{
  "symbol": "A/80/L.12",
  "filename": "A_80_L.12.pdf",
  "title": "The Syrian Golan",
  "text": "United Nations \nA/80/L.12\n \n \nGeneral Assembly \nDistr.: Limited \n10 November 2025 \nOriginal: English \n \n25-18145 (E)    141125    \n*2518145* \n \n \nEightieth session \nAgenda item 34 \nThe situation in the Middle East \n \n \n \nEgypt:* draft resolution \n \n \nThe Syrian Golan \n \n \n \nThe General Assembly, \n \nHaving considered the item entitled \u201cThe situation in the Middle East\u201d, \n \nTaking note of the report of the Secretary-General on the situation in the Middle \nEast,1 \n \nRecalling Security Council resolution 497 (1981) of 17 December 1981, \n \nReaffirming the fundamental principle of the inadmissibility of the acquisition \nof territory by force, in accordance with international law and the Charter of the \nUnited Nations, \n \nReaffirming once more the applicability of the Geneva Convention relative to \nthe Protection of Civilian Persons in Time of War, of 12 August 1949,2 to the occupied \nSyrian Golan, \n \nDeeply concerned that Israel has not withdrawn from the Syrian Golan, which \nhas been under occupation since 1967, contrary to the relevant Security Council and \nGeneral Assembly resolutions, \n \nStressing the illegality of the Israeli settlement construction and other activities \nin the occupied Syrian Golan since 1967, \n \nNoting with satisfaction the convening in Madrid on 30 October 1991 of the \nPeace Conference on the Middle East, on the basis of Security Council resolutions \n242 (1967) of 22 November 1967, 338 (1973) of 22 October 1973 and 425 (1978) of \n19 March 1978 and the formula of land for peace, \n \nExpressing grave concern over the halt in the peace process on the Syrian track, \nand expressing the hope that peace talks will soon resume from the point they had \nreached, \n__________________ \n \n* Any changes to the list of sponsors will be reflected in the official record of the meeting. \n \n1 A/80/327. \n \n2 United Nations, Treaty Series, vol. 75, No. 973. \n\nA/80/L.12 \n \n25-18145\n2/2 \n \n \n1. \nDeclares that Israel has failed so far to comply with Security Council \nresolution 497 (1981); \n \n2. \nAlso declares that the Israeli decision of 14 December 1981 to impose its \nlaws, jurisdiction and administration on the occupied Syrian Golan is null and void \nand has no validity whatsoever, as confirmed by the Security Council in its resolution \n497 (1981), and calls upon Israel to rescind it; \n \n3. \nReaffirms its determination that all relevant provisions of the Regulations \nannexed to the Hague Convention of 1907, and the Geneva Convention relative to the \nProtection of Civilian Persons in Time of War, of 12 August 1949, continue to apply \nto the Syrian territory occupied by Israel since 1967, and calls upon the Parties thereto \nto respect and ensure respect for their obligations under those instruments in all \ncircumstances; \n \n4. \nDetermines once more that the continued occupation of the Syrian Golan \nand its de facto annexation constitute a stumbling block in the way of achieving a \njust, comprehensive and lasting peace in the region; \n \n5. \nCalls upon Israel to resume the talks on the Syrian and Lebanese tracks \nand to respect the commitments and undertakings reached during the previous talks; \n \n6. \nDemands once more that Israel withdraw from all the occupied Syrian \nGolan to the line of 4 June 1967 in implementation of the relevant Security Council \nresolutions; \n \n7. \nCalls upon all the parties concerned, the co-sponsors of the peace process \nand the entire international community to exert all the necessary efforts to ensure the \nresumption of the peace process and its success by implementing Security Council \nresolutions 242 (1967) and 338 (1973); \n \n8. \nRequests the Secretary-General to report to the General Assembly at its \neighty-first session on the implementation of the present resolution. \n \n",
  "paragraphs": {
    "1": "Declares that Israel has failed so far to comply with Security Council resolution 497 (1981);",
    "2": "Also declares that the Israeli decision of 14 December 1981 to impose its laws, jurisdiction and administration on the occupied Syrian Golan is null and void and has no validity whatsoever, as confirmed by the Security Council in its resolution 497 (1981), and calls upon Israel to rescind it;",
    "3": "Reaffirms its determination that all relevant provisions of the Regulations annexed to the Hague Convention of 1907, and the Geneva Convention relative to the Protection of Civilian Persons in Time of War, of 12 August 1949, continue to apply to the Syrian territory occupied by Israel since 1967, and calls upon the Parties thereto to respect and ensure respect for their obligations under those instruments in all circumstances;",
    "4": "Determines once more that the continued occupation of the Syrian Golan and its de facto annexation constitute a stumbling block in the way of achieving a just, comprehensive and lasting peace in the region;",
    "5": "Calls upon Israel to resume the talks on the Syrian and Lebanese tracks and to respect the commitments and undertakings reached during the previous talks;",
    "6": "Demands once more that Israel withdraw from all the occupied Syrian Golan to the line of 4 June 1967 in implementation of the relevant Security Council resolutions;",
    "7": "Calls upon all the parties concerned, the co-sponsors of the peace process and the entire international community to exert all the necessary efforts to ensure the resumption of the peace process and its success by implementing Security Council resolutions 242 (1967) and 338 (1973);",
    "8": "Requests the Secretary-General to report to the General Assembly at its eighty-first session on the implementation of the present resolution."
  },
  "agenda_items": [
    "Item 34"
  ],
  "symbol_references": [
    "A/80/L.12"
  ]
}