{
  "symbol": "A/80/L.15",
  "filename": "A_80_L.15.pdf",
  "title": "2025 review of the United Nations peacebuilding architecture",
  "text": "United Nations \nA/80/L.15\n \n \nGeneral Assembly \nDistr.: Limited \n20 November 2025 \nOriginal: English \n \n25-18981 (E)    251125 \n*2518981* \n \n \nEightieth session \nAgenda item 62 \nPeacebuilding and sustaining peace \n \n \n \n \n \nDraft resolution submitted by the President of the General Assembly \n \n \n \n 2025 review of the United Nations peacebuilding architecture \n \n \n \nThe General Assembly, \n \nGuided by the purposes and principles of the Charter of the United Nations, and \nrenewing its commitment to international cooperation, \n \nRecalling the relevant provisions adopted at the Summit of the Future on 22 and \n23 September 2024, and reaffirming all General Assembly and Security Council \nresolutions and statements by the President of the Security Council on peacebuilding \nand sustaining peace,1 \n \nReaffirming that development, peace and security and human rights are \ninterlinked and mutually reinforcing, \n \nReaffirming its deep concern at the high human cost and suffering caused by \narmed conflicts, and expressing grave alarm about the significant number of \nsimultaneous security and humanitarian crises that the world currently faces, and the \nstrain that this places on the resources of the United Nations system, \n \nRecognizing that investing in conflict prevention is a highly cost-effective \nsolution and results in saving lives, stabilizing economies and reducing the need for \ncostly military responses, \n \nRecognizing also the vital role of the United Nations in preventing conflicts, in \nassisting parties to conflicts to end hostilities and emerge towards recovery, \nreconstruction and development and in mobilizing sustained international attention \nand assistance, \n \nRecognizing further that conflict prevention should be nationally led and owned, \nand reaffirming that Member States bear the primary responsibility for preventing \nconflict and building peace and for addressing the root causes of violence and conflict \nin their countries, and that national efforts to build and sustain peace contribute to the \nmaintenance of international peace and security, \n__________________ \n \n1  Including General Assembly resolution 60/180 and Security Council resolution 1645 (2005), \nAssembly resolution 65/7 and Council resolution 1947 (2010), Assembly resolution 70/262 and \nCouncil resolution 2282 (2016) and Assembly resolution 75/201 and Council resolution 2558 \n(2020). \n\nA/80/L.15 \n \n25-18981\n2/7 \n \n \nRecalling that peacebuilding is an inherently political process aimed at \npreventing the outbreak, escalation, recurrence or continuation of conflict, and further \nrecognizing that peacebuilding encompasses a wide range of political, development, \nand human rights programmes and mechanisms, \n \nRecognizing the importance of ensuring impact of United Nations system-wide \nactivities, including planning and joint analysis, in support of peacebuilding and \nsustaining peace efforts, and bearing in mind in this regard the role of the three core \ncomponents of the United Nations peacebuilding architecture in leveraging the entire \nUnited Nations system and the importance of greater synergies between them, while \nreiterating in this regard the important role that effective and responsive leadership in \nthe United Nations in the field can play in peacebuilding and sustaining peace, \n \nRecognizing also the contribution of peace operations in efforts to advance \npeacebuilding and sustaining peace, and mindful of the ongoing review of the \nSecretary-General on the future of all forms of United Nations peace operations, \n \nReaffirming the primary responsibility of national Governments and authorities \nin identifying, driving and directing priorities, strategies and activities for \npeacebuilding and sustaining peace, and emphasizing the importance of ensuring that \nthe needs of all segments of society are taken into account, while reiterating the \nimportance of partnerships with relevant stakeholders, including regional and \nsubregional organizations, international financial institutions, civil society \norganizations, local peacebuilding stakeholders and, where relevant, the private \nsector, in supporting national peacebuilding priorities, \n \nReaffirming also, in the context of the twenty-fifth anniversary of the adoption \nof Security Council resolution 1325 (2000) on 31 October 2000, the important role of \nwomen in peacebuilding and sustaining peace, and recognizing that the full, equal, \nmeaningful and safe participation of women at all decision-making levels in efforts \nto prevent, resolve and rebuild from conflict is important to achieve durable solutions \nand long-term stability, \n \nReaffirming further, in the context of the tenth anniversary of the adoption of \nSecurity Council resolution 2250 (2015) on 9 December 2015, that the full, effective, \nsafe and meaningful participation of youth is critical to maintain and promote \ninternational peace and security through peacebuilding and sustaining peace efforts, \n \nExpressing the need for increased visibility and awareness of United Nations \npeacebuilding and sustaining peace activities, particularly where it contributes to \ndemonstrating impact and mobilizing support, \n \nTaking note of the report of the Secretary-General on peacebuilding and sustaining \npeace of 25 November 20242 and the inputs for the 2025 review of the peacebuilding \narchitecture of the Peacebuilding Commission through its letter dated 13 November \n20243 and the former Chairs of the Peacebuilding Commission through their letter dated \n12 May 2025, and inputs from thematic and regional consultations, and encouraging \nrelevant United Nations bodies and organs, including the Peacebuilding Commission, \nto consider the inputs further, and further acknowledging the inputs from the group of \nindependent eminent persons through its letter dated 21 November 2024,4 \n \nAffirming that the 2025 review of the peacebuilding architecture is aimed at \nfurther enhancing the implementation and impact of peacebuilding activities at the \nfield level, \n \n__________________ \n \n2  A/79/552-S/2024/767. \n \n3  A/79/609-S/2024/827. \n \n4  A/79/634-S/2024/869, annex. \n\nA/80/L.15\n \n3/7\n25-18981 \n \n \n \nPeacebuilding Commission \n \n \n1. \nReaffirms all relevant resolutions relating to the mandate of the \nPeacebuilding Commission, and, mindful of the important role of the Commission, \nalso reaffirms the need to strengthen its fulfilment by: \n \n(a) \nRequesting the Peacebuilding Commission to establish a detailed, \npredictable and flexible annual programme of work reflecting, inter alia, its country-\nspecific, regional and thematic issues, while also taking into consideration the \nprogrammes of work of the General Assembly, the Security Council and the Economic \nand Social Council, as appropriate; \n \n(b) \nRequesting the Peacebuilding Commission, in line with its mandate, to \nserve as a platform to support Member States, upon their request, to strengthen their \nnational peacebuilding and sustaining peace efforts by: \n \n(i) \nAssisting Member States in building their national capacities to promote, \ndevelop, where they do not exist, and implement their voluntary and nationally \nowned prevention and peacebuilding strategies, efforts and other related \nframeworks in accordance with their national priorities and needs, including by \nsharing good practices and lessons learned; \n \n(ii) Inviting international financial institutions and regional development \nbanks to engage in relevant country-specific discussions, upon request by the \ncountry concerned, including on nationally led and owned prevention and \npeacebuilding strategies, priorities and other related frameworks and, where \nappropriate and in line with their governance arrangements, to consider \nproviding additional resources in support of their implementation; \n \n(c) \nTaking note of the decision of the Security Council to consider, where \nappropriate and on a case-by-case basis, referring countries transitioning off its \nagenda, at their request and with their consent, to the Peacebuilding Commission, \nwith due respect for national ownership and mindful of the benefits of sustained \nengagement with the Commission; \n \n(d) \nRequesting the Peacebuilding Commission to strengthen its impact \nthrough regular follow-up, monitoring and assessment of the implementation of its \noutcomes, and diversified modalities of engagement with relevant stakeholders; \n \n(e) \nRequesting the Peacebuilding Commission to continue serving as a \nplatform to convene all relevant actors, and gather analysis and expertise, including \nby leveraging information related to peacebuilding impact, with a view to advocating \nfor developing and sharing good practices in peacebuilding and promoting system-\nwide coordination; \n \n(f) \nRequesting the Peacebuilding Commission to continue monitoring the \nimplementation of its existing strategies and action plans, including through their \nregular assessments, to advance the women and peace and security and youth, peace \nand security agendas, with a view to supporting the full, equal, meaningful and safe \nparticipation of women, and promoting the full, effective, safe and meaningful \nparticipation of youth in peacebuilding and sustaining peace; \n \n(g) \nRequesting the Peacebuilding Commission to continue reviewing its \nworking methods and practices, with a view to enhancing the efficiency in delivering \non its mandates, and its impact in support of peacebuilding and sustaining peace, and \nalso requesting the Commission to report back in the context of its annual report; \n \n(h) \nReaffirming the practice that, in the use of conference rooms, priority must \nbe given to meetings of Member States, and in this regard requests the Secretariat to \nexplore options, within existing resources, to regularly provide venues and \n\nA/80/L.15 \n \n25-18981\n4/7 \n \nconference services to the Peacebuilding Commission, including by providing it with \npriority access to rooms with full United Nations membership capacity for its \nambassadorial-level meetings, without prejudice to the scheduling requirements of \nthe Charter bodies; \n \n(i) \nRequesting the Department of Global Communications of the Secretariat, \nin partnership with the Peacebuilding Support Office, and within existing resources, \nto support the Peacebuilding Commission in providing regular coverage and \nincreasing the visibility of its activities in order to attract more attention from the \nmedia and the public; \n \n2. \nRecognizes the importance of further enhancing the advisory role of the \nPeacebuilding Commission, and in this regard: \n \n(a) \nDecides, where appropriate and through its relevant agenda items, and \nwith a view to further strengthening its engagement with the Peacebuilding \nCommission, to consider seeking strategic and context-specific advice from the \nPeacebuilding Commission, including, where relevant, through the convening of joint \ndebates and the provision by the Commission of advice and remarks to the General \nAssembly, and through more regular, demand-driven interactions between the \nCommission and the Special Committee on Peacekeeping Operations; \n \n(b) \nMay consider, when seeking the advice of the Peacebuilding Commission, \ndiverse formats of engagement, as appropriate, including briefings, written \nsubmissions, informal interactive dialogues and other informal consultations; \n \n(c) \nRequests the Peacebuilding Commission to utilize its convening role to \ngather contributions from a broad range of stakeholders that may be used in the \npreparation of its advice, so as to provide recommendations and information to \nimprove their coordination, to develop and share good practices in peacebuilding, and \nin this regard further requests the United Nations leadership in countries considered \nby the Commission to regularly brief the Commission, as appropriate, on the \npeacebuilding components of relevant mandates and activities; \n \n(d) \nTakes note of the intention of the Security Council to encourage stronger \ncooperation with the Peacebuilding Commission, including through more specific \nrequests, early consultations and the provision of timely advice, including with the \nlonger-term perspective required for peacebuilding and sustaining peace being \nreflected in the formation, review and drawdown of peace operations mandates, as \nwell as planning and early coordination preceding transition processes; \n \n3. \nEncourages \nimproved \ncooperation \nbetween \nthe \nPeacebuilding \nCommission and the Economic and Social Council, in accordance with their \nrespective mandates, taking into account the oversight role of the Council for \noperational activities for development and humanitarian assistance and its overall \ncoordination of the United Nations development system, including through the \nagencies, funds and programmes, in support of coordination and coherence in \npeacebuilding and sustaining peace efforts with a view to maximizing impact on the \nground; \n \n4. \nCalls for the Peacebuilding Commission to serve as a platform to enhance \nUnited Nations system-wide coherence in support of peacebuilding and sustaining \npeace, including by encouraging input to its deliberations from across the United \nNations system; \n \n5. \nEncourages United Nations country teams, under the leadership and \ncoordination of resident coordinators, to improve inter-agency coordination and \nsynergy, consistent with their respective mandates, and to contribute to the efforts of \nthe Peacebuilding Commission in peacebuilding and sustaining peace, addressing \n\nA/80/L.15\n \n5/7\n25-18981 \n \nrisks for development programming and fostering resilience, at the request of host \ncountries and in accordance with their national ownership, plans and priorities, and \nfurther requests that resident coordinators be provided with necessary capacities and \ntraining to support these priorities, within existing resources; \n \n6. \nRequests the Secretary-General to further encourage systematic and \nstrategic collaboration with international financial institutions at the country level, \nleveraging comparative advantages, including by requesting resident coordinators to \nmake systematic use of partnership tools, as appropriate, to support joint analysis, \nassessment, coordination and programming efforts, upon request of the national \nGovernments and authorities of the countries concerned, and also requests the \nSecretary-General to continue updating the Peacebuilding Commission on this \ncollaboration through existing modalities; \n \n7. \nEncourages the Peacebuilding Commission, in full respect of national \nownership, to continue mobilizing resources and technical expertise for national \npeacebuilding priorities, such as in relation to development, human rights, justice, \ndisarmament, demobilization and reintegration and security sector reform, to support \nnational efforts to build and strengthen the capacities of inclusive, resilient and \naccountable national institutions and enhance good governance; \n \n8. \nAlso encourages the Peacebuilding Commission to further strengthen its \nstrategic and operational partnerships with international financial institutions to \nadvance peacebuilding and sustaining peace efforts, including by establishing, within \nexisting resources, an annual strategic dialogue with international financial \ninstitutions, and holding informal exchanges between the Commission and the \nexecutive boards of those institutions; \n \n9. \nWelcomes the existing collaboration of the Peacebuilding Commission \nwith regional and subregional organizations, and encourages the Commission to \nexplore opportunities, within existing resources, for a more systematic engagement \nwith other relevant regional and subregional organizations where such engagement \nsupports nationally identified peacebuilding priorities; \n \n10. Encourages the Peacebuilding Commission to further strengthen its \nrelationship with the African Union with a view to supporting the pillars of the \nAfrican Union Post-Conflict, Reconstruction and Development policy for its \nimplementation, and in this regard requests the Peacebuilding Support Office to \nfurther strengthen its cooperation with the African Union Centre for Post-Conflict \nReconstruction \nand \nDevelopment for implementing the \nmemorandum of \nunderstanding on United Nations-African Union partnership in peacebuilding of \n2017, and also encourages the Commission to further enhance its strategic partnership \nwith the African Union Peace and Security Council and to create a mechanism, within \nexisting resources, to follow up on the implementation of relevant recommendations \nthat emanate from their annual joint consultative meetings; \n \n11. \nAlso encourages the Peacebuilding Commission to further consult with \nrelevant civil society organizations, especially local peacebuilders, grass-roots \norganizations, and women-led and youth-led organizations from countries considered \nby the Commission; \n \n12. Decides to establish, within existing resources, an annual \u201cpeacebuilding \nweek\u201d in June, timed around the commemoration of the inaugural meeting of the \nCommission, aimed at raising awareness of the peacebuilding and sustaining peace \nefforts of the United Nations among a wide and inclusive group of stakeholders, \nfostering inclusive dialogue on peacebuilding approaches and promoting the sharing \nof good practices in peacebuilding and sustaining peace; \n \n\nA/80/L.15 \n \n25-18981\n6/7 \n \n \n \nPeacebuilding financing \n \n \n13. Calls for the full implementation of relevant resolutions on financing for \npeacebuilding; \n \n14. Encourages the Peacebuilding Commission to maintain a regular and \nstrategic dialogue with the Peacebuilding Fund, and continue its engagement with the \nAdvisory Group of the Fund to support improved strategic alignment and \ninformation-sharing; \n \n15. Encourages countries receiving support from the Peacebuilding Fund to \nshare with the Peacebuilding Commission their national peacebuilding priorities, \nchallenges and lessons learned as well as key outcomes and results of activities \nfinanced through the Fund, and requests the Secretary-General to reflect this \ninformation in the existing reporting on the Fund, where relevant; \n \n16. Encourages the Secretary-General to consider how the Peacebuilding \nFund can further enhance its support to conflict-affected countries preparing for or \nundergoing transitions from peace operations, in accordance with their national \npriorities; \n \n17. Also encourages the Secretary-General to utilize the Peacebuilding Fund \nto support countries, upon their request, to work in coordination with relevant \nstakeholders, on the basis of the principles of national leadership and ownership, to \nadvance greater coherence in peacebuilding, including in support of voluntary \nnational prevention and peacebuilding strategies and approaches to sustain peace; \n \n18. Encourages the Peacebuilding Commission, in coordination with the \nPeacebuilding Fund and the Peacebuilding Support Office, to engage with the private \nsector to promote investments with a view to supporting the national peacebuilding \npriorities and activities in conflict-affected countries considered by the Commission; \n \n19. Requests the Secretary-General to update, within existing modalities, the \nPeacebuilding Commission and inform its discussions on progress made and \nforthcoming opportunities with respect to innovative finance for peacebuilding, \nincluding recommendations for further action; \n \n20. Requests the Peacebuilding Support Office to provide annual updates, \nwithin existing modalities, on progress in advancing United Nations partnership with \ninternational financial institutions, including regional development banks and other \nrelevant financing partners, including examples of innovation and good practice and \nthe catalytic effect of the Peacebuilding Fund; \n \n21. Encourages the Peacebuilding Commission, recalling its mandate to bring \ntogether all relevant actors to marshal resources, to track the amount of resources it \nmobilizes in support of countries under its consideration and have the Chair provide \nan update thereon, within existing resources; \n \n22. Encourages continued investment by Member States in initiatives that \npromote the full, equal, meaningful and safe participation and leadership of women \nin peacebuilding, including through support for the social, economic and political \nempowerment of women; \n \n23. Urges efforts to address existing financing gaps for youth-led initiatives \nand youth organizations to ensure the full, effective and meaningful participation of \nyouth in the design, monitoring and implementation of peacebuilding efforts at all \nlevels, and encourages all financing stakeholders to increase coordination and \ncollaboration with youth on financing national priorities; \n \n\nA/80/L.15\n \n7/7\n25-18981 \n \n \n \nDepartment of Political and Peacebuilding Affairs/Peacebuilding Support Office \n \n \n24. Encourages the Peacebuilding Support Office to further enhance internal \ncooperation and coordination and continue using its existing coordination \nmechanisms to gather timely and relevant contributions from relevant actors within \nand outside the United Nations, to support the thematic and geographic activities of \nthe Peacebuilding Commission in a timely, focused and relevant manner; \n \n25. Encourages the Secretary-General to more systematically include data and \nanalysis in his reporting on peacebuilding and sustaining peace, and in this regard \nfurther encourages the Secretary-General to leverage the expertise of the \nPeacebuilding Support Office on measuring impact for an evidence-based and more \ncohesive approach to peacebuilding impact, drawing on capabilities from across the \nsystem to track and report on peacebuilding impact at the country and regional levels \nmore effectively, with the support of all relevant national stakeholders, and to update, \nas appropriate, the Peacebuilding Commission, within existing resources; \n \n26. Recognizes the important role of the Peacebuilding Support Office with its \nintergovernmental, strategy and partnerships, and financing expertise, and efforts to \nleverage the entire United Nations system and key partners, in support of the \nPeacebuilding Commission and of Member States\u2019 national peacebuilding needs and \nobjectives, bearing in mind the context of ongoing reforms of the United Nations, and \nencourages Member States to strengthen the capacities of the Peacebuilding Support \nOffice, within existing resources, or through voluntary funding; \n \n27. Requests the Secretary-General to assess how ongoing reforms of the \nUnited Nations in the context of the UN80 Initiative, in line with relevant General \nAssembly resolutions, can further enhance cooperation among relevant United \nNations system entities to deliver more coordinated, coherent, integrated and \nimpactful peacebuilding efforts at the country level, including by improving \nleadership, accountability and capacity for peacebuilding and sustaining peace; \n \n28. Requests the Peacebuilding Commission to include in its annual report \ninformation on progress in implementing relevant provisions of the present resolution \nahead of the next review; \n \n29. Reiterates its request to the Secretary-General to continue to present a \nreport every two years following this review, on the ongoing implementation of the \nresolutions on peacebuilding and sustaining peace, with due attention to the impact \nof relevant reforms on the performance of the United Nations system in advancing \nthe implementation of the resolutions on peacebuilding and sustaining peace; \n \n30. Calls for a further comprehensive review of United Nations peacebuilding \nin 2030. \n \n",
  "paragraphs": {
    "1": " conference services to the Peacebuilding Commission, including by providing it with priority access to rooms with full United Nations membership capacity for its ambassadorial-level meetings, without prejudice to the scheduling requirements of the Charter bodies; (i) Requesting the Department of Global Communications of the Secretariat, in partnership with the Peacebuilding Support Office, and within existing resources, to support the Peacebuilding Commission in providing regular coverage and increasing the visibility of its activities in order to attract more attention from the media and the public;",
    "2": "Recognizes the importance of further enhancing the advisory role of the Peacebuilding Commission, and in this regard: (a) Decides, where appropriate and through its relevant agenda items, and with a view to further strengthening its engagement with the Peacebuilding Commission, to consider seeking strategic and context-specific advice from the Peacebuilding Commission, including, where relevant, through the convening of joint debates and the provision by the Commission of advice and remarks to the General Assembly, and through more regular, demand-driven interactions between the Commission and the Special Committee on Peacekeeping Operations; (b) May consider, when seeking the advice of the Peacebuilding Commission, diverse formats of engagement, as appropriate, including briefings, written submissions, informal interactive dialogues and other informal consultations; (c) Requests the Peacebuilding Commission to utilize its convening role to gather contributions from a broad range of stakeholders that may be used in the preparation of its advice, so as to provide recommendations and information to improve their coordination, to develop and share good practices in peacebuilding, and in this regard further requests the United Nations leadership in countries considered by the Commission to regularly brief the Commission, as appropriate, on the peacebuilding components of relevant mandates and activities; (d) Takes note of the intention of the Security Council to encourage stronger cooperation with the Peacebuilding Commission, including through more specific requests, early consultations and the provision of timely advice, including with the longer-term perspective required for peacebuilding and sustaining peace being reflected in the formation, review and drawdown of peace operations mandates, as well as planning and early coordination preceding transition processes;",
    "3": "Encourages improved cooperation between the Peacebuilding Commission and the Economic and Social Council, in accordance with their respective mandates, taking into account the oversight role of the Council for operational activities for development and humanitarian assistance and its overall coordination of the United Nations development system, including through the agencies, funds and programmes, in support of coordination and coherence in peacebuilding and sustaining peace efforts with a view to maximizing impact on the ground;",
    "4": "Calls for the Peacebuilding Commission to serve as a platform to enhance United Nations system-wide coherence in support of peacebuilding and sustaining peace, including by encouraging input to its deliberations from across the United Nations system;",
    "5": " risks for development programming and fostering resilience, at the request of host countries and in accordance with their national ownership, plans and priorities, and further requests that resident coordinators be provided with necessary capacities and training to support these priorities, within existing resources;",
    "6": "Requests the Secretary-General to further encourage systematic and strategic collaboration with international financial institutions at the country level, leveraging comparative advantages, including by requesting resident coordinators to make systematic use of partnership tools, as appropriate, to support joint analysis, assessment, coordination and programming efforts, upon request of the national Governments and authorities of the countries concerned, and also requests the Secretary-General to continue updating the Peacebuilding Commission on this collaboration through existing modalities;",
    "7": "Encourages the Peacebuilding Commission, in full respect of national ownership, to continue mobilizing resources and technical expertise for national peacebuilding priorities, such as in relation to development, human rights, justice, disarmament, demobilization and reintegration and security sector reform, to support national efforts to build and strengthen the capacities of inclusive, resilient and accountable national institutions and enhance good governance;",
    "8": "Also encourages the Peacebuilding Commission to further strengthen its strategic and operational partnerships with international financial institutions to advance peacebuilding and sustaining peace efforts, including by establishing, within existing resources, an annual strategic dialogue with international financial institutions, and holding informal exchanges between the Commission and the executive boards of those institutions;",
    "9": "Welcomes the existing collaboration of the Peacebuilding Commission with regional and subregional organizations, and encourages the Commission to explore opportunities, within existing resources, for a more systematic engagement with other relevant regional and subregional organizations where such engagement supports nationally identified peacebuilding priorities;",
    "10": "Encourages the Peacebuilding Commission to further strengthen its relationship with the African Union with a view to supporting the pillars of the African Union Post-Conflict, Reconstruction and Development policy for its implementation, and in this regard requests the Peacebuilding Support Office to further strengthen its cooperation with the African Union Centre for Post-Conflict Reconstruction and Development for implementing the memorandum of understanding on United Nations-African Union partnership in peacebuilding of 2017, and also encourages the Commission to further enhance its strategic partnership with the African Union Peace and Security Council and to create a mechanism, within existing resources, to follow up on the implementation of relevant recommendations that emanate from their annual joint consultative meetings;",
    "11": "Also encourages the Peacebuilding Commission to further consult with relevant civil society organizations, especially local peacebuilders, grass-roots organizations, and women-led and youth-led organizations from countries considered by the Commission;",
    "12": " Peacebuilding financing",
    "13": "Calls for the full implementation of relevant resolutions on financing for peacebuilding;",
    "14": "Encourages the Peacebuilding Commission to maintain a regular and strategic dialogue with the Peacebuilding Fund, and continue its engagement with the Advisory Group of the Fund to support improved strategic alignment and information-sharing;",
    "15": "Encourages countries receiving support from the Peacebuilding Fund to share with the Peacebuilding Commission their national peacebuilding priorities, challenges and lessons learned as well as key outcomes and results of activities financed through the Fund, and requests the Secretary-General to reflect this information in the existing reporting on the Fund, where relevant;",
    "16": "Encourages the Secretary-General to consider how the Peacebuilding Fund can further enhance its support to conflict-affected countries preparing for or undergoing transitions from peace operations, in accordance with their national priorities;",
    "17": "Also encourages the Secretary-General to utilize the Peacebuilding Fund to support countries, upon their request, to work in coordination with relevant stakeholders, on the basis of the principles of national leadership and ownership, to advance greater coherence in peacebuilding, including in support of voluntary national prevention and peacebuilding strategies and approaches to sustain peace;",
    "18": "Encourages the Peacebuilding Commission, in coordination with the Peacebuilding Fund and the Peacebuilding Support Office, to engage with the private sector to promote investments with a view to supporting the national peacebuilding priorities and activities in conflict-affected countries considered by the Commission;",
    "19": "Requests the Secretary-General to update, within existing modalities, the Peacebuilding Commission and inform its discussions on progress made and forthcoming opportunities with respect to innovative finance for peacebuilding, including recommendations for further action;",
    "20": "Requests the Peacebuilding Support Office to provide annual updates, within existing modalities, on progress in advancing United Nations partnership with international financial institutions, including regional development banks and other relevant financing partners, including examples of innovation and good practice and the catalytic effect of the Peacebuilding Fund;",
    "21": "Encourages the Peacebuilding Commission, recalling its mandate to bring together all relevant actors to marshal resources, to track the amount of resources it mobilizes in support of countries under its consideration and have the Chair provide an update thereon, within existing resources;",
    "22": "Encourages continued investment by Member States in initiatives that promote the full, equal, meaningful and safe participation and leadership of women in peacebuilding, including through support for the social, economic and political empowerment of women;",
    "23": " Department of Political and Peacebuilding Affairs/Peacebuilding Support Office",
    "24": "Encourages the Peacebuilding Support Office to further enhance internal cooperation and coordination and continue using its existing coordination mechanisms to gather timely and relevant contributions from relevant actors within and outside the United Nations, to support the thematic and geographic activities of the Peacebuilding Commission in a timely, focused and relevant manner;",
    "25": "Encourages the Secretary-General to more systematically include data and analysis in his reporting on peacebuilding and sustaining peace, and in this regard further encourages the Secretary-General to leverage the expertise of the Peacebuilding Support Office on measuring impact for an evidence-based and more cohesive approach to peacebuilding impact, drawing on capabilities from across the system to track and report on peacebuilding impact at the country and regional levels more effectively, with the support of all relevant national stakeholders, and to update, as appropriate, the Peacebuilding Commission, within existing resources;",
    "26": "Recognizes the important role of the Peacebuilding Support Office with its intergovernmental, strategy and partnerships, and financing expertise, and efforts to leverage the entire United Nations system and key partners, in support of the Peacebuilding Commission and of Member States\u2019 national peacebuilding needs and objectives, bearing in mind the context of ongoing reforms of the United Nations, and encourages Member States to strengthen the capacities of the Peacebuilding Support Office, within existing resources, or through voluntary funding;",
    "27": "Requests the Secretary-General to assess how ongoing reforms of the United Nations in the context of the UN80 Initiative, in line with relevant General Assembly resolutions, can further enhance cooperation among relevant United Nations system entities to deliver more coordinated, coherent, integrated and impactful peacebuilding efforts at the country level, including by improving leadership, accountability and capacity for peacebuilding and sustaining peace;",
    "28": "Requests the Peacebuilding Commission to include in its annual report information on progress in implementing relevant provisions of the present resolution ahead of the next review;",
    "29": "Reiterates its request to the Secretary-General to continue to present a report every two years following this review, on the ongoing implementation of the resolutions on peacebuilding and sustaining peace, with due attention to the impact of relevant reforms on the performance of the United Nations system in advancing the implementation of the resolutions on peacebuilding and sustaining peace;",
    "30": "Calls for a further comprehensive review of United Nations peacebuilding in 2030."
  },
  "agenda_items": [
    "Item 62"
  ],
  "symbol_references": [
    "A/80/L.15"
  ]
}