{
  "symbol": "A/80/L.7",
  "filename": "A_80_L.7.pdf",
  "title": "Report of the International Atomic Energy Agency",
  "text": "United Nations \nA/80/L.7 \n \n \nGeneral Assembly \nDistr.: Limited \n22 October 2025 \nOriginal: English \n \n25-17051 (E)    281025 \n*2517051* \n \n \nEightieth session \nAgenda item 89 \nReport of the International Atomic Energy Agency \n \n \n \n \n \nAustralia:* draft resolution \n \n \n \n Report of the International Atomic Energy Agency \n \n \n \nThe General Assembly, \n \nHaving received the report of the International Atomic Energy Agency for \n2024,1 \n \nTaking note of the statement by the Director General of the Agency, in which he \nprovided additional information on the main developments in the activities of the \nAgency during 2025, \n \nRecognizing the importance of the work of the Agency, \n \nRecognizing also the cooperation between the United Nations and the Agency and \nthe Agreement governing the relationship between the United Nations and the Agency \nas approved by the General Conference of the Agency on 23 October 1957 and by the \nGeneral Assembly in the annex to its resolution 1145 (XII) of 14 November 1957, \n \n1. \nTakes note with appreciation of the report of the International Atomic \nEnergy Agency; \n \n2. \nTakes note of resolutions GC(69)/RES/7, entitled \u201cNuclear and radiation \nsafety\u201d; GC(69)/RES/8, entitled \u201cNuclear security\u201d; GC(69)/RES/9, entitled \n\u201cStrengthening the Agency\u2019s activities related to nuclear science, technology and \napplications\u201d, comprising GC(69)/RES/9 A.2, entitled \u201cSupport to the African Union\u2019s \nPan African Tsetse and Trypanosomosis Eradication Campaign (AU-PATTEC)\u201d, \nGC(69)/RES/9 A.3, entitled \u201cZoonotic Disease Integrated Action (ZODIAC) Project\u201d, \nand GC(69)/RES/9 B, entitled \u201cNuclear power applications\u201d; GC(69)/RES/10, entitled \n\u201cExtending the Technical Cooperation Programme for the State of Palestine to the Gaza \nStrip\u201d; GC(69)/RES/13, entitled \u201cImplementation of the NPT safeguards agreement \nbetween the Agency and the Democratic People\u2019s Republic of Korea\u201d; GC(69)/RES/14, \nentitled \u201cNuclear safety, security and safeguards in Ukraine\u201d; GC(69)/RES/15, entitled \n\u201cApplication of IAEA safeguards in the Middle East\u201d; and GC(69)/RES/16, entitled \n\u201cPersonnel\u201d, comprising GC(69)/RES/16 A, entitled \u201cStaffing of the Agency\u2019s \nSecretariat\u201d and GC(69)/RES/16 B, entitled \u201cWomen in the Secretariat\u201d; and decisions \nGC(69)/DEC/10, entitled \u201cAmendment to Article XIV.A of the Statute\u201d; \n__________________ \n \n* Any changes to the list of sponsors will be reflected in the official record of the meeting. \n \n1  See A/80/348. \n\nA/80/L.7 \n \n25-17051\n2/2 \n \nGC(69)/DEC/11, entitled \u201cPromotion of efficiency and effectiveness of the IAEA \ndecision making process\u201d, and GC(69)/DEC/12, entitled \u201cAmendment to Article VI of \nthe Statute\u201d, adopted by the General Conference of the Agency at its sixty-ninth regular \nsession, held from 15 to 19 September 2025;2 and of the statements by the President of \nthe General Conference with regard to the General Conference agenda item 8 entitled \n\u201cElection of Members to the Board of Governors\u201d;3 item 15 entitled \u201cStrengthening of \nthe Agency\u2019s technical cooperation activities\u201d; item 16 entitled \u201cStrengthening the \nAgency\u2019s activities related to nuclear science, technology and applications\u201d; and \nitem 17 entitled \u201cStrengthening the effectiveness and improving the efficiency of \nAgency safeguards\u201d, all as reflected in the official records of the General Conference; \n \n3. \nReaffirms its strong support for the indispensable role of the Agency in \nencouraging and assisting the development and practical application of atomic energy \nfor peaceful uses, in technology transfer to developing countries and in nuclear safety, \nverification and security; \n \n4. \nAppeals to Member States to continue to support the activities of the \nAgency; \n \n5. \nRequests the Secretary-General to transmit to the Director General of the \nAgency the records of the eightieth session of the General Assembly relating to the \nactivities of the Agency. \n \n__________________ \n \n2  See International Atomic Energy Agency, Resolutions Adopted and Other Relevant Decisions \nTaken during the 69th Regular Session of the General Conference, 15\u201319 September 2025 \n(GC(69)/RES/DEC(2025)) for the full texts of relevant resolutions and decisions and \ninformation regarding their adoption. \n \n3  See International Atomic Energy Agency General Conference resolution GC(67)/RES/15, \nentitled \u201cRestoration of the Sovereign  Equality of Member States in the IAEA\u201d. \n",
  "paragraphs": {
    "1": "Takes note with appreciation of the report of the International Atomic Energy Agency;",
    "2": "Takes note of resolutions GC(69)/RES/7, entitled \u201cNuclear and radiation safety\u201d; GC(69)/RES/8, entitled \u201cNuclear security\u201d; GC(69)/RES/9, entitled \u201cStrengthening the Agency\u2019s activities related to nuclear science, technology and applications\u201d, comprising GC(69)/RES/9 A.2, entitled \u201cSupport to the African Union\u2019s Pan African Tsetse and Trypanosomosis Eradication Campaign (AU-PATTEC)\u201d, GC(69)/RES/9 A.3, entitled \u201cZoonotic Disease Integrated Action (ZODIAC) Project\u201d, and GC(69)/RES/9 B, entitled \u201cNuclear power applications\u201d; GC(69)/RES/10, entitled \u201cExtending the Technical Cooperation Programme for the State of Palestine to the Gaza Strip\u201d; GC(69)/RES/13, entitled \u201cImplementation of the NPT safeguards agreement between the Agency and the Democratic People\u2019s Republic of Korea\u201d; GC(69)/RES/14, entitled \u201cNuclear safety, security and safeguards in Ukraine\u201d; GC(69)/RES/15, entitled \u201cApplication of IAEA safeguards in the Middle East\u201d; and GC(69)/RES/16, entitled \u201cPersonnel\u201d, comprising GC(69)/RES/16 A, entitled \u201cStaffing of the Agency\u2019s Secretariat\u201d and GC(69)/RES/16 B, entitled \u201cWomen in the Secretariat\u201d; and decisions GC(69)/DEC/10, entitled \u201cAmendment to Article XIV.A of the Statute\u201d; GC(69)/DEC/11, entitled \u201cPromotion of efficiency and effectiveness of the IAEA decision making process\u201d, and GC(69)/DEC/12, entitled \u201cAmendment to Article VI of the Statute\u201d, adopted by the General Conference of the Agency at its sixty-ninth regular session, held from 15 to 19 September 2025;2 and of the statements by the President of the General Conference with regard to the General Conference agenda item 8 entitled \u201cElection of Members to the Board of Governors\u201d;3 item 15 entitled \u201cStrengthening of the Agency\u2019s technical cooperation activities\u201d; item 16 entitled \u201cStrengthening the Agency\u2019s activities related to nuclear science, technology and applications\u201d; and item 17 entitled \u201cStrengthening the effectiveness and improving the efficiency of Agency safeguards\u201d, all as reflected in the official records of the General Conference;",
    "3": "Reaffirms its strong support for the indispensable role of the Agency in encouraging and assisting the development and practical application of atomic energy for peaceful uses, in technology transfer to developing countries and in nuclear safety, verification and security;",
    "4": "Appeals to Member States to continue to support the activities of the Agency;",
    "5": "Requests the Secretary-General to transmit to the Director General of the Agency the records of the eightieth session of the General Assembly relating to the activities of the Agency."
  },
  "agenda_items": [
    "Item 89",
    "Item 8",
    "Item 15",
    "Item 16",
    "Item 17"
  ],
  "symbol_references": [
    "A/80/L.7"
  ]
}