{
  "symbol": "A/80/L.10",
  "filename": "A_80_L.10.pdf",
  "title": "Building a peaceful and better world through sport and the Olympic ideal",
  "text": "United Nations \nA/80/L.10\n \n \nGeneral Assembly \nDistr.: Limited \n5 November 2025 \nOriginal: English \n \n25-17857 (E)    121125     \n*2517857* \n \n \nEightieth session \nAgenda item 11 \nSport for development and peace: building a peaceful and \nbetter world through sport and the Olympic ideal \n \n \n \n \n \nItaly and Turkmenistan:* draft resolution  \n \n \n \n Building a peaceful and better world through sport and the \nOlympic ideal \n \n \n \nThe General Assembly,  \n \nRecalling its resolution 78/10 of 21 November 2023, in which it decided to \ninclude in the provisional agenda of its eightieth session the sub-item entitled \n\u201cBuilding a peaceful and better world through sport and the Olympic ideal\u201d, and \nrecalling also its prior decision to consider the sub-item every two years, in advance \nof the Summer and Winter Olympic Games,  \n \nRecalling also its resolution 48/11 of 25 October 1993, which, inter alia, revived \nthe ancient Greek tradition of ekecheiria (\u201cOlympic Truce\u201d) calling for a truce during \nthe Olympic Games to encourage a peaceful environment and ensure safe passage, \naccess and participation for athletes and relevant persons at the Games, thereby \nmobilizing the youth of the world to the cause of peace,  \n \nRecalling further that the core concept of ekecheiria, historically, has been the \ncessation of hostilities from seven days before until seven days after the Olympic \nGames, which, according to the legendary oracle of Delphi, was to replace the cycle \nof conflict with a friendly athletic competition every four years,  \n \nRecognizing the valuable contribution of sport in promoting education, \nsustainable development, peace, cooperation, solidarity, fairness, social inclusion and \nhealth at the local, regional and international levels, and noting that, as declared in \nthe 2005 World Summit Outcome, 1  sports can contribute to an atmosphere of \ntolerance and understanding among peoples and nations,  \n \nRecognizing also the role that sports can play to prevent and counter terrorism \nand violent extremism conducive to terrorism, and its contributions to building \nresilience against radicalization to violence, recruitment and terrorist acts,  \n__________________ \n \n* Any changes to the list of sponsors will be reflected in the official record of the meeting. \n \n1  Resolution 60/1. \n\nA/80/L.10 \n \n25-17857\n2/5 \n \n \nWelcoming the designation of 6 April as the International Day of Sport for \nDevelopment and Peace,  \n \nRecalling the inclusion in the United Nations Millennium Declaration 2 of an \nappeal for the observance of the Olympic Truce now and in the future and for support \nfor the International Olympic Committee in its efforts to promote peace and human \nunderstanding through sport and the Olympic ideal, \n \nRecalling also that, in the 2030 Agenda for Sustainable Development, 3 sport is \nrecognized as an important enabler of sustainable development, in particular for its \ngrowing contribution to the realization of development and peace in its promotion of \ntolerance and respect and the contributions it makes to the empowerment of women \nand of young people, individuals and communities as well as to health, education and \nsocial inclusion objectives,  \n \nAcknowledging the valuable contribution that the appeal launched by the \nInternational Olympic Committee on 21 July 1992 for an Olympic Truce could make \ntowards advancing the purposes and principles of the Charter of the United Nations, \n \nRecalling its resolution 79/8 of 12 November 2024 on sport as an enabler of \nsustainable development in its three dimensions \u2013 economic, social and environmental \u2013 in \nwhich it called upon future hosts of the Olympic Games and the Paralympic Games and \nother Member States to include sport, as appropriate, in conflict prevention activities \nand to ensure the effective implementation of the Olympic Truce during the Games,  \n \nNoting that the XXV Olympic Winter Games will be held from 6 to 22 February \n2026 and that the XIV Paralympic Winter Games will be held from 6 to 15 March \n2026, across the host regions of the Milano-Cortina Games, \n \nNoting also that the vision of the Milano-Cortina 2026 Olympic and Paralympic \nWinter Games acknowledges the role of sport in inspiring individuals and \ncommunities to uphold the Olympic values of excellence, friendship and respect, \nthereby contributing to broader global efforts to advance inclusion, sustainability and \na culture of peace through sport,  \n \nAcknowledging that the Milano-Cortina 2026 Olympic and Paralympic Winter \nGames will be a unifying event and a meaningful opportunity to harness the power of \nsport to foster ongoing efforts for peace worldwide and to promote development, \nresilience, tolerance and understanding, accessibility and inclusion, and welcoming \nall the delegations of National Olympic and Paralympic Committees athletes and the \nRefugee Olympic and Paralympic Teams admitted by the International Olympic \nCommittee and the International Paralympic Committee to participate in the Games,  \n \nRecognizing the importance of fostering strengthened international cooperation \nacross editions of the Olympic and Paralympic Games, in support of the Olympic \nTruce and with a view to promoting collective efforts to uphold the universal value \nof sport as a driver for peaceful and inclusive societies, mutual understanding, \nsolidarity and intercultural dialogue among nations,  \n \nRecalling the importance of the meaningful engagement of local communities \nin the organization and implementation of the Olympic and Paralympic Winter \nGames, as a defining feature of Milano-Cortina 2026, in order to promote a strong \nsense of local ownership, community dialogue and identity, social integration, \ncohesion and the safeguarding of cultural heritage,  \n \nNoting with appreciation the commitment of the Milano-Cortina 2026 Olympic \nand Paralympic Winter Games to advancing all three dimensions of sustainable \ndevelopment and leaving a long-term legacy, including through measures aimed at \n__________________ \n \n2  Resolution 55/2. \n \n3  Resolution 70/1. \n\nA/80/L.10\n \n3/5\n25-17857 \n \nreducing environmental impact, promoting resilient and sustainable infrastructure and \nensuring lasting benefits for local populations and future generations,  \n \nNoting with appreciation also the continued efforts of the International Olympic \nCommittee to advance gender equality in sport, and welcoming the fact that the \nMilano-Cortina 2026 Olympic and Paralympic Winter Games will be the most gender-\nbalanced in the history of the Winter Games, following the commitment to allocate \nan almost equal number of quota places to male and female athletes, thereby \nreinforcing the role of the Games in promoting equal opportunities, \n \nRecalling article 31 of the Convention on the Rights of the Child, 4 which \noutlines the right of the child to engage in play and recreational activities, and the \noutcome document of the twenty-seventh special session of the General Assembly on \nchildren, entitled \u201cA world fit for children\u201d, 5  which stresses the promotion of \nphysical, mental and emotional health through play and sports,  \n \nRecognizing the imperative need to engage women and girls in the practice of \nsport for development and peace, and welcoming activities that aim to foster and \nencourage initiatives in this regard at the global level,  \n \nNoting the successful conclusion of the Games of the XXXIII Olympiad and the \nXVII Paralympic Games, held in Paris from 26 July to 11 August 2024 and from \n28 August to 8 September 2024, respectively, and welcoming the Games of the \nXXXIV Olympiad and the XVIII Paralympic Games, to be held in Los Angeles, United \nStates of America, from 14 to 30 July and from 15 to 27 August 2028, respectively, \nthe XXVI Olympic Winter Games and the XV Paralympic Winter Games, to be held \nacross the French Alps from 1 to 17 February and from 1 to 10 March 2030, \nrespectively, the Games of the XXXV Olympiad and the XIX Paralympic Games, to \nbe held in Brisbane, Australia, from 23 July to 8 August and from 24 August to \n5 September 2032, respectively, and the XXVII Olympic Winter Games and the \nXVI Paralympic Winter Games, to be held in Salt Lake City, United States of America, \nfrom 10 to 26 February and from 10 to 19 March 2034, respectively, \n \nAcknowledging the joint endeavours of the International Olympic Committee, \nthe International Paralympic Committee and relevant United Nations entities in such \nfields as the promotion of human rights, human development, poverty alleviation, \nhumanitarian assistance, health promotion, HIV and AIDS prevention, child and \nyouth education, gender equality, peacebuilding and sustainable development,  \n \nAcknowledging also the importance of the Youth Olympic Games in inspiring \nyouth through integrated sports, cultural and educational experiences, noting in this \nregard the successful conclusion of the Winter Youth Olympic Games held in \nGangwon, Republic of Korea, in 2024, and welcoming the Summer Youth Olympic \nGames to be held in Dakar in 2026, as the first Olympic event organized on the \nAfrican continent, and the Winter Youth Olympic Games to be held in Dolomiti \nValtellina, Italy, in 2028, \n \nWelcoming the proactive efforts of Milano-Cortina 2026 in conjunction with all \nOrganizing Committees of upcoming Olympic Games, to implement new standards \nfor delivering more sustainable Games in accordance with the International Olympic \nCommittee reforms, \n \nRecognizing that the active involvement of persons with disabilities in sports \nand the Paralympic Games contributes to the full and equal realization of their human \nrights, as well as respect for their inherent dignity, recalling articles 1 and 30 of the \n__________________ \n \n4  United Nations, Treaty Series, vol. 1577, No. 27531. \n \n5  Resolution S-27/2, annex. \n\nA/80/L.10 \n \n25-17857\n4/5 \n \nConvention on the Rights of Persons with Disabilities, 6  in which States Parties \nrecognized the right of persons with disabilities, including those with long-term \nphysical, mental, intellectual or sensory impairments, to take part on an equal basis \nwith others in cultural life, and committed to take appropriate measures to encourage \nand promote the participation, to the fullest extent possible, of persons with \ndisabilities in mainstream sporting activities at all levels, with a view to enabling \npersons with disabilities to participate on an equal basis with others in recreational, \nleisure and sporting activities, and noting in this regard the need for appropriate \ninstruction, training and resources alongside accessibility of venues, and welcoming \nplans to stage integrated and inclusive Games, \n \nRecognizing also the role that the Paralympic movement plays in showcasing \nthe achievements of athletes with disabilities to a global audience and in acting as a \nprimary vehicle to promote positive perceptions and greater inclusion of persons with \ndisabilities in sport and society, \n \nWelcoming the significant impetus that the Olympic Games, the Paralympic \nGames and the Youth Olympic Games give to the volunteer movement around the \nworld, acknowledging the contributions of volunteers to the success of the Games, \nand in this regard calling upon host countries to promote social inclusion without \ndiscrimination of any kind,  \n \nRecognizing the important role of supporters working alongside athletes and \npersons with disabilities to participate, organize and develop disability-specific \nsports, \n \nWelcoming the commitment made by various States Members of the United \nNations and other relevant stakeholders to developing national and international \nprogrammes that promote peace and conflict resolution, the Olympic and Paralympic \nvalues and the Olympic Truce ideals through sport and through culture, education, \nsustainable development and wider public engagement, and acknowledging the \ncontribution of former hosts of the Olympic and Paralympic Games in this regard,  \n \nRecognizing the humanitarian opportunities presented by the Olympic Truce and \nby other initiatives supported by the United Nations to achieve the cessation of \nconflict, \n \nRecalling that, in its resolution 79/8, it supported the independence and \nautonomy of sport as well as the mission of the International Olympic Committee in \nleading the Olympic movement and of the International Paralympic Committee in \nleading the Paralympic movement, and recognized the unifying and conciliative \nnature of the Olympic Games and major international sport events and that such \nevents are organized in the spirit of peace, mutual understanding, friendship, \ntolerance and inadmissibility of discrimination of any kind,  \n \nAcknowledging all the fundamental principles of the Olympic Charter, including \nprinciple 6, which states that the enjoyment of the rights and freedoms set forth in the \nOlympic Charter shall be secured for all, without discrimination of any kind,  \n \nNoting with satisfaction that the United Nations flag will be flown at the \nOlympic stadium and in the Olympic and Paralympic villages of the XXV Olympic \nWinter Games and the XIV Paralympic Winter Games,  \n \n1. \nUrges Member States to observe the Olympic Truce individually and \ncollectively, within the framework of the Charter of the United Nations, throughout \nthe period from the seventh day before the start of the XXV Olympic Winter Games \nuntil the seventh day following the end of the XIV Paralympic Winter Games, to be \n__________________ \n \n6  United Nations, Treaty Series, vol. 2515, No. 44910. \n\nA/80/L.10\n \n5/5\n25-17857 \n \nheld in Milano-Cortina in 2026, in particular, to ensure the safe passage, access and \nparticipation of athletes, officials and all other accredited persons taking part in the \nOlympic Winter Games and the Paralympic Winter Games, and to contribute through \nother appropriate measures to the safe organization of the Games;  \n \n2. \nUnderlines the importance of cooperation among Member States to \ncollectively implement the values of the Olympic Truce around the world, and \nemphasizes the important role of the International Olympic Committee, the \nInternational Paralympic Committee and the United Nations in this regard;  \n \n3. \nWelcomes the work of the International Olympic Committee and the \nInternational Paralympic Committee, as well as the International Olympic Truce \nCentre, in mobilizing national and international sports federations and organizations, \nNational Olympic and Paralympic Committees and associations of these \norganizations to take concrete actions at the local, national, regional and international \nlevels to promote and strengthen a culture of peace based on the spirit of the Olympic \nTruce, and invites those organizations and national committees to cooperate and share \ninformation and best practices, as appropriate;  \n \n4. \nAlso welcomes the leadership of Olympic and Paralympic athletes in \npromoting peace and human understanding through sport and the Olympic ideal; \n \n5. \nCalls upon all Member States to cooperate with the International Olympic \nCommittee and the International Paralympic Committee in their efforts to use sport \nas a tool to promote peace, dialogue, tolerance and reconciliation in areas of conflict \nduring and beyond the period of the Olympic and Paralympic Games;  \n \n6. \nRecognizes that sport and the Olympic and Paralympic Games can be used \nto promote human rights and strengthen universal respect for such rights, thus \ncontributing to their full realization;  \n \n7. \nWelcomes the cooperation among Member States, the United Nations and \nthe specialized agencies, funds and programmes, within their respective mandates, \nand the International Olympic Committee and the International Paralympic \nCommittee, to maximize the potential of sport to make a meaningful and sustainable \ncontribution to the achievement of the Sustainable Development Goals within the \n2030 Agenda for Sustainable Development, and encourages the Olympic and \nParalympic movements to work closely with national and international sports \norganizations on the use of sport to this end;  \n \n8. \nRequests the Secretary-General and the President of the General Assembly \nto promote the observance of the Olympic Truce among Member States and support for \nhuman development initiatives through sport and to continue to cooperate effectively \nwith the International Olympic Committee, the International Paralympic Committee \nand the sporting community in general in the realization of those objectives;  \n \n9. \nDecides to include in the provisional agenda of its eighty-second session \nthe sub-item entitled \u201cBuilding a peaceful and better world through sport and the \nOlympic ideal\u201d of the item entitled \u201cSport for development and peace\u201d and to consider \nthe sub-item before the Games of the XXXIV Olympiad and the XVIII Paralympic \nGames, to be held in Los Angeles in 2028.  \n \n",
  "paragraphs": {
    "1": "Urges Member States to observe the Olympic Truce individually and collectively, within the framework of the Charter of the United Nations, throughout the period from the seventh day before the start of the XXV Olympic Winter Games until the seventh day following the end of the XIV Paralympic Winter Games, to be __________________ 6 United Nations, Treaty Series, vol. 2515, No. 44910. A/80/L.10 5/5 25-17857 held in Milano-Cortina in 2026, in particular, to ensure the safe passage, access and participation of athletes, officials and all other accredited persons taking part in the Olympic Winter Games and the Paralympic Winter Games, and to contribute through other appropriate measures to the safe organization of the Games;",
    "2": "Underlines the importance of cooperation among Member States to collectively implement the values of the Olympic Truce around the world, and emphasizes the important role of the International Olympic Committee, the International Paralympic Committee and the United Nations in this regard;",
    "3": "Welcomes the work of the International Olympic Committee and the International Paralympic Committee, as well as the International Olympic Truce Centre, in mobilizing national and international sports federations and organizations, National Olympic and Paralympic Committees and associations of these organizations to take concrete actions at the local, national, regional and international levels to promote and strengthen a culture of peace based on the spirit of the Olympic Truce, and invites those organizations and national committees to cooperate and share information and best practices, as appropriate;",
    "4": "Also welcomes the leadership of Olympic and Paralympic athletes in promoting peace and human understanding through sport and the Olympic ideal;",
    "5": "Calls upon all Member States to cooperate with the International Olympic Committee and the International Paralympic Committee in their efforts to use sport as a tool to promote peace, dialogue, tolerance and reconciliation in areas of conflict during and beyond the period of the Olympic and Paralympic Games;",
    "6": "Recognizes that sport and the Olympic and Paralympic Games can be used to promote human rights and strengthen universal respect for such rights, thus contributing to their full realization;",
    "7": "Welcomes the cooperation among Member States, the United Nations and the specialized agencies, funds and programmes, within their respective mandates, and the International Olympic Committee and the International Paralympic Committee, to maximize the potential of sport to make a meaningful and sustainable contribution to the achievement of the Sustainable Development Goals within the 2030 Agenda for Sustainable Development, and encourages the Olympic and Paralympic movements to work closely with national and international sports organizations on the use of sport to this end;",
    "8": "Requests the Secretary-General and the President of the General Assembly to promote the observance of the Olympic Truce among Member States and support for human development initiatives through sport and to continue to cooperate effectively with the International Olympic Committee, the International Paralympic Committee and the sporting community in general in the realization of those objectives;",
    "9": "Decides to include in the provisional agenda of its eighty-second session the sub-item entitled \u201cBuilding a peaceful and better world through sport and the Olympic ideal\u201d of the item entitled \u201cSport for development and peace\u201d and to consider the sub-item before the Games of the XXXIV Olympiad and the XVIII Paralympic Games, to be held in Los Angeles in 2028."
  },
  "agenda_items": [
    "Item 11"
  ],
  "symbol_references": [
    "A/80/L.10"
  ]
}