{
  "symbol": "A/80/L.24",
  "filename": "A_80_L.24.pdf",
  "title": "International Year of Legal Literacy, 2027",
  "text": "United Nations \nA/80/L.24 \n \n \nGeneral Assembly \nDistr.: Limited \n2 December 2025 \nOriginal: English \n \n25-19720 (E)    051225 \n*2519720* \n \n \nEightieth session \nAgenda item 13 \nIntegrated and coordinated implementation of and follow-up \nto the outcomes of the major United Nations conferences and \nsummits in the economic, social and related fields \n \n \n \n \n \nKazakhstan, Kyrgyzstan, Tajikistan, Turkmenistan and Uzbekistan:* \ndraft resolution \n \n \n \n International Year of Legal Literacy, 2027 \n \n \n \nThe General Assembly, \n \nReaffirming the Charter of the United Nations, including the principles and \npurposes contained therein, \n \nReaffirming also the right of everyone to education, and recognizing that \neducation should be directed to the full development of the human personality and the \nsense of its dignity, strengthen the respect for human rights and fundamental freedoms, \nand enable all persons to participate effectively in a free society, promote understanding, \ntolerance and friendship among all nations and all racial, ethnic or religious groups, and \nfurther the activities of the United Nations for the maintenance of peace, \n \nReaffirming further its resolutions 53/199 of 15 December 1998 and 61/185 of \n20 December 2006 on the proclamation of international years, and Economic and \nSocial Council resolution 1980/67 of 25 July 1980 on international years and \nanniversaries, in particular paragraphs 1 to 10 of the annex thereto on the agreed \ncriteria for the proclamation of international years, as well as paragraphs 13 and 14, \nin which it is stated that an international day or year should not be proclaimed before \nthe basic arrangements for its organization and financing have been made, \n \nRecalling its resolution 2099 (XX) of 20 December 1965, in which the General \nAssembly established the United Nations Programme of Assistance in the Teaching, \nStudy, Dissemination and Wider Appreciation of International Law to contribute \ntowards a better knowledge of international law as a means of strengthening \ninternational peace and security and promoting friendly relations and cooperation \namong States, \n \nRecalling also its resolution 49/184 of 23 December 1994, by which it \nproclaimed the period from 1995 to 2004 the United Nations Decade for Human \nRights Education,  \n \n \n* Any changes to the list of sponsors will be reflected in the official record of the meeting. \n\nA/80/L.24 \n \n25-19720\n2/2 \n \n \nRecognizing the important role of relevant United Nations system entities in \npromoting legal education and literacy, including human rights education, and in \nsupporting national efforts to strengthen access to justice, \n \nNoting that United Nations literacy strategies emphasize that programmes \nmeeting learners\u2019 needs may include legal literacy, information literacy, digital literacy, \nmedia literacy and scientific literacy, \n \nAcknowledging that improving socioeconomic conditions, particularly for \nwomen and those in vulnerable situations, requires supporting legal literacy and \nincome-generating and skill-building activities, \n \nEncouraging States to strengthen national capacities for legal education and \nliteracy, including through the development and implementation of national plans and \nstrategies, and inviting the relevant organizations and bodies of the United Nations \nsystem to provide, upon request, technical assistance and capacity-building and to \nshare national experiences, good practices and lessons learned on promoting legal \nliteracy, and in this regard taking note of the experience of Tajikistan in declaring \n2024 as the Year of Legal Literacy in the country to contribute to legal awareness \namong its citizens,  \n \nRecognizing that education, training and public information are essential to the \npromotion and achievement of stable and harmonious relations among communities \nand to fostering mutual understanding, tolerance and peace, \n \nConvinced that an international year devoted to legal literacy would contribute \nto the implementation of the World Programme for Human Rights Education, promote \nawareness of rights and responsibilities and advance the rule of law at the national \nand international levels,  \n \n1. \nDecides to proclaim the year 2027 as the International Year of Legal \nLiteracy; \n \n2. \nInvites all Member States, organizations of the United Nations system, \nregional and subregional organizations, national human rights institutions and civil \nsociety organizations to observe the International Year, in a manner consistent with \nnational priorities, and to promote activities aimed at fostering understanding of rights \nand obligations and access to justice for all; \n \n3. \nInvites the organizations of the United Nations system, as well as \ninternational and regional organizations, to provide assistance, upon request, to States \nin their efforts to promote legal literacy; \n \n4. \nStresses that the costs of all the activities that may arise from the \nimplementation of the present resolution should be met through voluntary \ncontributions, including from the private sector, and calls upon all relevant \nstakeholders to make voluntary contributions and to provide other forms of support \nfor the International Year; \n \n5. \nRequests the Secretary-General to bring the present resolution to the \nattention of all Member States, the organizations of the United Nations system and \nother relevant stakeholders for appropriate observance. \n \n",
  "paragraphs": {
    "1": "Decides to proclaim the year 2027 as the International Year of Legal Literacy;",
    "2": "Invites all Member States, organizations of the United Nations system, regional and subregional organizations, national human rights institutions and civil society organizations to observe the International Year, in a manner consistent with national priorities, and to promote activities aimed at fostering understanding of rights and obligations and access to justice for all;",
    "3": "Invites the organizations of the United Nations system, as well as international and regional organizations, to provide assistance, upon request, to States in their efforts to promote legal literacy;",
    "4": "Stresses that the costs of all the activities that may arise from the implementation of the present resolution should be met through voluntary contributions, including from the private sector, and calls upon all relevant stakeholders to make voluntary contributions and to provide other forms of support for the International Year;",
    "5": "Requests the Secretary-General to bring the present resolution to the attention of all Member States, the organizations of the United Nations system and other relevant stakeholders for appropriate observance."
  },
  "agenda_items": [
    "Item 13"
  ],
  "symbol_references": [
    "A/80/L.24"
  ]
}