{
  "symbol": "A/80/L.27",
  "filename": "A_80_L.27.pdf",
  "title": "Strengthening of international cooperation and coordination of efforts to study, mitigate and minimize the consequences of the Chornobyl disaster",
  "text": "United Nations \nA/80/L.27\n \n \nGeneral Assembly \nDistr.: Limited \n4 December 2025 \nOriginal: English \n \n25-19857 (E)    081225 \n*2519857* \n \n \nEightieth session \nAgenda item 72 (d) \nStrengthening of the coordination of humanitarian and disaster \nrelief assistance of the United Nations, including special \neconomic assistance: strengthening of international cooperation \nand coordination of efforts to study, mitigate and minimize the \nconsequences of the Chernobyl disaster \n \n \n \nBelgium, Bulgaria, Canada, Czechia, Denmark, Estonia, Finland, France, Iceland, \nIreland, Latvia, Lithuania, Malta, Monaco, Netherlands (Kingdom of the), \nNorway, Poland, Republic of Moldova, Romania, Spain, Sweden, Ukraine and \nUnited Kingdom of Great Britain and Northern Ireland:* draft resolution \n \n \nStrengthening of international cooperation and coordination of \nefforts to study, mitigate and minimize the consequences of the \nChornobyl disaster \n \n \n \nThe General Assembly, \n \nReaffirming its resolution 77/288 of 16 May 2023, \n \nReaffirming also its resolution 68/99 of 13 December 2013 on the strengthening \nof international cooperation and coordination of efforts to study, mitigate and \nminimize the consequences of the Chornobyl disaster, as well as its other relevant \nresolutions, on the closure of the Chornobyl nuclear power plant of Ukraine, and \ntaking note of the decisions adopted by the relevant United Nations bodies, the \nspecialized agencies and other organizations of the United Nations system in the \nimplementation of those resolutions, \n \nRecognizing the still-persistent serious long-term consequences of the \nChornobyl disaster, as well as the continuing related needs of the affected \ncommunities and territories, \n \nStressing the need for continued coordination by the United Nations \nDevelopment Programme of the United Nations system activities aimed at the short-\nterm and long-term recovery of Chornobyl-affected territories and for the United \nNations agencies to strengthen strategic partnerships, the building of alliances and the \nmobilization of resources for the development of Chornobyl-affected territories, \n \nWelcoming events organized by Member States, relevant agencies of the United \nNations system and other international organizations, as well as civil society, to mark \nInternational Chornobyl Disaster Remembrance Day, observed on 26 April, and \n \n \n* Any changes to the list of sponsors will be reflected in the official records of the meeting. \n\nA/80/L.27 \n \n25-19857\n2/3 \n \nstressing its significance for the further strengthening of international cooperation to \nstudy, mitigate and minimize the consequences of the Chornobyl disaster, \n \nStressing that the fortieth anniversary of the Chornobyl disaster in 2026 presents \na critical opportunity for all stakeholders to actively commemorate the event and \nrenew their commitment to long-term recovery, resilience and sustainable \ndevelopment, \n \nWelcoming global efforts to enhance awareness of the needs of people and \nterritories affected by the Chornobyl disaster, including through web-based resources, \n \n1. \nWelcomes the report of the Secretary-General on the persistent legacy of \nthe Chornobyl disaster;1 \n \n2. \nGreatly appreciates the coordinating role of the United Nations \nDevelopment Programme in the international cooperation on Chornobyl, including \nthe work undertaken by the Inter-Agency Task Force on Chornobyl; \n \n3. \nAcknowledges the need for continuing international cooperation on \nChornobyl under the auspices of the United Nations that can contribute to the \nimplementation of the 2030 Agenda for Sustainable Development 2 and the Sendai \nFramework for Disaster Risk Reduction 2015\u20132030;3 \n \n4. \nStresses the need, in this regard, to continue the environmental and health \nmonitoring of the Chornobyl-affected regions and communities for the purpose of \nassessing the efficiency of international assistance; \n \n5. \nExpresses grave alarm at the damage arising from the drone strike of \n14 February 2025 against the New Safe Confinement structure at the Chornobyl \nnuclear power plant of Ukraine, which jeopardized decades of international progress \nin making the site safe and secure after one of the world\u2019s most dangerous nuclear \ndisasters; \n \n6. \nStresses the importance of continued support from the international \ncommunity and relevant authorities in repairing the New Safe Confinement, which is \ncritical for upholding global nuclear safety standards and mitigating environmental \nrisks in Ukraine; \n \n7. \nEncourages Member States and all interested partners to support \ninternational cooperation on Chornobyl aimed at achieving the Sustainable \nDevelopment Goals in the Chornobyl-affected regions, including through \npartnerships, innovation and investment; \n \n8. \nRequests the United Nations Development Programme and the \nInter-Agency Task Force on Chornobyl to continue to coordinate international \ncooperation on Chornobyl as a means to further the implementation of the 2030 \nAgenda and to keep post-Chornobyl recovery issues high on the inter-agency and \ninternational agendas; \n \n9. \nRecognizes the need to continue the sustainable development of the \nrecovering regions; \n \n10. Decides to rename International Chernobyl Disaster Remembrance Day, \nproclaimed in its resolution 71/125 of 8 December 2016 and observed annually since \n2017, as International Chornobyl Disaster Remembrance Day; \n__________________ \n \n1 A/80/395. \n \n2 Resolution 70/1. \n \n3 Resolution 69/283, annex II. \n\nA/80/L.27\n \n3/3\n25-19857 \n \n \n11. \nInvites Member States, relevant agencies of the United Nations system and \nother international organizations, as well as civil society, to observe International \nChornobyl Disaster Remembrance Day, including by paying particular attention to \nthe significance of marking this day in 2026, and notes that the costs of all activities \nthat may arise should be met from voluntary contributions; \n \n12. Requests the President of the General Assembly to convene, within \nexisting resources, on 24 April 2026, a special commemorative meeting of the \nAssembly in observance of the fortieth anniversary of the Chornobyl disaster; \n \n13. Decides to include in the provisional agenda of its eighty-third session, \nunder the item entitled \u201cStrengthening of the coordination of humanitarian and \ndisaster relief assistance of the United Nations, including special economic \nassistance\u201d, the sub-item entitled \u201cStrengthening of international cooperation and \ncoordination of efforts to study, mitigate and minimize the consequences of the \nChornobyl disaster\u201d; \n \n14. Requests the Secretary-General to submit to the General Assembly at its \neighty-third session, under the sub-item entitled \u201cStrengthening of international \ncooperation and coordination of efforts to study, mitigate and minimize the \nconsequences of the Chornobyl disaster\u201d of the item entitled \u201cStrengthening of the \ncoordination of humanitarian and disaster relief assistance of the United Nations, \nincluding special economic assistance\u201d, a report on the implementation of the present \nresolution. \n \n",
  "paragraphs": {
    "1": "Welcomes the report of the Secretary-General on the persistent legacy of the Chornobyl disaster;1",
    "2": "Greatly appreciates the coordinating role of the United Nations Development Programme in the international cooperation on Chornobyl, including the work undertaken by the Inter-Agency Task Force on Chornobyl;",
    "3": "Acknowledges the need for continuing international cooperation on Chornobyl under the auspices of the United Nations that can contribute to the implementation of the 2030 Agenda for Sustainable Development 2 and the Sendai Framework for Disaster Risk Reduction 2015\u20132030;3",
    "4": "Stresses the need, in this regard, to continue the environmental and health monitoring of the Chornobyl-affected regions and communities for the purpose of assessing the efficiency of international assistance;",
    "5": "Expresses grave alarm at the damage arising from the drone strike of 14 February 2025 against the New Safe Confinement structure at the Chornobyl nuclear power plant of Ukraine, which jeopardized decades of international progress in making the site safe and secure after one of the world\u2019s most dangerous nuclear disasters;",
    "6": "Stresses the importance of continued support from the international community and relevant authorities in repairing the New Safe Confinement, which is critical for upholding global nuclear safety standards and mitigating environmental risks in Ukraine;",
    "7": "Encourages Member States and all interested partners to support international cooperation on Chornobyl aimed at achieving the Sustainable Development Goals in the Chornobyl-affected regions, including through partnerships, innovation and investment;",
    "8": "Requests the United Nations Development Programme and the Inter-Agency Task Force on Chornobyl to continue to coordinate international cooperation on Chornobyl as a means to further the implementation of the 2030 Agenda and to keep post-Chornobyl recovery issues high on the inter-agency and international agendas;",
    "9": "Recognizes the need to continue the sustainable development of the recovering regions;",
    "10": "Decides to rename International Chernobyl Disaster Remembrance Day, proclaimed in its resolution 71/125 of 8 December 2016 and observed annually since 2017, as International Chornobyl Disaster Remembrance Day;",
    "11": "Invites Member States, relevant agencies of the United Nations system and other international organizations, as well as civil society, to observe International Chornobyl Disaster Remembrance Day, including by paying particular attention to the significance of marking this day in 2026, and notes that the costs of all activities that may arise should be met from voluntary contributions;",
    "12": "Requests the President of the General Assembly to convene, within existing resources, on 24 April 2026, a special commemorative meeting of the Assembly in observance of the fortieth anniversary of the Chornobyl disaster;",
    "13": "Decides to include in the provisional agenda of its eighty-third session, under the item entitled \u201cStrengthening of the coordination of humanitarian and disaster relief assistance of the United Nations, including special economic assistance\u201d, the sub-item entitled \u201cStrengthening of international cooperation and coordination of efforts to study, mitigate and minimize the consequences of the Chornobyl disaster\u201d;",
    "14": "Requests the Secretary-General to submit to the General Assembly at its eighty-third session, under the sub-item entitled \u201cStrengthening of international cooperation and coordination of efforts to study, mitigate and minimize the consequences of the Chornobyl disaster\u201d of the item entitled \u201cStrengthening of the coordination of humanitarian and disaster relief assistance of the United Nations, including special economic assistance\u201d, a report on the implementation of the present resolution."
  },
  "agenda_items": [
    "Item 72"
  ],
  "symbol_references": [
    "A/80/L.27"
  ]
}