{
  "symbol": "A/80/L.3",
  "filename": "A_80_L.3.pdf",
  "title": "Persistent legacy of the Chernobyl disaster",
  "text": "United Nations \nA/80/L.3\n \n \nGeneral Assembly \nDistr.: Limited \n16 September 2025 \nOriginal: English \n \n25-14866 (E)    180925 \n*2514866* \n \n \nEightieth session \nAgenda item 72 (d) \nStrengthening of the coordination of humanitarian and \ndisaster relief assistance of the United Nations, including \nspecial economic assistance: strengthening of international \ncooperation and coordination of efforts to study, mitigate \nand minimize the consequences of the Chernobyl disaster \n \n \n \nBelarus:* draft resolution \n \n \nPersistent legacy of the Chernobyl disaster \n \n \n \nThe General Assembly, \n \nReaffirming its resolution 77/288 of 16 May 2023, \n \nReaffirming also its resolution 68/99 of 13 December 2013 on the strengthening \nof international cooperation and coordination of efforts to study, mitigate and \nminimize the consequences of the Chernobyl disaster, as well as its other relevant \nresolutions, on the closure of the Chernobyl nuclear power plant, and taking note of \nthe decisions adopted by the relevant United Nations bodies, the specialized agencies \nand other organizations of the United Nations system in the implementation of those \nresolutions,  \n \nRecognizing the still-persistent serious long-term consequences of the \nChernobyl disaster, as well as the continuing related needs of the affected \ncommunities and territories,  \n \nStressing the need for continued coordination by the United Nations \nDevelopment Programme of the United Nations system activities aimed at the short-\nterm and long-term recovery of Chernobyl-affected territories and for the United \nNations agencies to strengthen strategic partnerships, build alliances and mobilize \nresources for the development of Chernobyl-affected territories,  \n \nWelcoming events organized by Member States, relevant agencies of the United \nNations system and other international organizations, as well as civil society, to mark \nInternational Chernobyl Disaster Remembrance Day, observed on 26 April, and \nstressing the significance of the Day for the further strengthening of international \ncooperation to study, mitigate and minimize the consequences of the Chernobyl \ndisaster, \n \n \n* Any changes to the list of sponsors will be reflected in the official record of the meeting. \n\nA/80/L.3 \n \n25-14866\n2/2 \n \n \nWelcoming also global efforts to enhance awareness of the needs of people and \nterritories affected by the Chernobyl disaster, including through web-based resources,  \n \n1. \nTakes note of the report of the Secretary-General;1  \n \n2. \nGreatly appreciates the coordinating role of the United Nations \nDevelopment Programme in the international cooperation on Chernobyl, including \nthe work undertaken by the Inter-Agency Task Force on Chernobyl; \n \n3. \nAcknowledges the need for continuing international cooperation on \nChernobyl under the auspices of the United Nations that can contribute to the \nimplementation of the 2030 Agenda for Sustainable Development 2 and the Sendai \nFramework for Disaster Risk Reduction 2015\u20132030;3  \n \n4. \nStresses the need, in this regard, to continue the environmental and health \nmonitoring of the Chernobyl-affected regions and communities for the purpose of \nassessing the efficiency of international assistance; \n \n5. \nEncourages Member States and all interested partners to support \ninternational cooperation on Chernobyl aimed at achieving the Sustainable \nDevelopment Goals in the Chernobyl-affected regions, including through \npartnerships, innovation and investment; \n \n6. \nRequests the United Nations Development Programme and the Inter-Agency \nTask Force on Chernobyl to continue to coordinate international cooperation on \nChernobyl as a means to further the implementation of the 2030 Agenda and to keep \npost-Chernobyl recovery issues high on the inter-agency and international agendas;  \n \n7. \nRecognizes the need to continue the sustainable development of the \nrecovering regions;  \n \n8. \nInvites Member States, relevant agencies of the United Nations system and \nother international organizations, as well as civil society, to observe International \nChernobyl Disaster Remembrance Day, and notes that the costs of all activities that \nmay arise should be met from voluntary contributions; \n \n9. \nRequests the President of the General Assembly to convene, within \nexisting resources, on 24 April 2026, a special commemorative meeting of the \nAssembly in observance of the fortieth anniversary of the Chernobyl disaster; \n \n10. Requests the Secretary-General to submit to the General Assembly at its \neighty-third session, under the sub-item entitled \u201cStrengthening of international \ncooperation and coordination of efforts to study, mitigate and minimize the \nconsequences of the Chernobyl disaster\u201d of the item entitled \u201cStrengthening of the \ncoordination of humanitarian and disaster relief assistance of the United Nations, \nincluding special economic assistance\u201d, a report on the implementation of the present \nresolution. \n \n__________________ \n \n1  A/80/___. \n \n2  Resolution 70/1. \n \n3  Resolution 69/283, annex II. \n",
  "paragraphs": {
    "1": "Takes note of the report of the Secretary-General;1",
    "2": "Greatly appreciates the coordinating role of the United Nations Development Programme in the international cooperation on Chernobyl, including the work undertaken by the Inter-Agency Task Force on Chernobyl;",
    "3": "Acknowledges the need for continuing international cooperation on Chernobyl under the auspices of the United Nations that can contribute to the implementation of the 2030 Agenda for Sustainable Development 2 and the Sendai Framework for Disaster Risk Reduction 2015\u20132030;3",
    "4": "Stresses the need, in this regard, to continue the environmental and health monitoring of the Chernobyl-affected regions and communities for the purpose of assessing the efficiency of international assistance;",
    "5": "Encourages Member States and all interested partners to support international cooperation on Chernobyl aimed at achieving the Sustainable Development Goals in the Chernobyl-affected regions, including through partnerships, innovation and investment;",
    "6": "Requests the United Nations Development Programme and the Inter-Agency Task Force on Chernobyl to continue to coordinate international cooperation on Chernobyl as a means to further the implementation of the 2030 Agenda and to keep post-Chernobyl recovery issues high on the inter-agency and international agendas;",
    "7": "Recognizes the need to continue the sustainable development of the recovering regions;",
    "8": "Invites Member States, relevant agencies of the United Nations system and other international organizations, as well as civil society, to observe International Chernobyl Disaster Remembrance Day, and notes that the costs of all activities that may arise should be met from voluntary contributions;",
    "9": "Requests the President of the General Assembly to convene, within existing resources, on 24 April 2026, a special commemorative meeting of the Assembly in observance of the fortieth anniversary of the Chernobyl disaster;",
    "10": "Requests the Secretary-General to submit to the General Assembly at its eighty-third session, under the sub-item entitled \u201cStrengthening of international cooperation and coordination of efforts to study, mitigate and minimize the consequences of the Chernobyl disaster\u201d of the item entitled \u201cStrengthening of the coordination of humanitarian and disaster relief assistance of the United Nations, including special economic assistance\u201d, a report on the implementation of the present resolution."
  },
  "agenda_items": [
    "Item 72"
  ],
  "symbol_references": [
    "A/80/L.3"
  ]
}