{
  "symbol": "A/80/L.23",
  "filename": "A_80_L.23.pdf",
  "title": "International cooperation on humanitarian assistance in the field of natural disasters, from relief to development",
  "text": "United Nations \nA/80/L.23\n \n \nGeneral Assembly \nDistr.: Limited \n28 November 2025 \nOriginal: English \n \n25-19539 (E)    081225     \n*2519539* \n \n \nEightieth session \nAgenda item 72 (a) \nStrengthening of the coordination of humanitarian and \ndisaster relief assistance of the United Nations, including \nspecial economic assistance: strengthening of the coordination \nof emergency humanitarian assistance of the United Nations \n \n \n \n \n \nIraq:*,** draft resolution \n \n \n \n International cooperation on humanitarian assistance in the field \nof natural disasters, from relief to development \n \n \n \nThe General Assembly, \n \nReaffirming its resolution 46/182 of 19 December 1991, the annex to which \ncontains the guiding principles for the strengthening of the coordination of emergency \nhumanitarian assistance of the United Nations system, as well as all its resolutions on \ninternational cooperation on humanitarian assistance in the field of natural disasters, \nfrom relief to development, and recalling the resolutions of the humanitarian affairs \nsegments of the sessions of the Economic and Social Council,  \n \nReaffirming also the principles of humanity, neutrality, impartiality and \nindependence for the provision of humanitarian assistance,  \n \nRecalling the Sendai Declaration1 and the Sendai Framework for Disaster Risk \nReduction 2015\u20132030,2 adopted by the Third United Nations World Conference on \nDisaster Risk Reduction, held in Sendai, Japan, from 14 to 18 March 2015,  \n \nRecognizing that the Sendai Framework applies to the risk of small-scale and \nlarge-scale, frequent and infrequent, sudden and slow-onset disasters caused by \nnatural or human-made hazards, as well as related environmental, technological and \nbiological hazards and risks,  \n \nNoting with concern that slow-onset disasters such as droughts are on the rise \nin many places and can have significant impacts on affected populations and lead to \nincreased vulnerability to other hazards,  \n__________________ \n \n* On behalf of the States that are members of the Group of 77 and China, taking into account also \nthe provisions of General Assembly resolution ES-10/23 of 10 May 2024. \n ** Any changes to the list of sponsors will be reflected in the official record of the meeting. \n \n1  Resolution 69/283, annex I. \n \n2  Ibid., annex II. \n\nA/80/L.23 \n \n25-19539\n2/19 \n \n \nRecognizing the Global Platform for Disaster Risk Reduction as the main forum \nat the global level for strategic advice coordination and partnership development for \ndisaster risk reduction, and recognizing also the contribution of the relevant regional \nand subregional platforms,  \n \nReaffirming the Paris Agreement3 and its early entry into force, and encouraging \nall the parties to the Agreement to fully implement the Agreement and parties to the \nUnited Nations Framework Convention on Climate Change 4 that have not yet done \nso to deposit their instruments of ratification, acceptance, approval or accession, \nwhere appropriate, as soon as possible,  \n \nHighlighting the synergies between the implementation of the 2030 Agenda for \nSustainable Development 5 and the Paris Agreement, and noting with concern the \nfindings contained in the Special Report on Global Warming of 1.5\u00b0C of the \nIntergovernmental Panel on Climate Change,  \n \nWelcoming the convening of the thirtieth session of the Conference of the Parties \nto the United Nations Framework Convention on Climate Change, held in Bel\u00e9m, \nBrazil, from 10 to 21 November 2025, and looking forward to the thirty-first session \nof the Conference of the Parties to the United Nations Framework Convention on \nClimate Change, \n \nWelcoming also the convening of the special high-level event on climate action, \nco-hosted by the Secretary-General and Brazil on 24 September 2025,  \n \nNoting with appreciation the hosting by the Government of Switzerland of the \neighth session of the Global Platform for Disaster Risk Reduction, held in Geneva \nfrom 2 to 6 June 2025,  \n \nTaking note of its resolution 71/1 of 19 September 2016, in which the General \nAssembly adopted the New York Declaration for Refugees and Migrants and the \nannexes thereto,  \n \nWelcoming the convening of the intergovernmental conference held on 10 and \n11 December 2018 in Marrakech, Morocco, and recalling that it adopted the Global \nCompact for Safe, Orderly and Regular Migration, also known as the Marrakech \nCompact on Migration,6 \n \nExpressing gravest concerns about the humanitarian impacts of and risks posed \nby pandemics and other health emergencies, including the ongoing consequences and \nlong-term effects of the coronavirus disease (COVID\u201119) pandemic, including on the \nalready significant levels of humanitarian and development needs and suffering of \npeople, including those in vulnerable situations and communities affected by natural \ndisasters, and acknowledging the related challenges for disaster preparedness, \nresponse and recovery efforts,  \n \nEmphasizing the fundamentally civilian character of humanitarian assistance, \nreaffirming, in situations in which military capacity and assets are used as a last resort \nto support the implementation of humanitarian assistance in the field of natural \ndisasters, the need for their use to be undertaken with the consent of the affected State \nand in conformity with international law, including international humanitarian law, as \nwell as humanitarian principles, and emphasizing also in this regard the need for \nMember States to coordinate with all relevant actors early on in a disaster response \n__________________ \n \n3 See FCCC/CP/2015/10/Add.1, decision 1/CP.21, annex. \n \n4 United Nations, Treaty Series, vol. 1771, No. 30822. \n \n5 Resolution 70/1. \n \n6 Resolution 73/195, annex. \n\nA/80/L.23\n \n3/19\n25-19539 \n \nso as to ensure the predictable, coherent and needs-based deployment of military \nassets and personnel supporting humanitarian assistance,  \n \nEmphasizing also that the affected State has the primary responsibility in the \ninitiation, organization, coordination and implementation of humanitarian assistance \nwithin its territory and in the facilitation of the work of humanitarian organizations \nin mitigating the consequences of natural disasters,  \n \nEmphasizing further the primary responsibility of each State to undertake \ndisaster risk reduction, including preparedness, and disaster risk management, \nincluding through the voluntary implementation of and follow-up to the Sendai \nFramework, as well as response and early recovery efforts, in order to minimize the \nimpact of disasters and build resilience, while recognizing the importance of \ninternational cooperation in support of the efforts of affected countries which may \nhave limited capacities in this regard,  \n \nRecalling the Bangkok Principles for the implementation of the health aspects \nof the Sendai Framework as a contribution to the Sendai Framework to build resilient \nhealth systems,  \n \nRecognizing the primary role of Member States in preparing for and responding \nto outbreaks of infectious disease, including those that become humanitarian crises, \nin compliance with the International Health Regulations (2005) adopted by the World \nHealth Assembly,7 highlighting the critical role played by Member States, the World \nHealth Organization as the directing and coordinating authority on international \nhealth work, the United Nations humanitarian system, regional organizations, \nnon\u2011governmental organizations, the private sector and other humanitarian actors in \nproviding financial, technical and in-kind support in order to bring epidemics or \npandemics under control, and recognizing also the need to strengthen local and \nnational health systems, early reporting and early warning systems, preparedness, \ncross-sectoral response capacities, and resilience linked to outbreaks of infectious \ndisease, including through capacity-building for developing countries,  \n \nExpressing its deep concern at the increasing challenges to Member States and \nto the United Nations humanitarian response capacity to deal with the consequences \nof natural disasters, given the effects of global challenges, including the impact of \nclimate change, the adverse impacts of the global financial and economic crisis and \nvolatile food prices on food security and nutrition, and other key factors that \nexacerbate the vulnerability of populations and exposure to natural hazards and the \nimpact of natural disasters,  \n \nExpressing its deep concern also that rural and urban poor communities in the \ndeveloping world are the hardest hit by the effects of increased disaster risk,  \n \nNoting with concern that women, persons with disabilities, older persons, \nchildren and youth are often disproportionately affected in natural disasters, and \nstressing the need to ensure that their specific needs are identified and addressed in \nemergency preparedness and response, \n \nAcknowledging the impacts of rapid urbanization in the context of natural \ndisasters and the adverse effects of climate change and that urban disaster \npreparedness and responses require appropriate disaster risk reduction strategies, \nincluding in urban planning, early action, rapid response and early recovery strategies \nimplemented from the initial stage of relief operations, as well as mitigation, \nrehabilitation and sustainable development strategies, giving special attention to the \nneeds and capacities of persons in vulnerable situations, and that action by \n__________________ \n \n7 World Health Organization, document WHA58/2005/REC/1, resolution 58.3, annex. \n\nA/80/L.23 \n \n25-19539\n4/19 \n \nhumanitarian and development actors in urban areas needs to recognize the \ncomplexity of cities and build urban resilience, with improved urban expertise and \ncapacities within organizations, while building on the capabilities, opportunities and \npotential new partnerships present in cities and other human settlements,  \n \nReaffirming the adoption of the outcome document entitled \u201cNew Urban \nAgenda\u201d at the United Nations Conference on Housing and Sustainable Urban \nDevelopment (Habitat III), held in Quito from 17 to 20 October 2016,8 and in this \nregard noting the commitments therein undertaken by Member States regarding \naffected populations in urban areas, and noting also the importance of implementing \npolicies to ensure more effective disaster risk reduction, including preparedness, and \ndisaster risk management, and looking forward to the high-level meeting of the \nGeneral Assembly on the midterm review of the New Urban Agenda in 2026;  \n \nRecognizing that local communities are the first responders in most disasters, \nunderlining the critical role played by in-country capacities in disaster risk reduction, \nincluding preparedness, and capacity-building for community resilience, as well as \nresponse and recovery, and acknowledging the need to support the efforts of Member \nStates to develop and enhance national and local capacities which are fundamental to \nimproving the overall delivery of humanitarian assistance,  \n \nStressing the need for all relevant actors involved in international responses to \nnatural disasters to ensure that such responses are tailored to context, make use of \nappropriate tools and support local systems, including by building on local expertise \nand capacities,  \n \nRecognizing the adverse effects of climate change as contributors to \nenvironmental degradation and extreme weather events, which may, in certain \ninstances, among other factors, contribute to disaster-induced human mobility,  \n \nRecognizing also the high numbers of persons affected by natural disasters, \nincluding in this respect displaced persons,  \n \nReaffirming the importance of international cooperation in support of the efforts \nof the affected States in dealing with natural disasters in all their phases, in particular \nin preparedness, response and the early recovery phase, and of strengthening the \nresponse capacity of countries affected by disaster,  \n \nRecognizing the importance of sharing and making use of effective practices as \npart of transboundary cooperation in preparation for cross-border disaster situations, \nsuch as simulation exercises or preparedness or evacuation drills,  \n \nRecognizing also that scientific advancements can contribute to the effective \nforecasting of extreme weather events, which allows for a more accurate prediction \nand early warning of such events, leading to early action,  \n \nTaking note of the launch of the Coalition for Disaster-Resilient Infrastructure, \nthe Risk-Informed Early Action Partnership, the Climate Risk and Early Warning \nSystems (CREWS) initiative and the Year of Action launched by the Global \nCommission on Adaptation that culminated in the 2021 Climate Adaptation Summit,  \n \nRecognizing the progress made by the United Nations Platform for Space-based \nInformation for Disaster Management and Emergency Response (UN-SPIDER) in its \nmission,  \n \nNoting the progress made by and the role of the Global Framework for Climate \nServices in developing and providing science-based climate information and \nprediction for climate risk management and for adaptation to climate variability and \n__________________ \n \n8 Resolution 71/256, annex. \n\nA/80/L.23\n \n5/19\n25-19539 \n \nchange, and looking forward to continued progress in this regard, including to address \nidentified gaps in coordinating and enabling partnerships,  \n \nWelcoming the important role played by Member States, including developing \ncountries, that have granted necessary and continued generous assistance to countries \nand peoples stricken by natural disasters,  \n \nRecognizing the significant role played by national Red Cross and Red Crescent \nsocieties, as part of the International Red Cross and Red Crescent Movement, in \ndisaster preparedness and risk reduction, disaster response, rehabilitation and \ndevelopment,  \n \nRecognizing also the significant achievements of the Central Emergency \nResponse Fund in facilitating life-saving assistance to crisis-affected people by \nproviding timely funding, enabling humanitarian organizations and their \nimplementing partners to act quickly when tragedy strikes and steer resources to \ncrises that do not receive the attention that they need and deserve, emphasizing the \nneed to broaden and diversify the income base of the Fund, and welcoming in this \nregard the call by the Secretary-General to achieve an annual funding level of \n1 billion United States dollars,  \n \nEmphasizing the need to address vulnerability and to integrate disaster risk \nreduction, including prevention, mitigation and preparedness, into all phases of \nnatural disaster management, post-natural disaster recovery and development \nplanning through close collaboration of all relevant actors and sectors,  \n \nReaffirming that strengthening resilience contributes to withstanding, adapting \nto and quickly recovering from disasters,  \n \nReaffirming also the importance of considering increasing investment in \nbuilding the resilience of communities, which can be the first line of response,  \n \nRecognizing the changing scope, scale and complexity of humanitarian crises, \nincluding natural disasters, and their adverse impact on efforts to achieve economic \ngrowth, sustainable development and internationally agreed development goals, in \nparticular the Sustainable Development Goals, and noting the positive contribution \nthat these efforts can make in strengthening the resilience and preparedness of \npopulations to such disasters and reducing displacement risk in the context of \ndisasters,  \n \nRecognizing also the clear relationship between emergency response, \nrehabilitation and development, and reaffirming that, in order to ensure a smooth \ntransition from relief to rehabilitation and development, emergency assistance must \nbe provided in ways that will be supportive of short-term and medium-term recovery, \nleading to long-term development, and that certain emergency measures should be \nseen as a step towards sustainable development,  \n \nEmphasizing, in this context, the important role of development organizations, \ninternational financial institutions and other relevant stakeholders in supporting \nnational efforts to prepare for and mitigate the consequences of natural disasters,  \n \n1. \nTakes note with appreciation of the report of the Secretary-General;9  \n \n2. \nExpresses its deep concern at the increasing impact of natural disasters, \nresulting in massive losses of life and property worldwide, food insecurity, water and \nsanitation-related challenges, shelter and infrastructure losses, and, in some instances, \ndisplacement, in particular in vulnerable societies lacking adequate capacity to \n__________________ \n \n9 A/80/390. \n\nA/80/L.23 \n \n25-19539\n6/19 \n \nmitigate effectively the long-term negative social, economic and environmental \nconsequences of natural disasters;  \n \n3. \nUrges Member States, the United Nations and humanitarian organizations \nto continue to identify and systematically apply lessons learned and best practices for \nmajor sudden-onset and slow-onset natural disasters, including continued \nimprovements in the areas of coordination, preparedness, risk reduction, early \nwarning, early action, rapid response, recovery, resilience and funding to ensure \nimproved humanitarian system-wide response and outcomes for people in need, \nenabled by coordinated, predictable, timely, flexible and adequate funding; \n \n4. \nReaffirms the importance of implementing the Sendai Framework for \nDisaster Risk Reduction 2015\u20132030, to ensure the substantial reduction of disaster \nrisk and losses in lives, livelihoods and health and in the economic, physical, social, \ncultural and environmental assets of persons, businesses, communities and countries, \nand underlines the importance of tackling the underlying disaster risk drivers and of \nintegrating a disaster risk reduction perspective into humanitarian assistance and \ndevelopment assistance programmes, as appropriate, to prevent new and reduce \nexisting disaster risk;  \n \n5. \nEncourages the United Nations to continue to increase its support for \nMember States in their prioritized implementation of the Sendai Framework, \nincluding through the revised United Nations Plan of Action on Disaster Risk \nReduction for Resilience: Towards a Risk-informed and Integrated Approach to \nSustainable Development, in line with the Sendai Framework, to ensure that the \nimplementation of the Sendai Framework most effectively contributes to a risk-\ninformed and integrated approach to the achievement of the 2030 Agenda for \nSustainable Development, in particular through building resilience against disasters, \nreducing displacement risk in the context of disasters and supporting national and \nlocal preparedness and response capacities;  \n \n6. \nEmphasizes the need to promote and strengthen disaster risk reduction and \npreparedness activities at all levels, in particular in hazard-prone areas, and \nencourages Member States, the United Nations system and other relevant \nhumanitarian and development actors to continue to increase funding and cooperation \nfor disaster risk reduction activities, including the strengthening of preparedness and \nmitigation, as well as for responding to disasters;  \n \n7. \nEncourages Member States, in line with the call in the Sendai Framework, \nto promote disaster risk reduction, including prevention, mitigation and preparedness, \nresponse and recovery with a view to ensuring a rapid and effective response to \ndisasters and to promoting international cooperation to build resilience and reduce \ndisaster risk;  \n \n8. \nAlso encourages Member States to provide dedicated financial \ncontributions to disaster risk reduction, including prevention, mitigation and \npreparedness, as well as early action, rapid response and recovery efforts, in a \nharmonized, flexible and complementary approach that fully utilizes and helps to \ncoordinate humanitarian and development funding options and potential;  \n \n9. \nCalls upon all States to adopt, where required, and to continue to \nimplement effectively, necessary legislative and other appropriate measures to \nmitigate the effects of natural disasters and integrate disaster risk reduction strategies \ninto development planning, as well as to incorporate a gender perspective into \npolicies, planning and funding, and in this regard requests the international \ncommunity to continue to assist developing countries as well as countries with \neconomies in transition, as appropriate;  \n\nA/80/L.23\n \n7/19\n25-19539 \n \n \n10. Acknowledges that climate change, among other factors, contributes to \nenvironmental degradation and to the increase in the intensity and frequency of \nclimate and extreme weather events, both of which amplify disaster risk and \ncontribute to displacement risk in the context of disasters, and in this regard \nencourages Member States, as well as relevant international, regional and subregional \norganizations, in accordance with their specific mandates, to support adaptation to the \nadverse effects of climate change, to strengthen disaster risk reduction and to \nsubstantially increase the availability of coverage and access to multi-hazard early \nwarning systems and strengthen their use to enhance disaster preparedness and early \naction, in order to minimize the humanitarian consequences of natural disasters, \nincluding through the provision of technologies, including new technologies, and \nsupport for capacity-building in developing countries, and in this regard stresses the \nimportance of scaled-up and accelerated implementation of the Early Warnings for \nAll initiative of the Secretary-General and the United Nations Executive Action Plan, \nincluding by leveraging existing programmes, financing streams and partnerships, to \nensure that every person on Earth is covered by early warning systems by 2027; \n \n11. \nEncourages the United Nations and humanitarian organizations to enhance \nefforts to study, prepare for, address and minimize the humanitarian consequences of \nthe adverse effects of climate change and environmental risks and continue to adapt \nhumanitarian planning, operations and relief to the evolving disaster landscape, \nincluding by innovative solutions;  \n \n12. Urges the United Nations, relevant humanitarian and development \norganizations, international financial institutions and other relevant stakeholders to \nstrengthen the capacity and resilience of Member States, including through capacity-\nbuilding for community resilience, the application of new science and technology and \ninvestments in the context of disasters and climate change;  \n \n13. Encourages Member States to address the humanitarian and development \nneeds arising from natural disaster-induced displacement, including through national \npolicies and resilience-building, and in this regard encourages Member States, \nsupported by the United Nations, to develop national laws and policies on internal \ndisplacement, as appropriate, which address such displacement, detail responsibilities \nand measures to minimize the impact of disasters, protect and assist internally \ndisplaced persons following disasters and identify, promote and support safe, \ndignified and durable solutions, and in this respect encourages Member States to \nadopt standards, as appropriate, in line with the Guiding Principles on Internal \nDisplacement, 10  the Framework on Durable Solutions for Internally Displaced \nPersons of the Inter-Agency Standing Committee 11  and the basic principles and \nguidelines on development-based evictions and displacement;12 \n \n14. Also encourages Member States to develop coherent approaches to address \nthe challenges of displacement in the context of natural disasters, including sudden-\nonset and slow-onset, and takes note of relevant initiatives in this regard;  \n \n15. Calls upon Member States, the United Nations and humanitarian and \ndevelopment organizations to integrate the building of resilience and human mobility \ninto relevant strategies, plans and legal frameworks, in particular regarding disaster \nrisk management and climate change adaptation, as integral elements of sustainable \ndevelopment at the national and regional levels so as to help to prevent and mitigate \ndisplacement in the context of disasters and the adverse effects of climate change, \nincluding in urban settings where displaced persons have particular needs, \n__________________ \n \n10 E/CN.4/1998/53/Add.2, annex. \n \n11 A/HRC/13/21/Add.4. \n \n12 A/HRC/4/18, annex I. \n\nA/80/L.23 \n \n25-19539\n8/19 \n \nrequirements and vulnerabilities, and to enhance cooperation and coordination, where \nappropriate, to comprehensively and coherently respond to such displacement, \nincluding by preventing, preparing for and addressing it;  \n \n16. Recognizes the increase in the number and scale of natural disasters, \nincluding those related to the adverse effects of climate change, which in certain \ninstances may contribute to displacement and to additional pressure on host \ncommunities, encourages Member States, the United Nations and relevant \norganizations and actors to further strengthen the efforts aimed at addressing the \nneeds of persons displaced in the context of disasters, including those induced by \nclimate change, and notes in this regard the importance of sharing best practices on \nprevention of and preparation for such displacements, and on the collection of data \non such displacement and on durable solutions;  \n \n17. Encourages Member States, the United Nations, relevant humanitarian \nand development organizations and other relevant stakeholders, as appropriate, to \nenhance understanding, analysis, monitoring and assessment of the drivers, scale, \ndynamics, effects, patterns and duration of displacement in the context of slow-onset \ndisasters, gradual environmental degradation and climate change, to strengthen the \nsystematic, impartial and timely collection and sharing of data disaggregated by sex, \nage and disability and to strengthen evidence-based policy and operational responses \nat all levels in this regard, including to address the root causes of such displacement \nand strengthen the resilience of displaced persons and their host communities;  \n \n18. Encourages increased investment in and enhanced sharing of quality \nforecasting data, risk analytics and modelling of future displacement risks and \npatterns which may result from natural disasters and the adverse impacts of climate \nchange;  \n \n19. Encourages Member States, regional organizations, the United Nations, \nhumanitarian and development organizations and other relevant stakeholders, as \nappropriate, to continue to strengthen international and regional collaboration to \nprovide assistance and support and achieve durable solutions in response to \ndisplacement in the context of disasters and the adverse effects of climate change, and \nenhance the collection, sharing and interoperability of related disaggregated data at \nall levels to strengthen responses and the achievement of durable solutions to \ndisplacement, and in this regard recognizes the importance of the Secretary-General\u2019s \nAction Agenda on Internal Displacement;  \n \n20. Encourages Member States to integrate displacement considerations into \ndisaster preparedness strategies and promote cooperation with neighbouring and other \nrelevant countries to prepare for early warning, contingency planning, stockpiling, \ncoordination \nmechanisms, \nevacuation \nplanning, \nreception \nand \nassistance \narrangements, and public information;  \n \n21. Calls upon Member States and relevant organizations and actors to \nrecognize and address the consequences of humanitarian emergencies for migrants, \nin particular those in vulnerable situations, and to strengthen coordinated \ninternational efforts for their assistance and protection in concert with national \nauthorities;  \n \n22. Encourages Member States to strengthen operational and legal \nframeworks for international disaster relief and initial recovery, to adopt and \nimplement national laws and regulations, as appropriate, to reduce the impact of the \nunderlying drivers of disaster risk and vulnerability, and to adopt comprehensive rules \nand procedures for the facilitation and regulation of international disaster assistance, \ndrawing, as appropriate, from the Guidelines for the Domestic Facilitation and \nRegulation of International Disaster Relief and Initial Recovery Assistance, and calls \n\nA/80/L.23\n \n9/19\n25-19539 \n \nupon the International Red Cross and Red Crescent Movement, relevant United \nNations organizations and other partners for technical support in achieving these \naims;  \n \n23. Welcomes the effective cooperation among the affected States, relevant \nbodies of the United Nations system, donor countries, regional and international \nfinancial institutions and other relevant stakeholders, such as the International Red \nCross and Red Crescent Movement, municipalities, civil society and the private \nsector, in the coordination and delivery of emergency relief, and stresses the need to \ncontinue such cooperation and delivery throughout relief operations and medium- and \nlong-term rehabilitation and reconstruction efforts, in a manner that reduces \nvulnerability to future natural hazards;  \n \n24. Reiterates the commitment to support, as a matter of priority, the efforts \nof countries, in particular developing countries, to strengthen their capacities at all \nlevels in order to assess and reduce risks, prepare for and respond rapidly, effectively \nand safely to natural disasters and mitigate their impact;  \n \n25. Also reiterates the need to build the capacities of governments to manage \nand respond to disaster and climate risks, including by providing support for and \nstrengthening national and, as appropriate, local preparedness and response \ncapacities, and to build resilience, taking into account the differing needs of women, \ngirls, boys and men of all ages, including persons with disabilities;  \n \n26. Underlines the need to address the economic, social and environmental \nimpacts of climate change, and emphasizes the need for action at all levels to enhance \nefforts to build resilience through, inter alia, the sustainable management of \necosystems, in order to reduce the impacts and costs of natural disasters;  \n \n27. Urges Member States to develop, update and strengthen early warning \nsystems, disaster preparedness and risk reduction measures at all levels, in accordance \nwith the Sendai Framework, taking into account their own circumstances and \ncapacities and in coordination with relevant actors, as appropriate, and to improve \ntheir response to early warning information in order to ensure that early warning leads \nto early action, implemented effectively in a timely manner, including through \nscaled\u2011up, predictable and multi-year support, such as forecast-based financing and \nother anticipatory risk financing instruments, and encourages all stakeholders to \nsupport the efforts of Member States in this regard;  \n \n28. Urges Member States, the United Nations and humanitarian and \ndevelopment organizations to continue to support early warning and early action \nefforts, including through forecast-based financing at the global, regional and national \nlevels, including for multi-hazard early warning systems, climate services, exposure \nand vulnerability mapping, new technologies and communication protocols, so that \npersons in vulnerable situations who are exposed to natural hazards, including in \ngeographically remote locations, receive timely, reliable, accurate and actionable \nearly warning information, and encourages the international community to further \nsupport national efforts in this regard;  \n \n29. Encourages the United Nations, humanitarian and development \norganizations, the private sector and other relevant stakeholders to support, as \nappropriate, the efforts of Member States to address the underlying vulnerability and \nroot causes of disaster risk and to work towards ensuring financing support that is \ncoherent, layered and sequenced;  \n \n30. Encourages Member States to develop or enhance forecast-based \npreparedness and early action and rapid response systems, including through the \nestablishment and networking of risk management centres, as well as the coordination \n\nA/80/L.23 \n \n25-19539\n10/19 \n \nof existing networks, ensure that comprehensive procedures are in place and make \nresources available for actions in anticipation of natural disasters, and invites relevant \nbodies of the United Nations system and other stakeholders to engage in these efforts;  \n \n31. Encourages the United Nations system and humanitarian and development \norganizations to support Member States, their national and local authorities, as well \nas local communities to reinforce early warning and early action systems in their \ndisaster and climate risk management frameworks;  \n \n32. Encourages Member States to consider elaborating and presenting to the \nUnited Nations Office for Disaster Risk Reduction their national platforms for \ndisaster risk reduction in accordance with the Sendai Framework, and encourages \nStates to cooperate with each other to reach this objective;  \n \n33. Encourages Member States, the United Nations and humanitarian and \ndevelopment organizations, in accordance with their respective mandates, to provide, \nin a coordinated manner, support for national and regional efforts by providing, in the \ncontext of natural disasters, the assistance necessary to increase sustainable food \nproduction and access to healthy and nutritious food and its utilization, while fully \nrespecting the humanitarian principles for humanitarian action;  \n \n34. Urges Member States, the United Nations, international financial \ninstitutions and humanitarian and development organizations, as appropriate, to \nincrease efforts to prevent famine and prevent and address food insecurity and \nmalnutrition and their underlying causes related to disasters and the adverse effects \nof climate change, among other principal drivers, including by providing urgent \nfunding and multisectoral assistance to respond to the needs of affected populations, \nsuch as those in hard-to-reach areas, and by developing and strengthening resilient \nand sustainable food systems, shock-responsive social protection systems and the use \nof cash and voucher assistance and disaster risk insurance to strengthen livelihoods, \nfood production, and recovery, and by improving the availability and use of data on \nfood security and nutrition risks and impacts;  \n \n35. Recognizes the importance of applying a multi-hazard approach to \npreparedness, and encourages Member States, taking into account their specific \ncircumstances, and the United Nations system to continue to apply the approach to \ntheir preparedness activities, including by giving due regard to, inter alia, secondary \nenvironmental hazards stemming from industrial and technological accidents;  \n \n36. Stresses that, to increase further the effectiveness of humanitarian \nassistance, particular international cooperation efforts should be undertaken to \nenhance and broaden further the utilization of national and local capacities and, where \nappropriate, of regional and subregional capacities for disaster preparedness and \nresponse, which may be made available in closer proximity to the site of a disaster, \nand more efficiently and at lower cost;  \n \n37. Also stresses the importance of investment in disaster-resilient \ninfrastructure and structural and non\u2011structural disaster risk reduction measures, \nincluding nature-based solutions, ecosystem-based approaches, among other \napproaches, for preventing and mitigating the humanitarian impacts of natural \ndisasters and helping to reduce the cost of disaster response, recovery and \nreconstruction, and encourages further efforts in this regard;  \n \n38. Acknowledges that the recovery, rehabilitation and reconstruction phase, \nwhich needs to be prepared ahead of a disaster, is a critical opportunity to \u201cbuild back \nbetter\u201d;  \n \n39. Encourages Member States, the United Nations and other relevant \nstakeholders to continue to support the localization of disaster preparedness and \n\nA/80/L.23\n \n11/19\n25-19539 \n \nresponse and work to ensure that national and local actors are enabled to respond to \ncommunity-level needs and priorities, and strengthen collaboration and partnerships \nbetween international, national, local and regional actors with a view to reinforcing \nnational and local capacities, leadership and coordination mechanisms;  \n \n40. Calls upon the United Nations and humanitarian organizations to continue \nto strengthen the engagement of affected people and local communities in disaster \npreparedness and response, including in the planning and implementation stages as \nwell as in building resilience, including in coordination with national Governments \nand in accordance with their mandates;  \n \n41. Encourages Member States and the United Nations to continue to \nimplement community engagement approaches through which communities receive \ntimely information and which can improve the targeting of humanitarian assistance;  \n \n42. Encourages Member States and regional organizations to work together to \nstrengthen regional cooperation to improve national and regional capacity to \nunderstand and reduce risks and prepare for and respond to disasters in support of \nnational efforts, including by exchanging experiences and best practices;  \n \n43. Encourages Member States to move from reactive to more anticipatory \nrisk-based, multi-hazard and inclusive approaches, such as the promotion of ex ante \ninvestments to prevent disaster risks and build resilience, the promotion of \nenvironmental and spatial measures and the integration of lessons from past disasters, \nas well as awareness of new risks, into future planning;  \n \n44. Encourages innovative practices that draw on the knowledge of people \naffected by natural disasters to develop locally sustainable solutions and to produce \nlife-saving items locally, with minimal logistical and infrastructure implications;  \n \n45. Stresses, in this context, the importance of strengthening international \ncooperation, particularly through the effective use of multilateral mechanisms, in the \ntimely provision of humanitarian assistance through all phases of a disaster, from \nrelief and recovery to development, including the provision of adequate resources;  \n \n46. Encourages all relevant stakeholders, including Member States, to take \nappropriate measures to reduce and discourage the sending of unsolicited, unneeded \nor inappropriate relief goods in response to disasters;  \n \n47. Encourages all Member States to facilitate, to the extent possible, the \ntransit of emergency humanitarian assistance and development assistance and the \nentry of humanitarian personnel and supplies, provided in the context of international \nefforts, including in the phase from relief to development, in full accordance with the \nprovisions of resolution 46/182 and the annex thereto, and in full respect of the \nhumanitarian principles of humanity, neutrality, impartiality and independence, and \ntheir obligations under international law, including international humanitarian law;  \n \n48. Encourages Member States to put in place, as appropriate, customs \nmeasures and to expedite the transit and management of international relief \nconsignments and strengthen, with the support of the United Nations and other \nrelevant stakeholders, their capacities and readiness to improve effectiveness in \nresponding to natural disasters;  \n \n49. Reaffirms the leading role of the Office for the Coordination of \nHumanitarian Affairs of the Secretariat as the focal point within the overall United \nNations system for the advocacy for and coordination of humanitarian assistance \namong United Nations humanitarian organizations and other humanitarian partners;  \n \n50. Recognizes the importance of global and regional operational readiness \nand response services, networks and surge mechanisms in strengthening the \n\nA/80/L.23 \n \n25-19539\n12/19 \n \neffectiveness of disaster prevention, preparedness and response, and encourages \nfurther efforts in this regard by, inter alia, strengthening partnerships with national \ndisaster management agencies and regional organizations, within their respective \nmandates, and building, reinforcing and complementing their capacities, in close \ncoordination with the United Nations and humanitarian organizations, including \nthrough improved data sharing and interoperability; \n \n51. Welcomes the important contribution of the United Nations Disaster \nAssessment and Coordination system to the effectiveness of humanitarian assistance \nin supporting Member States, upon their request, and the United Nations system in \npreparedness and humanitarian response, and encourages the continued incorporation \ninto this mechanism of experts from developing countries that are prone to natural \ndisasters;  \n \n52. Also welcomes the important contribution of the International Search and \nRescue Advisory Group to the effectiveness of international urban search and rescue \nassistance, and encourages Member States to continue to support the Advisory Group, \nin line with General Assembly resolution 57/150 of 16 December 2002;  \n \n53. Urges Member States, the United Nations system and other humanitarian \nactors to consider the specific and differentiated consequences of natural disasters in \nboth rural and urban areas when designing and implementing disaster risk reduction, \nprevention and mitigation, preparedness, humanitarian assistance and early recovery \nstrategies, giving special emphasis to addressing the needs of those living in rural and \nurban poor areas prone to natural disasters;  \n \n54. Encourages Member States, the United Nations and humanitarian and \ndevelopment organizations, in accordance with their respective mandates, and other \nrelevant stakeholders to continue to take concrete action for the effective \nimplementation of the New Urban Agenda, in order to strengthen resilience to \ndisasters and the adverse effects of climate change, and ensure that sustainable \ndevelopment in urban settings is informed by disaster risk, giving special attention to \nthe needs and capacities of persons in vulnerable situations;  \n \n55. Recognizes the important contribution of healthy ecosystems to reducing \ndisaster risk and building community resilience, and encourages all States, United \nNations entities and other relevant actors to promote ecosystem-based approaches and \nnature-based solutions for disaster risk reduction at all levels and across all phases of \ndisaster risk reduction and management;  \n \n56. Welcomes the continued efforts of the Office for the Coordination of \nHumanitarian Affairs to build partnerships with regional organizations, traditional \nand non\u2011traditional donors and the private sector, and encourages Member States and \nthe United Nations system to continue to strengthen partnerships at the global, \nregional, national and local levels in support of national efforts in situations of natural \ndisasters, in order to cooperate effectively in providing humanitarian assistance to \nthose in need and ensure that their collaborative efforts adhere to the principles of \nhumanity, neutrality, impartiality and independence;  \n \n57. Encourages Member States, the United Nations and humanitarian and \ndevelopment organizations to increase efforts to engage the private sector, including \nsmall and medium-sized enterprises, through strategic partnerships in disaster risk \nreduction activities and disaster response and recovery, as appropriate;  \n \n58. Recognizes that information and telecommunications technology can play \nan important role in disaster response, encourages Member States to develop \nemergency response telecommunications capacities that are accessible to all, \nincluding persons with disabilities, encourages the international community to assist \n\nA/80/L.23\n \n13/19\n25-19539 \n \nthe efforts of developing countries in this area, where needed, including in the \nrecovery phase, and in this regard encourages Member States that have not acceded \nto or ratified the Tampere Convention on the Provision of Telecommunication \nResources for Disaster Mitigation and Relief Operations13 to consider doing so;  \n \n59. Encourages the further use of space-based and ground-based remote-\nsensing technologies, including as provided by the United Nations Platform for \nSpace-based Information for Disaster Management and Emergency Response \n(UN\u2011SPIDER), as well as the sharing of geographical data, for the forecasting, \nprevention, mitigation and management of natural disasters, where appropriate, and \ninvites Member States to continue to provide their support to the consolidation of the \nUnited Nations capability in the area of satellite-derived geographical information for \nearly warning, preparedness, response and early recovery;  \n \n60. Encourages Member States to provide all support necessary, on a \nvoluntary basis, to UN-SPIDER, including financial support, to enable it to carry out \nits workplan, and reiterates the importance of enhancing international coordination \nand cooperation at the global level in disaster management and emergency response \nthrough greater access to and use of space-based services for all countries and by \nfacilitating \ncapacity-building \nand \ninstitutional \nstrengthening \nfor \ndisaster \nmanagement, in particular in developing countries;  \n \n61. Recognizes the opportunities for new technologies, when utilized in a \ncoordinated fashion and based on humanitarian principles, potentially to improve the \neffectiveness and accountability of humanitarian response, and encourages Member \nStates, the United Nations and its humanitarian partners to consider engaging, inter \nalia, with the volunteer and technical communities, as appropriate, in order to make \nuse of the variety of data and information available during emergencies and disaster \nrisk reduction efforts to strengthen the evidence-based shared understanding of \ndisaster risk and impacts and to work to improve efficiencies in this regard;  \n \n62. Encourages the United Nations to continue to strengthen its provision of \ndata-related services and policy advice and build the data skills of its humanitarian \nstaff, in order to improve the effectiveness of disaster preparedness and response;  \n \n63. Encourages Member States, relevant United Nations organizations and \ninternational financial institutions to enhance the global capacity for sustainable post-\ndisaster recovery in areas such as coordination with traditional and non\u2011traditional \npartners, identification and dissemination of lessons learned, development of \ncommon tools and mechanisms for recovery needs assessment, strategy development \nand programming, and incorporation of disaster risk reduction into all recovery \nprocesses, and welcomes the ongoing efforts to this end;  \n \n64. Encourages Member States and the United Nations system to support \nnational initiatives that address the differentiated impacts of natural disasters on the \naffected population, including through the collection and analysis of data \ndisaggregated, inter alia, by sex, age and disability, using, inter alia, the existing \ninformation provided by States, and through the development of tools, methods and \nprocedures that will result in more timely and useful initial needs assessments that \nlead to targeted and more effective assistance, and taking into account the \nenvironmental impact;  \n \n65. Calls upon United Nations humanitarian organizations, in consultation \nwith Member States, as appropriate, to strengthen the evidence base for effective \nhumanitarian assistance by further developing common mechanisms to improve the \nquality, transparency and reliability of, and make further progress towards, common \n__________________ \n \n13 United Nations, Treaty Series, vol. 2296, No. 40906. \n\nA/80/L.23 \n \n25-19539\n14/19 \n \nhumanitarian needs assessments, to assess their performance in assistance and to \nensure the most effective use of humanitarian resources by these organizations;  \n \n66. Encourages Member States to take steps to develop or to improve data \ncollection and analysis and to facilitate the exchange of relevant non\u2011sensitive \ninformation with humanitarian and development organizations of the United Nations, \nincluding through shared platforms and a common approach, in order to inform policy \nand measures designed to address disaster risks and their consequences, to support \npreparedness efforts, including forecast-based action and financing and disaster risk \nfinancing, and to improve the effectiveness and accountability of a needs-based \nhumanitarian response, and encourages the United Nations system, as appropriate, \nand other relevant actors to continue to assist developing countries in their efforts to \nbuild local and national capacities for data collection and analysis;  \n \n67. Also encourages Member States, with support from the United Nations \nupon request, to establish and strengthen national disaster loss databases, risk profiles \nand available capacities and to continue to collect, share and use such data to inform \nrelevant policies and strategies;  \n \n68. Encourages Member States, regional organizations, the United Nations \nand humanitarian and development organizations to continue to improve the \nidentification, mapping and analysis of risks and vulnerabilities, including the local \nimpact of future disaster risk drivers, and the development and implementation of \nappropriate strategies and programmes to anticipate and address them, including \nthrough the use of science, technology and innovation, and in this regard encourages \nall the relevant stakeholders to support Governments in capacity development, \nincluding at the regional and local levels, through the sharing of expertise and tools \nand the provision of necessary resources, as appropriate, to ensure that effective \ndisaster management plans and capacities are in place in accordance with national \npriorities for disaster risk management;  \n \n69. Stresses the importance of the full and equal participation of women in \ndecision-making and of gender mainstreaming in developing and implementing \ndisaster risk reduction, preparedness, early action, rapid response and recovery \nstrategies, and in this regard requests the Secretary-General to continue to ensure that \ngender mainstreaming is better taken into account in all aspects of humanitarian \nresponses and activities, including the analysis of allocations and programme \nimplementation, and through greater use of the Gender with Age Marker;  \n \n70. Encourages Member States, in cooperation with relevant United Nations \nhumanitarian organizations, to promote women\u2019s leadership, gender equality and \nempowerment of women and their full and effective participation in the planning and \nimplementation of natural disaster response strategies and humanitarian response to \neffectively address their specific needs, including through strengthening partnerships \nwith, and building the capacities of, national and local institutions, including national \nand local women\u2019s organizations and civil society actors, as appropriate, to adopt \ngender-responsive programming on mitigation and adaptation to climate change and \nto support the resilience and adaptive capacities of women and girls to respond to and \nrecover from adverse impacts of climate change; \n \n71. Encourages Governments, local authorities, the United Nations system \nand regional organizations, and invites donors and other assisting countries, to \naddress the vulnerabilities and capacities of women and girls through gender-\nresponsive programming, including with regard to sexual and reproductive health \nneeds and means to address sexual and gender-based violence and various forms of \nexploitation during emergencies and in post-disaster environments, and the allocation \n\nA/80/L.23\n \n15/19\n25-19539 \n \nof resources in their disaster risk reduction, response and recovery efforts in \ncoordination with the Governments of affected countries;  \n \n72. Encourages Member States, the United Nations and humanitarian \norganizations to strengthen efforts to prevent, mitigate and respond to the protection \nrisks and needs of persons affected by disasters, including by increasing funding and \nsupport for such efforts, ensuring protection capacities in surge mechanisms and \nenhancing the provision of basic services, especially for the most vulnerable, from \nthe very onset of disaster; \n \n73. Encourages Member States, humanitarian organizations and other relevant \nstakeholders, in the context of natural disasters, to ensure access to safe drinking \nwater and adequate and equitable sanitation and hygiene for all, including women and \ngirls;  \n \n74. Emphasizes the importance of mainstreaming the perspective of persons \nwith disabilities in disaster risk reduction, and recognizes the importance of \nnon\u2011discrimination and their inclusive and active participation in and contribution to \ndisaster risk reduction, preparedness, emergency response, recovery and transition \nfrom relief to development, as well as the implementation of systematic approaches, \npolicies and programmes that are inclusive of and accessible to persons with \ndisabilities, recognizing that persons with disabilities are disproportionately affected \nin humanitarian emergencies and face multiple obstacles in accessing humanitarian \nassistance, and recalls the Charter on Inclusion of Persons with Disabilities in \nHumanitarian Action;  \n \n75. Encourages efforts to provide safe and enabling learning environments \nand access to quality education for all, especially for girls and boys, in humanitarian \nemergencies caused by natural disasters, including in order to contribute to a smooth \ntransition from relief to development;  \n \n76. Also encourages efforts to strengthen the disaster resilience and safety of \nschools, reduce interruptions to education during natural disasters, including \ninterruptions to school meals, and in this regard encourages international support to \ncountries that are vulnerable to natural hazards, as appropriate;  \n \n77. Encourages Member States, the United Nations and humanitarian \norganizations to incorporate mental health and psychosocial support services into \ndisaster preparedness, response and recovery;  \n \n78. Encourages Member States and relevant regional and international \norganizations to identify and improve the dissemination of best practices, including \nin the context of COVID\u201119, for improving disaster preparedness, response and early \nrecovery and to scale up successful local initiatives, as appropriate;  \n \n79. Requests the United Nations humanitarian and development organizations \nto improve their coordination of disaster recovery efforts, from relief to development, \ninter alia, by strengthening institutional, coordination and strategic planning efforts \nin disaster preparedness, resilience-building and recovery, in support of national \nauthorities, and by ensuring that development actors participate in strategic planning \nat an early stage;  \n \n80. Encourages the United Nations and humanitarian and development \norganizations to support national, subnational and local governments and \ncommunities in their responsibility to develop long-term strategies, forecast-based \nfinancing and preparedness systems and multi-year operational plans for preparedness \nthat are embedded within disaster risk reduction and resilience strategies in line with \nthe Sendai Framework;  \n\nA/80/L.23 \n \n25-19539\n16/19 \n \n \n81. Calls upon the United Nations system and other humanitarian actors to \nimprove the dissemination of tools and services to support enhanced disaster risk \nreduction, in particular preparedness, early action, rapid response and early recovery;  \n \n82. Calls upon relevant United Nations humanitarian and development \norganizations, in consultation with Member States, to strengthen tools and \nmechanisms to ensure that early recovery needs and support are integrated into the \nplanning and implementation of disaster preparedness, humanitarian response and \ndevelopment cooperation activities, as appropriate;  \n \n83. Encourages the United Nations system and humanitarian organizations to \ncontinue their efforts to mainstream early recovery into humanitarian programming, \nacknowledges that early recovery is an important step towards resilience-building and \nshould receive further funding, and encourages the provision of timely, flexible and \npredictable funding for early recovery, including through established and \ncomplementary humanitarian and development instruments;  \n \n84. Urges Member States, the United Nations and humanitarian and \ndevelopment organizations to prioritize risk management and shift towards an \nanticipatory approach to humanitarian crises in order to prevent and reduce human \nsuffering and economic losses; and encourages scaling up of early warning and early \naction systems, forecasting, \nprevention-oriented \nresponses \nand \nemergency \npreparedness, strengthening of their coordination, coherence, complementarity and \nimpact, and an increase in the use of disaster risk analysis, climate science, predictive \nanalytics, reinforcing systematic risk monitoring and the sharing of data and analysis \nacross sectors and at all levels to better prevent and address disaster and climate risks \nand impacts; \n \n85. Also urges Member States, as well as the United Nations, and humanitarian \norganizations, in accordance with their respective mandates and in line with \nhumanitarian principles, to continue to scale up anticipatory approaches, early \nwarning early action systems, forecasting, prevention-oriented responses and \nemergency preparedness, and improve predictive and risk data analytics across \nsectors, reinforce systematic risk monitoring, early warning and preparedness \ncapacities at the local, national, regional and global levels, including, inter alia, the \nuse of anticipatory financing approaches for humanitarian emergencies, and to \nconsider further efforts by the United Nations humanitarian system and other relevant \nstakeholders in this regard;  \n \n86. Recalls its decision to hold a midterm review of the implementation of the \nSendai Framework in 2023, and in this regard welcomes the convening of the high-\nlevel meeting on the midterm review of the Sendai Framework on 18 and 19 May \n2023, at which the General Assembly adopted the political declaration on the midterm \nreview of the Sendai Framework;14 \n \n87. Encourages international financial institutions to accelerate anticipatory \nfinancing at scale for preparedness and response as well as for risk-informed resilient \nrecovery, including pre\u2011agreed contingency financing, in ways that complement and \nreinforce humanitarian pooled funds;  \n \n88. Urges Member States, humanitarian and development organizations and \nother stakeholders to ensure a comprehensive and coherent approach at the global, \nregional, national and local levels to El Ni\u00f1o and La Ni\u00f1a phenomena and similar or \nrelated events, including by strengthening forecasting, early warning and early action, \nprevention, preparedness, resilience-building and timely response, supported by \neffective leadership and predictable, adequate and early funding, when feasible, in \n__________________ \n \n14 Resolution 77/289, annex. \n\nA/80/L.23\n \n17/19\n25-19539 \n \nregions, countries and communities likely to be affected, and notes the work of the \nSpecial Envoys of the Secretary-General on El Ni\u00f1o and Climate and the blueprint \nfor action prepared by them, and the standard operating procedures for El Ni\u00f1o/ \nSouthern Oscillation events of the Inter-Agency Standing Committee; \n \n89. Notes that the El Ni\u00f1o/La Ni\u00f1a phenomenon has a recurring character and \ncan lead to extensive natural hazards with the potential to seriously affect populations, \nencourages Member States, humanitarian and development organizations and other \nstakeholders, in accordance with their respective mandates, to increase support, \nincluding financial, technical and capacity-building, as appropriate, for people and \ncommunities affected by and most vulnerable to these phenomena, including to meet \nand reduce humanitarian needs, and to prevent and address loss of livelihoods, \nincreased food insecurity, and impacts on health, water and sanitation, education, \nagriculture and other sectors, and encourages increased cooperation with regional and \nsubregional organizations and international financial institutions, and further \nencourages increased investment in national and local response mechanisms, climate \nadaptation and community resilience;  \n \n90. Encourages Member States and the United Nations to enhance the use of \ncommon risk analysis, including the use of the Index for Risk Management, to \nestablish the evidence base for short-, medium- and long-term planning and joint \nstrategies for disaster and climate risk management, capacity development and \nresilience-building, allowing for greater prioritization of resources where the risk is \ngreatest;  \n \n91. Encourages the United Nations and humanitarian and development \norganizations to work towards a common understanding of underlying risks, clarify \nroles and responsibilities according to their respective mandates and establish joint \nobjectives and programmes informed by affected people, data and analysis to \nstrengthen coordination, collaboration and coherence among short-, medium- and \nlong-term activities to progressively reduce needs and vulnerability, build resilience \nand manage the risk related to climate change and of disasters and development \nsetbacks over multi-year planning cycles, including through integrating risk \nmanagement into national sustainable development plans and ensuring the \nconnectivity of humanitarian plans with the longer-term sustainable development \npriorities of Member States, with a view to achieving the Sustainable Development \nGoals;  \n \n92. Stresses the need to strengthen resilience at all levels, and in this regard \nencourages Member States, the United Nations system and other relevant actors to \nsupport efforts, as appropriate, to integrate resilience into humanitarian and \ndevelopment programming, and encourages humanitarian and development actors to \npursue, where appropriate, common resilience and risk management objectives, \nachievable through joint analysis, planning, programming and funding;  \n \n93. Encourages Member States, international financial institutions and the \nprivate sector to support further development and, where appropriate, the strengthening \nof anticipatory financing approaches, to mobilize predictable and multi-year support \nand to work collectively towards common results in order to reduce need, risk and \nvulnerability, making use of a wide range of financing flows and instruments and \npartnerships to mobilize additional resources in the field of natural disasters;  \n \n94. Calls upon Member States, the United Nations and humanitarian \norganizations to provide emergency assistance in ways that are supportive of recovery \nand long-term development, in collaboration with development organizations, as \nappropriate, in accordance with their respective mandates, including by prioritizing \nhumanitarian tools and approaches that strengthen resilience, including preparedness, \n\nA/80/L.23 \n \n25-19539\n18/19 \n \nand support livelihoods, and to support further development and, where appropriate, \nthe strengthening of anticipatory financing approaches, such as, but not limited to, \ncash transfers, vouchers, local procurement of food and services and social safety \nnets; \n \n95. Encourages the United Nations system and other relevant humanitarian \nand development actors to support humanitarian coordinators and resident \ncoordinators in order to strengthen their capacity, inter alia, to support the host \nGovernment in implementing preparedness measures and to coordinate preparedness \nactivities of country teams in support of national efforts, and encourages the United \nNations system and other relevant humanitarian actors to further strengthen the ability \nto quickly and flexibly deploy humanitarian professionals to support Governments \nand country teams in the immediate aftermath of a disaster;  \n \n96. Encourages Member States, the United Nations and humanitarian and \ndevelopment organizations to identify ways to improve the current financing \narchitecture in order to better provide coherent, predictable and flexible longer-term \nfunding for risk management in multi-year strategies and forecasting, in particular \npreparedness, on the basis of a global assessment of risk, allowing for better \nprioritization of resources where the risk is greatest;  \n \n97. Recognizes that enhanced access to international climate finance is \nimportant to support mitigation and adaptation efforts in developing countries, \nespecially those that are particularly vulnerable to the adverse effects of climate \nchange, and also recognizes the ongoing efforts in this regard;  \n \n98. Urges Member States, international financial institutions and other \nrelevant stakeholders to scale up finance for adaptation and disaster risk reduction to \ncountries and local communities that are affected by compound risks caused by \nhumanitarian emergencies and vulnerability to natural hazards and the adverse effects \nof climate change to prevent, mitigate, adapt and respond to disaster impacts, to \nreduce humanitarian needs, risks and vulnerabilities related to disasters and to build \nresilience to shocks;  \n \n99. Emphasizes the need to mobilize adequate, flexible and sustainable \nresources for preparedness and disaster risk reduction, early action, rapid response \nand early recovery activities in order to ensure predictable and timely access to \nresources for humanitarian assistance in emergencies resulting from disasters \nassociated with natural hazards; \n \n100. Calls upon donors to fund humanitarian response plans and flash appeals \nfor disaster responses in order to further reinforce the effectiveness, sustainability, \npredictability and timely delivery of humanitarian assistance to people affected by \ndisasters, including those in hard-to-reach areas, and to scale up timely and \npredictable funding and innovative and anticipatory financing mechanisms, as well \nas by strengthening partnerships with international financial institutions in order to \nprevent, reduce and respond to humanitarian suffering and assist those in need;  \n \n101. Welcomes the important achievements of the Central Emergency Response \nFund in ensuring a more timely and predictable response to humanitarian \nemergencies, stresses the importance of continuing to improve the functioning of the \nFund, and in this regard encourages the United Nations funds and programmes and \nthe specialized agencies to review and evaluate, where necessary, their partnership \npolicies and practices in order to ensure the timely disbursement of funds from the \nFund to implementing partners in order to ensure that resources are used in the most \nefficient, effective, accountable and transparent manner possible;  \n\nA/80/L.23\n \n19/19\n25-19539 \n \n \n102. Calls upon all Member States, and invites the private sector and all \nconcerned individuals and institutions, to consider increasing their voluntary \ncontributions to the Central Emergency Response Fund in order to achieve an annual \nfunding level of 1 billion United States dollars, and to continue to reinforce and \nstrengthen the Fund as the global emergency response fund, and emphasizes that \ncontributions should be additional to current commitments to humanitarian \nprogramming and should not be to the detriment of resources made available for \ninternational cooperation for development;  \n \n103. Also calls upon Member States to continue to increase support to the \nCentral Emergency Response Fund and humanitarian country-based and regional \npooled funds for strengthening early and rapid response to mitigate the impact of \ndisasters, including in underfunded contexts and increasingly through local and \nnational responders and implementing partners;  \n \n104. Invites Member States, the private sector and all other relevant \nstakeholders to harness their differentiated skills, capacities and resources, and also \nto consider voluntary contributions to humanitarian funding mechanisms;  \n \n105. Strongly encourages giving appropriate consideration to disaster risk \nreduction, including preparedness, and the building of resilience to disasters as \nintegral elements of sustainable development and in the implementation of the 2030 \nAgenda for Sustainable Development, the Addis Ababa Action Agenda of the Third \nInternational Conference on Financing for Development15 and the Sevilla Commitment \nof the Fourth International Conference on Financing for Development 16 and promoting \na complementary and coherent approach between those frameworks and the Sendai \nFramework;  \n \n106. Strongly encourages all relevant actors to work to ensure a comprehensive, \ncoherent, systematic and people-centred approach to managing risks, including \nthrough, as appropriate, the 2030 Agenda for Sustainable Development, the Sendai \nFramework, the Paris Agreement and the New Urban Agenda;  \n \n107. Takes note of the World Humanitarian Summit, held in Istanbul, Turkey, \non 23 and 24 May 2016, and of the report of the Secretary-General on the outcome of \nthe World Humanitarian Summit;17 \n \n108. Requests the Secretary-General to continue to improve the international \nresponse to natural disasters and to report thereon to the General Assembly at its \neighty-first session and to include in his report recommendations on how to ensure \nthat humanitarian assistance is provided in ways supportive of the transition from \nrelief to development. \n \n__________________ \n \n15 Resolution 69/313, annex. \n \n16 Resolution 79/323, annex. \n \n17 A/71/353. \n",
  "paragraphs": {
    "1": "Takes note with appreciation of the report of the Secretary-General;9",
    "2": "Expresses its deep concern at the increasing impact of natural disasters, resulting in massive losses of life and property worldwide, food insecurity, water and sanitation-related challenges, shelter and infrastructure losses, and, in some instances, displacement, in particular in vulnerable societies lacking adequate capacity to __________________ 9 A/80/390. A/80/L.23 25-19539 6/19 mitigate effectively the long-term negative social, economic and environmental consequences of natural disasters;",
    "3": "Urges Member States, the United Nations and humanitarian organizations to continue to identify and systematically apply lessons learned and best practices for major sudden-onset and slow-onset natural disasters, including continued improvements in the areas of coordination, preparedness, risk reduction, early warning, early action, rapid response, recovery, resilience and funding to ensure improved humanitarian system-wide response and outcomes for people in need, enabled by coordinated, predictable, timely, flexible and adequate funding;",
    "4": "Reaffirms the importance of implementing the Sendai Framework for Disaster Risk Reduction 2015\u20132030, to ensure the substantial reduction of disaster risk and losses in lives, livelihoods and health and in the economic, physical, social, cultural and environmental assets of persons, businesses, communities and countries, and underlines the importance of tackling the underlying disaster risk drivers and of integrating a disaster risk reduction perspective into humanitarian assistance and development assistance programmes, as appropriate, to prevent new and reduce existing disaster risk;",
    "5": "Encourages the United Nations to continue to increase its support for Member States in their prioritized implementation of the Sendai Framework, including through the revised United Nations Plan of Action on Disaster Risk Reduction for Resilience: Towards a Risk-informed and Integrated Approach to Sustainable Development, in line with the Sendai Framework, to ensure that the implementation of the Sendai Framework most effectively contributes to a risk- informed and integrated approach to the achievement of the 2030 Agenda for Sustainable Development, in particular through building resilience against disasters, reducing displacement risk in the context of disasters and supporting national and local preparedness and response capacities;",
    "6": "Emphasizes the need to promote and strengthen disaster risk reduction and preparedness activities at all levels, in particular in hazard-prone areas, and encourages Member States, the United Nations system and other relevant humanitarian and development actors to continue to increase funding and cooperation for disaster risk reduction activities, including the strengthening of preparedness and mitigation, as well as for responding to disasters;",
    "7": "Encourages Member States, in line with the call in the Sendai Framework, to promote disaster risk reduction, including prevention, mitigation and preparedness, response and recovery with a view to ensuring a rapid and effective response to disasters and to promoting international cooperation to build resilience and reduce disaster risk;",
    "8": "Also encourages Member States to provide dedicated financial contributions to disaster risk reduction, including prevention, mitigation and preparedness, as well as early action, rapid response and recovery efforts, in a harmonized, flexible and complementary approach that fully utilizes and helps to coordinate humanitarian and development funding options and potential;",
    "9": "Calls upon all States to adopt, where required, and to continue to implement effectively, necessary legislative and other appropriate measures to mitigate the effects of natural disasters and integrate disaster risk reduction strategies into development planning, as well as to incorporate a gender perspective into policies, planning and funding, and in this regard requests the international community to continue to assist developing countries as well as countries with economies in transition, as appropriate; A/80/L.23 7/19 25-19539",
    "10": "Acknowledges that climate change, among other factors, contributes to environmental degradation and to the increase in the intensity and frequency of climate and extreme weather events, both of which amplify disaster risk and contribute to displacement risk in the context of disasters, and in this regard encourages Member States, as well as relevant international, regional and subregional organizations, in accordance with their specific mandates, to support adaptation to the adverse effects of climate change, to strengthen disaster risk reduction and to substantially increase the availability of coverage and access to multi-hazard early warning systems and strengthen their use to enhance disaster preparedness and early action, in order to minimize the humanitarian consequences of natural disasters, including through the provision of technologies, including new technologies, and support for capacity-building in developing countries, and in this regard stresses the importance of scaled-up and accelerated implementation of the Early Warnings for All initiative of the Secretary-General and the United Nations Executive Action Plan, including by leveraging existing programmes, financing streams and partnerships, to ensure that every person on Earth is covered by early warning systems by 2027;",
    "11": "Encourages the United Nations and humanitarian organizations to enhance efforts to study, prepare for, address and minimize the humanitarian consequences of the adverse effects of climate change and environmental risks and continue to adapt humanitarian planning, operations and relief to the evolving disaster landscape, including by innovative solutions;",
    "12": "Urges the United Nations, relevant humanitarian and development organizations, international financial institutions and other relevant stakeholders to strengthen the capacity and resilience of Member States, including through capacity- building for community resilience, the application of new science and technology and investments in the context of disasters and climate change;",
    "13": "Encourages Member States to address the humanitarian and development needs arising from natural disaster-induced displacement, including through national policies and resilience-building, and in this regard encourages Member States, supported by the United Nations, to develop national laws and policies on internal displacement, as appropriate, which address such displacement, detail responsibilities and measures to minimize the impact of disasters, protect and assist internally displaced persons following disasters and identify, promote and support safe, dignified and durable solutions, and in this respect encourages Member States to adopt standards, as appropriate, in line with the Guiding Principles on Internal Displacement, 10 the Framework on Durable Solutions for Internally Displaced Persons of the Inter-Agency Standing Committee 11 and the basic principles and guidelines on development-based evictions and displacement;12",
    "14": "Also encourages Member States to develop coherent approaches to address the challenges of displacement in the context of natural disasters, including sudden- onset and slow-onset, and takes note of relevant initiatives in this regard;",
    "15": "Calls upon Member States, the United Nations and humanitarian and development organizations to integrate the building of resilience and human mobility into relevant strategies, plans and legal frameworks, in particular regarding disaster risk management and climate change adaptation, as integral elements of sustainable development at the national and regional levels so as to help to prevent and mitigate displacement in the context of disasters and the adverse effects of climate change, including in urban settings where displaced persons have particular needs, __________________ 10 E/CN.4/1998/53/Add.2, annex. 11 A/HRC/13/21/Add.4. 12 A/HRC/4/18, annex I. A/80/L.23 25-19539 8/19 requirements and vulnerabilities, and to enhance cooperation and coordination, where appropriate, to comprehensively and coherently respond to such displacement, including by preventing, preparing for and addressing it;",
    "16": "Recognizes the increase in the number and scale of natural disasters, including those related to the adverse effects of climate change, which in certain instances may contribute to displacement and to additional pressure on host communities, encourages Member States, the United Nations and relevant organizations and actors to further strengthen the efforts aimed at addressing the needs of persons displaced in the context of disasters, including those induced by climate change, and notes in this regard the importance of sharing best practices on prevention of and preparation for such displacements, and on the collection of data on such displacement and on durable solutions;",
    "17": "Encourages Member States, the United Nations, relevant humanitarian and development organizations and other relevant stakeholders, as appropriate, to enhance understanding, analysis, monitoring and assessment of the drivers, scale, dynamics, effects, patterns and duration of displacement in the context of slow-onset disasters, gradual environmental degradation and climate change, to strengthen the systematic, impartial and timely collection and sharing of data disaggregated by sex, age and disability and to strengthen evidence-based policy and operational responses at all levels in this regard, including to address the root causes of such displacement and strengthen the resilience of displaced persons and their host communities;",
    "18": "Encourages increased investment in and enhanced sharing of quality forecasting data, risk analytics and modelling of future displacement risks and patterns which may result from natural disasters and the adverse impacts of climate change;",
    "19": "Encourages Member States, regional organizations, the United Nations, humanitarian and development organizations and other relevant stakeholders, as appropriate, to continue to strengthen international and regional collaboration to provide assistance and support and achieve durable solutions in response to displacement in the context of disasters and the adverse effects of climate change, and enhance the collection, sharing and interoperability of related disaggregated data at all levels to strengthen responses and the achievement of durable solutions to displacement, and in this regard recognizes the importance of the Secretary-General\u2019s Action Agenda on Internal Displacement;",
    "20": "Encourages Member States to integrate displacement considerations into disaster preparedness strategies and promote cooperation with neighbouring and other relevant countries to prepare for early warning, contingency planning, stockpiling, coordination mechanisms, evacuation planning, reception and assistance arrangements, and public information;",
    "21": "Calls upon Member States and relevant organizations and actors to recognize and address the consequences of humanitarian emergencies for migrants, in particular those in vulnerable situations, and to strengthen coordinated international efforts for their assistance and protection in concert with national authorities;",
    "22": "Encourages Member States to strengthen operational and legal frameworks for international disaster relief and initial recovery, to adopt and implement national laws and regulations, as appropriate, to reduce the impact of the underlying drivers of disaster risk and vulnerability, and to adopt comprehensive rules and procedures for the facilitation and regulation of international disaster assistance, drawing, as appropriate, from the Guidelines for the Domestic Facilitation and Regulation of International Disaster Relief and Initial Recovery Assistance, and calls A/80/L.23 9/19 25-19539 upon the International Red Cross and Red Crescent Movement, relevant United Nations organizations and other partners for technical support in achieving these aims;",
    "23": "Welcomes the effective cooperation among the affected States, relevant bodies of the United Nations system, donor countries, regional and international financial institutions and other relevant stakeholders, such as the International Red Cross and Red Crescent Movement, municipalities, civil society and the private sector, in the coordination and delivery of emergency relief, and stresses the need to continue such cooperation and delivery throughout relief operations and medium- and long-term rehabilitation and reconstruction efforts, in a manner that reduces vulnerability to future natural hazards;",
    "24": "Reiterates the commitment to support, as a matter of priority, the efforts of countries, in particular developing countries, to strengthen their capacities at all levels in order to assess and reduce risks, prepare for and respond rapidly, effectively and safely to natural disasters and mitigate their impact;",
    "25": "Also reiterates the need to build the capacities of governments to manage and respond to disaster and climate risks, including by providing support for and strengthening national and, as appropriate, local preparedness and response capacities, and to build resilience, taking into account the differing needs of women, girls, boys and men of all ages, including persons with disabilities;",
    "26": "Underlines the need to address the economic, social and environmental impacts of climate change, and emphasizes the need for action at all levels to enhance efforts to build resilience through, inter alia, the sustainable management of ecosystems, in order to reduce the impacts and costs of natural disasters;",
    "27": "Urges Member States to develop, update and strengthen early warning systems, disaster preparedness and risk reduction measures at all levels, in accordance with the Sendai Framework, taking into account their own circumstances and capacities and in coordination with relevant actors, as appropriate, and to improve their response to early warning information in order to ensure that early warning leads to early action, implemented effectively in a timely manner, including through scaled\u2011up, predictable and multi-year support, such as forecast-based financing and other anticipatory risk financing instruments, and encourages all stakeholders to support the efforts of Member States in this regard;",
    "28": "Urges Member States, the United Nations and humanitarian and development organizations to continue to support early warning and early action efforts, including through forecast-based financing at the global, regional and national levels, including for multi-hazard early warning systems, climate services, exposure and vulnerability mapping, new technologies and communication protocols, so that persons in vulnerable situations who are exposed to natural hazards, including in geographically remote locations, receive timely, reliable, accurate and actionable early warning information, and encourages the international community to further support national efforts in this regard;",
    "29": "Encourages the United Nations, humanitarian and development organizations, the private sector and other relevant stakeholders to support, as appropriate, the efforts of Member States to address the underlying vulnerability and root causes of disaster risk and to work towards ensuring financing support that is coherent, layered and sequenced;",
    "30": "Encourages Member States to develop or enhance forecast-based preparedness and early action and rapid response systems, including through the establishment and networking of risk management centres, as well as the coordination A/80/L.23 25-19539 10/19 of existing networks, ensure that comprehensive procedures are in place and make resources available for actions in anticipation of natural disasters, and invites relevant bodies of the United Nations system and other stakeholders to engage in these efforts;",
    "31": "Encourages the United Nations system and humanitarian and development organizations to support Member States, their national and local authorities, as well as local communities to reinforce early warning and early action systems in their disaster and climate risk management frameworks;",
    "32": "Encourages Member States to consider elaborating and presenting to the United Nations Office for Disaster Risk Reduction their national platforms for disaster risk reduction in accordance with the Sendai Framework, and encourages States to cooperate with each other to reach this objective;",
    "33": "Encourages Member States, the United Nations and humanitarian and development organizations, in accordance with their respective mandates, to provide, in a coordinated manner, support for national and regional efforts by providing, in the context of natural disasters, the assistance necessary to increase sustainable food production and access to healthy and nutritious food and its utilization, while fully respecting the humanitarian principles for humanitarian action;",
    "34": "Urges Member States, the United Nations, international financial institutions and humanitarian and development organizations, as appropriate, to increase efforts to prevent famine and prevent and address food insecurity and malnutrition and their underlying causes related to disasters and the adverse effects of climate change, among other principal drivers, including by providing urgent funding and multisectoral assistance to respond to the needs of affected populations, such as those in hard-to-reach areas, and by developing and strengthening resilient and sustainable food systems, shock-responsive social protection systems and the use of cash and voucher assistance and disaster risk insurance to strengthen livelihoods, food production, and recovery, and by improving the availability and use of data on food security and nutrition risks and impacts;",
    "35": "Recognizes the importance of applying a multi-hazard approach to preparedness, and encourages Member States, taking into account their specific circumstances, and the United Nations system to continue to apply the approach to their preparedness activities, including by giving due regard to, inter alia, secondary environmental hazards stemming from industrial and technological accidents;",
    "36": "Stresses that, to increase further the effectiveness of humanitarian assistance, particular international cooperation efforts should be undertaken to enhance and broaden further the utilization of national and local capacities and, where appropriate, of regional and subregional capacities for disaster preparedness and response, which may be made available in closer proximity to the site of a disaster, and more efficiently and at lower cost;",
    "37": "Also stresses the importance of investment in disaster-resilient infrastructure and structural and non\u2011structural disaster risk reduction measures, including nature-based solutions, ecosystem-based approaches, among other approaches, for preventing and mitigating the humanitarian impacts of natural disasters and helping to reduce the cost of disaster response, recovery and reconstruction, and encourages further efforts in this regard;",
    "38": "Acknowledges that the recovery, rehabilitation and reconstruction phase, which needs to be prepared ahead of a disaster, is a critical opportunity to \u201cbuild back better\u201d;",
    "39": "Encourages Member States, the United Nations and other relevant stakeholders to continue to support the localization of disaster preparedness and A/80/L.23 11/19 25-19539 response and work to ensure that national and local actors are enabled to respond to community-level needs and priorities, and strengthen collaboration and partnerships between international, national, local and regional actors with a view to reinforcing national and local capacities, leadership and coordination mechanisms;",
    "40": "Calls upon the United Nations and humanitarian organizations to continue to strengthen the engagement of affected people and local communities in disaster preparedness and response, including in the planning and implementation stages as well as in building resilience, including in coordination with national Governments and in accordance with their mandates;",
    "41": "Encourages Member States and the United Nations to continue to implement community engagement approaches through which communities receive timely information and which can improve the targeting of humanitarian assistance;",
    "42": "Encourages Member States and regional organizations to work together to strengthen regional cooperation to improve national and regional capacity to understand and reduce risks and prepare for and respond to disasters in support of national efforts, including by exchanging experiences and best practices;",
    "43": "Encourages Member States to move from reactive to more anticipatory risk-based, multi-hazard and inclusive approaches, such as the promotion of ex ante investments to prevent disaster risks and build resilience, the promotion of environmental and spatial measures and the integration of lessons from past disasters, as well as awareness of new risks, into future planning;",
    "44": "Encourages innovative practices that draw on the knowledge of people affected by natural disasters to develop locally sustainable solutions and to produce life-saving items locally, with minimal logistical and infrastructure implications;",
    "45": "Stresses, in this context, the importance of strengthening international cooperation, particularly through the effective use of multilateral mechanisms, in the timely provision of humanitarian assistance through all phases of a disaster, from relief and recovery to development, including the provision of adequate resources;",
    "46": "Encourages all relevant stakeholders, including Member States, to take appropriate measures to reduce and discourage the sending of unsolicited, unneeded or inappropriate relief goods in response to disasters;",
    "47": "Encourages all Member States to facilitate, to the extent possible, the transit of emergency humanitarian assistance and development assistance and the entry of humanitarian personnel and supplies, provided in the context of international efforts, including in the phase from relief to development, in full accordance with the provisions of resolution 46/182 and the annex thereto, and in full respect of the humanitarian principles of humanity, neutrality, impartiality and independence, and their obligations under international law, including international humanitarian law;",
    "48": "Encourages Member States to put in place, as appropriate, customs measures and to expedite the transit and management of international relief consignments and strengthen, with the support of the United Nations and other relevant stakeholders, their capacities and readiness to improve effectiveness in responding to natural disasters;",
    "49": "Reaffirms the leading role of the Office for the Coordination of Humanitarian Affairs of the Secretariat as the focal point within the overall United Nations system for the advocacy for and coordination of humanitarian assistance among United Nations humanitarian organizations and other humanitarian partners;",
    "50": "Recognizes the importance of global and regional operational readiness and response services, networks and surge mechanisms in strengthening the A/80/L.23 25-19539 12/19 effectiveness of disaster prevention, preparedness and response, and encourages further efforts in this regard by, inter alia, strengthening partnerships with national disaster management agencies and regional organizations, within their respective mandates, and building, reinforcing and complementing their capacities, in close coordination with the United Nations and humanitarian organizations, including through improved data sharing and interoperability;",
    "51": "Welcomes the important contribution of the United Nations Disaster Assessment and Coordination system to the effectiveness of humanitarian assistance in supporting Member States, upon their request, and the United Nations system in preparedness and humanitarian response, and encourages the continued incorporation into this mechanism of experts from developing countries that are prone to natural disasters;",
    "52": "Also welcomes the important contribution of the International Search and Rescue Advisory Group to the effectiveness of international urban search and rescue assistance, and encourages Member States to continue to support the Advisory Group, in line with General Assembly resolution 57/150 of 16 December 2002;",
    "53": "Urges Member States, the United Nations system and other humanitarian actors to consider the specific and differentiated consequences of natural disasters in both rural and urban areas when designing and implementing disaster risk reduction, prevention and mitigation, preparedness, humanitarian assistance and early recovery strategies, giving special emphasis to addressing the needs of those living in rural and urban poor areas prone to natural disasters;",
    "54": "Encourages Member States, the United Nations and humanitarian and development organizations, in accordance with their respective mandates, and other relevant stakeholders to continue to take concrete action for the effective implementation of the New Urban Agenda, in order to strengthen resilience to disasters and the adverse effects of climate change, and ensure that sustainable development in urban settings is informed by disaster risk, giving special attention to the needs and capacities of persons in vulnerable situations;",
    "55": "Recognizes the important contribution of healthy ecosystems to reducing disaster risk and building community resilience, and encourages all States, United Nations entities and other relevant actors to promote ecosystem-based approaches and nature-based solutions for disaster risk reduction at all levels and across all phases of disaster risk reduction and management;",
    "56": "Welcomes the continued efforts of the Office for the Coordination of Humanitarian Affairs to build partnerships with regional organizations, traditional and non\u2011traditional donors and the private sector, and encourages Member States and the United Nations system to continue to strengthen partnerships at the global, regional, national and local levels in support of national efforts in situations of natural disasters, in order to cooperate effectively in providing humanitarian assistance to those in need and ensure that their collaborative efforts adhere to the principles of humanity, neutrality, impartiality and independence;",
    "57": "Encourages Member States, the United Nations and humanitarian and development organizations to increase efforts to engage the private sector, including small and medium-sized enterprises, through strategic partnerships in disaster risk reduction activities and disaster response and recovery, as appropriate;",
    "58": "Recognizes that information and telecommunications technology can play an important role in disaster response, encourages Member States to develop emergency response telecommunications capacities that are accessible to all, including persons with disabilities, encourages the international community to assist A/80/L.23 13/19 25-19539 the efforts of developing countries in this area, where needed, including in the recovery phase, and in this regard encourages Member States that have not acceded to or ratified the Tampere Convention on the Provision of Telecommunication Resources for Disaster Mitigation and Relief Operations13 to consider doing so;",
    "59": "Encourages the further use of space-based and ground-based remote- sensing technologies, including as provided by the United Nations Platform for Space-based Information for Disaster Management and Emergency Response (UN\u2011SPIDER), as well as the sharing of geographical data, for the forecasting, prevention, mitigation and management of natural disasters, where appropriate, and invites Member States to continue to provide their support to the consolidation of the United Nations capability in the area of satellite-derived geographical information for early warning, preparedness, response and early recovery;",
    "60": "Encourages Member States to provide all support necessary, on a voluntary basis, to UN-SPIDER, including financial support, to enable it to carry out its workplan, and reiterates the importance of enhancing international coordination and cooperation at the global level in disaster management and emergency response through greater access to and use of space-based services for all countries and by facilitating capacity-building and institutional strengthening for disaster management, in particular in developing countries;",
    "61": "Recognizes the opportunities for new technologies, when utilized in a coordinated fashion and based on humanitarian principles, potentially to improve the effectiveness and accountability of humanitarian response, and encourages Member States, the United Nations and its humanitarian partners to consider engaging, inter alia, with the volunteer and technical communities, as appropriate, in order to make use of the variety of data and information available during emergencies and disaster risk reduction efforts to strengthen the evidence-based shared understanding of disaster risk and impacts and to work to improve efficiencies in this regard;",
    "62": "Encourages the United Nations to continue to strengthen its provision of data-related services and policy advice and build the data skills of its humanitarian staff, in order to improve the effectiveness of disaster preparedness and response;",
    "63": "Encourages Member States, relevant United Nations organizations and international financial institutions to enhance the global capacity for sustainable post- disaster recovery in areas such as coordination with traditional and non\u2011traditional partners, identification and dissemination of lessons learned, development of common tools and mechanisms for recovery needs assessment, strategy development and programming, and incorporation of disaster risk reduction into all recovery processes, and welcomes the ongoing efforts to this end;",
    "64": "Encourages Member States and the United Nations system to support national initiatives that address the differentiated impacts of natural disasters on the affected population, including through the collection and analysis of data disaggregated, inter alia, by sex, age and disability, using, inter alia, the existing information provided by States, and through the development of tools, methods and procedures that will result in more timely and useful initial needs assessments that lead to targeted and more effective assistance, and taking into account the environmental impact;",
    "65": "Calls upon United Nations humanitarian organizations, in consultation with Member States, as appropriate, to strengthen the evidence base for effective humanitarian assistance by further developing common mechanisms to improve the quality, transparency and reliability of, and make further progress towards, common __________________ 13 United Nations, Treaty Series, vol. 2296, No. 40906. A/80/L.23 25-19539 14/19 humanitarian needs assessments, to assess their performance in assistance and to ensure the most effective use of humanitarian resources by these organizations;",
    "66": "Encourages Member States to take steps to develop or to improve data collection and analysis and to facilitate the exchange of relevant non\u2011sensitive information with humanitarian and development organizations of the United Nations, including through shared platforms and a common approach, in order to inform policy and measures designed to address disaster risks and their consequences, to support preparedness efforts, including forecast-based action and financing and disaster risk financing, and to improve the effectiveness and accountability of a needs-based humanitarian response, and encourages the United Nations system, as appropriate, and other relevant actors to continue to assist developing countries in their efforts to build local and national capacities for data collection and analysis;",
    "67": "Also encourages Member States, with support from the United Nations upon request, to establish and strengthen national disaster loss databases, risk profiles and available capacities and to continue to collect, share and use such data to inform relevant policies and strategies;",
    "68": "Encourages Member States, regional organizations, the United Nations and humanitarian and development organizations to continue to improve the identification, mapping and analysis of risks and vulnerabilities, including the local impact of future disaster risk drivers, and the development and implementation of appropriate strategies and programmes to anticipate and address them, including through the use of science, technology and innovation, and in this regard encourages all the relevant stakeholders to support Governments in capacity development, including at the regional and local levels, through the sharing of expertise and tools and the provision of necessary resources, as appropriate, to ensure that effective disaster management plans and capacities are in place in accordance with national priorities for disaster risk management;",
    "69": "Stresses the importance of the full and equal participation of women in decision-making and of gender mainstreaming in developing and implementing disaster risk reduction, preparedness, early action, rapid response and recovery strategies, and in this regard requests the Secretary-General to continue to ensure that gender mainstreaming is better taken into account in all aspects of humanitarian responses and activities, including the analysis of allocations and programme implementation, and through greater use of the Gender with Age Marker;",
    "70": "Encourages Member States, in cooperation with relevant United Nations humanitarian organizations, to promote women\u2019s leadership, gender equality and empowerment of women and their full and effective participation in the planning and implementation of natural disaster response strategies and humanitarian response to effectively address their specific needs, including through strengthening partnerships with, and building the capacities of, national and local institutions, including national and local women\u2019s organizations and civil society actors, as appropriate, to adopt gender-responsive programming on mitigation and adaptation to climate change and to support the resilience and adaptive capacities of women and girls to respond to and recover from adverse impacts of climate change;",
    "71": "Encourages Governments, local authorities, the United Nations system and regional organizations, and invites donors and other assisting countries, to address the vulnerabilities and capacities of women and girls through gender- responsive programming, including with regard to sexual and reproductive health needs and means to address sexual and gender-based violence and various forms of exploitation during emergencies and in post-disaster environments, and the allocation A/80/L.23 15/19 25-19539 of resources in their disaster risk reduction, response and recovery efforts in coordination with the Governments of affected countries;",
    "72": "Encourages Member States, the United Nations and humanitarian organizations to strengthen efforts to prevent, mitigate and respond to the protection risks and needs of persons affected by disasters, including by increasing funding and support for such efforts, ensuring protection capacities in surge mechanisms and enhancing the provision of basic services, especially for the most vulnerable, from the very onset of disaster;",
    "73": "Encourages Member States, humanitarian organizations and other relevant stakeholders, in the context of natural disasters, to ensure access to safe drinking water and adequate and equitable sanitation and hygiene for all, including women and girls;",
    "74": "Emphasizes the importance of mainstreaming the perspective of persons with disabilities in disaster risk reduction, and recognizes the importance of non\u2011discrimination and their inclusive and active participation in and contribution to disaster risk reduction, preparedness, emergency response, recovery and transition from relief to development, as well as the implementation of systematic approaches, policies and programmes that are inclusive of and accessible to persons with disabilities, recognizing that persons with disabilities are disproportionately affected in humanitarian emergencies and face multiple obstacles in accessing humanitarian assistance, and recalls the Charter on Inclusion of Persons with Disabilities in Humanitarian Action;",
    "75": "Encourages efforts to provide safe and enabling learning environments and access to quality education for all, especially for girls and boys, in humanitarian emergencies caused by natural disasters, including in order to contribute to a smooth transition from relief to development;",
    "76": "Also encourages efforts to strengthen the disaster resilience and safety of schools, reduce interruptions to education during natural disasters, including interruptions to school meals, and in this regard encourages international support to countries that are vulnerable to natural hazards, as appropriate;",
    "77": "Encourages Member States, the United Nations and humanitarian organizations to incorporate mental health and psychosocial support services into disaster preparedness, response and recovery;",
    "78": "Encourages Member States and relevant regional and international organizations to identify and improve the dissemination of best practices, including in the context of COVID\u201119, for improving disaster preparedness, response and early recovery and to scale up successful local initiatives, as appropriate;",
    "79": "Requests the United Nations humanitarian and development organizations to improve their coordination of disaster recovery efforts, from relief to development, inter alia, by strengthening institutional, coordination and strategic planning efforts in disaster preparedness, resilience-building and recovery, in support of national authorities, and by ensuring that development actors participate in strategic planning at an early stage;",
    "80": "Encourages the United Nations and humanitarian and development organizations to support national, subnational and local governments and communities in their responsibility to develop long-term strategies, forecast-based financing and preparedness systems and multi-year operational plans for preparedness that are embedded within disaster risk reduction and resilience strategies in line with the Sendai Framework; A/80/L.23 25-19539 16/19",
    "81": "Calls upon the United Nations system and other humanitarian actors to improve the dissemination of tools and services to support enhanced disaster risk reduction, in particular preparedness, early action, rapid response and early recovery;",
    "82": "Calls upon relevant United Nations humanitarian and development organizations, in consultation with Member States, to strengthen tools and mechanisms to ensure that early recovery needs and support are integrated into the planning and implementation of disaster preparedness, humanitarian response and development cooperation activities, as appropriate;",
    "83": "Encourages the United Nations system and humanitarian organizations to continue their efforts to mainstream early recovery into humanitarian programming, acknowledges that early recovery is an important step towards resilience-building and should receive further funding, and encourages the provision of timely, flexible and predictable funding for early recovery, including through established and complementary humanitarian and development instruments;",
    "84": "Urges Member States, the United Nations and humanitarian and development organizations to prioritize risk management and shift towards an anticipatory approach to humanitarian crises in order to prevent and reduce human suffering and economic losses; and encourages scaling up of early warning and early action systems, forecasting, prevention-oriented responses and emergency preparedness, strengthening of their coordination, coherence, complementarity and impact, and an increase in the use of disaster risk analysis, climate science, predictive analytics, reinforcing systematic risk monitoring and the sharing of data and analysis across sectors and at all levels to better prevent and address disaster and climate risks and impacts;",
    "85": "Also urges Member States, as well as the United Nations, and humanitarian organizations, in accordance with their respective mandates and in line with humanitarian principles, to continue to scale up anticipatory approaches, early warning early action systems, forecasting, prevention-oriented responses and emergency preparedness, and improve predictive and risk data analytics across sectors, reinforce systematic risk monitoring, early warning and preparedness capacities at the local, national, regional and global levels, including, inter alia, the use of anticipatory financing approaches for humanitarian emergencies, and to consider further efforts by the United Nations humanitarian system and other relevant stakeholders in this regard;",
    "86": "Recalls its decision to hold a midterm review of the implementation of the Sendai Framework in 2023, and in this regard welcomes the convening of the high- level meeting on the midterm review of the Sendai Framework on 18 and 19 May 2023, at which the General Assembly adopted the political declaration on the midterm review of the Sendai Framework;14",
    "87": "Encourages international financial institutions to accelerate anticipatory financing at scale for preparedness and response as well as for risk-informed resilient recovery, including pre\u2011agreed contingency financing, in ways that complement and reinforce humanitarian pooled funds;",
    "88": "Urges Member States, humanitarian and development organizations and other stakeholders to ensure a comprehensive and coherent approach at the global, regional, national and local levels to El Ni\u00f1o and La Ni\u00f1a phenomena and similar or related events, including by strengthening forecasting, early warning and early action, prevention, preparedness, resilience-building and timely response, supported by effective leadership and predictable, adequate and early funding, when feasible, in __________________ 14 Resolution 77/289, annex. A/80/L.23 17/19 25-19539 regions, countries and communities likely to be affected, and notes the work of the Special Envoys of the Secretary-General on El Ni\u00f1o and Climate and the blueprint for action prepared by them, and the standard operating procedures for El Ni\u00f1o/ Southern Oscillation events of the Inter-Agency Standing Committee;",
    "89": "Notes that the El Ni\u00f1o/La Ni\u00f1a phenomenon has a recurring character and can lead to extensive natural hazards with the potential to seriously affect populations, encourages Member States, humanitarian and development organizations and other stakeholders, in accordance with their respective mandates, to increase support, including financial, technical and capacity-building, as appropriate, for people and communities affected by and most vulnerable to these phenomena, including to meet and reduce humanitarian needs, and to prevent and address loss of livelihoods, increased food insecurity, and impacts on health, water and sanitation, education, agriculture and other sectors, and encourages increased cooperation with regional and subregional organizations and international financial institutions, and further encourages increased investment in national and local response mechanisms, climate adaptation and community resilience;",
    "90": "Encourages Member States and the United Nations to enhance the use of common risk analysis, including the use of the Index for Risk Management, to establish the evidence base for short-, medium- and long-term planning and joint strategies for disaster and climate risk management, capacity development and resilience-building, allowing for greater prioritization of resources where the risk is greatest;",
    "91": "Encourages the United Nations and humanitarian and development organizations to work towards a common understanding of underlying risks, clarify roles and responsibilities according to their respective mandates and establish joint objectives and programmes informed by affected people, data and analysis to strengthen coordination, collaboration and coherence among short-, medium- and long-term activities to progressively reduce needs and vulnerability, build resilience and manage the risk related to climate change and of disasters and development setbacks over multi-year planning cycles, including through integrating risk management into national sustainable development plans and ensuring the connectivity of humanitarian plans with the longer-term sustainable development priorities of Member States, with a view to achieving the Sustainable Development Goals;",
    "92": "Stresses the need to strengthen resilience at all levels, and in this regard encourages Member States, the United Nations system and other relevant actors to support efforts, as appropriate, to integrate resilience into humanitarian and development programming, and encourages humanitarian and development actors to pursue, where appropriate, common resilience and risk management objectives, achievable through joint analysis, planning, programming and funding;",
    "93": "Encourages Member States, international financial institutions and the private sector to support further development and, where appropriate, the strengthening of anticipatory financing approaches, to mobilize predictable and multi-year support and to work collectively towards common results in order to reduce need, risk and vulnerability, making use of a wide range of financing flows and instruments and partnerships to mobilize additional resources in the field of natural disasters;",
    "94": "Calls upon Member States, the United Nations and humanitarian organizations to provide emergency assistance in ways that are supportive of recovery and long-term development, in collaboration with development organizations, as appropriate, in accordance with their respective mandates, including by prioritizing humanitarian tools and approaches that strengthen resilience, including preparedness, A/80/L.23 25-19539 18/19 and support livelihoods, and to support further development and, where appropriate, the strengthening of anticipatory financing approaches, such as, but not limited to, cash transfers, vouchers, local procurement of food and services and social safety nets;",
    "95": "Encourages the United Nations system and other relevant humanitarian and development actors to support humanitarian coordinators and resident coordinators in order to strengthen their capacity, inter alia, to support the host Government in implementing preparedness measures and to coordinate preparedness activities of country teams in support of national efforts, and encourages the United Nations system and other relevant humanitarian actors to further strengthen the ability to quickly and flexibly deploy humanitarian professionals to support Governments and country teams in the immediate aftermath of a disaster;",
    "96": "Encourages Member States, the United Nations and humanitarian and development organizations to identify ways to improve the current financing architecture in order to better provide coherent, predictable and flexible longer-term funding for risk management in multi-year strategies and forecasting, in particular preparedness, on the basis of a global assessment of risk, allowing for better prioritization of resources where the risk is greatest;",
    "97": "Recognizes that enhanced access to international climate finance is important to support mitigation and adaptation efforts in developing countries, especially those that are particularly vulnerable to the adverse effects of climate change, and also recognizes the ongoing efforts in this regard;",
    "98": "Urges Member States, international financial institutions and other relevant stakeholders to scale up finance for adaptation and disaster risk reduction to countries and local communities that are affected by compound risks caused by humanitarian emergencies and vulnerability to natural hazards and the adverse effects of climate change to prevent, mitigate, adapt and respond to disaster impacts, to reduce humanitarian needs, risks and vulnerabilities related to disasters and to build resilience to shocks;",
    "99": "Emphasizes the need to mobilize adequate, flexible and sustainable resources for preparedness and disaster risk reduction, early action, rapid response and early recovery activities in order to ensure predictable and timely access to resources for humanitarian assistance in emergencies resulting from disasters associated with natural hazards;",
    "100": "Calls upon donors to fund humanitarian response plans and flash appeals for disaster responses in order to further reinforce the effectiveness, sustainability, predictability and timely delivery of humanitarian assistance to people affected by disasters, including those in hard-to-reach areas, and to scale up timely and predictable funding and innovative and anticipatory financing mechanisms, as well as by strengthening partnerships with international financial institutions in order to prevent, reduce and respond to humanitarian suffering and assist those in need;",
    "101": "Welcomes the important achievements of the Central Emergency Response Fund in ensuring a more timely and predictable response to humanitarian emergencies, stresses the importance of continuing to improve the functioning of the Fund, and in this regard encourages the United Nations funds and programmes and the specialized agencies to review and evaluate, where necessary, their partnership policies and practices in order to ensure the timely disbursement of funds from the Fund to implementing partners in order to ensure that resources are used in the most efficient, effective, accountable and transparent manner possible; A/80/L.23 19/19 25-19539",
    "102": "Calls upon all Member States, and invites the private sector and all concerned individuals and institutions, to consider increasing their voluntary contributions to the Central Emergency Response Fund in order to achieve an annual funding level of 1 billion United States dollars, and to continue to reinforce and strengthen the Fund as the global emergency response fund, and emphasizes that contributions should be additional to current commitments to humanitarian programming and should not be to the detriment of resources made available for international cooperation for development;",
    "103": "Also calls upon Member States to continue to increase support to the Central Emergency Response Fund and humanitarian country-based and regional pooled funds for strengthening early and rapid response to mitigate the impact of disasters, including in underfunded contexts and increasingly through local and national responders and implementing partners;",
    "104": "Invites Member States, the private sector and all other relevant stakeholders to harness their differentiated skills, capacities and resources, and also to consider voluntary contributions to humanitarian funding mechanisms;",
    "105": "Strongly encourages giving appropriate consideration to disaster risk reduction, including preparedness, and the building of resilience to disasters as integral elements of sustainable development and in the implementation of the 2030 Agenda for Sustainable Development, the Addis Ababa Action Agenda of the Third International Conference on Financing for Development15 and the Sevilla Commitment of the Fourth International Conference on Financing for Development 16 and promoting a complementary and coherent approach between those frameworks and the Sendai Framework;",
    "106": "Strongly encourages all relevant actors to work to ensure a comprehensive, coherent, systematic and people-centred approach to managing risks, including through, as appropriate, the 2030 Agenda for Sustainable Development, the Sendai Framework, the Paris Agreement and the New Urban Agenda;",
    "107": "Takes note of the World Humanitarian Summit, held in Istanbul, Turkey, on 23 and 24 May 2016, and of the report of the Secretary-General on the outcome of the World Humanitarian Summit;17",
    "108": "Requests the Secretary-General to continue to improve the international response to natural disasters and to report thereon to the General Assembly at its eighty-first session and to include in his report recommendations on how to ensure that humanitarian assistance is provided in ways supportive of the transition from relief to development. __________________ 15 Resolution 69/313, annex. 16 Resolution 79/323, annex. 17 A/71/353."
  },
  "agenda_items": [
    "Item 72"
  ],
  "symbol_references": [
    "A/80/L.23"
  ]
}