{
  "symbol": "A/80/L.13",
  "filename": "A_80_L.13.pdf",
  "title": "Agreement under the United Nations Convention on the Law of the Sea on the Conservation and Sustainable Use of Marine Biological Diversity of Areas beyond National Jurisdiction",
  "text": "United Nations \nA/80/L.13\n \n \nGeneral Assembly \nDistr.: Limited \n13 November 2025 \nOriginal: English \n \n25-18441 (E)    201125 \n*2518441* \n \n \nEightieth session \nAgenda item 75 (b) \nOceans and the law of the sea: Agreement under the United Nations \nConvention on the Law of the Sea on the Conservation and \nSustainable Use of Marine Biological Diversity of Areas beyond \nNational Jurisdiction \n \n \n \n \n \nAlbania, Antigua and Barbuda, Armenia, Australia, Austria, Bahamas (The), \nBangladesh, Barbados, Belgium, Belize, Bosnia and Herzegovina, Botswana, \nBrazil, Bulgaria, Burundi, Cabo Verde, Cameroon, Canada, Chile, Colombia, \nCosta Rica, C\u00f4te d\u2019Ivoire, Croatia, Cyprus, Democratic Republic of the Congo, \nDenmark, Djibouti, Dominica, Dominican Republic, Egypt, Equatorial Guinea, \nEstonia, Fiji, Finland, France, Gabon, Gambia, Germany, Ghana, Greece, \nGrenada, Guinea, Guyana, Honduras, Hungary, Iceland, Indonesia, Ireland, \nItaly, Jamaica, Japan, Jordan, Kenya, Kiribati, Kyrgyzstan, Latvia, Lebanon, \nLithuania, Luxembourg, Madagascar, Maldives, Malta, Marshall Islands, \nMauritania, Mauritius, Mexico, Micronesia (Federated States of), Monaco, \nMongolia, Montenegro, Morocco, Mozambique, Nauru, Netherlands (Kingdom \nof the), New Zealand, Nigeria, North Macedonia, Norway, Palau, Papua New \nGuinea, Philippines, Poland, Portugal, Republic of Korea, Republic of \nMoldova, Romania, Saint Kitts and Nevis, Saint Lucia, Saint Vincent and the \nGrenadines, Senegal, Seychelles, Sierra Leone, Singapore, Slovakia, Slovenia, \nSolomon Islands, South Africa, Spain, Sri Lanka, State of Palestine, Suriname, \nSweden, Switzerland, Thailand, Timor-Leste, Tonga, Tuvalu, Uganda, Ukraine, \nUnited Kingdom of Great Britain and Northern Ireland, Uruguay, Vanuatu, \nViet Nam and Zambia:* draft resolution \n \n \n \n Agreement under the United Nations Convention on the Law of \nthe Sea on the Conservation and Sustainable Use of Marine \nBiological Diversity of Areas beyond National Jurisdiction \n \n \n \nThe General Assembly, \n \nRecalling its resolution 72/249 of 24 December 2017, in which it decided to \nconvene an intergovernmental conference, under the auspices of the United Nations, \nto consider the recommendations of the Preparatory Committee established by \nresolution 69/292 of 19 June 2015 on the elements and to elaborate the text of an \ninternational legally binding instrument under the United Nations Convention on the \nLaw of the Sea1 on the conservation and sustainable use of marine biological diversity \n__________________ \n \n* Any changes to the list of sponsors will be reflected in the official record of the meeting. \n \n1  United Nations, Treaty Series, vol. 1833, No. 31363. \n\nA/80/L.13 \n \n25-18441\n2/3 \n \nof areas beyond national jurisdiction, with a view to developing the instrument as \nsoon as possible, and other relevant resolutions and decisions relating to the \nconvening of sessions of the conference,2 \n \nRecalling also the adoption by the conference, on 19 June 2023, of the \nAgreement under the United Nations Convention on the Law of the Sea on the \nConservation and Sustainable Use of Marine Biological Diversity of Areas beyond \nNational Jurisdiction,3 by consensus,  \n \nRecalling further its resolution 77/321 of 1 August 2023, resolution 78/272 of \n24 April 2024, resolution 79/271 of 4 March 2025 and decision 78/560 of 13 August \n2024 on the Agreement,  \n \nUnderscoring the importance of the work of the preparatory commission \nestablished by resolution 78/272 to prepare for the entry into force of the Agreement \nand to prepare for the convening of the first meeting of the Conference of the Parties \nto the Agreement,  \n \nNoting that the conditions for the entry into force of the Agreement were met \nand that it will enter into force on 17 January 2026 pursuant to its article 68, paragraph \n1, following the deposit of the sixtieth instrument of ratification, approval, acceptance \nor accession on 19 September 2025,  \n \nNoting also that the first meeting of the Conference of the Parties shall be \nconvened by the Secretary-General of the United Nations no later than one year after \nthe entry into force of the Agreement pursuant to its article 47, paragraph 2, \n \n1. \nWelcomes the holding of the first and second sessions of the Preparatory \nCommission for the Entry into Force of the Agreement under the United Nations \nConvention on the Law of the Sea on the Conservation and Sustainable Use of Marine \nBiological Diversity of Areas beyond National Jurisdiction and the Convening of the \nFirst Meeting of the Conference of the Parties to the Agreement from 14 to 25 April \nand from 18 to 29 August 2025, respectively, and recalls that a third session will be \nconvened from 23 March to 2 April 2026;  \n \n2. \nTakes note of the statements by the Co-Chairs of the Preparatory \nCommission at the closing of the first and second sessions of the Commission; 4 \n \n3. \nWelcomes the upcoming entry into force of the Agreement on 17 January \n2026; \n \n4. \nEmphasizes the importance of the effective implementation of the \nAgreement;  \n \n5. \nTakes note of the signatures and ratifications of the Agreement to date; \n \n6. \nRequests the Secretary-General to convene the first meeting of the \nConference of the Parties to the Agreement for at least 10 working days by 17 January \n2027, on dates and for a duration to be determined in consultation with the Co-Chairs \nand the Bureau of the Preparatory Commission, with full conference services, \nincluding documentation, provision for parallel meetings and overtime, webcast and \npress and meeting coverage;  \n \n7. \nCalls upon all States and regional economic integration organizations that \nhave not done so to consider becoming Parties to the Agreement at the earliest \npossible date;  \n__________________ \n \n2  Resolutions 75/239 and 77/248 and decisions 74/543, 75/570, 76/564 and 77/556. \n \n3  A/CONF.232/2023/4. \n \n4  A/AC.296/2025/9 and A/AC.296/2025/19. \n\nA/80/L.13\n \n3/3\n25-18441 \n \n \n8. \nRequests the Secretary-General to continue to administer the voluntary \ntrust fund established pursuant to resolution 69/292 for the purpose of assisting \ndeveloping countries, in particular the least developed countries, landlocked \ndeveloping countries and small island developing States, as expanded in resolution \n78/272, in attending the meetings of the Conference of the Parties;5 \n \n9. \nInvites Member States, international financial institutions, donor agencies, \nintergovernmental organizations, non\u2011governmental organizations and natural and \njuridical persons to make financial contributions to the voluntary trust fund, and \nexpresses its appreciation to those that have contributed; \n \n10. Notes with appreciation the capacity-building and technical assistance \nactivities of States, regional economic integration organizations, the Division for \nOcean Affairs and the Law of the Sea of the Office of Legal Affairs of the Secretariat, \nand other relevant United Nations entities and intergovernmental organizations within \ntheir respective mandates, in relation to the Agreement, taking note also of the \ncontributions of other relevant stakeholders in this regard, and encourages the further \nundertaking of such activities; \n \n11. Recalls its invitation to States to provide information to the Secretary-\nGeneral on their capacity-building and technical assistance needs with a view to \nbecoming Parties to the Agreement to inform the further development and provision \nof capacity-building and technical assistance activities of the Division in support of \nrequesting States becoming Parties to the Agreement and the effective \nimplementation of the Agreement;  \n \n12. Decides to include in the provisional agenda of its eighty-first session, \nunder the item entitled \u201cOceans and the law of the sea\u201d, the sub-item entitled \n\u201cAgreement under the United Nations Convention on the Law of the Sea on the \nConservation and Sustainable Use of Marine Biological Diversity of Areas beyond \nNational Jurisdiction\u201d, and to hold the informal consultations concerning the \nresolution on the Agreement for one day in October.  \n \n__________________ \n \n5  See resolutions 69/292 and 78/272. \n",
  "paragraphs": {
    "1": "Welcomes the holding of the first and second sessions of the Preparatory Commission for the Entry into Force of the Agreement under the United Nations Convention on the Law of the Sea on the Conservation and Sustainable Use of Marine Biological Diversity of Areas beyond National Jurisdiction and the Convening of the First Meeting of the Conference of the Parties to the Agreement from 14 to 25 April and from 18 to 29 August 2025, respectively, and recalls that a third session will be convened from 23 March to 2 April 2026;",
    "2": "Takes note of the statements by the Co-Chairs of the Preparatory Commission at the closing of the first and second sessions of the Commission; 4",
    "3": "Welcomes the upcoming entry into force of the Agreement on 17 January 2026;",
    "4": "Emphasizes the importance of the effective implementation of the Agreement;",
    "5": "Takes note of the signatures and ratifications of the Agreement to date;",
    "6": "Requests the Secretary-General to convene the first meeting of the Conference of the Parties to the Agreement for at least 10 working days by 17 January 2027, on dates and for a duration to be determined in consultation with the Co-Chairs and the Bureau of the Preparatory Commission, with full conference services, including documentation, provision for parallel meetings and overtime, webcast and press and meeting coverage;",
    "7": "Calls upon all States and regional economic integration organizations that have not done so to consider becoming Parties to the Agreement at the earliest possible date; __________________ 2 Resolutions 75/239 and 77/248 and decisions 74/543, 75/570, 76/564 and 77/556. 3 A/CONF.232/2023/4. 4 A/AC.296/2025/9 and A/AC.296/2025/19. A/80/L.13 3/3 25-18441",
    "8": "Requests the Secretary-General to continue to administer the voluntary trust fund established pursuant to resolution 69/292 for the purpose of assisting developing countries, in particular the least developed countries, landlocked developing countries and small island developing States, as expanded in resolution 78/272, in attending the meetings of the Conference of the Parties;5",
    "9": "Invites Member States, international financial institutions, donor agencies, intergovernmental organizations, non\u2011governmental organizations and natural and juridical persons to make financial contributions to the voluntary trust fund, and expresses its appreciation to those that have contributed;",
    "10": "Notes with appreciation the capacity-building and technical assistance activities of States, regional economic integration organizations, the Division for Ocean Affairs and the Law of the Sea of the Office of Legal Affairs of the Secretariat, and other relevant United Nations entities and intergovernmental organizations within their respective mandates, in relation to the Agreement, taking note also of the contributions of other relevant stakeholders in this regard, and encourages the further undertaking of such activities;",
    "11": "Recalls its invitation to States to provide information to the Secretary- General on their capacity-building and technical assistance needs with a view to becoming Parties to the Agreement to inform the further development and provision of capacity-building and technical assistance activities of the Division in support of requesting States becoming Parties to the Agreement and the effective implementation of the Agreement;",
    "12": "Decides to include in the provisional agenda of its eighty-first session, under the item entitled \u201cOceans and the law of the sea\u201d, the sub-item entitled \u201cAgreement under the United Nations Convention on the Law of the Sea on the Conservation and Sustainable Use of Marine Biological Diversity of Areas beyond National Jurisdiction\u201d, and to hold the informal consultations concerning the resolution on the Agreement for one day in October. __________________ 5 See resolutions 69/292 and 78/272."
  },
  "agenda_items": [
    "Item 75"
  ],
  "symbol_references": [
    "A/80/L.13"
  ]
}