{
  "symbol": "A/C.3/80/L.64",
  "filename": "A_C.3_80_L.64.pdf",
  "title": "Rights of the child",
  "text": "United Nations \nA/C.3/80/L.64 \n \n \nGeneral Assembly \nDistr.: Limited \n14 November 2025 \nOriginal: English \n \n25-18550 (E)    171125     \n*2518550* \n \n \nEightieth session \nThird Committee \nAgenda item 67 \nPromotion and protection of the rights of children \n \n \n \n \n \nBurundi: amendment to revised draft resolution A/C.3/80/L.20/Rev.1 \n \n \n \n Rights of the child \n \n \n1. \nIn operative paragraph 13, delete \u201csexual and reproductive health,\u201d. \n2. \nIn operative paragraphs 27 and 43, delete \u201csexual and reproductive\u201d. \n3. \nIn operative paragraph 46, delete \u201cincluding sexual and reproductive health,\u201d. \n \n",
  "paragraphs": {
    "1": "In operative paragraph 13, delete \u201csexual and reproductive health,\u201d.",
    "2": "In operative paragraphs 27 and 43, delete \u201csexual and reproductive\u201d.",
    "3": "In operative paragraph 46, delete \u201cincluding sexual and reproductive health,\u201d."
  },
  "agenda_items": [
    "Item 67"
  ],
  "symbol_references": [
    "A/C.3/80/L.64",
    "A/C.3/80/L.20"
  ]
}