{
  "symbol": "A/C.4/80/L.16",
  "filename": "A_C.4_80_L.16.pdf",
  "title": "Operations of the United Nations Relief and Works Agency for Palestine Refugees in the Near East",
  "text": "United Nations \nA/C.4/80/L.16 \n \n \nGeneral Assembly \nDistr.: Limited \n11 November 2025 \nOriginal: English \n \n25-18253 (E)    181125 \n*2518253* \n \n \nEightieth session \nSpecial Political and Decolonization Committee \n(Fourth Committee) \nAgenda item 49 \nUnited Nations Relief and Works Agency for Palestine \nRefugees in the Near East \n \n \n \nBangladesh, Colombia, Egypt, Guyana, Indonesia, Iraq, Jordan, Kuwait, \nMalaysia, Mauritania, Morocco, Oman, Pakistan, Qatar, Saudi Arabia, Somalia, \nSouth Africa, Sudan, Viet Nam, Yemen and State of Palestine: draft resolution \n \n \nOperations of the United Nations Relief and Works Agency for \nPalestine Refugees in the Near East \n \n \n \nThe General Assembly, \n \nRecalling its resolutions 194 (III) of 11 December 1948, 212 (III) of 19 November \n1948, 302 (IV) of 8 December 1949 and all subsequent related resolutions, including \nits resolutions 78/73 of 7 December 2023, ES-10/25 of 11 December 2024 and \nES-10/27 of 12 June 2025,  \n \nRecalling also the relevant resolutions of the Security Council,  \n \nRecalling further Security Council resolution 2730 (2024) of 24 May 2024 on \nthe protection of humanitarian personnel and United Nations and associated personnel \nand all other relevant resolutions, \n \nHaving considered the report of the Commissioner-General of the United \nNations Relief and Works Agency for Palestine Refugees in the Near East covering \nthe period from 1 January to 31 December 2024,1  \n \nTaking note of the letter dated 26 June 2025 from the Chair of the Advisory \nCommission of the Agency addressed to the Commissioner-General,2  \n \nHaving considered the advisory opinion of the International Court of Justice, \nrendered on 22 October 2025, concerning the obligations of Israel in relation to the \npresence and activities of the United Nations, other international organizations and \nthird States in and in relation to the Occupied Palestinian Territory, \n__________________ \n \n1  Official Records of the General Assembly, Seventy-ninth Session, Supplement No. 13 (A/80/13). \n \n2  Ibid., pp. 7 and 8. \n\nA/C.4/80/L.16 \n \n25-18253\n2/12 \n \n \nRecalling the New York Declaration on the Peaceful Settlement of the Question \nof Palestine and the Implementation of the Two-State Solution, which was endorsed \nby the General Assembly in its decision 80/506 of 12 September 2025, 3  and \nunderlined, inter alia, the indispensable role of UNRWA, and expressed the \ncommitment to continue supporting, including through the appropriate funding, the \nAgency in the implementation of its mandate and welcomed its commitment and \nongoing efforts to implement the recommendations of the Colonna Report, \n \nEmphasizing the vital role of the Agency in providing essential education, \nhealth, relief and social services programmes to Palestine refugees, as well as life-\nsaving humanitarian assistance in all the fields of operation, in Jordan, Lebanon, the \nSyrian Arab Republic and the Occupied Palestinian Territory, namely in the Gaza \nStrip and the West Bank, including East Jerusalem, \n \nRecalling its resolutions 2252 (ES-V) of 4 July 1967 and 2341 B (XXII) of \n19 December 1967 and all subsequent related resolutions, recalling also Security \nCouncil resolutions 237 (1967) of 14 June 1967 and 259 (1968) of 27 September \n1968, stressing the necessity of an accelerated return of displaced persons, and calling \nfor compliance with the mechanism agreed upon by the parties in article XII of the \nDeclaration of Principles on Interim Self-Government Arrangements of 13 September \n19934 on the return of displaced persons, \n \nAware of the continuing needs of the Palestine refugees in all fields of operation \nin Jordan, Lebanon, the Syrian Arab Republic and the Occupied Palestinian Territory, \n \nExpressing grave concern at the especially dire situation of the Palestine \nrefugees in the Gaza Strip and the West Bank, including East Jerusalem, including \nwith regard to their safety, well-being and socioeconomic living conditions, \n \nExpressing grave concern also at the catastrophic humanitarian situation of the \nPalestine refugees in the Gaza Strip as a result of military attacks, severe restrictions \non humanitarian access, mass forced displacement, spread of acute malnutrition and \nfamine, disease and poverty, mass destruction of civilian infrastructure, including \nhomes, refugee camps, hospitals and Agency schools and facilities serving as shelters \nfor displaced persons, and loss of learning and livelihoods, \n \nExpressing grave concern further about the extremely difficult socioeconomic \nconditions being faced by the Palestine refugees in the West Bank, including East \nJerusalem, as a result of the recurrent Israeli military operations, settler violence, \nsevere movement restrictions, the construction of settlements and the wall, evictions, \nand the demolition of homes and livelihood properties causing forced transfers of \ncivilians, \n \nHaving considered the letter dated 28 October 2024 from the Secretary-General \naddressed to the President of the General Assembly5 bringing to the attention of the \nGeneral Assembly, on an urgent basis, developments which could prevent the Agency \nfrom continuing its essential work in the Occupied Palestinian Territory, including \nEast Jerusalem, as mandated by the Assembly, and seeking its guidance and support,  \n \nHaving considered also the letter dated 28 October 2024 from the Commissioner-\nGeneral addressed to the President of the General Assembly warning, inter alia, that \n\u201cthe Agency is under such physical, political and operational attack \u2013 unprecedented \nin United Nations history \u2013 that implementation of its mandate may become \nimpossible without decisive intervention by the General Assembly\u201d, \n__________________ \n \n3  Decision 80/506. \n \n4  A/48/486-S/26560, annex. \n \n5  A/79/558. \n\nA/C.4/80/L.16\n \n3/12\n25-18253 \n \n \nHaving considered further the letter dated 31 December 2024 from the \nSecretary-General addressed to the President of the General Assembly, in response to \nresolution ES-10/26 of 11 December 2024, calling upon all parties to enable the \nAgency to carry out its mandate, as adopted by the General Assembly, in all areas of \noperation, with full respect for the humanitarian principles of humanity, neutrality, \nimpartiality and independence, and to respect international humanitarian law, \nincluding the protection of United Nations and humanitarian facilities, \n \nCondemning the killing, injury and detention contrary to international law of \nAgency staff, the attacks affecting its facilities in the Gaza Strip and its compound in \noccupied East Jerusalem, and incitement against the Agency, and demanding the \ncessation of all such actions, \n \nDeploring the endangerment of the safety of the Agency\u2019s staff and the \nunprecedented high number of casualties inflicted on Agency personnel in the Gaza \nStrip by military attacks, any breaches of the inviolability of United Nations premises, \nand the damage and destruction caused to the facilities and properties of the Agency, \nincluding schools sheltering displaced civilians, stressing the need to maintain the \nneutrality and safeguard the inviolability of United Nations premises, installations \nand equipment and the immunity of its personnel, and stressing the imperative of \nensuring accountability, \n \nDeploring also the measures taken by Israel, the occupying Power, against the \nAgency, including the \u201cLaw to Cease UNRWA Operations\u201d and \u201cLaw to Cease \nUNRWA Operations in the State of Israel\u201d, adopted on 28 October 2024 and enacted \nas of 30 January 2025, undermining the delivery of humanitarian assistance to \nPalestine refugees in the Occupied Palestinian Territory, including in the Gaza Strip, \nand forcing the evacuation of the international staff of the Agency and the closure of \nits schools in East Jerusalem, \n \nRecalling the affirmation by the International Court of Justice in its advisory \nopinion of 22 October 2025 that Israel is prohibited from taking actions contrary to \nits obligations under articles V and VI of the Convention on the Privileges and \nImmunities of the United Nations6 against United Nations officials and experts on \nmissions operating in and in relation to the Occupied Palestinian Territory, \n \nRecalling also the Court\u2019s affirmation that Israel must refrain from extending its \ndomestic laws to the occupied territory in any manner inconsistent with its obligation \nnot to impede the Palestinian people from exercising its right to self-determination, \n \nDeeply concerned about the continuing imposition of restrictions on the \nfreedom of movement and access of Agency personnel, vehicles and goods, the injury, \nharassment and intimidation of the Agency staff, and denial of entry visas to Agency \nstaff, which undermine and obstruct the work of the Agency, including its ability to \nprovide life-saving assistance and essential basic and emergency services in \naccordance with its mandate,  \n \nDeeply concerned also about attempts to discredit the Agency, as well as \nattempts to undermine and terminate its operations in the Occupied Palestinian \nTerritory, including East Jerusalem, despite its proven operational capacity, record of \neffective provision of humanitarian and development assistance and consistent \nimplementation of its mandate in accordance with relevant resolutions and its \nregulatory framework, even under the most difficult circumstances, and stressing the \nneed to safeguard its vital humanitarian and development work and to enable the \n__________________ \n \n6  Resolution 22 A (I). \n\nA/C.4/80/L.16 \n \n25-18253\n4/12 \n \nAgency to fully implement its mandate in support of Palestine refugees without \ninterference, \n \nTaking note of the strategic assessment of the Agency commissioned by the \nSecretary-General in the context of the UN80 Initiative, which highlighted the critical \nrole of the Agency in providing basic services to millions of refugees in Gaza, the West \nBank, Jordan, Lebanon and the Syrian Arab Republic and the international community\u2019s \nreliance on the Agency as an effective and immediate response mechanism for \nemergencies, providing relief and assistance not only to Palestine refugees but to all in \nneed, contributing to both humanitarian response and regional stability, \n \nRecalling the Independent Review of Mechanisms and Procedures to Ensure \nAdherence by UNRWA to the Humanitarian Principle of Neutrality, led by Catherine \nColonna, and its findings, welcoming the commitment affirmed by the Secretary-\nGeneral and the Agency to fully implement its recommendations, and stressing the \nneed to provide the Agency with the required resources for implementation, \n \nUnderscoring the importance of the Agency continuing to take timely and \nappropriate measures to address any credible allegations, and to ensure accountability \nfor any violations of the Agency\u2019s policies related to the principles of neutrality, \nhumanity, impartiality and independence, \n \nTaking note of the finding in the advisory opinion of the International Court of \nJustice of 22 October 2025 that the United Nations response to alleged violations of \nthe Agency\u2019s neutrality by individual staff may be a strong indicator of the neutrality \nof the Agency as a whole, \n \nAffirming the need for accountability and compensation to victims of violations \nof international law in accordance with international standards by all sides, \n \nReaffirming the applicability of the Geneva Convention relative to the \nProtection of Civilian Persons in Time of War, of 12 August 1949,7 to the Palestinian \nterritory occupied since 1967, including East Jerusalem, and underscoring the \nobligations of Israel thereunder as the occupying Power,  \n \nRecalling Articles 100, 104 and 105 of the Charter of the United Nations and \nthe Convention on the Privileges and Immunities of the United Nations, \n \nRecalling also the Convention on the Safety of United Nations and Associated \nPersonnel, 8  Security Council resolution 2730 (2024) and all relevant resolutions \nconcerning the safety and security of United Nations and humanitarian personnel, \nincluding General Assembly resolution 78/118 of 8 December 2023, as well as \nSecurity Council resolutions on the protection of humanitarian personnel and United \nNations and associated personnel, including resolution 2175 (2014) of 29 August \n2014 and resolution 2730 (2024), \n \nDeeply concerned about the extremely critical financial situation of the Agency, \ncaused by the structural underfunding of the Agency, as well as by rising needs and \nexpenditures resulting from the deterioration of the socioeconomic and humanitarian \nconditions and the conflicts and rising instability in the region and their significant \nnegative impact on the ability of the Agency to deliver essential services to the \nPalestine refugees, including its emergency, recovery, reconstruction and development \nprogrammes in all fields of operation, \n \nTaking note of the report of the Secretary-General on the operations of the \nUnited Nations Relief and Works Agency for Palestine Refugees in the Near East, 9 \n__________________ \n \n7  United Nations, Treaty Series, vol. 75, No. 973. \n \n8  Ibid., vol. 2051, No. 35457. \n \n9  A/71/849. \n\nA/C.4/80/L.16\n \n5/12\n25-18253 \n \nsubmitted pursuant to resolution 71/93 of 6 December 2016, and the request contained \ntherein for broad consultations to explore all ways and means, including through \nvoluntary and assessed contributions, to ensure that the Agency\u2019s funding is \nsufficient, predictable and sustained for the duration of its mandate, and considering \nthe recommendations contained in the report, \n \nTaking note also of the report of 31 May 2025 of the Commissioner-General, \nsubmitted pursuant to paragraph 57 of the report of the Secretary-General and in follow-\nup to the update to the special report of 3 August 2015 of the Commissioner-General,10 \nsubmitted pursuant to paragraph 21 of General Assembly resolution 302 (IV), \nregarding the severe financial crisis of the Agency and the negative implications for \nthe continued delivery of core Agency programmes to the Palestine refugees in all \nfields of operation, \n \nExpressing appreciation for the efforts of donors and host countries to respond \nto the Agency\u2019s unprecedented financial crisis, including through generous, additional \ncontributions and, where possible, continued increases in voluntary contributions and \nagreements for multi-year funding, while acknowledging the steadfast support of all \nother donors to the Agency, \n \nWelcoming the contributions made to the Agency\u2019s emergency appeals, \nincluding to address the catastrophic humanitarian situation in the Gaza Strip, and \ncalling urgently upon the international community to continue its support in light of \nthe immense needs and the fact that these appeals remain severely underfunded, \n \nNoting that contributions have not been predictable enough or sufficient to meet \ngrowing needs and remedy the persistent shortfalls, thereby undermining the \nAgency\u2019s operations and efforts to promote human development and meet Palestine \nrefugees\u2019 basic needs, and stressing the need for further efforts to comprehensively \naddress the recurrent funding shortfalls affecting the Agency\u2019s operations, \n \nRecognizing the Agency\u2019s extensive efforts to rapidly develop innovative and \ndiversified ways to address its financial shortfall and mobilize resources, including \nthrough the expansion of the donor base and partnerships with United Nations \nentities, international financial institutions, the private sector and civil society, \nincluding through special digital campaigns, \n \nCommending the Agency for the measures taken to address the financial crisis, \ndespite difficult operational circumstances, including through the implementation of \nthe strategic plan 2023\u20132028 and various internal measures to contain expenditures, \nreduce operational and administrative costs, maximize the use of resources and reduce \nthe funding shortfalls, and expressing profound concern that, despite such measures, \nthe Agency\u2019s programme budget, which is funded primarily by voluntary contributions \nfrom Member States and intergovernmental organizations, faces persistent shortfalls \nthat continue to threaten the delivery of the Agency\u2019s core programmes of assistance \nto the Palestine refugees,  \n \nRecalling its resolution 65/272 of 18 April 2011, in which it requested the \nSecretary-General to continue to support the institutional strengthening of the \nAgency, and stressing the need to support the Agency\u2019s capacity to uphold its mandate \nand to avert the serious humanitarian, political and security risks that would result \nfrom any interruption or suspension of its vital work, \n \nRecognizing that the recurring and growing financial shortfalls directly affecting \nthe sustainability of the Agency\u2019s operations need to be remedied by examining new \nfunding modalities designed to put the Agency on a stable financial footing to enable \n__________________ \n \n10  A/70/272, annex. \n\nA/C.4/80/L.16 \n \n25-18253\n6/12 \n \nit to effectively carry out its core programmes in accordance with its mandate and \ncommensurate with humanitarian needs, \n \nWelcoming the joint efforts of host countries and donors to mobilize support for \nthe Agency, including through extraordinary ministerial meetings, inter alia, the most \nrecent ministerial meeting hosted by Jordan, Brazil and Spain on 25 September 2025, \naimed at urgently addressing the Agency\u2019s funding shortfall and the need for \npredictable multi-year funding, expanding donor support for the Agency and \nreaffirming support for its mandate, \n \nEmphasizing the continuing need for assistance to Palestine refugees in the \nSyrian Arab Republic, as well as those who have fled to neighbouring countries, \nincluding in particular in Lebanon, where an unprecedented financial crisis is further \naffecting socioeconomic conditions among the refugees and exacerbating already \nhigh unemployment and poverty rates, \n \nAware of the valuable work done by the Agency in providing protection to the \nPalestinian people, in particular Palestine refugees, and recalling the need for the \nprotection of all civilians in situations of armed conflict, \n \nRecognizing the efforts of Agency staff in all fields of operation to uphold the \nAgency\u2019s mandate, including the healthcare staff for their dedication in responding to \nthe profound stress caused to the health system by the high number of civilian \ncasualties and damage and destruction of healthcare facilities in the Gaza Strip and \nthe education staff for their efforts to provide continuity in education to the extent \npossible in times of emergency,  \n \nRecalling the statement of 15 July 1999 and the declarations adopted on \n5 December 2001 and on 17 December 201411 by the Conference of High Contracting \nParties to the Fourth Geneva Convention, including the call upon Parties to facilitate \nthe activities of the Agency, to guarantee its protection and to refrain from levying \ntaxes and imposing undue financial burdens, \n \nAware of the agreement between the Agency and the Government of Israel, \n \nTaking note of the agreement reached on 24 June 1994, embodied in an exchange \nof letters between the Agency and the Palestine Liberation Organization, 12  \n \nStressing the urgent need for the provision of the necessary humanitarian \nassistance and funding support for the advancement of reconstruction and recovery in \nthe Gaza Strip in accordance, inter alia, with the Arab-Islamic Early Recovery, \nReconstruction and Development Plan for Gaza,13 including by ensuring the timely \nfacilitation of construction projects, including extensive shelter repair, and the need \nfor the accelerated implementation of other urgent United Nations-led civilian \nreconstruction activities, and calling upon Israel to ensure the expedited and \nunimpeded import of all necessary construction materials into the Gaza Strip and to \nreduce the burdensome cost of importation of Agency supplies, \n \nStressing also that the situation in the Gaza Strip is unsustainable and that the \nceasefire agreement must lead to a fundamental improvement in the living conditions \nof the Palestinian people in the Gaza Strip, including through the sustained and \nregular opening of crossing points, and must ensure the safety and well-being of \ncivilians on both sides, \n__________________ \n \n11  A/69/711-S/2015/1, annex. \n \n12  Official Records of the General Assembly, Forty-ninth Session, Supplement No. 13 (A/49/13), \nannex I. \n \n13  See A/79/820-S/2025/151. \n\nA/C.4/80/L.16\n \n7/12\n25-18253 \n \n \nAffirming the need to support the Palestinian Government in its assumption of \nfull government responsibilities in both the West Bank and the Gaza Strip, in all \nfields, as well as through its presence at Gaza\u2019s crossing points, \n \nReaffirming that the effective functioning of the United Nations Relief and \nWorks Agency for Palestine Refugees in the Near East remains essential in all fields \nof operation, \n \n1. \nAffirms its full support for the mandate of the United Nations Relief and \nWorks Agency for Palestine Refugees in the Near East in all of its fields of operation, \nnamely Jordan, Lebanon, the Syrian Arab Republic and the Occupied Palestinian \nTerritory;  \n \n2. \nReaffirms the necessity for the continuation of the work of the Agency and \nthe importance of its unimpeded operation and provision of services, including \nemergency assistance, for the well-being, protection and human development of the \nPalestine refugees and for the stability of the region, pending the just resolution of \nthe question of the Palestine refugees in line with the relevant resolutions;  \n \n3. \nStresses that, at a time of heightened conflict and instability in the Middle \nEast, the Agency continues to play an indispensable role in ameliorating the plight of \nthe more than 6 million Palestine refugees registered with the Agency and in \nproviding a crucial measure of stability in the region, including in Gaza in the post-\nceasefire period and including by mitigating the consequences of alarming trends and \nsevere crises in the Agency\u2019s areas of operation, including increasing violence, \nmarginalization and poverty;  \n \n4. \nExpresses its appreciation for the tireless efforts of the Commissioner-\nGeneral and the staff of the Agency in all fields of operation in fulfilment of the \nmandate of the Agency and respect for the principles of humanity, neutrality, \nimpartiality and independence, particularly in the light of the dire humanitarian \nconditions, instability and unprecedented crises faced during the past year; \n \n5. \nCommends the Agency for its extraordinary efforts, in cooperation with \nother United Nations agencies on the ground, to provide emergency humanitarian \nassistance, including shelter, food and medical aid, to refugees and affected civilians \nduring periods of crisis and conflict, and recognizes its exemplary capacity to \nmobilize in emergency situations while continuously carrying out its core human \ndevelopment programmes, particularly its education programme;  \n \n6. \nEndorses the efforts of the Commissioner-General of the Agency to \ncontinue to provide humanitarian assistance, as far as practicable, on an emergency \nbasis, and as a temporary measure, to persons in the area who are currently displaced \nand in serious need of continued assistance as a result of the June 1967 and subsequent \nhostilities, while reaffirming the right of all persons displaced as a result of the June \n1967 and subsequent hostilities to return to their homes or former places of residence \nin the territories occupied by Israel since 1967; \n \n7. \nEmphasizes in particular that the United Nations Relief and Works Agency \nfor Palestine Refugees in the Near East remains the backbone of all humanitarian \nresponse and basic services for Palestine refugees in Gaza and the other fields of \noperation in the region, and affirms that no organization can replace or substitute the \nAgency\u2019s capacity and mandate to serve Palestine refugees and civilians in urgent \nneed of life-saving humanitarian assistance; \n \n8. \nUnderscores in this regard the critical role also to be played by the Agency \nin implementing urgently needed recovery and stabilization efforts in a post-ceasefire \nperiod in the Gaza Strip, considering its personnel capacity, operational agility, \n\nA/C.4/80/L.16 \n \n25-18253\n8/12 \n \nnetwork of facilities, decades of proven humanitarian and human development \nexpertise and cost-effective operations in comparison to other organizations; \n \n9. \nRecalls the New York Declaration on the Peaceful Settlement of the \nQuestion of Palestine and the Implementation of the Two-State Solution, and \nunderscores the commitment to continue supporting the Agency in the implementation \nof its mandate, including through the appropriate funding, as well as its commitment \nand ongoing efforts to implement the recommendations of the Colonna Report, and \nthat, upon the achievement of a just solution to the Palestine refugee issue, to be \nagreed upon in accordance with resolution 194 (III), the Agency will hand over its \npublic-like services in the Palestinian territory to empowered and prepared \nPalestinian institutions; \n \n10. Recognizes the critical contribution the Agency can make in implementing \nthe New York Declaration, the Arab-Islamic Early Recovery, Reconstruction and \nDevelopment Plan for Gaza, and other major international initiatives, including the \nceasefire agreement, as it serves as a pillar for regional stability, including through \nthe scaling-up of humanitarian assistance, restoration of education, health, water, \nsanitation and other basic services, and support for Palestinian capacity-building, and \nrequests the Secretary-General to inform the General Assembly as soon as possible \nof how the Agency can concretely contribute in this regard; \n \n11. Strongly warns against any attempts to dismantle or diminish the \noperations and mandate of the Agency, recognizing that any interruption or suspension \nof its work would have severe humanitarian consequences for millions of Palestine \nrefugees who depend on the Agency\u2019s services and also implications for the region;  \n \n12. Deplores the legislation adopted by the Israeli Knesset on 28 October 2024 \nand enacted as of January 2025, and calls upon the Israeli Government to abide by its \ninternational obligations, respect the privileges and immunities of the Agency and \nuphold its responsibility to allow and facilitate full, rapid, safe and unhindered \nhumanitarian assistance in all its forms into and throughout the entire Gaza Strip, \nincluding the provision of sorely needed basic services to the civilian population; \n \n13. Also deplores breaches of the inviolability of United Nations premises, the \nfailure to accord the property and assets of the Organization immunity, the failure to \nprotect United Nations personnel, premises and property and any disruption caused \nto Agency operations by such violations; \n \n14. Condemns the killing and injury of Agency personnel, including over 300 \nstaff members among at least 56514 humanitarian workers killed in Israeli attacks in \nthe Gaza Strip since October 2023; \n \n15. Demands that all parties act, in accordance with international law and the \nrelevant resolutions, to enable the Agency to carry out its mandate, as adopted by the \nGeneral Assembly, in all fields of operation, with full respect for the humanitarian \nprinciples of humanity, neutrality, impartiality and independence, and respect \ninternational humanitarian law obligations, including the protection of United \nNations and humanitarian facilities;  \n \n16. Also demands that Israel respect the mandate of the Agency and its \nprivileges and immunities and act forthwith to enable its operations to proceed \nwithout impediment or restriction in the Gaza Strip and the West Bank, including East \nJerusalem, including, inter alia, to allow and facilitate full, rapid, safe and unhindered \nhumanitarian assistance in all its forms into and throughout the entire Gaza Strip in \naccordance with the mandate of the Agency and to alleviate the humanitarian \n__________________ \n \n14  United Nations, Office for the Coordination of Humanitarian Affairs, situation report of \n9 October 2025. \n\nA/C.4/80/L.16\n \n9/12\n25-18253 \n \ncatastrophe, including by fully lifting the restrictions impeding or delaying the import \nof necessary construction materials and supplies for the reconstruction and repair of \ndamaged and destroyed refugee shelters and the implementation of urgently needed \ncivilian infrastructure projects in the refugee camps in the Gaza Strip and the West \nBank;  \n \n17. Reiterates its demand that Israel comply without delay with all its legal \nobligations under international law, including, inter alia, to take all necessary and \neffective measures to ensure, in full cooperation with the United Nations, the \nunhindered provision at scale by all concerned of urgently needed basic services and \nhumanitarian assistance, including food, water, electricity, fuel, shelter, clothing, \nhygiene and sanitation requirements, as well as medical supplies and medical care, to \nthe Palestinian civilian population throughout the Gaza Strip; \n \n18. Calls upon Israel, the occupying Power, to comply fully with the \nprovisions of the Geneva Convention relative to the Protection of Civilian Persons in \nTime of War, of 12 August 1949; \n \n19. Underscores the findings in the advisory opinion of the International Court \nof Justice of 22 October 2025 relevant to the mandate and operations of the Agency, \nincluding, inter alia, the Court\u2019s findings regarding the Agency\u2019s impartiality and \nneutrality, in line with paragraphs 114 and 118 of the advisory opinion, and that Israel, \nas the occupying Power, and in view of the scale and urgency of needs of the \nPalestinian population and that it is inadequately supplied with humanitarian aid and \nessential basic services, is obligated to agree to and facilitate relief schemes provided \nby the United Nations and its entities, including the Agency, in accordance with \ninternational humanitarian law, including the Fourth Geneva Convention, and with \nthe obligation of Member States under the Charter of the United Nations to cooperate \nin good faith with the United Nations and its entities; \n \n20. Also underscores the Court\u2019s reaffirmation of the permanent responsibility \nof the United Nations towards the question of Palestine until it is justly resolved in all \nits aspects and the Court\u2019s recognition that, since its establishment, the Agency has been \nan indispensable provider of humanitarian relief and basic services for the Palestine \nrefugees in the Gaza Strip and the wider region, and that Israel is not entitled to \nunilaterally decide on the presence and activities of United Nations entities in and in \nrelation to the Occupied Palestinian Territory, nor unilaterally revoke the privileges and \nimmunities accorded to the United Nations and its personnel, including the Agency;  \n \n21. Calls upon Israel to abide by Articles 100, 104 and 105 of the Charter of \nthe United Nations and the Convention on the Privileges and Immunities of the United \nNations in all aspects and to ensure the safety of the personnel of the Agency, the \nprotection of its installations and the safeguarding of the security of its facilities in \nthe Occupied Palestinian Territory, including East Jerusalem, at all times, to comply \nwith international humanitarian law, and to cease obstructing the movement and \naccess of the staff, vehicles and supplies of the Agency and levying taxes, extra fees \nand charges on the Agency; \n \n22. Underscores the imperative of reparations, in accordance with \ninternational law, for all losses, damage and destruction sustained by the Agency in \nthe Occupied Palestinian Territory, and calls upon the Secretary-General to undertake \nthe necessary assessments to this end; \n \n23. Calls upon all parties to ensure respect for and the protection of all \nhumanitarian personnel and United Nations and associated personnel, to respect the \nprinciples of humanity, neutrality, impartiality and independence for the provision of \nhumanitarian assistance and to respect and protect the inviolability of United Nations \npremises; \n\nA/C.4/80/L.16 \n \n25-18253\n10/12 \n \n \n24. Calls upon the Agency to continue to fully implement its high-level action \nplan for the implementation of the 50 recommendations of the Independent Review \nof Mechanisms and Procedures to Ensure Adherence by UNRWA to the Humanitarian \nPrinciple of Neutrality (Colonna Report) and to keep donors and other Member States \nregularly informed of the progress, welcomes the commitment affirmed by the \nSecretary-General and the Agency to fully implement the recommendations and the \nconsiderable progress already achieved, and urges Member States to provide the \nnecessary political and financial support to enable timely and effective implementation;  \n \n25. Stresses the need to support the capacity of the Agency to uphold its \nmandate and to avert the serious humanitarian, political and security risks that would \nresult from any interruption or suspension of its vital work;  \n \n26. Endorses the efforts of the Commissioner-General to continue to provide \nhumanitarian assistance, as far as is practicable, on an emergency basis and as a \ntemporary measure, to persons in the area who are internally displaced and in serious \nneed of continuing assistance as a result of recent crises in the Agency\u2019s fields of \noperation;  \n \n27. Encourages the Agency, in close cooperation with other relevant United \nNations entities, to continue to make progress in addressing the needs, rights and \nprotection of children, women and persons with disabilities in its operations, \nincluding through the provision of necessary psychosocial and humanitarian support, \nin accordance with the Convention on the Rights of the Child,15 the Convention on \nthe Elimination of All Forms of Discrimination against Women16 and the Convention \non the Rights of Persons with Disabilities;17  \n \n28. Also encourages the Agency to continue to reduce the vulnerability and \nimprove the self-reliance and resilience of Palestine refugees through its programmes;  \n \n29. Recognizes the acute protection needs of Palestine refugees across the \nregion, and encourages the Agency\u2019s efforts to contribute to a coordinated and \nsustained response in accordance with international law, including the Agency\u2019s \nprotection strategic framework; \n \n30. Commends the Agency for its humanitarian and psychosocial support \nprogrammes and other initiatives that provide recreational, cultural and educational \nactivities for children in all fields, including in the Gaza Strip, recognizing their \npositive contribution, calls for full support for such initiatives by donor and host \ncountries, and encourages the building and strengthening of partnerships to facilitate \nand enhance the provision of these services; \n \n31. Appeals for the continued maintenance and enhancement of the Agency\u2019s \nrefugee registration system and the preservation of its historical archives, and \nemphasizes the importance of ensuring that these tools remain accessible to refugee \nfamilies as a means of safeguarding their rights and their heritage, pending a just and \nlasting resolution; \n \n32. Welcomes the efforts of donors, organizations and host countries to \nrespond to the Agency\u2019s unprecedented financial crisis, including through generous, \nadditional contributions, including to the Agency\u2019s emergency appeals; \n \n33. Calls upon Member States and relevant stakeholders to provide the widest \npossible support to the United Nations Relief and Works Agency for Palestine \nRefugees in the Near East, in order to enable the Agency to uphold its mandate; \n__________________ \n \n15  United Nations, Treaty Series, vol. 1577, No. 27531. \n \n16  Ibid., vol. 1249, No. 20378. \n \n17  Ibid., vol. 2515, No. 44910. \n\nA/C.4/80/L.16\n \n11/12\n25-18253 \n \n \n34. Expresses its deep appreciation to all donor countries and organizations \nthat have, inter alia, sustained, accelerated or increased their contributions to the \nAgency, helping to alleviate its recurrent financial crises, to mitigate imminent risks \nto its core and emergency programming and to prevent an interruption of essential \nassistance to Palestine refugees; \n \n35. Welcomes the Statement of Shared Commitments on UNRWA, initiated by \nJordan, Kuwait and Slovenia on 22 May 2024, which expressed support for the \nAgency to effectively uphold the mandate conferred on the Agency by the General \nAssembly in all fields of operation in the Gaza Strip, the West Bank, including East \nJerusalem, Jordan, Lebanon and the Syrian Arab Republic and emphasized the \nindispensable role of the Agency in its 75 years of existence and work in assisting the \nPalestine refugees and its contribution to regional stability;  \n \n36. Expresses its appreciation for the important support and cooperation \nprovided by the host Governments to the Agency in the discharge of its duties;  \n \n37. Also expresses its appreciation to the Advisory Commission of the \nAgency, and requests it to continue its efforts and to keep the General Assembly \ninformed of its activities;  \n \n38. Takes note of the report of the Working Group on the Financing of the \nUnited Nations Relief and Works Agency for Palestine Refugees in the Near East 18 \nand the efforts to assist in ensuring the financial security of the Agency, and requests \nthe Secretary-General to continue to provide the necessary services and assistance to \nthe Working Group for the conduct of its work;  \n \n39. Urges immediate efforts to address the financial and operational crises \naffecting the Agency due, inter alia, to rising needs and expenditures resulting from \nthe deterioration of the socioeconomic conditions, unprecedented humanitarian crises \nand the conflicts and rising instability in the region and their significant negative \nimpact on the ability of the Agency to deliver essential services to the Palestine \nrefugees, especially in the Occupied Palestinian Territory and Lebanon;  \n \n40. Takes note of the report of the Secretary-General on the operations of the \nAgency19 and the conclusions and recommendations contained therein, including the \nproposal for an increased assessed contribution from the regular budget of the United \nNations;  \n \n41. Recognizes the Agency\u2019s extremely dire financial situation and the \nnecessity to strengthen its capacity to respond to the increased and emerging needs \nrelated to the catastrophic humanitarian situation in the Gaza Strip, as well as to \ncontinue to strengthen and sustain the Agency\u2019s compliance with the recommendations \nof the Independent Review (Colonna Report) through increased contributions, \nincluding from the assessed regular budget of the United Nations;  \n \n42. Requests the Secretary-General to submit a proposal for funding \nrequirements in the context of the proposed programme budget for 2027, in support \nof international staff requirements, in accordance with resolution 3331 B (XXIX) of \n17 December 1974; \n \n43. Calls upon the members of the Advisory Commission and the Working \nGroup on the Financing of the United Nations Relief and Works Agency for Palestine \nRefugees in the Near East to consider the relevant recommendations in the report of \nthe Secretary-General, including to help the Agency to address resource mobilization \n__________________ \n \n18  A/79/329. \n \n19  A/71/849. \n\nA/C.4/80/L.16 \n \n25-18253\n12/12 \n \nchallenges and to actively assist the Commissioner-General in the efforts to create \nsustainable, sufficient and predictable support for the Agency\u2019s operations; \n \n44. Requests the Commissioner-General to continue efforts to maintain and \nincrease traditional donor support and to enhance income from non-traditional donors, \nincluding through partnerships with public and private entities and exploration of \nfinancial avenues in relation to the implementation of the Sustainable Development \nGoals;20  \n \n45. Urges States and organizations to actively pursue partnerships with and \ninnovative support for the Agency, including as recommended in paragraphs 47, 48 \nand 50 of the report of the Secretary-General,21 including through the establishment \nof endowments, trust funds or revolving fund mechanisms and assistance to the \nAgency to access humanitarian, development and peace and security trust funds and \ngrants, as well as financing from international financial development institutions;  \n \n46. Appeals to States and organizations for voluntary contributions to the \nAgency, including multi-year funding agreements, full and timely disbursements of \npledges and an increase in such contributions where possible, in particular for the \nprogramme budget of the Agency, as well as for its emergency, recovery and \nreconstruction programmes as set out in its appeals and response plans, to support the \nmandate of the Agency, to alleviate its recurrent underfunding, to mitigate imminent \nrisks to its core and emergency programming and to prevent the interruption of essential \nassistance to the Palestine refugees and the dire repercussions of any such interruption;  \n \n47. Reiterates its appeals to all States, the specialized agencies, and \nintergovernmental and non-governmental organizations to continue and to augment \ntheir contributions to the programme budget of the Agency, to increase their special \nallocations for grants and scholarships for higher education to Palestine refugees and \nto contribute to the establishment of vocational training centres for Palestine refugees, \nand requests the Agency to act as the recipient and trustee for the special allocations \nfor grants and scholarships; \n \n48. Calls upon the Commissioner-General to include, in the annual reporting \nto the General Assembly, assessments on the progress made to remedy the recurrent \nfunding shortfalls of the Agency and ensure sustained, sufficient and predictable \nsupport for the Agency\u2019s operations, including through the implementation of the \nrelevant provisions of the present resolution; \n \n49. Recognizes the important and indispensable role of the Agency in its 75 \nyears of existence and work in assisting the Palestine refugees throughout its five \nfields of operations and contributing to regional stability; underscores that it is \nirreplaceable, and stresses the importance of cooperation of all States and other \nUnited Nations bodies with the Agency to enable the effective implementation of its \nmandate in all fields of operation until the realization of a just solution to the question \nof Palestine, including for the Palestine refugees, in accordance with the relevant \nUnited Nations resolutions. \n \n__________________ \n \n20  See resolution 70/1. \n \n21  A/71/849. \n",
  "paragraphs": {
    "1": "Affirms its full support for the mandate of the United Nations Relief and Works Agency for Palestine Refugees in the Near East in all of its fields of operation, namely Jordan, Lebanon, the Syrian Arab Republic and the Occupied Palestinian Territory;",
    "2": "Reaffirms the necessity for the continuation of the work of the Agency and the importance of its unimpeded operation and provision of services, including emergency assistance, for the well-being, protection and human development of the Palestine refugees and for the stability of the region, pending the just resolution of the question of the Palestine refugees in line with the relevant resolutions;",
    "3": "Stresses that, at a time of heightened conflict and instability in the Middle East, the Agency continues to play an indispensable role in ameliorating the plight of the more than 6 million Palestine refugees registered with the Agency and in providing a crucial measure of stability in the region, including in Gaza in the post- ceasefire period and including by mitigating the consequences of alarming trends and severe crises in the Agency\u2019s areas of operation, including increasing violence, marginalization and poverty;",
    "4": "Expresses its appreciation for the tireless efforts of the Commissioner- General and the staff of the Agency in all fields of operation in fulfilment of the mandate of the Agency and respect for the principles of humanity, neutrality, impartiality and independence, particularly in the light of the dire humanitarian conditions, instability and unprecedented crises faced during the past year;",
    "5": "Commends the Agency for its extraordinary efforts, in cooperation with other United Nations agencies on the ground, to provide emergency humanitarian assistance, including shelter, food and medical aid, to refugees and affected civilians during periods of crisis and conflict, and recognizes its exemplary capacity to mobilize in emergency situations while continuously carrying out its core human development programmes, particularly its education programme;",
    "6": "Endorses the efforts of the Commissioner-General of the Agency to continue to provide humanitarian assistance, as far as practicable, on an emergency basis, and as a temporary measure, to persons in the area who are currently displaced and in serious need of continued assistance as a result of the June 1967 and subsequent hostilities, while reaffirming the right of all persons displaced as a result of the June 1967 and subsequent hostilities to return to their homes or former places of residence in the territories occupied by Israel since 1967;",
    "7": "Emphasizes in particular that the United Nations Relief and Works Agency for Palestine Refugees in the Near East remains the backbone of all humanitarian response and basic services for Palestine refugees in Gaza and the other fields of operation in the region, and affirms that no organization can replace or substitute the Agency\u2019s capacity and mandate to serve Palestine refugees and civilians in urgent need of life-saving humanitarian assistance;",
    "8": "Underscores in this regard the critical role also to be played by the Agency in implementing urgently needed recovery and stabilization efforts in a post-ceasefire period in the Gaza Strip, considering its personnel capacity, operational agility, A/C.4/80/L.16 25-18253 8/12 network of facilities, decades of proven humanitarian and human development expertise and cost-effective operations in comparison to other organizations;",
    "9": "Recalls the New York Declaration on the Peaceful Settlement of the Question of Palestine and the Implementation of the Two-State Solution, and underscores the commitment to continue supporting the Agency in the implementation of its mandate, including through the appropriate funding, as well as its commitment and ongoing efforts to implement the recommendations of the Colonna Report, and that, upon the achievement of a just solution to the Palestine refugee issue, to be agreed upon in accordance with resolution 194 (III), the Agency will hand over its public-like services in the Palestinian territory to empowered and prepared Palestinian institutions;",
    "10": "Recognizes the critical contribution the Agency can make in implementing the New York Declaration, the Arab-Islamic Early Recovery, Reconstruction and Development Plan for Gaza, and other major international initiatives, including the ceasefire agreement, as it serves as a pillar for regional stability, including through the scaling-up of humanitarian assistance, restoration of education, health, water, sanitation and other basic services, and support for Palestinian capacity-building, and requests the Secretary-General to inform the General Assembly as soon as possible of how the Agency can concretely contribute in this regard;",
    "11": "Strongly warns against any attempts to dismantle or diminish the operations and mandate of the Agency, recognizing that any interruption or suspension of its work would have severe humanitarian consequences for millions of Palestine refugees who depend on the Agency\u2019s services and also implications for the region;",
    "12": "Deplores the legislation adopted by the Israeli Knesset on 28 October 2024 and enacted as of January 2025, and calls upon the Israeli Government to abide by its international obligations, respect the privileges and immunities of the Agency and uphold its responsibility to allow and facilitate full, rapid, safe and unhindered humanitarian assistance in all its forms into and throughout the entire Gaza Strip, including the provision of sorely needed basic services to the civilian population;",
    "13": "Also deplores breaches of the inviolability of United Nations premises, the failure to accord the property and assets of the Organization immunity, the failure to protect United Nations personnel, premises and property and any disruption caused to Agency operations by such violations;",
    "14": "Condemns the killing and injury of Agency personnel, including over 300 staff members among at least 56514 humanitarian workers killed in Israeli attacks in the Gaza Strip since October 2023;",
    "15": "Demands that all parties act, in accordance with international law and the relevant resolutions, to enable the Agency to carry out its mandate, as adopted by the General Assembly, in all fields of operation, with full respect for the humanitarian principles of humanity, neutrality, impartiality and independence, and respect international humanitarian law obligations, including the protection of United Nations and humanitarian facilities;",
    "16": "Also demands that Israel respect the mandate of the Agency and its privileges and immunities and act forthwith to enable its operations to proceed without impediment or restriction in the Gaza Strip and the West Bank, including East Jerusalem, including, inter alia, to allow and facilitate full, rapid, safe and unhindered humanitarian assistance in all its forms into and throughout the entire Gaza Strip in accordance with the mandate of the Agency and to alleviate the humanitarian __________________ 14 United Nations, Office for the Coordination of Humanitarian Affairs, situation report of 9 October 2025. A/C.4/80/L.16 9/12 25-18253 catastrophe, including by fully lifting the restrictions impeding or delaying the import of necessary construction materials and supplies for the reconstruction and repair of damaged and destroyed refugee shelters and the implementation of urgently needed civilian infrastructure projects in the refugee camps in the Gaza Strip and the West Bank;",
    "17": "Reiterates its demand that Israel comply without delay with all its legal obligations under international law, including, inter alia, to take all necessary and effective measures to ensure, in full cooperation with the United Nations, the unhindered provision at scale by all concerned of urgently needed basic services and humanitarian assistance, including food, water, electricity, fuel, shelter, clothing, hygiene and sanitation requirements, as well as medical supplies and medical care, to the Palestinian civilian population throughout the Gaza Strip;",
    "18": "Calls upon Israel, the occupying Power, to comply fully with the provisions of the Geneva Convention relative to the Protection of Civilian Persons in Time of War, of 12 August 1949;",
    "19": "Underscores the findings in the advisory opinion of the International Court of Justice of 22 October 2025 relevant to the mandate and operations of the Agency, including, inter alia, the Court\u2019s findings regarding the Agency\u2019s impartiality and neutrality, in line with paragraphs 114 and 118 of the advisory opinion, and that Israel, as the occupying Power, and in view of the scale and urgency of needs of the Palestinian population and that it is inadequately supplied with humanitarian aid and essential basic services, is obligated to agree to and facilitate relief schemes provided by the United Nations and its entities, including the Agency, in accordance with international humanitarian law, including the Fourth Geneva Convention, and with the obligation of Member States under the Charter of the United Nations to cooperate in good faith with the United Nations and its entities;",
    "20": "Also underscores the Court\u2019s reaffirmation of the permanent responsibility of the United Nations towards the question of Palestine until it is justly resolved in all its aspects and the Court\u2019s recognition that, since its establishment, the Agency has been an indispensable provider of humanitarian relief and basic services for the Palestine refugees in the Gaza Strip and the wider region, and that Israel is not entitled to unilaterally decide on the presence and activities of United Nations entities in and in relation to the Occupied Palestinian Territory, nor unilaterally revoke the privileges and immunities accorded to the United Nations and its personnel, including the Agency;",
    "21": "Calls upon Israel to abide by Articles 100, 104 and 105 of the Charter of the United Nations and the Convention on the Privileges and Immunities of the United Nations in all aspects and to ensure the safety of the personnel of the Agency, the protection of its installations and the safeguarding of the security of its facilities in the Occupied Palestinian Territory, including East Jerusalem, at all times, to comply with international humanitarian law, and to cease obstructing the movement and access of the staff, vehicles and supplies of the Agency and levying taxes, extra fees and charges on the Agency;",
    "22": "Underscores the imperative of reparations, in accordance with international law, for all losses, damage and destruction sustained by the Agency in the Occupied Palestinian Territory, and calls upon the Secretary-General to undertake the necessary assessments to this end;",
    "23": "Calls upon all parties to ensure respect for and the protection of all humanitarian personnel and United Nations and associated personnel, to respect the principles of humanity, neutrality, impartiality and independence for the provision of humanitarian assistance and to respect and protect the inviolability of United Nations premises; A/C.4/80/L.16 25-18253 10/12",
    "24": "Calls upon the Agency to continue to fully implement its high-level action plan for the implementation of the 50 recommendations of the Independent Review of Mechanisms and Procedures to Ensure Adherence by UNRWA to the Humanitarian Principle of Neutrality (Colonna Report) and to keep donors and other Member States regularly informed of the progress, welcomes the commitment affirmed by the Secretary-General and the Agency to fully implement the recommendations and the considerable progress already achieved, and urges Member States to provide the necessary political and financial support to enable timely and effective implementation;",
    "25": "Stresses the need to support the capacity of the Agency to uphold its mandate and to avert the serious humanitarian, political and security risks that would result from any interruption or suspension of its vital work;",
    "26": "Endorses the efforts of the Commissioner-General to continue to provide humanitarian assistance, as far as is practicable, on an emergency basis and as a temporary measure, to persons in the area who are internally displaced and in serious need of continuing assistance as a result of recent crises in the Agency\u2019s fields of operation;",
    "27": "Encourages the Agency, in close cooperation with other relevant United Nations entities, to continue to make progress in addressing the needs, rights and protection of children, women and persons with disabilities in its operations, including through the provision of necessary psychosocial and humanitarian support, in accordance with the Convention on the Rights of the Child,15 the Convention on the Elimination of All Forms of Discrimination against Women16 and the Convention on the Rights of Persons with Disabilities;17",
    "28": "Also encourages the Agency to continue to reduce the vulnerability and improve the self-reliance and resilience of Palestine refugees through its programmes;",
    "29": "Recognizes the acute protection needs of Palestine refugees across the region, and encourages the Agency\u2019s efforts to contribute to a coordinated and sustained response in accordance with international law, including the Agency\u2019s protection strategic framework;",
    "30": "Commends the Agency for its humanitarian and psychosocial support programmes and other initiatives that provide recreational, cultural and educational activities for children in all fields, including in the Gaza Strip, recognizing their positive contribution, calls for full support for such initiatives by donor and host countries, and encourages the building and strengthening of partnerships to facilitate and enhance the provision of these services;",
    "31": "Appeals for the continued maintenance and enhancement of the Agency\u2019s refugee registration system and the preservation of its historical archives, and emphasizes the importance of ensuring that these tools remain accessible to refugee families as a means of safeguarding their rights and their heritage, pending a just and lasting resolution;",
    "32": "Welcomes the efforts of donors, organizations and host countries to respond to the Agency\u2019s unprecedented financial crisis, including through generous, additional contributions, including to the Agency\u2019s emergency appeals;",
    "33": "Calls upon Member States and relevant stakeholders to provide the widest possible support to the United Nations Relief and Works Agency for Palestine Refugees in the Near East, in order to enable the Agency to uphold its mandate; __________________ 15 United Nations, Treaty Series, vol. 1577, No. 27531. 16 Ibid., vol. 1249, No. 20378. 17 Ibid., vol. 2515, No. 44910. A/C.4/80/L.16 11/12 25-18253",
    "34": "Expresses its deep appreciation to all donor countries and organizations that have, inter alia, sustained, accelerated or increased their contributions to the Agency, helping to alleviate its recurrent financial crises, to mitigate imminent risks to its core and emergency programming and to prevent an interruption of essential assistance to Palestine refugees;",
    "35": "Welcomes the Statement of Shared Commitments on UNRWA, initiated by Jordan, Kuwait and Slovenia on 22 May 2024, which expressed support for the Agency to effectively uphold the mandate conferred on the Agency by the General Assembly in all fields of operation in the Gaza Strip, the West Bank, including East Jerusalem, Jordan, Lebanon and the Syrian Arab Republic and emphasized the indispensable role of the Agency in its 75 years of existence and work in assisting the Palestine refugees and its contribution to regional stability;",
    "36": "Expresses its appreciation for the important support and cooperation provided by the host Governments to the Agency in the discharge of its duties;",
    "37": "Also expresses its appreciation to the Advisory Commission of the Agency, and requests it to continue its efforts and to keep the General Assembly informed of its activities;",
    "38": "Takes note of the report of the Working Group on the Financing of the United Nations Relief and Works Agency for Palestine Refugees in the Near East 18 and the efforts to assist in ensuring the financial security of the Agency, and requests the Secretary-General to continue to provide the necessary services and assistance to the Working Group for the conduct of its work;",
    "39": "Urges immediate efforts to address the financial and operational crises affecting the Agency due, inter alia, to rising needs and expenditures resulting from the deterioration of the socioeconomic conditions, unprecedented humanitarian crises and the conflicts and rising instability in the region and their significant negative impact on the ability of the Agency to deliver essential services to the Palestine refugees, especially in the Occupied Palestinian Territory and Lebanon;",
    "40": "Takes note of the report of the Secretary-General on the operations of the Agency19 and the conclusions and recommendations contained therein, including the proposal for an increased assessed contribution from the regular budget of the United Nations;",
    "41": "Recognizes the Agency\u2019s extremely dire financial situation and the necessity to strengthen its capacity to respond to the increased and emerging needs related to the catastrophic humanitarian situation in the Gaza Strip, as well as to continue to strengthen and sustain the Agency\u2019s compliance with the recommendations of the Independent Review (Colonna Report) through increased contributions, including from the assessed regular budget of the United Nations;",
    "42": "Requests the Secretary-General to submit a proposal for funding requirements in the context of the proposed programme budget for 2027, in support of international staff requirements, in accordance with resolution 3331 B (XXIX) of 17 December 1974;",
    "43": "Calls upon the members of the Advisory Commission and the Working Group on the Financing of the United Nations Relief and Works Agency for Palestine Refugees in the Near East to consider the relevant recommendations in the report of the Secretary-General, including to help the Agency to address resource mobilization __________________ 18 A/79/329. 19 A/71/849. A/C.4/80/L.16 25-18253 12/12 challenges and to actively assist the Commissioner-General in the efforts to create sustainable, sufficient and predictable support for the Agency\u2019s operations;",
    "44": "Requests the Commissioner-General to continue efforts to maintain and increase traditional donor support and to enhance income from non-traditional donors, including through partnerships with public and private entities and exploration of financial avenues in relation to the implementation of the Sustainable Development Goals;20",
    "45": "Urges States and organizations to actively pursue partnerships with and innovative support for the Agency, including as recommended in paragraphs 47, 48 and 50 of the report of the Secretary-General,21 including through the establishment of endowments, trust funds or revolving fund mechanisms and assistance to the Agency to access humanitarian, development and peace and security trust funds and grants, as well as financing from international financial development institutions;",
    "46": "Appeals to States and organizations for voluntary contributions to the Agency, including multi-year funding agreements, full and timely disbursements of pledges and an increase in such contributions where possible, in particular for the programme budget of the Agency, as well as for its emergency, recovery and reconstruction programmes as set out in its appeals and response plans, to support the mandate of the Agency, to alleviate its recurrent underfunding, to mitigate imminent risks to its core and emergency programming and to prevent the interruption of essential assistance to the Palestine refugees and the dire repercussions of any such interruption;",
    "47": "Reiterates its appeals to all States, the specialized agencies, and intergovernmental and non-governmental organizations to continue and to augment their contributions to the programme budget of the Agency, to increase their special allocations for grants and scholarships for higher education to Palestine refugees and to contribute to the establishment of vocational training centres for Palestine refugees, and requests the Agency to act as the recipient and trustee for the special allocations for grants and scholarships;",
    "48": "Calls upon the Commissioner-General to include, in the annual reporting to the General Assembly, assessments on the progress made to remedy the recurrent funding shortfalls of the Agency and ensure sustained, sufficient and predictable support for the Agency\u2019s operations, including through the implementation of the relevant provisions of the present resolution;",
    "49": "Recognizes the important and indispensable role of the Agency in its 75 years of existence and work in assisting the Palestine refugees throughout its five fields of operations and contributing to regional stability; underscores that it is irreplaceable, and stresses the importance of cooperation of all States and other United Nations bodies with the Agency to enable the effective implementation of its mandate in all fields of operation until the realization of a just solution to the question of Palestine, including for the Palestine refugees, in accordance with the relevant United Nations resolutions. __________________ 20 See resolution 70/1. 21 A/71/849."
  },
  "agenda_items": [
    "Item 49"
  ],
  "symbol_references": [
    "A/C.4/80/L.16"
  ]
}