{
  "symbol": "A/C.2/80/L.6",
  "filename": "A_C.2_80_L.6.pdf",
  "title": "Follow-up to the Third United Nations Conference on Landlocked Developing Countries",
  "text": "United Nations \nA/C.2/80/L.6 \n \n \nGeneral Assembly \nDistr.: Limited \n10 October 2025 \nOriginal: English \n \n25-16442 (E)    161025 \n*2516442* \n \n \nEightieth session \nSecond Committee \nAgenda item 21 (b) \nGroups of countries in special situations: follow-up to the \nThird United Nations Conference on Landlocked \nDeveloping Countries \n \n \n \nIraq:* draft resolution \n \n \nFollow-up to the Third United Nations Conference on Landlocked \nDeveloping Countries \n \n \n \nThe General Assembly, \n \nWelcoming the Awaza Programme of Action for Landlocked Developing \nCountries for the Decade 2024\u20132034, adopted by the General Assembly in its \nresolution 79/233 of 24 December 2024, and the Awaza Political Declaration, adopted \nat the Third United Nations Conference on Landlocked Developing Countries, held \nin Awaza, Turkmenistan, from 5 to 8 August 2025, \n \nRecalling the limited progress that was made during the implementation period \nof the Vienna Programme of Action for Landlocked Developing Countries for the \nDecade 2014\u20132024,1 and that it fell short of the goals and targets set out in the \nProgramme of Action,  \n \nRecognizing that the lack of territorial access to the sea, aggravated by \nremoteness from world markets and high transit costs and risks, continues to pose \nserious constraints on the overall growth and socioeconomic development of \nlandlocked developing countries,  \n \nAffirming that the Awaza Programme of Action determines a renewed and \nstrengthened commitment by the landlocked developing countries, transit countries, \ndevelopment partners, the United Nations system and international, regional and \nsubregional organizations, multilateral and regional development banks and the \ninternational community as a whole and that it is grounded in the overarching goals \nof addressing the special development needs, vulnerabilities and challenges of \nlandlocked developing countries arising from their landlockedness, remoteness and \ngeographical constraints in a more coherent manner to contribute to an enhanced rate \n__________________ \n \n*  On behalf of the States that are members of the Group of 77 and China, taking into account also \nthe provisions of General Assembly resolution ES-10/23 of 10 May 2024. \n \n1  Resolution 69/137, annex II. \n\nA/C.2/80/L.6 \n \n25-16442\n2/11 \n \nof sustained, inclusive and sustainable economic growth, effective participation in \ninternational trade and the eradication of poverty in all its forms and dimensions, \nincluding extreme poverty, to be achieved through a reinvigorated global partnership \nfor sustainable development based on scaled-up and ambitious means of \nimplementation and diverse support for the landlocked developing countries through \nforging the widest possible coalition of multi-stakeholder partnerships,  \n \nReaffirming that the Awaza Programme of Action is based on a comprehensive, \nresults-oriented, quantifiable, forward-looking, coherent, renewed and strengthened \nglobal partnership for landlocked developing countries that is fully aligned with the \n2030 Agenda for Sustainable Development2 and its Sustainable Development Goals, \nthe Sevilla Commitment,3 the Sendai Framework for Disaster Risk Reduction 2015\u2013\n20304 and the Paris Agreement,5 between landlocked developing countries and the \ntransit countries and their development partners, as well as with the relevant \ninternational and regional organizations, the private sector, civil society and other \nrelevant stakeholders,  \n \nReaffirming also that the Awaza Programme of Action is grounded in five \npriority areas, as follows: \n \n(a) \nStructural transformation and science, technology and innovation; \n \n(b) \nTrade, trade facilitation and regional integration; \n \n(c) \nTransit, transport and connectivity;  \n \n(d) \nEnhancing adaptive capacity, strengthening resilience and reducing \nvulnerability to climate change and disasters; \n \n(e) \nMeans of implementation,  \n \nRecognizing the importance of national-level implementation of the Awaza \nProgramme of Action and its mainstreaming into national development plans and \nstrategies, \n \nReaffirming that unfettered, efficient and cost-effective access to and from the \nsea by all means of transport, on the basis of the freedom of transit, and other related \nmeasures, in accordance with applicable rules of international law, are essential for \nthe landlocked developing countries,  \n \nReiterating the pledge that no one will be left behind, reaffirming the \nrecognition that the dignity of the human person is fundamental, and the wish to see \nthe Goals and targets met for all nations and peoples and for all segments of society, \nand recommitting to endeavour to reach the furthest behind first, \n \nReaffirming its resolution 70/1 of 25 September 2015, entitled \u201cTransforming \nour world: the 2030 Agenda for Sustainable Development\u201d, in which it adopted a \ncomprehensive, far-reaching and people-centred set of universal and transformative \nSustainable Development Goals and targets, its commitment to working tirelessly for \nthe full implementation of the Agenda by 2030, its recognition that eradicating \npoverty in all its forms and dimensions, including extreme poverty, is the greatest \nglobal challenge and an indispensable requirement for sustainable development, its \ncommitment to achieving sustainable development in its three dimensions \u2013 \neconomic, social and environmental \u2013 in a balanced and integrated manner, and to \n__________________ \n \n2  Resolution 70/1. \n \n3  Resolution 79/323, annex. \n \n4  Resolution 69/283, annex. \n \n5  Adopted under the UNFCCC in FCCC/CP/2015/10/Add.1, decision 1/CP.21. \n\nA/C.2/80/L.6\n \n3/11\n25-16442 \n \nbuilding upon the achievements of the Millennium Development Goals and seeking \nto address their unfinished business,  \n \nReaffirming also its resolution 69/313 of 27 July 2015 on the Addis Ababa \nAction Agenda of the Third International Conference on Financing for Development, \nwhich is an integral part of the 2030 Agenda for Sustainable Development, supports \nand complements it, helps to contextualize its means of implementation targets with \nconcrete policies and actions, and reaffirms the strong political commitment to \naddress the challenge of financing and creating an enabling environment at all levels \nfor sustainable development in the spirit of global partnership and solidarity,  \n \nWelcoming the convening of the Fourth International Conference on Financing \nfor Development from 30 June to 3 July 2025 in Sevilla, Spain, and reaffirming its \noutcome document, the Sevilla Commitment, endorsed by the General Assembly in \nits resolution 79/323 of 25 August 2025, which sets forth a renewed global framework \nfor financing for development, building on the 2015 Addis Ababa Action Agenda, to \nclose with urgency the estimated annual financing gap of 4 trillion United States \ndollars, catalyse sustainable investments at scale in developing countries and reform \nthe international financial architecture through continued and strong commitment to \nmultilateralism, international cooperation and global solidarity,  \n \nReaffirming the Paris Agreement and its early entry into force, encouraging all \nits Parties to fully implement the Agreement, and Parties to the United Nations \nFramework Convention on Climate Change6 that have not yet done so to deposit their \ninstruments of ratification, acceptance, approval or accession, where appropriate, as \nsoon as possible, \n \nReaffirming also the Doha Programme of Action for the Least Developed \nCountries, 7  which represents a new generation of renewed and strengthened \ncommitments between the least developed countries and their development partners, \nincluding the private sector, civil society and governments at all levels, cognizant that \nmany landlocked developing countries belong to the least developed country category, \n \nReaffirming further the recognition of the special needs and challenges of \nlandlocked developing countries in the 2030 Agenda and in the Sevilla Commitment, \n \nWelcoming the convening of the sixteenth session of the United Nations \nConference on Trade and Development, in Geneva, from 20 to 23 October 2025, the \nSecond World Summit for Social Development, in Doha, from 4 to 6 November 2025, \nthe thirtieth session of the Conference of the Parties to the United Nations Framework \nConvention on Climate Change, in Bel\u00e9m, Brazil, from 10 to 21 November 2025, the \nFourteenth Ministerial Conference of the World Trade Organization, in Cameroon \nfrom 26 to 29 March 2026, the thirteenth session of the World Urban Forum, in Baku \nfrom 17 to 22 May 2026, the seventeenth session of the Conference of the Parties to \nthe United Nations Convention to Combat Desertification in Those Countries \nExperiencing Serious Drought and/or Desertification, Particularly in Africa in \nUlaanbaatar from 17 to 28 August 2026, the seventeenth meeting of the Conference \nof the Parties to the Convention on Biological Diversity and the meetings of the \nConference of the Parties serving as the Meetings of the Parties to the Protocols to \nthe Convention, in Yerevan from 19 to 30 October 2026, the 2026 United Nations \nWater Conference to Accelerate the Implementation of Sustainable Development \nGoal 6: Ensure availability and sustainable management of water and sanitation for \nall, to be co-hosted by Senegal and the United Arab Emirates and to be held in the \nUnited Arab Emirates from 2 to 4 December 2026, and the United Nations Conference \non the Final Comprehensive Review of the Implementation of the Objectives of the \n__________________ \n \n6  United Nations, Treaty Series, vol. 1771, No. 30822. \n \n7  Resolution 76/258, annex. \n\nA/C.2/80/L.6 \n \n25-16442\n4/11 \n \nInternational Decade for Action, \u201cWater for Sustainable Development\u201d, 2018\u20132028, \nto be hosted by Tajikistan in Dushanbe in 2028, \n \nAcknowledging the importance of promoting collaboration between landlocked \ndeveloping countries and transit countries on the basis of common interest, and noting \nthat collaboration efforts need to be supported by an enabling international economic \nenvironment, taking into account different national realities, capacities and levels of \ndevelopment and respecting national priorities, while remaining consistent with \ninternational rules and commitments,  \n \nRecalling the ambition of the landlocked developing countries to have a \ndedicated work programme on their special needs under the auspices of the World \nTrade Organization, \n \nRecognizing the transport infrastructure gap in landlocked developing countries \nand the need to bring the level of transport infrastructure up to global standards and, \nin this regard, the crucial importance of strong national and international partnerships \nto bridging the gap and enhancing existing transport infrastructure facilities, \n \nTaking note of the declaration of the twenty-fourth annual Ministerial Meeting \nof Landlocked Developing Countries, organized by the Plurinational State of Bolivia \nand held at United Nations Headquarters on 26 September 2025 on the theme \u201cFrom \naspiration to action: advancing sustainable development in landlocked developing \ncountries through the Awaza Programme of Action\u201d,  \n \n1. \nTakes note of the report of the Secretary-General on the follow-up to the \nThird United Nations Conference on Landlocked Developing Countries; 8  \n \n2. \nReaffirms the commitment at the very heart of the 2030 Agenda for \nSustainable Development to leave no one behind and commit to taking more tangible \nsteps to support people in vulnerable situations and the most vulnerable countries and \nto reach the furthest behind first; \n \n3. \nWelcomes the ministerial declaration adopted by the high-level political \nforum on sustainable development convened under the auspices of the Economic and \nSocial Council, held in New York from 14 to 24 July 2025,9 and urges timely action \nto ensure its full implementation; \n \n4.  \nRecognizes that landlocked developing countries face major structural \nimpediments to sustainable development, including weak productive and supply \ncapacities, limited economic diversification and concentration in low value-added \nactivities, which constrain their ability to foster technology spillovers, diversify their \neconomies and create productive and sustainable employment opportunities;  \n \n5. \nEmphasizes the central role of sustainable agricultural production, food \nsecurity, nutrition and food safety as key elements for the eradication of poverty, \nwhile recognizing that agriculture accounts on average for 17 per cent of the gross \ndomestic product of landlocked developing countries and provides employment for \napproximately 55 per cent of their workforce, and stresses in this regard the need to \nenhance investment in rural infrastructure and in agricultural research and \ndevelopment and to accelerate the adoption of sustainable innovation practices;  \n \n6. \nRecommits to exploring the establishment of regional agricultural research \nhubs for landlocked developing countries, with a view to addressing structural \nimpediments, enhancing agricultural productivity, promoting value addition, supporting \ncapacity-building and facilitating improved agricultural practices, and looks forward \n__________________ \n \n8  A/80/336. \n \n9  E/HLS/2025/1. \n\nA/C.2/80/L.6\n \n5/11\n25-16442 \n \nto the report of the Secretary-General on the feasibility, effectiveness and administrative \nmodalities of such network hubs;  \n \n7. \nCalls upon the international community to support landlocked developing \ncountries in strengthening human capital, including through increased access to \nquality education and training, in particular science, technology, engineering and \nmathematics education, to improve labour productivity and meet evolving skills needs;  \n \n8. \nRecognizes the role of a dynamic and environmentally and socially \nresponsible private sector as a driver of structural transformation and sustained, \ninclusive and equitable economic growth, and emphasizes the need for regulatory and \ninstitutional frameworks to foster entrepreneurship, particularly for micro-, small and \nmedium-sized enterprises, including those owned by women and young people; \n \n9. \nEncourages support for the establishment of special economic zones, \nindustrial parks, technology incubators and other innovation initiatives, and stresses \nthe importance of the establishment of regulatory frameworks and guidelines, fair \nmarket access and responsible investment practices, including in the extractive \nindustries and critical minerals;  \n \n10. Calls upon development partners, multilateral financial institutions and \nthe private sector to strengthen partnerships with landlocked developing countries to \nmobilize targeted financial and technical support for sustainable private sector \ndevelopment;  \n \n11. Notes with concern that landlocked developing countries lag behind global \naverages in digital connectivity, research and development expenditure and patent \napplications, and stresses the urgent need to bridge the digital divides, including the \ngender digital divide;  \n \n12.  Calls for enhanced investment in affordable and reliable digital \ninfrastructure and digital literacy and skills, and the establishment of regional and \nnational research and innovation centres, including through strengthened partnerships \nunder the Technology Facilitation Mechanism and the Broadband Commission for \nSustainable Development;  \n \n13. Recognizes that industrialization is a crucial driver of economic growth, \njob creation and value addition in landlocked developing countries, with important \nspillover effects across agriculture and services, and stresses the need to double the \ncontribution of manufacturing value added to gross domestic product and increase the \nshare of medium- and high-tech industries by 2034;  \n \n14. Encourages landlocked developing countries to adopt proactive, equitable, \ninclusive and sustainable industrial policy frameworks that support rural \nindustrialization, gender-sensitive entrepreneurship and the formalization of the \ninformal sectors, in close coordination with trade and investment policies;  \n \n15. Calls upon development partners to provide enhanced financial, technical \nand capacity-building support for targeted industrial development programmes and \ninvestment in manufacturing to promote value addition, diversification and innovation;  \n \n16. Recognizes with concern that the landlocked developing countries\u2019 share \nof global merchandise exports was just 1.15 per cent in 2024, despite the landlocked \ndeveloping countries representing 7 per cent of the world\u2019s population;  \n \n17. Also recognizes with concern that the export structure of many landlocked \ndeveloping countries is characterized by a limited number of products, which often \nhave low value addition and are greatly affected by external shocks and hazards, \nnoting that primary commodities accounted for 81 per cent of the exports of the \nlandlocked developing countries in 2024;  \n\nA/C.2/80/L.6 \n \n25-16442\n6/11 \n \n \n18. Recognizes that trade in services, digital trade and e-commerce have great \npotential for overcoming the geographical constraints to trade in landlocked \ndeveloping countries, and expresses its concern that the landlocked developing \ncountries\u2019 share of global exports of services reached only 0.8 per cent in 2024, while \ntheir share of digitally deliverable services reached only 0.3 per cent in 2024;  \n \n19. Calls for the strengthening of the trade and productive capacities of the \nlandlocked developing countries, by enhancing aid for trade as well as market access \ntowards landlocked developing countries;  \n \n20. Calls upon development partners to support landlocked developing \ncountries in their efforts to harness the benefits of trade in services and services-\nfacilitated trade, to be able to comply with sanitary and phytosanitary measures and \ntechnical standards, to develop digital trade and e-commerce, to accede to the World \nTrade Organization, to actively participate in trade negotiations and to integrate into \nthe multilateral trading system;  \n \n21. Calls upon all relevant organizations, including the United Nations system \nentities, to provide specific support commensurate with their respective competencies \nto the landlocked and transit developing countries, including for export promotion, \ntrade fairs, trade facilitation, e-commerce and the design and implementation of \ninclusive trade policies with specific consideration of the interests of women, youth \nand people in vulnerable situations;  \n \n22. Recommits to supporting landlocked developing countries to substantially \ndiversify trade by increasing the value added and manufacturing component of their \nexports and expanding their exports of services and e-commerce; \n \n23. Invites the members of the World Trade Organization to consider the \ninterest of the landlocked developing countries in establishing a dedicated work \nprogramme on landlocked developing countries under the auspices of the World Trade \nOrganization to study the special needs, challenges and vulnerabilities of landlocked \ndeveloping countries; \n \n24. Recommits to make tangible contributions to overcoming the burden of \nlandlockedness to international trade by improving transit facilities and their \nefficiency with the aim of reducing the time taken and the cost of clearing goods \nbetween and through transit countries;  \n \n25. Also recommits to substantially increase the implementation rate of the \nmeasures under the United Nations Global Survey on Digital and Sustainable Trade \nFacilitation;  \n \n26. Further recommits to support landlocked developing countries and transit \ndeveloping countries to assist them in the ratification and effective implementation \nof international conventions on trade and transport facilitation, 10 the digitalization of \ntrade and customs procedures and the implementation of the Agreement on Trade \nFacilitation, in particular the provisions of articles on the release and clearance of \ngoods, border agency cooperation, formalities connected with importation, exportation \nand transit, freedom of transit and customs cooperation;  \n \n27. Recalls the decision of the Twelfth Ministerial Conference of the World \nTrade Organization for the Trade Facilitation Committee to hold a dedicated session \n__________________ \n \n10  Including the Customs Convention on Containers (Geneva, 2 December 1972), the Customs \nConvention on the Temporary Importation of Commercial Road Vehicles (Geneva, 18 May 1956), \nthe Customs Convention on the International Transport of Goods under Cover of TIR Carnets \n(Geneva, 14 November 1975), the International Convention on the Harmonization of Frontier \nControls of Goods (Geneva, 21 October 1982) and the World Trade Organization Agreement on \nTrade Facilitation (2013). \n\nA/C.2/80/L.6\n \n7/11\n25-16442 \n \non transit issues annually until the next review of the Trade Facilitation Agreement is \ncompleted and call for the strengthening and continuation of these sessions;  \n \n28. Recommits to increase regional and subregional trade with a view to \nseizing regional integration as a tool for addressing the challenges of being \nlandlocked and unlocking trade potentials of landlocked developing countries;  \n \n29.  Also recommits to substantially increase the share of landlocked \ndeveloping countries in intraregional trade;  \n \n30. Further recommits to create provisions on transit trade within regional \ntrade agreements;  \n \n31. Recommits to supporting the strengthening and deepening of regional and \nsubregional integration arrangements, and their effective implementation, in the areas \nof trade, transport and transit facilitation, including through joint projects on \ntransport, communication, digital and energy networks, the harmonization of regional \npolicies and the sharing of best practices, and to supporting the alignment of \ndevelopment assistance, and in particular regional Aid for Trade;  \n \n32. Also recommits to further strengthen technical and financial assistance and \ncapacity-building to the landlocked developing countries and transit countries to \nsupport the landlocked developing countries in advancing their regional integration \nefforts, including to help them to formulate and implement bankable regional \ninfrastructure development projects, in cooperation with transit countries and partners;  \n \n33. Stresses that cooperation on fundamental transit policies, laws and \nregulations between landlocked developing countries and their transit neighbours is \ncrucial for the effective and integrated solution of cross-border trade and transit \ntransport problems, and underlines that this cooperation should be promoted on the \nbasis of the mutual interests of both landlocked developing countries and transit \ncountries; \n \n34. Recalls the request to the Secretary-General to establish a high-level panel \nof experts to examine the application of the existing international laws and agreements, \nidentify constraints and make recommendations on the freedom of transit for \nlandlocked developing countries in accordance with applicable rules of international \nlaw, and looks forward to the report of the panel, along with its recommendations;  \n \n35. Calls upon the landlocked developing countries and transit countries, in a \ncoordinated manner, to develop and upgrade international transport and transit \ncorridors encompassing all modes of transportation, including roads, railroads, inland \nwaterways, ports and pipelines, to address the special development needs and \nchallenges of landlocked developing countries;  \n \n36. Encourages landlocked developing countries and transit countries to \npursue connectivity-related bilateral agreements in line with regional and international \nlegal instruments, including those related to corridor development and management;  \n \n37. Recommits to enhancing support to landlocked developing countries and \ntransit countries to develop corridors along transit highways, upgrade and maintain \nexisting ones, including by closing missing links, and encourage the use of information \nand communications technologies to increase the productivity of these corridors, \nimprove safety and facilitate the sharing of information among corridor member \ncountries;  \n \n38. Recognizes that road, rail, water and air transport infrastructure, and \nconnecting river ports and seaports, remain insufficiently funded and underdeveloped, \nwith huge missing links and inadequate maintenance, and stresses the importance of \ndeveloping trade-related physical and digital infrastructure and facilitating inclusive, \n\nA/C.2/80/L.6 \n \n25-16442\n8/11 \n \nequitable and affordable connectivity for landlocked developing countries, and in this \nregard invites multilateral development banks to increase investment in infrastructure, \nincluding roads, railways, waterways and ports, energy transit and connectivity \ninfrastructure, as well as digital infrastructure, such as fibre-optic cables and satellite-\nbased systems;  \n \n39.  Also recognizes the importance of sound infrastructure governance over \nthe life cycle of projects to ensure the long-term cost-effectiveness, economic \nefficiency, accountability, transparency and integrity of infrastructure investment, \nincluding through an open procurement process, stresses that the magnitude of the \nresources required to invest in quality, reliable, sustainable and resilient infrastructure \ndevelopment and maintenance remains a major challenge that requires the forging of \ninternational, regional, subregional and bilateral cooperation on infrastructure \nprojects, the allocation of more resources from national budgets, the effective \ndeployment of international development assistance and multilateral financing in the \ndevelopment and maintenance of infrastructure and the reinforcement of the role of \nthe private sector;  \n \n40.  Recalls the declaration of the United Nations Decade of Sustainable \nTransport for the 10-year period beginning on 1 January 2026,11 and looks forward to \nan implementation plan for the Decade and its implementation;  \n \n41. Stresses that affordable, reliable, sustainable and modern energy \ninfrastructure, including cross-border infrastructure as well as energy transit and \nconnectivity infrastructure, is vital for achieving structural transformation and \nbuilding the productive capacities of landlocked developing countries, and commits \nto supporting landlocked developing countries to maintain existing infrastructure, and \nexpand and upgrade, as appropriate, for the supply, transmission and distribution of \naffordable, reliable and modern services for all in rural and urban areas and to \nproviding financial and technical support to landlocked developing countries to assist \nthem in their objective to double their per capita generation of electricity and increase \nsubstantially the share of renewable energy in the energy mix;  \n \n42. Emphasizes that information and communications technologies, including \nhigh-speed broadband, promote economic development, expresses its concern that the \ndependence of the landlocked developing countries on land links through their \nneighbouring and coastal countries for access to submarine cables and international \nInternet bandwidth raises the cost and reduces the quality of their Internet access, and \ncalls upon development partners to support landlocked developing countries, \nincluding through financial and technical assistance, in their efforts towards achieving \nuniversal access to the Internet, leveraging all available and cost-effective means, \nincluding through submarine cables and satellite-based Internet connectivity;  \n \n43. Recommits to developing and expanding the necessary information and \ncommunications technologies, including high-speed broadband, and digital \ninfrastructure as well as capacity-building for the use of modern and affordable \ncommunications technology;  \n \n44. Recognizes that both public and private investment have key roles to play \nin sustainable infrastructure financing, including through development banks, \ndevelopment finance institutions and tools and mechanisms such as public-private \npartnerships, blended finance, which combines concessional public finance, \nnon-concessional private finance and expertise from the public and private sector, \nspecial purpose vehicles, non-recourse project financing, risk mitigation instruments \nand pooled financing structures, recommits to exploring the feasibility of establishing \n__________________ \n \n11  See resolution 78/148. \n\nA/C.2/80/L.6\n \n9/11\n25-16442 \n \na dedicated infrastructure investment finance facility, and looks forward to the report \nof the Secretary-General on the feasibility of the establishment of a dedicated \ninfrastructure investment finance facility and its possible modalities;  \n \n45.  Reaffirms that the landlocked developing countries remain vulnerable to \nand are negatively affected by the adverse impacts of climate change and that they \nhave limited institutional, technical and financial capacities to tackle the challenges \narising from the adverse impacts of climate change;  \n \n46. Notes the interest and commitment of the landlocked developing countries \nto develop a dedicated work programme on landlocked developing countries under \nthe United Nations Framework Convention on Climate Change;  \n \n47.  Welcomes the establishment of the Group of Landlocked Developing \nCountries as a negotiating group under the United Nations Framework Convention on \nClimate Change as a significant step towards fostering coordinated engagement and \ncollective action by the landlocked developing countries on climate-related issues;  \n \n48.  Welcomes the convening of the twenty-ninth session of the Conference of \nthe Parties to the United Nations Framework Convention on Climate Change, the \nnineteenth session of the Conference of the Parties serving as the Meeting of the \nParties to the Kyoto Protocol and the sixth session of the Conference of the Parties \nserving as the Meeting of the Parties to the Paris Agreement in Baku in November \n2024, as the first session of the Conference of the Parties held in a landlocked \ndeveloping country, and the adoption of their decisions by Parties; \n \n49. Reaffirms the commitment to support landlocked developing countries in \ntheir preparation and implementation of national adaptation strategies to address their \npriorities, including through the formulation of national adaptation plans and the \nsubsequent implementation of the policies, programmes and projects therein, in line \nwith the global goal on adaptation and the United Arab Emirates Framework for \nGlobal Climate Resilience, as appropriate; \n \n50. Recognizes the International Think Tank for Landlocked Developing \nCountries as a valuable platform for generating evidence-based policy \nrecommendations, fostering knowledge exchange and supporting the implementation \nof the Awaza Programme of Action for Landlocked Developing Countries for the \nDecade 2024\u2013203412 and other development priorities of the landlocked developing \ncountries;  \n \n51. Reaffirms its commitment to scale up support to landlocked developing \ncountries for the preparation and implementation of adaptation projects and the \ndevelopment of climate-resilient critical infrastructure such as transport, energy, \nhealth and educational facilities, water, electricity and information and communications \ntechnologies;  \n \n52. Expresses its deep concern that coverage of and accessibility to \nmulti-hazard early warning systems, in particular for people in vulnerable situations, \nremains inadequate, emphasizes the need to urgently extend the reach of multi-hazard \nearly warning systems in landlocked developing countries, in particular by \nstrengthening the means of implementation, and recommits to the strengthening of \nearly warning systems to help landlocked developing countries\u2019 preparedness for \ndisasters;  \n \n53. Recalls article 9, paragraphs 1, 2 and 3, of the Paris Agreement, on the \nprovision of financial resources to assist developing country Parties, and recommits \n__________________ \n \n12  Resolution 79/233, annex; see also resolution 79/279. \n\nA/C.2/80/L.6 \n \n25-16442\n10/11 \n \nto continuing and striving for increased support, such as for capacity-building for \nadaptation planning and implementation in landlocked developing countries; \n \n54. Recognizes that domestic resource mobilization is a critical aspect of \neconomic development for all countries, including landlocked developing countries, \nand notes that an efficient and effective tax administration and strengthened \ninstitutional capacity of the landlocked developing countries can contribute to \nincreasing their domestic resource mobilization;  \n \n55. Notes with concern the decline in 2024 in official development assistance \nto developing countries, and urges development partners, including the developed \ncountries, to honour their respective official development assistance commitments \nfully and in time and to step up efforts to increase their official development \nassistance to landlocked developing countries, in order to effectively implement the \nAwaza Programme of Action, recognizing that grant finance and highly concessional \nfinance are of great importance to them;  \n \n56. Resolves to strengthen technical, financial and capacity-building support \nto enable landlocked developing countries to advance their sustainable development \nefforts and access innovative financing mechanisms, including to formulate and \nimplement bankable infrastructure development projects;  \n \n57. Reaffirms the aim to increase foreign direct investment to landlocked \ndeveloping countries, especially towards developing essential infrastructure, \nincluding transportation networks, such as roads, railways and ports in landlocked \ndeveloping countries, as well as multimodal systems;  \n \n58. Recommits to working to improve access to and the use and quality of \nfinancial services to lower the cost of remittances to landlocked developing countries, \nand welcomes international action, such as the Global Forum on Remittances, \nInvestment and Development, led by the International Fund for Agricultural \nDevelopment, and the Global Partnership for Financial Inclusion, with the objective \nof improving the flow and reducing the cost of remittances;  \n \n59. Notes with concern that, of the 22 landlocked developing countries for \nwhich a debt distress analysis is available, 8 have a high risk of distress and 4 are \nalready in distress, and therefore urges international organizations such as the United \nNations, the World Bank Group, the International Monetary Fund and regional \ndevelopment banks to increase support, including financial and technical assistance, \nfor institutional capacity-building in landlocked developing countries to enhance \nsustainable upstream and downstream debt management as an integral part of national \ndevelopment strategies, including by promoting comprehensive, transparent and \naccountable debt management systems and negotiation and renegotiation capacities \nand by supporting legal advice in relation to addressing external debt litigation and \ndebt data reconciliation between creditors and debtors, notably through the Common \nFramework for Debt Treatments beyond the Debt Service Suspension Initiative, so \nthat debt sustainability may be achieved and maintained;  \n \n60. Reaffirms the request made in the Sevilla Commitment to the Secretary-\nGeneral to convene a working group, with the International Monetary Fund and the \nWorld Bank, tasked with proposing a consolidated set of voluntary guiding principles \non responsible sovereign borrowing and lending, and proposals for their \nimplementation, which will work in consultation with Member States and other \nrelevant stakeholders and whose work will build on the United Nations Conference \non Trade and Development Principles on Promoting Responsible Sovereign Lending \nand Borrowing, the Group of 20 operational guidelines for sustainable financing and \nother relevant principles and guidelines;  \n\nA/C.2/80/L.6\n \n11/11\n25-16442 \n \n \n61. Reiterates the invitation to the General Assembly and the Economic and \nSocial Council, as well as the high-level political forum on sustainable development, \nto devote adequate time to discussion of the sustainable development challenges \nfacing the landlocked developing countries in order to enhance engagement and \nimplement commitments;  \n \n62. Requests the Secretary-General to ensure the full mobilization of all \nrelevant parts of the United Nations system to facilitate coordinated implementation \nand coherence in the follow-up to and monitoring of the Awaza Programme of Action \nat the national, subregional, regional and global levels;  \n \n63. Calls upon relevant organizations and bodies of the United Nations \nsystem, and invites international organizations and relevant regional and subregional \norganizations, to integrate the Awaza Programme of Action into their programmes of \nwork, as appropriate, within their respective mandates, and to support landlocked and \ntransit developing countries in their implementation of the Programme of Action in a \nwell-coordinated and coherent manner;  \n \n64. Recognizes that, over the years, the responsibilities of the Office of the \nHigh Representative for the Least Developed Countries, Landlocked Developing \nCountries and Small Island Developing States have increased considerably in their \nscope and complexity and that, in addition to its original mandate, the requirement to \nundertake research and analytical work, monitor sectoral policy developments at the \nlevel of intergovernmental processes, follow up on actions taken at the national level \nand further strengthen the network of national focal points of landlocked developing \ncountries has increased, looks forward to the report of the Secretary-General on \nstrengthening the capabilities and effectiveness of the Office of the High \nRepresentative and the United Nations system to support landlocked developing \ncountries, underlines that the Office of the High Representative should be provided \nwith adequate resources to fulfil its mandate for the timely and effective follow-up, \nmonitoring and implementation of the Awaza Programme of Action and to extend \neffective support to the landlocked developing countries, and requests the Secretary-\nGeneral to address the allocation of adequate resources for the Office in the context \nof the proposed programme budget for 2027;  \n \n65. Requests \nGovernments, \nintergovernmental \nand \nnon-governmental \norganizations, major groups and other donors to contribute in a timely manner to the \ntrust fund in support of activities undertaken by the Office of the High Representative \nfor the Least Developed Countries, Landlocked Developing Countries and Small \nIsland Developing States to support the implementation of, follow-up to and \nmonitoring of the Awaza Programme of Action;  \n \n66. Requests the Secretary-General to submit to the General Assembly at its \neighty-first session a report on the follow-up to the Third United Nations Conference \non Landlocked Developing Countries, and decides to include in the provisional \nagenda of its eighty-first session, under the item entitled \u201cGroups of countries in \nspecial situations\u201d, the sub-item entitled \u201cFollow-up to the Third United Nations \nConference on Landlocked Developing Countries\u201d.  \n \n",
  "paragraphs": {
    "1": "Takes note of the report of the Secretary-General on the follow-up to the Third United Nations Conference on Landlocked Developing Countries; 8",
    "2": "Reaffirms the commitment at the very heart of the 2030 Agenda for Sustainable Development to leave no one behind and commit to taking more tangible steps to support people in vulnerable situations and the most vulnerable countries and to reach the furthest behind first;",
    "3": "Welcomes the ministerial declaration adopted by the high-level political forum on sustainable development convened under the auspices of the Economic and Social Council, held in New York from 14 to 24 July 2025,9 and urges timely action to ensure its full implementation;",
    "4": "Recognizes that landlocked developing countries face major structural impediments to sustainable development, including weak productive and supply capacities, limited economic diversification and concentration in low value-added activities, which constrain their ability to foster technology spillovers, diversify their economies and create productive and sustainable employment opportunities;",
    "5": "Emphasizes the central role of sustainable agricultural production, food security, nutrition and food safety as key elements for the eradication of poverty, while recognizing that agriculture accounts on average for 17 per cent of the gross domestic product of landlocked developing countries and provides employment for approximately 55 per cent of their workforce, and stresses in this regard the need to enhance investment in rural infrastructure and in agricultural research and development and to accelerate the adoption of sustainable innovation practices;",
    "6": "Recommits to exploring the establishment of regional agricultural research hubs for landlocked developing countries, with a view to addressing structural impediments, enhancing agricultural productivity, promoting value addition, supporting capacity-building and facilitating improved agricultural practices, and looks forward to the report of the Secretary-General on the feasibility, effectiveness and administrative modalities of such network hubs;",
    "7": "Calls upon the international community to support landlocked developing countries in strengthening human capital, including through increased access to quality education and training, in particular science, technology, engineering and mathematics education, to improve labour productivity and meet evolving skills needs;",
    "8": "Recognizes the role of a dynamic and environmentally and socially responsible private sector as a driver of structural transformation and sustained, inclusive and equitable economic growth, and emphasizes the need for regulatory and institutional frameworks to foster entrepreneurship, particularly for micro-, small and medium-sized enterprises, including those owned by women and young people;",
    "9": "Encourages support for the establishment of special economic zones, industrial parks, technology incubators and other innovation initiatives, and stresses the importance of the establishment of regulatory frameworks and guidelines, fair market access and responsible investment practices, including in the extractive industries and critical minerals;",
    "10": "Calls upon development partners, multilateral financial institutions and the private sector to strengthen partnerships with landlocked developing countries to mobilize targeted financial and technical support for sustainable private sector development;",
    "11": "Notes with concern that landlocked developing countries lag behind global averages in digital connectivity, research and development expenditure and patent applications, and stresses the urgent need to bridge the digital divides, including the gender digital divide;",
    "12": "Calls for enhanced investment in affordable and reliable digital infrastructure and digital literacy and skills, and the establishment of regional and national research and innovation centres, including through strengthened partnerships under the Technology Facilitation Mechanism and the Broadband Commission for Sustainable Development;",
    "13": "Recognizes that industrialization is a crucial driver of economic growth, job creation and value addition in landlocked developing countries, with important spillover effects across agriculture and services, and stresses the need to double the contribution of manufacturing value added to gross domestic product and increase the share of medium- and high-tech industries by 2034;",
    "14": "Encourages landlocked developing countries to adopt proactive, equitable, inclusive and sustainable industrial policy frameworks that support rural industrialization, gender-sensitive entrepreneurship and the formalization of the informal sectors, in close coordination with trade and investment policies;",
    "15": "Calls upon development partners to provide enhanced financial, technical and capacity-building support for targeted industrial development programmes and investment in manufacturing to promote value addition, diversification and innovation;",
    "16": "Recognizes with concern that the landlocked developing countries\u2019 share of global merchandise exports was just 1.15 per cent in 2024, despite the landlocked developing countries representing 7 per cent of the world\u2019s population;",
    "17": "",
    "18": "Recognizes that trade in services, digital trade and e-commerce have great potential for overcoming the geographical constraints to trade in landlocked developing countries, and expresses its concern that the landlocked developing countries\u2019 share of global exports of services reached only 0.8 per cent in 2024, while their share of digitally deliverable services reached only 0.3 per cent in 2024;",
    "19": "Calls for the strengthening of the trade and productive capacities of the landlocked developing countries, by enhancing aid for trade as well as market access towards landlocked developing countries;",
    "20": "Calls upon development partners to support landlocked developing countries in their efforts to harness the benefits of trade in services and services- facilitated trade, to be able to comply with sanitary and phytosanitary measures and technical standards, to develop digital trade and e-commerce, to accede to the World Trade Organization, to actively participate in trade negotiations and to integrate into the multilateral trading system;",
    "21": "Calls upon all relevant organizations, including the United Nations system entities, to provide specific support commensurate with their respective competencies to the landlocked and transit developing countries, including for export promotion, trade fairs, trade facilitation, e-commerce and the design and implementation of inclusive trade policies with specific consideration of the interests of women, youth and people in vulnerable situations;",
    "22": "Recommits to supporting landlocked developing countries to substantially diversify trade by increasing the value added and manufacturing component of their exports and expanding their exports of services and e-commerce;",
    "23": "Invites the members of the World Trade Organization to consider the interest of the landlocked developing countries in establishing a dedicated work programme on landlocked developing countries under the auspices of the World Trade Organization to study the special needs, challenges and vulnerabilities of landlocked developing countries;",
    "24": "Recommits to make tangible contributions to overcoming the burden of landlockedness to international trade by improving transit facilities and their efficiency with the aim of reducing the time taken and the cost of clearing goods between and through transit countries;",
    "25": "Also recommits to substantially increase the implementation rate of the measures under the United Nations Global Survey on Digital and Sustainable Trade Facilitation;",
    "26": "Further recommits to support landlocked developing countries and transit developing countries to assist them in the ratification and effective implementation of international conventions on trade and transport facilitation, 10 the digitalization of trade and customs procedures and the implementation of the Agreement on Trade Facilitation, in particular the provisions of articles on the release and clearance of goods, border agency cooperation, formalities connected with importation, exportation and transit, freedom of transit and customs cooperation;",
    "27": "Recalls the decision of the Twelfth Ministerial Conference of the World Trade Organization for the Trade Facilitation Committee to hold a dedicated session on transit issues annually until the next review of the Trade Facilitation Agreement is completed and call for the strengthening and continuation of these sessions;",
    "28": "Recommits to increase regional and subregional trade with a view to seizing regional integration as a tool for addressing the challenges of being landlocked and unlocking trade potentials of landlocked developing countries;",
    "29": "Also recommits to substantially increase the share of landlocked developing countries in intraregional trade;",
    "30": "Further recommits to create provisions on transit trade within regional trade agreements;",
    "31": "Recommits to supporting the strengthening and deepening of regional and subregional integration arrangements, and their effective implementation, in the areas of trade, transport and transit facilitation, including through joint projects on transport, communication, digital and energy networks, the harmonization of regional policies and the sharing of best practices, and to supporting the alignment of development assistance, and in particular regional Aid for Trade;",
    "32": "Also recommits to further strengthen technical and financial assistance and capacity-building to the landlocked developing countries and transit countries to support the landlocked developing countries in advancing their regional integration efforts, including to help them to formulate and implement bankable regional infrastructure development projects, in cooperation with transit countries and partners;",
    "33": "Stresses that cooperation on fundamental transit policies, laws and regulations between landlocked developing countries and their transit neighbours is crucial for the effective and integrated solution of cross-border trade and transit transport problems, and underlines that this cooperation should be promoted on the basis of the mutual interests of both landlocked developing countries and transit countries;",
    "34": "Recalls the request to the Secretary-General to establish a high-level panel of experts to examine the application of the existing international laws and agreements, identify constraints and make recommendations on the freedom of transit for landlocked developing countries in accordance with applicable rules of international law, and looks forward to the report of the panel, along with its recommendations;",
    "35": "Calls upon the landlocked developing countries and transit countries, in a coordinated manner, to develop and upgrade international transport and transit corridors encompassing all modes of transportation, including roads, railroads, inland waterways, ports and pipelines, to address the special development needs and challenges of landlocked developing countries;",
    "36": "Encourages landlocked developing countries and transit countries to pursue connectivity-related bilateral agreements in line with regional and international legal instruments, including those related to corridor development and management;",
    "37": "Recommits to enhancing support to landlocked developing countries and transit countries to develop corridors along transit highways, upgrade and maintain existing ones, including by closing missing links, and encourage the use of information and communications technologies to increase the productivity of these corridors, improve safety and facilitate the sharing of information among corridor member countries;",
    "38": " equitable and affordable connectivity for landlocked developing countries, and in this regard invites multilateral development banks to increase investment in infrastructure, including roads, railways, waterways and ports, energy transit and connectivity infrastructure, as well as digital infrastructure, such as fibre-optic cables and satellite- based systems;",
    "39": "Also recognizes the importance of sound infrastructure governance over the life cycle of projects to ensure the long-term cost-effectiveness, economic efficiency, accountability, transparency and integrity of infrastructure investment, including through an open procurement process, stresses that the magnitude of the resources required to invest in quality, reliable, sustainable and resilient infrastructure development and maintenance remains a major challenge that requires the forging of international, regional, subregional and bilateral cooperation on infrastructure projects, the allocation of more resources from national budgets, the effective deployment of international development assistance and multilateral financing in the development and maintenance of infrastructure and the reinforcement of the role of the private sector;",
    "40": "Recalls the declaration of the United Nations Decade of Sustainable Transport for the 10-year period beginning on 1 January 2026,11 and looks forward to an implementation plan for the Decade and its implementation;",
    "41": "Stresses that affordable, reliable, sustainable and modern energy infrastructure, including cross-border infrastructure as well as energy transit and connectivity infrastructure, is vital for achieving structural transformation and building the productive capacities of landlocked developing countries, and commits to supporting landlocked developing countries to maintain existing infrastructure, and expand and upgrade, as appropriate, for the supply, transmission and distribution of affordable, reliable and modern services for all in rural and urban areas and to providing financial and technical support to landlocked developing countries to assist them in their objective to double their per capita generation of electricity and increase substantially the share of renewable energy in the energy mix;",
    "42": "Emphasizes that information and communications technologies, including high-speed broadband, promote economic development, expresses its concern that the dependence of the landlocked developing countries on land links through their neighbouring and coastal countries for access to submarine cables and international Internet bandwidth raises the cost and reduces the quality of their Internet access, and calls upon development partners to support landlocked developing countries, including through financial and technical assistance, in their efforts towards achieving universal access to the Internet, leveraging all available and cost-effective means, including through submarine cables and satellite-based Internet connectivity;",
    "43": "Recommits to developing and expanding the necessary information and communications technologies, including high-speed broadband, and digital infrastructure as well as capacity-building for the use of modern and affordable communications technology;",
    "44": "Recognizes that both public and private investment have key roles to play in sustainable infrastructure financing, including through development banks, development finance institutions and tools and mechanisms such as public-private partnerships, blended finance, which combines concessional public finance, non-concessional private finance and expertise from the public and private sector, special purpose vehicles, non-recourse project financing, risk mitigation instruments and pooled financing structures, recommits to exploring the feasibility of establishing a dedicated infrastructure investment finance facility, and looks forward to the report of the Secretary-General on the feasibility of the establishment of a dedicated infrastructure investment finance facility and its possible modalities;",
    "45": "Reaffirms that the landlocked developing countries remain vulnerable to and are negatively affected by the adverse impacts of climate change and that they have limited institutional, technical and financial capacities to tackle the challenges arising from the adverse impacts of climate change;",
    "46": "Notes the interest and commitment of the landlocked developing countries to develop a dedicated work programme on landlocked developing countries under the United Nations Framework Convention on Climate Change;",
    "47": "Welcomes the establishment of the Group of Landlocked Developing Countries as a negotiating group under the United Nations Framework Convention on Climate Change as a significant step towards fostering coordinated engagement and collective action by the landlocked developing countries on climate-related issues;",
    "48": "Welcomes the convening of the twenty-ninth session of the Conference of the Parties to the United Nations Framework Convention on Climate Change, the nineteenth session of the Conference of the Parties serving as the Meeting of the Parties to the Kyoto Protocol and the sixth session of the Conference of the Parties serving as the Meeting of the Parties to the Paris Agreement in Baku in November 2024, as the first session of the Conference of the Parties held in a landlocked developing country, and the adoption of their decisions by Parties;",
    "49": "Reaffirms the commitment to support landlocked developing countries in their preparation and implementation of national adaptation strategies to address their priorities, including through the formulation of national adaptation plans and the subsequent implementation of the policies, programmes and projects therein, in line with the global goal on adaptation and the United Arab Emirates Framework for Global Climate Resilience, as appropriate;",
    "50": "Recognizes the International Think Tank for Landlocked Developing Countries as a valuable platform for generating evidence-based policy recommendations, fostering knowledge exchange and supporting the implementation of the Awaza Programme of Action for Landlocked Developing Countries for the Decade 2024\u2013203412 and other development priorities of the landlocked developing countries;",
    "51": "Reaffirms its commitment to scale up support to landlocked developing countries for the preparation and implementation of adaptation projects and the development of climate-resilient critical infrastructure such as transport, energy, health and educational facilities, water, electricity and information and communications technologies;",
    "52": "Expresses its deep concern that coverage of and accessibility to multi-hazard early warning systems, in particular for people in vulnerable situations, remains inadequate, emphasizes the need to urgently extend the reach of multi-hazard early warning systems in landlocked developing countries, in particular by strengthening the means of implementation, and recommits to the strengthening of early warning systems to help landlocked developing countries\u2019 preparedness for disasters;",
    "53": "Recalls article 9, paragraphs 1, 2 and 3, of the Paris Agreement, on the provision of financial resources to assist developing country Parties, and recommits to continuing and striving for increased support, such as for capacity-building for adaptation planning and implementation in landlocked developing countries;",
    "54": "Recognizes that domestic resource mobilization is a critical aspect of economic development for all countries, including landlocked developing countries, and notes that an efficient and effective tax administration and strengthened institutional capacity of the landlocked developing countries can contribute to increasing their domestic resource mobilization;",
    "55": "Notes with concern the decline in 2024 in official development assistance to developing countries, and urges development partners, including the developed countries, to honour their respective official development assistance commitments fully and in time and to step up efforts to increase their official development assistance to landlocked developing countries, in order to effectively implement the Awaza Programme of Action, recognizing that grant finance and highly concessional finance are of great importance to them;",
    "56": "Resolves to strengthen technical, financial and capacity-building support to enable landlocked developing countries to advance their sustainable development efforts and access innovative financing mechanisms, including to formulate and implement bankable infrastructure development projects;",
    "57": "Reaffirms the aim to increase foreign direct investment to landlocked developing countries, especially towards developing essential infrastructure, including transportation networks, such as roads, railways and ports in landlocked developing countries, as well as multimodal systems;",
    "58": "Recommits to working to improve access to and the use and quality of financial services to lower the cost of remittances to landlocked developing countries, and welcomes international action, such as the Global Forum on Remittances, Investment and Development, led by the International Fund for Agricultural Development, and the Global Partnership for Financial Inclusion, with the objective of improving the flow and reducing the cost of remittances;",
    "59": "Notes with concern that, of the 22 landlocked developing countries for which a debt distress analysis is available, 8 have a high risk of distress and 4 are already in distress, and therefore urges international organizations such as the United Nations, the World Bank Group, the International Monetary Fund and regional development banks to increase support, including financial and technical assistance, for institutional capacity-building in landlocked developing countries to enhance sustainable upstream and downstream debt management as an integral part of national development strategies, including by promoting comprehensive, transparent and accountable debt management systems and negotiation and renegotiation capacities and by supporting legal advice in relation to addressing external debt litigation and debt data reconciliation between creditors and debtors, notably through the Common Framework for Debt Treatments beyond the Debt Service Suspension Initiative, so that debt sustainability may be achieved and maintained;",
    "60": "",
    "61": "Reiterates the invitation to the General Assembly and the Economic and Social Council, as well as the high-level political forum on sustainable development, to devote adequate time to discussion of the sustainable development challenges facing the landlocked developing countries in order to enhance engagement and implement commitments;",
    "62": "Requests the Secretary-General to ensure the full mobilization of all relevant parts of the United Nations system to facilitate coordinated implementation and coherence in the follow-up to and monitoring of the Awaza Programme of Action at the national, subregional, regional and global levels;",
    "63": "Calls upon relevant organizations and bodies of the United Nations system, and invites international organizations and relevant regional and subregional organizations, to integrate the Awaza Programme of Action into their programmes of work, as appropriate, within their respective mandates, and to support landlocked and transit developing countries in their implementation of the Programme of Action in a well-coordinated and coherent manner;",
    "64": "Recognizes that, over the years, the responsibilities of the Office of the High Representative for the Least Developed Countries, Landlocked Developing Countries and Small Island Developing States have increased considerably in their scope and complexity and that, in addition to its original mandate, the requirement to undertake research and analytical work, monitor sectoral policy developments at the level of intergovernmental processes, follow up on actions taken at the national level and further strengthen the network of national focal points of landlocked developing countries has increased, looks forward to the report of the Secretary-General on strengthening the capabilities and effectiveness of the Office of the High Representative and the United Nations system to support landlocked developing countries, underlines that the Office of the High Representative should be provided with adequate resources to fulfil its mandate for the timely and effective follow-up, monitoring and implementation of the Awaza Programme of Action and to extend effective support to the landlocked developing countries, and requests the Secretary- General to address the allocation of adequate resources for the Office in the context of the proposed programme budget for 2027;",
    "65": "Requests Governments, intergovernmental and non-governmental organizations, major groups and other donors to contribute in a timely manner to the trust fund in support of activities undertaken by the Office of the High Representative for the Least Developed Countries, Landlocked Developing Countries and Small Island Developing States to support the implementation of, follow-up to and monitoring of the Awaza Programme of Action;",
    "66": "Requests the Secretary-General to submit to the General Assembly at its eighty-first session a report on the follow-up to the Third United Nations Conference on Landlocked Developing Countries, and decides to include in the provisional agenda of its eighty-first session, under the item entitled \u201cGroups of countries in special situations\u201d, the sub-item entitled \u201cFollow-up to the Third United Nations Conference on Landlocked Developing Countries\u201d."
  },
  "agenda_items": [
    "Item 21"
  ],
  "symbol_references": [
    "A/C.2/80/L.6"
  ]
}