{
  "symbol": "A/C.2/80/L.21",
  "filename": "A_C.2_80_L.21.pdf",
  "title": "Financial inclusion for sustainable development",
  "text": "United Nations \nA/C.2/80/L.21\n \n \nGeneral Assembly \nDistr.: Limited \n15 October 2025 \nOriginal: English \n \n25-16736 (E)    221025 \n*2516736* \n \n \nEightieth session \nSecond Committee \nAgenda item 16 (e) \nMacroeconomic policy questions: financial inclusion \nfor sustainable development \n \n \n \nIraq:* draft resolution \n \n \n \n Financial inclusion for sustainable development \n \n \n \nThe General Assembly, \n \nGuided by the purposes and principles enshrined in the Charter of the United \nNations, \n \nRecalling its resolutions 70/189 of 22 December 2015, 72/206 of 20 December \n2017, 74/205 of 19 December 2019, 76/195 of 17 December 2021 and 78/139 of \n19 December 2023, \n \nReaffirming its resolution 70/1 of 25 September 2015, entitled \u201cTransforming \nour world: the 2030 Agenda for Sustainable Development\u201d, in which it adopted a \ncomprehensive, far-reaching and people-centred set of universal and transformative \nSustainable Development Goals and targets, its commitment to working tirelessly for \nthe full implementation of the Agenda by 2030, its recognition that eradicating \npoverty in all its forms and dimensions, including extreme poverty, is the greatest \nglobal challenge and an indispensable requirement for sustainable development, its \ncommitment to achieving sustainable development in its three dimensions \u2013 \neconomic, social and environmental \u2013 in a balanced and integrated manner, and to \nbuilding upon the achievements of the Millennium Development Goals and seeking \nto address their unfinished business, \n \nReaffirming also its resolution 69/313 of 27 July 2015 on the Addis Ababa \nAction Agenda of the Third International Conference on Financing for Development, \nwhich is an integral part of the 2030 Agenda for Sustainable Development, supports \nand complements it, helps to contextualize its means of implementation targets with \nconcrete policies and actions, and reaffirms the strong political commitment to \naddress the challenge of financing and creating an enabling environment at all levels \nfor sustainable development in the spirit of global partnership and solidarity, \n \nWelcoming the convening of the Fourth International Conference on Financing \nfor Development from 30 June to 3 July 2025 in Sevilla, Spain, and reaffirming its \noutcome document, the Sevilla Commitment, endorsed by the General Assembly in \n \n \n* On behalf of the States that are members of the Group of 77 and China, taking into account also \nthe provisions of General Assembly resolution ES-10/23 of 10 May 2024. \n\nA/C.2/80/L.21 \n \n25-16736\n2/7 \n \nits resolution 79/323 of 25 August 2025, which sets forth a renewed global framework \nfor financing for development, building on the 2015 Addis Ababa Action Agenda, to \nclose with urgency the estimated annual 4 trillion dollar financing gap, catalyse \nsustainable investments at scale in developing countries and reform the international \nfinancial architecture through continued and strong commitment to multilateralism, \ninternational cooperation, and global solidarity, \n \nRecalling that the 2030 Agenda, inter alia, sets out policies, the adoption and \nimplementation of which seek to increase financial inclusion, and that the Addis \nAbaba Action Agenda and the Sevilla Commitment, inter alia, seek to ensure that \npolicy and regulatory environments support financial market stability, integrity and \nthe promotion of financial inclusion in a balanced manner and with appropriate \nconsumer protection, working towards the strengthening of financial literacy, \ncapacity development for developing countries and full and equal access to formal \nfinancial services for all, in a manner that contributes to the mobilization of domestic \nresources for public and private investment in the economy and for capital formation \nand to greater availability of financial services in ways that spur enterprise growth \nand job creation and stimulate the economy and that brings more people and \nbusinesses into the formal economy in ways that stimulate economic growth, increase \ntransparency and accountability and contribute to increased tax collection, \n \nRecognizing that financial access is just one aspect of financial health and that \ncomplementary efforts are needed, including addressing structural barriers, \nstrengthening financial and digital literacy, consumer protection, and regulation, \n \nRecognizing also that financial inclusion should prioritize improving financial \nhealth outcomes, advancing a state in which individuals are able to smoothly manage \ntheir financial needs and obligations, can build resilience to financial shocks, can \npursue aspirations and goals and capture opportunities, and feel confident about their \nfinancial lives, \n \nReaffirming the Doha Programme of Action for the Least Developed Countries, \nendorsed by the General Assembly in its resolution 76/258 of 1 April 2022, which \ncommits to renewed and strengthened global partnerships for achieving sustainable \ndevelopment in least developed countries, and welcoming the Third United Nations \nConference on Landlocked Developing Countries, as mandated by the Assembly in \nits resolution 77/246 of 30 December 2022, and the fourth International Conference \non Small Island Developing States, as mandated by the Assembly in its resolution \n77/245 of 30 December 2022, \n \nReaffirming and committing to the implementation of the Buenos Aires outcome \ndocument of the second High-level United Nations Conference on South-South \nCooperation,1 \n \nEmphasizing the relevance of inclusion in the international financial system at \nall levels and the importance of considering financial inclusion and financial health \nas a policy objective in financial regulation, in accordance with national priorities and \nlegislation, \n \nRecommitting to promoting appropriate, affordable and stable access to credit \nand other financial services to micro-, small and medium-sized enterprises, in \nparticular businesses and enterprises in the social and solidarity economy operating \nin both the formal and informal sectors, as well as adequate skills development \ntraining for all, particularly for youth, persons with disabilities, older persons, \nwomen, Indigenous Peoples, local communities and entrepreneurs, \n__________________ \n \n1 Resolution 73/291, annex. \n\nA/C.2/80/L.21\n \n3/7\n25-16736 \n \n \nAcknowledging that the promotion of formal financial systems and services with \nrobust risk-based regulatory frameworks for all financial intermediation, as \nappropriate, as well as the rule of law and accountable and inclusive institutions, \ncontributes to inclusive financial systems and to effectively and comprehensively \ncombating corruption and curbing illicit financial flows, \n \nRecognizing the value and principles of multi-stakeholder engagement also with \nregard to the development of national financial inclusion and financial health strategies, \nand that multi-stakeholder partnerships and the resources, knowledge and ingenuity of \nthe private sector, civil society, the scientific community, academia, philanthropy and \nfoundations, parliaments, local authorities, volunteers and other stakeholders will be \nimportant in mobilizing and sharing knowledge, expertise, technology and financial \nresources, complementing the efforts of Governments and supporting the achievement \nof the Sustainable Development Goals, in particular in developing countries, \n \nRecognizing \nalso \nthat \nmany \npeople \nin \nvulnerable \nsituations \nare \ndisproportionately excluded from financial systems and may not have access to \nquality financial services or may be reluctant to adopt them, \n \nReiterating the pledge that no one will be left behind, reaffirming the \nrecognition that the dignity of the human person is fundamental, and the wish to see \nthe Goals and targets met for all nations and peoples and for all segments of society, \nand recommitting to endeavour to reach the furthest behind first, \n \nRecognizing that digital technologies helped societies respond to the \ncoronavirus disease (COVID-19), creating new opportunities for digital financial \nservices to accelerate and enhance financial inclusion amid social distancing and \ncontainment measures, expanding the use of such services significantly and driving \nlasting changes in all sectors of the economy, including labour markets, e-commerce \nand financial services, noting with deep concern the barriers posed by the digital \ndivide and their impact on ensuring financial inclusion, and stressing the importance \nof bridging the digital gap between and within countries in order to ensure broadening \nfinancial inclusion in societies, including through policies and financial services that \nenhance household financial health, improving digital financial literacy and consumer \nprotection, enabling access to social safety nets and eradicating poverty for those \nhardest to reach, especially in rural and remote areas, in order to benefit the poorest \nand most vulnerable, particularly youth, persons with disabilities, older persons, \nwomen, Indigenous Peoples, local communities, farmers, migrants and entrepreneurs, \n \nNoting with concern that the global Sustainable Development Goals financing \ngap is estimated at 4 trillion United States dollars annually, and that a persistent \nfinancing gap hinders progress towards the Goals, and recognizing that strengthening \nfinancial inclusion is a key lever to narrow this gap, by mobilizing mass participation \nin formal financial systems, increasing savings, enabling investment in \nmicro-enterprises and unlocking catalytic private capital, \n \nWelcoming the appointment by the Secretary-General on 25 September 2024 of \nthe Special Advocate of the Secretary-General for Financial Health, whose mandate \nreflects an evolution of the work of the Special Advocate of the Secretary-General for \nInclusive Finance for Development towards financial health, \n \n1. \nRecalls the inclusion in the 2030 Agenda for Sustainable Development2 \nof, inter alia, several targets related to the promotion of financial inclusion, also \nrecalls that the Sustainable Development Goals and associated targets are integrated \n__________________ \n \n2 Resolution 70/1. \n\nA/C.2/80/L.21 \n \n25-16736\n4/7 \n \nand indivisible and balance the three dimensions of sustainable development, and in \nthis regard looks forward to their achievement; \n \n2. \nWelcomes the outcome document of the Fourth International Conference \non Financing for Development, the Sevilla Commitment,3 and calls for its timely and \neffective implementation; \n \n3. \nRecalls the inclusion in the Addis Ababa Action Agenda of the Third \nInternational Conference on Financing for Development 4  and in the Sevilla \nCommitment of the Fourth International Conference on Financing for Development \nof, inter alia, several policies and actions intended to ensure a policy and regulatory \nenvironment for the promotion of financial inclusion, and in this regard looks forward \nto their implementation; \n \n4. \nReaffirms its decision to give consideration, as appropriate, to financial \ninclusion in the follow-up and review framework of the 2030 Agenda and in the \nfollow-up processes of the Addis Ababa Action Agenda and the Sevilla Commitment; \n \n5. \nTakes note of the consideration given to financial inclusion in the \nFinancing for Sustainable Development Report 2024,5 stresses that, while financial \ninclusion has improved in recent years, notably owing to the growth in mobile \nbanking, significant gaps remain within and among developed and developing \ncountries, and remains concerned that, globally, 1.3 billion people do not have access \nto formal financial services and that, despite increased account ownership among \nwomen, the financial inclusion gender gap remains; \n \n6. \nNotes that the provision of universal and meaningful connectivity, \nincluding through digital public infrastructure, is key to strengthening financial \ninclusion, and in this regard underlines the need for the necessary investments, \nincluding in infrastructure, such as reliable electricity, as well as affordable mobile \nphones, broadband and network services, interoperable payment systems and other \nfinancial infrastructure and services, and encourages Member States to take policy \nactions in accordance with national circumstances and priorities; \n \n7. \nAcknowledges the important role that national financial inclusion \nstrategies can play in identifying and overcoming financing gaps and binding \nconstraints and in advancing financial health, including the lack of access to finance \nfor micro-, small and medium-sized enterprises, notes that at least 79 countries have \nadopted or are in the process of developing financial inclusion strategies, and in this \nregard encourages Member States to consider the convenience of adopting and \npursuing national financial inclusion strategies and gender-responsive strategies, to \nend the structural barriers to women\u2019s equal access to economic resources and to \nexpand peer learning, experience-sharing and capacity-building among countries and \nregions in this respect, through risk-sharing mechanisms and regulatory requirements \nas well as support from international partners through blended finance; \n \n8. \nRecognizes that digitally enabled innovation in the financial sector has \ncontributed significantly to the rapid expansion of access to financial services and \nfinancial inclusion, enabling progress on the Sustainable Development Goals and \nshowing impacts across the 2030 Agenda, as outlined in the Financing for Sustainable \nDevelopment Report 2024, and supports concrete actions to advance digital financial \ninclusion and close digital divides, including the gender digital divide, across and \nwithin countries, while improving responsible digital financial practices and \nregulatory responses that promote positive financial health outcomes, including \n__________________ \n \n3 Resolution 79/323, annex. \n \n4 Resolution 69/313, annex. \n \n5 United Nations publication, 2024. \n\nA/C.2/80/L.21\n \n5/7\n25-16736 \n \nsecure savings, affordable and appropriate credit and insurance, and long-term \nresilience, as appropriate, to protect consumers\u2019 interests, financial integrity and \nsystem stability, which are mutually reinforcing and also enablers of greater financial \ninclusion; \n \n9. \nAlso recognizes the growing importance of financial technology actors and \nnew instruments and platforms, including mobile banking, Internet-based services, \nand peer-to-peer platforms and open finance, which have enabled access to financial \nservices for millions of people and provided channels for smaller companies to raise \nrisk capital, as well as the potential of big data and artificial intelligence in this \nrespect, encourages, in this context, Governments and regulatory agencies to review \nand adjust, as appropriate, legal and regulatory frameworks to cope with the risks and \nmaximize the benefits associated with these new instruments, and invites countries \nand financial technology actors to exchange experiences, promote peer learning and \npublic-private partnerships and further enhance capacity-building in financial \nservices; \n \n10. Encourages the use of digital financial technologies and services which \nhave gained further importance during the pandemic and have allowed many \nhouseholds and micro-, small and medium-sized enterprises to access financial \nservices despite lockdowns and social distancing; considers that digital financial \ninclusion is associated with higher gross domestic product growth and that the \nadoption of digital payments is consistent with the notion that financial technologies \nmay contribute to growth and sustainable development and thus play an important \nrole in mitigating the economic impact of the COVID-19 pandemic and support the \nrecovery; promotes financial innovation and its role in enhancing financial inclusion \nand fostering more inclusive and equitable access to the benefits of the emerging \ndigital economy; acknowledges the needs of the poorest and of the people in the most \nvulnerable situations, while acknowledging the importance of more inclusive and \nequitable access to the benefits of the emerging digital economy in ways that enhance \nfinancial health, providing for an open, fair and non-discriminatory business \nenvironment; and encourages multi-stakeholder partnerships, as appropriate, at the \nlocal, regional and international levels in order to allow for an exchange of \nexperiences, promote peer learning in this area and further enhance capacity-building, \naccess to finance and support of micro-, small and medium-sized enterprises, \nincluding those owned and operated by women; \n \n11. Invites further use of digital financial technologies in the delivery of \nfinancial services in an efficient, effective, quick, affordable and secure manner, so \nthat they can benefit micro-, small and medium-sized enterprises and people, \nincluding the poorest and most vulnerable, who are affected disproportionately by the \npandemic and other crises, in turn allowing Governments to expand the reach of their \nemergency responses to those in the informal sector and those who do not have access \nto bank accounts, while functioning as an enabler of the Sustainable Development \nGoals, including eradicating poverty, bridging inequality gaps, creating jobs and \npromoting gender equality and the empowerment of women and girls, and in that \nregard calls for the strengthening of digital skills and digital financial infrastructure \nas well as broadband access to promote a sustainable, inclusive and resilient recovery; \n \n12. Calls for enhanced access to capacity-building, digital government and \nbusiness services and the leveraging of digital financial tools to expand inclusion for \nmicro-, small and medium-sized enterprises; \n \n13. Calls upon Member States, in cooperation with regulators, the private \nsector and international organizations, to promote the use of emerging technologies \nsuch as artificial intelligence in financial services, ensuring that they are based on \n\nA/C.2/80/L.21 \n \n25-16736\n6/7 \n \nresponsible principles protecting human rights and fostering inclusion in accessing \nthe services; \n \n14. Promotes the use of digital technologies, digital public goods and public \ninfrastructure to deepen financial inclusion and literacy, and supports investment in \nthe development and digitalization of inclusive and accessible financial system \ninfrastructure in developing countries; \n \n15. Acknowledges that, in the absence of strong financial consumer protection, \nthe growth-enhancing benefits of expanded financial inclusion may be lost or severely \nundermined, and in this regard stresses the importance of scaled-up action to improve \nfinancial and digital literacy, with an emphasis on practical skills in the areas of \nbudgeting, saving, insurance and long-term planning, alongside effective consumer \nprotection for the poorest and most vulnerable, including for women, young people, \nrural residents and migrants; \n \n16. Promotes efforts to expand access to financial products and services across \nsociety, particularly for women, youth, persons with disabilities, displaced people, \nmigrants and those in vulnerable situations, and in this regard calls for enhanced \nefforts by Member States, international financial institutions and relevant \nstakeholders to design tailored financial products and services that address their \nspecific needs; \n \n17. Acknowledges the efforts and actions on financial inclusion for sustainable \ndevelopment undertaken by a wide range of stakeholders working in partnership, such \nas the Alliance for Financial Inclusion, the Better Than Cash Alliance, the Special \nAdvocate of the Secretary-General for Financial Health and the Group of 20 Global \nPartnership for Financial Inclusion, urges them to engage in an inclusive and \ntransparent manner with Member States in their work, in order to ensure that their \ninitiatives complement or strengthen the United Nations system, including the United \nNations Capital Development Fund and the regional commissions, and encourages \nenhanced coordination and cooperation with the Inter-Agency Task Force on \nFinancing for Development; \n \n18. Encourages the international community, including Member States, and \nall relevant stakeholders, including the entities of the United Nations system, \ninternational financial institutions, other intergovernmental bodies, regional and \nnational development banks, domestic financial institutions, credit unions, \nmulti-stakeholder partnerships and relevant non-governmental organizations, as \nappropriate, to further develop financial literacy and financial education programmes \nthat equip individuals with the capacity to strengthen their financial health, as \nappropriate, in order to ensure that all learners acquire the knowledge and skills \nneeded to access financial services, in particular women and girls, farmers and those \nworking in micro-, small and medium-sized enterprises; \n \n19. Encourages Member States and all relevant stakeholders, as appropriate, \nin the context of a renewed and strengthened Global Partnership for Sustainable \nDevelopment, led by Governments, to further efforts to reduce the transaction costs \nof migrant remittances to less than 3 per cent by 2030 and eliminate remittance \ncorridors with costs higher than 5 per cent by 2030, considering that the global \naverage was about 6.5 per cent in the first quarter of 2025, which has remained \nunchanged in the past five to six years, to support national authorities in addressing \nthe most significant obstacles to the continued flow of remittances, such as the trend \nof banks withdrawing services, and to work towards expanding access to and the \nvolume of remittances through regulated and transparent channels, and in this regard \nhighlights the potential of financial technology services to offer alternative channels \nand reduce remittance costs; \n\nA/C.2/80/L.21\n \n7/7\n25-16736 \n \n \n20. Supports developing countries in line with their national circumstances \nand priorities in creating enabling domestic environments for development of digital \nfinancial services for all, including with a gender perspective, underpinned by \npartnerships between local banks and digital financial service firms to expand access \nto and reach of remittance and financial inclusion services, especially in rural areas, \nand adaptive regulatory frameworks that effectively manage the opportunities and \nrisks of new technologies; \n \n21. Promotes open finance schemes to increase financial inclusion and the \ncompetition and growth of the fintech sector while respecting applicable national data \nprivacy and personal data protection rules; \n \n22. Looks forward to the continuing consideration of financial inclusion in the \nforthcoming reports of the Inter-Agency Task Force on financing for sustainable \ndevelopment, as appropriate and in accordance with existing mandates, as well as in \nthe annual report of the Secretary-General on progress towards the achievement of \nthe Sustainable Development Goals, and to the further consideration of financial \ninclusion for sustainable development at the 2026 Economic and Social Council \nforum on financing for development follow-up; \n \n23. Reaffirms the commitment at the very heart of the 2030 Agenda to leave \nno one behind, and commits to taking more tangible steps to support people in \nvulnerable situations and the most vulnerable countries and to reach the furthest \nbehind first; \n \n24. Decides to include in the provisional agenda of its eighty-second session, \nunder the item entitled \u201cMacroeconomic policy questions\u201d, the sub-item entitled \n\u201cFinancial inclusion for sustainable development\u201d. \n \n",
  "paragraphs": {
    "1": "Recalls the inclusion in the 2030 Agenda for Sustainable Development2 of, inter alia, several targets related to the promotion of financial inclusion, also recalls that the Sustainable Development Goals and associated targets are integrated __________________ 2 Resolution 70/1. A/C.2/80/L.21 25-16736 4/7 and indivisible and balance the three dimensions of sustainable development, and in this regard looks forward to their achievement;",
    "2": "Welcomes the outcome document of the Fourth International Conference on Financing for Development, the Sevilla Commitment,3 and calls for its timely and effective implementation;",
    "3": "Recalls the inclusion in the Addis Ababa Action Agenda of the Third International Conference on Financing for Development 4 and in the Sevilla Commitment of the Fourth International Conference on Financing for Development of, inter alia, several policies and actions intended to ensure a policy and regulatory environment for the promotion of financial inclusion, and in this regard looks forward to their implementation;",
    "4": "Reaffirms its decision to give consideration, as appropriate, to financial inclusion in the follow-up and review framework of the 2030 Agenda and in the follow-up processes of the Addis Ababa Action Agenda and the Sevilla Commitment;",
    "5": "Takes note of the consideration given to financial inclusion in the Financing for Sustainable Development Report 2024,5 stresses that, while financial inclusion has improved in recent years, notably owing to the growth in mobile banking, significant gaps remain within and among developed and developing countries, and remains concerned that, globally, 1.3 billion people do not have access to formal financial services and that, despite increased account ownership among women, the financial inclusion gender gap remains;",
    "6": "Notes that the provision of universal and meaningful connectivity, including through digital public infrastructure, is key to strengthening financial inclusion, and in this regard underlines the need for the necessary investments, including in infrastructure, such as reliable electricity, as well as affordable mobile phones, broadband and network services, interoperable payment systems and other financial infrastructure and services, and encourages Member States to take policy actions in accordance with national circumstances and priorities;",
    "7": "Acknowledges the important role that national financial inclusion strategies can play in identifying and overcoming financing gaps and binding constraints and in advancing financial health, including the lack of access to finance for micro-, small and medium-sized enterprises, notes that at least 79 countries have adopted or are in the process of developing financial inclusion strategies, and in this regard encourages Member States to consider the convenience of adopting and pursuing national financial inclusion strategies and gender-responsive strategies, to end the structural barriers to women\u2019s equal access to economic resources and to expand peer learning, experience-sharing and capacity-building among countries and regions in this respect, through risk-sharing mechanisms and regulatory requirements as well as support from international partners through blended finance;",
    "8": "Recognizes that digitally enabled innovation in the financial sector has contributed significantly to the rapid expansion of access to financial services and financial inclusion, enabling progress on the Sustainable Development Goals and showing impacts across the 2030 Agenda, as outlined in the Financing for Sustainable Development Report 2024, and supports concrete actions to advance digital financial inclusion and close digital divides, including the gender digital divide, across and within countries, while improving responsible digital financial practices and regulatory responses that promote positive financial health outcomes, including __________________ 3 Resolution 79/323, annex. 4 Resolution 69/313, annex. 5 United Nations publication, 2024. A/C.2/80/L.21 5/7 25-16736 secure savings, affordable and appropriate credit and insurance, and long-term resilience, as appropriate, to protect consumers\u2019 interests, financial integrity and system stability, which are mutually reinforcing and also enablers of greater financial inclusion;",
    "9": "Also recognizes the growing importance of financial technology actors and new instruments and platforms, including mobile banking, Internet-based services, and peer-to-peer platforms and open finance, which have enabled access to financial services for millions of people and provided channels for smaller companies to raise risk capital, as well as the potential of big data and artificial intelligence in this respect, encourages, in this context, Governments and regulatory agencies to review and adjust, as appropriate, legal and regulatory frameworks to cope with the risks and maximize the benefits associated with these new instruments, and invites countries and financial technology actors to exchange experiences, promote peer learning and public-private partnerships and further enhance capacity-building in financial services;",
    "10": "Encourages the use of digital financial technologies and services which have gained further importance during the pandemic and have allowed many households and micro-, small and medium-sized enterprises to access financial services despite lockdowns and social distancing; considers that digital financial inclusion is associated with higher gross domestic product growth and that the adoption of digital payments is consistent with the notion that financial technologies may contribute to growth and sustainable development and thus play an important role in mitigating the economic impact of the COVID-19 pandemic and support the recovery; promotes financial innovation and its role in enhancing financial inclusion and fostering more inclusive and equitable access to the benefits of the emerging digital economy; acknowledges the needs of the poorest and of the people in the most vulnerable situations, while acknowledging the importance of more inclusive and equitable access to the benefits of the emerging digital economy in ways that enhance financial health, providing for an open, fair and non-discriminatory business environment; and encourages multi-stakeholder partnerships, as appropriate, at the local, regional and international levels in order to allow for an exchange of experiences, promote peer learning in this area and further enhance capacity-building, access to finance and support of micro-, small and medium-sized enterprises, including those owned and operated by women;",
    "11": "Invites further use of digital financial technologies in the delivery of financial services in an efficient, effective, quick, affordable and secure manner, so that they can benefit micro-, small and medium-sized enterprises and people, including the poorest and most vulnerable, who are affected disproportionately by the pandemic and other crises, in turn allowing Governments to expand the reach of their emergency responses to those in the informal sector and those who do not have access to bank accounts, while functioning as an enabler of the Sustainable Development Goals, including eradicating poverty, bridging inequality gaps, creating jobs and promoting gender equality and the empowerment of women and girls, and in that regard calls for the strengthening of digital skills and digital financial infrastructure as well as broadband access to promote a sustainable, inclusive and resilient recovery;",
    "12": "Calls for enhanced access to capacity-building, digital government and business services and the leveraging of digital financial tools to expand inclusion for micro-, small and medium-sized enterprises;",
    "13": "Calls upon Member States, in cooperation with regulators, the private sector and international organizations, to promote the use of emerging technologies such as artificial intelligence in financial services, ensuring that they are based on A/C.2/80/L.21 25-16736 6/7 responsible principles protecting human rights and fostering inclusion in accessing the services;",
    "14": "Promotes the use of digital technologies, digital public goods and public infrastructure to deepen financial inclusion and literacy, and supports investment in the development and digitalization of inclusive and accessible financial system infrastructure in developing countries;",
    "15": "Acknowledges that, in the absence of strong financial consumer protection, the growth-enhancing benefits of expanded financial inclusion may be lost or severely undermined, and in this regard stresses the importance of scaled-up action to improve financial and digital literacy, with an emphasis on practical skills in the areas of budgeting, saving, insurance and long-term planning, alongside effective consumer protection for the poorest and most vulnerable, including for women, young people, rural residents and migrants;",
    "16": "Promotes efforts to expand access to financial products and services across society, particularly for women, youth, persons with disabilities, displaced people, migrants and those in vulnerable situations, and in this regard calls for enhanced efforts by Member States, international financial institutions and relevant stakeholders to design tailored financial products and services that address their specific needs;",
    "17": "Acknowledges the efforts and actions on financial inclusion for sustainable development undertaken by a wide range of stakeholders working in partnership, such as the Alliance for Financial Inclusion, the Better Than Cash Alliance, the Special Advocate of the Secretary-General for Financial Health and the Group of 20 Global Partnership for Financial Inclusion, urges them to engage in an inclusive and transparent manner with Member States in their work, in order to ensure that their initiatives complement or strengthen the United Nations system, including the United Nations Capital Development Fund and the regional commissions, and encourages enhanced coordination and cooperation with the Inter-Agency Task Force on Financing for Development;",
    "18": "Encourages the international community, including Member States, and all relevant stakeholders, including the entities of the United Nations system, international financial institutions, other intergovernmental bodies, regional and national development banks, domestic financial institutions, credit unions, multi-stakeholder partnerships and relevant non-governmental organizations, as appropriate, to further develop financial literacy and financial education programmes that equip individuals with the capacity to strengthen their financial health, as appropriate, in order to ensure that all learners acquire the knowledge and skills needed to access financial services, in particular women and girls, farmers and those working in micro-, small and medium-sized enterprises;",
    "19": "Encourages Member States and all relevant stakeholders, as appropriate, in the context of a renewed and strengthened Global Partnership for Sustainable Development, led by Governments, to further efforts to reduce the transaction costs of migrant remittances to less than 3 per cent by 2030 and eliminate remittance corridors with costs higher than 5 per cent by 2030, considering that the global average was about 6.5 per cent in the first quarter of 2025, which has remained unchanged in the past five to six years, to support national authorities in addressing the most significant obstacles to the continued flow of remittances, such as the trend of banks withdrawing services, and to work towards expanding access to and the volume of remittances through regulated and transparent channels, and in this regard highlights the potential of financial technology services to offer alternative channels and reduce remittance costs; A/C.2/80/L.21 7/7 25-16736",
    "20": "Supports developing countries in line with their national circumstances and priorities in creating enabling domestic environments for development of digital financial services for all, including with a gender perspective, underpinned by partnerships between local banks and digital financial service firms to expand access to and reach of remittance and financial inclusion services, especially in rural areas, and adaptive regulatory frameworks that effectively manage the opportunities and risks of new technologies;",
    "21": "Promotes open finance schemes to increase financial inclusion and the competition and growth of the fintech sector while respecting applicable national data privacy and personal data protection rules;",
    "22": "Looks forward to the continuing consideration of financial inclusion in the forthcoming reports of the Inter-Agency Task Force on financing for sustainable development, as appropriate and in accordance with existing mandates, as well as in the annual report of the Secretary-General on progress towards the achievement of the Sustainable Development Goals, and to the further consideration of financial inclusion for sustainable development at the 2026 Economic and Social Council forum on financing for development follow-up;",
    "23": "Reaffirms the commitment at the very heart of the 2030 Agenda to leave no one behind, and commits to taking more tangible steps to support people in vulnerable situations and the most vulnerable countries and to reach the furthest behind first;",
    "24": "Decides to include in the provisional agenda of its eighty-second session, under the item entitled \u201cMacroeconomic policy questions\u201d, the sub-item entitled \u201cFinancial inclusion for sustainable development\u201d."
  },
  "agenda_items": [
    "Item 16"
  ],
  "symbol_references": [
    "A/C.2/80/L.21"
  ]
}