{
  "symbol": "A/C.1/80/L.28",
  "filename": "A_C.1_80_L.28.pdf",
  "title": "Objective information on military matters, including transparency of military expenditures",
  "text": "United Nations \nA/C.1/80/L.28\n \n \nGeneral Assembly \nDistr.: Limited \n13 October 2025 \nOriginal: English \n \n25-16550 (E)    211025     \n*2516550* \n \n \nEightieth session \nFirst Committee \nAgenda item 90 (b) \nReduction of military budgets: objective information \non military matters, including transparency of \nmilitary expenditures \n \n \n \n \n \nAlbania, Australia, Belgium, Bosnia and Herzegovina, Bulgaria, Chile, China, \nCroatia, Czechia, Denmark, Estonia, Finland, France, Germany, Greece, \nHungary, Iceland, Ireland, Italy, Japan, Latvia, Lithuania, Luxembourg, \nMalta, Netherlands (Kingdom of the), Norway, Portugal, Republic of Moldova, \nRomania, San Marino, Slovakia, Slovenia and Sweden: draft resolution \n \n \n \n Objective information on military matters, including transparency \nof military expenditures \n \n \n \nThe General Assembly,  \n \nRecalling its resolutions 53/72 of 4 December 1998, 54/43 of 1 December 1999, \n56/14 of 29 November 2001, 58/28 of 8 December 2003, 60/44 of 8 December 2005, \n62/13 of 5 December 2007, 64/22 of 2 December 2009, 66/20 of 2 December 2011, \n68/23 of 5 December 2013, 70/21 of 7 December 2015, 72/20 of 4 December 2017, \n74/24 of 12 December 2019 and 77/33 of 7 December 2022 on objective information \non military matters, including transparency of military expenditures, \n \nRecalling also its resolution 35/142 B of 12 December 1980, which introduced \nthe United Nations system for the standardized reporting of military expenditures, its \nresolutions 48/62 of 16 December 1993, 49/66 of 15 December 1994, 51/38 of \n10 December 1996 and 52/32 of 9 December 1997, in which the General Assembly \ncalled upon all Member States to participate in the system, and its resolution 47/54 B \nof 9 December 1992, in which the Assembly endorsed the guidelines and \nrecommendations for objective information on military matters and invited Member \nStates to provide the Secretary-General with relevant information regarding their \nimplementation, \n \nNoting that, since then, national reports on military expenditures and on the \nguidelines and recommendations for objective information on military matters have \nbeen submitted by a number of Member States belonging to different geographical \nregions, \n \nConvinced that transparency in military matters is an essential element for \nbuilding a climate of trust and confidence between States worldwide and that a better \n\nA/C.1/80/L.28 \n \n25-16550\n2/4 \n \nflow of objective information on military matters can help to relieve international \ntension and is therefore an important contribution to conflict prevention, \n \nNoting the role of the standardized reporting system, as instituted through its \nresolution 35/142 B, as an important instrument to enhance transparency in military \nmatters, \n \nConscious that the value of the standardized reporting system would be further \nenhanced by a broader participation of all Member States, \n \nNoting that a periodic review of the United Nations Report on Military \nExpenditures could facilitate its further development and maintain its continued \nrelevance and operation, and recalling that, in its resolution 66/20, the General \nAssembly recommended the establishment of a process for periodic reviews, \n \nRecalling, in that regard, the report of the Secretary-General on ways and means \nto implement the guidelines and recommendations for objective information on \nmilitary matters, including, in particular, on how to strengthen and broaden \nparticipation in the standardized reporting system,1 \n \nRecalling also the report of the Group of Governmental Experts on the \nOperation and Further Development of the United Nations Standardized Instrument \nfor Reporting Military Expenditures on further ways and means to implement the \nguidelines and recommendations for objective information on military matters, \nincluding, in particular, on how to strengthen and broaden participation in the \nstandardized reporting system,2 \n \nWelcoming the new interactive web platform of the Secretariat on military \nexpenditures,3 as well as the new online reporting tool,4 both available in the six \nofficial languages of the United Nations, thus increasing user-friendliness and \nfacilitating the submission of reports, in accordance with resolution 66/20, \n \nNoting the efforts of several regional organizations to promote transparency of \nmilitary expenditures, including standardized annual exchanges of relevant \ninformation among their member States, \n \nEmphasizing the continuing importance of the Report on Military Expenditures \nunder the current political and economic circumstances, \n \nRecalling that, in its resolution 66/20, the General Assembly recommended that, \nfor the purpose of reporting by Member States of their national military expenditures \nin the framework of the Report on Military Expenditures, \u201cmilitary expenditures\u201d be \ncommonly understood to refer to all financial resources that a State spends on the \nuses and functions of its military forces and information on military expenditures \nrepresents an actual outlay in current prices and domestic currency, \n \nMindful of the provisions of the Charter of the United Nations, including its \nArticle 26, \n \n1. \nCalls upon Member States, with a view to achieving the broadest possible \nparticipation, to provide the Secretary-General, by 30 April annually, with a report on \ntheir military expenditures for the latest fiscal year for which data are available, using, \npreferably and to the extent possible, one of the online reporting forms, including, if \nappropriate, a nil report or the \u201csingle figure\u201d report on military expenditures or any \n__________________ \n \n1 A/54/298. \n \n2 A/66/89, A/66/89/Corr.1, A/66/89/Corr.2 and A/66/89/Corr.3. \n \n3  See https://milex-reporting.unoda.org/en/states.  \n \n4 See https://milex-reporting.unoda.org/en/reporting-tool.  \n\nA/C.1/80/L.28\n \n3/4\n25-16550 \n \nother format developed in the context of similar reporting on military expenditures to \nother international or regional organizations; \n \n2. \nRecommends the guidelines and recommendations for objective \ninformation on military matters to all Member States for implementation, fully taking \ninto account specific political, military and other conditions prevailing in a region; \n \n3. \nInvites Member States to supplement their reports with explanatory \nremarks regarding submitted data to explain or clarify the figures provided in the \nreporting forms, such as the total military expenditures as a share of gross domestic \nproduct, major changes from previous reports and any additional information \nreflecting their defence policy, military strategies and doctrines; \n \n4. \nAlso invites Member States to provide, with their annual report, \ninformation on their national points of contact; \n \n5. \nEncourages relevant international bodies and regional organizations to \npromote transparency of military expenditures and to enhance complementarities \namong reporting systems, taking into account the particular characteristics of each \nregion, and to consider the possibility of an exchange of information with the United \nNations; \n \n6. \nTakes note of the annual report of the Secretary-General;5  \n \n7. \nRequests the Secretary-General, within available resources: \n \n(a) \nTo continue the practice of sending an annual note verbale to Member \nStates requesting the submission of their report on military expenditures; \n \n(b) \nTo circulate annually a note verbale to Member States detailing which \nreports on military expenditures were submitted and are available online; \n \n(c) \nTo continue consultations with relevant international bodies, with a view \nto ascertaining requirements for adjusting the present instrument in order to \nencourage wider participation, and to make recommendations, based on the outcome \nof those consultations and taking into account the views of Member States, on \nnecessary changes to the content and structure of the standardized reporting system; \n \n(d) \nTo encourage relevant international bodies and organizations to promote \ntransparency of military expenditures and to consult with those bodies and \norganizations \nwith \nemphasis \non \nexamining \npossibilities \nfor \nenhancing \ncomplementarities among international and regional reporting systems and for \nexchanging related information between those bodies and the United Nations; \n \n(e) \nTo continue to foster further cooperation with relevant regional \norganizations, with a view to raising awareness of the United Nations Report on \nMilitary Expenditures and its role as a confidence-building measure; \n \n(f) \nTo encourage the United Nations regional centres for peace and \ndisarmament in Africa, in Asia and the Pacific and in Latin America and the Caribbean \nto assist Member States in their regions in enhancing their knowledge of the \nstandardized reporting system; \n \n(g) \nTo promote international and regional or subregional symposiums and \ntraining seminars and to support the development of an online training course by the \nSecretariat, with the financial and technical support of interested States, with a view \nto explaining the purpose of the standardized reporting system and facilitating the \nsecure online filing of the reports; \n__________________ \n \n5 A/80/225. \n\nA/C.1/80/L.28 \n \n25-16550\n4/4 \n \n \n(h) \nTo report on experiences gained during such symposiums and training \nseminars; \n \n(i) \nTo provide, upon request, technical assistance to Member States lacking \nthe capacity to report data and to encourage Member States to voluntarily provide \nbilateral assistance to other Member States; \n \n8. \nEncourages Member States: \n \n(a) \nTo inform the Secretary-General about possible problems with the \nstandardized reporting system and their reasons for not submitting the requested data; \n \n(b) \nTo continue to provide the Secretary-General with their views and \nsuggestions on ways and means to improve the future functioning of and broadened \nparticipation in the standardized reporting system, including necessary changes to its \ncontent and structure, as well as recommendations to facilitate its further \ndevelopment; \n \n9. \nDecides to remain seized of the matter of the possible establishment of a \nprocess of periodic reviews of the Report on Military Expenditures, taking into \naccount the information referred to in paragraph 8 above; \n \n10. Also decides to include in the provisional agenda of its eighty-third \nsession, under the item entitled \u201cReduction of military budgets\u201d, the sub-item entitled \n\u201cObjective information on military matters, including transparency of military \nexpenditures\u201d. \n \n",
  "paragraphs": {
    "1": "Calls upon Member States, with a view to achieving the broadest possible participation, to provide the Secretary-General, by 30 April annually, with a report on their military expenditures for the latest fiscal year for which data are available, using, preferably and to the extent possible, one of the online reporting forms, including, if appropriate, a nil report or the \u201csingle figure\u201d report on military expenditures or any __________________ 1 A/54/298. 2 A/66/89, A/66/89/Corr.1, A/66/89/Corr.2 and A/66/89/Corr.3. 3 See https://milex-reporting.unoda.org/en/states. 4 See https://milex-reporting.unoda.org/en/reporting-tool. A/C.1/80/L.28 3/4 25-16550 other format developed in the context of similar reporting on military expenditures to other international or regional organizations;",
    "2": "Recommends the guidelines and recommendations for objective information on military matters to all Member States for implementation, fully taking into account specific political, military and other conditions prevailing in a region;",
    "3": "Invites Member States to supplement their reports with explanatory remarks regarding submitted data to explain or clarify the figures provided in the reporting forms, such as the total military expenditures as a share of gross domestic product, major changes from previous reports and any additional information reflecting their defence policy, military strategies and doctrines;",
    "4": "Also invites Member States to provide, with their annual report, information on their national points of contact;",
    "5": "Encourages relevant international bodies and regional organizations to promote transparency of military expenditures and to enhance complementarities among reporting systems, taking into account the particular characteristics of each region, and to consider the possibility of an exchange of information with the United Nations;",
    "6": "Takes note of the annual report of the Secretary-General;5",
    "7": "Requests the Secretary-General, within available resources: (a) To continue the practice of sending an annual note verbale to Member States requesting the submission of their report on military expenditures; (b) To circulate annually a note verbale to Member States detailing which reports on military expenditures were submitted and are available online; (c) To continue consultations with relevant international bodies, with a view to ascertaining requirements for adjusting the present instrument in order to encourage wider participation, and to make recommendations, based on the outcome of those consultations and taking into account the views of Member States, on necessary changes to the content and structure of the standardized reporting system; (d) To encourage relevant international bodies and organizations to promote transparency of military expenditures and to consult with those bodies and organizations with emphasis on examining possibilities for enhancing complementarities among international and regional reporting systems and for exchanging related information between those bodies and the United Nations; (e) To continue to foster further cooperation with relevant regional organizations, with a view to raising awareness of the United Nations Report on Military Expenditures and its role as a confidence-building measure; (f) To encourage the United Nations regional centres for peace and disarmament in Africa, in Asia and the Pacific and in Latin America and the Caribbean to assist Member States in their regions in enhancing their knowledge of the standardized reporting system; (g) To promote international and regional or subregional symposiums and training seminars and to support the development of an online training course by the Secretariat, with the financial and technical support of interested States, with a view to explaining the purpose of the standardized reporting system and facilitating the secure online filing of the reports; __________________ 5 A/80/225. A/C.1/80/L.28 25-16550 4/4 (h) To report on experiences gained during such symposiums and training seminars; (i) To provide, upon request, technical assistance to Member States lacking the capacity to report data and to encourage Member States to voluntarily provide bilateral assistance to other Member States;",
    "8": "Encourages Member States: (a) To inform the Secretary-General about possible problems with the standardized reporting system and their reasons for not submitting the requested data; (b) To continue to provide the Secretary-General with their views and suggestions on ways and means to improve the future functioning of and broadened participation in the standardized reporting system, including necessary changes to its content and structure, as well as recommendations to facilitate its further development;",
    "9": "Decides to remain seized of the matter of the possible establishment of a process of periodic reviews of the Report on Military Expenditures, taking into account the information referred to in paragraph 8 above;",
    "10": "Also decides to include in the provisional agenda of its eighty-third session, under the item entitled \u201cReduction of military budgets\u201d, the sub-item entitled \u201cObjective information on military matters, including transparency of military expenditures\u201d."
  },
  "agenda_items": [
    "Item 90"
  ],
  "symbol_references": [
    "A/C.1/80/L.28"
  ]
}