{
  "symbol": "A/C.3/80/L.24",
  "filename": "A_C.3_80_L.24.pdf",
  "title": "Report of the Human Rights Council",
  "text": "United Nations \nA/C.3/80/L.24\n \n \nGeneral Assembly \nDistr.: Limited \n31 October 2025 \nOriginal: English \n \n25-17595 (E)    071125 \n*2517595* \n \n \nEightieth session \nThird Committee \nAgenda item 66 \nReport of the Human Rights Council \n \n \n \n \n \nMauritania:* draft resolution \n \n \n \n Report of the Human Rights Council \n \n \n \nThe General Assembly, \n \nRecalling its resolutions 60/251 of 15 March 2006, by which it established the \nHuman Rights Council, and 65/281 of 17 June 2011 on the review of the Council, \n \nRecalling also its resolutions 62/219 of 22 December 2007, 63/160 of \n18 December 2008, 64/143 of 18 December 2009, 65/195 of 21 December 2010, \n66/136 of 19 December 2011, 67/151 of 20 December 2012, 68/144 of 18 December \n2013, 69/155 of 18 December 2014, 70/136 of 17 December 2015, 71/174 of \n19 December 2016, 72/153 of 19 December 2017, 73/152 of 17 December 2018, \n74/132 of 18 December 2019, 75/165 of 16 December 2020, 76/145 of 16 December \n2021, 77/200 of 15 December 2022, 78/186 of 19 December 2023 and 79/157 of \n17 December 2024, \n \nRecalling further its resolution 79/192 of 17 December 2024 on working \nmethods of the Third Committee, \n \nHaving considered the recommendations contained in the report of the Human \nRights Council,1 \n \n1. \nTakes note of the report of the Human Rights Council, including the \naddendum thereto, and its recommendations; \n \n2. \nEncourages Member States to streamline requests for interactive \ndialogues with the Third Committee.  \n \n__________________ \n \n* On behalf of the States Members of the United Nations that are members of the Group of \nAfrican States. \n \n1  Official Records of the General Assembly, Eightieth Session, Supplement No. 53 (A/80/53); and \nibid., Supplement No. 53A (A/80/53/Add.1). \n",
  "paragraphs": {
    "1": "Takes note of the report of the Human Rights Council, including the addendum thereto, and its recommendations;",
    "2": "Encourages Member States to streamline requests for interactive dialogues with the Third Committee."
  },
  "agenda_items": [
    "Item 66"
  ],
  "symbol_references": [
    "A/C.3/80/L.24"
  ]
}