{
  "symbol": "A/C.3/80/L.31",
  "filename": "A_C.3_80_L.31.pdf",
  "title": "Situation of human rights in the Syrian Arab Republic",
  "text": "United Nations \nA/C.3/80/L.31\n \n \nGeneral Assembly \nDistr.: Limited \n5 November 2025 \nOriginal: English \n \n25-17824 (E)    131125     \n*2517824* \n \n \nEightieth session \nThird Committee \nAgenda item 71 (c) \nPromotion and protection of human rights: human \nrights situations and reports of special rapporteurs \nand representatives \n \n \n \n \n \nQatar and United States of America: draft resolution \n \n \n \n Situation of human rights in the Syrian Arab Republic \n \n \n \nThe General Assembly, \n \nGuided by the Charter of the United Nations, \n \nReaffirming the purposes and principles of the Charter of the United Nations, the \nUniversal Declaration of Human Rights 1 and relevant international human rights \ntreaties, including the International Covenants on Human Rights, 2 \n \nReaffirming its strong commitment to the sovereignty, independence, unity and \nterritorial integrity of the Syrian Arab Republic and to the principles of the Charter of \nthe United Nations, \n \nWelcoming the end in December 2024 of the former Syrian regime, which failed \nto meet its responsibility to respect, protect and fulfil the human rights of all persons \nwithin its jurisdiction, and recognizing the likelihood of crimes against humanity and \nwar crimes committed in Syria, \n \nWelcoming also in this regard statements by the Minister for Foreign Affairs and \nExpatriates of Syria that those governing Syria bear profound responsibility to ensure \nthat the atrocities, abuses and violations committed by the former regime are never \nrepeated, and that the Syrian people deserve a homeland where their rights are \nsafeguarded, their voices are heard and their dignity is preserved, \n \nEmphasizing the importance of transitional justice, including victims\u2019 \nmeaningful participation, in order to ensure accountability, promote reconciliation \nand prevent the recurrence of atrocities, abuses and violations, in accordance with \ninternational law, including international human rights law and international \nhumanitarian law, \n__________________ \n \n1  Resolution 217 A (III). \n \n2  Resolution 2200 A (XXI), annex. \n\nA/C.3/80/L.31 \n \n25-17824\n2/5 \n \n \nUnderscoring the roles of international mechanisms, including the Independent \nInternational Commission of Inquiry on the Syrian Arab Republic, the International, \nImpartial and Independent Mechanism to Assist in the Investigation and Prosecution \nof Persons Responsible for the Most Serious Crimes under International Law \nCommitted in the Syrian Arab Republic since March 2011 and the Independent \nInstitution on Missing Persons in the Syrian Arab Republic, in providing support to \nand complementing the national efforts undertaken by the Government of Syria to \nensure Syrian-led, Syrian-owned accountability, and welcoming the unprecedented \nand increasing access granted by the Government of Syria to support investigations \nand accountability efforts, \n \nNoting with appreciation the continued efforts of the Syrian Government to \nfoster dialogue among representatives of the country\u2019s diverse religious communities, \nwhile also actively working to safeguard religious sites and preserve the rich religious \nand cultural diversity of Syria, recognizing that these actions are vital to promoting \nstability, peace and prosperity throughout the country, \n \nAcknowledging the important role of Syrian and international civil society, \nhuman rights defenders, victims, survivors and their families in documenting \nviolations and abuses in Syria throughout the conflict and post-conflict period, often \nat great personal risk, in pursuit of truth and accountability, \n \nDeploring that the former Syrian regime had consistently used arbitrary \ndetention, torture and other cruel, inhuman or degrading treatment, including sexual \nviolence and violence against women and girls, enforced disappearances and other \ndetention-related abuses, to intimidate, punish and coerce perceived political \nopponents, dissenting civilians and their family members, in addition to summary \nexecutions, extrajudicial killings, the targeting of civilians and the use of chemical \nweapons, as documented by the Commission of Inquiry, \n \nReiterating its grave concern at the findings of the Investigation and \nIdentification Team of the Organisation for the Prohibition of Chemical Weapons \nattributing responsibility for multiple chemical weapons attacks to the former Syrian \nregime, and expressing its strong conviction that all those responsible for the use of \nchemical weapons in Syria must be held accountable, noting in this regard that Syria \nhas a vested interest in investigating and holding to account perpetrators of any use \nof chemical weapons on its territory, \n \nNoting that, despite the welcome release by the Government of Syria of \nprisoners since December 2024, efforts to establish the fates and whereabouts of those \nwho remain missing and the need to support victims, survivors and their families, \nincluding through psychosocial assistance, will continue for years to come, and \nencouraging continued coordination and cooperation between the Syrian National \nCommission for Missing Persons, the Independent Institution on Missing Persons in \nthe Syrian Arab Republic and other technical experts on these efforts, \n \nUnderscoring the urgent need to preserve and secure all documentation, \ninformation and evidence related to atrocities, abuses and violations of human rights \nand violations of international humanitarian law, to ensure Syrian-led, Syrian-owned \naccountability, supported by the continuation of international efforts to this end, \n \nWelcoming the commitment expressed during the 108th session of the Council \nby the Minister for Foreign Affairs and Expatriates of Syria to work with the \nSecretariat and other States Parties towards the complete elimination of the former \nSyrian regime\u2019s chemical weapons programme in accordance with the obligations of \nSyria under the Convention, and welcoming also the steps taken by the new \nGovernment of Syria to support and facilitate the work of the Secretariat, despite the \nchallenges facing the country after 14 years of war, \n\nA/C.3/80/L.31\n \n3/5\n25-17824 \n \n \nNoting with great concern alarming allegations of attacks that appear to \nconstitute retaliation since December 2024, including violence in Suwayda\u2019 and \nsouthern Syria in July 2025, and an alarming report by the Commission of Inquiry \nthat found a wave of violence since January in coastal and western central Syria, \nincluding acts that may amount to war crimes, perpetrated by both pro-former \ngovernment fighters and individuals from the interim government force, as well as by \nprivate individuals, and acknowledging that the unimpeded access granted by the \nSyrian Government to the Commission enabled the Commission to conduct its \ninvestigations independently, without interference, and in full conformity with its \nmandate, \n \nSupporting efforts by the Government of Syria to preserve the territorial \nintegrity, unity and sovereignty of Syria, while ensuring the access of all Syrians to \nrepresentation and participation in the political process and State institutions, \nregardless of religious or ethnic background, and taking steps to prevent the re-\nestablishment of terrorist groups in Syrian territory, in line with international law, to \nsafeguard peaceful coexistence and enhance security and stability, \n \nWelcoming the lifting of most sanctions applied to Syria, including recent \nexemptions, exceptions and suspensions of sanctions and restrictive measures, and \nencouraging further steps to lift all remaining sanctions, as these steps would facilitate \nthe delivery of humanitarian aid throughout Syria and promote long-term recovery \nand reconstruction efforts in support of the country\u2019s prosperity and long-term \nstability, \n \n1. \nAffirms support for the Syrian people in their pursuit of a peaceful, \nrepresentative and comprehensive political process, in line with the stated \ncommitment of the Syrian Government to a comprehensive political transition; \n \n2. \nWelcomes the recent parliamentary elections in Syria as a step forward in \nthe country\u2019s political process, while recognizing the need for continued efforts to \nenhance the participation and representation of women and all constituencies of the \nSyrian people; \n \n3. \nAlso welcomes the establishment by the Government of Syria of a National \nCommission on Missing Persons and a National Commission on Transitional Justice, \nas well as provisions of the Constitutional Declaration signed in March 2025 \naffirming that the State shall guarantee human rights and fundamental freedoms, and \nnotes with support the provisions made on freedom of expression, freedom of religion \nor belief and women\u2019s rights, and in this regard calls for their implementation, and \nexpresses its hope that the Constitutional Declaration will serve as a solid framework \nfor a successful, orderly and comprehensive transition and a peaceful future for Syria, \nensuring human rights and fundamental freedoms for all Syrians, achieving justice \nand accountability and upholding good governance and the rule of law; \n \n4. \nEncourages the Government of Syria to continue to ensure a viable path \ntowards credible accountability for all crimes that does justice to victims, survivors \nand their families and contributes to reconciliation and a peaceful future for all \nSyrians, and recognizes in this regard the fact that the Constitutional Declaration \nincludes a provision to establish a transitional justice commission, but also recognizes \nthe multitude of challenges faced by the Government in its pursuit of Syrian-led, \nSyrian-owned accountability and transitional justice owing to the scale of the former \nregime\u2019s violations and their complex consequences; \n \n5. \nCalls upon the Government of Syria to ensure that allegations of all crimes \nthat appear to constitute retaliation are investigated, and that perpetrators are held to \naccount through transparent and appropriate judicial mechanisms that are consistent \nwith international law, and acknowledges in this regard the commitment made at the \n\nA/C.3/80/L.31 \n \n25-17824\n4/5 \n \nhighest levels of Syria on 9 March 2025 to hold accountable all those involved in \nviolations and abuses during the events of March 2025; \n \n6. \nWelcomes the actions of the Government of Syria to combat drug \ntrafficking within the country\u2019s borders and across the region, including enhanced law \nenforcement measures, significant seizures of narcotics such as Captagon, and \nincreased cooperation and coordination with neighbouring countries to dismantle \ntransnational trafficking and large-scale production networks, which the former Assad \nregime weaponized as a tool to destabilize the region, with severe consequences for \nsecurity and public health across neighbouring States; \n \n7. \nSupports the Government of Syria in its efforts to ensure the preservation \nof documentation, information and evidence related to atrocities, abuses and \nviolations of human rights and violations of international humanitarian law, including \nmass burial sites, and encourages the Government to develop a comprehensive and \ntrusted system for maintaining such evidence in the long term; \n \n8. \nWelcomes the Secretary-General\u2019s appointment of an Assistant Secretary-\nGeneral as the Head of the Independent Institution on Missing Persons in the Syrian \nArab Republic, and in this regard urges the Government of Syria and the Independent \nInstitution to work together to assist Syrian-led efforts to clarify the fate and \nwhereabouts of all missing persons in Syria, to provide adequate support to victims, \nsurvivors and the families of those missing, to ensure the full, equal, meaningful and \nsafe participation and representation of victims, survivors and the families of missing \npersons in Syria in this endeavour and to coordinate support in this regard; \n \n9. \nEncourages the Government of Syria to continue its positive engagement \nwith the International, Impartial and Independent Mechanism to Assist in the \nInvestigation and Prosecution of Persons Responsible for the Most Serious Crimes \nunder International Law Committed in the Syrian Arab Republic since March 2011, \nthe Independent Institution on Missing Persons in the Syrian Arab Republic and the \nIndependent International Commission of Inquiry on the Syrian Arab Republic, as \nwell as with Syrian civil society, including victim associations and groups, and in this \nregard calls upon these organizations and mechanisms to coordinate their approach \nand activities to ensure effectiveness; \n \n10. Encourages Member States to consider adjusting the current mandates of \nthe International, Impartial and Independent Mechanism, the Independent Institution \non Missing Persons and the Independent International Commission of Inquiry, as \nappropriate, to respond effectively to the new reality in Syria, enable capacity-\nbuilding and complement national Syrian-led, Syrian-owned processes; \n \n11. \nWelcomes the agreement between the Syrian Government and the Syrian \nDemocratic Forces of 10 March 2025 as a pivotal step towards national unity and \nstabilization, and calls for its full and swift implementation to ensure lasting peace, \nsecurity and inclusive governance across Syria; \n \n12. Expresses support for civil society, human rights defenders, victims, \nsurvivors and their families and for their continued role in Syrian-led, Syrian-owned, \ncomprehensive and victim-centred transitional justice and accountability efforts, and \nin this regard stresses the importance of protecting civic space and free, impartial \nmedia and for women to have the opportunity for full, equal, meaningful and safe \nparticipation and leadership in the political transition; \n \n13. Expresses gratitude to the United Nations, the Red Cross and Red Crescent \nMovement and the many humanitarian non-governmental organizations that have \nprovided assistance to Syrian civilians during more than 13 years of hardship and \nsuffering, recognizes the many donors that supported these efforts over this time, and \n\nA/C.3/80/L.31\n \n5/5\n25-17824 \n \nencourages continued cooperation between the Government of Syria and the United \nNations as reconstruction is carried out within the country; \n \n14. Encourages Member States, United Nations entities and other relevant \nstakeholders to provide support to the Syrian Government in strengthening national \ncapacities across governance, administrative, law enforcement and development \nsectors, in a manner that respects the sovereignty of Syria and aligns with its national \npriorities. \n \n",
  "paragraphs": {
    "1": "Affirms support for the Syrian people in their pursuit of a peaceful, representative and comprehensive political process, in line with the stated commitment of the Syrian Government to a comprehensive political transition;",
    "2": "Welcomes the recent parliamentary elections in Syria as a step forward in the country\u2019s political process, while recognizing the need for continued efforts to enhance the participation and representation of women and all constituencies of the Syrian people;",
    "3": "Also welcomes the establishment by the Government of Syria of a National Commission on Missing Persons and a National Commission on Transitional Justice, as well as provisions of the Constitutional Declaration signed in March 2025 affirming that the State shall guarantee human rights and fundamental freedoms, and notes with support the provisions made on freedom of expression, freedom of religion or belief and women\u2019s rights, and in this regard calls for their implementation, and expresses its hope that the Constitutional Declaration will serve as a solid framework for a successful, orderly and comprehensive transition and a peaceful future for Syria, ensuring human rights and fundamental freedoms for all Syrians, achieving justice and accountability and upholding good governance and the rule of law;",
    "4": "Encourages the Government of Syria to continue to ensure a viable path towards credible accountability for all crimes that does justice to victims, survivors and their families and contributes to reconciliation and a peaceful future for all Syrians, and recognizes in this regard the fact that the Constitutional Declaration includes a provision to establish a transitional justice commission, but also recognizes the multitude of challenges faced by the Government in its pursuit of Syrian-led, Syrian-owned accountability and transitional justice owing to the scale of the former regime\u2019s violations and their complex consequences;",
    "5": " highest levels of Syria on 9 March 2025 to hold accountable all those involved in violations and abuses during the events of March 2025;",
    "6": "Welcomes the actions of the Government of Syria to combat drug trafficking within the country\u2019s borders and across the region, including enhanced law enforcement measures, significant seizures of narcotics such as Captagon, and increased cooperation and coordination with neighbouring countries to dismantle transnational trafficking and large-scale production networks, which the former Assad regime weaponized as a tool to destabilize the region, with severe consequences for security and public health across neighbouring States;",
    "7": "Supports the Government of Syria in its efforts to ensure the preservation of documentation, information and evidence related to atrocities, abuses and violations of human rights and violations of international humanitarian law, including mass burial sites, and encourages the Government to develop a comprehensive and trusted system for maintaining such evidence in the long term;",
    "8": "Welcomes the Secretary-General\u2019s appointment of an Assistant Secretary- General as the Head of the Independent Institution on Missing Persons in the Syrian Arab Republic, and in this regard urges the Government of Syria and the Independent Institution to work together to assist Syrian-led efforts to clarify the fate and whereabouts of all missing persons in Syria, to provide adequate support to victims, survivors and the families of those missing, to ensure the full, equal, meaningful and safe participation and representation of victims, survivors and the families of missing persons in Syria in this endeavour and to coordinate support in this regard;",
    "9": "Encourages the Government of Syria to continue its positive engagement with the International, Impartial and Independent Mechanism to Assist in the Investigation and Prosecution of Persons Responsible for the Most Serious Crimes under International Law Committed in the Syrian Arab Republic since March 2011, the Independent Institution on Missing Persons in the Syrian Arab Republic and the Independent International Commission of Inquiry on the Syrian Arab Republic, as well as with Syrian civil society, including victim associations and groups, and in this regard calls upon these organizations and mechanisms to coordinate their approach and activities to ensure effectiveness;",
    "10": "Encourages Member States to consider adjusting the current mandates of the International, Impartial and Independent Mechanism, the Independent Institution on Missing Persons and the Independent International Commission of Inquiry, as appropriate, to respond effectively to the new reality in Syria, enable capacity- building and complement national Syrian-led, Syrian-owned processes;",
    "11": "Welcomes the agreement between the Syrian Government and the Syrian Democratic Forces of 10 March 2025 as a pivotal step towards national unity and stabilization, and calls for its full and swift implementation to ensure lasting peace, security and inclusive governance across Syria;",
    "12": "Expresses support for civil society, human rights defenders, victims, survivors and their families and for their continued role in Syrian-led, Syrian-owned, comprehensive and victim-centred transitional justice and accountability efforts, and in this regard stresses the importance of protecting civic space and free, impartial media and for women to have the opportunity for full, equal, meaningful and safe participation and leadership in the political transition;",
    "13": " encourages continued cooperation between the Government of Syria and the United Nations as reconstruction is carried out within the country;",
    "14": "Encourages Member States, United Nations entities and other relevant stakeholders to provide support to the Syrian Government in strengthening national capacities across governance, administrative, law enforcement and development sectors, in a manner that respects the sovereignty of Syria and aligns with its national priorities."
  },
  "agenda_items": [
    "Item 71"
  ],
  "symbol_references": [
    "A/C.3/80/L.31"
  ]
}