{
  "symbol": "A/C.3/80/L.57",
  "filename": "A_C.3_80_L.57.pdf",
  "title": "A/C.3/80/L.3/Rev.1",
  "text": "United Nations \nA/C.3/80/L.57 \n \n \nGeneral Assembly \nDistr.: Limited \n12 November 2025 \nOriginal: English \n \n25-18382 (E)    181125 \n*2518382* \n \n \nEightieth session \nThird Committee \nAgenda item 107 \nCrime prevention and criminal justice \n \n \n \n \n \nUnited States of America: amendment to revised draft resolution \nA/C.3/80/L.3/Rev.1 \n \n \n \n Strengthening the United Nations crime prevention and criminal \njustice programme, in particular its technical cooperation capacity \n \n \n1. \nIn operative paragraph 64, after \u201cto strengthen their efforts in preventing\u201d insert \n\u201cand combating child pornography\u201d. \n2. \nIn operative paragraph 65, after \u201conce in force\u201d insert \u201c, and emphasizes that \nthe new convention must be implemented in a way that does not undermine the \nobligations of States contained in the Optional Protocol to the Convention on the \nRights of the Child on the sale of children, child prostitution and child pornography\u201d. \n \n",
  "paragraphs": {
    "1": "In operative paragraph 64, after \u201cto strengthen their efforts in preventing\u201d insert \u201cand combating child pornography\u201d.",
    "2": "In operative paragraph 65, after \u201conce in force\u201d insert \u201c, and emphasizes that the new convention must be implemented in a way that does not undermine the obligations of States contained in the Optional Protocol to the Convention on the Rights of the Child on the sale of children, child prostitution and child pornography\u201d."
  },
  "agenda_items": [
    "Item 107"
  ],
  "symbol_references": [
    "A/C.3/80/L.57",
    "A/C.3/80/L.3"
  ]
}