{
  "symbol": "A/C.2/80/L.5",
  "filename": "A_C.2_80_L.5.pdf",
  "title": "Follow-up to the Fifth United Nations Conference on the Least Developed Countries",
  "text": "United Nations \nA/C.2/80/L.5\n \n \nGeneral Assembly \nDistr.: Limited \n10 October 2025 \nOriginal: English \n \n25-16438 (E)    151025     \n*2516438* \n \n \nEightieth session \nSecond Committee \nAgenda item 21 (a) \nGroups of countries in special situations: follow-up \nto the Fifth United Nations Conference on the Least \nDeveloped Countries \n \n \n \nIraq:* draft resolution \n \n \nFollow-up to the Fifth United Nations Conference on the Least \nDeveloped Countries \n \n \n \nThe General Assembly,  \n \nRecalling the Doha Programme of Action for the Least Developed Countries, 1 \nand the Doha Political Declaration, adopted during the second part of the Fifth United \nNations Conference on the Least Developed Countries, held in Doha from 5 to \n9 March 2023,2 in which the Heads of State and Government and representatives of \nStates strongly committed to the implementation of the Doha Programme of Action \nthroughout the coming decade, including its six priority areas,  \n \nReaffirming that the Doha Programme of Action is a new generation of renewed \nand strengthened commitments by the least developed countries and their \ndevelopment partners grounded in the overarching goals of achieving rapid, \nsustainable and inclusive recovery from the coronavirus disease (COVID-19) \npandemic, building resilience against future shocks, eradicating extreme poverty, \nstrengthening labour markets by promoting the transition from informal to formal \nemployment, enabling graduation from the least developed country category, \nfacilitating access to sustainable and innovative financing, addressing inequalities, \nwithin and among countries, leveraging the power of science, technology and \ninnovation, mainstreaming tech-driven entrepreneurship, bringing about structural \ntransformation and achieving the Sustainable Development Goals, through a \nreinvigorated global partnership for sustainable development based on scaled-up and \ndiverse support for the least developed countries in forging the widest possible \ncoalition of multi-stakeholder partnerships,  \n__________________ \n \n*  On behalf of the States that are members of the Group of 77 and China, taking into account also \nthe provisions of General Assembly resolution ES-10/23 of 10 May 2024. \n \n1  Resolution 76/258, annex. \n \n2  Report of the Fifth United Nations Conference on the Least Developed Countries, New York, \n17 March 2022, and Doha, 5\u20139 March 2023 (A/CONF.219/2023/3), chap. I, resolution 2. \n\nA/C.2/80/L.5 \n \n25-16438\n2/17 \n \n \nAffirming the purposes and principles of the Charter of the United Nations, \nincluding full respect for international law, the Universal Declaration of Human \nRights3 and international human rights treaties, and emphasizing the importance of \nfundamental freedoms for all,  \n \nReaffirming the 2030 Agenda for Sustainable Development,4 the Addis Ababa \nAction Agenda of the Third International Conference on Financing for Development, 5 \nthe Sevilla Commitment of the Fourth International Conference on Financing for \nDevelopment, 6  the Paris Agreement, 7  the Sendai Framework for Disaster Risk \nReduction 2015\u201320308 and the New Urban Agenda adopted in Quito by the United \nNations Conference on Housing and Sustainable Urban Development (Habitat III), 9  \n \nHighlighting the synergies between the implementation of the 2030 Agenda, the \nAddis Ababa Action Agenda, the Sevilla Commitment and the Paris Agreement, and \nnoting with concern the findings contained in the special report of the \nIntergovernmental Panel on Climate Change on the impacts of global warming of \n1.5 degrees Celsius above pre-industrial levels and related global greenhouse gas \nemission pathways, in the context of strengthening the global response to the threat \nof climate change, sustainable development and efforts to eradicate poverty, and \nwelcoming the convening of the thirtieth session of the Conference of the Parties to \nthe United Nations Framework Convention on Climate Change, in Bel\u00e9m, Brazil, \nfrom 10 to 21 November 2025,  \n \nNoting with great concern the severe negative impact on human health, safety \nand well-being caused by the coronavirus disease (COVID-19) pandemic, as well as \nthe severe disruption to societies and economies and the devastating impact on lives \nand livelihoods, and that the poorest and most vulnerable are the hardest hit by the \npandemic, reaffirming the ambition to get back on track to achieve the Sustainable \nDevelopment Goals by designing and implementing sustainable and inclusive \nrecovery strategies to accelerate progress towards the full implementation of the 2030 \nAgenda for Sustainable Development and to help to reduce the risk of and build \nresilience to future shocks, crises and pandemics, including by strengthening health \nsystems and achieving universal health coverage, and recognizing that equitable and \ntimely access for all to safe, quality, effective and affordable COVID-19 vaccines, \ntherapeutics and diagnostics are an essential part of a global response based on unity, \nsolidarity, renewed multilateral cooperation and the principle of leaving no one behind,  \n \nRecognizing that the COVID-19 pandemic and its consequences, the adverse \nimpact of climate change, biodiversity loss, desertification, pollution and other \nenvironmental degradation aspects, rising geopolitical tensions and conflicts with \nwidespread effects on people, planet, prosperity and peace affect the situation of food \nsecurity, energy security, extreme poverty and inequality, global trade and market \nstability, which put the very viability of achieving the Sustainable Development Goals \nby 2030 at great risk,  \n \nRecalling its resolution 79/218 of 19 December 2024,  \n \nWelcoming the convening of the Fourth International Conference on Financing \nfor Development, held in Spain from 30 June to 3 July 2025, and the Sevilla \nCommitment, \n__________________ \n \n3  Resolution 217 A (III). \n \n4  Resolution 70/1. \n \n5  Resolution 69/313, annex. \n \n6  Resolution 79/323, annex. \n \n7  Adopted under the UNFCCC in FCCC/CP/2015/10/Add.1, decision 1/CP.21. \n \n8  Resolution 69/283, annex II. \n \n9  Resolution 71/256, annex. \n\nA/C.2/80/L.5\n \n3/17\n25-16438 \n \n \nWelcoming also the convening of the Third United Nations Conference on \nLandlocked Developing Countries, and the Awaza Programme of Action for \nLandlocked Developing Countries for the Decade 2024\u20132034,10  \n \nWelcoming further the convening of the Second World Summit for Social \nDevelopment, in Qatar from 4 to 6 November 2025,  \n \nWelcoming the convening of the sixteenth session of the United Nations \nConference on Trade and Development, in Geneva from 20 to 23 October 2025 under \nthe theme \u201cShaping the future: driving economic transformation for equitable, \ninclusive and sustainable development\u201d, and the fourteenth Ministerial Conference of \nthe World Trade Organization, in Cameroon in March 2026,  \n \nRecalling Economic and Social Council resolution 2025/23 of 29 July 2025 on \nthe Doha Programme of Action for the Least Developed Countries for the decade \n2022\u20132031,  \n \nRecalling also General Assembly resolutions 59/209 of 20 December 2004 and \n67/221 of 21 December 2012 on a smooth transition for countries graduating from the \nlist of least developed countries,  \n \nRecognizing the special challenges facing all developing countries in pursuing \nsustainable development, in particular least developed countries,  \n \nRecognizing also the positive role and contributions of migrant worker \nremittances in least developed countries, and noting with appreciation that \nremittances to least developed countries continue to grow and reached 5 per cent of \ngross domestic product in 2023, further recognizing that remittance costs remain far \nabove the Sustainable Development Goal target of 3 per cent of the amount \ntransferred, in line with target 10.c of the 2030 Agenda and the Addis Ababa Action \nAgenda, with the world average remittance transfer cost at 6.3 per cent, highlighting \nthat promoting faster, safer, cheaper remittances and reducing to less than 3 per cent \nthe transaction costs of migrant remittances, including by adopting digital solutions \nand promoting digital and financial inclusion and accelerating access to transaction \naccounts for migrants, will have positive impacts on the millions of people who \ndepend heavily on them,  \n \nNoting the importance of the work of the Technology Bank for the Least \nDeveloped Countries in helping the least developed countries in assessing their \ntechnology gaps, capacity-building needs and identifying key areas for support; \npromoting networking among researchers, research institutions and centres of \nexcellence, helping such countries to access and utilize critical technologies on \nmutually agreed terms, drawing together bilateral initiatives and support by \nmultilateral institutions and the private sector, and implementing projects \ncontributing to the use of science, technology and innovation for economic \ndevelopment in the least developed countries; and recalling with appreciation the \ncontributions that Bangladesh, Guinea, India, Italy, Norway and T\u00fcrkiye have made, \nas well as the pledges made by the Sudan,  \n \nWelcoming the convening of the 2025 United Nations Conference to Support the \nImplementation of Sustainable Development Goal 14: Conserve and sustainably use \nthe oceans, seas and marine resources for sustainable development, co-hosted by \nCosta Rica and France and held in Nice, France, from 9 to 13 June 2025,  \n__________________ \n \n10  Resolution 79/233, annex; see also resolution 79/279. \n\nA/C.2/80/L.5 \n \n25-16438\n4/17 \n \n \nLooking forward to the convening of the 2026 United Nations Water \nConference, to be co-hosted by Senegal and the United Arab Emirates, and to be held \nin the United Arab Emirates from 2 to 4 December 2026,  \n \nTaking note of the 2025 Ministerial Declaration of the Least Developed \nCountries,  \n \nWelcoming the convening of the high-level meeting on sea level rise by the \nPresident of the General Assembly on 25 September 2024 and the high-level meeting \non antimicrobial resistance and the adoption of the political declaration on \nantimicrobial resistance11 on 26 September 2024,  \n \n1. \nTakes note of the reports of the Secretary-General on the follow-up to the \nFifth United Nations Conference on the Least Developed Countries12 and on an online \nuniversity for least developed countries or other equivalent platform to support \nuniversity-level science, technology, engineering and mathematics education in the \nleast developed countries;  \n \n2. \nCalls upon the least developed countries, in cooperation with their \ndevelopment partners, to broaden their existing country-level review mechanisms and \nreport dissemination, including those for the achievement of the Sustainable \nDevelopment Goals and the implementation of poverty reduction strategy papers, \nnationally determined contributions, United Nations Sustainable Development \nCooperation Frameworks and the existing consultative mechanisms, to cover the review \nof the Doha Programme of Action and extend them to all least developed countries;  \n \n3. \nCalls upon development partners and all other relevant actors to \nimplement the Doha Programme of Action by integrating it into their respective \nnational cooperation policy frameworks, programmes and activities, as appropriate, \nto ensure enhanced, predictable and targeted support to the least developed countries, \nas set out in the Programme of Action, and the delivery of their commitments, and to \nconsider appropriate measures to overcome shortfalls or shortcomings, if any;  \n \n4. \nInvites the United Nations system, including the governing bodies of the \nUnited Nations funds and programmes and other multilateral organizations, including \nthe World Bank Group, the International Monetary Fund and other international \nfinancial institutions, as well as the World Trade Organization, to contribute to the \nimplementation of the Doha Programme of Action and to integrate it into their \nprogrammes of work, as appropriate and in accordance with their relevant mandates, \nand invites those organizations to participate fully in reviews of the Programme of \nAction at the national, subregional, regional and global levels;  \n \n5. \nWelcomes the work of the Inter-Agency Consultative Group for Least \nDeveloped Countries, led by the Office of the High Representative for the Least \nDeveloped Countries, Landlocked Developing Countries and Small Island Developing \nStates, notes the steps taken by the United Nations System Chief Executives Board \nfor Coordination and the High-level Committee on Programmes in supporting the \ncoordination and follow-up of the implementation of the Doha Programme of Action \non a system-wide basis, and reiterates its invitation to the Secretary-General, in his \ncapacity as Chair of the Chief Executives Board, to include the implementation of the \nProgramme of Action in the agenda of the Board;  \n \n6. \nRecalls the strong commitment of the Heads of State and Government and \nrepresentatives of States to advancing the concrete deliverables of the Doha \nProgramme of Action with respect to exploring the feasibility, effectiveness and \nadministrative modalities of a system of stockholding or alternative means, such as \n__________________ \n \n11  Resolution 79/2, annex. \n \n12  A/80/82-E/2025/63. \n\nA/C.2/80/L.5\n \n5/17\n25-16438 \n \ncash transfers, taking into account possible economic implications and risks, an online \nuniversity or other equivalent platforms, an international investment support centre, \na sustainable graduation support facility, and comprehensive multi-hazard crisis \nmitigation and resilience-building measures for least developed countries, and \nwelcomes the efforts made towards their full operationalization and requests the \nSecretary-General to provide an update outlining progress towards operationalization \nof these deliverables and calls upon the development partners and other stakeholders \nto fully support the processes;  \n \n7. \nDecides to include the Doha Programme of Action as part of its review of \nthe implementation of and follow-up to major United Nations conferences and \nsummits, including the review of the 2030 Agenda for Sustainable Development;  \n \n8. \nNotes with concern the estimates that by 2030 much of the world\u2019s poor \nwill live in the least developed countries, which indicate that the implementation of \nthe 2030 Agenda is not on track, stresses the need for enhanced global support for the \nleast developed countries to achieve the Sustainable Development Goals, as well as \nensuring that no one is left behind, and further recognizes the importance of \nenhancing good governance at all levels by strengthening democratic processes, \ninstitutions and the rule of law, increasing efficiency, coherence, transparency and \nparticipation, achieving gender equality and the empowerment of all women and girls, \nreducing inequalities, protecting and promoting human rights, reducing corruption \nand strengthening the capacity of Governments of the least developed countries to \nplay an effective role in their economic and social development;  \n \n9. \nWelcomes the adoption of resolution 79/226 of 19 December 2024 on the \nquadrennial comprehensive policy review of operational activities for development \nof the United Nations system, and urges the United Nations development system to \ncontinue to prioritize allocations to the least developed countries, in order to support \nthe least developed countries in their efforts to implement the 2030 Agenda in a \ncoherent and integrated manner and ensure effective delivery of support and services \nto programme countries in accordance with national development policies, plans, \npriorities and needs and in line with the mandates of the entities of the United Nations \ndevelopment system, further urges the United Nations development system to \ncontinue to enhance its support for the implementation of the Doha Programme of \nAction, which is integral to the 2030 Agenda, and calls upon the entities of the United \nNations development system to integrate and mainstream the Doha Programme of \nAction fully into their operational activities for development;  \n \n10. \nExpresses deep concern at the devastating impacts of the COVID-19 \npandemic on the least developed countries, takes note of the statement dated 28 April \n2020 of the Group of Least Developed Countries on COVID-19 13 and commits to \nsupporting its implementation, as appropriate, and invites development partners, \ninternational organizations and other stakeholders to support the least developed \ncountries in their recovery efforts and continued implementation of the 2030 Agenda \nfor Sustainable Development, further highlighting the need for greater collaboration \nand partnerships at all levels to accelerate the implementation of the 2030 Agenda, \nincluding the fulfilment of the least developed country-specific targets, the Addis Ababa \nAction Agenda of the Third International Conference on Financing for Development, \nand the Sevilla Commitment adopted at the Fourth International Conference on \nFinancing for Development, which is an integral part of the 2030 Agenda;  \n \n11. \nExpresses its concern that the world is in the midst of a highly challenging \nenvironment in which global sustainable development prospects continue to diverge, \nwith 35 per cent of targets on track or displaying moderate progress, while progress \n__________________ \n \n13  See A/74/843, annex. \n\nA/C.2/80/L.5 \n \n25-16438\n6/17 \n \non 47 per cent of the targets is insufficient, and 18 per cent of the targets show \nregression from the 2015 baseline, underscoring the urgent need for intensified efforts \nto put the Sustainable Development Goals on course, and expresses further concern \nthat the increased pressure on food, energy and finance, elevated inflation, rising \nglobal interest rates, tightened financial conditions, high indebtedness, disruptions in \nsupply chains, and geopolitical tensions and conflicts, together with the adverse \nimpacts of climate change, biodiversity loss and digital divides, have exacerbated \nchallenges for many countries in addition to those associated with COVID-19 \nrecovery, increasing hunger, and all forms of malnutrition and poverty and inequality; \nand analysis of the most recent data reveals that the least developed countries are not \non track to meet the targets of the Doha Programme of Action and the Sustainable \nDevelopment Goals;  \n \n12. Welcomes the Secretary-General\u2019s efforts to address the SDG financing \ngap through an SDG stimulus; and reiterates the commitment to advance the \nSecretary-General\u2019s proposal, in a timely manner through discussions at the United \nNations as well as other relevant forums and institutions, to tackle the high cost of \ndebt and rising risks of debt distress, to enhance support to developing countries and \nto massively scale up affordable long-term financing for development and expand \ncontingency financing to countries in need;  \n \n13.  Reaffirms that the least developed countries, as the most vulnerable group \nof countries, need enhanced global support to overcome the structural challenges, as \nwell as recent devastating impacts of the COVID-19 pandemic, conflicts and climate \nchange and the deteriorating situation of food security, lack of access to finance and \nenergy, and increased poverty, that they face in implementing the 2030 Agenda, and \nin this regard calls upon the international community to prioritize and strengthen \nsupport from all sources to facilitate sustained recovery and rebuilding and the \ncoordinated implementation and coherent follow-up to and monitoring of the Doha \nProgramme of Action, the 2030 Agenda and the Addis Ababa Action Agenda in the \nleast developed countries; \n \n14. Recognizes that domestic public and private resources, including at the \nsubnational level, supplemented by international assistance and foreign direct \ninvestment, as appropriate, will be critical for the realization of sustainable \ndevelopment and the achievement of the Sustainable Development Goals; and that \nthe 2030 Agenda and the Addis Ababa Action Agenda acknowledge the centrality of \ndomestic resources mobilization, underscored by the principle of national ownership;  \n \n15. Welcomes the commitment of development partners to ensuring the \nfulfilment of their respective official development assistance commitments to the \nleast developed countries, ensuring the alignment of aid with the least developed \ncountries\u2019 national priorities and increasing the alignment of aid with the least \ndeveloped countries\u2019 national systems and procedures, also welcomes the decision by \nthe European Union by which it reaffirms its collective commitment to achieving the \ntarget of 0.7 per cent of gross national income for official development assistance \nwithin the time frame of the 2030 Agenda and to reach 0.20 per cent of gross national \nincome for official development assistance to the least developed countries within the \ntime frame of the 2030 Agenda, expresses concern that, according to the Organisation \nfor Economic Co-operation and Development, official development assistance flows \nfrom official donors fell by 7.1 per cent in 2024, the first decrease in official \ndevelopment assistance since 2019, encourages official development assistance \nproviders to consider setting a target to provide at least 0.20 per cent of gross national \nincome for official development assistance to the least developed countries, is \nencouraged by those that are allocating at least 50 per cent of their official development \nassistance to the least developed countries, and calls upon the development partners \n\nA/C.2/80/L.5\n \n7/17\n25-16438 \n \nto continue their development assistance to the least developed countries in their \nefforts to overcome ongoing crises;  \n \n16. Commends the surpassing of 100 billion United States dollars of special \ndrawing rights and welcomes the global ambition to voluntarily channel 100 billion \ndollars of special drawing rights to developing and least developing countries, calls \nupon Member States with strong external positions to consider the voluntary \nchannelling of special drawing rights to countries in need, particularly to the least \ndeveloped countries, in a timely manner, including through the International Monetary \nFund Poverty Reduction and Growth Trust, welcomes the operationalization of the \nInternational Monetary Fund Resilience and Sustainability Trust as a new mechanism \nto voluntarily channel special drawing rights to provide affordable long-term \nfinancing to the least developed countries and other vulnerable countries, with due \nconsideration to national legal frameworks, and also welcomes the ongoing \nexploration of viable options to voluntarily channel special drawing rights through \nmultilateral development banks; and calls for an urgent voluntary rechannelling of \nspecial drawing rights to countries most in need, including through multilateral \ndevelopment banks, while respecting relevant legal frameworks and preserving the \nreserve asset character of special drawing rights; and exploring ways for future \nallocations of special drawing rights to benefit those countries most in need;  \n \n17. Notes that the global macroeconomic outlook remains highly uncertain, \nand is particularly bleak for many developing countries, including a large number of \nleast developed countries, faced with significantly higher borrowing costs, growing \ndebt service burdens and tight fiscal constraints, and that such a finance divide will, \nif left unaddressed, translate into a lasting sustainable development divide; and calls \nfor improved international debt mechanisms to support debt review, debt payment \nsuspensions, and debt restructuring, as appropriate, with an expansion of support and \neligibility to vulnerable countries in need;  \n \n18. Calls upon official creditors to make long-term sustainable financing \navailable to least developed countries through grants and concessional funding and to \noffer more fixed-interest lending at low interest rates, emphasizing that this is part of \na mix of financing approaches that also include grants;  \n \n19.  Stresses the urgency of enhancing ambition for climate action in the \nimplementation of the United Nations Framework Convention on Climate Change and \nthe Paris Agreement in relation to climate mitigation, adaptation and the provision of \nthe means of implementation, especially finance to developing countries; urges the \nimplementation of the decisions adopted at the twenty-seventh session of the \nConference of the Parties to the Convention, held in Sharm el-Sheikh, Egypt; recalls its \ncommitment to take concrete steps toward the operationalization of the new funding \narrangements for responding to loss and damage, including the fund, by the twenty-\neighth session; commits to continuing work to accelerate action to address climate \nchange; and in this regard takes note of the first global stocktake of the Paris Agreement \nthat took place at the twenty-eighth session held in Dubai, United Arab Emirates; \n \n20. Notes with concern that the current provision of climate finance for \nadaptation remains insufficient to respond to worsening climate change impacts in \ndeveloping country Parties and recognizes the importance of the adequacy and \npredictability of adaptation finance, welcomes that the Parties 14 urged developed \ncountry Parties to urgently and significantly scale up their provision of climate \nfinance, technology transfer and capacity-building for adaptation so as to respond to \nthe needs of developing country Parties as part of a global effort, including for the \nformulation and implementation of national adaptation plans and adaptation \n__________________ \n \n14  United Nations Framework Convention on Climate Change and/or Paris Agreement. \n\nA/C.2/80/L.5 \n \n25-16438\n8/17 \n \ncommunications, also recognizes that many least developed countries face challenges \nin gaining direct access to international public finance owing to a lack of technical \ncapacity, supports the provision of assistance to least developed countries in preparing \nbankable projects and creating enabling environments, and encourages further efforts \nto enhance access to finance; \n \n21. \nUnderlines the need for reinforcing the existing comprehensive multi-hazard \nearly warning system and comprehensive multi-hazard crises mitigation and resilience-\nbuilding measures, including comprehensive disaster risk financing strategies for the \nleast developed countries aligned with the Sendai Framework for Disaster Risk \nReduction 2015\u20132030 as a key instrument to build resilience against and mitigate the \nimpacts of various shocks, and the commitment to making the best use of existing \ninitiatives, providing support for capacity-building for adaptation planning and \nimplementation, and technical assistance to develop operational national risk \ninformation systems to support policymaking, including in the insurance sector, and \ntakes note of the report of the Secretary-General on multi-hazard early warning systems \nin the least developed countries, as well as the comprehensive technical report entitled \n\u201cStatus of multi-hazard early warning systems in the least developed countries\u201d \nprepared by the Office of the High Representative in cooperation with the United \nNations Office for Disaster Risk Reduction and the World Meteorological Organization;  \n \n22. Welcomes the progress made under the Secretary-General\u2019s Early \nWarnings for All initiative, and invites the initiative to expand its coverage to include \nall least developed countries, which have acute needs and are the furthest behind;  \n \n23. Calls upon Member States, the broader United Nations system, civil \nsociety organizations and development partners across the public and private sectors \nto consider the recommendations contained in the report of the Secretary-General,15 \naimed at accelerating action to address gaps and deliver people-centred and country-\nled, end-to-end multi-hazard early warning systems in the least developed countries;  \n \n24.  Welcomes the adoption of resolution 78/322 of 13 August 2024 on the \nmultidimensional vulnerability index, calls for ensuring that the least developed \ncountries should be considered in the composition of the Independent Expert Advisory \nPanel, as appropriate, and recognizes the potential to further improve the index, inter \nalia, by considering additional indicators to be included in future iterations of the \nindex as well as indicators for potential refinement or approval to effectively capture \nthe vulnerabilities of all developing countries, including least developed countries;  \n \n25. Calls upon the developing countries, guided by the spirit of solidarity and \nconsistent with their capabilities, to provide support for the effective implementation \nof the Doha Programme of Action in mutually agreed areas of cooperation within the \nframework of South-South and triangular cooperation, which is a complement to but \nnot a substitute for North-South cooperation;  \n \n26. Underlines the importance of promoting an enabling business environment \nconducive to growth and development, the absence of corruption, a transparent and \nrules-based regulatory framework, simplifying business regulations and processes, \nreducing and streamlining administrative formalities, creating efficient national \nsupport mechanisms for micro-, small and medium-sized enterprises, improving \nsupply chains, facilitating access to markets, reinforcing cooperation, building \ncapacities to implement effective competition policies, and adopting open, \ntransparent and clear regulatory frameworks for business and investment, with \nprotection for property rights and land rights as appropriate and in accordance with \nnational circumstances and consistent with international legal frameworks;  \n__________________ \n \n15  A/79/288. \n\nA/C.2/80/L.5\n \n9/17\n25-16438 \n \n \n27. Urges the least developed countries and their development partners to \nmake use of existing initiatives and programmes, such as the relevant ministerial \ndecisions of the World Trade Organization on duty-free and quota-free market access \nfor the least developed countries and on preferential rules of origin for those \ncountries, as well as aid-for-trade, reiterates its commitment to increasing aid-for-\ntrade support, in particular for the least developed countries, striving to allocate an \nincreasing proportion of aid-for-trade to the least developed countries, in accordance \nwith development cooperation effectiveness principles, welcomes additional \ncooperation among developing countries to that end, and encourages the least \ndeveloped countries to mainstream trade in their national development plans;  \n \n28. Recognizes that the \nleast developed \ncountries \nface \nsignificant \ninfrastructure gaps, including in the areas of transport, energy, water, sanitation and \ninformation and communications technology, and reaffirms the need to promote \nquality, reliable, sustainable and resilient infrastructure and to enhance infrastructure \nconnectivity with concrete actions and predictable financing, thereby maximizing \nsynergies in infrastructure planning and development;  \n \n29. Reaffirms that the least developed countries are especially vulnerable to \nand disproportionately affected by the adverse effects of climate change, \nenvironmental degradation and other disasters, and recognizes the high importance of \nbuilding resilience in the least developed countries through stepped-up capacity-\nbuilding and finance for adaptation to climate change;  \n \n30. Recalls the Sendai Framework for Disaster Risk Reduction 2015\u20132030 and \nreaffirms that disaster-prone developing countries need particular attention in view of \ntheir high vulnerability and exposure to adverse climate change impacts, recognizes \nthat the development and implementation of risk-informed plans, policies, programmes \nand investments are essential for sustainable development and the achievement of the \nSustainable Development Goals, also recognizes that the COVID-19 pandemic has \nincreased vulnerability to wider, growing risks, notes with serious concern the stark \nwarnings contained in the recent report of the Intergovernmental Panel on Climate \nChange and notes that the Sendai Framework provides guidance relevant to a \nsustainable recovery from COVID-19 and also to identify and address underlying \ndrivers of disaster risk in a systemic manner, further recognizes the health aspects of \nthe Sendai Framework, and stresses the need for resilient health systems;  \n \n31. Recognizes the need for dealing with severe food insecurity and \nmalnutrition in least developed countries, and calls upon Member States and other \nrelevant stakeholders to keep food and agriculture supply chains functioning; and \ncalls upon the international financial institutions to find urgent, affordable and timely \nsolutions to support developing countries, in particular those highly indebted, in \nresponding to the food security crisis and achieving Sustainable Development Goal 2, \nthrough, but not limited to, facilitating, as appropriate, access to debt relief and \nconcessional finance, and welcomes the Nutrition for Growth Summit, convened by \nthe Government of France in 2025, and the First Leaders\u2019 Meeting of the Global \nAlliance against Hunger and Poverty, to be held in Qatar in November 2025;  \n \n32. Takes note of the findings and recommendations of the reports of the \nSecretary-General16 exploring the feasibility, effectiveness and administrative modalities \nof a system of food stockholding for the least developed countries, welcomes the \nestablishment of a task force to guide the preparation of a comprehensive feasibility \nstudy for the operationalization of the Food Stockholding Mechanism for the Least \nDeveloped Countries, with the ultimate goal of enhancing food security and resilience \nin these countries, and calls for consultations with relevant United Nations entities, \n__________________ \n \n16  A/77/291 and A/79/540. \n\nA/C.2/80/L.5 \n \n25-16438\n10/17 \n \nincluding Rome-based agencies, Member States, regional and international \norganizations and other stakeholders on the preparation of the feasibility study;  \n \n33. Recognizes that particular efforts are needed to ensure that all young \npeople, including girls, enjoy equal access to lifelong learning opportunities and equal \naccess to inclusive and quality education at all levels, inclusive of early childhood, \nprimary, secondary and tertiary education, as well as technical and vocational \ntraining, notes with concern, in this regard, the lack of progress in closing gender gaps \nin access to, retention in and completion of secondary education, particularly for girls, \nrecognizes the need to continue to provide and encourage, as appropriate, institutes \nof higher education to allocate places and scholarships for students and trainees from \nthe least developed countries, in particular in the fields of science, technology, \nbusiness management and economics, and to strengthen support for institutions in \nrelation to gender equality and the empowerment of women and girls at the global, \nregional and national levels, and also recognizes that the least developed countries \nhave the most to gain from sustainable development and utilizing the full skills and \ntalents of their people, including women and girls;  \n \n34. Takes note of the findings and recommendations of the report of the \nSecretary-General on an online university for least developed countries or other \nequivalent platform to support university-level science, technology, engineering and \nmathematics education in the least developed countries, and endorses the following \nrecommendations towards the establishment of an online university or equivalent \nplatform for least developed countries in accordance with the Doha Programme of \nAction, with the aim of formally launching the online university at the midterm \nreview of the Doha Programme of Action in 2027:  \n \n(a) \nSupport efforts to further elaborate the structure, governance mechanisms \nand other institutional matters related to the online university and conduct a sample \nmapping of in-country assessments, in collaboration with relevant United Nations \nentities including the United Nations Educational, Scientific and Cultural Organization, \nthe Technology Bank for the Least Developed Countries and the United Nations \nUniversity, to evaluate national readiness for implementing or expanding online and \nblended education to rapidly scale up the delivery of inclusive, quality science, \ntechnology, engineering and mathematics education in least developed countries; \n \n(b) \nEstablish a task force to provide strategic direction leading towards full \noperationalization of the online university to be supported by the Office of the High \nRepresentative; the task force membership shall include relevant representatives from \nthe United Nations system, government representatives and experts, and other \nrelevant stakeholders and organizations may be invited for exchange of views and \ninputs as required; \n \n(c) \nCommit to advancing the modalities of the proposed online university by \nstrategically leveraging existing facilities and resources both within the United \nNations system and through external partnerships, including the academic and \nresearch infrastructure provided by entities such as the United Nations University, the \nUnited Nations Educational, Scientific and Cultural Organization, the International \nTelecommunication Union and the Technology Bank as well as other relevant \ninstitutions; \n \n35. Recognizes the need to support least developed countries in building \ncapacity and a framework to scale up the development, deployment and sustainable \nutilization of emerging technologies for the Sustainable Development Goals, \nincluding strengthening of digital literacy and skills, as part of efforts to bridge digital \nand knowledge divides, as a prerequisite for inclusive participation in the digital \neconomy, and to provide necessary financial and technical support to least developed \n\nA/C.2/80/L.5\n \n11/17\n25-16438 \n \ncountries to establish and strengthen national and regional science institutes to \nincrease their capacity for research and development in science, technology and \ninnovations and promote the adaptation and application of modern technologies for \ndomestic uses;  \n \n36. Supports the Technology Bank for the Least Developed Countries as a \nfocal point for the least developed countries to strengthen their science, technology \nand innovation capacity towards building sustainable productive capacities and \npromoting structural economic transformation, also supports the Technology Bank in \nstrengthening the science, technology and innovation capacity of least developed \ncountries for structural transformation and productive capacity development, invites \nMember States, as well as international organizations, foundations and the private \nsector, to provide voluntary financial and in-kind resources to the Technology Bank \nin order to enhance its capacity and effectiveness, and to fulfil its mandate and decides \nto strengthen collaboration among Governments, the private sector and academia to \nadvance science, technology and innovation research and development, build \ninclusive digital economies and bridge the digital divide, including by facilitating \ntechnology transfer on mutually agreed terms; encourages least developed countries \nto engage with development partners through the Technology Bank, including by \nutilizing the technology needs assessments; and also decides to include the topic \n\u201cReport on the work of the Technology Bank for the Least Developed Countries\u201d \nunder the sub-item entitled \u201cFollow-up to the Fifth United Nations Conference on the \nLeast Developed Countries\u201d at its eighty-first session, and requests the Secretary-\nGeneral to submit a report for its consideration;  \n \n37. Reaffirms the commitment to implementing the decision contained in the \nAddis Ababa Action Agenda and the 2030 Agenda to adopt and implement investment \npromotion regimes that encourage and facilitate foreign direct investment and \nsustainable economic growth in the least developed countries, welcomes the support \nin the Sevilla Commitment for the establishment and operationalization of an \ninternational investment support centre for the least developed countries, reiterates \nthe decision to provide financial and technical support for project preparation and \ncontract negotiation, advisory support for investment-related dispute resolution, \naccess to information on investment facilities, improving enabling environments, and \nrisk insurance and guarantees such as through the Multilateral Investment Guarantee \nAgency, stresses the importance of foreign direct investment as a key source of \neconomic development and external finance, with a complementary and catalytic role \nvis-\u00e0-vis domestic resource mobilization and investment and development finance, \nand notes with concern that foreign direct investment to the least developed countries \nremains below 2.5 per cent of global foreign direct investment flows, despite the fact \nthat least developed countries are home to about 15 per cent of the global population, \ntakes note of the report of the Secretary-General on an international investment \nsupport centre for the least developed countries, and urges further progress on the \nelaboration of such a centre, as requested in paragraph 261 of the Doha Programme \nof Action, and requests the Secretary-General to carry out pilot projects in least \ndeveloped countries and submit the final recommendations from the full feasibility \nstudy to the General Assembly for its consideration at its eighty-first session;  \n \n38. Recognizes that increasing participation, supporting the empowerment of \nwomen, youth and civil society and strengthening collective action will contribute to \nthe eradication of poverty and the achievement of sustainable development, further \nreaffirms that achieving gender equality, the empowerment of all women and girls \nand the full realization of the human rights of all people is essential to achieving \nsustained, inclusive and equitable economic growth and sustainable development, and \nreiterates the need for gender mainstreaming, including targeted actions and \n\nA/C.2/80/L.5 \n \n25-16438\n12/17 \n \ninvestments in the formulation and implementation of all financial, economic, \nenvironmental and social policies in the least developed countries;  \n \n39. Reiterates its conviction that no country graduating from the least \ndeveloped country category should have its development progress disrupted or \nreversed, welcomes the fact that the United Nations graduation process helps to ensure \nthat no graduating country has its special and differential treatment measures and \nexemptions reduced abruptly, invites development and trading partners to consider \nextending to graduated countries trade preferences previously made available as a \nresult of least developed country status, or reducing them in a phased manner in order \nto avoid their abrupt reduction, notes that the Group of Least Developed Countries put \nforward various proposals at the World Trade Organization, pertaining to, among other \nthings, trade-related challenges and those related to the smooth transition of the \ncountries graduating from the least developed country category and seeks to further \nexamine these issues, and calls upon the development partners to continue to provide, \nas appropriate, special climate change-related finance and technological support to \ngraduated countries so as to support action towards the achievement of the goals of the \nParis Agreement and for a period consistent with their vulnerabilities, sustainable \ndevelopment needs and other national circumstances and emerging challenges;  \n \n40. Underlines the importance of integrating support for graduating and \ngraduated countries into the relevant work programmes of the entities of the United \nNations development system in the light of the increasing number of graduating \ncountries and their need for continued support from the United Nations development \nsystem;  \n \n41. Recognizes that the preparatory period before graduation is crucial for \ngraduating countries to prepare their national smooth transition strategy, and invites \nbilateral, regional and multilateral development partners to support the development, \npreparation, and implementation of countries\u2019 smooth transition strategies, including \nby extending least developed country-specific international support measures and \nappropriate incentives in accordance with the Doha Programme of Action; \n \n42. Takes note of the benefits of updating the existing General Assembly \nresolutions on smooth transition, and requests the President of the General Assembly \nto establish an open-ended ad hoc working group of Member States on the smooth \ntransition for countries graduating from the list of least developed countries to carry \nout an inclusive and transparent process to review and update the existing resolutions \non smooth transition and support to graduating least developed countries and recently \ngraduated countries; \n \n43. Recommits to take action to strengthen international, national and local \ndata systems efforts to collect high-quality, timely, relevant, disaggregated and \nreliable data on Sustainable Development Goals progress and to intensify efforts to \nstrengthen data and statistical capacities in developing countries, in particular the \nleast developed countries;  \n \n44. Recognizes that the activities relating to the least developed countries \ncarried out within the Secretariat need to be further coordinated and consolidated in \norder to ensure the effective monitoring and follow-up of the implementation of the \nDoha Programme of Action, led by the Office of the High Representative, and to \nprovide well-coordinated support to realizing, inter alia, the target of enabling 15 \nadditional least developed countries to meet the criteria for graduation by 2031;  \n \n45. \nAlso recognizes that, over the years, the responsibilities of the Office of the \nHigh Representative have increased considerably in their scope and complexity and \nthat, in addition to its original mandate, the requirement to undertake research and \nanalytical work, monitor sectoral policy developments at the level of intergovernmental \n\nA/C.2/80/L.5\n \n13/17\n25-16438 \n \nprocesses, follow up on actions taken at the national level, further strengthen the \nnetwork of national focal points of least developed countries, develop operational \nguidelines for United Nations entities support to countries in conflict and post-conflict \nsituations and support the graduating and graduated countries have increased;  \n \n46. Calls upon the development partners, international financial institutions \nand the United Nations system to enhance their support for the full and effective \noperationalization of the Sustainable Graduation Support Facility (iGRAD), in line \nwith the mandate of the Doha Programme of Action for the Least Developed Countries, \nrecognizing its vital role in providing technical assistance, advisory services and \ncapacity development to graduating and graduated least developed countries, and \nunderlining that enhanced international support to iGRAD can play a critical role in \nensuring smooth transition, sustaining development gains, and addressing \nvulnerabilities arising from climate change, economic shocks and other global crises; \n \n47. Recommends that the United Nations development system organizations \ndevelop internal guidelines on how to translate the stated priorities for least developed \ncountries into their budget allocations or their capacity-development projects, and \ninvites the World Bank Group, the International Monetary Fund, other international \nfinancial and development institutions to provide tailored programmes to support the \nleast developed countries; further invites international organizations to consider how \nthe Doha Programme of Action may inform their efforts; and also requests the United \nNations development system to further expand the use of the least developed country \ncategory in programming and budgeting;  \n \n48. Invites Governments, intergovernmental and non-governmental organizations, \nmajor groups and other donors to contribute in a timely manner to the trust fund in \nsupport of activities undertaken by the Office of the High Representative to support \nthe implementation, follow-up and monitoring of the Doha Programme of Action and \nthe participation of the representatives from the least developed countries in the high-\nlevel political forum on sustainable development of the Economic and Social Council \nas well as in other relevant forums, and in this regard expresses its appreciation to \nthose countries that have made voluntary contributions to the trust fund;  \n \n49. Expresses its profound gratitude to the Government and the people of the \nState of Qatar for hosting the second part of the Fifth United Nations Conference on \nthe Least Developed Countries and for providing all the necessary support to the \nConference and its follow-up processes;  \n \n50. Expresses its appreciation to all development partners for the support \nprovided to the least developed countries and for the continued commitment of \nsupport to the implementation of the Doha Programme of Action for the Least \nDeveloped Countries, including its deliverables;  \n \n51. Recalls paragraph 309 of the Doha Programme of Action, in which the \nGeneral Assembly was invited to consider conducting a comprehensive high-level \nmidterm review of the implementation of the Programme of Action in 2026; \n \n52.  Welcomes the generous offer of the Government of Qatar to host the \ncomprehensive high-level midterm review; \n \n53. Decides that the comprehensive high-level midterm review:  \n \n(a)  Shall be held in Doha, State of Qatar, for a period of three days, from 25 to \n27 March 2027, consisting of opening and closing plenary meetings and four \nadditional plenary meetings, as well as four parallel thematic round-table meetings;  \n \n(b)  Shall be held at the highest possible political level;  \n\nA/C.2/80/L.5 \n \n25-16438\n14/17 \n \n \n(c)  Shall result in an intergovernmentally negotiated and agreed outcome in \nthe form of a political declaration; \n \n(d)  Shall ensure that the summaries of the plenary meetings and other \ndeliberations of the review are included in the report of the review;  \n \n54. Also decides that the scope of the midterm comprehensive global review \nshall be as follows:  \n \n(a)  To undertake a comprehensive review of the implementation of the Doha \nProgramme of Action by the least developed countries and their development \npartners, share best practices and lessons learned and identify obstacles and \nconstraints encountered and actions and initiatives needed to overcome them, as well \nas new challenges and emerging issues;  \n \n(b)  To reaffirm the global commitment to address the special needs of the least \ndeveloped countries made at the Fifth United Nations Conference on the Least \nDeveloped Countries and to further strengthen the global partnership for development \nfor least developed countries in all priority areas of the Doha Programme of Action \nin order to ensure the timely, effective and full implementation of the Programme of \nAction during the remainder of the Decade, while taking into account the 2030 \nAgenda for Sustainable Development as it relates to the least developed countries;  \n \n55. Underlines that there will be two regional-level preparatory meetings, \ntaking advantage of the biennial regional meetings already scheduled for 2026, as \nappropriate, one in collaboration with the Economic Commission for Africa, which \nwill include Haiti, and the other in collaboration with the Economic and Social \nCommission for Asia and the Pacific, which will include Yemen, with the regional-\nlevel meetings to be supported by broad-based and inclusive country-level \npreparations, and that the outcomes of the regional-level preparatory meetings should \nbe considered in the comprehensive high-level midterm review;  \n \n56. Requests the Secretary-General to convene a United Nations system high-\nlevel event during the comprehensive high-level midterm review, with a view to \nensuring the full mobilization of the United Nations system in support of the least \ndeveloped countries and the coordinated and timely implementation by the United \nNations system of the Doha Programme of Action and the outcome of the review;  \n \n57. Requests the President of the General Assembly to organize, in 2026, a \none-day special thematic event, with the participation of Member States, \nnon-governmental organizations, civil society, the private sector and academic \ninstitutions, in order to provide input to the comprehensive high-level midterm review;  \n \n58. Requests the President of the General Assembly at its eighty-first session \nto appoint two co-facilitators, one from a developed country and one from a \ndeveloping country, to oversee and direct informal intergovernmental consultations \non all issues relating to the review and its preparatory process;  \n \n59. Requests the co-facilitators to present a draft political declaration, no later \nthan 30 October 2026 and in advance of the preparatory meeting of experts, prepared \non the basis of inputs from the national and regional preparatory meetings, the report \nof the Secretary-General and other inputs, including those from Member States;  \n \n60. Decides that the midterm review shall elect from among the \nrepresentatives of participating States the following officers: a President and an ex \nofficio Vice-President from the host country, and nine Vice-Presidents, one of whom \nshall be designated as Rapporteur;  \n \n61. Also decides that the Under-Secretary-General and High Representative \nfor the Least Developed Countries, Landlocked Developing Countries and Small \n\nA/C.2/80/L.5\n \n15/17\n25-16438 \n \nIsland Developing States shall serve as the Secretary-General of the midterm review \nand shall be responsible for making the necessary arrangements for carrying out the \nwork of the midterm review; and further underlines that the Office of the High \nRepresentative, as the focal point, in accordance with mandates given by the General \nAssembly in its resolution 56/227 of 24 December 2001, has the responsibility for \nensuring that the preparations are carried out effectively and efficiently and for \nmobilizing and coordinating the active involvement of the organizations of the United \nNations system;  \n \n62. \nFurther decides that the opening plenary meeting of the midterm review will \ninclude statements by the President of the midterm review, the Secretary-General of the \nUnited Nations, the President of the General Assembly, the President of the Economic \nand Social Council, the former and current Chairs of the Group of Least Developed \nCountries, the President of the European Commission, the President of the World Bank \nGroup and one representative each from civil society and the private sector;  \n \n63. Decides that the thematic meetings will focus on identifying concrete \nsuggestions to further strengthen the global partnership for development for least \ndeveloped countries in all priority areas of the Doha Programme of Action for the \nLeast Developed Countries in order to ensure the timely, effective and full \nimplementation of the Programme of Action during the remainder of the decade, \nwhile taking into account synergy and coherence of the Programme of Action with \nglobal processes, including the 2030 Agenda for Sustainable Development, the Sevilla \nCommitment of the Fourth International Conference on Financing for Development, \nthe Sendai Framework for Disaster Risk Reduction 2015\u20132030, and the Paris \nAgreement under the United Nations Framework Convention on Climate Change;  \n \n64. Also decides that the organizational arrangements of the round tables will \nbe as follows: \n \n(a)  Each round table will be co-chaired by two Chairs, one from the least \ndeveloped countries and one from the development partners, to be appointed by the \nPresident of the midterm review, from among representatives at the level of Head of \nState or Government and/or at the ministerial level; \n \n(b)  The Secretary-General of the midterm review will select up to four \npanellists for each of the round tables, and the panel discussion will be followed by \nan interactive debate among States and other relevant representatives and stakeholders; \n \n(c)  The round tables will be interactive and open to all conference \nparticipants; there will be no prepared list of speakers; at the discretion of the Chair \nor Chairs, priority in the order of speakers will be given to those speaking at the level \nof Head of State or Government or at the ministerial level; the round tables will aim \nto achieve a balance among speakers from all stakeholders; and, in order to provide \nfor maximum participation, interventions should not exceed three minutes;  \n \n65. Further decides that summaries of the round-table meetings will be \npresented orally by the Co-Chair at the closing plenary meeting;  \n \n66. Requests the President of the General Assembly to organize a four-day \npreparatory meeting of experts, to be chaired by the co-facilitators, with interpretation \nservices, no later than January 2027, with a view to considering the draft outcome \ndocument;  \n \n67. Decides that all negotiations on the outcome document shall be held at \nUnited Nations Headquarters in New York, and strongly encourages Member States \nto conclude negotiations on the draft outcome document in advance of the \ncomprehensive high-level midterm review;  \n\nA/C.2/80/L.5 \n \n25-16438\n16/17 \n \n \n68. Also decides that the comprehensive high-level midterm review and its \npreparatory process shall be open to participation by all States Members of the United \nNations or States members of the specialized agencies and observers in the General \nAssembly, and that the rules of procedure of the functional commissions of the \nEconomic and Social Council, as well as the supplementary arrangements established \nfor the Commission on Sustainable Development by the Council in its decisions \n1993/215 of 12 February 1993 and 1995/201 of 8 February 1995, shall apply;  \n \n69. Invites the host country to consider hosting, with the assistance of the \nOffice of the High Representative, within its existing mandate and resources, \nmeetings of various stakeholders on the margins of the comprehensive midterm \nreview, and encourages relevant representatives of Member States and relevant \nstakeholders to support and participate in the meetings; \n \n70. Invites the Economic and Social Council to consider the issue of the \ncomprehensive high-level midterm review as part of its coordination segment in 2026;  \n \n71. \nRequests the organs, organizations, funds and programmes of the United \nNations system to undertake sectoral appraisals in their respective fields of competence \non the implementation of the Doha Programme of Action, with special emphasis on \nareas where implementation has remained insufficient, and to make proposals for new \nmeasures, as necessary, as further inputs to the preparation for the comprehensive high-\nlevel midterm review, and in this regard affirms that appropriate inter-agency meetings \nshould be convened in order to ensure the full mobilization and coordination of the \nentire United Nations system, including the Bretton Woods institutions;  \n \n72. Emphasizes the importance of country-level preparations as a critical input \nto the preparatory process for the comprehensive high-level midterm review and to \nthe implementation of and follow-up to its outcome, in this context calls upon the \nleast developed countries to undertake their national reviews on the implementation \nof the Doha Programme of Action, with a particular focus on progress, obstacles, \nconstraints, actions and measures necessary to further its implementation, in close \ncollaboration with the Office of the High Representative and the United Nations \ncountry teams, as part of their existing workplans, and in this regard invites the United \nNations country teams to support the least developed countries in the preparation of \ntheir national reports, in close collaboration with the Office of the High Representative;  \n \n73. Requests the Deputy Secretary-General of the United Nations, in her \ncapacity as Chair of the United Nations Sustainable Development Group, to ensure \nthe full involvement of the United Nations resident coordinators and country teams \nin the least developed countries in the preparations for the comprehensive high-level \nmidterm review, in particular at the country level, including in the preparation of \nnational reports;  \n \n74. Requests the Secretary-General to submit, by the third quarter of 2026, a \ncomprehensive report on the implementation of the Doha Programme of Action over \nthe past five years, highlighting progress made against its targets and indicators, \nchallenges encountered and recommendations for the effective implementation of the \nProgramme during the remainder of the decade;  \n \n75. Reiterates the critical importance of the full and effective participation of \nthe least developed countries in the comprehensive high-level midterm review at the \nnational, regional and global levels, stresses that adequate resources should be provided, \nand in this regard requests the Secretary-General to mobilize extrabudgetary resources \nin order to cover the cost of the participation of two government representatives from \neach least developed country in the review and the preparatory meeting of experts;  \n\nA/C.2/80/L.5\n \n17/17\n25-16438 \n \n \n76. Urges Member States, and invites other multilateral development partners, \nintergovernmental and non-governmental organizations and the private sector, to \nmake voluntary contributions to the trust fund established by the Secretary-General \nin accordance with resolution 59/244 of 22 December 2004;  \n \n77.  Stresses, while recognizing the intergovernmental nature of the \ncomprehensive midterm review, the importance of the effective, well-structured and \nbroad participation of all relevant stakeholders, including parliamentarians, civil \nsociety and the private sector, in the midterm review, including national and regional \nreviews and thematic preparations, as well as in the interactive thematic round tables \nand side events during the midterm review, underlines that intergovernmental \nmechanisms at the global and regional levels, including those of the United Nations \nregional commissions, as well as relevant substantive material and statistical data, \nshould be effectively utilized in the review process, and decides: \n \n(a)  To invite non-governmental organizations that are in consultative status \nwith the Economic and Social Council to register with the Secretariat in order to \nparticipate in the comprehensive midterm review; \n \n(b)  To invite other relevant stakeholders, including organizations and bodies of \nthe United Nations system, international financial institutions, civil society \norganizations, the private sector, other international bodies and other non-governmental \norganizations to participate as observers in the midterm review; \n \n(c)  To request the President of the General Assembly to draw up a list of \nrepresentatives of other relevant non-governmental organizations, civil society \norganizations, academic institutions and the private sector who may participate in the \nmidterm review, taking into account the principles of transparency and of equitable \ngeographical representation and with due regard for gender parity and to submit the \nproposed list to Member States for their consideration on a non-objection basis and \nbring the list to the attention of the Assembly for a final decision by the Assembly on \nparticipation in the midterm review;  \n \n78. Calls upon all Member States to take a positive interest in the preparation \nof the comprehensive high-level midterm review and to be represented at a high level \nin the plenary meeting of the review, with a view to reaching a successful outcome;  \n \n79. Stresses the importance of the effective participation of all relevant \nstakeholders, including parliamentarians, civil society and the private sector, in the \ncomprehensive high-level midterm review and its preparatory process, in accordance \nwith Economic and Social Council resolution 1996/31 of 25 July 1996;  \n \n80.  Requests the Secretary-General, with the assistance of relevant \norganizations and bodies of the United Nations system, including the Department of \nGlobal Communications of the Secretariat, in collaboration with the Office of the \nHigh Representative, to take the measures necessary to intensify their public \ninformation efforts and other appropriate initiatives to enhance public awareness on \nthe outcome of the midterm review, including by highlighting its programme of \naction, objectives, key deliverables and significance;  \n \n81. Also requests the Secretary-General to submit to the General Assembly at \nits eighty-first session a comprehensive report on the implementation of the present \nresolution and the Doha Programme of Action, and decides to include in the \nprovisional agenda of its eighty-first session, under the item entitled \u201cGroups of \ncountries in special situations\u201d, the sub-item entitled \u201cFollow-up to the Fifth United \nNations Conference on the Least Developed Countries.\u201d  \n \n",
  "paragraphs": {
    "1": "Takes note of the reports of the Secretary-General on the follow-up to the Fifth United Nations Conference on the Least Developed Countries12 and on an online university for least developed countries or other equivalent platform to support university-level science, technology, engineering and mathematics education in the least developed countries;",
    "2": "Calls upon the least developed countries, in cooperation with their development partners, to broaden their existing country-level review mechanisms and report dissemination, including those for the achievement of the Sustainable Development Goals and the implementation of poverty reduction strategy papers, nationally determined contributions, United Nations Sustainable Development Cooperation Frameworks and the existing consultative mechanisms, to cover the review of the Doha Programme of Action and extend them to all least developed countries;",
    "3": "Calls upon development partners and all other relevant actors to implement the Doha Programme of Action by integrating it into their respective national cooperation policy frameworks, programmes and activities, as appropriate, to ensure enhanced, predictable and targeted support to the least developed countries, as set out in the Programme of Action, and the delivery of their commitments, and to consider appropriate measures to overcome shortfalls or shortcomings, if any;",
    "4": "Invites the United Nations system, including the governing bodies of the United Nations funds and programmes and other multilateral organizations, including the World Bank Group, the International Monetary Fund and other international financial institutions, as well as the World Trade Organization, to contribute to the implementation of the Doha Programme of Action and to integrate it into their programmes of work, as appropriate and in accordance with their relevant mandates, and invites those organizations to participate fully in reviews of the Programme of Action at the national, subregional, regional and global levels;",
    "5": "Welcomes the work of the Inter-Agency Consultative Group for Least Developed Countries, led by the Office of the High Representative for the Least Developed Countries, Landlocked Developing Countries and Small Island Developing States, notes the steps taken by the United Nations System Chief Executives Board for Coordination and the High-level Committee on Programmes in supporting the coordination and follow-up of the implementation of the Doha Programme of Action on a system-wide basis, and reiterates its invitation to the Secretary-General, in his capacity as Chair of the Chief Executives Board, to include the implementation of the Programme of Action in the agenda of the Board;",
    "6": "Recalls the strong commitment of the Heads of State and Government and representatives of States to advancing the concrete deliverables of the Doha Programme of Action with respect to exploring the feasibility, effectiveness and administrative modalities of a system of stockholding or alternative means, such as cash transfers, taking into account possible economic implications and risks, an online university or other equivalent platforms, an international investment support centre, a sustainable graduation support facility, and comprehensive multi-hazard crisis mitigation and resilience-building measures for least developed countries, and welcomes the efforts made towards their full operationalization and requests the Secretary-General to provide an update outlining progress towards operationalization of these deliverables and calls upon the development partners and other stakeholders to fully support the processes;",
    "7": "Decides to include the Doha Programme of Action as part of its review of the implementation of and follow-up to major United Nations conferences and summits, including the review of the 2030 Agenda for Sustainable Development;",
    "8": "Notes with concern the estimates that by 2030 much of the world\u2019s poor will live in the least developed countries, which indicate that the implementation of the 2030 Agenda is not on track, stresses the need for enhanced global support for the least developed countries to achieve the Sustainable Development Goals, as well as ensuring that no one is left behind, and further recognizes the importance of enhancing good governance at all levels by strengthening democratic processes, institutions and the rule of law, increasing efficiency, coherence, transparency and participation, achieving gender equality and the empowerment of all women and girls, reducing inequalities, protecting and promoting human rights, reducing corruption and strengthening the capacity of Governments of the least developed countries to play an effective role in their economic and social development;",
    "9": "Welcomes the adoption of resolution 79/226 of 19 December 2024 on the quadrennial comprehensive policy review of operational activities for development of the United Nations system, and urges the United Nations development system to continue to prioritize allocations to the least developed countries, in order to support the least developed countries in their efforts to implement the 2030 Agenda in a coherent and integrated manner and ensure effective delivery of support and services to programme countries in accordance with national development policies, plans, priorities and needs and in line with the mandates of the entities of the United Nations development system, further urges the United Nations development system to continue to enhance its support for the implementation of the Doha Programme of Action, which is integral to the 2030 Agenda, and calls upon the entities of the United Nations development system to integrate and mainstream the Doha Programme of Action fully into their operational activities for development;",
    "10": "Expresses deep concern at the devastating impacts of the COVID-19 pandemic on the least developed countries, takes note of the statement dated 28 April 2020 of the Group of Least Developed Countries on COVID-19 13 and commits to supporting its implementation, as appropriate, and invites development partners, international organizations and other stakeholders to support the least developed countries in their recovery efforts and continued implementation of the 2030 Agenda for Sustainable Development, further highlighting the need for greater collaboration and partnerships at all levels to accelerate the implementation of the 2030 Agenda, including the fulfilment of the least developed country-specific targets, the Addis Ababa Action Agenda of the Third International Conference on Financing for Development, and the Sevilla Commitment adopted at the Fourth International Conference on Financing for Development, which is an integral part of the 2030 Agenda;",
    "11": "Expresses its concern that the world is in the midst of a highly challenging environment in which global sustainable development prospects continue to diverge, with 35 per cent of targets on track or displaying moderate progress, while progress on 47 per cent of the targets is insufficient, and 18 per cent of the targets show regression from the 2015 baseline, underscoring the urgent need for intensified efforts to put the Sustainable Development Goals on course, and expresses further concern that the increased pressure on food, energy and finance, elevated inflation, rising global interest rates, tightened financial conditions, high indebtedness, disruptions in supply chains, and geopolitical tensions and conflicts, together with the adverse impacts of climate change, biodiversity loss and digital divides, have exacerbated challenges for many countries in addition to those associated with COVID-19 recovery, increasing hunger, and all forms of malnutrition and poverty and inequality; and analysis of the most recent data reveals that the least developed countries are not on track to meet the targets of the Doha Programme of Action and the Sustainable Development Goals;",
    "12": "Welcomes the Secretary-General\u2019s efforts to address the SDG financing gap through an SDG stimulus; and reiterates the commitment to advance the Secretary-General\u2019s proposal, in a timely manner through discussions at the United Nations as well as other relevant forums and institutions, to tackle the high cost of debt and rising risks of debt distress, to enhance support to developing countries and to massively scale up affordable long-term financing for development and expand contingency financing to countries in need;",
    "13": "Reaffirms that the least developed countries, as the most vulnerable group of countries, need enhanced global support to overcome the structural challenges, as well as recent devastating impacts of the COVID-19 pandemic, conflicts and climate change and the deteriorating situation of food security, lack of access to finance and energy, and increased poverty, that they face in implementing the 2030 Agenda, and in this regard calls upon the international community to prioritize and strengthen support from all sources to facilitate sustained recovery and rebuilding and the coordinated implementation and coherent follow-up to and monitoring of the Doha Programme of Action, the 2030 Agenda and the Addis Ababa Action Agenda in the least developed countries;",
    "14": "Recognizes that domestic public and private resources, including at the subnational level, supplemented by international assistance and foreign direct investment, as appropriate, will be critical for the realization of sustainable development and the achievement of the Sustainable Development Goals; and that the 2030 Agenda and the Addis Ababa Action Agenda acknowledge the centrality of domestic resources mobilization, underscored by the principle of national ownership;",
    "15": " to continue their development assistance to the least developed countries in their efforts to overcome ongoing crises;",
    "16": "Commends the surpassing of 100 billion United States dollars of special drawing rights and welcomes the global ambition to voluntarily channel 100 billion dollars of special drawing rights to developing and least developing countries, calls upon Member States with strong external positions to consider the voluntary channelling of special drawing rights to countries in need, particularly to the least developed countries, in a timely manner, including through the International Monetary Fund Poverty Reduction and Growth Trust, welcomes the operationalization of the International Monetary Fund Resilience and Sustainability Trust as a new mechanism to voluntarily channel special drawing rights to provide affordable long-term financing to the least developed countries and other vulnerable countries, with due consideration to national legal frameworks, and also welcomes the ongoing exploration of viable options to voluntarily channel special drawing rights through multilateral development banks; and calls for an urgent voluntary rechannelling of special drawing rights to countries most in need, including through multilateral development banks, while respecting relevant legal frameworks and preserving the reserve asset character of special drawing rights; and exploring ways for future allocations of special drawing rights to benefit those countries most in need;",
    "17": "Notes that the global macroeconomic outlook remains highly uncertain, and is particularly bleak for many developing countries, including a large number of least developed countries, faced with significantly higher borrowing costs, growing debt service burdens and tight fiscal constraints, and that such a finance divide will, if left unaddressed, translate into a lasting sustainable development divide; and calls for improved international debt mechanisms to support debt review, debt payment suspensions, and debt restructuring, as appropriate, with an expansion of support and eligibility to vulnerable countries in need;",
    "18": "Calls upon official creditors to make long-term sustainable financing available to least developed countries through grants and concessional funding and to offer more fixed-interest lending at low interest rates, emphasizing that this is part of a mix of financing approaches that also include grants;",
    "19": "Stresses the urgency of enhancing ambition for climate action in the implementation of the United Nations Framework Convention on Climate Change and the Paris Agreement in relation to climate mitigation, adaptation and the provision of the means of implementation, especially finance to developing countries; urges the implementation of the decisions adopted at the twenty-seventh session of the Conference of the Parties to the Convention, held in Sharm el-Sheikh, Egypt; recalls its commitment to take concrete steps toward the operationalization of the new funding arrangements for responding to loss and damage, including the fund, by the twenty- eighth session; commits to continuing work to accelerate action to address climate change; and in this regard takes note of the first global stocktake of the Paris Agreement that took place at the twenty-eighth session held in Dubai, United Arab Emirates;",
    "20": "Notes with concern that the current provision of climate finance for adaptation remains insufficient to respond to worsening climate change impacts in developing country Parties and recognizes the importance of the adequacy and predictability of adaptation finance, welcomes that the Parties 14 urged developed country Parties to urgently and significantly scale up their provision of climate finance, technology transfer and capacity-building for adaptation so as to respond to the needs of developing country Parties as part of a global effort, including for the formulation and implementation of national adaptation plans and adaptation communications, also recognizes that many least developed countries face challenges in gaining direct access to international public finance owing to a lack of technical capacity, supports the provision of assistance to least developed countries in preparing bankable projects and creating enabling environments, and encourages further efforts to enhance access to finance;",
    "21": "Underlines the need for reinforcing the existing comprehensive multi-hazard early warning system and comprehensive multi-hazard crises mitigation and resilience- building measures, including comprehensive disaster risk financing strategies for the least developed countries aligned with the Sendai Framework for Disaster Risk Reduction 2015\u20132030 as a key instrument to build resilience against and mitigate the impacts of various shocks, and the commitment to making the best use of existing initiatives, providing support for capacity-building for adaptation planning and implementation, and technical assistance to develop operational national risk information systems to support policymaking, including in the insurance sector, and takes note of the report of the Secretary-General on multi-hazard early warning systems in the least developed countries, as well as the comprehensive technical report entitled \u201cStatus of multi-hazard early warning systems in the least developed countries\u201d prepared by the Office of the High Representative in cooperation with the United Nations Office for Disaster Risk Reduction and the World Meteorological Organization;",
    "22": "Welcomes the progress made under the Secretary-General\u2019s Early Warnings for All initiative, and invites the initiative to expand its coverage to include all least developed countries, which have acute needs and are the furthest behind;",
    "23": "Calls upon Member States, the broader United Nations system, civil society organizations and development partners across the public and private sectors to consider the recommendations contained in the report of the Secretary-General,15 aimed at accelerating action to address gaps and deliver people-centred and country- led, end-to-end multi-hazard early warning systems in the least developed countries;",
    "24": "Welcomes the adoption of resolution 78/322 of 13 August 2024 on the multidimensional vulnerability index, calls for ensuring that the least developed countries should be considered in the composition of the Independent Expert Advisory Panel, as appropriate, and recognizes the potential to further improve the index, inter alia, by considering additional indicators to be included in future iterations of the index as well as indicators for potential refinement or approval to effectively capture the vulnerabilities of all developing countries, including least developed countries;",
    "25": "Calls upon the developing countries, guided by the spirit of solidarity and consistent with their capabilities, to provide support for the effective implementation of the Doha Programme of Action in mutually agreed areas of cooperation within the framework of South-South and triangular cooperation, which is a complement to but not a substitute for North-South cooperation;",
    "26": "Underlines the importance of promoting an enabling business environment conducive to growth and development, the absence of corruption, a transparent and rules-based regulatory framework, simplifying business regulations and processes, reducing and streamlining administrative formalities, creating efficient national support mechanisms for micro-, small and medium-sized enterprises, improving supply chains, facilitating access to markets, reinforcing cooperation, building capacities to implement effective competition policies, and adopting open, transparent and clear regulatory frameworks for business and investment, with protection for property rights and land rights as appropriate and in accordance with national circumstances and consistent with international legal frameworks;",
    "27": "Urges the least developed countries and their development partners to make use of existing initiatives and programmes, such as the relevant ministerial decisions of the World Trade Organization on duty-free and quota-free market access for the least developed countries and on preferential rules of origin for those countries, as well as aid-for-trade, reiterates its commitment to increasing aid-for- trade support, in particular for the least developed countries, striving to allocate an increasing proportion of aid-for-trade to the least developed countries, in accordance with development cooperation effectiveness principles, welcomes additional cooperation among developing countries to that end, and encourages the least developed countries to mainstream trade in their national development plans;",
    "28": "Recognizes that the least developed countries face significant infrastructure gaps, including in the areas of transport, energy, water, sanitation and information and communications technology, and reaffirms the need to promote quality, reliable, sustainable and resilient infrastructure and to enhance infrastructure connectivity with concrete actions and predictable financing, thereby maximizing synergies in infrastructure planning and development;",
    "29": "Reaffirms that the least developed countries are especially vulnerable to and disproportionately affected by the adverse effects of climate change, environmental degradation and other disasters, and recognizes the high importance of building resilience in the least developed countries through stepped-up capacity- building and finance for adaptation to climate change;",
    "30": "Recalls the Sendai Framework for Disaster Risk Reduction 2015\u20132030 and reaffirms that disaster-prone developing countries need particular attention in view of their high vulnerability and exposure to adverse climate change impacts, recognizes that the development and implementation of risk-informed plans, policies, programmes and investments are essential for sustainable development and the achievement of the Sustainable Development Goals, also recognizes that the COVID-19 pandemic has increased vulnerability to wider, growing risks, notes with serious concern the stark warnings contained in the recent report of the Intergovernmental Panel on Climate Change and notes that the Sendai Framework provides guidance relevant to a sustainable recovery from COVID-19 and also to identify and address underlying drivers of disaster risk in a systemic manner, further recognizes the health aspects of the Sendai Framework, and stresses the need for resilient health systems;",
    "31": "Recognizes the need for dealing with severe food insecurity and malnutrition in least developed countries, and calls upon Member States and other relevant stakeholders to keep food and agriculture supply chains functioning; and calls upon the international financial institutions to find urgent, affordable and timely solutions to support developing countries, in particular those highly indebted, in responding to the food security crisis and achieving Sustainable Development Goal 2, through, but not limited to, facilitating, as appropriate, access to debt relief and concessional finance, and welcomes the Nutrition for Growth Summit, convened by the Government of France in 2025, and the First Leaders\u2019 Meeting of the Global Alliance against Hunger and Poverty, to be held in Qatar in November 2025;",
    "32": "Takes note of the findings and recommendations of the reports of the Secretary-General16 exploring the feasibility, effectiveness and administrative modalities of a system of food stockholding for the least developed countries, welcomes the establishment of a task force to guide the preparation of a comprehensive feasibility study for the operationalization of the Food Stockholding Mechanism for the Least Developed Countries, with the ultimate goal of enhancing food security and resilience in these countries, and calls for consultations with relevant United Nations entities, including Rome-based agencies, Member States, regional and international organizations and other stakeholders on the preparation of the feasibility study;",
    "33": "Recognizes that particular efforts are needed to ensure that all young people, including girls, enjoy equal access to lifelong learning opportunities and equal access to inclusive and quality education at all levels, inclusive of early childhood, primary, secondary and tertiary education, as well as technical and vocational training, notes with concern, in this regard, the lack of progress in closing gender gaps in access to, retention in and completion of secondary education, particularly for girls, recognizes the need to continue to provide and encourage, as appropriate, institutes of higher education to allocate places and scholarships for students and trainees from the least developed countries, in particular in the fields of science, technology, business management and economics, and to strengthen support for institutions in relation to gender equality and the empowerment of women and girls at the global, regional and national levels, and also recognizes that the least developed countries have the most to gain from sustainable development and utilizing the full skills and talents of their people, including women and girls;",
    "34": "Takes note of the findings and recommendations of the report of the Secretary-General on an online university for least developed countries or other equivalent platform to support university-level science, technology, engineering and mathematics education in the least developed countries, and endorses the following recommendations towards the establishment of an online university or equivalent platform for least developed countries in accordance with the Doha Programme of Action, with the aim of formally launching the online university at the midterm review of the Doha Programme of Action in 2027: (a) Support efforts to further elaborate the structure, governance mechanisms and other institutional matters related to the online university and conduct a sample mapping of in-country assessments, in collaboration with relevant United Nations entities including the United Nations Educational, Scientific and Cultural Organization, the Technology Bank for the Least Developed Countries and the United Nations University, to evaluate national readiness for implementing or expanding online and blended education to rapidly scale up the delivery of inclusive, quality science, technology, engineering and mathematics education in least developed countries; (b) Establish a task force to provide strategic direction leading towards full operationalization of the online university to be supported by the Office of the High Representative; the task force membership shall include relevant representatives from the United Nations system, government representatives and experts, and other relevant stakeholders and organizations may be invited for exchange of views and inputs as required; (c) Commit to advancing the modalities of the proposed online university by strategically leveraging existing facilities and resources both within the United Nations system and through external partnerships, including the academic and research infrastructure provided by entities such as the United Nations University, the United Nations Educational, Scientific and Cultural Organization, the International Telecommunication Union and the Technology Bank as well as other relevant institutions;",
    "35": " countries to establish and strengthen national and regional science institutes to increase their capacity for research and development in science, technology and innovations and promote the adaptation and application of modern technologies for domestic uses;",
    "36": "Supports the Technology Bank for the Least Developed Countries as a focal point for the least developed countries to strengthen their science, technology and innovation capacity towards building sustainable productive capacities and promoting structural economic transformation, also supports the Technology Bank in strengthening the science, technology and innovation capacity of least developed countries for structural transformation and productive capacity development, invites Member States, as well as international organizations, foundations and the private sector, to provide voluntary financial and in-kind resources to the Technology Bank in order to enhance its capacity and effectiveness, and to fulfil its mandate and decides to strengthen collaboration among Governments, the private sector and academia to advance science, technology and innovation research and development, build inclusive digital economies and bridge the digital divide, including by facilitating technology transfer on mutually agreed terms; encourages least developed countries to engage with development partners through the Technology Bank, including by utilizing the technology needs assessments; and also decides to include the topic \u201cReport on the work of the Technology Bank for the Least Developed Countries\u201d under the sub-item entitled \u201cFollow-up to the Fifth United Nations Conference on the Least Developed Countries\u201d at its eighty-first session, and requests the Secretary- General to submit a report for its consideration;",
    "37": "Reaffirms the commitment to implementing the decision contained in the Addis Ababa Action Agenda and the 2030 Agenda to adopt and implement investment promotion regimes that encourage and facilitate foreign direct investment and sustainable economic growth in the least developed countries, welcomes the support in the Sevilla Commitment for the establishment and operationalization of an international investment support centre for the least developed countries, reiterates the decision to provide financial and technical support for project preparation and contract negotiation, advisory support for investment-related dispute resolution, access to information on investment facilities, improving enabling environments, and risk insurance and guarantees such as through the Multilateral Investment Guarantee Agency, stresses the importance of foreign direct investment as a key source of economic development and external finance, with a complementary and catalytic role vis-\u00e0-vis domestic resource mobilization and investment and development finance, and notes with concern that foreign direct investment to the least developed countries remains below 2.5 per cent of global foreign direct investment flows, despite the fact that least developed countries are home to about 15 per cent of the global population, takes note of the report of the Secretary-General on an international investment support centre for the least developed countries, and urges further progress on the elaboration of such a centre, as requested in paragraph 261 of the Doha Programme of Action, and requests the Secretary-General to carry out pilot projects in least developed countries and submit the final recommendations from the full feasibility study to the General Assembly for its consideration at its eighty-first session;",
    "38": " investments in the formulation and implementation of all financial, economic, environmental and social policies in the least developed countries;",
    "39": "Reiterates its conviction that no country graduating from the least developed country category should have its development progress disrupted or reversed, welcomes the fact that the United Nations graduation process helps to ensure that no graduating country has its special and differential treatment measures and exemptions reduced abruptly, invites development and trading partners to consider extending to graduated countries trade preferences previously made available as a result of least developed country status, or reducing them in a phased manner in order to avoid their abrupt reduction, notes that the Group of Least Developed Countries put forward various proposals at the World Trade Organization, pertaining to, among other things, trade-related challenges and those related to the smooth transition of the countries graduating from the least developed country category and seeks to further examine these issues, and calls upon the development partners to continue to provide, as appropriate, special climate change-related finance and technological support to graduated countries so as to support action towards the achievement of the goals of the Paris Agreement and for a period consistent with their vulnerabilities, sustainable development needs and other national circumstances and emerging challenges;",
    "40": "Underlines the importance of integrating support for graduating and graduated countries into the relevant work programmes of the entities of the United Nations development system in the light of the increasing number of graduating countries and their need for continued support from the United Nations development system;",
    "41": "Recognizes that the preparatory period before graduation is crucial for graduating countries to prepare their national smooth transition strategy, and invites bilateral, regional and multilateral development partners to support the development, preparation, and implementation of countries\u2019 smooth transition strategies, including by extending least developed country-specific international support measures and appropriate incentives in accordance with the Doha Programme of Action;",
    "42": "Takes note of the benefits of updating the existing General Assembly resolutions on smooth transition, and requests the President of the General Assembly to establish an open-ended ad hoc working group of Member States on the smooth transition for countries graduating from the list of least developed countries to carry out an inclusive and transparent process to review and update the existing resolutions on smooth transition and support to graduating least developed countries and recently graduated countries;",
    "43": "Recommits to take action to strengthen international, national and local data systems efforts to collect high-quality, timely, relevant, disaggregated and reliable data on Sustainable Development Goals progress and to intensify efforts to strengthen data and statistical capacities in developing countries, in particular the least developed countries;",
    "44": "Recognizes that the activities relating to the least developed countries carried out within the Secretariat need to be further coordinated and consolidated in order to ensure the effective monitoring and follow-up of the implementation of the Doha Programme of Action, led by the Office of the High Representative, and to provide well-coordinated support to realizing, inter alia, the target of enabling 15 additional least developed countries to meet the criteria for graduation by 2031;",
    "45": " processes, follow up on actions taken at the national level, further strengthen the network of national focal points of least developed countries, develop operational guidelines for United Nations entities support to countries in conflict and post-conflict situations and support the graduating and graduated countries have increased;",
    "46": "Calls upon the development partners, international financial institutions and the United Nations system to enhance their support for the full and effective operationalization of the Sustainable Graduation Support Facility (iGRAD), in line with the mandate of the Doha Programme of Action for the Least Developed Countries, recognizing its vital role in providing technical assistance, advisory services and capacity development to graduating and graduated least developed countries, and underlining that enhanced international support to iGRAD can play a critical role in ensuring smooth transition, sustaining development gains, and addressing vulnerabilities arising from climate change, economic shocks and other global crises;",
    "47": "Recommends that the United Nations development system organizations develop internal guidelines on how to translate the stated priorities for least developed countries into their budget allocations or their capacity-development projects, and invites the World Bank Group, the International Monetary Fund, other international financial and development institutions to provide tailored programmes to support the least developed countries; further invites international organizations to consider how the Doha Programme of Action may inform their efforts; and also requests the United Nations development system to further expand the use of the least developed country category in programming and budgeting;",
    "48": "Invites Governments, intergovernmental and non-governmental organizations, major groups and other donors to contribute in a timely manner to the trust fund in support of activities undertaken by the Office of the High Representative to support the implementation, follow-up and monitoring of the Doha Programme of Action and the participation of the representatives from the least developed countries in the high- level political forum on sustainable development of the Economic and Social Council as well as in other relevant forums, and in this regard expresses its appreciation to those countries that have made voluntary contributions to the trust fund;",
    "49": "Expresses its profound gratitude to the Government and the people of the State of Qatar for hosting the second part of the Fifth United Nations Conference on the Least Developed Countries and for providing all the necessary support to the Conference and its follow-up processes;",
    "50": "Expresses its appreciation to all development partners for the support provided to the least developed countries and for the continued commitment of support to the implementation of the Doha Programme of Action for the Least Developed Countries, including its deliverables;",
    "51": "Recalls paragraph 309 of the Doha Programme of Action, in which the General Assembly was invited to consider conducting a comprehensive high-level midterm review of the implementation of the Programme of Action in 2026;",
    "52": "Welcomes the generous offer of the Government of Qatar to host the comprehensive high-level midterm review;",
    "53": " (c) Shall result in an intergovernmentally negotiated and agreed outcome in the form of a political declaration; (d) Shall ensure that the summaries of the plenary meetings and other deliberations of the review are included in the report of the review;",
    "54": "Also decides that the scope of the midterm comprehensive global review shall be as follows: (a) To undertake a comprehensive review of the implementation of the Doha Programme of Action by the least developed countries and their development partners, share best practices and lessons learned and identify obstacles and constraints encountered and actions and initiatives needed to overcome them, as well as new challenges and emerging issues; (b) To reaffirm the global commitment to address the special needs of the least developed countries made at the Fifth United Nations Conference on the Least Developed Countries and to further strengthen the global partnership for development for least developed countries in all priority areas of the Doha Programme of Action in order to ensure the timely, effective and full implementation of the Programme of Action during the remainder of the Decade, while taking into account the 2030 Agenda for Sustainable Development as it relates to the least developed countries;",
    "55": "Underlines that there will be two regional-level preparatory meetings, taking advantage of the biennial regional meetings already scheduled for 2026, as appropriate, one in collaboration with the Economic Commission for Africa, which will include Haiti, and the other in collaboration with the Economic and Social Commission for Asia and the Pacific, which will include Yemen, with the regional- level meetings to be supported by broad-based and inclusive country-level preparations, and that the outcomes of the regional-level preparatory meetings should be considered in the comprehensive high-level midterm review;",
    "56": "Requests the Secretary-General to convene a United Nations system high- level event during the comprehensive high-level midterm review, with a view to ensuring the full mobilization of the United Nations system in support of the least developed countries and the coordinated and timely implementation by the United Nations system of the Doha Programme of Action and the outcome of the review;",
    "57": "Requests the President of the General Assembly to organize, in 2026, a one-day special thematic event, with the participation of Member States, non-governmental organizations, civil society, the private sector and academic institutions, in order to provide input to the comprehensive high-level midterm review;",
    "58": "Requests the President of the General Assembly at its eighty-first session to appoint two co-facilitators, one from a developed country and one from a developing country, to oversee and direct informal intergovernmental consultations on all issues relating to the review and its preparatory process;",
    "59": "Requests the co-facilitators to present a draft political declaration, no later than 30 October 2026 and in advance of the preparatory meeting of experts, prepared on the basis of inputs from the national and regional preparatory meetings, the report of the Secretary-General and other inputs, including those from Member States;",
    "60": "Decides that the midterm review shall elect from among the representatives of participating States the following officers: a President and an ex officio Vice-President from the host country, and nine Vice-Presidents, one of whom shall be designated as Rapporteur;",
    "61": " Island Developing States shall serve as the Secretary-General of the midterm review and shall be responsible for making the necessary arrangements for carrying out the work of the midterm review; and further underlines that the Office of the High Representative, as the focal point, in accordance with mandates given by the General Assembly in its resolution 56/227 of 24 December 2001, has the responsibility for ensuring that the preparations are carried out effectively and efficiently and for mobilizing and coordinating the active involvement of the organizations of the United Nations system;",
    "62": "Further decides that the opening plenary meeting of the midterm review will include statements by the President of the midterm review, the Secretary-General of the United Nations, the President of the General Assembly, the President of the Economic and Social Council, the former and current Chairs of the Group of Least Developed Countries, the President of the European Commission, the President of the World Bank Group and one representative each from civil society and the private sector;",
    "63": "Decides that the thematic meetings will focus on identifying concrete suggestions to further strengthen the global partnership for development for least developed countries in all priority areas of the Doha Programme of Action for the Least Developed Countries in order to ensure the timely, effective and full implementation of the Programme of Action during the remainder of the decade, while taking into account synergy and coherence of the Programme of Action with global processes, including the 2030 Agenda for Sustainable Development, the Sevilla Commitment of the Fourth International Conference on Financing for Development, the Sendai Framework for Disaster Risk Reduction 2015\u20132030, and the Paris Agreement under the United Nations Framework Convention on Climate Change;",
    "64": "Also decides that the organizational arrangements of the round tables will be as follows: (a) Each round table will be co-chaired by two Chairs, one from the least developed countries and one from the development partners, to be appointed by the President of the midterm review, from among representatives at the level of Head of State or Government and/or at the ministerial level; (b) The Secretary-General of the midterm review will select up to four panellists for each of the round tables, and the panel discussion will be followed by an interactive debate among States and other relevant representatives and stakeholders; (c) The round tables will be interactive and open to all conference participants; there will be no prepared list of speakers; at the discretion of the Chair or Chairs, priority in the order of speakers will be given to those speaking at the level of Head of State or Government or at the ministerial level; the round tables will aim to achieve a balance among speakers from all stakeholders; and, in order to provide for maximum participation, interventions should not exceed three minutes;",
    "65": "Further decides that summaries of the round-table meetings will be presented orally by the Co-Chair at the closing plenary meeting;",
    "66": "Requests the President of the General Assembly to organize a four-day preparatory meeting of experts, to be chaired by the co-facilitators, with interpretation services, no later than January 2027, with a view to considering the draft outcome document;",
    "67": "",
    "68": "Also decides that the comprehensive high-level midterm review and its preparatory process shall be open to participation by all States Members of the United Nations or States members of the specialized agencies and observers in the General Assembly, and that the rules of procedure of the functional commissions of the Economic and Social Council, as well as the supplementary arrangements established for the Commission on Sustainable Development by the Council in its decisions 1993/215 of 12 February 1993 and 1995/201 of 8 February 1995, shall apply;",
    "69": "Invites the host country to consider hosting, with the assistance of the Office of the High Representative, within its existing mandate and resources, meetings of various stakeholders on the margins of the comprehensive midterm review, and encourages relevant representatives of Member States and relevant stakeholders to support and participate in the meetings;",
    "70": "Invites the Economic and Social Council to consider the issue of the comprehensive high-level midterm review as part of its coordination segment in 2026;",
    "71": "Requests the organs, organizations, funds and programmes of the United Nations system to undertake sectoral appraisals in their respective fields of competence on the implementation of the Doha Programme of Action, with special emphasis on areas where implementation has remained insufficient, and to make proposals for new measures, as necessary, as further inputs to the preparation for the comprehensive high- level midterm review, and in this regard affirms that appropriate inter-agency meetings should be convened in order to ensure the full mobilization and coordination of the entire United Nations system, including the Bretton Woods institutions;",
    "72": "Emphasizes the importance of country-level preparations as a critical input to the preparatory process for the comprehensive high-level midterm review and to the implementation of and follow-up to its outcome, in this context calls upon the least developed countries to undertake their national reviews on the implementation of the Doha Programme of Action, with a particular focus on progress, obstacles, constraints, actions and measures necessary to further its implementation, in close collaboration with the Office of the High Representative and the United Nations country teams, as part of their existing workplans, and in this regard invites the United Nations country teams to support the least developed countries in the preparation of their national reports, in close collaboration with the Office of the High Representative;",
    "73": "Requests the Deputy Secretary-General of the United Nations, in her capacity as Chair of the United Nations Sustainable Development Group, to ensure the full involvement of the United Nations resident coordinators and country teams in the least developed countries in the preparations for the comprehensive high-level midterm review, in particular at the country level, including in the preparation of national reports;",
    "74": "Requests the Secretary-General to submit, by the third quarter of 2026, a comprehensive report on the implementation of the Doha Programme of Action over the past five years, highlighting progress made against its targets and indicators, challenges encountered and recommendations for the effective implementation of the Programme during the remainder of the decade;",
    "75": "",
    "76": "Urges Member States, and invites other multilateral development partners, intergovernmental and non-governmental organizations and the private sector, to make voluntary contributions to the trust fund established by the Secretary-General in accordance with resolution 59/244 of 22 December 2004;",
    "77": "Stresses, while recognizing the intergovernmental nature of the comprehensive midterm review, the importance of the effective, well-structured and broad participation of all relevant stakeholders, including parliamentarians, civil society and the private sector, in the midterm review, including national and regional reviews and thematic preparations, as well as in the interactive thematic round tables and side events during the midterm review, underlines that intergovernmental mechanisms at the global and regional levels, including those of the United Nations regional commissions, as well as relevant substantive material and statistical data, should be effectively utilized in the review process, and decides: (a) To invite non-governmental organizations that are in consultative status with the Economic and Social Council to register with the Secretariat in order to participate in the comprehensive midterm review; (b) To invite other relevant stakeholders, including organizations and bodies of the United Nations system, international financial institutions, civil society organizations, the private sector, other international bodies and other non-governmental organizations to participate as observers in the midterm review; (c) To request the President of the General Assembly to draw up a list of representatives of other relevant non-governmental organizations, civil society organizations, academic institutions and the private sector who may participate in the midterm review, taking into account the principles of transparency and of equitable geographical representation and with due regard for gender parity and to submit the proposed list to Member States for their consideration on a non-objection basis and bring the list to the attention of the Assembly for a final decision by the Assembly on participation in the midterm review;",
    "78": "Calls upon all Member States to take a positive interest in the preparation of the comprehensive high-level midterm review and to be represented at a high level in the plenary meeting of the review, with a view to reaching a successful outcome;",
    "79": "Stresses the importance of the effective participation of all relevant stakeholders, including parliamentarians, civil society and the private sector, in the comprehensive high-level midterm review and its preparatory process, in accordance with Economic and Social Council resolution 1996/31 of 25 July 1996;",
    "80": "Requests the Secretary-General, with the assistance of relevant organizations and bodies of the United Nations system, including the Department of Global Communications of the Secretariat, in collaboration with the Office of the High Representative, to take the measures necessary to intensify their public information efforts and other appropriate initiatives to enhance public awareness on the outcome of the midterm review, including by highlighting its programme of action, objectives, key deliverables and significance;",
    "81": "Also requests the Secretary-General to submit to the General Assembly at its eighty-first session a comprehensive report on the implementation of the present resolution and the Doha Programme of Action, and decides to include in the provisional agenda of its eighty-first session, under the item entitled \u201cGroups of countries in special situations\u201d, the sub-item entitled \u201cFollow-up to the Fifth United Nations Conference on the Least Developed Countries.\u201d"
  },
  "agenda_items": [
    "Item 21"
  ],
  "symbol_references": [
    "A/C.2/80/L.5"
  ]
}