{
  "symbol": "A/C.3/80/L.45",
  "filename": "A_C.3_80_L.45.pdf",
  "title": "National human rights institutions",
  "text": "United Nations \nA/C.3/80/L.45\n \n \nGeneral Assembly \nDistr.: Limited \n4 November 2025 \nOriginal: English \n \n25-17783 (E)    121125 \n*2517783* \n \n \n \nEightieth session \nThird Committee \nAgenda item 71 (b) \nPromotion and protection of human rights: human \nrights questions, including alternative approaches for \nimproving the effective enjoyment of human rights and \nfundamental freedoms \n \n \n \n \n \nArmenia, Austria, Bosnia and Herzegovina, Croatia, Czechia, Finland, Georgia, \nGermany, Ireland, Spain and Ukraine: draft resolution \n \n \n \n National human rights institutions \n \n \n \nThe General Assembly, \n \nRecalling all its relevant resolutions, as well as those of the Human Rights \nCouncil and the Commission on Human Rights on national institutions for the \npromotion and protection of human rights, including most recently Council resolution \n57/23 of 10 October 20241 and General Assembly resolution 78/204 of 19 December \n2023, as well as the previous resolutions on the role of the Ombudsman, mediator \ninstitutions and other national human rights institutions 2 in the promotion and \nprotection of human rights,  \n \nRecalling also the principles relating to the status of national institutions for the \npromotion and protection of human rights (the Paris Principles), 3 and recalling with \nappreciation the establishment of the Global Alliance of National Human Rights \nInstitutions,  \n \nRecalling further the Vienna Declaration and Programme of Action adopted by \nthe World Conference on Human Rights on 25 June 1993,4 which reaffirmed the \nimportant and constructive role played by national human rights institutions, in \nparticular in their advisory capacity to the competent authorities and their role in \npreventing and remedying human rights violations, in disseminating information on \nhuman rights and in education in human rights,  \n \nAcknowledging that the promotion and protection of human rights and the \nimplementation of the 2030 Agenda for Sustainable Development 5 are interrelated \n__________________ \n \n1  See Official Records of the General Assembly, Seventy-ninth Session, Supplement No. 53A \n(A/79/53/Add.1), chap. III, sect. A. \n \n2  \u201cNational human rights institutions\u201d and \u201cnational institutions for the promotion and protection \nof human rights\u201d are used synonymously. \n \n3  Resolution 48/134, annex. \n \n4  A/CONF.157/24 (Part I), chap. III. \n \n5  Resolution 70/1. \n\nA/C.3/80/L.45 \n \n25-17783\n2/9 \n \nand mutually reinforcing, and recognizing that the 2030 Agenda for Sustainable \nDevelopment contains a pledge to leave no one behind and envisages universal \nrespect and promotion of human rights and human dignity, the rule of law, justice, \nequality and non-discrimination,  \n \nRecognizing the importance of the independent contributions of national human \nrights institutions in promoting and protecting all human rights, including, in \naccordance with their mandates, economic, social, cultural, civil and political rights, \nparticularly in the context of the implementation of the 2030 Agenda for Sustainable \nDevelopment, which seeks, among other tasks, to realize the human rights of all \nwithout discrimination on any grounds, \n \nReaffirming the importance of, and welcoming the rapidly growing interest \nthroughout the world in, establishing and strengthening independent and pluralistic \nnational human rights institutions in accordance with the Paris Principles,  \n \nRecalling that the existence of independent national human rights institutions \nestablished in compliance with the Paris Principles is a global indicator of progress \ntowards achieving the 2030 Agenda for Sustainable Development, recognizing that \nnational human rights institutions in all regions have made important contributions \ntowards achieving the 2030 Agenda for Sustainable Development, and taking note of \nthe report of the Secretary-General on progress towards the Sustainable Development \nGoals,6 \n \nNoting that, when in compliance with the Paris Principles, national human rights \ninstitutions can help States to fast-track vital protection and other services to those \nleft behind, and that the pace of progress in establishing national human rights \ninstitutions in compliance with the Paris Principles must be increased, \n \nAcknowledging the ongoing valuable contribution made by many national \nhuman rights institutions in promoting and protecting human rights and fundamental \nfreedoms of all persons with disabilities, and emphasizing the importance of adopting \ncross-cutting approaches that address the specific vulnerabilities and barriers faced \nby diverse groups, including children, women, older persons, ethnic minorities, \npersons with disabilities and lesbian, gay, bisexual and transgender persons, among \nothers, \n \nWelcoming the twentieth anniversary of the Convention on the Rights of Persons \nwith Disabilities7 in 2026, and reaffirming the general principles enshrined therein, \nnamely, non-discrimination, full and effective participation and inclusion in society, \nrespect for difference and acceptance of all persons with disabilities as part of human \ndiversity and humanity, individual autonomy and independence of all persons with \ndisabilities, gender equality and respect for the evolving capacities of children with \ndisabilities,  \n \nConcerned that, despite the various instruments and undertakings, many persons \nwith disabilities continue to face barriers in their participation as equal members of \nsociety and violations and abuses of their human rights in places throughout the \nworld,  \n \nReaffirming the important role that national human rights institutions play, and \nwill continue to play, in promoting and protecting human rights and fundamental \nfreedoms, strengthening participation, in particular of civil society organizations, \npromoting the rule of law, developing and enhancing public awareness of those rights \n__________________ \n \n6  A/80/81-E/2025/62. \n \n7  United Nations, Treaty Series, vol. 2515, No. 44910. \n\nA/C.3/80/L.45\n \n3/9\n25-17783 \n \nand fundamental freedoms and contributing to the prevention of human rights \nviolations and abuses,  \n \nEncouraging greater efforts to investigate and respond to increasing reports of \ncases of reprisal or intimidation against national human rights institutions, their \nmembers and staff and those who cooperate or seek to cooperate with them,  \n \nRecognizing the important role that national human rights institutions can play \nin preventing and addressing cases of reprisal or intimidation as part of supporting \nthe cooperation between States and the United Nations in the promotion of human \nrights, including by contributing to follow-up actions, as appropriate, to \nrecommendations made by international human rights mechanisms, \n \nTaking note of the Belgrade principles on the relationship between national \nhuman rights institutions and parliaments,8 \n \nRecognizing the important role of the United Nations, in particular the Office of \nthe United Nations High Commissioner for Human Rights, in assisting the \ndevelopment and supporting the work of independent and effective national human \nrights institutions, in compliance with the Paris Principles, and recognizing also in \nthis regard the potential for strengthened and complementary cooperation among the \nUnited Nations, the Global Alliance of National Human Rights Institutions and its \nregional coordinating networks and those national institutions in the promotion and \nprotection of human rights,  \n \nRecalling the programme of action adopted by national institutions for the \npromotion and protection of human rights at their meeting held in Vienna in June \n1993 during the World Conference on Human Rights, in which it was recommended \nthat United Nations activities and programmes should be reinforced to meet the \nrequests for assistance from States wishing to establish or strengthen their national \ninstitutions for the promotion and protection of human rights, \n \nTaking note with appreciation of the reports of the Secretary-General on national \ninstitutions for the promotion and protection of human rights 9 and on the activities of \nthe Global Alliance of National Human Rights Institutions in accrediting national \ninstitutions in compliance with the principles relating to the status of institutions for \nthe promotion and protection of human rights (Paris Principles),10 \n \nWelcoming efforts to strengthen United Nations system-wide coordination in \nsupport of national human rights institutions and their networks, including the \ntripartite partnership between the Office of the United Nations High Commissioner \nfor Human Rights, the United Nations Development Programme and the Global \nAlliance of National Human Rights Institutions, \n \nCommending the strengthening in all regions of regional cooperation among \nnational human rights institutions, and welcoming further the continuing work of the \nNetwork of African National Human Rights Institutions, the Network of National \nInstitutions for the Promotion and Protection of Human Rights in the Americas, the \nAsia-Pacific Forum of National Human Rights Institutions and the European Network \nof National Human Rights Institutions, \n \nWelcoming the contribution of the Global Alliance of National Human Rights \nInstitutions to the strengthening of cooperation among existing national human rights \ninstitutions in all regions and the enhancement of the engagement of national human \n__________________ \n \n8  A/HRC/20/9, annex. \n \n9  A/78/182. \n \n10  A/HRC/51/52. \n\nA/C.3/80/L.45 \n \n25-17783\n4/9 \n \nrights institutions compliant with the Paris Principles with relevant United Nations \nmechanisms and processes,  \n \nWelcoming also the progress made to date by Member States and all other \nstakeholders, including the Global Alliance of National Human Rights Institutions \nand its regional coordinating networks and relevant United Nations mechanisms and \nprocesses, in the implementation of resolution 78/204, \n \nRecalling that, in the Pact for the Future,11 Heads of State and Government \nstated that national human rights institutions must be protected from any form of \nintimidation and reprisals, both online and offline, and that they recognized the \nimportance of United Nations engagement with relevant stakeholders, including \nnational human rights institutions and civil society organizations, decided to ensure \nthat such stakeholders can meaningfully participate, in their respective roles and \nresponsibilities, in accordance with relevant rules of procedure, in relevant United \nNations processes and that Member States have access to the views and expertise of \nthose partners, and also decided to leverage existing channels and strengthen \ncommunication between United Nations intergovernmental bodies and civil society, \nallowing for ongoing dialogue and exchange of information, \n \nWelcoming the opportunities afforded to national human rights institutions \ncompliant with the Paris Principles and their networks to contribute, including on an \nad hoc basis, to some sessions of the high-level political forum on sustainable \ndevelopment, the Permanent Forum on Indigenous Issues, the Commission on the \nStatus of Women, the Conference of States Parties to the Convention on the Rights of \nPersons with Disabilities and the Conference of the Parties to the United Nations \nFramework Convention on Climate Change,12 and encouraging further efforts to \nsustain such contributions through well-established modalities for participation in the \nwork of these bodies, \n \nRecalling the invitation to national human rights institutions compliant with the \nParis Principles to register with the Secretariat in order to participate in the \ninternational migration review forums, including the informal interactive multi-\nstakeholder hearings, and inviting the institutions, as well as the Global Alliance of \nNational Human Rights Institutions and its regional networks, to submit inputs prior \nto the forums, \n \nWelcoming the continued contribution of national human rights institutions to \nthe work of the United Nations human rights treaty bodies, as well as the efforts of \nthe treaty bodies, within their respective mandates and in accordance with the treaties \nestablishing these mechanisms, to promote the effective and enhanced participation \nby national human rights institutions compliant with the Paris Principles at all \nrelevant stages of their work, and noting with appreciation the ongoing efforts of the \ntreaty bodies, including by the continued consideration of a common treaty body \napproach to the engagement of the treaty bodies with national human rights \ninstitutions at all relevant stages of their work, \n \nWelcoming also the important role of national human rights institutions in close \nconsultation with and with the active involvement of all persons with disabilities, \nincluding through their representative organizations, in supporting compliance by \nStates Parties with the Convention of the Rights of Persons with Disabilities at the \nnational level, and in promoting, protecting and monitoring the human rights of all \npersons with disabilities and advancing the general principles of the Convention,  \n__________________ \n \n11  Resolution 79/1. \n \n12  United Nations, Treaty Series, vol. 1771, No. 30822. \n\nA/C.3/80/L.45\n \n5/9\n25-17783 \n \n \nWelcoming further the designation by States of national human rights \ninstitutions in compliance with the Paris Principles as national monitoring \nmechanisms for the Convention on the Rights of Persons with Disabilities, consistent \nwith articles 33 (2) and 16 (3) thereof, welcoming the full and effective participation \nof civil society, in particular all persons with disabilities and their representative \norganizations, in the monitoring process, and encouraging States to formally \ndesignate representative organizations as part of national monitoring mechanisms,  \n \nEmphasizing the importance of effective and full participation in political and \npublic life of persons with disabilities, as well as the role of all persons with \ndisabilities, through their representative organizations, in significantly supporting the \ndesign of laws, regulations, policies and programmes for promoting, protecting and \nmonitoring obligations under the Convention on the Rights of Persons with \nDisabilities, and noting in particular the importance of gender equality in the \nleadership across all levels of independent monitoring frameworks, national human \nrights institutions and organizations of children and young people with disabilities,  \n \nWelcoming the Marrakech Declaration, adopted at the thirteenth International \nConference of National Human Rights Institutions, and the Kyiv-Copenhagen \nDeclaration, adopted at the fourteenth International Conference of National Human \nRights Institutions, on the role of national human rights institutions in addressing and \npreventing torture and other cruel, inhuman or degrading treatment or punishment,  \n \n1. \nWelcomes the report of the Secretary-General,13 and welcomes the further \ninclusion of examples of good practices from national human rights institutions;  \n \n2. \nReaffirms the importance of the development of effective, independent and \npluralistic national institutions for the promotion and protection of human rights, in \naccordance with the principles relating to the status of national institutions for the \npromotion and protection of human rights (the Paris Principles);  \n \n3. \nRecognizes the role of national human rights institutions in advising and \nworking together with States to ensure full respect for human rights at the national \nlevel, including their liaison role between their Governments and civil society, all \npersons with disabilities and their representative organizations, Indigenous Peoples, \npersons belonging to minorities, minority groups and persons in vulnerable situations, \nincluding \nby \ncontributing \nto \nfollow-up \nactions, \nas \nappropriate, \nto \nthe \nrecommendations resulting from the international human rights mechanisms and \ncontributing to the prevention of human rights violations and abuses;  \n \n4. \nWelcomes the contribution that national human rights institutions \ncompliant with the Paris Principles have made to the promotion and protection of \nhuman rights, and the prevention of human rights violations and abuses, and \nencourages them to continue to do so, including by: \n \n(a) \nPromoting, protecting, monitoring and reporting on the rights of all \npersons with disabilities, including by supporting the implementation by States \nParties of the Convention of the Rights of Persons with Disabilities and engaging with \nrelevant United Nations bodies and mechanisms and processes, such as the \nConference of States Parties to the Convention on the Rights of Persons with \nDisabilities, the Committee on the Rights of Persons with Disabilities and the Special \nRapporteur on the rights of persons with disabilities;  \n \n(b) \nContributing to the protection and implementation of the human rights of \nall persons with disabilities, including those who require more intensive support, and \nto the fight against inequality and discrimination on the basis of disability, including \nmultiple and intersecting forms of discrimination, which means any distinction, \n__________________ \n \n13  A/80/286. \n\nA/C.3/80/L.45 \n \n25-17783\n6/9 \n \nexclusion or restriction on the basis of disability that has the purpose or effect of \nimpairing or nullifying the recognition, enjoyment or exercise, on an equal basis with \nothers, of all human rights and fundamental freedoms, and championing the voices of \nall persons with disabilities through close consultation and the active involvement of \nsuch persons through their representative organizations;  \n \n5. \nAcknowledges that, in the performance of their key functions, in \naccordance with their mandates and in compliance with the Paris Principles, national \nhuman rights institutions are supporting the establishment and maintenance of \ninclusive societies, and in doing so are contributing to achieving the 2030 Agenda for \nSustainable Development, including the promotion and protection of the human rights \nof all persons with disabilities;  \n \n6. \nWelcomes the increasingly important role of national institutions for the \npromotion and protection of human rights in supporting cooperation between their \nGovernments and the United Nations in the promotion and protection of human rights; \n \n7. \nUnderlines the role of national human rights institutions, established and \noperating in accordance with the Paris Principles, in the continued monitoring of \nexisting legislation and in consistently informing the State about the impact of such \nlegislation on the activities of human rights defenders, including by making relevant \nand concrete recommendations; \n \n8. \nRecognizes the role that national human rights institutions can play in \npreventing and addressing cases of reprisal or intimidation as part of supporting the \ncooperation between their Governments and the United Nations in the promotion of \nhuman rights, including by contributing to follow-up actions, as appropriate, to \nrecommendations made by international human rights mechanisms, and in that regard \ntakes note of the Marrakech Declaration adopted at the thirteenth International \nConference of National Human Rights Institutions and of the Kyiv-Copenhagen \nDeclaration adopted at the fourteenth International Conference of National Human \nRights Institutions;  \n \n9. \nAlso recognizes that, in accordance with the Vienna Declaration and \nProgramme of Action, it is the right of each State to choose the framework for national \ninstitutions that is best suited to its particular needs at the national level, with due \nconsideration of the Paris Principles, in order to promote human rights in accordance \nwith international human rights standards;  \n \n10. Calls upon all Member States to establish effective, independent, \npluralistic and adequately resourced national institutions or, where they already exist, \nto strengthen them, in compliance with the Paris Principles, for the promotion and \nprotection of all human rights and fundamental freedoms for all, as outlined in the \nVienna Declaration and Programme of Action, and welcomes the growing number of \nStates establishing national human rights institutions in line with the Paris Principles, \nincluding as one of the means for accelerating and guaranteeing progress for the \nimplementation of the 2030 Agenda for Sustainable Development, and to seek \ntechnical cooperation and assistance from the Office of the United Nations High \nCommissioner for Human Rights;  \n \n11. \nEncourages national institutions for the promotion and protection of \nhuman rights established by Member States to continue to play an active role in \npreventing and combating all violations of human rights as enumerated in the Vienna \nDeclaration and Programme of Action and relevant international human rights \ninstruments;  \n \n12. Stresses that national human rights institutions and their respective \nmembers and staff should not face any form of reprisal or intimidation, including \n\nA/C.3/80/L.45\n \n7/9\n25-17783 \n \npolitical pressure, physical intimidation, harassment or unjustifiable budgetary \nlimitations, as a result of activities undertaken in accordance with their respective \nmandates, including when taking up individual cases or when reporting on serious or \nsystematic violations in their countries, and calls upon States to promptly and \nthoroughly investigate cases of alleged reprisal or intimidation against members or \nstaff of national human rights institutions or against individuals who cooperate or \nseek to cooperate with them and to bring perpetrators to justice, and to ensure access \nto effective remedies and protection measures for victims;  \n \n13. Recognizes the role played by national institutions for the promotion and \nprotection of human rights in the Human Rights Council, including its universal \nperiodic review mechanism, in both preparation and follow-up, and the special \nprocedures, in accordance with Council resolutions 5/1 and 5/2 of 18 June 200714 and \nCommission on Human Rights resolution 2005/74 of 20 April 2005, 15 and in the \nhuman rights treaty bodies, as well as the strengthening of opportunities for such \nparticipation stipulated in the outcome of the review of the work and functioning of \nthe Council annexed to Council resolution 16/21 of 25 March 201116 and adopted in \nGeneral Assembly resolution 65/281 of 17 June 2011;  \n \n14. Encourages national human rights institutions to consider care and support \nsystems in their work; \n \n15. Welcomes the contribution of national human rights institutions compliant \nwith the Paris Principles to the work of the United Nations, including of the \nCommission on the Status of Women, the Conference of States Parties to the \nConvention on the Rights of Persons with Disabilities and the intergovernmental \nprocess of the General Assembly on strengthening and enhancing the effective \nfunctioning of the human rights treaty body system;  \n \n16. Encourages national human rights institutions compliant with the Paris \nPrinciples to continue to participate in and to contribute to deliberations in all relevant \nUnited Nations mechanisms and processes in accordance with their respective \nmandates, including the discussions on the implementation of the 2030 Agenda for \nSustainable Development;  \n \n17. Invites all relevant United Nations mechanisms, processes and bodies, in \naccordance with their respective mandates, including the Economic and Social \nCouncil and its subsidiary bodies, including the Commission on the Status of Women, \nand the Conference of States Parties to the Convention on the Rights of Persons with \nDisabilities and the 2030 Agenda for Sustainable Development, including the high-\nlevel political forum on sustainable development and related global and regional \nprocesses, to allow for the participation of national human rights institutions \ncompliant with the Paris Principles in their work, through appropriate modalities for \naccreditation and participation, with a view to ensuring the effective and continuing \ncontribution of national human rights institutions to these United Nations \nmechanisms, processes and bodies, bearing in mind the relevant provisions dealing \nwith their participation contained in General Assembly resolution 60/251 of 15 March \n2006, Human Rights Council resolutions 5/1, 5/2, 16/21 and 57/23 and Commission \non Human Rights resolution 2005/74;  \n__________________ \n \n14  See Official Records of the General Assembly, Sixty-second Session, Supplement No. 53 \n(A/62/53), chap. IV, sect. A. \n \n15  See Official Records of the Economic and Social Council, 2005, Supplement No. 3 and \ncorrigenda (E/2005/23, E/2005/23/Corr.1 and E/2005/23/Corr.2), chap. II, sect. A. \n \n16  See Official Records of the General Assembly, Sixty-sixth Session, Supplement No. 53 (A/66/53), \nchap. II, sect. A. \n\nA/C.3/80/L.45 \n \n25-17783\n8/9 \n \n \n18. Invites all other relevant United Nations forums and meetings, in \naccordance with their respective mandates, existing rules of procedure and modalities, \nto provide for the engagement of national human rights institutions compliant with \nthe Paris Principles and to allow for their contribution to these forums and meetings; \n \n19. Invites the human rights treaty bodies, within their respective mandates \nand in accordance with the treaties establishing these mechanisms, to provide for \nways to ensure the effective and enhanced participation by national human rights \ninstitutions compliant with the Paris Principles at all relevant stages of their work; \n \n20. Invites all United Nations human rights mechanisms and relevant United \nNations agencies, funds and programmes to work, within their respective mandates, \nwith Member States and national institutions in the promotion and protection of \nhuman rights with respect to, inter alia, projects in the area of good governance and \nthe rule of law, welcomes in this regard the efforts made by the United Nations High \nCommissioner for Human Rights to develop partnerships in support of national \ninstitutions, including the tripartite partnership between the Office of the High \nCommissioner, the United Nations Development Programme and the Global Alliance \nof National Human Rights Institutions, and in this respect invites all United Nations \nhuman rights mechanisms and relevant United Nations agencies, funds and \nprogrammes to enhance their interaction with national human rights institutions, \nincluding by facilitating their access to relevant information and documentation;  \n \n21. Stresses the importance of the financial and administrative independence \nand stability of national human rights institutions, notes with satisfaction the efforts \nof those States that have provided their national institutions with more autonomy and \nindependence, including by giving them an investigative role or enhancing such a \nrole, and encourages other Governments to consider taking similar steps;  \n \n22. Underlines the importance of the autonomy and independence of \nombudsman institutions, encourages increased cooperation between national human \nrights institutions and regional and international associations of ombudsmen, and \nencourages ombudsman institutions to actively draw on the standards enumerated in \ninternational instruments and the Paris Principles to strengthen their independence \nand increase their capacity to act as national human rights protection mechanisms;  \n \n23. Commends the high priority given by the Office of the High Commissioner \nto work on national human rights institutions, encourages the High Commissioner, in \nview of the expanded activities relating to national institutions, including the work of \nthe Subcommittee on Accreditation of the Global Alliance of National Human Rights \nInstitutions, which meets under the auspices of the Office of the High Commissioner, \nto ensure that appropriate arrangements are made and budgetary resources provided \nto continue and further extend activities in support of national institutions and their \nnetworks, and invites States to contribute additional voluntary funds to that end;  \n \n24. Welcomes the important role played by the Global Alliance of National \nHuman Rights Institutions, in close cooperation with the Office of the High \nCommissioner, in assisting, when requested, in the establishment of, and in \nstrengthening the compliance of, national human rights institutions with the Paris \nPrinciples, in assessing the conformity of national human rights institutions with the \nParis Principles and in providing technical assistance to strengthen national human \nrights institutions, upon request, with a view to enhancing the compliance of national \nhuman rights institutions with the Paris Principles, and calls upon Member States and \nother stakeholders, including United Nations agencies, to follow up on the \nrecommendations of the Subcommittee on Accreditation of the Global Alliance of \nNational Human Rights Institutions, with a view to enabling national human rights \ninstitutions to fully comply with the Paris Principles in both law and practice;  \n\nA/C.3/80/L.45\n \n9/9\n25-17783 \n \n \n25. Encourages national institutions, including ombudsman and mediator \ninstitutions, to seek accreditation status through the Global Alliance of National \nHuman Rights Institutions;  \n \n26. Encourages all Member States to take appropriate steps to promote the \nexchange of information and experience concerning the establishment and effective \noperation of national human rights institutions and to support the work of the Global \nAlliance of National Human Rights Institutions and its regional coordinating \nnetworks in this regard, including through support for the relevant technical \nassistance programmes of the Office of the High Commissioner; \n \n27. Encourages all States Parties to the Convention on the Rights of Persons \nwith Disabilities to consider designating or including national human rights \ninstitutions as part of one or more independent monitoring mechanisms, as \nappropriate, to promote, protect and monitor the implementation of the Convention, \ntaking into account the Paris Principles, consistent with articles 33 (2) and 16 (3) of \nthe Convention; \n \n28. Requests the Secretary-General to strengthen support to national human \nrights institutions compliant with the Paris Principles, as they engage with relevant \nUnited Nations mechanisms and processes, with full respect for their respective \nmandates, and with a view to enabling their most effective contributions, in order to \nfurther the implementation of international human rights obligations and \ncommitments;  \n \n29. Urges the Secretary-General to continue to give high priority to requests \nfrom Member States for assistance in the establishment and strengthening of national \nhuman rights institutions in compliance with the Paris Principles, including as one of \nthe means of accelerating and guaranteeing progress in the implementation of the \n2030 Agenda for Sustainable Development, and encourages the Secretary-General to \nstrengthen cooperation between the United Nations and the Global Alliance of \nNational Human Rights Institutions in this regard; \n \n30. Calls upon the Secretary-General to continue to encourage national human \nrights institutions to interact with and advocate independent participation in all \nrelevant United Nations mechanisms and processes, in accordance with their \nrespective mandates, existing rules of procedure and modalities; \n \n31. Requests the Secretary-General to continue to provide the assistance \nnecessary for holding international and regional meetings of national institutions, \nincluding meetings of the Global Alliance of National Human Rights Institutions, in \ncooperation with the Office of the High Commissioner;  \n \n32. Also requests the Secretary-General, in consultation with Member States \nand national human rights institutions, to submit a report to the General Assembly at \nits eighty-second session on the implementation of the present resolution, including \non best practices among national human rights institutions, prepared in consultation \nwith States, national human rights institutions and other relevant stakeholders, and \npublished in accessible formats. \n \n",
  "paragraphs": {
    "1": "Welcomes the report of the Secretary-General,13 and welcomes the further inclusion of examples of good practices from national human rights institutions;",
    "2": "Reaffirms the importance of the development of effective, independent and pluralistic national institutions for the promotion and protection of human rights, in accordance with the principles relating to the status of national institutions for the promotion and protection of human rights (the Paris Principles);",
    "3": "Recognizes the role of national human rights institutions in advising and working together with States to ensure full respect for human rights at the national level, including their liaison role between their Governments and civil society, all persons with disabilities and their representative organizations, Indigenous Peoples, persons belonging to minorities, minority groups and persons in vulnerable situations, including by contributing to follow-up actions, as appropriate, to the recommendations resulting from the international human rights mechanisms and contributing to the prevention of human rights violations and abuses;",
    "4": "Welcomes the contribution that national human rights institutions compliant with the Paris Principles have made to the promotion and protection of human rights, and the prevention of human rights violations and abuses, and encourages them to continue to do so, including by: (a) Promoting, protecting, monitoring and reporting on the rights of all persons with disabilities, including by supporting the implementation by States Parties of the Convention of the Rights of Persons with Disabilities and engaging with relevant United Nations bodies and mechanisms and processes, such as the Conference of States Parties to the Convention on the Rights of Persons with Disabilities, the Committee on the Rights of Persons with Disabilities and the Special Rapporteur on the rights of persons with disabilities; (b) Contributing to the protection and implementation of the human rights of all persons with disabilities, including those who require more intensive support, and to the fight against inequality and discrimination on the basis of disability, including multiple and intersecting forms of discrimination, which means any distinction, exclusion or restriction on the basis of disability that has the purpose or effect of impairing or nullifying the recognition, enjoyment or exercise, on an equal basis with others, of all human rights and fundamental freedoms, and championing the voices of all persons with disabilities through close consultation and the active involvement of such persons through their representative organizations;",
    "5": "Acknowledges that, in the performance of their key functions, in accordance with their mandates and in compliance with the Paris Principles, national human rights institutions are supporting the establishment and maintenance of inclusive societies, and in doing so are contributing to achieving the 2030 Agenda for Sustainable Development, including the promotion and protection of the human rights of all persons with disabilities;",
    "6": "Welcomes the increasingly important role of national institutions for the promotion and protection of human rights in supporting cooperation between their Governments and the United Nations in the promotion and protection of human rights;",
    "7": "Underlines the role of national human rights institutions, established and operating in accordance with the Paris Principles, in the continued monitoring of existing legislation and in consistently informing the State about the impact of such legislation on the activities of human rights defenders, including by making relevant and concrete recommendations;",
    "8": "Recognizes the role that national human rights institutions can play in preventing and addressing cases of reprisal or intimidation as part of supporting the cooperation between their Governments and the United Nations in the promotion of human rights, including by contributing to follow-up actions, as appropriate, to recommendations made by international human rights mechanisms, and in that regard takes note of the Marrakech Declaration adopted at the thirteenth International Conference of National Human Rights Institutions and of the Kyiv-Copenhagen Declaration adopted at the fourteenth International Conference of National Human Rights Institutions;",
    "9": "Also recognizes that, in accordance with the Vienna Declaration and Programme of Action, it is the right of each State to choose the framework for national institutions that is best suited to its particular needs at the national level, with due consideration of the Paris Principles, in order to promote human rights in accordance with international human rights standards;",
    "10": "Calls upon all Member States to establish effective, independent, pluralistic and adequately resourced national institutions or, where they already exist, to strengthen them, in compliance with the Paris Principles, for the promotion and protection of all human rights and fundamental freedoms for all, as outlined in the Vienna Declaration and Programme of Action, and welcomes the growing number of States establishing national human rights institutions in line with the Paris Principles, including as one of the means for accelerating and guaranteeing progress for the implementation of the 2030 Agenda for Sustainable Development, and to seek technical cooperation and assistance from the Office of the United Nations High Commissioner for Human Rights;",
    "11": "Encourages national institutions for the promotion and protection of human rights established by Member States to continue to play an active role in preventing and combating all violations of human rights as enumerated in the Vienna Declaration and Programme of Action and relevant international human rights instruments;",
    "12": " political pressure, physical intimidation, harassment or unjustifiable budgetary limitations, as a result of activities undertaken in accordance with their respective mandates, including when taking up individual cases or when reporting on serious or systematic violations in their countries, and calls upon States to promptly and thoroughly investigate cases of alleged reprisal or intimidation against members or staff of national human rights institutions or against individuals who cooperate or seek to cooperate with them and to bring perpetrators to justice, and to ensure access to effective remedies and protection measures for victims;",
    "13": "Recognizes the role played by national institutions for the promotion and protection of human rights in the Human Rights Council, including its universal periodic review mechanism, in both preparation and follow-up, and the special procedures, in accordance with Council resolutions 5/1 and 5/2 of 18 June 200714 and Commission on Human Rights resolution 2005/74 of 20 April 2005, 15 and in the human rights treaty bodies, as well as the strengthening of opportunities for such participation stipulated in the outcome of the review of the work and functioning of the Council annexed to Council resolution 16/21 of 25 March 201116 and adopted in General Assembly resolution 65/281 of 17 June 2011;",
    "14": "Encourages national human rights institutions to consider care and support systems in their work;",
    "15": "Welcomes the contribution of national human rights institutions compliant with the Paris Principles to the work of the United Nations, including of the Commission on the Status of Women, the Conference of States Parties to the Convention on the Rights of Persons with Disabilities and the intergovernmental process of the General Assembly on strengthening and enhancing the effective functioning of the human rights treaty body system;",
    "16": "Encourages national human rights institutions compliant with the Paris Principles to continue to participate in and to contribute to deliberations in all relevant United Nations mechanisms and processes in accordance with their respective mandates, including the discussions on the implementation of the 2030 Agenda for Sustainable Development;",
    "17": "Invites all relevant United Nations mechanisms, processes and bodies, in accordance with their respective mandates, including the Economic and Social Council and its subsidiary bodies, including the Commission on the Status of Women, and the Conference of States Parties to the Convention on the Rights of Persons with Disabilities and the 2030 Agenda for Sustainable Development, including the high- level political forum on sustainable development and related global and regional processes, to allow for the participation of national human rights institutions compliant with the Paris Principles in their work, through appropriate modalities for accreditation and participation, with a view to ensuring the effective and continuing contribution of national human rights institutions to these United Nations mechanisms, processes and bodies, bearing in mind the relevant provisions dealing with their participation contained in General Assembly resolution 60/251 of 15 March 2006, Human Rights Council resolutions 5/1, 5/2, 16/21 and 57/23 and Commission on Human Rights resolution 2005/74;",
    "18": "Invites all other relevant United Nations forums and meetings, in accordance with their respective mandates, existing rules of procedure and modalities, to provide for the engagement of national human rights institutions compliant with the Paris Principles and to allow for their contribution to these forums and meetings;",
    "19": "Invites the human rights treaty bodies, within their respective mandates and in accordance with the treaties establishing these mechanisms, to provide for ways to ensure the effective and enhanced participation by national human rights institutions compliant with the Paris Principles at all relevant stages of their work;",
    "20": "Invites all United Nations human rights mechanisms and relevant United Nations agencies, funds and programmes to work, within their respective mandates, with Member States and national institutions in the promotion and protection of human rights with respect to, inter alia, projects in the area of good governance and the rule of law, welcomes in this regard the efforts made by the United Nations High Commissioner for Human Rights to develop partnerships in support of national institutions, including the tripartite partnership between the Office of the High Commissioner, the United Nations Development Programme and the Global Alliance of National Human Rights Institutions, and in this respect invites all United Nations human rights mechanisms and relevant United Nations agencies, funds and programmes to enhance their interaction with national human rights institutions, including by facilitating their access to relevant information and documentation;",
    "21": "Stresses the importance of the financial and administrative independence and stability of national human rights institutions, notes with satisfaction the efforts of those States that have provided their national institutions with more autonomy and independence, including by giving them an investigative role or enhancing such a role, and encourages other Governments to consider taking similar steps;",
    "22": "Underlines the importance of the autonomy and independence of ombudsman institutions, encourages increased cooperation between national human rights institutions and regional and international associations of ombudsmen, and encourages ombudsman institutions to actively draw on the standards enumerated in international instruments and the Paris Principles to strengthen their independence and increase their capacity to act as national human rights protection mechanisms;",
    "23": "Commends the high priority given by the Office of the High Commissioner to work on national human rights institutions, encourages the High Commissioner, in view of the expanded activities relating to national institutions, including the work of the Subcommittee on Accreditation of the Global Alliance of National Human Rights Institutions, which meets under the auspices of the Office of the High Commissioner, to ensure that appropriate arrangements are made and budgetary resources provided to continue and further extend activities in support of national institutions and their networks, and invites States to contribute additional voluntary funds to that end;",
    "24": "",
    "25": "Encourages national institutions, including ombudsman and mediator institutions, to seek accreditation status through the Global Alliance of National Human Rights Institutions;",
    "26": "Encourages all Member States to take appropriate steps to promote the exchange of information and experience concerning the establishment and effective operation of national human rights institutions and to support the work of the Global Alliance of National Human Rights Institutions and its regional coordinating networks in this regard, including through support for the relevant technical assistance programmes of the Office of the High Commissioner;",
    "27": "Encourages all States Parties to the Convention on the Rights of Persons with Disabilities to consider designating or including national human rights institutions as part of one or more independent monitoring mechanisms, as appropriate, to promote, protect and monitor the implementation of the Convention, taking into account the Paris Principles, consistent with articles 33 (2) and 16 (3) of the Convention;",
    "28": "Requests the Secretary-General to strengthen support to national human rights institutions compliant with the Paris Principles, as they engage with relevant United Nations mechanisms and processes, with full respect for their respective mandates, and with a view to enabling their most effective contributions, in order to further the implementation of international human rights obligations and commitments;",
    "29": "Urges the Secretary-General to continue to give high priority to requests from Member States for assistance in the establishment and strengthening of national human rights institutions in compliance with the Paris Principles, including as one of the means of accelerating and guaranteeing progress in the implementation of the 2030 Agenda for Sustainable Development, and encourages the Secretary-General to strengthen cooperation between the United Nations and the Global Alliance of National Human Rights Institutions in this regard;",
    "30": "Calls upon the Secretary-General to continue to encourage national human rights institutions to interact with and advocate independent participation in all relevant United Nations mechanisms and processes, in accordance with their respective mandates, existing rules of procedure and modalities;",
    "31": "Requests the Secretary-General to continue to provide the assistance necessary for holding international and regional meetings of national institutions, including meetings of the Global Alliance of National Human Rights Institutions, in cooperation with the Office of the High Commissioner;",
    "32": "Also requests the Secretary-General, in consultation with Member States and national human rights institutions, to submit a report to the General Assembly at its eighty-second session on the implementation of the present resolution, including on best practices among national human rights institutions, prepared in consultation with States, national human rights institutions and other relevant stakeholders, and published in accessible formats."
  },
  "agenda_items": [
    "Item 71"
  ],
  "symbol_references": [
    "A/C.3/80/L.45"
  ]
}