{
  "symbol": "A/C.2/80/L.4",
  "filename": "A_C.2_80_L.4.pdf",
  "title": "South-South cooperation",
  "text": "United Nations \nA/C.2/80/L.4 \n \n \nGeneral Assembly \nDistr.: Limited \n10 October 2025 \nOriginal: English \n \n25-16436 (E)    161025 \n*2516436* \n \n \nEightieth session \nSecond Committee \nAgenda item 23 (b) \nOperational activities for development: South-South \ncooperation for development \n \n \n \n \n \nIraq:* draft resolution \n \n \n \n South-South cooperation \n \n \n \nThe General Assembly, \n \nReaffirming its resolution 73/291 of 15 April 2019, in which it endorsed the \nBuenos Aires outcome document of the second High-level United Nations Conference \non South-South Cooperation,  \n \nReaffirming also its resolution 64/222 of 21 December 2009, in which it \nendorsed the Nairobi outcome document of the High-level United Nations Conference \non South-South Cooperation,  \n \nReaffirming further its resolution 33/134 of 19 December 1978, in which it \nendorsed the Buenos Aires Plan of Action for Promoting and Implementing Technical \nCooperation among Developing Countries,1 \n \nRecalling its resolutions 57/270 B of 23 June 2003, 60/212 of 22 December \n2005, 62/209 of 19 December 2007, 63/233 of 19 December 2008, 64/1 of 6 October \n2009, 66/219 of 22 December 2011, 67/227 of 21 December 2012, 68/230 of \n20 December 2013, 69/239 of 19 December 2014, 70/222 of 22 December 2015, \n71/244 of 21 December 2016, 72/237 of 20 December 2017, 73/249 of 20 December \n2018, 74/239 of 19 December 2019, 75/234 of 21 December 2020, 76/221 of \n17 December 2021, 77/185 of 14 December 2022, 78/167 of 19 December 2023 and \n79/236 of 24 December 2024, \n \nReaffirming its resolution 70/1 of 25 September 2015, entitled \u201cTransforming \nour world: the 2030 Agenda for Sustainable Development\u201d, in which it adopted a \ncomprehensive, far-reaching and people-centred set of universal and transformative \nSustainable Development Goals and targets, its commitment to working tirelessly for \n__________________ \n \n* On behalf of the States that are members of the Group of 77 and China, taking into account also \nthe provisions of General Assembly resolution ES-10/23 of 10 May 2024. \n \n1  Report of the United Nations Conference on Technical Cooperation among Developing \nCountries, Buenos Aires, 30 August\u201312 September 1978 (United Nations publication, Sales \nNo. E.78.II.A.11 and corrigendum), chap. I. \n\nA/C.2/80/L.4 \n \n25-16436\n2/9 \n \nthe full implementation of the Agenda by 2030, its recognition that eradicating \npoverty in all its forms and dimensions, including extreme poverty, is the greatest \nglobal challenge and an indispensable requirement for sustainable development, its \ncommitment to achieving sustainable development in its three dimensions \u2013 \neconomic, social and environmental \u2013 in a balanced and integrated manner, and to \nbuilding upon the achievements of the Millennium Development Goals and seeking \nto address their unfinished business,  \n \nReaffirming also its resolution 69/313 of 27 July 2015 on the Addis Ababa \nAction Agenda of the Third International Conference on Financing for Development, \nwhich is an integral part of the 2030 Agenda for Sustainable Development, supports \nand complements it, helps to contextualize its means of implementation targets with \nconcrete policies and actions and reaffirms the strong political commitment to address \nthe challenge of financing and creating an enabling environment at all levels for \nsustainable development in the spirit of global partnership and solidarity,  \n \nReaffirming further the Paris Agreement 2  and its early entry into force, \nencouraging all its Parties to fully implement the Agreement, and Parties to the United \nNations Framework Convention on Climate Change3 that have not yet done so to \ndeposit their instruments of ratification, acceptance, approval or accession, where \nappropriate, as soon as possible,  \n \nWelcoming the convening of the Summit of the Future on 22 to 23 September \n2024 at the United Nations Headquarters in New York, at which resolution 79/1 \nentitled the \u201cPact for the Future\u201d and its annexes were adopted, \n \nWelcoming also the convening of the sixteenth session of the United Nations \nConference on Trade and Development, in Geneva, from 20 to 23 October 2025, and \nlooking forward to the continued work of the Conference on issues related to South-\nSouth cooperation, triangular cooperation and regional cooperation, including by \npromoting dialogue between economic integration structures with a view to \nenhancing mutual trade and exchanging best practices and experiences, towards the \nachievement of the Sustainable Development Goals, \n \nWelcoming further the convening of the Fourth International Conference on \nFinancing for Development from 30 June to 3 July 2025 in Sevilla, Spain, and \nreaffirming its outcome document, the Sevilla Commitment, endorsed by the General \nAssembly in its resolution 79/323 of 25 August 2025, which sets forth a renewed \nglobal framework for financing for development, building on the 2015 Addis Ababa \nAction Agenda, to close with urgency the estimated annual 4 trillion dollar financing \ngap, catalyse sustainable investments at scale in developing countries and reform the \ninternational financial architecture through continued and strong commitment to \nmultilateralism, international cooperation, and global solidarity,  \n \nReaffirming that South-South cooperation is an important element of \ninternational cooperation for development, and is not a substitute for, but rather a \ncomplement to, North-South cooperation, and recalling the commitment to enhance \nthe impact and effectiveness of South-South cooperation, guided by the principles of \nrespect for national sovereignty, national ownership and independence, equality, \nnon-conditionality, non-interference in domestic affairs and mutual benefit,  \n \nEncouraging the continuation and advancement of South-South and triangular \ncooperation on efforts for recovery from the socioeconomic effects of the coronavirus \ndisease (COVID-19) pandemic and other multiple crises in the pursuit of the 2030 \n__________________ \n \n2  Adopted under the United Nations Framework Convention on Climate Change in \nFCCC/CP/2015/10/Add.1, decision 1/CP.21, annex. \n \n3  United Nations, Treaty Series, vol. 1771, No. 30822. \n\nA/C.2/80/L.4\n \n3/9\n25-16436 \n \nAgenda and its Sustainable Development Goals, and calling for continued support \nfrom the relevant United Nations development system entities in that regard, \nparticularly in the areas of poverty eradication and food security, as well as reducing \ninequalities, and promoting resilience, including through the establishment of vaccine \nproduction facilities in developing countries and strengthening of health systems and \neconomic diversification in developing countries,  \n \nRecognizing the special challenges facing all developing countries in pursuing \nsustainable development, in particular African countries, the least developed \ncountries, landlocked developing countries and small island developing States, as \nwell as the specific challenges facing middle-income countries and countries in \nconflict and post-conflict situations,  \n \nRecognizing also that climate change, the continuing impact of the COVID-19 \npandemic, ongoing geopolitical tensions and conflicts and a turbulent global \neconomic outlook are creating additional challenges relating to the eradication of \npoverty, food security, energy security and the cost of living, and that developing \ncountries are disproportionately affected by these challenges, \n \nUnderlining the importance of South-South and triangular cooperation for the \nleast developed countries, in particular with regard to technical assistance, and the \nsharing of best practices in terms of their sustainable development, especially in areas \nof productive capacity-building, infrastructure, energy, science and technology, trade, \ninvestment and transit transport cooperation, \n \nStressing the important role of South-South and triangular cooperation in \naddressing the development needs of middle-income countries, including through \ncapacity-building and fostering peer-learning and sharing of best practices among \nmiddle-income countries across the regions, \n \nLooking forward to the elaboration of a system-wide response plan aimed at \nbetter addressing the multidimensional nature of sustainable development and \nfacilitating sustainable development cooperation and coordinated and inclusive \nsupport to middle-income countries based on their specific challenges and diverse \nneeds,  \n \nReaffirming the importance of a renewed framework for international support to \naddress the special needs of landlocked developing countries and to strengthen \npartnerships between the landlocked developing countries and transit countries and \ntheir development partners to ensure the implementation of the Awaza Programme of \nAction for Landlocked Developing Countries for the Decade 2024\u20132034,4  \n \nWelcoming the ongoing efforts to enhance South-South and triangular \ncooperation in the area of trade under the Global System of Trade Preferences among \nDeveloping Countries as a vehicle to support economic resilience and promote \nsustainable development, and looking forward to the continued work of the United \nNations Conference on Trade and Development to support developing countries in \ndeepening and enlarging South-South trade integration, regional, subregional and \ninterregional economic integration and cooperation arrangements,  \n \nWelcoming also the development of an initial voluntary conceptual framework \nfor the measurement of South-South cooperation, which marks a breakthrough in its \nmeasurement on the basis of country-led mechanisms and helps shed light on the \nimportance of South-South cooperation towards achieving the 2030 Agenda, by \nadding for the first time country-owned data on South-South cooperation in assessing \nthe contributions of such cooperation to sustainable development,  \n__________________ \n \n4  Resolution 79/233, annex; see also resolution 79/279. \n\nA/C.2/80/L.4 \n \n25-16436\n4/9 \n \n \nWelcoming further the Manual for the Framework to Measure South-South \nCooperation: Technical and Procedural Aspects for Pilot Testing, launched by the \nUnited Nations Conference on Trade and Development in collaboration with United \nNations regional commissions and the United Nations Office for South-South \nCooperation, to strengthen the capacity of developing countries to quantify South-\nSouth cooperation through the collection and reporting of South-South data,  \n \nRecalling that triangular cooperation complements and adds value to South-South \ncooperation by enabling requesting developing countries to source and access more, and \na broader range of, resources, expertise and capacities, that they identify as needed in \norder to achieve their national development goals and internationally agreed sustainable \ndevelopment goals,  \n \nTaking note of the strategic plan for the period 2024\u20132028 of the International \nOrganization for Migration, which offers a vision of how to save lives and protect \npeople on the move and emphasizes the role of the International Organization for \nMigration as a facilitator of South-South and triangular cooperation, regional \nintegration and interregional collaboration on migration, \n \nTaking note also of the initiatives of the United Nations regional commissions \nin leveraging triangular cooperation for digital transformation, which provides \nsupport in fully harnessing the potential of digitalization, \n \nTaking note further of the establishment by the United Nations Office for South-\nSouth Cooperation of a triangular cooperation window under the United Nations Fund \nfor South-South Cooperation, launched on 7 October 2024 in Lisbon,  \n \nReaffirming the mandate and the central role of the United Nations Office for \nSouth-South Cooperation as the focal point for promoting and facilitating South-\nSouth and triangular cooperation for development on a global and United Nations \nsystem-wide basis, and noting with appreciation the actions taken by the Office in \nstrengthening the United Nations system-wide coordination on South-South and \ntriangular cooperation, which has served as a channel to facilitate the mainstreaming \nof South-South and triangular cooperation into the corporate strategies and \noperational activities of United Nations entities,  \n \nNoting the development of a handbook by the United Nations Office for South-\nSouth Cooperation on integrating South-South and triangular cooperation in the \nvoluntary national reviews in collaboration with the Co-Chairs of the Group of \nFriends of the Voluntary National Reviews, Morocco and the Philippines,  \n \nStressing that financing for South-South cooperation initiatives require \nconcerted and coordinated efforts from Member States, United Nations entities, \ninternational financial institutions, regional and subregional development banks and \nthe private sector, \n \nReiterating the pledge that no one will be left behind, reaffirming the \nrecognition that the dignity of the human person is fundamental, and the wish to see \nthe Goals and targets met for all nations and peoples and for all segments of society, \nand recommitting to endeavour to reach the furthest behind first,  \n \n1. \nRecalls the convening of the second High-level United Nations \nConference on South-South Cooperation in Buenos Aires from 20 to 22 March 2019 \nand its outcome document,5 and calls upon the international community to support \nthe full implementation of the outcome document of the second High-level \nConference;  \n__________________ \n \n5  Resolution 73/291, annex. \n\nA/C.2/80/L.4\n \n5/9\n25-16436 \n \n \n2. \nTakes note of the report of the Secretary-General on the state of South-\nSouth cooperation;6  \n \n3. \nReaffirms its support for the High-level Committee on South-South \nCooperation, recalls its decisions 22/1 and 22/2 adopted during its twenty-second \nsession, held from 27 to 30 May 2025, and looks forward to the convening of the \ntwenty-third session of the Committee, to be held in 2027;  \n \n4. \nTakes note of the recommendation contained in the report of the \nAdministrator of the United Nations Development Programme on a midterm review \nof the outcome document of the second High-level Conference; \n \n5. \nRecognizes the contribution of and the need to scale up and strengthen \nSouth-South and triangular cooperation as a complementary means of implementation \nof the 2030 Agenda and its Sustainable Development Goals, including in achieving \nthe overarching goal of the eradication of poverty in all its forms and dimensions, \nincluding extreme poverty, and the goals of, inter alia, ending hunger, reducing \ninequalities, within and among countries, as well as for the use, capacity-building and \ntransfer of digital technologies, on mutually agreed terms, to accelerate the attainment \nof the Sustainable Development Goals and close the digital divides;  \n \n6. \nEncourages \nthe \ncontinuation \nand \nadvancement \nof \nSouth-South \ncooperation and triangular cooperation on efforts for COVID-19 response and \nrecovery from the socioeconomic effects of the pandemic and other multiple crises in \nthe pursuit of the 2030 Agenda for Sustainable Development7 and its Sustainable \nDevelopment Goals, and calls for continued support from the relevant United Nations \ndevelopment system entities in that regard, particularly in areas such as equitable and \nnon-discriminatory access to safe, quality, effective and affordable healthcare and \nservices and medical supplies and equipment, including diagnostics, therapeutics, \nmedicine and other health products, vaccines, as well as digitalization, the \nenvironment, climate change, social protection and the eradication of poverty, noting \nthat the world needs a stronger, better coordinated, inclusive and more agile global \nhealth architecture, based on solidarity and international and medical cooperation for \npandemic prevention, preparedness, response and recovery to stop the severe impact \nof future outbreaks; \n \n7. \nWelcomes the support of development partners for triangular cooperation \ntowards the achievement of the Sustainable Development Goals in the global South, \nand urges developed countries and multilateral partners to continue providing \nfinancial, scientific and technological assistance and capacity-building to developing \ncountries, to close the digital divides and to better harness science, technology and \ninnovation to accelerate the achievement of the Sustainable Development Goals by \n2030;  \n \n8. \nUrges Member States and United Nations entities to strengthen South-\nSouth and triangular cooperation on access to science, technology and innovation by \ncreating synergies, developing expertise and boosting resources in different regions \nand institutions, and in this regard notes with appreciation the convening of the \nSummit on Science, Technology and Innovation by the Group of 77 and China, in \nHavana on 15 and 16 September 2023, as an effort to boost cooperation in this field \nto increase its benefit to all people;  \n \n9. \nEncourages Member States, with the support of the United Nations \ndevelopment system, to facilitate the development of and access to appropriate \ntechnologies, facilitate technology transfer as a means to promote digital transitions \n__________________ \n \n6  A/80/256. \n \n7  Resolution 70/1. \n\nA/C.2/80/L.4 \n \n25-16436\n6/9 \n \nand foster the exchange of innovative practices through South-South and triangular \ncooperation, with the aim of safeguarding the interests of present and future \ngenerations, and to integrate science, digital technologies, including emerging ones, \nand data governance into national and international development strategies;  \n \n10. Encourages Member States and all relevant stakeholders, as appropriate, \nto establish or strengthen coordinated mechanisms at the subnational, national, \nregional and global levels to leverage the expertise and other resources of \nmulti-stakeholder partnerships to support South-South cooperation and triangular \ncooperation initiatives towards the attainment of the 2030 Agenda, while \nacknowledging that governments have the principal role of coordinating and leading \ndevelopment efforts;  \n \n11. Takes note of the various experiences and locally driven development \napproaches to achieve the Sustainable Development Goals, and reiterates the \nimportance of learning and sharing good practices, including through South-South, \nNorth-South and triangular cooperation through platforms such as South-South \nGalaxy, the Global South-South Development Expo, regional sustainable \ndevelopment forums and other knowledge-sharing platforms supported by the \ndifferent entities of the United Nations system;  \n \n12. Notes with appreciation the convening of the Third South Summit, held in \nKampala on 21 and 22 January 2024; \n \n13. Recalls the convening of the ministerial meeting on South-South \ncooperation held in 2023 during the second part of the Fifth United Nations \nConference on the Least Developed Countries, in Doha, on leveraging South-South \nand triangular cooperation for the attainment of the Sustainable Development Goals; \n \n14. Also recalls the adoption of the Antigua and Barbuda Agenda for Small \nIsland Developing States: A Renewed Declaration for Resilient Prosperity 8 at the \nFourth International Conference on Small Island Developing States, held in Antigua \nand Barbuda from 27 to 30 May 2024, which commits to supporting small island \ndeveloping States (SIDS), including by leveraging triangular and South-South \ncooperation, including SIDS-to-SIDS, to mobilize resources, as a complement to \nNorth-South cooperation, towards the realization of the Antigua and Barbuda Agenda \nfor Small Island Developing States by 2034;  \n \n15. Welcomes the convening of the Third United Nations Conference on \nLandlocked Developing Countries, held in Awaza, Turkmenistan, from 5 to 8 August \n2025, which served as an opportunity for the international community to scale up its \nsupport to landlocked developing countries in their efforts to leverage South-South \nand triangular cooperation, to achieve sustainable development and to realize the full \nimplementation of the Awaza Programme of Action for Landlocked Developing \nCountries for the Decade 2024\u20132034, as well as the convening of the ministerial \nmeeting on South-South cooperation on the margins of the third United Nations \nConference on Landlocked Developing Countries; \n \n16. Recalls the organization of the eleventh Global South-South Development \nExpo in Bangkok from 12 to 14 September 2022, encourages Member States to host \nfuture Global South-South Development Expos, which can serve as important \nknowledge-sharing platforms, and requests the United Nations Office for South-South \nCooperation to actively engage with Member States, including by their expressions \nof interest to host future Expos, and to include the progress in its report to the General \nAssembly at its eighty-first session; \n__________________ \n \n8  Resolution 78/317, annex. \n\nA/C.2/80/L.4\n \n7/9\n25-16436 \n \n \n17. Recognizes the need for coherent and tailored support to address the \nspecific development needs of middle-income countries, and notes the initiatives of \nthe Like-Minded Group for Middle-Income Countries in promoting the role of South-\nSouth and triangular cooperation, including building momentum towards the goal of \ndeveloping a strategic plan of action for middle-income countries; \n \n18. Recalls the special needs of Africa and recognizes that, while economic \ngrowth has improved, there is a need to sustain the recovery to face the ongoing \nadverse impacts of multiple crises on development and the serious challenges that \nthese impacts pose to the fight against poverty and hunger, which could further \nundermine the achievement of the internationally agreed development goals in Africa, \nincluding Agenda 2063: The Africa We Want and the Sustainable Development Goals \nand the unfinished business of the Millennium Development Goals, and welcomes the \nongoing efforts to fully operationalize the African Continental Free Trade Area and \nthe commencement of actual trading under the Agreement with a view to achieving \nthe Sustainable Development Goals; \n \n19. Recognizes the growing debt burden of developing countries, and also \nrecognizes the role of the United Nations, within its mandates, to facilitate South-\nSouth exchanges of knowledge on debt to help countries of the global South, and in \nthis regard acknowledges the efforts to establish the platform for borrower countries, \nwith support from existing institutions, and a United Nations entity serving as its \nsecretariat; \n \n20. Also recognizes the need to enhance the provision and mobilization of \nadequate resources for enhancing South-South and triangular cooperation, and in this \ncontext invites all countries in a position to do so, in particular developed countries, \nto scale up the contributions, in support of such cooperation, to the United Nations \nFund for South-South Cooperation and to the P\u00e9rez-Guerrero Trust Fund for \nSouth-South Cooperation, in accordance with General Assembly resolution 57/263 of \n20 December 2002, and to support other initiatives for all developing countries;  \n \n21. Acknowledges the effectiveness of the P\u00e9rez-Guerrero Trust Fund in \nproviding catalytic support to South-South cooperation, underscoring the enduring \npartnership between the Group of 77 and the United Nations Office for South-South \nCooperation;  \n \n22. Welcomes innovations that enhance and expand South-South and \ntriangular cooperation, and in this regard recognizes the importance of reinforcing \npartnership-building, including engaging with partners in national and local \ngovernments, civil society, academia and the private sector, and of resource \nmobilization, including contributions to the United Nations Fund for South-South \nCooperation, third-party cost-sharing, parallel financing, in-kind contributions and \nspecial fund management arrangements such as those of the India-United Nations \nDevelopment Partnership Fund, and the India, Brazil and South Africa Facility for \nPoverty and Hunger Alleviation; \n \n23. Encourages United Nations entities to support developing countries in \nintegrating development cooperation perspectives, including, in particular, South-\nSouth and triangular cooperation perspectives, into the preparation and presentation \nof the voluntary national review reports on sustainable development;  \n \n24. Notes that, within the context of the United Nations development system, \nthe United Nations system-wide strategy on South-South and triangular cooperation \nhas the potential to enhance the role and impact of South-South and triangular \ncooperation through galvanizing the expertise of United Nations organizations to \nsupport South-South and triangular cooperation, and in this regard calls upon the \nUnited Nations development system to continue mainstreaming South-South and \n\nA/C.2/80/L.4 \n \n25-16436\n8/9 \n \ntriangular cooperation into the United Nations Sustainable Development Cooperation \nFrameworks, at the country level, as appropriate, as a means to accelerate the \nimplementation of the 2030 Agenda and its Sustainable Development Goals, and also \ncalls upon the United Nations Office for South-South Cooperation to work in \ncollaboration with the United Nations system organizations and the regional \ncommissions to mainstream South-South and triangular cooperation, including \nthrough regional collaborative frameworks for South-South and triangular \ncooperation; \n \n25. Notes with appreciation the countries that have increased cooperation with \nthe United Nations Office for South-South Cooperation, and calls upon the Office to \nfurther strengthen its support to South-South cooperation projects;  \n \n26. Calls upon the United Nations development system entities to further \nintegrate, as appropriate, South-South and triangular cooperation into their strategic \nframeworks and planning instruments, and urges them to allocate sufficient financial \nand non-financial resources dedicated to supporting and facilitating South-South and \ntriangular cooperation, and encourages the United Nations resident coordinators to \ncontinue to advance the integration of South-South and triangular cooperation into \nthe work of United Nations country teams to achieve greater system-wide results and \nimpacts for the implementation of the 2030 Agenda and the Sustainable Development \nGoals; \n \n27.  Calls upon the United Nations Office for South-South Cooperation to \ndeepen efforts in mainstreaming South-South and triangular cooperation at the \ncountry level, including by providing demand-driven advisory and technical support \nto United Nations resident coordinators and United Nations country teams; \n \n28. Takes note with appreciation of the development of guidance materials and \ntraining modules by the United Nations Office for South-South Cooperation and other \nUnited Nations entities, such as the e-learning module on the use of South-South and \ntriangular cooperation, and encourages integration of this modality into policy \ninstruments and cooperation frameworks across the United Nations development \nsystem;  \n \n29. Calls upon the United Nations development system to support Member \nStates in enhancing the establishment and development of platforms for innovation \nand information-sharing in education and pedagogical methods, including, inter alia, \nin technical, vocational and tertiary education, and digital literacy, and leverage \ntechnological advancements through South-South and triangular cooperation;  \n \n30. Calls upon Member States to prioritize and scale up South-South and \ntriangular cooperation initiatives targeting the 1.9 billion young people, \npredominantly in developing countries, to enhance their digital skills, employability \nand entrepreneurship, including by incentivizing the mobilization of financing from \nall sources, and with the support of the United Nations development system;  \n \n31. Requests the United Nations Conference on Trade and Development to \nstrengthen capacity-building and support to developing countries, provide technical \nguidance, data-collection tools and reporting systems for applying the initial \nvoluntary conceptual framework for the measurement of South-South cooperation \nbased on country-led mechanisms, and establish a platform to enable country-led \ndevelopment of methodologies and sharing of experience;  \n \n32. Recommends that the United Nations development system support the \nefforts of the United Nations Conference on Trade and Development in raising \nawareness and developing the capacity of national statistical offices and cooperation \nagencies to use the initial voluntary conceptual framework for the measurement of \n\nA/C.2/80/L.4\n \n9/9\n25-16436 \n \nSouth-South cooperation, and acknowledges the importance of exploring possible \noptions for the measurement of triangular cooperation;  \n \n33. Takes note with appreciation of the ongoing efforts by the United Nations \nregional commissions, under the leadership of the United Nations Conference on \nTrade and Development and with the support of the United Nations Office for South-\nSouth Cooperation, to support pilot countries in applying the conceptual framework, \nincluding through capacity development, peer learning and data-collection tools, and \nencourages continued collaboration with United Nations country teams in this regard; \n \n34. Requests the United Nations Conference on Trade and Development to \nperiodically brief Member States on the utilization of the Manual for the Framework \nto Measure South-South Cooperation; \n \n35. Reaffirms the urgency of mobilizing greater resources to support South-\nSouth cooperation initiatives aimed at enhancing climate resilience, increasing \ninvestments in clean technologies, including zero- and low-emission technologies and \nrenewable energy in nature-based solutions, and climate-smart agriculture;  \n \n36. Recognizes the contribution of South-South and triangular cooperation in \npromoting gender equality and the empowerment of women and girls in sustainable \ndevelopment, as well as in achieving the overarching goal of the eradication of \npoverty in all its forms and dimensions, including extreme poverty;  \n \n37. Also recognizes the role of South-South and triangular cooperation in \nenhancing connectivity and digital transformation within and among developing \ncountries, and in this regard invites the United Nations Office for South-South \nCooperation and the United Nations system, in line with their respective mandates, to \nsupport efforts to develop and implement policies to bridge the digital divides and \nfast-track digital transformation to improve the delivery of public services in the \nSouth;  \n \n38. Reaffirms the commitment at the very heart of the 2030 Agenda to leave \nno one behind and commit to taking more tangible steps to support people in \nvulnerable situations and the most vulnerable countries and to reach the furthest \nbehind first;  \n \n39. Requests the Secretary-General to submit to the General Assembly at its \neighty-first session a comprehensive report on the state of South-South cooperation, \nincluding the implementation of the outcome document of the second High-level \nConference;  \n \n40. Decides to include in the provisional agenda of its eighty-first session, \nunder the item entitled \u201cOperational activities for development\u201d, the sub-item entitled \n\u201cSouth-South cooperation for development\u201d.  \n \n",
  "paragraphs": {
    "1": "Recalls the convening of the second High-level United Nations Conference on South-South Cooperation in Buenos Aires from 20 to 22 March 2019 and its outcome document,5 and calls upon the international community to support the full implementation of the outcome document of the second High-level Conference;",
    "2": "Takes note of the report of the Secretary-General on the state of South- South cooperation;6",
    "3": "Reaffirms its support for the High-level Committee on South-South Cooperation, recalls its decisions 22/1 and 22/2 adopted during its twenty-second session, held from 27 to 30 May 2025, and looks forward to the convening of the twenty-third session of the Committee, to be held in 2027;",
    "4": "Takes note of the recommendation contained in the report of the Administrator of the United Nations Development Programme on a midterm review of the outcome document of the second High-level Conference;",
    "5": "Recognizes the contribution of and the need to scale up and strengthen South-South and triangular cooperation as a complementary means of implementation of the 2030 Agenda and its Sustainable Development Goals, including in achieving the overarching goal of the eradication of poverty in all its forms and dimensions, including extreme poverty, and the goals of, inter alia, ending hunger, reducing inequalities, within and among countries, as well as for the use, capacity-building and transfer of digital technologies, on mutually agreed terms, to accelerate the attainment of the Sustainable Development Goals and close the digital divides;",
    "6": "Encourages the continuation and advancement of South-South cooperation and triangular cooperation on efforts for COVID-19 response and recovery from the socioeconomic effects of the pandemic and other multiple crises in the pursuit of the 2030 Agenda for Sustainable Development7 and its Sustainable Development Goals, and calls for continued support from the relevant United Nations development system entities in that regard, particularly in areas such as equitable and non-discriminatory access to safe, quality, effective and affordable healthcare and services and medical supplies and equipment, including diagnostics, therapeutics, medicine and other health products, vaccines, as well as digitalization, the environment, climate change, social protection and the eradication of poverty, noting that the world needs a stronger, better coordinated, inclusive and more agile global health architecture, based on solidarity and international and medical cooperation for pandemic prevention, preparedness, response and recovery to stop the severe impact of future outbreaks;",
    "7": "Welcomes the support of development partners for triangular cooperation towards the achievement of the Sustainable Development Goals in the global South, and urges developed countries and multilateral partners to continue providing financial, scientific and technological assistance and capacity-building to developing countries, to close the digital divides and to better harness science, technology and innovation to accelerate the achievement of the Sustainable Development Goals by 2030;",
    "8": "Urges Member States and United Nations entities to strengthen South- South and triangular cooperation on access to science, technology and innovation by creating synergies, developing expertise and boosting resources in different regions and institutions, and in this regard notes with appreciation the convening of the Summit on Science, Technology and Innovation by the Group of 77 and China, in Havana on 15 and 16 September 2023, as an effort to boost cooperation in this field to increase its benefit to all people;",
    "9": "Encourages Member States, with the support of the United Nations development system, to facilitate the development of and access to appropriate technologies, facilitate technology transfer as a means to promote digital transitions and foster the exchange of innovative practices through South-South and triangular cooperation, with the aim of safeguarding the interests of present and future generations, and to integrate science, digital technologies, including emerging ones, and data governance into national and international development strategies;",
    "10": "Encourages Member States and all relevant stakeholders, as appropriate, to establish or strengthen coordinated mechanisms at the subnational, national, regional and global levels to leverage the expertise and other resources of multi-stakeholder partnerships to support South-South cooperation and triangular cooperation initiatives towards the attainment of the 2030 Agenda, while acknowledging that governments have the principal role of coordinating and leading development efforts;",
    "11": "Takes note of the various experiences and locally driven development approaches to achieve the Sustainable Development Goals, and reiterates the importance of learning and sharing good practices, including through South-South, North-South and triangular cooperation through platforms such as South-South Galaxy, the Global South-South Development Expo, regional sustainable development forums and other knowledge-sharing platforms supported by the different entities of the United Nations system;",
    "12": "Notes with appreciation the convening of the Third South Summit, held in Kampala on 21 and 22 January 2024;",
    "13": "Recalls the convening of the ministerial meeting on South-South cooperation held in 2023 during the second part of the Fifth United Nations Conference on the Least Developed Countries, in Doha, on leveraging South-South and triangular cooperation for the attainment of the Sustainable Development Goals;",
    "14": "Also recalls the adoption of the Antigua and Barbuda Agenda for Small Island Developing States: A Renewed Declaration for Resilient Prosperity 8 at the Fourth International Conference on Small Island Developing States, held in Antigua and Barbuda from 27 to 30 May 2024, which commits to supporting small island developing States (SIDS), including by leveraging triangular and South-South cooperation, including SIDS-to-SIDS, to mobilize resources, as a complement to North-South cooperation, towards the realization of the Antigua and Barbuda Agenda for Small Island Developing States by 2034;",
    "15": "Welcomes the convening of the Third United Nations Conference on Landlocked Developing Countries, held in Awaza, Turkmenistan, from 5 to 8 August 2025, which served as an opportunity for the international community to scale up its support to landlocked developing countries in their efforts to leverage South-South and triangular cooperation, to achieve sustainable development and to realize the full implementation of the Awaza Programme of Action for Landlocked Developing Countries for the Decade 2024\u20132034, as well as the convening of the ministerial meeting on South-South cooperation on the margins of the third United Nations Conference on Landlocked Developing Countries;",
    "16": "Recalls the organization of the eleventh Global South-South Development Expo in Bangkok from 12 to 14 September 2022, encourages Member States to host future Global South-South Development Expos, which can serve as important knowledge-sharing platforms, and requests the United Nations Office for South-South Cooperation to actively engage with Member States, including by their expressions of interest to host future Expos, and to include the progress in its report to the General Assembly at its eighty-first session;",
    "17": "Recognizes the need for coherent and tailored support to address the specific development needs of middle-income countries, and notes the initiatives of the Like-Minded Group for Middle-Income Countries in promoting the role of South- South and triangular cooperation, including building momentum towards the goal of developing a strategic plan of action for middle-income countries;",
    "18": "Recalls the special needs of Africa and recognizes that, while economic growth has improved, there is a need to sustain the recovery to face the ongoing adverse impacts of multiple crises on development and the serious challenges that these impacts pose to the fight against poverty and hunger, which could further undermine the achievement of the internationally agreed development goals in Africa, including Agenda 2063: The Africa We Want and the Sustainable Development Goals and the unfinished business of the Millennium Development Goals, and welcomes the ongoing efforts to fully operationalize the African Continental Free Trade Area and the commencement of actual trading under the Agreement with a view to achieving the Sustainable Development Goals;",
    "19": "Recognizes the growing debt burden of developing countries, and also recognizes the role of the United Nations, within its mandates, to facilitate South- South exchanges of knowledge on debt to help countries of the global South, and in this regard acknowledges the efforts to establish the platform for borrower countries, with support from existing institutions, and a United Nations entity serving as its secretariat;",
    "20": "Also recognizes the need to enhance the provision and mobilization of adequate resources for enhancing South-South and triangular cooperation, and in this context invites all countries in a position to do so, in particular developed countries, to scale up the contributions, in support of such cooperation, to the United Nations Fund for South-South Cooperation and to the P\u00e9rez-Guerrero Trust Fund for South-South Cooperation, in accordance with General Assembly resolution 57/263 of 20 December 2002, and to support other initiatives for all developing countries;",
    "21": "Acknowledges the effectiveness of the P\u00e9rez-Guerrero Trust Fund in providing catalytic support to South-South cooperation, underscoring the enduring partnership between the Group of 77 and the United Nations Office for South-South Cooperation;",
    "22": "Welcomes innovations that enhance and expand South-South and triangular cooperation, and in this regard recognizes the importance of reinforcing partnership-building, including engaging with partners in national and local governments, civil society, academia and the private sector, and of resource mobilization, including contributions to the United Nations Fund for South-South Cooperation, third-party cost-sharing, parallel financing, in-kind contributions and special fund management arrangements such as those of the India-United Nations Development Partnership Fund, and the India, Brazil and South Africa Facility for Poverty and Hunger Alleviation;",
    "23": "Encourages United Nations entities to support developing countries in integrating development cooperation perspectives, including, in particular, South- South and triangular cooperation perspectives, into the preparation and presentation of the voluntary national review reports on sustainable development;",
    "24": " triangular cooperation into the United Nations Sustainable Development Cooperation Frameworks, at the country level, as appropriate, as a means to accelerate the implementation of the 2030 Agenda and its Sustainable Development Goals, and also calls upon the United Nations Office for South-South Cooperation to work in collaboration with the United Nations system organizations and the regional commissions to mainstream South-South and triangular cooperation, including through regional collaborative frameworks for South-South and triangular cooperation;",
    "25": "Notes with appreciation the countries that have increased cooperation with the United Nations Office for South-South Cooperation, and calls upon the Office to further strengthen its support to South-South cooperation projects;",
    "26": "Calls upon the United Nations development system entities to further integrate, as appropriate, South-South and triangular cooperation into their strategic frameworks and planning instruments, and urges them to allocate sufficient financial and non-financial resources dedicated to supporting and facilitating South-South and triangular cooperation, and encourages the United Nations resident coordinators to continue to advance the integration of South-South and triangular cooperation into the work of United Nations country teams to achieve greater system-wide results and impacts for the implementation of the 2030 Agenda and the Sustainable Development Goals;",
    "27": "Calls upon the United Nations Office for South-South Cooperation to deepen efforts in mainstreaming South-South and triangular cooperation at the country level, including by providing demand-driven advisory and technical support to United Nations resident coordinators and United Nations country teams;",
    "28": "Takes note with appreciation of the development of guidance materials and training modules by the United Nations Office for South-South Cooperation and other United Nations entities, such as the e-learning module on the use of South-South and triangular cooperation, and encourages integration of this modality into policy instruments and cooperation frameworks across the United Nations development system;",
    "29": "Calls upon the United Nations development system to support Member States in enhancing the establishment and development of platforms for innovation and information-sharing in education and pedagogical methods, including, inter alia, in technical, vocational and tertiary education, and digital literacy, and leverage technological advancements through South-South and triangular cooperation;",
    "30": "Calls upon Member States to prioritize and scale up South-South and triangular cooperation initiatives targeting the 1.9 billion young people, predominantly in developing countries, to enhance their digital skills, employability and entrepreneurship, including by incentivizing the mobilization of financing from all sources, and with the support of the United Nations development system;",
    "31": "Requests the United Nations Conference on Trade and Development to strengthen capacity-building and support to developing countries, provide technical guidance, data-collection tools and reporting systems for applying the initial voluntary conceptual framework for the measurement of South-South cooperation based on country-led mechanisms, and establish a platform to enable country-led development of methodologies and sharing of experience;",
    "32": " South-South cooperation, and acknowledges the importance of exploring possible options for the measurement of triangular cooperation;",
    "33": "Takes note with appreciation of the ongoing efforts by the United Nations regional commissions, under the leadership of the United Nations Conference on Trade and Development and with the support of the United Nations Office for South- South Cooperation, to support pilot countries in applying the conceptual framework, including through capacity development, peer learning and data-collection tools, and encourages continued collaboration with United Nations country teams in this regard;",
    "34": "Requests the United Nations Conference on Trade and Development to periodically brief Member States on the utilization of the Manual for the Framework to Measure South-South Cooperation;",
    "35": "Reaffirms the urgency of mobilizing greater resources to support South- South cooperation initiatives aimed at enhancing climate resilience, increasing investments in clean technologies, including zero- and low-emission technologies and renewable energy in nature-based solutions, and climate-smart agriculture;",
    "36": "Recognizes the contribution of South-South and triangular cooperation in promoting gender equality and the empowerment of women and girls in sustainable development, as well as in achieving the overarching goal of the eradication of poverty in all its forms and dimensions, including extreme poverty;",
    "37": "Also recognizes the role of South-South and triangular cooperation in enhancing connectivity and digital transformation within and among developing countries, and in this regard invites the United Nations Office for South-South Cooperation and the United Nations system, in line with their respective mandates, to support efforts to develop and implement policies to bridge the digital divides and fast-track digital transformation to improve the delivery of public services in the South;",
    "38": "Reaffirms the commitment at the very heart of the 2030 Agenda to leave no one behind and commit to taking more tangible steps to support people in vulnerable situations and the most vulnerable countries and to reach the furthest behind first;",
    "39": "Requests the Secretary-General to submit to the General Assembly at its eighty-first session a comprehensive report on the state of South-South cooperation, including the implementation of the outcome document of the second High-level Conference;",
    "40": "Decides to include in the provisional agenda of its eighty-first session, under the item entitled \u201cOperational activities for development\u201d, the sub-item entitled \u201cSouth-South cooperation for development\u201d."
  },
  "agenda_items": [
    "Item 23"
  ],
  "symbol_references": [
    "A/C.2/80/L.4"
  ]
}