{
  "symbol": "A/C.6/80/L.2",
  "filename": "A_C.6_80_L.2.pdf",
  "title": "Observer status for the Brazilian-Argentine Agency for Accounting and Control of Nuclear Materials in the General Assembly",
  "text": "United Nations \nA/C.6/80/L.2 \n \n \nGeneral Assembly \nDistr.: Limited \n8 October 2025 \nOriginal: English \n \n25-16079 (E)    141025 \n*2516079* \n \n \nEightieth session \nSixth Committee \nAgenda item 175 \nObserver status for the Brazilian-Argentine Agency for \nAccounting and Control of Nuclear Materials in the \nGeneral Assembly \n \n \n \n \n \nArgentina and Brazil: draft resolution \n \n \n \n Observer status for the Brazilian-Argentine Agency for Accounting \nand Control of Nuclear Materials in the General Assembly \n \n \n \nThe General Assembly, \n \nWishing to promote cooperation between the United Nations and the Brazilian \nArgentine Agency for Accounting and Control of Nuclear Materials, \n \n1. \nDecides to invite the Brazilian Argentine Agency for Accounting and \nControl of Nuclear Materials to participate in the sessions and the work of the General \nAssembly in the capacity of observer;  \n \n2. \nRequests the Secretary-General to take the action necessary to implement \nthe present resolution. \n \n",
  "paragraphs": {
    "1": "Decides to invite the Brazilian Argentine Agency for Accounting and Control of Nuclear Materials to participate in the sessions and the work of the General Assembly in the capacity of observer;",
    "2": "Requests the Secretary-General to take the action necessary to implement the present resolution."
  },
  "agenda_items": [
    "Item 175"
  ],
  "symbol_references": [
    "A/C.6/80/L.2"
  ]
}