{
  "symbol": "A/C.6/80/L.6",
  "filename": "A_C.6_80_L.6.pdf",
  "title": "Observer status for the Islamic Organization for Food Security in the General Assembly",
  "text": "United Nations \nA/C.6/80/L.6 \n \n \nGeneral Assembly \nDistr.: Limited \n8 October 2025 \nOriginal: English \n \n25-16084 (E)    141025     \n*2516084* \n \n \nEightieth session \nSixth Committee \nAgenda item 172 \nObserver status for the Islamic Organization for Food \nSecurity in the General Assembly \n \n \n \n \n \nAfghanistan, Albania, Algeria, Azerbaijan, Bahrain, Bangladesh, Benin, \nBrunei Darussalam, Burkina Faso, Cameroon, Chad, Comoros, C\u00f4te d\u2019Ivoire, \nDjibouti, Egypt, Gabon, Gambia, Guinea, Guinea-Bissau, Guyana, Indonesia, \nIran (Islamic Republic of), Iraq, Jordan, Kazakhstan, Kuwait, Kyrgyzstan, \nLebanon, Libya, Malaysia, Maldives, Mali, Mauritania, Morocco, Mozambique, \nNiger, Nigeria, Oman, Pakistan, Qatar, Saudi Arabia, Senegal, Sierra Leone, \nSomalia, Sudan, Suriname, Syrian Arab Republic, Tajikistan, Togo, Tunisia, \nT\u00fcrkiye, Turkmenistan, Uganda, United Arab Emirates, Uzbekistan, Yemen \nand State of Palestine: draft resolution \n \n \n \n Observer status for the Islamic Organization for Food Security in \nthe General Assembly \n \n \n \nThe General Assembly, \n \nWishing to promote cooperation between the United Nations and the Islamic \nOrganization for Food Security, \n \n1. \nDecides to invite the Islamic Organization for Food Security to participate \nin the sessions and the work of the General Assembly in the capacity of observer;  \n \n2. \nRequests the Secretary-General to take the action necessary to implement \nthe present resolution. \n \n",
  "paragraphs": {
    "1": "Decides to invite the Islamic Organization for Food Security to participate in the sessions and the work of the General Assembly in the capacity of observer;",
    "2": "Requests the Secretary-General to take the action necessary to implement the present resolution."
  },
  "agenda_items": [
    "Item 172"
  ],
  "symbol_references": [
    "A/C.6/80/L.6"
  ]
}