{
  "symbol": "A/C.2/80/L.51",
  "filename": "A_C.2_80_L.51.pdf",
  "title": "Promoting sustainable consumption and production patterns for the implementation of the 2030 Agenda for Sustainable Development, building on Agenda 21",
  "text": "United Nations \nA/C.2/80/L.51\n \n \nGeneral Assembly \nDistr.: Limited \n17 November 2025 \nOriginal: English \n \n25-18675 (E)    211125 \n*2518675* \n \n \nEightieth session \nSecond Committee \nAgenda item 18 (a) \nSustainable development: towards the achievement of sustainable \ndevelopment: implementation of the 2030 Agenda for Sustainable \nDevelopment, including through sustainable consumption and \nproduction, building on Agenda 21 \n \n \n \n \n \nDraft resolution submitted by the Rapporteur of the Committee, Javad Momeni \n(Islamic Republic of Iran), on the basis of informal consultations on draft \nresolution A/C.2/80/L.27 \n \n \n \n Promoting sustainable consumption and production patterns for \nthe implementation of the 2030 Agenda for Sustainable \nDevelopment, building on Agenda 21 \n \n \n \nThe General Assembly, \n \nRecalling the Rio Declaration on Environment and Development,1 Agenda 21,2 \nthe Programme for the Further Implementation of Agenda 21, 3 the Johannesburg \nDeclaration on Sustainable Development 4 and the Plan of Implementation of the \nWorld Summit on Sustainable Development (Johannesburg Plan of Implementation) 5 \nand the outcome document of the United Nations Conference on Sustainable \nDevelopment, entitled \u201cThe future we want\u201d,6 as well as all relevant resolutions on \nthe implementation of Agenda 21, the Programme for the Further Implementation of \nAgenda 21 and the outcomes of the World Summit on Sustainable Development and \nof the United Nations Conference on Sustainable Development, \n \nReaffirming its resolution 70/1 of 25 September 2015, entitled \u201cTransforming \nour world: the 2030 Agenda for Sustainable Development\u201d, in which it adopted a \ncomprehensive, far-reaching and people-centred set of universal and transformative \nSustainable Development Goals and targets, its commitment to working tirelessly for \n__________________ \n \n1  Report of the United Nations Conference on Environment and Development, Rio de Janeiro, \n3 \u2013 14 June 1992, vol. I, Resolutions Adopted by the Conference (United Nations publication, \nSales No. E.93.I.8 and corrigendum), resolution 1, annex I. \n \n2  Ibid., annex II. \n \n3  Resolution S-19/2, annex. \n \n4  Report of the World Summit on Sustainable Development, Johannesburg, South Africa, \n26 August\u20134 September 2002 (United Nations publication, Sales No. E.03.II.A.1 and \ncorrigendum), chap. I, resolution 1, annex. \n \n5  Ibid., resolution 2, annex. \n \n6  Resolution 66/288, annex. \n\nA/C.2/80/L.51 \n \n25-18675\n2/9 \n \nthe full implementation of the Agenda by 2030, its recognition that eradicating \npoverty in all its forms and dimensions, including extreme poverty, is the greatest \nglobal challenge and an indispensable requirement for sustainable development, its \ncommitment to achieving sustainable development in its three dimensions \u2013 \neconomic, social and environmental \u2013 in a balanced and integrated manner, and to \nbuilding upon the achievements of the Millennium Development Goals and seeking \nto address their unfinished business, \n \nRecognizing the importance of the United Nations Conference on Sustainable \nDevelopment and the United Nations Conference on Environment and Development \nand the resulting processes for the elaboration of the 2030 Agenda for Sustainable \nDevelopment and for the realization of sustainable development, and recognizing also \nthe uneven progress in the achievement of the Sustainable Development Goals and \nall other internationally agreed development goals and commitments necessary to \nachieve sustainable development, \n \nReaffirming the need to further mainstream sustainable development at all \nlevels, integrating economic, social and environmental aspects and recognizing their \ninterlinkages, so as to achieve sustainable development in all its dimensions, and \nreiterating that sustainable development is a key element of the overarching \nframework for United Nations activities, \n \nWelcoming the convening of the Summit of the Future on 22\u201323 September 2024 \nat the United Nations Headquarters in New York at which resolution 79/1 entitled \n\u201cThe Pact for the Future\u201d and its annexes were adopted, \n \nRecalling the commitment to make fundamental changes in our consumption \nand production patterns, including by transitioning to sustainable economic and \nbusiness models, the implementation of the 10-Year Framework of Programmes on \nSustainable Consumption and Production Patterns 7  and by providing support to \ndeveloping countries to strengthen their scientific, technological and innovation \ncapacity, and recognizing that local and national zero-waste initiatives can contribute \nto achieving sustainable consumption and production, as outlined in the political \ndeclaration of the high-level political forum on sustainable development convened \nunder the auspices of the General Assembly,8 \n \nRecognizing and underscoring the role of the private sector and industry, local \nauthorities, local communities and Indigenous Peoples in supporting more sustainable \nlifestyles, \n \nTaking note of the launch of the Sustainable Food Systems Programme under \nthe 10-Year Framework of Programmes on Sustainable Consumption and Production \nPatterns, an inclusive initiative to accelerate the shifts towards sustainable food \nsystems, \n \nRecognizing that digital technologies and the unprecedented scale, spread and \nspeed of change brought about by them can be harnessed to support the \nimplementation of the 2030 Agenda, while ensuring that digitalization remains \ninclusive, equitable and sustainable, \n \nStressing the need, in the implementation of the 2030 Agenda, to benefit from \nand build on experiences, success stories, best practices, challenges and the lessons \nlearned from the previous agreements on sustainable development, \n \nStressing also the importance of overcoming silos and seeking innovative and \ncoordinated approaches in integrating and balancing the three dimensions of \n__________________ \n \n7  A/CONF.216/5, annex. \n \n8  Resolution 78/1, annex. \n\nA/C.2/80/L.51\n \n3/9\n25-18675 \n \nsustainable development, and in this regard taking note of the actions and initiatives \nimplemented by the United Nations system entities, \n \nStressing further the need to determine gaps, obstacles, synergies and challenges \nin the implementation of commitments and instruments in the sustainable \ndevelopment field, in a coherent and integrated manner, and with a view to pursuing \nand achieving policy coherence, as well as identifying new opportunities and \nemerging challenges for international cooperation on the path towards sustainable \ndevelopment, \n \nReaffirming the 2030 Agenda, the Sevilla Commitment,9 building on the Addis \nAbaba Action Agenda of the Third International Conference on Financing for \nDevelopment,10 the Paris Agreement adopted under the United Nations Framework \nConvention on Climate Change, 11  the New Urban Agenda, 12  the Convention on \nBiological Diversity 13  and the Sendai Framework for Disaster Risk Reduction \n2015\u2013 2030,14 as well as major outcome documents in relation to countries in special \nsituations, \n \nRecalling United Nations Environment Assembly resolution 5/14 of 2 March \n2022 entitled \u201cEnd plastic pollution: towards an international legally binding \ninstrument\u201d,15 \n \nWelcoming the convening of the sixteenth meeting of the Conference of the \nParties to the Convention on Biological Diversity, held in Cali, Colombia, from \n21 October to 1 November 2024 on the theme \u201cPeace with nature\u201d, as well as its two \nresumed sessions, held online from 3 to 6 December 2024 and in Rome, Italy, from \n25 to 27 February 2025, respectively, and recalling the Kunming Montreal Global \nBiodiversity Framework adopted at the fifteenth meeting of the Conference of the \nParties to the Convention on Biological Diversity16 and urging its early, inclusive and \neffective implementation, \n \nWelcoming also the convening of the United Nations Conference on the Midterm \nComprehensive Review of the Implementation of the Objectives of the International \nDecade for Action, \u201cWater for Sustainable Development\u201d 2018\u20132028 in New York \nfrom 22 to 24 March 2023, and looking forward to the 2026 United Nations Water \nConference to Accelerate the Implementation of Sustainable Development Goal 6: \nEnsure availability and sustainable management of water and sanitation for all, to be \nco-hosted by Senegal and the United Arab Emirates and to be held in the United Arab \nEmirates from 2 to 4 December 2026, and the 2028 United Nations Conference on \nthe Final Comprehensive Review of the Implementation of the Objectives of the \nInternational Decade for Action, \u201cWater for Sustainable Development\u201d, 2018\u20132028, \nto be hosted by Tajikistan, \n \nRecalling its resolution 77/161 of 14 December 2022, entitled \u201cPromoting zero-\nwaste initiatives to advance the 2030 Agenda for Sustainable Development\u201d, \n \nNoting with appreciation the work of the Secretary-General\u2019s Advisory Board \nof Eminent Persons on Zero Waste for contributing to sustainable consumption and \nproduction and advancing the 2030 Agenda for Sustainable Development, \n__________________ \n \n9  Resolution 79/323, annex. \n \n10  Resolution 69/313, annex. \n \n11  See FCCC/CP/2015/10/Add.1, decision 1/CP.21, annex. \n \n12  Resolution 71/256, annex. \n \n13  United Nations, Treaty Series, vol. 1760, No. 30619. \n \n14  Resolution 69/283, annex II. \n \n15  UNEP/EA.5/Res.14. \n \n16  United Nations Environment Programme, document CBD/COP/15/17, decision 15/4, annex. \n\nA/C.2/80/L.51 \n \n25-18675\n4/9 \n \n \nNoting with concern that the compounded effects of the coronavirus disease \n(COVID-19) pandemic, conflict and economic shocks, and climate change, \nbiodiversity loss and pollution have exacerbated existing challenges in the \ninternational community\u2019s efforts, especially for developing countries, to implement \nsustainable consumption and production and may further reverse progress towards \nthe attainment of the Sustainable Development Goals, including Sustainable \nDevelopment Goal 12, and therefore stressing the importance of promoting \nsustainable consumption and production in the context of sustainable and inclusive \nrecovery strategies, \n \nNoting with concern also the latest warnings by the Intergovernmental Panel on \nClimate Change, including on the vulnerability of ecosystems to climate change being \nstrongly influenced by human society, including from unsustainable consumption and \nproduction, and further recognizing that the reduction of unsustainable consumption \nand production, including waste generation, will support progress in implementing \nthe Sustainable Development Goals, including Goal 12, while stressing the \nimportance of eradicating poverty in all its forms and dimensions and of reducing \ninequality, recognizing that eradicating poverty, changing unsustainable and \npromoting sustainable patterns of consumption and production and protecting and \nmanaging the natural resource base of economic and social development are the \noverarching objectives of and essential requirements for sustainable development, \n \nAcknowledging that pursuing circular economy approaches as a pathway to \nachieving sustainable consumption and production patterns can contribute to \naddressing climate change, biodiversity loss, land degradation, water stress and \npollution and their impact on human health, thus contributing to the achievement of \nrelated goals under the 2030 Agenda for Sustainable Development and other \ninternationally agreed environmental goals, \n \nWelcoming the convening of the 2025 United Nations Conference to Support the \nImplementation of Sustainable Development Goal 14: Conserve and sustainably use \nthe oceans, seas and marine resources for sustainable development, co-hosted by \nCosta Rica and France, held in Nice, France, from 9 to 13 June 2025, at which its \npolitical declaration17 was adopted, \n \nNoting the importance of transitioning to sustainable lifestyles and sustainable \npatterns of consumption and production in efforts to address climate change, \nincluding through circular economy approaches, and encourages efforts in this regard, \nin accordance with decision 1/CMA.5,18 \n \nRecognizing the pressing need to reduce excessive individual consumption \nwhich may place significant pressure on the environment, including in developing \ncountries, \n \nTaking note of the report of the Secretary-General entitled \u201cProgress towards \nthe Sustainable Development Goals: towards a rescue plan for people and planet\u201d 19 \nand the 2023 Global Sustainable Development Report, which highlights, inter alia, \nthat the world is not on track to achieve Goal 12 and its related targets by 2030 at the \ncurrent rate of progress, \n \n1. \nTakes note of the report of the Secretary-General entitled \u201cTowards the \nachievement of sustainable development: implementation of the 2030 Agenda for \n__________________ \n \n17  Resolution 79/314, annex. \n \n18  See FCCC/PA/CMA/2023/16/Add.1. \n \n19  A/78/80-E/2023/64. \n\nA/C.2/80/L.51\n \n5/9\n25-18675 \n \nSustainable Development, including through sustainable consumption and production, \nbuilding on Agenda 21\u201d;20 \n \n2. \nRecognizes that the United Nations Conference on Environment and \nDevelopment constituted a milestone that ushered in major international instruments \nand commitments that guide progress in closing development gaps within and among \ndeveloped and developing countries, and reaffirms all the principles of the Rio \nDeclaration on Environment and Development, as set out in the 2030 Agenda for \nSustainable Development,21 as well as the outcome document of the United Nations \nConference on Sustainable Development, held in Rio de Janeiro, Brazil, in June 2012, \nentitled \u201cThe future we want\u201d; \n \n3. \nReaffirms the commitment made in the 2030 Agenda to ensuring that \npeople everywhere have the relevant information and awareness for sustainable \ndevelopment and lifestyles in harmony with nature, recalls in this regard resolution \n6/8 of 1 March 2024 on promoting sustainable lifestyles, 22 adopted by the United \nNations Environment Assembly of the United Nations Environment Programme at its \nsixth session, and encourages Member States to create the necessary evidence-based \nenabling conditions, foster public and private collaboration, and pursue education at \nall levels and awareness-raising initiatives in support of empowering citizens to make \ninformed choices about sustainable lifestyles, while recognizing that each country is \nbest positioned to understand its own national circumstances and priorities to \nencourage more sustainable lifestyles; \n \n4. \nUrges the full and effective implementation of the Sustainable \nDevelopment Goals and all other internationally agreed development goals and \ncommitments in the economic, social and environmental fields, including the \nMillennium Development Goals and those under the three Rio conventions, and other \nmultilateral environmental agreements in accordance with their respective mandates, \nbuilding on their contributions, best practices, challenges and lessons learned, in order \nto support the full and effective implementation of the 2030 Agenda, including Goal 12, \nto ensure sustainable consumption and production patterns; \n \n5. \nRecognizes that the 2030 Agenda, including Goal 12, to ensure sustainable \nconsumption and production patterns, builds on issues included in Agenda 21, and \nencourages further efforts aimed at strengthening international cooperation to address \ngaps in its implementation, including through, inter alia, the provision of means of \nimplementation; \n \n6. \nWelcomes the political declaration adopted at the high-level political \nforum on sustainable development convened under the auspices of the General \nAssembly (Sustainable Development Goals Summit), held in New York on 18 and \n19 September 2023, and urges timely action to ensure its full implementation; \n \n7. \nAcknowledges that sustainable consumption and production practices can \nbe cost-efficient and effective ways to achieve economic development, reduce \nenvironmental impacts and advance human well-being, and encourages urgent action \nto achieve Sustainable Development Goal 12, in order to contribute to the \nachievement of all Goals; \n \n8. \nRecognizes that the United Nations Conference on Sustainable \nDevelopment adopted, among other commitments on sustainable consumption and \nproduction, the 10-Year Framework of Programmes on Sustainable Consumption and \nProduction Patterns and that both the Framework and its multi-partner trust fund are \n__________________ \n \n20  A/80/372. \n \n21  Resolution 70/1. \n \n22  UNEP/EA.6/Res.8. \n\nA/C.2/80/L.51 \n \n25-18675\n6/9 \n \ntools for action on sustainable consumption and production, and in this regard \nreiterates the need for such initiatives to continue to share best practices and provide \nother forms of technical assistance in the shift towards sustainable consumption and \nproduction patterns, including by providing tools and solutions for policy design and \nimplementation; \n \n9. \nWelcomes the One Planet Network Forum 2024, held in Rio de Janeiro, \nBrazil, on 12 and 13 September 2024, and takes note of its outcome document, and \nrecognizes the important role of the 10-Year Framework of Programmes on \nSustainable Consumption and Production Patterns and its One Planet network, and \nrecognizes its role in supporting Governments and businesses in embracing \nsustainable consumption and production patterns by providing tools, best practices, \ncapacity-building and cooperation platforms that help scale up impact and \neffectiveness; \n \n10. Calls upon Member States, United Nations entities and stakeholders to \nsupport the implementation and resource mobilization for the Global Strategy for \nSustainable Consumption and Production 2023\u20132030,23 as part of the international \nefforts to achieve the 2030 Agenda and its Sustainable Development Goals and the \nobjectives of the multilateral environmental agreements; \n \n11. Recognizes that unsustainable patterns of consumption and production are \nkey drivers of natural resource depletion, climate change, biodiversity loss, pollution, \nmalnutrition and land degradation, and therefore recommits to making fundamental \nchanges in the way that societies produce and consume goods and services through \nthe transition to sustainable economic and business models that promote sustainable \nconsumption and production patterns, as well as through policies, frameworks, \npartnerships, technological innovation and instruments that improve resource \nefficiency and the sustainable management of natural resources, including water-use \nefficiency, improved sanitation management, reduce waste, promote life cycle \napproaches, encourage approaches such as the circular economy, life cycle and other \napproaches, as appropriate and taking into account national circumstances and \ncapacities, enable consumers to make sustainable consumption choices, mainstream \nsustainability practices, encourage sustainable bioeconomy, as well as sustainable and \nenvironmentally sound bio-based products and increase resilience across all sectors \nof the economy, which will contribute to the achievement of the 2030 Agenda and its \nSustainable Development Goals, in particular Goal 12; \n \n12. Welcomes the extension by the General Assembly, in its resolution 76/202 \nof 17 December 2021, of the mandate of the 10-Year Framework of Programmes on \nSustainable Consumption and Production Patterns until 31 December 2030, \nencourages the implementation of the Framework of Programmes on Sustainable \nConsumption and Production, in accordance with target 12.1 of Goal 12; \n \n13. Takes note with appreciation of the United Nations Food Systems Summit +4 \nStocktaking Moment, convened by the Secretary-General from 27 to 29 July 2025 in \nAddis Ababa and co-hosted by the Governments of Ethiopia and Italy, and takes note \nof the call to action by the Secretary-General entitled \u201cFrom Rome to Addis and \nbeyond\u201d; \n \n14. Recognizes the important role of the private sector in promoting and \nutilizing sustainable practices, including for multinational corporations and micro-, \nsmall and medium-sized enterprises that may face greater challenges in enhancing \nresource efficiency, and reiterates the invitation to Member States to take measures, \n__________________ \n \n23  See A/77/607. \n\nA/C.2/80/L.51\n \n7/9\n25-18675 \n \nin cooperation with the private sector, to enhance the design of products, taking into \naccount life cycle assessments to contribute to resource efficiency; \n \n15. Acknowledges the Global Framework on Chemicals \u2013 For a Planet Free of \nHarm from Chemicals and Waste, including its strategic objectives and targets; \n \n16. Welcomes the establishment of the Intergovernmental Science-Policy \nPanel on Chemicals, Waste and Pollution, at the intergovernmental meeting held on \n19 and 20 June 2025 in Punta del Este, Uruguay, as mandated by the United Nations \nEnvironment Assembly in its resolution 5/8 of 2 March 2022, 24 to strengthen the \nscience-policy interface to contribute further to the sound management of chemicals \nand waste and to prevent pollution; \n \n17. Acknowledges the link between plastic waste and pollution and sustainable \nconsumption and production patterns, and calls upon all Member States to continue \nto step up activities across the life cycle of plastic to prevent, reduce and eliminate \nplastic pollution, including in the marine environment, including through innovative \napproaches that foster environmentally sound management, including the reduction, \nrepair, reuse and recycling of plastic waste and products; \n \n18. Welcomes the decision by the United Nations Environment Assembly at its \nresumed fifth session, in resolution 5/14 of 2 March 2022, to convene an \nintergovernmental negotiating committee to develop an international legally binding \ninstrument on plastic pollution, including in the marine environment, which could \ninclude both binding and voluntary approaches, based on a comprehensive approach \nthat addresses the full life cycle of plastic, taking into account, among other things, \nthe principles of the Rio Declaration on Environment and Development, as well as \nnational circumstances and capabilities, and underscores the importance of securing \nan ambitious international legally binding instrument to end plastic pollution, \nincluding in the marine environment, while acknowledging that some legal \nobligations arising out of a new instrument will require capacity-building and \ntechnical and financial assistance in order to be effectively implemented by \ndeveloping countries and countries with economies in transition, and in this regard \nwelcomes the commitment made by Heads of State and Government in the political \ndeclaration adopted during the high-level political forum on sustainable development \nconvened under the auspices of the General Assembly to support the work of the \nintergovernmental negotiating committee, with the ambition of completing its work \nby the end of 2024; \n \n19. Urges the international community to continue to support developing \ncountries in strengthening their scientific and technological capacity to move towards \nmore sustainable patterns of consumption and production, and calls for enhanced \nsupport to developing countries by providing means of implementation; \n \n20. Recognizes the need for greater financing, capacity-building, technical \nassistance and technology transfer on mutually agreed terms for developing countries \nto harness science, technology and innovation, and information and communication \ntechnologies, as well as new and emerging technologies including artificial \nintelligence, including through scaling up the use of open science, affordable and \nopen-source technology, research and development to accelerate the achievement of \nthe Sustainable Development Goals; \n \n21. Encourages the further strengthening of the science-policy interface and \nof the means of implementation from all sources and at all levels, including a \n__________________ \n \n24  UNEP/EA.5/Res.8. \n\nA/C.2/80/L.51 \n \n25-18675\n8/9 \n \nrevitalized and enhanced Global Partnership, as well as by supporting innovative \napproaches to sustainability science and emphasizing cross-disciplinary partnerships; \n \n22. Requests the United Nations system to further mainstream and integrate \nthe three dimensions of sustainable development throughout its work, to continue to \nexchange experiences and lessons learned in this regard and to step up its efforts at \nall levels in continued support of the implementation of the 2030 Agenda, including \nGoal 12, to ensure sustainable consumption and production patterns; \n \n23. Encourages regional and subregional organizations to continue to promote \nsustainable development in their respective regions by, inter alia, promoting peer \nlearning and cooperation, including South-South and triangular cooperation, as well \nas effective linkages among global, regional, subregional and national processes, as \nappropriate, to advance sustainable development; \n \n24. Strongly encourages further accelerated actions and multi-stakeholder \npartnerships at all levels, including with the United Nations system and the \ninternational financial system, to advance innovative pathways to achieving \nsustainable consumption and production, in line with United Nations Environment \nAssembly resolutions 5/11 of 2 March 2022, entitled \u201cEnhancing circular economy \nas a contribution to achieving sustainable consumption and production\u201d, 25 and 6/8 of \n1 March 2024, entitled \u201cPromoting sustainable lifestyles\u201d 26 as part of accelerated \nprogress towards the 2030 Agenda, thereby creating job opportunities, promoting \nsustainable business practices and fostering more sustainable and stable global supply \nchains, and ensuring that people everywhere have the relevant information and \nawareness about sustainable development and lifestyles in harmony with nature, and \nin this respect recognizes the need for discussions to further promote sustainable \nconsumption and production with a view to accelerating progress on Sustainable \nDevelopment Goal 12 and related goals and targets; \n \n25. Stresses the urgency of promoting sustainable consumption and production \napproaches, in which products and materials are designed in such a way that they can \nbe reused, remanufactured, recycled or recovered and therefore retained in the \neconomy for as long as possible, along with the resources of which they are made, \nthe generation of waste is avoided or minimized and greenhouse gas emissions are \nprevented or reduced; \n \n26. Encourages accelerated action to advance youth employment through \nskills development for decent jobs in sectors aligned with sustainable consumption \nand production; \n \n27. Calls upon Member States, in this regard, in cooperation with educational \ninstitutions, the private sector, international community, civil society, as appropriate, \nto ensure inclusive and equitable access to knowledge, science and information while \npromoting innovation, critical thinking and life skills that enable youth to actively \ncontribute to sustainable development, in particular in advancing sustainable \nconsumption and production patterns, for the benefit of current and future \ngenerations, while supporting and strengthening existing programmes, initiatives and \npartnerships that facilitate meaningful youth engagement; \n \n28. Requests the Secretary-General to submit to the General Assembly at its \neighty-first session a report on the implementation of the present resolution, with a \nparticular focus on the state of play with regard to sustainable consumption and \nproduction and the application and promotion thereof, and to recommend concrete \nactions to implement the 2030 Agenda in this regard; \n__________________ \n \n25  UNEP/EA.5/Res.11. \n \n26  UNEP/EA.6/Res.8. \n\nA/C.2/80/L.51\n \n9/9\n25-18675 \n \n \n29. Decides to include in the provisional agenda of its eighty-first session, \nunder the item entitled \u201cSustainable development\u201d, the sub-item entitled \u201cTowards \nthe achievement of sustainable development: implementation of the 2030 Agenda for \nSustainable Development, including through sustainable consumption and \nproduction, building on Agenda 21\u201d. \n \n",
  "paragraphs": {
    "1": "Takes note of the report of the Secretary-General entitled \u201cTowards the achievement of sustainable development: implementation of the 2030 Agenda for Sustainable Development, including through sustainable consumption and production, building on Agenda 21\u201d;20",
    "2": "Recognizes that the United Nations Conference on Environment and Development constituted a milestone that ushered in major international instruments and commitments that guide progress in closing development gaps within and among developed and developing countries, and reaffirms all the principles of the Rio Declaration on Environment and Development, as set out in the 2030 Agenda for Sustainable Development,21 as well as the outcome document of the United Nations Conference on Sustainable Development, held in Rio de Janeiro, Brazil, in June 2012, entitled \u201cThe future we want\u201d;",
    "3": "Reaffirms the commitment made in the 2030 Agenda to ensuring that people everywhere have the relevant information and awareness for sustainable development and lifestyles in harmony with nature, recalls in this regard resolution 6/8 of 1 March 2024 on promoting sustainable lifestyles, 22 adopted by the United Nations Environment Assembly of the United Nations Environment Programme at its sixth session, and encourages Member States to create the necessary evidence-based enabling conditions, foster public and private collaboration, and pursue education at all levels and awareness-raising initiatives in support of empowering citizens to make informed choices about sustainable lifestyles, while recognizing that each country is best positioned to understand its own national circumstances and priorities to encourage more sustainable lifestyles;",
    "4": "Urges the full and effective implementation of the Sustainable Development Goals and all other internationally agreed development goals and commitments in the economic, social and environmental fields, including the Millennium Development Goals and those under the three Rio conventions, and other multilateral environmental agreements in accordance with their respective mandates, building on their contributions, best practices, challenges and lessons learned, in order to support the full and effective implementation of the 2030 Agenda, including Goal 12, to ensure sustainable consumption and production patterns;",
    "5": "Recognizes that the 2030 Agenda, including Goal 12, to ensure sustainable consumption and production patterns, builds on issues included in Agenda 21, and encourages further efforts aimed at strengthening international cooperation to address gaps in its implementation, including through, inter alia, the provision of means of implementation;",
    "6": "Welcomes the political declaration adopted at the high-level political forum on sustainable development convened under the auspices of the General Assembly (Sustainable Development Goals Summit), held in New York on 18 and 19 September 2023, and urges timely action to ensure its full implementation;",
    "7": "Acknowledges that sustainable consumption and production practices can be cost-efficient and effective ways to achieve economic development, reduce environmental impacts and advance human well-being, and encourages urgent action to achieve Sustainable Development Goal 12, in order to contribute to the achievement of all Goals;",
    "8": "Recognizes that the United Nations Conference on Sustainable Development adopted, among other commitments on sustainable consumption and production, the 10-Year Framework of Programmes on Sustainable Consumption and Production Patterns and that both the Framework and its multi-partner trust fund are tools for action on sustainable consumption and production, and in this regard reiterates the need for such initiatives to continue to share best practices and provide other forms of technical assistance in the shift towards sustainable consumption and production patterns, including by providing tools and solutions for policy design and implementation;",
    "9": "Welcomes the One Planet Network Forum 2024, held in Rio de Janeiro, Brazil, on 12 and 13 September 2024, and takes note of its outcome document, and recognizes the important role of the 10-Year Framework of Programmes on Sustainable Consumption and Production Patterns and its One Planet network, and recognizes its role in supporting Governments and businesses in embracing sustainable consumption and production patterns by providing tools, best practices, capacity-building and cooperation platforms that help scale up impact and effectiveness;",
    "10": "Calls upon Member States, United Nations entities and stakeholders to support the implementation and resource mobilization for the Global Strategy for Sustainable Consumption and Production 2023\u20132030,23 as part of the international efforts to achieve the 2030 Agenda and its Sustainable Development Goals and the objectives of the multilateral environmental agreements;",
    "11": "Recognizes that unsustainable patterns of consumption and production are key drivers of natural resource depletion, climate change, biodiversity loss, pollution, malnutrition and land degradation, and therefore recommits to making fundamental changes in the way that societies produce and consume goods and services through the transition to sustainable economic and business models that promote sustainable consumption and production patterns, as well as through policies, frameworks, partnerships, technological innovation and instruments that improve resource efficiency and the sustainable management of natural resources, including water-use efficiency, improved sanitation management, reduce waste, promote life cycle approaches, encourage approaches such as the circular economy, life cycle and other approaches, as appropriate and taking into account national circumstances and capacities, enable consumers to make sustainable consumption choices, mainstream sustainability practices, encourage sustainable bioeconomy, as well as sustainable and environmentally sound bio-based products and increase resilience across all sectors of the economy, which will contribute to the achievement of the 2030 Agenda and its Sustainable Development Goals, in particular Goal 12;",
    "12": "Welcomes the extension by the General Assembly, in its resolution 76/202 of 17 December 2021, of the mandate of the 10-Year Framework of Programmes on Sustainable Consumption and Production Patterns until 31 December 2030, encourages the implementation of the Framework of Programmes on Sustainable Consumption and Production, in accordance with target 12.1 of Goal 12;",
    "13": "Takes note with appreciation of the United Nations Food Systems Summit +4 Stocktaking Moment, convened by the Secretary-General from 27 to 29 July 2025 in Addis Ababa and co-hosted by the Governments of Ethiopia and Italy, and takes note of the call to action by the Secretary-General entitled \u201cFrom Rome to Addis and beyond\u201d;",
    "14": "Recognizes the important role of the private sector in promoting and utilizing sustainable practices, including for multinational corporations and micro-, small and medium-sized enterprises that may face greater challenges in enhancing resource efficiency, and reiterates the invitation to Member States to take measures, in cooperation with the private sector, to enhance the design of products, taking into account life cycle assessments to contribute to resource efficiency;",
    "15": "Acknowledges the Global Framework on Chemicals \u2013 For a Planet Free of Harm from Chemicals and Waste, including its strategic objectives and targets;",
    "16": "Welcomes the establishment of the Intergovernmental Science-Policy Panel on Chemicals, Waste and Pollution, at the intergovernmental meeting held on 19 and 20 June 2025 in Punta del Este, Uruguay, as mandated by the United Nations Environment Assembly in its resolution 5/8 of 2 March 2022, 24 to strengthen the science-policy interface to contribute further to the sound management of chemicals and waste and to prevent pollution;",
    "17": "Acknowledges the link between plastic waste and pollution and sustainable consumption and production patterns, and calls upon all Member States to continue to step up activities across the life cycle of plastic to prevent, reduce and eliminate plastic pollution, including in the marine environment, including through innovative approaches that foster environmentally sound management, including the reduction, repair, reuse and recycling of plastic waste and products;",
    "18": "Welcomes the decision by the United Nations Environment Assembly at its resumed fifth session, in resolution 5/14 of 2 March 2022, to convene an intergovernmental negotiating committee to develop an international legally binding instrument on plastic pollution, including in the marine environment, which could include both binding and voluntary approaches, based on a comprehensive approach that addresses the full life cycle of plastic, taking into account, among other things, the principles of the Rio Declaration on Environment and Development, as well as national circumstances and capabilities, and underscores the importance of securing an ambitious international legally binding instrument to end plastic pollution, including in the marine environment, while acknowledging that some legal obligations arising out of a new instrument will require capacity-building and technical and financial assistance in order to be effectively implemented by developing countries and countries with economies in transition, and in this regard welcomes the commitment made by Heads of State and Government in the political declaration adopted during the high-level political forum on sustainable development convened under the auspices of the General Assembly to support the work of the intergovernmental negotiating committee, with the ambition of completing its work by the end of 2024;",
    "19": "Urges the international community to continue to support developing countries in strengthening their scientific and technological capacity to move towards more sustainable patterns of consumption and production, and calls for enhanced support to developing countries by providing means of implementation;",
    "20": "Recognizes the need for greater financing, capacity-building, technical assistance and technology transfer on mutually agreed terms for developing countries to harness science, technology and innovation, and information and communication technologies, as well as new and emerging technologies including artificial intelligence, including through scaling up the use of open science, affordable and open-source technology, research and development to accelerate the achievement of the Sustainable Development Goals;",
    "21": "Encourages the further strengthening of the science-policy interface and of the means of implementation from all sources and at all levels, including a revitalized and enhanced Global Partnership, as well as by supporting innovative approaches to sustainability science and emphasizing cross-disciplinary partnerships;",
    "22": "Requests the United Nations system to further mainstream and integrate the three dimensions of sustainable development throughout its work, to continue to exchange experiences and lessons learned in this regard and to step up its efforts at all levels in continued support of the implementation of the 2030 Agenda, including Goal 12, to ensure sustainable consumption and production patterns;",
    "23": "Encourages regional and subregional organizations to continue to promote sustainable development in their respective regions by, inter alia, promoting peer learning and cooperation, including South-South and triangular cooperation, as well as effective linkages among global, regional, subregional and national processes, as appropriate, to advance sustainable development;",
    "24": "Strongly encourages further accelerated actions and multi-stakeholder partnerships at all levels, including with the United Nations system and the international financial system, to advance innovative pathways to achieving sustainable consumption and production, in line with United Nations Environment Assembly resolutions 5/11 of 2 March 2022, entitled \u201cEnhancing circular economy as a contribution to achieving sustainable consumption and production\u201d, 25 and 6/8 of 1 March 2024, entitled \u201cPromoting sustainable lifestyles\u201d 26 as part of accelerated progress towards the 2030 Agenda, thereby creating job opportunities, promoting sustainable business practices and fostering more sustainable and stable global supply chains, and ensuring that people everywhere have the relevant information and awareness about sustainable development and lifestyles in harmony with nature, and in this respect recognizes the need for discussions to further promote sustainable consumption and production with a view to accelerating progress on Sustainable Development Goal 12 and related goals and targets;",
    "25": "Stresses the urgency of promoting sustainable consumption and production approaches, in which products and materials are designed in such a way that they can be reused, remanufactured, recycled or recovered and therefore retained in the economy for as long as possible, along with the resources of which they are made, the generation of waste is avoided or minimized and greenhouse gas emissions are prevented or reduced;",
    "26": "Encourages accelerated action to advance youth employment through skills development for decent jobs in sectors aligned with sustainable consumption and production;",
    "27": "Calls upon Member States, in this regard, in cooperation with educational institutions, the private sector, international community, civil society, as appropriate, to ensure inclusive and equitable access to knowledge, science and information while promoting innovation, critical thinking and life skills that enable youth to actively contribute to sustainable development, in particular in advancing sustainable consumption and production patterns, for the benefit of current and future generations, while supporting and strengthening existing programmes, initiatives and partnerships that facilitate meaningful youth engagement;",
    "28": "Requests the Secretary-General to submit to the General Assembly at its eighty-first session a report on the implementation of the present resolution, with a particular focus on the state of play with regard to sustainable consumption and production and the application and promotion thereof, and to recommend concrete actions to implement the 2030 Agenda in this regard;",
    "29": "Decides to include in the provisional agenda of its eighty-first session, under the item entitled \u201cSustainable development\u201d, the sub-item entitled \u201cTowards the achievement of sustainable development: implementation of the 2030 Agenda for Sustainable Development, including through sustainable consumption and production, building on Agenda 21\u201d."
  },
  "agenda_items": [
    "Item 18"
  ],
  "symbol_references": [
    "A/C.2/80/L.51",
    "A/C.2/80/L.27"
  ]
}