{
  "symbol": "A/C.6/80/L.4",
  "filename": "A_C.6_80_L.4.pdf",
  "title": "Observer status for the International Tropical Timber Organization in the General Assembly",
  "text": "United Nations \nA/C.6/80/L.4 \n \n \nGeneral Assembly \nDistr.: Limited \n8 October 2025 \nOriginal: English \n \n25-16081 (E)    141025     \n*2516081* \n \n \nEightieth session \nSixth Committee \nAgenda item 174 \nObserver status for the International Tropical Timber \nOrganization in the General Assembly \n \n \n \n \n \nAngola, Australia, Austria, Brazil, Canada, Colombia, Ecuador, Finland, \nGermany, Guatemala, Honduras, Indonesia, Japan, Malaysia, New Zealand, \nPeru and Sweden: draft resolution \n \n \n \n Observer status for the International Tropical Timber Organization \nin the General Assembly \n \n \n \nThe General Assembly, \n \nWishing to promote cooperation between the United Nations and the \nInternational Tropical Timber Organization, \n \n1. \nDecides to invite the International Tropical Timber Organization to \nparticipate in the sessions and the work of the General Assembly in the capacity of \nobserver;  \n \n2. \nRequests the Secretary-General to take the action necessary to implement \nthe present resolution. \n \n",
  "paragraphs": {
    "1": "Decides to invite the International Tropical Timber Organization to participate in the sessions and the work of the General Assembly in the capacity of observer;",
    "2": "Requests the Secretary-General to take the action necessary to implement the present resolution."
  },
  "agenda_items": [
    "Item 174"
  ],
  "symbol_references": [
    "A/C.6/80/L.4"
  ]
}