{
  "symbol": "A/C.3/80/L.34",
  "filename": "A_C.3_80_L.34.pdf",
  "title": "Strengthening United Nations action in the field of human rights through the promotion of international cooperation and the importance of non-selectivity, impartiality and objectivity",
  "text": "United Nations \nA/C.3/80/L.34\n \n \nGeneral Assembly \nDistr.: Limited \n4 November 2025 \nOriginal: English \n \n25-17756 (E)    101125     \n*2517756* \n \n \nEightieth session \nThird Committee \nAgenda item 71 (b) \nPromotion and protection of human rights: human rights \nquestions, including alternative approaches for improving \nthe effective enjoyment of human rights and \nfundamental freedoms \n \n \n \n \n \nBolivia (Plurinational State of), Cuba, Venezuela (Bolivarian Republic of) and \nViet Nam: draft resolution \n \n \n \n Strengthening United Nations action in the field of human rights \nthrough the promotion of international cooperation and the \nimportance of non-selectivity, impartiality and objectivity \n \n \n \nThe General Assembly, \n \nBearing in mind that among the purposes of the United Nations are those of \ndeveloping friendly relations among nations based on respect for the principle of \nequal rights and self-determination of peoples and taking other appropriate measures \nto strengthen universal peace, as well as achieving international cooperation in \nsolving international problems of an economic, social, cultural or humanitarian \ncharacter and in promoting and encouraging respect for human rights and \nfundamental freedoms for all without distinction as to race, sex, language or religion, \n \nDesirous of achieving further progress in international cooperation in promoting \nand encouraging respect for all human rights and fundamental freedoms for all, \n \nConsidering that such international cooperation should be based on the \nprinciples embodied in international law, especially the Charter of the United Nations, \nas well as the Universal Declaration of Human Rights, 1 the International Covenants \non Human Rights2 and other relevant instruments, \n \nDeeply convinced that United Nations action in the field of human rights should \nbe based not only on a profound understanding of the broad range of problems \nexisting in all societies but also on full respect for the political, economic and social \nrealities of each of them, in strict compliance with the purposes and principles of the \nCharter and for the basic purpose of promoting and encouraging respect for human \nrights and fundamental freedoms through international cooperation, \n__________________ \n \n1  Resolution 217 A (III). \n \n2  Resolution 2200 A (XXI), annex. \n\nA/C.3/80/L.34 \n \n25-17756\n2/3 \n \n \nRecalling its previous resolutions in this regard, including resolution 78/197 of \n19 December 2023, \n \nReaffirming the importance of ensuring the universality, objectivity and \nnon-selectivity of the consideration of human rights issues, as affirmed in the Vienna \nDeclaration and Programme of Action adopted by the World Conference on Human \nRights on 25 June 1993,3 and the elimination of double standards, \n \nReaffirming also the importance of the objectivity, independence, impartiality \nand discretion of the special rapporteurs and representatives on thematic issues and \non countries, as well as of the members of the working groups, in carrying out their \nmandates, \n \nRecalling that the 2030 Agenda for Sustainable Development 4  calls for a \nrevitalized Global Partnership for Sustainable Development, and emphasizing the \nimportance of international cooperation in realizing the Agenda, including the \nSustainable Development Goals, \n \nUnderlining the obligation that Governments have to promote and protect \nhuman rights and to carry out the responsibilities that they have undertaken under \ninternational law, especially the Charter, as well as various international instruments \nin the field of human rights, \n \n1. \nTakes note of the report of the Secretary-General;5 \n \n2. \nReiterates that, by virtue of the principle of equal rights and \nself-determination of peoples enshrined in the Charter of the United Nations, all \npeoples have the right freely to determine, without external interference, their \npolitical status and to pursue their economic, social and cultural development, and \nthat every State has the duty to respect that right within the provisions of the Charter, \nincluding respect for territorial integrity; \n \n3. \nReaffirms that it is a purpose of the United Nations and the task of all \nMember States, in cooperation with the Organization, to promote and encourage \nrespect for all human rights and fundamental freedoms for all and to remain vigilant \nwith regard to violations of human rights wherever they occur; \n \n4. \nCalls upon all Member States to base their activities for the promotion and \nprotection of human rights, including the development of further international \ncooperation in this field, on the Charter of the United Nations, the Universal \nDeclaration of Human Rights, the International Covenant on Economic, Social and \nCultural Rights,6 the International Covenant on Civil and Political Rights 7 and other \nrelevant international instruments, and to refrain from activities that are inconsistent \nwith that international framework; \n \n5. \nConsiders that international cooperation in this field should make an \neffective and practical contribution to the urgent task of preventing mass and flagrant \nviolations of all human rights and fundamental freedoms for all and to the \nstrengthening of international peace and security; \n \n6. \nReaffirms that the promotion, protection and full realization of all human \nrights and fundamental freedoms for all, as a legitimate concern of the world \n__________________ \n \n3  A/CONF.157/24 (Part I), chap. III. \n \n4  Resolution 70/1. \n \n5  A/80/304. \n \n6  See resolution 2200 A (XXI), annex. \n \n7  Ibid. \n\nA/C.3/80/L.34\n \n3/3\n25-17756 \n \ncommunity, should be guided by the principles of non-selectivity, impartiality and \nobjectivity and should not be used for political ends; \n \n7. \nRequests all human rights bodies within the United Nations system, as well \nas the special rapporteurs and representatives, independent experts and working \ngroups, to take duly into account the contents of the present resolution in carrying out \ntheir mandates; \n \n8. \nExpresses its conviction that an unbiased and fair approach to human rights \nissues contributes to the promotion of international cooperation as well as to the \neffective promotion, protection and realization of all human rights and fundamental \nfreedoms for all; \n \n9. \nStresses the continuing need for impartial and objective information on the \npolitical, economic and social situations and events of all countries, and in this \ncontext highlights the role of the media in raising public awareness of issues of public \ninterest; \n \n10. Invites Member States to consider adopting, as appropriate, within the \nframework of their respective legal systems and in accordance with their obligations \nunder international law, especially the Charter, and international human rights \ninstruments, the measures that they may deem appropriate to achieve further progress \nin international cooperation in promoting and encouraging respect for all human \nrights and fundamental freedoms for all; \n \n11. \nRequests the Human Rights Council to continue taking duly into account \nthe present resolution and to consider further proposals for the strengthening of \nUnited Nations action in the field of human rights through the promotion of \ninternational cooperation and the importance of the principles of non-selectivity, \nimpartiality and objectivity, including in the context of the universal periodic review; \n \n12. Requests \nthe \nSecretary-General \nto \ninvite \nMember \nStates \nand \nintergovernmental and non-governmental organizations to present further practical \nproposals and ideas that would contribute to the strengthening of United Nations \naction in the field of human rights through the promotion of international cooperation \nbased on the principles of non-selectivity, impartiality and objectivity, and to submit \na comprehensive report on the question to the General Assembly at its eighty-second \nsession; \n \n13. Decides to consider the matter at its eighty-second session under the item \nentitled \u201cPromotion and protection of human rights\u201d. \n \n",
  "paragraphs": {
    "1": "Takes note of the report of the Secretary-General;5",
    "2": "Reiterates that, by virtue of the principle of equal rights and self-determination of peoples enshrined in the Charter of the United Nations, all peoples have the right freely to determine, without external interference, their political status and to pursue their economic, social and cultural development, and that every State has the duty to respect that right within the provisions of the Charter, including respect for territorial integrity;",
    "3": "Reaffirms that it is a purpose of the United Nations and the task of all Member States, in cooperation with the Organization, to promote and encourage respect for all human rights and fundamental freedoms for all and to remain vigilant with regard to violations of human rights wherever they occur;",
    "4": "Calls upon all Member States to base their activities for the promotion and protection of human rights, including the development of further international cooperation in this field, on the Charter of the United Nations, the Universal Declaration of Human Rights, the International Covenant on Economic, Social and Cultural Rights,6 the International Covenant on Civil and Political Rights 7 and other relevant international instruments, and to refrain from activities that are inconsistent with that international framework;",
    "5": "Considers that international cooperation in this field should make an effective and practical contribution to the urgent task of preventing mass and flagrant violations of all human rights and fundamental freedoms for all and to the strengthening of international peace and security;",
    "6": "Reaffirms that the promotion, protection and full realization of all human rights and fundamental freedoms for all, as a legitimate concern of the world __________________ 3 A/CONF.157/24 (Part I), chap. III. 4 Resolution 70/1. 5 A/80/304. 6 See resolution 2200 A (XXI), annex. 7 Ibid. A/C.3/80/L.34 3/3 25-17756 community, should be guided by the principles of non-selectivity, impartiality and objectivity and should not be used for political ends;",
    "7": "Requests all human rights bodies within the United Nations system, as well as the special rapporteurs and representatives, independent experts and working groups, to take duly into account the contents of the present resolution in carrying out their mandates;",
    "8": "Expresses its conviction that an unbiased and fair approach to human rights issues contributes to the promotion of international cooperation as well as to the effective promotion, protection and realization of all human rights and fundamental freedoms for all;",
    "9": "Stresses the continuing need for impartial and objective information on the political, economic and social situations and events of all countries, and in this context highlights the role of the media in raising public awareness of issues of public interest;",
    "10": "Invites Member States to consider adopting, as appropriate, within the framework of their respective legal systems and in accordance with their obligations under international law, especially the Charter, and international human rights instruments, the measures that they may deem appropriate to achieve further progress in international cooperation in promoting and encouraging respect for all human rights and fundamental freedoms for all;",
    "11": "Requests the Human Rights Council to continue taking duly into account the present resolution and to consider further proposals for the strengthening of United Nations action in the field of human rights through the promotion of international cooperation and the importance of the principles of non-selectivity, impartiality and objectivity, including in the context of the universal periodic review;",
    "12": "Requests the Secretary-General to invite Member States and intergovernmental and non-governmental organizations to present further practical proposals and ideas that would contribute to the strengthening of United Nations action in the field of human rights through the promotion of international cooperation based on the principles of non-selectivity, impartiality and objectivity, and to submit a comprehensive report on the question to the General Assembly at its eighty-second session;",
    "13": "Decides to consider the matter at its eighty-second session under the item entitled \u201cPromotion and protection of human rights\u201d."
  },
  "agenda_items": [
    "Item 71"
  ],
  "symbol_references": [
    "A/C.3/80/L.34"
  ]
}