{
  "symbol": "A/C.6/80/L.3",
  "filename": "A_C.6_80_L.3.pdf",
  "title": "Observer status for the International Centre for Integrated Mountain Development in the General Assembly",
  "text": "United Nations \nA/C.6/80/L.3 \n \n \nGeneral Assembly \nDistr.: Limited \n8 October 2025 \nOriginal: English \n \n25-16080 (E)    141025 \n*2516080* \n \n \nEightieth session \nSixth Committee \nAgenda item 171 \nObserver status for the International Centre for Integrated \nMountain Development in the General Assembly \n \n \n \n \n \nAfghanistan, Bhutan, Kazakhstan, Kyrgyzstan, Nepal and Pakistan: \ndraft resolution \n \n \n \n Observer status for the International Centre for Integrated \nMountain Development in the General Assembly \n \n \n \nThe General Assembly, \n \nWishing to promote cooperation between the United Nations and the \nInternational Centre for Integrated Mountain Development, \n \n1. \nDecides to invite the International Centre for Integrated Mountain \nDevelopment to participate in the sessions and the work of the General Assembly in \nthe capacity of observer;  \n \n2. \nRequests the Secretary-General to take the action necessary to implement \nthe present resolution. \n \n",
  "paragraphs": {
    "1": "Decides to invite the International Centre for Integrated Mountain Development to participate in the sessions and the work of the General Assembly in the capacity of observer;",
    "2": "Requests the Secretary-General to take the action necessary to implement the present resolution."
  },
  "agenda_items": [
    "Item 171"
  ],
  "symbol_references": [
    "A/C.6/80/L.3"
  ]
}