{
  "symbol": "A/C.3/80/L.42",
  "filename": "A_C.3_80_L.42.pdf",
  "title": "Use of mercenaries as a means of violating human rights and impeding the exercise of the right of peoples to self-determination",
  "text": "United Nations \nA/C.3/80/L.42\n \n \nGeneral Assembly \nDistr.: Limited \n4 November 2025 \nOriginal: English \n \n25-17766 (E)    121125     \n*2517766* \n \n \nEightieth session \nThird Committee \nAgenda item 70 \nRight of peoples to self-determination \n \n \n \n \n \nBelarus, China, Cuba, Equatorial Guinea, Venezuela (Bolivarian Republic of) \nand Viet Nam: draft resolution \n \n \n \n Use of mercenaries as a means of violating human rights and \nimpeding the exercise of the right of peoples to self-determination \n \n \n \nThe General Assembly, \n \nRecalling all of its previous resolutions on the subject, including resolution \n79/162 of 17 December 2024, and Human Rights Council resolutions on the subject, \nincluding resolution 60/5 of 6 October 2025,1 as well as all resolutions adopted by the \nCommission on Human Rights in this regard, \n \nRecalling also all of its relevant resolutions, in which, inter alia, it condemned \nany State that permitted or tolerated the recruitment, financing, training, assembly, \ntransit or use of mercenaries with the objective of overthrowing the Governments of \nStates Members of the United Nations, especially those of developing countries, or \nof fighting against national liberation movements, and recalling further the relevant \nresolutions and international instruments adopted by the General Assembly, the \nSecurity Council, the Economic and Social Council and the Organization of African \nUnity, inter alia, the Organization of African Unity Convention for the elimination of \nmercenarism in Africa,2 as well as by the African Union, \n \nReaffirming the purposes and principles enshrined in the Charter of the United \nNations concerning the strict observance of the principles of sovereign equality, \npolitical independence, the territorial integrity of States, the self-determination of \npeoples, the non-use of force or of the threat of use of force in international relations \nand non-interference in affairs within the domestic jurisdiction of States, \n \nReaffirming also that, by virtue of the principle of self-determination, all \npeoples have the right freely to determine their political status and to pursue their \neconomic, social and cultural development and that every State has the duty to respect \nthis right in accordance with the provisions of the Charter, \n__________________ \n \n1  See Official Records of the General Assembly, Eightieth Session, Supplement No. 53A \n(A/80/53/Add.1), chap. III, sect. A. \n \n2  United Nations, Treaty Series, vol. 1490, No. 25573. \n\nA/C.3/80/L.42 \n \n25-17766\n2/4 \n \n \nDeeply concerned at the continuation of acts or threats of foreign military \nintervention and occupation that are threatening to suppress, or have already \nsuppressed, the right to self-determination of peoples and nations, \n \nReaffirming the Declaration on Principles of International Law concerning \nFriendly Relations and Cooperation among States in accordance with the Charter of \nthe United Nations,3 \n \nAcknowledging with appreciation the work and contributions of the open-ended \nintergovernmental working group established by the Human Rights Council with the \nmandate of considering the possibility of elaborating an international regulatory \nframework, including the option of elaborating a legally binding instrument on the \nregulation, monitoring and oversight of the activities of private military and security \ncompanies, \n \nAlarmed and concerned at the danger that the activities of mercenaries \nconstitute to peace and security in developing countries in various parts of the world, \nin particular in areas of armed conflict, and about the threat they pose to the integrity \nof and respect for the constitutional order of the affected countries, \n \nDeeply concerned at the loss of life, the substantial damage to property and the \nnegative effects on the policies and economies of affected countries resulting from \ninternational criminal mercenary activities, \n \nConvinced that, notwithstanding the way in which mercenaries or mercenary-\nrelated activities are used or the form that they take to acquire some semblance of \nlegitimacy, they are a threat to peace, security and the self-determination of peoples \nand an obstacle to the enjoyment of all human rights by peoples, \n \n1. \nTakes note with appreciation of the latest report of the Working Group of \nthe Human Rights Council on the use of mercenaries as a means of violating human \nrights and impeding the exercise of the right of peoples to self-determination;4 \n \n2. \nReaffirms that the use of mercenaries and their recruitment, financing, \nprotection and training are causes for grave concern to all States and that they violate \nthe purposes and principles enshrined in the Charter of the United Nations; \n \n3. \nRecognizes that armed conflict, terrorism, arms trafficking and covert \noperations by third Powers encourage, inter alia, the demand for mercenaries on the \nglobal market; \n \n4. \nUrges, once again, all States to take the steps necessary and to exercise the \nutmost vigilance against the menace posed by the activities of mercenaries and to take \nlegislative measures to ensure that their territories and other territories under their \ncontrol are not used for, and that their nationals do not take part in, the recruitment, \nassembly, financing, training, protection or transit of mercenaries for the planning of \nactivities designed to impede the right of peoples to self-determination, to destabilize \nor overthrow the Government of any State or to dismember or impair, totally or in \npart, the territorial integrity or political unity of sovereign and independent States \nconducting themselves in accordance with the right of peoples to self-determination; \n \n5. \nRequests all States to exercise the utmost vigilance against any kind of \nrecruitment, training, hiring or financing of mercenaries by private companies \noffering international military consultancy and security services, and to impose a \nspecific ban on such companies intervening in armed conflicts or actions to \ndestabilize constitutional regimes; \n__________________ \n \n3  Resolution 2625 (XXV), annex. \n \n4  A/80/329. \n\nA/C.3/80/L.42\n \n3/4\n25-17766 \n \n \n6. \nEncourages States that import military assistance or consultancy and \nsecurity services provided by private companies to establish national regulatory \nmechanisms for registering and licensing those companies in order to ensure that the \nimported services provided by those private companies neither impede the enjoyment \nof human rights nor violate human rights in the recipient country; \n \n7. \nEmphasizes its utmost concern about the impact of the activities of private \nmilitary and security companies on the enjoyment of human rights, in particular when \noperating in armed conflicts, and notes that private military and security companies \nand their personnel are rarely held accountable for violations of human rights; \n \n8. \nCalls upon all States that have not yet done so to consider acceding to or \nratifying the International Convention against the Recruitment, Use, Financing and \nTraining of Mercenaries;5 \n \n9. \nWelcomes the cooperation extended by those countries that have received \na visit by the Working Group on the use of mercenaries since the establishment of its \nmandate and the adoption by some States of national legislation that restricts the \nrecruitment, assembly, financing, training and transit of mercenaries; \n \n10. Condemns recent mercenary activities in developing countries in various \nparts of the world, in particular in areas of conflict, and the threat they pose to the \nintegrity of and respect for the constitutional order of those countries and the exercise \nof the right of their peoples to self-determination, and stresses the importance for the \nWorking Group on the use of mercenaries of looking into sources and root causes, as \nwell as the political motivations of mercenaries and for mercenary-related activities; \n \n11. \nCalls upon States to investigate the possibility of mercenary involvement \nwhenever and wherever criminal acts of a terrorist nature occur and to bring to trial \nthose found responsible or to consider their extradition, if so requested, in accordance \nwith national law and applicable bilateral or international treaties; \n \n12. Condemns any form of impunity granted to perpetrators of mercenary \nactivities and to those responsible for the use, recruitment, financing and training of \nmercenaries, and urges all States, in accordance with their obligations under \ninternational law, to bring them, without distinction, to justice; \n \n13. Calls upon Member States, in accordance with their obligations under \ninternational law, to cooperate with and assist the judicial prosecution of those \naccused of mercenary activities in transparent, open and fair trials; \n \n14. Requests the Working Group on the use of mercenaries and other experts \nto continue their participation, including by submitting contributions, in other \nsubsidiary bodies of the Human Rights Council considering issues related to the use \nof mercenaries and mercenary-related activities in all their forms and manifestations, \nincluding private military and security companies; \n \n15. Requests the Working Group on the use of mercenaries to continue its work \nwith respect to the strengthening of the international legal framework for the \nprevention and sanction of the recruitment, use, financing and training of \nmercenaries, taking into account the proposal for a new legal definition of a \nmercenary drafted by the Special Rapporteur on the use of mercenaries as a means of \nimpeding the exercise of the right of peoples to self-determination in his report \nsubmitted to the Commission on Human Rights at its sixtieth session 6  and the \nevolving phenomenon of mercenaries and its related forms; \n__________________ \n \n5  United Nations, Treaty Series, vol. 2163, No. 37789. \n \n6  See E/CN.4/2004/15, para. 47. \n\nA/C.3/80/L.42 \n \n25-17766\n4/4 \n \n \n16. Also requests the Working Group on the use of mercenaries to continue to \nstudy and identify sources and causes, emerging issues, manifestations and trends \nregarding mercenaries or mercenary-related activities and private military and \nsecurity companies and their impact on human rights, particularly on the right of \npeoples to self-determination; \n \n17. Requests the Office of the United Nations High Commissioner for Human \nRights, as a matter of priority, to publicize the adverse effects of the activities of \nmercenaries on the right of peoples to self-determination and, when requested and \nwhere necessary, to render advisory services to States that are affected by those \nactivities; \n \n18. Recommends that all Member States, including those confronted with the \nphenomenon of private military and security companies, as contracting States, States \nof operations, home States or States whose nationals are employed to work for a \nprivate military and security company, contribute to the work of the open-ended \nintergovernmental working group, taking into account the initial work done by the \nWorking Group on the use of mercenaries; \n \n19. Urges all States to cooperate fully with the Working Group on the use of \nmercenaries in the fulfilment of its mandate; \n \n20. Requests \nthe \nSecretary-General \nand \nthe \nUnited \nNations \nHigh \nCommissioner for Human Rights to continue to provide the Working Group on the \nuse of mercenaries with all the assistance and support necessary for the fulfilment of \nits mandate, both professional and financial, including through the promotion of \ncooperation between the Working Group and other components of the United Nations \nsystem that deal with countering mercenary-related activities, in order to meet the \ndemands of its current and future activities; \n \n21. Requests the Working Group on the use of mercenaries to consult States \nand intergovernmental and non-governmental organizations on the implementation of \nthe present resolution and to report, with specific recommendations, to the General \nAssembly at its eighty-first session its findings on the use of mercenaries to \nundermine the enjoyment of all human rights and to impede the exercise of the right \nof peoples to self-determination; \n \n22. Decides to consider the question of the use of mercenaries as a means of \nviolating human rights and impeding the exercise of the right of peoples to self-\ndetermination at its eighty-first session under the item entitled \u201cRight of peoples to \nself-determination\u201d. \n \n",
  "paragraphs": {
    "1": "Takes note with appreciation of the latest report of the Working Group of the Human Rights Council on the use of mercenaries as a means of violating human rights and impeding the exercise of the right of peoples to self-determination;4",
    "2": "Reaffirms that the use of mercenaries and their recruitment, financing, protection and training are causes for grave concern to all States and that they violate the purposes and principles enshrined in the Charter of the United Nations;",
    "3": "Recognizes that armed conflict, terrorism, arms trafficking and covert operations by third Powers encourage, inter alia, the demand for mercenaries on the global market;",
    "4": "Urges, once again, all States to take the steps necessary and to exercise the utmost vigilance against the menace posed by the activities of mercenaries and to take legislative measures to ensure that their territories and other territories under their control are not used for, and that their nationals do not take part in, the recruitment, assembly, financing, training, protection or transit of mercenaries for the planning of activities designed to impede the right of peoples to self-determination, to destabilize or overthrow the Government of any State or to dismember or impair, totally or in part, the territorial integrity or political unity of sovereign and independent States conducting themselves in accordance with the right of peoples to self-determination;",
    "5": "Requests all States to exercise the utmost vigilance against any kind of recruitment, training, hiring or financing of mercenaries by private companies offering international military consultancy and security services, and to impose a specific ban on such companies intervening in armed conflicts or actions to destabilize constitutional regimes;",
    "6": "Encourages States that import military assistance or consultancy and security services provided by private companies to establish national regulatory mechanisms for registering and licensing those companies in order to ensure that the imported services provided by those private companies neither impede the enjoyment of human rights nor violate human rights in the recipient country;",
    "7": "Emphasizes its utmost concern about the impact of the activities of private military and security companies on the enjoyment of human rights, in particular when operating in armed conflicts, and notes that private military and security companies and their personnel are rarely held accountable for violations of human rights;",
    "8": "Calls upon all States that have not yet done so to consider acceding to or ratifying the International Convention against the Recruitment, Use, Financing and Training of Mercenaries;5",
    "9": "Welcomes the cooperation extended by those countries that have received a visit by the Working Group on the use of mercenaries since the establishment of its mandate and the adoption by some States of national legislation that restricts the recruitment, assembly, financing, training and transit of mercenaries;",
    "10": "Condemns recent mercenary activities in developing countries in various parts of the world, in particular in areas of conflict, and the threat they pose to the integrity of and respect for the constitutional order of those countries and the exercise of the right of their peoples to self-determination, and stresses the importance for the Working Group on the use of mercenaries of looking into sources and root causes, as well as the political motivations of mercenaries and for mercenary-related activities;",
    "11": "Calls upon States to investigate the possibility of mercenary involvement whenever and wherever criminal acts of a terrorist nature occur and to bring to trial those found responsible or to consider their extradition, if so requested, in accordance with national law and applicable bilateral or international treaties;",
    "12": "Condemns any form of impunity granted to perpetrators of mercenary activities and to those responsible for the use, recruitment, financing and training of mercenaries, and urges all States, in accordance with their obligations under international law, to bring them, without distinction, to justice;",
    "13": "Calls upon Member States, in accordance with their obligations under international law, to cooperate with and assist the judicial prosecution of those accused of mercenary activities in transparent, open and fair trials;",
    "14": "Requests the Working Group on the use of mercenaries and other experts to continue their participation, including by submitting contributions, in other subsidiary bodies of the Human Rights Council considering issues related to the use of mercenaries and mercenary-related activities in all their forms and manifestations, including private military and security companies;",
    "15": "Requests the Working Group on the use of mercenaries to continue its work with respect to the strengthening of the international legal framework for the prevention and sanction of the recruitment, use, financing and training of mercenaries, taking into account the proposal for a new legal definition of a mercenary drafted by the Special Rapporteur on the use of mercenaries as a means of impeding the exercise of the right of peoples to self-determination in his report submitted to the Commission on Human Rights at its sixtieth session 6 and the evolving phenomenon of mercenaries and its related forms;",
    "16": "Also requests the Working Group on the use of mercenaries to continue to study and identify sources and causes, emerging issues, manifestations and trends regarding mercenaries or mercenary-related activities and private military and security companies and their impact on human rights, particularly on the right of peoples to self-determination;",
    "17": "Requests the Office of the United Nations High Commissioner for Human Rights, as a matter of priority, to publicize the adverse effects of the activities of mercenaries on the right of peoples to self-determination and, when requested and where necessary, to render advisory services to States that are affected by those activities;",
    "18": "Recommends that all Member States, including those confronted with the phenomenon of private military and security companies, as contracting States, States of operations, home States or States whose nationals are employed to work for a private military and security company, contribute to the work of the open-ended intergovernmental working group, taking into account the initial work done by the Working Group on the use of mercenaries;",
    "19": "Urges all States to cooperate fully with the Working Group on the use of mercenaries in the fulfilment of its mandate;",
    "20": "Requests the Secretary-General and the United Nations High Commissioner for Human Rights to continue to provide the Working Group on the use of mercenaries with all the assistance and support necessary for the fulfilment of its mandate, both professional and financial, including through the promotion of cooperation between the Working Group and other components of the United Nations system that deal with countering mercenary-related activities, in order to meet the demands of its current and future activities;",
    "21": "Requests the Working Group on the use of mercenaries to consult States and intergovernmental and non-governmental organizations on the implementation of the present resolution and to report, with specific recommendations, to the General Assembly at its eighty-first session its findings on the use of mercenaries to undermine the enjoyment of all human rights and to impede the exercise of the right of peoples to self-determination;",
    "22": "Decides to consider the question of the use of mercenaries as a means of violating human rights and impeding the exercise of the right of peoples to self- determination at its eighty-first session under the item entitled \u201cRight of peoples to self-determination\u201d."
  },
  "agenda_items": [
    "Item 70"
  ],
  "symbol_references": [
    "A/C.3/80/L.42"
  ]
}