{
  "symbol": "A/C.5/80/L.5",
  "filename": "A_C.5_80_L.5.pdf",
  "title": "informal consultations",
  "text": "United Nations \nA/C.5/80/L.5\n \n \nGeneral Assembly \nDistr.: Limited \n29 December 2025 \nOriginal: English \n \n25-21159 (E)    050126 \n*2521159* \n \n \nEightieth session \nFifth Committee \nAgenda item 136 \nProposed programme budget for 2026 \n \n \n \n \n \nDraft resolution submitted by the Chair of the Committee following \ninformal consultations \n \n \n \n Special subjects relating to the proposed programme budget \nfor 2026 \n \n \n \nThe General Assembly, \n \n \n \nI \n \n \nConditions of service and compensation for officials other than Secretariat \nofficials: members of the International Court of Justice and President and judges \nof the International Residual Mechanism for Criminal Tribunals \n \n \nRecalling its resolutions 37/240 of 21 December 1982, 40/257 A to C of \n18 December 1985, 45/250 A to C of 21 December 1990 and 48/252 A to C of 26 May \n1994, section VIII of its resolution 53/214 of 18 December 1998, its resolutions \n55/249 of 12 April 2001, 56/285 of 27 June 2002, 57/289 of 20 December 2002 and \n58/264 of 23 December 2003, section III of its resolution 59/282 of 13 April 2005, its \nresolutions 61/262 of 4 April 2007, 63/259 of 24 December 2008, 64/261 of 29 March \n2010 and 65/258 of 24 December 2010, section VI of its resolution 71/272 A of \n23 December 2016, section II of its resolution 75/253 B of 16 April 2021 and section \nIII of its resolution 77/263 B of 18 April 2023,  \n \nRecalling also Article 32 of the Statute of the International Court of Justice, as \nwell as relevant resolutions of the General Assembly that govern the conditions of \nservice and compensation for the members of the International Court of Justice and \nfor the President and judges of the International Residual Mechanism for Criminal \nTribunals,  \n \nHaving considered the report of the Secretary-General on conditions of service \nand compensation for officials other than Secretariat officials: members of the \nInternational Court of Justice and President and judges of the International Residual \nMechanism for Criminal Tribunals1 and the related report of the Advisory Committee \non Administrative and Budgetary Questions,2  \n__________________ \n \n1  A/80/313. \n \n2  A/80/7/Add.17. \n\nA/C.5/80/L.5 \n \n25-21159\n2/21 \n \n \n1. \nTakes note of the report of the Secretary-General;  \n \n2. \nEndorses the conclusions and recommendations contained in the report of \nthe Advisory Committee on Administrative and Budgetary Questions;  \n \n3. \nRequests the Secretary-General to submit his report on conditions of \nservice and compensation for officials other than Secretariat officials: members of the \nInternational Court of Justice and President and judges of the International Residual \nMechanism for Criminal Tribunals to the General Assembly every five years;  \n \n \n \nII \n \n \nStrategic heritage plan of the United Nations Office at Geneva \n \n \nRecalling part XI of its resolution 64/243 of 24 December 2009, section VII of \nits resolution 66/247 of 24 December 2011, section V of its resolution 68/247 A of \n27 December 2013, sections III and VII of its resolution 69/262 of 29 December 2014, \nsection X of its resolution 70/248 A of 23 December 2015, section XVIII of its \nresolution 71/272 A, section XVI of its resolution 72/262 A of 24 December 2017, \nsection XIII of its resolution 73/279 A of 22 December 2018, section VII of its \nresolution 74/263 of 27 December 2019, section IX of its resolution 75/253 A of \n31 December 2020, section XVIII of its resolution 76/246 A of 24 December 2021, \nsection VI of its resolution 77/263 A of 30 December 2022, section XIX of its \nresolution 78/253 of 22 December 2023, section XVII of its resolution 79/258 A of \n24 December 2024 and its resolution 79/297 of 30 June 2025, \n \nHaving considered the twelfth annual progress report of the Secretary-General \non the strategic heritage plan of the United Nations Office at Geneva 3 and the related \nreport of the Advisory Committee,4 \n \n1. \nTakes note of the report of the Secretary-General;  \n \n2. \nEndorses the conclusions and recommendations contained in the report of \nthe Advisory Committee;  \n \n3. \nAppropriates the amount of 82,193,200 United States dollars (equivalent \nto 63,592,900 Swiss francs) for 2026, under section 33, Construction, alteration, \nimprovement and major maintenance, of the proposed programme budget for 2026; \n \n \n \nIII \n \n \nConditions of service and compensation for officials, other than Secretariat \nofficials, serving the General Assembly: full-time members of the International \nCivil Service Commission and the Chair of the Advisory Committee on \nAdministrative and Budgetary Questions \n \n \nRecalling its resolution 35/221 of 17 December 1980, section VII of its \nresolution 55/238 of 23 December 2000, its resolution 58/266 of 23 December 2003, \nsection III of its resolution 65/268 of 4 April 2011, its resolution 68/247 A and section \nII of its resolution 72/262 A,  \n \nHaving considered the report of the Secretary-General,5  \n \n1. \nTakes note of the report of the Secretary-General;  \n \n2. \nRequests the Secretary-General to submit his report on conditions of \nservice and compensation for officials, other than Secretariat officials, serving the \nGeneral Assembly: full-time members of the International Civil Service Commission \n__________________ \n \n3  A/80/435. \n \n4  A/80/7/Add.23. \n \n5  A/80/178. \n\nA/C.5/80/L.5\n \n3/21\n25-21159 \n \nand the Chair of the Advisory Committee on Administrative and Budgetary Questions \nto the General Assembly every five years; \n \n \n \nIV \n \n \nRequest for a subvention to the Extraordinary Chambers in the Courts \nof Cambodia \n \n \nRecalling section I of its resolution 68/247 B of 9 April 2014, section I of its \nresolution 69/274 A of 2 April 2015, section IV of its resolution 70/248 A, section II \nof its resolution 71/272 A, section IX of its resolution 72/262 A, section IV of its \nresolution 73/279 A, section V of its resolution 74/263, section XX of its resolution \n75/253 A, section XII of its resolution 76/246 A, section IV of its resolution 77/263 A, \nsection IV of its resolution 78/253 and section III of its resolution 79/258 A, \n \nHaving considered the report of the Secretary-General on the use of the \ncommitment authority and request for a subvention to the Extraordinary Chambers in \nthe Courts of Cambodia6 and the related report of the Advisory Committee,7  \n \n1. \nTakes note of the report of the Secretary-General;  \n \n2. \nEndorses the conclusions and recommendations contained in the report of \nthe Advisory Committee;  \n \n3. \nReaffirms the high priority accorded to the work of the Extraordinary \nChambers in the Courts of Cambodia;  \n \n4. \nNotes with appreciation the sustained contributions of the Government of \nCambodia, as the host country, for the Extraordinary Chambers;  \n \n5. \nWelcomes the efforts of the Secretary-General and the Royal Government \nof Cambodia towards completion of the work of the Extraordinary Chambers, \nincluding with regard to the drawdown of activities and the residual functions \nrequiring performance;  \n \n6. \nEncourages the Secretary-General and the Royal Government of \nCambodia to take all the measures necessary to fully implement the Addendum to the \nAgreement between the United Nations and the Royal Government of Cambodia \nconcerning the Prosecution under Cambodian Law of Crimes Committed during the \nPeriod of Democratic Kampuchea on the Transitional Arrangements and the \nCompletion of Work of the Extraordinary Chambers (the Addendum) 8 with a view to \nworking towards the completion of the remaining residual functions and ensuring an \norderly and timely transition to the new Cambodian institution;  \n \n7. \nNotes that the resources requested by the Secretary-General are important \nfor sustaining the residual functions of the Extraordinary Chambers in 2026, including \nthe historic preservation and conservation of its archives as a shared global \nresponsibility to advance the cause of international justice; \n \n8.  \nWelcomes the intention of the Royal Government of Cambodia to establish \na permanent public independent institution to, among other tasks, serve as a research \ncentre, as well as the principal repository for the public to access information on the \nCambodian accountability process, and encourages the Royal Government of \nCambodia to take steps in that respect;  \n \n9. \nRecalls paragraph 9 of the report of the Advisory Committee, stresses the \nimportance of maintaining and preserving the records of the Extraordinary Chambers, \n__________________ \n \n6  A/80/441. \n \n7  A/80/7/Add.25. \n \n8  Resolution 75/257 B, annex. \n\nA/C.5/80/L.5 \n \n25-21159\n4/21 \n \nand recalls the importance of making those documents easily accessible for the \ngeneral public;  \n \n10. Also recalls paragraph 12 of the report of the Advisory Committee, \nexpresses concern over the steady decline in the levels of voluntary contributions, and \nrequests the Secretary-General to continue to intensify his efforts to obtain additional \nvoluntary contributions, including by broadening the donor base;  \n \n11. \nEncourages all Member States to provide continuing and additional \nvoluntary support for both the international and national components of the \nExtraordinary Chambers in support of the expeditious completion of the mandate of \nthe Chambers;  \n \n12. Welcomes all financial and in-kind contributions to support the work of the \nExtraordinary Chambers;  \n \n13. Stresses the continued importance of in-person engagement for outreach \nactivities and in-country information dissemination activities by the Extraordinary \nChambers to effectively carry out its core residual function;  \n \n14. Encourages the Extraordinary Chambers to continue to adopt appropriate \nmeasures for achieving operational savings and efficiencies while properly carrying \nout the residual functions in a transparent, accountable, cost-effective and expeditious \nmanner, with a view to a timely completion of the residual phase;  \n \n15. Authorizes the Secretary-General, to enter into commitments in an amount \nnot exceeding 1,856,700 dollars to supplement the voluntary financial resources of \nthe international component of the Extraordinary Chambers for the period from \n1 January to 31 December 2026, so as to enable the Chambers to carry out its judicial \nmandate, and requests the Secretary-General to report on the use of the commitment \nauthority in the context of the next report; \n \n \n \nV \n \n \nRequest for a subvention to the Residual Special Court for Sierra Leone  \n \n \nRecalling its resolution 58/284 of 8 April 2004, section VII of its resolution \n59/276 of 23 December 2004, section II of its resolution 59/294 of 22 June 2005, \nsection XII of its resolution 65/259 of 24 December 2010, section IX of its resolution \n66/247, section I of its resolution 67/246 of 24 December 2012, section VII of its \nresolution 70/248 A, section III of its resolution 71/272 A, section VIII of its \nresolution 72/262 A, section III of its resolution 73/279 A, section VI of its resolution \n74/263, section XVI of its resolution 75/253 A, section XI of its resolution 76/246 A, \nsection III of its resolution 77/263 A, section III of its resolution 78/253 and section \nII of its resolution 79/258 A,  \n \nHaving considered the report of the Secretary-General on the use of the \ncommitment authority and request for a subvention to the Residual Special Court for \nSierra Leone9 and the related report of the Advisory Committee,10  \n \n1. \nTakes note of the report of the Secretary-General;  \n \n2. \nEndorses the conclusions and recommendations contained in the report of \nthe Advisory Committee, subject to the provisions of the present resolution;  \n \n3. \nReaffirms the high priority accorded to the work of the Residual Special \nCourt for Sierra Leone;  \n__________________ \n \n9  A/80/420. \n \n10  A/80/7/Add.22. \n\nA/C.5/80/L.5\n \n5/21\n25-21159 \n \n \n4. \nRecalls article 6 of the Agreement between the United Nations and the \nGovernment of Sierra Leone on the Establishment of a Residual Special Court for \nSierra Leone,11 and reaffirms that the Residual Special Court shall have its principal \nseat in Sierra Leone and that it shall carry out its functions at its interim seat in the \nKingdom of the Netherlands, with a sub-office in Sierra Leone for witness and victim \nprotection and support, until such time as the Parties agree otherwise;  \n \n5. \nWelcomes the efforts to date of the Residual Special Court to digitize \njudicial records, notes that full digitization of all records remains incomplete, and \nencourages the Court to continue to work towards the completion of the full \ndigitization of archives within the existing resources;  \n \n6. \nAlso welcomes the continued in-kind multiform support provided by the \nGovernment of Sierra Leone to the Residual Special Court, including the provision \nof rent-free office space and other services at no cost;  \n \n7. \nEmphasizes that the subvention from the regular budget is a bridging \nfinancing mechanism to supplement insufficient voluntary contributions, and \nencourages all Member States to provide voluntary support for the Residual Special \nCourt;  \n \n8. \nTakes note of paragraph 11 of the report of the Advisory Committee;  \n \n9. \nRecalls paragraph 14 of the report of the Advisory Committee, and \nrequests the Secretary-General to intensify his efforts to seek voluntary contributions, \nincluding by broadening the donor base and developing more innovative fundraising \nand cost-efficient fundraising approaches;  \n \n10. Appreciates the efforts made by the Residual Special Court on cost-\nefficiency measures, encourages the Court to continue its efforts aimed at identifying \nadditional cost-efficiency and the relevant cost-savings measures to be applied in \nview of the persistent funding challenges, and requests the Secretary-General to \nreport thereon to the General Assembly at the main part of its eighty-first session;  \n \n11. \nLooks forward to the submission by the Residual Special Court of the \nfindings of the stocktaking exercise to the Oversight Committee;  \n \n12. Authorizes the Secretary-General to enter into commitments in an amount \nnot to exceed 2,771,700 dollars to supplement the voluntary financial resources of the \nResidual Special Court for the period from 1 January to 31 December 2026, and \nrequests the Secretary-General to report on the use of the commitment authority in \nthe context of his next report; \n \n \n \nVI \n \n \nProgress in the renovation of Africa Hall at the Economic Commission for Africa \nin Addis Ababa \n \n \nRecalling section III of its resolution 65/259, section VII of its resolution \n66/247, section III of its resolution 68/247 A, section V of its resolution 69/262, \nsection IX of its resolution 70/248 A, section V of its resolution 71/272 A, section XII \nof its resolution 72/262 A, section VIII of its resolution 73/279 A, section X of its \nresolution 74/263, section X of its resolution 75/253 A, section VIII of its resolution \n76/246 A, section IX of its resolution 77/263 A, section XIV of its resolution 78/253 \nand section XV of its resolution 79/258 A,  \n__________________ \n \n11  United Nations, Treaty Series, vol. 2871, No. 50125. \n\nA/C.5/80/L.5 \n \n25-21159\n6/21 \n \n \nHaving considered the report of the Secretary-General12 and the related report \nof the Advisory Committee,13  \n \n1. \nTakes note of the report of the Secretary-General;  \n \n2. \nEndorses the conclusions and recommendations contained in the report of \nthe Advisory Committee;  \n \n3. \nAcknowledges the successful completion of the renovation of Africa Hall \nat the Economic Commission for Africa, and expresses its appreciation to the \nGovernment of Ethiopia, as the host country, for its continued support for the project, \nand encourages the Secretary-General to continue to engage with the host country on \nall matters related to the project and its sustained use;  \n \n4.  \nAlso acknowledges the voluntary contributions already received from \nMember States in support of the renovation of Africa Hall and that the Secretary-\nGeneral continues to mobilize voluntary and in-kind contributions, with a focus on \nthe establishment and development of the permanent exhibition and the functioning \nof the visitors\u2019 centre;  \n \n5.  \nEncourages the Secretary-General to enhance efforts in engaging key \nstakeholders and cultivating partnerships with regional and international academic \nand research institutions, including universities and museums specialized in African \nhistory and culture, to raise global awareness of the historic Africa Hall and the \nAfrican heritage it represents;  \n \n6.  \nRecalls paragraph 10 of the report of the Advisory Committee, and \nrequests the Secretary-General to closely monitor and mitigate all identified issues \nduring the defect liability period, to ensure that the project is delivered within the \nscope and cost parameters approved by the General Assembly and to provide an \nupdate on relevant mitigation measures taken in his next report;  \n \n7. \nStresses the importance of effective governance, oversight, transparency, \naccountability and risk management of the project to ensure that the objectives of the \nproject are achieved within the approved budget and time schedule;  \n \n8.  \nWelcomes the efforts of the Economic Commission for Africa to document \nbest practices and lessons learned from relevant areas of the project, including, inter \nalia, cost savings through increasing energy and space utilization efficiency, value \nengineering and the use of local materials and knowledge, and encourages the \nSecretary-General to continue to document them, as relevant, in the update to the \nguidelines for the management of construction projects of the Organization;  \n \n9.  \nEncourages the Secretary-General to consider conducting surveys among \ndelegations and staff on the project quality, as appropriate;  \n \n10.  Stresses the importance of responsible waste and energy management \nduring the closeout and subsequent use of the facility;  \n \n11.  Recalls paragraphs 27 and 31 of the report of the Advisory Committee, in \nwhich the various revisions to the projections, budget and plan for the visitors\u2019 centre \nare noted, and, while emphasizing all necessary follow-up actions to be taken \nconcerning the opening of the visitors\u2019 centre and fulfilment of the projected number \nof visitors, trusts that the Secretary-General will provide updated projections, \nincluding a breakdown of the budget and plan, in his next report; \n \n__________________ \n \n12  A/80/190. \n \n13  A/80/7/Add.4. \n\nA/C.5/80/L.5\n \n7/21\n25-21159 \n \n \n \nVII \n \n \nProgress on the renovation of the North Building at the Economic Commission \nfor Latin America and the Caribbean in Santiago \n \n \nRecalling section VII of its resolution 69/274 A, section VI of its resolution \n70/248 B of 1 April 2016, section V of its resolution 72/262 A, section X of its \nresolution 73/279 A, section XI of its resolution 74/263, section XI of its resolution \n75/253 A, section XVI of its resolution 76/246 A, section X of its resolution 77/263 A, \nsection XVIII of its resolution 78/253 and section XVI of its resolution 79/258 A,  \n \nHaving considered the report of the Secretary-General14 and the related report \nof the Advisory Committee,15  \n \n1. \nTakes note of the report of the Secretary-General;  \n \n2. \nEndorses the conclusions and recommendations contained in the report of \nthe Advisory Committee;  \n \n3.  \nExpresses its gratitude to the Government of Chile, as the host country, \nfor its continued efforts in supporting and facilitating the work of the Economic \nCommission for Latin America and the Caribbean;  \n \n4.  \nAcknowledges the important role played by the host countries in \nfacilitating the maintenance and construction of United Nations facilities, and stresses \nthe value of continued collaboration with host countries in this regard;  \n \n5.  \nNotes with appreciation that the North Building reached substantial \ncompletion of its renovation in May 2025, and that all staff has been relocated to the \nbuilding;  \n \n6. \nRequests the Secretary-General to closely monitor and mitigate all project \nrisks during the defect liability period and take all measures necessary to ensure the \ndelivery of the project within the scope, revised budget and timeline, as approved by \nthe General Assembly, and also requests the Secretary-General to include information \non risk management and mitigation measures taken in his next progress report;  \n \n7. \nStresses the importance of effective governance, oversight, transparency, \naccountability and risk management of the project to ensure that the objectives of the \nproject are achieved within the approved budget and time schedule;  \n \n8.  \nWelcomes the efforts of the Economic Commission for Latin America and \nthe Caribbean to document best practices and lessons learned from relevant areas of \nthe project, including, inter alia, cost savings through increasing energy and space \nutilization efficiency, value engineering and the use of local materials and knowledge, \nand encourages the Secretary-General to continue to document them, as relevant, in \nthe update to the guidelines for the management of construction projects of the \nOrganization;  \n \n9. \nEncourages the Secretary-General to consider conducting surveys among \ndelegations and staff on the project quality, as appropriate;  \n \n10.  Welcomes the renovation of the North Building at the Economic \nCommission for Latin America and the Caribbean as a sustainable and energy-\nefficient building;  \n \n11.  Stresses the importance of responsible waste and energy management \nduring the closeout and subsequent use of the facility; \n \n__________________ \n \n14  A/80/209. \n \n15  A/80/7/Add.5. \n\nA/C.5/80/L.5 \n \n25-21159\n8/21 \n \n \n \nVIII \n \n \nSeismic mitigation retrofit and life-cycle replacements project at the Economic \nand Social Commission for Asia and the Pacific premises in Bangkok \n \n \nRecalling section XII of its resolution 70/248 A, section IV of its resolution \n71/272 A, section XIII of its resolution 72/262 A, section VII of its resolution \n73/279 A, section XII of its resolution 74/263, section XII of its resolution 75/253 A, \nsection VII of its resolution 76/246 A, section XI of its resolution 77/263 A, section \nXIII of its resolution 78/253 and section XIV of its resolution 79/258 A,  \n \nHaving considered the report of the Secretary-General16 and the related report \nof the Advisory Committee,17  \n \n1. \nTakes note of the report of the Secretary-General;  \n \n2. \nEndorses the conclusions and recommendations contained in the report of \nthe Advisory Committee;  \n \n3. \nExpresses its gratitude to the Government of Thailand, as the host country, \nfor its efforts in supporting and facilitating the work of the Economic and Social \nCommission for Asia and the Pacific through voluntary contributions and transfer of \nlocal knowledge and expertise towards the execution of the project;  \n \n4. \nNotes the substantial completion of construction activities of the project \nin June 2025, and commends the Economic and Social Commission for Asia and the \nPacific for its efforts that mitigated the risk of further delays in the project, controlled \nconstruction costs, enhanced efficiencies and mitigated the impact of unforeseen \ncircumstances on the project budget approved by the General Assembly;  \n \n5.  \nRequests the Secretary-General to continue to proactively monitor and \nmitigate all project risks during the defect liability period and to take all measures \nnecessary to ensure the delivery of the project within the scope, budget and timeline \napproved by the General Assembly;  \n \n6. \nStresses the importance of effective governance, oversight, transparency, \naccountability and risk management of the project to ensure that the objectives of the \nproject are achieved within the approved budget and time schedule;  \n \n7.  \nEncourages the Secretary-General to consider conducting surveys among \ndelegations and staff on the project quality, as appropriate;  \n \n8.  \nWelcomes the efforts of the Economic and Social Commission for Asia and \nthe Pacific to document best practices and lessons learned from relevant areas of the \nproject, including, inter alia, cost savings through increasing energy and space \nutilization efficiency, value engineering and the use of local materials and knowledge, \nand encourages the Secretary-General to continue to document them, as relevant, in \nthe update to the guidelines for the management of construction projects of the \nOrganization;  \n \n9.  \nNotes the importance of responsible waste and energy management during \nthe closeout and subsequent use of the facility; \n \n \n \nIX \n \n \nProgress on the replacement of office blocks A to J at the United Nations Office \nat Nairobi \n \n \nRecalling section XIV of its resolution 72/262 A, section IX of its resolution \n73/279 A, section XIII of its resolution 74/263, section XIV of its resolution \n__________________ \n \n16  A/80/201. \n \n17  A/80/7/Add.6. \n\nA/C.5/80/L.5\n \n9/21\n25-21159 \n \n75/253 A, section XV of its resolution 76/246 A, section XII of its resolution \n77/263 A, section XVI of its resolution 78/253 and section XIII of its resolution \n79/258 A,  \n \nHaving considered the report of the Secretary-General18 and the related report \nof the Advisory Committee,19  \n \n1. \nTakes note of the report of the Secretary-General;  \n \n2. \nEndorses the conclusions and recommendations contained in the report of \nthe Advisory Committee;  \n \n3. \nExpresses its gratitude to the Government of Kenya for its continued \nsupport for the United Nations Office at Nairobi, and trusts that the Secretary-General \nwill continue to engage with the host country to ensure the success and sustained use \nof the project;  \n \n4. \nReiterates its request to the Secretary-General to remain proactive in \nseeking both voluntary and in-kind contributions from Member States, in full \ncompliance with all relevant rules and regulations of the Organization, and to provide \ndetailed information on the matter in the context of his next report;  \n \n5.  \nRecalls paragraph 10 of the report of the Advisory Committee, and \nrequests the Secretary-General to closely monitor and mitigate all identified issues \nduring the defect liability period, to ensure that the project is delivered within the \nscope and cost parameters approved by the General Assembly and to provide an \nupdate on relevant mitigation measures taken in his next report;  \n \n6. \nStresses the importance of effective governance, oversight, transparency, \naccountability and risk management of the project to ensure that the objectives of the \nproject are achieved within the approved budget and time schedule;  \n \n7.  \nRequests the Secretary-General to ensure that all activities promote cost-\nefficiency and transparency, are implemented within existing resources and in \naccordance with the United Nations legislative framework, including the Financial \nRegulations and Rules of the United Nations,20 while maintaining full accountability \nto the General Assembly;  \n \n8.  \nEmphasizes that the Global Asset Management Policy Service should \ncontinue to be actively involved in overseeing the project to ensure the central \nsupervision of capital projects, including risk management and alignment with \nlessons learned;  \n \n9. \nRecalls and reiterates paragraph 24 of the report of the Advisory \nCommittee, and requests the Secretary-General to ensure that all efforts are made to \nlimit the use of the contingency provision;  \n \n10. Recalls paragraph 26 of the report of the Advisory Committee, commends \nthe synergies between this project and the United Nations Office at Nairobi \nconference facilities project, and requests the Secretary-General to ensure that the \nlessons learned will continue to be shared with the conference facilities project and \namong other United Nations capital construction projects, as appropriate, and to \nprovide further information in the context of his next report;  \n \n11. \nRequests the Secretary-General to document best practices and lessons \nlearned from relevant areas of the project, including, inter alia, cost savings through \nincreasing energy and space utilization efficiency, value engineering and the use of \n__________________ \n \n18  A/80/202. \n \n19  A/80/7/Add.7. \n \n20  ST/SGB/2013/4 and ST/SGB/2013/4/Amend.1. \n\nA/C.5/80/L.5 \n \n25-21159\n10/21 \n \nlocal materials and knowledge, and also requests the Secretary-General to include in \nthe update to the guidelines for the management of construction projects of the \nOrganization an analysis of the lessons learned and best practices from this project, \ninter alia, to improve risk management and to enable well-informed decision-making \nfor future projects;  \n \n12. Stresses the importance of responsible waste and energy management \nduring the closeout and subsequent use of the facility;  \n \n13. Recalls paragraph 3 of the report of the Advisory Committee, notes with \nappreciation the improvements to space utilization that have been achieved, also notes \nthe role of the United Nations Office at Nairobi in supporting the relocation of staff \nfrom other duty stations, and requests the Secretary-General to provide information \non the relocation of staff from other duty stations in the context of the UN80 Initiative \nin his future reports;  \n \n14.  Encourages the Secretary-General to consider conducting surveys among \ndelegations and staff on the project quality and accessibility, as appropriate;  \n \n \n \nX \n \n \nAddressing the deteriorating conditions and limited capacity of the conference \nservices facilities at the United Nations Office at Nairobi \n \n \nRecalling its resolution 73/270 of 22 December 2018, section XIV of its \nresolution 74/263, section III of its resolution 75/253 B, section IV of its resolution \n76/246 A, section VIII of its resolution 77/263 A, section XV of its resolution 78/253 \nand section XII of its resolution 79/258 A,  \n \nHaving considered the report of the Secretary-General21 and the related report \nof the Advisory Committee,22  \n \n1. \nTakes note of the report of the Secretary-General;  \n \n2. \nEndorses the conclusions and recommendations contained in the report of \nthe Advisory Committee;  \n \n3. \nExpresses its gratitude to the Government of Kenya for its continued \nsupport for the United Nations Office at Nairobi, and trusts that the Secretary-General \nwill continue to engage with the host country to ensure the success of the project;  \n \n4. \nReiterates its request to the Secretary-General to remain proactive in \nseeking both voluntary and in-kind contributions from Member States, in full \ncompliance with all relevant rules and regulations of the Organization, and to provide \ndetailed information on the matter in the context of his next progress report;  \n \n5. \nApproves the proposed name of the project as the United Nations Office at \nNairobi Conference Facilities Project;  \n \n6.  \nAcknowledges the need to address the deteriorating conditions and limited \ncapacity of the conference services facilities at the United Nations Office at Nairobi \nand the urgent need to implement the project in a timely manner to address the \nsituation, increase its utilization and to bring the Office to a standard consistent with \nother United Nations headquarters, while acknowledging the progress made under the \nproject during the reporting period;  \n \n7. \nRecalls paragraph 11 of the report of the Advisory Committee, notes that \nsignificant changes have been made to the project implementation strategy presented \nin the original report of the Secretary-General approved by the General Assembly, \n__________________ \n \n21  A/80/281. \n \n22  A/80/7/Add.8. \n\nA/C.5/80/L.5\n \n11/21\n25-21159 \n \nand requests the Secretary-General to ensure that any future changes to the project \nwill continue to be clearly presented and explained in his future progress reports;  \n \n8.  \nRequests the Secretary-General to continue to proactively monitor and \nmitigate all project risks, to take all measures necessary to ensure the delivery of the \nproject within the scope, budget and timeline approved by the General Assembly and \nto include in his next progress report an update on risk management and related \nmitigation measures;  \n \n9.  \nAlso requests the Secretary-General to continue to closely monitor cost \nescalation and provide updated information in his future progress reports;  \n \n10. Stresses the importance of effective governance, oversight, transparency, \naccountability and risk management of the project to ensure that the objectives of the \nproject are achieved within the approved budget and time schedule;  \n \n11.  Requests the Secretary-General to ensure that all activities promote cost-\nefficiency and transparency, are implemented within existing resources and in \naccordance with the United Nations legislative framework, including the Financial \nRegulations and Rules of the United Nations, while maintaining full accountability to \nthe General Assembly;  \n \n12. Recalls section XII, paragraph 21, of its resolution 79/258 A, expresses its \nappreciation to the Secretary-General for undertaking continuous value engineering, \nand encourages him to closely monitor prevailing escalation rates and to report \nthereon and on other cost-savings measures in future progress reports;  \n \n13.  Emphasizes that the Global Asset Management Policy Service should \ncontinue to be actively involved in overseeing the project to ensure the central \nsupervision of capital projects, including risk management and alignment with \nlessons learned;  \n \n14.  Requests the Secretary-General to document best practices and lessons \nlearned from relevant areas of the project, including, inter alia, cost savings through \nincreasing energy and space utilization efficiency, value engineering and the use of \nlocal materials and knowledge, and also requests the Secretary-General to include in \nthe update to the guidelines for the management of construction projects of the \nOrganization an analysis of the lessons learned and best practices from this project, \ninter alia, to improve risk management and to enable well-informed decision-making \nfor future projects;  \n \n15.  Also requests the Secretary-General to continue to explore possible cost-\nsharing arrangements that may be implemented by the United Nations Office at \nNairobi conference facilities and to report thereon in the next progress report;  \n \n16.  Recalls paragraph 25 of the report of the Advisory Committee, and further \nencourages the Secretary-General to continue to identify potential linkages and \nsynergies between this project and the project for the replacement of office blocks A \nto J;  \n \n17.  Also recalls its resolution 78/253, and requests the Secretary-General to \ncontinue to ensure conformity with relevant building codes and standards, technology \nand workplace safety, as well as best practices for persons with disabilities, in the \nconstruction and renovation of the United Nations Office at Nairobi facilities;  \n \n18.  Further recalls its resolution 78/253, and notes the incorporation of \nrenewable energy efficiency measures, wastewater treatment, solid waste management \nand water management into the project design, which aims to enable savings on \nelectricity and other expenses;  \n\nA/C.5/80/L.5 \n \n25-21159\n12/21 \n \n \n19. Recalls paragraph 15 of the report of the Advisory Committee, and \nrequests the Secretary-General to ensure oversight, transparency and strict adherence \nto the relevant legislative framework in the procurement of goods and services for the \nproject, and to provide more detailed information in the context of future progress \nreports;  \n \n20.  Also recalls paragraph 16 of the report of the Advisory Committee, and \nfurther encourages the Secretary-General to continue to incorporate local knowledge, \ntechnology, capacity and the use of locally sourced and manufactured materials, as \nwell as local labour and expertise, throughout the implementation of the project, as \nappropriate, and to provide updates on efficiency gains thereon in future progress \nreports;  \n \n21.  Further recalls its resolution 78/253, reiterates the important role of the \nUnited Nations Office at Nairobi as a duty station of the United Nations, requests the \nSecretary-General to continue to ensure compliance with the general principle \nestablished in the headquarters rule, encourages the Secretary-General to continue the \nefforts being made by the United Nations Office at Nairobi to attract more United \nNations intergovernmental meetings to its facilities, as appropriate, and emphasizes \nthat the intergovernmental meetings shall be given priority in using the facilities to \nfurther increase the utilization of the conference facilities;  \n \n22.  Recalls paragraph 41 of the report of the Advisory Committee, and \nrequests the Secretary-General to provide updated information, along with projected \nutilization rates for future meetings, in the next progress reports;  \n \n23.  Appropriates an amount of 42,342,700 dollars for the project in 2026, \ncomprising 38,929,200 dollars under section 33, Construction, alteration, improvement \nand major maintenance; 3,362,800 dollars under section 29D, Administration, \nNairobi; and 50,700 dollars under section 34, Safety and security, of the proposed \nprogramme budget for 2026; \n \n \n \nXI \n \n \nAssessment of the workplace at United Nations Headquarters \n \n \nRecalling section V of its resolution 67/246, section III of its resolution 67/254 \nA of 12 April 2013, section IV of its resolution 68/247 B, section VII of its resolution \n69/274 A, section XVI of its resolution 71/272 A, section XI of its resolution \n72/262 A, section VI of its resolution 73/279 A, section IX of its resolution 74/263, \nsection XIII of its resolution 75/253 A, section II of its resolution 75/253 C of 30 June \n2021 and section VI of its resolution 78/253,  \n \nHaving considered the report of the Secretary-General23 and the related report \nof the Advisory Committee,24  \n \n1. \nTakes note of the report of the Secretary-General; \n \n2. \nEndorses the conclusions and recommendations contained in the report of \nthe Advisory Committee; \n \n \n \nXII \n \n \nAdministrative expenses of the United Nations Joint Staff Pension Fund \n \n \nRecalling its resolution 70/238 A of 23 December 2015, section VII of its \nresolution 78/253 and its resolution 79/253 of 24 December 2024,  \n__________________ \n \n23  A/80/354. \n \n24  A/80/7/Add.20. \n\nA/C.5/80/L.5\n \n13/21\n25-21159 \n \n \nHaving considered the report of the United Nations Joint Staff Pension Board \non the work of its eighty-first session and administrative expenses of the United \nNations Joint Staff Pension Fund,25 the statement submitted by the Secretary-General \nin accordance with rule 153 of the rules of procedure of the General Assembly on \nprogramme budget implications arising from recommendations and decisions \ncontained in the report of the United Nations Joint Staff Pension Board,26 the financial \nreport and audited financial statements for the year ended 31 December 2024 and the \nreport of the Board of Auditors on the Fund27 and the recommendations contained \ntherein, the report of the Chief Executive of Pension Administration and the Acting \nRepresentative of the Secretary-General for the investment of the assets of the Fund \non the implementation of the recommendations of the Board of Auditors contained in \nits report for the year ended 31 December 2024 on the United Nations Joint Staff \nPension Fund28 and the related report of the Advisory Committee,29  \n \n1. \nTakes note of the report of the United Nations Joint Staff Pension Board \nand the statement of the Secretary-General;  \n \n2. \nAlso takes note of the report of the Chief Executive of Pension \nAdministration and the Acting Representative of the Secretary-General for the \ninvestment of the assets of the Fund on the implementation of the recommendations \nof the Board of Auditors contained in its report for the year ended 31 December 2024 \non the United Nations Joint Staff Pension Fund;  \n \n3. \nEndorses the conclusions and recommendations contained in the report of \nthe Advisory Committee, subject to the provisions of the present resolution;  \n \n4. \nEmphasizes the existing prerogative of the General Assembly on matters \npertaining to the Fund;  \n \n5. \nTakes note with appreciation of the work of the United Nations Joint Staff \nPension Board, and welcomes the decisions and recommendations contained in its \nreport;  \n \n6. \nAcknowledges the commitment of the Pension Fund to manage long-\nstanding recommendations of the Board of Auditors, and reiterates the importance of \nthe secretariat of the Fund, the Pension Board and the Representative of the Secretary-\nGeneral addressing all the accepted recommendations of the Board of Auditors and \nthe Office of Internal Oversight Services, in full and in a timely manner, and of \nreporting thereon in the next report to the General Assembly;  \n \n7. \nRecalls paragraph 50 of the report of the Advisory Committee, stresses the \nimportance of maintaining the long-term solvency of the Fund, and requests the Fund \nto continue to monitor risks to the future solvency of the Fund and to update the \nGeneral Assembly on its findings in its next report; \n \n8. \nCommends the contribution of the Budget Committee to an enhanced \noversight of resource utilization for the effective implementation of the operational \nneeds of the Pension Fund, and requests the Pension Fund to identify tangible \nefficiencies for reflection in the next budget submissions; \n \n9. \nWelcomes the progress made by the Pension Fund, including improving \nclient experience, modernizing pension services and strengthening relations with all \n__________________ \n \n25  A/80/346. \n \n26  A/C.5/80/2. \n \n27  Official Records of the General Assembly, Eightieth Session, Supplement No. 5P (A/80/5/Add.16). \n \n28  A/80/328. \n \n29  A/80/7/Add.18. \n\nA/C.5/80/L.5 \n \n25-21159\n14/21 \n \nstakeholders, and encourages the Pension Board to continue focusing on these areas \nand to report thereon in its next report; \n \n10. Reaffirms that the Secretary-General serves as fiduciary for the investment \nof the assets of the Fund, and also reaffirms that the investment of the assets of the \nFund shall be decided upon by the Secretary-General after consultation with the \nInvestments Committee, which plays an important role, and in the light of \nobservations and suggestions made from time to time by the Pension Board on the \ninvestments policy; \n \n11. \nRecalls paragraph 12 of its resolution 79/253 and paragraph 18 of the \nreport of the Advisory Committee, and requests the Secretary-General to continue to \ndiversify investment of the assets of the Fund among developed, developing and \nemerging markets, wherever this serves the interests of the participants and the \nbeneficiaries of the Fund, and ensure that decisions in any market are implemented \nprudently, taking fully into account the four investment criteria, namely, safety, \nprofitability, liquidity and convertibility, and to provide an update to the General \nAssembly on efforts being made to this end, including information on investments by \ncountry and geographical region and by currencies and assets, in the context of his \nnext report;  \n \n12. Also recalls section XIII, paragraph 21, of its resolution 76/246 A and \nparagraph 18 of its resolution 77/258 of 30 December 2022, and requests the \nSecretary-General to strengthen his efforts to implement the Fund\u2019s strategy on \nimpact investing for part of the portfolio, including in developing and emerging \nmarkets, from regions such as Africa, Latin America, Asia and others, with a view to \ngenerating positive social and environmental impact alongside the financial returns, \nbearing in mind the real rate of return target, and to update the General Assembly in \nhis next report; \n \n13. Encourages the Fund to continue using peer benchmarking to compare and \nimprove the performance of its investments, and reiterates that, while such \ncomparisons support transparency, they do not constitute recruitment or cost targets; \n \n14. Notes the financial constraints affecting the United Nations and ongoing \nreform initiatives, and, on the basis of the forthcoming actuarial valuation, asset \nliability management study and mortality studies, invites the Pension Board to review \nthe pension scheme holistically, including the Pension Adjustment System, and to \nassess options for pension scheme designs, such as defined contribution and hybrid \nschemes as well as adjustments within the existing scheme, that lower contributions, \nmaintain the sustainability and long-term viability of the Pension Fund and respect \naccrued pension rights, and requests the Pension Board to provide to the General \nAssembly, at its eighty-third session, a report outlining such options, and to update \nthe General Assembly on progress in its next annual report; \n \n15. Takes note of paragraph 60 of the report of the Advisory Committee, and \ndecides to reclassify one post of Public Information Officer from the P-3 to the P-4 \nlevel;  \n \n16. Also takes note of paragraph 67 of the report of the Advisory Committee, \nand decides to establish the post of Senior Legal Officer (P-5);  \n \n17. Approves the changes to the staffing table as set out in the table below: \n \n\nA/C.5/80/L.5\n \n15/21\n25-21159 \n \n \n \nA. Pension Administration \n \n \nAction \nTitle of post \nCategory/level \nNumber \nEstablishment \nLegal Officer \nP-4 \n1 \nEstablishment \nSenior Benefits Assistant  \nGS (PL) \n1 \nEstablishment \nInformation Systems Assistant \nGS (OL) \n1 \nTotal new posts \n \n \n3 \nReclassification \nPublic Information Officer \nP-4 \n1 \nReclassification \nSenior Accounting Assistant \nGS (PL) \n1 \nReclassification \nSenior Treasury Assistant \nGS (PL) \n1 \nReclassification \nSenior Programme Management Assistant \nGS (PL) \n1 \n \n \n \n \nB. Office of Investment Management \n \n \nAction \nTitle of post \nCategory/level \nNumber \nEstablishment \nPrincipal Legal Officer \nD-1 \n1 \nEstablishment \nSenior Legal Officer \nP-5 \n1 \nEstablishment \nRisk Officer \nP-3 \n1 \nTotal new posts \n \n \n3 \nReclassification \nHuman Resources Officer \nP-3 \n1 \nReclassification \nSenior Administrative Assistant \nGS (PL) \n1 \nReclassification \nSenior Information Systems Assistant \nGS (PL) \n1 \nRedeployment from Strategic Management \nOffice (programme of work) to Business \nSupport Section (programme support)  \nAdministrative Officer \nP-4 \n1 \nRedeployment from Strategic Management \nOffice (programme of work) to Business \nSupport Section (programme support) \nAssociate Human Resources Officer \nP-2/1 \n1 \nRedeployment from Strategic Management \nOffice (programme of work) to Business \nSupport Section (programme support) \nSenior Human Resources Assistant \nGS (PL) \n2 \n \nAbbreviations: GS (OL), General Service (Other level); GS (PL), General Service (Principal level). \n \n \n \n18. Also approves the estimates of 168,460,000 dollars for the administration \nof the Fund for 2026;  \n \n19. Further approves expenses, chargeable directly to the Fund, totalling \n162,989,200 dollars net for 2026;  \n \n20. Approves the amount of 5,470,800 dollars as the cost of the services \nprovided by the United Nations Joint Staff Pension Fund to the secretariat of the \nUnited Nations Staff Pension Committee for 2026, of which 3,266,100 dollars would \nrepresent the share of the regular budget and the balance of 2,204,700 dollars would \nrepresent the share of the funds and programmes;  \n \n21. Also approves the decrease of 76,600 dollars in the United Nations share \nof the cost of the administrative expenses of the central secretariat of the Fund under \nsection 1, Overall policymaking, direction and coordination, of the proposed \nprogramme budget for 2026;  \n\nA/C.5/80/L.5 \n \n25-21159\n16/21 \n \n \n22. Authorizes the Pension Board to supplement the voluntary contributions \nto the Emergency Fund for 2026 by an amount not to exceed 112,500 dollars;  \n \n \n \nXIII \n \n \nProgramme budget implications arising from recommendations contained in the \nreport of the International Civil Service Commission for 2025 \n \n \nHaving considered the statement submitted by the Secretary-General in \naccordance with rule 153 of the rules of procedure of the General Assembly on \nprogramme budget implications arising from recommendations contained in the \nreport of the International Civil Service Commission for 202530 and the related report \nof the Advisory Committee,31  \n \n1. \nRecalls its resolution 80/___ of __ December 2025;  \n \n2. \nTakes note of the statement submitted by the Secretary-General;  \n \n3.  \nEndorses the conclusions and recommendations contained in the report of \nthe Advisory Committee; \n \n \n \nXIV \n \n \nFinancial performance report on the programme budget for 2024 \n \n \nRecalling its resolutions 72/266 A of 24 December 2017, 78/252, 78/253, \n78/254 A to C, 78/255 and 78/256 of 22 December 2023, 78/273 and 78/274 of 24 \nApril 2024 and 79/245 A of 24 December 2024,  \n \nHaving considered the financial performance report on the programme budget \nfor 202432 and the related report of the Advisory Committee,33 \n \n1. \nTakes note of the report of the Secretary-General;  \n \n2. \nEndorses the conclusions and recommendations contained in the report of \nthe Advisory Committee;  \n \n3.  \nDecides that, starting from January 2026, regular budget credits to be \napportioned among Member States in accordance with the Financial Regulations and \nRules shall offset regular budget arrears of Member States, before crediting to the \nassessments, and the Financial Regulations and Rules shall be amended accordingly;  \n \n4.  \nAlso decides that, starting from January 2026, tribunals credits to be \napportioned among Member States in accordance with the Financial Regulations and \nRules shall offset tribunals arrears of Member States, before crediting to the \nassessments, and the Financial Regulations and Rules shall be amended accordingly;  \n \n5.  \nFurther decides that, starting from January 2027, the return of credits for \nthe regular budget and tribunals shall be apportioned on the basis of the scale of \nassessments for the year to which the credits relate, and the Financial Regulations and \nRules shall be amended accordingly;  \n \n6.  \nRequests the Secretary-General to make every effort to facilitate Member \nStates\u2019 payments of their assessed contributions, including in cases when there are \ncircumstances beyond their control in making payments;  \n \n7.  \nNotes that cash conservation does not constitute a sustainable solution to \nthe liquidity problem of the United Nations, and that other related measures introduced \n__________________ \n \n30  A/C.5/80/3. \n \n31  A/80/7/Add.19. \n \n32  A/80/89. \n \n33  A/80/7/Add.1. \n\nA/C.5/80/L.5\n \n17/21\n25-21159 \n \nby the Secretary-General cannot solve the problem, and emphasizes that the problem \ncan only be resolved through Member States fulfilling their financial obligations as \nset out in the Charter of the United Nations on time, in full and without conditions;  \n \n8. \nTakes note of the final expenditure in 2024 in the amount of 3,361,198,300 \ndollars and the actual income in 2024 in the amount of 366,969,700 dollars; \n \n \n \nXV \n \n \nRevised estimates resulting from resolutions and decisions adopted by the \nEconomic and Social Council at its 2025 session \n \n \nHaving considered the report of the Secretary-General34 and the related report \nof the Advisory Committee,35  \n \n1. \nTakes note of the report of the Secretary-General;  \n \n2. \nEndorses the conclusions and recommendations contained in the report of \nthe Advisory Committee;  \n \n3.  \nRecalls paragraph 17 of the report of the Advisory Committee, and \napproves resources in the amount of 400,000 dollars for multilingualism;  \n \n4. \nAppropriates an additional amount of 400,000 dollars for multilingualism \nunder section 2, General Assembly and Economic and Social Council affairs and \nconference management, of the proposed programme budget for 2026, which would \nrepresent a charge against the contingency fund;  \n \n5.  \nAlso appropriates an additional amount of 48,000 dollars under section \n36, Staff assessment, of the proposed programme budget for 2026, to be offset by an \nequivalent amount under income section 1, Income from staff assessment;  \n \n \n \nXVI  \n \n \nRevised estimates resulting from resolutions and decisions adopted by the \nHuman Rights Council at its fifty-eighth, fifty-ninth and sixtieth regular sessions \nand its thirty-seventh special session \n \n \nHaving considered the report of the Secretary-General36 and the related report \nof the Advisory Committee,37  \n \n1. \nTakes note of the report of the Secretary-General;  \n \n2. \nEndorses the conclusions and recommendations contained in the report of \nthe Advisory Committee;  \n \n3. \nApproves additional appropriations, representing a charge against the \ncontingency fund, in the amount of 11,610,700 dollars for the proposed programme \nbudget for 2026, comprising: \n \n(a) \n614,400 dollars under section 2, General Assembly and Economic and \nSocial Council affairs and conference management; \n \n(b) \n162,600 dollars under section 16, International drug control, crime and \nterrorism prevention and criminal justice; \n \n(c) \n8,751,200 dollars under section 24, Human rights (Office of the United \nNations High Commissioner for Human Rights); \n__________________ \n \n34  A/80/357. \n \n35  A/80/7/Add.21. \n \n36  A/80/525. \n \n37  A/80/7/Add.24. \n\nA/C.5/80/L.5 \n \n25-21159\n18/21 \n \n \n(d) \n1,571,500 dollars under section 24, Human rights (Independent \nInvestigative Mechanism for Afghanistan); \n \n(e) \n12,100 dollars under section 28, Global communications; \n \n(f) \n15,400 dollars under section 29E, Administration, Geneva; \n \n(g) \n466,700 dollars under section 29F, Administration, Vienna; \n \n(h) \n16,800 dollars under section 34, Safety and security; \n \n4. \nAlso approves the establishment, effective 1 January 2026, under section \n24, Human rights, of the proposed programme budget for 2026, of 13 posts, of which \n10 are for the Independent Investigative Mechanism for Afghanistan and 3 are for the \nOffice of the High Commissioner, to support the activities mandated by the Human \nRights Council in its resolutions 58/13 of 3 April 2025,38 60/2 and 60/14 of 6 October \n2025 and 60/20 of 7 October 2025;39  \n \n5. \nFurther approves an additional appropriation in the amount of 637,100 \ndollars under section 36, Staff assessment, of the proposed programme budget for \n2026, to be offset by an equivalent increase of 637,100 dollars under income \nsection 1, Income from staff assessment; \n \n \n \nXVII \n \n \nEstimates in respect of special political missions, good offices and other political \ninitiatives authorized by the General Assembly and/or the Security Council \n \n \nHaving considered the reports of the Secretary-General on the estimates in \nrespect of special political missions, good offices and other political initiatives \nauthorized by the General Assembly and/or the Security Council 40 and on revised \nestimates relating to the proposed programme budget for 2026 and the support \naccount for peacekeeping operations for the 2025/26 period 41 as well as the related \nreports of the Advisory Committee,42  \n \nRecalling its resolution 79/258 A; \n \n1. \nTakes note of the reports of the Secretary-General; \n \n2. \nEndorses the conclusions and recommendations contained in the reports \nof the Advisory Committee, subject to the provisions of the present resolution; \n \n3. \nRecalls its resolution 79/318 of 18 July 2025 on the UN80 Initiative, and \nwelcomes the efforts of the Secretary-General to strengthen the United Nations \nthrough structural and programmatic realignment to address duplication, reduce \noverlap, enhance transparency, strengthen mandate delivery and make special \npolitical missions more efficient, effective, impactful and fit for purpose for the \npeople it serves; \n \n4. \nStresses that the UN80 Initiative is not a liquidity management measure, and \nrequires going beyond a one-time reform exercise to also incorporate a culture of \nefficiency to ensure long-term effective and efficient mandate delivery, affirms the \nrespective roles of the General Assembly and the Security Council with regard to \n__________________ \n \n38  See Official Records of the General Assembly, Eightieth Session, Supplement No. 53 (A/80/53), \nchap. V, sect. A. \n \n39  Ibid., Supplement No. 53A (A/80/53/Add.1), chap. III, sect. A. \n \n40  A/80/6 (Sect. 3)/Add.1, A/80/6 (Sect. 3)/Add.2, A/80/6 (Sect. 3)/Add.3, A/80/6 (Sect. 3)/Add.4, \nA/80/6 (Sect. 3)/Add.5 and A/80/6 (Sect. 3)/Add.6. \n \n41  Relevant parts of A/80/400. \n \n42  A/80/7/Add.10, A/80/7/Add.11, A/80/7/Add.12, A/80/7/Add.13, A/80/7/Add.14 and \nA/80/7/Add.15. \n\nA/C.5/80/L.5\n \n19/21\n25-21159 \n \nspecial political missions, and requests the Secretary-General to pursue synergies to \nachieve greater efficiency in the management of post and non-post resources, and to \nthis end present proposals in his next budget submissions, while taking into account the \ndifferent sizes, complexities and operational environments of special political missions;  \n \n5. \nRecognizes the need to assess the impact of the reform efforts on mandate \nimplementation, requests the Secretary-General to reflect thereon in his future budget \nsubmissions for special political missions, and also requests the Secretary-General to \nexplore measures to apply zero-based budgeting, based on mandated activities;  \n \n6. \nReaffirms its commitment to considering the review of the arrangements \non the funding and backstopping of the special political missions and the \nrecommendations of the Advisory Committee, and expresses its commitment to \nconsidering this matter, with a view to making a decision, without prejudging the \noutcome, at the main part of its eighty-first session; \n \n7. \nDecides to abolish seven posts that have been vacant for longer than 36 \nmonths;  \n \n \n \nOffice of the Special Envoy of the Secretary-General for Syria \n \n \n8. \nTakes note of paragraph 53 of the report of the Advisory Committee; 43  \n \n9.  \nDecides against the abolishment of the encumbered P-5 post of Senior \nPolitical Affairs Officer based in Damascus;  \n \n10. Recalls paragraph 54 of the report of the Advisory Committee, 44  and \ndecides not to abolish one post of Special Assistant, Political Affairs (P-4) and to \nabolish one post of Mission Planning Officer (P-3);  \n \n \n \nOffice of the Special Envoy of the Secretary-General for the Horn of Africa \n \n \n11. \nTakes note of paragraph 62 of the report of the Advisory Committee, 45 and \ndecides against the abolishment of the P-4 post of Political Affairs Officer;  \n \n \n \nOffice of the Special Envoy of the Secretary-General for Yemen \n \n \n12. Takes note of paragraph 74 of the report of the Advisory Committee; 46  \n \n13. Also takes note of paragraph 75 of the report of the Advisory Committee, 47 \nand decides to reassign one post of Security Officer (Field Service) in Sana\u2019a as \nAdministrative Assistant (Field Service) in Amman; \n \n \n \nPanel of Experts on Haiti \n \n \n14. Decides against the abolishment of one post of Senior Political Affairs \nOfficer (P-5); \n \n \n \nCounter-Terrorism Committee Executive Directorate \n \n \n15. Takes note of paragraph 12 of the report of the Advisory Committee, 48 and \ndecides not to abolish two posts of Legal Affairs Officer (P-4) under the Assessment \nand Technical Assistance Office, based in New York, (Cluster C);  \n \n__________________ \n \n43  A/80/7/Add.11. \n \n44  Ibid. \n \n45  Ibid. \n \n46  Ibid. \n \n47  Ibid. \n \n48  A/80/7/Add.12. \n\nA/C.5/80/L.5 \n \n25-21159\n20/21 \n \n \n \nUnited Nations Office for West Africa and the Sahel \n \n \n16. Recalls paragraph 25 of the report of the Advisory Committee, 49  and \ndecides against the abolishment of the post of Information Analyst (P-3); \n \n \n \nUnited Nations Transitional Assistance Mission in Somalia  \n \n \n17. Recalls paragraph 42 of the report of the Advisory Committee, 50  and \ndecides not to abolish one post of Political Affairs Officer (P-3);  \n \n \n \nUnited Nations Regional Office for Central Africa \n \n \n18. Decides against the abolishment of the D-1 post; \n \n19. Takes note of paragraph 71 of the report of the Advisory Committee; 51  \n \n \n \nUnited Nations Support Mission in Libya \n \n \n20. Recalls paragraph 80 (a) (i) of the report of the Advisory Committee, 52 and \ndecides against the abolishment of one vacant post of United Nations Police Officer \n(P-4);  \n \n21. Also recalls paragraph 80 (d) of the report of the Advisory Committee, 53 \nand decides not to redeploy one post of Special Assistant, Political Affairs (P-3) in \nthe Office of the Chief of Staff and one post of Administrative Officer (Field Service) \nin the Office of the Chief of Mission Support to Tunis;  \n \n \n \nUnited Nations Mission to Support the Hudaydah Agreement \n \n \n22. Takes note of paragraph 100 of the report of the Advisory Committee; 54  \n \n \n \nUnited Nations Integrated Office in Haiti \n \n \n23. Recalls paragraph 116 of the Advisory Committee, 55  and decides to \napprove the reclassification of the post of Special Representative of the Secretary-\nGeneral from the Assistant Secretary-General level to the Under-Secretary-General \nlevel, and decides not to approve the reclassification of the post of Chief of Mission \nfrom D-2 to Assistant Secretary-General;  \n \n24. Approves the budgets in the amount of 535,042,000 dollars for the 37 \ncontinuing special political missions authorized by the General Assembly and/or the \nSecurity Council, and an amount of 2,323,000 dollars for the share of special political \nmissions in the budget of the Regional Service Centre in Entebbe, Uganda, for 2026, \nunder section 3, Political affairs, of the proposed programme budget for 2026; \n \n \n \nXVIII \n \n \nInternational Trade Centre \n \n \nApproves resources in the amount of 22,055,700 dollars (the United Nations \nshare equivalent to 50 per cent of 34,129,000 Swiss francs at the exchange rate of \n0.7737 Swiss francs to 1 dollar) proposed for 2026 under section 13, International \nTrade Centre, of the proposed programme budget for 2026; \n__________________ \n \n49  A/80/7/Add.13. \n \n50  Ibid. \n \n51  Ibid. \n \n52  Ibid. \n \n53  Ibid. \n \n54  Ibid. \n \n55  Ibid. \n\nA/C.5/80/L.5\n \n21/21\n25-21159 \n \n \n \nXIX \n \n \nGross jointly financed budget of the Joint Inspection Unit \n \n \nApproves the gross budget for the Joint Inspection Unit for 2026 in the amount \nof 9,666,200 dollars; \n \n \n \nXX \n \n \nGross jointly financed budget of the International Civil Service Commission \n \n \nApproves the gross budget for the International Civil Service Commission for \n2026 in the amount of 13,393,100 dollars; \n \n \n \nXXI \n \n \nGross jointly financed budget of the United Nations System Chief Executives \nBoard for Coordination \n \n \nNotes the gross budget for the United Nations System Chief Executives Board \nfor Coordination for 2026 in the amount of 4,522,600 dollars; \n \n \n \nXXII \n \n \nGross jointly financed budget of the Department of Safety and Security \n \n \nApproves the gross jointly financed budget of the Department of Safety and \nSecurity of the Secretariat for 2026 in the amount of 147,254,800 dollars, broken \ndown as follows: \n \n(a) \nField Security Operations: 124,739,200 dollars; \n \n(b) \nSecurity and Safety Services at the United Nations Office at Vienna: \n22,515,600 dollars; \n \n \n \nXXIII \n \n \nEffects of changes in rates of exchange and inflation \n \n \nHaving considered the report of the Secretary-General on the revised estimates \nresulting from changes in rates of exchange and inflation 56 and the related report of \nthe Advisory Committee,57  \n \nTakes note of the revised estimates arising from recosting owing to changes in \nthe rates of exchange and inflation; \n \n \n \nXXIV \n \n \nContingency fund \n \n \nRecalls its resolution 79/258 A, in which the level of the contingency fund for \nthe year 2026 was set at 0.75 per cent of the approved programme budget for 2025, \nor 27,880,300 dollars, \n \n1. \nNotes that, after a charge of 12,010,700 dollars, a balance of 15,869,600 \ndollars remains in the contingency fund for 2026; \n \n2. \nDecides that the contingency fund for the year 2027 shall be set at the level \nof 0.75 per cent of the approved programme budget for 2026. \n \n__________________ \n \n56  A/80/480. \n \n57  A/80/7/Add.16. \n",
  "paragraphs": {
    "1": "Notes that, after a charge of 12,010,700 dollars, a balance of 15,869,600 dollars remains in the contingency fund for 2026;",
    "2": "Decides that the contingency fund for the year 2027 shall be set at the level of 0.75 per cent of the approved programme budget for 2026. __________________ 56 A/80/480. 57 A/80/7/Add.16.",
    "3": "Recalls its resolution 79/318 of 18 July 2025 on the UN80 Initiative, and welcomes the efforts of the Secretary-General to strengthen the United Nations through structural and programmatic realignment to address duplication, reduce overlap, enhance transparency, strengthen mandate delivery and make special political missions more efficient, effective, impactful and fit for purpose for the people it serves;",
    "4": "Stresses that the UN80 Initiative is not a liquidity management measure, and requires going beyond a one-time reform exercise to also incorporate a culture of efficiency to ensure long-term effective and efficient mandate delivery, affirms the respective roles of the General Assembly and the Security Council with regard to __________________ 38 See Official Records of the General Assembly, Eightieth Session, Supplement No. 53 (A/80/53), chap. V, sect. A. 39 Ibid., Supplement No. 53A (A/80/53/Add.1), chap. III, sect. A. 40 A/80/6 (Sect. 3)/Add.1, A/80/6 (Sect. 3)/Add.2, A/80/6 (Sect. 3)/Add.3, A/80/6 (Sect. 3)/Add.4, A/80/6 (Sect. 3)/Add.5 and A/80/6 (Sect. 3)/Add.6. 41 Relevant parts of A/80/400. 42 A/80/7/Add.10, A/80/7/Add.11, A/80/7/Add.12, A/80/7/Add.13, A/80/7/Add.14 and A/80/7/Add.15. A/C.5/80/L.5 19/21 25-21159 special political missions, and requests the Secretary-General to pursue synergies to achieve greater efficiency in the management of post and non-post resources, and to this end present proposals in his next budget submissions, while taking into account the different sizes, complexities and operational environments of special political missions;",
    "5": "Recognizes the need to assess the impact of the reform efforts on mandate implementation, requests the Secretary-General to reflect thereon in his future budget submissions for special political missions, and also requests the Secretary-General to explore measures to apply zero-based budgeting, based on mandated activities;",
    "6": "Reaffirms its commitment to considering the review of the arrangements on the funding and backstopping of the special political missions and the recommendations of the Advisory Committee, and expresses its commitment to considering this matter, with a view to making a decision, without prejudging the outcome, at the main part of its eighty-first session;",
    "7": "Decides to abolish seven posts that have been vacant for longer than 36 months; Office of the Special Envoy of the Secretary-General for Syria",
    "8": "Takes note of paragraph 53 of the report of the Advisory Committee; 43",
    "9": "Decides against the abolishment of the encumbered P-5 post of Senior Political Affairs Officer based in Damascus;",
    "10": "Recalls paragraph 54 of the report of the Advisory Committee, 44 and decides not to abolish one post of Special Assistant, Political Affairs (P-4) and to abolish one post of Mission Planning Officer (P-3); Office of the Special Envoy of the Secretary-General for the Horn of Africa",
    "11": "Takes note of paragraph 62 of the report of the Advisory Committee, 45 and decides against the abolishment of the P-4 post of Political Affairs Officer; Office of the Special Envoy of the Secretary-General for Yemen",
    "12": "Takes note of paragraph 74 of the report of the Advisory Committee; 46",
    "13": "Also takes note of paragraph 75 of the report of the Advisory Committee, 47 and decides to reassign one post of Security Officer (Field Service) in Sana\u2019a as Administrative Assistant (Field Service) in Amman; Panel of Experts on Haiti",
    "14": "Decides against the abolishment of one post of Senior Political Affairs Officer (P-5); Counter-Terrorism Committee Executive Directorate",
    "15": "Takes note of paragraph 12 of the report of the Advisory Committee, 48 and decides not to abolish two posts of Legal Affairs Officer (P-4) under the Assessment and Technical Assistance Office, based in New York, (Cluster C); __________________ 43 A/80/7/Add.11. 44 Ibid. 45 Ibid. 46 Ibid. 47 Ibid. 48 A/80/7/Add.12. A/C.5/80/L.5 25-21159 20/21 United Nations Office for West Africa and the Sahel",
    "16": "Recalls paragraph 25 of the report of the Advisory Committee, 49 and decides against the abolishment of the post of Information Analyst (P-3); United Nations Transitional Assistance Mission in Somalia",
    "17": "Recalls paragraph 42 of the report of the Advisory Committee, 50 and decides not to abolish one post of Political Affairs Officer (P-3); United Nations Regional Office for Central Africa",
    "18": "Decides against the abolishment of the D-1 post;",
    "19": "Takes note of paragraph 71 of the report of the Advisory Committee; 51 United Nations Support Mission in Libya",
    "20": "Recalls paragraph 80 (a) (i) of the report of the Advisory Committee, 52 and decides against the abolishment of one vacant post of United Nations Police Officer (P-4);",
    "21": "Also recalls paragraph 80 (d) of the report of the Advisory Committee, 53 and decides not to redeploy one post of Special Assistant, Political Affairs (P-3) in the Office of the Chief of Staff and one post of Administrative Officer (Field Service) in the Office of the Chief of Mission Support to Tunis; United Nations Mission to Support the Hudaydah Agreement",
    "22": "Takes note of paragraph 100 of the report of the Advisory Committee; 54 United Nations Integrated Office in Haiti",
    "23": "Recalls paragraph 116 of the Advisory Committee, 55 and decides to approve the reclassification of the post of Special Representative of the Secretary- General from the Assistant Secretary-General level to the Under-Secretary-General level, and decides not to approve the reclassification of the post of Chief of Mission from D-2 to Assistant Secretary-General;",
    "24": "Approves the budgets in the amount of 535,042,000 dollars for the 37 continuing special political missions authorized by the General Assembly and/or the Security Council, and an amount of 2,323,000 dollars for the share of special political missions in the budget of the Regional Service Centre in Entebbe, Uganda, for 2026, under section 3, Political affairs, of the proposed programme budget for 2026; XVIII International Trade Centre Approves resources in the amount of 22,055,700 dollars (the United Nations share equivalent to 50 per cent of 34,129,000 Swiss francs at the exchange rate of 0.7737 Swiss francs to 1 dollar) proposed for 2026 under section 13, International Trade Centre, of the proposed programme budget for 2026; __________________ 49 A/80/7/Add.13. 50 Ibid. 51 Ibid. 52 Ibid. 53 Ibid. 54 Ibid. 55 Ibid. A/C.5/80/L.5 21/21 25-21159 XIX Gross jointly financed budget of the Joint Inspection Unit Approves the gross budget for the Joint Inspection Unit for 2026 in the amount of 9,666,200 dollars; XX Gross jointly financed budget of the International Civil Service Commission Approves the gross budget for the International Civil Service Commission for 2026 in the amount of 13,393,100 dollars; XXI Gross jointly financed budget of the United Nations System Chief Executives Board for Coordination Notes the gross budget for the United Nations System Chief Executives Board for Coordination for 2026 in the amount of 4,522,600 dollars; XXII Gross jointly financed budget of the Department of Safety and Security Approves the gross jointly financed budget of the Department of Safety and Security of the Secretariat for 2026 in the amount of 147,254,800 dollars, broken down as follows: (a) Field Security Operations: 124,739,200 dollars; (b) Security and Safety Services at the United Nations Office at Vienna: 22,515,600 dollars; XXIII Effects of changes in rates of exchange and inflation Having considered the report of the Secretary-General on the revised estimates resulting from changes in rates of exchange and inflation 56 and the related report of the Advisory Committee,57 Takes note of the revised estimates arising from recosting owing to changes in the rates of exchange and inflation; XXIV Contingency fund Recalls its resolution 79/258 A, in which the level of the contingency fund for the year 2026 was set at 0.75 per cent of the approved programme budget for 2025, or 27,880,300 dollars,"
  },
  "agenda_items": [
    "Item 136"
  ],
  "symbol_references": [
    "A/C.5/80/L.5"
  ]
}