{
  "symbol": "A/C.4/80/L.8",
  "filename": "A_C.4_80_L.8.pdf",
  "title": "International cooperation in the peaceful uses of outer space",
  "text": "United Nations \nA/C.4/80/L.8 \n \n \nGeneral Assembly \nDistr.: Limited \n24 October 2025 \nOriginal: English \n \n25-17043 (E)    281025     \n*2517043* \n \n \nEightieth session \nSpecial Political and Decolonization Committee \n(Fourth Committee) \nAgenda item 48 \nInternational cooperation in the peaceful uses of outer space \n \n \n \n \n \nMorocco:* draft resolution \n \n \n \n International cooperation in the peaceful uses of outer space \n \n \n \nThe General Assembly, \n \nRecalling its resolutions 51/122 of 13 December 1996, 54/68 of 6 December \n1999, 59/2 of 20 October 2004, 61/110 and 61/111 of 14 December 2006, 62/101 of \n17 December 2007, 62/217 of 22 December 2007, 65/97 of 10 December 2010, 65/271 \nof 7 April 2011, 66/71 of 9 December 2011, 67/113 of 18 December 2012, 68/50 of \n5 December 2013, 68/74 and 68/75 of 11 December 2013, 69/85 of 5 December 2014, \n70/1 of 25 September 2015, 70/82 of 9 December 2015, 70/230 of 23 December 2015, \n71/90 of 6 December 2016, 72/77 and 72/78 of 7 December 2017, 73/6 of 26 October \n2018, 73/91 of 7 December 2018, 74/82 of 13 December 2019, 75/92 of 10 December \n2020, 76/3 of 25 October 2021, 76/76 of 9 December 2021, 77/120 and 77/121 of \n12 December 2022 and 79/86 and 79/87 of 4 December 2024, \n \nEmphasizing the significant progress in the development of space science and \ntechnology and their applications that has enabled humans to explore the universe, \nand the extraordinary achievements made in space exploration efforts, including \ndeepening the understanding of the planetary system and the Sun and the Earth itself, \nin the use of space science and technology for the benefit of all humankind and in the \ndevelopment of the international legal regime governing space activities, \n \nRecognizing, in that regard, the unique platform at the global level for \ninternational cooperation in space activities represented by the Committee on the \nPeaceful Uses of Outer Space and its Scientific and Technical Subcommittee and Legal \nSubcommittee and assisted by the Office for Outer Space Affairs of the Secretariat, \n \nDeeply convinced of the common interest of all humankind in promoting and \nexpanding the exploration and use of outer space, as the province of all humankind, \nfor peaceful purposes and in continuing efforts to extend to all Member States the \nbenefits derived therefrom, and also of the importance of international cooperation in \nthis field, for which the United Nations should continue to provide a focal point, \n \n \n* In its capacity as Chair of the Committee on the Peaceful Uses of Outer Space. \n\nA/C.4/80/L.8 \n \n25-17043\n2/9 \n \n \nReaffirming the importance of international cooperation in developing the rule \nof international law, including the relevant norms of international space law and their \nimportant role in international cooperation for the exploration and use of outer space \nfor peaceful purposes, and of the widest possible adherence to international treaties \nthat promote the peaceful uses of outer space in order to meet emerging new \nchallenges, especially for developing countries, \n \nSeriously concerned about the possibility of an arms race in outer space, and \nbearing in mind the importance of article IV of the Treaty on Principles Governing \nthe Activities of States in the Exploration and Use of Outer Space, including the Moon \nand Other Celestial Bodies,1 \n \nRecognizing that all Member States, in particular those with major space \ncapabilities, should contribute actively to the prevention of an arms race in outer \nspace with a view to promoting and strengthening international cooperation in the \nexploration and use of outer space for peaceful purposes, \n \nDeeply concerned about the fragility of the space environment and the \nchallenges to the long-term sustainability of outer space activities, in particular the \nimpact of space debris, which is an issue of concern to all nations, \n \nNoting the progress achieved in the development of peaceful space exploration \nand applications, as well as in various national and cooperative space projects, and \nthe importance of further developing the legal framework to strengthen international \ncooperation in space, \n \nConvinced that space science and technology and their applications, including \nsatellite communications, Earth observation systems and satellite navigation \ntechnologies, provide indispensable tools for viable long-term solutions for \nsustainable development and can contribute more effectively to efforts to promote the \ndevelopment of all countries and regions of the world, and stressing in that regard the \nneed to harness the benefits of space technology towards implementing the 2030 \nAgenda for Sustainable Development,2 \n \nSeriously concerned about the devastating impact of disasters,3 and desirous of \nenhancing international coordination and cooperation at the global level in disaster \nmanagement and emergency response through greater access to and use of space-\nbased services and geospatial information for all countries and facilitating capacity-\nbuilding and institutional strengthening for disaster management, in particular in \ndeveloping countries, \n \nFirmly convinced that the use of space science and technology and their \napplications in areas such as telehealth, tele-education, disaster management, \nenvironmental protection, natural resources management and ocean and climate \nmonitoring contribute to achieving the objectives of the global conferences of the \nUnited Nations that address various aspects of economic, social and cultural \ndevelopment, particularly poverty eradication, \n \nDeeply concerned about the devastating effects of infectious diseases, including \nthe coronavirus disease (COVID-19) pandemic and Ebola virus disease, to the \ndetriment of human life, society and development, and urging the international \ncommunity to enhance the role of space-based solutions, in particular \ntele-epidemiology, in monitoring, preparedness and response activities, \n__________________ \n \n1 United Nations, Treaty Series, vol. 610, No. 8843. \n \n2 Resolution 70/1. \n \n3 The term \u201cdisasters\u201d refers to natural or technological disasters. \n\nA/C.4/80/L.8\n \n3/9\n25-17043 \n \n \nRecalling the fact that the United Nations Conference on Sustainable Development, \nheld in Rio de Janeiro, Brazil, from 20 to 22 June 2012, recognized the important role that \nspace science and technology play in promoting sustainable development,4 \n \nRecognizing the \u201cSpace2030\u201d Agenda: space as a driver of sustainable development \nand its implementation plan5 as a forward-looking strategy for reaffirming and \nstrengthening the contribution of space activities and space tools for the achievement \nof global agendas,6 \n \nBearing in mind the deliberations at the commencement of the seventy-ninth \nsession of the General Assembly, which reaffirmed the importance of the widest \npossible adherence to and full compliance with the Outer Space Treaty, and the role \nof the Committee on the Peaceful Uses of Outer Space in discussing the establishment \nof new frameworks for space traffic, space debris and space resources, 7 \n \nRecognizing the Outer Space Treaty as the cornerstone of the international legal \nregime governing outer space activities,8 \n \nHaving considered the report of the Committee on the Peaceful Uses of Outer \nSpace on the work of its sixty-eighth session,9 \n1. \nEndorses the report of the Committee on the Peaceful Uses of Outer Space \non the work of its sixty-eighth session; \n \n2. \nAgrees that the Committee, at its sixty-ninth session, should consider the \nsubstantive items recommended at its sixty-eighth session,10 taking into account the \nconcerns of all countries, in particular those of developing countries; \n \n3. \nEncourages the Committee to further consult on the proposal to hold a \nfourth United Nations Conference on the Peaceful Exploration of Outer Space \n(UNISPACE IV) in 2027;11 \n \n4. \nNotes with satisfaction that, at its sixty-fourth session, the Legal \nSubcommittee and its working groups continued their work,12 as mandated by the General \nAssembly in its resolution 79/87; \n \n5. \nAgrees that the Legal Subcommittee, at its sixty-fifth session, should \nconsider the substantive items and reconvene the working groups recommended by \nthe Committee,13 including holding intersessional consultations as necessary, taking \ninto account the concerns of all countries, in particular those of developing countries; \n__________________ \n \n4 Resolution 66/288, annex, para. 274. \n \n5 Resolution 76/3. \n \n6 The 2030 Agenda for Sustainable Development, the Sendai Framework for Disaster Risk \nReduction 2015\u20132030 and the Paris Agreement. \n \n7 Resolution 79/1, action 56. \n \n8 Ibid. \n \n9 Official Records of the General Assembly, Eightieth Session, Supplement No. 20 (A/80/20). \n \n10 Ibid., para. 324. \n \n11 Ibid., para. 259; see also resolution 79/1, action 56. \n \n12 Official Records of the General Assembly, Eightieth Session, Supplement No. 20 (A/80/20), \nchap. II, sect. C; see also A/AC.105/1362. \n \n13 Official Records of the General Assembly, Eightieth Session, Supplement No. 20 (A/80/20), \nparas. 159\u2013161. \n\nA/C.4/80/L.8 \n \n25-17043\n4/9 \n \n \n6. \nUrges Member States that have not yet become Parties to the international \ntreaties governing the uses of outer space14 to give consideration to ratifying or \nacceding to those treaties in accordance with their national law, as well as incorporating \nthem into their national legislation; \n \n7. \nUrges Member States that are not yet members of the Committee on the \nPeaceful Uses of Outer Space to give consideration to applying for membership of \nthe Committee as a unique platform for international cooperation in the exploration \nand use of outer space for peaceful purposes;15 \n \n8. \nNotes with satisfaction that the space law curriculum developed by the \nOffice for Outer Space Affairs of the Secretariat and published in all official \nlanguages of the United Nations could encourage further studies within Member \nStates in cooperation with relevant entities in support of capacity-building efforts in \nspace law and policy; \n \n9. \nAlso notes with satisfaction that, at its sixty-second session, the Scientific \nand Technical Subcommittee and its working groups continued their work,16 as \nmandated by the General Assembly in its resolution 79/87; \n \n10. Agrees that the Scientific and Technical Subcommittee, at its sixty-third \nsession, should consider the substantive items and reconvene the working groups \nrecommended by the Committee,17 including holding intersessional consultations as \nnecessary, taking into account the concerns of all countries, in particular those of \ndeveloping countries; \n \n11. Recalls with satisfaction the establishment of the Space and Global Health \nPlatform, based in Geneva, welcomes the progress in the work of the Space and \nGlobal Health Network,18 and reiterates its request to the Office to strengthen \ncapacity-building and networking in Africa, Asia and the Pacific and Latin America \nand the Caribbean, through regional technical cooperation projects, and to support \nfield projects for strengthening collaboration between the space and global health \nsectors as an efficient strategy for making better use of space science and technology \nfor access to global health for beneficiary States and taking better advantage of \nopportunities offered by bilateral or multilateral collaboration, as mandated by the \nGeneral Assembly in its resolution 77/120; \n \n12. Notes with appreciation that the long-term strategy on space and global \nhealth for the period 2025\u20132035 serves as an effective framework for the \nimplementation of recommendations contained in resolution 77/120;19 \n \n13. Reiterates the importance of information-sharing in discovering, \nmonitoring and physically characterizing potentially hazardous near-Earth objects to \n__________________ \n \n14 Treaty on Principles Governing the Activities of States in the Exploration and Use of Outer \nSpace, including the Moon and Other Celestial Bodies (United Nations, Treaty Series, vol. 610, \nNo. 8843); Agreement on the Rescue of Astronauts, the Return of Astronauts and the Return of \nObjects Launched into Outer Space (United Nations, Treaty Series, vol. 672, No. 9574); \nConvention on International Liability for Damage Caused by Space Objects (United Nations, \nTreaty Series, vol. 961, No. 13810); Convention on Registration of Objects Launched into Outer \nSpace (United Nations, Treaty Series, vol. 1023, No. 15020); and Agreement Governing the \nActivities of States on the Moon and Other Celestial Bodies (United Nations, Treaty Series, \nvol. 1363, No. 23002). \n \n15 Resolution 76/3, para. 10. \n \n16  Official Records of the General Assembly, Eightieth Session, Supplement No. 20 (A/80/20), \nchap. II, sect. B; see also A/AC.105/1338. \n \n17  Official Records of the General Assembly, Eightieth Session, Supplement No. 20 (A/80/20), \nparas. 125\u2013127. \n \n18 Ibid., para. 116. \n \n19 Ibid., para. 115; see also A/AC.105/C.1/127. \n\nA/C.4/80/L.8\n \n5/9\n25-17043 \n \nensure that all countries, in particular developing countries with limited capacity for \npredicting and mitigating a near-Earth object impact, are aware of potential threats, \nemphasizes the need for capacity-building for effective emergency response and \ndisaster management in the event of a near-Earth object impact, and notes with \nsatisfaction the work carried out by the International Asteroid Warning Network and \nthe Space Mission Planning Advisory Group to strengthen international cooperation \nto mitigate the potential threat posed by near-Earth objects, with the support of the \nOffice, serving as the permanent secretariat of the Advisory Group; 20 \n \n14. Recalls with satisfaction the adoption by the Committee of the preamble and \n21 Guidelines for the Long-term Sustainability of Outer Space Activities, as contained \nin annex II to the report of the Committee on its sixty-second session,21 recalls that the \nCommittee encouraged States and international intergovernmental organizations to \nvoluntarily take measures to ensure that the Guidelines were implemented to the \ngreatest extent feasible and practicable, and emphasizes that the Committee serves as \nthe principal forum for continued institutionalized dialogue on issues related to the \nimplementation and review of the Guidelines; \n \n15. Notes with satisfaction the establishment, by the Working Group on the \nLong-term Sustainability of Outer Space Activities of the Scientific and Technical \nSubcommittee, of the Expert Group on Space Situational Awareness;22 \n \n16. Notes with appreciation that some Member States are already \nimplementing space debris mitigation measures on a voluntary basis, through national \nmechanisms and consistent with the Space Debris Mitigation Guidelines of the \nInter-Agency Space Debris Coordination Committee and with the Space Debris \nMitigation Guidelines of the Committee on the Peaceful Uses of Outer Space, 23 \nendorsed by the General Assembly in its resolution 62/217, and invites other States \nto implement, through relevant national mechanisms, the Space Debris Mitigation \nGuidelines of the Committee on the Peaceful Uses of Outer Space; \n \n17. Considers that it is essential that Member States pay urgent attention to the \nproblem of the gradually increasing probability of collisions of space objects, especially \nthose with nuclear power sources, with space debris, and other aspects of space debris, \ncalls for the continuation of national research on this question, for the development \nof improved technology for the monitoring of space debris and for the compilation \nand dissemination of data on space debris, considers that, to the extent possible, \ninformation thereon should be provided to the Scientific and Technical Subcommittee, \nand agrees that international cooperation is needed to expand appropriate and \naffordable strategies to minimize the impact of space debris on future space missions; \n \n18. Urges all Member States, in particular those with major space capabilities, \nto contribute actively to the goal of preventing an arms race in outer space as an \nessential condition for the promotion of international cooperation in the exploration \nand use of outer space for peaceful purposes; \n \n19. Requests the Committee to continue to consider, as a matter of priority, \nways and means of maintaining outer space for peaceful purposes and to report \nthereon to the General Assembly at its eighty-first session, and agrees that the \nCommittee should continue to consider the broader perspective of space security and \nassociated matters that would be instrumental in ensuring the safe and responsible \nconduct of space activities, including ways to promote international, regional and \ninterregional cooperation to that end; \n__________________ \n \n20 A/AC.105/1338, paras. 95, 96 (a), 98\u2013100 and 104\u2013106. \n \n21  Official Records of the General Assembly, Seventy-fourth Session, Supplement No. 20 (A/74/20). \n \n22  Ibid., Eightieth Session, Supplement No. 20 (A/80/20), paras. 110\u2013112. \n \n23  Ibid., Sixty-second Session, Supplement No. 20 (A/62/20), paras. 117 and 118 and annex. \n\nA/C.4/80/L.8 \n \n25-17043\n6/9 \n \n \n20. Decides to convene a joint half-day panel discussion of the Disarmament \nand International Security Committee (First Committee) and the Special Political and \nDecolonization Committee (Fourth Committee) to address possible challenges to \nspace security and sustainability, and to include in the provisional agenda of its \neighty-first session, under the item entitled \u201cInternational cooperation in the peaceful \nuses of outer space\u201d, the sub-item entitled \u201cJoint panel discussion of the First and \nFourth Committees on possible challenges to space security and sustainability\u201d; \n \n21. Recalls that the Committee should carry out a midterm review of progress \nmade in implementing the \u201cSpace2030\u201d Agenda,24 and notes that Member States and \norganizations having observer status with the Committee will continue to be invited \nto submit reports on the implementation of the \u201cSpace2030\u201d Agenda for consideration \nby the Committee at its sixty-ninth session; \n \n22. Notes with satisfaction the establishment of the Action Team on Lunar \nActivities Consultation of the Committee to facilitate international consultations to \nensure that lunar activities are conducted in a safe, peaceful and transparent manner, \nand welcomes the establishment of the Bureau and the endorsement of the workplan \nof the Action Team;25 \n \n23. Emphasizes the central role of the Office in promoting international \ncooperation in the exploration and peaceful uses of outer space for economic, social \nand scientific development, in particular for the benefit of developing countries; \n \n24. Notes with satisfaction the programme of work undertaken by the Office \nin 2025 to strengthen international cooperation in the conduct of space activities for \npeaceful purposes and the use of space science and technology and their applications \ntowards the achievement of the internationally agreed Sustainable Development \nGoals, including the workshops and symposiums conducted to build capacity, the \nassistance provided to developing countries, at their request, in the development of \nnational space policy and legislation in conformity with international space law, and \nactions implemented to strengthen institutional capacity in space activities; \n \n25. Welcomes, in that regard, the activities being carried out by the Office to \npromote gender equality and the increased role of women in space activities, \nincluding through targeted capacity-building and technical advisory activities, and \nefforts to encourage enhanced involvement of women and girls in science, \ntechnology, engineering and mathematics education, and invites Member States to \nmake voluntary contributions to those activities; \n \n26. Requests the Office to continue to apprise the Committee and its Scientific \nand Technical Subcommittee and Legal Subcommittee, at their respective sessions in \n2026, of the status of its capacity-building activities; \n \n27. Recognizes with appreciation the capacity-building activities under the \nUnited Nations Programme on Space Applications, which provide unique benefits for \nMember States, in particular developing countries, participating in those activities, \nand calls upon the Office to further its support in this regard, particularly to \ndeveloping countries;26 \n \n28. Notes with satisfaction the activities carried out under the United Nations \nPlatform for Space-based Information for Disaster Management and Emergency \nResponse (UN-SPIDER), and recognizes the significant achievements made and the \nadvisory support provided to Member States, in particular to developing countries, \n__________________ \n \n24 Resolution 76/3, para. 30. \n \n25  Ibid., Eightieth Session, Supplement No. 20 (A/80/20), paras. 253 and 257 and annex I. \n \n26  See A/AC.105/1338, para. 41. \n\nA/C.4/80/L.8\n \n7/9\n25-17043 \n \nwithin the framework of UN-SPIDER since its establishment in 200627 with the \nvaluable contributions of its network of regional support offices, and encourages \nMember States, on a voluntary basis, to provide the programme with the additional \nresources necessary to address the increasing demand for support successfully and in \na timely manner, while taking into consideration recent natural disaster events, \nincluding severe weather and sea-level rise due to climate change; \n \n29. Reiterates the importance of the Sendai Framework for Disaster Risk \nReduction 2015\u20132030,28 in which the value of space-based technology and Earth \nobservation for disaster management and emergency response is recognized, and, in \nthat regard, notes with satisfaction the efforts of the Office and its UN-SPIDER \nprogramme towards promoting international cooperation as a way to enhance the use \nof space-based technologies and related services at the national and local levels in \ncontributing to the implementation of the Sendai Framework and the 2030 Agenda \nfor Sustainable Development; \n \n30. Notes with satisfaction the continuous progress made by the International \nCommittee on Global Navigation Satellite Systems with the support of the Office, in its \ncapacity as executive secretariat of the International Committee, towards achieving \ncompatibility and interoperability among global and regional space-based positioning, \nnavigation and timing systems and in the promotion of the use of global navigation \nsatellite systems and their integration into national infrastructure, particularly in \ndeveloping countries, and notes with appreciation that the International Committee held \nits nineteenth meeting in Busan, Republic of Korea, from 19 to 24 October 2025; \n \n31. Notes with appreciation that the regional centres for space science and \ntechnology education, affiliated to the United Nations, namely, the African regional \ncentres for space science and technology education in the French and English \nlanguages, located in Morocco and Nigeria, respectively, the Regional Centre for \nSpace Science and Technology Education for Asia and the Pacific, located in China, \nthe Centre for Space Science and Technology Education in Asia and the Pacific, \nlocated in India, the Regional Centre for Space Science and Technology Education \nfor Latin America and the Caribbean, with campuses located in Brazil and Mexico, \nand the Regional Centre for Space Science and Technology Education for Western \nAsia, located in Jordan, have continued their education programmes in 2025, \nencourages the regional centres to continue to promote greater participation of women \nin their education programmes, and agrees that the regional centres should continue \nto report to the Committee on the Peaceful Uses of Outer Space on their activities; \n \n32. Emphasizes that regional and interregional cooperation in the field of \nspace activities is essential to strengthen the peaceful uses of outer space, assist \nMember States in the development of their space capabilities and contribute to the \nimplementation of the 2030 Agenda for Sustainable Development, to that end requests \nrelevant regional organizations and their groups of experts to offer the assistance \nnecessary so that countries can carry out the recommendations of regional \nconferences, and in that regard notes the importance of the equal participation of \nwomen in all fields of science and technology; \n \n33. Recognizes, in that regard, the important role played by such organizations \nas the Asia-Pacific Space Cooperation Organization and the European Space Agency \nand by conferences and other mechanisms, such as the African Leadership Conference \non Space Science and Technology for Sustainable Development, the Asia-Pacific \nRegional Space Agency Forum and the Space Conference of the Americas, in \nstrengthening regional and international cooperation among States; \n__________________ \n \n27  See resolution 61/110. \n \n28  Resolution 69/283, annex II. \n\nA/C.4/80/L.8 \n \n25-17043\n8/9 \n \n \n34. Recalls the adoption of the African Space Policy and Strategy by the \nAssembly of the African Union at its twenty-sixth ordinary session, held in Addis \nAbaba on 30 and 31 January 2016, also recalls that this achievement marks the first \nstep towards the realization of an African outer space programme within the \nframework of the African Union Agenda 2063, and welcomes in that regard the \ninauguration of the African Space Agency, headquartered in Egypt; \n \n35. Emphasizes the need to increase the benefits of space technology and its \napplications and to contribute to an orderly growth of space activities favourable to \nsustained economic growth and sustainable development in all countries, including \nstrengthening sustainable spatial data infrastructure at the regional and national levels \nand building resilience to reduce the consequences of disasters, in particular in \ndeveloping countries; \n \n36. Reiterates the need to promote the benefits of space technology and its \napplications in the major United Nations conferences and summits for economic, \nsocial and cultural development and related fields, and recognizes that the fundamental \nsignificance of space science and technology and their applications for global, \nregional, national and local sustainable development processes should be promoted \nin the formulation of policies and programmes of action and their implementation, \nincluding through efforts towards achieving the objectives of those conferences and \nsummits and in implementing the 2030 Agenda for Sustainable Development; \n \n37. Encourages Member States, to that end, to promote the inclusion in those \nconferences, summits and processes of the relevance of space science and technology \napplications and the use of space-derived geospatial data, and in general, space-based \ndata and infrastructures, with the involvement of the Office; \n \n38. Encourages the Office to take active part in those conferences, summits \nand processes and other activities in support of their objectives, as appropriate, and \nto conduct capacity-building activities, hold lectures and participate in academic and \nresearch activities to foster international cooperation in the peaceful uses of outer space; \n \n39. Urges the Inter-Agency Meeting on Outer Space Activities (UN-Space), \nunder the leadership of the Office, to continue to examine how space science and \ntechnology and their applications could contribute to the 2030 Agenda for Sustainable \nDevelopment, and encourages entities of the United Nations system to increase their \ncollaboration, including through UN-Space, with a view to better coordinating their \ndata-sharing, building United Nations system capacity and cooperating on the \nprocurement of space-based information, to achieve cost savings in that regard, to \naccelerate the application of space assets in order to achieve the Sustainable Development \nGoals, and to participate, as appropriate, in UN-Space coordination efforts; \n \n40. Encourages the Office to continue to conduct capacity-building and \noutreach activities associated with space security and transparency and confidence-\nbuilding measures in outer space activities, as appropriate, and within the context of the \nlong-term sustainability of outer space activities, in particular for developing countries; \n \n41. \nAlso encourages the Office to explore existing avenues and new opportunities \nto increase its capability to meet the growing demand for support to strengthen the capacity \nof countries, in particular developing countries, in using space science and technology and \ntheir applications and to inform the Committee of those efforts; \n \n42. Agrees that the Office should pursue greater engagement with industry and \nprivate sector entities to further their support for and contributions to the overall work \nof the Office;29 \n__________________ \n \n29 Official Records of the General Assembly, Seventy-second Session, Supplement No. 20 \n(A/72/20), para. 326. \n\nA/C.4/80/L.8\n \n9/9\n25-17043 \n \n \n43. Appeals to Governments, the relevant entities of the United Nations \nsystem, intergovernmental and non-governmental organizations, institutions, industry \nand private sector entities and individuals to urgently increase their voluntary \ncontributions to the trust fund in support of the United Nations Programme on the \nPeaceful Uses of Outer Space in order to support the efforts of the Office to secure \nadditional resources to facilitate the full implementation of its programme of work, \nincluding, where appropriate, the financing of special projects, and otherwise to assist \nthe Office in carrying out technical cooperation and assistance activities, in particular \nfor developing countries; \n \n44. Recalls that the Western European and other States, the Asia-Pacific States \nand the Eastern European States have nominated their candidates for the offices of \nChair of the Committee, Chair of the Scientific and Technical Subcommittee and First \nVice-Chair of the Committee, respectively, for the period 2026\u20132027,30 notes that the \nLatin American and Caribbean States have nominated their candidates for the office \nof Chair of the Legal Subcommittee for 2026 and 2027, and urges the African States \nto nominate their candidate for the office of Second Vice-Chair/Rapporteur of the \nCommittee for the period 2026\u20132027, before the next session of the Committee, to be \nheld in 2026;31 \n \n45. Reiterates, with regard to the composition of the bureaux of the Committee \nand its subcommittees for the period 2026\u20132027,32 that the Committee and its \nsubcommittees should elect their officers at their respective sessions in 2026 in \naccordance with that composition; \n \n46. Urges the African States, the Asia-Pacific States, the Eastern European \nStates, the Latin American and Caribbean States and the Western European and other \nStates to nominate their candidates for the offices of Chair of the Scientific and \nTechnical Subcommittee, First Vice-Chair of the Committee, Chair of the Legal \nSubcommittee, Chair of the Committee and Second Vice-Chair/Rapporteur of the \nCommittee, respectively, for the period 2028\u20132029, before the next session of the \nCommittee, to be held in 2026;33 \n \n47. Endorses the decision of the Committee to grant permanent observer status \nto the African Space Agency;34  \n \n48. Also endorses the decision of the Committee to grant the status of observer \nto the International Council on Monuments and Sites, the Alliance for Collaboration in \nthe Exploration of Space (ACES Worldwide), the Lunar Policy Platform Foundation, \nAeroAI Global Solutions, Inc., and Women in Aerospace Europe, in accordance with \nthe procedures of the Committee;35 \n \n49. Encourages the regional groups to promote active participation in the \nwork of the Committee and its subsidiary bodies by the States members of the \nCommittee that are also members of the respective regional groups. \n \n__________________ \n \n30 Ibid., Seventy-ninth Session, Supplement No. 20 (A/79/20), paras. 380 and 381; and official \ncommunications from the Office for Outer Space Affairs to States members of the Committee, \ndated 18 and 25 October 2024. \n \n31 Official Records of the General Assembly, Eightieth Session, Supplement No. 20 (A/80/20), \nparas. 301 and 302. \n \n32 Ibid., Fifty-eighth Session, Supplement No. 20 (A/58/20), para. 12 and annex II. \n \n33 Ibid., Eightieth Session, Supplement No. 20 (A/80/20), paras. 303 and 304. \n \n34  Ibid., paras. 308 and 309. \n \n35  Ibid., paras. 310\u2013320. \n",
  "paragraphs": {
    "1": "Endorses the report of the Committee on the Peaceful Uses of Outer Space on the work of its sixty-eighth session;",
    "2": "Agrees that the Committee, at its sixty-ninth session, should consider the substantive items recommended at its sixty-eighth session,10 taking into account the concerns of all countries, in particular those of developing countries;",
    "3": "Encourages the Committee to further consult on the proposal to hold a fourth United Nations Conference on the Peaceful Exploration of Outer Space (UNISPACE IV) in 2027;11",
    "4": "Notes with satisfaction that, at its sixty-fourth session, the Legal Subcommittee and its working groups continued their work,12 as mandated by the General Assembly in its resolution 79/87;",
    "5": "Agrees that the Legal Subcommittee, at its sixty-fifth session, should consider the substantive items and reconvene the working groups recommended by the Committee,13 including holding intersessional consultations as necessary, taking into account the concerns of all countries, in particular those of developing countries;",
    "6": "Urges Member States that have not yet become Parties to the international treaties governing the uses of outer space14 to give consideration to ratifying or acceding to those treaties in accordance with their national law, as well as incorporating them into their national legislation;",
    "7": "Urges Member States that are not yet members of the Committee on the Peaceful Uses of Outer Space to give consideration to applying for membership of the Committee as a unique platform for international cooperation in the exploration and use of outer space for peaceful purposes;15",
    "8": "Notes with satisfaction that the space law curriculum developed by the Office for Outer Space Affairs of the Secretariat and published in all official languages of the United Nations could encourage further studies within Member States in cooperation with relevant entities in support of capacity-building efforts in space law and policy;",
    "9": "Also notes with satisfaction that, at its sixty-second session, the Scientific and Technical Subcommittee and its working groups continued their work,16 as mandated by the General Assembly in its resolution 79/87;",
    "10": "Agrees that the Scientific and Technical Subcommittee, at its sixty-third session, should consider the substantive items and reconvene the working groups recommended by the Committee,17 including holding intersessional consultations as necessary, taking into account the concerns of all countries, in particular those of developing countries;",
    "11": "Recalls with satisfaction the establishment of the Space and Global Health Platform, based in Geneva, welcomes the progress in the work of the Space and Global Health Network,18 and reiterates its request to the Office to strengthen capacity-building and networking in Africa, Asia and the Pacific and Latin America and the Caribbean, through regional technical cooperation projects, and to support field projects for strengthening collaboration between the space and global health sectors as an efficient strategy for making better use of space science and technology for access to global health for beneficiary States and taking better advantage of opportunities offered by bilateral or multilateral collaboration, as mandated by the General Assembly in its resolution 77/120;",
    "12": "Notes with appreciation that the long-term strategy on space and global health for the period 2025\u20132035 serves as an effective framework for the implementation of recommendations contained in resolution 77/120;19",
    "13": "Reiterates the importance of information-sharing in discovering, monitoring and physically characterizing potentially hazardous near-Earth objects to ensure that all countries, in particular developing countries with limited capacity for predicting and mitigating a near-Earth object impact, are aware of potential threats, emphasizes the need for capacity-building for effective emergency response and disaster management in the event of a near-Earth object impact, and notes with satisfaction the work carried out by the International Asteroid Warning Network and the Space Mission Planning Advisory Group to strengthen international cooperation to mitigate the potential threat posed by near-Earth objects, with the support of the Office, serving as the permanent secretariat of the Advisory Group; 20",
    "14": "Recalls with satisfaction the adoption by the Committee of the preamble and 21 Guidelines for the Long-term Sustainability of Outer Space Activities, as contained in annex II to the report of the Committee on its sixty-second session,21 recalls that the Committee encouraged States and international intergovernmental organizations to voluntarily take measures to ensure that the Guidelines were implemented to the greatest extent feasible and practicable, and emphasizes that the Committee serves as the principal forum for continued institutionalized dialogue on issues related to the implementation and review of the Guidelines;",
    "15": "Notes with satisfaction the establishment, by the Working Group on the Long-term Sustainability of Outer Space Activities of the Scientific and Technical Subcommittee, of the Expert Group on Space Situational Awareness;22",
    "16": "Notes with appreciation that some Member States are already implementing space debris mitigation measures on a voluntary basis, through national mechanisms and consistent with the Space Debris Mitigation Guidelines of the Inter-Agency Space Debris Coordination Committee and with the Space Debris Mitigation Guidelines of the Committee on the Peaceful Uses of Outer Space, 23 endorsed by the General Assembly in its resolution 62/217, and invites other States to implement, through relevant national mechanisms, the Space Debris Mitigation Guidelines of the Committee on the Peaceful Uses of Outer Space;",
    "17": "Considers that it is essential that Member States pay urgent attention to the problem of the gradually increasing probability of collisions of space objects, especially those with nuclear power sources, with space debris, and other aspects of space debris, calls for the continuation of national research on this question, for the development of improved technology for the monitoring of space debris and for the compilation and dissemination of data on space debris, considers that, to the extent possible, information thereon should be provided to the Scientific and Technical Subcommittee, and agrees that international cooperation is needed to expand appropriate and affordable strategies to minimize the impact of space debris on future space missions;",
    "18": "Urges all Member States, in particular those with major space capabilities, to contribute actively to the goal of preventing an arms race in outer space as an essential condition for the promotion of international cooperation in the exploration and use of outer space for peaceful purposes;",
    "19": "Requests the Committee to continue to consider, as a matter of priority, ways and means of maintaining outer space for peaceful purposes and to report thereon to the General Assembly at its eighty-first session, and agrees that the Committee should continue to consider the broader perspective of space security and associated matters that would be instrumental in ensuring the safe and responsible conduct of space activities, including ways to promote international, regional and interregional cooperation to that end;",
    "20": "Decides to convene a joint half-day panel discussion of the Disarmament and International Security Committee (First Committee) and the Special Political and Decolonization Committee (Fourth Committee) to address possible challenges to space security and sustainability, and to include in the provisional agenda of its eighty-first session, under the item entitled \u201cInternational cooperation in the peaceful uses of outer space\u201d, the sub-item entitled \u201cJoint panel discussion of the First and Fourth Committees on possible challenges to space security and sustainability\u201d;",
    "21": "Recalls that the Committee should carry out a midterm review of progress made in implementing the \u201cSpace2030\u201d Agenda,24 and notes that Member States and organizations having observer status with the Committee will continue to be invited to submit reports on the implementation of the \u201cSpace2030\u201d Agenda for consideration by the Committee at its sixty-ninth session;",
    "22": "Notes with satisfaction the establishment of the Action Team on Lunar Activities Consultation of the Committee to facilitate international consultations to ensure that lunar activities are conducted in a safe, peaceful and transparent manner, and welcomes the establishment of the Bureau and the endorsement of the workplan of the Action Team;25",
    "23": "Emphasizes the central role of the Office in promoting international cooperation in the exploration and peaceful uses of outer space for economic, social and scientific development, in particular for the benefit of developing countries;",
    "24": "Notes with satisfaction the programme of work undertaken by the Office in 2025 to strengthen international cooperation in the conduct of space activities for peaceful purposes and the use of space science and technology and their applications towards the achievement of the internationally agreed Sustainable Development Goals, including the workshops and symposiums conducted to build capacity, the assistance provided to developing countries, at their request, in the development of national space policy and legislation in conformity with international space law, and actions implemented to strengthen institutional capacity in space activities;",
    "25": "Welcomes, in that regard, the activities being carried out by the Office to promote gender equality and the increased role of women in space activities, including through targeted capacity-building and technical advisory activities, and efforts to encourage enhanced involvement of women and girls in science, technology, engineering and mathematics education, and invites Member States to make voluntary contributions to those activities;",
    "26": "Requests the Office to continue to apprise the Committee and its Scientific and Technical Subcommittee and Legal Subcommittee, at their respective sessions in 2026, of the status of its capacity-building activities;",
    "27": "Recognizes with appreciation the capacity-building activities under the United Nations Programme on Space Applications, which provide unique benefits for Member States, in particular developing countries, participating in those activities, and calls upon the Office to further its support in this regard, particularly to developing countries;26",
    "28": "Notes with satisfaction the activities carried out under the United Nations Platform for Space-based Information for Disaster Management and Emergency Response (UN-SPIDER), and recognizes the significant achievements made and the advisory support provided to Member States, in particular to developing countries, within the framework of UN-SPIDER since its establishment in 200627 with the valuable contributions of its network of regional support offices, and encourages Member States, on a voluntary basis, to provide the programme with the additional resources necessary to address the increasing demand for support successfully and in a timely manner, while taking into consideration recent natural disaster events, including severe weather and sea-level rise due to climate change;",
    "29": "Reiterates the importance of the Sendai Framework for Disaster Risk Reduction 2015\u20132030,28 in which the value of space-based technology and Earth observation for disaster management and emergency response is recognized, and, in that regard, notes with satisfaction the efforts of the Office and its UN-SPIDER programme towards promoting international cooperation as a way to enhance the use of space-based technologies and related services at the national and local levels in contributing to the implementation of the Sendai Framework and the 2030 Agenda for Sustainable Development;",
    "30": "Notes with satisfaction the continuous progress made by the International Committee on Global Navigation Satellite Systems with the support of the Office, in its capacity as executive secretariat of the International Committee, towards achieving compatibility and interoperability among global and regional space-based positioning, navigation and timing systems and in the promotion of the use of global navigation satellite systems and their integration into national infrastructure, particularly in developing countries, and notes with appreciation that the International Committee held its nineteenth meeting in Busan, Republic of Korea, from 19 to 24 October 2025;",
    "31": "Notes with appreciation that the regional centres for space science and technology education, affiliated to the United Nations, namely, the African regional centres for space science and technology education in the French and English languages, located in Morocco and Nigeria, respectively, the Regional Centre for Space Science and Technology Education for Asia and the Pacific, located in China, the Centre for Space Science and Technology Education in Asia and the Pacific, located in India, the Regional Centre for Space Science and Technology Education for Latin America and the Caribbean, with campuses located in Brazil and Mexico, and the Regional Centre for Space Science and Technology Education for Western Asia, located in Jordan, have continued their education programmes in 2025, encourages the regional centres to continue to promote greater participation of women in their education programmes, and agrees that the regional centres should continue to report to the Committee on the Peaceful Uses of Outer Space on their activities;",
    "32": "Emphasizes that regional and interregional cooperation in the field of space activities is essential to strengthen the peaceful uses of outer space, assist Member States in the development of their space capabilities and contribute to the implementation of the 2030 Agenda for Sustainable Development, to that end requests relevant regional organizations and their groups of experts to offer the assistance necessary so that countries can carry out the recommendations of regional conferences, and in that regard notes the importance of the equal participation of women in all fields of science and technology;",
    "33": "Recognizes, in that regard, the important role played by such organizations as the Asia-Pacific Space Cooperation Organization and the European Space Agency and by conferences and other mechanisms, such as the African Leadership Conference on Space Science and Technology for Sustainable Development, the Asia-Pacific Regional Space Agency Forum and the Space Conference of the Americas, in strengthening regional and international cooperation among States;",
    "34": "Recalls the adoption of the African Space Policy and Strategy by the Assembly of the African Union at its twenty-sixth ordinary session, held in Addis Ababa on 30 and 31 January 2016, also recalls that this achievement marks the first step towards the realization of an African outer space programme within the framework of the African Union Agenda 2063, and welcomes in that regard the inauguration of the African Space Agency, headquartered in Egypt;",
    "35": "Emphasizes the need to increase the benefits of space technology and its applications and to contribute to an orderly growth of space activities favourable to sustained economic growth and sustainable development in all countries, including strengthening sustainable spatial data infrastructure at the regional and national levels and building resilience to reduce the consequences of disasters, in particular in developing countries;",
    "36": "Reiterates the need to promote the benefits of space technology and its applications in the major United Nations conferences and summits for economic, social and cultural development and related fields, and recognizes that the fundamental significance of space science and technology and their applications for global, regional, national and local sustainable development processes should be promoted in the formulation of policies and programmes of action and their implementation, including through efforts towards achieving the objectives of those conferences and summits and in implementing the 2030 Agenda for Sustainable Development;",
    "37": "Encourages Member States, to that end, to promote the inclusion in those conferences, summits and processes of the relevance of space science and technology applications and the use of space-derived geospatial data, and in general, space-based data and infrastructures, with the involvement of the Office;",
    "38": "Encourages the Office to take active part in those conferences, summits and processes and other activities in support of their objectives, as appropriate, and to conduct capacity-building activities, hold lectures and participate in academic and research activities to foster international cooperation in the peaceful uses of outer space;",
    "39": "Urges the Inter-Agency Meeting on Outer Space Activities (UN-Space), under the leadership of the Office, to continue to examine how space science and technology and their applications could contribute to the 2030 Agenda for Sustainable Development, and encourages entities of the United Nations system to increase their collaboration, including through UN-Space, with a view to better coordinating their data-sharing, building United Nations system capacity and cooperating on the procurement of space-based information, to achieve cost savings in that regard, to accelerate the application of space assets in order to achieve the Sustainable Development Goals, and to participate, as appropriate, in UN-Space coordination efforts;",
    "40": "Encourages the Office to continue to conduct capacity-building and outreach activities associated with space security and transparency and confidence- building measures in outer space activities, as appropriate, and within the context of the long-term sustainability of outer space activities, in particular for developing countries;",
    "41": "Also encourages the Office to explore existing avenues and new opportunities to increase its capability to meet the growing demand for support to strengthen the capacity of countries, in particular developing countries, in using space science and technology and their applications and to inform the Committee of those efforts;",
    "42": "Agrees that the Office should pursue greater engagement with industry and private sector entities to further their support for and contributions to the overall work of the Office;29",
    "43": "Appeals to Governments, the relevant entities of the United Nations system, intergovernmental and non-governmental organizations, institutions, industry and private sector entities and individuals to urgently increase their voluntary contributions to the trust fund in support of the United Nations Programme on the Peaceful Uses of Outer Space in order to support the efforts of the Office to secure additional resources to facilitate the full implementation of its programme of work, including, where appropriate, the financing of special projects, and otherwise to assist the Office in carrying out technical cooperation and assistance activities, in particular for developing countries;",
    "44": "Recalls that the Western European and other States, the Asia-Pacific States and the Eastern European States have nominated their candidates for the offices of Chair of the Committee, Chair of the Scientific and Technical Subcommittee and First Vice-Chair of the Committee, respectively, for the period 2026\u20132027,30 notes that the Latin American and Caribbean States have nominated their candidates for the office of Chair of the Legal Subcommittee for 2026 and 2027, and urges the African States to nominate their candidate for the office of Second Vice-Chair/Rapporteur of the Committee for the period 2026\u20132027, before the next session of the Committee, to be held in 2026;31",
    "45": "Reiterates, with regard to the composition of the bureaux of the Committee and its subcommittees for the period 2026\u20132027,32 that the Committee and its subcommittees should elect their officers at their respective sessions in 2026 in accordance with that composition;",
    "46": "Urges the African States, the Asia-Pacific States, the Eastern European States, the Latin American and Caribbean States and the Western European and other States to nominate their candidates for the offices of Chair of the Scientific and Technical Subcommittee, First Vice-Chair of the Committee, Chair of the Legal Subcommittee, Chair of the Committee and Second Vice-Chair/Rapporteur of the Committee, respectively, for the period 2028\u20132029, before the next session of the Committee, to be held in 2026;33",
    "47": "Endorses the decision of the Committee to grant permanent observer status to the African Space Agency;34",
    "48": "Also endorses the decision of the Committee to grant the status of observer to the International Council on Monuments and Sites, the Alliance for Collaboration in the Exploration of Space (ACES Worldwide), the Lunar Policy Platform Foundation, AeroAI Global Solutions, Inc., and Women in Aerospace Europe, in accordance with the procedures of the Committee;35",
    "49": "Encourages the regional groups to promote active participation in the work of the Committee and its subsidiary bodies by the States members of the Committee that are also members of the respective regional groups."
  },
  "agenda_items": [
    "Item 48"
  ],
  "symbol_references": [
    "A/C.4/80/L.8"
  ]
}