{
  "symbol": "A/C.3/80/L.61",
  "filename": "A_C.3_80_L.61.pdf",
  "title": "A/C.3/80/L.20/Rev.1",
  "text": "United Nations \nA/C.3/80/L.61\n \n \nGeneral Assembly \nDistr.: Limited \n14 November 2025 \nOriginal: English \n \n25-18531 (E)    181125 \n*2518531* \n \n \nEightieth session \nThird Committee \nAgenda item 67 \nPromotion and protection of the rights of children \n \n \n \n \n \nBelarus and Russian Federation: amendment to revised draft resolution \nA/C.3/80/L.20/Rev.1 \n \n \n \n Rights of the child \n \n \n1. \nIn the fourteenth preambular paragraph, replace \u201cwhich notes that young \nchildren are holders of all rights enshrined in the Convention and that early childhood \nis a critical period for the realization of these rights\u201d with \u201cand taking note of the \nstatement of the Committee on the Rights of the Child on article 5 of the Convention \n(2023)\u201d. \n2. \nDelete the fifteenth preambular paragraph. \n \n",
  "paragraphs": {
    "1": "In the fourteenth preambular paragraph, replace \u201cwhich notes that young children are holders of all rights enshrined in the Convention and that early childhood is a critical period for the realization of these rights\u201d with \u201cand taking note of the statement of the Committee on the Rights of the Child on article 5 of the Convention (2023)\u201d.",
    "2": "Delete the fifteenth preambular paragraph."
  },
  "agenda_items": [
    "Item 67"
  ],
  "symbol_references": [
    "A/C.3/80/L.61",
    "A/C.3/80/L.20"
  ]
}