{
  "symbol": "A/C.3/80/L.35",
  "filename": "A_C.3_80_L.35.pdf",
  "title": "Enhancement of international cooperation in the field of human rights",
  "text": "United Nations \nA/C.3/80/L.35\n \n \nGeneral Assembly \nDistr.: Limited \n4 November 2025 \nOriginal: English \n \n25-17758 (E)    101125     \n*2517758* \n \n \nEightieth session \nThird Committee \nAgenda item 71 (b) \nPromotion and protection of human rights: human rights \nquestions, including alternative approaches for improving \nthe effective enjoyment of human rights and \nfundamental freedoms \n \n \n \n \n \nCuba:* draft resolution \n \n \n \n Enhancement of international cooperation in the field of \nhuman rights \n \n \n \nThe General Assembly, \n \nReaffirming its commitment to promoting international cooperation, as set forth \nin the Charter of the United Nations, in particular Article 1, paragraph 3, as well as \nrelevant provisions of the Vienna Declaration and Programme of Action adopted by \nthe World Conference on Human Rights on 25 June 1993,1 for enhancing genuine \ncooperation among Member States in the field of human rights, \n \nRecalling its resolution 70/1 of 25 September 2015, entitled \u201cTransforming our \nworld: the 2030 Agenda for Sustainable Development\u201d, in which the General \nAssembly adopted a comprehensive, far-reaching and people-centred set of universal \nand transformative Sustainable Development Goals, \n \nRecalling also its adoption of the United Nations Millennium Declaration on \n8 September 2000, 2  its resolution 79/166 of 17 December 2024, Human Rights \nCouncil resolution 59/3 of 4 July 20253 and the resolutions of the Commission on \nHuman Rights on the enhancement of international cooperation in the field of human \nrights, \n \nRecalling further the World Conference against Racism, Racial Discrimination, \nXenophobia and Related Intolerance, held in Durban, South Africa, from 31 August to \n8 September 2001, the Durban Review Conference, held in Geneva from 20 to 24 April \n2009, and the political declarations of the high-level meetings of the General Assembly \n__________________ \n \n* On behalf of the States that are members of the Movement of Non-Aligned Countries, taking \ninto account also the provisions of General Assembly resolution ES-10/23 of 10 May 2024. \n \n1  A/CONF.157/24 (Part I), chap. III. \n \n2  Resolution 55/2. \n \n3  See Official Records of the General Assembly, Eightieth Session, Supplement No. 53 (A/80/53), \nchap. VI, sect. A. \n\nA/C.3/80/L.35 \n \n25-17758\n2/4 \n \nto commemorate the tenth4 and twentieth5 anniversaries of the adoption of the Durban \nDeclaration and Programme of Action, and their role in the enhancement of \ninternational cooperation in the field of human rights, \n \nRecognizing that the enhancement of international cooperation in the field of \nhuman rights is essential for the full achievement of the purposes of the United \nNations, including the effective promotion and protection of all human rights, \n \nRecognizing also that the promotion and protection of human rights should be \nbased on the principle of cooperation and genuine dialogue and aimed at \nstrengthening the capacity of Member States to comply with their human rights \nobligations for the benefit of all human beings, \n \nUnderlining that cooperation is not just a matter of relations of good-\nneighbourliness, coexistence or reciprocity, but rather of a willingness to look beyond \nmutual interests in order to advance the general interest, \n \nStressing the importance of international cooperation for improving the living \nconditions of all in every country, including, in particular, in developing countries, \n \nReaffirming that dialogue among religions, cultures and civilizations in the field \nof human rights could contribute greatly to the enhancement of international \ncooperation in this field, \n \nReiterating the important role that genuine human rights dialogue can play in \nthe enhancement of cooperation in the field of human rights at the bilateral, regional \nand international levels, \n \nRecognizing that the enhancement of international cooperation and genuine \ndialogue contributes to the effective functioning of the international human rights \nsystem, \n \nEmphasizing that human rights dialogue should be constructive and based on the \nprinciples of universality, indivisibility, objectivity, non-selectivity, non-politicization, \nmutual respect and equal treatment, with the aim of facilitating mutual understanding \nand strengthening constructive cooperation, including through capacity-building and \ntechnical cooperation between States, \n \nEmphasizing also the need for further progress in the promotion and \nencouragement of respect for all human rights and fundamental freedoms for all \nthrough, inter alia, international cooperation, \n \nUnderlining the fact that mutual understanding, dialogue, cooperation, \ntransparency and confidence-building are important elements in all activities for the \npromotion and protection of human rights, \n \nRecalling the adoption of resolution 2000/22 of 18 August 2000, on the \npromotion of dialogue on human rights issues, by the Subcommission on the \nPromotion and Protection of Human Rights at its fifty-second session,6 \n \n1. \nReaffirms that it is one of the purposes of the United Nations and the \nresponsibility of all Member States to promote, protect and encourage respect for all \nhuman rights and fundamental freedoms for all through, inter alia, international \ncooperation; \n__________________ \n \n4  Resolution 66/3. \n \n5  Resolution 76/1. \n \n6  See E/CN.4/2001/2-E/CN.4/Sub.2/2000/46, chap. II, sect. A. \n\nA/C.3/80/L.35\n \n3/4\n25-17758 \n \n \n2. \nRecognizes that, in addition to their separate responsibilities to their \nindividual societies, States have a collective responsibility to uphold the principles of \nhuman dignity, equality and equity at the global level; \n \n3. \nReaffirms that dialogue among cultures and civilizations facilitates the \npromotion of a culture of peace, tolerance and respect for diversity, and welcomes in \nthis regard the holding of conferences and meetings at the national, regional and \ninternational levels on dialogue among civilizations; \n \n4. \nAlso reaffirms the duty of States to cooperate with one another in \naccordance with the Charter of the United Nations in the promotion of universal \nrespect for and observance of all human rights and fundamental freedoms for all, \nincluding with respect to the elimination of all forms of racial discrimination and all \nforms of religious intolerance; \n \n5. \nUrges all actors on the international scene to build an international order \nbased on inclusion, justice, equality and equity, human dignity, mutual understanding \nand promotion of and respect for cultural diversity and universal human rights and to \nreject all doctrines of exclusion based on racism, racial discrimination, xenophobia \nand related intolerance; \n \n6. \nReaffirms the importance of the enhancement of international cooperation \nfor the promotion and protection of human rights and for the achievement of the \nobjectives of the fight against racism, racial discrimination, xenophobia and related \nintolerance; \n \n7. \nConsiders that international cooperation in the field of human rights, in \nconformity with the purposes and principles set out in the Charter and international \nlaw, should make an effective and practical contribution to the urgent task of \npreventing violations of human rights and fundamental freedoms; \n \n8. \nReaffirms that the promotion, protection and full realization of all human \nrights and fundamental freedoms for all should be guided by the principles of \nuniversality, non-selectivity, interdependence, interrelatedness, cooperation and \ngenuine dialogue, objectivity and transparency, in a manner consistent with the \npurposes and principles set out in the Charter; \n \n9. \nEmphasizes the importance of the universal periodic review as a \nmechanism based on cooperation and constructive dialogue with the objective of, \ninter alia, improving the situation of human rights on the ground and promoting the \nfulfilment of the human rights obligations and commitments undertaken by States; \n \n10. Also emphasizes the need for a cooperative and constructive approach on \nthe part of all stakeholders to resolving human rights issues in international forums; \n \n11. \nFurther emphasizes the role of international cooperation in support of \nnational efforts and in increasing the capacities of Member States in the field of \nhuman rights through, inter alia, the enhancement of their cooperation with human \nrights mechanisms, including through the provision of technical assistance, upon the \nrequest of and in accordance with the priorities set by the States concerned; \n \n12. Calls upon Member States, the specialized agencies and intergovernmental \norganizations to continue to carry out a constructive dialogue and consultations for \nthe enhancement of understanding and the promotion and protection of all human \nrights and fundamental freedoms for all, and encourages non-governmental \norganizations to contribute actively to this endeavour; \n \n13. Urges States to take measures necessary to enhance bilateral, regional and \ninternational cooperation aimed at addressing the adverse impact of consecutive and \n\nA/C.3/80/L.35 \n \n25-17758\n4/4 \n \ncompounded global crises, such as financial and economic crises, food crises, climate \nchange and natural disasters, on the full enjoyment of human rights; \n \n14. Invites States and relevant United Nations human rights mechanisms and \nprocedures to continue to pay attention to the importance of mutual cooperation, \nunderstanding and dialogue in ensuring the promotion and protection of all human \nrights; \n \n15. Encourages all Member States and the United Nations system to explore \nand foster complementarities among North-South, South-South and triangular \ncooperation aiming at the enhancement of international cooperation in the field of \nhuman rights; \n \n16. Requests the Secretary-General, in collaboration with the United Nations \nHigh Commissioner for Human Rights, to consult States and intergovernmental and \nnon-governmental organizations on ways and means, as well as on obstacles and \nchallenges and possible proposals to overcome them, for the enhancement of \ninternational cooperation and genuine dialogue in the United Nations human rights \nmachinery, including the Human Rights Council; \n \n17. Decides to continue its consideration of the question at its eighty-first \nsession. \n \n",
  "paragraphs": {
    "1": "Reaffirms that it is one of the purposes of the United Nations and the responsibility of all Member States to promote, protect and encourage respect for all human rights and fundamental freedoms for all through, inter alia, international cooperation; __________________ 4 Resolution 66/3. 5 Resolution 76/1. 6 See E/CN.4/2001/2-E/CN.4/Sub.2/2000/46, chap. II, sect. A. A/C.3/80/L.35 3/4 25-17758",
    "2": "Recognizes that, in addition to their separate responsibilities to their individual societies, States have a collective responsibility to uphold the principles of human dignity, equality and equity at the global level;",
    "3": "Reaffirms that dialogue among cultures and civilizations facilitates the promotion of a culture of peace, tolerance and respect for diversity, and welcomes in this regard the holding of conferences and meetings at the national, regional and international levels on dialogue among civilizations;",
    "4": "Also reaffirms the duty of States to cooperate with one another in accordance with the Charter of the United Nations in the promotion of universal respect for and observance of all human rights and fundamental freedoms for all, including with respect to the elimination of all forms of racial discrimination and all forms of religious intolerance;",
    "5": "Urges all actors on the international scene to build an international order based on inclusion, justice, equality and equity, human dignity, mutual understanding and promotion of and respect for cultural diversity and universal human rights and to reject all doctrines of exclusion based on racism, racial discrimination, xenophobia and related intolerance;",
    "6": "Reaffirms the importance of the enhancement of international cooperation for the promotion and protection of human rights and for the achievement of the objectives of the fight against racism, racial discrimination, xenophobia and related intolerance;",
    "7": "Considers that international cooperation in the field of human rights, in conformity with the purposes and principles set out in the Charter and international law, should make an effective and practical contribution to the urgent task of preventing violations of human rights and fundamental freedoms;",
    "8": "Reaffirms that the promotion, protection and full realization of all human rights and fundamental freedoms for all should be guided by the principles of universality, non-selectivity, interdependence, interrelatedness, cooperation and genuine dialogue, objectivity and transparency, in a manner consistent with the purposes and principles set out in the Charter;",
    "9": "Emphasizes the importance of the universal periodic review as a mechanism based on cooperation and constructive dialogue with the objective of, inter alia, improving the situation of human rights on the ground and promoting the fulfilment of the human rights obligations and commitments undertaken by States;",
    "10": "Also emphasizes the need for a cooperative and constructive approach on the part of all stakeholders to resolving human rights issues in international forums;",
    "11": "Further emphasizes the role of international cooperation in support of national efforts and in increasing the capacities of Member States in the field of human rights through, inter alia, the enhancement of their cooperation with human rights mechanisms, including through the provision of technical assistance, upon the request of and in accordance with the priorities set by the States concerned;",
    "12": "Calls upon Member States, the specialized agencies and intergovernmental organizations to continue to carry out a constructive dialogue and consultations for the enhancement of understanding and the promotion and protection of all human rights and fundamental freedoms for all, and encourages non-governmental organizations to contribute actively to this endeavour;",
    "13": "Urges States to take measures necessary to enhance bilateral, regional and international cooperation aimed at addressing the adverse impact of consecutive and A/C.3/80/L.35 25-17758 4/4 compounded global crises, such as financial and economic crises, food crises, climate change and natural disasters, on the full enjoyment of human rights;",
    "14": "Invites States and relevant United Nations human rights mechanisms and procedures to continue to pay attention to the importance of mutual cooperation, understanding and dialogue in ensuring the promotion and protection of all human rights;",
    "15": "Encourages all Member States and the United Nations system to explore and foster complementarities among North-South, South-South and triangular cooperation aiming at the enhancement of international cooperation in the field of human rights;",
    "16": "Requests the Secretary-General, in collaboration with the United Nations High Commissioner for Human Rights, to consult States and intergovernmental and non-governmental organizations on ways and means, as well as on obstacles and challenges and possible proposals to overcome them, for the enhancement of international cooperation and genuine dialogue in the United Nations human rights machinery, including the Human Rights Council;",
    "17": "Decides to continue its consideration of the question at its eighty-first session."
  },
  "agenda_items": [
    "Item 71"
  ],
  "symbol_references": [
    "A/C.3/80/L.35"
  ]
}