{
  "symbol": "A/C.3/80/L.59",
  "filename": "A_C.3_80_L.59.pdf",
  "title": "Follow-up to the Fourth World Conference on Women and full implementation of the Beijing Declaration and Platform for Action and the outcome of the twenty-third special session of the",
  "text": "United Nations \nA/C.3/80/L.59\n \n \nGeneral Assembly \nDistr.: Limited \n13 November 2025 \nOriginal: English \n \n25-18424 (E)    191125 \n*2518424* \n \n \nEightieth session \nThird Committee \nAgenda item 26 (b) \nAdvancement of women: implementation of the outcome \nof the Fourth World Conference on Women and of the \ntwenty-third special session of the General Assembly \n \n \n \n \n \nDraft resolution submitted by the Chair on the basis of informal consultations \n \n \n \n Follow-up to the Fourth World Conference on Women and full \nimplementation of the Beijing Declaration and Platform for \nAction and the outcome of the twenty-third special session of the \nGeneral Assembly \n \n \n \nThe General Assembly, \n \nRecalling its previous resolutions on the question, including resolution 78/182 \nof 19 December 2023, and recalling also the section of resolution 64/289 of 2 July \n2010 entitled \u201cStrengthening the institutional arrangements for support of gender \nequality and the empowerment of women\u201d,  \n \nDeeply convinced that the Beijing Declaration and Platform for Action 1 and the \noutcome of the twenty-third special session of the General Assembly, entitled \n\u201cWomen 2000: gender equality, development and peace for the twenty-first century\u201d,2 \nare important contributions to the achievement of gender equality and the \nempowerment of women and must be translated into effective action by all States, the \nUnited Nations system and other organizations concerned,  \n \nReaffirming the commitments to gender equality and the empowerment of all \nwomen and girls, and their full and equal enjoyment of all human rights, made in the \n2030 Agenda for Sustainable Development3 and at major United Nations summits, \nconferences and special sessions, and reaffirming also that their full, effective and \naccelerated implementation is integral to achieving the internationally agreed \ndevelopment goals, including the Sustainable Development Goals, especially \nconsidering that the world is currently failing to achieve gender equality,  \n__________________ \n \n1  Report of the Fourth World Conference on Women, Beijing, 4\u201315 September 1995 (United \nNations publication, Sales No. E.96.IV.13), chap. I, resolution 1, annexes I and II. \n \n2  Resolution S-23/2, annex, and resolution S-23/3, annex. \n \n3  Resolution 70/1. \n\nA/C.3/80/L.59 \n \n25-18424\n2/10 \n \n \nReaffirming also the commitments with regard to gender equality and the \nempowerment of women and girls in the different United Nations intergovernmental \nprocesses, such as the outcome documents of the International Conferences on \nFinancing for Development, including the Sevilla Commitment of the Fourth \nInternational Conference on Financing for Development, 4  the quadrennial \ncomprehensive policy review of operational activities for development of the United \nNations system, the political declaration of the high-level meeting on universal health \ncoverage entitled \u201cUniversal health coverage: expanding our ambition for health and \nwell-being in a post-COVID world\u201d 5  and the political declaration on the \nimplementation of the United Nations Global Plan of Action to Combat Trafficking \nin Persons,6 \n \nWelcoming progress made towards achieving gender equality and the \nempowerment of women, but stressing that challenges and obstacles remain in the \nimplementation of the Beijing Declaration and Platform for Action and the outcome \nof the twenty-third special session, \n \nRecalling Security Council resolutions 1325 (2000) of 31 October 2000, 1820 \n(2008) of 19 June 2008, 1888 (2009) of 30 September 2009, 1889 (2009) of 5 October \n2009, 1960 (2010) of 16 December 2010, 2106 (2013) of 24 June 2013, 2122 (2013) \nof 18 October 2013, 2242 (2015) of 13 October 2015, 2467 (2019) of 23 April 2019 \nand 2493 (2019) of 29 October 2019 on women and peace and security and resolutions \n1882 (2009) of 4 August 2009, 2225 (2015) of 18 June 2015 and 2427 (2018) of 9 July \n2018 on children and armed conflict,  \n \nReaffirming the important role of all women in the prevention and resolution of \nconflicts and in peacebuilding efforts, stressing the need for their full, equal and \nmeaningful participation therein, including at decision-making levels, and noting in \nthis regard that 2025 marks the twenty-fifth anniversary of the adoption of Security \nCouncil resolution 1325 (2000) on women and peace and security, \n \nTaking note of the Global Leaders\u2019 Meeting on Gender Equality and Women\u2019s \nEmpowerment held in New York on 27 September 2015 and the Global Leaders\u2019 \nMeeting on Women held in Beijing on 13 and 14 October 2025, and noting the pledges \nand commitments to gender equality and the empowerment of all women and girls as \nwell as their all-round development made by Governments at the meetings, \n \nTaking note also of the ministerial declaration adopted at the 2025 high-level \npolitical forum on sustainable development, 7  which assessed, inter alia, the \nimplementation of Sustainable Development Goal 5, and the political declaration \nadopted at the high-level political forum on sustainable development convened under \nthe auspices of the General Assembly in September 2023, 8 which reaffirmed that the \n2030 Agenda is universal in nature and that its Goals and targets seek to realize the \nhuman rights of all and to achieve gender equality and the empowerment of all women \nand girls, \n \nRecalling Economic and Social Council resolution 2025/4 of 10 June 2025, \nentitled \u201cMainstreaming a gender perspective into all policies and programmes in the \nUnited Nations system\u201d, in which it was reaffirmed that gender mainstreaming \nconstitutes a critical strategy in the full, effective and accelerated implementation of \nthe Beijing Declaration and Platform for Action, \n__________________ \n \n4  Resolution 79/323, annex. \n \n5  Resolution 78/4, annex. \n \n6  Resolution 72/1. \n \n7  E/HLS/2025/1. \n \n8  Resolution 78/1, annex. \n\nA/C.3/80/L.59\n \n3/10\n25-18424 \n \n \nRecognizing that the responsibility for the implementation of the Beijing \nDeclaration and Platform for Action and the outcome of the twenty-third special \nsession rests primarily at the national level and that strengthened efforts are necessary \nin this respect, and reiterating that enhanced international cooperation is essential for \nfull, effective and accelerated implementation,  \n \nRecognizing also the primary role of the Commission on the Status of Women \nin the follow-up to the Beijing Declaration and Platform of Action, in which the work \nof the Commission is grounded, and stressing that it is critical to address and integrate \ngender equality and the empowerment of women and girls throughout national, \nregional and global reviews of the implementation of the 2030 Agenda for Sustainable \nDevelopment and to ensure synergies between the follow-up to the Beijing Platform \nfor Action and the gender-responsive follow-up to the 2030 Agenda,  \n \nWelcoming the work of the Commission on the Status of Women in reviewing \nthe implementation of the Beijing Declaration and Platform for Action, taking note \nwith appreciation of all its agreed conclusions, and acknowledging the need for their \nimplementation,  \n \nRecalling the sixty-ninth session of the Commission on the Status of Women, in \n2025, when the Commission undertook a review and appraisal of the implementation \nof the Beijing Declaration and Platform for Action and the outcome of the twenty-\nthird special session of the General Assembly, and welcoming the adoption of the \npolitical declaration on this occasion,9 \n \nRecalling also the high-level meeting of the General Assembly on the thirtieth \nanniversary of the Fourth World Conference on Women, held in New York on \n22 September 2025, which demonstrated commitment to the full and accelerated \nimplementation of the Beijing Declaration and Platform for Action and the outcome \ndocuments of its subsequent reviews, \n \nAcknowledging the Presidents of the General Assembly at its seventy-eighth and \nseventy-ninth sessions for convening the Advisory Board on Gender Equality and the \nGeneral Assembly Platform of Women Leaders, and encouraging greater participation \nof Member States in this initiative, \n \nTaking note of the adoption of Economic and Social Council resolution 2026/2 \nof 19 September 2025 on the revitalization of the Commission on the Status of Women,  \n \nCommending the United Nations Entity for Gender Equality and the \nEmpowerment of Women (UN-Women) for the continued support provided to \nintergovernmental processes, including on the linkages between sustainable \ndevelopment, financing for development, migration, climate change and the \nachievement of gender equality and the empowerment of women and girls,  \n \nRecalling its resolution 64/289, in which it decided that the resources required \nto service the normative intergovernmental processes should be funded from the \nregular budget,  \n \nTaking note of the ongoing work of the United Nations trust fund to end violence \nagainst women,  \n \nRecognizing that the participation and contribution of civil society, in particular \nwomen\u2019s groups and organizations and other non-governmental organizations, are \nimportant to the successful implementation of the Beijing Declaration and Platform \n__________________ \n \n9  Official Records of the Economic and Social Council, 2025, Supplement No. 7 (E/2025/27), \nchap. I, sect. C, resolution 69/1, annex. \n\nA/C.3/80/L.59 \n \n25-18424\n4/10 \n \nfor Action and the outcome of the twenty-third special session, as well as to the \ngender-responsive implementation of the 2030 Agenda,  \n \nReaffirming that gender mainstreaming is a globally accepted strategy for \npromoting the empowerment of women and achieving gender equality by \ntransforming structures of inequality, which is relevant to all issues considered by its \nMain Committees and subsidiary bodies, including in resolutions dealing with issues \nbeyond social, humanitarian, cultural, economic and financial matters,  \n \nReaffirming also the commitment to actively promote the mainstreaming of a \ngender perspective into the design, implementation, monitoring and evaluation of \npolicies and programmes in all political, economic and social spheres, as well as the \ncommitment to strengthen the capabilities of the United Nations system in the area of \ngender equality,  \n \nStressing that challenges and obstacles remain in the implementation of \ninternational standards and norms to achieve gender equality and the empowerment \nof all women and girls, as well as in changing discriminatory attitudes and gender \nstereotypes and negative social norms which perpetuate discrimination against \nwomen and girls, while recognizing the importance of fully engaging men and boys \nas agents and beneficiaries of change and as allies in the elimination of all forms of \ndiscrimination and violence against women and girls, including sexual and gender-\nbased violence, as well as in the full, effective and accelerated implementation of the \nBeijing Declaration and Platform for Action and the gender-responsive implementation \nof the 2030 Agenda,  \n \nExpressing concern with the continued emergence and re-emergence of health \nemergencies and epidemic-prone diseases that have a disproportionate impact on \nwomen and girls and a negative impact on gender equality and the empowerment of \nall women and girls,  \n \nExpressing concern also that the urgent goal of 50/50 gender balance in the \nUnited Nations system, especially at higher professional grade levels and in \nnon-headquarters locations, with full respect for the principle of equitable \ngeographical distribution, in conformity with Article 101, paragraph 3, of the Charter \nof the United Nations, remains unmet, that the representation of women decreases \nprogressively at higher professional grade levels and that the gap in representation is \ngreatest and the rate of change slowest at non-headquarters locations, including in \npeacekeeping missions, as reflected in the report of the Secretary-General on \nimprovement in the status of women in the United Nations system, 10 \n \nTaking note with appreciation of the work done to enhance the United Nations \nsystem-wide dashboard on gender parity by UN-Women and the United Nations \nDevelopment Programme to strengthen system-wide monitoring and data collection \nby providing the latest available data, in support of the Secretary-General\u2019s system-\nwide strategy on gender parity, \n \nAcknowledging the continuous efforts of UN-Women to strengthen the United \nNations system-wide knowledge hub on addressing sexual harassment in order to \nprovide a repository of resources, best practices and tools on the United Nations \nsystem efforts to prevent and address sexual harassment, \n \n1. \nTakes note with appreciation of the report of the Secretary-General on the \nmeasures taken and progress achieved in follow-up to and implementation of the \nBeijing Declaration and Platform for Action and the outcome of the twenty-third \n__________________ \n \n10  A/80/260. \n\nA/C.3/80/L.59\n \n5/10\n25-18424 \n \nspecial session of the General Assembly11 and of the report of the Secretary-General \non improvement in the status of women in the United Nations system;  \n \n2. \nReaffirms the Beijing Declaration and Platform for Action adopted at the \nFourth World Conference on Women and the outcome of the twenty-third special \nsession of the General Assembly, also reaffirms the political declaration on the \noccasion of the thirtieth anniversary of the Fourth World Conference on Women \nadopted by the Commission on the Status of Women at its sixty-ninth session, and \naffirms its commitment to their full, effective and accelerated implementation;  \n \n3. \nAlso reaffirms the primary and essential role of the General Assembly and \nthe Economic and Social Council, as well as the catalytic role of the Commission on \nthe Status of Women, in promoting gender equality and the empowerment of all \nwomen and girls, based on the full implementation of the Beijing Declaration and \nPlatform for Action and the outcome of the twenty-third special session, and in \npromoting and monitoring gender mainstreaming within the United Nations system, \nand encourages the Commission to contribute to the follow-up to the 2030 Agenda \nfor Sustainable Development in order to accelerate the realization of gender equality \nand the empowerment of all women and girls, as well as the enjoyment of all human \nrights by women and girls;  \n \n4. \nCalls upon Governments and all other stakeholders to systematically \nmainstream a gender perspective into the implementation of the 2030 Agenda in order \nto, inter alia, contribute to the full, effective and accelerated implementation of the \nBeijing Declaration and Platform for Action, and stresses in this regard the \nimportance of ensuring synergies between the follow-up to the Beijing Declaration \nand Platform for Action and the gender-responsive follow-up to the 2030 Agenda;  \n \n5. \nReiterates that the full, effective and accelerated implementation of the \nBeijing Declaration and Platform for Action and the outcome of the twenty-third \nspecial session is essential to achieving the Sustainable Development Goals;  \n \n6. \nNotes the adoption in September 2024 of the Pact for the Future, 12 which \nreaffirmed States\u2019 commitment to the Beijing Declaration and Platform for Action, to \naccelerating efforts to achieve gender equality, women\u2019s participation and the \nempowerment of all women and girls in all domains and to eliminating all forms of \ndiscrimination and violence against women and girls; \n \n7. \nRecognizes that the implementation of the Beijing Declaration and \nPlatform for Action and the fulfilment of the obligations of States Parties under the \nConvention on the Elimination of All Forms of Discrimination against Women 13 are \nmutually reinforcing in respect of achieving gender equality and the empowerment of \nwomen, and welcomes in this regard the contributions of the Committee on the \nElimination of Discrimination against Women to promoting the implementation of \nthe Platform for Action and the outcome of the twenty-third special session;  \n \n8. \nCalls upon States Parties to comply fully with their obligations under the \nConvention on the Elimination of All Forms of Discrimination against Women and \nthe Optional Protocol thereto 14  and to take into consideration the concluding \nobservations as well as the general recommendations of the Committee, urges States \nParties to consider limiting the extent of any reservations that they lodge to the \nConvention, to formulate any reservations as precisely and narrowly as possible and \nto regularly review such reservations with a view to withdrawing them so as to ensure \n__________________ \n \n11  A/80/261. \n \n12  Resolution 79/1. \n \n13  United Nations, Treaty Series, vol. 1249, No. 20378. \n \n14  Ibid., vol. 2131, No. 20378. \n\nA/C.3/80/L.59 \n \n25-18424\n6/10 \n \nthat no reservation is incompatible with the object and purpose of the Convention, \nurges all Member States that have not yet ratified or acceded to the Convention to \nconsider doing so, and calls upon those Member States that have not yet done so to \nconsider signing and ratifying or acceding to the Optional Protocol;  \n \n9. \nReaffirms that States have an obligation to exercise due diligence to \nprevent and combat all forms of violence against women and girls, provide protection \nto the victims and investigate, prosecute and punish the perpetrators of violence \nagainst women and girls, and that failure to do so violates and impairs or nullifies the \nenjoyment of their human rights and fundamental freedoms, calls upon Governments \nto elaborate and implement laws and strategies to eliminate violence against women \nand girls, encourages and supports men and boys to take an active part in the \nprevention and elimination of all forms of violence, encourages increased \nunderstanding among men and boys of how violence harms girls, boys, women and \nmen and undermines gender equality, encourages all actors to speak out against any \nform of violence against women, and in this regard encourages Member States to \ncontinue to support the Secretary-General\u2019s ongoing campaign, \u201cUNiTE to End \nViolence against Women\u201d, its social mobilization and advocacy platform, \u201cOrange \nthe World: End Violence against Women\u201d, and the \u201cHeforShe\u201d campaign of the \nUnited Nations Entity for Gender Equality and the Empowerment of Women \n(UN-Women), as well as to support the Secretary-General\u2019s voluntary compact on \npreventing and addressing sexual exploitation and abuse;  \n \n10. Reiterates the importance and value of the mandate of UN-Women, and \nwelcomes the Entity\u2019s leadership in providing a strong voice for women and girls at \nall levels and its efforts to support intergovernmental processes so that they fully \ncontribute to the achievement of gender equality and the empowerment of women and \ngirls and the realization of their human rights;  \n \n11. \nNotes with concern that UN-Women continues to draw on voluntary \ncontributions in order to enable it to carry out its mandate of servicing normative \nintergovernmental processes, and emphasizes the need for the full implementation of \nresolution 64/289 in this regard;  \n \n12. Notes the elaboration of the United Nations System-wide Gender Equality \nAcceleration Plan, reaffirms the important role of UN-Women in leading, coordinating \nand promoting accountability of the United Nations system in its work on gender \nequality and the empowerment of women and girls, and urges UN-Women to continue \nto support gender mainstreaming across the United Nations system as part of its work;  \n \n13. Welcomes the commitment of UN-Women to support Member States in \ntheir efforts to develop and strengthen norms, policies and standards on gender \nequality and the empowerment of women, as well as to integrate gender perspectives \ninto sectoral policy and normative frameworks, in line with its mandate, and \nencourages the Entity to continue to promote the need to mainstream and strengthen \na gender perspective in the work of intergovernmental bodies and processes, to raise \nawareness of the opportunities therein and to provide policy analysis, knowledge, \nevidence and information in support of intergovernmental deliberations in order to \nprovide technical assistance, at the request of Member States, in strengthening a \ngender perspective in resolutions and other outcomes; \n \n14. Recognizes the need to continue to strengthen the capacity of UN-Women \nto fully implement its normative support function;  \n \n15. Also recognizes the important role of UN-Women in promoting gender \nequality, and the empowerment of all women and girls and the central role that it plays \nin supporting Member States, in coordinating the United Nations system and in \nmobilizing civil society, the private sector and other relevant stakeholders, at all \n\nA/C.3/80/L.59\n \n7/10\n25-18424 \n \nlevels, in support of the implementation of the Beijing Declaration and Platform for \nAction, and calls upon UN-Women and the United Nations system, within their \nrespective mandates, to continue to support the full, effective and accelerated \nimplementation of the Beijing Declaration and Platform for Action at the \ninternational, regional, national and local levels, including through systematic gender \nmainstreaming, the mobilization of resources to deliver positive results and the \nmonitoring of progress with adequate data and robust accountability systems;  \n \n16. Urges Member States to increase funding for the budget of UN-Women by \nproviding, when legislative and budgetary provisions allow, core, multi-year, \npredictable, stable and sustainable voluntary contributions, recognizing the \nimportance of adequate funding in enabling UN-Women to implement its strategic \nplan promptly and effectively, and that the mobilization of financial resources for \nachieving its goals still remains a challenge;  \n \n17. Also urges Member States and encourages stakeholders, where applicable, \nto address gaps and challenges, take specific, measurable, time-bound actions and \nmobilize adequate financial resources for the full, effective and accelerated \nimplementation of the Beijing Declaration and Platform for Action; \n \n18. Reiterates the need to take further concrete action to advance the \nimplementation of the Beijing Declaration and Platform for Action, including by \nharnessing the potential of technology and innovation and closing the digital divides \nwithin and between countries, including the gender digital divide; \n \n19. Calls upon Governments and the organs, relevant funds and programmes \nand specialized agencies of the United Nations system, within their respective \nmandates, other international and regional organizations, including financial \ninstitutions, and all relevant actors of civil society, including non-governmental \norganizations, to intensify and accelerate action to achieve the full and effective \nimplementation of the Beijing Declaration and Platform for Action and of the \noutcome of the twenty-third special session; \n \n20.  Looks forward to the seventy-fourth session of the Commission on the \nStatus of Women, in 2030, when the Commission will undertake a review and \nappraisal of the implementation of the Beijing Declaration and Platform for Action \nand the outcome of the twenty-third special session of the General Assembly; \n \n21. Encourages all Member States to make ambitious commitments and \ndevelop action-oriented, time-bound targets and well-resourced action plans on \ngender equality and the empowerment of all women and girls towards the full and \neffective implementation of the Beijing Declaration and Platform for Action and the \noutcome of the twenty-third special session of the General Assembly; \n \n22. Encourages all actors, including Governments, the United Nations system, \nother international organizations and civil society, to continue to support the work of \nthe Commission on the Status of Women in fulfilling its central role in the follow-up \nto and review of the implementation of the Beijing Declaration and Platform for \nAction and the outcome of the twenty-third special session and, as applicable, to carry \nout the recommendations of the Commission, welcomes in this regard the \nCommission\u2019s continued sharing of experiences, lessons learned and good practices \nin overcoming challenges to the full implementation at the national and international \nlevels and the evaluation of progress in the implementation of priority themes, and \nencourages the intergovernmental bodies of the United Nations system, as \nappropriate, to incorporate the outcomes of the Commission into their work;  \n \n23. Requests the entities of the United Nations system to systematically and \nstrategically incorporate the outcomes of the Commission on the Status of Women \n\nA/C.3/80/L.59 \n \n25-18424\n8/10 \n \ninto their work, within their mandates, and, inter alia, to ensure effective support for \nthe efforts of Member States towards the achievement of gender equality and the \nempowerment of women and girls, and in this regard encourages UN-Women to \ncontinue to use concrete results-based reporting mechanisms and to ensure coherence, \nconsistency and coordination between the normative and operational aspects of its \nwork;  \n \n24. Encourages States and all stakeholders to strengthen the mainstreaming of \na gender perspective into all sectors and in all areas of development;  \n \n25. Reiterates its call upon the United Nations system, including the main \norgans, their main committees and subsidiary bodies, the funds and programmes and \nthe specialized agencies, to increase efforts to fully mainstream a gender perspective \ninto all issues under their consideration and within their mandates, as well as into all \nUnited Nations summits, conferences and special sessions and their follow-up \nprocesses;  \n \n26. Calls upon States to ensure that intergovernmental processes consistently \naddress gender perspectives in their preparatory processes and outcomes;  \n \n27. Commits to intensifying efforts to further integrate a gender perspective \ninto the work of the General Assembly, including in plenary and high-level meetings; \n \n28. Strongly encourages Governments to continue to support the role and \ncontribution of civil society, in particular non-governmental organizations and \nwomen\u2019s organizations, in the full, effective and accelerated implementation of the \nBeijing Declaration and Platform for Action and the outcome of the twenty-third \nspecial session and in the gender-responsive implementation of the 2030 Agenda;  \n \n29. Calls upon Governments and the United Nations system to encourage the \nparticipation of women\u2019s groups and other non-governmental organizations \nspecializing in gender equality and the empowerment of women and girls in \nintergovernmental processes, including through increased outreach, funding and \ncapacity-building; \n \n30. Calls upon the intergovernmental bodies of the United Nations system to \nsystematically request the inclusion of a gender perspective in reports of the \nSecretary-General and other inputs to intergovernmental processes;  \n \n31. Requests that reports of the Secretary-General submitted to the General \nAssembly and the Economic and Social Council and their subsidiary bodies continue \nto systematically address gender perspectives through gender-sensitive analysis, the \nprovision of data disaggregated by sex, age and disability and the reflection of the \ncontribution of women and girls as agents of change and of the impact of proposed \npolicies and programmes on gender equality and the empowerment of women and \ngirls, and that conclusions and recommendations for further action address the \ndifferent situations and needs of women and men and girls and boys in order to \nfacilitate gender-responsive policy development, and in this regard requests the \nSecretary-General to convey the importance of reflecting a gender perspective to all \nstakeholders who provide input to his reports;  \n \n32. Encourages Member States, with the support of, as appropriate, United \nNations entities, including UN-Women, international and regional organizations and \nother relevant actors, to prioritize the strengthening of national data collection and \nmonitoring capacities with regard to statistics disaggregated by sex and age, as well \nas national tracking indicators for gender equality and the empowerment of women, \nthrough multisectoral efforts and partnerships;  \n\nA/C.3/80/L.59\n \n9/10\n25-18424 \n \n \n33. Calls upon all parts of the United Nations system to continue to play an \nactive role in ensuring the full, effective and accelerated implementation of the \nBeijing Declaration and Platform for Action and the outcome of the twenty-third \nspecial session through, inter alia, the maintenance of gender specialists in all entities \nof the United Nations system, as well as by ensuring that all personnel, especially \nthose in the field, receive training and appropriate follow-up, including tools, \nguidance and support, for accelerated gender mainstreaming, and reaffirms the need \nto strengthen the capabilities of the United Nations system in the area of gender;  \n \n34. Commends the Secretary-General for his continued leadership and efforts \ntowards creating an enabling working environment and accelerating progress towards \nthe goal of 50/50 gender balance at all levels throughout the United Nations system, \nincluding the goal of reaching parity at all levels throughout the United Nations \nsystem by 2028, as set out in his system-wide strategy on gender parity, and in this \nregard calls upon the entities of the United Nations system, in collaboration with \nresident coordinators and heads of agencies and missions, to significantly increase \ntheir efforts towards achieving this goal in all locations, with the advice of gender \nfocal points, UN-Women and other bodies, and to provide sufficient financial and \nhuman resources for organizational change and for overcoming identified \nimpediments to progress on gender balance; \n \n35. Also commends the Secretary-General for requesting the entities of the \nUnited Nations to update and regularly monitor entity-specific implementation plans \nto achieve and maintain the goal of gender parity, and in this regard encourages \nUN-Women to continue to regularly report on the implementation of and progress \nmade on gender parity through such plans;  \n \n36. Requests the Secretary-General to further accelerate his efforts to achieve \nthe goal of 50/50 gender balance at all levels throughout the United Nations system, \nincluding in the field and in peacekeeping missions, with full respect for the principle \nof equitable geographical distribution, in conformity with Article 101, paragraph 3, \nof the Charter of the United Nations, considering, in particular, women from the \ndeveloping and the least developed countries, countries with economies in transition \nand unrepresented or largely underrepresented Member States, and to ensure the \nimplementation of measures with clear targets and timelines, including temporary \nspecial measures, as well as the strengthening of the implementation of policies and \nmeasures related to creating enabling working environments, including for work-life \nbalance, and to prevent and address all forms of discrimination, violence, racism, \nharassment, including sexual harassment, abuse of authority in the workplace and \nsexual exploitation and abuse, so as to accelerate progress, and managerial and \ndepartmental accountability, inter alia, through leadership compacts and performance \nappraisal systems, with respect to attaining gender parity within the shortest feasible \nperiod;  \n \n37. Requests the entities of the United Nations to strengthen efforts to prevent, \naddress and eliminate sexual harassment, in full alignment with the work of the \nUnited Nations Executive Group to Prevent and Respond to Sexual Harassment, \ncontinue monitoring and implementation of accountability mechanisms, strengthen \nleadership, apply a victim-centred approach to all forms of misconduct, enhance \ntraining and leverage the knowledge hub on addressing sexual harassment, as well as \ngender-sensitive exit surveys; \n \n38. Also requests the entities of the United Nations, at both headquarters and \nnon-headquarters levels, inter alia, the United Nations country team level, to continue \nto appoint gender focal points to provide support for the advancement of gender \nparity, led and coordinated by UN-Women, including through the implementation of \nentity-specific implementation plans as well as the recommendations contained in the \n\nA/C.3/80/L.59 \n \n25-18424\n10/10 \n \nEnabling Environment Guidelines for the United Nations System and the Field-\nspecific Enabling Environment Guidelines; \n \n39. Strongly encourages Member States to identify and regularly submit more \nwomen candidates for appointment to positions in the United Nations system, \nespecially at more senior, decision-making and policymaking levels, including in \npeacekeeping operations and by increasing the number of women peacekeepers, who \nalso include international observers;  \n \n40. Encourages increased efforts by Governments and the United Nations \nsystem to enhance accountability for the implementation of commitments to gender \nequality and the empowerment of women at the international, regional, national and \nlocal levels, including through improved monitoring and reporting on progress in \nrelation to policies, strategies, resource allocations and programmes and by achieving \ngender balance and promoting investment in girls\u2019 education and the full, equal and \nmeaningful participation and leadership of women in fields in which they are \ntraditionally underrepresented;  \n \n41. Reaffirms that Governments bear the primary responsibility for the \nachievement of gender equality and the empowerment of all women and girls, and the \nfull and equal enjoyment of their human rights, and that international cooperation has \nan essential role in assisting developing countries in progressing towards the full \nimplementation of the Beijing Declaration and Platform for Action;  \n \n42. Encourages the Secretary-General to bring to the attention of the United \nNations system the findings of his reports in order to strengthen follow-up on these \nfindings and to accelerate the implementation of the present resolution;  \n \n43. Requests the Secretary-General to provide an oral report to the \nCommission on the Status of Women at its seventieth and seventy-first sessions and \nto report to the General Assembly at its eighty-second session on the improvement in \nthe status of women in the United Nations system and on progress made and obstacles \nencountered in achieving gender balance, under the item entitled \u201cAdvancement of \nwomen\u201d;  \n \n44. Also requests the Secretary-General to report to the General Assembly at \nits eighty-second session on the role, focus, resources and capacities of national \nmachineries for the advancement of women, so as to provide a synthesized assessment \nof their effectiveness in supporting the full, effective and accelerated implementation \nof the 12 critical areas of concern of the Beijing Declaration and Platform for Action, \nwithin the existing report on measures taken and progress achieved in follow-up to \nand implementation of the Beijing Declaration and Platform for Action and the \noutcome of the twenty-third special session of the General Assembly;  \n \n45. Further requests the Secretary-General to report to the General Assembly \nat its eighty-second session, under the item entitled \u201cAdvancement of women\u201d, on the \nfollow-up to and progress made in the implementation of the Beijing Declaration and \nPlatform for Action and the outcome of the twenty-third special session. \n \n",
  "paragraphs": {
    "1": "Takes note with appreciation of the report of the Secretary-General on the measures taken and progress achieved in follow-up to and implementation of the Beijing Declaration and Platform for Action and the outcome of the twenty-third __________________ 10 A/80/260. A/C.3/80/L.59 5/10 25-18424 special session of the General Assembly11 and of the report of the Secretary-General on improvement in the status of women in the United Nations system;",
    "2": "Reaffirms the Beijing Declaration and Platform for Action adopted at the Fourth World Conference on Women and the outcome of the twenty-third special session of the General Assembly, also reaffirms the political declaration on the occasion of the thirtieth anniversary of the Fourth World Conference on Women adopted by the Commission on the Status of Women at its sixty-ninth session, and affirms its commitment to their full, effective and accelerated implementation;",
    "3": "Also reaffirms the primary and essential role of the General Assembly and the Economic and Social Council, as well as the catalytic role of the Commission on the Status of Women, in promoting gender equality and the empowerment of all women and girls, based on the full implementation of the Beijing Declaration and Platform for Action and the outcome of the twenty-third special session, and in promoting and monitoring gender mainstreaming within the United Nations system, and encourages the Commission to contribute to the follow-up to the 2030 Agenda for Sustainable Development in order to accelerate the realization of gender equality and the empowerment of all women and girls, as well as the enjoyment of all human rights by women and girls;",
    "4": "Calls upon Governments and all other stakeholders to systematically mainstream a gender perspective into the implementation of the 2030 Agenda in order to, inter alia, contribute to the full, effective and accelerated implementation of the Beijing Declaration and Platform for Action, and stresses in this regard the importance of ensuring synergies between the follow-up to the Beijing Declaration and Platform for Action and the gender-responsive follow-up to the 2030 Agenda;",
    "5": "Reiterates that the full, effective and accelerated implementation of the Beijing Declaration and Platform for Action and the outcome of the twenty-third special session is essential to achieving the Sustainable Development Goals;",
    "6": "Notes the adoption in September 2024 of the Pact for the Future, 12 which reaffirmed States\u2019 commitment to the Beijing Declaration and Platform for Action, to accelerating efforts to achieve gender equality, women\u2019s participation and the empowerment of all women and girls in all domains and to eliminating all forms of discrimination and violence against women and girls;",
    "7": "Recognizes that the implementation of the Beijing Declaration and Platform for Action and the fulfilment of the obligations of States Parties under the Convention on the Elimination of All Forms of Discrimination against Women 13 are mutually reinforcing in respect of achieving gender equality and the empowerment of women, and welcomes in this regard the contributions of the Committee on the Elimination of Discrimination against Women to promoting the implementation of the Platform for Action and the outcome of the twenty-third special session;",
    "8": "Calls upon States Parties to comply fully with their obligations under the Convention on the Elimination of All Forms of Discrimination against Women and the Optional Protocol thereto 14 and to take into consideration the concluding observations as well as the general recommendations of the Committee, urges States Parties to consider limiting the extent of any reservations that they lodge to the Convention, to formulate any reservations as precisely and narrowly as possible and to regularly review such reservations with a view to withdrawing them so as to ensure __________________ 11 A/80/261. 12 Resolution 79/1. 13 United Nations, Treaty Series, vol. 1249, No. 20378. 14 Ibid., vol. 2131, No. 20378. A/C.3/80/L.59 25-18424 6/10 that no reservation is incompatible with the object and purpose of the Convention, urges all Member States that have not yet ratified or acceded to the Convention to consider doing so, and calls upon those Member States that have not yet done so to consider signing and ratifying or acceding to the Optional Protocol;",
    "9": "Reaffirms that States have an obligation to exercise due diligence to prevent and combat all forms of violence against women and girls, provide protection to the victims and investigate, prosecute and punish the perpetrators of violence against women and girls, and that failure to do so violates and impairs or nullifies the enjoyment of their human rights and fundamental freedoms, calls upon Governments to elaborate and implement laws and strategies to eliminate violence against women and girls, encourages and supports men and boys to take an active part in the prevention and elimination of all forms of violence, encourages increased understanding among men and boys of how violence harms girls, boys, women and men and undermines gender equality, encourages all actors to speak out against any form of violence against women, and in this regard encourages Member States to continue to support the Secretary-General\u2019s ongoing campaign, \u201cUNiTE to End Violence against Women\u201d, its social mobilization and advocacy platform, \u201cOrange the World: End Violence against Women\u201d, and the \u201cHeforShe\u201d campaign of the United Nations Entity for Gender Equality and the Empowerment of Women (UN-Women), as well as to support the Secretary-General\u2019s voluntary compact on preventing and addressing sexual exploitation and abuse;",
    "10": "Reiterates the importance and value of the mandate of UN-Women, and welcomes the Entity\u2019s leadership in providing a strong voice for women and girls at all levels and its efforts to support intergovernmental processes so that they fully contribute to the achievement of gender equality and the empowerment of women and girls and the realization of their human rights;",
    "11": "Notes with concern that UN-Women continues to draw on voluntary contributions in order to enable it to carry out its mandate of servicing normative intergovernmental processes, and emphasizes the need for the full implementation of resolution 64/289 in this regard;",
    "12": "Notes the elaboration of the United Nations System-wide Gender Equality Acceleration Plan, reaffirms the important role of UN-Women in leading, coordinating and promoting accountability of the United Nations system in its work on gender equality and the empowerment of women and girls, and urges UN-Women to continue to support gender mainstreaming across the United Nations system as part of its work;",
    "13": "Welcomes the commitment of UN-Women to support Member States in their efforts to develop and strengthen norms, policies and standards on gender equality and the empowerment of women, as well as to integrate gender perspectives into sectoral policy and normative frameworks, in line with its mandate, and encourages the Entity to continue to promote the need to mainstream and strengthen a gender perspective in the work of intergovernmental bodies and processes, to raise awareness of the opportunities therein and to provide policy analysis, knowledge, evidence and information in support of intergovernmental deliberations in order to provide technical assistance, at the request of Member States, in strengthening a gender perspective in resolutions and other outcomes;",
    "14": "Recognizes the need to continue to strengthen the capacity of UN-Women to fully implement its normative support function;",
    "15": "Also recognizes the important role of UN-Women in promoting gender equality, and the empowerment of all women and girls and the central role that it plays in supporting Member States, in coordinating the United Nations system and in mobilizing civil society, the private sector and other relevant stakeholders, at all A/C.3/80/L.59 7/10 25-18424 levels, in support of the implementation of the Beijing Declaration and Platform for Action, and calls upon UN-Women and the United Nations system, within their respective mandates, to continue to support the full, effective and accelerated implementation of the Beijing Declaration and Platform for Action at the international, regional, national and local levels, including through systematic gender mainstreaming, the mobilization of resources to deliver positive results and the monitoring of progress with adequate data and robust accountability systems;",
    "16": "Urges Member States to increase funding for the budget of UN-Women by providing, when legislative and budgetary provisions allow, core, multi-year, predictable, stable and sustainable voluntary contributions, recognizing the importance of adequate funding in enabling UN-Women to implement its strategic plan promptly and effectively, and that the mobilization of financial resources for achieving its goals still remains a challenge;",
    "17": "Also urges Member States and encourages stakeholders, where applicable, to address gaps and challenges, take specific, measurable, time-bound actions and mobilize adequate financial resources for the full, effective and accelerated implementation of the Beijing Declaration and Platform for Action;",
    "18": "Reiterates the need to take further concrete action to advance the implementation of the Beijing Declaration and Platform for Action, including by harnessing the potential of technology and innovation and closing the digital divides within and between countries, including the gender digital divide;",
    "19": "Calls upon Governments and the organs, relevant funds and programmes and specialized agencies of the United Nations system, within their respective mandates, other international and regional organizations, including financial institutions, and all relevant actors of civil society, including non-governmental organizations, to intensify and accelerate action to achieve the full and effective implementation of the Beijing Declaration and Platform for Action and of the outcome of the twenty-third special session;",
    "20": "Looks forward to the seventy-fourth session of the Commission on the Status of Women, in 2030, when the Commission will undertake a review and appraisal of the implementation of the Beijing Declaration and Platform for Action and the outcome of the twenty-third special session of the General Assembly;",
    "21": "Encourages all Member States to make ambitious commitments and develop action-oriented, time-bound targets and well-resourced action plans on gender equality and the empowerment of all women and girls towards the full and effective implementation of the Beijing Declaration and Platform for Action and the outcome of the twenty-third special session of the General Assembly;",
    "22": "Encourages all actors, including Governments, the United Nations system, other international organizations and civil society, to continue to support the work of the Commission on the Status of Women in fulfilling its central role in the follow-up to and review of the implementation of the Beijing Declaration and Platform for Action and the outcome of the twenty-third special session and, as applicable, to carry out the recommendations of the Commission, welcomes in this regard the Commission\u2019s continued sharing of experiences, lessons learned and good practices in overcoming challenges to the full implementation at the national and international levels and the evaluation of progress in the implementation of priority themes, and encourages the intergovernmental bodies of the United Nations system, as appropriate, to incorporate the outcomes of the Commission into their work;",
    "23": "Requests the entities of the United Nations system to systematically and strategically incorporate the outcomes of the Commission on the Status of Women A/C.3/80/L.59 25-18424 8/10 into their work, within their mandates, and, inter alia, to ensure effective support for the efforts of Member States towards the achievement of gender equality and the empowerment of women and girls, and in this regard encourages UN-Women to continue to use concrete results-based reporting mechanisms and to ensure coherence, consistency and coordination between the normative and operational aspects of its work;",
    "24": "Encourages States and all stakeholders to strengthen the mainstreaming of a gender perspective into all sectors and in all areas of development;",
    "25": "Reiterates its call upon the United Nations system, including the main organs, their main committees and subsidiary bodies, the funds and programmes and the specialized agencies, to increase efforts to fully mainstream a gender perspective into all issues under their consideration and within their mandates, as well as into all United Nations summits, conferences and special sessions and their follow-up processes;",
    "26": "Calls upon States to ensure that intergovernmental processes consistently address gender perspectives in their preparatory processes and outcomes;",
    "27": "Commits to intensifying efforts to further integrate a gender perspective into the work of the General Assembly, including in plenary and high-level meetings;",
    "28": "Strongly encourages Governments to continue to support the role and contribution of civil society, in particular non-governmental organizations and women\u2019s organizations, in the full, effective and accelerated implementation of the Beijing Declaration and Platform for Action and the outcome of the twenty-third special session and in the gender-responsive implementation of the 2030 Agenda;",
    "29": "Calls upon Governments and the United Nations system to encourage the participation of women\u2019s groups and other non-governmental organizations specializing in gender equality and the empowerment of women and girls in intergovernmental processes, including through increased outreach, funding and capacity-building;",
    "30": "Calls upon the intergovernmental bodies of the United Nations system to systematically request the inclusion of a gender perspective in reports of the Secretary-General and other inputs to intergovernmental processes;",
    "31": "Requests that reports of the Secretary-General submitted to the General Assembly and the Economic and Social Council and their subsidiary bodies continue to systematically address gender perspectives through gender-sensitive analysis, the provision of data disaggregated by sex, age and disability and the reflection of the contribution of women and girls as agents of change and of the impact of proposed policies and programmes on gender equality and the empowerment of women and girls, and that conclusions and recommendations for further action address the different situations and needs of women and men and girls and boys in order to facilitate gender-responsive policy development, and in this regard requests the Secretary-General to convey the importance of reflecting a gender perspective to all stakeholders who provide input to his reports;",
    "32": "Encourages Member States, with the support of, as appropriate, United Nations entities, including UN-Women, international and regional organizations and other relevant actors, to prioritize the strengthening of national data collection and monitoring capacities with regard to statistics disaggregated by sex and age, as well as national tracking indicators for gender equality and the empowerment of women, through multisectoral efforts and partnerships; A/C.3/80/L.59 9/10 25-18424",
    "33": "Calls upon all parts of the United Nations system to continue to play an active role in ensuring the full, effective and accelerated implementation of the Beijing Declaration and Platform for Action and the outcome of the twenty-third special session through, inter alia, the maintenance of gender specialists in all entities of the United Nations system, as well as by ensuring that all personnel, especially those in the field, receive training and appropriate follow-up, including tools, guidance and support, for accelerated gender mainstreaming, and reaffirms the need to strengthen the capabilities of the United Nations system in the area of gender;",
    "34": "Commends the Secretary-General for his continued leadership and efforts towards creating an enabling working environment and accelerating progress towards the goal of 50/50 gender balance at all levels throughout the United Nations system, including the goal of reaching parity at all levels throughout the United Nations system by 2028, as set out in his system-wide strategy on gender parity, and in this regard calls upon the entities of the United Nations system, in collaboration with resident coordinators and heads of agencies and missions, to significantly increase their efforts towards achieving this goal in all locations, with the advice of gender focal points, UN-Women and other bodies, and to provide sufficient financial and human resources for organizational change and for overcoming identified impediments to progress on gender balance;",
    "35": "Also commends the Secretary-General for requesting the entities of the United Nations to update and regularly monitor entity-specific implementation plans to achieve and maintain the goal of gender parity, and in this regard encourages UN-Women to continue to regularly report on the implementation of and progress made on gender parity through such plans;",
    "36": "Requests the Secretary-General to further accelerate his efforts to achieve the goal of 50/50 gender balance at all levels throughout the United Nations system, including in the field and in peacekeeping missions, with full respect for the principle of equitable geographical distribution, in conformity with Article 101, paragraph 3, of the Charter of the United Nations, considering, in particular, women from the developing and the least developed countries, countries with economies in transition and unrepresented or largely underrepresented Member States, and to ensure the implementation of measures with clear targets and timelines, including temporary special measures, as well as the strengthening of the implementation of policies and measures related to creating enabling working environments, including for work-life balance, and to prevent and address all forms of discrimination, violence, racism, harassment, including sexual harassment, abuse of authority in the workplace and sexual exploitation and abuse, so as to accelerate progress, and managerial and departmental accountability, inter alia, through leadership compacts and performance appraisal systems, with respect to attaining gender parity within the shortest feasible period;",
    "37": "Requests the entities of the United Nations to strengthen efforts to prevent, address and eliminate sexual harassment, in full alignment with the work of the United Nations Executive Group to Prevent and Respond to Sexual Harassment, continue monitoring and implementation of accountability mechanisms, strengthen leadership, apply a victim-centred approach to all forms of misconduct, enhance training and leverage the knowledge hub on addressing sexual harassment, as well as gender-sensitive exit surveys;",
    "38": "Also requests the entities of the United Nations, at both headquarters and non-headquarters levels, inter alia, the United Nations country team level, to continue to appoint gender focal points to provide support for the advancement of gender parity, led and coordinated by UN-Women, including through the implementation of entity-specific implementation plans as well as the recommendations contained in the A/C.3/80/L.59 25-18424 10/10 Enabling Environment Guidelines for the United Nations System and the Field- specific Enabling Environment Guidelines;",
    "39": "Strongly encourages Member States to identify and regularly submit more women candidates for appointment to positions in the United Nations system, especially at more senior, decision-making and policymaking levels, including in peacekeeping operations and by increasing the number of women peacekeepers, who also include international observers;",
    "40": "Encourages increased efforts by Governments and the United Nations system to enhance accountability for the implementation of commitments to gender equality and the empowerment of women at the international, regional, national and local levels, including through improved monitoring and reporting on progress in relation to policies, strategies, resource allocations and programmes and by achieving gender balance and promoting investment in girls\u2019 education and the full, equal and meaningful participation and leadership of women in fields in which they are traditionally underrepresented;",
    "41": "Reaffirms that Governments bear the primary responsibility for the achievement of gender equality and the empowerment of all women and girls, and the full and equal enjoyment of their human rights, and that international cooperation has an essential role in assisting developing countries in progressing towards the full implementation of the Beijing Declaration and Platform for Action;",
    "42": "Encourages the Secretary-General to bring to the attention of the United Nations system the findings of his reports in order to strengthen follow-up on these findings and to accelerate the implementation of the present resolution;",
    "43": "Requests the Secretary-General to provide an oral report to the Commission on the Status of Women at its seventieth and seventy-first sessions and to report to the General Assembly at its eighty-second session on the improvement in the status of women in the United Nations system and on progress made and obstacles encountered in achieving gender balance, under the item entitled \u201cAdvancement of women\u201d;",
    "44": "Also requests the Secretary-General to report to the General Assembly at its eighty-second session on the role, focus, resources and capacities of national machineries for the advancement of women, so as to provide a synthesized assessment of their effectiveness in supporting the full, effective and accelerated implementation of the 12 critical areas of concern of the Beijing Declaration and Platform for Action, within the existing report on measures taken and progress achieved in follow-up to and implementation of the Beijing Declaration and Platform for Action and the outcome of the twenty-third special session of the General Assembly;",
    "45": "Further requests the Secretary-General to report to the General Assembly at its eighty-second session, under the item entitled \u201cAdvancement of women\u201d, on the follow-up to and progress made in the implementation of the Beijing Declaration and Platform for Action and the outcome of the twenty-third special session."
  },
  "agenda_items": [
    "Item 26"
  ],
  "symbol_references": [
    "A/C.3/80/L.59"
  ]
}