{
  "symbol": "A/C.6/80/L.7",
  "filename": "A_C.6_80_L.7.pdf",
  "title": "Observer status for the African Export-Import Bank in the",
  "text": "United Nations \nA/C.6/80/L.7 \n \n \nGeneral Assembly \nDistr.: Limited \n8 October 2025 \nOriginal: English \n \n25-16106 (E)    101025 \n*2516106* \n \n \nEightieth session \nSixth Committee \nAgenda item 173 \nObserver status for the African Export-Import Bank \nin the General Assembly \n \n \n \n \n \nGabon, Uganda and Zambia: draft resolution \n \n \n \n Observer status for the African Export-Import Bank in the \nGeneral Assembly \n \n \n \nThe General Assembly, \n \nWishing to promote cooperation between the United Nations and the African \nExport-Import Bank, \n \n1. \nDecides to invite the African Export-Import Bank to participate in the \nsessions and the work of the General Assembly in the capacity of observer; \n \n2. \nRequests the Secretary-General to take the action necessary to implement \nthe present resolution. \n \n",
  "paragraphs": {
    "1": "Decides to invite the African Export-Import Bank to participate in the sessions and the work of the General Assembly in the capacity of observer;",
    "2": "Requests the Secretary-General to take the action necessary to implement the present resolution."
  },
  "agenda_items": [
    "Item 173"
  ],
  "symbol_references": [
    "A/C.6/80/L.7"
  ]
}