{
  "symbol": "A/C.1/80/L.20",
  "filename": "A_C.1_80_L.20.pdf",
  "title": "Open-ended working group on security of and in the use of information and communications technologies 2021\u20132025 established pursuant to General Assembly resolution 75/240",
  "text": "United Nations \nA/C.1/80/L.20 \n \n \nGeneral Assembly \nDistr.: Limited \n13 October 2025 \nOriginal: English \n \n25-16528 (E)    171025    \n*2516528* \n \n \nEightieth session \nFirst Committee \nAgenda item 94 \nDevelopments in the field of information and telecommunications \nin the context of international security \n \n \n \nSingapore: draft resolution \n \n \nOpen-ended working group on security of and in the use of \ninformation and communications technologies 2021\u20132025 \nestablished pursuant to General Assembly resolution 75/240 \n \n \n \nThe General Assembly, \n \nRecalling its resolutions 75/240 of 31 December 2020 and 76/19 of 6 December \n2021, and noting that the open-ended working group on security of and in the use of \ninformation and communications technologies established pursuant to resolution \n75/240 held its organizational session and its first substantive session in 2021, its \nsecond and third substantive sessions in 2022, its fourth, fifth and sixth substantive \nsessions in 2023, its seventh, eighth and ninth substantive sessions in 2024, and its \ntenth and eleventh substantive sessions in 2025, \n \nRecalling also its decisions 77/512 of 7 December 2022 and 78/541 of \n22 December 2023, as well as its resolution 79/237 of 24 December 2024, \n \nRecalling further that, at its eleventh substantive session, on 11 July 2025, the \nopen-ended working group considered its final report, decided to include in its report \nthe outcome of the substantive discussions of the working group as contained in the \nannex to document A/80/257, and subsequently issued a compendium of statements \nin explanation of position on the adoption of the final report as document \nA/AC.292/2025/INF/5/Rev.1, \n \n1. \nDecides to endorse the final report of the open-ended working group as \ncontained in document A/80/257; \n \n2. \nRequests the Secretary-General to provide the necessary support to \noperationalize all aspects of the Global Mechanism on developments in the field of \nICTs in the context of international security and advancing responsible State \nbehaviour in the use of ICTs, starting in 2026, in accordance with the elements agreed \nin annex C to document A/79/214, as endorsed by the General Assembly in its \nresolution 79/237, and the additional elements agreed in annex I to document \nA/80/257, in order to ensure a smooth and seamless transition from the open-ended \nworking group to the Global Mechanism; \n\nA/C.1/80/L.20 \n \n25-16528\n2/2 \n \n \n3. \nAlso requests the Secretary-General to provide the necessary support to \nestablish the dedicated Global ICT Security Cooperation and Capacity-Building \nPortal in accordance with document A/80/257; \n \n4. \nAlso decides to include in the provisional agenda of its eighty-first session \nthe item entitled \u201cDevelopments in the field of information and telecommunications \nin the context of international security\u201d. \n \n",
  "paragraphs": {
    "1": "Decides to endorse the final report of the open-ended working group as contained in document A/80/257;",
    "2": "",
    "3": "Also requests the Secretary-General to provide the necessary support to establish the dedicated Global ICT Security Cooperation and Capacity-Building Portal in accordance with document A/80/257;",
    "4": "Also decides to include in the provisional agenda of its eighty-first session the item entitled \u201cDevelopments in the field of information and telecommunications in the context of international security\u201d."
  },
  "agenda_items": [
    "Item 94"
  ],
  "symbol_references": [
    "A/C.1/80/L.20"
  ]
}