{
  "symbol": "A/C.5/80/L.9",
  "filename": "A_C.5_80_L.9.pdf",
  "title": "informal consultations",
  "text": "United Nations \nA/C.5/80/L.9\n \n \nGeneral Assembly \nDistr.: Limited \n19 December 2025 \nOriginal: English \n \n25-20795 (E)    231225 \n*2520795* \n \n \nEightieth session \nFifth Committee \nAgenda item 137 \nProgramme planning \n \n \n \nDraft resolution submitted by the Chair of the Committee following \ninformal consultations \n \n \nProgramme planning \n \n \n \nThe General Assembly, \n \nRecalling its resolutions 37/234 of 21 December 1982, 38/227 A of 20 December \n1983, 41/213 of 19 December 1986, 55/234 of 23 December 2000, 56/253 of \n24 December 2001, 57/282 of 20 December 2002, 58/268 and 58/269 of 23 December \n2003, 59/275 of 23 December 2004, 60/257 of 8 May 2006, 61/235 of 22 December \n2006, 62/224 of 22 December 2007, 63/247 of 24 December 2008, 64/229 of \n22 December 2009, 65/244 of 24 December 2010, 66/8 of 11 November 2011, 67/236 \nof 24 December 2012, 68/20 of 4 December 2013, 69/17 of 18 November 2014, 70/8 \nof 13 November 2015, 71/6 of 27 October 2016, 72/9 of 17 November 2017, 72/266 A \nof 24 December 2017, 72/266 B of 5 July 2018, section III of its resolution 72/262 C \nof 5 July 2018 and its resolutions 73/269 of 22 December 2018, 74/251 of \n27 December 2019, 75/243 of 31 December 2020, 76/236 of 24 December 2021, \n77/254 of 30 December 2022, 78/244 of 22 December 2023 and 79/247 of \n24 December 2024, \n \nRecalling also the terms of reference of the Committee for Programme and \nCoordination, as outlined in the annex to Economic and Social Council resolution \n2008 (LX) of 14 May 1976, \n \nRecalling further the Regulations and Rules Governing Programme Planning, \nthe Programme Aspects of the Budget, the Monitoring of Implementation and the \nMethods of Evaluation,1 by which the relevant programmes and subprogrammes of \nthe proposed strategic framework shall be reviewed by the relevant sectoral, \nfunctional and regional intergovernmental bodies, if possible during the regular cycle \nof their meetings, \n \nHaving considered the report of the Committee for Programme and \nCoordination on the work of its sixty-fifth session, 2 the reports of the Secretary-\nGeneral on the proposed programme budget for 2026: part II, proposed programme \n__________________ \n \n1 ST/SGB/2018/3. \n \n2 Official Records of the General Assembly, Eightieth Session, Supplement No. 16 (A/80/16). \n\nA/C.5/80/L.9 \n \n25-20795\n2/3 \n \nplan for 2026 and programme performance for 2024, 3 and the letters and the annexes \nthereto from the Chairs of the Disarmament and International Security Committee \n(First Committee) dated 9 October 2025,4 the Economic and Financial Committee \n(Second Committee) dated 20 October 2025,5 the Social, Humanitarian and Cultural \nCommittee (Third Committee) dated 20 October 2025 6 and the Special Political and \nDecolonization Committee (Fourth Committee) dated 17 October 2025 7 addressed to \nthe Chair of the Fifth Committee, \n \n1. \nReaffirms the role of the Committee for Programme and Coordination as \nthe main subsidiary organ of the General Assembly and the Economic and Social \nCouncil for planning, programming and coordination; \n \n2. \nAlso reaffirms the role of the Committee for Programme and Coordination \nin verifying that the programmes of activities of the Organization are implemented in \nline with the legislative mandates and that the full implementation of regulations and \nrules is ensured; \n \n3. \nRe-emphasizes the role of the plenary and the Main Committees of the \nGeneral Assembly \nin \nreviewing \nand \ntaking \naction \non \nthe \nappropriate \nrecommendations of the Committee for Programme and Coordination relevant to their \nwork, in accordance with regulation 4.10 of the Regulations and Rules Governing \nProgramme Planning, the Programme Aspects of the Budget, the Monitoring of \nImplementation and the Methods of Evaluation; \n \n4. \nStresses that setting the priorities of the United Nations is the prerogative \nof the Member States, as reflected in legislative mandates; \n \n5. \nReiterates the need for Member States to participate fully in the budget \npreparation process, from its early stages and throughout the process; \n \n6. \nTakes note with appreciation of the work of the Committee for Programme \nand Coordination, and welcomes its report; \n \n7. \nReiterates that whenever the Committee for Programme and Coordination \ncannot provide conclusions and recommendations on a given subprogramme or \nprogramme of the proposed programme budget, the plenary or the relevant Main \nCommittee or Main Committees of the General Assembly responsible for those \nmandates will consider the said subprogramme or programme at the very start of its \nsession in order to provide any conclusions and recommendations to the Fifth \nCommittee, at the earliest opportunity, and no later than four weeks after the start of \nthe session, for timely consideration by the Fifth Committee; \n \n8. \nRecognizes the efforts of the President of the General Assembly and the \nChair of the Fifth Committee in following up with the Chairs of the relevant Main \nCommittees on the consideration of the programmes without recommendations from \nthe Committee for Programme and Coordination, in accordance with paragraph 8 of \nits resolution 79/247, and reiterates that incoming Presidents of the General Assembly \n__________________ \n \n3 A/80/6 (Plan outline), A/80/6 (Sect. 2), A/80/6 (Sect. 3), A/80/6 (Sect. 4), A/80/6 (Sect. 5), \nA/80/6 (Sect. 6), A/80/6 (Sect. 8), A/80/6 (Sect. 9), A/80/6 (Sect. 10), A/80/6 (Sect. 11), A/80/6 \n(Sect. 12), A/80/6 (Sect. 13), A/80/6 (Sect. 14), A/80/6 (Sect. 15), A/80/6 (Sect. 16), A/80/6 \n(Sect. 17), A/80/6 (Sect. 18), A/80/6 (Sect. 19), A/80/6 (Sect. 20), A/80/6 (Sect. 21), A/80/6 \n(Sect. 22), A/80/6 (Sect. 24), A/80/6 (Sect. 24)/Corr.1, A/80/6 (Sect. 25), A/80/6 (Sect. 26), \nA/80/6 (Sect. 27), A/80/6 (Sect. 28), A/80/6 (Sect. 29), A/80/6 (Sect. 29A), A/80/6 (Sect. 29B), \nA/80/6 (Sect. 29C), A/80/6 (Sect. 29D), A/80/6 (Sect. 29E), A/80/6 (Sect. 29F), A/80/6 \n(Sect. 30), A/80/6 (Sect. 31) and A/80/6 (Sect. 34). \n \n4 A/C.5/80/10. \n \n5 A/C.5/80/12. \n \n6 A/C.5/80/13. \n \n7 A/C.5/80/11. \n\nA/C.5/80/L.9\n \n3/3\n25-20795 \n \nand Chairs of the Fifth Committee shall reach out to and support the Chairs of the \nMain Committees to ensure that conclusions and recommendations are issued on time; \n \n9. \nEndorses the conclusions and recommendations of the Committee for \nProgramme and Coordination on the proposed programme plan for 2026 and \nprogramme performance for 20248 and on evaluation,9 contained in its report on the \nwork of its sixty-fifth session, and requests the Secretary-General to ensure the timely \nimplementation of the recommendations; \n \n10. Approves, on an exceptional basis and without creating a precedent, for \nprogrammes 3 and 20 of the proposed programme budget for 2026, a programme \nnarrative that is composed solely of the list of mandates at the programme level and \nthe objectives approved by the General Assembly in its resolution 71/6 and the \ndeliverables for 2026 at the subprogramme level; \n \n11. \nAlso approves, on an exceptional basis and without creating a precedent, \nfor programmes 13 and 21 of the proposed programme budget for 2026, a programme \nnarrative that is composed solely of the list of mandates at the programme level and \nthe objectives approved by the General Assembly in its resolution 76/236 and the \ndeliverables for 2026 at the subprogramme level; \n \n12. Further approves, on an exceptional basis and without creating a \nprecedent, for programmes 2, 10, 17, 25 and 26 of the proposed programme budget \nfor 2026, a programme narrative that is composed solely of the list of mandates at the \nprogramme level and the objectives approved by the General Assembly in its \nresolution 77/254 and the deliverables for 2026 at the subprogramme level; \n \n13. Approves, on an exceptional basis and without creating a precedent, for \nprogrammes 4, 11, 14, 23, 24 and 28 of the proposed programme budget for 2026, a \nprogramme narrative that is composed solely of the list of mandates at the programme \nlevel and the objectives approved by the General Assembly in its resolution 78/244 \nand the deliverables for 2026 at the subprogramme level; \n \n14. Also approves, on an exceptional basis and without creating a precedent, \nfor programmes 5, 7, 8, 9, 12, 15, 16, 18, 19 and 22 of the proposed programme budget \nfor 2026, a programme narrative that is composed solely of the list of mandates at the \nprogramme level and the objectives approved by the General Assembly in its \nresolution 79/247 and the deliverables for 2026 at the subprogramme level. \n \n__________________ \n \n8 See Official Records of the General Assembly, Eightieth Session, Supplement No. 16 (A/80/16), \nchap. II, sect. A. \n \n9 Ibid., sect. B. \n",
  "paragraphs": {
    "1": "Reaffirms the role of the Committee for Programme and Coordination as the main subsidiary organ of the General Assembly and the Economic and Social Council for planning, programming and coordination;",
    "2": "Also reaffirms the role of the Committee for Programme and Coordination in verifying that the programmes of activities of the Organization are implemented in line with the legislative mandates and that the full implementation of regulations and rules is ensured;",
    "3": "Re-emphasizes the role of the plenary and the Main Committees of the General Assembly in reviewing and taking action on the appropriate recommendations of the Committee for Programme and Coordination relevant to their work, in accordance with regulation 4.10 of the Regulations and Rules Governing Programme Planning, the Programme Aspects of the Budget, the Monitoring of Implementation and the Methods of Evaluation;",
    "4": "Stresses that setting the priorities of the United Nations is the prerogative of the Member States, as reflected in legislative mandates;",
    "5": "Reiterates the need for Member States to participate fully in the budget preparation process, from its early stages and throughout the process;",
    "6": "Takes note with appreciation of the work of the Committee for Programme and Coordination, and welcomes its report;",
    "7": "Reiterates that whenever the Committee for Programme and Coordination cannot provide conclusions and recommendations on a given subprogramme or programme of the proposed programme budget, the plenary or the relevant Main Committee or Main Committees of the General Assembly responsible for those mandates will consider the said subprogramme or programme at the very start of its session in order to provide any conclusions and recommendations to the Fifth Committee, at the earliest opportunity, and no later than four weeks after the start of the session, for timely consideration by the Fifth Committee;",
    "8": "Recognizes the efforts of the President of the General Assembly and the Chair of the Fifth Committee in following up with the Chairs of the relevant Main Committees on the consideration of the programmes without recommendations from the Committee for Programme and Coordination, in accordance with paragraph 8 of its resolution 79/247, and reiterates that incoming Presidents of the General Assembly and Chairs of the Fifth Committee shall reach out to and support the Chairs of the Main Committees to ensure that conclusions and recommendations are issued on time;",
    "9": "Endorses the conclusions and recommendations of the Committee for Programme and Coordination on the proposed programme plan for 2026 and programme performance for 20248 and on evaluation,9 contained in its report on the work of its sixty-fifth session, and requests the Secretary-General to ensure the timely implementation of the recommendations;",
    "10": "Approves, on an exceptional basis and without creating a precedent, for programmes 3 and 20 of the proposed programme budget for 2026, a programme narrative that is composed solely of the list of mandates at the programme level and the objectives approved by the General Assembly in its resolution 71/6 and the deliverables for 2026 at the subprogramme level;",
    "11": "Also approves, on an exceptional basis and without creating a precedent, for programmes 13 and 21 of the proposed programme budget for 2026, a programme narrative that is composed solely of the list of mandates at the programme level and the objectives approved by the General Assembly in its resolution 76/236 and the deliverables for 2026 at the subprogramme level;",
    "12": "Further approves, on an exceptional basis and without creating a precedent, for programmes 2, 10, 17, 25 and 26 of the proposed programme budget for 2026, a programme narrative that is composed solely of the list of mandates at the programme level and the objectives approved by the General Assembly in its resolution 77/254 and the deliverables for 2026 at the subprogramme level;",
    "13": "Approves, on an exceptional basis and without creating a precedent, for programmes 4, 11, 14, 23, 24 and 28 of the proposed programme budget for 2026, a programme narrative that is composed solely of the list of mandates at the programme level and the objectives approved by the General Assembly in its resolution 78/244 and the deliverables for 2026 at the subprogramme level;",
    "14": "Also approves, on an exceptional basis and without creating a precedent, for programmes 5, 7, 8, 9, 12, 15, 16, 18, 19 and 22 of the proposed programme budget for 2026, a programme narrative that is composed solely of the list of mandates at the programme level and the objectives approved by the General Assembly in its resolution 79/247 and the deliverables for 2026 at the subprogramme level."
  },
  "agenda_items": [
    "Item 137"
  ],
  "symbol_references": [
    "A/C.5/80/L.9"
  ]
}