{
  "symbol": "A/C.5/80/L.11",
  "filename": "A_C.5_80_L.11.pdf",
  "title": "informal consultations",
  "text": "United Nations \nA/C.5/80/L.11\n \n \nGeneral Assembly \nDistr.: Limited \n22 December 2025 \nOriginal: English \n \n25-20996 (E)    241225 \n*2520996* \n \n \nEightieth session \nFifth Committee \nAgenda item 135 \nProgramme budget for 2025 \n \n \n \n \n \nDraft resolution submitted by the Chair of the Committee following \ninformal consultations \n \n \n \n Capital master plan \n \n \n \nThe General Assembly, \n \nRecalling its resolution 54/249 of 23 December 1999, section IV of its resolution \n55/238 of 23 December 2000, its resolutions 56/234 and 56/236 of 24 December 2001 \nand 56/286 of 27 June 2002, section II of its resolution 57/292 of 20 December 2002, \nsection XXII of its resolution 58/272 of 23 December 2003, section XI of its resolution \n59/276 of 23 December 2004, its resolution 59/295 of 22 June 2005, section II of its \nresolution 60/248 of 23 December 2005, its resolutions 60/256 of 8 May 2006, 60/282 \nof 30 June 2006, 61/251 of 22 December 2006, 62/87 of 10 December 2007, 63/270 of \n7 April 2009, 64/228 of 22 December 2009 and 65/269 of 4 April 2011, section III of \nits resolution 66/258 of 9 April 2012, section V of its resolution 67/246 of 24 December \n2012, sections III and IV of its resolution 67/254 of 12 April 2013, section IV of its \nresolution 68/247 A of 27 December 2013, section VII of its resolution 68/247 B of \n9 April 2014, section VIII of its resolution 69/274 A of 2 April 2015 and its resolutions \n70/239 of 23 December 2015 and 79/246 of 24 December 2024, and its decisions 58/566 \nof 8 April 2004, 65/543 of 24 December 2010 and 66/555 of 24 December 2011, \n \nHaving considered the twenty-third annual progress report of the Secretary-\nGeneral on the implementation of the capital master plan 1 and the related report of \nthe Advisory Committee on Administrative and Budgetary Questions, 2 \n \n1. \nTakes note of the report of the Secretary-General; \n \n2. \nEndorses the conclusions and recommendations contained in the report of \nthe Advisory Committee on Administrative and Budgetary Questions; \n \n3. \nNotes with concern that the Organization continues to disburse a higher \namount in legal fees for arbitration under the capital master plan than the total in \ndamages subsequently awarded to the plaintiffs, and reiterates its request to the \n__________________ \n \n1  A/80/334. \n \n2  A/80/396. \n\nA/C.5/80/L.11 \n \n25-20996\n2/2 \n \nSecretary-General to ensure the cost- and time-effective resolution of the remaining \narbitration; \n \n4. \nRecalls paragraph 7 of the report of the Advisory Committee, requests the \nSecretary-General to provide in his future reports detailed and precise estimates on \nthe remaining third phase of the second arbitration case, including projected \nexpenditures on all expenses, including legal costs, and potential liabilities, required \nfor each year in which the arbitration might last, based on the latest assumptions and \nthe anticipated timing for when Member States may incur financial obligations, and \nalso requests the Secretary-General to take necessary steps to limit the financial \nliabilities and protect the rights of the United Nations to the fullest extent possible; \n \n5. \nAlso recalls paragraph 8 of the report of the Advisory Committee, and \nrequests the Secretary-General to continue to gather lessons learned related to the \narbitration cases and share them with other construction projects with a view to \navoiding litigation insofar as feasible, including from subcontractors and third parties, \nand protecting the rights of the United Nations in other construction projects, as well \nas improving construction-related risk management processes; \n \n6. \nRequests the Secretary-General to continue to hold managers accountable \nwhen their decisions have been established to be grossly negligent according to the \napplicable Staff Regulations and Rules of the United Nations and have led to litigation \nand subsequent financial loss; \n \n7. \nRecalls paragraph 17 of the report of the Advisory Committee, and \nrequests the Secretary-General to provide further information on the review of vendor \nregistration with options on further strengthening the registration process in his next \nprogress report. \n \n",
  "paragraphs": {
    "1": "Takes note of the report of the Secretary-General;",
    "2": "Endorses the conclusions and recommendations contained in the report of the Advisory Committee on Administrative and Budgetary Questions;",
    "3": "Notes with concern that the Organization continues to disburse a higher amount in legal fees for arbitration under the capital master plan than the total in damages subsequently awarded to the plaintiffs, and reiterates its request to the __________________ 1 A/80/334. 2 A/80/396. A/C.5/80/L.11 25-20996 2/2 Secretary-General to ensure the cost- and time-effective resolution of the remaining arbitration;",
    "4": "Recalls paragraph 7 of the report of the Advisory Committee, requests the Secretary-General to provide in his future reports detailed and precise estimates on the remaining third phase of the second arbitration case, including projected expenditures on all expenses, including legal costs, and potential liabilities, required for each year in which the arbitration might last, based on the latest assumptions and the anticipated timing for when Member States may incur financial obligations, and also requests the Secretary-General to take necessary steps to limit the financial liabilities and protect the rights of the United Nations to the fullest extent possible;",
    "5": "Also recalls paragraph 8 of the report of the Advisory Committee, and requests the Secretary-General to continue to gather lessons learned related to the arbitration cases and share them with other construction projects with a view to avoiding litigation insofar as feasible, including from subcontractors and third parties, and protecting the rights of the United Nations in other construction projects, as well as improving construction-related risk management processes;",
    "6": "Requests the Secretary-General to continue to hold managers accountable when their decisions have been established to be grossly negligent according to the applicable Staff Regulations and Rules of the United Nations and have led to litigation and subsequent financial loss;",
    "7": "Recalls paragraph 17 of the report of the Advisory Committee, and requests the Secretary-General to provide further information on the review of vendor registration with options on further strengthening the registration process in his next progress report."
  },
  "agenda_items": [
    "Item 135"
  ],
  "symbol_references": [
    "A/C.5/80/L.11"
  ]
}