{
  "symbol": "A/C.2/80/L.36",
  "filename": "A_C.2_80_L.36.pdf",
  "title": "Implementation of the Convention on Biological Diversity and its contribution to sustainable development",
  "text": "United Nations \nA/C.2/80/L.36\n \n \nGeneral Assembly \nDistr.: Limited \n20 October 2025 \nOriginal: English \n \n25-16916 (E)    271025 \n*2516916* \n \n \nEightieth session \nSecond Committee \nAgenda item 18 (f) \nSustainable development: Convention on Biological Diversity \n \n \n \n \n \nIraq:* draft resolution \n \n \n \n Implementation of the Convention on Biological Diversity and its \ncontribution to sustainable development \n \n \n \nThe General Assembly, \n \nRecalling its resolution 79/208 of 19 December 2024 and its previous \nresolutions relating to the Convention on Biological Diversity, 1 \n \nReaffirming the outcomes of the United Nations Conference on Environment \nand Development, including the Rio Declaration on Environment and Development 2 \nand its principles, the outcome document of the United Nations Conference on \nSustainable Development, entitled \u201cThe future we want\u201d, 3 and, inter alia, the \ncommitments concerning biodiversity contained therein, the Programme for the \nFurther Implementation of Agenda 21,4 the Johannesburg Declaration on Sustainable \nDevelopment5 and the Plan of Implementation of the World Summit on Sustainable \nDevelopment (Johannesburg Plan of Implementation) 6 and the outcome document of \nthe special event to follow up efforts made towards achieving the Millennium \nDevelopment Goals convened by the President of the General Assembly, 7 \n \nReaffirming also its resolution 70/1 of 25 September 2015, entitled \n\u201cTransforming our world: the 2030 Agenda for Sustainable Development\u201d, in which \nit adopted a comprehensive, far-reaching and people-centred set of universal and \n__________________ \n \n* On behalf of the States that are members of the Group of 77 and China, taking into account also \nthe provisions of General Assembly resolution ES-10/23 of 10 May 2024. \n \n1 United Nations, Treaty Series, vol. 1760, No. 30619. \n \n2 Report of the United Nations Conference on Environment and Development, Rio de Janeiro, \n3 \u2013 14 June 1992, vol. I, Resolutions Adopted by the Conference (United Nations publication, \nSales No. E.93.I.8 and corrigendum), resolution 1, annex I. \n \n3 Resolution 66/288, annex. \n \n4 Resolution S-19/2, annex. \n \n5 Report of the World Summit on Sustainable Development, Johannesburg, South Africa, \n26 August\u20134 September 2002 (United Nations publication, Sales No. E.03.II.A.1 and \ncorrigendum), chap. I, resolution 1, annex. \n \n6 Ibid., resolution 2, annex. \n \n7 Resolution 68/6. \n\nA/C.2/80/L.36 \n \n25-16916\n2/12 \n \ntransformative Sustainable Development Goals and targets, its commitment to \nworking tirelessly for the full implementation of the Agenda by 2030, its recognition \nthat eradicating poverty in all its forms and dimensions, including extreme poverty, \nis the greatest global challenge and an indispensable requirement for sustainable \ndevelopment, its commitment to achieving sustainable development in its three \ndimensions \u2013 economic, social and environmental \u2013 in a balanced and integrated \nmanner, and to building upon the achievements of the Millennium Development \nGoals and seeking to address their unfinished business,  \n \nReaffirming further its resolution 69/313 of 27 July 2015 on the Addis Ababa \nAction Agenda of the Third International Conference on Financing for Development, \nwhich is an integral part of the 2030 Agenda for Sustainable Development, supports \nand complements it, helps to contextualize its means of implementation targets with \nconcrete policies and actions, and reaffirms the strong political commitment to \naddress the challenge of financing and creating an enabling environment at all levels \nfor sustainable development in the spirit of global partnership and solidarity,  \n \nWelcoming the convening of the Fourth International Conference on Financing \nfor Development from 30 June to 3 July 2025 in Sevilla, Spain, and reaffirming its \noutcome document, the Sevilla Commitment, endorsed by the General Assembly in \nits resolution 79/323 of 25 August 2025, which sets forth a renewed global framework \nfor financing for development, building on the 2015 Addis Ababa Action Agenda, to \nclose with urgency the estimated annual 4 trillion dollar financing gap, catalyse \nsustainable investments at scale in developing countries and reform the international \nfinancial architecture through continued and strong commitment to multilateralism, \ninternational cooperation, and global solidarity, \n \nReaffirming the New Urban Agenda, adopted at the United Nations Conference \non Housing and Sustainable Urban Development (Habitat III), held in Quito, Ecuador, \nfrom 17 to 20 October 2016,8 and its vision for cities and human settlements that \nprotect, conserve, restore and promote their ecosystems, water, natural habitats and \nbiodiversity and minimize their environmental impact, and also welcoming the \nconvening of the thirteenth session of the World Urban Forum, to be held in Baku, \nfrom 17 to 22 May 2026 under the theme \u201cHousing the world: safe and resilient cities \nand communities\u201d, as an important platform to advance the implementation of the \nNew Urban Agenda, \n \nReaffirming also the Paris Agreement9 and encouraging all its Parties to fully \nimplement the Agreement, and Parties to the United Nations Framework Convention \non Climate Change10 that have not yet done so to deposit their instruments of \nratification, acceptance, approval or accession, where appropriate, as soon as \npossible,  \n \nLooking forward to the thirtieth session of the Conference of the Parties to the \nUnited Nations Framework Convention on Climate Change to be held in Bel\u00e9m, \nBrazil, from 10 to 21 November 2025,  \n \nNoting with serious concern the findings from the Intergovernmental Panel on \nClimate Change in its special reports entitled Global Warming of 1.5\u00b0C, The Ocean \nand Cryosphere in a Changing Climate and Climate Change and Land: An IPCC \nSpecial Report on Climate Change, Desertification, Land Degradation, Sustainable \nLand Management, Food Security, and Greenhouse Gas Fluxes in Terrestrial \nEcosystems, as well as the contribution of Working Groups I, II and III and the \nsynthesis report of the Sixth Assessment Report of the Intergovernmental Panel on \n__________________ \n \n8 Resolution 71/256, annex. \n \n9 Adopted under the UNFCCC in FCCC/CP/2015/10/Add.1, decision 1/CP.21. \n \n10 United Nations, Treaty Series, vol. 1771, No. 30822. \n\nA/C.2/80/L.36\n \n3/12\n25-16916 \n \nClimate Change, in which the Intergovernmental Panel highlights the linkages \nbetween climate change and extreme weather events and slow-onset events and their \nnegative impacts on people and nature, and highlighting the increasing frequency and \nintensity of extreme weather events, such as heatwaves, droughts and heavy \nprecipitation,  \n \nNoting with profound concern the findings of the Intergovernmental Science \nPolicy Platform on Biodiversity and Ecosystem Services Global Assessment Report \non Biodiversity and Ecosystem Services,  \n \nRecalling its resolution 76/300 of 28 July 2022 on the human right to a clean, \nhealthy and sustainable environment,  \n \nRecalling also its resolutions 71/312 of 6 July 2017 and 76/296 of 21 July 2022, \nand welcoming the 2025 United Nations Conference to Support the Implementation \nof Sustainable Development Goal 14: Conserve and sustainably use the oceans, seas \nand marine resources for sustainable development, which was co-hosted by Costa \nRica and France and held in Nice, France, from 9 to 13 June 2025,  \n \nTaking note of voluntary initiatives to support efforts to achieve the conservation \nand protection of at least 30 per cent of the world\u2019s land and ocean by 2030, which \ncan further contribute to halt and reverse biodiversity loss,  \n \nRecalling its resolution 73/284 of 1 March 2019, in which it proclaimed \n2021 \u2013 2030 the United Nations Decade on Ecosystem Restoration, with the aim of \nsupporting and scaling up efforts to prevent, halt and reverse the degradation of \necosystems worldwide and raise awareness of the importance of successful ecosystem \nrestoration,  \n \nRecalling also the United Nations strategic plan for forests 2017\u20132030,11 and \nrecognizing that forests are home to an estimated 80 per cent of all terrestrial species \nand that forests, including boreal, temperate and tropical, contribute substantially to \nclimate change mitigation and adaptation and to the conservation of biodiversity,  \n \nRecalling further the fifth edition of the Global Biodiversity Outlook, in which \nit was highlighted that none of the 20 Aichi Biodiversity Targets were fully achieved, \nalthough six were partially achieved (targets 9, 11, 16, 17, 19 and 20), and \nemphasizing the need for support and investments at all levels to enhance efforts for \nthe implementation of the goals and targets of the Kunming-Montreal Global \nBiodiversity Framework, including the provision and mobilization of financial \nresources,  \n \nNoting with concern that the Sustainable Development Goal targets with a 2020 \ndeadline have not been fully achieved,  \n \nRecognizing that the coronavirus disease (COVID-19) pandemic and other \npandemics underscore the need to conserve, restore and sustainably use biodiversity, \non land and below water, to reduce the risk of the economic, social and environmental \nimpacts of disasters and future pandemic outbreaks, many of which are exacerbated \nby biodiversity loss, the increased scale of poaching and the illegal use of and trade \nin wildlife and wildlife products, desertification, land degradation and drought, \nclimate change and plastic pollution, including in the marine environment, and \nemphasizing the need to support and invest at all levels, to enhance efforts to build \nresilience, to reduce the likelihood of zoonotic infections and to avoid or minimize \nadverse impacts on biological diversity in order to achieve the objectives of the \nConvention on Biological Diversity and to achieve a sustainable, resilient and \ninclusive recovery,  \n__________________ \n \n11 See resolution 71/285. \n\nA/C.2/80/L.36 \n \n25-16916\n4/12 \n \n \nRecalling with appreciation the intergovernmentally agreed outcomes of the \nmeetings of the Conference of the Parties to the Convention on Biological Diversity \nand the meetings of the Conference of the Parties serving as the Meetings of the \nParties to the Protocols to the Convention,  \n \nRecalling that the objectives of the Convention on Biological Diversity, to be \npursued in accordance with its relevant provisions, are the conservation of biological \ndiversity, the sustainable use of its components and the fair and equitable sharing of \nthe benefits arising out of the utilization of genetic resources, including by \nappropriate access to genetic resources, by appropriate transfer of relevant \ntechnologies, taking into account all rights over those resources and to technologies, \nand by appropriate funding,  \n \nRecognizing that the achievement of the three objectives of the Convention on \nBiological Diversity is crucial for sustainable development, poverty eradication, food \nsecurity and the improvement of human health and well-being, and a major factor \nunderpinning the achievement of the Sustainable Development Goals and other \ninternationally agreed development goals,  \n \nReaffirming that, in accordance with the Charter of the United Nations, States \nhave the sovereign right to exploit their own resources pursuant to their own \nenvironmental policies and the responsibility to ensure that activities within their \njurisdiction or control do not cause damage to the environment of other States or of \nareas beyond the limits of national jurisdiction,  \n \nReaffirming also the intrinsic value of biological diversity, as well as the \necological, genetic, social, economic, scientific, educational, cultural, recreational \nand aesthetic values of biological diversity, and its critical role in maintaining \necosystems that provide essential functions and services, which are critical \nfoundations for sustainable development, and human health and well-being,  \n \nEncouraging Parties, other Governments and relevant organizations to integrate \nnature-based solutions, ecosystem-based approaches and other management and \nconservation approaches, in line with resolution 5/5 of 7 March 2022 of the United \nNations Environment Assembly,12 to climate change adaptation and mitigation and \ndisaster risk reduction into their strategic planning, as appropriate, across sectors,  \n \nRecognizing that the traditional knowledge, innovations and practices of \nIndigenous Peoples and local communities that are relevant to the Convention make \na key contribution to the conservation and sustainable use of biodiversity and that \ntheir wider application can support social well-being and sustainable livelihoods,  \n \nRecalling the decisions adopted by the Conference of the Parties to the \nConvention on Biological Diversity on article 8 (j) and related provisions, as well as \nthe work done by the Ad Hoc Open-ended Intersessional Working Group on Article \n8 (j) and Related Provisions of the Convention on Biological Diversity,  \n \nRecalling also the United Nations Declaration on the Rights of Indigenous \nPeoples13 and the outcome document of the high-level plenary meeting of the General \nAssembly known as the World Conference on Indigenous Peoples, 14  \n \nRecognizing the vital role that women play in the conservation and sustainable \nuse of biological diversity, and reaffirming the need for their full, equal, effective and \nmeaningful participation at all levels of policymaking and implementation for the \n__________________ \n \n12 UNEP/EA.5/Res.5. \n \n13 Resolution 61/295, annex. \n \n14 Resolution 69/2. \n\nA/C.2/80/L.36\n \n5/12\n25-16916 \n \nconservation and sustainable use of biological diversity, as well as ecosystem \nrestoration,  \n \nRecognizing also the important role of other biodiversity-related multilateral \nenvironmental agreements, regional agreements and initiatives in contributing to the \nconservation and sustainable use of biodiversity,  \n \nRecognizing further the important role of the Convention on International Trade \nin Endangered Species of Wild Fauna and Flora15 in contributing to the conservation \nand sustainable use of biodiversity and in ensuring that no species entering into \ninternational trade is threatened with extinction, recognizing also the economic, social \nand environmental impacts of poaching and trafficking in wildlife,  \n \nRecalling the convening of the 2023 United Nations Conference on the Midterm \nComprehensive Review of the Implementation of the Objectives of the International \nDecade for Action, \u201cWater for Sustainable Development\u201d, 2018\u20132028, and looking \nforward to the 2026 United Nations Water Conference to Accelerate the \nImplementation of Sustainable Development Goal 6: Ensure availability and \nsustainable management of water and sanitation for all, to be co-hosted by Senegal \nand the United Arab Emirates and held in the United Arab Emirates from 2 to \n4 December 2026,  \n \nWelcoming the decision by the United Nations Environment Assembly at its \nresumed fifth session, in resolution 5/14 of 2 March 2022, 16 to convene an \nintergovernmental negotiating committee to develop an international legally binding \ninstrument on plastic pollution, including in the marine environment, and welcoming \nalso the decisions taken by the Environment Assembly at its resumed fifth session to \nstrengthen global action on the sound management of chemicals and waste and to \nprevent pollution, in line with Environment Assembly resolutions 5/2, 5/7 and 5/8 of \n2 March 2022,17 \n \nWelcoming also the sixteenth session of the Conference of the Parties to the \nUnited Nations Convention to Combat Desertification in Those Countries \nExperiencing Serious Drought and/or Desertification, Particularly in Africa, held in \nRiyadh, from 2 to 13 December 2024 under the theme \u201cOur land, our future\u201d,  \n \nNoting the adoption by the Conference of the Parties to the Convention on \nBiological Diversity, at its tenth meeting, of the Nagoya Protocol on Access to \nGenetic Resources and the Fair and Equitable Sharing of Benefits Arising from Their \nUtilization to the Convention on Biological Diversity,18 the objective of which is the \nfair and equitable sharing of the benefits arising from the utilization of genetic \nresources, including by appropriate access to genetic resources and by appropriate \ntransfer of relevant technologies, taking into account all rights over those resources \nand to technologies, and by appropriate funding, and acknowledging the role of access \nto genetic resources and equitable benefit-sharing arising from their utilization in \ncontributing to the conservation and sustainable use of biological diversity, poverty \neradication and environmental sustainability, and thereby to the achievement of \nsustainable development,  \n \nNoting also that 195 States and 1 regional economic integration organization are \nParties to the Convention and that 141 States and 1 regional economic integration \norganization are Parties to the Nagoya Protocol, noting further that 172 States and \n1 regional economic integration organization are Parties to the Cartagena Protocol on \n__________________ \n \n15 United Nations, Treaty Series, vol. 993, No. 14537. \n \n16 UNEP/EA.5/Res.14. \n \n17 UNEP/EA.5/Res.2, UNEP/EA.5/Res.7 and UNEP/EA.5/Res.8. \n \n18 United Nations Environment Programme, document UNEP/CBD/COP/10/27, annex, \ndecision X/1. \n\nA/C.2/80/L.36 \n \n25-16916\n6/12 \n \nBiosafety to the Convention on Biological Diversity 19 and that 54 States and \n1 regional economic integration organization are Parties to the Nagoya-Kuala Lumpur \nSupplementary Protocol on Liability and Redress to the Cartagena Protocol on \nBiosafety,20 and recalling the entry into force of the Nagoya-Kuala Lumpur \nSupplementary Protocol on 5 March 2018,  \n \nStressing that adequate, predictable and easily accessible financial resources \nfrom all sources will be key to place the global community on a path towards realizing \nthe 2050 Vision for Biodiversity of living in harmony with nature,  \n \nReiterating the pledge that no one will be left behind, reaffirming the \nrecognition that the dignity of the human person is fundamental, and the wish to see \nthe Goals and targets met for all nations and peoples and for all segments of society, \nand recommitting to endeavour to reach the furthest behind first,  \n \n1. \nTakes note of the report of the Executive Secretary of the Convention on \nBiological Diversity;21 \n \n2. \nInvites the Parties to the Convention to provide the Executive Secretary of \nthe Convention with full support in the fulfilment of her mandate and in promoting \nthe implementation of the Convention;  \n \n3. \nWelcomes the convening of the sixteenth meeting of the Conference of the \nParties to the Convention on Biological Diversity, as well as the Meetings of the \nParties to the Protocols to the Convention, held in Cali, Colombia, from 21 October \nto 1 November 2024, under the theme \u201cPeace with nature\u201d, takes note of its adopted \ndecisions, and looks forward to the seventeenth meeting of the Conference of the \nParties and the meetings of the Conference of the Parties serving as the Meetings of \nthe Parties to the Protocols to the Convention, to be held in Yerevan, in 2026;  \n \n4. \nAlso welcomes the Kunming-Montreal Global Biodiversity Framework to \ncontribute to the 2030 Agenda for Sustainable Development, 22 to the 2030 mission to \nhalt and reverse biodiversity loss by 2030 and to place the global community on a \npath towards realizing the 2050 Vision for Biodiversity, and urges Parties and invites \nother Governments, with the support of United Nations entities and the participation \nof all other stakeholders, to ensure the early, inclusive and effective implementation \nof the Framework and all other decisions adopted by the Parties;  \n \n5. \nCalls for the provision and mobilization of new and additional means of \nimplementation to support the full implementation of the Convention on Biological \nDiversity, and emphasizes the importance of urgently increasing the mobilization of \nfinancial resources from all sources, domestic and international, public and private, \nwith a view to closing the biodiversity financing gap and making adequate and \npredictable resources available in a timely manner for the effective implementation \nof the Kunming-Montreal Global Biodiversity Framework;  \n \n6. \nWelcomes the strategy for resource mobilization for the period 2025\u20132030, \nadopted at the sixteenth meeting of the Conference of the Parties to the Convention, \nfor the implementation of the Convention and its Protocols, as well as the \nachievement of the goals and targets of the Kunming-Montreal Global Biodiversity \nFramework, and the decision to establish the permanent arrangement for the financial \nmechanism envisioned under article 21 of the Convention; \n__________________ \n \n19 United Nations, Treaty Series, vol. 2226, No. 30619. \n \n20 See United Nations Environment Programme, document UNEP/CBD/BS/COP-MOP/5/17, annex, \ndecision BS-V/11. \n \n21 A/80/373, sect. III. \n \n22 Resolution 70/1. \n\nA/C.2/80/L.36\n \n7/12\n25-16916 \n \n \n7. \nEmphasizes that the successful implementation of the Kunming-Montreal \nGlobal Biodiversity Framework requires responsibility and transparency, which will \nbe supported by effective mechanisms for planning, monitoring, reporting and review, \nincluding through revising or updating national biodiversity strategies and action \nplans, in alignment with the Framework, its goals and its targets, in line with decision \n15/6 of 19 December 2022 adopted at the fifteenth meeting of the Conference of the \nParties;23  \n \n8. \nRequests the continuation of efforts made by the secretariat of the \nConvention, Parties to the Convention and the Global Environment Facility, as the \nfinancial mechanism of the Convention, in conjunction with United Nations funds \nand programmes and the specialized agencies, as well as other entities, in organizing \ncapacity-building activities to support countries in the updating of national \nbiodiversity strategies and action plans, with a view to enhancing capacity and \naddressing the need for human, technical and financial resources to implement the \nConvention and the Kunming-Montreal Global Biodiversity Framework, in particular \nfor developing countries;  \n \n9. \nWelcomes the establishment by the Global Environment Facility of the \nGlobal Biodiversity Framework Fund to support the implementation of the Kunming-\nMontreal Global Biodiversity Framework;  \n \n10. Calls for continued capitalization and timely operationalization of the \nGlobal Biodiversity Framework Fund commensurate with the targets of the \nFramework, from all sources, including, inter alia, international financial resources \nfrom developed countries, philanthropic organizations and the private sector, and to \nprogress towards implementation as soon as possible;  \n \n11. \nAcknowledges decision 16/2 of 1 November 2024 on the modalities for \noperationalizing the multilateral mechanism for the fair and equitable sharing of \nbenefits from the use of digital sequence information on genetic resources, including \na global fund (referred to as the Cali Fund), adopted at the sixteenth meeting of the \nConference of the Parties to the Convention;  \n \n12. Also acknowledges the important roles and contributions of Indigenous \nPeoples and local communities as custodians of biodiversity and as partners in its \nconservation, restoration and sustainable use, stresses that the implementation of the \nKunming-Montreal Global Biodiversity Framework must ensure that the rights, \nknowledge, \nincluding \ntraditional \nknowledge \nassociated \nwith \nbiodiversity, \ninnovations, world views, values and practices of Indigenous Peoples and local \ncommunities are respected, and documented and preserved with their free, prior and \ninformed consent,24 including through their full and effective participation in \ndecision-making, in accordance with relevant national legislation, international \ninstruments, including the United Nations Declaration on the Rights of Indigenous \nPeoples, and human rights law, and takes note with appreciation of the goal of \nproviding up to 20 per cent of the programming share of the Global Biodiversity \nFramework Fund by 2030 to support action by Indigenous Peoples and local \ncommunities for the conservation, restoration, sustainable use and management of \nbiodiversity;  \n \n13. Recalls decision 16/6 of 1 November 2024 entitled \u201cRole of people of \nAfrican descent, comprising collectives embodying traditional lifestyles, in the \n__________________ \n \n23  United Nations Environment Programme, document CBD/COP/15/17, decision 15/6. \n \n24 In this framework, free, prior and informed consent refers to the tripartite terminology of \u201cprior \nand informed consent\u201d or \u201cfree, prior and informed consent\u201d or \u201capproval and involvement\u201d. \n\nA/C.2/80/L.36 \n \n25-16916\n8/12 \n \nimplementation of the Convention on Biological Diversity\u201d, adopted at the sixteenth \nmeeting of the Conference of the Parties to the Convention on Biological Diversity; \n \n14. Urges Parties to the Convention to ensure the coherence and \ncomplementarity of the Kunming-Montreal Global Biodiversity Framework with \nother existing or upcoming international processes, in particular with regard to the \n2030 Agenda, the Paris Agreement and other related processes, frameworks and \nstrategies, and reiterates the invitation to the other multilateral environmental \nagreements, including biodiversity-related conventions and the Rio conventions, \nrelevant international organizations and their programmes, and other relevant \nprocesses to actively participate in their implementation; \n \n15. Encourages support for the Sharm el-Sheikh to Kunming Action Agenda \nfor Nature and People, which is aimed at collecting, coordinating and celebrating \nactions in support of biodiversity conservation and its sustainable use, encourages all \nrelevant stakeholders, including Indigenous Peoples and local communities and the \nprivate sector, to consider developing biodiversity commitments, and invites relevant \nagencies, funds and programmes of the United Nations system and other relevant \ninstitutions and intergovernmental organizations, where relevant, to support the \nimplementation of the Action Agenda; \n \n16. Welcomes the adoption of the Global Action Plan on Biodiversity and \nHealth at the sixteenth meeting of the Conference of the Parties to the Convention on \nBiological Diversity, and encourages Parties to implement it when mainstreaming \nbiodiversity and health interlinkages and to provide information on their \nimplementing activities and the result thereof, including in national reports, as \nappropriate; \n \n17. Notes that the COVID-19 pandemic has exacerbated pre-existing \ninequalities and challenges for the implementation of the Convention and further \nhighlighted that the loss and degradation of biodiversity increases the risk of zoonotic \ndisease spillover from wildlife to people and urges Parties to the Convention and all \nother relevant stakeholders to continue to mainstream biodiversity into COVID-19 \nrecovery plans and in plans aimed at reducing the risk of future pandemics, \nemphasizes the importance of a One Health approach and other holistic approaches \nthat deliver multiple benefits to the health and well-being of people and planet, that \nwould further strengthen the capacity to address biodiversity loss, prevent and \nrespond to the emergence of diseases, including zoonotic infections, and future \npandemics, and contribute to reducing the adverse impacts of climate change, calls \nfor transformative actions from all relevant stakeholders and adequate and sufficient \nmeans of implementation, particularly for developing countries, to ensure the full \nimplementation of the Convention to halt and reverse biodiversity loss, and welcomes \nthe financial commitments and initiatives that have been announced from \ngovernments, organizations and the private sector that contribute to biodiversity \nconservation, restoration and sustainable use and maintain the political momentum \nfor the implementation of the Kunming-Montreal Global Biodiversity Framework;  \n \n18. Notes with concern the limited progress made in the implementation of the \nthree objectives of the Convention, namely, the conservation of biological diversity, \nthe sustainable use of its components and the fair and equitable sharing of the benefits \narising out of the utilization of genetic resources, as well the limited progress made \nin the implementation of the Nagoya Protocol on Access to Genetic Resources and \nthe Fair and Equitable Sharing of Benefits Arising from Their Utilization; \n \n19. Notes the limited progress made in mainstreaming article 8 (j) of the \nConvention and related provisions into various areas of work under the Convention, \ntakes note with appreciation of decisions 15/10 of 19 December 2022 and 16/4 of \n30 October 2024 of the Conference of the Parties to the Convention to develop and \n\nA/C.2/80/L.36\n \n9/12\n25-16916 \n \nadopt a new programme of work on article 8 (j) and other provisions of the \nConvention related to Indigenous Peoples and local communities to 2030 aligned with \nthe Kunming-Montreal Global Biodiversity Framework, with the full and effective \nparticipation of Indigenous Peoples and local communities, and in this regard invites \nthe secretariat of the Convention, through the Secretary-General, to report on the \nprogress made by the Ad Hoc Open-ended Intersessional Working Group on \nArticle 8 (j) and Related Provisions when reporting on the implementation of the \npresent resolution to the General Assembly;  \n \n20. Welcomes the decision to establish the subsidiary body on article 8 (j) and \nother provisions of the Convention on Biological Diversity, and encourages Parties, \nother Governments and relevant organizations to provide additional support to \nrepresentatives of Indigenous Peoples and local communities, to participate \neffectively in its meetings;  \n \n21. Encourages the respective Parties, in close collaboration with the relevant \nstakeholders, to take concrete measures towards achieving and coherently and \neffectively implementing the objectives of the Convention and its Protocols, and calls \nupon Parties and stakeholders to strengthen international cooperation measures for \nthe fulfilment of obligations contained in the Convention and its protocols, including \nthrough comprehensively addressing at all levels the difficulties that may impede \ntheir implementation;  \n \n22. Highlights the importance of Parties raising high-level political \nengagement for the achievement of the objectives of the Convention and the \nKunming-Montreal Global Biodiversity Framework adopted at the fifteenth session \nof the Conference of the Parties, and the related Goals and targets of the 2030 Agenda;  \n \n23. Invites all Parties, relevant departments of the Secretariat, the specialized \nagencies, funds and programmes of the United Nations system and the regional \ncommissions to continue to contribute to the achievement of the objectives of the \nConvention;  \n \n24. Notes the important role of the United Nations Environment Management \nGroup in enhancing inter-agency coordination to support the implementation of the \nKunming-Montreal Global Biodiversity Framework;  \n \n25. Stresses the importance of mainstreaming biodiversity across government \nand society for achieving the objectives of the Convention, as well as the mission, \nvision, goals and targets of the Kunming-Montreal Global Biodiversity Framework \nadopted at the fifteenth session of the Conference of the Parties, and urges all relevant \nstakeholders to mainstream biodiversity in all relevant sectors;  \n \n26. Calls upon Governments and all stakeholders to take appropriate measures \nto mainstream consideration of the socioeconomic impacts and benefits of the \nconservation and sustainable use of biodiversity and its components, as well as \necosystems that provide essential services, into relevant programmes and policies at \nall levels, in accordance with national legislation, circumstances and priorities;  \n \n27. Stresses \nthe \nimportance \nof \nmainstreaming \nbiodiversity \nin \nthe \nimplementation of the 2030 Agenda as part of national implementation plans for the \nSustainable Development Goals, in particular all biodiversity-related Goals and \ntargets;  \n \n28. Recognizes that integrating biodiversity considerations into sectoral and \ncross-sectoral policies, plans and programmes at all levels is critical for harnessing \nthe benefits of enhanced synergies and policy coherence;  \n \n29. Welcomes the decisions of the Parties to the Convention to better \nmainstream biodiversity and to take specific actions tailored to national needs and \n\nA/C.2/80/L.36 \n \n25-16916\n10/12 \n \ncircumstances, and in line with other relevant international agreements, including in \nkey sectors, such as agriculture, forestry, fisheries and tourism, as well as health, \nenergy, mining, infrastructure, manufacturing and processing sectors, which are \ncrucial for addressing biodiversity loss, bearing in mind the impact of these sectors \non biodiversity;  \n \n30. Recalls its resolution 77/321 of 1 August 2023 entitled \u201cAgreement under \nthe United Nations Convention on the Law of the Sea on the Conservation and \nSustainable Use of Marine Biological Diversity of Areas beyond National \nJurisdiction\u201d;  \n \n31. Emphasizes the importance of ending illegal, unreported and unregulated \nfishing, and welcomes the Agreement on Fisheries Subsidies reached at the Twelfth \nMinisterial Conference of the World Trade Organization;  \n \n32. Notes the critical role of biodiversity and ecosystem functions and services \nfor climate change adaptation, mitigation and disaster risk reduction, including by \nadding resilience to fragile ecosystems and making them less vulnerable, and that \ncontinued climate change will have predominantly adverse and often irreversible \nimpacts on many ecosystems and their functions and services, with significant \nnegative social, cultural and economic consequences;  \n \n33. Urges the Parties to the Convention to facilitate the transfer of technology \non mutually agreed terms for the effective implementation of the Convention in \naccordance with article 16 and other relevant provisions of the Convention, and in \nthis regard welcomes the decision to establish an informal advisory group on technical \nand scientific cooperation, to provide strategic advice on practical measures, tools \nand opportunities to promote and facilitate technical and scientific cooperation in \naccordance with the terms of reference contained in annex III to decision 15/8 of \n19 December 2022 of the Conference of the Parties to the Convention; \n \n34. Urges Parties and invites other Governments and relevant organizations to \nrecognize the important role of, and to promote, science, technology and innovation \nin supporting the implementation of the goals and targets of the Kunming-Montreal \nGlobal Biodiversity Framework towards achieving the 2050 Vision for Biodiversity \nof living in harmony with nature;  \n \n35. Recalls decision 15/11 of 19 December 2022 of the Conference of the \nParties to the Convention, entitled \u201cGender Plan of Action\u201d, which recognizes the \nimportance of advancing efforts to achieve gender equality and the empowerment of \nall women and girls and of supporting and advancing gender mainstreaming and \ngender-responsive implementation of the Kunming-Montreal Global Biodiversity \nFramework, and encourages Parties to promote the mainstreaming of a gender \nperspective in developing, implementing and revising their national, and where \nappropriate, regional and subnational biodiversity strategies and action plans and \nequivalent instruments in implementing the three objectives of the Convention, and \nalso recognizes the need to enhance cooperation on capacity-building in order to \nsupport Parties in this process;  \n \n36. Invites countries that have not yet done so to ratify or accede to the \nConvention;  \n \n37. Invites Parties to the Convention to ratify or accede to the Nagoya \nProtocol, and invites the Executive Secretary of the Convention and the Global \nEnvironment Facility, within its mandate as the financial mechanism of the \nConvention, in collaboration with relevant organizations, to continue to support \ncapacity-building and development activities to support the ratification and \nimplementation of the Protocol;  \n\nA/C.2/80/L.36\n \n11/12\n25-16916 \n \n \n38. Also invites Parties to the Convention to consider, as appropriate, ratifying \nor acceding to the Cartagena Protocol;  \n \n39. Invites Parties to the Cartagena Protocol to consider, as appropriate, \nratifying or acceding to the Nagoya-Kuala Lumpur Supplementary Protocol on \nLiability and Redress to the Cartagena Protocol on Biosafety;  \n \n40. Stresses the urgent need to halt the global decline of biodiversity, which is \nunprecedented in human history, including its main indirect and direct drivers, in \nparticular changes in land and sea use, direct exploitation of organisms, climate \nchange, pollution and invasion of alien species;  \n \n41. Notes the findings of the Intergovernmental Science-Policy Platform on \nBiodiversity and Ecosystem Services in its assessment report on the diverse values \nand valuation of nature, and stresses that achieving a sustainable and just future \nrequires institutions that enable a recognition and integration of the diverse values of \nnature and nature\u2019s contributions to people, and that the transformative change needed \nto address the global biodiversity crisis relies on shifting away from predominant \nvalues that currently overemphasize short-term and individual material gains to \nnurturing sustainability-aligned values across society;  \n \n42. Takes note of the Intergovernmental Science-Policy Platform on \nBiodiversity and Ecosystem Services assessment reports on the sustainable use of \nwild species and on invasive alien species and their control, and stresses that the \nimpacts of invasive alien species are increasing rapidly and are predicted to continue \nrising in the future, whereas they can be prevented and mitigated through effective \nmanagement, with closer collaboration across sectors and countries;  \n \n43. Notes that increasing investments in nature-based solutions, ecosystem \nbased approaches and other management and conservation approaches, in line with \nUnited Nations Environment Assembly resolution 5/5, has the potential to cost-\neffectively support biodiversity conservation, restoration and its sustainable use, to \nhelp advance climate mitigation and adaptation and to reduce adverse impacts of \nclimate change and to slow, halt and even reverse some aspects of biodiversity and \necosystem loss, and therefore invites all relevant stakeholders to consider the \nopportunities it presents;  \n \n44. Stresses the importance of engaging Indigenous Peoples and local \ncommunities, women, youth, civil society, local governments and authorities, \nacademia, the business and financial sectors and other relevant stakeholders to \nsupport action towards the implementation of the Kunming-Montreal Global \nBiodiversity Framework, the 2050 Vision for Biodiversity and the three objectives of \nthe Convention, and invites them to align their practices more explicitly with the \nobjectives of the Convention, including through partnerships, in accordance with \nnational legislation, circumstances and priorities;  \n \n45. Encourages the private sector, in particular business and financial \ninstitutions, to progressively reduce negative impacts on biodiversity, increase \npositive impacts, reduce biodiversity-related risks to business and financial \ninstitutions, and promote actions to ensure sustainable patterns of production, in this \nregard stresses the importance of the work of the Global Partnership for Business and \nBiodiversity, and notes other related and complementary initiatives;  \n \n46. Reaffirms the commitment at the very heart of the 2030 Agenda to leave \nno one behind and commit to taking more tangible steps to support people in \nvulnerable situations and the most vulnerable countries and to reach the furthest \nbehind first;  \n\nA/C.2/80/L.36 \n \n25-16916\n12/12 \n \n \n47. Requests the Secretary-General to submit to the General Assembly, at its \neighty-first session, a report on the implementation of the present resolution, progress \nin the implementation of the Convention on Biological Diversity and the Kunming-\nMontreal Global Biodiversity Framework, and decides to include in the provisional \nagenda of its eighty-first session, under the item entitled \u201cSustainable development\u201d, \nthe sub-item entitled \u201cConvention on Biological Diversity\u201d. \n \n",
  "paragraphs": {
    "1": "Takes note of the report of the Executive Secretary of the Convention on Biological Diversity;21",
    "2": "Invites the Parties to the Convention to provide the Executive Secretary of the Convention with full support in the fulfilment of her mandate and in promoting the implementation of the Convention;",
    "3": "Welcomes the convening of the sixteenth meeting of the Conference of the Parties to the Convention on Biological Diversity, as well as the Meetings of the Parties to the Protocols to the Convention, held in Cali, Colombia, from 21 October to 1 November 2024, under the theme \u201cPeace with nature\u201d, takes note of its adopted decisions, and looks forward to the seventeenth meeting of the Conference of the Parties and the meetings of the Conference of the Parties serving as the Meetings of the Parties to the Protocols to the Convention, to be held in Yerevan, in 2026;",
    "4": "Also welcomes the Kunming-Montreal Global Biodiversity Framework to contribute to the 2030 Agenda for Sustainable Development, 22 to the 2030 mission to halt and reverse biodiversity loss by 2030 and to place the global community on a path towards realizing the 2050 Vision for Biodiversity, and urges Parties and invites other Governments, with the support of United Nations entities and the participation of all other stakeholders, to ensure the early, inclusive and effective implementation of the Framework and all other decisions adopted by the Parties;",
    "5": "Calls for the provision and mobilization of new and additional means of implementation to support the full implementation of the Convention on Biological Diversity, and emphasizes the importance of urgently increasing the mobilization of financial resources from all sources, domestic and international, public and private, with a view to closing the biodiversity financing gap and making adequate and predictable resources available in a timely manner for the effective implementation of the Kunming-Montreal Global Biodiversity Framework;",
    "6": "Welcomes the strategy for resource mobilization for the period 2025\u20132030, adopted at the sixteenth meeting of the Conference of the Parties to the Convention, for the implementation of the Convention and its Protocols, as well as the achievement of the goals and targets of the Kunming-Montreal Global Biodiversity Framework, and the decision to establish the permanent arrangement for the financial mechanism envisioned under article 21 of the Convention; __________________ 19 United Nations, Treaty Series, vol. 2226, No. 30619. 20 See United Nations Environment Programme, document UNEP/CBD/BS/COP-MOP/5/17, annex, decision BS-V/11. 21 A/80/373, sect. III. 22 Resolution 70/1. A/C.2/80/L.36 7/12 25-16916",
    "7": "Emphasizes that the successful implementation of the Kunming-Montreal Global Biodiversity Framework requires responsibility and transparency, which will be supported by effective mechanisms for planning, monitoring, reporting and review, including through revising or updating national biodiversity strategies and action plans, in alignment with the Framework, its goals and its targets, in line with decision 15/6 of 19 December 2022 adopted at the fifteenth meeting of the Conference of the Parties;23",
    "8": "Requests the continuation of efforts made by the secretariat of the Convention, Parties to the Convention and the Global Environment Facility, as the financial mechanism of the Convention, in conjunction with United Nations funds and programmes and the specialized agencies, as well as other entities, in organizing capacity-building activities to support countries in the updating of national biodiversity strategies and action plans, with a view to enhancing capacity and addressing the need for human, technical and financial resources to implement the Convention and the Kunming-Montreal Global Biodiversity Framework, in particular for developing countries;",
    "9": "Welcomes the establishment by the Global Environment Facility of the Global Biodiversity Framework Fund to support the implementation of the Kunming- Montreal Global Biodiversity Framework;",
    "10": "Calls for continued capitalization and timely operationalization of the Global Biodiversity Framework Fund commensurate with the targets of the Framework, from all sources, including, inter alia, international financial resources from developed countries, philanthropic organizations and the private sector, and to progress towards implementation as soon as possible;",
    "11": "Acknowledges decision 16/2 of 1 November 2024 on the modalities for operationalizing the multilateral mechanism for the fair and equitable sharing of benefits from the use of digital sequence information on genetic resources, including a global fund (referred to as the Cali Fund), adopted at the sixteenth meeting of the Conference of the Parties to the Convention;",
    "12": "Also acknowledges the important roles and contributions of Indigenous Peoples and local communities as custodians of biodiversity and as partners in its conservation, restoration and sustainable use, stresses that the implementation of the Kunming-Montreal Global Biodiversity Framework must ensure that the rights, knowledge, including traditional knowledge associated with biodiversity, innovations, world views, values and practices of Indigenous Peoples and local communities are respected, and documented and preserved with their free, prior and informed consent,24 including through their full and effective participation in decision-making, in accordance with relevant national legislation, international instruments, including the United Nations Declaration on the Rights of Indigenous Peoples, and human rights law, and takes note with appreciation of the goal of providing up to 20 per cent of the programming share of the Global Biodiversity Framework Fund by 2030 to support action by Indigenous Peoples and local communities for the conservation, restoration, sustainable use and management of biodiversity;",
    "13": "Recalls decision 16/6 of 1 November 2024 entitled \u201cRole of people of African descent, comprising collectives embodying traditional lifestyles, in the __________________ 23 United Nations Environment Programme, document CBD/COP/15/17, decision 15/6. 24 In this framework, free, prior and informed consent refers to the tripartite terminology of \u201cprior and informed consent\u201d or \u201cfree, prior and informed consent\u201d or \u201capproval and involvement\u201d. A/C.2/80/L.36 25-16916 8/12 implementation of the Convention on Biological Diversity\u201d, adopted at the sixteenth meeting of the Conference of the Parties to the Convention on Biological Diversity;",
    "14": "Urges Parties to the Convention to ensure the coherence and complementarity of the Kunming-Montreal Global Biodiversity Framework with other existing or upcoming international processes, in particular with regard to the 2030 Agenda, the Paris Agreement and other related processes, frameworks and strategies, and reiterates the invitation to the other multilateral environmental agreements, including biodiversity-related conventions and the Rio conventions, relevant international organizations and their programmes, and other relevant processes to actively participate in their implementation;",
    "15": "Encourages support for the Sharm el-Sheikh to Kunming Action Agenda for Nature and People, which is aimed at collecting, coordinating and celebrating actions in support of biodiversity conservation and its sustainable use, encourages all relevant stakeholders, including Indigenous Peoples and local communities and the private sector, to consider developing biodiversity commitments, and invites relevant agencies, funds and programmes of the United Nations system and other relevant institutions and intergovernmental organizations, where relevant, to support the implementation of the Action Agenda;",
    "16": "Welcomes the adoption of the Global Action Plan on Biodiversity and Health at the sixteenth meeting of the Conference of the Parties to the Convention on Biological Diversity, and encourages Parties to implement it when mainstreaming biodiversity and health interlinkages and to provide information on their implementing activities and the result thereof, including in national reports, as appropriate;",
    "17": "Notes that the COVID-19 pandemic has exacerbated pre-existing inequalities and challenges for the implementation of the Convention and further highlighted that the loss and degradation of biodiversity increases the risk of zoonotic disease spillover from wildlife to people and urges Parties to the Convention and all other relevant stakeholders to continue to mainstream biodiversity into COVID-19 recovery plans and in plans aimed at reducing the risk of future pandemics, emphasizes the importance of a One Health approach and other holistic approaches that deliver multiple benefits to the health and well-being of people and planet, that would further strengthen the capacity to address biodiversity loss, prevent and respond to the emergence of diseases, including zoonotic infections, and future pandemics, and contribute to reducing the adverse impacts of climate change, calls for transformative actions from all relevant stakeholders and adequate and sufficient means of implementation, particularly for developing countries, to ensure the full implementation of the Convention to halt and reverse biodiversity loss, and welcomes the financial commitments and initiatives that have been announced from governments, organizations and the private sector that contribute to biodiversity conservation, restoration and sustainable use and maintain the political momentum for the implementation of the Kunming-Montreal Global Biodiversity Framework;",
    "18": "Notes with concern the limited progress made in the implementation of the three objectives of the Convention, namely, the conservation of biological diversity, the sustainable use of its components and the fair and equitable sharing of the benefits arising out of the utilization of genetic resources, as well the limited progress made in the implementation of the Nagoya Protocol on Access to Genetic Resources and the Fair and Equitable Sharing of Benefits Arising from Their Utilization;",
    "19": "Notes the limited progress made in mainstreaming article 8 (j) of the Convention and related provisions into various areas of work under the Convention, takes note with appreciation of decisions 15/10 of 19 December 2022 and 16/4 of 30 October 2024 of the Conference of the Parties to the Convention to develop and A/C.2/80/L.36 9/12 25-16916 adopt a new programme of work on article 8 (j) and other provisions of the Convention related to Indigenous Peoples and local communities to 2030 aligned with the Kunming-Montreal Global Biodiversity Framework, with the full and effective participation of Indigenous Peoples and local communities, and in this regard invites the secretariat of the Convention, through the Secretary-General, to report on the progress made by the Ad Hoc Open-ended Intersessional Working Group on Article 8 (j) and Related Provisions when reporting on the implementation of the present resolution to the General Assembly;",
    "20": "Welcomes the decision to establish the subsidiary body on article 8 (j) and other provisions of the Convention on Biological Diversity, and encourages Parties, other Governments and relevant organizations to provide additional support to representatives of Indigenous Peoples and local communities, to participate effectively in its meetings;",
    "21": "Encourages the respective Parties, in close collaboration with the relevant stakeholders, to take concrete measures towards achieving and coherently and effectively implementing the objectives of the Convention and its Protocols, and calls upon Parties and stakeholders to strengthen international cooperation measures for the fulfilment of obligations contained in the Convention and its protocols, including through comprehensively addressing at all levels the difficulties that may impede their implementation;",
    "22": "Highlights the importance of Parties raising high-level political engagement for the achievement of the objectives of the Convention and the Kunming-Montreal Global Biodiversity Framework adopted at the fifteenth session of the Conference of the Parties, and the related Goals and targets of the 2030 Agenda;",
    "23": "Invites all Parties, relevant departments of the Secretariat, the specialized agencies, funds and programmes of the United Nations system and the regional commissions to continue to contribute to the achievement of the objectives of the Convention;",
    "24": "Notes the important role of the United Nations Environment Management Group in enhancing inter-agency coordination to support the implementation of the Kunming-Montreal Global Biodiversity Framework;",
    "25": "Stresses the importance of mainstreaming biodiversity across government and society for achieving the objectives of the Convention, as well as the mission, vision, goals and targets of the Kunming-Montreal Global Biodiversity Framework adopted at the fifteenth session of the Conference of the Parties, and urges all relevant stakeholders to mainstream biodiversity in all relevant sectors;",
    "26": "Calls upon Governments and all stakeholders to take appropriate measures to mainstream consideration of the socioeconomic impacts and benefits of the conservation and sustainable use of biodiversity and its components, as well as ecosystems that provide essential services, into relevant programmes and policies at all levels, in accordance with national legislation, circumstances and priorities;",
    "27": "Stresses the importance of mainstreaming biodiversity in the implementation of the 2030 Agenda as part of national implementation plans for the Sustainable Development Goals, in particular all biodiversity-related Goals and targets;",
    "28": "Recognizes that integrating biodiversity considerations into sectoral and cross-sectoral policies, plans and programmes at all levels is critical for harnessing the benefits of enhanced synergies and policy coherence;",
    "29": "Welcomes the decisions of the Parties to the Convention to better mainstream biodiversity and to take specific actions tailored to national needs and A/C.2/80/L.36 25-16916 10/12 circumstances, and in line with other relevant international agreements, including in key sectors, such as agriculture, forestry, fisheries and tourism, as well as health, energy, mining, infrastructure, manufacturing and processing sectors, which are crucial for addressing biodiversity loss, bearing in mind the impact of these sectors on biodiversity;",
    "30": "Recalls its resolution 77/321 of 1 August 2023 entitled \u201cAgreement under the United Nations Convention on the Law of the Sea on the Conservation and Sustainable Use of Marine Biological Diversity of Areas beyond National Jurisdiction\u201d;",
    "31": "Emphasizes the importance of ending illegal, unreported and unregulated fishing, and welcomes the Agreement on Fisheries Subsidies reached at the Twelfth Ministerial Conference of the World Trade Organization;",
    "32": "Notes the critical role of biodiversity and ecosystem functions and services for climate change adaptation, mitigation and disaster risk reduction, including by adding resilience to fragile ecosystems and making them less vulnerable, and that continued climate change will have predominantly adverse and often irreversible impacts on many ecosystems and their functions and services, with significant negative social, cultural and economic consequences;",
    "33": "Urges the Parties to the Convention to facilitate the transfer of technology on mutually agreed terms for the effective implementation of the Convention in accordance with article 16 and other relevant provisions of the Convention, and in this regard welcomes the decision to establish an informal advisory group on technical and scientific cooperation, to provide strategic advice on practical measures, tools and opportunities to promote and facilitate technical and scientific cooperation in accordance with the terms of reference contained in annex III to decision 15/8 of 19 December 2022 of the Conference of the Parties to the Convention;",
    "34": "Urges Parties and invites other Governments and relevant organizations to recognize the important role of, and to promote, science, technology and innovation in supporting the implementation of the goals and targets of the Kunming-Montreal Global Biodiversity Framework towards achieving the 2050 Vision for Biodiversity of living in harmony with nature;",
    "35": "Recalls decision 15/11 of 19 December 2022 of the Conference of the Parties to the Convention, entitled \u201cGender Plan of Action\u201d, which recognizes the importance of advancing efforts to achieve gender equality and the empowerment of all women and girls and of supporting and advancing gender mainstreaming and gender-responsive implementation of the Kunming-Montreal Global Biodiversity Framework, and encourages Parties to promote the mainstreaming of a gender perspective in developing, implementing and revising their national, and where appropriate, regional and subnational biodiversity strategies and action plans and equivalent instruments in implementing the three objectives of the Convention, and also recognizes the need to enhance cooperation on capacity-building in order to support Parties in this process;",
    "36": "Invites countries that have not yet done so to ratify or accede to the Convention;",
    "37": "Invites Parties to the Convention to ratify or accede to the Nagoya Protocol, and invites the Executive Secretary of the Convention and the Global Environment Facility, within its mandate as the financial mechanism of the Convention, in collaboration with relevant organizations, to continue to support capacity-building and development activities to support the ratification and implementation of the Protocol; A/C.2/80/L.36 11/12 25-16916",
    "38": "Also invites Parties to the Convention to consider, as appropriate, ratifying or acceding to the Cartagena Protocol;",
    "39": "Invites Parties to the Cartagena Protocol to consider, as appropriate, ratifying or acceding to the Nagoya-Kuala Lumpur Supplementary Protocol on Liability and Redress to the Cartagena Protocol on Biosafety;",
    "40": "Stresses the urgent need to halt the global decline of biodiversity, which is unprecedented in human history, including its main indirect and direct drivers, in particular changes in land and sea use, direct exploitation of organisms, climate change, pollution and invasion of alien species;",
    "41": "Notes the findings of the Intergovernmental Science-Policy Platform on Biodiversity and Ecosystem Services in its assessment report on the diverse values and valuation of nature, and stresses that achieving a sustainable and just future requires institutions that enable a recognition and integration of the diverse values of nature and nature\u2019s contributions to people, and that the transformative change needed to address the global biodiversity crisis relies on shifting away from predominant values that currently overemphasize short-term and individual material gains to nurturing sustainability-aligned values across society;",
    "42": "Takes note of the Intergovernmental Science-Policy Platform on Biodiversity and Ecosystem Services assessment reports on the sustainable use of wild species and on invasive alien species and their control, and stresses that the impacts of invasive alien species are increasing rapidly and are predicted to continue rising in the future, whereas they can be prevented and mitigated through effective management, with closer collaboration across sectors and countries;",
    "43": "Notes that increasing investments in nature-based solutions, ecosystem based approaches and other management and conservation approaches, in line with United Nations Environment Assembly resolution 5/5, has the potential to cost- effectively support biodiversity conservation, restoration and its sustainable use, to help advance climate mitigation and adaptation and to reduce adverse impacts of climate change and to slow, halt and even reverse some aspects of biodiversity and ecosystem loss, and therefore invites all relevant stakeholders to consider the opportunities it presents;",
    "44": "Stresses the importance of engaging Indigenous Peoples and local communities, women, youth, civil society, local governments and authorities, academia, the business and financial sectors and other relevant stakeholders to support action towards the implementation of the Kunming-Montreal Global Biodiversity Framework, the 2050 Vision for Biodiversity and the three objectives of the Convention, and invites them to align their practices more explicitly with the objectives of the Convention, including through partnerships, in accordance with national legislation, circumstances and priorities;",
    "45": "Encourages the private sector, in particular business and financial institutions, to progressively reduce negative impacts on biodiversity, increase positive impacts, reduce biodiversity-related risks to business and financial institutions, and promote actions to ensure sustainable patterns of production, in this regard stresses the importance of the work of the Global Partnership for Business and Biodiversity, and notes other related and complementary initiatives;",
    "46": "Reaffirms the commitment at the very heart of the 2030 Agenda to leave no one behind and commit to taking more tangible steps to support people in vulnerable situations and the most vulnerable countries and to reach the furthest behind first; A/C.2/80/L.36 25-16916 12/12",
    "47": "Requests the Secretary-General to submit to the General Assembly, at its eighty-first session, a report on the implementation of the present resolution, progress in the implementation of the Convention on Biological Diversity and the Kunming- Montreal Global Biodiversity Framework, and decides to include in the provisional agenda of its eighty-first session, under the item entitled \u201cSustainable development\u201d, the sub-item entitled \u201cConvention on Biological Diversity\u201d."
  },
  "agenda_items": [
    "Item 18"
  ],
  "symbol_references": [
    "A/C.2/80/L.36"
  ]
}