{
  "symbol": "A/C.2/80/L.60",
  "filename": "A_C.2_80_L.60.pdf",
  "title": "Draft programme of work of the Second Committee for the eighty-first session of the General Assembly",
  "text": "United Nations \nA/C.2/80/L.60\n \n \nGeneral Assembly \nDistr.: Limited \n19 November 2025 \nOriginal: English \n \n25-18805 (E)    251125     \n*2518805* \n \n \nEightieth session \nSecond Committee \nAgenda item 121 \nRevitalization of the work of the General Assembly \n \n \n \n \n \nDraft decision submitted by the Bureau \n \n \n \n Draft programme of work of the Second Committee for the \neighty-first session of the General Assembly \n \n \n \nThe General Assembly: \n \n(a) \nApproves the draft programme of work of the Second Committee for the \neighty-first session of the Assembly as set out below; \n \n(b) \nInvites the Bureau of the Second Committee at the eighty-first session, in \npreparing the draft programme of work and timetable of the Committee for the eighty-\nfirst session, to take into account the provisional programme of work and timetable \nof the Committee as contained in document A/C.2/80/CRP.1. \n \n \n \nDraft programme of work1 \n \n1. \nInformation and communications technologies for sustainable development. \n2. \nMacroeconomic policy questions: \n \n(a) \nInternational trade and development; \n \n(b) \nInternational financial system and development; \n \n(c) \nExternal debt sustainability and development; \n \n(d) \nPromotion of international cooperation to combat illicit financial flows \nand strengthen good practices on assets return to foster sustainable \ndevelopment; \n \n(e) \nPromoting investments for sustainable development; \n \n(f) \nPromotion of inclusive and effective international tax cooperation at the \nUnited Nations; \n \n(g) \nCreative economy and sustainable development. \n__________________ \n \n1  The final list of items and sub-items to be considered will be based on the resolutions and \ndecisions adopted by the General Assembly. \n\nA/C.2/80/L.60 \n \n25-18805\n2/3 \n \n3. \nFollow-up to and implementation of the outcomes of the International \nConferences on Financing for Development. \n4. \nSustainable development: \n \n(a) \nTowards the achievement of sustainable development: implementation of \nthe 2030 Agenda for Sustainable Development, including through \nsustainable consumption and production, building on Agenda 21; \n \n(b) \nFollow-up to and implementation of the Antigua and Barbuda Agenda for \nSmall Island Developing States: A Renewed Declaration for Resilient \nProsperity; \n \n(c) \nDisaster risk reduction; \n \n(d) \nProtection of global climate for present and future generations of \nhumankind; \n \n(e) \nImplementation of the United Nations Convention to Combat \nDesertification in Those Countries Experiencing Serious Drought and/or \nDesertification, Particularly in Africa; \n \n(f) \nConvention on Biological Diversity; \n \n(g) \nReport of the United Nations Environment Assembly of the United \nNations Environment Programme; \n \n(h) \nHarmony with Nature; \n \n(i) \nEnsuring access to affordable, reliable, sustainable and modern energy \nfor all; \n \n(j) \nCombating sand and dust storms; \n \n(k) \nPromoting the social and solidarity economy for sustainable \ndevelopment. \n5. \nFollow-up to the implementation of the New Urban Agenda and strengthening \nof the United Nations Human Settlements Programme (UN-Habitat). \n6. \nGlobalization and interdependence: \n \n(a) \nRole of the United Nations in promoting development in the context of \nglobalization and interdependence; \n \n(b) \nInternational migration and development; \n7. \nGroups of countries in special situations: \n \n(a) \nFollow-up to the Fifth United Nations Conference on the Least \nDeveloped Countries; \n \n(b) \nFollow-up to the Third United Nations Conference on Landlocked \nDeveloping Countries. \n8. \nEradication of poverty and other development issues: \n \n(a) \nImplementation of the Third United Nations Decade for the Eradication \nof Poverty (2018\u20132027); \n \n(b) \nIndustrial development cooperation; \n \n(c) \nWomen in development; \n \n(d) \nHuman resources development; \n\nA/C.2/80/L.60\n \n3/3\n25-18805 \n \n \n(e) \nEradicating rural poverty to implement the 2030 Agenda for Sustainable \nDevelopment. \n9. \nOperational activities for development: \n \n(a) \nOperational activities for development of the United Nations system; \n \n(b) \nSouth-South cooperation for development. \n10. Agriculture development, food security and nutrition. \n11. \nPermanent sovereignty of the Palestinian people in the Occupied Palestinian \nTerritory, including East Jerusalem, and of the Arab population in the occupied \nSyrian Golan over their natural resources. \n12. Revitalization of the work of the General Assembly. \n13. Programme planning. \n \n",
  "paragraphs": {
    "1": "Information and communications technologies for sustainable development.",
    "2": "Macroeconomic policy questions: (a) International trade and development; (b) International financial system and development; (c) External debt sustainability and development; (d) Promotion of international cooperation to combat illicit financial flows and strengthen good practices on assets return to foster sustainable development; (e) Promoting investments for sustainable development; (f) Promotion of inclusive and effective international tax cooperation at the United Nations; (g) Creative economy and sustainable development.",
    "3": "Follow-up to and implementation of the outcomes of the International Conferences on Financing for Development.",
    "4": "Sustainable development: (a) Towards the achievement of sustainable development: implementation of the 2030 Agenda for Sustainable Development, including through sustainable consumption and production, building on Agenda 21; (b) Follow-up to and implementation of the Antigua and Barbuda Agenda for Small Island Developing States: A Renewed Declaration for Resilient Prosperity; (c) Disaster risk reduction; (d) Protection of global climate for present and future generations of humankind; (e) Implementation of the United Nations Convention to Combat Desertification in Those Countries Experiencing Serious Drought and/or Desertification, Particularly in Africa; (f) Convention on Biological Diversity; (g) Report of the United Nations Environment Assembly of the United Nations Environment Programme; (h) Harmony with Nature; (i) Ensuring access to affordable, reliable, sustainable and modern energy for all; (j) Combating sand and dust storms; (k) Promoting the social and solidarity economy for sustainable development.",
    "5": "Follow-up to the implementation of the New Urban Agenda and strengthening of the United Nations Human Settlements Programme (UN-Habitat).",
    "6": "Globalization and interdependence: (a) Role of the United Nations in promoting development in the context of globalization and interdependence; (b) International migration and development;",
    "7": "Groups of countries in special situations: (a) Follow-up to the Fifth United Nations Conference on the Least Developed Countries; (b) Follow-up to the Third United Nations Conference on Landlocked Developing Countries.",
    "8": " (e) Eradicating rural poverty to implement the 2030 Agenda for Sustainable Development.",
    "9": "Operational activities for development: (a) Operational activities for development of the United Nations system; (b) South-South cooperation for development.",
    "10": "Agriculture development, food security and nutrition.",
    "11": "Permanent sovereignty of the Palestinian people in the Occupied Palestinian Territory, including East Jerusalem, and of the Arab population in the occupied Syrian Golan over their natural resources.",
    "12": "Revitalization of the work of the General Assembly.",
    "13": "Programme planning."
  },
  "agenda_items": [
    "Item 121"
  ],
  "symbol_references": [
    "A/C.2/80/L.60"
  ]
}