{
  "symbol": "A/C.3/80/L.28",
  "filename": "A_C.3_80_L.28.pdf",
  "title": "Freedom of religion or belief",
  "text": "United Nations \nA/C.3/80/L.28\n \n \nGeneral Assembly \nDistr.: Limited \n4 November 2025 \nOriginal: English \n \n25-17790 (E)    121125     \n*2517790* \n \n \nEightieth session \nThird Committee \nAgenda item 71 (b) \nPromotion and protection of human rights: human \nrights questions, including alternative approaches for \nimproving the effective enjoyment of human rights and \nfundamental freedoms \n \n \n \n \n \nAlbania, Austria, Belgium, Bosnia and Herzegovina, Bulgaria, Croatia, Cyprus, \nCzechia, Denmark, Estonia, Finland, France, Germany, Greece, Hungary, \nIreland, Italy, Latvia, Lithuania, Luxembourg, Malta, Monaco, Montenegro, \nNetherlands (Kingdom of the), North Macedonia, Poland, Portugal, Republic of \nMoldova, Romania, Slovakia, Slovenia, Spain, Sweden, Ukraine and \nUnited Kingdom of Great Britain and Northern Ireland: draft resolution \n \n \n \n Freedom of religion or belief \n \n \n \nThe General Assembly, \n \nRecalling article 18 of the International Covenant on Civil and Political Rights, 1 \narticle 18 of the Universal Declaration of Human Rights 2 and other relevant human \nrights provisions, \n \nRecalling also its resolution 36/55 of 25 November 1981, by which it \nproclaimed the Declaration on the Elimination of All Forms of Intolerance and of \nDiscrimination Based on Religion or Belief, \n \nRecalling further its previous resolutions on freedom of religion or belief and \non the elimination of all forms of intolerance and of discrimination based on religion \nor belief, including its resolution 79/174 of 17 December 2024 and Human Rights \nCouncil resolution 58/5 of 2 April 2025,3  \n \nRecognizing the important work carried out by the Human Rights Committee in \nproviding guidance with respect to the scope of freedom of religion or belief, \n \nNoting the conclusions and recommendations of the expert workshops organized \nby the Office of the United Nations High Commissioner for Human Rights and \ncontained in the Rabat Plan of Action on the prohibition of advocacy of national, \n__________________ \n \n1  See resolution 2200 A (XXI), annex. \n \n2  Resolution 217 A (III). \n \n3  See Official Records of the General Assembly, Eightieth Session, Supplement No. 53 (A/80/53), \nchap. V, sect. A. \n\nA/C.3/80/L.28 \n \n25-17790\n2/6 \n \nracial or religious hatred that constitutes incitement to discrimination, hostility or \nviolence, adopted in Rabat on 5 October 2012,4  \n \nConsidering that religion or belief, for those who profess either, is one of the \nfundamental elements in their conception of life and that freedom of religion or belief, \nas a universal human right, should be fully respected and guaranteed, \n \nSeriously concerned by continuing acts of intolerance and violence based on \nreligion or belief against individuals, including against persons belonging to religious \ncommunities and religious minorities around the world, and by the increasing number \nand intensity of such incidents, which are often of a criminal nature and may have \ninternational characteristics, \n \nDeeply concerned by the limited progress that has been made in the elimination \nof all forms of intolerance and of discrimination based on religion or belief, and \nbelieving that further intensified efforts are therefore required to promote and protect \nthe right to freedom of thought, conscience and religion or belief and to eliminate all \nforms of hatred, intolerance and discrimination based on religion or belief, as noted \nat the World Conference against Racism, Racial Discrimination, Xenophobia and \nRelated Intolerance, held in Durban, South Africa, from 31 August to 8 September \n2001, as well as at the Durban Review Conference, held in Geneva from 20 to \n24 April 2009, \n \nRecalling that States have the primary responsibility to promote and protect \nhuman rights, including the human rights of persons belonging to religious minorities, \nincluding their right to exercise their religion or belief freely, \n \nConcerned that State and non-State actors sometimes tolerate or encourage acts \nof violence, or credible threats of violence, against persons belonging to religious \ncommunities and religious minorities, \n \nConcerned also by the increasing number of laws and regulations that limit the \nfreedom of thought, conscience and religion or belief and by the implementation of \nexisting laws in a discriminatory manner, \n \nConvinced of the need to urgently address the rapid rise in various parts of the \nworld of religious extremism that affects the human rights of individuals, in particular \npersons belonging to religious communities and religious minorities, the situations of \nviolence and discrimination that affect many individuals, particularly women and \nchildren, on the basis of or in the name of religion or belief or in accordance with \ncultural and traditional practices, and the misuse of religion or belief for ends \ninconsistent with the principles set out in the Charter of the United Nations and in \nother relevant instruments of the United Nations, \n \nSeriously concerned about all attacks on religious places, sites and shrines that \nviolate international law, in particular international human rights law and \ninternational humanitarian law, including any deliberate destruction of relics and \nmonuments, and including also those carried out in connection with incitement to \nnational, racial or religious hatred, \n \nEmphasizing that States, regional organizations, national human rights \ninstitutions, non-governmental organizations, religious bodies, the media and civil \nsociety as a whole have an important role to play in promoting tolerance and respect \nfor religious and cultural diversity and in the universal promotion and protection of \nhuman rights, including freedom of religion or belief, \n__________________ \n \n4  A/HRC/22/17/Add.4, appendix. \n\nA/C.3/80/L.28\n \n3/6\n25-17790 \n \n \nUnderlining the importance of education, including human rights education, in \nthe promotion of tolerance, which involves the acceptance by the public of and its \nrespect for diversity, including with regard to religious expression, and underlining also \nthe fact that education, in particular at school, should contribute in a meaningful way \nto promoting tolerance and the elimination of discrimination based on religion or belief, \n \n1. \nStresses that everyone has the right to freedom of thought, conscience and \nreligion or belief, which includes the freedom to have or not to have, or to adopt, a \nreligion or belief of one\u2019s own choice and the freedom, either alone or in community \nwith others and in public or private, to manifest one\u2019s religion or belief in teaching, \npractice, worship and observance, including the right to change one\u2019s religion or belief; \n \n2. \nEmphasizes that the right to freedom of thought, conscience and religion \nor belief applies equally to all persons, regardless of their religion or belief and \nwithout any discrimination as to their equal protection by the law; \n \n3. \nStrongly condemns violations of freedom of thought, conscience and \nreligion or belief, as well as all forms of intolerance, discrimination and violence \nbased on religion or belief; \n \n4. \nRecognizes with deep concern the overall rise in instances of \ndiscrimination, intolerance and violence, regardless of the actors, directed against \nmembers of many religious and other communities in various parts of the world, \nincluding cases motivated by Islamophobia, antisemitism and Christianophobia and \nprejudices against persons of other religions or beliefs; \n \n5. \nReaffirms that terrorism cannot and should not be associated with any \nreligion or belief, as this may have adverse consequences for the enjoyment of the \nright to freedom of religion or belief of all members of the religious communities \nconcerned; \n \n6. \nStrongly condemns continuing violence and acts of terrorism targeting \nindividuals, including persons belonging to religious minorities, on the basis of or in \nthe name of religion or belief, and underlines the importance of a comprehensive and \ninclusive community-based preventive approach, involving a wide set of actors, \nincluding civil society and religious communities; \n \n7. \nRecalls that States have an obligation to exercise due diligence to prevent, \ninvestigate and punish acts of violence, intimidation and harassment against a person \nor a group of persons belonging to a religious minority, regardless of the perpetrator, \nand that failure to do so may constitute a human rights violation; \n \n8. \nEmphasizes that freedom of religion or belief, freedom of opinion and \nexpression, the right to peaceful assembly and the right to freedom of association are \ninterdependent, interrelated and mutually reinforcing, and stresses the role that these \nrights can play in the fight against all forms of intolerance and of discrimination based \non religion or belief; \n \n9. \nStrongly condemns any advocacy of hatred based on religion or belief that \nconstitutes incitement to discrimination, hostility or violence, whether it involves the \nuse of print, audiovisual or electronic media or any other means; \n \n10. Expresses concern at the persistence of institutionalized social intolerance \nand discrimination practised against many on the grounds of religion or belief, and \nemphasizes that legal procedures pertaining to religious or belief-based groups and \nplaces of worship are not a prerequisite for the exercise of the right to manifest one\u2019s \nreligion or belief and that such procedures, when legally required at the national or \nlocal level, should be non-discriminatory in order to contribute to the effective \n\nA/C.3/80/L.28 \n \n25-17790\n4/6 \n \nprotection of the right of all persons to practise their religion or belief, either \nindividually or in community with others and in public or private; \n \n11. \nRecognizes with concern the challenges that persons in vulnerable \nsituations, including persons deprived of their liberty, refugees, asylum-seekers and \ninternally displaced persons, children, persons belonging to national or ethnic, \nreligious and linguistic minorities and migrants, as well as women, are facing as \nregards their ability to freely exercise their right to freedom of religion or belief; \n \n12. Emphasizes that, as underlined by the Human Rights Committee, \nrestrictions on the freedom to manifest one\u2019s religion or belief are permitted only if \nlimitations are prescribed by law, are necessary to protect public safety, order, health \nor morals or the fundamental rights and freedoms of others, are non-discriminatory \nand are applied in a manner that does not vitiate the right to freedom of thought, \nconscience and religion or belief; \n \n13. Expresses deep concern at continued obstacles to the enjoyment of the \nright to freedom of religion or belief, as well as the increasing number of instances of \nintolerance, discrimination and violence based on religion or belief, including: \n \n(a) \nActs of violence and intolerance directed against individuals based on their \nreligion or belief, including religious persons and persons belonging to religious \nminorities and other communities in various parts of the world; \n \n(b) \nThe rise of religious extremism in various parts of the world that affects \nthe human rights of individuals, including persons belonging to religious minorities; \n \n(c) \nIncidents of hatred, discrimination, intolerance and violence based on \nreligion or belief, which may be associated with or manifested by the derogatory \nstereotyping, negative profiling and stigmatization of persons based on their religion \nor belief; \n \n(d) \nAttacks on or the destruction of religious places, sites and shrines that \nviolate international law, in particular international human rights law and \ninternational humanitarian law, as they have more than material significance for the \ndignity and lives of persons holding spiritual or religious beliefs; \n \n(e) \nInstances, both in law and practice, that constitute violations of the human \nright to freedom of religion or belief, including of the individual right to publicly \nexpress one\u2019s spiritual and religious beliefs, taking into account the relevant articles \nof the International Covenant on Civil and Political Rights, as well as other \ninternational instruments; \n \n(f) \nConstitutional and legislative systems that fail to provide adequate and \neffective guarantees of freedom of thought, conscience and religion or belief to all \nwithout distinction; \n \n14. Urges States to step up their efforts to protect and promote freedom of \nthought, conscience and religion or belief, and to that end: \n \n(a) \nTo ensure that their constitutional and legislative systems provide adequate \nand effective guarantees of freedom of thought, conscience and religion or belief to \nall without distinction by, inter alia, providing access to justice, including by \nfacilitating legal assistance and effective remedies in cases where the right to freedom \nof thought, conscience and religion or belief or the right to freely choose and practise \none\u2019s religion or belief is violated, paying particular attention to persons belonging to \nreligious minorities; \n \n(b) \nTo implement all accepted universal periodic review recommendations \nrelated to the promotion and protection of freedom of religion or belief; \n\nA/C.3/80/L.28\n \n5/6\n25-17790 \n \n \n(c) \nTo ensure that no one within their territory and subject to their jurisdiction \nis deprived of the right to life, liberty and security of person because of religion or \nbelief, to provide adequate protection to persons at risk of violent attack on the \ngrounds of their religion or belief, to ensure that no one is subjected to torture or other \ncruel, inhuman or degrading treatment or punishment or arbitrary arrest or detention \non that account and to bring to justice all perpetrators of violations of these rights; \n \n(d) \nTo end violations of the human rights of women and girls and to devote \nparticular attention to appropriate measures modifying or abolishing existing laws, \nregulations, customs and practices that discriminate against them, including in the \nexercise of their right to freedom of thought, conscience and religion or belief, and to \nfoster practical ways to ensure gender equality; \n \n(e) \nTo ensure that existing legislation is not implemented in a discriminatory \nmanner or does not result in discrimination based on religion or belief, that no one is \ndiscriminated against on the basis of his or her religion or belief when accessing, inter \nalia, education, medical care, employment, humanitarian assistance or social benefits, \nand that everyone has the right and the opportunity to have access, on general terms \nof equality, to public services in their country, without any discrimination based on \nreligion or belief; \n \n(f) \nTo review, whenever relevant, existing registration practices in order to \nensure that such practices do not limit the right of all persons to manifest their religion \nor belief, either alone or in community with others and in public or private; \n \n(g) \nTo ensure that no official documents are withheld from the individual on \nthe grounds of religion or belief and that everyone has the right to refrain from \ndisclosing information concerning their religious affiliation in such documents \nagainst their will; \n \n(h) \nTo ensure, in particular, the right of all persons to worship, assemble or \nteach in connection with a religion or belief, their right to establish and maintain \nplaces for these purposes and the right of all persons to seek, receive and impart \ninformation and ideas in these areas; \n \n(i) \nTo ensure that, in accordance with appropriate national legislation and in \nconformity with international human rights law, the freedom of all persons and \nmembers of groups to establish and maintain religious, charitable or humanitarian \ninstitutions is fully respected and protected; \n \n(j) \nTo ensure that all public officials and civil servants, including members of \nlaw enforcement bodies, and personnel of detention facilities, the military and \neducators, in the course of fulfilling their official duties, respect freedom of religion \nor belief and do not discriminate for reasons based on religion or belief, and that they \nreceive all necessary and appropriate awareness-raising, education or training on \nrespect for freedom of religion or belief; \n \n(k) \nTo take all necessary and appropriate action, in conformity with \ninternational standards of human rights, to combat hatred, discrimination, intolerance \nand acts of violence, intimidation and coercion motivated by intolerance based on \nreligion or belief, as well as incitement to hostility and violence, with particular \nregard to persons belonging to religious minorities in all parts of the world; \n \n(l) \nTo promote, through education and other means, mutual understanding, \ntolerance, non-discrimination and respect in all matters relating to freedom of religion \nor belief by encouraging, in society at large, a wider knowledge of the diversity of \nreligions and beliefs and of the history, traditions, languages and cultures of the \nvarious religious minorities existing within their jurisdiction; \n\nA/C.3/80/L.28 \n \n25-17790\n6/6 \n \n \n(m) To prevent any distinction, exclusion, restriction or preference based on \nreligion or belief that impairs the recognition, enjoyment or exercise of human rights \nand fundamental freedoms on an equal basis and to detect signs of intolerance that \nmay lead to discrimination based on religion or belief; \n \n15. Welcomes and encourages initiatives by the media to promote tolerance \nand respect for religious and cultural diversity and the universal promotion and \nprotection of human rights, including freedom of religion or belief, and stresses the \nimportance of unhindered participation in the media and in public discourse for all \npersons, regardless of their religion or belief; \n \n16. Stresses the importance of a continued and strengthened dialogue in all its \nforms, including among and within religions or beliefs, and with broader participation, \nincluding of women, to promote greater tolerance, respect and mutual understanding, \nand welcomes different initiatives in this regard, including the United Nations Alliance \nof Civilizations initiative and the programmes led by the United Nations Educational, \nScientific and Cultural Organization; \n \n17. Welcomes and encourages the continuing efforts of all actors in society, \nincluding national human rights institutions, non-governmental organizations and \nbodies and groups based on religion or belief, to promote the implementation of the \nDeclaration on the Elimination of All Forms of Intolerance and of Discrimination \nBased on Religion or Belief,5 and further encourages their work in promoting freedom \nof religion or belief, in highlighting cases of religious intolerance, discrimination and \npersecution and in promoting religious tolerance; \n \n18. Recommends that States, the United Nations and other actors, including \nnational human rights institutions, non-governmental organizations and bodies and \ngroups based on religion or belief, in their efforts to promote freedom of religion or \nbelief, ensure the widest possible dissemination of the text of the Declaration in as \nmany different languages as possible and promote its implementation; \n \n19. Takes note with appreciation of the work and the interim report of the \nSpecial Rapporteur on freedom of religion or belief; 6 \n \n20. Urges all Governments to cooperate fully with the Special Rapporteur, to \nrespond favourably to her requests to visit their countries and to provide all \ninformation and follow-up necessary for the effective fulfilment of her mandate; \n \n21. Requests the Secretary-General to ensure that the Special Rapporteur \nreceives the resources necessary to fully discharge her mandate; \n \n22. Requests the Special Rapporteur to submit an interim report to the General \nAssembly at its eighty-first session; \n \n23. Decides to consider the question of the elimination of all forms of religious \nintolerance at its eighty-first session under the item entitled \u201cPromotion and \nprotection of human rights\u201d. \n \n__________________ \n \n5  Resolution 36/55. \n \n6  See A/80/205 and A/80/205/Corr.1. \n",
  "paragraphs": {
    "1": "Stresses that everyone has the right to freedom of thought, conscience and religion or belief, which includes the freedom to have or not to have, or to adopt, a religion or belief of one\u2019s own choice and the freedom, either alone or in community with others and in public or private, to manifest one\u2019s religion or belief in teaching, practice, worship and observance, including the right to change one\u2019s religion or belief;",
    "2": "Emphasizes that the right to freedom of thought, conscience and religion or belief applies equally to all persons, regardless of their religion or belief and without any discrimination as to their equal protection by the law;",
    "3": "Strongly condemns violations of freedom of thought, conscience and religion or belief, as well as all forms of intolerance, discrimination and violence based on religion or belief;",
    "4": "Recognizes with deep concern the overall rise in instances of discrimination, intolerance and violence, regardless of the actors, directed against members of many religious and other communities in various parts of the world, including cases motivated by Islamophobia, antisemitism and Christianophobia and prejudices against persons of other religions or beliefs;",
    "5": "Reaffirms that terrorism cannot and should not be associated with any religion or belief, as this may have adverse consequences for the enjoyment of the right to freedom of religion or belief of all members of the religious communities concerned;",
    "6": "Strongly condemns continuing violence and acts of terrorism targeting individuals, including persons belonging to religious minorities, on the basis of or in the name of religion or belief, and underlines the importance of a comprehensive and inclusive community-based preventive approach, involving a wide set of actors, including civil society and religious communities;",
    "7": "Recalls that States have an obligation to exercise due diligence to prevent, investigate and punish acts of violence, intimidation and harassment against a person or a group of persons belonging to a religious minority, regardless of the perpetrator, and that failure to do so may constitute a human rights violation;",
    "8": "Emphasizes that freedom of religion or belief, freedom of opinion and expression, the right to peaceful assembly and the right to freedom of association are interdependent, interrelated and mutually reinforcing, and stresses the role that these rights can play in the fight against all forms of intolerance and of discrimination based on religion or belief;",
    "9": "Strongly condemns any advocacy of hatred based on religion or belief that constitutes incitement to discrimination, hostility or violence, whether it involves the use of print, audiovisual or electronic media or any other means;",
    "10": " protection of the right of all persons to practise their religion or belief, either individually or in community with others and in public or private;",
    "11": "Recognizes with concern the challenges that persons in vulnerable situations, including persons deprived of their liberty, refugees, asylum-seekers and internally displaced persons, children, persons belonging to national or ethnic, religious and linguistic minorities and migrants, as well as women, are facing as regards their ability to freely exercise their right to freedom of religion or belief;",
    "12": "Emphasizes that, as underlined by the Human Rights Committee, restrictions on the freedom to manifest one\u2019s religion or belief are permitted only if limitations are prescribed by law, are necessary to protect public safety, order, health or morals or the fundamental rights and freedoms of others, are non-discriminatory and are applied in a manner that does not vitiate the right to freedom of thought, conscience and religion or belief;",
    "13": "Expresses deep concern at continued obstacles to the enjoyment of the right to freedom of religion or belief, as well as the increasing number of instances of intolerance, discrimination and violence based on religion or belief, including: (a) Acts of violence and intolerance directed against individuals based on their religion or belief, including religious persons and persons belonging to religious minorities and other communities in various parts of the world; (b) The rise of religious extremism in various parts of the world that affects the human rights of individuals, including persons belonging to religious minorities; (c) Incidents of hatred, discrimination, intolerance and violence based on religion or belief, which may be associated with or manifested by the derogatory stereotyping, negative profiling and stigmatization of persons based on their religion or belief; (d) Attacks on or the destruction of religious places, sites and shrines that violate international law, in particular international human rights law and international humanitarian law, as they have more than material significance for the dignity and lives of persons holding spiritual or religious beliefs; (e) Instances, both in law and practice, that constitute violations of the human right to freedom of religion or belief, including of the individual right to publicly express one\u2019s spiritual and religious beliefs, taking into account the relevant articles of the International Covenant on Civil and Political Rights, as well as other international instruments; (f) Constitutional and legislative systems that fail to provide adequate and effective guarantees of freedom of thought, conscience and religion or belief to all without distinction;",
    "14": " (c) (m) To prevent any distinction, exclusion, restriction or preference based on religion or belief that impairs the recognition, enjoyment or exercise of human rights and fundamental freedoms on an equal basis and to detect signs of intolerance that may lead to discrimination based on religion or belief;",
    "15": "Welcomes and encourages initiatives by the media to promote tolerance and respect for religious and cultural diversity and the universal promotion and protection of human rights, including freedom of religion or belief, and stresses the importance of unhindered participation in the media and in public discourse for all persons, regardless of their religion or belief;",
    "16": "Stresses the importance of a continued and strengthened dialogue in all its forms, including among and within religions or beliefs, and with broader participation, including of women, to promote greater tolerance, respect and mutual understanding, and welcomes different initiatives in this regard, including the United Nations Alliance of Civilizations initiative and the programmes led by the United Nations Educational, Scientific and Cultural Organization;",
    "17": "Welcomes and encourages the continuing efforts of all actors in society, including national human rights institutions, non-governmental organizations and bodies and groups based on religion or belief, to promote the implementation of the Declaration on the Elimination of All Forms of Intolerance and of Discrimination Based on Religion or Belief,5 and further encourages their work in promoting freedom of religion or belief, in highlighting cases of religious intolerance, discrimination and persecution and in promoting religious tolerance;",
    "18": "Recommends that States, the United Nations and other actors, including national human rights institutions, non-governmental organizations and bodies and groups based on religion or belief, in their efforts to promote freedom of religion or belief, ensure the widest possible dissemination of the text of the Declaration in as many different languages as possible and promote its implementation;",
    "19": "Takes note with appreciation of the work and the interim report of the Special Rapporteur on freedom of religion or belief; 6",
    "20": "Urges all Governments to cooperate fully with the Special Rapporteur, to respond favourably to her requests to visit their countries and to provide all information and follow-up necessary for the effective fulfilment of her mandate;",
    "21": "Requests the Secretary-General to ensure that the Special Rapporteur receives the resources necessary to fully discharge her mandate;",
    "22": "Requests the Special Rapporteur to submit an interim report to the General Assembly at its eighty-first session;",
    "23": "Decides to consider the question of the elimination of all forms of religious intolerance at its eighty-first session under the item entitled \u201cPromotion and protection of human rights\u201d."
  },
  "agenda_items": [
    "Item 71"
  ],
  "symbol_references": [
    "A/C.3/80/L.28"
  ]
}