{
  "symbol": "A/C.4/80/L.2",
  "filename": "A_C.4_80_L.2.pdf",
  "title": "Offers by Member States of study and training facilities for inhabitants of Non-Self-Governing Territories",
  "text": "United Nations \nA/C.4/80/L.2 \n \n \nGeneral Assembly \nDistr.: Limited \n9 October 2025 \nOriginal: English \n \n25-16296 (E)    141025     \n*2516296* \n \n \nEightieth session \nSpecial Political and Decolonization Committee \n(Fourth Committee) \nAgenda item 57 \nOffers by Member States of study and training facilities for \ninhabitants of Non-Self-Governing Territories \n \n \n \n \n \nAustria, Cuba, Guatemala, Hungary and Venezuela (Bolivarian Republic of): \ndraft resolution \n \n \n \n Offers by Member States of study and training facilities for \ninhabitants of Non-Self-Governing Territories \n \n \n \nThe General Assembly, \n \nRecalling its resolution 79/97 of 4 December 2024, \n \nHaving examined the report of the Secretary-General,1 prepared pursuant to its \nresolution 845 (IX) of 22 November 1954, \n \nConscious of the importance of promoting the educational advancement of the \ninhabitants of Non-Self-Governing Territories, \n \nStrongly convinced that the continuation and expansion of offers of scholarships \nis essential in order to meet the increasing need of students from Non-Self-Governing \nTerritories for educational and training assistance, and considering that students in \nthose Territories should be encouraged to avail themselves of such offers, \n \n1. \nTakes note of the report of the Secretary-General; \n \n2. \nExpresses its appreciation to those Member States that have made \nscholarships available to the inhabitants of Non-Self-Governing Territories; \n \n3. \nInvites all States to make or continue to make generous offers of study and \ntraining facilities to the inhabitants of those Territories that have not yet attained self-\ngovernment or independence and, wherever possible, to provide travel funds to \nprospective students; \n \n4. \nUrges the administering Powers to take effective measures to ensure the \nwidespread and continuous dissemination in the Territories under their administration \nof information relating to offers of study and training facilities made by States and to \n__________________ \n \n1  A/80/71. \n\nA/C.4/80/L.2 \n \n25-16296\n2/2 \n \nprovide all the facilities necessary to enable students to avail themselves of such \noffers; \n \n5. \nRequests the Secretary-General to report to the General Assembly at its \neighty-first session on the implementation of the present resolution; \n \n6. \nDraws the attention of the Special Committee on the Situation with regard \nto the Implementation of the Declaration on the Granting of Independence to Colonial \nCountries and Peoples to the present resolution. \n \n",
  "paragraphs": {
    "1": "Takes note of the report of the Secretary-General;",
    "2": "Expresses its appreciation to those Member States that have made scholarships available to the inhabitants of Non-Self-Governing Territories;",
    "3": "Invites all States to make or continue to make generous offers of study and training facilities to the inhabitants of those Territories that have not yet attained self- government or independence and, wherever possible, to provide travel funds to prospective students;",
    "4": "Urges the administering Powers to take effective measures to ensure the widespread and continuous dissemination in the Territories under their administration of information relating to offers of study and training facilities made by States and to provide all the facilities necessary to enable students to avail themselves of such offers;",
    "5": "Requests the Secretary-General to report to the General Assembly at its eighty-first session on the implementation of the present resolution;",
    "6": "Draws the attention of the Special Committee on the Situation with regard to the Implementation of the Declaration on the Granting of Independence to Colonial Countries and Peoples to the present resolution."
  },
  "agenda_items": [
    "Item 57"
  ],
  "symbol_references": [
    "A/C.4/80/L.2"
  ]
}