{
  "symbol": "A/C.3/80/L.36",
  "filename": "A_C.3_80_L.36.pdf",
  "title": "Human rights and cultural diversity",
  "text": "United Nations \nA/C.3/80/L.36\n \n \nGeneral Assembly \nDistr.: Limited \n4 November 2025 \nOriginal: English \n \n25-17771 (E)    111125     \n*2517771* \n \n \nEightieth session \nThird Committee \nAgenda item 71 (b) \nPromotion and protection of human rights: human \nrights questions, including alternative approaches for \nimproving the effective enjoyment of human rights and \nfundamental freedoms \n \n \n \n \n \nCuba:* draft resolution \n \n \n \n Human rights and cultural diversity \n \n \n \nThe General Assembly, \n \nRecalling the Universal Declaration of Human Rights, 1  the International \nCovenant on Economic, Social and Cultural Rights2 and the International Covenant \non Civil and Political Rights,3 as well as other pertinent human rights instruments,  \n \nRecalling also its resolutions 54/160 of 17 December 1999, 55/91 of \n4 December 2000, 57/204 of 18 December 2002, 58/167 of 22 December 2003, 60/167 \nof 16 December 2005, 62/155 of 18 December 2007, 64/174 of 18 December 2009, \n66/154 of 19 December 2011, 68/159 of 18 December 2013, 70/156 of 17 December \n2015, 72/170 of 19 December 2017, 74/159 of 18 December 2019, 76/162 of \n16 December 2021 and 78/201 of 19 December 2023, and recalling further its \nresolutions 54/113 of 10 December 1999, 55/23 of 13 November 2000 and 60/4 of \n20 October 2005 concerning the United Nations Year of Dialogue among Civilizations, \nand its resolution 78/286 of 7 June 2024 declaring 10 June as the International Day for \nDialogue among Civilizations,  \n \nNoting that numerous instruments within the United Nations system promote \ncultural diversity, as well as the conservation and development of culture, in particular \nthe Declaration of the Principles of International Culture Cooperation proclaimed on \n4 November 1966 by the General Conference of the United Nations Educational, \nScientific and Cultural Organization at its fourteenth session, 4  \n \nTaking note of the report of the Secretary-General,5  \n__________________ \n \n* On behalf of the States that are members of the Movement of Non-Aligned Countries, taking \ninto account also the provisions of General Assembly resolution ES-10/23 of 10 May 2024. \n \n1 Resolution 217 A (III). \n \n2 See resolution 2200 A (XXI), annex. \n \n3 Ibid. \n \n4 See United Nations Educational, Scientific and Cultural Organization, Records of the General \nConference, Fourteenth Session, Paris, 1966, Resolutions. \n \n5 A/80/352. \n\nA/C.3/80/L.36 \n \n25-17771\n2/5 \n \n \nRecalling that, as stated in the Declaration on Principles of International Law \nconcerning Friendly Relations and Cooperation among States in accordance with the \nCharter of the United Nations, contained in the annex to its resolution 2625 (XXV) \nof 24 October 1970, States have the duty to cooperate with one another, irrespective \nof the differences in their political, economic and social systems, in the various \nspheres of international relations, in the promotion of universal respect for and \nobservance of human rights and fundamental freedoms for all, and in the elimination \nof all forms of racial discrimination and all forms of religious intolerance,  \n \nRecalling also the adoption, by its resolution 56/6 of 9 November 2001, of the \nGlobal Agenda for Dialogue among Civilizations,  \n \nRecalling further the contribution of the World Conference against Racism, \nRacial Discrimination, Xenophobia and Related Intolerance, held in Durban, South \nAfrica, from 31 August to 8 September 2001, the Durban Review Conference, held in \nGeneva from 20 to 24 April 2009, and the high-level meetings of the General \nAssembly to commemorate the tenth and twentieth anniversaries of the adoption of \nthe Durban Declaration and Programme of Action, 6 held on 22 September 2011 and \n2021, respectively, to the promotion of respect for cultural diversity,  \n \nRecalling the Universal Declaration on Cultural Diversity of the United Nations \nEducational, Scientific and Cultural Organization, 7 together with its Action Plan, 8 \nadopted on 2 November 2001 by the General Conference of the United Nations \nEducational, Scientific and Cultural Organization at its thirty-first session, in which \nmember States invited the United Nations system and other intergovernmental and \nnon-governmental organizations concerned to cooperate with the United Nations \nEducational, Scientific and Cultural Organization in the promotion of the principles \nset forth in the Declaration and its Action Plan, with a view to enhancing the synergy \nof actions in favour of cultural diversity,  \n \nRecalling also the Ministerial Meeting on Human Rights and Cultural Diversity \nof the Movement of Non-Aligned Countries, held in Tehran on 3 and 4 September \n2007,  \n \nReaffirming that all human rights are universal, indivisible, interdependent and \ninterrelated and that the international community must treat human rights globally in \na fair and equal manner, on the same footing and with the same emphasis, and that, \nwhile the significance of national and regional particularities and various historical, \ncultural and religious backgrounds must be borne in mind, it is the duty of States, \nregardless of their political, economic and cultural systems, to promote and protect \nall human rights and fundamental freedoms for all,  \n \nExpressing concern over the adverse impacts of lack of respect for and \nrecognition of cultural diversity on human rights, justice, friendship and the \nfundamental right to development,  \n \nRecognizing that cultural diversity and the pursuit of cultural development by \nall peoples and nations are a source of mutual enrichment for the cultural life of \nhumankind,  \n \nRecognizing also the contribution that diverse cultures have been making to the \ndevelopment and promotion of all human rights and fundamental freedoms for all,  \n__________________ \n \n6 See A/CONF.189/12 and A/CONF.189/12/Corr.1, chap. I. \n \n7 United Nations Educational, Scientific and Cultural Organization, Records of the General \nConference, Thirty-first Session, Paris, 15 October\u20133 November 2001, vol. 1 and corrigendum, \nResolutions, sect. V, resolution 25, annex I. \n \n8 Ibid., annex II. \n\nA/C.3/80/L.36\n \n3/5\n25-17771 \n \n \nTaking into account that a culture of peace actively fosters non-violence and \nrespect for human rights and strengthens solidarity among peoples and nations and \ndialogue between cultures, and in that regard recalling its resolutions adopted under \nthe agenda item entitled \u201cCulture of peace\u201d, \n \nReaffirming that discriminatory treatment against different cultures and \nreligions is detrimental to the principle of the equality of human beings,  \n \nRecognizing that all cultures and civilizations share a common set of universal \nvalues,  \n \nRecognizing also that the promotion of the rights of Indigenous Peoples and \ntheir cultures and traditions contribute to the respect for and observance of cultural \ndiversity among all peoples and nations,  \n \nConsidering that tolerance of cultural, ethnic, religious and linguistic \ndiversities, as well as dialogue among and within civilizations, is essential for peace, \nunderstanding and friendship among individuals and people of different cultures and \nnations of the world, while manifestations of cultural prejudice, intolerance and \nxenophobia towards different cultures and religions generate hatred, violence and \nextremism among peoples and nations throughout the world,  \n \nRecognizing in each culture a dignity and value that deserve recognition, respect \nand preservation, and convinced that, in their rich variety and diversity, and in the \nreciprocal influences that they exert on one another, all cultures form part of the \ncommon heritage belonging to all humankind,  \n \nConvinced that the promotion of cultural pluralism and tolerance towards and \ndialogue among various cultures and civilizations would contribute to the efforts of \nall peoples and nations to enrich their cultures and traditions by engaging in a \nmutually beneficial exchange of knowledge and intellectual, moral and material \nachievements,  \n \nAcknowledging the diversity of the world, recognizing that all cultures and \ncivilizations contribute to the enrichment of humankind, acknowledging the \nimportance of respect and understanding for religious and cultural diversity \nthroughout the world, and, in order to promote international peace and security, \ncommitting itself to advancing human welfare, freedom and progress everywhere, as \nwell as to encouraging tolerance, respect, dialogue and cooperation among different \ncultures, civilizations and peoples,  \n \n1. \nAffirms the importance for all peoples and nations to hold, develop and \npreserve their cultural heritage and traditions in a national and international \natmosphere of peace, tolerance and mutual respect;  \n \n2. \nEmphasizes the important contribution of culture to development and the \nachievement of national development objectives and internationally agreed \ndevelopment goals, including the Sustainable Development Goals;  \n \n3. \nRecalls that, as expressed in the Universal Declaration on Cultural \nDiversity, no one may invoke cultural diversity to infringe upon human rights \nguaranteed by international law, or to limit their scope;  \n \n4. \nAlso recalls the adoption of the 2030 Agenda for Sustainable \nDevelopment, 9  in which Member States acknowledged the natural and cultural \ndiversity of the world and recognized that all cultures and civilizations can contribute \nto, and are crucial enablers of, sustainable development;  \n__________________ \n \n9 Resolution 70/1. \n\nA/C.3/80/L.36 \n \n25-17771\n4/5 \n \n \n5. \nRecognizes the importance given to cultural diversity in the 2030 Agenda \nfor Sustainable Development, including in Sustainable Development Goal 4, related \nto ensuring inclusive and equitable quality education and promoting lifelong learning \nopportunities for all;  \n \n6. \nAlso recognizes the right of everyone to take part in cultural life and to \nenjoy the benefits of scientific progress and its applications;  \n \n7. \nAffirms that the international community should strive to respond to the \nchallenges and opportunities posed by globalization in a manner that ensures respect \nfor the cultural diversity of all;  \n \n8. \nExpresses \nits \ndetermination \nto \nprevent \nand \nmitigate \ncultural \nhomogenization in the context of globalization, through increased intercultural \nexchange guided by the promotion and protection of cultural diversity;  \n \n9. \nAffirms that intercultural dialogue essentially enriches the common \nunderstanding of human rights and that the benefits to be derived from the \nencouragement and development of international contacts and cooperation in the \ncultural fields are important;  \n \n10. Recalls the recognition at the World Conference against Racism, Racial \nDiscrimination, Xenophobia and Related Intolerance of the necessity of respecting \nand maximizing the benefits of diversity within and among all nations in working \ntogether to build a harmonious and productive future by putting into practice and \npromoting values and principles such as justice, equality and non-discrimination, \ndemocracy, fairness and friendship, tolerance and respect within and among \ncommunities and nations, in particular through public information and educational \nprogrammes to raise awareness and understanding of the benefits of cultural diversity, \nincluding programmes in which the public authorities work in partnership with \ninternational and non-governmental organizations and other sectors of civil society;  \n \n11. \nEmphasizes that dialogue among religions, cultures and civilizations on \nthe basis of equal dignity should be enhanced, through supporting efforts made at the \ninternational level towards reducing confrontation, suppressing xenophobia and \npromoting respect for diversity, and in that regard also emphasizes that States should \noppose all attempts at uniculturalism or the imposition of particular models of social \nor cultural systems and promote dialogue among civilizations, a culture of peace, \ntolerance and interfaith dialogue, which will contribute towards peace, security and \ndevelopment;  \n \n12. Welcomes the activities of the Non-Aligned Movement Centre for Human \nRights and Cultural Diversity in Tehran, and acknowledges the important role that the \nCentre plays in the promotion of the universality of all human rights, as well as their \nrealization;  \n \n13. Recognizes that respect for cultural diversity and the cultural rights of all \nenhances cultural pluralism, contributing to a wider exchange of knowledge and \nunderstanding of cultural background, advancing the application and enjoyment of \nuniversally accepted human rights throughout the world and fostering stable, friendly \nrelations among peoples and nations worldwide;  \n \n14. Emphasizes that the promotion of cultural pluralism and tolerance at the \nnational, regional and international levels is important for enhancing respect for \ncultural rights and cultural diversity;  \n \n15. Also emphasizes that tolerance and respect for diversity facilitate the \nuniversal promotion and protection of human rights, including gender equality and \nthe enjoyment of all human rights by all, and underlines the fact that tolerance and \n\nA/C.3/80/L.36\n \n5/5\n25-17771 \n \nrespect for cultural diversity and the universal promotion and protection of human \nrights are mutually supportive;  \n \n16. Urges all actors on the international scene to build an international order \nbased on inclusion, justice, equality and equity, human dignity, mutual understanding \nand promotion of and respect for cultural diversity and universal human rights, and \nto reject all doctrines of exclusion based on racism, racial discrimination, xenophobia \nand related intolerance;  \n \n17. Calls upon States, relevant international organizations and non-governmental \norganizations to support and embark on intercultural initiatives on human rights in \norder to promote all human rights, thereby enriching their universality;  \n \n18. Urges States to ensure that their political and legal systems reflect the \nmulticultural diversity within their societies and, where necessary, to improve \ndemocratic institutions so that they are more fully participatory and avoid \nmarginalization and exclusion of, and discrimination against, specific sectors of \nsociety;  \n \n19. Calls upon States, international organizations and United Nations \nagencies, and invites civil society, including non-governmental organizations, to \nrecognize and promote respect for cultural diversity for the purpose of advancing the \nobjectives of peace, development and universally accepted human rights;  \n \n20. Stresses the necessity of freely using the media and new information and \ncommunications technologies to create the conditions for a renewed dialogue among \ncultures and civilizations;  \n \n21. Requests the Office of the United Nations High Commissioner for Human \nRights to continue to bear in mind fully the issues raised in the present resolution in \nthe course of its activities for the promotion and protection of human rights;  \n \n22. Also requests the Office of the High Commissioner, and invites the United \nNations Educational, Scientific and Cultural Organization, to support initiatives \naimed at promoting intercultural dialogue on human rights;  \n \n23. Urges relevant international organizations to conduct studies on how \nrespect for cultural diversity contributes to fostering international solidarity and \ncooperation among all nations;  \n \n24. Requests the Secretary-General to prepare a report on the implementation \nof the present resolution, including efforts undertaken at the national, regional and \ninternational levels regarding the recognition and importance of cultural diversity \namong all peoples and nations in the world and taking into account the views of \nMember States, relevant United Nations agencies and non-governmental organizations, \nand to submit the report to the General Assembly at its eighty-second session;  \n \n25. Decides to continue consideration of the question at its eighty-second \nsession under the sub-item entitled \u201cHuman rights questions, including alternative \napproaches for improving the effective enjoyment of human rights and fundamental \nfreedoms\u201d of the item entitled \u201cPromotion and protection of human rights\u201d. \n \n",
  "paragraphs": {
    "1": "Affirms the importance for all peoples and nations to hold, develop and preserve their cultural heritage and traditions in a national and international atmosphere of peace, tolerance and mutual respect;",
    "2": "Emphasizes the important contribution of culture to development and the achievement of national development objectives and internationally agreed development goals, including the Sustainable Development Goals;",
    "3": "Recalls that, as expressed in the Universal Declaration on Cultural Diversity, no one may invoke cultural diversity to infringe upon human rights guaranteed by international law, or to limit their scope;",
    "4": "Also recalls the adoption of the 2030 Agenda for Sustainable Development, 9 in which Member States acknowledged the natural and cultural diversity of the world and recognized that all cultures and civilizations can contribute to, and are crucial enablers of, sustainable development; __________________ 9 Resolution 70/1. A/C.3/80/L.36 25-17771 4/5",
    "5": "Recognizes the importance given to cultural diversity in the 2030 Agenda for Sustainable Development, including in Sustainable Development Goal 4, related to ensuring inclusive and equitable quality education and promoting lifelong learning opportunities for all;",
    "6": "Also recognizes the right of everyone to take part in cultural life and to enjoy the benefits of scientific progress and its applications;",
    "7": "Affirms that the international community should strive to respond to the challenges and opportunities posed by globalization in a manner that ensures respect for the cultural diversity of all;",
    "8": "Expresses its determination to prevent and mitigate cultural homogenization in the context of globalization, through increased intercultural exchange guided by the promotion and protection of cultural diversity;",
    "9": "Affirms that intercultural dialogue essentially enriches the common understanding of human rights and that the benefits to be derived from the encouragement and development of international contacts and cooperation in the cultural fields are important;",
    "10": "Recalls the recognition at the World Conference against Racism, Racial Discrimination, Xenophobia and Related Intolerance of the necessity of respecting and maximizing the benefits of diversity within and among all nations in working together to build a harmonious and productive future by putting into practice and promoting values and principles such as justice, equality and non-discrimination, democracy, fairness and friendship, tolerance and respect within and among communities and nations, in particular through public information and educational programmes to raise awareness and understanding of the benefits of cultural diversity, including programmes in which the public authorities work in partnership with international and non-governmental organizations and other sectors of civil society;",
    "11": "Emphasizes that dialogue among religions, cultures and civilizations on the basis of equal dignity should be enhanced, through supporting efforts made at the international level towards reducing confrontation, suppressing xenophobia and promoting respect for diversity, and in that regard also emphasizes that States should oppose all attempts at uniculturalism or the imposition of particular models of social or cultural systems and promote dialogue among civilizations, a culture of peace, tolerance and interfaith dialogue, which will contribute towards peace, security and development;",
    "12": "Welcomes the activities of the Non-Aligned Movement Centre for Human Rights and Cultural Diversity in Tehran, and acknowledges the important role that the Centre plays in the promotion of the universality of all human rights, as well as their realization;",
    "13": "Recognizes that respect for cultural diversity and the cultural rights of all enhances cultural pluralism, contributing to a wider exchange of knowledge and understanding of cultural background, advancing the application and enjoyment of universally accepted human rights throughout the world and fostering stable, friendly relations among peoples and nations worldwide;",
    "14": "Emphasizes that the promotion of cultural pluralism and tolerance at the national, regional and international levels is important for enhancing respect for cultural rights and cultural diversity;",
    "15": "Also emphasizes that tolerance and respect for diversity facilitate the universal promotion and protection of human rights, including gender equality and the enjoyment of all human rights by all, and underlines the fact that tolerance and A/C.3/80/L.36 5/5 25-17771 respect for cultural diversity and the universal promotion and protection of human rights are mutually supportive;",
    "16": "Urges all actors on the international scene to build an international order based on inclusion, justice, equality and equity, human dignity, mutual understanding and promotion of and respect for cultural diversity and universal human rights, and to reject all doctrines of exclusion based on racism, racial discrimination, xenophobia and related intolerance;",
    "17": "Calls upon States, relevant international organizations and non-governmental organizations to support and embark on intercultural initiatives on human rights in order to promote all human rights, thereby enriching their universality;",
    "18": "Urges States to ensure that their political and legal systems reflect the multicultural diversity within their societies and, where necessary, to improve democratic institutions so that they are more fully participatory and avoid marginalization and exclusion of, and discrimination against, specific sectors of society;",
    "19": "Calls upon States, international organizations and United Nations agencies, and invites civil society, including non-governmental organizations, to recognize and promote respect for cultural diversity for the purpose of advancing the objectives of peace, development and universally accepted human rights;",
    "20": "Stresses the necessity of freely using the media and new information and communications technologies to create the conditions for a renewed dialogue among cultures and civilizations;",
    "21": "Requests the Office of the United Nations High Commissioner for Human Rights to continue to bear in mind fully the issues raised in the present resolution in the course of its activities for the promotion and protection of human rights;",
    "22": "Also requests the Office of the High Commissioner, and invites the United Nations Educational, Scientific and Cultural Organization, to support initiatives aimed at promoting intercultural dialogue on human rights;",
    "23": "Urges relevant international organizations to conduct studies on how respect for cultural diversity contributes to fostering international solidarity and cooperation among all nations;",
    "24": "Requests the Secretary-General to prepare a report on the implementation of the present resolution, including efforts undertaken at the national, regional and international levels regarding the recognition and importance of cultural diversity among all peoples and nations in the world and taking into account the views of Member States, relevant United Nations agencies and non-governmental organizations, and to submit the report to the General Assembly at its eighty-second session;",
    "25": "Decides to continue consideration of the question at its eighty-second session under the sub-item entitled \u201cHuman rights questions, including alternative approaches for improving the effective enjoyment of human rights and fundamental freedoms\u201d of the item entitled \u201cPromotion and protection of human rights\u201d."
  },
  "agenda_items": [
    "Item 71"
  ],
  "symbol_references": [
    "A/C.3/80/L.36"
  ]
}