{
  "symbol": "A/C.2/80/L.9",
  "filename": "A_C.2_80_L.9.pdf",
  "title": "Follow-up to and implementation of the outcomes of the International Conferences on Financing for Development",
  "text": "United Nations \nA/C.2/80/L.9 \n \n \nGeneral Assembly \nDistr.: Limited \n13 October 2025 \nOriginal: English \n \n25-16547 (E)    171025 \n*2516547* \n \n \nEightieth session \nSecond Committee \nAgenda item 17 \nFollow-up to and implementation of the outcomes of the \nInternational Conferences on Financing for Development \n \n \n \n \n \nIraq:* draft resolution \n \n \n \n Follow-up to and implementation of the outcomes of the \nInternational Conferences on Financing for Development \n \n \n \nThe General Assembly, \n \nWelcoming the convening of the Fourth International Conference on Financing \nfor Development from 30 June to 3 July 2025 in Sevilla, Spain, and reaffirming its \noutcome document, the Sevilla Commitment, endorsed by the General Assembly in \nits resolution 79/323 of 25 August 2025, which sets forth a renewed global framework \nfor financing for development, building on the 2015 Addis Ababa Action Agenda, 1 to \nclose with urgency the estimated annual 4 trillion dollar financing gap, and catalyse \nsustainable investments at scale in developing countries and reform the international \nfinancial architecture through continued and strong commitment to multilateralism, \ninternational cooperation, and global solidarity,  \n \nRecalling its resolution 79/199 of 19 December 2024 and all previous \nresolutions 2  on the follow-up to and implementation of the outcomes of the \nInternational Conferences on Financing for Development and its resolution 70/299 of \n29 July 2016 on the follow-up and review of the 2030 Agenda for Sustainable \nDevelopment at the global level,  \n \nReaffirming its resolution 69/313 of 27 July 2015 on the Addis Ababa Action \nAgenda of the Third International Conference on Financing for Development, which \nis an integral part of the 2030 Agenda for Sustainable Development, 3 supports and \ncomplements it, helps to contextualize its means of implementation targets with \nconcrete policies and actions, and reaffirms the strong political commitment to \n__________________ \n \n* On behalf of the States that are members of the Group of 77 and China, taking into account also \nthe provisions of General Assembly resolution ES-10/23 of 10 May 2024. \n \n1  General Assembly resolution 69/313, annex. \n \n2  Resolutions 70/192, 71/217, 72/208, 73/223, 74/207, 75/208, 76/198, 77/156 and 78/231. \n \n3  Resolutions 70/1. \n\nA/C.2/80/L.9 \n \n25-16547\n2/4 \n \naddress the challenge of financing and creating an enabling environment at all levels \nfor sustainable development in the spirit of global partnership and solidarity,  \n \nRecalling the International Conference on Financing for Development, held in \nMonterrey, Mexico, from 18 to 22 March 2002, the Follow-up International \nConference on Financing for Development to Review the Implementation of the \nMonterrey Consensus, held in Doha from 29 November to 2 December 2008, and the \nThird International Conference on Financing for Development, held in Addis Ababa \nfrom 13 to 16 July 2015,  \n \nReaffirming its resolution 70/1 of 25 September 2015, entitled \u201cTransforming \nour world: the 2030 Agenda for Sustainable Development\u201d, in which it adopted a \ncomprehensive, far-reaching and people-centred set of universal and transformative \nSustainable Development Goals and targets, its commitment to working tirelessly for \nthe full implementation of the Agenda by 2030, its recognition that eradicating \npoverty in all its forms and dimensions, including extreme poverty, is the greatest \nglobal challenge and an indispensable requirement for sustainable development, its \ncommitment to achieving sustainable development in its three dimensions \u2013 \neconomic, social and environmental \u2013 in a balanced and integrated manner, and to \nbuilding upon the achievements of the Millennium Development Goals and seeking \nto address their unfinished business,  \n \nReaffirming also the Paris Agreement 4  and its early entry into force, \nencouraging all its Parties to fully implement the Agreement, and Parties to the United \nNations Framework Convention on Climate Change5 that have not yet done so to \ndeposit their instruments of ratification, acceptance, approval or accession, where \nappropriate, as soon as possible,  \n \nReaffirming further all the principles of the Rio Declaration on Environment \nand Development,6 including, inter alia, the principle of common but differentiated \nresponsibilities, as set out in principle 7 thereof,  \n \nReiterating the affirmation in the Sevilla Commitment that achieving gender \nequality, empowering all women and girls and attaining the full realization of their \nhuman rights are essential to achieving sustained, inclusive and equitable economic \ngrowth and sustainable development, \n \nReaffirming the importance of addressing the diverse needs of and challenges \nfaced by countries in special situations, in particular African countries, the least \ndeveloped countries, landlocked developing countries and small island developing \nStates and countries in conflict and post-conflict situations, as well as the specific \nchallenges faced by middle-income countries,  \n \nExpressing concern that progress in achieving sustainable development in its \neconomic, social and environmental dimensions is severely off track,  \n \nTaking note of the convening of the ninth annual retreat of the Group of Friends \nof Monterrey to exchange informal views on financing for development issues,  \n \nWelcoming the convening of the Economic and Social Council forum on \nfinancing for development follow-up, held on 28 and 29 April 2025,  \n \nReiterating the pledge that no one will be left behind, reaffirming the \nrecognition that the dignity of the human person is fundamental, and the wish to see \n__________________ \n \n4  Adopted under the UNFCCC in FCCC/CP/2015/10/Add.1, decision 1/CP.21. \n \n5  United Nations, Treaty Series, vol. 1771, No. 30822. \n \n6  Report of the United Nations Conference on Environment and Development, Rio de Janeiro, \n3-14 June 1992, vol. I, Resolutions Adopted by the Conference (United Nations publication, \nSales No. E.93.I.8 and corrigendum), resolution 1, annex I. \n\nA/C.2/80/L.9\n \n3/4\n25-16547 \n \nthe Goals and targets met for all nations and peoples and for all segments of society, \nand recommitting to endeavour to reach the furthest behind first,  \n \nRecommitting to ensuring that no country or person is left behind and to focusing \nour effort where the challenges are greatest, including by ensuring the inclusion and \nparticipation of those who are furthest behind,  \n \nWelcoming the convening of the Summit of the Future on 22\u201323 September 2024 \nat the United Nations Headquarters in New York, at which resolution 79/1 entitled \n\u201cThe Pact for the Future\u201d and its annexes were adopted,  \n \n1. \nTakes note of the report of the Secretary-General on the outcome of the \nFourth International Conference on Financing for Development; 7  \n \n2. \nWelcomes the outcome document of the Fourth International Conference \non Financing for Development, the Sevilla Commitment,8 and calls for its timely and \neffective implementation; \n \n3. \nReaffirms that the Sevilla Commitment provides a renewed global \nframework for financing for development to realize sustainable development and the \n2030 Agenda, with concrete policies and actions, the implementation of which \nrequires following up on, that relate to its seven action areas, namely, domestic public \nresources; domestic and international private business and finance; international \ndevelopment cooperation and development effectiveness; international trade as an \nengine for development; debt and debt sustainability; international financial \narchitecture and systemic issues; science, technology, innovation and capacity-\nbuilding; and data, monitoring and follow-up;  \n \n4. \nUrges the United Nations system, international financial institutions, \nmultilateral development banks, regional development banks and other relevant \nstakeholders to integrate the actions of the Sevilla Commitment into their relevant \nstrategic and operational programmatic documents and frameworks, in accordance \nwith their respective mandates;  \n \n5. \nLooks forward to the launch of the biennial cycle of in-depth review of \nand reporting on national and global commitments in the action areas of the financing \nfor development outcomes at the 2026 Economic and Social Council forum on \nfinancing for development follow-up, which will include the annual special high-level \nmeeting with the Bretton Woods institutions and a special high-level meeting that \nengages with the World Trade Organization and the United Nations Conference on \nTrade and Development;  \n \n6. \nReaffirms that the deliberations of the special meeting of the Economic \nand Social Council on international cooperation in tax matters, the Development \nCooperation Forum, a special meeting of the Economic and Social Council on \nfinancial integrity, the multi-stakeholder forum on science, technology and innovation \nfor the Sustainable Development Goals and a high-level special meeting of the \nEconomic and Social Council with credit rating agencies, among others, as well as \nongoing engagements with the private sector through mechanisms such as the \nFinancing for Development Business Sector Steering Committee and the Global \nInvestors for Sustainable Development Alliance, will be taken into account by the \nforum on financing for development follow-up on an appropriate cycle;  \n \n7. \nRecalls the report of the Inter-Agency Task Force on Financing for \nDevelopment entitled Financing for Sustainable Development Report 2024: \n__________________ \n \n7  A/80/387. \n \n8  Resolution 79/323, annex. \n\nA/C.2/80/L.9 \n \n25-16547\n4/4 \n \nFinancing for Development at a Crossroads,9 calls upon the Inter-Agency Task Force \non Financing for Development to continue to report annually on progress in \nimplementing the financing for development outcomes and the means of \nimplementation of the 2030 Agenda for Sustainable Development and its Sustainable \nDevelopment Goals and advise the intergovernmental follow-up thereto on progress, \nimplementation gaps and recommendations for corrective action, while taking into \nconsideration the national and regional dimensions, including to consider options to \npresent its findings in a more interactive and user-friendly manner, and looks forward \nto the Financing for Sustainable Development Report 2026, with deeper reporting on \nthe action areas under in-depth review at the Economic and Social Council forum on \nfinancing for development follow-up;  \n \n8. \nReiterates that States will not be able to achieve the ambitious Goals and \ntargets of the 2030 Agenda without a revitalized and enhanced global partnership and \ncomparably ambitious means of implementation, and reaffirms the commitment at the \nvery heart of the 2030 Agenda to leave no one behind and commit to taking more \ntangible steps to support people in vulnerable situations and the most vulnerable \ncountries and to reach the furthest behind first;  \n \n9. \nRequests the Department of Economic and Social Affairs of the Secretariat \nto initiate a network of national focal points for financing for development in line \nwith paragraph 65 (d) of the Sevilla Commitment;  \n \n10. Reiterates its appeal to Member States and other potential donors to \nconsider contributing generously to the trust fund to support activities for the follow \nup to the International Conference on Financing for Development, which would \nfacilitate the implementation of a strengthened and more effective inclusive, \nintergovernmental process for carrying out the financing for development follow-up;  \n \n11. Recognizes the work of the Financing for Sustainable Development Office, \nand encourages the Office, in collaboration with experts from the public and private \nsectors, academia, civil society and other multilateral organizations who work in the \nfield of financing for development, to continue its work in accordance with its \nmandate;  \n \n12. Requests the Secretary-General to submit a report to the General Assembly \nat its eighty-first session on the follow-up to and implementation of the Sevilla \nCommitment, including on progress made and continuing challenges faced, and on \nthe implementation of the present resolution;  \n \n13. Decides to include in the provisional agenda of its eighty-first session the \nitem entitled \u201cFollow-up to and implementation of the outcomes of the International \nConferences on Financing for Development\u201d. \n \n__________________ \n \n9  Financing for Sustainable Development Report 2024 (United Nations publication, 2024). \n",
  "paragraphs": {
    "1": "Takes note of the report of the Secretary-General on the outcome of the Fourth International Conference on Financing for Development; 7",
    "2": "Welcomes the outcome document of the Fourth International Conference on Financing for Development, the Sevilla Commitment,8 and calls for its timely and effective implementation;",
    "3": "Reaffirms that the Sevilla Commitment provides a renewed global framework for financing for development to realize sustainable development and the 2030 Agenda, with concrete policies and actions, the implementation of which requires following up on, that relate to its seven action areas, namely, domestic public resources; domestic and international private business and finance; international development cooperation and development effectiveness; international trade as an engine for development; debt and debt sustainability; international financial architecture and systemic issues; science, technology, innovation and capacity- building; and data, monitoring and follow-up;",
    "4": "Urges the United Nations system, international financial institutions, multilateral development banks, regional development banks and other relevant stakeholders to integrate the actions of the Sevilla Commitment into their relevant strategic and operational programmatic documents and frameworks, in accordance with their respective mandates;",
    "5": "Looks forward to the launch of the biennial cycle of in-depth review of and reporting on national and global commitments in the action areas of the financing for development outcomes at the 2026 Economic and Social Council forum on financing for development follow-up, which will include the annual special high-level meeting with the Bretton Woods institutions and a special high-level meeting that engages with the World Trade Organization and the United Nations Conference on Trade and Development;",
    "6": "Reaffirms that the deliberations of the special meeting of the Economic and Social Council on international cooperation in tax matters, the Development Cooperation Forum, a special meeting of the Economic and Social Council on financial integrity, the multi-stakeholder forum on science, technology and innovation for the Sustainable Development Goals and a high-level special meeting of the Economic and Social Council with credit rating agencies, among others, as well as ongoing engagements with the private sector through mechanisms such as the Financing for Development Business Sector Steering Committee and the Global Investors for Sustainable Development Alliance, will be taken into account by the forum on financing for development follow-up on an appropriate cycle;",
    "7": "Recalls the report of the Inter-Agency Task Force on Financing for Development entitled Financing for Sustainable Development Report 2024: __________________ 7 A/80/387. 8 Resolution 79/323, annex. A/C.2/80/L.9 25-16547 4/4 Financing for Development at a Crossroads,9 calls upon the Inter-Agency Task Force on Financing for Development to continue to report annually on progress in implementing the financing for development outcomes and the means of implementation of the 2030 Agenda for Sustainable Development and its Sustainable Development Goals and advise the intergovernmental follow-up thereto on progress, implementation gaps and recommendations for corrective action, while taking into consideration the national and regional dimensions, including to consider options to present its findings in a more interactive and user-friendly manner, and looks forward to the Financing for Sustainable Development Report 2026, with deeper reporting on the action areas under in-depth review at the Economic and Social Council forum on financing for development follow-up;",
    "8": "Reiterates that States will not be able to achieve the ambitious Goals and targets of the 2030 Agenda without a revitalized and enhanced global partnership and comparably ambitious means of implementation, and reaffirms the commitment at the very heart of the 2030 Agenda to leave no one behind and commit to taking more tangible steps to support people in vulnerable situations and the most vulnerable countries and to reach the furthest behind first;",
    "9": "Requests the Department of Economic and Social Affairs of the Secretariat to initiate a network of national focal points for financing for development in line with paragraph 65 (d) of the Sevilla Commitment;",
    "10": "Reiterates its appeal to Member States and other potential donors to consider contributing generously to the trust fund to support activities for the follow up to the International Conference on Financing for Development, which would facilitate the implementation of a strengthened and more effective inclusive, intergovernmental process for carrying out the financing for development follow-up;",
    "11": "Recognizes the work of the Financing for Sustainable Development Office, and encourages the Office, in collaboration with experts from the public and private sectors, academia, civil society and other multilateral organizations who work in the field of financing for development, to continue its work in accordance with its mandate;",
    "12": "Requests the Secretary-General to submit a report to the General Assembly at its eighty-first session on the follow-up to and implementation of the Sevilla Commitment, including on progress made and continuing challenges faced, and on the implementation of the present resolution;",
    "13": "Decides to include in the provisional agenda of its eighty-first session the item entitled \u201cFollow-up to and implementation of the outcomes of the International Conferences on Financing for Development\u201d. __________________ 9 Financing for Sustainable Development Report 2024 (United Nations publication, 2024)."
  },
  "agenda_items": [
    "Item 17"
  ],
  "symbol_references": [
    "A/C.2/80/L.9"
  ]
}