{
  "symbol": "A/C.2/80/L.50",
  "filename": "A_C.2_80_L.50.pdf",
  "title": "Combating sand and dust storms",
  "text": "United Nations \nA/C.2/80/L.50\n \n \nGeneral Assembly \nDistr.: Limited \n17 November 2025 \nOriginal: English \n \n25-18661 (E)    211125 \n*2518661* \n \n \nEightieth session \nSecond Committee \nAgenda item 18 (i) \nSustainable development: combating sand and dust storms \n \n \n \n \n \nDraft resolution submitted by the Rapporteur of the Committee, Javad Momeni \n(Islamic Republic of Iran), on the basis of informal consultations on draft \nresolution A/C.2/80/L.39 \n \n \n \n Combating sand and dust storms \n \n \n \nThe General Assembly, \n \nRecalling its resolutions 70/195 of 22 December 2015, 71/219 of 21 December \n2016, 72/225 of 20 December 2017, 73/237 of 20 December 2018, 74/226 of \n19 December 2019, 75/222 of 21 December 2020, 76/211 of 17 December 2021, \n77/171 of 14 December 2022, 78/158 of 19 December 2023 and 79/212 of \n19 December 2024 on combating sand and dust storms,  \n \nReaffirming its resolution 70/1 of 25 September 2015, entitled \u201cTransforming \nour world: the 2030 Agenda for Sustainable Development\u201d, in which it adopted a \ncomprehensive, far-reaching and people-centred set of universal and transformative \nSustainable Development Goals and targets, its commitment to working tirelessly for \nthe full implementation of the Agenda by 2030, its recognition that eradicating \npoverty in all its forms and dimensions, including extreme poverty, is the greatest \nglobal challenge and an indispensable requirement for sustainable development, its \ncommitment to achieving sustainable development in its three dimensions \u2013 \neconomic, social and environmental \u2013 in a balanced and integrated manner, and to \nbuilding upon the achievements of the Millennium Development Goals and seeking \nto address their unfinished business,  \n \nReaffirming also its resolution 69/313 of 27 July 2015 on the Addis Ababa \nAction Agenda of the Third International Conference on Financing for Development, \nwhich is an integral part of the 2030 Agenda for Sustainable Development, supports \nand complements it, helps to contextualize its means of implementation targets with \nconcrete policies and actions, and reaffirms the strong political commitment to \naddress the challenge of financing and creating an enabling environment at all levels \nfor sustainable development in the spirit of global partnership and solidarity,  \n\nA/C.2/80/L.50 \n \n25-18661\n2/8 \n \n \nReaffirming further the Paris Agreement 1 and its early entry into force, and \nencouraging all its Parties to fully implement the Agreement, and Parties to the United \nNations Framework Convention on Climate Change 2 that have not yet done so to \ndeposit their instruments of ratification, acceptance, approval or accession, where \nappropriate, as soon as possible,  \n \nHighlighting the synergies between the implementation of the 2030 Agenda for \nSustainable Development, the Addis Ababa Action Agenda and the Paris Agreement, \nnoting with concern the findings contained in the special report of the \nIntergovernmental Panel on Climate Change entitled Global Warming of 1.5\u00b0C, \nnoting with concern also the findings of the report of the Asian and Pacific Centre for \nthe Development of Disaster Information Management of the Economic and Social \nCommission for Asia and the Pacific entitled Sand and Dust Storms Risk Assessment \nin Asia and the Pacific and the report of the United Nations Environment Programme \nentitled Impacts of Sand and Dust Storms on Oceans: A Scientific Environmental \nAssessment for Policy Makers, in addition to the World Health Organization \nglobal air quality guidelines and the World Meteorological Organization report \nentitled 2020 State of Climate Services: Risk Information and Early Warning \nSystems, welcoming the convening of the twenty-eighth session of the Conference of \nthe Parties to the United Nations Framework Convention on Climate Change, held in \nDubai, United Arab Emirates, from 30 November to 13 December 2023, and the \ntwenty-ninth session of the Conference of the Parties to the United Nations \nFramework Convention on Climate Change, held in Baku, Azerbaijan, from 11 to \n22 November 2024, welcoming also the thirtieth session of the Conference of the \nParties to the United Nations Framework Convention on Climate Change, held in \nBel\u00e9m, Brazil, from 10 to 21 November 2025, and looking forward to the thirty-first \nsession of the Conference of the Parties to the United Nations Framework Convention \non Climate Change, to be held in 2026,  \n \nRecalling United Nations Environment Assembly resolutions 1/7 of 27 June \n2014 on strengthening the role of the United Nations Environment Programme in \npromoting air quality,3 2/21 of 27 May 20164 and 6/7 of 1 March 20245 on combating \nsand and dust storms, 4/10 of 15 March 2019 on innovation on biodiversity and land \ndegradation6 and 6/10 of 1 March 2024 on promoting regional cooperation to improve \nair quality globally,7 \n \nAcknowledging the work done by the secretariat of the United Nations \nConvention to Combat Desertification in Those Countries Experiencing Serious \nDrought and/or Desertification, Particularly in Africa,8 towards mitigating sand and \ndust storm issues at source, and acknowledging also the continuing support of the \nFood and Agriculture Organization of the United Nations for countries affected by \nsand and dust storms through the promotion of sustainable land management, \nagroforestry, \nshelter \nbelts, \nafforestation/reforestation \nand \nland \nrestoration \nprogrammes, which all contribute to sand and dust storm source mitigation,  \n \nRecalling its resolutions 71/229 of 21 December 2016, 72/220 of 20 December \n2017, 73/233 of 20 December 2018, 74/220 of 19 December 2019, 75/218 of \n__________________ \n \n1  Adopted under the UNFCCC in FCCC/CP/2015/10/Add.1, decision 1/CP.21. \n \n2  United Nations, Treaty Series, vol. 1771, No. 30822. \n \n3  See Official Records of the General Assembly, Sixty-ninth Session, Supplement No. 25 \n(A/69/25), annex. \n \n4  Ibid., Seventy-first Session, Supplement No. 25 (A/71/25), annex. \n \n5  UNEP/EA.6/Res.7. \n \n6  UNEP/EA.4/Res.10. \n \n7  UNEP/EA.6/Res.10. \n \n8  United Nations, Treaty Series, vol. 1954, No. 33480. \n\nA/C.2/80/L.50\n \n3/8\n25-18661 \n \n21 December 2020, 76/206 of 17 December 2021, 77/166 of 14 December 2022, \n78/154 of 19 December 2023 and 79/207 of 19 December 2024 on the implementation \nof the United Nations Convention to Combat Desertification in Those Countries \nExperiencing Serious Drought and/or Desertification, Particularly in Africa,  \n \nWelcoming the convening of the fifteenth session of the Conference of the \nParties to the United Nations Convention to Combat Desertification, held in Abidjan, \nC\u00f4te d\u2019Ivoire, from 9 to 20 May 2022, noting the adoption of the Abidjan Call as well \nas the Abidjan Legacy Programme, to address drought and preserve and restore the \nterrestrial ecosystem, reverse land degradation and halt the loss of biodiversity, noting \nalso decision 26/COP.15 of 20 May 2022,9 in which the Conference urged a proactive \napproach to enhance cooperation at all levels to address the causes and impacts of \nsand and dust storms and called for the organization, as appropriate, of a science-\npolicy dialogue to contribute to the development of further guidance and policies to \naddress sand and dust storms, and welcoming the convening of the sixteenth session \nof the Conference of the Parties to the United Nations Convention to Combat \nDesertification, held in Riyadh, from 2 to 13 December 2024, and its decision \n27/COP.16 of 14 December 2024,10 and looking forward to the seventeenth session, \nto be held in Mongolia from 17 to 28 August 2026, \n \nWelcoming also the convening of the sixteenth meeting of the Conference of the \nParties to the Convention on Biological Diversity, and the meetings of the Parties to \nthe Protocols to the Convention, held in Cali, Colombia, from 21 October to \n1 November 2024, under the theme \u201cPeace with nature\u201d, as well as the two resumed \nsessions of the sixteenth meeting of the Conference of Parties to the Convention, held \nonline from 3 to 6 December 2024 and in Rome from 25 to 27 February 2025, and \ntaking note of their adopted decisions, looking forward to the seventeenth meeting of \nthe Conference of the Parties and the meetings of the Parties to the Protocols to the \nConvention, to be held in Yerevan from 19 to 30 October 2026, and recalling the \nKunming-Montreal Global Biodiversity Framework, adopted at the fifteenth meeting \nof the Conference of the Parties to the Convention on Biological Diversity, 11 and \nurging its early, inclusive and effective implementation, \n \nRecalling its resolution 66/288 of 27 July 2012, in which it endorsed the \noutcome document of the United Nations Conference on Sustainable Development, \nentitled \u201cThe future we want\u201d,  \n \nNoting the adoption, by the Economic and Social Commission for Asia and the \nPacific at its seventy-second session, of resolution 72/7 of 19 May 2016 on regional \ncooperation to combat sand and dust storms in Asia and the Pacific, and taking note \nof the Regional Plan of Action on Sand and Dust Storms in Asia and the Pacific of \nthe Asian and Pacific Centre for the Development of Disaster Information \nManagement of the Commission,12  \n \nNoting with appreciation the recognition by the Economic and Social \nCommission for Asia and the Pacific at its seventy-fifth session of the \nrecommendation by the Governing Council of the Asian and Pacific Centre for the \nDevelopment of Disaster Information Management to establish a subregional \ncooperation mechanism for slow-onset hazards with a focus on sand and dust storms \nin South-West and Central Asia, and noting the recognition by the Commission at its \nseventy-eighth session of the Regional Plan of Action on Sand and Dust Storms in \nAsia and the Pacific, which provides a strategic framework and reference for \n__________________ \n \n9  See ICCD/COP(15)/23/Add.1. \n \n10  See ICCD/COP(16)/24/Add.1. \n \n11  United Nations Environment Programme, document CBD/COP/15/17, decision 15/4, annex. \n \n12  ESCAP/78/12/Add.1. \n\nA/C.2/80/L.50 \n \n25-18661\n4/8 \n \ncountries in the region to take action at the national and regional levels, in the context \nof multi-hazard disaster risk reduction, to reduce the negative impact of sand and dust \nstorms and identify anthropogenic measures that could contribute to or mitigate their \nformation and intensity,  \n \nTaking note of the Regional Programme to Combat Sand and Dust Storms of the \nUnited Nations Environment Programme, and of other initiatives, including the \nministerial meeting on sand and dust storms held in Nairobi on 21 February 2013 on \nthe margins of the twenty-seventh session of the Governing Council/Global \nMinisterial Environment Forum of the United Nations Environment Programme,  \n \nRecalling the Sendai Declaration and the Sendai Framework for Disaster Risk \nReduction 2015\u20132030, adopted at the Third United Nations World Conference on \nDisaster Risk Reduction and endorsed by the General Assembly in its resolution \n69/283 of 3 June 2015, and recognizing that one of the priorities for action of the \nFramework is an understanding of disaster risk for prevention, mitigation and \nadaptation and for the development and implementation of appropriate preparedness \nand effective response to disasters, which continue to undermine efforts to achieve \nsustainable development, recalling also the convening of the high-level meeting of \nthe General Assembly on the midterm review of the Sendai Framework for Disaster \nRisk Reduction 2015\u20132030, and its political declaration,13 \n \nStressing the need for cooperation at the global and regional levels with a view \nto managing and mitigating the negative effects of sand and dust storms, particularly \nin the most affected countries, through the enhancement of early warning systems and \nthe sharing of climate and weather information to forecast sand and dust storms, and \naffirming that resilient action to combat and prevent sand and dust storms requires a \nbetter understanding of the severe multidimensional impacts of sand and dust storms, \nincluding the deterioration of the health, well-being and livelihood of people, \nincreased desertification and land degradation, deforestation, loss of biodiversity and \nland productivity, and their impact on sustainable economic growth, \n \nRecognizing that sand and dust storms are an issue of international concern, the \ncosts of which are measured in economic, social and environmental terms, and that \nsand and dust storms continue to grow and negatively affect the achievement of 11 of \nthe 17 Sustainable Development Goals and their means of implementation, \n \nNoting that sand and dust storms are a challenge with impacts on, inter alia, \ninfrastructure, transport, communication, agriculture, ecosystems and human health \nand transboundary impacts that require institutional, technical and scientific \nresponses, and that the global frequency and intensity of sand and dust storms have \nincreased in some regions in the last decade and pose a great threat to the sustainable \ndevelopment of affected countries,  \n \nEmphasizing the relevance of the efforts and cooperation of Member States at \nthe regional and international levels to control and reduce the negative impacts of \nsand and dust storms on human settlements in vulnerable regions, recalling its \nresolutions 72/225 and 77/171, in which it noted the first International Conference on \nCombating Sand and Dust Storms, held in Tehran from 3 to 5 July 2017, and the \nsecond International Conference on Combating Sand and Dust Storms, held in Tehran \non 9 and 10 September 2023, welcoming the holding of other meetings with the active \nparticipation of all countries, and taking note with appreciation of other ongoing \ninitiatives to combat sand and dust storms, at the national, regional and global levels,  \n__________________ \n \n13  Resolution 77/289, annex. \n\nA/C.2/80/L.50\n \n5/8\n25-18661 \n \n \n1. \nTakes note of the report of the Secretary-General;14  \n \n2. \nRecognizes that sand and dust storms are increasing in intensity and \nfrequency in several regions, affecting more than 150 countries, and that sand and \ndust storms and the unsustainable land management, soil, agricultural and livestock \npractices, among other factors, that can cause or exacerbate these phenomena, \nincluding climate change, pose a serious challenge to the sustainable development of \naffected countries and regions, also recognizes that, in the past few years, sand and \ndust storms have inflicted substantial economic, social and environmental damage on \nthe inhabitants of the world\u2019s arid, semi-arid and dry subhumid areas, especially in \nAfrica and Asia, and underscores the need to treat them and to promptly take measures \nto address those challenges and the need for coordinated measures that address their \nmultidimensional impacts on health, livelihoods, ecosystems and infrastructure; \n \n3. \nRecalls the convening of a high-level interactive dialogue on sand and dust \nstorms, held at Headquarters in New York on 16 July 2018, to discuss action-oriented \nrecommendations and address the challenges faced by the affected countries, \nincluding ways to improve policy coordination at the global level to tackle those \nchallenges in the context of the Sustainable Development Goals, during which the \ncontinuing need to confront the challenges presented by sand and dust storms was \nhighlighted,  \n \n4. \nAlso recalls the convening of the high-level meeting on sand and dust \nstorms, by the President of the General Assembly at the seventy-ninth session of the \nAssembly, in collaboration with the United Nations Coalition on Combating Sand and \nDust Storms, in the General Assembly Hall, at United Nations Headquarters in New \nYork, held on 10 July 2025 in the context of the International Day of Combating Sand \nand Dust Storms, at which participants discussed the challenges faced by affected \ncountries to further practical actions at the regional and global levels;  \n \n5. \nWelcomes the efforts of the United Nations Coalition on Combating Sand \nand Dust Storms, which is pursuing efforts, within its mandate and resources, to move \nto the implementation stage, and aims, inter alia, to promote and coordinate a \ncollaborative United Nations system response to the growing issue of sand and dust \nstorms on a local, national, regional and global scale, ensuring that unified and \ncoherent action is taken, to facilitate the capacity-building of Member States, raise \ntheir awareness and enhance their preparedness and response to sand and dust storms \nin critical regions, and to facilitate the exchange of knowledge, data and best practices \namong Coalition members to promote effective and coherent action on sand and dust \nstorms; \n \n6. \nReiterates the invitation to the Secretary-General to consider designating \na relevant agency or entity with adequate capacity, by July 2026, to act as a focal \npoint on sand and dust storms in the United Nations system to follow up the decisions \nin the relevant resolutions and the United Nations Coalition on Combating Sand and \nDust Storms, ensuring that the designation process is transparent, inclusive and \nconsultative with Member States;  \n \n7. \nRecognizes the importance of new and innovative technologies and best \npractices in combating sand and dust storms, as well as their sharing and transfer on \nmutually agreed terms;  \n \n8. \nEncourages regional, subregional and interregional organizations and \nprocesses to continue to share best practices, policies, experiences and technical \nexpertise promoting local, national, regional and global strategies in combating and \npreventing sand and dust storms to address the root causes and mitigate the impacts \n__________________ \n \n14 A/80/265. \n\nA/C.2/80/L.50 \n \n25-18661\n6/8 \n \nof sand and dust storms, and find sustainable solutions, including through improved \nimplementation of sustainable land management, soil, agricultural and livestock \npractices, as well as sustainable water management, and to promote regional \ncooperation in this matter to reduce the risks and impact of future sand and dust \nstorms at all levels, including local, national, regional and global, and to provide \naffected countries with capacity-building and technical support from the relevant \nUnited Nations organizations, such as the World Meteorological Organization, the \nUnited Nations Environment Programme and the World Health Organization, within \ntheir respective mandates, to this end;  \n \n9. \nInvites all affected Member States as well as relevant entities of the United \nNations development system, regional organizations and other relevant stakeholders \nto endeavour to meet the objectives set out in the present resolution;  \n \n10. Welcomes the convening of the interregional forum organized by the \nEconomic and Social Commission for Western Asia and the Economic and Social \nCommission for Asia and the Pacific, held in Beirut on 7 and 8 October 2025, in \ncollaboration with the United Nations Coalition on Combating Sand and Dust Storms, \nand implemented within the framework of activities planned by the Coalition\u2019s \nWorking Group on Regional Collaboration in support of the United Nations Decade \non Combating Sand and Dust Storms (2025\u20132034), aimed at fostering regional and \ninterregional dialogue on joint actions and cooperative responses to combat sand and \ndust storms;  \n \n11. \nTakes note of the establishment of a regional and global trust fund for the \nWest Asia and African region to combat sand and dust storms, supported by voluntary \ncontributions from interested countries, intergovernmental and non-governmental \norganizations, major groups and other donors, the private sector, civil society and \nregional development banks, to undertake the implementation of regional and \nsubregional programmes and action plans without prejudice to the possibility that this \nfund may include other regions in the future, while respecting international \nframeworks and any relevant documents on combating sand and dust storms to ensure \ncoordinated action at a global scale;  \n \n12. Reaffirms that climate change is one of the greatest challenges of our time \nand, among other factors, is a serious challenge to the sustainable development of all \ncountries, including those affected by sand and dust storms, and emphasizes that, \namong other factors, climate change is an important potential contributor to future \nwind erosion and the risk of sand and dust storms, especially the occurrence of more \nextreme wind events worsening drought conditions and the movement towards drier \nclimates, although reverse effects are possible;  \n \n13. Recognizes that sand and dust storms cause numerous human health \nproblems in different regions around the world, especially in arid, semi-arid and dry \nsubhumid regions, and that there is a need to reinforce protective strategies to reduce \nthe negative impacts of sand and dust storms on human health, invites the World \nHealth Organization, with the cooperation of other relevant United Nations system \nentities, as appropriate, to support affected countries in combating health problems \ncaused by sand and dust storms, within their respective mandates, recognizes the \nformation of a working group on sand and dust storms to discuss emerging issues and \nshare information under the technical advisory group on global air pollution and \nhealth of the World Health Organization, and also recognizes the publication of a \ndedicated section on the health effects of sand and dust storms as part of the World \nHealth Organization global air quality guidelines released in September 2021, and the \ndevelopment of standard operating procedures to assess and address the short-term \nhealth effects of desert dust by the World Health Organization, in collaboration with \nexperts from the World Meteorological Organization;  \n\nA/C.2/80/L.50\n \n7/8\n25-18661 \n \n \n14. Emphasizes that sand and dust storm issues will continue to constitute \nimportant components of the global coalition on health, environment and climate \nchange launched in May 2018 by the World Health Organization, the United Nations \nEnvironment Programme and the World Meteorological Organization to improve \ncoordination and reduce deaths that are attributed to environmental risks, such as air \npollution;  \n \n15. Commends the United Nations Environment Assembly on its commitment \nto addressing sand and dust storms, and in this regard notes Environment Assembly \nresolution 2/21 on sand and dust storms, adopted during its second session, resolution \n4/10 on innovation on biodiversity and land degradation, adopted during its fourth \nsession, and resolution 6/7 on combating sand and dust storms, adopted during its \nsixth session;  \n \n16. Takes note of the convening of the regional ministerial meeting on \nenvironmental cooperation for a better future held in the Islamic Republic of Iran on \n12 July 2022 to find solutions for regional environmental challenges, especially the \nissue of sand and dust storms;  \n \n17. Recalls the convening of the sixth session of the United Nations \nEnvironment Assembly in Nairobi from 26 February to 1 March 2024, under the \ntheme \u201cEffective, inclusive and sustainable multilateral actions to tackle climate \nchange, biodiversity loss and pollution\u201d, and looks forward to the seventh session of \nthe Environment Assembly, to be held in Nairobi from 8 to 12 December 2025;  \n \n18. Commends the secretariat of the United Nations Convention to Combat \nDesertification in Those Countries Experiencing Serious Drought and/or \nDesertification, Particularly in Africa, on its efforts to develop both a global base map \nof sand and dust storm sources, in collaboration with the United Nations Environment \nProgramme and the World Meteorological Organization, and the Sand and Dust Storms \nCompendium: Information and Guidance on Assessing and Addressing the Risks, in \ncollaboration with the Science-Policy Interface of the Convention and other relevant \nUnited Nations system entities, as a comprehensive collation of material designed to \nprovide information and guidance on how to assess and address the risks posed by sand \nand dust storms and plan actions to combat their recurrence and impacts; \n \n19. Also commends the World Meteorological Organization for achieving \nseveral improvements to the observation and modelling systems that are part of its \nSand and Dust Storm Warning Advisory and Assessment System, which provides sand \nand dust storm forecasts for early warning systems in various countries, and \nencourages the strengthening of early warning systems and the exchange of weather \ninformation for predicting sand and dust storms, to better prepare vulnerable \ncountries, and encourages the World Meteorological Organization and all relevant \nstakeholders to broaden the regional domains of this system to cover the highly \naffected regions and to continue to make technical improvements to it;  \n \n20. Welcomes the convening of the sixteenth session of the Conference of the \nParties to the United Nations Convention to Combat Desertification in Those \nCountries Experiencing Serious Drought and/or Desertification, particularly in \nAfrica, held in Riyadh from 2 to 13 December 2024, under the theme \u201cOur land. Our \nfuture\u201d, and the adoption of its decisions, and calls for their full implementation, and \nlooks forward to the convening of the seventeenth session of the Conference of the \nParties, to be held in Ulaanbaatar from 17 to 28 August 2026;  \n \n21. Encourages the relevant entities of the United Nations, including the \nWorld Health Organization, the United Nations Environment Programme, the United \nNations Development Programme, the World Meteorological Organization, the \nUnited Nations Office for Disaster Risk Reduction, the Food and Agriculture \n\nA/C.2/80/L.50 \n \n25-18661\n8/8 \n \nOrganization of the United Nations and the Department of Economic and Social \nAffairs of the Secretariat, within their respective mandates and resources, and donors \nto continue to provide capacity-building and technical assistance for combating and \npreventing sand and dust storms, and to continue to support the implementation of \nthe national, regional and global action plans of the affected countries;  \n \n22. Recalls its resolution 77/294 of 8 June 2023, in which 12 July of each year \nwas proclaimed as International Day of Combating Sand and Dust Storms, to further \nraise international awareness of sand and dust storms, and stresses the need for global \nand regional cooperation to manage and mitigate their effects; \n \n23. \nAlso recalls its resolution 78/314 of 10 July 2024, in which it proclaimed \n2025\u20132034 the United Nations Decade on Combating Sand and Dust Storms, within \nexisting structures and available resources, with the aim of enhancing international and \nregional cooperation and supporting and scaling up efforts to prevent, halt and mitigate \nthe negative effects of sand and dust storms, especially on the affected countries; \n \n24. Emphasizes the importance of reviewing the implementation of the United \nNations Decade on Combating Sand and Dust Storms at its eighty-fourth session, as \na means to assess progress made and identify challenges encountered, with a view to \nenhancing international cooperation and support for affected countries and providing \ntimely opportunities to advance discussion on the matter, including through the \nconvening of a high-level ministerial meeting on the mid-term review of the Decade, \nunder the auspices of the President of the General Assembly, through voluntary \ncontributions and without duplication of effort, to advance international cooperation \nand support for affected countries and to discuss their challenges, needs and priorities, \nincluding ways to enhance regional and global policy coordination, in coordination \nwith the United Nations Coalition on Combating Sand and Dust Storms and other \nrelevant United Nations entities, which will result in a summary of the proceedings \nto be prepared by the President of the General Assembly as its outcome document;  \n \n25. Acknowledges the global assessment of sand and dust storms prepared by \nthe United Nations Environment Programme in collaboration with other relevant \nUnited Nations system entities, including the World Meteorological Organization and \nthe secretariat of the United Nations Convention to Combat Desertification, which \nsets out proposals for consolidated and coordinated technical and policy options for \nresponding to sand and dust storms; \n \n26. Requests the Secretary-General to further encourage the United Nations \nCoalition on Combating Sand and Dust Storms to conduct its priority activities as \nidentified by the Coalition\u2019s five working groups, which are knowledge-sharing, \ncapacity-building, training, awareness-raising and support for the formulation of \nnational, regional and interregional plans, to mitigate and prevent sand and dust storm \nhazards, to encourage the Coalition to enhance resource mobilization efforts so as to \nincrease voluntary contributions to the Coalition and its member agencies, and invites \nthe Coalition to consider the possibility of broadening the scope of the concept note \nto include other sectors affected by sand and dust storms, in order to align with the \nworkplan and the action plan of the Coalition;  \n \n27. Also requests the Secretary-General to submit to the General Assembly at \nits eighty-first session a report on the implementation of the present resolution, while \nincluding best practices aimed at adapting, mitigating, controlling and combating \nsand and dust storms in collaboration with the affected nations and other countries, \nand decides to include in the provisional agenda of its eighty-first session, under the \nitem entitled \u201cSustainable development\u201d, the sub-item entitled \u201cCombating sand and \ndust storms\u201d. \n \n",
  "paragraphs": {
    "1": "Takes note of the report of the Secretary-General;14",
    "2": "Recognizes that sand and dust storms are increasing in intensity and frequency in several regions, affecting more than 150 countries, and that sand and dust storms and the unsustainable land management, soil, agricultural and livestock practices, among other factors, that can cause or exacerbate these phenomena, including climate change, pose a serious challenge to the sustainable development of affected countries and regions, also recognizes that, in the past few years, sand and dust storms have inflicted substantial economic, social and environmental damage on the inhabitants of the world\u2019s arid, semi-arid and dry subhumid areas, especially in Africa and Asia, and underscores the need to treat them and to promptly take measures to address those challenges and the need for coordinated measures that address their multidimensional impacts on health, livelihoods, ecosystems and infrastructure;",
    "3": "Recalls the convening of a high-level interactive dialogue on sand and dust storms, held at Headquarters in New York on 16 July 2018, to discuss action-oriented recommendations and address the challenges faced by the affected countries, including ways to improve policy coordination at the global level to tackle those challenges in the context of the Sustainable Development Goals, during which the continuing need to confront the challenges presented by sand and dust storms was highlighted,",
    "4": "Also recalls the convening of the high-level meeting on sand and dust storms, by the President of the General Assembly at the seventy-ninth session of the Assembly, in collaboration with the United Nations Coalition on Combating Sand and Dust Storms, in the General Assembly Hall, at United Nations Headquarters in New York, held on 10 July 2025 in the context of the International Day of Combating Sand and Dust Storms, at which participants discussed the challenges faced by affected countries to further practical actions at the regional and global levels;",
    "5": "Welcomes the efforts of the United Nations Coalition on Combating Sand and Dust Storms, which is pursuing efforts, within its mandate and resources, to move to the implementation stage, and aims, inter alia, to promote and coordinate a collaborative United Nations system response to the growing issue of sand and dust storms on a local, national, regional and global scale, ensuring that unified and coherent action is taken, to facilitate the capacity-building of Member States, raise their awareness and enhance their preparedness and response to sand and dust storms in critical regions, and to facilitate the exchange of knowledge, data and best practices among Coalition members to promote effective and coherent action on sand and dust storms;",
    "6": "Reiterates the invitation to the Secretary-General to consider designating a relevant agency or entity with adequate capacity, by July 2026, to act as a focal point on sand and dust storms in the United Nations system to follow up the decisions in the relevant resolutions and the United Nations Coalition on Combating Sand and Dust Storms, ensuring that the designation process is transparent, inclusive and consultative with Member States;",
    "7": "Recognizes the importance of new and innovative technologies and best practices in combating sand and dust storms, as well as their sharing and transfer on mutually agreed terms;",
    "8": "Encourages regional, subregional and interregional organizations and processes to continue to share best practices, policies, experiences and technical expertise promoting local, national, regional and global strategies in combating and preventing sand and dust storms to address the root causes and mitigate the impacts of sand and dust storms, and find sustainable solutions, including through improved implementation of sustainable land management, soil, agricultural and livestock practices, as well as sustainable water management, and to promote regional cooperation in this matter to reduce the risks and impact of future sand and dust storms at all levels, including local, national, regional and global, and to provide affected countries with capacity-building and technical support from the relevant United Nations organizations, such as the World Meteorological Organization, the United Nations Environment Programme and the World Health Organization, within their respective mandates, to this end;",
    "9": "Invites all affected Member States as well as relevant entities of the United Nations development system, regional organizations and other relevant stakeholders to endeavour to meet the objectives set out in the present resolution;",
    "10": "Welcomes the convening of the interregional forum organized by the Economic and Social Commission for Western Asia and the Economic and Social Commission for Asia and the Pacific, held in Beirut on 7 and 8 October 2025, in collaboration with the United Nations Coalition on Combating Sand and Dust Storms, and implemented within the framework of activities planned by the Coalition\u2019s Working Group on Regional Collaboration in support of the United Nations Decade on Combating Sand and Dust Storms (2025\u20132034), aimed at fostering regional and interregional dialogue on joint actions and cooperative responses to combat sand and dust storms;",
    "11": "Takes note of the establishment of a regional and global trust fund for the West Asia and African region to combat sand and dust storms, supported by voluntary contributions from interested countries, intergovernmental and non-governmental organizations, major groups and other donors, the private sector, civil society and regional development banks, to undertake the implementation of regional and subregional programmes and action plans without prejudice to the possibility that this fund may include other regions in the future, while respecting international frameworks and any relevant documents on combating sand and dust storms to ensure coordinated action at a global scale;",
    "12": "Reaffirms that climate change is one of the greatest challenges of our time and, among other factors, is a serious challenge to the sustainable development of all countries, including those affected by sand and dust storms, and emphasizes that, among other factors, climate change is an important potential contributor to future wind erosion and the risk of sand and dust storms, especially the occurrence of more extreme wind events worsening drought conditions and the movement towards drier climates, although reverse effects are possible;",
    "13": "",
    "14": "Emphasizes that sand and dust storm issues will continue to constitute important components of the global coalition on health, environment and climate change launched in May 2018 by the World Health Organization, the United Nations Environment Programme and the World Meteorological Organization to improve coordination and reduce deaths that are attributed to environmental risks, such as air pollution;",
    "15": "Commends the United Nations Environment Assembly on its commitment to addressing sand and dust storms, and in this regard notes Environment Assembly resolution 2/21 on sand and dust storms, adopted during its second session, resolution 4/10 on innovation on biodiversity and land degradation, adopted during its fourth session, and resolution 6/7 on combating sand and dust storms, adopted during its sixth session;",
    "16": "Takes note of the convening of the regional ministerial meeting on environmental cooperation for a better future held in the Islamic Republic of Iran on 12 July 2022 to find solutions for regional environmental challenges, especially the issue of sand and dust storms;",
    "17": "Recalls the convening of the sixth session of the United Nations Environment Assembly in Nairobi from 26 February to 1 March 2024, under the theme \u201cEffective, inclusive and sustainable multilateral actions to tackle climate change, biodiversity loss and pollution\u201d, and looks forward to the seventh session of the Environment Assembly, to be held in Nairobi from 8 to 12 December 2025;",
    "18": "Commends the secretariat of the United Nations Convention to Combat Desertification in Those Countries Experiencing Serious Drought and/or Desertification, Particularly in Africa, on its efforts to develop both a global base map of sand and dust storm sources, in collaboration with the United Nations Environment Programme and the World Meteorological Organization, and the Sand and Dust Storms Compendium: Information and Guidance on Assessing and Addressing the Risks, in collaboration with the Science-Policy Interface of the Convention and other relevant United Nations system entities, as a comprehensive collation of material designed to provide information and guidance on how to assess and address the risks posed by sand and dust storms and plan actions to combat their recurrence and impacts;",
    "19": "Also commends the World Meteorological Organization for achieving several improvements to the observation and modelling systems that are part of its Sand and Dust Storm Warning Advisory and Assessment System, which provides sand and dust storm forecasts for early warning systems in various countries, and encourages the strengthening of early warning systems and the exchange of weather information for predicting sand and dust storms, to better prepare vulnerable countries, and encourages the World Meteorological Organization and all relevant stakeholders to broaden the regional domains of this system to cover the highly affected regions and to continue to make technical improvements to it;",
    "20": "Welcomes the convening of the sixteenth session of the Conference of the Parties to the United Nations Convention to Combat Desertification in Those Countries Experiencing Serious Drought and/or Desertification, particularly in Africa, held in Riyadh from 2 to 13 December 2024, under the theme \u201cOur land. Our future\u201d, and the adoption of its decisions, and calls for their full implementation, and looks forward to the convening of the seventeenth session of the Conference of the Parties, to be held in Ulaanbaatar from 17 to 28 August 2026;",
    "21": " Organization of the United Nations and the Department of Economic and Social Affairs of the Secretariat, within their respective mandates and resources, and donors to continue to provide capacity-building and technical assistance for combating and preventing sand and dust storms, and to continue to support the implementation of the national, regional and global action plans of the affected countries;",
    "22": "Recalls its resolution 77/294 of 8 June 2023, in which 12 July of each year was proclaimed as International Day of Combating Sand and Dust Storms, to further raise international awareness of sand and dust storms, and stresses the need for global and regional cooperation to manage and mitigate their effects;",
    "23": "Also recalls its resolution 78/314 of 10 July 2024, in which it proclaimed 2025\u20132034 the United Nations Decade on Combating Sand and Dust Storms, within existing structures and available resources, with the aim of enhancing international and regional cooperation and supporting and scaling up efforts to prevent, halt and mitigate the negative effects of sand and dust storms, especially on the affected countries;",
    "24": "Emphasizes the importance of reviewing the implementation of the United Nations Decade on Combating Sand and Dust Storms at its eighty-fourth session, as a means to assess progress made and identify challenges encountered, with a view to enhancing international cooperation and support for affected countries and providing timely opportunities to advance discussion on the matter, including through the convening of a high-level ministerial meeting on the mid-term review of the Decade, under the auspices of the President of the General Assembly, through voluntary contributions and without duplication of effort, to advance international cooperation and support for affected countries and to discuss their challenges, needs and priorities, including ways to enhance regional and global policy coordination, in coordination with the United Nations Coalition on Combating Sand and Dust Storms and other relevant United Nations entities, which will result in a summary of the proceedings to be prepared by the President of the General Assembly as its outcome document;",
    "25": "Acknowledges the global assessment of sand and dust storms prepared by the United Nations Environment Programme in collaboration with other relevant United Nations system entities, including the World Meteorological Organization and the secretariat of the United Nations Convention to Combat Desertification, which sets out proposals for consolidated and coordinated technical and policy options for responding to sand and dust storms;",
    "26": "Requests the Secretary-General to further encourage the United Nations Coalition on Combating Sand and Dust Storms to conduct its priority activities as identified by the Coalition\u2019s five working groups, which are knowledge-sharing, capacity-building, training, awareness-raising and support for the formulation of national, regional and interregional plans, to mitigate and prevent sand and dust storm hazards, to encourage the Coalition to enhance resource mobilization efforts so as to increase voluntary contributions to the Coalition and its member agencies, and invites the Coalition to consider the possibility of broadening the scope of the concept note to include other sectors affected by sand and dust storms, in order to align with the workplan and the action plan of the Coalition;",
    "27": "Also requests the Secretary-General to submit to the General Assembly at its eighty-first session a report on the implementation of the present resolution, while including best practices aimed at adapting, mitigating, controlling and combating sand and dust storms in collaboration with the affected nations and other countries, and decides to include in the provisional agenda of its eighty-first session, under the item entitled \u201cSustainable development\u201d, the sub-item entitled \u201cCombating sand and dust storms\u201d."
  },
  "agenda_items": [
    "Item 18"
  ],
  "symbol_references": [
    "A/C.2/80/L.50",
    "A/C.2/80/L.39"
  ]
}