{
  "symbol": "A/C.2/80/L.13",
  "filename": "A_C.2_80_L.13.pdf",
  "title": "International trade and development",
  "text": "United Nations \nA/C.2/80/L.13\n \n \nGeneral Assembly \nDistr.: Limited \n14 October 2025 \nOriginal: English \n \n25-16558 (E)    201025     \n*2516558* \n \n \nEightieth session \nSecond Committee \nAgenda item 16 (a) \nMacroeconomic policy questions: international trade \nand development \n \n \n \n \n \nIraq:* draft resolution \n \n \n \n International trade and development \n \n \n \nThe General Assembly, \n \nRecalling its resolutions 56/178 of 21 December 2001, 57/235 of 20 December \n2002, 58/197 of 23 December 2003, 59/221 of 22 December 2004, 60/184 of \n22 December 2005, 61/186 of 20 December 2006, 62/184 of 19 December 2007, \n63/203 of 19 December 2008, 64/188 of 21 December 2009, 65/142 of 20 December \n2010, 66/185 of 22 December 2011, 67/196 of 21 December 2012, 68/199 of \n20 December 2013, 69/205 of 19 December 2014, 70/187 of 22 December 2015, \n71/214 of 21 December 2016, 72/202 of 20 December 2017, 73/219 of 20 December \n2018, 74/201 of 19 December 2019, 75/203 of 21 December 2020, 76/190 of \n17 December 2021, 77/151 of 14 December 2022, 78/134 of 19 December 2023 and \n79/195 of 19 December 2024, \n \nRecalling also its resolutions 35/63 of 5 December 1980 and 70/186 of \n22 December 2015, \n \nReaffirming its resolution 70/1 of 25 September 2015, entitled \u201cTransforming \nour world: the 2030 Agenda for Sustainable Development\u201d, in which it adopted a \ncomprehensive, far-reaching and people-centred set of universal and transformative \nSustainable Development Goals and targets, its commitment to working tirelessly for \nthe full implementation of the Agenda by 2030, its recognition that eradicating \npoverty in all its forms and dimensions, including extreme poverty, is the greatest \nglobal challenge and an indispensable requirement for sustainable development, its \ncommitment to achieving sustainable development in its three dimensions \u2013 \neconomic, social and environmental \u2013 in a balanced and integrated manner, and to \nbuilding upon the achievements of the Millennium Development Goals and seeking \nto address their unfinished business, \n \nWelcoming the convening of the Fourth International Conference on Financing \nfor Development from 30 June to 3 July 2025 in Sevilla, Spain, and reaffirming its \noutcome document, the Sevilla Commitment, endorsed by the General Assembly in \nits resolution 79/323 of 25 August 2025, which sets forth a renewed global framework \n \n \n* On behalf of the States that are members of the Group of 77 and China, taking into account also \nthe provisions of General Assembly resolution ES-10/23 of 10 May 2024. \n\nA/C.2/80/L.13 \n \n25-16558\n2/9 \n \nfor financing for development, building on the 2015 Addis Ababa Action Agenda, to \nclose with urgency the estimated annual 4 trillion dollar financing gap, catalyse \nsustainable investments at scale in developing countries and reform the international \nfinancial architecture through continued and strong commitment to multilateralism, \ninternational cooperation, and global solidarity, \n \nWelcoming also the convening of the Summit of the Future on 22 and \n23 September 2024 at the United Nations Headquarters in New York at which \nresolution 79/1 entitled \u201cThe Pact for the Future\u201d and its annexes were adopted,  \n \nRecognizing the benefits of trade and the need to ensure that they are more \nwidely shared, \n \nReaffirming that it is fundamental, for fair, sound and robust competition and \nconsumer protection policies and enforcement, to maintain a robust, level playing \nfield and enhance transparency for all participants, so that market access is not under \nanti-competitive practices, \n \nReaffirming also World Trade Organization decision WT/MIN(15)/48-\nWT/L/982 of 19 December 2015 on the implementation of preferential treatment in \nfavour of services and service suppliers of the least developed countries and \nincreasing their participation in services trade and decision WT/L/508/Add.1 of \n25 July 2012 on accession by the least developed countries, encouraging progress on \nthe implementation of the World Trade Organization work programme on small \neconomies,1 which supports their efforts towards sustainable development, as also \nreflected in the outcome document of the Fourth International Conference on Small \nIsland Developing States, the Antigua and Barbuda Agenda for Small Island \nDeveloping States, 2  and stressing that Aid for Trade and targeted trade-related \ncapacity-building are essential to integrating developing countries, in particular the \nleast developed countries, landlocked developing countries and small island \ndeveloping States, into the international trading system, \n \nTaking note that the Thirteenth Ministerial Conference of the World Trade \nOrganization instructed the Committee on Trade and Development to hold focused \nsessions, to assess trade-related challenges identified for the fuller integration of \nlandlocked developing countries into the multilateral trading system, \n \nTaking note also of the decision of the Twelfth Ministerial Conference of the \nWorld Trade Organization for the Trade Facilitation Committee to hold a dedicated \nsession on transit issues annually until the next review of the Trade Facilitation \nAgreement is completed, and calling for the strengthening and continuation of those \nsessions, \n \nRecalling the ambition of landlocked developing countries to have a dedicated \nwork programme on their special needs under the auspices of the World Trade \nOrganization, \n \nRecognizing the critical role of women as workers, producers and traders and \nthe need to address their specific challenges in order to facilitate their full, equal and \nmeaningful participation in domestic, regional and international trade, \n \nRecognizing also that multilateral rules and disciplines are the best guarantee \nagainst protectionism and are fundamental to the transparency, predictability and \nstability of international trade, \n \nNoting the commitments to working to ensure that bilateral, regional and \nplurilateral trade agreements complement the multilateral trading system, recognizing \n__________________ \n \n1 World Trade Organization, document WT/MIN(24)/33-WT/L/1188. \n \n2  Resolution 78/317, annex. \n\nA/C.2/80/L.13\n \n3/9\n25-16558 \n \nthat they can play an important role in complementing global liberalization initiatives, \nand in this regard recalling, inter alia, the entry into force of the Agreement \nEstablishing the African Continental Free Trade Area, on 30 May 2019, and \nwelcoming ongoing efforts to fully operationalize the Agreement, including the \ncommencement of actual trading under the Agreement aimed at doubling intra-\nAfrican trade to deliver economic transformation and strengthen Africa\u2019s resilience, \nincluding food security and nutrition, coronavirus disease (COVID-19) recovery and \nachievement of the Sustainable Development Goals, \n \nNoting with concern the fragile and highly uncertain global socioeconomic \noutlook, geopolitical tensions and conflicts and current multiple crises, which \nincrease pressure on food, energy, finance and trade, affecting many countries around \nthe world and their ability to achieve the Sustainable Development Goals, \n \nAcknowledging the critical role of the inclusive and rules-based multilateral \ntrading system in supporting sustainable development, and recognizing that ensuring \npredictability in trade requires continued commitment by all members to uphold and \nstrengthen the multilateral framework embodied in the World Trade Organization, \nincluding by restoring and reforming its dispute settlement system, \n \nNoting with concern that developing countries are being pressed to undertake \ntariff reductions and provide greater market access on a non-reciprocal basis, while \nsimultaneously facing unjustifiably high tariffs and non-tariff barriers on their export \nproducts, stressing that such practices, applied in a unilateral and arbitrary manner, \nrun counter to the fundamental principles of the World Trade Organization and the \nrules-based multilateral trading system, and underscoring that these policies risk \nexacerbating \ninequalities, \ndistorting \ntrade \nflows \nand \nfostering \neconomic \nfragmentation and instability, \n \nEmphasizing that it is necessary and urgent to restore trade predictability \nthrough strengthened international cooperation, as well as the reliability of the rules-\nbased multilateral trading system as a driver of inclusive and sustainable \ndevelopment, \n \nDeeply concerned about the financial and technical challenges on commodity \nvalue chains, including in developing countries, caused by the impact of climate \nchange, including along the environmental, economic and social dimensions, \n \nDeeply concerned also about trade-restrictive measures imposed under the guise \nof environmental protection, as they hinder free and fair trade and violate the \nprinciples of nationally determined contributions and equity and common but \ndifferentiated responsibilities and respective capabilities, in the light of different \nnational circumstances, \n \nEmphasizing the need to strengthen trade capacities of developing countries and \ntheir ability to integrate into regional and global value chains in a very challenging \ncontext, \n \nReiterating the pledge that no one will be left behind, reaffirming the \nrecognition that the dignity of the human person is fundamental, and the wish to see \nthe Goals and targets met for all nations and peoples and for all segments of society, \nand recommitting to endeavour to reach the furthest behind first, \n \n1. \nTakes note of the report of the Trade and Development Board of the United \nNations Conference on Trade and Development 3 and the report of the Secretary-\nGeneral;4 \n__________________ \n \n3 A/80/15 (Part I), A/80/15 (Part II), A/80/15 (Part III) and A/80/15 (Part IV). \n \n4 A/80/268. \n\nA/C.2/80/L.13 \n \n25-16558\n4/9 \n \n \n2. \nReaffirms that international trade is an engine for inclusive growth and \npoverty eradication and that it contributes to the promotion of sustainable \ndevelopment, structural transformation and industrialization, particularly in \ndeveloping countries; \n \n3. \nUnderscores that a universal, rules-based, fair, open, transparent, \npredictable, inclusive, non-discriminatory and equitable multilateral trading system \nshould contribute to the achievement of the Sustainable Development Goals, \nproviding policy space for national development objectives, poverty eradication and \nsustainable development, consistent with relevant international rules and countries\u2019 \ncommitments, and promote export-led growth in the developing countries through, \ninter alia, preferential trade access for developing countries, targeted special and \ndifferential treatment that responds to the development needs of individual countries, \nand the elimination of trade barriers that are inconsistent with World Trade \nOrganization agreements; \n \n4. \nRecalls the ministerial decision of 7 December 2013 on duty-free and \nquota-free market access for least developed countries, 5 recognizes that nearly all \ndeveloped country members of the World Trade Organization provide either full or \nnearly full duty-free and quota-free market access to least developed country products \nand that a number of developing country members of the World Trade Organization \nalso grant a significant degree of duty-free and quota-free market access to least \ndeveloped country products, takes note of the adoption of trading arrangements that \nfurther extend preferential market access for the benefit of other developing States, \nand welcomes the ministerial decision6 that was adopted at the Thirteenth Ministerial \nConference of the World Trade Organization on 2 March 2024 on smooth transition \nsupport measures in favour of countries graduated from the least developed country \ncategory; \n \n5. \nReaffirms the commitment of the World Trade Organization members to \nwork towards urgent reform of the Organization, with the aim of improving all its \nfunctions, while reaffirming the foundational principles of the Organization, and to \naccelerate discussions with a view to having a fully and well-functioning dispute \nsettlement system accessible to all members without further delay, and for this reason \ncalls upon the members of the World Trade Organization to accelerate discussions in \nan inclusive and transparent manner, build on the progress already made, and work \non unresolved issues, while taking advantage of the available opportunities, \naddressing the challenges that the Organization is facing and ensuring the \nOrganization\u2019s proper functioning; the work shall be member-driven, open, \ntransparent, inclusive and must address the interests of all members, including \ndevelopment issues; \n \n6. \nAlso reaffirms that maintaining stable trade flows is essential to urgently \naddressing the multiple global crises, inter alia, of food, energy and finance faced by \ndeveloping countries, as well as enhancing food security and nutrition in these \ncountries; \n \n7. \nUnderscores the urgent need to keep markets, including for food, fertilizer \nand agriculture, open, equitable, transparent, non-discriminatory and predictable by \neliminating trade-restrictive measures and distortions, speculations and hoarding \nthrough the reform of the multilateral trade rules on agriculture, according to World \nTrade Organization mandates, and to ensure sustained food security and nutrition of \ncountries, particularly the least developed and net food-importing developing \ncountries; \n__________________ \n \n5 World Trade Organization, document WT/MIN(13)/44. \n \n6 World Trade Organization, document WT/MIN(24)/34. \n\nA/C.2/80/L.13\n \n5/9\n25-16558 \n \n \n8. \nEncourages cooperation among countries to improve agricultural \nproductivity and trade with a view to increasing the availability, accessibility and \naffordability of food to help address global food security; \n \n9. \nNotes with concern that certain forms of support for agricultural producers \nare either trade-distorting or harmful to nature and health, and reaffirms its \ncommitment to correct and prevent trade restrictions and distortions in world \nagricultural markets, including through the parallel elimination of all forms of \nagricultural export subsidies and all export measures with equivalent effect, \nhighlights the need to address trade-distorting domestic support in agriculture, and \nlooks forward to continuing the World Trade Organization negotiations consistent \nwith existing mandates to further reform agricultural trade rules, with a view to \nachieving concrete and positive results at the next Ministerial Conference; \n \n10. Stresses the continuing importance of the provision and mobilization of \nnew and additional means of implementation, such as climate finance, technology \ntransfer on mutually agreed terms and capacity-building to developing countries, for \nexpanding trade in renewable energy that can contribute to ensure access to \naffordable, reliable, sustainable and modern energy and in line with their national \ndevelopment priorities, including through making clean and renewable energy \ntechnologies available for all; \n \n11. \nRecognizes the increase in services trade as a portion of global economic \noutput, and its role in trade and employment as well as its contribution to global and \nregional connectivity and productivity growth, and in this respect underlines the \ncritical role of services, digitally enabled services and electronic commerce and \ncreative economy in sustainable development, and highlights the importance of \nsupporting developing countries, particularly the least developed countries, in taking \nadvantage of the sector\u2019s potential, including by addressing the digital divides and \nimproving data collection and regulatory capacities of services; and in this context \nalso recognizes the importance of plurilateral initiatives at the World Trade \nOrganization, which have been vital in driving concrete progress in key areas of trade; \n \n12. Urges the members of the World Trade Organization to reaffirm their \ncommitment to enhancing the participation of the least developed countries in global \nservices trade, including by the full and effective implementation of the services \nwaiver, formalized by a decision adopted at the 2011 Ministerial Conference,7 as a \nmeans of achieving this goal; \n \n13. Underscores the continuing need for international support to increase \neconomic resilience and diversification of commodity-dependent developing \ncountries in such a way that their structural transformation is sustainable and \neconomically meaningful; \n \n14. Calls upon Member States to take complementary actions at the national \nlevel to strengthen domestic enabling environments and implement sound domestic \npolicies and reforms conducive to realizing the potential of trade for inclusive growth \nand sustainable development; \n \n15. Notes the need to increase the added value and competitiveness of the \nexports of critical minerals and commodities of developing countries, and to support \ndomestic value addition and broad economic diversification close to source; \n \n16. Underlines that enlarging aggregate trade gains alone is insufficient to \nhelp countries to eliminate poverty, empower women or create jobs on a sustainable \nbasis, in order to reduce inequality within and among countries, and that trade must \n__________________ \n \n7 World Trade Organization, document WT/L/847. \n\nA/C.2/80/L.13 \n \n25-16558\n6/9 \n \nbe made more inclusive to benefit people and economic actors who tend to be \neconomically isolated or vulnerable; \n \n17. Calls for the development of additional and innovative instruments that \nsupport the integration of micro-, small and medium-sized enterprises in developing \ncountries into higher-value global value chains with a focus on financial inclusion \nthat ensures that trade benefits all; \n \n18. Reaffirms the importance of promoting regional economic integration of \ndeveloping countries to foster trade recovery and development, and in this regard \nwelcomes ongoing efforts to fully operationalize the Agreement Establishing the \nAfrican Continental Free Trade Area, including the commencement of actual trading \nunder the Agreement aimed at doubling intra-African trade to deliver economic \ntransformation and strengthen Africa\u2019s resilience, including food security and \nnutrition, and achievement of the Sustainable Development Goals, and notes the \nprogress made in the implementation of the Regional Comprehensive Economic \nPartnership Agreement; \n \n19. Reiterates that States will not be able to achieve the ambitious Goals and \ntargets of the 2030 Agenda for Sustainable Development 8 without a revitalized and \nenhanced global partnership and means of implementation and that a revitalized \nglobal partnership will facilitate an intensive global engagement in support of the \nimplementation of the 2030 Agenda, bringing together Governments, civil society, \nthe private sector, the United Nations system and other actors and mobilizing all \navailable resources; \n \n20. Welcomes the outcome document of the Fourth International Conference \non Financing for Development, the Sevilla Commitment, 9 and calls for its timely and \neffective implementation; \n \n21. Encourages the development and implementation of inclusive trade \npolicies that can contribute to advancing gender equality and women\u2019s economic \nempowerment, which has a positive impact on economic growth and contributes to \npoverty eradication; \n \n22. Recommits firmly to promoting a rules-based, non-discriminatory, open, \nfair, inclusive, equitable and transparent multilateral trading system, with the World \nTrade Organization at its core, as well as meaningful trade liberalization, and with a \nstrong development dimension in line with the 2030 Agenda for Sustainable \nDevelopment, while preserving the fundamental principles of the World Trade \nOrganization; \n \n23. Calls for strengthening competition and consumer protection laws, \npolicies and enforcement for open, fair, equitable, transparent, non-discriminatory \nand predictable markets, deepening international cooperation among competition \nauthorities in order to strengthen the effectiveness and efficiency of law enforcement \nagainst cross-border anti-competitive business practices, in accordance with the Set \nof Multilaterally Agreed Equitable Principles and Rules for the Control of Restrictive \nBusiness Practices, and among consumer protection authorities in order to strengthen \nthe effectiveness and efficiency of law enforcement against cross-border fraudulent \nand deceptive commercial practices, in accordance with the United Nations guidelines \nfor consumer protection; \n \n24. Looks forward to the convening of the Fourteenth Ministerial Conference \nof the World Trade Organization, to be held in Cameroon from 26 to 29 March 2026; \n__________________ \n \n8 Resolution 70/1. \n \n9 Resolution 79/323, annex. \n\nA/C.2/80/L.13\n \n7/9\n25-16558 \n \n \n25. Emphasizes the need to continue combating protectionism in all its forms \nand to rectify any trade-distorting measures, including unilateral ones, that are \ninconsistent with World Trade Organization rules, recognizing the right of countries, \nin particular developing countries, to fully utilize existing flexibilities consistent with \ntheir World Trade Organization commitments and obligations, and emphasizes that \nthe work of the World Trade Organization shall continue to promote sustainable \neconomic development, with provisions for special and differential treatment \nremaining an integral part of the World Trade Organization agreements which should \nbe reviewed with a view to being more precise, effective and operational; \n \n26. Recognizes that, beyond the multilateral trade rules, non-reciprocal trade \npreferences to developing countries, such as the Generalized System of Preferences, \nremain vital and should be expanded beyond tariff relief to address non-tariff barriers \nand provide real market access; \n \n27. Takes note with appreciation of the ministerial decision on the TRIPS \nAgreement that was adopted at the Twelfth Ministerial Conference of the World Trade \nOrganization to authorize the use of the subject matter of a patent required for the \nproduction and supply of COVID-19 vaccines without the consent of the right holder \nto the extent necessary to address the COVID-19 pandemic, in accordance with the \nprovisions of article 31 of the TRIPS Agreement,10 and regrets the lack of agreement \nto take a decision on the extension of the ministerial decision to cover the production \nand supply of COVID-19 diagnostics and therapeutics, despite the call in paragraph \n8 of the ministerial decision on the TRIPS Agreement for World Trade Organization \nmembers to reach a decision on this matter no later than six months from the date of \nthe decision; \n \n28. Calls for enhancing the capacity of the multilateral trading system, with \nthe World Trade Organization at its core, to increase pandemic and disaster \npreparedness and resilience through a multifaceted response, including through \npartnership with the United Nations Conference on Trade and Development and the \nInternational Trade Centre, and including by strengthening the resilience of global \nsupply chains, including short-term measures such as trade facilitation, transparency \nand restraint in relation to export restrictions on vaccines, therapeutics and \ndiagnostics supplies, as well as the rapid scaling up and expansion of vaccine \nproduction globally, including in developing countries, and recalls the ministerial \ndeclaration on the World Trade Organization response to the COVID-19 pandemic \nand preparedness for future pandemics, adopted on 17 June 2022; 11 \n \n29. Recalls the decision at the Twelfth Ministerial Conference of the World \nTrade Organization not to impose export restrictions on foodstuffs purchased for \nnon-commercial humanitarian purposes by the World Food Programme; 12 \n \n30. Takes note of the dedicated work programme undertaken in the World \nTrade Organization as provided for in the ministerial declaration on the emergency \nresponse to food insecurity to examine how the Marrakesh Ministerial Decision on \nMeasures Concerning the Possible Negative Effects of the Reform Programme on \nLeast Developed and Net Food-Importing Developing Countries 13 could be made \nmore effective and operational and consider the needs of least developed and net food-\nimporting developing countries to increase their resilience in responding to acute food \n__________________ \n \n10 See World Trade Organization, ministerial decision on the TRIPS Agreement (WT/MIN(22)/30), \nadopted on 17 June 2022. \n \n11 World Trade Organization, document WT/MIN(22)/31. \n \n12 See World Trade Organization, ministerial decision on World Food Programme food purchases \nexemption from export prohibitions or restrictions (WT/MIN(22)/29), adopted on 17 June 2022. \n \n13 See World Trade Organization, ministerial declaration on the emergency response to food \ninsecurity (WT/MIN(22)/28), adopted on 17 June 2022. \n\nA/C.2/80/L.13 \n \n25-16558\n8/9 \n \ninstability, bolster their agricultural production and enhance their domestic food \nsecurity; \n \n31. Underlines that any emergency measures introduced to address food \nsecurity concerns shall minimize trade distortions as far as possible, be temporary, \ntargeted, transparent and be notified and implemented in accordance with World \nTrade Organization rules, and underscores that particular regard should be given to \nthe effect that such measures have on developing countries, including the least \ndeveloped and net food-importing developing countries; \n \n32. Welcomes the entry into force of the World Trade Organization Agreement \non Fisheries Subsidies 14 among accepting World Trade Organization members on \n15 September 2025, having reached the required threshold of two-thirds of members \nformally accepting the agreement, urges members of the World Trade Organization \nthat have not yet done so to promptly accept the Agreement, and encourages the \nmembers of the World Trade Organization to finalize negotiations on outstanding \nissues and achieve a comprehensive agreement on fisheries subsidies, including \nthrough further disciplines on certain forms of fisheries subsidies that contribute to \novercapacity and overfishing, recognizing that appropriate and effective special and \ndifferential treatment for developing country members and least developed country \nmembers should be an integral part of these negotiations; \n \n33. Underlines the importance of the Agreement on Trade Facilitation annexed \nto the Protocol amending the Marrakesh Agreement Establishing the World Trade \nOrganization in improving transparency, expediting the movement, release and \nclearance of goods, including goods in transit, and thereby reducing trade costs, and \nin this regard encourages its full and effective implementation, including through \nenhanced support towards its implementation; \n \n34. Urges the international community to adopt urgent and effective measures \nto eliminate the use of unilateral economic, financial or trade measures that are not \nauthorized by relevant organs of the United Nations, and that are inconsistent with \nthe principles of international law or the Charter of the United Nations or that \ncontravene the basic principles of the multilateral trading system and that affect, in \nparticular, but not exclusively, developing countries; \n \n35. Notes that the use of policy instruments for environmental purposes with \npotential impact on international trade can have unintended consequences for partner \ncountries, especially the least developed countries, which need to be addressed to aid \ntheir pursuit of structural transformation and economic diversification; \n \n36. Emphasizes that, in line with the spirit of World Trade Organization \nagreements, trade-related environmental measures can best contribute to sustainable \ndevelopment, including environmental sustainability, by improving market access \nconditions and facilitating trade and investment, thus providing new market \nopportunities and incentives for sustainably produced products through trade policies, \nrather than by imposing barriers to trade; \n \n37. Expresses deep concern regarding unilateral protectionist measures taken \nby some trade partners that would constitute a means of arbitrary or unjustifiable \ndiscrimination between countries or a disguised restriction on international trade, \nincluding unilateral and discriminatory border adjustment mechanisms and taxes; \n \n38. Stresses the importance of article 3.5 of the United Nations Framework \nConvention on Climate Change15 and article 4.15 of the Paris Agreement,16 in this \n__________________ \n \n14  World Trade Organization, document WT/MIN(22)/W/22. \n \n15 United Nations, Treaty Series, vol. 1771, No. 30822. \n \n16 See FCCC/CP/2015/10/Add.1, decision 1/CP.21, annex. \n\nA/C.2/80/L.13\n \n9/9\n25-16558 \n \nregard welcomes the recognition, in the global stocktake at the twenty-eighth session \nof the Conference of the Parties to the United Nations Framework Convention on \nClimate Change, that measures taken to combat climate change, including unilateral \nones, should not constitute a means of arbitrary or unjustifiable discrimination or a \ndisguised restriction on international trade, and calls upon Parties to reconsider such \nmeasures and suspend their implementation; \n \n39. Welcomes efforts to enhance South-South and triangular trade cooperation \nunder interregional trade arrangements, such as the Global System of Trade \nPreferences among Developing Countries, as a vehicle to support export \ndiversification, economic resilience and technological upgrading; \n \n40. Reiterates the important role of the United Nations Conference on Trade \nand Development as the focal point within the United Nations system for the \nintegrated treatment of trade and development and interrelated issues in the areas of \nfinance, technology, investment and sustainable development, and in contributing to \nsupporting the implementation of the 2030 Agenda; \n41. \nReaffirms the fundamental role that competition and consumer protection \nlaws, policies and enforcement can play for strong economic development and the \nusefulness of the Set of Multilaterally Agreed Equitable Principles and Rules for the \nControl of Restrictive Business Practices and the United Nations guidelines for \nconsumer protection, as well as the important and useful role that the United Nations \nConference on Trade and Development plays in this field; \n \n42. Takes note of the report of the Ninth United Nations Conference to Review \nAll Aspects of the Set of Multilaterally Agreed Equitable Principles and Rules for the \nControl of Restrictive Business Practices,17 held from 7 to 11 July 2025 in Geneva, \nand, in line with the recommendations contained therein, decides to rename the \nConference as the United Nations Conference on Competition and Consumer \nProtection, and also decides to convene the Tenth United Nations Conference on \nCompetition and Consumer Protection, to be held under the auspices of the United \nNations Conference on Trade and Development in 2030; \n \n43. Welcomes the convening of the sixteenth session of the United Nations \nConference on Trade and Development, from 20 to 23 October 2025 in Geneva;  \n \n44. Reaffirms the commitment at the very heart of the 2030 Agenda to leave \nno one behind and commit to taking more tangible steps to support people in \nvulnerable situations and the most vulnerable countries and to reach the furthest \nbehind first; \n \n45. Requests the Secretary-General, in collaboration with the secretariat of the \nUnited Nations Conference on Trade and Development, to submit to the General \nAssembly at its eighty-first session a report on the implementation of the present \nresolution and developments in the international trading system, and decides to \ninclude in the provisional agenda of its eighty-first session, under the item entitled \n\u201cMacroeconomic policy questions\u201d, the sub-item entitled \u201cInternational trade and \ndevelopment\u201d. \n \n__________________ \n \n17 TD/RBP/CONF.10/7. \n",
  "paragraphs": {
    "1": "Takes note of the report of the Trade and Development Board of the United Nations Conference on Trade and Development 3 and the report of the Secretary- General;4 __________________ 3 A/80/15 (Part I), A/80/15 (Part II), A/80/15 (Part III) and A/80/15 (Part IV). 4 A/80/268. A/C.2/80/L.13 25-16558 4/9",
    "2": "Reaffirms that international trade is an engine for inclusive growth and poverty eradication and that it contributes to the promotion of sustainable development, structural transformation and industrialization, particularly in developing countries;",
    "3": "Underscores that a universal, rules-based, fair, open, transparent, predictable, inclusive, non-discriminatory and equitable multilateral trading system should contribute to the achievement of the Sustainable Development Goals, providing policy space for national development objectives, poverty eradication and sustainable development, consistent with relevant international rules and countries\u2019 commitments, and promote export-led growth in the developing countries through, inter alia, preferential trade access for developing countries, targeted special and differential treatment that responds to the development needs of individual countries, and the elimination of trade barriers that are inconsistent with World Trade Organization agreements;",
    "4": "Recalls the ministerial decision of 7 December 2013 on duty-free and quota-free market access for least developed countries, 5 recognizes that nearly all developed country members of the World Trade Organization provide either full or nearly full duty-free and quota-free market access to least developed country products and that a number of developing country members of the World Trade Organization also grant a significant degree of duty-free and quota-free market access to least developed country products, takes note of the adoption of trading arrangements that further extend preferential market access for the benefit of other developing States, and welcomes the ministerial decision6 that was adopted at the Thirteenth Ministerial Conference of the World Trade Organization on 2 March 2024 on smooth transition support measures in favour of countries graduated from the least developed country category;",
    "5": "Reaffirms the commitment of the World Trade Organization members to work towards urgent reform of the Organization, with the aim of improving all its functions, while reaffirming the foundational principles of the Organization, and to accelerate discussions with a view to having a fully and well-functioning dispute settlement system accessible to all members without further delay, and for this reason calls upon the members of the World Trade Organization to accelerate discussions in an inclusive and transparent manner, build on the progress already made, and work on unresolved issues, while taking advantage of the available opportunities, addressing the challenges that the Organization is facing and ensuring the Organization\u2019s proper functioning; the work shall be member-driven, open, transparent, inclusive and must address the interests of all members, including development issues;",
    "6": "Also reaffirms that maintaining stable trade flows is essential to urgently addressing the multiple global crises, inter alia, of food, energy and finance faced by developing countries, as well as enhancing food security and nutrition in these countries;",
    "7": "Underscores the urgent need to keep markets, including for food, fertilizer and agriculture, open, equitable, transparent, non-discriminatory and predictable by eliminating trade-restrictive measures and distortions, speculations and hoarding through the reform of the multilateral trade rules on agriculture, according to World Trade Organization mandates, and to ensure sustained food security and nutrition of countries, particularly the least developed and net food-importing developing countries; __________________ 5 World Trade Organization, document WT/MIN(13)/44. 6 World Trade Organization, document WT/MIN(24)/34. A/C.2/80/L.13 5/9 25-16558",
    "8": "Encourages cooperation among countries to improve agricultural productivity and trade with a view to increasing the availability, accessibility and affordability of food to help address global food security;",
    "9": "Notes with concern that certain forms of support for agricultural producers are either trade-distorting or harmful to nature and health, and reaffirms its commitment to correct and prevent trade restrictions and distortions in world agricultural markets, including through the parallel elimination of all forms of agricultural export subsidies and all export measures with equivalent effect, highlights the need to address trade-distorting domestic support in agriculture, and looks forward to continuing the World Trade Organization negotiations consistent with existing mandates to further reform agricultural trade rules, with a view to achieving concrete and positive results at the next Ministerial Conference;",
    "10": "Stresses the continuing importance of the provision and mobilization of new and additional means of implementation, such as climate finance, technology transfer on mutually agreed terms and capacity-building to developing countries, for expanding trade in renewable energy that can contribute to ensure access to affordable, reliable, sustainable and modern energy and in line with their national development priorities, including through making clean and renewable energy technologies available for all;",
    "11": "Recognizes the increase in services trade as a portion of global economic output, and its role in trade and employment as well as its contribution to global and regional connectivity and productivity growth, and in this respect underlines the critical role of services, digitally enabled services and electronic commerce and creative economy in sustainable development, and highlights the importance of supporting developing countries, particularly the least developed countries, in taking advantage of the sector\u2019s potential, including by addressing the digital divides and improving data collection and regulatory capacities of services; and in this context also recognizes the importance of plurilateral initiatives at the World Trade Organization, which have been vital in driving concrete progress in key areas of trade;",
    "12": "Urges the members of the World Trade Organization to reaffirm their commitment to enhancing the participation of the least developed countries in global services trade, including by the full and effective implementation of the services waiver, formalized by a decision adopted at the 2011 Ministerial Conference,7 as a means of achieving this goal;",
    "13": "Underscores the continuing need for international support to increase economic resilience and diversification of commodity-dependent developing countries in such a way that their structural transformation is sustainable and economically meaningful;",
    "14": "Calls upon Member States to take complementary actions at the national level to strengthen domestic enabling environments and implement sound domestic policies and reforms conducive to realizing the potential of trade for inclusive growth and sustainable development;",
    "15": "Notes the need to increase the added value and competitiveness of the exports of critical minerals and commodities of developing countries, and to support domestic value addition and broad economic diversification close to source;",
    "16": "Underlines that enlarging aggregate trade gains alone is insufficient to help countries to eliminate poverty, empower women or create jobs on a sustainable basis, in order to reduce inequality within and among countries, and that trade must __________________ 7 World Trade Organization, document WT/L/847. A/C.2/80/L.13 25-16558 6/9 be made more inclusive to benefit people and economic actors who tend to be economically isolated or vulnerable;",
    "17": "Calls for the development of additional and innovative instruments that support the integration of micro-, small and medium-sized enterprises in developing countries into higher-value global value chains with a focus on financial inclusion that ensures that trade benefits all;",
    "18": "Reaffirms the importance of promoting regional economic integration of developing countries to foster trade recovery and development, and in this regard welcomes ongoing efforts to fully operationalize the Agreement Establishing the African Continental Free Trade Area, including the commencement of actual trading under the Agreement aimed at doubling intra-African trade to deliver economic transformation and strengthen Africa\u2019s resilience, including food security and nutrition, and achievement of the Sustainable Development Goals, and notes the progress made in the implementation of the Regional Comprehensive Economic Partnership Agreement;",
    "19": "Reiterates that States will not be able to achieve the ambitious Goals and targets of the 2030 Agenda for Sustainable Development 8 without a revitalized and enhanced global partnership and means of implementation and that a revitalized global partnership will facilitate an intensive global engagement in support of the implementation of the 2030 Agenda, bringing together Governments, civil society, the private sector, the United Nations system and other actors and mobilizing all available resources;",
    "20": "Welcomes the outcome document of the Fourth International Conference on Financing for Development, the Sevilla Commitment, 9 and calls for its timely and effective implementation;",
    "21": "Encourages the development and implementation of inclusive trade policies that can contribute to advancing gender equality and women\u2019s economic empowerment, which has a positive impact on economic growth and contributes to poverty eradication;",
    "22": "Recommits firmly to promoting a rules-based, non-discriminatory, open, fair, inclusive, equitable and transparent multilateral trading system, with the World Trade Organization at its core, as well as meaningful trade liberalization, and with a strong development dimension in line with the 2030 Agenda for Sustainable Development, while preserving the fundamental principles of the World Trade Organization;",
    "23": "Calls for strengthening competition and consumer protection laws, policies and enforcement for open, fair, equitable, transparent, non-discriminatory and predictable markets, deepening international cooperation among competition authorities in order to strengthen the effectiveness and efficiency of law enforcement against cross-border anti-competitive business practices, in accordance with the Set of Multilaterally Agreed Equitable Principles and Rules for the Control of Restrictive Business Practices, and among consumer protection authorities in order to strengthen the effectiveness and efficiency of law enforcement against cross-border fraudulent and deceptive commercial practices, in accordance with the United Nations guidelines for consumer protection;",
    "24": "Looks forward to the convening of the Fourteenth Ministerial Conference of the World Trade Organization, to be held in Cameroon from 26 to 29 March 2026; __________________ 8 Resolution 70/1. 9 Resolution 79/323, annex. A/C.2/80/L.13 7/9 25-16558",
    "25": "Emphasizes the need to continue combating protectionism in all its forms and to rectify any trade-distorting measures, including unilateral ones, that are inconsistent with World Trade Organization rules, recognizing the right of countries, in particular developing countries, to fully utilize existing flexibilities consistent with their World Trade Organization commitments and obligations, and emphasizes that the work of the World Trade Organization shall continue to promote sustainable economic development, with provisions for special and differential treatment remaining an integral part of the World Trade Organization agreements which should be reviewed with a view to being more precise, effective and operational;",
    "26": "Recognizes that, beyond the multilateral trade rules, non-reciprocal trade preferences to developing countries, such as the Generalized System of Preferences, remain vital and should be expanded beyond tariff relief to address non-tariff barriers and provide real market access;",
    "27": "Takes note with appreciation of the ministerial decision on the TRIPS Agreement that was adopted at the Twelfth Ministerial Conference of the World Trade Organization to authorize the use of the subject matter of a patent required for the production and supply of COVID-19 vaccines without the consent of the right holder to the extent necessary to address the COVID-19 pandemic, in accordance with the provisions of article 31 of the TRIPS Agreement,10 and regrets the lack of agreement to take a decision on the extension of the ministerial decision to cover the production and supply of COVID-19 diagnostics and therapeutics, despite the call in paragraph 8 of the ministerial decision on the TRIPS Agreement for World Trade Organization members to reach a decision on this matter no later than six months from the date of the decision;",
    "28": "Calls for enhancing the capacity of the multilateral trading system, with the World Trade Organization at its core, to increase pandemic and disaster preparedness and resilience through a multifaceted response, including through partnership with the United Nations Conference on Trade and Development and the International Trade Centre, and including by strengthening the resilience of global supply chains, including short-term measures such as trade facilitation, transparency and restraint in relation to export restrictions on vaccines, therapeutics and diagnostics supplies, as well as the rapid scaling up and expansion of vaccine production globally, including in developing countries, and recalls the ministerial declaration on the World Trade Organization response to the COVID-19 pandemic and preparedness for future pandemics, adopted on 17 June 2022; 11",
    "29": "Recalls the decision at the Twelfth Ministerial Conference of the World Trade Organization not to impose export restrictions on foodstuffs purchased for non-commercial humanitarian purposes by the World Food Programme; 12",
    "30": "Takes note of the dedicated work programme undertaken in the World Trade Organization as provided for in the ministerial declaration on the emergency response to food insecurity to examine how the Marrakesh Ministerial Decision on Measures Concerning the Possible Negative Effects of the Reform Programme on Least Developed and Net Food-Importing Developing Countries 13 could be made more effective and operational and consider the needs of least developed and net food- importing developing countries to increase their resilience in responding to acute food __________________ 10 See World Trade Organization, ministerial decision on the TRIPS Agreement (WT/MIN(22)/30), adopted on 17 June 2022. 11 World Trade Organization, document WT/MIN(22)/31. 12 See World Trade Organization, ministerial decision on World Food Programme food purchases exemption from export prohibitions or restrictions (WT/MIN(22)/29), adopted on 17 June 2022. 13 See World Trade Organization, ministerial declaration on the emergency response to food insecurity (WT/MIN(22)/28), adopted on 17 June 2022. A/C.2/80/L.13 25-16558 8/9 instability, bolster their agricultural production and enhance their domestic food security;",
    "31": "Underlines that any emergency measures introduced to address food security concerns shall minimize trade distortions as far as possible, be temporary, targeted, transparent and be notified and implemented in accordance with World Trade Organization rules, and underscores that particular regard should be given to the effect that such measures have on developing countries, including the least developed and net food-importing developing countries;",
    "32": "Welcomes the entry into force of the World Trade Organization Agreement on Fisheries Subsidies 14 among accepting World Trade Organization members on 15 September 2025, having reached the required threshold of two-thirds of members formally accepting the agreement, urges members of the World Trade Organization that have not yet done so to promptly accept the Agreement, and encourages the members of the World Trade Organization to finalize negotiations on outstanding issues and achieve a comprehensive agreement on fisheries subsidies, including through further disciplines on certain forms of fisheries subsidies that contribute to overcapacity and overfishing, recognizing that appropriate and effective special and differential treatment for developing country members and least developed country members should be an integral part of these negotiations;",
    "33": "Underlines the importance of the Agreement on Trade Facilitation annexed to the Protocol amending the Marrakesh Agreement Establishing the World Trade Organization in improving transparency, expediting the movement, release and clearance of goods, including goods in transit, and thereby reducing trade costs, and in this regard encourages its full and effective implementation, including through enhanced support towards its implementation;",
    "34": "Urges the international community to adopt urgent and effective measures to eliminate the use of unilateral economic, financial or trade measures that are not authorized by relevant organs of the United Nations, and that are inconsistent with the principles of international law or the Charter of the United Nations or that contravene the basic principles of the multilateral trading system and that affect, in particular, but not exclusively, developing countries;",
    "35": "Notes that the use of policy instruments for environmental purposes with potential impact on international trade can have unintended consequences for partner countries, especially the least developed countries, which need to be addressed to aid their pursuit of structural transformation and economic diversification;",
    "36": "Emphasizes that, in line with the spirit of World Trade Organization agreements, trade-related environmental measures can best contribute to sustainable development, including environmental sustainability, by improving market access conditions and facilitating trade and investment, thus providing new market opportunities and incentives for sustainably produced products through trade policies, rather than by imposing barriers to trade;",
    "37": "Expresses deep concern regarding unilateral protectionist measures taken by some trade partners that would constitute a means of arbitrary or unjustifiable discrimination between countries or a disguised restriction on international trade, including unilateral and discriminatory border adjustment mechanisms and taxes;",
    "38": "Stresses the importance of article 3.5 of the United Nations Framework Convention on Climate Change15 and article 4.15 of the Paris Agreement,16 in this __________________ 14 World Trade Organization, document WT/MIN(22)/W/22. 15 United Nations, Treaty Series, vol. 1771, No. 30822. 16 See FCCC/CP/2015/10/Add.1, decision 1/CP.21, annex. A/C.2/80/L.13 9/9 25-16558 regard welcomes the recognition, in the global stocktake at the twenty-eighth session of the Conference of the Parties to the United Nations Framework Convention on Climate Change, that measures taken to combat climate change, including unilateral ones, should not constitute a means of arbitrary or unjustifiable discrimination or a disguised restriction on international trade, and calls upon Parties to reconsider such measures and suspend their implementation;",
    "39": "Welcomes efforts to enhance South-South and triangular trade cooperation under interregional trade arrangements, such as the Global System of Trade Preferences among Developing Countries, as a vehicle to support export diversification, economic resilience and technological upgrading;",
    "40": "Reiterates the important role of the United Nations Conference on Trade and Development as the focal point within the United Nations system for the integrated treatment of trade and development and interrelated issues in the areas of finance, technology, investment and sustainable development, and in contributing to supporting the implementation of the 2030 Agenda;",
    "41": "Reaffirms the fundamental role that competition and consumer protection laws, policies and enforcement can play for strong economic development and the usefulness of the Set of Multilaterally Agreed Equitable Principles and Rules for the Control of Restrictive Business Practices and the United Nations guidelines for consumer protection, as well as the important and useful role that the United Nations Conference on Trade and Development plays in this field;",
    "42": "Takes note of the report of the Ninth United Nations Conference to Review All Aspects of the Set of Multilaterally Agreed Equitable Principles and Rules for the Control of Restrictive Business Practices,17 held from 7 to 11 July 2025 in Geneva, and, in line with the recommendations contained therein, decides to rename the Conference as the United Nations Conference on Competition and Consumer Protection, and also decides to convene the Tenth United Nations Conference on Competition and Consumer Protection, to be held under the auspices of the United Nations Conference on Trade and Development in 2030;",
    "43": "Welcomes the convening of the sixteenth session of the United Nations Conference on Trade and Development, from 20 to 23 October 2025 in Geneva;",
    "44": "Reaffirms the commitment at the very heart of the 2030 Agenda to leave no one behind and commit to taking more tangible steps to support people in vulnerable situations and the most vulnerable countries and to reach the furthest behind first;",
    "45": "Requests the Secretary-General, in collaboration with the secretariat of the United Nations Conference on Trade and Development, to submit to the General Assembly at its eighty-first session a report on the implementation of the present resolution and developments in the international trading system, and decides to include in the provisional agenda of its eighty-first session, under the item entitled \u201cMacroeconomic policy questions\u201d, the sub-item entitled \u201cInternational trade and development\u201d. __________________ 17 TD/RBP/CONF.10/7."
  },
  "agenda_items": [
    "Item 16"
  ],
  "symbol_references": [
    "A/C.2/80/L.13"
  ]
}