{
  "symbol": "A/C.6/80/L.5",
  "filename": "A_C.6_80_L.5.pdf",
  "title": "Observer status for the Climate Vulnerable Forum in the",
  "text": "United Nations \nA/C.6/80/L.5 \n \n \nGeneral Assembly \nDistr.: Limited \n8 October 2025 \nOriginal: English \n \n25-16083 (E)    101025 \n*2516083* \n \n \nEightieth session \nSixth Committee \nAgenda item 176 \nObserver status for the Climate Vulnerable Forum \nin the General Assembly \n \n \n \n \n \nBarbados, Burkina Faso and Ghana: draft resolution \n \n \n \n Observer status for the Climate Vulnerable Forum in the \nGeneral Assembly \n \n \n \nThe General Assembly, \n \nWishing to promote cooperation between the United Nations and the Climate \nVulnerable Forum, \n \n1. \nDecides to invite the Climate Vulnerable Forum to participate in the \nsessions and the work of the General Assembly in the capacity of observer; \n \n2. \nRequests the Secretary-General to take the action necessary to implement \nthe present resolution. \n \n",
  "paragraphs": {
    "1": "Decides to invite the Climate Vulnerable Forum to participate in the sessions and the work of the General Assembly in the capacity of observer;",
    "2": "Requests the Secretary-General to take the action necessary to implement the present resolution."
  },
  "agenda_items": [
    "Item 176"
  ],
  "symbol_references": [
    "A/C.6/80/L.5"
  ]
}