{
  "symbol": "A/C.5/80/L.13",
  "filename": "A_C.5_80_L.13.pdf",
  "title": "informal consultations",
  "text": "United Nations \nA/C.5/80/L.13\n \n \nGeneral Assembly \nDistr.: Limited \n22 December 2025 \nOriginal: English \n \n25-20999 (E)    301225 \n*2520999* \n \n \nEightieth session \nFifth Committee \nAgenda item 147 \nFinancing of the International Residual Mechanism \nfor Criminal Tribunals \n \n \n \n \n \nDraft resolution submitted by the Chair of the Committee following \ninformal consultations  \n \n \n \n Financing of the International Residual Mechanism for \nCriminal Tribunals  \n \n \n \nThe General Assembly, \n \nHaving considered the reports of the Secretary-General on the budget \nperformance for 2024 and the proposed budget for 2026,1 the financial report and \naudited financial statements for the year ended 31 December 2024 and the report of \nthe Board of Auditors on the International Residual Mechanism for Criminal \nTribunals2 and the recommendations contained therein, as well as the related report \nof the Advisory Committee on Administrative and Budgetary Questions, 3 \n \nRecalling its resolution 66/240 A of 24 December 2011 on the financing of the \nInternational Residual Mechanism for Criminal Tribunals and its subsequent \nresolutions thereon, the latest of which was resolution 79/255 of 24 December 2024,  \n \n1. \nTakes note of the reports of the Secretary-General;  \n \n2. \nEndorses the conclusions and recommendations contained in the report of \nthe Advisory Committee on Administrative and Budgetary Questions;  \n \n3. \nDecides to appropriate to the special account for the International Residual \nMechanism for Criminal Tribunals a total amount of 56,126,600 United States dollars \ngross (51,268,200 dollars net) for the Mechanism for 2026, as detailed in annex I to \nthe present resolution;  \n \n4. \nAlso decides to apportion the amount of 28,063,300 dollars gross \n(25,634,100 dollars net) among Member States in accordance with the scale of \nassessments applicable to the regular budget of the United Nations for 2026; \n__________________ \n \n1  A/80/412, A/80/412/Corr.1 and A/80/505. \n \n2  Official Records of the General Assembly, Eightieth Session, Supplement No. 5O (A/80/5/Add.15). \n \n3  A/80/570. \n\nA/C.5/80/L.13 \n \n25-20999\n2/3 \n \n \n5. \nFurther decides to apportion the amount of 28,063,300 dollars gross \n(25,634,100 dollars net) among Member States in accordance with the scale of \nassessments applicable to peacekeeping operations of the United Nations for 2026; \n \n6. \nDecides that, in accordance with the provisions of its resolution 973 (X) \nof 15 December 1955, there shall be set off against the apportionment among Member \nStates, as provided for in paragraphs 4 and 5 above, their respective share in the Tax \nEqualization Fund of the estimated staff assessment income in the amount of \n4,858,400 dollars approved for the Mechanism for 2026; \n \n7. \nAlso decides, in accordance with paragraph 4 of its resolution 80/____ of __ \nDecember 2025 on the financial performance report on the programme budget for 2024, \nthat there shall be a credit to Member States for their respective share of the credit of \n8,898,000 dollars gross (9,756,600 dollars net), as reflected in the financial performance \nreport on the budget of the International Residual Mechanism for Criminal Tribunals for \n20244 and detailed in annex II to the present resolution: \n \n(a) \nFor Member States that have fulfilled their financial obligations to the \nInternational Residual Mechanism for Criminal Tribunals, as an offset against their \nassessment for 2026; \n \n(b) \nFor Member States that have not fulfilled their financial obligations to the \nInternational Residual Mechanism for Criminal Tribunals, as an offset against their \narrears. \n \n \n \nAnnex I \n \n \nFinancing for 2026 of the International Residual Mechanism for Criminal Tribunals \n \n \nGross \nNet of staff \nassessment \n(United States dollars) \nEstimated appropriation for 2026a \n56 234 300 \n51 375 900 \nRecommendations of the Advisory Committee on Administrative \nand Budgetary Questions  \n(107 700) \n(107 700) \nRecommendations of the Fifth Committee \n\u2013 \n\u2013 \nAppropriation for 2026 \n56 126 600 \n51 268 200 \nOf which: \n \n \nContributions apportioned to Member States in accordance with \nthe scale of assessments applicable to the regular budget of the \nUnited Nations for 2026 \n28 063 300 \n25 634 100 \nContributions apportioned to Member States in accordance with \nthe scale of assessments applicable to peacekeeping operations of \nthe United Nations for 2026 \n28 063 300 \n25 634 100 \n \n \na  See A/80/505. \n \n \n__________________ \n \n4  A/80/412 and A/80/412/Corr.1. \n\nA/C.5/80/L.13\n \n3/3\n25-20999 \n \n \n \nAnnex II \n \n \nCredits reported in the financial performance report for 2024 \n \n \nGross \nNet of staff \nassessment \n(United States dollars) \nCancellation of commitments for the year 2023, and \nother revenue \n(8 894 000) \n(8 894 000) \nSurplus resulting from the final expenditure for the \nbudget for the year 2024  \n(4 000) \n(862 600) \nTotal credits reported in the financial \nperformance report for 2024 \n8 898 000 \n9 756 600 \n \n",
  "paragraphs": {
    "1": "Takes note of the reports of the Secretary-General;",
    "2": "Endorses the conclusions and recommendations contained in the report of the Advisory Committee on Administrative and Budgetary Questions;",
    "3": "Decides to appropriate to the special account for the International Residual Mechanism for Criminal Tribunals a total amount of 56,126,600 United States dollars gross (51,268,200 dollars net) for the Mechanism for 2026, as detailed in annex I to the present resolution;",
    "4": "Also decides to apportion the amount of 28,063,300 dollars gross (25,634,100 dollars net) among Member States in accordance with the scale of assessments applicable to the regular budget of the United Nations for 2026;",
    "5": "Further decides to apportion the amount of 28,063,300 dollars gross (25,634,100 dollars net) among Member States in accordance with the scale of assessments applicable to peacekeeping operations of the United Nations for 2026;",
    "6": "Decides that, in accordance with the provisions of its resolution 973 (X) of 15 December 1955, there shall be set off against the apportionment among Member States, as provided for in paragraphs 4 and 5 above, their respective share in the Tax Equalization Fund of the estimated staff assessment income in the amount of 4,858,400 dollars approved for the Mechanism for 2026;",
    "7": "Also decides, in accordance with paragraph 4 of its resolution 80/ Annex II Credits reported in the financial performance report for 2024 Gross Net of staff assessment (United States dollars) Cancellation of commitments for the year 2023, and other revenue (8 894 000) (8 894 000) Surplus resulting from the final expenditure for the budget for the year 2024 (4 000) (862 600) Total credits reported in the financial performance report for 2024 8 898 000 9 756 600"
  },
  "agenda_items": [
    "Item 147"
  ],
  "symbol_references": [
    "A/C.5/80/L.13"
  ]
}