{
  "symbol": "A/C.2/80/L.58",
  "filename": "A_C.2_80_L.58.pdf",
  "title": "Information and communications technologies for sustainable development",
  "text": "United Nations \nA/C.2/80/L.58\n \n \nGeneral Assembly \nDistr.: Limited \n18 November 2025 \nOriginal: English \n \n25-18777 (E)    251125 \n*2518777* \n \n \n \nEightieth session \nSecond Committee \nAgenda item 15 \nInformation and communications technologies for \nsustainable development \n \n \n \n \n \nDraft resolution submitted by the Vice-Chair of the Committee, Jenni Mikkola \n(Finland), on the basis of informal consultations on draft resolution A/C.2/80/L.17 \n \n \n \n Information and communications technologies for \nsustainable development \n \n \n \nThe General Assembly,  \n \nRecalling its resolution 79/194 of 19 December 2024 on information and \ncommunications technologies for sustainable development, as well as previous \nresolutions on the issue,1  \n \nRecalling also Economic and Social Council resolution 2025/18 of 29 July 2025 \non the assessment of the progress made in the implementation of and follow-up to the \noutcomes of the World Summit on the Information Society, as well as previous \nresolutions on the issue,2  \n \nReaffirming its resolution 70/1 of 25 September 2015, entitled \u201cTransforming \nour world: the 2030 Agenda for Sustainable Development\u201d, in which it adopted a \ncomprehensive, far-reaching and people-centred set of universal and transformative \nSustainable Development Goals and targets, its commitment to working tirelessly for \nthe full implementation of the Agenda by 2030, its recognition that eradicating \npoverty in all its forms and dimensions, including extreme poverty, is the greatest \nglobal challenge and an indispensable requirement for sustainable development, its \ncommitment to achieving sustainable development in its three dimensions \u2013 \neconomic, social and environmental \u2013 in a balanced and integrated manner, and to \nbuilding upon the achievements of the Millennium Development Goals and seeking \nto address their unfinished business,  \n__________________ \n \n1  Resolutions 56/183, 57/238, 59/220, 60/252, 62/182, 63/202, 64/187, 65/141, 66/184, 67/195, \n68/198, 69/204, 70/184, 71/212, 72/200, 73/218, 74/197, 75/202, 76/189, 77/150 and 78/132. \n \n2  Economic and Social Council resolutions 2006/46, 2008/3, 2009/7, 2010/2, 2011/16, 2012/5, \n2013/9, 2014/27, 2015/26, 2016/22, 2017/21, 2018/28, 2019/24, 2020/12, 2021/28, 2022/15, \n2023/3 and 2024/13. \n\nA/C.2/80/L.58 \n \n25-18777\n2/18 \n \n \nReaffirming also its resolution 69/313 of 27 July 2015 on the Addis Ababa \nAction Agenda of the Third International Conference on Financing for Development, \nwhich is an integral part of the 2030 Agenda for Sustainable Development, supports \nand complements it, helps to contextualize its means of implementation targets with \nconcrete policies and actions, and reaffirms the strong political commitment to \naddress the challenge of financing and creating an enabling environment at all levels \nfor sustainable development in the spirit of global partnership and solidarity,  \n \nWelcoming the convening of the Fourth International Conference on Financing \nfor Development from 30 June to 3 July 2025 in Sevilla, Spain, and reaffirming its \noutcome document, the Sevilla Commitment, endorsed by the General Assembly in \nits resolution 79/323 of 25 August 2025, which sets forth a renewed global framework \nfor financing for development, building on the 2015 Addis Ababa Action Agenda, 3 to \nclose with urgency the estimated annual 4 trillion United States dollar financing gap, 4 \nand catalyse sustainable development investments at scale in developing countries \nand continue the reform of the international financial architecture through continued \nand strong commitment to multilateralism, international cooperation, and global \nsolidarity, \n \nReaffirming the New Urban Agenda, adopted at the United Nations Conference \non Housing and Sustainable Urban Development (Habitat III), held in Quito, Ecuador, \nfrom 17 to 20 October 2016,5  \n \nRecognizing the role of the Commission on Science and Technology for \nDevelopment as the United Nations focal point for science, technology and \ninnovation for development and as a forum in the examination of science and \ntechnology questions and the role of science and technology as enablers for the \nachievement of the 2030 Agenda, the advancement of understanding of science and \ntechnology policies, particularly in respect of developing countries, and the \nformulation of recommendations and guidelines on science and technology matters \nfor development within the United Nations system,  \n \nRecognizing also the role of the Technology Facilitation Mechanism, which \nincludes the multi-stakeholder forum on science, technology and innovation for the \nSustainable Development Goals, the inter-agency task team on science, technology \nand innovation for the Sustainable Development Goals and the online platform, as a \ntool to facilitate multi-stakeholder collaboration and partnerships among Member \nStates, civil society, the private sector, the scientific, technical and academic \ncommunities, United Nations entities and other stakeholders in order to support the \nimplementation of the Sustainable Development Goals, including through forging \npartnerships, such as the Partnership in Action on STI for SDGs Road Maps,  \n \nRecalling the Declaration of Principles and the Plan of Action adopted by the \nWorld Summit on the Information Society at its first phase, held in Geneva from 10 \nto 12 December 2003,6 and endorsed by the General Assembly,7 and the Tunis \nCommitment and the Tunis Agenda for the Information Society adopted by the \nSummit at its second phase, held in Tunis from 16 to 18 November 2005, 8 and \nendorsed by the Assembly,9  \n__________________ \n \n3  General Assembly resolution 69/313, annex. \n \n4  Financing for Sustainable Development Report 2024 (United Nations publication, 2024), \nfigure I.1. \n \n5  Resolution 71/256, annex. \n \n6  See A/C.2/59/3, annex. \n \n7  See resolution 59/220. \n \n8  See A/60/687. \n \n9  See resolution 60/252. \n\nA/C.2/80/L.58\n \n3/18\n25-18777 \n \n \nRecalling also the references to information and communications technologies \ncontained in the 2030 Agenda, the Addis Ababa Action Agenda and the Sevilla \nCommitment, and reiterating calls for close alignment between the World Summit on \nthe Information Society process and the 2030 Agenda, as well as other relevant \nintergovernmental outcomes,  \n \nRecalling further the outcome document of the high-level meeting of the \nGeneral Assembly on the overall review of the implementation of the outcomes of the \nWorld Summit on the Information Society,10 held in New York on 15 and 16 December \n2015, in which it took stock of the progress made in the implementation of the \noutcomes of the World Summit, addressed potential information and communications \ntechnology gaps and identified areas for continued focus,  \n \nWelcoming the convening of the Summit of the Future on 22-23 September 2024 \nat the United Nations Headquarters in New York at which resolution 79/1 entitled \n\u201cThe Pact for the Future\u201d and its annexes were adopted,  \n \nReaffirming its common desire and commitment to the World Summit on the \nInformation Society vision as laid out in the Geneva Declaration of Principles,  \n \nReaffirming also the outcome of the high-level meeting of the General Assembly \non the overall review of the implementation of the outcomes of the World Summit on \nthe Information Society, which provides an overview of implementation action lines, \nchallenges, vision and priority areas, and recognizing the need for all people to have \nmedia and information literacy skills, which are important in order to fully participate \nin an inclusive information society,  \n \nRecognizing that information and communications technologies present new \nopportunities and challenges and that there is a pressing need to address the major \nimpediments that developing countries face in accessing new technologies, stressing \nthe need to close the digital divides, both between and within countries and including \nthe rural-urban, youth-older persons, disability and gender digital divides, as well as \nthose in vulnerable situations,  \n \nEmphasizing the importance of harnessing information and communications \ntechnologies for development, and recalling the need to emphasize quality of access \nto bridge digital and knowledge divides, using a multidimensional approach that \nincludes speed, stability, affordability, language, training, capacity-building, local \ncontent and accessibility for persons with disabilities,  \n \nTaking note of the report of the Secretary-General on the progress made in the \nimplementation of and follow-up to the outcomes of the World Summit on the \nInformation Society at the regional and international levels, 11  \n \nRecalling the report on the economic impact of broadband in the least developed \ncountries, landlocked developing countries and small island developing States, jointly \nprepared by the Office of the High Representative for the Least Developed Countries, \nLandlocked Developing Countries and Small Island Developing States and the \nInternational Telecommunication Union, as well as the United Nations E-Government \nSurvey prepared by the Department of Economic and Social Affairs of the Secretariat, \n \nRecognizing that the Doha Programme of Action for the Least Developed \nCountries,12 the Awaza Programme of Action for Landlocked Developing Countries \nfor the Decade 2024\u2013203413 and the Antigua and Barbuda Agenda for Small Island \n__________________ \n \n10  Resolution 70/125. \n \n11  A/80/62-E/2025/12. \n \n12  Resolution 76/258, annex. \n \n13  Resolution 79/233, annex; see also resolution 79/279. \n\nA/C.2/80/L.58 \n \n25-18777\n4/18 \n \nDeveloping States: A Renewed Declaration for Resilient Prosperity 14 aim to leverage \nthe potential of science, technology and innovation to address the sustainable \ndevelopment challenges facing the least developed countries, landlocked developing \ncountries and small island developing States, respectively,  \n \nNoting the call for the continuation of annual reports on the implementation of \nthe outcomes of the World Summit on the Information Society, through the \nCommission on Science and Technology for Development, to the Economic and \nSocial Council, and reaffirming the role of the Commission, as set forth in Council \nresolution 2006/46 of 28 July 2006, as the focal point in the system-wide follow-up, \nin particular the review and assessment of progress made in implementing the \noutcomes of the World Summit,  \n \nNoting also the holding of the twenty-eighth session of the Commission on \nScience and Technology for Development from 7 to 11 April 2025, and looking \nforward to the twenty-ninth session, which will have as a priority theme \u201cScience, \ntechnology and innovation in the age of artificial intelligence\u201d, thus providing a \nplatform for all stakeholders to share experiences and pursue partnerships for \ncapacity-building,  \n \nTaking note of the report of the High-level Panel on Digital Cooperation, entitled \n\u201cThe age of digital interdependence\u201d, submitted to the Secretary-General on 10 June \n2019, also taking note of the report of the Secretary-General entitled \u201cRoad map for \ndigital cooperation\u201d, presented on 11 June 2020,15 and further taking note of the \nrecommendations of the Secretary-General, in his report entitled \u201cOur Common \nAgenda\u201d,16 to improve digital cooperation, with a view to bridging digital divides and \naccelerating the positive contribution that digital technologies can play in society, \nincluding towards achieving the 2030 Agenda, as well as the establishment of the \nOffice for Digital and Emerging Technologies,  \n \nAcknowledging that our digital cooperation rests on international law, including \nthe Charter of the United Nations, international human rights law, and the \n2030 Agenda for Sustainable Development,  \n \nRecalling the ongoing efforts to implement the commitments of the Global \nDigital Compact,  within countries and at the regional and global levels, taking into \naccount different national realities, capacities and levels of development, and \nrespecting national policies and priorities and applicable legal frameworks,  \n \nNoting that the working group on digital technologies under the steering \ncommittee led by the Secretary-General for the implementation of the Pact for the \nFuture has developed the Global Digital Compact implementation map in accordance \nwith paragraph 71 of the Compact,  \n \nRecognizing the importance of the Global Digital Compact and of the World \nSummit on the Information Society process and the need to ensure a cohesive and \nconsistent approach to digital cooperation to avoid duplications,  \n \nNoting the holding of the World Summit on the Information Society+ 20 Forum \nHigh-level Event, from 7 to 11 July 2025, jointly organized by the International \nTelecommunication Union, the United Nations Conference on Trade and \nDevelopment, the United Nations Educational, Scientific and Cultural Organization \nand the United Nations Development Programme, and looking forward to the next \n__________________ \n \n14  Resolution 78/317, annex. \n \n15  A/74/821. \n \n16  A/75/982. \n\nA/C.2/80/L.58\n \n5/18\n25-18777 \n \nannual World Summit on the Information Society Forum, to be held in Geneva in \n2026, co-hosted by Switzerland and the International Telecommunication Union,  \n \nRecalling the United Nations Development Programme Digital Strategy \n2022\u2013 2025, which seeks to assist countries, upon their request, in their efforts towards \ndigital transformation through the creation of inclusive and resilient digital \necosystems,  \n \nRecalling also the report of the Broadband Commission for Sustainable \nDevelopment entitled The State of Broadband Report 2024: Leveraging Artificial \nIntelligence for Universal Connectivity,  \n \nRecognizing the fact that information and communications technologies are \ncritical enablers of economic development and investment, with consequential \nbenefits for employment and social welfare, by lowering barriers to economic \nparticipation, and that \nthe \nincreasing \npervasiveness of information \nand \ncommunications technologies within society has had profound impacts on the ways \nin which Governments deliver services, businesses relate to consumers and citizens \nparticipate in public and private life,  \n \nTaking note of the report of the United Nations Conference on Trade and \nDevelopment entitled Technology and Innovation Report 2025: Inclusive Artificial \nIntelligence for Development,  \n \nNoting the tax challenges arising from digitalization of the economy and the \nimportance of ensuring that tax is paid where value is created, and noting also \ninternational efforts to address this issue,  \n \nStressing, however, that recent progress notwithstanding, important and \ngrowing digital divides remain between and within developed and developing \ncountries in terms of the availability, affordability, access to and use of information \nand communications technologies and broadband, stressing also the urgent need to \nclose digital divides, including with regard to such issues as the affordability of the \nInternet, and to ensure that the benefits of information and communications \ntechnologies, including new technologies, are available to all, stressing further that \nthe benefits of these technologies should be fairly distributed, and in this regard \nreaffirming its commitment to significantly increasing access to information and \ncommunications technologies and striving to provide universal and affordable access \nto the Internet in the least developed countries by 2020, and noting the many efforts \nto help to bridge digital divides and expand access, including the Connect 2030 \nAgenda for Global Telecommunication/Information and Communication Technology, \nincluding Broadband, for Sustainable Development,  \n \nRecalling the vision of a people-centred, inclusive and development-oriented \ninformation society, where everyone can create, access, utilize and share information \nand knowledge, enabling individuals, communities and peoples to achieve their full \npotential in promoting their sustainable development and improving their quality of \nlife, premised on the purposes and principles of the Charter of the United Nations and \nrespecting fully and upholding the Universal Declaration of Human Rights, 17  \n \nStressing the necessity for all forms of development cooperation, including aid \nflows, to promote digital transformation,  \n \nRecalling the recommendations for actions in bridging the gender digital divide \ncontained in the progress report of the Working Group on the Digital Gender Divide \nof the Broadband Commission for Sustainable Development and taking note of the \nreport of the Working Group on Education of the Broadband Commission entitled \n__________________ \n \n17  Resolution 217 A (III). \n\nA/C.2/80/L.58 \n \n25-18777\n6/18 \n \n\u201cDigital skills for life and work\u201d, and noting the conclusions from the sixty-seventh \nsession of the Commission on the Status of Women titled \u201cInnovation and \ntechnological change, and education in the digital age for achieving gender equality \nand the empowerment of all women and girls\u201d,  \n \nRecognizing that realizing gender equality and the empowerment of all women \nand girls will make a crucial contribution to progress across all of the Sustainable \nDevelopment Goals, and emphasizing the need to target science, technology and \ninnovation strategies to address the empowerment of women and girls and to reduce \ninequalities, including the gender digital divide,  \n \nNoting with great concern the fact that a gender digital divide persists in \nwomen\u2019s access to and use and development of information and communications \ntechnologies, including in education, employment and other areas of economic and \nsocial development, and in this regard welcoming the many initiatives that focus on \naccess, skills and leadership to promote the equal participation and empowerment of \nwomen and girls in the digital age, such as the International Girls in ICT Day of the \nInternational Telecommunication Union and the Global Partnership for Gender \nEquality in the Digital Age, known as the Equals Partnership,  \n \nNoting with great concern also that many developing countries lack meaningful \nand affordable access to information and communications technologies and that, for \nthe majority of the poor, the promise of science and technology, including information \nand communications technologies, remains unfulfilled, and emphasizing the need to \neffectively harness technology, including information and communications \ntechnologies and data management, and promote inclusive digital literacy to bridge \nthe digital and knowledge divides,  \n \nReaffirming the importance of data for the Sustainable Development Goals and \nfor development, recognizing the importance of identifying innovative, interoperable \nand inclusive mechanisms to enable data to flow with trust within and between \ncountries to mutual benefit, while respecting relevant data protection and privacy \nsafeguards and applicable legal frameworks,  \n \nRecognizing the need to focus on capacity development policies and sustainable \nsupport to further enhance the impact of activities and initiatives at the national and \nlocal levels aimed at providing advice, services and support, with a view to building \nan inclusive, people-centred and development-oriented information society,  \n \nRecognizing also that harnessing the benefits of digital technologies for \ninclusive, equitable and quality education and lifelong learning opportunities requires \nthe advancement of connectivity, capacities and content, and electricity coverage, and \nacknowledging the need for access to broadband Internet and technology devices, \ndigital inclusion, skills and literacy, and to incorporate digital competencies into the \neducation system for the capacity-building of educators and students,  \n \nNoting that a range of topics continues to emerge on issues related to the access \nto and use and applications of information and communications technologies and their \neffects on economic, social and environmental dimensions of sustainable \ndevelopment,  \n \nNoting with concern that digital divides between and within countries, including \nthose related to artificial intelligence, continue to widen and that developing countries \nand, in particular, those in special situations face significant challenges in keeping \npace with the rapid acceleration of artificial intelligence development, and \nacknowledging the need to better realize the benefits of artificial intelligence, \nespecially in developing countries, while recognizing the potential negative impacts \n\nA/C.2/80/L.58\n \n7/18\n25-18777 \n \nof artificial intelligence and artificial intelligence-generated content causing obstacles \nto sustainable development, such as on labour markets,  \n \nReiterating that our cooperation will leverage digital technologies for \nsustainability while minimizing their negative environmental impacts in the context \nof sustainable development and efforts to eradicate poverty,  \n \nReaffirming that the same rights that people have offline must also be protected \nonline, and emphasizing that progress towards the vision of the World Summit on the \nInformation Society should be considered not only as a function of economic \ndevelopment and the spreading of information and communications technologies but \nalso as a function of progress with respect to the realization of human rights and \nfundamental freedoms,  \n \nReaffirming also that Internet governance, including the process towards \nenhanced cooperation and the convening of the Internet Governance Forum, should \ncontinue to follow the provisions set forth in the outcomes of the summits held in \nGeneva and Tunis,  \n \nRecalling the efforts undertaken by the host countries in organizing the meetings \nof the Internet Governance Forum, most recently held in Lillestr\u00f8m, Norway, in 2025 \nunder the theme \u201cBuilding governance together\u201d,  \n \nRecalling also the convening of the Working Group on Enhanced Cooperation \non Public Policy Issues Pertaining to the Internet, based on the proposal by the Chair \nof the Commission on Science and Technology for Development regarding the \nstructure and composition of the Working Group, as requested by the General \nAssembly in its resolution 70/125 of 16 December 2015 and endorsed by the \nEconomic and Social Council in its resolution 2017/21 of 6 July 2017, and taking \nnote of its work,  \n \nNoting that information and communications technologies can help to accelerate \nprogress towards the achievement of the Sustainable Development Goals, and noting \nalso that, inter alia, the International Telecommunication Union and the United \nNations Development Programme have an important role in supporting Member \nStates in the implementation of the Goals,  \n \nNoting also that technological change includes new and powerful tools for \ndevelopment, and mindful of its impacts, opportunities and challenges and that \nGovernments, the private sector, international organizations, civil society and the \ntechnical and academic communities should take into account the social, economic, \nethical, cultural and technical issues related to rapid technological advancements in \norder to deepen their understanding of how to harness their potential to support the \nachievement of the 2030 Agenda,  \n \nReaffirming the value and principles of multi-stakeholder cooperation and \nengagement that have characterized the World Summit on the Information Society \nprocess since its inception, and recognizing that the effective participation, \npartnership and cooperation of Governments, the private sector, civil society, \ninternational organizations, the technical and academic communities and all other \nrelevant stakeholders, within their respective roles and responsibilities, especially \nwith balanced representation from developing countries, have been and continue to \nbe vital in developing the information society,  \n \nRecognizing the important contributions and full participation of all \nstakeholders to help bridge, in their roles and responsibilities, the digital divides,  \n\nA/C.2/80/L.58 \n \n25-18777\n8/18 \n \n \nAcknowledging that differences in individual stakeholders\u2019 capabilities to both \nuse and create information and communications technologies represent a knowledge \ndivide that perpetuates inequality,  \n \nConscious of the challenges faced by States in preventing and combating the use \nof information and communications technologies for criminal purposes, and \nemphasizing the need to continue international cooperation in this regard and to \nreinforce technical assistance and capacity-building activities, at their request, for the \nprevention, prosecution and punishment of such use in accordance with international \nlaw and national legislations,  \n \nWelcoming the adoption by General Assembly resolution 79/243 of \n24 December 2024 of United Nations Convention against Cybercrime; Strengthening \nInternational Cooperation for Combating Certain Crimes Committed by Means of \nInformation and Communications Technology Systems and for the Sharing of \nEvidence in Electronic Form of Serious Crimes, emphasizing the importance of the \nSigning ceremony held in Hanoi, Viet Nam, on 25 and 26 October 2025,  \n \nReiterating the pledge that no one will be left behind, reaffirming the \nrecognition that the dignity of the human person is fundamental, and the wish to see \nthe Goals and targets met for all nations and peoples and for all segments of society, \nand recommitting to endeavour to reach the furthest behind first,  \n \nNoting with grave concern that approximately a third of the world\u2019s population, \nespecially women and girls, older persons and people in vulnerable situations, as well \nas approximately two thirds of people in the least developed countries, are not using \nthe Internet, and noting that the impact of the coronavirus disease (COVID-19) \npandemic exacerbates inequalities caused by the digital divides, since the poorest and \nthe most vulnerable who are the hardest hit are also those who lag behind the most in \naccess to information and communications technologies,  \n \nTaking note of the United Nations Educational, Scientific and Cultural \nOrganization Recommendation on the Ethics of Artificial Intelligence, 18  \n \n1. \nRecognizes that information and communications technologies have the \npotential to provide new solutions to development challenges, particularly in the \ncontext of globalization, and can foster sustained, inclusive and equitable economic \ngrowth and sustainable development, competitiveness, access to information and \nknowledge, trade and development, eradication of poverty, including extreme \npoverty, gender equality and social inclusion that will help to expedite the integration \nof all countries, especially developing countries, in particular the least developed \ncountries, into the global economy;  \n \n2. \nWelcomes the remarkable evolution and diffusion of information and \ncommunications technologies, underpinned by the contributions of both the public \nand private sectors, which have seen penetration into almost all corners of the globe, \ncreated new opportunities for social interactions, enabled new business models and \ncontributed to economic growth and development in all other sectors, while \nemphasizing that the unique and emerging challenges related to their evolution and \ndiffusion require equitable and inclusive approaches and strengthened international \ncooperation to maximize the benefits of the information society;  \n \n3. \nRecognizes the potential of information and communications technologies \nand digital transformation to achieve the 2030 Agenda for Sustainable Development 19 \nand other internationally agreed development goals, noting that they can accelerate \n__________________ \n \n18  United Nations Educational, Scientific and Cultural Organization, Records of the General \nConference, Forty-first Session, Paris, 9\u201324 November 2021, vol. 1, Resolutions, annex VII. \n \n19  Resolution 70/1. \n\nA/C.2/80/L.58\n \n9/18\n25-18777 \n \nprogress across all 17 Sustainable Development Goals, accordingly urges all \nGovernments, the private sector, civil society, international organizations, the \ntechnical and academic communities and all other relevant stakeholders to integrate \ninformation and communications technologies and digital solutions into their \napproaches to implementing the Goals, and requests United Nations system entities \nfacilitating the World Summit on the Information Society action lines to review their \nreporting and workplans to support the implementation of the 2030 Agenda;  \n \n4. \nReaffirms its commitment to bridging digital and knowledge divides, \nrecognizes that its approach must be multidimensional and include an evolving \nunderstanding of what constitutes access, emphasizing the quality of that access, and \nacknowledges that speed, stability, affordability, language and local content \naccessibility for everyone, including persons with disabilities and other persons in \nvulnerable situations, are now core elements of quality and that high-speed broadband \nis already an essential enabler of sustainable development;  \n \n5. \nEmphasizes, in this regard, the vital importance of multilingualism and \nlocal content in the information society, including the promotion, protection and \npreservation of linguistic and cultural diversity in training data, particularly for the \nlarge language models of artificial intelligence, and urges all stakeholders to \nencourage the creation of, and access to, educational, cultural and scientific content \nonline so as to promote quality of access and ensure that all people and cultures can \nexpress themselves and have access to the Internet in all languages, including \nIndigenous languages;  \n \n6. \nRecognizes that the Internet is a critical global facility for inclusive and \nequitable digital transformation, and that, to fully benefit all, it must be open, global, \ninteroperable, stable and secure, while recognizing that Internet governance must \ncontinue to be global and multi-stakeholder in nature, with the full involvement of \nGovernments, the private sector, civil society, international organizations, technical \nand academic communities and all other relevant stakeholders in accordance with \ntheir respective roles and responsibilities;  \n \n7. \nStresses the important role played by Governments, the private sector, civil \nsociety, scientific, technical and academic communities, international organizations \nand relevant stakeholders in accordance with their respective roles and \nresponsibilities in information and communications technologies;  \n \n8. \nEncourages strengthened and continuing cooperation between and among \nstakeholders from both developed and developing countries, within their respective \nroles and responsibilities, to ensure the effective implementation of the outcomes of \nthe Geneva and Tunis phases of the World Summit on the Information Society, \nthrough, inter alia, the promotion of national, regional and international \nmulti-stakeholder partnerships, including public-private partnerships, and the \npromotion of national and regional multi-stakeholder thematic platforms in a joint \neffort and dialogue with developing countries, including the least developed \ncountries, development partners and actors in the information and communications \ntechnologies sector;  \n \n9. \nWelcomes the operationalization of the Technology Bank for the Least \nDeveloped Countries, and invites Member States, as well as international \norganizations, foundations and the private sector, to provide voluntary financial \ncontributions and technical assistance to ensure its full and effective implementation;  \n \n10. Reiterates the call for support for the full operationalization of all \ncomponents of the Technology Facilitation Mechanism and to explore a voluntary \nfunding model in collaboration with the Department of Economic and Social Affairs \nof the Secretariat and relevant United Nations entities;  \n\nA/C.2/80/L.58 \n \n25-18777\n10/18 \n \n \n11. \nNotes the progress that has been made by United Nations system entities \nin cooperation with national Governments, regional commissions and other \nstakeholders, including non-governmental organizations and the private sector, in the \nimplementation of the action lines contained in the outcome documents of the World \nSummit on the Information Society, and encourages the use of those action lines for \nthe implementation of the 2030 Agenda;  \n \n12. Also notes that the digital economy is an important and growing part of \nthe global economy and that connectivity is correlated with increases in gross \ndomestic product, recognizes the critical importance of expanding the participation \nof all countries, in particular developing countries, in the digital economy, including \nby harnessing data for economic growth, particularly in developing countries;  \n \n13. Welcomes the establishment by the Commission on Science and \nTechnology for Development of a dedicated working group to engage in a \ncomprehensive and inclusive multi-stakeholder dialogue on data governance at all \nlevels as relevant for development, encourages the working group to report on its \nprogress to the General Assembly, by no later than the eighty-first session, including \non follow-up recommendations towards equitable and interoperable data governance \narrangements, which may include fundamental principles of data governance at all \nlevels as relevant for development, proposals to support interoperability between \nnational, regional and international data systems, considerations of sharing the \nbenefits of data, and options to facilitate safe, secure and trusted data flows, including \ncross-border data flows as relevant for development, and looks forward to the \ncontinuation of discussions in the United Nations, building on those outcomes and \nrecognizing the ongoing work of other relevant bodies and stakeholders, including \nthe Statistical Commission, in our efforts to pursue common understandings for data \ngovernance at all levels, as relevant for development;  \n \n14. Recognizes the role of the Commission on Science and Technology for \nDevelopment in reviewing follow-up on the implementation of the outcomes of the \nWorld Summit on the Information Society;  \n \n15. Emphasizes the role of the Commission on Science and Technology for \nDevelopment in the follow-up and review process of the Global Digital Compact and \nthe need for ensuring the strongest possible convergence between the implementation \nof the World Summit on the Information Society outcomes and the Compact to avoid \nduplication and enhance synergies, efficiencies and thereby impact;  \n \n16. Encourages countries to take advantage of capacity-building mechanisms \nand opportunities from the entire United Nations system and from Member States, \nand urges the international community to provide necessary resources to support such \nefforts;  \n \n17. Takes note of the report of the Secretary-General on \u201cInnovative voluntary \nfinancing options for artificial intelligence capacity-building\u201d, which was developed \nin line with the request contained in resolution 79/1 and that took into account, inter \nalia, the recommendation on a Global Fund on AI;  \n \n18. Emphasizes the importance of increased investment, particularly from the \nprivate sector and philanthropy, to scale up artificial intelligence capacity-building \nfor sustainable development, and recognizes the need to scale up AI capacity-\nbuilding, leveraging existing United Nations and multi-stakeholder mechanisms to \nbridge AI divides, facilitate access to AI applications, and build capacity and high-\nperformance computing and related skills in developing countries;  \n \n19. Urges a continued focus on maximizing development gains from \ne-commerce, through initiatives such as eTrade for All and the e-trade readiness \n\nA/C.2/80/L.58\n \n11/18\n25-18777 \n \nassessments and implementation tools launched by the United Nations Conference on \nTrade and Development, with a focus on providing technical assistance and building \ncapacity for adopting and scaling e-commerce;  \n \n20. Looks forward to the holding of the sixth meeting of the Working Group \non Measuring E-commerce and the Digital Economy, on 4 and 5 December 2025, and \nthe ninth session of the Intergovernmental Group of Experts on E-commerce and the \nDigital Economy, from 11 to 13 May 2026;  \n \n21. Recognizes the need for international cooperation to examine and address \nthe opportunities, risks and challenges associated with dealing with data, including \ndata protection, and the need for urgent action aimed at reducing digital divides and \ninequalities in data generation, accessibility and infrastructure, within and among \ncountries and regions, and encourages strengthening of international collaboration on \ninclusive and human-centric governance of data and greater interoperability in this \nregard, building on contributions from international organizations, including the \nUnited Nations system, and to find common ground on these issues, ensuring no one \nis left behind;  \n \n22. Calls for increased international cooperation and resources for capacity-\nbuilding support to developing countries to support their efforts to collect, analyse \nand disseminate relevant, accurate, reliable and disaggregated data and statistics for \nbetter monitoring and policymaking to accelerate the achievement of the \n2030 Agenda, while respecting privacy and data protection;  \n \n23. Further calls upon the international community to enhance its support to \ndeveloping countries, including by increasing resources available, to build their \ncapacities to equally and meaningfully benefit from data and participate in the digital \neconomy;  \n \n24. Emphasizes that efforts to close all digital divides and ensure that no one \nis left behind in the digital economy, including by harnessing data for economic \ngrowth, particularly in developing countries, must be expanded;  \n \n25. Welcomes the work of the Information for All Programme of the United \nNations Educational, Scientific and Cultural Organization, which aims to assist \nMember States in formulating policies to bridge digital divides and ensure equitable \nknowledge societies, and also welcomes the holding of Global Media and Information \nLiteracy Week from 24 to 31 October 2025;  \n \n26. Recognizes that, despite recent progress and significant gains, there is still \nuneven growth in access to and the use of information and communications \ntechnologies, and expresses concern over the substantial continued digital and \nbroadband divides between and within developed and developing countries, including \nthe fact that while 93 per cent of people use the Internet in high-income countries, \nonly 27 per cent of the population of low-income countries is online, and that the cost of \naccess is higher in developing countries in relation to average household income, resulting \nin a lack of affordable access to information and communications technologies;20 \n \n27. Stresses the need to provide universal, meaningful and affordable access \nto the Internet by 2030, particularly in all developing countries, welcomes efforts by \nthe United Nations to assist countries, upon their request, in achieving this, and calls \nupon all stakeholders, including the international community, to support further \nactions, including investment, to improve broadband access and connectivity in \ndeveloping countries;  \n__________________ \n \n20  International Telecommunication Union, Measuring Digital Development: Facts and Figures \n2024 (Geneva, 2024).  \n\nA/C.2/80/L.58 \n \n25-18777\n12/18 \n \n \n28. Recognizes the importance of broadband connectivity to users in rural and \nremote areas, and in this regard notes that small and non-profit community operators, \nincluding community networks and other affordable, scalable and inclusive \ntechnology and business models that provide last-mile connectivity solutions, as \nappropriate and among others, can provide these services through, inter alia, \nappropriate regulatory measures that allow them to gain access to basic infrastructure;  \n \n29. Stresses the importance of rapid technological change in ensuring food \nsecurity and nutrition by 2030, and information technology in agriculture systems \nwith due regard for sustainability;  \n \n30. Encourages research and development, and the development of viable \nstrategies that could result in further competitiveness, investment and rapid \nreductions in the cost of information and communications technologies, urges all \nrelevant stakeholders to address the growing digital divides between and within \ncountries through, inter alia, strengthened enabling policy environments at all levels, \nlegal and regulatory frameworks conducive to increased investment and innovation, \npublic-private partnerships, universal access strategies and international cooperation \nto improve affordability, education, capacity-building, multilingualism, cultural \npreservation, investment and technology transfer on mutually agreed terms, and \nsupports the development, deployment and sustainable use of emerging and open-\nsource technologies and supports policies towards open science and open innovation \nand know-how for the achievement of the Sustainable Development Goals, especially \nin developing countries, as well as accelerated access to research capacity and \ncapacity-building and high-performance computing and related skills in developing \ncountries;  \n \n31. Acknowledges the importance of more inclusive and equitable access to \nthe benefits of the emerging digital economy, and recognizes that collective efforts \nare needed towards new rule-setting that not only favours large digital enterprises, \nbut also provides for an open, fair, competitive, inclusive and non-discriminatory \nbusiness environment, including support for the access of micro-, small and medium-\nsized enterprises, including those owned or operated by women, to finance, \ninformation and markets, while protecting and empowering consumers;  \n \n32. Recognizes that a gender digital divide persists and that, worldwide, 70 per \ncent of men use the Internet compared with 65 per cent of women, notes that in the \nleast developed countries only 29 per cent of women use the Internet, compared with \n41 per cent of men, and calls upon all stakeholders to close the gender digital divide, \nensure the full, equal, effective and meaningful participation of all women in the \ninformation society and women\u2019s access to information and communications \ntechnologies for development, including women\u2019s and girls\u2019 access to new \ntechnologies, in this respect reiterates its request for relevant United Nations system \nentities, including the United Nations Entity for Gender Equality and the \nEmpowerment of Women (UN-Women), to support the implementation and \nmonitoring of the action lines contained in the outcome documents of the World \nSummit on the Information Society by enhancing the emphasis on gender equality \nand all women\u2019s empowerment, and reaffirms the commitment to ensuring women\u2019s \nfull and meaningful participation in decision-making processes related to information \nand communications technologies, including policies and approaches to promote \nwomen\u2019s online safety to facilitate their participation in the digital world, and to \naddress any potential negative impacts of digital technologies on gender equality and \nthe empowerment of women and girls, and committing to eliminating, preventing and \n\nA/C.2/80/L.58\n \n13/18\n25-18777 \n \nresponding to all forms of violence against women and girls, 21 including sexual and \ngender-based violence that occurs through or is amplified by the use of technology; \n \n33. Notes the implementation of the outcomes of the World Summit on the \nInformation Society at the regional level, facilitated by the regional commissions, as \nobserved in the report of the Secretary-General on the progress made in the \nimplementation of and follow-up to the outcomes of the World Summit at the regional \nand international levels;  \n \n34. Encourages the United Nations funds and programmes and the specialized \nagencies to strengthen their collaborative efforts within their respective mandates and \nstrategic plans, to contribute to the implementation of the outcomes of the World \nSummit on the Information Society, and emphasizes the importance of allocating \nadequate resources in this regard;  \n \n35. Takes note of the World Summit on the Information Society process and \n2030 Agenda-Global Digital Compact matrix prepared by the United Nations Group \non the Information Society, which maps the Global Digital Compact objectives to \nexisting World Summit structures, mechanisms and activities, offering a structured \napproach for effective follow-up and implementation of the Compact;  \n \n36. Acknowledges the existing mandate of the Internet Governance Forum, \nand looks forward to the high-level overall review of the implementation of the \noutcomes of the World Summit on the Information Society, to be held on 16 and \n17 December 2025;  \n \n37. Stresses the need for the enhanced participation of Governments and \nstakeholders from all developing countries, in particular the least developed \ncountries, in all meetings of the Internet Governance Forum, and in this regard invites \nMember States, as well as other relevant stakeholders, to support the participation of \nGovernments and all other stakeholders from developing countries in the Forum \nitself, as well as in the preparatory meetings;  \n \n38. Notes the work of the Working Group on Enhanced Cooperation, \nestablished by the Chair of the Commission on Science and Technology for \nDevelopment as requested by the General Assembly in its resolution 70/125, to \ndevelop recommendations on how to further implement enhanced cooperation as \nenvisioned in the Tunis Agenda, and also notes that the Working Group ensured the \nfull involvement of Governments and other relevant stakeholders, in particular from \ndeveloping countries, taking into account all their diverse views and expertise;  \n \n39. Also notes that the Working Group held five meetings between September \n2016 and January 2018 at which it discussed inputs from Member States and other \nstakeholders, as stipulated by the General Assembly in its resolution 70/125;  \n \n40. Recalls the report of the Chair of the Working Group,22 which includes \nreferences to the full texts of all proposals and contributions, and expresses its \ngratitude to the Chair and all participants who submitted inputs and contributed to the \nwork of the Working Group;  \n \n41. Welcomes the good progress made by the Working Group in many areas \nand the fact that consensus seemed to emerge on some issues, while significant \ndivergence of views in a number of other issues persisted, and in that regard regrets \n__________________ \n \n21  United Nations Entity for Gender Equality and the Empowerment of Women (UN-Women) and \nUnited Nations, Department of Economic and Social Affairs, Progress on the Sustainable \nDevelopment Goals: The Gender Snapshot 2025 (New York, 2025).  \n \n22  See E/CN.16/2018/CRP.3. \n\nA/C.2/80/L.58 \n \n25-18777\n14/18 \n \nthat the Working Group could not find agreement on recommendations on how to \nfurther implement enhanced cooperation as envisioned in the Tunis Agenda;  \n \n42. Recognizes the importance of enhanced cooperation in the future, to enable \nGovernments, on an equal footing, to carry out their roles and responsibilities in \ninternational public policy issues pertaining to the Internet, and notes the need for \ncontinued dialogue and work on the implementation of enhanced cooperation as \nenvisioned in the Tunis Agenda;  \n \n43. Encourages the use of and engagement with forums and expertise \navailable within relevant United Nations bodies, such as the Commission on Science \nand Technology for Development, by all relevant stakeholders in an inclusive and \nequitable manner to promote global digital cooperation;  \n \n44. Recognizes that a lack of access to affordable and reliable technologies \nand services remains a critical challenge in many developing countries, in particular \nAfrican countries, the least developed countries, landlocked developing countries, \nsmall island developing States, middle-income countries, countries in situations of \nconflict, post-conflict countries and countries affected by natural disasters, and that \nall efforts should be deployed to reduce the price of information and communications \ntechnologies and broadband access, bearing in mind that deliberate interventions, \nincluding through open science and open innovation, research and development and \ntechnology transfer on mutually agreed terms, may be necessary to spur the \ndevelopment of lower-cost connectivity options;  \n \n45. Also recognizes that information and communications technologies \npresent new opportunities and challenges and that there is a pressing need to address \nthe major impediments that developing countries face in engaging with and accessing \nnew technologies, such as an appropriate enabling environment, sufficient resources, \ninfrastructure, education and literacy, capacity, investment and connectivity, as well \nas issues related to technology ownership, setting standards and technology flows, \nand in this regard urges all stakeholders to consider ensuring adequate means of \nimplementation, including appropriate financing for digital development and \nstrengthened capacity-building of developing countries, particularly the least \ndeveloped countries, towards a digitally empowered society and knowledge economy, \nand in this regard welcomes efforts by United Nations entities in providing such \ncapacity-building support to countries, upon their request;  \n \n46. Recalls the commitment to strengthen international cooperation to address \nthe challenge of misinformation and disinformation and hate speech online and \nmitigate the risks of information manipulation in a manner consistent with \ninternational law;  \n \n47. Encourages Member States, in particular developed countries and those \ndeveloping countries in a position to do so, to increase capacity-building cooperation, \nincluding policy exchanges, knowledge-sharing activities and the transfer of \ntechnology on mutually agreed terms, technical assistance, lifelong learning, \npersonnel training, skilling of workforce, international research cooperation, \nvoluntary joint international research laboratories and artificial intelligence capacity-\nbuilding centres, with full consideration of developing countries\u2019 national needs, \npolicies and priorities, and to hold training courses, seminars and workshops, among \nothers for sharing experiences and best practices;  \n \n48. Recognizes the need to harness the potential of information and \ncommunications technologies as critical enablers of sustainable development and to \novercome digital divides, and stresses that capacity-building for the productive use \nof such technologies should be given due consideration in the implementation of the \n2030 Agenda, the Addis Ababa Action Agenda of the Third International Conference \n\nA/C.2/80/L.58\n \n15/18\n25-18777 \n \non Financing for Development and the Sevilla Commitment of the Fourth \nInternational Conference on Financing for Development; 23  \n \n49. Notes that, while a solid foundation for capacity-building in information \nand communications technologies has been laid in many areas with regard to building \nthe information society, there is still a need for continuing efforts to address the \nongoing challenges, especially for developing countries and the least developed \ncountries, and draws attention to the positive impact of broadened capacity \ndevelopment that involves institutions, organizations and entities dealing with \ninformation and communications technologies and Internet governance issues;  \n \n50. Recognizes the importance of assisting developing countries, in particular \nthe least developed countries, to address the challenges and opportunities in relation \nto the use of the Internet and e-commerce to develop their international trade \ncapacities, among other things;  \n \n51. Also recognizes the importance of the free flow of information and \nknowledge, and the need to reduce disparities in information flows at all levels, as \nthe amount of information distributed worldwide grows and the role of \ncommunication becomes all the more important, and acknowledges that the \nmainstreaming of information and communications technologies in school curricula, \nopen access to data, open science and open innovation, the fostering of competition, \nthe creation of transparent, predictable, independent and non-discriminatory \nregulatory and legal systems, proportionate taxation and licensing fees, access to \nfinance, the facilitation of public-private partnerships, multi-stakeholder cooperation, \nnational and regional broadband strategies, rational, equitable, efficient and \neconomical use of the radio frequency spectrum by all radio communication services, \ninfrastructure-sharing models, community-based approaches and public access \nfacilities have in many countries facilitated significant gains in connectivity and \nsustainable development;  \n \n52. Calls upon all stakeholders to keep the goal of bridging digital divides, in \ntheir different forms, an area of priority concern, to put into effect sound strategies \nthat contribute to the development of e-government and to continue to focus on \npro-poor information and communications technology policies and applications, \nincluding access to broadband at the grass-roots level, with a view to narrowing the \ndigital divides among and within countries and, in turn, building information and \nknowledge societies;  \n \n53. Recognizes that digitally enabled innovation in the financial sector has \ncontributed significantly to the rapid expansion of access to financial services and \nfinancial inclusion, enabling progress on the Sustainable Development Goals and \nshowing impacts across the 2030 Agenda, as outlined in the Financing for Sustainable \nDevelopment Report 2023, and supports concrete actions to advance digital financial \ninclusion and close digital divides between and within countries, while improving \nresponsible and inclusive digital financial practices and promoting policy and \nregulatory responses, as appropriate, and build local capability to protect consumers\u2019 \ninterests, financial integrity and system stability, which are mutually reinforcing and \nalso enablers of greater financial inclusion;  \n \n54. Calls for the promotion of new research and the development and transfer \nof technologies on mutually agreed terms, including in the areas of food and nutrition, \nhealth, water and sanitation, and energy, in order to contribute to the eradication of \npoverty in all its forms and dimensions and the achievement of sustained, inclusive \nand equitable economic growth, human well-being and sustainable development; \n__________________ \n \n23 Resolution 79/323, annex. \n\nA/C.2/80/L.58 \n \n25-18777\n16/18 \n \n \n55. Notes the commitments made in the Addis Ababa Action Agenda and the \nSevilla Commitment, and recognizes that official development assistance and other \nconcessional financial flows for information and communications technologies can \nmake significant contributions to development outcomes, in particular where they can \nreduce the risk of public and private investment, and increase the use of information \nand communications technologies to strengthen good governance and tax collection;  \n \n56. Invites all relevant stakeholders to support more comprehensively those \ncountries that are trailing in the digital economy in order to reduce the digital divides, \nstrengthen the international enabling environment for value creation and build \ncapacities in both the private and public sectors, with a view to increasing \nproductivity and competitiveness;  \n \n57. Recognizes the critical importance of private sector investment in \ninformation and communications technology infrastructure, content and services, in \nfull compliance with national law and relevant legal and regulatory frameworks, \nencourages Governments to create such frameworks conducive to increased \ninvestment and innovation, and also recognizes the importance of public-private \npartnerships, universal access strategies and other approaches to that end;  \n \n58. Encourages the promotion of digital solutions through access to and use \nand development of digital public goods, which include open-source software, open \ndata, open artificial intelligence models, open standards and open content that adhere \nto international and domestic laws, in unlocking the full potential of rapid \ntechnological change to achieve the Sustainable Development Goals, and recognizes \nthat digital public goods can empower societies and individuals to direct digital \ntechnologies to their development needs and can facilitate digital cooperation and \ninvestment;  \n \n59. Recognizes that resilient, safe, inclusive and interoperable digital public \ninfrastructure has the potential to deliver services at scale and increase social and \neconomic opportunities for all, that there are multiple models of digital public \ninfrastructure, that each society will develop and use shared digital systems according \nto its specific priorities and needs, and that transparent, safe and secure digital \nsystems and user-centred safeguards can promote public trust and effective use of \ndigital services;  \n \n60. Welcomes the holding of the tenth annual Economic and Social Council \nforum on financing for development follow-up, takes note of its intergovernmentally \nagreed conclusions and recommendations,24 looks forward to further advancement in \nthe follow-up process, and welcomes the work of the Inter-Agency Task Force on \nFinancing for Development, the progress made in operationalizing the three \ncomponents of the Technology Facilitation Mechanism and the holding of the tenth \nannual multi-stakeholder forum on science, technology and innovation for the \nSustainable Development Goals;  \n \n61. Reaffirms the commitment at the very heart of the 2030 Agenda to leave \nno one behind and commit to taking more tangible steps to support people in \nvulnerable situations and the most vulnerable countries and to reach the furthest \nbehind first;  \n \n62. Recognizes the important role of information and communications \ntechnologies for attaining the Sustainable Development Goals and for a sustainable, \ninclusive and resilient recovery from the COVID-19 pandemic, and calls upon all \nstakeholders in the information and communications technologies sector, including \nGovernments and the United Nations system, to fully consider the health and \n__________________ \n \n24 See E/FFDF/2025/2. \n\nA/C.2/80/L.58\n \n17/18\n25-18777 \n \nsocioeconomic impacts of the COVID-19 pandemic as they strengthen their efforts to \nbridge the digital divides within and between developed and developing countries, \nwith particular attention to the poorest and most vulnerable, as well as women and \ngirls, and to ensuring affordable and reliable connectivity, the promotion of digital \naccess, skills and inclusion, and the expansion of accessible and inclusive distance-\nlearning solutions and digital health services;  \n \n63. Takes note of the report of the Commission on Science and Technology for \nDevelopment on its twenty-eighth session,25 including a summary of the substantive \ndiscussion on the 20-year review of the implementation of the outcomes of the World \nSummit on the Information Society, as a major input to the preparatory process of the \nhigh-level overall review of the implementation of the outcomes of the World \nSummit;  \n \n64. Notes the report prepared by the secretariat of the United Nations \nConference on Trade and Development entitled Implementing World Summit on the \nInformation Society Outcomes: A Twenty-Year Review, which was the basis for the \nsubstantive discussion at the twenty-eighth session of the Commission and an \nimportant input to the preparatory process of the high-level meeting of the General \nAssembly;  \n \n65. Looks forward, in accordance with its resolution 70/125, to its high-level \nmeeting on the overall review of the implementation of the outcomes of the World \nSummit on the Information Society in 2025, involving the input and participation of \nall stakeholders, including in the preparatory process, to take stock of progress on the \noutcomes of the World Summit and identify both areas of continued focus and \nchallenges;  \n \n66. Takes note of the modalities resolution for the overall review by the \nGeneral Assembly of the implementation of the outcomes of the World Summit on \nthe Information Society, as contained in General Assembly resolution 79/277, and \nnotes the appointment by the President of the General Assembly of two co-facilitators \nto convene open intergovernmental consultations, involving the input and \nparticipation of all stakeholders in the review process, including in the preparatory \nprocess;  \n \n67. Recognizes the immense potential of artificial intelligence systems to \naccelerate progress across all the Sustainable Development Goals and the importance \nof finding pathways to leverage artificial intelligence to this end in an inclusive and \nequitable manner, in this regard acknowledges the need to govern artificial \nintelligence in the public interest and promote international cooperation to support \ndeveloping countries in building and strengthening artificial intelligence capacities \nand readiness, as well as efforts to address potential negative impacts of emerging \ndigital technologies on sustainable development with the United Nations playing an \nimportant role in shaping, enabling and supporting the international governance of \nartificial intelligence, acknowledges the recommendations contained in the final \nreport of the High-level Advisory Body on Artificial Intelligence, and recalls the \ncommitments in the Global Digital Compact to enhance international governance of \nartificial intelligence for the benefit of humanity;  \n \n68. Welcomes the establishment, within the United Nations, of the \nmultidisciplinary Independent International Scientific Panel on Artificial Intelligence \nand of the Global Dialogue on Artificial Intelligence Governance, in accordance with \nresolution 79/325 setting out their terms of reference and modalities, and looks \nforward to progress towards the fulfilment of their mandates;  \n__________________ \n \n25 Official Records of the Economic and Social Council, 2025, Supplement No. 11 (E/2025/31). \n\nA/C.2/80/L.58 \n \n25-18777\n18/18 \n \n \n69. Resolves to bridge the artificial intelligence and other digital divides \nbetween and within countries, and to enhance international cooperation on capacity-\nbuilding in developing countries, including through North-South, South-South and \ntriangular cooperation, with full consideration of the needs, policies and priorities of \ndeveloping countries, with the aim of harnessing the benefits of artificial intelligence, \nminimizing its risks, and accelerating innovation and progress towards the \nachievement of all 17 Sustainable Development Goals;  \n \n70. Calls upon Member States and invites other stakeholders to take action to \ncooperate with and provide assistance to developing countries towards inclusive and \nequitable access to the benefits of digital transformation and safe, secure and \ntrustworthy artificial intelligence systems, including by:  \n \n(a) \nEnhancing the ability of developing countries, in particular the least \ndeveloped countries, to address major structural impediments and lift obstacles to \naccessing the benefits of new and emerging technologies and artificial intelligence \ninnovation to achieve all 17 Sustainable Development Goals, including through \nscaling up the use of scientific sources, affordable technology, research and \ndevelopment, including through strengthened partnerships;  \n \n(b) \nEnabling international innovation-based environments to enhance the \nability of developing countries to develop technical expertise and capacities, harness \ndata and compute resources, and national regulatory and governance approaches, \nframeworks and procurement capacity, and create an inclusive enabling environment \nat all levels for safe, secure and trustworthy artificial intelligence systems-based \nsolutions;  \n \n71. Recognizes that quantum technologies have the potential to solve problems \nin a way that is not possible with current technologies, while also posing risks, and \nthat it is necessary to encourage international cooperation in this field through \ninitiatives such as the 2025 International Year of Quantum Science and Technology \nso that all countries can prepare for this new scenario;  \n \n72. Requests the Secretary-General to submit to the General Assembly at its \neighty-first session, through the Commission on Science and Technology for \nDevelopment and the Economic and Social Council, an action-oriented report on the \nstatus of the implementation of and follow-up to the present resolution, taking into \naccount the 2030 Agenda, the Addis Ababa Action Agenda and the Sevilla \nCommitment, the review process of the World Summit on the Information Society, \nthe summary by the Co-Chairs of the multi-stakeholder forum on science, technology \nand innovation for the Sustainable Development Goals26 and other relevant processes, \nas part of his annual report on the progress made in the implementation of and follow-\nup to the outcomes of the World Summit on the Information Society at the regional \nand international levels, looking forward to the outcome of WSIS+20;  \n \n73. Invites the Co-Chairs of the multi-stakeholder forum on science, \ntechnology and innovation for the Sustainable Development Goals in 2026 to include \nan update on the midterm reviews of science, technology and innovation for the \nSustainable Development Goals in the Co-Chairs\u2019 summary;  \n \n74. Decides to include in the provisional agenda of its eighty-first session, \nthenceforth considering biennalization, the item entitled \u201cInformation and \ncommunications technologies for sustainable development\u201d, unless otherwise agreed.  \n \n__________________ \n \n26 E/HLPF/2025/6. \n",
  "paragraphs": {
    "1": "Recognizes that information and communications technologies have the potential to provide new solutions to development challenges, particularly in the context of globalization, and can foster sustained, inclusive and equitable economic growth and sustainable development, competitiveness, access to information and knowledge, trade and development, eradication of poverty, including extreme poverty, gender equality and social inclusion that will help to expedite the integration of all countries, especially developing countries, in particular the least developed countries, into the global economy;",
    "2": "Welcomes the remarkable evolution and diffusion of information and communications technologies, underpinned by the contributions of both the public and private sectors, which have seen penetration into almost all corners of the globe, created new opportunities for social interactions, enabled new business models and contributed to economic growth and development in all other sectors, while emphasizing that the unique and emerging challenges related to their evolution and diffusion require equitable and inclusive approaches and strengthened international cooperation to maximize the benefits of the information society;",
    "3": "Recognizes the potential of information and communications technologies and digital transformation to achieve the 2030 Agenda for Sustainable Development 19 and other internationally agreed development goals, noting that they can accelerate __________________ 18 United Nations Educational, Scientific and Cultural Organization, Records of the General Conference, Forty-first Session, Paris, 9\u201324 November 2021, vol. 1, Resolutions, annex VII. 19 Resolution 70/1. A/C.2/80/L.58 9/18 25-18777 progress across all 17 Sustainable Development Goals, accordingly urges all Governments, the private sector, civil society, international organizations, the technical and academic communities and all other relevant stakeholders to integrate information and communications technologies and digital solutions into their approaches to implementing the Goals, and requests United Nations system entities facilitating the World Summit on the Information Society action lines to review their reporting and workplans to support the implementation of the 2030 Agenda;",
    "4": "Reaffirms its commitment to bridging digital and knowledge divides, recognizes that its approach must be multidimensional and include an evolving understanding of what constitutes access, emphasizing the quality of that access, and acknowledges that speed, stability, affordability, language and local content accessibility for everyone, including persons with disabilities and other persons in vulnerable situations, are now core elements of quality and that high-speed broadband is already an essential enabler of sustainable development;",
    "5": "Emphasizes, in this regard, the vital importance of multilingualism and local content in the information society, including the promotion, protection and preservation of linguistic and cultural diversity in training data, particularly for the large language models of artificial intelligence, and urges all stakeholders to encourage the creation of, and access to, educational, cultural and scientific content online so as to promote quality of access and ensure that all people and cultures can express themselves and have access to the Internet in all languages, including Indigenous languages;",
    "6": "Recognizes that the Internet is a critical global facility for inclusive and equitable digital transformation, and that, to fully benefit all, it must be open, global, interoperable, stable and secure, while recognizing that Internet governance must continue to be global and multi-stakeholder in nature, with the full involvement of Governments, the private sector, civil society, international organizations, technical and academic communities and all other relevant stakeholders in accordance with their respective roles and responsibilities;",
    "7": "Stresses the important role played by Governments, the private sector, civil society, scientific, technical and academic communities, international organizations and relevant stakeholders in accordance with their respective roles and responsibilities in information and communications technologies;",
    "8": "Encourages strengthened and continuing cooperation between and among stakeholders from both developed and developing countries, within their respective roles and responsibilities, to ensure the effective implementation of the outcomes of the Geneva and Tunis phases of the World Summit on the Information Society, through, inter alia, the promotion of national, regional and international multi-stakeholder partnerships, including public-private partnerships, and the promotion of national and regional multi-stakeholder thematic platforms in a joint effort and dialogue with developing countries, including the least developed countries, development partners and actors in the information and communications technologies sector;",
    "9": "Welcomes the operationalization of the Technology Bank for the Least Developed Countries, and invites Member States, as well as international organizations, foundations and the private sector, to provide voluntary financial contributions and technical assistance to ensure its full and effective implementation;",
    "10": "Reiterates the call for support for the full operationalization of all components of the Technology Facilitation Mechanism and to explore a voluntary funding model in collaboration with the Department of Economic and Social Affairs of the Secretariat and relevant United Nations entities; A/C.2/80/L.58 25-18777 10/18",
    "11": "Notes the progress that has been made by United Nations system entities in cooperation with national Governments, regional commissions and other stakeholders, including non-governmental organizations and the private sector, in the implementation of the action lines contained in the outcome documents of the World Summit on the Information Society, and encourages the use of those action lines for the implementation of the 2030 Agenda;",
    "12": "Also notes that the digital economy is an important and growing part of the global economy and that connectivity is correlated with increases in gross domestic product, recognizes the critical importance of expanding the participation of all countries, in particular developing countries, in the digital economy, including by harnessing data for economic growth, particularly in developing countries;",
    "13": "Welcomes the establishment by the Commission on Science and Technology for Development of a dedicated working group to engage in a comprehensive and inclusive multi-stakeholder dialogue on data governance at all levels as relevant for development, encourages the working group to report on its progress to the General Assembly, by no later than the eighty-first session, including on follow-up recommendations towards equitable and interoperable data governance arrangements, which may include fundamental principles of data governance at all levels as relevant for development, proposals to support interoperability between national, regional and international data systems, considerations of sharing the benefits of data, and options to facilitate safe, secure and trusted data flows, including cross-border data flows as relevant for development, and looks forward to the continuation of discussions in the United Nations, building on those outcomes and recognizing the ongoing work of other relevant bodies and stakeholders, including the Statistical Commission, in our efforts to pursue common understandings for data governance at all levels, as relevant for development;",
    "14": "Recognizes the role of the Commission on Science and Technology for Development in reviewing follow-up on the implementation of the outcomes of the World Summit on the Information Society;",
    "15": "Emphasizes the role of the Commission on Science and Technology for Development in the follow-up and review process of the Global Digital Compact and the need for ensuring the strongest possible convergence between the implementation of the World Summit on the Information Society outcomes and the Compact to avoid duplication and enhance synergies, efficiencies and thereby impact;",
    "16": "Encourages countries to take advantage of capacity-building mechanisms and opportunities from the entire United Nations system and from Member States, and urges the international community to provide necessary resources to support such efforts;",
    "17": "Takes note of the report of the Secretary-General on \u201cInnovative voluntary financing options for artificial intelligence capacity-building\u201d, which was developed in line with the request contained in resolution 79/1 and that took into account, inter alia, the recommendation on a Global Fund on AI;",
    "18": "Emphasizes the importance of increased investment, particularly from the private sector and philanthropy, to scale up artificial intelligence capacity-building for sustainable development, and recognizes the need to scale up AI capacity- building, leveraging existing United Nations and multi-stakeholder mechanisms to bridge AI divides, facilitate access to AI applications, and build capacity and high- performance computing and related skills in developing countries;",
    "19": "Urges a continued focus on maximizing development gains from e-commerce, through initiatives such as eTrade for All and the e-trade readiness A/C.2/80/L.58 11/18 25-18777 assessments and implementation tools launched by the United Nations Conference on Trade and Development, with a focus on providing technical assistance and building capacity for adopting and scaling e-commerce;",
    "20": "Looks forward to the holding of the sixth meeting of the Working Group on Measuring E-commerce and the Digital Economy, on 4 and 5 December 2025, and the ninth session of the Intergovernmental Group of Experts on E-commerce and the Digital Economy, from 11 to 13 May 2026;",
    "21": "Recognizes the need for international cooperation to examine and address the opportunities, risks and challenges associated with dealing with data, including data protection, and the need for urgent action aimed at reducing digital divides and inequalities in data generation, accessibility and infrastructure, within and among countries and regions, and encourages strengthening of international collaboration on inclusive and human-centric governance of data and greater interoperability in this regard, building on contributions from international organizations, including the United Nations system, and to find common ground on these issues, ensuring no one is left behind;",
    "22": "Calls for increased international cooperation and resources for capacity- building support to developing countries to support their efforts to collect, analyse and disseminate relevant, accurate, reliable and disaggregated data and statistics for better monitoring and policymaking to accelerate the achievement of the 2030 Agenda, while respecting privacy and data protection;",
    "23": "Further calls upon the international community to enhance its support to developing countries, including by increasing resources available, to build their capacities to equally and meaningfully benefit from data and participate in the digital economy;",
    "24": "Emphasizes that efforts to close all digital divides and ensure that no one is left behind in the digital economy, including by harnessing data for economic growth, particularly in developing countries, must be expanded;",
    "25": "Welcomes the work of the Information for All Programme of the United Nations Educational, Scientific and Cultural Organization, which aims to assist Member States in formulating policies to bridge digital divides and ensure equitable knowledge societies, and also welcomes the holding of Global Media and Information Literacy Week from 24 to 31 October 2025;",
    "26": "Recognizes that, despite recent progress and significant gains, there is still uneven growth in access to and the use of information and communications technologies, and expresses concern over the substantial continued digital and broadband divides between and within developed and developing countries, including the fact that while 93 per cent of people use the Internet in high-income countries, only 27 per cent of the population of low-income countries is online, and that the cost of access is higher in developing countries in relation to average household income, resulting in a lack of affordable access to information and communications technologies;20",
    "27": "Stresses the need to provide universal, meaningful and affordable access to the Internet by 2030, particularly in all developing countries, welcomes efforts by the United Nations to assist countries, upon their request, in achieving this, and calls upon all stakeholders, including the international community, to support further actions, including investment, to improve broadband access and connectivity in developing countries; __________________ 20 International Telecommunication Union, Measuring Digital Development: Facts and Figures 2024 (Geneva, 2024). A/C.2/80/L.58 25-18777 12/18",
    "28": "Recognizes the importance of broadband connectivity to users in rural and remote areas, and in this regard notes that small and non-profit community operators, including community networks and other affordable, scalable and inclusive technology and business models that provide last-mile connectivity solutions, as appropriate and among others, can provide these services through, inter alia, appropriate regulatory measures that allow them to gain access to basic infrastructure;",
    "29": "Stresses the importance of rapid technological change in ensuring food security and nutrition by 2030, and information technology in agriculture systems with due regard for sustainability;",
    "30": "Encourages research and development, and the development of viable strategies that could result in further competitiveness, investment and rapid reductions in the cost of information and communications technologies, urges all relevant stakeholders to address the growing digital divides between and within countries through, inter alia, strengthened enabling policy environments at all levels, legal and regulatory frameworks conducive to increased investment and innovation, public-private partnerships, universal access strategies and international cooperation to improve affordability, education, capacity-building, multilingualism, cultural preservation, investment and technology transfer on mutually agreed terms, and supports the development, deployment and sustainable use of emerging and open- source technologies and supports policies towards open science and open innovation and know-how for the achievement of the Sustainable Development Goals, especially in developing countries, as well as accelerated access to research capacity and capacity-building and high-performance computing and related skills in developing countries;",
    "31": "Acknowledges the importance of more inclusive and equitable access to the benefits of the emerging digital economy, and recognizes that collective efforts are needed towards new rule-setting that not only favours large digital enterprises, but also provides for an open, fair, competitive, inclusive and non-discriminatory business environment, including support for the access of micro-, small and medium- sized enterprises, including those owned or operated by women, to finance, information and markets, while protecting and empowering consumers;",
    "32": "Recognizes that a gender digital divide persists and that, worldwide, 70 per cent of men use the Internet compared with 65 per cent of women, notes that in the least developed countries only 29 per cent of women use the Internet, compared with 41 per cent of men, and calls upon all stakeholders to close the gender digital divide, ensure the full, equal, effective and meaningful participation of all women in the information society and women\u2019s access to information and communications technologies for development, including women\u2019s and girls\u2019 access to new technologies, in this respect reiterates its request for relevant United Nations system entities, including the United Nations Entity for Gender Equality and the Empowerment of Women (UN-Women), to support the implementation and monitoring of the action lines contained in the outcome documents of the World Summit on the Information Society by enhancing the emphasis on gender equality and all women\u2019s empowerment, and reaffirms the commitment to ensuring women\u2019s full and meaningful participation in decision-making processes related to information and communications technologies, including policies and approaches to promote women\u2019s online safety to facilitate their participation in the digital world, and to address any potential negative impacts of digital technologies on gender equality and the empowerment of women and girls, and committing to eliminating, preventing and A/C.2/80/L.58 13/18 25-18777 responding to all forms of violence against women and girls, 21 including sexual and gender-based violence that occurs through or is amplified by the use of technology;",
    "33": "Notes the implementation of the outcomes of the World Summit on the Information Society at the regional level, facilitated by the regional commissions, as observed in the report of the Secretary-General on the progress made in the implementation of and follow-up to the outcomes of the World Summit at the regional and international levels;",
    "34": "Encourages the United Nations funds and programmes and the specialized agencies to strengthen their collaborative efforts within their respective mandates and strategic plans, to contribute to the implementation of the outcomes of the World Summit on the Information Society, and emphasizes the importance of allocating adequate resources in this regard;",
    "35": "Takes note of the World Summit on the Information Society process and 2030 Agenda-Global Digital Compact matrix prepared by the United Nations Group on the Information Society, which maps the Global Digital Compact objectives to existing World Summit structures, mechanisms and activities, offering a structured approach for effective follow-up and implementation of the Compact;",
    "36": "Acknowledges the existing mandate of the Internet Governance Forum, and looks forward to the high-level overall review of the implementation of the outcomes of the World Summit on the Information Society, to be held on 16 and 17 December 2025;",
    "37": "Stresses the need for the enhanced participation of Governments and stakeholders from all developing countries, in particular the least developed countries, in all meetings of the Internet Governance Forum, and in this regard invites Member States, as well as other relevant stakeholders, to support the participation of Governments and all other stakeholders from developing countries in the Forum itself, as well as in the preparatory meetings;",
    "38": "Notes the work of the Working Group on Enhanced Cooperation, established by the Chair of the Commission on Science and Technology for Development as requested by the General Assembly in its resolution 70/125, to develop recommendations on how to further implement enhanced cooperation as envisioned in the Tunis Agenda, and also notes that the Working Group ensured the full involvement of Governments and other relevant stakeholders, in particular from developing countries, taking into account all their diverse views and expertise;",
    "39": "Also notes that the Working Group held five meetings between September 2016 and January 2018 at which it discussed inputs from Member States and other stakeholders, as stipulated by the General Assembly in its resolution 70/125;",
    "40": "Recalls the report of the Chair of the Working Group,22 which includes references to the full texts of all proposals and contributions, and expresses its gratitude to the Chair and all participants who submitted inputs and contributed to the work of the Working Group;",
    "41": "Welcomes the good progress made by the Working Group in many areas and the fact that consensus seemed to emerge on some issues, while significant divergence of views in a number of other issues persisted, and in that regard regrets __________________ 21 United Nations Entity for Gender Equality and the Empowerment of Women (UN-Women) and United Nations, Department of Economic and Social Affairs, Progress on the Sustainable Development Goals: The Gender Snapshot 2025 (New York, 2025). 22 See E/CN.16/2018/CRP.3. A/C.2/80/L.58 25-18777 14/18 that the Working Group could not find agreement on recommendations on how to further implement enhanced cooperation as envisioned in the Tunis Agenda;",
    "42": "Recognizes the importance of enhanced cooperation in the future, to enable Governments, on an equal footing, to carry out their roles and responsibilities in international public policy issues pertaining to the Internet, and notes the need for continued dialogue and work on the implementation of enhanced cooperation as envisioned in the Tunis Agenda;",
    "43": "Encourages the use of and engagement with forums and expertise available within relevant United Nations bodies, such as the Commission on Science and Technology for Development, by all relevant stakeholders in an inclusive and equitable manner to promote global digital cooperation;",
    "44": "Recognizes that a lack of access to affordable and reliable technologies and services remains a critical challenge in many developing countries, in particular African countries, the least developed countries, landlocked developing countries, small island developing States, middle-income countries, countries in situations of conflict, post-conflict countries and countries affected by natural disasters, and that all efforts should be deployed to reduce the price of information and communications technologies and broadband access, bearing in mind that deliberate interventions, including through open science and open innovation, research and development and technology transfer on mutually agreed terms, may be necessary to spur the development of lower-cost connectivity options;",
    "45": "Also recognizes that information and communications technologies present new opportunities and challenges and that there is a pressing need to address the major impediments that developing countries face in engaging with and accessing new technologies, such as an appropriate enabling environment, sufficient resources, infrastructure, education and literacy, capacity, investment and connectivity, as well as issues related to technology ownership, setting standards and technology flows, and in this regard urges all stakeholders to consider ensuring adequate means of implementation, including appropriate financing for digital development and strengthened capacity-building of developing countries, particularly the least developed countries, towards a digitally empowered society and knowledge economy, and in this regard welcomes efforts by United Nations entities in providing such capacity-building support to countries, upon their request;",
    "46": "Recalls the commitment to strengthen international cooperation to address the challenge of misinformation and disinformation and hate speech online and mitigate the risks of information manipulation in a manner consistent with international law;",
    "47": "Encourages Member States, in particular developed countries and those developing countries in a position to do so, to increase capacity-building cooperation, including policy exchanges, knowledge-sharing activities and the transfer of technology on mutually agreed terms, technical assistance, lifelong learning, personnel training, skilling of workforce, international research cooperation, voluntary joint international research laboratories and artificial intelligence capacity- building centres, with full consideration of developing countries\u2019 national needs, policies and priorities, and to hold training courses, seminars and workshops, among others for sharing experiences and best practices;",
    "48": "Recognizes the need to harness the potential of information and communications technologies as critical enablers of sustainable development and to overcome digital divides, and stresses that capacity-building for the productive use of such technologies should be given due consideration in the implementation of the 2030 Agenda, the Addis Ababa Action Agenda of the Third International Conference A/C.2/80/L.58 15/18 25-18777 on Financing for Development and the Sevilla Commitment of the Fourth International Conference on Financing for Development; 23",
    "49": "Notes that, while a solid foundation for capacity-building in information and communications technologies has been laid in many areas with regard to building the information society, there is still a need for continuing efforts to address the ongoing challenges, especially for developing countries and the least developed countries, and draws attention to the positive impact of broadened capacity development that involves institutions, organizations and entities dealing with information and communications technologies and Internet governance issues;",
    "50": "Recognizes the importance of assisting developing countries, in particular the least developed countries, to address the challenges and opportunities in relation to the use of the Internet and e-commerce to develop their international trade capacities, among other things;",
    "51": "Also recognizes the importance of the free flow of information and knowledge, and the need to reduce disparities in information flows at all levels, as the amount of information distributed worldwide grows and the role of communication becomes all the more important, and acknowledges that the mainstreaming of information and communications technologies in school curricula, open access to data, open science and open innovation, the fostering of competition, the creation of transparent, predictable, independent and non-discriminatory regulatory and legal systems, proportionate taxation and licensing fees, access to finance, the facilitation of public-private partnerships, multi-stakeholder cooperation, national and regional broadband strategies, rational, equitable, efficient and economical use of the radio frequency spectrum by all radio communication services, infrastructure-sharing models, community-based approaches and public access facilities have in many countries facilitated significant gains in connectivity and sustainable development;",
    "52": "Calls upon all stakeholders to keep the goal of bridging digital divides, in their different forms, an area of priority concern, to put into effect sound strategies that contribute to the development of e-government and to continue to focus on pro-poor information and communications technology policies and applications, including access to broadband at the grass-roots level, with a view to narrowing the digital divides among and within countries and, in turn, building information and knowledge societies;",
    "53": "Recognizes that digitally enabled innovation in the financial sector has contributed significantly to the rapid expansion of access to financial services and financial inclusion, enabling progress on the Sustainable Development Goals and showing impacts across the 2030 Agenda, as outlined in the Financing for Sustainable Development Report 2023, and supports concrete actions to advance digital financial inclusion and close digital divides between and within countries, while improving responsible and inclusive digital financial practices and promoting policy and regulatory responses, as appropriate, and build local capability to protect consumers\u2019 interests, financial integrity and system stability, which are mutually reinforcing and also enablers of greater financial inclusion;",
    "54": "Calls for the promotion of new research and the development and transfer of technologies on mutually agreed terms, including in the areas of food and nutrition, health, water and sanitation, and energy, in order to contribute to the eradication of poverty in all its forms and dimensions and the achievement of sustained, inclusive and equitable economic growth, human well-being and sustainable development; __________________ 23 Resolution 79/323, annex. A/C.2/80/L.58 25-18777 16/18",
    "55": "Notes the commitments made in the Addis Ababa Action Agenda and the Sevilla Commitment, and recognizes that official development assistance and other concessional financial flows for information and communications technologies can make significant contributions to development outcomes, in particular where they can reduce the risk of public and private investment, and increase the use of information and communications technologies to strengthen good governance and tax collection;",
    "56": "Invites all relevant stakeholders to support more comprehensively those countries that are trailing in the digital economy in order to reduce the digital divides, strengthen the international enabling environment for value creation and build capacities in both the private and public sectors, with a view to increasing productivity and competitiveness;",
    "57": "Recognizes the critical importance of private sector investment in information and communications technology infrastructure, content and services, in full compliance with national law and relevant legal and regulatory frameworks, encourages Governments to create such frameworks conducive to increased investment and innovation, and also recognizes the importance of public-private partnerships, universal access strategies and other approaches to that end;",
    "58": "Encourages the promotion of digital solutions through access to and use and development of digital public goods, which include open-source software, open data, open artificial intelligence models, open standards and open content that adhere to international and domestic laws, in unlocking the full potential of rapid technological change to achieve the Sustainable Development Goals, and recognizes that digital public goods can empower societies and individuals to direct digital technologies to their development needs and can facilitate digital cooperation and investment;",
    "59": "Recognizes that resilient, safe, inclusive and interoperable digital public infrastructure has the potential to deliver services at scale and increase social and economic opportunities for all, that there are multiple models of digital public infrastructure, that each society will develop and use shared digital systems according to its specific priorities and needs, and that transparent, safe and secure digital systems and user-centred safeguards can promote public trust and effective use of digital services;",
    "60": "Welcomes the holding of the tenth annual Economic and Social Council forum on financing for development follow-up, takes note of its intergovernmentally agreed conclusions and recommendations,24 looks forward to further advancement in the follow-up process, and welcomes the work of the Inter-Agency Task Force on Financing for Development, the progress made in operationalizing the three components of the Technology Facilitation Mechanism and the holding of the tenth annual multi-stakeholder forum on science, technology and innovation for the Sustainable Development Goals;",
    "61": "Reaffirms the commitment at the very heart of the 2030 Agenda to leave no one behind and commit to taking more tangible steps to support people in vulnerable situations and the most vulnerable countries and to reach the furthest behind first;",
    "62": "Recognizes the important role of information and communications technologies for attaining the Sustainable Development Goals and for a sustainable, inclusive and resilient recovery from the COVID-19 pandemic, and calls upon all stakeholders in the information and communications technologies sector, including Governments and the United Nations system, to fully consider the health and __________________ 24 See E/FFDF/2025/2. A/C.2/80/L.58 17/18 25-18777 socioeconomic impacts of the COVID-19 pandemic as they strengthen their efforts to bridge the digital divides within and between developed and developing countries, with particular attention to the poorest and most vulnerable, as well as women and girls, and to ensuring affordable and reliable connectivity, the promotion of digital access, skills and inclusion, and the expansion of accessible and inclusive distance- learning solutions and digital health services;",
    "63": "Takes note of the report of the Commission on Science and Technology for Development on its twenty-eighth session,25 including a summary of the substantive discussion on the 20-year review of the implementation of the outcomes of the World Summit on the Information Society, as a major input to the preparatory process of the high-level overall review of the implementation of the outcomes of the World Summit;",
    "64": "Notes the report prepared by the secretariat of the United Nations Conference on Trade and Development entitled Implementing World Summit on the Information Society Outcomes: A Twenty-Year Review, which was the basis for the substantive discussion at the twenty-eighth session of the Commission and an important input to the preparatory process of the high-level meeting of the General Assembly;",
    "65": "Looks forward, in accordance with its resolution 70/125, to its high-level meeting on the overall review of the implementation of the outcomes of the World Summit on the Information Society in 2025, involving the input and participation of all stakeholders, including in the preparatory process, to take stock of progress on the outcomes of the World Summit and identify both areas of continued focus and challenges;",
    "66": "Takes note of the modalities resolution for the overall review by the General Assembly of the implementation of the outcomes of the World Summit on the Information Society, as contained in General Assembly resolution 79/277, and notes the appointment by the President of the General Assembly of two co-facilitators to convene open intergovernmental consultations, involving the input and participation of all stakeholders in the review process, including in the preparatory process;",
    "67": "Recognizes the immense potential of artificial intelligence systems to accelerate progress across all the Sustainable Development Goals and the importance of finding pathways to leverage artificial intelligence to this end in an inclusive and equitable manner, in this regard acknowledges the need to govern artificial intelligence in the public interest and promote international cooperation to support developing countries in building and strengthening artificial intelligence capacities and readiness, as well as efforts to address potential negative impacts of emerging digital technologies on sustainable development with the United Nations playing an important role in shaping, enabling and supporting the international governance of artificial intelligence, acknowledges the recommendations contained in the final report of the High-level Advisory Body on Artificial Intelligence, and recalls the commitments in the Global Digital Compact to enhance international governance of artificial intelligence for the benefit of humanity;",
    "68": "Welcomes the establishment, within the United Nations, of the multidisciplinary Independent International Scientific Panel on Artificial Intelligence and of the Global Dialogue on Artificial Intelligence Governance, in accordance with resolution 79/325 setting out their terms of reference and modalities, and looks forward to progress towards the fulfilment of their mandates; __________________ 25 Official Records of the Economic and Social Council, 2025, Supplement No. 11 (E/2025/31). A/C.2/80/L.58 25-18777 18/18",
    "69": "Resolves to bridge the artificial intelligence and other digital divides between and within countries, and to enhance international cooperation on capacity- building in developing countries, including through North-South, South-South and triangular cooperation, with full consideration of the needs, policies and priorities of developing countries, with the aim of harnessing the benefits of artificial intelligence, minimizing its risks, and accelerating innovation and progress towards the achievement of all 17 Sustainable Development Goals;",
    "70": "Calls upon Member States and invites other stakeholders to take action to cooperate with and provide assistance to developing countries towards inclusive and equitable access to the benefits of digital transformation and safe, secure and trustworthy artificial intelligence systems, including by: (a) Enhancing the ability of developing countries, in particular the least developed countries, to address major structural impediments and lift obstacles to accessing the benefits of new and emerging technologies and artificial intelligence innovation to achieve all 17 Sustainable Development Goals, including through scaling up the use of scientific sources, affordable technology, research and development, including through strengthened partnerships; (b) Enabling international innovation-based environments to enhance the ability of developing countries to develop technical expertise and capacities, harness data and compute resources, and national regulatory and governance approaches, frameworks and procurement capacity, and create an inclusive enabling environment at all levels for safe, secure and trustworthy artificial intelligence systems-based solutions;",
    "71": "Recognizes that quantum technologies have the potential to solve problems in a way that is not possible with current technologies, while also posing risks, and that it is necessary to encourage international cooperation in this field through initiatives such as the 2025 International Year of Quantum Science and Technology so that all countries can prepare for this new scenario;",
    "72": "Requests the Secretary-General to submit to the General Assembly at its eighty-first session, through the Commission on Science and Technology for Development and the Economic and Social Council, an action-oriented report on the status of the implementation of and follow-up to the present resolution, taking into account the 2030 Agenda, the Addis Ababa Action Agenda and the Sevilla Commitment, the review process of the World Summit on the Information Society, the summary by the Co-Chairs of the multi-stakeholder forum on science, technology and innovation for the Sustainable Development Goals26 and other relevant processes, as part of his annual report on the progress made in the implementation of and follow- up to the outcomes of the World Summit on the Information Society at the regional and international levels, looking forward to the outcome of WSIS+20;",
    "73": "Invites the Co-Chairs of the multi-stakeholder forum on science, technology and innovation for the Sustainable Development Goals in 2026 to include an update on the midterm reviews of science, technology and innovation for the Sustainable Development Goals in the Co-Chairs\u2019 summary;",
    "74": "Decides to include in the provisional agenda of its eighty-first session, thenceforth considering biennalization, the item entitled \u201cInformation and communications technologies for sustainable development\u201d, unless otherwise agreed. __________________ 26 E/HLPF/2025/6."
  },
  "agenda_items": [
    "Item 15"
  ],
  "symbol_references": [
    "A/C.2/80/L.58",
    "A/C.2/80/L.17"
  ]
}