{
  "symbol": "A/RES/75/72",
  "filename": "A_RES_75_72.pdf",
  "title": "75/72. Decreasing the operational readiness of nuclear weapons systems",
  "text": "United Nations \nA/RES/75/72 \n \n \nGeneral Assembly \nDistr.: General \n17 December 2020 \n \n20-16898 (E)    221220     \n*2016898* \n \n \nSeventy-fifth session \nAgenda item 103 \nGeneral and complete disarmament  \n \n \n \n \n Resolution adopted by the General Assembly \non 7 December 2020 \n \n \n \n \n[on the report of the First Committee (A/75/399, para. 96)] \n \n \n \n75/72. Decreasing the operational readiness of nuclear weapons systems \n \n \n \nThe General Assembly, \n \nRecalling its resolutions 62/36 of 5 December 2007, 63/41 of 2 December 2008, \n65/71 of 8 December 2010, 67/46 of 3 December 2012, 69/42 of 2 December 2014, \n71/53 of 5 December 2016 and 73/60 of 5 December 2018, \n \nRecalling also that the maintenance of nuclear weapons on high alert was a \nfeature of cold war nuclear postures, and welcoming the increased confidence and \ntransparency since the cessation of the cold war, while noting with concern the recent \ndeterioration in the international security climate, \n \nConcerned that several thousand nuclear weapons remain on high alert, ready \nto be launched within minutes, \n \nNoting the continuing engagement in multilateral disarmament forums in \nsupport of further reductions to the operational status of nuclear weapons systems, \n \nRecognizing that the maintenance of nuclear weapons systems at a high level of \nreadiness increases the risk of the unintentional or accidental use of such weapons, \nwhich would have catastrophic humanitarian consequences, \n \nRecognizing also that reductions in deployments and the lowering of operational \nstatus contribute to the maintenance of international peace and security, as well as to \nthe process of nuclear disarmament, through the enhancement of confidence-building \nand transparency measures and a diminishing role for nuclear weapons in security \npolicies, \n \nWelcoming the steps taken by some States in support of nuclear disarmament, \nincluding de-targeting initiatives, increasing the amount of preparation time required \nfor deployment and other measures to diminish further the possibility of nuclear \nlaunches resulting from accidents, unauthorized actions or misperceptions, \n\nA/RES/75/72 \nDecreasing the operational readiness of nuclear weapons systems\n \n20-16898\n2/2 \n \n \nRecalling the adoption by consensus of the conclusions and recommendations \nfor follow-on actions by the 2010 Review Conference of the Parties to the Treaty on \nthe Non-Proliferation of Nuclear Weapons,1 including the commitments of the \nnuclear-weapon States to promptly engage with a view to, inter alia, considering the \nlegitimate interest of non-nuclear-weapon States in further reducing the operational \nstatus of nuclear weapons systems in ways that promote international stability and \nsecurity, \n \nEncouraging, in this regard, continued dialogue among the nuclear-weapon \nStates to advance their nuclear non-proliferation and disarmament commitments \nunder the action plan of the 2010 Review Conference,2 and acknowledging the \npotential of this process for leading to deeper engagement on nuclear disarmament \nand greater mutual confidence, \n \nTaking note of the references to operational readiness in reports of the nuclear-\nweapon States during the last and current review cycles of the Treaty on the \nNon-Proliferation of Nuclear Weapons, and looking forward to further information \non this matter being provided in national reports to the tenth Review Conference of \nthe Parties to the Treaty, \n \nWelcoming all opportunities to address the further reduction of the operational \nstatus of nuclear weapons systems as a step leading to nuclear disarmament, \n \n1. \nCalls for practical and concrete steps to be taken, unilaterally, bilaterally \nor multilaterally, to decrease the operational readiness of nuclear weapons systems, \nwith a view to ensuring that all nuclear weapons are removed from high alert status; \n \n2. \nLooks forward to the issue of the lowering of the operational readiness of \nnuclear weapons systems being addressed further at the tenth Review Conference of \nthe Parties to the Treaty on the Non-Proliferation of Nuclear Weapons; \n \n3. \nUrges States to update the General Assembly on progress made in the \nimplementation of the present resolution; \n \n4. \nDecides to remain seized of the matter. \n \n37th plenary meeting \n7 December 2020 \n \n__________________ \n \n1 See 2010 Review Conference of the Parties to the Treaty on the Non-Proliferation of Nuclear \nWeapons, Final Document, vol. I (NPT/CONF.2010/50 (Vol. I)), part I. \n \n2 Ibid. \n",
  "paragraphs": {
    "1": "Calls for practical and concrete steps to be taken, unilaterally, bilaterally or multilaterally, to decrease the operational readiness of nuclear weapons systems, with a view to ensuring that all nuclear weapons are removed from high alert status;",
    "2": "Looks forward to the issue of the lowering of the operational readiness of nuclear weapons systems being addressed further at the tenth Review Conference of the Parties to the Treaty on the Non-Proliferation of Nuclear Weapons;",
    "3": "Urges States to update the General Assembly on progress made in the implementation of the present resolution;",
    "4": "Decides to remain seized of the matter."
  },
  "agenda_items": [
    "Item 103"
  ],
  "symbol_references": []
}