{
  "symbol": "A/RES/80/74",
  "filename": "A_RES_80_74.pdf",
  "title": "80/74. Assistance in mine action",
  "text": "United Nations \nA/RES/80/74\n \nGeneral Assembly \nDistr.: General \n8 December 2025 \n25-20096 (E) \n*2520096* \n \n3\n \nEightieth session \nAgenda item 46 \nAssistance in mine action \n \n \n \n \n Resolution adopted by the General Assembly \non 5 December 2025 \n \n \n[on the report of the Special Political and Decolonization Committee \n(Fourth Committee) (A/80/537, para. 15)] \n \n \n \n80/74. Assistance in mine action \n \n \n \nThe General Assembly, \n \nRecalling its resolution 78/70 of 7 December 2023 and all its previous \nresolutions on assistance in mine clearance and on assistance in mine action, all \nadopted without a vote, \n \nRecalling also all relevant treaties and conventions1 and their review processes, \n \nNoting with appreciation the extent to which the International Day for Mine \nAwareness and Assistance in Mine Action continues to be commemorated worldwide, \n \nNoting all relevant United Nations resolutions that take into account the \nhumanitarian aspects of assistance in mine action, \n \nReaffirming its deep concern at the grave humanitarian and development impact \nof mines and explosive remnants of war,2 in affected countries, which have serious \nand lasting social and economic consequences for their civilian populations, including \nrefugees and other displaced persons returning to their homes, as well as persons \nresiding in conflict and post-conflict areas, and which hinder the access of people in \n_______________ \n \n1 These include the Convention on the Prohibition of the Use, Stockpiling, Production and \nTransfer of Anti-Personnel Mines and on Their Destruction, 1997; the Protocol on Prohibitions \nor Restrictions on the Use of Mines, Booby Traps and Other Devices, as amended in 1996 \n(Protocol II to the 1980 Convention on Prohibitions or Restrictions on the Use of Certain \nConventional Weapons Which May Be Deemed to Be Excessively Injurious or to Have \nIndiscriminate Effects); the Protocol on Explosive Remnants of War, 2003 (Protocol V to the \n1980 Convention); the Convention on Cluster Munitions, 2008; the Protocol Additional to the \nGeneva Conventions of 12 August 1949, and relating to the Protection of Victims of \nInternational Armed Conflicts 1977 (Protocol I); and the Convention on the Rights of Persons \nwith Disabilities, 2006. \n \n2 As defined by Protocol V to the 1980 Convention. \n\nA/RES/80/74 \nAssistance in mine action\n \n25-20096\n2/7 \n \nneed to humanitarian assistance and the achievement of sustainable development and \ninhibit peacebuilding and sustaining peace efforts, \n \nDeeply concerned that children continue to be disproportionately affected by \nmines and explosive remnants of war in conflict and post-conflict situations, \n \nStressing that women and girls experience a differentiated impact as victims of \nmines and explosive remnants of war, and concerned that they are often expected to \ntake on a caregiving role for survivors and provide financial support for their families \nwhen the main provider is injured or killed, \n \nBearing in mind the serious humanitarian risk that mines and explosive remnants \nof war pose, in affected countries, to the safety, health and lives of populations, \nincluding local civilian populations, as well as of personnel participating in \nhumanitarian, peacekeeping, stabilization, rehabilitation, reconstruction and mine \nclearance programmes and operations, \n \nDeeply concerned by the increasing threat of improvised explosive devices to \ncivilian populations, humanitarian personnel, United Nations personnel, including \npeacekeepers, and national defence and security forces, \n \nStrongly condemning all acts of violence, including direct attacks, against \nhumanitarian mine action personnel and facilities and their means of transport and \nequipment, \n \nEmphasizing the continued necessity and urgency of strengthening mine action \nefforts by the international community with a view to eliminating the risk and the \nhumanitarian impact of mines and explosive remnants of war on civilians as soon as \npossible and to facilitating the safe and unhindered access of humanitarian personnel \nand the delivery of supplies and equipment, in accordance with the humanitarian \nprinciples, \n \nRecognizing the continued progress made through a comprehensive approach to \nmine action, including assessing, surveying and clearing mines and explosive \nremnants of war, providing risk education to affected populations and supporting \nvictims, \n \nNoting that, for the purposes of the implementation of the present resolution, \nimprovised explosive devices meeting the definition of mines, booby traps or other \ndevices fall under the scope of mine action when their clearance is undertaken for \nhumanitarian purposes and in areas where major active hostilities have ceased, \n \nRecognizing that, in addition to the primary role of Member States, the United \nNations plays a significant role in the field of assistance in mine action, in particular \nthrough the implementation of the Strategy of the United Nations on Mine Action by \nmembers of the Inter-Agency Coordination Group on Mine Action,3 chaired by the \nMine Action Service at the working level, \n \nConsidering mine action to be an important and integrated component of United \nNations humanitarian assistance and development activities, and noting the \n_______________ \n \n3 Consisting of the Mine Action Service of the Department of Peace Operations of the Secretariat, \nthe Office for Disarmament Affairs of the Secretariat, the United Nations Development \nProgramme, the United Nations Children\u2019s Fund, the United Nations Office for Project Services, \nthe Food and Agriculture Organization of the United Nations, the Office for the Coordination of \nHumanitarian Affairs of the Secretariat, the United Nations Entity for Gender Equality and the \nEmpowerment of Women (UN-Women), the Office of the United Nations High Commissioner for \nHuman Rights, the Office of the United Nations High Commissioner for Refugees, the World \nFood Programme and the World Health Organization. The United Nations Institute for \nDisarmament Research and the World Bank are observers. \n\nAssistance in mine action \nA/RES/80/74\n \n3/7\n25-20096 \n \nintegration of mine action in numerous United Nations peacekeeping operations and \nspecial political missions mandated by the Security Council, \n \nRecognizing the contribution of mine action to the 2030 Agenda for Sustainable \nDevelopment,4 \n \nNoting the important role of mine action in reducing the human cost of weapons, \n \nNoting also that mine action contributes to the realization of durable solutions \nfor refugees and internally displaced persons, including through enabling their safe \nreturn and sustainable reintegration, \n \nNoting further the relevance of the United Nations Disability Inclusion Strategy \nlaunched by the Secretary-General in June 2019 to bring about lasting change on \ndisability inclusion across the United Nations system, in particular by ensuring, \nthrough advocacy and technical assistance, equal access for all persons with \ndisabilities, including victims of mines and explosive ordnance, \n \nNoting the role of the United Nations Global Advocate for persons with \ndisabilities in conflict and peacebuilding situations, \n \nNoting with satisfaction that humanitarian appeals increasingly include mine \naction, where relevant, and underlining the importance of considering mine action \nduring the earliest stages of planning and programming, where appropriate, in \nhumanitarian emergency responses,5 in accordance with the humanitarian principles, \n \nNoting with appreciation the efforts of the Inter-Agency Coordination Group on \nMine Action in cooperating and coordinating with non\u2011governmental organizations \nand other stakeholders and the strengthening of United Nations coordination at the \nglobal level, and encouraging further enhancement of that cooperation, \n \nRecognizing the importance of the full involvement and equal opportunities for \nparticipation of both women and men in mine action programmes and of gender- and \nage-appropriate and disability-inclusive perspective in mine action programmes, \n \nRecognizing also the valuable mine action efforts of national, regional and \ninternational mine action practitioners, including United Nations personnel and \npeacekeepers, and also experts from relevant non\u2011governmental organizations \ninvolved in mine action, enabling local communities and survivors of mines and \nexplosive remnants of war to resume normal lives and reclaim their livelihoods, \nincluding by regaining access to previously contaminated lands, \n \nNoting with appreciation national, regional and subregional efforts, including \nthe ongoing development by the African Union of a strategic framework on mine \naction, as well as other relevant regional mine action strategies, \n \nTaking note of the United Nations Policy on Victim Assistance in Mine Action, \nwhich highlights the significance of integrating victim assistance efforts into broader \nnational and international frameworks, such as the Convention on the Rights of \nPersons with Disabilities,6 as well as the importance of sustained services and support \nto victims of mines and explosive remnants of war, \n_______________ \n \n4 Resolution 70/1. \n \n5 Reaffirming its resolution 46/182 of 19 December 1991 and the guiding principles contained in \nthe annex thereto, other relevant General Assembly and Economic and Social Council resolutions \nand agreed conclusions of the Council, reaffirming also the principles of humanity, neutrality, \nimpartiality and independence in the provision of humanitarian assistance and reaffirming further \nthe need for all actors engaged in the provision of humanitarian assistance in situations of \ncomplex emergencies and natural disasters to promote and fully respect these principles. \n \n6 United Nations, Treaty Series, vol. 2515, No. 44910. \n\nA/RES/80/74 \nAssistance in mine action\n \n25-20096\n4/7 \n \n \nNoting the launch of the Strategy of the United Nations on Mine Action in \nJanuary 2024, including its reinforced monitoring and evaluation mechanism, \nemphasizing the importance of using evaluation to inform the future direction of mine \naction within the United Nations, including the role and function of the Mine Action \nService, and encouraging the members of the Inter-Agency Coordination Group on \nMine Action to continue their work to improve the impact of the United Nations in \nthe field of mine action, \n \nNoting the coordination efforts under the informal donor information-sharing \nforum known as the Mine Action Support Group, which endeavours to coordinate the \nhumanitarian mine action programmes of donor States, harmonizing the prioritization \nof their respective mine action programmes and increasing donor support for mine \naction where it is most needed, \n \nNoting with appreciation the role of the Explosive Ordnance Risk Education \nAdvisory Group, which is co-chaired by the United Nations Children\u2019s Fund and a \nrotating non\u2011governmental organization and comprises 18 leading organizations in \nthe mine action sector and which was formed to steer risk education efforts and to \npromote the use of robust behaviour change strategies to systematically protect \naffected populations from the threat of mines and explosive remnants of war, \n \nNoting the discussions on the issue of improvised explosive devices of the \nGroup of Experts of the High Contracting Parties to the Protocol on Prohibitions or \nRestrictions on the Use of Mines, Booby Traps and Other Devices, as amended on \n3 May 1996 (Amended Protocol II), to the Convention on Prohibitions or Restrictions \non the Use of Certain Conventional Weapons Which May Be Deemed to Be \nExcessively Injurious or to Have Indiscriminate Effects,7 and on the technical annex \nto the Protocol on Explosive Remnants of War (Protocol V) 8 to the Convention on \nProhibitions or Restrictions on the Use of Certain Conventional Weapons Which May \nBe Deemed to Be Excessively Injurious or to Have Indiscriminate Effects, 9 \n \n1. \nTakes note of the report of the Secretary-General, 10  including the \nrecommendations contained therein; \n \n2. \nCalls upon Member States to comply with their respective international \nobligations related to mine action; \n \n3. \nUrges Member States to strengthen their efforts to put an end to the \nsuffering and casualties caused by mines and explosive remnants of war; \n \n4. \nCalls, in particular, for the continuation of the efforts of Member States, \nincluding through South-South, regional and subregional cooperation, bearing in \nmind the need to ensure national ownership, with the assistance of the United Nations \nand relevant organizations involved in mine action, upon request and as appropriate \nand in coordination with the affected country, to foster the establishment and \ndevelopment of national mine action capacities in countries in which mines and \nexplosive remnants of war constitute a serious threat to the safety, health and lives of \nthe local civilian population, or an impediment to land cultivation and local resilience, \nand the delivery of humanitarian assistance, as well as social and economic \ndevelopment and peacebuilding efforts at the national and local levels; \n \n5. \nUrges all Member States, in particular those that have the capacity to do \nso, as well as the United Nations system and other relevant organizations and \n_______________ \n \n7 Ibid., vol. 2048, No. 22495. \n \n8 Ibid., vol. 2399, No. 22495. \n \n9 Ibid., vol. 1342, No. 22495. \n \n10 A/80/272. \n\nAssistance in mine action \nA/RES/80/74\n \n5/7\n25-20096 \n \ninstitutions involved in mine action, to support mine- and explosive remnants of war-\naffected States, upon request and as appropriate, by providing: \n \n(a) \nAssistance to countries affected by mines and explosive remnants of war \nfor the establishment and development of national mine action capacities, including \nin the fulfilment of the relevant international obligations of those countries and the \nimplementation of national mine action strategies and plans; \n \n(b) \nSupport for national and, where and as appropriate, local programmes, in \ncooperation with the relevant bodies of the United Nations system and relevant \nregional, governmental and non\u2011governmental organizations, to reduce the risks \nposed by mines and explosive remnants of war, taking into consideration the different \nneeds of women, girls, boys and men, and the negative implications related to extreme \nweather events and climate change; \n \n(c) \nReliable, \npredictable, \ntimely \nand, \nwhere \npossible, \nmulti-annual \ncontributions for mine action activities, including through national mine action efforts \nand mine action programmes of the United Nations and non\u2011governmental \norganizations, including those relating to rapid response in humanitarian emergencies, \nvictim assistance and mine risk education, as well as the safe mobility of displaced \npersons, food security and agricultural recovery, as appropriate, especially at the local \nlevel, as well as through relevant national, regional and global trust funds, including \nthe voluntary trust fund for assistance in mine action, through the development of \ninnovative financing programmes; \n \n(d) \nNecessary information and technical, financial and material training and \nassistance to locate, remove, destroy and otherwise render ineffective minefields, \nmines and explosive remnants of war, in accordance with international law, as soon \nas possible; \n \n(e) \nTechnological assistance (i) to countries affected by mines and explosive \nremnants of war, and (ii) to promote user-oriented scientific research on and \ndevelopment of mine action techniques and technologies that are effective, \nsustainable, appropriate and environmentally sound; \n \n6. \nEncourages efforts to conduct all mine action activities in accordance with \nthe International Mine Action Standards or national standards compliant with those \nStandards, and emphasizes the importance of ensuring the accuracy and objectivity \nof reporting information as well as of using state-of-the-art technologies and an \ninformation management system, such as the Information Management System for \nMine Action, to help to facilitate mine action activities; \n \n7. \nCalls for explosive ordnance risk education to be context-specific, \nculturally and linguistically appropriate and accessible to persons with disabilities, \nincluding through appropriate community-led delivery; \n \n8. \nNotes the continued update of the International Mine Action Standards, \nand encourages the Mine Action Service to continue its efforts in this regard; \n \n9. \nUrges all mine- and explosive remnants of war-affected States, pursuant \nto applicable international law, to identify all areas, as appropriate, under their \njurisdiction or control containing mines and explosive remnants of war in the most \nefficient manner possible and to employ land release techniques, including \nnon\u2011technical survey, technical survey and clearance when appropriate; \n \n10. Encourages mine- and explosive remnants of war-affected States, with \nsupport from relevant United Nations agencies and development partners as \nappropriate, to proactively mainstream mine action, including victim and survivor \nassistance requirements and their linkage with health care, including mental health \n\nA/RES/80/74 \nAssistance in mine action\n \n25-20096\n6/7 \n \nand psychosocial support and disabilities agendas, into development plans and \nprocesses to ensure that development priorities include mine action and that mine \naction, including victim assistance requirements, is funded in a predictable and \nsustainable manner; \n \n11. \nEncourages all relevant multilateral, regional and national programmes \nand bodies to include activities related to mine action, including clearance, in their \npeacebuilding, \nhumanitarian, \nstabilization, \nrehabilitation, \nsafe \nmobility, \nreconstruction, infrastructure, early recovery, agricultural recovery, as appropriate, \npeace sustainment, disaster risk reduction, food security and development assistance \nactivities, where appropriate, bearing in mind the need to ensure national and local \nownership, sustainability and capacity-building, as well as to include a gender- and \nage-appropriate perspective in all aspects of such activities and to take into account \nthe rights and the specific needs of persons with disabilities; \n \n12. Encourages United Nations entities to account for explosive ordnance \ncontamination in their assessments, plans and budgets, when required, to advance \ntheir own entity\u2019s primary mandates and objectives; \n \n13. Encourages Member States, as appropriate, and relevant organizations \ninvolved in mine action to continue efforts to ensure that mine action programmes \ntake into account risk education, the rights, specific needs and requirements of victims \nand persons with disabilities, that they are gender- and age-sensitive and disability-\ninclusive so that women, girls, boys and men can benefit equally from them, and also \ntake into account the specific needs of refugees and internally displaced persons, as \nwell as persons residing in conflict and post-conflict areas, and encourages the \nparticipation of all stakeholders, including women, in the programming of mine \naction; \n \n14. Encourages the inclusion of refugees and internally displaced persons, as \nwell as persons residing in conflict and post-conflict areas, in mine action national \nplans and strategies in the spirit of \u201cleaving no one behind\u201d and in order to mobilize \nsolutions and reach social cohesion among the populations of countries affected by \nconflict; \n \n15. Urges States to provide humanitarian assistance for victims of mines and \nexplosive remnants of war, as well as support to families and communities, taking \ninto account the rights and specific needs of victims of mines and explosive remnants \nof war, including persons with disabilities, and to take measures to protect civilians \nin situations of armed conflict, in accordance with international law, including \ninternational humanitarian law; \n \n16. Expresses concern at the impediments caused by landmines, explosive \nremnants of war and improvised explosive devices, in certain instances, to efforts on \nidentifying the whereabouts of missing persons, and calls upon States concerned to \ncooperate in that regard; \n \n17. Encourages States to support victims\u2019 and survivors\u2019 access to appropriate \nmedical care, including mental health and psychosocial support, physical and sensory \nrehabilitation, education and skills training and income-earning opportunities, and to \nprovide those services to all, while integrating a gender perspective, with respect for \ninternational law, including international humanitarian law; \n \n18. Encourages a focus on the localization of mine action, including through \nlocal capacity development, bearing in mind relevant international and national \nframeworks, in order to ensure that sustainable and tailored mine action benefits for \naffected communities continue; \n\nAssistance in mine action \nA/RES/80/74\n \n7/7\n25-20096 \n \n \n19. Encourages the provision of capacity-building assistance to affected \ncountries, upon their request, in order to integrate assistance for victims into their \nnational policy frameworks on health care, social services and disability-inclusive \ndevelopment by relevant United Nations agencies, civil society organizations and \nother entities with expertise in those matters; \n \n20. Stresses the importance of cooperation and coordination in mine action \nand of devoting existing resources to that end, as appropriate, emphasizes the primary \nresponsibility of national authorities in that regard, and also stresses the supporting \nrole of the United Nations, with the Mine Action Service as the coordinator for mine \naction within the United Nations system, and other relevant organizations in that \nregard; \n \n21. Encourages the United Nations to continue to take measures to improve \ncoordination, efficiency, transparency and accountability, in particular by \nimplementing the Strategy of the United Nations on Mine Action; \n \n22. Notes with appreciation the continued partnership and cooperation of the \nUnited Nations with regional and subregional organizations, especially the African \nUnion, to mitigate the risk to civilians from mines and explosive remnants of war, \nincluding through the Joint United Nations-African Union Framework for an \nEnhanced Partnership in Peace and Security and other joint initiatives, and encourages \nin this regard the establishment of partnerships with regional, national and local \norganizations, as appropriate; \n \n23. Recognizes the importance of explicitly incorporating references to mine \naction, in ceasefire and peace agreements, when appropriate, as well as in the \nmandates of peacekeeping operations and special political missions, as appropriate, \nin coordination with host Governments, in the light of the potential that mine action \ncan have as a peace- and confidence-building measure in post-conflict situations \namong the parties concerned and in view of the ongoing dangers faced by United \nNations personnel, including peacekeepers, and host populations; \n \n24. Encourages those Member States and organizations in a position to do so \nto support measures by all relevant actors aimed at improving rapid response capacity \nin humanitarian emergencies, as well as transparency and accountability; \n \n25. Requests the Secretary-General to submit to the General Assembly at its \neighty-second session a report on the implementation of the present resolution and on \nfollow-up to previous resolutions on assistance in mine clearance and on assistance \nin mine action; \n \n26. Decides to include in the provisional agenda of its eighty-second session \nthe item entitled \u201cAssistance in mine action\u201d. \n \n55th plenary meeting \n5 December 2025 \n \n",
  "paragraphs": {
    "1": "Takes note of the report of the Secretary-General, 10 including the recommendations contained therein;",
    "2": "Calls upon Member States to comply with their respective international obligations related to mine action;",
    "3": "Urges Member States to strengthen their efforts to put an end to the suffering and casualties caused by mines and explosive remnants of war;",
    "4": "Calls, in particular, for the continuation of the efforts of Member States, including through South-South, regional and subregional cooperation, bearing in mind the need to ensure national ownership, with the assistance of the United Nations and relevant organizations involved in mine action, upon request and as appropriate and in coordination with the affected country, to foster the establishment and development of national mine action capacities in countries in which mines and explosive remnants of war constitute a serious threat to the safety, health and lives of the local civilian population, or an impediment to land cultivation and local resilience, and the delivery of humanitarian assistance, as well as social and economic development and peacebuilding efforts at the national and local levels;",
    "5": "Urges all Member States, in particular those that have the capacity to do so, as well as the United Nations system and other relevant organizations and institutions involved in mine action, to support mine- and explosive remnants of war- affected States, upon request and as appropriate, by providing: (a) Assistance to countries affected by mines and explosive remnants of war for the establishment and development of national mine action capacities, including in the fulfilment of the relevant international obligations of those countries and the implementation of national mine action strategies and plans; (b) Support for national and, where and as appropriate, local programmes, in cooperation with the relevant bodies of the United Nations system and relevant regional, governmental and non\u2011governmental organizations, to reduce the risks posed by mines and explosive remnants of war, taking into consideration the different needs of women, girls, boys and men, and the negative implications related to extreme weather events and climate change; (c) Reliable, predictable, timely and, where possible, multi-annual contributions for mine action activities, including through national mine action efforts and mine action programmes of the United Nations and non\u2011governmental organizations, including those relating to rapid response in humanitarian emergencies, victim assistance and mine risk education, as well as the safe mobility of displaced persons, food security and agricultural recovery, as appropriate, especially at the local level, as well as through relevant national, regional and global trust funds, including the voluntary trust fund for assistance in mine action, through the development of innovative financing programmes; (d) Necessary information and technical, financial and material training and assistance to locate, remove, destroy and otherwise render ineffective minefields, mines and explosive remnants of war, in accordance with international law, as soon as possible; (e) Technological assistance (i) to countries affected by mines and explosive remnants of war, and (ii) to promote user-oriented scientific research on and development of mine action techniques and technologies that are effective, sustainable, appropriate and environmentally sound;",
    "6": "Encourages efforts to conduct all mine action activities in accordance with the International Mine Action Standards or national standards compliant with those Standards, and emphasizes the importance of ensuring the accuracy and objectivity of reporting information as well as of using state-of-the-art technologies and an information management system, such as the Information Management System for Mine Action, to help to facilitate mine action activities;",
    "7": "Calls for explosive ordnance risk education to be context-specific, culturally and linguistically appropriate and accessible to persons with disabilities, including through appropriate community-led delivery;",
    "8": "Notes the continued update of the International Mine Action Standards, and encourages the Mine Action Service to continue its efforts in this regard;",
    "9": "Urges all mine- and explosive remnants of war-affected States, pursuant to applicable international law, to identify all areas, as appropriate, under their jurisdiction or control containing mines and explosive remnants of war in the most efficient manner possible and to employ land release techniques, including non\u2011technical survey, technical survey and clearance when appropriate;",
    "10": " and psychosocial support and disabilities agendas, into development plans and processes to ensure that development priorities include mine action and that mine action, including victim assistance requirements, is funded in a predictable and sustainable manner;",
    "11": "Encourages all relevant multilateral, regional and national programmes and bodies to include activities related to mine action, including clearance, in their peacebuilding, humanitarian, stabilization, rehabilitation, safe mobility, reconstruction, infrastructure, early recovery, agricultural recovery, as appropriate, peace sustainment, disaster risk reduction, food security and development assistance activities, where appropriate, bearing in mind the need to ensure national and local ownership, sustainability and capacity-building, as well as to include a gender- and age-appropriate perspective in all aspects of such activities and to take into account the rights and the specific needs of persons with disabilities;",
    "12": "Encourages United Nations entities to account for explosive ordnance contamination in their assessments, plans and budgets, when required, to advance their own entity\u2019s primary mandates and objectives;",
    "13": "Encourages Member States, as appropriate, and relevant organizations involved in mine action to continue efforts to ensure that mine action programmes take into account risk education, the rights, specific needs and requirements of victims and persons with disabilities, that they are gender- and age-sensitive and disability- inclusive so that women, girls, boys and men can benefit equally from them, and also take into account the specific needs of refugees and internally displaced persons, as well as persons residing in conflict and post-conflict areas, and encourages the participation of all stakeholders, including women, in the programming of mine action;",
    "14": "Encourages the inclusion of refugees and internally displaced persons, as well as persons residing in conflict and post-conflict areas, in mine action national plans and strategies in the spirit of \u201cleaving no one behind\u201d and in order to mobilize solutions and reach social cohesion among the populations of countries affected by conflict;",
    "15": "Urges States to provide humanitarian assistance for victims of mines and explosive remnants of war, as well as support to families and communities, taking into account the rights and specific needs of victims of mines and explosive remnants of war, including persons with disabilities, and to take measures to protect civilians in situations of armed conflict, in accordance with international law, including international humanitarian law;",
    "16": "Expresses concern at the impediments caused by landmines, explosive remnants of war and improvised explosive devices, in certain instances, to efforts on identifying the whereabouts of missing persons, and calls upon States concerned to cooperate in that regard;",
    "17": "Encourages States to support victims\u2019 and survivors\u2019 access to appropriate medical care, including mental health and psychosocial support, physical and sensory rehabilitation, education and skills training and income-earning opportunities, and to provide those services to all, while integrating a gender perspective, with respect for international law, including international humanitarian law;",
    "18": "",
    "19": "Encourages the provision of capacity-building assistance to affected countries, upon their request, in order to integrate assistance for victims into their national policy frameworks on health care, social services and disability-inclusive development by relevant United Nations agencies, civil society organizations and other entities with expertise in those matters;",
    "20": "Stresses the importance of cooperation and coordination in mine action and of devoting existing resources to that end, as appropriate, emphasizes the primary responsibility of national authorities in that regard, and also stresses the supporting role of the United Nations, with the Mine Action Service as the coordinator for mine action within the United Nations system, and other relevant organizations in that regard;",
    "21": "Encourages the United Nations to continue to take measures to improve coordination, efficiency, transparency and accountability, in particular by implementing the Strategy of the United Nations on Mine Action;",
    "22": "Notes with appreciation the continued partnership and cooperation of the United Nations with regional and subregional organizations, especially the African Union, to mitigate the risk to civilians from mines and explosive remnants of war, including through the Joint United Nations-African Union Framework for an Enhanced Partnership in Peace and Security and other joint initiatives, and encourages in this regard the establishment of partnerships with regional, national and local organizations, as appropriate;",
    "23": "Recognizes the importance of explicitly incorporating references to mine action, in ceasefire and peace agreements, when appropriate, as well as in the mandates of peacekeeping operations and special political missions, as appropriate, in coordination with host Governments, in the light of the potential that mine action can have as a peace- and confidence-building measure in post-conflict situations among the parties concerned and in view of the ongoing dangers faced by United Nations personnel, including peacekeepers, and host populations;",
    "24": "Encourages those Member States and organizations in a position to do so to support measures by all relevant actors aimed at improving rapid response capacity in humanitarian emergencies, as well as transparency and accountability;",
    "25": "Requests the Secretary-General to submit to the General Assembly at its eighty-second session a report on the implementation of the present resolution and on follow-up to previous resolutions on assistance in mine clearance and on assistance in mine action;",
    "26": "Decides to include in the provisional agenda of its eighty-second session the item entitled \u201cAssistance in mine action\u201d."
  },
  "agenda_items": [
    "Item 46"
  ],
  "symbol_references": []
}