{
  "symbol": "A/RES/73/222",
  "filename": "A_RES_73_222.pdf",
  "title": "73/222. Promotion of international cooperation to combat illicit financial flows and strengthen good practices on assets return to foster sustainable development",
  "text": "United Nations \nA/RES/73/222\n \n \nGeneral Assembly \nDistr.: General \n10 January 2019 \n \n18-22543 (E)    140119     \n*1822543* \n \n \nSeventy-third session \nAgenda item 18 (d) \n \n \n \n \n Resolution adopted by the General Assembly \non 20 December 2018 \n \n \n \n \n[on the report of the Second Committee (A/73/536/Add.4)] \n \n \n 73/222. Promotion of international cooperation to combat illicit financial \nflows and strengthen good practices on assets return to foster \nsustainable development \n \n \n \nThe General Assembly,  \n \nGuided by the purposes and principles enshrined in the Charter of the United \nNations,  \n \nReaffirming its resolution 70/1 of 25 September 2015, entitled \u201cTransforming \nour world: the 2030 Agenda for Sustainable Development\u201d, in which it adopted a \ncomprehensive, far-reaching and people-centred set of universal and transformative \nSustainable Development Goals and targets, its commitment to working tirelessly for \nthe full implementation of the Agenda by 2030, its recognition that eradicating \npoverty in all its forms and dimensions, including extreme poverty, is the greatest \nglobal challenge and an indispensable requirement for sustainable development, its \ncommitment to achieving sustainable development in its three dimensions \u2014 \neconomic, social and environmental \u2014 in a balanced and integrated manner, and to \nbuilding upon the achievements of the Millennium Development Goals and seeking \nto address their unfinished business,  \n \nReaffirming also its resolution 69/313 of 27 July 2015 on the Addis Ababa \nAction Agenda of the Third International Conference on Financing for Development, \nwhich is an integral part of the 2030 Agenda for Sustainable Development, supports \nand complements it, helps to contextualize its means of implementation targets with \nconcrete policies and actions, and reaffirms the strong political commitment to \naddress the challenge of financing and creating an enabling environment at all levels \nfor sustainable development in the spirit of global partnership and solidarity,  \n \nReaffirming further the United Nations Convention against Corruption, 1 which \nis the most comprehensive and universal instrument on corruption, and recognizing \nthe need to continue to promote its ratification or accession thereto and its full and \n__________________ \n \n1  United Nations, Treaty Series, vol. 2349, No. 42146. \n\nA/RES/73/222 \nPromotion of international cooperation to combat illicit financial flows and\nstrengthen good practices on assets return to foster sustainable development\n \n18-22543\n2/5 \n \neffective implementation, including full support for the Mechanism for the Review of \nImplementation of the Convention,  \n \nReaffirming the United Nations Convention against Transnational Organized \nCrime,2  \n \nRecalling its resolutions 65/169 of 20 December 2010, 71/213 of 21 December \n2016 and 72/207 of 20 December 2017, \n \nRecalling also its resolutions 71/208 of 19 December 2016 and 72/196 of \n19 December 2017, \n \nReiterating its deep concern about the impact of illicit financial flows, in \nparticular those caused by tax evasion, corruption and transnational organized crime, \non the economic, social and political stability and development of societies, and \nespecially on developing countries,  \n \nRecognizing the challenge posed by the increasing scope and complexity of \nillicit financial flows and the need for the recovery and return of stolen assets, which \nnecessitates international cooperation, \n \nReaffirming the importance of chapter V of the United Nations Convention \nagainst Corruption, and underlining that the recovery and return of stolen assets \npursuant to that chapter is a fundamental principle of the Convention,  \n \nRecognizing the work carried out by the Conference of the States Parties to the \nUnited Nations Convention against Corruption, and in particular its Open-ended \nIntergovernmental Working Group on Asset Recovery, to advance the full \nimplementation of chapter V of the Convention,  \n \nTaking note of the technical resources produced by the United Nations Office \non Drugs and Crime and the World Bank through the Stolen Asset Recovery Initiative,  \n \nEncouraging States parties to the United Nations Convention against Corruption \nto make full use of the asset recovery tools set forth in chapter V of the Convention, \nincluding mechanisms for the enforcement of foreign restraining and confiscation \norders, as a means of significantly reducing expenses that a State party may normally \nincur in pursuing asset recovery, \n \nCalling upon all States parties to the United Nations Convention against \nCorruption, in particular requesting and requested States, to cooperate to recover the \nproceeds of crime, as defined in the Convention, and to demonstrate their strong \ncommitment to ensuring the return or disposal of such proceeds, in accordance with \narticle 57 of the Convention,  \n \nRecognizing that combating illicit financial flows involves an essential \ndevelopment challenge, and emphasizing that illicit financial flows reduce the \navailability of valuable resources for financing for development, \n \nRecognizing also that global knowledge of the importance of combating illicit \nfinancial flows and enhancing the return of assets is rapidly increasing, as is the \npolitical will to recover illicitly acquired assets by both requesting and requested \nStates, and noting that while many challenges remain unresolved, tackling them \neffectively requires a holistic approach that recognizes the different types of illicit \nfinancial flows and their impact on sustainable development, \n \nRecognizing further the important work undertaken by academia and civil \nsociety, including the International Centre for Asset Recovery and the U4 \nAnti-Corruption Resource Centre, in assisting Member States in understanding the \n__________________ \n \n2  Ibid., vol. 2225, No. 39574. \n\nPromotion of international cooperation to combat illicit financial flows and \nstrengthen good practices on assets return to foster sustainable development \nA/RES/73/222\n \n3/5\n18-22543 \n \nchallenges associated with the return of stolen assets under chapter V of the United \nNations Convention against Corruption, \n \nNoting with appreciation the ongoing efforts by regional organizations and other \nrelevant international forums to strengthen cooperation in preventing and combating \nillicit financial flows, \n \nTaking note of the 2018 report of the Inter-Agency Task Force on Financing for \nDevelopment,3  \n \nWelcoming the establishment of the Platform for Collaboration on Tax to \nintensify collaboration and coordination on tax issues between the United Nations, \nthe International Monetary Fund, the World Bank Group and the Organization for \nEconomic Cooperation and Development, including on formalizing regular \ndiscussions among the four international organizations on the design and \nimplementation of standards for international tax matters and on the strengthening of \ntheir ability to provide capacity-building support to developing countries,  \n \nTaking note of the report of the High-level Panel on Illicit Financial Flows from \nAfrica and its relevant contributions in increasing knowledge of the sources of illicit \nfinancial flows, while reiterating its invitation to other regions to carry out similar \nexercises, \n \nNoting with appreciation the decision of the Heads of State and Government of \nthe African Union to declare 2018 as the African Anti-Corruption Year and the \nappointment of an Anti-Corruption Champion,  \n \nKeeping in mind, therefore, that there are different sources of illicit financial \nflows and that separate analysis of each source is more beneficial in designing policy \nresponses to prevent illicit financial flows,  \n \nNoting efforts to promote the exchange of information and synergy between the \nopen-ended intergovernmental expert meetings to enhance international cooperation \nunder the United Nations Convention against Corruption and the Working Group on \nInternational Cooperation established by the Conference of the Parties to the United \nNations Convention against Transnational Organized Crime,  \n \nNoting also recent international developments on the implementation of the \nStandard for Automatic Exchange of Financial Account Information in Tax Matters \nunder common reporting standards developed by the Organization for Economic \nCooperation and Development, and now involving more than 100 countries, as well \nas the role of the 154 members of the Global Forum on Transparency and Exchange \nof Information for Tax Purposes, which enables cooperation on an equal footing, \n \n1. \nWelcomes the inclusion in the 2030 Agenda for Sustainable Development4 \nof, inter alia, the target related to combating illicit financial flows, recalls that the \nSustainable Development Goals and associated targets are integrated and indivisible \nand balance the three dimensions of sustainable development, and in this regard looks \nforward to their achievement;  \n \n2. \nNotes the inclusion in the Addis Ababa Action Agenda of the Third \nInternational Conference on Financing for Development5 of actions intended to combat \nillicit financial flows, and, in this regard, looks forward to their implementation; \n__________________ \n \n3  Financing for Development: Progress and Prospects 2018 (United Nations publication, Sales \nNo. E.18.I.5). \n \n4  Resolution 70/1. \n \n5  Resolution 69/313, annex. \n\nA/RES/73/222 \nPromotion of international cooperation to combat illicit financial flows and\nstrengthen good practices on assets return to foster sustainable development\n \n18-22543\n4/5 \n \n \n3. \nReaffirms its commitment to work to strengthen regulatory frameworks at \nall levels in accordance with international standards and to further increase \ntransparency and accountability of financial institutions and the corporate sector, as \nwell as public administrations; \n \n4. \nWelcomes the ongoing efforts of Member States to enhance knowledge and \nbroaden understanding of the challenges and opportunities involved in international \ncooperation to combat illicit financial flows and strengthen good practices on assets \nreturn consistent with the United Nations Convention against Corruption1 so as to \nfoster sustainable development;  \n \n5. \nNotes that developing countries are particularly susceptible to the negative \nimpact of illicit financial flows; \n \n6. \nAcknowledges that combating illicit financial flows requires a range of \nactions that includes deterring, detecting, preventing and countering such flows; \n \n7. \nNotes that new technologies have opened the door for a growing number \nof people in developing countries to access digital financial services and can both \nincrease efficiency in revenue collection and strengthen the fight against illicit \nfinancial flows; \n \n8. \nExpresses its concern that virtual assets are increasingly being used for \nillicit activities, and in this regard encourages Member States and other relevant \norganizations to consider taking measures to prevent and counter their illicit use; \n \n9. \nUrges Member States that have not yet done so to consider ratifying or \nacceding to the United Nations Convention against Corruption and the United Nations \nConvention against Transnational Organized Crime and the Protocols thereto, 6 and \nalso urges States parties to those Conventions and Protocols to make efforts towards \ntheir effective implementation;  \n \n10. Calls upon the relevant organizations of the United Nations system, within \ntheir respective mandates and resources, to ensure that no one is left behind and no \ncountry is left behind in the implementation of the present resolution; \n \n11. \nEncourages further efforts by relevant national and international actors to \nmitigate transfer pricing not in line with the arm\u2019s length principle and trade \nmisinvoicing and to avoid base erosion and profit shifting, bearing in mind the need \nfor developing countries to strengthen their domestic resource mobilization in order \nto achieve the Sustainable Development Goals;  \n \n12. Encourages countries and relevant multilateral and international \norganizations to continue their efforts to provide, upon request, technical assistance \nand capacity-building assistance to developing countries in order to improve their \ncapacity to prevent, detect and combat illicit financial flows and strengthen good \npractices on assets return to foster sustainable development; \n \n13. Encourages greater international cooperation to support African and other \nregional initiatives to combat illicit financial flows; \n \n14. Calls upon all countries to cooperate, in accordance with applicable \nbilateral or multilateral agreements, in the areas of mutual legal assistance and \nadministrative assistance in tax matters, as well as the automatic exchange of \nfinancial account information; \n__________________ \n \n6  United Nations, Treaty Series, vols. 2225, 2237, 2241 and 2326, No. 39574. \n\nPromotion of international cooperation to combat illicit financial flows and \nstrengthen good practices on assets return to foster sustainable development \nA/RES/73/222\n \n5/5\n18-22543 \n \n \n15. Recognizes the importance of enhanced capacity for data collection and \nanalysis to combat illicit financial flows, emphasizing the need to increase the \nexchange of data within national Government institutions as well as from \ninternational institutions;  \n \n16. Emphasizes the importance of the ongoing efforts of the United Nations \nOffice on Drugs and Crime, in coordination with the United Nations Conference on \nTrade and Development and other institutions, to develop a methodology to produce \nestimates of the total value of inward and outward illicit financial flows; \n \n17. Reiterates its call to the President of the General Assembly to convene, \nduring the seventy-third session of the Assembly, within existing resources and in \ncoordination with all relevant stakeholders, a high-level meeting on international \ncooperation to combat illicit financial flows and strengthen good practices on assets \nreturn to foster sustainable development; \n \n18. Notes that international cooperation in combating illicit financial flows is \na work in progress that must continue to be pursued, and encourages all countries to \ndevelop effective tools and create a policy environment for combating illicit financial \nflows, in accordance with the existing relevant international frameworks, including \nthe United Nations Convention against Corruption; \n \n19. Notes with concern that proceeds emanating from offences established \nunder the United Nations Convention against Corruption have yet to be disposed of \nin favour of the legitimate owners and victims of the crimes, and pledges to deter, \ndetect, prevent and counter corruption, increase transparency and promote good \ngovernance; \n \n20. Takes note with appreciation of the first meeting of the Global Forum on \nAsset Recovery, which took place in December 2017, supported by the Stolen Asset \nRecovery Initiative, a joint initiative of the World Bank and the United Nations Office \non Drugs and Crime, and welcomes the adoption of the Global Forum on Asset \nRecovery communiqu\u00e9; \n \n21. Stresses that anti-corruption measures should be an integral part of \nnational development policies and strategies;  \n \n22. Looks forward to the inclusion, in the 2019 report of the Inter-Agency Task \nForce on Financing for Development, of an analysis of international cooperation to \ncombat illicit financial flows and strengthen good practices on assets return to foster \nsustainable development, pursuant to the mandate of the Task Force, and also looks \nforward to the deliberations of the Economic and Social Council forum on financing \nfor development follow-up; \n \n23. Decides to include in the provisional agenda of its seventy-fourth session \nunder the item entitled \u201cMacroeconomic policy questions\u201d, a sub-item entitled \n\u201cPromotion of international cooperation to combat illicit financial flows and \nstrengthen good practices on assets return to foster sustainable development\u201d, unless \notherwise agreed. \n \n62nd plenary meeting  \n20 December 2018 \n \n",
  "paragraphs": {
    "1": "Welcomes the inclusion in the 2030 Agenda for Sustainable Development4 of, inter alia, the target related to combating illicit financial flows, recalls that the Sustainable Development Goals and associated targets are integrated and indivisible and balance the three dimensions of sustainable development, and in this regard looks forward to their achievement;",
    "2": "Notes the inclusion in the Addis Ababa Action Agenda of the Third International Conference on Financing for Development5 of actions intended to combat illicit financial flows, and, in this regard, looks forward to their implementation; __________________ 3 Financing for Development: Progress and Prospects 2018 (United Nations publication, Sales No. E.18.I.5). 4 Resolution 70/1. 5 Resolution 69/313, annex. A/RES/73/222 Promotion of international cooperation to combat illicit financial flows and strengthen good practices on assets return to foster sustainable development 18-22543 4/5",
    "3": "Reaffirms its commitment to work to strengthen regulatory frameworks at all levels in accordance with international standards and to further increase transparency and accountability of financial institutions and the corporate sector, as well as public administrations;",
    "4": "Welcomes the ongoing efforts of Member States to enhance knowledge and broaden understanding of the challenges and opportunities involved in international cooperation to combat illicit financial flows and strengthen good practices on assets return consistent with the United Nations Convention against Corruption1 so as to foster sustainable development;",
    "5": "Notes that developing countries are particularly susceptible to the negative impact of illicit financial flows;",
    "6": "Acknowledges that combating illicit financial flows requires a range of actions that includes deterring, detecting, preventing and countering such flows;",
    "7": "Notes that new technologies have opened the door for a growing number of people in developing countries to access digital financial services and can both increase efficiency in revenue collection and strengthen the fight against illicit financial flows;",
    "8": "Expresses its concern that virtual assets are increasingly being used for illicit activities, and in this regard encourages Member States and other relevant organizations to consider taking measures to prevent and counter their illicit use;",
    "9": "Urges Member States that have not yet done so to consider ratifying or acceding to the United Nations Convention against Corruption and the United Nations Convention against Transnational Organized Crime and the Protocols thereto, 6 and also urges States parties to those Conventions and Protocols to make efforts towards their effective implementation;",
    "10": "Calls upon the relevant organizations of the United Nations system, within their respective mandates and resources, to ensure that no one is left behind and no country is left behind in the implementation of the present resolution;",
    "11": "Encourages further efforts by relevant national and international actors to mitigate transfer pricing not in line with the arm\u2019s length principle and trade misinvoicing and to avoid base erosion and profit shifting, bearing in mind the need for developing countries to strengthen their domestic resource mobilization in order to achieve the Sustainable Development Goals;",
    "12": "Encourages countries and relevant multilateral and international organizations to continue their efforts to provide, upon request, technical assistance and capacity-building assistance to developing countries in order to improve their capacity to prevent, detect and combat illicit financial flows and strengthen good practices on assets return to foster sustainable development;",
    "13": "Encourages greater international cooperation to support African and other regional initiatives to combat illicit financial flows;",
    "14": "Calls upon all countries to cooperate, in accordance with applicable bilateral or multilateral agreements, in the areas of mutual legal assistance and administrative assistance in tax matters, as well as the automatic exchange of financial account information; __________________ 6 United Nations, Treaty Series, vols. 2225, 2237, 2241 and 2326, No. 39574. Promotion of international cooperation to combat illicit financial flows and strengthen good practices on assets return to foster sustainable development A/RES/73/222 5/5 18-22543",
    "15": "Recognizes the importance of enhanced capacity for data collection and analysis to combat illicit financial flows, emphasizing the need to increase the exchange of data within national Government institutions as well as from international institutions;",
    "16": "Emphasizes the importance of the ongoing efforts of the United Nations Office on Drugs and Crime, in coordination with the United Nations Conference on Trade and Development and other institutions, to develop a methodology to produce estimates of the total value of inward and outward illicit financial flows;",
    "17": "Reiterates its call to the President of the General Assembly to convene, during the seventy-third session of the Assembly, within existing resources and in coordination with all relevant stakeholders, a high-level meeting on international cooperation to combat illicit financial flows and strengthen good practices on assets return to foster sustainable development;",
    "18": "Notes that international cooperation in combating illicit financial flows is a work in progress that must continue to be pursued, and encourages all countries to develop effective tools and create a policy environment for combating illicit financial flows, in accordance with the existing relevant international frameworks, including the United Nations Convention against Corruption;",
    "19": "Notes with concern that proceeds emanating from offences established under the United Nations Convention against Corruption have yet to be disposed of in favour of the legitimate owners and victims of the crimes, and pledges to deter, detect, prevent and counter corruption, increase transparency and promote good governance;",
    "20": "Takes note with appreciation of the first meeting of the Global Forum on Asset Recovery, which took place in December 2017, supported by the Stolen Asset Recovery Initiative, a joint initiative of the World Bank and the United Nations Office on Drugs and Crime, and welcomes the adoption of the Global Forum on Asset Recovery communiqu\u00e9;",
    "21": "Stresses that anti-corruption measures should be an integral part of national development policies and strategies;",
    "22": "Looks forward to the inclusion, in the 2019 report of the Inter-Agency Task Force on Financing for Development, of an analysis of international cooperation to combat illicit financial flows and strengthen good practices on assets return to foster sustainable development, pursuant to the mandate of the Task Force, and also looks forward to the deliberations of the Economic and Social Council forum on financing for development follow-up;",
    "23": "Decides to include in the provisional agenda of its seventy-fourth session under the item entitled \u201cMacroeconomic policy questions\u201d, a sub-item entitled \u201cPromotion of international cooperation to combat illicit financial flows and strengthen good practices on assets return to foster sustainable development\u201d, unless otherwise agreed. 62nd plenary meeting 20 December 2018"
  },
  "agenda_items": [
    "Item 18"
  ],
  "symbol_references": []
}