{
  "symbol": "A/RES/76/302",
  "filename": "A_RES_76_302.pdf",
  "title": "76/302. International Day for Interventional Cardiology",
  "text": "United Nations \nA/RES/76/302\n \n \nGeneral Assembly \nDistr.: General \n9 September 2022 \n \n22-21525 (E)    140922     \n*2221525* \n \n \nSeventy-sixth session \nAgenda item 129 \nGlobal health and foreign policy \n \n \n \n \n Resolution adopted by the General Assembly \non 2 September 2022 \n \n \n \n \n[without reference to a Main Committee (A/76/L.77 and A/76/L.77/Add.1)] \n \n \n 76/302. International Day for Interventional Cardiology \n \n \n \nThe General Assembly, \n \nReaffirming its resolution 70/1 of 25 September 2015, entitled \u201cTransforming \nour world: the 2030 Agenda for Sustainable Development\u201d, in which it adopted a \ncomprehensive, far-reaching and people-centred set of universal and transformative \nSustainable Development Goals and its aspirational and global targets, which include \nachieving the target of universal health coverage by 2030, including financial risk \nprotection, access to quality essential health-care services and access to safe, \neffective, quality and affordable essential medicines and vaccines for all, \n \nRecalling its resolution 71/159 of 15 December 2016 entitled \u201cGlobal health \nand foreign policy: health employment and economic growth\u201d, in which it underlined \nthe primary responsibility of Member States to accelerate their transition towards \nachieving universal health coverage and recognized that health is a precondition for \nand an outcome and indicator of all three dimensions of sustainable development, \n \nRecalling also its resolution 66/115 of 12 December 2011 on global health and \nforeign policy and all resolutions on the realization of the right of everyone to the \nenjoyment of the highest attainable standard of physical and mental health adopted \nby the General Assembly, \n \nNoting that non-communicable diseases, including heart disease, stroke, cancer, \ndiabetes and chronic lung disease, are collectively responsible for almost 70 per cent \nof all deaths worldwide,  \n \nConcerned that the increasing incidence of non-communicable diseases \nconstitutes a heavy burden on society, with serious social and economic \nconsequences, and aware that there is a need to respond to cardiovascular diseases, \ncancers, diabetes and chronic respiratory diseases, which represent a leading threat to \nhuman health and development, \n\nA/RES/76/302 \nInternational Day for Interventional Cardiology\n \n22-21525\n2/3 \n \n \nNoting that interventional cardio-angiology improves health, increases life \nexpectancy and improves the quality of life, and that angioplasty has been the \nprocedure that has saved the most grams of myocardium at risk worldwide, \n \nReaffirming the leadership role of the World Health Organization in promoting \nglobal action against non-communicable diseases, and the need for that organization \nto continue to cooperate with regional and international organizations in order to \nreduce effectively the impact of non-communicable diseases, \n \nWelcoming the progress that the United Nations Inter-Agency Task Force on the \nPrevention and Control of Non-communicable Diseases makes through joint efforts \nto promote public health and foster the achievement of non-communicable disease-\nrelated targets of the Sustainable Development Goals, as well as through partnerships \nand alliances, when applicable, for the prevention and treatment of non-communicable \ndiseases,  \n \nRecalling the political declaration of the high-level meeting of the General \nAssembly on the prevention and control of non-communicable diseases, adopted by \nthe General Assembly on 19 September 2011,1 and reaffirming the political will to \neffectively implement the commitments contained therein,  \n \nRecalling also the political declaration of the high-level meeting on universal \nhealth coverage, entitled \u201cUniversal health coverage: moving together to build a \nhealthier world\u201d, of 2019,2 which called for the further strengthening of efforts to \naddress non-communicable diseases, including cardiovascular diseases, cancer, \nchronic respiratory diseases and diabetes, as part of universal health coverage, and \nunderlining the fundamental importance of universal health coverage, with a \nparticular focus on access to primary health care and essential public health functions, \nand the urgency of having strong and resilient health systems, reaching those who are \nvulnerable or in vulnerable situations,  \n \nReaffirming its resolutions 53/199 of 15 December 1998 and 61/185 of \n20 December 2006 on the proclamation of international years, and Economic and \nSocial Council resolution 1980/67 of 25 July 1980 on international years and \nanniversaries, in particular paragraphs 1 to 10 of the annex thereto on the agreed \ncriteria for the proclamation of international years, and paragraphs 13 and 14, in \nwhich it is stated that an international day or year should not be proclaimed before \nthe basic arrangements for its organization and financing have been made, \n \nTaking note that, on 16 September 1977, the first coronary angioplasty was \nperformed by Dr. Andreas Gr\u00fcntzig, \n \n1. \nDecides to proclaim 16 September as International Day for Interventional \nCardiology;  \n \n2. \nInvites all Member States, organizations of the United Nations system and \nother global, regional and subregional organizations, as well as other relevant \nstakeholders, including civil society, non-governmental organizations, the private \nsector, academia and individuals, to observe annually the International Day for \nInterventional Cardiology in an appropriate manner and in accordance with national \npriorities, in order to raise public awareness of cardiovascular diseases and \nprocedures, related complications, as well as prevention and care, including through \neducation and the mass media; \n \n3. \nInvites the World Health Organization to facilitate the implementation of \nthe International Day;  \n__________________ \n \n1  Resolution 66/2, annex. \n \n2  Resolution 74/2. \n\nInternational Day for Interventional Cardiology \nA/RES/76/302\n \n3/3\n22-21525 \n \n \n4. \nStresses that the costs of all activities that may arise from the \nimplementation of the present resolution should be met through voluntary \ncontributions, including from the private sector;  \n \n5. \nRequests the Secretary-General to bring the present resolution to the \nattention of all Member States, the organizations of the United Nations system and \nother relevant stakeholders, including civil society, the private sector and academia, \nfor appropriate observance. \n \n98th plenary meeting \n2 September 2022 \n \n",
  "paragraphs": {
    "1": "Decides to proclaim 16 September as International Day for Interventional Cardiology;",
    "2": "Invites all Member States, organizations of the United Nations system and other global, regional and subregional organizations, as well as other relevant stakeholders, including civil society, non-governmental organizations, the private sector, academia and individuals, to observe annually the International Day for Interventional Cardiology in an appropriate manner and in accordance with national priorities, in order to raise public awareness of cardiovascular diseases and procedures, related complications, as well as prevention and care, including through education and the mass media;",
    "3": "Invites the World Health Organization to facilitate the implementation of the International Day; __________________ 1 Resolution 66/2, annex. 2 Resolution 74/2. International Day for Interventional Cardiology A/RES/76/302 3/3 22-21525",
    "4": "Stresses that the costs of all activities that may arise from the implementation of the present resolution should be met through voluntary contributions, including from the private sector;",
    "5": "Requests the Secretary-General to bring the present resolution to the attention of all Member States, the organizations of the United Nations system and other relevant stakeholders, including civil society, the private sector and academia, for appropriate observance. 98th plenary meeting 2 September 2022"
  },
  "agenda_items": [
    "Item 129"
  ],
  "symbol_references": [
    "A/76/L.77"
  ]
}