{
  "symbol": "A/RES/73/258",
  "filename": "A_RES_73_258.pdf",
  "title": "73/258. Cooperation between the United Nations and the Organisation for the Prohibition of Chemical Weapons",
  "text": "United Nations \nA/RES/73/258\n \n \nGeneral Assembly \nDistr.: General \n21 January 2019 \n \n18-22639 (E)    230119 \n*1822639* \n \n \nSeventy-third session \nAgenda item 128 (n) \n \n \n \n \n Resolution adopted by the General Assembly \non 20 December 2018 \n \n \n \n \n[without reference to a Main Committee (A/73/L.72 and A/73/L.72/Add.1 )] \n \n \n 73/258. Cooperation between the United Nations and the Organisation \nfor the Prohibition of Chemical Weapons \n \n \n \nThe General Assembly, \n \nRecalling its resolution 71/250 of 22 December 2016 on cooperation between \nthe United Nations and the Organisation for the Prohibition of Chemical Weapons, \n \nHaving received the annual report for 2016 and the draft report for 2017 of the \nOrganisation for the Prohibition of Chemical Weapons on the implementation of the \nConvention on the Prohibition of the Development, Production, Stockpiling and Use \nof Chemical Weapons and on Their Destruction,1  \n \n1. \nTakes note of the annual report for 2016 and the draft report for 2017 of \nthe Organisation for the Prohibition of Chemical Weapons submitted on its behalf by \nits Director General;1 \n \n2. \nNotes with appreciation the ongoing work of the Organisation for the \nProhibition of Chemical Weapons with regard to the implementation of the \nConvention on the Prohibition of the Development, Production, Stockpiling and Use \nof Chemical Weapons and on Their Destruction;2  \n \n3. \nCommends the commemoration of the twentieth anniversary of the entry \ninto force of the Chemical Weapons Convention and the founding of the Organisation \nfor the Prohibition of Chemical Weapons, held on 29 April 2017;  \n \n4. \nWelcomes the effective and ongoing cooperation between the United \nNations and the Organisation for the Prohibition of Chemical Weapons as set out in \nthe Agreement concerning the Relationship between the United Nations and the \nOrganisation for the Prohibition of Chemical Weapons;3  \n__________________ \n \n1  See A/73/97. \n \n2  United Nations, Treaty Series, vol. 1974, No. 33757. \n \n3  Ibid., vol. 2160, No. 1240. \n\nA/RES/73/258 \nCooperation between the United Nations and the Organisation\nfor the Prohibition of Chemical Weapons\n \n18-22639\n2/2 \n \n \n5. \nAlso welcomes the decision of the Conference of the States Parties to the \nConvention on the Prohibition of the Development, Production, Stockpiling and Use \nof Chemical Weapons and on Their Destruction at its twenty-second session on the \nappointment of Mr. Fernando Arias as the Director General of the Technical \nSecretariat of the Organisation for the Prohibition of Chemical Weapons;4  \n \n6. \nTakes note of the report of the Conference of the States Parties on its fourth \nspecial session, held in The Hague on 26 and 27 June 2018, and also takes note of the \ndecision adopted at the special session entitled \u201cAddressing the threat from chemical \nweapons use\u201d;5  \n \n7. \nRecalls Security Council resolution 2118 (2013) of 27 September 2013, in \nwhich, inter alia, the Council requested the Director General of the Organisation for \nthe Prohibition of Chemical Weapons to report to the Council, on a monthly basis, on \nthe implementation of resolution 2118 (2013) and the decision of the Executive \nCouncil of the Organisation of 27 September 2013, also recalls paragraph 5 of \nSecurity Council resolution 2209 (2015) of 6 March 2015, in which the Council \nwelcomed the intention of the Director General to include future reports of the \nOrganisation for the Prohibition of Chemical Weapons fact-finding mission in the \nSyrian Arab Republic, which was mandated to establish the facts surrounding \nallegations of the use of toxic chemicals for hostile purposes in the Syrian Arab \nRepublic, as part of his monthly report to the Council, notes in this regard the \ntransmission by the Director General of 22 monthly reports, as well as all reports of \nthe fact-finding mission, during the reporting period, and expresses appreciation for \nthe work done in this regard;  \n \n8. \nDecides to include in the provisional agenda of its seventy-fifth session, \nunder the item entitled \u201cCooperation between the United Nations and regional and \nother organizations\u201d, the sub-item entitled \u201cCooperation between the United Nations \nand the Organisation for the Prohibition of Chemical Weapons\u201d. \n \n63rd plenary meeting \n20 December 2018 \n \n__________________ \n \n4  See Organisation for the Prohibition of Chemical Weapons, document C-22/DEC.18. \n \n5  Organisation for the Prohibition of Chemical Weapons, document C-SS-4/DEC.3. \n",
  "paragraphs": {
    "1": "Takes note of the annual report for 2016 and the draft report for 2017 of the Organisation for the Prohibition of Chemical Weapons submitted on its behalf by its Director General;1",
    "2": "Notes with appreciation the ongoing work of the Organisation for the Prohibition of Chemical Weapons with regard to the implementation of the Convention on the Prohibition of the Development, Production, Stockpiling and Use of Chemical Weapons and on Their Destruction;2",
    "3": "Commends the commemoration of the twentieth anniversary of the entry into force of the Chemical Weapons Convention and the founding of the Organisation for the Prohibition of Chemical Weapons, held on 29 April 2017;",
    "4": "Welcomes the effective and ongoing cooperation between the United Nations and the Organisation for the Prohibition of Chemical Weapons as set out in the Agreement concerning the Relationship between the United Nations and the Organisation for the Prohibition of Chemical Weapons;3",
    "5": "Also welcomes the decision of the Conference of the States Parties to the Convention on the Prohibition of the Development, Production, Stockpiling and Use of Chemical Weapons and on Their Destruction at its twenty-second session on the appointment of Mr. Fernando Arias as the Director General of the Technical Secretariat of the Organisation for the Prohibition of Chemical Weapons;4",
    "6": "Takes note of the report of the Conference of the States Parties on its fourth special session, held in The Hague on 26 and 27 June 2018, and also takes note of the decision adopted at the special session entitled \u201cAddressing the threat from chemical weapons use\u201d;5",
    "7": "Recalls Security Council resolution 2118 (2013) of 27 September 2013, in which, inter alia, the Council requested the Director General of the Organisation for the Prohibition of Chemical Weapons to report to the Council, on a monthly basis, on the implementation of resolution 2118 (2013) and the decision of the Executive Council of the Organisation of 27 September 2013, also recalls paragraph 5 of Security Council resolution 2209 (2015) of 6 March 2015, in which the Council welcomed the intention of the Director General to include future reports of the Organisation for the Prohibition of Chemical Weapons fact-finding mission in the Syrian Arab Republic, which was mandated to establish the facts surrounding allegations of the use of toxic chemicals for hostile purposes in the Syrian Arab Republic, as part of his monthly report to the Council, notes in this regard the transmission by the Director General of 22 monthly reports, as well as all reports of the fact-finding mission, during the reporting period, and expresses appreciation for the work done in this regard;",
    "8": "Decides to include in the provisional agenda of its seventy-fifth session, under the item entitled \u201cCooperation between the United Nations and regional and other organizations\u201d, the sub-item entitled \u201cCooperation between the United Nations and the Organisation for the Prohibition of Chemical Weapons\u201d."
  },
  "agenda_items": [
    "Item 128"
  ],
  "symbol_references": [
    "A/73/L.72"
  ]
}