{
  "symbol": "A/RES/75/267",
  "filename": "A_RES_75_267.pdf",
  "title": "75/267. Global Media and Information Literacy Week",
  "text": "United Nations \nA/RES/75/267\n \n \nGeneral Assembly \nDistr.: General \n29 March 2021 \n \n21-04094 (E)    310321    \n*2104094* \n \n \nSeventy-fifth session \nAgenda item 56 \nQuestions relating to information \n \n \n \n \n Resolution adopted by the General Assembly \non 25 March 2021 \n \n \n \n \n[without reference to a Main Committee (A/75/L.68 and A/75/L.68/Add.1)] \n \n \n 75/267. Global Media and Information Literacy Week \n \n \n \nThe General Assembly,  \n \nReaffirming the purposes and principles enshrined in the Charter of the United \nNations and the Universal Declaration of Human Rights, 1 \n \nRecalling article 19 of the International Covenant on Civil and Political Rights 2 \nand article 13 of the International Covenant on Economic, Social and Cultural Rights,3 \n \nRecalling also its resolutions 75/101 A of 10 December 2020, entitled \n\u201cInformation in the service of humanity\u201d, and 75/101 B of 10 December 2020, entitled \n\u201cUnited Nations global communications policies and activities\u201d,  \n \nRecalling further its resolution 75/202 of 21 December 2020, in which it \nrecognized the need for people to have media and information literacy skills and \nwelcomed the holding of Global Media and Information Literacy Week from 24 to \n31 October 2020,  \n \nWelcoming resolution 56 adopted unanimously on 25 November 2019 by the \nGeneral Conference of the United Nations Educational, Scientific and Cultural \nOrganization at its fortieth session, proclaiming 24 to 31 October of each year as \nGlobal Media and Information Literacy Week,4 \n \nReaffirming its resolutions 53/199 of 15 December 1998 and 61/185 of \n20 December 2006 on the proclamation of international years, and Economic and \nSocial Council resolution 1980/67 of 25 July 1980 on international years and \nanniversaries,  \n__________________ \n \n1  Resolution 217 A (III). \n \n2  See resolution 2200 A (XXI), annex. \n \n3  Ibid. \n \n4  See United Nations Educational, Scientific and Cultural Organization, Records of the General \nConference, Fortieth Session, Paris, 12\u201327 November 2019, vol. 1, sect. IV. \n\nA/RES/75/267 \nGlobal Media and Information Literacy Week\n \n21-04094\n2/3 \n \n \nHighlighting the global concerns about the exponential spread and proliferation \nof disinformation and misinformation, thereby increasing the need for the \ndissemination of factual, timely, targeted, clear, accessible, multilingual and science-\nbased information, and emphasizing the need for all Member States to stand together \nto address the challenge of disinformation and misinformation,  \n \nEmphasizing that media and information literacy is also needed for the \nachievement of sustainable development,  \n \nRecognizing that substantial digital divides and data inequalities exist, including \nthe gender digital divide, within and among countries and regions, and between \ndeveloped and developing countries, including in terms of access to and use of \ninformation, media and digital and communications technologies, which may affect \nthe capability of the public, private or other media and individuals to disseminate \ninformation and communicate their views, further recognizing that there is a need to \nensure the diversity of sources and the freedom to seek, receive and impart \ninformation, and noting that these issues can be addressed by, among other things, \nimproving people\u2019s competencies, including as part of lifelong learning,  \n \nRecognizing also the importance of access to information and communication \ntechnologies, including in relation to connectivity and the development of broadband \ninfrastructure and services, especially in a post-pandemic world, and stressing the \nneed to ensure that the benefits of these technologies are accessible to all countries,  \n \nReaffirming the need to ensure balance such that the fight against disinformation \nand misinformation promotes and does not infringe on individuals\u2019 freedom of \nexpression and access to information, and noting that media and information literacy \ncan help to bring about this balance through awareness-raising and a focus on the \nempowerment of people,  \n \nTaking note of the statement by the President of the seventy-fifth session of the \nGeneral Assembly entitled \u201cResponding to an \u2018infodemic\u2019 \u2013 sharing best practices\u201d,  \n \nTaking note also of the cross-regional statement on the infodemic in the context \nof the coronavirus disease (COVID-19), endorsed by 130 Member States, as well as \nan observer State and a Permanent Observer,  \n \nTaking note further of the Secretary-General\u2019s message to the high-level \nconference on the theme \u201cThe danger of disinformation \u2013 countering fake news and \nsafeguarding health in the post-truth era\u201d,  \n \nTaking note of the United Nations Strategy and Plan of Action on Hate Speech, \nin which it is proposed that the United Nations system establish and strengthen \npartnerships with new and traditional media to promote the values of tolerance, \nnon-discrimination, pluralism and freedom of opinion and expression, and to address \nhate speech narratives,  \n \nNoting with appreciation the efforts of the United Nations system in helping to \ncounter the proliferation of misinformation and disinformation, including during the \nCOVID-19 pandemic, by sharing accurate, timely, relevant and multilingual \ninformation, as reflected in the COVID-19 communications response initiative of the \nDepartment of Global Communications of the Secretariat, in particular the Verified \ncampaign announced by the Secretary-General in April 2020, and the joint statement \nentitled \u201cManaging the COVID-19 infodemic: promoting healthy behaviours and \nmitigating the harm from misinformation and disinformation\u201d of the World Health \nOrganization, the United Nations, the United Nations Children\u2019s Fund, the United \nNations Development Programme, the United Nations Educational, Scientific and \nCultural Organization, the Joint United Nations Programme on HIV/AIDS, the \nInternational Telecommunication Union, Global Pulse and the International \nFederation of Red Cross and Red Crescent Societies,  \n\nGlobal Media and Information Literacy Week \nA/RES/75/267\n \n3/3\n21-04094 \n \n \nExpressing its appreciation to all Member States and stakeholders that have \nhosted or have been involved in the promotion of Global Media and Information \nLiteracy Week,  \n \nRecognizing the lead role played by the United Nations Educational, Scientific \nand Cultural Organization, in cooperation with other United Nations specialized \nagencies, in coordinating Global Media and Information Literacy Week celebrations \naround the world,  \n \n1. \nProclaims 24 to 31 October of each year the Global Media and Information \nLiteracy Week;  \n \n2. \nInvites all Member States, relevant organizations of the United Nations \nsystem, \nother \ninternational \norganizations \nand \ncivil \nsociety, \nincluding \nnon-governmental organizations and the private sector, to commemorate Global \nMedia and Information Literacy Week in the way that each considers most \nappropriate, including by focusing on commemorative, educational and public \nawareness activities that tackle the issue of disinformation and misinformation, within \ntheir existing resources;  \n \n3. \nEncourages all Member States to develop and implement policies, action \nplans and strategies related to the promotion of media and information literacy, and \nto increase awareness, capacity for prevention and resilience to disinformation and \nmisinformation, as appropriate;  \n \n4. \nAlso encourages all Member States to incorporate youth perspectives in \nmedia and information literacy policies, strategies and initiatives, and actively \ninvolve youth in the promotion of media and information literacy;  \n \n5. \nUrges Member States to ensure that their plans, policies and strategies to \ncounter disinformation and misinformation are in keeping with the principles of \nindependent and pluralistic media and the right to freedom of expression and opinion;  \n \n6. \nEncourages Member States, the United Nations system and all other \nrelevant stakeholders to enhance cooperation on media and information literacy at the \nglobal, regional and national levels, under the coordination of the United Nations \nEducational, Scientific and Cultural Organization, as well as to strengthen \ncommunications capacities and improve media infrastructure and communications \ntechnology in developing countries, especially in the areas of training and \ndissemination of information;  \n \n7. \nCalls upon United Nations agencies, funds and programmes to deepen \ntheir cooperation with the United Nations Educational, Scientific and Cultural \nOrganization in this field and to support Member States, upon their request, in \npromoting media and information literacy and in observing Global Media and \nInformation Literacy Week;  \n \n8. \nEncourages relevant private sector organizations, including technological \nintermediaries and social media platforms, to promote media and information literacy, \nas a way to empower all people and facilitate digital inclusion and global connectivity, \nand to assist in the fight against disinformation and misinformation;  \n \n9. \nRequests the Secretary-General to bring the present resolution to the \nattention of all Member States, the organizations of the United Nations system and \ncivil society organizations for appropriate observance.  \n \n58th plenary meeting \n25 March 2021 \n \n",
  "paragraphs": {
    "1": "Proclaims 24 to 31 October of each year the Global Media and Information Literacy Week;",
    "2": "Invites all Member States, relevant organizations of the United Nations system, other international organizations and civil society, including non-governmental organizations and the private sector, to commemorate Global Media and Information Literacy Week in the way that each considers most appropriate, including by focusing on commemorative, educational and public awareness activities that tackle the issue of disinformation and misinformation, within their existing resources;",
    "3": "Encourages all Member States to develop and implement policies, action plans and strategies related to the promotion of media and information literacy, and to increase awareness, capacity for prevention and resilience to disinformation and misinformation, as appropriate;",
    "4": "Also encourages all Member States to incorporate youth perspectives in media and information literacy policies, strategies and initiatives, and actively involve youth in the promotion of media and information literacy;",
    "5": "Urges Member States to ensure that their plans, policies and strategies to counter disinformation and misinformation are in keeping with the principles of independent and pluralistic media and the right to freedom of expression and opinion;",
    "6": "Encourages Member States, the United Nations system and all other relevant stakeholders to enhance cooperation on media and information literacy at the global, regional and national levels, under the coordination of the United Nations Educational, Scientific and Cultural Organization, as well as to strengthen communications capacities and improve media infrastructure and communications technology in developing countries, especially in the areas of training and dissemination of information;",
    "7": "Calls upon United Nations agencies, funds and programmes to deepen their cooperation with the United Nations Educational, Scientific and Cultural Organization in this field and to support Member States, upon their request, in promoting media and information literacy and in observing Global Media and Information Literacy Week;",
    "8": "Encourages relevant private sector organizations, including technological intermediaries and social media platforms, to promote media and information literacy, as a way to empower all people and facilitate digital inclusion and global connectivity, and to assist in the fight against disinformation and misinformation;",
    "9": "Requests the Secretary-General to bring the present resolution to the attention of all Member States, the organizations of the United Nations system and civil society organizations for appropriate observance."
  },
  "agenda_items": [
    "Item 56"
  ],
  "symbol_references": [
    "A/75/L.68"
  ]
}