{
  "symbol": "A/RES/78/158",
  "filename": "A_RES_78_158.pdf",
  "title": "78/158. Combating sand and dust storms",
  "text": "United Nations \nA/RES/78/158\n \n \nGeneral Assembly \nDistr.: General \n21 December 2023 \n \n23-25894 (E)    030124 \n*2325894* \n \n \nSeventy-eighth session \nAgenda item 18 (i) \nSustainable development: combating sand and dust storms\n \n \n \n \n \n Resolution adopted by the General Assembly \non 19 December 2023 \n \n \n \n \n[on the report of the Second Committee (A/78/461/Add.9, para. 7)] \n \n \n 78/158. Combating sand and dust storms \n \n \n \nThe General Assembly, \n \nRecalling its resolutions 70/195 of 22 December 2015, 71/219 of 21 December \n2016, 72/225 of 20 December 2017, 73/237 of 20 December 2018, 74/226 of \n19 December 2019, 75/222 of 21 December 2020, 76/211 of 17 December 2021 and \n77/171 of 14 December 2022 on combating sand and dust storms,  \n \nReaffirming its resolution 70/1 of 25 September 2015, entitled \u201cTransforming \nour world: the 2030 Agenda for Sustainable Development\u201d, in which it adopted a \ncomprehensive, far-reaching and people-centred set of universal and transformative \nSustainable Development Goals and targets, its commitment to working tirelessly for \nthe full implementation of the Agenda by 2030, its recognition that eradicating \npoverty in all its forms and dimensions, including extreme poverty, is the greatest \nglobal challenge and an indispensable requirement for sustainable development, its \ncommitment to achieving sustainable development in its three dimensions \u2013 \neconomic, social and environmental \u2013 in a balanced and integrated manner, and to \nbuilding upon the achievements of the Millennium Development Goals and seeking \nto address their unfinished business, \n \nReaffirming also its resolution 69/313 of 27 July 2015 on the Addis Ababa \nAction Agenda of the Third International Conference on Financing for Development, \nwhich is an integral part of the 2030 Agenda for Sustainable Development, supports \nand complements it, helps to contextualize its means of implementation targets with \nconcrete policies and actions, and reaffirms the strong political commitment to \naddress the challenge of financing and creating an enabling environment at all levels \nfor sustainable development in the spirit of global partnership and solidarity,  \n \nReaffirming further the Paris Agreement1 and its early entry into force, and \nencouraging all its parties to fully implement the Agreement, and parties to the United \n__________________ \n \n1  Adopted under the UNFCCC in FCCC/CP/2015/10/Add.1, decision 1/CP.21. \n\nA/RES/78/158 \nCombating sand and dust storms\n \n23-25894\n2/8 \n \nNations Framework Convention on Climate Change2 that have not yet done so to \ndeposit their instruments of ratification, acceptance, approval or accession, where \nappropriate, as soon as possible,  \n \nHighlighting the synergies between the implementation of the 2030 Agenda for \nSustainable Development, the Addis Ababa Action Agenda and the Paris Agreement, \nnoting with concern the findings contained in the special report of the \nIntergovernmental Panel on Climate Change entitled Global Warming of 1.5\u00b0C, noting \nwith concern also the findings of the report of the Asian and Pacific Centre for the \nDevelopment of Disaster Information Management of the Economic and Social \nCommission for Asia and the Pacific entitled Sand and Dust Storms Risk Assessment \nin Asia and the Pacific and the report of the United Nations Environment Programme \nentitled Impacts of Sand and Dust Storms on Oceans: A Scientific Environmental \nAssessment for Policy Makers, in addition to the World Health Organization global \nair quality guidelines and the World Meteorological Organization report entitled 2020 \nState of Climate Services: Risk Information and Early Warning Systems, noting the \nholding of the twenty-seventh session of the Conference of the Parties to the United \nNations Framework Convention on Climate Change, hosted by the Government of \nEgypt in Sharm el-Sheikh from 6 to 20 November 2022, and looking forward to the \ntwenty-eighth session of the Conference of the Parties, to be held in the United Arab \nEmirates from 30 November to 12 December 2023,  \n \nRecalling United Nations Environment Assembly resolutions 1/7 of 27 June \n2014 on strengthening the role of the United Nations Environment Programme in \npromoting air quality,3 2/21 of 27 May 2016 on sand and dust storms4 and 4/10 of \n15 March 2019 on innovation on biodiversity and land degradation, 5 \n \nAcknowledging the work done by the secretariat of the United Nations \nConvention to Combat Desertification in Those Countries Experiencing Serious \nDrought and/or Desertification, Particularly in Africa,6 towards mitigating sand and \ndust storm issues at source, and acknowledging also the continuing support of the \nFood and Agriculture Organization of the United Nations for countries affected by sand \nand dust storms through the promotion of sustainable land use management, \nagroforestry, shelter belts, afforestation/reforestation and land restoration programmes, \nwhich all contribute to sand and dust storm source mitigation,  \n \nRecalling its resolutions 71/229 of 21 December 2016, 72/220 of 20 December \n2017, 73/233 of 20 December 2018, 74/220 of 19 December 2019, 75/218 of \n21 December 2020, 76/206 of 17 December 2021 and 77/166 of 14 December 2022 on \nthe implementation of the United Nations Convention to Combat Desertification in \nThose Countries Experiencing Serious Drought and/or Desertification, Particularly in \nAfrica,  \n \nWelcoming the convening of the fifteenth session of the Conference of the \nParties to the United Nations Convention to Combat Desertification, held in Abidjan, \nC\u00f4te d\u2019Ivoire, from 9 to 20 May 2022, noting the adoption of the Abidjan Call as well \nas the Abidjan Legacy Programme, to address drought and preserve and restore the \nterrestrial ecosystem, reverse land degradation and halt the loss of biodiversity, noting \nalso decision 26/COP.15 of 20 May 2022,7 in which the Conference urged a proactive \napproach to enhance cooperation at all levels to address the causes and impacts of \n__________________ \n \n2  United Nations, Treaty Series, vol. 1771, No. 30822. \n \n3  See Official Records of the General Assembly, Sixty-ninth Session, Supplement No. 25 (A/69/25), \nannex. \n \n4  Ibid., Seventy-first Session, Supplement No. 25 (A/71/25), annex. \n \n5  UNEP/EA.4/Res.10. \n \n6  United Nations, Treaty Series, vol. 1954, No. 33480. \n \n7  See ICCD/COP(15)/23/Add.1. \n\nCombating sand and dust storms \nA/RES/78/158\n \n3/8\n23-25894 \n \nsand and dust storms and called for the organization, as appropriate, of a science-\npolicy dialogue to contribute to the development of further guidance and policies to \naddress sand and dust storms, and welcoming the offers made by the Government of \nSaudi Arabia and the Government of Mongolia to host the sixteenth and seventeenth \nsessions, in 2024 and 2026, respectively,  \n \nWelcoming also the first part of the fifteenth meeting of the Conference of the \nParties to the Convention on Biological Diversity, held in Kunming, China, from 11 \nto 15 October 2021, and the second part of the fifteenth meeting of the Conference of \nthe Parties to the Convention, held in Montreal, Canada, from 7 to 19 December 2022, \nand its outcomes, including the Kunming Montreal Global Biodiversity Framework, \nand urges their early, inclusive and effective implementation,  \n \nRecalling its resolution 66/288 of 27 July 2012, in which it endorsed the \noutcome document of the United Nations Conference on Sustainable Development, \nentitled \u201cThe future we want\u201d,  \n \nNoting the adoption, by the Economic and Social Commission for Asia and the \nPacific at its seventy-second session, of resolution 72/7 of 19 May 2016 on regional \ncooperation to combat sand and dust storms in Asia and the Pacific, and taking note \nof the Regional Plan of Action on Sand and Dust Storms in Asia and the Pacific of \nthe Asian and Pacific Centre for the Development of Disaster Information \nManagement of the Commission,8 \n \nNoting also the endorsement by the Economic and Social Commission for Asia \nand the Pacific at its seventy-fifth session of the recommendation by the Governing \nCouncil of the Asian and Pacific Centre for the Development of Disaster Information \nManagement to establish a subregional cooperation mechanism for slow-onset hazards \nwith a focus on sand and dust storms in South-West and Central Asia, and noting the \nendorsement by the Commission at its seventy-eighth session of the Regional Plan of \nAction on Sand and Dust Storms in Asia and the Pacific, which provides a strategic \nframework and reference for countries in the region to take action at the national and \nregional levels, in the context of multi-hazard disaster risk reduction, to reduce the \nnegative impact of sand and dust storms and identify anthropogenic measures that could \ncontribute to or mitigate their formation and intensity,  \n \nTaking note of the Regional Programme to Combat Sand and Dust Storms of the \nUnited Nations Environment Programme, and of other initiatives, including the \nministerial meeting on sand and dust storms held in Nairobi on 21 February 2013 on \nthe margins of the twenty-seventh session of the Governing Council/Global \nMinisterial Environment Forum of the United Nations Environment Programme,  \n \nRecalling the Sendai Declaration and the Sendai Framework for Disaster Risk \nReduction 2015\u20132030, adopted at the Third United Nations World Conference on \nDisaster Risk Reduction and endorsed by the General Assembly in its resolution \n69/283 of 3 June 2015, and recognizing that one of the priorities for action of the \nFramework is an understanding of disaster risk for prevention and mitigation and for \nthe development and implementation of appropriate preparedness and effective \nresponse to disasters, which continue to undermine efforts to achieve sustainable \ndevelopment, recalling also the convening of the high-level meeting of the General \nAssembly on the midterm review of the Sendai Framework for Disaster Risk \nReduction 2015\u20132030, and its political declaration,9 \n \nNoting with great concern the severe negative impact on human health, safety \nand well-being caused by the coronavirus disease (COVID-19) pandemic, as well as \n__________________ \n \n8  ESCAP/78/12/Add.1. \n \n9  Resolution 77/289, annex. \n\nA/RES/78/158 \nCombating sand and dust storms\n \n23-25894\n4/8 \n \nthe severe disruption to societies and economies and the devastating impact on lives \nand livelihoods, and that the poorest and most vulnerable are the hardest hit by the \npandemic, reaffirming the ambition to get back on track to achieve the Sustainable \nDevelopment Goals by designing and implementing sustainable and inclusive \nrecovery strategies to accelerate progress towards the full implementation of the 2030 \nAgenda for Sustainable Development and to help to reduce the risk of and build \nresilience to future shocks, crises and pandemics, including by strengthening health \nsystems and achieving universal health coverage, and recognizing that equitable and \ntimely access for all to safe, quality, effective and affordable COVID-19 vaccines, \ntherapeutics and diagnostics are an essential part of a global response based on unity, \nsolidarity, renewed multilateral cooperation and the principle of leaving no one behind,  \n \nStressing the need for cooperation at the global and regional levels with a view \nto managing and mitigating the effects of sand and dust storms through the \nenhancement of early warning systems and the sharing of climate and weather \ninformation to forecast sand and dust storms, and affirming that resilient action to \ncombat and prevent sand and dust storms requires a better understanding of the severe \nmultidimensional impacts of sand and dust storms, including the deterioration of the \nhealth, well-being and livelihood of people, increased desertification and land \ndegradation, deforestation, loss of biodiversity and land productivity, and their impact \non sustainable economic growth,  \n \nRecognizing that sand and dust storms are an issue of international concern, the \ncosts of which are measured in economic, social and environmental terms, and that \nsand and dust storms continue to grow and negatively affect the achievement of 11 of \nthe 17 Sustainable Development Goals and their means of implementation, expressing \ndeep concern about the devastating impacts of COVID-19 on human health and well-\nbeing, while taking into consideration that the COVID-19 pandemic has exacerbated \nthe challenges faced by people in vulnerable situations, noting with concern that sand \nand dust storms may exacerbate the symptoms of respiratory diseases such as \nCOVID-19 and may complicate and prolong the recovery from the disease, in addition \nto the other negative impacts that can be associated with respiratory disorders such as \nasthma, tracheitis, pneumonia and silicosis, which may lead to chronic obstructive \npulmonary disease and cardiovascular and heart disorders, in addition to eye and skin \nirritation, and can also spread other diseases, such as meningitis, and taking into \naccount that a reduction in cardiovascular and respiratory disease, as comorbidities \nlinked to COVID-19-related deaths, can produce significant health benefits, when \nmitigating measures are taken,  \n \nEmphasizing the relevance of the efforts and cooperation of Member States at \nthe regional and international levels to control and reduce the negative impacts of \nsand and dust storms on human settlements in vulnerable regions, recalling its \nresolutions 72/225 and 77/171, in which it noted the first International Conference on \nCombating Sand and Dust Storms, held in Tehran from 3 to 5 July 2017, and the \nsecond International Conference on Combating Sand and Dust Storms, held in Tehran \non 9 and 10 September 2023, welcoming the holding of other meetings with the active \nparticipation of all countries, and taking note with appreciation of other ongoing \ninitiatives to combat sand and dust storms, at the national, regional and global levels,  \n \n1. \nTakes note of the report of the Secretary-General;10 \n \n2. \nRecognizes that sand and dust storms and the unsustainable land \nmanagement, soil, agricultural and livestock practices, among other factors, that can \ncause or exacerbate these phenomena, including climate change, pose a serious \nchallenge to the sustainable development of affected countries and regions, also \n__________________ \n \n10  A/78/237. \n\nCombating sand and dust storms \nA/RES/78/158\n \n5/8\n23-25894 \n \nrecognizes that, in the past few years, sand and dust storms have inflicted substantial \neconomic, social and environmental damage on the inhabitants of the world\u2019s arid, \nsemi-arid and dry subhumid areas, especially in Africa and Asia, and underscores the \nneed to treat them and to promptly take measures to address those challenges;  \n \n3. \nRecalls the convening of a high-level interactive dialogue on sand and dust \nstorms, held at Headquarters in New York on 16 July 2018, bringing together Member \nStates, observer States and observers of the General Assembly, United Nations system \nentities, regional commissions and other stakeholders to discuss action-oriented \nrecommendations and address the challenges faced by the affected countries, including \nways to improve policy coordination at the global level to tackle those challenges in the \ncontext of the Sustainable Development Goals, during which the continuing need to \nconfront the challenges presented by sand and dust storms was highlighted;  \n \n4. \nWelcomes the operationalization of the United Nations Coalition on \nCombating Sand and Dust Storms, which is pursuing efforts, within its mandate and \nresources, to move to the implementation stage, and aims, inter alia, to promote and \ncoordinate a collaborative United Nations system response to the growing issue of \nsand and dust storms on a local, regional and global scale, ensuring that unified and \ncoherent action is taken, and to facilitate the capacity-building of Member States, \nraise their awareness and enhance their preparedness and response to sand and dust \nstorms in critical regions;  \n \n5. \nOnce again invites the Secretary-General to consider designating a \nrelevant agency or entity with adequate capacity to act as a focal point on sand and \ndust storms in the United Nations system to follow up the decisions in the relevant \nresolutions and the United Nations Coalition on Combating Sand and Dust Storms; \n \n6. \nRecognizes the importance of new and innovative technologies and best \npractices in combating sand and dust storms, as well as their sharing and transfer on \nmutually agreed terms;  \n \n7. \nEncourages regional, subregional and interregional organizations and \nprocesses to continue to share best practices, policies, experiences and technical \nexpertise in combating and preventing sand and dust storms to address the root causes \nand mitigate the impacts of sand and dust storms, including through improved \nimplementation of sustainable land management, soil, agricultural and livestock \npractices, and to promote regional cooperation in this matter to reduce the risks and \nimpact of future sand and dust storms and to provide affected countries with capacity-\nbuilding and technical support from the relevant United Nations organizations, such as \nthe World Meteorological Organization, the United Nations Environment Programme \nand the World Health Organization, within their respective mandates, to this end; \n \n8. \nTakes note of the convening of the second International Conference on \nCombating Sand and Dust Storms, in Tehran on 9 and 10 September 2023;  \n \n9. \nRequests the President of the General Assembly to convene, at the seventy-\nninth session of the Assembly, a high-level meeting on sand and dust storms, through \nvoluntary contributions and without duplication of effort, in collaboration with the \nUnited Nations Coalition on Combating Sand and Dust Storms, to be held in the \nGeneral Assembly Hall, at United Nations Headquarters in New York, in the context \nof the International Day of Combating Sand and Dust Storms, and encourages the \nparticipation of countries at the highest level possible, to discuss the challenges faced \nby affected countries to further practical actions at the regional and global levels; \n \n10. Invites all affected Member States as well as relevant entities of the United \nNations development system, regional organizations and other relevant stakeholders \nto endeavour to meet the objectives set out in the present resolution;  \n\nA/RES/78/158 \nCombating sand and dust storms\n \n23-25894\n6/8 \n \n \n11. Takes note of the establishment of a regional and global trust fund for the \nWest Asia and African region to combat sand and dust storms, supported by voluntary \ncontributions from interested countries, intergovernmental and non-governmental \norganizations, major groups and other donors, the private sector, civil society and \nregional development banks, to undertake the implementation of regional and \nsubregional programmes and action plans without prejudice to the possibility that this \nfund may include other regions in the future, while respecting international \nframeworks and any relevant documents on combating sand and dust storms to ensure \ncoordinated action at a global scale;  \n \n12. Reaffirms that climate change is one of the greatest challenges of our time \nand, among other factors, is a serious challenge to the sustainable development of all \ncountries, including those affected by sand and dust storms, and emphasizes that, \namong other factors, climate change is an important potential contributor to future \nwind erosion and the risk of sand and dust storms, especially the occurrence of more \nextreme wind events worsening drought conditions and the movement towards drier \nclimates, although reverse effects are possible;  \n \n13. Recognizes that sand and dust storms cause numerous human health \nproblems in different regions around the world, especially in arid, semi-arid and dry \nsubhumid regions, and that there is a need to reinforce protective strategies to reduce \nthe negative impacts of sand and dust storms on human health, invites the World \nHealth Organization, with the cooperation of other relevant United Nations system \nentities, as appropriate, to support affected countries in combating health problems \ncaused by sand and dust storms, within their respective mandates, recognizes the \nformation of a working group on sand and dust storms to discuss emerging issues and \nshare information under the technical advisory group on global air pollution and \nhealth of the World Health Organization, and also recognizes the publication of a \ndedicated section on the health effects of sand and dust storms as part of the World \nHealth Organization global air quality guidelines released in September 2021, and the \ndevelopment of standard operating procedures to assess and address the short-term \nhealth effects of desert dust by the World Health Organization, in collaboration with \nexperts from the World Meteorological Organization;  \n \n14. Emphasizes that sand and dust storm issues will continue to constitute \nimportant components of the global coalition on health, environment and climate \nchange launched in May 2018 by the World Health Organization, the United Nations \nEnvironment Programme and the World Meteorological Organization to improve \ncoordination and reduce deaths that are attributed to environmental risks, such as air \npollution;  \n \n15. Commends the United Nations Environment Assembly on its commitment \nto addressing sand and dust storms, and in this regard notes Environment Assembly \nresolution 2/21 on sand and dust storms, adopted during its second session, and \nresolution 4/10 on innovation on biodiversity and land degradation, adopted during \nits fourth session;  \n \n16. Takes note of the convening of the regional ministerial meeting on \nenvironmental cooperation for a better future held in the Islamic Republic of Iran on \n12 July 2022 to find solutions for regional environmental challenges, especially the \nissue of sand and dust storms;  \n \n17. Recalls the convening of the fifth session of the United Nations \nEnvironment Assembly in Nairobi from 28 February to 2 March 2022, under the \n\nCombating sand and dust storms \nA/RES/78/158\n \n7/8\n23-25894 \n \ntheme \u201cStrengthening actions for nature to achieve the Sustainable Development \nGoals\u201d, and also recalls its ministerial declaration;11 \n \n18. Commends the secretariat of the United Nations Convention to Combat \nDesertification \nin \nThose \nCountries \nExperiencing \nSerious \nDrought \nand/or \nDesertification, Particularly in Africa, on its efforts to develop both a global base map \nof sand and dust storm sources, in collaboration with the United Nations Environment \nProgramme and the World Meteorological Organization, and the Sand and Dust Storms \nCompendium: Information and Guidance on Assessing and Addressing the Risks, in \ncollaboration with the Science-Policy Interface of the Convention and other relevant \nUnited Nations system entities, as a comprehensive collation of material designed to \nprovide information and guidance on how to assess and address the risks posed by sand \nand dust storms and plan actions to combat their recurrence and impacts;  \n \n19. Also commends the World Meteorological Organization for achieving \nseveral improvements to the observation and modelling systems that are part of its \nSand and Dust Storm Warning Advisory and Assessment System, which provides sand \nand dust storm forecasts for early warning systems in various countries, and \nencourages the World Meteorological Organization and all relevant stakeholders to \nbroaden the regional domains of this system to cover the highly affected regions and \nto continue making technical improvements to it;  \n \n20. Welcomes the fifteenth session of the Conference of the Parties to the \nUnited Nations Convention to Combat Desertification, held in Abidjan from 9 to \n20 May 2022, takes note of the Abidjan Call and other relevant decisions adopted by \nthe parties during the Conference, namely decision 26/COP.15, and reaffirms the \nimportance of addressing sand and dust storms under the Convention;  \n \n21. Encourages the relevant entities of the United Nations, including the \nWorld Health Organization, the United Nations Environment Programme, the United \nNations Development Programme, the World Meteorological Organization, the \nUnited Nations Office for Disaster Risk Reduction, the Food and Agriculture \nOrganization of the United Nations and the Department of Economic and Social \nAffairs, within their respective mandates and resources, and donors to continue to \nprovide capacity-building and technical assistance for combating and preventing sand \nand dust storms and to continue to support the implementation of the national, \nregional and global action plans of the affected countries;  \n \n22. Recalls its resolution 77/294 of 8 June 2023, in which 12 July of each year \nwas proclaimed as International Day of Combating Sand and Dust Storms, to further \nraise international awareness of sand and dust storms, and stresses the need for global \nand regional cooperation to manage and mitigate their effects;  \n \n23. Decides to consider during the seventy-eighth session of the General \nAssembly the measures required to proclaim the International Decade for Combating \nSand and Dust Storms, within existing structures and available resources;  \n \n24. Acknowledges the global assessment of sand and dust storms prepared by \nthe United Nations Environment Programme in collaboration with other relevant \nUnited Nations system entities, including the World Meteorological Organization and \nthe secretariat of the United Nations Convention to Combat Desertification, which \nsets out proposals for consolidated and coordinated technical and policy options for \nresponding to sand and dust storms;  \n \n25. Takes note with appreciation of the efforts made by the World Health \nOrganization so far in conducting and its willingness to conduct further studies \nregarding the common effects of both COVID-19 and sand and dust storms on public \n__________________ \n \n11  UNEP/EA.5/HLS.1. \n\nA/RES/78/158 \nCombating sand and dust storms\n \n23-25894\n8/8 \n \nhealth, and invites the United Nations Coalition on Combating Sand and Dust Storms, \nwithin its existing mandate and resources, to continue its efforts to prepare \nrecommendations on mitigating the common effects of both COVID-19 and sand and \ndust storms on the respiratory systems of infected people, to be included in the report \nof the Secretary-General to be submitted to the General Assembly at its seventy-ninth \nsession;  \n \n26. Requests the Secretary-General to further encourage the United Nations \nCoalition on Combating Sand and Dust Storms to conduct its priority activities as \nidentified by the Coalition\u2019s five working groups, which are knowledge-sharing, \ncapacity-building, training, awareness-raising and support for the formulation of \nnational, regional and interregional plans, to mitigate and prevent sand and dust storm \nhazards, to encourage the Coalition to enhance resource mobilization efforts so as to \nincrease voluntary contributions to the Coalition and its member agencies, and invites \nthe Coalition to consider the possibility of broadening the scope of the concept note \nto include other sectors affected by sand and dust storms, in order to align with the \nworkplan of the Coalition; \n \n27. Also requests the Secretary-General to submit to the General Assembly at \nits seventy-ninth session a report on the implementation of the present resolution, \nwhile including best practices aimed at adapting, mitigating, controlling and \ncombating sand and dust storms in collaboration with the affected nations and other \ncountries, and decides to include in the provisional agenda of its seventy-ninth \nsession, under the item entitled \u201cSustainable development\u201d, the sub-item entitled \n\u201cCombating sand and dust storms\u201d. \n \n49th plenary meeting \n19 December 2023 \n \n",
  "paragraphs": {
    "1": "Takes note of the report of the Secretary-General;10",
    "2": "Recognizes that sand and dust storms and the unsustainable land management, soil, agricultural and livestock practices, among other factors, that can cause or exacerbate these phenomena, including climate change, pose a serious challenge to the sustainable development of affected countries and regions, also recognizes that, in the past few years, sand and dust storms have inflicted substantial economic, social and environmental damage on the inhabitants of the world\u2019s arid, semi-arid and dry subhumid areas, especially in Africa and Asia, and underscores the need to treat them and to promptly take measures to address those challenges;",
    "3": "Recalls the convening of a high-level interactive dialogue on sand and dust storms, held at Headquarters in New York on 16 July 2018, bringing together Member States, observer States and observers of the General Assembly, United Nations system entities, regional commissions and other stakeholders to discuss action-oriented recommendations and address the challenges faced by the affected countries, including ways to improve policy coordination at the global level to tackle those challenges in the context of the Sustainable Development Goals, during which the continuing need to confront the challenges presented by sand and dust storms was highlighted;",
    "4": "Welcomes the operationalization of the United Nations Coalition on Combating Sand and Dust Storms, which is pursuing efforts, within its mandate and resources, to move to the implementation stage, and aims, inter alia, to promote and coordinate a collaborative United Nations system response to the growing issue of sand and dust storms on a local, regional and global scale, ensuring that unified and coherent action is taken, and to facilitate the capacity-building of Member States, raise their awareness and enhance their preparedness and response to sand and dust storms in critical regions;",
    "5": "Once again invites the Secretary-General to consider designating a relevant agency or entity with adequate capacity to act as a focal point on sand and dust storms in the United Nations system to follow up the decisions in the relevant resolutions and the United Nations Coalition on Combating Sand and Dust Storms;",
    "6": "Recognizes the importance of new and innovative technologies and best practices in combating sand and dust storms, as well as their sharing and transfer on mutually agreed terms;",
    "7": "Encourages regional, subregional and interregional organizations and processes to continue to share best practices, policies, experiences and technical expertise in combating and preventing sand and dust storms to address the root causes and mitigate the impacts of sand and dust storms, including through improved implementation of sustainable land management, soil, agricultural and livestock practices, and to promote regional cooperation in this matter to reduce the risks and impact of future sand and dust storms and to provide affected countries with capacity- building and technical support from the relevant United Nations organizations, such as the World Meteorological Organization, the United Nations Environment Programme and the World Health Organization, within their respective mandates, to this end;",
    "8": "Takes note of the convening of the second International Conference on Combating Sand and Dust Storms, in Tehran on 9 and 10 September 2023;",
    "9": "Requests the President of the General Assembly to convene, at the seventy- ninth session of the Assembly, a high-level meeting on sand and dust storms, through voluntary contributions and without duplication of effort, in collaboration with the United Nations Coalition on Combating Sand and Dust Storms, to be held in the General Assembly Hall, at United Nations Headquarters in New York, in the context of the International Day of Combating Sand and Dust Storms, and encourages the participation of countries at the highest level possible, to discuss the challenges faced by affected countries to further practical actions at the regional and global levels;",
    "10": "",
    "11": "Takes note of the establishment of a regional and global trust fund for the West Asia and African region to combat sand and dust storms, supported by voluntary contributions from interested countries, intergovernmental and non-governmental organizations, major groups and other donors, the private sector, civil society and regional development banks, to undertake the implementation of regional and subregional programmes and action plans without prejudice to the possibility that this fund may include other regions in the future, while respecting international frameworks and any relevant documents on combating sand and dust storms to ensure coordinated action at a global scale;",
    "12": "Reaffirms that climate change is one of the greatest challenges of our time and, among other factors, is a serious challenge to the sustainable development of all countries, including those affected by sand and dust storms, and emphasizes that, among other factors, climate change is an important potential contributor to future wind erosion and the risk of sand and dust storms, especially the occurrence of more extreme wind events worsening drought conditions and the movement towards drier climates, although reverse effects are possible;",
    "13": "Recognizes that sand and dust storms cause numerous human health problems in different regions around the world, especially in arid, semi-arid and dry subhumid regions, and that there is a need to reinforce protective strategies to reduce the negative impacts of sand and dust storms on human health, invites the World Health Organization, with the cooperation of other relevant United Nations system entities, as appropriate, to support affected countries in combating health problems caused by sand and dust storms, within their respective mandates, recognizes the formation of a working group on sand and dust storms to discuss emerging issues and share information under the technical advisory group on global air pollution and health of the World Health Organization, and also recognizes the publication of a dedicated section on the health effects of sand and dust storms as part of the World Health Organization global air quality guidelines released in September 2021, and the development of standard operating procedures to assess and address the short-term health effects of desert dust by the World Health Organization, in collaboration with experts from the World Meteorological Organization;",
    "14": "Emphasizes that sand and dust storm issues will continue to constitute important components of the global coalition on health, environment and climate change launched in May 2018 by the World Health Organization, the United Nations Environment Programme and the World Meteorological Organization to improve coordination and reduce deaths that are attributed to environmental risks, such as air pollution;",
    "15": "Commends the United Nations Environment Assembly on its commitment to addressing sand and dust storms, and in this regard notes Environment Assembly resolution 2/21 on sand and dust storms, adopted during its second session, and resolution 4/10 on innovation on biodiversity and land degradation, adopted during its fourth session;",
    "16": "Takes note of the convening of the regional ministerial meeting on environmental cooperation for a better future held in the Islamic Republic of Iran on 12 July 2022 to find solutions for regional environmental challenges, especially the issue of sand and dust storms;",
    "17": " theme \u201cStrengthening actions for nature to achieve the Sustainable Development Goals\u201d, and also recalls its ministerial declaration;11",
    "18": "Commends the secretariat of the United Nations Convention to Combat Desertification in Those Countries Experiencing Serious Drought and/or Desertification, Particularly in Africa, on its efforts to develop both a global base map of sand and dust storm sources, in collaboration with the United Nations Environment Programme and the World Meteorological Organization, and the Sand and Dust Storms Compendium: Information and Guidance on Assessing and Addressing the Risks, in collaboration with the Science-Policy Interface of the Convention and other relevant United Nations system entities, as a comprehensive collation of material designed to provide information and guidance on how to assess and address the risks posed by sand and dust storms and plan actions to combat their recurrence and impacts;",
    "19": "Also commends the World Meteorological Organization for achieving several improvements to the observation and modelling systems that are part of its Sand and Dust Storm Warning Advisory and Assessment System, which provides sand and dust storm forecasts for early warning systems in various countries, and encourages the World Meteorological Organization and all relevant stakeholders to broaden the regional domains of this system to cover the highly affected regions and to continue making technical improvements to it;",
    "20": "Welcomes the fifteenth session of the Conference of the Parties to the United Nations Convention to Combat Desertification, held in Abidjan from 9 to 20 May 2022, takes note of the Abidjan Call and other relevant decisions adopted by the parties during the Conference, namely decision 26/COP.15, and reaffirms the importance of addressing sand and dust storms under the Convention;",
    "21": "Encourages the relevant entities of the United Nations, including the World Health Organization, the United Nations Environment Programme, the United Nations Development Programme, the World Meteorological Organization, the United Nations Office for Disaster Risk Reduction, the Food and Agriculture Organization of the United Nations and the Department of Economic and Social Affairs, within their respective mandates and resources, and donors to continue to provide capacity-building and technical assistance for combating and preventing sand and dust storms and to continue to support the implementation of the national, regional and global action plans of the affected countries;",
    "22": "Recalls its resolution 77/294 of 8 June 2023, in which 12 July of each year was proclaimed as International Day of Combating Sand and Dust Storms, to further raise international awareness of sand and dust storms, and stresses the need for global and regional cooperation to manage and mitigate their effects;",
    "23": "Decides to consider during the seventy-eighth session of the General Assembly the measures required to proclaim the International Decade for Combating Sand and Dust Storms, within existing structures and available resources;",
    "24": "Acknowledges the global assessment of sand and dust storms prepared by the United Nations Environment Programme in collaboration with other relevant United Nations system entities, including the World Meteorological Organization and the secretariat of the United Nations Convention to Combat Desertification, which sets out proposals for consolidated and coordinated technical and policy options for responding to sand and dust storms;",
    "25": "Takes note with appreciation of the efforts made by the World Health Organization so far in conducting and its willingness to conduct further studies regarding the common effects of both COVID-19 and sand and dust storms on public health, and invites the United Nations Coalition on Combating Sand and Dust Storms, within its existing mandate and resources, to continue its efforts to prepare recommendations on mitigating the common effects of both COVID-19 and sand and dust storms on the respiratory systems of infected people, to be included in the report of the Secretary-General to be submitted to the General Assembly at its seventy-ninth session;",
    "26": "Requests the Secretary-General to further encourage the United Nations Coalition on Combating Sand and Dust Storms to conduct its priority activities as identified by the Coalition\u2019s five working groups, which are knowledge-sharing, capacity-building, training, awareness-raising and support for the formulation of national, regional and interregional plans, to mitigate and prevent sand and dust storm hazards, to encourage the Coalition to enhance resource mobilization efforts so as to increase voluntary contributions to the Coalition and its member agencies, and invites the Coalition to consider the possibility of broadening the scope of the concept note to include other sectors affected by sand and dust storms, in order to align with the workplan of the Coalition;",
    "27": "Also requests the Secretary-General to submit to the General Assembly at its seventy-ninth session a report on the implementation of the present resolution, while including best practices aimed at adapting, mitigating, controlling and combating sand and dust storms in collaboration with the affected nations and other countries, and decides to include in the provisional agenda of its seventy-ninth session, under the item entitled \u201cSustainable development\u201d, the sub-item entitled \u201cCombating sand and dust storms\u201d."
  },
  "agenda_items": [
    "Item 18"
  ],
  "symbol_references": []
}