{
  "symbol": "A/RES/79/96",
  "filename": "A_RES_79_96.pdf",
  "title": "79/96. Implementation of the Declaration on the Granting of Independence to Colonial Countries and Peoples by the specialized agencies and the international institutions associated with the United Nations",
  "text": "United Nations \nA/RES/79/96\n \n \nGeneral Assembly \nDistr.: General \n12 December 2024 \n \n24-23554 (E)     \n*2423554* \n \n \nSeventy-ninth session \nAgenda item 56 \nImplementation of the Declaration on the Granting of \nIndependence to Colonial Countries and Peoples by the \nspecialized agencies and the international institutions \nassociated with the United Nations \n \n \n \n \n Resolution adopted by the General Assembly \non 4 December 2024 \n \n \n \n \n[on the report of the Special Political and Decolonization Committee \n(Fourth Committee) (A/79/429, para. 8)] \n \n \n \n79/96. Implementation of the Declaration on the Granting of \nIndependence to Colonial Countries and Peoples by the specialized \nagencies and the international institutions associated with the \nUnited Nations \n \n \n \nThe General Assembly, \n \nHaving considered the item entitled \u201cImplementation of the Declaration on the \nGranting of Independence to Colonial Countries and Peoples by the specialized \nagencies and the international institutions associated with the United Nations\u201d, \n \nHaving also considered the report of the Secretary-General1 and the report of \nthe Economic and Social Council2 on the item, \n \nHaving examined the report of the Special Committee on the Situation with \nregard to the Implementation of the Declaration on the Granting of Independence to \nColonial Countries and Peoples for 2024,3 \n \nRecalling its resolutions 1514 (XV) of 14 December 1960 and 1541 (XV) of \n15 December 1960 and the resolutions of the Special Committee, as well as other \nrelevant resolutions and decisions, including, in particular, Economic and Social \nCouncil resolution 2023/33 of 26 July 2023, \n \nBearing in mind the relevant provisions of the final documents of the successive \nConferences of Heads of State or Government of Non-Aligned Countries and of the \n__________________ \n \n1 A/79/66. \n \n2 E/2024/6. \n \n3 Official Records of the General Assembly, Seventy-ninth Session, Supplement No. 23 (A/79/23). \n\nA/RES/79/96 \nImplementation of the Declaration on the Granting of \nIndependence to Colonial Countries and Peoples by the specialized \nagencies and the international institutions associated with the \nUnited Nations\n \n24-23554\n2/5 \n \nresolutions adopted by the Assembly of Heads of State and Government of the African \nUnion, the Pacific Islands Forum and the Caribbean Community, \n \nConscious of the need to facilitate the implementation of the Declaration on the \nGranting of Independence to Colonial Countries and Peoples, contained in resolution \n1514 (XV), \n \nNoting that the large majority of the remaining Non-Self-Governing Territories \nare small island Territories, \n \nWelcoming the assistance extended to Non-Self-Governing Territories by certain \nspecialized agencies and other organizations of the United Nations system, \n \nWelcoming also the participation in the capacity of observers of those Non-Self-\nGoverning Territories that are associate members of regional commissions in the \nworld conferences in the economic and social spheres, subject to the rules of \nprocedure of the General Assembly and in accordance with relevant resolutions and \ndecisions of the United Nations, including resolutions and decisions of the Assembly \nand the Special Committee on specific Territories, \n \nNoting that only some specialized agencies and other organizations of the \nUnited Nations system have been involved in providing assistance to Non-Self-\nGoverning Territories, \n \nStressing that, because the development options of the small island Non-Self-\nGoverning Territories are limited, there are special challenges to planning for and \nimplementing sustainable development and that those Territories will be constrained \nin meeting those challenges without the continuing cooperation and assistance of the \nspecialized agencies and other organizations of the United Nations system, \n \nStressing also the importance of securing the resources necessary for funding \nexpanded programmes of assistance for the peoples concerned and the need to enlist \nthe support of all major funding institutions within the United Nations system in that \nregard, \n \nReaffirming the mandates of the specialized agencies and other organizations of \nthe United Nations system to take all appropriate measures, within their respective \nresponsibilities, to ensure the full implementation of General Assembly resolution \n1514 (XV) and other relevant resolutions, \n \nExpressing its appreciation to the African Union, the Pacific Islands Forum, the \nCaribbean Community and other regional organizations for the continued cooperation \nand assistance that they have extended to the specialized agencies and other \norganizations of the United Nations system in this regard, \n \nExpressing its conviction that closer contacts and consultations between and \namong the specialized agencies and other organizations of the United Nations system \nand regional organizations help to facilitate the effective formulation of programmes \nof assistance to the peoples concerned, \n \nMindful of the imperative need to keep under continuous review the activities \nof the specialized agencies and other organizations of the United Nations system in \nthe implementation of the various resolutions and decisions of the United Nations \nrelating to decolonization, \n \nBearing in mind the extremely fragile economies of the small island Non-Self-\nGoverning Territories and their vulnerability to natural disasters, such as hurricanes, \ncyclones and sea level rise, and recalling the relevant resolutions of the General \nAssembly, \n\nImplementation of the Declaration on the Granting of \nIndependence to Colonial Countries and Peoples by the specialized \nagencies and the international institutions associated with the \nUnited Nations \nA/RES/79/96\n \n3/5\n24-23554 \n \n \nRecalling its resolution 78/83 of 7 December 2023 on the implementation of the \nDeclaration by the specialized agencies and the international institutions associated \nwith the United Nations, \n \n1. \nTakes note of the report of the Secretary-General; \n \n2. \nRecommends that all States intensify their efforts through the specialized \nagencies and other organizations of the United Nations system of which they are \nmembers to ensure the full and effective implementation of the Declaration on the \nGranting of Independence to Colonial Countries and Peoples, contained in General \nAssembly resolution 1514 (XV), and other relevant resolutions of the United Nations; \n \n3. \nReaffirms that the specialized agencies and other organizations and \ninstitutions of the United Nations system should continue to be guided by the relevant \nresolutions of the United Nations in their efforts to contribute to the implementation \nof the Declaration and all other relevant resolutions of the General Assembly; \n \n4. \nAlso reaffirms that the recognition by the General Assembly, the Security \nCouncil and other United Nations organs of the legitimacy of the aspirations of the \npeoples of the Non-Self-Governing Territories to exercise their right to self-\ndetermination entails, as a corollary, the extension of all appropriate assistance to \nthose peoples; \n \n5. \nExpresses its appreciation to those specialized agencies and other \norganizations of the United Nations system that have continued to cooperate with the \nUnited Nations and the regional and subregional organizations in the implementation \nof General Assembly resolution 1514 (XV) and other relevant resolutions of the \nUnited Nations, and requests all the specialized agencies and other organizations of \nthe United Nations system to implement the relevant provisions of those resolutions; \n \n6. \nRequests the specialized agencies and other organizations of the United \nNations system to intensify their engagement with the work of the Special Committee \non the Situation with regard to the Implementation of the Declaration on the Granting \nof Independence to Colonial Countries and Peoples as an important element for the \nimplementation of General Assembly resolution 1514 (XV), including participation \nin the regional seminars on decolonization, upon the invitation of the Special \nCommittee; \n \n7. \nRequests the specialized agencies and other organizations of the United \nNations system and international and regional organizations to examine and review \nconditions in each Territory so as to take appropriate measures to accelerate progress \nin the economic and social sectors of the Territories; \n \n8. \nUrges those specialized agencies and other organizations of the United \nNations system that have not yet provided assistance to Non-Self-Governing \nTerritories to do so as soon as possible; \n \n9. \nRequests the specialized agencies and other organizations and institutions \nof the United Nations system and regional organizations to strengthen existing \nmeasures of support and formulate appropriate programmes of assistance for the \nremaining Non-Self-Governing Territories, within the framework of their respective \nmandates, in order to accelerate progress in the economic and social sectors of those \nTerritories; \n \n10. Requests the specialized agencies and other organizations of the United \nNations system concerned to provide information on: \n \n(a) \nEnvironmental problems facing the Non-Self-Governing Territories; \n\nA/RES/79/96 \nImplementation of the Declaration on the Granting of \nIndependence to Colonial Countries and Peoples by the specialized \nagencies and the international institutions associated with the \nUnited Nations\n \n24-23554\n4/5 \n \n \n(b) \nThe impact of natural disasters, such as hurricanes and volcanic eruptions, \nand other environmental problems, such as beach and coastal erosion and droughts, \non those Territories; \n \n(c) \nWays and means to assist the Territories to fight drug trafficking, money-\nlaundering and other illegal and criminal activities; \n \n(d) \nIllegal exploitation of the marine and other natural resources of the \nTerritories and the need to utilize those resources for the benefit of the peoples of the \nTerritories; \n \n11. Recommends that the executive heads of the specialized agencies and other \norganizations of the United Nations system formulate, with the active cooperation of \nthe regional organizations concerned, concrete proposals for the full implementation \nof the relevant resolutions of the United Nations and submit the proposals to their \ngoverning and legislative organs; \n \n12. Also recommends that the specialized agencies and other organizations of \nthe United Nations system continue to review at the regular meetings of their \ngoverning bodies the implementation of General Assembly resolution 1514 (XV) and \nother relevant resolutions of the United Nations; \n \n13. Recalls the adoption by the Economic Commission for Latin America and \nthe Caribbean of its resolution 574 (XXVII) of 16 May 1998, 4  calling for the \nnecessary mechanisms for its associate members, including Non-Self-Governing \nTerritories, to participate in the special sessions of the General Assembly, subject to \nthe rules of procedure of the Assembly, to review and assess the implementation of \nthe plans of action of those United Nations world conferences in which the Territories \noriginally participated in the capacity of observer, and in the work of the Economic \nand Social Council and its subsidiary bodies; \n \n14. Requests the Chair of the Special Committee to deepen cooperation with \nthe President of the Economic and Social Council on the identical agenda items of \nboth bodies on assistance to the Non-Self-Governing Territories, through regular \nconsultations, in accordance with relevant resolutions on decolonization; \n \n15. Recalls the publication by the Department of Public Information and the \nDepartment of Political Affairs of the Secretariat, in consultation with United Nations \nagencies, funds and programmes and the Special Committee, of an information leaflet \non assistance programmes available to the Non-Self-Governing Territories, which \nwas updated for the United Nations website on decolonization, and requests its \ncontinued updating and wide dissemination; \n \n16. Welcomes the continuing efforts made by the United Nations Development \nProgramme in maintaining close liaison among the specialized agencies and other \norganizations of the United Nations system, including the Economic Commission for \nLatin America and the Caribbean and the Economic and Social Commission for Asia \nand the Pacific, and in providing assistance to the peoples of the Non-Self-Governing \nTerritories; \n \n17. Encourages the Non-Self-Governing Territories to take steps to establish \nand/or strengthen disaster preparedness and management institutions and policies, \ninter alia, with the assistance of the relevant specialized agencies; \n \n18. Requests the administering Powers concerned to facilitate, when \nappropriate, the participation of appointed and elected representatives of Non-Self-\nGoverning Territories in the relevant meetings and conferences of the specialized \n__________________ \n \n4 See Official Records of the Economic and Social Council, 1998, Supplement No. 21 (E/1998/41), \nsect. III.G. \n\nImplementation of the Declaration on the Granting of \nIndependence to Colonial Countries and Peoples by the specialized \nagencies and the international institutions associated with the \nUnited Nations \nA/RES/79/96\n \n5/5\n24-23554 \n \nagencies and other organizations of the United Nations system, in accordance with \nrelevant resolutions and decisions of the United Nations, including resolutions and \ndecisions of the General Assembly and the Special Committee on specific Territories, \nso that the Territories may benefit from the related activities of those agencies and \norganizations; \n \n19. Recommends that all Governments intensify their efforts through the \nspecialized agencies and other organizations of the United Nations system of which \nthey are members to accord priority to the question of providing assistance to the \npeoples of the Non-Self-Governing Territories; \n \n20. Requests the Secretary-General to continue to assist the specialized \nagencies and other organizations of the United Nations system in working out \nappropriate measures for implementing the relevant resolutions of the United Nations \nand to prepare for submission to the relevant bodies, with the assistance of those \nagencies and organizations, a report on the action taken in implementation of the \nrelevant resolutions, including the present resolution, since the circulation of his \nprevious report; \n \n21. Commends the Economic and Social Council for its debate and resolution \non this question, and requests it to continue to consider and intensify its cooperation \nwith the Special Committee, with the aim of developing appropriate measures for the \nfurther coordination of the policies and activities of the specialized agencies and other \norganizations of the United Nations system in implementing the relevant resolutions \nof the General Assembly; \n \n22. Requests the specialized agencies to report annually to the Secretary-\nGeneral on the implementation of the present resolution; \n \n23. Requests the Secretary-General to transmit the present resolution to the \ngoverning bodies of the appropriate specialized agencies and international institutions \nassociated with the United Nations so that those bodies may take the measures \nnecessary to implement it, and also requests the Secretary-General to report to the \nGeneral Assembly at its eightieth session on the implementation of the present \nresolution; \n \n24. Requests the Special Committee to continue to examine the question and \nto report thereon to the General Assembly at its eightieth session. \n \n47th plenary meeting \n4 December 2024 \n \n \n",
  "paragraphs": {
    "1": "Takes note of the report of the Secretary-General;",
    "2": "Recommends that all States intensify their efforts through the specialized agencies and other organizations of the United Nations system of which they are members to ensure the full and effective implementation of the Declaration on the Granting of Independence to Colonial Countries and Peoples, contained in General Assembly resolution 1514 (XV), and other relevant resolutions of the United Nations;",
    "3": "Reaffirms that the specialized agencies and other organizations and institutions of the United Nations system should continue to be guided by the relevant resolutions of the United Nations in their efforts to contribute to the implementation of the Declaration and all other relevant resolutions of the General Assembly;",
    "4": "Also reaffirms that the recognition by the General Assembly, the Security Council and other United Nations organs of the legitimacy of the aspirations of the peoples of the Non-Self-Governing Territories to exercise their right to self- determination entails, as a corollary, the extension of all appropriate assistance to those peoples;",
    "5": "Expresses its appreciation to those specialized agencies and other organizations of the United Nations system that have continued to cooperate with the United Nations and the regional and subregional organizations in the implementation of General Assembly resolution 1514 (XV) and other relevant resolutions of the United Nations, and requests all the specialized agencies and other organizations of the United Nations system to implement the relevant provisions of those resolutions;",
    "6": "Requests the specialized agencies and other organizations of the United Nations system to intensify their engagement with the work of the Special Committee on the Situation with regard to the Implementation of the Declaration on the Granting of Independence to Colonial Countries and Peoples as an important element for the implementation of General Assembly resolution 1514 (XV), including participation in the regional seminars on decolonization, upon the invitation of the Special Committee;",
    "7": "Requests the specialized agencies and other organizations of the United Nations system and international and regional organizations to examine and review conditions in each Territory so as to take appropriate measures to accelerate progress in the economic and social sectors of the Territories;",
    "8": "Urges those specialized agencies and other organizations of the United Nations system that have not yet provided assistance to Non-Self-Governing Territories to do so as soon as possible;",
    "9": "Requests the specialized agencies and other organizations and institutions of the United Nations system and regional organizations to strengthen existing measures of support and formulate appropriate programmes of assistance for the remaining Non-Self-Governing Territories, within the framework of their respective mandates, in order to accelerate progress in the economic and social sectors of those Territories;",
    "10": " (b) The impact of natural disasters, such as hurricanes and volcanic eruptions, and other environmental problems, such as beach and coastal erosion and droughts, on those Territories; (c) Ways and means to assist the Territories to fight drug trafficking, money- laundering and other illegal and criminal activities; (d) Illegal exploitation of the marine and other natural resources of the Territories and the need to utilize those resources for the benefit of the peoples of the Territories;",
    "11": "Recommends that the executive heads of the specialized agencies and other organizations of the United Nations system formulate, with the active cooperation of the regional organizations concerned, concrete proposals for the full implementation of the relevant resolutions of the United Nations and submit the proposals to their governing and legislative organs;",
    "12": "Also recommends that the specialized agencies and other organizations of the United Nations system continue to review at the regular meetings of their governing bodies the implementation of General Assembly resolution 1514 (XV) and other relevant resolutions of the United Nations;",
    "13": "Recalls the adoption by the Economic Commission for Latin America and the Caribbean of its resolution 574 (XXVII) of 16 May 1998, 4 calling for the necessary mechanisms for its associate members, including Non-Self-Governing Territories, to participate in the special sessions of the General Assembly, subject to the rules of procedure of the Assembly, to review and assess the implementation of the plans of action of those United Nations world conferences in which the Territories originally participated in the capacity of observer, and in the work of the Economic and Social Council and its subsidiary bodies;",
    "14": "Requests the Chair of the Special Committee to deepen cooperation with the President of the Economic and Social Council on the identical agenda items of both bodies on assistance to the Non-Self-Governing Territories, through regular consultations, in accordance with relevant resolutions on decolonization;",
    "15": "Recalls the publication by the Department of Public Information and the Department of Political Affairs of the Secretariat, in consultation with United Nations agencies, funds and programmes and the Special Committee, of an information leaflet on assistance programmes available to the Non-Self-Governing Territories, which was updated for the United Nations website on decolonization, and requests its continued updating and wide dissemination;",
    "16": "Welcomes the continuing efforts made by the United Nations Development Programme in maintaining close liaison among the specialized agencies and other organizations of the United Nations system, including the Economic Commission for Latin America and the Caribbean and the Economic and Social Commission for Asia and the Pacific, and in providing assistance to the peoples of the Non-Self-Governing Territories;",
    "17": "Encourages the Non-Self-Governing Territories to take steps to establish and/or strengthen disaster preparedness and management institutions and policies, inter alia, with the assistance of the relevant specialized agencies;",
    "18": "Requests the administering Powers concerned to facilitate, when appropriate, the participation of appointed and elected representatives of Non-Self- Governing Territories in the relevant meetings and conferences of the specialized agencies and other organizations of the United Nations system, in accordance with relevant resolutions and decisions of the United Nations, including resolutions and decisions of the General Assembly and the Special Committee on specific Territories, so that the Territories may benefit from the related activities of those agencies and organizations;",
    "19": "Recommends that all Governments intensify their efforts through the specialized agencies and other organizations of the United Nations system of which they are members to accord priority to the question of providing assistance to the peoples of the Non-Self-Governing Territories;",
    "20": "Requests the Secretary-General to continue to assist the specialized agencies and other organizations of the United Nations system in working out appropriate measures for implementing the relevant resolutions of the United Nations and to prepare for submission to the relevant bodies, with the assistance of those agencies and organizations, a report on the action taken in implementation of the relevant resolutions, including the present resolution, since the circulation of his previous report;",
    "21": "Commends the Economic and Social Council for its debate and resolution on this question, and requests it to continue to consider and intensify its cooperation with the Special Committee, with the aim of developing appropriate measures for the further coordination of the policies and activities of the specialized agencies and other organizations of the United Nations system in implementing the relevant resolutions of the General Assembly;",
    "22": "Requests the specialized agencies to report annually to the Secretary- General on the implementation of the present resolution;",
    "23": "Requests the Secretary-General to transmit the present resolution to the governing bodies of the appropriate specialized agencies and international institutions associated with the United Nations so that those bodies may take the measures necessary to implement it, and also requests the Secretary-General to report to the General Assembly at its eightieth session on the implementation of the present resolution;",
    "24": "Requests the Special Committee to continue to examine the question and to report thereon to the General Assembly at its eightieth session."
  },
  "agenda_items": [
    "Item 56"
  ],
  "symbol_references": []
}