{
  "symbol": "A/RES/80/228",
  "filename": "A_RES_80_228.pdf",
  "title": "80/228. Improving the coordination of efforts against trafficking in persons",
  "text": "United Nations \nA/RES/80/228 \n \nGeneral Assembly \nDistr.: General \n22 December 2025 \n25-20946 (E) \n*2520946* \n \n \nEightieth session \nAgenda item 107 \nCrime prevention and criminal justice \n \n \n \n \n Resolution adopted by the General Assembly \non 18 December 2025 \n \n \n[on the report of the Third Committee (A/80/545, para. 5)] \n \n \n 80/228. Improving the coordination of efforts against trafficking \nin persons \n \n \n \nThe General Assembly, \n \nReiterating its strong condemnation of trafficking in persons, especially women \nand children, which constitutes an offence and a serious threat to human dignity and \nphysical integrity, human rights and sustainable development,  \n \nReiterating its concern that, despite sustained measures taken at the \ninternational, regional and national levels, trafficking in persons remains one of the \ngrave challenges facing the international community, which also impairs the \nenjoyment of human rights and needs a more concerted collective and comprehensive \ninternational response, and is on the rise again with cases of child trafficking \nincreasing, \n \nBearing in mind that all States have an obligation to exercise due diligence to \nprevent, investigate and punish perpetrators of trafficking in persons and to protect \nand assist victims, and that not doing so violates and impairs or nullifies the \nenjoyment of the human rights and fundamental freedoms of the victims, \n \nRecognizing that the coronavirus disease (COVID\u201119) pandemic was one of the \ngreatest global challenges in the history of the United Nations, and recognizing also \nthat the disruption and devastation caused by the COVID\u201119 pandemic has brought \nurgency to strengthening international cooperation to prevent, prepare for and respond \nto pandemics and other health emergencies, taking into account lessons learned from \nthe COVID\u201119 pandemic and other health emergencies to effectively combat \ntrafficking in persons, \n \nRecalling the adoption by the General Assembly of the 2030 Agenda for \nSustainable Development,1 and recalling also the targets of the Sustainable Development \n_______________ \n \n1 Resolution 70/1. \n\nA/RES/80/228 \nImproving the coordination of efforts against trafficking in persons\n \n25-20946\n2/14 \n \nGoals on eliminating all forms of violence against all women and girls in the public \nand private spheres, including trafficking and sexual and other types of exploitation, 2 \non taking immediate and effective measures to eradicate forced labour, end modern \nslavery and trafficking in persons and secure the prohibition and elimination of the \nworst forms of child labour, including recruitment and use of child soldiers, and by \n2025 end child labour in all its forms, 3 and on ending abuse and exploitation of, \ntrafficking in and all forms of violence against and torture of children, 4 \n \nRecalling also the United Nations Convention against Transnational Organized \nCrime, 5  as well as its supplementing Protocol to Prevent, Suppress and Punish \nTrafficking in Persons, Especially Women and Children, 6  which provided the \ndefinition of the crime of trafficking in persons, welcoming the twenty-fifth \nanniversary of the adoption of each instrument, and further acknowledging the \nOptional Protocol to the Convention on the Rights of the Child on the sale of children, \nchild prostitution and child pornography7 and the Supplementary Convention on the \nAbolition of Slavery, the Slave Trade, and Institutions and Practices Similar to \nSlavery,8 \n \nRecalling further the adoption of the Worst Forms of Child Labour Convention, \n1999 (No. 182), of the International Labour Organization, 9  which requires its \nmembers that ratify the Convention to take immediate and effective measures to \nsecure the prohibition and elimination of the worst forms of child labour as a matter \nof urgency, and of the Protocol of 2014 to the Forced Labour Convention, 1930 \n(No. 29), of the International Labour Organization, which recognizes that trafficking \nin persons for the purposes of forced or compulsory labour is the subject of growing \ninternational concern,  \n \nRecalling the adoption of the United Nations Global Plan of Action to Combat \nTrafficking in Persons by the General Assembly in its resolution 64/293 of 30 July \n2010, and underlining the importance of its full implementation,  \nReaffirming that the Global Plan of Action was developed:  \n \n(a) \nTo promote universal ratification of the United Nations Convention against \nTransnational Organized Crime and the Protocol to Prevent, Suppress and Punish \nTrafficking in Persons, Especially Women and Children, as well as other relevant \ninternational instruments that address trafficking in persons, and to reinforce the \nimplementation of existing instruments against trafficking in persons,  \n \n(b) \nTo help Member States to reinforce their political commitments and legal \nobligations to prevent and combat trafficking in persons,  \n \n(c) \nTo promote comprehensive, coordinated and consistent responses at the \nnational, regional and international levels to counter trafficking in persons,  \n \n(d) \nTo promote a human rights-based, gender- and age-sensitive approach in \naddressing all factors that make people vulnerable to trafficking in persons and \nstrengthening the criminal justice response, which are necessary to prevent trafficking \nin persons, protect its victims and prosecute its perpetrators, \n_______________ \n \n2 Target 5.2. \n \n3 Target 8.7. \n \n4 Target 16.2. \n \n5 United Nations, Treaty Series, vol. 2225, No. 39574. \n \n6 Ibid., vol. 2237, No. 39574. \n \n7 Ibid., vol. 2171, No. 27531. \n \n8 Ibid., vol. 266, No. 3822. \n \n9 Ibid., vol. 2133, No. 37245. \n\nImproving the coordination of efforts against trafficking in persons \nA/RES/80/228\n \n3/14\n25-20946 \n \n \n(e) \nTo raise awareness within the United Nations system and also among \nStates and other stakeholders, such as the private sector, civil society and the \ninternational and national mass media, and the public at large,  \n \n(f) \nTo foster cooperation and coordination among all relevant stakeholders, \nincluding Member States, international organizations, civil society organizations and \nthe private sector, and within various entities of the United Nations system, taking \ninto account existing best practices and lessons learned,  \n \nRecalling its resolutions 61/180 of 20 December 2006, 63/194 of 18 December \n2008, 64/178 of 18 December 2009, 67/190 of 20 December 2012, 68/192 of \n18 December 2013, 70/179 of 17 December 2015, 72/195 of 19 December 2017, \n74/176 of 18 December 2019, 76/186 of 16 December 2021 and 78/228 of \n19 December 2023 on improving the coordination of efforts against trafficking in \npersons and its other relevant resolutions on trafficking in persons, 10 \n \nRecalling also its resolutions 71/322 of 8 September 2017, 73/189 of \n17 December 2018, 75/195 of 16 December 2020, 77/236 of 15 December 2022 and \n79/189 of 17 December 2024, entitled \u201cStrengthening and promoting effective \nmeasures and international cooperation on organ donation and transplantation to \nprevent and combat trafficking in persons for the purpose of organ removal and \ntrafficking in human organs\u201d, \n \nRecalling further Economic and Social Council resolutions 2017/18 of 6 July \n2017 and 2021/25 of 22 July 2021 on the implementation of the Global Plan of Action \nand previous Council resolutions on trafficking in persons,  \n \nRecalling Human Rights Council resolution 44/4 of 16 July 2020, entitled \n\u201cTrafficking in persons, especially women and children: strengthening human rights \nthrough enhanced protection, support and empowerment of victims of trafficking, \nespecially women and children\u201d, 11  resolution 53/9 of 12 July 2023, entitled \n\u201cTrafficking in persons, especially women and children\u201d, 12  and other relevant \nresolutions of the Council on trafficking in persons,  \n \nRecalling also Commission on Crime Prevention and Criminal Justice \nresolution 27/2 of 18 May 2018, entitled \u201cPreventing and combating trafficking in \npersons facilitated by the criminal misuse of information and communications \ntechnologies\u201d,13 resolution 27/3 of 18 May 2018, entitled \u201cImproving the protection \nof children against trafficking in persons, including by addressing the criminal misuse \nof information and communications technologies\u201d,14 resolution 27/4 of 18 May 2018, \nentitled \u201cStrengthening measures against trafficking in persons\u201d,15 resolution 32/1 of \n27 May 2023, entitled \u201cTaking action against trafficking in persons in business \noperations, public procurement and supply chains for goods and services\u201d, 16 \nresolution 33/1 of 17 May 2024, entitled \u201cCountering trafficking in persons in the \ncontext of rapid technological change\u201d,17 and the other relevant resolutions of the \nCommission on trafficking in persons, \n_______________ \n \n10 Resolutions 49/166, 50/167, 51/66, 52/98, 53/116, 55/67, 58/137, 59/166, 61/144, 63/156, \n65/190, 67/145, 69/149, 71/167, 73/146, 76/158, 77/194 and 79/154. \n \n11 See Official Records of the General Assembly, Seventy-fifth Session, Supplement No. 53 \n(A/75/53), chap. V, sect. A. \n \n12 Ibid., Seventy-eighth Session, Supplement No. 53 (A/78/53), chap. VII, sect. A. \n \n13 See Official Records of the Economic and Social Council, 2018, Supplement No. 10 (E/2018/30), \nchap. I, sect. C. \n \n14 Ibid. \n \n15 Ibid. \n \n16 Ibid., 2023, Supplement No. 10 (E/2023/30), chap. I, sect. C. \n \n17 Ibid., 2024, Supplement No. 10 (E/2024/30), chap. I, sect. D. \n\nA/RES/80/228 \nImproving the coordination of efforts against trafficking in persons\n \n25-20946\n4/14 \n \n \nWelcoming the adoption of General Assembly resolution 79/286 of 29 April \n2025 entitled \u201cModalities, format and organization of the high-level meeting of the \nGeneral Assembly on the appraisal of the United Nations Global Plan of Action to \nCombat Trafficking in Persons\u201d, providing for the organization of the high-level \nmeeting and the adoption of a political declaration by the Assembly, \n \nRecalling the reference to preventing, countering and combating trafficking in \npersons and to the vulnerabilities of children in the context of addressing trafficking \nin persons and migrant smuggling in the Kyoto Declaration on Advancing Crime \nPrevention, Criminal Justice and the Rule of Law: Towards the Achievement of the \n2030 Agenda for Sustainable Development, adopted by the Fourteenth United Nations \nCongress on Crime Prevention and Criminal Justice, held in Kyoto, Japan, from 7 to \n12 March 2021,18 \n \nRecalling also the New York Declaration for Refugees and Migrants, adopted at \nthe high-level plenary meeting of the General Assembly on addressing large \nmovements of refugees and migrants, held at United Nations Headquarters in New \nYork on 19 September 2016,19 in which States declared that they would, with full \nrespect for their obligations under international law, vigorously combat trafficking in \npersons and migrant smuggling with a view to their elimination, including through \ntargeted measures to identify victims of trafficking in persons or those at risk of \ntrafficking, provide support for the victims of trafficking in persons and work to \nprevent trafficking in persons among those affected by displacement,  \n \nRecognizing that further work is required both to better understand the link \nbetween migration and trafficking in persons and to develop more effective responses \nto eliminate the risk of trafficking in persons in the migration process in order to, \ninter alia, further efforts to protect migrant workers from all forms of violence, \ndiscrimination, exploitation and abuse, \n \nRecognizing also the important role of the Inter-Agency Coordination Group \nagainst Trafficking in Persons in fostering coordination and cooperation in the global \nfight against trafficking in persons, within the existing mandates of its members 20 and \npartners,21 \n_______________ \n \n18 Resolution 76/181, annex. \n \n19 Resolution 71/1. \n \n20 The Council of the Baltic Sea States, the Department of Peace Operations of the Secretariat, the \nDepartment of Political and Peacebuilding Affairs of the Secretariat, the International Centre for \nMigration Policy Development, the International Civil Aviation Organization, the International \nCriminal Police Organization (INTERPOL), the International Labour Organization, the \nInternational Organization for Migration, the International Telecommunication Union, the Joint \nUnited Nations Programme on HIV/AIDS, the Office of the United Nations High Commissioner \nfor Human Rights, the Office of the Special Representative of the Secretary-General for Children \nand Armed Conflict, the Office of the Special Representative of the Secretary-General on Sexual \nViolence in Conflict, the Office of the Special Representative of the Secretary-General on \nViolence against Children, the Organization for Security and Cooperation in Europe, the \nOrganization of American States, the United Nations Children\u2019s Fund, the United Nations \nDevelopment Programme, the United Nations Educational, Scientific and Cultural Organization, \nthe Office of the United Nations High Commissioner for Refugees, the United Nations \nInterregional Crime and Justice Research Institute, the United Nations Office on Drugs and \nCrime, the Office on Genocide Prevention and the Responsibility to Protect, the United Nations \nPopulation Fund, the Counter-Terrorism Committee Executive Directorate, the United Nations \nEntity for Gender Equality and the Empowerment of Women (UN-Women) and the World Bank. \n \n21 The Council of Europe, the Special Rapporteur on trafficking in persons, especially women and \nchildren, the Special Rapporteur on contemporary forms of slavery, including its causes and \nconsequences and the Special Rapporteur on the sale, sexual exploitation and sexual abuse of \nchildren. \n\nImproving the coordination of efforts against trafficking in persons \nA/RES/80/228\n \n5/14\n25-20946 \n \n \nRecalling that the Inter-Agency Coordination Group was established to foster \ncooperation among relevant United Nations agencies and other international \norganizations involved in combating trafficking in persons in countries around the \nworld using, to the extent possible, mechanisms already in place at the regional and \nnational levels, and to share information, experiences and good practices relating to \nthe activities of the partner agencies to counter trafficking with Governments, \ninternational and regional organizations and other relevant bodies, \n \nRecognizing that the Inter-Agency Coordination Group, within its mandate, \ncontributes to the implementation of the Global Plan of Action, taking note with \nappreciation of the activities of the United Nations Office on Drugs and Crime as \ncoordinator of the Coordination Group, as well as the activities of the members of the \nCoordination Group, and encouraging the more robust participation of all members \nof the Coordination Group, \n \nTaking note with appreciation of the work of the 2024 Co-Chairs of the \nInter\u2011Agency Coordination Group, the International Organization for Migration and \nthe Office of the Special Representative of the Secretary-General on Violence against \nChildren, including the 2024 priorities on strengthening multi-stakeholder \npartnerships and reinforcing counter-trafficking responses in crisis contexts, while \nmaintaining a strong emphasis on child protection, \n \nTaking note with appreciation also of the work of the 2025 Co-Chairs of the \nInter-Agency Coordination Group, the Organization of American States and the \nUnited Nations Office on Drugs and Crime, including the provision of a joint \nsubmission to the fourth appraisal of the United Nations Global Plan of Action to \nCombat Trafficking in Persons, which provides the analysis of prevailing trends on \ntrafficking in persons, particularly child trafficking, as well as emerging trends, \nincluding trafficking in persons facilitated and/or enabled through new technologies, \nand recommendations for States\u2019 consideration as priority actions for the period \nahead, and improving understanding of the nexus between trafficking in persons and \nother serious crimes, \n \nTaking note with appreciation further of the thematic focus of the Inter-Agency \nCoordination Group on trafficking in persons and technology, trafficking in persons \nin humanitarian settings, including conflicts, addressing vulnerability to trafficking \nin persons, trafficking in persons for the purpose of organ removal, the relationship \nbetween migration and trafficking in persons, preventing trafficking in persons in \npublic procurement, the non\u2011punishment of trafficking victims, and taking note of the \nwork of the Coordination Group to strengthen coordination among its members and \npartners as well as with other organizations and institutions, including \nnon\u2011governmental actors, civil society, victims and survivors,22 the private sector and \ntrade unions, and of the continued implementation by the Coordination Group of its \nPlan of Action, endorsed at the principal-level meeting on 15 December 2020, as well \nas the efforts of the Coordination Group to increase the visibility of its work, \n \nEmphasizing the central role of the work of the United Nations Office on Drugs \nand Crime in the global fight against trafficking in persons, particularly in providing \ntechnical assistance to Member States, upon their request, to implement the United \nNations Convention against Transnational Organized Crime and the Protocol to \nPrevent, Suppress and Punish Trafficking in Persons, Especially Women and \n_______________ \n \n22 The term \u201csurvivor\u201d or \u201csurvivors\u201d is not defined in the Protocol to Prevent, Suppress and Punish \nTrafficking in Persons, Especially Women and Children, but in some Member States it is used to \nacknowledge that victims of trafficking in persons can recover or have recovered from the \ntrauma that they have endured. \n\nA/RES/80/228 \nImproving the coordination of efforts against trafficking in persons\n \n25-20946\n6/14 \n \nChildren, by making use of existing capacity-building tools, lessons learned from \nMember States and expertise available in other international organizations,  \n \nRecognizing the role of the Working Group on Trafficking in Persons established \nby the Conference of the Parties to the United Nations Convention against \nTransnational Organized Crime, and taking note of the recommendations arising from \nits meetings, which guide States Parties to the Protocol to Prevent, Suppress and \nPunish Trafficking in Persons, Especially Women and Children, supplementing the \nUnited Nations Convention against Transnational Organized Crime in strengthening \ninternational cooperation as well as in exchanging best practices to fight the crime of \ntrafficking in persons, \n \nExpressing concern about the increasing reports of trafficking in persons in the \ncontext of sport, which often involves transnational organized crime groups \nexploiting people in vulnerable situations, especially children, and in this regard \nrecognizing the need to address the knowledge gap around this issue through support \nfor and engagement in data-gathering on trafficking in persons in the context of sport \nin order to ensure that responses are evidence-based, \n \nRecognizing the need to continue to foster a global partnership against \ntrafficking in persons among all stakeholders and the need to continue to work \ntowards an enhanced comprehensive and coordinated approach to prevent and combat \ntrafficking and to protect and assist victims of trafficking in persons through the \nappropriate national, regional and international mechanisms, \n \nRecognizing also the importance of bilateral, subregional, regional and \ninternational cooperation mechanisms and initiatives, including information \nexchanges on good practices and mutual legal assistance, where appropriate, of \nGovernments and of intergovernmental and non\u2011governmental organizations to \naddress the crime of trafficking in persons, especially women and children, \n \nTaking note with appreciation of the different initiatives of Member States, \npromoted in the United Nations to contribute to the global fight against trafficking in \npersons,23 \n \nRecalling that trafficking in persons is fuelled by high profits for traffickers and \ndemand that fosters all forms of exploitation, with trafficking in persons \ndisproportionately affecting women and girls, who are particularly vulnerable to \ntrafficking for the purpose of sexual exploitation, \n \nStressing the need to take appropriate measures to ensure access to justice and \nprotections for victims in criminal justice processes, including measures to ensure \nthat identified victims of trafficking in persons are not penalized for having been \ntrafficked and that they do not suffer from victimization as a result of actions taken \nby government authorities, communities and families, and in this regard taking note \nof the report of the Secretary-General entitled \u201cTrafficking in women and girls: \nstrengthening access to justice for victim-survivors\u201d,24 \n \nRecognizing that broad international cooperation between Member States and \nrelevant intergovernmental and non\u2011governmental organizations is essential for \neffectively countering the threat of trafficking in persons and other contemporary \nforms of slavery, \n_______________ \n \n23 Such as, inter alia, Alliance 8.7; Finance Against Slavery and Trafficking; the call to action to \nend forced labour, modern slavery and human trafficking; the principles to guide government \naction to combat human trafficking in global supply chains; and the Bali Process on People \nSmuggling, Trafficking in Persons and Related Transnational Crime. \n \n24 A/79/322. \n\nImproving the coordination of efforts against trafficking in persons \nA/RES/80/228\n \n7/14\n25-20946 \n \n \nRecognizing also that victims of trafficking are often subject to multiple forms \nof discrimination and violence, including on the grounds of gender, age, disability, \nethnicity, culture and religion, as well as national or social origin, and that these forms \nof discrimination may themselves fuel trafficking in persons, and that women and \nchildren without nationality or without birth registration are particularly vulnerable \nto trafficking in persons, \n \nRecognizing further the potential of the Internet and other information and \ncommunications technologies, including artificial intelligence, to prevent and combat \ntrafficking in persons and to assist victims, stressing the need for increased support \nfor technology-based solutions to identify cases and victims of trafficking and for \nincreased law enforcement cooperation in this regard to address the new challenges \ngenerated by the rapid development of the Internet and other information and \ncommunications technologies, \n \nExpressing concern about the continual use and adaptation of information and \ncommunications technologies, including artificial intelligence, the Internet, social \nmedia and online platforms by the perpetrators of trafficking in persons to facilitate \ntrafficking in persons, including in the context of emergencies, for the purpose of \nrecruitment, exploitation, especially of women and children, controlling victims, \navoiding detection, investigation and prosecution, and transferring the profits of the \ncriminal activity, \n \nStressing the need to promote the establishment of common frameworks, where \nrelevant, for aligning activities and defining and assessing progress, to build a \nvoluntary, robust and shared evidence base of effective programmes and practices to \ncombat trafficking in persons, as well as to promote and protect the rights of victims \nof trafficking in persons and to reintegrate victims into the community, including by \nmaking use, where appropriate, of the Recommended Principles and Guidelines on \nHuman Rights and Human Trafficking25 and the commentary thereon developed by \nthe Office of the United Nations High Commissioner for Human Rights, the \nGuidelines on the Protection of Child Victims of Trafficking developed by the United \nNations Children\u2019s Fund, the assessment toolkit \u201cTrafficking in persons for the \npurpose of organ removal\u201d developed by the United Nations Office on Drugs and \nCrime and the Toolkit for Guidance in Designing and Evaluating Counter-Trafficking \nProgrammes developed by the Inter-Agency Coordination Group against Trafficking \nin Persons, \n \nWelcoming the efforts of Member States, United Nations agencies, international \norganizations, civil society organizations, the private sector and financial institutions \nto address the problem of trafficking in persons, including women and children as the \nmost vulnerable group, and emphasizing the urgent need for them to further enhance \ntheir efforts and cooperation to build the evidence base, including by sharing their \nknowledge and best practices as widely as possible, \n \nAffirming that capacity-building is a very important component in combating \ntrafficking in persons, and in this regard stressing the need to intensify international \ncooperation to combat trafficking in persons, including through bilateral and regional \ninitiatives to enhance judiciary prosecutor\u2019s offices and law enforcement cooperation \nand training, as well as technical assistance for countries aimed at strengthening their \nability to prevent and combat all forms of trafficking, including supporting their \ndevelopment programmes,  \n \nRecalling the Khartoum process and its Declaration adopted in Khartoum on \n16 October 2014 during the Regional Ministerial Conference on Human Trafficking \n_______________ \n \n25 E/2002/68/Add.1. \n\nA/RES/80/228 \nImproving the coordination of efforts against trafficking in persons\n \n25-20946\n8/14 \n \nand Smuggling in the Horn of Africa, coordinated by the African Union, the Office of \nthe United Nations High Commissioner for Refugees and the International \nOrganization for Migration, which aimed to strengthen national, regional and \ninternational cooperation and build capacities in the African countries to combat \ntrafficking in persons and migrant smuggling,  \n \nRecalling also the Third Work Plan for a Comprehensive Response to \nTrafficking in Persons in the Western Hemisphere 2023\u20132028, adopted by the General \nAssembly of the Organization of American States at its fifty-third regular session, \nheld in Washington, D.C., from 21 to 23 June 2023,  \n \nRecalling further the Global Compact for Safe, Orderly and Regular Migration26 \nand the Global Compact on Refugees, 27 and taking note of the adoption by the \nCommittee on the Elimination of Discrimination against Women of its general \nrecommendation No. 38 (2020) on trafficking in women and girls in the context of \nglobal migration,28 \n \nRecognizing that the Global Plan of Action and the establishment of the United \nNations voluntary trust fund for victims of trafficking in persons, especially women \nand children, established in compliance with the Global Plan of Action, aim at raising \nawareness of the situation of victims of trafficking in persons and at providing them \nwith humanitarian, legal and financial aid through established channels of assistance, \nsuch as governmental, intergovernmental and non\u2011governmental organizations,  \n \nReaffirming the importance of humanitarian, legal and financial aid to victims \nof trafficking in persons, including through governmental, intergovernmental and \nnon\u2011governmental organizations, including the United Nations voluntary trust fund \nfor victims of trafficking in persons, especially women and children, managed by the \nUnited Nations Office on Drugs and Crime, the United Nations voluntary trust fund \non contemporary forms of slavery, managed by the Office of the United Nations High \nCommissioner for Human Rights, and the International Organization for Migration \nGlobal Assistance Fund, \n \nRecognizing the need to ensure the protection and provision of appropriate \nsupport and assistance to trafficking victims without discrimination, focusing on long-\nterm reintegration, including access to employment, education and housing, \n \nTaking note of the report of the Secretary-General entitled \u201cImproving the \ncoordination of efforts against trafficking in persons\u201d,29 \n \nTaking note also of the reports of relevant special procedure mandate holders of \nthe Human Rights Council, such as the report of the Special Rapporteur on trafficking \nin persons, especially women and children,30 as well as the reports of the Special \nRapporteur on contemporary forms of slavery, including its causes and \nconsequences,31 and of the Special Rapporteur on the sale, sexual exploitation and \nsexual abuse of children,32 \n \nRecognizing that, in accordance with the United Nations Convention against \nTransnational Organized Crime, the Conference of the Parties to the Convention is \nestablished to improve the capacity of States Parties to combat transnational \n_______________ \n \n26 Resolution 73/195, annex. \n \n27 Official Records of the General Assembly, Seventy-third Session, Supplement No. 12 (A/73/12 \n(Part I) and A/73/12 (Part II)), part II. \n \n28 CEDAW/C/GC/38. \n \n29 A/80/234. \n \n30 A/80/166. \n \n31 A/80/182. \n \n32 A/80/113. \n\nImproving the coordination of efforts against trafficking in persons \nA/RES/80/228\n \n9/14\n25-20946 \n \norganized crime and to promote and review the implementation of the Convention, \nincluding the Protocol to Prevent, Suppress and Punish Trafficking in Persons, \nEspecially Women and Children, and in this regard taking note of resolutions 10/1 of \n16 October 2020, entitled \u201cLaunch of the review process of the Mechanism for the \nReview of the Implementation of the United Nations Convention against \nTransnational Organized Crime and the Protocols thereto\u201d, and 10/3, also of \n16 October 2020, entitled \u201cEffective implementation of the Protocol to Prevent, \nSuppress and Punish Trafficking in Persons, Especially Women and Children, \nsupplementing the United Nations Convention against Transnational Organized \nCrime\u201d, adopted by the Conference of the Parties at its tenth session, held in Vienna \nfrom 12 to 16 October 2020,33 and of resolution 11/5 of 21 October 2022, entitled \n\u201cImplementation of the Protocol to Prevent, Suppress and Punish Trafficking in \nPersons, Especially Women and Children, supplementing the United Nations \nConvention against Transnational Organized Crime\u201d, adopted by the Conference of \nthe Parties at its eleventh session, held in Vienna from 17 to 21 October 2022,34 \n \nRecalling the request made to the Secretary-General by the General Assembly \nin its resolution 64/293 to include, within existing reporting obligations to the \nAssembly under the item on crime prevention and criminal justice, a section on the \nimplementation by the United Nations system of the United Nations Global Plan of \nAction to Combat Trafficking in Persons, \n \n1. \nUrges Member States that have not yet done so to consider ratifying or \nacceding to, as a matter of priority, the United Nations Convention against \nTransnational Organized Crime and the Protocol to Prevent, Suppress and Punish \nTrafficking in Persons, Especially Women and Children, supplementing the United \nNations Convention against Transnational Organized Crime, taking into consideration \nthe central role of those instruments in the fight against trafficking in persons, and \nalso urges States Parties to those instruments to fully and effectively implement their \nobligations;  \n \n2. \nUrges Member States and other stakeholders mentioned in the United \nNations Global Plan of Action to Combat Trafficking in Persons,35 and invites the \nConference of the Parties to the United Nations Convention against Transnational \nOrganized Crime and relevant international, regional and subregional organizations, \nwithin their respective mandates, to continue to contribute to the full and effective \nimplementation of the Global Plan of Action, including by means of strengthening \ncooperation and improving coordination among themselves in achieving that goal; \n \n3. \nCalls upon Governments to closely follow developments in the area of \ninternational protection of victims of trafficking in persons in order to protect the \nhuman rights of such persons and to ensure compliance with international \nhumanitarian law and international human rights law; \n \n4. \nRecalls the holding of the high-level meetings of the General Assembly \nduring its sixty-seventh session, from 13 to 15 May 2013, during its seventy-second \nsession, on 27 and 28 September 2017, during its seventy-sixth session, on 22 and \n23 November 2021, and during its eightieth session, on 24 and 25 November 2025, to \nappraise the progress achieved in the implementation of the Global Plan of Action, \nwhich, inter alia, reiterated strong political will to take decisive concerted action \nagainst trafficking in persons;  \n \n5. \nAlso recalls its decision, in its resolution 68/192, to appraise, from within \nexisting resources, on a four-year basis starting at its seventy-second session, the \n_______________ \n \n33 See CTOC/COP/2020/10, sect. I.A. \n \n34 See CTOC/COP/2022/9, sect. I.A. \n \n35 Resolution 64/293. \n\nA/RES/80/228 \nImproving the coordination of efforts against trafficking in persons\n \n25-20946\n10/14 \n \nprogress achieved in the implementation of the Global Plan of Action in order to \nassess achievements, gaps and challenges, including in the implementation of the \nrelevant legal instruments, and therefore decides to convene a high-level meeting of \nthe General Assembly on the progress achieved in the implementation of the Global \nPlan of Action at its eighty-fourth session, after the general debate, but no later than \nDecember 2029; \n \n6. \nReaffirms its request to the Secretary-General and to the President of the \nGeneral Assembly, in close cooperation and coordination with Member States, to take \nall appropriate measures to arrange the high-level meeting; \n \n7. \nRecalls its decision to designate 30 July as the World Day against \nTrafficking in Persons, to be observed annually, and, while welcoming events held by \nMember States, United Nations agencies, other international organizations and civil \nsociety at the international, regional and national levels to mark the World Day, invites \nall stakeholders to continue to observe the World Day in order to raise awareness of \ntrafficking in persons and the situation of the victims of this crime and for the \npromotion and protection of their rights;  \n \n8. \nExpresses solidarity with and compassion for victims and survivors of \ntrafficking in persons, and calls for the full respect for their human rights and the \nprovision of appropriate victim-centred, trauma-informed, gender-responsive and \nage-sensitive care and assistance, where applicable, including interpretation and sign \nlanguage, where appropriate, to victims of trafficking, and services for their \nrehabilitation or recovery, as appropriate, in cooperation with civil society and other \nrelevant partners; \n \n9. \nStresses the need to ensure that victims are treated with respect and dignity \nand are not inappropriately penalized or adversely affected by any actions taken by \ngovernment authorities and communities, including criminal, civil, administrative and \nimmigration penalties, for acts that they commit as a direct consequence of their \ntrafficking situation, through the implementation of the principles of both \nnon\u2011prosecution and non\u2011punishment of victims of trafficking subject to national \nlaws, rules and regulations; \n \n10. Expresses support for the activities of the United Nations Office on Drugs \nand Crime, reaffirms its request to the Secretary-General to provide adequate support \nto the Commission on Crime Prevention and Criminal Justice, and invites Member \nStates to make voluntary contributions to the Office for the purpose of providing \nassistance to Member States upon request;  \n \n11. Encourages the United Nations Office on Drugs and Crime to cooperate \nwith relevant international organizations outside the United Nations system and to \ninvite such organizations and interested Member States to participate, when \nappropriate, in the meetings of the Inter-Agency Coordination Group against \nTrafficking in Persons and to keep Member States informed of the schedule of and \nthe progress made by the Coordination Group; \n \n12. Invites Member States to consider the recommendations of the Working \nGroup on Trafficking in Persons for strengthening international cooperation and \nexchanging best practices in the fight against this crime; \n \n13. Recalls the Inter-Agency Coordination Group Plan of Action, endorsed on \n15 December 2020, as well as of the first regional consultation on trafficking in \npersons in Eastern Africa, held in virtual format on 7 and 8 February 2022, and takes \nnote of the regional consultation with civil society and international organizations on \ntrafficking in persons in the Americas, held in Panama City on 8 May 2025; \n\nImproving the coordination of efforts against trafficking in persons \nA/RES/80/228\n \n11/14\n25-20946 \n \n \n14. Welcomes the sixth and seventh meetings of the Inter-Agency \nCoordination Group at the level of principals, held in virtual format on 13 December \n2024 and on 29 October 2025, which reinforced the vital role of inter-agency \npartnership in tackling trafficking in persons, and requests the United Nations Office \non Drugs and Crime, as coordinator of the Coordination Group, to continue to \nconvene such meetings of the Coordination Group at the level of principals on a \nregular basis, and in this context takes note of the engagement of the European Union \nAnti-Trafficking Coordinator with the Coordination Group, and encourages the \nCoordination Group to engage with relevant regional and international organizations \nfrom other regions; \n \n15. Also welcomes the Special Rapporteur on the sale, sexual exploitation and \nsexual abuse of children as the newest partner of the Coordination Group; \n \n16. Invites regional and international organizations, within their mandates, to \njoin and consider co-chairing, along with a United Nations agency, the Inter-Agency \nCoordination Group to strengthen the exchange of expertise and regional experiences \nand thus enhance international cooperation in combating trafficking in persons and \nassisting the victims of this crime; \n \n17. Takes note of the ongoing process undertaken by the Inter-Agency \nCoordination Group to sustain the focus on child trafficking and explore a possible \nnexus between trafficking in persons and other forms of organized crime, and to \nensure that information-sharing among relevant agencies and between countries is \ndone in accordance with international and national legal frameworks and takes into \naccount privacy and confidentiality; \n \n18. Invites the United Nations Office on Drugs and Crime, in its capacity as \ncoordinator of the Inter-Agency Coordination Group, and other relevant agencies of \nthe United Nations system to further strengthen their activities related to the \nimplementation of relevant international instruments and the Global Plan of Action to \ndrive greater progress in eliminating trafficking in persons, and invites Member States \nand other international and bilateral donors to provide voluntary contributions to the \nOffice for these purposes, in accordance with the policies, rules and procedures of the \nUnited Nations;  \n \n19. Calls upon Member States to take into consideration new methods of \nrecruiting those at risk of being subjected to trafficking in persons, such as the misuse \nof the Internet by traffickers, in particular for recruiting children, to take measures to \ndevelop targeted awareness-raising campaigns, including for law enforcement, front-\nline service providers and at-risk industries, to identify the signs of trafficking in \npersons and to develop specialized training for law enforcement and criminal justice \npractitioners; \n \n20. Encourages Member States to harness the opportunities presented by \ntechnology, including artificial intelligence, to strengthen detection, investigation, \nprevention and victim assistance in cases of trafficking in persons, and to promote \ncooperation and the exchange of good practices in this regard, including with relevant \nstakeholders in line with applicable international law, including international human \nrights obligations and domestic legal frameworks; \n \n21. Also encourages Member States to take, consistent with domestic law, \nlegislative or other measures, where appropriate, to facilitate the detection, by Internet \nservice and access providers or other relevant entities, of child sexual exploitation \nand child abuse materials related to offences involving trafficking in children, as \nrequired by domestic frameworks and to ensure, in compliance with domestic law, the \nreporting of such materials to the relevant authorities and their removal by Internet \n\nA/RES/80/228 \nImproving the coordination of efforts against trafficking in persons\n \n25-20946\n12/14 \n \nservice and access providers or other relevant entities, including in conjunction with \nlaw enforcement in the investigation and prosecution; \n \n22. Further encourages Member States to scale up their efforts to combat \nemerging forms of technology-facilitated and cyber-enabled trafficking in persons, in \nparticular forced criminality for the purposes of online scams and online fraud, \ndevelop digital literacy programmes for at-risk populations, most notably for children \nand youth, and address the gender-related risks and challenges emerging from the use \nof technologies; \n \n23. Reaffirms Member States\u2019 commitment to address the social, economic, \ncultural, political and other factors that make people vulnerable to trafficking in \npersons, such as poverty, underdevelopment, unemployment, inequality, humanitarian \nemergencies, armed conflicts and natural disasters, sexual violence, gender \ndiscrimination, racial discrimination and social and financial exclusion, as well as \nnegative social norms, which promote a culture of tolerance towards violence against \nwomen, youth and children; \n \n24. Recognizes that in armed conflicts, trafficking in persons can be prevalent, \nand in this regard calls upon Member States to ensure the comprehensive application \nof international humanitarian law, international criminal law, international human \nrights law and international refugee law, in accordance with respective obligations, to \ntrafficking in persons in conflict situations for all purposes of exploitation, and to \nboth internal and cross-border trafficking in persons, in order to ensure accountability, \nprevent impunity and provide effective access to justice for trafficked persons; \n \n25. Expresses deep concern about the increasing links between armed groups, \nincluding terrorist groups, and trafficking in persons, involving the coercion of \nvictims, in particular women and girls, into child, early and forced marriages, sexual \nslavery, forced pregnancy, forced labour, domestic servitude and sexual exploitation, \nand subjecting men and boys to forced labour or to act as combatants; \n \n26. Encourages Member States to seek to address trafficking in persons in \nglobal supply chains, including by considering the development of common public \nprocurement standards, compliance requirements or codes of conduct and by \nharmonizing frameworks, in line with domestic legislation, including those guiding \nanti\u2011trafficking efforts and sustainable procurement; \n \n27. Calls upon Member States, international organizations, civil society \norganizations, the private sector and financial institutions, through partnerships, as \nappropriate, to increase and support prevention efforts in countries of origin, transit \nand destination by focusing domestically and globally on the demand and supply \nchains that foster all forms of trafficking and the goods and services produced as a \nresult of trafficking in persons and to consider cooperating to organize awareness-\nraising campaigns, programmes to facilitate the identification of victims of trafficking \nand the provision of assistance to those victims;  \n \n28. Calls upon States, in accordance with domestic law and taking into account \nbest practices or other promising measures developed in response to emerging trends \nin trafficking in persons, to encourage the private sector to conduct due diligence with \nrespect to their supply chains and consider the risks of trafficking in persons in their \nown operations and in those of their subcontractors and suppliers, aiming to ensure \nthat they address risks proactively; \n \n29. Stresses the need to intensify the efforts to prevent irregular migration and \ncreate and strengthen pathways for safe, orderly and regular migration to reduce the \nexposure of people on the move who are vulnerable to trafficking in persons, and in \nthis regard encourages Member States to take legislative or other measures to prevent, \n\nImproving the coordination of efforts against trafficking in persons \nA/RES/80/228\n \n13/14\n25-20946 \n \ncombat and eradicate trafficking in persons in the context of international migration \nby strengthening capacities and international cooperation to investigate, prosecute \nand penalize trafficking in persons, discouraging demand that fosters exploitation \nleading to trafficking, and ending impunity of trafficking networks; \n \n30. Encourages Member States to cooperate on issues concerning trafficking \nin persons with the Inter-Agency Coordination Group; \n \n31. Also encourages Member States to cooperate with the Special Rapporteur \non contemporary forms of slavery and trafficking in persons, and with other relevant \nspecial procedure mandate holders of the Human Rights Council, including the \nSpecial Rapporteur on violence against women and girls, its causes and consequences, \nand the Special Rapporteur on the sale, sexual exploitation and sexual abuse of \nchildren, as well as with the Special Representative of the Secretary-General on \nViolence against Children; \n \n32. Calls upon Member States to continue their efforts to criminalize \ntrafficking in persons in all its forms, including the exploitation of the prostitution of \nothers or other forms of sexual exploitation, forced labour or services, slavery or \npractices similar to slavery, servitude or the removal of organs, especially concerning \nchild labour, children and persons with disabilities, and to strengthen cooperation and \ncoordination in countries of origin, transit and destination in order to disrupt and \ndismantle criminal networks involved in such crimes, inter alia, through the \nenhancement of information-sharing, including through the secure communications \nchannels of the International Criminal Police Organization, where appropriate, as well \nas through mutual legal assistance and extradition, with full respect for international \nlaw and domestic law, and to investigate, prosecute and penalize traffickers and \nintermediaries while providing victim-centred, trauma-informed, gender- and age-\nsensitive protection and assistance to the victims of trafficking with full respect for \ntheir human rights, and invites Member States to continue to support those United \nNations agencies and international organizations that are actively involved in victim \nprotection;  \n \n33. Also calls upon Member States to take measures to support family \nreunification for victims of trafficking in persons, where safe and appropriate, \nespecially when those are children, taking into consideration the best interests of the \nchild; \n \n34. Notes the second consultative meeting on strengthening partnerships with \nnational rapporteurs and relevant mechanisms on trafficking in persons, held in \nBangkok on 21 and 22 May 2014, co-hosted by the United Nations Office on Drugs \nand Crime, the Special Rapporteur on trafficking in persons, especially women and \nchildren, and the Office of the United Nations High Commissioner for Human Rights, \nand the establishment of an informal network of such mechanisms located all over the \nworld to address trafficking in persons in a consistent manner and to exchange \ninformation and best practices built on different national experiences, requests the \nUnited Nations Office on Drugs and Crime to continue its efforts to collect \ninformation on national efforts to combat trafficking in persons, as well as on relevant \nnational mechanisms, to make up-to-date information available to Member States, and \ninvites Member States to host consultative meetings between relevant national \nmechanisms on trafficking in persons that continue transnational dialogue and the \nexchange of information on common challenges; \n \n35. Requests the United Nations Office on Drugs and Crime, in its capacity as \nfund manager of the United Nations voluntary trust fund for victims of trafficking in \npersons, especially women and children, to continue to encourage contributions by \nStates and all other relevant stakeholders to the trust fund;  \n\nA/RES/80/228 \nImproving the coordination of efforts against trafficking in persons\n \n25-20946\n14/14 \n \n \n36. Welcomes the biennial publication of the Global Report on Trafficking in \nPersons, prepared by the United Nations Office on Drugs and Crime, looks forward \nto the next such report, to be produced by the Office in 2026, pursuant to the Global \nPlan of Action, supports the United Nations Office on Drugs and Crime trafficking in \npersons data capacity-building programme, and strongly encourages Member States \nto provide to the Office evidence-based internationally standardized data on patterns, \nflows and forms of trafficking in persons, including for the purpose of the removal of \norgans and in the context of sport, based on the International Classification of Crime \nfor Statistical Purposes; \n \n37. Encourages the Office of the United Nations High Commissioner for \nHuman Rights, the United Nations Children\u2019s Fund and the Inter-Agency \nCoordination Group against Trafficking in Persons in coordination with the United \nNations Office on Drugs and Crime to consider updating, subject to the availability \nof extrabudgetary resources, respectively the Recommended Principles and \nGuidelines on Human Rights and Human Trafficking and the commentary thereon, \nthe Guidelines on the Protection of Child Victims of Trafficking and the Toolkit for \nGuidance in Designing and Evaluating Counter-Trafficking Programmes of the \nCoordination Group; \n \n38. Requests the Secretary-General to submit a report on the implementation \nof the present resolution to the General Assembly at its eighty-second session, \nincluding recommendations on measures to bring greater urgency to and improve the \ncoordination of efforts against trafficking in persons. \n \n69th plenary meeting \n18 December 2025 \n \n",
  "paragraphs": {
    "1": "Urges Member States that have not yet done so to consider ratifying or acceding to, as a matter of priority, the United Nations Convention against Transnational Organized Crime and the Protocol to Prevent, Suppress and Punish Trafficking in Persons, Especially Women and Children, supplementing the United Nations Convention against Transnational Organized Crime, taking into consideration the central role of those instruments in the fight against trafficking in persons, and also urges States Parties to those instruments to fully and effectively implement their obligations;",
    "2": "Urges Member States and other stakeholders mentioned in the United Nations Global Plan of Action to Combat Trafficking in Persons,35 and invites the Conference of the Parties to the United Nations Convention against Transnational Organized Crime and relevant international, regional and subregional organizations, within their respective mandates, to continue to contribute to the full and effective implementation of the Global Plan of Action, including by means of strengthening cooperation and improving coordination among themselves in achieving that goal;",
    "3": "Calls upon Governments to closely follow developments in the area of international protection of victims of trafficking in persons in order to protect the human rights of such persons and to ensure compliance with international humanitarian law and international human rights law;",
    "4": "Recalls the holding of the high-level meetings of the General Assembly during its sixty-seventh session, from 13 to 15 May 2013, during its seventy-second session, on 27 and 28 September 2017, during its seventy-sixth session, on 22 and 23 November 2021, and during its eightieth session, on 24 and 25 November 2025, to appraise the progress achieved in the implementation of the Global Plan of Action, which, inter alia, reiterated strong political will to take decisive concerted action against trafficking in persons;",
    "5": "Also recalls its decision, in its resolution 68/192, to appraise, from within existing resources, on a four-year basis starting at its seventy-second session, the progress achieved in the implementation of the Global Plan of Action in order to assess achievements, gaps and challenges, including in the implementation of the relevant legal instruments, and therefore decides to convene a high-level meeting of the General Assembly on the progress achieved in the implementation of the Global Plan of Action at its eighty-fourth session, after the general debate, but no later than December 2029;",
    "6": "Reaffirms its request to the Secretary-General and to the President of the General Assembly, in close cooperation and coordination with Member States, to take all appropriate measures to arrange the high-level meeting;",
    "7": "Recalls its decision to designate 30 July as the World Day against Trafficking in Persons, to be observed annually, and, while welcoming events held by Member States, United Nations agencies, other international organizations and civil society at the international, regional and national levels to mark the World Day, invites all stakeholders to continue to observe the World Day in order to raise awareness of trafficking in persons and the situation of the victims of this crime and for the promotion and protection of their rights;",
    "8": "Expresses solidarity with and compassion for victims and survivors of trafficking in persons, and calls for the full respect for their human rights and the provision of appropriate victim-centred, trauma-informed, gender-responsive and age-sensitive care and assistance, where applicable, including interpretation and sign language, where appropriate, to victims of trafficking, and services for their rehabilitation or recovery, as appropriate, in cooperation with civil society and other relevant partners;",
    "9": "Stresses the need to ensure that victims are treated with respect and dignity and are not inappropriately penalized or adversely affected by any actions taken by government authorities and communities, including criminal, civil, administrative and immigration penalties, for acts that they commit as a direct consequence of their trafficking situation, through the implementation of the principles of both non\u2011prosecution and non\u2011punishment of victims of trafficking subject to national laws, rules and regulations;",
    "10": "Expresses support for the activities of the United Nations Office on Drugs and Crime, reaffirms its request to the Secretary-General to provide adequate support to the Commission on Crime Prevention and Criminal Justice, and invites Member States to make voluntary contributions to the Office for the purpose of providing assistance to Member States upon request;",
    "11": "Encourages the United Nations Office on Drugs and Crime to cooperate with relevant international organizations outside the United Nations system and to invite such organizations and interested Member States to participate, when appropriate, in the meetings of the Inter-Agency Coordination Group against Trafficking in Persons and to keep Member States informed of the schedule of and the progress made by the Coordination Group;",
    "12": "Invites Member States to consider the recommendations of the Working Group on Trafficking in Persons for strengthening international cooperation and exchanging best practices in the fight against this crime;",
    "13": "",
    "14": "Welcomes the sixth and seventh meetings of the Inter-Agency Coordination Group at the level of principals, held in virtual format on 13 December 2024 and on 29 October 2025, which reinforced the vital role of inter-agency partnership in tackling trafficking in persons, and requests the United Nations Office on Drugs and Crime, as coordinator of the Coordination Group, to continue to convene such meetings of the Coordination Group at the level of principals on a regular basis, and in this context takes note of the engagement of the European Union Anti-Trafficking Coordinator with the Coordination Group, and encourages the Coordination Group to engage with relevant regional and international organizations from other regions;",
    "15": "Also welcomes the Special Rapporteur on the sale, sexual exploitation and sexual abuse of children as the newest partner of the Coordination Group;",
    "16": "Invites regional and international organizations, within their mandates, to join and consider co-chairing, along with a United Nations agency, the Inter-Agency Coordination Group to strengthen the exchange of expertise and regional experiences and thus enhance international cooperation in combating trafficking in persons and assisting the victims of this crime;",
    "17": "Takes note of the ongoing process undertaken by the Inter-Agency Coordination Group to sustain the focus on child trafficking and explore a possible nexus between trafficking in persons and other forms of organized crime, and to ensure that information-sharing among relevant agencies and between countries is done in accordance with international and national legal frameworks and takes into account privacy and confidentiality;",
    "18": "Invites the United Nations Office on Drugs and Crime, in its capacity as coordinator of the Inter-Agency Coordination Group, and other relevant agencies of the United Nations system to further strengthen their activities related to the implementation of relevant international instruments and the Global Plan of Action to drive greater progress in eliminating trafficking in persons, and invites Member States and other international and bilateral donors to provide voluntary contributions to the Office for these purposes, in accordance with the policies, rules and procedures of the United Nations;",
    "19": "Calls upon Member States to take into consideration new methods of recruiting those at risk of being subjected to trafficking in persons, such as the misuse of the Internet by traffickers, in particular for recruiting children, to take measures to develop targeted awareness-raising campaigns, including for law enforcement, front- line service providers and at-risk industries, to identify the signs of trafficking in persons and to develop specialized training for law enforcement and criminal justice practitioners;",
    "20": "Encourages Member States to harness the opportunities presented by technology, including artificial intelligence, to strengthen detection, investigation, prevention and victim assistance in cases of trafficking in persons, and to promote cooperation and the exchange of good practices in this regard, including with relevant stakeholders in line with applicable international law, including international human rights obligations and domestic legal frameworks;",
    "21": " service and access providers or other relevant entities, including in conjunction with law enforcement in the investigation and prosecution;",
    "22": "Further encourages Member States to scale up their efforts to combat emerging forms of technology-facilitated and cyber-enabled trafficking in persons, in particular forced criminality for the purposes of online scams and online fraud, develop digital literacy programmes for at-risk populations, most notably for children and youth, and address the gender-related risks and challenges emerging from the use of technologies;",
    "23": "Reaffirms Member States\u2019 commitment to address the social, economic, cultural, political and other factors that make people vulnerable to trafficking in persons, such as poverty, underdevelopment, unemployment, inequality, humanitarian emergencies, armed conflicts and natural disasters, sexual violence, gender discrimination, racial discrimination and social and financial exclusion, as well as negative social norms, which promote a culture of tolerance towards violence against women, youth and children;",
    "24": "Recognizes that in armed conflicts, trafficking in persons can be prevalent, and in this regard calls upon Member States to ensure the comprehensive application of international humanitarian law, international criminal law, international human rights law and international refugee law, in accordance with respective obligations, to trafficking in persons in conflict situations for all purposes of exploitation, and to both internal and cross-border trafficking in persons, in order to ensure accountability, prevent impunity and provide effective access to justice for trafficked persons;",
    "25": "Expresses deep concern about the increasing links between armed groups, including terrorist groups, and trafficking in persons, involving the coercion of victims, in particular women and girls, into child, early and forced marriages, sexual slavery, forced pregnancy, forced labour, domestic servitude and sexual exploitation, and subjecting men and boys to forced labour or to act as combatants;",
    "26": "Encourages Member States to seek to address trafficking in persons in global supply chains, including by considering the development of common public procurement standards, compliance requirements or codes of conduct and by harmonizing frameworks, in line with domestic legislation, including those guiding anti\u2011trafficking efforts and sustainable procurement;",
    "27": "Calls upon Member States, international organizations, civil society organizations, the private sector and financial institutions, through partnerships, as appropriate, to increase and support prevention efforts in countries of origin, transit and destination by focusing domestically and globally on the demand and supply chains that foster all forms of trafficking and the goods and services produced as a result of trafficking in persons and to consider cooperating to organize awareness- raising campaigns, programmes to facilitate the identification of victims of trafficking and the provision of assistance to those victims;",
    "28": "Calls upon States, in accordance with domestic law and taking into account best practices or other promising measures developed in response to emerging trends in trafficking in persons, to encourage the private sector to conduct due diligence with respect to their supply chains and consider the risks of trafficking in persons in their own operations and in those of their subcontractors and suppliers, aiming to ensure that they address risks proactively;",
    "29": " combat and eradicate trafficking in persons in the context of international migration by strengthening capacities and international cooperation to investigate, prosecute and penalize trafficking in persons, discouraging demand that fosters exploitation leading to trafficking, and ending impunity of trafficking networks;",
    "30": "Encourages Member States to cooperate on issues concerning trafficking in persons with the Inter-Agency Coordination Group;",
    "31": "Also encourages Member States to cooperate with the Special Rapporteur on contemporary forms of slavery and trafficking in persons, and with other relevant special procedure mandate holders of the Human Rights Council, including the Special Rapporteur on violence against women and girls, its causes and consequences, and the Special Rapporteur on the sale, sexual exploitation and sexual abuse of children, as well as with the Special Representative of the Secretary-General on Violence against Children;",
    "32": "Calls upon Member States to continue their efforts to criminalize trafficking in persons in all its forms, including the exploitation of the prostitution of others or other forms of sexual exploitation, forced labour or services, slavery or practices similar to slavery, servitude or the removal of organs, especially concerning child labour, children and persons with disabilities, and to strengthen cooperation and coordination in countries of origin, transit and destination in order to disrupt and dismantle criminal networks involved in such crimes, inter alia, through the enhancement of information-sharing, including through the secure communications channels of the International Criminal Police Organization, where appropriate, as well as through mutual legal assistance and extradition, with full respect for international law and domestic law, and to investigate, prosecute and penalize traffickers and intermediaries while providing victim-centred, trauma-informed, gender- and age- sensitive protection and assistance to the victims of trafficking with full respect for their human rights, and invites Member States to continue to support those United Nations agencies and international organizations that are actively involved in victim protection;",
    "33": "Also calls upon Member States to take measures to support family reunification for victims of trafficking in persons, where safe and appropriate, especially when those are children, taking into consideration the best interests of the child;",
    "34": "Notes the second consultative meeting on strengthening partnerships with national rapporteurs and relevant mechanisms on trafficking in persons, held in Bangkok on 21 and 22 May 2014, co-hosted by the United Nations Office on Drugs and Crime, the Special Rapporteur on trafficking in persons, especially women and children, and the Office of the United Nations High Commissioner for Human Rights, and the establishment of an informal network of such mechanisms located all over the world to address trafficking in persons in a consistent manner and to exchange information and best practices built on different national experiences, requests the United Nations Office on Drugs and Crime to continue its efforts to collect information on national efforts to combat trafficking in persons, as well as on relevant national mechanisms, to make up-to-date information available to Member States, and invites Member States to host consultative meetings between relevant national mechanisms on trafficking in persons that continue transnational dialogue and the exchange of information on common challenges;",
    "35": "",
    "36": "Welcomes the biennial publication of the Global Report on Trafficking in Persons, prepared by the United Nations Office on Drugs and Crime, looks forward to the next such report, to be produced by the Office in 2026, pursuant to the Global Plan of Action, supports the United Nations Office on Drugs and Crime trafficking in persons data capacity-building programme, and strongly encourages Member States to provide to the Office evidence-based internationally standardized data on patterns, flows and forms of trafficking in persons, including for the purpose of the removal of organs and in the context of sport, based on the International Classification of Crime for Statistical Purposes;",
    "37": "Encourages the Office of the United Nations High Commissioner for Human Rights, the United Nations Children\u2019s Fund and the Inter-Agency Coordination Group against Trafficking in Persons in coordination with the United Nations Office on Drugs and Crime to consider updating, subject to the availability of extrabudgetary resources, respectively the Recommended Principles and Guidelines on Human Rights and Human Trafficking and the commentary thereon, the Guidelines on the Protection of Child Victims of Trafficking and the Toolkit for Guidance in Designing and Evaluating Counter-Trafficking Programmes of the Coordination Group;",
    "38": "Requests the Secretary-General to submit a report on the implementation of the present resolution to the General Assembly at its eighty-second session, including recommendations on measures to bring greater urgency to and improve the coordination of efforts against trafficking in persons."
  },
  "agenda_items": [
    "Item 107"
  ],
  "symbol_references": []
}