{
  "symbol": "A/RES/76/187",
  "filename": "A_RES_76_187.pdf",
  "title": "76/187. Strengthening the United Nations crime prevention and criminal justice programme, in particular its technical cooperation capacity",
  "text": "United Nations \nA/RES/76/187\n \n \nGeneral Assembly \nDistr.: General \n11 January 2022 \n \n \n21-19242 (E)    130122 \n*2119242* \n \n \nSeventy-sixth session \nAgenda item 108 \nCrime prevention and criminal justice \n \n \n \n \n Resolution adopted by the General Assembly \non 16 December 2021 \n \n \n \n \n[on the report of the Third Committee (A/76/463, para. 26)] \n \n \n 76/187. Strengthening the United Nations crime prevention and criminal \njustice programme, in particular its technical cooperation capacity \n \n \n \nThe General Assembly, \n \nReaffirming its resolutions 46/152 of 18 December 1991, 60/1 of 16 September \n2005, 67/1 of 19 September 2012, 69/193 and 69/196 of 18 December 2014, 70/178 \nand 70/182 of 17 December 2015, 71/209 of 19 December 2016, 72/196 of \n19 December 2017, 73/186 of 17 December 2018, 74/177 of 18 December 2019 and \n75/196 of 16 December 2020,  \n \nReaffirming also its resolutions relating to the urgent need to strengthen \ninternational cooperation and technical assistance in promoting and facilitating the \nratification and implementation of the United Nations Convention against \nTransnational Organized Crime and the Protocols thereto,1 the Single Convention on \nNarcotic Drugs of 1961 as amended by the 1972 Protocol,2 the Convention on \nPsychotropic Substances of 1971,3 the United Nations Convention against Illicit \nTraffic in Narcotic Drugs and Psychotropic Substances of 1988, 4 the United Nations \nConvention against Corruption5 and all the international conventions and protocols \nagainst terrorism, \n \nWelcoming the results achieved by the Fourteenth United Nations Congress on \nCrime Prevention and Criminal Justice, held in Kyoto, Japan, from 7 to 12 March \n2021,6 including the Kyoto Declaration on Advancing Crime Prevention, Criminal \n__________________ \n \n1  United Nations, Treaty Series, vols. 2225, 2237, 2241 and 2326, No. 39574. \n \n2  Ibid., vol. 976, No. 14152. \n \n3  Ibid., vol. 1019, No. 14956. \n \n4  Ibid., vol. 1582, No. 27627. \n \n5  Ibid., vol. 2349, No. 42146. \n \n6  See A/CONF.234/16. \n\nA/RES/76/187 \nStrengthening the United Nations crime prevention and criminal \njustice programme, in particular its technical cooperation capacity\n \n21-19242\n2/23 \n \nJustice and the Rule of Law: Towards the Achievement of the 2030 Agenda for \nSustainable Development,7  \n \nUnderscoring the role of the Commission on Crime Prevention and Criminal \nJustice as the principal policymaking body of the United Nations in the field of crime \nprevention and criminal justice, and reaffirming its resolution 73/183 of 17 December \n2018 on enhancing the role of the Commission in contributing to the implementation \nof the 2030 Agenda for Sustainable Development, in which Member States were \nencouraged to raise awareness of the work of the Commission in the successful \nimplementation of the 2030 Agenda,  \n \nReaffirming its resolution 73/185 of 17 December 2018 on the rule of law, crime \nprevention and criminal justice in the context of the Sustainable Development Goals, \n \nExpressing its grave concern about the negative effects of transnational \norganized crime on development, peace, stability and security and human rights, \nabout the increasing vulnerability of States to such crime and about the growing \ndegree of penetration of criminal organizations and their financial and economic \nresources into the economy,  \n \nExpressing concern at the involvement of organized criminal groups, as well as \nthe substantial increase in the volume, rate of transnational occurrence and range of \ncriminal offences related to trafficking in precious metals, stones and other minerals \nin some parts of the world, and the potential use of trafficking in precious metals, \nstones and other minerals as a source of funding for organized crime, other relevant \ncriminal activities and terrorism,  \n \nDeeply concerned about the growing links, in some cases, between forms of \ntransnational organized crime and terrorism, recognizing that countering \ntransnational organized crime and terrorism is a common and shared responsibility, \nand in this respect recalling its resolution 74/175 of 18 December 2019 on technical \nassistance provided by the United Nations Office on Drugs and Crime related to \ncounter-terrorism,  \n \nConvinced that the rule of law and development are strongly interrelated and \nmutually reinforcing and that the advancement of the rule of law at the national and \ninternational levels, including through crime prevention and criminal justice \nmechanisms, is essential for sustained and inclusive economic growth and sustainable \ndevelopment and the full realization of all human rights and fundamental freedoms, \nincluding the right to development, and in this respect reaffirming the 2030 Agenda \nfor Sustainable Development,8 which, inter alia, includes the commitment to promote \npeaceful and inclusive societies for sustainable development, provide access to justice \nfor all and build effective, accountable and inclusive institutions at all levels, and in \nthis respect recalling its resolution 70/299 of 29 July 2016 on the follow-up and \nreview of the 2030 Agenda at the global level,  \n \nExpressing concern about the unprecedented crisis caused by the coronavirus \ndisease (COVID-19) pandemic, which is reversing hard-won sustainable development \ngains and may increase the risks of corruption, terrorism, transnational organized \ncrime, fraud, financial crime, illegal trafficking, including trafficking in persons, and \nother criminal activities, welcoming the contributions of the United Nations Office \non Drugs and Crime and other relevant agencies to the sharing of good practices in \ncrisis response and recovery in this context, and reaffirming its resolution 76/184 of \n16 December 2021 on strengthening criminal justice systems during and after the \nCOVID-19 pandemic, \n__________________ \n \n7  Resolution 76/181, annex. \n \n8  Resolution 70/1. \n\nStrengthening the United Nations crime prevention and criminal \njustice programme, in particular its technical cooperation capacity \nA/RES/76/187\n \n3/23\n21-19242 \n \n \nEmphasizing that transnational organized crime must be addressed with full \nrespect for the principle of the sovereignty of States and in accordance with the rule \nof law as part of a comprehensive response to promote durable solutions through the \npromotion of human rights and more equitable socioeconomic conditions,  \n \nEncouraging Member States to develop and implement, as appropriate, \ncomprehensive, evidence-based crime prevention policies, national and local \nstrategies and action plans based on an understanding of the multiple factors that \ncontribute to crime and to address such factors in a holistic manner, in close \ncooperation with all stakeholders, including civil society, and in this respect stressing \nthat social development and the promotion of the rule of law, including the fostering \nof a culture of lawfulness while respecting cultural identities, in accordance with the \nKyoto Declaration, should be integral elements of strategies to foster crime \nprevention and economic development in all States, \n \nRecalling its resolution 74/172 of 18 December 2019 on Education for Justice \nand the rule of law in the context of sustainable development,  \n \nConcerned at the increasing rate of violence in urban areas, and recognizing the \nneed for inclusive measures to address urban safety and the prevention of related \ncrime and violence in an integrated, participatory and cross-sectoral manner,  \n \nReaffirming its commitment and strong political will in support of effective, fair, \nhumane and accountable criminal justice systems and the institutions comprising \nthem, encouraging the effective participation and inclusion of all sectors of society, \nthus creating the conditions needed to advance the wider United Nations agenda, and \nrecognizing the responsibility of Member States to uphold human dignity, all human \nrights and fundamental freedoms, in particular for those affected by crime and those \nwho may be in contact with the criminal justice system, including vulnerable \nmembers of society, regardless of their status, who may be subject to multiple and \naggravated forms of discrimination, and to prevent and counter hate crimes, as well \nas crimes motivated by intolerance or discrimination of any kind,  \n \nTaking note of Commission on Crime Prevention and Criminal Justice resolution \n25/2 of 27 May 2016 on promoting legal aid, including through a network of legal aid \nproviders,9 in which the Commission encouraged Member States to adopt or strengthen \nlegislative or other measures to ensure that effective legal aid, including for victims of \ncrime, is provided consistent with their domestic legislation and in line with the United \nNations Principles and Guidelines on Access to Legal Aid in Criminal Justice \nSystems,10 and which also contributes to the implementation of the 2030 Agenda,  \n \nWelcoming the efforts made by some Member States to establish a common \ndocumentation standard as a tool for facilitating both technical interoperability and \naccessibility of legal documentation,  \n \nDeeply concerned about the negative impact of corruption on development and \non the enjoyment of human rights, and recognizing the universal importance of good \ngovernance, transparency, integrity and accountability, thus calling for a zero-\ntolerance approach to corruption and more effective measures to prevent and counter \ncorruption in all its forms, including bribery, as well as measures to prevent the \nlaundering of proceeds of corruption and other forms of crime,  \n \nBearing in mind its resolution 75/194 of 16 December 2020 on preventing and \ncombating corrupt practices and the transfer of proceeds of corruption, facilitating \nasset recovery and returning such assets to legitimate owners, in particular to \n__________________ \n \n9  See Official Records of the Economic and Social Council, 2016, Supplement No. 10 (E/2016/30), \nchap. I, sect. D. \n \n10  Resolution 67/187, annex. \n\nA/RES/76/187 \nStrengthening the United Nations crime prevention and criminal \njustice programme, in particular its technical cooperation capacity\n \n21-19242\n4/23 \n \ncountries of origin, in accordance with the United Nations Convention against \nCorruption,  \n \nWelcoming the progress made with regard to the second cycle of the Mechanism \nfor the Review of Implementation of the United Nations Convention against \nCorruption, and stressing the importance of full participation by States parties in the \nMechanism and the effective implementation of the Convention in all its aspects by \nall States parties, and welcoming also resolution 10/1 of 16 October 2020 of the \nConference of the Parties to the United Nations Convention against Transnational \nOrganized Crime,11 by which the Conference launched the first review phase of the \nMechanism for the Review of the Implementation of the United Nations Convention \nagainst Transnational Organized Crime and the Protocols thereto, \n \nWelcoming also decision 8/1 of 20 December 2019 of the Conference of the States \nParties to the United Nations Convention against Corruption to extend the duration of \nthe second cycle of the Implementation Review Mechanism until June 2024,12 \n \nTaking note of the United Nations Office on Drugs and Crime and the United \nNations Development Programme Manual on Corruption Surveys and the \ndevelopment of methodological tools, standards and guidelines that can support \ncountries in producing comparable and up-to-date statistics on corruption, including \nin the context of Sustainable Development Goal implementation, and welcoming in \nthis regard resolution 8/10 of 20 December 2019 of the Conference of the States \nParties to the United Nations Convention against Corruption,13 \n \nBearing in mind that, pursuant to chapter V of the United Nations Convention \nagainst Corruption, the return of assets is one of the main objectives, an integral part \nand a fundamental principle of the Convention and that the States parties to the \nConvention shall afford one another the widest measure of cooperation and assistance \nin that regard, and welcoming in this regard resolution 8/1 of 20 December 2019 of \nthe Conference of the States Parties to the United Nations Convention against \nCorruption,14 \n \nRecognizing that, thanks to their nearly universal adherence and wide scope of \napplication, the United Nations Convention against Transnational Organized Crime 15 \nand the United Nations Convention against Corruption offer fundamental legal bases \nfor international cooperation to support the investigation and prosecution of crimes \ncovered by those Conventions, including for extradition, mutual legal assistance and \nconfiscation and asset recovery, and that they provide effective mechanisms that \nshould be further implemented and utilized in practice, \n \nWelcoming the political declaration entitled \u201cOur common commitment to \neffectively addressing challenges and implementing measures to prevent and combat \ncorruption and strengthen international cooperation\u201d, adopted by the General Assembly \nat its thirty-second special session, held at United Nations Headquarters from 2 to 4 June \n2021,16 \n \nRecognizing the efforts of the Group of 20 in countering corruption at both the \nglobal and the national levels, taking note with appreciation of the anti-corruption \ninitiatives outlined in the Leaders\u2019 Declaration of the Summit of the Group of 20, held \nin Riyadh on 21 and 22 November 2020, and urging the Group of 20 to continue to \nengage other States Members of the United Nations and the United Nations Office on \n__________________ \n \n11  See CTOC/COP/2020/10, sect. I.A. \n \n12  See CAC/COSP/2019/17, sect. I.C. \n \n13  Ibid., sect. I.B. \n \n14  Ibid. \n \n15  United Nations, Treaty Series, vol. 2225, No. 39574. \n \n16  Resolution S-32/1, annex. \n\nStrengthening the United Nations crime prevention and criminal \njustice programme, in particular its technical cooperation capacity \nA/RES/76/187\n \n5/23\n21-19242 \n \nDrugs and Crime in its work in an inclusive and transparent manner to ensure that \ninitiatives of the Group of 20 complement or strengthen the work being undertaken \nby the United Nations system, \n \nStressing the importance of strengthened international cooperation, based on the \nprinciples of shared responsibility and in accordance with international law, to \neffectively address the world drug problem, dismantle illicit networks and counter \ntransnational organized crime, including money-laundering, illicit financial flows, \nsmuggling of migrants, trafficking in persons, trafficking in arms and other forms of \norganized crime, all of which threaten national security and undermine sustainable \ndevelopment and the rule of law, and stressing also in this respect the importance of \nlaw enforcement cooperation and exchange of information, in accordance with \ninternational law, as well as of designated central authorities and effective points of \ncontact dedicated to facilitating the procedures related to international cooperation, \nincluding for extradition and mutual legal assistance requests, as well as the \nimportance of the coordinating role of relevant regional networks, \n \nWelcoming the high-level debate of the General Assembly held on 22 April 2021 \non the theme \u201cUrban safety, security and good governance: making crime prevention \na priority for all\u201d, and taking note of the summary of the discussion prepared by the \nPresident of the General Assembly and transmitted to the Commission on Crime \nPrevention and Criminal Justice and to all Member States,  \n \nNoting the important contribution that public-private sector cooperation can \nmake in efforts to prevent and combat criminal activities, such as transnational \norganized crime, corruption, cybercrime and terrorism, in particular in the tourism \nsector,  \n \nReaffirming the commitments made by Member States in the United Nations \nGlobal Counter-Terrorism Strategy, adopted on 8 September 2006,17 and its successive \nbiennial reviews, in particular in its resolution 75/291 of 30 June 2021, in which it \nencouraged Member States and United Nations entities to strengthen and better \ncoordinate their actions against terrorism and to prevent and combat violent extremism \nas and when conducive to terrorism, including through technical assistance provided \nto Member States upon their request, and highlighting in this respect the work of the \nOffice of Counter-Terrorism, established through its resolution 71/291 of 15 June \n2017, and that of the United Nations Global Counter-Terrorism Coordination Compact \nentities on strengthening the capability of the United Nations system to assist Member \nStates in implementing the United Nations Global Counter-Terrorism Strategy,  \n \nHighlighting the importance of its resolutions on measures to eliminate \ninternational terrorism and on the protection of human rights and fundamental \nfreedoms while countering terrorism adopted at its seventy-third and seventy-fourth \nsessions,  \n \nExpressing concern that terrorists may benefit from transnational organized \ncrime in some regions, including from trafficking in arms, drugs and cultural property, \nas well as trafficking in persons and human organs, and from the illicit trade in natural \nresources, including oil, and in oil products, modular refineries and related material, \nprecious metals, stones and other minerals, charcoal and wildlife, as well as from \nkidnapping for ransom and other crimes, including extortion, money-laundering and \nbank robbery, and condemning the destruction of cultural heritage perpetrated by \nterrorist groups in some countries,  \n \nRecalling its resolution 66/177 of 19 December 2011 on strengthening \ninternational cooperation in combating the harmful effects of illicit financial flows \n__________________ \n \n17  Resolution 60/288. \n\nA/RES/76/187 \nStrengthening the United Nations crime prevention and criminal \njustice programme, in particular its technical cooperation capacity\n \n21-19242\n6/23 \n \nresulting from criminal activities, in which it urged States parties to the United Nations \nConvention against Illicit Traffic in Narcotic Drugs and Psychotropic Substances of \n1988, the United Nations Convention against Transnational Organized Crime and the \nUnited Nations Convention against Corruption to apply fully the provisions of those \nConventions, in particular measures to prevent and combat money-laundering, \nincluding by criminalizing the laundering of proceeds of transnational organized \ncrime, as well as measures to enhance national confiscation regimes and international \ncooperation, including in asset recovery, and recalling also its resolution 73/222 of \n20 December 2018, in which, inter alia, it reiterated its deep concern about the impact \nof illicit financial flows, in particular those caused by tax evasion, corruption and \ntransnational organized crime, on the economic, social and political stability and \ndevelopment of societies, and especially on developing countries,  \n \nNoting with concern the misuse of virtual assets and related payment methods \nby criminal individuals and transnational organized crime groups to raise, move and \nstore funds, including the proceeds of crime, as well as the potential use of emerging \npayment methods, such as prepaid cards and mobile payments or virtual assets, by \nterrorists and terrorist groups,  \n \nTaking into consideration all resolutions of the Commission on Crime \nPrevention and Criminal Justice and the relevant resolutions of the Economic and \nSocial Council, in particular those relating to the strengthening of international \ncooperation, as well as to the technical assistance and advisory services of the United \nNations crime prevention and criminal justice programme of the United Nations \nOffice on Drugs and Crime in the fields of crime prevention and criminal justice, \npromotion and reinforcement of the rule of law and reform of criminal justice \ninstitutions, including with regard to the implementation of technical assistance to \nMember States in improving systems for collecting and analysing data on crime \nprevention and criminal justice at all levels,  \n \nNoting the establishment by the Secretary-General of the United Nations system \ntask force on transnational organized crime and drug trafficking as threats to security \nand stability for the purpose of developing an effective and comprehensive approach \nto those crimes within the United Nations system, and reaffirming the crucial role of \nMember States in this regard, as reflected in the Charter of the United Nations,  \n \nRecognizing the progress made by the United Nations Office on Drugs and Crime \nin the delivery of advisory services and technical assistance to requesting Member \nStates in the areas of crime prevention and criminal justice reform, data and \ninformation analysis, preventing and countering organized crime, corruption, piracy \nand transnational organized crime committed at sea, illicit financial flows, money-\nlaundering, economic and financial crimes, including fraud, as well as tax and \ncorporate crimes, cybercrime, criminal misuse of the Internet and other information \nand communications technologies as well as such misuse for terrorist purposes, \ntrafficking in endangered species of wild fauna and flora and other crimes that affect \nthe environment, such as trafficking in timber, hazardous waste, precious metals, \nstones and other minerals, direct and indirect trade in oil and refined oil products with \norganized criminal and terrorist groups, counterfeiting in trademark goods, match-\nfixing, trafficking in cultural property and artefacts, kidnapping, smuggling of \nmigrants, organ trafficking, trafficking in persons, including the support and \nprotection, as appropriate, of victims, their families and witnesses, illicit \nmanufacturing of and trafficking in firearms, drug trafficking and trafficking in \nfalsified medical products, as well as terrorism, including progress in tackling the \nphenomenon of foreign terrorist fighters, including those who are returning and \nrelocating, and preventing chemical, biological, radiological and nuclear terrorism, as \nwell as in the area of international cooperation, with special emphasis on extradition \nand mutual legal assistance and the international transfer of sentenced persons,  \n\nStrengthening the United Nations crime prevention and criminal \njustice programme, in particular its technical cooperation capacity \nA/RES/76/187\n \n7/23\n21-19242 \n \n \nWelcoming the adoption by the United Nations Office on Drugs and Crime of an \nintegrated approach to programming and to technical assistance delivery at the global, \nregional and national levels, through the continuous linkages between the normative, \noperational and research components of its mandate, and based on continuing \nconsultations and partnerships at the national, regional and global levels, particularly \non its implementation, and focused on ensuring that the Office responds in a \nsustainable and coherent manner to the priorities of Member States,  \n \nReiterating its concern regarding the overall financial situation of the United \nNations Office on Drugs and Crime, and welcoming the extension of the mandate of \nthe standing open-ended intergovernmental working group on improving the \ngovernance and financial situation of the Office,  \n \nWelcoming Commission on Crime Prevention and Criminal Justice resolution \n26/3 of 26 May 2017 on mainstreaming a gender perspective into crime prevention \nand criminal justice policies and programmes and into efforts to prevent and combat \ntransnational organized crime,18 \n \nReiterating its condemnation of all forms of violence against women and girls, \nnoting with deep concern the increase in cases of violence against women and girls \nand in obstacles to their access to justice during the COVID-19 pandemic, and in this \nrespect reaffirming its resolutions 65/228 of 21 December 2010, 71/170 of \n19 December 2016, 72/149 of 19 December 2017 and 73/148 of 17 December 2018, \nrecalling the resolutions of the Commission on Human Rights and the Human Rights \nCouncil addressing various aspects of violence against women and girls of all ages, \nand recalling also the agreed conclusions adopted by the Commission on the Status \nof Women at its fifty-seventh session, which addressed the elimination and prevention \nof all forms of violence against women and girls,19 \n \nExpressing deep concern about the gender-related killing of women and girls, \nrecalling its relevant resolutions,20 recognizing the key role of law enforcement and \nthe criminal justice system in preventing and responding to the gender-related killing \nof women and girls, including by ending impunity for such crimes, and recognizing \nthe importance of collecting relevant data and developing preventive measures,  \n \nNoting the significance of the updated Model Strategies and Practical Measures \non the Elimination of Violence against Women in the Field of Crime Prevention and \nCriminal Justice21 as a way to assist countries in strengthening their national crime \nprevention and criminal justice capacities to respond to all forms of violence against \nwomen and girls,  \n \nRecalling its resolution 69/194 of 18 December 2014, by which it adopted the \nUnited Nations Model Strategies and Practical Measures on the Elimination of \nViolence against Children in the Field of Crime Prevention and Criminal Justice, \nconvinced of the importance of preventing youth crime, including through sports, \nsupporting the rehabilitation of young offenders and their reintegration into society, \nprotecting in particular child victims of all forms of violence, including those in \ncontact with the law and witnesses, including efforts to prevent their revictimization, \nand addressing the needs of children of prisoners, stressing that such responses should \ntake into account the human rights and best interests of children and young people, \nconsistent with the obligations of the States parties under relevant international \n__________________ \n \n18  See Official Records of the Economic and Social Council, 2017, Supplement No. 10 (E/2017/30), \nchap. I, sect. D. \n \n19  Ibid., 2013, Supplement No. 7 (E/2013/27), chap. I, sect. A. \n \n20  Resolutions 68/191 and 70/176. \n \n21  Resolution 65/228, annex. \n\nA/RES/76/187 \nStrengthening the United Nations crime prevention and criminal \njustice programme, in particular its technical cooperation capacity\n \n21-19242\n8/23 \n \ninstruments, including the Convention on the Rights of the Child22 and the Optional \nProtocols thereto,23 and noting other relevant United Nations standards and norms in \njuvenile justice, where appropriate,  \n \nTaking note with appreciation of the partnership between the United Nations \nEducational, Scientific and Cultural Organization and the United Nations Office on \nDrugs and Crime in promoting the importance of education as an effective tool for \nthe prevention of crime and terrorism, under the Education for Justice initiative, and \nin this respect taking note with appreciation also of the launch of the joint publication \nentitled Strengthening the Rule of Law through Education: A Guide for Policymakers,  \n \nEmphasizing the relevance of international instruments and United Nations \nstandards and norms in crime prevention and criminal justice related to the treatment \nof prisoners, in particular women and juveniles,  \n \nRecalling its resolution 70/146 of 17 December 2015, in which it reaffirmed that \nno one shall be subjected to torture or other cruel, inhuman or degrading treatment or \npunishment,  \n \nStressing the importance of the Code of Conduct for Law Enforcement \nOfficials24 and the Basic Principles on the Use of Force and Firearms by Law \nEnforcement Officials,25 which are voluntary guidelines that emphasize, inter alia, \nefficient and human rights-based policing,  \n \nRecalling its resolution 65/229 of 21 December 2010 on the United Nations \nRules for the Treatment of Women Prisoners and Non-custodial Measures for Women \nOffenders (the Bangkok Rules), and in this regard encouraging the efforts of Member \nStates to implement the Bangkok Rules,  \n \nWelcoming the adoption, by its resolution 70/175 of 17 December 2015, of the \nrevision to the Standard Minimum Rules for the Treatment of Prisoners, as the United \nNations Standard Minimum Rules for the Treatment of Prisoners (the Nelson Mandela \nRules), and reaffirming its resolution 72/193 of 19 December 2017, in which, inter alia, \nMember States were encouraged to endeavour to improve conditions of imprisonment \nand to promote the practical application of the Nelson Mandela Rules as the universally \nacknowledged and updated minimum standards for the treatment of prisoners, to use the \nRules as a guide in the development of prison laws, policies and practices, to continue \nexchanging good practices and identifying challenges faced in the practical application \nof the Rules and to share their experiences in dealing with those challenges,  \n \nWelcoming also Economic and Social Council resolution 2017/19 of 6 July 2017 \non promoting and encouraging the implementation of alternatives to imprisonment as \npart of comprehensive crime prevention and criminal justice policies,  \n \nReiterating its strong condemnation of trafficking in persons, which constitutes \na serious crime and a grave offence to human dignity and physical integrity, a \nviolation or abuse of human rights and a challenge to sustainable development and \nrequires the implementation of a comprehensive approach that includes measures to \nprevent such trafficking, to punish the traffickers and to identify and protect the \nvictims of such trafficking, and a robust criminal justice response, and recalling in \nthis respect the United Nations Convention against Transnational Organized Crime \nand the Protocol to Prevent, Suppress and Punish Trafficking in Persons, Especially \n__________________ \n \n22  United Nations, Treaty Series, vol. 1577, No. 27531. \n \n23  Ibid., vols. 2171, 2173 and 2983, No. 27531. \n \n24  Resolution 34/169, annex. \n \n25  See Eighth United Nations Congress on the Prevention of Crime and the Treatment of Offenders, \nHavana, 27 August\u20137 September 1990: report prepared by the Secretariat (United Nations \npublication, Sales No. E.91.IV.2), chap. I, sect. B. \n\nStrengthening the United Nations crime prevention and criminal \njustice programme, in particular its technical cooperation capacity \nA/RES/76/187\n \n9/23\n21-19242 \n \nWomen and Children, supplementing the United Nations Convention against \nTransnational Organized Crime,26 and its resolutions 71/167 of 19 December 2016, \n72/195 of 19 December 2017, 73/146 of 17 December 2018, 74/176 of 18 December \n2019 and 75/158 of 16 December 2020, \n \nBearing in mind its resolution 73/189 of 17 December 2018 on strengthening \nand promoting effective measures and international cooperation on organ donation \nand transplantation to prevent and combat trafficking in persons for the purpose of \norgan removal and trafficking in human organs,  \n \nReaffirming its resolution 72/1 of 27 September 2017, by which it adopted the \npolitical declaration on the implementation of the United Nations Global Plan of \nAction to Combat Trafficking in Persons,  \n \nUnderlining that Member States need to recognize that the crime of smuggling \nof migrants and the crime of trafficking in persons are distinct crimes and require \nseparate and complementary legal, operational and policy responses, while \nrecognizing that smuggled migrants might also become victims of trafficking in \npersons and therefore require appropriate protection and assistance, and recalling its \nresolutions 69/187 of 18 December 2014, 70/147 of 17 December 2015, 72/179 of \n19 December 2017 and 74/148 of 18 December 2019, in which it called upon all \nMember States to protect and assist migrants, including migrant children and \nadolescents, as well as Economic and Social Council resolutions 2014/23 of 16 July \n2014 and 2015/23 of 21 July 2015 and Commission on Crime Prevention and Criminal \nJustice resolution 30/1 of 21 May 2021,27  \n \nReaffirming its resolution 70/1 of 25 September 2015, in which it, inter alia, \ncommitted to taking immediate and effective measures to eradicate forced labour, end \nmodern slavery and human trafficking and secure the prohibition and elimination of \nthe worst forms of child labour,  \n \nRecalling its resolution 71/1 of 19 September 2016, by which it adopted the \nNew York Declaration for Refugees and Migrants, which addresses the issue of large \nmovements of refugees and migrants,  \n \nStressing the importance for Member States to take legislative or other measures \nto prevent, combat and eradicate trafficking in persons in the context of international \nmigration by strengthening capacities and international cooperation to investigate, \nprosecute and penalize trafficking in persons, discouraging demand that fosters \nexploitation leading to trafficking, and ending impunity of trafficking networks,  \n \nWelcoming the work of the United Nations voluntary trust fund for victims of \ntrafficking in persons, especially women and children, established in accordance with \nthe United Nations Global Plan of Action to Combat Trafficking in Persons, adopted \nby its resolution 64/293 of 30 July 2010, as well as the important contribution of the \nInter-Agency Coordination Group against Trafficking in Persons, within its mandate, \nto the implementation of the Global Plan of Action, and of the Special Rapporteur on \ntrafficking in persons, especially women and children,  \n \nConcerned at the growing involvement of terrorist and organized criminal \ngroups in all forms and aspects of trafficking in cultural property and related offences, \nand alarmed by the destruction of cultural heritage perpetrated by terrorist groups, \nwhich is linked to trafficking in cultural property in some countries and to financing \nof terrorist activities,  \n__________________ \n \n26  United Nations, Treaty Series, vol. 2237, No. 39574. \n \n27  See Official Records of the Economic and Social Council, 2021, Supplement No. 10 (E/2021/30), \nchap. I, sect. D. \n\nA/RES/76/187 \nStrengthening the United Nations crime prevention and criminal \njustice programme, in particular its technical cooperation capacity\n \n21-19242\n10/23 \n \n \nRecognizing the indispensable role of crime prevention and criminal justice \nresponses in combating all forms and aspects of trafficking in cultural property and \nrelated offences in a comprehensive and effective manner, and underlining the \nimportance of the technical assistance provided by the United Nations Office on \nDrugs and Crime aimed at supporting the implementation of the International \nGuidelines for Crime Prevention and Criminal Justice Responses with Respect to \nTrafficking in Cultural Property and Other Related Offences 28 and at facilitating \noperational cooperation against all forms of trafficking in cultural property, including \nthrough the practical assistance tool developed to that end,  \n \nWelcoming resolution 27/5 of 18 May 2018 of the Commission on Crime \nPrevention and Criminal Justice,29 which focused on the need to strengthen \ninternational cooperation to prevent and counter trafficking in cultural property, \nincluding through judicial cooperation and mutual legal assistance, and noting the \nefforts of Member States to implement General Assembly resolutions 68/186 of \n18 December 2013, 69/196, and 73/130 of 13 December 2018,  \n \nAffirming that the destruction of cultural heritage, which is representative of the \ndiversity of human culture, erases the collective memories of a nation, destabilizes \ncommunities and threatens their cultural identity, and emphasizing the importance of \ncultural diversity and pluralism as well as freedom of religion and belief for achieving \npeace, stability, reconciliation and social cohesion, and recalling in this respect its \nresolution 73/130,  \n \nReaffirming the intrinsic value of biological diversity and its various \ncontributions to sustainable development and human well-being, and recognizing that \nwild fauna and flora in their many beautiful and varied forms are an irreplaceable part \nof the natural systems of the Earth which must be protected for this generation and \nthe generations to come, \n \nTaking note of the World Wildlife Crime Report: Trafficking in Protected \nSpecies, prepared by the United Nations Office on Drugs and Crime in 2020,  \n \nEmphasizing that the protection of wildlife must be part of a comprehensive \napproach to achieving poverty eradication, food security, sustainable development, \nincluding the conservation and sustainable use of biological diversity, economic \ngrowth, social well-being and sustainable livelihoods,  \n \nExpressing deep concern about crimes that affect the environment, including \nillicit trafficking in endangered and, where applicable, protected species of wild fauna \nand flora, in hazardous waste and other wastes, illegal mining and crimes in the \nfisheries sector, and emphasizing the need to combat such crimes by strengthening \ncoordinated action to eliminate, prevent and combat corruption and disrupt illicit \nnetworks and also by coordinating international cooperation, capacity-building, \ncriminal justice responses and law enforcement efforts,  \n \nRecognizing, in this respect, the legal framework provided by and the important \nrole of the Convention on International Trade in Endangered Species of Wild Fauna \nand Flora30 as the primary mechanism for regulating international trade in species of \nwild fauna and flora listed in its appendices,  \n \nRecalling the adoption of its resolutions 71/326 of 11 September 2017, 73/343 of \n16 September 2019 and 75/311 of 23 July 2021 on tackling illicit trafficking in wildlife, \nand welcoming Commission on Crime Prevention and Criminal Justice resolution 28/3 \n__________________ \n \n28  Resolution 69/196, annex. \n \n29  See Official Records of the Economic and Social Council, 2018, Supplement No. 10 (E/2018/30), \nchap. I, sect. C. \n \n30  United Nations, Treaty Series, vol. 993, No. 14537. \n\nStrengthening the United Nations crime prevention and criminal \njustice programme, in particular its technical cooperation capacity \nA/RES/76/187\n \n11/23\n21-19242 \n \nof 24 May 201931 and resolution 8/12 of 20 December 2019 of the Conference of the \nStates Parties to the United Nations Convention against Corruption,32 \n \nConcerned at the growing trend of cybercrime and the misuse of information \nand communications technologies in multiple forms of crime, and recalling its \nresolutions 73/187 of 17 December 2018, 74/173 of 18 December 2019, 74/247 of \n27 December 2019 and 75/282 of 26 May 2021, as well as Economic and Social \nCouncil resolutions 2019/19 and 2019/20 of 23 July 2019,  \n \nStressing the need to enhance coordination and cooperation among Member \nStates in combating cybercrime, including by providing technical assistance to \ndeveloping countries, upon request, to improve national legislation and enhance the \ncapacity of national authorities to deal with cybercrime in all its forms, including its \nprevention, detection, investigation and prosecution, emphasizing in this context the \nrole that the United Nations, in particular the Commission on Crime Prevention and \nCriminal Justice, plays, and reaffirming the importance of respect for human rights \nand fundamental freedoms in the use of information and communications technologies,  \n \nDeeply concerned about the increasing harm caused by, and the negative impact \nof, illicitly manufactured and trafficked firearms, their parts and components and \nammunition, and about the links of such trafficking with other forms of transnational \norganized crime, including drug trafficking, as well as terrorism, and noting that \nreducing the illicit manufacturing of and trafficking in firearms, their parts and \ncomponents and ammunitions is one of the major components of the efforts to reduce \nthe power of transnational organized criminal groups and the violence that \naccompanies their activities,  \n \nNoting international efforts to prevent, combat and eradicate the illicit trade in \nconventional arms, in particular in small arms and light weapons, as demonstrated by \nthe adoption in 2001 of the Programme of Action to Prevent, Combat and Eradicate \nthe Illicit Trade in Small Arms and Light Weapons in All Its Aspects, 33 the entry into \nforce in 2005 of the Protocol against the Illicit Manufacturing of and Trafficking in \nFirearms, Their Parts and Components and Ammunition, supplementing the United \nNations Convention against Transnational Organized Crime,34 and the entry into force \nin 2014 of the Arms Trade Treaty,35 and noting also the common themes and \ncomplementary character of these instruments, \n \nWelcoming the 2019 Ministerial Declaration on Strengthening Our Actions at \nthe National, Regional and International Levels to Accelerate the Implementation of \nOur Joint Commitments to Address and Counter the World Drug Problem, adopted \nduring the ministerial segment of the sixty-second session of the Commission on \nNarcotic Drugs,36 in which Member States committed to accelerating, based on the \nprinciple of common and shared responsibility, the full implementation of the 2009 \nPolitical Declaration and Plan of Action on International Cooperation towards an \nIntegrated and Balanced Strategy to Counter the World Drug Problem, 37 the Joint \nMinisterial Statement of the 2014 high-level review by the Commission on Narcotic \nDrugs of the implementation by Member States of the Political Declaration and Plan \n__________________ \n \n31  See Official Records of the Economic and Social Council, 2019, Supplement No. 10 (E/2019/30), \nchap. I, sect. D. \n \n32  See CAC/COSP/2019/17, sect. I.B. \n \n33  Report of the United Nations Conference on the Illicit Trade in Small Arms and Light Weapons in \nAll Its Aspects, New York, 9\u201320 July 2001 (A/CONF.192/15), chap. IV, para. 24. \n \n34  United Nations, Treaty Series, vol. 2326, No. 39574. \n \n35  Ibid., vol. 3013, No. 52373. \n \n36  See Official Records of the Economic and Social Council, 2019, Supplement No. 8 (E/2019/28), \nchap. I, sect. B. \n \n37  Ibid., 2009, Supplement No. 8 (E/2009/28), chap. I, sect. C. \n\nA/RES/76/187 \nStrengthening the United Nations crime prevention and criminal \njustice programme, in particular its technical cooperation capacity\n \n21-19242\n12/23 \n \nof Action38 and the outcome document of the special session of the General Assembly \non the world drug problem held in 2016,39 aimed at achieving all commitments, \noperational recommendations and aspirational goals set out therein,  \n \n1. \nTakes note with appreciation of the report of the Secretary-General \nprepared pursuant to resolution 75/196;40 \n \n2. \nReaffirms its resolution 70/1, entitled \u201cTransforming our world: the 2030 \nAgenda for Sustainable Development\u201d, which, inter alia, includes the commitment to \npromote peaceful and inclusive societies for sustainable development, provide access \nto justice for all and build effective, accountable and inclusive institutions at all \nlevels;  \n \n3. \nCalls upon all Member States, when appropriate, to take into consideration \nthe Kyoto Declaration on Advancing Crime Prevention, Criminal Justice and the Rule \nof Law: Towards the Achievement of the 2030 Agenda for Sustainable Development, \nadopted at the high-level segment of the Fourteenth United Nations Congress on Crime \nPrevention and Criminal Justice, held in Kyoto, Japan, from 7 to 12 March 2021, when \nformulating legislation and policy directives, and to make every effort, where \nappropriate, to implement the principles contained therein in conformity with the \npurposes and principles of the Charter of the United Nations, and requests the United \nNations Office on Drugs and Crime to continue to provide technical assistance, upon \nrequest, to Member States, including through its Global Programme for the \nImplementation of the Doha Declaration and the Education for Justice initiative;  \n \n4. \nEncourages Member States to promote the integrity, honesty and \nresponsibility of criminal justice practitioners through specialized and appropriate \ntraining and the application of codes or standards of conduct, and in this context notes \nthe work of the Global Judicial Integrity Network aimed at strengthening judicial \nintegrity;  \n \n5. \nUrges Member States that have not yet done so to consider ratifying or \nacceding to the United Nations Convention against Transnational Organized Crime \nand the Protocols thereto, the Single Convention on Narcotic Drugs of 1961 as \namended by the 1972 Protocol, the Convention on Psychotropic Substances of 1971, \nthe United Nations Convention against Illicit Traffic in Narcotic Drugs and \nPsychotropic Substances of 1988, the United Nations Convention against Corruption \nand the international conventions and protocols related to terrorism, and urges States \nparties to those conventions and protocols to make efforts towards their effective \nimplementation, particularly with regard to preventing and combating transnational \norganized crime, including cybercrime; \n \n6. \nReaffirms that the United Nations Convention against Transnational \nOrganized Crime and the Protocols thereto represent the most important tools of the \ninternational community for fighting transnational organized crime, including \ncybercrime, notes with appreciation that the number of States parties has reached 190, \nwhich is a significant indication of the commitment shown by the international \ncommunity to combating transnational organized crime, and recalls in this respect \nresolution 10/4 of 16 October 2020 of the Conference of the Parties to the United \nNations Convention against Transnational Organized Crime,41 in which the \nConference emphasized the continued relevance of the Convention, including in \ncountering new, emerging and evolving forms of transnational organized crime; \n__________________ \n \n38  Ibid., 2014, Supplement No. 8 (E/2014/28), chap. I, sect. C. \n \n39  Resolution S-30/1, annex. \n \n40  A/76/122. \n \n41  See CTOC/COP/2020/10, sect. I.A. \n\nStrengthening the United Nations crime prevention and criminal \njustice programme, in particular its technical cooperation capacity \nA/RES/76/187\n \n13/23\n21-19242 \n \n \n7. \nRecognizes that technical assistance and economic development are \nfundamental to ensuring the effective implementation of the provisions of the United \nNations Convention against Transnational Organized Crime and the Protocols thereto, \nand recalls in this regard article 30 of the Convention;  \n \n8. \nWelcomes the progress made by States parties in their participation in the \nreview process of the Mechanism for the Review of the Implementation of the United \nNations Convention against Transnational Organized Crime and the Protocols thereto, \nin accordance with resolution 10/1 of the Conference of the Parties to the United \nNations Convention against Transnational Organized Crime, adopted at its tenth \nsession, held in Vienna from 12 to 16 October 2020, and urges States parties to \ncontinue to actively participate in and support the review process; \n \n9. \nEncourages States parties to the United Nations Convention against \nTransnational Organized Crime to submit case law, legislation and other relevant \nresponses to the knowledge management portal known as Sharing Electronic \nResources and Laws on Crime; \n \n10. Welcomes the resolutions adopted by the Conference of the Parties at its \neighth, ninth and tenth sessions, held in Vienna from 17 to 21 October 2016, from \n15 to 19 October 2018 and from 12 to 16 October 2020, respectively, to promote greater \nuse of the Convention by central authorities in extradition and mutual legal assistance \nand to enhance the effectiveness of these authorities and to strengthen, as appropriate, \nthe implementation of the Protocol against the Illicit Manufacturing of and \nTrafficking in Firearms, Their Parts and Components and Ammunition, supplementing \nthe United Nations Convention against Transnational Organized Crime; \n \n11. Also welcomes the thirty-second special session of the General Assembly, \nheld at United Nations Headquarters from 2 to 4 June 2021, at which the Assembly \nadopted a political declaration entitled \u201cOur common commitment to effectively \naddressing challenges and implementing measures to prevent and combat corruption \nand strengthen international cooperation\u201d;  \n \n12. Urges States parties to the United Nations Convention against Corruption \nto continue to provide full support to the review mechanism adopted by the \nConference of the States Parties to the Convention, notes the progress made under the \nsecond cycle of the Mechanism for the Review of Implementation of the Convention, \nand further notes with appreciation that the number of States parties has reached 188, \nwhich is a significant indication of the commitment shown by the international \ncommunity to combating corruption and related crimes;  \n \n13. Also urges States parties to the United Nations Convention against \nCorruption to increase their efforts and to take measures to prevent and counter \ncorruption, with the necessary focus on, among others, acts of corruption that involve \nvast quantities of assets, without undermining their commitment to preventing and \ncountering corruption at all levels and in all forms, and calls upon States parties to \nthe Convention to take measures to ensure that legal and natural persons are held \naccountable for corruption offences, including when they involve bribery and vast \nquantities of assets, in accordance with the Convention; \n \n14. Takes note of the creation of the Global Operational Network of \nAnti-Corruption Law Enforcement Authorities under the auspices of the United \nNations Office on Drugs and Crime, and encourages States to participate in and make \nbest use of this network, as appropriate;  \n \n15. Welcomes the progress achieved by the Conference of the Parties to the \nUnited Nations Convention against Transnational Organized Crime and the \nConference of the States Parties to the United Nations Convention against Corruption \nin the implementation of their respective mandates, and calls upon States parties to \n\nA/RES/76/187 \nStrengthening the United Nations crime prevention and criminal \njustice programme, in particular its technical cooperation capacity\n \n21-19242\n14/23 \n \ngive full effect to the resolutions adopted by those bodies, including providing \ninformation regarding compliance with the treaties;  \n \n16. Encourages Member States, in accordance with their domestic law, to \nstrengthen the capacity of their respective criminal justice systems to investigate, \nprosecute and punish all forms of crime, while supporting an accessible, effective, \nfair, humane, transparent and accountable criminal justice system and protecting the \nhuman rights and fundamental freedoms of defendants, as well as the rights and \nlegitimate interests of victims and witnesses, and to adopt and reinforce measures to \nensure access to effective legal aid in criminal justice systems, and in this context \ntakes note of the establishment of the Global Judicial Integrity Network in April 2018;  \n \n17. Requests the United Nations Office on Drugs and Crime to continue to \nprovide technical assistance to Member States, upon request, including, inter alia, in \nthe field of international cooperation in criminal matters, to strengthen the rule of law, \nalso taking into account the work undertaken by other United Nations entities, within \nexisting mandates, as well as regional and bilateral efforts, and to continue to ensure \ncoordination and coherence, including through the Rule of Law Coordination and \nResource Group;  \n \n18. Calls for greater coordination and coherence among United Nations \nentities and with stakeholders, including donors, host countries and recipients of \ncapacity-building, in countering transnational organized crime;  \n \n19. Reiterates the importance of providing the United Nations crime \nprevention and criminal justice programme with sufficient, stable and predictable \nfunding for the full implementation of its mandates;  \n \n20. Encourages all States to have national and local action plans for crime \nprevention in order to take into account, in a comprehensive, integrated and \nparticipatory manner, inter alia, factors that place certain populations and places at \nhigher risk of victimization and/or of offending, and to ensure that such plans are \nbased on the best available evidence and good practices, and stresses that crime \nprevention should be considered an integral element of strategies to foster social and \neconomic development in all States, in accordance with the commitments contained \nin General Assembly resolutions 70/1 and 70/299;  \n \n21. Recommends that Member States adopt multisectoral crime prevention \npolicies and programmes for youth and increase their meaningful and inclusive \nparticipation therein, including through sport and education, taking into consideration \ntheir varying needs, and safeguard their well-being, recognizing that youth may face \nspecific challenges and risk factors that make them particularly vulnerable to crime, \nall forms of violence, terrorism and victimization, and in this respect recalls its \nresolution 76/183 of 16 December 2021, entitled \u201cIntegrating sport into youth crime \nprevention and criminal justice strategies\u201d;  \n \n22. Invites the President of the General Assembly, in cooperation with the \nUnited Nations Office on Drugs and Crime and with the involvement of relevant \nstakeholders, to hold, within existing resources and during the seventy-sixth session, \na high-level debate on the theme \u201cEnhancing youth mainstreaming in crime \nprevention policies\u201d and to prepare a summary of the discussion for transmission to \nthe Commission on Crime Prevention and Criminal Justice and to all Member States; \n \n23. Encourages States to continue to build on the results of important forums \nsuch as the high-level debate of the General Assembly held on 22 April 2021 on the \ntheme \u201cUrban safety, security and good governance: making crime prevention a \npriority for all\u201d, and urges the United Nations Office on Drugs and Crime to continue \nto develop comprehensive efforts in its actions aimed at preventing crime, especially \nwith a view to obtaining detailed information that can lead to an improved \n\nStrengthening the United Nations crime prevention and criminal \njustice programme, in particular its technical cooperation capacity \nA/RES/76/187\n \n15/23\n21-19242 \n \nunderstanding of the transnational aspects of urban safety and security, and improve \nthe efforts of States to curb criminal actions in this field; \n \n24. Urges Member States, in cooperation with the United Nations crime \nprevention and criminal justice programme, to develop national, subregional, regional \nand international strategies, with the support of relevant international organizations, \nas appropriate, and other necessary measures, including the establishment, in \naccordance with domestic legislation, of designated central and competent authorities \nand effective points of contact dedicated to facilitating the procedures related to \ninternational cooperation, including for extradition and mutual legal assistance \nrequests, in order to effectively address transnational organized crime; to strengthen \nall forms of cooperation to enable the return of illicitly acquired assets in accordance \nwith the provisions of the United Nations Convention against Corruption for asset \nrecovery, in particular chapter V, with the cooperation of the United Nations Office \non Drugs and Crime, within its existing mandate; and to inform accordingly the Office \nabout existing or updated contact details of such authorities and points of contact to \nfacilitate international cooperation as appropriate;  \n \n25. Encourages Member States to study the implementation of a common \ndocumentation standard, including within the United Nations system and in \ncooperation with relevant international institutions;  \n \n26. Reaffirms the importance of the United Nations crime prevention and \ncriminal justice programme in promoting effective action to strengthen international \ncooperation in crime prevention and criminal justice, as well as of the work of the \nUnited Nations Office on Drugs and Crime in the fulfilment of its mandate in crime \nprevention and criminal justice, including providing to Member States, upon request \nand as a matter of high priority, technical cooperation, advisory services and other \nforms of assistance, and coordinating with and complementing the work of all \nrelevant and competent United Nations bodies and offices in respect of all forms of \norganized crime, including piracy and transnational organized crime committed at \nsea, cybercrime, criminal misuse of the Internet and other information and \ncommunications technologies as well as such misuse for terrorist purposes, the misuse \nof new information technologies to abuse and exploit children, trafficking in cultural \nproperty and artefacts, illicit financial flows, money-laundering, economic and \nfinancial crimes, including fraud, as well as tax and corporate crimes, match-fixing, \ncounterfeiting in trademark goods, illicit trafficking in endangered species of wild \nfauna and flora and other crimes that affect the environment, such as trafficking in \ntimber, hazardous waste, precious metals, stones and other minerals, drug trafficking, \nkidnapping, trafficking in persons, including the support and protection, as \nappropriate, of victims, their families and witnesses, organ trafficking, smuggling of \nmigrants and illicit manufacturing of and trafficking in firearms, direct and indirect \ntrade in oil and refined oil products with organized criminal and terrorist groups, as \nwell as corruption and terrorism;  \n \n27. Encourages Member States to collect relevant information and to further \nidentify, analyse and counter any existing, growing or potential links, in some cases, \nbetween transnational organized crime, the illicit access to and trafficking in firearms, \ntheir parts and components and ammunition, illicit drug-related activities, money-\nlaundering and the financing of terrorism, in order to enhance criminal justice \nresponses to those crimes, and calls upon the United Nations Office on Drugs and \nCrime, within its relevant mandates, to support, upon request, the efforts of Member \nStates in that regard; \n \n28. Notes with appreciation the progress made by the United Nations Office \non Drugs and Crime, in coordination with the United Nations Conference on Trade \nand Development and other institutions, on the development of a methodology to \n\nA/RES/76/187 \nStrengthening the United Nations crime prevention and criminal \njustice programme, in particular its technical cooperation capacity\n \n21-19242\n16/23 \n \nproduce estimates of the total value of inward and outward illicit financial flows, and \nencourages the Office, within its relevant mandates and in cooperation with Member \nStates, to continue its work on studying illicit financial flows related to criminal \nactivities, in line with this methodology;  \n \n29. Calls upon Member States to strengthen cooperation at the international, \nregional, subregional and bilateral levels to counter the threat posed by foreign \nterrorist fighters, including those who are returning and relocating, including through \nenhanced operational and timely information-sharing, logistical support, as \nappropriate, and capacity-building activities, such as those provided by the United \nNations Office on Drugs and Crime, to share and adopt best practices to identify \nforeign terrorist fighters, to prevent the travel of foreign terrorist fighters from, into \nor through Member States, to prevent the financing, mobilization, recruitment and \norganization of foreign terrorist fighters, to prevent and counter violent extremism as \nand when conducive to terrorism, to enhance efforts to implement prosecution, \nrehabilitation and reintegration strategies, taking into account gender and age \ndimensions, and to ensure that any person who participates in the financing, planning, \npreparation or perpetration of terrorist acts or in the supporting of terrorist acts is \nbrought to justice, in compliance with obligations under international law, as well as \napplicable domestic law, and requests the Office to continue to provide technical \nassistance, upon request, in this regard in cooperation and coordination with the \nOffice of Counter-Terrorism and the United Nations Global Counter-Terrorism \nCoordination Compact entities;  \n \n30. Calls upon the United Nations Office on Drugs and Crime to further \nenhance technical assistance, upon request, for building the capacity of Member \nStates to become party to and implement the international conventions and protocols \nrelated to counter-terrorism, including through targeted programmes and the training \nof relevant criminal justice and law enforcement officials, upon request, and the \ndevelopment of technical tools and publications, within its mandate, and in this \nrespect takes note with appreciation of the Guidance Manual for Member States on \nTerrorist Financing Risk Assessments, published by the Office;  \n \n31. Calls upon Member States to address the threat posed by radicalization to \nterrorism in prisons, and calls upon the United Nations, especially the United Nations \nOffice on Drugs and Crime, to continue to support Member States in this regard in \ncooperation and coordination with the Office of Counter-Terrorism and the United \nNations Global Counter-Terrorism Coordination Compact entities;  \n \n32. Urges the United Nations Office on Drugs and Crime to increase \ncollaboration with intergovernmental, international and regional organizations that \nhave transnational organized crime mandates, as appropriate, in order to share best \npractices, foster cooperation and take advantage of their unique and comparative \nadvantage;  \n \n33. Reaffirms the importance of the United Nations Office on Drugs and Crime \nand its country and regional offices in building capacity at the local level in the field \nof crime prevention and criminal justice, and urges the Office to consider regional \nvulnerabilities, projects and impacts in the fight against transnational organized crime \nin all its forms, in particular in developing countries, when deciding to close and \nallocate offices, with a view to maintaining an effective level of support to national \nand regional efforts in those areas;  \n \n34. Requests the Secretary-General to continue to provide the United Nations \nOffice on Drugs and Crime with adequate resources to support, in an effective \nmanner, efforts towards the implementation of the United Nations Convention against \nTransnational Organized Crime and the Protocols thereto, the Single Convention on \nNarcotic Drugs of 1961 as amended by the 1972 Protocol, the Convention on \n\nStrengthening the United Nations crime prevention and criminal \njustice programme, in particular its technical cooperation capacity \nA/RES/76/187\n \n17/23\n21-19242 \n \nPsychotropic Substances of 1971, the United Nations Convention against Illicit \nTraffic in Narcotic Drugs and Psychotropic Substances of 1988 and the United \nNations Convention against Corruption, and to discharge its functions as the \nsecretariat of the conferences of the parties to the conventions, the Commission on \nCrime Prevention and Criminal Justice and the Commission on Narcotic Drugs, as \nwell as the United Nations congresses on crime prevention and criminal justice, in \naccordance with its mandate, and requests the Secretariat to continue to provide \nsupport to the Commissions within their respective mandates, enabling them to \nactively contribute, as appropriate, to the global follow-up and the thematic review \nof progress made by Member States in the achievement of the Sustainable \nDevelopment Goals as set forth in resolutions 70/299, and 72/305 of 23 July 2018;  \n \n35. Urges all Member States to provide the fullest possible financial and \npolitical support to the United Nations Office on Drugs and Crime by widening its \ndonor base and increasing voluntary contributions, in particular general-purpose \ncontributions, so as to enable it to continue, expand, improve and strengthen, within \nits mandates, its research, operational and technical cooperation activities;  \n \n36. Expresses concern regarding the overall financial situation of the United \nNations Office on Drugs and Crime, emphasizes the need to provide the Office with \nadequate, predictable and stable resources and to ensure their cost-effective utilization, \nand requests the Secretary-General, also considering the extension of the mandate of \nthe standing open-ended intergovernmental working group on improving the \ngovernance and financial situation of the Office, to continue to report, within existing \nreporting obligations, on the financial situation of the Office and to continue to ensure \nthat the Office has sufficient resources to carry out its mandates fully and effectively;  \n \n37. Invites States and other interested parties to make further voluntary \ncontributions to the United Nations voluntary trust fund for victims of trafficking in \npersons, especially women and children, and to the United Nations voluntary trust \nfund on contemporary forms of slavery;  \n \n38. Calls upon Member States to intensify national and international efforts to \neliminate all forms of discrimination, including racism, religious intolerance, \nxenophobia and gender-related discrimination by, inter alia, raising awareness, \ndeveloping educational materials and programmes and considering, where \nappropriate, drafting and enforcing legislation against discrimination;  \n \n39. Emphasizes the importance of protecting vulnerable members of society, \nregardless of their status, who may be subject to multiple and aggravated forms of \ndiscrimination, and in that regard expresses its concern about the increase in the \nactivities of transnational and national organized criminal groups and others who \nprofit from crimes against migrants, especially women and children, without regard \nfor dangerous and inhumane conditions and in flagrant violation of national laws and \ninternational law;  \n \n40. Calls upon Member States to implement, when appropriate, the United \nNations Standard Minimum Rules for the Treatment of Prisoners (the Nelson Mandela \nRules),42 bearing in mind their spirit and purpose, and to intensify their efforts to \naddress the challenge of prison overcrowding through appropriate criminal justice \nreforms, which should include, where appropriate, a review of penal policies and \npractical measures to reduce pretrial detention, to enhance the use of non-custodial \nsanctions and measures and to improve access to legal aid to the extent possible, and \nrequests the United Nations Office on Drugs and Crime to continue to provide \ntechnical assistance to Member States, upon request, in this respect; \n__________________ \n \n42  Resolution 70/175, annex. \n\nA/RES/76/187 \nStrengthening the United Nations crime prevention and criminal \njustice programme, in particular its technical cooperation capacity\n \n21-19242\n18/23 \n \n \n41. Reaffirms its resolution 76/182 of 16 December 2021 on reducing \nreoffending through rehabilitation and reintegration, and encourages Member States \nto promote a rehabilitative environment in correctional facilities and multi-\nstakeholder partnerships to reduce reoffending by fostering inter-agency coordination \namong relevant government authorities; \n \n42. Emphasizes the need for all Member States to promote, where appropriate, \ncooperation on the transfer of sentenced persons to serve the rest of their sentences in \ntheir own countries, conclude bilateral or multilateral agreements or arrangements in \nthis regard as necessary, taking into consideration the rights of sentenced persons and \nissues relating to consent, rehabilitation and reintegration, as appropriate, and raise \nawareness among these prisoners about the availability of such measures; \n \n43. Invites Member States to mainstream a gender perspective into their \ncriminal justice systems, including by the use of non-custodial measures for women, \nwhen appropriate, and by improving the treatment of women prisoners, taking into \nconsideration the United Nations Rules for the Treatment of Women Prisoners and \nNon-custodial Measures for Women Offenders (the Bangkok Rules), 43 and by \ndeveloping and implementing national strategies and plans to promote the full \nprotection of women and girls from all acts of violence and to strengthen the crime \nprevention and criminal justice response to the gender-related killing of women and \ngirls, in particular by taking measures to support the practical capacity of Member \nStates to prevent, investigate, prosecute and punish all forms of such crime, and \nwelcomes in this respect the practical tools recommended by the open-ended \nintergovernmental expert group on gender-related killing of women and girls at its \nmeeting held in Bangkok from 11 to 13 November 2014; 44 \n \n44. Also invites Member States to integrate child- and youth-related issues into \ntheir criminal justice reform efforts, recognizing the importance of protecting children \nfrom all forms of violence, exploitation and abuse, consistent with the obligations of \nparties under relevant international instruments, and to develop comprehensive child-\nsensitive justice policies focused on the best interests of the child, consistent with the \nprinciple that the deprivation of liberty of children should be used only as a measure \nof last resort and for the shortest appropriate period of time;  \n \n45. Recognizes the efforts made by the United Nations Office on Drugs and \nCrime to assist Member States in developing their abilities and strengthening their \ncapacity to prevent and combat kidnapping, and requests the Office to continue to \nprovide technical assistance, upon request, with a view to fostering international \ncooperation, in particular mutual legal assistance, aimed at countering effectively this \ngrowing serious crime;  \n \n46. Calls upon Member States to consider ratifying or acceding to, and for \nStates parties to effectively implement, the Protocol against the Smuggling of \nMigrants by Land, Sea and Air, supplementing the United Nations Convention against \nTransnational Organized Crime,45 to reinforce international cooperation for \npreventing and combating the smuggling of migrants and for the prosecution of \nsmugglers, in accordance, as appropriate, with article 6 of the Protocol and with \nnational laws and legislation, while effectively protecting the rights and respecting \nthe dignity of smuggled migrants, consistent with the principles of non-discrimination \nand other applicable obligations under relevant international law, taking into account \nthe special needs of women, children, especially when unaccompanied, and persons \nwith disabilities and older persons, and in collaboration with international \n__________________ \n \n43  Resolution 65/229, annex. \n \n44  See E/CN.15/2015/16. \n \n45  United Nations, Treaty Series, vol. 2241, No. 39574. \n\nStrengthening the United Nations crime prevention and criminal \njustice programme, in particular its technical cooperation capacity \nA/RES/76/187\n \n19/23\n21-19242 \n \norganizations, civil society and the private sector, and in this regard calls upon the \nUnited Nations Office on Drugs and Crime to continue its technical assistance to \nMember States in accordance with the Protocol;  \n \n47. Takes note of the launch of the first United Nations Office on Drugs and \nCrime Global Study on Smuggling of Migrants, encourages Member States to promote \nthe reliable collection of relevant data and research, at the national and, as \nappropriate, the regional and international levels, invites the Office to systematically \ncollect data and information from Member States on migrant smuggling routes, the \nmodi operandi of migrant smugglers and the role of transnational organized crime, \nand invites Member States and other donors to provide extrabudgetary resources for \nthis purpose; \n \n48. Encourages Member States to ensure that, in investigating and prosecuting \ntrafficking in persons and the smuggling of migrants, the concurrent undertaking of \nfinancial investigations is a standard practice, with a view to tracing, freezing and \nconfiscating proceeds acquired through those crimes, and to consider trafficking in \npersons and the smuggling of migrants to be predicate offences of money-laundering; \n \n49. Takes note of the launch by the United Nations Office on Drugs and Crime \nof the Global Report on Trafficking in Persons 2020, recognizes that the Global \nReport on Trafficking in Persons is a useful resource facilitating information-sharing \non the nature, scope and trends of trafficking in persons, as well as modi operandi of \ntraffickers, and encourages Member States to submit to the Office information on \npatterns, forms and flows of trafficking in persons for purposes of compiling future \nglobal reports; \n \n50. Emphasizes the importance of preventing and combating all forms of \ntrafficking in persons, and in this regard expresses its concern about the activities of \ntransnational and national organized criminal groups and others who profit from such \ncrimes, including for the purpose of organ removal, and calls upon Member States to \nconsider ratifying or acceding to, and for States parties, in accordance with their \nobligations, to fully and effectively implement the Protocol to Prevent, Suppress and \nPunish Trafficking in Persons, Especially Women and Children, supplementing the \nUnited Nations Convention against Transnational Organized Crime, as well as to \nstrengthen national efforts to combat all forms of trafficking in persons and to protect \nand assist the victims of trafficking in accordance with all relevant legal obligations \nand in collaboration with international organizations, civil society and the private \nsector, and in this regard calls upon the United Nations Office on Drugs and Crime to \ncontinue its technical assistance to Member States in accordance with the Protocol;  \n \n51. Requests the United Nations Office on Drugs and Crime to enhance its \ntechnical assistance to Member States, upon request, to strengthen international \ncooperation in preventing and combating terrorism, including the phenomenon of \ntravelling, returning and relocating foreign terrorist fighters, especially with regard \nto extradition and mutual legal assistance, and its financial sources, through the \nfacilitation of the ratification and implementation of the universal conventions and \nprotocols related to terrorism, in close consultation and cooperation with the Security \nCouncil Committee established pursuant to resolution 1373 (2001) concerning \ncounter-terrorism (the Counter-Terrorism Committee) and its Executive Directorate, \nas well as to contribute to the work of the Office of Counter-Terrorism, established in \naccordance with resolution 71/291, and of the United Nations Global Counter-\nTerrorism Coordination Compact entities, and invites Member States to provide the \nUnited Nations Office on Drugs and Crime with appropriate resources for its mandate;  \n \n52. Urges the United Nations Office on Drugs and Crime to continue to \nprovide, within its mandate, technical assistance to Member States, upon their \nrequest, to combat money-laundering and the financing of terrorism through the \n\nA/RES/76/187 \nStrengthening the United Nations crime prevention and criminal \njustice programme, in particular its technical cooperation capacity\n \n21-19242\n20/23 \n \nGlobal Programme against Money-Laundering, Proceeds of Crime and the Financing \nof Terrorism, in accordance with United Nations-related instruments and international \nstandards, including, where applicable, standards and relevant initiatives of regional, \ninterregional and multilateral organizations and intergovernmental bodies against \nmoney-laundering, inter alia and as appropriate, the Financial Action Task Force, in \naccordance with national legislation;  \n \n53. Encourages Member States to enhance the effectiveness of countering \ncriminal threats to the tourism sector, including terrorist threats, through, when \nappropriate, the activities of the United Nations Office on Drugs and Crime and other \nrelevant international organizations, in cooperation with the World Tourism \nOrganization and the private sector;  \n \n54. Affirms that attacks intentionally directed against buildings dedicated to \nreligion, education, art, science or charitable purposes, or historic monuments, or \nhospitals and places where the sick and wounded are collected, may amount to war \ncrimes, stresses the importance of holding accountable perpetrators of attacks \nintentionally directed against the above-mentioned buildings, provided that they are \nnot military objectives, and calls upon all States to take appropriate action to this end \nwithin their jurisdiction in accordance with applicable international law;  \n \n55. Urges States parties to make effective use of the United Nations \nConvention against Transnational Organized Crime for broad cooperation in \npreventing and combating all forms and aspects of trafficking in cultural property and \nrelated offences, including money-laundering and the financing of terrorism, \nespecially in returning such confiscated proceeds of crime or property to their \nlegitimate owners, in accordance with article 14, paragraph 2, of the Convention;  \n \n56. Encourages States parties to the United Nations Convention against \nTransnational Organized Crime to promptly notify countries of origin when objects \nthat may be cultural property removed from their territory are identified, and to \nexchange information and statistical data on all forms and aspects of trafficking in \ncultural property and related offences, and reaffirms in this regard the importance of \nthe International Guidelines for Crime Prevention and Criminal Justice Responses \nwith Respect to Trafficking in Cultural Property and Other Related Offences, as \nadopted by the General Assembly in its resolution 69/196;  \n \n57. Urges Member States to introduce effective national and international \nmeasures to prevent and combat illicit trafficking in cultural property, including \npublicizing legislation, international guidelines and related technical background \ndocuments, and offering special training for police, customs and border services, and \ninvites Member States to make trafficking in cultural property and related offences, \nincluding stealing from and looting of archaeological and other cultural sites, a \nserious crime, as defined in article 2 (b) of the United Nations Convention against \nTransnational Organized Crime;  \n \n58. Also urges Member States to take decisive steps at the national level to \nprevent, combat and eradicate the illegal trade in wildlife, on both the supply and \ndemand sides, including by strengthening the legislation necessary for the prevention, \ninvestigation and prosecution of such illegal trade, as well as by strengthening \nenforcement and criminal justice responses, in accordance with national legislation \nand international law, acknowledging that the International Consortium on \nCombating Wildlife Crime can provide valuable technical assistance in this regard;  \n \n59. Calls upon Member States to make illicit trafficking in protected species \nof wild fauna and flora and other crimes that affect the environment, such as \ntrafficking in timber, hazardous waste and other wastes, precious metals, stones and \nother minerals, involving organized criminal groups a serious crime in accordance \n\nStrengthening the United Nations crime prevention and criminal \njustice programme, in particular its technical cooperation capacity \nA/RES/76/187\n \n21/23\n21-19242 \n \nwith their national legislation and with article 2 (b) of the United Nations Convention \nagainst Transnational Organized Crime;  \n \n60. Also calls upon Member States to take appropriate and effective measures \nto prevent and combat trafficking in timber, hazardous waste and other wastes, \nprecious metals, stones and other minerals by organized criminal groups, including, \nwhere appropriate, the adoption and effective implementation of the necessary \nlegislation for the prevention, investigation and prosecution of illicit trafficking in \ntimber, hazardous waste and other wastes, precious metals, stones and other minerals; \n \n61. Reaffirms its resolution 76/185 of 16 December 2021 on preventing and \ncombating crimes that affect the environment, and requests the United Nations Office \non Drugs and Crime, subject to the availability of extrabudgetary resources and within \nits mandate, to provide technical assistance and capacity-building to Member States, \nupon request, for the purposes of supporting their efforts to effectively prevent and \ncombat crimes that affect the environment, as well as corruption and money-\nlaundering related to such crimes;  \n \n62. Encourages Member States to continue to support the United Nations \nOffice on Drugs and Crime in providing targeted technical assistance, within its \nexisting mandate, to enhance the capacity of affected States, upon their request, to \ncombat piracy and other forms of crime committed at sea, including by assisting \nMember States in creating an effective law enforcement response and strengthening \ntheir judicial capacity;  \n \n63. Notes with appreciation the holding of the seventh meeting of the open-\nended intergovernmental Expert Group to Conduct a Comprehensive Study on \nCybercrime and the responses to cybercrime by Member States, the international \ncommunity and the private sector, and calls upon Member States to take actions to \ncreate a secure and resilient cyberenvironment, to prevent and counter effectively \ncriminal activities carried out over the Internet, paying particular attention to identity \nfraud-related offences, recruitment for the purpose of trafficking in persons and \nprotecting children from online exploitation and abuse, to strengthen law enforcement \ncooperation at the national and international levels, including with the aim of \nidentifying and protecting victims by, inter alia, removing child pornography and \nother child sexual abuse material from the Internet, to enhance the security of \ncomputer networks and protect the integrity of relevant infrastructure, and to \nendeavour to provide long-term technical assistance and capacity-building to \nstrengthen the ability of national authorities to deal with cybercrime, including the \nprevention, detection, investigation and prosecution of such crime in all its forms;  \n \n64. Encourages Member States to strengthen their efforts in combating \ncybercrime and all forms of criminal misuse of information and communications \ntechnologies and to enhance international cooperation involving electronic evidence \nin this regard; \n \n65. Notes the establishment of the Ad Hoc Committee to Elaborate a \nComprehensive International Convention on Countering the Use of Information and \nCommunications Technologies for Criminal Purposes, encourages Member States to \nactively participate in the work of the Ad Hoc Committee, and further encourages the \nparticipation of relevant stakeholders, in line with the modalities established under \nits resolution 75/282 of 26 May 2021; \n \n66. Requests the United Nations Office on Drugs and Crime to continue to \nassist Member States, upon request, in combating the illicit manufacturing of and \ntrafficking in firearms, their parts and components and ammunition, and to support \nthem in their efforts to address the links with other forms of transnational organized \ncrime, through, inter alia, legislative assistance, technical support, improved data \n\nA/RES/76/187 \nStrengthening the United Nations crime prevention and criminal \njustice programme, in particular its technical cooperation capacity\n \n21-19242\n22/23 \n \ncollection and analysis and strengthened national statistical systems, and in this \nrespect invites Member States to provide the Office with relevant information and \nsuitably disaggregated data;  \n \n67. Encourages Member States to effectively implement resolution 10/2 of \n16 October 2020 of the Conference of the Parties to the United Nations Convention \nagainst Transnational Organized Crime, entitled \u201cStrengthening international \ncooperation against the illicit manufacturing of and trafficking in firearms, their parts \nand components and ammunition\u201d;46 \n \n68. \nUrges Member States to exchange good practices and experiences of \npractitioners who are involved in combating illicit trafficking in firearms and to consider \nthe use of available tools, including marking and record-keeping, to facilitate the tracing \nof firearms and, where possible, their parts and components and ammunition, in order to \nenhance criminal investigations into illicit trafficking in firearms;  \n \n69. Urges States parties to the Protocol against the Illicit Manufacturing of \nand Trafficking in Firearms, Their Parts and Components and Ammunition that import \nand export parts and components of firearms to reinforce their control measures in \nline with the Protocol and other relevant international legal instruments to which they \nare party, with a view to preventing and reducing the risks of their diversion, illicit \nmanufacturing and trafficking, and takes note of the first United Nations Office on \nDrugs and Crime Global Study on Firearms Trafficking; \n \n70. Notes the results of the eighth meeting of the Working Group on Firearms, \nheld in Vienna from 10 to 12 May 2021, and invites States parties to take measures, \nas appropriate and consistent with their domestic laws, to implement the \nrecommendations and discussion points resulting from the Working Group meetings, \nin order to contribute to strengthening international cooperation against the illicit \nmanufacturing of and trafficking in firearms;  \n \n71. Calls upon Member States to intensify all efforts to address the world drug \nproblem, based upon the principle of common and shared responsibility and through \na comprehensive and balanced approach, including through more effective bilateral, \nregional and international cooperation among judicial and law enforcement \nauthorities, in accordance with international law, to counter the involvement of \norganized criminal groups in illicit drug production and trafficking and related \ncriminal activities and to take steps to reduce the violence that accompanies drug \ntrafficking;  \n \n72. Recommends that Member States, as appropriate to their national contexts, \nadopt a comprehensive and integrated approach to crime prevention and criminal \njustice reform, based on baseline assessments, regular data collection and analysis, \nand focusing on all sectors of and linkages within the justice system, and develop \ncrime prevention policies, strategies and programmes, including ones that focus on \nearly prevention by using multidisciplinary and participatory approaches, in close \ncooperation with all stakeholders, including civil society, and requests the United \nNations Office on Drugs and Crime to continue to provide technical assistance, upon \nrequest, to Member States for this purpose;  \n \n73. Reiterates its invitation to Member States to gradually adopt the \nInternational Classification of Crime for Statistical Purposes and to strengthen \nnational statistical systems of criminal justice, requests the United Nations Office on \nDrugs and Crime, within its existing mandate, to continue to strengthen the regular \ncollection, analysis and dissemination of accurate, reliable, timely and comparable \ndata and information, including, as appropriate, real time data, and data disaggregated \n__________________ \n \n46  See CTOC/COP/2020/10, sect. I.A. \n\nStrengthening the United Nations crime prevention and criminal \njustice programme, in particular its technical cooperation capacity \nA/RES/76/187\n \n23/23\n21-19242 \n \nby sex, age and other relevant criteria, and strongly encourages Member States to \nshare such data and information with the Office;  \n \n74. Takes note of the global studies on the smuggling of migrants, trafficking \nin persons, trafficking in firearms and intentional homicide, including on the gender-\nrelated killing of women and girls, that have been produced by the United Nations \nOffice on Drugs and Crime and thus provide data-driven analyses in support of policy \ndevelopment at the national and international levels, and requests the Office to \ncontinue to develop, in close cooperation with Member States, technical and \nmethodological tools and trend analyses and studies to enhance knowledge of crime \ntrends and support Member States in designing appropriate responses in specific areas \nof crime, in particular in their transnational dimension and in relation to the \nSustainable Development Goals, taking into account the need to make the best \npossible use of existing resources;  \n \n75. Encourages Member States to take relevant measures, as appropriate to \ntheir national contexts, to ensure the diffusion, use and application of the United \nNations standards and norms in crime prevention and criminal justice, including the \nconsideration and, where they deem it necessary, dissemination of existing manuals, \nhandbooks and capacity-building material, including e-learning training materials, \ndeveloped and published by the United Nations Office on Drugs and Crime;  \n \n76. Requests the United Nations Office on Drugs and Crime, in collaboration \nand close consultation with Member States and within existing resources, to continue \nto support the enhancement of capacity and skills in the field of forensic sciences, \nincluding the setting of standards, and the development of technical assistance \nmaterial for training, such as manuals, compilations of useful practices and guidelines \nand scientific and forensic reference material, for law enforcement officials and \nprosecution authorities, and to promote and facilitate the establishment and \nsustainability of regional networks of forensic science providers in order to enhance \ntheir expertise and capacity to prevent and combat transnational organized crime;  \n \n77. Requests the Secretary-General to submit a report to the General Assembly \nat its seventy-seventh session on the implementation of the mandates of the United \nNations crime prevention and criminal justice programme, reflecting also emerging \npolicy issues and possible responses. \n \n53rd plenary meeting \n16 December 2021 \n \n \n",
  "paragraphs": {
    "1": "Takes note with appreciation of the report of the Secretary-General prepared pursuant to resolution 75/196;40",
    "2": "Reaffirms its resolution 70/1, entitled \u201cTransforming our world: the 2030 Agenda for Sustainable Development\u201d, which, inter alia, includes the commitment to promote peaceful and inclusive societies for sustainable development, provide access to justice for all and build effective, accountable and inclusive institutions at all levels;",
    "3": "Calls upon all Member States, when appropriate, to take into consideration the Kyoto Declaration on Advancing Crime Prevention, Criminal Justice and the Rule of Law: Towards the Achievement of the 2030 Agenda for Sustainable Development, adopted at the high-level segment of the Fourteenth United Nations Congress on Crime Prevention and Criminal Justice, held in Kyoto, Japan, from 7 to 12 March 2021, when formulating legislation and policy directives, and to make every effort, where appropriate, to implement the principles contained therein in conformity with the purposes and principles of the Charter of the United Nations, and requests the United Nations Office on Drugs and Crime to continue to provide technical assistance, upon request, to Member States, including through its Global Programme for the Implementation of the Doha Declaration and the Education for Justice initiative;",
    "4": "Encourages Member States to promote the integrity, honesty and responsibility of criminal justice practitioners through specialized and appropriate training and the application of codes or standards of conduct, and in this context notes the work of the Global Judicial Integrity Network aimed at strengthening judicial integrity;",
    "5": "Urges Member States that have not yet done so to consider ratifying or acceding to the United Nations Convention against Transnational Organized Crime and the Protocols thereto, the Single Convention on Narcotic Drugs of 1961 as amended by the 1972 Protocol, the Convention on Psychotropic Substances of 1971, the United Nations Convention against Illicit Traffic in Narcotic Drugs and Psychotropic Substances of 1988, the United Nations Convention against Corruption and the international conventions and protocols related to terrorism, and urges States parties to those conventions and protocols to make efforts towards their effective implementation, particularly with regard to preventing and combating transnational organized crime, including cybercrime;",
    "6": "Reaffirms that the United Nations Convention against Transnational Organized Crime and the Protocols thereto represent the most important tools of the international community for fighting transnational organized crime, including cybercrime, notes with appreciation that the number of States parties has reached 190, which is a significant indication of the commitment shown by the international community to combating transnational organized crime, and recalls in this respect resolution 10/4 of 16 October 2020 of the Conference of the Parties to the United Nations Convention against Transnational Organized Crime,41 in which the Conference emphasized the continued relevance of the Convention, including in countering new, emerging and evolving forms of transnational organized crime;",
    "7": "Recognizes that technical assistance and economic development are fundamental to ensuring the effective implementation of the provisions of the United Nations Convention against Transnational Organized Crime and the Protocols thereto, and recalls in this regard article 30 of the Convention;",
    "8": "Welcomes the progress made by States parties in their participation in the review process of the Mechanism for the Review of the Implementation of the United Nations Convention against Transnational Organized Crime and the Protocols thereto, in accordance with resolution 10/1 of the Conference of the Parties to the United Nations Convention against Transnational Organized Crime, adopted at its tenth session, held in Vienna from 12 to 16 October 2020, and urges States parties to continue to actively participate in and support the review process;",
    "9": "Encourages States parties to the United Nations Convention against Transnational Organized Crime to submit case law, legislation and other relevant responses to the knowledge management portal known as Sharing Electronic Resources and Laws on Crime;",
    "10": "Welcomes the resolutions adopted by the Conference of the Parties at its eighth, ninth and tenth sessions, held in Vienna from 17 to 21 October 2016, from 15 to 19 October 2018 and from 12 to 16 October 2020, respectively, to promote greater use of the Convention by central authorities in extradition and mutual legal assistance and to enhance the effectiveness of these authorities and to strengthen, as appropriate, the implementation of the Protocol against the Illicit Manufacturing of and Trafficking in Firearms, Their Parts and Components and Ammunition, supplementing the United Nations Convention against Transnational Organized Crime;",
    "11": "Also welcomes the thirty-second special session of the General Assembly, held at United Nations Headquarters from 2 to 4 June 2021, at which the Assembly adopted a political declaration entitled \u201cOur common commitment to effectively addressing challenges and implementing measures to prevent and combat corruption and strengthen international cooperation\u201d;",
    "12": "Urges States parties to the United Nations Convention against Corruption to continue to provide full support to the review mechanism adopted by the Conference of the States Parties to the Convention, notes the progress made under the second cycle of the Mechanism for the Review of Implementation of the Convention, and further notes with appreciation that the number of States parties has reached 188, which is a significant indication of the commitment shown by the international community to combating corruption and related crimes;",
    "13": "Also urges States parties to the United Nations Convention against Corruption to increase their efforts and to take measures to prevent and counter corruption, with the necessary focus on, among others, acts of corruption that involve vast quantities of assets, without undermining their commitment to preventing and countering corruption at all levels and in all forms, and calls upon States parties to the Convention to take measures to ensure that legal and natural persons are held accountable for corruption offences, including when they involve bribery and vast quantities of assets, in accordance with the Convention;",
    "14": "Takes note of the creation of the Global Operational Network of Anti-Corruption Law Enforcement Authorities under the auspices of the United Nations Office on Drugs and Crime, and encourages States to participate in and make best use of this network, as appropriate;",
    "15": " give full effect to the resolutions adopted by those bodies, including providing information regarding compliance with the treaties;",
    "16": "Encourages Member States, in accordance with their domestic law, to strengthen the capacity of their respective criminal justice systems to investigate, prosecute and punish all forms of crime, while supporting an accessible, effective, fair, humane, transparent and accountable criminal justice system and protecting the human rights and fundamental freedoms of defendants, as well as the rights and legitimate interests of victims and witnesses, and to adopt and reinforce measures to ensure access to effective legal aid in criminal justice systems, and in this context takes note of the establishment of the Global Judicial Integrity Network in April 2018;",
    "17": "Requests the United Nations Office on Drugs and Crime to continue to provide technical assistance to Member States, upon request, including, inter alia, in the field of international cooperation in criminal matters, to strengthen the rule of law, also taking into account the work undertaken by other United Nations entities, within existing mandates, as well as regional and bilateral efforts, and to continue to ensure coordination and coherence, including through the Rule of Law Coordination and Resource Group;",
    "18": "Calls for greater coordination and coherence among United Nations entities and with stakeholders, including donors, host countries and recipients of capacity-building, in countering transnational organized crime;",
    "19": "Reiterates the importance of providing the United Nations crime prevention and criminal justice programme with sufficient, stable and predictable funding for the full implementation of its mandates;",
    "20": "Encourages all States to have national and local action plans for crime prevention in order to take into account, in a comprehensive, integrated and participatory manner, inter alia, factors that place certain populations and places at higher risk of victimization and/or of offending, and to ensure that such plans are based on the best available evidence and good practices, and stresses that crime prevention should be considered an integral element of strategies to foster social and economic development in all States, in accordance with the commitments contained in General Assembly resolutions 70/1 and 70/299;",
    "21": "Recommends that Member States adopt multisectoral crime prevention policies and programmes for youth and increase their meaningful and inclusive participation therein, including through sport and education, taking into consideration their varying needs, and safeguard their well-being, recognizing that youth may face specific challenges and risk factors that make them particularly vulnerable to crime, all forms of violence, terrorism and victimization, and in this respect recalls its resolution 76/183 of 16 December 2021, entitled \u201cIntegrating sport into youth crime prevention and criminal justice strategies\u201d;",
    "22": "Invites the President of the General Assembly, in cooperation with the United Nations Office on Drugs and Crime and with the involvement of relevant stakeholders, to hold, within existing resources and during the seventy-sixth session, a high-level debate on the theme \u201cEnhancing youth mainstreaming in crime prevention policies\u201d and to prepare a summary of the discussion for transmission to the Commission on Crime Prevention and Criminal Justice and to all Member States;",
    "23": " understanding of the transnational aspects of urban safety and security, and improve the efforts of States to curb criminal actions in this field;",
    "24": "Urges Member States, in cooperation with the United Nations crime prevention and criminal justice programme, to develop national, subregional, regional and international strategies, with the support of relevant international organizations, as appropriate, and other necessary measures, including the establishment, in accordance with domestic legislation, of designated central and competent authorities and effective points of contact dedicated to facilitating the procedures related to international cooperation, including for extradition and mutual legal assistance requests, in order to effectively address transnational organized crime; to strengthen all forms of cooperation to enable the return of illicitly acquired assets in accordance with the provisions of the United Nations Convention against Corruption for asset recovery, in particular chapter V, with the cooperation of the United Nations Office on Drugs and Crime, within its existing mandate; and to inform accordingly the Office about existing or updated contact details of such authorities and points of contact to facilitate international cooperation as appropriate;",
    "25": "Encourages Member States to study the implementation of a common documentation standard, including within the United Nations system and in cooperation with relevant international institutions;",
    "26": "Reaffirms the importance of the United Nations crime prevention and criminal justice programme in promoting effective action to strengthen international cooperation in crime prevention and criminal justice, as well as of the work of the United Nations Office on Drugs and Crime in the fulfilment of its mandate in crime prevention and criminal justice, including providing to Member States, upon request and as a matter of high priority, technical cooperation, advisory services and other forms of assistance, and coordinating with and complementing the work of all relevant and competent United Nations bodies and offices in respect of all forms of organized crime, including piracy and transnational organized crime committed at sea, cybercrime, criminal misuse of the Internet and other information and communications technologies as well as such misuse for terrorist purposes, the misuse of new information technologies to abuse and exploit children, trafficking in cultural property and artefacts, illicit financial flows, money-laundering, economic and financial crimes, including fraud, as well as tax and corporate crimes, match-fixing, counterfeiting in trademark goods, illicit trafficking in endangered species of wild fauna and flora and other crimes that affect the environment, such as trafficking in timber, hazardous waste, precious metals, stones and other minerals, drug trafficking, kidnapping, trafficking in persons, including the support and protection, as appropriate, of victims, their families and witnesses, organ trafficking, smuggling of migrants and illicit manufacturing of and trafficking in firearms, direct and indirect trade in oil and refined oil products with organized criminal and terrorist groups, as well as corruption and terrorism;",
    "27": "Encourages Member States to collect relevant information and to further identify, analyse and counter any existing, growing or potential links, in some cases, between transnational organized crime, the illicit access to and trafficking in firearms, their parts and components and ammunition, illicit drug-related activities, money- laundering and the financing of terrorism, in order to enhance criminal justice responses to those crimes, and calls upon the United Nations Office on Drugs and Crime, within its relevant mandates, to support, upon request, the efforts of Member States in that regard;",
    "28": " produce estimates of the total value of inward and outward illicit financial flows, and encourages the Office, within its relevant mandates and in cooperation with Member States, to continue its work on studying illicit financial flows related to criminal activities, in line with this methodology;",
    "29": "Calls upon Member States to strengthen cooperation at the international, regional, subregional and bilateral levels to counter the threat posed by foreign terrorist fighters, including those who are returning and relocating, including through enhanced operational and timely information-sharing, logistical support, as appropriate, and capacity-building activities, such as those provided by the United Nations Office on Drugs and Crime, to share and adopt best practices to identify foreign terrorist fighters, to prevent the travel of foreign terrorist fighters from, into or through Member States, to prevent the financing, mobilization, recruitment and organization of foreign terrorist fighters, to prevent and counter violent extremism as and when conducive to terrorism, to enhance efforts to implement prosecution, rehabilitation and reintegration strategies, taking into account gender and age dimensions, and to ensure that any person who participates in the financing, planning, preparation or perpetration of terrorist acts or in the supporting of terrorist acts is brought to justice, in compliance with obligations under international law, as well as applicable domestic law, and requests the Office to continue to provide technical assistance, upon request, in this regard in cooperation and coordination with the Office of Counter-Terrorism and the United Nations Global Counter-Terrorism Coordination Compact entities;",
    "30": "Calls upon the United Nations Office on Drugs and Crime to further enhance technical assistance, upon request, for building the capacity of Member States to become party to and implement the international conventions and protocols related to counter-terrorism, including through targeted programmes and the training of relevant criminal justice and law enforcement officials, upon request, and the development of technical tools and publications, within its mandate, and in this respect takes note with appreciation of the Guidance Manual for Member States on Terrorist Financing Risk Assessments, published by the Office;",
    "31": "Calls upon Member States to address the threat posed by radicalization to terrorism in prisons, and calls upon the United Nations, especially the United Nations Office on Drugs and Crime, to continue to support Member States in this regard in cooperation and coordination with the Office of Counter-Terrorism and the United Nations Global Counter-Terrorism Coordination Compact entities;",
    "32": "Urges the United Nations Office on Drugs and Crime to increase collaboration with intergovernmental, international and regional organizations that have transnational organized crime mandates, as appropriate, in order to share best practices, foster cooperation and take advantage of their unique and comparative advantage;",
    "33": "Reaffirms the importance of the United Nations Office on Drugs and Crime and its country and regional offices in building capacity at the local level in the field of crime prevention and criminal justice, and urges the Office to consider regional vulnerabilities, projects and impacts in the fight against transnational organized crime in all its forms, in particular in developing countries, when deciding to close and allocate offices, with a view to maintaining an effective level of support to national and regional efforts in those areas;",
    "34": " Psychotropic Substances of 1971, the United Nations Convention against Illicit Traffic in Narcotic Drugs and Psychotropic Substances of 1988 and the United Nations Convention against Corruption, and to discharge its functions as the secretariat of the conferences of the parties to the conventions, the Commission on Crime Prevention and Criminal Justice and the Commission on Narcotic Drugs, as well as the United Nations congresses on crime prevention and criminal justice, in accordance with its mandate, and requests the Secretariat to continue to provide support to the Commissions within their respective mandates, enabling them to actively contribute, as appropriate, to the global follow-up and the thematic review of progress made by Member States in the achievement of the Sustainable Development Goals as set forth in resolutions 70/299, and 72/305 of 23 July 2018;",
    "35": "Urges all Member States to provide the fullest possible financial and political support to the United Nations Office on Drugs and Crime by widening its donor base and increasing voluntary contributions, in particular general-purpose contributions, so as to enable it to continue, expand, improve and strengthen, within its mandates, its research, operational and technical cooperation activities;",
    "36": "Expresses concern regarding the overall financial situation of the United Nations Office on Drugs and Crime, emphasizes the need to provide the Office with adequate, predictable and stable resources and to ensure their cost-effective utilization, and requests the Secretary-General, also considering the extension of the mandate of the standing open-ended intergovernmental working group on improving the governance and financial situation of the Office, to continue to report, within existing reporting obligations, on the financial situation of the Office and to continue to ensure that the Office has sufficient resources to carry out its mandates fully and effectively;",
    "37": "Invites States and other interested parties to make further voluntary contributions to the United Nations voluntary trust fund for victims of trafficking in persons, especially women and children, and to the United Nations voluntary trust fund on contemporary forms of slavery;",
    "38": "Calls upon Member States to intensify national and international efforts to eliminate all forms of discrimination, including racism, religious intolerance, xenophobia and gender-related discrimination by, inter alia, raising awareness, developing educational materials and programmes and considering, where appropriate, drafting and enforcing legislation against discrimination;",
    "39": "Emphasizes the importance of protecting vulnerable members of society, regardless of their status, who may be subject to multiple and aggravated forms of discrimination, and in that regard expresses its concern about the increase in the activities of transnational and national organized criminal groups and others who profit from crimes against migrants, especially women and children, without regard for dangerous and inhumane conditions and in flagrant violation of national laws and international law;",
    "40": "Calls upon Member States to implement, when appropriate, the United Nations Standard Minimum Rules for the Treatment of Prisoners (the Nelson Mandela Rules),42 bearing in mind their spirit and purpose, and to intensify their efforts to address the challenge of prison overcrowding through appropriate criminal justice reforms, which should include, where appropriate, a review of penal policies and practical measures to reduce pretrial detention, to enhance the use of non-custodial sanctions and measures and to improve access to legal aid to the extent possible, and requests the United Nations Office on Drugs and Crime to continue to provide technical assistance to Member States, upon request, in this respect;",
    "41": "Reaffirms its resolution 76/182 of 16 December 2021 on reducing reoffending through rehabilitation and reintegration, and encourages Member States to promote a rehabilitative environment in correctional facilities and multi- stakeholder partnerships to reduce reoffending by fostering inter-agency coordination among relevant government authorities;",
    "42": "Emphasizes the need for all Member States to promote, where appropriate, cooperation on the transfer of sentenced persons to serve the rest of their sentences in their own countries, conclude bilateral or multilateral agreements or arrangements in this regard as necessary, taking into consideration the rights of sentenced persons and issues relating to consent, rehabilitation and reintegration, as appropriate, and raise awareness among these prisoners about the availability of such measures;",
    "43": "Invites Member States to mainstream a gender perspective into their criminal justice systems, including by the use of non-custodial measures for women, when appropriate, and by improving the treatment of women prisoners, taking into consideration the United Nations Rules for the Treatment of Women Prisoners and Non-custodial Measures for Women Offenders (the Bangkok Rules), 43 and by developing and implementing national strategies and plans to promote the full protection of women and girls from all acts of violence and to strengthen the crime prevention and criminal justice response to the gender-related killing of women and girls, in particular by taking measures to support the practical capacity of Member States to prevent, investigate, prosecute and punish all forms of such crime, and welcomes in this respect the practical tools recommended by the open-ended intergovernmental expert group on gender-related killing of women and girls at its meeting held in Bangkok from 11 to 13 November 2014; 44",
    "44": "Also invites Member States to integrate child- and youth-related issues into their criminal justice reform efforts, recognizing the importance of protecting children from all forms of violence, exploitation and abuse, consistent with the obligations of parties under relevant international instruments, and to develop comprehensive child- sensitive justice policies focused on the best interests of the child, consistent with the principle that the deprivation of liberty of children should be used only as a measure of last resort and for the shortest appropriate period of time;",
    "45": "Recognizes the efforts made by the United Nations Office on Drugs and Crime to assist Member States in developing their abilities and strengthening their capacity to prevent and combat kidnapping, and requests the Office to continue to provide technical assistance, upon request, with a view to fostering international cooperation, in particular mutual legal assistance, aimed at countering effectively this growing serious crime;",
    "46": "Calls upon Member States to consider ratifying or acceding to, and for States parties to effectively implement, the Protocol against the Smuggling of Migrants by Land, Sea and Air, supplementing the United Nations Convention against Transnational Organized Crime,45 to reinforce international cooperation for preventing and combating the smuggling of migrants and for the prosecution of smugglers, in accordance, as appropriate, with article 6 of the Protocol and with national laws and legislation, while effectively protecting the rights and respecting the dignity of smuggled migrants, consistent with the principles of non-discrimination and other applicable obligations under relevant international law, taking into account the special needs of women, children, especially when unaccompanied, and persons with disabilities and older persons, and in collaboration with international organizations, civil society and the private sector, and in this regard calls upon the United Nations Office on Drugs and Crime to continue its technical assistance to Member States in accordance with the Protocol;",
    "47": "Takes note of the launch of the first United Nations Office on Drugs and Crime Global Study on Smuggling of Migrants, encourages Member States to promote the reliable collection of relevant data and research, at the national and, as appropriate, the regional and international levels, invites the Office to systematically collect data and information from Member States on migrant smuggling routes, the modi operandi of migrant smugglers and the role of transnational organized crime, and invites Member States and other donors to provide extrabudgetary resources for this purpose;",
    "48": "Encourages Member States to ensure that, in investigating and prosecuting trafficking in persons and the smuggling of migrants, the concurrent undertaking of financial investigations is a standard practice, with a view to tracing, freezing and confiscating proceeds acquired through those crimes, and to consider trafficking in persons and the smuggling of migrants to be predicate offences of money-laundering;",
    "49": "Takes note of the launch by the United Nations Office on Drugs and Crime of the Global Report on Trafficking in Persons 2020, recognizes that the Global Report on Trafficking in Persons is a useful resource facilitating information-sharing on the nature, scope and trends of trafficking in persons, as well as modi operandi of traffickers, and encourages Member States to submit to the Office information on patterns, forms and flows of trafficking in persons for purposes of compiling future global reports;",
    "50": "Emphasizes the importance of preventing and combating all forms of trafficking in persons, and in this regard expresses its concern about the activities of transnational and national organized criminal groups and others who profit from such crimes, including for the purpose of organ removal, and calls upon Member States to consider ratifying or acceding to, and for States parties, in accordance with their obligations, to fully and effectively implement the Protocol to Prevent, Suppress and Punish Trafficking in Persons, Especially Women and Children, supplementing the United Nations Convention against Transnational Organized Crime, as well as to strengthen national efforts to combat all forms of trafficking in persons and to protect and assist the victims of trafficking in accordance with all relevant legal obligations and in collaboration with international organizations, civil society and the private sector, and in this regard calls upon the United Nations Office on Drugs and Crime to continue its technical assistance to Member States in accordance with the Protocol;",
    "51": "Requests the United Nations Office on Drugs and Crime to enhance its technical assistance to Member States, upon request, to strengthen international cooperation in preventing and combating terrorism, including the phenomenon of travelling, returning and relocating foreign terrorist fighters, especially with regard to extradition and mutual legal assistance, and its financial sources, through the facilitation of the ratification and implementation of the universal conventions and protocols related to terrorism, in close consultation and cooperation with the Security Council Committee established pursuant to resolution 1373 (2001) concerning counter-terrorism (the Counter-Terrorism Committee) and its Executive Directorate, as well as to contribute to the work of the Office of Counter-Terrorism, established in accordance with resolution 71/291, and of the United Nations Global Counter- Terrorism Coordination Compact entities, and invites Member States to provide the United Nations Office on Drugs and Crime with appropriate resources for its mandate;",
    "52": " Global Programme against Money-Laundering, Proceeds of Crime and the Financing of Terrorism, in accordance with United Nations-related instruments and international standards, including, where applicable, standards and relevant initiatives of regional, interregional and multilateral organizations and intergovernmental bodies against money-laundering, inter alia and as appropriate, the Financial Action Task Force, in accordance with national legislation;",
    "53": "Encourages Member States to enhance the effectiveness of countering criminal threats to the tourism sector, including terrorist threats, through, when appropriate, the activities of the United Nations Office on Drugs and Crime and other relevant international organizations, in cooperation with the World Tourism Organization and the private sector;",
    "54": "Affirms that attacks intentionally directed against buildings dedicated to religion, education, art, science or charitable purposes, or historic monuments, or hospitals and places where the sick and wounded are collected, may amount to war crimes, stresses the importance of holding accountable perpetrators of attacks intentionally directed against the above-mentioned buildings, provided that they are not military objectives, and calls upon all States to take appropriate action to this end within their jurisdiction in accordance with applicable international law;",
    "55": "Urges States parties to make effective use of the United Nations Convention against Transnational Organized Crime for broad cooperation in preventing and combating all forms and aspects of trafficking in cultural property and related offences, including money-laundering and the financing of terrorism, especially in returning such confiscated proceeds of crime or property to their legitimate owners, in accordance with article 14, paragraph 2, of the Convention;",
    "56": "Encourages States parties to the United Nations Convention against Transnational Organized Crime to promptly notify countries of origin when objects that may be cultural property removed from their territory are identified, and to exchange information and statistical data on all forms and aspects of trafficking in cultural property and related offences, and reaffirms in this regard the importance of the International Guidelines for Crime Prevention and Criminal Justice Responses with Respect to Trafficking in Cultural Property and Other Related Offences, as adopted by the General Assembly in its resolution 69/196;",
    "57": "Urges Member States to introduce effective national and international measures to prevent and combat illicit trafficking in cultural property, including publicizing legislation, international guidelines and related technical background documents, and offering special training for police, customs and border services, and invites Member States to make trafficking in cultural property and related offences, including stealing from and looting of archaeological and other cultural sites, a serious crime, as defined in article 2 (b) of the United Nations Convention against Transnational Organized Crime;",
    "58": "Also urges Member States to take decisive steps at the national level to prevent, combat and eradicate the illegal trade in wildlife, on both the supply and demand sides, including by strengthening the legislation necessary for the prevention, investigation and prosecution of such illegal trade, as well as by strengthening enforcement and criminal justice responses, in accordance with national legislation and international law, acknowledging that the International Consortium on Combating Wildlife Crime can provide valuable technical assistance in this regard;",
    "59": " with their national legislation and with article 2 (b) of the United Nations Convention against Transnational Organized Crime;",
    "60": "Also calls upon Member States to take appropriate and effective measures to prevent and combat trafficking in timber, hazardous waste and other wastes, precious metals, stones and other minerals by organized criminal groups, including, where appropriate, the adoption and effective implementation of the necessary legislation for the prevention, investigation and prosecution of illicit trafficking in timber, hazardous waste and other wastes, precious metals, stones and other minerals;",
    "61": "Reaffirms its resolution 76/185 of 16 December 2021 on preventing and combating crimes that affect the environment, and requests the United Nations Office on Drugs and Crime, subject to the availability of extrabudgetary resources and within its mandate, to provide technical assistance and capacity-building to Member States, upon request, for the purposes of supporting their efforts to effectively prevent and combat crimes that affect the environment, as well as corruption and money- laundering related to such crimes;",
    "62": "Encourages Member States to continue to support the United Nations Office on Drugs and Crime in providing targeted technical assistance, within its existing mandate, to enhance the capacity of affected States, upon their request, to combat piracy and other forms of crime committed at sea, including by assisting Member States in creating an effective law enforcement response and strengthening their judicial capacity;",
    "63": "Notes with appreciation the holding of the seventh meeting of the open- ended intergovernmental Expert Group to Conduct a Comprehensive Study on Cybercrime and the responses to cybercrime by Member States, the international community and the private sector, and calls upon Member States to take actions to create a secure and resilient cyberenvironment, to prevent and counter effectively criminal activities carried out over the Internet, paying particular attention to identity fraud-related offences, recruitment for the purpose of trafficking in persons and protecting children from online exploitation and abuse, to strengthen law enforcement cooperation at the national and international levels, including with the aim of identifying and protecting victims by, inter alia, removing child pornography and other child sexual abuse material from the Internet, to enhance the security of computer networks and protect the integrity of relevant infrastructure, and to endeavour to provide long-term technical assistance and capacity-building to strengthen the ability of national authorities to deal with cybercrime, including the prevention, detection, investigation and prosecution of such crime in all its forms;",
    "64": "Encourages Member States to strengthen their efforts in combating cybercrime and all forms of criminal misuse of information and communications technologies and to enhance international cooperation involving electronic evidence in this regard;",
    "65": "Notes the establishment of the Ad Hoc Committee to Elaborate a Comprehensive International Convention on Countering the Use of Information and Communications Technologies for Criminal Purposes, encourages Member States to actively participate in the work of the Ad Hoc Committee, and further encourages the participation of relevant stakeholders, in line with the modalities established under its resolution 75/282 of 26 May 2021;",
    "66": " collection and analysis and strengthened national statistical systems, and in this respect invites Member States to provide the Office with relevant information and suitably disaggregated data;",
    "67": "Encourages Member States to effectively implement resolution 10/2 of 16 October 2020 of the Conference of the Parties to the United Nations Convention against Transnational Organized Crime, entitled \u201cStrengthening international cooperation against the illicit manufacturing of and trafficking in firearms, their parts and components and ammunition\u201d;46",
    "68": "Urges Member States to exchange good practices and experiences of practitioners who are involved in combating illicit trafficking in firearms and to consider the use of available tools, including marking and record-keeping, to facilitate the tracing of firearms and, where possible, their parts and components and ammunition, in order to enhance criminal investigations into illicit trafficking in firearms;",
    "69": "Urges States parties to the Protocol against the Illicit Manufacturing of and Trafficking in Firearms, Their Parts and Components and Ammunition that import and export parts and components of firearms to reinforce their control measures in line with the Protocol and other relevant international legal instruments to which they are party, with a view to preventing and reducing the risks of their diversion, illicit manufacturing and trafficking, and takes note of the first United Nations Office on Drugs and Crime Global Study on Firearms Trafficking;",
    "70": "Notes the results of the eighth meeting of the Working Group on Firearms, held in Vienna from 10 to 12 May 2021, and invites States parties to take measures, as appropriate and consistent with their domestic laws, to implement the recommendations and discussion points resulting from the Working Group meetings, in order to contribute to strengthening international cooperation against the illicit manufacturing of and trafficking in firearms;",
    "71": "Calls upon Member States to intensify all efforts to address the world drug problem, based upon the principle of common and shared responsibility and through a comprehensive and balanced approach, including through more effective bilateral, regional and international cooperation among judicial and law enforcement authorities, in accordance with international law, to counter the involvement of organized criminal groups in illicit drug production and trafficking and related criminal activities and to take steps to reduce the violence that accompanies drug trafficking;",
    "72": "Recommends that Member States, as appropriate to their national contexts, adopt a comprehensive and integrated approach to crime prevention and criminal justice reform, based on baseline assessments, regular data collection and analysis, and focusing on all sectors of and linkages within the justice system, and develop crime prevention policies, strategies and programmes, including ones that focus on early prevention by using multidisciplinary and participatory approaches, in close cooperation with all stakeholders, including civil society, and requests the United Nations Office on Drugs and Crime to continue to provide technical assistance, upon request, to Member States for this purpose;",
    "73": "Reiterates its invitation to Member States to gradually adopt the International Classification of Crime for Statistical Purposes and to strengthen national statistical systems of criminal justice, requests the United Nations Office on Drugs and Crime, within its existing mandate, to continue to strengthen the regular collection, analysis and dissemination of accurate, reliable, timely and comparable data and information, including, as appropriate, real time data, and data disaggregated by sex, age and other relevant criteria, and strongly encourages Member States to share such data and information with the Office;",
    "74": "Takes note of the global studies on the smuggling of migrants, trafficking in persons, trafficking in firearms and intentional homicide, including on the gender- related killing of women and girls, that have been produced by the United Nations Office on Drugs and Crime and thus provide data-driven analyses in support of policy development at the national and international levels, and requests the Office to continue to develop, in close cooperation with Member States, technical and methodological tools and trend analyses and studies to enhance knowledge of crime trends and support Member States in designing appropriate responses in specific areas of crime, in particular in their transnational dimension and in relation to the Sustainable Development Goals, taking into account the need to make the best possible use of existing resources;",
    "75": "Encourages Member States to take relevant measures, as appropriate to their national contexts, to ensure the diffusion, use and application of the United Nations standards and norms in crime prevention and criminal justice, including the consideration and, where they deem it necessary, dissemination of existing manuals, handbooks and capacity-building material, including e-learning training materials, developed and published by the United Nations Office on Drugs and Crime;",
    "76": "Requests the United Nations Office on Drugs and Crime, in collaboration and close consultation with Member States and within existing resources, to continue to support the enhancement of capacity and skills in the field of forensic sciences, including the setting of standards, and the development of technical assistance material for training, such as manuals, compilations of useful practices and guidelines and scientific and forensic reference material, for law enforcement officials and prosecution authorities, and to promote and facilitate the establishment and sustainability of regional networks of forensic science providers in order to enhance their expertise and capacity to prevent and combat transnational organized crime;",
    "77": "Requests the Secretary-General to submit a report to the General Assembly at its seventy-seventh session on the implementation of the mandates of the United Nations crime prevention and criminal justice programme, reflecting also emerging policy issues and possible responses."
  },
  "agenda_items": [
    "Item 108"
  ],
  "symbol_references": []
}