{
  "symbol": "A/RES/73/94",
  "filename": "A_RES_73_94.pdf",
  "title": "73/94. Operations of the United Nations Relief and Works Agency for Palestine Refugees in the Near East",
  "text": "United Nations \nA/RES/73/94\n \n \nGeneral Assembly \nDistr.: General \n18 December 2018 \n \n18-21412 (E)    201218 \n*1821412* \n \n \nSeventy-third session \nAgenda item 54 \n \n \n \n \n Resolution adopted by the General Assembly \non 7 December 2018 \n \n \n \n \n[on the report of the Special Political and Decolonization Committee \n(Fourth Committee) (A/73/523)] \n \n \n \n73/94. Operations of the United Nations Relief and Works Agency \nfor Palestine Refugees in the Near East \n \n \n \nThe General Assembly,  \n \nRecalling its resolutions 194 (III) of 11 December 1948, 212 (III) of 19 November \n1948, 302 (IV) of 8 December 1949 and all subsequent related resolutions, including \nits resolution 72/82 of 7 December 2017, \n \nRecalling also the relevant resolutions of the Security Council, \n \nHaving considered the report of the Commissioner-General of the United \nNations Relief and Works Agency for Palestine Refugees in the Near East covering \nthe period from 1 January to 31 December 2017,1  \n \nTaking note of the letter dated 19 June 2018 from the Chair of the Advisory \nCommission of the Agency addressed to the Commissioner-General,2 and noting the \nextraordinary meeting of the Commission held on 21 January and 16 August 2018, \n \nUnderlining that, at a time of heightened conflict and instability in the Middle \nEast, the Agency continues to play a vital role in ameliorating the plight of the \nPalestine refugees through the provision of, inter alia, essential education, health, \nrelief and social services programmes and emergency assistance to a registered \npopulation of more than 5.4 million refugees whose situation has become extremely \nprecarious, in mitigating the consequences of alarming trends, including increasing \nviolence, marginalization and poverty, in the areas of operation, and in providing a \ncrucial measure of stability in the region, \n \nDeeply concerned about the extremely critical financial situation of the Agency, \ncaused by the structural underfunding of the Agency, as well as by rising needs and \nexpenditures resulting from the deterioration of the socioeconomic and humanitarian \n__________________ \n \n1  Official Records of the General Assembly, Seventy-third Session, Supplement No. 13 (A/73/13). \n \n2  Ibid., pp. 6\u20137. \n\nA/RES/73/94 \nOperations of the United Nations Relief and Works\nAgency for Palestine Refugees in the Near East\n \n18-21412\n2/10 \n \nconditions and the conflicts and rising instability in the region and their significant \nnegative impact on the ability of the Agency to deliver essential services to the \nPalestine refugees, including its emergency, recovery, \nreconstruction and \ndevelopment programmes in all fields of operation, \n \nTaking note of the report of the Secretary-General on the operations of the \nUnited Nations Relief and Works Agency for Palestine Refugees in the Near East, 3 \nsubmitted pursuant to resolution 71/93 of 6 December 2016, and the request contained \ntherein for broad consultations to explore all ways and means, including through \nvoluntary and assessed contributions, to ensure that the Agency\u2019s funding is \nsufficient, predictable and sustained for the duration of its mandate, and considering \nthe recommendations contained in the report, \n \nTaking note also of the report of 30 June 2017 of the Commissioner-General, \nsubmitted pursuant to paragraph 57 of the report of the Secretary-General and in \nfollow-up to the update to the special report of 3 August 2015 of the Commissioner-\nGeneral, 4  submitted pursuant to paragraph 21 of General Assembly resolution \n302 (IV), regarding the severe financial crisis of the Agency and the negative \nimplications for the continued delivery of core Agency programmes to the Palestine \nrefugees in all fields of operation, \n \nExpressing appreciation for the efforts of donors and host countries to respond \nto the Agency\u2019s unprecedented financial crisis, including through generous, \nadditional contributions and, where possible, continued increases in voluntary \ncontributions, while acknowledging the steadfast support of all other donors to the \nAgency, \n \nNoting that contributions have not been predictable enough or sufficient to meet \ngrowing needs and remedy the persistent shortfalls, which have been exacerbated in \n2018 by the suspension of the single largest voluntary contribution to the Agency, \nundermining the Agency\u2019s operations and efforts to promote human development and \nmeet Palestine refugees\u2019 basic needs, and stressing the need for further efforts to \ncomprehensively address the recurrent funding shortfalls affecting the Agency\u2019s \noperations, \n \nRecognizing the Agency\u2019s extensive efforts to rapidly develop innovative and \ndiversified ways to address its financial shortfall and mobilize resources, including \nthrough the expansion of the donor base and partnerships with international financial \ninstitutions, the private sector and civil society, including through special initiatives \nsuch as the \u201cDignity is priceless\u201d campaign, \n \nCommending the Agency for the measures taken to address the financial crisis, \ndespite difficult operational circumstances, including through the implementation of \nthe medium-term strategy for 2016\u20132021 and various internal measures to contain \nexpenditures, reduce operational and administrative costs, maximize the use of \nresources and reduce the funding shortfalls, and expressing profound concern that, \ndespite such measures, the Agency\u2019s programme budget, which is funded primarily \nby voluntary contributions from Member States and intergovernmental organizations, \nfaces persistent shortfalls that are increasingly threatening the delivery of the \nAgency\u2019s core programmes of assistance to the Palestine refugees, \n \nEncouraging the Agency to sustain those reform efforts, while also taking all \npossible measures to protect and improve the quality of access to and the delivery of \ncore programmes of assistance, \n__________________ \n \n3  A/71/849. \n \n4  A/70/272, annex. \n\nOperations of the United Nations Relief and Works \nAgency for Palestine Refugees in the Near East \nA/RES/73/94\n \n3/10\n18-21412 \n \n \nRecalling its resolution 65/272 of 18 April 2011, in which it requested the \nSecretary-General to continue to support the institutional strengthening of the \nAgency, \n \nStressing the need to support the Agency\u2019s capacity to uphold its mandate and \nto avert the serious humanitarian, political and security risks that would result from \nany interruption or suspension of its vital work, \n \nRecognizing that the recurring and growing financial shortfalls directly affecting \nthe sustainability of the Agency\u2019s operations need to be remedied by examining new \nfunding modalities designed to put the Agency on a stable financial footing to enable \nit to effectively carry out its core programmes in accordance with its mandate and \ncommensurate with humanitarian needs, \n \nWelcoming the affirmation in the New York Declaration for Refugees and \nMigrants, adopted by the General Assembly on 19 September 2016,5 that, inter alia, \nthe Agency, along with other relevant organizations, requires sufficient funding to be \nable to carry out its activities effectively and in a predictable manner, \n \nBearing in mind the 2030 Agenda for Sustainable Development,6 including the \npledge that no one will be left behind, emphasizing that the Sustainable Development \nGoals apply to all, including refugees, and commending the efforts of the Agency\u2019s \nprogrammes to promote 10 of the 17 Goals, as indicated in the report of the Secretary-\nGeneral,3  \n \nWelcoming the joint efforts of host countries and donors to mobilize support for \nthe Agency, including through extraordinary ministerial meetings, inter alia, the \nextraordinary ministerial conference held in Rome on 15 March 2018 on the theme \n\u201cPreserving dignity and sharing responsibility: mobilizing collective action for the \nUnited Nations Relief and Works Agency for Palestine Refugees in the Near East\u201d, \nchaired by Egypt, Jordan and Sweden, and the ministerial meeting convened at United \nNations Headquarters in New York on 27 September 2018, hosted by Germany, \nJapan, Jordan, Sweden, Turkey and the European Union, aimed at urgently addressing \nthe Agency\u2019s funding shortfall and expanding donor support for the Agency, \n \nWelcoming also the decision taken by the Organization of Islamic Cooperation \nCouncil of Foreign Ministers at its forty-fifth session, held in Bangladesh in May \n2018, and reaffirmed at the seventh extraordinary session of the Islamic Summit \nConference, held in Turkey in May 2018, to establish a waqf fund to support Palestine \nrefugees through enhanced support to the Agency, \n \nRecalling Articles 100, 104 and 105 of the Charter of the United Nations and \nthe Convention on the Privileges and Immunities of the United Nations, 7 \n \nRecalling also the Convention on the Safety of United Nations and Associated \nPersonnel,8  \n \nRecalling further its resolutions 72/131 of 11 December 2017 on the safety and \nsecurity of humanitarian personnel and protection of United Nations personnel and \n72/133 of 11 December 2017 on the strengthening of the coordination of emergency \nhumanitarian assistance of the United Nations, calling upon, inter alia, all States to \nensure respect for and the protection of all humanitarian personnel and United Nations \nand associated personnel, to respect the principles of humanity, neutrality, \n__________________ \n \n5  Resolution 71/1. \n \n6  Resolution 70/1. \n \n7  Resolution 22 A (I). \n \n8  United Nations, Treaty Series, vol. 2051, No. 35457. \n\nA/RES/73/94 \nOperations of the United Nations Relief and Works\nAgency for Palestine Refugees in the Near East\n \n18-21412\n4/10 \n \nimpartiality and independence for the provision of humanitarian assistance and to \nrespect and ensure respect for the inviolability of United Nations premises, \n \nAffirming the applicability of the Geneva Convention relative to the Protection \nof Civilian Persons in Time of War, of 12 August 1949,9 to the Palestinian territory \noccupied since 1967, including East Jerusalem, \n \nAware of the continuing needs of the Palestine refugees in all fields of operation, \nnamely Jordan, Lebanon, the Syrian Arab Republic and the Occupied Palestinian \nTerritory, \n \nGravely concerned about the extremely difficult socioeconomic conditions \nbeing faced by the Palestine refugees in the Occupied Palestinian Territory, including \nEast Jerusalem, particularly in the refugee camps in the Gaza Strip, as a result of the \nrecurrent military operations, continuing prolonged Israeli closures, the construction \nof settlements and the wall, evictions, the demolition of homes and livelihood \nproperties causing forced transfers of civilians, and the severe economic and \nmovement restrictions that in effect amount to a blockade, which have deepened \nunemployment and poverty rates among the refugees, with potentially lasting, long-\nterm negative effects, while taking note of developments with regard to the situation \nof access there, \n \nDeploring the continuing and negative repercussions of the conflicts in and \naround the Gaza Strip and the high number of Palestinian causalities, including \nchildren, in the recent period, \n \nExpressing grave concern in this regard about the lasting impact on the \nhumanitarian and socioeconomic situation of the Palestine refugees in the Gaza Strip, \nincluding high rates of food insecurity, poverty, displacement and the depletion of \ncoping capacities, and taking note in this regard of the United Nations country team \nreports of 26 August 2016, entitled \u201cGaza: two years after\u201d and of July 2017, entitled \n\u201cGaza ten years later\u201d and the alarming conditions and figures documented therein, \n \nDeploring all attacks affecting United Nations installations, including Agency \nschools sheltering displaced civilians, and all other breaches of the inviolability of \nUnited Nations premises, including during the conflict in the Gaza Strip in July and \nAugust 2014, as reported in the summary by the Secretary-General of the report of \nthe Board of Inquiry10 and by the independent commission of inquiry established \npursuant to Human Rights Council resolution S-21/1,11 and stressing the imperative \nof ensuring accountability, \n \nRecalling the temporary tripartite agreement facilitated by the United Nations \nin September 2014, and stressing the urgent need for the lifting of all Israeli closures \nand restrictions on the Gaza Strip and for the reconstruction of destroyed homes and \ninfrastructure, \n \nRecalling also its resolution ES-10/18 of 16 January 2009 and Security Council \nresolution 1860 (2009) of 8 January 2009, as well as the Agreement on Movement \nand Access of 15 November 2005, \n \nCalling upon Israel to ensure the expedited and unimpeded import of all \nnecessary construction materials into the Gaza Strip and to reduce the burdensome \ncost of importation of Agency supplies, while taking note of the continued \nimplementation of the tripartite agreement facilitated by the United Nations, \n__________________ \n \n9  Ibid., vol. 75, No. 973. \n \n10  S/2015/286, annex. \n \n11  See A/HRC/29/52. \n\nOperations of the United Nations Relief and Works \nAgency for Palestine Refugees in the Near East \nA/RES/73/94\n \n5/10\n18-21412 \n \n \nExpressing concern about the continuing classroom shortage, including in the \nGaza Strip, and the consequent negative impact on the right to education of refugee \nchildren, \n \nStressing the urgent need for the advancement of reconstruction in the Gaza \nStrip, including by ensuring the timely facilitation of construction projects, including \nextensive shelter repair, and the need for the accelerated implementation of other \nurgent United Nations-led civilian reconstruction activities, \n \nWelcoming contributions made to the Agency\u2019s emergency appeals, including \nfor the Gaza Strip, and calling urgently upon the international community to continue \nits support, since needs persist and these appeals remain severely underfunded, \n \nUrging the full disbursement of pledges made at the Cairo International \nConference on Palestine: Reconstructing Gaza, held on 12 October 2014, for ensuring \nthe provision of the necessary humanitarian assistance and accelerating the \nreconstruction process, \n \nStressing that the situation in the Gaza Strip is unsustainable and that a durable \nceasefire agreement must lead to a fundamental improvement in the living conditions \nof the Palestinian people in the Gaza Strip, including through the sustained and \nregular opening of crossing points, and must ensure the safety and well-being of \ncivilians on both sides, \n \nAffirming the need to support the Palestinian national consensus Government in \nits assumption of full government responsibilities in both the West Bank and the Gaza \nStrip, in all fields, as well as through its presence at Gaza\u2019s crossing points, \n \nNoting with appreciation the significant progress made towards rebuilding the \nNahr el-Bared refugee camp, commending the Government of Lebanon, donors, the \nAgency and other parties concerned for the continuing efforts to assist affected and \ndisplaced refugees, and emphasizing the need for the funding required to complete \nthe reconstruction of the camp and end without delay the displacement from the camp \nof thousands of residents whose shelters have not been rebuilt, \n \nExpressing deep concern at the critical situation of Palestine refugees in the \nSyrian Arab Republic and at the impact of the crisis on the Agency\u2019s installations and \nits ability to deliver its services, and regretting profoundly the loss of life and \nwidespread displacement among refugees and the killing of staff members of the \nAgency in the crisis since 2012, \n \nEmphasizing the continuing need for assistance to Palestine refugees in the \nSyrian Arab Republic as well as those who have fled to neighbouring countries, and \nemphasizing the necessity of ensuring open borders for Palestine refugees fleeing the \ncrisis in the Syrian Arab Republic, consistent \nwith the principles of \nnon-discrimination and non-refoulement under international law, and recalling in this \nregard the statement by the President of the Security Council of 2 October 201312 and \nthe New York Declaration for Refugees and Migrants, \n \nAware of the valuable work done by the Agency in providing protection to the \nPalestinian people, in particular Palestine refugees, and recalling the need for the \nprotection of all civilians in situations of armed conflict, \n \nDeploring the endangerment of the safety of the Agency\u2019s staff and the damage \nand destruction caused to the facilities and properties of the Agency during the period \n__________________ \n \n12  S/PRST/2013/15; see Resolutions and Decisions of the Security Council, 1 August 2013\u201331 July \n2014 (S/INF/69). \n\nA/RES/73/94 \nOperations of the United Nations Relief and Works\nAgency for Palestine Refugees in the Near East\n \n18-21412\n6/10 \n \ncovered by the report of the Commissioner-General, and stressing the need to \nmaintain the neutrality and safeguard the inviolability of United Nations premises, \ninstallations and equipment at all times, \n \nDeploring also the breaches of the inviolability of United Nations premises, the \nfailure to accord the property and assets of the Organization immunity from any form \nof interference, incursions or misuse, the failure to protect United Nations personnel, \npremises and property and any disruption caused to Agency operations by such \nviolations, \n \nCondemning the killing, injury and detention contrary to international law of \nAgency staff members, \n \nCondemning also the killing, wounding and detention contrary to international \nlaw of refugee children and women, \n \nAffirming the need for accountability and compensation to victims of violations \nof international law in accordance with international standards by all sides, \n \nDeeply concerned about the continuing imposition of restrictions on the \nfreedom of movement and access of the Agency\u2019s staff, vehicles and goods, and the \ninjury, harassment and intimidation of the Agency\u2019s staff, which undermine and \nobstruct the work of the Agency, including its ability to provide essential basic and \nemergency services, \n \nRecalling the statement of 15 July 1999 and the declarations adopted on \n5 December 2001 and on 17 December 201413 by the Conference of High Contracting \nParties to the Fourth Geneva Convention, including the call upon parties to facilitate \nthe activities of the Agency, to guarantee its protection and to refrain from levying \ntaxes and imposing undue financial burdens, \n \nAware of the agreement between the Agency and the Government of Israel, \n \nTaking note of the agreement reached on 24 June 1994, embodied in an \nexchange of letters between the Agency and the Palestine Liberation Organization, 14 \n \n1. \nReaffirms that the effective functioning of the United Nations Relief and \nWorks Agency for Palestine Refugees in the Near East remains essential in all fields \nof operation; \n \n2. \nExpresses its appreciation to the Commissioner-General of the Agency, as \nwell as to all the staff of the Agency, for their tireless efforts and valuable work, \nparticularly in the light of the difficult conditions, instability and crises faced during \nthe past year; \n \n3. \nExpresses special commendation to the Agency for the essential role that \nit has played for almost seven decades since its establishment in providing vital \nservices for the well-being, human development and protection of the Palestine \nrefugees and the amelioration of their plight and for the stability of the region, and \naffirms the necessity for continuing the work of the Agency and its unimpeded \noperation and provision of services, pending the just resolution of the question of the \nPalestine refugees; \n \n4. \nCommends the Agency for its extraordinary efforts, in cooperation with \nother United Nations agencies on the ground, to provide emergency humanitarian \nassistance, including shelter, food and medical aid, to refugees and affected civilians \n__________________ \n \n13  A/69/711-S/2015/1, annex. \n \n14  Official Records of the General Assembly, Forty-ninth Session, Supplement No. 13 (A/49/13), \nannex I. \n\nOperations of the United Nations Relief and Works \nAgency for Palestine Refugees in the Near East \nA/RES/73/94\n \n7/10\n18-21412 \n \nduring periods of crisis and conflict, and recognizes its exemplary capacity to \nmobilize in emergency situations while continuously carrying out its core human \ndevelopment programmes; \n \n5. \nExpresses its grave concern about attempts to discredit the Agency despite \nits proven operational capacity, record of effective provision of humanitarian and \ndevelopment assistance and consistent implementation of its mandate in accordance \nwith relevant resolutions and its regulatory framework, even under the most difficult \ncircumstances; \n \n6. \nReaffirms the Agency\u2019s important role in providing humanitarian and \ndevelopment assistance to Palestine refugees, engaging with international human \nrights mechanisms, as appropriate, and in doing so contributing to the protection and \nresilience of Palestinian civilians, as outlined in the report of the Secretary-General \non the protection of the Palestinian civilian population, 15 and contributing to regional \nstability; \n \n7. \nExpresses its appreciation for the important support and cooperation \nprovided by the host Governments to the Agency in the discharge of its duties; \n \n8. \nAlso expresses its appreciation to the Advisory Commission of the \nAgency, and requests it to continue its efforts and to keep the General Assembly \ninformed of its activities; \n \n9. \nTakes note of the report of the Working Group on the Financing of the \nUnited Nations Relief and Works Agency for Palestine Refugees in the Near East 16 \nand the efforts to assist in ensuring the financial security of the Agency, and requests \nthe Secretary-General to provide the necessary services and assistance to the Working \nGroup for the conduct of its work; \n \n10. Expresses its deep appreciation to all donor countries and organizations \nthat have, inter alia, sustained, accelerated or increased their contributions to the \nAgency, helping to alleviate its unprecedented financial crisis in 2018, to mitigate \nimminent risks to its core and emergency programming and to prevent an interruption \nof essential assistance to Palestine refugees; \n \n11. \nCommends the Agency for its six-year medium-term strategy for 2016\u20132021 \nand the Commissioner-General for his continuing efforts to increase the budgetary \ntransparency and efficiency of the Agency, as reflected in the Agency\u2019s programme \nbudget for the biennium 2018\u20132019;17 \n \n12. Also commends the Agency for sustaining its robust internal reform efforts, \ndespite difficult operational circumstances, and recognizes its implementation of \nmaximum efficiency procedures to contain expenditures, reduce operational and \nadministrative costs, reduce its funding shortfalls and maximize the use of resources; \n \n13. Takes note of the report of the Secretary-General on the operations of the \nUnited Nations Relief and Works Agency for Palestine Refugees in the Near East 3 \nand the conclusions and recommendations contained therein; \n \n14. \nAppeals to States and organizations for the maintenance of their voluntary \ncontributions to the Agency, as well as an increase in contributions where possible, in \nparticular to the Agency\u2019s programme budget, including in the consideration of their \nallocation of resources for international human rights, peace and stability, development \n__________________ \n \n15  A/ES-10/794. \n \n16  A/73/349. \n \n17  Official Records of the General Assembly, Seventy-second Session, Supplement No. 13A \n(A/72/13/Add.1). \n\nA/RES/73/94 \nOperations of the United Nations Relief and Works\nAgency for Palestine Refugees in the Near East\n \n18-21412\n8/10 \n \nand humanitarian efforts, to support the Agency\u2019s mandate and its ability to meet the \nrising needs of the Palestine refugees and essential associated costs of operations; \n \n15. Appeals to States and organizations not currently contributing to the \nAgency to urgently consider making voluntary contributions in response to the calls \nof the Secretary-General for expansion of the Agency\u2019s donor base, in order to \nstabilize funding and ensure greater sharing of the financial burden of supporting the \nAgency\u2019s operations, in accordance with the continuing responsibility of the \ninternational community as a whole to assist the Palestine refugees; \n \n16. Calls for the provision by donors of early annual voluntary contributions, \nless earmarking, and multi-year funding, in line with the Grand Bargain on \nhumanitarian financing announced at the World Humanitarian Summit, held in \nIstanbul, Turkey, in May 2016, in order to enhance the Agency\u2019s ability to plan and \nimplement its operations with a greater degree of assurance regarding resource flows; \n \n17. Also calls for the full and timely funding by donors of the Agency\u2019s \nemergency, recovery and reconstruction programmes as set out in its appeals and \nresponse plans; \n \n18. Requests the Commissioner-General to continue efforts to maintain and \nincrease traditional donor support and to enhance income from non-traditional \ndonors, including through partnerships with public and private entities; \n \n19. Encourages the Agency to explore financing avenues in relation to the \nimplementation of the Sustainable Development Goals;6  \n \n20. Urges States and organizations to actively pursue partnerships with and \ninnovative support for the Agency, including as recommended in paragraphs 47, 48 \nand 50 of the report of the Secretary-General,3 including through the establishment \nof endowments, trust funds or revolving fund mechanisms and assistance to the \nAgency to access humanitarian, development and peace and security trust funds and \ngrants; \n \n21. Welcomes pledges by States and organizations to provide diplomatic and \ntechnical support to the Agency, including engagement with international and \nfinancial development institutions, including the World Bank and the Islamic \nDevelopment Bank, and, where appropriate, to facilitate support for the establishment \nof financing mechanisms that can provide assistance to refugees and in fragile \ncontexts, including to meet the needs of the Palestine refugees, and calls for serious \nfollow-up efforts; \n \n22. Encourages further progress with regard to the creation of a World Bank \nmulti-donor trust fund, as well as by the Organization of Islamic Cooperation for the \nestablishment of an Islamic Development Bank endowment fund (waqf) to support \nPalestine refugees through the Agency; \n \n23. Requests the Agency to continue to implement efficiency measures \nthrough its medium-term strategy and the development of a five-year proposal for \nstabilizing the Agency\u2019s finances, including specific and time-bound measures, and \nto continue to improve its cost efficiency and resource mobilization efforts; \n \n24. Calls upon the members of the Advisory Commission and the Working \nGroup on the Financing of the United Nations Relief and Works Agency for Palestine \nRefugees in the Near East to consider the relevant recommendations in the report of \nthe Secretary-General,3 including to help the Agency to address resource mobilization \nchallenges and to actively assist the Commissioner-General in the efforts to create \nsustainable, sufficient and predictable support for the Agency\u2019s operations; \n\nOperations of the United Nations Relief and Works \nAgency for Palestine Refugees in the Near East \nA/RES/73/94\n \n9/10\n18-21412 \n \n \n25. Takes note of the recommendations of the Secretary-General regarding the \nsupport provided to the Agency from the regular budget of the United Nations; \n \n26. Endorses the efforts of the Commissioner-General to continue to provide \nhumanitarian assistance, as far as is practicable, on an emergency basis and as a \ntemporary measure, to persons in the area who are internally displaced and in serious \nneed of continuing assistance as a result of recent crises in the Agency\u2019s fields of \noperation; \n \n27. Encourages the Agency to provide increased assistance, in accordance \nwith its mandate, to affected Palestine refugees in the Syrian Arab Republic as well \nas to those who have fled to neighbouring countries, as detailed in the Syrian regional \ncrisis response plans, and calls upon donors to urgently ensure sustained support to \nthe Agency in this regard in the light of the continuing grave deterioration of the \nsituation and the growing needs of the refugees; \n \n28. Welcomes the progress made thus far by the Agency in rebuilding the Nahr \nel-Bared refugee camp in northern Lebanon, and calls for donor funding to enable the \nexpeditious completion of its reconstruction, for the continued provision of relief \nassistance to those displaced following its destruction in 2007 and for the alleviation \nof their ongoing suffering through the provision of the necessary support and financial \nassistance until the reconstruction of the camp is complete; \n \n29. Encourages the Agency, in close cooperation with other relevant United \nNations entities, to continue to make progress in addressing the needs, rights and \nprotection of children, women and persons with disabilities in its operations, \nincluding through the provision of necessary psychosocial and humanitarian support, \nin accordance with the Convention on the Rights of the Child,18 the Convention on \nthe Elimination of All Forms of Discrimination against Women 19 and the Convention \non the Rights of Persons with Disabilities;20  \n \n30. Also encourages the Agency to continue to reduce the vulnerability and \nimprove the self-reliance and resilience of Palestine refugees through its programmes; \n \n31. Recognizes the acute protection needs of Palestine refugees across the \nregion, and encourages the Agency\u2019s efforts to contribute to a coordinated and \nsustained response in accordance with international law, including the Agency\u2019s \ndevelopment of its protection framework and function in all field offices, including \nfor child protection; \n \n32. Commends the Agency for its humanitarian and psychosocial support \nprogrammes and other initiatives that provide recreational, cultural and educational \nactivities for children in all fields, including in the Gaza Strip, recognizing their \npositive contribution, as well as the detrimental impact of the funding shortfall on \nsome emergency assistance provided by the Agency, calls for full support for such \ninitiatives by donor and host countries, and encourages the building and strengthening \nof partnerships to facilitate and enhance the provision of these services; \n \n33. Calls upon Israel, the occupying Power, to comply fully with the \nprovisions of the Geneva Convention relative to the Protection of Civilian Persons in \nTime of War, of 12 August 1949;9  \n \n34. Also calls upon Israel to abide by Articles 100, 104 and 105 of the Charter \nof the United Nations and the Convention on the Privileges and Immunities of the \nUnited Nations7 in order to ensure the safety of the personnel of the Agency, the \n__________________ \n \n18  United Nations, Treaty Series, vol. 1577, No. 27531. \n \n19  Ibid., vol. 1249, No. 20378. \n \n20  Ibid., vol. 2515, No. 44910. \n\nA/RES/73/94 \nOperations of the United Nations Relief and Works\nAgency for Palestine Refugees in the Near East\n \n18-21412\n10/10 \n \nprotection of its institutions and the safeguarding of the security of its facilities in the \nOccupied Palestinian Territory, including East Jerusalem, at all times; \n \n35. Takes note of the investigations into the incidents affecting the Agency\u2019s \nfacilities during the conflict in the Gaza Strip in July and August 2014, and calls for \nensuring accountability for all violations of international law; \n \n36. Urges the Government of Israel to expeditiously reimburse the Agency for \nall transit charges incurred and other financial losses sustained as a result of the delays \nand restrictions on movement and access imposed by Israel; \n \n37. Calls upon Israel particularly to cease obstructing the movement and \naccess of the staff, vehicles and supplies of the Agency and to cease levying taxes, \nextra fees and charges, which affect the Agency\u2019s operations detrimentally; \n \n38. Reiterates its call upon Israel to fully lift the restrictions impeding or \ndelaying the import of necessary construction materials and supplies for the \nreconstruction and repair of the remaining damaged or destroyed refugee shelters, and \nfor the implementation of suspended and urgently needed civilian infrastructure \nprojects in refugee camps in the Gaza Strip, noting the alarming figures reflected in \nthe United Nations country team reports of 26 August 2016, entitled \u201cGaza: two years \nafter\u201d and of July 2017, entitled \u201cGaza ten years later\u201d; \n \n39. Requests the Commissioner-General to proceed with the issuance of \nidentification cards for Palestine refugees and their descendants in the Occupied \nPalestinian Territory; \n \n40. Notes with appreciation the positive contribution of the Agency\u2019s \nmicrofinance and job creation programmes, encourages efforts to enhance the \nsustainability and benefits of microfinance services to a greater number of Palestine \nrefugees, especially in view of the high unemployment rates affecting them, and youth \nin particular, welcomes the Agency\u2019s efforts to streamline costs and increase \nmicrofinance services through internal reform efforts, and calls upon the Agency, in \nclose cooperation with the relevant agencies, to continue to contribute to the \ndevelopment of the economic and social stability of the Palestine refugees in all fields \nof operation; \n \n41. Reiterates its appeals to all States, the specialized agencies and \nnon-governmental organizations to continue and to augment their contributions to the \nprogramme budget of the Agency, to increase their special allocations for grants and \nscholarships for higher education to Palestine refugees and to contribute to the \nestablishment of vocational training centres for Palestine refugees, and requests the \nAgency to act as the recipient and trustee for the special allocations for grants and \nscholarships; \n \n42. Calls upon the Commissioner-General to include, in the annual reporting \nto the General Assembly, assessments on the progress made to remedy the recurrent \nfunding shortfalls of the Agency and ensure sustained, sufficient and predictable \nsupport for the Agency\u2019s operations, including through the implementation of the \nrelevant provisions of the present resolution. \n \n48th plenary meeting  \n7 December 2018 \n \n",
  "paragraphs": {
    "1": "Reaffirms that the effective functioning of the United Nations Relief and Works Agency for Palestine Refugees in the Near East remains essential in all fields of operation;",
    "2": "Expresses its appreciation to the Commissioner-General of the Agency, as well as to all the staff of the Agency, for their tireless efforts and valuable work, particularly in the light of the difficult conditions, instability and crises faced during the past year;",
    "3": "Expresses special commendation to the Agency for the essential role that it has played for almost seven decades since its establishment in providing vital services for the well-being, human development and protection of the Palestine refugees and the amelioration of their plight and for the stability of the region, and affirms the necessity for continuing the work of the Agency and its unimpeded operation and provision of services, pending the just resolution of the question of the Palestine refugees;",
    "4": "Commends the Agency for its extraordinary efforts, in cooperation with other United Nations agencies on the ground, to provide emergency humanitarian assistance, including shelter, food and medical aid, to refugees and affected civilians __________________ 13 A/69/711-S/2015/1, annex. 14 Official Records of the General Assembly, Forty-ninth Session, Supplement No. 13 (A/49/13), annex I. Operations of the United Nations Relief and Works Agency for Palestine Refugees in the Near East A/RES/73/94 7/10 18-21412 during periods of crisis and conflict, and recognizes its exemplary capacity to mobilize in emergency situations while continuously carrying out its core human development programmes;",
    "5": "Expresses its grave concern about attempts to discredit the Agency despite its proven operational capacity, record of effective provision of humanitarian and development assistance and consistent implementation of its mandate in accordance with relevant resolutions and its regulatory framework, even under the most difficult circumstances;",
    "6": "Reaffirms the Agency\u2019s important role in providing humanitarian and development assistance to Palestine refugees, engaging with international human rights mechanisms, as appropriate, and in doing so contributing to the protection and resilience of Palestinian civilians, as outlined in the report of the Secretary-General on the protection of the Palestinian civilian population, 15 and contributing to regional stability;",
    "7": "Expresses its appreciation for the important support and cooperation provided by the host Governments to the Agency in the discharge of its duties;",
    "8": "Also expresses its appreciation to the Advisory Commission of the Agency, and requests it to continue its efforts and to keep the General Assembly informed of its activities;",
    "9": "Takes note of the report of the Working Group on the Financing of the United Nations Relief and Works Agency for Palestine Refugees in the Near East 16 and the efforts to assist in ensuring the financial security of the Agency, and requests the Secretary-General to provide the necessary services and assistance to the Working Group for the conduct of its work;",
    "10": "Expresses its deep appreciation to all donor countries and organizations that have, inter alia, sustained, accelerated or increased their contributions to the Agency, helping to alleviate its unprecedented financial crisis in 2018, to mitigate imminent risks to its core and emergency programming and to prevent an interruption of essential assistance to Palestine refugees;",
    "11": "Commends the Agency for its six-year medium-term strategy for 2016\u20132021 and the Commissioner-General for his continuing efforts to increase the budgetary transparency and efficiency of the Agency, as reflected in the Agency\u2019s programme budget for the biennium 2018\u20132019;17",
    "12": "Also commends the Agency for sustaining its robust internal reform efforts, despite difficult operational circumstances, and recognizes its implementation of maximum efficiency procedures to contain expenditures, reduce operational and administrative costs, reduce its funding shortfalls and maximize the use of resources;",
    "13": "Takes note of the report of the Secretary-General on the operations of the United Nations Relief and Works Agency for Palestine Refugees in the Near East 3 and the conclusions and recommendations contained therein;",
    "14": "Appeals to States and organizations for the maintenance of their voluntary contributions to the Agency, as well as an increase in contributions where possible, in particular to the Agency\u2019s programme budget, including in the consideration of their allocation of resources for international human rights, peace and stability, development __________________ 15 A/ES-10/794. 16 A/73/349. 17 Official Records of the General Assembly, Seventy-second Session, Supplement No. 13A (A/72/13/Add.1). A/RES/73/94 Operations of the United Nations Relief and Works Agency for Palestine Refugees in the Near East 18-21412 8/10 and humanitarian efforts, to support the Agency\u2019s mandate and its ability to meet the rising needs of the Palestine refugees and essential associated costs of operations;",
    "15": "Appeals to States and organizations not currently contributing to the Agency to urgently consider making voluntary contributions in response to the calls of the Secretary-General for expansion of the Agency\u2019s donor base, in order to stabilize funding and ensure greater sharing of the financial burden of supporting the Agency\u2019s operations, in accordance with the continuing responsibility of the international community as a whole to assist the Palestine refugees;",
    "16": "Calls for the provision by donors of early annual voluntary contributions, less earmarking, and multi-year funding, in line with the Grand Bargain on humanitarian financing announced at the World Humanitarian Summit, held in Istanbul, Turkey, in May 2016, in order to enhance the Agency\u2019s ability to plan and implement its operations with a greater degree of assurance regarding resource flows;",
    "17": "Also calls for the full and timely funding by donors of the Agency\u2019s emergency, recovery and reconstruction programmes as set out in its appeals and response plans;",
    "18": "Requests the Commissioner-General to continue efforts to maintain and increase traditional donor support and to enhance income from non-traditional donors, including through partnerships with public and private entities;",
    "19": "Encourages the Agency to explore financing avenues in relation to the implementation of the Sustainable Development Goals;6",
    "20": "Urges States and organizations to actively pursue partnerships with and innovative support for the Agency, including as recommended in paragraphs 47, 48 and 50 of the report of the Secretary-General,3 including through the establishment of endowments, trust funds or revolving fund mechanisms and assistance to the Agency to access humanitarian, development and peace and security trust funds and grants;",
    "21": "Welcomes pledges by States and organizations to provide diplomatic and technical support to the Agency, including engagement with international and financial development institutions, including the World Bank and the Islamic Development Bank, and, where appropriate, to facilitate support for the establishment of financing mechanisms that can provide assistance to refugees and in fragile contexts, including to meet the needs of the Palestine refugees, and calls for serious follow-up efforts;",
    "22": "Encourages further progress with regard to the creation of a World Bank multi-donor trust fund, as well as by the Organization of Islamic Cooperation for the establishment of an Islamic Development Bank endowment fund (waqf) to support Palestine refugees through the Agency;",
    "23": "Requests the Agency to continue to implement efficiency measures through its medium-term strategy and the development of a five-year proposal for stabilizing the Agency\u2019s finances, including specific and time-bound measures, and to continue to improve its cost efficiency and resource mobilization efforts;",
    "24": "Calls upon the members of the Advisory Commission and the Working Group on the Financing of the United Nations Relief and Works Agency for Palestine Refugees in the Near East to consider the relevant recommendations in the report of the Secretary-General,3 including to help the Agency to address resource mobilization challenges and to actively assist the Commissioner-General in the efforts to create sustainable, sufficient and predictable support for the Agency\u2019s operations; Operations of the United Nations Relief and Works Agency for Palestine Refugees in the Near East A/RES/73/94 9/10 18-21412",
    "25": "Takes note of the recommendations of the Secretary-General regarding the support provided to the Agency from the regular budget of the United Nations;",
    "26": "Endorses the efforts of the Commissioner-General to continue to provide humanitarian assistance, as far as is practicable, on an emergency basis and as a temporary measure, to persons in the area who are internally displaced and in serious need of continuing assistance as a result of recent crises in the Agency\u2019s fields of operation;",
    "27": "Encourages the Agency to provide increased assistance, in accordance with its mandate, to affected Palestine refugees in the Syrian Arab Republic as well as to those who have fled to neighbouring countries, as detailed in the Syrian regional crisis response plans, and calls upon donors to urgently ensure sustained support to the Agency in this regard in the light of the continuing grave deterioration of the situation and the growing needs of the refugees;",
    "28": "Welcomes the progress made thus far by the Agency in rebuilding the Nahr el-Bared refugee camp in northern Lebanon, and calls for donor funding to enable the expeditious completion of its reconstruction, for the continued provision of relief assistance to those displaced following its destruction in 2007 and for the alleviation of their ongoing suffering through the provision of the necessary support and financial assistance until the reconstruction of the camp is complete;",
    "29": "Encourages the Agency, in close cooperation with other relevant United Nations entities, to continue to make progress in addressing the needs, rights and protection of children, women and persons with disabilities in its operations, including through the provision of necessary psychosocial and humanitarian support, in accordance with the Convention on the Rights of the Child,18 the Convention on the Elimination of All Forms of Discrimination against Women 19 and the Convention on the Rights of Persons with Disabilities;20",
    "30": "Also encourages the Agency to continue to reduce the vulnerability and improve the self-reliance and resilience of Palestine refugees through its programmes;",
    "31": "Recognizes the acute protection needs of Palestine refugees across the region, and encourages the Agency\u2019s efforts to contribute to a coordinated and sustained response in accordance with international law, including the Agency\u2019s development of its protection framework and function in all field offices, including for child protection;",
    "32": "Commends the Agency for its humanitarian and psychosocial support programmes and other initiatives that provide recreational, cultural and educational activities for children in all fields, including in the Gaza Strip, recognizing their positive contribution, as well as the detrimental impact of the funding shortfall on some emergency assistance provided by the Agency, calls for full support for such initiatives by donor and host countries, and encourages the building and strengthening of partnerships to facilitate and enhance the provision of these services;",
    "33": "Calls upon Israel, the occupying Power, to comply fully with the provisions of the Geneva Convention relative to the Protection of Civilian Persons in Time of War, of 12 August 1949;9",
    "34": "Also calls upon Israel to abide by Articles 100, 104 and 105 of the Charter of the United Nations and the Convention on the Privileges and Immunities of the United Nations7 in order to ensure the safety of the personnel of the Agency, the __________________ 18 United Nations, Treaty Series, vol. 1577, No. 27531. 19 Ibid., vol. 1249, No. 20378. 20 Ibid., vol. 2515, No. 44910. A/RES/73/94 Operations of the United Nations Relief and Works Agency for Palestine Refugees in the Near East 18-21412 10/10 protection of its institutions and the safeguarding of the security of its facilities in the Occupied Palestinian Territory, including East Jerusalem, at all times;",
    "35": "Takes note of the investigations into the incidents affecting the Agency\u2019s facilities during the conflict in the Gaza Strip in July and August 2014, and calls for ensuring accountability for all violations of international law;",
    "36": "Urges the Government of Israel to expeditiously reimburse the Agency for all transit charges incurred and other financial losses sustained as a result of the delays and restrictions on movement and access imposed by Israel;",
    "37": "Calls upon Israel particularly to cease obstructing the movement and access of the staff, vehicles and supplies of the Agency and to cease levying taxes, extra fees and charges, which affect the Agency\u2019s operations detrimentally;",
    "38": "Reiterates its call upon Israel to fully lift the restrictions impeding or delaying the import of necessary construction materials and supplies for the reconstruction and repair of the remaining damaged or destroyed refugee shelters, and for the implementation of suspended and urgently needed civilian infrastructure projects in refugee camps in the Gaza Strip, noting the alarming figures reflected in the United Nations country team reports of 26 August 2016, entitled \u201cGaza: two years after\u201d and of July 2017, entitled \u201cGaza ten years later\u201d;",
    "39": "Requests the Commissioner-General to proceed with the issuance of identification cards for Palestine refugees and their descendants in the Occupied Palestinian Territory;",
    "40": "Notes with appreciation the positive contribution of the Agency\u2019s microfinance and job creation programmes, encourages efforts to enhance the sustainability and benefits of microfinance services to a greater number of Palestine refugees, especially in view of the high unemployment rates affecting them, and youth in particular, welcomes the Agency\u2019s efforts to streamline costs and increase microfinance services through internal reform efforts, and calls upon the Agency, in close cooperation with the relevant agencies, to continue to contribute to the development of the economic and social stability of the Palestine refugees in all fields of operation;",
    "41": "Reiterates its appeals to all States, the specialized agencies and non-governmental organizations to continue and to augment their contributions to the programme budget of the Agency, to increase their special allocations for grants and scholarships for higher education to Palestine refugees and to contribute to the establishment of vocational training centres for Palestine refugees, and requests the Agency to act as the recipient and trustee for the special allocations for grants and scholarships;",
    "42": "Calls upon the Commissioner-General to include, in the annual reporting to the General Assembly, assessments on the progress made to remedy the recurrent funding shortfalls of the Agency and ensure sustained, sufficient and predictable support for the Agency\u2019s operations, including through the implementation of the relevant provisions of the present resolution. 48th plenary meeting 7 December 2018"
  },
  "agenda_items": [
    "Item 54"
  ],
  "symbol_references": []
}