{
  "symbol": "A/RES/79/264",
  "filename": "A_RES_79_264.pdf",
  "title": "79/264. Promotion of durable peace through sustainable development in Africa",
  "text": "United Nations \nA/RES/79/264\n \nGeneral Assembly \nDistr.: General \n16 January 2025 \n25-00680 (E) \n*2500680* \n \n \nSeventy-ninth session \nAgenda item 65 (b) \nFrom the New Partnership for Africa\u2019s Development to \nAgenda 2063: progress in the implementation of sustainable \ndevelopment in Africa and international support: causes of \nconflict and the promotion of durable peace and sustainable \ndevelopment in Africa \n \n \n \n \n Resolution adopted by the General Assembly \non 15 January 2025 \n \n \n[without reference to a Main Committee (A/79/L.47)] \n \n \n 79/264. Promotion of durable peace through sustainable development \nin Africa \n \n \n \nThe General Assembly, \n \nRecalling the report of the Open-ended Ad Hoc Working Group on the Causes of \nConflict and the Promotion of Durable Peace and Sustainable Development in Africa, 1 \nits resolution 53/92 of 7 December 1998 and all subsequent annual resolutions, \nincluding resolution 78/263 of 26 February 2024, as well as all its resolutions on the \nNew Partnership for Africa\u2019s Development,2 its resolution 66/293 of 17 September \n2012, by which it established a monitoring mechanism to review commitments made \ntowards Africa\u2019s development, and all resolutions and decisions regarding the \ncooperation between the United Nations and the African Union, in particular the \ncomprehensive strategic partnership between the two organizations, \n \nRecalling also the 2005 World Summit Outcome,3 through which world leaders \nreaffirmed their commitment to addressing the special needs of Africa, and its \nresolution 60/265 of 30 June 2006, \n \nReaffirming all other previous resolutions and outcome documents adopted by \nconsensus relating to the causes of conflict and the promotion of durable peace and \nsustainable development in Africa, including the Security Council resolutions on \npeace and security in Africa, on women, peace and security, on youth, peace and \nsecurity, on children and armed conflict, on the role of the Council in the prevention \n_______________ \n \n1 Official Records of the General Assembly, Fifty-sixth Session, Supplement No. 45 (A/56/45). \n \n2 A/57/304, annex. \n \n3 Resolution 60/1. \n\nA/RES/79/264 \nPromotion of durable peace through sustainable development \nin Africa\n \n25-00680\n2/11 \n \nof armed conflicts, on strengthening the effectiveness of the role of the Council in \nconflict prevention, particularly in Africa, and on threats to international peace and \nsecurity, \n \nReaffirming in particular Security Council resolution 2558 (2020) and General \nAssembly resolution 75/201 of 21 December 2020 on the review of the United \nNations peacebuilding architecture, which stressed the importance of continued \nimplementation of the resolutions on peacebuilding and sustaining peace, with \nemphasis on the impact made at the field level, \n \nEmphasizing the importance of a comprehensive approach to sustaining peace, \nparticularly through the prevention of conflict and addressing all its root causes, \nincluding by strengthening the rule of law, good governance, democracy, \naccountability, gender equality and respect for and protection of human rights and \nfundamental freedoms, as well as addressing economic and social disparities, \ncorruption, structural inequalities, border governance, illicit trade in and proliferation \nof arms, and the illegal exploitation of natural resources, in all its aspects for peace, \nsecurity and development in Africa, underlining the importance of sustainable and \ninclusive socioeconomic development for sustaining peace in Africa, through \neconomic development, including but not limited to transnational and transregional \ninfrastructure development, industrialization, poverty eradication, job creation, \nagricultural modernization and promotion of entrepreneurship, and expressing the \nneed for continued support to African countries based on their national priorities and \nneeds, \n \nReaffirming its resolution 70/1 of 25 September 2015, entitled \u201cTransforming \nour world: the 2030 Agenda for Sustainable Development\u201d, in which it adopted a \ncomprehensive, far-reaching and people-centred set of universal and transformative \nSustainable Development Goals and targets, its commitment to working tirelessly for \nthe full implementation of the Agenda by 2030, its recognition that eradicating \npoverty in all its forms and dimensions, including extreme poverty, is the greatest \nglobal challenge and an indispensable requirement for sustainable development, its \ncommitment to achieving sustainable development in its three dimensions \u2013 \neconomic, social and environmental \u2013 in a balanced and integrated manner, and to \nbuilding upon the achievements of the Millennium Development Goals and seeking \nto address their unfinished business, \n \nReaffirming also its resolution 69/313 of 27 July 2015, entitled \u201cAddis Ababa \nAction Agenda of the Third International Conference on Financing for Development \n(Addis Ababa Action Agenda)\u201d, which helps to contextualize the means of \nimplementation of the 2030 Agenda for Sustainable Development with concrete \npolicies and actions and to address the challenge of financing and creating an enabling \nenvironment at all levels for sustainable development, \n \nReaffirming further the importance of aligning international support with \nAfrica\u2019s own priorities, aimed at the implementation of the 2030 Agenda for \nSustainable Development and the African Union Agenda 2063, including but not \nlimited to industrialization, equal access to work opportunities, youth employment, \naccess to quality education and quality, reliable, sustainable and resilient \ninfrastructure, the eradication of poverty, environmentally sustainable and climate-\nresilient economies and communities, and the reduction of inequalities, \n \nWelcoming the convening of the Summit of the Future on 22-23 September 2024 \nat the United Nations Headquarters in New York at which resolution 79/1 entitled \n\u201cThe Pact for the Future\u201d and its annexes were adopted, \n \nRecognizing the capacity of the African Union and subregional organizations to \naddress the root causes of conflict in Africa, while acknowledging the need for the \n\nPromotion of durable peace through sustainable development \nin Africa \nA/RES/79/264\n \n3/11\n25-00680 \n \nprovision of support by the international community and the United Nations, taking \ninto account the responsibilities of the Organization in this regard according to the \nCharter of the United Nations, and reaffirming the primary responsibility of national \nGovernments and authorities for peacebuilding, \n \nUnderscoring the importance of continuing the efforts of the African Union and \nsubregional organizations to prevent and settle conflicts and promote human rights, \ndemocracy, the rule of law and constitutional order in Africa, while continuing to \ndevelop African capacities, including those required for the realization of sustainable \ndevelopment, particularly in countries emerging from conflict, \n \nReaffirming the commitment to ensure that there will be no tolerance for \nimpunity for genocide, war crimes and crimes against humanity or for violations of \ninternational humanitarian law and gross violations of human rights law, and that such \nviolations will be properly investigated and appropriately prosecuted and sanctioned, \nthrough national judicial mechanisms and institutions or, where appropriate, regional \nor international judicial mechanisms, and for that purpose encouraging Member States \nto strengthen national judicial systems and institutions, \n \nAcknowledging the particular challenges that infectious disease outbreaks, \nespecially the impact of the coronavirus disease (COVID\u201119) pandemic, pose in \nconflict-affected areas and their effect on health emergency and crisis management, \nas health systems in areas of conflict are often compromised and ill-equipped to deal \nwith the threat posed by infectious disease outbreaks, and strongly condemning \nviolent attacks and threats directed against medical personnel and facilities, which \nhave long-term consequences for the civilian population and the health-care systems \nof the countries concerned, as well as for the neighbouring regions, and have a \nnegative impact on sustainable development, \n \nReiterating the need to enable equitable access to quality, safe, efficacious and \naffordable COVID\u201119 diagnostics, therapeutics, medicines and vaccines for all, \nincluding the most vulnerable, in addition to support for strengthening health systems \nto ensure effective delivery, particularly in conflict-affected areas, and inviting \ncontinued, increased and accelerated provision of safe and effective vaccine doses \nfrom developed economies and all those in a position to do so to African countries in \nneed, particularly through the Access to COVID\u201119 Tools (ACT) Accelerator, the \nCOVID\u201119 Vaccine Global Access (COVAX) Facility and other relevant supplies and \nassistance as appropriate, and commends the efforts of Member States in this regard, \nwhile emphasizing the role of immunization against COVID\u201119 as a global public \ngood for health, \n \nWelcoming the work of the Peacebuilding Commission and its convening role in \nmobilizing attention and commitment to bringing a strategic approach and coherence \nto international peacebuilding efforts, and recognizing the valuable work done in \ncountry-specific, regional and thematic meetings, including the country-specific \nconfigurations of the Commission, \n \nWelcoming also the fourth edition of the Aswan Forum for Sustainable Peace \nand Development, held in July 2024 under the theme \u201cAfrica in a Changing World: \nRe-envisioning Global Governance for Peace and Development\u201d, which aimed at \ncontributing to advancing African perspectives on strengthening multilateralism and \ninternational cooperation, \n \nRenewing \nits \nunwavering \ncommitment \nto \nstrengthening \ninternational \ncooperation to prevent and combat terrorism in all its forms and manifestations and \nreaffirming that any acts of terrorism are criminal and unjustifiable, regardless of their \nmotivation, wherever, whenever and by whomsoever committed, and also recognizing \nthat any measures taken by Member States to prevent and counter terrorism, as well \n\nA/RES/79/264 \nPromotion of durable peace through sustainable development \nin Africa\n \n25-00680\n4/11 \n \nas to prevent and counter violent extremism as and when conducive to terrorism, must \nfully comply with their obligations under international law, including the Charter of \nthe United Nations, in particular the purposes and principles thereof, and relevant \ninternational conventions and protocols, including those related to international \nhuman rights law, international refugee law and international humanitarian law, \n \nEncouraging the United Nations system, the African Union and subregional \norganizations to enhance their interaction with civil society, including women\u2019s and \nyouth organizations, academia and research institutions, on issues relevant to the \npromotion of peace, security and sustainable development in Africa, and taking note \nwith appreciation of the ongoing efforts in this regard, including by the Office of the \nSpecial Adviser on Africa as well as by the Peacebuilding Commission, \n \n1. \nTakes note of the report of the Secretary-General on the promotion of \ndurable peace through sustainable development in Africa; 4 \n \n2. \nRecalls the advice submitted for the first time in 2021 by the Peacebuilding \nCommission on the item on the causes of conflict and the promotion of durable peace \nand sustainable development in Africa, as contained in the letter from the Chair of the \nCommission addressed to the President of the General Assembly, and further \nencourages the Commission to continue that good practice with a view to enhancing \ncooperation and synergies in support of addressing root causes of conflict in Africa;  \n \n3. \nAlso recalls the adoption of the African Union Agenda 2063 and its second \n10-year implementation plan (2024\u20132033), which outlines key African flagship \nprojects, fast-track programmes, priority areas, specific targets and African strategies \nand policy measures at all levels, and urges further efforts to support the \nimplementation of the second 10-year implementation plan;  \n \n4. \nFurther recalls the unanimous adoption of General Assembly resolution \n76/305 of 8 September 2022 on financing for peacebuilding, and urges all relevant \nstakeholders to ensure its operationalization so as to ensure adequate, predictable and \nsustained financing for peacebuilding, including in Africa, and in this regard notes \nthat the amount of voluntary contributions has not been sufficient to meet increasing \ndemands for the support of the Peacebuilding Fund, and affirms that other sources of \nfunding, including assessed contributions, could be used to finance the Fund through \nmodalities determined by the General Assembly as a means of achieving this \nobjective, and stresses that assessed funding is not meant to be a substitute for \nvoluntary contributions and innovative funding, and in this regard recalls the adoption \nof resolution 78/257 on 22 December 2023;  \n \n5. \nWelcomes the progress made by African countries, the African Union and \nsubregional organizations in conflict prevention, peacemaking, peacekeeping, \npeacebuilding and development, calls for intensified efforts, support and a \ncoordinated approach among national Governments, the African Union, subregional \norganizations, the United Nations system and relevant partners in addressing those \nchallenges, with a view to achieving further progress towards the goal of a conflict-\nfree Africa, and in this regard recognizes the important role played by civil society \norganizations, including women\u2019s organizations; \n \n6. \nReiterates that we are setting out together on the path towards sustainable \ndevelopment in its three dimensions \u2013 economic, social and environmental \u2013 in a \nbalanced and integrated manner, including through international cooperation and \npartnership on the basis of mutual trust and the full benefit of all, in a spirit of global \nsolidarity, and for the common future of present and coming generations, focusing on \n_______________ \n \n4 A/79/226-S/2024/550. \n\nPromotion of durable peace through sustainable development \nin Africa \nA/RES/79/264\n \n5/11\n25-00680 \n \nthe needs of African countries and the achievement of the Sustainable Development \nGoals;  \n \n7. \nRecognizes the need for African countries to make continued efforts to \ncreate enabling environments for inclusive growth in support of sustainable \ndevelopment, and calls upon the international community to enhance support and \nfulfil its commitments to take further action in areas critical to Africa\u2019s economic and \nsocial development; \n \n8. \nUnderscores the importance of adopting a comprehensive and integrated \napproach to the peace and security challenges facing the continent, and requests the \nSecretary-General to continue to promote the coordination of United Nations entities \nto support a comprehensive response to Africa\u2019s peace and development challenges;  \n \n9. \nUrges continued support for measures to address the challenges of poverty \neradication and hunger, decent job creation and sustainable development in Africa, \nincluding, as appropriate, domestic resource mobilization, debt relief, improved \nmarket access, regional integration and intra-African trade, including through the \nAfrican Continental Free Trade Area, support for the private sector and \nentrepreneurship, fulfilment of commitments on official development assistance and \nincreased flows of foreign direct investment and transfer of technology on mutually \nagreed terms;  \n \n10. Underlines the importance of strengthened support from development \npartners and the multilateral system to build and strengthen resilience, State \ninstitutions and effective governance systems, particularly in conflict-affected and \npost-conflict countries, including through scaling up financial assistance, technical \nexpertise and capacity-building; \n \n11. \nUrges Member States to commit to enhancing public health cooperation \nwith Africa, supporting Africa in strengthening and improving health systems, \nnamely, through capacity-building;  \n \n12. Recognizes the adverse effects of climate change, ecological changes and \nnatural disasters on the achievement of sustainable development in African Member \nStates, including drought, desertification, biodiversity loss, land degradation, \nflooding and food insecurity, emphasizes the importance of sustainable use of natural \nresources and the need for adequate risk assessment and risk management strategies, \nhighlights the importance of supporting efforts to strengthen the implementation of \ninitiatives aimed at enhancing resilience in Africa, in particular the Comprehensive \nAfrica Agriculture Development Programme and other initiatives launched under the \nleadership of the African Union Commission such as the Great Green Wall and the \nLand Policy Initiative and the African Union Green Recovery Action Plan, as well as \ninitiatives launched by African countries such as the Adaptation of African \nAgriculture and the Security, Stability and Sustainability initiatives, and welcomes \nthe efforts and initiatives of the African Union on addressing climate change on the \ncontinent; and in this regard welcomes the outcomes of the twenty-seventh session of \nthe Conference of the Parties to the United Nations Framework Convention on \nClimate Change (COP27), held in Sharm el-Sheikh, Egypt, in November 2022, noting \nthe launch of the Climate Responses for Sustaining Peace (CRSP) initiative by Egypt \nas President of the twenty-seventh session of the Conference of the Parties and the \nAfrican Union, as well as the twenty-eighth session of the Conference of the Parties \nto the United Nations Framework Convention on Climate Change (COP28), held in \nDubai, United Arab Emirates, in December 2023; \n \n13. Welcomes the convening of the Africa Climate Summit in Nairobi from \n4 to 6 September 2023, takes note of the African Leaders Nairobi Declaration on \n\nA/RES/79/264 \nPromotion of durable peace through sustainable development \nin Africa\n \n25-00680\n6/11 \n \nClimate Change and Call to Action, and reaffirms the importance of the provision of \nthe means of implementation to developing countries; \n \n14. Also welcomes the convening of the sixteenth meeting of the Conference \nof the Parties to the Convention on Biological Diversity, as well as the Meetings of \nthe Parties to the Protocols to the Convention, held in Cali, Colombia, from \n21 October to 1 November 2024, under the theme \u201cPeace with nature\u201d, takes note of \nits adopted decisions, looks forward to the seventeenth meeting of the Conference of \nthe Parties, and urges the early, inclusive and effective implementation of the \nKunming-Montreal Global Biodiversity Framework, \n \n15. Reaffirms the need to promote and protect effectively the human rights and \nfundamental freedoms of all migrants, regardless of their migration status, especially \nthose of women and children, and to address international migration through \ninternational, regional or bilateral cooperation, recognizing the roles and \nresponsibilities of countries of origin, transit and destination in promoting and \nprotecting the human rights of all migrants, calls for respect for the principle of \nrefugee protection in Africa and the resolution of the plight of refugees, including \nthrough support for efforts aimed at addressing the causes of refugee movement and \nbringing about the voluntary, dignified, safe and sustainable return and reintegration \nof those populations, and also calls for respect for the principle of non\u2011refoulement \nof refugees in Africa;  \n \n16. Welcomes the progress made in improving the collection and use of \ndisaggregated migration data, including through the establishment of migration data \nand knowledge centres and observatories, such as the African Migration Observatory, \nas well as the promotion of bilateral and regional exchanges and initiatives on \nmigration data;  \n \n17. Reaffirms the convening of the intergovernmental conference held on 10 and \n11 December 2018 in Marrakech, Morocco, and recalls that it adopted the Global \nCompact for Safe, Orderly and Regular Migration, also known as the Marrakech \nCompact on Migration;5 \n \n18. Notes the opportunities and challenges presented by Africa\u2019s demographic \nstructure, and stresses the importance of addressing the socioeconomic dimension of \nyouth unemployment as well as facilitating the enhanced participation of youth in \ndecision-making processes, reaffirms the important and positive contribution of youth \nto the efforts for the maintenance and promotion of peace and security and the role \nyoung people play in the prevention and resolution of conflicts, including through the \npromotion of narratives of peace, and as a key aspect of the sustainability, \ninclusiveness and success of peacekeeping and peacebuilding efforts, and further \nnotes with concern the tragic plight of children in conflict situations in Africa, in \nparticular the unlawful recruitment and use of children by parties to armed conflicts, \nsexual violence as well as other violations and abuses committed against children;  \n \n19. Recalls its resolution 78/244 of 22 December 2023, in which it endorsed \nthe report of the Committee for Programme and Coordination, 6 in which the Office of \nthe Special Adviser on Africa was requested to explore the feasibility of developing \ndeliverables and activities for the promotion of young people and ensuring their \ninclusion in the strategies of implementation of the 2030 Agenda for Sustainable \nDevelopment7 and Agenda 2063, underscores the relevance of addressing structural \ninequalities with a particular focus on women and youth by ensuring equal access to \neducation, health care, employment, participation in decision-making processes and \n_______________ \n \n5 Resolution 73/195, annex. \n \n6 Official Records of the General Assembly, Seventy-eighth Session, Supplement No. 16 (A/78/16). \n \n7 Resolution 70/1. \n\nPromotion of durable peace through sustainable development \nin Africa \nA/RES/79/264\n \n7/11\n25-00680 \n \nother development needs, highlights the need to strengthen State institutions and \ngovernance systems, including through capacity-building initiatives, technical \nassistance and financial support, and in that regard further recalls its resolution 78/252 \nof 22 December 2023, and takes note of the Secretary-General\u2019s submission in the \ncontext of the 2025 proposed programme budget of a proposal for the establishment \nof a fellowship for young Africans at United Nations Headquarters in New York to \nstrengthen institutional capacities in policy analysis, design and monitoring, under \nthe coordination of the Office of the Special Adviser on Africa; \n \n20. Expresses concern that unemployment, underemployment and lack of \ndecent work have socioeconomic implications that could serve as critical triggers for \nconflict, including exacerbating inequality, poor service delivery and weakening \nresilience, which pose threats to peace, stability and development, particularly in post-\nconflict and conflict-affected countries;  \n \n21. Expresses grave concern about the growing threat posed by terrorism and \nviolent extremism as and when conducive to terrorism to the peace, security and social \nand economic development of Africa, and calls upon the Office of Counter-Terrorism, \nthe United Nations Office on Drugs and Crime and its Terrorism Prevention Branch \nand relevant Global Counter-Terrorism Coordination Compact entities, within their \nexisting mandates, to intensify cooperation, assistance and capacity-building, for \nAfrican Member States, the African Union and African subregional organizations, \nwhile ensuring compliance with international law, and encourages the United Nations \nsystem and Member States to support the efforts on the establishment of the African \nUnion Special Fund on the Prevention and Combating of Terrorism and Violent \nExtremism in Africa, and recalls the sixteenth extraordinary African Union summit \non terrorism, held on 28 May 2022 in Equatorial Guinea, and its conclusions; \n \n22. Calls upon the Office of Counter-Terrorism and relevant Global Counter-\nTerrorism Coordination Compact entities, within their existing mandates, to intensify \ncooperation, assistance and capacity-building, for African Member States, the African \nUnion and African subregional organizations, while ensuring compliance with \ninternational law, upon their request, in preventing and combating terrorism and \npreventing and countering violent extremism as and when conducive to terrorism, \nthrough the implementation of relevant international and regional treaties and \nprotocols, and in this regard welcomes in particular African initiatives, namely the \nAfrican Union Plan of Action on the Prevention and Combating of Terrorism in \nAfrica, the African Union Counter Terrorism Centre, based in Algiers, and the \nIntergovernmental Authority on Development Centre of Excellence in Preventing and \nCountering Violent Extremism in the Horn of Africa, based in Djibouti, as well as the \nCommunity of Sahel-Saharan States Counter-Terrorism Centre, based in Cairo;  \n \n23. Recalls the establishment of regional programme offices of the Office of \nCounter-Terrorism in Africa, in Rabat, Morocco, and Nairobi, Kenya, and welcomes \ntheir efforts in this regard, further recalls that the offices have been established to \nprevent and counter violent extremism conducive to terrorism and enhance counter-\nterrorism training and capacity-building support to Member States of the region, upon \nrequest and with the consent of the relevant Member States and in coordination with \nthem, for delivery of programmes closer to the beneficiaries, and invites the Office of \nCounter-Terrorism to work in close coordination with relevant local, subregional and \nregional institutions working to counter terrorism as well as with relevant Global \nCounter-Terrorism Coordination Compact entities, and further invites relevant \ninstitutions dealing with counter-terrorism to coordinate, with the regional \nprogramme offices of the Office of Counter-Terrorism, in order to ensure updated and \ntailored training materials and programmes, while underlining the need for upholding \nthe principle of consent of the host countries in the context of all such United Nations \n\nA/RES/79/264 \nPromotion of durable peace through sustainable development \nin Africa\n \n25-00680\n8/11 \n \nfield engagements, in line with respective mandates, and in cooperation with the \nrespective host countries;  \n \n24. Also recalls the decision taken at the fourteenth extraordinary session of \nthe Assembly of Heads of State and Government of the African Union, within the \ncontext of the African Union Agenda 2063, to extend the implementation of the \nAfrican Union Master Road Map of Practical Steps for Silencing the Guns in Africa \nfor a period of 10 years (2021\u20132030), with periodic reviews every two years, and to \nextend the commemoration and conduct of Africa Amnesty Month during September \nof each year for a period of 10 years (2021\u20132030), and calls upon Member States and \nthe United Nations system, as appropriate, to intensify their support and cooperation \nwith African countries, the African Union and the African regional economic \ncommunities and relevant regional mechanisms towards the timely realization of this \ngoal;  \n \n25. Emphasizes that the illicit flow of arms, particularly small arms and light \nweapons, to rebel armed groups, terrorists and criminals contributes significantly to \ninsecurity and violence in various parts of Africa and undermines social cohesion, \npublic security, socioeconomic development and the normal functioning of State \ninstitutions, underlines the importance of promoting the implementation of relevant \ninternational instruments and strengthening law enforcement mechanisms, and in this \nregard urges Member States to take effective measures to holistically address all root \ncauses of conflicts and redouble efforts to effectively curb the illicit flow of \nconventional weapons into and within Africa, including by taking the necessary steps \nat the national level to implement the Programme of Action to Prevent, Combat and \nEradicate the Illicit Trade in Small Arms and Light Weapons in All Its Aspects; 8 \n \n26. Stresses the critical importance of a regional approach to conflict \nprevention, including early action to address rising conflict risk and emerging violent \nconflict and, in particular with respect to cross-border issues such as transnational \norganized crime, drug trafficking, disarmament, demobilization, repatriation, \nresettlement and reintegration programmes, the prevention and combating of illegal \nexploitation of and trafficking in natural resources and high-value commodities and \nthe illicit trade in small arms and light weapons in all its aspects, and emphasizes in \nthis regard the central role of national Governments, the African Union and \nsubregional organizations in addressing such issues, and welcomes the role of the \nAfrican Union Mechanism for Police Cooperation (AFRIPOL), based in Algeria, in \nfighting the organized crimes in Africa;  \n \n27. Notes that in some armed conflict situations, the illicit exploitation, \ntrafficking and trade in natural resources has contributed to the outbreak, escalation \nor continuation of such conflicts, and calls for the implementation of resolutions \nadopted on this issue to support the prevention of the illegal exploitation of natural \nresources;  \n \n28. Expresses concern over the threat of piracy and armed robbery at sea in \nthe Gulf of Guinea to security and economic activities in the region and the continent \nat large, in this regard recalls the adoption of Security Council resolution 2634 (2022) \nof 31 May 2022 on maritime security in the Gulf of Guinea, and commends the \ncountries of the Gulf of Guinea region and regional bodies, including the Economic \nCommunity of Central African States, the Economic Community of West African \nStates and the Gulf of Guinea Commission, for the collective efforts undertaken to \naddress and prevent piracy, including the steady decline in the incidence of piracy and \narmed robbery in the region, armed robbery at sea and other maritime crimes, and \n_______________ \n \n8 Report of the United Nations Conference on the Illicit Trade in Small Arms and Light Weapons in \nAll Its Aspects, New York, 9\u201320 July 2001 (A/CONF.192/15), chap. IV, para. 24. \n\nPromotion of durable peace through sustainable development \nin Africa \nA/RES/79/264\n \n9/11\n25-00680 \n \ncalls for enhanced international and regional cooperation to address these threats to \nmaritime safety and security in the Gulf of Guinea;  \n \n29. Underscores the critical role of regional instruments in tackling maritime \ninsecurity on the continent of Africa, and notes that the commemoration of the tenth \nanniversary of the Yaound\u00e9 Architecture provides the opportunity to address gaps in \nits implementation in order to make it more responsive;  \n \n30. Welcomes the ongoing efforts of the African Union and subregional \norganizations to strengthen their capacity in peacekeeping operations on the \ncontinent, in accordance with Chapter VIII of the Charter of the United Nations and \nin close coordination with the United Nations, through the Peace and Security Council \nof the African Union, and in this regard recalls the Cairo Road Map on Enhancing \nPeacekeeping Operations: From Mandate to Exit that was endorsed by the Peace and \nSecurity Council of the African Union as an African contribution to advance United \nNations peacekeeping reform efforts related to the Secretary-General\u2019s Action for \nPeacekeeping initiative, and further welcomes language from the communiqu\u00e9 as well \nas the ongoing efforts to develop a continental early warning system, strengthen the \nreadiness of the African Standby Force and enhance mediation capacity and \npreventive diplomacy, including through the Panel of the Wise; \n \n31. Reaffirms the importance of African Union-led peace support operations \nin the maintenance of international and regional peace and security, underscores the \nimportance of enhancing the operational and institutional capacity to effectively \ndischarge their respective mandates, emphasizes the need to ensure access to \nadequate, predictable and sustainable financing of African Union-led peace support \noperations, and in this regard recalls the adoption of Security Council resolution 2719 \n(2023) of 21 December 2023 on a framework for African Union-led peace support \noperations; \n \n32. Recalls the United Nations Peacekeeping Ministerial Meeting, held in \nAccra, Ghana, on 5 and 6 December 2023, and that the Ministerial, which was the \nfirst to be held on the continent of Africa, provided an opportunity for participants to \nshare insights on innovative ways to make modern-day peacekeeping operations more \neffective and responsive to the security challenges of our time, including the \ndeteriorating security situation in some parts of Africa and globally;  \n \n33. Recognizes the role of the Peacebuilding Commission in ensuring that \nnational ownership of the peacebuilding process in countries under consideration is \nobserved and that nationally identified priorities are at the core of international and \nregional efforts in peacebuilding and sustaining peace in the countries under \nconsideration, welcomes the bridging role of the Commission as a dedicated \nintergovernmental advisory body to bring together all the relevant actors in the United \nNations system as well as international and financial institutions, representatives of \nnational Governments, representatives of civil society and regional and subregional \norganizations consistent with its mandate to promote a strategic approach and \ncoherence in international peacebuilding efforts, calls upon the Peacebuilding \nCommission to further enhance its relationship with regional and subregional \norganizations in Africa, welcomes the Peacebuilding Fund\u2019s engagement, as a timely, \ncatalytic and risk-tolerant instrument for enhancing the impact and coherence of \nUnited Nations peacebuilding support, including with respect to cross-border \ninitiatives that recognize the complex dynamics and regional impacts of conflicts in \nareas such as the Sahel, and calls upon the entirety of the United Nations system to \ndevelop cross-border initiatives that are coherent with one another (including funding \nfrom international financial institutions) and address underlying causes of regional \ntensions and conflict;  \n\nA/RES/79/264 \nPromotion of durable peace through sustainable development \nin Africa\n \n25-00680\n10/11 \n \n \n34. Recalls decision Assembly/AU/Dec.729(XXXII) of 11 February 2019 of \nthe Assembly of Heads of State and Government of the African Union on revitalizing \nand operationalizing the African Union Policy on Post-Conflict Reconstruction and \nDevelopment, while aligning it with the evolving international discourse on \npeacebuilding and sustaining peace and the actual needs of countries emerging from \nconflict in Africa, and calls upon the United Nations system and Member States to \nsupport the peace consolidation mechanisms and processes, including the African \nPeace and Security Architecture, the African Governance Architecture, the African \nUnion Post-Conflict Reconstruction and Development Framework and the African \nUnion Centre for Post-Conflict Reconstruction and Development, in order to fully \ncontribute to conflict prevention, peacemaking initiatives, peacebuilding and post-\nconflict reconstruction;  \n \n35. Notes with concern that sexual violence in conflict continues and may \nincrease even as armed conflicts draw to an end, notes the adoption by the General \nAssembly and the Security Council of relevant resolutions, including Council \nresolution 2467 (2019) of 23 April 2019, urges further progress in the implementation \nof policies and guidelines relating to the protection of and assistance to victims and \nsurvivors of sexual violence in conflict and post-conflict situations in Africa, \nincluding more systematic monitoring and reporting, and encourages the entities that \ncompose United Nations Action against Sexual Violence in Conflict, as well as other \nrelevant parts of the United Nations system, to assist the Office of the Special \nRepresentative of the Secretary-General on Sexual Violence in Conflict in the \nimplementation of its mandate, including in Africa;  \n \n36. Reiterates the calls for the full, equal, meaningful and safe participation of \nwomen in conflict prevention and resolution, and peacebuilding, consistent with \nSecurity Council resolution 1325 (2000) of 31 October 2000 and subsequent Security \nCouncil resolutions on women and peace and security, recalls the ongoing efforts of \nAfrican countries and the African Union, including the work of the African Union \nSpecial Envoy on Women, Peace and Security, to ensure the protection of the rights \nof women and girls in conflict and post-conflict situations, also recalls the adoption \nand entry into force of the Protocol to the African Charter on Human and Peoples\u2019 \nRights on the Rights of Women in Africa, as well as all other relevant instruments for \nstrengthening the role of women in peace and conflict on the continent, and further \nwelcomes in this regard the adoption of national action plans on women, peace and \nsecurity by several African countries and the various initiatives of the African Union, \nand urges the provision of adequate international support for the implementation of \nthese plans;  \n \n37. Recognizes the important contribution of the African Peer Review \nMechanism since its inception in improving governance and supporting \nsocioeconomic development in African countries, takes note of the decision adopted \nby the Assembly of Heads of State and Government of the African Union in January \n2017 on the revitalization of the African Peer Review Mechanism, expanding the \nmonitoring and evaluation mandate of the Mechanism, invites the United Nations \nsystem and Member States to provide voluntary substantial financial and capacity-\nbuilding support to the revitalization of the Mechanism and to advance its activities; \n \n38. Recalls the commitment of the African leaders to Africa\u2019s political, social \nand economic integration agenda and to the ideal of pan-Africanism and African \nrenaissance, as well as their effort to achieve the goal of a conflict-free Africa as \naffirmed in the solemn declaration adopted on 26 May 2013 on the occasion of the \nfiftieth anniversary of the Organization of African Unity/African Union, expresses its \nreadiness to contribute, and calls upon all, in particular relevant United Nations entities, \nto help to achieve this goal through enhanced collaboration with African Union \n\nPromotion of durable peace through sustainable development \nin Africa \nA/RES/79/264\n \n11/11\n25-00680 \n \ninstitutions, regional economic communities and regional mechanisms in accordance \nwith their respective mandates;  \n \n39. Also recalls the launching by the African Union Commission and United \nNations Development Programme, of the Africa Facility to Support Inclusive \nTransitions, on the sidelines of the fifth African Union mid-year coordination \nmeeting, held in Nairobi on 15 July 2023;  \n \n40. Calls upon the United Nations system, Member States, and bilateral and \nmultilateral partners to deliver expeditiously on their commitments and to support the \nfull and speedy implementation of the provisions of the political declaration on \nAfrica\u2019s development needs,9 the 2030 Agenda and the African Union Agenda 2063, \nrecognizing the relevance of leveraging new transformative technologies to advance \nsustainable development on the continent and bridge the digital divide that is \nundermining African countries\u2019 development efforts;  \n \n41. Welcomes the convening of the seventh and eighth United Nations-African \nUnion annual conferences at the level of the Secretary-General and the Chairperson \nof the African Union Commission, held at United Nations Headquarters on \n28 November 2023 and in Addis Ababa on 21 October 2024, recalls the adoption of \nits resolution 71/254 of 23 December 2016 on the Framework for a Renewed United \nNations-African Union Partnership on Africa\u2019s Integration and Development Agenda \n2017\u20132027, and reaffirms the commitment to continue to deepen the strategic \npartnership between the United Nations and the African Union in addressing peace \nand security, sustainable development and human rights and implementing the 2030 \nAgenda and Agenda 2063 in Africa; \n \n42. Decides to include the sub-item entitled \u201cCauses of conflict and the \npromotion of durable peace and sustainable development in Africa\u201d under the item \nentitled \u201cFrom the New Partnership for Africa\u2019s Development to Agenda 2063: \nprogress in the implementation of sustainable development in Africa and international \nsupport\u201d in the provisional agenda for consideration and decision during the main part \nof its eightieth session, and requests the Secretary-General to continue to monitor and \nreport, by September 2025, to the General Assembly, and thereafter on an annual \nbasis, on persistent and emerging challenges to the promotion of durable peace and \nsustainable development in Africa, including the root causes of conflict and \nconditions to promote sustainable development, as well as on the approach and \nsupport of the United Nations system. \n \n56th (resumed) plenary meeting \n15 January 2025 \n \n_______________ \n \n9 Resolution 63/1. \n",
  "paragraphs": {
    "1": "Takes note of the report of the Secretary-General on the promotion of durable peace through sustainable development in Africa; 4",
    "2": "Recalls the advice submitted for the first time in 2021 by the Peacebuilding Commission on the item on the causes of conflict and the promotion of durable peace and sustainable development in Africa, as contained in the letter from the Chair of the Commission addressed to the President of the General Assembly, and further encourages the Commission to continue that good practice with a view to enhancing cooperation and synergies in support of addressing root causes of conflict in Africa;",
    "3": "Also recalls the adoption of the African Union Agenda 2063 and its second 10-year implementation plan (2024\u20132033), which outlines key African flagship projects, fast-track programmes, priority areas, specific targets and African strategies and policy measures at all levels, and urges further efforts to support the implementation of the second 10-year implementation plan;",
    "4": "Further recalls the unanimous adoption of General Assembly resolution 76/305 of 8 September 2022 on financing for peacebuilding, and urges all relevant stakeholders to ensure its operationalization so as to ensure adequate, predictable and sustained financing for peacebuilding, including in Africa, and in this regard notes that the amount of voluntary contributions has not been sufficient to meet increasing demands for the support of the Peacebuilding Fund, and affirms that other sources of funding, including assessed contributions, could be used to finance the Fund through modalities determined by the General Assembly as a means of achieving this objective, and stresses that assessed funding is not meant to be a substitute for voluntary contributions and innovative funding, and in this regard recalls the adoption of resolution 78/257 on 22 December 2023;",
    "5": "Welcomes the progress made by African countries, the African Union and subregional organizations in conflict prevention, peacemaking, peacekeeping, peacebuilding and development, calls for intensified efforts, support and a coordinated approach among national Governments, the African Union, subregional organizations, the United Nations system and relevant partners in addressing those challenges, with a view to achieving further progress towards the goal of a conflict- free Africa, and in this regard recognizes the important role played by civil society organizations, including women\u2019s organizations;",
    "6": "Reiterates that we are setting out together on the path towards sustainable development in its three dimensions \u2013 economic, social and environmental \u2013 in a balanced and integrated manner, including through international cooperation and partnership on the basis of mutual trust and the full benefit of all, in a spirit of global solidarity, and for the common future of present and coming generations, focusing on _______________ 4 A/79/226-S/2024/550. Promotion of durable peace through sustainable development in Africa A/RES/79/264 5/11 25-00680 the needs of African countries and the achievement of the Sustainable Development Goals;",
    "7": "Recognizes the need for African countries to make continued efforts to create enabling environments for inclusive growth in support of sustainable development, and calls upon the international community to enhance support and fulfil its commitments to take further action in areas critical to Africa\u2019s economic and social development;",
    "8": "Underscores the importance of adopting a comprehensive and integrated approach to the peace and security challenges facing the continent, and requests the Secretary-General to continue to promote the coordination of United Nations entities to support a comprehensive response to Africa\u2019s peace and development challenges;",
    "9": "Urges continued support for measures to address the challenges of poverty eradication and hunger, decent job creation and sustainable development in Africa, including, as appropriate, domestic resource mobilization, debt relief, improved market access, regional integration and intra-African trade, including through the African Continental Free Trade Area, support for the private sector and entrepreneurship, fulfilment of commitments on official development assistance and increased flows of foreign direct investment and transfer of technology on mutually agreed terms;",
    "10": "Underlines the importance of strengthened support from development partners and the multilateral system to build and strengthen resilience, State institutions and effective governance systems, particularly in conflict-affected and post-conflict countries, including through scaling up financial assistance, technical expertise and capacity-building;",
    "11": "Urges Member States to commit to enhancing public health cooperation with Africa, supporting Africa in strengthening and improving health systems, namely, through capacity-building;",
    "12": "Recognizes the adverse effects of climate change, ecological changes and natural disasters on the achievement of sustainable development in African Member States, including drought, desertification, biodiversity loss, land degradation, flooding and food insecurity, emphasizes the importance of sustainable use of natural resources and the need for adequate risk assessment and risk management strategies, highlights the importance of supporting efforts to strengthen the implementation of initiatives aimed at enhancing resilience in Africa, in particular the Comprehensive Africa Agriculture Development Programme and other initiatives launched under the leadership of the African Union Commission such as the Great Green Wall and the Land Policy Initiative and the African Union Green Recovery Action Plan, as well as initiatives launched by African countries such as the Adaptation of African Agriculture and the Security, Stability and Sustainability initiatives, and welcomes the efforts and initiatives of the African Union on addressing climate change on the continent; and in this regard welcomes the outcomes of the twenty-seventh session of the Conference of the Parties to the United Nations Framework Convention on Climate Change (COP27), held in Sharm el-Sheikh, Egypt, in November 2022, noting the launch of the Climate Responses for Sustaining Peace (CRSP) initiative by Egypt as President of the twenty-seventh session of the Conference of the Parties and the African Union, as well as the twenty-eighth session of the Conference of the Parties to the United Nations Framework Convention on Climate Change (COP28), held in Dubai, United Arab Emirates, in December 2023;",
    "13": "Welcomes the convening of the Africa Climate Summit in Nairobi from 4 to 6 September 2023, takes note of the African Leaders Nairobi Declaration on A/RES/79/264 Promotion of durable peace through sustainable development in Africa 25-00680 6/11 Climate Change and Call to Action, and reaffirms the importance of the provision of the means of implementation to developing countries;",
    "14": "Also welcomes the convening of the sixteenth meeting of the Conference of the Parties to the Convention on Biological Diversity, as well as the Meetings of the Parties to the Protocols to the Convention, held in Cali, Colombia, from 21 October to 1 November 2024, under the theme \u201cPeace with nature\u201d, takes note of its adopted decisions, looks forward to the seventeenth meeting of the Conference of the Parties, and urges the early, inclusive and effective implementation of the Kunming-Montreal Global Biodiversity Framework,",
    "15": "Reaffirms the need to promote and protect effectively the human rights and fundamental freedoms of all migrants, regardless of their migration status, especially those of women and children, and to address international migration through international, regional or bilateral cooperation, recognizing the roles and responsibilities of countries of origin, transit and destination in promoting and protecting the human rights of all migrants, calls for respect for the principle of refugee protection in Africa and the resolution of the plight of refugees, including through support for efforts aimed at addressing the causes of refugee movement and bringing about the voluntary, dignified, safe and sustainable return and reintegration of those populations, and also calls for respect for the principle of non\u2011refoulement of refugees in Africa;",
    "16": "Welcomes the progress made in improving the collection and use of disaggregated migration data, including through the establishment of migration data and knowledge centres and observatories, such as the African Migration Observatory, as well as the promotion of bilateral and regional exchanges and initiatives on migration data;",
    "17": "Reaffirms the convening of the intergovernmental conference held on 10 and 11 December 2018 in Marrakech, Morocco, and recalls that it adopted the Global Compact for Safe, Orderly and Regular Migration, also known as the Marrakech Compact on Migration;5",
    "18": "Notes the opportunities and challenges presented by Africa\u2019s demographic structure, and stresses the importance of addressing the socioeconomic dimension of youth unemployment as well as facilitating the enhanced participation of youth in decision-making processes, reaffirms the important and positive contribution of youth to the efforts for the maintenance and promotion of peace and security and the role young people play in the prevention and resolution of conflicts, including through the promotion of narratives of peace, and as a key aspect of the sustainability, inclusiveness and success of peacekeeping and peacebuilding efforts, and further notes with concern the tragic plight of children in conflict situations in Africa, in particular the unlawful recruitment and use of children by parties to armed conflicts, sexual violence as well as other violations and abuses committed against children;",
    "19": "Recalls its resolution 78/244 of 22 December 2023, in which it endorsed the report of the Committee for Programme and Coordination, 6 in which the Office of the Special Adviser on Africa was requested to explore the feasibility of developing deliverables and activities for the promotion of young people and ensuring their inclusion in the strategies of implementation of the 2030 Agenda for Sustainable Development7 and Agenda 2063, underscores the relevance of addressing structural inequalities with a particular focus on women and youth by ensuring equal access to education, health care, employment, participation in decision-making processes and _______________ 5 Resolution 73/195, annex. 6 Official Records of the General Assembly, Seventy-eighth Session, Supplement No. 16 (A/78/16). 7 Resolution 70/1. Promotion of durable peace through sustainable development in Africa A/RES/79/264 7/11 25-00680 other development needs, highlights the need to strengthen State institutions and governance systems, including through capacity-building initiatives, technical assistance and financial support, and in that regard further recalls its resolution 78/252 of 22 December 2023, and takes note of the Secretary-General\u2019s submission in the context of the 2025 proposed programme budget of a proposal for the establishment of a fellowship for young Africans at United Nations Headquarters in New York to strengthen institutional capacities in policy analysis, design and monitoring, under the coordination of the Office of the Special Adviser on Africa;",
    "20": "Expresses concern that unemployment, underemployment and lack of decent work have socioeconomic implications that could serve as critical triggers for conflict, including exacerbating inequality, poor service delivery and weakening resilience, which pose threats to peace, stability and development, particularly in post- conflict and conflict-affected countries;",
    "21": "Expresses grave concern about the growing threat posed by terrorism and violent extremism as and when conducive to terrorism to the peace, security and social and economic development of Africa, and calls upon the Office of Counter-Terrorism, the United Nations Office on Drugs and Crime and its Terrorism Prevention Branch and relevant Global Counter-Terrorism Coordination Compact entities, within their existing mandates, to intensify cooperation, assistance and capacity-building, for African Member States, the African Union and African subregional organizations, while ensuring compliance with international law, and encourages the United Nations system and Member States to support the efforts on the establishment of the African Union Special Fund on the Prevention and Combating of Terrorism and Violent Extremism in Africa, and recalls the sixteenth extraordinary African Union summit on terrorism, held on 28 May 2022 in Equatorial Guinea, and its conclusions;",
    "22": "Calls upon the Office of Counter-Terrorism and relevant Global Counter- Terrorism Coordination Compact entities, within their existing mandates, to intensify cooperation, assistance and capacity-building, for African Member States, the African Union and African subregional organizations, while ensuring compliance with international law, upon their request, in preventing and combating terrorism and preventing and countering violent extremism as and when conducive to terrorism, through the implementation of relevant international and regional treaties and protocols, and in this regard welcomes in particular African initiatives, namely the African Union Plan of Action on the Prevention and Combating of Terrorism in Africa, the African Union Counter Terrorism Centre, based in Algiers, and the Intergovernmental Authority on Development Centre of Excellence in Preventing and Countering Violent Extremism in the Horn of Africa, based in Djibouti, as well as the Community of Sahel-Saharan States Counter-Terrorism Centre, based in Cairo;",
    "23": "Recalls the establishment of regional programme offices of the Office of Counter-Terrorism in Africa, in Rabat, Morocco, and Nairobi, Kenya, and welcomes their efforts in this regard, further recalls that the offices have been established to prevent and counter violent extremism conducive to terrorism and enhance counter- terrorism training and capacity-building support to Member States of the region, upon request and with the consent of the relevant Member States and in coordination with them, for delivery of programmes closer to the beneficiaries, and invites the Office of Counter-Terrorism to work in close coordination with relevant local, subregional and regional institutions working to counter terrorism as well as with relevant Global Counter-Terrorism Coordination Compact entities, and further invites relevant institutions dealing with counter-terrorism to coordinate, with the regional programme offices of the Office of Counter-Terrorism, in order to ensure updated and tailored training materials and programmes, while underlining the need for upholding the principle of consent of the host countries in the context of all such United Nations A/RES/79/264 Promotion of durable peace through sustainable development in Africa 25-00680 8/11 field engagements, in line with respective mandates, and in cooperation with the respective host countries;",
    "24": "Also recalls the decision taken at the fourteenth extraordinary session of the Assembly of Heads of State and Government of the African Union, within the context of the African Union Agenda 2063, to extend the implementation of the African Union Master Road Map of Practical Steps for Silencing the Guns in Africa for a period of 10 years (2021\u20132030), with periodic reviews every two years, and to extend the commemoration and conduct of Africa Amnesty Month during September of each year for a period of 10 years (2021\u20132030), and calls upon Member States and the United Nations system, as appropriate, to intensify their support and cooperation with African countries, the African Union and the African regional economic communities and relevant regional mechanisms towards the timely realization of this goal;",
    "25": "Emphasizes that the illicit flow of arms, particularly small arms and light weapons, to rebel armed groups, terrorists and criminals contributes significantly to insecurity and violence in various parts of Africa and undermines social cohesion, public security, socioeconomic development and the normal functioning of State institutions, underlines the importance of promoting the implementation of relevant international instruments and strengthening law enforcement mechanisms, and in this regard urges Member States to take effective measures to holistically address all root causes of conflicts and redouble efforts to effectively curb the illicit flow of conventional weapons into and within Africa, including by taking the necessary steps at the national level to implement the Programme of Action to Prevent, Combat and Eradicate the Illicit Trade in Small Arms and Light Weapons in All Its Aspects; 8",
    "26": "Stresses the critical importance of a regional approach to conflict prevention, including early action to address rising conflict risk and emerging violent conflict and, in particular with respect to cross-border issues such as transnational organized crime, drug trafficking, disarmament, demobilization, repatriation, resettlement and reintegration programmes, the prevention and combating of illegal exploitation of and trafficking in natural resources and high-value commodities and the illicit trade in small arms and light weapons in all its aspects, and emphasizes in this regard the central role of national Governments, the African Union and subregional organizations in addressing such issues, and welcomes the role of the African Union Mechanism for Police Cooperation (AFRIPOL), based in Algeria, in fighting the organized crimes in Africa;",
    "27": "Notes that in some armed conflict situations, the illicit exploitation, trafficking and trade in natural resources has contributed to the outbreak, escalation or continuation of such conflicts, and calls for the implementation of resolutions adopted on this issue to support the prevention of the illegal exploitation of natural resources;",
    "28": "Expresses concern over the threat of piracy and armed robbery at sea in the Gulf of Guinea to security and economic activities in the region and the continent at large, in this regard recalls the adoption of Security Council resolution 2634 (2022) of 31 May 2022 on maritime security in the Gulf of Guinea, and commends the countries of the Gulf of Guinea region and regional bodies, including the Economic Community of Central African States, the Economic Community of West African States and the Gulf of Guinea Commission, for the collective efforts undertaken to address and prevent piracy, including the steady decline in the incidence of piracy and armed robbery in the region, armed robbery at sea and other maritime crimes, and _______________ 8 Report of the United Nations Conference on the Illicit Trade in Small Arms and Light Weapons in All Its Aspects, New York, 9\u201320 July 2001 (A/CONF.192/15), chap. IV, para. 24. Promotion of durable peace through sustainable development in Africa A/RES/79/264 9/11 25-00680 calls for enhanced international and regional cooperation to address these threats to maritime safety and security in the Gulf of Guinea;",
    "29": "Underscores the critical role of regional instruments in tackling maritime insecurity on the continent of Africa, and notes that the commemoration of the tenth anniversary of the Yaound\u00e9 Architecture provides the opportunity to address gaps in its implementation in order to make it more responsive;",
    "30": "Welcomes the ongoing efforts of the African Union and subregional organizations to strengthen their capacity in peacekeeping operations on the continent, in accordance with Chapter VIII of the Charter of the United Nations and in close coordination with the United Nations, through the Peace and Security Council of the African Union, and in this regard recalls the Cairo Road Map on Enhancing Peacekeeping Operations: From Mandate to Exit that was endorsed by the Peace and Security Council of the African Union as an African contribution to advance United Nations peacekeeping reform efforts related to the Secretary-General\u2019s Action for Peacekeeping initiative, and further welcomes language from the communiqu\u00e9 as well as the ongoing efforts to develop a continental early warning system, strengthen the readiness of the African Standby Force and enhance mediation capacity and preventive diplomacy, including through the Panel of the Wise;",
    "31": "Reaffirms the importance of African Union-led peace support operations in the maintenance of international and regional peace and security, underscores the importance of enhancing the operational and institutional capacity to effectively discharge their respective mandates, emphasizes the need to ensure access to adequate, predictable and sustainable financing of African Union-led peace support operations, and in this regard recalls the adoption of Security Council resolution 2719 (2023) of 21 December 2023 on a framework for African Union-led peace support operations;",
    "32": "Recalls the United Nations Peacekeeping Ministerial Meeting, held in Accra, Ghana, on 5 and 6 December 2023, and that the Ministerial, which was the first to be held on the continent of Africa, provided an opportunity for participants to share insights on innovative ways to make modern-day peacekeeping operations more effective and responsive to the security challenges of our time, including the deteriorating security situation in some parts of Africa and globally;",
    "33": "Recognizes the role of the Peacebuilding Commission in ensuring that national ownership of the peacebuilding process in countries under consideration is observed and that nationally identified priorities are at the core of international and regional efforts in peacebuilding and sustaining peace in the countries under consideration, welcomes the bridging role of the Commission as a dedicated intergovernmental advisory body to bring together all the relevant actors in the United Nations system as well as international and financial institutions, representatives of national Governments, representatives of civil society and regional and subregional organizations consistent with its mandate to promote a strategic approach and coherence in international peacebuilding efforts, calls upon the Peacebuilding Commission to further enhance its relationship with regional and subregional organizations in Africa, welcomes the Peacebuilding Fund\u2019s engagement, as a timely, catalytic and risk-tolerant instrument for enhancing the impact and coherence of United Nations peacebuilding support, including with respect to cross-border initiatives that recognize the complex dynamics and regional impacts of conflicts in areas such as the Sahel, and calls upon the entirety of the United Nations system to develop cross-border initiatives that are coherent with one another (including funding from international financial institutions) and address underlying causes of regional tensions and conflict; A/RES/79/264 Promotion of durable peace through sustainable development in Africa 25-00680 10/11",
    "34": "Recalls decision Assembly/AU/Dec.729(XXXII) of 11 February 2019 of the Assembly of Heads of State and Government of the African Union on revitalizing and operationalizing the African Union Policy on Post-Conflict Reconstruction and Development, while aligning it with the evolving international discourse on peacebuilding and sustaining peace and the actual needs of countries emerging from conflict in Africa, and calls upon the United Nations system and Member States to support the peace consolidation mechanisms and processes, including the African Peace and Security Architecture, the African Governance Architecture, the African Union Post-Conflict Reconstruction and Development Framework and the African Union Centre for Post-Conflict Reconstruction and Development, in order to fully contribute to conflict prevention, peacemaking initiatives, peacebuilding and post- conflict reconstruction;",
    "35": "Notes with concern that sexual violence in conflict continues and may increase even as armed conflicts draw to an end, notes the adoption by the General Assembly and the Security Council of relevant resolutions, including Council resolution 2467 (2019) of 23 April 2019, urges further progress in the implementation of policies and guidelines relating to the protection of and assistance to victims and survivors of sexual violence in conflict and post-conflict situations in Africa, including more systematic monitoring and reporting, and encourages the entities that compose United Nations Action against Sexual Violence in Conflict, as well as other relevant parts of the United Nations system, to assist the Office of the Special Representative of the Secretary-General on Sexual Violence in Conflict in the implementation of its mandate, including in Africa;",
    "36": "Reiterates the calls for the full, equal, meaningful and safe participation of women in conflict prevention and resolution, and peacebuilding, consistent with Security Council resolution 1325 (2000) of 31 October 2000 and subsequent Security Council resolutions on women and peace and security, recalls the ongoing efforts of African countries and the African Union, including the work of the African Union Special Envoy on Women, Peace and Security, to ensure the protection of the rights of women and girls in conflict and post-conflict situations, also recalls the adoption and entry into force of the Protocol to the African Charter on Human and Peoples\u2019 Rights on the Rights of Women in Africa, as well as all other relevant instruments for strengthening the role of women in peace and conflict on the continent, and further welcomes in this regard the adoption of national action plans on women, peace and security by several African countries and the various initiatives of the African Union, and urges the provision of adequate international support for the implementation of these plans;",
    "37": "Recognizes the important contribution of the African Peer Review Mechanism since its inception in improving governance and supporting socioeconomic development in African countries, takes note of the decision adopted by the Assembly of Heads of State and Government of the African Union in January 2017 on the revitalization of the African Peer Review Mechanism, expanding the monitoring and evaluation mandate of the Mechanism, invites the United Nations system and Member States to provide voluntary substantial financial and capacity- building support to the revitalization of the Mechanism and to advance its activities;",
    "38": "Recalls the commitment of the African leaders to Africa\u2019s political, social and economic integration agenda and to the ideal of pan-Africanism and African renaissance, as well as their effort to achieve the goal of a conflict-free Africa as affirmed in the solemn declaration adopted on 26 May 2013 on the occasion of the fiftieth anniversary of the Organization of African Unity/African Union, expresses its readiness to contribute, and calls upon all, in particular relevant United Nations entities, to help to achieve this goal through enhanced collaboration with African Union Promotion of durable peace through sustainable development in Africa A/RES/79/264 11/11 25-00680 institutions, regional economic communities and regional mechanisms in accordance with their respective mandates;",
    "39": "Also recalls the launching by the African Union Commission and United Nations Development Programme, of the Africa Facility to Support Inclusive Transitions, on the sidelines of the fifth African Union mid-year coordination meeting, held in Nairobi on 15 July 2023;",
    "40": "Calls upon the United Nations system, Member States, and bilateral and multilateral partners to deliver expeditiously on their commitments and to support the full and speedy implementation of the provisions of the political declaration on Africa\u2019s development needs,9 the 2030 Agenda and the African Union Agenda 2063, recognizing the relevance of leveraging new transformative technologies to advance sustainable development on the continent and bridge the digital divide that is undermining African countries\u2019 development efforts;",
    "41": "Welcomes the convening of the seventh and eighth United Nations-African Union annual conferences at the level of the Secretary-General and the Chairperson of the African Union Commission, held at United Nations Headquarters on 28 November 2023 and in Addis Ababa on 21 October 2024, recalls the adoption of its resolution 71/254 of 23 December 2016 on the Framework for a Renewed United Nations-African Union Partnership on Africa\u2019s Integration and Development Agenda 2017\u20132027, and reaffirms the commitment to continue to deepen the strategic partnership between the United Nations and the African Union in addressing peace and security, sustainable development and human rights and implementing the 2030 Agenda and Agenda 2063 in Africa;",
    "42": "Decides to include the sub-item entitled \u201cCauses of conflict and the promotion of durable peace and sustainable development in Africa\u201d under the item entitled \u201cFrom the New Partnership for Africa\u2019s Development to Agenda 2063: progress in the implementation of sustainable development in Africa and international support\u201d in the provisional agenda for consideration and decision during the main part of its eightieth session, and requests the Secretary-General to continue to monitor and report, by September 2025, to the General Assembly, and thereafter on an annual basis, on persistent and emerging challenges to the promotion of durable peace and sustainable development in Africa, including the root causes of conflict and conditions to promote sustainable development, as well as on the approach and support of the United Nations system. 56th (resumed) plenary meeting 15 January 2025 _______________ 9 Resolution 63/1."
  },
  "agenda_items": [
    "Item 65"
  ],
  "symbol_references": [
    "A/79/L.47"
  ]
}