{
  "symbol": "A/RES/79/332",
  "filename": "A_RES_79_332.pdf",
  "title": "79/332. Cooperation between the United Nations and the Shanghai Cooperation Organization",
  "text": "United Nations \nA/RES/79/332 \n \nGeneral Assembly \nDistr.: General \n8 September 2025 \n25-14350 (E) \n*2514350* \n \n \nSeventy-ninth session \nAgenda item 125 (s) \nCooperation between the United Nations and regional and \nother organizations: cooperation between the United Nations \nand the Shanghai Cooperation Organization \n \n \n \n \n Resolution adopted by the General Assembly \non 5 September 2025 \n \n \n[without reference to a Main Committee (A/79/L.124)] \n \n \n 79/332. Cooperation between the United Nations and the Shanghai \nCooperation Organization \n \n \n \nThe General Assembly, \n \nRecalling that one of the objectives of the United Nations is to achieve \ncooperation in maintaining international peace and security and solving international \nproblems of an economic, social, cultural or humanitarian character, \n \nRecalling also the Articles of the Charter of the United Nations that encourage \nactivities on the basis of regional cooperation to promote the goals and objectives of \nthe United Nations, \n \nRecalling further its resolution 59/48 of 2 December 2004, by which it granted \nobserver status to the Shanghai Cooperation Organization, \n \nRecalling its resolutions 64/183 of 18 December 2009, 65/124 of 13 December \n2010, 67/15 of 19 November 2012, 69/11 of 11 November 2014, 71/14 of \n21 November 2016, 73/334 of 30 August 2019, 75/268 of 25 March 2021 and 77/338 \nof 1 September 2023 on cooperation between the United Nations and the Shanghai \nCooperation Organization, \n \nRecalling also the Joint Declaration on Cooperation between the Secretariats of \nthe United Nations and the Shanghai Cooperation Organization, dated 5 April 2010, \n \nNoting that the Shanghai Cooperation Organization is committed to act \nconsistently with the purposes and principles of the Charter of the United Nations,  \n \nNoting also that the Shanghai Cooperation Organization has become an essential \nregional organization for addressing security in the region in all its dimensions, \nincluding in cooperation with relevant regional organizations, \n\nA/RES/79/332 \nCooperation between the United Nations and the Shanghai \nCooperation Organization\n \n25-14350\n2/5 \n \n \nRecognizing that interaction within the Shanghai Cooperation Organization can \nserve as a basis for forming an equal and indivisible security architecture in Eurasia, \nas affirmed in the Astana Declaration of the Council of Heads of State of the Shanghai \nCooperation Organization of 4 July 2024,  \n \nTaking into account the commitment of the States members of the Shanghai \nCooperation Organization to pursue the implementation of the goals outlined in the \n2030 Agenda for Sustainable Development, 1  and welcoming the decision of the \nShanghai Cooperation Organization to designate 2025 as the Year of Sustainable \nDevelopment, \n \nRecalling the commitment of the States members of the Shanghai Cooperation \nOrganization to achieve a pacific settlement of regional disputes under Chapter VIII \nof the Charter of the United Nations, \n \nRecognizing the efforts of the States members of the Shanghai Cooperation \nOrganization, upholding the \u201cShanghai spirit\u201d, to build the region of the Shanghai \nCooperation Organization into a region of lasting peace, friendship, prosperity and \nharmony, in accordance with the Treaty on Long-term Good-neighbourliness, \nFriendship and Cooperation among the States members of the Shanghai Cooperation \nOrganization,2 \n \nRecalling that, in its resolution 77/338, it noted the aspiration of the States \nmembers of the Shanghai Cooperation Organization to promote stability and the \nmaintenance of international peace and security, and noting in this regard the meetings \nof the Council of Heads of State of the Shanghai Cooperation Organization, including \nthe twenty-fourth meeting, held in Astana, Kazakhstan, on 4 July 2024, \n \nWelcoming the series of events held by the States members of the Shanghai \nCooperation Organization to commemorate the eightieth anniversary of the founding \nof the United Nations and the eightieth anniversary of the victory of the Second World \nWar, \n \nWelcoming also the commitment of States Party to the Treaty on the \nNon\u2011Proliferation of Nuclear Weapons 3 that are States members of the Shanghai \nCooperation Organization to comply fully with the Treaty, including in Central Asia, \nwhile reaffirming the inalienable right of States Party to the Treaty to develop \nresearch, production and use of nuclear energy for peaceful purposes without \ndiscrimination and in conformity with articles I and II of the Treaty, \n \nRecognizing the efforts of the States members of the Shanghai Cooperation \nOrganization to promote counter-terrorism cooperation, including through the \nRegional Anti-Terrorist Structure, and welcoming in this regard the protocol on \ncooperation between the Regional Anti-Terrorist Structure of the Shanghai \nCooperation Organization and the United Nations Office on Drugs and Crime, signed \non 22 July 2012, noting the cooperation between the Regional Anti-Terrorist Structure \nof the Shanghai Cooperation Organization and the Office of Counter-Terrorism, \nincluding the United Nations Counter-Terrorism Centre, in implementing the United \nNations Global Counter-Terrorism Strategy, 4  and the cooperation between the \nRegional Anti-Terrorist Structure of the Shanghai Cooperation Organization and the \nCounter-Terrorism Committee Executive Directorate, and noting the Memorandum of \nUnderstanding on cooperation between these two entities signed on 25 March 2019, \n_______________ \n \n1 Resolution 70/1. \n \n2 United Nations, Treaty Series, vol. 2896, No. 50518. \n \n3 Ibid., vol. 729, No. 10485. \n \n4 Resolution 60/288. \n\nCooperation between the United Nations and the Shanghai \nCooperation Organization \nA/RES/79/332\n \n3/5\n25-14350 \n \n \nRecognizing also the role of the Shanghai Cooperation Organization in \ncombating drugs, based on the outcome of the thirtieth special session of the General \nAssembly on the world drug problem, held in New York from 19 to 21 April 2016,5 \nand encouraging the Shanghai Cooperation Organization to continue such cooperation \nin this field, \n \nRecalling the signing of the Memorandum of Understanding between the \nsecretariat of the Shanghai Cooperation Organization and the United Nations Office \non Drugs and Crime in June 2011 with a view to effectively addressing, in cooperation \nwith relevant international and regional actors, the production of and trade and \ntrafficking in drugs, and welcoming the further cooperation of the Shanghai \nCooperation Organization and the Office, \n \nNoting the improved quality of the dynamics of cooperation among the States \nmembers of the Shanghai Cooperation Organization, as well as the further \nenhancement of the potential and role of the Shanghai Cooperation Organization in \nthe international arena as a multilateral mechanism, and in this regard welcoming the \nconvening of the meetings of the Council of Heads of State of the Shanghai \nCooperation Organization, including the twenty-first meeting, held in Dushanbe on \n16 and 17 September 2021, the twenty-second meeting, held in Samarkand on 15 and \n16 September 2022, the twenty-third meeting, held under the chairmanship of India \non 4 July 2023 in video format, and the first meeting held in the Shanghai Cooperation \nOrganization Plus format in Astana on 4 July 2024, \n \nTaking note of the initiatives of the Shanghai Cooperation Organization, as well \nas the efforts of others, to address security of and in the use of information and \ncommunications technologies, and recognizing the need for further discussions in \nrelevant forums, \n \nAcknowledging the role of initiatives at the regional level in supporting \nsustainable development and the need to foster an open, fair and inclusive \nenvironment for development and cooperation worldwide, and in this regard recalling \nthe initiative \u201cOn World Unity for a Just Peace, Harmony and Development\u201d, 6 \nintroduced by Kazakhstan during its chairmanship at the Shanghai Cooperation \nOrganization Plus summit, held in Astana on 4 July 2024, and endorsed by a decision \nof the Council of Heads of State of the Shanghai Cooperation Organization, which \nthe Shanghai Cooperation Organization members recognized as an important \ncontribution to global efforts to advance the formation of a more representative, \ndemocratic, just and multipolar world order based on the purposes and principles of \nthe Charter of the United Nations and international law, with the central coordinating \nrole of the United Nations, and which advocates ensuring equal opportunities for the \ndevelopment of all States regardless of their geographical location, territorial size, \ndemographic, military and resource potential, and political, economic and social \nstructure,  \n \nNoting the signing of the Memorandum of Understanding between the \nsecretariat of the Shanghai Cooperation Organization and the secretariat of the United \nNations Economic and Social Commission for Asia and the Pacific in September 2022 \naimed at enhancing cooperation in trade, transport, energy, and information and \ncommunications technology connectivity, \n \nWelcoming the signing of the Memorandum of Understanding on cooperation \nbetween the secretariat of the Shanghai Cooperation Organization and the United \nNations Educational, Scientific and Cultural Organization in September 2022 with the \n_______________ \n \n5 Resolution S-30/1, annex. \n \n6 See A/79/807-S/2025/132. \n\nA/RES/79/332 \nCooperation between the United Nations and the Shanghai \nCooperation Organization\n \n25-14350\n4/5 \n \ngoal of strengthening peace, sustainable development and intercultural dialogue by \nmeans of developing cooperation in education, science, culture, communication and \ninformation, \n \nWelcoming also the signing in February 2024 of the Memorandum of \nUnderstanding between the secretariat of the Shanghai Cooperation Organization and \nthe United Nations Environment Programme to develop collaboration on the \npreservation of biological diversity, adaptation to climate change and the mitigation \nof its consequences, the reduction of environmental pollution and the development of \necological tourism, \n \nWelcoming further the renewal in October 2024 of the Memorandum of \nUnderstanding between the secretariat of the Shanghai Cooperation Organization and \nthe Food and Agriculture Organization of the United Nations to continue cooperation \non sustainable rural development, ensuring food security, and digital agriculture, \n \nNoting the decision adopted on 4 July 2024 in Astana by the Council of Heads \nof State of the Shanghai Cooperation Organization to grant Belarus the status of a \nState member of the Shanghai Cooperation Organization, \n \nRecognizing the efforts of the Shanghai Cooperation Organization to promote \ncooperation with other regional organizations, including the Collective Security \nTreaty Organization, the Commonwealth of Independent States, the Association of \nSoutheast Asian Nations, the Conference on Interaction and Confidence-building \nMeasures in Asia, the Economic Cooperation Organization, the Eurasian Economic \nUnion7 and the League of Arab States,8 as well as with the International Committee \nof the Red Cross, \n \nTaking into consideration the fact that countries with economies in transition \nare among the members of the Shanghai Cooperation Organization, and in this regard \nrecalling its resolution 61/210 of 20 December 2006, in which it proposed that the \nUnited Nations system enhance dialogue with regional and subregional cooperation \norganizations whose membership includes countries with economies in transition and \nincrease support provided to them, \n \nConvinced that strengthening cooperation between the United Nations and other \norganizations of the United Nations system and the Shanghai Cooperation \nOrganization helps to promote the goals and objectives of the United Nations, \n \nWelcoming the final settlement of the territorial and State border issues achieved \nby Kyrgyzstan and Uzbekistan and by Kyrgyzstan and Tajikistan, in full compliance \nwith the norms of international law and the Charter of the United Nations and in the \ninterests of maintenance of regional peace, stability and security, and recognizing the \nparticular significance of the signed treaty as a valuable contribution to peace, \nsecurity and stability within the Shanghai Cooperation Organization\u2019s space,  \n \nWelcoming also the Shanghai Cooperation Organization Tianjin Summit, held \non 31 August and 1 September 2025 under the chairmanship of China, and the Tianjin \nDeclaration of the Council of Heads of State of the Shanghai Cooperation \nOrganization, \n \nWelcoming further the assumption of the chairmanship by Kyrgyzstan for the \n2025\u20132026 term, \n_______________ \n \n7 The Memorandum of Understanding between the secretariat of the Shanghai Cooperation \nOrganization and the Eurasian Economic Commission was signed in Dushanbe on 17 September \n2021. \n \n8 The Memorandum of Understanding between the secretariat of the Shanghai Cooperation \nOrganization and the League of Arab States was signed in Samarkand on 16 September 2022. \n\nCooperation between the United Nations and the Shanghai \nCooperation Organization \nA/RES/79/332\n \n5/5\n25-14350 \n \n \n1. \nAcknowledges the constructive role of the Shanghai Cooperation \nOrganization in securing peace and sustainable development, advancing regional \ncooperation and strengthening good-neighbourliness and mutual trust, and notes the \nactivities of the Shanghai Cooperation Organization aimed at strengthening peace, \nsecurity and stability in the region, countering terrorism, drug trafficking and other \ntypes of criminal activity of a transnational character and promoting regional \ncooperation in various areas such as trade and economic development, energy, \ntransportation, agriculture and agro-industry, the regulation of migration, banking and \nfinances, information and telecommunications, science and new technology, start-ups \nand innovation, the digital economy, customs, education, public health, traditional \nmedicine, environmental protection and reducing the danger of natural disasters, as \nwell as in other related areas; \n \n2. \nEmphasizes the importance of strengthening dialogue, cooperation and \ncoordination between the United Nations system and the Shanghai Cooperation \nOrganization, and proposes that the Secretary-General, for this purpose, continue to \nhold regular consultations with the Secretary-General of the Shanghai Cooperation \nOrganization through the existing inter-agency forums and formats, including the \nhigh-level interactive dialogue of the Secretary-General of the United Nations with \nthe heads of the regional organizations and other organizations; \n \n3. \nProposes that the specialized agencies, organizations, programmes and \nfunds of the United Nations system cooperate with the Shanghai Cooperation \nOrganization with a view to jointly implementing programmes to achieve their goals, \nand in this regard recommends that the heads of such entities continue consultations \nwith the Secretary-General of the United Nations; \n \n4. \nRequests the Secretary-General to submit to the General Assembly at its \neighty-first session a report on the implementation of the present resolution; \n \n5. \nDecides to include in the provisional agenda of its eighty-first session, \nunder the item entitled \u201cCooperation between the United Nations and regional and \nother organizations\u201d, the sub-item entitled \u201cCooperation between the United Nations \nand the Shanghai Cooperation Organization\u201d. \n \n95th plenary meeting \n5 September 2025 \n \n",
  "paragraphs": {
    "2021": "8 The Memorandum of Understanding between the secretariat of the Shanghai Cooperation Organization and the League of Arab States was signed in Samarkand on 16 September 2022. Cooperation between the United Nations and the Shanghai Cooperation Organization A/RES/79/332 5/5 25-14350",
    "1": "Acknowledges the constructive role of the Shanghai Cooperation Organization in securing peace and sustainable development, advancing regional cooperation and strengthening good-neighbourliness and mutual trust, and notes the activities of the Shanghai Cooperation Organization aimed at strengthening peace, security and stability in the region, countering terrorism, drug trafficking and other types of criminal activity of a transnational character and promoting regional cooperation in various areas such as trade and economic development, energy, transportation, agriculture and agro-industry, the regulation of migration, banking and finances, information and telecommunications, science and new technology, start-ups and innovation, the digital economy, customs, education, public health, traditional medicine, environmental protection and reducing the danger of natural disasters, as well as in other related areas;",
    "2": "Emphasizes the importance of strengthening dialogue, cooperation and coordination between the United Nations system and the Shanghai Cooperation Organization, and proposes that the Secretary-General, for this purpose, continue to hold regular consultations with the Secretary-General of the Shanghai Cooperation Organization through the existing inter-agency forums and formats, including the high-level interactive dialogue of the Secretary-General of the United Nations with the heads of the regional organizations and other organizations;",
    "3": "Proposes that the specialized agencies, organizations, programmes and funds of the United Nations system cooperate with the Shanghai Cooperation Organization with a view to jointly implementing programmes to achieve their goals, and in this regard recommends that the heads of such entities continue consultations with the Secretary-General of the United Nations;",
    "4": "Requests the Secretary-General to submit to the General Assembly at its eighty-first session a report on the implementation of the present resolution;",
    "5": "Decides to include in the provisional agenda of its eighty-first session, under the item entitled \u201cCooperation between the United Nations and regional and other organizations\u201d, the sub-item entitled \u201cCooperation between the United Nations and the Shanghai Cooperation Organization\u201d. 95th plenary meeting 5 September 2025"
  },
  "agenda_items": [
    "Item 125"
  ],
  "symbol_references": [
    "A/79/L.124"
  ]
}