{
  "symbol": "A/RES/73/313",
  "filename": "A_RES_73_313.pdf",
  "title": "73/313. Financing of the United Nations Operation in C\u00f4te d\u2019Ivoire",
  "text": "United Nations \nA/RES/73/313\n \n \nGeneral Assembly \nDistr.: General \n16 July 2019 \n \n19-11309 (E)    180719   \n*1911309* \n \n \nSeventy-third session \nAgenda item 153 \n \n \n \n \n Resolution adopted by the General Assembly on 3 July 2019 \n \n \n \n \n[on the report of the Fifth Committee (A/73/921)] \n \n \n 73/313. Financing of the United Nations Operation in C\u00f4te d\u2019Ivoire  \n \n \n \nThe General Assembly, \n \nHaving considered the report of the Secretary-General on the financing of the \nUnited Nations Operation in C\u00f4te d\u2019Ivoire1 and the related report of the Advisory \nCommittee on Administrative and Budgetary Questions,2 \n \nRecalling Security Council resolution 1528 (2004) of 27 February 2004, by \nwhich the Council decided to establish the United Nations Operation in C\u00f4te d\u2019Ivoire \nfor an initial period of 12 months as from 4 April 2004, and the subsequent resolutions \nby which the Council extended the mandate of the Operation, the latest of which was \nresolution 2284 (2016) of 28 April 2016, by which the Council extended the mandate \nof the Operation for a final period until 30 June 2017, \n \nRecalling also its resolution 58/310 of 18 June 2004 on the financing of the \nOperation and its subsequent resolutions thereon, the latest of which was resolution \n72/291 of 5 July 2018, as well as its decision 72/558 of 5 July 2018, \n \nReaffirming the general principles underlying the financing of United Nations \npeacekeeping operations, as stated in its resolutions 1874 (S-IV) of 27 June 1963, \n3101 (XXVIII) of 11 December 1973 and 55/235 of 23 December 2000, \n \n1. \nTakes note of the status of contributions to the United Nations Operation \nin C\u00f4te d\u2019Ivoire as at 30 April 2019, including the contributions outstanding in the \namount of 9.7 million United States dollars, representing some 0.2 per cent of the \ntotal assessed contributions, notes with concern that only 162 Member States have \npaid their assessed contributions in full, and urges all other Member States, in \nparticular those in arrears, to ensure payment of their outstanding assessed \ncontributions; \n__________________ \n \n1 A/73/707. \n \n2 A/73/854. \n\nA/RES/73/313 \nFinancing of the United Nations Operation in C\u00f4te d\u2019Ivoire\n \n19-11309\n2/2 \n \n \n2. \nExpresses its appreciation to those Member States that have paid their \nassessed contributions in full, and urges all other Member States to make every \npossible effort to ensure payment of their assessed contributions to the Operation \nin full; \n \n3. \nEndorses the conclusions and recommendations contained in the report of \nthe Advisory Committee on Administrative and Budgetary Questions, 2 and requests \nthe Secretary-General to ensure their full implementation; \n \n4. \nEncourages the Secretary-General to continue to draw on lessons learned \nand best practices for future drawdowns and closures; \n \n5. \nReiterates its request to the Secretary-General to closely analyse the level \nof personnel required to successfully draw down and liquidate a closing mission, \ndrawing on lessons learned during the liquidation of the Operation, and identify \nhuman resources strategies that facilitate the retention of expertise from already \nonboarded staff, including national staff, until the end of the liquidation period; \n \n6. \nRecalls paragraph 5 of the report of the Advisory Committee, and requests \nthe Secretary-General to include in future performance reports and reports on the \ndisposal of assets disaggregated information for assets disposed of before and after \nthe beginning of the liquidation period; \n \n7. \nAlso recalls paragraph 7 of the report of the Advisory Committee, and in \nthis regard requests the Secretary-General in future mission liquidation plans to \ninclude a risk assessment, mitigation measures and, in the case of theft, appropriate \nsteps to recover stolen assets, and to ensure that the relevant staff and financial \nregulations and rules are applied in any future cases of loss or theft of assets; \n \n \n \nFinal disposition of the assets of the United Nations Operation in C\u00f4te d\u2019Ivoire \n \n \n8. \nTakes note of the report of the Secretary-General on the final disposition \nof the assets of the United Nations Operation in C\u00f4te d\u2019Ivoire;1 \n \n9. \nDecides to include in the provisional agenda of its seventy-fourth session \nthe item entitled \u201cFinancing of the United Nations Operation in C\u00f4te d\u2019Ivoire\u201d. \n \n97th plenary meeting \n3 July 2019 \n \n",
  "paragraphs": {
    "1": "Takes note of the status of contributions to the United Nations Operation in C\u00f4te d\u2019Ivoire as at 30 April 2019, including the contributions outstanding in the amount of 9.7 million United States dollars, representing some 0.2 per cent of the total assessed contributions, notes with concern that only 162 Member States have paid their assessed contributions in full, and urges all other Member States, in particular those in arrears, to ensure payment of their outstanding assessed contributions; __________________ 1 A/73/707. 2 A/73/854. A/RES/73/313 Financing of the United Nations Operation in C\u00f4te d\u2019Ivoire 19-11309 2/2",
    "2": "Expresses its appreciation to those Member States that have paid their assessed contributions in full, and urges all other Member States to make every possible effort to ensure payment of their assessed contributions to the Operation in full;",
    "3": "Endorses the conclusions and recommendations contained in the report of the Advisory Committee on Administrative and Budgetary Questions, 2 and requests the Secretary-General to ensure their full implementation;",
    "4": "Encourages the Secretary-General to continue to draw on lessons learned and best practices for future drawdowns and closures;",
    "5": "Reiterates its request to the Secretary-General to closely analyse the level of personnel required to successfully draw down and liquidate a closing mission, drawing on lessons learned during the liquidation of the Operation, and identify human resources strategies that facilitate the retention of expertise from already onboarded staff, including national staff, until the end of the liquidation period;",
    "6": "Recalls paragraph 5 of the report of the Advisory Committee, and requests the Secretary-General to include in future performance reports and reports on the disposal of assets disaggregated information for assets disposed of before and after the beginning of the liquidation period;",
    "7": "Also recalls paragraph 7 of the report of the Advisory Committee, and in this regard requests the Secretary-General in future mission liquidation plans to include a risk assessment, mitigation measures and, in the case of theft, appropriate steps to recover stolen assets, and to ensure that the relevant staff and financial regulations and rules are applied in any future cases of loss or theft of assets; Final disposition of the assets of the United Nations Operation in C\u00f4te d\u2019Ivoire",
    "8": "Takes note of the report of the Secretary-General on the final disposition of the assets of the United Nations Operation in C\u00f4te d\u2019Ivoire;1",
    "9": "Decides to include in the provisional agenda of its seventy-fourth session the item entitled \u201cFinancing of the United Nations Operation in C\u00f4te d\u2019Ivoire\u201d. 97th plenary meeting 3 July 2019"
  },
  "agenda_items": [
    "Item 153"
  ],
  "symbol_references": []
}