{
  "symbol": "A/RES/72/296",
  "filename": "A_RES_72_296.pdf",
  "title": "72/296. Financing of the United Nations Mission in Liberia",
  "text": "United Nations \nA/RES/72/296\n \n \nGeneral Assembly \nDistr.: General \n19 July 2018 \n \n18-11313 (E)    200718  \n*1811313* \n \n \nSeventy-second session \nAgenda item 158 \n \n \n \n \n Resolution adopted by the General Assembly on 5 July 2018 \n \n \n \n \n[on the report of the Fifth Committee (A/72/914)] \n \n \n 72/296. Financing of the United Nations Mission in Liberia  \n \n \n \nThe General Assembly, \n \nHaving considered the report of the Secretary-General on the financing of the \nUnited Nations Mission in Liberia1 and the related report of the Advisory Committee \non Administrative and Budgetary Questions,2  \n \nRecalling Security Council resolution 1497 (2003) of 1 August 2003, by which \nthe Council declared its readiness to establish a United Nations stabilization force to \nsupport the transitional government and to assist in the implementation of a \ncomprehensive peace agreement in Liberia,  \n \nRecalling also Security Council resolution 1509 (2003) of 19 September 2003, \nby which the Council established the United Nations Mission in Liberia for a period \nof 12 months, and the subsequent resolutions by which the Council extended the \nmandate of the Mission, the latest of which was resolution 2333 (2016) of \n23 December 2016, by which the Council extended the mandate of the Mission for a \nfinal period until 30 March 2018 and requested the Secretary-General to complete by \n30 April 2018 the withdrawal of all uniformed and civilian components, other than \nthose required to complete the liquidation of the Mission,  \n \nRecalling further its resolution 58/315 of 1 July 2004,  \n \nRecalling its resolution 58/261 A of 23 December 2003 on the financing of the \nMission and its subsequent resolutions thereon, the latest of which was resolution \n71/304 of 30 June 2017,  \n \nReaffirming the general principles underlying the financing of United Nations \npeacekeeping operations, as stated in its resolutions 1874 (S-IV) of 27 June 1963, \n3101 (XXVIII) of 11 December 1973 and 55/235 of 23 December 2000,  \n__________________ \n \n1  A/72/640 and A/72/640/Corr.1. \n \n2  A/72/839. \n\nA/RES/72/296 \nFinancing of the United Nations Mission in Liberia\n \n18-11313\n2/3 \n \n \nNoting with appreciation that voluntary contributions have been made to the \nMission,  \n \nMindful of the fact that it is essential to provide the Mission with the financial \nresources necessary to enable it to fulfil its responsibilities under the relevant \nresolutions of the Security Council,  \n \n1. \nTakes note of the status of contributions to the United Nations Mission in \nLiberia as at 30 April 2018, including the contributions outstanding in the amount of \n22.7 million United States dollars, representing some 0.3 per cent of the total assessed \ncontributions, notes with concern that only 99 Member States have paid their assessed \ncontributions in full, and urges all other Member States, in particular those in arrears, \nto ensure payment of their outstanding assessed contributions;  \n \n2. \nExpresses its appreciation to those Member States that have paid their \nassessed contributions in full, and urges all other Member States to make every \npossible effort to ensure payment of their assessed contributions to the Mission in full; \n \n3. \nExpresses concern at the financial situation with regard to peacekeeping \nactivities, in particular as regards the reimbursements to troop contributors that bear \nadditional burdens owing to overdue payments by Member States of their \nassessments;  \n \n4. \nEmphasizes that all future and existing peacekeeping missions shall be \ngiven equal and non-discriminatory treatment in respect of financial and \nadministrative arrangements;  \n \n5. \nAlso emphasizes that all peacekeeping missions shall be provided with \nadequate resources for the effective and efficient discharge of their respective \nmandates;  \n \n6. \nRequests the Secretary-General to ensure that proposed peacekeeping \nbudgets are based on the relevant legislative mandates;  \n \n7. \nEndorses the conclusions and recommendations contained in the report of \nthe Advisory Committee on Administrative and Budgetary Questions, 2 and requests \nthe Secretary-General to ensure their full implementation;  \n \n8. \nStresses the importance of applicable payments due to a staff member at \nthe time of separation from service during the transitional period, taking into account \nthe special situation of national staff, and in this regard requests the Secretary-General \nto ensure a timely treatment to all staff; \n \n9. \nEncourages the Secretary-General to identify potential outstanding \ncommitments at least nine months before the physical closure of a mission in future \npre-liquidation processes;  \n \n10. Requests the Secretary-General to continue his efforts to identify and \naddress on time and in full all the residual activities, including unforeseen liabilities \nidentified after the closure of the Mission;  \n \n11. \nAlso requests the Secretary-General to rigorously pursue and complete the \nliquidation of assets, as planned, in accordance with regulation 5.14 of the Financial \nRegulations and Rules of the United Nations,3 including engaging with the authorities \nregarding potential donations and taking account of lessons learned, and to report \nthereon in the context of the final performance report;  \n \n12. Notes with concern the significant amount of contaminated soil collected \nduring the liquidation of the Mission, and in this regard requests the Secretary-\nGeneral to continue to reduce the long-term overall environmental footprint of the \n__________________ \n \n3  ST/SGB/2013/4. \n\nFinancing of the United Nations Mission in Liberia \nA/RES/72/296\n \n3/3\n18-11313 \n \nMission in full compliance with the relevant rules and regulations, including but not \nlimited to the United Nations environmental and waste management policy and \nprocedures;  \n \n13. Requests the Secretary-General to ensure the full implementation of the \nrelevant provisions of its resolutions 59/296 of 22 June 2005, 60/266 of 30 June 2006, \n61/276 of 29 June 2007, 64/269 of 24 June 2010, 65/289 of 30 June 2011, 66/264 of \n21 June 2012, 69/307 of 25 June 2015 and 70/286 of 17 June 2016, as well as other \nrelevant resolutions;  \n \n14. Also requests the Secretary-General to take all action necessary to ensure \nthat the Mission is administered with a maximum of efficiency and economy;  \n \n \n \nBudget performance report for the period from 1 July 2016 to 30 June 2017  \n \n \n15. Takes note of the report of the Secretary-General on the budget \nperformance of the Mission for the period from 1 July 2016 to 30 June 2017;1  \n \n16. Decides that Member States that have fulfilled their financial obligations \nto the Mission shall be credited with their respective share of the unencumbered \nbalance and other revenue in the amount of 11,062,400 dollars in respect of the \nfinancial period ended 30 June 2017, in accordance with the levels updated in its \nresolution 70/246 of 23 December 2015, taking into account the scale of assessments \nfor 2017, as set out in its resolution 70/245 of 23 December 2015;  \n \n17. Also decides that, for Member States that have not fulfilled their financial \nobligations to the Mission, there shall be set off against their outstanding obligations \ntheir respective share of the unencumbered balance and other revenue in the amount \nof 11,062,400 dollars in respect of the financial period ended 30 June 2017, in \naccordance with the scheme set out in paragraph 16 above;  \n \n18. Further decides that the increase of 783,600 dollars in the estimated staff \nassessment income in respect of the financial period ended 30 June 2017 shall be \nadded to the credits in the amount of 11,062,400 dollars referred to in paragraphs 16 \nand 17 above;  \n \n19. Decides to include in the provisional agenda of its seventy-third session \nthe item entitled \u201cFinancing of the United Nations Mission in Liberia\u201d.  \n \n104th plenary meeting  \n5 July 2018 \n \n",
  "paragraphs": {
    "1": "Takes note of the status of contributions to the United Nations Mission in Liberia as at 30 April 2018, including the contributions outstanding in the amount of 22.7 million United States dollars, representing some 0.3 per cent of the total assessed contributions, notes with concern that only 99 Member States have paid their assessed contributions in full, and urges all other Member States, in particular those in arrears, to ensure payment of their outstanding assessed contributions;",
    "2": "Expresses its appreciation to those Member States that have paid their assessed contributions in full, and urges all other Member States to make every possible effort to ensure payment of their assessed contributions to the Mission in full;",
    "3": "Expresses concern at the financial situation with regard to peacekeeping activities, in particular as regards the reimbursements to troop contributors that bear additional burdens owing to overdue payments by Member States of their assessments;",
    "4": "Emphasizes that all future and existing peacekeeping missions shall be given equal and non-discriminatory treatment in respect of financial and administrative arrangements;",
    "5": "Also emphasizes that all peacekeeping missions shall be provided with adequate resources for the effective and efficient discharge of their respective mandates;",
    "6": "Requests the Secretary-General to ensure that proposed peacekeeping budgets are based on the relevant legislative mandates;",
    "7": "Endorses the conclusions and recommendations contained in the report of the Advisory Committee on Administrative and Budgetary Questions, 2 and requests the Secretary-General to ensure their full implementation;",
    "8": "Stresses the importance of applicable payments due to a staff member at the time of separation from service during the transitional period, taking into account the special situation of national staff, and in this regard requests the Secretary-General to ensure a timely treatment to all staff;",
    "9": "Encourages the Secretary-General to identify potential outstanding commitments at least nine months before the physical closure of a mission in future pre-liquidation processes;",
    "10": "Requests the Secretary-General to continue his efforts to identify and address on time and in full all the residual activities, including unforeseen liabilities identified after the closure of the Mission;",
    "11": "Also requests the Secretary-General to rigorously pursue and complete the liquidation of assets, as planned, in accordance with regulation 5.14 of the Financial Regulations and Rules of the United Nations,3 including engaging with the authorities regarding potential donations and taking account of lessons learned, and to report thereon in the context of the final performance report;",
    "12": "Notes with concern the significant amount of contaminated soil collected during the liquidation of the Mission, and in this regard requests the Secretary- General to continue to reduce the long-term overall environmental footprint of the Mission in full compliance with the relevant rules and regulations, including but not limited to the United Nations environmental and waste management policy and procedures;",
    "13": "Requests the Secretary-General to ensure the full implementation of the relevant provisions of its resolutions 59/296 of 22 June 2005, 60/266 of 30 June 2006, 61/276 of 29 June 2007, 64/269 of 24 June 2010, 65/289 of 30 June 2011, 66/264 of 21 June 2012, 69/307 of 25 June 2015 and 70/286 of 17 June 2016, as well as other relevant resolutions;",
    "14": "Also requests the Secretary-General to take all action necessary to ensure that the Mission is administered with a maximum of efficiency and economy; Budget performance report for the period from 1 July 2016 to 30 June 2017",
    "15": "Takes note of the report of the Secretary-General on the budget performance of the Mission for the period from 1 July 2016 to 30 June 2017;1",
    "16": "Decides that Member States that have fulfilled their financial obligations to the Mission shall be credited with their respective share of the unencumbered balance and other revenue in the amount of 11,062,400 dollars in respect of the financial period ended 30 June 2017, in accordance with the levels updated in its resolution 70/246 of 23 December 2015, taking into account the scale of assessments for 2017, as set out in its resolution 70/245 of 23 December 2015;",
    "17": "Also decides that, for Member States that have not fulfilled their financial obligations to the Mission, there shall be set off against their outstanding obligations their respective share of the unencumbered balance and other revenue in the amount of 11,062,400 dollars in respect of the financial period ended 30 June 2017, in accordance with the scheme set out in paragraph 16 above;",
    "18": "Further decides that the increase of 783,600 dollars in the estimated staff assessment income in respect of the financial period ended 30 June 2017 shall be added to the credits in the amount of 11,062,400 dollars referred to in paragraphs 16 and 17 above;",
    "19": "Decides to include in the provisional agenda of its seventy-third session the item entitled \u201cFinancing of the United Nations Mission in Liberia\u201d."
  },
  "agenda_items": [
    "Item 158"
  ],
  "symbol_references": []
}