{
  "symbol": "A/RES/79/8",
  "filename": "A_RES_79_8.pdf",
  "title": "79/8. Sport as an enabler of sustainable development",
  "text": "United Nations \nA/RES/79/8\n \nGeneral Assembly \nDistr.: General \n13 November 2024 \n24-21179 (E) \n*2421179* \n \n \nSeventy-ninth session \nAgenda item 12 \nSport for development and peace \n \n \n \n \n Resolution adopted by the General Assembly \non 12 November 2024 \n \n \n[without reference to a Main Committee (A/79/L.10)] \n \n \n \n79/8. Sport as an enabler of sustainable development \n \n \n \nThe General Assembly, \n \nRecalling its resolutions 58/5 of 3 November 2003 and 59/10 of 27 October \n2004, its decision to proclaim 2005 the International Year for Sport and Physical \nEducation to strengthen sport as a means to promote education, health, development \nand peace, and its resolutions 60/1 of 16 September 2005, 60/9 of 3 November 2005, \n61/10 of 3 November 2006, 62/271 of 23 July 2008, 63/135 of 11 December 2008, \n65/4 of 18 October 2010, 67/17 of 28 November 2012, 69/6 of 31 October 2014, \n71/160 of 16 December 2016, 73/24 of 3 December 2018, 75/18 of 1 December 2020 \nand 77/27 of 1 December 2022,  \n \nRecalling also its resolution 67/296 of 23 August 2013, in which it proclaimed \n6 April the International Day of Sport for Development and Peace,  \n \nRecalling further its resolution 78/10 of 21 November 2023 on building a \npeaceful and better world through sport and the Olympic ideal, and all its previous \nresolutions on this matter,  \n \nReaffirming its resolution 70/1 of 25 September 2015, entitled \u201cTransforming \nour world: the 2030 Agenda for Sustainable Development\u201d, in which it adopted a \ncomprehensive, far-reaching and people-centred set of universal and transformative \nSustainable Development Goals and targets, its commitment to working tirelessly for \nthe full implementation of the Agenda by 2030, its recognition that eradicating \npoverty in all its forms and dimensions, including extreme poverty, is the greatest \nglobal challenge and an indispensable requirement for sustainable development, its \ncommitment to achieving sustainable development in its three dimensions \u2013 \neconomic, social and environmental \u2013 in a balanced and integrated manner, and to \nbuilding upon the achievements of the Millennium Development Goals and seeking \nto address their unfinished business,  \n\nA/RES/79/8 \nSport as an enabler of sustainable development\n \n24-21179\n2/10 \n \n \nReaffirming also its resolution 69/313 of 27 July 2015 on the Addis Ababa \nAction Agenda of the Third International Conference on Financing for Development, \nwhich is an integral part of the 2030 Agenda for Sustainable Development, 1 supports \nand complements it, helps to contextualize its means of implementation targets with \nconcrete policies and actions, and reaffirms the strong political commitment to \naddress the challenge of financing and creating an enabling environment at all levels \nfor sustainable development in the spirit of global partnership and solidarity,  \n \nRecalling Policy Brief No. 73 of the Department of Economic and Social Affairs \nof the Secretariat, \u201cThe impact of COVID\u201119 on sport, physical activity and well-\nbeing and its effects on social development\u201d, the inter-agency advocacy brief \n\u201cRecovering better: sport for development and peace \u2013 reopening, recovery and \nresilience post COVID\u201119\u201d, initiated by the Department of Economic and Social \nAffairs and co-led by the Department and the United Nations Entity for Gender \nEquality and the Empowerment of Women (UN-Women), and Policy Brief No. 128 \nof the Department of Economic and Social Affairs, \u201cAddressing climate change \nthrough sport\u201d,  \n \nRecognizing the contribution of sport to the realization of the Millennium \nDevelopment Goals, as declared in its resolutions 60/1, and 65/1 of 22 September \n2010,  \n \nRecalling that, in the 2030 Agenda for Sustainable Development, inter alia, sport \nis recognized as an important enabler for sustainable development,  \n \nWelcoming the convening of the Summit of the Future on 22 and 23 September \n2024 at United Nations Headquarters in New York, and taking note of resolution 79/1 \nof 22 September 2024, entitled \u201cThe Pact for the Future\u201d, and its annexes, that, \ninter alia, recognizes the protection and promotion of culture and sport as integral \ncomponents of sustainable development, \n \nTaking note of its resolution 78/310 of 1 July 2024, entitled \u201cWorld Fair Play \nDay\u201d, which proclaimed 19 May as World Fair Play Day,  \n \nRecognizing that the sport sector can contribute to addressing the adverse \nimpacts of climate change, including by reducing its own carbon footprint, by \nadopting sustainability standards and by raising awareness and influencing millions \nof people worldwide and their behaviours,  \n \nAcknowledging the importance of holistic approaches to health and well-being \nthrough regular physical activity, including sport and recreation, to prevent and \ncontrol non\u2011communicable diseases and promote healthy lifestyles, including through \nphysical education, as reflected in the political declaration of the third high-level \nmeeting of the General Assembly on the prevention and control of non\u2011communicable \ndiseases,2 \n \nRecognizing that sports, the arts and physical activity have the power to change \nperceptions, prejudices and behaviours, as well as to inspire people, break down racial \nand political barriers, combat discrimination and defuse conflict, as reflected in the \npolitical declaration adopted at the Nelson Mandela Peace Summit in 2018, 3 \n \nRecognizing also that sport, including sport for persons with disabilities and \npersons living with rare diseases, has an important role to play in the promotion of \npeace and development, physical and mental health, gender equality, the \n_______________ \n \n1 Resolution 70/1. \n \n2 Resolution 73/2. \n \n3 Resolution 73/1. \n\nSport as an enabler of sustainable development \nA/RES/79/8\n \n3/10\n24-21179 \n \nempowerment of women and girls, respect for human rights and the fight against \nracism and racial discrimination,  \n \nRecognizing further the benefits of sport for the health of older persons, as \noutlined in the Madrid International Plan of Action on Ageing, 2002, 4 \n \nRecalling article 31 of the Convention on the Rights of the Child, 5 outlining a \nchild\u2019s right to play and leisure, and the outcome document of the twenty-seventh \nspecial session of the General Assembly on children, entitled \u201cA world fit for \nchildren\u201d,6 stressing the promotion of physical, mental and emotional health through \nplay and sports,  \n \nRecalling also the political declaration7 and outcome8 adopted at the five-year \nreview of the Beijing Declaration and Platform for Action, 9 with 2025 marking its \nthirtieth anniversary, and the commitments made therein to ensure equal opportunities \nfor women and girls in recreational and sports activities, as well as in participation in \nathletics and physical activities at the national, regional and international levels, such \nas access, training, competition, remuneration and prizes,  \n \nRecalling further article 30 of the Convention on the Rights of Persons with \nDisabilities,10 in which States parties recognized the right of persons with disabilities \nto take part on an equal basis with others in cultural life and are to take appropriate \nmeasures to enable persons with disabilities to participate on an equal basis with \nothers in recreational, leisure and sporting activities, and recognizing that the active \ninvolvement of persons with disabilities and persons living with rare diseases in sport \ncontributes to the full and equal realization of their human rights, as well as respect \nfor their inherent dignity, consistent with article 1 of the Convention,  \n \nAcknowledging the revised International Charter of Physical Education, \nPhysical Activity and Sport, as proclaimed by the General Conference of the United \nNations Educational, Scientific and Cultural Organization at its thirty-eighth session, \nin November 2015,11 as well as the Declaration of Berlin and the Kazan Action Plan \nadopted at the fifth and sixth International Conferences of Ministers and Senior \nOfficials Responsible for Physical Education and Sport, held, respectively, in Berlin \nin May 2013 and in Kazan, Russian Federation, in July 2017,  \n \nRecognizing the important role played by the International Convention against \nDoping in Sport 12 in harmonizing the actions taken by Governments in the fight \nagainst doping in sport, which are complementary to those undertaken by the Olympic \nmovement and other sporting organizations under the World Anti-Doping Code of the \nWorld Anti-Doping Agency,  \n \nAcknowledging the recommendations contained in the report of the Sport for \nDevelopment and Peace International Working Group entitled \u201cHarnessing the power \nof sport for development and peace: recommendations to Governments\u201d, and \n_______________ \n \n4 Report of the Second World Assembly on Ageing, Madrid, 8\u201312 April 2002 (United Nations \npublication, Sales No. E.02.IV.4), chap. I, resolution 1, annex II. \n \n5 United Nations, Treaty Series, vol. 1577, No. 27531. \n \n6 Resolution S-27/2, annex. \n \n7 Resolution S-23/2, annex. \n \n8 Resolution S-23/3, annex. \n \n9 Report of the Fourth World Conference on Women, Beijing, 4\u201315 September 1995 (United \nNations publication, Sales No. E.96.IV.13), chap. I, resolution 1, annexes I and II. \n \n10 United Nations, Treaty Series, vol. 2515, No. 44910. \n \n11 United Nations Educational, Scientific and Cultural Organization, Records of the General \nConference, Thirty-eighth Session, Paris, 3\u201318 November 2015, vol. 1, Resolutions, sect. IV, \nresolution 43. \n \n12 United Nations, Treaty Series, vol. 2419, No. 43649. \n\nA/RES/79/8 \nSport as an enabler of sustainable development\n \n24-21179\n4/10 \n \nencouraging \nMember \nStates \nto \nimplement \nand \nfurther \ndevelop \nthose \nrecommendations,  \n \nRecognizing the need to strengthen and further coordinate efforts, including \nmulti-stakeholder partnerships, at all levels to maximize the potential of sport to \ncontribute to the achievement of the 2030 Agenda and the Sustainable Development \nGoals, as well as other internationally agreed development goals, and national \npeacebuilding and State-building priorities,  \n \nAcknowledging the major role of the United Nations system and its country \nprogrammes, as well as the role of Member States, in promoting human development \nthrough sport and physical education,  \n \nAcknowledging also the role of the United Nations Educational, Scientific and \nCultural Organization, the Intergovernmental Committee for Physical Education and \nSport and the International Conference of Ministers and Senior Officials Responsible \nfor Physical Education and Sport, including the declarations that it has adopted, in \npromoting the educational, cultural and social dimensions of sport and physical \neducation, including in the context of the 2030 Agenda, and in forging commitments \nand recommendations in this regard,  \n \nRecalling the proclamation by the General Conference of the United Nations \nEducational, Scientific and Cultural Organization, at its thirty-eighth session, of \n20 September as the International Day of University Sport,  \n \nRecalling also the role of UN-Women and the opportunities that it provides \nwithin its mandate for the realization of gender equality and the empowerment of \nwomen and girls, including in and through sport, and welcoming the continued \nadvancement of women and girls in sports and sporting activities, in particular the \nsupport for their progressively higher participation in sport events, which provides \nopportunities for economic development through sports,  \n \nAcknowledging the Olympic Charter, and that any form of discrimination is \nincompatible with belonging to the Olympic movement,  \n \nWelcoming the memorandum of understanding signed between the International \nOlympic Committee and the United Nations in April 2014, in which a call was made \nto strengthen efforts around sport-based initiatives that encourage social and \neconomic development, as well as to strengthen the many partnerships that United \nNations organizations have established with the Committee,  \n \nAffirming the invaluable contribution of the Olympic and Paralympic \nmovements in establishing sport as a unique means for the promotion of peace and \ndevelopment, in particular through the ideal of the Olympic Truce, acknowledging \nthe opportunities provided by past Olympic and Paralympic Games, including those \nheld in Beijing in 2022 and Paris in 2024, as well as the Winter Youth Olympic Games \nheld in Lausanne, Switzerland, in 2020, welcoming with appreciation all upcoming \nOlympic and Paralympic Games, in particular those to be held in Milano-Cortina, \nItaly, in 2026, in Los Angeles, United States of America, in 2028, and in Brisbane, \nAustralia, in 2032, as well as the Winter Games in 2030 in the French Alps, France, \nand in 2034 in Salt Lake City, United States of America, in addition to the Youth \nOlympic Games held in Gangwon, Republic of Korea, in 2024, and in Dakar in 2026, \nand calling upon future hosts of such Games and other Member States to include sport, \nas appropriate, in conflict prevention activities and to ensure the effective \nimplementation of the Olympic Truce during the Games,  \n \nRecognizing the role that the Paralympic movement plays in showcasing the \nachievements of athletes with disabilities to a global audience and in acting as a \n\nSport as an enabler of sustainable development \nA/RES/79/8\n \n5/10\n24-21179 \n \nprimary vehicle to promote positive perceptions and greater inclusion of persons with \ndisabilities in sport and society,  \n \nRecognizing also the importance of international, continental and regional sport \nevents, such as the World Artistic Gymnastics Championships, the Special Olympics \nWorld Games, the Deaflympics, the World Indigenous Games, the European Games, \nthe Games of La Francophonie, the Pan American Games and the Parapan American \nGames, the Games of the Community of Portuguese-speaking Countries, the All \nAfrica Games, the Asian Games, the Pacific Games, the Asian Indoor and Martial Arts \nGames, the World Nomad Games, the Commonwealth Games and the World \nUniversity Games, for promoting education, health, development, peace and \nsolidarity among nations,  \n \nAcknowledging the success of the inaugural United Nations New York-based \nMissions Games (United Nations Games), held in New York from 11 April to 8 May \n2024, within the framework of the General Assembly Sustainability Week, and \ndevoted to the International Day of Sport for Development and Peace, and welcoming \nthe convening of the second United Nations Games in New York in April 2025 to \nfoster camaraderie, collaboration and dialogue among the staff of the permanent \nmissions accredited to the United Nations and the Secretariat of the United Nations,  \n \nHighlighting the importance of continuing to reduce barriers to participation in \nsport events, particularly for participants from developing countries,  \n \nRecognizing that major international sport events should be organized in the \nspirit of peace, mutual understanding and international cooperation, friendship and \ntolerance, and without discrimination of any kind, and that the unifying and \nconciliative nature of such events should be respected,  \n \nReaffirming the importance of Member States, including those that will host \nsuch Games and other sporting events in the future, as well as relevant sport-related \norganizations, federations and associations, as appropriate, enhancing measures to \naddress the risks of corruption related to such events, and in this regard welcoming \nthe conferences on safeguarding sport from corruption, held in Vienna in June 2018 \nand in September 2019, noting with appreciation the efforts of the United Nations \nOffice on Drugs and Crime in this regard, in particular the publication of the Global \nReport on Corruption in Sport, and noting the efforts of the International Partnership \nagainst Corruption in Sport established in 2017,  \n \nTaking note of the United Nations Office on Drugs and Crime Global Report on \nCorruption in Sport and its report entitled \u201cGame Over: Exposing the Linkages \nbetween Corruption, Serious and Organized Crime in Sport\u201d, noting with appreciation \nthe efforts of Member States and the Office aimed at preventing, detecting, \ninvestigating and sanctioning corruption and organized crime in sport through \nawareness-raising, capacity-building and activities linked to enhancing cooperation \nbetween criminal justice authorities, sports organizations and relevant stakeholders, \nand recalling in this regard Conference of the States Parties to the United Nations \nConvention against Corruption resolution 8/4 on safeguarding sport from corruption,  \n \nNoting the high-level debate on the theme \u201cCrime prevention and sustainable \ndevelopment through sports\u201d held at United Nations Headquarters in New York in \nJune 2024 by the President of the General Assembly in partnership with the United \nNations Office on Drugs and Crime,  \n \nEmphasizing the critical role of productive public-private partnerships for \nfunding sport for development and peace programmes, institutional development and \nphysical and social infrastructures,  \n\nA/RES/79/8 \nSport as an enabler of sustainable development\n \n24-21179\n6/10 \n \n \nRecognizing the work of the Department of Economic and Social Affairs since \n2017 to promote the contributions of sport to development and peace, including its \nsupport for intergovernmental mechanisms in New York on sport-related discussions, \nresearch and thought leadership, coordination with other United Nations entities on \npolicy, and awareness-raising efforts,  \n \n1. \nReaffirms that sport is an important enabler of sustainable development, \nand recognizes the growing contribution of sport to the realization of development \nand peace in its promotion of tolerance and respect and the contributions it makes to \nthe empowerment of women and of young people, individuals and communities as \nwell as to physical and mental health, education and social inclusion objectives;  \n \n2. \nEncourages all relevant stakeholders to emphasize and advance the use of \nsport as a vehicle to foster sustainable development and, inter alia, strengthen \neducation, including physical education, for children and young persons, including \npersons with disabilities and persons living with rare diseases, prevent disease, \nincluding non\u2011communicable diseases, and drug abuse, promote physical and mental \nhealth, realize gender equality and the empowerment of women and girls, realize the \nempowerment of young people, foster inclusion and well-being, promote healthy and \nactive ageing, help to ensure the participation of everyone without discrimination of \nany kind, promote tolerance, mutual understanding and respect and facilitate social \ninclusion, conflict prevention and peacebuilding;  \n \n3. \nTakes note with appreciation of the report of the Secretary-General entitled \n\u201cUnited by our common goals: ensuring the impact of sport on sustainable \ndevelopment and peace\u201d, 13 reviewing progress towards the implementation of the \nUnited Nations Action Plan on Sport for Development and Peace between 2022 and \n2024, focusing on progress in five priority areas of impact and highlighting ways and \nopportunities for strengthening its implementation within the United Nations system, \nin line with the respective mandates of United Nations system organizations amid \ncurrent global challenges;  \n \n4. \nWelcomes the growing attention by the international community to \nexploring and leveraging the role of sport and physical activity in the attainment of \ndevelopment objectives and the enjoyment of human rights, and in this regard \nacknowledges the endorsement by the General Conference of the United Nations \nEducational, Scientific and Cultural Organization of the Kazan Action Plan and its \nsport policy follow-up framework, adopted at the sixth International Conference of \nMinisters and Senior Officials Responsible for Physical Education and Sport, as a \nvoluntary, overarching reference for fostering international convergence among \npolicymakers in the fields of physical education, physical activity and sports, as well \nas a potential tool for aligning international and national policy in these fields,14 and \nthe endorsement by the World Health Assembly of the global action plan on physical \nactivity 2018\u20132030;15 \n \n5. \nEncourages Member States, the entities of the United Nations system, \nincluding its peacekeeping missions, special political missions and integrated \npeacebuilding missions, sport-related organizations, federations and associations, \nathletes, the media, civil society, academia and the private sector to draw on these \nframeworks, as appropriate, in a coherent and integrated manner, to advance the \nconsolidation of sport in cross-cutting development and peace strategies and the \n_______________ \n \n13 A/79/289. \n \n14 See United Nations Educational, Scientific and Cultural Organization, Records of the General \nConference, Thirty-ninth Session, Paris, 30 October\u201314 November 2017, vol. 1, Resolutions, \nsect. IV, resolution 30. \n \n15 See World Health Organization, document WHA71/2018/REC/1, resolution 71.6. \n\nSport as an enabler of sustainable development \nA/RES/79/8\n \n7/10\n24-21179 \n \nincorporation of sport and physical education in international, regional and national \ndevelopment and peace policies and programmes, on the basis of standards, indicators \nand benchmarks, as well as to ensure the monitoring and evaluation of such strategies, \npolicies and programmes;  \n \n6. \nUrges Member States that have not yet done so to consider signing, \nratifying, acceding to and implementing the Convention on the Rights of the Child \nand the Optional Protocols thereto,16 the Convention on the Rights of Persons with \nDisabilities, the Convention on the Elimination of All Forms of Discrimination \nagainst Women17 and the International Convention against Doping in Sport;  \n \n7. \nCalls upon the relevant entities of the United Nations system and other \ninternational and regional organizations, within their respective mandates and \nexisting resources, to strengthen system-wide coherence and to increase and expand \ninternal coordination, and encourages their ongoing collaboration to advance the role \nof sport as an enabler of sustainable development, in line with the United Nations \nAction Plan on Sport for Development and Peace, to maximize the potential of sport \nand physical activity to contribute to the achievement of the Goals and targets of the \n2030 Agenda and other internationally agreed development goals, and national \npeacebuilding and State-building priorities;  \n \n8. \nEncourages Member States to integrate sport and quality physical \neducation and activity into national strategies for sustainable development, taking \nnote of the contributions that sport makes to health, to promote safe sport as a \ncontributor to the health and well-being of individuals and communities and to \neffectively use all the opportunities offered by sport and by its values as a vehicle for \nthe implementation of the 2030 Agenda and in order to implement the Sustainable \nDevelopment Goals and to address the adverse impacts of climate change, and \nencourages the United Nations system to support Member States in such efforts;  \n \n9. \nAlso encourages Member States to provide institutional structures, \nappropriate quality standards, policies and competencies and to promote academic \nresearch and expertise in the field to enable ongoing training, capacity-building and \neducation of physical education teachers, coaches and community leaders in sport for \ndevelopment and peace programmes, and equally encourages United Nations entities \nto continue to provide research, normative and policy guidance to further advance the \nengagement of Governments and other stakeholders in their use of sport for the \nachievement of development and peace, accelerate the implementation of the 2030 \nAgenda and strengthen efforts in that area;  \n \n10. Further encourages Member States, in accordance with their national \npriorities, to use sport as a lever for education and employment, for health and \nnutrition, for gender equality and the inclusion of persons with disabilities, for \nsustainability and hosting major sporting events, and for financing and measuring the \nimpact of sport for sustainable development;  \n \n11. \nInvites Member States and international sport organizations to continue to \nassist developing countries, in particular the least developed countries, in their \ncapacity-building efforts in sport and physical education by providing national \nexperiences and best practices, as well as financial, technical and logistic resources \nfor the development of sport-based programmes, including for youth and for \nsustainable development, and further invites the United Nations system to strengthen \nthe provision of inter-agency capacity development and technical cooperation \nservices and financial assistance, as appropriate, to support the development and \n_______________ \n \n16 United Nations, Treaty Series, vols. 2171, 2173 and 2983, No. 27531. \n \n17 Ibid., vol. 1249, No. 20378. \n\nA/RES/79/8 \nSport as an enabler of sustainable development\n \n24-21179\n8/10 \n \nimplementation of national policies and approaches to maximizing the contributions \nof sport for development and peace, as well as sport for all, without discrimination of \nany kind;  \n \n12. Invites Member States to work together with the United Nations system \nand other stakeholders to increase engagement and cooperation with one another to \nharness digital technology to advance sport as a tool to achieve the Sustainable \nDevelopment Goals and to support sport and physical activity at home, while \nbroadening access to sport training and physical activity opportunities through online \nplatforms;  \n \n13. Notes the lack of centralized global socioeconomic data and statistics on \nsport, acknowledges progress in the development and adoption of common indicators \nto measure the contribution of physical education, physical activity and sport, and \nencourages the United Nations system to continue its ongoing work with the \nCommonwealth and other international partners to establish a shared indicator \nframework, taking note of action 2 of the Kazan Action Plan, adopted at the sixth \nInternational Conference of Ministers and Senior Officials Responsible for Physical \nEducation and Sport and endorsed by the General Conference of the United Nations \nEducational, Scientific and Cultural Organization;  \n \n14. Encourages relevant stakeholders, and in particular the organizers of sport \nevents, to use and leverage such events to promote and support sport for development \nand peace initiatives and to strengthen existing and build new partnerships, coordinate \ncommon strategies, policies and programmes and increase coherence and synergies, \nwhile raising awareness at the local, national, regional and global levels;  \n \n15. Encourages Member States to adopt best practices and means to promote \nthe practice of sport and physical activities among all members of society, and in this \nregard welcomes initiatives to adopt dedicated education, health, youth and sport \ndays, including specialized sport days, at the national and local levels, as a means to \npromote physical and mental health and well-being and cultivate a sport culture in \nsociety;  \n \n16. Also encourages Member States to strengthen collaboration with sport \norganizations as well as civil society, including non\u2011governmental organizations, that \nimplement sport for development and peace initiatives, including by enabling \npartnerships and strengthening local capacities, as appropriate, to monitor impacts \nand scale up actions, while also noting the role of the private sector, national and \ninternational sports federations and organizations, and all relevant national initiatives \nin this regard;  \n \n17. Supports the independence and autonomy of sport as well as the mission \nof the International Olympic Committee in leading the Olympic movement and of the \nInternational Paralympic Committee in leading the Paralympic movement;  \n \n18. Notes the efforts undertaken by the Secretary-General, the President of the \nGeneral Assembly, Member States and civil society for the observance of the Olympic \nTruce, and encourages future hosts of the Olympic Games and the Paralympic Games \nand other Member States to support the effective implementation of the Truce and to \nuse sport as a tool to promote peace, dialogue and reconciliation in areas of conflict \nduring and beyond the period of the Olympic and Paralympic Games;  \n \n19. Encourages relevant entities involved in delivering mega sport events to \nrespect applicable laws and international principles, including the Guiding Principles \non Business and Human Rights: Implementing the United Nations \u201cProtect, Respect \n\nSport as an enabler of sustainable development \nA/RES/79/8\n \n9/10\n24-21179 \n \nand Remedy\u201d Framework,18 noting other ongoing initiatives in this regard, at every \nstage of the event life cycle, to safeguard the many societal benefits that hosting such \nevents can contribute;  \n \n20. Calls upon Member States to enhance their efforts to prevent and fight \nagainst corruption and organized crime in sport, including by supporting efforts aimed \nat enhancing cooperation between and among law enforcement authorities, relevant \nUnited Nations agencies and sports organizations, facilitating the exchange of \nexpertise and the dissemination of information and raising awareness within sports \norganizations and the sports community, and through educational programmes, of the \nthreat posed by corruption and organized crime in sport, and also calls upon Members \nStates to make use of available tools by relevant agencies in accordance with the \nfundamental principles of their legal systems;  \n \n21. Calls upon Member States and the sport sector to enhance their efforts to \nprevent and fight trafficking in persons, in particular of children and women, as well \nas forced labour, sexual exploitation, abuse and harassment, and all forms of violence \nin sports;  \n \n22. Encourages Member States, in particular those committed to promoting \nsport as a tool for development and peace, and other stakeholders, such as \ninternational sports federations, organizers of sport events, sports clubs and leagues, \nfoundations and the private sector, especially businesses involved in the sports and \ndevelopment sector, to continue and intensify their support for the work of the United \nNations system on sport for development and peace, including through voluntary \ncontributions and the establishment of innovative partnerships to advance policy and \nprogramme development in the field of sport for development and peace;  \n \n23. Encourages the Department of Economic and Social Affairs of the \nSecretariat to continue its work on sport for development and peace, including by \nupdating the 2018 United Nations Action Plan on Sport for Development and Peace, \nand encourages Member States to support the Department in its efforts, including \nthrough voluntary contributions;  \n \n24. Invites the Secretary-General to strengthen the capacity of the Secretariat, \nwithin existing resources and through voluntary contributions, to support and \ncoordinate the implementation of the United Nations Action Plan on Sport for \nDevelopment and Peace across the United Nations system and to strengthen \nnormative and policy guidance and the evidence on the impact of sport on the \nSustainable Development Goals through the monitoring and evaluation of United \nNations policies and programmes using quantitative methods and disaggregated data, \nin full consultation with Member States;  \n \n25. Encourages Member States to actively participate in the Group of Friends \nof Sport for Development and Peace, an informal group of permanent missions to the \nUnited Nations in New York and Geneva serving as a platform to promote dialogue \nand exchange of views and information, including on ongoing initiatives, programmes \nand partnerships, between Member States and all relevant stakeholders, as well as to \nfacilitate and encourage the integration of sport to support the achievement of the \nUnited Nations goals and objectives;  \n \n26. Also encourages Member States, with the support of the United Nations \nsystem, within existing resources, and other relevant stakeholders, to explore ways \nand means to integrate sport into various development objectives in the review and \nfollow-up processes of relevant development frameworks and agendas, including the \nfollow-up to the World Summit for Social Development, the Beijing Declaration and \n_______________ \n \n18 A/HRC/17/31, annex. \n\nA/RES/79/8 \nSport as an enabler of sustainable development\n \n24-21179\n10/10 \n \nPlatform for Action, the reviews of the implementation of the Convention on the \nRights of Persons with Disabilities and of the achievement of the ends of the United \nNations Declaration on the Rights of Indigenous Peoples,19 the follow-up to the World \nProgramme of Action for Youth, 20 the follow-up processes of Agenda 2063 of the \nAfrican Union and the review and follow-up processes of the 2030 Agenda, including \nthe high-level political forum on sustainable development and the political declaration \nof the third high-level meeting of the General Assembly on the prevention and control \nof non\u2011communicable diseases;  \n \n27. Requests the Secretary-General to report to the General Assembly at its \neighty-first session on the implementation of the present resolution, including a \ndetailed needs assessment of the capacity of the Secretariat to implement the United \nNations Action Plan on Sport for Development and Peace through 2030 and beyond;  \n \n28. Decides to include in the provisional agenda of its eighty-first session the \nitem entitled \u201cSport for development and peace\u201d. \n \n37th plenary meeting \n12 November 2024 \n \n_______________ \n \n19 Resolution 61/295, annex. \n \n20 Resolution 50/81, annex, and resolution 62/126, annex. \n",
  "paragraphs": {
    "1": "Reaffirms that sport is an important enabler of sustainable development, and recognizes the growing contribution of sport to the realization of development and peace in its promotion of tolerance and respect and the contributions it makes to the empowerment of women and of young people, individuals and communities as well as to physical and mental health, education and social inclusion objectives;",
    "2": "Encourages all relevant stakeholders to emphasize and advance the use of sport as a vehicle to foster sustainable development and, inter alia, strengthen education, including physical education, for children and young persons, including persons with disabilities and persons living with rare diseases, prevent disease, including non\u2011communicable diseases, and drug abuse, promote physical and mental health, realize gender equality and the empowerment of women and girls, realize the empowerment of young people, foster inclusion and well-being, promote healthy and active ageing, help to ensure the participation of everyone without discrimination of any kind, promote tolerance, mutual understanding and respect and facilitate social inclusion, conflict prevention and peacebuilding;",
    "3": "Takes note with appreciation of the report of the Secretary-General entitled \u201cUnited by our common goals: ensuring the impact of sport on sustainable development and peace\u201d, 13 reviewing progress towards the implementation of the United Nations Action Plan on Sport for Development and Peace between 2022 and 2024, focusing on progress in five priority areas of impact and highlighting ways and opportunities for strengthening its implementation within the United Nations system, in line with the respective mandates of United Nations system organizations amid current global challenges;",
    "4": "Welcomes the growing attention by the international community to exploring and leveraging the role of sport and physical activity in the attainment of development objectives and the enjoyment of human rights, and in this regard acknowledges the endorsement by the General Conference of the United Nations Educational, Scientific and Cultural Organization of the Kazan Action Plan and its sport policy follow-up framework, adopted at the sixth International Conference of Ministers and Senior Officials Responsible for Physical Education and Sport, as a voluntary, overarching reference for fostering international convergence among policymakers in the fields of physical education, physical activity and sports, as well as a potential tool for aligning international and national policy in these fields,14 and the endorsement by the World Health Assembly of the global action plan on physical activity 2018\u20132030;15",
    "5": "Encourages Member States, the entities of the United Nations system, including its peacekeeping missions, special political missions and integrated peacebuilding missions, sport-related organizations, federations and associations, athletes, the media, civil society, academia and the private sector to draw on these frameworks, as appropriate, in a coherent and integrated manner, to advance the consolidation of sport in cross-cutting development and peace strategies and the incorporation of sport and physical education in international, regional and national development and peace policies and programmes, on the basis of standards, indicators and benchmarks, as well as to ensure the monitoring and evaluation of such strategies, policies and programmes;",
    "6": "Urges Member States that have not yet done so to consider signing, ratifying, acceding to and implementing the Convention on the Rights of the Child and the Optional Protocols thereto,16 the Convention on the Rights of Persons with Disabilities, the Convention on the Elimination of All Forms of Discrimination against Women17 and the International Convention against Doping in Sport;",
    "7": "Calls upon the relevant entities of the United Nations system and other international and regional organizations, within their respective mandates and existing resources, to strengthen system-wide coherence and to increase and expand internal coordination, and encourages their ongoing collaboration to advance the role of sport as an enabler of sustainable development, in line with the United Nations Action Plan on Sport for Development and Peace, to maximize the potential of sport and physical activity to contribute to the achievement of the Goals and targets of the 2030 Agenda and other internationally agreed development goals, and national peacebuilding and State-building priorities;",
    "8": "Encourages Member States to integrate sport and quality physical education and activity into national strategies for sustainable development, taking note of the contributions that sport makes to health, to promote safe sport as a contributor to the health and well-being of individuals and communities and to effectively use all the opportunities offered by sport and by its values as a vehicle for the implementation of the 2030 Agenda and in order to implement the Sustainable Development Goals and to address the adverse impacts of climate change, and encourages the United Nations system to support Member States in such efforts;",
    "9": "Also encourages Member States to provide institutional structures, appropriate quality standards, policies and competencies and to promote academic research and expertise in the field to enable ongoing training, capacity-building and education of physical education teachers, coaches and community leaders in sport for development and peace programmes, and equally encourages United Nations entities to continue to provide research, normative and policy guidance to further advance the engagement of Governments and other stakeholders in their use of sport for the achievement of development and peace, accelerate the implementation of the 2030 Agenda and strengthen efforts in that area;",
    "10": "Further encourages Member States, in accordance with their national priorities, to use sport as a lever for education and employment, for health and nutrition, for gender equality and the inclusion of persons with disabilities, for sustainability and hosting major sporting events, and for financing and measuring the impact of sport for sustainable development;",
    "11": "Invites Member States and international sport organizations to continue to assist developing countries, in particular the least developed countries, in their capacity-building efforts in sport and physical education by providing national experiences and best practices, as well as financial, technical and logistic resources for the development of sport-based programmes, including for youth and for sustainable development, and further invites the United Nations system to strengthen the provision of inter-agency capacity development and technical cooperation services and financial assistance, as appropriate, to support the development and implementation of national policies and approaches to maximizing the contributions of sport for development and peace, as well as sport for all, without discrimination of any kind;",
    "12": "Invites Member States to work together with the United Nations system and other stakeholders to increase engagement and cooperation with one another to harness digital technology to advance sport as a tool to achieve the Sustainable Development Goals and to support sport and physical activity at home, while broadening access to sport training and physical activity opportunities through online platforms;",
    "13": "Notes the lack of centralized global socioeconomic data and statistics on sport, acknowledges progress in the development and adoption of common indicators to measure the contribution of physical education, physical activity and sport, and encourages the United Nations system to continue its ongoing work with the Commonwealth and other international partners to establish a shared indicator framework, taking note of action 2 of the Kazan Action Plan, adopted at the sixth International Conference of Ministers and Senior Officials Responsible for Physical Education and Sport and endorsed by the General Conference of the United Nations Educational, Scientific and Cultural Organization;",
    "14": "Encourages relevant stakeholders, and in particular the organizers of sport events, to use and leverage such events to promote and support sport for development and peace initiatives and to strengthen existing and build new partnerships, coordinate common strategies, policies and programmes and increase coherence and synergies, while raising awareness at the local, national, regional and global levels;",
    "15": "Encourages Member States to adopt best practices and means to promote the practice of sport and physical activities among all members of society, and in this regard welcomes initiatives to adopt dedicated education, health, youth and sport days, including specialized sport days, at the national and local levels, as a means to promote physical and mental health and well-being and cultivate a sport culture in society;",
    "16": "Also encourages Member States to strengthen collaboration with sport organizations as well as civil society, including non\u2011governmental organizations, that implement sport for development and peace initiatives, including by enabling partnerships and strengthening local capacities, as appropriate, to monitor impacts and scale up actions, while also noting the role of the private sector, national and international sports federations and organizations, and all relevant national initiatives in this regard;",
    "17": "Supports the independence and autonomy of sport as well as the mission of the International Olympic Committee in leading the Olympic movement and of the International Paralympic Committee in leading the Paralympic movement;",
    "18": "Notes the efforts undertaken by the Secretary-General, the President of the General Assembly, Member States and civil society for the observance of the Olympic Truce, and encourages future hosts of the Olympic Games and the Paralympic Games and other Member States to support the effective implementation of the Truce and to use sport as a tool to promote peace, dialogue and reconciliation in areas of conflict during and beyond the period of the Olympic and Paralympic Games;",
    "19": " and Remedy\u201d Framework,18 noting other ongoing initiatives in this regard, at every stage of the event life cycle, to safeguard the many societal benefits that hosting such events can contribute;",
    "20": "Calls upon Member States to enhance their efforts to prevent and fight against corruption and organized crime in sport, including by supporting efforts aimed at enhancing cooperation between and among law enforcement authorities, relevant United Nations agencies and sports organizations, facilitating the exchange of expertise and the dissemination of information and raising awareness within sports organizations and the sports community, and through educational programmes, of the threat posed by corruption and organized crime in sport, and also calls upon Members States to make use of available tools by relevant agencies in accordance with the fundamental principles of their legal systems;",
    "21": "Calls upon Member States and the sport sector to enhance their efforts to prevent and fight trafficking in persons, in particular of children and women, as well as forced labour, sexual exploitation, abuse and harassment, and all forms of violence in sports;",
    "22": "Encourages Member States, in particular those committed to promoting sport as a tool for development and peace, and other stakeholders, such as international sports federations, organizers of sport events, sports clubs and leagues, foundations and the private sector, especially businesses involved in the sports and development sector, to continue and intensify their support for the work of the United Nations system on sport for development and peace, including through voluntary contributions and the establishment of innovative partnerships to advance policy and programme development in the field of sport for development and peace;",
    "23": "Encourages the Department of Economic and Social Affairs of the Secretariat to continue its work on sport for development and peace, including by updating the 2018 United Nations Action Plan on Sport for Development and Peace, and encourages Member States to support the Department in its efforts, including through voluntary contributions;",
    "24": "Invites the Secretary-General to strengthen the capacity of the Secretariat, within existing resources and through voluntary contributions, to support and coordinate the implementation of the United Nations Action Plan on Sport for Development and Peace across the United Nations system and to strengthen normative and policy guidance and the evidence on the impact of sport on the Sustainable Development Goals through the monitoring and evaluation of United Nations policies and programmes using quantitative methods and disaggregated data, in full consultation with Member States;",
    "25": "Encourages Member States to actively participate in the Group of Friends of Sport for Development and Peace, an informal group of permanent missions to the United Nations in New York and Geneva serving as a platform to promote dialogue and exchange of views and information, including on ongoing initiatives, programmes and partnerships, between Member States and all relevant stakeholders, as well as to facilitate and encourage the integration of sport to support the achievement of the United Nations goals and objectives;",
    "26": "Also encourages Member States, with the support of the United Nations system, within existing resources, and other relevant stakeholders, to explore ways and means to integrate sport into various development objectives in the review and follow-up processes of relevant development frameworks and agendas, including the follow-up to the World Summit for Social Development, the Beijing Declaration and Platform for Action, the reviews of the implementation of the Convention on the Rights of Persons with Disabilities and of the achievement of the ends of the United Nations Declaration on the Rights of Indigenous Peoples,19 the follow-up to the World Programme of Action for Youth, 20 the follow-up processes of Agenda 2063 of the African Union and the review and follow-up processes of the 2030 Agenda, including the high-level political forum on sustainable development and the political declaration of the third high-level meeting of the General Assembly on the prevention and control of non\u2011communicable diseases;",
    "27": "Requests the Secretary-General to report to the General Assembly at its eighty-first session on the implementation of the present resolution, including a detailed needs assessment of the capacity of the Secretariat to implement the United Nations Action Plan on Sport for Development and Peace through 2030 and beyond;",
    "28": "Decides to include in the provisional agenda of its eighty-first session the item entitled \u201cSport for development and peace\u201d."
  },
  "agenda_items": [
    "Item 12"
  ],
  "symbol_references": [
    "A/79/L.10"
  ]
}