{
  "symbol": "A/RES/72/272",
  "filename": "A_RES_72_272.pdf",
  "title": "72/272. World Bicycle Day",
  "text": "United Nations \nA/RES/72/272\n \n \nGeneral Assembly \nDistr.: General \n16 April 2018 \n \n18-05867 (E)    180418 \n*1805867* \n \n \nSeventy-second session \nAgenda item 11 \n \n \n \n \n Resolution adopted by the General Assembly \non 12 April 2018 \n \n \n \n \n[without reference to a Main Committee (A/72/L.43 and A/72/L.43/Add.1)] \n \n \n 72/272. World Bicycle Day \n \n \n \nThe General Assembly, \n \nRecognizing the contribution of sport to the realization of the Millennium \nDevelopment Goals, as declared in its resolutions 60/1 of 16 September 2005 and \n65/1 of 22 September 2010, \n \nRecalling that, in the 2030 Agenda for Sustainable Development, 1 inter alia, \nsport was recognized as an important enabler of sustainable development, \n \nRecognizing the need to strengthen and further coordinate efforts, including \nmulti-stakeholder partnerships, at all levels to maximize the potential of the bicycle \nto contribute to the achievement of the internationally agreed development goals, \nincluding the Sustainable Development Goals and targets of the 2030 Agenda, and a \nculture of peace, \n \nReaffirming its resolutions 53/199 of 15 December 1998 and 61/185 of \n20 December 2006 on the proclamation of international years, and Economic and \nSocial Council resolution 1980/67 of 25 July 1980 on international years and \nanniversaries, in particular paragraphs 1 to 10 of the annex thereto on the agreed \ncriteria for the proclamation of international years, as well as paragraphs 13 and 14, \nin which it is stated that an international day or year should not be proclaimed before \nthe basic arrangements for its organization and financing have been made, \n \nRecalling the New Urban Agenda, adopted at the United Nations Conference on \nHousing and Sustainable Urban Development (Habitat III), held in Quito from 17 to \n20 October 2016,2 \n \nAcknowledging the uniqueness, longevity and versatility of the bicycle, which \nhas been in use for two centuries, and that it is a simple, affordable, reliable, clean \n__________________ \n \n1  Resolution 70/1. \n \n2  Resolution 71/256, annex. \n\nA/RES/72/272 \nWorld Bicycle Day\n \n18-05867\n2/3 \n \nand environmentally fit sustainable means of transportation, fostering environmental \nstewardship and health, \n \nRecognizing that the synergy between the bicycle and the user fosters creativity \nand social engagement and gives the user an immediate awareness of the local \nenvironment, and recognizing also that the bicycle can serve as a tool for development \nand as a means not just of transportation but also of access to education, health care \nand sport, \n \nEmphasizing that the bicycle is a symbol of sustainable transportation and \nconveys a positive message to foster sustainable consumption and production, and \nhas a positive impact on climate, \n \nAcknowledging the role of the United Nations system and its country \nprogrammes in supporting Member States, upon request, in promoting social \ndevelopment through sport and physical education, including cycling, \n \nEmphasizing the extremely important role of productive public-private \npartnerships in financing programmes for organizing bicycle rallies to promote peace \nand development, preservation of the environment, institutional development and \nphysical and social infrastructure, \n \nNoting that major international and local cycling competitions should be \norganized in the spirit of peace, mutual understanding, friendship, tolerance and \ninadmissibility of discrimination of any kind and that the unifying and conciliative \nnature of such events should be respected, \n \n1. \nDecides to declare 3 June World Bicycle Day; \n \n2. \nInvites all Member States, organizations of the United Nations system and \nother relevant international organizations, international, regional and national sports \norganizations, civil society, including non-governmental organizations and the private \nsector, and all other relevant stakeholders to cooperate in observing World Bicycle \nDay, to celebrate the Day and to promote awareness of it; \n \n3. \nEncourages Member States to devote particular attention to the bicycle in \ncross-cutting development strategies and to include the bicycle in international, \nregional, national and subnational development policies and programmes, as \nappropriate; \n \n4. \nAlso encourages Member States to improve road safety and integrate it \ninto sustainable mobility and transport infrastructure planning and design, in \nparticular through policies and measures to actively protect and promote pedestrian \nsafety and cycling mobility, with a view to broader health outcomes, particularly the \nprevention of injuries and non-communicable diseases; \n \n5. \nEncourages stakeholders to emphasize and advance the use of the bicycle \nas a means of fostering sustainable development, strengthening education, including \nphysical education, for children and young people, promoting health, preventing \ndisease, promoting tolerance, mutual understanding and respect and facilitating social \ninclusion and a culture of peace; \n \n6. \nEncourages Member States to adopt best practices and means to promote \nthe bicycle among all members of society, and in this regard welcomes initiatives to \norganize bicycle rides at the national and local levels as a means of strengthening \nphysical and mental health and well-being and developing a culture of cycling in \nsociety; \n\nWorld Bicycle Day \nA/RES/72/272\n \n3/3\n18-05867 \n \n \n7. \nRequests the Secretary-General to bring the present resolution to the \nattention of Member States and the organizations of the United Nations system; \n \n8. \nStresses that the cost of all activities that may arise from the \nimplementation of the present resolution should be met from voluntary contributions. \n \n82nd plenary meeting  \n12 April 2018 \n \n",
  "paragraphs": {
    "1": "Decides to declare 3 June World Bicycle Day;",
    "2": "Invites all Member States, organizations of the United Nations system and other relevant international organizations, international, regional and national sports organizations, civil society, including non-governmental organizations and the private sector, and all other relevant stakeholders to cooperate in observing World Bicycle Day, to celebrate the Day and to promote awareness of it;",
    "3": "Encourages Member States to devote particular attention to the bicycle in cross-cutting development strategies and to include the bicycle in international, regional, national and subnational development policies and programmes, as appropriate;",
    "4": "Also encourages Member States to improve road safety and integrate it into sustainable mobility and transport infrastructure planning and design, in particular through policies and measures to actively protect and promote pedestrian safety and cycling mobility, with a view to broader health outcomes, particularly the prevention of injuries and non-communicable diseases;",
    "5": "Encourages stakeholders to emphasize and advance the use of the bicycle as a means of fostering sustainable development, strengthening education, including physical education, for children and young people, promoting health, preventing disease, promoting tolerance, mutual understanding and respect and facilitating social inclusion and a culture of peace;",
    "6": "Encourages Member States to adopt best practices and means to promote the bicycle among all members of society, and in this regard welcomes initiatives to organize bicycle rides at the national and local levels as a means of strengthening physical and mental health and well-being and developing a culture of cycling in society; World Bicycle Day A/RES/72/272 3/3 18-05867",
    "7": "Requests the Secretary-General to bring the present resolution to the attention of Member States and the organizations of the United Nations system;",
    "8": "Stresses that the cost of all activities that may arise from the implementation of the present resolution should be met from voluntary contributions. 82nd plenary meeting 12 April 2018"
  },
  "agenda_items": [
    "Item 11"
  ],
  "symbol_references": [
    "A/72/L.43"
  ]
}