{
  "symbol": "A/RES/74/289",
  "filename": "A_RES_74_289.pdf",
  "title": "74/289. Financing of the United Nations Mission in Liberia",
  "text": "United Nations \nA/RES/74/289 \n \n \nGeneral Assembly \nDistr.: General \n13 July 2020 \n \n20-08799 (E)    160720 \n*2008799* \n \n \nSeventy-fourth session \nAgenda item 158 \nFinancing of the United Nations Mission in Liberia \n \n \n \n \n Resolution adopted by the General Assembly \non 30 June 2020 \n \n \n \n \n[on the report of the Fifth Committee (A/74/917)] \n \n \n 74/289. Financing of the United Nations Mission in Liberia \n \n \n \nThe General Assembly, \n \nHaving considered the report of the Secretary-General on the financing of the \nUnited Nations Mission in Liberia1 and the related report of the Advisory Committee \non Administrative and Budgetary Questions,2 \n \nRecalling Security Council resolution 1497 (2003) of 1 August 2003, by which \nthe Council declared its readiness to establish a United Nations stabilization force to \nsupport the transitional government and to assist in the implementation of a \ncomprehensive peace agreement in Liberia, \n \nRecalling also Security Council resolution 1509 (2003) of 19 September 2003, \nby which the Council established the United Nations Mission in Liberia for a period \nof 12 months, and the subsequent resolutions by which the Council extended the \nmandate of the Mission, the latest of which was resolution 2333 (2016) of \n23 December 2016, by which the Council extended the mandate of the Mission for a \nfinal period until 30 March 2018 and requested the Secretary-General to complete by \n30 April 2018 the withdrawal of all uniformed and civilian components, other than \nthose required to complete the liquidation of the Mission, \n \nRecalling further its resolution 58/315 of 1 July 2004, \n \nRecalling its resolution 58/261 A of 23 December 2003 on the financing of the \nMission and its subsequent resolutions thereon, the latest of which was resolution \n73/319 of 3 July 2019, as well as its decision 73/555 of 3 July 2019, \n__________________ \n \n1 A/74/726. \n \n2 A/74/828. \n\nA/RES/74/289 \nFinancing of the United Nations Mission in Liberia\n \n20-08799\n2/2 \n \n \nReaffirming the general principles underlying the financing of United Nations \npeacekeeping operations, as stated in its resolutions 1874 (S-IV) of 27 June 1963, \n3101 (XXVIII) of 11 December 1973 and 55/235 of 23 December 2000, \n \n1. \nTakes note of the status of contributions to the United Nations Mission in \nLiberia as at 30 April 2020, including the contributions outstanding in the amount of \n9.1 million United States dollars, representing some 0.1 per cent of the total assessed \ncontributions, notes with concern that only 161 Member States have paid their \nassessed contributions in full, and urges all other Member States, in particular those \nin arrears, to ensure payment of their outstanding assessed contributions; \n \n2. \nExpresses its appreciation to those Member States that have paid their \nassessed contributions in full, and urges all other Member States to make every \npossible effort to ensure payment of their assessed contributions to the Mission in full; \n \n3. \nEndorses the conclusions and recommendations contained in the report of \nthe Advisory Committee on Administrative and Budgetary Questions,2 and requests \nthe Secretary-General to ensure their full implementation; \n \n \n \nFinal disposition of the assets of the United Nations Mission in Liberia \n \n \n4. \nTakes note of the report of the Secretary-General on the final disposition \nof the assets of the United Nations Mission in Liberia;1 \n \n5. \nRequests the Secretary-General to continue his efforts to identify and \naddress on time and in full all the residual activities, including unforeseen liabilities \nidentified after the closure of the Mission, and stresses the importance of raising the \nawareness of contractors regarding the settlement of any residual claims; \n \n6. \nWelcomes the effort of the Secretary-General to reduce the overall \nenvironmental footprint of the Mission, in cooperation with Liberian authorities, and \nstresses the necessity to further ensure that all relevant measures are taken in line with \nthe respective regulations and rules in order to ensure an environmentally responsible \nclosure of the Mission; \n \n7. \nDecides to include in the provisional agenda of its seventy-fifth session \nthe item entitled \u201cFinancing of the United Nations Mission in Liberia\u201d. \n \n30 June 2020 \n \n",
  "paragraphs": {
    "1": "Takes note of the status of contributions to the United Nations Mission in Liberia as at 30 April 2020, including the contributions outstanding in the amount of 9.1 million United States dollars, representing some 0.1 per cent of the total assessed contributions, notes with concern that only 161 Member States have paid their assessed contributions in full, and urges all other Member States, in particular those in arrears, to ensure payment of their outstanding assessed contributions;",
    "2": "Expresses its appreciation to those Member States that have paid their assessed contributions in full, and urges all other Member States to make every possible effort to ensure payment of their assessed contributions to the Mission in full;",
    "3": "Endorses the conclusions and recommendations contained in the report of the Advisory Committee on Administrative and Budgetary Questions,2 and requests the Secretary-General to ensure their full implementation; Final disposition of the assets of the United Nations Mission in Liberia",
    "4": "Takes note of the report of the Secretary-General on the final disposition of the assets of the United Nations Mission in Liberia;1",
    "5": "Requests the Secretary-General to continue his efforts to identify and address on time and in full all the residual activities, including unforeseen liabilities identified after the closure of the Mission, and stresses the importance of raising the awareness of contractors regarding the settlement of any residual claims;",
    "6": "Welcomes the effort of the Secretary-General to reduce the overall environmental footprint of the Mission, in cooperation with Liberian authorities, and stresses the necessity to further ensure that all relevant measures are taken in line with the respective regulations and rules in order to ensure an environmentally responsible closure of the Mission;",
    "7": "Decides to include in the provisional agenda of its seventy-fifth session the item entitled \u201cFinancing of the United Nations Mission in Liberia\u201d. 30 June 2020"
  },
  "agenda_items": [
    "Item 158"
  ],
  "symbol_references": []
}