{
  "symbol": "A/RES/76/174",
  "filename": "A_RES_76_174.pdf",
  "title": "76/174. Implementing the Declaration on the Right and Responsibility of Individuals, Groups and Organs of Society to Promote and Protect Universally Recognized Human Rights and Fundamental Freedoms through providing a safe and enabling environment for human rights defenders and ensuring their protection, including in the context of and recovery from the coronavirus disease (COVID-19) pandemic",
  "text": "United Nations \nA/RES/76/174\n \n \nGeneral Assembly \nDistr.: General \n10 January 2022 \n \n21-19209 (E)    140122 \n*2119209* \n \n \nSeventy-sixth session \nAgenda item 74 (b) \nPromotion and protection of human rights: human \nrights questions, including alternative approaches for \nimproving the effective enjoyment of human rights and \nfundamental freedoms \n \n \n \n \n Resolution adopted by the General Assembly \non 16 December 2021 \n \n \n \n \n[on the report of the Third Committee (A/76/462/Add.2, para. 114)] \n \n \n 76/174. Implementing the Declaration on the Right and Responsibility of \nIndividuals, Groups and Organs of Society to Promote and \nProtect Universally Recognized Human Rights and Fundamental \nFreedoms through providing a safe and enabling environment \nfor human rights defenders and ensuring their protection, \nincluding in the context of and recovery from the coronavirus \ndisease (COVID-19) pandemic \n \n \n \nThe General Assembly, \n \nGuided by the purposes and principles of the Charter of the United Nations, \n \nGuided also by the Universal Declaration of Human Rights,1 the International \nCovenants on Human Rights2 and other relevant instruments, \n \nRecalling its resolution 53/144 of 9 December 1998, by which it adopted by \nconsensus the Declaration on the Right and Responsibility of Individuals, Groups and \nOrgans of Society to Promote and Protect Universally Recognized Human Rights and \nFundamental Freedoms, commonly referred to as the Declaration on Human Rights \nDefenders, and encouraging States to uphold the purposes, principles and provisions \nof the Declaration in the context of its implementation, \n \nStressing, in this regard, that all human rights and fundamental freedoms apply \nto all persons equally, including human rights defenders, in the context of the \n__________________ \n \n1 Resolution 217 A (III). \n \n2 Resolution 2200 A (XXI), annex. \n\nA/RES/76/174 \nImplementing the Declaration on the Right and Responsibility of Individuals, \nGroups and Organs of Society to Promote and Protect Universally Recognized \nHuman Rights and Fundamental Freedoms through providing a safe and enabling \nenvironment for human rights defenders and ensuring their protection, including in \nthe context of and recovery from the coronavirus disease (COVID-19) pandemic \n \n21-19209\n2/8 \n \nDeclaration, and that these rights and freedoms must be respected, protected and \nfulfilled without discrimination, \n \nRecalling all other previous resolutions on this subject, including its resolutions \n66/164 of 19 December 2011, 68/181 of 18 December 2013, 70/161 of 17 December \n2015, 72/247 of 24 December 2017 and 74/146 of 18 December 2019 and Human Rights \nCouncil resolutions 13/13 of 25 March 2010,3 22/6 of 21 March 2013,4 31/32 of 24 March \n2016,5 34/5 of 23 March 2017,6 40/11 of 21 March 20197 and 43/16 of 22 June 2020,8 \n \nReaffirming that States have the primary responsibility and are under the \nobligation to respect, promote and protect all human rights and fundamental freedoms \nof all persons, \n \nReiterating that all human rights and fundamental freedoms are universal, \nindivisible, interdependent and interrelated and should be promoted and implemented \nin a fair and equitable manner, without prejudice to the implementation of each of \nthose rights and freedoms, \n \nReaffirming the importance of the Declaration on Human Rights Defenders and \nits full and effective implementation, and that promoting respect, support and \nprotection for the activities of human rights defenders, including women, indigenous \nand environmental human rights defenders, is essential to the overall enjoyment of \nhuman rights, and recognizing the substantial role that human rights defenders can \nplay in supporting efforts to strengthen conflict prevention, peace and sustainable \ndevelopment, including environmental protection, through dialogue, openness, \nparticipation and justice, including by monitoring, reporting on and contributing to \nthe promotion and protection of all civil, political, economic, social and cultural \nrights, and other rights, including the right to development, and in the context of the \nimplementation of the 2030 Agenda for Sustainable Development,9 \n \nRecognizing the positive, important and legitimate role played by human rights \ndefenders in the promotion and protection of human rights as they relate to the \nenjoyment of a safe, clean, healthy and sustainable environment, and deeply \nconcerned that human rights defenders working in environmental matters, referred to \nas environmental human rights defenders, are among the human rights defenders most \nexposed and at risk, \n \nUnderscoring the positive, important and legitimate role of human rights \ndefenders in promoting and advocating the realization of all human rights, at the local, \nnational, regional and international levels, including by engaging with Governments \nand contributing to the efforts in the implementation of the obligations and \ncommitments of States in this regard, \n \nStressing that, in the exercise of the rights and freedoms referred to in the \nDeclaration, human rights defenders, acting individually and in association with \nothers, shall be subject only to such limitations as are in accordance with applicable \ninternational obligations and are determined by law solely for the purpose of securing \ndue recognition and respect for the rights and freedoms of others and of meeting the \n__________________ \n \n3 See Official Records of the General Assembly, Sixty-fifth Session, Supplement No. 53 and \ncorrigendum (A/65/53 and A/65/53/Corr.1), chap. II, sect. A. \n \n4 Ibid., Sixty-eighth Session, Supplement No. 53 (A/68/53), chap. IV, sect. A. \n \n5 Ibid., Seventy-first Session, Supplement No. 53 (A/71/53), chap. IV, sect. A. \n \n6 Ibid., Seventy-second Session, Supplement No. 53 (A/72/53), chap. IV, sect. A. \n \n7 Ibid., Seventy-fourth Session, Supplement No. 53 (A/74/53), chap. IV, sect. A. \n \n8 Ibid., Seventy-fifth Session, Supplement No. 53 (A/75/53), chap. IV, sect. A. \n \n9 Resolution 70/1. \n\nImplementing the Declaration on the Right and Responsibility of Individuals, \nGroups and Organs of Society to Promote and Protect Universally Recognized \nHuman Rights and Fundamental Freedoms through providing a safe and enabling \nenvironment for human rights defenders and ensuring their protection, including in \nthe context of and recovery from the coronavirus disease (COVID-19) pandemic \nA/RES/76/174\n \n3/8\n21-19209 \n \njust requirements of morality, public order and the general welfare in a democratic \nsociety, \n \nUnderscoring that the legal framework within which human rights defenders work \npeacefully to promote and protect human rights and fundamental freedoms is that of \nnational legislation consistent with the Charter and international human rights law, \n \nWelcoming the steps taken by some States to create a safe and enabling \nenvironment, online and offline, for the promotion, protection and defence of human \nrights, and recognizing in this regard the positive efforts by authorities, national \nhuman rights institutions, where they exist, and civil society towards the development \nand enactment of relevant national policies, laws, programmes and practices, and the \nmonitoring of their implementation, \n \nMindful that domestic law and administrative provisions and their application \nshould not hinder but enable the work, both online and offline, of human rights \ndefenders, including by avoiding any criminalization, stigmatization, impediments, \nobstructions or restrictions thereof, contrary to the obligations and commitments of \nStates under international human rights law, \n \nRecognizing that, while the institutional measures for the protection of human \nrights defenders and the promotion of their work within the United Nations, regional \norganizations and national systems have grown in number since the adoption of the \nDeclaration, they remain insufficient to address the ongoing human rights violations \nand abuses against human rights defenders around the world, and that strengthened \nefforts are required for the effective implementation of the Declaration, \n \nDeeply concerned about the loss of life and livelihoods and the disruption to \neconomies and societies caused by the coronavirus disease (COVID-19) pandemic, \nand its negative impact on the enjoyment of human rights, including on the \nadvancement of gender equality, around the world and on those on the front line \nproviding support to their communities, including human rights defenders, \n \nRecognizing that the pandemic has exacerbated and accelerated existing \nchallenges, both online and offline, for human rights defenders regarding their safety \nand participation, including misinformation and disinformation; acts of intimidation, \nsuch as smear campaigns, incitement to discrimination or violence, unlawful or \narbitrary surveillance, attacks and killings; restrictions on access to resources; and \nrestrictions on the rights of peaceful assembly, to freedom of association, and to \nfreedom of expression; and has increased the impact of the digital divides, \n \nReaffirming that emergency measures taken by Governments in response to the \nCOVID-19 pandemic must be necessary, proportionate to the evaluated risk and \napplied in a non-discriminatory and transparent way, have a specific focus and time-\nlimited duration and be in accordance with the State\u2019s obligations under applicable \ninternational human rights law, \n \nRecognizing the positive, important and legitimate role played by human rights \ndefenders, including women human rights defenders, in the promotion and protection \nof human rights in the COVID-19 pandemic response and recovery, and that human \nrights defenders, civil society and journalists working both online and offline at the \nlocal, national, regional and international levels are critical to providing accurate \ninformation about the situation and needs on the ground, contributing to designing \nand implementing responsive measures adopted by the authorities that are inclusive, \nsafe, enabling and accessible for all, including for persons with disabilities, providing \nessential services and feedback on recovery and response measures, pursuing \ntransparency and accountability, and countering disinformation and misinformation, \n\nA/RES/76/174 \nImplementing the Declaration on the Right and Responsibility of Individuals, \nGroups and Organs of Society to Promote and Protect Universally Recognized \nHuman Rights and Fundamental Freedoms through providing a safe and enabling \nenvironment for human rights defenders and ensuring their protection, including in \nthe context of and recovery from the coronavirus disease (COVID-19) pandemic \n \n21-19209\n4/8 \n \n \nGravely concerned that national security, counter-terrorism and cybercrime \nlegislation and other measures, such as laws regulating civil society organizations, \nare in some instances misused to target human rights defenders or have hindered their \nwork and endangered their safety in a manner contrary to international law, \n \nRecognizing the pressing importance of addressing, and taking concrete steps to \nprevent and stop, the use of legislation to hinder or limit unduly the ability of human \nrights defenders to exercise their work and access resources, including by reviewing \nand, where necessary, amending relevant legislation and its implementation in order \nto ensure compliance with international human rights law, \n \nRecognizing also that the protection of human rights defenders can be fully \nachieved only in the context of a holistic approach that includes the strengthening of \ndemocratic institutions, safeguarding civic space, the fight against impunity, ending \ngender and economic inequality and social exclusion, and equal access to justice, \n \nStressing the importance of meaningful participation of human rights defenders \nin the implementation of the Declaration, and reaffirming the right of everyone, \nindividually and in association with others, to unhindered access to and \ncommunication with international bodies, both online and offline, in particular the \nUnited Nations, its representatives and mechanisms in the field of human rights, \nincluding the Human Rights Council and its special procedures, the universal periodic \nreview mechanism and treaty bodies, as well as regional human rights mechanisms, \nin accordance with their respective mandates, existing rules of procedure and \nmodalities, without fear of reprisals, \n \nStressing also the need for further action by States and non-State actors to promote \na safe and enabling environment for hu man rights defenders and their protection, taking \ninto account their diversity and the diverse contexts in which they operate, \n \n1. \nAffirms the important role of human rights defenders in supporting States \nto realize the 2030 Agenda for Sustainable Development, including the pledge that no \none will be left behind and to reach the furthest behind first; \n \n2. \nNotes the guidance of the United Nations High Commissioner for Human \nRights on human rights-compliant responses to the COVID-19 pandemic and the \nSecretary-General\u2019s policy brief on COVID-19 and human rights entitled \u201cWe are all \nin this together\u201d; \n \n3. \nRecognizes the positive, important and legitimate role played by human \nrights defenders in the promotion and protection of human rights in the COVID-19 \nresponse and recovery, mindful of the impact of the COVID-19 pandemic on the \nenjoyment of human rights around the world, particularly the rights of women and \nchildren, reaffirms the utility and benefit of regular consultations and dialogue with \ncivil society, including human rights defenders, on the development and \nimplementation of public policies, programmes and emergency measures related to \nthe COVID-19 response and recovery and ensuring that measures adopted by \nauthorities are inclusive, safe and enabling, underscores in this regard the significant \nrole of human rights defenders in identifying and raising awareness of human rights \nimpacts and risks of COVID-19-related emergency measures, including by expressing \ntheir views, concerns, support, criticism or dissent regarding government policy, \nincluding public health and infection control issues, on workplace health, safety and \nrights, and in their communities, and underlines the need for States to take the \nmeasures necessary to safeguard space for such public dialogue and its participants; \n \n4. \nCalls upon States to ensure that COVID-19-related emergency measures \nare not misused to endanger the safety of human rights defenders, or unduly hinder \n\nImplementing the Declaration on the Right and Responsibility of Individuals, \nGroups and Organs of Society to Promote and Protect Universally Recognized \nHuman Rights and Fundamental Freedoms through providing a safe and enabling \nenvironment for human rights defenders and ensuring their protection, including in \nthe context of and recovery from the coronavirus disease (COVID-19) pandemic \nA/RES/76/174\n \n5/8\n21-19209 \n \ntheir work, including by limiting the right to freedom of expression in a manner \ncontrary to international law; \n \n5. \nExpresses grave concern at the situation of human rights defenders around \nthe world, strongly condemns the violence against and the criminalization, \nintimidation, attacks, torture, enforced disappearance, killing of and all other human \nrights violations or abuses against human rights defenders, including women, \nenvironmental and indigenous human rights defenders, by State and non-State actors, \nand stresses the need to combat impunity by ensuring that those responsible for \nviolations and abuses against human rights defenders, including against their legal \nrepresentatives, associates and family members, are promptly brought to justice \nthrough impartial investigations; \n \n6. \nCondemns all acts of intimidation and reprisal, both online and offline, by \nState and non-State actors against individuals, groups and organs of society, including \nagainst human rights defenders and their legal representatives, associates and family \nmembers, who seek to cooperate, are cooperating or have cooperated with \nsubregional, regional and international bodies, including the United Nations, its \nrepresentatives and mechanisms, in the field of human rights, and strongly calls upon \nall States to give effect to the right of everyone, individually and in association with \nothers, to unhindered access to and communication with international bodies, \nincluding the United Nations, its special procedures, the universal periodic review \nmechanism and the treaty bodies, as well as regional human rights mechanisms; \n \n7. \nWelcomes the work and takes note of the reports of the Special Rapporteur \nof the Human Rights Council on the situation of human rights defenders presented to \nthe Human Rights Council and the General Assembly, and encourages all States to \nconsider implementing recommendations contained in the reports and to cooperate \nwith and assist the Special Rapporteur; \n \n8. \nCalls upon States to ensure that the criminalization and prosecution of \nterrorism or national security offences, and the measures used to address threats in \nthis regard, are in accordance with their obligations under international human rights \nlaw, to avoid endangering the safety of human rights defenders or unduly hindering \ntheir work; \n \n9. \nAlso calls upon States to take concrete steps to prevent and put an end to \narbitrary arrest and detention, including of human rights defenders, and in this regard \nstrongly urges the release of persons detained or imprisoned, in violation of the \nobligations and commitments of States under international human rights law, for \nexercising their human rights and fundamental freedoms, such as the rights to freedom \nof expression, peaceful assembly and association, including in relation to cooperation \nwith the United Nations or other international mechanisms in the area of human rights; \n \n10. Urges States to promote a safe and enabling environment, online and \noffline, including through the implementation of existing national legislation that is \nin compliance with international human rights law and, where necessary, through the \nadoption and implementation of more comprehensive legislative and administrative \nmeasures, in which human rights defenders can operate free from hindrance, arbitrary \nor unlawful surveillance, reprisals and insecurity, ensuring, among other things, the \nright to take part in the conduct of public affairs and in cultural life, the freedom to \nseek, receive and impart information and equal access to justice, including to an \neffective remedy; \n \n11. Continues to express particular concern about systemic and structural \ndiscrimination, \neconomic \ndisenfranchisement, \nviolence \nand \nharassment \ndisproportionately faced by women human rights defenders in diverse situations and \n\nA/RES/76/174 \nImplementing the Declaration on the Right and Responsibility of Individuals, \nGroups and Organs of Society to Promote and Protect Universally Recognized \nHuman Rights and Fundamental Freedoms through providing a safe and enabling \nenvironment for human rights defenders and ensuring their protection, including in \nthe context of and recovery from the coronavirus disease (COVID-19) pandemic \n \n21-19209\n6/8 \n \nconditions, including sexual and gender-based violence as well as defamation and \nsmear campaigns, both online and offline, and reiterates its strong call upon States to \ntake appropriate, robust and practical steps to protect women human rights defenders \nand to integrate a gender perspective into their efforts to create a safe and enabling \nenvironment for the defence of human rights; \n \n12. Recognizes young people\u2019s essential contributions to defending human \nrights, democracy and the rule of law and expresses deep concern about the threats, \nhuman rights violations and abuses and discrimination young people may face because \nof their age and the nature of their civic engagement and as a result of their activities in \npromoting human rights, and in this regard calls upon States to provide a safe, enabling \nand empowering environment for young people to promote human rights; \n \n13. Also recognizes that democracy and the rule of law are essential \ncomponents for the creation of a safe and enabling environment, and the protection \nof human rights defenders, and urges States to take measures to strengthen democratic \ninstitutions, safeguard civic space, uphold the rule of law and combat impunity; \n \n14. Calls upon States to promote, through public statements, policies, \nprogrammes or laws, the important and legitimate role of human rights defenders in \nthe promotion of all human rights, democracy and the rule of law as essential \ncomponents of ensuring their protection, including by respecting the independence of \ntheir organizations and by denouncing the stigmatization of their work; \n \n15. Calls upon all States to take all measures necessary to ensure the rights \nand safety of all persons, including human rights defenders, who exercise, inter alia, \nthe rights to freedom of opinion, expression, peaceful assembly and association, \nwhich are essential for the promotion and protection of human rights; \n \n16. Calls upon States and encourages non-State actors to ensure that those \ninvolved in the protection of human rights defenders, their legal representatives, \nassociates or family members are trained in human rights and the protection-related \nneeds of human rights defenders at risk; \n \n17. Underlines the legitimate and valuable role of human rights defenders in \nmediation efforts and in supporting victims in accessing effective remedies for \nviolations and abuses of their human rights, including economic, social and cultural \nrights, including for members of impoverished communities and communities in \nvulnerable situations and for those belonging to minorities and indigenous peoples; \n \n18. Calls upon States to take appropriate measures for the prevention of all \nforms of violence, intimidation, threats, harassment and attacks against human rights \ndefenders on the Internet and through digital technologies and tools, to refrain from \nthe use of surveillance technologies against human rights defenders, in a manner that \nis not compliant with international human rights obligations, and to protect human \nrights defenders, including women human rights defenders, in online spaces and to \nconsider adopting laws, policies and practices that protect them against online threats \nof violence and intimidation while also affirming the rights to freedom of expression \nand privacy, and further encourages social media companies to condemn attacks \nagainst human rights defenders when they occur on their platforms; \n \n19. Urges States to investigate, in a prompt, effective, independent and \naccountable manner, complaints and allegations regarding threats or human rights \nviolations and abuses perpetrated by State and non-State actors, including against \nhuman rights defenders, their legal representatives, associates or family members, \nand to initiate, when appropriate, proceedings against the perpetrators so as to ensure \nthat impunity for such acts is eliminated and, as far as possible, to report publicly on \ninvestigations and proceedings; \n\nImplementing the Declaration on the Right and Responsibility of Individuals, \nGroups and Organs of Society to Promote and Protect Universally Recognized \nHuman Rights and Fundamental Freedoms through providing a safe and enabling \nenvironment for human rights defenders and ensuring their protection, including in \nthe context of and recovery from the coronavirus disease (COVID-19) pandemic \nA/RES/76/174\n \n7/8\n21-19209 \n \n \n20. Calls upon States to develop and implement appropriate and effective \nprotection mechanisms for human rights defenders at risk or in vulnerable situations, \nincluding through meaningful consultation with them and based on comprehensive \nrisk analysis, and also to ensure that these mechanisms are holistic, appropriately \nresourced, age- and gender-sensitive, and respond to the protection needs of \nindividuals and the communities in which they live, functioning also as an early \nwarning to ensure that human rights defenders, when threatened, have immediate \naccess to authorities that are competent and adequately resourced to provide effective \nprotective measures, while further research should be undertaken, with a view to \nimproving the effectiveness of existing protection mechanisms; \n \n21. Underlines the value of national human rights institutions, established and \noperating in accordance with the principles relating to the status of national \ninstitutions for the promotion and protection of human rights (the Paris Principles), 10 \nin the continued engagement with human rights defenders and in the monitoring of \nexisting legislation and consistently informing the State about its impact on the \nactivities of human rights defenders, including by making relevant and concrete \nrecommendations, while noting with concern that national human rights institutions \nand their members and staff may themselves sometimes be in need of protection; \n \n22. Strongly encourages States to develop and put in place comprehensive, \nsustainable and age- and gender-responsive public policies and programmes that \nsupport and protect human rights defenders at all stages of their work, online and \noffline, that ensure effective coordination between relevant institutional actors, \nincluding coordination within national and local levels, and address causes of attacks \nagainst defenders and barriers against the defence of rights, and that take into account, \ninter alia, the diversity of human rights defenders and the diverse contexts in which \nthey operate, and the intersectional dimensions of violations and abuses against \nwomen human rights defenders, indigenous peoples, children, persons with \ndisabilities, persons belonging to minorities and rural communities; \n \n23. Strongly reaffirms the urgent need to respect, protect, facilitate and \npromote the work of human rights defenders promoting and defending economic, \nsocial and cultural rights, as a vital factor contributing towards the realization of those \nrights, including as they relate to environmental, land and indigenous issues and \nbusiness activity, as well as development, including through corporate accountability; \n \n24. Urges non-State actors, including transnational corporations and other \nbusiness enterprises, to assume their responsibility to respect the human rights and \nfundamental freedoms of all persons, including human rights defenders, and \nunderlines the need to ensure human rights due diligence and the accountability of, \nand the provision of adequate remedies by, transnational corporations and other \nbusiness enterprises, while also urging States to adopt relevant policies and laws in \nthis regard, including to hold all companies to account for involvement in threats or \nattacks against human rights defenders; \n \n25. Recognizes the important contribution of the promotion and protection of \nthe safety of human rights defenders in the realization of the Sustainable Development \nGoals, including target 16.10, and calls upon States to strengthen national disaggregated \ndata collection, analysis and reporting on the number of verified cases of killing, \nkidnapping, enforced disappearance, arbitrary detention, torture and other harmful acts \nagainst human rights advocates, as reflected in Sustainable Development Goal indicator \n16.10.1, and to do their utmost to make these data available to the relevant entities; \n__________________ \n \n10 Resolution 48/134, annex. \n\nA/RES/76/174 \nImplementing the Declaration on the Right and Responsibility of Individuals, \nGroups and Organs of Society to Promote and Protect Universally Recognized \nHuman Rights and Fundamental Freedoms through providing a safe and enabling \nenvironment for human rights defenders and ensuring their protection, including in \nthe context of and recovery from the coronavirus disease (COVID-19) pandemic \n \n21-19209\n8/8 \n \n \n26. Calls upon all States and encourages non-State actors to implement the \nGuiding Principles on Business and Human Rights: Implementing the United Nations \n\u201cProtect, Respect and Remedy\u201d Framework,11 underscores the responsibility of all \nbusiness enterprises, both transnational and other, to respect human rights, including \nthe rights to life and to liberty and security of person of human rights defenders, and \ntheir exercise of the rights to freedom of expression, peaceful assembly and \nassociation, and participation in the conduct of public affairs, and underscores further \nthe importance that business enterprises establish or participate in effective and \naccessible operational-level grievance mechanisms for individuals and communities \nwho may be adversely impacted; \n \n27. \nTakes note of the Secretary-General\u2019s Call to Action for Human Rights, and \nthe United Nations Guidance Note on the Protection and Promotion of Civic Space; \n \n28. Encourages all concerned United Nations system entities and organizations, \nwithin their mandates, to implement the United Nations Guidance Note on the Protection \nand Promotion of Civic Space, and to consider ways in which they can assist States, upon \ntheir request, in creating and maintaining a safe and enabling environment for human \nrights defenders, including women human rights defenders, and ensuring their protection; \n \n29. Encourages the Office of the United Nations High Commissioner for \nHuman Rights, in consultation with the Special Rapporteur and other special \nprocedures of the Human Rights Council, to continue to compile and share \ninformation on best practices and challenges for the development of a more coherent \napproach to support the Declaration by the United Nations; \n \n30. Requests all concerned United Nations system entities and organizations, \nwithin their mandates, to provide all possible assistance and support to the Special \nRapporteur for the effective fulfilment of her mandate, including in the context of \ncountry visits and through suggestions on ways and means of ensuring the protection \nof human rights defenders; \n \n31. Requests the Special Rapporteur to continue to report annually on her \nactivities to the General Assembly and the Human Rights Council, in accordance with \nthe mandate; \n \n32. Decides to remain seized of the matter. \n \n53rd plenary meeting \n16 December 2021 \n \n__________________ \n \n11 A/HRC/17/31, annex. \n",
  "paragraphs": {
    "1": "Affirms the important role of human rights defenders in supporting States to realize the 2030 Agenda for Sustainable Development, including the pledge that no one will be left behind and to reach the furthest behind first;",
    "2": "Notes the guidance of the United Nations High Commissioner for Human Rights on human rights-compliant responses to the COVID-19 pandemic and the Secretary-General\u2019s policy brief on COVID-19 and human rights entitled \u201cWe are all in this together\u201d;",
    "3": "Recognizes the positive, important and legitimate role played by human rights defenders in the promotion and protection of human rights in the COVID-19 response and recovery, mindful of the impact of the COVID-19 pandemic on the enjoyment of human rights around the world, particularly the rights of women and children, reaffirms the utility and benefit of regular consultations and dialogue with civil society, including human rights defenders, on the development and implementation of public policies, programmes and emergency measures related to the COVID-19 response and recovery and ensuring that measures adopted by authorities are inclusive, safe and enabling, underscores in this regard the significant role of human rights defenders in identifying and raising awareness of human rights impacts and risks of COVID-19-related emergency measures, including by expressing their views, concerns, support, criticism or dissent regarding government policy, including public health and infection control issues, on workplace health, safety and rights, and in their communities, and underlines the need for States to take the measures necessary to safeguard space for such public dialogue and its participants;",
    "4": " their work, including by limiting the right to freedom of expression in a manner contrary to international law;",
    "5": "Expresses grave concern at the situation of human rights defenders around the world, strongly condemns the violence against and the criminalization, intimidation, attacks, torture, enforced disappearance, killing of and all other human rights violations or abuses against human rights defenders, including women, environmental and indigenous human rights defenders, by State and non-State actors, and stresses the need to combat impunity by ensuring that those responsible for violations and abuses against human rights defenders, including against their legal representatives, associates and family members, are promptly brought to justice through impartial investigations;",
    "6": "Condemns all acts of intimidation and reprisal, both online and offline, by State and non-State actors against individuals, groups and organs of society, including against human rights defenders and their legal representatives, associates and family members, who seek to cooperate, are cooperating or have cooperated with subregional, regional and international bodies, including the United Nations, its representatives and mechanisms, in the field of human rights, and strongly calls upon all States to give effect to the right of everyone, individually and in association with others, to unhindered access to and communication with international bodies, including the United Nations, its special procedures, the universal periodic review mechanism and the treaty bodies, as well as regional human rights mechanisms;",
    "7": "Welcomes the work and takes note of the reports of the Special Rapporteur of the Human Rights Council on the situation of human rights defenders presented to the Human Rights Council and the General Assembly, and encourages all States to consider implementing recommendations contained in the reports and to cooperate with and assist the Special Rapporteur;",
    "8": "Calls upon States to ensure that the criminalization and prosecution of terrorism or national security offences, and the measures used to address threats in this regard, are in accordance with their obligations under international human rights law, to avoid endangering the safety of human rights defenders or unduly hindering their work;",
    "9": "Also calls upon States to take concrete steps to prevent and put an end to arbitrary arrest and detention, including of human rights defenders, and in this regard strongly urges the release of persons detained or imprisoned, in violation of the obligations and commitments of States under international human rights law, for exercising their human rights and fundamental freedoms, such as the rights to freedom of expression, peaceful assembly and association, including in relation to cooperation with the United Nations or other international mechanisms in the area of human rights;",
    "10": "Urges States to promote a safe and enabling environment, online and offline, including through the implementation of existing national legislation that is in compliance with international human rights law and, where necessary, through the adoption and implementation of more comprehensive legislative and administrative measures, in which human rights defenders can operate free from hindrance, arbitrary or unlawful surveillance, reprisals and insecurity, ensuring, among other things, the right to take part in the conduct of public affairs and in cultural life, the freedom to seek, receive and impart information and equal access to justice, including to an effective remedy;",
    "11": " conditions, including sexual and gender-based violence as well as defamation and smear campaigns, both online and offline, and reiterates its strong call upon States to take appropriate, robust and practical steps to protect women human rights defenders and to integrate a gender perspective into their efforts to create a safe and enabling environment for the defence of human rights;",
    "12": "Recognizes young people\u2019s essential contributions to defending human rights, democracy and the rule of law and expresses deep concern about the threats, human rights violations and abuses and discrimination young people may face because of their age and the nature of their civic engagement and as a result of their activities in promoting human rights, and in this regard calls upon States to provide a safe, enabling and empowering environment for young people to promote human rights;",
    "13": "Also recognizes that democracy and the rule of law are essential components for the creation of a safe and enabling environment, and the protection of human rights defenders, and urges States to take measures to strengthen democratic institutions, safeguard civic space, uphold the rule of law and combat impunity;",
    "14": "Calls upon States to promote, through public statements, policies, programmes or laws, the important and legitimate role of human rights defenders in the promotion of all human rights, democracy and the rule of law as essential components of ensuring their protection, including by respecting the independence of their organizations and by denouncing the stigmatization of their work;",
    "15": "Calls upon all States to take all measures necessary to ensure the rights and safety of all persons, including human rights defenders, who exercise, inter alia, the rights to freedom of opinion, expression, peaceful assembly and association, which are essential for the promotion and protection of human rights;",
    "16": "Calls upon States and encourages non-State actors to ensure that those involved in the protection of human rights defenders, their legal representatives, associates or family members are trained in human rights and the protection-related needs of human rights defenders at risk;",
    "17": "Underlines the legitimate and valuable role of human rights defenders in mediation efforts and in supporting victims in accessing effective remedies for violations and abuses of their human rights, including economic, social and cultural rights, including for members of impoverished communities and communities in vulnerable situations and for those belonging to minorities and indigenous peoples;",
    "18": "Calls upon States to take appropriate measures for the prevention of all forms of violence, intimidation, threats, harassment and attacks against human rights defenders on the Internet and through digital technologies and tools, to refrain from the use of surveillance technologies against human rights defenders, in a manner that is not compliant with international human rights obligations, and to protect human rights defenders, including women human rights defenders, in online spaces and to consider adopting laws, policies and practices that protect them against online threats of violence and intimidation while also affirming the rights to freedom of expression and privacy, and further encourages social media companies to condemn attacks against human rights defenders when they occur on their platforms;",
    "19": "",
    "20": "Calls upon States to develop and implement appropriate and effective protection mechanisms for human rights defenders at risk or in vulnerable situations, including through meaningful consultation with them and based on comprehensive risk analysis, and also to ensure that these mechanisms are holistic, appropriately resourced, age- and gender-sensitive, and respond to the protection needs of individuals and the communities in which they live, functioning also as an early warning to ensure that human rights defenders, when threatened, have immediate access to authorities that are competent and adequately resourced to provide effective protective measures, while further research should be undertaken, with a view to improving the effectiveness of existing protection mechanisms;",
    "21": "Underlines the value of national human rights institutions, established and operating in accordance with the principles relating to the status of national institutions for the promotion and protection of human rights (the Paris Principles), 10 in the continued engagement with human rights defenders and in the monitoring of existing legislation and consistently informing the State about its impact on the activities of human rights defenders, including by making relevant and concrete recommendations, while noting with concern that national human rights institutions and their members and staff may themselves sometimes be in need of protection;",
    "22": "Strongly encourages States to develop and put in place comprehensive, sustainable and age- and gender-responsive public policies and programmes that support and protect human rights defenders at all stages of their work, online and offline, that ensure effective coordination between relevant institutional actors, including coordination within national and local levels, and address causes of attacks against defenders and barriers against the defence of rights, and that take into account, inter alia, the diversity of human rights defenders and the diverse contexts in which they operate, and the intersectional dimensions of violations and abuses against women human rights defenders, indigenous peoples, children, persons with disabilities, persons belonging to minorities and rural communities;",
    "23": "Strongly reaffirms the urgent need to respect, protect, facilitate and promote the work of human rights defenders promoting and defending economic, social and cultural rights, as a vital factor contributing towards the realization of those rights, including as they relate to environmental, land and indigenous issues and business activity, as well as development, including through corporate accountability;",
    "24": "Urges non-State actors, including transnational corporations and other business enterprises, to assume their responsibility to respect the human rights and fundamental freedoms of all persons, including human rights defenders, and underlines the need to ensure human rights due diligence and the accountability of, and the provision of adequate remedies by, transnational corporations and other business enterprises, while also urging States to adopt relevant policies and laws in this regard, including to hold all companies to account for involvement in threats or attacks against human rights defenders;",
    "25": "Recognizes the important contribution of the promotion and protection of the safety of human rights defenders in the realization of the Sustainable Development Goals, including target 16.10, and calls upon States to strengthen national disaggregated data collection, analysis and reporting on the number of verified cases of killing, kidnapping, enforced disappearance, arbitrary detention, torture and other harmful acts against human rights advocates, as reflected in Sustainable Development Goal indicator 16.10.1, and to do their utmost to make these data available to the relevant entities;",
    "26": "Calls upon all States and encourages non-State actors to implement the Guiding Principles on Business and Human Rights: Implementing the United Nations \u201cProtect, Respect and Remedy\u201d Framework,11 underscores the responsibility of all business enterprises, both transnational and other, to respect human rights, including the rights to life and to liberty and security of person of human rights defenders, and their exercise of the rights to freedom of expression, peaceful assembly and association, and participation in the conduct of public affairs, and underscores further the importance that business enterprises establish or participate in effective and accessible operational-level grievance mechanisms for individuals and communities who may be adversely impacted;",
    "27": "Takes note of the Secretary-General\u2019s Call to Action for Human Rights, and the United Nations Guidance Note on the Protection and Promotion of Civic Space;",
    "28": "Encourages all concerned United Nations system entities and organizations, within their mandates, to implement the United Nations Guidance Note on the Protection and Promotion of Civic Space, and to consider ways in which they can assist States, upon their request, in creating and maintaining a safe and enabling environment for human rights defenders, including women human rights defenders, and ensuring their protection;",
    "29": "Encourages the Office of the United Nations High Commissioner for Human Rights, in consultation with the Special Rapporteur and other special procedures of the Human Rights Council, to continue to compile and share information on best practices and challenges for the development of a more coherent approach to support the Declaration by the United Nations;",
    "30": "Requests all concerned United Nations system entities and organizations, within their mandates, to provide all possible assistance and support to the Special Rapporteur for the effective fulfilment of her mandate, including in the context of country visits and through suggestions on ways and means of ensuring the protection of human rights defenders;",
    "31": "Requests the Special Rapporteur to continue to report annually on her activities to the General Assembly and the Human Rights Council, in accordance with the mandate;",
    "32": "Decides to remain seized of the matter."
  },
  "agenda_items": [
    "Item 74"
  ],
  "symbol_references": []
}