{
  "symbol": "A/RES/73/346",
  "filename": "A_RES_73_346.pdf",
  "title": "73/346. Multilingualism",
  "text": "United Nations \nA/RES/73/346 \n \n \nGeneral Assembly \nDistr.: General \n20 September 2019 \n \n19-15935 (E)    250919     \n*1915935* \n \n \nSeventy-third session \nAgenda item 127 \n \n \n \n \n Resolution adopted by the General Assembly \non 16 September 2019 \n \n \n \n \n[without reference to a Main Committee (A/73/L.114 and A/73/L.114/Add.1)] \n \n \n 73/346. Multilingualism \n \n \n \nThe General Assembly, \n \nRecognizing that multilingualism, as a core value of the Organization, \ncontributes to the achievement of the goals of the United Nations, as set out in \nArticle 1 of the Charter of the United Nations, \n \nBearing in mind that multilingualism is an enabler of multilateral diplomacy and \nthat it contributes to the promotion of the values of the United Nations, as well as the \nfaith of our peoples in the purposes and principles enshrined in its Charter, \n \nRecognizing that the United Nations pursues multilingualism as a means of \npromoting, protecting and preserving diversity of languages and cultures globally, as \nwell as of improving the efficiency, performance and transparency of the \nOrganization, \n \nRecognizing also, in this regard, that multilingualism promotes unity in \ndiversity and international understanding, tolerance and dialogue, and recognizing the \nimportance of the capacity to communicate to the peoples of the world in their own \nlanguages, including in formats accessible to persons with disabilities, by \ncontributing to the ownership and sustainability of the actions of the United Nations, \n \nStressing the need for strict observance of the resolutions and rules establishing \nlanguage arrangements for the different bodies and organs of the United Nations, \n \nRecalling that Arabic, Chinese, English, French, Russian and Spanish are both \nthe official and the working languages of the General Assembly, including its \ncommittees and subcommittees,1 and of the Security Council,2 that Arabic, Chinese, \nEnglish, French, Russian and Spanish are the official languages and English, French \n__________________ \n \n1  Rule 51 of the rules of procedure of the General Assembly. \n \n2  Rule 41 of the provisional rules of procedure of the Security Council. \n\nA/RES/73/346 \nMultilingualism\n \n19-15935\n2/12 \n \nand Spanish the working languages of the Economic and Social Council 3 and that \nEnglish and French are the working languages of the Secretariat, 4 \n \nEmphasizing the importance of multilingualism in the activities of the United \nNations, \n \nRecognizing the contribution of multilingualism in promoting international \npeace and security, development and human rights, through the work of the United \nNations departments and offices,  \n \nReaffirming its resolution 70/1 of 25 September 2015, entitled \u201cTransforming \nour world: the 2030 Agenda for Sustainable Development\u201d, and reaffirming its \nunwavering commitment to achieving the 2030 Agenda and utilizing it to transform \nour world for the better by 2030, \n \nRecalling its resolution 47/135 of 18 December 1992, by which it adopted the \nDeclaration on the Rights of Persons Belonging to National or Ethnic, Religious and \nLinguistic Minorities, and the International Covenant on Civil and Political Rights, 5 \nin particular article 27 thereof, concerning the rights of persons belonging to ethnic, \nreligious or linguistic minorities,  \n \nRecalling also its resolution 71/178 of 19 December 2016, in which it \nestablished 2019 as the International Year of Indigenous Languages, with a view to \nthe need to preserve, revitalize and promote indigenous languages,  \n \nRecalling further the decision taken by the General Conference of the United \nNations Educational, Scientific and Cultural Organization on 17 November 1999 that \n21 February should be proclaimed International Mother Language Day, \n \nRecalling its resolutions 2 (I) of 1 February 1946, 2480 B (XXIII) of \n21 December 1968, 42/207 C of 11 December 1987 and 50/11 of 2 November 1995 \nand other subsequent resolutions relating to multilingualism, including resolutions \n71/288 of 24 May 2017, 71/328 of 11 September 2017, 72/90 A and B of 7 December \n2017, 72/161 of 19 December 2017, 72/254 of 24 December 2017, 72/304 of 13 July \n2018, 72/313 of 17 September 2018, 73/102 A and B of 7 December 2018 and 73/270 \nof 22 December 2018,  \n \n1. \nTakes note of the report of the Secretary-General;6 \n \n \n \nI \n \n \nMultilingualism in general and the role of the Secretariat \n \n \n2. \nEmphasizes the paramount importance of the equality of the six official \nlanguages of the United Nations; \n \n3. \nUnderlines the need for the full implementation of all resolutions \nestablishing language arrangements for the official languages of the United Nations \nand the working languages of the Secretariat;  \n \n4. \nAlso underlines the responsibility of the Secretariat in integrating \nmultilingualism into its activities, from within existing resources, on an equitable \nbasis; \n \n5. \nNotes that the availability of United Nations documents in relevant official \nlanguages is limited in some areas of Secretariat activity, and therefore invites the \n__________________ \n \n3  Rule 32 of the rules of procedure of the Economic and Social Council. \n \n4  See resolution 2 (I), annex. \n \n5  See resolution 2200 A (XXI), annex. \n \n6  A/73/761. \n\nMultilingualism \nA/RES/73/346\n \n3/12\n19-15935 \n \nSecretary-General to take the appropriate measures to implement, within existing \nresources, current multilingualism policies, in compliance with relevant rules and \nregulations; \n \n6. \nRequests the Secretariat to continue to provide notes for the Presidents of \nthe main organs and the Chairs of their subsidiary bodies in the United Nations \nofficial language spoken by the presiding officer of the meeting; \n \n7. \nNotes that a high proportion of calls for bids are published in English, and \ntherefore encourages the Secretariat, where appropriate, to make use of existing \nmultilingualism policies to facilitate the participation of local vendors in the United \nNations procurement bidding process;  \n \n8. \nAlso notes that the Procurement Manual, published in three official \nlanguages, is in the process of being updated, and encourages the Secretariat to ensure \nthat the updates are reflected in all its language versions in an appropriate time frame; \n \n9. \nRecalls that the Secretary-General retains the authority to appoint a senior \nSecretariat official as the future Coordinator for Multilingualism, as first requested \nby the General Assembly in its resolution 54/64 of 6 December 1999;  \n \n10. Recalls with appreciation the appointment by the Secretary-General of the \nCoordinator for Multilingualism, who is responsible for the overall implementation \nof multilingualism Secretariat-wide, calls upon all departments and offices within the \nSecretariat to fully support the work of the Coordinator in the implementation of the \nrelevant mandates on multilingualism, and requests the Secretary-General to report \nthereon in his next report on multilingualism; \n \n11. Recalls its endorsement of the terms of reference for the Coordinator for \nMultilingualism, as proposed in report A/71/757 of the Secretary-General on \nmultilingualism;  \n \n12. Welcomes the designation of the Coordinator for Multilingualism as lead \nentity on multilingualism at the United Nations System Chief Executives Board for \nCoordination level, as well as the joint efforts of the Coordinator and the secretariat \nof the Chief Executives Board towards a more coordinated approach to \nmultilingualism across member organizations of the Board, with a view to sharing \ninformation on innovative solutions to common challenges;  \n \n13. Also welcomes the ongoing development of the network of focal points \nthat supports the Coordinator for Multilingualism in effectively and consistently \nimplementing relevant resolutions throughout all Secretariat entities and the United \nNations system;  \n \n14. Further welcomes the ongoing development of a Secretariat-wide coherent \npolicy framework on multilingualism to support a comprehensive and coordinated \napproach on multilingualism within the United Nations, taking into consideration the \nrelevant recommendations contained in the report of the Joint Inspection Unit on \nmultilingualism,7 and requests the Secretary-General to report on progress made at \nthe seventy-fifth session of the General Assembly;  \n \n15. Notes the difficulties reported by Secretariat entities in compiling accurate \nand comprehensive data for the report of the Secretary-General, owing, inter alia, to \nthe lack of disaggregated data by language, and welcomes efforts by the Coordinator \nfor Multilingualism to address the problem among Secretariat entities; \n \n16. Welcomes the efforts of the Coordinator for Multilingualism to encourage \nall Secretariat entities to promote the celebrations of a day dedicated to each of the \n__________________ \n \n7  A/67/78. \n\nA/RES/73/346 \nMultilingualism\n \n19-15935\n4/12 \n \nofficial languages of the United Nations, in order to inform and raise awareness of \ntheir history, culture and use, encourages the Secretary-General to provide \ncommunication about each language day in the six official languages and further \nstrengthen this approach in a cost-neutral manner, if needed through the participation \nof partner organizations, including Member States and institutions such as the United \nNations Educational, Scientific and Cultural Organization, and also encourages the \nSecretary-General to consider extending this important initiative to other non-official \nlanguages spoken throughout the world; \n \n17. Welcomes with appreciation the inclusion, in 2018, of a new category of \nthe United Nations Secretary-General Awards aimed at honouring a staff member or \nteam for their best practices and innovative approaches to fostering multilingualism \nat the United Nations;  \n \n18. Welcomes the efforts made by international organizations based on a \nshared language to increase their cooperation with the United Nations regarding \nmultilingualism;  \n \n19. Also welcomes the activities of the United Nations Educational, Scientific \nand Cultural Organization, Member States, entities of the United Nations system, \nother international organizations and all other participating bodies aimed at fostering \nrespect for and the promotion and protection of all languages, in particular \nendangered ones, linguistic diversity and multilingualism;  \n \n20. Reaffirms that linguistic diversity is an important element of cultural \ndiversity, stresses the importance of the full and effective implementation of the \nConvention on the Protection and Promotion of the Diversity of Cultural \nExpressions, 8  which entered into force on 18 March 2007, and recalls the \nRecommendation concerning the Promotion and Use of Multilingualism and \nUniversal Access to Cyberspace of 15 October 2003;9 \n \n \n \nII \n \n \nRole of the Department of Global Communications in multilingualism \n \n \n21. Reaffirms that the primary mission of the Department of Global \nCommunications of the Secretariat is to provide, through its outreach activities, \naccurate, impartial, comprehensive, balanced, timely, relevant and multilingual \ninformation to the public on the tasks and responsibilities of the United Nations in \norder to strengthen international support for the activities of the Organization with \nthe greatest transparency; \n \n22. Requests the Secretary-General to ensure the full implementation of \nexisting mandates in the area of multilingualism as they relate to information and \ncommunication, and in this regard encourages the Secretariat to explore the \nopportunities offered by the new information and communications technologies;  \n \n23. Also requests the Secretary-General to ensure that any decisions made by \nthe Department of Global Communications, including those justified by budget \nlimitations or reductions, do not undermine the principles of multilingualism; \n \n24. Emphasizes the importance of making use of all the official languages of \nthe United Nations, ensuring their full and equitable treatment in all the activities of \nthe Department of Global Communications, with the aim of eliminating the disparity \nbetween the use of English and the use of the five other official languages, and in this \n__________________ \n \n8  United Nations, Treaty Series, vol. 2440, No. 43977. \n \n9  United Nations Educational, Scientific and Cultural Organization, Records of the General \nConference, Thirty-second Session, Paris, 29 September\u201317 October 2003, vol. 1, Resolutions, \nsect. IV, resolution 41, annex. \n\nMultilingualism \nA/RES/73/346\n \n5/12\n19-15935 \n \nregard reaffirms its request that the Secretary-General ensure that the Department has \nthe necessary staffing capacity in all the official languages to undertake all its \nactivities;  \n \n25. Also emphasizes the role of the Department of Global Communications in \nbuilding support for international peace and security, development and human rights \nfor all and the contribution of multilingualism in achieving these goals; \n \n26. Welcomes \nthe \nongoing \nefforts \nof \nthe \nDepartment \nof \nGlobal \nCommunications to enhance multilingualism in all its activities, and stresses the \nimportance of ensuring that the texts of all new public United Nations documents in \nall six official languages, information materials and all older United Nations \ndocuments are made available through the United Nations websites and are accessible \nto Member States without delay;  \n \n27. Encourages the Department of Global Communications to continue to use \nother languages in addition to the official languages, when appropriate, according to \nthe targeted audience, with a view to reaching the widest possible spectrum of \naudiences and extending the United Nations message to all corners of the world in \norder to strengthen international support for the activities of the Organization;  \n \n28. Welcomes the work done by the network of United Nations information \ncentres, including the United Nations Regional Information Centre, in favour of the \npublication of United Nations information materials and the translation of important \ndocuments into languages other than the official languages of the United Nations, \nencourages the information centres to continue their important multilingual activities \nin the interactive and proactive aspects of their work and to develop web pages in \nlocal languages, and the Department of Global Communications to provide the \nnecessary resources and technical facilities, with a view to reaching the widest \npossible spectrum of audiences and extending the United Nations message to all \ncorners of the world in order to strengthen international support for the activities of \nthe Organization, and encourages the continuation of efforts in this regard; \n \n29. Emphasizes the importance of the network of United Nations information \ncentres in enhancing the public image of the United Nations, in disseminating \nmessages on the United Nations to local populations, especially in developing \ncountries, bearing in mind that information in local languages has the strongest impact \non local populations, and in mobilizing support for the work of the United Nations at \nthe local level;  \n \n30. Welcomes the sustained effort to disseminate information globally by the \nuse of official and non-official languages and traditional means of communication, \nand in this regard expresses its particular appreciation for the work currently being \ncarried out by United Nations Radio in the six official languages, as well as in \nnon-official languages;  \n \n31. Requests the Secretary-General to continue his efforts to ensure that, in \nview of their income-generating nature, guided tours at United Nations Headquarters \nare consistently available in all six official languages of the United Nations; \n \n32. Welcomes the initiative of the Secretary-General to also offer guided tours \nat United Nations Headquarters in non-official languages;  \n \n33. Notes with interest the cost-neutral initiatives of the Secretariat to produce \npublications in official and non-official languages, to increase the volume of \ntranslated publications and to encourage a multilingual acquisition policy for the \nlibraries of the United Nations, and requests the Secretariat to continue those \ninitiatives; \n\nA/RES/73/346 \nMultilingualism\n \n19-15935\n6/12 \n \n \n34. Welcomes the creation of the United Nations digital library, which \nprovides multilingual content, and encourages the United Nations libraries to \ncontinue to take into consideration the importance of multilingualism in their \nactivities; \n \n35. Notes with appreciation the efforts of the Department of Global \nCommunications to work at the local level with other organizations and bodies of the \nUnited Nations system to enhance the coordination of their communications \nactivities, and urges the Department to encourage the United Nations \nCommunications Group to promote linguistic diversity in its work;  \n \n36. Recalls paragraph 71 of its resolution 73/102 B, and encourages the \nDepartment of Global Communications to prioritize the development of collaborative \narrangements for the digitization of the audiovisual archives of the United Nations \nwhile preserving their multilingual character in a cost-neutral manner;  \n \n37. Welcomes the Department of Global Communications partnerships with \nuniversities for translation services on a pro bono basis, and requests the Secretary-\nGeneral to grow the number of such partnerships; \n \n38. Requests the Secretary-General to continue to exert all efforts to ensure \nthat publications and other information services of the Secretariat, including the \nUnited Nations website, social media platforms and the United Nations News Service, \ncontain comprehensive, balanced, objective and equitable information in all official \nlanguages about the issues before the Organization and that they maintain editorial \nindependence, impartiality, accuracy and full consistency with resolutions and \ndecisions of the General Assembly;  \n \n \n \nIII \n \n \nWebsites, social media and other web-based communication tools \n \n \n39. Reaffirms that the United Nations website is an essential tool for Member \nStates, the media, non-governmental organizations, educational institutions and the \ngeneral public;  \n \n40. Also reaffirms the need to achieve full parity among the six official \nlanguages on all United Nations websites, welcomes in this regard the renewed efforts \nof the Secretary-General to conduct a comprehensive review of the United Nations \nwebsites, including content discrepancies among the official languages, notes with \nappreciation the innovative ideas, potential synergies and other cost-neutral measures \nproposed in the report of the Secretary-General on multilingualism to achieve full \nparity among the six official languages, and requests the Secretary-General to present \nan updated version of the review to the General Assembly at its seventy-fifth session;  \n \n41. Welcomes the renewed efforts of the Secretary-General to conduct a \ncomprehensive review of the United Nations websites, presenting the status of content \nin non-official languages, notes with appreciation the innovative ideas, potential \nsynergies and other cost-neutral measures proposed in the report of the Secretary-\nGeneral on multilingualism to reinforce the broader multilingual development and \nenrichment of the United Nations websites, as appropriate, and requests the Secretary-\nGeneral to present an updated version of this review to the General Assembly at its \nseventy-fifth session;  \n \n42. Recalls paragraph 35 of its resolution 71/328, notes with concern the \ndisparity between the English and the non-English languages on the websites \nmaintained by the Secretariat, urges the Secretary-General to lead the efforts of all \noffices and departments of the Secretariat to take concrete action to address such \nuneven development, and in this regard calls upon all stakeholders, including the \nDepartment of Global Communications, content-providing Secretariat entities and the \n\nMultilingualism \nA/RES/73/346\n \n7/12\n19-15935 \n \nOffice of Information and Communications Technology of the Secretariat, to continue \ntheir collaboration, within their respective mandates, so as to achieve full parity \namong the six official languages on all United Nations websites developed and \nmaintained by all Secretariat entities, in full conformance with the principles of \nmultilingualism and in compliance with the relevant resolutions addressing \nmultilingualism and accessibility for persons with disabilities, by making every effort \nto translate materials currently available only in English and by providing offices and \ndepartments with technological solutions that comply with the principle of parity, \nfrom within existing resources;  \n \n43. Urges the Secretary-General to strengthen his efforts to develop, maintain \nand update multilingual United Nations websites and the web page of the Secretary-\nGeneral in all the official languages of the United Nations, from within existing \nresources and on an equitable basis;  \n \n44. Reaffirms its request that the Secretary-General ensure, while maintaining \nan up-to-date and accurate website and social media, the equitable distribution of \nfinancial and human resources within the Department of Global Communications \nallocated to the United Nations website and social media among all six official \nlanguages, with full respect for the needs and specificities of all six languages;  \n \n45. Encourages the continuation of the live webcasts of public meetings of the \nGeneral Assembly and the Economic and Social Council and their respective \nsubsidiary bodies, as well as of the public meetings of the Security Council, with \ninterpretation services, and requests the Secretariat to make every effort to provide \nfull access to archived videos in all official languages of all past open formal United \nNations meetings with interpretation services, in strict observance of the principle of \nfull parity of the six official languages of the United Nations, in order to promote \ntransparency and accountability within the Organization, and in that regard requests \nthe Department of Global Communications, the Office of Information and \nCommunications Technology and the Department for General Assembly and \nConference Management of the Secretariat to collaborate, on a cost-neutral basis, to \nexplore cost-efficient technological options to ensure equal availability, searchability, \ncompleteness and user-friendly presentation of webcast archives in all official \nlanguages on the United Nations website, and requests the Secretary-General to report \non the results of this collaboration in the next report on multilingualism, to be \nsubmitted to the General Assembly at its seventy-fifth session; \n \n46. Notes with concern that the multilingual development and enrichment of \nthe United Nations website and social media accounts in certain official languages \nhas improved at a much slower rate than expected, and in this regard requests the \nDepartment of Global Communications, in coordination with content-providing \noffices, to advance actions to achieve full parity among the six official languages on \nthe United Nations website, in particular by expediting the filling of vacant posts in \nsome sections;  \n \n47. Takes note of section III.B of the report of the Secretary-General, requests \nthe Secretary-General to continue his ongoing efforts in this regard, and urges all \ncontent-providing offices in the Secretariat to strengthen their efforts to translate into \nall official languages all English-language materials and databases posted on the \nUnited Nations website in the most practical, efficient and cost-effective manner, \nfrom within existing resources;  \n \n48. Requests the Department of Global Communications, in cooperation with \nthe Office of Information and Communications Technology, to continue its efforts to \nensure that technological infrastructures and supportive applications fully support \nLatin, non-Latin and bidirectional scripts in order to enhance the equality of all \nofficial languages on the United Nations website; \n\nA/RES/73/346 \nMultilingualism\n \n19-15935\n8/12 \n \n \n49. Recognizes the language landing page of the domain un.org as one solution \nto enabling multilingualism in United Nations websites, and encourages the \nSecretary-General to continue to explore innovative solutions to enhance multilingual \ncapabilities for Secretariat websites in a cost-neutral manner;  \n \n50. Welcomes the mention of the language skills of the members of the senior \nleadership in some of the appointment notices issued by the Secretary-General under \nun.org, and encourages the Secretary-General to include them in those notices, when \nrequested by the appointee;  \n \n51. Also welcomes the cooperative arrangements undertaken by the \nDepartment of Global Communications with academic institutions to increase the \nnumber of web pages available in official and non-official languages, and requests \nthe Secretary-General, in coordination with content-providing offices, to extend such \ncooperative arrangements, in a cost-effective manner, to all the official languages of \nthe United Nations, bearing in mind the necessity of adherence to United Nations \nstandards and guidelines;  \n \n52. Underlines the importance, in the implementation of new communication \ntools, such as social networks, of taking into account the linguistic dimension in order \nto assure full parity among the official languages of the Organization;  \n \n53. Acknowledges the increasing importance of social media in order to reach \nthe widest possible audience, and as such welcomes the growing popularity of the \nUnited Nations official social media accounts across all languages, and encourages \nthe Department of Global Communications to continue to expand, within existing \nresources, its multilingual presence across outlets by providing timely updates on the \nwork and priorities of the Organization in the six United Nations official languages, \nas well as additional non-official languages whenever appropriate; \n \n54. Urges the Secretariat to keep iSeek up to date in the two working \nlanguages of the Secretariat, to continue its efforts to implement iSeek at all duty \nstations and to develop and implement cost-neutral measures to provide Member \nStates with secure access to the information currently accessible only on the Intranet \nof the Secretariat;  \n \n \n \nIV \n \n \nDocumentation and conference services \n \n \n55. Reiterates its request that the Secretary-General complete the task of \nuploading all important older United Nations documents to the United Nations \nwebsite in all six official languages on a priority basis so that those archives are also \nmade available to Member States through that medium;  \n \n56. Requests the Secretary-General to continue to ensure, through the \nprovision of documentation services and meetings and publishing services under \nconference management, including high-quality translation and interpretation, \neffective multilingual communication equally in all the official languages of the \nUnited Nations among representatives of Member States in intergovernmental organs \nand among members of United Nations expert bodies;  \n \n57. Encourages the Department for General Assembly and Conference \nManagement, within existing resources and upon request, to document policy \nguidance regarding translation outsourcing and quality standards for use by relevant \ndepartments and offices of the Secretariat;  \n \n58. Notes the use of innovative translation technologies such as eLUNa that \nassist in making human translation more efficient and consistent, and encourages, \n\nMultilingualism \nA/RES/73/346\n \n9/12\n19-15935 \n \nwithin existing resources, the Secretariat to explore additional technologies for use \nby United Nations entities with appropriate quality controls;  \n \n59. Underlines that all the initiatives on leveraging technology, where \napplicable, including those introduced on a trial basis, shall comply with the principle \nof parity among the official languages of the Organization, with a view to preserving \nand enhancing the quality and scope of the services provided by the Secretariat, and \nencourages the Secretary-General to continue these efforts as a practical contribution \nto the achievement of the goals of multilingualism;  \n \n60. Reiterates with concern its request that the Secretary-General ensure that \nthe rules concerning the simultaneous distribution of documents in all six official \nlanguages are strictly respected as regards both the distribution of printed copies and \nthe posting of parliamentary documentation on the Official Document System and the \nUnited Nations website, in accordance with section III, paragraph 5, of its resolution \n55/222 of 23 December 2000;  \n \n61. Reiterates the need to fully implement and observe rule 55 of the rules of \nprocedure of the General Assembly, which provides that, during the sessions of the \nAssembly, the Journal of the United Nations shall be published in the languages of \nthe Assembly, from within existing resources;  \n \n62. Underlines that all the initiatives on the evolution of the working methods, \nincluding those introduced on a trial basis, shall comply with the principle of parity \namong the official languages of the Organization, with a view to preserving or \nenhancing the quality and scope of the services provided by the Secretariat;  \n \n \n \nV \n \n \nHuman resources management and staff training \n \n \n63. Recalls its resolution 71/263 of 23 December 2016, in particular paragraph \n10 thereof, in which it reaffirmed the need to respect the equality of the two working \nlanguages of the Secretariat, reaffirmed the use of additional working languages in \nspecific duty stations as mandated, and in that regard requested the Secretary-General \nto ensure that job openings specified the need for either of the working languages of \nthe Secretariat, unless the functions of the post required a specific working language; \n \n64. Notes the significant disparities across official languages observed in \nlanguage requirements in the job openings published on Inspira in 2017, and \nwelcomes in this regard the guidelines on setting language requirements in job \nopenings in the coming biennium, and requests the Secretary-General to report on the \nprogress achieved through the implementation of the guidelines at the seventy-fifth \nsession of the General Assembly; \n \n65. Notes with satisfaction the willingness of the Secretariat to encourage staff \nmembers, in meetings with interpretation services, to use any of the six official \nlanguages of which they have a command; \n \n66. Encourages United Nations staff members to continue to actively use \nexisting training facilities to acquire and enhance their proficiency in one or more of \nthe official languages of the United Nations;  \n \n67. Welcomes the invitation of the Secretary-General to all the entities of the \nSecretariat to build an inventory of staff language skills, while making the best use of \nexisting language databases, as underlined in its resolution 71/328, and encourages \nthe Office of Human Resources of the Department of Management Strategy, Policy \nand Compliance of the Secretariat, in collaboration with the Human Resources \nServices Division of the Department of Operational Support of the Secretariat, to lead \nthese efforts, in collaboration with the Coordinator for Multilingualism;  \n\nA/RES/73/346 \nMultilingualism\n \n19-15935\n10/12 \n \n \n68. Requests the Secretary-General to continue the efforts to ensure that \ntraining opportunities in the six official languages are equally available to all staff; \n \n69. Recalls paragraph 11 of its resolution 71/263, in which it acknowledged \nthat the interaction of the United Nations with the local population in the field was \nessential and that language skills constituted an important element of the selection \nand training processes and therefore affirmed that a good command of the official \nlanguage(s) spoken in the country of residence should be taken into account as an \nadditional asset during those processes; \n \n70. Also recalls its resolution 68/265 of 9 April 2014 on the mobility \nframework, and invites the Secretary-General to take into account applicable \nlanguage skills while ensuring full compliance with Article 101 of the Charter of the \nUnited Nations;  \n \n71. Welcomes the inclusion by the Secretary-General of a managerial indicator \nrelated to multilingualism in all his compacts with senior managers, including senior \nmanagers in the field, requiring that all workplans and, where applicable, mission \nplans and budgets integrate multilingualism and/or language considerations and that \nall parliamentary documentation be submitted by authoring entities for multilingual \nprocessing on time and within the established word limit, and requests the Secretary-\nGeneral to report thereon at the seventy-fifth session of the General Assembly; \n \n72. Stresses that the employment of staff shall continue to be carried out in \nstrict accordance with Article 101 of the Charter and in line with the relevant \nprovisions of General Assembly resolutions;  \n \n73. Notes with concern that a number of recruitment handbooks developed by \nthe Office of Human Resources are available only in English, and encourages the \nSecretary-General to ensure that upcoming reviews and updates, in particular those \nof the applicant\u2019s manual, are published simultaneously in the working languages; \n \n74. Invites the Secretary-General to ensure compliance with the requirement \nfor United Nations staff to have the ability to use one of the working languages of the \nSecretariat, and encourages the Secretary-General to further the implementation of \nresolution 2480 B (XXIII);  \n \n75. Stresses that the promotion of staff in the Professional and higher \ncategories shall be carried out in strict accordance with Article 101 of the Charter and \nin line with the provisions of resolution 2480 B (XXIII) and the relevant provisions \nof resolution 55/258 of 14 June 2001; \n \n76. Welcomes the efforts of the Coordinator for Multilingualism to support the \nOffice of Human Resources of the Department of Management Strategy, Policy and \nCompliance and the Human Resources Services Division of the Department of \nOperational Support in reviewing how language skills are assessed in staff selection, \nand requests the Secretary-General to report on progress made in this regard during \nthe seventy-fifth session of the General Assembly; \n \n77. Invites the Secretary-General to take the appropriate measures to consider \nthe linguistic specificities mentioned in job openings during the composition of \ninterview panels for the employment of United Nations staff, notes the difficulty of \nconstituting panels whose members are proficient in the additional language, and in \nthat regard invites the Secretary-General to consider the possibility of addressing this \nissue in the medium term; \n \n78. Welcomes the ongoing harmonization exercise that aims to produce a \nUnited Nations Language Framework ensuring greater consistency in language \nlearning, teaching and assessment (a) across the entire Secretariat and (b) across all \n\nMultilingualism \nA/RES/73/346\n \n11/12\n19-15935 \n \nsix United Nations official languages, and requests the Secretary-General to report on \nprogress made in this regard during the seventy-fifth session of the General Assembly; \n \n79. Recognizes the key contribution of the Language and Communications \nProgramme to promoting multilingualism within the United Nations, supporting the \nlanguage needs of the Organization at Headquarters and in the field, in collaboration \nwith other Secretariat entities, requests the Secretary-General to ensure full \nimplementation of the existing mandate on linguistic training to continue the delivery \nof an offer adapted to the need of the United Nations, and also requests the Secretary-\nGeneral to provide further information in this regard at the seventy-fifth session of \nthe General Assembly; \n \n \n \nVI \n \n \nLanguage services staff  \n \n \n80. Recalls its resolution 66/233 of 24 December 2011, in particular paragraph \n7 of section III thereof, reiterates its request that the Secretary-General ensure that all \nlanguage services are given equal treatment and are provided with equally favourable \nworking conditions and resources, with a view to achieving maximum quality of \nservices, with full respect for the specificities of the six official languages, and in that \nregard recalls section D, paragraph 11, of its resolution 54/248 of 23 December 1999;  \n \n81. Acknowledges the measures taken by the Secretary-General, in accordance \nwith its resolutions, to address the issue of the replacement of retiring staff in the \nlanguage services, and requests the Secretary-General to maintain and to intensify \nthose efforts, including through the strengthening of cooperation with institutions that \ntrain language specialists to meet the needs in the six official languages of the United \nNations;  \n \n \n \nVII \n \n \nMultilingualism across the three pillars of the United Nations \n \n \n82. Acknowledges the contribution of multilingualism to the three pillars of \nthe United Nations: peace and security, development and human rights;  \n \n83. Notes the work of the Secretary-General in making available multilingual \ninformation, technical assistance and training materials related to the implementation \nof the 2030 Agenda for Sustainable Development,10 and encourages the Secretary-\nGeneral to continue his efforts in this regard; \n \n84. Stresses the importance of proposing United Nations information, \ntechnical assistance and training materials, whenever possible, in the local languages \nof the beneficiary countries, including through locally based United Nations websites; \n \n85. Takes note of the recommendations related to multilingualism contained \nin the report of the High-level Independent Panel on Peace Operations, 11  the \nsubsequent report of the Secretary-General12 and the report of the Advisory Group of \nExperts on the Review of the Peacebuilding Architecture;13  \n \n86. Recalls its resolution 72/304, in which it endorsed the proposals, \nrecommendations and conclusions of the Special Committee on Peacekeeping \nOperations;14 \n__________________ \n \n10  Resolution 70/1. \n \n11  See A/70/95-S/2015/446. \n \n12  A/70/357-S/2015/682. \n \n13  See A/69/968-S/2015/490. \n \n14  Official Records of the General Assembly, Seventy-second Session, Supplement No. 19 (A/72/19), \nchap. V. \n\nA/RES/73/346 \nMultilingualism\n \n19-15935\n12/12 \n \n \n87. Takes note of the ongoing initiatives outlined in the report of the Secretary-\nGeneral related to field operations, requests the Secretary-General to continue his \nongoing efforts in this regard, and recalls its resolution 66/297 of 17 September 2012 \nwithout prejudice to Article 101 of the Charter; \n \n88. Urges the Secretariat to translate all peacekeeping training documents into \nthe six official languages of the United Nations, from within existing resources, to \nenable and facilitate their use by all Member States, troop-contributing countries and \npolice-contributing countries, in particular, and by other involved institutions; \n \n89. Requests the Secretary-General to submit to the General Assembly at its \nseventy-fifth session a comprehensive report on the full implementation of its \nresolutions on multilingualism; \n \n90. Decides to include in the provisional agenda of its seventy-fifth session \nthe item entitled \u201cMultilingualism\u201d. \n \n107th plenary meeting  \n16 September 2019 \n \n",
  "paragraphs": {
    "1": "Takes note of the report of the Secretary-General;6 I Multilingualism in general and the role of the Secretariat",
    "2": "Emphasizes the paramount importance of the equality of the six official languages of the United Nations;",
    "3": "Underlines the need for the full implementation of all resolutions establishing language arrangements for the official languages of the United Nations and the working languages of the Secretariat;",
    "4": "Also underlines the responsibility of the Secretariat in integrating multilingualism into its activities, from within existing resources, on an equitable basis;",
    "5": "Notes that the availability of United Nations documents in relevant official languages is limited in some areas of Secretariat activity, and therefore invites the __________________ 3 Rule 32 of the rules of procedure of the Economic and Social Council. 4 See resolution 2 (I), annex. 5 See resolution 2200 A (XXI), annex. 6 A/73/761. Multilingualism A/RES/73/346 3/12 19-15935 Secretary-General to take the appropriate measures to implement, within existing resources, current multilingualism policies, in compliance with relevant rules and regulations;",
    "6": "Requests the Secretariat to continue to provide notes for the Presidents of the main organs and the Chairs of their subsidiary bodies in the United Nations official language spoken by the presiding officer of the meeting;",
    "7": "Notes that a high proportion of calls for bids are published in English, and therefore encourages the Secretariat, where appropriate, to make use of existing multilingualism policies to facilitate the participation of local vendors in the United Nations procurement bidding process;",
    "8": "Also notes that the Procurement Manual, published in three official languages, is in the process of being updated, and encourages the Secretariat to ensure that the updates are reflected in all its language versions in an appropriate time frame;",
    "9": "Recalls that the Secretary-General retains the authority to appoint a senior Secretariat official as the future Coordinator for Multilingualism, as first requested by the General Assembly in its resolution 54/64 of 6 December 1999;",
    "10": "Recalls with appreciation the appointment by the Secretary-General of the Coordinator for Multilingualism, who is responsible for the overall implementation of multilingualism Secretariat-wide, calls upon all departments and offices within the Secretariat to fully support the work of the Coordinator in the implementation of the relevant mandates on multilingualism, and requests the Secretary-General to report thereon in his next report on multilingualism;",
    "11": "Recalls its endorsement of the terms of reference for the Coordinator for Multilingualism, as proposed in report A/71/757 of the Secretary-General on multilingualism;",
    "12": "Welcomes the designation of the Coordinator for Multilingualism as lead entity on multilingualism at the United Nations System Chief Executives Board for Coordination level, as well as the joint efforts of the Coordinator and the secretariat of the Chief Executives Board towards a more coordinated approach to multilingualism across member organizations of the Board, with a view to sharing information on innovative solutions to common challenges;",
    "13": "Also welcomes the ongoing development of the network of focal points that supports the Coordinator for Multilingualism in effectively and consistently implementing relevant resolutions throughout all Secretariat entities and the United Nations system;",
    "14": "Further welcomes the ongoing development of a Secretariat-wide coherent policy framework on multilingualism to support a comprehensive and coordinated approach on multilingualism within the United Nations, taking into consideration the relevant recommendations contained in the report of the Joint Inspection Unit on multilingualism,7 and requests the Secretary-General to report on progress made at the seventy-fifth session of the General Assembly;",
    "15": "Notes the difficulties reported by Secretariat entities in compiling accurate and comprehensive data for the report of the Secretary-General, owing, inter alia, to the lack of disaggregated data by language, and welcomes efforts by the Coordinator for Multilingualism to address the problem among Secretariat entities;",
    "16": "Welcomes the efforts of the Coordinator for Multilingualism to encourage all Secretariat entities to promote the celebrations of a day dedicated to each of the __________________ 7 A/67/78. A/RES/73/346 Multilingualism 19-15935 4/12 official languages of the United Nations, in order to inform and raise awareness of their history, culture and use, encourages the Secretary-General to provide communication about each language day in the six official languages and further strengthen this approach in a cost-neutral manner, if needed through the participation of partner organizations, including Member States and institutions such as the United Nations Educational, Scientific and Cultural Organization, and also encourages the Secretary-General to consider extending this important initiative to other non-official languages spoken throughout the world;",
    "17": "Welcomes with appreciation the inclusion, in 2018, of a new category of the United Nations Secretary-General Awards aimed at honouring a staff member or team for their best practices and innovative approaches to fostering multilingualism at the United Nations;",
    "18": "Welcomes the efforts made by international organizations based on a shared language to increase their cooperation with the United Nations regarding multilingualism;",
    "19": "Also welcomes the activities of the United Nations Educational, Scientific and Cultural Organization, Member States, entities of the United Nations system, other international organizations and all other participating bodies aimed at fostering respect for and the promotion and protection of all languages, in particular endangered ones, linguistic diversity and multilingualism;",
    "20": "Reaffirms that linguistic diversity is an important element of cultural diversity, stresses the importance of the full and effective implementation of the Convention on the Protection and Promotion of the Diversity of Cultural Expressions, 8 which entered into force on 18 March 2007, and recalls the Recommendation concerning the Promotion and Use of Multilingualism and Universal Access to Cyberspace of 15 October 2003;9 II Role of the Department of Global Communications in multilingualism",
    "21": "Reaffirms that the primary mission of the Department of Global Communications of the Secretariat is to provide, through its outreach activities, accurate, impartial, comprehensive, balanced, timely, relevant and multilingual information to the public on the tasks and responsibilities of the United Nations in order to strengthen international support for the activities of the Organization with the greatest transparency;",
    "22": "Requests the Secretary-General to ensure the full implementation of existing mandates in the area of multilingualism as they relate to information and communication, and in this regard encourages the Secretariat to explore the opportunities offered by the new information and communications technologies;",
    "23": "Also requests the Secretary-General to ensure that any decisions made by the Department of Global Communications, including those justified by budget limitations or reductions, do not undermine the principles of multilingualism;",
    "24": "Emphasizes the importance of making use of all the official languages of the United Nations, ensuring their full and equitable treatment in all the activities of the Department of Global Communications, with the aim of eliminating the disparity between the use of English and the use of the five other official languages, and in this __________________ 8 United Nations, Treaty Series, vol. 2440, No. 43977. 9 United Nations Educational, Scientific and Cultural Organization, Records of the General Conference, Thirty-second Session, Paris, 29 September\u201317 October 2003, vol. 1, Resolutions, sect. IV, resolution 41, annex. Multilingualism A/RES/73/346 5/12 19-15935 regard reaffirms its request that the Secretary-General ensure that the Department has the necessary staffing capacity in all the official languages to undertake all its activities;",
    "25": "Also emphasizes the role of the Department of Global Communications in building support for international peace and security, development and human rights for all and the contribution of multilingualism in achieving these goals;",
    "26": "Welcomes the ongoing efforts of the Department of Global Communications to enhance multilingualism in all its activities, and stresses the importance of ensuring that the texts of all new public United Nations documents in all six official languages, information materials and all older United Nations documents are made available through the United Nations websites and are accessible to Member States without delay;",
    "27": "Encourages the Department of Global Communications to continue to use other languages in addition to the official languages, when appropriate, according to the targeted audience, with a view to reaching the widest possible spectrum of audiences and extending the United Nations message to all corners of the world in order to strengthen international support for the activities of the Organization;",
    "28": "Welcomes the work done by the network of United Nations information centres, including the United Nations Regional Information Centre, in favour of the publication of United Nations information materials and the translation of important documents into languages other than the official languages of the United Nations, encourages the information centres to continue their important multilingual activities in the interactive and proactive aspects of their work and to develop web pages in local languages, and the Department of Global Communications to provide the necessary resources and technical facilities, with a view to reaching the widest possible spectrum of audiences and extending the United Nations message to all corners of the world in order to strengthen international support for the activities of the Organization, and encourages the continuation of efforts in this regard;",
    "29": "Emphasizes the importance of the network of United Nations information centres in enhancing the public image of the United Nations, in disseminating messages on the United Nations to local populations, especially in developing countries, bearing in mind that information in local languages has the strongest impact on local populations, and in mobilizing support for the work of the United Nations at the local level;",
    "30": "Welcomes the sustained effort to disseminate information globally by the use of official and non-official languages and traditional means of communication, and in this regard expresses its particular appreciation for the work currently being carried out by United Nations Radio in the six official languages, as well as in non-official languages;",
    "31": "Requests the Secretary-General to continue his efforts to ensure that, in view of their income-generating nature, guided tours at United Nations Headquarters are consistently available in all six official languages of the United Nations;",
    "32": "Welcomes the initiative of the Secretary-General to also offer guided tours at United Nations Headquarters in non-official languages;",
    "33": "Notes with interest the cost-neutral initiatives of the Secretariat to produce publications in official and non-official languages, to increase the volume of translated publications and to encourage a multilingual acquisition policy for the libraries of the United Nations, and requests the Secretariat to continue those initiatives; A/RES/73/346 Multilingualism 19-15935 6/12",
    "34": "Welcomes the creation of the United Nations digital library, which provides multilingual content, and encourages the United Nations libraries to continue to take into consideration the importance of multilingualism in their activities;",
    "35": "Notes with appreciation the efforts of the Department of Global Communications to work at the local level with other organizations and bodies of the United Nations system to enhance the coordination of their communications activities, and urges the Department to encourage the United Nations Communications Group to promote linguistic diversity in its work;",
    "36": "Recalls paragraph 71 of its resolution 73/102 B, and encourages the Department of Global Communications to prioritize the development of collaborative arrangements for the digitization of the audiovisual archives of the United Nations while preserving their multilingual character in a cost-neutral manner;",
    "37": "Welcomes the Department of Global Communications partnerships with universities for translation services on a pro bono basis, and requests the Secretary- General to grow the number of such partnerships;",
    "38": "Requests the Secretary-General to continue to exert all efforts to ensure that publications and other information services of the Secretariat, including the United Nations website, social media platforms and the United Nations News Service, contain comprehensive, balanced, objective and equitable information in all official languages about the issues before the Organization and that they maintain editorial independence, impartiality, accuracy and full consistency with resolutions and decisions of the General Assembly; III Websites, social media and other web-based communication tools",
    "39": "Reaffirms that the United Nations website is an essential tool for Member States, the media, non-governmental organizations, educational institutions and the general public;",
    "40": "Also reaffirms the need to achieve full parity among the six official languages on all United Nations websites, welcomes in this regard the renewed efforts of the Secretary-General to conduct a comprehensive review of the United Nations websites, including content discrepancies among the official languages, notes with appreciation the innovative ideas, potential synergies and other cost-neutral measures proposed in the report of the Secretary-General on multilingualism to achieve full parity among the six official languages, and requests the Secretary-General to present an updated version of the review to the General Assembly at its seventy-fifth session;",
    "41": "Welcomes the renewed efforts of the Secretary-General to conduct a comprehensive review of the United Nations websites, presenting the status of content in non-official languages, notes with appreciation the innovative ideas, potential synergies and other cost-neutral measures proposed in the report of the Secretary- General on multilingualism to reinforce the broader multilingual development and enrichment of the United Nations websites, as appropriate, and requests the Secretary- General to present an updated version of this review to the General Assembly at its seventy-fifth session;",
    "42": "Recalls paragraph 35 of its resolution 71/328, notes with concern the disparity between the English and the non-English languages on the websites maintained by the Secretariat, urges the Secretary-General to lead the efforts of all offices and departments of the Secretariat to take concrete action to address such uneven development, and in this regard calls upon all stakeholders, including the Department of Global Communications, content-providing Secretariat entities and the Multilingualism A/RES/73/346 7/12 19-15935 Office of Information and Communications Technology of the Secretariat, to continue their collaboration, within their respective mandates, so as to achieve full parity among the six official languages on all United Nations websites developed and maintained by all Secretariat entities, in full conformance with the principles of multilingualism and in compliance with the relevant resolutions addressing multilingualism and accessibility for persons with disabilities, by making every effort to translate materials currently available only in English and by providing offices and departments with technological solutions that comply with the principle of parity, from within existing resources;",
    "43": "Urges the Secretary-General to strengthen his efforts to develop, maintain and update multilingual United Nations websites and the web page of the Secretary- General in all the official languages of the United Nations, from within existing resources and on an equitable basis;",
    "44": "Reaffirms its request that the Secretary-General ensure, while maintaining an up-to-date and accurate website and social media, the equitable distribution of financial and human resources within the Department of Global Communications allocated to the United Nations website and social media among all six official languages, with full respect for the needs and specificities of all six languages;",
    "45": "Encourages the continuation of the live webcasts of public meetings of the General Assembly and the Economic and Social Council and their respective subsidiary bodies, as well as of the public meetings of the Security Council, with interpretation services, and requests the Secretariat to make every effort to provide full access to archived videos in all official languages of all past open formal United Nations meetings with interpretation services, in strict observance of the principle of full parity of the six official languages of the United Nations, in order to promote transparency and accountability within the Organization, and in that regard requests the Department of Global Communications, the Office of Information and Communications Technology and the Department for General Assembly and Conference Management of the Secretariat to collaborate, on a cost-neutral basis, to explore cost-efficient technological options to ensure equal availability, searchability, completeness and user-friendly presentation of webcast archives in all official languages on the United Nations website, and requests the Secretary-General to report on the results of this collaboration in the next report on multilingualism, to be submitted to the General Assembly at its seventy-fifth session;",
    "46": "Notes with concern that the multilingual development and enrichment of the United Nations website and social media accounts in certain official languages has improved at a much slower rate than expected, and in this regard requests the Department of Global Communications, in coordination with content-providing offices, to advance actions to achieve full parity among the six official languages on the United Nations website, in particular by expediting the filling of vacant posts in some sections;",
    "47": "Takes note of section III.B of the report of the Secretary-General, requests the Secretary-General to continue his ongoing efforts in this regard, and urges all content-providing offices in the Secretariat to strengthen their efforts to translate into all official languages all English-language materials and databases posted on the United Nations website in the most practical, efficient and cost-effective manner, from within existing resources;",
    "48": "Requests the Department of Global Communications, in cooperation with the Office of Information and Communications Technology, to continue its efforts to ensure that technological infrastructures and supportive applications fully support Latin, non-Latin and bidirectional scripts in order to enhance the equality of all official languages on the United Nations website; A/RES/73/346 Multilingualism 19-15935 8/12",
    "49": "Recognizes the language landing page of the domain un.org as one solution to enabling multilingualism in United Nations websites, and encourages the Secretary-General to continue to explore innovative solutions to enhance multilingual capabilities for Secretariat websites in a cost-neutral manner;",
    "50": "Welcomes the mention of the language skills of the members of the senior leadership in some of the appointment notices issued by the Secretary-General under un.org, and encourages the Secretary-General to include them in those notices, when requested by the appointee;",
    "51": "Also welcomes the cooperative arrangements undertaken by the Department of Global Communications with academic institutions to increase the number of web pages available in official and non-official languages, and requests the Secretary-General, in coordination with content-providing offices, to extend such cooperative arrangements, in a cost-effective manner, to all the official languages of the United Nations, bearing in mind the necessity of adherence to United Nations standards and guidelines;",
    "52": "Underlines the importance, in the implementation of new communication tools, such as social networks, of taking into account the linguistic dimension in order to assure full parity among the official languages of the Organization;",
    "53": "Acknowledges the increasing importance of social media in order to reach the widest possible audience, and as such welcomes the growing popularity of the United Nations official social media accounts across all languages, and encourages the Department of Global Communications to continue to expand, within existing resources, its multilingual presence across outlets by providing timely updates on the work and priorities of the Organization in the six United Nations official languages, as well as additional non-official languages whenever appropriate;",
    "54": "Urges the Secretariat to keep iSeek up to date in the two working languages of the Secretariat, to continue its efforts to implement iSeek at all duty stations and to develop and implement cost-neutral measures to provide Member States with secure access to the information currently accessible only on the Intranet of the Secretariat; IV Documentation and conference services",
    "55": "Reiterates its request that the Secretary-General complete the task of uploading all important older United Nations documents to the United Nations website in all six official languages on a priority basis so that those archives are also made available to Member States through that medium;",
    "56": "Requests the Secretary-General to continue to ensure, through the provision of documentation services and meetings and publishing services under conference management, including high-quality translation and interpretation, effective multilingual communication equally in all the official languages of the United Nations among representatives of Member States in intergovernmental organs and among members of United Nations expert bodies;",
    "57": "Encourages the Department for General Assembly and Conference Management, within existing resources and upon request, to document policy guidance regarding translation outsourcing and quality standards for use by relevant departments and offices of the Secretariat;",
    "58": "Notes the use of innovative translation technologies such as eLUNa that assist in making human translation more efficient and consistent, and encourages, Multilingualism A/RES/73/346 9/12 19-15935 within existing resources, the Secretariat to explore additional technologies for use by United Nations entities with appropriate quality controls;",
    "59": "Underlines that all the initiatives on leveraging technology, where applicable, including those introduced on a trial basis, shall comply with the principle of parity among the official languages of the Organization, with a view to preserving and enhancing the quality and scope of the services provided by the Secretariat, and encourages the Secretary-General to continue these efforts as a practical contribution to the achievement of the goals of multilingualism;",
    "60": "Reiterates with concern its request that the Secretary-General ensure that the rules concerning the simultaneous distribution of documents in all six official languages are strictly respected as regards both the distribution of printed copies and the posting of parliamentary documentation on the Official Document System and the United Nations website, in accordance with section III, paragraph 5, of its resolution 55/222 of 23 December 2000;",
    "61": "Reiterates the need to fully implement and observe rule 55 of the rules of procedure of the General Assembly, which provides that, during the sessions of the Assembly, the Journal of the United Nations shall be published in the languages of the Assembly, from within existing resources;",
    "62": "Underlines that all the initiatives on the evolution of the working methods, including those introduced on a trial basis, shall comply with the principle of parity among the official languages of the Organization, with a view to preserving or enhancing the quality and scope of the services provided by the Secretariat; V Human resources management and staff training",
    "63": "Recalls its resolution 71/263 of 23 December 2016, in particular paragraph 10 thereof, in which it reaffirmed the need to respect the equality of the two working languages of the Secretariat, reaffirmed the use of additional working languages in specific duty stations as mandated, and in that regard requested the Secretary-General to ensure that job openings specified the need for either of the working languages of the Secretariat, unless the functions of the post required a specific working language;",
    "64": "Notes the significant disparities across official languages observed in language requirements in the job openings published on Inspira in 2017, and welcomes in this regard the guidelines on setting language requirements in job openings in the coming biennium, and requests the Secretary-General to report on the progress achieved through the implementation of the guidelines at the seventy-fifth session of the General Assembly;",
    "65": "Notes with satisfaction the willingness of the Secretariat to encourage staff members, in meetings with interpretation services, to use any of the six official languages of which they have a command;",
    "66": "Encourages United Nations staff members to continue to actively use existing training facilities to acquire and enhance their proficiency in one or more of the official languages of the United Nations;",
    "67": "Welcomes the invitation of the Secretary-General to all the entities of the Secretariat to build an inventory of staff language skills, while making the best use of existing language databases, as underlined in its resolution 71/328, and encourages the Office of Human Resources of the Department of Management Strategy, Policy and Compliance of the Secretariat, in collaboration with the Human Resources Services Division of the Department of Operational Support of the Secretariat, to lead these efforts, in collaboration with the Coordinator for Multilingualism; A/RES/73/346 Multilingualism 19-15935 10/12",
    "68": "Requests the Secretary-General to continue the efforts to ensure that training opportunities in the six official languages are equally available to all staff;",
    "69": "Recalls paragraph 11 of its resolution 71/263, in which it acknowledged that the interaction of the United Nations with the local population in the field was essential and that language skills constituted an important element of the selection and training processes and therefore affirmed that a good command of the official language(s) spoken in the country of residence should be taken into account as an additional asset during those processes;",
    "70": "Also recalls its resolution 68/265 of 9 April 2014 on the mobility framework, and invites the Secretary-General to take into account applicable language skills while ensuring full compliance with Article 101 of the Charter of the United Nations;",
    "71": "Welcomes the inclusion by the Secretary-General of a managerial indicator related to multilingualism in all his compacts with senior managers, including senior managers in the field, requiring that all workplans and, where applicable, mission plans and budgets integrate multilingualism and/or language considerations and that all parliamentary documentation be submitted by authoring entities for multilingual processing on time and within the established word limit, and requests the Secretary- General to report thereon at the seventy-fifth session of the General Assembly;",
    "72": "Stresses that the employment of staff shall continue to be carried out in strict accordance with Article 101 of the Charter and in line with the relevant provisions of General Assembly resolutions;",
    "73": "Notes with concern that a number of recruitment handbooks developed by the Office of Human Resources are available only in English, and encourages the Secretary-General to ensure that upcoming reviews and updates, in particular those of the applicant\u2019s manual, are published simultaneously in the working languages;",
    "74": "Invites the Secretary-General to ensure compliance with the requirement for United Nations staff to have the ability to use one of the working languages of the Secretariat, and encourages the Secretary-General to further the implementation of resolution 2480 B (XXIII);",
    "75": "Stresses that the promotion of staff in the Professional and higher categories shall be carried out in strict accordance with Article 101 of the Charter and in line with the provisions of resolution 2480 B (XXIII) and the relevant provisions of resolution 55/258 of 14 June 2001;",
    "76": "Welcomes the efforts of the Coordinator for Multilingualism to support the Office of Human Resources of the Department of Management Strategy, Policy and Compliance and the Human Resources Services Division of the Department of Operational Support in reviewing how language skills are assessed in staff selection, and requests the Secretary-General to report on progress made in this regard during the seventy-fifth session of the General Assembly;",
    "77": "Invites the Secretary-General to take the appropriate measures to consider the linguistic specificities mentioned in job openings during the composition of interview panels for the employment of United Nations staff, notes the difficulty of constituting panels whose members are proficient in the additional language, and in that regard invites the Secretary-General to consider the possibility of addressing this issue in the medium term;",
    "78": "Welcomes the ongoing harmonization exercise that aims to produce a United Nations Language Framework ensuring greater consistency in language learning, teaching and assessment (a) across the entire Secretariat and (b) across all Multilingualism A/RES/73/346 11/12 19-15935 six United Nations official languages, and requests the Secretary-General to report on progress made in this regard during the seventy-fifth session of the General Assembly;",
    "79": "Recognizes the key contribution of the Language and Communications Programme to promoting multilingualism within the United Nations, supporting the language needs of the Organization at Headquarters and in the field, in collaboration with other Secretariat entities, requests the Secretary-General to ensure full implementation of the existing mandate on linguistic training to continue the delivery of an offer adapted to the need of the United Nations, and also requests the Secretary- General to provide further information in this regard at the seventy-fifth session of the General Assembly; VI Language services staff",
    "80": "Recalls its resolution 66/233 of 24 December 2011, in particular paragraph 7 of section III thereof, reiterates its request that the Secretary-General ensure that all language services are given equal treatment and are provided with equally favourable working conditions and resources, with a view to achieving maximum quality of services, with full respect for the specificities of the six official languages, and in that regard recalls section D, paragraph 11, of its resolution 54/248 of 23 December 1999;",
    "81": "Acknowledges the measures taken by the Secretary-General, in accordance with its resolutions, to address the issue of the replacement of retiring staff in the language services, and requests the Secretary-General to maintain and to intensify those efforts, including through the strengthening of cooperation with institutions that train language specialists to meet the needs in the six official languages of the United Nations; VII Multilingualism across the three pillars of the United Nations",
    "82": "Acknowledges the contribution of multilingualism to the three pillars of the United Nations: peace and security, development and human rights;",
    "83": "Notes the work of the Secretary-General in making available multilingual information, technical assistance and training materials related to the implementation of the 2030 Agenda for Sustainable Development,10 and encourages the Secretary- General to continue his efforts in this regard;",
    "84": "Stresses the importance of proposing United Nations information, technical assistance and training materials, whenever possible, in the local languages of the beneficiary countries, including through locally based United Nations websites;",
    "85": "Takes note of the recommendations related to multilingualism contained in the report of the High-level Independent Panel on Peace Operations, 11 the subsequent report of the Secretary-General12 and the report of the Advisory Group of Experts on the Review of the Peacebuilding Architecture;13",
    "86": "Recalls its resolution 72/304, in which it endorsed the proposals, recommendations and conclusions of the Special Committee on Peacekeeping Operations;14 __________________ 10 Resolution 70/1. 11 See A/70/95-S/2015/446. 12 A/70/357-S/2015/682. 13 See A/69/968-S/2015/490. 14 Official Records of the General Assembly, Seventy-second Session, Supplement No. 19 (A/72/19), chap. V. A/RES/73/346 Multilingualism 19-15935 12/12",
    "87": "Takes note of the ongoing initiatives outlined in the report of the Secretary- General related to field operations, requests the Secretary-General to continue his ongoing efforts in this regard, and recalls its resolution 66/297 of 17 September 2012 without prejudice to Article 101 of the Charter;",
    "88": "Urges the Secretariat to translate all peacekeeping training documents into the six official languages of the United Nations, from within existing resources, to enable and facilitate their use by all Member States, troop-contributing countries and police-contributing countries, in particular, and by other involved institutions;",
    "89": "Requests the Secretary-General to submit to the General Assembly at its seventy-fifth session a comprehensive report on the full implementation of its resolutions on multilingualism;",
    "90": "Decides to include in the provisional agenda of its seventy-fifth session the item entitled \u201cMultilingualism\u201d. 107th plenary meeting 16 September 2019"
  },
  "agenda_items": [
    "Item 127"
  ],
  "symbol_references": [
    "A/73/L.114"
  ]
}