{
  "symbol": "A/RES/75/151",
  "filename": "A_RES_75_151.pdf",
  "title": "75/151. Implementation of the outcome of the World Summit for Social Development and of the twenty-fourth special session of the General Assembly",
  "text": "United Nations \nA/RES/75/151\n \n \nGeneral Assembly \nDistr.: General \n23 December 2020 \n \n20-17281 (E)    301220     \n*2017281* \n \n \nSeventy-fifth session \nAgenda item 27 (a) \nSocial development: implementation of the outcome of \nthe World Summit for Social Development and of the \ntwenty-fourth special session of the General Assembly  \n \n \n \n \n Resolution adopted by the General Assembly \non 16 December 2020 \n \n \n \n \n[on the report of the Third Committee (A/75/470, para. 26)] \n \n \n 75/151. Implementation of the outcome of the World Summit for Social \nDevelopment and of the twenty-fourth special session of the \nGeneral Assembly \n \n \n \nThe General Assembly, \n \nReaffirming all previous resolutions on the implementation of the outcome of \nthe World Summit for Social Development and of the twenty-fourth special session \nof the General Assembly, including resolution 74/122 of 18 December 2019,  \n \nRecalling the World Summit for Social Development, held in Copenhagen from \n6 to 12 March 1995, and the twenty-fourth special session of the General Assembly, \nentitled \u201cWorld Summit for Social Development and beyond: achieving social \ndevelopment for all in a globalizing world\u201d, held in Geneva from 26 June to 1 July \n2000, \n \nReaffirming that the Copenhagen Declaration on Social Development and the \nProgramme of Action of the World Summit for Social Development 1 and the further \ninitiatives for social development adopted by the General Assembly at its twenty \nfourth special session,2 as well as a continued global dialogue on social development \nissues, constitute the basic framework for the promotion of social development for all \nat the national and international levels,  \n \nWelcoming the progress made towards the full implementation of the \nCopenhagen Declaration and the Programme of Action through concerted action at \nthe national, regional and global levels, and expressing its deep concern that, more \n__________________ \n \n1  Report of the World Summit for Social Development, Copenhagen, 6\u201312 March 1995 (United \nNations publication, Sales No. E.96.IV.8), chap. I, resolution 1, annexes I and II.  \n \n2  Resolution S-24/2, annex. \n\nA/RES/75/151 \nImplementation of the outcome of the World Summit \nfor Social Development and of the twenty-fourth \nspecial session of the General Assembly\n \n20-17281\n2/16 \n \nthan 20 years after the convening of the World Summit for Social Development, \nprogress has been slow and uneven, and major gaps remain,  \n \nWelcoming also the adoption, in its entirety, of the 2030 Agenda for Sustainable \nDevelopment,3 in which it is recognized that eradicating poverty in all its forms and \ndimensions, including extreme poverty, is the greatest global challenge and an \nindispensable requirement for sustainable development,  \n \nWelcoming further the convening in New York on 24 and 25 September 2019 of \nthe high-level political forum on sustainable development under the auspices of the \nGeneral Assembly, and its political declaration,4 aiming to follow up and \ncomprehensively review progress in the implementation of the 2030 Agenda and the \n17 Sustainable Development Goals,  \n \nWelcoming the adoption of the political declaration of the high-level meeting on \nuniversal health coverage, held in New York on 23 September 2019, entitled \n\u201cUniversal health coverage: moving together to build a healthier world\u201d, 5  \n \nReaffirming the need to achieve sustainable development by promoting \nsustained, inclusive and equitable economic growth, creating greater opportunities for \nall, reducing inequalities within and among countries, raising basic standards of living \nand fostering equitable and inclusive social development and the sustainable \nmanagement of natural resources,  \n \nRecognizing that the three core themes of social development, namely, poverty \neradication, full and productive employment and decent work for all and social \nintegration, are interrelated and mutually reinforcing, and that an enabling \nenvironment therefore needs to be created so that all three objectives can be pursued \nsimultaneously, \n \nEmphasizing the need to enhance the role of the Commission for Social \nDevelopment in the follow-up to and review of the World Summit for Social \nDevelopment and the twenty-fourth special session of the General Assembly, and \nwelcoming the decision of the Economic and Social Council that the Commission, \ngiven its mandates and experience in promoting people-centred inclusive \ndevelopment, will report on social aspects related to the agreed main theme of the \nCouncil in order to contribute to its work,6 including by offering inputs regarding the \neffective implementation of the 2030 Agenda in a holistic and inclusive manner,  \n \nWelcoming the decision of the Economic and Social Council that the \nCommission for Social Development will consider one priority theme at each session \non the basis of the follow-up to and review of the World Summit for Social \nDevelopment and its linkages to the social dimensions of the 2030 Agenda, proposing \nan action-oriented resolution with recommendations to the Council in order to \ncontribute to its work, and that the priority theme for the 2021 session, which shall \nallow the Commission to contribute to the work of the Council, will be \u201cSocially just \ntransition towards sustainable development: the role of digital technologies on social \ndevelopment and well-being of all\u201d,  \n \nRecalling the ministerial declaration adopted at the high-level segment of the \n2020 session of the Economic and Social Council and the 2020 high-level political \nforum on sustainable development, convened under the auspices of the Council, on \n__________________ \n \n3  Resolution 70/1. \n \n4  Resolution 74/4, annex. \n \n5  Resolution 74/2. \n \n6  Economic and Social Council resolution 2016/6, para. 3.  \n\nImplementation of the outcome of the World Summit \nfor Social Development and of the twenty-fourth \nspecial session of the General Assembly \nA/RES/75/151\n \n3/16\n20-17281 \n \nthe theme \u201cAccelerated action and transformative pathways: realizing the decade of \naction and delivery for sustainable development\u201d,7  \n \nReaffirming that the Declaration on the Right to Development8 also informs the \n2030 Agenda, along with other relevant instruments, such as the Addis Ababa Action \nAgenda of the Third International Conference on Financing for Development, 9 \nAgenda 2063 adopted by the African Union, and the International Labour \nOrganization Declaration on Social Justice for a Fair Globalization, 10 and reaffirming \nalso the strong political commitment to address the challenge of financing and \ncreating an enabling environment at all levels for sustainable development in the spirit \nof global partnership and solidarity,  \n \nAffirming its strong support for fair globalization and the need to translate \ngrowth into the reduction of inequalities, eradication of poverty and commitment to \nstrategies and policies that aim to promote full, freely chosen and productive \nemployment and decent work for all and that these strategies and policies should \nconstitute fundamental components of relevant national and international policies and \nnational development strategies, including inequality and poverty reduction \nstrategies, reaffirming that employment creation and decent work for all should be \nincorporated into macroeconomic policies, taking fully into account the impact and \nsocial dimension of globalization, the benefits and costs of which are often unevenly \nshared and distributed, and noting in this regard that the decent work agenda of the \nInternational Labour Organization, with its four strategic objectives, has an important \nrole to play in achieving the objective of social protection and elimination of \ninequalities, as reaffirmed in the International Labour Organization Declaration on \nSocial Justice for a Fair Globalization,  \n \nRecognizing that social inclusion is a means for achieving social integration and \nis crucial for fostering stable, safe, harmonious, peaceful and just societies and for \nimproving social cohesion so as to create an environment for development and \nprogress and to leave no one behind,  \n \nRecognizing also that the remaining effects of the world financial and economic \ncrisis have the potential to undermine progress towards achieving internationally \nagreed development goals, including the Sustainable Development Goals, and \nthreaten debt sustainability in many countries, especially developing countries,  \n \nDeeply concerned that extreme poverty and the feminization of poverty persist \nin all countries of the world, regardless of their economic, social and cultural \nsituation, and that the extent and manifestations thereof, such as hunger and \nmalnutrition, vulnerability to trafficking in persons, forced and child labour, disease, \nlack of adequate shelter and illiteracy, are heightened in developing countries and \nparticularly severe in least developed countries, while acknowledging the significant \nprogress made in several parts of the world in combating extreme poverty,  \n \nStressing the importance of removing obstacles to the realization of the right of \npeoples to self-determination, in particular of peoples living under colonial or other \nforms of alien domination or foreign occupation, which adversely affect their social \nand economic development, including their exclusion from labour markets,  \n \nStressing also the importance of establishing a just and lasting peace all over \nthe world in accordance with the purposes and principles of the Charter of the United \nNations, supporting all efforts to uphold the sovereign equality of all States and \n__________________ \n \n7  See Official Records of the General Assembly, Seventy-fifth Session, Supplement No. 3 \n(A/75/3/Rev.1), chap. VI, sect. E. \n \n8  Resolution 41/128, annex. \n \n9  Resolution 69/313, annex. \n \n10  A/63/538-E/2009/4, annex. \n\nA/RES/75/151 \nImplementation of the outcome of the World Summit \nfor Social Development and of the twenty-fourth \nspecial session of the General Assembly\n \n20-17281\n4/16 \n \nrespect their territorial integrity and political independence, and refraining in \ninternational relations from the threat or use of force in any manner inconsistent with \nthe purposes and principles of the United Nations,  \n \nRecognizing in this regard the recent efforts to establish the Aswan Forum for \nSustainable Peace and Development, which was held on 11 and 12 December 2019, \nunder the theme \u201cAn agenda for sustainable peace, security and development in \nAfrica\u201d,  \n \nRecognizing also that terrorism, trafficking in arms, organized crime, trafficking \nin persons, money-laundering, ethnic and religious conflict, civil war, politically \nmotivated killing and genocide pose increasing challenges to States and societies in \nthe attainment of conditions conducive to social development, including reduction of \ninequalities, and that they further present urgent and compelling reasons for action by \nGovernments individually and, as appropriate, jointly to foster social cohesion while \nrecognizing, protecting and valuing diversity,  \n \nRecognizing further that, since the convening of the World Summit for Social \nDevelopment in Copenhagen in 1995, advances have been made in addressing and \npromoting social integration, including through the adoption of the Madrid \nInternational Plan of Action on Ageing, 2002,11 the World Programme of Action for \nYouth,12 the Convention on the Rights of Persons with Disabilities,13 the United \nNations Declaration on the Rights of Indigenous Peoples14 and the Beijing \nDeclaration and Platform for Action,15  \n \nWelcoming the International Decade for People of African Descent (2015\u2013\n2024), which urges Member States to promote the social development of people of \nAfrican descent, particularly women and girls, by eradicating any form of \ndiscrimination, ensuring access to quality education and eliminating challenges and \nspecific risks with regard to health,  \n \nReaffirming the commitment to promoting the rights of indigenous peoples in \nthe areas of education, employment, housing, sanitation, health and social protection \nand social security, and noting the attention paid to those areas in the United Nations \nDeclaration on the Rights of Indigenous Peoples,  \n \nReaffirming also the efforts of Governments to achieve all health-related \nSustainable Development Goal targets, in particular Goal 3 of ensuring healthy lives \nand promoting well-being for all throughout the life course, by integrating those aims \ninto their national plans and policies, as well as the significant progress made in \nincreasing life expectancy, reducing maternal, newborn and child mortality and \ncombating communicable diseases,  \n \nRecognizing that action to achieve universal health coverage by 2030 is \ninadequate and that the level of progress and investment to date is insufficient to meet \ntarget 3.8 of the Sustainable Development Goals, and that the world has yet to fulfil \nits promise of implementing, at all levels, measures to address the health needs of all,  \n \nRecalling the outcome of the World Health Assembly held in May 2019, the \nagreement to accelerate and scale up action to prevent and treat non-communicable \ndiseases, the agreement on a common approach to antimicrobial resistance, the \n__________________ \n \n11  Report of the Second World Assembly on Ageing, Madrid, 8\u201312 April 2002 (United Nations \npublication, Sales No. E.02.IV.4), chap. I, resolution 1, annex II. \n \n12  Resolution 50/81, annex, and resolution 62/126, annex.  \n \n13  United Nations, Treaty Series, vol. 2515, No. 44910. \n \n14  Resolution 61/295, annex. \n \n15  Report of the Fourth World Conference on Women, Beijing, 4\u201315 September 1995 (United \nNations publication, Sales No. E.96.IV.13), chap. I, resolution 1, annexes I and II. \n\nImplementation of the outcome of the World Summit \nfor Social Development and of the twenty-fourth \nspecial session of the General Assembly \nA/RES/75/151\n \n5/16\n20-17281 \n \nadoption of a new global strategy on health, the environment and climate change, and \nthe adoption by the Assembly of the eleventh revision of the International Statistical \nClassification of Diseases and Related Health Problems, which will go into effect on \n1 January 2022,  \n \nReaffirming the commitments made in the 2030 Agenda, including to ensure \ninclusive and equitable quality education and promote lifelong learning opportunities \nfor all,  \n \nNoting with concern that, despite the progress achieved, at least half of the \nworld\u2019s population lacks access to essential health services, more than 800 million \npeople bear the burden of catastrophic spending of at least 10 per cent of their \nhousehold income on health care and out-of-pocket expenses drive almost 100 million \npeople into poverty each year,  \n \nReaffirming education for sustainable development as a vital means of \nimplementation for sustainable development, as outlined in the Aichi-Nagoya \nDeclaration on Education for Sustainable Development, 16 and as an integral element \nof the Sustainable Development Goal on quality education and a key enabler of all \nthe other Goals, and welcoming the increased international recognition of education \nfor sustainable development in quality education and lifelong learning,  \n \nAcknowledging the importance for achieving sustainable development of \ndelivering quality education to all girls and boys, which will require reaching children \nliving in extreme poverty, children with disabilities, migrant and refugee children and \nthose in conflict and post-conflict situations and providing safe, non-violent, \ninclusive and effective learning environments for all, and recognizing the importance \nof scaling up investments and international cooperation to allow all children to \ncomplete free, equitable, inclusive and quality early childhood, primary and \nsecondary education, including through scaling up and strengthening initiatives, such \nas the Global Partnership for Education, and by upgrading education facilities that \nare child-, disability- and gender-sensitive and increasing the percentage of qualified \nteachers in developing countries, including through international cooperation, \nespecially in the least developed countries and small island developing States,  \n \nReiterating the contribution of education to eradicating poverty in all forms and \ndimensions by providing people with knowledge and skills, which increases \nproductivity and income and helps in reducing inequality within countries,  \n \nAcknowledging the importance of adopting science, technology and innovation \nstrategies as integral elements of national sustainable development strategies to help \nto strengthen knowledge-sharing and collaboration and the importance of scaling up \ninvestment in science, technology, engineering and mathematics education and \nenhancing technical, vocational and tertiary education, distance education and \ntraining and of ensuring equal access for all women and girls and encouraging their \nparticipation therein, \n \nWelcoming the adoption of resolutions 74/270 of 2 April 2020 on global \nsolidarity to fight the coronavirus disease (COVID-19), 74/274 of 20 April 2020 on \ninternational cooperation to ensure global access to medicines, vaccines and medical \nequipment to face COVID-19, 74/306 of 11 September 2020 entitled \u201cComprehensive \nand coordinated response to the coronavirus disease (COVID-19) pandemic\u201d and \n74/307 of 11 September 2020 entitled \u201cUnited response against global health threats: \ncombating COVID-19\u201d, \n \nConcerned that the current COVID-19 crisis is likely to reverse decades of \nprogress in social development, leaving more people behind and that it has also had \n__________________ \n \n16  A/70/228, annex. \n\nA/RES/75/151 \nImplementation of the outcome of the World Summit \nfor Social Development and of the twenty-fourth \nspecial session of the General Assembly\n \n20-17281\n6/16 \n \na negative impact on the abilities of Governments to realize the 2030 Agenda and \nachieve the Sustainable Development Goals, stressing that at this critical moment in \nthe decade of action to deliver the Goals by 2030 the visions, principles and \ncommitments made at the World Summit for Social Development remain valid and \nare central to addressing emerging global challenges, and recalling that social policies \nhave a key role to play in addressing the immediate effects of crises,  \n \nDeeply concerned that the COVID-19 pandemic, owing to its severe disruptions \nto societies, economies, employment, global trade, supply chains and travel, and \nagricultural, industrial and commercial systems, is having a devastating impact on \nsustainable development and humanitarian needs, including on poverty eradication, \nlivelihoods, ending hunger, food security and nutrition, education, environmentally \nsound waste management and access to health care, especially for the poor and people \nin vulnerable situations and in countries in special situations and those countries most \naffected, and is making the prospect of achieving all Sustainable Development Goals \nmore difficult, including eradicating poverty in all its forms and dimensions by 2030, \nending hunger and achieving food security and improved nutrition, \n \n1.  \nTakes note of the report of the Secretary-General;17  \n \n2. \nWelcomes the reaffirmation by Governments of their will and commitment \nto continue implementing the Copenhagen Declaration on Social Development and \nthe Programme of Action of the World Summit for Social Development, in particular \nto promote equality and social justice, eradicate poverty, promote full and productive \nemployment and decent work for all and foster social integration to achieve stable, \nsafe and just societies for all, and recognizes that the implementation of the \nCopenhagen commitments and the attainment of the internationally agreed \ndevelopment goals are mutually reinforcing;  \n \n3. \nReaffirms its commitment to working tirelessly for the full implementation \nof the 2030 Agenda for Sustainable Development, and its recognition that eradicating \npoverty in all its forms and dimensions, including extreme poverty, is the greatest \nglobal challenge and an indispensable requirement for achieving sustainable \ndevelopment in its three dimensions \u2013 economic, social and environmental \u2013 in a \nbalanced, holistic and integrated manner;  \n \n4. \nRecognizes that poverty is a multidimensional phenomenon, and \nencourages Member States to develop comprehensive, integrated and coherent \npoverty eradication strategies that effectively address the structural causes of poverty \nand inequality with an emphasis on job-rich growth; address and meet the basic \nhuman needs of people living in poverty; ensure their access to quality education, \nnutrition, health, water, sanitation, housing and other public social services, access to \nemployment and decent work for all, as well as access to productive resources, \nincluding credit, land, training, technology and knowledge; and ensure their \nparticipation in decision-making on social and economic development policies and \nprogrammes in this regard;  \n \n5. \nEmphasizes that the major United Nations conferences and summits, \nincluding the Millennium Summit, the International Conference on Financing for \nDevelopment, in its Monterrey Consensus,18 the 2005 World Summit, the Follow-up \nInternational Conference on Financing for Development to Review the \nImplementation of the Monterrey Consensus, in its Doha Declaration on Financing \n__________________ \n \n17  A/75/216. \n \n18  Report of the International Conference on Financing for Development, Monterrey, Mexico, \n18\u221222 March 2002 (United Nations publication, Sales No. E.02.II.A.7), chap. I, resolution 1, \nannex. \n\nImplementation of the outcome of the World Summit \nfor Social Development and of the twenty-fourth \nspecial session of the General Assembly \nA/RES/75/151\n \n7/16\n20-17281 \n \nfor Development,19 the high-level plenary meeting of the General Assembly on the \nMillennium Development Goals, the United Nations Conference on Sustainable \nDevelopment, the 2013 special event to follow up efforts made towards achieving the \nMillennium Development Goals, the third International Conference on Financing for \nDevelopment, in its Addis Ababa Action Agenda, and the United Nations summit for \nthe adoption of the post-2015 development agenda, have reinforced the priority and \nurgency of the eradication of poverty in all its forms and dimensions within the United \nNations development agenda; \n \n6. \nRecognizes the complex character of the ongoing food insecurity situation, \nincluding food price volatility, as a combination of several major factors, both \nstructural and conjunctural, which is also negatively affected by, inter alia, \nenvironmental degradation, drought and desertification, global climate change, \nnatural disasters, the lack of the necessary technology and armed conflicts, and also \nrecognizes that a strong commitment from national Governments and the international \ncommunity as a whole is required to confront the major threats to food security and \nto ensure that policies in the area of agriculture do not distort trade and worsen food \ninsecurity;  \n \n7. \nReaffirms the importance of supporting the African Union\u2019s development \nframework, Agenda 2063, as well as its 10-year plan of action, as a strategic \nframework for ensuring a positive socioeconomic transformation in Africa within the \nnext 50 years, which is the African Union long-term strategy emphasizing \nindustrialization, youth employment, improved natural resource governance and the \nreduction of inequalities, and its continental programme embedded in the resolutions \nof the General Assembly on the New Partnership for Africa\u2019s Development 20 and \nregional initiatives, such as the Comprehensive Africa Agriculture Development \nProgramme;  \n \n8. \nStresses that the benefits of economic growth should be inclusive and \ndistributed more equitably and that, in order to close the gap of inequality and avoid \nany further deepening of inequality, comprehensive social policies and programmes, \nincluding appropriate social transfer and job creation programmes and social \nprotection systems, are needed;  \n \n9. \nReaffirms that social integration policies should seek to reduce \ninequalities, promote access to basic social services, quality education for all and \nhealth care, eliminate discrimination, increase the participation and integration of \nsocial groups, particularly young people, older persons and persons with disabilities, \nnoting the role of sports in this regard, and address the challenges posed to social \ndevelopment by globalization and market-driven reforms in order for all people in all \ncountries to benefit from globalization;  \n \n10. Stresses that an enabling environment is a critical precondition for \nachieving equity and social development and that, while economic growth is essential, \nentrenched inequality and marginalization are an obstacle to the broad-based and \nsustained growth required for sustainable, inclusive and people-centred development, \nand recognizes the need to balance and ensure complementarity between measures to \nachieve growth and measures to achieve economic and social equity and inclusion in \norder for there to be an impact on overall poverty levels;  \n \n11. \nAcknowledges that investment in human capital and social protection has \nbeen proven to be effective in reducing poverty and inequality, and invites Member \nStates to mobilize innovative sources of financing, including through public-private \npartnerships, to secure adequate levels of social expenditure necessary for expanding \n__________________ \n \n19  Resolution 63/239, annex. \n \n20  A/57/304, annex. \n\nA/RES/75/151 \nImplementation of the outcome of the World Summit \nfor Social Development and of the twenty-fourth \nspecial session of the General Assembly\n \n20-17281\n8/16 \n \ncoverage towards universal access to health education, innovation, new technologies \nand basic social protection and to address the issues of illicit financial flows and \ncorruption;  \n \n12. Stresses that international trade and stable financial systems can be \neffective tools to create favourable conditions for the development of all countries \nand that trade barriers and some trading practices continue to have negative effects \non employment growth, particularly in developing countries, that good governance \nand the rule of law at the national and international levels and the need to promote \nrespect for all human rights and fundamental freedoms are essential for sustained \neconomic growth, sustainable development, the reduction of inequalities, the \neradication of poverty, hunger and malnutrition and for addressing the most pressing \nsocial needs of people living in poverty, and in this regard also stresses the importance \nof economic, social and cultural rights and the importance of the principles of \nnon-discrimination, inclusivity and meaningful participation for the implementation \nof the outcome of the World Summit for Social Development;  \n \n13. Acknowledges that inequalities persist within and among countries, posing \nsignificant challenges to social cohesion, reaffirms that the eradication of poverty, the \npromotion of prosperity, gender equality and the empowerment of all women and girls \nand the reduction of inequality within and among countries are fundamental to \nachieving sustainable development for all, and that this requires collective and \ntransformative efforts to leave no one behind and put the furthest behind first, and \nadapt institutions and policies to take into account the multidimensional nature of \ninequality and poverty and the inherent interlinkages between different Goals and \ntargets of the 2030 Agenda;  \n \n14. Urges Member States to strengthen social policies, as appropriate, paying \nparticular attention to the specific needs of disadvantaged and marginalized social \ngroups, inter alia, women, children, youth, persons with disabilities, people living \nwith HIV/AIDS, older persons, indigenous peoples, refugees, internally displaced \npersons, migrants and other persons in vulnerable situations, as well as to address all \nforms of violence in its many manifestations, including domestic violence, and \ndiscrimination, including xenophobia, against them, to ensure that these groups are \nnot left behind, and recognizes that violence increases the challenges faced by States \nand societies in the achievement of poverty eradication, full and productive \nemployment and decent work for all, and social integration;  \n \n15. Reaffirms the commitment to gender equality and the empowerment of all \nwomen and girls, as well as to the mainstreaming of a gender perspective into all \ndevelopment efforts, recognizing that they are critical for achieving sustainable \ndevelopment and for efforts to combat hunger and malnutrition, poverty and disease, \nto strengthening policies and programmes that improve, ensure and broaden the full \nparticipation of women in all spheres of political, economic, social and cultural life \nas equal partners and to improving the access of women to all resources needed for \nthe full exercise of all their human rights and fundamental freedoms by removing \npersistent barriers and allocating adequate resources for the elimination of all forms \nof violence and discrimination against women, including in the workplace, inter alia, \nby addressing wage inequality, ensuring equal access to full and productive \nemployment and decent work for all, reconciliation of work and private life for both \nmen and women, as well as strengthening their economic independence;  \n \n16. Recognizes that youth participation is important for development, and \nurges Member States and United Nations entities, in consultation with youth and \nyouth-led and youth-focused organizations, to explore and promote new avenues for \nthe full, effective, structured and sustainable participation of young people and youth-\nled organizations in relevant decision-making processes and monitoring, in all \n\nImplementation of the outcome of the World Summit \nfor Social Development and of the twenty-fourth \nspecial session of the General Assembly \nA/RES/75/151\n \n9/16\n20-17281 \n \nspheres of political, economic, social and cultural life, including in designing and \nimplementing policies, programmes and initiatives, in particular while implementing \nthe 2030 Agenda;  \n \n17.  Reaffirms the right to food and acknowledges the importance of promoting \nsustainable farming and agriculture, and, recognizing the important contribution that \nfamily farming and smallholder farming can play in providing food security, reducing \ninequality in access to food and nutrition, calls upon Governments to ensure access \nby all people, in particular the poor and people in vulnerable situations, including \ninfants, to safe, nutritious and sufficient food all year round;  \n \n18.  Urges Governments, with the cooperation of relevant entities, to establish \nnationally appropriate social protection that supports labour market participation and \naddresses and reduces inequality and social exclusion, and social protection systems \nand floors, including through streamlining fragmented social protection systems/ \nprogrammes, ensuring that such programmes are gender-responsive and disability-\nsensitive, and progressively extend their coverage to all people throughout their life \ncycle, including for workers in the informal economy, invites the International Labour \nOrganization, upon request, to support government efforts to strengthen social \nprotection strategies and policies on extending social protection and social security \ncoverage, urges Governments, while taking account of national circumstances, to \nfocus on the needs of those living in, or vulnerable to, poverty and to give particular \nconsideration to universal access to basic social security systems, including the \nimplementation of social protection floors, which can provide a systemic base upon \nwhich to address poverty and vulnerability, and in this regard takes note of the \nInternational Labour Organization recommendation on social protection floors;  \n \n19.  Stresses the need to address challenges faced by those working in informal \nor vulnerable jobs, by investing in the creation of more decent work opportunities, \nincluding providing access to decent jobs in the formal sector in accordance with \nInternational Labour Organization recommendation No. 204 concerning the transition \nfrom the informal to the formal economy, and enhancing the productive capacities of \npeople, and strengthen labour institutions and employment and labour-market \npolicies, taking into consideration the specific circumstances of each country and by \npromoting close partnerships with relevant stakeholders;  \n \n20. Urges Member States to strengthen, as appropriate, the authority and \ncapacity of national mechanisms for promoting gender equality and the empowerment \nof women and girls, at all levels, which should be placed at the highest possible level \nof government, with sufficient funding, and to mainstream a gender perspective \nacross all relevant national and local institutions, including labour, economic and \nfinancial government agencies, in order to ensure that national planning, decision-\nmaking, policy formulation and implementation, budgeting processes and \ninstitutional structures contribute to women\u2019s economic empowerment in the \nchanging world of work;  \n \n21.  Also urges Member States to address the high rates of youth \nunemployment, underemployment, vulnerable employment, informal employment \nand young people not in employment, education or training by developing and \nimplementing targeted and integrated local and national youth employment policies \nfor inclusive, sustainable and innovative job creation, improved employability, skills \ndevelopment and vocational training to facilitate the transition from school to work \nand to increase the prospects for integrating youth into the sustainable labour market, \nand through increased entrepreneurship, including the development of networks of \nyoung entrepreneurs at the local, national, regional and global levels that foster \nknowledge among young people about their rights and responsibilities in society, and \nencourages Member States to invest in education, support lifelong learning and \n\nA/RES/75/151 \nImplementation of the outcome of the World Summit \nfor Social Development and of the twenty-fourth \nspecial session of the General Assembly\n \n20-17281\n10/16 \n \nprovide social protection for all youth and to request donors, specialized United \nNations entities and the private sector to continue to provide assistance to Member \nStates, including technical and funding support, as appropriate;  \n \n22.  Recognizes that promoting full employment and decent work for all also \nrequires investing in education, training and skills development for women and men, \nand girls and boys, strengthening social protection and health systems and applying \ninternational labour standards, and urges States and, as appropriate, the relevant \nentities of the United Nations system and international and regional organizations, \nwithin their respective mandates, as well as civil society, the private sector, employer \norganizations, trade unions, the media and other relevant actors, to continue to \ndevelop and strengthen policies, strategies and programmes to enhance, in particular, \nthe employability of women and youth and to ensure their access to full and \nproductive employment and decent work for all, including by improving access to \nformal and non-formal education, skills development and vocational training, lifelong \nlearning and retraining and long-distance education, inter alia, in information and \ncommunications technology and entrepreneurial skills, particularly in developing \ncountries, including with a view to supporting the economic empowerment of women \nin the different stages of their lives;  \n \n23. Reaffirms the New Urban Agenda,21 which envisages cities and human \nsettlements that fulfil their social function, including the social and ecological \nfunction of land, with a view to progressively achieving the full realization of the \nright to adequate housing, as a component of the right to an adequate standard of \nliving, without discrimination, universal access to safe and affordable drinking water \nand sanitation, as well as equal access for all to public goods and quality services in \nareas such as food security and nutrition, health, education, infrastructure, mobility \nand transportation, energy, air energy, air quality and livelihoods;  \n \n24. Recognizes that the negative effects of climate change and environmental \ndisasters have differential impacts, with people in vulnerable situations, poor and \nrural communities and low-income countries being disproportionately exposed to \nfloods, droughts and other natural disasters, and that they have a lower capacity and \nassets to recover from such external shocks, and expresses concern that climate \nchange may cause high and volatile food and commodity prices and hit them hardest;  \n \n25. Acknowledges the important nexus between international migration and \nsocial development, and stresses the importance of effectively enforcing labour laws \nwith regard to labour relations and working conditions of migrant workers, inter alia, \nthose related to their remuneration and conditions of health, safety at work and the \nright to freedom of association;  \n \n26. Reaffirms that social development requires the active involvement of all \nactors in the development process, including civil society organizations, corporations, \nthe public sector and small businesses, and that partnerships among all relevant actors \nwithin countries are increasingly becoming part of national and international \ncooperation for social development, also reaffirms that, within countries, partnerships \namong the Government, civil society and the private sector can contribute effectively \nto the achievement of social development goals, and acknowledges the role of the \npublic and private sectors as employers and enablers for the effective generation of \nnew investments, full and productive employment and decent work for all, including \nthrough partnerships with the United Nations system, civil society and academia;  \n \n27. Stresses the importance of the policy space and leadership of national \nGovernments for implementing policies for poverty eradication and sustainable \ndevelopment, while remaining consistent with relevant international rules and \n__________________ \n \n21  Resolution 71/256, annex. \n\nImplementation of the outcome of the World Summit \nfor Social Development and of the twenty-fourth \nspecial session of the General Assembly \nA/RES/75/151\n \n11/16\n20-17281 \n \ncommitments, in particular in the areas of human rights, social expenditure and social \nprotection programmes, and calls upon international financial institutions and donors \nto support developing countries in achieving their social development, in line with \ntheir national priorities and strategies, by, among other things, providing debt relief \nwithin the context of the implementation of the 2030 Agenda;  \n \n28. Underlines the responsibility of the private sector, at both the national and \nthe international levels, including small and large companies and transnational \ncorporations, regarding not only the economic and financial implications but also the \ndevelopment, social, gender and environmental implications of their activities, their \nobligations towards their workers and their contributions to achieving sustainable \ndevelopment, including social development, emphasizes that transnational \ncorporations and other business enterprises have a responsibility to respect human \nrights, applicable laws and international principles and standards, to operate \ntransparently, in a socially and environmentally responsible manner, and to refrain \nfrom affecting the well-being of peoples, and also emphasizes the need to take further \nconcrete actions on corporate responsibility and accountability, including through the \nparticipation of all relevant stakeholders, inter alia, for the prevention or prosecution \nof corruption, and to prevent human rights abuses;  \n \n29. Reaffirms the necessity of improving availability, affordability and \nefficiency of health products by increasing transparency of prices of medicines, \nvaccines, medical devices, diagnostics, assistive products, cell- and gene-based \ntherapies and other health technologies across the value chain, including through \nimproved regulations and building constructive engagement and a stronger \npartnership with relevant stakeholders, including industries, the private sector and \ncivil society, in accordance with national and regional legal frameworks and contexts, \nto address the global concern about the high prices of some health products, and in \nthis regard encourages the World Health Organization to continue its efforts to \nbiennially convene the Fair Pricing Forum with Member States and all relevant \nstakeholders to discuss the affordability and transparency of prices and costs relating \nto health products;  \n \n30. Recognizes that health is an investment in human capital and social and \neconomic development, towards the full realization of human potential, and \nsignificantly contributes to the promotion and protection of human rights and dignity \nas well as the empowerment of all people;  \n \n31. Welcomes the renewed commitment in the political declaration of the high-\nlevel meeting on universal health coverage to achieve universal health coverage, \nwhich implies that all people have access, without discrimination, to nationally \ndetermined sets of the needed promotive, preventive, curative, rehabilitative and \npalliative essential health services, and essential, safe, affordable, effective and \nquality medicines and vaccines, while ensuring that the use of these services does not \nexpose the users to financial hardship, with a special emphasis on those who are \nmarginalized;  \n \n32. Reaffirms that achieving universal health coverage, including financial \nrisk protection, access to quality essential health-care services and access to safe, \neffective, quality and affordable essential medicines and vaccines for all, is essential \nto eradicate poverty, and reduce inequality and achieve sustainable development for \nall;  \n \n33. Acknowledges that expanding health care is a challenge, as well as the \nrising cost of medications and health products is threatening the sustainability of \nhealth systems in many countries, and stresses the responsibility of States to ensure \naccess to all, without discrimination of any kind, of medicines, in particular essential \nmedicines, that are affordable, safe, effective and of quality;  \n\nA/RES/75/151 \nImplementation of the outcome of the World Summit \nfor Social Development and of the twenty-fourth \nspecial session of the General Assembly\n \n20-17281\n12/16 \n \n \n34. Expresses concern at the global shortfall of 18 million health workers, \nprimarily in low- and middle income countries, recognizes the need to train, build and \nretain a skilled health workforce, including nurses, midwives and community health \nworkers, who are an important element of strong and resilient health systems, and \nalso recognizes that increased investment in a more effective and socially accountable \nhealth workforce can unleash significant socioeconomic gains and contribute to the \neradication of poverty in all its forms and dimensions, the empowerment of all women \nand girls and the reduction of inequality;  \n \n35. Calls upon States, at the international level, to take steps, individually \nand/or through international cooperation, in accordance with applicable international \nlaw, including international agreements, to ensure that their actions as members of \ninternational organizations take into due account the right of everyone to the \nenjoyment of the highest attainable standard of physical and mental health, and that \nthe application of international agreements is supportive of public health policies that \npromote broad access to safe, effective and affordable medicines;  \n \n36. Encourages all States to apply measures and procedures for enforcing \nintellectual property rights in such a manner as to avoid creating barriers to the \nlegitimate trade in medicines, and to provide for safeguards against the abuse of such \nmeasures and procedures;  \n \n37. Calls upon Member States to make greater investments and promote \ndecent work in the health and social sectors, enable safe working environments and \nconditions, effective retention and equitable and broad distribution of the health \nworkforce, and strengthen capacities to optimize the existing health workforce, \nincluding through expanding rural and community-based health education and \ntraining to contribute to the achievement of universal health coverage;  \n \n38. Encourages Governments to end all forms of malnutrition, including the \ninternationally agreed targets on stunting and wasting in children under 5 years of \nage, and address the nutritional needs of adolescent girls, pregnant and lactating \nwomen and older persons;  \n \n39. Welcomes the rapid expansion in school enrolment worldwide, with \nliteracy rates rising steadily over the past 50 years to reach 68 per cent in 2016, and \nthe improvement in the access to early childhood, primary, secondary, tertiary and \ndistance education and throughout the life course, and calls upon the international \ncommunity to provide inclusive and equitable quality education at all levels so that \nall people may have access to lifelong learning opportunities that help them to acquire \nthe knowledge and skills needed to exploit opportunities to participate fully in \nsociety;  \n \n40. Recognizes the limited access to and high rates of dropout from school and \nsecondary education, the increased rates of exclusion from education with age and \nthe existence of large disparities in school attendance and learning acquisition by \nregion, wealth, sex, urban or rural residence and other factors such as indigenous \nidentity or disability, underscoring the challenges ahead, and also recognizes that \npoverty may affect access to quality education at the secondary and tertiary levels;  \n \n41. Also recognizes that factors such as poverty, residing in a rural area or \nhaving a disability all too often prevent children and adolescents from accessing \nquality education, especially at the secondary and tertiary levels;  \n \n42. Encourages all States to measure progress in the realization of the right to \neducation, such as by developing national indicators as an important tool for the \nrealization of the right to education and for policy formulation, impact assessment \nand transparency;  \n\nImplementation of the outcome of the World Summit \nfor Social Development and of the twenty-fourth \nspecial session of the General Assembly \nA/RES/75/151\n \n13/16\n20-17281 \n \n \n43. Encourages States to increase investments and international cooperation \nto allow all girls and boys to complete free, equitable, inclusive and quality early \nchildhood, primary and secondary education, including by scaling up and \nstrengthening initiatives, such as the Global Partnership for Education, and to explore \nadditional innovative mechanisms based on models combining public and private \nresources, while ensuring that all education providers give due respect to the right to \neducation;  \n \n44. Urges States to support the efforts of developing countries, in particular \nleast developed countries, to realize progressively the right to education, including \nthe progressive realization of the equal enjoyment of the right to education by every \ngirl through appropriate resources, including financial and technical resources, in \nsupport of country-led national education plans;  \n \n45. Reaffirms the right to education, and calls upon the international \ncommunity to provide universal access to inclusive, equal and non-discriminatory \nquality education at all levels \u2013 early childhood, primary, secondary, tertiary and \ndistance education, including technical and vocational training \u2013 as well as to promote \nthe completion of primary and secondary education so that all people may have access \nto lifelong learning opportunities that help them to acquire the knowledge and skills \nneeded to exploit opportunities to participate fully in society and contribute to \nsustainable development;  \n \n46. Recognizes that substantial and efficiently spent investments are needed to \nimprove the quality of education and vocational training and in order to enable \nmillions of people to acquire skills for decent work, and takes note with appreciation \nof the report of the International Commission on Financing Global Education \nOpportunity and the recommendations contained therein, as appropriate;  \n \n47. Urges Member States to promote and respect women\u2019s right to education \nthroughout the life course at all levels, especially for those who have been left furthest \nbehind, and eliminate gender disparities in access to all areas of secondary and tertiary \neducation, promote financial literacy and inclusion, digital literacy and \nentrepreneurship, ensure that women and girls have equal access to career \ndevelopment, training, scholarships and fellowships and adopt positive action to build \nwomen\u2019s and girls\u2019 leadership skills and influence, and adopt measures that promote, \nrespect and guarantee the safety of women and girls in the school environment and \nthat support women and girls with disabilities at all levels of education and training;  \n \n48. Reaffirms that international cooperation has an essential role in assisting \ndeveloping countries, including the least developed and middle-income countries, in \nstrengthening their human, institutional and technological capacity;  \n \n49. Underlines that South-South cooperation is an important element of \ninternational cooperation for development as a complement to, not a substitute for, \nNorth-South cooperation, recognizes its increased importance, different history and \nparticularities, and stresses that it should be seen as an expression of solidarity among \npeoples and countries of the South, based on their shared experiences and objectives, \nand that it should continue to be guided by the principles of respect for national \nsovereignty, national ownership and independence, equality, non-conditionality, \nnon-interference in domestic affairs and mutual benefit;  \n \n50. Emphasizes that international public finance plays an important role in \ncomplementing the efforts of countries to mobilize public resources domestically, \nespecially in the poorest and the most vulnerable countries with limited domestic \nresources, and that an important use of international public finance, including official \ndevelopment assistance, is to catalyse the mobilization of additional resources from \nother public and private sources, and notes that official development assistance \n\nA/RES/75/151 \nImplementation of the outcome of the World Summit \nfor Social Development and of the twenty-fourth \nspecial session of the General Assembly\n \n20-17281\n14/16 \n \nproviders have reaffirmed their respective commitments, including the commitment \nby many developed countries to achieve the target of 0.7 per cent of gross national \nincome for official development assistance to developing countries and 0.15 to 0.2 \nper cent of gross national income for official development assistance to the least \ndeveloped countries;  \n \n51. Welcomes the increase in the volume of official development assistance \nsince the adoption of the Monterrey Consensus, expresses its concern that many \ncountries still fall short of their official development assistance commitments, \nreiterates that the fulfilment of all official development assistance commitments \nremains crucial, commends those few countries that have met or surpassed their \ncommitment to 0.7 per cent of gross national income for official development \nassistance and the target of 0.15 to 0.20 per cent of gross national income for official \ndevelopment assistance to the least developed countries, urges all other countries to \nstep up efforts to increase their official development assistance and to make additional \nconcrete efforts towards the official development assistance targets, welcomes the \ndecision by the European Union reaffirming its collective commitment to achieve the \ntarget of 0.7 per cent of gross national income for official development assistance \nwithin the time frame of the 2030 Agenda and undertaking to meet collectively the \ntarget of 0.15 to 0.20 per cent of gross national income for official development \nassistance to the least developed countries in the short term and to reach 0.20 per cent \nof gross national income for official development assistance to the least developed \ncountries within the time frame of the 2030 Agenda, and encourages official \ndevelopment assistance providers to consider setting a target to provide at least 0.20 \nper cent of gross national income for official development assistance to the least \ndeveloped countries;  \n \n52. Stresses the essential role that official development assistance plays in \ncomplementing, leveraging and sustaining financing for development efforts in \ndeveloping countries and in facilitating the achievement of development objectives, \nincluding the internationally agreed development goals, in particular the Sustainable \nDevelopment Goals, and welcomes steps to improve the effectiveness and quality of \naid based on the fundamental principles of national ownership, alignment, \nharmonization, managing for results and mutual accountability;  \n \n53. Welcomes the contribution to the mobilization of resources for social \ndevelopment by the initiatives taken on a voluntary basis by groups of Member States \nbased on innovative financing mechanisms, including those that aim to provide \nfurther access to drugs at affordable prices to developing countries on a sustainable \nand predictable basis, such as the International Drug Purchase Facility, UNITAID, as \nwell as other initiatives such as the International Finance Facility for Immunization \nand the Advance Market Commitment for Vaccines;  \n \n54. Encourages Governments to support the research and development of \nvaccines and medicines for the communicable and non-communicable diseases that \nprimarily affect developing countries, provide access to affordable essential \nmedicines and vaccines, in accordance with the Doha Declaration on the TRIPS \nAgreement and Public Health, which affirms the right of developing countries to use \nto the full the provisions in the Agreement on Trade-Related Aspects of Intellectual \nProperty Rights regarding flexibilities to protect public health, and, in particular, \nprovide access to medicines for all;  \n \n55. Stresses that the international community shall enhance its efforts to create \nan enabling environment for social development and poverty eradication through \nincreasing market access for developing countries, technology transfer on mutually \nagreed terms, financial aid and a comprehensive solution to the external debt problem;  \n\nImplementation of the outcome of the World Summit \nfor Social Development and of the twenty-fourth \nspecial session of the General Assembly \nA/RES/75/151\n \n15/16\n20-17281 \n \n \n56. Reaffirms that each country has the primary responsibility for its own \neconomic and social development and that the role of national policies and \ndevelopment strategies cannot be overemphasized, and underlines the importance of \nadopting effective measures, including new financial mechanisms, as appropriate, to \nsupport the efforts of developing countries to achieve sustained economic growth, \nsustainable development, poverty eradication and the strengthening of their \ndemocratic systems;  \n \n57. Stresses that the international community should support national \ncommitments to eradicate poverty in all its forms and dimensions with the goal to \nensure that no one is left behind, and recognizes the need for greater international \ncooperation to further reduce inequality between and within countries and increase \ncapacity-building support to countries with the most constrained resources to ensure \nthat social expenditures meet certain targets;  \n \n58.  Reconfirms the Addis Ababa Action Agenda, and recognizes the need to \ntake steps to significantly increase investment to close resource gaps, including \nthrough the mobilization of financial resources from all sources, including public, \nprivate, domestic and international resource mobilization and allocation;  \n \n59.  Reaffirms that the Commission for Social Development, as a functional \ncommission of the Economic and Social Council, in promoting the integrated \ntreatment of social development issues in the United Nations system, shall review, on \na periodic basis, issues related to the follow-up to and implementation of the \nCopenhagen Declaration and the Programme of Action, in a manner consistent with \nthe functions and contributions of the relevant organs, organizations and bodies of the \nUnited Nations system, and shall advise the Council thereon;  \n \n60.  Also reaffirms that the Commission for Social Development continues to \nhave the primary responsibility for the follow-up to and review of the World Summit \nfor Social Development and the outcome of the twenty-fourth special session of the \nGeneral Assembly, and that it serves as the main United Nations forum for an \nintensified global dialogue on social development issues, and calls upon Member \nStates, the relevant specialized agencies, funds and programmes of the United Nations \nsystem and civil society to enhance their support for its work;  \n \n61.  Further reaffirms the mandate of the Commission for Social Development \nand that social development is a cross-cutting element in discussions surrounding the \n2030 Agenda, and calls upon Member States, the relevant specialized agencies, funds \nand programmes of the United Nations system, civil society and relevant stakeholders \nto enhance their support for the high-level political forum on sustainable development \nas it builds upon the work of the functional commissions of the Economic and Social \nCouncil, including the Commission, while reflecting the integrated nature of the \nSustainable Development Goals as well as the interlinkages between them;  \n \n62.  Requests the United Nations funds, programmes and agencies to continue \nto support national efforts of Member States to achieve inclusive social development \nin a coherent and coordinated manner, to mainstream the goal of full and productive \nemployment and decent work for all into their policies, programmes and activities, as \nwell as to support efforts of Member States aimed at achieving this objective, and \ninvites financial institutions to support efforts in this regard;  \n \n63. Invites the Secretary-General, the Economic and Social Council, the \nregional commissions, the relevant specialized agencies, the funds and programmes \nof the United Nations system and other intergovernmental forums, within their \nrespective mandates, to continue to integrate into their work programmes and give \npriority attention to the Copenhagen commitments and the Declaration on the tenth \n\nA/RES/75/151 \nImplementation of the outcome of the World Summit \nfor Social Development and of the twenty-fourth \nspecial session of the General Assembly\n \n20-17281\n16/16 \n \nanniversary of the World Summit for Social Development,22 to continue to be actively \ninvolved in their follow-up and to monitor the achievement of those commitments \nand undertakings;  \n \n64.  Calls upon the Commission for Social Development to continue to address \ninequality in all its dimensions, in the context of the implementation of the \nCopenhagen Declaration and the Programme of Action, as well as the implementation \nof the 2030 Agenda, and invites the Commission to emphasize the increased exchange \nof national, regional and international experiences, the focused and interactive \ndialogues among experts and practitioners and the sharing of best practices and \nlessons learned;  \n \n65.  Requests the Secretary-General to continue engaging with Member States \nto sustain and further strengthen the political momentum on health-related issues, \nincluding the realization of universal health coverage and, in close collaboration with \nrelevant United Nations agencies and other stakeholders, including regional \norganizations, to strengthen existing initiatives that are led and coordinated by the \nWorld Health Organization to provide assistance to Member States, upon their \nrequest, towards the achievement of universal health coverage and all health-related \ntargets of the Sustainable Development Goals;  \n \n66.  Calls upon the international community to provide inclusive and equitable \nquality education at all levels throughout the life course \u2013 early childhood, primary, \nsecondary, tertiary and distance education, including technical and vocational \ntraining \u2013 so that all people, particularly those in vulnerable situations, may have \naccess to lifelong learning opportunities that help them to acquire the knowledge and \nskills needed to exploit opportunities to participate fully in society and contribute to \nsustainable development;  \n \n67.  Decides to include in the provisional agenda of its seventy-sixth session, \nunder the item entitled \u201cSocial development\u201d, the sub-item entitled \u201cImplementation \nof the outcome of the World Summit for Social Development and of the twenty-fourth \nspecial session of the General Assembly\u201d, with a particular focus on significant \nincrease and/or more efficient utilization of the resources allocated to social \ndevelopment in order to achieve the goals of the World Summit through national \naction and regional and international cooperation, taking into consideration the \nmultifaceted impacts of the COVID-19 pandemic and its consequences, especially on \nsocial development, and requests the Secretary-General to submit a report on the \nquestion to the Assembly at that session.\n \n46th plenary meeting \n16 December 2020 \n \n__________________ \n \n22  See Official Records of the Economic and Social Council, 2005, Supplement No. 6 (E/2005/26), \nchap. I, sect. A; see also Economic and Social Council decision 2005/234. \n",
  "paragraphs": {
    "1": "Takes note of the report of the Secretary-General;17",
    "2": "Welcomes the reaffirmation by Governments of their will and commitment to continue implementing the Copenhagen Declaration on Social Development and the Programme of Action of the World Summit for Social Development, in particular to promote equality and social justice, eradicate poverty, promote full and productive employment and decent work for all and foster social integration to achieve stable, safe and just societies for all, and recognizes that the implementation of the Copenhagen commitments and the attainment of the internationally agreed development goals are mutually reinforcing;",
    "3": "Reaffirms its commitment to working tirelessly for the full implementation of the 2030 Agenda for Sustainable Development, and its recognition that eradicating poverty in all its forms and dimensions, including extreme poverty, is the greatest global challenge and an indispensable requirement for achieving sustainable development in its three dimensions \u2013 economic, social and environmental \u2013 in a balanced, holistic and integrated manner;",
    "4": "Recognizes that poverty is a multidimensional phenomenon, and encourages Member States to develop comprehensive, integrated and coherent poverty eradication strategies that effectively address the structural causes of poverty and inequality with an emphasis on job-rich growth; address and meet the basic human needs of people living in poverty; ensure their access to quality education, nutrition, health, water, sanitation, housing and other public social services, access to employment and decent work for all, as well as access to productive resources, including credit, land, training, technology and knowledge; and ensure their participation in decision-making on social and economic development policies and programmes in this regard;",
    "5": "Emphasizes that the major United Nations conferences and summits, including the Millennium Summit, the International Conference on Financing for Development, in its Monterrey Consensus,18 the 2005 World Summit, the Follow-up International Conference on Financing for Development to Review the Implementation of the Monterrey Consensus, in its Doha Declaration on Financing for Development,19 the high-level plenary meeting of the General Assembly on the Millennium Development Goals, the United Nations Conference on Sustainable Development, the 2013 special event to follow up efforts made towards achieving the Millennium Development Goals, the third International Conference on Financing for Development, in its Addis Ababa Action Agenda, and the United Nations summit for the adoption of the post-2015 development agenda, have reinforced the priority and urgency of the eradication of poverty in all its forms and dimensions within the United Nations development agenda;",
    "6": "Recognizes the complex character of the ongoing food insecurity situation, including food price volatility, as a combination of several major factors, both structural and conjunctural, which is also negatively affected by, inter alia, environmental degradation, drought and desertification, global climate change, natural disasters, the lack of the necessary technology and armed conflicts, and also recognizes that a strong commitment from national Governments and the international community as a whole is required to confront the major threats to food security and to ensure that policies in the area of agriculture do not distort trade and worsen food insecurity;",
    "7": "Reaffirms the importance of supporting the African Union\u2019s development framework, Agenda 2063, as well as its 10-year plan of action, as a strategic framework for ensuring a positive socioeconomic transformation in Africa within the next 50 years, which is the African Union long-term strategy emphasizing industrialization, youth employment, improved natural resource governance and the reduction of inequalities, and its continental programme embedded in the resolutions of the General Assembly on the New Partnership for Africa\u2019s Development 20 and regional initiatives, such as the Comprehensive Africa Agriculture Development Programme;",
    "8": "Stresses that the benefits of economic growth should be inclusive and distributed more equitably and that, in order to close the gap of inequality and avoid any further deepening of inequality, comprehensive social policies and programmes, including appropriate social transfer and job creation programmes and social protection systems, are needed;",
    "9": "Reaffirms that social integration policies should seek to reduce inequalities, promote access to basic social services, quality education for all and health care, eliminate discrimination, increase the participation and integration of social groups, particularly young people, older persons and persons with disabilities, noting the role of sports in this regard, and address the challenges posed to social development by globalization and market-driven reforms in order for all people in all countries to benefit from globalization;",
    "10": "Stresses that an enabling environment is a critical precondition for achieving equity and social development and that, while economic growth is essential, entrenched inequality and marginalization are an obstacle to the broad-based and sustained growth required for sustainable, inclusive and people-centred development, and recognizes the need to balance and ensure complementarity between measures to achieve growth and measures to achieve economic and social equity and inclusion in order for there to be an impact on overall poverty levels;",
    "11": "Acknowledges that investment in human capital and social protection has been proven to be effective in reducing poverty and inequality, and invites Member States to mobilize innovative sources of financing, including through public-private partnerships, to secure adequate levels of social expenditure necessary for expanding coverage towards universal access to health education, innovation, new technologies and basic social protection and to address the issues of illicit financial flows and corruption;",
    "12": "Stresses that international trade and stable financial systems can be effective tools to create favourable conditions for the development of all countries and that trade barriers and some trading practices continue to have negative effects on employment growth, particularly in developing countries, that good governance and the rule of law at the national and international levels and the need to promote respect for all human rights and fundamental freedoms are essential for sustained economic growth, sustainable development, the reduction of inequalities, the eradication of poverty, hunger and malnutrition and for addressing the most pressing social needs of people living in poverty, and in this regard also stresses the importance of economic, social and cultural rights and the importance of the principles of non-discrimination, inclusivity and meaningful participation for the implementation of the outcome of the World Summit for Social Development;",
    "13": "Acknowledges that inequalities persist within and among countries, posing significant challenges to social cohesion, reaffirms that the eradication of poverty, the promotion of prosperity, gender equality and the empowerment of all women and girls and the reduction of inequality within and among countries are fundamental to achieving sustainable development for all, and that this requires collective and transformative efforts to leave no one behind and put the furthest behind first, and adapt institutions and policies to take into account the multidimensional nature of inequality and poverty and the inherent interlinkages between different Goals and targets of the 2030 Agenda;",
    "14": "Urges Member States to strengthen social policies, as appropriate, paying particular attention to the specific needs of disadvantaged and marginalized social groups, inter alia, women, children, youth, persons with disabilities, people living with HIV/AIDS, older persons, indigenous peoples, refugees, internally displaced persons, migrants and other persons in vulnerable situations, as well as to address all forms of violence in its many manifestations, including domestic violence, and discrimination, including xenophobia, against them, to ensure that these groups are not left behind, and recognizes that violence increases the challenges faced by States and societies in the achievement of poverty eradication, full and productive employment and decent work for all, and social integration;",
    "15": "Reaffirms the commitment to gender equality and the empowerment of all women and girls, as well as to the mainstreaming of a gender perspective into all development efforts, recognizing that they are critical for achieving sustainable development and for efforts to combat hunger and malnutrition, poverty and disease, to strengthening policies and programmes that improve, ensure and broaden the full participation of women in all spheres of political, economic, social and cultural life as equal partners and to improving the access of women to all resources needed for the full exercise of all their human rights and fundamental freedoms by removing persistent barriers and allocating adequate resources for the elimination of all forms of violence and discrimination against women, including in the workplace, inter alia, by addressing wage inequality, ensuring equal access to full and productive employment and decent work for all, reconciliation of work and private life for both men and women, as well as strengthening their economic independence;",
    "16": " spheres of political, economic, social and cultural life, including in designing and implementing policies, programmes and initiatives, in particular while implementing the 2030 Agenda;",
    "17": "Reaffirms the right to food and acknowledges the importance of promoting sustainable farming and agriculture, and, recognizing the important contribution that family farming and smallholder farming can play in providing food security, reducing inequality in access to food and nutrition, calls upon Governments to ensure access by all people, in particular the poor and people in vulnerable situations, including infants, to safe, nutritious and sufficient food all year round;",
    "18": "Urges Governments, with the cooperation of relevant entities, to establish nationally appropriate social protection that supports labour market participation and addresses and reduces inequality and social exclusion, and social protection systems and floors, including through streamlining fragmented social protection systems/ programmes, ensuring that such programmes are gender-responsive and disability- sensitive, and progressively extend their coverage to all people throughout their life cycle, including for workers in the informal economy, invites the International Labour Organization, upon request, to support government efforts to strengthen social protection strategies and policies on extending social protection and social security coverage, urges Governments, while taking account of national circumstances, to focus on the needs of those living in, or vulnerable to, poverty and to give particular consideration to universal access to basic social security systems, including the implementation of social protection floors, which can provide a systemic base upon which to address poverty and vulnerability, and in this regard takes note of the International Labour Organization recommendation on social protection floors;",
    "19": "Stresses the need to address challenges faced by those working in informal or vulnerable jobs, by investing in the creation of more decent work opportunities, including providing access to decent jobs in the formal sector in accordance with International Labour Organization recommendation No. 204 concerning the transition from the informal to the formal economy, and enhancing the productive capacities of people, and strengthen labour institutions and employment and labour-market policies, taking into consideration the specific circumstances of each country and by promoting close partnerships with relevant stakeholders;",
    "20": "Urges Member States to strengthen, as appropriate, the authority and capacity of national mechanisms for promoting gender equality and the empowerment of women and girls, at all levels, which should be placed at the highest possible level of government, with sufficient funding, and to mainstream a gender perspective across all relevant national and local institutions, including labour, economic and financial government agencies, in order to ensure that national planning, decision- making, policy formulation and implementation, budgeting processes and institutional structures contribute to women\u2019s economic empowerment in the changing world of work;",
    "21": " provide social protection for all youth and to request donors, specialized United Nations entities and the private sector to continue to provide assistance to Member States, including technical and funding support, as appropriate;",
    "22": "Recognizes that promoting full employment and decent work for all also requires investing in education, training and skills development for women and men, and girls and boys, strengthening social protection and health systems and applying international labour standards, and urges States and, as appropriate, the relevant entities of the United Nations system and international and regional organizations, within their respective mandates, as well as civil society, the private sector, employer organizations, trade unions, the media and other relevant actors, to continue to develop and strengthen policies, strategies and programmes to enhance, in particular, the employability of women and youth and to ensure their access to full and productive employment and decent work for all, including by improving access to formal and non-formal education, skills development and vocational training, lifelong learning and retraining and long-distance education, inter alia, in information and communications technology and entrepreneurial skills, particularly in developing countries, including with a view to supporting the economic empowerment of women in the different stages of their lives;",
    "23": "Reaffirms the New Urban Agenda,21 which envisages cities and human settlements that fulfil their social function, including the social and ecological function of land, with a view to progressively achieving the full realization of the right to adequate housing, as a component of the right to an adequate standard of living, without discrimination, universal access to safe and affordable drinking water and sanitation, as well as equal access for all to public goods and quality services in areas such as food security and nutrition, health, education, infrastructure, mobility and transportation, energy, air energy, air quality and livelihoods;",
    "24": "Recognizes that the negative effects of climate change and environmental disasters have differential impacts, with people in vulnerable situations, poor and rural communities and low-income countries being disproportionately exposed to floods, droughts and other natural disasters, and that they have a lower capacity and assets to recover from such external shocks, and expresses concern that climate change may cause high and volatile food and commodity prices and hit them hardest;",
    "25": "Acknowledges the important nexus between international migration and social development, and stresses the importance of effectively enforcing labour laws with regard to labour relations and working conditions of migrant workers, inter alia, those related to their remuneration and conditions of health, safety at work and the right to freedom of association;",
    "26": "Reaffirms that social development requires the active involvement of all actors in the development process, including civil society organizations, corporations, the public sector and small businesses, and that partnerships among all relevant actors within countries are increasingly becoming part of national and international cooperation for social development, also reaffirms that, within countries, partnerships among the Government, civil society and the private sector can contribute effectively to the achievement of social development goals, and acknowledges the role of the public and private sectors as employers and enablers for the effective generation of new investments, full and productive employment and decent work for all, including through partnerships with the United Nations system, civil society and academia;",
    "27": "Stresses the importance of the policy space and leadership of national Governments for implementing policies for poverty eradication and sustainable development, while remaining consistent with relevant international rules and commitments, in particular in the areas of human rights, social expenditure and social protection programmes, and calls upon international financial institutions and donors to support developing countries in achieving their social development, in line with their national priorities and strategies, by, among other things, providing debt relief within the context of the implementation of the 2030 Agenda;",
    "28": "Underlines the responsibility of the private sector, at both the national and the international levels, including small and large companies and transnational corporations, regarding not only the economic and financial implications but also the development, social, gender and environmental implications of their activities, their obligations towards their workers and their contributions to achieving sustainable development, including social development, emphasizes that transnational corporations and other business enterprises have a responsibility to respect human rights, applicable laws and international principles and standards, to operate transparently, in a socially and environmentally responsible manner, and to refrain from affecting the well-being of peoples, and also emphasizes the need to take further concrete actions on corporate responsibility and accountability, including through the participation of all relevant stakeholders, inter alia, for the prevention or prosecution of corruption, and to prevent human rights abuses;",
    "29": "Reaffirms the necessity of improving availability, affordability and efficiency of health products by increasing transparency of prices of medicines, vaccines, medical devices, diagnostics, assistive products, cell- and gene-based therapies and other health technologies across the value chain, including through improved regulations and building constructive engagement and a stronger partnership with relevant stakeholders, including industries, the private sector and civil society, in accordance with national and regional legal frameworks and contexts, to address the global concern about the high prices of some health products, and in this regard encourages the World Health Organization to continue its efforts to biennially convene the Fair Pricing Forum with Member States and all relevant stakeholders to discuss the affordability and transparency of prices and costs relating to health products;",
    "30": "Recognizes that health is an investment in human capital and social and economic development, towards the full realization of human potential, and significantly contributes to the promotion and protection of human rights and dignity as well as the empowerment of all people;",
    "31": "Welcomes the renewed commitment in the political declaration of the high- level meeting on universal health coverage to achieve universal health coverage, which implies that all people have access, without discrimination, to nationally determined sets of the needed promotive, preventive, curative, rehabilitative and palliative essential health services, and essential, safe, affordable, effective and quality medicines and vaccines, while ensuring that the use of these services does not expose the users to financial hardship, with a special emphasis on those who are marginalized;",
    "32": "Reaffirms that achieving universal health coverage, including financial risk protection, access to quality essential health-care services and access to safe, effective, quality and affordable essential medicines and vaccines for all, is essential to eradicate poverty, and reduce inequality and achieve sustainable development for all;",
    "33": "",
    "34": "Expresses concern at the global shortfall of 18 million health workers, primarily in low- and middle income countries, recognizes the need to train, build and retain a skilled health workforce, including nurses, midwives and community health workers, who are an important element of strong and resilient health systems, and also recognizes that increased investment in a more effective and socially accountable health workforce can unleash significant socioeconomic gains and contribute to the eradication of poverty in all its forms and dimensions, the empowerment of all women and girls and the reduction of inequality;",
    "35": "Calls upon States, at the international level, to take steps, individually and/or through international cooperation, in accordance with applicable international law, including international agreements, to ensure that their actions as members of international organizations take into due account the right of everyone to the enjoyment of the highest attainable standard of physical and mental health, and that the application of international agreements is supportive of public health policies that promote broad access to safe, effective and affordable medicines;",
    "36": "Encourages all States to apply measures and procedures for enforcing intellectual property rights in such a manner as to avoid creating barriers to the legitimate trade in medicines, and to provide for safeguards against the abuse of such measures and procedures;",
    "37": "Calls upon Member States to make greater investments and promote decent work in the health and social sectors, enable safe working environments and conditions, effective retention and equitable and broad distribution of the health workforce, and strengthen capacities to optimize the existing health workforce, including through expanding rural and community-based health education and training to contribute to the achievement of universal health coverage;",
    "38": "Encourages Governments to end all forms of malnutrition, including the internationally agreed targets on stunting and wasting in children under 5 years of age, and address the nutritional needs of adolescent girls, pregnant and lactating women and older persons;",
    "39": "Welcomes the rapid expansion in school enrolment worldwide, with literacy rates rising steadily over the past 50 years to reach 68 per cent in 2016, and the improvement in the access to early childhood, primary, secondary, tertiary and distance education and throughout the life course, and calls upon the international community to provide inclusive and equitable quality education at all levels so that all people may have access to lifelong learning opportunities that help them to acquire the knowledge and skills needed to exploit opportunities to participate fully in society;",
    "40": "Recognizes the limited access to and high rates of dropout from school and secondary education, the increased rates of exclusion from education with age and the existence of large disparities in school attendance and learning acquisition by region, wealth, sex, urban or rural residence and other factors such as indigenous identity or disability, underscoring the challenges ahead, and also recognizes that poverty may affect access to quality education at the secondary and tertiary levels;",
    "41": "Also recognizes that factors such as poverty, residing in a rural area or having a disability all too often prevent children and adolescents from accessing quality education, especially at the secondary and tertiary levels;",
    "42": "",
    "43": "Encourages States to increase investments and international cooperation to allow all girls and boys to complete free, equitable, inclusive and quality early childhood, primary and secondary education, including by scaling up and strengthening initiatives, such as the Global Partnership for Education, and to explore additional innovative mechanisms based on models combining public and private resources, while ensuring that all education providers give due respect to the right to education;",
    "44": "Urges States to support the efforts of developing countries, in particular least developed countries, to realize progressively the right to education, including the progressive realization of the equal enjoyment of the right to education by every girl through appropriate resources, including financial and technical resources, in support of country-led national education plans;",
    "45": "Reaffirms the right to education, and calls upon the international community to provide universal access to inclusive, equal and non-discriminatory quality education at all levels \u2013 early childhood, primary, secondary, tertiary and distance education, including technical and vocational training \u2013 as well as to promote the completion of primary and secondary education so that all people may have access to lifelong learning opportunities that help them to acquire the knowledge and skills needed to exploit opportunities to participate fully in society and contribute to sustainable development;",
    "46": "Recognizes that substantial and efficiently spent investments are needed to improve the quality of education and vocational training and in order to enable millions of people to acquire skills for decent work, and takes note with appreciation of the report of the International Commission on Financing Global Education Opportunity and the recommendations contained therein, as appropriate;",
    "47": "Urges Member States to promote and respect women\u2019s right to education throughout the life course at all levels, especially for those who have been left furthest behind, and eliminate gender disparities in access to all areas of secondary and tertiary education, promote financial literacy and inclusion, digital literacy and entrepreneurship, ensure that women and girls have equal access to career development, training, scholarships and fellowships and adopt positive action to build women\u2019s and girls\u2019 leadership skills and influence, and adopt measures that promote, respect and guarantee the safety of women and girls in the school environment and that support women and girls with disabilities at all levels of education and training;",
    "48": "Reaffirms that international cooperation has an essential role in assisting developing countries, including the least developed and middle-income countries, in strengthening their human, institutional and technological capacity;",
    "49": "Underlines that South-South cooperation is an important element of international cooperation for development as a complement to, not a substitute for, North-South cooperation, recognizes its increased importance, different history and particularities, and stresses that it should be seen as an expression of solidarity among peoples and countries of the South, based on their shared experiences and objectives, and that it should continue to be guided by the principles of respect for national sovereignty, national ownership and independence, equality, non-conditionality, non-interference in domestic affairs and mutual benefit;",
    "50": " providers have reaffirmed their respective commitments, including the commitment by many developed countries to achieve the target of 0.7 per cent of gross national income for official development assistance to developing countries and 0.15 to 0.2 per cent of gross national income for official development assistance to the least developed countries;",
    "51": "Welcomes the increase in the volume of official development assistance since the adoption of the Monterrey Consensus, expresses its concern that many countries still fall short of their official development assistance commitments, reiterates that the fulfilment of all official development assistance commitments remains crucial, commends those few countries that have met or surpassed their commitment to 0.7 per cent of gross national income for official development assistance and the target of 0.15 to 0.20 per cent of gross national income for official development assistance to the least developed countries, urges all other countries to step up efforts to increase their official development assistance and to make additional concrete efforts towards the official development assistance targets, welcomes the decision by the European Union reaffirming its collective commitment to achieve the target of 0.7 per cent of gross national income for official development assistance within the time frame of the 2030 Agenda and undertaking to meet collectively the target of 0.15 to 0.20 per cent of gross national income for official development assistance to the least developed countries in the short term and to reach 0.20 per cent of gross national income for official development assistance to the least developed countries within the time frame of the 2030 Agenda, and encourages official development assistance providers to consider setting a target to provide at least 0.20 per cent of gross national income for official development assistance to the least developed countries;",
    "52": "Stresses the essential role that official development assistance plays in complementing, leveraging and sustaining financing for development efforts in developing countries and in facilitating the achievement of development objectives, including the internationally agreed development goals, in particular the Sustainable Development Goals, and welcomes steps to improve the effectiveness and quality of aid based on the fundamental principles of national ownership, alignment, harmonization, managing for results and mutual accountability;",
    "53": "Welcomes the contribution to the mobilization of resources for social development by the initiatives taken on a voluntary basis by groups of Member States based on innovative financing mechanisms, including those that aim to provide further access to drugs at affordable prices to developing countries on a sustainable and predictable basis, such as the International Drug Purchase Facility, UNITAID, as well as other initiatives such as the International Finance Facility for Immunization and the Advance Market Commitment for Vaccines;",
    "54": "Encourages Governments to support the research and development of vaccines and medicines for the communicable and non-communicable diseases that primarily affect developing countries, provide access to affordable essential medicines and vaccines, in accordance with the Doha Declaration on the TRIPS Agreement and Public Health, which affirms the right of developing countries to use to the full the provisions in the Agreement on Trade-Related Aspects of Intellectual Property Rights regarding flexibilities to protect public health, and, in particular, provide access to medicines for all;",
    "55": "",
    "56": "Reaffirms that each country has the primary responsibility for its own economic and social development and that the role of national policies and development strategies cannot be overemphasized, and underlines the importance of adopting effective measures, including new financial mechanisms, as appropriate, to support the efforts of developing countries to achieve sustained economic growth, sustainable development, poverty eradication and the strengthening of their democratic systems;",
    "57": "Stresses that the international community should support national commitments to eradicate poverty in all its forms and dimensions with the goal to ensure that no one is left behind, and recognizes the need for greater international cooperation to further reduce inequality between and within countries and increase capacity-building support to countries with the most constrained resources to ensure that social expenditures meet certain targets;",
    "58": "Reconfirms the Addis Ababa Action Agenda, and recognizes the need to take steps to significantly increase investment to close resource gaps, including through the mobilization of financial resources from all sources, including public, private, domestic and international resource mobilization and allocation;",
    "59": "Reaffirms that the Commission for Social Development, as a functional commission of the Economic and Social Council, in promoting the integrated treatment of social development issues in the United Nations system, shall review, on a periodic basis, issues related to the follow-up to and implementation of the Copenhagen Declaration and the Programme of Action, in a manner consistent with the functions and contributions of the relevant organs, organizations and bodies of the United Nations system, and shall advise the Council thereon;",
    "60": "Also reaffirms that the Commission for Social Development continues to have the primary responsibility for the follow-up to and review of the World Summit for Social Development and the outcome of the twenty-fourth special session of the General Assembly, and that it serves as the main United Nations forum for an intensified global dialogue on social development issues, and calls upon Member States, the relevant specialized agencies, funds and programmes of the United Nations system and civil society to enhance their support for its work;",
    "61": "Further reaffirms the mandate of the Commission for Social Development and that social development is a cross-cutting element in discussions surrounding the 2030 Agenda, and calls upon Member States, the relevant specialized agencies, funds and programmes of the United Nations system, civil society and relevant stakeholders to enhance their support for the high-level political forum on sustainable development as it builds upon the work of the functional commissions of the Economic and Social Council, including the Commission, while reflecting the integrated nature of the Sustainable Development Goals as well as the interlinkages between them;",
    "62": "Requests the United Nations funds, programmes and agencies to continue to support national efforts of Member States to achieve inclusive social development in a coherent and coordinated manner, to mainstream the goal of full and productive employment and decent work for all into their policies, programmes and activities, as well as to support efforts of Member States aimed at achieving this objective, and invites financial institutions to support efforts in this regard;",
    "63": " anniversary of the World Summit for Social Development,22 to continue to be actively involved in their follow-up and to monitor the achievement of those commitments and undertakings;",
    "64": "Calls upon the Commission for Social Development to continue to address inequality in all its dimensions, in the context of the implementation of the Copenhagen Declaration and the Programme of Action, as well as the implementation of the 2030 Agenda, and invites the Commission to emphasize the increased exchange of national, regional and international experiences, the focused and interactive dialogues among experts and practitioners and the sharing of best practices and lessons learned;",
    "65": "Requests the Secretary-General to continue engaging with Member States to sustain and further strengthen the political momentum on health-related issues, including the realization of universal health coverage and, in close collaboration with relevant United Nations agencies and other stakeholders, including regional organizations, to strengthen existing initiatives that are led and coordinated by the World Health Organization to provide assistance to Member States, upon their request, towards the achievement of universal health coverage and all health-related targets of the Sustainable Development Goals;",
    "66": "Calls upon the international community to provide inclusive and equitable quality education at all levels throughout the life course \u2013 early childhood, primary, secondary, tertiary and distance education, including technical and vocational training \u2013 so that all people, particularly those in vulnerable situations, may have access to lifelong learning opportunities that help them to acquire the knowledge and skills needed to exploit opportunities to participate fully in society and contribute to sustainable development;",
    "67": "Decides to include in the provisional agenda of its seventy-sixth session, under the item entitled \u201cSocial development\u201d, the sub-item entitled \u201cImplementation of the outcome of the World Summit for Social Development and of the twenty-fourth special session of the General Assembly\u201d, with a particular focus on significant increase and/or more efficient utilization of the resources allocated to social development in order to achieve the goals of the World Summit through national action and regional and international cooperation, taking into consideration the multifaceted impacts of the COVID-19 pandemic and its consequences, especially on social development, and requests the Secretary-General to submit a report on the question to the Assembly at that session."
  },
  "agenda_items": [
    "Item 27"
  ],
  "symbol_references": []
}