{
  "symbol": "A/RES/73/341",
  "filename": "A_RES_73_341.pdf",
  "title": "73/341. Revitalization of the work of the General Assembly",
  "text": "United Nations \nA/RES/73/341 \n \n \nGeneral Assembly \nDistr.: General \n16 September 2019 \n \n19-15704 (E)    180919     \n*1915704* \n \n \nSeventy-third session \nAgenda item 123 \n \n \n \n \n Resolution adopted by the General Assembly \non 12 September 2019 \n \n \n \n \n[without reference to a Main Committee (A/73/956)] \n \n \n 73/341. Revitalization of the work of the General Assembly  \n \n \n \nThe General Assembly, \n \nBearing in mind the role and authority of the General Assembly as a principal \norgan of the United Nations and the importance of its effectiveness and efficiency in \nfulfilling its functions under the Charter of the United Nations, \n \nAcknowledging that all resolutions of the General Assembly relating to the \nrevitalization of its work constitute an equally important contribution to the \nstrengthening of the role, authority, effectiveness and efficiency of the Assembly as \nestablished by the Charter, \n \nReiterating that the revitalization of the work of the General Assembly is a \ncritical component of the overall reform of the United Nations, \n \nWelcoming the calls to increase the efficiency of the work of the General \nAssembly through streamlining its agenda, including by elimination of duplication \nand overlap of agenda items,  \n \nWelcoming also the efforts of the President of the General Assembly to provide \nimpetus to and promote the process of revitalization of the work of the Assembly \nduring its seventy-third session in favour of strengthening multilateralism, \n \nRecalling that the seventy-fifth anniversary of the United Nations will be \ncommemorated in 2020 under the theme \u201cThe future we want, the United Nations we \nneed: reaffirming our collective commitment to multilateralism\u201d,  \n \nUnderlining the need to further enhance the role, authority, effectiveness and \nefficiency of the General Assembly to address the evolving global challenges,  \n \n1. \nReaffirms its resolution 72/313 of 17 September 2018 and all other \nprevious resolutions adopted by consensus relating to the revitalization of the work \nof the General Assembly;  \n\nA/RES/73/341 \nRevitalization of the work of the General Assembly\n \n19-15704\n2/8 \n \n \n2. \nWelcomes the report of the Ad Hoc Working Group on the Revitalization \nof the Work of the General Assembly and the updated inventory of Assembly \nresolutions on revitalization annexed thereto;1  \n \n3. \nRequests the Secretariat to continue updating regularly and equally the \nmultilingual web page devoted to the revitalization of the work of the General \nAssembly in all six official languages and its substantive content within existing \nresources in a cost-effective manner, including through the use of existing capabilities \nsuch as automation of translation, while ensuring the accuracy of translation;  \n \n4. \nDecides to establish, at its seventy-fourth session, an ad hoc working group \non the revitalization of the work of the General Assembly, open to all Member States:  \n \n(a) \nTo identify further ways to enhance the role, authority, effectiveness and \nefficiency of the Assembly, inter alia, by building on the progress achieved in past \nsessions as well as on previous resolutions, including evaluating the status of their \nimplementation;  \n \n(b) \nTo submit a report thereon to the Assembly at its seventy-fourth session;  \n \n5. \nAlso decides that the Ad Hoc Working Group shall continue its review of \nthe inventory of General Assembly resolutions on revitalization annexed to the report \nof the Ad Hoc Working Group submitted at the seventy-third session and, as a result, \ncontinue to update the inventory to be attached to the report to be submitted at the \nseventy-fourth session of the Assembly, including the separate indication of relevant \nprovisions that were not implemented, with reasons therefor; \n \n6. \nTakes note of the report of the Secretary-General, 2  and requests the \nSecretary-General to submit an update on the provisions of the General Assembly \nresolutions on revitalization addressed to the Secretariat for implementation that have \nnot been implemented, with an indication of the constraints and reasons behind any \nlack of implementation, for further consideration by the Ad Hoc Working Group at \nthe seventy-fourth session; \n \n \n \nRole and authority of the General Assembly \n \n \n7. \nReaffirms the role and authority of the General Assembly and the strict \nrespect of the Charter-based prerogatives and division of work among the principal \norgans of the United Nations;  \n \n8. \nWelcomes the decision of the President of the General Assembly at its \nseventy-third session to select \u201cMaking the United Nations relevant to all people: \nglobal leadership and shared responsibilities for peaceful, equitable and sustainable \nsocieties\u201d as the theme of the general debate, and also welcomes the decision of the \nPresident-elect of the General Assembly to select \u201cGalvanizing multilateral efforts \nfor poverty eradication, quality education, climate action and inclusion\u201d as the theme \nof the general debate of the seventy-fourth session of the Assembly;  \n \n9. \nStresses the importance of implementing the resolutions of the General \nAssembly on a non-selective basis, including those related to the revitalization of its \nwork that require a follow-up or further actions, as shown in the updated inventory of \nAssembly resolutions on revitalization annexed to the report of the Ad Hoc Working \nGroup;  \n \n10. Welcomes the efforts of the President of the General Assembly to reinforce \nsynergy, coherence and complementarity between the agendas of the Assembly and \nits Committees, and the Economic and Social Council and its subsidiary bodies, and \n__________________ \n \n1 A/73/956. \n \n2 A/73/895. \n\nRevitalization of the work of the General Assembly \nA/RES/73/341\n \n3/8\n19-15704 \n \nencourages regular interaction between the Presidents of the General Assembly, the \nSecurity Council and the Economic and Social Council in this regard;  \n \n11. Recalls the Guidelines on the Rationalization of the Agenda of the General \nAssembly, as adopted in its resolution 48/264 of 29 July 1994;  \n \n12. Also recalls the need to enhance synergies and coherence by addressing \ngaps, overlaps and duplication where they are found to exist in the agendas of the \nGeneral Assembly, especially of its Second and Third Committees, and the Economic \nand Social Council and its subsidiary bodies, in accordance with relevant rules of \nprocedure and in the light of the adoption of the 2030 Agenda for Sustainable \nDevelopment;3 \n \n13. Requests the General Committee, while exercising its functions under \nrule 40 of the rules of procedure of the General Assembly, to pay special attention to \nreduction of such overlap;  \n \n14. Stresses the need to limit the number of high-level events in the margins \nof the general debate;  \n \n15. Underlines the urgent need to preserve the primacy of the general debate \nof the General Assembly and for Member States and the United Nations system to \nsingly and collectively limit the number of side events held in parallel with or in the \nmargins of the general debate;  \n \n16. Recognizes the value of holding interactive inclusive thematic debates on \ncurrent issues of critical importance to the international community, calls for the \nrationalizing of such debates to ensure high-level attendance, and calls upon \nthe President of the General Assembly to be mindful of the regular agenda of the \nAssembly when organizing such debates;  \n \n17. Requests the President of the General Assembly to reconsider the timing \nof the plenary meetings of the Assembly on the report of the Secretary-General on the \nwork of the Organization and on the report of the Security Council, in close \ncoordination with the Secretary-General and the President of the Security Council, so \nthat discussions of these important reports are not conducted in a perfunctory manner;  \n \n18. Reiterates its decision to hold an interactive and comprehensive dialogue \nbetween the Permanent Missions and the Secretariat as mandated in resolution 71/323 \nof 8 September 2017, during the work of the Ad Hoc Working Group, and strongly \nemphasizes the importance of the follow-up on issues raised during the dialogue \naimed at improving the work of the Secretariat in its interaction with Permanent \nMissions, including the circulation of these follow-up measures to Permanent \nMissions;  \n \n19. Requests the Secretariat to circulate in advance to the Permanent Missions \nall new or updated administrative instructions and other documents that have an \nimpact on Member States with respect to the delivery of standard administrative \nservices;  \n \n20. Notes the progress aimed at increasing the visibility of the General \nAssembly in the media and in bringing the priorities of the Assembly to a wider \naudience, and requests the Department of Global Communications of the Secretariat \nto continue to take appropriate measures to further enhance public awareness of the \nrole and activities of the Assembly, including on as many platforms as possible;  \n \n21. Takes note of the proposals provided by the Secretariat for addressing the \ncost of the use of the Delegates\u2019 Dining Room and other venues at United Nations \n__________________ \n \n3 Resolution 70/1. \n\nA/RES/73/341 \nRevitalization of the work of the General Assembly\n \n19-15704\n4/8 \n \nHeadquarters in New York by delegations, and decides to continue the consideration \nof this issue during its seventy-fourth session;  \n \n22. Commends the President of the General Assembly and the Secretary-\nGeneral for their efforts to phase out single-use plastic food containers and disposable \ncutlery at United Nations catering venues in New York, and notes the desirability that \nthese measures would not lead to any additional increase in the prices of goods and \nservices provided by vendors; \n \n \n \nWorking methods \n \n \n23. Stresses the desirability of the General Assembly further streamlining its \nagenda and dedicating more time for dialogue as well as the review of the \nimplementation of the resolutions it adopts;  \n \n24. Reaffirms existing relevant mandates related to the improvement of the \nworking methods of the Main Committees;  \n \n25. Requests the Secretariat to brief the Ad Hoc Working Group at the seventy-\nfourth session of the General Assembly on past decisions regarding the streamlining \nof the agenda of the Assembly to further address the issue of the increasingly \noverloaded agenda of the Assembly;  \n \n26. Requests each Main Committee to further discuss its working methods, \nand in this regard invites the Chairs of the Main Committees to continue briefing the \nAd Hoc Working Group during the seventy-fourth session on any best practices and \nlessons learned with a view to improving working methods, and to coordinate their \nbriefings through, inter alia, possible identification of commonalities in the working \nmethods and the lessons learned;  \n \n27. Reiterates its request to the President of the General Assembly at its \nseventy-fourth session to identify proposals, in a timely manner, through \nconsultations with all Member States, the President of the Economic and Social \nCouncil and the General Committee, within their respective mandates, aimed at \naddressing gaps, overlaps and duplication where they are found to exist in the agenda \nof the Assembly as they relate to the 2030 Agenda for Sustainable Development as a \nwhole, and reaffirms the respective mandates of the Main Committees of the \nAssembly, and on that basis, calls upon all of them to continue their consideration of \naddressing gaps, overlaps and duplication in their respective agendas as they relate to \nthe 2030 Agenda as a whole, and in this regard requests them to make proposals \navailable for discussion during the seventy-fourth session of the Assembly;  \n \n28. Takes note with appreciation of the updated mapping assessment of the \nSustainable Development Goals coverage developed during the seventy-third session \nof the General Assembly as an evolving reference document for the consideration of \nMember States during the seventy-fourth session of the Assembly, and also takes note \nof the initial efforts made during the seventy-third session of the Assembly to develop \npossible criteria to identify overlaps and duplication where they are found to exist, \nwith a view to continuing the work on agenda alignment with the aim of focusing the \nwork of the Assembly more effectively and efficiently on the timely implementation \nof the 2030 Agenda for Sustainable Development; \n \n29. Emphasizes that the General Assembly and its Main Committees, at the \nseventy-fourth session, in consultation with Member States, should continue their \nconsideration of and make concrete proposals for the further biennialization, \ntriennialization, clustering and elimination of items on the agenda of the Assembly, \nincluding through the introduction of a sunset clause, with the clear consent of the \nsponsoring State or States, taking into account the relevant recommendations of the \nAd Hoc Working Group, during the seventy-fourth session of the Assembly; \n\nRevitalization of the work of the General Assembly \nA/RES/73/341\n \n5/8\n19-15704 \n \n \n30. Welcomes the increasing number of women candidates nominated for the \nsubsidiary organs of the General Assembly in seeking to promote gender balance, and \nencourages Member States to continue to do so;  \n \n31. Reiterates the need to produce the Journal of the United Nations in all six \nofficial languages in strict compliance with rule 55 of the rules of procedure of the \nGeneral Assembly, and in that regard emphasizes the importance of the extension of \nthe information in the Journal published in the six official languages, reiterates its \nrequest to the Secretary-General to brief the Ad Hoc Working Group, on a yearly \nbasis, on the progress achieved in this regard, and requests the Secretariat to continue \nto explore cost-neutral options to that effect;  \n \n32. Requests the Secretariat to continue to improve, harmonize and unify \ne-services provided to Member States under e-deleGATE with a view to creating a full-\nfledged delegates\u2019 online workplace in order to save costs, reduce the environmental \nimpact and improve the distribution of documents;  \n \n33. Decides that all meetings of the General Assembly and its subsidiary \norgans should make provisions for accessible seating for representatives with \ndisabilities through the following process:  \n \n(a) \nUpon a request by a delegation for accessible seating, the seating order in \na given meeting room is changed in such a way as to allow the requesting delegation \nto move to the closest accessible seat from the one it occupies in accordance with the \norder established for each session of the Assembly, and the seating order for the rest \nof the delegations is moved by one seat; \n \n(b) \nShould there be more than one request for accessible seating, the \ndelegations requesting such seats will move to the accessible seats which are closest \nto their respective seats, which they occupy in accordance with the order established \nfor each session of the Assembly, and the seating order for the rest of the delegations \nis moved by the corresponding number of seats, omitting the ones newly occupied by \nthe requesting delegations; \n \n34. Requests, in this regard, the Secretariat to inform the Member States as \nsoon as possible of any changes to the seating plans of the conference rooms;  \n \n35. Requests the Secretary-General to submit a comprehensive report during \nthe seventy-fourth session of the General Assembly on the ways to improve the \naccessibility of the United Nations Headquarters premises for persons with \ndisabilities;  \n \n36. Invites other principal organs of the United Nations and their subsidiary \norgans to make similar accommodations, as provided in paragraphs 33 and 34 above, \nfor their meetings;  \n \n37. Requests the Secretariat to bring this decision to the attention of any State, \norganization or entity that seeks to organize a meeting to be held at the United \nNations, and encourages such State, organization or entity to make arrangements for \naccessible seating in the manner mentioned in paragraphs 33 and 34;  \n \n38. Takes note of the report of the Secretary-General entitled \u201cOpening of the \nregular sessions of the General Assembly\u201d, submitted pursuant to resolution 72/313;4  \n \n \n \nSelection and appointment of the Secretary-General and other executive heads \n \n \n39. Reaffirms the important role played by the Secretary-General in the \ncontext of the current global challenges and in the implementation of the three pillars \n__________________ \n \n4 A/73/723. \n\nA/RES/73/341 \nRevitalization of the work of the General Assembly\n \n19-15704\n6/8 \n \nof the United Nations, namely, peace and security, human rights and sustainable \ndevelopment;  \n \n40. Reaffirms its commitment to continue, in the Ad Hoc Working Group, in \naccordance with the provisions of Article 97 of the Charter, its thorough consideration \nof the issues under the third thematic cluster of the Working Group, on the \nrevitalization of the work of the General Assembly, including the examination of \ninnovative ways to improve the process of selecting and appointing the Secretary-\nGeneral and other executive heads in all its aspects, and recalls all relevant \nresolutions, including resolutions 11 (I) of 24 January 1946, 46/77 of 12 December \n1991, 47/233 of 17 August 1993, 48/264, 51/241 of 31 July 1997, 52/163 of \n15 December 1997, 55/14 of 3 November 2000, 55/285 of 7 September 2001, 56/509 \nof 8 July 2002, 57/300 of 20 December 2002, 57/301 of 13 March 2003, 58/126 of \n19 December 2003, 58/316 of 1 July 2004, 59/313 of 12 September 2005, 60/286 of \n8 September 2006, 61/292 of 2 August 2007, 62/276 of 15 September 2008, 63/309 \nof 14 September 2009, 64/301 of 13 September 2010, 65/315 of 12 September 2011, \n66/294 of 17 September 2012, 67/297 of 20 August 2013, 68/307 10 September 2014, \n69/321 of 11 September 2015, 70/305 of 13 September 2016, 71/323 and 72/313, \nreaffirming the applicable procedures set out in the rules of procedure of the \nAssembly, in particular rule 141, and acknowledging existing relevant practices of \nthe Assembly;  \n \n41. Encourages future Presidents of the General Assembly to actively \ncontribute to the implementation of provisions guiding the selection and appointment \nof the ninth Secretary-General, as contained in all relevant resolutions, in particular \nresolutions 69/321 and 70/305, and stresses the need for the selection and \nappointment process of the Secretary-General and other executive heads to be guided \nby the principles of transparency and inclusiveness;  \n \n42. Welcomes the progress achieved in the selection and appointment process \nof the Secretary-General in the consensual resolutions 69/321, 70/305, 71/323 and \n72/313, in full compliance with the General Assembly mandate under Article 97 of \nthe Charter, and reaffirms previous resolutions referring to gender balance and \nregional rotation in the course of the identification and appointment of the best \ncandidate for the post of Secretary-General;  \n \n43. Decides to further assess during the seventy-fourth session of the General \nAssembly the selection and appointment process of the Secretary-General, \nconsolidate the advances gained in the relevant Assembly resolutions and explore \npossible steps to further improve the process, including the collaboration between the \nAssembly and the Security Council, consistent with Article 97 of the Charter, as well \nas to explore the possibility for the incumbent Secretary-General to present a vision \nstatement for the next term and to brief the Member States on its content;  \n \n44. Reiterates the possibility of providing the process of selection and \nappointment of the Secretary-General with notional timelines in accordance with \nparagraph 72 of its resolution 72/313, and decides to further discuss this issue during \nits seventy-fourth session in the Ad Hoc Working Group;  \n \n45. Decides that the Secretary-General-designate shall take an oath of office \nbefore the General Assembly during a swearing-in ceremony, as detailed in the annex \nto the present resolution;  \n \n46. Welcomes again the ongoing efforts of the Secretary-General towards \nachieving equal and fair distribution in terms of the gender and geographical balance \nof the executive heads of the United Nations system and the Senior Management \nGroup of the Organization, while securing the highest standards of efficiency, \ncompetence and integrity, in accordance with Article 101 of the Charter and its \n\nRevitalization of the work of the General Assembly \nA/RES/73/341\n \n7/8\n19-15704 \n \nresolutions 46/232 of 2 March 1992, 51/241, and 71/263 of 23 December 2016, \ncommends in particular the fact that gender parity was achieved in the Senior \nManagement Group, and requests that further effective measures be taken in this \nregard;  \n \n47. Supports the request of the Secretary-General for Member States to submit \nthe names and r\u00e9sum\u00e9s of nationals who may be considered for positions of executive \nheads and senior management of the Secretariat;  \n \n48. Welcomes the fact that gender parity has already been reached in the Senior \nManagement Group, and commends the Secretary-General\u2019s commitment to reach \ngender parity and to recruit staff on as wide a geographical basis as possible across \nthe United Nations Organization; \n \n49. Reiterates the need to ensure equal and fair distribution based on gender \nbalance and as wide a geographical basis as possible, and in this regard recalls its \nresolutions 46/232 and 51/241, adopted without a vote, which contain the principles \nthat the highest standards of efficiency, competence and integrity are the paramount \nconsiderations in the recruitment and performance of international civil servants and \nthat, as a general rule, there should be no monopoly on senior posts in the United \nNations system by nationals of any State or group of States;  \n \n50. Requests the Office of Human Resources of the Secretariat to continue \nwith the practice of providing a briefing to the Ad Hoc Working Group on the gender \nand geographical balance of the executive heads of the United Nations system and \nthe Senior Management Group of the Organization, as well as with a breakdown \nshowing those originating from the States that are permanent members of the Security \nCouncil;  \n \n \n \nStrengthening the accountability, transparency and institutional memory \nof the Office of the President of the General Assembly \n \n \n51. Emphasizes the important role of the President of the General Assembly \nwithin the United Nations Organization, as well as in the overall success of the work \nof the Assembly;  \n \n52. Invites Member States to equally consider women as candidates for the \nposition of President of the General Assembly, and encourages Presidents-elect to \ncontinue to strive for both gender and geographical balance within the Office of the \nPresident of the General Assembly;  \n \n53. Notes with appreciation the decision of Member States to fund the \ntransition period, the trust fund in support of the Office of the President of the General \nAssembly, seconding national staff as well as the convening of annual retreats;  \n \n54. Welcomes the induction programme delivered to the Office of the President \nof the General Assembly, and calls upon the Secretariat to strengthen the programme \nthrough enhanced content and increased delivery time;  \n \n55. Recognizes the heavy reliance of the Office of the President of the General \nAssembly on voluntary contributions to deliver on a growing number of mandates \nentrusted to it by the Assembly; \n \n56. Requests the Secretary-General to continue to provide to the President of \nthe General Assembly, within existing resources, adequate administrative, technical, \nlogistical and protocol-related support necessary to effectively execute his or her \nmandates as president of a principal organ of the United Nations;  \n \n57. Recalls that the activities of the President of the General Assembly have \nincreased continuously and markedly in recent years, also recalls the provisions \n\nA/RES/73/341 \nRevitalization of the work of the General Assembly\n \n19-15704\n8/8 \n \nregarding the support for the Office of the President of the General Assembly in \nprevious resolutions, and expresses continued interest in seeking ways to further \nsupport and strengthen the Office in accordance with existing procedures, in \nparticular rule 153 of the rules of procedure of the Assembly;  \n \n58. Requests the Secretary-General to take the measures necessary to preserve \nand further strengthen the institutional memory of the Office of the President of the \nGeneral Assembly, through utilizing existing United Nations record-keeping and \narchiving facilities; \n \n59. Requests the Secretariat to issue, within existing resources, in coordination \nwith the Office of the President of the General Assembly, a compendium of best \npractices of past Presidents that could serve to contribute to strengthening the \ninstitutional memory of the Office;  \n \n60. Emphasizes the importance of a handover report for the institutional \nmemory of the Office of the President of the General Assembly in accordance with \nresolution 69/321 and other relevant mandates contained in resolutions on the \nrevitalization of the work of the Assembly;  \n \n61. Calls upon the President of the General Assembly to organize the informal \ninteractive dialogue of the Member States with the candidate(s) for the position of \nPresident of the General Assembly pursuant to resolution 71/323 as a question and \nanswer session with targeted and relevant questions, that serves as a follow-up to the \nvision statement of the candidate(s) and draws on the plans and priorities of each \ncandidate for his or her term, and emphasizes the need to provide enough time so that \nall participants would have the opportunity to put forward questions; \n \n62. Encourages the Office of the President of the General Assembly to \nexpedite the posting of all relevant documents, including the President\u2019s speeches, \nletters, travels, activities, decisions and press releases, on the relevant websites of the \nUnited Nations. \n \n106th plenary meeting \n12 September 2019 \nAnnex \nOath of office of the Secretary-General \n \nI, [name], solemnly swear to exercise in all loyalty, discretion and conscience \nthe functions entrusted to me as Secretary-General of the United Nations, to discharge \nthese functions and regulate my conduct with the interests of the United Nations only \nin view and in accordance with the Charter of the United Nations, without seeking or \naccepting any instructions in regard to the performance of my duties from any \nGovernment or other authority external to the Organization. \n \n",
  "paragraphs": {
    "1": "Reaffirms its resolution 72/313 of 17 September 2018 and all other previous resolutions adopted by consensus relating to the revitalization of the work of the General Assembly; A/RES/73/341 Revitalization of the work of the General Assembly 19-15704 2/8",
    "2": "Welcomes the report of the Ad Hoc Working Group on the Revitalization of the Work of the General Assembly and the updated inventory of Assembly resolutions on revitalization annexed thereto;1",
    "3": "Requests the Secretariat to continue updating regularly and equally the multilingual web page devoted to the revitalization of the work of the General Assembly in all six official languages and its substantive content within existing resources in a cost-effective manner, including through the use of existing capabilities such as automation of translation, while ensuring the accuracy of translation;",
    "4": "Decides to establish, at its seventy-fourth session, an ad hoc working group on the revitalization of the work of the General Assembly, open to all Member States: (a) To identify further ways to enhance the role, authority, effectiveness and efficiency of the Assembly, inter alia, by building on the progress achieved in past sessions as well as on previous resolutions, including evaluating the status of their implementation; (b) To submit a report thereon to the Assembly at its seventy-fourth session;",
    "5": "Also decides that the Ad Hoc Working Group shall continue its review of the inventory of General Assembly resolutions on revitalization annexed to the report of the Ad Hoc Working Group submitted at the seventy-third session and, as a result, continue to update the inventory to be attached to the report to be submitted at the seventy-fourth session of the Assembly, including the separate indication of relevant provisions that were not implemented, with reasons therefor;",
    "6": "Takes note of the report of the Secretary-General, 2 and requests the Secretary-General to submit an update on the provisions of the General Assembly resolutions on revitalization addressed to the Secretariat for implementation that have not been implemented, with an indication of the constraints and reasons behind any lack of implementation, for further consideration by the Ad Hoc Working Group at the seventy-fourth session; Role and authority of the General Assembly",
    "7": "Reaffirms the role and authority of the General Assembly and the strict respect of the Charter-based prerogatives and division of work among the principal organs of the United Nations;",
    "8": "Welcomes the decision of the President of the General Assembly at its seventy-third session to select \u201cMaking the United Nations relevant to all people: global leadership and shared responsibilities for peaceful, equitable and sustainable societies\u201d as the theme of the general debate, and also welcomes the decision of the President-elect of the General Assembly to select \u201cGalvanizing multilateral efforts for poverty eradication, quality education, climate action and inclusion\u201d as the theme of the general debate of the seventy-fourth session of the Assembly;",
    "9": "Stresses the importance of implementing the resolutions of the General Assembly on a non-selective basis, including those related to the revitalization of its work that require a follow-up or further actions, as shown in the updated inventory of Assembly resolutions on revitalization annexed to the report of the Ad Hoc Working Group;",
    "10": "Welcomes the efforts of the President of the General Assembly to reinforce synergy, coherence and complementarity between the agendas of the Assembly and its Committees, and the Economic and Social Council and its subsidiary bodies, and __________________ 1 A/73/956. 2 A/73/895. Revitalization of the work of the General Assembly A/RES/73/341 3/8 19-15704 encourages regular interaction between the Presidents of the General Assembly, the Security Council and the Economic and Social Council in this regard;",
    "11": "Recalls the Guidelines on the Rationalization of the Agenda of the General Assembly, as adopted in its resolution 48/264 of 29 July 1994;",
    "12": "Also recalls the need to enhance synergies and coherence by addressing gaps, overlaps and duplication where they are found to exist in the agendas of the General Assembly, especially of its Second and Third Committees, and the Economic and Social Council and its subsidiary bodies, in accordance with relevant rules of procedure and in the light of the adoption of the 2030 Agenda for Sustainable Development;3",
    "13": "Requests the General Committee, while exercising its functions under rule 40 of the rules of procedure of the General Assembly, to pay special attention to reduction of such overlap;",
    "14": "Stresses the need to limit the number of high-level events in the margins of the general debate;",
    "15": "Underlines the urgent need to preserve the primacy of the general debate of the General Assembly and for Member States and the United Nations system to singly and collectively limit the number of side events held in parallel with or in the margins of the general debate;",
    "16": "Recognizes the value of holding interactive inclusive thematic debates on current issues of critical importance to the international community, calls for the rationalizing of such debates to ensure high-level attendance, and calls upon the President of the General Assembly to be mindful of the regular agenda of the Assembly when organizing such debates;",
    "17": "Requests the President of the General Assembly to reconsider the timing of the plenary meetings of the Assembly on the report of the Secretary-General on the work of the Organization and on the report of the Security Council, in close coordination with the Secretary-General and the President of the Security Council, so that discussions of these important reports are not conducted in a perfunctory manner;",
    "18": "Reiterates its decision to hold an interactive and comprehensive dialogue between the Permanent Missions and the Secretariat as mandated in resolution 71/323 of 8 September 2017, during the work of the Ad Hoc Working Group, and strongly emphasizes the importance of the follow-up on issues raised during the dialogue aimed at improving the work of the Secretariat in its interaction with Permanent Missions, including the circulation of these follow-up measures to Permanent Missions;",
    "19": "Requests the Secretariat to circulate in advance to the Permanent Missions all new or updated administrative instructions and other documents that have an impact on Member States with respect to the delivery of standard administrative services;",
    "20": "Notes the progress aimed at increasing the visibility of the General Assembly in the media and in bringing the priorities of the Assembly to a wider audience, and requests the Department of Global Communications of the Secretariat to continue to take appropriate measures to further enhance public awareness of the role and activities of the Assembly, including on as many platforms as possible;",
    "21": "Takes note of the proposals provided by the Secretariat for addressing the cost of the use of the Delegates\u2019 Dining Room and other venues at United Nations __________________ 3 Resolution 70/1. A/RES/73/341 Revitalization of the work of the General Assembly 19-15704 4/8 Headquarters in New York by delegations, and decides to continue the consideration of this issue during its seventy-fourth session;",
    "22": "Commends the President of the General Assembly and the Secretary- General for their efforts to phase out single-use plastic food containers and disposable cutlery at United Nations catering venues in New York, and notes the desirability that these measures would not lead to any additional increase in the prices of goods and services provided by vendors; Working methods",
    "23": "Stresses the desirability of the General Assembly further streamlining its agenda and dedicating more time for dialogue as well as the review of the implementation of the resolutions it adopts;",
    "24": "Reaffirms existing relevant mandates related to the improvement of the working methods of the Main Committees;",
    "25": "Requests the Secretariat to brief the Ad Hoc Working Group at the seventy- fourth session of the General Assembly on past decisions regarding the streamlining of the agenda of the Assembly to further address the issue of the increasingly overloaded agenda of the Assembly;",
    "26": "Requests each Main Committee to further discuss its working methods, and in this regard invites the Chairs of the Main Committees to continue briefing the Ad Hoc Working Group during the seventy-fourth session on any best practices and lessons learned with a view to improving working methods, and to coordinate their briefings through, inter alia, possible identification of commonalities in the working methods and the lessons learned;",
    "27": "Reiterates its request to the President of the General Assembly at its seventy-fourth session to identify proposals, in a timely manner, through consultations with all Member States, the President of the Economic and Social Council and the General Committee, within their respective mandates, aimed at addressing gaps, overlaps and duplication where they are found to exist in the agenda of the Assembly as they relate to the 2030 Agenda for Sustainable Development as a whole, and reaffirms the respective mandates of the Main Committees of the Assembly, and on that basis, calls upon all of them to continue their consideration of addressing gaps, overlaps and duplication in their respective agendas as they relate to the 2030 Agenda as a whole, and in this regard requests them to make proposals available for discussion during the seventy-fourth session of the Assembly;",
    "28": "Takes note with appreciation of the updated mapping assessment of the Sustainable Development Goals coverage developed during the seventy-third session of the General Assembly as an evolving reference document for the consideration of Member States during the seventy-fourth session of the Assembly, and also takes note of the initial efforts made during the seventy-third session of the Assembly to develop possible criteria to identify overlaps and duplication where they are found to exist, with a view to continuing the work on agenda alignment with the aim of focusing the work of the Assembly more effectively and efficiently on the timely implementation of the 2030 Agenda for Sustainable Development;",
    "29": "Emphasizes that the General Assembly and its Main Committees, at the seventy-fourth session, in consultation with Member States, should continue their consideration of and make concrete proposals for the further biennialization, triennialization, clustering and elimination of items on the agenda of the Assembly, including through the introduction of a sunset clause, with the clear consent of the sponsoring State or States, taking into account the relevant recommendations of the Ad Hoc Working Group, during the seventy-fourth session of the Assembly; Revitalization of the work of the General Assembly A/RES/73/341 5/8 19-15704",
    "30": "Welcomes the increasing number of women candidates nominated for the subsidiary organs of the General Assembly in seeking to promote gender balance, and encourages Member States to continue to do so;",
    "31": "Reiterates the need to produce the Journal of the United Nations in all six official languages in strict compliance with rule 55 of the rules of procedure of the General Assembly, and in that regard emphasizes the importance of the extension of the information in the Journal published in the six official languages, reiterates its request to the Secretary-General to brief the Ad Hoc Working Group, on a yearly basis, on the progress achieved in this regard, and requests the Secretariat to continue to explore cost-neutral options to that effect;",
    "32": "Requests the Secretariat to continue to improve, harmonize and unify e-services provided to Member States under e-deleGATE with a view to creating a full- fledged delegates\u2019 online workplace in order to save costs, reduce the environmental impact and improve the distribution of documents;",
    "33": "Decides that all meetings of the General Assembly and its subsidiary organs should make provisions for accessible seating for representatives with disabilities through the following process: (a) Upon a request by a delegation for accessible seating, the seating order in a given meeting room is changed in such a way as to allow the requesting delegation to move to the closest accessible seat from the one it occupies in accordance with the order established for each session of the Assembly, and the seating order for the rest of the delegations is moved by one seat; (b) Should there be more than one request for accessible seating, the delegations requesting such seats will move to the accessible seats which are closest to their respective seats, which they occupy in accordance with the order established for each session of the Assembly, and the seating order for the rest of the delegations is moved by the corresponding number of seats, omitting the ones newly occupied by the requesting delegations;",
    "34": "Requests, in this regard, the Secretariat to inform the Member States as soon as possible of any changes to the seating plans of the conference rooms;",
    "35": "Requests the Secretary-General to submit a comprehensive report during the seventy-fourth session of the General Assembly on the ways to improve the accessibility of the United Nations Headquarters premises for persons with disabilities;",
    "36": "Invites other principal organs of the United Nations and their subsidiary organs to make similar accommodations, as provided in paragraphs 33 and 34 above, for their meetings;",
    "37": "Requests the Secretariat to bring this decision to the attention of any State, organization or entity that seeks to organize a meeting to be held at the United Nations, and encourages such State, organization or entity to make arrangements for accessible seating in the manner mentioned in paragraphs 33 and 34;",
    "38": "Takes note of the report of the Secretary-General entitled \u201cOpening of the regular sessions of the General Assembly\u201d, submitted pursuant to resolution 72/313;4 Selection and appointment of the Secretary-General and other executive heads",
    "39": "Reaffirms the important role played by the Secretary-General in the context of the current global challenges and in the implementation of the three pillars __________________ 4 A/73/723. A/RES/73/341 Revitalization of the work of the General Assembly 19-15704 6/8 of the United Nations, namely, peace and security, human rights and sustainable development;",
    "40": "Reaffirms its commitment to continue, in the Ad Hoc Working Group, in accordance with the provisions of Article 97 of the Charter, its thorough consideration of the issues under the third thematic cluster of the Working Group, on the revitalization of the work of the General Assembly, including the examination of innovative ways to improve the process of selecting and appointing the Secretary- General and other executive heads in all its aspects, and recalls all relevant resolutions, including resolutions 11 (I) of 24 January 1946, 46/77 of 12 December 1991, 47/233 of 17 August 1993, 48/264, 51/241 of 31 July 1997, 52/163 of 15 December 1997, 55/14 of 3 November 2000, 55/285 of 7 September 2001, 56/509 of 8 July 2002, 57/300 of 20 December 2002, 57/301 of 13 March 2003, 58/126 of 19 December 2003, 58/316 of 1 July 2004, 59/313 of 12 September 2005, 60/286 of 8 September 2006, 61/292 of 2 August 2007, 62/276 of 15 September 2008, 63/309 of 14 September 2009, 64/301 of 13 September 2010, 65/315 of 12 September 2011, 66/294 of 17 September 2012, 67/297 of 20 August 2013, 68/307 10 September 2014, 69/321 of 11 September 2015, 70/305 of 13 September 2016, 71/323 and 72/313, reaffirming the applicable procedures set out in the rules of procedure of the Assembly, in particular rule 141, and acknowledging existing relevant practices of the Assembly;",
    "41": "Encourages future Presidents of the General Assembly to actively contribute to the implementation of provisions guiding the selection and appointment of the ninth Secretary-General, as contained in all relevant resolutions, in particular resolutions 69/321 and 70/305, and stresses the need for the selection and appointment process of the Secretary-General and other executive heads to be guided by the principles of transparency and inclusiveness;",
    "42": "Welcomes the progress achieved in the selection and appointment process of the Secretary-General in the consensual resolutions 69/321, 70/305, 71/323 and 72/313, in full compliance with the General Assembly mandate under Article 97 of the Charter, and reaffirms previous resolutions referring to gender balance and regional rotation in the course of the identification and appointment of the best candidate for the post of Secretary-General;",
    "43": "Decides to further assess during the seventy-fourth session of the General Assembly the selection and appointment process of the Secretary-General, consolidate the advances gained in the relevant Assembly resolutions and explore possible steps to further improve the process, including the collaboration between the Assembly and the Security Council, consistent with Article 97 of the Charter, as well as to explore the possibility for the incumbent Secretary-General to present a vision statement for the next term and to brief the Member States on its content;",
    "44": "Reiterates the possibility of providing the process of selection and appointment of the Secretary-General with notional timelines in accordance with paragraph 72 of its resolution 72/313, and decides to further discuss this issue during its seventy-fourth session in the Ad Hoc Working Group;",
    "45": "Decides that the Secretary-General-designate shall take an oath of office before the General Assembly during a swearing-in ceremony, as detailed in the annex to the present resolution;",
    "46": "Welcomes again the ongoing efforts of the Secretary-General towards achieving equal and fair distribution in terms of the gender and geographical balance of the executive heads of the United Nations system and the Senior Management Group of the Organization, while securing the highest standards of efficiency, competence and integrity, in accordance with Article 101 of the Charter and its Revitalization of the work of the General Assembly A/RES/73/341 7/8 19-15704 resolutions 46/232 of 2 March 1992, 51/241, and 71/263 of 23 December 2016, commends in particular the fact that gender parity was achieved in the Senior Management Group, and requests that further effective measures be taken in this regard;",
    "47": "Supports the request of the Secretary-General for Member States to submit the names and r\u00e9sum\u00e9s of nationals who may be considered for positions of executive heads and senior management of the Secretariat;",
    "48": "Welcomes the fact that gender parity has already been reached in the Senior Management Group, and commends the Secretary-General\u2019s commitment to reach gender parity and to recruit staff on as wide a geographical basis as possible across the United Nations Organization;",
    "49": "Reiterates the need to ensure equal and fair distribution based on gender balance and as wide a geographical basis as possible, and in this regard recalls its resolutions 46/232 and 51/241, adopted without a vote, which contain the principles that the highest standards of efficiency, competence and integrity are the paramount considerations in the recruitment and performance of international civil servants and that, as a general rule, there should be no monopoly on senior posts in the United Nations system by nationals of any State or group of States;",
    "50": "Requests the Office of Human Resources of the Secretariat to continue with the practice of providing a briefing to the Ad Hoc Working Group on the gender and geographical balance of the executive heads of the United Nations system and the Senior Management Group of the Organization, as well as with a breakdown showing those originating from the States that are permanent members of the Security Council; Strengthening the accountability, transparency and institutional memory of the Office of the President of the General Assembly",
    "51": "Emphasizes the important role of the President of the General Assembly within the United Nations Organization, as well as in the overall success of the work of the Assembly;",
    "52": "Invites Member States to equally consider women as candidates for the position of President of the General Assembly, and encourages Presidents-elect to continue to strive for both gender and geographical balance within the Office of the President of the General Assembly;",
    "53": "Notes with appreciation the decision of Member States to fund the transition period, the trust fund in support of the Office of the President of the General Assembly, seconding national staff as well as the convening of annual retreats;",
    "54": "Welcomes the induction programme delivered to the Office of the President of the General Assembly, and calls upon the Secretariat to strengthen the programme through enhanced content and increased delivery time;",
    "55": "Recognizes the heavy reliance of the Office of the President of the General Assembly on voluntary contributions to deliver on a growing number of mandates entrusted to it by the Assembly;",
    "56": "Requests the Secretary-General to continue to provide to the President of the General Assembly, within existing resources, adequate administrative, technical, logistical and protocol-related support necessary to effectively execute his or her mandates as president of a principal organ of the United Nations;",
    "57": "Recalls that the activities of the President of the General Assembly have increased continuously and markedly in recent years, also recalls the provisions A/RES/73/341 Revitalization of the work of the General Assembly 19-15704 8/8 regarding the support for the Office of the President of the General Assembly in previous resolutions, and expresses continued interest in seeking ways to further support and strengthen the Office in accordance with existing procedures, in particular rule 153 of the rules of procedure of the Assembly;",
    "58": "Requests the Secretary-General to take the measures necessary to preserve and further strengthen the institutional memory of the Office of the President of the General Assembly, through utilizing existing United Nations record-keeping and archiving facilities;",
    "59": "Requests the Secretariat to issue, within existing resources, in coordination with the Office of the President of the General Assembly, a compendium of best practices of past Presidents that could serve to contribute to strengthening the institutional memory of the Office;",
    "60": "Emphasizes the importance of a handover report for the institutional memory of the Office of the President of the General Assembly in accordance with resolution 69/321 and other relevant mandates contained in resolutions on the revitalization of the work of the Assembly;",
    "61": "Calls upon the President of the General Assembly to organize the informal interactive dialogue of the Member States with the candidate(s) for the position of President of the General Assembly pursuant to resolution 71/323 as a question and answer session with targeted and relevant questions, that serves as a follow-up to the vision statement of the candidate(s) and draws on the plans and priorities of each candidate for his or her term, and emphasizes the need to provide enough time so that all participants would have the opportunity to put forward questions;",
    "62": "Encourages the Office of the President of the General Assembly to expedite the posting of all relevant documents, including the President\u2019s speeches, letters, travels, activities, decisions and press releases, on the relevant websites of the United Nations. 106th plenary meeting 12 September 2019 Annex Oath of office of the Secretary-General I, [name], solemnly swear to exercise in all loyalty, discretion and conscience the functions entrusted to me as Secretary-General of the United Nations, to discharge these functions and regulate my conduct with the interests of the United Nations only in view and in accordance with the Charter of the United Nations, without seeking or accepting any instructions in regard to the performance of my duties from any Government or other authority external to the Organization."
  },
  "agenda_items": [
    "Item 123"
  ],
  "symbol_references": []
}