{
  "symbol": "A/RES/73/20",
  "filename": "A_RES_73_20.pdf",
  "title": "73/20. Special information programme on the question of Palestine of the Department of Public Information of the Secretariat",
  "text": "United Nations \nA/RES/73/20\n \n \nGeneral Assembly \nDistr.: General \n4 December 2018 \n \n18-20708 (E)    061218 \n*1820708* \n \n \nSeventy-third session \nAgenda item 39 \n \n \n \n \n Resolution adopted by the General Assembly \non 30 November 2018 \n \n \n \n \n[without reference to a Main Committee (A/73/L.33 and A/73/L.33/Add.1)] \n \n \n \n73/20. Special information programme on the question of Palestine \nof the Department of Public Information of the Secretariat \n \n \n \nThe General Assembly, \n \nHaving considered the report of the Committee on the Exercise of the \nInalienable Rights of the Palestinian People,1 \n \nTaking note, in particular, of the information contained in chapter VI of that \nreport, \n \nRecalling its resolution 72/12 of 30 November 2017, \n \nConvinced that the worldwide dissemination of accurate and comprehensive \ninformation and the role of civil society organizations and institutions remain of vital \nimportance in heightening awareness of and support for the inalienable rights of the \nPalestinian people, including the right to self-determination and independence, and \nfor the efforts to achieve a just, lasting and peaceful settlement of the question of \nPalestine, \n \nRecalling the mutual recognition between the Government of the State of Israel \nand the Palestine Liberation Organization, the representative of the Palestinian \npeople, as well as the existing agreements between the two sides, \n \nAffirming its support for a comprehensive, just, lasting and peaceful settlement \nto the Israeli-Palestinian conflict on the basis of the relevant United Nations \nresolutions, the terms of reference of the Madrid Conference, including the principle \nof land for peace, the Arab Peace Initiative adopted by the Council of the League of \nArab States at its fourteenth session, 2 and the Quartet road map to a permanent \n__________________ \n \n1 Official Records of the General Assembly, Seventy-third Session, Supplement No. 35 (A/73/35). \n \n2 A/56/1026-S/2002/932, annex II, resolution 14/221. \n\nA/RES/73/20 \nSpecial information programme on the question of Palestine\nof the Department of Public Information of the Secretariat\n \n18-20708\n2/3 \n \ntwo-State solution to the Israeli-Palestinian conflict, 3  endorsed by the Security \nCouncil in its resolution 1515 (2003) of 19 November 2003, \n \nRecalling the advisory opinion rendered on 9 July 2004 by the International \nCourt of Justice on the legal consequences of the construction of a wall in the \nOccupied Palestinian Territory,4 \n \nTaking note of its resolution 67/19 of 29 November 2012, \n \nReaffirming that the United Nations has a permanent responsibility towards the \nquestion of Palestine until the question is resolved in all its aspects in a satisfactory \nmanner in accordance with international legitimacy, \n \n1. \nNotes with appreciation the action taken by the Department of Public \nInformation of the Secretariat in compliance with its resolution 72/12; \n \n2. \nConsiders that the special information programme on the question of \nPalestine of the Department is very useful in raising the awareness of the international \ncommunity concerning the question of Palestine and the situation in the Middle East \nand that the programme is contributing effectively to an atmosphere conducive to \ndialogue and supportive of peace efforts and should receive the necessary support for \nthe fulfilment of its tasks; \n \n3. \nRequests the Department, in full cooperation and coordination with the \nCommittee on the Exercise of the Inalienable Rights of the Palestinian People, to \ncontinue, with the necessary flexibility as may be required by developments affecting \nthe question of Palestine, its special information programme for 2019\u20132020, in \nparticular, inter alia: \n \n(a) \nTo disseminate information on all the activities of the United Nations \nsystem relating to the question of Palestine and peace efforts, including reports on the \nwork carried out by the relevant United Nations organizations, as well as on the efforts \nof the Secretary-General and his Special Envoy vis-\u00e0-vis the objective of peace; \n \n(b) \nTo continue to issue, update and modernize publications and audiovisual \nand online materials on the various aspects of the question of Palestine in all fields, \nincluding materials concerning relevant recent developments, in particular the efforts \nto achieve a peaceful settlement of the question of Palestine; \n \n(c) \nTo expand its collection of audiovisual material on the question of \nPalestine, to continue the production and preservation of such material and to update, \non a periodic basis, the public exhibit on the question of Palestine displayed in the \nGeneral Assembly Building as well as at United Nations headquarters in Geneva and \nVienna; \n \n(d) \nTo organize and promote fact-finding news missions for journalists to the \nOccupied Palestinian Territory, including East Jerusalem, and Israel; \n \n(e) \nTo organize international, regional and national seminars or encounters for \njournalists aimed, in particular, at sensitizing public opinion to the question of \nPalestine and peace efforts and at enhancing dialogue and understanding between \nPalestinians and Israelis for the promotion of a peaceful settlement to the Israeli-\nPalestinian conflict, including by fostering and encouraging the contribution of the \nmedia in support of peace between the two sides; \n__________________ \n \n3 S/2003/529, annex. \n \n4 See A/ES-10/273 and A/ES-10/273/Corr.1. \n\nSpecial information programme on the question of Palestine \nof the Department of Public Information of the Secretariat \nA/RES/73/20\n \n3/3\n18-20708 \n \n \n(f) \nTo continue to provide assistance to the Palestinian people in the field of \nmedia development, in particular through its annual training programme for \nPalestinian broadcasters and journalists; \n \n4. \nEncourages the Department to continue organizing encounters for the \nmedia and representatives of civil society to engage in open and positive discussions \nto explore means for encouraging people-to-people dialogue and promoting peace and \nmutual understanding in the region. \n \n43rd plenary meeting  \n30 November 2018 \n \n",
  "paragraphs": {
    "1": "Notes with appreciation the action taken by the Department of Public Information of the Secretariat in compliance with its resolution 72/12;",
    "2": "Considers that the special information programme on the question of Palestine of the Department is very useful in raising the awareness of the international community concerning the question of Palestine and the situation in the Middle East and that the programme is contributing effectively to an atmosphere conducive to dialogue and supportive of peace efforts and should receive the necessary support for the fulfilment of its tasks;",
    "3": "Requests the Department, in full cooperation and coordination with the Committee on the Exercise of the Inalienable Rights of the Palestinian People, to continue, with the necessary flexibility as may be required by developments affecting the question of Palestine, its special information programme for 2019\u20132020, in particular, inter alia: (a) To disseminate information on all the activities of the United Nations system relating to the question of Palestine and peace efforts, including reports on the work carried out by the relevant United Nations organizations, as well as on the efforts of the Secretary-General and his Special Envoy vis-\u00e0-vis the objective of peace; (b) To continue to issue, update and modernize publications and audiovisual and online materials on the various aspects of the question of Palestine in all fields, including materials concerning relevant recent developments, in particular the efforts to achieve a peaceful settlement of the question of Palestine; (c) To expand its collection of audiovisual material on the question of Palestine, to continue the production and preservation of such material and to update, on a periodic basis, the public exhibit on the question of Palestine displayed in the General Assembly Building as well as at United Nations headquarters in Geneva and Vienna; (d) To organize and promote fact-finding news missions for journalists to the Occupied Palestinian Territory, including East Jerusalem, and Israel; (e) To organize international, regional and national seminars or encounters for journalists aimed, in particular, at sensitizing public opinion to the question of Palestine and peace efforts and at enhancing dialogue and understanding between Palestinians and Israelis for the promotion of a peaceful settlement to the Israeli- Palestinian conflict, including by fostering and encouraging the contribution of the media in support of peace between the two sides; __________________ 3 S/2003/529, annex. 4 See A/ES-10/273 and A/ES-10/273/Corr.1. Special information programme on the question of Palestine of the Department of Public Information of the Secretariat A/RES/73/20 3/3 18-20708 (f) To continue to provide assistance to the Palestinian people in the field of media development, in particular through its annual training programme for Palestinian broadcasters and journalists;",
    "4": "Encourages the Department to continue organizing encounters for the media and representatives of civil society to engage in open and positive discussions to explore means for encouraging people-to-people dialogue and promoting peace and mutual understanding in the region. 43rd plenary meeting 30 November 2018"
  },
  "agenda_items": [
    "Item 39"
  ],
  "symbol_references": [
    "A/73/L.33"
  ]
}