{
  "symbol": "A/RES/75/85",
  "filename": "A_RES_75_85.pdf",
  "title": "75/85. Convention on Prohibitions or Restrictions on the Use of Certain Conventional Weapons Which May Be Deemed to Be Excessively Injurious or to Have Indiscriminate Effects",
  "text": "United Nations \nA/RES/75/85\n \n \nGeneral Assembly \nDistr.: General \n18 December 2020 \n \n20-16916 (E)    221220 \n*2016916* \n \n \nSeventy-fifth session \nAgenda item 107 \nConvention on Prohibitions or Restrictions on the Use of \nCertain Conventional Weapons Which May Be Deemed to \nBe Excessively Injurious or to Have Indiscriminate Effects \n \n \n \n \n Resolution adopted by the General Assembly \non 7 December 2020 \n \n \n \n \n[on the report of the First Committee (A/75/403, para. 7)] \n \n \n \n75/85. Convention on Prohibitions or Restrictions on the Use of Certain \nConventional Weapons Which May Be Deemed to Be Excessively \nInjurious or to Have Indiscriminate Effects \n \n \n \nThe General Assembly, \n \nRecalling its resolution 74/76 of 12 December 2019, \n \nRecalling with satisfaction the adoption and entry into force of the Convention \non Prohibitions or Restrictions on the Use of Certain Conventional Weapons Which \nMay Be Deemed to Be Excessively Injurious or to Have Indiscriminate Effects 1 and \nits amended article 1,2 the Protocol on Non-Detectable Fragments (Protocol I),3 the \nProtocol on Prohibitions or Restrictions on the Use of Mines, Booby Traps and Other \nDevices (Protocol II)4 and its amended version,5 the Protocol on Prohibitions or \nRestrictions on the Use of Incendiary Weapons (Protocol III),6 the Protocol on \nBlinding Laser Weapons (Protocol IV)7 and the Protocol on Explosive Remnants of \nWar (Protocol V),8 \n \nRecalling the results of the Fifth Review Conference of the High Contracting \nParties to the Convention, held in Geneva from 12 to 16 December 2016, \n__________________ \n \n1 United Nations, Treaty Series, vol. 1342, No. 22495. \n \n2 Ibid., vol. 2260, No. 22495. \n \n3 Ibid., vol. 1342, No. 22495. \n \n4 Ibid., vol. 1342, No. 22495. \n \n5 Ibid., vol. 2048, No. 22495. \n \n6 Ibid., vol. 1342, No. 22495. \n \n7 Ibid., vol. 2024, No. 22495. \n \n8 Ibid., vol. 2399, No. 22495. \n\nA/RES/75/85 \nConvention on Prohibitions or Restrictions on the Use of Certain \nConventional Weapons Which May Be Deemed to Be Excessively \nInjurious or to Have Indiscriminate Effects\n \n20-16916\n2/5 \n \n \nWelcoming the results of the 2019 Meeting of the High Contracting Parties to \nthe Convention, held in Geneva from 13 to 15 November 2019, \n \nWelcoming also the results of the Twenty-first Annual Conference of the High \nContracting Parties to Amended Protocol II, held in Geneva on 12 November 2019, \n \nWelcoming further the results of the Thirteenth Conference of the High \nContracting Parties to Protocol V, held in Geneva on 11 November 2019, \n \nNoting that the Meeting of the Group of Experts of the High Contracting Parties \nto Amended Protocol II, the Meeting of Experts of the High Contracting Parties to \nProtocol V and the two sessions of the Group of Governmental Experts related to \nemerging technologies in the area of lethal autonomous weapons systems of the High \nContracting Parties to the Convention had to be rescheduled owing to the coronavirus \ndisease (COVID-19) pandemic, and noting the efforts made to hold them in 2020 \nunder exceptional circumstances, \n \nNoting also the consultations by the President of the Twenty-first Annual \nConference with the High Contracting Parties to Amended Protocol II on \npossibilities to include discussions, as appropriate, on good practices in the \nimplementation of the Protocol, with respect to mines other than anti-personnel \nmines, in particular with regard to the protection of civilians, taking into account the \ndivergent views, \n \nRecalling the role played by the International Committee of the Red Cross in \nthe elaboration of the Convention and the Protocols thereto, and welcoming the \nparticular efforts of various international, non-governmental and other organizations \nin raising awareness of the humanitarian consequences of various categories of \nconventional weapons which may be deemed to be excessively injurious or to have \nindiscriminate effects, \n \nEmphasizing the importance of the perspectives of women, men, boys and girls \nin considering the issues addressed by the Convention and its Protocols, \n \n1. \nCalls upon all States that have not yet done so to take all measures to \nbecome parties, as soon as possible, to the Convention on Prohibitions or Restrictions \non the Use of Certain Conventional Weapons Which May Be Deemed to Be \nExcessively Injurious or to Have Indiscriminate Effects and the Protocols thereto, as \namended, with a view to achieving the widest possible adherence to these instruments \nat an early date and so as to ultimately achieve their universality; \n \n2. \nCalls upon all High Contracting Parties to the Convention that have not \nyet done so to express their consent to be bound by the Protocols to the Convention \nand the amendment extending the scope of the Convention and the Protocols thereto \nto include armed conflicts of a non-international character; \n \n3. \nEmphasizes the importance of the universalization of the Protocol on \nExplosive Remnants of War (Protocol V); \n \n4. \nWelcomes additional ratifications and acceptances of or accessions to the \nConvention, as well as consents to be bound by the Protocols thereto; \n \n5. \nAcknowledges the continued efforts of the Secretary-General, as \ndepositary of the Convention and the Protocols thereto, and of the respective office \nholders of the conferences of the High Contracting Parties to the Convention, \nProtocol V and Amended Protocol II, on behalf of the High Contracting Parties, to \nachieve the goal of universality; \n\nConvention on Prohibitions or Restrictions on the Use of Certain \nConventional Weapons Which May Be Deemed to Be Excessively \nInjurious or to Have Indiscriminate Effects \nA/RES/75/85\n \n3/5\n20-16916 \n \n \n6. \nRecalls the following decisions by the Fifth Review Conference of the \nHigh Contracting Parties to the Convention: \n \n(a) \nTo establish an open-ended Group of Governmental Experts related to \nemerging technologies in the area of lethal autonomous weapons systems in the \ncontext of the objectives and purposes of the Convention, adhering to the agreed \nrecommendations contained in document CCW/CONF.V/2, and to submit a report to \nthe 2017 Meeting of the High Contracting Parties to the Convention consistent with \nthose recommendations; \n \n(b) \nTo add to the agenda of the next Meeting of the High Contracting Parties \nin 2017 the item \u201cProtocol III\u201d; \n \n(c) \nTo add to the agenda of the next Meeting of the High Contracting Parties \nin 2017 the item \u201cMines other than anti-personnel mines\u201d;9 \n \n(d) \nTo add to the agenda of the next Meeting of the High Contracting Parties \nin 2017 the item for informal discussion \u201cConsideration of how developments in the \nfield of science and technology relevant to the Convention may be addressed under \nthe Convention\u201d; \n \n(e) \nTo invite the Chair-elect to conduct consultations with a view to including \non the agenda of the 2017 annual Meeting of the High Contracting Parties the item \n\u201cStrengthening the respect for international humanitarian law and addressing, in the \ncontext and objectives of the Convention and its annexed Protocols, the challenges \npresented by the use of conventional weapons in armed conflicts and their impact on \ncivilians, particularly in areas where there are concentrations of civilians\u201d; \n \n(f) \nTo include on the agenda of the annual Meetings of the High Contracting \nParties the item \u201cFinancial issues related to the Convention and its annexed Protocols\u201d \nand to consider at the next such meeting efficiency and cost-saving measures and a \nreport to be prepared by the Chair-elect; \n \n(g) \nTo retain the practice of keeping summary records only for the final \nsessions of the future Review Conferences, the meetings of the High Contracting \nParties to the Convention, and the Conferences of the High Contracting Parties to \nAmended Protocol II and Protocol V; \n \n(h) \nTo continue the Sponsorship Programme; \n \n7. \nAlso recalls the following decisions by the Meeting of the High \nContracting Parties to the Convention in 2019: \n \n(a) \nTo call for a total of 10 days of meetings, to be held in Geneva in 2020, of \nthe Group of Governmental Experts related to emerging technologies in the area of \nlethal autonomous weapons systems in the context of the objectives and purposes of \nthe Convention; \n \n(b) \nTo call for the universalization and full implementation of Protocol III on \nProhibitions or Restrictions on the Use of Incendiary Weapons, given the Protocol\u2019s \nimportance; \n \n(c) \nTo place on the agenda of its next meeting the item \u201cEmerging issues in \nthe context of the objectives and purposes of the Convention\u201d and to invite the High \nContracting Parties to submit working papers on issues that they intend to raise; \n__________________ \n \n9 Noting the update included in paragraph 34 of the final report of the 2018 Meeting of the High \nContracting Parties to the Convention (CCW/MSP/2018/11). \n\nA/RES/75/85 \nConvention on Prohibitions or Restrictions on the Use of Certain \nConventional Weapons Which May Be Deemed to Be Excessively \nInjurious or to Have Indiscriminate Effects\n \n20-16916\n4/5 \n \n \n(d) \nTo establish a voluntary working capital fund, to be contributed to only by \nthe High Contracting Parties to the Convention, to provide liquidity during the \nfinancial year with a view to ensuring the stability of Implementation Support Unit \nsupport to the Convention, to review the functioning of the working capital fund at \nthe Sixth Review Conference of the High Contracting Parties to the Convention and \nto request the Secretariat of the United Nations to submit a report on the status of the \nfund to the 2020 Meeting of the High Contracting Parties to the Convention; \n \n(e) \nTo keep under annual review the implementation of the agreed-upon \nfinancial measures and to continue to monitor the financial situation of the \nConvention; \n \n(f) \nTo request the Chair-elect to consult the High Contracting Parties and the \nSecretariat of the United Nations to address the question of prioritization of funding \nfor the implementation of the Convention; \n \n8. \nCalls upon all High Contracting Parties to ensure full and prompt \ncompliance with their financial obligations under the Convention and its annexed \nProtocols; \n \n9. \nWelcomes the adoption by the 2019 Meeting of the High Contracting \nParties to the Convention of the financial measures to strengthen the financial \nsituation of the Convention, including the establishment of a voluntary working \ncapital fund to provide liquidity during the financial year, with a view to ensuring the \nstability of Implementation Support Unit support to the Convention; \n \n10. Also welcomes the decisions of the 2019 Meeting of the High Contracting \nParties to the Convention pertaining to the Group of Governmental Experts related to \nemerging technologies in the area of lethal autonomous weapons systems, and takes \nnote of the report of the 2019 session of the Group of Governmental Experts; \n \n11. \nFurther welcomes the commitment by the High Contracting Parties to \ncontinue to contribute to the further development of international humanitarian law, \nand, in this context, to keep under review both the development of new weapons and \nuses of weapons, which may have indiscriminate effects or cause unnecessary \nsuffering; \n \n12. Welcomes the commitment of the High Contracting Parties to Protocol V \nto the effective and efficient implementation of the Protocol and the implementation \nof the decisions of the First and Second Conferences of the High Contracting Parties \nto the Protocol establishing a comprehensive framework for the exchange of \ninformation and cooperation; \n \n13. Notes that, in conformity with article 8 of the Convention, conferences \nmay be convened to examine amendments to the Convention or to any of the Protocols \nthereto, to examine additional protocols concerning other categories of conventional \nweapons not covered by existing Protocols or to review the scope and application of \nthe Convention and the Protocols thereto and to examine any proposed amendments \nor additional protocols; \n \n14. Underlines the vital role of the full and equal participation of women in \ndecision-making and implementation of the Convention; \n \n15. Requests the Secretary-General to render the assistance necessary and to \nprovide such services as may be required for the annual conferences and expert \nmeetings of the High Contracting Parties to the Convention and of the High \nContracting Parties to Amended Protocol II and Protocol V, as well as for any \ncontinuation of the work after the meetings; \n\nConvention on Prohibitions or Restrictions on the Use of Certain \nConventional Weapons Which May Be Deemed to Be Excessively \nInjurious or to Have Indiscriminate Effects \nA/RES/75/85\n \n5/5\n20-16916 \n \n \n16. Also requests the Secretary-General, in his capacity as depositary of the \nConvention and the Protocols thereto, to continue to inform the General Assembly \nperiodically, by electronic means, of ratifications and acceptances of and accessions \nto the Convention, its amended article 1 and the Protocols; \n \n17. Decides to include in the provisional agenda of its seventy-sixth session \nthe item entitled \u201cConvention on Prohibitions or Restrictions on the Use of Certain \nConventional Weapons Which May Be Deemed to Be Excessively Injurious or to \nHave Indiscriminate Effects\u201d. \n \n37th plenary meeting \n7 December 2020 \n \n",
  "paragraphs": {
    "1": "Calls upon all States that have not yet done so to take all measures to become parties, as soon as possible, to the Convention on Prohibitions or Restrictions on the Use of Certain Conventional Weapons Which May Be Deemed to Be Excessively Injurious or to Have Indiscriminate Effects and the Protocols thereto, as amended, with a view to achieving the widest possible adherence to these instruments at an early date and so as to ultimately achieve their universality;",
    "2": "Calls upon all High Contracting Parties to the Convention that have not yet done so to express their consent to be bound by the Protocols to the Convention and the amendment extending the scope of the Convention and the Protocols thereto to include armed conflicts of a non-international character;",
    "3": "Emphasizes the importance of the universalization of the Protocol on Explosive Remnants of War (Protocol V);",
    "4": "Welcomes additional ratifications and acceptances of or accessions to the Convention, as well as consents to be bound by the Protocols thereto;",
    "5": "",
    "6": "Recalls the following decisions by the Fifth Review Conference of the High Contracting Parties to the Convention: (a) To establish an open-ended Group of Governmental Experts related to emerging technologies in the area of lethal autonomous weapons systems in the context of the objectives and purposes of the Convention, adhering to the agreed recommendations contained in document CCW/CONF.V/2, and to submit a report to the 2017 Meeting of the High Contracting Parties to the Convention consistent with those recommendations; (b) To add to the agenda of the next Meeting of the High Contracting Parties in 2017 the item \u201cProtocol III\u201d; (c) To add to the agenda of the next Meeting of the High Contracting Parties in 2017 the item \u201cMines other than anti-personnel mines\u201d;9 (d) To add to the agenda of the next Meeting of the High Contracting Parties in 2017 the item for informal discussion \u201cConsideration of how developments in the field of science and technology relevant to the Convention may be addressed under the Convention\u201d; (e) To invite the Chair-elect to conduct consultations with a view to including on the agenda of the 2017 annual Meeting of the High Contracting Parties the item \u201cStrengthening the respect for international humanitarian law and addressing, in the context and objectives of the Convention and its annexed Protocols, the challenges presented by the use of conventional weapons in armed conflicts and their impact on civilians, particularly in areas where there are concentrations of civilians\u201d; (f) To include on the agenda of the annual Meetings of the High Contracting Parties the item \u201cFinancial issues related to the Convention and its annexed Protocols\u201d and to consider at the next such meeting efficiency and cost-saving measures and a report to be prepared by the Chair-elect; (g) To retain the practice of keeping summary records only for the final sessions of the future Review Conferences, the meetings of the High Contracting Parties to the Convention, and the Conferences of the High Contracting Parties to Amended Protocol II and Protocol V; (h) To continue the Sponsorship Programme;",
    "7": "Also recalls the following decisions by the Meeting of the High Contracting Parties to the Convention in 2019: (a) To call for a total of 10 days of meetings, to be held in Geneva in 2020, of the Group of Governmental Experts related to emerging technologies in the area of lethal autonomous weapons systems in the context of the objectives and purposes of the Convention; (b) To call for the universalization and full implementation of Protocol III on Prohibitions or Restrictions on the Use of Incendiary Weapons, given the Protocol\u2019s importance; (c) To place on the agenda of its next meeting the item \u201cEmerging issues in the context of the objectives and purposes of the Convention\u201d and to invite the High Contracting Parties to submit working papers on issues that they intend to raise; (d) To establish a voluntary working capital fund, to be contributed to only by the High Contracting Parties to the Convention, to provide liquidity during the financial year with a view to ensuring the stability of Implementation Support Unit support to the Convention, to review the functioning of the working capital fund at the Sixth Review Conference of the High Contracting Parties to the Convention and to request the Secretariat of the United Nations to submit a report on the status of the fund to the 2020 Meeting of the High Contracting Parties to the Convention; (e) To keep under annual review the implementation of the agreed-upon financial measures and to continue to monitor the financial situation of the Convention; (f) To request the Chair-elect to consult the High Contracting Parties and the Secretariat of the United Nations to address the question of prioritization of funding for the implementation of the Convention;",
    "8": "Calls upon all High Contracting Parties to ensure full and prompt compliance with their financial obligations under the Convention and its annexed Protocols;",
    "9": "Welcomes the adoption by the 2019 Meeting of the High Contracting Parties to the Convention of the financial measures to strengthen the financial situation of the Convention, including the establishment of a voluntary working capital fund to provide liquidity during the financial year, with a view to ensuring the stability of Implementation Support Unit support to the Convention;",
    "10": "Also welcomes the decisions of the 2019 Meeting of the High Contracting Parties to the Convention pertaining to the Group of Governmental Experts related to emerging technologies in the area of lethal autonomous weapons systems, and takes note of the report of the 2019 session of the Group of Governmental Experts;",
    "11": "Further welcomes the commitment by the High Contracting Parties to continue to contribute to the further development of international humanitarian law, and, in this context, to keep under review both the development of new weapons and uses of weapons, which may have indiscriminate effects or cause unnecessary suffering;",
    "12": "Welcomes the commitment of the High Contracting Parties to Protocol V to the effective and efficient implementation of the Protocol and the implementation of the decisions of the First and Second Conferences of the High Contracting Parties to the Protocol establishing a comprehensive framework for the exchange of information and cooperation;",
    "13": "Notes that, in conformity with article 8 of the Convention, conferences may be convened to examine amendments to the Convention or to any of the Protocols thereto, to examine additional protocols concerning other categories of conventional weapons not covered by existing Protocols or to review the scope and application of the Convention and the Protocols thereto and to examine any proposed amendments or additional protocols;",
    "14": "Underlines the vital role of the full and equal participation of women in decision-making and implementation of the Convention;",
    "15": "",
    "16": "Also requests the Secretary-General, in his capacity as depositary of the Convention and the Protocols thereto, to continue to inform the General Assembly periodically, by electronic means, of ratifications and acceptances of and accessions to the Convention, its amended article 1 and the Protocols;",
    "17": "Decides to include in the provisional agenda of its seventy-sixth session the item entitled \u201cConvention on Prohibitions or Restrictions on the Use of Certain Conventional Weapons Which May Be Deemed to Be Excessively Injurious or to Have Indiscriminate Effects\u201d."
  },
  "agenda_items": [
    "Item 107"
  ],
  "symbol_references": []
}