{
  "symbol": "A/RES/76/306",
  "filename": "A_RES_76_306.pdf",
  "title": "76/306. Establishment of the United Nations Youth Office",
  "text": "United Nations \nA/RES/76/306\n \n \nGeneral Assembly \nDistr.: General \n12 September 2022 \n \n22-21686 (E)    130922 \n*2221686* \n \n \nSeventy-sixth session \nAgenda item 124 \nStrengthening of the United Nations system \n \n \n \n \n Resolution adopted by the General Assembly \non 8 September 2022 \n \n \n \n \n[without reference to a Main Committee (A/76/L.85)] \n \n \n 76/306. Establishment of the United Nations Youth Office \n \n \n \nThe General Assembly, \n \nReaffirming the principles and purposes of the Charter of the United Nations, \n \nReaffirming also the Universal Declaration of Human Rights1 and the importance \nof the timely implementation of the 2030 Agenda for Sustainable Development 2 and \nthe Addis Ababa Action Agenda of the Third International Conference on Financing \nfor Development,3 the Paris Agreement adopted under the United Nations Framework \nConvention on Climate Change4 and the Sendai Framework for Disaster Risk Reduction \n2015\u20132030, 5  and reiterating the commitment to provide youth with a nurturing \nenvironment for the full realization of their rights and capabilities and helping our \ncountries to reap the demographic dividend, \n \nReaffirming further the World Programme of Action for Youth, adopted by the \nGeneral Assembly in its resolutions 50/81 of 14 December 1995 and 62/126 of \n18 December 2007, \n \nRecalling the declaration on the commemoration of the seventy-fifth \nanniversary of the United Nations, adopted on 21 September 2020, 6 and reiterating \nthe commitments of Heads of State and Government representing the peoples of the \nworld in the declaration, in particular those related to listening to and working with \nyouth, \n__________________ \n \n1 Resolution 217 A (III). \n \n2 Resolution 70/1. \n \n3 Resolution 69/313, annex. \n \n4 See FCCC/CP/2015/10/Add.1, decision 1/CP.21, annex. \n \n5 Resolution 69/283, annex II. \n \n6 Resolution 75/1. \n\nA/RES/76/306 \nEstablishment of the United Nations Youth Office\n \n22-21686\n2/3 \n \n \nRecalling also its resolution 76/6 of 15 November 2021 on the follow-up to the \nreport of the Secretary-General entitled \u201cOur Common Agenda\u201d,7 and acknowledging \nthe proposal of the Secretary-General to establish a dedicated United Nations Youth \nOffice in the Secretariat to ensure that the voices of youth are more systematically \nintegrated across the United Nations system, \n \nUnderlining the important role of youth in the promotion of peace and security, \nsustainable development and human rights and the importance of the full, effective, \nconstructive and inclusive participation of youth in decision-making, \n \nReaffirming the importance of involving youth and youth-led and youth-focused \norganizations in the work of the United Nations at the national, regional and \ninternational levels, including in the implementation of the World Programme of \nAction for Youth and the 2030 Agenda, \n \nRecognizing the importance of a balanced composition of the United Nations \nworkforce from an age perspective and the need to ensure youth representation with \ndue regard to geographical distribution and gender balance, \n \nRecognizing also the work of the Envoys of the Secretary-General on Youth in \naddressing the needs of and placing young people as a cross-cutting priority of the \nUnited Nations, ensuring that their perspectives are reflected across the United \nNations work, as well as, inter alia, as a harmonizer with different United Nations \nentities, Governments and their youth delegates, civil society, youth organizations, \nacademia and media towards enhancing, empowering and strengthening young people \nwithin and outside the United Nations system, \n \n1. \nDecides to establish the United Nations Youth Office as a dedicated office \nfor youth affairs in the Secretariat, integrating the Office of the Envoy of the \nSecretary-General on Youth, following a submission of a detailed proposal on the \noperational functions, structure, resources and staffing of the new Youth Office, based \non a thorough analysis of the resource needs of the Office and funding from the \nregular budget of the United Nations, and in this regard requests the Secretary-\nGeneral to submit this proposal to the General Assembly, through its Fifth Committee, \nduring the seventy-seventh session; \n \n2. \nEmphasizes the importance of ensuring that the United Nations Youth \nOffice is provided with sufficient financial and human resources, and decides that the \nOffice shall be led by a suitably qualified person, preferably under the age of 35 years, \nwith a demonstrated commitment to youth issues, who shall be appointed by the \nSecretary-General at a senior-level position, in accordance with Article 101 of the \nCharter of the United Nations, with due regard to gender balance and geographical \nrepresentation; \n \n3. \nDecides that the United Nations Youth Office will: \n \n(a) \nLead engagement and advocacy for the advancement of youth issues \nacross the United Nations, in the areas of peace and security, sustainable development \nand human rights; \n \n(b) \nPromote meaningful, inclusive and effective engagement of youth and \nyouth-led and youth-focused organizations in the work of the United Nations, \nworking in close collaboration across the United Nations system; \n \n(c) \nEncourage greater United Nations system-wide collaboration, coordination \nand accountability on the advancement of youth issues, including United Nations \n__________________ \n \n7 A/75/982. \n\nEstablishment of the United Nations Youth Office \nA/RES/76/306\n \n3/3\n22-21686 \n \nsupport to Member States, as appropriate and upon their request, in promoting the \neffective and meaningful engagement, participation and empowerment of youth; \n \n(d) \nEncourage the identification of focal points on youth, within existing \nresources, across the United Nations system and in United Nations country teams; \n \n(e) \nEngage with youth-focused envoys, representatives and offices of regional \norganizations on advancing youth issues; \n \n(f) \nPropose innovative approaches to advance multi-stakeholder initiatives on \nthe engagement and empowerment of youth, for the consideration of Member States; \n \n(g) \nPromote and facilitate intergenerational and intercultural dialogue, \ncollaboration and solidarity; \n \n(h) \nSupport efforts to enhance youth representation at the United Nations, \nincluding through increasing and improving the conditions of internships and \nemployment opportunities for youth, especially for youth from developing countries \nand with due regard to gender balance; \n \n(i) \nSupport ongoing efforts towards the mobilization of financial and \ntechnical support and investment to promote and upscale quality and inclusive \neducation and training, skills development, capacity-building and bridging the digital \ndivide, in tandem with job creation, for youth and creating an enabling environment \nfor harnessing their talents and abilities to contribute to their societies; \n \n(j) \nConduct outreach to youth and youth-led and youth-focused organizations, \nthrough innovative means, including the use of social media; \n \n4. \nInvites the President of the Economic and Social Council, with the support \nof the Department of Economic and Social Affairs of the Secretariat, to collaborate \nwith the United Nations Youth Office in the preparations for the youth forum of the \nCouncil, in particular in ensuring that the forum represents a platform for youth from \nacross all regions to continue to share their ideas and engage in dialogue with Member \nStates; \n \n5. \nDecides to include in the draft agenda of its seventy-seventh session, and \nof subsequent sessions, an item entitled \u201cReport of the United Nations Youth Office\u201d, \nand requests the Secretary-General to submit to the General Assembly an annual \nreport on the activities of the Office for its consideration under this agenda item in \nplenary meeting; \n \n6. \nRequests that the United Nations Youth Office share the report with youth \nrepresentatives and representatives of youth-led and youth-focused organizations. \n \n102nd plenary meeting \n8 September 2022 \n \n",
  "paragraphs": {
    "1": "Decides to establish the United Nations Youth Office as a dedicated office for youth affairs in the Secretariat, integrating the Office of the Envoy of the Secretary-General on Youth, following a submission of a detailed proposal on the operational functions, structure, resources and staffing of the new Youth Office, based on a thorough analysis of the resource needs of the Office and funding from the regular budget of the United Nations, and in this regard requests the Secretary- General to submit this proposal to the General Assembly, through its Fifth Committee, during the seventy-seventh session;",
    "2": "Emphasizes the importance of ensuring that the United Nations Youth Office is provided with sufficient financial and human resources, and decides that the Office shall be led by a suitably qualified person, preferably under the age of 35 years, with a demonstrated commitment to youth issues, who shall be appointed by the Secretary-General at a senior-level position, in accordance with Article 101 of the Charter of the United Nations, with due regard to gender balance and geographical representation;",
    "3": "Decides that the United Nations Youth Office will: (a) Lead engagement and advocacy for the advancement of youth issues across the United Nations, in the areas of peace and security, sustainable development and human rights; (b) Promote meaningful, inclusive and effective engagement of youth and youth-led and youth-focused organizations in the work of the United Nations, working in close collaboration across the United Nations system; (c) Encourage greater United Nations system-wide collaboration, coordination and accountability on the advancement of youth issues, including United Nations __________________ 7 A/75/982. Establishment of the United Nations Youth Office A/RES/76/306 3/3 22-21686 support to Member States, as appropriate and upon their request, in promoting the effective and meaningful engagement, participation and empowerment of youth; (d) Encourage the identification of focal points on youth, within existing resources, across the United Nations system and in United Nations country teams; (e) Engage with youth-focused envoys, representatives and offices of regional organizations on advancing youth issues; (f) Propose innovative approaches to advance multi-stakeholder initiatives on the engagement and empowerment of youth, for the consideration of Member States; (g) Promote and facilitate intergenerational and intercultural dialogue, collaboration and solidarity; (h) Support efforts to enhance youth representation at the United Nations, including through increasing and improving the conditions of internships and employment opportunities for youth, especially for youth from developing countries and with due regard to gender balance; (i) Support ongoing efforts towards the mobilization of financial and technical support and investment to promote and upscale quality and inclusive education and training, skills development, capacity-building and bridging the digital divide, in tandem with job creation, for youth and creating an enabling environment for harnessing their talents and abilities to contribute to their societies; (j) Conduct outreach to youth and youth-led and youth-focused organizations, through innovative means, including the use of social media;",
    "4": "Invites the President of the Economic and Social Council, with the support of the Department of Economic and Social Affairs of the Secretariat, to collaborate with the United Nations Youth Office in the preparations for the youth forum of the Council, in particular in ensuring that the forum represents a platform for youth from across all regions to continue to share their ideas and engage in dialogue with Member States;",
    "5": "Decides to include in the draft agenda of its seventy-seventh session, and of subsequent sessions, an item entitled \u201cReport of the United Nations Youth Office\u201d, and requests the Secretary-General to submit to the General Assembly an annual report on the activities of the Office for its consideration under this agenda item in plenary meeting;",
    "6": "Requests that the United Nations Youth Office share the report with youth representatives and representatives of youth-led and youth-focused organizations. 102nd plenary meeting 8 September 2022"
  },
  "agenda_items": [
    "Item 124"
  ],
  "symbol_references": [
    "A/76/L.85"
  ]
}