{
  "symbol": "A/RES/74/218",
  "filename": "A_RES_74_218.pdf",
  "title": "74/218. Disaster risk reduction",
  "text": "United Nations \nA/RES/74/218\n \n \nGeneral Assembly \nDistr.: General \n23 January 2020 \n \n19-22487 (E)    280120 \n*1922487* \n \n \nSeventy-fourth session \nAgenda item 19 (c) \nSustainable development: disaster risk reduction \n \n \n \n \n Resolution adopted by the General Assembly \non 19 December 2019 \n \n \n \n \n[on the report of the Second Committee (A/74/381/Add.3)] \n \n \n 74/218. Disaster risk reduction \n \n \n \nThe General Assembly, \n \nRecalling its resolution 73/231 of 20 December 2018 and all previous relevant \nresolutions,  \n \nRecalling also the Sendai Declaration1 and the Sendai Framework for Disaster \nRisk Reduction 2015\u20132030,2 \n \nRecalling further the Rio Declaration on Environment and Development, 3 \nAgenda 21, 4  the Programme for the Further Implementation of Agenda 21, 5  the \nJohannesburg Declaration on Sustainable Development6 and the Plan of Implementation \nof the World Summit on Sustainable Development (Johannesburg Plan of \nImplementation), 7  and reaffirming the outcome document of the United Nations \nConference on Sustainable Development, entitled \u201cThe future we want\u201d,8 in particular \nthe decisions related to disaster risk reduction,  \n \nReaffirming its resolution 70/1 of 25 September 2015, entitled \u201cTransforming \nour world: the 2030 Agenda for Sustainable Development\u201d, in which it adopted a \ncomprehensive, far-reaching and people-centred set of universal and transformative \n__________________ \n \n1 Resolution 69/283, annex I. \n \n2 Ibid., annex II. \n \n3 Report of the United Nations Conference on Environment and Development, Rio de Janeiro, \n3\u221214 June 1992, vol. I, Resolutions Adopted by the Conference (United Nations publication, \nSales No. E.93.I.8 and corrigendum), resolution 1, annex I. \n \n4 Ibid., annex II. \n \n5 Resolution S-19/2, annex. \n \n6 Report of the World Summit on Sustainable Development, Johannesburg, South Africa, \n26 August\u20134 September 2002 (United Nations publication, Sales No. E.03.II.A.1 and \ncorrigendum), chap. I, resolution 1, annex. \n \n7 Ibid., resolution 2, annex. \n \n8 Resolution 66/288, annex. \n\nA/RES/74/218 \nDisaster risk reduction\n \n19-22487\n2/11 \n \nSustainable Development Goals and targets, its commitment to working tirelessly for \nthe full implementation of the Agenda by 2030, its recognition that eradicating \npoverty in all its forms and dimensions, including extreme poverty, is the greatest \nglobal challenge and an indispensable requirement for sustainable development, its \ncommitment to achieving sustainable development in its three dimensions \u2013 \neconomic, social and environmental \u2013 in a balanced and integrated manner, and to \nbuilding upon the achievements of the Millennium Development Goals and seeking \nto address their unfinished business,  \n \nReaffirming also its resolution 69/313 of 27 July 2015 on the Addis Ababa \nAction Agenda of the Third International Conference on Financing for Development, \nwhich is an integral part of the 2030 Agenda for Sustainable Development, supports \nand complements it, helps to contextualize its means of implementation targets with \nconcrete policies and actions, and reaffirms the strong political commitment to \naddress the challenge of financing and creating an enabling environment at all levels \nfor sustainable development in the spirit of global partnership and solidarity,  \n \nReaffirming further the New Urban Agenda, adopted at the United Nations \nConference on Housing and Sustainable Urban Development (Habitat III), held in \nQuito from 17 to 20 October 2016,9 and recognizing the linkages between disaster \nrisk reduction and sustainable urban development,  \n \nRecognizing the need for a broader and a more people-centred preventive \napproach to disaster risk and that disaster risk reduction practices need to be \nmulti-hazard and multisectoral, inclusive and accessible in order to be efficient and \neffective,  \n \nReiterating the call in the Sendai Framework for the substantial reduction of \ndisaster risk and losses in lives, livelihoods and health and in the economic, physical, \nsocial, cultural and environmental assets of persons, businesses, communities and \ncountries,  \n \nExpressing its deep concern at the number and scale of disasters and their \ndevastating impact this year and in recent years, which have resulted in massive loss \nof life, food insecurity, water-related challenges, displacement, humanitarian needs \nand long-term negative economic, social and environmental consequences for \nvulnerable societies throughout the world, and which hamper the achievement of their \nsustainable development, in particular that of developing countries,  \n \nRecognizing that disaster risk is increasingly complex and systemic and that \nhazards can trigger each other with cascading impacts across sectors and geographies, \nas well as at the local, national, regional and global levels, and that the interrelation \nof risks across multiple dimensions and scales and potential unintended negative \nconsequences should inform development policies and investments, emphasizing that \nthese policies should be oriented towards building resilience and achieving \nsustainability and the Sustainable Development Goals, and noting in this regard the \nfindings contained in the report of the Secretary-General on progress towards the \nSustainable Development Goals,10 the Global Sustainable Development Report and \nthe 2019 Global Assessment Report on Disaster Risk Reduction, and stressing the \nimportance of an integrated understanding of disaster risk in the implementation of \nthe 2030 Agenda for Sustainable Development, the Paris Agreement 11 and the Sendai \nFramework,  \n__________________ \n \n9 Resolution 71/256, annex. \n \n10  E/2019/68. \n \n11 Adopted under the UNFCCC in FCCC/CP/2015/10/Add.1, decision 1/CP.21. \n\nDisaster risk reduction \nA/RES/74/218\n \n3/11\n19-22487 \n \n \nRecognizing also the importance of promoting policies and planning that build \nresilience and reduce displacement risk in the context of disasters, including through \ntransboundary cooperation,  \n \nRecalling the Bangkok Principles for the implementation of the health aspects \nof the Sendai Framework as a contribution to the Sendai Framework to build resilient \nhealth systems,  \n \nRecognizing climate change as one of the drivers of disaster risk, and that the \nadverse effects of climate change, as contributors to environmental degradation and \nextreme weather events, may, in certain instances, among other factors, contribute to \ndisaster-induced human mobility, and in this regard acknowledging the internationally \nagreed outcomes adopted under the United Nations Framework Convention on \nClimate Change,12 \n \nRecognizing also that disasters, many of which are exacerbated by climate \nchange and are increasing in frequency and intensity, significantly impede progress \ntowards sustainable development,  \n \nReaffirming the Paris Agreement, and encouraging all its parties to fully \nimplement the Agreement, and parties to the United Nations Framework Convention \non Climate Change that have not yet done so to deposit their instruments of \nratification, acceptance, approval or accession, where appropriate, as soon as possible,  \n \nWelcoming the holding of the 2019 Climate Action Summit convened by the \nSecretary-General on 23 September, and noting the multi-partner initiatives and \ncommitments presented during the Summit,  \n \nLooking forward to the preparatory meetings leading to the fifth United Nations \nConference on the Least Developed Countries, to be held in Qatar in 2021, to raise \nambition and accelerate action to reduce disaster risk in the least developed countries,  \n \nHighlighting the synergies between the implementation of the Sendai \nFramework, the 2030 Agenda for Sustainable Development and the Paris Agreement,  \n \nNoting with concern the findings contained in the special report of the \nIntergovernmental Panel on Climate Change on the impacts of global warming of \n1.5 degrees Celsius above pre-industrial levels and related global greenhouse gas \nemission pathways, Global Warming of 1.5\u00b0C, in the context of strengthening the \nglobal response to the threat of climate change, sustainable development and efforts \nto eradicate poverty, noting with concern also the findings contained in the special \nreport of the Panel on climate change, desertification, land degradation, sustainable \nland management, food security and greenhouse gas fluxes in terrestrial ecosystems, \nentitled Climate Change and Land, and noting with concern further the findings \ncontained in the special report of the Panel entitled The Ocean and Cryosphere in a \nChanging Climate, \n \nStressing the urgent need to address the unprecedented global decline in \nbiodiversity, noting with concern the findings of the Intergovernmental Science-\nPolicy Platform on Biodiversity and Ecosystem Services, and in this regard looking \nforward to the 2020 United Nations summit on biodiversity and the fifteenth meeting \nof the Conference of the Parties to the Convention on Biological Diversity, which will \nadopt a post-2020 global biodiversity framework,  \n \nReaffirming the importance of strengthening international cooperation, in the \nface of disasters, weather-related hazards, including those driven by natural climate \ncycles such as the El Ni\u00f1o Southern Oscillation, and the adverse effects of climate \nchange, to estimate and prevent major damage and ensure an adequate response, early \n__________________ \n \n12 United Nations, Treaty Series, vol. 1771, No. 30822. \n\nA/RES/74/218 \nDisaster risk reduction\n \n19-22487\n4/11 \n \naction and attention to the affected populations in a timely manner in order to enhance \nresilience to their impacts, and recognizing in this regard the importance of \ndeveloping risk-informed strategies, risk finance tools, including forecast-based \nfinancing approaches and disaster risk insurance mechanisms and coordinated \nmulti-hazard early warning systems, including timely risk communication at the local, \nnational and regional levels,  \n \nRecognizing that disaster-prone developing countries, in particular the least \ndeveloped countries, small island developing States, landlocked developing countries \nand African countries, as well as middle-income countries facing specific challenges, \nwarrant particular attention in view of their higher vulnerability and risk levels, which \noften greatly exceed their capacity to prepare for, respond to and recover from \ndisasters, and recognizing also that similar attention and appropriate assistance should \nalso be extended to other disaster-prone countries with specific characteristics, such \nas archipelagic countries, as well as countries with extensive coastlines,  \n \nRecalling that the Sendai Framework applies to risks of small-scale and large-\nscale, frequent and infrequent, sudden- and slow-onset disasters caused by natural or \nhuman-made hazards, as well as related environmental, technological and biological \nhazards and risks,  \n \nReiterating the pledge that no one will be left behind, reaffirming the \nrecognition that the dignity of the human person is fundamental, and the wish to see \nthe Goals and targets met for all nations and peoples and for all segments of society, \nand recommitting to endeavour to reach the furthest behind first, \n \n1. \nTakes note of the report of the Secretary-General on the implementation of \nGeneral Assembly resolution 73/231;13 \n \n2. \nUrges the effective implementation of the Sendai Declaration1 and the \nSendai Framework for Disaster Risk Reduction 2015\u20132030;2  \n \n3. \nReiterates its call for the prevention of new and the reduction of existing \ndisaster risk through the implementation of integrated and inclusive economic, \nstructural, legal, social, health, cultural, educational, environmental, technological, \npolitical, financial and institutional measures that prevent and reduce hazard exposure \nand vulnerability to disaster, increase preparedness for response and recovery and \nthus strengthen resilience;  \n \n4. \nStresses the urgent need to enhance adaptive capacity, strengthen \nresilience and reduce vulnerability to climate change and extreme weather events, and \nin this regard further urges Member States to continue engaging in adaptation \nplanning processes and to enhance cooperation in disaster risk reduction;  \n \n5. \nUnderlines the need to address the economic, social and environmental \nimpacts of disasters, many of which are exacerbated by climate change, and \nemphasizes the need for action at all levels to enhance efforts to build resilience \nthrough, inter alia, the sustainable management of ecosystems to reduce the impacts \nand costs of disasters;  \n \n6. \nTakes note of the launch of the Coalition for Disaster-Resilient \nInfrastructure, the Risk-Informed Early Action Partnership, the Climate Risk and \nEarly Warning Systems (CREWS) initiative, and the Year of Action launched by the \nGlobal Commission on Adaptation that will culminate in the 2020 Climate Adaptation \nSummit;  \n \n7. \nRecognizes that in some cases the use of public debt and renewed external \nborrowing to absorb the impact of a disaster could lead to higher debt servicing for \n__________________ \n \n13 A/74/248. \n\nDisaster risk reduction \nA/RES/74/218\n \n5/11\n19-22487 \n \ndeveloping countries and constrain their growth and their capacity to invest in long-\nterm resilience-building, and further acknowledges that, with each new disaster, \nfinancial vulnerabilities may grow and domestic response capacities may weaken;  \n \n8. \nCalls upon all relevant actors to work towards the achievement of the \nglobal targets adopted in the Sendai Framework;  \n \n9. \nRecognizes progress made in achieving target (e) of the Sendai Framework \nand that the development and implementation of risk-informed strategic plans, \npolicies, programmes and investments and national and local disaster risk reduction \nstrategies are essential for sustainable development and the achievement of the \nSustainable Development Goals;14 \n \n10. Expresses concern that the current pace of action is not fast enough to meet \nthe target (e) deadline of the Sendai Framework by the end of 2020, and thus urges \nStates to accelerate progress and allocate the resources necessary to support the \ndevelopment and implementation of inclusive and participatory national and local \ndisaster risk reduction strategies, in line with the Sendai Framework, with a particular \nfocus on local strategies and programmes, to promote coherence and integration with \nsustainable development and climate change adaptation strategies, including national \nadaptation plans, to include the objective of preparing to \u201cbuild back better\u201d in \ndisaster risk reduction strategies and, where appropriate, to incorporate considerations \nregarding the risk of disaster displacement, in accordance with national circumstances, \nmaking use of practical guidance to support the achievement of target (e), and notes \nin this regard the relevant voluntary \u201cWords into action\u201d guidelines;  \n \n11. \nUrges States to conduct inclusive and multi-hazard disaster risk \nassessments that consider climate change projections to support evidence-based \ndisaster risk reduction strategies and guide risk-informed development investments \nby the private and public sectors;  \n \n12. Recognizes the important contribution of healthy ecosystems to reducing \ndisaster risk and building community resilience, and encourages all States, United \nNations entities and other relevant actors to promote ecosystem-based approaches for \ndisaster risk reduction at all levels and across all phases of disaster risk reduction and \nmanagement;  \n \n13. Acknowledges that water is essential to the achievement of the Sustainable \nDevelopment Goals, that water-related disasters and multidimensional hazards \nthreaten lives, livelihoods, agriculture and basic service infrastructure and cause \nsubstantial socioeconomic damage and losses, and that sustainable, integrated disaster \nrisk-informed water resource management is necessary for successful disaster \npreparedness, disaster risk reduction and climate change adaptation, and in this regard \ninvites all countries to integrate land and water management, including for floods and \ndroughts, into their national and subnational planning and management processes;  \n \n14. Recognizes that biological hazards require strengthened coordination \nbetween disaster and health risk management systems in the areas of risk assessment, \nsurveillance and early warning, and that resilient health infrastructures and \nstrengthened health systems capable of implementing the International Health \nRegulations (2005),15 as well as increasing the overall capacity of health systems, \nreduce overall disaster risk and build disaster resilience;  \n \n15. Urges States, while implementing the Sendai Framework, to prioritize the \nestablishment and strengthening of national disaster loss databases to augment efforts \nto create or enhance systems for data collection and the development of baselines on \n__________________ \n \n14 See resolution 70/1. \n \n15 World Health Organization, document WHA58/2005/REC/1, resolution 58.3, annex. \n\nA/RES/74/218 \nDisaster risk reduction\n \n19-22487\n6/11 \n \ncurrent losses, including livelihood and other losses of affected populations, and work \ntowards the collection of information disaggregated by income, sex, age and disability \nand on historical disaster losses going back, at least, to 2005, if feasible;  \n \n16. Recognizes that disaster risk reduction requires a multi-hazard and \nsystemic approach and inclusive risk-informed decision-making based on the open \nexchange and dissemination of data disaggregated by, inter alia, income, sex, age and \ndisability, and analysis with an adequate understanding of how the information is to \nbe interpreted and used, as well as on easily accessible, up-to-date, comprehensible, \ninteroperable, science-based, non-sensitive risk information, for a wide range of users \nand decision makers, complemented by traditional knowledge, and in this regard \nencourages States to commence or, as appropriate, further enhance the collection and \nanalysis of data on disaster loss and other relevant disaster risk reduction targets, \ndisaggregated by income, sex, age and disability and other characteristics relevant in \nnational contexts, and to strengthen inter-institutional, inclusive coordination on \ndisaster risk data and integrated analysis, and invites Member States to mobilize \nnational statistical and planning offices and other relevant authorities, and strengthen \ntheir capacity in the systemic collection, analysis and validation of disaster risk data \nto institutionalize its use in decision-making processes and investments across \nsectors;  \n \n17. Also recognizes the endorsement by the Economic and Social Council on \n2 July 2018 of the Strategic Framework on Geospatial Information and Services for \nDisasters,16 as a guide for Member States to ensure the availability and accessibility \nof quality geospatial information and services across all phases of disaster risk \nreduction and management, and which contributes to the implementation of the \nSendai Framework;  \n \n18. Stresses the importance of promoting the further development of and \ninvestment in effective national and regional multi-hazard early warning mechanisms, \nwhere relevant, and facilitating the sharing and exchange of information across all \ncountries;  \n \n19. Reaffirms that international cooperation for disaster risk reduction \nincludes a variety of sources and is a critical element in supporting the efforts of \ndeveloping countries to reduce disaster risk, and encourages States to strengthen \ninternational and regional information exchange and sharing, including through \nNorth-South cooperation complemented by South-South and triangular cooperation, \nestablishing and networking risk management centres, promoting critical science and \ntechnology research cooperation on disaster reduction and improving international \ncoordination mechanisms to respond to large-scale disasters;  \n \n20. Recognizes the importance of monitoring the Sendai Framework, and \nencourages States to use the online monitor to report on progress against the Sendai \nFramework global targets and the Sustainable Development Goals related to disaster \nrisk to provide, inter alia, a comprehensive overview of progress to inform the \ndeliberations and outcomes of the high-level political forum on sustainable \ndevelopment and the Global Platform for Disaster Risk Reduction, and notes the \nongoing work towards coherence between national climate change adaptation and \nnational disaster risk reduction strategies, as well as the Sendai Framework target \nindicators and national adaptation goals and indicators;  \n \n21. Reaffirms that the establishment of common indicators and shared data \nsets to measure the Sendai Framework global targets and the disaster risk reduction \ntargets of Sustainable Development Goals 1, 11 and 13 is an important contribution \nto ensure coherence, feasibility and consistency in implementation, the collection of \n__________________ \n \n16 Economic and Social Council resolution 2018/14, annex. \n\nDisaster risk reduction \nA/RES/74/218\n \n7/11\n19-22487 \n \ndata and reporting, and in this regard recognizes the importance of prioritizing \ncapacity-building support to developing countries, in particular the least developed \ncountries, small island developing States, landlocked developing countries and \nAfrican countries, as well as middle-income countries facing specific challenges;  \n \n22. Encourages States to give appropriate consideration to disaster risk \nreduction in the implementation of the 2030 Agenda for Sustainable Development, 13 \nwhere it is reflected across several Goals and targets, including in their voluntary \nnational reviews, inter alia, through the engagement of national Sendai Framework \nfocal points early in the national review process, as appropriate, and stresses the \nimportance of considering disaster risk reduction in the deliberations and outcomes \nof the high-level political forum on sustainable development;  \n \n23. Reiterates its strong encouragement of and the need for effective \ncoordination and coherence, as applicable, in the implementation of the 2030 Agenda \nfor Sustainable Development, the Addis Ababa Action Agenda of the Third \nInternational Conference on Financing for Development, 17  the Paris Agreement \nadopted under the United Nations Framework Convention on Climate Change, 11 and \nthe Sendai Framework, as well as the United Nations Framework Convention on \nClimate Change,12 the Convention on Biological Diversity, 18  the United Nations \nConvention to Combat Desertification in Those Countries Experiencing Serious \nDrought and/or Desertification, Particularly in Africa,19 and the New Urban Agenda,9 \nwhile respecting the relevant mandates, in order to build synergies and resilience, \ntranslate integrated global policy frameworks, as appropriate, into national laws, \npolicies or regulations defining roles and responsibilities across the public and private \nsectors, as well as into integrated multisectoral programmes at the national and local \nlevels, and reduce disaster risk across sectors, and addressing the global challenge of \neradicating poverty in all its forms and dimensions, including extreme poverty;  \n \n24. Encourages countries, the relevant United Nations bodies, agencies, funds \nand programmes and other relevant institutions and stakeholders to take into \nconsideration the important role of coordinated, inclusive and participatory disaster \nrisk governance across sectors for the achievement of sustainable development and, \ninter alia, the strengthening of disaster prevention as well as preparedness for \neffective response, recovery, rehabilitation and reconstruction;  \n \n25. Urges that due consideration continue to be given to the review of the \nglobal progress in the implementation of the Sendai Framework as part of the \nintegrated and coordinated follow-up processes to United Nations conferences and \nsummits, aligned with the Economic and Social Council, the high-level political \nforum on sustainable development and the quadrennial comprehensive policy review \ncycles, as appropriate, taking into account the contributions of the Global Platform \nfor Disaster Risk Reduction and regional and subregional platforms for disaster risk \nreduction and the Sendai Framework monitor;  \n \n26. Recognizes that effective and meaningful global and regional partnerships \nand the further strengthening of international cooperation, including the fulfilment of \nrespective commitments of official development assistance by developed countries, \nare essential for effective disaster risk management;  \n \n27. Encourages the incorporation of disaster risk reduction measures, as \nappropriate, into multilateral and bilateral development assistance programmes and \ninfrastructure financing, including through North-South cooperation complemented \nby South-South as well as triangular cooperation, within and across all sectors related \n__________________ \n \n17 Resolution 69/313, annex. \n \n18 United Nations, Treaty Series, vol. 1760, No. 30619. \n \n19 Ibid., vol. 1954, No. 33480. \n\nA/RES/74/218 \nDisaster risk reduction\n \n19-22487\n8/11 \n \nto sustainable development, including poverty reduction, agriculture, natural resource \nmanagement, the environment, urban development and adaptation to climate change; \n \n28. Recognizes that financing for disaster risk reduction requires greater \nattention, and in this regard encourages increased investments in disaster risk \nreduction, including resilient infrastructure, and invites the United Nations system \nand its entities, within the scope of their respective mandates, in partnership with \ninternational financial institutions, regional development banks and other relevant \ninstitutions and stakeholders, to support developing countries in developing \ncomprehensive disaster risk reduction financing strategies in support of national and \nlocal disaster risk reduction strategies, and incentivizing investments in resilience and \nprevention, and to explore the development of tailored financing mechanisms for \ndisaster risk reduction, including forecast-based financing approaches and disaster \nrisk insurance mechanisms;  \n \n29. Encourages States to allocate increased domestic resources to disaster risk \nreduction, including resilient infrastructure, to include disaster risk reduction in \nbudgeting and financial planning across all relevant sectors, and to ensure that \nnational financing frameworks and infrastructure plans are risk-informed, according \nto national plans and policies;  \n \n30. Recognizes that economic losses are rising as a result of the increasing \nnumber and value of assets exposed to hazards, and encourages countries to conduct \na disaster risk assessment of existing critical infrastructure, to ensure that \ninfrastructure plans are aligned to national disaster risk reduction strategies and risk \nassessments, to support the publication of disaster risk assessments, to make disaster \nrisk assessments a prerequisite for infrastructure and housing investments and to \nstrengthen regulatory frameworks for land-use planning and building codes, as \nappropriate, towards the achievement of target (d) of the Sendai Framework, and in \nthis regard encourages countries and other relevant stakeholders to integrate disaster \nrisk reduction considerations into their social, economic and environmental \ninvestments;  \n \n31. Encourages all relevant stakeholders to collaborate with the private sector \nto enhance the resilience of businesses, as well as the societies within which they \noperate, by integrating disaster risk into their management practices, to facilitate \nprivate investments in disaster risk reduction and to promote risk-informed private \ninvestments;  \n \n32. Reaffirms that investing in national and local skills, systems and \nknowledge to build resilience and preparedness will save lives, reduce the risk of \ndisplacement in the context of disasters, strengthen the adaptive capacity of food \nproduction systems and enhance food security, cut costs and preserve development \ngains, and in this regard encourages exploring innovative ways, such as forecast-\nbased financing approaches and disaster risk insurance mechanisms, to increase the \navailability of resources for Member States before a disaster is credibly expected to \noccur;  \n \n33. Also reaffirms the need for the enhancement of the implementation \ncapacity and capability of developing countries, in particular the least developed \ncountries, small island developing States, landlocked developing countries and \nAfrican countries, as well as middle-income countries facing specific challenges, \nincluding the mobilization of support through international cooperation, for the \nprovision of means of implementation to augment domestic efforts in accordance with \ntheir national priorities;  \n \n34. Recalls that the economic vulnerability index gives consideration to the \nimpacts of natural disasters, recognizes the relevance of disaster risk and the impact \n\nDisaster risk reduction \nA/RES/74/218\n \n9/11\n19-22487 \n \nof disasters in the process of graduation from the least developed country category, \nincluding the impact assessment of the likely consequences of graduation and the \nvulnerability profiles, and stresses the importance of integrating disaster risk \nreduction into the smooth transition strategies of graduating countries;  \n \n35. Recognizes that the extent to which developing countries are able to \neffectively enhance and implement national disaster risk reduction policies and \nmeasures in the context of their respective circumstances and capabilities can be \nfurther enhanced through the provision of sustainable international cooperation;  \n \n36. Also recognizes the importance of giving priority to the development of \nlocal and national disaster risk reduction capacity-building, policies, strategies and \nplans with the participation of all relevant stakeholders, in accordance with national \npractices and legislation;  \n \n37. Further recognizes that, while each State has the primary responsibility \nfor preventing and reducing disaster risk, it is a shared responsibility between \nGovernments and relevant stakeholders, and recognizes that non-State and other \nrelevant stakeholders, including major groups, parliaments, civil society, the \nInternational Red Cross and Red Crescent Movement, non-governmental \norganizations, national platforms for disaster risk reduction, focal points for the \nSendai Framework, local government representatives, scientific institutions and the \nprivate sector, as well as organizations and relevant agencies, funds and programmes \nof the United Nations system and other relevant institutions and intergovernmental \norganizations, play an important role as enablers in providing support to States, in \naccordance with national policies, laws and regulations, in the implementation of the \nSendai Framework at the local, national, regional and global levels, and that greater \nefforts are needed to mobilize multi-stakeholder partnerships for disaster risk \nreduction, according to national plans and policies;  \n \n38. Encourages Governments to promote the full, equal and effective \nparticipation and leadership of women, as well as of persons with disabilities, in the \ndesign, management, resourcing and implementation of gender-responsive and \ndisability-inclusive disaster risk reduction policies, plans and programmes, and \nrecognizes in this regard that women and girls are disproportionately exposed to risk, \nincreased loss of livelihoods and even loss of life during and in the aftermath of \ndisasters, and that disasters and the consequent disruption to physical, social, \neconomic and environmental networks and support systems disproportionately affect \npersons with disabilities and their families;  \n \n39. Stresses the importance of mainstreaming a gender perspective and the \nperspectives of persons with disabilities, as well as other people in vulnerable \nsituations, in disaster risk management, and of engaging and appropriately drawing \non the capacities of children, youth, including young professionals, as contributors in \ndisaster risk management so as to strengthen the resilience of communities and reduce \nsocial vulnerabilities to disasters, and in this regard recognizes the need for the \ninclusive participation and contribution of women, children, older persons, persons \nwith disabilities, indigenous peoples and local communities, as well as the role of \nyouth, volunteers, migrants, academia, scientific and research entities and networks, \nbusiness, professional associations, private sector financing institutions and the \nmedia, in all forums and processes related to disaster risk reduction, in accordance \nwith the Sendai Framework;  \n \n40. Emphasizes that disaster prevention, preparedness, early actions and \nresilience-building in most cases are significantly more cost-effective than emergency \nresponse, as well as the importance of additional efforts to increase the availability of \n\nA/RES/74/218 \nDisaster risk reduction\n \n19-22487\n10/11 \n \nand access to multi-hazard early warning mechanisms of States, in order to ensure \nthat early warning leads to early action, and encourages all relevant stakeholders to \nsupport these efforts;  \n \n41. Acknowledges the continuous work of the entities of the United Nations \nsystem, in accordance with their respective mandates, in supporting the efforts of \ndeveloping countries in the area of disaster risk reduction, including through the \ninclusion, where appropriate, of disaster risk reduction in the United Nations \nSustainable Development Cooperation Framework and as part of the common country \nassessment\u2019s multidimensional analysis, requests the relevant United Nations entities \nand United Nations country teams, and urges other relevant stakeholders, to continue \nto integrate disaster risk reduction and the implementation of the Sendai Framework \ninto their work and to align their work with the United Nations Plan of Action on \nDisaster Risk Reduction for Resilience: Towards a Risk-informed and Integrated \nApproach to Sustainable Development, guided by the Senior Leadership Group on \nDisaster Risk Reduction for Resilience convened by the Special Representative of the \nSecretary-General for Disaster Risk Reduction, according to the Sendai Framework;  \n \n42. Also acknowledges the importance of the work of the agencies, funds and \nprogrammes of the United Nations system and other relevant institutions in disaster \nrisk reduction, the substantial increase in demands on the United Nations Office for \nDisaster Risk Reduction and the need for timely, stable, adequate and predictable \nresources necessary for supporting the implementation of the Sendai Framework, and \nin this regard encourages Member States to consider providing or augmenting \nvoluntary contributions to the United Nations Office for Disaster Risk Reduction;  \n \n43. Recognizes the continued importance of voluntary funding, and urges \nexisting and new donors to provide sufficient funding and, where possible, to augment \nfinancial contributions to the United Nations trust fund for disaster reduction to \nsupport te implementation of the Sendai Framework, including through unearmarked \nand, where possible, multi-annual contributions;  \n \n44. Reaffirms the importance of the Global Platform for Disaster Risk \nReduction and the regional and subregional platforms for disaster risk reduction as \nforums to assess and discuss progress on the implementation of the Sendai Framework \nand advance coherence between disaster risk reduction, sustainable development and \nclimate change mitigation and adaptation, including financing, and recognizes their \noutcomes as contributions to the high-level political forum on sustainable development;  \n \n45. Expresses its appreciation to the Government of Switzerland for hosting \nthe sixth session of the Global Platform for Disaster Risk Reduction in Geneva from \n13 to 17 May 2019, jointly organized with the United Nations Office for Disaster Risk \nReduction, and looks forward to the regional platforms for disaster risk reduction and \ntheir deliberations, to be held in Australia and Jamaica in 2020 and jointly organized \nwith the United Nations Office for Disaster Risk Reduction, and encourages \nparticipation by all stakeholders, sectors and ministries at the highest level possible;  \n \n46. Stresses the importance of promoting the incorporation of disaster risk \nknowledge, including disaster prevention, mitigation, preparedness, response, \nrecovery and rehabilitation, in formal and non-formal education, as well as in civic \neducation at all levels and in professional education and training;  \n \n47. Welcomes the annual observance of the International Day for Disaster Risk \nReduction on 13 October and World Tsunami Awareness Day on 5 November, and \nencourages all States, United Nations bodies and other relevant actors to observe the \nDays to further raise public awareness of disaster risk reduction;  \n\nDisaster risk reduction \nA/RES/74/218\n \n11/11\n19-22487 \n \n \n48. Reaffirms the commitment at the very heart of the 2030 Agenda to leave \nno one behind and commit to taking more tangible steps to support people in \nvulnerable situations and the most vulnerable countries and to reach the furthest \nbehind first;  \n \n49. Requests the Secretary-General to submit to the General Assembly at its \nseventy-fifth session a report on the implementation of the present resolution, and \ndecides to include in the provisional agenda of its seventy-fifth session, under the \nitem entitled \u201cSustainable development\u201d, the sub-item entitled \u201cDisaster risk \nreduction\u201d. \n \n52nd plenary meeting \n19 December 2019 \n \n",
  "paragraphs": {
    "1": "Takes note of the report of the Secretary-General on the implementation of General Assembly resolution 73/231;13",
    "2": "Urges the effective implementation of the Sendai Declaration1 and the Sendai Framework for Disaster Risk Reduction 2015\u20132030;2",
    "3": "Reiterates its call for the prevention of new and the reduction of existing disaster risk through the implementation of integrated and inclusive economic, structural, legal, social, health, cultural, educational, environmental, technological, political, financial and institutional measures that prevent and reduce hazard exposure and vulnerability to disaster, increase preparedness for response and recovery and thus strengthen resilience;",
    "4": "Stresses the urgent need to enhance adaptive capacity, strengthen resilience and reduce vulnerability to climate change and extreme weather events, and in this regard further urges Member States to continue engaging in adaptation planning processes and to enhance cooperation in disaster risk reduction;",
    "5": "Underlines the need to address the economic, social and environmental impacts of disasters, many of which are exacerbated by climate change, and emphasizes the need for action at all levels to enhance efforts to build resilience through, inter alia, the sustainable management of ecosystems to reduce the impacts and costs of disasters;",
    "6": "Takes note of the launch of the Coalition for Disaster-Resilient Infrastructure, the Risk-Informed Early Action Partnership, the Climate Risk and Early Warning Systems (CREWS) initiative, and the Year of Action launched by the Global Commission on Adaptation that will culminate in the 2020 Climate Adaptation Summit;",
    "7": "Recognizes that in some cases the use of public debt and renewed external borrowing to absorb the impact of a disaster could lead to higher debt servicing for __________________ 13 A/74/248. Disaster risk reduction A/RES/74/218 5/11 19-22487 developing countries and constrain their growth and their capacity to invest in long- term resilience-building, and further acknowledges that, with each new disaster, financial vulnerabilities may grow and domestic response capacities may weaken;",
    "8": "Calls upon all relevant actors to work towards the achievement of the global targets adopted in the Sendai Framework;",
    "9": "Recognizes progress made in achieving target (e) of the Sendai Framework and that the development and implementation of risk-informed strategic plans, policies, programmes and investments and national and local disaster risk reduction strategies are essential for sustainable development and the achievement of the Sustainable Development Goals;14",
    "10": "Expresses concern that the current pace of action is not fast enough to meet the target (e) deadline of the Sendai Framework by the end of 2020, and thus urges States to accelerate progress and allocate the resources necessary to support the development and implementation of inclusive and participatory national and local disaster risk reduction strategies, in line with the Sendai Framework, with a particular focus on local strategies and programmes, to promote coherence and integration with sustainable development and climate change adaptation strategies, including national adaptation plans, to include the objective of preparing to \u201cbuild back better\u201d in disaster risk reduction strategies and, where appropriate, to incorporate considerations regarding the risk of disaster displacement, in accordance with national circumstances, making use of practical guidance to support the achievement of target (e), and notes in this regard the relevant voluntary \u201cWords into action\u201d guidelines;",
    "11": "Urges States to conduct inclusive and multi-hazard disaster risk assessments that consider climate change projections to support evidence-based disaster risk reduction strategies and guide risk-informed development investments by the private and public sectors;",
    "12": "Recognizes the important contribution of healthy ecosystems to reducing disaster risk and building community resilience, and encourages all States, United Nations entities and other relevant actors to promote ecosystem-based approaches for disaster risk reduction at all levels and across all phases of disaster risk reduction and management;",
    "13": "Acknowledges that water is essential to the achievement of the Sustainable Development Goals, that water-related disasters and multidimensional hazards threaten lives, livelihoods, agriculture and basic service infrastructure and cause substantial socioeconomic damage and losses, and that sustainable, integrated disaster risk-informed water resource management is necessary for successful disaster preparedness, disaster risk reduction and climate change adaptation, and in this regard invites all countries to integrate land and water management, including for floods and droughts, into their national and subnational planning and management processes;",
    "14": "Recognizes that biological hazards require strengthened coordination between disaster and health risk management systems in the areas of risk assessment, surveillance and early warning, and that resilient health infrastructures and strengthened health systems capable of implementing the International Health Regulations (2005),15 as well as increasing the overall capacity of health systems, reduce overall disaster risk and build disaster resilience;",
    "15": "Urges States, while implementing the Sendai Framework, to prioritize the establishment and strengthening of national disaster loss databases to augment efforts to create or enhance systems for data collection and the development of baselines on __________________ 14 See resolution 70/1. 15 World Health Organization, document WHA58/2005/REC/1, resolution 58.3, annex. A/RES/74/218 Disaster risk reduction 19-22487 6/11 current losses, including livelihood and other losses of affected populations, and work towards the collection of information disaggregated by income, sex, age and disability and on historical disaster losses going back, at least, to 2005, if feasible;",
    "16": "Recognizes that disaster risk reduction requires a multi-hazard and systemic approach and inclusive risk-informed decision-making based on the open exchange and dissemination of data disaggregated by, inter alia, income, sex, age and disability, and analysis with an adequate understanding of how the information is to be interpreted and used, as well as on easily accessible, up-to-date, comprehensible, interoperable, science-based, non-sensitive risk information, for a wide range of users and decision makers, complemented by traditional knowledge, and in this regard encourages States to commence or, as appropriate, further enhance the collection and analysis of data on disaster loss and other relevant disaster risk reduction targets, disaggregated by income, sex, age and disability and other characteristics relevant in national contexts, and to strengthen inter-institutional, inclusive coordination on disaster risk data and integrated analysis, and invites Member States to mobilize national statistical and planning offices and other relevant authorities, and strengthen their capacity in the systemic collection, analysis and validation of disaster risk data to institutionalize its use in decision-making processes and investments across sectors;",
    "17": "Also recognizes the endorsement by the Economic and Social Council on 2 July 2018 of the Strategic Framework on Geospatial Information and Services for Disasters,16 as a guide for Member States to ensure the availability and accessibility of quality geospatial information and services across all phases of disaster risk reduction and management, and which contributes to the implementation of the Sendai Framework;",
    "18": "Stresses the importance of promoting the further development of and investment in effective national and regional multi-hazard early warning mechanisms, where relevant, and facilitating the sharing and exchange of information across all countries;",
    "19": "Reaffirms that international cooperation for disaster risk reduction includes a variety of sources and is a critical element in supporting the efforts of developing countries to reduce disaster risk, and encourages States to strengthen international and regional information exchange and sharing, including through North-South cooperation complemented by South-South and triangular cooperation, establishing and networking risk management centres, promoting critical science and technology research cooperation on disaster reduction and improving international coordination mechanisms to respond to large-scale disasters;",
    "20": "Recognizes the importance of monitoring the Sendai Framework, and encourages States to use the online monitor to report on progress against the Sendai Framework global targets and the Sustainable Development Goals related to disaster risk to provide, inter alia, a comprehensive overview of progress to inform the deliberations and outcomes of the high-level political forum on sustainable development and the Global Platform for Disaster Risk Reduction, and notes the ongoing work towards coherence between national climate change adaptation and national disaster risk reduction strategies, as well as the Sendai Framework target indicators and national adaptation goals and indicators;",
    "21": "Reaffirms that the establishment of common indicators and shared data sets to measure the Sendai Framework global targets and the disaster risk reduction targets of Sustainable Development Goals 1, 11 and 13 is an important contribution to ensure coherence, feasibility and consistency in implementation, the collection of __________________ 16 Economic and Social Council resolution 2018/14, annex. Disaster risk reduction A/RES/74/218 7/11 19-22487 data and reporting, and in this regard recognizes the importance of prioritizing capacity-building support to developing countries, in particular the least developed countries, small island developing States, landlocked developing countries and African countries, as well as middle-income countries facing specific challenges;",
    "22": "Encourages States to give appropriate consideration to disaster risk reduction in the implementation of the 2030 Agenda for Sustainable Development, 13 where it is reflected across several Goals and targets, including in their voluntary national reviews, inter alia, through the engagement of national Sendai Framework focal points early in the national review process, as appropriate, and stresses the importance of considering disaster risk reduction in the deliberations and outcomes of the high-level political forum on sustainable development;",
    "23": "Reiterates its strong encouragement of and the need for effective coordination and coherence, as applicable, in the implementation of the 2030 Agenda for Sustainable Development, the Addis Ababa Action Agenda of the Third International Conference on Financing for Development, 17 the Paris Agreement adopted under the United Nations Framework Convention on Climate Change, 11 and the Sendai Framework, as well as the United Nations Framework Convention on Climate Change,12 the Convention on Biological Diversity, 18 the United Nations Convention to Combat Desertification in Those Countries Experiencing Serious Drought and/or Desertification, Particularly in Africa,19 and the New Urban Agenda,9 while respecting the relevant mandates, in order to build synergies and resilience, translate integrated global policy frameworks, as appropriate, into national laws, policies or regulations defining roles and responsibilities across the public and private sectors, as well as into integrated multisectoral programmes at the national and local levels, and reduce disaster risk across sectors, and addressing the global challenge of eradicating poverty in all its forms and dimensions, including extreme poverty;",
    "24": "Encourages countries, the relevant United Nations bodies, agencies, funds and programmes and other relevant institutions and stakeholders to take into consideration the important role of coordinated, inclusive and participatory disaster risk governance across sectors for the achievement of sustainable development and, inter alia, the strengthening of disaster prevention as well as preparedness for effective response, recovery, rehabilitation and reconstruction;",
    "25": "Urges that due consideration continue to be given to the review of the global progress in the implementation of the Sendai Framework as part of the integrated and coordinated follow-up processes to United Nations conferences and summits, aligned with the Economic and Social Council, the high-level political forum on sustainable development and the quadrennial comprehensive policy review cycles, as appropriate, taking into account the contributions of the Global Platform for Disaster Risk Reduction and regional and subregional platforms for disaster risk reduction and the Sendai Framework monitor;",
    "26": "Recognizes that effective and meaningful global and regional partnerships and the further strengthening of international cooperation, including the fulfilment of respective commitments of official development assistance by developed countries, are essential for effective disaster risk management;",
    "27": "Encourages the incorporation of disaster risk reduction measures, as appropriate, into multilateral and bilateral development assistance programmes and infrastructure financing, including through North-South cooperation complemented by South-South as well as triangular cooperation, within and across all sectors related __________________ 17 Resolution 69/313, annex. 18 United Nations, Treaty Series, vol. 1760, No. 30619. 19 Ibid., vol. 1954, No. 33480. A/RES/74/218 Disaster risk reduction 19-22487 8/11 to sustainable development, including poverty reduction, agriculture, natural resource management, the environment, urban development and adaptation to climate change;",
    "28": "Recognizes that financing for disaster risk reduction requires greater attention, and in this regard encourages increased investments in disaster risk reduction, including resilient infrastructure, and invites the United Nations system and its entities, within the scope of their respective mandates, in partnership with international financial institutions, regional development banks and other relevant institutions and stakeholders, to support developing countries in developing comprehensive disaster risk reduction financing strategies in support of national and local disaster risk reduction strategies, and incentivizing investments in resilience and prevention, and to explore the development of tailored financing mechanisms for disaster risk reduction, including forecast-based financing approaches and disaster risk insurance mechanisms;",
    "29": "Encourages States to allocate increased domestic resources to disaster risk reduction, including resilient infrastructure, to include disaster risk reduction in budgeting and financial planning across all relevant sectors, and to ensure that national financing frameworks and infrastructure plans are risk-informed, according to national plans and policies;",
    "30": "Recognizes that economic losses are rising as a result of the increasing number and value of assets exposed to hazards, and encourages countries to conduct a disaster risk assessment of existing critical infrastructure, to ensure that infrastructure plans are aligned to national disaster risk reduction strategies and risk assessments, to support the publication of disaster risk assessments, to make disaster risk assessments a prerequisite for infrastructure and housing investments and to strengthen regulatory frameworks for land-use planning and building codes, as appropriate, towards the achievement of target (d) of the Sendai Framework, and in this regard encourages countries and other relevant stakeholders to integrate disaster risk reduction considerations into their social, economic and environmental investments;",
    "31": "Encourages all relevant stakeholders to collaborate with the private sector to enhance the resilience of businesses, as well as the societies within which they operate, by integrating disaster risk into their management practices, to facilitate private investments in disaster risk reduction and to promote risk-informed private investments;",
    "32": "Reaffirms that investing in national and local skills, systems and knowledge to build resilience and preparedness will save lives, reduce the risk of displacement in the context of disasters, strengthen the adaptive capacity of food production systems and enhance food security, cut costs and preserve development gains, and in this regard encourages exploring innovative ways, such as forecast- based financing approaches and disaster risk insurance mechanisms, to increase the availability of resources for Member States before a disaster is credibly expected to occur;",
    "33": "Also reaffirms the need for the enhancement of the implementation capacity and capability of developing countries, in particular the least developed countries, small island developing States, landlocked developing countries and African countries, as well as middle-income countries facing specific challenges, including the mobilization of support through international cooperation, for the provision of means of implementation to augment domestic efforts in accordance with their national priorities;",
    "34": "Recalls that the economic vulnerability index gives consideration to the impacts of natural disasters, recognizes the relevance of disaster risk and the impact Disaster risk reduction A/RES/74/218 9/11 19-22487 of disasters in the process of graduation from the least developed country category, including the impact assessment of the likely consequences of graduation and the vulnerability profiles, and stresses the importance of integrating disaster risk reduction into the smooth transition strategies of graduating countries;",
    "35": "Recognizes that the extent to which developing countries are able to effectively enhance and implement national disaster risk reduction policies and measures in the context of their respective circumstances and capabilities can be further enhanced through the provision of sustainable international cooperation;",
    "36": "Also recognizes the importance of giving priority to the development of local and national disaster risk reduction capacity-building, policies, strategies and plans with the participation of all relevant stakeholders, in accordance with national practices and legislation;",
    "37": "Further recognizes that, while each State has the primary responsibility for preventing and reducing disaster risk, it is a shared responsibility between Governments and relevant stakeholders, and recognizes that non-State and other relevant stakeholders, including major groups, parliaments, civil society, the International Red Cross and Red Crescent Movement, non-governmental organizations, national platforms for disaster risk reduction, focal points for the Sendai Framework, local government representatives, scientific institutions and the private sector, as well as organizations and relevant agencies, funds and programmes of the United Nations system and other relevant institutions and intergovernmental organizations, play an important role as enablers in providing support to States, in accordance with national policies, laws and regulations, in the implementation of the Sendai Framework at the local, national, regional and global levels, and that greater efforts are needed to mobilize multi-stakeholder partnerships for disaster risk reduction, according to national plans and policies;",
    "38": "Encourages Governments to promote the full, equal and effective participation and leadership of women, as well as of persons with disabilities, in the design, management, resourcing and implementation of gender-responsive and disability-inclusive disaster risk reduction policies, plans and programmes, and recognizes in this regard that women and girls are disproportionately exposed to risk, increased loss of livelihoods and even loss of life during and in the aftermath of disasters, and that disasters and the consequent disruption to physical, social, economic and environmental networks and support systems disproportionately affect persons with disabilities and their families;",
    "39": "Stresses the importance of mainstreaming a gender perspective and the perspectives of persons with disabilities, as well as other people in vulnerable situations, in disaster risk management, and of engaging and appropriately drawing on the capacities of children, youth, including young professionals, as contributors in disaster risk management so as to strengthen the resilience of communities and reduce social vulnerabilities to disasters, and in this regard recognizes the need for the inclusive participation and contribution of women, children, older persons, persons with disabilities, indigenous peoples and local communities, as well as the role of youth, volunteers, migrants, academia, scientific and research entities and networks, business, professional associations, private sector financing institutions and the media, in all forums and processes related to disaster risk reduction, in accordance with the Sendai Framework;",
    "40": "Emphasizes that disaster prevention, preparedness, early actions and resilience-building in most cases are significantly more cost-effective than emergency response, as well as the importance of additional efforts to increase the availability of A/RES/74/218 Disaster risk reduction 19-22487 10/11 and access to multi-hazard early warning mechanisms of States, in order to ensure that early warning leads to early action, and encourages all relevant stakeholders to support these efforts;",
    "41": "Acknowledges the continuous work of the entities of the United Nations system, in accordance with their respective mandates, in supporting the efforts of developing countries in the area of disaster risk reduction, including through the inclusion, where appropriate, of disaster risk reduction in the United Nations Sustainable Development Cooperation Framework and as part of the common country assessment\u2019s multidimensional analysis, requests the relevant United Nations entities and United Nations country teams, and urges other relevant stakeholders, to continue to integrate disaster risk reduction and the implementation of the Sendai Framework into their work and to align their work with the United Nations Plan of Action on Disaster Risk Reduction for Resilience: Towards a Risk-informed and Integrated Approach to Sustainable Development, guided by the Senior Leadership Group on Disaster Risk Reduction for Resilience convened by the Special Representative of the Secretary-General for Disaster Risk Reduction, according to the Sendai Framework;",
    "42": "Also acknowledges the importance of the work of the agencies, funds and programmes of the United Nations system and other relevant institutions in disaster risk reduction, the substantial increase in demands on the United Nations Office for Disaster Risk Reduction and the need for timely, stable, adequate and predictable resources necessary for supporting the implementation of the Sendai Framework, and in this regard encourages Member States to consider providing or augmenting voluntary contributions to the United Nations Office for Disaster Risk Reduction;",
    "43": "Recognizes the continued importance of voluntary funding, and urges existing and new donors to provide sufficient funding and, where possible, to augment financial contributions to the United Nations trust fund for disaster reduction to support te implementation of the Sendai Framework, including through unearmarked and, where possible, multi-annual contributions;",
    "44": "Reaffirms the importance of the Global Platform for Disaster Risk Reduction and the regional and subregional platforms for disaster risk reduction as forums to assess and discuss progress on the implementation of the Sendai Framework and advance coherence between disaster risk reduction, sustainable development and climate change mitigation and adaptation, including financing, and recognizes their outcomes as contributions to the high-level political forum on sustainable development;",
    "45": "Expresses its appreciation to the Government of Switzerland for hosting the sixth session of the Global Platform for Disaster Risk Reduction in Geneva from 13 to 17 May 2019, jointly organized with the United Nations Office for Disaster Risk Reduction, and looks forward to the regional platforms for disaster risk reduction and their deliberations, to be held in Australia and Jamaica in 2020 and jointly organized with the United Nations Office for Disaster Risk Reduction, and encourages participation by all stakeholders, sectors and ministries at the highest level possible;",
    "46": "Stresses the importance of promoting the incorporation of disaster risk knowledge, including disaster prevention, mitigation, preparedness, response, recovery and rehabilitation, in formal and non-formal education, as well as in civic education at all levels and in professional education and training;",
    "47": "Welcomes the annual observance of the International Day for Disaster Risk Reduction on 13 October and World Tsunami Awareness Day on 5 November, and encourages all States, United Nations bodies and other relevant actors to observe the Days to further raise public awareness of disaster risk reduction; Disaster risk reduction A/RES/74/218 11/11 19-22487",
    "48": "Reaffirms the commitment at the very heart of the 2030 Agenda to leave no one behind and commit to taking more tangible steps to support people in vulnerable situations and the most vulnerable countries and to reach the furthest behind first;",
    "49": "Requests the Secretary-General to submit to the General Assembly at its seventy-fifth session a report on the implementation of the present resolution, and decides to include in the provisional agenda of its seventy-fifth session, under the item entitled \u201cSustainable development\u201d, the sub-item entitled \u201cDisaster risk reduction\u201d. 52nd plenary meeting 19 December 2019"
  },
  "agenda_items": [
    "Item 19"
  ],
  "symbol_references": []
}