{
  "symbol": "A/RES/79/274",
  "filename": "A_RES_79_274.pdf",
  "title": "79/274. Permanent neutrality of Turkmenistan",
  "text": "United Nations \nA/RES/79/274\n \nGeneral Assembly \nDistr.: General \n25 March 2025 \n25-04827 (E) \n*2504827* \n \n \nSeventy-ninth session \nAgenda item 61 \nPeacebuilding and sustaining peace \n \n \n \n \n Resolution adopted by the General Assembly \non 21 March 2025 \n \n \n[without reference to a Main Committee (A/79/L.59)] \n \n \n 79/274. Permanent neutrality of Turkmenistan \n \n \n \nThe General Assembly, \n \nRecalling its resolutions 50/80 A of 12 December 1995 and 69/285 of 3 June \n2015 on the permanent neutrality of Turkmenistan, \n \nRecalling also its resolutions 71/275 of 2 February 2017 on the proclamation of \nthe International Day of Neutrality and 75/28 of 7 December 2020 on the role and \nimportance of a policy of neutrality in maintaining and strengthening international \npeace, security and sustainable development, \n \nReaffirming the sovereign right of every State to determine independently its \nforeign policy in accordance with the norms and principles of international law, \nincluding the Charter of the United Nations, \n \nUnderlining that the national policies of neutrality of some States can contribute \nto the strengthening of international peace and security in relevant regions and at the \nglobal level and can play an important role in developing peaceful, friendly and \nmutually beneficial relations between the countries of the world, \n \nAcknowledging that such national policies of neutrality are aimed at promoting \nthe use of preventive diplomacy, including through the prevention of conflict, \nmediation, good offices, negotiation, the use of special envoys, informal \nconsultations, peacebuilding and targeted development activities, \n \nRecognizing that the status of permanent neutrality of Turkmenistan contributes \nto the strengthening of peace and security in the region, and the active and positive \nrole that Turkmenistan plays in developing peaceful, friendly and mutually beneficial \nrelations with the countries of the region and other States of the world, \n \nUnderlining the contribution of neutral Turkmenistan in the United Nations-led \ninter-Tajik talks, through the initiative to host a continuous round of inter-Tajik talks \nin Ashgabat in 1995 and 1996, and in addressing conflict in Afghanistan by hosting \n\nA/RES/79/274 \nPermanent neutrality of Turkmenistan\n \n25-04827\n2/3 \n \ninter-Afghan talks and an international forum on Afghanistan in 1997 and continuing \nto offer the territory of Turkmenistan for further inclusive, Afghan-led dialogue on \nreconciliation,  \n \nWelcoming the initiatives of neutral Turkmenistan directed at further \nstrengthening economic, social, cultural and environmental cooperation in Central \nAsia and the Caspian Sea region,  \n \nExpressing its gratitude to the Government of Turkmenistan for its valuable \ncontribution to strengthening international peace and security by strongly upholding \nits policy of permanent neutrality and hosting annual international conferences \ndedicated to advancing the principles and values of neutrality as a means of achieving \npeace and sustainable development, \n \nRecalling the outcome document of the international conference on the theme \n\u201cPolicy of neutrality and its significance in ensuring international peace, security and \nsustainable development\u201d (Ashgabat outcome document), adopted on 12 December \n2020,1 \n \nWelcoming the proclamation of the International Year of Peace and Trust, 2025, \nthrough its resolution 78/266 of 21 March 2024, as well as the declaration of the zone \nof peace, trust and cooperation of Central Asia through its resolution 76/299 of 28 July \n2022, at the initiative of Turkmenistan, \n \nRecalling its resolutions 72/7 of 17 November 2017, 75/272 of 16 April 2021 \nand 77/273 of 24 February 2023, and recognizing that the United Nations Regional \nCentre for Preventive Diplomacy for Central Asia, established in Ashgabat in \nDecember 2007 at the initiative of all Central Asian States and with the support of the \ninternational community, plays an important role in assisting the Central Asian States \nin addressing regional challenges by encouraging and facilitating closer cooperation \namong them, identifying and tackling potential sources of tension before possible \nescalation and responding to domestic and transnational challenges and threats to \npeace and security by supporting the sustainable development of the region,  \n \nRecognizing the positive role that neutral Turkmenistan plays in the provision \nand delivery of humanitarian assistance in situations of complex emergencies and \nnatural disasters in the region, in accordance with the guiding principles for the \nstrengthening of the coordination of humanitarian emergency assistance of the United \nNations,2 including the principle of neutrality,  \n \nUnderlining the importance of the economic and geoeconomic aspects of the \nneutrality of Turkmenistan for regional interconnectivity, which is conducive to \nregional development, and in this regard welcoming the initiatives of Turkmenistan \non the stable transit of energy and the development of reliable transport and transit \ncorridors, as reflected in relevant General Assembly resolutions, 3 \n \nNoting the support of the Movement of Non-Aligned Countries for the status of \npermanent neutrality of Turkmenistan expressed in the Final Document of the \nEleventh Conference of Heads of State or Government of Non-Aligned Countries, \nheld in Cartagena de Indias, Colombia, from 18 to 20 October 1995,4 \n \nNoting also the resolutions of the Council of Foreign Ministers of the \nOrganization of Islamic Cooperation that support the permanent neutrality of \n_______________ \n \n1 A/75/651-S/2020/1203, annex. \n \n2 Resolution 46/182, annex. \n \n3 See resolutions 63/210, 67/263, 69/213, 70/197, 72/212, 75/313, 78/148 and 78/149. \n \n4 See A/50/752-S/1995/1035, annex III. \n\nPermanent neutrality of Turkmenistan \nA/RES/79/274\n \n3/3\n25-04827 \n \nTurkmenistan and underscore the role of a policy of neutrality in maintaining and \nstrengthening international peace, security and sustainable development,  \n \n1. \nReiterates its strong support for the status of permanent neutrality declared \nby Turkmenistan; \n \n2. \nCalls once again upon States Members of the United Nations to respect \nand support this status of Turkmenistan and to respect its independence, sovereignty \nand territorial integrity;  \n \n3. \nEncourages the effective use of the territories of neutral countries for \nhosting peace talks and conflict resolution and settlement processes, including \nthrough the establishment of dedicated mediation facilities, and notes the proposal of \nTurkmenistan to set up on its territory the Peace Mediation Chamber under the \nauspices of the United Nations, which would require evaluation by Member States \nand the United Nations system; \n \n4. \nNotes the work of the Group of Friends of Neutrality for Peace, Security \nand Sustainable Development, an informal group established at the initiative of \nTurkmenistan in August 2020 and operating on the basis of the final declaration of \nthe first ministerial meeting of the Group5 to maintain a wide multilateral dialogue on \nthe practical implementation of the principles of neutrality in preventing conflicts, \neliminating the root causes and consequences of conflicts, resolving humanitarian \nchallenges and promoting neutrality in international relations; \n \n5. \nRequests the Secretary-General, in consultation with Member States and \nother relevant actors, to develop, within existing resources, guidance for upholding \nand implementing the principles of neutrality for peace and security, with a specific \nfocus on consolidating lessons learned and key principles for the effective application \nof neutrality in international relations; \n \n6. \nWelcomes the decision of the Government of Turkmenistan to host an \ninternational forum, in December 2025, devoted to the International Year of Peace \nand Trust, 2025, the International Day of Neutrality and the thirtieth anniversary of \nthe permanent neutrality of Turkmenistan; \n \n7. \nDecides to include in the provisional agenda of its eightieth session, under \nthe item entitled \u201cPeacebuilding and sustaining peace\u201d, a sub-item entitled \n\u201cNeutrality for peace and security\u201d. \n \n61st plenary meeting \n21 March 2025 \n \n_______________ \n \n5 A/77/778, annex. \n",
  "paragraphs": {
    "1": "Reiterates its strong support for the status of permanent neutrality declared by Turkmenistan;",
    "2": "Calls once again upon States Members of the United Nations to respect and support this status of Turkmenistan and to respect its independence, sovereignty and territorial integrity;",
    "3": "Encourages the effective use of the territories of neutral countries for hosting peace talks and conflict resolution and settlement processes, including through the establishment of dedicated mediation facilities, and notes the proposal of Turkmenistan to set up on its territory the Peace Mediation Chamber under the auspices of the United Nations, which would require evaluation by Member States and the United Nations system;",
    "4": "Notes the work of the Group of Friends of Neutrality for Peace, Security and Sustainable Development, an informal group established at the initiative of Turkmenistan in August 2020 and operating on the basis of the final declaration of the first ministerial meeting of the Group5 to maintain a wide multilateral dialogue on the practical implementation of the principles of neutrality in preventing conflicts, eliminating the root causes and consequences of conflicts, resolving humanitarian challenges and promoting neutrality in international relations;",
    "5": "Requests the Secretary-General, in consultation with Member States and other relevant actors, to develop, within existing resources, guidance for upholding and implementing the principles of neutrality for peace and security, with a specific focus on consolidating lessons learned and key principles for the effective application of neutrality in international relations;",
    "6": "Welcomes the decision of the Government of Turkmenistan to host an international forum, in December 2025, devoted to the International Year of Peace and Trust, 2025, the International Day of Neutrality and the thirtieth anniversary of the permanent neutrality of Turkmenistan;",
    "7": "Decides to include in the provisional agenda of its eightieth session, under the item entitled \u201cPeacebuilding and sustaining peace\u201d, a sub-item entitled \u201cNeutrality for peace and security\u201d."
  },
  "agenda_items": [
    "Item 61"
  ],
  "symbol_references": [
    "A/79/L.59"
  ]
}