{
  "symbol": "A/RES/72/181",
  "filename": "A_RES_72_181.pdf",
  "title": "72/181. National institutions for the promotion and protection of human rights",
  "text": "United Nations \nA/RES/72/181\n \n \nGeneral Assembly \nDistr.: General \n29 January 2018 \n \n17-23173 (E)    010218     \n*1723173* \n \n \nSeventy-second session \nAgenda item 72 (b) \n \n \n \n \n Resolution adopted by the General Assembly \non 19 December 2017 \n \n \n \n \n[on the report of the Third Committee (A/72/439/Add.2)] \n \n \n 72/181. National institutions for the promotion and protection \nof human rights \n \n \n \nThe General Assembly, \n \nRecalling its previous resolutions on national institutions for the promotion and \nprotection of human rights, the most recent of which was resolution 70/163 of \n17 December 2015, and those of the Commission on Human Rights and the Human \nRights Council concerning national institutions and their role in the promotion and \nprotection of human rights, the most recent of which was Council resolution 33/15 of \n29 September 2016,1 \n \nWelcoming the rapidly growing interest throughout the world in the creation and \nstrengthening of independent, pluralistic national institutions for the promotion and \nprotection of human rights, \n \nRecalling the principles relating to the status of national institutions for the \npromotion and protection of human rights (the Paris Principles), 2 welcoming the \nforthcoming twenty-fifth anniversary of the adoption of the Principles, and noting \nwith appreciation the establishment of the Global Alliance of National Human Rights \nInstitutions, \n \nRecalling also the Vienna Declaration and Programme of Action adopted by the \nWorld Conference on Human Rights on 25 June 1993,3 which reaffirmed the \nimportant and constructive role played by national human rights institutions, in \nparticular in their advisory capacity to the competent authorities and their role in \npreventing and remedying human rights violations, in disseminating information on \nhuman rights and in education in human rights, \n__________________ \n \n1  See Official Records of the General Assembly, Seventy-first Session, Supplement No. 53A and \ncorrigendum (A/71/53/Add.1 and A/71/53/Add.1/Corr.1), chap. II. \n \n2  Resolution 48/134, annex. \n \n3  A/CONF.157/24 (Part I), chap. III. \n\nA/RES/72/181 \nNational institutions for the promotion and protection of human rights\n \n17-23173 \n2/7 \n \n \nReaffirming the important role that such national institutions play and will \ncontinue to play in promoting and protecting human rights and fundamental freedoms, \nstrengthening participation, in particular of civil society organizations, and promoting \nthe rule of law and developing and enhancing public awareness of those rights and \nfreedoms, \n \nRecalling its previous resolutions on the role of the Ombudsman, mediator \ninstitutions and other national human rights institutions in the promotion and \nprotection of human rights, the most recent of which was resolution 71/200 of \n19 December 2016, \n \nRecognizing the important role of the United Nations, in particular the Office of \nthe United Nations High Commissioner for Human Rights, in assisting the \ndevelopment of independent and effective national human rights institutions, guided \nby the Paris Principles, and recognizing also in this regard the potential for \nstrengthened and complementary cooperation among the United Nations, the Global \nAlliance of National Human Rights Institutions and its regional coordinating \nnetworks and those national institutions in the promotion and protection of human \nrights,  \n \nWelcoming in this context the tripartite partnership between the United Nations \nDevelopment Programme, the Office of the High Commissioner and the Global \nAlliance of National Human Rights Institutions, and recognizing their contribution to \nthe development of independent and effective national human rights institutions, in \naccordance with the Paris Principles, \n \nReaffirming that all human rights are universal, indivisible, interrelated, \ninterdependent and mutually reinforcing and that all human rights must be treated in \na fair and equal manner, on the same footing and with the same emphasis, \n \nBearing in mind the significance of national and regional particularities and \nvarious historical, cultural and religious backgrounds, and that all States, regardless \nof their political, economic and cultural systems, have the duty to promote and protect \nall human rights and fundamental freedoms, \n \nRecalling the programme of action adopted by national institutions for the \npromotion and protection of human rights at their meeting held in Vienna in June \n1993 during the World Conference on Human Rights, in which it was recommended \nthat United Nations activities and programmes should be reinforced to meet the \nrequests for assistance from States wishing to establish or strengthen their national \ninstitutions for the promotion and protection of human rights, \n \nTaking note with appreciation of the reports of the Secretary-General on national \ninstitutions for the promotion and protection of human rights 4 and on the activities of \nthe Global Alliance of National Human Rights Institutions in accrediting national \ninstitutions in compliance with the principles relating to the status of institutions for \nthe promotion and protection of human rights (Paris Principles), 5  \n \nWelcoming the strengthening in all regions of regional cooperation among \nnational human rights institutions, and welcoming also the continuing work of the \nNetwork of African National Human Rights Institutions, the Network of National \nInstitutions for the Promotion and Protection of Human Rights in the Americas, the \nAsia-Pacific Forum of National Human Rights Institutions and the European Network \nof National Human Rights Institutions, \n__________________ \n \n4  A/HRC/33/33. \n \n5  A/HRC/33/34 and A/HRC/33/34/Add.1. \n\nNational institutions for the promotion and protection of human rights \nA/RES/72/181\n \n3/7 \n17-23173 \n \n \nWelcoming also the contribution of the Global Alliance of National Human \nRights Institutions to the strengthening of cooperation among existing national human \nrights institutions in all regions and the enhancement of the engagement of national \nhuman rights institutions compliant with the Paris Principles with relevant United \nNations mechanisms and processes, \n \nWelcoming further the progress made to date by Member States and all other \nstakeholders, including the Global Alliance of National Human Rights Institutions \nand its regional coordinating networks and relevant United Nations mechanisms and \nprocesses in the implementation of resolution 70/163, \n \nWelcoming the adoption by the Open-ended Working Group on Ageing of \ndecision 7/1 of 12 December 2016, entitled \u201cModalities of participation of national \nhuman rights institutions in the work of the Open-ended Working Group on Ageing\u201d,6 \nby which the Working Group decided to invite national human rights institutions fully \ncompliant with the Paris Principles to participate in its work in their own capacity, \n \nNoting with appreciation the opportunities afforded to national human rights \ninstitutions to contribute to the Conference of States Parties to the Convention on the \nRights of Persons with Disabilities and to the Commission on the Status of Women, \nand noting in this regard the efforts to further enhance the participation of national \nhuman rights institutions compliant with the Paris Principles at the sessions of the \nCommission, in compliance with the rules of procedure of the Economic and Social \nCouncil,  \n \nWelcoming in this regard the decision of the Commission on the Status of \nWomen to encourage the secretariat to continue its consideration of how to enhance \nthe participation, including at the sixty-second session of the Commission, of national \nhuman rights institutions that are fully compliant with the Paris Principles, where they \nexist, in compliance with the rules of procedure of the Economic and Social Council,7  \n \nWelcoming also the decision to invite national human rights institutions \ncompliant with the Paris Principles to participate in the intergovernmental conference \nto adopt a global compact for safe, orderly and regular migration and its preparatory \nprocess and to invite the institutions, as well as the Global Alliance of National \nHuman Rights Institutions and its regional coordinating networks, to organize global \nand regional consultations and to contribute views to the preparatory process,8  \n \nWelcoming further the continued contribution of national human rights \ninstitutions to the work of the United Nations human rights treaty bodies, as well as \nthe efforts of the human rights treaty bodies, within their respective mandates and in \naccordance with the treaties establishing these mechanisms, to promote the effective \nand enhanced participation by national human rights institutions compliant with the \nParis Principles at all relevant stages of their work, and noting with appreciation the \nongoing efforts of the United Nations human rights treaty bodies, including by the \ncontinued consideration of a common treaty body approach to the engagement of the \nUnited Nations human rights treaty bodies with national human rights institutions at \nall relevant stages of their work, \n \n1. \nTakes note with appreciation of the report of the Secretary-General;9 \n \n2. \nReaffirms the importance of the development of effective, independent and \npluralistic national institutions for the promotion and protection of human rights, in \n__________________ \n \n6  See A/AC.278/2016/2, para. 10. \n \n7  See Official Records of the Economic and Social Council, 2017, Supplement No. 7 (E/2017/27), \nchap. I, sect. A. \n \n8  See resolution 71/280. \n \n9  A/72/277. \n\nA/RES/72/181 \nNational institutions for the promotion and protection of human rights\n \n17-23173 \n4/7 \n \naccordance with the principles relating to the status of national institutions for the \npromotion and protection of human rights (the Paris Principles);2 \n \n3. \nRecognizes the role of independent national institutions for the promotion \nand protection of human rights in working together with Governments to ensure full \nrespect for human rights at the national level, including by contributing to follow-up \nactions, as appropriate, to the recommendations resulting from the international \nhuman rights mechanisms;  \n \n4. \nWelcomes the increasingly important role of national institutions for the \npromotion and protection of human rights in supporting cooperation between their \nGovernments and the United Nations in the promotion and protection of human rights;  \n \n5. \nUnderlines the value of national human rights institutions, established and \noperating in accordance with the Paris Principles, in the continued monitoring of \nexisting legislation and in consistently informing the State about the impact of such \nlegislation on the activities of human rights defenders, including by making relevant \nand concrete recommendations;  \n \n6. \nRecognizes the role that national human rights institutions can play in \npreventing and addressing cases of reprisals as part of supporting the cooperation \nbetween their Governments and the United Nations in the promotion of human rights, \nincluding by contributing to follow-up actions, as appropriate, to recommendations \nmade by international human rights mechanisms;  \n \n7. \nAlso recognizes that, in accordance with the Vienna Declaration and \nProgramme of Action,3 it is the right of each State to choose the framework for \nnational institutions that is best suited to its particular needs at the national level in \norder to promote human rights in accordance with international human rights \nstandards;  \n \n8. \nEncourages Member States to establish effective, independent and \npluralistic national institutions or, where they already exist, to strengthen them for \nthe promotion and protection of all human rights and fundamental freedoms for all, \nas outlined in the Vienna Declaration and Programme of Action;  \n \n9. \nWelcomes the growing number of States establishing or considering the \nestablishment of national institutions for the promotion and protection of human \nrights, and welcomes in particular the growing number of States that have accepted \nrecommendations to establish national institutions compliant with the Paris Principles \nmade through the universal periodic review and, where relevant, by treaty bodies and \nspecial procedures;  \n \n10. Encourages national institutions for the promotion and protection of \nhuman rights established by Member States to continue to play an active role in \npreventing and combating all violations of human rights as enumerated in the Vienna \nDeclaration and Programme of Action and relevant international human rights \ninstruments; \n \n11. \nStresses that national human rights institutions and their respective \nmembers and staff should not face any form of reprisal or intimidation, including \npolitical pressure, physical intimidation, harassment or unjustifiable budgetary \nlimitations, as a result of activities undertaken in accordance with their respective \nmandates, including when taking up individual cases or when reporting on serious or \nsystematic violations in their countries, and calls upon States to promptly and \nthoroughly investigate cases of alleged reprisal or intimidation against members or \nstaff of national human rights institutions or against individuals who cooperate or \nseek to cooperate with them;  \n\nNational institutions for the promotion and protection of human rights \nA/RES/72/181\n \n5/7 \n17-23173 \n \n \n12. Recognizes the role played by national institutions for the promotion and \nprotection of human rights in the Human Rights Council, including its universal \nperiodic review mechanism, in both preparation and follow-up, and the special \nprocedures, as well as in the human rights treaty bodies, in accordance with Council \nresolutions 5/1 and 5/2 of 18 June 200710 and Commission on Human Rights \nresolution 2005/74 of 20 April 2005;11  \n \n13. Welcomes the strengthening of opportunities for national human rights \ninstitutions compliant with the Paris Principles to contribute to the work of the Human \nRights Council, as stipulated in the Council review outcome document annexed to \nCouncil resolution 16/21 of 25 March 201112 adopted by the General Assembly in its \nresolution 65/281 of 17 June 2011, and encourages and welcomes the increasing use \nmade by national human rights institutions of these participatory opportunities;  \n \n14. Also welcomes the contribution of national human rights institutions \ncompliant with the Paris Principles to the work of the United Nations, including of \nthe Commission on the Status of Women, the Conference of States Parties to the \nConvention on the Rights of Persons with Disabilities, the Open-ended Working \nGroup on Ageing and the intergovernmental process of the General Assembly on \nstrengthening and enhancing the effective functioning of the human rights treaty body \nsystem;  \n \n15. Encourages national human rights institutions compliant with the Paris \nPrinciples to continue to participate in and to contribute to deliberations in all relevant \nUnited Nations mechanisms and processes in accordance with their respective \nmandates, including the discussions on the implementation of the 2030 Agenda for \nSustainable Development;13  \n \n16. Encourages all relevant United Nations mechanisms and processes, in \naccordance with their respective mandates, including the Commission on the Status \nof Women, the Conference of States Parties to the Convention on the Rights of \nPersons with Disabilities, the Open-ended Working Group on Ageing and the 2030 \nAgenda for Sustainable Development, including the high-level political forum on \nsustainable development, to further enhance the participation of national human rights \ninstitutions compliant with the Paris Principles and to allow for their contribution to \nthese United Nations mechanisms and processes, bearing in mind the relevant \nprovisions dealing with their participation contained in General Assembly resolution \n60/251 of 15 March 2006, Human Rights Council resolutions 5/1, 5/2 and 16/21 and \nCommission on Human Rights resolution 2005/74;  \n \n17. Encourages all other relevant United Nations forums and meetings, in \naccordance with their respective mandates, existing rules of procedure and modalities, \nto provide for the engagement of national human rights institutions compliant with \nthe Paris Principles and to allow for their contribution to these forums and meetings;  \n \n18. Invites the human rights treaty bodies, within their respective mandates \nand in accordance with the treaties establishing these mechanisms, to provide for \nways to ensure the effective and enhanced participation by national human rights \ninstitutions compliant with the Paris Principles at all relevant stages of their work;  \n__________________ \n \n10  See Official Records of the General Assembly, Sixty-second Session, Supplement No. 53 \n(A/62/53), chap. IV, sect. A. \n \n11  See Official Records of the Economic and Social Council, 2005, Supplement No. 3 and \ncorrigenda (E/2005/23, E/2005/23/Corr.1 and E/2005/23/Corr.2), chap. II, sect. A. \n \n12  See Official Records of the General Assembly, Sixty-sixth Session, Supplement No. 53 (A/66/53), \nchap. II, sect. A. \n \n13  Resolution 70/1. \n\nA/RES/72/181 \nNational institutions for the promotion and protection of human rights\n \n17-23173 \n6/7 \n \n \n19. Requests the Secretary-General to continue to provide support to national \nhuman rights institutions compliant with the Paris Principles as they engage with \nrelevant United Nations mechanisms and processes, with full respect for their \nrespective mandates, and with a view to enabling their most effective contributions, \nin order to further the implementation of international human rights obligations and \ncommitments;  \n \n20. Encourages all United Nations human rights mechanisms and relevant \nUnited Nations agencies, funds and programmes to work, within their respective \nmandates, with Member States and national institutions in the promotion and \nprotection of human rights with respect to, inter alia, projects in the area of good \ngovernance and the rule of law, welcomes in this regard the efforts made by the United \nNations High Commissioner for Human Rights to develop partnerships in support of \nnational institutions, including the tripartite partnership between the United Nations \nDevelopment Programme, the Office of the United Nations High Commissioner for \nHuman Rights and the Global Alliance of National Human Rights Institutions, and in \nthis respect encourages all United Nations human rights mechanisms and relevant \nUnited Nations agencies, funds and programmes to enhance their interaction with \nnational human rights institutions, including by facilitating their access to relevant \ninformation and documentation;  \n \n21. Stresses the importance of the financial and administrative independence \nand stability of national human rights institutions for the promotion and protection of \nhuman rights, and notes with satisfaction the efforts of those States that have provided \ntheir national institutions with more autonomy and independence, including by giving \nthem an investigative role or enhancing such a role, and encourages other \nGovernments to consider taking similar steps;  \n \n22. Urges the Secretary-General to continue to give high priority to requests \nfrom Member States for assistance in the establishment and strengthening of national \nhuman rights institutions;  \n \n23. Underlines the importance of the autonomy and independence of \nombudsman institutions, encourages increased cooperation between national human \nrights institutions and regional and international associations of ombudsmen, and also \nencourages ombudsman institutions to actively draw on the standards enumerated in \ninternational instruments and the Paris Principles to strengthen their independence \nand increase their capacity to act as national human rights protection mechanisms;  \n \n24. Commends the high priority given by the Office of the High Commissioner \nto work on national human rights institutions, encourages the High Commissioner, in \nview of the expanded activities relating to national institutions, to ensure that \nappropriate arrangements are made and budgetary resources provided to continue and \nfurther extend activities in support of national institutions, and invites Governments \nto contribute additional voluntary funds to that end;  \n \n25. Welcomes the important role played by the Global Alliance of National \nHuman Rights Institutions, in close cooperation with the Office of the High \nCommissioner, in assisting Governments, when requested, in the establishment and \nstrengthening of national human rights institutions in accordance with the Paris \nPrinciples, in assessing the conformity of national human rights institutions with the \nParis Principles and in providing technical assistance to strengthen national human \nrights institutions, upon request, with a view to enhancing their compliance with the \nParis Principles, and calls upon Member States and other stakeholders, including \nUnited Nations agencies, to follow up on the recommendations of the Subcommittee \non Accreditation of the Global Alliance of National Human Rights Institutions, with \na view to enabling national human rights institutions to fully comply with the Paris \nPrinciples in both law and practice;  \n\nNational institutions for the promotion and protection of human rights \nA/RES/72/181\n \n7/7 \n17-23173 \n \n \n26. Encourages national institutions, including ombudsman and mediator \ninstitutions, to seek accreditation status through the Global Alliance of National \nHuman Rights Institutions; \n \n27. Encourages all Member States to take appropriate steps to promote the \nexchange of information and experience concerning the establishment and effective \noperation of national human rights institutions and to support the work of the Global \nAlliance of National Human Rights Institutions and its regional coordinating \nnetworks in this regard, including through support for the relevant technical \nassistance programmes of the Office of the High Commissioner; \n \n28. Calls upon the Secretary-General to continue to encourage national human \nrights institutions to interact with and advocate independent participation in all \nrelevant United Nations mechanisms and processes, in accordance with their \nrespective mandates, existing rules of procedure and modalities;  \n \n29. Requests the Secretary-General to continue to provide the assistance \nnecessary for holding international and regional meetings of national institutions, \nincluding meetings of the Global Alliance of National Human Rights Institutions, in \ncooperation with the Office of the High Commissioner; \n \n30. Also requests the Secretary-General to report to the General Assembly at \nits seventy-fourth session on the implementation of the present resolution. \n \n73rd plenary meeting  \n19 December 2017 \n \n",
  "paragraphs": {
    "1": "Takes note with appreciation of the report of the Secretary-General;9",
    "2": "Reaffirms the importance of the development of effective, independent and pluralistic national institutions for the promotion and protection of human rights, in accordance with the principles relating to the status of national institutions for the promotion and protection of human rights (the Paris Principles);2",
    "3": "Recognizes the role of independent national institutions for the promotion and protection of human rights in working together with Governments to ensure full respect for human rights at the national level, including by contributing to follow-up actions, as appropriate, to the recommendations resulting from the international human rights mechanisms;",
    "4": "Welcomes the increasingly important role of national institutions for the promotion and protection of human rights in supporting cooperation between their Governments and the United Nations in the promotion and protection of human rights;",
    "5": "Underlines the value of national human rights institutions, established and operating in accordance with the Paris Principles, in the continued monitoring of existing legislation and in consistently informing the State about the impact of such legislation on the activities of human rights defenders, including by making relevant and concrete recommendations;",
    "6": "Recognizes the role that national human rights institutions can play in preventing and addressing cases of reprisals as part of supporting the cooperation between their Governments and the United Nations in the promotion of human rights, including by contributing to follow-up actions, as appropriate, to recommendations made by international human rights mechanisms;",
    "7": "Also recognizes that, in accordance with the Vienna Declaration and Programme of Action,3 it is the right of each State to choose the framework for national institutions that is best suited to its particular needs at the national level in order to promote human rights in accordance with international human rights standards;",
    "8": "Encourages Member States to establish effective, independent and pluralistic national institutions or, where they already exist, to strengthen them for the promotion and protection of all human rights and fundamental freedoms for all, as outlined in the Vienna Declaration and Programme of Action;",
    "9": "Welcomes the growing number of States establishing or considering the establishment of national institutions for the promotion and protection of human rights, and welcomes in particular the growing number of States that have accepted recommendations to establish national institutions compliant with the Paris Principles made through the universal periodic review and, where relevant, by treaty bodies and special procedures;",
    "10": "Encourages national institutions for the promotion and protection of human rights established by Member States to continue to play an active role in preventing and combating all violations of human rights as enumerated in the Vienna Declaration and Programme of Action and relevant international human rights instruments;",
    "11": "",
    "12": "Recognizes the role played by national institutions for the promotion and protection of human rights in the Human Rights Council, including its universal periodic review mechanism, in both preparation and follow-up, and the special procedures, as well as in the human rights treaty bodies, in accordance with Council resolutions 5/1 and 5/2 of 18 June 200710 and Commission on Human Rights resolution 2005/74 of 20 April 2005;11",
    "13": "Welcomes the strengthening of opportunities for national human rights institutions compliant with the Paris Principles to contribute to the work of the Human Rights Council, as stipulated in the Council review outcome document annexed to Council resolution 16/21 of 25 March 201112 adopted by the General Assembly in its resolution 65/281 of 17 June 2011, and encourages and welcomes the increasing use made by national human rights institutions of these participatory opportunities;",
    "14": "Also welcomes the contribution of national human rights institutions compliant with the Paris Principles to the work of the United Nations, including of the Commission on the Status of Women, the Conference of States Parties to the Convention on the Rights of Persons with Disabilities, the Open-ended Working Group on Ageing and the intergovernmental process of the General Assembly on strengthening and enhancing the effective functioning of the human rights treaty body system;",
    "15": "Encourages national human rights institutions compliant with the Paris Principles to continue to participate in and to contribute to deliberations in all relevant United Nations mechanisms and processes in accordance with their respective mandates, including the discussions on the implementation of the 2030 Agenda for Sustainable Development;13",
    "16": "Encourages all relevant United Nations mechanisms and processes, in accordance with their respective mandates, including the Commission on the Status of Women, the Conference of States Parties to the Convention on the Rights of Persons with Disabilities, the Open-ended Working Group on Ageing and the 2030 Agenda for Sustainable Development, including the high-level political forum on sustainable development, to further enhance the participation of national human rights institutions compliant with the Paris Principles and to allow for their contribution to these United Nations mechanisms and processes, bearing in mind the relevant provisions dealing with their participation contained in General Assembly resolution 60/251 of 15 March 2006, Human Rights Council resolutions 5/1, 5/2 and 16/21 and Commission on Human Rights resolution 2005/74;",
    "17": "Encourages all other relevant United Nations forums and meetings, in accordance with their respective mandates, existing rules of procedure and modalities, to provide for the engagement of national human rights institutions compliant with the Paris Principles and to allow for their contribution to these forums and meetings;",
    "18": "Invites the human rights treaty bodies, within their respective mandates and in accordance with the treaties establishing these mechanisms, to provide for ways to ensure the effective and enhanced participation by national human rights institutions compliant with the Paris Principles at all relevant stages of their work;",
    "19": "Requests the Secretary-General to continue to provide support to national human rights institutions compliant with the Paris Principles as they engage with relevant United Nations mechanisms and processes, with full respect for their respective mandates, and with a view to enabling their most effective contributions, in order to further the implementation of international human rights obligations and commitments;",
    "20": "Encourages all United Nations human rights mechanisms and relevant United Nations agencies, funds and programmes to work, within their respective mandates, with Member States and national institutions in the promotion and protection of human rights with respect to, inter alia, projects in the area of good governance and the rule of law, welcomes in this regard the efforts made by the United Nations High Commissioner for Human Rights to develop partnerships in support of national institutions, including the tripartite partnership between the United Nations Development Programme, the Office of the United Nations High Commissioner for Human Rights and the Global Alliance of National Human Rights Institutions, and in this respect encourages all United Nations human rights mechanisms and relevant United Nations agencies, funds and programmes to enhance their interaction with national human rights institutions, including by facilitating their access to relevant information and documentation;",
    "21": "Stresses the importance of the financial and administrative independence and stability of national human rights institutions for the promotion and protection of human rights, and notes with satisfaction the efforts of those States that have provided their national institutions with more autonomy and independence, including by giving them an investigative role or enhancing such a role, and encourages other Governments to consider taking similar steps;",
    "22": "Urges the Secretary-General to continue to give high priority to requests from Member States for assistance in the establishment and strengthening of national human rights institutions;",
    "23": "Underlines the importance of the autonomy and independence of ombudsman institutions, encourages increased cooperation between national human rights institutions and regional and international associations of ombudsmen, and also encourages ombudsman institutions to actively draw on the standards enumerated in international instruments and the Paris Principles to strengthen their independence and increase their capacity to act as national human rights protection mechanisms;",
    "24": "Commends the high priority given by the Office of the High Commissioner to work on national human rights institutions, encourages the High Commissioner, in view of the expanded activities relating to national institutions, to ensure that appropriate arrangements are made and budgetary resources provided to continue and further extend activities in support of national institutions, and invites Governments to contribute additional voluntary funds to that end;",
    "25": "",
    "26": "Encourages national institutions, including ombudsman and mediator institutions, to seek accreditation status through the Global Alliance of National Human Rights Institutions;",
    "27": "Encourages all Member States to take appropriate steps to promote the exchange of information and experience concerning the establishment and effective operation of national human rights institutions and to support the work of the Global Alliance of National Human Rights Institutions and its regional coordinating networks in this regard, including through support for the relevant technical assistance programmes of the Office of the High Commissioner;",
    "28": "Calls upon the Secretary-General to continue to encourage national human rights institutions to interact with and advocate independent participation in all relevant United Nations mechanisms and processes, in accordance with their respective mandates, existing rules of procedure and modalities;",
    "29": "Requests the Secretary-General to continue to provide the assistance necessary for holding international and regional meetings of national institutions, including meetings of the Global Alliance of National Human Rights Institutions, in cooperation with the Office of the High Commissioner;",
    "30": "Also requests the Secretary-General to report to the General Assembly at its seventy-fourth session on the implementation of the present resolution."
  },
  "agenda_items": [
    "Item 72"
  ],
  "symbol_references": []
}