{
  "symbol": "A/RES/74/176",
  "filename": "A_RES_74_176.pdf",
  "title": "74/176. Improving the coordination of efforts against trafficking in persons",
  "text": "United Nations \nA/RES/74/176\n \n \nGeneral Assembly \nDistr.: General \n23 January 2020 \n \n19-22333 (E)    270120 \n*1922333* \n \n \nSeventy-fourth session \nAgenda item 106 \nCrime prevention and criminal justice \n \n \n \n \n Resolution adopted by the General Assembly \non 18 December 2019 \n \n \n \n \n[on the report of the Third Committee (A/74/400)] \n \n \n 74/176. Improving the coordination of efforts against trafficking in persons \n \n \n \nThe General Assembly, \n \nReiterating its strong condemnation of trafficking in persons, especially women \nand children, which constitutes an offence and a serious threat to human dignity and \nphysical integrity, human rights and sustainable development,  \n \nReiterating its concern that, despite sustained measures taken at the \ninternational, regional and national levels, trafficking in persons remains one of the \ngrave challenges facing the international community, which also impairs the \nenjoyment of human rights and needs a more concerted collective and comprehensive \ninternational response,  \n \nBearing in mind that all States have an obligation to exercise due diligence to \nprevent, investigate and punish perpetrators of trafficking in persons and to protect \nand assist victims, and that not doing so violates and impairs or nullifies the \nenjoyment of the human rights and fundamental freedoms of the victims,  \n \nRecalling the adoption by the General Assembly of the 2030 Agenda for \nSustainable Development, 1  and recalling also the targets of the Sustainable \nDevelopment Goals on eliminating all forms of violence against all women and girls \nin the public and private spheres, including trafficking and sexual and other types of \nexploitation,2 on taking immediate and effective measures to eradicate forced labour, \nend modern slavery and human trafficking and secure the prohibition and elimination \nof the worst forms of child labour, including recruitment and use of child soldiers, \n__________________ \n \n1  Resolution 70/1. \n \n2  Target 5.2. \n\nA/RES/74/176 \nImproving the coordination of efforts\nagainst trafficking in persons\n \n19-22333\n2/10 \n \nand by 2025 end child labour in all its forms,3 and on ending abuse and exploitation \nof, trafficking in and all forms of violence against and torture of children,4  \n \nRecalling also the United Nations Convention against Transnational Organized \nCrime, 5  as well as its supplementing Protocol to Prevent, Suppress and Punish \nTrafficking in Persons, Especially Women and Children, 6  which provided the \ndefinition of the crime of trafficking in persons, the Optional Protocol to the \nConvention on the Rights of the Child on the sale of children, child prostitution and \nchild pornography7 and the Supplementary Convention on the Abolition of Slavery, \nthe Slave Trade, and Institutions and Practices Similar to Slavery, 8  \n \nTaking note of the adoption of the Protocol of 2014 to the Forced Labour \nConvention, 1930 (No. 29), of the International Labour Organization, which \nrecognizes that trafficking in persons for the purposes of forced or compulsory labour \nis the subject of growing international concern,  \n \nRecalling the adoption of the United Nations Global Plan of Action to Combat \nTrafficking in Persons by the General Assembly in its resolution 64/293 of 30 July \n2010, and underlining the importance of its full implementation,  \n \nReaffirming that the Global Plan of Action was developed:  \n \n(a) \nTo promote universal ratification of the United Nations Convention \nagainst Transnational Organized Crime and the Protocol to Prevent, Suppress and \nPunish Trafficking in Persons, Especially Women and Children, as well as other \nrelevant international instruments that address trafficking in persons, and to reinforce \nthe implementation of existing instruments against trafficking in persons,  \n \n(b) \nTo help Member States to reinforce their political commitments and legal \nobligations to prevent and combat trafficking in persons,  \n \n(c) \nTo promote comprehensive, coordinated and consistent responses at the \nnational, regional and international levels to counter trafficking in persons,  \n \n(d) \nTo promote a human rights-based, gender- and age-sensitive approach in \naddressing all factors that make people vulnerable to trafficking in persons and \nstrengthening the criminal justice response, which are necessary to prevent trafficking \nin persons, protect its victims and prosecute its perpetrators,  \n \n(e) \nTo raise awareness within the United Nations system and also among \nStates and other stakeholders, such as the private sector, civil society and the \ninternational and national mass media, and the public at large,  \n \n(f) \nTo foster cooperation and coordination among all relevant stakeholders, \nincluding Member States, international organizations, civil society organizations and \nthe private sector, and within various entities of the United Nations system, taking \ninto account existing best practices and lessons learned,  \n \nRecalling its resolutions 61/180 of 20 December 2006, 64/178 of 18 December \n2009, 67/190 of 20 December 2012, 68/192 of 18 December 2013, 70/179 of \n17 December 2015 and 72/195 of 19 December 2017 on improving the coordination \n__________________ \n \n3  Target 8.7. \n \n4  Target 16.2. \n \n5  United Nations, Treaty Series, vol. 2225, No. 39574. \n \n6  Ibid., vol. 2237, No. 39574. \n \n7  Ibid., vol. 2171, No. 27531. \n \n8  Ibid., vol. 266, No. 3822. \n\nImproving the coordination of efforts \nagainst trafficking in persons \nA/RES/74/176\n \n3/10\n19-22333 \n \nof efforts against trafficking in persons and its other relevant resolutions on \ntrafficking in persons,9  \n \nRecalling also its resolutions 71/322 of 8 September 2017 and 73/189 of \n17 December 2018, entitled \u201cStrengthening and promoting effective measures and \ninternational cooperation on organ donation and transplantation to prevent and \ncombat trafficking in persons for the purpose of organ removal and trafficking in \nhuman organs\u201d, \n \nRecalling further Economic and Social Council resolution 2017/18 of 6 July \n2017 on the implementation of the Global Plan of Action and previous Council \nresolutions on trafficking in persons,  \n \nRecalling Human Rights Council resolution 32/3 of 30 June 2016, entitled \n\u201cTrafficking in persons, especially women and children: protecting victims of \ntrafficking and persons at risk of trafficking, especially women and children in \nconflict and post-conflict situations\u201d,10 and other relevant resolutions of the Council \non trafficking in persons,  \n \nRecalling also Commission on Crime Prevention and Criminal Justice \nresolution 27/2 of 18 May 2018, entitled \u201cPreventing and combating trafficking in \npersons facilitated by the criminal misuse of information and communications \ntechnologies\u201d,11 and the other relevant resolutions of the Commission on trafficking \nin persons, \n \nWelcoming the adoption of the political declaration on the implementation of \nthe United Nations Global Plan of Action to Combat Trafficking in Persons at the \nhigh-level meeting of the General Assembly held at United Nations Headquarters in \nNew York on 27 and 28 September 2017,12 and looking forward to the next high-level \nmeeting of the Assembly to review the implementation of the Global Plan of Action, \nto be held in 2021, as envisaged in the political declaration, \n \nTaking note of the reference to preventing and countering trafficking in persons \nand the victim-oriented approach in the context of addressing trafficking in persons \nin the Doha Declaration on Integrating Crime Prevention and Criminal Justice into \nthe Wider United Nations Agenda to Address Social and Economic Challenges and to \nPromote the Rule of Law at the National and International Levels, and Public \nParticipation, adopted by the Thirteenth United Nations Congress on Crime \nPrevention and Criminal Justice, held in Doha from 12 to 19 April 2015, 13 \n \nRecalling the New York Declaration for Refugees and Migrants, adopted at the \nhigh-level plenary meeting of the General Assembly on addressing large movements \nof refugees and migrants, held at United Nations Headquarters in New York on \n19 September 2016,14 in which States declared that they would, with full respect for \ntheir obligations under international law, vigorously combat human trafficking and \nmigrant smuggling with a view to their elimination, including through targeted \nmeasures to identify victims of human trafficking or those at risk of trafficking, \nprovide support for the victims of human trafficking and work to prevent human \ntrafficking among those affected by displacement,  \n__________________ \n \n9  Resolutions 55/67, 58/137, 59/166, 61/144, 63/156 and 63/194. \n \n10  See Official Records of the General Assembly, Seventy-first Session, Supplement No. 53 \n(A/71/53), chap. V, sect. A. \n \n11  See Official Records of the Economic and Social Council, 2018, Supplement No. 10 (E/2018/30), \nchap. I, sect. C. \n \n12  Resolution 72/1. \n \n13  Resolution 70/174, annex. \n \n14  Resolution 71/1. \n\nA/RES/74/176 \nImproving the coordination of efforts\nagainst trafficking in persons\n \n19-22333\n4/10 \n \n \nRecognizing the important role of the Inter-Agency Coordination Group against \nTrafficking in Persons in fostering coordination and cooperation in the global fight \nagainst trafficking in persons, within the existing mandates of its members and \npartners,15  \n \nRecognizing also that the Inter-Agency Coordination Group, within its mandate, \ncontributes to the implementation of the Global Plan of Action, taking note with \nappreciation of the activities of the United Nations Office on Drugs and Crime as \ncoordinator of the Coordination Group, as well as the activities of the members of the \nCoordination Group acting on a rotational basis as Chair of the working group of the \nCoordination Group, and encouraging the more robust participation of all members \nof the Coordination Group,  \n \nTaking note with appreciation of the work of the 2019 Co-Chairs of the \nInter-Agency Coordination Group, the United Nations Entity for Gender Equality and \nthe Empowerment of Women (UN-Women) and the Organization for Security and \nCooperation in Europe, including the convening of the first consultative briefing \noutside of the United Nations system, at the Alliance against Trafficking in Persons, \n \nTaking note with appreciation also of the thematic focus of the Inter-Agency \nCoordination Group in 2018 on trafficking in children and in 2019 on trafficking in \npersons and technology, and on measures to prevent trafficking in persons in public \nprocurement, as well as in the procurement of goods and services by the United \nNations, \n \nRecalling that the Inter-Agency Coordination Group was established to foster \ncooperation among relevant United Nations agencies and other international \norganizations involved in combating human trafficking in countries around the world \nusing, to the extent possible, mechanisms already in place at the regional and national \nlevels, and to share information, experiences and good practices relating to the \nactivities of the partner agencies to counter trafficking with Governments, \ninternational and regional organizations and other relevant bodies,  \n \nEmphasizing the central role of the work of the United Nations Office on Drugs \nand Crime in the global fight against trafficking in persons, particularly in providing \ntechnical assistance to Member States, upon their request, to implement the United \nNations Convention against Transnational Organized Crime and the Protocol to \nPrevent, Suppress and Punish Trafficking in Persons, Especially Women and \nChildren, by making use of existing capacity-building tools, lessons learned from \nMember States and expertise available in other international organizations,  \n \nRecognizing the need to continue to foster a global partnership against \ntrafficking in persons among all stakeholders and the need to continue to work \n__________________ \n \n15  The United Nations Office on Drugs and Crime, the International Civil Aviation Organization, \nthe International Criminal Police Organization (INTERPOL), the International Labour \nOrganization, the International Organization for Migration, the Joint United Nations Programme \non HIV/AIDS, the Office of the United Nations High Commissioner for Human Rights, the \nOffice of the United Nations High Commissioner for Refugees, the United Nations Children\u2019s \nFund, the United Nations Development Programme, the United Nations Educational, Scientific \nand Cultural Organization, the United Nations Entity for Gender Equality and the Empowerment \nof Women (UN-Women), the United Nations Interregional Crime and Justice Research Institute, \nthe United Nations Population Fund, the World Bank, the Department of Peace Operations of the \nSecretariat, the Department of Political and Peacebuilding Affairs of the Secretariat, the Counter-\nTerrorism Committee Executive Directorate, the International Centre for Migration Policy \nDevelopment, the Office of the Special Representative of the Secretary-General on Sexual \nViolence in Conflict, the Office on Genocide Prevention and the Responsibility to Protect and the \nOrganization for Security and Cooperation in Europe, as well as the Special Rapporteur of the \nHuman Rights Council on trafficking in persons, especially women and children, and the Council \nof Europe as partners of the Inter-Agency Coordination Group. \n\nImproving the coordination of efforts \nagainst trafficking in persons \nA/RES/74/176\n \n5/10\n19-22333 \n \ntowards an enhanced comprehensive and coordinated approach to prevent and combat \ntrafficking and to protect and assist victims of trafficking in persons through the \nappropriate national, regional and international mechanisms,  \n \nRecognizing also the importance of bilateral, subregional, regional and \ninternational cooperation mechanisms and initiatives, including information \nexchanges on good practices, of Governments and of intergovernmental and \nnon-governmental organizations to address the problem of trafficking in persons, \nespecially women and children,  \n \nTaking note with appreciation of the different initiatives of Member States, \npromoted in the United Nations to contribute to the global fight against trafficking in \npersons,16  \n \nRecalling that trafficking in persons is fuelled by high profits for traffickers and \ndemand that fosters all forms of exploitation, with trafficking in persons \ndisproportionately affecting women and girls, who are particularly vulnerable to \ntrafficking for the purpose of sexual exploitation, \n \nStressing the need to take appropriate measures to ensure access to justice and \nprotections for victims in criminal justice processes, including measures to ensure \nthat identified victims of trafficking in persons are not penalized for having been \ntrafficked and that they do not suffer from victimization as a result of actions taken \nby government authorities, communities and families,  \n \nRecognizing that broad international cooperation between Member States and \nrelevant intergovernmental and non-governmental organizations is essential for \neffectively countering the threat of trafficking in persons and other contemporary \nforms of slavery,  \n \nRecognizing also that victims of trafficking are often subject to multiple forms \nof discrimination and violence, including on the grounds of gender, age, disability, \nethnicity, culture and religion, as well as national or social origin, and that these forms \nof discrimination may themselves fuel trafficking in persons, and that women and \nchildren without nationality or without birth registration are particularly vulnerable \nto trafficking in persons,  \n \nRecognizing further the potential of the Internet and other information and \ncommunications technologies to prevent and combat trafficking in persons and to \nassist victims, stressing the need for increased law enforcement cooperation in this \nregard to address the new challenges generated by the rapid development of the \nInternet and other information and communications technologies, expressing concern \nthat human traffickers have misused the Internet and other information and \ncommunications technologies to facilitate trafficking in persons, including for the \npurpose of recruiting and exploiting women and children and controlling victims, and \nin this regard taking note of the issue brief \u201cHuman trafficking and technology: trends, \nchallenges and opportunities\u201d, produced by the Inter-Agency Coordination Group, \n \nStressing the need to promote and protect the rights of victims of trafficking in \npersons and to reintegrate victims into the community, including by taking into \naccount, where appropriate, the Recommended Principles and Guidelines on Human \nRights and Human Trafficking17 and the commentary thereon developed by the Office \n__________________ \n \n16  Such as, inter alia, Alliance 8.7; Finance Against Slavery and Trafficking; the call to action to \nend forced labour, modern slavery and human trafficking; the principles to guide government \naction to combat human trafficking in global supply chains; and the Bali Process on People \nSmuggling, Trafficking in Persons and Related Transnational Crime. \n \n17  E/2002/68/Add.1. \n\nA/RES/74/176 \nImproving the coordination of efforts\nagainst trafficking in persons\n \n19-22333\n6/10 \n \nof the United Nations High Commissioner for Human Rights, as well as the \nGuidelines on the Protection of Child Victims of Trafficking developed by the United \nNations Children\u2019s Fund,  \n \nWelcoming the efforts of Member States, United Nations agencies, international \norganizations, civil society organizations, the private sector and financial institutions \nto address the problem of trafficking in persons, including women and children as the \nmost vulnerable group, and emphasizing the urgent need for them to further enhance \ntheir efforts and cooperation to build the evidence base, including by sharing their \nknowledge and best practices as widely as possible,  \n \nAffirming that capacity-building is a very important component in combating \ntrafficking in persons, and in this regard stressing the need to intensify international \ncooperation to combat trafficking in persons, as well as technical assistance for \ncountries aimed at strengthening their ability to prevent all forms of trafficking, \nincluding supporting their development programmes,  \n \nTaking note of the Khartoum process and its Declaration adopted in Khartoum \non 16 October 2014 during the Regional Ministerial Conference on Human \nTrafficking and Smuggling in the Horn of Africa, coordinated by the African Union, \nthe Office of the United Nations High Commissioner for Refugees and the \nInternational Organization for Migration, which aimed to strengthen national, \nregional and international cooperation and build capacities in the African countries to \ncombat trafficking in persons and migrant smuggling,  \n \nTaking note also of the Second Work Plan to Combat Trafficking in Persons in \nthe Western Hemisphere 2015\u20132018, adopted by States members of the Organization \nof American States at the fourth Meeting of National Authorities on Trafficking in \nPersons, held on 4 and 5 December 2014 in Brasilia, and extended until 2020 by States \nmembers at the fifth Meeting of National Authorities on Trafficking in Persons, held \non 12 and 13 March 2018 in Washington, D.C., \n \nRecognizing that the Global Plan of Action and the establishment of the United \nNations voluntary trust fund for victims of trafficking in persons, especially women \nand children, established in compliance with the Global Plan of Action, aim at raising \nawareness of the situation of victims of human trafficking and at providing them with \nhumanitarian, legal and financial aid through established channels of assistance, such \nas governmental, intergovernmental and non-governmental organizations,  \n \nReaffirming the importance of humanitarian, legal and financial aid to victims \nof trafficking in persons, including through governmental, intergovernmental and \nnon-governmental organizations, including the United Nations voluntary trust fund \nfor victims of trafficking in persons, especially women and children, managed by the \nUnited Nations Office on Drugs and Crime, the United Nations voluntary trust fund \non contemporary forms of slavery, managed by the Office of the United Nations High \nCommissioner for Human Rights, and the International Organization for Migration \nGlobal Assistance Fund, \n \nTaking note of the report of the Secretary-General,18  \n \nTaking note also of the report of the Special Rapporteur of the Human Rights \nCouncil on trafficking in persons, especially women and children,19 as well as the \nreports of the Special Rapporteur of the Council on contemporary forms of slavery, \nincluding its causes and consequences,20 and of the Special Rapporteur of the Council \n__________________ \n \n18  A/74/127. \n \n19  A/74/189. \n \n20  A/74/179. \n\nImproving the coordination of efforts \nagainst trafficking in persons \nA/RES/74/176\n \n7/10\n19-22333 \n \non the sale and sexual exploitation of children, including child prostitution, child \npornography and other child sexual abuse material, 21  \n \nRecognizing that, in accordance with the United Nations Convention against \nTransnational Organized Crime, the Conference of the Parties to the Convention is \nestablished to improve the capacity of States parties to combat transnational \norganized crime and to promote and review the implementation of the Convention, \nincluding the Protocol to Prevent, Suppress and Punish Trafficking in Persons, \nEspecially Women and Children, and in this regard taking note of resolution 9/1 of \n19 October 2018, entitled \u201cEstablishment of the Mechanism for the Review of the \nImplementation of the United Nations Convention against Transnational Organized \nCrime and the Protocols thereto\u201d, adopted by the Conference of the Parties at its ninth \nsession, held in Vienna from 15 to 19 October 2018, 22  \n \n1. \nUrges Member States that have not yet done so to consider ratifying or \nacceding to, as a matter of priority, the United Nations Convention against \nTransnational Organized Crime5 and the Protocol to Prevent, Suppress and Punish \nTrafficking in Persons, Especially Women and Children, supplementing the United \nNations Convention against Transnational Organized Crime, 6 taking into \nconsideration the central role of those instruments in the fight against trafficking in \npersons, and also urges States parties to those instruments to implement them fully \nand effectively;  \n \n2. \nUrges Member States and other stakeholders mentioned in the United \nNations Global Plan of Action to Combat Trafficking in Persons, 23 and invites the \nConference of the Parties to the United Nations Convention against Transnational \nOrganized Crime and relevant international, regional and subregional organizations, \nwithin their respective mandates, to continue to contribute to the full and effective \nimplementation of the Global Plan of Action, including by means of strengthening \ncooperation and improving coordination among themselves in achieving that goal;  \n \n3. \nRecalls the holding of the high-level meetings of the General Assembly \nduring its sixty-seventh session, from 13 to 15 May 2013, and during its seventy-\nsecond session, on 27 and 28 September 2017, to appraise the progress achieved in \nthe implementation of the Global Plan of Action, which, inter alia, reiterated strong \npolitical will to step up efforts against trafficking in persons;  \n \n4. \nAlso recalls its decision, in its resolution 68/192, to appraise, from within \nexisting resources, on a four-year basis starting at its seventy-second session, the \nprogress achieved in the implementation of the Global Plan of Action in order to \nassess achievements, gaps and challenges, including in the implementation of the \nrelevant legal instruments, and therefore decides to convene a high-level meeting of \nthe General Assembly on the progress achieved in the implementation of the Global \nPlan of Action at its seventy-sixth session, after the general debate, but no later than \nDecember 2021; \n \n5. \nRequests the Secretary-General and the President of the General Assembly, \nin close cooperation and coordination with Member States, to take all appropriate \nmeasures to arrange the high-level meeting; \n \n6. \nRecalls its decision to designate 30 July as the World Day against \nTrafficking in Persons, to be observed annually, and, while welcoming events held by \nMember States, United Nations agencies, other international organizations and civil \nsociety at the international, regional and national levels to mark the World Day, \n__________________ \n \n21  A/74/162. \n \n22  See CTOC/COP/2018/13, sect. I.A. \n \n23  Resolution 64/293. \n\nA/RES/74/176 \nImproving the coordination of efforts\nagainst trafficking in persons\n \n19-22333\n8/10 \n \ninvites all stakeholders to continue to observe the World Day in order to raise \nawareness of trafficking in persons and the situation of the victims of this crime and \nfor the promotion and protection of their rights;  \n \n7. \nExpresses solidarity with and compassion for victims and survivors of \ntrafficking in persons, and calls for the full respect of their human rights and the \nprovision of appropriate victim-centred care and assistance, where applicable, \nincluding interpretation and sign language, where appropriate, to victims of \ntrafficking, and services for their rehabilitation in cooperation with civil society and \nother relevant partners;  \n \n8. \nExpresses support for the activities of the United Nations Office on Drugs \nand Crime, reaffirms its request to the Secretary-General to provide adequate support \nto the Commission on Crime Prevention and Criminal Justice, and invites Member \nStates to make voluntary contributions to the Office for the purpose of providing \nassistance to Member States upon request;  \n \n9. \nEncourages the United Nations Office on Drugs and Crime to cooperate \nwith relevant international organizations outside the United Nations system and to \ninvite such organizations and interested Member States to participate, when \nappropriate, in the meetings of the Inter-Agency Coordination Group against \nTrafficking in Persons and to keep Member States informed of the schedule of and \nthe progress made by the Coordination Group;  \n \n10. Takes note of the consultative briefings for Member States hosted by the \nInter-Agency Coordination Group at United Nations Headquarters in June and \nOctober 2018 on the work and priorities of the Coordination Group in 2018 and \nbeyond, and takes note with appreciation of the participation of the Organization for \nSecurity and Cooperation in Europe in the briefings as the first regional organization \nto partner with and co-chair in 2019 the Coordination Group, as well as of the Council \nof Europe and the Special Rapporteur of the Human Rights Council on trafficking in \npersons, especially women and children, as partners of the Coordination Group;  \n \n11. \nWelcomes the first meeting of the Inter-Agency Coordination Group at the \nlevel of principals of the relevant United Nations agencies and organizations, \nincluding those agencies that are not active members of the Coordination Group, held \nin London on 2 May 2018, which contributed to relaunching the Coordination Group \nas a forum for policy exchange, and takes note with appreciation of the briefing for \nMember States and other relevant partners about the outcome of the meeting and \nfuture activities of the Coordination Group held on 29 June 2018 at United Nations \nHeadquarters, as well as requests the United Nations Office on Drugs and Crime, as \ncoordinator of the Coordination Group, to continue to convene such meetings of the \nCoordination Group at the level of principals on a regular basis, and in this context \ntakes note of the role of the Organization for Security and Cooperation in Europe as \nthe first regional entity to co-chair the Coordination Group, and also takes note of the \nengagement of the European Union Anti-Trafficking Coordinator with the \nCoordination Group; \n \n12. Invites regional organizations, within their mandates, to join and consider \nco-chairing, along with a United Nations agency, the Inter-Agency Coordination \nGroup to strengthen the exchange of expertise and regional experiences and thus \nenhance international cooperation in combating trafficking in persons and assisting \nthe victims of this crime; \n \n13. Takes note of the ongoing process undertaken by the Inter-Agency \nCoordination Group to conduct studies on emerging trends in the field of trafficking \nin persons, and to ensure that information-sharing among relevant agencies and \n\nImproving the coordination of efforts \nagainst trafficking in persons \nA/RES/74/176\n \n9/10\n19-22333 \n \nbetween countries is done in accordance with international and national legal \nframeworks and takes into account privacy and confidentiality; \n \n14. Invites the United Nations Office on Drugs and Crime, in its capacity as \ncoordinator of the Inter-Agency Coordination Group, and other relevant agencies of \nthe United Nations system to further strengthen their activities related to the \nimplementation of relevant international instruments and the Global Plan of Action \nto drive greater progress in eliminating trafficking in persons, and invites Member \nStates and other international and bilateral donors to provide voluntary contributions \nto the Office for these purposes, in accordance with the policies, rules and procedures \nof the United Nations;  \n \n15. Calls upon Member States to take into consideration new methods of \nrecruiting those at risk of being subjected to trafficking in persons, such as the misuse \nof the Internet by traffickers, in particular for recruiting children, to take measures to \ndevelop targeted awareness-raising campaigns, including for law enforcement, \nfront-line service providers and at-risk industries, to identify the signs of trafficking \nin persons and to develop specialized training for law enforcement and criminal \njustice practitioners;  \n \n16. Invites Member States to address the social, economic, cultural, political \nand other factors that make people vulnerable to trafficking in persons, such as \npoverty, unemployment, inequality, humanitarian emergencies, including armed \nconflicts and natural disasters, sexual violence, gender discrimination and social \nexclusion and marginalization, as well as a culture of tolerance towards violence \nagainst women, youth and children; \n \n17. Calls upon Member States, international organizations, civil society \norganizations and the private sector, through partnerships, as appropriate, to increase \nand support prevention efforts in countries of origin, transit and destination by \nfocusing domestically and globally on the demand and supply chains that foster all \nforms of trafficking and the goods and services produced as a result of trafficking in \npersons;  \n \n18. Encourages Member States to take legislative or other measures to \nprevent, combat and eradicate trafficking in persons in the context of international \nmigration by strengthening capacities and international cooperation to investigate, \nprosecute and penalize trafficking in persons, discouraging demand that fosters \nexploitation leading to trafficking, and ending impunity of trafficking networks; \n \n19. Also encourages Member States to cooperate on issues concerning \ntrafficking in persons with the Inter-Agency Coordination Group, and in this regard \ntakes note of the \nToolkit for Guidance in Designing and Evaluating \nCounter-Trafficking Programmes of the Coordination Group, which might contribute \nto establishing a common framework for aligning activities and defining and \nassessing progress, as well as building a voluntary, robust and shared evidence base \nof effective programmes and practices to combat trafficking in persons; \n \n20. Further encourages Member States to cooperate with the Special \nRapporteur of the Human Rights Council on trafficking in persons, especially women \nand children, as well as with other relevant special procedures, including the Special \nRapporteur of the Council on violence against women, its causes and consequences, \nthe Special Representative of the Secretary-General on Violence against Children, the \nSpecial Rapporteur of the Council on the sale and sexual exploitation of children, \nincluding child prostitution, child pornography and other child sexual abuse material, \nand the Special Rapporteur of the Council on contemporary forms of slavery, \nincluding its causes and consequences;  \n\nA/RES/74/176 \nImproving the coordination of efforts\nagainst trafficking in persons\n \n19-22333\n10/10 \n \n \n21. Calls upon Member States to continue their efforts to criminalize \ntrafficking in persons in all its forms, including the exploitation of the prostitution of \nothers or other forms of sexual exploitation, forced labour or services, slavery or \npractices similar to slavery, servitude or the removal of organs, especially concerning \nchildren and persons with disabilities, and to condemn these practices and to \ninvestigate, prosecute and penalize traffickers and intermediaries while providing \nvictim-centred protection and assistance to the victims of trafficking with full respect \nfor their human rights, and invites Member States to continue to support those United \nNations agencies and international organizations that are actively involved in victim \nprotection;  \n \n22. Also calls upon Member States to take measures to support family \nreunification for victims of trafficking in persons, where safe and appropriate, \nespecially when those are children, taking into consideration the best interests of the \nchild; \n \n23. Notes the second consultative meeting on strengthening partnerships with \nnational rapporteurs and relevant mechanisms on trafficking in persons, held in \nBangkok on 21 and 22 May 2014, co-hosted by the United Nations Office on Drugs \nand Crime, the Special Rapporteur on trafficking in persons, especially women and \nchildren, and the Office of the United Nations High Commissioner for Human Rights, \nand the establishment of an informal network of such mechanisms located all over \nthe world to address trafficking in persons in a consistent manner and to exchange \ninformation and best practices built on different national experiences, requests the \nUnited Nations Office on Drugs and Crime to continue its efforts to collect \ninformation on national efforts to combat trafficking in persons, as well as on relevant \nnational mechanisms, to make up-to-date information available to Member States, \nand invites Member States to host consultative meetings between relevant national \nmechanisms on trafficking in persons that continue transnational dialogue and the \nexchange of information on common challenges; \n \n24. Requests the United Nations Office on Drugs and Crime, in its capacity as \nfund manager of the United Nations voluntary trust fund for victims of trafficking in \npersons, especially women and children, to continue to encourage contributions by \nStates and all other relevant stakeholders to the trust fund;  \n \n25. Welcomes the biennial publication of the Global Report on Trafficking in \nPersons, prepared by the United Nations Office on Drugs and Crime, looks forward \nto the next such report, to be produced by the Office in 2020, pursuant to the Global \nPlan of Action, and encourages Member States to provide to the Office evidence-\nbased data on patterns, flows and forms of trafficking in persons, including for the \npurpose of the removal of organs;  \n \n26. Requests the Secretary-General to submit a report on the implementation \nof the present resolution to the General Assembly at its seventy-sixth session, \nincluding recommendations on measures to bring greater urgency to and improve the \ncoordination of efforts against trafficking in persons. \n \n50th plenary meeting \n18 December 2019 \n \n",
  "paragraphs": {
    "1": "Urges Member States that have not yet done so to consider ratifying or acceding to, as a matter of priority, the United Nations Convention against Transnational Organized Crime5 and the Protocol to Prevent, Suppress and Punish Trafficking in Persons, Especially Women and Children, supplementing the United Nations Convention against Transnational Organized Crime, 6 taking into consideration the central role of those instruments in the fight against trafficking in persons, and also urges States parties to those instruments to implement them fully and effectively;",
    "2": "Urges Member States and other stakeholders mentioned in the United Nations Global Plan of Action to Combat Trafficking in Persons, 23 and invites the Conference of the Parties to the United Nations Convention against Transnational Organized Crime and relevant international, regional and subregional organizations, within their respective mandates, to continue to contribute to the full and effective implementation of the Global Plan of Action, including by means of strengthening cooperation and improving coordination among themselves in achieving that goal;",
    "3": "Recalls the holding of the high-level meetings of the General Assembly during its sixty-seventh session, from 13 to 15 May 2013, and during its seventy- second session, on 27 and 28 September 2017, to appraise the progress achieved in the implementation of the Global Plan of Action, which, inter alia, reiterated strong political will to step up efforts against trafficking in persons;",
    "4": "Also recalls its decision, in its resolution 68/192, to appraise, from within existing resources, on a four-year basis starting at its seventy-second session, the progress achieved in the implementation of the Global Plan of Action in order to assess achievements, gaps and challenges, including in the implementation of the relevant legal instruments, and therefore decides to convene a high-level meeting of the General Assembly on the progress achieved in the implementation of the Global Plan of Action at its seventy-sixth session, after the general debate, but no later than December 2021;",
    "5": "Requests the Secretary-General and the President of the General Assembly, in close cooperation and coordination with Member States, to take all appropriate measures to arrange the high-level meeting;",
    "6": "Recalls its decision to designate 30 July as the World Day against Trafficking in Persons, to be observed annually, and, while welcoming events held by Member States, United Nations agencies, other international organizations and civil society at the international, regional and national levels to mark the World Day, invites all stakeholders to continue to observe the World Day in order to raise awareness of trafficking in persons and the situation of the victims of this crime and for the promotion and protection of their rights;",
    "7": "Expresses solidarity with and compassion for victims and survivors of trafficking in persons, and calls for the full respect of their human rights and the provision of appropriate victim-centred care and assistance, where applicable, including interpretation and sign language, where appropriate, to victims of trafficking, and services for their rehabilitation in cooperation with civil society and other relevant partners;",
    "8": "Expresses support for the activities of the United Nations Office on Drugs and Crime, reaffirms its request to the Secretary-General to provide adequate support to the Commission on Crime Prevention and Criminal Justice, and invites Member States to make voluntary contributions to the Office for the purpose of providing assistance to Member States upon request;",
    "9": "Encourages the United Nations Office on Drugs and Crime to cooperate with relevant international organizations outside the United Nations system and to invite such organizations and interested Member States to participate, when appropriate, in the meetings of the Inter-Agency Coordination Group against Trafficking in Persons and to keep Member States informed of the schedule of and the progress made by the Coordination Group;",
    "10": "Takes note of the consultative briefings for Member States hosted by the Inter-Agency Coordination Group at United Nations Headquarters in June and October 2018 on the work and priorities of the Coordination Group in 2018 and beyond, and takes note with appreciation of the participation of the Organization for Security and Cooperation in Europe in the briefings as the first regional organization to partner with and co-chair in 2019 the Coordination Group, as well as of the Council of Europe and the Special Rapporteur of the Human Rights Council on trafficking in persons, especially women and children, as partners of the Coordination Group;",
    "11": "Welcomes the first meeting of the Inter-Agency Coordination Group at the level of principals of the relevant United Nations agencies and organizations, including those agencies that are not active members of the Coordination Group, held in London on 2 May 2018, which contributed to relaunching the Coordination Group as a forum for policy exchange, and takes note with appreciation of the briefing for Member States and other relevant partners about the outcome of the meeting and future activities of the Coordination Group held on 29 June 2018 at United Nations Headquarters, as well as requests the United Nations Office on Drugs and Crime, as coordinator of the Coordination Group, to continue to convene such meetings of the Coordination Group at the level of principals on a regular basis, and in this context takes note of the role of the Organization for Security and Cooperation in Europe as the first regional entity to co-chair the Coordination Group, and also takes note of the engagement of the European Union Anti-Trafficking Coordinator with the Coordination Group;",
    "12": "Invites regional organizations, within their mandates, to join and consider co-chairing, along with a United Nations agency, the Inter-Agency Coordination Group to strengthen the exchange of expertise and regional experiences and thus enhance international cooperation in combating trafficking in persons and assisting the victims of this crime;",
    "13": " between countries is done in accordance with international and national legal frameworks and takes into account privacy and confidentiality;",
    "14": "Invites the United Nations Office on Drugs and Crime, in its capacity as coordinator of the Inter-Agency Coordination Group, and other relevant agencies of the United Nations system to further strengthen their activities related to the implementation of relevant international instruments and the Global Plan of Action to drive greater progress in eliminating trafficking in persons, and invites Member States and other international and bilateral donors to provide voluntary contributions to the Office for these purposes, in accordance with the policies, rules and procedures of the United Nations;",
    "15": "Calls upon Member States to take into consideration new methods of recruiting those at risk of being subjected to trafficking in persons, such as the misuse of the Internet by traffickers, in particular for recruiting children, to take measures to develop targeted awareness-raising campaigns, including for law enforcement, front-line service providers and at-risk industries, to identify the signs of trafficking in persons and to develop specialized training for law enforcement and criminal justice practitioners;",
    "16": "Invites Member States to address the social, economic, cultural, political and other factors that make people vulnerable to trafficking in persons, such as poverty, unemployment, inequality, humanitarian emergencies, including armed conflicts and natural disasters, sexual violence, gender discrimination and social exclusion and marginalization, as well as a culture of tolerance towards violence against women, youth and children;",
    "17": "Calls upon Member States, international organizations, civil society organizations and the private sector, through partnerships, as appropriate, to increase and support prevention efforts in countries of origin, transit and destination by focusing domestically and globally on the demand and supply chains that foster all forms of trafficking and the goods and services produced as a result of trafficking in persons;",
    "18": "Encourages Member States to take legislative or other measures to prevent, combat and eradicate trafficking in persons in the context of international migration by strengthening capacities and international cooperation to investigate, prosecute and penalize trafficking in persons, discouraging demand that fosters exploitation leading to trafficking, and ending impunity of trafficking networks;",
    "19": "Also encourages Member States to cooperate on issues concerning trafficking in persons with the Inter-Agency Coordination Group, and in this regard takes note of the Toolkit for Guidance in Designing and Evaluating Counter-Trafficking Programmes of the Coordination Group, which might contribute to establishing a common framework for aligning activities and defining and assessing progress, as well as building a voluntary, robust and shared evidence base of effective programmes and practices to combat trafficking in persons;",
    "20": "",
    "21": "Calls upon Member States to continue their efforts to criminalize trafficking in persons in all its forms, including the exploitation of the prostitution of others or other forms of sexual exploitation, forced labour or services, slavery or practices similar to slavery, servitude or the removal of organs, especially concerning children and persons with disabilities, and to condemn these practices and to investigate, prosecute and penalize traffickers and intermediaries while providing victim-centred protection and assistance to the victims of trafficking with full respect for their human rights, and invites Member States to continue to support those United Nations agencies and international organizations that are actively involved in victim protection;",
    "22": "Also calls upon Member States to take measures to support family reunification for victims of trafficking in persons, where safe and appropriate, especially when those are children, taking into consideration the best interests of the child;",
    "23": "Notes the second consultative meeting on strengthening partnerships with national rapporteurs and relevant mechanisms on trafficking in persons, held in Bangkok on 21 and 22 May 2014, co-hosted by the United Nations Office on Drugs and Crime, the Special Rapporteur on trafficking in persons, especially women and children, and the Office of the United Nations High Commissioner for Human Rights, and the establishment of an informal network of such mechanisms located all over the world to address trafficking in persons in a consistent manner and to exchange information and best practices built on different national experiences, requests the United Nations Office on Drugs and Crime to continue its efforts to collect information on national efforts to combat trafficking in persons, as well as on relevant national mechanisms, to make up-to-date information available to Member States, and invites Member States to host consultative meetings between relevant national mechanisms on trafficking in persons that continue transnational dialogue and the exchange of information on common challenges;",
    "24": "Requests the United Nations Office on Drugs and Crime, in its capacity as fund manager of the United Nations voluntary trust fund for victims of trafficking in persons, especially women and children, to continue to encourage contributions by States and all other relevant stakeholders to the trust fund;",
    "25": "Welcomes the biennial publication of the Global Report on Trafficking in Persons, prepared by the United Nations Office on Drugs and Crime, looks forward to the next such report, to be produced by the Office in 2020, pursuant to the Global Plan of Action, and encourages Member States to provide to the Office evidence- based data on patterns, flows and forms of trafficking in persons, including for the purpose of the removal of organs;",
    "26": "Requests the Secretary-General to submit a report on the implementation of the present resolution to the General Assembly at its seventy-sixth session, including recommendations on measures to bring greater urgency to and improve the coordination of efforts against trafficking in persons."
  },
  "agenda_items": [
    "Item 106"
  ],
  "symbol_references": []
}