{
  "symbol": "A/RES/76/59",
  "filename": "A_RES_76_59.pdf",
  "title": "76/59. United Nations Regional Centre for Peace and Disarmament in Asia and the Pacific",
  "text": "United Nations \nA/RES/76/59\n \n \nGeneral Assembly \nDistr.: General \n14 December 2021 \n \n \n21-18513 (E)    171221 \n*2118513* \n \n \nSeventy-sixth session \nAgenda item 101 (d) \nReview and implementation of the Concluding Document \nof the Twelfth Special Session of the General Assembly: \nUnited Nations Regional Centre for Peace and \nDisarmament in Asia and the Pacific \n \n \n \n \n Resolution adopted by the General Assembly \non 6 December 2021 \n \n \n \n \n[on the report of the First Committee (A/76/445, para. 17)] \n \n \n \n76/59. United Nations Regional Centre for Peace and Disarmament in \nAsia and the Pacific \n \n \n \nThe General Assembly, \n \nRecalling its resolutions 42/39 D of 30 November 1987 and 44/117 F of \n15 December 1989, by which it established the United Nations Regional Centre for \nPeace and Disarmament in Asia and renamed it the United Nations Regional Centre \nfor Peace and Disarmament in Asia and the Pacific, with headquarters in Kathmandu, \n \nRecalling also the mandate of the Regional Centre to provide, on request, \nsubstantive support for the initiatives and other activities mutually agreed upon by \nthe Member States of the Asia-Pacific region for the implementation of measures for \npeace and disarmament, through appropriate utilization of available resources, \n \nTaking note of the report of the Secretary-General,1 and expressing its \nappreciation to the Regional Centre for its important work in promoting dialogue and \nconfidence-building measures through the organization of meetings, conferences and \nworkshops in the region, including national and subregional workshops on the \nimplementation of Security Council resolution 1540 (2004) of 28 April 2004 in South \nAsia and Mongolia; capacity-building training for States of Asia and the Pacific on \npreparing and submitting online national reports on the implementation of the \nProgramme of Action to Prevent, Combat and Eradicate the Illicit Trade in Small \nArms and Light Weapons in All Its Aspects2 and the Arms Trade Treaty;3 and a \n__________________ \n \n1  A/76/97. \n \n2  Report of the United Nations Conference on the Illicit Trade in Small Arms and Light Weapons in \nAll Its Aspects, New York, 9\u201320 July 2001 (A/CONF.192/15), chap. IV, para. 24. \n \n3  United Nations, Treaty Series, vol. 3013, No. 52373. \n\nA/RES/76/59 \nUnited Nations Regional Centre for Peace and Disarmament in \nAsia and the Pacific\n \n21-18513\n2/2 \n \ncapacity-building project for States of Asia and the Pacific on gun violence and illicit \nsmall arms trafficking from a gender perspective, \n \nExpressing appreciation for the timely execution by Nepal of its host country \ncommitments for the physical operation of the Regional Centre, \n \nWelcoming the work by the Regional Centre in support of the achievement of \nSustainable Development Goals 5 and 16,4 in particular target 5.2 to eliminate all \nforms of violence against all women and girls, target 5.5 to ensure women\u2019s full and \neffective participation and equal opportunities for leadership and target 16.4 to \nsignificantly reduce illicit financial and arms flows, \n \nWelcoming also the efforts by the Regional Centre to promote the role and \nrepresentation of women in disarmament, non-proliferation and arms control \nactivities, \n \nWelcoming further the youth-focused outreach activities undertaken by the \nRegional Centre, \n \n1. \nExpresses its satisfaction at the activities carried out over the past year by \nthe United Nations Regional Centre for Peace and Disarmament in Asia and the \nPacific, and invites all States of the region to continue to support the activities of the \nRegional Centre, including by continuing to take part in them, where possible, and by \nproposing items for inclusion in the programme of activities of the Centre, in order \nto contribute to the implementation of measures for peace and disarmament; \n \n2. \nExpresses its gratitude to the Government of Nepal for its cooperation and \nfinancial support, which has enabled the Regional Centre to operate from Kathmandu; \n \n3. \nExpresses its appreciation to the Secretary-General and the Office for \nDisarmament Affairs of the Secretariat for providing the necessary support with a \nview to ensuring the smooth operation of the Regional Centre and to enabling the \nCentre to function effectively; \n \n4. \nAppeals to Member States, in particular those within the Asia-Pacific \nregion, as well as to international governmental and non-governmental organizations \nand foundations, to make voluntary contributions, the only resources of the Regional \nCentre, to strengthen its programme of activities and the implementation thereof; \n \n5. \nReaffirms its strong support for the role of the Regional Centre in the \npromotion of activities of the United Nations at the regional level to strengthen peace, \nstability and security among its Member States; \n \n6. \nUnderlines the importance of the Kathmandu process for the development \nof the practice of region-wide security and disarmament dialogues; \n \n7. \nRequests the Secretary-General to report to the General Assembly at its \nseventy-seventh session on the implementation of the present resolution; \n \n8. \nDecides to include in the provisional agenda of its seventy-seventh \nsession, under the item entitled \u201cReview and implementation of the Concluding \nDocument of the Twelfth Special Session of the General Assembly\u201d, the sub-item \nentitled \u201cUnited Nations Regional Centre for Peace and Disarmament in Asia and the \nPacific\u201d. \n \n45th plenary meeting \n6 December 2021 \n \n__________________ \n \n4  See resolution 70/1. \n",
  "paragraphs": {
    "1": "Expresses its satisfaction at the activities carried out over the past year by the United Nations Regional Centre for Peace and Disarmament in Asia and the Pacific, and invites all States of the region to continue to support the activities of the Regional Centre, including by continuing to take part in them, where possible, and by proposing items for inclusion in the programme of activities of the Centre, in order to contribute to the implementation of measures for peace and disarmament;",
    "2": "Expresses its gratitude to the Government of Nepal for its cooperation and financial support, which has enabled the Regional Centre to operate from Kathmandu;",
    "3": "Expresses its appreciation to the Secretary-General and the Office for Disarmament Affairs of the Secretariat for providing the necessary support with a view to ensuring the smooth operation of the Regional Centre and to enabling the Centre to function effectively;",
    "4": "Appeals to Member States, in particular those within the Asia-Pacific region, as well as to international governmental and non-governmental organizations and foundations, to make voluntary contributions, the only resources of the Regional Centre, to strengthen its programme of activities and the implementation thereof;",
    "5": "Reaffirms its strong support for the role of the Regional Centre in the promotion of activities of the United Nations at the regional level to strengthen peace, stability and security among its Member States;",
    "6": "Underlines the importance of the Kathmandu process for the development of the practice of region-wide security and disarmament dialogues;",
    "7": "Requests the Secretary-General to report to the General Assembly at its seventy-seventh session on the implementation of the present resolution;",
    "8": "Decides to include in the provisional agenda of its seventy-seventh session, under the item entitled \u201cReview and implementation of the Concluding Document of the Twelfth Special Session of the General Assembly\u201d, the sub-item entitled \u201cUnited Nations Regional Centre for Peace and Disarmament in Asia and the Pacific\u201d. 45th plenary meeting 6 December 2021 __________________ 4 See resolution 70/1."
  },
  "agenda_items": [
    "Item 101"
  ],
  "symbol_references": []
}