{
  "symbol": "A/RES/78/129",
  "filename": "A_RES_78_129.pdf",
  "title": "78/129. Promotion of interreligious and intercultural dialogue, understanding and cooperation for peace",
  "text": "United Nations \nA/RES/78/129\n \n \nGeneral Assembly \nDistr.: General \n21 December 2023 \n \n23-25872 (E)    291223  \n*2325872* \n \n \nSeventy-eighth session \nAgenda item 14 \nCulture of peace \n \n \n \n \n Resolution adopted by the General Assembly \non 18 December 2023 \n \n \n \n \n[without reference to a Main Committee (A/78/L.26)] \n \n \n 78/129. Promotion of interreligious and intercultural dialogue, \nunderstanding and cooperation for peace \n \n \n \nThe General Assembly, \n \nReaffirming the purposes and principles enshrined in the Charter of the United \nNations and the Universal Declaration of Human Rights, 1 in particular the right to \nfreedom of thought, conscience and religion,  \n \nRecalling its resolution 76/69 of 9 December 2021 on the promotion of \ninterreligious and intercultural dialogue, understanding and cooperation for peace, \nand its other related resolutions,  \n \nRecalling also its resolutions 53/243 A and B of 13 September 1999 on the \nDeclaration and Programme of Action on a Culture of Peace, which serve as a \nuniversal mandate for the international community for the promotion of a culture of \npeace and non-violence that benefits humanity, in particular future generations, and \nwelcoming the convening of the High-level Forum on the Culture of Peace by the \nPresident of the General Assembly on 6 September 2022,  \n \nEncouraging, in this regard, activities aimed at promoting interreligious and \nintercultural dialogue in order to enhance peace and social stability, respect for \ndiversity and mutual respect and to create, at the global level, and also at the regional, \nnational and local levels, an environment conducive to peace and mutual \nunderstanding,  \n \nRecalling its resolution 69/312 of 6 July 2015 on the United Nations Alliance of \nCivilizations, in which it reaffirmed its support for the Alliance and reiterated the \nvaluable role of the Alliance in promoting greater understanding and respect among \ncivilizations, cultures, religions and beliefs, \n__________________ \n \n1 Resolution 217 A (III). \n\nA/RES/78/129 \nPromotion of interreligious and intercultural dialogue, \nunderstanding and cooperation for peace\n \n23-25872\n2/7 \n \n \nRecalling also its resolution 36/55 of 25 November 1981, by which it \nproclaimed the Declaration on the Elimination of All Forms of Intolerance and of \nDiscrimination Based on Religion or Belief, and its resolutions 72/241 of 20 December \n2017 on a world against violence and violent extremism, 73/285 of 2 April 2019 on \ncombating terrorism and other acts of violence based on religion or belief, 75/258 of 21 \nJanuary 2021 on promoting a culture of peace and tolerance to safeguard religious sites, \n77/298 of 22 June 2023, entitled \u201cThe United Nations Global Counter-Terrorism \nStrategy: eighth review\u201d, and 77/318 of 25 July 2023 on promoting interreligious and \nintercultural dialogue and tolerance in countering hate speech,  \n \nRecalling further its resolution 72/130 of 8 December 2017 proclaiming 16 May \nas International Day of Living Together in Peace, resolution 73/296 of 28 May 2019 \ndesignating 22 August as International Day Commemorating the Victims of Acts of \nViolence Based on Religion or Belief, resolution 73/329 of 25 July 2019 declaring \n5 April the International Day of Conscience, and resolution 76/254 of 15 March 2022 \ndesignating 15 March as International Day to Combat Islamophobia, \n \nWelcoming the observance of 10 December as Human Rights Day,2 9 December \nas the International Day of Commemoration and Dignity of the Victims of the Crime \nof Genocide and of the Prevention of This Crime,3 2 October as the International Day \nof Non-Violence,4 18 June as the International Day for Countering Hate Speech, 5 \n21 August as the International Day of Remembrance of and Tribute to the Victims of \nTerrorism,6 4 February as the International Day of Human Fraternity, 7 16 November \nas the International Day for Tolerance, 8 20 February as the World Day of Social \nJustice 9  and 15 March as the International Day to Combat Islamophobia, 10  as \nproclaimed by the United Nations,  \n \nBearing in mind the valuable contribution that interreligious and intercultural \ndialogue can make to an improved awareness and understanding of the common \nvalues shared by all humankind, \n \nNoting that interreligious and intercultural dialogue has made significant \ncontributions to mutual understanding, tolerance and respect, as well as to the \npromotion of a culture of peace and an improvement of overall relations among \npeople from different cultural and religious backgrounds and among nations,  \n \nNoting also the growing importance of interreligious and intercultural dialogue \nin the context of the global phenomenon of migration, which increases interaction \namong persons and communities from various traditions, cultures and religions,  \n \nConvinced that the full enjoyment of human rights by all persons, the promotion \nof cultural pluralism and tolerance towards and dialogue among various cultures and \ncivilizations would contribute to the efforts of all peoples and nations to enrich their \ncultures and traditions by engaging in a mutually beneficial exchange of knowledge \nand intellectual, moral and material achievements, \n \nNoting the launch by the Secretary-General of the United Nations Strategy and \nPlan of Action on Hate Speech, and noting the role of the Special Adviser to the \nSecretary-General on the Prevention of Genocide in this regard,  \n__________________ \n \n2 Resolution 423 (V). \n \n3 Resolution 69/323. \n \n4 Resolution 61/271. \n \n5 Resolution 75/309. \n \n6 Resolution 72/165. \n \n7 Resolution 75/200. \n \n8 Resolution 51/95. \n \n9 Resolution 62/10. \n \n10 Resolution 76/254. \n\nPromotion of interreligious and intercultural dialogue, \nunderstanding and cooperation for peace \nA/RES/78/129\n \n3/7\n23-25872 \n \n \nNoting also the leading role played by the United Nations Alliance of \nCivilizations in preparing the United Nations Plan of Action to Safeguard Religious \nSites, noting further the launch of the Plan of Action by the Secretary-General on \n12 September 2019, and inviting Member States to consider implementing the \nrelevant recommendations addressed to them, in collaboration with other \nstakeholders, as appropriate, \n \nNoting further the Unite for Heritage campaign launched by the United Nations \nEducational, Scientific and Cultural Organization in March 2015, which is aimed at \ncelebrating and safeguarding cultural heritage and diversity around the world, and the \nConference on Safeguarding Endangered Cultural Heritage, held in Abu Dhabi on 2 and \n3 December 2016, and the declaration adopted at the Conference,  \n \nRecalling that States have the primary responsibility to promote and protect \nhuman rights, including the human rights of persons belonging to religious minorities, \nincluding their right to exercise their religion or belief freely,  \n \nRecognizing that individuals in many religions and societies accord significance \nto religious symbols, and in this regard underscoring the importance of promoting \nmutual respect, tolerance and peaceful coexistence, \n \nReaffirming that violence can and should never be a justifiable or acceptable \nresponse to acts of intolerance on the basis of religion or belief and that such violence \nshould not be attributed to any religion, nationality, civilization or ethnic group,  \n \nReaffirming also the positive role that the exercise of the right to freedom of \nopinion and expression and full respect for the freedom to seek, receive and impart \ninformation can play in strengthening democracy and combating religious \nintolerance, and reaffirming further that the exercise of the right to freedom of \nexpression carries with it special duties and responsibilities, in accordance with \narticle 19 of the International Covenant on Civil and Political Rights,11  \n \nRecalling article 20 (2) of the International Covenant on Civil and Political \nRights, which states that any advocacy of national, racial or religious hatred that \nconstitutes incitement to discrimination, hostility or violence shall be prohibited by \nlaw,  \n \nBearing in mind that tolerance of cultural, ethnic, religious and linguistic \ndiversities contributes towards peace, mutual understanding and friendship among \npeople of different cultures and nations and that these diversities should be made part \nof intercultural and interreligious dialogue efforts, as appropriate,  \n \nReaffirming \nthe \n2030 Agenda for \nSustainable \nDevelopment,\n12  and \nacknowledging that the 2030 Agenda includes the promotion of peaceful and \ninclusive societies for sustainable development,  \n \nNoting the various initiatives at the local, national, regional and international \nlevels for enhancing interreligious and intercultural dialogue, understanding and \ncooperation, and for strengthening people-to-people bonds, which are mutually \nreinforcing and interrelated, as well as declarations and statements from various \nmeetings in this regard, all of which contribute to promoting social cohesion and \ninclusion, peace and development,  \n \nNoting also the cooperation between the United Nations and regional and other \norganizations in the promotion of interreligious and intercultural dialogue,  \n__________________ \n \n11 See resolution 2200 A (XXI), annex. \n \n12 Resolution 70/1. \n\nA/RES/78/129 \nPromotion of interreligious and intercultural dialogue, \nunderstanding and cooperation for peace\n \n23-25872\n4/7 \n \n \nWelcoming the leading role of the United Nations Educational, Scientific and \nCultural Organization, as well as the work of the United Nations Alliance of \nCivilizations, in promoting intercultural dialogue,  \n \nWelcoming also the work of the Anna Lindh Foundation and the ongoing work \nof the King Abdullah Bin Abdulaziz International Centre for Interreligious and \nIntercultural Dialogue in Lisbon, \n \nNoting the efforts that build on the Rabat Plan of Action on the prohibition of \nadvocacy of national, racial or religious hatred,13 the Plan of Action for Religious \nLeaders and Actors to Prevent Incitement to Violence that Could Lead to Atrocity \nCrimes, also known as the Fez Plan of Action, the Plan of Action to Safeguard \nReligious Sites, and the Istanbul Process for Combating Intolerance, Discrimination \nand Incitement to Hatred and/or Violence on the Basis of Religion or Belief,  \n \nAcknowledging the positive contribution of individuals and of relevant civil \nsociety organizations to the promotion of interreligious and intercultural dialogue, \nunderstanding and the culture of peace,  \n \nUnderlining the importance of education, including education on culture, peace, \ntolerance, mutual understanding and human rights, in promoting interreligious and \nintercultural dialogue, respect for diversity, and the elimination of discrimination \nbased on religion or belief,  \n \nRecognizing the contributions of the media and of new information and \ncommunications technologies to promoting peoples\u2019 understanding of different \ncultures and religions, including through the promotion of dialogue, \n \nReaffirming the importance of sustaining the process of engaging all \nstakeholders, including young men and women as relevant actors, in interreligious \nand intercultural dialogue within the appropriate initiatives at various levels, which \nis aimed at challenging prejudices, improving mutual understanding and fostering \ncooperation,  \n \nRecognizing the commitment of all religions to peace and the contribution that \ninterreligious and intercultural dialogue among religions, groups and individuals, in \nparticular religious leaders, can make towards an improved awareness and \nunderstanding of the common values shared by all humankind,  \n \nTaking note of the document entitled \u201cHuman Fraternity for World Peace and \nLiving Together\u201d, which was signed by Pope Francis and the Grand Imam of \nAl-Azhar, Ahmad al-Tayyib, on 4 February 2019 in Abu Dhabi, \n \n1. \nReaffirms that mutual understanding and interreligious and intercultural \ndialogue constitute important dimensions of the dialogue among civilizations and of \nthe culture of peace; \n \n2. \nRecognizes that the open public debate of ideas, as well as interfaith and \nintercultural dialogue, at the local, national and international levels can be among the \nbest protections against religious intolerance and can play a positive role in \nstrengthening democracy and combating religious hatred, and convinced that a \ncontinuing dialogue on these issues can help to overcome existing misperceptions; \n \n3. \nTakes note of the report of the Secretary-General on the promotion of a \nculture of peace and interreligious and intercultural dialogue, understanding and \ncooperation for peace;14 \n__________________ \n \n13 A/HRC/22/17/Add.4, appendix. \n \n14 A/76/357. \n\nPromotion of interreligious and intercultural dialogue, \nunderstanding and cooperation for peace \nA/RES/78/129\n \n5/7\n23-25872 \n \n \n4. \nRecognizes the importance of interreligious and intercultural dialogue and \nits valuable contribution to promoting social cohesion and inclusion, peace and \ndevelopment, and calls upon Member States to consider, as appropriate and where \napplicable, interreligious and intercultural dialogue as an important tool in efforts \naimed at achieving peace and social stability and the full realization of the Sustainable \nDevelopment Goals; \n \n5. \nAlso recognizes the efforts by relevant stakeholders to foster peaceful and \nharmonious coexistence within societies by promoting respect for religious and \ncultural diversity, including by engendering sustained and robust interaction among \nvarious segments of society; \n \n6. \nFurther recognizes the leading role of the United Nations Educational, \nScientific and Cultural Organization on intercultural dialogue and its contribution to \ninterreligious dialogue, as well as its activities related to the culture of peace and \nnon-violence and its focus on concrete actions at the global, regional and subregional \nlevels, and recognizes the contribution by the United Nations Alliance of Civilizations \nin this regard;  \n \n7. \nWelcomes the declarations adopted by the Global Forums of the United \nNations Alliance of Civilizations, and invites relevant stakeholders to continue their \nefforts to promote mutual understanding among different civilizations, cultures, \nreligions and beliefs;  \n \n8. \nAlso welcomes the efforts undertaken by the High Representative for the \nUnited Nations Alliance of Civilizations in promoting intercultural and interreligious \ndialogue, strengthening social cohesion and promoting a culture of peace; \n \n9. \nTakes note with concern of the rise in discrimination, hate speech, \nstigmatization, racism and xenophobia related to the COVID-19 pandemic; \n \n10. Calls upon Member States, which have the primary responsibility to \ncounter discrimination and hate speech, and all relevant actors, including political \nand religious leaders, to promote inclusion and unity to combat racism, xenophobia, \nhate speech, violence and discrimination;  \n \n11. \nReaffirms the solemn commitment of all States to fulfil their obligations \nand commitments to promote universal respect for and observance and protection of \nall human rights and fundamental freedoms for all in accordance with the Charter of \nthe United Nations, the Universal Declaration of Human Rights and other instruments \nrelating to human rights and international law, the universal nature of these rights and \nfreedoms being beyond question; \n \n12. \nRecalls the initiative to open up the Kartarpur Sahib Corridor in the spirit of \ninterfaith harmony and peaceful neighbourhood, and appreciates the agreement \nbetween the Governments of India and Pakistan to allow visa-free access to pilgrims of \nall faiths, especially Nanak Naam Levas and the Sikh community from across the world, \nas a landmark initiative for interreligious and intercultural cooperation for peace; \n \n13. Notes with appreciation the ninth United Nations Alliance of Civilizations \nGlobal Forum, held in Fez, Kingdom of Morocco, on 22 and 23 November 2022 under \nthe theme \u201cTowards an alliance of peace: living together as one humanity\u201d, that \nadopted the Fez Declaration, and focused, among other issues, on countering and \naddressing online hate speech on social media, and invites relevant stakeholders to \ncontinue their efforts to promote cross-cultural dialogue and mutual understanding \namong different civilizations, cultures, religions and beliefs;  \n \n14. Underlines the importance of moderation as a value, while respecting \nhuman rights and fundamental freedoms, and for further contributing to the promotion \nof interreligious and intercultural dialogue, tolerance, understanding and cooperation, \n\nA/RES/78/129 \nPromotion of interreligious and intercultural dialogue, \nunderstanding and cooperation for peace\n \n23-25872\n6/7 \n \nand encourages efforts, as appropriate, to enable voices of moderation to work \ntogether in order to build a more secure, inclusive and peaceful world; \n \n15. Welcomes the efforts by the media to promote interreligious and \nintercultural dialogue, encourages the further promotion of dialogue among the media \nfrom all cultures and civilizations, emphasizes that everyone has the right to freedom \nof expression, and reaffirms that the exercise of this right carries with it special duties \nand responsibilities and may therefore be subject to certain restrictions, but that these \ncan be only such as are provided by law and necessary for respect of the rights or \nreputations of others, and protection of national security or of public order, or of \npublic health and morals, and are non-discriminatory and that all measures taken \nshould be in full compliance with international human rights law;  \n \n16. Also welcomes the efforts to use information and communications \ntechnologies, including the Internet, to promote interreligious and intercultural \ndialogue, including through the Peace and Dialogue ePortal of the United Nations \nEducational, Scientific and Cultural Organization, and encourages relevant \nstakeholders to utilize the opportunity to disseminate their best practices and \nexperiences on interreligious and intercultural dialogue by contributing to the Peace \nand Dialogue ePortal;  \n \n17. Encourages Member States to consider, as and where appropriate, \ninitiatives that identify areas for practical action in all sectors and levels of society \nfor the promotion of interreligious and intercultural dialogue, tolerance, \nunderstanding and cooperation; \n \n18. Acknowledges the active engagement of the United Nations system with \nfaith-based and cultural organizations and other relevant non-governmental \norganizations in the promotion of interreligious and intercultural dialogue and in \nbringing together people of different cultures, religions, faiths or beliefs to discuss \ncommon issues and objectives;  \n \n19. Also acknowledges the important role of civil society, including academia, \nin fostering interreligious and intercultural dialogue, and encourages support for \npractical measures that mobilize civil society, including building capacities, \nopportunities and frameworks for cooperation; \n \n20. Invites Member States to further promote reconciliation to help to ensure \ndurable peace, and sustained development, including by working with faith leaders \nand communities and through reconciliatory measures and acts of service and by \nencouraging forgiveness and compassion among individuals;  \n \n21. Also invites Member States to disseminate values of religious tolerance \nand interreligious dialogue through educational programmes; \n \n22. Recognizes that the Office of Intergovernmental Support and Coordination \nfor Sustainable Development in the Department of Economic and Social Affairs of \nthe Secretariat plays a valuable role as focal point within the Secretariat on the issue, \nand encourages it to continue to interact and coordinate with the relevant entities of \nthe United Nations system and coordinate their contribution to the intergovernmental \nprocess aimed at promoting interreligious and intercultural dialogue; \n \n23. Requests the Secretary-General to report to the General Assembly at its \neightieth session on the implementation of the present resolution.  \n \n48th plenary meeting \n18 December 2023 \n \n\nPromotion of interreligious and intercultural dialogue, \nunderstanding and cooperation for peace \nA/RES/78/129\n \n7/7\n23-25872 \n \n \n",
  "paragraphs": {
    "1": "Reaffirms that mutual understanding and interreligious and intercultural dialogue constitute important dimensions of the dialogue among civilizations and of the culture of peace;",
    "2": "Recognizes that the open public debate of ideas, as well as interfaith and intercultural dialogue, at the local, national and international levels can be among the best protections against religious intolerance and can play a positive role in strengthening democracy and combating religious hatred, and convinced that a continuing dialogue on these issues can help to overcome existing misperceptions;",
    "3": "Takes note of the report of the Secretary-General on the promotion of a culture of peace and interreligious and intercultural dialogue, understanding and cooperation for peace;14 __________________ 13 A/HRC/22/17/Add.4, appendix. 14 A/76/357. Promotion of interreligious and intercultural dialogue, understanding and cooperation for peace A/RES/78/129 5/7 23-25872",
    "4": "Recognizes the importance of interreligious and intercultural dialogue and its valuable contribution to promoting social cohesion and inclusion, peace and development, and calls upon Member States to consider, as appropriate and where applicable, interreligious and intercultural dialogue as an important tool in efforts aimed at achieving peace and social stability and the full realization of the Sustainable Development Goals;",
    "5": "Also recognizes the efforts by relevant stakeholders to foster peaceful and harmonious coexistence within societies by promoting respect for religious and cultural diversity, including by engendering sustained and robust interaction among various segments of society;",
    "6": "Further recognizes the leading role of the United Nations Educational, Scientific and Cultural Organization on intercultural dialogue and its contribution to interreligious dialogue, as well as its activities related to the culture of peace and non-violence and its focus on concrete actions at the global, regional and subregional levels, and recognizes the contribution by the United Nations Alliance of Civilizations in this regard;",
    "7": "Welcomes the declarations adopted by the Global Forums of the United Nations Alliance of Civilizations, and invites relevant stakeholders to continue their efforts to promote mutual understanding among different civilizations, cultures, religions and beliefs;",
    "8": "Also welcomes the efforts undertaken by the High Representative for the United Nations Alliance of Civilizations in promoting intercultural and interreligious dialogue, strengthening social cohesion and promoting a culture of peace;",
    "9": "Takes note with concern of the rise in discrimination, hate speech, stigmatization, racism and xenophobia related to the COVID-19 pandemic;",
    "10": "Calls upon Member States, which have the primary responsibility to counter discrimination and hate speech, and all relevant actors, including political and religious leaders, to promote inclusion and unity to combat racism, xenophobia, hate speech, violence and discrimination;",
    "11": "Reaffirms the solemn commitment of all States to fulfil their obligations and commitments to promote universal respect for and observance and protection of all human rights and fundamental freedoms for all in accordance with the Charter of the United Nations, the Universal Declaration of Human Rights and other instruments relating to human rights and international law, the universal nature of these rights and freedoms being beyond question;",
    "12": "Recalls the initiative to open up the Kartarpur Sahib Corridor in the spirit of interfaith harmony and peaceful neighbourhood, and appreciates the agreement between the Governments of India and Pakistan to allow visa-free access to pilgrims of all faiths, especially Nanak Naam Levas and the Sikh community from across the world, as a landmark initiative for interreligious and intercultural cooperation for peace;",
    "13": "Notes with appreciation the ninth United Nations Alliance of Civilizations Global Forum, held in Fez, Kingdom of Morocco, on 22 and 23 November 2022 under the theme \u201cTowards an alliance of peace: living together as one humanity\u201d, that adopted the Fez Declaration, and focused, among other issues, on countering and addressing online hate speech on social media, and invites relevant stakeholders to continue their efforts to promote cross-cultural dialogue and mutual understanding among different civilizations, cultures, religions and beliefs;",
    "14": "Underlines the importance of moderation as a value, while respecting human rights and fundamental freedoms, and for further contributing to the promotion of interreligious and intercultural dialogue, tolerance, understanding and cooperation, A/RES/78/129 Promotion of interreligious and intercultural dialogue, understanding and cooperation for peace 23-25872 6/7 and encourages efforts, as appropriate, to enable voices of moderation to work together in order to build a more secure, inclusive and peaceful world;",
    "15": "Welcomes the efforts by the media to promote interreligious and intercultural dialogue, encourages the further promotion of dialogue among the media from all cultures and civilizations, emphasizes that everyone has the right to freedom of expression, and reaffirms that the exercise of this right carries with it special duties and responsibilities and may therefore be subject to certain restrictions, but that these can be only such as are provided by law and necessary for respect of the rights or reputations of others, and protection of national security or of public order, or of public health and morals, and are non-discriminatory and that all measures taken should be in full compliance with international human rights law;",
    "16": "Also welcomes the efforts to use information and communications technologies, including the Internet, to promote interreligious and intercultural dialogue, including through the Peace and Dialogue ePortal of the United Nations Educational, Scientific and Cultural Organization, and encourages relevant stakeholders to utilize the opportunity to disseminate their best practices and experiences on interreligious and intercultural dialogue by contributing to the Peace and Dialogue ePortal;",
    "17": "Encourages Member States to consider, as and where appropriate, initiatives that identify areas for practical action in all sectors and levels of society for the promotion of interreligious and intercultural dialogue, tolerance, understanding and cooperation;",
    "18": "Acknowledges the active engagement of the United Nations system with faith-based and cultural organizations and other relevant non-governmental organizations in the promotion of interreligious and intercultural dialogue and in bringing together people of different cultures, religions, faiths or beliefs to discuss common issues and objectives;",
    "19": "Also acknowledges the important role of civil society, including academia, in fostering interreligious and intercultural dialogue, and encourages support for practical measures that mobilize civil society, including building capacities, opportunities and frameworks for cooperation;",
    "20": "Invites Member States to further promote reconciliation to help to ensure durable peace, and sustained development, including by working with faith leaders and communities and through reconciliatory measures and acts of service and by encouraging forgiveness and compassion among individuals;",
    "21": "Also invites Member States to disseminate values of religious tolerance and interreligious dialogue through educational programmes;",
    "22": "Recognizes that the Office of Intergovernmental Support and Coordination for Sustainable Development in the Department of Economic and Social Affairs of the Secretariat plays a valuable role as focal point within the Secretariat on the issue, and encourages it to continue to interact and coordinate with the relevant entities of the United Nations system and coordinate their contribution to the intergovernmental process aimed at promoting interreligious and intercultural dialogue;",
    "23": "Requests the Secretary-General to report to the General Assembly at its eightieth session on the implementation of the present resolution. 48th plenary meeting 18 December 2023 Promotion of interreligious and intercultural dialogue, understanding and cooperation for peace A/RES/78/129 7/7 23-25872"
  },
  "agenda_items": [
    "Item 14"
  ],
  "symbol_references": [
    "A/78/L.26"
  ]
}