{
  "symbol": "A/RES/72/102",
  "filename": "A_RES_72_102.pdf",
  "title": "72/102. Question of Guam",
  "text": "United Nations \nA/RES/72/102\n \n \nGeneral Assembly \nDistr.: General \n15 December 2017 \n \n17-22135 (E)    191217 \n*1722135* \n \n \nSeventy-second session \nAgenda item 62 \n \n \n \n \n Resolution adopted by the General Assembly \non 7 December 2017 \n \n \n \n \n[on the report of the Special Political and Decolonization Committee \n(Fourth Committee) (A/72/456)] \n \n \n 72/102. Question of Guam \n \n \n \nThe General Assembly,  \n \nHaving considered the question of Guam and examined the relevant chapter of \nthe report of the Special Committee on the Situation with regard to the \nImplementation of the Declaration on the Granting of Independence to Colonial \nCountries and Peoples for 2017,1  \n \nTaking note of the working paper prepared by the Secretariat on Guam 2 and \nother relevant information,  \n \nRecognizing that all available options for self-determination of the Territory \nare valid as long as they are in accordance with the freely expressed wishes of the \npeople of Guam and in conformity with the clearly defined principles contained in \nGeneral Assembly resolutions 1514 (XV) of 14 December 1960, 1541 (XV) of \n15 December 1960 and other resolutions of the Assembly,  \n \nExpressing concern that 57 years after the adoption of the Declaration on the \nGranting of Independence to Colonial Countries and Peoples, 3 there still remain \n17 Non-Self-Governing Territories, including Guam,  \n \nConscious of the importance of continuing the effective implementation of the \nDeclaration, taking into account the target set by the United Nations to eradicate \ncolonialism by 2020 and the plans of action for the Second 4 and Third International \nDecades for the Eradication of Colonialism,  \n__________________ \n \n1  Official Records of the General Assembly, Seventy-second Session, Supplement No. 23 (A/72/23), \nchap. X. \n \n2  A/AC.109/2017/9. \n \n3  Resolution 1514 (XV). \n \n4  A/56/61, annex. \n\nA/RES/72/102 \nQuestion of Guam\n \n17-22135 \n2/6 \n \n \nRecognizing that the specific characteristics and the aspirations of the people \nof Guam require flexible, practical and innovative approaches to the options for \nself-determination, without any prejudice to territorial size, geographical location, \nsize of population or natural resources,  \n \nConvinced that the wishes and aspirations of the people of the Territory should \ncontinue to guide the development of their future political status and that \nreferendums, free and fair elections and other forms of popular consultation play an \nimportant role in ascertaining the wishes and aspirations of the people,  \n \nConcerned by the use and exploitation of the natural resources of the Non-Self-\nGoverning Territories by the administering Powers for their benefit, by the use of the \nTerritories as tax havens to the detriment of the world economy and by the \nconsequences of any economic activities of the administering Powers that are contrary \nto the interests of the people of the Territories, as well as to resolution 1514 (XV),  \n \nConvinced that any negotiations to determine the status of the Territory must \ntake place with the active involvement and participation of the people of the \nTerritory, under the auspices of the United Nations, on a case-by-case basis, and that \nthe views of the people of Guam in respect of their right to self-determination \nshould be ascertained,  \n \nNoting the continued cooperation of the Non-Self-Governing Territories at the \nlocal and regional levels, including participation in the work of regional \norganizations,  \n \nMindful that, in order for the Special Committee to enhance its understanding \nof the political status of the people of Guam and to fulfil its mandate effectively, it \nis important for it to be apprised by the United States of America as the \nadministering Power and to receive information from other appropriate sources, \nincluding the representatives of the Territory, concerning the wishes and aspirations \nof the people of the Territory,  \n \nAware of the importance both to Guam and to the Special Committee of the \nparticipation of elected and appointed representatives of Guam in the work of the \nCommittee,  \n \nRecognizing the need for the Special Committee to ensure that the appropriate \nbodies of the United Nations actively pursue a public awareness campaign aimed at \nassisting the people of Guam with their inalienable right to self-determination and \nin gaining a better understanding of the options for self-determination, on a case-by-\ncase basis,  \n \nMindful, in that connection, that the holding of regional seminars in the \nCaribbean and Pacific regions and at Headquarters, with the active participation of \nrepresentatives of the Non-Self-Governing Territories, provides a helpful means for \nthe Special Committee to fulfil its mandate and that the regional nature of the \nseminars, which alternate between the Caribbean and the Pacific, is a crucial \nelement in the context of a United Nations programme for ascertaining the political \nstatus of the Territories,  \n \nWelcoming the Caribbean regional seminar on the theme \u201cImplementation of \nthe Third International Decade for the Eradication of Colonialism: the future for \ndecolonization in the Non-Self-Governing Territories \u2013 what are the prospects?\u201d, \nheld by the Special Committee in Kingstown and hosted by the Government of \nSaint Vincent and the Grenadines from 16 to 18 May 2017, as a significant and \nforward-looking event, which enabled the participants to assess progress made and \naddress challenges faced in the decolonization process, review the existing working \nmethods of the Committee and renew its commitment to implementing its \nhistoric task,  \n\nQuestion of Guam \nA/RES/72/102\n \n3/6 \n17-22135 \n \n \nRecognizing the importance of the conclusions and recommendations adopted \nby the seminar, which are annexed to the report of the Special Committee 5 and \nwhich outline the findings of the seminar, including, especially, the way forward for \nthe decolonization process within the context of the proclamation by the General \nAssembly of the period 2011\u20132020 as the Third International Decade for the \nEradication of Colonialism,6  \n \nNoting with appreciation the contribution to the development of some \nTerritories by the specialized agencies and other organizations of the United Nations \nsystem, in particular the Economic Commission for Latin America and the \nCaribbean, the Economic and Social Commission for Asia and the Pacific, the \nUnited Nations Development Programme and the World Food Programme, as well \nas regional institutions such as the Caribbean Development Bank, the Caribbean \nCommunity, the Organization of Eastern Caribbean States, the Pacific Islands \nForum and the agencies of the Council of Regional Organizations in the Pacific,  \n \nNoting the statement made by a representative of the Governor of Guam at the \n2017 Caribbean regional seminar, at which participants received updates on the \nfinancial and non-financial challenges faced by the Territory and the efforts towards \ndecolonization, including endeavours made by the Guam Commission on \nDecolonization for the Implementation and Exercise of Chamorro Self-\nDetermination through the education campaign to help the native inhabitants better \nunderstand the decolonization process, the plebiscite on self-determination and the \npolitical status options to be voted on,  \n \nCognizant of the efforts made by the Guam Commission on Decolonization to \npromote in the Territory the holding of a plebiscite on self-determination, to \npopulate the decolonization registry and to move forward with its education \ncampaign, and noting that more than 11,000 native inhabitants have been registered \nto vote, a significant increase since 2000,  \n \nNoting with concern a ruling by a federal court of the United States, as the \nadministering Power, in March 2017, that a plebiscite on self-determination could \nnot be limited to native inhabitants, which has brought the plebiscite to a halt,  \n \nNoting, in this regard, the request by a representative of the Governor of Guam \nat the 2017 Caribbean regional seminar that the Special Committee urge the \nadministering Power to assume its responsibility in allowing the people of Guam to \nfully exercise their inalienable right to self-determination and help Guam to develop \nideas on how to overcome the current challenges hindering its ability to reach self-\ngovernance,  \n \nRecalling that the administering Power has approved a grant to support the \nself-determination education campaign in the Territory,  \n \nRecalling also that, in a referendum held in 1987, the registered and eligible \nvoters of Guam endorsed a draft Guam Commonwealth Act that would establish a \nnew framework for relations between the Territory and the administering Power, \nproviding for a greater measure of internal self-government for Guam and \nrecognition of the right of the Chamorro people of Guam to self-determination for \nthe Territory,  \n \nAware that negotiations between the administering Power and the territorial \nGovernment on the draft Guam Commonwealth Act ended in 1997 and that Guam \nhas subsequently established a non-binding plebiscite process for a self-\ndetermination vote by the eligible Chamorro voters,  \n__________________ \n \n5  Official Records of the General Assembly, Seventy-second Session, Supplement No. 23 (A/72/23). \n \n6  See resolution 65/119. \n\nA/RES/72/102 \nQuestion of Guam\n \n17-22135 \n4/6 \n \n \nCognizant of the importance of the administering Power continuing to \nimplement its programme of transferring surplus federal land to the Government \nof Guam,  \n \nNoting a call for reform in the programme of the administering Power with \nrespect to the thorough, unconditional and expeditious transfer of land property to \nthe people of Guam,  \n \nNoting also the concerns expressed by a representative of the Governor of \nGuam at the 2017 Caribbean regional seminar regarding a potential lawsuit by the \nadministering Power over the Chamorro Land Trust programme, which had been put \nin place to facilitate the transfer of land to the original landowners,  \n \nNoting further the expressed desire of the territorial Government for a visiting \nmission by the Special Committee, \n \nAware of the existing concerns of the Territory regarding the potential social, \ncultural, economic and environmental impacts of the planned transfer of additional \nmilitary personnel of the administering Power to the Territory,  \n \nAware also of the concerns expressed by the Territory on this subject before \nthe Special Political and Decolonization Committee (Fourth Committee) at the \nseventy-second session of the General Assembly,  \n \nRecalling the statement made by the Speaker of the thirty-third Guam \nlegislature before the Fourth Committee at the seventieth session of the General \nAssembly that the most acute threat to the legitimate exercise of the decolonization \nof Guam was the incessant militarization of the island by its administering Power, \nand noting the concern expressed regarding the effect of the escalating military \nactivities and installations of the administering Power on Guam,  \n \nRecalling also its resolution 57/140 of 11 December 2002, in which it \nreiterated that military activities and arrangements by administering Powers in the \nNon-Self-Governing Territories under their administration should not run counter to \nthe rights and interests of the peoples of the Territories concerned, especially their \nright to self-determination, including independence, and called upon the \nadministering Powers concerned to terminate such activities and to eliminate the \nremaining military bases in compliance with the relevant resolutions of the General \nAssembly,  \n \nNoting the concerns raised by the Territory before the Fourth Committee at the \nseventy-second session of the General Assembly about the involuntary placement of \nthe Territory in the midst of regional tensions,  \n \nRecalling its resolution 35/118 of 11 December 1980, and conscious that \nimmigration into Guam has resulted in the indigenous Chamorros becoming a \nminority in their homeland,  \n \n1. \nReaffirms the inalienable right of the people of Guam to self-\ndetermination, in conformity with the Charter of the United Nations and with \nGeneral Assembly resolution 1514 (XV), containing the Declaration on the Granting \nof Independence to Colonial Countries and Peoples;  \n \n2. \nAlso reaffirms that, in the process of the decolonization of Guam, there is \nno alternative to the principle of self-determination, which is also a fundamental \nhuman right, as recognized under the relevant human rights conventions;  \n \n3. \nFurther reaffirms that it is ultimately for the people of Guam to \ndetermine freely their future political status in accordance with the relevant \nprovisions of the Charter, the Declaration and the relevant resolutions of the General \nAssembly, and in that connection calls upon the administering Power, in cooperation \n\nQuestion of Guam \nA/RES/72/102\n \n5/6 \n17-22135 \n \nwith the territorial Government and appropriate bodies of the United Nations \nsystem, to develop political education programmes for the Territory in order to \nfoster an awareness among the people of their right to self-determination in \nconformity with the legitimate political status options, based on the principles \nclearly defined in Assembly resolution 1541 (XV) and other relevant resolutions and \ndecisions;  \n \n4. \nWelcomes the convening of the Guam Commission on Decolonization for \nthe Implementation and Exercise of Chamorro Self-Determination and its ongoing \nwork on a self-determination vote, as well as its public education efforts;  \n \n5. \nStresses that the decolonization process in Guam should be compatible \nwith the Charter, the Declaration on the Granting of Independence to Colonial \nCountries and Peoples and the Universal Declaration of Human Rights; 7  \n \n6. \nCalls once again upon the administering Power to take into consideration \nthe expressed will of the Chamorro people as supported by Guam voters in the \nreferendum of 1987 and as subsequently provided for in Guam law regarding \nChamorro self-determination efforts, encourages the administering Power and the \nterritorial Government to enter into negotiations on the matter, and stresses the need \nfor continued close monitoring of the overall situation in the Territory;  \n \n7. \nRequests the administering Power, in cooperation with the territorial \nGovernment, to continue to transfer land to the original landowners of the Territory, \nto continue to recognize and to respect the political rights and the cultural and \nethnic identity of the Chamorro people of Guam and to take all measures necessary \nto address the concerns of the territorial Government with regard to the question of \nimmigration;  \n \n8. \nAlso requests the administering Power to assist the Territory by \nfacilitating public outreach efforts, consistent with Article 73 b of the Charter, and \nin that regard welcomes the financial assistance granted by the administering Power \nin support of the decolonization educational campaign, calls upon the relevant \nUnited Nations organizations to provide assistance to the Territory, if requested, and \nwelcomes the recent outreach work by the territorial Government;  \n \n9. \nFurther requests the administering Power to cooperate in establishing \nprogrammes for the sustainable development of the economic activities and \nenterprises of the Territory, noting the special role of the Chamorro people in the \ndevelopment of Guam;  \n \n10. Stresses the importance of the Special Committee on the Situation with \nregard to the Implementation of the Declaration on the Granting of Independence to \nColonial Countries and Peoples being apprised of the views and wishes of the \npeople of Guam and enhancing its understanding of their conditions, including the \nnature and scope of the existing political and constitutional arrangements between \nGuam and the administering Power;  \n \n11. \nCalls upon the administering Power to participate in and cooperate fully \nwith the work of the Special Committee in order to implement the provisions of \nArticle 73 e of the Charter and the Declaration and in order to advise the Committee \non the implementation of the provisions under Article 73 b of the Charter on efforts \nto promote self-government in Guam, and encourages the administering Power to \nfacilitate visiting and special missions to the Territory;  \n__________________ \n \n7  Resolution 217 A (III). \n\nA/RES/72/102 \nQuestion of Guam\n \n17-22135 \n6/6 \n \n \n12. Also calls upon the administering Power to facilitate a visiting mission to \nthe Territory, and requests the Chair of the Special Committee to take all the steps \nnecessary to that end;  \n \n13. Reaffirms the responsibility of the administering Power under the Charter \nto promote the economic and social development and preserve the cultural identity \nof the Territory, and requests the administering Power to take steps to enlist and \nmake effective use of all possible assistance, on both a bilateral and a multilateral \nbasis, in the strengthening of the economy of the Territory;  \n \n14. Takes into account the 2030 Agenda for Sustainable Development, 8 \nincluding the Sustainable Development Goals, stresses the importance of fostering \nthe economic and social sustainable development of the Territory by promoting \nsustained, inclusive and equitable economic growth, creating greater opportunities \nfor all, reducing inequalities, raising basic standards of living, fostering equitable \nsocial development and inclusion and promoting the integrated and sustainable \nmanagement of natural resources and ecosystems that supports, inter alia, economic, \nsocial and human development, while facilitating ecosystem conservation, \nregeneration, restoration and resilience in the face of new and emerging challenges, \nand strongly urges the administering Power to refrain from undertaking any kind of \nillicit, harmful and unproductive activities, including the use of the Territory as a \ntax haven, that are not aligned with the interests of the people of the Territory;  \n \n15. Requests the Territory and the administering Power to take all measures \nnecessary to protect and conserve the environment of the Territory against any \ndegradation and the impact of militarization on the environment, and once again \nrequests the specialized agencies concerned to monitor environmental conditions in \nthe Territory and to provide assistance to the Territory, consistent with their \nprevailing rules of procedure;  \n \n16. Requests the Secretary-General to report on the environmental impact of \nthe military activities of the administering Power in the Territory;  \n \n17. Requests the Special Committee to continue to examine the question of \nGuam and to report thereon to the General Assembly at its seventy-third session and \non the implementation of the present resolution. \n \n66th plenary meeting  \n7 December 2017 \n \n__________________ \n \n8  Resolution 70/1. \n",
  "paragraphs": {
    "1": "Reaffirms the inalienable right of the people of Guam to self- determination, in conformity with the Charter of the United Nations and with General Assembly resolution 1514 (XV), containing the Declaration on the Granting of Independence to Colonial Countries and Peoples;",
    "2": "Also reaffirms that, in the process of the decolonization of Guam, there is no alternative to the principle of self-determination, which is also a fundamental human right, as recognized under the relevant human rights conventions;",
    "3": "Further reaffirms that it is ultimately for the people of Guam to determine freely their future political status in accordance with the relevant provisions of the Charter, the Declaration and the relevant resolutions of the General Assembly, and in that connection calls upon the administering Power, in cooperation Question of Guam A/RES/72/102 5/6 17-22135 with the territorial Government and appropriate bodies of the United Nations system, to develop political education programmes for the Territory in order to foster an awareness among the people of their right to self-determination in conformity with the legitimate political status options, based on the principles clearly defined in Assembly resolution 1541 (XV) and other relevant resolutions and decisions;",
    "4": "Welcomes the convening of the Guam Commission on Decolonization for the Implementation and Exercise of Chamorro Self-Determination and its ongoing work on a self-determination vote, as well as its public education efforts;",
    "5": "Stresses that the decolonization process in Guam should be compatible with the Charter, the Declaration on the Granting of Independence to Colonial Countries and Peoples and the Universal Declaration of Human Rights; 7",
    "6": "Calls once again upon the administering Power to take into consideration the expressed will of the Chamorro people as supported by Guam voters in the referendum of 1987 and as subsequently provided for in Guam law regarding Chamorro self-determination efforts, encourages the administering Power and the territorial Government to enter into negotiations on the matter, and stresses the need for continued close monitoring of the overall situation in the Territory;",
    "7": "Requests the administering Power, in cooperation with the territorial Government, to continue to transfer land to the original landowners of the Territory, to continue to recognize and to respect the political rights and the cultural and ethnic identity of the Chamorro people of Guam and to take all measures necessary to address the concerns of the territorial Government with regard to the question of immigration;",
    "8": "Also requests the administering Power to assist the Territory by facilitating public outreach efforts, consistent with Article 73 b of the Charter, and in that regard welcomes the financial assistance granted by the administering Power in support of the decolonization educational campaign, calls upon the relevant United Nations organizations to provide assistance to the Territory, if requested, and welcomes the recent outreach work by the territorial Government;",
    "9": "Further requests the administering Power to cooperate in establishing programmes for the sustainable development of the economic activities and enterprises of the Territory, noting the special role of the Chamorro people in the development of Guam;",
    "10": "Stresses the importance of the Special Committee on the Situation with regard to the Implementation of the Declaration on the Granting of Independence to Colonial Countries and Peoples being apprised of the views and wishes of the people of Guam and enhancing its understanding of their conditions, including the nature and scope of the existing political and constitutional arrangements between Guam and the administering Power;",
    "11": "Calls upon the administering Power to participate in and cooperate fully with the work of the Special Committee in order to implement the provisions of Article 73 e of the Charter and the Declaration and in order to advise the Committee on the implementation of the provisions under Article 73 b of the Charter on efforts to promote self-government in Guam, and encourages the administering Power to facilitate visiting and special missions to the Territory; __________________ 7 Resolution 217 A (III). A/RES/72/102 Question of Guam 17-22135 6/6",
    "12": "Also calls upon the administering Power to facilitate a visiting mission to the Territory, and requests the Chair of the Special Committee to take all the steps necessary to that end;",
    "13": "Reaffirms the responsibility of the administering Power under the Charter to promote the economic and social development and preserve the cultural identity of the Territory, and requests the administering Power to take steps to enlist and make effective use of all possible assistance, on both a bilateral and a multilateral basis, in the strengthening of the economy of the Territory;",
    "14": "Takes into account the 2030 Agenda for Sustainable Development, 8 including the Sustainable Development Goals, stresses the importance of fostering the economic and social sustainable development of the Territory by promoting sustained, inclusive and equitable economic growth, creating greater opportunities for all, reducing inequalities, raising basic standards of living, fostering equitable social development and inclusion and promoting the integrated and sustainable management of natural resources and ecosystems that supports, inter alia, economic, social and human development, while facilitating ecosystem conservation, regeneration, restoration and resilience in the face of new and emerging challenges, and strongly urges the administering Power to refrain from undertaking any kind of illicit, harmful and unproductive activities, including the use of the Territory as a tax haven, that are not aligned with the interests of the people of the Territory;",
    "15": "Requests the Territory and the administering Power to take all measures necessary to protect and conserve the environment of the Territory against any degradation and the impact of militarization on the environment, and once again requests the specialized agencies concerned to monitor environmental conditions in the Territory and to provide assistance to the Territory, consistent with their prevailing rules of procedure;",
    "16": "Requests the Secretary-General to report on the environmental impact of the military activities of the administering Power in the Territory;",
    "17": "Requests the Special Committee to continue to examine the question of Guam and to report thereon to the General Assembly at its seventy-third session and on the implementation of the present resolution. 66th plenary meeting 7 December 2017 __________________ 8 Resolution 70/1."
  },
  "agenda_items": [
    "Item 62"
  ],
  "symbol_references": []
}