{
  "symbol": "A/RES/75/275",
  "filename": "A_RES_75_275.pdf",
  "title": "75/275. Solidarity with and support for the Government and people of Saint Vincent and the Grenadines, as well as neighbouring countries affected by the impact of the eruptions of La Soufri\u00e8re volcano",
  "text": "United Nations \nA/RES/75/275\n \n \nGeneral Assembly \nDistr.: General \n29 April 2021 \n \n21-05672 (E)    040521 \n*2105672* \n \n \nSeventy-fifth session \nAgenda item 73 (a) \nStrengthening of the coordination of humanitarian and \ndisaster relief assistance of the United Nations, including \nspecial economic assistance: strengthening of the \ncoordination of emergency humanitarian assistance of the \nUnited Nations \n \n \n \n \n Resolution adopted by the General Assembly \non 28 April 2021 \n \n \n \n \n[without reference to a Main Committee (A/75/L.80 and A/75/L.80/Add.1)] \n \n \n 75/275. Solidarity with and support for the Government and people of \nSaint Vincent and the Grenadines, as well as neighbouring countries \naffected by the impact of the eruptions of La Soufri\u00e8re volcano \n \n \n \nThe General Assembly, \n \nGuided by the purposes and principles of the Charter of the United Nations, \n \nReaffirming its resolution 46/182 of 19 December 1991, the annex to which \ncontains the guiding principles for the strengthening of the coordination of emergency \nhumanitarian assistance of the United Nations system, as well as all its resolutions on \ninternational cooperation on humanitarian assistance in the field of natural disasters, \nfrom relief to development, and recalling the resolutions of the humanitarian \nsegments of the substantive sessions of the Economic and Social Council, \n \nReaffirming also the principles of humanity, neutrality, impartiality and \nindependence for the provision of humanitarian assistance, \n \nDeeply concerned about the serious consequences of the explosive eruptions of \nLa Soufri\u00e8re volcano in Saint Vincent and the Grenadines since 9 April 2021, which \nhave resulted in the displacement of residents and the loss of livelihoods, food \nsecurity and nutrition, health security and access to social infrastructure, and about \nthe urgent need to restore normal conditions for the population, \n \nConcerned about the effects of the ongoing eruptions of La Soufri\u00e8re volcano \non basic infrastructure and other areas and on the economies of the neighbouring \ncountries, which could adversely affect the economic and social development plans \nof those countries, \n\nA/RES/75/275 \nSolidarity with and support for the Government and people \nof Saint Vincent and the Grenadines, as well as \nneighbouring countries affected by the impact of the \neruptions of La Soufri\u00e8re volcano\n \n21-05672\n2/2 \n \n \nNoting with concern the elevated public health risk of the spread of the \ncoronavirus disease (COVID-19) among persons offered refuge both within and \nbeyond the national territory of Saint Vincent and the Grenadines, in particular in the \nabsence of the equitable distribution of COVID-19 vaccines, \n \nUnderlining the special needs and challenges of Saint Vincent and the \nGrenadines and the affected neighbouring countries as small island developing States, \nand recognizing the additional challenges and constraints facing those countries in \nthe aftermath of the eruptions of La Soufri\u00e8re volcano, \n \nRecognizing that the great efforts that the Government of Saint Vincent and the \nGrenadines is making to improve the quality of life for all Vincentians and the \nimplementation of the country\u2019s National Economic and Social Development Plan \n(2013\u20132025), in line with the Sustainable Development Goals, 1 have been hampered \nby this natural disaster, \n \nWelcoming the generous and immediate assistance that has been provided by the \nCaribbean Community and neighbouring countries, and by other States and national, \nregional and international organizations, in particular the United Nations system, to \nalleviate this emergency situation in Saint Vincent and the Grenadines, \n \nWelcoming also the launch of a United Nations funding appeal and response \nplan by the United Nations team for the Eastern Caribbean to mobilize the solidarity \nof the international community in extending humanitarian assistance and recovery \nsupport to Saint Vincent and the Grenadines, as well as neighbouring countries \naffected by the impact of the eruptions of La Soufri\u00e8re volcano, \n \n1. \nExpresses its solidarity and support to the Government and people of Saint \nVincent and the Grenadines, as well as affected neighbouring countries; \n \n2. \nInvites the international community to continue efforts to increase support, \nand encourages the international financial institutions and organizations to continue \nto contribute and to respond generously for the duration of the emergency and of the \nrehabilitation process in Saint Vincent and the Grenadines, as well as affected \nneighbouring countries; \n \n3. \nRequests the Secretary-General, to the extent of his authority, to support \nthe rehabilitation efforts that are being made by the Government of Saint Vincent and \nthe Grenadines, as well as affected neighbouring countries. \n \n62nd plenary meeting \n28 April 2021 \n \n__________________ \n \n1 See resolution 70/1. \n",
  "paragraphs": {
    "1": "Expresses its solidarity and support to the Government and people of Saint Vincent and the Grenadines, as well as affected neighbouring countries;",
    "2": "Invites the international community to continue efforts to increase support, and encourages the international financial institutions and organizations to continue to contribute and to respond generously for the duration of the emergency and of the rehabilitation process in Saint Vincent and the Grenadines, as well as affected neighbouring countries;",
    "3": "Requests the Secretary-General, to the extent of his authority, to support the rehabilitation efforts that are being made by the Government of Saint Vincent and the Grenadines, as well as affected neighbouring countries."
  },
  "agenda_items": [
    "Item 73"
  ],
  "symbol_references": [
    "A/75/L.80"
  ]
}