{
  "symbol": "A/RES/80/170",
  "filename": "A_RES_80_170.pdf",
  "title": "80/170. Strengthening and promoting the international treaty framework",
  "text": "United Nations \nA/RES/80/170 \n \nGeneral Assembly \nDistr.: General \n19 December 2025 \n25-20871 (E) \n*2520871* \n \n \nEightieth session \nAgenda item 87 \nStrengthening and promoting the international \ntreaty framework \n \n \n \n \n Resolution adopted by the General Assembly \non 15 December 2025 \n \n \n[on the report of the Sixth Committee (A/80/457, para. 7)] \n \n \n 80/170. Strengthening and promoting the international treaty framework \n \n \n \nThe General Assembly, \n \nRecalling its resolutions 23 (I) of 10 February 1946, 97 (I) of 14 December \n1946, 364 B (IV) of 1 December 1949, 482 (V) of 12 December 1950, 32/144 of \n16 December 1977, 33/141 A of 19 December 1978, 51/158 of 16 December 1996, \n73/210 of 20 December 2018, 75/144 of 15 December 2020, 76/120 of 9 December \n2021 and 78/236 of 22 December 2023, \n \nRecalling also its resolutions 71/328 of 11 September 2017, 73/346 of \n16 September 2019, 76/268 of 10 June 2022 and 78/330 of 6 September 2024, which \nreaffirm that multilingualism is a core value of the Organization that contributes to \nthe achievement of the goals of the United Nations, and requesting the Secretary-\nGeneral to continue to make efforts to ensure that multilingualism is not undermined \nby the measures taken in response to the liquidity situation, \n \nConscious of the obligations resulting from Article 102 of the Charter of the \nUnited Nations and the importance of treaties in the development of international law \nand the international legal order,  \n \nNoting with appreciation the role of the Secretariat, in particular the Treaty \nSection of the Office of Legal Affairs, in the implementation of Article 102 of the \nCharter,  \n \nNoting that the considerable increase in the number of multilateral treaties \ndeposited with the Secretary-General and treaties submitted for registration over the \npast years has led to the growth in the volume of work carried out by the Treaty \nSection, \n \nNoting also that, while the authentic texts of registered treaties are promptly \nmade available online through the electronic treaty database, there is currently a \n\nA/RES/80/170 \nStrengthening and promoting the international treaty framework\n \n25-20871\n2/4 \n \nsignificant backlog in the publication of the United Nations Treaty Series due to the \nlimited resources available for the translation and publication process, contributing to \nthe accumulation of unpublished treaties, \n \nRecognizing the importance of the expeditious processing, registration and \npublication of treaties and treaty-related actions,  \n \nSupporting the efforts of the Secretary-General to increase the efficiency of the \nregistration and publication process within available resources and to enhance the role \nplayed by the Treaty Section in assisting Member States in this area, \n \nWelcoming the measures taken by the Treaty Section to expedite the publication \nof the United Nations Treaty Series and to provide electronic access to all of its \npublications on the website of the United Nations Treaty Collection, and recognizing \nthe role that new technology can play in the accessibility of the United Nations Treaty \nSeries, \n \nRecognizing that practice and technology have developed considerably over the \npast years, and acknowledging the importance of maintaining consistency with treaty-\nmaking practice in the international community, \n \nRecognizing also the important role performed by depositaries of multilateral \ntreaties, \n \nNoting with appreciation the role of the Treaty Section in discharging the \nfunctions entrusted to the Secretary-General as depositary of over 600 multilateral \ninstruments,  \n \nBearing in mind the provisions of the Vienna Convention on the Law of Treaties, \nadopted on 22 May 1969 by the United Nations Conference on the Law of Treaties, 1 \n \nConvinced of the need to further gather and exchange views on practice relating \nto the strengthening and promoting of the international treaty framework, \n \n1. \nRecalls Article 102 of the Charter of the United Nations, reaffirms the \nimportance of the registration and publication of treaties, as well as their accessibility, \nand stresses that the regulations to give effect to Article 102 should be useful and \nrelevant to Member States and should be kept updated to assist States in implementing \ntheir obligations thereunder; \n \n2. \nNotes that some Member States continue to consider that there remain \noutstanding issues where the regulations may need further consideration; \n \n3. \nReaffirms its support for the annual treaty event organized by the \nSecretary-General;  \n \n4. \nWelcomes the organization of workshops on treaty law and practice by the \nTreaty Section at Headquarters and at the national and regional levels as an important \ncapacity-building initiative, commends the efforts of the Treaty Section to continue \nto organize these workshops as regularly as possible, including through the use of \ninformation and communications technology when necessary owing to extraordinary \ncircumstances, and invites States and interested international organizations and \ninstitutions to continue to support this activity; \n \n5. \nAlso welcomes the holding in 2024 and 2025 of regional workshops on \ntreaty law and practice for member States of the Central American Integration System, \nfor African States and for member States of the Association of Southeast Asian \nNations; \n_______________ \n \n1 United Nations, Treaty Series, vol. 1155, No. 18232. \n\nStrengthening and promoting the international treaty framework \nA/RES/80/170\n \n3/4\n25-20871 \n \n \n6. \nExpresses its appreciation to El Salvador, Ethiopia and Singapore for \nhosting the regional workshops on treaty law and practice in San Salvador, Addis \nAbaba and Singapore; \n \n7. \nAlso expresses its appreciation to the African Union, the Economic \nCommission for Africa, the United Nations Institute for Training and Research, and \nthe Centre for International Law of the National University of Singapore for their \ncontribution to the organization of the regional workshops on treaty law and practice \nfor African States, for member States of the Central American Integration System and \nfor member States of the Association of Southeast Asian Nations, respectively; \n \n8. \nNotes that the delivery of workshops on treaty law and practice at the \nnational and regional levels is subject to the availability of funds, and invites States \nand interested organizations and institutions to make voluntary contributions to the \ntrust fund established by the Secretary-General for the Office of Legal Affairs to \nsupport the promotion of international law, towards the financing of such workshops, \nor otherwise to assist in their implementation and possible expansion, as a \ncomplement to workshops on treaty law and practice held at Headquarters; \n \n9. \nExpresses its appreciation to the Member States and interested \norganizations and institutions that have made voluntary contributions towards the \nfinancing of the workshops on treaty law and practice at the national and regional \nlevels; \n \n10. Welcomes efforts to build the capacity of States in treaty law and practice, \nand invites Member States to consider providing targeted technical assistance, upon \nrequest, at the bilateral, regional and multilateral levels, in particular to developing \ncountries, in order to develop and enhance their treaty practice, including in the use \nof information and communications technology; \n \n11. Also welcomes the efforts made to develop and enhance the United Nations \nelectronic treaty database, which provides online access to comprehensive \ninformation on the depositary functions of the Secretary-General and the registration \nand publication of treaties under Article 102 of the Charter, and encourages the \ncontinuation of such efforts in the future, while bearing in mind the challenges that \nmany developing countries face in accessing information and communications \ntechnology; \n \n12. Notes that most submissions of treaties for registration are in electronic \nformat, and encourages the Secretary-General to develop, in consultation with and on \nthe basis of feedback from Member States and within available resources, an online \ntreaty registration system to facilitate submissions of treaties for registration, as an \nadditional option to the existing ways of submission in electronic or hard-copy \nformat; \n \n13. Recognizes the importance of the legal publications prepared by the Treaty \nSection, and stresses the need to update the Summary of Practice of the Secretary-\nGeneral as Depositary of Multilateral Treaties in the light of new developments and \npractices; \n \n14. Acknowledges the efforts of the depositaries in the registration of treaties \nunder Article 102 of the Charter, and encourages the continuation of such efforts in \nthe future; \n \n15. Calls upon the Secretary-General to ensure the expedited publication of \nthe United Nations Treaty Series, in accordance with the regulations, through the \nprompt provision of editorial and translation services, to enable effective \ndissemination of and access to treaties; \n\nA/RES/80/170 \nStrengthening and promoting the international treaty framework\n \n25-20871\n4/4 \n \n \n16. Also calls upon the Secretary-General to strengthen the capacity of the \nTreaty Section to perform its responsibilities and functions under the Charter, \nmultilateral treaties deposited with the Secretary-General and relevant General \nAssembly resolutions, as well as to meet the increasing demands in the performance \nof these functions; \n \n17. Welcomes the thematic debate on \u201cThe role of technology in shaping \ntreaty-making practice\u201d; \n \n18. Takes note of the report of the Secretary-General on the role of technology \nin shaping treaty-making practice,2 submitted pursuant to its resolution 78/236 to \nsupport the thematic debate on that subtopic; \n \n19. Also takes note of the subtopics suggested by some Member States for \nconsideration for future thematic debates, and requests the Secretariat to maintain a \nnon\u2011exhaustive indicative list of such subtopics and circulate it sufficiently in advance \nof the meetings of the Sixth Committee on the agenda item; \n \n20. Decides to undertake a regular thematic debate in the Sixth Committee to \nfoster a technical exchange of views on practice relating to the strengthening and \npromoting of the international treaty framework, and in that regard invites Member \nStates to focus their comments during the debate at the eighty-second session of the \nGeneral Assembly on the subtopic \u201cThe role of international cooperation, including \nin the use of technology and capacity-building, in strengthening the international \ntreaty framework\u201d, and requests the Secretary-General to invite Governments and \ninternational organizations to submit information on their practice in this regard, and \nto provide, at its eighty-second session, a report with information on practice related \nto the subtopic taking into account these submissions; \n \n21. Decides to include in the provisional agenda of its eighty-second session \nthe item entitled \u201cStrengthening and promoting the international treaty framework\u201d. \n \n64th plenary meeting \n15 December 2025 \n \n_______________ \n \n2 A/80/132. \n",
  "paragraphs": {
    "1": "Recalls Article 102 of the Charter of the United Nations, reaffirms the importance of the registration and publication of treaties, as well as their accessibility, and stresses that the regulations to give effect to Article 102 should be useful and relevant to Member States and should be kept updated to assist States in implementing their obligations thereunder;",
    "2": "Notes that some Member States continue to consider that there remain outstanding issues where the regulations may need further consideration;",
    "3": "Reaffirms its support for the annual treaty event organized by the Secretary-General;",
    "4": "Welcomes the organization of workshops on treaty law and practice by the Treaty Section at Headquarters and at the national and regional levels as an important capacity-building initiative, commends the efforts of the Treaty Section to continue to organize these workshops as regularly as possible, including through the use of information and communications technology when necessary owing to extraordinary circumstances, and invites States and interested international organizations and institutions to continue to support this activity;",
    "5": "Also welcomes the holding in 2024 and 2025 of regional workshops on treaty law and practice for member States of the Central American Integration System, for African States and for member States of the Association of Southeast Asian Nations;",
    "6": "Expresses its appreciation to El Salvador, Ethiopia and Singapore for hosting the regional workshops on treaty law and practice in San Salvador, Addis Ababa and Singapore;",
    "7": "Also expresses its appreciation to the African Union, the Economic Commission for Africa, the United Nations Institute for Training and Research, and the Centre for International Law of the National University of Singapore for their contribution to the organization of the regional workshops on treaty law and practice for African States, for member States of the Central American Integration System and for member States of the Association of Southeast Asian Nations, respectively;",
    "8": "Notes that the delivery of workshops on treaty law and practice at the national and regional levels is subject to the availability of funds, and invites States and interested organizations and institutions to make voluntary contributions to the trust fund established by the Secretary-General for the Office of Legal Affairs to support the promotion of international law, towards the financing of such workshops, or otherwise to assist in their implementation and possible expansion, as a complement to workshops on treaty law and practice held at Headquarters;",
    "9": "Expresses its appreciation to the Member States and interested organizations and institutions that have made voluntary contributions towards the financing of the workshops on treaty law and practice at the national and regional levels;",
    "10": "Welcomes efforts to build the capacity of States in treaty law and practice, and invites Member States to consider providing targeted technical assistance, upon request, at the bilateral, regional and multilateral levels, in particular to developing countries, in order to develop and enhance their treaty practice, including in the use of information and communications technology;",
    "11": "Also welcomes the efforts made to develop and enhance the United Nations electronic treaty database, which provides online access to comprehensive information on the depositary functions of the Secretary-General and the registration and publication of treaties under Article 102 of the Charter, and encourages the continuation of such efforts in the future, while bearing in mind the challenges that many developing countries face in accessing information and communications technology;",
    "12": "Notes that most submissions of treaties for registration are in electronic format, and encourages the Secretary-General to develop, in consultation with and on the basis of feedback from Member States and within available resources, an online treaty registration system to facilitate submissions of treaties for registration, as an additional option to the existing ways of submission in electronic or hard-copy format;",
    "13": "Recognizes the importance of the legal publications prepared by the Treaty Section, and stresses the need to update the Summary of Practice of the Secretary- General as Depositary of Multilateral Treaties in the light of new developments and practices;",
    "14": "Acknowledges the efforts of the depositaries in the registration of treaties under Article 102 of the Charter, and encourages the continuation of such efforts in the future;",
    "15": "",
    "16": "Also calls upon the Secretary-General to strengthen the capacity of the Treaty Section to perform its responsibilities and functions under the Charter, multilateral treaties deposited with the Secretary-General and relevant General Assembly resolutions, as well as to meet the increasing demands in the performance of these functions;",
    "17": "Welcomes the thematic debate on \u201cThe role of technology in shaping treaty-making practice\u201d;",
    "18": "Takes note of the report of the Secretary-General on the role of technology in shaping treaty-making practice,2 submitted pursuant to its resolution 78/236 to support the thematic debate on that subtopic;",
    "19": "Also takes note of the subtopics suggested by some Member States for consideration for future thematic debates, and requests the Secretariat to maintain a non\u2011exhaustive indicative list of such subtopics and circulate it sufficiently in advance of the meetings of the Sixth Committee on the agenda item;",
    "20": "Decides to undertake a regular thematic debate in the Sixth Committee to foster a technical exchange of views on practice relating to the strengthening and promoting of the international treaty framework, and in that regard invites Member States to focus their comments during the debate at the eighty-second session of the General Assembly on the subtopic \u201cThe role of international cooperation, including in the use of technology and capacity-building, in strengthening the international treaty framework\u201d, and requests the Secretary-General to invite Governments and international organizations to submit information on their practice in this regard, and to provide, at its eighty-second session, a report with information on practice related to the subtopic taking into account these submissions;",
    "21": "Decides to include in the provisional agenda of its eighty-second session the item entitled \u201cStrengthening and promoting the international treaty framework\u201d."
  },
  "agenda_items": [
    "Item 87"
  ],
  "symbol_references": []
}