{
  "symbol": "A/RES/73/331",
  "filename": "A_RES_73_331.pdf",
  "title": "73/331. Cooperation between the United Nations and the Collective Security Treaty Organization",
  "text": "United Nations \nA/RES/73/331\n \n \nGeneral Assembly \nDistr.: General \n31 July 2019 \n \n19-12817 (E)    020819 \n*1912817* \n \n \nSeventy-third session \nAgenda item 128 (t) \n \n \n \n \n Resolution adopted by the General Assembly \non 25 July 2019 \n \n \n \n \n[without reference to a Main Committee (A/73/L.103 and A/73/L.103/Add.1)] \n \n \n 73/331. Cooperation between the United Nations and the Collective \nSecurity Treaty Organization \n \n \n \nThe General Assembly, \n \nHaving considered the report of the Secretary-General on cooperation between \nthe United Nations and regional and other organizations,1 \n \nReferring to the Articles of the Charter of the United Nations that encourage \nmeasures for regional cooperation to advance the purposes and principles of the \nUnited Nations,  \n \nReferring also to its resolution 59/50 of 2 December 2004, in which it granted \nthe Collective Security Treaty Organization observer status in the General Assembly, \n \nReferring further to its resolutions 64/256 of 2 March 2010, 65/122 of \n13 December 2010, 67/6 of 19 November 2012, 69/12 of 11 November 2014 and \n71/12 of 21 November 2016 on cooperation between the United Nations and the \nCollective Security Treaty Organization and to its Declaration on the Enhancement \nof Cooperation between the United Nations and Regional Arrangements or Agencies \nin the Maintenance of International Peace and Security, 2 \n \nReferring to all previous relevant resolutions of the Security Council, including \nresolution 1631 (2005) of 17 October 2005, and the relevant statements by its \nPresident, including those of 13 January 20103 and 6 August 2013,4 which underline \nthe importance of developing effective partnerships between the United Nations and \nregional and subregional organizations, in accordance with the Charter of the United \nNations and statutes of regional and subregional organizations,  \n__________________ \n \n1  A/73/328\u2013S/2018/592. \n \n2  Resolution 49/57, annex. \n \n3  S/PRST/2010/1; see Resolutions and Decisions of the Security Council, 1 August 2009\u201331 July \n2010 (S/INF/65). \n \n4  S/PRST/2013/12; see Resolutions and Decisions of the Security Council, 1 August 2013\u201331 July \n2014 (S/INF/69). \n\nA/RES/73/331 \nCooperation between the United Nations and the Collective \nSecurity Treaty Organization\n \n19-18217\n2/3 \n \n \nReferring also to the Joint Declaration on Cooperation between the Secretariats of \nthe United Nations and the Collective Security Treaty Organization of 18 March 2010, \n \nNoting with satisfaction that, in the 25 years since the signing of the Collective \nSecurity Treaty, the Collective Security Treaty Organization has transformed into a \nmultifunctional structure with the potential to provide an adequate response to a wide \nrange of threats and challenges within the area of its responsibility,  \n \nEncouraging the efforts by the States members of the Collective Security Treaty \nOrganization to attain objectives consistent with the purposes and principles of the \nUnited Nations,  \n \nStressing the importance of continuing to strive towards achieving a world free \nof terrorism, including through the comprehensive implementation of the United \nNations Global Counter-Terrorism Strategy5 and relevant resolutions of the United \nNations, noting also in this regard the various initiatives by member States and \nregional organizations,  \n \nCommending the practical steps of the Collective Security Treaty Organization \nfor the implementation of the United Nations Global Counter-Terrorism Strategy, \nincluding cooperation between the United Nations and the Collective Security Treaty \nOrganization in the area of counter-terrorism, in particular the signing on 9 November \n2018 of the memorandum of understanding on cooperation and interaction between \nthe secretariat of the Collective Security Treaty Organization and the United Nations \nOffice of Counter-Terrorism, \n \nWelcoming the practical contribution of the Collective Security Treaty \nOrganization to the implementation of the Political Declaration and Plan of Action on \nInternational Cooperation towards an Integrated and Balanced Strategy to Counter \nthe World Drug Problem, adopted by the General Assembly at its sixty-fourth \nsession, 6 for the period 2009\u20132019, as well as the decisions of the 2016 special \nsession of the Assembly on the world drug problem,7 and emphasizing in particular \nthe great practical importance of the regional operation of the Collective Security \nTreaty Organization \u201cKanal\u201d, conducted under the counter-narcotics strategy of the \nStates members of the Organization for the period 2015\u20132020, to combat the \nsmuggling of Afghan opiates and the cannabis group of drugs, cocaine and synthetic \nsubstances into the territory of States of the Eurasian region and to counter the \nactivities of organized drug groups and their leaders, \n \nNoting the important efforts of the Collective Security Treaty Organization \nthrough its regional operation \u201cNelegal\u201d, aimed at reducing the incidence and \nnegative impact of irregular migration,  \n \nNoting with appreciation the progress in enhancing practical cooperation based \non the memorandum of understanding between the secretariat of the Collective \nSecurity Treaty Organization and the Department of Peacekeeping Operations of the \nUnited Nations Secretariat of 28 September 2012 on peacekeeping operations, \nincluding contributions of States members of the Collective Security Treaty \nOrganization to United Nations peacekeeping operations, as well as the participation \nof United Nations representatives in Collective Security Treaty Organization \npeacekeeping training drills, \n \nWelcoming the signing on 17 January 2017 of the memorandum of understanding \nbetween the secretariat of the Collective Security Treaty Organization and the Office \nof the United Nations High Commissioner for Refugees, \n__________________ \n \n5  Resolution 60/288. \n \n6  See Official Records of the Economic and Social Council, 2009, Supplement No. 8 (E/2009/28), \nchap. I, sect. C. \n \n7  See resolution S-30/1, annex. \n\nCooperation between the United Nations and the Collective \nSecurity Treaty Organization \nA/RES/73/331\n \n3/3\n19-18217 \n \n \nNoting the firm intention of both organizations to further strengthen existing \ncooperation by developing specific proposals in the priority areas of cooperation, \n \n1. \nTakes note with appreciation of the report of the Secretary-General on \ncooperation between the United Nations and regional and other organizations, 1 and \nacknowledges in particular the development of mutually beneficial interaction \nbetween the United Nations and the Collective Security Treaty Organization;  \n \n2. \nNotes with appreciation the significant practical contribution and efforts \nof the Collective Security Treaty Organization to strengthen its peacekeeping \ncapacities and the system of regional security and stability, to counter terrorism and \ntransnational organized crime, to combat illicit trafficking in drugs and weapons, and \nirregular migration and human trafficking, and to recover from natural and human-\nmade disasters, thereby contributing to the attainment of the purposes and principles \nof the United Nations;  \n \n3. \nWelcomes the efforts of the secretariats of the United Nations and the \nCollective Security Treaty Organization to enhance coordination and cooperation in \nthe areas of mutual interest and to develop concrete modalities for such cooperation, \nand encourages them to continue their collaboration, including the exchange of \ninformation;  \n \n4. \nInvites the Secretary-General of the United Nations to continue regular \nconsultations with the Secretary-General of the Collective Security Treaty \nOrganization, through bilateral contacts and various formats, including consultations \nbetween the Secretary-General of the United Nations and the heads of regional \norganizations;  \n \n5. \nInvites the United Nations and the Collective Security Treaty Organization \nto continue their interaction in the interest of the consistent and comprehensive \nimplementation of the United Nations Global Counter-Terrorism Strategy;5  \n \n6. \nInvites increased cooperation and coordination among the specialized \nagencies and programmes of the United Nations system and the Collective Security \nTreaty Organization and the development of their direct contacts in areas of mutual \ninterest; \n \n7. \nEncourages both organizations to continue to examine possible ways to \nfurther strengthen their interaction in the area of peacekeeping;  \n \n8. \nRequests the Secretary-General of the United Nations to submit to the \nGeneral Assembly at its seventy-fifth session a report on the implementation of the \npresent resolution;  \n \n9. \nDecides to include in the provisional agenda of its seventy-fifth session, \nunder the item entitled \u201cCooperation between the United Nations and regional and \nother organizations\u201d, the sub-item entitled \u201cCooperation between the United Nations \nand the Collective Security Treaty Organization\u201d.  \n \n101st plenary meeting \n25 July 2019 \n \n",
  "paragraphs": {
    "1": "Takes note with appreciation of the report of the Secretary-General on cooperation between the United Nations and regional and other organizations, 1 and acknowledges in particular the development of mutually beneficial interaction between the United Nations and the Collective Security Treaty Organization;",
    "2": "Notes with appreciation the significant practical contribution and efforts of the Collective Security Treaty Organization to strengthen its peacekeeping capacities and the system of regional security and stability, to counter terrorism and transnational organized crime, to combat illicit trafficking in drugs and weapons, and irregular migration and human trafficking, and to recover from natural and human- made disasters, thereby contributing to the attainment of the purposes and principles of the United Nations;",
    "3": "Welcomes the efforts of the secretariats of the United Nations and the Collective Security Treaty Organization to enhance coordination and cooperation in the areas of mutual interest and to develop concrete modalities for such cooperation, and encourages them to continue their collaboration, including the exchange of information;",
    "4": "Invites the Secretary-General of the United Nations to continue regular consultations with the Secretary-General of the Collective Security Treaty Organization, through bilateral contacts and various formats, including consultations between the Secretary-General of the United Nations and the heads of regional organizations;",
    "5": "Invites the United Nations and the Collective Security Treaty Organization to continue their interaction in the interest of the consistent and comprehensive implementation of the United Nations Global Counter-Terrorism Strategy;5",
    "6": "Invites increased cooperation and coordination among the specialized agencies and programmes of the United Nations system and the Collective Security Treaty Organization and the development of their direct contacts in areas of mutual interest;",
    "7": "Encourages both organizations to continue to examine possible ways to further strengthen their interaction in the area of peacekeeping;",
    "8": "Requests the Secretary-General of the United Nations to submit to the General Assembly at its seventy-fifth session a report on the implementation of the present resolution;",
    "9": "Decides to include in the provisional agenda of its seventy-fifth session, under the item entitled \u201cCooperation between the United Nations and regional and other organizations\u201d, the sub-item entitled \u201cCooperation between the United Nations and the Collective Security Treaty Organization\u201d. 101st plenary meeting 25 July 2019"
  },
  "agenda_items": [
    "Item 128"
  ],
  "symbol_references": [
    "A/73/L.103"
  ]
}