{
  "symbol": "A/RES/73/43",
  "filename": "A_RES_73_43.pdf",
  "title": "73/43. Measures to uphold the authority of the 1925 Geneva Protocol",
  "text": "United Nations \nA/RES/73/43\n \n \nGeneral Assembly \nDistr.: General \n12 December 2018 \n \n18-21244 (E)    141218  \n*1821244* \n \n \nSeventy-third session \nAgenda item 101 (l) \n \n \n \n \n Resolution adopted by the General Assembly \non 5 December 2018 \n \n \n \n \n[on the report of the First Committee (A/73/510 and A/73/510/Corr.1)] \n \n \n \n73/43. Measures to uphold the authority of the 1925 Geneva Protocol  \n \n \n \nThe General Assembly,  \n \nRecalling its previous resolutions on the subject, in particular resolution \n71/59 of 5 December 2016,  \n \nDetermined to act with a view to achieving effective progress towards general \nand complete disarmament under strict and effective international control, \n \nRecalling the long-standing determination of the international community to \nachieve the effective prohibition of the development, production, stockpiling and use \nof chemical and biological weapons, as well as the continuing support for measures \nto uphold the authority of the Protocol for the Prohibition of the Use in War of \nAsphyxiating, Poisonous or Other Gases, and of Bacteriological Methods of Warfare, \nsigned at Geneva on 17 June 1925,1 as expressed by consensus in many previous \nresolutions, \n \nEmphasizing the necessity of easing international tension and strengthening \ntrust and confidence between States, \n \n1. \nTakes note of the note by the Secretary-General;2  \n \n2. \nRenews its previous call to all States to observe strictly the principles and \nobjectives of the Protocol for the Prohibition of the Use in War of Asphyxiating, \nPoisonous or Other Gases, and of Bacteriological Methods of Warfare,1 and reaffirms \nthe vital necessity of upholding its provisions; \n \n3. \nCalls upon those States that continue to maintain reservations to the 1925 \nGeneva Protocol to withdraw them; \n__________________ \n \n1  League of Nations, Treaty Series, vol. XCIV, No. 2138. \n \n2  A/73/91. \n\nA/RES/73/43 \nMeasures to uphold the authority of the 1925 Geneva Protocol\n \n18-21244\n2/2 \n \n \n4. \nRequests the Secretary-General to submit to the General Assembly at its \nseventy-fifth session a report on the implementation of the present resolution. \n \n45th plenary meeting  \n5 December 2018 \n \n",
  "paragraphs": {
    "1": "Takes note of the note by the Secretary-General;2",
    "2": "Renews its previous call to all States to observe strictly the principles and objectives of the Protocol for the Prohibition of the Use in War of Asphyxiating, Poisonous or Other Gases, and of Bacteriological Methods of Warfare,1 and reaffirms the vital necessity of upholding its provisions;",
    "3": "Calls upon those States that continue to maintain reservations to the 1925 Geneva Protocol to withdraw them; __________________ 1 League of Nations, Treaty Series, vol. XCIV, No. 2138. 2 A/73/91. A/RES/73/43 Measures to uphold the authority of the 1925 Geneva Protocol 18-21244 2/2",
    "4": "Requests the Secretary-General to submit to the General Assembly at its seventy-fifth session a report on the implementation of the present resolution. 45th plenary meeting 5 December 2018"
  },
  "agenda_items": [
    "Item 101"
  ],
  "symbol_references": []
}