{
  "symbol": "A/RES/72/110",
  "filename": "A_RES_72_110.pdf",
  "title": "72/110. Dissemination of information on decolonization",
  "text": "United Nations \nA/RES/72/110\n \n \nGeneral Assembly \nDistr.: General \n15 December 2017 \n \n17-22146 (E)    191217  \n*1722146* \n \n \nSeventy-second session \nAgenda item 62 \n \n \n \n \n Resolution adopted by the General Assembly \non 7 December 2017 \n \n \n \n \n[on the report of the Special Political and Decolonization Committee \n(Fourth Committee) (A/72/456)] \n \n \n \n72/110. Dissemination of information on decolonization  \n \n \n \nThe General Assembly,  \n \nHaving examined the chapter of the report of the Special Committee on the \nSituation with regard to the Implementation of the Declaration on the Granting of \nIndependence to Colonial Countries and Peoples for 2017 relating to the \ndissemination of information on decolonization and publicity for the work of the \nUnited Nations in the field of decolonization,1  \n \nRecalling its resolution 1514 (XV) of 14 December 1960, containing the \nDeclaration on the Granting of Independence to Colonial Countries and Peoples, and \nother resolutions and decisions of the United Nations concerning the dissemination \nof information on decolonization, in particular General Assembly resolution 71/121 \nof 6 December 2016,  \n \nRecognizing the need for flexible, practical and innovative approaches towards \nreviewing the options for self-determination for the peoples of Non-Self-Governing \nTerritories, with a view to implementing the plan of action for the Third International \nDecade for the Eradication of Colonialism,  \n \nReiterating the importance of dissemination of information as an instrument for \nfurthering the aims of the Declaration, and mindful of the role of world public opinion \nin effectively assisting the peoples of Non-Self-Governing Territories to achieve self-\ndetermination,  \n \nRecognizing the role played by the administering Powers in transmitting \ninformation to the Secretary-General, in accordance with the terms of Article 73 e of \nthe Charter of the United Nations,  \n__________________ \n \n1  Official Records of the General Assembly, Seventy-second Session, Supplement No. 23 (A/72/23), \nchap. III.  \n\nA/RES/72/110 \nDissemination of information on decolonization\n \n17-22146 \n2/3 \n \n \nStressing the importance of the visiting missions of the Special Committee in \ncontributing substantially to the dissemination of information on decolonization,  \n \nRecognizing that the Department of Public Information of the Secretariat, \nthrough the United Nations information centres, must play a bigger role, in \naccordance with resolutions and decisions of the United Nations, in the dissemination \nof information at the regional level on the activities of the United Nations,  \n \nRecalling the issuance by the Department of Public Information, in consultation \nwith the United Nations Development Programme, the specialized agencies and the \nSpecial Committee, of an information leaflet on assistance programmes available to \nthe Non-Self-Governing Territories,  \n \nAware of the role of non-governmental organizations in the dissemination of \ninformation on decolonization,  \n \n1. \nApproves the activities in the field of dissemination of information on \ndecolonization undertaken by the Department of Public Information and the \nDepartment of Political Affairs of the Secretariat, in accordance with the relevant \nresolutions of the United Nations on decolonization, and encourages the continued \nupdating and wide dissemination of the information leaflet on what the United \nNations can do to assist Non-Self-Governing Territories, published in accordance \nwith General Assembly resolution 61/129 of 14 December 2006, and updated for the \nUnited Nations website on decolonization;  \n \n2. \nConsiders it important to continue and expand its efforts to ensure the \nwidest possible dissemination of information on decolonization, with particular \nemphasis on the options for self-determination available for the peoples of Non-Self-\nGoverning Territories, and to this end requests the Department of Public Information, \nthrough the United Nations information centres in the relevant regions, to actively \nengage and seek new and innovative ways to disseminate material to the Non-Self-\nGoverning Territories;  \n \n3. \nRequests the Secretary-General to further enhance the information \nprovided on the United Nations decolonization website and to continue to include the \nfull series of reports of the regional seminars on decolonization, the statements and \nscholarly papers presented at those seminars and links to the full series of reports of \nthe Special Committee on the Situation with regard to the Implementation of the \nDeclaration on the Granting of Independence to Colonial Countries and Peoples;  \n \n4. \nRequests the Department of Public Information to continue its efforts to \nupdate web-based information on the assistance programmes available to the \nNon-Self-Governing Territories;  \n \n5. \nRequests the Department of Political Affairs and the Department of Public \nInformation to implement the recommendations of the Special Committee and to \ncontinue their efforts to take measures through all of the media available, including \npublications, radio, television, the Internet and social media, to give publicity to the \nwork of the United Nations in the field of decolonization and, inter alia:  \n \n(a) \nTo develop procedures to collect, prepare and disseminate, particularly to \nthe Non-Self-Governing Territories, basic material on the issue of self-determination \nof the peoples of the Territories;  \n \n(b) \nTo seek the full cooperation of the administering Powers in the discharge \nof the tasks referred to above;  \n \n(c) \nTo explore further the idea of a programme of collaboration with the \ndecolonization focal points of territorial Governments, particularly in the Pacific and \nCaribbean regions, to help to improve the exchange of information;  \n\nDissemination of information on decolonization \nA/RES/72/110\n \n3/3 \n17-22146 \n \n \n(d) \nTo encourage the involvement of non-governmental organizations in the \ndissemination of information on decolonization;  \n \n(e) \nTo encourage the involvement of the Non-Self-Governing Territories in \nthe dissemination of information on decolonization;  \n \n(f) \nTo report to the Special Committee on measures taken in the \nimplementation of the present resolution;  \n \n6. \nRequests all States, including the administering Powers, to accelerate the \ndissemination of information referred to in paragraph 2 above;  \n \n7. \nRequests the Special Committee to continue to examine this question and \nto report to the General Assembly at its seventy-third session on the implementation \nof the present resolution. \n \n66th plenary meeting  \n7 December 2017 \n \n",
  "paragraphs": {
    "1": "Approves the activities in the field of dissemination of information on decolonization undertaken by the Department of Public Information and the Department of Political Affairs of the Secretariat, in accordance with the relevant resolutions of the United Nations on decolonization, and encourages the continued updating and wide dissemination of the information leaflet on what the United Nations can do to assist Non-Self-Governing Territories, published in accordance with General Assembly resolution 61/129 of 14 December 2006, and updated for the United Nations website on decolonization;",
    "2": "Considers it important to continue and expand its efforts to ensure the widest possible dissemination of information on decolonization, with particular emphasis on the options for self-determination available for the peoples of Non-Self- Governing Territories, and to this end requests the Department of Public Information, through the United Nations information centres in the relevant regions, to actively engage and seek new and innovative ways to disseminate material to the Non-Self- Governing Territories;",
    "3": "Requests the Secretary-General to further enhance the information provided on the United Nations decolonization website and to continue to include the full series of reports of the regional seminars on decolonization, the statements and scholarly papers presented at those seminars and links to the full series of reports of the Special Committee on the Situation with regard to the Implementation of the Declaration on the Granting of Independence to Colonial Countries and Peoples;",
    "4": "Requests the Department of Public Information to continue its efforts to update web-based information on the assistance programmes available to the Non-Self-Governing Territories;",
    "5": " (d) To encourage the involvement of non-governmental organizations in the dissemination of information on decolonization; (e) To encourage the involvement of the Non-Self-Governing Territories in the dissemination of information on decolonization; (f) To report to the Special Committee on measures taken in the implementation of the present resolution;",
    "6": "Requests all States, including the administering Powers, to accelerate the dissemination of information referred to in paragraph 2 above;",
    "7": "Requests the Special Committee to continue to examine this question and to report to the General Assembly at its seventy-third session on the implementation of the present resolution."
  },
  "agenda_items": [
    "Item 62"
  ],
  "symbol_references": []
}