{
  "symbol": "A/RES/80/75",
  "filename": "A_RES_80_75.pdf",
  "title": "80/75. Effects of atomic radiation",
  "text": "United Nations \nA/RES/80/75\n \nGeneral Assembly \nDistr.: General \n8 December 2025 \n25-20095 (E) \n*2520095* \n \n \nEightieth session \nAgenda item 47 \nEffects of atomic radiation \n \n \n \n \n Resolution adopted by the General Assembly \non 5 December 2025 \n \n \n[on the report of the Special Political and Decolonization Committee \n(Fourth Committee) (A/80/537, para. 15)] \n \n \n \n80/75. Effects of atomic radiation \n \n \n \nThe General Assembly, \n \nRecalling its resolution 913 (X) of 3 December 1955, by which it established \nthe United Nations Scientific Committee on the Effects of Atomic Radiation, and its \nsubsequent resolutions on the subject, in which, inter alia, it requested the Scientific \nCommittee to continue its work, \n \nConcerned about the potentially harmful effects on present and future \ngenerations resulting from the levels of ionizing radiation to which humankind and \nthe environment are exposed, \n \nConscious of the continuing need to examine and compile information about the \nlevels of exposure to ionizing radiation and to analyse its effects on humankind and \nthe environment, and conscious also of the increasing volume, complexity and \ndiversity of that information,  \n \nAcknowledging the concerns about the radiological consequences of nuclear \naccidents and other incidents involving ionizing radiation exposure,  \n \nReaffirming the desirability of the Scientific Committee continuing its work, \nand welcoming the increased commitment of States members of the Committee,  \n \nEmphasizing the vital need for sufficient, assured and predictable funding, as \nwell as the efficient management of the work of the secretariat of the Scientific \nCommittee to arrange for its annual sessions and coordinate the development of \ndocuments based on scientific reviews of the exposures to sources of ionizing \nradiation and its effects on human health and the environment,  \n \nRecognizing the importance of the scientific work of the Scientific Committee \nand the possible need to carry out unforeseen additional work, such as after nuclear \naccidents,  \n\nA/RES/80/75 \nEffects of atomic radiation\n \n25-20095\n2/5 \n \n \nConsidering that the high quality of the work and the scientific rigour of the \nScientific Committee need to be maintained in the future,  \n \nRecognizing the importance of disseminating the findings of the Scientific \nCommittee to the scientific community and the public, and widely publicizing \nscientific knowledge about ionizing radiation, and recalling in that context \nprinciple 10 of the Rio Declaration on Environment and Development,1 \n \nNoting the need to allocate sufficient and predictable resources to support the \nScientific Committee, while recognizing the importance of voluntary contributions, \nboth in kind and to the general trust fund established by the Executive Director of the \nUnited Nations Environment Programme to support the work of the Committee,  \n \nRecognizing that sufficient staffing of the secretariat is essential to support the \nwork of the Scientific Committee, \n \nWelcoming the recruitment process for the fixed-term positions approved by the \nGeneral Assembly, \n \nUnderstanding that a continued freeze on appointments in respect of these fixed-\nterm positions will impair the operation of the Scientific Committee and delay the \ndelivery of its programme of work, \n \nCommending the secretariat of the Scientific Committee for its ongoing efforts \nto ensure the sustainable and effective work of the Committee, and encouraging all \nStates in a position to do so to provide support to the secretariat of the Committee,  \n \nRecalling the support expressed by the International Atomic Energy Agency and \nthe World Health Organization for the work of the Scientific Committee on producing \nthe most reliable and comprehensive review of sources of scientific information about \nthe levels and effects of ionizing radiation, including at low levels, which continue to \nprovide the scientific basis for the development of international safety standards and \nfor the identification of priorities for research in several areas of ionizing radiatio n \nsciences, \n \nRecognizing the importance of close cooperation between the Scientific \nCommittee and other relevant international organizations, and noting the research \nframework agreement signed with the European Commission and the memorandums \nof understanding signed with the International Commission on Radiological Protection \nand with the Nuclear Energy Agency of the Organisation for Economic Co-operation \nand Development, \n \n1. \nCommends the United Nations Scientific Committee on the Effects of \nAtomic Radiation, on its seventieth anniversary, for the valuable contribution that it \nhas made since its inception to improve knowledge and understanding of the levels, \neffects and risks of exposure to ionizing radiation and for fulfilling its mandate with \nscientific authority and independence of judgment;  \n \n2. \nReaffirms the decision to maintain the present functions and independent \nrole of the Scientific Committee; \n \n3. \nRe-emphasizes the need for the Scientific Committee to hold regular \nsessions on an annual basis so that its report will be able to reflect the latest \ndevelopments and findings in the field of ionizing radiation and thereby provide \nupdated information for dissemination among all States; \n_______________ \n \n1 Report of the United Nations Conference on Environment and Development, Rio de Janeiro, \n3\u201314 June 1992, vol. I, Resolutions Adopted by the Conference (United Nations publication, \nSales No. E.93.I.8 and corrigendum), resolution 1, annex I. \n\nEffects of atomic radiation \nA/RES/80/75\n \n3/5\n25-20095 \n \n \n4. \nNotes with appreciation the work of the Scientific Committee, takes note \nof the report on its seventy-second session,2 and encourages the Committee, over its \ncoming sessions, to continue to work towards implementing strategies to support its \nlong-term efforts to serve the scientific community, as well as wider audiences; \n \n5. \nWelcomes the decisions on the outlined future programme of work for the \nperiod 2025\u20132029, provided that sufficient resources are available in the secretariat, \nthat will serve to guide the priority areas of the Scientific Committee; \n \n6. \nNotes with appreciation the implementation of the 2022 strategy to \nimprove collection, analysis and dissemination of data on exposure to ionizing \nradiation aimed at seeking widespread participation in the Scientific Committee\u2019s \nsurveys and ensuring that future surveys adapt to changing data sources on the use of \nionizing radiation across the world; \n \n7. \nWelcomes the extension of the mandate of the ad hoc working group on \neffects and mechanisms and the ad hoc working group on sources and exposure to \nassist the Scientific Committee in supporting and monitoring progress in the \nimplementation of its programme of work, to evaluate new scientific developments \nrelevant to the Committee and to monitor the implementation of the updated strategy \nfor data collection; \n \n8. \nSupports the Scientific Committee in continuing to conduct its programme \nof work of scientific review and assessment on behalf of the General Assembly, and \nwelcomes further progress, in particular on its evaluation on effects of ionizing \nradiation on the nervous system, and recognizes the decision of the Committee to \ndefer the completion of the evaluation to 2029;  \n \n9. \nWelcomes the two substantive scientific reports adopted by the Scientific \nCommittee during its seventy-second session, on epidemiological studies of ionizing \nradiation and cancer and on the evaluation of effects of ionizing radiation on the \ncirculatory system, and looks forward to the timely publication of the supporting \nscientific annexes thereto as their outcomes are relied upon by other international \norganizations; \n \n10. Also welcomes the initiation of the evaluation of effects of ionizing \nradiation on the eye in 2025, and the planned commencement of the data collection \nfor the evaluation on medical exposure in 2026, subject to the availability of resources \nin the secretariat;  \n \n11. \nRecognizes the intention of the Scientific Committee to postpone to its \nseventy-third session the decision on the starting date of the upcoming evaluations on \neffects of ionizing radiation on the immune system and on levels of radiation exposure \nto and effects on wildlife populations and ecosystems, subject to the availability of \nresources in the secretariat; \n \n12. Requests the Scientific Committee to continue its work, including its \nimportant activities to disseminate knowledge of the levels, effects and risks of \nionizing radiation from all sources, and to report thereon to the General Assembly at \nits eighty-first session; \n \n13. Acknowledges the importance of sharing data with the Scientific \nCommittee as appropriate, and the central role played by the increasing number of \nNational Contact Persons and Alternate National Contact Persons in order to \ncoordinate data collection at the country level and to cooperate with technical experts \nto complete Committee questionnaires; \n_______________ \n \n2 Official Records of the General Assembly, Eightieth Session, Supplement No. 46 (A/80/46). \n\nA/RES/80/75 \nEffects of atomic radiation\n \n25-20095\n4/5 \n \n \n14. Encourages National Contact Persons and their alternates to take part in \nthe Scientific Committee\u2019s global surveys and submit available scientific data on \nradiation exposure of patients, workers and the general public as appropriate; \n \n15. Recalls the strategy of the Scientific Committee to improve data \ncollection, encourages in this regard Member States, the organizations of the United \nNations system and non\u2011governmental organizations concerned to provide further \nrelevant data about levels, effects and risks of exposure to ionizing radiation from \nvarious sources, which would greatly help in the preparation of future reports of the \nCommittee to the General Assembly, and encourages relevant organizations to further \ncollaborate with the secretariat on arrangements for the collection, analysis and \ndissemination of data on radiation exposures of patients, workers and the general \npublic;  \n \n16. Welcomes the planned development of an online platform for collecting \ndata on the exposure of patients, workers and the general public, subject to the \navailability of resources in the secretariat, and urges Member States to take part in the \nScientific Committee\u2019s planned global survey on medical exposure and to nominate \nNational Contact Persons to facilitate coordination of the collection and submission \nof data on the radiation exposure of patients; \n \n17. Invites the Scientific Committee to continue its consultations with \nscientists and experts from interested Member States in the process of preparing its \nfuture scientific reports, and requests the secretariat to continue to facilitate such \nconsultations; \n \n18. Welcomes, in this context, the readiness of Member States to provide the \nScientific Committee with relevant information on the levels and effects of ionizing \nradiation, and invites the Committee to analyse and give due consideration to such \ninformation, particularly in the light of its own findings;  \n \n19. Requests the secretariat to monitor the timely publication of approved \nreports and to strive to publish them within 12 months of their approval; \n \n20. Encourages the relevant agencies of the United Nations system, and other \ninternational bodies, to continue to use the Scientific Committee\u2019s evaluations as the \nscientific basis for the establishment of international safety standards;  \n \n21. Welcomes the Scientific Committee\u2019s outreach strategy for the period \n2025\u20132029, focusing on strengthening the Committee\u2019s input to the science-policy \ninterface within and outside the extensive United Nations network, enhancing \nengagement with scientific, diplomatic, academic and professional communities, \nsubject to the availability of resources in the secretariat and encouraging the \ninvolvement of young professionals in the work of the Committee;  \n \n22. Notes the online publication of the United Nations Environment \nProgramme booklet entitled Radiation: Effects and Sources in 16 different languages, \nand encourages its wide dissemination and periodic update, as appropriate, on the \nbasis of the most recent Scientific Committee reports and annexes;  \n \n23. Welcomes the ongoing work of the secretariat to publish the website of the \nScientific Committee in all official languages of the United Nations; \n \n24. Requests the United Nations Environment Programme to continue, within \nexisting United Nations resources, to provide the secretariat for the Scientific \nCommittee, while respecting the Committee\u2019s independent mandate and methods of \noperation, and to disseminate its findings to Member States, the scientific community \nand the public and to ensure that the administrative measures in place are appropriate \n\nEffects of atomic radiation \nA/RES/80/75\n \n5/5\n25-20095 \n \nso that the secretariat is able to adequately and efficiently service the Committee in a \npredictable and sustainable manner; \n \n25. Requests the Secretary-General to assess possible options for servicing \narrangements for the secretariat in the framework of the UN80 Initiative and to keep \nMember States informed; \n \n26. Encourages the Scientific Committee to stand ready to carry out unplanned \nadditional work, in strict compliance with its mandate, and in coordination with the \nInternational Atomic Energy Agency and other relevant international organizations, \nas appropriate, such as after nuclear accidents, that could include those in the context \nof military actions or natural disasters; \n \n27. Welcomes the augmentation of the regular budget of the Scientific \nCommittee in 2023 as decided after the seventy-eighth session of the General \nAssembly, allowing in particular to sustain the capacities of the secretariat to support \nthe Committee, and acknowledges the temporary hiring freeze, due to the ongoing \nliquidity crisis faced by the United Nations; \n \n28. Expresses strong expectations that, subject to measures required to manage \nthe liquidity constraints, the regular budget of the Scientific Committee will remain \nin full, and that the United Nations Environment Programme will finalize the \nrecruitment process for the fixed-term positions allocated to the secretariat, to \nimplement the Committee\u2019s programme of work as referred to above; \n \n29. Requests the Secretary-General to strengthen support for the secretariat, as \ndecided in 2023, in order to adequately and efficiently provide service to the Scientific \nCommittee in a predictable and sustainable manner, and to effectively facilitate the \nuse of the invaluable expertise offered to the Committee by its members, and to report \nto the General Assembly at its eighty-first session on these issues; \n \n30. Understands that, as the budgetary situation becomes increasingly \nchallenging, extrabudgetary support continues to be crucial for the timely \nimplementation of the programme of work to deliver on the mandate of the Scientific \nCommittee, which would require the provision of additional professional and \nadministrative secretariat services; \n \n31. Acknowledges the contributions to the general trust fund by Member States \nand the contribution of cost-free experts and technical officers; \n \n32. Encourages Member States in a position to do so to make voluntary \ncontributions to the general trust fund established by the Executive Director of the \nUnited Nations Environment Programme and also to make contributions in kind, in \norder to support the work of the Scientific Committee, and the dissemination of its \nfindings, in a sustainable manner.  \n \n55th plenary meeting \n5 December 2025 \n \n",
  "paragraphs": {
    "1": "Commends the United Nations Scientific Committee on the Effects of Atomic Radiation, on its seventieth anniversary, for the valuable contribution that it has made since its inception to improve knowledge and understanding of the levels, effects and risks of exposure to ionizing radiation and for fulfilling its mandate with scientific authority and independence of judgment;",
    "2": "Reaffirms the decision to maintain the present functions and independent role of the Scientific Committee;",
    "3": "Re-emphasizes the need for the Scientific Committee to hold regular sessions on an annual basis so that its report will be able to reflect the latest developments and findings in the field of ionizing radiation and thereby provide updated information for dissemination among all States;",
    "4": "Notes with appreciation the work of the Scientific Committee, takes note of the report on its seventy-second session,2 and encourages the Committee, over its coming sessions, to continue to work towards implementing strategies to support its long-term efforts to serve the scientific community, as well as wider audiences;",
    "5": "Welcomes the decisions on the outlined future programme of work for the period 2025\u20132029, provided that sufficient resources are available in the secretariat, that will serve to guide the priority areas of the Scientific Committee;",
    "6": "Notes with appreciation the implementation of the 2022 strategy to improve collection, analysis and dissemination of data on exposure to ionizing radiation aimed at seeking widespread participation in the Scientific Committee\u2019s surveys and ensuring that future surveys adapt to changing data sources on the use of ionizing radiation across the world;",
    "7": "Welcomes the extension of the mandate of the ad hoc working group on effects and mechanisms and the ad hoc working group on sources and exposure to assist the Scientific Committee in supporting and monitoring progress in the implementation of its programme of work, to evaluate new scientific developments relevant to the Committee and to monitor the implementation of the updated strategy for data collection;",
    "8": "Supports the Scientific Committee in continuing to conduct its programme of work of scientific review and assessment on behalf of the General Assembly, and welcomes further progress, in particular on its evaluation on effects of ionizing radiation on the nervous system, and recognizes the decision of the Committee to defer the completion of the evaluation to 2029;",
    "9": "Welcomes the two substantive scientific reports adopted by the Scientific Committee during its seventy-second session, on epidemiological studies of ionizing radiation and cancer and on the evaluation of effects of ionizing radiation on the circulatory system, and looks forward to the timely publication of the supporting scientific annexes thereto as their outcomes are relied upon by other international organizations;",
    "10": "Also welcomes the initiation of the evaluation of effects of ionizing radiation on the eye in 2025, and the planned commencement of the data collection for the evaluation on medical exposure in 2026, subject to the availability of resources in the secretariat;",
    "11": "Recognizes the intention of the Scientific Committee to postpone to its seventy-third session the decision on the starting date of the upcoming evaluations on effects of ionizing radiation on the immune system and on levels of radiation exposure to and effects on wildlife populations and ecosystems, subject to the availability of resources in the secretariat;",
    "12": "Requests the Scientific Committee to continue its work, including its important activities to disseminate knowledge of the levels, effects and risks of ionizing radiation from all sources, and to report thereon to the General Assembly at its eighty-first session;",
    "13": "Acknowledges the importance of sharing data with the Scientific Committee as appropriate, and the central role played by the increasing number of National Contact Persons and Alternate National Contact Persons in order to coordinate data collection at the country level and to cooperate with technical experts to complete Committee questionnaires;",
    "14": "Encourages National Contact Persons and their alternates to take part in the Scientific Committee\u2019s global surveys and submit available scientific data on radiation exposure of patients, workers and the general public as appropriate;",
    "15": "Recalls the strategy of the Scientific Committee to improve data collection, encourages in this regard Member States, the organizations of the United Nations system and non\u2011governmental organizations concerned to provide further relevant data about levels, effects and risks of exposure to ionizing radiation from various sources, which would greatly help in the preparation of future reports of the Committee to the General Assembly, and encourages relevant organizations to further collaborate with the secretariat on arrangements for the collection, analysis and dissemination of data on radiation exposures of patients, workers and the general public;",
    "16": "Welcomes the planned development of an online platform for collecting data on the exposure of patients, workers and the general public, subject to the availability of resources in the secretariat, and urges Member States to take part in the Scientific Committee\u2019s planned global survey on medical exposure and to nominate National Contact Persons to facilitate coordination of the collection and submission of data on the radiation exposure of patients;",
    "17": "Invites the Scientific Committee to continue its consultations with scientists and experts from interested Member States in the process of preparing its future scientific reports, and requests the secretariat to continue to facilitate such consultations;",
    "18": "Welcomes, in this context, the readiness of Member States to provide the Scientific Committee with relevant information on the levels and effects of ionizing radiation, and invites the Committee to analyse and give due consideration to such information, particularly in the light of its own findings;",
    "19": "Requests the secretariat to monitor the timely publication of approved reports and to strive to publish them within 12 months of their approval;",
    "20": "Encourages the relevant agencies of the United Nations system, and other international bodies, to continue to use the Scientific Committee\u2019s evaluations as the scientific basis for the establishment of international safety standards;",
    "21": "Welcomes the Scientific Committee\u2019s outreach strategy for the period 2025\u20132029, focusing on strengthening the Committee\u2019s input to the science-policy interface within and outside the extensive United Nations network, enhancing engagement with scientific, diplomatic, academic and professional communities, subject to the availability of resources in the secretariat and encouraging the involvement of young professionals in the work of the Committee;",
    "22": "Notes the online publication of the United Nations Environment Programme booklet entitled Radiation: Effects and Sources in 16 different languages, and encourages its wide dissemination and periodic update, as appropriate, on the basis of the most recent Scientific Committee reports and annexes;",
    "23": "Welcomes the ongoing work of the secretariat to publish the website of the Scientific Committee in all official languages of the United Nations;",
    "24": " so that the secretariat is able to adequately and efficiently service the Committee in a predictable and sustainable manner;",
    "25": "Requests the Secretary-General to assess possible options for servicing arrangements for the secretariat in the framework of the UN80 Initiative and to keep Member States informed;",
    "26": "Encourages the Scientific Committee to stand ready to carry out unplanned additional work, in strict compliance with its mandate, and in coordination with the International Atomic Energy Agency and other relevant international organizations, as appropriate, such as after nuclear accidents, that could include those in the context of military actions or natural disasters;",
    "27": "Welcomes the augmentation of the regular budget of the Scientific Committee in 2023 as decided after the seventy-eighth session of the General Assembly, allowing in particular to sustain the capacities of the secretariat to support the Committee, and acknowledges the temporary hiring freeze, due to the ongoing liquidity crisis faced by the United Nations;",
    "28": "Expresses strong expectations that, subject to measures required to manage the liquidity constraints, the regular budget of the Scientific Committee will remain in full, and that the United Nations Environment Programme will finalize the recruitment process for the fixed-term positions allocated to the secretariat, to implement the Committee\u2019s programme of work as referred to above;",
    "29": "Requests the Secretary-General to strengthen support for the secretariat, as decided in 2023, in order to adequately and efficiently provide service to the Scientific Committee in a predictable and sustainable manner, and to effectively facilitate the use of the invaluable expertise offered to the Committee by its members, and to report to the General Assembly at its eighty-first session on these issues;",
    "30": "Understands that, as the budgetary situation becomes increasingly challenging, extrabudgetary support continues to be crucial for the timely implementation of the programme of work to deliver on the mandate of the Scientific Committee, which would require the provision of additional professional and administrative secretariat services;",
    "31": "Acknowledges the contributions to the general trust fund by Member States and the contribution of cost-free experts and technical officers;",
    "32": "Encourages Member States in a position to do so to make voluntary contributions to the general trust fund established by the Executive Director of the United Nations Environment Programme and also to make contributions in kind, in order to support the work of the Scientific Committee, and the dissemination of its findings, in a sustainable manner."
  },
  "agenda_items": [
    "Item 47"
  ],
  "symbol_references": []
}