{
  "symbol": "A/RES/74/257",
  "filename": "A_RES_74_257.pdf",
  "title": "74/257. Review of the implementation of General Assembly resolutions 48/218 B, 54/244, 59/272, 64/263 and 69/253",
  "text": "United Nations \nA/RES/74/257\n \n \nGeneral Assembly \nDistr.: General \n9 January 2020 \n \n19-22723 (E)    100120 \n*1922723* \n \n \nSeventy-fourth session \nAgenda item 145 \nReview of the implementation of General Assembly \nresolutions 48/218 B, 54/244, 59/272, 64/263 and 69/253 \n \n \n \n \n Resolution adopted by the General Assembly \non 27 December 2019 \n \n \n \n \n[on the report of the Fifth Committee (A/74/605)] \n \n \n 74/257. Review of the implementation of General Assembly resolutions \n48/218 B, 54/244, 59/272, 64/263 and 69/253 \n \n \n \nThe General Assembly, \n \nRecalling its resolutions 48/218 B of 29 July 1994, 54/244 of 23 December \n1999, 59/272 of 23 December 2004, 64/263 of 29 March 2010 and 69/253 of \n29 December 2014, \n \nRecalling also its resolution 61/275 of 29 June 2007, \n \n1. \nReaffirms its resolutions 48/218 B, 54/244, 59/272, 64/263 and 69/253; \n \n2. \nAlso reaffirms its primary role in the consideration of and action taken on \nreports submitted to it; \n \n3. \nFurther reaffirms its oversight role and the role of the Fifth Committee in \nadministrative and budgetary matters; \n \n4. \nReaffirms the independence and the separate and distinct roles of the \ninternal and external oversight mechanisms; \n \n5. \nRecognizes the important roles and operational independence of the \noversight bodies, including the Office of Internal Oversight Services of the \nSecretariat, in contributing to improvements in the effectiveness, transparency and \naccountability of the Organization; \n \n6. \nRecalls that the Office shall exercise operational independence relating to \nthe performance of its internal oversight functions, under the authority of the \nSecretary-General, in accordance with the relevant resolutions; \n \n7. \nStresses that the independence and objectivity of the Office are vital in \nensuring that its internal oversight functions are carried out in a credible, factual and \n\nA/RES/74/257 \nReview of the implementation of General Assembly resolutions \n48/218 B, 54/244, 59/272, 64/263 and 69/253\n \n19-22723\n2/2 \n \nunbiased manner, and reaffirms the authority of the Office to initiate, carry out and \nreport on any action to fulfil its oversight functions; \n \n8. \nReaffirms that the purpose of the Office is to assist the Secretary-General \nin fulfilling his internal oversight responsibilities in respect of the resources and staff \nof the Organization; \n \n9. \nEmphasizes that the implementation of recommendations and the reporting \nprocedures of the Office should continue as established by the General Assembly; \n \n10. Notes the role of the Management Committee in monitoring closely the \nimplementation of the recommendations of oversight bodies, and stresses the \nimportance of follow-up with programme managers to ensure the full implementation \nof those recommendations in a prompt and timely manner, especially those critical \nrecommendations whose implementation is overdue; \n \n11. \nWelcomes the continued efforts of the Office to promote the Organization\u2019s \nzero-tolerance approach to fraud, corruption, sexual harassment and sexual \nexploitation and abuse, and the actions taken in this regard, including the creation of \na specialized team to investigate sexual harassment complaints and the \nimplementation of a procedure for addressing such complaints, and also welcomes \nthe efforts made to strengthen the investigative capacity of the Office in the light of \nthe need to improve the average time required to complete the growing number of \ninvestigations into a range of misconduct, including cases of sexual harassment; \n \n12. Requests the Secretary-General to take all measures necessary to ensure \nthat the credibility of the Organization and its staff is protected; \n \n13. Decides to evaluate and review at its seventy-ninth session the functions \nand reporting procedures of the Office and any other matter that it deems appropriate, \nand to that end to include in the provisional agenda of that session an item entitled \n\u201cReview of the implementation of General Assembly resolutions 48/218 B, 54/244, \n59/272, 64/263, 69/253 and 74/257\u201d. \n \n52nd (resumed) plenary meeting \n27 December 2019 \n \n",
  "paragraphs": {
    "1": "Reaffirms its resolutions 48/218 B, 54/244, 59/272, 64/263 and 69/253;",
    "2": "Also reaffirms its primary role in the consideration of and action taken on reports submitted to it;",
    "3": "Further reaffirms its oversight role and the role of the Fifth Committee in administrative and budgetary matters;",
    "4": "Reaffirms the independence and the separate and distinct roles of the internal and external oversight mechanisms;",
    "5": "Recognizes the important roles and operational independence of the oversight bodies, including the Office of Internal Oversight Services of the Secretariat, in contributing to improvements in the effectiveness, transparency and accountability of the Organization;",
    "6": "Recalls that the Office shall exercise operational independence relating to the performance of its internal oversight functions, under the authority of the Secretary-General, in accordance with the relevant resolutions;",
    "7": "Stresses that the independence and objectivity of the Office are vital in ensuring that its internal oversight functions are carried out in a credible, factual and A/RES/74/257 Review of the implementation of General Assembly resolutions 48/218 B, 54/244, 59/272, 64/263 and 69/253 19-22723 2/2 unbiased manner, and reaffirms the authority of the Office to initiate, carry out and report on any action to fulfil its oversight functions;",
    "8": "Reaffirms that the purpose of the Office is to assist the Secretary-General in fulfilling his internal oversight responsibilities in respect of the resources and staff of the Organization;",
    "9": "Emphasizes that the implementation of recommendations and the reporting procedures of the Office should continue as established by the General Assembly;",
    "10": "Notes the role of the Management Committee in monitoring closely the implementation of the recommendations of oversight bodies, and stresses the importance of follow-up with programme managers to ensure the full implementation of those recommendations in a prompt and timely manner, especially those critical recommendations whose implementation is overdue;",
    "11": "Welcomes the continued efforts of the Office to promote the Organization\u2019s zero-tolerance approach to fraud, corruption, sexual harassment and sexual exploitation and abuse, and the actions taken in this regard, including the creation of a specialized team to investigate sexual harassment complaints and the implementation of a procedure for addressing such complaints, and also welcomes the efforts made to strengthen the investigative capacity of the Office in the light of the need to improve the average time required to complete the growing number of investigations into a range of misconduct, including cases of sexual harassment;",
    "12": "Requests the Secretary-General to take all measures necessary to ensure that the credibility of the Organization and its staff is protected;",
    "13": "Decides to evaluate and review at its seventy-ninth session the functions and reporting procedures of the Office and any other matter that it deems appropriate, and to that end to include in the provisional agenda of that session an item entitled \u201cReview of the implementation of General Assembly resolutions 48/218 B, 54/244, 59/272, 64/263, 69/253 and 74/257\u201d. 52nd (resumed) plenary meeting 27 December 2019"
  },
  "agenda_items": [
    "Item 145"
  ],
  "symbol_references": []
}