{
  "symbol": "A/RES/72/44",
  "filename": "A_RES_72_44.pdf",
  "title": "72/44. The Arms Trade Treaty",
  "text": "United Nations \nA/RES/72/44\n \n \nGeneral Assembly \nDistr.: General \n12 December 2017 \n \n17-21721 (E)    141217 \n*1721721* \n \n \nSeventy-second session \nAgenda item 99 (x) \n \n \n \n \n Resolution adopted by the General Assembly \non 4 December 2017 \n \n \n \n \n[on the report of the First Committee (A/72/409)] \n \n \n \n72/44. The Arms Trade Treaty \n \n \n \nThe General Assembly, \n \nRecalling its resolutions 61/89 of 6 December 2006, 63/240 of 24 December \n2008, 64/48 of 2 December 2009, 67/234 A of 24 December 2012, 67/234 B of \n2 April 2013, 68/31 of 5 December 2013, 69/49 of 2 December 2014, 70/58 \nof 7 December 2015 and 71/50 of 5 December 2016 and its decision 66/518 of \n2 December 2011, \n \nRecognizing that disarmament, arms control and non-proliferation are essential \nfor the maintenance of international peace and security, \n \nRecognizing also the security, social, economic and humanitarian consequences \nof the illicit and unregulated trade in conventional arms, \n \nRecognizing further the legitimate political, security, economic and \ncommercial interests of States in the international trade in conventional arms, \n \nUnderlining the need to prevent and eradicate the illicit trade in conventional \narms and to prevent their diversion to the illicit market, or for unauthorized end use \nand end users, including the commission of terrorist acts, \n \nNoting the contribution made by the Programme of Action to Prevent, Combat \nand Eradicate the Illicit Trade in Small Arms and Light Weapons in All Its Aspects,1 \nas well as the Protocol against the Illicit Manufacturing of and Trafficking in \nFirearms, Their Parts and Components and Ammunition, supplementing the United \nNations Convention against Transnational Organized Crime, 2 and the International \nInstrument to Enable States to Identify and Trace, in a Timely and Reliable Manner, \nIllicit Small Arms and Light Weapons,3 \n__________________ \n \n1  Report of the United Nations Conference on the Illicit Trade in Small Arms and Light Weapons in \nAll Its Aspects, New York, 9\u201320 July 2001 (A/CONF.192/15), chap. IV, para. 24. \n \n2  United Nations, Treaty Series, vol. 2326, No. 39574. \n \n3  See decision 60/519 and A/60/88 and A/60/88/Corr.2, annex. \n\nA/RES/72/44 \nThe Arms Trade Treaty\n \n17-21721 \n2/3 \n \n \nHighlighting the links and synergies between the Arms Trade Treaty4 and the \n2030 Agenda for Sustainable Development,5 including Sustainable Development \nGoal 16 and target 16.4, which aims at significantly reducing illicit arms flows \nby 2030,  \n \nRecognizing the important role that civil society organizations, including \nnon-governmental organizations, and industry play, by raising awareness, in efforts \nto prevent and eradicate the unregulated and illicit trade in conventional arms and \nprevent their diversion and in supporting the implementation of the Arms Trade \nTreaty, \n \nWelcoming the adoption by the General Assembly and the entry into force of \nthe Treaty on 2 April 2013 and 24 December 2014, respectively, and noting that the \nTreaty remains open for accession by any State that has not signed it, \n \nWelcoming also the latest ratifications of the Treaty, bearing in mind that \nuniversalization of the Treaty is essential to achieving its object and purpose, \n \nNoting the efforts by the States parties to the Treaty to continue exploring \nways and means to enhance national implementation of the Treaty through the \nworking group on implementation and the voluntary trust fund for the \nimplementation of the Arms Trade Treaty, \n \n1. \nWelcomes the decisions taken at the Third Conference of States Parties to \nthe Arms Trade Treaty, held in Geneva from 11 to 15 September 2017, and notes \nthat the Fourth Conference of States Parties is to be held in Japan from 20 to \n24 August 2018, subject to the final confirmation of the Government of Japan; \n \n2. \nAlso welcomes the establishment of the standing working groups on \nimplementation, on transparency and reporting, and on universalization by the Third \nConference of States Parties as important steps in advancing the object and purpose \nof the Arms Trade Treaty;4 \n \n3. \nRecognizes that the consolidation of the institutional structure of the \nTreaty provides a framework for supporting further work under the Treaty, in \nparticular its effective implementation, and in this regard calls upon States that have \nnot yet done so to address their financial obligations under the Treaty in a prompt \nand timely manner;  \n \n4. \nCalls upon all States that have not yet done so to ratify, accept, approve \nor accede to the Treaty, according to their respective constitutional processes, in \norder to achieve its universalization; \n \n5. \nCalls upon those States parties in a position to do so to provide \nassistance, including legal or legislative assistance, institutional capacity-building \nand technical, material or financial assistance, to requesting States in order to \npromote the universalization of the Treaty; \n \n6. \nStresses the vital importance of the full and effective implementation of \nand compliance with all provisions of the Treaty by States parties, and urges them to \nmeet their obligations under the Treaty; \n \n7. \nRecognizes the complementarity among all relevant international \ninstruments on conventional arms and the Treaty, and to this end urges all States to \nimplement effective national measures to prevent, combat and eradicate the illicit \nand unregulated trade in conventional arms in fulfilment of their respective \ninternational obligations and commitments; \n__________________ \n \n4  See resolution 67/234 B. \n \n5  Resolution 70/1. \n\nThe Arms Trade Treaty \nA/RES/72/44\n \n3/3 \n17-21721 \n \n \n8. \nEncourages all States parties to make available their initial report, as \nwell as their annual report for the preceding calendar year, as required under article 13 \nof the Treaty, thereby enhancing confidence, transparency, trust and accountability, \nand notes the endorsement by the Second Conference of States Parties of templates \nthat may facilitate the reporting task; \n \n9. \nWelcomes the successful operationalization of the voluntary trust fund for \nthe implementation of the Arms Trade Treaty, encourages eligible States to make \nbest use of the voluntary trust fund, and encourages all States parties in a position to \ndo so to contribute to the voluntary trust fund;  \n \n10. Encourages States parties and signatory States in a position to do so to \nprovide financial assistance, through a voluntary sponsorship fund, that could \ncontribute to meeting the costs of participation in meetings under the Treaty for \nthose States that would otherwise be unable to attend; \n \n11. \nEncourages States parties to strengthen their cooperation with civil society, \nincluding non-governmental organizations, industry and relevant international \norganizations and to work with other States parties at the national and regional \nlevels, with the aim of ensuring the effective implementation of the Treaty; \n \n12. Decides to include in the provisional agenda of its seventy-third session, \nunder the item entitled \u201cGeneral and complete disarmament\u201d, the sub-item entitled \n\u201cThe Arms Trade Treaty\u201d, and to review the implementation of the present \nresolution at that session.  \n \n62nd plenary meeting  \n4 December 2017 \n \n",
  "paragraphs": {
    "1": "Welcomes the decisions taken at the Third Conference of States Parties to the Arms Trade Treaty, held in Geneva from 11 to 15 September 2017, and notes that the Fourth Conference of States Parties is to be held in Japan from 20 to 24 August 2018, subject to the final confirmation of the Government of Japan;",
    "2": "Also welcomes the establishment of the standing working groups on implementation, on transparency and reporting, and on universalization by the Third Conference of States Parties as important steps in advancing the object and purpose of the Arms Trade Treaty;4",
    "3": "Recognizes that the consolidation of the institutional structure of the Treaty provides a framework for supporting further work under the Treaty, in particular its effective implementation, and in this regard calls upon States that have not yet done so to address their financial obligations under the Treaty in a prompt and timely manner;",
    "4": "Calls upon all States that have not yet done so to ratify, accept, approve or accede to the Treaty, according to their respective constitutional processes, in order to achieve its universalization;",
    "5": "Calls upon those States parties in a position to do so to provide assistance, including legal or legislative assistance, institutional capacity-building and technical, material or financial assistance, to requesting States in order to promote the universalization of the Treaty;",
    "6": "Stresses the vital importance of the full and effective implementation of and compliance with all provisions of the Treaty by States parties, and urges them to meet their obligations under the Treaty;",
    "7": "Recognizes the complementarity among all relevant international instruments on conventional arms and the Treaty, and to this end urges all States to implement effective national measures to prevent, combat and eradicate the illicit and unregulated trade in conventional arms in fulfilment of their respective international obligations and commitments; __________________ 4 See resolution 67/234 B. 5 Resolution 70/1. The Arms Trade Treaty A/RES/72/44 3/3 17-21721",
    "8": "Encourages all States parties to make available their initial report, as well as their annual report for the preceding calendar year, as required under article 13 of the Treaty, thereby enhancing confidence, transparency, trust and accountability, and notes the endorsement by the Second Conference of States Parties of templates that may facilitate the reporting task;",
    "9": "Welcomes the successful operationalization of the voluntary trust fund for the implementation of the Arms Trade Treaty, encourages eligible States to make best use of the voluntary trust fund, and encourages all States parties in a position to do so to contribute to the voluntary trust fund;",
    "10": "Encourages States parties and signatory States in a position to do so to provide financial assistance, through a voluntary sponsorship fund, that could contribute to meeting the costs of participation in meetings under the Treaty for those States that would otherwise be unable to attend;",
    "11": "Encourages States parties to strengthen their cooperation with civil society, including non-governmental organizations, industry and relevant international organizations and to work with other States parties at the national and regional levels, with the aim of ensuring the effective implementation of the Treaty;",
    "12": "Decides to include in the provisional agenda of its seventy-third session, under the item entitled \u201cGeneral and complete disarmament\u201d, the sub-item entitled \u201cThe Arms Trade Treaty\u201d, and to review the implementation of the present resolution at that session. 62nd plenary meeting 4 December 2017"
  },
  "agenda_items": [
    "Item 99"
  ],
  "symbol_references": []
}