{
  "symbol": "A/RES/73/344",
  "filename": "A_RES_73_344.pdf",
  "title": "73/344. Academy for Human Encounters and Dialogue",
  "text": "United Nations \nA/RES/73/344\n \n \nGeneral Assembly \nDistr.: General \n20 September 2019 \n \n19-15933 (E)    260919 \n*1915933* \n \n \nSeventy-third session \nAgenda item 15 \n \n \n \n \n Resolution adopted by the General Assembly \non 16 September 2019 \n \n \n \n \n[without reference to a Main Committee (A/73/L.107 and A/73/L.107/Add.1)] \n \n \n 73/344. Academy for Human Encounters and Dialogue \n \n \n \nThe General Assembly, \n \nReaffirming the purposes and principles enshrined in the Charter of the United \nNations,  \n \nRecalling all relevant General Assembly resolutions, in particular resolutions \n56/6 of 9 November 2001 on the Global Agenda for Dialogue among Civilizations, \n57/6 of 4 November 2002 on the International Decade for a Culture of Peace and \nNon-Violence for the Children of the World, 2001\u20132010, 58/128 of 19 December \n2003 on the promotion of religious and cultural understanding, harmony and \ncooperation, 59/23 of 11 November 2004 on the promotion of interreligious dialogue, \n59/199 of 20 December 2004 on the elimination of all forms of religious intolerance, \n61/161 of 19 December 2006 on the elimination of all forms of intolerance and of \ndiscrimination based on religion or belief, 73/90 of 7 December 2018, in the context \nof the principles and purposes of the University for Peace, and 73/129 of 12 December \n2018 on the promotion of interreligious and intercultural dialogue, understanding and \ncooperation for peace, \n \nRecognizing the ongoing efforts of relevant entities of the United Nations \nsystem aimed at developing values and skills conducive to a culture of peace, \nincluding education and training in promoting dialogue and consensus-building,  \n \nConsidering the importance of promoting education for peace that fosters \nrespect for the values inherent in peace and universal coexistence among people, \nincluding respect for the life, dignity and integrity of human beings, as well as \nfriendship and solidarity among people irrespective of their nationality, race, sex, \nreligion or culture,  \n \nRecalling the adoption of the 2030 Agenda for Sustainable Development 1 and \nthe need to coordinate efforts for its implementation,  \n__________________ \n \n1  Resolution 70/1. \n\nA/RES/73/344 \nAcademy for Human Encounters and Dialogue\n \n19-15933\n2/2 \n \n \nRecognizing the importance of the Declaration2 and Programme of Action3 on a \nCulture of Peace, adopted by the General Assembly on 13 September 1999, which \nserve as the universal mandate for the international community, particularly the \nUnited Nations system, for the promotion of a culture of peace and non-violence that \nbenefits humanity, in particular future generations,  \n \nRecognizing also the relevance of the full implementation of the 2030 Agenda \nand its Sustainable Development Goals, including Goal 4, to ensure inclusive and \nequitable quality education and promote lifelong learning opportunities for all, Goal 5, \nto achieve gender equality and empower all women and girls, and Goal 16, to promote \npeaceful and inclusive societies for sustainable development, provide access to justice \nfor all and build effective, accountable and inclusive institutions at all levels, \n \nRecognizing further that cultural diversity and the pursuit of cultural \ndevelopment by all peoples and nations are sources of mutual enrichment for the \ncultural life of humankind,  \n \nConvinced that the promotion of cultural pluralism and tolerance towards and \ndialogue among various cultures and civilizations would contribute to the efforts of \nall peoples and nations to enrich their cultures and traditions through engagement in \na mutually beneficial exchange of knowledge and intellectual, moral and material \nachievements,  \n \nBearing in mind the positive potential of dialogue initiatives at the national, \nregional and international levels to make a valuable contribution to improved \nawareness and understanding of the common values shared by all humankind, \n \nExpressing its appreciation to the President of Lebanon for his efforts to \nstrengthen the role of Lebanon as a centre of dialogue and diversity, in particular \nthrough his initiative to establish the Academy for Human Encounters and Dialogue,  \n \n1. \nWelcomes the initiative by the President of Lebanon to establish the \nAcademy for Human Encounters and Dialogue in Beirut;  \n \n2. \nEncourages the Secretary-General, the United Nations Educational, \nScientific and Cultural Organization and other relevant specialized agencies to \nsupport, within existing resources and in accordance with their respective mandates, \nthe efforts to establish the Academy; \n \n3. \nRequests the Secretary-General to keep the General Assembly informed of \nthe implementation of the present resolution.  \n \n107th plenary meeting \n16 September 2019 \n \n__________________ \n \n2  Resolution 53/243 A. \n \n3  Resolution 53/243 B. \n",
  "paragraphs": {
    "1": "Welcomes the initiative by the President of Lebanon to establish the Academy for Human Encounters and Dialogue in Beirut;",
    "2": "Encourages the Secretary-General, the United Nations Educational, Scientific and Cultural Organization and other relevant specialized agencies to support, within existing resources and in accordance with their respective mandates, the efforts to establish the Academy;",
    "3": "Requests the Secretary-General to keep the General Assembly informed of the implementation of the present resolution."
  },
  "agenda_items": [
    "Item 15"
  ],
  "symbol_references": [
    "A/73/L.107"
  ]
}