{
  "symbol": "A/RES/78/85",
  "filename": "A_RES_78_85.pdf",
  "title": "78/85. Question of Western Sahara",
  "text": "United Nations \nA/RES/78/85\n \n \nGeneral Assembly \nDistr.: General \n11 December 2023 \n \n23-24946 (E)    181223 \n*2324946* \n \n \nSeventy-eighth session \nAgenda item 58 \nImplementation of the Declaration on the Granting of \nIndependence to Colonial Countries and Peoples \n \n \n \n \n Resolution adopted by the General Assembly on \n7 December 2023 \n \n \n \n \n[on the report of the Special Political and Decolonization Committee  \n(Fourth Committee) (A/78/429, para. 33)] \n \n \n \n78/85. Question of Western Sahara \n \n \n \nThe General Assembly, \n \nHaving considered in depth the question of Western Sahara, \n \nReaffirming the inalienable right of all peoples to self-determination and \nindependence, in accordance with the principles set forth in the Charter of the United \nNations and General Assembly resolution 1514 (XV) of 14 December 1960 \ncontaining the Declaration on the Granting of Independence to Colonial Countries \nand Peoples, \n \nRecognizing that all available options for self-determination of the Territories \nare valid as long as they are in accordance with the freely expressed wishes of the \npeople concerned and in conformity with the clearly defined principles contained in \nGeneral Assembly resolutions 1514 (XV) and 1541 (XV) of 15 December 1960 and \nother resolutions of the Assembly, \n \nRecalling its resolution 77/133 of 12 December 2022, \n \nRecalling also all resolutions of the General Assembly and the Security Council \non the question of Western Sahara, \n \nRecalling further Security Council resolutions 658 (1990) of 27 June 1990, 690 \n(1991) of 29 April 1991, 1359 (2001) of 29 June 2001, 1429 (2002) of 30 July 2002, \n1495 (2003) of 31 July 2003, 1541 (2004) of 29 April 2004, 1570 (2004) of \n28 October 2004, 1598 (2005) of 28 April 2005, 1634 (2005) of 28 October 2005, \n1675 (2006) of 28 April 2006 and 1720 (2006) of 31 October 2006, \n \nUnderlining the adoption of Security Council resolutions 1754 (2007) on \n30 April 2007, 1783 (2007) on 31 October 2007, 1813 (2008) on 30 April 2008, 1871 \n(2009) on 30 April 2009, 1920 (2010) on 30 April 2010, 1979 (2011) on 27 April \n2011, 2044 (2012) on 24 April 2012, 2099 (2013) on 25 April 2013, 2152 (2014) on 29 \nApril 2014, 2218 (2015) on 28 April 2015, 2285 (2016) on 29 April 2016, 2351 (2017) \n\nA/RES/78/85 \nQuestion of Western Sahara\n \n23-24946\n2/3 \n \non 28 April 2017, 2414 (2018) on 27 April 2018, 2440 (2018) on 31 October 2018, 2468 \n(2019) on 30 April 2019, 2494 (2019) on 30 October 2019, 2548 (2020) on 30 October \n2020, 2602 (2021) on 29 October 2021 and 2654 (2022) on 27 October 2022, \n \nExpressing its satisfaction that the parties met on 18 and 19 June 2007, on \n10 and 11 August 2007, from 7 to 9 January 2008 and from 16 to 18 March 2008 \nunder the auspices of the Personal Envoy of the Secretary-General for Western Sahara \nand in the presence of the neighbouring countries and that they have agreed to \ncontinue the negotiations, \n \nAlso expressing its satisfaction at the holding of nine informal meetings \nconvened by the Personal Envoy of the Secretary-General on 9 and 10 August 2009 \nin D\u00fcrnstein, Austria, on 10 and 11 February 2010 in Westchester County, New York, \nUnited States of America, from 7 to 10 November 2010, from 16 to 18 December \n2010 and from 21 to 23 January 2011, all on Long Island, New York, from 7 to \n9 March 2011 in Mellieha, Malta, from 5 to 7 June 2011 and from 19 to 21 July 2011, \nboth on Long Island, and from 11 to 13 March 2012 in Manhasset, New York, to \nprepare for the fifth round of negotiations, \n \nCalling upon all the parties and the States of the region to cooperate fully with \nthe Secretary-General and his Personal Envoy and with each other, \n \nReaffirming the responsibility of the United Nations towards the people of \nWestern Sahara, \n \nWelcoming, in this regard, the efforts of the Secretary-General and his Personal \nEnvoy in search of a mutually acceptable political solution to the dispute, which will \nprovide for the self-determination of the people of Western Sahara, \n \nHaving examined the relevant chapter of the report of the Special Committee on \nthe Situation with regard to the Implementation of the Declaration on the Granting of \nIndependence to Colonial Countries and Peoples for 2023,1  \n \nHaving also examined the report of the Secretary-General,2  \n \n1. \nTakes note of the report of the Secretary-General; \n \n2. \nSupports the process of negotiations initiated by Security Council \nresolution 1754 (2007) and further sustained by Council resolutions 1783 (2007), \n1813 (2008), 1871 (2009), 1920 (2010), 1979 (2011), 2044 (2012), 2099 (2013), 2152 \n(2014), 2218 (2015), 2285 (2016), 2351 (2017), 2414 (2018), 2440 (2018), 2468 \n(2019), 2494 (2019), 2548 (2020), 2602 (2021) and 2654 (2022), with a view to \nachieving a just, lasting and mutually acceptable political solution, which will provide \nfor the self-determination of the people of Western Sahara, and commends the efforts \nundertaken by the Secretary-General and his Personal Envoy for Western Sahara in \nthis respect; \n \n3. \nWelcomes the commitment of the parties to continue to show political will \nand work in an atmosphere propitious for dialogue, in order to enter into a more \nintensive phase of negotiations, in good faith and without preconditions, noting \nefforts and developments since 2006, thus ensuring the implementation of Security \nCouncil resolutions 1754 (2007), 1783 (2007), 1813 (2008), 1871 (2009), 1920 \n(2010), 1979 (2011), 2044 (2012), 2099 (2013), 2152 (2014), 2218 (2015), 2285 \n(2016), 2351 (2017), 2414 (2018), 2440 (2018), 2468 (2019), 2494 (2019), 2548 \n(2020), 2602 (2021) and 2654 (2022) and the success of negotiations; \n__________________ \n \n1  Official Records of the General Assembly, Seventy-eighth Session, Supplement No. 23 (A/78/23). \n \n2  A/78/249. \n\nQuestion of Western Sahara \nA/RES/78/85\n \n3/3\n23-24946 \n \n \n4. \nAlso welcomes the ongoing negotiations between the parties held on \n18 and 19 June 2007, on 10 and 11 August 2007, from 7 to 9 January 2008 and from \n16 to 18 March 2008 in the presence of the neighbouring countries and under the \nauspices of the United Nations; \n \n5. \nCalls upon the parties to cooperate with the International Committee of \nthe Red Cross, and calls upon them to abide by their obligations under international \nhumanitarian law; \n \n6. \nRequests the Special Committee on the Situation with regard to the \nImplementation of the Declaration on the Granting of Independence to Colonial \nCountries and Peoples to continue to consider the situation in Western Sahara and to \nreport thereon to the General Assembly at its seventy-ninth session; \n \n7. \nInvites the Secretary-General to submit to the General Assembly at its \nseventy-ninth session a report on the implementation of the present resolution. \n \n45th plenary meeting \n7 December 2023 \n \n",
  "paragraphs": {
    "1": "Takes note of the report of the Secretary-General;",
    "2": "Supports the process of negotiations initiated by Security Council resolution 1754 (2007) and further sustained by Council resolutions 1783 (2007), 1813 (2008), 1871 (2009), 1920 (2010), 1979 (2011), 2044 (2012), 2099 (2013), 2152 (2014), 2218 (2015), 2285 (2016), 2351 (2017), 2414 (2018), 2440 (2018), 2468 (2019), 2494 (2019), 2548 (2020), 2602 (2021) and 2654 (2022), with a view to achieving a just, lasting and mutually acceptable political solution, which will provide for the self-determination of the people of Western Sahara, and commends the efforts undertaken by the Secretary-General and his Personal Envoy for Western Sahara in this respect;",
    "3": "Welcomes the commitment of the parties to continue to show political will and work in an atmosphere propitious for dialogue, in order to enter into a more intensive phase of negotiations, in good faith and without preconditions, noting efforts and developments since 2006, thus ensuring the implementation of Security Council resolutions 1754 (2007), 1783 (2007), 1813 (2008), 1871 (2009), 1920 (2010), 1979 (2011), 2044 (2012), 2099 (2013), 2152 (2014), 2218 (2015), 2285 (2016), 2351 (2017), 2414 (2018), 2440 (2018), 2468 (2019), 2494 (2019), 2548 (2020), 2602 (2021) and 2654 (2022) and the success of negotiations;",
    "4": "Also welcomes the ongoing negotiations between the parties held on 18 and 19 June 2007, on 10 and 11 August 2007, from 7 to 9 January 2008 and from 16 to 18 March 2008 in the presence of the neighbouring countries and under the auspices of the United Nations;",
    "5": "Calls upon the parties to cooperate with the International Committee of the Red Cross, and calls upon them to abide by their obligations under international humanitarian law;",
    "6": "Requests the Special Committee on the Situation with regard to the Implementation of the Declaration on the Granting of Independence to Colonial Countries and Peoples to continue to consider the situation in Western Sahara and to report thereon to the General Assembly at its seventy-ninth session;",
    "7": "Invites the Secretary-General to submit to the General Assembly at its seventy-ninth session a report on the implementation of the present resolution."
  },
  "agenda_items": [
    "Item 58"
  ],
  "symbol_references": []
}