{
  "symbol": "A/RES/76/2",
  "filename": "A_RES_76_2.pdf",
  "title": "76/2. Scale of assessments for the apportionment of the expenses of the United Nations: requests under Article 19 of the Charter",
  "text": "United Nations \nA/RES/76/2\n \n \nGeneral Assembly \nDistr.: General \n13 October 2021 \n \n21-14660 (E)    181021     \n*2114660* \n \n \nSeventy-sixth session \nAgenda item 142 \nScale of assessments for the apportionment of the expenses \nof the United Nations \n \n \n \n \n Resolution adopted by the General Assembly \non 11 October 2021 \n \n \n \n \n[on the report of the Fifth Committee (A/76/383, para. 6)] \n \n \n \n76/2. Scale of assessments for the apportionment of the expenses of the \nUnited Nations: requests under Article 19 of the Charter \n \n \n \nThe General Assembly, \n \nHaving considered chapter V of the report of the Committee on Contributions on \nits eighty-first session,1 \n \nReaffirming the obligation of Member States under Article 17 of the Charter of the \nUnited Nations to bear the expenses of the Organization as apportioned by the General \nAssembly, \n \n1. \nReaffirms its role in accordance with the provisions of Article 19 of the \nCharter of the United Nations and the advisory role of the Committee on Contributions \nin accordance with rule 160 of the rules of procedure of the General Assembly; \n \n2. \nAlso reaffirms its resolution 54/237 C of 23 December 1999; \n \n3. \nRequests the Secretary-General to continue to bring to the attention of \nMember States the deadline specified in resolution 54/237 C, including through an early \nannouncement in the Journal of the United Nations and through direct communication; \n \n4. \nUrges all Member States requesting exemption under Article 19 of the \nCharter to submit as much information as possible in support of their requests and to \nconsider submitting such information in advance of the deadline specified in resolution \n54/237 C so as to enable the collation of any additional detailed information that may \nbe necessary; \n__________________ \n \n1 Official Records of the General Assembly, Seventy-sixth Session, Supplement No. 11 and \naddendum (A/76/11 and A/76/11/Add.1). \n\nA/RES/76/2 \nScale of assessments for the apportionment of the expenses of the \nUnited Nations: requests under Article 19 of the Charter\n \n21-14660\n2/2 \n \n \n5. \nAgrees that the failure of the Comoros, Sao Tome and Principe and Somalia \nto pay the full minimum amount necessary to avoid the application of Article 19 of the \nCharter was due to conditions beyond their control; \n \n6. \nDecides that the Comoros, Sao Tome and Principe and Somalia shall be \npermitted to vote in the General Assembly until the end of its seventy-sixth session. \n \n \n18th plenary meeting \n11 October 2021 \n \n",
  "paragraphs": {
    "1": "Reaffirms its role in accordance with the provisions of Article 19 of the Charter of the United Nations and the advisory role of the Committee on Contributions in accordance with rule 160 of the rules of procedure of the General Assembly;",
    "2": "Also reaffirms its resolution 54/237 C of 23 December 1999;",
    "3": "Requests the Secretary-General to continue to bring to the attention of Member States the deadline specified in resolution 54/237 C, including through an early announcement in the Journal of the United Nations and through direct communication;",
    "4": "Urges all Member States requesting exemption under Article 19 of the Charter to submit as much information as possible in support of their requests and to consider submitting such information in advance of the deadline specified in resolution 54/237 C so as to enable the collation of any additional detailed information that may be necessary;",
    "5": "Agrees that the failure of the Comoros, Sao Tome and Principe and Somalia to pay the full minimum amount necessary to avoid the application of Article 19 of the Charter was due to conditions beyond their control;",
    "6": "Decides that the Comoros, Sao Tome and Principe and Somalia shall be permitted to vote in the General Assembly until the end of its seventy-sixth session."
  },
  "agenda_items": [
    "Item 142"
  ],
  "symbol_references": []
}