{
  "symbol": "A/RES/72/202",
  "filename": "A_RES_72_202.pdf",
  "title": "72/202. International trade and development",
  "text": "United Nations \nA/RES/72/202\n \n \nGeneral Assembly \nDistr.: General \n23 January 2018 \n \n17-23264 (E)    260118 \n*1723264* \n \n \nSeventy-second session \nAgenda item 17 (a) \n \n \n \n \n Resolution adopted by the General Assembly \non 20 December 2017 \n \n \n \n \n[on the report of the Second Committee (A/72/418/Add.1)] \n \n \n 72/202. International trade and development \n \n \n \nThe General Assembly,  \n \nRecalling its resolutions 56/178 of 21 December 2001, 57/235 of 20 December \n2002, 58/197 of 23 December 2003, 63/203 of 19 December 2008, 66/185 of \n22 December 2011, 67/196 of 21 December 2012, 68/199 of 20 December 2013, \n69/205 of 19 December 2014, 70/187 of 22 December 2015 and 71/214 of \n21 December 2016,  \n \nTaking note of its resolutions 59/221 of 22 December 2004, 60/184 of \n22 December 2005, 61/186 of 20 December 2006, 62/184 of 19 December 2007, \n64/188 of 21 December 2009 and 65/142 of 20 December 2010,  \n \nReaffirming its resolution 70/1 of 25 September 2015, entitled \u201cTransforming \nour world: the 2030 Agenda for Sustainable Development\u201d, in which it adopted a \ncomprehensive, far-reaching and people-centred set of universal and transformative \nSustainable Development Goals and targets, its commitment to working tirelessly \nfor the full implementation of the Agenda by 2030, its recognition that eradicating \npoverty in all its forms and dimensions, including extreme poverty, is the greatest \nglobal challenge and an indispensable requirement for sustainable development, its \ncommitment to achieving sustainable development in its three dimensions \u2014 \neconomic, social and environmental \u2014 in a balanced and integrated manner, and to \nbuilding upon the achievements of the Millennium Development Goals and seeking \nto address their unfinished business, \n \nReaffirming also its resolution 69/313 of 27 July 2015 on the Addis Ababa \nAction Agenda of the Third International Conference on Financing for \nDevelopment, which is an integral part of the 2030 Agenda for Sustainable \nDevelopment, supports and complements it, helps to contextualize its means of \nimplementation targets with concrete policies and actions, and reaffirms the strong \npolitical commitment to address the challenge of financing and creating an enabling \nenvironment at all levels for sustainable development in the spirit of global \npartnership and solidarity, \n\nA/RES/72/202 \nInternational trade and development\n \n17-23264 \n2/2 \n \n \nReiterating the pledge that no one will be left behind, reaffirming the \nrecognition that the dignity of the human person is fundamental, and the wish to see \nthe Goals and targets met for all nations and peoples and for all segments of society, \nand recommitting to endeavour to reach the furthest behind first, \n \nRecommitting to ensuring that no country or person is left behind and to \nfocusing our effort where the challenges are greatest, including by ensuring the \ninclusion and participation of those who are furthest behind, \n \n1. \nTakes note of the report of the Trade and Development Board of the \nUnited Nations Conference on Trade and Development1 and the report of the \nSecretary-General;2 \n \n2. \nReaffirms that international trade is an engine for inclusive growth and \npoverty reduction and that it contributes to the promotion of sustainable \ndevelopment; \n \n3. \nAlso reaffirms the commitments made through the adoption of the Addis \nAbaba Action Agenda of the Third International Conference on Financing for \nDevelopment3 in, inter alia, international trade as an important action area for \nsustainable development; \n \n4. \nRecommits to promoting a universal, rules-based, open, transparent, \npredictable, inclusive, non-discriminatory and equitable multilateral trading system \nunder the World Trade Organization, as well as meaningful trade liberalization; \n \n5. \nWelcomes the convening of the Eleventh Ministerial Conference of the \nWorld Trade Organization in Buenos Aires from 10 to 13 December 2017, looks \nforward to a successful outcome and expresses its appreciation to the Government \nof Argentina for hosting the meeting;  \n \n6. \nTakes note of the fourteenth session of the United Nations Conference on \nTrade and Development and its outcome documents;4  \n \n7. \nUrges the international community to adopt urgent and effective \nmeasures to eliminate the use of unilateral economic, financial or trade measures \nthat are not authorized by relevant organs of the United Nations, that are \ninconsistent with the principles of international law or the Charter of the United \nNations or that contravene the basic principles of the multilateral trading system and \nthat affect in particular, but not exclusively, developing countries; \n \n8. \nCalls upon the relevant organizations of the United Nations system, \nwithin their respective mandates and resources, to ensure that no one is left behind \nand no country is left behind in the implementation of the present resolution; \n \n9. \nRequests the Secretary-General, in collaboration with the secretariat of \nthe United Nations Conference on Trade and Development, to submit to the General \nAssembly, at its seventy-third session, a report on the implementation of the present \nresolution, and decides to include in the provisional agenda of its seventy-third \nsession, under the item entitled \u201cMacroeconomic policy questions\u201d, the sub-item \nentitled \u201cInternational trade and development\u201d, unless otherwise agreed.  \n \n74th plenary meeting  \n20 December 2017 \n \n__________________ \n \n1  A/72/15 (Part I), A/72/15 (Part II), A/72/15 (Part III), A/72/15 (Part IV) and A/72/15 (Part V). \n \n2  A/72/274. \n \n3  Resolution 69/313, annex. \n \n4 TD/519, TD/519/Add.1, TD/519/Add.2 and TD/519/Add.2/Corr.1. \n",
  "paragraphs": {
    "1": "Takes note of the report of the Trade and Development Board of the United Nations Conference on Trade and Development1 and the report of the Secretary-General;2",
    "2": "Reaffirms that international trade is an engine for inclusive growth and poverty reduction and that it contributes to the promotion of sustainable development;",
    "3": "Also reaffirms the commitments made through the adoption of the Addis Ababa Action Agenda of the Third International Conference on Financing for Development3 in, inter alia, international trade as an important action area for sustainable development;",
    "4": "Recommits to promoting a universal, rules-based, open, transparent, predictable, inclusive, non-discriminatory and equitable multilateral trading system under the World Trade Organization, as well as meaningful trade liberalization;",
    "5": "Welcomes the convening of the Eleventh Ministerial Conference of the World Trade Organization in Buenos Aires from 10 to 13 December 2017, looks forward to a successful outcome and expresses its appreciation to the Government of Argentina for hosting the meeting;",
    "6": "Takes note of the fourteenth session of the United Nations Conference on Trade and Development and its outcome documents;4",
    "7": "Urges the international community to adopt urgent and effective measures to eliminate the use of unilateral economic, financial or trade measures that are not authorized by relevant organs of the United Nations, that are inconsistent with the principles of international law or the Charter of the United Nations or that contravene the basic principles of the multilateral trading system and that affect in particular, but not exclusively, developing countries;",
    "8": "Calls upon the relevant organizations of the United Nations system, within their respective mandates and resources, to ensure that no one is left behind and no country is left behind in the implementation of the present resolution;",
    "9": "Requests the Secretary-General, in collaboration with the secretariat of the United Nations Conference on Trade and Development, to submit to the General Assembly, at its seventy-third session, a report on the implementation of the present resolution, and decides to include in the provisional agenda of its seventy-third session, under the item entitled \u201cMacroeconomic policy questions\u201d, the sub-item entitled \u201cInternational trade and development\u201d, unless otherwise agreed. 74th plenary meeting 20 December 2017 __________________ 1 A/72/15 (Part I), A/72/15 (Part II), A/72/15 (Part III), A/72/15 (Part IV) and A/72/15 (Part V). 2 A/72/274. 3 Resolution 69/313, annex. 4 TD/519, TD/519/Add.1, TD/519/Add.2 and TD/519/Add.2/Corr.1."
  },
  "agenda_items": [
    "Item 17"
  ],
  "symbol_references": []
}