{
  "symbol": "A/RES/79/231",
  "filename": "A_RES_79_231.pdf",
  "title": "79/231. Promoting and fostering the efficiency, accountability, effectiveness and transparency of public administration by strengthening supreme audit institutions",
  "text": "United Nations \nA/RES/79/231\n \nGeneral Assembly \nDistr.: General \n23 December 2024 \n24-24306 (E) \n*2424306* \n \n \nSeventy-ninth session \nAgenda item 20 (a) \nGlobalization and interdependence: role of the United Nations \nin promoting development in the context of globalization \nand interdependence \n \n \n \n \n Resolution adopted by the General Assembly \non 19 December 2024 \n \n \n[without reference to a Main Committee (A/79/L.46)] \n \n \n 79/231. Promoting and fostering the efficiency, accountability, \neffectiveness and transparency of public administration by \nstrengthening supreme audit institutions \n \n \n \nThe General Assembly, \n \nRecalling its resolutions 66/209 of 22 December 2011 and 69/228 of \n19 December 2014, \n \nRecalling also the ministerial declaration of the high-level segment of the 2024 \nsession of the Economic and Social Council and the high-level political forum on \nsustainable development,1 \n \nEmphasizing the need to improve the efficiency, accountability, effectiveness \nand transparency of public administration, \n \nEmphasizing also that efficient, accountable, effective and transparent public \nadministration has a key role to play in the implementation of the Sustainable \nDevelopment Goals,2 \n \nHighlighting the contribution of supreme audit institutions in promoting \ntransparency and accountability in the implementation of policies and actions, as \napplicable, aimed at achieving national development objectives and the Sustainable \nDevelopment Goals, including combating climate change, \n_______________ \n \n1 Official Records of the General Assembly, Seventy-ninth Session, Supplement No. 3 (A/79/3), \nchap. VI, sect. D. \n \n2 See resolution 70/1. \n\nA/RES/79/231 \nPromoting and fostering the efficiency, accountability, effectiveness \nand transparency of public administration by strengthening \nsupreme audit institutions\n \n24-24306\n2/3 \n \n \nEmphasizing the importance of strengthening the capacity of supreme audit \ninstitutions to further contribute to sustainable development, within their respective \nmandates, \n \nStressing the need for capacity-building as a tool to promote sustainable \ndevelopment, and welcoming the cooperation of the International Organization of \nSupreme Audit Institutions with the United Nations in this regard, \n \n1. \nRecognizes that supreme audit institutions can accomplish their tasks \nobjectively and effectively only if they are independent of the audited entity and are \nprotected against outside influence; \n \n2. \nAlso recognizes the important role of supreme audit institutions in \npromoting the efficiency, accountability, effectiveness and transparency of public \nadministration, which is conducive to the achievement of national development \nobjectives and priorities as well as the Sustainable Development Goals; \n \n3. \nAcknowledges the valuable role that supreme audit institutions, in \naccordance with national legal and institutional frameworks and priorities, as well as \ninternational agreements and commitments, as applicable, can play, inter alia, in \ncontributing to Governments\u2019 efforts to address climate change by providing \nindependent and objective assessments of national action in this field, fostering the \nefficient allocation of resources, assessing the effectiveness of policy implementation, \nand promoting transparency and good governance; \n \n4. \nTakes note with appreciation of the work of the International Organization \nof Supreme Audit Institutions in promoting greater efficiency, accountability, \neffectiveness, transparency and efficient and effective receipt and use of public \nresources for the benefit of citizens; \n \n5. \nAlso takes note with appreciation of the Lima Declaration of Guidelines \non Auditing Precepts of 1977 3  and the Mexico Declaration on Supreme Audit \nInstitutions Independence of 2007, 4 and encourages Member States to apply, in a \nmanner consistent with their national institutional structures, the principles set out in \nthose Declarations; \n \n6. \nEncourages Member States and relevant United Nations institutions to \ncontinue and to intensify their cooperation, including in capacity-building, with the \nInternational Organization of Supreme Audit Institutions through, inter alia, training \nand technical assistance, in order to promote good governance at all levels by ensuring \nefficiency, accountability, effectiveness and transparency through strengthened \nsupreme audit institutions, including, as appropriate, the improvement of public \naccounting systems; \n \n7. \nEncourages Member States to consider climate-related findings and \nrecommendations in the reports of supreme audit institutions, where appropriate and \nfeasible, in accordance with national legal and institutional frameworks; \n \n8. \nAlso encourages Member States to strengthen, where feasible and in \naccordance with their national legal and institutional frameworks, the capacities of \ntheir supreme audit institutions to audit national climate-related policies expenditures \nand actions; \n_______________ \n \n3 Adopted by the Ninth Congress of the International Organization of Supreme Audit Institutions, \nLima, 17\u201326 October 1977. \n \n4 Adopted by the Nineteenth Congress of the International Organization of Supreme Audit \nInstitutions, Mexico City, 5\u201310 November 2007. \n\nPromoting and fostering the efficiency, accountability, effectiveness \nand transparency of public administration by strengthening \nsupreme audit institutions \nA/RES/79/231\n \n3/3\n24-24306 \n \n \n9. \nAcknowledges the role of supreme audit institutions in fostering \ngovernmental accountability for the use of resources and their performance in \nachieving development goals; \n \n10. Takes note of the interest of the International Organization of Supreme \nAudit Institutions in the Sustainable Development Goals; \n \n11. \nEncourages Member States to give due consideration to the independence \nand capacity-building of supreme audit institutions in a manner consistent with their \nnational institutional structures, as well as to the improvement of public accounting \nsystems in accordance with national development plans in the context of the \nSustainable Development Goals; \n \n12. Stresses the importance of continuing international cooperation to support \ndeveloping countries in capacity-building, knowledge and best practices related to \npublic accounting and auditing. \n \n54th plenary meeting \n19 December 2024 \n \n",
  "paragraphs": {
    "1": "Recognizes that supreme audit institutions can accomplish their tasks objectively and effectively only if they are independent of the audited entity and are protected against outside influence;",
    "2": "Also recognizes the important role of supreme audit institutions in promoting the efficiency, accountability, effectiveness and transparency of public administration, which is conducive to the achievement of national development objectives and priorities as well as the Sustainable Development Goals;",
    "3": "Acknowledges the valuable role that supreme audit institutions, in accordance with national legal and institutional frameworks and priorities, as well as international agreements and commitments, as applicable, can play, inter alia, in contributing to Governments\u2019 efforts to address climate change by providing independent and objective assessments of national action in this field, fostering the efficient allocation of resources, assessing the effectiveness of policy implementation, and promoting transparency and good governance;",
    "4": "Takes note with appreciation of the work of the International Organization of Supreme Audit Institutions in promoting greater efficiency, accountability, effectiveness, transparency and efficient and effective receipt and use of public resources for the benefit of citizens;",
    "5": "Also takes note with appreciation of the Lima Declaration of Guidelines on Auditing Precepts of 1977 3 and the Mexico Declaration on Supreme Audit Institutions Independence of 2007, 4 and encourages Member States to apply, in a manner consistent with their national institutional structures, the principles set out in those Declarations;",
    "6": "Encourages Member States and relevant United Nations institutions to continue and to intensify their cooperation, including in capacity-building, with the International Organization of Supreme Audit Institutions through, inter alia, training and technical assistance, in order to promote good governance at all levels by ensuring efficiency, accountability, effectiveness and transparency through strengthened supreme audit institutions, including, as appropriate, the improvement of public accounting systems;",
    "7": "Encourages Member States to consider climate-related findings and recommendations in the reports of supreme audit institutions, where appropriate and feasible, in accordance with national legal and institutional frameworks;",
    "8": "Also encourages Member States to strengthen, where feasible and in accordance with their national legal and institutional frameworks, the capacities of their supreme audit institutions to audit national climate-related policies expenditures and actions; _______________ 3 Adopted by the Ninth Congress of the International Organization of Supreme Audit Institutions, Lima, 17\u201326 October 1977. 4 Adopted by the Nineteenth Congress of the International Organization of Supreme Audit Institutions, Mexico City, 5\u201310 November 2007. Promoting and fostering the efficiency, accountability, effectiveness and transparency of public administration by strengthening supreme audit institutions A/RES/79/231 3/3 24-24306",
    "9": "Acknowledges the role of supreme audit institutions in fostering governmental accountability for the use of resources and their performance in achieving development goals;",
    "10": "Takes note of the interest of the International Organization of Supreme Audit Institutions in the Sustainable Development Goals;",
    "11": "Encourages Member States to give due consideration to the independence and capacity-building of supreme audit institutions in a manner consistent with their national institutional structures, as well as to the improvement of public accounting systems in accordance with national development plans in the context of the Sustainable Development Goals;",
    "12": "Stresses the importance of continuing international cooperation to support developing countries in capacity-building, knowledge and best practices related to public accounting and auditing. 54th plenary meeting 19 December 2024"
  },
  "agenda_items": [
    "Item 20"
  ],
  "symbol_references": [
    "A/79/L.46"
  ]
}