{
  "symbol": "A/RES/73/133",
  "filename": "A_RES_73_133.pdf",
  "title": "73/133. Graduation of countries from the least developed country category",
  "text": "United Nations \nA/RES/73/133\n \n \nGeneral Assembly \nDistr.: General \n21 December 2018 \n \n18-21868 (E)    261218 \n*1821868* \n \n \nSeventy-third session \nAgenda item 9 \n \n \n \n \n Resolution adopted by the General Assembly \non 13 December 2018 \n \n \n \n \n[without reference to a Main Committee (A/73/L.40/Rev.1)] \n \n \n 73/133. Graduation of countries from the least developed country category \n \n \n \nThe General Assembly, \n \nRecalling Economic and Social Council resolution 2018/27 of 24 July 2018 on \nthe report of the Committee for Development Policy on its twentieth session,  \n \nTaking into account its resolutions 59/209 of 20 December 2004, 65/286 of \n29 June 2011 and 67/221 of 21 December 2012 on a smooth transition for countries \ngraduating from the list of least developed countries, \n \nRecalling paragraph 10 of its resolution 67/221, in which it decided to take note \nof the decisions of the Council regarding the graduation of countries from the least \ndeveloped country category, as well as the inclusion of countries in that category, at \nthe first session of the General Assembly following the adoption of the decisions, \n \nEmphasizing that graduation from the least developed country category is a \nmajor milestone for the country involved as it means that significant progress has \nbeen made towards reaching at least some of its development goals, \n \n1. \nReaffirms that graduating from the category of least developed countries \nshould not result in a disruption of development plans, programmes and projects; \n \n2. \nTakes note of the endorsement by the Economic and Social Council of the \nrecommendation of the Committee for Development Policy that Bhutan be graduated \nfrom the least developed country category, also takes note of the fact that the \nCommittee found reasonable the request by Bhutan to align the effective graduation \ndate with the end of the country\u2019s twelfth national development plan, in 2023, and \ndecides to provide Bhutan, on an exceptional basis, with an additional preparatory \nperiod of two years before the start of the three-year preparatory period leading to \ngraduation;  \n \n3. \nInvites Bhutan to prepare, during the five-year period between the \nadoption of the present resolution and its graduation from the least developed country \ncategory, its national smooth-transition strategy, with the support of the United \n\nA/RES/73/133 \nGraduation of countries from the least developed country category\n \n18-21868\n2/4 \n \nNations system and in cooperation with its bilateral, regional and multilateral \ndevelopment and trading partners; \n \n4. \nTakes note of the endorsement by the Council of the recommendation of \nthe Committee that Solomon Islands be graduated from the least developed country \ncategory, and decides to provide Solomon Islands, on an exceptional basis, with an \nadditional preparatory period of three years before the start of the three-year \npreparatory period leading to graduation; \n \n5. \nInvites Solomon Islands to prepare, during the six-year period between the \nadoption of the present resolution and its graduation from the least developed country \ncategory, its national smooth-transition strategy, with the support of the United \nNations system and in cooperation with its bilateral, regional and multilateral \ndevelopment and trading partners; \n \n6. \nTakes note of the endorsement by the Council of the recommendation of \nthe Committee that Sao Tome and Principe be graduated from the least developed \ncountry category, also takes note of the fact that the Committee found reasonable the \nrequest by Sao Tome and Principe to postpone its effective graduation date to 2024 \nso as to enable it to enact necessary internal reforms and align its transition strategy \nwith its national development plan, and decides to provide Sao Tome and Principe, \non an exceptional basis, with an additional preparatory period of three years before \nthe start of the three-year preparatory period leading to graduation;  \n \n7. \nInvites Sao Tome and Principe to prepare, during the six-year period \nbetween the adoption of the present resolution and its graduation from the least \ndeveloped country category, its national smooth-transition strategy, with the support \nof the United Nations system and in cooperation with its bilateral, regional and \nmultilateral development and trading partners. \n \n52nd plenary meeting  \n13 December 2018 \n \n",
  "paragraphs": {
    "1": "Reaffirms that graduating from the category of least developed countries should not result in a disruption of development plans, programmes and projects;",
    "2": "Takes note of the endorsement by the Economic and Social Council of the recommendation of the Committee for Development Policy that Bhutan be graduated from the least developed country category, also takes note of the fact that the Committee found reasonable the request by Bhutan to align the effective graduation date with the end of the country\u2019s twelfth national development plan, in 2023, and decides to provide Bhutan, on an exceptional basis, with an additional preparatory period of two years before the start of the three-year preparatory period leading to graduation;",
    "3": " Nations system and in cooperation with its bilateral, regional and multilateral development and trading partners;",
    "4": "Takes note of the endorsement by the Council of the recommendation of the Committee that Solomon Islands be graduated from the least developed country category, and decides to provide Solomon Islands, on an exceptional basis, with an additional preparatory period of three years before the start of the three-year preparatory period leading to graduation;",
    "5": "Invites Solomon Islands to prepare, during the six-year period between the adoption of the present resolution and its graduation from the least developed country category, its national smooth-transition strategy, with the support of the United Nations system and in cooperation with its bilateral, regional and multilateral development and trading partners;",
    "6": "Takes note of the endorsement by the Council of the recommendation of the Committee that Sao Tome and Principe be graduated from the least developed country category, also takes note of the fact that the Committee found reasonable the request by Sao Tome and Principe to postpone its effective graduation date to 2024 so as to enable it to enact necessary internal reforms and align its transition strategy with its national development plan, and decides to provide Sao Tome and Principe, on an exceptional basis, with an additional preparatory period of three years before the start of the three-year preparatory period leading to graduation;",
    "7": "Invites Sao Tome and Principe to prepare, during the six-year period between the adoption of the present resolution and its graduation from the least developed country category, its national smooth-transition strategy, with the support of the United Nations system and in cooperation with its bilateral, regional and multilateral development and trading partners."
  },
  "agenda_items": [
    "Item 9"
  ],
  "symbol_references": [
    "A/73/L.40"
  ]
}