{
  "symbol": "A/RES/73/304",
  "filename": "A_RES_73_304.pdf",
  "title": "73/304. Towards torture-free trade: examining the feasibility, scope and parameters for possible common international standards",
  "text": "United Nations \nA/RES/73/304\n \n \nGeneral Assembly \nDistr.: General \n2 July 2019 \n \n19-11082 (E)    050719     \n*1911082* \n \n \nSeventy-third session \nAgenda item 74 \n \n \n \n \n Resolution adopted by the General Assembly \non 28 June 2019 \n \n \n \n \n[without reference to a Main Committee (A/73/L.94 and A/73/L.94/Add.1)] \n \n \n 73/304. Towards torture-free trade: examining the feasibility, scope and \nparameters for possible common international standards  \n \n \n \nThe General Assembly, \n \nGuided by the purposes and principles enshrined in the Charter of the United \nNations, and reaffirming its respect for and commitment to international law, \nincluding international human rights law,  \n \nRecalling the Universal Declaration of Human Rights, 1  the International \nCovenant on Civil and Political Rights2 and the Second Optional Protocol thereto 3 \nand the Convention against Torture and Other Cruel, Inhuman or Degrading \nTreatment or Punishment4 and the Optional Protocol thereto,5  \n \nReaffirming its resolution 72/163 of 19 December 2017, in which it called upon \nall States to take appropriate effective legislative, administrative, judicial and other \nmeasures to prevent and prohibit the production, trade, export, import and use of \nequipment that has no practical use other than for the purpose of torture or other cruel, \ninhuman or degrading treatment or punishment,  \n \nNoting and encouraging relevant initiatives, undertaken at the international, \nregional and subregional levels between States, including those of the United Nations, \nand the role played by non-governmental organizations and civil society, to enhance \ncooperation and improve information exchange and transparency in the field of trade \nin goods used for (a) capital punishment, (b) torture or other cruel, inhuman or \ndegrading treatment or punishment,  \n__________________ \n \n1  Resolution 217 A (III). \n \n2  See resolution 2200 A (XXI), annex. \n \n3  United Nations, Treaty Series, vol. 1642, No. 14668. \n \n4  Ibid., vol. 1465, No. 24841. \n \n5  Ibid., vol. 2375, No. 24841. \n\nA/RES/73/304 \nTowards torture-free trade: examining the feasibility, scope and \nparameters for possible common international standards\n \n19-11082\n2/2 \n \n \nRecognizing that the absence of common international standards on the import, \nexport and transfer of goods used for (a) capital punishment, (b) torture or other cruel, \ninhuman or degrading treatment or punishment is a contributory factor to facilitate \nthe availability of these goods and enable such practices, \n \nAcknowledging the growing support across all regions for concluding an \ninternational instrument, negotiated on a non-discriminatory, transparent and \nmultilateral basis, to establish common international standards for the import, export \nand transfer of goods used for (a) capital punishment, (b) torture or other cruel, \ninhuman or degrading treatment or punishment,  \n \nAcknowledging also the importance of international trade and the need to ensure \nthat the establishment of non-discriminatory, transparent, multilaterally agreed \ncommon international standards for the import, export and transfer of goods used for \n(a) capital punishment, (b) torture or other cruel, inhuman or degrading treatment or \npunishment does not create barriers to international trade in other goods,  \n \nTaking note of the launching of the Alliance for Torture-Free Trade,  \n \n1. \nRequests the Secretary-General, with the provisions of resolution 72/163 \nin mind, to seek the views of Member States on the feasibility and possible scope of \na range of options to establish common international standards for the import, export \nand transfer of goods used for (a) capital punishment, (b) torture or other cruel, \ninhuman or degrading treatment or punishment, and to submit a report on the subject \nto the General Assembly at its seventy-fourth session; \n \n2. \nAlso requests the Secretary-General, on the basis of his report to be \nsubmitted to the General Assembly at its seventy-fourth session, to establish a group \nof governmental experts, to be chosen on the basis of equitable geographical \ndistribution and guided by the need to appoint individuals reflecting the highest \nstandards of efficiency, competence in the fields of human rights and/or international \ntrade, and integrity, to examine, commencing in 2020, the feasibility, scope of the \ngoods to be included and draft parameters for a range of options to establish common \ninternational standards on the matter and to transmit the report of the group of experts \nto the Assembly for consideration at its seventy-fifth session;  \n \n3. \nFurther requests the Secretary-General to provide the group of experts \nwith any assistance and services that may be required for the discharge of its task;  \n \n4. \nDecides that the cost of all activities that may arise from the \nimplementation of the present resolution should be met from voluntary contributions. \n \n95th plenary meeting \n28 June 2019 \n \n",
  "paragraphs": {
    "1": "Requests the Secretary-General, with the provisions of resolution 72/163 in mind, to seek the views of Member States on the feasibility and possible scope of a range of options to establish common international standards for the import, export and transfer of goods used for (a) capital punishment, (b) torture or other cruel, inhuman or degrading treatment or punishment, and to submit a report on the subject to the General Assembly at its seventy-fourth session;",
    "2": "Also requests the Secretary-General, on the basis of his report to be submitted to the General Assembly at its seventy-fourth session, to establish a group of governmental experts, to be chosen on the basis of equitable geographical distribution and guided by the need to appoint individuals reflecting the highest standards of efficiency, competence in the fields of human rights and/or international trade, and integrity, to examine, commencing in 2020, the feasibility, scope of the goods to be included and draft parameters for a range of options to establish common international standards on the matter and to transmit the report of the group of experts to the Assembly for consideration at its seventy-fifth session;",
    "3": "Further requests the Secretary-General to provide the group of experts with any assistance and services that may be required for the discharge of its task;",
    "4": "Decides that the cost of all activities that may arise from the implementation of the present resolution should be met from voluntary contributions."
  },
  "agenda_items": [
    "Item 74"
  ],
  "symbol_references": [
    "A/73/L.94"
  ]
}