{
  "symbol": "A/RES/79/304",
  "filename": "A_RES_79_304.pdf",
  "title": "79/304. Financing of the United Nations Organization Stabilization Mission in the Democratic Republic of the Congo",
  "text": "United Nations \nA/RES/79/304\n \n \nGeneral Assembly \nDistr.: General \n1 July 2025 \n \n25-10827 (E) \n*2510827* \n \n \nSeventy-ninth session \nAgenda item 159 \nFinancing of the United Nations Organization Stabilization \nMission in the Democratic Republic of the Congo \n \n \n \n \n Resolution adopted by the General Assembly \non 30 June 2025 \n \n \n \n \n[on the report of the Fifth Committee (A/79/929, para. 6)] \n \n \n 79/304. Financing of the United Nations Organization Stabilization \nMission in the Democratic Republic of the Congo \n \n \n \nThe General Assembly, \n \nHaving considered the reports of the Secretary-General on the financing of the \nUnited Nations Organization Stabilization Mission in the Democratic Republic of the \nCongo 1 and the related report of the Advisory Committee on Administrative and \nBudgetary Questions,2  \n \nRecalling Security Council resolution 1925 (2010) of 28 May 2010, by which \nthe Council decided that, as from 1 July 2010, the United Nations Organization \nMission in the Democratic Republic of the Congo would bear the title \u201cUnited \nNations Organization Stabilization Mission in the Democratic Republic of the \nCongo\u201d, and recalling also the subsequent resolutions by which the Council extended \nthe mandate of the Mission, the latest of which was resolution 2765 (2024) of \n20 December 2024, by which the Council extended the mandate of the Mission until \n20 December 2025, \n \nRecalling also its resolution 54/260 A of 7 April 2000 on the financing of the \nMission and its subsequent resolutions thereon, the latest of which was resolution \n78/301 of 28 June 2024, \n \nRecalling further its resolution 58/315 of 1 July 2004, \n \nReaffirming the general principles underlying the financing of United Nations \npeacekeeping operations, as stated in its resolutions 1874 (S-IV) of 27 June 1963, \n3101 (XXVIII) of 11 December 1973 and 55/235 of 23 December 2000, \n__________________ \n \n1 A/79/681 and A/79/744. \n \n2 A/79/724/Add.9. \n\nA/RES/79/304 \nFinancing of the United Nations Organization Stabilization Mission \nin the Democratic Republic of the Congo\n \n25-10827\n2/4 \n \n \nNoting with appreciation that voluntary contributions have been made to the \nMission, \n \nMindful of the fact that it is essential to provide the Mission with the financial \nresources necessary to enable it to fulfil its responsibilities under the relevant \nresolutions of the Security Council, \n \n1. \nRequests the Secretary General to entrust the Head of Mission with the \ntask of formulating future budget proposals in full accordance with the provisions of \nits resolutions 59/296 of 22 June 2005, 60/266 of 30 June 2006, 61/276 of 29 June \n2007, 64/269 of 24 June 2010, 65/289 of 30 June 2011, 66/264 of 21 June 2012, \n69/307 of 25 June 2015, 70/286 of 17 June 2016 and 76/274 of 29 June 2022, as well \nas other relevant resolutions; \n \n2. \nTakes note of the status of contributions to the United Nations \nOrganization Stabilization Mission in the Democratic Republic of the Congo as at \n30 April 2025, including the contributions outstanding in the amount of 410.2 million \nUnited States dollars, representing some 1.5 per cent of the total assessed \ncontributions, notes with concern that only 81 Member States have paid their assessed \ncontributions in full, and urges all other Member States, in particular those in arrears, \nto ensure payment of their outstanding assessed contributions; \n \n3. \nExpresses its appreciation to those Member States that have paid their \nassessed contributions in full, and urges all other Member States to make every \npossible effort to ensure payment of their assessed contributions to the Mission in \nfull; \n \n4. \nExpresses concern at the financial situation with regard to peacekeeping \nactivities, in particular as regards the reimbursements to troop contributors that bear \nadditional burdens owing to overdue payments by Member States of their \nassessments; \n \n5. \nEmphasizes that all future and existing peacekeeping missions shall be \ngiven equal and non-discriminatory treatment in respect of financial and \nadministrative arrangements; \n \n6. \nAlso emphasizes that all peacekeeping missions shall be provided with \nadequate resources for the effective and efficient discharge of their respective \nmandates; \n \n7. \nRequests the Secretary-General to ensure that proposed peacekeeping \nbudgets are based on the relevant legislative mandates; \n \n8. \nEndorses the conclusions and recommendations contained in the report of \nthe Advisory Committee on Administrative and Budgetary Questions, subject to the \nprovisions of the present resolution, and requests the Secretary-General to ensure \ntheir full implementation; \n \n9. \nRequests the Secretary-General to ensure the full implementation of the \nrelevant provisions of its resolutions 59/296, 60/266, 61/276, 64/269, 65/289, 66/264, \n69/307, 70/286 and 76/274; \n \n10. Also requests the Secretary-General to take all action necessary to ensure \nthat the Mission is administered with a maximum of efficiency and economy; \n \n11. \nDecides to abolish the post of Facilities Management Assistant (national \nGeneral Service) in the Engineering and Facilities Camp Management Section that \nhas been vacant for more than 24 months; \n \n\nFinancing of the United Nations Organization Stabilization Mission \nin the Democratic Republic of the Congo \nA/RES/79/304\n \n3/4\n25-10827 \n \n \n \nBudget performance report for the period from 1 July 2023 to 30 June 2024 \n \n \n12. Takes note of the report of the Secretary-General on the budget \nperformance of the Mission for the period from 1 July 2023 to 30 June 2024; 3 \n \n \n \nBudget estimates for the period from 1 July 2025 to 30 June 2026 \n \n \n13. Decides to appropriate to the special account for the United Nations \nOrganization Stabilization Mission in the Democratic Republic of the Congo the \namount of 960,753,200 dollars for the period from 1 July 2025 to 30 June 2026, \ninclusive of 869,127,200 dollars for the maintenance of the Mission, 72,464,200 \ndollars for the support account for peacekeeping operations, 10,068,900 dollars for \nthe United Nations Logistics Base at Brindisi, Italy, and 9,092,900 dollars for the \nRegional Service Centre in Entebbe, Uganda; \n \n \n \nFinancing of the appropriation for the period from 1 July 2025 to 30 June 2026 \n \n \n14. Decides to apportion among Member States the amount of 451,658,400 \ndollars for the period from 1 July to 20 December 2025 in accordance with the levels \nupdated in its resolution 79/250 of 24 December 2024, taking into account the scale \nof assessments for 2025, as set out in its resolution 79/249 of 24 December 2024; \n \n15. Also decides that, in accordance with the provisions of its resolution 973 (X) \nof 15 December 1955, there shall be set off against the apportionment among Member \nStates, as provided for in paragraph 14 above, their respective share in the Tax \nEqualization Fund of 16,771,500 dollars, comprising the estimated staff assessment \nincome of 12,582,800 dollars approved for the Mission, the prorated share of \n3,129,900 dollars of the estimated staff assessment income approved for the support \naccount, the prorated share of 539,700 dollars of the estimated staff assessment \nincome approved for the United Nations Logistics Base and the prorated share of \n519,100 dollars of the estimated staff assessment income approved for the Regional \nService Centre; \n \n16. Further decides to apportion among Member States the amount of \n509,094,800 dollars for the period from 21 December 2025 to 30 June 2026, at a \nmonthly rate of 80,062,767 dollars, in accordance with the levels updated in its \nresolution 79/250, taking into account the scale of assessments for 2025 and 2026, as \nset out in its resolution 79/249, subject to a decision of the Security Council to extend \nthe mandate of the Mission; \n \n17. Decides that, in accordance with the provisions of its resolution 973 (X), \nthere shall be set off against the apportionment among Member States, as provided \nfor in paragraph 16 above, their respective share in the Tax Equalization Fund of \n18,904,500 dollars, comprising the estimated staff assessment income of 14,183,000 \ndollars approved for the Mission, the prorated share of 3,527,900 dollars of the \nestimated staff assessment income approved for the support account, the prorated \nshare of 608,400 dollars of the estimated staff assessment income approved for the \nUnited Nations Logistics Base and the prorated share of 585,200 dollars of the \nestimated staff assessment income approved for the Regional Service Centre; \n \n18. Also decides that, for Member States that have fulfilled their financial \nobligations to the Mission, there shall be set off against their apportionment, as \nprovided for in paragraphs 14 and 16 above, their respective share of the \nunencumbered balance and other revenue in the amount of 97,190,400 dollars in \nrespect of the financial period ended 30 June 2024, in accordance with the levels \n__________________ \n \n3 A/79/681. \n\nA/RES/79/304 \nFinancing of the United Nations Organization Stabilization Mission \nin the Democratic Republic of the Congo\n \n25-10827\n4/4 \n \nupdated in its resolution 76/239 of 24 December 2021, taking into account the scale \nof assessments for 2024, as set out in its resolution 76/238 of 24 December 2021; \n \n19. Further decides that, for Member States that have not fulfilled their \nfinancial obligations to the Mission, there shall be set off against their outstanding \nobligations their respective share of the unencumbered balance and other revenue in \nthe amount of 97,190,400 dollars in respect of the financial period ended 30 June \n2024, in accordance with the scheme set out in paragraph 18 above; \n \n20. Decides that the increase of 1,283,100 dollars in the estimated staff \nassessment income in respect of the financial period ended 30 June 2024 shall be \nadded to the credits in the amount of 97,190,400 dollars referred to in paragraphs 18 \nand 19 above; \n \n21. Encourages the Secretary-General to continue to take additional measures \nto ensure the safety and security of all personnel participating in the Mission under \nthe auspices of the United Nations, bearing in mind paragraphs 5 and 6 of Security \nCouncil resolution 1502 (2003) of 26 August 2003; \n \n22. Invites voluntary contributions to the Mission in cash and in the form of \nservices and supplies acceptable to the Secretary-General, to be administered, as \nappropriate, in accordance with the procedure and practices established by the \nGeneral Assembly; \n \n23. Decides to include in the provisional agenda of its eightieth session the \nitem entitled \u201cFinancing of the United Nations Organization Stabilization Mission in \nthe Democratic Republic of the Congo\u201d. \n \n81st plenary meeting \n30 June 2025 \n \n",
  "paragraphs": {
    "1": "Requests the Secretary General to entrust the Head of Mission with the task of formulating future budget proposals in full accordance with the provisions of its resolutions 59/296 of 22 June 2005, 60/266 of 30 June 2006, 61/276 of 29 June 2007, 64/269 of 24 June 2010, 65/289 of 30 June 2011, 66/264 of 21 June 2012, 69/307 of 25 June 2015, 70/286 of 17 June 2016 and 76/274 of 29 June 2022, as well as other relevant resolutions;",
    "2": "Takes note of the status of contributions to the United Nations Organization Stabilization Mission in the Democratic Republic of the Congo as at 30 April 2025, including the contributions outstanding in the amount of 410.2 million United States dollars, representing some 1.5 per cent of the total assessed contributions, notes with concern that only 81 Member States have paid their assessed contributions in full, and urges all other Member States, in particular those in arrears, to ensure payment of their outstanding assessed contributions;",
    "3": "Expresses its appreciation to those Member States that have paid their assessed contributions in full, and urges all other Member States to make every possible effort to ensure payment of their assessed contributions to the Mission in full;",
    "4": "Expresses concern at the financial situation with regard to peacekeeping activities, in particular as regards the reimbursements to troop contributors that bear additional burdens owing to overdue payments by Member States of their assessments;",
    "5": "Emphasizes that all future and existing peacekeeping missions shall be given equal and non-discriminatory treatment in respect of financial and administrative arrangements;",
    "6": "Also emphasizes that all peacekeeping missions shall be provided with adequate resources for the effective and efficient discharge of their respective mandates;",
    "7": "Requests the Secretary-General to ensure that proposed peacekeeping budgets are based on the relevant legislative mandates;",
    "8": "Endorses the conclusions and recommendations contained in the report of the Advisory Committee on Administrative and Budgetary Questions, subject to the provisions of the present resolution, and requests the Secretary-General to ensure their full implementation;",
    "9": "Requests the Secretary-General to ensure the full implementation of the relevant provisions of its resolutions 59/296, 60/266, 61/276, 64/269, 65/289, 66/264, 69/307, 70/286 and 76/274;",
    "10": "Also requests the Secretary-General to take all action necessary to ensure that the Mission is administered with a maximum of efficiency and economy;",
    "11": "Decides to abolish the post of Facilities Management Assistant (national General Service) in the Engineering and Facilities Camp Management Section that has been vacant for more than 24 months; Financing of the United Nations Organization Stabilization Mission in the Democratic Republic of the Congo A/RES/79/304 3/4 25-10827 Budget performance report for the period from 1 July 2023 to 30 June 2024",
    "12": "Takes note of the report of the Secretary-General on the budget performance of the Mission for the period from 1 July 2023 to 30 June 2024; 3 Budget estimates for the period from 1 July 2025 to 30 June 2026",
    "13": "Decides to appropriate to the special account for the United Nations Organization Stabilization Mission in the Democratic Republic of the Congo the amount of 960,753,200 dollars for the period from 1 July 2025 to 30 June 2026, inclusive of 869,127,200 dollars for the maintenance of the Mission, 72,464,200 dollars for the support account for peacekeeping operations, 10,068,900 dollars for the United Nations Logistics Base at Brindisi, Italy, and 9,092,900 dollars for the Regional Service Centre in Entebbe, Uganda; Financing of the appropriation for the period from 1 July 2025 to 30 June 2026",
    "14": "Decides to apportion among Member States the amount of 451,658,400 dollars for the period from 1 July to 20 December 2025 in accordance with the levels updated in its resolution 79/250 of 24 December 2024, taking into account the scale of assessments for 2025, as set out in its resolution 79/249 of 24 December 2024;",
    "15": "Also decides that, in accordance with the provisions of its resolution 973 (X) of 15 December 1955, there shall be set off against the apportionment among Member States, as provided for in paragraph 14 above, their respective share in the Tax Equalization Fund of 16,771,500 dollars, comprising the estimated staff assessment income of 12,582,800 dollars approved for the Mission, the prorated share of 3,129,900 dollars of the estimated staff assessment income approved for the support account, the prorated share of 539,700 dollars of the estimated staff assessment income approved for the United Nations Logistics Base and the prorated share of 519,100 dollars of the estimated staff assessment income approved for the Regional Service Centre;",
    "16": "Further decides to apportion among Member States the amount of 509,094,800 dollars for the period from 21 December 2025 to 30 June 2026, at a monthly rate of 80,062,767 dollars, in accordance with the levels updated in its resolution 79/250, taking into account the scale of assessments for 2025 and 2026, as set out in its resolution 79/249, subject to a decision of the Security Council to extend the mandate of the Mission;",
    "17": "Decides that, in accordance with the provisions of its resolution 973 (X), there shall be set off against the apportionment among Member States, as provided for in paragraph 16 above, their respective share in the Tax Equalization Fund of 18,904,500 dollars, comprising the estimated staff assessment income of 14,183,000 dollars approved for the Mission, the prorated share of 3,527,900 dollars of the estimated staff assessment income approved for the support account, the prorated share of 608,400 dollars of the estimated staff assessment income approved for the United Nations Logistics Base and the prorated share of 585,200 dollars of the estimated staff assessment income approved for the Regional Service Centre;",
    "18": "Also decides that, for Member States that have fulfilled their financial obligations to the Mission, there shall be set off against their apportionment, as provided for in paragraphs 14 and 16 above, their respective share of the unencumbered balance and other revenue in the amount of 97,190,400 dollars in respect of the financial period ended 30 June 2024, in accordance with the levels __________________ 3 A/79/681. A/RES/79/304 Financing of the United Nations Organization Stabilization Mission in the Democratic Republic of the Congo 25-10827 4/4 updated in its resolution 76/239 of 24 December 2021, taking into account the scale of assessments for 2024, as set out in its resolution 76/238 of 24 December 2021;",
    "19": "Further decides that, for Member States that have not fulfilled their financial obligations to the Mission, there shall be set off against their outstanding obligations their respective share of the unencumbered balance and other revenue in the amount of 97,190,400 dollars in respect of the financial period ended 30 June 2024, in accordance with the scheme set out in paragraph 18 above;",
    "20": "Decides that the increase of 1,283,100 dollars in the estimated staff assessment income in respect of the financial period ended 30 June 2024 shall be added to the credits in the amount of 97,190,400 dollars referred to in paragraphs 18 and 19 above;",
    "21": "Encourages the Secretary-General to continue to take additional measures to ensure the safety and security of all personnel participating in the Mission under the auspices of the United Nations, bearing in mind paragraphs 5 and 6 of Security Council resolution 1502 (2003) of 26 August 2003;",
    "22": "Invites voluntary contributions to the Mission in cash and in the form of services and supplies acceptable to the Secretary-General, to be administered, as appropriate, in accordance with the procedure and practices established by the General Assembly;",
    "23": "Decides to include in the provisional agenda of its eightieth session the item entitled \u201cFinancing of the United Nations Organization Stabilization Mission in the Democratic Republic of the Congo\u201d. 81st plenary meeting 30 June 2025"
  },
  "agenda_items": [
    "Item 159"
  ],
  "symbol_references": []
}