{
  "symbol": "A/RES/77/37",
  "filename": "A_RES_77_37.pdf",
  "title": "77/37. Programme of action to advance responsible State behaviour in the use of information and communications technologies in the context of international security",
  "text": "United Nations \nA/RES/77/37\n \n \nGeneral Assembly \nDistr.: General \n12 December 2022 \n \n22-28102 (E)    151222     \n*2228102* \n \n \nSeventy-seventh session \nAgenda item 94 \nDevelopments in the field of information and \ntelecommunications in the context of international security \n \n \n \n \n Resolution adopted by the General Assembly \non 7 December 2022 \n \n \n \n \n[on the report of the First Committee (A/77/380, para. 11)] \n \n \n \n77/37. Programme of action to advance responsible State behaviour in \nthe use of information and communications technologies in the \ncontext of international security \n \n \n \nThe General Assembly, \n \nRecalling its resolutions 43/78 H of 7 December 1988, 53/70 of 4 December \n1998, 54/49 of 1 December 1999, 55/28 of 20 November 2000, 56/19 of 29 November \n2001, 57/53 of 22 November 2002, 58/32 of 8 December 2003, 59/61 of 3 December \n2004, 60/45 of 8 December 2005, 61/54 of 6 December 2006, 62/17 of 5 December \n2007, 63/37 of 2 December 2008, 64/25 of 2 December 2009, 65/41 of 8 December \n2010, 66/24 of 2 December 2011, 67/27 of 3 December 2012, 68/243 of 27 December \n2013, 69/28 of 2 December 2014, 70/237 of 23 December 2015, 71/28 of 5 December \n2016, 73/27 of 5 December 2018, 73/266 of 22 December 2018, 74/28 and 74/29 of \n12 December 2019, 75/32 of 7 December 2020, 75/240 of 31 December 2020 and \n76/19 of 6 December 2021, \n \nNoting that considerable progress has been achieved in developing and applying \nthe latest information technologies and means of telecommunication, \n \nRecognizing that the dissemination and use of information and communications \ntechnologies affect the interests of the entire global community and that broad \ninternational cooperation would lead to the most effective responses, \n \nExpressing \nconcern \nthat \ninformation \ntechnologies \nand \nmeans \nof \ntelecommunication can potentially be used for purposes that are inconsistent with the \nobjectives of maintaining international stability and security and may adversely affect \nthe integrity of the infrastructure of States, to the detriment of their security in both \ncivil and military fields, \n\nA/RES/77/37 \nProgramme of action to advance responsible State behaviour in the \nuse of information and communications technologies in the context of \ninternational security\n \n22-28102\n2/4 \n \n \nExpressing concern also about malicious information and communications \ntechnology activities aimed at critical infrastructure and critical information \ninfrastructure facilities supporting essential services to the public, \n \nConsidering that it is necessary to prevent the use of information resources or \ntechnologies for criminal or terrorist purposes, \n \nStressing that it is in the interest of all States to seek the settlement of disputes \nby peaceful means, and to promote the use of information and communications \ntechnologies for peaceful purposes and to prevent conflicts arising from the use of \ninformation and communications technologies, \n \nUnderlining the importance of respect for human rights and fundamental \nfreedoms in the use of information and communications technologies, \n \nHighlighting the necessity of bridging digital divides, building resilience in \nevery society and sector, and maintaining a human-centric approach, \n \nRecalling the assessments and recommendations of the 2010, 2013, 2015 and \n2021 groups of governmental experts, as well as those of the 2021 Open-ended \nWorking \nGroup \non \nDevelopments \nin \nthe \nField \nof \nInformation \nand \nTelecommunications in the Context of International Security, 1 and the first annual \nprogress report of the open-ended working group on security of and in the use of \ninformation and communications technologies 2021\u20132025, 2  in particular the \ncumulative and evolving framework for responsible State behaviour in the use of \ninformation and communications technologies elaborated by these processes, \n \nCalling upon Member States to be guided in their use of information and \ncommunications technologies by the 2010, 2013, 2015 and 2021 reports of the Group \nof Governmental Experts and the 2021 report of the Open-ended Working Group, \n \nRecalling the conclusion of the above-mentioned reports that international law, \nand in particular the Charter of the United Nations, is applicable and essential to \nmaintaining peace and stability and promoting an open, secure, stable, accessible and \npeaceful information and communications technology environment, \n \nReaffirming that voluntary, non-binding norms of responsible State behaviour \nin the use of information and communications technologies can reduce risks to \ninternational peace, security and stability, and do not seek to limit or prohibit action \nthat is otherwise consistent with international law but nonetheless to set standards for \nresponsible State behaviour, while also reaffirming that, given the unique attributes \nof information and communications technologies, additional norms could be \ndeveloped over time and, separately, noting the possibility of future elaboration of \nadditional binding obligations, if appropriate, \n \nRecalling that confidence-building measures in the field of information and \ncommunications technology security can contribute to preventing conflicts, avoiding \nmisperceptions, misunderstandings and the reduction of tensions, and that regional \nand subregional organizations have made significant efforts in developing \nconfidence-building measures, \n \nSupporting the open-ended working group 2021\u20132025, and further encouraging \nit to take into account the outcomes of the previous Open-ended Working Group and \nthe groups of governmental experts and add to the efforts undertaken by them, \n \nUnderlining the complementarity of the proposal for a programme of action \nwith the work of the current open-ended working group 2021\u20132025, \n__________________ \n \n1 See A/65/201, A/68/98, A/70/174, A/75/816 and A/76/135. \n \n2 See A/77/275. \n\nProgramme of action to advance responsible State behaviour in the \nuse of information and communications technologies in the context \nof international security \nA/RES/77/37\n \n3/4\n22-28102 \n \n \nReaffirming that any future mechanism for regular institutional dialogue under \nthe auspices of the United Nations should be an action-oriented process with specific \nobjectives, building on previous outcomes, and be inclusive, transparent, consensus-\ndriven and results-based, \n \nRecognizing the utility of exploring mechanisms dedicated to following up on \nthe implementation of the agreed norms and rules as well as the development of \nfurther ones, \n \nStressing the urgent need to assist States in their efforts to implement the \nframework for responsible State behaviour and tackle emerging threats in the \ninformation and communications technology environment, as the ever-evolving \nproperties and characteristics of new and emerging technologies expand the attack \nsurface, creating new vectors and vulnerabilities that can be exploited for malicious \ninformation and communications technology activity, \n \nEmphasizing that capacity-building is essential for cooperation of States and \nconfidence-building in the field of information and communications technology \nsecurity, and that capacity-building in relation to State use of information and \ncommunications technologies in the context of international security should be guided \nby the principles for capacity-building included the 2021 final report of the Open-\nended Working Group, \n \nReaffirming that the United Nations should continue to play a leading role in \npromoting dialogue on the use of information and communications technologies by \nStates, \n \nEmphasizing the value of further strengthening collaboration, when appropriate, \nwith civil society, the private sector, academia and the technical community, to \nstrengthen security and stability in the information and communications technology \nenvironment,  \n \nEncouraging States to, on a voluntary basis, survey or report on their national \nefforts to implement rules, norms and principles, including through the report of the \nSecretary-General on developments in the field of information and communications \ntechnologies in the context of international security as well as the National Survey of \nImplementation, \n \nUnderlining the importance of narrowing the \u201cgender digital divide\u201d and of \npromoting the full, equal and meaningful participation and leadership of women in \ndecision-making processes related to the use of information and communications \ntechnologies in the context of international security,  \n \nWelcoming the recommendation by the open-ended working group 2021\u20132025 \nin its first annual progress report that States engage in discussions on the scope, \nstructure and content of the programme of action at the fourth and fifth substantive \nsessions of the open-ended working group, \n \n1. \nWelcomes the proposal to establish a United Nations programme of action \nto advance responsible State behaviour in the use of information and communications \ntechnologies in the context of international security, as a permanent, inclusive, action-\noriented mechanism to discuss existing and potential threats; to support States\u2019 \ncapacities and efforts to implement and advance commitments to be guided by the \nframework for responsible State behaviour, which includes voluntary, non-binding \nnorms for the application of international law to the use of information and \ncommunications technologies by States, confidence-building and capacity building \nmeasures, as affirmed in General Assembly resolution 76/19, the 2010, 2013, 2015 \nand 2021 reports of the groups of governmental experts, the 2021 report of the Open-\nended Working Group on Developments in the Field of Information and \n\nA/RES/77/37 \nProgramme of action to advance responsible State behaviour in the \nuse of information and communications technologies in the context of \ninternational security\n \n22-28102\n4/4 \n \nTelecommunications in the Context of International Security and the first annual \nprogress report of the open-ended working group on security of and in the use of \ninformation and communications technologies 2021\u20132025; to discuss, and further \ndevelop if appropriate, this framework; to promote engagement and cooperation with \nrelevant stakeholders; and to periodically review the progress made in the \nimplementation of the programme of action as well as the programme\u2019s future work; \n \n2. \nUnderlines that the programme of action is to take into account the \nconsensus outcomes adopted by the open-ended working group 2021\u20132025; \n \n3. \nRequests the Secretary-General, within existing resources and through \nvoluntary contributions, to seek the views of Member States on the scope, structure \nand content for the programme of action, and the preparatory work and modalities for \nits establishment, including at an international conference, taking into account \nGeneral Assembly resolution 76/19, the 2010, 2013, 2015 and 2021 consensus reports \nof the groups of governmental experts, the 2021 report of the Open-ended Working \nGroup, the first annual progress report of the open-ended working group 2021\u20132025, \nthe views and contributions submitted by Member States in the framework of the \nopen-ended working group 2021\u20132025 and the regional consultations held in \naccordance with paragraph 4 of the present resolution, and to submit a report based \non those views to the General Assembly at its seventy-eighth session and for further \ndiscussion between Member States in the meetings of the open-ended working group \n2021\u20132025; \n \n4. \nRequests the Office for Disarmament Affairs of the Secretariat, within \nexisting resources and through voluntary contributions, to collaborate with relevant \nregional organizations whose members are also States Members of the United Nations \nto convene a series of consultations to share views on the programme of action; \n \n5. \nDecides to include in the provisional agenda of its seventy-eighth session \nthe item entitled \u201cDevelopments in the field of information and telecommunications \nin the context of international security\u201d.  \n \n46th plenary meeting \n7 December 2022 \n \n \n",
  "paragraphs": {
    "1": "Welcomes the proposal to establish a United Nations programme of action to advance responsible State behaviour in the use of information and communications technologies in the context of international security, as a permanent, inclusive, action- oriented mechanism to discuss existing and potential threats; to support States\u2019 capacities and efforts to implement and advance commitments to be guided by the framework for responsible State behaviour, which includes voluntary, non-binding norms for the application of international law to the use of information and communications technologies by States, confidence-building and capacity building measures, as affirmed in General Assembly resolution 76/19, the 2010, 2013, 2015 and 2021 reports of the groups of governmental experts, the 2021 report of the Open- ended Working Group on Developments in the Field of Information and Telecommunications in the Context of International Security and the first annual progress report of the open-ended working group on security of and in the use of information and communications technologies 2021\u20132025; to discuss, and further develop if appropriate, this framework; to promote engagement and cooperation with relevant stakeholders; and to periodically review the progress made in the implementation of the programme of action as well as the programme\u2019s future work;",
    "2": "Underlines that the programme of action is to take into account the consensus outcomes adopted by the open-ended working group 2021\u20132025;",
    "3": "Requests the Secretary-General, within existing resources and through voluntary contributions, to seek the views of Member States on the scope, structure and content for the programme of action, and the preparatory work and modalities for its establishment, including at an international conference, taking into account General Assembly resolution 76/19, the 2010, 2013, 2015 and 2021 consensus reports of the groups of governmental experts, the 2021 report of the Open-ended Working Group, the first annual progress report of the open-ended working group 2021\u20132025, the views and contributions submitted by Member States in the framework of the open-ended working group 2021\u20132025 and the regional consultations held in accordance with paragraph 4 of the present resolution, and to submit a report based on those views to the General Assembly at its seventy-eighth session and for further discussion between Member States in the meetings of the open-ended working group 2021\u20132025;",
    "4": "Requests the Office for Disarmament Affairs of the Secretariat, within existing resources and through voluntary contributions, to collaborate with relevant regional organizations whose members are also States Members of the United Nations to convene a series of consultations to share views on the programme of action;",
    "5": "Decides to include in the provisional agenda of its seventy-eighth session the item entitled \u201cDevelopments in the field of information and telecommunications in the context of international security\u201d."
  },
  "agenda_items": [
    "Item 94"
  ],
  "symbol_references": []
}