{
  "symbol": "A/RES/77/32",
  "filename": "A_RES_77_32.pdf",
  "title": "77/32. International Year of Dialogue as a Guarantee of Peace, 2023",
  "text": "United Nations \nA/RES/77/32\n \n \nGeneral Assembly \nDistr.: General \n8 December 2022 \n \n22-27794 (E)    131222 \n*2227794* \n \n \nSeventy-seventh session \nAgenda item 14 \nCulture of peace \n \n \n \n \n Resolution adopted by the General Assembly \non 6 December 2022 \n \n \n \n \n[without reference to a Main Committee (A/77/L.10)] \n \n \n \n77/32. International Year of Dialogue as a Guarantee of Peace, 2023 \n \n \n \nThe General Assembly,  \n \nRecognizing the important role of the United Nations in developing friendly \nrelations among nations,  \n \nReaffirming the Charter of the United Nations and its purposes and principles, \nand especially the commitment to settle disputes through peaceful means and the \ndetermination to save succeeding generations from the scourge of war,  \n \nRecognizing the importance of the Declaration and Programme of Action on a \nCulture of Peace,1 which serve as the universal mandate for the international \ncommunity, particularly the United Nations system, for the promotion of a culture of \npeace and non-violence that benefits humanity, in particular future generations,  \n \nReaffirming that inclusive dialogue in its various manifestations plays an \nimportant role in strengthening the relationship and cooperation between Member \nStates,  \n \nReaffirming also the role of inclusive dialogue in promoting a culture of peace \nin support of proactive peace efforts as a basis for achieving the Sustainable \nDevelopment Goals,  \n \nWelcoming the efforts made by the United Nations Member States to address \nglobal challenges and advance in a spirit of trust and solidarity, in order to find \ncommon solutions and move forward in areas of mutual interest towards a relationship \nbased on dialogue and cooperation,  \n \nRecognizing that all efforts made by the United Nations system in general and \nthe international community at large for the prevention of conflicts, the peaceful \nsettlement of disputes, peacekeeping, peacebuilding, mediation, disarmament, \n__________________ \n \n1  Resolutions 53/243 A and B. \n\nA/RES/77/32 \nInternational Year of Dialogue as a Guarantee of Peace, 2023\n \n22-27794\n2/4 \n \nsustainable development, the promotion of human dignity and human rights, social \ninclusion, democracy, the rule of law, good governance and gender equality at the \nnational and international levels contribute greatly to a culture of peace,  \n \nRecognizing also the role of international, regional and subregional \norganizations, in accordance with their mandates, in the promotion and preservation \nof peace,  \n \nRecognizing further the importance of respect and understanding for religious \nand cultural diversity throughout the world, of choosing dialogue and negotiations \nover confrontation and of working together and not against each other,  \n \nRecognizing that the open, constructive and respectful debate of ideas, as well \nas interreligious, interfaith and intercultural dialogue, at the local, national, regional \nand international levels, can play a positive role in combating religious hatred, \nincitement and violence,  \n \nEmphasizing the role of women and youth, as well as the contribution of \nchildren and older persons in advancing a culture of peace, and in particular the \nimportance of the active participation of women in the prevention and resolution of \nconflicts and in activities promoting a culture of peace, including in post-conflict \nsituations,  \n \nRecognizing the importance of developing more peaceful societies through \nadvancing equality, tolerance, human development and promoting human rights, and \nin this regard calling for investment in education, including through effective policies \nand practices, towards promoting respect, reconciliation and a culture of peace and \nnon-violence,  \n \nEmphasizing that the policy of neutrality declared and pursued by States \nMembers of the United Nations plays an important role in the development of \npeaceful, trust-based, friendly and mutually beneficial relations among the countries \nof the world and contributes to the strengthening of international peace and security \nat the regional and global levels,  \n \nRecognizing the importance of combating poverty, hunger, disease, illiteracy \nand unemployment, and emphasizing that friendship to all and malice towards none, \nin the spirit of constructive cooperation, dialogue and mutual understanding, will help \nto achieve these objectives,  \n \nConvinced that dialogue contributes to combining the efforts of the international \ncommunity in consolidating the traditions of peaceful and trust-based coexistence \namong the peoples of the world, restoring the values, attitudes and traditions of \nmaintaining and promoting peace and the comprehensive establishment of a culture \nof peace and trust in international relations,  \n \nRecognizing the urgent need to promote and strengthen preventive diplomacy, \ninter alia, through multilateralism and political dialogue, and the important role of the \nUnited Nations in this regard,  \n \nStressing the importance of preventive diplomacy in supporting the efforts of \nthe United Nations to promote the peaceful settlement of conflicts, in order to \npreserve peace,  \n \nWelcoming the efforts of the international community to enhance understanding \nthrough constructive dialogue among civilizations, in particular through various \ninitiatives at the local, national, regional and international levels,  \n \nExpressing its appreciation for the ongoing efforts of the United Nations \nAlliance of Civilizations in fostering international dialogue, greater understanding \nand respect among civilizations, cultures, religions and beliefs and promoting a \n\nInternational Year of Dialogue as a Guarantee of Peace, 2023 \nA/RES/77/32\n \n3/4\n22-27794 \n \nculture of peace through a number of practical projects in the areas of youth, \neducation, media and migrations, in collaboration with Governments, international \norganizations, foundations and civil society groups, as well as media and the private \nsector,  \n \nNoting the importance of the Eighth United Nations Alliance of Civilizations \nForum, held at United Nations Headquarters on 19 and 20 November 2018 under the \ntheme \u201c#Commit2Dialogue: partnerships for prevention and sustaining peace\u201d, as \nwell as the Ninth United Nations Alliance of Civilizations Global Forum, held in Fez, \nMorocco, on 22 and 23 November 2022 under the theme \u201cTowards an alliance of \npeace: living together as one humanity\u201d, aimed at discussing ways of promoting \ndialogue, tolerance, cultural and religious diversity and pluralism,  \n \nWelcoming the work of the Congress of the Leaders of World and Traditional \nReligions as an international interreligious dialogue platform for the benefit of peace, \nand noting the importance of the Declaration of the Seventh Congress, held in Astana \non 14 and 15 September 2022,  \n \nReaffirming its resolutions 53/199 of 15 December 1998 and 61/185 of \n20 December 2006 on the proclamation of international years, and Economic and \nSocial Council resolution 1980/67 of 25 July 1980 on international years and \nanniversaries,  \n \nEmphasizing that dialogue is a transformative peacebuilding method in \nresolving conflicts and in building peace,  \n \nRecognizing that dialogue as a valuable tool in conflict resolution and \nprevention can help to ease tensions, resolve disputes, overcome dividing lines and \ncontribute to a culture of peace and non-violence, people-to-people contacts and \nreconciliation,  \n \nNoting that the Secretary-General is working to advance dialogue through \ncooperation with Governments, international organizations, regional bodies, civil \nsociety and the private sector,  \n \n1. \nDeclares 2023 the International Year of Dialogue as a Guarantee of Peace;  \n \n2. \nUnderlines that the International Year of Dialogue as a Guarantee of Peace \nconstitutes a means of mobilizing the efforts of the international community to \npromote peace and trust among nations based on, inter alia, political dialogue, \nnegotiations, mutual understanding and cooperation, in order to build sustainable \npeace, solidarity and harmony;  \n \n3. \nCalls upon the international community to resolve conflicts through \ninclusive dialogue and negotiation in order to ensure the strengthening of peace and \ntrust in relations between Member States as a value that promotes sustainable \ndevelopment, peace and security and human rights;  \n \n4. \nAcknowledges the importance of mediation in the peaceful settlement of \ndisputes, conflict prevention and resolution and in seeking long-term political \nsolutions for sustaining peace, and recognizes that mediation needs to be further and \nmore effectively used, without prejudice to other means mentioned in Chapter VI of \nthe Charter of the United Nations;  \n \n5. \nInvites all Member States, organizations of the United Nations system, \ninternational \nand \nregional \norganizations \nand \ncivil \nsociety, \nincluding \nnon-governmental organizations, individuals and other relevant stakeholders, to \nfacilitate the observance of the International Year of Dialogue as a Guarantee of Peace \nin an appropriate manner and to disseminate the advantages of peace and trust, \nincluding through educational and public awareness-raising activities;  \n\nA/RES/77/32 \nInternational Year of Dialogue as a Guarantee of Peace, 2023\n \n22-27794\n4/4 \n \n \n6. \nRequests the Secretary-General to bring the present resolution to the \nattention of all Member States, organizations of the United Nations system and other \ninternational and regional organizations, as well as civil society, including \nnon-governmental organizations and individuals;  \n \n7. \nStresses that the cost of all activities that may arise from the \nimplementation of the present resolution should be met from voluntary contributions. \n \n45th plenary meeting \n6 December 2022 \n \n",
  "paragraphs": {
    "1": "Declares 2023 the International Year of Dialogue as a Guarantee of Peace;",
    "2": "Underlines that the International Year of Dialogue as a Guarantee of Peace constitutes a means of mobilizing the efforts of the international community to promote peace and trust among nations based on, inter alia, political dialogue, negotiations, mutual understanding and cooperation, in order to build sustainable peace, solidarity and harmony;",
    "3": "Calls upon the international community to resolve conflicts through inclusive dialogue and negotiation in order to ensure the strengthening of peace and trust in relations between Member States as a value that promotes sustainable development, peace and security and human rights;",
    "4": "Acknowledges the importance of mediation in the peaceful settlement of disputes, conflict prevention and resolution and in seeking long-term political solutions for sustaining peace, and recognizes that mediation needs to be further and more effectively used, without prejudice to other means mentioned in Chapter VI of the Charter of the United Nations;",
    "5": "Invites all Member States, organizations of the United Nations system, international and regional organizations and civil society, including non-governmental organizations, individuals and other relevant stakeholders, to facilitate the observance of the International Year of Dialogue as a Guarantee of Peace in an appropriate manner and to disseminate the advantages of peace and trust, including through educational and public awareness-raising activities;",
    "6": "Requests the Secretary-General to bring the present resolution to the attention of all Member States, organizations of the United Nations system and other international and regional organizations, as well as civil society, including non-governmental organizations and individuals;",
    "7": "Stresses that the cost of all activities that may arise from the implementation of the present resolution should be met from voluntary contributions."
  },
  "agenda_items": [
    "Item 14"
  ],
  "symbol_references": [
    "A/77/L.10"
  ]
}