{
  "symbol": "A/RES/73/286",
  "filename": "A_RES_73_286.pdf",
  "title": "73/286. International Delegate\u2019s Day",
  "text": "United Nations \nA/RES/73/286\n \n \nGeneral Assembly \nDistr.: General \n4 April 2019 \n \n19-05486 (E)    080419     \n*1905486* \n \n \nSeventy-third session \nAgenda item 125 \n \n \n \n \n Resolution adopted by the General Assembly \non 2 April 2019 \n \n \n \n \n[without reference to a Main Committee (A/73/L.78 and A/73/L.78/Add.1)] \n \n \n 73/286. International Delegate\u2019s Day \n \n \n \nThe General Assembly, \n \nMindful of the celebration, in 2020, of the seventy-fifth anniversary of the San \nFrancisco Conference, in which 850 delegates took part, and which resulted in the \ncreation of the United Nations, an organization that now comprises 193 Member \nStates and serves as the main international venue for collective dialogue between the \ndelegates of its Member States,  \n \nRecognizing the role of the representatives of the Governments assembled in \nSan Francisco who agreed to the Charter of the United Nations,  \n \nRecalling its resolution 168 (II) of 31 October 1947, by which it declared \n24 October United Nations Day, devoted to making known to the peoples of the world \nthe aims and achievements of the United Nations and to gaining their support for the \nwork of the United Nations,  \n \nWelcoming the initiatives of States Members of the United Nations on the \nestablishment and celebration of a diplomatic workers\u2019 or service day, where such exist,  \n \nRecalling its resolutions 53/199 of 15 December 1998 and 61/185 of \n20 December 2006 on the proclamation of international years, and Economic and \nSocial Council resolution 1980/67 of 25 July 1980 on international years and \nanniversaries,  \n \n1. \nDecides to designate 25 April as International Delegate\u2019s Day, 1  to be \nobserved every year, beginning in 2020;  \n \n2. \nInvites all Member States, the organizations of the United Nations system \nand other international and regional organizations, as well as non-governmental \norganizations and individuals, to observe International Delegate\u2019s Day, in an \n__________________ \n \n1  In accordance with rule 25 of the rules of procedure of the General Assembly in relation to the \nStates Members of the United Nations. \n\nA/RES/73/286 \nInternational Delegate\u2019s Day\n \n19-05486\n2/2 \n \nappropriate manner and in accordance with national priorities, in order to highlight \nthe role of the delegates of the States Members of the United Nations in fulfilling the \nmain goals of the United Nations, in particular in maintaining international peace and \nsecurity and employing international machinery for the promotion of the economic \nand social advancement of all peoples, and in promoting and encouraging respect for \nhuman rights and fundamental freedoms, as envisaged in the Charter of the United \nNations, as well as in promoting effective multilateralism, and notes that the cost of \nall activities that may arise from the implementation of the present resolution should \nbe met from voluntary contributions;  \n \n3. \nRequests the Secretary-General to bring the present resolution to the \nattention of all States Members and observers of the United Nations and the \norganizations of the United Nations system. \n \n73rd plenary meeting \n2 April 2019 \n \n",
  "paragraphs": {
    "1": "Decides to designate 25 April as International Delegate\u2019s Day, 1 to be observed every year, beginning in 2020;",
    "2": "Invites all Member States, the organizations of the United Nations system and other international and regional organizations, as well as non-governmental organizations and individuals, to observe International Delegate\u2019s Day, in an appropriate manner and in accordance with national priorities, in order to highlight the role of the delegates of the States Members of the United Nations in fulfilling the main goals of the United Nations, in particular in maintaining international peace and security and employing international machinery for the promotion of the economic and social advancement of all peoples, and in promoting and encouraging respect for human rights and fundamental freedoms, as envisaged in the Charter of the United Nations, as well as in promoting effective multilateralism, and notes that the cost of all activities that may arise from the implementation of the present resolution should be met from voluntary contributions;",
    "3": "Requests the Secretary-General to bring the present resolution to the attention of all States Members and observers of the United Nations and the organizations of the United Nations system."
  },
  "agenda_items": [
    "Item 125"
  ],
  "symbol_references": [
    "A/73/L.78"
  ]
}