{
  "symbol": "A/RES/73/340",
  "filename": "A_RES_73_340.pdf",
  "title": "73/340. Scope, modalities, format and organization of the high-level meeting on the twenty-fifth anniversary of the Fourth World Conference on Women",
  "text": "United Nations \nA/RES/73/340 \n \n \nGeneral Assembly \nDistr.: General \n16 September 2019 \n \n19-15703 (E)    180919     \n*1915703* \n \n \nSeventy-third session \nAgenda item 29 \n \n \n \n \n Resolution adopted by the General Assembly \non 12 September 2019 \n \n \n \n \n[without reference to a Main Committee (A/73/L.115)] \n \n \n 73/340. Scope, modalities, format and organization of the high-level \nmeeting on the twenty-fifth anniversary of the Fourth World \nConference on Women \n \n \n \nThe General Assembly, \n \nRecognizing the significance of the Fourth World Conference on Women, held \nin Beijing in September 1995, \n \nReaffirming the Beijing Declaration and Platform for Action adopted in 1995 at \nthe Fourth World Conference on Women1 and the outcome documents of its twenty-\nthird special session,2 \n \nRecalling its resolution 73/294 of 22 May 2019, entitled \u201cTwenty-fifth \nanniversary of the Fourth World Conference on Women\u201d, in which it decided to \nconvene a one-day high-level meeting of the General Assembly in the margins of the \ngeneral debate at its seventy-fifth session in order to celebrate the twenty-fifth \nanniversary of the Fourth World Conference on Women, so as to accelerate the \nrealization of gender equality and the empowerment of all women and girls,  \n \nRecognizing that, through the adoption of the 2030 Agenda for Sustainable \nDevelopment3 and its Sustainable Development Goals in September 2015, Heads of \nState and Government confirmed that realizing gender equality and the empowerment \nof women and girls will make a crucial contribution to progress across all the Goals \nand targets,  \n \nReiterating that the full, effective and accelerated implementation of the Beijing \nDeclaration and Platform for Action and the outcome of the twenty-third special \n__________________ \n \n1  Report of the Fourth World Conference on Women, Beijing, 4\u201315 September 1995 (United \nNations publication, Sales No. E.96.IV.13), chap. I, resolution 1, annexes I and II. \n \n2  Resolution S-23/2, annex, and resolution S-23/3, annex. \n \n3  Resolution 70/1. \n\nA/RES/73/340 \nScope, modalities, format and organization of the high-level meeting on\nthe twenty-fifth anniversary of the Fourth World Conference on Women\n \n19-15703\n2/4 \n \nsession is essential to achieving the Sustainable Development Goals and gender \nequality and the empowerment of women and girls, \n \n1. \nDecides that the one-day high-level meeting of the General Assembly on \nthe twenty-fifth anniversary of the Fourth World Conference on Women shall be held \nin New York on Wednesday, 23 September 2020, in the margins of the general debate \nof the Assembly at its seventy-fifth session, from 9 a.m. to 7 p.m., and consist of an \nopening segment, a plenary segment for general discussion and a closing segment;  \n \n2. \nAlso decides that the theme of the high-level meeting of the General \nAssembly will be \u201cAccelerating the realization of gender equality and the \nempowerment of all women and girls\u201d and that this meeting will highlight \nachievements, best practices, gaps and challenges, and recalls that the theme of the \nseventy-fifth anniversary of the United Nations, \u201cThe future we want, the United \nNations we need: reaffirming our collective commitment to multilateralism\u201d, shall \nguide all activities, meetings and conferences organized by the United Nations \nin 2020; \n \n3. \nFurther decides that:  \n \n(a) \nThe opening segment, to be held from 9 to 10 a.m., will feature statements \nby the President of the General Assembly at its seventy-fifth session, the Secretary-\nGeneral, a representative of China as the host country of the Fourth World Conference \non Women, the Under-Secretary-General/Executive Director of the United Nations \nEntity for Gender Equality and the Empowerment of Women (UN-Women), the \nExecutive Director of the United Nations Population Fund, the Chair of the \nCommittee on the Elimination of Discrimination against Women, the Chair of the \nWorking Group of the Human Rights Council on the issue of discrimination against \nwomen in law and in practice, the Special Rapporteur of the Human Rights Council \non violence against women, its causes and consequences, as well as an eminent high-\nlevel champion of gender equality, a representative from civil society and a young \nwoman leader, to be selected, in consultation with Member States, by the President \nof the Assembly;  \n \n(b) \nThe plenary segment, to be held from 10 a.m. to 6.30 p.m., will comprise \nstatements by all States Members of the United Nations and members of the \nspecialized agencies that have observer status with the General Assembly, \nintergovernmental organizations and entities that have observer status with the \nAssembly, a list of speakers will be established in accordance with established \npractices of the Assembly and the time limits for these statements will be three \nminutes for individual delegations and five minutes for statements made on behalf of \na group of States;  \n \n(c) \nThe closing segment, to be held from 6.30 to 7 p.m., will comprise \nconcluding remarks by the President of the General Assembly;  \n \n4. \nRequests the President of the General Assembly, with the support of the \nUnited Nations Entity for Gender Equality and the Empowerment of Women \n(UN-Women), to organize and preside over an interactive multi-stakeholder hearing \nfollowing the high-level political forum on sustainable development in July 2020, \nwith the active participation of representatives of all States Members of the United \nNations and members of the specialized agencies that have observer status with the \nGeneral Assembly, intergovernmental organizations and entities that have observer \nstatus with the Assembly, and parliamentarians, representatives of non-governmental \norganizations in consultative status with the Economic and Social Council, invited \ncivil society organizations, national human rights institutions, where they exist, \nacademic institutions and the private sector, ensuring the participation and voices of \nwomen and girls as part of the preparatory process for the high-level meeting of the \n\nScope, modalities, format and organization of the high-level meeting on \nthe twenty-fifth anniversary of the Fourth World Conference on Women \nA/RES/73/340\n \n3/4\n19-15703 \n \nAssembly, to take stock of the outcomes and recommendations of other processes, \nincluding the sixty-fourth session of the Commission on the Status of Women and \nrelevant initiatives such as the Generation Equality Forum scheduled to take place in \nMay and July 2020, and also requests the President of the Assembly to prepare a \nsummary of the interactive multi-stakeholder hearing prior to the high-level meeting \nof the Assembly;  \n \n5. \nInvites non-governmental organizations in consultative status with the \nEconomic and Social Council with relevant expertise to register with the Secretariat \nto attend the high-level meeting of the General Assembly and the interactive \nmulti-stakeholder hearing;  \n \n6. \nRequests the President of the General Assembly to draw up a list of other \nrelevant representatives of relevant non-governmental organizations and civil society \norganizations, including individuals whose efforts have supported the implementation \nof the Beijing Declaration and Platform of Action1 and the human rights addressed \ntherein, national human rights institutions, where they exist, academic institutions \nand the private sector, who may attend the high-level meeting of the General \nAssembly to be held on 23 September 2020 and participate in the interactive \nmulti-stakeholder hearing, taking into account the principles of transparency and \nequitable geographical representation, with due regard to the full and meaningful \nparticipation of women and young people, and to submit the list to Member States for \ntheir consideration on a non-objection basis;4 \n \n7. \nInvites members of civil society, non-governmental organizations, the \nprivate sector, academia, development partners and other relevant initiatives to make \na fundamental contribution to the process in terms of raising awareness of gaps and \nchallenges and identifying concrete actions to accelerate the realization of gender \nequality and the empowerment of all women and girls and its contribution towards \nthe achievement of the Sustainable Development Goals;3  \n \n8. \nEncourages participation in the high-level meeting of the General \nAssembly, at the highest possible level, and encourages Governments to present \nconcrete actions and commitments to accelerate the realization of gender equality and \nthe empowerment of all women and girls by 2030, including in support of the role of \ncivil society organizations and youth;  \n \n9. \nInvites the Inter-Parliamentary Union to contribute to the high-level \nmeeting of the General Assembly;  \n \n10. Invites the United Nations system, including funds, programmes and \nspecialized agencies, regional commissions and relevant envoys of the Secretary-\nGeneral, to participate in the high-level meeting of the General Assembly, as \nappropriate, and urges them to consider initiatives in support of the preparatory process \nand the high-level meeting of the Assembly, particularly with regard to sharing good \npractices, challenges, lessons learned and urgent actions that need to be taken for the \nrealization of gender equality and the empowerment of all women and girls;  \n \n11. Encourages Member States to consider including in their national \ndelegations heads of national mechanisms for the promotion of gender equality and \nthe empowerment of women and girls, as appropriate, as well as representatives such \nas parliamentarians, representatives of civil society and other relevant stakeholders;  \n__________________ \n \n4  The list of proposed as well as final names will be brought to the attention of the General \nAssembly. Where a name is objected to, the objecting Member State will, on a voluntary basis, \nmake known to the Office of the President of the General Assembly the general basis of its \nobjections and the Office will share any information received with any Member State upon its \nrequest. \n\nA/RES/73/340 \nScope, modalities, format and organization of the high-level meeting on\nthe twenty-fifth anniversary of the Fourth World Conference on Women\n \n19-15703\n4/4 \n \n \n12. Decides that the proceedings of the high-level meeting of the General \nAssembly shall be webcast, and encourages the Secretary-General and UN-Women to \ngive the highest visibility to this meeting and its summary, as well as to the interactive \nmulti-stakeholder hearing, through all relevant media platforms and information and \ncommunications technologies;  \n \n13. Requests the President of the General Assembly to prepare a summary of \nthe high-level meeting of the General Assembly and to bring the summary to the \nattention of Member States, relevant United Nations entities and other stakeholders;  \n \n14. Requests the President of the General Assembly at its seventy-fourth \nsession to finalize the organizational arrangements for the high-level meeting of the \nGeneral Assembly, in close consultation with Member States.  \n \n106th plenary meeting  \n12 September 2019 \n \n",
  "paragraphs": {
    "1": "Decides that the one-day high-level meeting of the General Assembly on the twenty-fifth anniversary of the Fourth World Conference on Women shall be held in New York on Wednesday, 23 September 2020, in the margins of the general debate of the Assembly at its seventy-fifth session, from 9 a.m. to 7 p.m., and consist of an opening segment, a plenary segment for general discussion and a closing segment;",
    "2": "Also decides that the theme of the high-level meeting of the General Assembly will be \u201cAccelerating the realization of gender equality and the empowerment of all women and girls\u201d and that this meeting will highlight achievements, best practices, gaps and challenges, and recalls that the theme of the seventy-fifth anniversary of the United Nations, \u201cThe future we want, the United Nations we need: reaffirming our collective commitment to multilateralism\u201d, shall guide all activities, meetings and conferences organized by the United Nations in 2020;",
    "3": "Further decides that: (a) The opening segment, to be held from 9 to 10 a.m., will feature statements by the President of the General Assembly at its seventy-fifth session, the Secretary- General, a representative of China as the host country of the Fourth World Conference on Women, the Under-Secretary-General/Executive Director of the United Nations Entity for Gender Equality and the Empowerment of Women (UN-Women), the Executive Director of the United Nations Population Fund, the Chair of the Committee on the Elimination of Discrimination against Women, the Chair of the Working Group of the Human Rights Council on the issue of discrimination against women in law and in practice, the Special Rapporteur of the Human Rights Council on violence against women, its causes and consequences, as well as an eminent high- level champion of gender equality, a representative from civil society and a young woman leader, to be selected, in consultation with Member States, by the President of the Assembly; (b) The plenary segment, to be held from 10 a.m. to 6.30 p.m., will comprise statements by all States Members of the United Nations and members of the specialized agencies that have observer status with the General Assembly, intergovernmental organizations and entities that have observer status with the Assembly, a list of speakers will be established in accordance with established practices of the Assembly and the time limits for these statements will be three minutes for individual delegations and five minutes for statements made on behalf of a group of States; (c) The closing segment, to be held from 6.30 to 7 p.m., will comprise concluding remarks by the President of the General Assembly;",
    "4": " Assembly, to take stock of the outcomes and recommendations of other processes, including the sixty-fourth session of the Commission on the Status of Women and relevant initiatives such as the Generation Equality Forum scheduled to take place in May and July 2020, and also requests the President of the Assembly to prepare a summary of the interactive multi-stakeholder hearing prior to the high-level meeting of the Assembly;",
    "5": "Invites non-governmental organizations in consultative status with the Economic and Social Council with relevant expertise to register with the Secretariat to attend the high-level meeting of the General Assembly and the interactive multi-stakeholder hearing;",
    "6": "Requests the President of the General Assembly to draw up a list of other relevant representatives of relevant non-governmental organizations and civil society organizations, including individuals whose efforts have supported the implementation of the Beijing Declaration and Platform of Action1 and the human rights addressed therein, national human rights institutions, where they exist, academic institutions and the private sector, who may attend the high-level meeting of the General Assembly to be held on 23 September 2020 and participate in the interactive multi-stakeholder hearing, taking into account the principles of transparency and equitable geographical representation, with due regard to the full and meaningful participation of women and young people, and to submit the list to Member States for their consideration on a non-objection basis;4",
    "7": "Invites members of civil society, non-governmental organizations, the private sector, academia, development partners and other relevant initiatives to make a fundamental contribution to the process in terms of raising awareness of gaps and challenges and identifying concrete actions to accelerate the realization of gender equality and the empowerment of all women and girls and its contribution towards the achievement of the Sustainable Development Goals;3",
    "8": "Encourages participation in the high-level meeting of the General Assembly, at the highest possible level, and encourages Governments to present concrete actions and commitments to accelerate the realization of gender equality and the empowerment of all women and girls by 2030, including in support of the role of civil society organizations and youth;",
    "9": "Invites the Inter-Parliamentary Union to contribute to the high-level meeting of the General Assembly;",
    "10": "Invites the United Nations system, including funds, programmes and specialized agencies, regional commissions and relevant envoys of the Secretary- General, to participate in the high-level meeting of the General Assembly, as appropriate, and urges them to consider initiatives in support of the preparatory process and the high-level meeting of the Assembly, particularly with regard to sharing good practices, challenges, lessons learned and urgent actions that need to be taken for the realization of gender equality and the empowerment of all women and girls;",
    "11": "Encourages Member States to consider including in their national delegations heads of national mechanisms for the promotion of gender equality and the empowerment of women and girls, as appropriate, as well as representatives such as parliamentarians, representatives of civil society and other relevant stakeholders;",
    "12": "Decides that the proceedings of the high-level meeting of the General Assembly shall be webcast, and encourages the Secretary-General and UN-Women to give the highest visibility to this meeting and its summary, as well as to the interactive multi-stakeholder hearing, through all relevant media platforms and information and communications technologies;",
    "13": "Requests the President of the General Assembly to prepare a summary of the high-level meeting of the General Assembly and to bring the summary to the attention of Member States, relevant United Nations entities and other stakeholders;",
    "14": "Requests the President of the General Assembly at its seventy-fourth session to finalize the organizational arrangements for the high-level meeting of the General Assembly, in close consultation with Member States."
  },
  "agenda_items": [
    "Item 29"
  ],
  "symbol_references": [
    "A/73/L.115"
  ]
}