{
  "symbol": "A/RES/72/246",
  "filename": "A_RES_72_246.pdf",
  "title": "72/246. Effects of terrorism on the enjoyment of human rights",
  "text": "United Nations \nA/RES/72/246\n \n \nGeneral Assembly \nDistr.: General \n18 January 2018 \n \n17-23330 (E)    230118  \n*1723330* \n \n \nSeventy-second session \nAgenda item 72 (b) \n \n \n \n \n Resolution adopted by the General Assembly \non 24 December 2017 \n \n \n \n \n[on the report of the Third Committee (A/72/439/Add.2)] \n \n \n 72/246. Effects of terrorism on the enjoyment of human rights \n \n \n \nThe General Assembly, \n \nGuided by the purposes and principles of the Charter of the United Nations, the \nUniversal Declaration of Human Rights,1 the International Covenant on Economic, \nSocial and Cultural Rights,2 the International Covenant on Civil and Political Rights 2 \nand other relevant international human rights instruments,  \n \nTaking note of all relevant resolutions of the General Assembly, the Security \nCouncil, the Commission on Human Rights and the Human Rights Council \nconcerning terrorism and the protection of human rights, including Assembly \nresolutions 46/51 of 9 December 1991, 60/158 of 16 December 2005, 60/288 of \n8 September 2006, 64/297 of 8 September 2010, 68/178 of 18 December 2013, \n68/276 of 13 June 2014, 69/127 of 10 December 2014, 70/148 of 17 December 2015 \nand 70/291 of 1 July 2016, Commission on Human Rights resolution 2004/44 of \n19 April 20043 and Human Rights Council resolutions 25/7 of 27 March 2014,4 \n28/17 of 26 March 2015,5 29/9 of 2 July 2015,6 31/3 of 23 March 2016,7 31/30 of \n24 March 2016,7 33/21 of 30 September 2016,8 34/8 of 23 March 20179 and 35/34 of \n23 June 2017,10  \n__________________ \n \n1  Resolution 217 A (III). \n \n2  See resolution 2200 A (XXI), annex. \n \n3  See Official Records of the Economic and Social Council, 2004, Supplement No. 3 (E/2004/23), \nchap. II, sect. A. \n \n4  See Official Records of the General Assembly, Sixty-ninth Session, Supplement No. 53 (A/69/53), \nchap. IV, sect. A. \n \n5  Ibid., Seventieth Session, Supplement No. 53 (A/70/53), chap. III, sect. A. \n \n6  Ibid, chap. V, sect. A. \n \n7  Ibid., Seventy-first Session, Supplement No. 53 (A/71/53), chap. IV, sect. A. \n \n8  Ibid., Supplement No. 53A and corrigendum (A/71/53/Add.1 and A/71/53/Add.1/Corr.1), chap. II. \n \n9  Ibid., Seventy-second Session, Supplement No. 53 (A/72/53), chap. IV, sect. A. \n \n10  Ibid., chap. V, sect. A. \n\nA/RES/72/246 \nEffects of terrorism on the enjoyment of human rights\n \n17-23330 \n2/4 \n \n \nReiterating its strong and unequivocal condemnation of all acts, methods and \npractices of terrorism and violent extremism as and when conducive to terrorism in \nall its forms and manifestations, wherever and by whomsoever committed, regardless \nof their motivation,  \n \nRecognizing that terrorism has a detrimental effect on the full enjoyment of all \nhuman rights and fundamental freedoms, and impedes the full enjoyment of political, \ncivil, economic, social and cultural rights,  \n \nStrongly condemning the systematic recruitment and use of children to \nperpetrate terrorist attacks, as well as the violations and abuses committed by terrorist \ngroups against children, including killing and maiming, abduction and rape and other \nforms of sexual violence, and noting that such violations and abuses may amount to \nwar crimes or crimes against humanity, \n \nExpressing deep concern that acts of sexual and gender-based violence are \nknown to be part of the strategic objectives and ideology of certain terrorist groups \nand are used as an instrument to increase their power through supporting financing \nand recruitment and through the destruction of communities, \n \nEmphasizing that all human rights are universal, indivisible, interdependent and \ninterrelated,  \n \nReaffirming the fundamental importance of respecting all human rights and \nfundamental freedoms and the rule of law, and reiterating that all States have an \nobligation to promote and protect all human rights and fundamental freedoms and to \nensure implementation of their obligations under international human rights law and \ninternational humanitarian law, as applicable, \n \nReaffirming also that the promotion and the protection of human rights for all \nand the rule of law are essential to the fight against terrorism, recognizing that \neffective counter-terrorism measures and the protection of human rights are not \nconflicting goals, but are complementary and mutually reinforcing, and stressing the \nneed to promote and protect the rights of victims of terrorism, \n \nStressing that States have a responsibility to protect individuals within their \nterritory and subject to their jurisdiction from acts of terrorism, to take effective \ncounter-terrorism measures and to investigate and prosecute those responsible for \ncarrying out such acts, and emphasizing the importance of ensuring that counter-\nterrorism laws, measures and practices are human rights-compliant,  \n \nRenewing \nits \nunwavering \ncommitment \nto \nstrengthening \ninternational \ncooperation to prevent and combat terrorism and violent extremism as and when \nconducive to terrorism in all its forms and manifestations, and reaffirming that any \nacts of terrorism are criminal and unjustifiable, regardless of their motivation, \nwherever, whenever and by whomsoever committed, \n \nEmphasizing that terrorism cannot and should not be associated with any \nreligion, nationality, civilization or ethnic group, and that tolerance, pluralism, \ninclusion and respect for diversity, dialogue among civilizations and the enhancement \nof interfaith and intercultural understanding and respect among people, including at \nthe national, regional and global levels, while avoiding the escalation of hatred, are \namong the most important elements in promoting cooperation and success in \npreventing and combating terrorism, and welcoming the various initiatives to that \nend,  \n \nReaffirming the commitment of Member States to take measures aimed at \naddressing the conditions conducive to the spread of terrorism, including but not \nlimited to prolonged unresolved conflicts, the dehumanization of victims of terrorism \nin all its forms and manifestations, lack of the rule of law and violations and abuses \nof human rights, ethnic, national and religious discrimination, political exclusion, \n\nEffects of terrorism on the enjoyment of human rights \nA/RES/72/246\n \n3/4 \n17-23330 \n \nsocioeconomic marginalization and lack of good governance, while recognizing that \nnone of these conditions can excuse or justify acts of terrorism, \n \nConscious that there are a number of drivers underlying radicalization to \nterrorism and that development based on the principles of social justice, inclusion and \nequal opportunities can contribute to the prevention of terrorism and violent \nextremism as and when conducive to terrorism, as well as to the promotion of \ninclusive, open and resilient societies, notably through education, and affirming the \ndetermination of States to work towards conflict resolution, to confront oppression, \nto eradicate poverty, to promote sustained economic growth, sustainable \ndevelopment, global prosperity, good governance, human rights and fundamental \nfreedoms for all and the rule of law, to improve intercultural understanding and to \npromote respect for all,  \n \n1. \nStrongly condemns all terrorist acts as criminal and unjustifiable, and \nexpresses grave concern about their detrimental effects on the enjoyment of all human \nrights;  \n \n2. \nReaffirms its commitment to the United Nations Global Counter-Terrorism \nStrategy and a balanced and integrated implementation of its four pillars, as adopted \nin its resolution 60/288, and at its fifth review, and recognizes the need to redouble \nefforts for even attention paid to and even implementation of all the pillars of the \nstrategy; \n \n3. \nExpresses concern that terrorists and terrorist groups have targeted \ncommunities and individuals, as well as Governments, including on the basis of \nreligion or belief and/or ethnicity; \n \n4. \nDeeply deplores the suffering caused by terrorism to the victims of \nterrorism in all its forms and manifestations and to their families, expresses its \nprofound solidarity with them, and encourages Member States to provide them with \nproper support and assistance while taking into account, inter alia, when appropriate, \nconsiderations regarding remembrance, dignity, respect, justice and truth, in \naccordance with international law; \n \n5. \nRecognizes that terrorism has a grave impact on the full enjoyment of all \nhuman rights and fundamental freedoms and that it potentially hampers development, \nincluding but not limited to destroying infrastructure, harming the tourism industry, \ndiverting foreign direct investment, impeding economic growth and increasing \nsecurity costs;  \n \n6. \nUrges States to protect persons within their territory and subject to their \njurisdiction by preventing and countering terrorism in all its forms and \nmanifestations, in full compliance with their international legal obligations, and to \nrespect and protect all human rights while countering terrorism in accordance with \ninternational law, in particular international human rights law, international refugee \nlaw and international humanitarian law;  \n \n7. \nCalls upon Member States to remain alert to the use of information and \ncommunications technology for terrorist purposes and to cooperate to counter violent \nextremist propaganda and incitement to violence on the Internet and social media, \nincluding by developing effective counter-narratives, and to prevent terrorists from \nrecruiting and raising funds online for terrorist purposes, while respecting human \nrights and fundamental freedoms, in compliance with their obligations under \ninternational law, and stresses the importance of cooperation with civil society and \nthe private sector in this endeavour; \n \n8. \nExpresses its concern at the increasing use, in a globalized society, by \nterrorists and their supporters, of information and communications technology, in \nparticular the Internet and other media, to advocate, commit, incite, recruit for, fund \n\nA/RES/72/246 \nEffects of terrorism on the enjoyment of human rights\n \n17-23330 \n4/4 \n \nor plan terrorist acts, urges States to take appropriate preventive measures in this \nregard while acting in full compliance with their obligations under international law, \nand reiterates that such technologies can be powerful tools in countering the spread \nof terrorism, including by promoting tolerance, dialogue among peoples and peace; \n \n9. \nEmphasizes the importance of cooperation among stakeholders, including \nthrough technical cooperation, capacity-building and the exchange of good practices, \ninformation and intelligence on preventing and countering terrorism, and in this \nregard calls upon States and relevant regional and subregional organizations, as \nappropriate, to continue to implement the United Nations Global Counter-Terrorism \nStrategy and its four pillars in a balanced and integrated manner;  \n \n10. Reaffirms its profound solidarity with the victims of terrorism and their \nfamilies, and acknowledges the importance of protecting their rights and providing \nthem with proper support, assistance and rehabilitation, while taking into account, \nwhen appropriate, considerations regarding remembrance, dignity, respect, justice \nand truth in such a way that promotes accountability and ends impunity, and \nencourages the enhancement of international cooperation and the exchange of \nexpertise in that respect, in accordance with international law;  \n \n11. \nRequests the Secretary-General to submit a report on the implementation \nof the present resolution to the General Assembly at its seventy-third session. \n \n76th plenary meeting \n24 December 2017 \n \n",
  "paragraphs": {
    "1": "Strongly condemns all terrorist acts as criminal and unjustifiable, and expresses grave concern about their detrimental effects on the enjoyment of all human rights;",
    "2": "Reaffirms its commitment to the United Nations Global Counter-Terrorism Strategy and a balanced and integrated implementation of its four pillars, as adopted in its resolution 60/288, and at its fifth review, and recognizes the need to redouble efforts for even attention paid to and even implementation of all the pillars of the strategy;",
    "3": "Expresses concern that terrorists and terrorist groups have targeted communities and individuals, as well as Governments, including on the basis of religion or belief and/or ethnicity;",
    "4": "Deeply deplores the suffering caused by terrorism to the victims of terrorism in all its forms and manifestations and to their families, expresses its profound solidarity with them, and encourages Member States to provide them with proper support and assistance while taking into account, inter alia, when appropriate, considerations regarding remembrance, dignity, respect, justice and truth, in accordance with international law;",
    "5": "Recognizes that terrorism has a grave impact on the full enjoyment of all human rights and fundamental freedoms and that it potentially hampers development, including but not limited to destroying infrastructure, harming the tourism industry, diverting foreign direct investment, impeding economic growth and increasing security costs;",
    "6": "Urges States to protect persons within their territory and subject to their jurisdiction by preventing and countering terrorism in all its forms and manifestations, in full compliance with their international legal obligations, and to respect and protect all human rights while countering terrorism in accordance with international law, in particular international human rights law, international refugee law and international humanitarian law;",
    "7": "Calls upon Member States to remain alert to the use of information and communications technology for terrorist purposes and to cooperate to counter violent extremist propaganda and incitement to violence on the Internet and social media, including by developing effective counter-narratives, and to prevent terrorists from recruiting and raising funds online for terrorist purposes, while respecting human rights and fundamental freedoms, in compliance with their obligations under international law, and stresses the importance of cooperation with civil society and the private sector in this endeavour;",
    "8": "Expresses its concern at the increasing use, in a globalized society, by terrorists and their supporters, of information and communications technology, in particular the Internet and other media, to advocate, commit, incite, recruit for, fund A/RES/72/246 Effects of terrorism on the enjoyment of human rights 17-23330 4/4 or plan terrorist acts, urges States to take appropriate preventive measures in this regard while acting in full compliance with their obligations under international law, and reiterates that such technologies can be powerful tools in countering the spread of terrorism, including by promoting tolerance, dialogue among peoples and peace;",
    "9": "Emphasizes the importance of cooperation among stakeholders, including through technical cooperation, capacity-building and the exchange of good practices, information and intelligence on preventing and countering terrorism, and in this regard calls upon States and relevant regional and subregional organizations, as appropriate, to continue to implement the United Nations Global Counter-Terrorism Strategy and its four pillars in a balanced and integrated manner;",
    "10": "Reaffirms its profound solidarity with the victims of terrorism and their families, and acknowledges the importance of protecting their rights and providing them with proper support, assistance and rehabilitation, while taking into account, when appropriate, considerations regarding remembrance, dignity, respect, justice and truth in such a way that promotes accountability and ends impunity, and encourages the enhancement of international cooperation and the exchange of expertise in that respect, in accordance with international law;",
    "11": "Requests the Secretary-General to submit a report on the implementation of the present resolution to the General Assembly at its seventy-third session. 76th plenary meeting 24 December 2017"
  },
  "agenda_items": [
    "Item 72"
  ],
  "symbol_references": []
}