{
  "symbol": "A/RES/78/155",
  "filename": "A_RES_78_155.pdf",
  "title": "78/155. Implementation of the Convention on Biological Diversity and its contribution to sustainable development",
  "text": "United Nations \nA/RES/78/155\n \n \nGeneral Assembly \nDistr.: General \n21 December 2023 \n \n23-25897 (E)    030124 \n*2325897* \n \n \nSeventy-eighth session \nAgenda item 18 (f) \nSustainable development: Convention on Biological Diversity  \n \n \n \n \n Resolution adopted by the General Assembly \non 19 December 2023 \n \n \n \n \n[on the report of the Second Committee (A/78/461/Add.6, para. 7)] \n \n \n 78/155. Implementation of the Convention on Biological Diversity and its \ncontribution to sustainable development \n \n \n \nThe General Assembly, \n \nRecalling its resolution 77/167 of 14 December 2022 and its previous \nresolutions relating to the Convention on Biological Diversity, 1  \n \nReaffirming the outcomes of the United Nations Conference on Environment \nand Development, including the Rio Declaration on Environment and Development 2 \nand its principles, the outcome document of the United Nations Conference on \nSustainable Development, entitled \u201cThe future we want\u201d, 3  and, inter alia, the \ncommitments concerning biodiversity contained therein, the Programme for the \nFurther Implementation of Agenda 21,4 the Johannesburg Declaration on Sustainable \nDevelopment5 and the Plan of Implementation of the World Summit on Sustainable \nDevelopment (Johannesburg Plan of Implementation)6 and the outcome document of \nthe special event to follow up efforts made towards achieving the Millennium \nDevelopment Goals convened by the President of the General Assembly, 7 \n \nReaffirming also its resolution 70/1 of 25 September 2015, entitled \n\u201cTransforming our world: the 2030 Agenda for Sustainable Development\u201d, in which \n__________________ \n \n1 United Nations, Treaty Series, vol. 1760, No. 30619. \n \n2 Report of the United Nations Conference on Environment and Development, Rio de Janeiro, \n3\u2013 14 June 1992, vol. I, Resolutions Adopted by the Conference (United Nations publication, \nSales No. E.93.I.8 and corrigendum), resolution 1, annex I. \n \n3 Resolution 66/288, annex. \n \n4 Resolution S-19/2, annex. \n \n5 Report of the World Summit on Sustainable Development, Johannesburg, South Africa, \n26 August\u20134 September 2002 (United Nations publication, Sales No. E.03.II.A.1 and \ncorrigendum), chap. I, resolution 1, annex. \n \n6 Ibid., resolution 2, annex. \n \n7 Resolution 68/6. \n\nA/RES/78/155 \nImplementation of the Convention on Biological Diversity \nand its contribution to sustainable development\n \n23-25897\n2/13 \n \nit adopted a comprehensive, far-reaching and people-centred set of universal and \ntransformative Sustainable Development Goals and targets, its commitment to \nworking tirelessly for the full implementation of the Agenda by 2030, its recognition \nthat eradicating poverty in all its forms and dimensions, including extreme poverty, \nis the greatest global challenge and an indispensable requirement for sustainable \ndevelopment, its commitment to achieving sustainable development in its three \ndimensions \u2013 economic, social and environmental \u2013 in a balanced and integrated \nmanner, and to building upon the achievements of the Millennium Development \nGoals and seeking to address their unfinished business,  \n \nReaffirming further its resolution 69/313 of 27 July 2015 on the Addis Ababa \nAction Agenda of the Third International Conference on Financing for Development, \nwhich is an integral part of the 2030 Agenda for Sustainable Development, supports \nand complements it, helps to contextualize its means of implementation targets with \nconcrete policies and actions, and reaffirms the strong political commitment to \naddress the challenge of financing and creating an enabling environment at all levels \nfor sustainable development in the spirit of global partnership and solidarity, \n \nReaffirming the New Urban Agenda, adopted at the United Nations Conference \non Housing and Sustainable Urban Development (Habitat III), held in Quito, Ecuador, \nfrom 17 to 20 October 2016,8 and its vision for cities and human settlements that \nprotect, conserve, restore and promote their ecosystems, water, natural habitats and \nbiodiversity and minimize their environmental impact,  \n \nReaffirming also the Paris Agreement9 and encouraging all its parties to fully \nimplement the Agreement, and parties to the United Nations Framework Convention \non Climate Change 10  that have not yet done so to deposit their instruments of \nratification, acceptance, approval or accession, where appropriate, as soon as possible,  \n \nUrging the implementation of the Paris Agreement and the agreed \nintergovernmentally negotiated outcomes and decisions of the subsequent United \nNations Climate Change Conferences, \n \nWelcoming the twenty-seventh session of the Conference of the Parties to the \nUnited Nations Framework Convention on Climate Change, held in Sharm el-Sheikh, \nEgypt, from 6 to 20 November 2022, and looking forward to the twenty-eighth session \nof the Conference of the Parties to the United Nations Framework Convention on \nClimate Change in Dubai, United Arab Emirates, from 30 November to 12 December \n2023, \n \nNoting with serious concern the findings from the Intergovernmental Panel \non Climate Change in its special reports entitled Global Warming of 1.5\u00b0C, The Ocean \nand Cryosphere in a Changing Climate and Climate Change and Land: An IPCC \nSpecial Report on Climate Change, Desertification, Land Degradation, Sustainable \nLand Management, Food Security, and Greenhouse Gas Fluxes in Terrestrial \nEcosystems, as well as the contribution of Working Groups I, II and III and the synthesis \nreport of the Sixth Assessment Report of the Intergovernmental Panel on Climate \nChange, in which the Intergovernmental Panel highlights the linkages between climate \nchange and extreme weather events and slow-onset events and their negative impacts \non people and nature, and highlighting the increasing frequency and intensity of \nextreme weather events, such as heatwaves, droughts and heavy precipitation,  \n \nRecalling the convening of the summit on biodiversity on 30 September 2020, \nin order to highlight the urgency of action at the highest levels in support of a global \n__________________ \n \n8 Resolution 71/256, annex. \n \n9 Adopted under the UNFCCC in FCCC/CP/2015/10/Add.1, decision 1/CP.21. \n \n10 United Nations, Treaty Series, vol. 1771, No. 30822. \n\nImplementation of the Convention on Biological Diversity \nand its contribution to sustainable development \nA/RES/78/155\n \n3/13\n23-25897 \n \nbiodiversity framework that contributes to the 2030 Agenda and places the global \ncommunity on a path towards realizing the 2050 Vision for Biodiversity, \u201cLiving in \nharmony with nature\u201d,  \n \nTaking note with appreciation of the interactive dialogue on Harmony with \nNature convened by the President of the General Assembly on 24 April 2023, in \ncommemoration of International Mother Earth Day,  \n \nRecalling its resolution 76/300 of 28 July 2022 on the human right to a clean, \nhealthy and sustainable environment, \n \nRecalling also its resolutions 71/312 of 6 July 2017 and 76/296 of 21 July 2022, \nin which it endorsed the declarations adopted by the first and second United Nations \nConferences to Support the Implementation of Sustainable Development Goal 14: \nConserve and sustainably use the oceans, seas and marine resources for sustainable \ndevelopment, demonstrating the collective will to take action to conserve and \nsustainably use our oceans, seas and marine resources for sustainable development, \nas well as to halt and reverse the decline in the health and productivity of our ocean \nand its ecosystems and to protect and restore its resilience and ecological integrity, \nrecognizing the important contributions of the dialogues and voluntary commitments \nmade in the context of those Conferences to the effective and timely implementation \nof Sustainable Development Goal 14, and looking forward to the third United Nations \nOcean Conference, to be held in 2025,  \n \nTaking note of voluntary initiatives to support efforts to achieve the conservation \nand protection of at least 30 per cent of the world\u2019s land and ocean by 2030, which \ncan further contribute to halt and reverse biodiversity loss, \n \nRecalling its resolution 73/284 of 1 March 2019, in which it proclaimed 2021\u2013\n2030 the United Nations Decade on Ecosystem Restoration, with the aim of \nsupporting and scaling up efforts to prevent, halt and reverse the degradation of \necosystems worldwide and raise awareness of the importance of successful ecosystem \nrestoration,  \n \nRecalling also the United Nations strategic plan for forests 2017\u20132030,11 and \nrecognizing that forests are home to an estimated 80 per cent of all terrestrial species \nand that forests, including boreal, temperate and tropical, contribute substantially to \nclimate change mitigation and adaptation and to the conservation of biodiversity,  \n \nRecalling further the fifth edition of the Global Biodiversity Outlook, in which \nit was highlighted that none of the 20 Aichi Biodiversity Targets were fully achieved, \nalthough six were partially achieved (targets 9, 11, 16, 17, 19 and 20), \n \nNoting with concern that the Sustainable Development Goal targets with a 2020 \ndeadline have not been fully achieved, \n \nRecognizing that the coronavirus disease (COVID-19) pandemic and other \npandemics underscore the need to conserve, restore and sustainably use biodiversity, \non land and below water, to reduce the risk of the economic, social and environmental \nimpacts of disasters and future pandemic outbreaks, many of which are exacerbated \nby biodiversity loss, the increased scale of poaching and the illegal use of and trade \nin wildlife and wildlife products, desertification, land degradation and drought, \nclimate change and plastic pollution, including in the marine environment, and \nemphasizing the need to support and invest at all levels, to enhance efforts to build \nresilience, to reduce the likelihood of zoonotic infections and to avoid or minimize \nadverse impacts on biological diversity in order to achieve the objectives of the \n__________________ \n \n11 See resolution 71/285. \n\nA/RES/78/155 \nImplementation of the Convention on Biological Diversity \nand its contribution to sustainable development\n \n23-25897\n4/13 \n \nConvention on Biological Diversity and to achieve a sustainable, resilient and \ninclusive recovery,  \n \nRecalling with appreciation the intergovernmentally agreed outcomes of the \nmeetings of the Conference of the Parties to the Convention on Biological Diversity \nand the meetings of the Conference of the Parties serving as the Meetings of the \nParties to the Protocols to the Convention, \n \nRecalling that the objectives of the Convention on Biological Diversity, to be \npursued in accordance with its relevant provisions, are the conservation of biological \ndiversity, the sustainable use of its components and the fair and equitable sharing of the \nbenefits arising out of the utilization of genetic resources, including by appropriate \naccess to genetic resources, by appropriate transfer of relevant technologies, taking into \naccount all rights over those resources and to technologies, and by appropriate funding,  \n \nRecognizing that the achievement of the three objectives of the Convention on \nBiological Diversity is crucial for sustainable development, poverty eradication, food \nsecurity and the improvement of human health and well-being, and a major factor \nunderpinning the achievement of the Sustainable Development Goals and other \ninternationally agreed development goals, \n \nReaffirming that, in accordance with the Charter of the United Nations, States \nhave the sovereign right to exploit their own resources pursuant to their own \nenvironmental policies and the responsibility to ensure that activities within their \njurisdiction or control do not cause damage to the environment of other States or of \nareas beyond the limits of national jurisdiction, \n \nReaffirming also the intrinsic value of biological diversity, as well as the \necological, genetic, social, economic, scientific, educational, cultural, recreational and \naesthetic values of biological diversity, and its critical role in maintaining ecosystems \nthat provide essential functions and services, which are critical foundations for \nsustainable development, and human health and well-being, \n \nEncouraging parties, other Governments and relevant organizations to integrate \nnature-based solutions, ecosystem-based approaches and other management and \nconservation approaches, in line with resolution 5/5 of 7 March 2022 of the United \nNations Environment Assembly,12 to climate change adaptation and mitigation and \ndisaster risk reduction into their strategic planning, as appropriate, across sectors,  \n \nRecognizing that the traditional knowledge, innovations and practices of \nIndigenous Peoples and local communities that are relevant to the Convention make \na key contribution to the conservation and sustainable use of biodiversity and that \ntheir wider application can support social well-being and sustainable livelihoods, \n \nRecalling the decisions adopted by the Conference of the Parties to the \nConvention on Biological Diversity at its thirteenth and fourteenth meetings, on \narticle 8 (j) and related provisions,13 decision CBD/CP/MOP/VIII/1914 and decision \n__________________ \n \n12 UNEP/EA.5/Res.5. \n \n13 United Nations Environment Programme, document UNEP/CBD/COP/13/25, decisions XIII/18 \nand 14/12, 14/13, 14/14, 14/15, 14/16 and 14/17 of the Conference of the Parties to the \nConvention on Biological Diversity. \n \n14 Adopted by the Conference of the Parties serving as the Meeting of the Parties to the Cartagena \nProtocol on Biosafety at its eighth meeting (see United Nations Environment Programme, \ndocument UNEP/CBD/CP/MOP/8/17). \n\nImplementation of the Convention on Biological Diversity \nand its contribution to sustainable development \nA/RES/78/155\n \n5/13\n23-25897 \n \nCBD/NP/MOP/DEC/2/7,15 as well as of the work done by the Ad Hoc Open-ended \nInter-sessional Working Group on Article 8 (j) and related provisions,  \n \nNoting with profound concern the findings of the Intergovernmental Science-\nPolicy Platform on Biodiversity and Ecosystem Services Global Assessment Report \non Biodiversity and Ecosystem Services, \n \nRecalling the United Nations Declaration on the Rights of Indigenous Peoples 16 \nand the outcome document of the high-level plenary meeting of the General Assembly \nknown as the World Conference on Indigenous Peoples,17  \n \nRecognizing the vital role that women play in the conservation and sustainable \nuse of biological diversity, and reaffirming the need for their full, equal, effective and \nmeaningful participation at all levels of policymaking and implementation for the \nconservation and sustainable use of biological diversity, as well as ecosystem \nrestoration,  \n \nRecognizing also the important role of other biodiversity-related multilateral \nenvironmental agreements, regional agreements and initiatives in contributing to the \nconservation and sustainable use of biodiversity,  \n \nRecognizing further the important role of the Convention on International Trade \nin Endangered Species of Wild Fauna and Flora18 in contributing to the conservation \nand sustainable use of biodiversity and in ensuring that no species entering into \ninternational trade is threatened with extinction, recognizing also the economic, social \nand environmental impacts of poaching and trafficking in wildlife,  \n \nWelcoming the convening of the United Nations Conference on the Midterm \nComprehensive Review of the Implementation of the Objectives of the International \nDecade for Action, \u201cWater for Sustainable Development\u201d, 2018\u20132028, from 22 to \n24 March 2023,  \n \nRecognizing the importance of the outcomes of the resumed fifth session of the \nUnited Nations Environment Assembly, held in Nairobi from 28 February to 2 March \n2022, and the first special session of the United Nations Environment Assembly to \ncommemorate the fiftieth anniversary of the establishment of the United Nations \nEnvironment Programme, held in Nairobi on 3 and 4 March 2022, recognizing \nalso the importance of the international meeting entitled \u201cStockholm+50: a healthy \nplanet for the prosperity of all \u2013 our responsibility, our opportunity\u201d, held in \nStockholm on 2 and 3 June 2022, at which the global interconnectedness of the \nenvironment was emphasized, and looking forward to the sixth session of the United \nNations Environment Assembly, to be held in Nairobi from 26 February to 1 March \n2024,  \n \nWelcoming the decision by the United Nations Environment Assembly at its \nresumed fifth session, in resolution 5/14 of 2 March 2022, 19  to convene an \nintergovernmental negotiating committee to develop an international legally binding \ninstrument on plastic pollution, including in the marine environment, and welcoming \nalso the decision taken by the Environment Assembly at its resumed fifth session to \nstrengthen global action on the sound management of chemicals and waste and to \n__________________ \n \n15 Adopted by the Conference of the Parties serving as the Meeting of the Parties to the Nagoya \nProtocol on Access to Genetic Resources and the Fair and Equitable Sharing of Benefits Arising \nfrom Their Utilization at its second meeting (see United Nations Environment Programme, \ndocument UNEP/CBD/NP/MOP/2/13). \n \n16 Resolution 61/295, annex. \n \n17 Resolution 69/2. \n \n18 United Nations, Treaty Series, vol. 993, No. 14537. \n \n19 UNEP/EA.5/Res.14. \n\nA/RES/78/155 \nImplementation of the Convention on Biological Diversity \nand its contribution to sustainable development\n \n23-25897\n6/13 \n \nprevent pollution, in line with Environment Assembly resolutions 5/2, 5/7 and 5/8 of \n2 March 2022,20 \n \nRecognizing the importance of the outcomes of the fifteenth session of the \nConference of the Parties of the United Nations Convention to Combat Desertification \nin Those Countries Experiencing Serious Drought and/or Desertification, Particularly \nin Africa, held in Abidjan, C\u00f4te d\u2019Ivoire from 9 to 20 May 2022, \n \nNoting the adoption by the Conference of the Parties to the Convention on \nBiological Diversity, at its tenth meeting, of the Nagoya Protocol on Access to \nGenetic Resources and the Fair and Equitable Sharing of Benefits Arising from Their \nUtilization to the Convention on Biological Diversity, 21 the objective of which is the \nfair and equitable sharing of the benefits arising from the utilization of genetic \nresources, including by appropriate access to genetic resources and by appropriate \ntransfer of relevant technologies, taking into account all rights over those resources \nand to technologies, and by appropriate funding, and acknowledging the role of access \nto genetic resources and equitable benefit-sharing arising from their utilization in \ncontributing to the conservation and sustainable use of biological diversity, poverty \neradication and environmental sustainability, and thereby to the achievement of \nsustainable development,  \n \nNoting also that 195 States and 1 regional economic integration organization are \nparties to the Convention and that 140 States and 1 regional economic integration \norganization are parties to the Nagoya Protocol, noting further that 172 States and 1 \nregional economic integration organization are parties to the Cartagena Protocol on \nBiosafety to the Convention on Biological Diversity 22  and that 53 States and 1 \nregional economic integration organization are parties to the Nagoya-Kuala Lumpur \nSupplementary Protocol on Liability and Redress to the Cartagena Protocol on \nBiosafety, 23  and recalling the entry into force of the Nagoya-Kuala Lumpur \nSupplementary Protocol on 5 March 2018,  \n \nTaking note with appreciation of the initiative launched at the fourteenth \nmeeting of the Conference of the Parties to the Convention to promote a coherent \napproach between the United Nations Framework Convention on Climate Change, \nthe Convention on Biological Diversity and the United Nations Convention to \nCombat Desertification in Those Countries Experiencing Serious Drought and/or \nDesertification, Particularly in Africa24 (the Rio conventions) to address biodiversity \nloss, climate change and land and ecosystem degradation,  \n \nStressing that adequate, predictable and easily accessible financial resources \nfrom all sources will be key to place the global community on a path towards realizing \nthe 2050 Vision for Biodiversity of living in harmony with nature,  \n \nReiterating the pledge that no one will be left behind, reaffirming the \nrecognition that the dignity of the human person is fundamental, and the wish to see \nthe Goals and targets met for all nations and peoples and for all segments of society, \nand recommitting to endeavour to reach the furthest behind first,  \n \n1. \nTakes note of the report of the Executive Secretary of the Convention on \nBiological Diversity;25  \n__________________ \n \n20 UNEP/EA.5/Res.2, UNEP/EA.5/Res.7 and UNEP/EA.5/Res.8. \n \n21 United Nations Environment Programme, document UNEP/CBD/COP/10/27, annex, decision X/1. \n \n22 United Nations, Treaty Series, vol. 2226, No. 30619. \n \n23 See United Nations Environment Programme, document UNEP/CBD/BS/COP-MOP/5/17, annex, \ndecision BS-V/11. \n \n24 United Nations, Treaty Series, vol. 1954, No. 33480. \n \n25 A/78/209, sect. III. \n\nImplementation of the Convention on Biological Diversity \nand its contribution to sustainable development \nA/RES/78/155\n \n7/13\n23-25897 \n \n \n2. \nWelcomes the convening of the first part of the fifteenth meeting of the \nConference of the Parties to the Convention on Biological Diversity, as well as the \nMeetings of the Parties to the Protocols to the Convention, held in Kunming, China, \nfrom 11 to 15 October 2021 under the theme proposed by the Presidency \u201cEcological \ncivilization: building a shared future for all life on Earth\u201d, and the second part, held \nin Montreal, Canada, under the presidency of China, from 7 to 19 December 2022, \nwith the support of Canada, and its outcomes, looks forward to the sixteenth meeting \nof the Conference of the Parties and the meetings of the Conference of the Parties \nserving as the Meetings of the Parties to the Protocols to the Convention, and \nencourages all Parties in a position to do so to consider hosting;  \n \n3. \nAlso welcomes the Kunming-Montreal Global Biodiversity Framework to \ncontribute to the 2030 Agenda for Sustainable Development, 26 to the 2030 mission to \nhalt and reverse biodiversity loss by 2030 and to place the global community on a \npath towards realizing the 2050 Vision for Biodiversity, and urges Parties and invites \nother Governments, with the support of United Nations entities and the participation \nof all other stakeholders, to ensure the early, inclusive and effective implementation \nof the Framework and all other decisions adopted by the Parties;  \n \n4. \nCalls for the provision and mobilization of new and additional means of \nimplementation to support the full implementation of the Convention on Biological \nDiversity, and further emphasizes the importance of urgently increasing the \nmobilization of financial resources from all sources, domestic and international, \npublic and private, with a view to closing the biodiversity financing gap and making \nadequate and predictable resources available in a timely manner for the effective \nimplementation of the Kunming-Montreal Global Biodiversity Framework; \n \n5. \nWelcomes the adoption by the Conference of the Parties to the Convention \nat its fifteenth meeting of the strategy for resource mobilization for the Kunming-\nMontreal Global Biodiversity Framework in support of the achievement of the three \nobjectives of the Convention;  \n \n6. \nEmphasizes that the successful implementation of the Kunming-Montreal \nGlobal Biodiversity Framework requires responsibility and transparency, which will \nbe supported by effective mechanisms for planning, monitoring, reporting and review, \nincluding through revising or updating national biodiversity strategies and action \nplans, in alignment with the Framework, its goals and its targets, in line with decision \n15/6 adopted at the fifteenth meeting of the Conference of the Parties;  \n \n7. \nRequests the continuation of efforts made by the secretariat of the \nConvention, parties to the Convention and the Global Environment Facility, as the \nfinancial mechanism of the Convention, in conjunction with United Nations funds \nand programmes and the specialized agencies, as well as other entities, in organizing \ncapacity-building activities to support countries in the updating of national \nbiodiversity strategies and action plans, with a view to enhancing capacity and \naddressing the need for human, technical and financial resources to implement the \nConvention and the Kunming-Montreal Global Biodiversity Framework, in particular \nfor developing countries; \n \n8. \nWelcomes the establishment by the Global Environment Facility of the \nGlobal Biodiversity Framework Fund to support the implementation of the Kunming-\nMontreal Global Biodiversity Framework;  \n \n9. \nCalls for continued capitalization and timely operationalization of the \nGlobal Biodiversity Framework Fund commensurate with the targets of the \nFramework, from all sources, including, inter alia, international financial resources \n__________________ \n \n26 Resolution 70/1. \n\nA/RES/78/155 \nImplementation of the Convention on Biological Diversity \nand its contribution to sustainable development\n \n23-25897\n8/13 \n \nfrom developed countries, philanthropic organizations and the private sector, and to \nprogress towards implementation as soon as possible;  \n \n10. \nWelcomes the decision to establish, as part of the Kunming-Montreal \nGlobal Biodiversity Framework, a multilateral mechanism for benefit-sharing from \nthe use of digital sequence information on genetic resources, including a global fund, \nand recognizing the ongoing process towards its operationalization;  \n \n11. \nAcknowledges the important roles and contributions of Indigenous Peoples \nand local communities as custodians of biodiversity and as partners in its conservation, \nrestoration and sustainable use, stresses that the implementation of the Kunming-\nMontreal Global Biodiversity Framework must ensure that the rights, knowledge, \nincluding traditional knowledge associated with biodiversity, innovations, world views, \nvalues and practices of Indigenous Peoples and local communities are respected, and \ndocumented and preserved with their free, prior and informed consent, 27 including \nthrough their full and effective participation in decision-making, in accordance with \nrelevant national legislation, international instruments, including the United Nations \nDeclaration on the Rights of Indigenous Peoples, and human rights law, and takes \nnote with appreciation of the goal of providing up to 20 per cent of the programming \nshare of the Global Biodiversity Framework Fund by 2030 to support action by \nIndigenous Peoples and local communities for the conservation, restoration, \nsustainable use and management of biodiversity;  \n \n12. Welcomes the political declaration adopted by the high-level political \nforum on sustainable development convened under the auspices of the General \nAssembly (Sustainable Development Goals Summit),28 held in New York on 18 and \n19 September 2023, and urges timely action to ensure its full implementation;  \n \n13. Urges parties to the Convention to ensure the coherence and \ncomplementarity of the Kunming-Montreal Global Biodiversity Framework with \nother existing or upcoming international processes, in particular with regard to the \n2030 Agenda, the Paris Agreement and other related processes, frameworks and \nstrategies, and reiterates the invitation to the other multilateral environmental \nagreements, including biodiversity-related conventions and the Rio conventions, \nrelevant international organizations and their programmes, and other relevant \nprocesses to actively participate in their implementation;  \n \n14. Encourages support for the Sharm el-Sheikh to Kunming Action Agenda \nfor Nature and People, which is aimed at collecting, coordinating and celebrating \nactions in support of biodiversity conservation and its sustainable use, encourages all \nrelevant stakeholders, including Indigenous Peoples and local communities and the \nprivate sector, to consider developing biodiversity commitments, and invites relevant \nagencies, funds and programmes of the United Nations system and other relevant \ninstitutions and intergovernmental organizations, where relevant, to support the \nimplementation of the Action Agenda;  \n \n15. Urges parties to the Convention on Biological Diversity and all other \nrelevant stakeholders to mainstream biodiversity into COVID-19 response and \nrecovery efforts, to fully implement and support the 2030 Agenda for Sustainable \nDevelopment and other international development goals, including by strengthening \napproaches to enhance resilience, protecting wild flora and fauna and other living \nspecies reversing the trends in environmental degradation, through the conservation, \nsustainable use and restoration of ecosystems, sustainably managing water resources \nat all levels, preventing the retreat of mountain glaciers and permafrost thaw, \n__________________ \n \n27 In this framework, free, prior and informed consent refers to the tripartite terminology of \u201cprior \nand informed consent\u201d or \u201cfree, prior and informed consent\u201d or \u201capproval and involvement\u201d. \n \n28 Resolution 78/1. \n\nImplementation of the Convention on Biological Diversity \nand its contribution to sustainable development \nA/RES/78/155\n \n9/13\n23-25897 \n \nsustainably managing all types of forests and halting deforestation and forest \ndegradation, as well as by integrating the conservation and sustainable use of \nbiodiversity and access to genetic resources and the fair and equitable sharing of \nbenefits arising from their utilization into relevant national decision-making, \nemphasizes that biodiversity and health linkages should be addressed holistically, \nincluding through a biodiversity-inclusive One Health approach, among other \napproaches, and recalls in this regard decision 14/4 of 30 November 2018 of the \nConference of the Parties to the Convention on Biological Diversity and resolutions \n3/4 of 30 January 2018, 5/1 of 2 March 2022 and 5/6 of 7 March 2022 of the United \nNations Environment Assembly;29  \n \n16. Notes that the COVID-19 pandemic has exacerbated pre-existing \ninequalities and challenges for the implementation of the Convention and further \nhighlighted that the loss and degradation of biodiversity increases the risk of zoonotic \ndisease spillover from wildlife to people and that biodiversity should continue to be \nmainstreamed in COVID-19 recovery plans and in plans aimed at reducing the risk \nof future pandemics, emphasizes the importance of a One Health approach and other \nholistic approaches that deliver multiple benefits to the health and well-being of \npeople, and planet, that would further strengthen the capacity to address biodiversity \nloss, prevent and respond to the emergence of diseases, including zoonotic infections, \nand future pandemics, and contribute to reducing the adverse impacts of climate \nchange, calls for transformative actions from all relevant stakeholders and adequate \nand sufficient means of implementation, particularly for developing countries, to \nensure the full implementation of the Convention to halt and reverse biodiversity loss, \nand welcomes the financial commitments and initiatives that have been announced \nfrom governments, organizations and the private sector that contribute to biodiversity \nconservation, restoration and sustainable use and maintain the political momentum \nfor the implementation of the Kunming-Montreal Global Biodiversity Framework;  \n \n17. Notes with concern the limited progress made in the implementation of the \nthree objectives of the Convention, namely, the conservation of biological diversity, \nthe sustainable use of its components and the fair and equitable sharing of the benefits \narising out of the utilization of genetic resources;  \n \n18. Recalls with appreciation the entry into force of the Nagoya Protocol on \nAccess to Genetic Resources and the Fair and Equitable Sharing of Benefits Arising \nfrom Their Utilization to the Convention on Biological Diversity on 12 October 2014, \nand notes with particular concern the limited progress made in the implementation of \nthe Nagoya Protocol;  \n \n19. Notes the limited progress made in mainstreaming article 8 (j) of the \nConvention and related provisions into various areas of work under the Convention, \ntakes note with appreciation of decision 15/10 of the Conference of the Parties to the \nConvention to develop a new programme of work on article 8 (j) and other provisions \nof the Convention related to Indigenous Peoples and local communities aligned with \nthe Kunming-Montreal Global Biodiversity Framework, with the full and effective \nparticipation of Indigenous Peoples and local communities, and in this regard invites \nthe secretariat of the Convention, through the Secretary-General, to report on the \nprogress made by the Ad Hoc Open-ended Inter-sessional Working Group on Article \n8 (j) and related provisions when reporting on the implementation of the present \nresolution to the General Assembly;  \n \n20. Encourages the respective parties, in close collaboration with relevant \nstakeholders, to take concrete measures towards achieving the objectives of the \nConvention on Biological Diversity and the Protocols thereto, the Cartagena Protocol \n__________________ \n \n29 UNEP/EA.3/Res.4, UNEP/EA.5/Res.1 and UNEP/EA.5/Res.6. \n\nA/RES/78/155 \nImplementation of the Convention on Biological Diversity \nand its contribution to sustainable development\n \n23-25897\n10/13 \n \non Biosafety and the Nagoya Protocol, requests the parties, in close collaboration \nwith relevant stakeholders, to coherently and efficiently implement the obligations \nand commitments under the Convention and the Protocols, and in this regard \nemphasizes the need to comprehensively address at all levels the difficulties that may \nimpede their implementation;  \n \n21. Reaffirms the importance of continuing to pursue more efficient and \ncoherent implementation of the three objectives of the Convention, and calls upon \nparties and stakeholders to strengthen international cooperation measures for the \nfulfilment of obligations contained in the Convention;  \n \n22. Highlights the importance of parties raising high-level political \nengagement for the achievement of the objectives of the Convention and the related \nGoals and targets of the 2030 Agenda;  \n \n23. Invites all parties, relevant departments of the Secretariat, the specialized \nagencies, funds and programmes of the United Nations system and the regional \ncommissions to continue to contribute to the achievement of the objectives of the \nConvention;  \n \n24. Notes the important role of the United Nations Environment Management \nGroup in enhancing inter-agency coordination to support the implementation of the \nKunming-Montreal Global Biodiversity Framework; \n \n25. Stresses the importance of mainstreaming biodiversity for achieving the \nobjectives of the Convention, the 2050 Vision and 2030 mission for Biodiversity in \norder to achieve the transformational change required throughout societies and \neconomies, including changes in behaviour and decision-making at all levels, and \nurges all relevant stakeholders to mainstream biodiversity in all relevant sectors;  \n \n26. Calls upon Governments and all stakeholders to take appropriate measures \nto mainstream consideration of the socioeconomic impacts and benefits of the \nconservation and sustainable use of biodiversity and its components, as well as \necosystems that provide essential services, into relevant programmes and policies at \nall levels, in accordance with national legislation, circumstances and priorities;  \n \n27. Stresses \nthe \nimportance \nof \nmainstreaming \nbiodiversity \nin \nthe \nimplementation of the 2030 Agenda as part of national implementation plans for the \nSustainable Development Goals, in particular all biodiversity-related Goals and \ntargets; \n \n28. Recognizes that integrating biodiversity considerations into sectoral and \ncross-sectoral policies, plans and programmes at all levels is critical for harnessing \nthe benefits of enhanced synergies and policy coherence;  \n \n29. Stresses the critical importance of mainstreaming biodiversity across \ngovernment and society in order to achieve the objectives of the Convention, and the \nurgent need to mainstream biodiversity in line with the Kunming-Montreal Global \nBiodiversity Framework;  \n \n30. Welcomes the decisions of the parties to the Convention to better \nmainstream biodiversity and to take specific actions tailored to national needs and \ncircumstances, and in line with other relevant international agreements, including in \nkey sectors, such as agriculture, forestry, fisheries and tourism, as well as health, \nenergy, mining, infrastructure, manufacturing and processing sectors, which are \ncrucial for addressing biodiversity loss, bearing in mind the impact of these sectors \non biodiversity; \n \n31. Recalls its resolution 77/321 of 1 August 2023 entitled \u201cAgreement under \nthe United Nations Convention on the Law of the Sea on the Conservation and \n\nImplementation of the Convention on Biological Diversity \nand its contribution to sustainable development \nA/RES/78/155\n \n11/13\n23-25897 \n \nSustainable Use of Marine Biological Diversity of Areas beyond National \nJurisdiction\u201d;  \n \n32. Emphasizes the importance of ending illegal, unreported and unregulated \nfishing, and welcomes the Agreement on Fisheries Subsidies reached at the Twelfth \nMinisterial Conference of the World Trade Organization; \n \n33. Notes the critical role of biodiversity and ecosystem functions and services \nfor climate change adaptation, mitigation and disaster risk reduction, including by \nadding resilience to fragile ecosystems and making them less vulnerable, and that \ncontinued climate change will have predominantly adverse and often irreversible \nimpacts on many ecosystems and their functions and services, with significant \nnegative social, cultural and economic consequences;  \n \n34. Urges the parties to the Convention to facilitate the transfer of technology \non mutually agreed terms for the effective implementation of the Convention in \naccordance with article 16 and other relevant provisions of the Convention, and in \nthis regard welcomes the decision to establish an informal advisory group on technical \nand scientific cooperation, to provide strategic advice on practical measures, tools \nand opportunities to promote and facilitate technical and scientific cooperation in \naccordance with the terms of reference contained in annex III to decision 15/8 of the \nConference of the Parties to the Convention;  \n \n35. Urges parties and invites other Governments and relevant organizations to \nrecognize the important role of, and to promote, science, technology and innovation \nin supporting the implementation of the goals and targets of the Kunming-Montreal \nGlobal Biodiversity Framework towards achieving the 2050 Vision for Biodiversity \nof living in harmony with nature; \n \n36. Welcomes decision 15/11 of the Conference of the Parties to the \nConvention, entitled \u201cGender Plan of Action\u201d, which recognizes the importance of \nadvancing efforts to achieve gender equality and the empowerment of all women and \ngirls and of supporting and advancing gender mainstreaming and gender-responsive \nimplementation of the Kunming-Montreal Global Biodiversity Framework and \nencourages parties to promote the mainstreaming of a gender perspective in \ndeveloping, implementing and revising their national, and where appropriate, regional \nand subnational biodiversity strategies and action plans and equivalent instruments in \nimplementing the three objectives of the Convention, and also recognizes the need to \nenhance cooperation on capacity-building in order to support parties in this process;  \n \n37. Invites countries that have not yet done so to ratify or accede to the \nConvention;  \n \n38. Invites parties to the Convention to ratify or accede to the Nagoya \nProtocol, and invites the Executive Secretary of the Convention and the Global \nEnvironment Facility, within its mandate as the financial mechanism of the \nConvention, in collaboration with relevant organizations, to continue to support \ncapacity-building and development activities to support the ratification and \nimplementation of the Protocol;  \n \n39. Also invites parties to the Convention to consider, as appropriate, ratifying \nor acceding to the Cartagena Protocol;  \n \n40. Invites parties to the Cartagena Protocol to consider, as appropriate, \nratifying or acceding to the Nagoya-Kuala Lumpur Supplementary Protocol on \nLiability and Redress to the Cartagena Protocol on Biosafety; \n \n41. Stresses the urgent need to halt the global decline of biodiversity, which is \nunprecedented in human history, including its main indirect and direct drivers, in \n\nA/RES/78/155 \nImplementation of the Convention on Biological Diversity \nand its contribution to sustainable development\n \n23-25897\n12/13 \n \nparticular changes in land and sea use, direct exploitation of organisms, climate \nchange, pollution and invasion of alien species;  \n \n42. Notes the findings of the Intergovernmental Science-Policy Platform on \nBiodiversity and Ecosystem Services in its assessment report on the diverse values \nand valuation of nature, and stresses that achieving a sustainable and just future \nrequires institutions that enable a recognition and integration of the diverse values of \nnature and nature\u2019s contributions to people, and that the transformative change needed \nto address the global biodiversity crisis relies on shifting away from predominant \nvalues that currently overemphasize short-term and individual material gains to \nnurturing sustainability-aligned values across society;  \n \n43. Takes note of the Intergovernmental Science-Policy Platform on \nBiodiversity and Ecosystem Services assessment reports on the sustainable use of \nwild species and on invasive alien species and their control, and stresses that the \nimpacts of invasive alien species are increasing rapidly and are predicted to continue \nrising in the future, whereas they can be prevented and mitigated through effective \nmanagement, with closer collaboration across sectors and countries;  \n \n44. Notes that increasing investments in nature-based solutions, ecosystem-\nbased approaches and other management and conservation approaches, in line with \nresolution 5/5 of the United Nations Environment Assembly, has the potential to cost-\neffectively support biodiversity conservation, restoration and its sustainable use, to \nhelp advance climate mitigation and adaptation and to reduce adverse impacts of \nclimate change and to slow, halt and even reverse some aspects of biodiversity and \necosystem loss, and therefore invites all relevant stakeholders to consider the \nopportunities it presents;  \n \n45. Stresses the importance of engaging Indigenous Peoples and local \ncommunities, women, youth, civil society, local governments and authorities, \nacademia, the business and financial sectors and other relevant stakeholders to \nsupport action towards the implementation of the Kunming-Montreal Global \nBiodiversity Framework, the 2050 Vision for Biodiversity and the three objectives of \nthe Convention, and invites them to align their practices more explicitly with the \nobjectives of the Convention, including through partnerships, in accordance with \nnational legislation, circumstances and priorities;  \n \n46. Encourages the private sector, in particular business and financial \ninstitutions, to progressively reduce negative impacts on biodiversity, increase \npositive impacts, reduce biodiversity-related risks to business and financial \ninstitutions, and promote actions to ensure sustainable patterns of production, in this \nregard stresses the importance of the work of the Global Partnership for Business and \nBiodiversity, and notes other related and complementary initiatives; \n \n47. Notes the ongoing work of the Joint Liaison Group of the secretariats and \noffices of the relevant subsidiary bodies of the Convention on Biological Diversity, \nthe Convention to Combat Desertification and the United Nations Framework \nConvention on Climate Change and the Liaison Group of Biodiversity-related \nConventions, acknowledges the importance of improving coherence in the \nimplementation of those conventions, recognizes the importance of enhancing \nsynergies among the biodiversity-related conventions and agreements, without \nprejudice to their specific objectives, in this regard notes the contribution of the \nUnited Nations Environment Assembly, as reflected in its resolution 2/17 of 27 May \n2016,30 and the outcomes of its fourth session, held in Nairobi from 11 to 15 March \n__________________ \n \n30 See Official Records of the General Assembly, Seventy-first Session, Supplement No. 25 \n(A/71/25), annex. \n\nImplementation of the Convention on Biological Diversity \nand its contribution to sustainable development \nA/RES/78/155\n \n13/13\n23-25897 \n \n2019,31 in particular its ministerial declaration, and encourages the conferences of the \nparties to the biodiversity-related multilateral environmental agreements to consider \nstrengthening efforts in this regard, taking into account relevant experiences and \nbearing in mind their respective independent legal status and mandates;  \n \n48. Reaffirms the commitment at the very heart of the 2030 Agenda to leave \nno one behind and commit to taking more tangible steps to support people in \nvulnerable situations and the most vulnerable countries and to reach the furthest \nbehind first; \n \n49. Requests the Secretary-General to submit to the General Assembly, at its \nseventy-ninth session, a report on the implementation of the present resolution, \nprogress in the implementation of the Convention on Biological Diversity and the \nKunming-Montreal Global Biodiversity Framework, and decides to include in the \nprovisional agenda of its seventy-ninth session, under the item entitled \u201cSustainable \ndevelopment\u201d, the sub-item entitled \u201cConvention on Biological Diversity\u201d. \n \n49th plenary meeting \n19 December 2023 \n \n__________________ \n \n31 Ibid., Seventy-fourth Session, Supplement No. 25 (A/74/25), annex I. \n",
  "paragraphs": {
    "1": "Takes note of the report of the Executive Secretary of the Convention on Biological Diversity;25",
    "2": "Welcomes the convening of the first part of the fifteenth meeting of the Conference of the Parties to the Convention on Biological Diversity, as well as the Meetings of the Parties to the Protocols to the Convention, held in Kunming, China, from 11 to 15 October 2021 under the theme proposed by the Presidency \u201cEcological civilization: building a shared future for all life on Earth\u201d, and the second part, held in Montreal, Canada, under the presidency of China, from 7 to 19 December 2022, with the support of Canada, and its outcomes, looks forward to the sixteenth meeting of the Conference of the Parties and the meetings of the Conference of the Parties serving as the Meetings of the Parties to the Protocols to the Convention, and encourages all Parties in a position to do so to consider hosting;",
    "3": "Also welcomes the Kunming-Montreal Global Biodiversity Framework to contribute to the 2030 Agenda for Sustainable Development, 26 to the 2030 mission to halt and reverse biodiversity loss by 2030 and to place the global community on a path towards realizing the 2050 Vision for Biodiversity, and urges Parties and invites other Governments, with the support of United Nations entities and the participation of all other stakeholders, to ensure the early, inclusive and effective implementation of the Framework and all other decisions adopted by the Parties;",
    "4": "Calls for the provision and mobilization of new and additional means of implementation to support the full implementation of the Convention on Biological Diversity, and further emphasizes the importance of urgently increasing the mobilization of financial resources from all sources, domestic and international, public and private, with a view to closing the biodiversity financing gap and making adequate and predictable resources available in a timely manner for the effective implementation of the Kunming-Montreal Global Biodiversity Framework;",
    "5": "Welcomes the adoption by the Conference of the Parties to the Convention at its fifteenth meeting of the strategy for resource mobilization for the Kunming- Montreal Global Biodiversity Framework in support of the achievement of the three objectives of the Convention;",
    "6": "Emphasizes that the successful implementation of the Kunming-Montreal Global Biodiversity Framework requires responsibility and transparency, which will be supported by effective mechanisms for planning, monitoring, reporting and review, including through revising or updating national biodiversity strategies and action plans, in alignment with the Framework, its goals and its targets, in line with decision 15/6 adopted at the fifteenth meeting of the Conference of the Parties;",
    "7": "Requests the continuation of efforts made by the secretariat of the Convention, parties to the Convention and the Global Environment Facility, as the financial mechanism of the Convention, in conjunction with United Nations funds and programmes and the specialized agencies, as well as other entities, in organizing capacity-building activities to support countries in the updating of national biodiversity strategies and action plans, with a view to enhancing capacity and addressing the need for human, technical and financial resources to implement the Convention and the Kunming-Montreal Global Biodiversity Framework, in particular for developing countries;",
    "8": "Welcomes the establishment by the Global Environment Facility of the Global Biodiversity Framework Fund to support the implementation of the Kunming- Montreal Global Biodiversity Framework;",
    "9": "Calls for continued capitalization and timely operationalization of the Global Biodiversity Framework Fund commensurate with the targets of the Framework, from all sources, including, inter alia, international financial resources from developed countries, philanthropic organizations and the private sector, and to progress towards implementation as soon as possible;",
    "10": "Welcomes the decision to establish, as part of the Kunming-Montreal Global Biodiversity Framework, a multilateral mechanism for benefit-sharing from the use of digital sequence information on genetic resources, including a global fund, and recognizing the ongoing process towards its operationalization;",
    "11": "Acknowledges the important roles and contributions of Indigenous Peoples and local communities as custodians of biodiversity and as partners in its conservation, restoration and sustainable use, stresses that the implementation of the Kunming- Montreal Global Biodiversity Framework must ensure that the rights, knowledge, including traditional knowledge associated with biodiversity, innovations, world views, values and practices of Indigenous Peoples and local communities are respected, and documented and preserved with their free, prior and informed consent, 27 including through their full and effective participation in decision-making, in accordance with relevant national legislation, international instruments, including the United Nations Declaration on the Rights of Indigenous Peoples, and human rights law, and takes note with appreciation of the goal of providing up to 20 per cent of the programming share of the Global Biodiversity Framework Fund by 2030 to support action by Indigenous Peoples and local communities for the conservation, restoration, sustainable use and management of biodiversity;",
    "12": "Welcomes the political declaration adopted by the high-level political forum on sustainable development convened under the auspices of the General Assembly (Sustainable Development Goals Summit),28 held in New York on 18 and 19 September 2023, and urges timely action to ensure its full implementation;",
    "13": "Urges parties to the Convention to ensure the coherence and complementarity of the Kunming-Montreal Global Biodiversity Framework with other existing or upcoming international processes, in particular with regard to the 2030 Agenda, the Paris Agreement and other related processes, frameworks and strategies, and reiterates the invitation to the other multilateral environmental agreements, including biodiversity-related conventions and the Rio conventions, relevant international organizations and their programmes, and other relevant processes to actively participate in their implementation;",
    "14": "Encourages support for the Sharm el-Sheikh to Kunming Action Agenda for Nature and People, which is aimed at collecting, coordinating and celebrating actions in support of biodiversity conservation and its sustainable use, encourages all relevant stakeholders, including Indigenous Peoples and local communities and the private sector, to consider developing biodiversity commitments, and invites relevant agencies, funds and programmes of the United Nations system and other relevant institutions and intergovernmental organizations, where relevant, to support the implementation of the Action Agenda;",
    "15": "Urges parties to the Convention on Biological Diversity and all other relevant stakeholders to mainstream biodiversity into COVID-19 response and recovery efforts, to fully implement and support the 2030 Agenda for Sustainable Development and other international development goals, including by strengthening approaches to enhance resilience, protecting wild flora and fauna and other living species reversing the trends in environmental degradation, through the conservation, sustainable use and restoration of ecosystems, sustainably managing water resources at all levels, preventing the retreat of mountain glaciers and permafrost thaw, sustainably managing all types of forests and halting deforestation and forest degradation, as well as by integrating the conservation and sustainable use of biodiversity and access to genetic resources and the fair and equitable sharing of benefits arising from their utilization into relevant national decision-making, emphasizes that biodiversity and health linkages should be addressed holistically, including through a biodiversity-inclusive One Health approach, among other approaches, and recalls in this regard decision 14/4 of 30 November 2018 of the Conference of the Parties to the Convention on Biological Diversity and resolutions 3/4 of 30 January 2018, 5/1 of 2 March 2022 and 5/6 of 7 March 2022 of the United Nations Environment Assembly;29",
    "16": "Notes that the COVID-19 pandemic has exacerbated pre-existing inequalities and challenges for the implementation of the Convention and further highlighted that the loss and degradation of biodiversity increases the risk of zoonotic disease spillover from wildlife to people and that biodiversity should continue to be mainstreamed in COVID-19 recovery plans and in plans aimed at reducing the risk of future pandemics, emphasizes the importance of a One Health approach and other holistic approaches that deliver multiple benefits to the health and well-being of people, and planet, that would further strengthen the capacity to address biodiversity loss, prevent and respond to the emergence of diseases, including zoonotic infections, and future pandemics, and contribute to reducing the adverse impacts of climate change, calls for transformative actions from all relevant stakeholders and adequate and sufficient means of implementation, particularly for developing countries, to ensure the full implementation of the Convention to halt and reverse biodiversity loss, and welcomes the financial commitments and initiatives that have been announced from governments, organizations and the private sector that contribute to biodiversity conservation, restoration and sustainable use and maintain the political momentum for the implementation of the Kunming-Montreal Global Biodiversity Framework;",
    "17": "Notes with concern the limited progress made in the implementation of the three objectives of the Convention, namely, the conservation of biological diversity, the sustainable use of its components and the fair and equitable sharing of the benefits arising out of the utilization of genetic resources;",
    "18": "Recalls with appreciation the entry into force of the Nagoya Protocol on Access to Genetic Resources and the Fair and Equitable Sharing of Benefits Arising from Their Utilization to the Convention on Biological Diversity on 12 October 2014, and notes with particular concern the limited progress made in the implementation of the Nagoya Protocol;",
    "19": "Notes the limited progress made in mainstreaming article 8 (j) of the Convention and related provisions into various areas of work under the Convention, takes note with appreciation of decision 15/10 of the Conference of the Parties to the Convention to develop a new programme of work on article 8 (j) and other provisions of the Convention related to Indigenous Peoples and local communities aligned with the Kunming-Montreal Global Biodiversity Framework, with the full and effective participation of Indigenous Peoples and local communities, and in this regard invites the secretariat of the Convention, through the Secretary-General, to report on the progress made by the Ad Hoc Open-ended Inter-sessional Working Group on Article 8 (j) and related provisions when reporting on the implementation of the present resolution to the General Assembly;",
    "20": "Encourages the respective parties, in close collaboration with relevant stakeholders, to take concrete measures towards achieving the objectives of the Convention on Biological Diversity and the Protocols thereto, the Cartagena Protocol on Biosafety and the Nagoya Protocol, requests the parties, in close collaboration with relevant stakeholders, to coherently and efficiently implement the obligations and commitments under the Convention and the Protocols, and in this regard emphasizes the need to comprehensively address at all levels the difficulties that may impede their implementation;",
    "21": "Reaffirms the importance of continuing to pursue more efficient and coherent implementation of the three objectives of the Convention, and calls upon parties and stakeholders to strengthen international cooperation measures for the fulfilment of obligations contained in the Convention;",
    "22": "Highlights the importance of parties raising high-level political engagement for the achievement of the objectives of the Convention and the related Goals and targets of the 2030 Agenda;",
    "23": "Invites all parties, relevant departments of the Secretariat, the specialized agencies, funds and programmes of the United Nations system and the regional commissions to continue to contribute to the achievement of the objectives of the Convention;",
    "24": "Notes the important role of the United Nations Environment Management Group in enhancing inter-agency coordination to support the implementation of the Kunming-Montreal Global Biodiversity Framework;",
    "25": "Stresses the importance of mainstreaming biodiversity for achieving the objectives of the Convention, the 2050 Vision and 2030 mission for Biodiversity in order to achieve the transformational change required throughout societies and economies, including changes in behaviour and decision-making at all levels, and urges all relevant stakeholders to mainstream biodiversity in all relevant sectors;",
    "26": "Calls upon Governments and all stakeholders to take appropriate measures to mainstream consideration of the socioeconomic impacts and benefits of the conservation and sustainable use of biodiversity and its components, as well as ecosystems that provide essential services, into relevant programmes and policies at all levels, in accordance with national legislation, circumstances and priorities;",
    "27": "Stresses the importance of mainstreaming biodiversity in the implementation of the 2030 Agenda as part of national implementation plans for the Sustainable Development Goals, in particular all biodiversity-related Goals and targets;",
    "28": "Recognizes that integrating biodiversity considerations into sectoral and cross-sectoral policies, plans and programmes at all levels is critical for harnessing the benefits of enhanced synergies and policy coherence;",
    "29": "Stresses the critical importance of mainstreaming biodiversity across government and society in order to achieve the objectives of the Convention, and the urgent need to mainstream biodiversity in line with the Kunming-Montreal Global Biodiversity Framework;",
    "30": "Welcomes the decisions of the parties to the Convention to better mainstream biodiversity and to take specific actions tailored to national needs and circumstances, and in line with other relevant international agreements, including in key sectors, such as agriculture, forestry, fisheries and tourism, as well as health, energy, mining, infrastructure, manufacturing and processing sectors, which are crucial for addressing biodiversity loss, bearing in mind the impact of these sectors on biodiversity;",
    "31": " Sustainable Use of Marine Biological Diversity of Areas beyond National Jurisdiction\u201d;",
    "32": "Emphasizes the importance of ending illegal, unreported and unregulated fishing, and welcomes the Agreement on Fisheries Subsidies reached at the Twelfth Ministerial Conference of the World Trade Organization;",
    "33": "Notes the critical role of biodiversity and ecosystem functions and services for climate change adaptation, mitigation and disaster risk reduction, including by adding resilience to fragile ecosystems and making them less vulnerable, and that continued climate change will have predominantly adverse and often irreversible impacts on many ecosystems and their functions and services, with significant negative social, cultural and economic consequences;",
    "34": "Urges the parties to the Convention to facilitate the transfer of technology on mutually agreed terms for the effective implementation of the Convention in accordance with article 16 and other relevant provisions of the Convention, and in this regard welcomes the decision to establish an informal advisory group on technical and scientific cooperation, to provide strategic advice on practical measures, tools and opportunities to promote and facilitate technical and scientific cooperation in accordance with the terms of reference contained in annex III to decision 15/8 of the Conference of the Parties to the Convention;",
    "35": "Urges parties and invites other Governments and relevant organizations to recognize the important role of, and to promote, science, technology and innovation in supporting the implementation of the goals and targets of the Kunming-Montreal Global Biodiversity Framework towards achieving the 2050 Vision for Biodiversity of living in harmony with nature;",
    "36": "Welcomes decision 15/11 of the Conference of the Parties to the Convention, entitled \u201cGender Plan of Action\u201d, which recognizes the importance of advancing efforts to achieve gender equality and the empowerment of all women and girls and of supporting and advancing gender mainstreaming and gender-responsive implementation of the Kunming-Montreal Global Biodiversity Framework and encourages parties to promote the mainstreaming of a gender perspective in developing, implementing and revising their national, and where appropriate, regional and subnational biodiversity strategies and action plans and equivalent instruments in implementing the three objectives of the Convention, and also recognizes the need to enhance cooperation on capacity-building in order to support parties in this process;",
    "37": "Invites countries that have not yet done so to ratify or accede to the Convention;",
    "38": "Invites parties to the Convention to ratify or accede to the Nagoya Protocol, and invites the Executive Secretary of the Convention and the Global Environment Facility, within its mandate as the financial mechanism of the Convention, in collaboration with relevant organizations, to continue to support capacity-building and development activities to support the ratification and implementation of the Protocol;",
    "39": "Also invites parties to the Convention to consider, as appropriate, ratifying or acceding to the Cartagena Protocol;",
    "40": "Invites parties to the Cartagena Protocol to consider, as appropriate, ratifying or acceding to the Nagoya-Kuala Lumpur Supplementary Protocol on Liability and Redress to the Cartagena Protocol on Biosafety;",
    "41": " particular changes in land and sea use, direct exploitation of organisms, climate change, pollution and invasion of alien species;",
    "42": "Notes the findings of the Intergovernmental Science-Policy Platform on Biodiversity and Ecosystem Services in its assessment report on the diverse values and valuation of nature, and stresses that achieving a sustainable and just future requires institutions that enable a recognition and integration of the diverse values of nature and nature\u2019s contributions to people, and that the transformative change needed to address the global biodiversity crisis relies on shifting away from predominant values that currently overemphasize short-term and individual material gains to nurturing sustainability-aligned values across society;",
    "43": "Takes note of the Intergovernmental Science-Policy Platform on Biodiversity and Ecosystem Services assessment reports on the sustainable use of wild species and on invasive alien species and their control, and stresses that the impacts of invasive alien species are increasing rapidly and are predicted to continue rising in the future, whereas they can be prevented and mitigated through effective management, with closer collaboration across sectors and countries;",
    "44": "Notes that increasing investments in nature-based solutions, ecosystem- based approaches and other management and conservation approaches, in line with resolution 5/5 of the United Nations Environment Assembly, has the potential to cost- effectively support biodiversity conservation, restoration and its sustainable use, to help advance climate mitigation and adaptation and to reduce adverse impacts of climate change and to slow, halt and even reverse some aspects of biodiversity and ecosystem loss, and therefore invites all relevant stakeholders to consider the opportunities it presents;",
    "45": "Stresses the importance of engaging Indigenous Peoples and local communities, women, youth, civil society, local governments and authorities, academia, the business and financial sectors and other relevant stakeholders to support action towards the implementation of the Kunming-Montreal Global Biodiversity Framework, the 2050 Vision for Biodiversity and the three objectives of the Convention, and invites them to align their practices more explicitly with the objectives of the Convention, including through partnerships, in accordance with national legislation, circumstances and priorities;",
    "46": "Encourages the private sector, in particular business and financial institutions, to progressively reduce negative impacts on biodiversity, increase positive impacts, reduce biodiversity-related risks to business and financial institutions, and promote actions to ensure sustainable patterns of production, in this regard stresses the importance of the work of the Global Partnership for Business and Biodiversity, and notes other related and complementary initiatives;",
    "47": "Notes the ongoing work of the Joint Liaison Group of the secretariats and offices of the relevant subsidiary bodies of the Convention on Biological Diversity, the Convention to Combat Desertification and the United Nations Framework Convention on Climate Change and the Liaison Group of Biodiversity-related Conventions, acknowledges the importance of improving coherence in the implementation of those conventions, recognizes the importance of enhancing synergies among the biodiversity-related conventions and agreements, without prejudice to their specific objectives, in this regard notes the contribution of the United Nations Environment Assembly, as reflected in its resolution 2/17 of 27 May 2016,30 and the outcomes of its fourth session, held in Nairobi from 11 to 15 March 2019,31 in particular its ministerial declaration, and encourages the conferences of the parties to the biodiversity-related multilateral environmental agreements to consider strengthening efforts in this regard, taking into account relevant experiences and bearing in mind their respective independent legal status and mandates;",
    "48": "Reaffirms the commitment at the very heart of the 2030 Agenda to leave no one behind and commit to taking more tangible steps to support people in vulnerable situations and the most vulnerable countries and to reach the furthest behind first;",
    "49": "Requests the Secretary-General to submit to the General Assembly, at its seventy-ninth session, a report on the implementation of the present resolution, progress in the implementation of the Convention on Biological Diversity and the Kunming-Montreal Global Biodiversity Framework, and decides to include in the provisional agenda of its seventy-ninth session, under the item entitled \u201cSustainable development\u201d, the sub-item entitled \u201cConvention on Biological Diversity\u201d."
  },
  "agenda_items": [
    "Item 18"
  ],
  "symbol_references": []
}