{
  "symbol": "A/RES/73/46",
  "filename": "A_RES_73_46.pdf",
  "title": "73/46. Women, disarmament, non-proliferation and arms control",
  "text": "United Nations \nA/RES/73/46\n \n \nGeneral Assembly \nDistr.: General \n12 December 2018 \n \n18-21247 (E)    141218 \n*1821247* \n \n \nSeventy-third session \nAgenda item 101 (gg) \n \n \n \n \n Resolution adopted by the General Assembly \non 5 December 2018 \n \n \n \n \n[on the report of the First Committee (A/73/510 and A/73/510/Corr.1)] \n \n \n \n73/46. Women, disarmament, non-proliferation and arms control  \n \n \n \nThe General Assembly,  \n \nRecalling that the Charter of the United Nations reaffirms the equal rights of \nwomen and men, \n \nRecalling also its resolutions 65/69 of 8 December 2010, 67/48 of 3 December \n2012, 68/33 of 5 December 2013, 69/61 of 2 December 2014 and 71/56 of \n5 December 2016,  \n \nRecalling further General Assembly and Security Council resolutions on the \nissue of women and peace and security, \n \nRecalling the 2015 review of the women and peace and security agenda,  \n \nReaffirming the Sustainable Development Goals relevant to the promotion of \nwomen, disarmament, non-proliferation and arms control, and acknowledging that the \nsuccess of efforts to achieve sustainable development and disarmament depends on \nthe full and effective inclusion of women in all aspects of these efforts, \n \nWelcoming the call for the full and meaningful participation of women in efforts \nto prevent, combat and eradicate the illicit transfer of small arms, pursuant to Security \nCouncil resolutions 2106 (2013) of 24 June 2013, 2117 (2013) of 26 September 2013, \n2122 (2013) of 18 October 2013 and 2220 (2015) of 22 May 2015, \n \nReaffirming that the equal, full and effective participation of both women and \nmen is one of the essential factors for the promotion and attainment of sustainable \npeace and security, \n \nRecognizing the valuable contribution of women to practical disarmament \nmeasures carried out at the local, national, subregional and regional levels in the \nprevention and reduction of armed violence and armed conflict, and in promoting \ndisarmament, non-proliferation and arms control, \n\nA/RES/73/46 \nWomen, disarmament, non-proliferation and arms control\n \n18-21247\n2/3 \n \n \nRecognizing also that the role of women in disarmament, non-proliferation and \narms control should be further developed and in particular the need to facilitate the \nparticipation and representation of women in policymaking, planning and \nimplementation processes related to disarmament, non-proliferation and arms control, \n \nRecalling the entry into force of the Arms Trade Treaty, 1  and therefore \nencouraging States parties to fully implement all the provisions of the Treaty, \nincluding the provisions on serious acts of gender-based violence and on violence \nagainst children, \n \nNoting with appreciation the efforts of Member States to increase the \nparticipation of women in their national and regional coordination mechanisms on \ndisarmament-related matters, including in efforts to prevent, combat and eradicate the \nillicit trade in small arms and light weapons in all its aspects, \n \nRecognizing the important role played by civil society organizations in \npromoting the role of women in disarmament, non-proliferation and arms control, \n \n1. \nUrges Member States, relevant subregional and regional organizations, the \nUnited Nations and the specialized agencies to promote equal opportunities for the \nrepresentation of women in all decision-making processes with regard to matters \nrelated to disarmament, non-proliferation and arms control, in particular as it relates \nto the prevention and reduction of armed violence and armed conflict; \n \n2. \nWelcomes the report of the Secretary-General on the measures taken by \nMember States to implement General Assembly resolution 71/56;2  \n \n3. \nAlso welcomes the continuing efforts of the United Nations organs, \nagencies, funds and programmes to accord high priority to the issue of women and \npeace and security, and in this regard notes the role of the United Nations Entity for \nGender Equality and the Empowerment of Women (UN-Women) in promoting the \nimplementation of all resolutions related to women in the context of peace and \nsecurity; \n \n4. \nEncourages Member States to better understand the impact of armed \nviolence, in particular the impact of the illicit trafficking in small arms and light \nweapons on women and girls, through, inter alia, the development of national action \nplans on women and peace and security and strengthening the collection of data \ndisaggregated by sex and age; \n \n5. \nUrges Member States to support and strengthen the effective participation \nof women in organizations in the field of disarmament at the local, national, \nsubregional and regional levels; \n \n6. \nCalls upon all States to empower women, including through capacity-\nbuilding efforts, as appropriate, to participate in the design and implementation of \ndisarmament, non-proliferation and arms control efforts; \n \n7. \nEncourages States to seriously consider increasing funding for policies \nand programmes that take account of the differing impacts of illicit small arms and \nlight weapons on women, men, girls and boys; \n \n8. \nCalls upon all States to develop appropriate and effective national risk \nassessment criteria to facilitate the prevention of the use of arms to commit violence \nagainst women and children; \n__________________ \n \n1  See resolution 67/234 B. \n \n2  A/73/115. \n\nWomen, disarmament, non-proliferation and arms control \nA/RES/73/46\n \n3/3\n18-21247 \n \n \n9. \nRequests the relevant United Nations organs, agencies, funds and \nprogrammes to assist States, upon request, in promoting the role of women in \ndisarmament, non-proliferation and arms control, including in preventing, combating \nand eradicating the illicit trade in small arms and light weapons; \n \n10. Requests the Secretary-General to seek the views of Member States on \nways and means of promoting the role of women in disarmament, non-proliferation \nand arms control and to report to the General Assembly at its seventy-fifth session on \nthe implementation of the present resolution; \n \n11. \nDecides to include in the provisional agenda of its seventy-fifth session, \nunder the item entitled \u201cGeneral and complete disarmament\u201d, the sub-item entitled \n\u201cWomen, disarmament, non-proliferation and arms control\u201d. \n \n45th plenary meeting  \n5 December 2018 \n \n",
  "paragraphs": {
    "1": "Urges Member States, relevant subregional and regional organizations, the United Nations and the specialized agencies to promote equal opportunities for the representation of women in all decision-making processes with regard to matters related to disarmament, non-proliferation and arms control, in particular as it relates to the prevention and reduction of armed violence and armed conflict;",
    "2": "Welcomes the report of the Secretary-General on the measures taken by Member States to implement General Assembly resolution 71/56;2",
    "3": "Also welcomes the continuing efforts of the United Nations organs, agencies, funds and programmes to accord high priority to the issue of women and peace and security, and in this regard notes the role of the United Nations Entity for Gender Equality and the Empowerment of Women (UN-Women) in promoting the implementation of all resolutions related to women in the context of peace and security;",
    "4": "Encourages Member States to better understand the impact of armed violence, in particular the impact of the illicit trafficking in small arms and light weapons on women and girls, through, inter alia, the development of national action plans on women and peace and security and strengthening the collection of data disaggregated by sex and age;",
    "5": "Urges Member States to support and strengthen the effective participation of women in organizations in the field of disarmament at the local, national, subregional and regional levels;",
    "6": "Calls upon all States to empower women, including through capacity- building efforts, as appropriate, to participate in the design and implementation of disarmament, non-proliferation and arms control efforts;",
    "7": "Encourages States to seriously consider increasing funding for policies and programmes that take account of the differing impacts of illicit small arms and light weapons on women, men, girls and boys;",
    "8": "Calls upon all States to develop appropriate and effective national risk assessment criteria to facilitate the prevention of the use of arms to commit violence against women and children; __________________ 1 See resolution 67/234 B. 2 A/73/115. Women, disarmament, non-proliferation and arms control A/RES/73/46 3/3 18-21247",
    "9": "Requests the relevant United Nations organs, agencies, funds and programmes to assist States, upon request, in promoting the role of women in disarmament, non-proliferation and arms control, including in preventing, combating and eradicating the illicit trade in small arms and light weapons;",
    "10": "Requests the Secretary-General to seek the views of Member States on ways and means of promoting the role of women in disarmament, non-proliferation and arms control and to report to the General Assembly at its seventy-fifth session on the implementation of the present resolution;",
    "11": "Decides to include in the provisional agenda of its seventy-fifth session, under the item entitled \u201cGeneral and complete disarmament\u201d, the sub-item entitled \u201cWomen, disarmament, non-proliferation and arms control\u201d. 45th plenary meeting 5 December 2018"
  },
  "agenda_items": [
    "Item 101"
  ],
  "symbol_references": []
}