{
  "symbol": "A/RES/74/248",
  "filename": "A_RES_74_248.pdf",
  "title": "74/248. Investigation into the conditions and circumstances resulting in the tragic death of Dag Hammarskj\u00f6ld and of the members of the party accompanying him",
  "text": "United Nations \nA/RES/74/248\n \n \nGeneral Assembly \nDistr.: General \n21 January 2020 \n \n19-22676 (E)    220120 \n*1922676* \n \n \nSeventy-fourth session \nAgenda item 128 \nInvestigation into the conditions and circumstances \nresulting in the tragic death of Dag Hammarskj\u00f6ld and of \nthe members of the party accompanying him \n \n \n \n \n Resolution adopted by the General Assembly \non 27 December 2019 \n \n \n \n \n[without reference to a Main Committee (A/74/L.20 and A/74/L.20/Add.1)] \n \n \n 74/248. Investigation into the conditions and circumstances resulting \nin the tragic death of Dag Hammarskj\u00f6ld and of the members \nof the party accompanying him  \n \n \n \nThe General Assembly, \n \nRecalling its resolutions 1759 (XVII) of 26 October 1962, 69/246 of \n29 December 2014, 70/11 of 19 November 2015, 71/260 of 23 December 2016 and \n72/252 of 24 December 2017, \n \nUnderlining the shared responsibility to pursue the full truth concerning the \nconditions and circumstances resulting in the tragic death of Dag Hammarskj\u00f6ld and \nof the members of the party accompanying him, \n \nRecognizing that a further inquiry or investigation would be necessary to finally \nestablish the facts of the matter, \n \nExpressing appreciation for the continuing commitment of the Secretary-\nGeneral to the search for the truth in this regard, \n \nWelcoming the report of the Eminent Person appointed pursuant to General \nAssembly resolution 72/252,1 and recognizing the contributions by Member States to \nhis work, in particular those that have appointed independent and high-ranking \nofficials, \n \nAcknowledging the letter dated 12 September 2019 from the Secretary-General \naddressed to the President of the General Assembly, transmitting the report of the \nEminent Person, together with his assessment of the way forward,1 \n__________________ \n \n1  See A/73/973. \n\nA/RES/74/248 \nInvestigation into the conditions and circumstances resulting\nin the tragic death of Dag Hammarskj\u00f6ld and of the members\nof the party accompanying him \n \n19-22676\n2/2 \n \n \nNoting, in particular, the conclusion drawn by the Eminent Person that it appears \nplausible that an external attack or threat may have been the cause of the crash, \nwhether by way of a direct attack causing flight SE-BDY to crash or by causing a \nmomentary distraction of the pilots,  \n \n1. \nRequests the Secretary-General to reappoint the Eminent Person appointed \npursuant to General Assembly resolution 72/252 to continue to review the information \nreceived and possible new information made available by Member States, including \nby individuals and private entities, to assess its probative value and to draw \nconclusions from the investigations already conducted; \n \n2. \nUrges all Member States, in particular those referred to in the report, 1 to \nrelease any relevant records in their possession and to provide to the Eminent Person \nand the Secretary-General relevant information related to the death of Dag \nHammarskj\u00f6ld and of the members of the party accompanying him, and to ensure that \nthey have conducted a full review of their archives and records; \n \n3. \nCalls upon those Member States referred to in the report to cooperate with \nand assist the Eminent Person fully, including by appointing without delay \nindependent and high-ranking officials to determine whether relevant information \nexists within their security, intelligence and defence archives, and encourages the \nEminent Person to remain engaged with all high-ranking officials, including those \nwho have concluded their work;  \n \n4. \nCalls upon Member States to encourage individuals and private entities to \nensure that any relevant records related to the death of Dag Hammarskj\u00f6ld and of the \nmembers of the party accompanying him are made available for review by the \nEminent Person;  \n \n5. \nRequests the Secretary-General to report to the General Assembly before \nthe end of its seventy-fifth session on progress made; \n \n6. \nDecides to include in the provisional agenda of its seventy-sixth session \nthe item entitled \u201cInvestigation into the conditions and circumstances resulting in the \ntragic death of Dag Hammarskj\u00f6ld and of the members of the party accompanying \nhim\u201d. \n \n52nd (resumed) plenary meeting \n27 December 2019 \n \n",
  "paragraphs": {
    "1": "Requests the Secretary-General to reappoint the Eminent Person appointed pursuant to General Assembly resolution 72/252 to continue to review the information received and possible new information made available by Member States, including by individuals and private entities, to assess its probative value and to draw conclusions from the investigations already conducted;",
    "2": "Urges all Member States, in particular those referred to in the report, 1 to release any relevant records in their possession and to provide to the Eminent Person and the Secretary-General relevant information related to the death of Dag Hammarskj\u00f6ld and of the members of the party accompanying him, and to ensure that they have conducted a full review of their archives and records;",
    "3": "Calls upon those Member States referred to in the report to cooperate with and assist the Eminent Person fully, including by appointing without delay independent and high-ranking officials to determine whether relevant information exists within their security, intelligence and defence archives, and encourages the Eminent Person to remain engaged with all high-ranking officials, including those who have concluded their work;",
    "4": "Calls upon Member States to encourage individuals and private entities to ensure that any relevant records related to the death of Dag Hammarskj\u00f6ld and of the members of the party accompanying him are made available for review by the Eminent Person;",
    "5": "Requests the Secretary-General to report to the General Assembly before the end of its seventy-fifth session on progress made;",
    "6": "Decides to include in the provisional agenda of its seventy-sixth session the item entitled \u201cInvestigation into the conditions and circumstances resulting in the tragic death of Dag Hammarskj\u00f6ld and of the members of the party accompanying him\u201d. 52nd (resumed) plenary meeting 27 December 2019"
  },
  "agenda_items": [
    "Item 128"
  ],
  "symbol_references": [
    "A/74/L.20"
  ]
}