{
  "symbol": "A/RES/76/14",
  "filename": "A_RES_76_14.pdf",
  "title": "76/14. International Year of Basic Sciences for Sustainable Development, 2022",
  "text": "United Nations \nA/RES/76/14\n \n \nGeneral Assembly \nDistr.: General \n6 December 2021 \n \n21-17890 (E)    091221 \n*2117890* \n \n \nSeventy-sixth session \nAgenda item 15 \nIntegrated and coordinated implementation of and \nfollow-up to the outcomes of the major United Nations \nconferences and summits in the economic, social and \nrelated fields \n \n \n \n \n Resolution adopted by the General Assembly \non 2 December 2021 \n \n \n \n \n[without reference to a Main Committee (A/76/L.12 and A/76/L.12/Add.1)] \n \n \n \n76/14. International Year of Basic Sciences for Sustainable \nDevelopment, 2022 \n \n \n \nThe General Assembly, \n \nReaffirming its resolution 70/1 of 25 September 2015, entitled \u201cTransforming \nour world: the 2030 Agenda for Sustainable Development\u201d, in which it adopted a \ncomprehensive, far-reaching and people-centred set of universal and transformative \nSustainable Development Goals and targets, its commitment to working tirelessly for \nthe full implementation of the Agenda by 2030, its recognition that eradicating \npoverty in all its forms and dimensions, including extreme poverty, is the greatest \nglobal challenge and an indispensable requirement for sustainable development, and \nits commitment to achieving sustainable development in its three dimensions \u2013 \neconomic, social and environmental \u2013 in a balanced and integrated manner, and to \nbuilding upon the achievements of the Millennium Development Goals and seeking \nto address their unfinished business,  \n \nReaffirming also its resolutions 53/199 of 15 December 1998 and 61/185 of \n20 December 2006 on the proclamation of international years, and Economic and \nSocial Council resolution 1980/67 of 25 July 1980 on international years and \nanniversaries, particularly paragraphs 1 to 10 of the annex thereto on the agreed \ncriteria for the proclamation of international years, as well as paragraphs 13 and 14, \nin which it is stated that an international year should not be proclaimed before the \nbasic arrangements for its organization and financing have been made,  \n \nRecalling its resolutions 70/212 of 22 December 2015 on the International Day \nof Women and Girls in Science, and 68/220 of 20 December 2013 on science, \ntechnology and innovation for development, in which it recognized that full and equal \naccess to and participation in science, technology and innovation for women and girls \n\nA/RES/76/14 \nInternational Year of Basic Sciences for \nSustainable Development, 2022 \n \n21-17890\n2/3 \n \nof all ages is imperative for achieving gender equality and the empowerment of \nwomen and girls, which is essential to achieve sustainable development,  \n \nRecalling also its resolutions 58/293 of 10 June 2004, in which it proclaimed \n2005 the International Year of Physics, 62/200 of 19 December 2007, in which it \ndeclared 2009 the International Year of Astronomy, 63/209 of 19 December 2008, in \nwhich it proclaimed 2011 the International Year of Chemistry, 66/284 of 3 July 2012, \nin which it proclaimed 2014 the International Year of Crystallography, 68/221 of \n20 December 2013, in which it proclaimed 2015 the International Year of Light and \nLight-based Technologies, and 72/228 of 20 December 2017, in which it proclaimed \n2019 the International Year of the Periodic Table of Chemical Elements, \n \nNoting the adoption by the General Conference of the United Nations \nEducational, Scientific and Cultural Organization at its fortieth session, on \n25 November 2019, of a resolution supporting the proclamation by the General \nAssembly of the United Nations of 2022 as the International Year of Basic Sciences \nfor Sustainable Development,1  \n \nRecognizing the high value for humankind of basic sciences, and that enhanced \nglobal awareness of, and increased education in, the basic sciences is vital to attain \nsustainable development and to improve the quality of life for people all over the \nworld,  \n \nStressing that the applications of basic sciences are vital for advances in \nmedicine, industry, agriculture, water resources, energy planning, environment, \ncommunications and culture, and that basic sciences and emerging technologies \nrespond to the needs of humankind by providing access to information and increasing \nthe health and well-being of individuals, communities and societies,  \n \nEmphasizing the importance of basic sciences to launching rational and \ninnovative thinking and a knowledge-based society, \n \nAware that the year 2022 provides an opportunity to highlight the need for \ninternational scientific collaboration on the centennial celebration of the founding of \nthe International Union of Pure and Applied Physics,  \n \nNoting that the International Union of Pure and Applied Physics and 40 other \nscience unions and organizations established a Steering Committee in 2017, the goal \nof which is to promote the proclamation by the General Assembly of the United \nNations of 2022 as the International Year of Basic Sciences for Sustainable \nDevelopment, and to elaborate, and collaborate in the implementation of, the relevant \nevents,  \n \nNoting also that 50 science academies and networks have expressed their \nsupport, including 28 Nobel laureates and Fields Medalists,  \n \n1. \nProclaims the year 2022 the International Year of Basic Sciences for \nSustainable Development;  \n \n2. \nInvites all Member States, organizations of the United Nations system and \nother global, regional and subregional organizations, as well as other relevant \nstakeholders, including academia, civil society, inter alia, international and national \nnon-governmental organizations, individuals and the private sector, to observe and \nraise awareness of the importance of basic sciences for sustainable development, in \naccordance with national priorities;  \n__________________ \n \n1  United Nations Educational, Scientific and Cultural Organization, Records of the General \nConference, Fortieth Session, Paris, 12\u201327 November 2019, vol. 1, Resolutions, sect. IV, \nresolution 32. \n\nInternational Year of Basic Sciences for \nSustainable Development, 2022 \nA/RES/76/14\n \n3/3\n21-17890 \n \n \n3. \nInvites the United Nations Educational, Scientific and Cultural \nOrganization to be the lead agency and focal point for the Year and to organize \nactivities to be realized during the Year, in collaboration with other relevant entities \nof the United Nations system, as well as international governmental and \nnon-governmental scientific organizations, such as the International Union of Pure \nand Applied Physics, the European Laboratory for Particle Physics and their \nassociated organizations and federations across the world, and in this regard notes \nthat the activities of the Year will be funded from voluntary contributions, including \nfrom the private sector;  \n \n4. \nRequests the Secretary-General to bring the present resolution to the \nattention of all Member States, the organizations of the United Nations system and \nother relevant stakeholders, including civil society organizations, academia and the \nprivate sector, for appropriate observance.  \n \n43rd plenary meeting \n2 December 2021 \n \n",
  "paragraphs": {
    "1": "Proclaims the year 2022 the International Year of Basic Sciences for Sustainable Development;",
    "2": "Invites all Member States, organizations of the United Nations system and other global, regional and subregional organizations, as well as other relevant stakeholders, including academia, civil society, inter alia, international and national non-governmental organizations, individuals and the private sector, to observe and raise awareness of the importance of basic sciences for sustainable development, in accordance with national priorities; __________________ 1 United Nations Educational, Scientific and Cultural Organization, Records of the General Conference, Fortieth Session, Paris, 12\u201327 November 2019, vol. 1, Resolutions, sect. IV, resolution 32. International Year of Basic Sciences for Sustainable Development, 2022 A/RES/76/14 3/3 21-17890",
    "3": "Invites the United Nations Educational, Scientific and Cultural Organization to be the lead agency and focal point for the Year and to organize activities to be realized during the Year, in collaboration with other relevant entities of the United Nations system, as well as international governmental and non-governmental scientific organizations, such as the International Union of Pure and Applied Physics, the European Laboratory for Particle Physics and their associated organizations and federations across the world, and in this regard notes that the activities of the Year will be funded from voluntary contributions, including from the private sector;",
    "4": "Requests the Secretary-General to bring the present resolution to the attention of all Member States, the organizations of the United Nations system and other relevant stakeholders, including civil society organizations, academia and the private sector, for appropriate observance. 43rd plenary meeting 2 December 2021"
  },
  "agenda_items": [
    "Item 15"
  ],
  "symbol_references": [
    "A/76/L.12"
  ]
}