{
  "symbol": "A/RES/74/269",
  "filename": "A_RES_74_269.pdf",
  "title": "74/269. Scope, modalities, format and organization of the summit on biodiversity",
  "text": "United Nations \nA/RES/74/269\n \n \nGeneral Assembly \nDistr.: General \n2 April 2020 \n \n20-04976 (E)    060420     \n*2004976* \n \n \nSeventy-fourth session \nAgenda item 19 (f) \nSustainable development: Convention on \nBiological Diversity \n \n \n \n \n Resolution adopted by the General Assembly on \n31 March 2020 \n \n \n \n \n[without reference to a Main Committee (A/74/L.49)] \n \n \n 74/269. Scope, modalities, format and organization of the summit \non biodiversity \n \n \n \nThe General Assembly, \n \nRecalling its resolution 74/4 of 15 October 2019, entitled \u201cPolitical declaration \nof the high-level political forum on sustainable development convened under the \nauspices of the General Assembly\u201d and its call on gearing up for a decade of action \nand delivery for sustainable development, \n \nRecalling also its resolutions 73/234 of 20 December 2018 and 74/221 of \n19 December 2019 and its decision to convene a summit on biodiversity at the level \nof Heads of State and Government, within existing resources, before the fifteenth \nmeeting of the Conference of the Parties to the Convention on Biological Diversity, \nin 2020, in order to highlight the urgency of action at the highest levels in support of \na post-2020 global biodiversity framework that contributes to the 2030 Agenda for \nSustainable Development1  and places the global community on a path towards \nrealizing the 2050 Vision for Biodiversity, \u201cLiving in harmony with nature\u201d, \n \n1. \nDecides that the summit on biodiversity at the level of Heads of State and \nGovernment to be convened by the President of the General Assembly shall be held \nat United Nations Headquarters in New York on the first day of the general debate of \nthe Assembly at its seventy-fifth session, from 3 to 6 p.m., and on the second day of \nthe general debate, from 10 a.m. to 1 p.m.; \n \n2. \nAlso decides that the summit and its preparatory process shall provide for \nthe effective participation of all States Members of the United Nations, all members \nof the specialized agencies and all parties to the Convention on Biological Diversity; 2  \n__________________ \n \n1  Resolution 70/1. \n \n2  United Nations, Treaty Series, vol. 1760, No. 30619. \n\nA/RES/74/269 \n \n20-04976\n2/4 \n \n \n3. \nFurther decides that the summit will consist of an opening segment, a \nplenary segment for general discussion, two leaders dialogues and a brief closing \nsegment and that the overall theme of the summit will be \u201cUrgent action on \nbiodiversity for sustainable development\u201d; \n \n4. \nDecides that: \n \n(a) \nThe opening segment, to be held from 3 to 3.50 p.m. on the first day of the \ngeneral debate, will include the President of the General Assembly at its seventy-fifth \nsession, the Secretary-General, the President of the Economic and Social Council, the \nhost of the fourteenth meeting of the Conference of the Parties to the Convention on \nBiological Diversity, the host of the fifteenth meeting of the Conference of the Parties \nto the Convention on Biological Diversity, the Executive Director of the United \nNations Environment Programme, the Executive Secretary of the Secretariat for the \nConvention on Biological Diversity and the Chair of the Intergovernmental Science-\nPolicy Platform on Biodiversity and Ecosystem Services, as well as an eminent \nchampion of biodiversity and a youth leader, one of whom should be a representative \nof indigenous peoples and local communities, both to be selected, in consultation with \nMember States, by the President of the General Assembly; \n \n(b) \nThe plenary segment will start at the end of the opening segment and end \nat 6 p.m. on the first day of the general debate and will comprise statements by States \nMembers of the United Nations, members of the specialized agencies, parties to the \nConvention on Biological Diversity and observers of the General Assembly and the \ntime limits for these statements, strictly observed, will be three minutes for individual \ndelegations and five minutes for statements made on behalf of a group of States; \n \n(c) \nDelegations will have only one opportunity to speak in the summit, either \nin the plenary segment or in one of the leaders dialogues; \n \n(d) \nThe closing segment, to be held after the conclusion of the leaders \ndialogues on the second day of the general debate, will comprise key messages from \nthe leaders dialogues and concluding remarks by the President of the General \nAssembly; \n \n5. \nAlso decides that the organizational arrangements for the leaders dialogues \nwill be as follows: \n \n(a) \nTwo consecutive leaders dialogues of 75 minutes each will start at 10 a.m. \non the second day of the general debate; \n \n(b) \nThe leaders dialogues will address the following themes: \n \n \nDialogue 1: Addressing biodiversity loss and mainstreaming biodiversity \n \nfor sustainable development; \n \n \nDialogue 2: Harnessing science, technology and innovation, capacity-\nbuilding, access and benefit-sharing, financing and partnerships for \nbiodiversity; \n \n(c) \nEach leaders dialogue will be presided over by two co-chairs, one from a \ndeveloping country and one from a developed country, to be appointed by the \nPresident of the General Assembly from among the Heads of State or Government \nattending the summit, with adequate regional representation; \n \n(d) \nThe time limit for interventions in the leaders dialogues will be three \nminutes, strictly observed; \n \n(e) \nThe President of the General Assembly may invite parliamentarians, local \ngovernments, the heads or senior representatives of relevant United Nations entities \nas well as intergovernmental organizations, the secretariats of the Rio and \n\nA/RES/74/269\n \n3/4\n20-04976 \n \nbiodiversity-related conventions, civil society, the private sector, including the \nfinancial sector, academia, youth, indigenous peoples and local communities to serve \nas speakers in the leaders dialogues, taking into account gender balance, level of \ndevelopment and geographical representation; \n \n6. \nInvites all observers of the General Assembly to participate in the summit \nat the highest possible level; \n \n7. \nInvites non-governmental organizations in consultative status with the \nEconomic and Social Council with relevant expertise to register with the Secretariat \nto attend the summit; \n \n8. \nRequests the President of the General Assembly to draw up a list of other \nrelevant representatives of relevant non-governmental organizations, civil society \norganizations, academic institutions, indigenous peoples and local communities, \nyouth and the private sector who may attend the summit, taking into account the \nprinciples of transparency and equitable gender and geographical representation, and \nto submit the list to Member States for their consideration on a non-objection basis;3  \n \n9. \nInvites the United Nations system, including the funds, programmes and \nspecialized agencies, regional commissions and relevant envoys of the Secretary-\nGeneral and the secretariats of the biodiversity-related conventions, to participate in \nthe summit, as appropriate, to highlight the need to support a post-2020 global \nbiodiversity framework, and urges them to consider initiatives, including through the \nUnited Nations Environment Management Group, in support of the summit and its \npreparation, particularly with regard to sharing relevant good practices, challenges \nand lessons learned; \n \n10. Encourages participation in the summit at the highest possible level and \nthe inclusion in delegations of representatives of parliamentary institutions, local \ngovernments, civil society, including non-governmental organizations, indigenous \npeoples and local communities, community organizations, faith-based organizations, \nacademia, philanthropic foundations, youth and the private sector, with due regard to \ngender balance; \n \n11. Encourages all participants to demonstrate ambition to accelerate action \non biodiversity for sustainable development; \n \n12. Decides that the proceedings of the summit shall be webcasted, and \nencourages the President of the General Assembly, the Secretary-General and all \nrelevant United Nations entities to give the highest visibility to the summit, including \nduring its preparation, through all relevant media platforms and information and \ncommunications technologies; \n \n13. Requests the President of the General Assembly to prepare, before the \nopening of the fifteenth meeting of the Conference of the Parties to the Convention \non Biological Diversity, a factual summary to reflect the discussions of the summit \nheld to highlight the urgency of action at the highest levels in support of a post-2020 \nglobal biodiversity framework that contributes to the 2030 Agenda for Sustainable \nDevelopment1 and places the global community on a path towards realizing the 2050 \nVision for Biodiversity, \u201cLiving in harmony with nature\u201d; \n \n14. Also requests the President of the General Assembly to bring the summary \nof the summit to the attention of all participants, as well as all relevant United Nations \n__________________ \n \n3  The list of proposed as well as final names will be brought to the attention of the General \nAssembly. Where a name is objected to, the objecting Member State will, on a voluntary basis, \nmake known to the Office of the President of the General Assembly the general basis of its \nobjections and the Office will share any information received with any Member State upon its \nrequest. \n\nA/RES/74/269 \n \n20-04976\n4/4 \n \nentities, the secretariats of the Rio and biodiversity-related conventions and all other \nrelevant stakeholders; \n \n15. Further requests the President of the General Assembly, in consultation \nwith Member States, to finalize the organizational arrangements for the summit. \n \n31 March 2020 \n \n",
  "paragraphs": {
    "1": "Decides that the summit on biodiversity at the level of Heads of State and Government to be convened by the President of the General Assembly shall be held at United Nations Headquarters in New York on the first day of the general debate of the Assembly at its seventy-fifth session, from 3 to 6 p.m., and on the second day of the general debate, from 10 a.m. to 1 p.m.;",
    "2": "Also decides that the summit and its preparatory process shall provide for the effective participation of all States Members of the United Nations, all members of the specialized agencies and all parties to the Convention on Biological Diversity; 2",
    "3": "Further decides that the summit will consist of an opening segment, a plenary segment for general discussion, two leaders dialogues and a brief closing segment and that the overall theme of the summit will be \u201cUrgent action on biodiversity for sustainable development\u201d;",
    "4": "Decides that: (a) The opening segment, to be held from 3 to 3.50 p.m. on the first day of the general debate, will include the President of the General Assembly at its seventy-fifth session, the Secretary-General, the President of the Economic and Social Council, the host of the fourteenth meeting of the Conference of the Parties to the Convention on Biological Diversity, the host of the fifteenth meeting of the Conference of the Parties to the Convention on Biological Diversity, the Executive Director of the United Nations Environment Programme, the Executive Secretary of the Secretariat for the Convention on Biological Diversity and the Chair of the Intergovernmental Science- Policy Platform on Biodiversity and Ecosystem Services, as well as an eminent champion of biodiversity and a youth leader, one of whom should be a representative of indigenous peoples and local communities, both to be selected, in consultation with Member States, by the President of the General Assembly; (b) The plenary segment will start at the end of the opening segment and end at 6 p.m. on the first day of the general debate and will comprise statements by States Members of the United Nations, members of the specialized agencies, parties to the Convention on Biological Diversity and observers of the General Assembly and the time limits for these statements, strictly observed, will be three minutes for individual delegations and five minutes for statements made on behalf of a group of States; (c) Delegations will have only one opportunity to speak in the summit, either in the plenary segment or in one of the leaders dialogues; (d) The closing segment, to be held after the conclusion of the leaders dialogues on the second day of the general debate, will comprise key messages from the leaders dialogues and concluding remarks by the President of the General Assembly;",
    "5": " biodiversity-related conventions, civil society, the private sector, including the financial sector, academia, youth, indigenous peoples and local communities to serve as speakers in the leaders dialogues, taking into account gender balance, level of development and geographical representation;",
    "6": "Invites all observers of the General Assembly to participate in the summit at the highest possible level;",
    "7": "Invites non-governmental organizations in consultative status with the Economic and Social Council with relevant expertise to register with the Secretariat to attend the summit;",
    "8": "Requests the President of the General Assembly to draw up a list of other relevant representatives of relevant non-governmental organizations, civil society organizations, academic institutions, indigenous peoples and local communities, youth and the private sector who may attend the summit, taking into account the principles of transparency and equitable gender and geographical representation, and to submit the list to Member States for their consideration on a non-objection basis;3",
    "9": "Invites the United Nations system, including the funds, programmes and specialized agencies, regional commissions and relevant envoys of the Secretary- General and the secretariats of the biodiversity-related conventions, to participate in the summit, as appropriate, to highlight the need to support a post-2020 global biodiversity framework, and urges them to consider initiatives, including through the United Nations Environment Management Group, in support of the summit and its preparation, particularly with regard to sharing relevant good practices, challenges and lessons learned;",
    "10": "Encourages participation in the summit at the highest possible level and the inclusion in delegations of representatives of parliamentary institutions, local governments, civil society, including non-governmental organizations, indigenous peoples and local communities, community organizations, faith-based organizations, academia, philanthropic foundations, youth and the private sector, with due regard to gender balance;",
    "11": "Encourages all participants to demonstrate ambition to accelerate action on biodiversity for sustainable development;",
    "12": "Decides that the proceedings of the summit shall be webcasted, and encourages the President of the General Assembly, the Secretary-General and all relevant United Nations entities to give the highest visibility to the summit, including during its preparation, through all relevant media platforms and information and communications technologies;",
    "13": "Requests the President of the General Assembly to prepare, before the opening of the fifteenth meeting of the Conference of the Parties to the Convention on Biological Diversity, a factual summary to reflect the discussions of the summit held to highlight the urgency of action at the highest levels in support of a post-2020 global biodiversity framework that contributes to the 2030 Agenda for Sustainable Development1 and places the global community on a path towards realizing the 2050 Vision for Biodiversity, \u201cLiving in harmony with nature\u201d;",
    "14": "Also requests the President of the General Assembly to bring the summary of the summit to the attention of all participants, as well as all relevant United Nations entities, the secretariats of the Rio and biodiversity-related conventions and all other relevant stakeholders;",
    "15": "Further requests the President of the General Assembly, in consultation with Member States, to finalize the organizational arrangements for the summit. 31 March 2020"
  },
  "agenda_items": [
    "Item 19"
  ],
  "symbol_references": [
    "A/74/L.49"
  ]
}