{
  "symbol": "A/RES/78/261",
  "filename": "A_RES_78_261.pdf",
  "title": "78/261. \u201cWorld Social Summit\u201d under the title \u201cSecond World Summit for Social Development\u201d",
  "text": "United Nations \nA/RES/78/261\n \n \nGeneral Assembly \nDistr.: General \n6 March 2024 \n \n24-04405 (E)    110324 \n*2404405* \n \n \nSeventy-eighth session \nAgenda item 24 (b) \nSocial development: social development, including \nquestions relating to the world social situation and to \nyouth, ageing, persons with disabilities and the family \n \n \n \n \n Resolution adopted by the General Assembly \non 26 February 2024 \n \n \n \n \n[without reference to a Main Committee (A/78/L.39)] \n \n \n 78/261. \u201cWorld Social Summit\u201d under the title \u201cSecond World Summit for \nSocial Development\u201d \n \n \n \nThe General Assembly,  \n \nRecalling the World Summit for Social Development, held in Copenhagen from \n6 to 12 March 1995, and the twenty-fourth special session of the General Assembly, \nentitled \u201cWorld Summit for Social Development and beyond: achieving social \ndevelopment for all in a globalizing world\u201d, held in Geneva from 26 June to 1 July 2000,  \n \nReaffirming that the Copenhagen Declaration on Social Development and the \nProgramme of Action of the World Summit for Social Development1 and the further \ninitiatives for social development adopted by the General Assembly at its twenty-\nfourth special session,2 as well as a continued global dialogue on social development \nissues, constitute the basic framework for the promotion of social development for all \nat the national and international levels, \n \nReaffirming also all previous resolutions on the implementation of the outcome \nof the World Summit for Social Development and of the twenty-fourth special session \nof the General Assembly, including resolution 78/174 of 19 December 2023, \n \nWelcoming the progress made towards the full implementation of the \nCopenhagen Declaration and the Programme of Action through concerted action at \nthe national, regional and international levels, and expressing its deep concern that \nmore than 25 years after the convening of the World Summit for Social Development, \nprogress has been slow and uneven, and major gaps remain, and recognizing the three \ncore themes of social development, namely, poverty eradication, full and productive \nemployment and decent work for all and social integration, are interrelated and \n__________________ \n \n1  Report of the World Summit for Social Development, Copenhagen, 6\u201312 March 1995 (United \nNations publication, Sales No. E.96.IV.8), chap. I, resolution 1, annexes I and II. \n \n2  Resolution S-24/2, annex. \n\nA/RES/78/261 \n\u201cWorld Social Summit\u201d under the title\u201cSecond World\nSummit for Social Development\u201d\n \n24-04405\n2/2 \n \nmutually reinforcing, and that an enabling environment therefore needs to be created \nso that all three objectives can be pursued simultaneously, \n \nRecalling General Assembly resolution 70/1 of 25 September 2015, entitled \n\u201cTransforming our world: the 2030 Agenda for Sustainable Development\u201d, in which \nthe Assembly adopted a comprehensive, far-reaching and people-centred set of \nuniversal and transformative Sustainable Development Goals and targets and \naffirmed its commitment to working tirelessly for the full implementation of the \nAgenda by 2030 with a view to leaving no one behind and reaching the furthest behind \nfirst, and its recognition that eradicating poverty in all its forms and dimensions, \nincluding extreme poverty, is the greatest global challenge and an indispensable \nrequirement for sustainable development,  \n \nRecalling also its resolution 76/6 of 15 November 2021, entitled \u201cFollow-up to \nthe report of the Secretary-General entitled \u2018Our Common Agenda\u20193 and noting the \nproposal contained in that report to convene a world social summit in 2025, to be \ndiscussed and agreed upon by Member States, including its modalities, title, \nobjectives, scope and possible outcomes, and emphasizing that the possible summit\u2019s \noutcome should have a social development approach including the need to place \npeople at the centre of development and the pledge to make poverty eradication, full \nemployment and social integration the overriding development objectives, and give \nmomentum towards the implementation of the 2030 Agenda, \n \nRecalling further the Political Declaration adopted at the High-Level Political \nForum on Sustainable Development convened under the auspices of the General \nAssembly4 last September, where Heads of State and Government agreed to look \nforward to the proposed World Social Summit in 2025, subject to discussion and \nagreement by the General Assembly on its modalities, and emphasized that the \npossible summit outcome should have a social development approach and give \nmomentum towards the implementation of the 2030 Agenda, \n \n1. \nDecides to convene the \u201cWorld Social Summit\u201d in 2025, under the title \n\u201cthe Second World Summit for Social Development\u201d, to address the gaps and \nrecommit to the Copenhagen Declaration on Social Development and the Programme \nof Action and its implementation and give momentum towards the implementation of \nthe 2030 Agenda; \n \n2. \nRequests that the President of the General Assembly, consistent with the \nrules of the General Assembly, appoint two co-facilitators, one from a developing \ncountry and one from a developed country, to facilitate the intergovernmental \npreparatory process leading up to the Summit consisting of its modalities and \noutcome, which should be a short and concise political declaration adopted by \nconsensus, and should have a social development approach and give momentum \ntowards the implementation of the 2030 Agenda; \n \n3. \nAlso requests the Secretary-General to provide adequate support within \nexisting resources to the intergovernmental preparatory process of the Summit. \n \n57th plenary meeting \n26 February 2024 \n \n__________________ \n \n3  A/75/982. \n \n4  Resolution 78/1, annex. \n",
  "paragraphs": {
    "1": "Decides to convene the \u201cWorld Social Summit\u201d in 2025, under the title \u201cthe Second World Summit for Social Development\u201d, to address the gaps and recommit to the Copenhagen Declaration on Social Development and the Programme of Action and its implementation and give momentum towards the implementation of the 2030 Agenda;",
    "2": "Requests that the President of the General Assembly, consistent with the rules of the General Assembly, appoint two co-facilitators, one from a developing country and one from a developed country, to facilitate the intergovernmental preparatory process leading up to the Summit consisting of its modalities and outcome, which should be a short and concise political declaration adopted by consensus, and should have a social development approach and give momentum towards the implementation of the 2030 Agenda;",
    "3": "Also requests the Secretary-General to provide adequate support within existing resources to the intergovernmental preparatory process of the Summit."
  },
  "agenda_items": [
    "Item 24"
  ],
  "symbol_references": [
    "A/78/L.39"
  ]
}