{
  "symbol": "A/RES/77/43",
  "filename": "A_RES_77_43.pdf",
  "title": "77/43. Role of science and technology in the context of international security and disarmament",
  "text": "United Nations \nA/RES/77/43 \n \n \nGeneral Assembly \nDistr.: General \n12 December 2022 \n \n22-28138 (E)    151222     \n*2228138* \n \n \nSeventy-seventh session \nAgenda item 98 \nRole of science and technology in the context of international \nsecurity and disarmament \n \n \n \nResolution adopted by the General Assembly on \n7 December 2022 \n \n \n[on the report of the First Committee (A/77/384, para. 7)] \n \n \n \n77/43. Role of science and technology in the context of international \nsecurity and disarmament \n \n \n \nThe General Assembly, \n \nRecognizing that scientific and technological developments can have both \ncivilian and military applications and that progress in science and technology for \ncivilian applications needs to be maintained and encouraged, \n \nUnderlining the keen interest of the international community to keep abreast of \nthe latest developments in science and technology of relevance to international \nsecurity and disarmament and to channel scientific and technological developments \nfor beneficial purposes, \n \nMindful of the need to regulate the transfer of technologies for peaceful uses, in \naccordance with relevant international obligations, to address the risk of proliferation \nby States or non-State actors, \n \nAcknowledging the need to continue the exchange of technologies for peaceful \nuses, including in accordance with relevant international obligations, \n \nMindful of the rights of States, reflected in relevant international agreements, \nregarding the development, production, transfer and use of technologies for peaceful \npurposes, in accordance with relevant international obligations, as well as the need \nfor all Member States to fulfil their obligations in relation to arms control and \ndisarmament and to prevent proliferation in all its aspects of all weapons of mass \ndestruction and their means of delivery, \n \nCognizant of the discussions on developments in science and technology at the \nInternational Atomic Energy Agency and the Organisation for the Prohibition of \nChemical Weapons and within the meetings of experts on science and technology \nunder the 2018\u20132020 intersessional programme established by the 2017 Meeting of \n\nA/RES/77/43 \nRole of science and technology in the context of international \nsecurity and disarmament\n \n22-28138\n2/3 \n \nthe States Parties to the Convention on the Prohibition of the Development, \nProduction and Stockpiling of Bacteriological (Biological) and Toxin Weapons and \non Their Destruction, \n \nCognizant also of the discussions in the Conference on Disarmament in 2022 \nunder its subsidiary body 5, \n \nMindful of the discussions in other forums, such as the Committee on the \nPeaceful Uses of Outer Space, on the long-term sustainability of outer space activities \nand on the prevention of an arms race in outer space in the United Nations \ndisarmament machinery, \n \nNoting the discussions on various dimensions of emerging technologies under \nthe framework of the Convention on Prohibitions or Restrictions on the Use of Certain \nConventional Weapons Which May Be Deemed to Be Excessively Injurious or to \nHave Indiscriminate Effects,1 and recalling the discussions and progress made by the \nGroup of Governmental Experts on lethal autonomous weapons systems during its \nsessions held from 2018 to 2022, \n \nNoting also the discussions within the United Nations and the specialized \nagencies on developments in the field of information and communications \ntechnologies, including in the context of international security, \n \nAcknowledging that the accelerating pace of technological change necessitates \na system-wide assessment of the potential impact of developments in science and \ntechnology on international security and disarmament, with due regard to avoiding \nduplication and complementing efforts already under way in United Nations entities \nand in the framework of the relevant international conventions, \n \nNoting the discussions on current developments in science and technology and \ntheir potential impact on international security and disarmament efforts in the \nAdvisory Board on Disarmament Matters, \n \n1. \nInvites Member States to continue efforts to apply developments in science \nand technology for disarmament-related purposes, including the verification of \ndisarmament, arms control and non-proliferation instruments, and to make \ndisarmament-related technologies available to interested States; \n \n2. \nCalls upon Member States to remain vigilant in understanding new and \nemerging developments in science and technology that could imperil international \nsecurity, and underlines the importance of Member States engaging with experts from \nindustry, the research community and civil society in addressing this challenge; \n \n3. \nTakes note of the updated report of the Secretary-General on current \ndevelopments in science and technology and their potential impact on international \nsecurity and disarmament efforts;2 \n \n4. \nRequests the Secretary-General to submit to the General Assembly at its \nseventy-eighth session an updated report on the matter; \n \n5. \nEncourages the Advisory Board on Disarmament Matters to continue its \ndiscussions on current developments in science and technology and their potential \nimpact on international security and disarmament efforts; \n \n6. \nEncourages Member States to organize events such as conferences, \nseminars, workshops and exhibitions, at the national, regional and international \nlevels, on the role of science and technology in the context of international security \nand disarmament, in order to facilitate multilateral dialogue, as well as dialogue \n__________________ \n \n1  United Nations, Treaty Series, vol. 1342, No. 22495. \n \n2  A/77/188. \n\nRole of science and technology in the context of international \nsecurity and disarmament \nA/RES/77/43\n \n3/3\n22-28138 \n \namong relevant stakeholders, on current developments in science and technology and \ntheir potential impact on international security and disarmament efforts; \n \n7. \nDecides to include in the provisional agenda of its seventy-eighth session \nthe item entitled \u201cRole of science and technology in the context of international \nsecurity and disarmament\u201d. \n \n46th plenary meeting \n7 December 2022 \n \n",
  "paragraphs": {
    "1": "Invites Member States to continue efforts to apply developments in science and technology for disarmament-related purposes, including the verification of disarmament, arms control and non-proliferation instruments, and to make disarmament-related technologies available to interested States;",
    "2": "Calls upon Member States to remain vigilant in understanding new and emerging developments in science and technology that could imperil international security, and underlines the importance of Member States engaging with experts from industry, the research community and civil society in addressing this challenge;",
    "3": "Takes note of the updated report of the Secretary-General on current developments in science and technology and their potential impact on international security and disarmament efforts;2",
    "4": "Requests the Secretary-General to submit to the General Assembly at its seventy-eighth session an updated report on the matter;",
    "5": "Encourages the Advisory Board on Disarmament Matters to continue its discussions on current developments in science and technology and their potential impact on international security and disarmament efforts;",
    "6": "Encourages Member States to organize events such as conferences, seminars, workshops and exhibitions, at the national, regional and international levels, on the role of science and technology in the context of international security and disarmament, in order to facilitate multilateral dialogue, as well as dialogue among relevant stakeholders, on current developments in science and technology and their potential impact on international security and disarmament efforts;",
    "7": "Decides to include in the provisional agenda of its seventy-eighth session the item entitled \u201cRole of science and technology in the context of international security and disarmament\u201d."
  },
  "agenda_items": [
    "Item 98"
  ],
  "symbol_references": []
}