{
  "symbol": "A/RES/72/53",
  "filename": "A_RES_72_53.pdf",
  "title": "72/53. Implementation of the Convention on the Prohibition of the Use, Stockpiling, Production and Transfer of Anti-Personnel Mines and on Their Destruction",
  "text": "United Nations \nA/RES/72/53\n \n \nGeneral Assembly \nDistr.: General \n12 December 2017 \n \n17-21737 (E)    141217 \n*1721737* \n \n \nSeventy-second session \nAgenda item 99 (m) \n \n \n \n \n Resolution adopted by the General Assembly \non 4 December 2017 \n \n \n \n \n[on the report of the First Committee (A/72/409)] \n \n \n \n72/53. Implementation of the Convention on the Prohibition of the Use, \nStockpiling, Production and Transfer of Anti-Personnel Mines \nand on Their Destruction \n \n \n \nThe General Assembly,  \n \nRecalling its resolutions 54/54 B of 1 December 1999, 55/33 V of \n20 November 2000, 56/24 M of 29 November 2001, 57/74 of 22 November 2002, \n58/53 of 8 December 2003, 59/84 of 3 December 2004, 60/80 of 8 December 2005, \n61/84 of 6 December 2006, 62/41 of 5 December 2007, 63/42 of 2 December 2008, \n64/56 of 2 December 2009, 65/48 of 8 December 2010, 66/29 of 2 December 2011, \n67/32 of 3 December 2012, 68/30 of 5 December 2013, 69/34 of 2 December 2014, \n70/55 of 7 December 2015 and 71/34 of 5 December 2016,  \n \nReaffirming its determination to put an end to the suffering and casualties \ncaused by anti-personnel mines, which kill or injure thousands of people \u2013 women, \ngirls, boys and men \u2013 every year, and which place people living in affected areas at \nrisk and hinder the development of their communities, \n \nBelieving it necessary to do the utmost to contribute in an efficient and \ncoordinated manner to facing the challenge of removing anti-personnel mines \nplaced throughout the world and to assure their destruction, \n \nWishing to do the utmost to ensure assistance for the care and rehabilitation, \nincluding the social and economic reintegration, of mine victims, \n \nNoting with satisfaction the work undertaken to implement the Convention on \nthe Prohibition of the Use, Stockpiling, Production and Transfer of Anti-Personnel \nMines and on Their Destruction1 and the substantial progress made towards \naddressing the global anti-personnel landmine problem, \n__________________ \n \n1  United Nations, Treaty Series, vol. 2056, No. 35597. \n\nA/RES/72/53 \nImplementation of the Convention on the Prohibition of the Use, Stockpiling, \nProduction and Transfer of Anti-Personnel Mines and on Their Destruction\n \n17-21737 \n2/3 \n \n \nRecalling the first to fifteenth meetings of the States parties to the Convention, \nheld in Maputo (1999), Geneva (2000), Managua (2001), Geneva (2002), Bangkok \n(2003), Zagreb (2005), Geneva (2006), the Dead Sea (2007), Geneva (2008 and \n2010), Phnom Penh (2011), Geneva (2012, 2013 and 2015) and Santiago (2016), \nand the First, Second and Third Review Conferences of the States Parties to the \nConvention, held in Nairobi (2004), Cartagena, Colombia (2009), and Maputo (2014), \n \nRecalling also that, at the Third Review Conference of the States Parties to the \nConvention, the international community reviewed the implementation of the \nConvention and the States parties adopted a declaration and an action plan for the \nperiod 2014\u20132019 to support enhanced implementation and promotion of the \nConvention,  \n \nUnderlining \nthe \nimportance \nof \ncooperation \nand \nassistance \nin \nthe \nimplementation of the Convention, including through the so-called individualized \napproach, which offers mine-affected countries a platform for presenting their \nchallenges, \n \nNoting with satisfaction that 162 States have ratified or acceded to the \nConvention and have formally accepted the obligations of the Convention, \n \nEmphasizing the desirability of attracting the adherence of all States to the \nConvention, and determined to work strenuously towards the promotion of its \nuniversalization and norms, \n \nNoting with regret that anti-personnel mines continue to be used in some \nconflicts around the world, causing human suffering and impeding post-conflict \ndevelopment, \n \n1. \nInvites all States that have not signed the Convention on the Prohibition \nof the Use, Stockpiling, Production and Transfer of Anti-Personnel Mines and on \nTheir Destruction1 to accede to it without delay; \n \n2. \nUrges the one remaining State that has signed but has not ratified the \nConvention to ratify it without delay; \n \n3. \nStresses the importance of the full and effective implementation of and \ncompliance with the Convention, including through the continued implementation \nof the action plan for the period 2014\u20132019; \n \n4. \nExpresses strong concern regarding the use of anti-personnel mines in \nvarious parts of the world, including use highlighted in recent allegations, reports \nand documented evidence;  \n \n5. \nUrges all States parties to provide the Secretary-General with complete \nand timely information as required under article 7 of the Convention in order to \npromote transparency and compliance with the Convention; \n \n6. \nInvites all States that have not ratified the Convention or acceded to it to \nprovide, on a voluntary basis, information to make global mine action efforts more \neffective; \n \n7. \nRenews its call upon all States and other relevant parties to work together \nto promote, support and advance the care, rehabilitation and social and economic \nreintegration of mine victims, mine risk education programmes and the removal and \ndestruction of anti-personnel mines placed or stockpiled throughout the world; \n \n8. \nUrges all States to remain seized of the issue at the highest political level \nand, where in a position to do so, to promote adherence to the Convention through \nbilateral, subregional, regional and multilateral contacts, outreach, seminars and \nother means; \n\nImplementation of the Convention on the Prohibition of the Use, Stockpiling, \nProduction and Transfer of Anti-Personnel Mines and on Their Destruction \nA/RES/72/53\n \n3/3 \n17-21737 \n \n \n9. \nReiterates its invitation and encouragement to all interested States, the \nUnited Nations, other relevant international organizations or institutions, regional \norganizations, the International Committee of the Red Cross and relevant \nnon-governmental organizations to attend the Sixteenth Meeting of the States \nParties to the Convention, to be held in Vienna from 18 to 21 December 2017, and \nto participate in the future programme of meetings of the States parties to the \nConvention; \n \n10. Requests the Secretary-General, in accordance with article 11, paragraph 1, \nof the Convention, to undertake the preparations necessary to convene the \nSeventeenth Meeting of the States Parties to the Convention and, on behalf of the \nStates parties and in accordance with article 11, paragraph 4, of the Convention, to \ninvite States not parties to the Convention, as well as the United Nations, other \nrelevant international organizations or institutions, regional organizations, the \nInternational Committee of the Red Cross and relevant non-governmental \norganizations, to attend the Seventeenth Meeting of the States Parties as observers;  \n \n11. \nCalls upon States parties and participating States to address issues \narising from outstanding dues and from recently implemented United Nations \nfinancial and accounting practices;  \n \n12. Decides to include in the provisional agenda of its seventy-third session, \nunder the item entitled \u201cGeneral and complete disarmament\u201d, the sub-item entitled \n\u201cImplementation of the Convention on the Prohibition of the Use, Stockpiling, \nProduction and Transfer of Anti-Personnel Mines and on Their Destruction\u201d. \n \n62nd plenary meeting  \n4 December 2017 \n \n",
  "paragraphs": {
    "1": "Invites all States that have not signed the Convention on the Prohibition of the Use, Stockpiling, Production and Transfer of Anti-Personnel Mines and on Their Destruction1 to accede to it without delay;",
    "2": "Urges the one remaining State that has signed but has not ratified the Convention to ratify it without delay;",
    "3": "Stresses the importance of the full and effective implementation of and compliance with the Convention, including through the continued implementation of the action plan for the period 2014\u20132019;",
    "4": "Expresses strong concern regarding the use of anti-personnel mines in various parts of the world, including use highlighted in recent allegations, reports and documented evidence;",
    "5": "Urges all States parties to provide the Secretary-General with complete and timely information as required under article 7 of the Convention in order to promote transparency and compliance with the Convention;",
    "6": "Invites all States that have not ratified the Convention or acceded to it to provide, on a voluntary basis, information to make global mine action efforts more effective;",
    "7": "Renews its call upon all States and other relevant parties to work together to promote, support and advance the care, rehabilitation and social and economic reintegration of mine victims, mine risk education programmes and the removal and destruction of anti-personnel mines placed or stockpiled throughout the world;",
    "8": "",
    "9": "Reiterates its invitation and encouragement to all interested States, the United Nations, other relevant international organizations or institutions, regional organizations, the International Committee of the Red Cross and relevant non-governmental organizations to attend the Sixteenth Meeting of the States Parties to the Convention, to be held in Vienna from 18 to 21 December 2017, and to participate in the future programme of meetings of the States parties to the Convention;",
    "10": "Requests the Secretary-General, in accordance with article 11, paragraph 1, of the Convention, to undertake the preparations necessary to convene the Seventeenth Meeting of the States Parties to the Convention and, on behalf of the States parties and in accordance with article 11, paragraph 4, of the Convention, to invite States not parties to the Convention, as well as the United Nations, other relevant international organizations or institutions, regional organizations, the International Committee of the Red Cross and relevant non-governmental organizations, to attend the Seventeenth Meeting of the States Parties as observers;",
    "11": "Calls upon States parties and participating States to address issues arising from outstanding dues and from recently implemented United Nations financial and accounting practices;",
    "12": "Decides to include in the provisional agenda of its seventy-third session, under the item entitled \u201cGeneral and complete disarmament\u201d, the sub-item entitled \u201cImplementation of the Convention on the Prohibition of the Use, Stockpiling, Production and Transfer of Anti-Personnel Mines and on Their Destruction\u201d."
  },
  "agenda_items": [
    "Item 99"
  ],
  "symbol_references": []
}