{
  "symbol": "A/RES/80/169",
  "filename": "A_RES_80_169.pdf",
  "title": "80/169. United Nations Conference of Plenipotentiaries on Protection of Persons in the Event of Disasters",
  "text": "United Nations \nA/RES/80/169\n \nGeneral Assembly \nDistr.: General \n19 December 2025 \n25-20869 (E) \n*2520869* \n \n \nEightieth session \nAgenda item 86 \nProtection of persons in the event of disasters \n \n \n \n \n Resolution adopted by the General Assembly \non 15 December 2025 \n \n \n[on the report of the Sixth Committee (A/80/456, para. 10)] \n \n \n 80/169. United Nations Conference of Plenipotentiaries on Protection of \nPersons in the Event of Disasters \n \n \n \nThe General Assembly, \n \nHaving considered chapter IV of the report of the International Law \nCommission on the work of its sixty-eighth session,1 which contains the draft articles \non protection of persons in the event of disasters, \n \nRecalling that the International Law Commission decided to recommend the \nelaboration of a convention on the basis of the draft articles on the protection of \npersons in the event of disasters,2 \n \nReaffirming the purposes and principles enshrined in the Charter of the United \nNations, \n \nRecalling the Declaration of Principles of International Law concerning \nFriendly Relations and Cooperation among States in accordance with the Charter of \nthe United Nations, of 1970,3 \n \nEmphasizing the continuing importance of the codification and progressive \ndevelopment of international law, as referred to in Article 13, paragraph 1 (a), of the \nCharter, \n \nRecalling its resolutions 71/141 of 13 December 2016, 73/209 of 20 December \n2018, 76/119 of 9 December 2021 and 79/128 of 4 December 2024, as well as its \ndecisions 75/526 of 15 December 2020 and 78/516 of 7 December 2023, \n \nRecalling also the number of suggestions for improvements to the draft articles \nmade by States, including during the deliberations in the working group on protection \n_______________ \n \n1 Official Records of the General Assembly, Seventy-first Session, Supplement No. 10 (A/71/10). \n \n2 Ibid., chap. IV, sect. E.1. \n \n3 Resolution 2625 (XXV), annex. \n\nA/RES/80/169 \nUnited Nations Conference of Plenipotentiaries on Protection of \nPersons in the Event of Disasters\n \n25-20869\n2/4 \n \nof persons in the event of disasters at the seventy-eighth and seventy-ninth sessions \nof the General Assembly, \n \nNoting with concern the increasing number of disasters in the world, as well as \ntheir intensity and impact on affected populations,  \n \nStressing once again the need for a comprehensive global legal regime to better \naddress the protection of persons in the event of disasters, and having considered the \nfeasibility of developing an international convention, \n \nRecalling that, in its resolution 79/128, it decided to elaborate and conclude a \nlegally binding instrument on the protection of persons in the event of disasters, \nwithout prejudice to the legal effects of any particular provisions contained therein, \nby the end of 2027 at the latest, at the dates and location and in accordance with the \nmodalities to be determined by the General Assembly at its eightieth session, \n \nRecalling also, in this regard, that the Government of the Philippines has \nexpressed its interest in hosting a United Nations conference of plenipotentiaries on \nprotection of persons in the event of disasters, \n \n1. \nDecides to convene the United Nations Conference of Plenipotentiaries on \nProtection of Persons in the Event of Disasters, to meet for three weeks from \n25 January to 12 February 2027 in Manila, and, if necessary, for a further two weeks \nin August 2027, to elaborate and conclude a legally binding instrument on the \nprotection of persons in the event of disasters, without prejudice to the legal effects \nof any particular provisions contained therein; \n \n2. \nAlso decides to convene a preparatory committee for the Conference, to \nmeet from 31 August to 4 September 2026, to refer the consolidated text including \nthe draft articles and the proposals submitted by Governments, prepared at the \nresumed session of the Sixth Committee held in accordance with resolution 79/128, \nto the Conference, to decide on the question of the participation of stakeholders other \nthan those referred to in paragraph 9, based on a list prepared by the Secretariat, with \ndue regard to the principles of transparency and equitable geographical \nrepresentation, and whose work is relevant to the Conference, and to discuss the \norganization and methods of work of the Conference, including the rules of procedure, \nwith a view to making recommendations thereon to the Conference, taking into \naccount the importance of promoting consensus in the Preparatory Committee and on \nthe final results of the work of the Conference, requests the Secretary-General to \nprepare proposals and to bring the proposals and the list referred to above to the \nattention of Member States well in advance for their consideration and to the \nPreparatory Committee, and decides that, upon completion of its mandate, the \nPreparatory Committee shall report directly to the Conference; \n \n3. \nRefers the consolidated text to the Conference for its consideration, \ntogether with the commentaries to the draft articles prepared by the International Law \nCommission, as well as the written comments and observations of Governments, all \nthe views expressed in the debates of the Sixth Committee on this topic, while noting \nthe report of the working group of the Sixth Committee convened at the seventy-\nseventh and seventy-eighth sessions, and the recommendation of the Commission;  \n \n4. \nDecides that the rules of procedure of the General Assembly shall apply \nprovisionally to the procedure of the Conference until otherwise agreed by the \nConference;  \n \n5. \nAlso decides that the Conference shall exhaust every effort in good faith \nto reach agreement on substantive matters by consensus;  \n\nUnited Nations Conference of Plenipotentiaries on Protection of \nPersons in the Event of Disasters \nA/RES/80/169\n \n3/4\n25-20869 \n \n \n6. \nFurther decides that the Conference will be undertaken in an open and \ntransparent manner, with a view to promoting universal adherence, and emphasizes \nthe need to ensure the widest possible and effective participation, including, in \nparticular, of developing countries, in the Conference;  \n \n7. \nDecides that the Conference and the Preparatory Committee shall be open \nto all States Members of the United Nations and members of the specialized agencies, \nand requests the Secretary-General to invite those States to participate in the \nConference;  \n \n8. \nAlso decides that the Conference and the Preparatory Committee shall be \nopen to observers having received a standing invitation to participate in the sessions \nand the work of the General Assembly, on the understanding that they shall participate \nin the Conference and the Preparatory Committee in accordance with the rights and \nprivileges conferred upon them by the Assembly, and requests the Secretary-General \nto invite them to the Conference, as well as to invite, as observers to the Conference, \nrepresentatives of interested regional intergovernmental organizations and other \ninterested international bodies;  \n \n9. \nFurther decides that attendance at the Preparatory Committee and the \nConference as observers will also be opened to relevant non\u2011governmental \norganizations in consultative status with the Economic and Social Council in \naccordance with the provisions of Council resolution 1996/31 of 25 July 1996, on the \nunderstanding that their participation means attending formal meetings, receiving \ncopies of the official documents, making their materials available to delegates and \naddressing the meetings, through a limited number of their representatives, as \nappropriate;  \n \n10. Invites the States referred to in paragraph 7 above to include as far as \npossible among their representatives experts competent in the field to be considered;  \n \n11. \nRequests the Secretary-General to arrange for the attendance at the \nConference, as an expert, of the Special Rapporteur of the International Law \nCommission on the protection of persons in the event of disasters;  \n \n12. Also requests the Secretary-General to appoint a Secretary-General of the \nConference to serve as focal point within the Secretariat for providing support to the \norganization of the Conference;  \n \n13. Further requests the Secretary-General to provide the Conference and the \nPreparatory Committee with the necessary assistance for the performance of their \nwork, including secretariat services and the provision of essential background \ninformation and relevant documents, including summary records and United Nations \nmedia coverage, and to arrange for support to be provided by the Codification \nDivision of the Office of Legal Affairs of the Secretariat;  \n \n14. Recognizes the importance of ensuring the availability of adequate \nresources to ensure the widest possible and effective participation in the Conference, \nand, accordingly, invites Member States, international financial institutions, donor \nagencies, intergovernmental organizations, non\u2011governmental organizations and \nnatural and juridical persons to make earmarked financial contributions to the trust \nfund established by the Secretary-General for the Office of Legal Affairs to support \nthe promotion of international law, and authorizes the Secretary-General to disburse \nfunds from such contributions to that trust fund for the purposes of assisting \ndeveloping countries, in particular the least developed countries and small island \ndeveloping States, in attending the Conference, through the provision of daily \nsubsistence allowance in addition to defraying the costs of economy-class travel, \n\nA/RES/80/169 \nUnited Nations Conference of Plenipotentiaries on Protection of \nPersons in the Event of Disasters\n \n25-20869\n4/4 \n \nwhile limiting requests for assistance from the trust fund to one delegate per State for \neach session of the Conference;  \n \n15. Decides that the Sixth Committee shall resume its session from 6 to \n10 April 2026, within the framework of a working group of the Committee, in \naccordance with resolution 79/128; \n \n16. Also decides to include in the provisional agenda of its eighty-first session \nan item entitled \u201cUnited Nations Conference of Plenipotentiaries on Protection of \nPersons in the Event of Disasters\u201d. \n \n64th plenary meeting \n15 December 2025 \n \n",
  "paragraphs": {
    "1": "Decides to convene the United Nations Conference of Plenipotentiaries on Protection of Persons in the Event of Disasters, to meet for three weeks from 25 January to 12 February 2027 in Manila, and, if necessary, for a further two weeks in August 2027, to elaborate and conclude a legally binding instrument on the protection of persons in the event of disasters, without prejudice to the legal effects of any particular provisions contained therein;",
    "2": "Also decides to convene a preparatory committee for the Conference, to meet from 31 August to 4 September 2026, to refer the consolidated text including the draft articles and the proposals submitted by Governments, prepared at the resumed session of the Sixth Committee held in accordance with resolution 79/128, to the Conference, to decide on the question of the participation of stakeholders other than those referred to in paragraph 9, based on a list prepared by the Secretariat, with due regard to the principles of transparency and equitable geographical representation, and whose work is relevant to the Conference, and to discuss the organization and methods of work of the Conference, including the rules of procedure, with a view to making recommendations thereon to the Conference, taking into account the importance of promoting consensus in the Preparatory Committee and on the final results of the work of the Conference, requests the Secretary-General to prepare proposals and to bring the proposals and the list referred to above to the attention of Member States well in advance for their consideration and to the Preparatory Committee, and decides that, upon completion of its mandate, the Preparatory Committee shall report directly to the Conference;",
    "3": "Refers the consolidated text to the Conference for its consideration, together with the commentaries to the draft articles prepared by the International Law Commission, as well as the written comments and observations of Governments, all the views expressed in the debates of the Sixth Committee on this topic, while noting the report of the working group of the Sixth Committee convened at the seventy- seventh and seventy-eighth sessions, and the recommendation of the Commission;",
    "4": "Decides that the rules of procedure of the General Assembly shall apply provisionally to the procedure of the Conference until otherwise agreed by the Conference;",
    "5": "Also decides that the Conference shall exhaust every effort in good faith to reach agreement on substantive matters by consensus; United Nations Conference of Plenipotentiaries on Protection of Persons in the Event of Disasters A/RES/80/169 3/4 25-20869",
    "6": "Further decides that the Conference will be undertaken in an open and transparent manner, with a view to promoting universal adherence, and emphasizes the need to ensure the widest possible and effective participation, including, in particular, of developing countries, in the Conference;",
    "7": "Decides that the Conference and the Preparatory Committee shall be open to all States Members of the United Nations and members of the specialized agencies, and requests the Secretary-General to invite those States to participate in the Conference;",
    "8": "Also decides that the Conference and the Preparatory Committee shall be open to observers having received a standing invitation to participate in the sessions and the work of the General Assembly, on the understanding that they shall participate in the Conference and the Preparatory Committee in accordance with the rights and privileges conferred upon them by the Assembly, and requests the Secretary-General to invite them to the Conference, as well as to invite, as observers to the Conference, representatives of interested regional intergovernmental organizations and other interested international bodies;",
    "9": "Further decides that attendance at the Preparatory Committee and the Conference as observers will also be opened to relevant non\u2011governmental organizations in consultative status with the Economic and Social Council in accordance with the provisions of Council resolution 1996/31 of 25 July 1996, on the understanding that their participation means attending formal meetings, receiving copies of the official documents, making their materials available to delegates and addressing the meetings, through a limited number of their representatives, as appropriate;",
    "10": "Invites the States referred to in paragraph 7 above to include as far as possible among their representatives experts competent in the field to be considered;",
    "11": "Requests the Secretary-General to arrange for the attendance at the Conference, as an expert, of the Special Rapporteur of the International Law Commission on the protection of persons in the event of disasters;",
    "12": "Also requests the Secretary-General to appoint a Secretary-General of the Conference to serve as focal point within the Secretariat for providing support to the organization of the Conference;",
    "13": "Further requests the Secretary-General to provide the Conference and the Preparatory Committee with the necessary assistance for the performance of their work, including secretariat services and the provision of essential background information and relevant documents, including summary records and United Nations media coverage, and to arrange for support to be provided by the Codification Division of the Office of Legal Affairs of the Secretariat;",
    "14": "Recognizes the importance of ensuring the availability of adequate resources to ensure the widest possible and effective participation in the Conference, and, accordingly, invites Member States, international financial institutions, donor agencies, intergovernmental organizations, non\u2011governmental organizations and natural and juridical persons to make earmarked financial contributions to the trust fund established by the Secretary-General for the Office of Legal Affairs to support the promotion of international law, and authorizes the Secretary-General to disburse funds from such contributions to that trust fund for the purposes of assisting developing countries, in particular the least developed countries and small island developing States, in attending the Conference, through the provision of daily subsistence allowance in addition to defraying the costs of economy-class travel, A/RES/80/169 United Nations Conference of Plenipotentiaries on Protection of Persons in the Event of Disasters 25-20869 4/4 while limiting requests for assistance from the trust fund to one delegate per State for each session of the Conference;",
    "15": "Decides that the Sixth Committee shall resume its session from 6 to 10 April 2026, within the framework of a working group of the Committee, in accordance with resolution 79/128;",
    "16": "Also decides to include in the provisional agenda of its eighty-first session an item entitled \u201cUnited Nations Conference of Plenipotentiaries on Protection of Persons in the Event of Disasters\u201d. 64th plenary meeting 15 December 2025"
  },
  "agenda_items": [
    "Item 86"
  ],
  "symbol_references": []
}