{
  "symbol": "A/RES/73/138",
  "filename": "A_RES_73_138.pdf",
  "title": "73/138. White Helmets Commission: participation of volunteers in the activities of the United Nations in the field of humanitarian relief, rehabilitation and technical cooperation for development",
  "text": "United Nations \nA/RES/73/138\n \n \nGeneral Assembly \nDistr.: General \n9 January 2019 \n \n18-22066 (E)    110119     \n*1822066* \n \n \nSeventy-third session \nAgenda item 75 (a) \n \n \n \n \n Resolution adopted by the General Assembly \non 14 December 2018 \n \n \n \n \n[without reference to a Main Committee (A/73/L.53 and A/73/L.53/Add.1)] \n \n \n 73/138. White Helmets Commission: participation of volunteers in the \nactivities of the United Nations in the field of humanitarian relief, \nrehabilitation and technical cooperation for development \n \n \n \nThe General Assembly, \n \nReaffirming its resolutions 50/19 of 28 November 1995, 52/171 of 16 December \n1997, 54/98 of 8 December 1999, 56/102 of 14 December 2001, 58/118 of \n17 December 2003, 61/220 of 20 December 2006, 64/75 of 7 December 2009, 67/84 \nof 13 December 2012, 69/134 of 12 December 2014 and 70/105 of 10 December 2015, \n \nReaffirming also its resolution 46/182 of 19 December 1991 and the guiding \nprinciples contained in the annex thereto, and reaffirming further other relevant \nresolutions of the General Assembly and relevant resolutions and agreed conclusions \nof the Economic and Social Council,  \n \nEmphasizing the principles of humanity, neutrality, impartiality and \nindependence in the provision of humanitarian assistance, and reaffirming the need \nfor all actors engaged in the provision of humanitarian assistance in situations of \ncomplex emergencies and natural disasters to promote and fully respect these \nprinciples,  \n \nEmphasizing also the need for close collaboration between relief and \ndevelopment activities in the context of humanitarian emergencies, taking into \naccount the 2030 Agenda for Sustainable Development, 1  \n \nRecognizing that the international community, in addressing the growing \nmagnitude and complexity of disasters and chronic challenges, such as hunger, \nmalnutrition and poverty, must rely on the formulation of a well-coordinated global \nresponse within the framework of the United Nations and on the promotion of a \nsmooth transition from relief to rehabilitation, reconstruction and development,  \n__________________ \n \n1  Resolution 70/1. \n\nA/RES/73/138 \nWhite Helmets Commission: participation of volunteers in the activities\nof the United Nations in the field of humanitarian relief,\nrehabilitation and technical cooperation for development\n \n18-22066\n2/4 \n \n \nUnderscoring the need, in order to ensure a smooth transition from relief to \nrehabilitation and achieve development, to better align, wherever appropriate, \nhumanitarian and development assistance with national development priorities and \nstrategies, and encouraging Member States, as well as the United Nations system and \nregional organizations in supporting the efforts of Member States, to tackle the root \ncauses of humanitarian crises, including poverty and underdevelopment, to strengthen \ndisaster risk reduction, including preparedness, to build the resilience of affected \nStates, including host communities, and to reduce humanitarian needs,  \n \nRecognizing the progress made by Member States, the United Nations system \nand other international organizations with regard to disaster risk management and \ncoordination in the provision of humanitarian assistance,  \n \nRecognizing also that the Sendai Framework for Disaster Risk Reduction \n2015\u201320302 applies to the risk of small-scale and large-scale, frequent and infrequent, \nsudden and slow-onset disasters caused by natural or man-made hazards, as well as \nrelated environmental, technological and biological hazards and risks, \n \nRecognizing further the need for the public and private sectors and civil society \norganizations, as well as academia and scientific and research institutions, to work \nmore closely together and to create opportunities for collaboration, and for businesses \nto integrate disaster risk into their management practices,  \n \nReaffirming its resolution 70/1 of 25 September 2015, entitled \u201cTransforming \nour world: the 2030 Agenda for Sustainable Development\u201d, in which it adopted a \ncomprehensive, far-reaching and people-centred set of universal and transformative \nSustainable Development Goals and targets, its commitment to working tirelessly for \nthe full implementation of the Agenda by 2030, its recognition that eradicating \npoverty in all its forms and dimensions, including extreme poverty, is the greatest \nglobal challenge and an indispensable requirement for sustainable development, its \ncommitment to achieving sustainable development in its three dimensions \u2013 economic, \nsocial and environmental \u2013 in a balanced and integrated manner and to building upon \nthe achievements of the Millennium Development Goals and seeking to address their \nunfinished business,  \n \nNoting the World Humanitarian Summit, held in Istanbul, Turkey, on 23 and \n24 May 2016, and taking note of the report of the Secretary-General on the outcome \nof the World Humanitarian Summit,3  \n \nNoting also the contributions of the global, regional and subregional platforms \nfor disaster risk reduction,  \n \nReaffirming the importance of continued efforts by the relevant organizations of \nthe United Nations system and, as appropriate, other relevant humanitarian actors to \nimprove the humanitarian response to natural and man-made disasters and complex \nemergencies by further strengthening humanitarian response capacities at all levels, \nby continuing to strengthen the provision and coordination of humanitarian assistance \nat the global, regional and field levels, \n \nEmphasizing the importance of global, regional, national and local policies and \nstrategies for prevention, preparedness, response and recovery in disasters and \nhumanitarian crises, with a view to integrating a gender perspective, as well as a \nperspective on the needs of children, young people, older persons and persons with \ndisabilities, in the design and implementation of all phases of disaster risk reduction, \nand reaffirming that it is essential to ensure that women are empowered to effectively \nand meaningfully participate in leadership and decision-making processes,  \n__________________ \n \n2  Resolution 69/283, annex II. \n \n3  A/71/353. \n\nWhite Helmets Commission: participation of volunteers in the activities \nof the United Nations in the field of humanitarian relief, \nrehabilitation and technical cooperation for development \nA/RES/73/138\n \n3/4\n18-22066 \n \n \n1. \nTakes note of the report of the Secretary-General on the strengthening of \nthe coordination of emergency humanitarian assistance of the United Nations, \nsubmitted in compliance with resolutions 46/182 and 72/133 of 11 December 2017,4 \nin particular paragraph 96 of the report, in which an update is provided on \ncollaboration between the White Helmets, an initiative of the Government of \nArgentina, and the United Nations, and it is noted that since 1994, more than 700 \nWhite Helmets volunteers have provided assistance in 71 countries and undertaken \n291 international humanitarian missions, many in coordination with the United \nNations, and strengthened links with United Nations system agencies through \nagreements, joint workplans, financial support and field missions; \n \n2. \nHighlights that the White Helmets is a volunteer corps composed entirely \nof civilians that develops its activities on the basis of cooperation, solidarity and the \nparticipation of communities;  \n \n3. \nNotes with appreciation the contribution of the White Helmets to \nhumanitarian assistance, disaster risk management and the achievement of sustainable \ndevelopment; \n \n4. \nRecognizes that the White Helmets initiative has demonstrated the \npotential of regional partnerships and has encouraged the participation of affected or \nvulnerable populations in the tasks of planning, training, mobilizing and providing an \nimmediate response in disaster situations and complex emergencies, while integrating \na gender perspective into its activities;  \n \n5. \nCommends national and international volunteers, including the White \nHelmets, for their contributions and their fundamental role in disaster risk reduction, \nresponse and recovery;  \n \n6. \nTakes note of the renewal, signed in 2016, of the memorandum of \nunderstanding between the White Helmets and the Office of the United Nations High \nCommissioner for Refugees, which established the framework for the deployment of \nWhite Helmets volunteers in support of the emergency responses of the Office of the \nHigh Commissioner, and recognizes the efforts made by the World Food Programme \nand the White Helmets for joint action within the framework of food security, \nincluding the exchange of information among stakeholders in the field, and the \ninternational humanitarian assistance activities that the White Helmets developed \nwith the International Organization for Migration; \n \n7. \nEncourages the United Nations system, including the World Health \nOrganization, and operational partners of the United Nations, in providing \npsychosocial support to the disaster-affected population in emergency and disaster \nsituations, to draw on, as appropriate, the voluntary expertise of the White Helmets, \nwhich has been successfully tested, and invites Member States to consider means of \nintegrating the White Helmets initiative into their programme activities;  \n \n8. \nRecognizes the international humanitarian activities that the White \nHelmets developed in the period from 2016 to 2018 in coordination with the national \nauthorities of disaster-affected countries and the agencies of the United Nations \nsystem and its partners in the design, preparedness, organization and deployment of \nhumanitarian assistance, including response, recovery and reconstruction following \ndisasters and building of resilience, and in addressing the consequences of \nhumanitarian emergencies for migrants, in particular those in vulnerable situations; \n \n9. \nInvites the Secretary-General, on the basis of the experience acquired, to \ncontinue to consider the use of the White Helmets initiative as a resource suitable for \npreventing and mitigating the effects of disasters and other humanitarian crises;  \n__________________ \n \n4  A/73/78-E/2018/54. \n\nA/RES/73/138 \nWhite Helmets Commission: participation of volunteers in the activities\nof the United Nations in the field of humanitarian relief,\nrehabilitation and technical cooperation for development\n \n18-22066\n4/4 \n \n \n10. Recognizes the agreement signed between the United Nations Office for \nProject Services and the White Helmets Commission, which extends until 2019 and \nwill allow for the continuation of the work launched in 1995, and invites Member \nStates to consider means of supporting collaboration of the White Helmets with their \nprogramme activities and to consider making financial resources available to the \nspecial voluntary fund of the United Nations Office for Project Services; \n \n11. \nInvites the Secretary-General, on the basis of the work experience acquired \nby the White Helmets in the international field, as recognized in various resolutions \nof the General Assembly, and in view of the success of coordinated actions carried \nout with, inter alia, the Office for the Coordination of Humanitarian Affairs, the Office \nof the United Nations High Commissioner for Refugees, the International Strategy \nfor Disaster Reduction, the World Health Organization, the Pan American Health \nOrganization, the World Food Programme, the Food and Agriculture Organization of \nthe United Nations, the United Nations Development Programme and the United \nNations Volunteers, to suggest measures to enhance the collaboration of the White \nHelmets initiative with the United Nations system and to report thereon to the \nAssembly at its seventy-sixth session in a separate section of the annual report on the \nstrengthening of the coordination of emergency humanitarian assistance of the United \nNations. \n \n54th plenary meeting \n14 December 2018 \n \n",
  "paragraphs": {
    "1": "Takes note of the report of the Secretary-General on the strengthening of the coordination of emergency humanitarian assistance of the United Nations, submitted in compliance with resolutions 46/182 and 72/133 of 11 December 2017,4 in particular paragraph 96 of the report, in which an update is provided on collaboration between the White Helmets, an initiative of the Government of Argentina, and the United Nations, and it is noted that since 1994, more than 700 White Helmets volunteers have provided assistance in 71 countries and undertaken 291 international humanitarian missions, many in coordination with the United Nations, and strengthened links with United Nations system agencies through agreements, joint workplans, financial support and field missions;",
    "2": "Highlights that the White Helmets is a volunteer corps composed entirely of civilians that develops its activities on the basis of cooperation, solidarity and the participation of communities;",
    "3": "Notes with appreciation the contribution of the White Helmets to humanitarian assistance, disaster risk management and the achievement of sustainable development;",
    "4": "Recognizes that the White Helmets initiative has demonstrated the potential of regional partnerships and has encouraged the participation of affected or vulnerable populations in the tasks of planning, training, mobilizing and providing an immediate response in disaster situations and complex emergencies, while integrating a gender perspective into its activities;",
    "5": "Commends national and international volunteers, including the White Helmets, for their contributions and their fundamental role in disaster risk reduction, response and recovery;",
    "6": "Takes note of the renewal, signed in 2016, of the memorandum of understanding between the White Helmets and the Office of the United Nations High Commissioner for Refugees, which established the framework for the deployment of White Helmets volunteers in support of the emergency responses of the Office of the High Commissioner, and recognizes the efforts made by the World Food Programme and the White Helmets for joint action within the framework of food security, including the exchange of information among stakeholders in the field, and the international humanitarian assistance activities that the White Helmets developed with the International Organization for Migration;",
    "7": "Encourages the United Nations system, including the World Health Organization, and operational partners of the United Nations, in providing psychosocial support to the disaster-affected population in emergency and disaster situations, to draw on, as appropriate, the voluntary expertise of the White Helmets, which has been successfully tested, and invites Member States to consider means of integrating the White Helmets initiative into their programme activities;",
    "8": "Recognizes the international humanitarian activities that the White Helmets developed in the period from 2016 to 2018 in coordination with the national authorities of disaster-affected countries and the agencies of the United Nations system and its partners in the design, preparedness, organization and deployment of humanitarian assistance, including response, recovery and reconstruction following disasters and building of resilience, and in addressing the consequences of humanitarian emergencies for migrants, in particular those in vulnerable situations;",
    "9": "Invites the Secretary-General, on the basis of the experience acquired, to continue to consider the use of the White Helmets initiative as a resource suitable for preventing and mitigating the effects of disasters and other humanitarian crises; __________________ 4 A/73/78-E/2018/54. A/RES/73/138 White Helmets Commission: participation of volunteers in the activities of the United Nations in the field of humanitarian relief, rehabilitation and technical cooperation for development 18-22066 4/4",
    "10": "Recognizes the agreement signed between the United Nations Office for Project Services and the White Helmets Commission, which extends until 2019 and will allow for the continuation of the work launched in 1995, and invites Member States to consider means of supporting collaboration of the White Helmets with their programme activities and to consider making financial resources available to the special voluntary fund of the United Nations Office for Project Services;",
    "11": "Invites the Secretary-General, on the basis of the work experience acquired by the White Helmets in the international field, as recognized in various resolutions of the General Assembly, and in view of the success of coordinated actions carried out with, inter alia, the Office for the Coordination of Humanitarian Affairs, the Office of the United Nations High Commissioner for Refugees, the International Strategy for Disaster Reduction, the World Health Organization, the Pan American Health Organization, the World Food Programme, the Food and Agriculture Organization of the United Nations, the United Nations Development Programme and the United Nations Volunteers, to suggest measures to enhance the collaboration of the White Helmets initiative with the United Nations system and to report thereon to the Assembly at its seventy-sixth session in a separate section of the annual report on the strengthening of the coordination of emergency humanitarian assistance of the United Nations. 54th plenary meeting 14 December 2018"
  },
  "agenda_items": [
    "Item 75"
  ],
  "symbol_references": [
    "A/73/L.53"
  ]
}