{
  "symbol": "A/RES/75/318",
  "filename": "A_RES_75_318.pdf",
  "title": "75/318. World Cotton Day",
  "text": "United Nations \nA/RES/75/318\n \n \nGeneral Assembly \nDistr.: General \n1 September 2021 \n \n21-12016 (E)    080921 \n*2112016* \n \n \nSeventy-fifth session \nAgenda item 14 \nIntegrated and coordinated implementation of and \nfollow-up to the outcomes of the major United Nations \nconferences and summits in the economic, social and \nrelated fields \n \n \n \n \n Resolution adopted by the General Assembly \non 30 August 2021 \n \n \n \n \n[without reference to a Main Committee (A/75/L.126/Rev.1  \nand A/75/L.126/Rev.1/Add.1)] \n \n \n 75/318. World Cotton Day \n \n \n \nThe General Assembly, \n \nReaffirming its resolution 70/1 of 25 September 2015, entitled \u201cTransforming \nour world: the 2030 Agenda for Sustainable Development\u201d, in which it adopted a \ncomprehensive, far-reaching and people-centred set of universal and transformative \nSustainable Development Goals and targets, its commitment to working tirelessly for \nthe full implementation of the Agenda by 2030, its recognition that eradicating \npoverty in all its forms and dimensions, including extreme poverty, is the greatest \nglobal challenge and an indispensable requirement for sustainable development, its \ncommitment to achieving sustainable development in its three dimensions \u2013 \neconomic, social and environmental \u2013 in a balanced and integrated manner, and to \nbuilding upon the achievements of the Millennium Development Goals and seeking \nto address their unfinished business, \n \nReaffirming also its resolutions 53/199 of 15 December 1998 and 61/185 of \n20 December 2006 on the proclamation of international years, and Economic and \nSocial Council resolution 1980/67 of 25 July 1980 on international years and \nanniversaries, in particular paragraphs 1 to 10 of the annex thereto on the agreed \ncriteria for the proclamation of international years, as well as paragraphs 13 and 14, \nin which it is stated that an international day or year should not be proclaimed before \nthe basic arrangements for its organization and financing have been made, \n \nReaffirming further its resolution 69/313 of 27 July 2015 on the Addis Ababa \nAction Agenda of the Third International Conference on Financing for Development, \nwhich is an integral part of the 2030 Agenda for Sustainable Development, supports \nand complements it, helps to contextualize its means of implementation targets with \n\nA/RES/75/318 \nWorld Cotton Day\n \n21-12016\n2/3 \n \nconcrete policies and actions and reaffirms the strong political commitment to address \nthe challenge of financing and creating an enabling environment at all levels for \nsustainable development in the spirit of global partnership and solidarity, \n \nConsidering the historical importance of cotton as a global commodity and the \nvital role that cotton plays in several Member States by providing livelihoods and as \na subsistence crop for millions of people and its broader economic and social impacts \naround the world, and recognizing the local and cultural heritage associated with \ncotton production and the interlinkage between local production methods and the \nquality of cotton varieties, \n \nRecognizing that the proclamation of World Cotton Day will contribute to \nincreased awareness of the international community about the importance of the \ncontribution of the sustainable cotton sector to the achievement of the 2030 Agenda, \n \nReaffirming the relevance of the sectoral Cotton Initiative, launched in 2003 at \nthe World Trade Organization to improve market access opportunities for cotton and \ncotton-related products from least developed countries and to substantially reduce any \ntrade-distorting effects of undue measures in international cotton trade and to \nintensify discussions on factors negatively impacting cotton trade and markets, \n \nReaffirming also the importance of development assistance programmes and \nefforts to improve cotton production capacity in developing countries, in order to \nfoster their cotton supply chain industries, \n \nTaking into consideration development assistance activities related to cotton \nproduction, processing, marketing and consumption provided by the international \ncommunity and aimed at contributing to poverty reduction strategies and other \ndevelopment-oriented projects as well as towards increasing the standard of living of \nthe poorest and most vulnerable among those engaged in the cotton value chain sector, \nand cotton by-products, particularly in developing and least developed countries, \n \nConvinced of the importance of a global celebration dedicated to cotton \nproduction and the promotion of reliable cotton value chains, which would serve to \ndraw attention to the hundreds of millions of people around the world who earn their \nlivelihoods through their work in cotton production and related industries, \n \n1. \nDecides to proclaim 7 October of each year as World Cotton Day; \n \n2. \nInvites all Member States, organizations of the United Nations system, other \ninternational and regional organizations and civil society, including non-governmental \norganizations, to observe World Cotton Day in an appropriate manner and in \naccordance with national priorities, in order to raise awareness of the importance of \ncotton production, processing, marketing and consumption, the specific related \nchallenges and the emerging opportunities, especially for developing countries and \nleast developed countries; \n \n3. \nInvites the Food and Agriculture Organization of the United Nations, in \ncollaboration with all relevant organizations, in particular the United Nations \nConference on Trade and Development, the United Nations Industrial Development \nOrganization, the United Nations Environment Programme, the World Trade \nOrganization, the International Trade Centre and the International Cotton Advisory \nCommittee, to facilitate the observance of World Cotton Day, mindful of the \nprovisions contained in the annex to Economic and Social Council resolution \n1980/67; \n \n4. \nRecognizes the role of women in the cotton sector and the importance of \nbiotechnology in both sustainable cotton production and economic development, and \nunderscores the need to increase cultivation of organic cotton and for gender-sensitive \ntechnical assistance programmes and projects in developing countries; \n\nWorld Cotton Day \nA/RES/75/318\n \n3/3\n21-12016 \n \n \n5. \nInvites all relevant stakeholders and interested organizations to raise the \nvisibility of the cotton sector and awareness of the critical role that it plays in \neconomic development, international trade and poverty alleviation, highlighting the \nimportance of sustained, inclusive and sustainable economic growth, full and \nproductive employment and decent work for all; \n \n6. \nEncourages Member States, through the observance of World Cotton Day, \nto hold discussions to ensure that people in developing countries in general, and least \ndeveloped countries in particular, benefit from the earnings and results of cotton \nproduction and cotton processing in an appropriate manner; \n \n7. \nInvites all relevant organizations of the United Nations system, other \ninternational \norganizations \nand \ncivil \nsociety, \nincluding \nnon-governmental \norganizations, as well as academia, and the private sector, to promote synergies in \ntheir areas of expertise, in order to contribute to the economic, social and \nenvironmental dimensions of sustainable development and minimize the adverse \nimpacts of the production, processing, marketing and consumption of cotton and \ncotton-related products; \n \n8. \nStresses that the cost of all activities that may arise from the \nimplementation of the present resolution should be met from voluntary contributions, \nincluding from the private sector; \n \n9. \nRequests the Secretary-General to bring the present resolution to the \nattention of all Member States, the United Nations system bodies, other institutions, \norganizations and entities, as well as civil society organizations, the private sector \nand academia for effective and appropriate observance. \n \n99th plenary meeting \n30 August 2021 \n \n",
  "paragraphs": {
    "1": "Decides to proclaim 7 October of each year as World Cotton Day;",
    "2": "Invites all Member States, organizations of the United Nations system, other international and regional organizations and civil society, including non-governmental organizations, to observe World Cotton Day in an appropriate manner and in accordance with national priorities, in order to raise awareness of the importance of cotton production, processing, marketing and consumption, the specific related challenges and the emerging opportunities, especially for developing countries and least developed countries;",
    "3": "Invites the Food and Agriculture Organization of the United Nations, in collaboration with all relevant organizations, in particular the United Nations Conference on Trade and Development, the United Nations Industrial Development Organization, the United Nations Environment Programme, the World Trade Organization, the International Trade Centre and the International Cotton Advisory Committee, to facilitate the observance of World Cotton Day, mindful of the provisions contained in the annex to Economic and Social Council resolution 1980/67;",
    "4": "Recognizes the role of women in the cotton sector and the importance of biotechnology in both sustainable cotton production and economic development, and underscores the need to increase cultivation of organic cotton and for gender-sensitive technical assistance programmes and projects in developing countries; World Cotton Day A/RES/75/318 3/3 21-12016",
    "5": "Invites all relevant stakeholders and interested organizations to raise the visibility of the cotton sector and awareness of the critical role that it plays in economic development, international trade and poverty alleviation, highlighting the importance of sustained, inclusive and sustainable economic growth, full and productive employment and decent work for all;",
    "6": "Encourages Member States, through the observance of World Cotton Day, to hold discussions to ensure that people in developing countries in general, and least developed countries in particular, benefit from the earnings and results of cotton production and cotton processing in an appropriate manner;",
    "7": "Invites all relevant organizations of the United Nations system, other international organizations and civil society, including non-governmental organizations, as well as academia, and the private sector, to promote synergies in their areas of expertise, in order to contribute to the economic, social and environmental dimensions of sustainable development and minimize the adverse impacts of the production, processing, marketing and consumption of cotton and cotton-related products;",
    "8": "Stresses that the cost of all activities that may arise from the implementation of the present resolution should be met from voluntary contributions, including from the private sector;",
    "9": "Requests the Secretary-General to bring the present resolution to the attention of all Member States, the United Nations system bodies, other institutions, organizations and entities, as well as civil society organizations, the private sector and academia for effective and appropriate observance. 99th plenary meeting 30 August 2021"
  },
  "agenda_items": [
    "Item 14"
  ],
  "symbol_references": [
    "A/75/L.126"
  ]
}