{
  "symbol": "A/RES/75/10",
  "filename": "A_RES_75_10.pdf",
  "title": "75/10. Cooperation between the United Nations and the International Criminal Police Organization (INTERPOL)",
  "text": "United Nations \nA/RES/75/10\n \n \nGeneral Assembly \nDistr.: General \n30 November 2020 \n \n20-15846 (E)    071220 \n*2015846* \n \n \nSeventy-fifth session \nAgenda item 130 (y) \nCooperation between the United Nations and regional \nand other organizations: cooperation between the \nUnited Nations and the International Criminal Police \nOrganization (INTERPOL) \n \n \n \n \n Resolution adopted by the General Assembly \non 23 November 2020 \n \n \n \n \n[without reference to a Main Committee (A/75/L.20 and A/75/L.20/Add.1)] \n \n \n \n75/10. Cooperation between the United Nations and the International \nCriminal Police Organization (INTERPOL) \n \n \n \nThe General Assembly, \n \nRecalling its resolution 51/1 of 15 October 1996, in which it invited the \nInternational Criminal Police Organization (INTERPOL) to participate as an observer \nin its sessions and work, and its resolutions 71/19 of 21 November 2016 and 73/11 of \n26 November 2018 concerning the cooperation between the United Nations and \nINTERPOL, and calling for the strengthening of cooperation between the United \nNations and INTERPOL, \n \nRecalling also the cooperation agreement of 1997 between the United Nations \nand INTERPOL1 and all other relevant cooperation agreements between them, \n \nRecalling further all relevant United Nations resolutions recognizing that \ncooperation between the United Nations and international organizations such as \nINTERPOL can contribute to preventing and combating transnational crime, in \nparticular transnational organized crime, and preventing and countering terrorism, \n \nAcknowledging the unprecedented public health and socioeconomic damage \ncaused by the coronavirus disease (COVID-19) pandemic, including the impact of the \npandemic on the vulnerabilities that drive, enable and perpetuate criminal activity, \n \nAcknowledging also the cooperation between the United Nations and \nINTERPOL in assisting the States Members of the United Nations that are also \n__________________ \n \n1  United Nations, Treaty Series, vol. 1996, No. 1200. \n\nA/RES/75/10 \nCooperation between the United Nations and the International \nCriminal Police Organization (INTERPOL)\n \n20-15846\n2/6 \n \nmember countries of INTERPOL in preventing and responding to crime and in \nimproving their law enforcement capabilities, upon their request, \n \nRecognizing that INTERPOL is an apolitical and neutral international \norganization entrusted with the mandate of ensuring and promoting mutual assistance \namong criminal police authorities, in full respect of the sovereignty of Member States \nand consistent with their obligations under international law and the domestic laws \nand regulations of each Member State, and in accordance with the rules and \nregulations of INTERPOL, \n \nAcknowledging that INTERPOL has been a key actor since 1923 in enabling and \npromoting international police cooperation in order to prevent and combat \ntransnational crime, in particular transnational organized crime, through enhanced \npolice cooperation among its member countries as well as in fostering innovation in \npolice and law enforcement matters, \n \nAcknowledging also the contributions derived from the global structure of the \nGeneral Secretariat of INTERPOL, consisting of its seat in Lyon, France, its regional \nbureaux around the world, its Offices of the Special Representative at the United \nNations, the European Union and the African Union and its Global Complex for \nInnovation, \n \nWelcoming the role of the national central bureaux of INTERPOL, present in \nevery member country, as the cornerstone of cooperation to enhance cohesion, \nstability and security and as the primary international policing hub, which links \nnational police forces through its global network, \n \nWelcoming also the cooperation between the United Nations Global Counter-\nTerrorism Coordination Compact entities and INTERPOL in preventing and \ncountering terrorism by assisting Member States, upon their request, in implementing \nthe United Nations Global Counter-Terrorism Strategy,2 including through \ninformation-sharing on foreign terrorist fighters, including those returning or \nrelocating, and on improvements in border security, 3 and in this regard taking note \nwith appreciation of the development of the joint United Nations Counter-Terrorism \nCentre-INTERPOL project entitled \u201cEnhancing information-sharing on foreign \nterrorist fighters among Member States\u201d, \n \nWelcoming further the cooperation and coordination efforts undertaken in \naccordance with the arrangement on cooperation of 21 July 2017 between the United \nNations and INTERPOL, in relation to the Counter-Terrorism Committee Executive \nDirectorate, supplementary to the cooperation agreement of 1997 between the United \nNations and INTERPOL, \n \nWelcoming the cooperation and coordination efforts undertaken between the \nOffice of Counter-Terrorism and INTERPOL, in accordance with the arrangement on \ncooperation of 27 June 2018 between the United Nations and INTERPOL, in relation \nto the activities of the Office of Counter-Terrorism, supplementary to the cooperation \nagreement of 1997 between the United Nations and INTERPOL, \n \nNoting the cooperation and coordination efforts undertaken in accordance with \nexisting arrangements between the Department of Peace Operations of the Secretariat \nand INTERPOL, and recalling the joint effort of INTERPOL and the Department of \nPeace Operations pertaining to interim law enforcement, security support and support \nfor the development of national police and other law enforcement agencies in mission \nsettings, in accordance with respective and specific mandates, \n__________________ \n \n2  Resolution 60/288. \n \n3  See resolution 72/284. \n\nCooperation between the United Nations and the International \nCriminal Police Organization (INTERPOL) \nA/RES/75/10\n \n3/6\n20-15846 \n \n \nRecognizing the contribution of the cooperation between the United Nations and \nINTERPOL towards the implementation of the 2030 Agenda for Sustainable \nDevelopment,4 through joint activities, capacity-building and targeted support of \nMember States in the fight against all forms of transnational crime and terrorism, and \ntaking note of the contribution of the INTERPOL Global Policing Goals to support \nthe implementation of the 2030 Agenda by Member States, \n \nAcknowledging the need to strengthen the cooperation between the United \nNations and INTERPOL to mainstream a gender perspective into training, workshops, \ncapacity-building and leadership training programmes, \n \nRecalling the political declaration on the implementation of the United Nations \nGlobal Plan of Action to Combat Trafficking in Persons, 5 in which, inter alia, the \nGeneral Assembly reaffirmed the important contribution of INTERPOL to the global \nfight against trafficking in persons, especially women and children, \n \nRecognizing the contribution of the cooperation between the United Nations and \nINTERPOL in combating the illicit trade in small arms and light weapons, and \nacknowledging the contribution of INTERPOL to the third United Nations \nConference to Review Progress Made in the Implementation of the Programme of \nAction to Prevent, Combat and Eradicate the Illicit Trade in Small Arms and Light \nWeapons in All Its Aspects, and the relevant role of INTERPOL in the International \nInstrument to Enable States to Identify and Trace, in a Timely and Reliable Manner, \nIllicit Small Arms and Light Weapons,6  \n \nNoting the cooperation between the United Nations and INTERPOL in assisting \nMember States, upon their request, in tackling the illicit trafficking in chemical, \nbiological, radiological and nuclear materials by non-State actors, \n \nConcerned at the growing trend of cybercrime and the criminal misuse of \ninformation and communications technologies in multiple forms of crime, recalling \nits resolutions 73/187 of 17 December 2018 and 74/247 of 27 December 2019, as well \nas Economic and Social Council resolutions 2019/19 and 2019/20 of 23 July 2019, \nand noting the need to enhance coordination and cooperation between the United \nNations, in particular the Global Programme on Cybercrime of the United Nations \nOffice on Drugs and Crime, INTERPOL and Member States in combating cybercrime, \nincluding through technical assistance, particularly to developing countries, upon \nrequest, in order to enhance the capacity of national authorities to deal with \ncybercrime in all its forms, including its prevention, detection, investigation and \nprosecution, \n \nNoting the continued efforts and progress made by INTERPOL to provide a \nglobal law enforcement knowledge exchange platform, and the contribution of \nINTERPOL to the promotion and achievement of the highest level of professionalism \nin law enforcement, including through the provision and delivery of training and \ntraining resources and the creation of networks of law enforcement education \ninstitutions, aimed at increasing the efficiency of law enforcement agencies in \ncombating transnational organized crime through international police cooperation, \n \nConvinced that increased and enhanced cooperation between the United Nations \nand INTERPOL in accordance with the Charter of the United Nations and the \nConstitution of INTERPOL, as well as applicable international law, will contribute to \nachieving the respective purposes and principles of both organizations, \n__________________ \n \n4  Resolution 70/1. \n \n5  Resolution 72/1. \n \n6  See decision 60/519 and A/60/88 and A/60/88/Corr.2, annex. \n\nA/RES/75/10 \nCooperation between the United Nations and the International \nCriminal Police Organization (INTERPOL)\n \n20-15846\n4/6 \n \n \n1. \nCalls for the strengthening of cooperation between the United Nations and \nthe International Criminal Police Organization (INTERPOL), within their respective \nmandates, in (a) preventing and combating transnational crime, in particular \ntransnational organized crime, including the smuggling of migrants, trafficking in \npersons, drug trafficking, piracy, the illicit manufacturing of and trafficking in small \narms and light weapons, illicit trafficking in chemical, biological, radiological and \nnuclear materials, the criminal misuse of information and communications \ntechnologies, including the Internet and social media, corruption and money-\nlaundering, trafficking in illicit and counterfeit goods and crimes that affect the \nenvironment, including illicit trafficking in endangered and, where applicable, \nprotected species of wild flora and fauna; and (b) preventing and countering terrorism, \nincluding through preventing and disrupting foreign terrorist fighter travel, \ncountering the use of information and communications technologies, including the \nInternet and social media, for terrorist purposes, while respecting human rights and \nfundamental freedoms, preventing and interdicting access to weapons necessary for \nterrorist activities, including small arms and light weapons and improvised explosive \ndevices, as well as to chemical, biological, radiological and nuclear materials, \ncountering the financing of terrorism, including financing through the use of \nemerging technologies and methods, preventing and disrupting financial support for \nforeign terrorist fighters and preventing and combating the intentional and unlawful \ndestruction of cultural heritage and trafficking in cultural property perpetrated by \ncriminal and terrorist groups; \n \n2. \nEmphasizes the importance of optimal coordination and cooperation \nbetween the United Nations and INTERPOL in countering terrorism, with particular \nregard to the threat posed by the travel of foreign terrorist fighters, including those \nwho return or relocate, and in strengthening international efforts to ensure that refugee \nstatus is not abused by the perpetrators, organizers and facilitators of terrorist acts, \nconsistent with the obligations of Member States under international law, and in this \ncontext stresses the importance of information-sharing, as appropriate, including \nbiometric data, which could encompass fingerprints and photographs, in order to \nincrease the chances of the positive identification of terrorists and their affiliates, in \naddition to information from battlefields, counter-terrorism military operations and \nnational prison systems, while respecting human rights and fundamental freedoms, \nand also stresses the importance of Member States making full use of INTERPOL \ncapabilities in this regard, notably the Stolen and Lost Travel Document Database, \nthe Nominal Database, the Foreign Terrorist Fighter Criminal Analysis File, the \nFingerprint Database, the DNA Profile Database and the facial recognition system, \nand of promoting international cooperation efforts to assist Member States, upon their \nrequest, in strengthening cooperation between their law enforcement agencies in \norder to bring suspected terrorists to justice; \n \n3. \nRecognizes the potential for strengthening the cooperation between \nINTERPOL and the Department of Peace Operations of the Secretariat to provide \ntimely capacity-building and technical assistance, including by organizing training \nactivities, to enhance the capacity of national police services and other law \nenforcement organizations, upon request, and in accordance with respective \nmandates; \n \n4. \nUrges the United Nations and INTERPOL to deepen their cooperation to \npromote gender equality in law enforcement, including through capacity-building \nprogrammes, as well as equal opportunities for employment, leadership positions and \ndecision-making at all levels of law enforcement agencies, with a view to the \nempowerment of all women and their full enjoyment of all human rights; \n \n5. \nEmphasizes the importance of optimal coordination and cooperation \nbetween the United Nations and INTERPOL to create synergies within their \n\nCooperation between the United Nations and the International \nCriminal Police Organization (INTERPOL) \nA/RES/75/10\n \n5/6\n20-15846 \n \nrespective mandates in the fight against transnational crime, in particular \ntransnational organized crime; \n \n6. \nReaffirms the importance of close cooperation between the United Nations \nand INTERPOL in the global fight against trafficking in persons, including through \nthe Inter-Agency Coordination Group against Trafficking in Persons, as well as any \nsexual exploitation, including of women and children, and in this context stresses the \nimportance of Member States making use of readily available INTERPOL \ncapabilities, such as the International Child Sexual Exploitation Database, the Stolen \nand Lost Travel Document Database, the Travel Documents Associated with Notices \nsystem and the Nominal Database, as well as the INTERPOL Human Trafficking \nExpert Group, and also stresses the importance of Member States enhancing their \ncapability to fight such crimes using the training curricula facilitated by INTERPOL; \n \n7. \nAlso reaffirms the importance of close cooperation between the United \nNations and INTERPOL to combat the smuggling of migrants, and in this context \nstresses the importance of Member States making use of readily available INTERPOL \ncapabilities, including the Stolen and Lost Travel Document Database and the \nNominal Database, as well as the INTERPOL Human Trafficking Expert Group; \n \n8. \nEmphasizes the importance of optimal cooperation between the United \nNations and INTERPOL to provide, upon request, complementary support to \npeacekeeping and peacebuilding efforts in accordance with existing mandates, \nincluding in assisting Member States in strengthening the national central bureaux of \nINTERPOL through training and technical assistance in order to fight transnational \norganized crime more effectively, and supporting the reinforcement of national police \nand other law enforcement agencies, as demonstrated by joint Department of Peace \nOperations and INTERPOL projects at United Nations peacekeeping missions; \n \n9. \nEncourages the United Nations to take full advantage of the benefits of \ncooperation with INTERPOL, in accordance with their respective mandates and \nconsistent with the national priorities of Member States, to prevent, combat and \neradicate the illicit trade in small arms and light weapons and to implement the \nProgramme of Action to Prevent, Combat and Eradicate the Illicit Trade in Small \nArms and Light Weapons in All Its Aspects7 and its International Instrument to Enable \nStates to Identify and Trace, in a Timely and Reliable Manner, Illicit Small Arms and \nLight Weapons, including through making use of the readily available INTERPOL \ncapabilities to facilitate the tracing of weapons, notably the INTERPOL Illicit Arms \nRecords and Tracing Management System, the INTERPOL Ballistic Information \nNetwork and the INTERPOL Firearms Reference Table; \n \n10. Encourages further cooperation between the United Nations, in particular \nthe United Nations Office on Drugs and Crime, and INTERPOL in addressing the \nchallenges faced by Member States in combating cybercrime and the criminal misuse \nof information and communications technologies, including through technical \nassistance and capacity-building activities made available by INTERPOL and \nrelevant United Nations entities, upon request and based on national needs, taking \ninto account specific challenges faced by developing countries; \n \n11. \nCalls upon the United Nations system and INTERPOL, as appropriate and \nwithin their existing mandates, to assist Member States in their efforts to prevent and \ncounter the destruction and looting of and trafficking in cultural property in all forms; \n \n12. Welcomes the steps that INTERPOL and the United Nations, particularly \nthe United Nations Office on Drugs and Crime, have taken to analyse and respond to \n__________________ \n \n7  Report of the United Nations Conference on the Illicit Trade in Small Arms and Light Weapons in \nAll Its Aspects, New York, 9\u201320 July 2001 (A/CONF.192/15), chap. IV, para. 24. \n\nA/RES/75/10 \nCooperation between the United Nations and the International \nCriminal Police Organization (INTERPOL)\n \n20-15846\n6/6 \n \nthe effects of the COVID-19 pandemic on crime, encourages relevant United Nations \nagencies to make use of resources and expertise provided by INTERPOL to enhance \ninternational law enforcement cooperation and to address these effects, including the \nCOVID-19 global threat assessment and recommended health protocols for police \nofficers, and calls upon the two organizations to further collaborate on and coordinate \ntheir analysis and responses, within their respective mandates, as well as to make use \nof lessons learned to address future public health challenges; \n \n13. Encourages increased cooperation between the United Nations and \nINTERPOL to assist Member States, upon their request, in effectively using the \nfollowing resources readily available to Member States that are also member \ncountries of INTERPOL, through their national central bureaux: \n \n(a) \nThe INTERPOL I-24/7 global police secure communications system, \nwhich enables authorized users to share sensitive and urgent police information with \ntheir counterparts around the globe for the primary purpose of assisting in the \nprevention, detection and investigation of crime, in accordance with the INTERPOL \nmandate; \n \n(b) \nINTERPOL databases, by populating, updating and querying them, as \nappropriate, with a view to sharing accurate information between Member States in a \ntimely manner in accordance with INTERPOL rules and regulations, in full respect \nof national sovereignty and operational priorities, through full access to them; \n \n(c) \nPublication of INTERPOL notices and diffusions to alert, request \nassistance from and provide assistance to law enforcement agencies of other Member \nStates; \n \n(d) \nCriminal information analysis, namely, INTERPOL analytical products, to \nsupport national operational activities and investigations by sharing information with \nINTERPOL for inclusion in the INTERPOL Criminal Analysis Files; \n \n(e) \nINTERPOL support for the operations of the law enforcement agencies of \nMember States as well as training and capacity-building programmes and initiatives \ndesigned to improve national police capabilities; \n \n14. Acknowledges the importance of extending real-time access to the I-24/7 \nglobal police secure communications system from the national central bureaux of \nMember States that are also member countries of INTERPOL to their other national \nlaw enforcement entities at strategic locations, such as border crossings, airports and \ncustoms and immigration posts, with a view to increasing the security of their borders \nby implementing INTERPOL technical solutions, inter alia, by integrating the most \nrecent versions of the Fixed INTERPOL Network Database into border crossing \npoints and systematically and automatically checking all incoming and outgoing \ntravellers and conducting anticipated checks through advance passenger information \nand passenger name records mechanisms, thereby promoting increased cooperation \nbetween the United Nations and INTERPOL; \n \n15. Requests the Secretary-General to submit to the General Assembly at its \nseventy-seventh session a report on the implementation of the present resolution; \n \n16. Decides to include in the provisional agenda of its seventy-seventh \nsession, under the item entitled \u201cCooperation between the United Nations and \nregional and other organizations\u201d, the sub-item entitled \u201cCooperation between the \nUnited Nations and the International Criminal Police Organization (INTERPOL)\u201d. \n \n30th plenary meeting \n23 November 2020 \n \n",
  "paragraphs": {
    "1": "Calls for the strengthening of cooperation between the United Nations and the International Criminal Police Organization (INTERPOL), within their respective mandates, in (a) preventing and combating transnational crime, in particular transnational organized crime, including the smuggling of migrants, trafficking in persons, drug trafficking, piracy, the illicit manufacturing of and trafficking in small arms and light weapons, illicit trafficking in chemical, biological, radiological and nuclear materials, the criminal misuse of information and communications technologies, including the Internet and social media, corruption and money- laundering, trafficking in illicit and counterfeit goods and crimes that affect the environment, including illicit trafficking in endangered and, where applicable, protected species of wild flora and fauna; and (b) preventing and countering terrorism, including through preventing and disrupting foreign terrorist fighter travel, countering the use of information and communications technologies, including the Internet and social media, for terrorist purposes, while respecting human rights and fundamental freedoms, preventing and interdicting access to weapons necessary for terrorist activities, including small arms and light weapons and improvised explosive devices, as well as to chemical, biological, radiological and nuclear materials, countering the financing of terrorism, including financing through the use of emerging technologies and methods, preventing and disrupting financial support for foreign terrorist fighters and preventing and combating the intentional and unlawful destruction of cultural heritage and trafficking in cultural property perpetrated by criminal and terrorist groups;",
    "2": "Emphasizes the importance of optimal coordination and cooperation between the United Nations and INTERPOL in countering terrorism, with particular regard to the threat posed by the travel of foreign terrorist fighters, including those who return or relocate, and in strengthening international efforts to ensure that refugee status is not abused by the perpetrators, organizers and facilitators of terrorist acts, consistent with the obligations of Member States under international law, and in this context stresses the importance of information-sharing, as appropriate, including biometric data, which could encompass fingerprints and photographs, in order to increase the chances of the positive identification of terrorists and their affiliates, in addition to information from battlefields, counter-terrorism military operations and national prison systems, while respecting human rights and fundamental freedoms, and also stresses the importance of Member States making full use of INTERPOL capabilities in this regard, notably the Stolen and Lost Travel Document Database, the Nominal Database, the Foreign Terrorist Fighter Criminal Analysis File, the Fingerprint Database, the DNA Profile Database and the facial recognition system, and of promoting international cooperation efforts to assist Member States, upon their request, in strengthening cooperation between their law enforcement agencies in order to bring suspected terrorists to justice;",
    "3": "Recognizes the potential for strengthening the cooperation between INTERPOL and the Department of Peace Operations of the Secretariat to provide timely capacity-building and technical assistance, including by organizing training activities, to enhance the capacity of national police services and other law enforcement organizations, upon request, and in accordance with respective mandates;",
    "4": "Urges the United Nations and INTERPOL to deepen their cooperation to promote gender equality in law enforcement, including through capacity-building programmes, as well as equal opportunities for employment, leadership positions and decision-making at all levels of law enforcement agencies, with a view to the empowerment of all women and their full enjoyment of all human rights;",
    "5": " respective mandates in the fight against transnational crime, in particular transnational organized crime;",
    "6": "Reaffirms the importance of close cooperation between the United Nations and INTERPOL in the global fight against trafficking in persons, including through the Inter-Agency Coordination Group against Trafficking in Persons, as well as any sexual exploitation, including of women and children, and in this context stresses the importance of Member States making use of readily available INTERPOL capabilities, such as the International Child Sexual Exploitation Database, the Stolen and Lost Travel Document Database, the Travel Documents Associated with Notices system and the Nominal Database, as well as the INTERPOL Human Trafficking Expert Group, and also stresses the importance of Member States enhancing their capability to fight such crimes using the training curricula facilitated by INTERPOL;",
    "7": "Also reaffirms the importance of close cooperation between the United Nations and INTERPOL to combat the smuggling of migrants, and in this context stresses the importance of Member States making use of readily available INTERPOL capabilities, including the Stolen and Lost Travel Document Database and the Nominal Database, as well as the INTERPOL Human Trafficking Expert Group;",
    "8": "Emphasizes the importance of optimal cooperation between the United Nations and INTERPOL to provide, upon request, complementary support to peacekeeping and peacebuilding efforts in accordance with existing mandates, including in assisting Member States in strengthening the national central bureaux of INTERPOL through training and technical assistance in order to fight transnational organized crime more effectively, and supporting the reinforcement of national police and other law enforcement agencies, as demonstrated by joint Department of Peace Operations and INTERPOL projects at United Nations peacekeeping missions;",
    "9": "Encourages the United Nations to take full advantage of the benefits of cooperation with INTERPOL, in accordance with their respective mandates and consistent with the national priorities of Member States, to prevent, combat and eradicate the illicit trade in small arms and light weapons and to implement the Programme of Action to Prevent, Combat and Eradicate the Illicit Trade in Small Arms and Light Weapons in All Its Aspects7 and its International Instrument to Enable States to Identify and Trace, in a Timely and Reliable Manner, Illicit Small Arms and Light Weapons, including through making use of the readily available INTERPOL capabilities to facilitate the tracing of weapons, notably the INTERPOL Illicit Arms Records and Tracing Management System, the INTERPOL Ballistic Information Network and the INTERPOL Firearms Reference Table;",
    "10": "Encourages further cooperation between the United Nations, in particular the United Nations Office on Drugs and Crime, and INTERPOL in addressing the challenges faced by Member States in combating cybercrime and the criminal misuse of information and communications technologies, including through technical assistance and capacity-building activities made available by INTERPOL and relevant United Nations entities, upon request and based on national needs, taking into account specific challenges faced by developing countries;",
    "11": "Calls upon the United Nations system and INTERPOL, as appropriate and within their existing mandates, to assist Member States in their efforts to prevent and counter the destruction and looting of and trafficking in cultural property in all forms;",
    "12": "Welcomes the steps that INTERPOL and the United Nations, particularly the United Nations Office on Drugs and Crime, have taken to analyse and respond to the effects of the COVID-19 pandemic on crime, encourages relevant United Nations agencies to make use of resources and expertise provided by INTERPOL to enhance international law enforcement cooperation and to address these effects, including the COVID-19 global threat assessment and recommended health protocols for police officers, and calls upon the two organizations to further collaborate on and coordinate their analysis and responses, within their respective mandates, as well as to make use of lessons learned to address future public health challenges;",
    "13": "Encourages increased cooperation between the United Nations and INTERPOL to assist Member States, upon their request, in effectively using the following resources readily available to Member States that are also member countries of INTERPOL, through their national central bureaux: (a) The INTERPOL I-24/7 global police secure communications system, which enables authorized users to share sensitive and urgent police information with their counterparts around the globe for the primary purpose of assisting in the prevention, detection and investigation of crime, in accordance with the INTERPOL mandate; (b) INTERPOL databases, by populating, updating and querying them, as appropriate, with a view to sharing accurate information between Member States in a timely manner in accordance with INTERPOL rules and regulations, in full respect of national sovereignty and operational priorities, through full access to them; (c) Publication of INTERPOL notices and diffusions to alert, request assistance from and provide assistance to law enforcement agencies of other Member States; (d) Criminal information analysis, namely, INTERPOL analytical products, to support national operational activities and investigations by sharing information with INTERPOL for inclusion in the INTERPOL Criminal Analysis Files; (e) INTERPOL support for the operations of the law enforcement agencies of Member States as well as training and capacity-building programmes and initiatives designed to improve national police capabilities;",
    "14": "Acknowledges the importance of extending real-time access to the I-24/7 global police secure communications system from the national central bureaux of Member States that are also member countries of INTERPOL to their other national law enforcement entities at strategic locations, such as border crossings, airports and customs and immigration posts, with a view to increasing the security of their borders by implementing INTERPOL technical solutions, inter alia, by integrating the most recent versions of the Fixed INTERPOL Network Database into border crossing points and systematically and automatically checking all incoming and outgoing travellers and conducting anticipated checks through advance passenger information and passenger name records mechanisms, thereby promoting increased cooperation between the United Nations and INTERPOL;",
    "15": "Requests the Secretary-General to submit to the General Assembly at its seventy-seventh session a report on the implementation of the present resolution;",
    "16": "Decides to include in the provisional agenda of its seventy-seventh session, under the item entitled \u201cCooperation between the United Nations and regional and other organizations\u201d, the sub-item entitled \u201cCooperation between the United Nations and the International Criminal Police Organization (INTERPOL)\u201d."
  },
  "agenda_items": [
    "Item 130"
  ],
  "symbol_references": [
    "A/75/L.20"
  ]
}