{
  "symbol": "A/RES/80/231",
  "filename": "A_RES_80_231.pdf",
  "title": "80/231. Financial reports and audited financial statements, and reports of the Board of Auditors",
  "text": "United Nations \nA/RES/80/231 \n \nGeneral Assembly \nDistr.: General \n31 December 2025 \n25-21242 (E) \n*2521242* \n \n \nEightieth session \nAgenda item 133 \nFinancial reports and audited financial statements, and \nreports of the Board of Auditors \n \n \n \n \n Resolution adopted by the General Assembly \non 30 December 2025 \n \n \n[on the report of the Fifth Committee (A/80/568, para. 19)] \n \n \n 80/231. Financial reports and audited financial statements, and reports of \nthe Board of Auditors \n \n \n \nThe General Assembly, \n \nRecalling its resolution 52/212 B of 31 March 1998 and its decision 57/573 of \n20 December 2002, \n \nRecalling also its resolutions 79/245 A of 24 December 2024 and 79/245 B of \n30 June 2025, \n \nHaving considered, for the period ended 31 December 2024, the financial \nreports and audited financial statements and the reports of the Board of Auditors on \nthe United Nations,1 the International Trade Centre,2 the United Nations University,3 \nthe United Nations Development Programme, 4  the United Nations Capital \nDevelopment Fund,5 the United Nations Children\u2019s Fund,6 the United Nations Relief \nand Works Agency for Palestine Refugees in the Near East, 7 the United Nations \nInstitute for Training and Research,8 the voluntary funds administered by the United \nNations High Commissioner for Refugees,9 the Fund of the United Nations Environment \n_______________ \n \n1 Official Records of the General Assembly, Eightieth Session, Supplement No. 5, vol. I (A/80/5 \n(Vol. I)). \n \n2 Ibid., vol. III (A/80/5 (Vol. III)). \n \n3 Ibid., vol. IV (A/80/5 (Vol. IV)). \n \n4 Ibid., Supplement No. 5A (A/80/5/Add.1). \n \n5 Ibid., Supplement No. 5B (A/80/5/Add.2). \n \n6 Ibid., Supplement No. 5C (A/80/5/Add.3). \n \n7 Ibid., Supplement No. 5D (A/80/5/Add.4). \n \n8 Ibid., Supplement No. 5E (A/80/5/Add.5). \n \n9 Ibid., Supplement No. 5F (A/80/5/Add.6). \n\nA/RES/80/231 \nFinancial reports and audited financial statements, and reports of \nthe Board of Auditors\n \n25-21242\n2/3 \n \nProgramme, 10  the United Nations Population Fund, 11  the United Nations Human \nSettlements Programme, 12  the United Nations Office on Drugs and Crime, 13  the \nUnited Nations Office for Project Services,14 the United Nations Entity for Gender \nEquality and the Empowerment of Women (UN-Women),15 the International Residual \nMechanism for Criminal Tribunals 16  and the United Nations Joint Staff Pension \nFund,17 the note by the Secretary-General transmitting the concise summary of the \nprincipal findings, conclusions and recommendations contained in the reports of the \nBoard of Auditors for the annual financial period 2024,18 the reports of the Secretary-\nGeneral on the implementation of the recommendations of the Board of Auditors \ncontained in its reports on the United Nations19 and on the United Nations funds and \nprogrammes 20  for the year ended 31 December 2024, the report by the Chief \nExecutive of Pension Administration and the Acting Representative of the Secretary-\nGeneral for the investment of the assets of the Fund on the implementation of the \nrecommendations of the Board of Auditors contained in its report for the year ended \n31 December 2024 on the United Nations Joint Staff Pension Fund21 and the related \nreport of the Advisory Committee on Administrative and Budgetary Questions, 22 \n \n1. \nTakes note of the audit opinions and findings, and endorses the \nrecommendations, contained in the reports of the Board of Auditors; \n \n2. \nEndorses the conclusions and recommendations contained in the report of \nthe Advisory Committee on Administrative and Budgetary Questions; \n \n3. \nReaffirms that the Board of Auditors shall be completely independent and \nsolely responsible for the conduct of audits; \n \n4. \nDecides to consider further the report of the Board of Auditors on the \nInternational Residual Mechanism for Criminal Tribunals under the agenda item \nrelating to the Mechanism; \n \n5. \nAlso decides to consider further the report of the Board of Auditors on the \nUnited Nations Joint Staff Pension Fund under the agenda item relating to the Pension \nFund; \n \n6. \nCommends the Board of Auditors for the continued high quality of its \nreports and the streamlined format thereof; \n \n7. \nTakes note of the reports of the Secretary-General on the implementation \nof the recommendations of the Board of Auditors contained in its reports for the year \nended 31 December 2024 on the United Nations and on the United Nations funds and \nprogrammes; \n \n8. \nReiterates its request to the Secretary-General and the executive heads of \nthe funds and programmes of the United Nations to ensure full implementation of the \nrecommendations of the Board of Auditors and the related recommendations of the \nAdvisory Committee in a prompt and timely manner, to continue to hold programme \n_______________ \n \n10 Ibid., Supplement No. 5G (A/80/5/Add.7). \n \n11 Ibid., Supplement No. 5H (A/80/5/Add.8). \n \n12 Ibid., Supplement No. 5I (A/80/5/Add.9). \n \n13 Ibid., Supplement No. 5J (A/80/5/Add.10). \n \n14 Ibid., Supplement No. 5K (A/80/5/Add.11). \n \n15 Ibid., Supplement No. 5L (A/80/5/Add.12). \n \n16 Ibid., Supplement No. 5O (A/80/5/Add.15). \n \n17 Ibid., Supplement No. 5P (A/80/5/Add.16). \n \n18 A/80/253. \n \n19 A/80/353. \n \n20 A/80/353/Add.1. \n \n21 A/80/328. \n \n22 A/80/485. \n\nFinancial reports and audited financial statements, and reports of \nthe Board of Auditors \nA/RES/80/231\n \n3/3\n25-21242 \n \nmanagers accountable for the non\u2011implementation of recommendations and to \neffectively address the root causes of the problems highlighted by the Board; \n \n9. \nReiterates its request to the Secretary-General to provide in his reports on \nthe implementation of the recommendations of the Board of Auditors a full \nexplanation for the delays in the implementation of the recommendations of the \nBoard, in particular those recommendations not yet fully implemented that are two or \nmore years old; \n \n10. Also reiterates its request to the Secretary-General to indicate in future \nreports an expected time frame for the implementation of the recommendations of the \nBoard of Auditors, as well as the priorities for their implementation and the office \nholders to be held accountable. \n \n69th (resumed) plenary meeting \n30 December 2025 \n \n",
  "paragraphs": {
    "1": "Takes note of the audit opinions and findings, and endorses the recommendations, contained in the reports of the Board of Auditors;",
    "2": "Endorses the conclusions and recommendations contained in the report of the Advisory Committee on Administrative and Budgetary Questions;",
    "3": "Reaffirms that the Board of Auditors shall be completely independent and solely responsible for the conduct of audits;",
    "4": "Decides to consider further the report of the Board of Auditors on the International Residual Mechanism for Criminal Tribunals under the agenda item relating to the Mechanism;",
    "5": "Also decides to consider further the report of the Board of Auditors on the United Nations Joint Staff Pension Fund under the agenda item relating to the Pension Fund;",
    "6": "Commends the Board of Auditors for the continued high quality of its reports and the streamlined format thereof;",
    "7": "Takes note of the reports of the Secretary-General on the implementation of the recommendations of the Board of Auditors contained in its reports for the year ended 31 December 2024 on the United Nations and on the United Nations funds and programmes;",
    "8": "Reiterates its request to the Secretary-General and the executive heads of the funds and programmes of the United Nations to ensure full implementation of the recommendations of the Board of Auditors and the related recommendations of the Advisory Committee in a prompt and timely manner, to continue to hold programme _______________ 10 Ibid., Supplement No. 5G (A/80/5/Add.7). 11 Ibid., Supplement No. 5H (A/80/5/Add.8). 12 Ibid., Supplement No. 5I (A/80/5/Add.9). 13 Ibid., Supplement No. 5J (A/80/5/Add.10). 14 Ibid., Supplement No. 5K (A/80/5/Add.11). 15 Ibid., Supplement No. 5L (A/80/5/Add.12). 16 Ibid., Supplement No. 5O (A/80/5/Add.15). 17 Ibid., Supplement No. 5P (A/80/5/Add.16). 18 A/80/253. 19 A/80/353. 20 A/80/353/Add.1. 21 A/80/328. 22 A/80/485. Financial reports and audited financial statements, and reports of the Board of Auditors A/RES/80/231 3/3 25-21242 managers accountable for the non\u2011implementation of recommendations and to effectively address the root causes of the problems highlighted by the Board;",
    "9": "Reiterates its request to the Secretary-General to provide in his reports on the implementation of the recommendations of the Board of Auditors a full explanation for the delays in the implementation of the recommendations of the Board, in particular those recommendations not yet fully implemented that are two or more years old;",
    "10": "Also reiterates its request to the Secretary-General to indicate in future reports an expected time frame for the implementation of the recommendations of the Board of Auditors, as well as the priorities for their implementation and the office holders to be held accountable. 69th (resumed) plenary meeting 30 December 2025"
  },
  "agenda_items": [
    "Item 133"
  ],
  "symbol_references": []
}