{
  "symbol": "A/RES/74/280",
  "filename": "A_RES_74_280.pdf",
  "title": "74/280. Support account for peacekeeping operations",
  "text": "United Nations \nA/RES/74/280\n \n \nGeneral Assembly \nDistr.: General \n13 July 2020 \n \n20-08788 (E)    160720     \n*2008788* \n \n \nSeventy-fourth session \nAgenda item 148 \nAdministrative and budgetary aspects of the financing of \nthe United Nations peacekeeping operations \n \n \n \n \n Resolution adopted by the General Assembly \non 30 June 2020 \n \n \n \n \n[on the report of the Fifth Committee (A/74/910)] \n \n \n 74/280. Support account for peacekeeping operations \n \n \n \nThe General Assembly, \n \nRecalling its resolutions 45/258 of 3 May 1991, 47/218 A of 23 December 1992, \n48/226 A of 23 December 1993, 48/226 C of 29 July 1994, 49/250 of 20 July 1995 \nand 50/221 B of 7 June 1996, section I of its resolution 55/238 of 23 December 2000, \nits resolutions 55/271 of 14 June 2001, 56/241 of 24 December 2001, 56/293 of \n27 June 2002, 57/318 of 18 June 2003, 58/298 of 18 June 2004, 59/301 of 22 June \n2005, 60/268 of 30 June 2006, 61/279 of 29 June 2007, 62/250 of 20 June 2008, \n63/287 of 30 June 2009, 64/271 of 24 June 2010, 65/290 of 30 June 2011, 66/265 of \n21 June 2012, 67/287 of 28 June 2013, 68/283 of 30 June 2014, 69/308 of 25 June \n2015, 70/287 of 17 June 2016, 71/295 of 30 June 2017, 72/288 of 5 July 2018, 73/308 \nof 3 July 2019 and its other relevant resolutions, as well as its decisions 49/469 of \n23 December 1994, 50/473 of 23 December 1995, 72/558 of 5 July 2018 and 73/555 \nof 3 July 2019,  \n \nHaving considered the reports of the Secretary-General on the budget \nperformance of the support account for peacekeeping operations for the period from \n1 July 2018 to 30 June 20191 and on the budget for the support account for \npeacekeeping operations for the period from 1 July 2020 to 30 June 2021,2 the report \nof the Independent Audit Advisory Committee on the proposed budget of the Office \nof Internal Oversight Services under the support account for peacekeeping operations \nfor the period from 1 July 2020 to 30 June 20213 and the related report of the Advisory \nCommittee on Administrative and Budgetary Questions,4  \n__________________ \n \n1  A/74/622. \n \n2  A/74/743. \n \n3  A/74/716. \n \n4  A/74/809. \n\nA/RES/74/280 \nSupport account for peacekeeping operations\n \n20-08788\n2/10 \n \n \nRecognizing the importance of the United Nations being able to respond and \ndeploy rapidly to a peacekeeping operation upon the adoption of a relevant resolution \nof the Security Council, within 30 days for traditional peacekeeping operations and \n90 days for complex peacekeeping operations,  \n \nRecognizing also the need for adequate support during all phases of \npeacekeeping operations, including the liquidation and termination phases,  \n \nMindful that the level of the support account should broadly correspond to the \nmandate, number, size and complexity of peacekeeping missions,  \n \n1. \nTakes note of the report of the Secretary-General on the budget for the \nsupport account for peacekeeping operations for the period from 1 July 2020 to \n30 June 20212 and the report of the Independent Audit Advisory Committee on the \nproposed budget of the Office of Internal Oversight Services under the support \naccount for peacekeeping operations for the period from 1 July 2020 to 30 June 2021;3 \n \n2. \nReaffirms its role in carrying out a thorough analysis and approval of \nhuman and financial resources and policies with a view to ensuring the full, effective \nand efficient implementation of all mandated programmes and activities and the \nimplementation of policies in this regard;  \n \n3. \nAlso reaffirms that the Fifth Committee is the appropriate Main Committee \nof the General Assembly entrusted with responsibility for administrative and \nbudgetary matters;  \n \n4. \nFurther reaffirms rule 153 of its rules of procedure;  \n \n5. \nReaffirms that the support account funds shall be used for the sole purpose \nof financing human resources and non-human resources requirements for \nbackstopping and supporting peacekeeping operations at Headquarters, and that any \nchanges in this limitation require the prior approval of the General Assembly;  \n \n6. \nAlso reaffirms the need for adequate funding for the backstopping of \npeacekeeping operations, as well as the need for full justification for that funding in \nsupport account budget submissions;  \n \n7. \nFurther reaffirms the need for effective and efficient administration and \nfinancial management of peacekeeping operations, and urges the Secretary-General \nto continue to identify measures to increase the productivity and efficiency of the \nsupport account;  \n \n8. \nRequests the Secretary-General to ensure the full implementation of the \nrelevant provisions of its resolutions 59/296 of 22 June 2005, 60/266 of 30 June 2006, \n61/276 of 29 June 2007, 64/269 of 24 June 2010, 65/289 of 30 June 2011, 66/264 of \n21 June 2012, 69/307 of 25 June 2015 and 70/286 of 17 June 2016, as well as other \nrelevant resolutions;  \n \n9. \nEndorses the conclusions and recommendations contained in the report of \nthe Advisory Committee on Administrative and Budgetary Questions, 4 subject to the \nprovisions of the present resolution, and requests the Secretary-General to ensure \ntheir full implementation;  \n \n10. Decides to maintain, for the financial period from 1 July 2020 to 30 June \n2021, the funding mechanism for the support account used in the current period, from \n1 July 2019 to 30 June 2020, as approved in paragraph 3 of its resolution 50/221 B;  \n \n\nSupport account for peacekeeping operations \nA/RES/74/280\n \n3/10\n20-08788 \n \n \n \nBudget performance report for the period from 1 July 2018 to 30 June 2019 \n \n \n11. \nTakes note of the report of the Secretary-General on the budget \nperformance of the support account for peacekeeping operations for the period from \n1 July 2018 to 30 June 2019;1  \n \n \n \nBudget estimates for the financial period from 1 July 2020 to 30 June 2021 \n \n \n12. Approves the support account requirements in the amount of 355,694,200 \nUnited States dollars for the financial period from 1 July 2020 to 30 June 2021, \ninclusive of the amount of 13,381,300 dollars for the enterprise resource planning \nproject, 868,500 dollars for the global service delivery model project, 3,881,600 \ndollars for peacekeeping capability readiness and 18,053,700 dollars for Umoja \nmaintenance and support costs, including 1,355 continuing posts and 2 new temporary \nposts, as well as the abolishment, redeployment, reassignment and reclassification of \nposts, as set out in annex I to the present resolution, and 62 continuing and 6 new \ngeneral temporary assistance positions and 50 person-months, as set out in annex II, \nas well as related post and non-post requirements; \n \n \n \nFinancing of the support account for peacekeeping operations for the financial \nperiods from 1 July 2018 to 30 June 2019 and from 1 July 2020 to 30 June 2021 \n \n \n13. Decides that the requirements for the support account for peacekeeping \noperations for the financial period from 1 July 2020 to 30 June 2021 shall be financed \nas follows: \n \n(a) \nThe total amount of 1,916,800 dollars, comprising investment revenue of \n691,500 dollars, other miscellaneous revenue of 26,200 dollars and the cancellation \nof prior-period obligations of 1,199,100 dollars in respect of the period from 1 July \n2018 to 30 June 2019, to be applied to the resources required for the financial period \nfrom 1 July 2020 to 30 June 2021;  \n \n(b) \nThe amount of 3,802,200 dollars, representing the excess of the authorized \nlevel of the Peacekeeping Reserve Fund in respect of the financial period ended \n30 June 2019, to be applied to the resources required for the financial period from \n1 July 2020 to 30 June 2021;  \n \n(c) \nThe balance of 349,975,200 dollars to be prorated among the budgets of \nthe active peacekeeping operations for the financial period from 1 July 2020 to \n30 June 2021; \n \n(d) \nThe net estimated staff assessment income of 28,128,200 dollars, \ncomprising the amount of 26,817,100 dollars for the financial period from 1 July 2020 \nto 30 June 2021 and the increase of 1,311,100 dollars in respect of the financial period \nended 30 June 2019, to be offset against the balance referred to in subparagraph \n(c) above, to be prorated among the budgets of the individual active peacekeeping \noperations. \n \n30 June 2020 \n \n \n \n \n\nA/RES/74/280 \nSupport account for peacekeeping operations\n \n20-08788\n4/10 \n \nAnnex I \n \nA \nPosts to be established under the support account for peacekeeping \noperations for the period from 1 July 2020 to 30 June 2021 \n \n \n \nPosts \n \n \nDepartment/office \nOrganizational unit \nNumber Level \nFunction \nStatus \nDepartment of Management Strategy, Policy and Compliance \nOffice of Programme Planning, \nFinance and Budget \nField Operations Finance Division \n1 GS (OL) Finance and Budget Assistanta New \nSubtotal \n1 \n \n \n \nSecretariat of the Advisory Committee on Administrative and Budgetary Questions \n \n1 P-4 \nAdministrative Officer \nNew \nSubtotal \n1 \n \n \n \nTotal \n2 \n \n \n \n \nNote: The specific assignment and location of each of the new posts is set out in the report of the Secretary-General on the budget \nfor the support account for peacekeeping operations for the period from 1 July 2020 to 30 June 2021 (A/74/743) and \nreferenced in the related report of the Advisory Committee on Administrative and Budgetary Questions ( A/74/809). \n \na Post establishment effective as of 1 January 2021. \nAbbreviations: GS (OL), General Service (Other level). \n \n \n \n \n\nSupport account for peacekeeping operations \nA/RES/74/280\n \n5/10\n20-08788 \n \n \n B \nRedeployment, reassignment, reclassification and abolishment of \nposts under the support account for peacekeeping operations for \nthe period from 1 July 2020 to 30 June 2021 \n \n \n \n \nRedeployment \n \n \n \nDepartment of Management Strategy, Policy and Compliance/Office of Programme \nPlanning, Finance and Budget, Finance Division \n \nRedeployment of the Trust Fund Management Section from the Programme Planning \nand Budget Division \n \n \n \nOffice of Internal Oversight Services/Internal Audit Division/Entebbe \n \nRedeployment of 2 posts (1 P-4 Resident Auditor, 1 P-3 Resident Auditor) from the \nResident Audit Office of the African Union-United Nations Hybrid Operation in \nDarfur (as of 1 April 2021) \n \n \n \nReassignment and downward reclassification \n \n \n \nOffice of Internal Oversight Services/Inspection and Evaluations Division/Entebbe \n \nReassignment and reclassification of 1 post (1 FS Audit Assistant to be reassigned \nand reclassified as 1 NGS Programme Assistant) from the Internal Audit Division/ \nResident Audit Office of the African Union-United Nations Hybrid Operation in \nDarfur \n \n \n \nAbolishment  \n \n \n \nDepartment of Peace Operations/Single regional political-operational structure/ \nAmericas Division (United Nations Mission for Justice Support in Haiti) \n \nAbolishment of 4 posts (1 P-5 Senior Political Affairs Officer, 2 P-4 Political Affairs \nOfficers, 1 P-2 Associate Political Affairs Officer) \n \n \n \nDepartment of Operational Support/Office of Support Operations/Capacity \nDevelopment and Operational Training Service \n \nAbolishment of 1 post (1 GS (OL) Information Management Assistant) \n \n \n \nDepartment of Operational Support/Office of Supply Chain Management/Uniformed \nCapabilities Support Division \n \nAbolishment of 1 post (1 P-3 Finance Officer) \n \n \n \nDepartment of Operational Support/Office of Supply Chain Management/ \nLogistics Division \n \nAbolishment of 1 post (1 GS (OL) Administrative Assistant) \n \n \n \nDepartment of Operational Support/Office of Supply Chain Management/ \nProcurement Division \n \nAbolishment of 1 post (1 GS (OL) Team Assistant) \n \n \n \nDepartment of Operational Support/Division for Special Activities/Office of \nthe Director \n \nAbolishment of 1 post (1 P-4 Administrative Officer) \n \n\nA/RES/74/280 \nSupport account for peacekeeping operations\n \n20-08788\n6/10 \n \n \n \nOffice of Information and Communications Technology/Operations Support Division \n \nAbolishment of 1 post (1 GS (OL) Information Systems Assistant) \n \n \n \nOffice of Internal Oversight Services/Internal Audit Division/Resident Audit Office of \nthe African Union-United Nations Hybrid Operation in Darfur \n \nAbolishment of 3 posts (1 P-5 Chief Resident Auditor, 1 P-4 Resident Auditor, 1 FS \nAudit Assistant) (as of 1 April 2021) \n \n \n \n \n Abbreviations: FS, Field Service; GS (OL), General Service (Other level); NGS, national \nGeneral Service. \n\nSupport account for peacekeeping operations \nA/RES/74/280\n \n7/10\n20-08788 \n \nAnnex II \n \n \n General temporary assistance positions to be established under the \nsupport account for peacekeeping operations for the period from \n1 July 2020 to 30 June 2021 \n \n \n \nPosition \n \n \nDepartment/office \nOrganizational unit \nNumber \nLevel \nFunction \nStatus \nDepartment of Peace Operations \n \n \n \n \nOffice of the Under-\nSecretary-General/ \nOffice of the \nDirector for \nCoordination and \nShared Services \nExecutive Office \n1 \nP-4 \nHuman Resources Officer \nContinuation \n \n\u2013 \n3 months, \nP-3 \nLeave replacement \nContinuation \n \n\u2013 \n3 months, \nGS (OL) \nLeave replacement \nContinuation \nOffice of Rule of \nLaw and Security \nInstitutions \nJustice and Corrections \nService \n1 \nP-4 \nJudicial Affairs Officer \nContinuation \nPolicy, Evaluation \nand Training \nDivision \nPolicy and Best Practices \nService \n1 \nP-3 \nPolitical Affairs Officer (Action for \nPeacekeeping) \nContinuation \nIntegrated Training Service \n1 \nP-3 \nTraining Officer \nNew \nSubtotal \n4 \n \n \n \nUnited Nations Office to the African Union \n \n \n \n \nAdministrative \nSupport Section \n \n\u2013 \n4 months, \nFS \nLeave replacement \nContinuation \n \n\u2013 \n4 months, \nNGS \nLeave replacement \nContinuation \nSubtotal \n\u2013 \n \n \n \nDepartment of Operational Support \n \n \n \n \nOffice of Support \nOperations \nHealth-Care Management \nand Occupational Safety and \nHealth Division \n1 \nP-4 \nMedical Officer \nContinuation \n1 \nP-4 \nMental Health Officer (post-\ntraumatic stress disorder) \nNew \nHuman Resources Services \nDivision \n10 \nP-3 \nHuman Resources Officer \n(occupational groups) \nContinuation \n \n3 \nGS (OL) \nHuman Resources Assistant \n(occupational groups) \nContinuation \nOffice of Supply \nChain Management \nUniformed Capabilities \nSupport Division \n2 \nP-3 \nFinance and Budget Officer \nContinuation \n1 \nP-4 \nFinance and Budget Officer (post-\ntraumatic stress disorder) \nNew \n1 \nGS (OL) \nFinance and Budget Assistant (post-\ntraumatic stress disorder) \nNew \nEnabling and Outreach \nService \n1 \nGS (OL) \nProcurement Assistant \nContinuation \nDivision of \nAdministration, \nNew York \nHeadquarters Client Support \nService \n\u2013 \n6 months, \nP-4 \nLeave replacement \nNew \nSubtotal \n20 \n \n \n \n\nA/RES/74/280 \nSupport account for peacekeeping operations\n \n20-08788\n8/10 \n \n \nPosition \n \n \nDepartment/office \nOrganizational unit \nNumber \nLevel \nFunction \nStatus \nDepartment of Management Strategy, Policy and Compliance \n \n \nOffice of the Under-\nSecretary-General \nBusiness Partner Service \n\u2013 \n4 months, \nP-3 \nLeave replacement \nContinuation \n \n\u2013 \n4 months, \nGS (OL) \nLeave replacement \nContinuation \nManagement Evaluation Unit \n1 \nP-3 \nLegal Officer \nContinuation \nOffice of Programme \nPlanning, Finance \nand Budget \nFinance Division \n1 \nP-4 \nFinance Officer (accounting policy) \nContinuation \n \n1 \nGS (OL) \nBenefits Assistant (insurance) \nContinuation \nOffice of Human \nResources \nGlobal Strategy and Policy \nDivision \n1 \nP-4 \nProgramme Officer (gender parity) \nContinuation \n1 \nP-3 \nHuman Resources Officer (mobility) \nContinuation \nAdministrative Law Division/ \nConduct and Discipline \nService \n1 \nP-3 \nProgramme Officer \nContinuation \nAdministrative Law Division/ \nAppeals Management Section \n1 \nP-4 \nLegal Officer \nNew \n1 \nP-3 \nLegal Officer \nNew \nBusiness \nTransformation and \nAccountability \nDivision \nAnalytics and Project \nManagement Service \n1 \nP-4 \nManagement and Programme \nAnalyst \nContinuation \nSubtotal \n9 \n \n \n \nOffice of Information and Communications Technology \n \n \n \nEnterprise Solutions \nService \nEnterprise applications centre \u2013 \nAsia (Bangkok office) \n1 \nP-4 \nProject Manager (rations \nmanagement system) \nContinuation \n1  \nP-3 \nInformation Systems Officer (fuel \nmanagement system) \nContinuation \nEnterprise applications centre \u2013 \nAsia (New York office) \n1  \nP-3 \nInformation Systems Officer \n(customer relationship management \nfor the troop-contribution \nmanagement project) \nContinuation \nSubtotal \n3 \n \n \n \nOffice of Internal Oversight Services \n \n \n \n \nExecutive Office \n \n\u2013 \n4 months, \nP-3 \nLeave replacement \nContinuation \n \n\u2013 \n6 months, \nGS (OL) \nLeave replacement \nContinuation \nInvestigations \nDivision \nNew York \n1 \nP-4 \nInvestigator (sexual harassment) \nContinuation \n \n2 \nP-3 \nInvestigator (sexual harassment) \nContinuation \n \n1 \nGS (OL) \nAdministrative Assistant \nContinuation \nNairobi \n1 \nP-4 \nInvestigator (sexual harassment) \nContinuation \n \n2 \nP-3 \nInvestigator (sexual harassment) \nContinuation \nEntebbe \n1 \nNGS \nAdministrative Assistant \nContinuation \n \n2 \nP-3 \nResident Investigator \nContinuation \nUnited Nations Mission in \nSouth Sudan \n1 \nNGS \nAdministrative Assistant \nContinuation \n\nSupport account for peacekeeping operations \nA/RES/74/280\n \n9/10\n20-08788 \n \n \nPosition \n \n \nDepartment/office \nOrganizational unit \nNumber \nLevel \nFunction \nStatus \nUnited Nations \nMultidimensional Integrated \nStabilization Mission in Mali \n1 \nP-5 \nChief Resident Investigator \nContinuation \n1 \nP-4 \nResident Investigator \nContinuation \n2 \nP-3 \nResident Investigator \nContinuation \n \n1 \nNGS \nAdministrative Assistant \nContinuation \nUnited Nations Organization \nStabilization Mission in the \nDemocratic Republic of the \nCongo \n1 \nP-3 \nResident Investigator \nContinuation \nUnited Nations \nMultidimensional Integrated \nStabilization Mission in the \nCentral African Republic \n2 \nP-3 \nResident Investigator \nContinuation \nInternal Audit \nDivision \nUnited Nations \nMultidimensional Integrated \nStabilization Mission in Mali \n1 \nP-4 \nResident Auditor  \nContinuation \n1 \nP-3 \nResident Auditor \nContinuation \nUnited Nations \nMultidimensional Integrated \nStabilization Mission in the \nCentral African Republic \n3 \nP-4 \nResident Auditor \nContinuation \n2 \nP-3 \nResident Auditor  \nContinuation \nSubtotal \n26 \n \n \n \nExecutive Office of the Secretary-General \n \n \n \n \n \n\u2013 \n6 months, \nGS (OL) \nLeave replacement \nContinuation \nSubtotal \n\u2013 \n \n \n \nOffice of the United Nations Ombudsman and Mediation Services \n \nRegional Ombudsman\u2019s Office in Entebbe \n2 \nP-4 \nConflict Resolution Officer \nContinuation \nSubtotal \n2 \n \n \n \nOffice of Legal Affairs \n \n \n \n \nGeneral Legal \nDivision \nAdministration of Justice \nCluster \n\u2013 \n3 months, \nP-4 \nLeave replacement \nContinuation \nSubtotal \n\u2013 \n \n \n \nDepartment of Global Communications \n \n \n \n \nExecutive Office \n \n\u2013 \n1.5 months, \nP-3 \nLeave replacement \nContinuation \n \n\u2013 \n1.5 months, \nGS (OL) \nLeave replacement \nContinuation \nSubtotal \n\u2013 \n \n \n \nDepartment of Safety and Security \n \nOffice of the Under-\nSecretary-General \nExecutive Office \n1 \nP-3 \nAdministrative Officer \nContinuation \n1 \nGS (OL) \nHuman Resources Assistant \nContinuation \nSubtotal \n2 \n \n \n \n\nA/RES/74/280 \nSupport account for peacekeeping operations\n \n20-08788\n10/10 \n \n \nPosition \n \n \nDepartment/office \nOrganizational unit \nNumber \nLevel \nFunction \nStatus \nOffice of the United Nations High Commissioner for Human Rights \n \n \nField Engagement \nDivision \nPeace Missions Support \nSection (Addis Ababa) \n1 \nP-3 \nHuman Rights Officer (United \nNations Office to the African \nUnion) \nContinuation \nThematic \nEngagement, Special \nProcedures and Right \nto Development \nDivision \nMethodology, Education and \nTraining Section (New York) \n1 \nP-4 \nHuman Rights Officer (sexual \nexploitation and abuse) \nContinuation \nSubtotal \n2 \n \n \n \nTotal \n68 \n \nPositions  \nand 50 person-months (positions \nof less than 12 months\u2019 duration)a \n \n \nNote: The specific assignment and location of each of the general temporary assistance positions is set out in the report of the \nSecretary-General on the budget for the support account for peacekeeping operations for the period from 1 July 2020 to \n30 June 2021 (A/74/743) and referenced in the report of the Advisory Committee on Administrative and Budgetary Questions \n(A/74/809). \nAbbreviations: FS, Field Service; GS (OL), General Service (Other level); NGS, national General Service. \n \na Person-months are indicated in the column entitled \u201cLevel\u201d. \n \n \n \n",
  "paragraphs": {
    "1": "Takes note of the report of the Secretary-General on the budget for the support account for peacekeeping operations for the period from 1 July 2020 to 30 June 20212 and the report of the Independent Audit Advisory Committee on the proposed budget of the Office of Internal Oversight Services under the support account for peacekeeping operations for the period from 1 July 2020 to 30 June 2021;3",
    "2": "Reaffirms its role in carrying out a thorough analysis and approval of human and financial resources and policies with a view to ensuring the full, effective and efficient implementation of all mandated programmes and activities and the implementation of policies in this regard;",
    "3": "Also reaffirms that the Fifth Committee is the appropriate Main Committee of the General Assembly entrusted with responsibility for administrative and budgetary matters;",
    "4": "Further reaffirms rule 153 of its rules of procedure;",
    "5": "Reaffirms that the support account funds shall be used for the sole purpose of financing human resources and non-human resources requirements for backstopping and supporting peacekeeping operations at Headquarters, and that any changes in this limitation require the prior approval of the General Assembly;",
    "6": "Also reaffirms the need for adequate funding for the backstopping of peacekeeping operations, as well as the need for full justification for that funding in support account budget submissions;",
    "7": "Further reaffirms the need for effective and efficient administration and financial management of peacekeeping operations, and urges the Secretary-General to continue to identify measures to increase the productivity and efficiency of the support account;",
    "8": "Requests the Secretary-General to ensure the full implementation of the relevant provisions of its resolutions 59/296 of 22 June 2005, 60/266 of 30 June 2006, 61/276 of 29 June 2007, 64/269 of 24 June 2010, 65/289 of 30 June 2011, 66/264 of 21 June 2012, 69/307 of 25 June 2015 and 70/286 of 17 June 2016, as well as other relevant resolutions;",
    "9": "Endorses the conclusions and recommendations contained in the report of the Advisory Committee on Administrative and Budgetary Questions, 4 subject to the provisions of the present resolution, and requests the Secretary-General to ensure their full implementation;",
    "10": "Decides to maintain, for the financial period from 1 July 2020 to 30 June 2021, the funding mechanism for the support account used in the current period, from 1 July 2019 to 30 June 2020, as approved in paragraph 3 of its resolution 50/221 B; Support account for peacekeeping operations A/RES/74/280 3/10 20-08788 Budget performance report for the period from 1 July 2018 to 30 June 2019",
    "11": "Takes note of the report of the Secretary-General on the budget performance of the support account for peacekeeping operations for the period from 1 July 2018 to 30 June 2019;1 Budget estimates for the financial period from 1 July 2020 to 30 June 2021",
    "12": "Approves the support account requirements in the amount of 355,694,200 United States dollars for the financial period from 1 July 2020 to 30 June 2021, inclusive of the amount of 13,381,300 dollars for the enterprise resource planning project, 868,500 dollars for the global service delivery model project, 3,881,600 dollars for peacekeeping capability readiness and 18,053,700 dollars for Umoja maintenance and support costs, including 1,355 continuing posts and 2 new temporary posts, as well as the abolishment, redeployment, reassignment and reclassification of posts, as set out in annex I to the present resolution, and 62 continuing and 6 new general temporary assistance positions and 50 person-months, as set out in annex II, as well as related post and non-post requirements; Financing of the support account for peacekeeping operations for the financial periods from 1 July 2018 to 30 June 2019 and from 1 July 2020 to 30 June 2021",
    "13": "Decides that the requirements for the support account for peacekeeping operations for the financial period from 1 July 2020 to 30 June 2021 shall be financed as follows: (a) The total amount of 1,916,800 dollars, comprising investment revenue of 691,500 dollars, other miscellaneous revenue of 26,200 dollars and the cancellation of prior-period obligations of 1,199,100 dollars in respect of the period from 1 July 2018 to 30 June 2019, to be applied to the resources required for the financial period from 1 July 2020 to 30 June 2021; (b) The amount of 3,802,200 dollars, representing the excess of the authorized level of the Peacekeeping Reserve Fund in respect of the financial period ended 30 June 2019, to be applied to the resources required for the financial period from 1 July 2020 to 30 June 2021; (c) The balance of 349,975,200 dollars to be prorated among the budgets of the active peacekeeping operations for the financial period from 1 July 2020 to 30 June 2021; (d) The net estimated staff assessment income of 28,128,200 dollars, comprising the amount of 26,817,100 dollars for the financial period from 1 July 2020 to 30 June 2021 and the increase of 1,311,100 dollars in respect of the financial period ended 30 June 2019, to be offset against the balance referred to in subparagraph (c) above, to be prorated among the budgets of the individual active peacekeeping operations. 30 June 2020 A/RES/74/280 Support account for peacekeeping operations 20-08788 4/10 Annex I A Posts to be established under the support account for peacekeeping operations for the period from 1 July 2020 to 30 June 2021 Posts Department/office Organizational unit Number Level Function Status Department of Management Strategy, Policy and Compliance Office of Programme Planning, Finance and Budget Field Operations Finance Division 1 GS (OL) Finance and Budget Assistanta New Subtotal 1 Secretariat of the Advisory Committee on Administrative and Budgetary Questions 1 P-4 Administrative Officer New Subtotal 1 Total 2 Note: The specific assignment and location of each of the new posts is set out in the report of the Secretary-General on the budget for the support account for peacekeeping operations for the period from 1 July 2020 to 30 June 2021 (A/74/743) and referenced in the related report of the Advisory Committee on Administrative and Budgetary Questions ( A/74/809). a Post establishment effective as of 1 January 2021. Abbreviations: GS (OL), General Service (Other level). Support account for peacekeeping operations A/RES/74/280 5/10 20-08788 B Redeployment, reassignment, reclassification and abolishment of posts under the support account for peacekeeping operations for the period from 1 July 2020 to 30 June 2021 Redeployment Department of Management Strategy, Policy and Compliance/Office of Programme Planning, Finance and Budget, Finance Division Redeployment of the Trust Fund Management Section from the Programme Planning and Budget Division Office of Internal Oversight Services/Internal Audit Division/Entebbe Redeployment of 2 posts (1 P-4 Resident Auditor, 1 P-3 Resident Auditor) from the Resident Audit Office of the African Union-United Nations Hybrid Operation in Darfur (as of 1 April 2021) Reassignment and downward reclassification Office of Internal Oversight Services/Inspection and Evaluations Division/Entebbe Reassignment and reclassification of 1 post (1 FS Audit Assistant to be reassigned and reclassified as 1 NGS Programme Assistant) from the Internal Audit Division/ Resident Audit Office of the African Union-United Nations Hybrid Operation in Darfur Abolishment Department of Peace Operations/Single regional political-operational structure/ Americas Division (United Nations Mission for Justice Support in Haiti) Abolishment of 4 posts (1 P-5 Senior Political Affairs Officer, 2 P-4 Political Affairs Officers, 1 P-2 Associate Political Affairs Officer) Department of Operational Support/Office of Support Operations/Capacity Development and Operational Training Service Abolishment of 1 post (1 GS (OL) Information Management Assistant) Department of Operational Support/Office of Supply Chain Management/Uniformed Capabilities Support Division Abolishment of 1 post (1 P-3 Finance Officer) Department of Operational Support/Office of Supply Chain Management/ Logistics Division Abolishment of 1 post (1 GS (OL) Administrative Assistant) Department of Operational Support/Office of Supply Chain Management/ Procurement Division Abolishment of 1 post (1 GS (OL) Team Assistant) Department of Operational Support/Division for Special Activities/Office of the Director Abolishment of 1 post (1 P-4 Administrative Officer) A/RES/74/280 Support account for peacekeeping operations 20-08788 6/10 Office of Information and Communications Technology/Operations Support Division Abolishment of 1 post (1 GS (OL) Information Systems Assistant) Office of Internal Oversight Services/Internal Audit Division/Resident Audit Office of the African Union-United Nations Hybrid Operation in Darfur Abolishment of 3 posts (1 P-5 Chief Resident Auditor, 1 P-4 Resident Auditor, 1 FS Audit Assistant) (as of 1 April 2021) Abbreviations: FS, Field Service; GS (OL), General Service (Other level); NGS, national General Service. Support account for peacekeeping operations A/RES/74/280 7/10 20-08788 Annex II General temporary assistance positions to be established under the support account for peacekeeping operations for the period from 1 July 2020 to 30 June 2021 Position Department/office Organizational unit Number Level Function Status Department of Peace Operations Office of the Under- Secretary-General/ Office of the Director for Coordination and Shared Services Executive Office 1 P-4 Human Resources Officer Continuation \u2013 3 months, P-3 Leave replacement Continuation \u2013 3 months, GS (OL) Leave replacement Continuation Office of Rule of Law and Security Institutions Justice and Corrections Service 1 P-4 Judicial Affairs Officer Continuation Policy, Evaluation and Training Division Policy and Best Practices Service 1 P-3 Political Affairs Officer (Action for Peacekeeping) Continuation Integrated Training Service 1 P-3 Training Officer New Subtotal 4 United Nations Office to the African Union Administrative Support Section \u2013 4 months, FS Leave replacement Continuation \u2013 4 months, NGS Leave replacement Continuation Subtotal \u2013 Department of Operational Support Office of Support Operations Health-Care Management and Occupational Safety and Health Division 1 P-4 Medical Officer Continuation 1 P-4 Mental Health Officer (post- traumatic stress disorder) New Human Resources Services Division 10 P-3 Human Resources Officer (occupational groups) Continuation 3 GS (OL) Human Resources Assistant (occupational groups) Continuation Office of Supply Chain Management Uniformed Capabilities Support Division 2 P-3 Finance and Budget Officer Continuation 1 P-4 Finance and Budget Officer (post- traumatic stress disorder) New 1 GS (OL) Finance and Budget Assistant (post- traumatic stress disorder) New Enabling and Outreach Service 1 GS (OL) Procurement Assistant Continuation Division of Administration, New York Headquarters Client Support Service \u2013 6 months, P-4 Leave replacement New Subtotal 20 A/RES/74/280 Support account for peacekeeping operations 20-08788 8/10 Position Department/office Organizational unit Number Level Function Status Department of Management Strategy, Policy and Compliance Office of the Under- Secretary-General Business Partner Service \u2013 4 months, P-3 Leave replacement Continuation \u2013 4 months, GS (OL) Leave replacement Continuation Management Evaluation Unit 1 P-3 Legal Officer Continuation Office of Programme Planning, Finance and Budget Finance Division 1 P-4 Finance Officer (accounting policy) Continuation 1 GS (OL) Benefits Assistant (insurance) Continuation Office of Human Resources Global Strategy and Policy Division 1 P-4 Programme Officer (gender parity) Continuation 1 P-3 Human Resources Officer (mobility) Continuation Administrative Law Division/ Conduct and Discipline Service 1 P-3 Programme Officer Continuation Administrative Law Division/ Appeals Management Section 1 P-4 Legal Officer New 1 P-3 Legal Officer New Business Transformation and Accountability Division Analytics and Project Management Service 1 P-4 Management and Programme Analyst Continuation Subtotal 9 Office of Information and Communications Technology Enterprise Solutions Service Enterprise applications centre \u2013 Asia (Bangkok office) 1 P-4 Project Manager (rations management system) Continuation 1 P-3 Information Systems Officer (fuel management system) Continuation Enterprise applications centre \u2013 Asia (New York office) 1 P-3 Information Systems Officer (customer relationship management for the troop-contribution management project) Continuation Subtotal 3 Office of Internal Oversight Services Executive Office \u2013 4 months, P-3 Leave replacement Continuation \u2013 6 months, GS (OL) Leave replacement Continuation Investigations Division New York 1 P-4 Investigator (sexual harassment) Continuation 2 P-3 Investigator (sexual harassment) Continuation 1 GS (OL) Administrative Assistant Continuation Nairobi 1 P-4 Investigator (sexual harassment) Continuation 2 P-3 Investigator (sexual harassment) Continuation Entebbe 1 NGS Administrative Assistant Continuation 2 P-3 Resident Investigator Continuation United Nations Mission in South Sudan 1 NGS Administrative Assistant Continuation Support account for peacekeeping operations A/RES/74/280 9/10 20-08788 Position Department/office Organizational unit Number Level Function Status United Nations Multidimensional Integrated Stabilization Mission in Mali 1 P-5 Chief Resident Investigator Continuation 1 P-4 Resident Investigator Continuation 2 P-3 Resident Investigator Continuation 1 NGS Administrative Assistant Continuation United Nations Organization Stabilization Mission in the Democratic Republic of the Congo 1 P-3 Resident Investigator Continuation United Nations Multidimensional Integrated Stabilization Mission in the Central African Republic 2 P-3 Resident Investigator Continuation Internal Audit Division United Nations Multidimensional Integrated Stabilization Mission in Mali 1 P-4 Resident Auditor Continuation 1 P-3 Resident Auditor Continuation United Nations Multidimensional Integrated Stabilization Mission in the Central African Republic 3 P-4 Resident Auditor Continuation 2 P-3 Resident Auditor Continuation Subtotal 26 Executive Office of the Secretary-General \u2013 6 months, GS (OL) Leave replacement Continuation Subtotal \u2013 Office of the United Nations Ombudsman and Mediation Services Regional Ombudsman\u2019s Office in Entebbe 2 P-4 Conflict Resolution Officer Continuation Subtotal 2 Office of Legal Affairs General Legal Division Administration of Justice Cluster \u2013 3 months, P-4 Leave replacement Continuation Subtotal \u2013 Department of Global Communications Executive Office \u2013 1.5 months, P-3 Leave replacement Continuation \u2013 1.5 months, GS (OL) Leave replacement Continuation Subtotal \u2013 Department of Safety and Security Office of the Under- Secretary-General Executive Office 1 P-3 Administrative Officer Continuation 1 GS (OL) Human Resources Assistant Continuation Subtotal 2 A/RES/74/280 Support account for peacekeeping operations 20-08788 10/10 Position Department/office Organizational unit Number Level Function Status Office of the United Nations High Commissioner for Human Rights Field Engagement Division Peace Missions Support Section (Addis Ababa) 1 P-3 Human Rights Officer (United Nations Office to the African Union) Continuation Thematic Engagement, Special Procedures and Right to Development Division Methodology, Education and Training Section (New York) 1 P-4 Human Rights Officer (sexual exploitation and abuse) Continuation Subtotal 2 Total 68 Positions and 50 person-months (positions of less than 12 months\u2019 duration)a Note: The specific assignment and location of each of the general temporary assistance positions is set out in the report of the Secretary-General on the budget for the support account for peacekeeping operations for the period from 1 July 2020 to 30 June 2021 (A/74/743) and referenced in the report of the Advisory Committee on Administrative and Budgetary Questions (A/74/809). Abbreviations: FS, Field Service; GS (OL), General Service (Other level); NGS, national General Service. a Person-months are indicated in the column entitled \u201cLevel\u201d."
  },
  "agenda_items": [
    "Item 148"
  ],
  "symbol_references": []
}