{
  "symbol": "A/RES/76/192",
  "filename": "A_RES_76_192.pdf",
  "title": "76/192. International financial system and development",
  "text": "United Nations \nA/RES/76/192\n \n \nGeneral Assembly \nDistr.: General \n10 January 2022 \n \n21-19247 (E)    140122 \n*2119247* \n \n \nSeventy-sixth session \nAgenda item 18 (b) \nMacroeconomic policy questions: international financial \nsystem and development \n \n \n \n \n Resolution adopted by the General Assembly \non 17 December 2021 \n \n \n \n \n[on the report of the Second Committee (A/76/531/Add.2, para. 7)] \n \n \n 76/192. International financial system and development \n \n \n \nThe General Assembly, \n \nRecalling its resolutions 55/186 of 20 December 2000 and 56/181 of \n21 December 2001, entitled \u201cTowards a strengthened and stable international \nfinancial architecture responsive to the priorities of growth and development, \nespecially in developing countries, and to the promotion of economic and social \nequity\u201d, as well as its resolutions 57/241 of 20 December 2002, 58/202 of \n23 December 2003, 59/222 of 22 December 2004, 60/186 of 22 December 2005, \n61/187 of 20 December 2006, 62/185 of 19 December 2007, 63/205 of 19 December \n2008, 64/190 of 21 December 2009, 65/143 of 20 December 2010, 66/187 of \n22 December 2011, 67/197 of 21 December 2012, 68/201 of 20 December 2013, \n69/206 of 19 December 2014, 70/188 of 22 December 2015, 71/215 of 21 December \n2016, 72/203 of 20 December 2017, 73/220 of 20 December 2018, 74/202 of \n19 December 2019 and 75/204 of 21 December 2020,  \n \nReaffirming its resolution 70/1 of 25 September 2015, entitled \u201cTransforming \nour world: the 2030 Agenda for Sustainable Development\u201d, in which it adopted a \ncomprehensive, far-reaching and people-centred set of universal and transformative \nSustainable Development Goals and targets, its commitment to working tirelessly for \nthe full implementation of the Agenda by 2030, its recognition that eradicating \npoverty in all its forms and dimensions, including extreme poverty, is the greatest \nglobal challenge and an indispensable requirement for sustainable development, its \ncommitment to achieving sustainable development in its three dimensions \u2013 \neconomic, social and environmental \u2013 in a balanced and integrated manner, and to \nbuilding upon the achievements of the Millennium Development Goals and seeking \nto address their unfinished business, \n \nReaffirming also its resolution 69/313 of 27 July 2015 on the Addis Ababa \nAction Agenda of the Third International Conference on Financing for Development, \n\nA/RES/76/192 \nInternational financial system and development\n \n21-19247\n2/11 \n \nwhich is an integral part of the 2030 Agenda for Sustainable Development, supports \nand complements it, helps to contextualize its means of implementation targets with \nconcrete policies and actions, and reaffirms the strong political commitment to \naddress the challenge of financing and creating an enabling environment at all levels \nfor sustainable development in the spirit of global partnership and solidarity, \n \nRecalling the Doha Declaration on Financing for Development: outcome \ndocument of the Follow-up International Conference on Financing for Development \nto Review the Implementation of the Monterrey Consensus, held in Doha from \n29 November to 2 December 2008,1 \n \nRecalling also the United Nations Millennium Declaration, 2  its resolution \n56/210 B of 9 July 2002, in which it endorsed the Monterrey Consensus of the \nInternational Conference on Financing for Development, 3 the Rio Declaration on \nEnvironment and Development, 4  Agenda 21, 5  the Programme for the Further \nImplementation of Agenda 216 and the Plan of Implementation of the World Summit \non Sustainable Development,7 \n \nRecalling further the Conference on the World Financial and Economic Crisis \nand Its Impact on Development and its outcome document, 8 recognizing the work \nundertaken by the Ad Hoc Open-ended Working Group of the General Assembly to \nfollow up on the issues contained in the Outcome of the Conference, and recalling its \nprogress report,9 \n \nRecalling the United Nations Conference on Sustainable Development, held in \nRio de Janeiro, Brazil, from 20 to 22 June 2012, and its outcome document, entitled \n\u201cThe future we want\u201d,10 \n \nAppreciating the fact that the Summit of the Group of 20 held in Hangzhou, \nChina, on 4 and 5 September 2016, with the broad participation of developing \ncountries, including the Chair of the Group of 77, endorsed the Group of 20 Action \nPlan on the 2030 Agenda for Sustainable Development as an important contribution \nto the global implementation of the 2030 Agenda, recalling that the Summit of the \nGroup of 20 held in Hamburg, Germany, on 7 and 8 July 2017 endorsed the Hamburg \nUpdate: Taking Forward the Group of 20 Action Plan on the 2030 Agenda for \nSustainable Development, recalling also that the Summit of the Group of 20 held in \nBuenos Aires on 30 November and 1 December 2018 endorsed the Buenos Aires \nUpdate: Moving Forward the Group of 20 Action Plan on the 2030 Agenda for \nSustainable Development, recalling further that the Summit of the Group of 20 held \nin Osaka, Japan, on 28 and 29 June 2019 endorsed the Osaka Update on the Group of \n20 Action Plan on the 2030 Agenda for Sustainable Development, recalling that the \nSummit of the Group of 20, held virtually on 21 and 22 November 2020, endorsed \n__________________ \n \n1  Resolution 63/239, annex. \n \n2  Resolution 55/2. \n \n3  Report of the International Conference on Financing for Development, Monterrey, Mexico, \n18\u221222 March 2002 (United Nations publication, Sales No. E.02.II.A.7), chap. I, resolution 1, \nannex. \n \n4  Report of the United Nations Conference on Environment and Development, Rio de Janeiro, \n3\u221214 June 1992, vol. I, Resolutions Adopted by the Conference (United Nations publication, \nSales No. E.93.I.8 and corrigendum), resolution 1, annex I. \n \n5  Ibid., annex II. \n \n6  Resolution S-19/2, annex. \n \n7  Report of the World Summit on Sustainable Development, Johannesburg, South Africa, \n26 August\u20134 September 2002 (United Nations publication, Sales No. E.03.II.A.1 and \ncorrigendum), chap. I, resolution 2, annex. \n \n8  Resolution 63/303, annex. \n \n9  A/64/884. \n \n10  Resolution 66/288, annex. \n\nInternational financial system and development \nA/RES/76/192\n \n3/11\n21-19247 \n \nthe Riyadh Update on the Group of 20 Action Plan on the 2030 Agenda for Sustainable \nDevelopment, and looking forward to their implementation, while urging the Group \nof 20 to continue to engage in an inclusive and transparent manner with other States \nMembers of the United Nations in its work in order to ensure that the initiatives of \nthe Group of 20 complement or strengthen the United Nations system, \n \nNoting the holding of the twenty-fourth Saint Petersburg International \nEconomic Forum in Saint Petersburg, Russian Federation, from 2 to 5 June 2021, and \nnoting also the Financing for Development in the Era of COVID-19 and Beyond \nInitiative,  \n \nNoting with great concern the severe negative impact on human health, safety \nand well-being caused by the coronavirus disease (COVID-19) pandemic, as well as \nthe severe disruption to societies and economies and the devastating impact on lives \nand livelihoods, and that the poorest and most vulnerable are the hardest hit by the \npandemic, reaffirming the ambition to get back on track to achieve the Sustainable \nDevelopment Goals by designing and implementing sustainable and inclusive \nrecovery strategies to accelerate progress towards the full implementation of the \n2030 Agenda for Sustainable Development and to help to reduce the risk of and build \nresilience to future shocks, crises and pandemics, including by strengthening health \nsystems and achieving universal health coverage, and recognizing that equitable and \ntimely access for all to safe, quality, effective and affordable COVID-19 vaccines, \ntherapeutics and diagnostics are an essential part of a global response based on unity, \nsolidarity, renewed multilateral cooperation and the principle of leaving no one \nbehind, \n \nNoting with great concern also that the COVID-19 pandemic, and the social and \neconomic crisis that it has triggered, has amplified underlying risks in the \ninternational financial system and brought to the fore the growing importance of \nnon-economic risks, including climate risks, as well as opportunities and risks \nassociated with the rapid digitization of the economy, that women, young people and \ninformal and low-skilled workers face a higher share of job losses, that many micro-, \nsmall and medium-sized enterprises have had to close or are at risk of closing amid \nuncertain prospects for economic recovery and the emergence of new variants of the \ncoronavirus, that most developing countries lack the resources to implement large-\nscale monetary and fiscal policy responses and that debt risks and liquidity constraints \nremain elevated for many developing countries, leading to a risk of a diverging and \nuneven recovery, while recognizing the steps that the international community, \nincluding the International Monetary Fund, the World Bank and the Group of 20, \nalong with regional financial arrangements and development banks, has taken to \nrespond to the crisis through increased global liquidity and debt relief measures for \nthe poorest countries, and recognizing that the COVID-19 crisis has exposed gaps and \nvulnerabilities in the international system and underscored the importance of \nstrengthening the global financial safety net and the need to work together to help to \nbuild a more resilient and sustainable global economy and that more remains to be \ndone, also noting that the scale and prolonged duration of the crisis call for continued \nconcerted and inclusive efforts to mitigate the impacts of the pandemic on economies \nand people and to ensure a more inclusive, sustainable and resilient recovery, \n \nRecognizing that the COVID-19 pandemic and the remaining effects of the \nworld financial and economic crisis have undermined debt sustainability and progress \ntowards achieving the internationally agreed development goals, including the \nSustainable Development Goals, especially in developing countries, and stressing the \nneed to better prepare for such crises that may happen in the future, including by \naddressing the lessons learned, improving confidence, sustaining economic growth \nand promoting full and productive employment and decent work for all women and \n\nA/RES/76/192 \nInternational financial system and development\n \n21-19247\n4/11 \n \nmen, including young people, older persons and people with disabilities, and by \ncontinuing to promote global economic stability and the underlying institutional \nreforms required to achieve the Sustainable Development Goals, \n \nExpressing concern about the adverse impact of the continuing fragility of the \nglobal economy, the slow pace of the restoration of global growth and trade, \nincreasing protectionism and inward-looking policies, with increasing systemic risks \nthat threaten financial stability, including in developing countries, \n \nExpressing concern also at the continued decline in correspondent banking \nrelationships, impacting the ability to send and receive international payments, with \npotential consequences for the cost of remittances, financial inclusion and \ninternational trade, among other areas, and thus for the achievement of the Sustainable \nDevelopment Goals, \n \nReaffirming the purposes of the United Nations, as set forth in its Charter, \nincluding to achieve international cooperation in solving international problems of an \neconomic, social, cultural or humanitarian character and to be a centre for \nharmonizing the actions of nations in the attainment of common ends, and reiterating \nthe need to strengthen the leadership role of the United Nations in promoting \ndevelopment, \n \nRecognizing the contribution of the original and reconvened Panel of Eminent \nPersons of the United Nations Conference on Trade and Development in the context \nof the United Nations sustainable development pillar and United Nations reform, as \nwell as the contribution of the United Nations system to sustainable finance and \ninvestments in the Sustainable Development Goals, and recognizing also the \ncontribution of the independent team of advisers to the Economic and Social Council \ndialogue on the longer-term positioning of the United Nations development system in \nthe context of the implementation of the 2030 Agenda, \n \nRecognizing also that adequate incentives for international investors to adopt \nlonger-term investment strategies can support the achievement of sustainable \ndevelopment and potentially reduce capital market volatility, \n \nEmphasizing that the international financial system should bolster sustainable, \ninclusive and sustained economic growth, sustainable development and job creation, \npromote financial inclusion and support efforts to eradicate poverty in all its forms \nand dimensions, including extreme poverty, and hunger, in particular in developing \ncountries, while allowing for the coherent mobilization of all sources of financing for \ndevelopment, \n \nTaking note of the work of the United Nations in the area of external debt \nsustainability and development, \n \nRecognizing the importance of scaling up international tax cooperation, and in \nthis regard welcoming the work of the Committee of Experts on International \nCooperation in Tax Matters and the support to tax authorities of developing countries \nthrough the Addis Tax Initiative, which contribute to the mobilization of domestic \nresources for the Sustainable Development Goals and the curbing of illicit financial \nflows and tax evasion, \n \nRecognizing also the need to reduce mechanistic reliance on credit-rating \nagency assessments, including in regulations, and to promote increased competition \nas well as measures to avoid conflict of interest in the provision of credit ratings in \norder to improve the quality of ratings, acknowledging the efforts of the Financial \nStability Board and others in this area, expressing support for establishing greater \ntransparency requirements for evaluation standards of credit-rating agencies, and \naffirming the commitment to continue ongoing work on these issues, \n\nInternational financial system and development \nA/RES/76/192\n \n5/11\n21-19247 \n \n \nAcknowledging the 2016 implementation of quota and governance reforms at \nthe International Monetary Fund and the 2018 agreement on shareholding reforms at \nthe World Bank Group, including a general capital increase, a selective capital \nincrease and a financial sustainability framework, the conclusion of the fifteenth \ngeneral quota review by the Board of Governors of the Fund in February 2020, and \nan early twentieth replenishment process of the International Development \nAssociation, to be concluded in December 2021, and acknowledging also that, in \nOctober 2016, the Chinese renminbi officially became the fifth currency in the special \ndrawing rights basket, pursuant to the decision taken by the Executive Board of the \nFund in November 2015,  \n \n1. \nTakes note of the report of the Secretary-General;11 \n \n2. \nRecognizes the need to continue and intensify efforts to enhance the \ncoherence and consistency of the international monetary, financial and trading systems, \nreiterates the importance of ensuring their openness, fairness and inclusiveness in \norder to complement national efforts to ensure sustainable development, including \nstrong, sustained, balanced, inclusive and equitable economic growth, and that all \nmen and women, in particular the poor and vulnerable, have equal rights to economic \nresources and appropriate financial services, and the achievement of the internationally \nagreed development goals, including the Sustainable Development Goals, and \nencourages the international financial institutions to align their programmes and \npolicies with the 2030 Agenda for Sustainable Development 12 in accordance with \ntheir mandates; \n \n3. \nNotes that the United Nations, on the basis of its universal membership \nand legitimacy, provides a unique and key forum for discussing international \neconomic issues and their impact on development, and reaffirms that the United \nNations is well positioned to participate in various reform processes aimed at \nimproving and strengthening the effective functioning of the international financial \nsystem and architecture, while recognizing that the United Nations and the \ninternational financial institutions have complementary mandates that make the \ncoordination of their actions crucial; \n \n4. \nRecognizes the important efforts undertaken nationally, regionally and \ninternationally to respond to the challenges posed by the latest global financial and \neconomic crisis, and also recognizes that more needs to be done in order to promote \nthe economic recovery, to manage the consequences of volatility in global financial \nand commodity markets, to tackle high unemployment and rising indebtedness in \nmany countries, as well as widespread fiscal strains, to reinforce the banking sector, \nincluding by increasing its transparency and accountability, to address systemic \nfragilities and imbalances, to reform and strengthen the international financial system \nand to continue and to enhance the coordination of financial and economic policies at \nthe international level; \n \n5. \nAcknowledges that endeavours to overcome the crisis must go beyond \nshort-term relief, and recognizes the need for continued action to support the \ndeveloping countries, including middle-income countries, that are most in need, on \nan inclusive basis, including through enhanced cooperation between the United \nNations and international financial institutions and multilateral and regional \ndevelopment banks, according to their respective mandates, net positive flows from \nthe international financial institutions to developing countries, sufficient concessional \nfinance by, inter alia, enhancing access to concessional, long-term loans and \ndevelopment assistance while mobilizing catalytically additional resources from the \n__________________ \n \n11  A/76/230. \n \n12  Resolution 70/1. \n\nA/RES/76/192 \nInternational financial system and development\n \n21-19247\n6/11 \n \nprivate sector and assisting developing countries in addressing debt vulnerability in \nthe immediate term and in attaining debt sustainability in the long term, recommends \nthe full and transparent implementation by all official bilateral creditors of the Group \nof 20 Debt Service Suspension Initiative along with its extension until December \n2021, and the orderly, timely and effective implementation of the Common \nFramework for Debt Treatments beyond the Debt Service Suspension Initiative, \nendorsed at the leaders\u2019 summit hosted by Saudi Arabia on COVID-19 and negotiated \nfurther under the presidency of Italy, noting the need for greater collaboration of \ncredit rating agencies in this regard, welcomes existing liquidity support for countries \nwith liquidity constraints, for example the International Monetary Fund Catastrophe \nContainment and Relief Trust, which has provided 851 million United States dollars \nto 29 countries as of end-October 2021, also welcomes the International Monetary \nFund\u2019s special drawing rights allocation of the equivalent of 650 billion dollars of \n23 August 2021 to meet the long-term global need to supplement reserve assets, and \nencourages countries with strong external positions to seek options for voluntary \nchannelling of special drawing rights, in accordance with national laws and \nregulations, and to this end appreciates the Fund\u2019s efforts to seek further viable \noptions for the voluntary channelling of special drawing rights to countries most in \nneed, such as the Poverty Reduction and Growth Trust and the new Resilience and \nSustainability Trust of the Fund, with a view to providing affordable long-term \nfinancing to developing countries in a manner that preserves their external debt \nsustainability, and encourages the consideration of viable options to voluntarily \nchannel through multilateral development banks;  \n \n6. \nStresses the critical importance of a stable, inclusive and enabling global \neconomic environment for the advancement of sustainable development, for the \nreliable and effective financing of development and for the implementation of the \n2030 Agenda, mobilizing public and private, as well as domestic and international \nresources;  \n \n7. \nNotes the need for open, inclusive and transparent discussions on the \nmodernization of official development assistance measurement and on the proposed \nmeasure of \u201ctotal official support for sustainable development\u201d, and reaffirms that \nany such measure will not dilute commitments already made; \n \n8. \nReiterates that debtors and creditors, including both public and private, \nmust work together in a transparent manner to prevent and resolve unsustainable debt \nsituations and that maintaining sustainable debt levels is the responsibility of the \nborrowing countries, acknowledging, however, that lenders also have a responsibility \nto lend in a way that does not undermine a country\u2019s debt sustainability, and in this \nregard takes note of the United Nations Conference on Trade and Development \nprinciples on responsible sovereign lending and borrowing and recognizes the \napplicable requirements of the International Monetary Fund debt limits policy and/or \nthe World Bank non-concessional borrowing policy, as well as the safeguards of the \nDevelopment Assistance Committee of the Organisation for Economic Co-operation \nand Development in its statistical system to enhance the debt sustainability of \nrecipient countries, and will work towards a global consensus on guidelines for debtor \nand creditor responsibilities in borrowing by and lending to sovereigns, building on \nexisting initiatives; \n \n9. \nInvites, in this regard, the President of the General Assembly and the \nSecretary-General to give appropriate consideration to the central role of maintaining \nand facilitating the financial and macroeconomic stability of developing countries, \nincluding debt sustainability, and of supporting an appropriately enabling domestic \nand international economic, financial and regulatory environment for the means of \nimplementation of the 2030 Agenda, including financial inclusion, and in this regard \n\nInternational financial system and development \nA/RES/76/192\n \n7/11\n21-19247 \n \ninvites all major institutional stakeholders, including the International Monetary \nFund, the World Bank and the United Nations Conference on Trade and Development, \nto support these efforts, in accordance with their respective mandates; \n \n10. Encourages, in this regard, the Economic and Social Council to consider, \nat its annual forum on financing for development follow-up, a dedicated discussion \nand analysis of systemic issues and challenges, taking into account the roles of the \ninternational financial institutions, including the International Monetary Fund, and of \nthe United Nations Conference on Trade and Development, in accordance with their \nrespective mandates, pursuant to the relevant resolutions on this matter, including its \nresolution 69/313 on the Addis Ababa Action Agenda of the Third International \nConference on Financing for Development and the mandate of the annual forum on \nfinancing for development follow-up set out therein; \n \n11. \nResolves to strengthen the coherence and consistency of multilateral \nfinancial, investment, trade and development policy and environment institutions and \nplatforms and to increase cooperation between major international institutions, while \nrespecting mandates and governance structures, and commits itself to taking better \nadvantage of relevant United Nations forums for promoting universal and holistic \ncoherence and international commitments to sustainable development, building on \nthe vision of the Monterrey Consensus, with a view to supporting the implementation \nof the Addis Ababa Action Agenda and the 2030 Agenda; \n \n12. Recalls that countries must have, in accordance with their specific needs \nand circumstances, the flexibility necessary to implement countercyclical measures \nand pursue tailored and targeted responses to the various types of shocks, including \neconomic and financial crises, notes that, in the 2018 International Monetary Fund \nreview of programme design and conditionality, it was found that the number of \nstructural conditions included in programmes of the Fund had increased over time, \nand calls for the Fund to build on recent progress to further prioritize reforms and \nstreamline conditions to ensure that they are timely, tailored and targeted, in \naccordance with national circumstances and priorities, and that they support \ndeveloping countries in the face of financial, economic and development challenges, \nwhile also noting that new and ongoing programmes should not contain unwarranted \nprocyclical conditionalities; \n \n13. Notes, in this regard, the new strategy of the International Monetary Fund \nfor engagement on social spending, welcomes the Fund\u2019s recognition of the adverse \nimpacts that fiscal adjustment could have on the vulnerable, for whom social spending \nis critical to achieving the commitments under the 2030 Agenda, including nationally \nappropriate social protection systems and measures for all, including floors, and \nencourages greater collaboration on social protection finance between the Fund and \ninternational development institutions; \n \n14. Invites the multilateral development banks and other international \ndevelopment banks to continue to provide both concessional and non-concessional, \nstable, long-term development finance by leveraging contributions and capital and by \nmobilizing resources for developing countries from multiple sources, for example \nfrom capital markets, and stresses that development banks should make optimal use \nof their resources and balance sheets, consistent with maintaining their financial \nintegrity, and should update and develop their policies in support of the 2030 Agenda, \nincluding the Sustainable Development Goals, as appropriate; \n \n15. Welcomes, in this regard, the ongoing work of the New Development Bank \nand the Asian Infrastructure Investment Bank in the global development finance \narchitecture, and encourages enhanced regional and subregional cooperation, \n\nA/RES/76/192 \nInternational financial system and development\n \n21-19247\n8/11 \n \nincluding through regional and subregional development banks, commercial and \nreserve currency arrangements and other regional and subregional initiatives; \n \n16. Encourages, in this regard, the multilateral development banks to continue \nto move forward on flexible, concessional, fast-disbursing and front-loaded assistance \nthat will substantially and quickly assist developing countries facing financing gaps \nin their efforts to achieve the Sustainable Development Goals, taking into \nconsideration the individual absorptive capacities and debt sustainability of those \ncountries, and invites shareholders of regional development banks to ensure that they \nare sufficiently capitalized so as to be able to meet those needs; \n \n17. Also encourages the multilateral development banks, within their \nrespective mandates, to continue to expand technical assistance, disseminate and \nshare their knowledge and best practices and enhance the multiplier effect of their \nfinancing by leveraging more resources from more sources, including by mobilizing \nprivate investment, to provide innovative and integral solutions to multidimensional \ndevelopment problems, in particular in developing and emerging economies; \n \n18. Recognizes the need for the international financial institutions, as \nappropriate, to promote gender mainstreaming in their policies and programmes, \nincluding macroeconomic, job creation and structural reform policies and \nprogrammes, in accordance with relevant national priorities and strategies; \n \n19. Urges multilateral donors and invites the international financial \ninstitutions and regional development banks, within their respective mandates, to \nreview and implement policies that support national efforts to ensure that a higher \nproportion of resources reach women and girls, in particular in rural and remote areas, \nand invites multilateral and regional development banks to agree on common \nindicators for analysing the gender impact of their lending; \n \n20. Recognizes that it is important that the International Monetary Fund \ncontinue to be adequately resourced, and supports and reiterates its commitment to \nfurther governance reform at both the Fund and the World Bank to adapt to changes \nin the global economy; \n \n21. Notes the lack of progress on a quota increase under the fifteenth general \nreview of quotas of the International Monetary Fund, but welcomes the political \nagreement reached on the review by the Board of Governors on the occasion of the \nfortieth meeting of the International Monetary and Financial Committee, held in \nWashington, D.C., on 18 and 19 October 2019, as well as the support garnered for \nmaintaining the Fund\u2019s current resource envelope with a doubling of the New \nArrangements to Borrow and a further temporary round of bilateral borrowing beyond \n2020; \n \n22. Recalls the commitment to revisiting the adequacy of quotas and \ncontinuing the process of International Monetary Fund governance reform under the \nsixteenth general review of quotas, including a new quota formula as a guide, with \nthe review to be extended from 2020 to no later than 15 December 2023, and the \ncommitment to ensuring the primary role of quotas in Fund resources, and that any \nadjustment in quota shares would be expected to result in increases in the quota shares \nof dynamic economies in line with their relative positions in the world economy and \nhence likely in the share of emerging market and developing countries as a whole, \nwhile protecting the voice and representation of the poorest members, and recommits \nitself to the broadening and strengthening of the voice and participation of developing \ncountries, including African countries, the least developed countries, landlocked \ndeveloping countries, small island developing States, middle-income countries and \ncountries in conflict and post-conflict situations, in international economic decision-\nmaking, norm-setting and global economic governance; \n\nInternational financial system and development \nA/RES/76/192\n \n9/11\n21-19247 \n \n \n23. Encourages Member States to work together to strengthen and improve a \nsystem in which different layers of the global financial safety net are closely \ncoordinated and have clear assignments of responsibilities and to consider enhancing \nregional financial arrangements to help countries to weather shocks, strengthen their \ncapacity to detect risk and create new regional arrangements where there are not \nsufficient institutions in place; \n \n24. Acknowledges the importance of the international financial institutions \nsupporting, in line with their mandates, the policy space of each country, while \nremaining consistent with relevant international rules and commitments, in particular \ndeveloping countries; \n \n25. Reaffirms that cohesive, nationally owned sustainable development \nstrategies, supported by integrated national financing frameworks, will be at the heart \nof efforts, reiterates that each country has primary responsibility for its own economic \nand social development and that the role of national policies and development \nstrategies cannot be overemphasized, expresses respect for each country\u2019s policy \nspace and leadership to implement policies for the eradication of poverty in all its \nforms and dimensions and for sustainable development, while remaining consistent \nwith relevant international rules and commitments, at the same time recognizes that \nnational development efforts need to be supported by an enabling international \neconomic environment, including coherent and mutually supporting world trade, \nmonetary and financial systems and strengthened and enhanced global economic \ngovernance, and that processes to develop and facilitate the availability of appropriate \nknowledge and technologies globally, as well as capacity-building, are also critical, \nand commits to pursuing policy coherence and an enabling environment for \nsustainable development at all levels and by all actors, and to reinvigorating the \nGlobal Partnership for Sustainable Development; \n \n26. Recommits itself to a redoubling of its efforts to substantially reduce illicit \nfinancial flows by 2030, with a view to eventually eliminating them, including by \ncombating tax evasion and corruption through strengthened national regulation and \nincreased international cooperation; \n \n27. Recognizes the role of special drawing rights as an international reserve \nasset, acknowledges that special drawing rights allocations helped to supplement \ninternational reserves in response to the world financial and economic crisis, thus \ncontributing to the stability of the international financial system and global economic \nresilience, and supports the continued examination of the broader use of special \ndrawing rights as a way to enhance the resilience of the international monetary \nsystem, including with reference to their potential role in the international reserve \nsystem; \n \n28. Notes the rapid development of cryptoassets and the potential systemic \nimplications of these private assets on the functioning of the international monetary \nsystem, the ability of regulators to protect consumers and promote financial stability \nand the ability of central banks to effectively use monetary policy to pursue domestic \neconomic objectives, encourages promoters of such assets to work with regulators on \nfinancial regulations in markets where their assets are used, and urges regulators to \ncarefully consider the potential implications for the international and domestic \nfinancial system when formulating the appropriate regulatory treatment for \ncryptoassets in their jurisdictions; \n \n29. Looks forward to the results of the ongoing work by the Financial Stability \nBoard and the Financial Action Task Force on global stablecoins, underlining the need \nto appropriately address the risks associated with them and other similar arrangements \nwith potential systemic footprints before these projects can commence operation; \n\nA/RES/76/192 \nInternational financial system and development\n \n21-19247\n10/11 \n \n \n30. Notes the work by the Financial Stability Board on financial market \nreform, commits itself to sustaining or strengthening frameworks for macroprudential \nregulation and countercyclical buffers, reaffirms the commitment to hastening the \ncompletion of the reform agenda on financial market regulation, including assessing \nand if necessary reducing the systemic risks associated with non-bank financial \nintermediation, markets for derivatives, securities lending and repurchase agreements, \nand also reaffirms the commitment to addressing the risk created by \u201ctoo-big-to-fail\u201d \nfinancial institutions and to addressing cross-border elements in the effective \nresolution of troubled, systemically important financial institutions; \n \n31. Also notes that there are growing risks outside the regulatory framework, \nincluding through non-bank financial institutions and financial technology, and calls \nupon financial regulators to increasingly shift towards examining the underlying risks \nassociated with financial activity rather than the type of financial institution; \n \n32. Calls upon financial regulators to encourage financial institutions to \nexplore new opportunities to improve their ability to better manage risks, including \nthrough anti-money-laundering and countering the financing of terrorism measures, \nas well as through the greater use of technology to help to address the costs and risks \nof operating correspondent banking relationships; \n \n33. Emphasizes the relevance of inclusion in the international financial system \nat all levels and the importance of considering financial inclusion as a policy objective \nin financial regulation, in accordance with national priorities and legislation; \n \n34. Reiterates that effective, inclusive multilateral surveillance should be at \nthe centre of crisis prevention efforts, stresses the need to continue to strengthen \nsurveillance of the financial policies of countries, and in this regard notes the current \nefforts to update the surveillance approach of the International Monetary Fund to \nbetter integrate bilateral and multilateral surveillance, along with cross-border and \ncross-sectoral linkages with macroeconomic and macroprudential policies, while \npaying closer attention to the spillover effects from national economic and financial \npolicies on to the global economy; \n \n35. Notes the potential for source countries of capital flows to use appropriate \ncombinations of macroeconomic, macroprudential and regulatory policies that avoid \nexcessive leverage and large international spillovers in the form of capital flow \nvolatility, while still meeting domestic macroeconomic objectives, encourages source \ncountries to consider such policies, and calls for greater macroeconomic coordination \namong systemically important economies, which can also help to address global \nfinancial market volatility; \n \n36. Invites the international financial and banking institutions, in consultation \nwith national Governments, to develop tailored guidelines on how countries can \nattract long-term international investments, guided by the 2030 Agenda, in line with \nnational plans and policies, and with a view to minimizing the adverse effects of \ncapital market volatility; \n \n37. Reiterates the need to resolve to reduce mechanistic reliance on credit-\nrating agency assessments, including in regulations, and to promote increased \ncompetition as well as measures to avoid conflict of interest in the provision of credit \nratings; \n \n38. Invites the international financial and banking institutions to continue to \nenhance the transparency and analytical rigour of risk-rating mechanisms, noting that \nsovereign risk assessments should maximize the use of objective and transparent \nparameters, which can be facilitated by high-quality data and analysis, and \nencourages relevant institutions, including the United Nations Conference on Trade \n\nInternational financial system and development \nA/RES/76/192\n \n11/11\n21-19247 \n \nand Development, to continue their work on the issue, including the potential impact \nof the role played by private credit rating agencies on the development prospects of \ndeveloping countries, in accordance with their mandates; \n \n39. Recommits itself to enabling women\u2019s full and equal participation in the \neconomy and their equal access to decision-making processes and leadership; \n \n40. Welcomes efforts by new development banks to develop safeguard systems \nin open consultation with stakeholders on the basis of established international \nstandards, and encourages all development banks to establish or maintain social and \nenvironmental safeguard systems, including on human rights, gender equality and \nwomen\u2019s empowerment, that are transparent, effective, efficient and time-sensitive; \n \n41. Reiterates that States are strongly urged to refrain from promulgating and \napplying any unilateral economic, financial or trade measures not in accordance with \ninternational law and the Charter of the United Nations that impede the full \nachievement of economic and social development, particularly in developing \ncountries; \n \n42. Requests, in this regard, the Secretary-General to submit to the General \nAssembly at its seventy-seventh session an action-oriented report on the \nimplementation of the present resolution with a particular focus on the implications \nof the COVID-19 pandemic for the international financial system and development; \n \n43. Decides to include in the provisional agenda of its seventy-seventh \nsession, under the item entitled \u201cMacroeconomic policy questions\u201d, the sub-item \nentitled \u201cInternational financial system and development\u201d, unless otherwise agreed. \n \n54th plenary meeting \n17 December 2021 \n \n",
  "paragraphs": {
    "1": "Takes note of the report of the Secretary-General;11",
    "2": "Recognizes the need to continue and intensify efforts to enhance the coherence and consistency of the international monetary, financial and trading systems, reiterates the importance of ensuring their openness, fairness and inclusiveness in order to complement national efforts to ensure sustainable development, including strong, sustained, balanced, inclusive and equitable economic growth, and that all men and women, in particular the poor and vulnerable, have equal rights to economic resources and appropriate financial services, and the achievement of the internationally agreed development goals, including the Sustainable Development Goals, and encourages the international financial institutions to align their programmes and policies with the 2030 Agenda for Sustainable Development 12 in accordance with their mandates;",
    "3": "Notes that the United Nations, on the basis of its universal membership and legitimacy, provides a unique and key forum for discussing international economic issues and their impact on development, and reaffirms that the United Nations is well positioned to participate in various reform processes aimed at improving and strengthening the effective functioning of the international financial system and architecture, while recognizing that the United Nations and the international financial institutions have complementary mandates that make the coordination of their actions crucial;",
    "4": "Recognizes the important efforts undertaken nationally, regionally and internationally to respond to the challenges posed by the latest global financial and economic crisis, and also recognizes that more needs to be done in order to promote the economic recovery, to manage the consequences of volatility in global financial and commodity markets, to tackle high unemployment and rising indebtedness in many countries, as well as widespread fiscal strains, to reinforce the banking sector, including by increasing its transparency and accountability, to address systemic fragilities and imbalances, to reform and strengthen the international financial system and to continue and to enhance the coordination of financial and economic policies at the international level;",
    "5": "Acknowledges that endeavours to overcome the crisis must go beyond short-term relief, and recognizes the need for continued action to support the developing countries, including middle-income countries, that are most in need, on an inclusive basis, including through enhanced cooperation between the United Nations and international financial institutions and multilateral and regional development banks, according to their respective mandates, net positive flows from the international financial institutions to developing countries, sufficient concessional finance by, inter alia, enhancing access to concessional, long-term loans and development assistance while mobilizing catalytically additional resources from the private sector and assisting developing countries in addressing debt vulnerability in the immediate term and in attaining debt sustainability in the long term, recommends the full and transparent implementation by all official bilateral creditors of the Group of 20 Debt Service Suspension Initiative along with its extension until December 2021, and the orderly, timely and effective implementation of the Common Framework for Debt Treatments beyond the Debt Service Suspension Initiative, endorsed at the leaders\u2019 summit hosted by Saudi Arabia on COVID-19 and negotiated further under the presidency of Italy, noting the need for greater collaboration of credit rating agencies in this regard, welcomes existing liquidity support for countries with liquidity constraints, for example the International Monetary Fund Catastrophe Containment and Relief Trust, which has provided 851 million United States dollars to 29 countries as of end-October 2021, also welcomes the International Monetary Fund\u2019s special drawing rights allocation of the equivalent of 650 billion dollars of 23 August 2021 to meet the long-term global need to supplement reserve assets, and encourages countries with strong external positions to seek options for voluntary channelling of special drawing rights, in accordance with national laws and regulations, and to this end appreciates the Fund\u2019s efforts to seek further viable options for the voluntary channelling of special drawing rights to countries most in need, such as the Poverty Reduction and Growth Trust and the new Resilience and Sustainability Trust of the Fund, with a view to providing affordable long-term financing to developing countries in a manner that preserves their external debt sustainability, and encourages the consideration of viable options to voluntarily channel through multilateral development banks;",
    "6": "Stresses the critical importance of a stable, inclusive and enabling global economic environment for the advancement of sustainable development, for the reliable and effective financing of development and for the implementation of the 2030 Agenda, mobilizing public and private, as well as domestic and international resources;",
    "7": "Notes the need for open, inclusive and transparent discussions on the modernization of official development assistance measurement and on the proposed measure of \u201ctotal official support for sustainable development\u201d, and reaffirms that any such measure will not dilute commitments already made;",
    "8": "Reiterates that debtors and creditors, including both public and private, must work together in a transparent manner to prevent and resolve unsustainable debt situations and that maintaining sustainable debt levels is the responsibility of the borrowing countries, acknowledging, however, that lenders also have a responsibility to lend in a way that does not undermine a country\u2019s debt sustainability, and in this regard takes note of the United Nations Conference on Trade and Development principles on responsible sovereign lending and borrowing and recognizes the applicable requirements of the International Monetary Fund debt limits policy and/or the World Bank non-concessional borrowing policy, as well as the safeguards of the Development Assistance Committee of the Organisation for Economic Co-operation and Development in its statistical system to enhance the debt sustainability of recipient countries, and will work towards a global consensus on guidelines for debtor and creditor responsibilities in borrowing by and lending to sovereigns, building on existing initiatives;",
    "9": " invites all major institutional stakeholders, including the International Monetary Fund, the World Bank and the United Nations Conference on Trade and Development, to support these efforts, in accordance with their respective mandates;",
    "10": "Encourages, in this regard, the Economic and Social Council to consider, at its annual forum on financing for development follow-up, a dedicated discussion and analysis of systemic issues and challenges, taking into account the roles of the international financial institutions, including the International Monetary Fund, and of the United Nations Conference on Trade and Development, in accordance with their respective mandates, pursuant to the relevant resolutions on this matter, including its resolution 69/313 on the Addis Ababa Action Agenda of the Third International Conference on Financing for Development and the mandate of the annual forum on financing for development follow-up set out therein;",
    "11": "Resolves to strengthen the coherence and consistency of multilateral financial, investment, trade and development policy and environment institutions and platforms and to increase cooperation between major international institutions, while respecting mandates and governance structures, and commits itself to taking better advantage of relevant United Nations forums for promoting universal and holistic coherence and international commitments to sustainable development, building on the vision of the Monterrey Consensus, with a view to supporting the implementation of the Addis Ababa Action Agenda and the 2030 Agenda;",
    "12": "Recalls that countries must have, in accordance with their specific needs and circumstances, the flexibility necessary to implement countercyclical measures and pursue tailored and targeted responses to the various types of shocks, including economic and financial crises, notes that, in the 2018 International Monetary Fund review of programme design and conditionality, it was found that the number of structural conditions included in programmes of the Fund had increased over time, and calls for the Fund to build on recent progress to further prioritize reforms and streamline conditions to ensure that they are timely, tailored and targeted, in accordance with national circumstances and priorities, and that they support developing countries in the face of financial, economic and development challenges, while also noting that new and ongoing programmes should not contain unwarranted procyclical conditionalities;",
    "13": "Notes, in this regard, the new strategy of the International Monetary Fund for engagement on social spending, welcomes the Fund\u2019s recognition of the adverse impacts that fiscal adjustment could have on the vulnerable, for whom social spending is critical to achieving the commitments under the 2030 Agenda, including nationally appropriate social protection systems and measures for all, including floors, and encourages greater collaboration on social protection finance between the Fund and international development institutions;",
    "14": "Invites the multilateral development banks and other international development banks to continue to provide both concessional and non-concessional, stable, long-term development finance by leveraging contributions and capital and by mobilizing resources for developing countries from multiple sources, for example from capital markets, and stresses that development banks should make optimal use of their resources and balance sheets, consistent with maintaining their financial integrity, and should update and develop their policies in support of the 2030 Agenda, including the Sustainable Development Goals, as appropriate;",
    "15": " including through regional and subregional development banks, commercial and reserve currency arrangements and other regional and subregional initiatives;",
    "16": "Encourages, in this regard, the multilateral development banks to continue to move forward on flexible, concessional, fast-disbursing and front-loaded assistance that will substantially and quickly assist developing countries facing financing gaps in their efforts to achieve the Sustainable Development Goals, taking into consideration the individual absorptive capacities and debt sustainability of those countries, and invites shareholders of regional development banks to ensure that they are sufficiently capitalized so as to be able to meet those needs;",
    "17": "Also encourages the multilateral development banks, within their respective mandates, to continue to expand technical assistance, disseminate and share their knowledge and best practices and enhance the multiplier effect of their financing by leveraging more resources from more sources, including by mobilizing private investment, to provide innovative and integral solutions to multidimensional development problems, in particular in developing and emerging economies;",
    "18": "Recognizes the need for the international financial institutions, as appropriate, to promote gender mainstreaming in their policies and programmes, including macroeconomic, job creation and structural reform policies and programmes, in accordance with relevant national priorities and strategies;",
    "19": "Urges multilateral donors and invites the international financial institutions and regional development banks, within their respective mandates, to review and implement policies that support national efforts to ensure that a higher proportion of resources reach women and girls, in particular in rural and remote areas, and invites multilateral and regional development banks to agree on common indicators for analysing the gender impact of their lending;",
    "20": "Recognizes that it is important that the International Monetary Fund continue to be adequately resourced, and supports and reiterates its commitment to further governance reform at both the Fund and the World Bank to adapt to changes in the global economy;",
    "21": "Notes the lack of progress on a quota increase under the fifteenth general review of quotas of the International Monetary Fund, but welcomes the political agreement reached on the review by the Board of Governors on the occasion of the fortieth meeting of the International Monetary and Financial Committee, held in Washington, D.C., on 18 and 19 October 2019, as well as the support garnered for maintaining the Fund\u2019s current resource envelope with a doubling of the New Arrangements to Borrow and a further temporary round of bilateral borrowing beyond 2020;",
    "22": "",
    "23": "Encourages Member States to work together to strengthen and improve a system in which different layers of the global financial safety net are closely coordinated and have clear assignments of responsibilities and to consider enhancing regional financial arrangements to help countries to weather shocks, strengthen their capacity to detect risk and create new regional arrangements where there are not sufficient institutions in place;",
    "24": "Acknowledges the importance of the international financial institutions supporting, in line with their mandates, the policy space of each country, while remaining consistent with relevant international rules and commitments, in particular developing countries;",
    "25": "Reaffirms that cohesive, nationally owned sustainable development strategies, supported by integrated national financing frameworks, will be at the heart of efforts, reiterates that each country has primary responsibility for its own economic and social development and that the role of national policies and development strategies cannot be overemphasized, expresses respect for each country\u2019s policy space and leadership to implement policies for the eradication of poverty in all its forms and dimensions and for sustainable development, while remaining consistent with relevant international rules and commitments, at the same time recognizes that national development efforts need to be supported by an enabling international economic environment, including coherent and mutually supporting world trade, monetary and financial systems and strengthened and enhanced global economic governance, and that processes to develop and facilitate the availability of appropriate knowledge and technologies globally, as well as capacity-building, are also critical, and commits to pursuing policy coherence and an enabling environment for sustainable development at all levels and by all actors, and to reinvigorating the Global Partnership for Sustainable Development;",
    "26": "Recommits itself to a redoubling of its efforts to substantially reduce illicit financial flows by 2030, with a view to eventually eliminating them, including by combating tax evasion and corruption through strengthened national regulation and increased international cooperation;",
    "27": "Recognizes the role of special drawing rights as an international reserve asset, acknowledges that special drawing rights allocations helped to supplement international reserves in response to the world financial and economic crisis, thus contributing to the stability of the international financial system and global economic resilience, and supports the continued examination of the broader use of special drawing rights as a way to enhance the resilience of the international monetary system, including with reference to their potential role in the international reserve system;",
    "28": "Notes the rapid development of cryptoassets and the potential systemic implications of these private assets on the functioning of the international monetary system, the ability of regulators to protect consumers and promote financial stability and the ability of central banks to effectively use monetary policy to pursue domestic economic objectives, encourages promoters of such assets to work with regulators on financial regulations in markets where their assets are used, and urges regulators to carefully consider the potential implications for the international and domestic financial system when formulating the appropriate regulatory treatment for cryptoassets in their jurisdictions;",
    "29": "",
    "30": "Notes the work by the Financial Stability Board on financial market reform, commits itself to sustaining or strengthening frameworks for macroprudential regulation and countercyclical buffers, reaffirms the commitment to hastening the completion of the reform agenda on financial market regulation, including assessing and if necessary reducing the systemic risks associated with non-bank financial intermediation, markets for derivatives, securities lending and repurchase agreements, and also reaffirms the commitment to addressing the risk created by \u201ctoo-big-to-fail\u201d financial institutions and to addressing cross-border elements in the effective resolution of troubled, systemically important financial institutions;",
    "31": "Also notes that there are growing risks outside the regulatory framework, including through non-bank financial institutions and financial technology, and calls upon financial regulators to increasingly shift towards examining the underlying risks associated with financial activity rather than the type of financial institution;",
    "32": "Calls upon financial regulators to encourage financial institutions to explore new opportunities to improve their ability to better manage risks, including through anti-money-laundering and countering the financing of terrorism measures, as well as through the greater use of technology to help to address the costs and risks of operating correspondent banking relationships;",
    "33": "Emphasizes the relevance of inclusion in the international financial system at all levels and the importance of considering financial inclusion as a policy objective in financial regulation, in accordance with national priorities and legislation;",
    "34": "Reiterates that effective, inclusive multilateral surveillance should be at the centre of crisis prevention efforts, stresses the need to continue to strengthen surveillance of the financial policies of countries, and in this regard notes the current efforts to update the surveillance approach of the International Monetary Fund to better integrate bilateral and multilateral surveillance, along with cross-border and cross-sectoral linkages with macroeconomic and macroprudential policies, while paying closer attention to the spillover effects from national economic and financial policies on to the global economy;",
    "35": "Notes the potential for source countries of capital flows to use appropriate combinations of macroeconomic, macroprudential and regulatory policies that avoid excessive leverage and large international spillovers in the form of capital flow volatility, while still meeting domestic macroeconomic objectives, encourages source countries to consider such policies, and calls for greater macroeconomic coordination among systemically important economies, which can also help to address global financial market volatility;",
    "36": "Invites the international financial and banking institutions, in consultation with national Governments, to develop tailored guidelines on how countries can attract long-term international investments, guided by the 2030 Agenda, in line with national plans and policies, and with a view to minimizing the adverse effects of capital market volatility;",
    "37": "Reiterates the need to resolve to reduce mechanistic reliance on credit- rating agency assessments, including in regulations, and to promote increased competition as well as measures to avoid conflict of interest in the provision of credit ratings;",
    "38": " and Development, to continue their work on the issue, including the potential impact of the role played by private credit rating agencies on the development prospects of developing countries, in accordance with their mandates;",
    "39": "Recommits itself to enabling women\u2019s full and equal participation in the economy and their equal access to decision-making processes and leadership;",
    "40": "Welcomes efforts by new development banks to develop safeguard systems in open consultation with stakeholders on the basis of established international standards, and encourages all development banks to establish or maintain social and environmental safeguard systems, including on human rights, gender equality and women\u2019s empowerment, that are transparent, effective, efficient and time-sensitive;",
    "41": "Reiterates that States are strongly urged to refrain from promulgating and applying any unilateral economic, financial or trade measures not in accordance with international law and the Charter of the United Nations that impede the full achievement of economic and social development, particularly in developing countries;",
    "42": "Requests, in this regard, the Secretary-General to submit to the General Assembly at its seventy-seventh session an action-oriented report on the implementation of the present resolution with a particular focus on the implications of the COVID-19 pandemic for the international financial system and development;",
    "43": "Decides to include in the provisional agenda of its seventy-seventh session, under the item entitled \u201cMacroeconomic policy questions\u201d, the sub-item entitled \u201cInternational financial system and development\u201d, unless otherwise agreed."
  },
  "agenda_items": [
    "Item 18"
  ],
  "symbol_references": []
}