{
  "symbol": "A/RES/79/316",
  "filename": "A_RES_79_316.pdf",
  "title": "79/316. Promoting interreligious and intercultural dialogue and tolerance in countering hate speech",
  "text": "United Nations \nA/RES/79/316\n \nGeneral Assembly \nDistr.: General \n2 July 2025 \n25-10889 (E) \n*2510889* \n \n \nSeventy-ninth session \nAgenda item 14 \nCulture of peace \n \n \n \n \n Resolution adopted by the General Assembly \non 30 June 2025 \n \n \n[without reference to a Main Committee (A/79/L.98)] \n \n \n 79/316. Promoting interreligious and intercultural dialogue and tolerance \nin countering hate speech \n \n \n \nThe General Assembly, \n \nReaffirming the commitment made by all Member States under the Charter of \nthe United Nations to promote and encourage universal respect for and observance of \nall human rights and fundamental freedoms without distinction as to, inter alia, \nreligion or belief,  \n \nRecalling article 18 of the International Covenant on Civil and Political Rights, 1 \narticle 18 of the Universal Declaration of Human Rights 2 and other relevant human \nrights provisions,  \n \nRecalling also its resolution 36/55 of 25 November 1981, by which it \nproclaimed the Declaration on the Elimination of All Forms of Intolerance and of \nDiscrimination Based on Religion or Belief,  \n \nNoting with appreciation resolution 73/328 of 25 July 2019 on promoting \ninterreligious and intercultural dialogue and tolerance in countering hate speech and \nthe subsequent resolution 75/309 of 21 July 2021, in which it proclaimed 18 June as \nthe International Day for Countering Hate Speech, to be observed annually, as well \nas the subsequent resolution 77/318 of 25 July 2023, \n \nNoting the adoption of the Security Council resolution 2686 (2023) of 14 June \n2023 on tolerance and international peace and security that recognized that hate \nspeech, racism, racial discrimination, xenophobia, related forms of intolerance, \ngender discrimination and acts of extremism can contribute to driving the outbreak, \nescalation and recurrence of conflict, and undermine initiatives to address root causes \n_______________ \n \n1  See resolution 2200 A (XXI), annex. \n \n2 Resolution 217 A (III). \n\nA/RES/79/316 \nPromoting interreligious and intercultural dialogue and tolerance \nin countering hate speech\n \n25-10889\n2/7 \n \nof conflict and prevent and resolve conflict, as well as reconciliation, reconstruction \nand peacebuilding efforts,  \n \nRecognizing the importance of the Declaration and Programme of Action on a \nCulture of Peace,3 which serve as a basis for the international community, particularly \nthe United Nations system, for the promotion of a culture of peace and non\u2011violence \nthat benefits humanity, in particular future generations,  \n \nRecalling the importance of committing to advance equitable and inclusive \napproaches to harnessing artificial intelligence benefits and mitigating risks in full \nrespect of international law, including international human rights law, and taking into \naccount other relevant frameworks such as the Recommendation on the Ethics of \nArtificial Intelligence of the United Nations Educational, Scientific and Cultural \nOrganization, 4  and taking note of the United Nations Global Principles for \nInformation Integrity and the recommendations contained therein for urgent action to \naddress risks posed by advances in artificial intelligence and to curb harm from the \nspread of hate speech, misinformation and disinformation, \n \nRecalling also that discrimination against human beings on the basis of religion \nor belief constitutes an affront to human dignity and undermines the enjoyment of the \nhuman rights and fundamental freedoms proclaimed in the Universal Declaration of \nHuman Rights and enunciated in detail in the International Covenants on Human \nRights,5 \n \nReaffirming the obligation of Member States to prohibit discrimination and \nviolence, on the basis of religion or belief and to implement measures to guarantee \nthe equal and effective protection of the law,  \n \nWelcoming, in this regard, all international, regional and national initiatives, as \nwell as efforts by religious and other leaders to promote interreligious and \nintercultural dialogue, \n \nReaffirming the positive role that the exercise of the right to freedom of opinion \nand expression and full respect for the freedom to seek, receive and impart \ninformation can play in strengthening democracy and combating religious \nintolerance, and reaffirming further that the exercise of the right to freedom of \nexpression carries with it special duties and responsibilities, in accordance with \narticle 19 of the International Covenant on Civil and Political Rights, \n \nRecalling article 20 (2) of the International Covenant on Civil and Political \nRights, which states that any advocacy of national, racial or religious hatred that \nconstitutes incitement to discrimination, hostility or violence shall be prohibited by \nlaw,  \n \nRecognizing the commitment of all religions to peace and the contribution that \ninterreligious and intercultural dialogue among religions, groups and individuals, in \nparticular religious leaders, can make towards an improved awareness and \nunderstanding of the common values shared by all humankind, as well as to promoting \nand protecting universal human rights and fundamental freedoms, \n \nStrongly deploring all acts of violence against persons on the basis of their \nreligion or belief, as well as any such acts directed against their religious symbols, \nholy books, homes, businesses, properties, schools, cultural centres or places of \n_______________ \n \n3 Resolutions 53/243 A and B. \n \n4 United Nations Educational, Scientific and Cultural Organization, Records of the General \nConference, Forty-first Session, Paris, 9\u201324 November 2021, vol. 1, Resolutions, annex VII. \n \n5 Resolution 2200 A (XXI), annex. \n\nPromoting interreligious and intercultural dialogue and tolerance \nin countering hate speech \nA/RES/79/316\n \n3/7\n25-10889 \n \nworship, as well as all attacks on and in religious places, sites and shrines in violation \nof international law, \n \nExpressing concern at the growing manifestations of intolerance based on \nreligion or belief, including in the digital context, which can generate hatred, \ndiscrimination and violence among individuals from and within different nations and \nwhich may have serious implications at the national, regional and international levels, \nand in this regard emphasizing the importance of respect for religious and cultural \ndiversity, as well as interreligious, interfaith and intercultural dialogue aimed at \npromoting a culture of tolerance and respect among individuals, societies and nations,  \n \nNoting with appreciation the efforts of the United Nations system in helping to \ncounter the proliferation of hate speech, misinformation and disinformation,  \n \nNoting the establishment of the International Day Commemorating the Victims \nof Acts of Violence Based on Religion or Belief, which contributes to the promotion \nof interreligious and intercultural dialogue,  \n \nExpressing deep concern at all acts of hate speech that undermine the spirit of \ntolerance and respect for diversity, may lead to violations and abuses of human rights \nand constitute a serious common concern for all Member States, and convinced that \nthere is no justification for hate speech, whatever be the motivation, \n \nRecognizing with deep concern the overall rise in instances of discrimination, \nintolerance and violence, regardless of the actors, directed against members of many \nreligious and other communities in various parts of the world, including cases \nmotivated by Islamophobia, antisemitism and Christianophobia and prejudices \nagainst persons of other religions or beliefs, \n \nTaking note of the appointment of the High Representative for the United \nNations Alliance of Civilizations as the United Nations Special Envoy to Combat \nIslamophobia, pursuant to General Assembly resolution 78/264 of 15 March 2024 on \nmeasures to combat Islamophobia,  \n \nTaking note also of the launch, on 17 January 2025, of the United Nations Action \nPlan to Enhance Monitoring and Response to Antisemitism,  \n \nExpressing deep concern at the instances of intolerance and discrimination and \nacts of violence occurring in the world, including cases motivated by discrimination \nagainst persons belonging to religious minorities, in addition to the negative \nprojection of the followers of religions and the enforcement of measures that \nspecifically discriminate against persons on the basis of religion or belief,  \n \nHighlighting the global concerns about the exponential spread and proliferation \nof hate speech, disinformation and misinformation, thereby increasing the need for \nthe dissemination of factual, timely, targeted, clear, accessible, multilingual, accurate \nand science-based information, and emphasizing the need for all Member States to \nstand together to address the challenge of hate speech online and offline, \ndisinformation and misinformation,  \n \nHighlighting also that while technological advances have the potential to \nfacilitate efforts to accelerate human progress as well as to promote and protect human \nrights and fundamental freedoms, their misuse has facilitated the spread of hate \nspeech at historically unprecedented volume, velocity and virality, risking the \nintegrity of the information ecosystem,  \n \nExpressing concern about the spread of disinformation and misinformation, \nparticularly on social media platforms, which may lead to the spread of hate speech \nand all forms of discrimination,  \n\nA/RES/79/316 \nPromoting interreligious and intercultural dialogue and tolerance \nin countering hate speech\n \n25-10889\n4/7 \n \n \nExpressing deep concern about the growing misuse of artificial intelligence or \nmachine-learning technologies to generate, disseminate or amplify hate speech, \nincluding on social media platforms, through, inter alia, the use of artificial content, \nincluding images, videos and other forms of media, while also recognizing the \npotential of such technologies to detect and mitigate harmful content when developed \nand deployed safely,  \n \nRecognizing efforts to enhance international governance of artificial intelligence \nfor the benefit of humanity, based on international law, including the Charter of the \nUnited Nations and international human rights law, while also recognizing the need \nfor a balanced, interoperable, inclusive and risk-based approach to the governance of \nartificial intelligence, with the full and equal representation of all countries, especially \ndeveloping countries,  \n \nEmphasizing that Member States, regional organizations, national human rights \ninstitutions, the private sector actors, including social media companies, \nnon\u2011governmental organizations, religious bodies, the media, and civil society as a \nwhole have an important role to play in promoting tolerance and respect, for religious \nand cultural diversity and in the universal promotion and protection of human rights, \nincluding freedom of religion or belief,  \n \nRecognizing the role played by many religious leaders and faith-based \norganizations, through speaking out against hate speech, misinformation and \ndisinformation, expressing solidarity with those targeted by such expressions, and \namplifying messages that serve to reduce discrimination and stigma, \n \nRecognizing also the leading role of the United Nations Educational, Scientific \nand Cultural Organization and the work of the United Nations Alliance of \nCivilizations in promoting intercultural dialogue and their contribution to \ninterreligious dialogue, as well as their activities related to the culture of peace and \nnon\u2011violence and their focus on concrete actions at the global, regional and \nsubregional levels,  \n \nNoting the role of the Special Adviser to the Secretary-General on the Prevention \nof Genocide, in the launch of the United Nations Strategy and Plan of Action on Hate \nSpeech, and as part of efforts to address and counter hate speech,  \n \nNoting also the Rabat Plan of Action on the prohibition of advocacy of national, \nracial or religious hatred that constitutes incitement to discrimination, hostility or \nviolence,6 \n \nNoting further the Plan of Action for Religious Leaders and Actors to Prevent \nIncitement to Violence that Could Lead to Atrocity Crimes, also called the Fez Plan \nof Action, and the Plan of Action to Safeguard Religious Sites,  \n \nNoting, in this regard, the outcome document adopted at the High-level \nSymposium on the Fifth Anniversary of the Fez Plan of Action, held in Fez, Kingdom \nof Morocco, on 20 and 21 July 2022,  \n \nRecognizing that cultural diversity and the pursuit of cultural development by \nall peoples and nations are sources of mutual enrichment for the cultural life of \nhumankind,  \n \n1. \nRecognizes the importance of interreligious and intercultural dialogue and \nits valuable contribution to promoting social cohesion, peace and development, and \ncalls upon Member States to consider, as appropriate and where applicable, \ninterreligious and intercultural dialogue as an important tool in efforts aimed at \n_______________ \n \n6 A/HRC/22/17/Add.4, appendix. \n\nPromoting interreligious and intercultural dialogue and tolerance \nin countering hate speech \nA/RES/79/316\n \n5/7\n25-10889 \n \nachieving peace and social stability and the full realization of internationally agreed \ndevelopment goals;  \n \n2. \nRecognizes that there is no universally agreed definition of hate speech, \nand in this regard stresses the importance of working on an intergovernmentally \nagreed definition of hate speech that can help in countering it, in accordance with \ninternational law; \n \n3. \nCalls upon Member States to increase understanding about the spread and \nimpact of hate speech, while continuing to adhere to relevant international human \nrights law obligations, as well as relevant United Nations instruments, in particular \nthe Rabat Plan of Action;  \n \n4. \nInvites all Member States, organizations and agencies of the United \nNations system, other international and regional organizations and civil society \norganizations, non\u2011governmental organizations, academic institutions, the private \nsector, individuals and other relevant stakeholders to observe the International Day \nfor Countering Hate Speech, as appropriate, with the cost covered exclusively by \nvoluntary contributions;  \n \n5. \nInvites all Member States to further promote the culture of peace to help \nto ensure peace and sustainable development, including through the celebration of the \ninternational, regional and national days in this regard and by mobilizing the efforts \nof the international community to promote peace, tolerance, inclusion, understanding \nand solidarity;  \n \n6. \nCondemns any advocacy of hatred that constitutes incitement to \ndiscrimination, hostility or violence, whether it involves the use of print, audiovisual \nor electronic media, social media or any other means; \n \n7. \nExpresses its concern that incidents of racial and religious intolerance, \ndiscrimination and related violence, as well as of negative racial and religious \nstereotyping, continue to rise around the world, and condemns, in this context, any \nadvocacy of national, racial or religious hatred that constitutes incitement to \ndiscrimination, hostility or violence, and urges States to take effective measures, \nconsistent with their obligations under international human rights law, to address, \ncounter and combat such incidents;  \n \n8. \nEmphasizes that freedom of religion or belief, freedom of opinion and \nexpression, the right to peaceful assembly and the right to freedom of association are \ninterdependent, interrelated and mutually reinforcing, and stresses the role that these \nrights can play in the fight against all forms of intolerance and of discrimination based \non religion or belief;  \n \n9. \nTakes note of the United Nations Strategy and Plan of Action on Hate \nSpeech, in which it is proposed that the United Nations system establish and \nstrengthen partnerships with new and traditional media to promote the values of \ntolerance, non\u2011discrimination, pluralism and freedom of opinion and expression, and \nto address hate speech narratives;  \n \n10. Encourages Member States to consider, as and where appropriate, \ninitiatives that identify areas for practical action in all sectors and levels of society \nfor the promotion of interreligious and intercultural dialogue, tolerance, \nunderstanding and cooperation;  \n \n11. \nUrges Member States to refrain from creating or disseminating false or \nmisleading information, as well as from conducting or sponsoring domestic or \ninformation operations that wilfully spread hate speech, in ways that are contrary to \ntheir obligations under international law, and in this regard further urges them to take \n\nA/RES/79/316 \nPromoting interreligious and intercultural dialogue and tolerance \nin countering hate speech\n \n25-10889\n6/7 \n \nappropriate and proportionate measures to mitigate risks arising from hate speech, \nwhile stressing that responses to these challenges must be undertaken in accordance \nwith international human rights law obligations; \n \n12. Calls upon digital technology companies and developers to co-develop \nindustry accountability frameworks, in consultation with Governments and other \nstakeholders, in their respective roles, that increase explainability and transparency \naround their data, systems and processes, define responsibilities and commit to \nstandards as well as auditable public reports, including to mitigate the risks that \nartificial intelligence systems may pose in generating, disseminating and amplifying \nhate speech; \n \n13. Also calls upon digital technology companies and developers to continue \nto develop solutions and publicly communicate actions to counter potential harms, \nincluding hate speech, bias and discrimination, from artificial intelligence-enabled \ncontent, including such measures as ensuring data integrity, incorporation of \nsafeguards into artificial intelligence model training processes, identification of \nartificial intelligence-generated material, authenticity certification for content and \norigins, labelling, watermarking and other techniques; \n \n14. Calls upon Member States to engage with all relevant stakeholders to \npromote the virtues of interreligious and intercultural dialogue, respect and \nacceptance of differences, tolerance, respect for diversity, peaceful coexistence and \ncohabitation, inclusion and respect for human rights, to reject the spread of hate \nspeech, that constitutes incitement to discrimination, hostility and violence;  \n \n15. Encourages all Member States and international organizations to generate \npublic awareness about the dangers of intolerance and sectarian violence and to react \nwith renewed commitment and action in support of the promotion of tolerance and \nhuman rights, and invites them to continue to pay attention to the importance of \nmutual cooperation, understanding and dialogue in ensuring the promotion of \nmoderation and tolerance, and respect for human rights;  \n \n16. Notes with appreciation the ninth United Nations Alliance of Civilizations \nGlobal Forum, held in Fez, Kingdom of Morocco, on 22 and 23 November 2022 under \nthe theme \u201cTowards an alliance of peace: living together as one humanity\u201d, that \nadopted the Fez Declaration, and focused, among other issues, on countering and \naddressing online hate speech on social media;  \n \n17. Also notes with appreciation the Cascais Declaration on the tenth United \nNations Alliance of Civilizations Global Forum, on the theme \u201cUnited in peace: \nrestoring trust, reshaping the future \u2013 reflecting on two decades of dialogue for \nhumanity\u201d, held in Cascais, Portugal, from 25 to 27 November 2024; \n \n18. Urges Member States and social media companies to take active measures \nto counter hate speech and address its increasing spread, enable research into \nmeasures to reduce it and promote users\u2019 access to effective reporting channels, in a \nmanner consistent with international human rights;  \n \n19. Recalls its request to the Secretary-General to convene, within existing \nresources, in 2025, a global conference on promoting interreligious and intercultural \ndialogue and tolerance in countering hate speech that involves United Nations \nentities, Member States, political figures, religious leaders, faith-based organizations, \nmedia, civil society and other relevant stakeholders;  \n \n20. Encourages Member States to focus on promoting interreligious and \nintercultural dialogue, respect for diversity, and the elimination of discrimination \nbased on religion or belief, while underlining the importance of education, culture, \npeace, tolerance, mutual understanding and human rights;  \n\nPromoting interreligious and intercultural dialogue and tolerance \nin countering hate speech \nA/RES/79/316\n \n7/7\n25-10889 \n \n \n21. Invites Member States to support, in accordance with relevant international \nobligations, transparent and accessible systems to identify, track, collect data and \nanalyse trends on hate speech, both in person and in digital contexts, at all national \nlevels, as appropriate, to support effective responses;  \n \n22. Also invites Member States to further promote reconciliation to help ensure \ndurable peace and sustainable development, and to encourage religious and \ncommunity leaders to engage in intra- and interfaith dialogue to respond to incitement \nto violence, discrimination and hate speech;  \n \n23. Invites Member States and other relevant stakeholders to counter hate \nspeech and disinformation directed at migrants, refugees, and stateless and displaced \npersons, including in digital spaces, by promoting intercultural dialogue, inclusive \neducation and public awareness campaigns that highlight the positive contributions \nof migrants to host societies and foster mutual respect and understanding, in \naccordance with international human rights obligations;  \n \n24. Calls upon Member States, who have the primary responsibility to counter \ndiscrimination and hate speech, and all relevant actors, including political and \nreligious leaders, to promote inclusion, unity, tolerance and mutual respect and to \nspeak out and take strong action against racism, xenophobia, hate speech, violence \nand discrimination;  \n \n25. Welcomes the proclamation of the first week of February of every year as \nthe World Interfaith Harmony Week between all religions, faiths and beliefs;  \n \n26. Takes note of global efforts to support implementing the Secretary-\nGeneral\u2019s Plan of Action for Religious Leaders and Actors to Prevent Incitement to \nViolence that Could Lead to Atrocity Crimes, also called the Fez Plan of Action, the \nSecretary-General\u2019s Strategy and Plan of Action on Hate Speech and the Secretary-\nGeneral\u2019s Plan of Action to Safeguard Religious Sites;  \n \n27. Invites all Member States, the United Nations system, regional and \nnon\u2011governmental organizations and other relevant stakeholders to increase their \nunderstanding of the Plan of Action for Religious Leaders and Actors to Prevent \nIncitement to Violence that Could Lead to Atrocity Crimes, also called the Fez Plan \nof Action, and the Plan of Action on Hate Speech, and other initiatives promoting \ntolerance and mutual understanding;  \n \n28. Requests the Secretary-General to submit, within existing resources, a \nreport to the General Assembly at its eighty-first session, no later than April 2027, on \nthe challenges and opportunities of the use of artificial intelligence in addressing, \ncountering and combating hate speech. \n \n81st plenary meeting \n30 June 2025 \n \n",
  "paragraphs": {
    "1": "Recognizes the importance of interreligious and intercultural dialogue and its valuable contribution to promoting social cohesion, peace and development, and calls upon Member States to consider, as appropriate and where applicable, interreligious and intercultural dialogue as an important tool in efforts aimed at achieving peace and social stability and the full realization of internationally agreed development goals;",
    "2": "Recognizes that there is no universally agreed definition of hate speech, and in this regard stresses the importance of working on an intergovernmentally agreed definition of hate speech that can help in countering it, in accordance with international law;",
    "3": "Calls upon Member States to increase understanding about the spread and impact of hate speech, while continuing to adhere to relevant international human rights law obligations, as well as relevant United Nations instruments, in particular the Rabat Plan of Action;",
    "4": "Invites all Member States, organizations and agencies of the United Nations system, other international and regional organizations and civil society organizations, non\u2011governmental organizations, academic institutions, the private sector, individuals and other relevant stakeholders to observe the International Day for Countering Hate Speech, as appropriate, with the cost covered exclusively by voluntary contributions;",
    "5": "Invites all Member States to further promote the culture of peace to help to ensure peace and sustainable development, including through the celebration of the international, regional and national days in this regard and by mobilizing the efforts of the international community to promote peace, tolerance, inclusion, understanding and solidarity;",
    "6": "Condemns any advocacy of hatred that constitutes incitement to discrimination, hostility or violence, whether it involves the use of print, audiovisual or electronic media, social media or any other means;",
    "7": "Expresses its concern that incidents of racial and religious intolerance, discrimination and related violence, as well as of negative racial and religious stereotyping, continue to rise around the world, and condemns, in this context, any advocacy of national, racial or religious hatred that constitutes incitement to discrimination, hostility or violence, and urges States to take effective measures, consistent with their obligations under international human rights law, to address, counter and combat such incidents;",
    "8": "Emphasizes that freedom of religion or belief, freedom of opinion and expression, the right to peaceful assembly and the right to freedom of association are interdependent, interrelated and mutually reinforcing, and stresses the role that these rights can play in the fight against all forms of intolerance and of discrimination based on religion or belief;",
    "9": "Takes note of the United Nations Strategy and Plan of Action on Hate Speech, in which it is proposed that the United Nations system establish and strengthen partnerships with new and traditional media to promote the values of tolerance, non\u2011discrimination, pluralism and freedom of opinion and expression, and to address hate speech narratives;",
    "10": "Encourages Member States to consider, as and where appropriate, initiatives that identify areas for practical action in all sectors and levels of society for the promotion of interreligious and intercultural dialogue, tolerance, understanding and cooperation;",
    "11": " appropriate and proportionate measures to mitigate risks arising from hate speech, while stressing that responses to these challenges must be undertaken in accordance with international human rights law obligations;",
    "12": "Calls upon digital technology companies and developers to co-develop industry accountability frameworks, in consultation with Governments and other stakeholders, in their respective roles, that increase explainability and transparency around their data, systems and processes, define responsibilities and commit to standards as well as auditable public reports, including to mitigate the risks that artificial intelligence systems may pose in generating, disseminating and amplifying hate speech;",
    "13": "Also calls upon digital technology companies and developers to continue to develop solutions and publicly communicate actions to counter potential harms, including hate speech, bias and discrimination, from artificial intelligence-enabled content, including such measures as ensuring data integrity, incorporation of safeguards into artificial intelligence model training processes, identification of artificial intelligence-generated material, authenticity certification for content and origins, labelling, watermarking and other techniques;",
    "14": "Calls upon Member States to engage with all relevant stakeholders to promote the virtues of interreligious and intercultural dialogue, respect and acceptance of differences, tolerance, respect for diversity, peaceful coexistence and cohabitation, inclusion and respect for human rights, to reject the spread of hate speech, that constitutes incitement to discrimination, hostility and violence;",
    "15": "Encourages all Member States and international organizations to generate public awareness about the dangers of intolerance and sectarian violence and to react with renewed commitment and action in support of the promotion of tolerance and human rights, and invites them to continue to pay attention to the importance of mutual cooperation, understanding and dialogue in ensuring the promotion of moderation and tolerance, and respect for human rights;",
    "16": "Notes with appreciation the ninth United Nations Alliance of Civilizations Global Forum, held in Fez, Kingdom of Morocco, on 22 and 23 November 2022 under the theme \u201cTowards an alliance of peace: living together as one humanity\u201d, that adopted the Fez Declaration, and focused, among other issues, on countering and addressing online hate speech on social media;",
    "17": "Also notes with appreciation the Cascais Declaration on the tenth United Nations Alliance of Civilizations Global Forum, on the theme \u201cUnited in peace: restoring trust, reshaping the future \u2013 reflecting on two decades of dialogue for humanity\u201d, held in Cascais, Portugal, from 25 to 27 November 2024;",
    "18": "Urges Member States and social media companies to take active measures to counter hate speech and address its increasing spread, enable research into measures to reduce it and promote users\u2019 access to effective reporting channels, in a manner consistent with international human rights;",
    "19": "Recalls its request to the Secretary-General to convene, within existing resources, in 2025, a global conference on promoting interreligious and intercultural dialogue and tolerance in countering hate speech that involves United Nations entities, Member States, political figures, religious leaders, faith-based organizations, media, civil society and other relevant stakeholders;",
    "20": "",
    "21": "Invites Member States to support, in accordance with relevant international obligations, transparent and accessible systems to identify, track, collect data and analyse trends on hate speech, both in person and in digital contexts, at all national levels, as appropriate, to support effective responses;",
    "22": "Also invites Member States to further promote reconciliation to help ensure durable peace and sustainable development, and to encourage religious and community leaders to engage in intra- and interfaith dialogue to respond to incitement to violence, discrimination and hate speech;",
    "23": "Invites Member States and other relevant stakeholders to counter hate speech and disinformation directed at migrants, refugees, and stateless and displaced persons, including in digital spaces, by promoting intercultural dialogue, inclusive education and public awareness campaigns that highlight the positive contributions of migrants to host societies and foster mutual respect and understanding, in accordance with international human rights obligations;",
    "24": "Calls upon Member States, who have the primary responsibility to counter discrimination and hate speech, and all relevant actors, including political and religious leaders, to promote inclusion, unity, tolerance and mutual respect and to speak out and take strong action against racism, xenophobia, hate speech, violence and discrimination;",
    "25": "Welcomes the proclamation of the first week of February of every year as the World Interfaith Harmony Week between all religions, faiths and beliefs;",
    "26": "Takes note of global efforts to support implementing the Secretary- General\u2019s Plan of Action for Religious Leaders and Actors to Prevent Incitement to Violence that Could Lead to Atrocity Crimes, also called the Fez Plan of Action, the Secretary-General\u2019s Strategy and Plan of Action on Hate Speech and the Secretary- General\u2019s Plan of Action to Safeguard Religious Sites;",
    "27": "Invites all Member States, the United Nations system, regional and non\u2011governmental organizations and other relevant stakeholders to increase their understanding of the Plan of Action for Religious Leaders and Actors to Prevent Incitement to Violence that Could Lead to Atrocity Crimes, also called the Fez Plan of Action, and the Plan of Action on Hate Speech, and other initiatives promoting tolerance and mutual understanding;",
    "28": "Requests the Secretary-General to submit, within existing resources, a report to the General Assembly at its eighty-first session, no later than April 2027, on the challenges and opportunities of the use of artificial intelligence in addressing, countering and combating hate speech."
  },
  "agenda_items": [
    "Item 14"
  ],
  "symbol_references": [
    "A/79/L.98"
  ]
}