{
  "symbol": "A/RES/74/302",
  "filename": "A_RES_74_302.pdf",
  "title": "74/302. Implementation of the recommendations contained in the report of the Secretary-General on the causes of conflict and the promotion of durable peace and sustainable development in Africa",
  "text": "United Nations \nA/RES/74/302\n \n \nGeneral Assembly \nDistr.: General \n8 September 2020 \n \n20-11527 (E)    100920 \n*2011527* \n \n \nSeventy-fourth session \nAgenda item 64 (b) \nNew Partnership for Africa\u2019s Development: progress in \nimplementation and international support: causes of \nconflict and the promotion of durable peace and \nsustainable development in Africa \n \n \n \n \n Resolution adopted by the General Assembly \non 3 September 2020 \n \n \n \n \n[without reference to a Main Committee (A/74/L.69/Rev.1 and \nA/74/L.69/Rev.1/Add.1)] \n \n \n 74/302. Implementation of the recommendations contained in the report of \nthe Secretary-General on the causes of conflict and the promotion \nof durable peace and sustainable development in Africa \n \n \n \nThe General Assembly, \n \nRecalling the report of the Open-ended Ad Hoc Working Group on the Causes \nof Conflict and the Promotion of Durable Peace and Sustainable Development in \nAfrica, 1  its resolution 53/92 of 7 December 1998 and all subsequent annual \nresolutions, including resolution 73/336 of 10 September 2019, as well as all its \nresolutions on the New Partnership for Africa\u2019s Development, including resolution \n73/335 of 10 September 2019, and its resolutions 59/213 of 20 December 2004, \n63/310 of 14 September 2009, 65/274 of 18 April 2011 and 67/302 of 16 September \n2013 on cooperation between the United Nations and the African Union, \n \nRecalling also, in this context, Security Council resolutions 1809 (2008) of \n16 April 2008 on peace and security in Africa, 1325 (2000) of 31 October 2000, \n1820 (2008) of 19 June 2008, 1888 (2009) of 30 September 2009, 1889 (2009) of \n5 October 2009, 1960 (2010) of 16 December 2010, 2106 (2013) of 24 June 2013, \n2122 (2013) of 18 October 2013, 2242 (2015) of 13 October 2015 and 2467 (2019) \nof 23 April 2019 on women and peace and security, 2250 (2015) of 9 December 2015 \nand 2419 (2018) of 6 June 2018 on youth, peace and security, 1366 (2001) of \n30 August 2001 on the role of the Council in the prevention of armed conflicts, \n1612 (2005) of 26 July 2005, 1882 (2009) of 4 August 2009, 1998 (2011) of 12 July \n2011, 2068 (2012) of 19 September 2012, 2225 (2015) of 18 June 2015 and \n__________________ \n \n1  Official Records of the General Assembly, Fifty-sixth Session, Supplement No. 45 (A/56/45). \n\nA/RES/74/302 \nImplementation of the recommendations contained in the report of \nthe Secretary-General on the causes of conflict and the promotion \nof durable peace and sustainable development in Africa\n \n20-11527\n2/13 \n \n2427 (2018) of 9 July 2018 on children and armed conflict, 1625 (2005) of \n14 September 2005 on strengthening the effectiveness of the role of the Council in \nconflict prevention, particularly in Africa, 2195 (2014) of 19 December 2014 and \n2379 (2017) of 21 September 2017 on threats to international peace and security, \n1631 (2005) of 17 October 2005, 2033 (2012) of 12 January 2012 and 2320 (2016) of \n18 November 2016, as well as the statements by the President of the Security Council \nof 16 December 20142 and 24 May 20163 on cooperation between the United Nations \nand regional and subregional organizations in maintaining international peace and \nsecurity, and resolutions 2167 (2014) of 28 July 2014 and 2447 (2018) of \n13 December 2018 on United Nations peacekeeping operations, \n \nRecalling further the United Nations Conference on Sustainable Development, \nheld in Rio de Janeiro, Brazil, from 20 to 22 June 2012, and its outcome document \nentitled \u201cThe future we want\u201d,4  \n \nReaffirming its resolution 70/1 of 25 September 2015, entitled \u201cTransforming \nour world: the 2030 Agenda for Sustainable Development\u201d, in which it adopted a \ncomprehensive, far-reaching and people-centred set of universal and transformative \nSustainable Development Goals and targets, its commitment to working tirelessly for \nthe full implementation of the Agenda by 2030, its recognition that eradicating poverty \nin all its forms and dimensions, including extreme poverty, is the greatest global \nchallenge and an indispensable requirement for sustainable development, its \ncommitment to achieving sustainable development in its three dimensions \u2013 economic, \nsocial and environmental \u2013 in a balanced and integrated manner, and to building upon \nthe achievements of the Millennium Development Goals and seeking to address their \nunfinished business, \n \nRecalling the 2015 high-level plenary meeting of the General Assembly on the \nSustainable Development Goals and its outcome document,5 and recognizing that \ndevelopment, peace and security and human rights are closely interlinked and \nmutually reinforcing,  \n \nReaffirming its resolution 69/313 of 27 July 2015 on the Addis Ababa Action \nAgenda of the Third International Conference on Financing for Development, which \nis an integral part of the 2030 Agenda for Sustainable Development, supports and \ncomplements it, and helps to contextualize its means of implementation targets with \nconcrete policies and actions, and reaffirms the strong political commitment to \naddress the challenge of financing and creating an enabling environment at all levels \nfor sustainable development in the spirit of global partnership and solidarity,  \n \nRecalling the 2005 World Summit Outcome, 6  through which world leaders \nreaffirmed their commitment to addressing the special needs of Africa, and its \nresolution 60/265 of 30 June 2006, \n \nReaffirming the need to strengthen the synergy between Africa\u2019s economic and \nsocial development programmes and its peace and security agenda, \n \nRecognizing, in particular, the capacity of the African Union and subregional \norganizations to address the causes of conflict in Africa, \n__________________ \n \n2  S/PRST/2014/27; see Resolutions and Decisions of the Security Council, 1 August 2014\u201331 July \n2015 (S/INF/70). \n \n3  S/PRST/2016/8; see Resolutions and Decisions of the Security Council, 1 August 2015\u2013\n31 December 2016 (S/INF/71). \n \n4  Resolution 66/288, annex. \n \n5  Resolution 70/1. \n \n6  Resolution 60/1. \n\nImplementation of the recommendations contained in the report of \nthe Secretary-General on the causes of conflict and the promotion \nof durable peace and sustainable development in Africa \n \n3/13\n20-11527 \n \n \nReaffirming the political declaration on Africa\u2019s development needs adopted at \nthe high-level meeting on 22 September 2008,7  \n \nRecalling its resolution 66/293 of 17 September 2012 establishing a monitoring \nmechanism to review commitments made towards Africa\u2019s development,  \n \nReaffirming the political declaration on the peaceful resolution of conflicts in \nAfrica adopted at the high-level meeting of the General Assembly held on 25 April \n2013,8  \n \nReaffirming also the importance of supporting the African Union Agenda 2063, \nas a strategic vision and an action plan for ensuring a positive socioeconomic \ntransformation in Africa by 2063, and acknowledging the emphasis in Agenda 2063 \non peace and security as critical enablers for sustainable development,  \n \nStressing that the responsibility for peace and security in Africa, including the \ncapacity to address the root causes of conflict and to resolve conflicts in a peaceful \nmanner, lies primarily with African countries, while recognizing the need for the \nprovision of support by the international community and the United Nations, taking \ninto account the responsibilities of the Organization in this regard according to the \nCharter of the United Nations, \n \nUnderscoring the importance of continuing the efforts of the African Union and \nsubregional organizations to prevent and settle conflicts and promote human rights, \ndemocracy, the rule of law and constitutional order in Africa, \n \nNoting that, despite the positive trends and advances in obtaining durable peace \nin Africa, the conditions required for sustainable development have yet to be \nconsolidated throughout the continent and that there is therefore an urgent need to \ncontinue to develop African human and institutional capacities, particularly in \ncountries emerging from conflict, \n \nReaffirming the commitment to ensure that there will be no tolerance for \nimpunity for genocide, war crimes and crimes against humanity or for violations of \ninternational humanitarian law and gross violations of human rights law, and that such \nviolations will be properly investigated and appropriately sanctioned, including by \nbringing the perpetrators of any crimes to justice, through national mechanisms or, \nwhere appropriate, regional or international mechanisms, in accordance with \ninternational law, and for that purpose encouraging Member States to strengthen \nnational judicial systems and institutions, \n \nUnderscoring the importance of taking into account lessons learned from the \n1994 genocide against the Tutsi in Rwanda, during which Hutu and others who \nopposed the genocide were also killed, \n \nRecognizing the importance of aligning international support with Africa\u2019s own \npriorities, including but not limited to industrialization, equal access to work \nopportunities, youth employment, access to quality education and high-quality and \nresilient infrastructure, the eradication of poverty, environmentally sustainable and \nclimate-resilient economies and communities, and the reduction of inequalities, \naimed at the implementation of the 2030 Agenda for Sustainable Development \nthrough action-oriented efforts, \n \nUnderlining the importance of enhancing national and regional initiatives, with \ninternational support, to address the negative implications of the illegal exploitation \nof natural resources in all its aspects for peace, security and development in Africa, \n__________________ \n \n7  Resolution 63/1. \n \n8  Resolution 67/259. \n\nA/RES/74/302 \nImplementation of the recommendations contained in the report of \nthe Secretary-General on the causes of conflict and the promotion \nof durable peace and sustainable development in Africa\n \n20-11527\n4/13 \n \nand condemning the illicit trade in and proliferation of arms, especially small arms \nand light weapons,  \n \nAcknowledging that the achievement of durable peace and sustainable \ndevelopment in countries affected by conflict, in conflict and in post-conflict \nsituations requires that national Governments and international partners continue to \ndevelop coordinated approaches tailored to the peacebuilding needs and challenges \nfaced by those countries,  \n \nEmphasizing the importance of a comprehensive approach to sustaining peace, \nparticularly through the prevention of conflict and addressing its root causes, \nstrengthening the rule of law at the international and national levels, and promoting \nsustained and sustainable economic growth, poverty eradication, social development, \nsustainable development, national reconciliation and unity, including through \ninclusive dialogue and mediation, access to justice and transitional justice, \naccountability, good governance, democracy, accountable institutions, gender \nequality and respect for, and protection of, human rights and fundamental freedoms,  \n \nRecognizing that effective peacebuilding must involve the entire United Nations \nsystem, consistent with the respective mandates of missions and the Charter, and in \nthis regard emphasizing the importance of joint analysis and effective strategic \nplanning across the United Nations system in its long-term engagement in conflict-\naffected countries, and where appropriate, in cooperation and coordination with \nregional and subregional organizations, \n \nReaffirming, in this regard, the importance of the Peacebuilding Commission as \na dedicated intergovernmental advisory body to address, within its existing mandate \nand in an integrated manner, the special needs of countries affected by conflict and to \nassist them in laying the foundation for peace and sustainable development, taking \ninto consideration national priorities and the principle of national ownership, \n \nWelcoming the work of the Peacebuilding Commission in bringing a strategic \napproach and coherence to international peacebuilding efforts, and recognizing the \nvaluable work done in all its configurations and meetings, \n \nReaffirming the primary responsibility of national Governments and authorities \nin identifying, driving and directing priorities, strategies and activities for \npeacebuilding and sustaining peace, and in this regard emphasizing that inclusivity is \nkey to advancing national peacebuilding processes and objectives in order to ensure \nthat the needs of all segments of society are taken into account, \n \nRecalling the adoption of Security Council resolution 2413 (2018) and General \nAssembly resolution 72/276, on 26 April 2018, reaffirming Council resolution \n2282 (2016) and Assembly resolution 70/262, both of 27 April 2016, on the review of \nthe United Nations peacebuilding architecture, affirming the importance of \npeacebuilding and sustaining peace, and recognizing the importance of their \nimplementation for strengthening the Peacebuilding Commission and enabling it to \nrealize its full potential, in accordance with Assembly resolution 60/180 and Council \nresolution 1645 (2005), both of 20 December 2005, and Assembly resolution 65/7 and \nCouncil resolution 1947 (2010), both of 29 October 2010, and in this regard \nwelcoming the workshop on the theme \u201cPeacebuilding and sustaining peace in Africa: \ntowards a coherent approach to the peace continuum\u201d, held in Addis Ababa on 12 and \n13 November 2019, which provided perspectives from Africa on the 2020 review \nprocess and the need to consolidate the regional dimension in the activities of the \nPeacebuilding Commission in Africa, \n \nRenewing \nits \nunwavering \ncommitment \nto \nstrengthening \ninternational \ncooperation to prevent and combat terrorism in all its forms and manifestations, and \n\nImplementation of the recommendations contained in the report of \nthe Secretary-General on the causes of conflict and the promotion \nof durable peace and sustainable development in Africa \n \n5/13\n20-11527 \n \nreaffirming that any acts of terrorism are criminal and unjustifiable, regardless of their \nmotivation, wherever, whenever and by whomsoever committed, \n \nRecognizing that international cooperation and any measures taken by Member \nStates to prevent and combat terrorism, as well as to prevent violent extremism as and \nwhen conducive to terrorism, must fully comply with their obligations under \ninternational law, including the Charter, in particular the purposes and principles \nthereof, and relevant international conventions and protocols, as well as their \nobligations under international human rights law, refugee law and international \nhumanitarian law,  \n \nReaffirming that terrorism and violent extremism as and when conducive to \nterrorism cannot and should not be associated with any religion, nationality, \ncivilization or ethnic group, \n \nEncouraging the United Nations system, the African Union and subregional \norganizations to enhance their interaction with civil society, including women\u2019s and \nyouth associations, academia and research institutions, on issues relevant to the \npromotion of peace, security and sustainable development in Africa, and welcoming \nthe ongoing efforts in this regard, including by the Office of the Special Adviser on \nAfrica, \n \n1. \nTakes note of the report of the Secretary-General on the implementation of \nthe recommendations contained in his report on the causes of conflict and the \npromotion of durable peace and sustainable development in Africa; 9  \n \n2. \nRecalls the adoption of the African Union Agenda 2063 and its first \n10-year implementation plan (2014\u20132023), which outlines key African flagship \nprojects, fast-track programmes, priority areas, specific targets and African strategies \nand policy measures at all levels, and acknowledges the importance of supporting the \nimplementation of the plan; \n \n3. \nWelcomes, in this regard, the high-level events organized during the 2020 \nAfrica Dialogue Series on the theme \u201cCOVID-19 and silencing the guns in Africa: \nchallenges and opportunities\u201d, organized by the Office of the Special Adviser on \nAfrica, in close partnership with the African Union Commission, the African Union \nDevelopment Agency, the African Peer Review Mechanism, regional economic \ncommunities and the United Nations system; \n \n4. \nAlso welcomes the progress made by African countries, the African Union \nand subregional organizations in conflict prevention, peacemaking, peacekeeping, \npeacebuilding and development, calls for intensified efforts and a coordinated \napproach \namong \nnational \nGovernments, \nthe African \nUnion, \nsubregional \norganizations, the United Nations system and relevant partners in addressing those \nchallenges, with a view to achieving further progress towards the goal of a conflict-\nfree Africa, and in this regard recognizes the important role played by civil society \norganizations, including women\u2019s organizations;  \n \n5. \nStresses the importance of creating an environment conducive to national \nreconciliation, transitional justice and social and economic recovery in countries \nemerging from conflict, and calls upon the United Nations system, the international \ncommunity and all partners to support the efforts of African countries to promote \npolitical, social and economic inclusion; \n \n6. \nRecognizes that international and regional efforts to prevent conflict and \nconsolidate peace in Africa should be channelled towards the sustainable \ndevelopment of Africa and the human and institutional capacity-building of African \n__________________ \n \n9  A/74/301-S/2019/645. \n\nA/RES/74/302 \nImplementation of the recommendations contained in the report of \nthe Secretary-General on the causes of conflict and the promotion \nof durable peace and sustainable development in Africa\n \n20-11527\n6/13 \n \ncountries and organizations, particularly in priority areas identified at the continental \nlevel; \n \n7. \nEncourages African Governments to strengthen structures and policies in \norder to create an environment conducive to the promotion of sustainable, inclusive \neconomic growth and to attracting foreign direct investment, and invites the \ninternational community to assist in that process by providing adequate financial and \ntechnical assistance and by renewing its commitment to efforts aimed at combating \nthe illegal exploitation of the natural resources of those countries, in conformity with \ninternational law; \n \n8. \nCalls upon the international community to enhance support and fulfil its \ncommitments to take further action in areas critical to Africa\u2019s economic and social \ndevelopment, in the spirit of win-win cooperation and to create a shared future, based \nupon our common humanity, and welcomes the efforts by development partners to \nstrengthen cooperation with the New Partnership for Africa\u2019s Development;10  \n \n9. \nRecognizes the need for African countries to make continued efforts to \ncreate enabling environments for inclusive growth in support of sustainable \ndevelopment and for the international community to make continued efforts to \nincrease the flow of new and additional resources for financing for development from \nall sources, public and private, domestic and foreign, to support those development \nefforts by African countries, and welcomes the various important initiatives \nestablished between African countries and their development partners in this regard;  \n \n10. Urges continued support for measures to address the challenges of poverty \neradication and hunger, decent job creation and sustainable development in Africa, \nincluding, as appropriate, debt relief, improved market access, regional integration \nand intra-African trade, including through the African Continental Free Trade Area, \nsupport for the private sector and entrepreneurship, fulfilment of commitments on \nofficial development assistance and increased flows of foreign direct investment and \ntransfer of technology on mutually agreed terms; \n \n11. \nRecalls, in this regard, the high-level expert group meeting on the theme \n\u201cTackling the socioeconomic root causes of conflict towards achieving the goal of a \nconflict-free Africa in the context of the implementation of Africa\u2019s transformative \nAgenda 2063 and the global 2030 Agenda for Sustainable Development\u201d, held in \nCairo on 16 and 17 November 2015; \n \n12. Underlines the importance of the strategic partnerships among the United \nNations, the African Union and the regional economic communities, including in \npromoting an integrated and coherent implementation of the 2030 Agenda for \nSustainable Development5 and the African Union Agenda 2063; \n \n13. Recognizes the adverse effects of climate change and natural disasters on \nthe sustainable development of African Member States, including through drought, \ndesertification, biodiversity loss, land degradation, flooding and food insecurity, and \nemphasizes the need for adequate risk assessment and risk management strategies by \nthe respective Governments of African Member States and the United Nations;  \n \n14. Underlines the need to address the economic, social and environmental \nimpact of climate change, desertification and land degradation in Africa, and \nhighlights the importance of supporting efforts to strengthen the implementation of \ninitiatives aimed at enhancing resilience in Africa, in particular the Comprehensive \nAfrica Agriculture Development Programme and other initiatives launched under the \nleadership of the African Union Commission such as the Great Green Wall and the \nLand Policy Initiative, as well as initiatives launched by African countries such as the \n__________________ \n \n10  A/57/304, annex. \n\nImplementation of the recommendations contained in the report of \nthe Secretary-General on the causes of conflict and the promotion \nof durable peace and sustainable development in Africa \n \n7/13\n20-11527 \n \nAdaptation of African Agriculture and the Security, Stability and Sustainability \ninitiatives;  \n \n15. Welcomes, in this regard, the endorsement by African Heads of State and \nGovernment of the Inter-Basin Water Transfer initiative, as a pan-African project to \nrestore Lake Chad and promote its navigation and industrial and economic \ndevelopment, and encourages relevant United Nations entities and development \npartners to support such African-oriented initiatives for stabilization, recovery and \nclimate resilience; \n \n16. Recalls the African Union Convention for the Protection and Assistance of \nInternally Displaced Persons in Africa, which entered into force on 6 December 2012, \nand the Kampala Declaration on Refugees, Returnees and Internally Displaced \nPersons in Africa, adopted on 23 October 2009; \n \n17. Reaffirms the need to promote and protect effectively the human rights and \nfundamental freedoms of all migrants, regardless of their migration status, especially \nthose of women and children, and to address international migration through \ninternational, regional or bilateral cooperation and dialogue and through a \ncomprehensive and balanced approach, recognizing the roles and responsibilities of \ncountries of origin, transit and destination in promoting and protecting the human \nrights of all migrants and avoiding approaches that might aggravate their \nvulnerability, and recognizes in this regard the importance of the New York \nDeclaration for Refugees and Migrants, adopted at the high-level plenary meeting of \nthe General Assembly on addressing large movements of refugees and migrants, held \non 19 September 2016;11  \n \n18. Calls for the safeguarding of the principle of refugee protection in Africa \nand the resolution of the plight of refugees, including through support for efforts \naimed at addressing the causes of refugee movement and bringing about the voluntary, \ndignified, safe and sustainable return and reintegration of those populations, and calls \nupon the international community, including Member States, the Office of the United \nNations High Commissioner for Refugees and other relevant United Nations \norganizations, within their respective mandates, to take concrete action to meet the \nprotection and assistance needs of refugees, returnees and internally displaced \npersons and stateless persons and to contribute generously to projects and \nprogrammes aimed at alleviating their plight, facilitating durable solutions for \nrefugees and internally displaced persons and supporting vulnerable local host \ncommunities; \n \n19. Reaffirms the convening of the intergovernmental conference held on 10 \nand 11 December 2018 in Marrakech, Morocco, and recalls that it adopted the Global \nCompact for Safe, Orderly and Regular Migration, also known as the Marrakech \nCompact on Migration;12  \n \n20. Recalls the adoption of its resolution 73/150 of 17 December 2018 on \nassistance to refugees, returnees and displaced persons in Africa, and further recalls \nthe decision of African Heads of State and Government to proclaim 2019 the African \nYear of Refugees, Returnees and Internally Displaced Persons: Towards Durable \nSolutions to Forced Displacement in Africa; \n \n21. Notes the opportunities presented by Africa\u2019s demographic structure, and \nstresses the importance of addressing the socioeconomic dimension of youth \nunemployment as well as facilitating the enhanced participation of youth in decision-\n__________________ \n \n11  Resolution 71/1. \n \n12  Resolution 73/195, annex. \n\nA/RES/74/302 \nImplementation of the recommendations contained in the report of \nthe Secretary-General on the causes of conflict and the promotion \nof durable peace and sustainable development in Africa\n \n20-11527\n8/13 \n \nmaking processes, with a view to addressing social, political and economic \nchallenges, including the eradication of child labour and gender stereotypes; \n \n22. Reaffirms the important and positive contribution of youth to the efforts \nfor the maintenance and promotion of peace and security and the role young people \nplay in the prevention and resolution of conflicts, and as a key aspect of the \nsustainability, inclusiveness and success of peacekeeping and peacebuilding efforts, \nas well as in post-conflict situations, and encourages all those involved in planning \nfor disarmament, demobilization and reintegration to consider the needs of youth \naffected by armed conflict, including the problem of youth unemployment on the \ncontinent, by investing in building young people\u2019s capabilities and skills to meet \nlabour demands through relevant education opportunities designed in a manner that \npromotes a culture of peace; \n \n23. Expresses grave concern about the growing threat posed by terrorism, \nviolent extremism as and when conducive to terrorism, and foreign terrorist fighters \nto the peace, security and social and economic development of Africa; \n \n24. Recalls the initiative by the Secretary-General and his Plan of Action to \nPrevent Violent Extremism;13  \n \n25. Calls upon relevant United Nations entities, within their existing \nmandates, to intensify cooperation, assistance and capacity-building, for African \nMember States, the African Union and African subregional organizations, upon their \nrequest, in the fight against terrorism and violent extremism as and when conducive \nto terrorism, through the implementation of relevant international and regional \ntreaties and protocols, and in this regard welcomes in particular African initiatives, \nnamely the African Union Plan of Action on the Prevention and Combating of \nTerrorism in Africa, the African Centre for Studies and Research on Terrorism, based \nin Algiers, and the Intergovernmental Authority on Development Centre of \nExcellence in Preventing and Countering Violent Extremism in the Horn of Africa, \nbased in Djibouti, as well as the Community of Sahel-Saharan States Counter-\nTerrorism Centre, based in Cairo; \n \n26. Recalls the decision on the establishment of the African Union Special \nFund on the Prevention and Combating of Terrorism and Violent Extremism in Africa, \nadopted in Kigali in July 2016, and encourages the United Nations system and \nMember States to support the efforts of the African Union in this regard; \n \n27. Notes the ongoing efforts of the African Union, in collaboration with \nregional economic communities and development partners, including the United \nNations system, to \u201csilence the guns in Africa by 2020\u201d, and welcomes the African \nUnion summit decision, adopted in February 2020, proclaiming \u201cSilencing the guns: \ncreating conducive conditions for Africa\u2019s development\u201d as the theme for 2020, as \nwell as the African Union decision on the implementation of the African Union Master \nRoad Map of Practical Steps for Silencing the Guns in Africa by 2020, and calls upon \nMember States and the United Nations system, as appropriate, to intensify their \nsupport and cooperation with African countries, the African Union and the African \nregional economic communities and relevant regional mechanisms towards the timely \nrealization of this goal; \n \n28. Takes note of the convening of a general debate on cooperation between \nthe United Nations and regional and subregional organizations in maintaining \ninternational peace and security: silencing the guns in Africa by the Security Council, \nand welcomes its adoption of resolution 2457 (2019) on 27 February 2019; \n__________________ \n \n13  See A/70/674. \n\nImplementation of the recommendations contained in the report of \nthe Secretary-General on the causes of conflict and the promotion \nof durable peace and sustainable development in Africa \n \n9/13\n20-11527 \n \n \n29. Notes that in some armed conflict situations, the illicit exploitation, \ntrafficking and trade in natural resources has contributed to the outbreak, escalation \nor continuation of such conflicts, and further notes resolutions adopted on this issue \nto support the prevention of the illegal exploitation of natural resources; \n \n30. Stresses the critical importance of a regional approach to conflict \nprevention, in particular with respect to cross-border issues such as transnational \norganized crime, drug trafficking, disarmament, demobilization, repatriation, \nresettlement and reintegration programmes, the prevention of illegal exploitation of \nnatural resources and trafficking in high-value commodities and the illicit trade in \nsmall arms and light weapons in all its aspects, and emphasizes in this regard the \ncentral role of the African Union and subregional organizations in addressing such \nissues; \n \n31. Emphasizes that the illicit flow of arms, particularly small arms and light \nweapons, to rebel armed groups, terrorists and criminals contributes significantly to \ninsecurity and violence in various parts of Africa and undermines social cohesion, \npublic security, socioeconomic development and the normal functioning of State \ninstitutions; \n \n32. Underlines the link in certain circumstances between illicit financial \nflows, organized crime, transnational crime, terrorism, poaching and the illicit \nproliferation of conventional weapons, and in this regard urges Member States to take \neffective measures to holistically address all root causes of conflicts and redouble \nefforts to effectively curb the illicit flow of conventional weapons into and within \nAfrica, including by taking the necessary steps at the national level to implement the \nProgramme of Action to Prevent, Combat and Eradicate the Illicit Trade in Small \nArms and Light Weapons in All Its Aspects;14  \n \n33. Calls upon the United Nations system, and invites Member States, to assist \nAfrican countries emerging from conflict, upon their request as appropriate, in their \nefforts to build national capacities, including through national security sector reform \nstrategies, transitional justice and the disarmament, demobilization and reintegration \nof ex-combatants, including children formerly associated with armed forces or armed \ngroups; \n \n34. Welcomes the ongoing efforts of the African Union and subregional \norganizations to strengthen their capacity in peacekeeping operations on the \ncontinent, in accordance with Chapter VIII of the Charter of the United Nations and \nin close coordination with the United Nations, through the Peace and Security Council \nof the African Union, as well as the ongoing efforts to develop a continental early \nwarning system, strengthen the readiness of the African Standby Force and enhance \nmediation capacity and preventive diplomacy, including through the Panel of the \nWise; \n \n35. Recognizes the growing and emerging challenges and risks facing United \nNations peacekeeping operations and political missions, and in this regard recalls the \nAction for Peacekeeping initiative, the report of the High-level Independent Panel on \nPeace Operations15 and the report of the Secretary-General entitled \u201cThe future of \nUnited Nations peace operations: implementation of the recommendations of the \nHigh-level Independent Panel on Peace Operations\u201d,16 as well as recommendations \nsupported by Member States in the report of the Special Committee on Peacekeeping \n__________________ \n \n14  Report of the United Nations Conference on the Illicit Trade in Small Arms and Light Weapons in \nAll Its Aspects, New York, 9\u201320 July 2001 (A/CONF.192/15), chap. IV, para. 24. \n \n15  See A/70/95-S/2015/446. \n \n16  A/70/357-S/2015/682. \n\nA/RES/74/302 \nImplementation of the recommendations contained in the report of \nthe Secretary-General on the causes of conflict and the promotion \nof durable peace and sustainable development in Africa\n \n20-11527\n10/13 \n \nOperations, 17 in particular on prevention, mediation and stronger global regional \npartnerships, including between the United Nations and the African Union, and \nencourages the Security Council, as appropriate, to consult with relevant regional \norganizations, particularly the African Union, especially if transitioning from a \nregional to a United Nations peacekeeping operation; \n \n36. Also recognizes the role of the Peacebuilding Commission in ensuring that \nnational ownership of the peacebuilding process in countries under consideration is \nobserved and that nationally identified priorities are at the core of international and \nregional efforts in peacebuilding and sustaining peace in the countries under \nconsideration, notes the important steps taken by the Commission in engaging with a \nbroad range of country and regional situations, and calls for sustained regional and \ninternational \ncommitment \nto \nthe \nimplementation \nof \nnationally \nidentified \npeacebuilding priorities; \n \n37. Welcomes the bridging role of the Peacebuilding Commission as a \ndedicated intergovernmental advisory body to bring together all the relevant actors in \nthe United Nations system in accordance with its mandate to promote a strategic \napproach and coherence in international peacebuilding efforts, and invites in this \nregard the Commission, in exercising its advisory role to the General Assembly, to \nprovide written input/advice on the engagement of the Commission in efforts aimed \nat addressing the root causes of conflicts and building peace in Africa, for the \nconsideration by the General Assembly at upcoming sessions of the item on the causes \nof conflict and the promotion of durable peace and sustainable development in Africa; \n \n38. Recognizes the progress made by the Peacebuilding Commission in \nenhancing its relationship with regional and subregional organizations in Africa, in \nparticular the African Union, and in this regard recalls the signing of a memorandum \nof understanding on peacebuilding between the Peacebuilding Support Office and the \nAfrican Union Commission on 18 September 2017 with a view to strengthening the \ncollaboration between the United Nations and the African Union to provide a \nframework and strengthen cooperation in support of peacebuilding and sustaining \npeace efforts in Africa; \n \n39. Recalls, in this regard, decision Assembly/AU/Dec.729(XXXII) of \n11 February 2019 of the Assembly of Heads of State and Government of the African \nUnion on revitalizing and operationalizing the African Union Policy on Post-Conflict \nReconstruction and Development, while aligning it with the evolving international \ndiscourse on peacebuilding and sustaining peace and the actual needs of countries \nemerging from conflict in Africa, and calls upon the United Nations system and \nMember States to support the peace consolidation mechanisms and processes, \nincluding the African Peace and Security Architecture, the African Governance \nArchitecture, the African Union Post-Conflict Reconstruction and Development \nFramework and the African Union Centre for Post-Conflict Reconstruction and \nDevelopment, in order to fully contribute to conflict prevention, peacemaking \ninitiatives, peacebuilding and post-conflict reconstruction; \n \n40. Calls upon Member States to assist African countries in post-conflict \nsituations, at their request, in achieving a smooth transition from relief to \ndevelopment and to support relevant United Nations bodies, including the \nPeacebuilding Commission, and encourage increased efforts to support ongoing \nregional efforts to build African mediation and negotiation capacity; \n \n41. Calls upon the United Nations system and Member States to support the \nAfrican Union in its effort to effectively integrate training in international \nhumanitarian law and international human rights law, with particular emphasis on the \n__________________ \n \n17  Official Records of the General Assembly, Seventy-fourth Session, Supplement No. 19 (A/74/19). \n\nImplementation of the recommendations contained in the report of \nthe Secretary-General on the causes of conflict and the promotion \nof durable peace and sustainable development in Africa \n \n11/13\n20-11527 \n \nrights of women and children, into the training of civilian, police and military \npersonnel of national standby contingents at both the operational and tactical levels, \nas set out in article 13 of the Protocol relating to the Establishment of the Peace and \nSecurity Council of the African Union; \n \n42. Notes with concern that conflict-related sexual violence continues and may \nincrease even as armed conflicts draw to an end, urges further progress in the \nimplementation of policies and guidelines relating to the protection of and assistance \nto women and children in conflict and post-conflict situations in Africa, including \nmore systematic monitoring and reporting, notes the adoption by the General \nAssembly and the Security Council of relevant resolutions, including Council \nresolution 2467 (2019), and encourages the entities that compose United Nations \nAction against Sexual Violence in Conflict, as well as other relevant parts of the \nUnited Nations system, to assist the Special Representative of the Secretary-General \non Sexual Violence in Conflict in the implementation of her mandate, including in \nAfrica;  \n \n43. Reiterates the calls for the full, effective and meaningful participation of \nwomen in conflict prevention and resolution, peacekeeping and peacebuilding, \nconsistent with relevant Security Council resolutions, including resolutions \n1325 (2000), 1820 (2008) and 2242 (2015) on women and peace and security, and \nrecalls in this regard the report of the Secretary-General containing the results of the \nglobal study on the implementation of resolution 1325 (2000), 18 recognizes with \nappreciation all the work undertaken for the global study, and encourages follow-up \nof its recommendations; \n \n44. Recalls the ongoing efforts of African countries and the African Union, \nincluding the work of the African Union Special Envoy on Women, Peace and \nSecurity, to ensure the protection of the rights of women in conflict and post-conflict \nsituations, recalls in this regard the adoption of national action plans on women, peace \nand security by several African countries, the various initiatives of the African Union, \nthe adoption and entry into force of the Protocol to the African Charter on Human and \nPeoples\u2019 Rights on the Rights of Women in Africa, the Solemn Declaration on Gender \nEquality in Africa, the African Union Gender Policy, the African Union five-year \nGender, Peace and Security Programme, 2015\u20132020, and the Southern African \nDevelopment Community Protocol on Gender and Development, as well as the \nFramework of Cooperation concerning the Prevention and Response to Conflict-\nrelated Sexual Violence in Africa signed by the African Union Commission and the \nUnited Nations, stresses the significance of those instruments for all countries in \nAfrica for strengthening the role of women in peace and conflict prevention on the \ncontinent, and strongly urges the United Nations and all relevant parties to redouble \ntheir efforts and provide support in this regard; \n \n45. Notes with concern the tragic plight of children in conflict situations in \nAfrica, in particular the phenomenon of the recruitment and use of children by parties \nto armed conflicts, sexual exploitation and abuse, as well as other violations and \nabuses committed against children, and in this regard takes note of efforts aimed at \npromoting education and the right to education and facilitating the continuation of \neducation in situations of armed conflict and protracted crises, stresses the need for \nthe protection of children in armed conflicts and for ensuring that the protection and \nrights of children in armed conflicts are integrated into all peace processes, also \nstresses the need for post-conflict, reintegration, rehabilitation and education, with \ndue regard for the relevant resolutions of the General Assembly and the Security \nCouncil, and encourages the relevant parts of the United Nations system to assist the \n__________________ \n \n18  S/2015/716. \n\nA/RES/74/302 \nImplementation of the recommendations contained in the report of \nthe Secretary-General on the causes of conflict and the promotion \nof durable peace and sustainable development in Africa\n \n20-11527\n12/13 \n \nSpecial Representative of the Secretary-General for Children and Armed Conflict in \nthe implementation of her mandate, including in Africa; \n \n46. Welcomes, in this regard, the ongoing efforts of the African Union to \nensure the protection of children in armed conflict and post-conflict situations, recalls \nthe adoption and entry into force of the African Charter on the Rights and Welfare of \nthe Child, as well as the declaration signed on 17 September 2013 by the Office of \nthe Special Representative of the Secretary-General for Children and Armed Conflict \nand the Peace and Security Department of the African Union Commission, in order to \nmainstream protection mechanisms in all peace and security activities of the African \nUnion, in close partnership with the United Nations Children\u2019s Fund, and stresses the \nsignificance of those instruments for all countries in Africa in protecting children \naffected by armed conflicts on the continent; \n \n47. Acknowledges the particular challenges that infectious disease outbreaks, \nincluding the Ebola virus disease and especially the impact of the coronavirus disease \n(COVID-19) pandemic, pose in conflict-affected areas and their effect on health crisis \nmanagement, as health systems in areas of conflict are often compromised and \nill-equipped to deal with the threat posed by infectious disease outbreaks, and strongly \ncondemns violent attacks and threats directed against medical personnel and facilities, \nwhich have long-term consequences for the civilian population and the health-care \nsystems of the countries concerned, as well as for the neighbouring regions, and have \na negative impact on sustainable development; \n \n48. Welcomes African-led initiatives to strengthen political, economic and \ncorporate governance, such as the African Charter on Democracy, Elections and \nGovernance and the African Peer Review Mechanism, encourages more African \ncountries to participate in this process, and calls upon the United Nations system and \nMember States to assist African countries and regional and subregional organizations, \nupon their request, in their ongoing efforts to promote democracy, constitutional order \nand the rule of law, to enhance good governance and to continue to fight against \nimpunity, as well as in the holding of free, fair, inclusive, peaceful and transparent \nelections; \n \n49. Recognizes, in this regard, the important contribution of the African Peer \nReview Mechanism since its inception in improving governance and supporting \nsocioeconomic development in African countries, and takes note of the decision \nadopted by the Assembly of Heads of State and Government of the African Union in \nJanuary 2017 on the revitalization of the African Peer Review Mechanism, expanding \nthe monitoring and evaluation mandate of the Mechanism, and invites the United \nNations system and Member States to provide voluntary substantial financial and \ncapacity-building support to the Mechanism to advance its activities; \n \n50. Reaffirms the importance of the role of the Interdepartmental Task Force \non African Affairs and the Regional Coordination Mechanism for Africa in ensuring \ngreater coherence and coordination of United Nations system support to Africa, \nincluding support to the African Union, particularly in the areas of conflict prevention \nand conflict resolution, human rights, governance and the rule of law, and post-\nconflict reconstruction and development; \n \n51. Recalls the commitment of the African leaders to Africa\u2019s political, social \nand economic integration agenda and to the ideal of pan-Africanism and African \nrenaissance, as well as their effort to achieve the goal of a conflict-free Africa by \n2020, as affirmed in the solemn declaration adopted on 26 May 2013 on the occasion \nof the fiftieth anniversary of the Organization of African Unity/African Union, \nexpresses its readiness to contribute, and calls upon all, in particular relevant United \nNations entities, to help to achieve this goal; \n\nImplementation of the recommendations contained in the report of \nthe Secretary-General on the causes of conflict and the promotion \nof durable peace and sustainable development in Africa \n \n13/13\n20-11527 \n \n \n52. Recalls the adoption of its resolution 71/254 of 23 December 2016 on the \nFramework for a Renewed United Nations-African Union Partnership on Africa\u2019s \nIntegration and Development Agenda 2017\u20132027, and calls upon the Secretary-\nGeneral to provide, as appropriate, predictable support for full, effective and efficient \nimplementation of the Framework; \n \n53. Also recalls relevant resolutions on the strengthening of cooperation and \ncommunication between the United Nations and regional and subregional \norganizations or arrangements, and encourages enhanced coordination and \ncooperation in advocacy and in the mobilization of the support of the international \ncommunity for African countries and towards the priorities of their continental and \nregional institutions; \n \n54. Calls upon the United Nations system and Member States, bilateral and \nmultilateral partners and new partners to deliver expeditiously on commitments and \nto ensure the full and speedy implementation of the provisions of the political \ndeclaration on Africa\u2019s development needs,7 as well as the implementation of the New \nPartnership for Africa\u2019s Development; \n \n55. Emphasizes the importance of deepening cooperation between the United \nNations and the African Union, based on consultations, regular meetings at all levels, \nshared analysis, comparative advantages and division of labour to better address \ntoday\u2019s challenges, in accordance with Chapter VIII of the Charter of the United \nNations; \n \n56. Recalls the convening of the third United Nations-African Union annual \nconference at the level of the Secretary-General and the Chairperson of the African \nUnion Commission at United Nations Headquarters on 6 May 2019, and reaffirms the \ncommitment to continue to deepen the strategic partnership between the United \nNations and the African Union in addressing peace and security issues, achieving \nsustainable development and implementing Agenda 2063 in Africa; \n \n57. Takes note of the recommendations presented by the Secretary-General to \nthe General Assembly at its sixty-seventh session on possible ways to strengthen the \ninterdepartmental task force on African affairs, 19 and reaffirms the need to ensure \nfurther coherence and an integrated approach for United Nations support to Africa, \nincluding in following up on the implementation of all global summit and conference \noutcomes related to Africa; \n \n58. Requests the Secretary-General to continue to monitor and report to the \nGeneral Assembly on an annual basis on persistent and emerging challenges to the \npromotion of durable peace and sustainable development in Africa, including the root \ncauses of conflict and conditions to promote sustainable development, as well as on \nthe approach and support of the United Nations system.  \n \n62nd plenary meeting \n3 September 2020 \n \n__________________ \n \n19  See A/67/205/Add.1-S/2012/715/Add.1. \n",
  "paragraphs": {
    "1": "Takes note of the report of the Secretary-General on the implementation of the recommendations contained in his report on the causes of conflict and the promotion of durable peace and sustainable development in Africa; 9",
    "2": "Recalls the adoption of the African Union Agenda 2063 and its first 10-year implementation plan (2014\u20132023), which outlines key African flagship projects, fast-track programmes, priority areas, specific targets and African strategies and policy measures at all levels, and acknowledges the importance of supporting the implementation of the plan;",
    "3": "Welcomes, in this regard, the high-level events organized during the 2020 Africa Dialogue Series on the theme \u201cCOVID-19 and silencing the guns in Africa: challenges and opportunities\u201d, organized by the Office of the Special Adviser on Africa, in close partnership with the African Union Commission, the African Union Development Agency, the African Peer Review Mechanism, regional economic communities and the United Nations system;",
    "4": "Also welcomes the progress made by African countries, the African Union and subregional organizations in conflict prevention, peacemaking, peacekeeping, peacebuilding and development, calls for intensified efforts and a coordinated approach among national Governments, the African Union, subregional organizations, the United Nations system and relevant partners in addressing those challenges, with a view to achieving further progress towards the goal of a conflict- free Africa, and in this regard recognizes the important role played by civil society organizations, including women\u2019s organizations;",
    "5": "Stresses the importance of creating an environment conducive to national reconciliation, transitional justice and social and economic recovery in countries emerging from conflict, and calls upon the United Nations system, the international community and all partners to support the efforts of African countries to promote political, social and economic inclusion;",
    "6": "Recognizes that international and regional efforts to prevent conflict and consolidate peace in Africa should be channelled towards the sustainable development of Africa and the human and institutional capacity-building of African countries and organizations, particularly in priority areas identified at the continental level;",
    "7": "Encourages African Governments to strengthen structures and policies in order to create an environment conducive to the promotion of sustainable, inclusive economic growth and to attracting foreign direct investment, and invites the international community to assist in that process by providing adequate financial and technical assistance and by renewing its commitment to efforts aimed at combating the illegal exploitation of the natural resources of those countries, in conformity with international law;",
    "8": "Calls upon the international community to enhance support and fulfil its commitments to take further action in areas critical to Africa\u2019s economic and social development, in the spirit of win-win cooperation and to create a shared future, based upon our common humanity, and welcomes the efforts by development partners to strengthen cooperation with the New Partnership for Africa\u2019s Development;10",
    "9": "Recognizes the need for African countries to make continued efforts to create enabling environments for inclusive growth in support of sustainable development and for the international community to make continued efforts to increase the flow of new and additional resources for financing for development from all sources, public and private, domestic and foreign, to support those development efforts by African countries, and welcomes the various important initiatives established between African countries and their development partners in this regard;",
    "10": "Urges continued support for measures to address the challenges of poverty eradication and hunger, decent job creation and sustainable development in Africa, including, as appropriate, debt relief, improved market access, regional integration and intra-African trade, including through the African Continental Free Trade Area, support for the private sector and entrepreneurship, fulfilment of commitments on official development assistance and increased flows of foreign direct investment and transfer of technology on mutually agreed terms;",
    "11": "Recalls, in this regard, the high-level expert group meeting on the theme \u201cTackling the socioeconomic root causes of conflict towards achieving the goal of a conflict-free Africa in the context of the implementation of Africa\u2019s transformative Agenda 2063 and the global 2030 Agenda for Sustainable Development\u201d, held in Cairo on 16 and 17 November 2015;",
    "12": "Underlines the importance of the strategic partnerships among the United Nations, the African Union and the regional economic communities, including in promoting an integrated and coherent implementation of the 2030 Agenda for Sustainable Development5 and the African Union Agenda 2063;",
    "13": "Recognizes the adverse effects of climate change and natural disasters on the sustainable development of African Member States, including through drought, desertification, biodiversity loss, land degradation, flooding and food insecurity, and emphasizes the need for adequate risk assessment and risk management strategies by the respective Governments of African Member States and the United Nations;",
    "14": "Underlines the need to address the economic, social and environmental impact of climate change, desertification and land degradation in Africa, and highlights the importance of supporting efforts to strengthen the implementation of initiatives aimed at enhancing resilience in Africa, in particular the Comprehensive Africa Agriculture Development Programme and other initiatives launched under the leadership of the African Union Commission such as the Great Green Wall and the Land Policy Initiative, as well as initiatives launched by African countries such as the Adaptation of African Agriculture and the Security, Stability and Sustainability initiatives;",
    "15": "Welcomes, in this regard, the endorsement by African Heads of State and Government of the Inter-Basin Water Transfer initiative, as a pan-African project to restore Lake Chad and promote its navigation and industrial and economic development, and encourages relevant United Nations entities and development partners to support such African-oriented initiatives for stabilization, recovery and climate resilience;",
    "16": "Recalls the African Union Convention for the Protection and Assistance of Internally Displaced Persons in Africa, which entered into force on 6 December 2012, and the Kampala Declaration on Refugees, Returnees and Internally Displaced Persons in Africa, adopted on 23 October 2009;",
    "17": "Reaffirms the need to promote and protect effectively the human rights and fundamental freedoms of all migrants, regardless of their migration status, especially those of women and children, and to address international migration through international, regional or bilateral cooperation and dialogue and through a comprehensive and balanced approach, recognizing the roles and responsibilities of countries of origin, transit and destination in promoting and protecting the human rights of all migrants and avoiding approaches that might aggravate their vulnerability, and recognizes in this regard the importance of the New York Declaration for Refugees and Migrants, adopted at the high-level plenary meeting of the General Assembly on addressing large movements of refugees and migrants, held on 19 September 2016;11",
    "18": "Calls for the safeguarding of the principle of refugee protection in Africa and the resolution of the plight of refugees, including through support for efforts aimed at addressing the causes of refugee movement and bringing about the voluntary, dignified, safe and sustainable return and reintegration of those populations, and calls upon the international community, including Member States, the Office of the United Nations High Commissioner for Refugees and other relevant United Nations organizations, within their respective mandates, to take concrete action to meet the protection and assistance needs of refugees, returnees and internally displaced persons and stateless persons and to contribute generously to projects and programmes aimed at alleviating their plight, facilitating durable solutions for refugees and internally displaced persons and supporting vulnerable local host communities;",
    "19": "Reaffirms the convening of the intergovernmental conference held on 10 and 11 December 2018 in Marrakech, Morocco, and recalls that it adopted the Global Compact for Safe, Orderly and Regular Migration, also known as the Marrakech Compact on Migration;12",
    "20": "Recalls the adoption of its resolution 73/150 of 17 December 2018 on assistance to refugees, returnees and displaced persons in Africa, and further recalls the decision of African Heads of State and Government to proclaim 2019 the African Year of Refugees, Returnees and Internally Displaced Persons: Towards Durable Solutions to Forced Displacement in Africa;",
    "21": "Notes the opportunities presented by Africa\u2019s demographic structure, and stresses the importance of addressing the socioeconomic dimension of youth unemployment as well as facilitating the enhanced participation of youth in decision- making processes, with a view to addressing social, political and economic challenges, including the eradication of child labour and gender stereotypes;",
    "22": "Reaffirms the important and positive contribution of youth to the efforts for the maintenance and promotion of peace and security and the role young people play in the prevention and resolution of conflicts, and as a key aspect of the sustainability, inclusiveness and success of peacekeeping and peacebuilding efforts, as well as in post-conflict situations, and encourages all those involved in planning for disarmament, demobilization and reintegration to consider the needs of youth affected by armed conflict, including the problem of youth unemployment on the continent, by investing in building young people\u2019s capabilities and skills to meet labour demands through relevant education opportunities designed in a manner that promotes a culture of peace;",
    "23": "Expresses grave concern about the growing threat posed by terrorism, violent extremism as and when conducive to terrorism, and foreign terrorist fighters to the peace, security and social and economic development of Africa;",
    "24": "Recalls the initiative by the Secretary-General and his Plan of Action to Prevent Violent Extremism;13",
    "25": "Calls upon relevant United Nations entities, within their existing mandates, to intensify cooperation, assistance and capacity-building, for African Member States, the African Union and African subregional organizations, upon their request, in the fight against terrorism and violent extremism as and when conducive to terrorism, through the implementation of relevant international and regional treaties and protocols, and in this regard welcomes in particular African initiatives, namely the African Union Plan of Action on the Prevention and Combating of Terrorism in Africa, the African Centre for Studies and Research on Terrorism, based in Algiers, and the Intergovernmental Authority on Development Centre of Excellence in Preventing and Countering Violent Extremism in the Horn of Africa, based in Djibouti, as well as the Community of Sahel-Saharan States Counter- Terrorism Centre, based in Cairo;",
    "26": "Recalls the decision on the establishment of the African Union Special Fund on the Prevention and Combating of Terrorism and Violent Extremism in Africa, adopted in Kigali in July 2016, and encourages the United Nations system and Member States to support the efforts of the African Union in this regard;",
    "27": "Notes the ongoing efforts of the African Union, in collaboration with regional economic communities and development partners, including the United Nations system, to \u201csilence the guns in Africa by 2020\u201d, and welcomes the African Union summit decision, adopted in February 2020, proclaiming \u201cSilencing the guns: creating conducive conditions for Africa\u2019s development\u201d as the theme for 2020, as well as the African Union decision on the implementation of the African Union Master Road Map of Practical Steps for Silencing the Guns in Africa by 2020, and calls upon Member States and the United Nations system, as appropriate, to intensify their support and cooperation with African countries, the African Union and the African regional economic communities and relevant regional mechanisms towards the timely realization of this goal;",
    "28": "Takes note of the convening of a general debate on cooperation between the United Nations and regional and subregional organizations in maintaining international peace and security: silencing the guns in Africa by the Security Council, and welcomes its adoption of resolution 2457 (2019) on 27 February 2019;",
    "29": "Notes that in some armed conflict situations, the illicit exploitation, trafficking and trade in natural resources has contributed to the outbreak, escalation or continuation of such conflicts, and further notes resolutions adopted on this issue to support the prevention of the illegal exploitation of natural resources;",
    "30": "Stresses the critical importance of a regional approach to conflict prevention, in particular with respect to cross-border issues such as transnational organized crime, drug trafficking, disarmament, demobilization, repatriation, resettlement and reintegration programmes, the prevention of illegal exploitation of natural resources and trafficking in high-value commodities and the illicit trade in small arms and light weapons in all its aspects, and emphasizes in this regard the central role of the African Union and subregional organizations in addressing such issues;",
    "31": "Emphasizes that the illicit flow of arms, particularly small arms and light weapons, to rebel armed groups, terrorists and criminals contributes significantly to insecurity and violence in various parts of Africa and undermines social cohesion, public security, socioeconomic development and the normal functioning of State institutions;",
    "32": "Underlines the link in certain circumstances between illicit financial flows, organized crime, transnational crime, terrorism, poaching and the illicit proliferation of conventional weapons, and in this regard urges Member States to take effective measures to holistically address all root causes of conflicts and redouble efforts to effectively curb the illicit flow of conventional weapons into and within Africa, including by taking the necessary steps at the national level to implement the Programme of Action to Prevent, Combat and Eradicate the Illicit Trade in Small Arms and Light Weapons in All Its Aspects;14",
    "33": "Calls upon the United Nations system, and invites Member States, to assist African countries emerging from conflict, upon their request as appropriate, in their efforts to build national capacities, including through national security sector reform strategies, transitional justice and the disarmament, demobilization and reintegration of ex-combatants, including children formerly associated with armed forces or armed groups;",
    "34": "Welcomes the ongoing efforts of the African Union and subregional organizations to strengthen their capacity in peacekeeping operations on the continent, in accordance with Chapter VIII of the Charter of the United Nations and in close coordination with the United Nations, through the Peace and Security Council of the African Union, as well as the ongoing efforts to develop a continental early warning system, strengthen the readiness of the African Standby Force and enhance mediation capacity and preventive diplomacy, including through the Panel of the Wise;",
    "35": "Recognizes the growing and emerging challenges and risks facing United Nations peacekeeping operations and political missions, and in this regard recalls the Action for Peacekeeping initiative, the report of the High-level Independent Panel on Peace Operations15 and the report of the Secretary-General entitled \u201cThe future of United Nations peace operations: implementation of the recommendations of the High-level Independent Panel on Peace Operations\u201d,16 as well as recommendations supported by Member States in the report of the Special Committee on Peacekeeping Operations, 17 in particular on prevention, mediation and stronger global regional partnerships, including between the United Nations and the African Union, and encourages the Security Council, as appropriate, to consult with relevant regional organizations, particularly the African Union, especially if transitioning from a regional to a United Nations peacekeeping operation;",
    "36": "Also recognizes the role of the Peacebuilding Commission in ensuring that national ownership of the peacebuilding process in countries under consideration is observed and that nationally identified priorities are at the core of international and regional efforts in peacebuilding and sustaining peace in the countries under consideration, notes the important steps taken by the Commission in engaging with a broad range of country and regional situations, and calls for sustained regional and international commitment to the implementation of nationally identified peacebuilding priorities;",
    "37": "Welcomes the bridging role of the Peacebuilding Commission as a dedicated intergovernmental advisory body to bring together all the relevant actors in the United Nations system in accordance with its mandate to promote a strategic approach and coherence in international peacebuilding efforts, and invites in this regard the Commission, in exercising its advisory role to the General Assembly, to provide written input/advice on the engagement of the Commission in efforts aimed at addressing the root causes of conflicts and building peace in Africa, for the consideration by the General Assembly at upcoming sessions of the item on the causes of conflict and the promotion of durable peace and sustainable development in Africa;",
    "38": "Recognizes the progress made by the Peacebuilding Commission in enhancing its relationship with regional and subregional organizations in Africa, in particular the African Union, and in this regard recalls the signing of a memorandum of understanding on peacebuilding between the Peacebuilding Support Office and the African Union Commission on 18 September 2017 with a view to strengthening the collaboration between the United Nations and the African Union to provide a framework and strengthen cooperation in support of peacebuilding and sustaining peace efforts in Africa;",
    "39": "Recalls, in this regard, decision Assembly/AU/Dec.729(XXXII) of 11 February 2019 of the Assembly of Heads of State and Government of the African Union on revitalizing and operationalizing the African Union Policy on Post-Conflict Reconstruction and Development, while aligning it with the evolving international discourse on peacebuilding and sustaining peace and the actual needs of countries emerging from conflict in Africa, and calls upon the United Nations system and Member States to support the peace consolidation mechanisms and processes, including the African Peace and Security Architecture, the African Governance Architecture, the African Union Post-Conflict Reconstruction and Development Framework and the African Union Centre for Post-Conflict Reconstruction and Development, in order to fully contribute to conflict prevention, peacemaking initiatives, peacebuilding and post-conflict reconstruction;",
    "40": "Calls upon Member States to assist African countries in post-conflict situations, at their request, in achieving a smooth transition from relief to development and to support relevant United Nations bodies, including the Peacebuilding Commission, and encourage increased efforts to support ongoing regional efforts to build African mediation and negotiation capacity;",
    "41": "Calls upon the United Nations system and Member States to support the African Union in its effort to effectively integrate training in international humanitarian law and international human rights law, with particular emphasis on the rights of women and children, into the training of civilian, police and military personnel of national standby contingents at both the operational and tactical levels, as set out in article 13 of the Protocol relating to the Establishment of the Peace and Security Council of the African Union;",
    "42": "Notes with concern that conflict-related sexual violence continues and may increase even as armed conflicts draw to an end, urges further progress in the implementation of policies and guidelines relating to the protection of and assistance to women and children in conflict and post-conflict situations in Africa, including more systematic monitoring and reporting, notes the adoption by the General Assembly and the Security Council of relevant resolutions, including Council resolution 2467 (2019), and encourages the entities that compose United Nations Action against Sexual Violence in Conflict, as well as other relevant parts of the United Nations system, to assist the Special Representative of the Secretary-General on Sexual Violence in Conflict in the implementation of her mandate, including in Africa;",
    "43": "Reiterates the calls for the full, effective and meaningful participation of women in conflict prevention and resolution, peacekeeping and peacebuilding, consistent with relevant Security Council resolutions, including resolutions 1325 (2000), 1820 (2008) and 2242 (2015) on women and peace and security, and recalls in this regard the report of the Secretary-General containing the results of the global study on the implementation of resolution 1325 (2000), 18 recognizes with appreciation all the work undertaken for the global study, and encourages follow-up of its recommendations;",
    "44": "Recalls the ongoing efforts of African countries and the African Union, including the work of the African Union Special Envoy on Women, Peace and Security, to ensure the protection of the rights of women in conflict and post-conflict situations, recalls in this regard the adoption of national action plans on women, peace and security by several African countries, the various initiatives of the African Union, the adoption and entry into force of the Protocol to the African Charter on Human and Peoples\u2019 Rights on the Rights of Women in Africa, the Solemn Declaration on Gender Equality in Africa, the African Union Gender Policy, the African Union five-year Gender, Peace and Security Programme, 2015\u20132020, and the Southern African Development Community Protocol on Gender and Development, as well as the Framework of Cooperation concerning the Prevention and Response to Conflict- related Sexual Violence in Africa signed by the African Union Commission and the United Nations, stresses the significance of those instruments for all countries in Africa for strengthening the role of women in peace and conflict prevention on the continent, and strongly urges the United Nations and all relevant parties to redouble their efforts and provide support in this regard;",
    "45": "Notes with concern the tragic plight of children in conflict situations in Africa, in particular the phenomenon of the recruitment and use of children by parties to armed conflicts, sexual exploitation and abuse, as well as other violations and abuses committed against children, and in this regard takes note of efforts aimed at promoting education and the right to education and facilitating the continuation of education in situations of armed conflict and protracted crises, stresses the need for the protection of children in armed conflicts and for ensuring that the protection and rights of children in armed conflicts are integrated into all peace processes, also stresses the need for post-conflict, reintegration, rehabilitation and education, with due regard for the relevant resolutions of the General Assembly and the Security Council, and encourages the relevant parts of the United Nations system to assist the Special Representative of the Secretary-General for Children and Armed Conflict in the implementation of her mandate, including in Africa;",
    "46": "Welcomes, in this regard, the ongoing efforts of the African Union to ensure the protection of children in armed conflict and post-conflict situations, recalls the adoption and entry into force of the African Charter on the Rights and Welfare of the Child, as well as the declaration signed on 17 September 2013 by the Office of the Special Representative of the Secretary-General for Children and Armed Conflict and the Peace and Security Department of the African Union Commission, in order to mainstream protection mechanisms in all peace and security activities of the African Union, in close partnership with the United Nations Children\u2019s Fund, and stresses the significance of those instruments for all countries in Africa in protecting children affected by armed conflicts on the continent;",
    "47": "Acknowledges the particular challenges that infectious disease outbreaks, including the Ebola virus disease and especially the impact of the coronavirus disease (COVID-19) pandemic, pose in conflict-affected areas and their effect on health crisis management, as health systems in areas of conflict are often compromised and ill-equipped to deal with the threat posed by infectious disease outbreaks, and strongly condemns violent attacks and threats directed against medical personnel and facilities, which have long-term consequences for the civilian population and the health-care systems of the countries concerned, as well as for the neighbouring regions, and have a negative impact on sustainable development;",
    "48": "Welcomes African-led initiatives to strengthen political, economic and corporate governance, such as the African Charter on Democracy, Elections and Governance and the African Peer Review Mechanism, encourages more African countries to participate in this process, and calls upon the United Nations system and Member States to assist African countries and regional and subregional organizations, upon their request, in their ongoing efforts to promote democracy, constitutional order and the rule of law, to enhance good governance and to continue to fight against impunity, as well as in the holding of free, fair, inclusive, peaceful and transparent elections;",
    "49": "Recognizes, in this regard, the important contribution of the African Peer Review Mechanism since its inception in improving governance and supporting socioeconomic development in African countries, and takes note of the decision adopted by the Assembly of Heads of State and Government of the African Union in January 2017 on the revitalization of the African Peer Review Mechanism, expanding the monitoring and evaluation mandate of the Mechanism, and invites the United Nations system and Member States to provide voluntary substantial financial and capacity-building support to the Mechanism to advance its activities;",
    "50": "Reaffirms the importance of the role of the Interdepartmental Task Force on African Affairs and the Regional Coordination Mechanism for Africa in ensuring greater coherence and coordination of United Nations system support to Africa, including support to the African Union, particularly in the areas of conflict prevention and conflict resolution, human rights, governance and the rule of law, and post- conflict reconstruction and development;",
    "51": "",
    "52": "Recalls the adoption of its resolution 71/254 of 23 December 2016 on the Framework for a Renewed United Nations-African Union Partnership on Africa\u2019s Integration and Development Agenda 2017\u20132027, and calls upon the Secretary- General to provide, as appropriate, predictable support for full, effective and efficient implementation of the Framework;",
    "53": "Also recalls relevant resolutions on the strengthening of cooperation and communication between the United Nations and regional and subregional organizations or arrangements, and encourages enhanced coordination and cooperation in advocacy and in the mobilization of the support of the international community for African countries and towards the priorities of their continental and regional institutions;",
    "54": "Calls upon the United Nations system and Member States, bilateral and multilateral partners and new partners to deliver expeditiously on commitments and to ensure the full and speedy implementation of the provisions of the political declaration on Africa\u2019s development needs,7 as well as the implementation of the New Partnership for Africa\u2019s Development;",
    "55": "Emphasizes the importance of deepening cooperation between the United Nations and the African Union, based on consultations, regular meetings at all levels, shared analysis, comparative advantages and division of labour to better address today\u2019s challenges, in accordance with Chapter VIII of the Charter of the United Nations;",
    "56": "Recalls the convening of the third United Nations-African Union annual conference at the level of the Secretary-General and the Chairperson of the African Union Commission at United Nations Headquarters on 6 May 2019, and reaffirms the commitment to continue to deepen the strategic partnership between the United Nations and the African Union in addressing peace and security issues, achieving sustainable development and implementing Agenda 2063 in Africa;",
    "57": "Takes note of the recommendations presented by the Secretary-General to the General Assembly at its sixty-seventh session on possible ways to strengthen the interdepartmental task force on African affairs, 19 and reaffirms the need to ensure further coherence and an integrated approach for United Nations support to Africa, including in following up on the implementation of all global summit and conference outcomes related to Africa;",
    "58": "Requests the Secretary-General to continue to monitor and report to the General Assembly on an annual basis on persistent and emerging challenges to the promotion of durable peace and sustainable development in Africa, including the root causes of conflict and conditions to promote sustainable development, as well as on the approach and support of the United Nations system."
  },
  "agenda_items": [
    "Item 64"
  ],
  "symbol_references": [
    "A/74/L.69"
  ]
}