{
  "symbol": "A/RES/77/69",
  "filename": "A_RES_77_69.pdf",
  "title": "77/69. Transparency in armaments",
  "text": "United Nations \nA/RES/77/69\n \n \nGeneral Assembly \nDistr.: General \n14 December 2022 \n \n22-28160 (E)    191222     \n*2228160* \n \n \nSeventy-seventh session \nAgenda item 99 (f) \nGeneral and complete disarmament: transparency \nin armaments \n \n \n \n \n Resolution adopted by the General Assembly \non 7 December 2022 \n \n \n \n \n[on the report of the First Committee (A/77/385, para. 110)] \n \n \n \n77/69. Transparency in armaments \n \n \n \nThe General Assembly, \n \nRecalling its resolutions 46/36 L of 9 December 1991, 47/52 L of 15 December \n1992, 48/75 E of 16 December 1993, 49/75 C of 15 December 1994, 50/70 D of \n12 December 1995, 51/45 H of 10 December 1996, 52/38 R of 9 December 1997, \n53/77 V of 4 December 1998, 54/54 O of 1 December 1999, 55/33 U of 20 November \n2000, 56/24 Q of 29 November 2001, 57/75 of 22 November 2002, 58/54 of \n8 December 2003, 60/226 of 23 December 2005, 61/77 of 6 December 2006, 63/69 \nof 2 December 2008, 64/54 of 2 December 2009, 66/39 of 2 December 2011, 68/43 \nof 5 December 2013, 71/44 of 5 December 2016 and 74/53 of 12 December 2019, \nentitled \u201cTransparency in armaments\u201d, \n \nContinuing to take the view that an enhanced level of transparency in armaments \ncontributes greatly to confidence-building and security among States and that the \nestablishment of the United Nations Register of Conventional Arms constitutes an \nimportant step forward in the promotion of transparency in military matters, \n \nWelcoming, in that regard, the thirtieth anniversary of the establishment of the \nRegister as an important element in the contribution of the United Nations to \ninternational peace and security, \n \nWelcoming also the consolidated reports of the Secretary-General on the \nRegister, which include the returns of Member States for 2018,1 20192 and 2020,3  \n \nWelcoming further the 2022 report of the Secretary-General on the continuing \noperation of the Register and its further development, prepared with the assistance of \n__________________ \n \n1 A/74/201. \n \n2 A/75/152. \n \n3 A/76/130. \n\nA/RES/77/69 \nTransparency in armaments\n \n22-28160\n2/3 \n \nthe 2022 group of governmental experts,4 including the recommendation that those \nMember States in a position to do so, using the seven-plus-one formula, provide \ninformation on exports and imports of small arms and light weapons, as appropriate, \nthrough the online reporting tool or the optional standardized form for reporting \ninternational transfers of small arms and light weapons, \n \nWelcoming the response of Member States to the request contained in \nparagraphs 9 and 10 of resolution 46/36 L to provide data on their imports and exports \nof arms, as well as available background information regarding their military \nholdings, procurement through national production and relevant policies, \n \nRecalling the entry into force of the Arms Trade Treaty5 on 24 December 2014, \nand also recalling that the data and information reported by States parties to the Arms \nTrade Treaty on the export and import of eight categories of conventional arms \nincluded in their annual reports can also be submitted to the Register, \n \nWelcoming the consensus report of the 2022 group of governmental experts, \nnearly half of whom were women, in which the group highlighted the continued \nimportance of the Register as an instrument to support transparency, confidence-\nbuilding and dialogue in military matters, \n \nExpressing its concern at the low number of reports that have been submitted to \nthe Register by the Member States,  \n \nNoting the concern expressed in the report of the 2022 group of governmental \nexperts that the current level of resources of the Secretariat in the field of database \nmanagement is insufficient, and its recommendation that the United Nations provide \nsufficient resources to enable the Secretariat to implement its core tasks for the \neffective operation of the Register, \n \nStressing that the continuing operation of the Register and its further \ndevelopment should be reviewed in order to secure a Register that is capable of \nattracting the widest possible participation, \n \n1. \nReaffirms its determination to ensure the effective operation of the United \nNations Register of Conventional Arms, as provided for in paragraphs 7 to 10 of \nresolution 46/36 L; \n \n2. \nEndorses the report of the Secretary-General on the continuing operation \nof the Register and its further development and the recommendations contained in the \nconsensus report of the 2022 group of governmental experts; 6 \n \n3. \nEmphasizes that it is important for those Member States in a position to do \nso, using the seven-plus-one formula, to provide information on exports and imports \nof small arms and light weapons, and decides to adapt the scope of the Register in \nconformity with the recommendations contained in the 2022 report of the Secretary-\nGeneral; \n \n4. \nCalls upon Member States, with a view to achieving universal \nparticipation, to provide the Secretary-General, by 31 May annually, with the \nrequested data and information for the Register, including nil reports and rolling nil \nreturns if appropriate, using the online reporting tool, on the basis of resolutions \n46/36 L and 47/52 L and the recommendations contained in the respective reports of \nthe Secretary-General on the continuing operation of the Register and its further \ndevelopment;  \n__________________ \n \n4 See A/77/126. \n \n5 United Nations, Treaty Series, vol. 3013, No. 52373. \n \n6 See A/77/126. \n\nTransparency in armaments \nA/RES/77/69\n \n3/3\n22-28160 \n \n \n5. \nInvites Member States in a position to do so, pending further development \nof the Register, to provide additional information on procurement through national \nproduction and military holdings as part of their background information and to make \nuse of the reference reporting form, or any other method they deem appropriate, for \nthe respective elements; \n \n6. \nReaffirms its decision, with a view to further development of the Register, \nto keep the scope of, participation in and use of the Register under review, and to that \nend requests the Secretary-General, with the assistance of a group of governmental \nexperts to be convened for a week each at the end of 2024 and at the beginning and \nin the middle of 2025, within existing resources, with the broadest possible \nparticipation, and on the basis of equitable geographical representation, to prepare a \nreport on the continuing operation and relevance of the Register, including by \nexploring the relationship between the participation in, scope of and use of the \nRegister, and its further development, taking into account the work of the Conference \non Disarmament, relevant deliberations within the United Nations, the views \nexpressed by Member States and the reports of the Secretary-General on the \ncontinuing operation of the Register and its further development, with a view to taking \na decision at its eightieth session; \n \n7. \nRequests the Secretary-General to implement the recommendations \ncontained in his 2000, 2003, 2006, 2009, 2013, 2016, 2019 and 2022 reports on the \ncontinuing operation of the Register and its further development, in particular the \nrecommendations contained in paragraphs 116 (a) to (u) of the consensus report of \nthe 2022 group of governmental experts that are specifically addressed to the \nSecretariat; \n \n8. \nAlso requests the Secretary-General in that regard to ensure that sufficient \nresources are made available by the United Nations, within existing resources, to \nenable the Secretariat to effectively implement its core functions for the effective \noperation of the Register, as outlined in paragraphs 116 (a) to (u) of the 2022 report, \nincluding in relation to the recommendation in paragraph 116 (g) pertaining to the \ntranslation of the online reporting tool and the Register database website into all six \nofficial languages of the United Nations, and to ensure that sufficient resources at the \nappropriate levels are provided in that regard; \n \n9. \nInvites the Conference on Disarmament to consider continuing its work \nundertaken in the field of transparency in armaments; \n \n10. Reiterates its call upon all Member States to cooperate at the regional and \nsubregional levels, taking fully into account the specific conditions prevailing in the \nregion or subregion, with a view to enhancing and coordinating international and \nregional efforts aimed at increased openness and transparency in armaments; \n \n11. \nRequests the Secretary-General to report to the General Assembly at its \neightieth session on progress made in implementing the present resolution; \n \n12. Decides to include in the provisional agenda of its eightieth session, under \nthe item entitled \u201cGeneral and complete disarmament\u201d, the sub-item entitled \n\u201cTransparency in armaments\u201d. \n \n46th plenary meeting \n7 December 2022 \n \n",
  "paragraphs": {
    "1": "Reaffirms its determination to ensure the effective operation of the United Nations Register of Conventional Arms, as provided for in paragraphs 7 to 10 of resolution 46/36 L;",
    "2": "Endorses the report of the Secretary-General on the continuing operation of the Register and its further development and the recommendations contained in the consensus report of the 2022 group of governmental experts; 6",
    "3": "Emphasizes that it is important for those Member States in a position to do so, using the seven-plus-one formula, to provide information on exports and imports of small arms and light weapons, and decides to adapt the scope of the Register in conformity with the recommendations contained in the 2022 report of the Secretary- General;",
    "4": "Calls upon Member States, with a view to achieving universal participation, to provide the Secretary-General, by 31 May annually, with the requested data and information for the Register, including nil reports and rolling nil returns if appropriate, using the online reporting tool, on the basis of resolutions 46/36 L and 47/52 L and the recommendations contained in the respective reports of the Secretary-General on the continuing operation of the Register and its further development;",
    "5": "Invites Member States in a position to do so, pending further development of the Register, to provide additional information on procurement through national production and military holdings as part of their background information and to make use of the reference reporting form, or any other method they deem appropriate, for the respective elements;",
    "6": "Reaffirms its decision, with a view to further development of the Register, to keep the scope of, participation in and use of the Register under review, and to that end requests the Secretary-General, with the assistance of a group of governmental experts to be convened for a week each at the end of 2024 and at the beginning and in the middle of 2025, within existing resources, with the broadest possible participation, and on the basis of equitable geographical representation, to prepare a report on the continuing operation and relevance of the Register, including by exploring the relationship between the participation in, scope of and use of the Register, and its further development, taking into account the work of the Conference on Disarmament, relevant deliberations within the United Nations, the views expressed by Member States and the reports of the Secretary-General on the continuing operation of the Register and its further development, with a view to taking a decision at its eightieth session;",
    "7": "Requests the Secretary-General to implement the recommendations contained in his 2000, 2003, 2006, 2009, 2013, 2016, 2019 and 2022 reports on the continuing operation of the Register and its further development, in particular the recommendations contained in paragraphs 116 (a) to (u) of the consensus report of the 2022 group of governmental experts that are specifically addressed to the Secretariat;",
    "8": "Also requests the Secretary-General in that regard to ensure that sufficient resources are made available by the United Nations, within existing resources, to enable the Secretariat to effectively implement its core functions for the effective operation of the Register, as outlined in paragraphs 116 (a) to (u) of the 2022 report, including in relation to the recommendation in paragraph 116 (g) pertaining to the translation of the online reporting tool and the Register database website into all six official languages of the United Nations, and to ensure that sufficient resources at the appropriate levels are provided in that regard;",
    "9": "Invites the Conference on Disarmament to consider continuing its work undertaken in the field of transparency in armaments;",
    "10": "Reiterates its call upon all Member States to cooperate at the regional and subregional levels, taking fully into account the specific conditions prevailing in the region or subregion, with a view to enhancing and coordinating international and regional efforts aimed at increased openness and transparency in armaments;",
    "11": "Requests the Secretary-General to report to the General Assembly at its eightieth session on progress made in implementing the present resolution;",
    "12": "Decides to include in the provisional agenda of its eightieth session, under the item entitled \u201cGeneral and complete disarmament\u201d, the sub-item entitled \u201cTransparency in armaments\u201d."
  },
  "agenda_items": [
    "Item 99"
  ],
  "symbol_references": []
}