{
  "symbol": "A/RES/79/250",
  "filename": "A_RES_79_250.pdf",
  "title": "79/250. Scale of assessments for the apportionment of the expenses of the United Nations peacekeeping operations",
  "text": "United Nations \nA/RES/79/250\n \n \nGeneral Assembly \nDistr.: General \n31 December 2024 \n \n24-24689 (E)     \n*2424689* \n \n \nSeventy-ninth session \nAgenda item 154 \nScale of assessments for the apportionment of the expenses \nof the United Nations peacekeeping operations \n \n \n \n \n Resolution adopted by the General Assembly \non 24 December 2024 \n \n \n \n \n[on the report of the Fifth Committee (A/79/669, para. 8)] \n \n \n 79/250. Scale of assessments for the apportionment of the expenses of the \nUnited Nations peacekeeping operations \n \n \n \nThe General Assembly, \n \nRecalling its resolutions 55/235 and 55/236 of 23 December 2000, 58/256 of \n23 December 2003, 61/243 of 22 December 2006, 64/249 of 24 December 2009, \n67/239 of 24 December 2012, 70/246 of 23 December 2015, 73/272 of 22 December \n2018 and 76/239 of 24 December 2021, \n \nReaffirming the principles set out in its resolutions 1874 (S-IV) of 27 June 1963, \n3101 (XXVIII) of 11 December 1973 and 55/235, \n \nRecalling its request to the Secretary-General, in paragraph 15 of its resolution \n55/235, to update the composition of the levels of contribution of Member States for \npeacekeeping operations described in the resolution on a triennial basis, in \nconjunction with the regular budget scale of assessment reviews, in accordance with \nthe criteria established in the resolution, and to report thereon to the General \nAssembly, \n \nHaving considered the report of the Secretary-General on the implementation of \nresolutions 55/235 and 55/236,1 \n \n1. \nReaffirms that the determination of the scale of assessments for the \napportionment of the expenses of United Nations peacekeeping operations shall \nremain the prerogative of the General Assembly; \n__________________ \n \n1  A/79/318. \n\nA/RES/79/250 \nScale of assessments for the apportionment of the expenses of the \nUnited Nations peacekeeping operations\n \n24-24689\n2/4 \n \n \n2. \nTakes note of the report of the Secretary-General and of the updated \ncomposition of levels of contribution for peacekeeping operations for the period from \n2025 to 2027 contained therein;2 \n \n3. \nReaffirms the following general principles underlying the financing of \nUnited Nations peacekeeping operations:  \n \n(a) \nThe financing of such operations is the collective responsibility of all \nStates Members of the United Nations and, accordingly, the costs of peacekeeping \noperations are expenses of the Organization to be borne by Member States in \naccordance with Article 17, paragraph 2, of the Charter of the United Nations; \n \n(b) \nIn order to meet the expenditures caused by such operations, a different \nprocedure is required from that applied to meet expenditures under the regular budget \nof the United Nations; \n \n(c) \nWhereas the economically more developed countries are in a position to \nmake relatively larger contributions to peacekeeping operations, the economically \nless developed countries have a relatively limited capacity to contribute towards \npeacekeeping operations involving heavy expenditures; \n \n(d) \nThe special responsibilities of the permanent members of the Security \nCouncil for the maintenance of peace and security should be borne in mind in \nconnection with their contributions to the financing of peace and security operations; \n \n(e) \nWhere circumstances warrant, the General Assembly should give special \nconsideration to the situation of any Member States which are victims of, and those \nwhich are otherwise involved in, the events or actions leading to a peacekeeping \noperation; \n \n4. \nAlso reaffirms that assessment rates for the financing of peacekeeping \noperations should be based on the scale of assessments for the regular budget of the \nUnited Nations, with an appropriate and transparent system of adjustments based on \nthe levels of Member States, consistent with the principles outlined above; \n \n5. \nRecognizes the need to reform the current methodology for apportioning \nthe expenses of peacekeeping operations, and desires to address the issue in an \neffective and expeditious manner; \n \n6. \nReaffirms that the permanent members of the Security Council should \nform a separate level and that, consistent with their special responsibilities for the \nmaintenance of peace and security, they should be assessed at a higher rate than for \nthe regular budget; \n \n7. \nAlso reaffirms that all discounts resulting from adjustments to the regular \nbudget assessment rates of Member States in levels C to J shall be borne on a pro rata \nbasis by the permanent members of the Security Council; \n \n8. \nFurther reaffirms that the statistical data used for setting the rates of \nassessment for peacekeeping should be the same as the data used in preparing the \nregular budget scale of assessments, subject to the provisions of the present resolution; \n \n9. \nReaffirms that the least developed countries should be placed in a separate \nlevel and receive the highest rate of discount available under the scale; \n \n10. Also reaffirms the decision to create levels of discount to facilitate \nautomatic, predictable movement between categories on the basis of the per capita \ngross national income of Member States; \n__________________ \n \n2  Ibid., annex II. \n\nScale of assessments for the apportionment of the expenses of the \nUnited Nations peacekeeping operations \nA/RES/79/250\n \n3/4\n24-24689 \n \n \n11. Decides that, as from 1 January 2025, the rates of assessment for \npeacekeeping should be based on the 10 levels of contribution and parameters set \nforth in the table below:  \n \nLevel \nCriterion \nThreshold in United States \ndollars (2025\u20132027) \nDiscount \n(percentage) \nA \nPermanent members of the Security Council \nNot applicable \nPremium \nB \nAll Member States, except those covered below and level A \nNot applicable \n0 \nC \nAs listed in the annex to General Assembly resolution 55/235 \nNot applicable \n7.5 \nD \nMember States with per capita gross national income less than 2 times the average \nfor all Member States (except level A, C and J contributors) \nUnder 22,946 \n20 \nE \nMember States with per capita gross national income less than 1.8 times the \naverage for all Member States (except level A, C and J contributors) \nUnder 20,651 \n40 \nF \nMember States with per capita gross national income less than 1.6 times the \naverage for all Member States (except level A, C and J contributors) \nUnder 18,357 \n60 \nG \nMember States with per capita gross national income less than 1.4 times the \naverage for all Member States (except level A, C and J contributors) \nUnder 16,062 \n70 \nH \nMember States with per capita gross national income less than 1.2 times the \naverage for all Member States (except level A, C and J contributors) \nUnder 13,768 \n80 (or 70 on a \nvoluntary basis)a \nI \nMember States with per capita gross national income less than the average for all \nMember States (except level A, C and J contributors) \nUnder 11,473 \n80 \nJ \nLeast developed countries (except level A and C contributors) \nNot applicable \n90 \n \n \na Member States in level H* have a discount of 70 per cent. \n \n \n \n12. Encourages States Members of the United Nations at all levels to move up \nvoluntarily in their level of contribution; \n \n13. Welcomes with appreciation the commitment of certain Member States to \nundertake voluntarily to contribute to peacekeeping operations at a rate higher than \nrequired by their per capita income; \n \n14. Recalls its decision that, at any time during the scale period, a Member \nState may make a voluntary commitment to contribute at a rate higher than its current \nrate by informing the General Assembly through the Secretary-General, and that the \nAssembly may take note of that decision; \n \n15. Reaffirms that Member States will be assigned to the lowest level of \ncontribution with the highest discount for which they are eligible, unless they indicate \na decision to move to a higher level; \n \n16. Also reaffirms that, for purposes of determining the eligibility of Member \nStates for contribution in particular levels during the 2025\u20132027 scale period, the \naverage per capita gross national income of all Member States will be 11,473 United \nStates dollars and the per capita gross national income of Member States will be the \naverage of 2017 to 2022 figures; \n \n17. Further reaffirms that transition periods of two years will apply to \ncountries moving up by two levels, and that transition periods of three years will \napply to countries moving up by three or more levels without prejudice to paragraph \n15 above; \n \n18. Reaffirms that transitions as specified above will occur in equal increments \nover the transition period as designated above; \n\nA/RES/79/250 \nScale of assessments for the apportionment of the expenses of the \nUnited Nations peacekeeping operations\n \n24-24689\n4/4 \n \n \n19. Endorses the updated composition of levels to be applied in adjusting \nregular budget scale rates to establish Member States\u2019 rates of assessment for \npeacekeeping operations for the period from 2025 to 2027;3 \n \n20. Requests the Secretary-General to continue to update the composition of \nthe levels described above on a triennial basis, in conjunction with the regular budget \nscale of assessment reviews, in accordance with the criteria established above, and to \nreport thereon to the General Assembly; \n \n21. Decides to review the structure of the levels of the scale of assessments \nfor the apportionment of the expenses of United Nations peacekeeping operations \nduring its eighty-second session. \n \n55th (resumed) plenary meeting \n24 December 2024 \n \n__________________ \n \n3  A/79/318/Add.1, annex. \n",
  "paragraphs": {
    "1": "Reaffirms that the determination of the scale of assessments for the apportionment of the expenses of United Nations peacekeeping operations shall remain the prerogative of the General Assembly;",
    "2": "Takes note of the report of the Secretary-General and of the updated composition of levels of contribution for peacekeeping operations for the period from 2025 to 2027 contained therein;2",
    "3": "Reaffirms the following general principles underlying the financing of United Nations peacekeeping operations: (a) The financing of such operations is the collective responsibility of all States Members of the United Nations and, accordingly, the costs of peacekeeping operations are expenses of the Organization to be borne by Member States in accordance with Article 17, paragraph 2, of the Charter of the United Nations; (b) In order to meet the expenditures caused by such operations, a different procedure is required from that applied to meet expenditures under the regular budget of the United Nations; (c) Whereas the economically more developed countries are in a position to make relatively larger contributions to peacekeeping operations, the economically less developed countries have a relatively limited capacity to contribute towards peacekeeping operations involving heavy expenditures; (d) The special responsibilities of the permanent members of the Security Council for the maintenance of peace and security should be borne in mind in connection with their contributions to the financing of peace and security operations; (e) Where circumstances warrant, the General Assembly should give special consideration to the situation of any Member States which are victims of, and those which are otherwise involved in, the events or actions leading to a peacekeeping operation;",
    "4": "Also reaffirms that assessment rates for the financing of peacekeeping operations should be based on the scale of assessments for the regular budget of the United Nations, with an appropriate and transparent system of adjustments based on the levels of Member States, consistent with the principles outlined above;",
    "5": "Recognizes the need to reform the current methodology for apportioning the expenses of peacekeeping operations, and desires to address the issue in an effective and expeditious manner;",
    "6": "Reaffirms that the permanent members of the Security Council should form a separate level and that, consistent with their special responsibilities for the maintenance of peace and security, they should be assessed at a higher rate than for the regular budget;",
    "7": "Also reaffirms that all discounts resulting from adjustments to the regular budget assessment rates of Member States in levels C to J shall be borne on a pro rata basis by the permanent members of the Security Council;",
    "8": "Further reaffirms that the statistical data used for setting the rates of assessment for peacekeeping should be the same as the data used in preparing the regular budget scale of assessments, subject to the provisions of the present resolution;",
    "9": "Reaffirms that the least developed countries should be placed in a separate level and receive the highest rate of discount available under the scale;",
    "10": "Also reaffirms the decision to create levels of discount to facilitate automatic, predictable movement between categories on the basis of the per capita gross national income of Member States;",
    "11": "Decides that, as from 1 January 2025, the rates of assessment for peacekeeping should be based on the 10 levels of contribution and parameters set forth in the table below: Level Criterion Threshold in United States dollars (2025\u20132027) Discount (percentage) A Permanent members of the Security Council Not applicable Premium B All Member States, except those covered below and level A Not applicable 0 C As listed in the annex to General Assembly resolution 55/235 Not applicable 7.5 D Member States with per capita gross national income less than 2 times the average for all Member States (except level A, C and J contributors) Under 22,946 20 E Member States with per capita gross national income less than 1.8 times the average for all Member States (except level A, C and J contributors) Under 20,651 40 F Member States with per capita gross national income less than 1.6 times the average for all Member States (except level A, C and J contributors) Under 18,357 60 G Member States with per capita gross national income less than 1.4 times the average for all Member States (except level A, C and J contributors) Under 16,062 70 H Member States with per capita gross national income less than 1.2 times the average for all Member States (except level A, C and J contributors) Under 13,768 80 (or 70 on a voluntary basis)a I Member States with per capita gross national income less than the average for all Member States (except level A, C and J contributors) Under 11,473 80 J Least developed countries (except level A and C contributors) Not applicable 90 a Member States in level H* have a discount of 70 per cent.",
    "12": "Encourages States Members of the United Nations at all levels to move up voluntarily in their level of contribution;",
    "13": "Welcomes with appreciation the commitment of certain Member States to undertake voluntarily to contribute to peacekeeping operations at a rate higher than required by their per capita income;",
    "14": "Recalls its decision that, at any time during the scale period, a Member State may make a voluntary commitment to contribute at a rate higher than its current rate by informing the General Assembly through the Secretary-General, and that the Assembly may take note of that decision;",
    "15": "Reaffirms that Member States will be assigned to the lowest level of contribution with the highest discount for which they are eligible, unless they indicate a decision to move to a higher level;",
    "16": "Also reaffirms that, for purposes of determining the eligibility of Member States for contribution in particular levels during the 2025\u20132027 scale period, the average per capita gross national income of all Member States will be 11,473 United States dollars and the per capita gross national income of Member States will be the average of 2017 to 2022 figures;",
    "17": "Further reaffirms that transition periods of two years will apply to countries moving up by two levels, and that transition periods of three years will apply to countries moving up by three or more levels without prejudice to paragraph 15 above;",
    "18": "",
    "19": "Endorses the updated composition of levels to be applied in adjusting regular budget scale rates to establish Member States\u2019 rates of assessment for peacekeeping operations for the period from 2025 to 2027;3",
    "20": "Requests the Secretary-General to continue to update the composition of the levels described above on a triennial basis, in conjunction with the regular budget scale of assessment reviews, in accordance with the criteria established above, and to report thereon to the General Assembly;",
    "21": "Decides to review the structure of the levels of the scale of assessments for the apportionment of the expenses of United Nations peacekeeping operations during its eighty-second session."
  },
  "agenda_items": [
    "Item 154"
  ],
  "symbol_references": []
}