{
  "symbol": "A/RES/78/249",
  "filename": "A_RES_78_249.pdf",
  "title": "78/249. Financing of the International Residual Mechanism for Criminal Tribunals",
  "text": "United Nations \nA/RES/78/249\n \n \nGeneral Assembly \nDistr.: General \n28 December 2023 \n \n23-26263 (E)    050124 \n*2326263* \n \n \nSeventy-eighth session \nAgenda item 145 \nFinancing of the International Residual Mechanism for \nCriminal Tribunals \n \n \n \n \n Resolution adopted by the General Assembly \non 22 December 2023 \n \n \n \n \n[on the report of the Fifth Committee (A/78/661, para. 6)] \n \n \n 78/249. Financing of the International Residual Mechanism for \nCriminal Tribunals \n \n \n \nThe General Assembly,  \n \nHaving considered the reports of the Secretary-General on the budget \nperformance for 2022, the proposed budget for 2024 and the revised estimates arising \nfrom the effect of changes in rates of exchange and inflation for the International \nResidual Mechanism for Criminal Tribunals,1 the financial report and audited financial \nstatements for the year ended 31 December 2022 and the report of the Board of \nAuditors on the International Residual Mechanism for Criminal Tribunals 2 and the \nrecommendations contained therein, as well as the related reports of the Advisory \nCommittee on Administrative and Budgetary Questions,3 \n \nRecalling its resolution 66/240 A of 24 December 2011 on the financing of the \nInternational Residual Mechanism for Criminal Tribunals and its subsequent \nresolutions thereon, the latest of which was resolution 77/261 of 30 December 2022,  \n \n1. \nTakes note of the reports of the Secretary-General;  \n \n2. \nEndorses the conclusions and recommendations contained in the reports \nof the Advisory Committee on Administrative and Budgetary Questions, subject to \nthe provisions of the present resolution; \n \n3. \nReaffirms the high priority accorded to the work of the International \nResidual Mechanism for Criminal Tribunals;  \n__________________ \n \n1  A/78/390, A/78/534 and A/78/634.  \n \n2  Official Records of the General Assembly, Seventy-eighth Session, Supplement No. 5O \n(A/78/5/Add.15).  \n \n3  A/78/621 and A/78/7/Add.41. \n\nA/RES/78/249 \nFinancing of the International Residual Mechanism for Criminal \nTribunals\n \n23-26263\n2/3 \n \n \n4. \nRecalls paragraphs 17 and 23 of the report of the Advisory Committee, 4 \nand encourages the Mechanism to ensure the prompt and efficient completion of its \nremaining work; \n \n5. \nAlso recalls paragraph 12 of the report of the Advisory Committee, and \nencourages the Mechanism to complete the digitization of its archives, including \nthrough the use of voluntary contributions; \n \n6. \nNotes with appreciation the efforts made by the Mechanism to reduce its \ncosts and enhance its efficiency as well as the timeliness of its activities to make \ngreater use of the lessons learned and to adopt appropriate measures for achieving \nfurther operational savings and efficiencies, in order to ensure the expeditious \ncompletion of its work in a transparent, accountable and cost-effective manner; \n \n7. \nReiterates its request to the Secretary-General to develop a compendium \nof lessons learned and best practices from the closure of predecessor tribunals; \n \n8. \nNotes the importance of ensuring continued public consciousness of the \nevents leading to the establishment of the Mechanism, and requests the Mechanism \nto continue the provision of library services to the public within existing resources;  \n \n9. \nRecalls paragraph 7 of its resolution 74/272 of 13 April 2020, and requests \nthe Secretary-General to continue his efforts to settle all outstanding claims without \ndelay and to report thereon in the context of his next report; \n \n10. Requests the Secretary-General to continue to provide additional and \ndetailed information on the final expenditures and unencumbered balance, as well as \nits return to Member States in the context of the next report; \n \n11. \nNotes the efforts of the Mechanism to gradually downsize its operations in \nthe light of its reduced functions, and requests the Secretary-General to ensure that \nthe Mechanism continues to take measures in this regard; \n \n12. Reiterates its requests to the Secretary-General to continue his efforts to \npromote the nationalization of positions, as appropriate, and to report thereon in the \ncontext of his next budget proposal; \n \n13. Decides not to abolish one general temporary assistance position of \nProtocol Assistant (Local level) in the Arusha branch; \n \n14. Also decides to reduce non-post resources by the amount of 150,000 \nUnited States dollars;  \n \n15. Further decides to appropriate to the special account for the International \nResidual Mechanism for Criminal Tribunals a total amount of 65,459,100 dollars \ngross (60,132,400 dollars net) for 2024, as detailed in the annex to the present \nresolution;  \n \n16. Decides that the total assessment for 2024 under the special account \namounting to 55,107,500 dollars shall consist of:  \n \n(a) \n65,459,100 dollars, being the estimated appropriation approved for the \nperiod;  \n \n(b) \nLess 3,369,000 dollars, being the credit of the cancellation of prior period \nobligations/commitments corresponding to the year 2021, and other revenue;  \n \n(c) \nLess 6,982,600 dollars, being the surplus resulting from the final \nexpenditure for the budget for the year 2022;  \n__________________ \n \n4  A/78/621. \n\nFinancing of the International Residual Mechanism for Criminal \nTribunals \nA/RES/78/249\n \n3/3\n23-26263 \n \n \n17. Also decides to apportion the amount of 27,553,750 dollars gross \n(25,176,900 dollars net) among Member States in accordance with the scale of \nassessments applicable to the regular budget of the United Nations for 2024;  \n \n18. Further decides to apportion the amount of 27,553,750 dollars gross \n(25,176,900 dollars net) among Member States in accordance with the scale of \nassessments applicable to peacekeeping operations of the United Nations for 2024;  \n \n19. Decides that, in accordance with the provisions of its resolution 973 (X) \nof 15 December 1955, there shall be set off against the apportionment among Member \nStates, as provided for in paragraphs 17 and 18 above, their respective share in the \nTax Equalization Fund of the estimated staff assessment income in the amount of \n4,753,700 dollars approved for the Mechanism for 2024.  \n \n50th (resumed) plenary meeting \n22 December 2023 \n \n \n \n \nAnnex \n \n \n \nFinancing of the International Residual Mechanism for Criminal Tribunals \nfor 2024 \n \n \nGross \nNet of staff \nassessment \n(United States dollars) \nEstimated appropriation for 2024a \n63 930 800 \n58 552 400 \nRevised estimates: effects of changes in rates of exchange and inflation b \n3 704 800 \n3 597 500 \nRecommendations of the Advisory Committee on Administrative and Budgetary \nQuestionsc \n(2 061 900) \n (1 897 200) \nRecommendations of the Fifth Committeec  \n(114 600) \n (120 300) \nEstimated initial appropriation for 2024 \n65 459 100 \n60 132 400 \nTotal assessment for 2024 \n \n \nRequirements for 2024 \n65 459 100 \n60 132 400 \nCancellation of commitments for the year 2021 and other revenue  \n(3 369 000) \n (3 369 000) \nSurplus resulting from the final expenditure for the budget for the year 2022  \n(6 982 600) \n (6 409 600) \nNet contributions assessed on Member States for 2024 \n55 107 500 \n50 353 800 \nOf which: \n \n \nContributions assessed on Member States in accordance with the scale of \nassessments applicable to the regular budget of the United Nations for 2024 \n27 553 750 \n25 176 900 \nContributions assessed on Member States in accordance with the scale of \nassessments applicable to peacekeeping operations of the United Nations for 2024 \n27 553 750 \n25 176 900 \n \n \na See A/78/534.  \n \nb See A/78/634.  \n \nc Reflects amounts after recosting. \n \n",
  "paragraphs": {
    "1": "Takes note of the reports of the Secretary-General;",
    "2": "Endorses the conclusions and recommendations contained in the reports of the Advisory Committee on Administrative and Budgetary Questions, subject to the provisions of the present resolution;",
    "3": "Reaffirms the high priority accorded to the work of the International Residual Mechanism for Criminal Tribunals;",
    "4": "Recalls paragraphs 17 and 23 of the report of the Advisory Committee, 4 and encourages the Mechanism to ensure the prompt and efficient completion of its remaining work;",
    "5": "Also recalls paragraph 12 of the report of the Advisory Committee, and encourages the Mechanism to complete the digitization of its archives, including through the use of voluntary contributions;",
    "6": "Notes with appreciation the efforts made by the Mechanism to reduce its costs and enhance its efficiency as well as the timeliness of its activities to make greater use of the lessons learned and to adopt appropriate measures for achieving further operational savings and efficiencies, in order to ensure the expeditious completion of its work in a transparent, accountable and cost-effective manner;",
    "7": "Reiterates its request to the Secretary-General to develop a compendium of lessons learned and best practices from the closure of predecessor tribunals;",
    "8": "Notes the importance of ensuring continued public consciousness of the events leading to the establishment of the Mechanism, and requests the Mechanism to continue the provision of library services to the public within existing resources;",
    "9": "Recalls paragraph 7 of its resolution 74/272 of 13 April 2020, and requests the Secretary-General to continue his efforts to settle all outstanding claims without delay and to report thereon in the context of his next report;",
    "10": "Requests the Secretary-General to continue to provide additional and detailed information on the final expenditures and unencumbered balance, as well as its return to Member States in the context of the next report;",
    "11": "Notes the efforts of the Mechanism to gradually downsize its operations in the light of its reduced functions, and requests the Secretary-General to ensure that the Mechanism continues to take measures in this regard;",
    "12": "Reiterates its requests to the Secretary-General to continue his efforts to promote the nationalization of positions, as appropriate, and to report thereon in the context of his next budget proposal;",
    "13": "Decides not to abolish one general temporary assistance position of Protocol Assistant (Local level) in the Arusha branch;",
    "14": "Also decides to reduce non-post resources by the amount of 150,000 United States dollars;",
    "15": "Further decides to appropriate to the special account for the International Residual Mechanism for Criminal Tribunals a total amount of 65,459,100 dollars gross (60,132,400 dollars net) for 2024, as detailed in the annex to the present resolution;",
    "16": "Decides that the total assessment for 2024 under the special account amounting to 55,107,500 dollars shall consist of: (a) 65,459,100 dollars, being the estimated appropriation approved for the period; (b) Less 3,369,000 dollars, being the credit of the cancellation of prior period obligations/commitments corresponding to the year 2021, and other revenue; (c) Less 6,982,600 dollars, being the surplus resulting from the final expenditure for the budget for the year 2022;",
    "17": "Also decides to apportion the amount of 27,553,750 dollars gross (25,176,900 dollars net) among Member States in accordance with the scale of assessments applicable to the regular budget of the United Nations for 2024;",
    "18": "Further decides to apportion the amount of 27,553,750 dollars gross (25,176,900 dollars net) among Member States in accordance with the scale of assessments applicable to peacekeeping operations of the United Nations for 2024;",
    "19": "Decides that, in accordance with the provisions of its resolution 973 (X) of 15 December 1955, there shall be set off against the apportionment among Member States, as provided for in paragraphs 17 and 18 above, their respective share in the Tax Equalization Fund of the estimated staff assessment income in the amount of 4,753,700 dollars approved for the Mechanism for 2024. 50th (resumed) plenary meeting 22 December 2023 Annex Financing of the International Residual Mechanism for Criminal Tribunals for 2024 Gross Net of staff assessment (United States dollars) Estimated appropriation for 2024a 63 930 800 58 552 400 Revised estimates: effects of changes in rates of exchange and inflation b 3 704 800 3 597 500 Recommendations of the Advisory Committee on Administrative and Budgetary Questionsc (2 061 900) (1 897 200) Recommendations of the Fifth Committeec (114 600) (120 300) Estimated initial appropriation for 2024 65 459 100 60 132 400 Total assessment for 2024 Requirements for 2024 65 459 100 60 132 400 Cancellation of commitments for the year 2021 and other revenue (3 369 000) (3 369 000) Surplus resulting from the final expenditure for the budget for the year 2022 (6 982 600) (6 409 600) Net contributions assessed on Member States for 2024 55 107 500 50 353 800 Of which: Contributions assessed on Member States in accordance with the scale of assessments applicable to the regular budget of the United Nations for 2024 27 553 750 25 176 900 Contributions assessed on Member States in accordance with the scale of assessments applicable to peacekeeping operations of the United Nations for 2024 27 553 750 25 176 900 a See A/78/534. b See A/78/634. c Reflects amounts after recosting."
  },
  "agenda_items": [
    "Item 145"
  ],
  "symbol_references": []
}