{
  "symbol": "A/RES/76/167",
  "filename": "A_RES_76_167.pdf",
  "title": "76/167. Protection of and assistance to internally displaced persons",
  "text": "United Nations \nA/RES/76/167\n \n \nGeneral Assembly \nDistr.: General \n7 January 2022 \n \n \n21-19231 (E)    130122 \n*2119231* \n \n \nSeventy-sixth session \nAgenda item 74 (b) \nPromotion and protection of human rights: human \nrights questions, including alternative approaches for \nimproving the effective enjoyment of human rights and \nfundamental freedoms \n \n \n \n \n Resolution adopted by the General Assembly \non 16 December 2021 \n \n \n \n \n[on the report of the Third Committee (A/76/462/Add.2, para. 114)] \n \n \n 76/167. Protection of and assistance to internally displaced persons \n \n \n \nThe General Assembly, \n \nGuided by the purposes and principles of the Charter of the United Nations, \n \nRecalling that internally displaced persons are persons or groups of persons who \nhave been forced or obliged to flee or to leave their homes or places of habitual \nresidence, in particular as a result of or in order to avoid the effects of armed conflict, \nsituations of generalized violence, violations of human rights or natural or human-\nmade disasters, and who have not crossed an internationally recognized State border,1  \n \nDeeply disturbed by the alarmingly high numbers of internally displaced \npersons throughout the world, for reasons including violations and abuses of human \nrights and violations of international humanitarian law, armed conflict, persecution, \nviolence and other reasons, including terrorism, as well as natural and human-made \ndisasters, who receive inadequate protection and assistance, and conscious of the \nserious challenges that this is creating for host communities, national and local \nauthorities and the international community, \n \nRecalling the very large number of people who are displaced within national \nborders and the potential for such persons to seek protection and assistance in other \ncountries as refugees or migrants, and noting the need for reflection on effective \nstrategies to ensure adequate protection and assistance for internally displaced \npersons in this regard, including the need for comprehensive and disaggregated data \nand other measures aimed at preventing and reducing such displacements, \n__________________ \n \n1  See Guiding Principles on Internal Displacement (E/CN.4/1998/53/Add.2, annex), introduction, \npara. 2. \n\nA/RES/76/167 \nProtection of and assistance to internally displaced persons\n \n21-19231\n2/12 \n \n \nReaffirming General Assembly resolution 46/182 of 19 December 1991 and the \nguiding principles contained in the annex thereto, other relevant General Assembly \nand Economic and Social Council resolutions and agreed conclusions of the Council, \nreaffirming also the principles of humanity, neutrality, impartiality and independence \nin the provision of humanitarian assistance, and reaffirming further the need for all \nactors engaged in the provision of humanitarian assistance in situations of complex \nemergencies and natural disasters to promote and fully respect these principles, \n \nEmphasizing that States have the primary responsibility to provide protection \nand assistance to internally displaced persons within their jurisdiction, without \ndiscrimination, as well as to address the root causes of the displacement problem and \nto support all durable solutions in appropriate cooperation with those displaced, their \nhosts, civil society, local authorities, development actors, the private sector and the \ninternational community, \n \nExpressing particular concern at the increased level of discrimination \nexperienced by internally displaced persons, including those who may be in \nparticularly vulnerable situations, including women, children, older persons and \npersons with disabilities, and emphasizing the need to ensure that their specific needs \nare met through the provision of adequate protection and access to assistance, \n \nNoting the need to address the root causes of displacement and for increased \nawareness within the international community of the issue of internal displacement \nworldwide, including the situation of millions living in protracted situations of \ndisplacement, many of them outside camp settings and in urban areas, and the urgency \nof providing adequate humanitarian assistance and protection to internally displaced \npersons, \n \nRecognizing that violations of international humanitarian law can cause \ndisplacement, and recalling that displacement could be reduced if international \nhumanitarian law was respected by all parties to armed conflict, in particular the \nfundamental principles of distinction, proportionality and precaution, as well as the \nprohibition of forced displacement of the civilian population, unless the security of \nthe civilians involved or imperative military reasons so demand,2  \n \nExpressing deep concern at the threat posed by landmines, explosive remnants \nof war and improvised explosive devices to internally displaced persons fleeing \nconflict, impeding, in certain instances, their voluntary return, local integration and \nresettlement and the safe delivery of humanitarian assistance, and noting the urgency \nof providing protection from landmines and other explosive remnants of war and \nsupporting host communities and local organizations, \n \nExpressing particular concern that many internally displaced children, in \nparticular girls, lack access to education in all phases of displacement owing to attacks \nagainst schools, damaged or destroyed school buildings, insecurity, the prevalence of \nviolence, including gender-based violence, in and around schools, loss of \ndocumentation, language barriers and discrimination, \n \nExpressing particular concern also that many internally displaced persons, \nincluding women, men, girls and boys, do not receive the health care they require in \nall phases of displacement, including mental health care and psychosocial support, \n \nRecognizing the increase in the number, scale and frequency of disasters, \nincluding those related to the adverse effects of climate change, which in certain \ninstances may contribute to displacement and additional pressure on host \n__________________ \n \n2  Protocol Additional to the Geneva Conventions of 12 August 1949, and relating to the Protection \nof Victims of Non-International Armed Conflicts (Protocol II) (United Nations, Treaty Series, \nvol. 1125, No. 17513), arts. 13 and 17. \n\nProtection of and assistance to internally displaced persons \nA/RES/76/167\n \n3/12\n21-19231 \n \ncommunities, encouraging the United Nations and all relevant actors to strengthen \nefforts in cooperation with national Governments aimed at addressing the needs of \npersons displaced internally by natural disasters, including those exacerbated by \nclimate change, and noting in this regard the importance of sharing best practices to \nprevent and prepare for such displacements, \n \nExpressing concern that many millions of people are displaced each year by \nsudden- and slow-onset disasters, recognizing that building resilience of nations and \ncommunities, including through preparedness, prevention, disaster risk reduction and \nclimate-change adaptation measures can reduce disaster displacement risk, including \nthrough integrating disaster risk reduction strategies into national, regional and global \ndevelopment policies and programmes, and in this regard recognizing also the \nimportant role of sustainable development in averting and reducing the risk of loss \nand damage, \n \nRecognizing that the vulnerability of internally displaced persons may increase \nwhen their host communities are affected by disasters, \n \nExpressing gravest concerns about the humanitarian impact of and risks posed \nby the short- and long-term impacts of the coronavirus disease (COVID-19) \npandemic, including on the already significant levels of humanitarian and \ndevelopment needs and suffering of internally displaced persons and host \ncommunities, recognizing the disproportionate impact of the pandemic on displaced \nwomen, children and people in vulnerable situations, and profoundly concerned by \nrising humanitarian assistance and protection needs including due to the increase in \nviolence, including sexual and gender-based violence and violence against displaced \nchildren, and the significant impact on education, especially for girls, as well as high \nlevels of food insecurity and malnutrition and rising risks of famine, loss of \nlivelihoods, and all the negative impacts on health, including mental health, which \nare also exacerbated by weakened health systems, and the impacts and risks for \ndisplacement; and recognizing the compounded risks and impacts due to armed \nconflict, poverty, natural disasters, violence, the adverse effects of climate change, \nand other environmental challenges; and further recognizing the efforts and measures \nproposed by the Secretary-General concerning the response to the impact of the \nCOVID-19 pandemic, \n \nConscious of the human rights, humanitarian and development dimensions, as \nwell as the possible peacebuilding and transitional justice dimensions, of internal \ndisplacement, including in protracted and repeated temporary displacement \nsituations, and the responsibilities of States, with the support of the international \ncommunity, to ensure the provision of protection and assistance, including by \nrespecting and protecting the human rights and fundamental freedoms of all internally \ndisplaced persons, with a view to finding durable solutions, \n \nRecognizing the important contributions made by national and local authorities \nand host communities to protect and assist internally displaced persons, \nacknowledging that the hosting of large groups of internally displaced persons can \nput pressure on those authorities and communities, and recognizing also the \nimportance of adequately supporting host communities, as well as local capacities, by \naddressing their needs, \n \nRecalling the Vienna Declaration and Programme of Action adopted by the \nWorld Conference on Human Rights on 25 June 1993,3 regarding the need to develop \nglobal strategies to address the problem of internal displacement, and recalling also \nall relevant resolutions of the General Assembly and the Security Council, \n__________________ \n \n3  A/CONF.157/24 (Part I), chap. III. \n\nA/RES/76/167 \nProtection of and assistance to internally displaced persons\n \n21-19231\n4/12 \n \n \nRecalling also General Assembly resolution 74/160 of 18 December 2019 and \nHuman Rights Council resolution 41/15 of 11 July 2019,4  \n \nRecognizing that internally displaced persons are to enjoy, in full equality and \nwithout discrimination, the same rights and freedoms under international and \ndomestic law as do other persons in their country, including the right to freedom of \nmovement and residence, and should be protected against arbitrary displacement, \n \nRecalling the relevant norms of international law, which includes international \nhuman rights law, inter alia, the Convention on the Rights of the Child,5 as well as \ninternational refugee law and international humanitarian law, including the Geneva \nConventions of 19496 and the Additional Protocols thereto of 1977, 7 as applicable, as \na vital legal framework for the protection of and assistance to civilians in armed \nconflict and under foreign occupation, including internally displaced persons, \n \nRecognizing that internally displaced persons, including women, children, older \npersons and persons with disabilities, without identity documents, may be at risk of \nhuman rights violations and abuses, and may face difficulties in the realization of \ntheir rights and in accessing services, \n \nRecognizing also that the protection of internally displaced persons has been \nstrengthened by identifying, reaffirming and consolidating specific standards for their \nprotection, in particular through the Guiding Principles on Internal Displacement, 8  \n \nWelcoming the increasing dissemination, promotion, application and integration \ninto domestic laws and policies of the Guiding Principles on Internal Displacement \nwhen dealing with situations of internal displacement, \n \nNoting with appreciation the important role of national human rights \ninstitutions, during all phases of displacement, in ensuring that all human rights issues \nof internally displaced persons are appropriately addressed, \n \nDeploring practices of forced displacement and their negative consequences for \nthe enjoyment of human rights and fundamental freedoms by large groups of \npopulations, and recalling the relevant provisions of the Rome Statute of the \nInternational Criminal Court9 that define the deportation or forcible transfer of \npopulation as a crime against humanity and the unlawful deportation, transfer or \nordering of the displacement of the civilian population as war crimes, \n \nRecognizing the importance of the African Union Convention for the Protection \nand Assistance of Internally Displaced Persons in Africa (Kampala Convention), 10 \nwhich builds on the Protocol on the Protection of and Assistance to Internally \nDisplaced Persons and the Protocol on the Property Rights of Returning Persons, \nadopted by the International Conference on the Great Lakes Region, and which marks \na significant step towards strengthening the national and regional normative \nframework for the protection of and assistance to internally displaced persons in \nAfrica, and welcoming the holding of the first Conference of States Parties to the \nConvention in April 2017, \n__________________ \n \n4  See Official Records of the General Assembly, Seventy-fourth Session, Supplement No. 53 \n(A/74/53), chap. V, sect. A. \n \n5  United Nations, Treaty Series, vol. 1577, No. 27531. \n \n6  Ibid., vol. 75, Nos. 970\u2013973. \n \n7  Ibid., vol. 1125, Nos. 17512 and 17513. \n \n8  E/CN.4/1998/53/Add.2, annex. \n \n9  United Nations, Treaty Series, vol. 2187, No. 38544. \n \n10 Ibid., vol. 3014, No. 52375.  \n\nProtection of and assistance to internally displaced persons \nA/RES/76/167\n \n5/12\n21-19231 \n \n \nNoting the Framework on Durable Solutions for Internally Displaced Persons of \nthe Inter-Agency Standing Committee,11 and taking note of the decision of the Policy \nCommittee of the Secretary-General of 4 October 2011 endorsing the preliminary \nframework on ending displacement in the aftermath of conflict, \n \nUnderlining the necessity of safe and unhindered humanitarian access for the \nrelevant United Nations agencies and humanitarian organizations to internally \ndisplaced persons, including those residing in conflict areas, in accordance with \ninternational law, \n \nRecognizing that the 2030 Agenda for Sustainable Development12 seeks to \naddress the needs of the most vulnerable, including internally displaced persons, and \nthat addressing the needs of internally displaced persons can help countries to achieve \ntheir overall development goals, \n \nNoting the increasing number of internally displaced persons outside camps and \nin urban areas and the need to meet their immediate and their long-term needs, and \nthe needs of host families, and recognizing the importance of the New Urban Agenda \nadopted at the United Nations Conference on Housing and Sustainable Urban \nDevelopment (Habitat III),13  \n \nTaking note of the first World Humanitarian Summit, held in Istanbul, Turkey, \non 23 and 24 May 2016, and taking note also of the report of the Secretary-General \non the outcome of the World Humanitarian Summit,14 which contains, inter alia, \nrecommendations to strengthen partnerships between Member States and \nhumanitarian and development actors to address the urgent and long-term needs of \ninternally displaced persons, \n \nNoting the need for finding durable solutions for internally displaced persons in \ntheir countries and addressing possible obstacles in this regard, and recognizing that \ndurable solutions include voluntary and sustainable return in safety and with dignity, \nas well as voluntary local integration in the areas to which persons have been \ndisplaced or voluntary settlement in another part of the country, without prejudice to \nthe right of internally displaced persons to leave their country or to seek asylum, \n \nEmphasizing that all durable solutions for internally displaced persons should \nbe approached from a humanitarian and development perspective, involving the \ntimely engagement of internally displaced persons and host communities, \n \nMindful of the significant humanitarian and development assistance required to \nmeet the needs of people in protracted situations of internal displacement and of the \nlarge gap between needs and resources, \n \nRecognizing the need for increased coverage, quality and availability of \ninformation on internal displacement and to collect reliable, timely, longitudinal and \ndisaggregated data, including data disaggregated by sex, age, disability and location, \non internally displaced persons and the impact of new and protracted displacement \non host communities in order to improve policy and programming, preventive \nmeasures on and response to internal displacement and to promote the achievement \nof durable solutions, including, in this respect, the relevance of the Global Internal \nDisplacement Database maintained by the Internal Displacement Monitoring Centre \nand the technical support available from the inter-agency Joint Internal Displacement \nProfiling Service and the Expert Group on Refugee and Internally Displaced Persons \n__________________ \n \n11  A/HRC/13/21/Add.4. \n \n12  Resolution 70/1. \n \n13  Resolution 71/256, annex. \n \n14  A/71/353. \n\nA/RES/76/167 \nProtection of and assistance to internally displaced persons\n \n21-19231\n6/12 \n \nStatistics, and noting the adoption by the Statistical Commission of International \nRecommendations on Internally Displaced Persons Statistics, \n \nExpressing its appreciation to those Governments and intergovernmental, \nregional and non-governmental organizations that have supported and facilitated the \nwork of the Special Rapporteur of the Human Rights Council on the human rights of \ninternally displaced persons, and of her predecessors, the former representatives of \nthe Secretary-General on the human rights of internally displaced persons, and have \nhelped, according to their roles and responsibilities, to provide protection and \nassistance to internally displaced persons, \n \nWelcoming the continuing cooperation between the Special Rapporteur and \nnational Governments and the relevant offices and agencies of the United Nations as \nwell as with other international and regional organizations, and encouraging further \nstrengthening of this collaboration in order to promote better strategies for, protection \nof, assistance to and durable solutions for internally displaced persons, \n \nAcknowledging with appreciation the important and independent contribution \nof the International Red Cross and Red Crescent Movement and other humanitarian \nagencies in protecting and assisting internally displaced persons, in cooperation with \nnational Governments and relevant international bodies, \n \nWelcoming the priorities set by the Special Rapporteur as contained in the report \nto the Human Rights Council at its thirty-fifth session15 and the two strategic \nobjectives of supporting Governments in developing national instruments and \ninstitutions on internal displacement and facilitating viable, durable solutions for \ninternally displaced persons, including through the engagement of development \nactors, \n \n1. \nTakes note with appreciation of the main report of the Special Rapporteur \nof the Human Rights Council on the human rights of internally displaced persons16 \nand the conclusions contained therein; \n \n2. \nCommends the Special Rapporteur for the activities undertaken so far, for \nthe catalytic role that she plays in raising the level of awareness about the plight of \ninternally displaced persons and for her ongoing efforts to address their development \nand other specific needs, including through the mainstreaming of the human rights of \ninternally displaced persons into all relevant parts of the United Nations system; \n \n3. \nEncourages the Special Rapporteur, through continuous dialogue with \nGovernments and all intergovernmental and non-governmental organizations \nconcerned, to continue her analysis of the reasons for internal displacement and to \nremain apprised of the needs and human rights of those who are displaced, including \nthe needs of those who may be in particularly vulnerable situations, including women, \nchildren, older persons and persons with disabilities, the level of emergency \npreparedness and ways to strengthen protection and assistance, including by \nenhancing the role of national human rights institutions, where appropriate, and the \nprotection of internally displaced persons, as well as durable solutions for internally \ndisplaced persons, including by addressing possible obstacles to the exercise of \nhousing, land and property rights for internally displaced persons, also encourages \nthe Special Rapporteur, with regard to the latter, to use, in her activities, the \nFramework on Durable Solutions for Internally Displaced Persons of the \nInter-Agency Standing Committee, and further encourages the Special Rapporteur to \ncontinue to advocate the needs of host communities and promote comprehensive \n__________________ \n \n15  A/HRC/35/27. \n \n16  A/HRC/47/37. \n\nProtection of and assistance to internally displaced persons \nA/RES/76/167\n \n7/12\n21-19231 \n \nstrategies, taking into account the primary responsibility of States for the protection \nof and assistance to internally displaced persons within their jurisdiction; \n \n4. \nWelcomes the initiatives undertaken by regional organizations, such as the \nAfrican Union, the International Conference on the Great Lakes Region, the \nOrganization of American States and the Council of Europe, to address the protection, \nassistance and development needs of internally displaced persons and to find durable \nsolutions for them, and encourages regional organizations to strengthen their \nactivities and their cooperation with the Special Rapporteur; \n \n5. \nUrges all Governments to continue to facilitate the activities of the Special \nRapporteur, in particular Governments with situations of internal displacement, and \nto respond favourably to requests from the Special Rapporteur to enable her to \ncontinue and enhance dialogue with Governments in addressing situations of internal \ndisplacement, and thanks those Governments that have already done so; \n \n6. \nInvites Governments to give serious consideration, in dialogue with the \nSpecial Rapporteur, to the recommendations and suggestions addressed to them, in \naccordance with her mandate, and to inform her of measures taken thereon; \n \n7. \nWelcomes the use of the Guiding Principles on Internal Displacement by \nthe Special Rapporteur in her dialogue with Governments, intergovernmental and \nnon-governmental organizations and other relevant actors, and requests her to \ncontinue her efforts to further their dissemination, promotion, application and \nintegration into domestic laws and policies and to provide support for efforts to \npromote capacity-building and the use of the Guiding Principles, as well as the \ndevelopment of domestic legislation and policies; \n \n8. \nRecognizes that Member States have the primary responsibility to promote \ndurable solutions for their internally displaced persons, as well as to respect, protect \nand fulfil their human rights, thus contributing to their national, economic and social \ndevelopment processes, and encourages the international community, the United \nNations system, the Special Rapporteur, relevant international and regional \norganizations and donor countries to continue to support international, regional and \nnational efforts to meet the needs and fulfil the human rights of internally displaced \npersons, including children, on the basis of solidarity, the principles of international \ncooperation and the Guiding Principles on Internal Displacement and to ensure that \nhumanitarian assistance, early recovery and development assistance efforts are \nappropriately funded; \n \n9. \nRequests Member States to strengthen their efforts to ensure the protection \nof and better assistance to internally displaced persons, in particular to address the \nchallenges of protracted displacement, by adopting and implementing gender-\nsensitive policies and strategies, in accordance with national and regional \nframeworks, while recognizing the Guiding Principles on Internal Displacement as \nan important international framework for the protection of internally displaced \npersons, encourages all relevant actors, in accordance with their mandates, to make \nuse of the Guiding Principles when dealing with situations of internal displacement, \nand in this regard recognizes the central role of national and local authorities and \ninstitutions in addressing the specific needs of internally displaced persons and in \nfinding solutions to displacement through, inter alia, continued and enhanced \ninternational support, upon request, for the capacity-building of States; \n \n10. Encourages States to ensure that internally displaced persons, including \nchildren, have access to a process to obtain appropriate identification documents; \n \n11. Notes the implementation of the multi-stakeholder Plan of Action for \nAdvancing Prevention, Protection and Solutions for Internally Displaced Persons \n\nA/RES/76/167 \nProtection of and assistance to internally displaced persons\n \n21-19231\n8/12 \n \n2018\u20132020 (GP20) to commemorate the twentieth anniversary of the Guiding \nPrinciples on Internal Displacement, and its follow-up initiative, (GP2.0); \n \n12. Notes with appreciation the report of the Secretary-General\u2019s High-level \nPanel on Internal Displacement, acknowledges that increased efforts on addressing \nthe root causes as well as prevention, protection and improved assistance to internally \ndisplaced persons and durable solutions for internal displacement are critically \nimportant, and encourages the Secretary-General to work with Member States, the \nUnited Nations system and relevant actors, as appropriate, on these efforts; \n \n13. Expresses its appreciation for the fact that an increasing number of States \nhave adopted domestic legislation and policies dealing with all stages of \ndisplacement, encourages States to continue to do so in an inclusive and \nnon-discriminatory way, consistent with the Guiding Principles on Internal \nDisplacement, urges States to increase their efforts to implement such domestic laws \nand policies, including through the identification of national focal points within \nGovernments for issues of internal displacement, in particular for setting national \ntargets and indicators for policy and programmes and for the allocation of budget \nresources, and encourages the international community and national actors to provide \nfinancial support and cooperation to Governments, upon request, in this regard; \n \n14. Calls upon Governments to provide protection and assistance, including \nreintegration and development assistance, to internally displaced persons and to \nfacilitate the efforts of the relevant United Nations agencies and humanitarian \norganizations in this regard by allowing and facilitating safe and unhindered access \nfor humanitarian personnel and the delivery of supplies and equipment to internally \ndisplaced persons, in accordance with international law, by maintaining the civilian \nand humanitarian character of camps and settlements for internally displaced persons, \nwhere they exist, and by taking the steps necessary to ensure the safety and security \nof humanitarian personnel so that they may efficiently perform their task of assisting \ninternally displaced persons; \n \n15. Expresses particular concern about the full range of threats, violations and \nabuses of human rights and violations of international humanitarian law experienced \nby many internally displaced persons, including women and children, who are \nparticularly vulnerable or specifically targeted especially for sexual and gender-based \nviolence and sexual exploitation and abuse, trafficking in persons in all its forms,17 \nforced recruitment and abduction, encourages the continued commitment of the \nSpecial Rapporteur to promote action to address their particular assistance and \nprotection needs, and calls upon States, in cooperation with international agencies and \nother stakeholders, to provide protection and assistance to internally displaced persons \nwho are victims of the above-mentioned threats, violations and abuses, as well as other \ngroups of internally displaced persons with special needs, such as severely traumatized \nindividuals, older persons and persons with disabilities, taking into account all relevant \nresolutions of the General Assembly and the Security Council; \n \n16. Encourages the international community to provide technical cooperation \nto States affected by displacement, upon their request, including for the training of \nstaff members of institutions in charge of registration and development of national \nlaws and policies on internal displacement and issues related to land and property \nrestitution and compensation; \n \n17. Emphasizes the central role of the Emergency Relief Coordinator in the \ncoordination of the protection of and assistance to internally displaced persons, \n__________________ \n \n17  As defined in article 3 of the Protocol to Prevent, Suppress and Punish Trafficking in Persons, \nEspecially Women and Children, supplementing the United Nations Convention against \nTransnational Organized Crime (United Nations, Treaty Series, vol. 2237, No. 39574). \n\nProtection of and assistance to internally displaced persons \nA/RES/76/167\n \n9/12\n21-19231 \n \ninter alia, through the inter-agency cluster system, welcomes continued initiatives to \nensure better protection, assistance and development strategies for internally \ndisplaced persons, as well as better coordination of activities regarding them, and \nemphasizes the need to strengthen the capacities of national and local authorities, host \ncommunities, local organizations, United Nations organizations and other relevant \nactors to meet the immense humanitarian challenges of internal displacement; \n \n18. Notes with appreciation the increased attention paid to the issue of \ninternally displaced persons in humanitarian response plans, and encourages further \nefforts in this regard; \n \n19. Emphasizes the importance of communication and consultation with \ninternally displaced persons and host communities by Governments and other relevant \nactors, in accordance with their specific mandates, during all phases of displacement, \nas well as the participation of internally displaced persons, where appropriate, in \npolicies, programmes and activities pertaining to them, taking into account the \nprimary responsibility of States for the protection of and assistance to internally \ndisplaced persons within their jurisdiction; \n \n20. Calls upon States, in cooperation with international agencies and other \nstakeholders, to provide for and support, in particular, the full and meaningful participation \nof internally displaced women at all levels of decision-making processes and in all \nactivities that have a direct impact on their lives, in all aspects of internal displacement, \nincluding the promotion and protection of human rights, the prevention of human rights \nviolations and the design and implementation of durable solutions, peace processes, \npeacebuilding, transitional justice, post-conflict reconstruction and development; \n \n21. Encourages all relevant United Nations organizations and humanitarian \nassistance, human rights and development organizations to enhance their \ncollaboration and coordination through the Inter-Agency Standing Committee and \nUnited Nations country teams in countries with situations of internal displacement \nand to provide all possible assistance and support to the Special Rapporteur, and \nrequests the continued participation of the Special Rapporteur in the work of the \nInter-Agency Standing Committee and its subsidiary bodies; \n \n22. Encourages \nthe \nInter-Agency \nStanding \nCommittee \nto \nenhance \ncoordination, effectiveness, efficiency and predictability in preventing, responding to \nand finding solutions to internal displacement; \n \n23. Expresses deep concern at the insufficient funding levels of humanitarian \nappeals, and in this respect urges all relevant actors to provide the relevant United \nNations agencies and humanitarian organizations with sufficient and predictable \nresources to ensure adequate support for those who are forcibly displaced; \n \n24. Calls upon all parties to armed conflict to comply with their obligations \nunder international humanitarian law, and international human rights law, as \napplicable, with a view to preventing forced displacement and promoting the \nprotection of civilians, and calls upon Governments to take measures to respect and \nprotect the human rights of all internally displaced persons, without distinction of any \nkind, in accordance with their applicable obligations under international law; \n \n25. Calls upon States, in cooperation with all other relevant actors, including \nhumanitarian and development agencies and donors, to ensure the right to a quality \neducation, including primary and secondary education, for internally displaced \nchildren, without discrimination of any kind, as well as to support existing schools to \nenable them to include internally displaced persons, calls upon all parties to armed \nconflict to respect the civilian character of schools and other educational institutions \nand to refrain from undertaking actions that could adversely affect the protection of \n\nA/RES/76/167 \nProtection of and assistance to internally displaced persons\n \n21-19231\n10/12 \n \nthese buildings against direct attacks, and strongly condemns all attacks, as well as \nthreats of attack, against schools, in contravention of international humanitarian law; \n \n26. Recognizes that equitable and timely access for all to safe, quality, \neffective and affordable COVID-19 vaccines, therapeutics and diagnostics is an \nessential part of a global response based on unity, solidarity, renewed multilateral \ncooperation and the principle of leaving no one behind;  \n \n27. Highlights the need for States, with the support of relevant partners, \nincluding humanitarian and development agencies and donors, as appropriate, to \naddress the physical and mental health needs of internally displaced persons, which \nmay include assistance, health care and psychosocial and other counselling services; \n \n28. Stresses the obligation, in accordance with international humanitarian law \nand national laws and regulations, as applicable, to respect and protect medical \npersonnel, as well as humanitarian personnel exclusively engaged in medical duties, \ntheir means of transport and equipment, as well as hospitals and other medical \nfacilities, in all circumstances, in this regard notes the role of domestic legal \nframeworks and other appropriate measures in promoting the safety and protection of \nsuch personnel, urges States and all parties to armed conflict to develop and integrate \neffective measures to prevent and address violence against such personnel, their \nmeans of transport and equipment, as well as hospitals and other medical facilities, \nand strongly urges States to conduct full, prompt, impartial and effective \ninvestigations within their jurisdiction of violations of international humanitarian law \nrelated to the protection of the wounded and sick, including internally displaced \npersons, medical personnel and humanitarian personnel exclusively engaged in \nmedical duties, their means of transport and equipment, as well as hospitals and other \nmedical facilities in armed conflict, and, where appropriate, to take action against \nthose responsible in accordance with domestic and international law, with a view to \nreinforcing preventive measures, ensuring accountability and addressing the \ngrievances of victims, including internally displaced persons; \n \n29. Recognizes the adverse effects of climate change as contributors to \nenvironmental degradation and extreme weather events, which may, among other \nfactors, contribute to human displacement, and in this regard notes the adoption of \nthe Sendai Framework for Disaster Risk Reduction 2015\u20132030 in March 2015,18 the \nParis Agreement adopted under the United Nations Framework Convention on \nClimate Change in December 201519 and relevant initiatives related to internal \ndisplacement, such as the Nansen Initiative, and their follow-up processes, and \nencourages the Special Rapporteur, in close collaboration with States and \nintergovernmental and non-governmental organizations, to continue to explore the \nhuman rights implications and dimensions of disaster-induced internal displacement, \nwith a view to supporting Member States in their efforts to build local resilience and \ncapacity to prevent and prepare for displacement or to provide assistance through \nwell-planned recovery programmes that support internally displaced persons and their \nhosts and provide protection to those who are forced to flee; \n \n30. Affirms the need for the effective implementation of the Sendai Framework \nfor Disaster Risk Reduction 2015\u20132030 to integrate, as appropriate, post-disaster \nreconstruction and recovery, including the principle of \u201cbuild back better\u201d, into the \neconomic and social sustainable development of affected areas, as well as temporary \nsettlements where displaced persons live, to promote periodic disaster preparedness \nand response exercises in recovery and resettlement efforts, with a view to ensuring \na rapid and effective response to disasters and related displacement, and to promote \n__________________ \n \n18  Resolution 69/283, annex II. \n \n19  See FCCC/CP/2015/10/Add.1, decision 1/CP.21, annex. \n\nProtection of and assistance to internally displaced persons \nA/RES/76/167\n \n11/12\n21-19231 \n \ntransboundary cooperation to build resilience and reduce disaster risk, including \ndisplacement risk, including by establishing or improving early warning systems, \nincluding heatwave early warning, connected to longer-term risk management \nsystems and supported by public awareness campaigns, recognizing that early action \nfollowing quality forecasts can reduce the impact of extreme weather events; \n \n31. Recognizes that internal displacement is not only a humanitarian but also \na development challenge, and in some cases can also be a peacebuilding challenge, \nand calls upon States to provide durable solutions and address possible obstacles in \nthis regard and to include the needs, vulnerabilities and capacities of internally \ndisplaced persons and host communities in their national development plans; \n \n32. Encourages closer cooperation between development and humanitarian \nactors, in accordance with their respective mandates, towards collective results over \nmultiple years, with the aim of reducing the needs and vulnerabilities of internally \ndisplaced persons, in support of national priorities, while fully respecting the \nimportance of humanitarian principles for humanitarian action; \n \n33. Also encourages strengthened international cooperation, in particular between \nhumanitarian and development actors, including through the provision of resources, \ncoherent multi-year planning that addresses protracted displacement and expertise to \nassist affected countries, in particular developing countries, in their national efforts and \npolicies related to assistance, protection, resilience-building and rehabilitation for \ninternally displaced persons and host communities, as appropriate, and the integration of \nthe human rights and needs of internally displaced persons into both rural and urban \ndevelopment strategies, as well as the participation of both internally displaced persons \nand host communities in the design and implementation of those strategies; \n \n34. Calls upon the United Nations to work closely with Member States and \nother relevant actors, including local governments, civil society and the private sector, \nin furtherance of the New Urban Agenda in order to promote more effective \nemergency preparedness and response in urban areas, and notes the importance of \naddressing, as appropriate, the particular needs and vulnerabilities of internally \ndisplaced persons in urban settings and of supporting host cities, in the spirit of \ninternational cooperation, including by ensuring equal access to income-earning \nopportunities and preventing arbitrary forced evictions; \n \n35. Encourages Member States, humanitarian agencies, donors, development \nactors and other providers of development assistance to continue to work together, in close \ncooperation with the Special Rapporteur, to provide a more predictable response to the \nneeds of internally displaced persons, including long-term development assistance for the \nimplementation of durable solutions, with a view to reducing internal displacement; \n \n36. Encourages Governments, United Nations agencies and other stakeholders to \npromote an inclusive approach to durable solutions that addresses the needs of internally \ndisplaced persons and their host communities, including the promotion of opportunities \nto fully harness the human potential of the displaced populations by promoting self-\nsufficiency through income-generating activities and sustainable livelihood opportunities; \n \n37. Urges all countries to integrate the 2030 Agenda for Sustainable \nDevelopment into their respective national policies and development frameworks, as \nappropriate, and recalls that the 2030 Agenda seeks to address the needs of the most \nvulnerable, including internally displaced persons; \n \n38. Notes the importance of taking the human rights and the specific protection \nand assistance needs of internally displaced persons into consideration, when \nappropriate, in peace processes, and emphasizes that durable solutions for internally \ndisplaced persons, including through voluntary return, sustainable reintegration, \n\nA/RES/76/167 \nProtection of and assistance to internally displaced persons\n \n21-19231\n12/12 \n \nrehabilitation and reconciliation processes and their active participation, as \nappropriate, in the peace process are necessary elements of effective peacebuilding; \n \n39. Welcomes the role of the Peacebuilding Commission in this regard, and \ncontinues to urge the Commission to intensify its efforts, within its mandate, in \ncooperation with national and transitional Governments and in consultation with the \nrelevant United Nations entities, to incorporate the rights and the specific needs of \ninternally displaced persons, including their voluntary return in safety and with \ndignity, reintegration and rehabilitation, as well as related land and property issues, \nwhen advising on or proposing country-specific peacebuilding strategies for post-\nconflict situations in cases under consideration; \n \n40. Recalls the dedication by the African Union of 2019 to, inter alia, mark \nthe tenth anniversary of the African Union Convention for the Protection and \nAssistance of Internally Displaced Persons in Africa (Kampala Convention), \nwelcomes progress in the number of African States having signed and ratified the \nConvention, encourages further progress in this regard, and encourages other regional \nmechanisms to develop their own regional normative frameworks for the protection \nof internally displaced persons; \n \n41. Encourages Member States, members of the Inter-Agency Standing \nCommittee, United Nations humanitarian coordinators and country teams to \ncontribute to the provision of reliable data on internal displacement situations, with \nthe cooperation of the Internal Displacement Monitoring Centre and the technical \nsupport and assistance of the Joint Internal Displacement Profiling Service, and to \nprovide financial resources, as appropriate, in these respects, and encourages States \nto take into account the International Recommendations on Internally Displaced \nPersons Statistics through their national statistics offices, where applicable; \n \n42. Recalls the need to reflect on effective strategies to ensure adequate \nprotection and assistance for internally displaced persons and to prevent and reduce \nsuch displacement, and in this regard encourages the Secretary-General to work with \nMember States and the United Nations system to explore ways to better address the \nlong-term needs of internally displaced persons, support communities that host them \nand improve the lives of the many millions of internally displaced persons; \n \n43. Requests the Secretary-General to continue to provide the Special \nRapporteur, from within existing resources, with all assistance necessary to \nstrengthen and carry out her mandate effectively, and encourages the Office of the \nUnited Nations High Commissioner for Human Rights, in close cooperation with the \nEmergency Relief Coordinator, the Office for the Coordination of Humanitarian \nAffairs of the United Nations Secretariat, the Office of the United Nations High \nCommissioner for Refugees, the International Organization for Migration and all \nother relevant United Nations offices and agencies and related organizations, to \ncontinue to support and cooperate with the Special Rapporteur; \n \n44. Encourages the Special Rapporteur to continue to seek the contributions \nof States, relevant organizations and institutions in order to create a more stable basis \nfor her work; \n \n45. Requests the Special Rapporteur to submit to the General Assembly at its \nseventy-seventh and seventy-eighth sessions a report on the implementation of the \npresent resolution; \n \n46. Decides to continue its consideration of the question of protection of and \nassistance to internally displaced persons at its seventy-eighth session. \n \n53rd plenary meeting \n16 December 2021 \n",
  "paragraphs": {
    "1": "Takes note with appreciation of the main report of the Special Rapporteur of the Human Rights Council on the human rights of internally displaced persons16 and the conclusions contained therein;",
    "2": "Commends the Special Rapporteur for the activities undertaken so far, for the catalytic role that she plays in raising the level of awareness about the plight of internally displaced persons and for her ongoing efforts to address their development and other specific needs, including through the mainstreaming of the human rights of internally displaced persons into all relevant parts of the United Nations system;",
    "3": "Encourages the Special Rapporteur, through continuous dialogue with Governments and all intergovernmental and non-governmental organizations concerned, to continue her analysis of the reasons for internal displacement and to remain apprised of the needs and human rights of those who are displaced, including the needs of those who may be in particularly vulnerable situations, including women, children, older persons and persons with disabilities, the level of emergency preparedness and ways to strengthen protection and assistance, including by enhancing the role of national human rights institutions, where appropriate, and the protection of internally displaced persons, as well as durable solutions for internally displaced persons, including by addressing possible obstacles to the exercise of housing, land and property rights for internally displaced persons, also encourages the Special Rapporteur, with regard to the latter, to use, in her activities, the Framework on Durable Solutions for Internally Displaced Persons of the Inter-Agency Standing Committee, and further encourages the Special Rapporteur to continue to advocate the needs of host communities and promote comprehensive strategies, taking into account the primary responsibility of States for the protection of and assistance to internally displaced persons within their jurisdiction;",
    "4": "Welcomes the initiatives undertaken by regional organizations, such as the African Union, the International Conference on the Great Lakes Region, the Organization of American States and the Council of Europe, to address the protection, assistance and development needs of internally displaced persons and to find durable solutions for them, and encourages regional organizations to strengthen their activities and their cooperation with the Special Rapporteur;",
    "5": "Urges all Governments to continue to facilitate the activities of the Special Rapporteur, in particular Governments with situations of internal displacement, and to respond favourably to requests from the Special Rapporteur to enable her to continue and enhance dialogue with Governments in addressing situations of internal displacement, and thanks those Governments that have already done so;",
    "6": "Invites Governments to give serious consideration, in dialogue with the Special Rapporteur, to the recommendations and suggestions addressed to them, in accordance with her mandate, and to inform her of measures taken thereon;",
    "7": "Welcomes the use of the Guiding Principles on Internal Displacement by the Special Rapporteur in her dialogue with Governments, intergovernmental and non-governmental organizations and other relevant actors, and requests her to continue her efforts to further their dissemination, promotion, application and integration into domestic laws and policies and to provide support for efforts to promote capacity-building and the use of the Guiding Principles, as well as the development of domestic legislation and policies;",
    "8": "Recognizes that Member States have the primary responsibility to promote durable solutions for their internally displaced persons, as well as to respect, protect and fulfil their human rights, thus contributing to their national, economic and social development processes, and encourages the international community, the United Nations system, the Special Rapporteur, relevant international and regional organizations and donor countries to continue to support international, regional and national efforts to meet the needs and fulfil the human rights of internally displaced persons, including children, on the basis of solidarity, the principles of international cooperation and the Guiding Principles on Internal Displacement and to ensure that humanitarian assistance, early recovery and development assistance efforts are appropriately funded;",
    "9": "Requests Member States to strengthen their efforts to ensure the protection of and better assistance to internally displaced persons, in particular to address the challenges of protracted displacement, by adopting and implementing gender- sensitive policies and strategies, in accordance with national and regional frameworks, while recognizing the Guiding Principles on Internal Displacement as an important international framework for the protection of internally displaced persons, encourages all relevant actors, in accordance with their mandates, to make use of the Guiding Principles when dealing with situations of internal displacement, and in this regard recognizes the central role of national and local authorities and institutions in addressing the specific needs of internally displaced persons and in finding solutions to displacement through, inter alia, continued and enhanced international support, upon request, for the capacity-building of States;",
    "10": "Encourages States to ensure that internally displaced persons, including children, have access to a process to obtain appropriate identification documents;",
    "11": " 2018\u20132020 (GP20) to commemorate the twentieth anniversary of the Guiding Principles on Internal Displacement, and its follow-up initiative, (GP2.0);",
    "12": "Notes with appreciation the report of the Secretary-General\u2019s High-level Panel on Internal Displacement, acknowledges that increased efforts on addressing the root causes as well as prevention, protection and improved assistance to internally displaced persons and durable solutions for internal displacement are critically important, and encourages the Secretary-General to work with Member States, the United Nations system and relevant actors, as appropriate, on these efforts;",
    "13": "Expresses its appreciation for the fact that an increasing number of States have adopted domestic legislation and policies dealing with all stages of displacement, encourages States to continue to do so in an inclusive and non-discriminatory way, consistent with the Guiding Principles on Internal Displacement, urges States to increase their efforts to implement such domestic laws and policies, including through the identification of national focal points within Governments for issues of internal displacement, in particular for setting national targets and indicators for policy and programmes and for the allocation of budget resources, and encourages the international community and national actors to provide financial support and cooperation to Governments, upon request, in this regard;",
    "14": "Calls upon Governments to provide protection and assistance, including reintegration and development assistance, to internally displaced persons and to facilitate the efforts of the relevant United Nations agencies and humanitarian organizations in this regard by allowing and facilitating safe and unhindered access for humanitarian personnel and the delivery of supplies and equipment to internally displaced persons, in accordance with international law, by maintaining the civilian and humanitarian character of camps and settlements for internally displaced persons, where they exist, and by taking the steps necessary to ensure the safety and security of humanitarian personnel so that they may efficiently perform their task of assisting internally displaced persons;",
    "15": "Expresses particular concern about the full range of threats, violations and abuses of human rights and violations of international humanitarian law experienced by many internally displaced persons, including women and children, who are particularly vulnerable or specifically targeted especially for sexual and gender-based violence and sexual exploitation and abuse, trafficking in persons in all its forms,17 forced recruitment and abduction, encourages the continued commitment of the Special Rapporteur to promote action to address their particular assistance and protection needs, and calls upon States, in cooperation with international agencies and other stakeholders, to provide protection and assistance to internally displaced persons who are victims of the above-mentioned threats, violations and abuses, as well as other groups of internally displaced persons with special needs, such as severely traumatized individuals, older persons and persons with disabilities, taking into account all relevant resolutions of the General Assembly and the Security Council;",
    "16": "Encourages the international community to provide technical cooperation to States affected by displacement, upon their request, including for the training of staff members of institutions in charge of registration and development of national laws and policies on internal displacement and issues related to land and property restitution and compensation;",
    "17": "Emphasizes the central role of the Emergency Relief Coordinator in the coordination of the protection of and assistance to internally displaced persons, inter alia, through the inter-agency cluster system, welcomes continued initiatives to ensure better protection, assistance and development strategies for internally displaced persons, as well as better coordination of activities regarding them, and emphasizes the need to strengthen the capacities of national and local authorities, host communities, local organizations, United Nations organizations and other relevant actors to meet the immense humanitarian challenges of internal displacement;",
    "18": "Notes with appreciation the increased attention paid to the issue of internally displaced persons in humanitarian response plans, and encourages further efforts in this regard;",
    "19": "Emphasizes the importance of communication and consultation with internally displaced persons and host communities by Governments and other relevant actors, in accordance with their specific mandates, during all phases of displacement, as well as the participation of internally displaced persons, where appropriate, in policies, programmes and activities pertaining to them, taking into account the primary responsibility of States for the protection of and assistance to internally displaced persons within their jurisdiction;",
    "20": "Calls upon States, in cooperation with international agencies and other stakeholders, to provide for and support, in particular, the full and meaningful participation of internally displaced women at all levels of decision-making processes and in all activities that have a direct impact on their lives, in all aspects of internal displacement, including the promotion and protection of human rights, the prevention of human rights violations and the design and implementation of durable solutions, peace processes, peacebuilding, transitional justice, post-conflict reconstruction and development;",
    "21": "Encourages all relevant United Nations organizations and humanitarian assistance, human rights and development organizations to enhance their collaboration and coordination through the Inter-Agency Standing Committee and United Nations country teams in countries with situations of internal displacement and to provide all possible assistance and support to the Special Rapporteur, and requests the continued participation of the Special Rapporteur in the work of the Inter-Agency Standing Committee and its subsidiary bodies;",
    "22": "Encourages the Inter-Agency Standing Committee to enhance coordination, effectiveness, efficiency and predictability in preventing, responding to and finding solutions to internal displacement;",
    "23": "Expresses deep concern at the insufficient funding levels of humanitarian appeals, and in this respect urges all relevant actors to provide the relevant United Nations agencies and humanitarian organizations with sufficient and predictable resources to ensure adequate support for those who are forcibly displaced;",
    "24": "Calls upon all parties to armed conflict to comply with their obligations under international humanitarian law, and international human rights law, as applicable, with a view to preventing forced displacement and promoting the protection of civilians, and calls upon Governments to take measures to respect and protect the human rights of all internally displaced persons, without distinction of any kind, in accordance with their applicable obligations under international law;",
    "25": " these buildings against direct attacks, and strongly condemns all attacks, as well as threats of attack, against schools, in contravention of international humanitarian law;",
    "26": "Recognizes that equitable and timely access for all to safe, quality, effective and affordable COVID-19 vaccines, therapeutics and diagnostics is an essential part of a global response based on unity, solidarity, renewed multilateral cooperation and the principle of leaving no one behind;",
    "27": "Highlights the need for States, with the support of relevant partners, including humanitarian and development agencies and donors, as appropriate, to address the physical and mental health needs of internally displaced persons, which may include assistance, health care and psychosocial and other counselling services;",
    "28": "Stresses the obligation, in accordance with international humanitarian law and national laws and regulations, as applicable, to respect and protect medical personnel, as well as humanitarian personnel exclusively engaged in medical duties, their means of transport and equipment, as well as hospitals and other medical facilities, in all circumstances, in this regard notes the role of domestic legal frameworks and other appropriate measures in promoting the safety and protection of such personnel, urges States and all parties to armed conflict to develop and integrate effective measures to prevent and address violence against such personnel, their means of transport and equipment, as well as hospitals and other medical facilities, and strongly urges States to conduct full, prompt, impartial and effective investigations within their jurisdiction of violations of international humanitarian law related to the protection of the wounded and sick, including internally displaced persons, medical personnel and humanitarian personnel exclusively engaged in medical duties, their means of transport and equipment, as well as hospitals and other medical facilities in armed conflict, and, where appropriate, to take action against those responsible in accordance with domestic and international law, with a view to reinforcing preventive measures, ensuring accountability and addressing the grievances of victims, including internally displaced persons;",
    "29": "Recognizes the adverse effects of climate change as contributors to environmental degradation and extreme weather events, which may, among other factors, contribute to human displacement, and in this regard notes the adoption of the Sendai Framework for Disaster Risk Reduction 2015\u20132030 in March 2015,18 the Paris Agreement adopted under the United Nations Framework Convention on Climate Change in December 201519 and relevant initiatives related to internal displacement, such as the Nansen Initiative, and their follow-up processes, and encourages the Special Rapporteur, in close collaboration with States and intergovernmental and non-governmental organizations, to continue to explore the human rights implications and dimensions of disaster-induced internal displacement, with a view to supporting Member States in their efforts to build local resilience and capacity to prevent and prepare for displacement or to provide assistance through well-planned recovery programmes that support internally displaced persons and their hosts and provide protection to those who are forced to flee;",
    "30": "Affirms the need for the effective implementation of the Sendai Framework for Disaster Risk Reduction 2015\u20132030 to integrate, as appropriate, post-disaster reconstruction and recovery, including the principle of \u201cbuild back better\u201d, into the economic and social sustainable development of affected areas, as well as temporary settlements where displaced persons live, to promote periodic disaster preparedness and response exercises in recovery and resettlement efforts, with a view to ensuring a rapid and effective response to disasters and related displacement, and to promote transboundary cooperation to build resilience and reduce disaster risk, including displacement risk, including by establishing or improving early warning systems, including heatwave early warning, connected to longer-term risk management systems and supported by public awareness campaigns, recognizing that early action following quality forecasts can reduce the impact of extreme weather events;",
    "31": "Recognizes that internal displacement is not only a humanitarian but also a development challenge, and in some cases can also be a peacebuilding challenge, and calls upon States to provide durable solutions and address possible obstacles in this regard and to include the needs, vulnerabilities and capacities of internally displaced persons and host communities in their national development plans;",
    "32": "Encourages closer cooperation between development and humanitarian actors, in accordance with their respective mandates, towards collective results over multiple years, with the aim of reducing the needs and vulnerabilities of internally displaced persons, in support of national priorities, while fully respecting the importance of humanitarian principles for humanitarian action;",
    "33": "Also encourages strengthened international cooperation, in particular between humanitarian and development actors, including through the provision of resources, coherent multi-year planning that addresses protracted displacement and expertise to assist affected countries, in particular developing countries, in their national efforts and policies related to assistance, protection, resilience-building and rehabilitation for internally displaced persons and host communities, as appropriate, and the integration of the human rights and needs of internally displaced persons into both rural and urban development strategies, as well as the participation of both internally displaced persons and host communities in the design and implementation of those strategies;",
    "34": "Calls upon the United Nations to work closely with Member States and other relevant actors, including local governments, civil society and the private sector, in furtherance of the New Urban Agenda in order to promote more effective emergency preparedness and response in urban areas, and notes the importance of addressing, as appropriate, the particular needs and vulnerabilities of internally displaced persons in urban settings and of supporting host cities, in the spirit of international cooperation, including by ensuring equal access to income-earning opportunities and preventing arbitrary forced evictions;",
    "35": "Encourages Member States, humanitarian agencies, donors, development actors and other providers of development assistance to continue to work together, in close cooperation with the Special Rapporteur, to provide a more predictable response to the needs of internally displaced persons, including long-term development assistance for the implementation of durable solutions, with a view to reducing internal displacement;",
    "36": "Encourages Governments, United Nations agencies and other stakeholders to promote an inclusive approach to durable solutions that addresses the needs of internally displaced persons and their host communities, including the promotion of opportunities to fully harness the human potential of the displaced populations by promoting self- sufficiency through income-generating activities and sustainable livelihood opportunities;",
    "37": "Urges all countries to integrate the 2030 Agenda for Sustainable Development into their respective national policies and development frameworks, as appropriate, and recalls that the 2030 Agenda seeks to address the needs of the most vulnerable, including internally displaced persons;",
    "38": " rehabilitation and reconciliation processes and their active participation, as appropriate, in the peace process are necessary elements of effective peacebuilding;",
    "39": "Welcomes the role of the Peacebuilding Commission in this regard, and continues to urge the Commission to intensify its efforts, within its mandate, in cooperation with national and transitional Governments and in consultation with the relevant United Nations entities, to incorporate the rights and the specific needs of internally displaced persons, including their voluntary return in safety and with dignity, reintegration and rehabilitation, as well as related land and property issues, when advising on or proposing country-specific peacebuilding strategies for post- conflict situations in cases under consideration;",
    "40": "Recalls the dedication by the African Union of 2019 to, inter alia, mark the tenth anniversary of the African Union Convention for the Protection and Assistance of Internally Displaced Persons in Africa (Kampala Convention), welcomes progress in the number of African States having signed and ratified the Convention, encourages further progress in this regard, and encourages other regional mechanisms to develop their own regional normative frameworks for the protection of internally displaced persons;",
    "41": "Encourages Member States, members of the Inter-Agency Standing Committee, United Nations humanitarian coordinators and country teams to contribute to the provision of reliable data on internal displacement situations, with the cooperation of the Internal Displacement Monitoring Centre and the technical support and assistance of the Joint Internal Displacement Profiling Service, and to provide financial resources, as appropriate, in these respects, and encourages States to take into account the International Recommendations on Internally Displaced Persons Statistics through their national statistics offices, where applicable;",
    "42": "Recalls the need to reflect on effective strategies to ensure adequate protection and assistance for internally displaced persons and to prevent and reduce such displacement, and in this regard encourages the Secretary-General to work with Member States and the United Nations system to explore ways to better address the long-term needs of internally displaced persons, support communities that host them and improve the lives of the many millions of internally displaced persons;",
    "43": "Requests the Secretary-General to continue to provide the Special Rapporteur, from within existing resources, with all assistance necessary to strengthen and carry out her mandate effectively, and encourages the Office of the United Nations High Commissioner for Human Rights, in close cooperation with the Emergency Relief Coordinator, the Office for the Coordination of Humanitarian Affairs of the United Nations Secretariat, the Office of the United Nations High Commissioner for Refugees, the International Organization for Migration and all other relevant United Nations offices and agencies and related organizations, to continue to support and cooperate with the Special Rapporteur;",
    "44": "Encourages the Special Rapporteur to continue to seek the contributions of States, relevant organizations and institutions in order to create a more stable basis for her work;",
    "45": "Requests the Special Rapporteur to submit to the General Assembly at its seventy-seventh and seventy-eighth sessions a report on the implementation of the present resolution;",
    "46": "Decides to continue its consideration of the question of protection of and assistance to internally displaced persons at its seventy-eighth session."
  },
  "agenda_items": [
    "Item 74"
  ],
  "symbol_references": []
}