{
  "symbol": "A/RES/74/206",
  "filename": "A_RES_74_206.pdf",
  "title": "74/206. Promotion of international cooperation to combat illicit financial flows and strengthen good practices on assets return to foster sustainable development",
  "text": "United Nations \nA/RES/74/206\n \n \nGeneral Assembly \nDistr.: General \n29 January 2020 \n \n19-22419 (E)    290120 \n*1922419* \n \n \nSeventy-fourth session \nAgenda item 17 (f) \nMacroeconomic policy questions: promotion of \ninternational cooperation to combat illicit financial flows \nand strengthen good practices on assets return to foster \nsustainable development \n \n \n \n \n Resolution adopted by the General Assembly \non 19 December 2019 \n \n \n \n \n[on the report of the Second Committee (A/74/379/Add.6)] \n \n \n 74/206. Promotion of international cooperation to combat illicit financial \nflows and strengthen good practices on assets return to foster \nsustainable development \n \n \n \nThe General Assembly,  \n \nGuided by the purposes and principles enshrined in the Charter of the United \nNations,  \n \nReaffirming its resolution 70/1 of 25 September 2015, entitled \u201cTransforming \nour world: the 2030 Agenda for Sustainable Development\u201d, in which it adopted a \ncomprehensive, far-reaching and people-centred set of universal and transformative \nSustainable Development Goals and targets, its commitment to working tirelessly for \nthe full implementation of the Agenda by 2030, its recognition that eradicating \npoverty in all its forms and dimensions, including extreme poverty, is the greatest \nglobal challenge and an indispensable requirement for sustainable development, its \ncommitment to achieving sustainable development in its three dimensions \u2013 economic, \nsocial and environmental \u2013 in a balanced and integrated manner, and to building upon \nthe achievements of the Millennium Development Goals and seeking to address their \nunfinished business,  \n \nReaffirming also its resolution 69/313 of 27 July 2015 on the Addis Ababa \nAction Agenda of the Third International Conference on Financing for Development, \nwhich is an integral part of the 2030 Agenda for Sustainable Development, supports \nand complements it, helps to contextualize its means of implementation targets with \nconcrete policies and actions, and reaffirms the strong political commitment to \naddress the challenge of financing and creating an enabling environment at all levels \nfor sustainable development in the spirit of global partnership and solidarity,  \n\nA/RES/74/206 \nPromotion of international cooperation to combat illicit\nfinancial flows and strengthen good practices on\nassets return to foster sustainable development\n \n19-22419\n2/7 \n \n \nReaffirming further the United Nations Convention against Corruption,1 which \nis the most comprehensive and universal instrument on corruption, and recognizing \nthe need to continue to promote its ratification or accession thereto and its full and \neffective implementation, including full support for the Mechanism for the Review of \nImplementation of the Convention,  \n \nReaffirming the United Nations Convention against Transnational Organized \nCrime,2  \n \nRecalling its resolutions 65/169 of 20 December 2010, 71/213 of 21 December \n2016, 72/207 of 20 December 2017 and 73/222 of 20 December 2018,  \n \nRecalling also its resolutions 71/208 of 19 December 2016, 72/196 of \n19 December 2017 and 73/186 of 17 December 2018,  \n \nTaking note of the 2019 report of the Inter-Agency Task Force on Financing for \nDevelopment,3  \n \nRecognizing that making progress on reducing illicit financial flows could \ncontribute to the achievement of other goals and targets in the 2030 Agenda for \nSustainable Development,  \n \nTaking note of the report of the High-level Panel on Illicit Financial Flows from \nAfrica and its relevant contributions in increasing knowledge of the sources of illicit \nfinancial flows, and reiterating its invitation to other regions to carry out similar \nexercises,  \n \nTaking note also of the policy recommendations of the Intergovernmental Group \nof Experts on Financing for Development of the United Nations Conference on Trade \nand Development,4 \n \nReiterating its deep concern about the impact of illicit financial flows, in \nparticular those caused by tax evasion, corruption and transnational organized crime, \non the economic, social and political stability and development of societies, and \nespecially on developing countries and their progress in financing the 2030 Agenda \nfor Sustainable Development,  \n \nBearing in mind in this regard that there are different sources of illicit financial \nflows and that a separate analysis of each source is more beneficial in designing policy \nresponses to prevent illicit financial flows,  \n \nNoting with appreciation the ongoing efforts by regional organizations and other \nrelevant international forums to strengthen cooperation in preventing and combating \nillicit financial flows, as well as new initiatives taken by Governments and the private \nsector to mobilize the financial sector in the collective fight against illicit financial \nflows,  \n \nRecognizing that combating illicit financial flows is an essential development \nchallenge, noting that developing countries are particularly susceptible to the negative \nimpact of illicit financial flows, and emphasizing that illicit financial flows reduce \nthe availability of valuable resources for financing for development,  \n \nRecognizing also the importance of studying the potential relationship between \ncombating illicit financial flows and attaining debt sustainability,  \n__________________ \n \n1  United Nations, Treaty Series, vol. 2349, No. 42146. \n \n2  Ibid., vol. 2225, No. 39574. \n \n3  Financing for Sustainable Development Report 2019 (United Nations publications, Sales \nNo. E.19.I.7). \n \n4  See TD/B/EFD/1/3. \n\nPromotion of international cooperation to combat illicit \nfinancial flows and strengthen good practices on \nassets return to foster sustainable development \nA/RES/74/206\n \n3/7\n19-22419 \n \n \nRecognizing further that the challenge posed by the increasing scope and \ncomplexity of illicit financial flows and the need for the recovery and return of stolen \nassets requires strengthened international cooperation, \n \nRecognizing that numerous technical, legal and practical challenges are to be \naddressed in order to facilitate the repatriation of proceeds of crime to countries from \nwhere they were originally stolen,  \n \nRecognizing also that global knowledge of the importance of combating illicit \nfinancial flows and enhancing the return of assets is rapidly increasing, as is the \npolitical will to recover illicitly acquired assets by both requesting and requested \nStates, and noting that, while many challenges remain unresolved, tackling them \neffectively requires a holistic approach that recognizes the different types of illicit \nfinancial flows and their impact on sustainable development,  \n \nReaffirming the importance of chapter V of the United Nations Convention \nagainst Corruption, and underlining that the recovery and return of stolen assets \npursuant to that chapter is a fundamental principle of the Convention,  \n \nRecognizing the work carried out by the Conference of the States Parties to the \nUnited Nations Convention against Corruption, and in particular its Open-ended \nIntergovernmental Working Group on Asset Recovery, to advance the full \nimplementation of chapter V of the Convention,  \n \nNoting the efforts to promote the exchange of information and synergies \nbetween the open-ended intergovernmental expert meetings to enhance international \ncooperation under the United Nations Convention against Corruption and the Working \nGroup on International Cooperation established by the Conference of the Parties to \nthe United Nations Convention against Transnational Organized Crime,  \n \nRecalling the work of the Platform for Collaboration on Tax, which is to \nintensify collaboration and coordination on tax issues between the United Nations, \nthe International Monetary Fund, the World Bank Group and the Organization for \nEconomic Cooperation and Development, including on formalizing regular \ndiscussions among the four international organizations on the implementation of \nstandards for international tax matters and on the strengthening of their ability to \nprovide capacity-building support to developing countries,  \n \nRecognizing the important work undertaken by academia and civil society, \nincluding the International Centre for Asset Recovery and the U4 Anti-Corruption \nResource Centre, in assisting Member States in understanding the challenges \nassociated with the return of stolen assets under chapter V of the United Nations \nConvention against Corruption,  \n \nNoting the work of the 135-member Inclusive Framework on Base Erosion and \nProfit Shifting, which provides a forum for collaboration for tackling tax avoidance, \nimproving the coherence of international tax rules and ensuring a more transparent \nand fair tax environment,  \n \nNoting also international developments on the implementation of the Standard \nfor Automatic Exchange of Financial Account Information in Tax Matters under a \ncommon reporting standard developed by the Organization for Economic Cooperation \nand Development, and now involving 102 countries, as well as the role of the 158 \nmembers of the Global Forum on Transparency and Exchange of Information for Tax \nPurposes, which enables cooperation on an equal footing,  \n \nReiterating the pledge that no one will be left behind, reaffirming the \nrecognition that the dignity of the human person is fundamental, and the wish to see \n\nA/RES/74/206 \nPromotion of international cooperation to combat illicit\nfinancial flows and strengthen good practices on\nassets return to foster sustainable development\n \n19-22419\n4/7 \n \nthe Goals and targets met for all nations and peoples and for all segments of society, \nand recommitting to endeavour to reach the furthest behind first,  \n \n1. \nWelcomes the focus on combating illicit financial flows, inter alia, at the \nHigh-level Dialogue on Financing for Development, held on 26 September 2019, \nacknowledges that combating illicit financial flows contributes to domestic resource \nmobilization, and calls upon the relevant organizations of the United Nations system, \nwithin their respective mandates and resources, to continue their consideration of the \nnegative impact of illicit financial flows on financing the 2030 Agenda for \nSustainable Development,5 to further explore policy responses to the phenomenon \nand to coordinate their efforts in this regard;  \n \n2. \nAlso welcomes the high-level meeting on international cooperation to \ncombat illicit financial flows and strengthen good practices on assets return, convened \nby the President of the General Assembly at Headquarters on 16 May 2019, and looks \nforward to continued discussions on this issue, building on the momentum created by \nthe meeting;  \n \n3. \nReaffirms its commitment to strive to eliminate safe havens that create \nincentives for the transfer abroad of stolen assets and illicit financial flows;  \n \n4. \nAlso reaffirms its commitment to strengthen regulatory frameworks at all \nlevels in accordance with international standards and to further increase the \ntransparency and accountability of financial institutions and the corporate sector, as \nwell as public administrations;  \n \n5. \nNotes with concern that proceeds emanating from offences established \nunder the United Nations Convention against Corruption1 have yet to be disposed of \nin favour of the requesting States parties, their prior legitimate owners and victims of \nthe crimes, and decides to deter, detect, prevent and counter corruption, increase \ntransparency and promote good governance;  \n \n6. \nReaffirms the need for Member States to effectively implement and \nenforce existing obligations under the United Nations Convention against Corruption, \nas a critical part of combating illicit financial flows;  \n \n7. \nWelcomes the ongoing efforts of Member States to enhance knowledge and \nbroaden understanding of the challenges and opportunities involved in international \ncooperation to combat illicit financial flows and strengthen good practices on assets \nreturn consistent with the United Nations Convention against Corruption so as to \nfoster sustainable development;  \n \n8. \nAcknowledges that combating illicit financial flows requires a range of \nactions that includes deterring, detecting, preventing and countering such flows in \nsource, transit and destination countries;  \n \n9. \nRecalls that new technologies can both increase efficiency in revenue \ncollection and strengthen the efforts to combat illicit financial flows, expresses \nconcern that virtual assets are being used for illicit activities, and in this regard \nencourages Member States and other relevant organizations to take measures in line \nwith international standards, where applicable, to prevent and counter their illicit use;  \n \n10. Notes that international cooperation in combating illicit financial flows is \na work in progress that must continue to be pursued, and encourages all countries to \ndevelop effective tools and create a policy environment for combating illicit financial \n__________________ \n \n5  Resolution 70/1. \n\nPromotion of international cooperation to combat illicit \nfinancial flows and strengthen good practices on \nassets return to foster sustainable development \nA/RES/74/206\n \n5/7\n19-22419 \n \nflows, in accordance with the existing relevant international frameworks, including \nthe United Nations Convention against Corruption;  \n \n11. \nUrges Member States that have not yet done so to consider ratifying or \nacceding to the United Nations Convention against Corruption and the United Nations \nConvention against Transnational Organized Crime and the Protocols thereto, 6 and \nurges States parties to those Conventions and Protocols to make efforts towards their \neffective implementation;  \n \n12. Encourages countries and relevant multilateral and international \norganizations to continue their efforts to provide, upon request, technical assistance \nand capacity-building assistance to developing countries, as well as to support African \nand other regional initiatives, in order to improve their capacity to prevent, detect and \ncombat illicit financial flows and strengthen good practices on assets return to foster \nsustainable development;  \n \n13. Notes with appreciation the first meeting of the Global Forum on Asset \nRecovery, held in December 2017, supported by the Stolen Asset Recovery Initiative, \na joint initiative of the World Bank and the United Nations Office on Drugs and Crime, \nand welcomes the adoption of the Global Forum on Asset Recovery communiqu\u00e9;  \n \n14. Notes the second International Expert Meeting on the Return of Stolen \nAssets, held in Addis Ababa from 7 to 9 May 2019, and encourages the continuation \nof its work in advancing efforts to strengthen the recovery and return of stolen assets \nin support of sustainable development;  \n \n15. Encourages further efforts by relevant national and international actors to \nmitigate transfer pricing not in line with the arm\u2019s length principle and trade \nmisinvoicing;  \n \n16. Calls upon all countries to work together to eliminate base erosion and \nprofit shifting and to ensure that all companies, including multinationals, pay taxes \nto the Governments of countries where economic activity occurs and value is created, \nin accordance with national and international laws and policies;  \n \n17. Also calls upon all countries to cooperate, in accordance with applicable \nbilateral or multilateral agreements, in the areas of mutual legal assistance and \nadministrative assistance in tax matters, as well as the automatic exchange of financial \naccount information;  \n \n18. Recognizes that measures aimed at combating illicit financial flows often \nrequire cooperation between law enforcement agencies, and encourages Member \nStates, where applicable and subject to their domestic legal system, and in line with \ntheir treaty obligations, to cooperate in this regard;  \n \n19. Stresses that anti-corruption measures should be an integral part of \nnational development policies and strategies and that all jurisdictions should consider \nundertaking further research, policy development and programming, as appropriate, \nto address corruption;  \n \n20. Encourages closer public-private sector collaboration to better tackle \ncorruption, and stresses that further research, policy development and programming \nshould help in reaching this goal;  \n \n21. Notes that various jurisdictions have introduced mechanisms to increase \nbeneficial ownership transparency, including, inter alia, beneficial ownership \nregistries of legal entities and legal arrangements, such as companies, trusts and \n__________________ \n \n6  United Nations, Treaty Series, vols. 2225, 2237, 2241 and 2326, No. 39574. \n\nA/RES/74/206 \nPromotion of international cooperation to combat illicit\nfinancial flows and strengthen good practices on\nassets return to foster sustainable development\n \n19-22419\n6/7 \n \nlimited liability partnerships, and invites all jurisdictions to consider establishing \nappropriate mechanisms, in line with international standards, where applicable;  \n \n22. Encourages States parties to the United Nations Convention against \nCorruption to make full use of the asset recovery tools set forth in chapter V of the \nConvention, including mechanisms for the enforcement of foreign restraining and \nconfiscation orders, as a means of significantly reducing the expenses that a State \nparty may normally incur in pursuing asset recovery;  \n \n23. Calls upon all States parties to the United Nations Convention against \nCorruption, in particular requesting and requested States parties, to cooperate to recover \nthe proceeds of crime, as defined in the Convention, and to fulfil their obligation to \nensure the return or disposal of such proceeds, in accordance with article 57 of the \nConvention;  \n \n24. Recognizes the importance of enhanced capacity for data collection and \nanalysis to combat illicit financial flows, emphasizing the need to increase the \nexchange of data within national government institutions as well as from international \ninstitutions;  \n \n25. Emphasizes the importance of the ongoing efforts of the United Nations \nOffice on Drugs and Crime, in coordination with the United Nations Conference on \nTrade and Development and other institutions, to develop a methodology to produce \nestimates of the total value of inward and outward illicit financial flows;  \n \n26. Invites the President of the General Assembly, the President of the \nEconomic and Social Council and the Secretary-General to give appropriate \nconsideration to the importance of combating illicit financial flows and strengthening \ngood practices on assets return to foster sustainable development, and in this regard \ninvites all relevant international institutions to support these efforts, in accordance \nwith their respective mandates;  \n \n27. Reaffirms the commitment at the very heart of the 2030 Agenda to leave \nno one behind and commit to taking more tangible steps to support people in \nvulnerable situations and the most vulnerable countries and to reach the furthest \nbehind first;  \n \n28. Looks forward to the inclusion, in the 2020 report of the Inter-Agency Task \nForce on Financing for Development, of an analysis of international cooperation to \ncombat illicit financial flows and strengthen good practices on assets return to foster \nsustainable development, pursuant to the mandate of the Task Force, and also looks \nforward to the deliberations of the Economic and Social Council forum on financing \nfor development follow-up on efforts to combat illicit financial flows;  \n \n29. Requests the secretariat of the United Nations Conference on Trade and \nDevelopment, in consultation with relevant entities of the United Nations system, \nincluding the United Nations Office on Drugs and Crime, to inform the General \nAssembly at its seventy-fifth session of the implementation of the present resolution, \nthrough a dedicated section of the Sustainable Development Goals Pulse report and \nof the Trade and Development Report, elaborating in particular on the challenges that \nMember States experience in combating illicit financial flows and recovering and \nreturning stolen assets and on the options available to help to accelerate the \nelimination of illicit financial flows and to return stolen assets, in line with \ncommitments contained in the Addis Ababa Action Agenda of the Third International \nConference on Financing for Development 7 and the 2030 Agenda for Sustainable \nDevelopment;  \n__________________ \n \n7  Resolution 69/313, annex. \n\nPromotion of international cooperation to combat illicit \nfinancial flows and strengthen good practices on \nassets return to foster sustainable development \nA/RES/74/206\n \n7/7\n19-22419 \n \n \n30. Decides to include in the provisional agenda of its seventy-fifth session, \nunder the item entitled \u201cMacroeconomic policy questions\u201d, the sub-item entitled \n\u201cPromotion of international cooperation to combat illicit financial flows and \nstrengthen good practices on assets return to foster sustainable development\u201d.  \n \n52nd plenary meeting \n19 December 2019 \n \n",
  "paragraphs": {
    "1": "Welcomes the focus on combating illicit financial flows, inter alia, at the High-level Dialogue on Financing for Development, held on 26 September 2019, acknowledges that combating illicit financial flows contributes to domestic resource mobilization, and calls upon the relevant organizations of the United Nations system, within their respective mandates and resources, to continue their consideration of the negative impact of illicit financial flows on financing the 2030 Agenda for Sustainable Development,5 to further explore policy responses to the phenomenon and to coordinate their efforts in this regard;",
    "2": "Also welcomes the high-level meeting on international cooperation to combat illicit financial flows and strengthen good practices on assets return, convened by the President of the General Assembly at Headquarters on 16 May 2019, and looks forward to continued discussions on this issue, building on the momentum created by the meeting;",
    "3": "Reaffirms its commitment to strive to eliminate safe havens that create incentives for the transfer abroad of stolen assets and illicit financial flows;",
    "4": "Also reaffirms its commitment to strengthen regulatory frameworks at all levels in accordance with international standards and to further increase the transparency and accountability of financial institutions and the corporate sector, as well as public administrations;",
    "5": "Notes with concern that proceeds emanating from offences established under the United Nations Convention against Corruption1 have yet to be disposed of in favour of the requesting States parties, their prior legitimate owners and victims of the crimes, and decides to deter, detect, prevent and counter corruption, increase transparency and promote good governance;",
    "6": "Reaffirms the need for Member States to effectively implement and enforce existing obligations under the United Nations Convention against Corruption, as a critical part of combating illicit financial flows;",
    "7": "Welcomes the ongoing efforts of Member States to enhance knowledge and broaden understanding of the challenges and opportunities involved in international cooperation to combat illicit financial flows and strengthen good practices on assets return consistent with the United Nations Convention against Corruption so as to foster sustainable development;",
    "8": "Acknowledges that combating illicit financial flows requires a range of actions that includes deterring, detecting, preventing and countering such flows in source, transit and destination countries;",
    "9": "Recalls that new technologies can both increase efficiency in revenue collection and strengthen the efforts to combat illicit financial flows, expresses concern that virtual assets are being used for illicit activities, and in this regard encourages Member States and other relevant organizations to take measures in line with international standards, where applicable, to prevent and counter their illicit use;",
    "10": "Notes that international cooperation in combating illicit financial flows is a work in progress that must continue to be pursued, and encourages all countries to develop effective tools and create a policy environment for combating illicit financial flows, in accordance with the existing relevant international frameworks, including the United Nations Convention against Corruption;",
    "11": "Urges Member States that have not yet done so to consider ratifying or acceding to the United Nations Convention against Corruption and the United Nations Convention against Transnational Organized Crime and the Protocols thereto, 6 and urges States parties to those Conventions and Protocols to make efforts towards their effective implementation;",
    "12": "Encourages countries and relevant multilateral and international organizations to continue their efforts to provide, upon request, technical assistance and capacity-building assistance to developing countries, as well as to support African and other regional initiatives, in order to improve their capacity to prevent, detect and combat illicit financial flows and strengthen good practices on assets return to foster sustainable development;",
    "13": "Notes with appreciation the first meeting of the Global Forum on Asset Recovery, held in December 2017, supported by the Stolen Asset Recovery Initiative, a joint initiative of the World Bank and the United Nations Office on Drugs and Crime, and welcomes the adoption of the Global Forum on Asset Recovery communiqu\u00e9;",
    "14": "Notes the second International Expert Meeting on the Return of Stolen Assets, held in Addis Ababa from 7 to 9 May 2019, and encourages the continuation of its work in advancing efforts to strengthen the recovery and return of stolen assets in support of sustainable development;",
    "15": "Encourages further efforts by relevant national and international actors to mitigate transfer pricing not in line with the arm\u2019s length principle and trade misinvoicing;",
    "16": "Calls upon all countries to work together to eliminate base erosion and profit shifting and to ensure that all companies, including multinationals, pay taxes to the Governments of countries where economic activity occurs and value is created, in accordance with national and international laws and policies;",
    "17": "Also calls upon all countries to cooperate, in accordance with applicable bilateral or multilateral agreements, in the areas of mutual legal assistance and administrative assistance in tax matters, as well as the automatic exchange of financial account information;",
    "18": "Recognizes that measures aimed at combating illicit financial flows often require cooperation between law enforcement agencies, and encourages Member States, where applicable and subject to their domestic legal system, and in line with their treaty obligations, to cooperate in this regard;",
    "19": "Stresses that anti-corruption measures should be an integral part of national development policies and strategies and that all jurisdictions should consider undertaking further research, policy development and programming, as appropriate, to address corruption;",
    "20": "Encourages closer public-private sector collaboration to better tackle corruption, and stresses that further research, policy development and programming should help in reaching this goal;",
    "21": "Notes that various jurisdictions have introduced mechanisms to increase beneficial ownership transparency, including, inter alia, beneficial ownership registries of legal entities and legal arrangements, such as companies, trusts and limited liability partnerships, and invites all jurisdictions to consider establishing appropriate mechanisms, in line with international standards, where applicable;",
    "22": "Encourages States parties to the United Nations Convention against Corruption to make full use of the asset recovery tools set forth in chapter V of the Convention, including mechanisms for the enforcement of foreign restraining and confiscation orders, as a means of significantly reducing the expenses that a State party may normally incur in pursuing asset recovery;",
    "23": "Calls upon all States parties to the United Nations Convention against Corruption, in particular requesting and requested States parties, to cooperate to recover the proceeds of crime, as defined in the Convention, and to fulfil their obligation to ensure the return or disposal of such proceeds, in accordance with article 57 of the Convention;",
    "24": "Recognizes the importance of enhanced capacity for data collection and analysis to combat illicit financial flows, emphasizing the need to increase the exchange of data within national government institutions as well as from international institutions;",
    "25": "Emphasizes the importance of the ongoing efforts of the United Nations Office on Drugs and Crime, in coordination with the United Nations Conference on Trade and Development and other institutions, to develop a methodology to produce estimates of the total value of inward and outward illicit financial flows;",
    "26": "Invites the President of the General Assembly, the President of the Economic and Social Council and the Secretary-General to give appropriate consideration to the importance of combating illicit financial flows and strengthening good practices on assets return to foster sustainable development, and in this regard invites all relevant international institutions to support these efforts, in accordance with their respective mandates;",
    "27": "Reaffirms the commitment at the very heart of the 2030 Agenda to leave no one behind and commit to taking more tangible steps to support people in vulnerable situations and the most vulnerable countries and to reach the furthest behind first;",
    "28": "Looks forward to the inclusion, in the 2020 report of the Inter-Agency Task Force on Financing for Development, of an analysis of international cooperation to combat illicit financial flows and strengthen good practices on assets return to foster sustainable development, pursuant to the mandate of the Task Force, and also looks forward to the deliberations of the Economic and Social Council forum on financing for development follow-up on efforts to combat illicit financial flows;",
    "29": "Requests the secretariat of the United Nations Conference on Trade and Development, in consultation with relevant entities of the United Nations system, including the United Nations Office on Drugs and Crime, to inform the General Assembly at its seventy-fifth session of the implementation of the present resolution, through a dedicated section of the Sustainable Development Goals Pulse report and of the Trade and Development Report, elaborating in particular on the challenges that Member States experience in combating illicit financial flows and recovering and returning stolen assets and on the options available to help to accelerate the elimination of illicit financial flows and to return stolen assets, in line with commitments contained in the Addis Ababa Action Agenda of the Third International Conference on Financing for Development 7 and the 2030 Agenda for Sustainable Development;",
    "30": "Decides to include in the provisional agenda of its seventy-fifth session, under the item entitled \u201cMacroeconomic policy questions\u201d, the sub-item entitled \u201cPromotion of international cooperation to combat illicit financial flows and strengthen good practices on assets return to foster sustainable development\u201d."
  },
  "agenda_items": [
    "Item 17"
  ],
  "symbol_references": []
}