{
  "symbol": "A/RES/72/165",
  "filename": "A_RES_72_165.pdf",
  "title": "72/165. International Day of Remembrance of and Tribute to the Victims of Terrorism",
  "text": "United Nations \nA/RES/72/165\n \n \nGeneral Assembly \nDistr.: General \n25 January 2018 \n \n17-22975 (E)    300118 \n*1722975* \n \n \nSeventy-second session \nAgenda item 72 (b) \n \n \n \n \n Resolution adopted by the General Assembly \non 19 December 2017 \n \n \n \n \n[on the report of the Third Committee (A/72/439/Add.2)] \n \n \n 72/165. International Day of Remembrance of and Tribute to the Victims \nof Terrorism \n \n \n \nThe General Assembly, \n \nGuided by the Charter of the United Nations, the Universal Declaration of \nHuman Rights,1 the International Covenant on Civil and Political Rights 2 and other \nrelevant instruments of international human rights law and international humanitarian \nlaw, \n \nRecalling previous resolutions of the General Assembly, the Commission on \nHuman Rights and the Human Rights Council on human rights and terrorism and on \nthe promotion and protection of human rights while countering terrorism, \n \nRecalling also Human Rights Council resolution 17/8 of 16 June 2011, entitled \n\u201cProclamation of 19 August as the International Day of Remembrance of and Tribute \nto the Victims of Terrorism\u201d,3  \n \nReaffirming the fact that the promotion and protection of human rights for all \nand the rule of law at the national and international levels are essential for preventing \nand combating terrorism, \n \nRecognizing that effective counter-terrorism measures and the protection of \nhuman rights are not conflicting goals, but complementary and mutually reinforcing, \nand stressing the need to promote and protect the rights of victims of terrorism, \n \nDeeply deploring the suffering caused by terrorism to the victims and their \nfamilies, expressing its profound solidarity with them, and stressing the importance \nof providing them with proper assistance, \n__________________ \n \n1  Resolution 217 A (III). \n \n2  See resolution 2200 A (XXI), annex. \n \n3  See Official Records of the General Assembly, Sixty-sixth Session, Supplement No. 53 (A/66/53), \nchap. I.  \n\nA/RES/72/165 \nInternational Day of Remembrance and Tribute to the Victims of Terrorism\n \n17-22975 \n2/2 \n \n \nRecognizing that terrorism clearly has a very real and direct impact, with \ndevastating consequences for, inter alia, the enjoyment of human rights and \nfundamental freedoms, \n \nRecognizing also the role that victims of terrorism can play, including in \ncountering the appeal of terrorism, and emphasizing the need to promote international \nsolidarity in support of victims of terrorism and to ensure that victims of terrorism \nare treated with dignity and respect, \n \nRecognizing further the importance of respecting the human rights of victims of \nterrorism and their families and of providing them with appropriate support and \nassistance in accordance with applicable law, \n \nRenewing \nits \nunwavering \ncommitment \nto \nstrengthening \ninternational \ncooperation to prevent and combat terrorism in all its forms and manifestations, and \nreaffirming that any acts of terrorism are criminal and unjustifiable, regardless of their \nmotivation, wherever, whenever and by whomsoever committed, \n \nReaffirming its resolutions 53/199 of 15 December 1998 and 61/185 of \n20 December 2006 on the proclamation of international years, and Economic and \nSocial Council resolution 1980/67 of 25 July 1980 on international years and \nanniversaries, particularly paragraphs 1 to 10 of the annex thereto on the agreed \ncriteria for the proclamation of international years, as well as paragraphs 13 and 14, \nin which it is stated that an international day or year should not be proclaimed before \nthe basic arrangements for its organization and financing have been made, \n \n1. \nDecides to proclaim 21 August the International Day of Remembrance of \nand Tribute to the Victims of Terrorism, in order to honour and support the victims \nand survivors of terrorism and to promote and protect the full enjoyment of their \nhuman rights and fundamental freedoms; \n \n2. \nInvites all Member States, organizations of the United Nations system, \nwithin existing resources, as well as other international organizations, and civil \nsociety entities, including non-governmental organizations and individuals, to \nobserve the International Day in an appropriate manner; \n \n3. \nStresses that the cost of all activities that may arise from the \nimplementation of the present resolution shall be met from voluntary contributions; \n \n4. \nRequests the Secretary-General to report to the General Assembly at its \nseventy-third session on the implementation of the present resolution. \n \n73rd plenary meeting  \n19 December 2017 \n \n",
  "paragraphs": {
    "1": "Decides to proclaim 21 August the International Day of Remembrance of and Tribute to the Victims of Terrorism, in order to honour and support the victims and survivors of terrorism and to promote and protect the full enjoyment of their human rights and fundamental freedoms;",
    "2": "Invites all Member States, organizations of the United Nations system, within existing resources, as well as other international organizations, and civil society entities, including non-governmental organizations and individuals, to observe the International Day in an appropriate manner;",
    "3": "Stresses that the cost of all activities that may arise from the implementation of the present resolution shall be met from voluntary contributions;",
    "4": "Requests the Secretary-General to report to the General Assembly at its seventy-third session on the implementation of the present resolution."
  },
  "agenda_items": [
    "Item 72"
  ],
  "symbol_references": []
}