{
  "symbol": "A/RES/76/242",
  "filename": "A_RES_76_242.pdf",
  "title": "76/242. Administration of justice at the United Nations",
  "text": "United Nations \nA/RES/76/242\n \n \nGeneral Assembly \nDistr.: General \n5 January 2022 \n \n21-19707 (E)    070122 \n*2119707* \n \n \nSeventy-sixth session \nAgenda item 147 \nAdministration of justice at the United Nations \n \n \n \n \n Resolution adopted by the General Assembly on \n24 December 2021 \n \n \n \n \n[on the report of the Fifth Committee (A/76/620)] \n \n \n 76/242. Administration of justice at the United Nations \n \n \n \nThe General Assembly, \n \nRecalling section XI of its resolution 55/258 of 14 June 2001 and its resolutions \n57/307 of 15 April 2003, 59/266 of 23 December 2004, 59/283 of 13 April 2005, \n61/261 of 4 April 2007, 62/228 of 22 December 2007, 63/253 of 24 December 2008, \n64/233 of 22 December 2009, 65/251 of 24 December 2010, 66/237 of 24 December \n2011, 67/241 of 24 December 2012, 68/254 of 27 December 2013, 69/203 of \n18 December 2014, 70/112 of 14 December 2015, 71/266 of 23 December 2016, \n72/256 of 24 December 2017, 73/276 of 22 December 2018, 74/258 of 27 December \n2019 and 75/248 of 31 December 2020, \n \nHaving considered the reports of the Secretary-General on administration of \njustice at the United Nations1 and on the activities of the Office of the United Nations \nOmbudsman and Mediation Services,2 the report of the Internal Justice Council on \nadministration of justice at the United Nations3 and the related report of the Advisory \nCommittee on Administrative and Budgetary Questions, 4 as well as the letter dated \n19 November 2021 from the President of the General Assembly addressed to the Chair \nof the Fifth Committee,5 \n \n1. \nTakes note of the reports of the Secretary-General on administration of \njustice at the United Nations and on the activities of the Office of the United Nations \nOmbudsman and Mediation Services, the report of the Internal Justice Council on \nadministration of justice at the United Nations and the related report of the Advisory \nCommittee on Administrative and Budgetary Questions; \n__________________ \n \n1 A/76/99. \n \n2 A/76/140. \n \n3 A/76/124. \n \n4 A/76/499. \n \n5 A/C.5/76/19. \n\nA/RES/76/242 \nAdministration of justice at the United Nations\n \n21-19707\n2/4 \n \n \n2. \nEndorses the conclusions and recommendations contained in the report of \nthe Advisory Committee; \n \n \n \nI \n \n \nSystem of administration of justice \n \n \n3. \nEmphasizes the importance of the principle of judicial independence in the \nsystem of administration of justice; \n \n4. \nStresses the importance of ensuring access for all staff members to the \nsystem of administration of justice, regardless of their duty station; \n \n5. \nAcknowledges the evolving nature of the system of administration of \njustice and the need to carefully monitor its implementation to ensure that it remains \nwithin the parameters set out by the General Assembly; \n \n6. \nReaffirms its decision, contained in paragraph 4 of its resolution 61/261, \nto establish a new, independent, transparent, professionalized, adequately resourced \nand decentralized system of administration of justice consistent with the relevant \nrules of international law and the principles of the rule of law and due process to \nensure respect for the rights and obligations of staff members and the accountability \nof managers and staff members alike; \n \n7. \nRequests the Secretary-General to continue to ensure a strong culture of \naccountability throughout the Secretariat, in particular with proactive and transparent \napplication of the United Nations three-pillared approach to the management of \nmisconduct, namely, prevention, enforcement and remedial action, and to ensure \naccess to effective remedies for all categories of personnel; \n \n8. \nAlso requests the Secretary-General to continue to hold managers \naccountable when their decisions have been established to be grossly negligent \naccording to the applicable Staff Regulations and Rules of the United Nations 6 and \nhave led to litigation and subsequent financial loss, and to report thereon to the \nGeneral Assembly at its seventy-seventh session; \n \n9. \nCommends the Secretary-General for ensuring the availability of outreach \ndocuments in all six official languages, requests the Secretary-General to continue to \ntake measures to implement multilingualism within the system of administration of \njustice, and also requests the Secretary-General to report on his efforts to continue to \npromote multilingualism in the system of administration of justice in the context of \nhis next reports; \n \n10. Reiterates that retaliation against complainants or staff appearing as \nwitnesses constitutes misconduct, notes with appreciation the policy on protection \nagainst retaliation for reporting misconduct and for cooperating with duly authorized \naudits or investigations7 as well as the efforts to continuously improve the framework \nfor protection from retaliation, and in this regard requests the Secretary-General to \nprovide information on the implementation of the policy for all categories of \npersonnel covered in his next report; \n \n \n \nII \n \n \nInformal system \n \n \n11. \nRecognizes that the informal system of administration of justice is an \nefficient and effective option both for staff who seek redress of grievances and for the \nparticipation of managers; \n__________________ \n \n6 ST/SGB/2018/1/Rev.1. \n \n7 ST/SGB/2017/2/Rev.1. \n\nAdministration of justice at the United Nations \nA/RES/76/242\n \n3/4\n21-19707 \n \n \n12. Reaffirms that the informal resolution of conflict is a crucial element of \nthe system of administration of justice, emphasizes that all possible use should be \nmade of the informal system in order to avoid unnecessary litigation, without \nprejudice to the basic right of staff members to access the formal system, and \nencourages recourse to the informal resolution of disputes; \n \n13. Also reaffirms the importance of the informal dispute resolution process in \nthe Organization, which represents an effective method of dispute resolution as \ncompared with the formal process, and the central role of mediation, and emphasizes \nthat all possible use should be made of the informal system; \n \n14. Notes the efforts of the Secretary-General to promote knowledge and \nawareness of and action on racism within the Organization, and reiterates its request \nto the Secretary-General to include information on racism and cases involving racial \ndiscrimination in the context of his next report on the activities of the Office of the \nUnited Nations Ombudsman and Mediation Services; \n \n \n \nIII \n \n \nFormal system \n \n \n15. Recognizes the ongoing positive contribution of the Office of Staff Legal \nAssistance to the system of administration of justice; \n \n16. Recalls paragraph 27 of its resolution 75/248, appreciates the efforts of the \nUnited Nations Dispute Tribunal and the Office of Administration of Justice to \ndevelop and implement the case disposal plan, and welcomes the launch of the real-\ntime case-tracking dashboard; \n \n17. Notes with concern the impact of dual employment of the full-time judges \non the prompt and efficient performance of their judicial duties, and urges the full-\ntime judges of the Dispute Tribunal not to hold any other employment so as to ensure \nthe credibility and efficiency of the internal justice system; \n \n18. Requests the Secretary-General, in consultation with the Dispute Tribunal \nand the United Nations Appeals Tribunal, to include, in the context of his next report, \nhis views regarding the recommendation of the Internal Justice Council for the \nappointment of a president for a term of seven years; \n \n19. Also requests the Secretary-General to continue to track the data on the \nnumber of cases received by the Management Evaluation Unit and the Dispute \nTribunal in order to identify any emerging trends, and to report thereon in the context \nof his next report; \n \n20. Notes the continuing high opt-out rates from the voluntary staff funding \nmechanism, and in this regard encourages the Secretary-General to intensify his \nefforts to strengthen incentives for staff not to opt out, particularly in locations and \nUnited Nations entities where the participation rate is low, and to report on measures \ntaken in this regard in the context of his next report; \n \n \n \nIV \n \n \nOther issues \n \n \n21. \nInvites the Sixth Committee to consider the legal aspects of the report to be \nsubmitted by the Secretary-General, without prejudice to the role of the Fifth \nCommittee as the Main Committee entrusted with responsibilities for administrative and \nbudgetary matters; \n\nA/RES/76/242 \nAdministration of justice at the United Nations\n \n21-19707\n4/4 \n \n \n22. Decides to approve the proposed amendments to articles 8.2 (a) and 9.2 (a) \nand to articles 24, 25, 26 and 27 of the rules of procedure of the Appeals Tribunal, as \nadopted by the Appeals Tribunal on 24 October 2019 and 19 October 2020, \nrespectively.8 \n \n54th resumed plenary meeting \n24 December 2021 \n \n__________________ \n \n8 See A/75/162, annex I, and A/76/99, annex I. \n",
  "paragraphs": {
    "1": "Takes note of the reports of the Secretary-General on administration of justice at the United Nations and on the activities of the Office of the United Nations Ombudsman and Mediation Services, the report of the Internal Justice Council on administration of justice at the United Nations and the related report of the Advisory Committee on Administrative and Budgetary Questions; __________________ 1 A/76/99. 2 A/76/140. 3 A/76/124. 4 A/76/499. 5 A/C.5/76/19. A/RES/76/242 Administration of justice at the United Nations 21-19707 2/4",
    "2": "Endorses the conclusions and recommendations contained in the report of the Advisory Committee; I System of administration of justice",
    "3": "Emphasizes the importance of the principle of judicial independence in the system of administration of justice;",
    "4": "Stresses the importance of ensuring access for all staff members to the system of administration of justice, regardless of their duty station;",
    "5": "Acknowledges the evolving nature of the system of administration of justice and the need to carefully monitor its implementation to ensure that it remains within the parameters set out by the General Assembly;",
    "6": "Reaffirms its decision, contained in paragraph 4 of its resolution 61/261, to establish a new, independent, transparent, professionalized, adequately resourced and decentralized system of administration of justice consistent with the relevant rules of international law and the principles of the rule of law and due process to ensure respect for the rights and obligations of staff members and the accountability of managers and staff members alike;",
    "7": "Requests the Secretary-General to continue to ensure a strong culture of accountability throughout the Secretariat, in particular with proactive and transparent application of the United Nations three-pillared approach to the management of misconduct, namely, prevention, enforcement and remedial action, and to ensure access to effective remedies for all categories of personnel;",
    "8": "Also requests the Secretary-General to continue to hold managers accountable when their decisions have been established to be grossly negligent according to the applicable Staff Regulations and Rules of the United Nations 6 and have led to litigation and subsequent financial loss, and to report thereon to the General Assembly at its seventy-seventh session;",
    "9": "Commends the Secretary-General for ensuring the availability of outreach documents in all six official languages, requests the Secretary-General to continue to take measures to implement multilingualism within the system of administration of justice, and also requests the Secretary-General to report on his efforts to continue to promote multilingualism in the system of administration of justice in the context of his next reports;",
    "10": "Reiterates that retaliation against complainants or staff appearing as witnesses constitutes misconduct, notes with appreciation the policy on protection against retaliation for reporting misconduct and for cooperating with duly authorized audits or investigations7 as well as the efforts to continuously improve the framework for protection from retaliation, and in this regard requests the Secretary-General to provide information on the implementation of the policy for all categories of personnel covered in his next report; II Informal system",
    "11": "Recognizes that the informal system of administration of justice is an efficient and effective option both for staff who seek redress of grievances and for the participation of managers; __________________ 6 ST/SGB/2018/1/Rev.1. 7 ST/SGB/2017/2/Rev.1. Administration of justice at the United Nations A/RES/76/242 3/4 21-19707",
    "12": "Reaffirms that the informal resolution of conflict is a crucial element of the system of administration of justice, emphasizes that all possible use should be made of the informal system in order to avoid unnecessary litigation, without prejudice to the basic right of staff members to access the formal system, and encourages recourse to the informal resolution of disputes;",
    "13": "Also reaffirms the importance of the informal dispute resolution process in the Organization, which represents an effective method of dispute resolution as compared with the formal process, and the central role of mediation, and emphasizes that all possible use should be made of the informal system;",
    "14": "Notes the efforts of the Secretary-General to promote knowledge and awareness of and action on racism within the Organization, and reiterates its request to the Secretary-General to include information on racism and cases involving racial discrimination in the context of his next report on the activities of the Office of the United Nations Ombudsman and Mediation Services; III Formal system",
    "15": "Recognizes the ongoing positive contribution of the Office of Staff Legal Assistance to the system of administration of justice;",
    "16": "Recalls paragraph 27 of its resolution 75/248, appreciates the efforts of the United Nations Dispute Tribunal and the Office of Administration of Justice to develop and implement the case disposal plan, and welcomes the launch of the real- time case-tracking dashboard;",
    "17": "Notes with concern the impact of dual employment of the full-time judges on the prompt and efficient performance of their judicial duties, and urges the full- time judges of the Dispute Tribunal not to hold any other employment so as to ensure the credibility and efficiency of the internal justice system;",
    "18": "Requests the Secretary-General, in consultation with the Dispute Tribunal and the United Nations Appeals Tribunal, to include, in the context of his next report, his views regarding the recommendation of the Internal Justice Council for the appointment of a president for a term of seven years;",
    "19": "Also requests the Secretary-General to continue to track the data on the number of cases received by the Management Evaluation Unit and the Dispute Tribunal in order to identify any emerging trends, and to report thereon in the context of his next report;",
    "20": "Notes the continuing high opt-out rates from the voluntary staff funding mechanism, and in this regard encourages the Secretary-General to intensify his efforts to strengthen incentives for staff not to opt out, particularly in locations and United Nations entities where the participation rate is low, and to report on measures taken in this regard in the context of his next report; IV Other issues",
    "21": "Invites the Sixth Committee to consider the legal aspects of the report to be submitted by the Secretary-General, without prejudice to the role of the Fifth Committee as the Main Committee entrusted with responsibilities for administrative and budgetary matters; A/RES/76/242 Administration of justice at the United Nations 21-19707 4/4",
    "22": "Decides to approve the proposed amendments to articles 8.2 (a) and 9.2 (a) and to articles 24, 25, 26 and 27 of the rules of procedure of the Appeals Tribunal, as adopted by the Appeals Tribunal on 24 October 2019 and 19 October 2020, respectively.8 54th resumed plenary meeting 24 December 2021 __________________ 8 See A/75/162, annex I, and A/76/99, annex I."
  },
  "agenda_items": [
    "Item 147"
  ],
  "symbol_references": []
}