{
  "symbol": "A/RES/77/8",
  "filename": "A_RES_77_8.pdf",
  "title": "77/8. World Day for the Prevention of and Healing from Child Sexual Exploitation, Abuse and Violence",
  "text": "United Nations \nA/RES/77/8\n \n \nGeneral Assembly \nDistr.: General \n11 November 2022 \n \n22-25409 (E)    151122     \n*2225409* \n \n \nSeventy-seventh session \nAgenda item 131 \nSexual exploitation and abuse: implementing a \nzero-tolerance policy \n \n \n \n \n Resolution adopted by the General Assembly \non 7 November 2022 \n \n \n \n \n[without reference to a Main Committee (A/77/L.8)] \n \n \n \n77/8. World Day for the Prevention of and Healing from Child Sexual \nExploitation, Abuse and Violence \n \n \n \nThe General Assembly,  \n \nRecalling its resolutions 53/199 of 15 December 1998 and 61/185 of \n20 December 2006 on the proclamation of international years and Economic and \nSocial Council resolution 1980/67 of 25 July 1980 on international years and \nanniversaries, \n \nReaffirming the Universal Declaration of Human Rights,1 the Convention on the \nRights of the Child 2  and its Optional Protocols, 3  the International Covenant on \nEconomic, Social and Cultural Rights, 4 the International Covenant on Civil and \nPolitical Rights5 and the United Nations Convention against Transnational Organized \nCrime,6 and recalling all other relevant international treaties,  \n \nRecalling that the 2030 Agenda for Sustainable Development7 places the dignity \nof children and their right to live free from violence as a priority on the international \ndevelopment agenda through the implementation of the range of goals and targets of \nthe 2030 Agenda relevant to ending exploitation, abuse, trafficking, torture and all \nforms of violence against children, as well as eliminating all harmful practices, such \nas child, early and forced marriage and female genital mutilation, which place \nchildren at risk of experiencing child sexual exploitation, abuse and violence,  \n__________________ \n \n1  Resolution 217 A (III). \n \n2  United Nations, Treaty Series, vol. 1577, No. 27531. \n \n3  Ibid., vols. 2171, 2173 and 2983, No. 27531. \n \n4  See resolution 2200 A (XXI), annex. \n \n5  Ibid. \n \n6  United Nations, Treaty Series, vol. 2225, No. 39574. \n \n7  Resolution 70/1. \n\nA/RES/77/8 \nWorld Day for the Prevention of and Healing from \nChild Sexual Exploitation, Abuse and Violence\n \n22-25409\n2/2 \n \n \nExpressing grave concern that children, especially girls, are at a greater risk of \nexperiencing forced sex and sexual exploitation, abuse and violence, including both \nonline and offline, in particular during armed conflicts, that, because of the shame, \nstigma and fear associated with their experiences, many victims and survivors never \ndisclose and/or seek justice, rehabilitation or support, and that many victims and \nsurvivors of child abuse experience lifelong consequences that affect their physical \nand mental health and well-being, \n \nAffirming the need to eliminate and prevent all forms of child sexual \nexploitation, abuse and violence and to promote the dignity and rights, including \nmental and physical health and healing, of those who experience child sexual \nexploitation, abuse and violence,  \n \n1. \nDecides to proclaim 18 November of each year as the World Day for the \nPrevention of and Healing from Child Sexual Exploitation, Abuse and Violence;  \n \n2. \nInvites all Member States, relevant organizations of the United Nations \nsystem and other international organizations, world leaders, faith actors, civil society, \nincluding non-governmental organizations, academic institutions and the private \nsector, and other relevant stakeholders to commemorate the World Day for the \nPrevention of and Healing from Child Sexual Exploitation, Abuse and Violence each \nyear in a manner that each considers most appropriate, including through \ncommitments to ensure quality education and to raise public awareness of those \naffected by child sexual abuse and the need to prevent and eliminate child sexual \nexploitation, abuse and violence, including online and offline, and the imperative to \nhold perpetrators to account, ensure the access of survivors and victims to justice and \nremedies, as well as facilitate open discussion on the need to prevent and eliminate \ntheir stigmatization, promote their healing, affirm their dignity and protect their \nrights; \n \n3. \nStresses that the cost of all activities that may arise from the \nimplementation of the present resolution should be met from voluntary contributions; \n \n4. \nRequests the Secretary-General to bring the present resolution to the \nattention of all Member States, the organizations of the United Nations system and \nother relevant stakeholders, for appropriate observance. \n \n30th plenary meeting \n7 November 2022 \n \n \n",
  "paragraphs": {
    "1": "Decides to proclaim 18 November of each year as the World Day for the Prevention of and Healing from Child Sexual Exploitation, Abuse and Violence;",
    "2": "Invites all Member States, relevant organizations of the United Nations system and other international organizations, world leaders, faith actors, civil society, including non-governmental organizations, academic institutions and the private sector, and other relevant stakeholders to commemorate the World Day for the Prevention of and Healing from Child Sexual Exploitation, Abuse and Violence each year in a manner that each considers most appropriate, including through commitments to ensure quality education and to raise public awareness of those affected by child sexual abuse and the need to prevent and eliminate child sexual exploitation, abuse and violence, including online and offline, and the imperative to hold perpetrators to account, ensure the access of survivors and victims to justice and remedies, as well as facilitate open discussion on the need to prevent and eliminate their stigmatization, promote their healing, affirm their dignity and protect their rights;",
    "3": "Stresses that the cost of all activities that may arise from the implementation of the present resolution should be met from voluntary contributions;",
    "4": "Requests the Secretary-General to bring the present resolution to the attention of all Member States, the organizations of the United Nations system and other relevant stakeholders, for appropriate observance."
  },
  "agenda_items": [
    "Item 131"
  ],
  "symbol_references": [
    "A/77/L.8"
  ]
}