{
  "symbol": "A/RES/78/108",
  "filename": "A_RES_78_108.pdf",
  "title": "78/108. Report of the International Law Commission on the work of its seventy-fourth session",
  "text": "United Nations \nA/RES/78/108\n \n \nGeneral Assembly \nDistr.: General \n11 December 2023 \n \n23-24964 (E)    211223     \n*2324964* \n \n \nSeventy-eighth session \nAgenda item 79 \nReport of the International Law Commission on the work \nof its seventy-third and seventy-fourth sessions \n \n \n \n \n Resolution adopted by the General Assembly \non 7 December 2023 \n \n \n \n \n[on the report of the Sixth Committee (A/78/435, para. 11)] \n \n \n 78/108. Report of the International Law Commission on the work of its \nseventy-fourth session \n \n \n \nThe General Assembly, \n \nHaving considered the report of the International Law Commission on the work \nof its seventy-fourth session,1  \n \nEmphasizing the importance of furthering the progressive development and \ncodification of international law as a means of implementing the purposes and \nprinciples set forth in the Charter of the United Nations and in the Declaration on \nPrinciples of International Law concerning Friendly Relations and Cooperation \namong States in accordance with the Charter of the United Nations, 2  \n \nRecognizing the desirability of referring legal and drafting questions to the Sixth \nCommittee, including topics that might be submitted to the International Law \nCommission for closer examination, and of enabling the Sixth Committee and the \nCommission to enhance further their contribution to the progressive development and \ncodification of international law, \n \nRecalling the need to keep under review those topics of international law which, \ngiven their new or renewed interest for the international community, may be suitable \nfor the progressive development and codification of international law and therefore \nmay be included in the future programme of work of the International Law \nCommission, \n \nRecalling also the role of Member States in submitting proposals for new topics \nfor the consideration of the International Law Commission, and noting in this regard \n__________________ \n \n1 Official Records of the General Assembly, Seventy-eighth Session, Supplement No. 10 (A/78/10). \n \n2 Resolution 2625 (XXV), annex. \n\nA/RES/78/108 \nReport of the International Law Commission on the work of its \nseventy-fourth session\n \n23-24964\n2/7 \n \nthe recommendation of the Commission that such proposals be accompanied by a \nstatement of reasons, \n \nReaffirming the importance for the successful work of the International Law \nCommission of the information provided by Member States concerning their views \nand practice, \n \nRecognizing the importance of the work of the special rapporteurs of the \nInternational Law Commission, \n \nWelcoming the holding of the International Law Seminar, and the voluntary \ncontributions made to the United Nations trust fund for the International Law \nSeminar,  \n \nAcknowledging the importance of facilitating the timely publication of the \nYearbook of the International Law Commission and of eliminating the backlog, \n \nNoting the establishment of a trust fund for assistance to Special Rapporteurs of \nthe International Law Commission or Chairs of its Study Groups and matters ancillary \nthereto, \n \nStressing the usefulness of focusing and structuring the debate on the report of \nthe International Law Commission in the Sixth Committee in such a manner that \nconditions are provided for concentrated attention to each of the main topics dealt \nwith in the report and for discussions on specific topics, \n \nWishing to enhance further, in the context of the revitalization of the debate on \nthe report of the International Law Commission, the interaction between the Sixth \nCommittee as a body of governmental representatives and the Commission as a body \nof independent legal experts, with a view to improving the dialogue between the two \nbodies, \n \nWelcoming initiatives to hold interactive debates, panel discussions and question \ntime in the Sixth Committee, as envisaged in General Assembly resolution 58/316 of \n1 July 2004 on further measures for the revitalization of the work of the Assembly, \n \n1. \nTakes note of the report of the International Law Commission on the work \nof its seventy-fourth session;3 \n \n2. \nExpresses its appreciation to the International Law Commission for the \nwork accomplished at its seventy-fourth session, and notes in particular the \ncompletion of the first reading of the draft conclusions on general principles of law \nand the commentaries thereto;4  \n \n3. \nRecommends that the International Law Commission continue its work on \nthe topics in its current programme of work, taking into account the comments and \nobservations of Governments, whether submitted in writing or expressed orally in \ndebates in the Sixth Committee; \n \n4. \nDraws the attention of Governments to the importance for the \nInternational Law Commission of having their views on the various aspects of the \ntopics on the agenda of the Commission, in particular on all the specific issues \nidentified in chapter III of its report,5 regarding: \n \n(a) \nPrevention and repression of piracy and armed robbery at sea; \n \n(b) \nSubsidiary means for the determination of rules of international law; \n__________________ \n \n3 Official Records of the General Assembly, Seventy-eighth Session, Supplement No. 10 (A/78/10). \n \n4 Ibid., chap. IV, sect. C. \n \n5 See Official Records of the General Assembly, Seventy-eighth Session, Supplement No. 10 \n(A/78/10). \n\nReport of the International Law Commission on the work of its \nseventy-fourth session \nA/RES/78/108\n \n3/7\n23-24964 \n \n \n(c) \nSea-level rise in relation to international law; \n \n5. \nAlso draws the attention of Governments to the importance for the \nInternational Law Commission of having their comments and observations by \n1 December 2024 on the draft conclusions on general principles of law; 6  \n \n6. \nFurther draws the attention of Governments to the importance that the \nInternational Law Commission attaches to receiving their comments and observations  \non the topic \u201cImmunity of State officials from foreign criminal jurisdiction\u201d ahead of \nits second reading;7  \n \n7. \nTakes note of the decision of the International Law Commission to include \nthe topic \u201cNon-legally binding international agreements\u201d in its programme of work, 8 \nand encourages the Commission to continue the examination of the topics that are in \nits long-term programme of work;9  \n \n8. \nEncourages the International Law Commission to take particular account \nof the capacity and views of Member States, as well as of the workload of the \nCommission, when including topics in its current programme of work; \n \n9. \nTakes note with appreciation of the recommendation of the International \nLaw Commission, contained in paragraphs 275 and 276 of its report, regarding the \ncommemoration of its seventy-fifth anniversary, and encourages States, in association \nwith regional organizations, professional associations, academic institutions and \nmembers of the Commission concerned, to convene national or regional meetings, \nwhich would be dedicated to the work of the Commission; \n \n10. Takes note of paragraph 277 of the report of the International Law \nCommission, and requests the Secretary-General to continue his efforts to identify \nconcrete options for support for the work of special rapporteurs, additional to those \nprovided under General Assembly resolution 56/272 of 27 March 2002; \n \n11. \nWelcomes the efforts of the International Law Commission to improve its \nmethods of work, and encourages the Commission to continue this practice;  \n \n12. Invites the International Law Commission to continue to take measures to \nenhance its efficiency and productivity and to consider making proposals to Member \nStates to that end; \n \n13. Recalls the importance of an in-depth analysis of State practice and the \nconsideration of the diversity of legal systems of Member States to the work of the \nInternational Law Commission;  \n \n14. Takes note of paragraph 283 of the report of the International Law \nCommission, recalls the paramount importance of multilingualism as set forth in \nGeneral Assembly resolution 76/268 of 10 June 2022 on multilingualism, underlines \nthe importance of having the documents of the Commission published in due time in \nthe six official languages of the United Nations while ensuring their accuracy in all \nofficial languages, and to this end requests special rapporteurs to submit their reports \nwithin the time limits specified by the Secretariat, and the Secretariat to give due \n__________________ \n \n6 Ibid., para. 38. \n \n7 Ibid., para. 29. \n \n8 Ibid., para. 249. \n \n9 The following topics are currently in the long-term programme of work of the International Law \nCommission: \u201cOwnership and protection of wrecks beyond the limits of national maritime \njurisdiction\u201d, \u201cJurisdictional immunity of international organizations\u201d, \u201cProtection of personal \ndata in transborder flow of information\u201d, \u201cExtraterritorial jurisdiction\u201d, \u201cThe fair and equitable \ntreatment standard in international investment law\u201d, \u201cEvidence before international courts and \ntribunals\u201d, \u201cUniversal criminal jurisdiction\u201d and \u201cReparation to individuals for gross violations \nof international human rights law and serious violations of international humanitarian law\u201d. \n\nA/RES/78/108 \nReport of the International Law Commission on the work of its \nseventy-fourth session\n \n23-24964\n4/7 \n \nconsideration to the quality of the translation of the documents of the Commission in \nthe six official languages; \n \n15. Encourages the International Law Commission to continue to take cost-\nsaving measures at its future sessions, without prejudice to the efficiency and \neffectiveness of its work; \n \n16. Recalls that the seat of the International Law Commission is at the United \nNations Office at Geneva; \n \n17. Takes note of paragraph 291 of the report of the International Law \nCommission, and decides that the next session of the Commission shall be held at the \nUnited Nations Office at Geneva from 15 April to 31 May 2024, which will coincide \nwith the commemoration of the seventy-fifth anniversary of the Commission, and \nfrom 1 July to 2 August 2024;  \n \n18. Also takes note of paragraph 291 of the report of the International Law \nCommission, and endorses the request of the Commission that the Secretariat proceed \nwith the necessary administrative and organizational arrangements to facilitate the \nholding of the first part of the seventy-seventh session of the Commission in New \nYork; \n \n19. Stresses the desirability of further enhancing the dialogue between the \nInternational Law Commission, in particular the special rapporteurs, and the Sixth \nCommittee, and in this context encourages, inter alia, the continued practice of \ninformal consultations in the form of discussions between the members of the Sixth \nCommittee and the members of the Commission throughout the year; \n \n20. Encourages delegations, during the debate on the report of the \nInternational Law Commission, to continue to adhere as far as possible to the \nstructured work programme agreed to by the Sixth Committee and to consider \npresenting concise and focused statements; \n \n21. Encourages Member States to consider being represented at the level of \nlegal adviser during the first week in which the report of the International Law \nCommission is discussed in the Sixth Committee (International Law Week) to enable \nhigh-level discussions on issues of international law; \n \n22. Underlines in this regard the necessity to allow sufficient time for the \nconsideration of the report of the International Law Commission in the Sixth \nCommittee; \n \n23. Requests the International Law Commission to continue to pay special \nattention to indicating in its annual report, for each topic, any specific issues on which \nexpressions of views by Governments, either in the Sixth Committee or in written \nform, would be of particular interest in providing effective guidance for the \nCommission in its further work; \n \n24. Takes note of paragraphs 293 to 298 of the report of the International Law \nCommission with regard to cooperation and interaction with other bodies, and \nencourages the Commission to continue the implementation of articles 16 (e), 25 and \n26 of its statute in order to further strengthen cooperation between the Commission \nand other bodies concerned with international law, having in mind the usefulness of \nsuch cooperation; \n \n25. Notes that consulting with national organizations and individual experts \nconcerned with international law may assist Governments in considering whether to \nmake comments and observations on drafts submitted by the International Law \nCommission and in formulating their comments and observations; \n\nReport of the International Law Commission on the work of its \nseventy-fourth session \nA/RES/78/108\n \n5/7\n23-24964 \n \n \n26. Reaffirms its previous decisions concerning the indispensable role of the \nCodification Division of the Office of Legal Affairs of the Secretariat in providing \nassistance to the International Law Commission, including in the preparation of \nmemorandums and studies on topics on the agenda of the Commission; \n \n27. Also reaffirms its previous decisions concerning the documentation and \nsummary records of the International Law Commission;10  \n \n28. Takes note of paragraph 281 of the report of the International Law \nCommission, stresses the need to expedite the preparation of the summary records of \nthe International Law Commission, welcomes the continuation of the measures taken \nto streamline the processing of summary records during the sixty-fifth session of the \nCommission,11 which have led to a more rational use of resources, and expresses its \nsatisfaction that the summary records of the Commission, constituting travaux \npr\u00e9paratoires in the progressive development and codification of international law, \nwill not be subject to arbitrary length restrictions; \n \n29. Welcomes the institutionalization of the practice of the Secretariat to \ninclude on the website of the International Law Commission the provisional summary \nrecords in English and French relating to the work of the Commission; \n \n30. Also welcomes the efforts of the Secretariat in seeking to ensure the timely \nand efficient processing of the documents of the International Law Commission and \nthe institutionalization of the experimental measures taken during the sixty-eighth \nsession of the Commission to streamline the editing of those documents; \n \n31. Takes note of paragraph 280 of the report of the International Law \nCommission, and underlines the importance of the publications of the Codification \nDivision to the work of the Commission, welcomes in particular the issuance of the \ntenth edition of The Work of the International Law Commission in Chinese, English, \nFrench, Russian and Spanish and of volume 26 of the United Nations Legislative \nSeries entitled Materials on the Provisional Application of Treaties,12 and reiterates \nits request that the Secretary-General continue to publish The Work of the \nInternational Law Commission in all six official languages at the beginning of each \nquinquennium, the Reports of International Arbitral Awards in English or French and \nthe Summaries of the Judgments, Advisory Opinions and Orders of the International \nCourt of Justice in all six official languages every five years; \n \n32. Also takes note of paragraph 284 of the report of the International Law \nCommission, expresses its appreciation to the United Nations Library at Geneva for \nthe dedicated assistance accorded to the Commission, and notes the Commission\u2019s \nemphasis on the need for adequate funding to ensure the continuation of the Library\u2019s \nability to function as a research library to assist the Commission in the performance \nof its mandate in the codification and progressive development of international law; \n \n33. Further takes note of paragraph 285 of the report of the International Law \nCommission, stresses the unique value of the Yearbook of the International Law \nCommission, and requests the Secretary-General to ensure its timely publication in \nall official languages;  \n__________________ \n \n10 See resolutions 32/151, para. 10, and 37/111, para. 5, and all subsequent resolutions on the \nannual reports of the International Law Commission to the General Assembly; see also Yearbook \nof the International Law Commission 1982, vol. II (Part Two), paras. 267\u2013269 and 271, as well \nas all subsequent annual reports of the International Law Commission. \n \n11 Official Records of the General Assembly, Sixty-eighth Session, Supplement No. 10 (A/68/10), \npara. 183. \n \n12 See resolution 76/113, para. 5, and Official Records of the General Assembly, Seventy-sixth \nSession, Supplement No. 10 (A/76/10), para. 49. \n\nA/RES/78/108 \nReport of the International Law Commission on the work of its \nseventy-fourth session\n \n23-24964\n6/7 \n \n \n34. Expresses its appreciation to Governments that have made voluntary \ncontributions to the trust fund on the backlog relating to the Yearbook of the \nInternational Law Commission, and encourages further contributions to the trust \nfund; \n \n35. Takes note of paragraph 286 of the report of the International Law \nCommission, expresses its satisfaction with the remarkable progress achieved in the \npast few years in reducing the backlog of the Yearbook of the International Law \nCommission in all six languages, welcomes the efforts made by the Division of \nConference Management of the United Nations Office at Geneva, especially its \nEditing Section, in effectively implementing relevant resolutions of the General \nAssembly calling for the reduction of the backlog, encourages that Division to \nprovide continuous necessary support to the Editing Section in advancing the \nYearbook of the International Law Commission, and requests that updates on progress \nmade in this respect be provided to the Commission on a regular basis; \n \n36. Welcomes the continuous efforts of the Codification Division to maintain \nand improve the website relating to the work of the International Law Commission; \n \n37. Takes note of paragraph 287 of the report of the International Law \nCommission and expresses its appreciation for contributions made to date to the trust \nfund to receive voluntary contributions for assistance to Special Rapporteurs of the \nInternational Law Commission or Chairs of its Study Groups and matters ancillary \nthereto, and invites further contributions to the trust fund, in accordance with the \nterms of the trust fund, including the need for the financial contributions not to be \nearmarked for any specific activity of the International Law Commission, its Special \nRapporteurs or Chairs of its Study Groups; \n \n38. Expresses the hope that the International Law Seminar will continue to be \nheld in connection with the sessions of the International Law Commission and that \nan increasing number of participants representing the principal legal systems of the \nworld and from different countries in the various regions, including in particular those \nfrom developing countries, will be given the opportunity to attend the Seminar, as \nwell as delegates to the Sixth Committee, and appeals to States to continue to make \nurgently needed voluntary contributions to the United Nations trust fund for the \nInternational Law Seminar;  \n \n39. Requests the Secretary-General to continue to provide the International \nLaw Seminar with adequate services, including interpretation, as required, and \nencourages him to continue to consider ways to improve the structure and content of \nthe Seminar; \n \n40. Underlines the importance of the records and topical summary of the \ndebate in the Sixth Committee for the deliberations of the International Law \nCommission, and in this regard requests the Secretary-General to forward to the \nCommission, for its attention, the records of the debate on the report of the \nCommission, together with such written statements as delegations may circulate in \nconjunction with their oral statements, and to prepare and distribute a topical \nsummary of the debate, following established practice; \n \n41. Requests the Secretariat to circulate to States, as soon as possible after the \nconclusion of the session of the International Law Commission, chapter II of its report \ncontaining a summary of the work of that session, chapter III containing the specific \nissues on which the views of Governments would be of particular interest to the \nCommission and any draft provisions adopted on either first or second reading by the \nCommission; \n \n42. Also requests the Secretariat to make the complete report of the \nInternational Law Commission available as soon as possible after the conclusion of \n\nReport of the International Law Commission on the work of its \nseventy-fourth session \nA/RES/78/108\n \n7/7\n23-24964 \n \nthe session of the Commission for the consideration of Member States with due \nanticipation and no later than the prescribed time limit for reports in the General \nAssembly; \n \n43. Encourages the International Law Commission to continue to consider \nways in which specific issues on which the views of Governments would be of \nparticular interest to the Commission could be framed so as to help Governments to \nhave a better appreciation of the issues on which responses are required; \n \n44. Recommends that the debate on the report of the International Law \nCommission at the seventy-ninth session of the General Assembly commence on \n21 October 2024. \n \n45th plenary meeting \n7 December 2023 \n \n",
  "paragraphs": {
    "1": "Takes note of the report of the International Law Commission on the work of its seventy-fourth session;3",
    "2": "Expresses its appreciation to the International Law Commission for the work accomplished at its seventy-fourth session, and notes in particular the completion of the first reading of the draft conclusions on general principles of law and the commentaries thereto;4",
    "3": "Recommends that the International Law Commission continue its work on the topics in its current programme of work, taking into account the comments and observations of Governments, whether submitted in writing or expressed orally in debates in the Sixth Committee;",
    "4": "Draws the attention of Governments to the importance for the International Law Commission of having their views on the various aspects of the topics on the agenda of the Commission, in particular on all the specific issues identified in chapter III of its report,5 regarding: (a) Prevention and repression of piracy and armed robbery at sea; (b) Subsidiary means for the determination of rules of international law; (c) Sea-level rise in relation to international law;",
    "5": "Also draws the attention of Governments to the importance for the International Law Commission of having their comments and observations by 1 December 2024 on the draft conclusions on general principles of law; 6",
    "6": "Further draws the attention of Governments to the importance that the International Law Commission attaches to receiving their comments and observations on the topic \u201cImmunity of State officials from foreign criminal jurisdiction\u201d ahead of its second reading;7",
    "7": "Takes note of the decision of the International Law Commission to include the topic \u201cNon-legally binding international agreements\u201d in its programme of work, 8 and encourages the Commission to continue the examination of the topics that are in its long-term programme of work;9",
    "8": "Encourages the International Law Commission to take particular account of the capacity and views of Member States, as well as of the workload of the Commission, when including topics in its current programme of work;",
    "9": "Takes note with appreciation of the recommendation of the International Law Commission, contained in paragraphs 275 and 276 of its report, regarding the commemoration of its seventy-fifth anniversary, and encourages States, in association with regional organizations, professional associations, academic institutions and members of the Commission concerned, to convene national or regional meetings, which would be dedicated to the work of the Commission;",
    "10": "Takes note of paragraph 277 of the report of the International Law Commission, and requests the Secretary-General to continue his efforts to identify concrete options for support for the work of special rapporteurs, additional to those provided under General Assembly resolution 56/272 of 27 March 2002;",
    "11": "Welcomes the efforts of the International Law Commission to improve its methods of work, and encourages the Commission to continue this practice;",
    "12": "Invites the International Law Commission to continue to take measures to enhance its efficiency and productivity and to consider making proposals to Member States to that end;",
    "13": "Recalls the importance of an in-depth analysis of State practice and the consideration of the diversity of legal systems of Member States to the work of the International Law Commission;",
    "14": "Takes note of paragraph 283 of the report of the International Law Commission, recalls the paramount importance of multilingualism as set forth in General Assembly resolution 76/268 of 10 June 2022 on multilingualism, underlines the importance of having the documents of the Commission published in due time in the six official languages of the United Nations while ensuring their accuracy in all official languages, and to this end requests special rapporteurs to submit their reports within the time limits specified by the Secretariat, and the Secretariat to give due consideration to the quality of the translation of the documents of the Commission in the six official languages;",
    "15": "Encourages the International Law Commission to continue to take cost- saving measures at its future sessions, without prejudice to the efficiency and effectiveness of its work;",
    "16": "Recalls that the seat of the International Law Commission is at the United Nations Office at Geneva;",
    "17": "Takes note of paragraph 291 of the report of the International Law Commission, and decides that the next session of the Commission shall be held at the United Nations Office at Geneva from 15 April to 31 May 2024, which will coincide with the commemoration of the seventy-fifth anniversary of the Commission, and from 1 July to 2 August 2024;",
    "18": "Also takes note of paragraph 291 of the report of the International Law Commission, and endorses the request of the Commission that the Secretariat proceed with the necessary administrative and organizational arrangements to facilitate the holding of the first part of the seventy-seventh session of the Commission in New York;",
    "19": "Stresses the desirability of further enhancing the dialogue between the International Law Commission, in particular the special rapporteurs, and the Sixth Committee, and in this context encourages, inter alia, the continued practice of informal consultations in the form of discussions between the members of the Sixth Committee and the members of the Commission throughout the year;",
    "20": "Encourages delegations, during the debate on the report of the International Law Commission, to continue to adhere as far as possible to the structured work programme agreed to by the Sixth Committee and to consider presenting concise and focused statements;",
    "21": "Encourages Member States to consider being represented at the level of legal adviser during the first week in which the report of the International Law Commission is discussed in the Sixth Committee (International Law Week) to enable high-level discussions on issues of international law;",
    "22": "Underlines in this regard the necessity to allow sufficient time for the consideration of the report of the International Law Commission in the Sixth Committee;",
    "23": "Requests the International Law Commission to continue to pay special attention to indicating in its annual report, for each topic, any specific issues on which expressions of views by Governments, either in the Sixth Committee or in written form, would be of particular interest in providing effective guidance for the Commission in its further work;",
    "24": "Takes note of paragraphs 293 to 298 of the report of the International Law Commission with regard to cooperation and interaction with other bodies, and encourages the Commission to continue the implementation of articles 16 (e), 25 and 26 of its statute in order to further strengthen cooperation between the Commission and other bodies concerned with international law, having in mind the usefulness of such cooperation;",
    "25": "",
    "26": "Reaffirms its previous decisions concerning the indispensable role of the Codification Division of the Office of Legal Affairs of the Secretariat in providing assistance to the International Law Commission, including in the preparation of memorandums and studies on topics on the agenda of the Commission;",
    "27": "Also reaffirms its previous decisions concerning the documentation and summary records of the International Law Commission;10",
    "28": "Takes note of paragraph 281 of the report of the International Law Commission, stresses the need to expedite the preparation of the summary records of the International Law Commission, welcomes the continuation of the measures taken to streamline the processing of summary records during the sixty-fifth session of the Commission,11 which have led to a more rational use of resources, and expresses its satisfaction that the summary records of the Commission, constituting travaux pr\u00e9paratoires in the progressive development and codification of international law, will not be subject to arbitrary length restrictions;",
    "29": "Welcomes the institutionalization of the practice of the Secretariat to include on the website of the International Law Commission the provisional summary records in English and French relating to the work of the Commission;",
    "30": "Also welcomes the efforts of the Secretariat in seeking to ensure the timely and efficient processing of the documents of the International Law Commission and the institutionalization of the experimental measures taken during the sixty-eighth session of the Commission to streamline the editing of those documents;",
    "31": "Takes note of paragraph 280 of the report of the International Law Commission, and underlines the importance of the publications of the Codification Division to the work of the Commission, welcomes in particular the issuance of the tenth edition of The Work of the International Law Commission in Chinese, English, French, Russian and Spanish and of volume 26 of the United Nations Legislative Series entitled Materials on the Provisional Application of Treaties,12 and reiterates its request that the Secretary-General continue to publish The Work of the International Law Commission in all six official languages at the beginning of each quinquennium, the Reports of International Arbitral Awards in English or French and the Summaries of the Judgments, Advisory Opinions and Orders of the International Court of Justice in all six official languages every five years;",
    "32": "Also takes note of paragraph 284 of the report of the International Law Commission, expresses its appreciation to the United Nations Library at Geneva for the dedicated assistance accorded to the Commission, and notes the Commission\u2019s emphasis on the need for adequate funding to ensure the continuation of the Library\u2019s ability to function as a research library to assist the Commission in the performance of its mandate in the codification and progressive development of international law;",
    "33": "Further takes note of paragraph 285 of the report of the International Law Commission, stresses the unique value of the Yearbook of the International Law Commission, and requests the Secretary-General to ensure its timely publication in all official languages;",
    "34": "Expresses its appreciation to Governments that have made voluntary contributions to the trust fund on the backlog relating to the Yearbook of the International Law Commission, and encourages further contributions to the trust fund;",
    "35": "Takes note of paragraph 286 of the report of the International Law Commission, expresses its satisfaction with the remarkable progress achieved in the past few years in reducing the backlog of the Yearbook of the International Law Commission in all six languages, welcomes the efforts made by the Division of Conference Management of the United Nations Office at Geneva, especially its Editing Section, in effectively implementing relevant resolutions of the General Assembly calling for the reduction of the backlog, encourages that Division to provide continuous necessary support to the Editing Section in advancing the Yearbook of the International Law Commission, and requests that updates on progress made in this respect be provided to the Commission on a regular basis;",
    "36": "Welcomes the continuous efforts of the Codification Division to maintain and improve the website relating to the work of the International Law Commission;",
    "37": "Takes note of paragraph 287 of the report of the International Law Commission and expresses its appreciation for contributions made to date to the trust fund to receive voluntary contributions for assistance to Special Rapporteurs of the International Law Commission or Chairs of its Study Groups and matters ancillary thereto, and invites further contributions to the trust fund, in accordance with the terms of the trust fund, including the need for the financial contributions not to be earmarked for any specific activity of the International Law Commission, its Special Rapporteurs or Chairs of its Study Groups;",
    "38": "Expresses the hope that the International Law Seminar will continue to be held in connection with the sessions of the International Law Commission and that an increasing number of participants representing the principal legal systems of the world and from different countries in the various regions, including in particular those from developing countries, will be given the opportunity to attend the Seminar, as well as delegates to the Sixth Committee, and appeals to States to continue to make urgently needed voluntary contributions to the United Nations trust fund for the International Law Seminar;",
    "39": "Requests the Secretary-General to continue to provide the International Law Seminar with adequate services, including interpretation, as required, and encourages him to continue to consider ways to improve the structure and content of the Seminar;",
    "40": "Underlines the importance of the records and topical summary of the debate in the Sixth Committee for the deliberations of the International Law Commission, and in this regard requests the Secretary-General to forward to the Commission, for its attention, the records of the debate on the report of the Commission, together with such written statements as delegations may circulate in conjunction with their oral statements, and to prepare and distribute a topical summary of the debate, following established practice;",
    "41": "Requests the Secretariat to circulate to States, as soon as possible after the conclusion of the session of the International Law Commission, chapter II of its report containing a summary of the work of that session, chapter III containing the specific issues on which the views of Governments would be of particular interest to the Commission and any draft provisions adopted on either first or second reading by the Commission;",
    "42": " the session of the Commission for the consideration of Member States with due anticipation and no later than the prescribed time limit for reports in the General Assembly;",
    "43": "Encourages the International Law Commission to continue to consider ways in which specific issues on which the views of Governments would be of particular interest to the Commission could be framed so as to help Governments to have a better appreciation of the issues on which responses are required;",
    "44": "Recommends that the debate on the report of the International Law Commission at the seventy-ninth session of the General Assembly commence on 21 October 2024."
  },
  "agenda_items": [
    "Item 79"
  ],
  "symbol_references": []
}