{
  "symbol": "A/RES/80/164",
  "filename": "A_RES_80_164.pdf",
  "title": "80/164. Report of the International Law Commission on the work of its seventy-sixth session",
  "text": "United Nations \nA/RES/80/164 \n \nGeneral Assembly \nDistr.: General \n19 December 2025 \n25-20858 (E) \n*2520858* \n \n \nEightieth session \nAgenda item 80 \nReport of the International Law Commission on the work of \nits seventy-sixth session \n \n \n \n \n Resolution adopted by the General Assembly \non 15 December 2025 \n \n \n[on the report of the Sixth Committee (A/80/450, para. 9)] \n \n \n 80/164. Report of the International Law Commission on the work of its \nseventy-sixth session \n \n \n \nThe General Assembly, \n \nHaving considered the report of the International Law Commission on the work \nof its seventy-sixth session,1 \n \nEmphasizing the importance of furthering the progressive development and \ncodification of international law as a means of implementing the purposes and \nprinciples set forth in the Charter of the United Nations and in the Declaration on \nPrinciples of International Law concerning Friendly Relations and Cooperation \namong States in accordance with the Charter of the United Nations, 2 \n \nRecognizing the desirability of referring legal and drafting questions to the Sixth \nCommittee, including topics that might be submitted to the International Law \nCommission for closer examination, and of enabling the Sixth Committee and the \nCommission to enhance further their contribution to the progressive development and \ncodification of international law, \n \nRecalling the need to keep under review those topics of international law which, \ngiven their new or renewed interest for the international community, may be suitable \nfor the progressive development and codification of international law and therefore \nmay be included in the future programme of work of the International Law \nCommission, \n \nRecalling also the role of Member States in submitting proposals for new topics \nfor the consideration of the International Law Commission, and noting in this regard \n_______________ \n \n1 Official Records of the General Assembly, Eightieth Session, Supplement No. 10 (A/80/10). \n \n2 Resolution 2625 (XXV), annex. \n\nA/RES/80/164 \nReport of the International Law Commission on the work of its \nseventy-sixth session\n \n25-20858\n2/7 \n \nthe recommendation of the Commission that such proposals be accompanied by a \nstatement of reasons, \n \nReaffirming the importance for the successful work of the International Law \nCommission of the information provided by Member States concerning their views \nand practice, \n \nRecognizing the importance of the work of the special rapporteurs of the \nInternational Law Commission, \n \nWelcoming the holding of the International Law Seminar, and the voluntary \ncontributions made to the United Nations trust fund for the International Law \nSeminar, \n \nAcknowledging the importance of facilitating the timely publication of the \nYearbook of the International Law Commission and of eliminating the backlog, \n \nRecalling the establishment of a trust fund for assistance to Special Rapporteurs \nof the International Law Commission or Chairs of its Study Groups and matters \nancillary thereto, \n \nStressing the usefulness of focusing and structuring the debate on the report of \nthe International Law Commission in the Sixth Committee in such a manner that \nconditions are provided for concentrated attention to each of the main topics dealt \nwith in the report and for discussions on specific topics, \n \nWishing to enhance further, in the context of the revitalization of the debate on \nthe report of the International Law Commission, the interaction between the Sixth \nCommittee as a body of governmental representatives and the Commission as a body \nof independent legal experts, with a view to improving the dialogue between the two \nbodies, \n \nWelcoming initiatives to hold interactive debates, panel discussions and question \ntime in the Sixth Committee, as envisaged in General Assembly resolution 58/316 of \n1 July 2004 on further measures for the revitalization of the work of the Assembly, \n \n1. \nTakes note of the report of the International Law Commission on the work \nof its seventy-sixth session; \n \n2. \nExpresses its appreciation to the International Law Commission for the \nwork accomplished at its seventy-sixth session; \n \n3. \nWelcomes the completion of the work of the International Law \nCommission and takes note of its adoption of the final report of the Study Group on \nthe topic \u201cSea-level rise in relation to international law\u201d, contained in annex I to the \nreport of the Commission on the work of its seventy-sixth session; \n \n4. \nRecognizes the valuable contribution of this work to enhancing the \nunderstanding and clarification of issues of international law arising in connection \nwith sea-level rise, and invites States to reflect on it in relation to the ongoing work \nof the General Assembly in 2026 and, in this regard, and without setting a precedent, \nto express further views on the legal aspects of this topic during the eighty-first \nsession of the Assembly, during the consideration of the report of the Commission on \nthe work of its seventy-seventh session; \n \n5. \nTakes note that the International Court of Justice engaged with the final \nreport of the Study Group in its advisory opinion of 23 July 2025; \n \n6. \nRecommends that the International Law Commission continue its work on \nthe topics in its current programme of work, taking into account the comments and \nobservations of Governments, whether submitted in writing or expressed orally in \n\nReport of the International Law Commission on the work of its \nseventy-sixth session \nA/RES/80/164\n \n3/7\n25-20858 \n \ndebates in the Sixth Committee, and further recognizes the important role of \ncomments and observations from Governments in the work of the Commission; \n \n7. \nEncourages the International Law Commission to include in its \ncommentaries, where relevant and practicable, indications of the extent to which the \nCommission views draft provisions as representing the codification or progressive \ndevelopment of international law; \n \n8. \nDraws the attention of Governments to the importance for the \nInternational Law Commission of having their views on the various aspects of the \ntopics on the agenda of the Commission, in particular on all the specific issues \nidentified in chapter III of its report, including: \n \n(a) \nSettlement of disputes to which international organizations are parties; \n \n(b) \nNon-legally binding international agreements; \n \n(c) \nPrevention and repression of piracy and armed robbery at sea; 3 \n \n9. \nTakes note of the decision of the International Law Commission to include \nthe topics \u201cCompensation for the damage caused by internationally wrongful acts\u201d \nand \u201cDue diligence in international law\u201d in its programme of work, 4 and encourages \nthe Commission to continue the examination of the topics that are in its long-term \nprogramme of work;5 \n \n10. Encourages the International Law Commission to take particular account \nof the capacity and views of Member States, as well as of the workload of the \nCommission, when including topics in its current programme of work; \n \n11. Takes note of paragraphs 445 to 449 of the report of the International Law \nCommission, and notes, in particular, the inclusion of the topics \u201cThe principle of \nnon\u2011intervention in international law\u201d, \u201cIdentification and legal consequences of \nobligations erga omnes in international law\u201d and \u201cLegal aspects of accountability for \ncrimes committed against United Nations personnel serving in peacekeeping \noperations\u201d in the long-term programme of work of the Commission,6 and in this \nregard calls upon the Commission to take into consideration the comments, concerns \nand observations expressed by Governments during the debate in the Sixth \nCommittee; \n \n12. Also takes note of paragraph 464 of the report of the International Law \nCommission, and requests the Secretary-General to continue his efforts to identify \nconcrete options for support for the work of special rapporteurs, additional to those \nprovided under General Assembly resolution 56/272 of 27 March 2002; \n_______________ \n \n3 Official Records of the General Assembly, Eightieth Session, Supplement No. 10 (A/80/10), \nparas. 27\u201329. \n \n4 Ibid., para. 437. \n \n5 The following topics are currently in the long-term programme of work of the International Law \nCommission: \u201cOwnership and protection of wrecks beyond the limits of national maritime \njurisdiction\u201d, \u201cJurisdictional immunity of international organizations\u201d, \u201cProtection of personal \ndata in transborder flow of information\u201d, \u201cExtraterritorial jurisdiction\u201d, \u201cThe fair and equitable \ntreatment standard in international investment law\u201d, \u201cEvidence before international courts and \ntribunals\u201d, \u201cUniversal criminal jurisdiction\u201d, \u201cReparation to individuals for gross violations of \ninternational human rights law and serious violations of international humanitarian law\u201d, \u201cThe \nprinciple of non-intervention in international law\u201d, \u201cIdentification and legal consequences of \nobligations erga omnes in international law\u201d and \u201cLegal aspects of accountability for crimes \ncommitted against United Nations personnel serving in peacekeeping operations\u201d. \n \n6 Official Records of the General Assembly, Eightieth Session, Supplement No. 10 (A/80/10), \npara. 446. \n\nA/RES/80/164 \nReport of the International Law Commission on the work of its \nseventy-sixth session\n \n25-20858\n4/7 \n \n \n13. Welcomes the efforts of the International Law Commission to improve its \nmethods of work, and encourages the Commission to continue this practice;  \n \n14. Recalls that the persons to be elected to the International Law Commission \nshould individually possess the qualifications required and that in the Commission as \na whole representation of the main forms of civilization and of the principal legal \nsystems of the world should be assured, as well as invites Member States to bear in \nmind General Assembly resolution 77/335 of 1 September 2023, concerning working \nmethods of the Assembly and its subsidiary organs, when nominating candidates for \nthe Commission; \n \n15. Invites the International Law Commission to continue to take measures to \nenhance its efficiency and productivity and to consider making proposals to Member \nStates to that end; \n \n16. Recalls the importance of an in-depth analysis of State practice and the \nconsideration of the diversity of legal systems of Member States to the work of the \nInternational Law Commission;  \n \n17. Takes note of paragraph 471 of the report of the International Law \nCommission, recalls the paramount importance of multilingualism as set forth in \nGeneral Assembly resolution 78/330 of 6 September 2024 on multilingualism, \nunderlines the importance of having the documents of the Commission published in \ndue time in the six official languages of the United Nations while ensuring their \naccuracy in all official languages, and to this end requests special rapporteurs to \nsubmit their reports within the time limits specified by the Secretariat, and the \nSecretariat to give due consideration to the quality of the translation of the documents \nof the Commission in the six official languages; \n \n18. Encourages the International Law Commission to continue to take cost-\nsaving measures at its future sessions, without prejudice to the efficiency and \neffectiveness of its work; \n \n19. Recalls that the seat of the International Law Commission is at the United \nNations Office at Geneva; \n \n20. Takes note of paragraphs 440 to 444 of the report of the International Law \nCommission describing the reduction of its annual session from the originally planned \n12-week session that was decided in General Assembly resolution 79/121 to a single \n5-week period (28 April to 30 May 2025) due to the serious liquidity crisis, which in \nthe view of the Commission raised serious concerns about establishing a precedent, \nand emphasizes that no precedent has been established regarding the reduction of the \nsession; \n \n21. Also takes note of paragraphs 487 to 489 of the report of the International \nLaw Commission, decides that the seventy-seventh session of the Commission shall \nbe held from 20 April to 29 May 2026 or from 27 April to 5 June 2026 and from \n29 June to 7 August 2026, at United Nations Headquarters in New York or at the \nUnited Nations Office at Geneva, with due consideration given to facilitating the \nparticipation of Member States and to the most cost-effective location, and stresses \nthe importance of having a 12-week session in two parts; \n \n22. Decides, without prejudice to the budgetary prerogatives of the Fifth \nCommittee and to the authority of the Secretary-General, that no exceptional \nmeasures affecting the duration of the seventy-seventh session of the International \nLaw Commission shall be taken by the Secretariat without consultation with the \nBureau of the Sixth Committee, which shall inform the Sixth Committee; \n\nReport of the International Law Commission on the work of its \nseventy-sixth session \nA/RES/80/164\n \n5/7\n25-20858 \n \n \n23. Stresses the desirability of further enhancing the dialogue between the \nInternational Law Commission, in particular the special rapporteurs, and the Sixth \nCommittee, and in this context encourages, inter alia, the continued practice of \ninformal consultations in the form of discussions between the members of the Sixth \nCommittee and the members of the Commission throughout the year; \n \n24. Encourages delegations, during the debate on the report of the \nInternational Law Commission, to continue to adhere as far as possible to the \nstructured work programme agreed to by the Sixth Committee and to consider \npresenting concise and focused statements; \n \n25. Encourages Member States to consider being represented at the level of \nlegal adviser during the first week in which the report of the International Law \nCommission is discussed in the Sixth Committee (International Law Week) to enable \nhigh-level discussions on issues of international law; \n \n26. Underlines in this regard the necessity to allow sufficient time for the \nconsideration of the report of the International Law Commission in the Sixth \nCommittee; \n \n27. Requests the International Law Commission to continue to pay special \nattention to indicating in its annual report, for each topic, any specific issues on which \nexpressions of views by Governments, either in the Sixth Committee or in written \nform, would be of particular interest in providing effective guidance for the \nCommission in its further work; \n \n28. Recognizes the significant value of the commentaries of the International \nLaw Commission for the users of its work, and emphasizes the importance of \nfeedback from States; \n \n29. Takes note of paragraphs 490 to 493 of the report of the International Law \nCommission with regard to cooperation and interaction with other bodies, notes with \nregret the limited exchange of views with other relevant bodies in 2025, and \nencourages the Commission, in a balanced manner, to continue to strengthen \ncooperation between the Commission and other bodies concerned with international \nlaw, in accordance with articles 25 and 26 of its statute, having in mind the usefulness \nof such cooperation and recognizing the importance of continued dialogue and \nconsultation among them to promote international law; \n \n30. Notes that consulting with national organizations and individual experts \nconcerned with international law may assist Governments in considering whether to \nmake comments and observations on drafts submitted by the International Law \nCommission and in formulating their comments and observations; \n \n31. Reaffirms its previous decisions concerning the indispensable role of the \nCodification Division of the Office of Legal Affairs of the Secretariat in providing \nassistance to the International Law Commission, including in the preparation of \nmemorandums and studies on topics on the agenda of the Commission; \n \n32. Also reaffirms its previous decisions concerning the documentation and \nsummary records of the International Law Commission;7 \n \n33. Takes note of paragraph 469 of the report of the International Law \nCommission, stresses the need to expedite the preparation of the summary records of \nthe International Law Commission, welcomes the continuation of the measures taken \n_______________ \n \n7 See resolutions 32/151, para. 10, and 37/111, para. 5, and all subsequent resolutions on the \nannual reports of the International Law Commission to the General Assembly; see also Yearbook \nof the International Law Commission 1982, vol. II (Part Two), paras. 267\u2013269 and 271, as well \nas all subsequent annual reports of the International Law Commission. \n\nA/RES/80/164 \nReport of the International Law Commission on the work of its \nseventy-sixth session\n \n25-20858\n6/7 \n \nto streamline the processing of summary records during the sixty-fifth session of the \nCommission,8 which have led to a more rational use of resources, and expresses its \nsatisfaction that the summary records of the Commission, constituting travaux \npr\u00e9paratoires in the progressive development and codification of international law, \nwill not be subject to arbitrary length restrictions; \n \n34. Encourages the continuation of the practice of the Secretariat to include \non the website of the International Law Commission the provisional summary records \nin English and French relating to the work of the Commission; \n \n35. Welcomes the efforts of the Secretariat in seeking to ensure the timely and \nefficient processing of the documents of the International Law Commission and the \ninstitutionalization of the measures taken during the sixty-eighth session of the \nCommission to streamline the editing of those documents; \n \n36. Takes note of paragraph 468 of the report of the International Law \nCommission, underlines the importance of the publications of the Codification \nDivision to the work of the Commission, and reiterates its request that the Secretary-\nGeneral continue to publish The Work of the International Law Commission in all six \nofficial languages at the beginning of each quinquennium, the Reports of \nInternational Arbitral Awards in English or French and the Summaries of the \nJudgments, Advisory Opinions and Orders of the International Court of Justice in all \nsix official languages every five years; \n \n37. Also takes note of paragraphs 472 to 475 of the report of the International \nLaw Commission, expresses its appreciation to the United Nations Library at Geneva \nfor the dedicated assistance accorded to the Commission, and notes the Commission\u2019s \nconcern that current budget constraints could limit the capacity of the Library to offer \nspecialized research assistance and to acquire additional publications essential for the \nwork of the Commission; \n \n38. Further takes note of paragraph 476 of the report of the International Law \nCommission, stresses the unique value of the Yearbook of the International Law \nCommission, and requests the Secretary-General to ensure its timely publication in all \nofficial languages;  \n \n39. Expresses its appreciation to Governments that have made voluntary \ncontributions to the trust fund on the backlog relating to the Yearbook of the \nInternational Law Commission, and encourages further contributions to the trust fund; \n \n40. Takes note of paragraph 477 of the report of the International Law \nCommission, expresses its satisfaction with the remarkable progress achieved in the \npast few years in reducing the backlog of the Yearbook of the International Law \nCommission in all six languages, welcomes the efforts made by the Division of \nConference Management of the United Nations Office at Geneva, especially its \nEditing Section, in effectively implementing relevant resolutions of the General \nAssembly calling for the reduction of the backlog, encourages that Division to provide \ncontinuous necessary support to the Editing Section in advancing the Yearbook of the \nInternational Law Commission, and requests that updates on progress made in this \nrespect be provided to the Commission on a regular basis; \n \n41. Welcomes the continuous efforts of the Codification Division to maintain \nand improve the website relating to the work of the International Law Commission; \n \n42. Takes note of paragraph 478 of the report of the International Law \nCommission and expresses its appreciation for contributions made to date to the trust \n_______________ \n \n8 Official Records of the General Assembly, Sixty-eighth Session, Supplement No. 10 (A/68/10), \npara. 183. \n\nReport of the International Law Commission on the work of its \nseventy-sixth session \nA/RES/80/164\n \n7/7\n25-20858 \n \nfund to receive voluntary contributions for assistance to Special Rapporteurs of the \nInternational Law Commission or Chairs of its Study Groups and matters ancillary \nthereto, and invites further contributions to the trust fund, in accordance with the \nterms of the trust fund, including the need for the financial contributions not to be \nearmarked for any specific activity of the International Law Commission, its Special \nRapporteurs or Chairs of its Study Groups; \n \n43. Expresses the hope that the International Law Seminar will continue to be \nheld in connection with the sessions of the International Law Commission and that an \nincreasing number of participants representing the principal legal systems of the \nworld and from different countries in the various regions, including in particular those \nfrom developing countries, will be given the opportunity to attend the Seminar, as \nwell as delegates to the Sixth Committee, and appeals to States to continue to make \nurgently needed voluntary contributions to the United Nations trust fund for the \nInternational Law Seminar;  \n \n44. Requests the Secretary-General to continue to provide the International \nLaw Seminar with adequate services, including interpretation, as required, and \nencourages him to continue to consider ways to improve the structure and content of \nthe Seminar; \n \n45. Underlines the importance of the records and topical summary of the \ndebate in the Sixth Committee for the deliberations of the International Law \nCommission, and in this regard requests the Secretary-General to forward to the \nCommission, for its attention, the records of the debate on the report of the \nCommission, together with such written statements as delegations may circulate in \nconjunction with their oral statements, and to prepare and distribute a topical \nsummary of the debate, following established practice; \n \n46. Requests the Secretariat to circulate to States, as soon as possible after the \nconclusion of the session of the International Law Commission, chapter II of its report \ncontaining a summary of the work of that session, chapter III containing the specific \nissues on which the views of Governments would be of particular interest to the \nCommission and any draft provisions adopted on either first or second reading by the \nCommission; \n \n47. Also requests the Secretariat to make the complete report of the \nInternational Law Commission available as soon as possible after the conclusion of \nthe session of the Commission for the consideration of Member States with due \nanticipation and no later than the prescribed time limit for reports in the General \nAssembly; \n \n48. Encourages the International Law Commission to continue to consider \nways in which specific issues on which the views of Governments would be of \nparticular interest to the Commission could be framed so as to help Governments to \nhave a better appreciation of the issues on which responses are required; \n \n49. Recommends that the debate on the report of the International Law \nCommission at the eighty-first session of the General Assembly commence on \n26 October 2026. \n \n64th plenary meeting \n15 December 2025 \n \n",
  "paragraphs": {
    "1": "Takes note of the report of the International Law Commission on the work of its seventy-sixth session;",
    "2": "Expresses its appreciation to the International Law Commission for the work accomplished at its seventy-sixth session;",
    "3": "Welcomes the completion of the work of the International Law Commission and takes note of its adoption of the final report of the Study Group on the topic \u201cSea-level rise in relation to international law\u201d, contained in annex I to the report of the Commission on the work of its seventy-sixth session;",
    "4": "Recognizes the valuable contribution of this work to enhancing the understanding and clarification of issues of international law arising in connection with sea-level rise, and invites States to reflect on it in relation to the ongoing work of the General Assembly in 2026 and, in this regard, and without setting a precedent, to express further views on the legal aspects of this topic during the eighty-first session of the Assembly, during the consideration of the report of the Commission on the work of its seventy-seventh session;",
    "5": "Takes note that the International Court of Justice engaged with the final report of the Study Group in its advisory opinion of 23 July 2025;",
    "6": "Recommends that the International Law Commission continue its work on the topics in its current programme of work, taking into account the comments and observations of Governments, whether submitted in writing or expressed orally in Report of the International Law Commission on the work of its seventy-sixth session A/RES/80/164 3/7 25-20858 debates in the Sixth Committee, and further recognizes the important role of comments and observations from Governments in the work of the Commission;",
    "7": "Encourages the International Law Commission to include in its commentaries, where relevant and practicable, indications of the extent to which the Commission views draft provisions as representing the codification or progressive development of international law;",
    "8": "Draws the attention of Governments to the importance for the International Law Commission of having their views on the various aspects of the topics on the agenda of the Commission, in particular on all the specific issues identified in chapter III of its report, including: (a) Settlement of disputes to which international organizations are parties; (b) Non-legally binding international agreements; (c) Prevention and repression of piracy and armed robbery at sea; 3",
    "9": "Takes note of the decision of the International Law Commission to include the topics \u201cCompensation for the damage caused by internationally wrongful acts\u201d and \u201cDue diligence in international law\u201d in its programme of work, 4 and encourages the Commission to continue the examination of the topics that are in its long-term programme of work;5",
    "10": "Encourages the International Law Commission to take particular account of the capacity and views of Member States, as well as of the workload of the Commission, when including topics in its current programme of work;",
    "11": "Takes note of paragraphs 445 to 449 of the report of the International Law Commission, and notes, in particular, the inclusion of the topics \u201cThe principle of non\u2011intervention in international law\u201d, \u201cIdentification and legal consequences of obligations erga omnes in international law\u201d and \u201cLegal aspects of accountability for crimes committed against United Nations personnel serving in peacekeeping operations\u201d in the long-term programme of work of the Commission,6 and in this regard calls upon the Commission to take into consideration the comments, concerns and observations expressed by Governments during the debate in the Sixth Committee;",
    "12": "Also takes note of paragraph 464 of the report of the International Law Commission, and requests the Secretary-General to continue his efforts to identify concrete options for support for the work of special rapporteurs, additional to those provided under General Assembly resolution 56/272 of 27 March 2002; _______________ 3 Official Records of the General Assembly, Eightieth Session, Supplement No. 10 (A/80/10), paras. 27\u201329. 4 Ibid., para. 437. 5 The following topics are currently in the long-term programme of work of the International Law Commission: \u201cOwnership and protection of wrecks beyond the limits of national maritime jurisdiction\u201d, \u201cJurisdictional immunity of international organizations\u201d, \u201cProtection of personal data in transborder flow of information\u201d, \u201cExtraterritorial jurisdiction\u201d, \u201cThe fair and equitable treatment standard in international investment law\u201d, \u201cEvidence before international courts and tribunals\u201d, \u201cUniversal criminal jurisdiction\u201d, \u201cReparation to individuals for gross violations of international human rights law and serious violations of international humanitarian law\u201d, \u201cThe principle of non-intervention in international law\u201d, \u201cIdentification and legal consequences of obligations erga omnes in international law\u201d and \u201cLegal aspects of accountability for crimes committed against United Nations personnel serving in peacekeeping operations\u201d. 6 Official Records of the General Assembly, Eightieth Session, Supplement No. 10 (A/80/10), para. 446. A/RES/80/164 Report of the International Law Commission on the work of its seventy-sixth session 25-20858 4/7",
    "13": "Welcomes the efforts of the International Law Commission to improve its methods of work, and encourages the Commission to continue this practice;",
    "14": "Recalls that the persons to be elected to the International Law Commission should individually possess the qualifications required and that in the Commission as a whole representation of the main forms of civilization and of the principal legal systems of the world should be assured, as well as invites Member States to bear in mind General Assembly resolution 77/335 of 1 September 2023, concerning working methods of the Assembly and its subsidiary organs, when nominating candidates for the Commission;",
    "15": "Invites the International Law Commission to continue to take measures to enhance its efficiency and productivity and to consider making proposals to Member States to that end;",
    "16": "Recalls the importance of an in-depth analysis of State practice and the consideration of the diversity of legal systems of Member States to the work of the International Law Commission;",
    "17": "Takes note of paragraph 471 of the report of the International Law Commission, recalls the paramount importance of multilingualism as set forth in General Assembly resolution 78/330 of 6 September 2024 on multilingualism, underlines the importance of having the documents of the Commission published in due time in the six official languages of the United Nations while ensuring their accuracy in all official languages, and to this end requests special rapporteurs to submit their reports within the time limits specified by the Secretariat, and the Secretariat to give due consideration to the quality of the translation of the documents of the Commission in the six official languages;",
    "18": "Encourages the International Law Commission to continue to take cost- saving measures at its future sessions, without prejudice to the efficiency and effectiveness of its work;",
    "19": "Recalls that the seat of the International Law Commission is at the United Nations Office at Geneva;",
    "20": "Takes note of paragraphs 440 to 444 of the report of the International Law Commission describing the reduction of its annual session from the originally planned 12-week session that was decided in General Assembly resolution 79/121 to a single 5-week period (28 April to 30 May 2025) due to the serious liquidity crisis, which in the view of the Commission raised serious concerns about establishing a precedent, and emphasizes that no precedent has been established regarding the reduction of the session;",
    "21": "Also takes note of paragraphs 487 to 489 of the report of the International Law Commission, decides that the seventy-seventh session of the Commission shall be held from 20 April to 29 May 2026 or from 27 April to 5 June 2026 and from 29 June to 7 August 2026, at United Nations Headquarters in New York or at the United Nations Office at Geneva, with due consideration given to facilitating the participation of Member States and to the most cost-effective location, and stresses the importance of having a 12-week session in two parts;",
    "22": "Decides, without prejudice to the budgetary prerogatives of the Fifth Committee and to the authority of the Secretary-General, that no exceptional measures affecting the duration of the seventy-seventh session of the International Law Commission shall be taken by the Secretariat without consultation with the Bureau of the Sixth Committee, which shall inform the Sixth Committee; Report of the International Law Commission on the work of its seventy-sixth session A/RES/80/164 5/7 25-20858",
    "23": "Stresses the desirability of further enhancing the dialogue between the International Law Commission, in particular the special rapporteurs, and the Sixth Committee, and in this context encourages, inter alia, the continued practice of informal consultations in the form of discussions between the members of the Sixth Committee and the members of the Commission throughout the year;",
    "24": "Encourages delegations, during the debate on the report of the International Law Commission, to continue to adhere as far as possible to the structured work programme agreed to by the Sixth Committee and to consider presenting concise and focused statements;",
    "25": "Encourages Member States to consider being represented at the level of legal adviser during the first week in which the report of the International Law Commission is discussed in the Sixth Committee (International Law Week) to enable high-level discussions on issues of international law;",
    "26": "Underlines in this regard the necessity to allow sufficient time for the consideration of the report of the International Law Commission in the Sixth Committee;",
    "27": "Requests the International Law Commission to continue to pay special attention to indicating in its annual report, for each topic, any specific issues on which expressions of views by Governments, either in the Sixth Committee or in written form, would be of particular interest in providing effective guidance for the Commission in its further work;",
    "28": "Recognizes the significant value of the commentaries of the International Law Commission for the users of its work, and emphasizes the importance of feedback from States;",
    "29": "Takes note of paragraphs 490 to 493 of the report of the International Law Commission with regard to cooperation and interaction with other bodies, notes with regret the limited exchange of views with other relevant bodies in 2025, and encourages the Commission, in a balanced manner, to continue to strengthen cooperation between the Commission and other bodies concerned with international law, in accordance with articles 25 and 26 of its statute, having in mind the usefulness of such cooperation and recognizing the importance of continued dialogue and consultation among them to promote international law;",
    "30": "Notes that consulting with national organizations and individual experts concerned with international law may assist Governments in considering whether to make comments and observations on drafts submitted by the International Law Commission and in formulating their comments and observations;",
    "31": "Reaffirms its previous decisions concerning the indispensable role of the Codification Division of the Office of Legal Affairs of the Secretariat in providing assistance to the International Law Commission, including in the preparation of memorandums and studies on topics on the agenda of the Commission;",
    "32": "Also reaffirms its previous decisions concerning the documentation and summary records of the International Law Commission;7",
    "33": "Takes note of paragraph 469 of the report of the International Law Commission, stresses the need to expedite the preparation of the summary records of the International Law Commission, welcomes the continuation of the measures taken _______________ 7 See resolutions 32/151, para. 10, and 37/111, para. 5, and all subsequent resolutions on the annual reports of the International Law Commission to the General Assembly; see also Yearbook of the International Law Commission 1982, vol. II (Part Two), paras. 267\u2013269 and 271, as well as all subsequent annual reports of the International Law Commission. A/RES/80/164 Report of the International Law Commission on the work of its seventy-sixth session 25-20858 6/7 to streamline the processing of summary records during the sixty-fifth session of the Commission,8 which have led to a more rational use of resources, and expresses its satisfaction that the summary records of the Commission, constituting travaux pr\u00e9paratoires in the progressive development and codification of international law, will not be subject to arbitrary length restrictions;",
    "34": "Encourages the continuation of the practice of the Secretariat to include on the website of the International Law Commission the provisional summary records in English and French relating to the work of the Commission;",
    "35": "Welcomes the efforts of the Secretariat in seeking to ensure the timely and efficient processing of the documents of the International Law Commission and the institutionalization of the measures taken during the sixty-eighth session of the Commission to streamline the editing of those documents;",
    "36": "Takes note of paragraph 468 of the report of the International Law Commission, underlines the importance of the publications of the Codification Division to the work of the Commission, and reiterates its request that the Secretary- General continue to publish The Work of the International Law Commission in all six official languages at the beginning of each quinquennium, the Reports of International Arbitral Awards in English or French and the Summaries of the Judgments, Advisory Opinions and Orders of the International Court of Justice in all six official languages every five years;",
    "37": "Also takes note of paragraphs 472 to 475 of the report of the International Law Commission, expresses its appreciation to the United Nations Library at Geneva for the dedicated assistance accorded to the Commission, and notes the Commission\u2019s concern that current budget constraints could limit the capacity of the Library to offer specialized research assistance and to acquire additional publications essential for the work of the Commission;",
    "38": "Further takes note of paragraph 476 of the report of the International Law Commission, stresses the unique value of the Yearbook of the International Law Commission, and requests the Secretary-General to ensure its timely publication in all official languages;",
    "39": "Expresses its appreciation to Governments that have made voluntary contributions to the trust fund on the backlog relating to the Yearbook of the International Law Commission, and encourages further contributions to the trust fund;",
    "40": "Takes note of paragraph 477 of the report of the International Law Commission, expresses its satisfaction with the remarkable progress achieved in the past few years in reducing the backlog of the Yearbook of the International Law Commission in all six languages, welcomes the efforts made by the Division of Conference Management of the United Nations Office at Geneva, especially its Editing Section, in effectively implementing relevant resolutions of the General Assembly calling for the reduction of the backlog, encourages that Division to provide continuous necessary support to the Editing Section in advancing the Yearbook of the International Law Commission, and requests that updates on progress made in this respect be provided to the Commission on a regular basis;",
    "41": "Welcomes the continuous efforts of the Codification Division to maintain and improve the website relating to the work of the International Law Commission;",
    "42": "Takes note of paragraph 478 of the report of the International Law Commission and expresses its appreciation for contributions made to date to the trust _______________ 8 Official Records of the General Assembly, Sixty-eighth Session, Supplement No. 10 (A/68/10), para. 183. Report of the International Law Commission on the work of its seventy-sixth session A/RES/80/164 7/7 25-20858 fund to receive voluntary contributions for assistance to Special Rapporteurs of the International Law Commission or Chairs of its Study Groups and matters ancillary thereto, and invites further contributions to the trust fund, in accordance with the terms of the trust fund, including the need for the financial contributions not to be earmarked for any specific activity of the International Law Commission, its Special Rapporteurs or Chairs of its Study Groups;",
    "43": "Expresses the hope that the International Law Seminar will continue to be held in connection with the sessions of the International Law Commission and that an increasing number of participants representing the principal legal systems of the world and from different countries in the various regions, including in particular those from developing countries, will be given the opportunity to attend the Seminar, as well as delegates to the Sixth Committee, and appeals to States to continue to make urgently needed voluntary contributions to the United Nations trust fund for the International Law Seminar;",
    "44": "Requests the Secretary-General to continue to provide the International Law Seminar with adequate services, including interpretation, as required, and encourages him to continue to consider ways to improve the structure and content of the Seminar;",
    "45": "Underlines the importance of the records and topical summary of the debate in the Sixth Committee for the deliberations of the International Law Commission, and in this regard requests the Secretary-General to forward to the Commission, for its attention, the records of the debate on the report of the Commission, together with such written statements as delegations may circulate in conjunction with their oral statements, and to prepare and distribute a topical summary of the debate, following established practice;",
    "46": "Requests the Secretariat to circulate to States, as soon as possible after the conclusion of the session of the International Law Commission, chapter II of its report containing a summary of the work of that session, chapter III containing the specific issues on which the views of Governments would be of particular interest to the Commission and any draft provisions adopted on either first or second reading by the Commission;",
    "47": "Also requests the Secretariat to make the complete report of the International Law Commission available as soon as possible after the conclusion of the session of the Commission for the consideration of Member States with due anticipation and no later than the prescribed time limit for reports in the General Assembly;",
    "48": "Encourages the International Law Commission to continue to consider ways in which specific issues on which the views of Governments would be of particular interest to the Commission could be framed so as to help Governments to have a better appreciation of the issues on which responses are required;",
    "49": "Recommends that the debate on the report of the International Law Commission at the eighty-first session of the General Assembly commence on 26 October 2026. 64th plenary meeting 15 December 2025"
  },
  "agenda_items": [
    "Item 80"
  ],
  "symbol_references": []
}