{
  "symbol": "A/RES/74/230",
  "filename": "A_RES_74_230.pdf",
  "title": "74/230. Culture and sustainable development",
  "text": "United Nations \nA/RES/74/230\n \n \nGeneral Assembly \nDistr.: General \n16 January 2020 \n \n19-22502 (E)    200120 \n*1922502* \n \n \nSeventy-fourth session \nAgenda item 20 (c) \nGlobalization and interdependence: culture and \nsustainable development \n \n \n \n \n Resolution adopted by the General Assembly \non 19 December 2019 \n \n \n \n \n[on the report of the Second Committee (A/74/382/Add.3)] \n \n \n 74/230. Culture and sustainable development \n \n \n \nThe General Assembly, \n \nGuided by the purposes and principles enshrined in the Charter of the United \nNations, \n \nRecalling its resolutions 41/187 of 8 December 1986, 46/158 of 19 December \n1991, 51/179 of 16 December 1996, 52/197 of 18 December 1997, 53/184 of \n15 December 1998, 55/192 of 20 December 2000, 57/249 of 20 December 2002, \n65/166 of 20 December 2010 and 66/208 of 22 December 2011 concerning culture \nand development, 66/288 of 27 July 2012, entitled \u201cThe future we want\u201d, and 68/223 \nof 20 December 2013, 69/230 of 19 December 2014, 70/214 of 22 December 2015 \nand 72/229 of 20 December 2017 on culture and sustainable development, \n \nReaffirming its resolution 70/1 of 25 September 2015, entitled \u201cTransforming \nour world: the 2030 Agenda for Sustainable Development\u201d, in which it adopted a \ncomprehensive, far-reaching and people-centred set of universal and transformative \nSustainable Development Goals and targets, its commitment to working tirelessly for \nthe full implementation of the Agenda by 2030, its recognition that eradicating \npoverty in all its forms and dimensions, including extreme poverty, is the greatest \nglobal challenge and an indispensable requirement for sustainable development, its \ncommitment to achieving sustainable development in its three dimensions \u2013 \neconomic, social and environmental \u2013 in a balanced and integrated manner, and to \nbuilding upon the achievements of the Millennium Development Goals and seeking \nto address their unfinished business, \n \nReaffirming also the Paris Agreement 1  and its early entry into force, \nencouraging all its parties to fully implement the Agreement, and parties to the United \n__________________ \n \n1  Adopted under the UNFCCC in FCCC/CP/2015/10/Add.1, decision 1/CP.21. \n\nA/RES/74/230 \nCulture and sustainable development\n \n19-22502\n2/9 \n \nNations Framework Convention on Climate Change 2 that have not yet done so to \ndeposit their instruments of ratification, acceptance, approval or accession, where \nappropriate, as soon as possible, \n \nWelcoming the holding of the 2019 Climate Action Summit convened by the \nSecretary-General on 23 September, taking note of the multi-partner initiatives and \ncommitments presented during the Summit, and taking note also of the Youth Climate \nSummit, held on 21 September, \n \nReaffirming its resolution 69/313 of 27 July 2015 on the Addis Ababa Action \nAgenda of the Third International Conference on Financing for Development, which \nis an integral part of the 2030 Agenda for Sustainable Development, supports and \ncomplements it, helps to contextualize its means of implementation targets with \nconcrete policies and actions, and reaffirms the strong political commitment to \naddress the challenge of financing and creating an enabling environment at all levels \nfor sustainable development in the spirit of global partnership and solidarity, \n \nWelcoming the New Urban Agenda, adopted at the United Nations Conference \non Housing and Sustainable Urban Development (Habitat III), held in Quito, Ecuador, \nfrom 17 to 20 October 2016,3 calling for its full, effective and timely implementation \nat all levels, and reaffirming that culture and cultural diversity are sources of \nenrichment for humankind and provide an important contribution to the sustainable \ndevelopment of cities, human settlements and citizens, empowering them to play an \nactive and unique role in development initiatives, \n \nRecalling that, in the 2030 Agenda for Sustainable Development, inter alia, the \nnatural and cultural diversity of the world is acknowledged and it is recognized that \ncultures and civilizations can contribute to, and are crucial enablers of, sustainable \ndevelopment, \n \nRecalling also the 2005 Convention on the Protection and Promotion of the \nDiversity of Cultural Expressions,4 as well as other international conventions of the \nUnited Nations Educational, Scientific and Cultural Organization that acknowledge \ncultural diversity and economic and social development,5  \n \nRecognizing that culture is an essential component of human development, that \nit represents a source of identity, innovation and creativity for the individual and the \ncommunity and that it is an important factor in social inclusion and poverty \neradication, providing for sustainable economic growth and ownership of \ndevelopment processes, \n \nRecognizing also the growing importance of the digital environment in the \ndiffusion of cultural and creative content, \n \nRecognizing further the importance of respect and understanding for cultural \ndiversity throughout the world and of working together and not against each other \n__________________ \n \n2  United Nations, Treaty Series, vol. 1771, No. 30822. \n \n3  Resolution 71/256, annex. \n \n4  United Nations, Treaty Series, vol. 2440, No. 43977. \n \n5  Convention for the Protection of Cultural Property in the Event of Armed Conflict, of 1954 \n(United Nations, Treaty Series, vol. 249, No. 3511); Convention on the Means of Prohibiting and \nPreventing the Illicit Import, Export and Transfer of Ownership of Cultural Property, of 1970 \n(United Nations, Treaty Series, vol. 823, No. 11806); Convention concerning the Protection of \nthe World Cultural and Natural Heritage, of 1972 (United Nations, Treaty Series, vol. 1037, \nNo. 15511); Convention on the Protection of the Underwater Cultural Heritage, of 2001 (United \nNations, Treaty Series, vol. 2562, No. 45694); and Convention for the Safeguarding of the \nIntangible Cultural Heritage, of 2003 (United Nations, Treaty Series, vol. 2368, No. 42671). \n\nCulture and sustainable development \nA/RES/74/230\n \n3/9\n19-22502 \n \nand of fostering intercultural understanding and dialogue, mutual listening and \nlearning and an ethic of global citizenship and solidarity, \n \nRecalling its resolution 73/130 of 13 December 2018 on the return or restitution \nof cultural property to the countries of origin, aware of the importance attached to the \nreturn of cultural property that is of fundamental spiritual, historical and cultural \nvalue, and expressing deep concern about the continuing illicit trafficking in cultural \nproperty and its damage to the cultural heritage of nations, \n \nRecalling also the adoption of the United Nations Declaration on the Rights of \nIndigenous Peoples, on 13 September 2007,6 and its call for States to enable access \nto and/or the repatriation of ceremonial objects and human remains in their possession \nthrough fair, transparent and effective mechanisms developed in conjunction with \nindigenous peoples concerned, \n \nRecalling further the principles of the Universal Declaration on Cultural \nDiversity of the United Nations Educational, Scientific and Cultural Organization, 7 \nand acknowledging that cultural diversity is a source of enrichment for humankind \nand an important contribution to the sustainable development of local communities, \npeoples and nations, supporting their ability to play an active and unique role in \ndevelopment initiatives, \n \nRecognizing the importance of multilingualism as a means of promoting, \nprotecting and preserving the diversity of languages and cultures globally and that \ngenuine multilingualism promotes unity in diversity and international understanding, \nand recognizing also the importance for the peoples of the world to communicate in \ntheir own language, \n \nRecalling its resolution 71/178 of 19 December 2016, in which it proclaimed \nthe year beginning on 1 January 2019 the International Year of Indigenous Languages, \nto draw attention to the critical loss of indigenous languages and the urgent need to \npreserve, revitalize and promote indigenous languages, \n \nNoting the fourth international conference on the theme \u201cPreservation of world \nlanguages and development of linguistic diversity in cyberspace: context, policy, \npractice\u201d, held under the auspices of the United Nations Educational, Scientific and \nCultural Organization in Yakutsk, Russian Federation, from 1 to 5 July 2019, \n \nRecalling the concerns expressed in the Beijing Declaration and Platform for \nAction8 on the underrepresentation of women in decision-making positions in the area \nof culture, which has prevented women from having a significant impact in the area \nof culture and development, \n \nRecalling also the importance of the promotion of national cultures, artistic \ncreation in all its forms and international and regional cultural cooperation, and \nreaffirming in this regard the relevance of strengthening national efforts and regional \nand international cooperation mechanisms for cultural action and artistic creation and \nrecognizing respect for cultural pluralism, as defined by the Universal Declaration on \nCultural Diversity, as policies for the inclusion and participation of all citizens that \nguarantee social cohesion and the vitality of civil society and peace, enhance cultural \ndevelopment and contribute to sustainable development, \n__________________ \n \n6  Resolution 61/295, annex. \n \n7  United Nations Educational, Scientific and Cultural Organization, Records of the General \nConference, Thirty-first Session, Paris, 15 October\u20133 November 2001, vol. 1 and corrigendum, \nResolutions, sect. V, resolution 25, annex I. \n \n8  Report of the Fourth World Conference on Women, Beijing, 4\u201315 September 1995 (United \nNations publication, Sales No. E.96.IV.13), chap. I, resolution 1, annexes I and II. \n\nA/RES/74/230 \nCulture and sustainable development\n \n19-22502\n4/9 \n \n \nRecognizing the linkages between cultural and biological diversity and the \npositive contribution of local and indigenous traditional knowledge in addressing \nenvironmental challenges in a sustainable manner, \n \nRecalling the United Nations strategic plan for forests 2017\u20132030, 9  and \nacknowledging that, in many regions, forests have important cultural and spiritual \nvalue, \n \nTaking note of the declaration adopted in Florence, Italy, on 4 October 2014, at \nthe third United Nations Educational, Scientific and Cultural Organization World \nForum on Culture and Cultural Industries, the Hangzhou outcomes, adopted at the \nconference on the theme \u201cCulture for sustainable cities\u201d, held in Hangzhou, China, \nfrom 10 to 12 December 2015, the Bali Declaration, adopted at the second World \nCulture Forum, held in Bali, Indonesia, from 10 to 14 October 2016, the global report \non culture for sustainable urban development of the United Nations Educational, \nScientific and Cultural Organization, entitled Culture: Urban Future, of October \n2016, the new strategy for the integration of culture and creativity in the \nimplementation of the 2030 Agenda for Sustainable Development, adopted at the \neleventh annual meeting of the Creative Cities Network, held in Enghien-les-Bains, \nFrance, from 30 June to 2 July 2017, the twelfth annual meeting of the Creative Cities \nNetwork, held in Krakow and Katowice, Poland, from 12 to 15 June 2018, and the \nthirteenth annual meeting of the Creative Cities Network, held in Fabriano, Italy, from \n10 to 15 June 2019, as well as its discussions on the role of culture across development \nareas, including education, entrepreneurship, innovation, inclusiveness and \nenvironmental sustainability, \n \nRecognizing the role of museums as crucial partners for protecting and \npromoting culture, from safeguarding world heritage to countering illicit trafficking \nin cultural property, in particular through their preservation, research, communication \nand education efforts, \n \nRecognizing also that culture in diplomacy remains an important component of \nstrengthening international relations, \n \nReiterating the pledge that no one will be left behind, reaffirming the \nrecognition that the dignity of the human person is fundamental, and the wish to see \nthe Goals and targets met for all nations and peoples and for all segments of society, \nand recommitting to endeavour to reach the furthest behind first, \n \n1. \nTakes note of the note by the Secretary-General transmitting the report of \nthe United Nations Educational, Scientific and Cultural Organization; 10  \n \n2. \nReaffirms the role of culture as an enabler of sustainable development that \nprovides people and communities with a strong sense of identity and social cohesion \nand contributes to more effective and sustainable development policies and measures \nat all levels, and stresses in this regard that policies responsive to cultural contexts \ncan yield better, sustainable, inclusive and equitable development outcomes; \n \n3. \nRecognizes the power of culture as a driver of sustainable development, \nwhich contributes to fostering social inclusion and developing a strong and viable \neconomic sector by generating income, creating decent jobs and addressing both the \neconomic and social dimensions of poverty through cultural heritage, including its \nprotection and preservation, and cultural and creative sectors, while providing \ninnovative and effective solutions to cross-cutting issues, such as education, health, \ngender equality and women\u2019s empowerment, technology and the environment; \n__________________ \n \n9  See resolution 71/285. \n \n10  A/74/286. \n\nCulture and sustainable development \nA/RES/74/230\n \n5/9\n19-22502 \n \n \n4. \nEmphasizes the important contribution of culture to the three dimensions \nof sustainable development and to the achievement of national development \nobjectives, the 2030 Agenda for Sustainable Development 11  and its Sustainable \nDevelopment Goals, as well as other internationally agreed development goals, and \nin this regard acknowledges: \n \n(a) \nThat culture contributes to inclusive economic development, as cultural \nheritage preservation, cultural and creative sectors, sustainable cultural tourism and \ncultural infrastructure, including urban regeneration, can be sources of income \ngeneration, job creation and decent work for all, including at the community level, \nthus improving living conditions and fostering community-based economic growth, \nand contribute to the empowerment of individuals; \n \n(b) \nThat culture contributes to inclusive social development for all, including \nlocal communities and indigenous peoples, with respect for cultural diversity, \nsafeguarding of the cultural and natural heritage, fostering of cultural institutions and \nstrengthening of cultural and creative sectors, in urban and rural contexts; \n \n(c) \nThat culture contributes to environmental sustainability, since the \nprotection of cultural and biological diversity and natural heritage is important for \nsustainable development, and that support for traditional systems of environmental \nprotection, and resource management, can contribute to the increased sustainability \nof fragile ecosystems and the conservation, preservation and sustainable use of \nbiodiversity and to avoiding land degradation and addressing climate change; \n \n5. \nReaffirms that sustainable development cannot be realized without peace \nand security and that peace and security will be at risk without sustainable \ndevelopment, and acknowledges that culture can contribute to sustainable \ndevelopment by constituting a valuable resource for enabling communities to \nparticipate fully in social and cultural life, facilitating inclusive governance and \ndialogue at the national, regional and international levels and contributing to conflict \nprevention and resolution, as well as to reconciliation, recovery and resilience; \n \n6. \nReaffirms its commitment to embracing diversity in cities and human \nsettlements, \nto \nstrengthening \nsocial \ncohesion, \nintercultural \ndialogue \nand \nunderstanding, \ntolerance, \nmutual \nrespect, \ngender \nequality \nand \nwomen\u2019s \nempowerment, innovation, entrepreneurship, inclusion, identity and safety, and the \ndignity of all people, including people in vulnerable situations, as well as to fostering \nliveability and a vibrant urban economy and to taking steps to ensure that local \ninstitutions promote pluralism and peaceful coexistence within increasingly \nheterogeneous and multicultural societies; \n \n7. \nRecognizes that culture should be taken into account in the promotion and \nimplementation of new sustainable consumption and production patterns that \ncontribute to the responsible use of resources and address the adverse impacts of \nclimate change; \n \n8. \nAcknowledges that quality education, non-formal education and lifelong \nlearning are enriched by culture, transmitting shared values, knowledge and skills, \nand also acknowledges that arts education can make a direct contribution to the \nconstructive transformation of educational systems to meet the needs of learners in a \nrapidly changing world and the need for a creative and adaptive workforce; 12  \n__________________ \n \n11  Resolution 70/1. \n \n12  As stated in the preamble to the outcome document of the second World Conference on Arts \nEducation, held in Seoul from 25 to 28 May 2010, namely, the Seoul Agenda: Goals for the \nDevelopment of Arts Education. \n\nA/RES/74/230 \nCulture and sustainable development\n \n19-22502\n6/9 \n \n \n9. \nCalls for the promotion of education for the protection of natural spaces \nand places of memory whose existence is necessary for expressing the intangible \ncultural heritage; \n \n10. Recalls the inclusion in the 2030 Agenda for Sustainable Development of \nseveral targets reflecting the contribution of culture to sustainable development, also \nrecalls that the Sustainable Development Goals and targets are integrated and \nindivisible and balance the three dimensions of sustainable development, and in this \nregard looks forward to their achievement, building on the positive results and impact \nof programmes utilizing culture as an enabler of sustainable development; \n \n11. \nWelcomes the efforts and initiatives of the United Nations Educational, \nScientific and Cultural Organization, as the mandated United Nations agency on \nculture, to strengthen and measure the transformational impact of culture on the \nrealization of the 2030 Agenda for Sustainable Development; \n \n12. Decides to give consideration, as appropriate, to the contribution of culture \nto sustainable development in the follow-up and review framework of the 2030 \nAgenda for Sustainable Development; \n \n13. Takes note with appreciation of the high-level event on culture and \nsustainable development in May 2019, convened by the President of the General \nAssembly on the occasion of the World Day for Cultural Diversity for Dialogue and \nDevelopment, pursuant to resolution 72/229; \n \n14. Welcomes the convening of the Forum of Ministers for Culture by the \nUnited Nations Educational, Scientific and Cultural Organization on 19 November \n2019, on the theme \u201cCulture and public policy for sustainable development\u201d, the first \nforum of its kind to be held in 21 years, with a focus on the contribution of culture to \nachieving the Sustainable Development Goals and its linkages to education, social \ntransformation, employment and the environment; \n \n15. Looks forward to the multi-partner international alliance on nature and \nculture to be launched in 2020 at the fifteenth meeting of the Conference of the Parties \nto the Convention on Biological Diversity, which will aim to strengthen international \ncooperation on the linkages between biological and cultural diversity to achieve the \n2050 Vision for Biodiversity of humanity living in harmony with nature; \n \n16. Invites all countries, as well as intergovernmental bodies and organizations \nof the United Nations system, within their respective mandates and resources, \nrelevant non-governmental organizations and all other relevant stakeholders: \n \n(a) \nTo raise public awareness of the importance of cultural diversity for \nsustainable development, promoting its positive value through education and media \ntools; \n \n(b) \nTo ensure a more visible and effective integration and mainstreaming of \nculture into economic, social and environmental development policies and strategies \nat all levels; \n \n(c) \nTo ensure that women and men can equally access, participate in and \ncontribute to cultural life and decision-making, and to further commit themselves to \nthe development of cultural policies and programmes with a gender perspective at the \nlocal, national and international levels in order to achieve gender equality and the \nempowerment of all women and girls; \n \n(d) \nTo undertake relevant intercultural dialogue and cooperation and cultural \ndiversity programmes for youth to engage in a multicultural society, participate in the \n\nCulture and sustainable development \nA/RES/74/230\n \n7/9\n19-22502 \n \nachievement of the 2030 Agenda for Sustainable Development, achieve better \neducational results and acquire a broader and more diverse range of skills and \ncompetences; \n \n(e) \nTo promote capacity-building, where appropriate, at all levels for the \ndevelopment of dynamic cultural and creative sectors, in particular by encouraging \ncreativity, innovation and entrepreneurship, supporting the development of cultural \ninstitutions and cultural and creative sectors, providing technical and vocational \ntraining for culture professionals and increasing employment opportunities in the \ncultural and creative sectors for sustained, inclusive and equitable economic growth \nand development; \n \n(f) \nTo actively support the emergence of local markets for cultural goods and \nservices and to facilitate the effective and licit access of such goods and services to \ninternational markets, taking into account the expanding range of cultural production \nand consumption and, for States parties thereto, the provisions of the Convention on \nthe Protection and Promotion of the Diversity of Cultural Expressions; 4 \n \n(g) \nTo promote the diversity of and the access to cultural expressions in the \ndigital environment; \n \n(h) \nTo preserve and maintain local and indigenous traditional knowledge and \ncommunity practices of environmental management, which are valuable examples of \nculture as a vehicle for sustainable development, and to foster synergies between \nmodern science and technology and local and indigenous knowledge, practices and \ninnovation; \n \n(i) \nTo accelerate efforts to protect cultural and natural heritage from extreme \nweather events, sea level rise, desertification and other threats exacerbated by climate \nchange, which jeopardize its integrity and preservation for present and future \ngenerations; \n \n(j) \nTo promote global awareness of the linkages between cultural and \nbiological diversity, including through the protection and preservation and \nencouragement of the customary use of biological resources, in accordance with \ntraditional cultural practices, as an important element of a comprehensive approach \nto sustainable development; \n \n(k) \nTo support national legal frameworks and policies for the protection and \npreservation of cultural heritage and cultural property, encouraging initiatives to fight \nagainst illicit trafficking in cultural property, and for the return of cultural property, \nin accordance with national legislation and applicable international legal frameworks; \n \n(l) \nTo support national legal frameworks and policies to enable intellectual \nproperty rights to sustain those involved in cultural creativity, including by promoting \ninternational cooperation to prevent the misappropriation of creative works; \n \n(m) To promote access to and/or the repatriation of ceremonial objects and \nhuman remains in their possession through fair, transparent and effective mechanisms \ndeveloped in conjunction with indigenous peoples concerned; \n \n(n) \nTo note that, in achieving these objectives, innovative mechanisms of \nfinancing, public and private, can make a positive contribution in assisting developing \ncountries in mobilizing additional resources for development on a stable, predictable \nand voluntary basis, and to reiterate that such voluntary mechanisms should be \neffective, should aim to mobilize resources that are stable and predictable, should \nsupplement and not be a substitute for traditional sources of financing, should be \ndisbursed in accordance with the priorities of developing countries and should not \nunduly burden such countries; \n\nA/RES/74/230 \nCulture and sustainable development\n \n19-22502\n8/9 \n \n \n(o) \nTo mobilize culture as a vehicle to foster tolerance, mutual understanding, \npeace and reconciliation in the context of conflict-prevention, conflict-resolution and \npeacebuilding processes; \n \n17. Expresses deep concern that cultural property, including religious sites, \nshrines and cemeteries, and objects, is increasingly targeted by terrorist attacks and \nvandalism, often resulting in its damage, theft or complete destruction, and condemns \nsuch attacks; \n \n18. Encourages all countries, intergovernmental bodies, organizations of the \nUnited Nations system, as appropriate, within their existing mandates, relevant \nnon-governmental organizations and all other relevant stakeholders to enhance \ninternational cooperation in supporting the efforts of developing countries towards \nthe development and strengthening of cultural and creative sectors, cultural tourism \nand culture-related microenterprises and to assist those countries in developing the \nnecessary infrastructure and skills, as well as in mastering information and \ncommunications technologies and in gaining access to new technologies on mutually \nagreed terms; \n \n19. Encourages initiatives to foster cultural cooperation agreements and \nnetworks at the regional level for knowledge- and information-sharing for sustainable \ndevelopment; \n \n20. Also encourages programmes that facilitate social benefits and economic \nrights for artists and cultural professionals, including opportunities for decent work, \nfair remuneration and equal pay for work of equal value, as well as training in the \nlight of technological advancement and digitalization; \n \n21. Invites the organizations of the United Nations system, in particular the \nUnited Nations Educational, Scientific and Cultural Organization, to continue to \nprovide support, to facilitate financing and to assist countries, upon their request, in \ndeveloping their national capacities to optimize the contribution of culture to \nsustainable development, including through information-sharing, the exchange of \nbest practices, data collection, research and study and the use of appropriate \nevaluation indicators, as well as to implement applicable international cultural \nconventions, taking into account the relevant resolutions of the General Assembly; \n \n22. Invites the United Nations Educational, Scientific and Cultural \nOrganization and other relevant United Nations bodies to continue to assess, in \nconsultation with countries, the contribution of culture to the achievement of \nsustainable development through the compilation of quantitative data, including \nindicators and statistics, with a view to informing development policies and relevant \nreports, where appropriate, and to continue to act as a platform for exchange among \ncountries on the nexus between culture and sustainable development, including \nthrough the Forums of Ministers for Culture; \n \n23. Requests the Secretary-General to ensure that United Nations country \nteams continue to further integrate and mainstream culture into their programming \nexercises, in particular United Nations Sustainable Development Cooperation \nFrameworks, in consultation with relevant national authorities, when assisting \ncountries in the pursuit of their development objectives; \n \n24. Encourages all countries, intergovernmental bodies, organizations of the \nUnited Nations system, relevant non-governmental organizations and all other \nrelevant stakeholders to give due consideration to the contribution of culture to the \nachievement of sustainable development in the formulation of national, regional and \ninternational development policies and international cooperation instruments, and in \nthis regard, building upon the discussion at the previous high-level event on culture \nand sustainable development, invites the President of the General Assembly to host a \n\nCulture and sustainable development \nA/RES/74/230\n \n9/9\n19-22502 \n \none-day high-level event on this subject, within existing resources, during the \nseventy-fifth session of the Assembly, and to invite the United Nations Educational, \nScientific and Cultural Organization to support him or her, within its existing \nmandates; \n \n25. Reaffirms the commitment at the very heart of the 2030 Agenda to leave \nno one behind and commit to taking more tangible steps to support people in \nvulnerable situations and the most vulnerable countries and to reach the furthest \nbehind first; \n \n26. Requests the Secretary-General to submit to the General Assembly at its \nseventy-sixth session a report on the implementation of the present resolution, and \ndecides to include in the provisional agenda of its seventy-sixth session, under the \nitem entitled \u201cGlobalization and interdependence\u201d, the sub-item entitled \u201cCulture and \nsustainable development\u201d. \n \n52nd plenary meeting \n19 December 2019 \n \n",
  "paragraphs": {
    "1": "Takes note of the note by the Secretary-General transmitting the report of the United Nations Educational, Scientific and Cultural Organization; 10",
    "2": "Reaffirms the role of culture as an enabler of sustainable development that provides people and communities with a strong sense of identity and social cohesion and contributes to more effective and sustainable development policies and measures at all levels, and stresses in this regard that policies responsive to cultural contexts can yield better, sustainable, inclusive and equitable development outcomes;",
    "3": "Recognizes the power of culture as a driver of sustainable development, which contributes to fostering social inclusion and developing a strong and viable economic sector by generating income, creating decent jobs and addressing both the economic and social dimensions of poverty through cultural heritage, including its protection and preservation, and cultural and creative sectors, while providing innovative and effective solutions to cross-cutting issues, such as education, health, gender equality and women\u2019s empowerment, technology and the environment; __________________ 9 See resolution 71/285. 10 A/74/286. Culture and sustainable development A/RES/74/230 5/9 19-22502",
    "4": "Emphasizes the important contribution of culture to the three dimensions of sustainable development and to the achievement of national development objectives, the 2030 Agenda for Sustainable Development 11 and its Sustainable Development Goals, as well as other internationally agreed development goals, and in this regard acknowledges: (a) That culture contributes to inclusive economic development, as cultural heritage preservation, cultural and creative sectors, sustainable cultural tourism and cultural infrastructure, including urban regeneration, can be sources of income generation, job creation and decent work for all, including at the community level, thus improving living conditions and fostering community-based economic growth, and contribute to the empowerment of individuals; (b) That culture contributes to inclusive social development for all, including local communities and indigenous peoples, with respect for cultural diversity, safeguarding of the cultural and natural heritage, fostering of cultural institutions and strengthening of cultural and creative sectors, in urban and rural contexts; (c) That culture contributes to environmental sustainability, since the protection of cultural and biological diversity and natural heritage is important for sustainable development, and that support for traditional systems of environmental protection, and resource management, can contribute to the increased sustainability of fragile ecosystems and the conservation, preservation and sustainable use of biodiversity and to avoiding land degradation and addressing climate change;",
    "5": "Reaffirms that sustainable development cannot be realized without peace and security and that peace and security will be at risk without sustainable development, and acknowledges that culture can contribute to sustainable development by constituting a valuable resource for enabling communities to participate fully in social and cultural life, facilitating inclusive governance and dialogue at the national, regional and international levels and contributing to conflict prevention and resolution, as well as to reconciliation, recovery and resilience;",
    "6": "Reaffirms its commitment to embracing diversity in cities and human settlements, to strengthening social cohesion, intercultural dialogue and understanding, tolerance, mutual respect, gender equality and women\u2019s empowerment, innovation, entrepreneurship, inclusion, identity and safety, and the dignity of all people, including people in vulnerable situations, as well as to fostering liveability and a vibrant urban economy and to taking steps to ensure that local institutions promote pluralism and peaceful coexistence within increasingly heterogeneous and multicultural societies;",
    "7": "Recognizes that culture should be taken into account in the promotion and implementation of new sustainable consumption and production patterns that contribute to the responsible use of resources and address the adverse impacts of climate change;",
    "8": "Acknowledges that quality education, non-formal education and lifelong learning are enriched by culture, transmitting shared values, knowledge and skills, and also acknowledges that arts education can make a direct contribution to the constructive transformation of educational systems to meet the needs of learners in a rapidly changing world and the need for a creative and adaptive workforce; 12 __________________ 11 Resolution 70/1. 12 As stated in the preamble to the outcome document of the second World Conference on Arts Education, held in Seoul from 25 to 28 May 2010, namely, the Seoul Agenda: Goals for the Development of Arts Education. A/RES/74/230 Culture and sustainable development 19-22502 6/9",
    "9": "Calls for the promotion of education for the protection of natural spaces and places of memory whose existence is necessary for expressing the intangible cultural heritage;",
    "10": "Recalls the inclusion in the 2030 Agenda for Sustainable Development of several targets reflecting the contribution of culture to sustainable development, also recalls that the Sustainable Development Goals and targets are integrated and indivisible and balance the three dimensions of sustainable development, and in this regard looks forward to their achievement, building on the positive results and impact of programmes utilizing culture as an enabler of sustainable development;",
    "11": "Welcomes the efforts and initiatives of the United Nations Educational, Scientific and Cultural Organization, as the mandated United Nations agency on culture, to strengthen and measure the transformational impact of culture on the realization of the 2030 Agenda for Sustainable Development;",
    "12": "Decides to give consideration, as appropriate, to the contribution of culture to sustainable development in the follow-up and review framework of the 2030 Agenda for Sustainable Development;",
    "13": "Takes note with appreciation of the high-level event on culture and sustainable development in May 2019, convened by the President of the General Assembly on the occasion of the World Day for Cultural Diversity for Dialogue and Development, pursuant to resolution 72/229;",
    "14": "Welcomes the convening of the Forum of Ministers for Culture by the United Nations Educational, Scientific and Cultural Organization on 19 November 2019, on the theme \u201cCulture and public policy for sustainable development\u201d, the first forum of its kind to be held in 21 years, with a focus on the contribution of culture to achieving the Sustainable Development Goals and its linkages to education, social transformation, employment and the environment;",
    "15": "Looks forward to the multi-partner international alliance on nature and culture to be launched in 2020 at the fifteenth meeting of the Conference of the Parties to the Convention on Biological Diversity, which will aim to strengthen international cooperation on the linkages between biological and cultural diversity to achieve the 2050 Vision for Biodiversity of humanity living in harmony with nature;",
    "16": "Invites all countries, as well as intergovernmental bodies and organizations of the United Nations system, within their respective mandates and resources, relevant non-governmental organizations and all other relevant stakeholders: (a) To raise public awareness of the importance of cultural diversity for sustainable development, promoting its positive value through education and media tools; (b) To ensure a more visible and effective integration and mainstreaming of culture into economic, social and environmental development policies and strategies at all levels; (c) To ensure that women and men can equally access, participate in and contribute to cultural life and decision-making, and to further commit themselves to the development of cultural policies and programmes with a gender perspective at the local, national and international levels in order to achieve gender equality and the empowerment of all women and girls; (d) To undertake relevant intercultural dialogue and cooperation and cultural diversity programmes for youth to engage in a multicultural society, participate in the Culture and sustainable development A/RES/74/230 7/9 19-22502 achievement of the 2030 Agenda for Sustainable Development, achieve better educational results and acquire a broader and more diverse range of skills and competences; (e) To promote capacity-building, where appropriate, at all levels for the development of dynamic cultural and creative sectors, in particular by encouraging creativity, innovation and entrepreneurship, supporting the development of cultural institutions and cultural and creative sectors, providing technical and vocational training for culture professionals and increasing employment opportunities in the cultural and creative sectors for sustained, inclusive and equitable economic growth and development; (f) To actively support the emergence of local markets for cultural goods and services and to facilitate the effective and licit access of such goods and services to international markets, taking into account the expanding range of cultural production and consumption and, for States parties thereto, the provisions of the Convention on the Protection and Promotion of the Diversity of Cultural Expressions; 4 (g) To promote the diversity of and the access to cultural expressions in the digital environment; (h) To preserve and maintain local and indigenous traditional knowledge and community practices of environmental management, which are valuable examples of culture as a vehicle for sustainable development, and to foster synergies between modern science and technology and local and indigenous knowledge, practices and innovation; (i) To accelerate efforts to protect cultural and natural heritage from extreme weather events, sea level rise, desertification and other threats exacerbated by climate change, which jeopardize its integrity and preservation for present and future generations; (j) To promote global awareness of the linkages between cultural and biological diversity, including through the protection and preservation and encouragement of the customary use of biological resources, in accordance with traditional cultural practices, as an important element of a comprehensive approach to sustainable development; (k) To support national legal frameworks and policies for the protection and preservation of cultural heritage and cultural property, encouraging initiatives to fight against illicit trafficking in cultural property, and for the return of cultural property, in accordance with national legislation and applicable international legal frameworks; (l) To support national legal frameworks and policies to enable intellectual property rights to sustain those involved in cultural creativity, including by promoting international cooperation to prevent the misappropriation of creative works; (m) To promote access to and/or the repatriation of ceremonial objects and human remains in their possession through fair, transparent and effective mechanisms developed in conjunction with indigenous peoples concerned; (n) To note that, in achieving these objectives, innovative mechanisms of financing, public and private, can make a positive contribution in assisting developing countries in mobilizing additional resources for development on a stable, predictable and voluntary basis, and to reiterate that such voluntary mechanisms should be effective, should aim to mobilize resources that are stable and predictable, should supplement and not be a substitute for traditional sources of financing, should be disbursed in accordance with the priorities of developing countries and should not unduly burden such countries; A/RES/74/230 Culture and sustainable development 19-22502 8/9 (o) To mobilize culture as a vehicle to foster tolerance, mutual understanding, peace and reconciliation in the context of conflict-prevention, conflict-resolution and peacebuilding processes;",
    "17": "Expresses deep concern that cultural property, including religious sites, shrines and cemeteries, and objects, is increasingly targeted by terrorist attacks and vandalism, often resulting in its damage, theft or complete destruction, and condemns such attacks;",
    "18": "Encourages all countries, intergovernmental bodies, organizations of the United Nations system, as appropriate, within their existing mandates, relevant non-governmental organizations and all other relevant stakeholders to enhance international cooperation in supporting the efforts of developing countries towards the development and strengthening of cultural and creative sectors, cultural tourism and culture-related microenterprises and to assist those countries in developing the necessary infrastructure and skills, as well as in mastering information and communications technologies and in gaining access to new technologies on mutually agreed terms;",
    "19": "Encourages initiatives to foster cultural cooperation agreements and networks at the regional level for knowledge- and information-sharing for sustainable development;",
    "20": "Also encourages programmes that facilitate social benefits and economic rights for artists and cultural professionals, including opportunities for decent work, fair remuneration and equal pay for work of equal value, as well as training in the light of technological advancement and digitalization;",
    "21": "Invites the organizations of the United Nations system, in particular the United Nations Educational, Scientific and Cultural Organization, to continue to provide support, to facilitate financing and to assist countries, upon their request, in developing their national capacities to optimize the contribution of culture to sustainable development, including through information-sharing, the exchange of best practices, data collection, research and study and the use of appropriate evaluation indicators, as well as to implement applicable international cultural conventions, taking into account the relevant resolutions of the General Assembly;",
    "22": "Invites the United Nations Educational, Scientific and Cultural Organization and other relevant United Nations bodies to continue to assess, in consultation with countries, the contribution of culture to the achievement of sustainable development through the compilation of quantitative data, including indicators and statistics, with a view to informing development policies and relevant reports, where appropriate, and to continue to act as a platform for exchange among countries on the nexus between culture and sustainable development, including through the Forums of Ministers for Culture;",
    "23": "Requests the Secretary-General to ensure that United Nations country teams continue to further integrate and mainstream culture into their programming exercises, in particular United Nations Sustainable Development Cooperation Frameworks, in consultation with relevant national authorities, when assisting countries in the pursuit of their development objectives;",
    "24": "Encourages all countries, intergovernmental bodies, organizations of the United Nations system, relevant non-governmental organizations and all other relevant stakeholders to give due consideration to the contribution of culture to the achievement of sustainable development in the formulation of national, regional and international development policies and international cooperation instruments, and in this regard, building upon the discussion at the previous high-level event on culture and sustainable development, invites the President of the General Assembly to host a Culture and sustainable development A/RES/74/230 9/9 19-22502 one-day high-level event on this subject, within existing resources, during the seventy-fifth session of the Assembly, and to invite the United Nations Educational, Scientific and Cultural Organization to support him or her, within its existing mandates;",
    "25": "Reaffirms the commitment at the very heart of the 2030 Agenda to leave no one behind and commit to taking more tangible steps to support people in vulnerable situations and the most vulnerable countries and to reach the furthest behind first;",
    "26": "Requests the Secretary-General to submit to the General Assembly at its seventy-sixth session a report on the implementation of the present resolution, and decides to include in the provisional agenda of its seventy-sixth session, under the item entitled \u201cGlobalization and interdependence\u201d, the sub-item entitled \u201cCulture and sustainable development\u201d. 52nd plenary meeting 19 December 2019"
  },
  "agenda_items": [
    "Item 20"
  ],
  "symbol_references": []
}