{
  "symbol": "A/RES/72/286",
  "filename": "A_RES_72_286.pdf",
  "title": "72/286. Financing of the Regional Service Centre in Entebbe, Uganda",
  "text": "United Nations \nA/RES/72/286\n \n \nGeneral Assembly \nDistr.: General \n17 July 2018 \n \n18-11302 (E)    190718 \n*1811302* \n \n \nSeventy-second session \nAgenda item 149 \n \n \n \n \n Resolution adopted by the General Assembly on 5 July 2018 \n \n \n \n \n[on the report of the Fifth Committee (A/72/917)] \n \n \n 72/286. Financing of the Regional Service Centre in Entebbe, Uganda \n \n \n \nThe General Assembly, \n \nRecalling its resolutions 69/307 of 25 June 2015, 70/289 of 17 June 2016 and \n71/293 of 30 June 2017,  \n \nHaving considered the reports of the Secretary-General on the financing of the \nRegional Service Centre in Entebbe, Uganda,1 and the related report of the Advisory \nCommittee on Administrative and Budgetary Questions,2  \n \n1. \nReaffirms its resolutions 57/290 B of 18 June 2003, 59/296 of 22 June \n2005, 60/266 of 30 June 2006, 61/276 of 29 June 2007, 64/269 of 24 June 2010, \n65/289 of 30 June 2011, 66/264 of 21 June 2012, 69/307, and 70/286 of 17 June 2016, \nand requests the Secretary-General to ensure the full implementation of their relevant \nprovisions;  \n \n2. \nTakes note of the reports of the Secretary-General;1  \n \n3. \nEndorses the conclusions and recommendations contained in the report of \nthe Advisory Committee on Administrative and Budgetary Questions, 2 subject to the \nprovisions of the present resolution, and requests the Secretary-General to ensure \ntheir full implementation;  \n \n4. \nAcknowledges the support of the Government of Uganda in facilitating the \nwork of the United Nations at the Regional Service Centre in Entebbe, Uganda;  \n \n5. \nRecalls paragraph 13 of the report of the Advisory Committee, and decides \nnot to abolish the post of Service Delivery Manager (P-5);  \n \n6. \nAlso recalls paragraph 22 of the report of the Advisory Committee, \nwelcomes the nationalization of a number of Field Service posts, and urges the \nSecretary-General to continue the implementation of the nationalization plan and to \nreport thereon in the context of the next budget submission;  \n__________________ \n \n1  A/72/639 and A/72/777. \n \n2  A/72/789/Add.9. \n\nA/RES/72/286 \nFinancing of the Regional Service Centre in Entebbe, Uganda\n \n18-11302\n2/2 \n \n \n7. \nNotes that the national staff of the Regional Service Centre are eligible for \ncontinuing contracts, and in this regard requests the Secretary-General to ensure that \nnational staff of the Centre are granted continuing contracts in line with the relevant \nprovisions of General Assembly resolutions, in particular resolution 65/247 of \n24 December 2010, and in compliance with the Staff Regulations and Rules of the \nUnited Nations;3  \n \n \n \nBudget performance report for the period from 1 July 2016 to 30 June 2017 \n \n \n8. \nTakes note of the report of the Secretary-General on the budget \nperformance of the Regional Service Centre for the period from 1 July 2016 to \n30 June 2017;4 \n \n \n \nBudget estimates for the period from 1 July 2018 to 30 June 2019 \n \n \n9. \nApproves the amount of 31,438,900 United States dollars for the \nmaintenance of the Regional Service Centre for the period from 1 July 2018 to \n30 June 2019;  \n \n \n \nFinancing of the budget estimates \n \n \n10. Decides that the requirements for the Regional Service Centre for the \nperiod from 1 July 2018 to 30 June 2019 shall be financed as follows:  \n \n(a) \nThe unencumbered balance and other revenue in the amount of 2,983,200 \ndollars in respect of the financial period ended 30 June 2017, to be applied against \nthe resources required for the period from 1 July 2018 to 30 June 2019; \n \n(b) \nThe amount of 27,860,200 dollars, to be prorated among the budgets of \nthe active peacekeeping operations for the period from 1 July 2018 to 30 June 2019; \n \n(c) \nThe amount of 595,500 dollars, to be charged against the appropriation \nunder section 3, Political affairs, of the programme budget for the biennium  \n2018\u20132019, as approved by the General Assembly in its resolutions 72/263 A to C of \n24 December 2017; \n \n(d) \nThe estimated staff assessment income of 2,792,300 dollars, comprising \nthe amount of 2,892,400 dollars for the period from 1 July 2018 to 30 June 2019 and \nthe decrease of 100,100 dollars in respect of the period from 1 July 2016 to 30 June \n2017, to be offset against the balance referred to in subparagraph (b) above, to be \nprorated among the budgets of the individual active peacekeeping operations; \n \n11. \nAlso decides to consider at its seventy-third session the question of the \nfinancing of the Regional Service Centre. \n \n104th plenary meeting  \n5 July 2018 \n \n__________________ \n3 ST/SGB/2017/1 and ST/SGB/2017/1/Corr.1. \n \n4  A/72/639. \n",
  "paragraphs": {
    "1": "Reaffirms its resolutions 57/290 B of 18 June 2003, 59/296 of 22 June 2005, 60/266 of 30 June 2006, 61/276 of 29 June 2007, 64/269 of 24 June 2010, 65/289 of 30 June 2011, 66/264 of 21 June 2012, 69/307, and 70/286 of 17 June 2016, and requests the Secretary-General to ensure the full implementation of their relevant provisions;",
    "2": "Takes note of the reports of the Secretary-General;1",
    "3": "Endorses the conclusions and recommendations contained in the report of the Advisory Committee on Administrative and Budgetary Questions, 2 subject to the provisions of the present resolution, and requests the Secretary-General to ensure their full implementation;",
    "4": "Acknowledges the support of the Government of Uganda in facilitating the work of the United Nations at the Regional Service Centre in Entebbe, Uganda;",
    "5": "Recalls paragraph 13 of the report of the Advisory Committee, and decides not to abolish the post of Service Delivery Manager (P-5);",
    "6": "Also recalls paragraph 22 of the report of the Advisory Committee, welcomes the nationalization of a number of Field Service posts, and urges the Secretary-General to continue the implementation of the nationalization plan and to report thereon in the context of the next budget submission; __________________ 1 A/72/639 and A/72/777. 2 A/72/789/Add.9. A/RES/72/286 Financing of the Regional Service Centre in Entebbe, Uganda 18-11302 2/2",
    "7": "Notes that the national staff of the Regional Service Centre are eligible for continuing contracts, and in this regard requests the Secretary-General to ensure that national staff of the Centre are granted continuing contracts in line with the relevant provisions of General Assembly resolutions, in particular resolution 65/247 of 24 December 2010, and in compliance with the Staff Regulations and Rules of the United Nations;3 Budget performance report for the period from 1 July 2016 to 30 June 2017",
    "8": "Takes note of the report of the Secretary-General on the budget performance of the Regional Service Centre for the period from 1 July 2016 to 30 June 2017;4 Budget estimates for the period from 1 July 2018 to 30 June 2019",
    "9": "Approves the amount of 31,438,900 United States dollars for the maintenance of the Regional Service Centre for the period from 1 July 2018 to 30 June 2019; Financing of the budget estimates",
    "10": "Decides that the requirements for the Regional Service Centre for the period from 1 July 2018 to 30 June 2019 shall be financed as follows: (a) The unencumbered balance and other revenue in the amount of 2,983,200 dollars in respect of the financial period ended 30 June 2017, to be applied against the resources required for the period from 1 July 2018 to 30 June 2019; (b) The amount of 27,860,200 dollars, to be prorated among the budgets of the active peacekeeping operations for the period from 1 July 2018 to 30 June 2019; (c) The amount of 595,500 dollars, to be charged against the appropriation under section 3, Political affairs, of the programme budget for the biennium 2018\u20132019, as approved by the General Assembly in its resolutions 72/263 A to C of 24 December 2017; (d) The estimated staff assessment income of 2,792,300 dollars, comprising the amount of 2,892,400 dollars for the period from 1 July 2018 to 30 June 2019 and the decrease of 100,100 dollars in respect of the period from 1 July 2016 to 30 June 2017, to be offset against the balance referred to in subparagraph (b) above, to be prorated among the budgets of the individual active peacekeeping operations;",
    "11": "Also decides to consider at its seventy-third session the question of the financing of the Regional Service Centre. 104th plenary meeting 5 July 2018 __________________ 3 ST/SGB/2017/1 and ST/SGB/2017/1/Corr.1. 4 A/72/639."
  },
  "agenda_items": [
    "Item 149"
  ],
  "symbol_references": []
}