{
  "symbol": "A/RES/78/235",
  "filename": "A_RES_78_235.pdf",
  "title": "78/235. Subregional Centre for Human Rights and Democracy in Central Africa",
  "text": "United Nations \nA/RES/78/235\n \n \nGeneral Assembly \nDistr.: General \n28 December 2023 \n \n23-26240 (E)    090124 \n*2326240* \n \n \nSeventy-eighth session \nAgenda item 71 (b) \nPromotion and protection of human rights: human rights \nquestions, including alternative approaches for improving \nthe effective enjoyment of human rights and \nfundamental freedoms  \n \n \n \n \n Resolution adopted by the General Assembly \non 22 December 2023 \n \n \n \n \n[on the report of the Third Committee (A/78/481/Add.2, para. 139)] \n \n \n 78/235. Subregional Centre for Human Rights and Democracy in \nCentral Africa \n \n \n \nThe General Assembly, \n \nRecalling its resolution 55/105 of 4 December 2000 concerning regional \narrangements for the promotion and protection of human rights, \n \nRecalling also its resolutions 55/34 B of 20 November 2000 and 55/233 of \n23 December 2000, section III of its resolution 55/234 of 23 December 2000, and its \nresolutions 56/253 of 24 December 2001 and 75/254 A to C of 31 December 2020, \n \nRecalling further its resolutions 58/176 of 22 December 2003, 59/183 of \n20 December 2004, 60/151 of 16 December 2005, 61/158 of 19 December 2006, \n62/221 of 22 December 2007, 63/177 of 18 December 2008, 64/165 of 18 December \n2009, 66/162 of 19 December 2011, 68/174 of 18 December 2013, 70/167 of \n17 December 2015, 72/187 of 19 December 2017, 74/162 of 18 December 2019 and \n76/171 of 16 December 2021 on the Subregional Centre for Human Rights and \nDemocracy in Central Africa, \n \nRecalling that the World Conference on Human Rights recommended that more \nresources be made available for the strengthening of regional arrangements for the \npromotion and protection of human rights under the programme of technical \ncooperation in the field of human rights of the Office of the United Nations High \nCommissioner for Human Rights,1 \n__________________ \n \n1  See A/CONF.157/24 (Part I), chap. III. \n\nA/RES/78/235 \nSubregional Centre for Human Rights and Democracy in \nCentral Africa \n \n23-26240 \n2/3 \n \n \nRecalling also the report of the United Nations High Commissioner for Human \nRights,2 \n \nTaking note of the report of the Secretary-General,3 \n \nNoting the holding of the fifty-second, fifty-third, fifty-fourth and fifty-fifth \nministerial meetings of the United Nations Standing Advisory Committee on Security \nQuestions in Central Africa, in Libreville from 22 to 26 November 2021, in Yaound\u00e9 \nfrom 30 May to 4 June 2022, in Kint\u00e9l\u00e9, Congo, from 12 to 16 January 2023, and in \nSao Tome from 15 to 19 May 2023, \n \nNoting also the operationalization of a far-reaching organizational change \ninitiative in the Office of the United Nations High Commissioner for Human Rights \nwith a view to better integrating work at Headquarters and in the field, 4 \n \nNoting further the security and humanitarian situation in the subregion, and in \nparticular the challenges created by indiscriminate attacks and massive abuses of \nhuman rights by terrorist groups, including Boko Haram, against the civilian \npopulation in many countries of the Central African subregion and in the Lake Chad \nbasin countries, \n \nNoting that the effective presence of the Office of the United Nations High \nCommissioner for Human Rights in the countries covered and continued dialogue \nwith the authorities have generated an increased number of requests for assistance \nfrom States, \n \nMindful of the vastness and diversity of the needs in the field of human rights \nwithin the subregion, and taking into account the need for sufficient funding for the \nCentre to fully realize its significant function and crucial role in the subregion, \n \nNoting with concern the negative effects of the coronavirus disease (COVID-19) \npandemic and the liquidity crisis of the Secretariat on the capacity of the Centre to \ndeliver on some of its mandate, \n \nEmphasizing the importance of sustainable development towards the enjoyment \nof all human rights, including economic, social and cultural rights, as well as civil \nand political rights, and stressing the importance of strengthening the work of the \nCentre in the area of economic, social and cultural rights, \n \n1. \nWelcomes the activities of the Subregional Centre for Human Rights and \nDemocracy in Central Africa at Yaound\u00e9; \n \n2. \nNotes with satisfaction the support provided to the Centre by the host \ncountry; \n \n3. \nAlso notes with satisfaction the increasing activities of the Centre and the \nimproved cooperation between the Centre and the States members of the Economic \nCommunity of Central African States, and in this regard encourages the Centre, in \ndelivering and reporting its activities, to give equal consideration to all of the \ncountries covered and to all human rights, including civil and political as well as \neconomic, social and cultural rights; \n \n4. \nEncourages the Centre to take into account the requested activities, needs \nand demands of the countries of the subregion in the implementation of the strategic \n__________________ \n \n2  Official Records of the General Assembly, Fifty-sixth Session, Supplement No. 36, addendum \n(A/56/36/Add.1). \n \n3  A/78/298. \n \n4  See Official Records of the General Assembly, Seventieth Session, Supplement No. 36 (A/70/36), \nchap. III. \n\nSubregional Centre for Human Rights and Democracy in \nCentral Africa \nA/RES/78/235 \n \n3/3 \n23-26240 \n \nthematic priorities of the Office of the United Nations High Commissioner for Human \nRights; \n \n5. \nNotes with satisfaction the engagement of the Centre in the area of human \nrights in development and in the economic sphere, through advocacy and the \nprovision of guidance to States, private sector companies and businesses in the \nsubregion, with a view to strengthening commitments to protect and/or respect human \nrights, and encourages the Centre to increase its support in this field; \n \n6. \nRequests the Centre to enhance its work, within its mandate, in order to \neffectively assist all countries in Central Africa in promoting and protecting \neconomic, social and cultural rights and addressing inequalities, bearing in mind that \nall human rights are universal, indivisible, interdependent and interrelated; \n \n7. \nEncourages the Centre to continue to strengthen its cooperation and invest \nin relations with subregional organizations and bodies, including the African Union, \nthe Economic Community of Central African States, the United Nations Regional \nOffice for Central Africa and the United Nations country teams, as well as with the \npeacekeeping missions of the subregion; \n \n8. \nEncourages the Regional Representative and Director of the Centre to \ncontinue to hold regular briefings for the ambassadors of Central African States based \nin Geneva and Yaound\u00e9, as well as in countries of the subregion during visits of the \nRegional Representative, with the aim of exchanging information on the activities of \nthe Centre and charting its direction; \n \n9. \nNotes the efforts of the Secretary-General and the United Nations High \nCommissioner for Human Rights to ensure the full implementation of the relevant \nresolutions of the General Assembly5 in order to provide sufficient funds and human \nresources for the missions of the Centre; \n \n10. Also notes the Secretary-General\u2019s appeal to Member States in his report \nA/78/298 to increase the regular budget allocations to the Centre, in particular in \nterms of human resources and funding for technical cooperation activities to assist \nthe Centre in contributing to bolstering national human rights protection systems and \nto advancing progress towards the attainment of the Sustainable Development Goals 6 \nin Central Africa; \n \n11. \nRequests the Secretary-General and the High Commissioner for Human \nRights to strengthen the capacity of the Centre, including through human resources \nfrom within the subregion, and to enhance support for the Centre so as to enable it to \nachieve greater results on the ground in terms of strengthening national human rights \nsystems and moving more rapidly towards the achievement of the Sustainable \nDevelopment Goals in Central Africa; \n \n12. Requests the Secretary-General to submit to the General Assembly at its \neightieth session a report on the implementation of the present resolution, including \ndata on the evolution of the human and financial resources of the Centre since its \nestablishment. \n \n50th (resumed) plenary meeting \n22 December 2023 \n \n__________________ \n \n5  Resolutions 61/158, 62/221, 63/177, 64/165, 72/187 and 74/162. \n \n6  See resolution 70/1. \n",
  "paragraphs": {
    "1": "Welcomes the activities of the Subregional Centre for Human Rights and Democracy in Central Africa at Yaound\u00e9;",
    "2": "Notes with satisfaction the support provided to the Centre by the host country;",
    "3": "Also notes with satisfaction the increasing activities of the Centre and the improved cooperation between the Centre and the States members of the Economic Community of Central African States, and in this regard encourages the Centre, in delivering and reporting its activities, to give equal consideration to all of the countries covered and to all human rights, including civil and political as well as economic, social and cultural rights;",
    "4": "Encourages the Centre to take into account the requested activities, needs and demands of the countries of the subregion in the implementation of the strategic __________________ 2 Official Records of the General Assembly, Fifty-sixth Session, Supplement No. 36, addendum (A/56/36/Add.1). 3 A/78/298. 4 See Official Records of the General Assembly, Seventieth Session, Supplement No. 36 (A/70/36), chap. III. Subregional Centre for Human Rights and Democracy in Central Africa A/RES/78/235 3/3 23-26240 thematic priorities of the Office of the United Nations High Commissioner for Human Rights;",
    "5": "Notes with satisfaction the engagement of the Centre in the area of human rights in development and in the economic sphere, through advocacy and the provision of guidance to States, private sector companies and businesses in the subregion, with a view to strengthening commitments to protect and/or respect human rights, and encourages the Centre to increase its support in this field;",
    "6": "Requests the Centre to enhance its work, within its mandate, in order to effectively assist all countries in Central Africa in promoting and protecting economic, social and cultural rights and addressing inequalities, bearing in mind that all human rights are universal, indivisible, interdependent and interrelated;",
    "7": "Encourages the Centre to continue to strengthen its cooperation and invest in relations with subregional organizations and bodies, including the African Union, the Economic Community of Central African States, the United Nations Regional Office for Central Africa and the United Nations country teams, as well as with the peacekeeping missions of the subregion;",
    "8": "Encourages the Regional Representative and Director of the Centre to continue to hold regular briefings for the ambassadors of Central African States based in Geneva and Yaound\u00e9, as well as in countries of the subregion during visits of the Regional Representative, with the aim of exchanging information on the activities of the Centre and charting its direction;",
    "9": "Notes the efforts of the Secretary-General and the United Nations High Commissioner for Human Rights to ensure the full implementation of the relevant resolutions of the General Assembly5 in order to provide sufficient funds and human resources for the missions of the Centre;",
    "10": "Also notes the Secretary-General\u2019s appeal to Member States in his report A/78/298 to increase the regular budget allocations to the Centre, in particular in terms of human resources and funding for technical cooperation activities to assist the Centre in contributing to bolstering national human rights protection systems and to advancing progress towards the attainment of the Sustainable Development Goals 6 in Central Africa;",
    "11": "Requests the Secretary-General and the High Commissioner for Human Rights to strengthen the capacity of the Centre, including through human resources from within the subregion, and to enhance support for the Centre so as to enable it to achieve greater results on the ground in terms of strengthening national human rights systems and moving more rapidly towards the achievement of the Sustainable Development Goals in Central Africa;",
    "12": "Requests the Secretary-General to submit to the General Assembly at its eightieth session a report on the implementation of the present resolution, including data on the evolution of the human and financial resources of the Centre since its establishment. 50th (resumed) plenary meeting 22 December 2023 __________________ 5 Resolutions 61/158, 62/221, 63/177, 64/165, 72/187 and 74/162. 6 See resolution 70/1."
  },
  "agenda_items": [
    "Item 71"
  ],
  "symbol_references": []
}