{
  "symbol": "A/RES/74/247",
  "filename": "A_RES_74_247.pdf",
  "title": "74/247. Countering the use of information and communications technologies for criminal purposes",
  "text": "United Nations \nA/RES/74/247\n \n \nGeneral Assembly \nDistr.: General \n20 January 2020 \n \n19-22674 (E)    200120 \n*1922674* \n \n \nSeventy-fourth session \nAgenda item 107 \nCountering the use of information and communications \ntechnologies for criminal purposes \n \n \n \n \n Resolution adopted by the General Assembly \non 27 December 2019 \n \n \n \n \n[on the report of the Third Committee (A/74/401)] \n \n \n 74/247. Countering the use of information and communications \ntechnologies for criminal purposes \n \n \n \nThe General Assembly,  \n \nNoting that information and communications technologies, while having \nenormous potential for the development of States, create new opportunities for \nperpetrators and may contribute to a rise in the levels and complexity of crime,  \n \nNoting also the potential risk of the misuse of emerging technologies, including \nartificial intelligence, while recognizing their potential in preventing and combating \nthe use of information and communications technologies for criminal purposes,  \n \nConcerned by the increase in the rate and diversity of crimes committed in the \ndigital world and their impact on the stability of critical infrastructure of States and \nenterprises and on the well-being of individuals,  \n \nRecognizing that diverse criminals, including traffickers in persons, are taking \nadvantage of information and communications technologies to carry out criminal \nactivities,  \n \nStressing the need to enhance coordination and cooperation among States in \ncombating the use of information and communications technologies for criminal \npurposes, including by providing technical assistance to developing countries, upon \ntheir request, to improve national legislation and frameworks and build the capacity \nof national authorities to deal with such use in all its forms, including its prevention, \ndetection, investigation and prosecution, and emphasizing in this context the role that \nthe United Nations, in particular the Commission on Crime Prevention and Criminal \nJustice, plays,  \n\nA/RES/74/247 \nCountering the use of information and communications \ntechnologies for criminal purposes\n \n19-22674\n2/3 \n \n \nRecalling Commission on Crime Prevention and Criminal Justice resolution \n22/8 of 26 April 2013,1 in which the Commission welcomed the efforts of the United \nNations Office on Drugs and Crime in fulfilling its mandate to provide technical \nassistance and capacity-building on cybercrime,  \n \nNoting the work carried out by the Commission on Crime Prevention and \nCriminal Justice under the auspices of an open-ended intergovernmental expert group \nwhich was established to conduct a comprehensive study of the problem of \ncybercrime and responses to it by Member States, the international community and \nthe private sector,  \n \nRecalling its resolution 65/230 of 21 December 2010, in which the General \nAssembly endorsed the Salvador Declaration on Comprehensive Strategies for Global \nChallenges: Crime Prevention and Criminal Justice Systems and Their Development \nin a Changing World, \n \nRecalling also the Doha Declaration on Integrating Crime Prevention and \nCriminal Justice into the Wider United Nations Agenda to Address Social and \nEconomic Challenges and to Promote the Rule of Law at the National and International \nLevels, and Public Participation,2 adopted at the Thirteenth United Nations Congress \non Crime Prevention and Criminal Justice, held in Doha from 12 to 19 April 2015,  \n \nNoting the discussions held during the first to fifth meetings of the open-ended \nintergovernmental expert group, held in Vienna from 17 to 21 January 2011, 25 to \n28 February 2013, 10 to 13 April 2017, 3 to 5 April 2018 and 27 to 29 March 2019, \nreaffirming the importance of the study and the need to further enhance international \ndiscussion on and cooperation against cybercrime,  \n \nNoting also the importance of the international and regional instruments in the \nfight against cybercrime and the ongoing efforts to examine options to strengthen \nexisting and propose new national and international legal or other responses to the \nuse of information and communications technologies for criminal purposes,  \n \nRecalling its resolutions 53/70 of 4 December 1998, 54/49 of 1 December 1999, \n55/28 of 20 November 2000, 56/19 of 29 November 2001, 57/53 of 22 November \n2002, 58/32 of 8 December 2003, 59/61 of 3 December 2004, 60/45 of 8 December \n2005, 61/54 of 6 December 2006, 62/17 of 5 December 2007, 63/37 of 2 December \n2008, 64/25 of 2 December 2009, 65/41 of 8 December 2010, 66/24 of 2 December \n2011, 66/181 of 19 December 2011, 67/27 of 3 December 2012, 68/193 of \n18 December 2013, 68/243 of 27 December 2013, 69/28 of 2 December 2014, 70/237 \nof 23 December 2015, 71/28 of 5 December 2016, 72/196 of 19 December 2017, \n73/27 of 5 December 2018 and 73/187 of 17 December 2018,  \n \nRecalling also the reports of the Group of Governmental Experts on Developments \nin the Field of Information and Telecommunications in the Context of International \nSecurity,3 which is of the view that States should consider how best to cooperate to \nprosecute the criminal use of information and communications technologies,  \n \nTaking note of Commission on Crime Prevention and Criminal Justice resolution \n26/4 of 26 May 2017,4 in which the Commission expressed appreciation for the work \ndone by the Expert Group to Conduct a Comprehensive Study on Cybercrime and \nrequested the Expert Group to continue its work, with a view to examining options to \n__________________ \n \n1  See Official Records of the Economic and Social Council, 2013, Supplement No. 10 and \ncorrigendum (E/2013/30 and E/2013/30/Corr.1), chap. I, sect. D. \n \n2  Resolution 70/174, annex. \n \n3  A/65/201, A/68/98 and A/70/174. \n \n4  See Official Records of the Economic and Social Council, 2017, Supplement No. 10 (E/2017/30), \nchap. I, sect. D. \n\nCountering the use of information and communications \ntechnologies for criminal purposes \nA/RES/74/247\n \n3/3\n19-22674 \n \nstrengthen existing responses and propose new national and international legal or \nother responses to cybercrime, and in this regard reaffirming the role of the United \nNations Office on Drugs and Crime, \n \nTaking note also of Economic and Social Council resolution 2019/19 of 23 July \n2019, entitled \u201cPromoting technical assistance and capacity-building to strengthen \nnational measures and international cooperation to combat cybercrime, including \ninformation-sharing\u201d, adopted on the recommendation of the Commission on Crime \nPrevention and Criminal Justice, \n \nRecognizing the role of the open-ended intergovernmental Expert Group to \nConduct a Comprehensive Study on Cybercrime as an important platform for \nexchanging information on national legislation, best practices, technical assistance \nand international cooperation, with a view to examining options to strengthen existing \nresponses and to proposing new national and international legal or other responses to \ncybercrime,  \n \nReaffirming the importance of respect for human rights and fundamental \nfreedoms in the use of information and communications technologies,  \n \n1. \nTakes note of the report of the Secretary-General,5 which was prepared \npursuant to resolution 73/187;  \n \n2. \nDecides to establish an open-ended ad hoc intergovernmental committee \nof experts, representative of all regions, to elaborate a comprehensive international \nconvention on countering the use of information and communications technologies \nfor criminal purposes, taking into full consideration existing international instruments \nand efforts at the national, regional and international levels on combating the use of \ninformation and communications technologies for criminal purposes, in particular the \nwork and outcomes of the open-ended intergovernmental Expert Group to Conduct a \nComprehensive Study on Cybercrime; \n \n3. \nAlso decides that the ad hoc committee shall convene a three-day \norganizational session in August 2020, in New York, in order to agree on an outline \nand modalities for its further activities, to be submitted to the General Assembly at \nits seventy-fifth session for its consideration and approval; \n \n4. \nRequests the Secretary General to allocate the necessary resources in order \nto organize and support the work of the ad hoc committee within the United Nations \nprogramme budget; \n \n5. \nInvites donor countries to provide assistance to the United Nations in \nensuring the active engagement of developing countries in the work of the ad hoc \ncommittee, including by covering travel costs and accommodation expenses;  \n \n6. \nDecides to examine the question at its seventy-fifth session under the item \nentitled \u201cCountering the use of information and communications technologies for \ncriminal purposes\u201d. \n \n52nd (resumed) plenary meeting \n27 December 2019 \n \n__________________ \n \n5  A/74/130. \n",
  "paragraphs": {
    "1": "Takes note of the report of the Secretary-General,5 which was prepared pursuant to resolution 73/187;",
    "2": "Decides to establish an open-ended ad hoc intergovernmental committee of experts, representative of all regions, to elaborate a comprehensive international convention on countering the use of information and communications technologies for criminal purposes, taking into full consideration existing international instruments and efforts at the national, regional and international levels on combating the use of information and communications technologies for criminal purposes, in particular the work and outcomes of the open-ended intergovernmental Expert Group to Conduct a Comprehensive Study on Cybercrime;",
    "3": "Also decides that the ad hoc committee shall convene a three-day organizational session in August 2020, in New York, in order to agree on an outline and modalities for its further activities, to be submitted to the General Assembly at its seventy-fifth session for its consideration and approval;",
    "4": "Requests the Secretary General to allocate the necessary resources in order to organize and support the work of the ad hoc committee within the United Nations programme budget;",
    "5": "Invites donor countries to provide assistance to the United Nations in ensuring the active engagement of developing countries in the work of the ad hoc committee, including by covering travel costs and accommodation expenses;",
    "6": "Decides to examine the question at its seventy-fifth session under the item entitled \u201cCountering the use of information and communications technologies for criminal purposes\u201d."
  },
  "agenda_items": [
    "Item 107"
  ],
  "symbol_references": []
}