{
  "symbol": "A/RES/74/74",
  "filename": "A_RES_74_74.pdf",
  "title": "74/74. Report of the Conference on Disarmament",
  "text": "United Nations \nA/RES/74/74\n \n \nGeneral Assembly \nDistr.: General \n23 December 2019 \n \n19-21875 (E)    060120 \n*1921875* \n \n \nSeventy-fourth session \nAgenda item 100 (a) \nReview of the implementation of the recommendations and \ndecisions adopted by the General Assembly at its tenth \nspecial session: report of the Conference on Disarmament \n \n \n \n \n Resolution adopted by the General Assembly \non 12 December 2019 \n \n \n \n \n[on the report of the First Committee (A/74/370)] \n \n \n \n74/74. Report of the Conference on Disarmament \n \n \n \nThe General Assembly,  \n \nHaving considered the report of the Conference on Disarmament,1  \n \nRecalling its resolution 73/81 of 5 December 2018, \n \nConvinced that the Conference on Disarmament, as the single multilateral \ndisarmament negotiating forum of the international community, has the primary role \nin substantive negotiations on priority questions of disarmament,  \n \nRecognizing the addresses of the Secretary-General of the United Nations, as \nwell as the addresses of Ministers for Foreign Affairs and other high-level officials in \nthe Conference on Disarmament, and referring to their various expressions of support \nfor and concern about the endeavours of the Conference and calls for the Conference \nto commence negotiations without delay to advance disarmament goals through the \nadoption of a balanced and comprehensive programme of work, \n \nRecognizing also the need to conduct multilateral negotiations with the aim of \nreaching agreement on concrete issues, and emphasizing the importance of effective \nmultilateralism in the context of the changing international climate, \n \nNoting with renewed concern that, despite the intensive efforts by States \nmembers and Presidents of the Conference on Disarmament at its 2019 session to \nreach consensus on a programme of work on the basis of relevant proposals and \nsuggestions, the Conference did not succeed in commencing its substantive work by \nmeans of negotiations or agree to a programme of work,  \n__________________ \n \n1  Official Records of the General Assembly, Seventy-fourth Session, Supplement No. 27 (A/74/27). \n\nA/RES/74/74 \nReport of the Conference on Disarmament\n \n19-21875\n2/3 \n \n \nRecalling, in this respect, that the Conference on Disarmament has a number of \npriority issues for negotiation to achieve disarmament goals, \n \nWelcoming the overwhelming call for greater flexibility with respect to \nimplementing the substantive work of the Conference on Disarmament on the basis \nof a balanced and comprehensive programme of work, \n \nUnderlining the need for continued cooperation among the States members of \nthe Conference on Disarmament as well as among the successive Presidents of the \nConference, \n \nNoting with appreciation the contributions made at the 2019 session to promote \nsubstantive discussions on issues on the agenda,  \n \nAcknowledging the United Nations Institute for Disarmament Research, as a \nstand-alone, autonomous institution, and the contribution that its research makes,  \n \nRecognizing the importance of engagement between civil society and the \nConference on Disarmament according to decisions taken by the Conference, \n \n1. \nReaffirms the role of the Conference on Disarmament as the single \nmultilateral disarmament negotiating forum of the international community; \n \n2. \nAppreciates the strong support expressed for the Conference on \nDisarmament at its 2019 session by Ministers for Foreign Affairs and other high-level \nofficials, while also acknowledging their concern about its ongoing impasse, and \ntakes into account their calls for greater flexibility with respect to commencing the \nsubstantive work of the Conference without further delay; \n \n3. \nCalls upon the Conference on Disarmament to further intensify \nconsultations and to explore possibilities for overcoming its ongoing deadlock of two \ndecades by adopting and implementing a balanced and comprehensive programme of \nwork at the earliest possible date during its 2020 session, bearing in mind the decision \non the programme of work adopted by the Conference on 29 May 2009,2 as well as \nother relevant present, past and future proposals; \n \n4. \nEncourages the current President and the incoming President of the \nConference on Disarmament to conduct consultations during the intersessional period \nand, if possible, to make recommendations, taking into account all relevant proposals, \npast, present and future, including those submitted as documents of the Conference, \nviews presented and discussions held, and to endeavour to keep the membership of \nthe Conference informed, as appropriate, of their consultations; \n \n5. \nRequests the current President and successive Presidents of the Conference \non Disarmament to cooperate with the States members of the Conference in the effort \nto guide the Conference to the early commencement of its substantive work, including \nnegotiations, at its 2020 session; \n \n6. \nRecognizes the importance of continuing consultations in 2020 on the \nquestion of the expansion of the membership of the Conference on Disarmament; \n \n7. \nRequests the Secretary-General to continue to ensure and to strengthen, if \nneeded, the provision to the Conference on Disarmament of all necessary \nadministrative, substantive and conference support services; \n \n8. \nRequests the Conference on Disarmament to submit to the General \nAssembly at its seventy-fifth session a report on its work; \n__________________ \n \n2  Ibid., Sixty-fourth Session, Supplement No. 27 (A/64/27), para. 18. \n\nReport of the Conference on Disarmament \nA/RES/74/74\n \n3/3\n19-21875 \n \n \n9. \nDecides to include in the provisional agenda of its seventy-fifth session, \nunder the item entitled \u201cReview of the implementation of the recommendations and \ndecisions adopted by the General Assembly at its tenth special session\u201d, the sub-item \nentitled \u201cReport of the Conference on Disarmament\u201d. \n \n46th plenary meeting \n12 December 2019 \n \n",
  "paragraphs": {
    "1": "Reaffirms the role of the Conference on Disarmament as the single multilateral disarmament negotiating forum of the international community;",
    "2": "Appreciates the strong support expressed for the Conference on Disarmament at its 2019 session by Ministers for Foreign Affairs and other high-level officials, while also acknowledging their concern about its ongoing impasse, and takes into account their calls for greater flexibility with respect to commencing the substantive work of the Conference without further delay;",
    "3": "Calls upon the Conference on Disarmament to further intensify consultations and to explore possibilities for overcoming its ongoing deadlock of two decades by adopting and implementing a balanced and comprehensive programme of work at the earliest possible date during its 2020 session, bearing in mind the decision on the programme of work adopted by the Conference on 29 May 2009,2 as well as other relevant present, past and future proposals;",
    "4": "Encourages the current President and the incoming President of the Conference on Disarmament to conduct consultations during the intersessional period and, if possible, to make recommendations, taking into account all relevant proposals, past, present and future, including those submitted as documents of the Conference, views presented and discussions held, and to endeavour to keep the membership of the Conference informed, as appropriate, of their consultations;",
    "5": "Requests the current President and successive Presidents of the Conference on Disarmament to cooperate with the States members of the Conference in the effort to guide the Conference to the early commencement of its substantive work, including negotiations, at its 2020 session;",
    "6": "Recognizes the importance of continuing consultations in 2020 on the question of the expansion of the membership of the Conference on Disarmament;",
    "7": "Requests the Secretary-General to continue to ensure and to strengthen, if needed, the provision to the Conference on Disarmament of all necessary administrative, substantive and conference support services;",
    "8": "Requests the Conference on Disarmament to submit to the General Assembly at its seventy-fifth session a report on its work; __________________ 2 Ibid., Sixty-fourth Session, Supplement No. 27 (A/64/27), para. 18. Report of the Conference on Disarmament A/RES/74/74 3/3 19-21875",
    "9": "Decides to include in the provisional agenda of its seventy-fifth session, under the item entitled \u201cReview of the implementation of the recommendations and decisions adopted by the General Assembly at its tenth special session\u201d, the sub-item entitled \u201cReport of the Conference on Disarmament\u201d. 46th plenary meeting 12 December 2019"
  },
  "agenda_items": [
    "Item 100"
  ],
  "symbol_references": []
}