{
  "symbol": "A/RES/78/281",
  "filename": "A_RES_78_281.pdf",
  "title": "78/281. World Football Day",
  "text": "United Nations \nA/RES/78/281\n \n \nGeneral Assembly \nDistr.: General \n9 May 2024 \n \n24-08409 (E)    150524 \n*2408409* \n \n \nSeventy-eighth session \nAgenda item 11 \nSport for development and peace: building a peaceful and \nbetter world through sport and the Olympic ideal \n \n \n \n \n Resolution adopted by the General Assembly \non 7 May 2024 \n \n \n \n \n[without reference to a Main Committee (A/78/L.56)] \n \n \n 78/281. World Football Day \n \n \n \nThe General Assembly, \n \nRecalling its resolution 77/27 of 1 December 2022, in which it reaffirmed that \nsport is an important enabler of sustainable development and recognized the growing \ncontribution of sport to the realization of development and peace, the promotion of \ntolerance and respect, and the empowerment of women and girls, young people, \nindividuals and communities, and persons with disabilities, as well as to the \nachievement of physical and mental health, education and social inclusion objectives, \n \nRecalling also its resolutions on sport as a means to promote education, health, \ndevelopment and peace, in particular resolution 58/5 of 3 November 2003, in which \nit proclaimed 2005 the International Year for Sport and Physical Education, and \nresolutions 59/10 of 27 October 2004, 60/9 of 3 November 2005, 61/10 of \n3 November 2006, 62/271 of 23 July 2008, 63/135 of 11 December 2008, 65/4 of \n18 October 2010, 67/17 of 28 November 2012, 69/6 of 31 October 2014, 71/160 of \n16 December 2016, 73/24 of 3 December 2018, 75/18 of 1 December 2020 and 76/259 \nof 8 April 2022, \n \nRecognizing the valuable contribution of sport in promoting education, \nsustainable development, peace, gender equality, cooperation, solidarity, fairness, \nsocial inclusion and health at the local, regional and international levels, and noting \nthat, as declared in the 2005 World Summit Outcome,1 sports can contribute to an \natmosphere of tolerance and understanding among peoples and nations, \n \nRecalling its resolution 67/296 of 23 August 2013, in which it proclaimed \n6 April the International Day of Sport for Development and Peace, \n__________________ \n \n1  Resolution 60/1. \n\nA/RES/78/281 \nWorld Football Day\n \n24-08409\n2/3 \n \n \nReaffirming its resolutions 53/199 of 15 December 1998 and 61/185 of \n20 December 2006 on the proclamation of international years, and Economic and \nSocial Council resolution 1980/67 of 25 July 1980 on international years and \nanniversaries, \n \nRecognizing that major international sporting events should be organized in the \nspirit of peace, mutual understanding, international cooperation, friendship, and \ntolerance, and without discrimination, and that the unifying and conciliative nature of \nsuch events should be respected, \n \nRecognizing also the fundamental role of the F\u00e9d\u00e9ration Internationale de \nFootball Association and the important role of regional and national football \nfederations, as well as relevant associations, in promoting the game of football, \n \nEncouraging all Member States and relevant international and regional \norganizations to facilitate the participation of the athletes in sporting events and \ncompetitions, \n \nRecognizing that sports, the arts and physical activity have the power to change \nperceptions, prejudices and behaviours, as well as to inspire people, break down racial \nand political barriers, combat discrimination and defuse conflict, as reflected in the \npolitical declaration adopted at the Nelson Mandela Peace Summit in 2018, 2 \n \nNoting that sport, including sport for persons with disabilities, has a vital role \nin promoting peace, development and respect for human rights, \n \nNoting also that sport is a potential tool for raising public awareness on issues \nsuch as climate change and health through high-profile events, athletes and teams, \n \nEncouraging Member States involved in delivering mega sporting events to \nrespect applicable laws and international principles, including the Guiding Principles \non Business and Human Rights: Implementing the United Nations \u201cProtect, Respect \nand Remedy\u201d Framework, as well as the fundamental values of Olympism and the \nInternational Olympic Movement and other international sport governing \norganizations, \n \nAcknowledging the global reach of football and its impact in various spheres, \nincluding commerce, peace and diplomacy, and recognizing that football creates a \nspace for cooperation, \n \nWelcoming the Football for the Goals initiative, a platform for the global football \ncommunity to engage with and advocate for the Sustainable Development Goals and \nbuild on sustainability practices, \n \nRecalling that the goal of establishing international days is to create special time \nand space everywhere around the world to educate the general public on issues of \nconcern, to mobilize political will and resources to address global problems, and to \ncelebrate and reinforce achievements of humanity, and recognizing the global impact \nof designated international days as springboards for awareness-raising actions, \n \n1. \nCommends countries that have hosted and will host significant \ninternational football events and encourages them to ensure that these events leave a \nlasting legacy for global peace, sportsmanship and fair play; \n \n2. \nEmphasizes that sport, including sport for persons with disabilities, has an \nimportant role to play in the promotion of peace and development, respect for human \nrights, the fight against racism and racial discrimination, gender equality and the \n__________________ \n \n2  Resolution 73/1. \n\nWorld Football Day \nA/RES/78/281\n \n3/3\n24-08409 \n \nempowerment of women and girls, in particular football, given its universal \npopularity; \n \n3. \nEncourages all Member States to support sport, including football, in its \nrole as a tool to promote peace, development, the empowerment of women and girls, \nand the achievement of the Sustainable Development Goals, fostering social \ninclusion, intercultural dialogue and dialogue among civilizations; \n \n4. \nAlso encourages Member States to adopt policies and programmes for the \npromotion of sport and physical activities, including football, at the national and local \nlevels as a means to enhance physical and mental health and well-being and to \ncultivate a sporting culture in society; \n \n5. \nDecides to proclaim 25 May as World Football Day, as 2024 marks the \n100th anniversary of the first international football tournament in history with the \nrepresentation of all regions as part of the 1924 Summer Olympic Games, held in \nParis; \n \n6. \nInvites all States Members of the United Nations, members of the \nspecialized agencies and observers of the General Assembly, as well as organizations \nof the United Nations system, in particular the Division for Inclusive Social \nDevelopment of the Department of Economic and Social Affairs of the Secretariat, \nother international and regional organizations, academia, civil society, the private \nsector and other relevant stakeholders to observe World Football Day in an \nappropriate manner and in accordance with national priorities, and to disseminate the \nadvantages of football for all, including through educational and public awareness-\nraising activities; \n \n7. \nStresses that the cost of all activities that may arise from the implementation \nof the present resolution should be met through voluntary contributions; \n \n8. \nRequests the Secretary-General to bring the present resolution to the \nattention of all Member States, the organizations of the United Nations system and \nother relevant stakeholders for appropriate observance. \n \n80th plenary meeting \n7 May 2024 \n \n \n",
  "paragraphs": {
    "1": "Commends countries that have hosted and will host significant international football events and encourages them to ensure that these events leave a lasting legacy for global peace, sportsmanship and fair play;",
    "2": "Emphasizes that sport, including sport for persons with disabilities, has an important role to play in the promotion of peace and development, respect for human rights, the fight against racism and racial discrimination, gender equality and the empowerment of women and girls, in particular football, given its universal popularity;",
    "3": "Encourages all Member States to support sport, including football, in its role as a tool to promote peace, development, the empowerment of women and girls, and the achievement of the Sustainable Development Goals, fostering social inclusion, intercultural dialogue and dialogue among civilizations;",
    "4": "Also encourages Member States to adopt policies and programmes for the promotion of sport and physical activities, including football, at the national and local levels as a means to enhance physical and mental health and well-being and to cultivate a sporting culture in society;",
    "5": "Decides to proclaim 25 May as World Football Day, as 2024 marks the 100th anniversary of the first international football tournament in history with the representation of all regions as part of the 1924 Summer Olympic Games, held in Paris;",
    "6": "Invites all States Members of the United Nations, members of the specialized agencies and observers of the General Assembly, as well as organizations of the United Nations system, in particular the Division for Inclusive Social Development of the Department of Economic and Social Affairs of the Secretariat, other international and regional organizations, academia, civil society, the private sector and other relevant stakeholders to observe World Football Day in an appropriate manner and in accordance with national priorities, and to disseminate the advantages of football for all, including through educational and public awareness- raising activities;",
    "7": "Stresses that the cost of all activities that may arise from the implementation of the present resolution should be met through voluntary contributions;",
    "8": "Requests the Secretary-General to bring the present resolution to the attention of all Member States, the organizations of the United Nations system and other relevant stakeholders for appropriate observance."
  },
  "agenda_items": [
    "Item 11"
  ],
  "symbol_references": [
    "A/78/L.56"
  ]
}