{
  "symbol": "A/RES/77/78",
  "filename": "A_RES_77_78.pdf",
  "title": "77/78. Strengthening and developing the system of arms control, disarmament and non-proliferation treaties and agreements",
  "text": "United Nations \nA/RES/77/78\n \n \nGeneral Assembly \nDistr.: General \n15 December 2022 \n \n22-28178 (E)    201222     \n*2228178* \n \n \nSeventy-seventh session \nAgenda item 99 (qq) \nGeneral and complete disarmament: strengthening and \ndeveloping the system of arms control, disarmament and \nnon-proliferation treaties and agreements \n \n \n \n \n Resolution adopted by the General Assembly \non 7 December 2022 \n \n \n \n \n[on the report of the First Committee (A/77/385, para. 110)] \n \n \n \n77/78. Strengthening and developing the system of arms control, \ndisarmament and non-proliferation treaties and agreements \n \n \n \nThe General Assembly, \n \nRecalling its previous relevant resolutions, \n \nRecognizing the common interest of all humankind in strengthening and \ndeveloping the system of arms control, disarmament and non-proliferation treaties \nand agreements, \n \nStressing the vital importance of efforts in arms control, disarmament and \nnon-proliferation for providing international peace and strengthening global security, \n \nWelcoming the extension for five years of the Treaty between the Russian \nFederation and the United States of America on Measures for the Further Reduction \nand Limitation of Strategic Offensive Arms, \n \nStressing the paramount importance of full and strict implementation, \nstrengthening and development of arms control, disarmament and non-proliferation \ntreaties and agreements providing enhanced security to individual nations and the \ninternational community, \n \nUnderlining that any weakening of confidence in and compliance with such \ntreaties and agreements diminishes their contribution to global or regional stability \nand undermines the credibility and effectiveness of the international legal system and \nregime applicable to arms control, disarmament and non-proliferation, \n \nRecognizing in this context that full implementation by Member States of \nexisting treaties and agreements to which they are parties and resolving \nimplementation concerns effectively by means consistent with such treaties and \nagreements and international law facilitate the conclusion of additional arms control, \n\nA/RES/77/78 \nStrengthening and developing the system of arms control, \ndisarmament and non-proliferation treaties and agreements\n \n22-28178\n2/3 \n \ndisarmament and non-proliferation treaties and agreements, and thereby contribute to \nbetter relations among States and the strengthening of the existing system of such \ntreaties and agreements, as well as international peace and security, \n \nBelieving that supporting and developing the system of arms control, \ndisarmament and non-proliferation through the strengthening of appropriate treaties \nand agreements and their regimes is a matter of interest and concern to all members \nof the international community, and noting the role that the United Nations has played \nand should continue to play in that regard, \n \nStressing the importance of appropriate and sustainable financial support for the \neffectiveness and efficiency of the relevant international arms control, disarmament \nand non-proliferation instruments and proper functioning of their regimes, \n \nEmphasizing the importance of appropriate technical assistance and capacity-\nbuilding efforts for the implementation of arms control, disarmament and \nnon-proliferation treaties and agreements by Member States, \n \nConcerned that any actions that undermine the existing system of arms control, \ndisarmament and non-proliferation treaties and agreements affect the interests of the \ninternational community, \n \nMindful that it is the responsibility and obligation of all Member States to \ncontribute to the process of easing international tension and to strengthening \ninternational peace and security and, in this connection, to refrain from steps that \nnegatively affect the security environment and to make efforts to advance along the \npath of nuclear disarmament, as well as general and complete disarmament under \nstrict and effective international control, \n \n1. \nUrges all States parties to arms control, disarmament and non-proliferation \ntreaties and agreements to implement all provisions of such treaties and agreements \nin their entirety; \n \n2. \nCalls for continued efforts to strengthen the system of arms control, \ndisarmament and non-proliferation treaties and agreements and to preserve its \nintegrity and validity for maintaining global stability and international peace and \nsecurity; \n \n3. \nCalls upon all Member States to give serious consideration to the negative \nimplications of undermining arms control, disarmament and non-proliferation treaties \nand agreements and their regimes for international security and stability, as well as \nfor progress in the field of disarmament; \n \n4. \nUrges all Member States to support efforts aimed at the resolution of \nimplementation issues by means consistent with arms control, disarmament and \nnon-proliferation treaties and agreements and international law, with a view to \nencouraging strict observance by all States parties of the provisions of such treaties \nand agreements, maintaining or restoring the integrity of such treaties and agreements \nand strengthening and developing their regimes; \n \n5. \nConsiders that any actions that undermine the system of arms control, \ndisarmament and non-proliferation treaties and agreements also undermine global \nstability and international peace and security; \n \n6. \nSupports efforts by the international community, in the light of emerging \ndevelopments, towards safeguarding the integrity of the existing arms control, \ndisarmament and non-proliferation treaties and agreements, which is in the strongest \ninterest of humankind; \n\nStrengthening and developing the system of arms control, \ndisarmament and non-proliferation treaties and agreements \nA/RES/77/78\n \n3/3\n22-28178 \n \n \n7. \nWelcomes the role that the United Nations has played and continues to play \nin fostering negotiations on arms control, disarmament and non-proliferation treaties \nand agreements; \n \n8. \nExpresses the need to maintain the effectiveness and efficiency as well as \nthe consensus-based nature of the relevant multilateral instruments in the field of \ndisarmament, non-proliferation and arms control; \n \n9. \nRequests the Secretary-General to continue to provide assistance that may be \nnecessary in protecting the integrity of arms control, disarmament and non-proliferation \ntreaties and agreements, and in strengthening the system of such treaties and agreements; \n \n10. Encourages States in a position to do so to provide, upon request, technical \nassistance and capacity-building in support of national implementation of arms control, \ndisarmament and non-proliferation treaties and agreements by Member States; \n \n11. \nEncourages efforts by all States parties to elaborate additional cooperative \nmeasures, as appropriate, that can increase confidence in existing arms control, \ndisarmament and non-proliferation treaties and agreements and facilitate the \nconclusion of additional treaties and agreements of that kind; \n \n12. Notes the importance of effective verification provisions for arms control, \ndisarmament and non-proliferation treaties and agreements; \n \n13. Decides to include in the provisional agenda of its seventy-ninth session, \nunder the item entitled \u201cGeneral and complete disarmament\u201d, the sub-item entitled \n\u201cStrengthening and developing the system of arms control, disarmament and \nnon-proliferation treaties and agreements\u201d. \n \n46th plenary meeting \n7 December 2022 \n \n",
  "paragraphs": {
    "1": "Urges all States parties to arms control, disarmament and non-proliferation treaties and agreements to implement all provisions of such treaties and agreements in their entirety;",
    "2": "Calls for continued efforts to strengthen the system of arms control, disarmament and non-proliferation treaties and agreements and to preserve its integrity and validity for maintaining global stability and international peace and security;",
    "3": "Calls upon all Member States to give serious consideration to the negative implications of undermining arms control, disarmament and non-proliferation treaties and agreements and their regimes for international security and stability, as well as for progress in the field of disarmament;",
    "4": "Urges all Member States to support efforts aimed at the resolution of implementation issues by means consistent with arms control, disarmament and non-proliferation treaties and agreements and international law, with a view to encouraging strict observance by all States parties of the provisions of such treaties and agreements, maintaining or restoring the integrity of such treaties and agreements and strengthening and developing their regimes;",
    "5": "Considers that any actions that undermine the system of arms control, disarmament and non-proliferation treaties and agreements also undermine global stability and international peace and security;",
    "6": "Supports efforts by the international community, in the light of emerging developments, towards safeguarding the integrity of the existing arms control, disarmament and non-proliferation treaties and agreements, which is in the strongest interest of humankind; Strengthening and developing the system of arms control, disarmament and non-proliferation treaties and agreements",
    "7": "Welcomes the role that the United Nations has played and continues to play in fostering negotiations on arms control, disarmament and non-proliferation treaties and agreements;",
    "8": "Expresses the need to maintain the effectiveness and efficiency as well as the consensus-based nature of the relevant multilateral instruments in the field of disarmament, non-proliferation and arms control;",
    "9": "Requests the Secretary-General to continue to provide assistance that may be necessary in protecting the integrity of arms control, disarmament and non-proliferation treaties and agreements, and in strengthening the system of such treaties and agreements;",
    "10": "Encourages States in a position to do so to provide, upon request, technical assistance and capacity-building in support of national implementation of arms control, disarmament and non-proliferation treaties and agreements by Member States;",
    "11": "Encourages efforts by all States parties to elaborate additional cooperative measures, as appropriate, that can increase confidence in existing arms control, disarmament and non-proliferation treaties and agreements and facilitate the conclusion of additional treaties and agreements of that kind;",
    "12": "Notes the importance of effective verification provisions for arms control, disarmament and non-proliferation treaties and agreements;",
    "13": "Decides to include in the provisional agenda of its seventy-ninth session, under the item entitled \u201cGeneral and complete disarmament\u201d, the sub-item entitled \u201cStrengthening and developing the system of arms control, disarmament and non-proliferation treaties and agreements\u201d."
  },
  "agenda_items": [
    "Item 99"
  ],
  "symbol_references": []
}