{
  "symbol": "A/RES/76/226",
  "filename": "A_RES_76_226.pdf",
  "title": "76/226. A global call for concrete action for the elimination of racism, racial discrimination, xenophobia and related intolerance and the comprehensive implementation of and follow-up to the Durban Declaration and Programme of Action",
  "text": "United Nations \nA/RES/76/226*\n \n \nGeneral Assembly \nDistr.: General \n10 January 2022 \n \n21-19655* (E)    230822 \n*2119655* \n \n \nSeventy-sixth session \nAgenda item 72 (b) \nElimination of racism, racial discrimination, xenophobia \nand related intolerance: comprehensive implementation of \nand follow-up to the Durban Declaration and Programme \nof Action \n \n \n \n \n Resolution adopted by the General Assembly \non 24 December 2021 \n \n \n \n \n[on the report of the Third Committee (A/76/460, para. 19)] \n \n \n 76/226. A global call for concrete action for the elimination of racism, \nracial discrimination, xenophobia and related intolerance and the \ncomprehensive implementation of and follow-up to the Durban \nDeclaration and Programme of Action \n \n \n \nThe General Assembly, \n \nRecalling all its previous resolutions on the comprehensive follow-up to the \nWorld Conference against Racism, Racial Discrimination, Xenophobia and Related \nIntolerance and the effective implementation of the Durban Declaration and \nProgramme of Action adopted by the World Conference,1 in particular its resolutions \n66/144 of 19 December 2011, 67/155 of 20 December 2012, 74/137 of 18 December \n2019 and 76/1 of 22 September 2021, and in this regard underlining the imperative \nneed for their full and effective implementation, \n \nRecalling also the suffering of the victims of racism, racial discrimination, \nxenophobia and related intolerance, and the need to honour their memory, \n \nCalling upon States to honour the memory of victims of the historical injustices \nof slavery, the slave trade, including the transatlantic slave trade, colonialism and \napartheid, \n \nStressing that the outcome of the World Conference against Racism, Racial \nDiscrimination, Xenophobia and Related Intolerance has the same status as the \noutcomes of all the major United Nations conferences, summits and special sessions \nin the human rights and social fields, and that the Durban Declaration and Programme \n__________________ \n \n* Reissued for technical reasons on 23 August 2022. \n \n1 See A/CONF.189/12 and A/CONF.189/12/Corr.1, chap. I. \n\nA/RES/76/226 \nA global call for concrete action for the elimination of racism, racial \ndiscrimination, xenophobia and related intolerance and the \ncomprehensive implementation of and follow-up to the Durban \nDeclaration and Programme of Action\n \n21-19655\n2/9 \n \nof Action remains a solid basis and the only instructive outcome of the World \nConference, which prescribes comprehensive measures for combating all the scourges \nof racism and adequate remedies for victims, and noting with concern the lack of \neffective implementation thereof, \n \nAlarmed at the global rise in hate speech, constituting incitement to racial \ndiscrimination, hostility and violence, stressing the importance of addressing it, and \nin this regard noting the issuance of the United Nations Guidance Note on Addressing \nand Countering COVID-19-related Hate Speech on 11 May 2020, \n \nUnderlining the need to promote tolerance, inclusion and respect for diversity \nand the need to seek common ground among and within civilizations in order to \naddress common challenges to humanity that threaten shared values, universal human \nrights and the fight against racism, racial discrimination, xenophobia and related \nintolerance, through cooperation, partnership and inclusion, \n \nAlarmed at the spread in many parts of the world of various racist extremist \nmovements based on ideologies that seek to promote nationalist, right-wing agendas \nand racial superiority, and stressing that these practices fuel racism, racial \ndiscrimination, xenophobia and related intolerance, \n \nDeploring the ongoing and resurgent scourges of racism, racial discrimination, \nxenophobia and related intolerance in many regions of the world, often targeting \nmigrants and refugees, as well as people of African descent, expressing concern that \nsome political leaders and parties have supported such an environment, and in this \ncontext expressing its support for migrants and refugees in the context of the severe \ndiscrimination that they may face, \n \nReaffirming the necessity of eliminating racial discrimination against migrants, \nincluding migrant workers, in relation to issues such as employment, social services, \nincluding education and health, and access to justice, and that their treatment must be \nin accordance with international human rights instruments and free from racism, \nracial discrimination, xenophobia and related intolerance, \n \nDeploring the recent incidents of excessive use of force and other human rights \nviolations by law enforcement officers against peaceful demonstrators defending the \nrights of Africans and of people of African descent, and recalling Human Rights \nCouncil resolutions 43/1 of 19 June 2020, 2 44/20 of 17 July 2020 3 and 47/21 of \n13 July 2021,4 \n \nRecognizing that racism, racial discrimination, xenophobia and related intolerance \nhave a deep negative impact on the enjoyment of human rights, and therefore require \na united and comprehensive response from the international community, \n \nExpressing concern at the loss of life and livelihoods and the disruption to \neconomies and societies by the coronavirus disease (COVID-19) pandemic, and its \nnegative impact on the enjoyment of human rights around the world, \ndisproportionately affecting certain individuals, including those facing racism, racial \ndiscrimination, xenophobia and related intolerance, which the pandemic has \nhighlighted and exposed, including underlying deep and long-standing structural \ninequalities and fundamental problems in various areas of social, economic, civil and \npolitical life, and its exacerbation of existing inequalities, and recalling that systemic \nand structural racism and racial discrimination further exacerbate inequality in access \nto health care and treatment, leading to racial disparities in health outcomes and a \n__________________ \n \n2 See Official Records of the General Assembly, Seventy-fifth Session, Supplement No. 53 \n(A/75/53), chap. IV, sect. A. \n \n3 Ibid., chap. V, sect. A. \n \n4 Ibid., Seventy-sixth Session, Supplement No. 53 (A/76/53), chap. VII, sect. A. \n\nA global call for concrete action for the elimination of racism, racial \ndiscrimination, xenophobia and related intolerance and the \ncomprehensive implementation of and follow-up to the Durban \nDeclaration and Programme of Action \nA/RES/76/226\n \n3/9\n21-19655 \n \nhigher rate of mortality and morbidity among individuals and groups facing racial \ndiscrimination, \n \nNoting with concern the disproportionate impact of the COVID-19 pandemic on \nthe existing inequalities within our societies and regret that, in that context, persons \nbelonging to racial and ethnic minorities and to other groups, including Asians and \npeople of Asian descent, especially women and girls, have been victims of racist \nviolence, threats of violence, discrimination and stigmatization, \n \nRecalling the three Decades for Action to Combat Racism and Racial \nDiscrimination previously declared by the General Assembly, and regretting that the \nProgrammes of Action for those Decades were not fully implemented and that their \nobjectives have yet to be attained, \n \nReiterating that all human beings are born free and equal in dignity and rights \nand have the potential to contribute constructively to the development and well-being \nof their societies, and that any doctrine of racial superiority is scientifically false, \nmorally condemnable, socially unjust and dangerous and must be rejected, together \nwith theories that attempt to determine the existence of separate human races, \n \nUnderlining the intensity, magnitude and organized nature of slavery and the \nslave trade, including the transatlantic slave trade, and the associated historical \ninjustices, as well as the untold suffering caused by colonialism and apartheid, and \nthat Africans and people of African descent, Asians and people of Asian descent and \nindigenous peoples continue to be victims, and acknowledging that the ongoing \neffects must be remedied, \n \nAcknowledging the efforts and initiatives undertaken by States to prohibit racial \ndiscrimination and racial segregation and to engender the full enjoyment of economic, \nsocial and cultural rights, as well as civil and political rights, \n \nEmphasizing that, despite efforts in this regard, millions of human beings \ncontinue to be victims of racism, racial discrimination, xenophobia and related \nintolerance, including their contemporary forms and manifestations, some of which \nmanifest in violent forms, \n \nWelcoming the efforts made by civil society in support of the follow-up \nmechanisms in the implementation of the Durban Declaration and Programme of \nAction, \n \nRecalling the appointment of the five independent eminent experts by the \nSecretary-General on 16 June 2003, pursuant to General Assembly resolution 56/266 \nof 27 March 2002, with the mandate to follow up on the implementation of the \nprovisions of the Durban Declaration and Programme of Action and to make \nappropriate recommendations thereon, \n \nUnderlining the primacy of the political will, international cooperation and \nadequate funding at the national, regional and international levels needed to address \nall forms and manifestations of racism, racial discrimination, xenophobia and related \nintolerance for the successful implementation of the Durban Declaration and \nProgramme of Action, \n \nRecalling its resolution 2142 (XXI) of 26 October 1966, in which it proclaimed \n21 March as the International Day for the Elimination of Racial Discrimination, \n \nRecalling also its resolution 62/122 of 17 December 2007, in which it \ndesignated 25 March as the annual International Day of Remembrance of the Victims \nof Slavery and the Transatlantic Slave Trade, \n \nRecalling further, in the above context, the erection of the permanent memorial \nfor the victims of slavery and the slave trade, including the transatlantic slave trade, \n\nA/RES/76/226 \nA global call for concrete action for the elimination of racism, racial \ndiscrimination, xenophobia and related intolerance and the \ncomprehensive implementation of and follow-up to the Durban \nDeclaration and Programme of Action\n \n21-19655\n4/9 \n \nthe Ark of Return, based on the theme \u201cAcknowledge the tragedy, consider the legacy, \nlest we forget\u201d, \n \nWelcoming the call upon all the former colonial Powers for reparations, \nconsistent with paragraphs 157 and 158 of the Durban Programme of Action, to \nredress the historical injustices of slavery and the slave trade, including the \ntransatlantic slave trade, \n \nRecognizing and affirming that the global fight against racism, racial \ndiscrimination, xenophobia and related intolerance and all their abhorrent and \ncontemporary forms and manifestations is a matter of priority for the international \ncommunity, \n \nI \nInternational Convention on the Elimination of All Forms of Racial Discrimination \n \n \n1. \nReaffirms the paramount importance of universal adherence to and the full \nand effective implementation of the International Convention on the Elimination of \nAll Forms of Racial Discrimination, 5  adopted by the General Assembly in its \nresolution 2106 A (XX) of 21 December 1965, in addressing the scourges of racism \nand racial discrimination; \n \n2. \nCalls upon States that have not done so to accede to and/or ratify the \nConvention, and States parties to consider making the declaration under article 14 of \nthe Convention, as well as to consider withdrawing reservations to article 4 of the \nConvention, as a matter of urgency, and to consider withdrawing reservations that are \nincompatible with the object and purpose of the Convention; \n \n3. \nUnderlines, in the above context, that the provisions of the Convention do \nnot respond effectively to contemporary manifestations of racial discrimination, in \nparticular in relation to xenophobia and related intolerance, which is recognized as \nthe rationale behind the convening of the World Conference against Racism, Racial \nDiscrimination, Xenophobia and Related Intolerance in 2001; \n \n4. \nTakes note of the acknowledgement by the Human Rights Council and its \nsubsidiary structures of the existence of both procedural and substantive gaps in the \nConvention, which must be filled as a matter of urgency, necessity and priority; \n \n5. \nExpresses its concern at the lack of progress in the elaboration of \ncomplementary standards to the Convention to fill existing gaps through the \ndevelopment of new normative standards aimed at combating all forms of \ncontemporary and resurgent scourges of racism; \n \n6. \nRecalls Human Rights Council resolution 34/36 of 24 March 2017,6 in \nwhich the Council requested the Chair-Rapporteur of the Ad Hoc Committee on the \nElaboration of Complementary Standards to the International Convention on the \nElimination of All Forms of Racial Discrimination to ensure the commencement of \nthe negotiations on the draft additional protocol to the Convention criminalizing acts \nof a racist and xenophobic nature during the tenth session of the Ad Hoc Committee; \n \n7. \nRequests the Chair-Rapporteur of the Ad Hoc Committee on the \nElaboration of Complementary Standards to present a progress report to the General \nAssembly at its seventy-seventh session; \n \n__________________ \n \n5 United Nations, Treaty Series, vol. 660, No. 9464. \n \n6 See Official Records of the General Assembly, Seventy-second Session, Supplement No. 53 \n(A/72/53), chap. IV, sect. A. \n\nA global call for concrete action for the elimination of racism, racial \ndiscrimination, xenophobia and related intolerance and the \ncomprehensive implementation of and follow-up to the Durban \nDeclaration and Programme of Action \nA/RES/76/226\n \n5/9\n21-19655 \n \nII \nInternational Decade for People of African Descent \n \n \n8. \nRecalls the proclamation of the International Decade for People of African \nDescent, as contained in its resolution 68/237 of 23 December 2013, and the \ncelebratory launch of the Decade on 10 December 2014; \n \n9. \nAlso recalls the programme of activities for the International Decade for \nPeople of African Descent, in which it was recommended that a forum on people of \nAfrican descent be established and that consideration be given to the elaboration of a \ndraft United Nations declaration on the promotion and full respect of the human rights \nof people of African descent; \n \n10. Requests the Intergovernmental Working Group on the Effective \nImplementation of the Durban Declaration and Programme of Action to devote at \nleast half of its annual session to the elaboration of a draft United Nations declaration \non the promotion and full respect of the human rights of people of African descent; \n \n11. \nInvites the Permanent Forum of People of African Descent and the Working \nGroup of Experts on People of African Descent, in accordance with their respective \nmandates, to contribute to the elaboration of a draft United Nations declaration on the \npromotion and full respect of the human rights of people of African descent; \n \n12. Recalls the draft programme of action for the International Decade for \nPeople of African Descent as an instructive framework in which all the initiatives \naimed at improving the quality of life of people of African descent are anchored and \nwhich, if adopted, would contribute to the programme of activities for the \nimplementation of the International Decade for People of African Descent; \n \n13. Takes note of the reports of the Secretary-General on the programme of \nactivities for the implementation of the International Decade for People of African \nDescent7 and on a global call for concrete action for the total elimination of racism, \nracial discrimination, xenophobia and related intolerance and the comprehensive \nimplementation of and follow-up to the Durban Declaration and Programme of \nAction;8 \n \n14. Acknowledges and profoundly regrets the untold suffering and evils \ninflicted on millions of men and women and children as a result of slavery, the slave \ntrade, the transatlantic slave trade, colonialism, apartheid, genocide and past \ntragedies, noting that some States have taken the initiative to apologize and have paid \nreparations, where appropriate, for grave and massive violations committed, further \ncalls upon those that have not yet expressed remorse or presented apologies to find \nsome way to contribute to the restoration of the dignity of victims, and calls upon all \nthe relevant States that have not already done so to dispense reparatory justice, \ncontributing to the development and recognition of the dignity of the affected States \nand their people; \n \n15. Takes note of the report of the Working Group of Experts on People of \nAfrican Descent, 9  invites the Human Rights Council, through the Chair of the \nWorking Group, to continue to submit a report on the work of the Working Group to \nthe General Assembly, and in this regard invites the Chair of the Working Group to \nengage in an interactive dialogue with the Assembly under the item entitled \n\u201cElimination of racism, racial discrimination, xenophobia and related intolerance\u201d at \nits seventy-seventh session; \n__________________ \n \n7 A/76/322. \n \n8 A/75/561. \n \n9 A/76/302. \n\nA/RES/76/226 \nA global call for concrete action for the elimination of racism, racial \ndiscrimination, xenophobia and related intolerance and the \ncomprehensive implementation of and follow-up to the Durban \nDeclaration and Programme of Action\n \n21-19655\n6/9 \n \n \n16. Takes note with appreciation of the proclamation of 31 August as the \nInternational Day for People of African Descent; \n \n17. Welcomes the establishment of the Permanent Forum of People of African \nDescent as a consultation mechanism for people of African descent and other relevant \nstakeholders as a platform for improving the safety and quality of life and livelihoods \nof people of African descent, as well as an advisory body to the Human Rights \nCouncil, and to contribute to elaborating a draft United Nations declaration on the \npromotion and full respect of the human rights of people of African descent, and \nrequests the Secretary-General and the United Nations High Commissioner for \nHuman Rights to strengthen the substantive support to the Forum in order to fulfil its \nmandate; \n \n18. Stresses that everyone, including people and communities of African \ndescent, should be able to participate in an inclusive manner and guide the design and \nimplementation of processes that contribute to halting, reversing and repairing the \nlasting consequences and ongoing manifestations of systemic racism, and notably \nacknowledges the important role that young people have played and should continue \nto play in these processes; \n \n19. Encourages States to examine the extent and impact of systemic racism \nand to adopt effective legal, policy and institutional measures that address racism \nbeyond a summation of individualized acts, and recommends that progress be \nmeasured according to indicators grounded in impact rather than intent; \n \n20. Welcomes the establishment of an international independent expert \nmechanism, comprising three experts with law enforcement and human rights \nexpertise, aimed at furthering transformative change for racial justice and equality in \nthe context of law enforcement globally, especially where relating to the legacies of \ncolonialism and the transatlantic slave trade in enslaved Africans, to investigate the \nresponses of Governments to peaceful anti-racism protests and all violations of \ninternational human rights law and to contribute to accountability and redress for \nvictims; \n \n21. Requests the Office of the United Nations High Commissioner for Human \nRights and the Department of Global Communications of the Secretariat to continue \nawareness-raising efforts and public information campaigns in support of the \nInternational Decade for People of African Descent through the use of social networks \nand digital media, including the wide distribution of user-friendly, concise and \naccessible versions of material in this regard; \n \nIII \nOffice of the United Nations High Commissioner for Human Rights \n \n \n22. Requests the Secretary-General and the Office of the United Nations High \nCommissioner for Human Rights to provide the resources necessary for the effective \nfulfilment of the mandates of the Intergovernmental Working Group on the Effective \nImplementation of the Durban Declaration and Programme of Action, the Working \nGroup of Experts on People of African Descent, the Group of Independent Eminent \nExperts on the Implementation of the Durban Declaration and Programme of Action, \nthe Ad Hoc Committee on the Elaboration of Complementary Standards and the \nPermanent Forum of People of African Descent, and in this regard to ensure the \nparticipation of experts in each session of those follow-up mechanisms in order to \nprovide advice on the specific issues under discussion and assist the mechanisms in \ntheir deliberations and the adoption of action-oriented recommendations in relation \nto the implementation of the Declaration and Programme of Action; \n\nA global call for concrete action for the elimination of racism, racial \ndiscrimination, xenophobia and related intolerance and the \ncomprehensive implementation of and follow-up to the Durban \nDeclaration and Programme of Action \nA/RES/76/226\n \n7/9\n21-19655 \n \n \n23. Recalls Human Rights Council resolutions 43/1 and 47/21, and welcomes \nthe report of the United Nations High Commissioner for Human Rights on the \npromotion and protection of the human rights and fundamental freedoms of Africans \nand of people of African descent against excessive use of force and other human rights \nviolations by law enforcement officers and the annex thereto, entitled \u201cFour-point \nAgenda towards Transformative Change for Racial Justice and Equality\u201d, submitted \npursuant to resolution 43/1;10 \n \n24. Stresses the importance of consolidating all efforts aimed at combating \nracism under a single anti-racial discrimination unit, including on the issues of racial \nequality and justice; \n \nIV \nGroup of Independent Eminent Experts on the Implementation of the Durban \nDeclaration and Programme of Action \n \n \n25. Recalls the report of the Group of Independent Eminent Experts on the \nImplementation of the Durban Declaration and Programme of Action on its sixth \nsession,11 and in this regard notes that the session, which included private and public \nsessions, was held in Geneva from 6 to 10 May 2019; \n \nV \nTrust fund for the Programme for the Decade for Action to Combat Racism \nand Racial Discrimination \n \n \n26. Recalls the establishment by the Secretary-General, in 1973, of the trust \nfund for the Programme for the Decade for Action to Combat Racism and Racial \nDiscrimination as a funding mechanism that has been utilized for the implementation \nof the activities of the three Decades for Action to Combat Racism and Racial \nDiscrimination declared by the General Assembly, and in this regard appreciates the \nfact that the trust fund has also been utilized for the subsequent programmes and \noperational activities transcending the three Decades; \n \n27. Requests the Secretary-General to include, in his report on the \nimplementation of the present resolution to the General Assembly at its seventy-\nseventh session, a section outlining the progress in the implementation of paragraph 18 \nof its resolution 68/151 of 18 December 2013 regarding the revitalization of the trust \nfund for the purpose of ensuring the successful implementation of the activities of the \nInternational Decade for People of African Descent and enhancing the effectiveness \nof the comprehensive follow-up to the World Conference against Racism, Racial \nDiscrimination, \nXenophobia \nand \nRelated \nIntolerance \nand \nthe \neffective \nimplementation of the Durban Declaration and Programme of Action; \n \n28. Strongly \nappeals \nto \nall \nGovernments, \nintergovernmental \nand \nnon-governmental organizations and individuals, as well as other donors in a position \nto do so, to contribute generously to the trust fund, and to that end requests the \nSecretary-General to continue to undertake appropriate contacts and initiatives to \nencourage contributions; \n \nVI \nSpecial Rapporteur of the Human Rights Council on contemporary forms of \nracism, racial discrimination, xenophobia and related intolerance \n \n \n29. Takes note of the report of the Special Rapporteur of the Human Rights \nCouncil on contemporary forms of racism, racial discrimination, xenophobia and \n__________________ \n \n10 A/HRC/47/53. \n \n11 See A/74/173. \n\nA/RES/76/226 \nA global call for concrete action for the elimination of racism, racial \ndiscrimination, xenophobia and related intolerance and the \ncomprehensive implementation of and follow-up to the Durban \nDeclaration and Programme of Action\n \n21-19655\n8/9 \n \nrelated intolerance,12 and encourages the Special Rapporteur, within her mandate, to \ncontinue to focus on the issues of racism, racial discrimination, xenophobia and \nrelated intolerance and incitement to hatred, which impede peaceful coexistence and \nharmony within societies, and to submit reports in this regard to the Human Rights \nCouncil and the General Assembly; \n \n30. Reiterates its previous requests to the Special Rapporteur to consider \nexamining national models of mechanisms that measure racial equality and their value \nadded in the eradication of racial discrimination and to report on such challenges, \nsuccesses and best practices in her next report, and expresses concern at the lack of \nprogress in this regard; \n \nVII \nCommemoration of the twentieth anniversary of the adoption of the Durban \nDeclaration and Programme of Action \n \n \n31. Welcomes the convening of a one-day high-level meeting of the General \nAssembly to commemorate the twentieth anniversary of the adoption of the Durban \nDeclaration and Programme of Action on 22 September 2021, on the theme \n\u201cReparations, racial justice and equality for people of African descent\u201d, and the \nadoption of a political declaration aimed at mobilizing political will at the national, \nregional and international levels for the full and effective implementation of the \nDurban Declaration and Programme of Action and its follow-up processes;13 \n \n32. Emphasizes the critical importance of increasing public support for the \nDurban Declaration and Programme of Action and the participation of civil society \nand other relevant stakeholders in its realization; \n \n33. Invites Member States, United Nations entities, international and regional \norganizations, civil society, including non-governmental organizations, and other \nstakeholders to organize and support various high-visibility initiatives, aimed at \neffectively increasing awareness at all levels, to commemorate the twentieth \nanniversary of the adoption of the Durban Declaration and Programme of Action; \n \n34. Requests the Secretary-General to establish a programme of outreach, with \nthe involvement of Member States and United Nations funds and programmes, as well \nas civil society, including non-governmental organizations, to appropriately \ncommemorate the twentieth anniversary of the adoption of the Durban Declaration \nand Programme of Action; \n \n35. Calls upon Member States and the United Nations system to intensify \nefforts to widely distribute copies of the Durban Declaration and Programme of \nAction, and encourages efforts to ensure its translation and wide dissemination; \n \n36. Expresses its appreciation for the continuing work of the mechanisms \nmandated to follow up on the World Conference and the Durban Review Conference; \n \nVIII \nFollow-up and implementation activities \n \n \n37. Acknowledges the guidance and leadership role of the Human Rights \nCouncil, and encourages it to continue to oversee the implementation of the Durban \nDeclaration and Programme of Action and the outcome document of the Durban \nReview Conference; \n__________________ \n \n12 A/76/369. \n \n13 Political declaration entitled \u201cUnited against racism, racial discrimination, xenophobia and \nrelated intolerance\u201d (resolution 76/1). \n\nA global call for concrete action for the elimination of racism, racial \ndiscrimination, xenophobia and related intolerance and the \ncomprehensive implementation of and follow-up to the Durban \nDeclaration and Programme of Action \nA/RES/76/226\n \n9/9\n21-19655 \n \n \n38. Requests the Office of the United Nations High Commissioner for Human \nRights to continue to provide the Human Rights Council with all the support \nnecessary for it to achieve its objectives in this regard; \n \n39. Requests the Human Rights Council to consider, at its fifty-first session, \nthe question of developing a multi-year programme of activities to provide for the \nrenewed and strengthened outreach activities needed to inform and mobilize the \nglobal public in support of the Durban Declaration and Programme of Action and to \nstrengthen awareness of the contribution that they have made in the struggle against \nracism, racial discrimination, xenophobia and related intolerance, in consultation with \nMember States, national human rights institutions, relevant civil society organizations \nand United Nations agencies, funds and programmes; \n \n40. Welcomes the efforts undertaken by the Human Rights Council, through \nits Advisory Committee, in preparing a study on appropriate ways and means of \nassessing the situation regarding racial equality, while identifying possible gaps and \noverlaps; \n \n41. Takes note with appreciation of the special meeting of the Economic and \nSocial Council on the theme \u201cReimagining equality: eliminating racism, xenophobia \nand discrimination for all in the decade of action for the Sustainable Development \nGoals\u201d, held on 18 February 2021; \n \n42. Welcomes the commemorative plenary meeting of the General Assembly \nheld on 21 March 2021 to mark the International Day for the Elimination of Racial \nDiscrimination, on \u201cYouth standing up against racism\u201d; \n \n43. Takes note with appreciation of the commemorative plenary meeting of \nthe General Assembly held on 25 March 2021 to mark the International Day of \nRemembrance of the Victims of Slavery and the Transatlantic Slave Trade; \n \n44. Also takes note with appreciation of the commemorative activities from \n31 August to 4 September 2021 in San Jos\u00e9 and Cahuita, Costa Rica, to mark the first-\never International Day for People of African Descent; \n \n45. Requests the Secretary-General to submit to the General Assembly at its \nseventy-seventh session a report on the implementation of the present resolution; \n \n46. Requests the President of the General Assembly and the President of the \nHuman Rights Council to continue to convene annual commemorative meetings of \nthe Assembly and the Council during the commemoration of the International Day for \nthe Elimination of Racial Discrimination, with the appropriate focus and themes, and \nin this context encourages the participation of eminent personalities active in the \nstruggle against racial discrimination, Member States and civil society organizations \nin accordance with the rules of procedure of the Assembly and the Council, \nrespectively; \n \n47. Decides to remain seized of this priority matter at its seventy-seventh \nsession under the item entitled \u201cElimination of racism, racial discrimination, \nxenophobia and related intolerance\u201d. \n \n54th (resumed) plenary meeting \n24 December 2021 \n \n",
  "paragraphs": {
    "1": "Reaffirms the paramount importance of universal adherence to and the full and effective implementation of the International Convention on the Elimination of All Forms of Racial Discrimination, 5 adopted by the General Assembly in its resolution 2106 A (XX) of 21 December 1965, in addressing the scourges of racism and racial discrimination;",
    "2": "Calls upon States that have not done so to accede to and/or ratify the Convention, and States parties to consider making the declaration under article 14 of the Convention, as well as to consider withdrawing reservations to article 4 of the Convention, as a matter of urgency, and to consider withdrawing reservations that are incompatible with the object and purpose of the Convention;",
    "3": "Underlines, in the above context, that the provisions of the Convention do not respond effectively to contemporary manifestations of racial discrimination, in particular in relation to xenophobia and related intolerance, which is recognized as the rationale behind the convening of the World Conference against Racism, Racial Discrimination, Xenophobia and Related Intolerance in 2001;",
    "4": "Takes note of the acknowledgement by the Human Rights Council and its subsidiary structures of the existence of both procedural and substantive gaps in the Convention, which must be filled as a matter of urgency, necessity and priority;",
    "5": "Expresses its concern at the lack of progress in the elaboration of complementary standards to the Convention to fill existing gaps through the development of new normative standards aimed at combating all forms of contemporary and resurgent scourges of racism;",
    "6": "Recalls Human Rights Council resolution 34/36 of 24 March 2017,6 in which the Council requested the Chair-Rapporteur of the Ad Hoc Committee on the Elaboration of Complementary Standards to the International Convention on the Elimination of All Forms of Racial Discrimination to ensure the commencement of the negotiations on the draft additional protocol to the Convention criminalizing acts of a racist and xenophobic nature during the tenth session of the Ad Hoc Committee;",
    "7": "Requests the Chair-Rapporteur of the Ad Hoc Committee on the Elaboration of Complementary Standards to present a progress report to the General Assembly at its seventy-seventh session; II International Decade for People of African Descent",
    "8": "Recalls the proclamation of the International Decade for People of African Descent, as contained in its resolution 68/237 of 23 December 2013, and the celebratory launch of the Decade on 10 December 2014;",
    "9": "Also recalls the programme of activities for the International Decade for People of African Descent, in which it was recommended that a forum on people of African descent be established and that consideration be given to the elaboration of a draft United Nations declaration on the promotion and full respect of the human rights of people of African descent;",
    "10": "Requests the Intergovernmental Working Group on the Effective Implementation of the Durban Declaration and Programme of Action to devote at least half of its annual session to the elaboration of a draft United Nations declaration on the promotion and full respect of the human rights of people of African descent;",
    "11": "Invites the Permanent Forum of People of African Descent and the Working Group of Experts on People of African Descent, in accordance with their respective mandates, to contribute to the elaboration of a draft United Nations declaration on the promotion and full respect of the human rights of people of African descent;",
    "12": "Recalls the draft programme of action for the International Decade for People of African Descent as an instructive framework in which all the initiatives aimed at improving the quality of life of people of African descent are anchored and which, if adopted, would contribute to the programme of activities for the implementation of the International Decade for People of African Descent;",
    "13": "Takes note of the reports of the Secretary-General on the programme of activities for the implementation of the International Decade for People of African Descent7 and on a global call for concrete action for the total elimination of racism, racial discrimination, xenophobia and related intolerance and the comprehensive implementation of and follow-up to the Durban Declaration and Programme of Action;8",
    "14": "Acknowledges and profoundly regrets the untold suffering and evils inflicted on millions of men and women and children as a result of slavery, the slave trade, the transatlantic slave trade, colonialism, apartheid, genocide and past tragedies, noting that some States have taken the initiative to apologize and have paid reparations, where appropriate, for grave and massive violations committed, further calls upon those that have not yet expressed remorse or presented apologies to find some way to contribute to the restoration of the dignity of victims, and calls upon all the relevant States that have not already done so to dispense reparatory justice, contributing to the development and recognition of the dignity of the affected States and their people;",
    "15": "Takes note of the report of the Working Group of Experts on People of African Descent, 9 invites the Human Rights Council, through the Chair of the Working Group, to continue to submit a report on the work of the Working Group to the General Assembly, and in this regard invites the Chair of the Working Group to engage in an interactive dialogue with the Assembly under the item entitled \u201cElimination of racism, racial discrimination, xenophobia and related intolerance\u201d at its seventy-seventh session;",
    "16": "Takes note with appreciation of the proclamation of 31 August as the International Day for People of African Descent;",
    "17": "Welcomes the establishment of the Permanent Forum of People of African Descent as a consultation mechanism for people of African descent and other relevant stakeholders as a platform for improving the safety and quality of life and livelihoods of people of African descent, as well as an advisory body to the Human Rights Council, and to contribute to elaborating a draft United Nations declaration on the promotion and full respect of the human rights of people of African descent, and requests the Secretary-General and the United Nations High Commissioner for Human Rights to strengthen the substantive support to the Forum in order to fulfil its mandate;",
    "18": "Stresses that everyone, including people and communities of African descent, should be able to participate in an inclusive manner and guide the design and implementation of processes that contribute to halting, reversing and repairing the lasting consequences and ongoing manifestations of systemic racism, and notably acknowledges the important role that young people have played and should continue to play in these processes;",
    "19": "Encourages States to examine the extent and impact of systemic racism and to adopt effective legal, policy and institutional measures that address racism beyond a summation of individualized acts, and recommends that progress be measured according to indicators grounded in impact rather than intent;",
    "20": "Welcomes the establishment of an international independent expert mechanism, comprising three experts with law enforcement and human rights expertise, aimed at furthering transformative change for racial justice and equality in the context of law enforcement globally, especially where relating to the legacies of colonialism and the transatlantic slave trade in enslaved Africans, to investigate the responses of Governments to peaceful anti-racism protests and all violations of international human rights law and to contribute to accountability and redress for victims;",
    "21": "Requests the Office of the United Nations High Commissioner for Human Rights and the Department of Global Communications of the Secretariat to continue awareness-raising efforts and public information campaigns in support of the International Decade for People of African Descent through the use of social networks and digital media, including the wide distribution of user-friendly, concise and accessible versions of material in this regard; III Office of the United Nations High Commissioner for Human Rights",
    "22": "",
    "23": "Recalls Human Rights Council resolutions 43/1 and 47/21, and welcomes the report of the United Nations High Commissioner for Human Rights on the promotion and protection of the human rights and fundamental freedoms of Africans and of people of African descent against excessive use of force and other human rights violations by law enforcement officers and the annex thereto, entitled \u201cFour-point Agenda towards Transformative Change for Racial Justice and Equality\u201d, submitted pursuant to resolution 43/1;10",
    "24": "Stresses the importance of consolidating all efforts aimed at combating racism under a single anti-racial discrimination unit, including on the issues of racial equality and justice; IV Group of Independent Eminent Experts on the Implementation of the Durban Declaration and Programme of Action",
    "25": "Recalls the report of the Group of Independent Eminent Experts on the Implementation of the Durban Declaration and Programme of Action on its sixth session,11 and in this regard notes that the session, which included private and public sessions, was held in Geneva from 6 to 10 May 2019; V Trust fund for the Programme for the Decade for Action to Combat Racism and Racial Discrimination",
    "26": "Recalls the establishment by the Secretary-General, in 1973, of the trust fund for the Programme for the Decade for Action to Combat Racism and Racial Discrimination as a funding mechanism that has been utilized for the implementation of the activities of the three Decades for Action to Combat Racism and Racial Discrimination declared by the General Assembly, and in this regard appreciates the fact that the trust fund has also been utilized for the subsequent programmes and operational activities transcending the three Decades;",
    "27": "Requests the Secretary-General to include, in his report on the implementation of the present resolution to the General Assembly at its seventy- seventh session, a section outlining the progress in the implementation of paragraph 18 of its resolution 68/151 of 18 December 2013 regarding the revitalization of the trust fund for the purpose of ensuring the successful implementation of the activities of the International Decade for People of African Descent and enhancing the effectiveness of the comprehensive follow-up to the World Conference against Racism, Racial Discrimination, Xenophobia and Related Intolerance and the effective implementation of the Durban Declaration and Programme of Action;",
    "28": "Strongly appeals to all Governments, intergovernmental and non-governmental organizations and individuals, as well as other donors in a position to do so, to contribute generously to the trust fund, and to that end requests the Secretary-General to continue to undertake appropriate contacts and initiatives to encourage contributions; VI Special Rapporteur of the Human Rights Council on contemporary forms of racism, racial discrimination, xenophobia and related intolerance",
    "29": "Takes note of the report of the Special Rapporteur of the Human Rights Council on contemporary forms of racism, racial discrimination, xenophobia and related intolerance,12 and encourages the Special Rapporteur, within her mandate, to continue to focus on the issues of racism, racial discrimination, xenophobia and related intolerance and incitement to hatred, which impede peaceful coexistence and harmony within societies, and to submit reports in this regard to the Human Rights Council and the General Assembly;",
    "30": "Reiterates its previous requests to the Special Rapporteur to consider examining national models of mechanisms that measure racial equality and their value added in the eradication of racial discrimination and to report on such challenges, successes and best practices in her next report, and expresses concern at the lack of progress in this regard; VII Commemoration of the twentieth anniversary of the adoption of the Durban Declaration and Programme of Action",
    "31": "Welcomes the convening of a one-day high-level meeting of the General Assembly to commemorate the twentieth anniversary of the adoption of the Durban Declaration and Programme of Action on 22 September 2021, on the theme \u201cReparations, racial justice and equality for people of African descent\u201d, and the adoption of a political declaration aimed at mobilizing political will at the national, regional and international levels for the full and effective implementation of the Durban Declaration and Programme of Action and its follow-up processes;13",
    "32": "Emphasizes the critical importance of increasing public support for the Durban Declaration and Programme of Action and the participation of civil society and other relevant stakeholders in its realization;",
    "33": "Invites Member States, United Nations entities, international and regional organizations, civil society, including non-governmental organizations, and other stakeholders to organize and support various high-visibility initiatives, aimed at effectively increasing awareness at all levels, to commemorate the twentieth anniversary of the adoption of the Durban Declaration and Programme of Action;",
    "34": "Requests the Secretary-General to establish a programme of outreach, with the involvement of Member States and United Nations funds and programmes, as well as civil society, including non-governmental organizations, to appropriately commemorate the twentieth anniversary of the adoption of the Durban Declaration and Programme of Action;",
    "35": "Calls upon Member States and the United Nations system to intensify efforts to widely distribute copies of the Durban Declaration and Programme of Action, and encourages efforts to ensure its translation and wide dissemination;",
    "36": "Expresses its appreciation for the continuing work of the mechanisms mandated to follow up on the World Conference and the Durban Review Conference; VIII Follow-up and implementation activities",
    "37": "Acknowledges the guidance and leadership role of the Human Rights Council, and encourages it to continue to oversee the implementation of the Durban Declaration and Programme of Action and the outcome document of the Durban Review Conference;",
    "38": "Requests the Office of the United Nations High Commissioner for Human Rights to continue to provide the Human Rights Council with all the support necessary for it to achieve its objectives in this regard;",
    "39": "Requests the Human Rights Council to consider, at its fifty-first session, the question of developing a multi-year programme of activities to provide for the renewed and strengthened outreach activities needed to inform and mobilize the global public in support of the Durban Declaration and Programme of Action and to strengthen awareness of the contribution that they have made in the struggle against racism, racial discrimination, xenophobia and related intolerance, in consultation with Member States, national human rights institutions, relevant civil society organizations and United Nations agencies, funds and programmes;",
    "40": "Welcomes the efforts undertaken by the Human Rights Council, through its Advisory Committee, in preparing a study on appropriate ways and means of assessing the situation regarding racial equality, while identifying possible gaps and overlaps;",
    "41": "Takes note with appreciation of the special meeting of the Economic and Social Council on the theme \u201cReimagining equality: eliminating racism, xenophobia and discrimination for all in the decade of action for the Sustainable Development Goals\u201d, held on 18 February 2021;",
    "42": "Welcomes the commemorative plenary meeting of the General Assembly held on 21 March 2021 to mark the International Day for the Elimination of Racial Discrimination, on \u201cYouth standing up against racism\u201d;",
    "43": "Takes note with appreciation of the commemorative plenary meeting of the General Assembly held on 25 March 2021 to mark the International Day of Remembrance of the Victims of Slavery and the Transatlantic Slave Trade;",
    "44": "Also takes note with appreciation of the commemorative activities from 31 August to 4 September 2021 in San Jos\u00e9 and Cahuita, Costa Rica, to mark the first- ever International Day for People of African Descent;",
    "45": "Requests the Secretary-General to submit to the General Assembly at its seventy-seventh session a report on the implementation of the present resolution;",
    "46": "Requests the President of the General Assembly and the President of the Human Rights Council to continue to convene annual commemorative meetings of the Assembly and the Council during the commemoration of the International Day for the Elimination of Racial Discrimination, with the appropriate focus and themes, and in this context encourages the participation of eminent personalities active in the struggle against racial discrimination, Member States and civil society organizations in accordance with the rules of procedure of the Assembly and the Council, respectively;",
    "47": "Decides to remain seized of this priority matter at its seventy-seventh session under the item entitled \u201cElimination of racism, racial discrimination, xenophobia and related intolerance\u201d."
  },
  "agenda_items": [
    "Item 72"
  ],
  "symbol_references": []
}