{
  "symbol": "A/RES/75/15",
  "filename": "A_RES_75_15.pdf",
  "title": "75/15. Cooperation between the United Nations and the Association of Southeast Asian Nations",
  "text": "United Nations \nA/RES/75/15\n \n \nGeneral Assembly \nDistr.: General \n30 November 2020 \n \n20-15857 (E)    071220 \n*2015857* \n \n \nSeventy-fifth session \nAgenda item 130 (q) \nCooperation between the United Nations and regional and \nother organizations: cooperation between the United Nations \nand the Association of Southeast Asian Nations \n \n \n \n \n Resolution adopted by the General Assembly \non 23 November 2020 \n \n \n \n \n[without reference to a Main Committee (A/75/L.25 and A/75/L.25/Add.1)] \n \n \n \n75/15. Cooperation between the United Nations and the Association of \nSoutheast Asian Nations \n \n \n \nThe General Assembly,  \n \nRecalling the aims and purposes of the Association of Southeast Asian Nations, \nas enshrined in the Bangkok Declaration of 8 August 1967, 1 in particular the \nmaintenance of close and beneficial cooperation with existing international and \nregional organizations with similar aims and purposes,  \n \nNoting the purposes and principles enshrined in the Charter of the Association \nof Southeast Asian Nations, which came into force on 15 December 2008, 2 \nparticularly on upholding the Charter of the United Nations and international law,  \n \nNoting with satisfaction that the activities of the Association of Southeast Asian \nNations are consistent with the purposes and principles of the United Nations,  \n \nRecalling all previous resolutions on cooperation between the United Nations \nand the Association of Southeast Asian Nations,3 \n \nRecalling also the fiftieth anniversary of the Association of Southeast Asian \nNations in 2017, under the chairmanship of the Philippines, and its resolution 71/317 \nof 19 July 2017 on the commemoration of the fiftieth anniversary of the Association \nof Southeast Asian Nations,  \n \nEmphasizing the significance of the year 2020 to the comprehensive partnership \nbetween the United Nations and the Association of Southeast Asian Nations as it \nmarks the seventy-fifth anniversary of the United Nations, during which States \n__________________ \n \n1  United Nations, Treaty Series, vol. 1331, No. 22341. \n \n2  Ibid., vol. 2624, No. 46745. \n \n3  Resolutions 57/35, 59/5, 61/46, 63/35, 65/235, 67/110, 69/110, 71/255 and 73/259. \n\nA/RES/75/15 \nCooperation between the United Nations and the \nAssociation of Southeast Asian Nations\n \n20-15857\n2/7 \n \nMembers of the United Nations have strongly reaffirmed their commitment to \nreinvigorated multilateralism to tackle global challenges and strengthen United \nNations partnership with regional and subregional organizations,  \n \nEmphasizing also the significance of the twenty-fifth anniversary of the Beijing \nDeclaration and Platform for Action adopted at the Fourth World Conference on \nWomen4 and the twentieth anniversary of Security Council resolution 1325 (2000) of \n31 October 2000 on women and peace and security, and welcoming in this regard \nefforts and commitments by the Association of Southeast Asian Nations to achieve \ngender equality and the empowerment of all women and girls and to advance the \nwomen and peace and security agenda,  \n \nRecognizing the unprecedented challenges posed by the coronavirus disease \n(COVID-19) pandemic and its adverse impacts on global and regional health, \neconomies, financial markets, trade and social development, while underscoring the \nimportance of intensified international cooperation and multilateral efforts in \nhandling disease outbreaks,  \n \nRecognizing also efforts by the Association of Southeast Asian Nations to \nmaintain unity in responding to the unprecedented global COVID-19 pandemic and \nto enhance cooperation with external partners, including the United Nations, and the \ninternational community in the fight against COVID-19, as well as mitigate the \nmultifaceted impact of the pandemic towards sustainable recovery, and acknowledging \nin this regard the Chairman\u2019s statement on the Association of Southeast Asian Nations \ncollective response to the outbreak of COVID-19 of 15 February 2020, the declaration \nof the special Association of Southeast Asian Nations summit on COVID-19 held on \n14 April 20205 and subsequent measures, including the establishment of the \nAssociation of Southeast Asian Nations COVID-19 Response Fund and the adoption \nof the Comprehensive Recovery Framework and Implementation Plan, \n \nTaking note of the report of the Secretary-General,6 \n \nNoting with satisfaction the progress of the implementation of the Plan of Action \nto Implement the Joint Declaration on Comprehensive Partnership between the United \nNations and the Association of Southeast Asian Nations (2016\u20132020), with more than \n96 per cent of the agreed action lines having been addressed as of October 2020 \ndespite the COVID-19 pandemic, contributing meaningfully to the realization of the \ncommon goals between the United Nations and the Association of Southeast Asian \nNations for peace, stability and sustainable development, \n \nWelcoming the adoption of the Plan of Action to Implement the Joint Declaration \non Comprehensive Partnership between the United Nations and the Association of \nSoutheast Asian Nations (2021\u20132025), which will continue to guide both sides in \nfurther strengthening the comprehensive partnership in the years to come through \nexpanded areas of cross-sectoral cooperation,  \n \nWelcoming also the participation of the Association of Southeast Asian Nations \nin the high-level meetings between the United Nations and regional organizations, as \nwell as the collaboration between the Association of Southeast Asian Nations and the \nEconomic and Social Commission for Asia and the Pacific to promote dialogue and \ncooperation among regional organizations in Asia and the Pacific,  \n \nWelcoming further the briefing by the Secretary-General of the Association of \nSoutheast Asian Nations at the United Nations Security Council, under the Presidency \n__________________ \n \n4  Report of the Fourth World Conference on Women, Beijing, 4\u201315 September 1995 (United Nations \npublication, Sales No. E.96.IV.13), chap. I, resolution 1, annexes I and II. \n \n5  A/74/811, annex. \n \n6  See A/75/345-S/2020/898, sect. II. \n\nCooperation between the United Nations and the  \nAssociation of Southeast Asian Nations \nA/RES/75/15\n \n3/7\n20-15857 \n \nof Viet Nam for the month of January 2020, on the topic \u201cCooperation between the \nUnited Nations and regional and subregional organizations in maintaining \ninternational peace and security: cooperation between the United Nations and the \nAssociation of Southeast Asian Nations\u201d, on 30 January 2020 in New York,  \n \nRecalling the First to Eleventh Summits of the Association of Southeast Asian \nNations and the United Nations and the commitment of the leaders of the Association \nof Southeast Asian Nations and the Secretary-General of the United Nations to further \ndeepen the comprehensive partnership between the two organizations, \n \nWelcoming progress in the implementation of the Kuala Lumpur Declaration on \nthe Association of Southeast Asian Nations 2025: Forging Ahead Together and its \nthree Community Blueprints, and the three Midterm Reviews of the Implementation \nof the Association of Southeast Asian Nations Community Blueprints 2025, \n \nWelcoming also positive progress of the Initiative for Association of Southeast \nAsian Nations Integration Work Plan III and the Master Plan on Association of \nSoutheast Asian Nations Connectivity 2025, adopted at the twenty-eighth Association \nof Southeast Asian Nations Summit, held in Vientiane in September 2016, and \nwelcoming further the adoption of the Hanoi Declaration on the Adoption of the \nInitiative for Association of Southeast Asian Nations Integration Work Plan IV and \nthe Midterm Review of the Implementation of the Master Plan on Association of \nSoutheast Asian Nations Connectivity 2025, at the thirty-seventh Association of \nSoutheast Asian Nations Summit, held by videoconference in November 2020, \n \nRecognizing the efforts of the Association of Southeast Asian Nations to \nstrengthen its institutions, and in this regard recalling the establishment of the \nAssociation of Southeast Asian Nations Community on 31 December 2015,  \n \n1. \nWelcomes the progress towards achieving the implementation of the \nAssociation of Southeast Asian Nations Community Vision 2025, which will ensure \nlasting peace and stability, sustained economic growth, shared prosperity and social \nprogress in the region;  \n \n2. \nReaffirms the commitment of the United Nations and the Association of \nSoutheast Asian Nations to further strengthen the partnership between the two \norganizations, as described in the Memorandum of Understanding signed on \n27 September 2007;  \n \n3. \nRecognizes the efforts of the United Nations and the Association of \nSoutheast Asian Nations to further intensify and strengthen the level of and \nframework for cooperation between the two organizations through, inter alia, the \nimplementation of the Joint Declaration on Comprehensive Partnership between the \nAssociation of Southeast Asian Nations and the United Nations, issued on \n19 November 2011 at the Fourth Summit of the Association of Southeast Asian \nNations and the United Nations, held in Bali, Indonesia, and looks forward to the \nimplementation of the Plan of Action to Implement the Joint Declaration on \nComprehensive Partnership between the Association of Southeast Asian Nations and \nthe United Nations (2021\u20132025); \n \n4. \nEncourages the United Nations, including the Economic and Social \nCommission for Asia and the Pacific and other relevant United Nations agencies, to \ncontinue to work closely with the Association of Southeast Asian Nations in \nimplementing the 2030 Agenda for Sustainable Development 7 and the Association of \nSoutheast Asian Nations Community Vision 2025, to promote complementarities and \npartnership between the two to ensure that regional integration efforts in the \nAssociation of Southeast Asian Nations reinforce the attainment of the Sustainable \n__________________ \n \n7  Resolution 70/1. \n\nA/RES/75/15 \nCooperation between the United Nations and the \nAssociation of Southeast Asian Nations\n \n20-15857\n4/7 \n \nDevelopment Goals and vice versa, through implementation of the Complementarities \nRoad Map (2020\u20132025), the decade of action and delivery for sustainable \ndevelopment, the annual High-level Brainstorming Dialogue on Enhancing \nComplementarities between the Association of Southeast Asian Nations Community \nVision 2025 and the 2030 Agenda for Sustainable Development, as well as other \nconcrete activities and projects under the Plan of Action to Implement the Joint \nDeclaration on Comprehensive Partnership (2021\u20132025);  \n \n5. \nWelcomes the launch of the Association of Southeast Asian Nations Centre \nfor Sustainable Development Studies and Dialogue in Thailand on 3 November 2019 \nin order to encourage research and studies, build capacities of States members of the \nAssociation of Southeast Asian Nations as well as enhance cooperation on sustainable \ndevelopment between the Association of Southeast Asian Nations and external \npartners, including the United Nations and related agencies;  \n \n6. \nCommends the President of the General Assembly, the Secretary-General \nof the United Nations, the Ministers for Foreign Affairs of the States members of the \nAssociation of Southeast Asian Nations and the Secretary-General of the Association \nof Southeast Asian Nations for their efforts to hold annual meetings during the regular \nsessions of the General Assembly, with a view to further enhancing the Association \nof Southeast Asian Nations-United Nations partnership, including by reviewing, \noverseeing and directing the implementation of the present resolution;  \n \n7. \nEncourages the United Nations and the Association of Southeast Asian \nNations to continue regular meetings of senior officials, ministerial meetings and \nsummits, and in this regard welcomes the convening of the Eleventh Summit of the \nAssociation of Southeast Asian Nations and the United Nations by videoconference \non 15 November 2020; \n \n8. \nRecalls the successful convening of the Association of Southeast Asian \nNations leaders\u2019 gathering with the Secretary-General of the Association of Southeast \nAsian Nations, the Secretary-General of the United Nations, the Managing Director \nof the International Monetary Fund and the President of the World Bank in Bali, on \n11 October 2018, which reaffirmed the importance of the role of the Association of \nSoutheast Asian Nations in promoting multilateralism, further enhancing existing \ncooperation and forging close cooperation with the International Monetary Fund, the \nWorld Bank and the United Nations to implement the 2030 Agenda for Sustainable \nDevelopment, and in improving the lives of its peoples;  \n \n9. \nEncourages the United Nations to provide strengthened support, including \nthrough exchanges of relevant experiences, information, best practices, lessons \nlearned and capacity-building, based on mutual respect, for the relevant Association \nof Southeast Asian Nations mechanisms and Association of Southeast Asian Nations-\nled arrangements, as appropriate;  \n \n10. Reaffirms the importance of enhancing regional security and cooperation \nand the peaceful settlement of disputes to promote peace, stability and prosperity, in \naccordance with the purposes and principles of the Charter of the United Nations, the \nCharter of the Association of Southeast Asian Nations, the Treaty of Amity and \nCooperation in Southeast Asia8 and international law;  \n \n11. \nSupports the convening of workshops and seminars between the \nAssociation of Southeast Asian Nations and the United Nations to promote dialogue \non regional and global security issues, including conflict prevention, preventive \ndiplomacy, disarmament and non-proliferation, cybersecurity, peacekeeping operations, \ntransnational crime, illicit trafficking in wildlife and timber, counter-terrorism and \n__________________ \n \n8  United Nations, Treaty Series, vol. 1025, No. 15063. \n\nCooperation between the United Nations and the  \nAssociation of Southeast Asian Nations \nA/RES/75/15\n \n5/7\n20-15857 \n \nthe prevention of violent extremism as and when conducive to terrorism, based on \nmutual trust, shared interests and mutual respect;  \n \n12. Encourages cooperation between the United Nations and the Association \nof Southeast Asian Nations to exchange expertise, best practices, lessons learned and \nexperiences and promote capacity-building in countering terrorism and radicalization \nto terrorism and preventing violent extremism as and when conducive to terrorism, as \nwell as in addressing the growing threats of transnational crime and cross-border \nchallenges, which require comprehensive approaches, including through effective \nregional cooperation, in order to foster a more secure, interconnected and prosperous \nAssociation of Southeast Asian Nations community;  \n \n13. Also encourages cooperation between the United Nations and the \nAssociation of Southeast Asian Nations in the field of human rights, particularly \nthrough the Association of Southeast Asian Nations Intergovernmental Commission \non Human Rights and the Association of Southeast Asian Nations Commission on the \nPromotion and Protection of the Rights of Women and Children, based on the \nAssociation of Southeast Asian Nations Human Rights Declaration, the Phnom Penh \nStatement on the Adoption of the Association of Southeast Asian Nations Human \nRights Declaration, the Universal Declaration of Human Rights 9 and other \ninternational human rights instruments and mechanisms to which all of the States \nmembers of the Association of Southeast Asian Nations are parties;  \n \n14. Acknowledges the importance of maritime cooperation, including \nmaritime security cooperation, between the United Nations and the Association of \nSoutheast Asian Nations, including in the form of training workshops and the \nexchange of relevant experiences, information, best practices and lessons learned, to \nfurther promote the rule of law and the implementation of relevant international law, \nincluding the United Nations Convention on the Law of the Sea, 10 and other \ninternational instruments, and underscores the need to further strengthen such \ncooperation in order to address related issues and challenges;  \n \n15. Reiterates the importance of regional integration and enhancement of \nconnectivity in the South-East Asian region and their potential contribution to \nregional and global peace, prosperity and sustainable development, and in this regard \nencourages cooperation between the Association of Southeast Asian Nations and the \nUnited Nations to narrow the development gap within and between the States \nmembers of the Association of Southeast Asian Nations and also encourages support \nby the United Nations in the implementation of the Master Plan on Association of \nSoutheast Asian Nations Connectivity 2025;  \n \n16. Encourages continued efforts and enhanced cooperation between the \nUnited Nations and the Association of Southeast Asian Nations towards deepening \neconomic integration both within the region and in the global economy so as to \npromote mutual benefits through capacity-building and advisory services in the \nimplementation of the Association of Southeast Asian Nations Economic Community \nBlueprint 2025 in areas such as trade, investment, the development of micro-, small \nand medium-sized enterprises, regulatory frameworks, global supply chains and \nresource management;  \n \n17. Also encourages continued partnership of the United Nations in the \nAssociation of Southeast Asian Nations Smart Cities Network, which is part of the \nintegration efforts of the Association that synergize development efforts, promote \ngreater cooperation among member cities, the private sector and external partners, \nspearhead smart city development and sustainable urbanization, with the goal of \n__________________ \n \n9  Resolution 217 A (III). \n \n10  United Nations, Treaty Series, vol. 1833, No. 31363. \n\nA/RES/75/15 \nCooperation between the United Nations and the \nAssociation of Southeast Asian Nations\n \n20-15857\n6/7 \n \nimproving the lives of the citizens of the States members of the Association of \nSoutheast Asian Nations using technology and digital infrastructure as enablers, and \nfacilitate the implementation of the 2030 Agenda and its Sustainable Development \nGoals;  \n \n18. Welcomes the Association of Southeast Asian Nations-led arrangements, \nin particular the meeting of the Ministers of Defence and its relevant mechanisms \nsuch as the Association of Southeast Asian Nations Peacekeeping Centres Network, \nas well as expert working groups on peacekeeping operations of the Association on \nvarious important issues related to peacekeeping operations, including improvement \nin the meaningful participation of women peacekeepers from States members of the \nAssociation of Southeast Asian Nations at all levels and in key positions;  \n \n19. Encourages efforts to develop effective partnerships and promote closer \ncooperation between the United Nations and the Association of Southeast Asian \nNations in peacekeeping, peacebuilding and sustaining peace, by engaging in joint \npeacekeeping and peacebuilding-related activities under the Plan of Action to \nImplement the Joint Declaration on Comprehensive Partnership between the \nAssociation of Southeast Asian Nations and the United Nations (2021\u20132025), and by \ncontinuing to pursue, inter alia, the United Nations Triangular Partnership Project \namong participating States members of the Association, and in the context of the \nAction for Peacekeeping initiative;  \n \n20. Also encourages collaboration between the United Nations and the \nAssociation of Southeast Asian Nations Regional Mine Action Centre, including the \nsharing of expertise and best practices, training and capacity-building activities, in \naddressing the humanitarian aspects of landmines and explosive remnants of war;  \n \n21. Further encourages closer cooperation on disaster risk reduction, \nemergency response and management between the United Nations and the \nAssociation of Southeast Asian Nations in order to ensure an effective response to \nand management of natural disasters, through the adoption and implementation of the \nAssociation of Southeast Asian Nations-United Nations Joint Strategic Plan of Action \non Disaster Management 2021\u20132025, and to enhance the capacity of and technical \nsupport to the Association of Southeast Asian Nations Coordinating Centre for \nHumanitarian Assistance on Disaster Management;  \n \n22. Takes note with appreciation of the ongoing work of the Association of \nSoutheast Asian Nations Coordinating Centre for Humanitarian Assistance on \nDisaster Management in addressing disaster management, emergency response and \nhumanitarian assistance in the region;  \n \n23. Encourages closer cooperation on the culture of peace agenda between the \nUnited Nations and the Association of Southeast Asian Nations, including through the \nsix thrusts of the 2017 Association of Southeast Asian Nations Declaration on Culture \nof Prevention for a Peaceful, Inclusive, Resilient, Healthy and Harmonious Society;  \n \n24. Also encourages further cooperation and collaborative efforts between the \nUnited Nations and the Association of Southeast Asian Nations on addressing \nenvironmental sustainability, climate change, biodiversity conservation, including \nthrough the Association of Southeast Asian Nations Centre for Biodiversity, and the \nprotection, restoration and sustainable use of terrestrial, coastal and marine \necosystems, including the prevention and reduction of marine plastic debris, and \nacknowledges continued cooperation undertaken through the implementation of the \nAssociation of Southeast Asian Nations-United Nations Action Plan on Environment \nand Climate Change (2016\u20132020);  \n \n25. Further encourages the exploration of measures by the United Nations and \nthe Association of Southeast Asian Nations to further the effective and timely \n\nCooperation between the United Nations and the  \nAssociation of Southeast Asian Nations \nA/RES/75/15\n \n7/7\n20-15857 \n \nimplementation of joint activities under the Plan of Action to Implement the Joint \nDeclaration on Comprehensive Partnership (2021\u20132025);  \n \n26. Encourages the conduct of the secretariat-to-secretariat annual review on \nthe implementation of the comprehensive partnership to identify challenges and \ndiscuss practical modalities for the two secretariats to effectively contribute to \nenhancing United Nations and Association of Southeast Asian Nations cooperation, \nand takes note with appreciation of the secretariat-to-secretariat engagements, which \ncontribute to the implementation of the Plan of Action to Implement the Joint \nDeclaration on Comprehensive Partnership (2021\u20132025); \n \n27. Requests the Secretary-General to submit to the General Assembly, at its \nseventy-seventh session, a report on the implementation of the present resolution;  \n \n28. Decides to include in the provisional agenda of its seventy-seventh \nsession, under the item entitled \u201cCooperation between the United Nations and \nregional and other organizations\u201d, the sub-item entitled \u201cCooperation between the \nUnited Nations and the Association of Southeast Asian Nations\u201d.  \n \n30th plenary meeting \n23 November 2020 \n \n",
  "paragraphs": {
    "1": "Welcomes the progress towards achieving the implementation of the Association of Southeast Asian Nations Community Vision 2025, which will ensure lasting peace and stability, sustained economic growth, shared prosperity and social progress in the region;",
    "2": "Reaffirms the commitment of the United Nations and the Association of Southeast Asian Nations to further strengthen the partnership between the two organizations, as described in the Memorandum of Understanding signed on 27 September 2007;",
    "3": "Recognizes the efforts of the United Nations and the Association of Southeast Asian Nations to further intensify and strengthen the level of and framework for cooperation between the two organizations through, inter alia, the implementation of the Joint Declaration on Comprehensive Partnership between the Association of Southeast Asian Nations and the United Nations, issued on 19 November 2011 at the Fourth Summit of the Association of Southeast Asian Nations and the United Nations, held in Bali, Indonesia, and looks forward to the implementation of the Plan of Action to Implement the Joint Declaration on Comprehensive Partnership between the Association of Southeast Asian Nations and the United Nations (2021\u20132025);",
    "4": "Encourages the United Nations, including the Economic and Social Commission for Asia and the Pacific and other relevant United Nations agencies, to continue to work closely with the Association of Southeast Asian Nations in implementing the 2030 Agenda for Sustainable Development 7 and the Association of Southeast Asian Nations Community Vision 2025, to promote complementarities and partnership between the two to ensure that regional integration efforts in the Association of Southeast Asian Nations reinforce the attainment of the Sustainable __________________ 7 Resolution 70/1. A/RES/75/15 Cooperation between the United Nations and the Association of Southeast Asian Nations 20-15857 4/7 Development Goals and vice versa, through implementation of the Complementarities Road Map (2020\u20132025), the decade of action and delivery for sustainable development, the annual High-level Brainstorming Dialogue on Enhancing Complementarities between the Association of Southeast Asian Nations Community Vision 2025 and the 2030 Agenda for Sustainable Development, as well as other concrete activities and projects under the Plan of Action to Implement the Joint Declaration on Comprehensive Partnership (2021\u20132025);",
    "5": "Welcomes the launch of the Association of Southeast Asian Nations Centre for Sustainable Development Studies and Dialogue in Thailand on 3 November 2019 in order to encourage research and studies, build capacities of States members of the Association of Southeast Asian Nations as well as enhance cooperation on sustainable development between the Association of Southeast Asian Nations and external partners, including the United Nations and related agencies;",
    "6": "Commends the President of the General Assembly, the Secretary-General of the United Nations, the Ministers for Foreign Affairs of the States members of the Association of Southeast Asian Nations and the Secretary-General of the Association of Southeast Asian Nations for their efforts to hold annual meetings during the regular sessions of the General Assembly, with a view to further enhancing the Association of Southeast Asian Nations-United Nations partnership, including by reviewing, overseeing and directing the implementation of the present resolution;",
    "7": "Encourages the United Nations and the Association of Southeast Asian Nations to continue regular meetings of senior officials, ministerial meetings and summits, and in this regard welcomes the convening of the Eleventh Summit of the Association of Southeast Asian Nations and the United Nations by videoconference on 15 November 2020;",
    "8": "Recalls the successful convening of the Association of Southeast Asian Nations leaders\u2019 gathering with the Secretary-General of the Association of Southeast Asian Nations, the Secretary-General of the United Nations, the Managing Director of the International Monetary Fund and the President of the World Bank in Bali, on 11 October 2018, which reaffirmed the importance of the role of the Association of Southeast Asian Nations in promoting multilateralism, further enhancing existing cooperation and forging close cooperation with the International Monetary Fund, the World Bank and the United Nations to implement the 2030 Agenda for Sustainable Development, and in improving the lives of its peoples;",
    "9": "Encourages the United Nations to provide strengthened support, including through exchanges of relevant experiences, information, best practices, lessons learned and capacity-building, based on mutual respect, for the relevant Association of Southeast Asian Nations mechanisms and Association of Southeast Asian Nations- led arrangements, as appropriate;",
    "10": "Reaffirms the importance of enhancing regional security and cooperation and the peaceful settlement of disputes to promote peace, stability and prosperity, in accordance with the purposes and principles of the Charter of the United Nations, the Charter of the Association of Southeast Asian Nations, the Treaty of Amity and Cooperation in Southeast Asia8 and international law;",
    "11": "Supports the convening of workshops and seminars between the Association of Southeast Asian Nations and the United Nations to promote dialogue on regional and global security issues, including conflict prevention, preventive diplomacy, disarmament and non-proliferation, cybersecurity, peacekeeping operations, transnational crime, illicit trafficking in wildlife and timber, counter-terrorism and __________________ 8 United Nations, Treaty Series, vol. 1025, No. 15063. Cooperation between the United Nations and the Association of Southeast Asian Nations A/RES/75/15 5/7 20-15857 the prevention of violent extremism as and when conducive to terrorism, based on mutual trust, shared interests and mutual respect;",
    "12": "Encourages cooperation between the United Nations and the Association of Southeast Asian Nations to exchange expertise, best practices, lessons learned and experiences and promote capacity-building in countering terrorism and radicalization to terrorism and preventing violent extremism as and when conducive to terrorism, as well as in addressing the growing threats of transnational crime and cross-border challenges, which require comprehensive approaches, including through effective regional cooperation, in order to foster a more secure, interconnected and prosperous Association of Southeast Asian Nations community;",
    "13": "Also encourages cooperation between the United Nations and the Association of Southeast Asian Nations in the field of human rights, particularly through the Association of Southeast Asian Nations Intergovernmental Commission on Human Rights and the Association of Southeast Asian Nations Commission on the Promotion and Protection of the Rights of Women and Children, based on the Association of Southeast Asian Nations Human Rights Declaration, the Phnom Penh Statement on the Adoption of the Association of Southeast Asian Nations Human Rights Declaration, the Universal Declaration of Human Rights 9 and other international human rights instruments and mechanisms to which all of the States members of the Association of Southeast Asian Nations are parties;",
    "14": "Acknowledges the importance of maritime cooperation, including maritime security cooperation, between the United Nations and the Association of Southeast Asian Nations, including in the form of training workshops and the exchange of relevant experiences, information, best practices and lessons learned, to further promote the rule of law and the implementation of relevant international law, including the United Nations Convention on the Law of the Sea, 10 and other international instruments, and underscores the need to further strengthen such cooperation in order to address related issues and challenges;",
    "15": "Reiterates the importance of regional integration and enhancement of connectivity in the South-East Asian region and their potential contribution to regional and global peace, prosperity and sustainable development, and in this regard encourages cooperation between the Association of Southeast Asian Nations and the United Nations to narrow the development gap within and between the States members of the Association of Southeast Asian Nations and also encourages support by the United Nations in the implementation of the Master Plan on Association of Southeast Asian Nations Connectivity 2025;",
    "16": "Encourages continued efforts and enhanced cooperation between the United Nations and the Association of Southeast Asian Nations towards deepening economic integration both within the region and in the global economy so as to promote mutual benefits through capacity-building and advisory services in the implementation of the Association of Southeast Asian Nations Economic Community Blueprint 2025 in areas such as trade, investment, the development of micro-, small and medium-sized enterprises, regulatory frameworks, global supply chains and resource management;",
    "17": "Also encourages continued partnership of the United Nations in the Association of Southeast Asian Nations Smart Cities Network, which is part of the integration efforts of the Association that synergize development efforts, promote greater cooperation among member cities, the private sector and external partners, spearhead smart city development and sustainable urbanization, with the goal of __________________ 9 Resolution 217 A (III). 10 United Nations, Treaty Series, vol. 1833, No. 31363. A/RES/75/15 Cooperation between the United Nations and the Association of Southeast Asian Nations 20-15857 6/7 improving the lives of the citizens of the States members of the Association of Southeast Asian Nations using technology and digital infrastructure as enablers, and facilitate the implementation of the 2030 Agenda and its Sustainable Development Goals;",
    "18": "Welcomes the Association of Southeast Asian Nations-led arrangements, in particular the meeting of the Ministers of Defence and its relevant mechanisms such as the Association of Southeast Asian Nations Peacekeeping Centres Network, as well as expert working groups on peacekeeping operations of the Association on various important issues related to peacekeeping operations, including improvement in the meaningful participation of women peacekeepers from States members of the Association of Southeast Asian Nations at all levels and in key positions;",
    "19": "Encourages efforts to develop effective partnerships and promote closer cooperation between the United Nations and the Association of Southeast Asian Nations in peacekeeping, peacebuilding and sustaining peace, by engaging in joint peacekeeping and peacebuilding-related activities under the Plan of Action to Implement the Joint Declaration on Comprehensive Partnership between the Association of Southeast Asian Nations and the United Nations (2021\u20132025), and by continuing to pursue, inter alia, the United Nations Triangular Partnership Project among participating States members of the Association, and in the context of the Action for Peacekeeping initiative;",
    "20": "Also encourages collaboration between the United Nations and the Association of Southeast Asian Nations Regional Mine Action Centre, including the sharing of expertise and best practices, training and capacity-building activities, in addressing the humanitarian aspects of landmines and explosive remnants of war;",
    "21": "Further encourages closer cooperation on disaster risk reduction, emergency response and management between the United Nations and the Association of Southeast Asian Nations in order to ensure an effective response to and management of natural disasters, through the adoption and implementation of the Association of Southeast Asian Nations-United Nations Joint Strategic Plan of Action on Disaster Management 2021\u20132025, and to enhance the capacity of and technical support to the Association of Southeast Asian Nations Coordinating Centre for Humanitarian Assistance on Disaster Management;",
    "22": "Takes note with appreciation of the ongoing work of the Association of Southeast Asian Nations Coordinating Centre for Humanitarian Assistance on Disaster Management in addressing disaster management, emergency response and humanitarian assistance in the region;",
    "23": "Encourages closer cooperation on the culture of peace agenda between the United Nations and the Association of Southeast Asian Nations, including through the six thrusts of the 2017 Association of Southeast Asian Nations Declaration on Culture of Prevention for a Peaceful, Inclusive, Resilient, Healthy and Harmonious Society;",
    "24": "Also encourages further cooperation and collaborative efforts between the United Nations and the Association of Southeast Asian Nations on addressing environmental sustainability, climate change, biodiversity conservation, including through the Association of Southeast Asian Nations Centre for Biodiversity, and the protection, restoration and sustainable use of terrestrial, coastal and marine ecosystems, including the prevention and reduction of marine plastic debris, and acknowledges continued cooperation undertaken through the implementation of the Association of Southeast Asian Nations-United Nations Action Plan on Environment and Climate Change (2016\u20132020);",
    "25": "Further encourages the exploration of measures by the United Nations and the Association of Southeast Asian Nations to further the effective and timely Cooperation between the United Nations and the Association of Southeast Asian Nations A/RES/75/15 7/7 20-15857 implementation of joint activities under the Plan of Action to Implement the Joint Declaration on Comprehensive Partnership (2021\u20132025);",
    "26": "Encourages the conduct of the secretariat-to-secretariat annual review on the implementation of the comprehensive partnership to identify challenges and discuss practical modalities for the two secretariats to effectively contribute to enhancing United Nations and Association of Southeast Asian Nations cooperation, and takes note with appreciation of the secretariat-to-secretariat engagements, which contribute to the implementation of the Plan of Action to Implement the Joint Declaration on Comprehensive Partnership (2021\u20132025);",
    "27": "Requests the Secretary-General to submit to the General Assembly, at its seventy-seventh session, a report on the implementation of the present resolution;",
    "28": "Decides to include in the provisional agenda of its seventy-seventh session, under the item entitled \u201cCooperation between the United Nations and regional and other organizations\u201d, the sub-item entitled \u201cCooperation between the United Nations and the Association of Southeast Asian Nations\u201d. 30th plenary meeting 23 November 2020"
  },
  "agenda_items": [
    "Item 130"
  ],
  "symbol_references": [
    "A/75/L.25"
  ]
}