{
  "symbol": "A/RES/80/197",
  "filename": "A_RES_80_197.pdf",
  "title": "80/197. Implementation of the Convention on the Rights of Persons with Disabilities and the Optional Protocol thereto: amplified barriers in diverse contexts",
  "text": "United Nations \nA/RES/80/197 \n \nGeneral Assembly \nDistr.: General \n22 December 2025 \n25-20944 (E) \n*2520944* \n \n \nEightieth session \nAgenda item 71 (a) \nPromotion and protection of human rights: implementation of \nhuman rights instruments \n \n \n \n \n Resolution adopted by the General Assembly \non 17 December 2025 \n \n \n[on the report of the Third Committee (A/80/545, para. 5)] \n \n \n 80/197. Implementation of the Convention on the Rights of Persons with \nDisabilities and the Optional Protocol thereto: amplified barriers \nin diverse contexts \n \n \n \nThe General Assembly, \n \nRecalling its resolution 78/195 of 19 December 2023 and its previous relevant \nresolutions, and relevant resolutions of the Human Rights Council and of the \nEconomic and Social Council and its functional commissions,  \n \nRecalling \nalso \nthe \nuniversality, \nindivisibility, \ninterdependence \nand \ninterrelatedness of all human rights and fundamental freedoms and the need for \npersons with disabilities to be guaranteed the full enjoyment of their rights and \nfreedoms without discrimination,  \n \nReaffirming the Universal Declaration of Human Rights,1 the Convention on the \nRights of Persons with Disabilities 2  and the Optional Protocol thereto, 3  the \nConvention on the Elimination of All Forms of Discrimination against Women, 4 the \nConvention on the Rights of the Child, 5  the International Convention on the \nElimination of All Forms of Racial Discrimination 6  and all other relevant \ninternational human rights instruments, \n_______________ \n \n1 Resolution 217 A (III). \n \n2 United Nations, Treaty Series, vol. 2515, No. 44910. \n \n3 Ibid., vol. 2518, No. 44910. \n \n4 Ibid., vol. 1249, No. 20378. \n \n5 Ibid., vol. 1577, No. 27531. \n \n6 Ibid., vol. 660, No. 9464. \n\nA/RES/80/197 \nImplementation of the Convention on the Rights of Persons with \nDisabilities and the Optional Protocol thereto: amplified barriers in \ndiverse contexts\n \n25-20944\n2/14 \n \n \nRecalling the Vienna Declaration and Programme of Action, 7  the Sendai \nFramework for Disaster Risk Reduction 2015\u201320308 and the New Urban Agenda,9 \n \nReaffirming the 2030 Agenda for Sustainable Development,10 which is inclusive \nof persons with disabilities and in which Member States pledged to leave no one \nbehind, recognizing that the contributions of persons with disabilities are important \nto its full and effective implementation, and acknowledging that Member States, while \nimplementing the 2030 Agenda, should, inter alia, respect, protect, promote and fulfil \nhuman rights and fundamental freedoms for all, without discrimination of any kind, \n \nRecognizing that international cooperation is key for disability-inclusive \ndevelopment, which is needed to ensure that sufficient means of implementation exist \nto provide countries with the opportunity to realize the rights and inclusion of persons \nwith disabilities, in order to achieve the Sustainable Development Goals, \n \nWelcoming the fact that, since the opening for signature of the Convention on \nthe Rights of Persons with Disabilities and the Optional Protocol thereto on 30 March \n2007, 164 States and 1 regional integration organization have signed and 193 States \nand 1 regional integration organization have ratified or acceded to the Convention and \n94 States have signed and 108 States have ratified the Optional Protocol,  \n \nNoting with appreciation the work and activities that have been and continue to \nbe undertaken in support of the Convention and towards the fulfilment and \nmainstreaming of the rights of all persons with disabilities, particularly through, inter \nalia, the Conference of States Parties to the Convention, the Under-Secretary-General \nfor Policy, the Committee on the Rights of Persons with Disabilities, other human \nrights treaty bodies, the Special Rapporteur on the rights of persons with disabilities, \nthe Inter-Agency Support Group on the Convention and the Inter-Agency Standing \nCommittee Task Team on Inclusion of Persons with Disabilities in Humanitarian \nAction,  \n \nNoting the 2025 Global Disability Summit and the Amman-Berlin Declaration \non Global Disability Inclusion, to advance progress towards the full implementation \nof the Convention, \n \nRecalling that persons with disabilities include those who have long-term \nphysical, mental, intellectual, psychosocial or sensory impairments which, in \ninteraction with various barriers, may hinder their full and effective participation in \nsociety on an equal basis with others, including in relation to their access to the \nphysical environment, to transportation, to information and communications, \nincluding information and communications technologies and systems, and to other \nfacilities and services open or provided to the public, in both urban and rural areas, \n \nNoting that diverse contexts may refer to a range of social, environmental, \npolitical, economic and cultural conditions that influence how persons with \ndisabilities experience and access their rights, including but not limited to situations \nof poverty, humanitarian emergencies, armed conflict, post-conflict, environmental \nand climate change-related challenges, forced and internal displacement, rural or \nremote living, neocolonial contexts, migration and refugee contexts, care and support \ncontexts, institutionalization, digital divides, lack of access to justice and quality \ninclusive education, and discrimination based on disability, sex, age, race, colour, \nsocioeconomic status, ethnicity and national or social origin, \n_______________ \n \n7 A/CONF.157/24 (Part I), chap. III. \n \n8 Resolution 69/283, annex II. \n \n9 Resolution 71/256, annex. \n \n10 Resolution 70/1. \n\nImplementation of the Convention on the Rights of Persons with \nDisabilities and the Optional Protocol thereto: amplified barriers in \ndiverse contexts \nA/RES/80/197\n \n3/14\n25-20944 \n \n \nRecognizing that persons with disabilities are often disproportionately affected \nin situations of risk, including situations of armed conflict, humanitarian emergencies \nand the occurrence of natural disasters and in their aftermath, and that they may \nrequire specific protection and safety measures, recognizing further the diversity of \npersons with disabilities and the need to ensure their full, equal, effective and \nmeaningful participation and inclusion in the development of measures and decision-\nmaking processes relating thereto, including on accessibility and reasonable \naccommodation, as well as care and support arrangements, in order to ensure \ndisability-inclusive risk reduction and humanitarian action, and recognizing the \nspecial coping mechanisms developed by persons with disabilities to withstand the \neffects of conflict and natural disasters, as well as their critical contributions to \nconflict prevention, resolution, reconciliation, reconstruction, peacebuilding and \naddressing the root causes of conflict,  \n \nRecognizing also that the rights and needs of persons with disabilities are often \noverlooked in situations of risk, including situations of armed conflict, humanitarian \nemergencies and the occurrence of disasters caused by natural or man-made hazards, \nincluding in the early phases, and the importance of providing timely and appropriate \nprotection, reintegration and rehabilitation assistance and access to assistive \ntechnologies, recognizing the major impediments that developing countries face in \naccessing new technologies, to persons with disabilities, while ensuring that the \ndiversity of persons with disabilities is taken into account and that all their specific \nrights and needs are addressed, in particular those of women and children with \ndisabilities, and persons with intellectual and psychosocial disabilities, such as access \nto affordable, quality, inclusive and accessible healthcare services, care and support \nprogrammes, psychosocial support and educational programmes and livelihoods in an \nequitable and inclusive manner, in order to further promote their role as agents of \nchange, \n \nRecognizing further the particular barriers faced by persons with disabilities in \naccessing justice, including access to effective remedies and, as appropriate, \nreparation, in relation to violations of international law, including international \nhumanitarian law and international human rights law, \n \nRecognizing the negative impact of laws and practices that hinder persons with \ndisabilities or fail to provide them with adequate support in the exercise of their legal \ncapacity on an equal basis with others, which have a negative impact on the enjoyment \nof equality and non\u2011discrimination, and in some cases deny them their right to \neffective access to justice on an equal basis with others or allow for their forced \ninstitutionalization on the basis of a real or perceived disability, \n \nNoting the need for Member States, the United Nations system and other \nstakeholders to further strengthen the normative framework on disability, including \nthe rights of persons with disabilities, in line with the pledge of leaving no one behind \ncontained in the 2030 Agenda for Sustainable Development, and to consider disability \nas a global issue, cutting across the pillars of the United Nations,  \n \nWelcoming progress towards mainstreaming disability, including the rights of \npersons with disabilities, in the work of the United Nations, noting the contributions \nof the Steering Committee on Accessibility and of the United Nations Global \nDisability Fund, as well as the progress made in the implementation of the United \nNations Disability Inclusion Strategy, and welcoming the leadership of the Secretary-\nGeneral to bring about transformative and systematic change on disability inclusion \nacross the United Nations system, \n \nAcknowledging the importance of dedicated, predictable and flexible funding to \nsupport national implementation of the Convention on the Rights of Persons with \n\nA/RES/80/197 \nImplementation of the Convention on the Rights of Persons with \nDisabilities and the Optional Protocol thereto: amplified barriers in \ndiverse contexts\n \n25-20944\n4/14 \n \nDisabilities, particularly in developing countries, and recognizing in this regard the \nrole of the United Nations Global Disability Fund, which serves as a United Nations \npooled fund that channels resources to countries to promote and strengthen disability-\ninclusive policies and practices at all levels, \n \nRecalling that the Disability and Development Report 2024: Accelerating the \nRealization of the Sustainable Development Goals by, for and with Persons with \nDisabilities presents an overview of the status of accessibility for persons with \ndisabilities, including the participation of persons with disabilities, in the achievement \nof the 2030 Agenda for Sustainable Development, and the persistent gaps in this \nregard, identifies good practices and includes recommendations on scaling up actions \nto ensure the full, equal, effective and meaningful participation of persons with \ndisabilities in the programmes, policies and efforts of States for the effective \nimplementation of the Convention on the Rights of Persons with Disabilities and the \ndisability-inclusive achievement of the Sustainable Development Goals,  \n \nReaffirming the imperative of ensuring access to finance and economic \nopportunities for persons with disabilities, including by expanding access to financial \nproducts and services, removing barriers to access global supply chains for disability-\nowned businesses and implementing comprehensive financial and digital literacy \nprogrammes that target them, \n \nNoting the importance of facilitating access to and sharing accessible and \nassistive technologies, through the transfer of technology on mutually agreed terms \nand other actions, to promote local manufacturing and advance disability-inclusive \ndevelopment, ensure accessibility for persons with disabilities and promote their \nempowerment, \n \nExpressing concern that women and girls with disabilities in various situations \nare subject to multiple and intersecting forms of discrimination, exploitation and all \nforms of violence, offline and online, abandonment and lack of access to basic and \nessential services, including menstrual health and hygiene, which limit their \nenjoyment of all human rights and fundamental freedoms on an equal basis with \nothers, and recognizing that the realization of gender equality and the empowerment \nof all women and girls is crucial to achieving the Sustainable Development Goals and \ntargets which contribute, inter alia, to the empowerment of women and girls with \ndisabilities and facilitate the implementation of the Convention on the Rights of \nPersons with Disabilities,  \n \nNoting the importance of promoting safe and enabling conditions for children \nwith disabilities facing multiple forms of discrimination, such as children with \ndisabilities belonging to national or ethnic, religious and linguistic minorities, as well \nas migrant children with disabilities, refugee or asylum-seeking children with \ndisabilities, internally displaced children with disabilities, children of African descent \nwith disabilities and Indigenous children with disabilities, as well as children with \ndisabilities from local communities, \n \nStressing the need to pay particular attention to the rights and needs of \nIndigenous persons with disabilities, including women, children, youth and older \npersons, as set out in the United Nations Declaration on the Rights of Indigenous \nPeoples,11 including in the process of protecting and promoting their equal access to \njustice, while recognizing that Indigenous persons with disabilities are \ndisproportionately affected by the direct consequences of climate change owing to \ntheir close relationship with and protection of the environment and its resources, and \n_______________ \n \n11 Resolution 61/295, annex. \n\nImplementation of the Convention on the Rights of Persons with \nDisabilities and the Optional Protocol thereto: amplified barriers in \ndiverse contexts \nA/RES/80/197\n \n5/14\n25-20944 \n \nspecific measures are required to ensure that their rights are protected, respected and \nfulfilled in this context,  \n \nRecognizing that accessibility is essential for persons with disabilities to live \nindependently, fully enjoy all their human rights and fundamental freedoms on an \nequal basis with others and participate fully, meaningfully and effectively in all \naspects of life, including in political and public life and decision-making processes in \nthe civil, political, social, economic and cultural spheres, as well as to health and \neducation and to information and communications, and the need to identify and \neliminate prejudice, discrimination, and obstacles or barriers amplified by the diverse \ncontexts that limit the access of persons with disabilities to the physical environment, \nto transportation, to information and communications and to other facilities and \nservices open or available to the public, in both urban and rural areas, on an equal \nbasis with others, while recognizing also the importance of accessibility measures, \nuniversal design and assistive technologies in this regard, \n \nRecognizing also that forced institutionalization on the basis of disability is a \nform of violence that deprives persons with disabilities, including women and girls, \nof liberty, and that in such situations they face an increased risk of further violations \nand abuses, including physical, psychological and sexual and gender-based violence, \n \nRecognizing further that persons with disabilities, including children with \ndisabilities through their representative organizations, as well as civil society \norganizations committed to disability mainstreaming, should be consulted closely and \nactively involved in decision-making processes and in the development and \nimplementation of legislation and policies and programmes, especially those \nconcerning them directly, \n \nRecognizing that information and communications technologies, including \nassistive technology and devices, have shown their potential to strengthen the exercise \nof human rights, and that they can create conditions enabling persons with disabilities \nto fully enjoy their human rights and can contribute to their social inclusion and \nempowerment and allow them to live independently in the community on an equal \nbasis with others and to fully, effectively and meaningfully participate in society and \nin the workplace,  \n \nRecognizing also the intersection between ageing and disability and the specific \nchallenges linked to accessibility for older persons with disabilities, especially those \nfaced by older women with disabilities, as well as the need to take appropriate \nmeasures to ensure access by older persons with disabilities to social protection and \npoverty reduction programmes, \n \nRecognizing further that support is an integral part of being able to live \nindependently and being included in the community, and recognizing the importance \nof increasing the resilience of older persons, persons with disabilities and persons \nwith mental health conditions by ensuring legal and social protection, adopting \ninclusive employment measures, providing better care and support services and \npromoting long-term care and support at home and in the community, facilitating \naccess to and sharing of accessible and assistive technologies, especially new and \nemerging ones, including information and communications systems, mobility aids, \nassistive devices and other assistive technologies with a view to ensuring their \naffordability and guaranteeing the empowerment, autonomy and independence of \npersons with disabilities, \n \nRecognizing the need to promote and protect the human rights of all persons \nwith disabilities, including those who require more intensive support to attain and \nmaintain maximum independence, full physical, mental, social and vocational \nabilities and full inclusion and participation in all aspects of life,  \n\nA/RES/80/197 \nImplementation of the Convention on the Rights of Persons with \nDisabilities and the Optional Protocol thereto: amplified barriers in \ndiverse contexts\n \n25-20944\n6/14 \n \n \nAcknowledging that the Convention on the Rights of Persons with Disabilities \nlaid the foundation for a paradigm shift in mental health and created the momentum \nfor the deinstitutionalization and the identification of models of care and support \nbased on respect for the human rights of persons with disabilities that, inter alia, \naddress the underlying determinants of mental health, provide effective community-\nbased and mental health services and psychosocial support, reduce power \nasymmetries in mental health settings and respect the enjoyment of individual \nautonomy on an equal basis with others, \n \nRecognizing the contribution of family members towards the full and equal \nenjoyment by persons with disabilities of their human rights, including to participate \nin decision-making processes, inter alia, through participation in organizations which \nempower persons with disabilities to have a voice and full control of their own lives, \nand recognizing the need for States to raise awareness throughout society, including \nat the family level, regarding persons with disabilities and to foster respect for their \nrights and dignity, including participation,  \n \nRecognizing also the need for States to accelerate the development, \nimplementation and mainstreaming of strategies that respect, protect and fulfil the \nrights of all persons with disabilities, including women and girls, to the enjoyment of \ncivil, political, economic, cultural and social rights, without discrimination, by \nadopting legislation, policies and programmes that are inclusive of and accessible to \nall persons with disabilities, including those who are in vulnerable situations, and \naffirming that realizing their human rights requires their full and effective \nparticipation and inclusion in all aspects of public, political, economic, cultural, social \nand family life, on an equal basis with all others,  \n \nRecognizing further the need to raise awareness and foster dialogue among all \nstakeholders to address significant barriers persons with disabilities continue to face \nin the full enjoyment of their cultural rights and explore innovative, inclusive and \npractical solutions that guarantee equal access to cultural life and heritage, \n \nStressing the need to address prevailing challenges to bridge digital divides for \nand with persons with disabilities in order to promote the full enjoyment of their \nhuman rights, including by emphasizing the right to privacy and the respect for data-\nprotection regulations and standards in all uses of information and communications \ntechnologies and systems,  \n \nRecognizing that children with disabilities, particularly girls, may face \nstigmatization, discrimination and exclusion and are disproportionately subjected to \nmental and physical violence and sexual abuse and therefore may be particularly \nexposed to online risks, including cyberbullying, and that there is a need to take steps \nto ensure that the digital environment, including safety information, protective \nstrategies, services and forums relating to it, is inclusive, accessible and safe, bearing \nin mind the importance of countering prejudice that might lead to overprotection or \nexclusion, \n \nWelcoming the positive role of civil society in the promotion and \nimplementation of the rights of persons with disabilities, and stressing the importance \nof closely consulting and actively involving persons with disabilities, including \nwomen and children and Indigenous persons with disabilities, as well as other persons \nwith disabilities in vulnerable situations, including through their representative \norganizations, in the development and implementation of legislation and policies that \naffect their lives and in other decision-making processes concerning issues relating to \npersons with disabilities, thereby minimizing the risk of creating barriers to \naccessibility for all persons with disabilities,  \n\nImplementation of the Convention on the Rights of Persons with \nDisabilities and the Optional Protocol thereto: amplified barriers in \ndiverse contexts \nA/RES/80/197\n \n7/14\n25-20944 \n \n \nStressing the need for capacity-development efforts aimed at empowering \npersons with disabilities and their representative organizations to ensure equal access \nto quality education, full and productive employment and decent work on an equal \nbasis and without discrimination to persons with disabilities, including by promoting \naccess to inclusive education systems, skills development, volunteering opportunities \nand vocational and entrepreneurial training in order to enable persons with disabilities \nto attain and maintain maximum independence,  \n \nAcknowledging the importance of taking measures to raise awareness of the \nrights of persons with disabilities in order to eliminate discrimination, stereotypes, \nprejudices and other barriers which constitute a major impediment to their full, equal \nand effective participation in society and the economy, as well as in political and \npublic life, and recognizing the importance of disability-related international \ncommemorations in this regard, \n \nExpressing particular concern at the increased level and risk of abuse, \nexploitation, violence, discrimination and exclusion experienced by internally \ndisplaced persons with disabilities, and emphasizing the need to ensure that their \nspecific needs are met through the provision of adequate protection and access to \nassistance, \n \nConcerned that the continuing lack of available, high-quality, timely and \nreliable statistics, data and information on the situation of persons with disabilities at \nthe national, regional and global levels contributes to their exclusion in official \nstatistics, policies and programmes, and in this regard recognizing the need to \nintensify efforts to build the capacity of Member States, and to strengthen, at the \nnational level, data collection, analysis and use of data disaggregated by disability, \nsex and age for specific indicators, using appropriate measurement tools, including, \nas appropriate, the United Nations Children\u2019s Fund Module on Child Functioning and \nthe Washington Group short set of questions on disability and other data-collection \nmethodologies, to support the development of evidence-based policies and \nprogrammes that are accessible to and inclusive of persons with disabilities, including \nwomen and girls, on an equal basis with others,  \n \nStressing the relevance of disaggregated data collection and analysis and use \nthereof, including by disability, age, sex and other characteristics relevant to national \ncontexts, as an important element in the design of inclusive policies that respond to \nthe diverse contexts that amplify the barriers faced by persons with disabilities,  \n \n1. \nCalls upon those States that have not yet done so to consider signing and \nratifying the Convention on the Rights of Persons with Disabilities and the Optional \nProtocol thereto as a matter of priority;  \n \n2. \nEncourages States that have ratified the Convention and submitted one or \nmore reservations to it to review regularly the effect and continued relevance of such \nreservations and to consider the possibility of withdrawing them;  \n \n3. \nRequests United Nations agencies and organizations, and invites \nintergovernmental and non\u2011governmental organizations, to continue to strengthen \nefforts undertaken to disseminate accessible and easy-to-understand information on \nthe Convention and the Optional Protocol thereto, including to children and young \npeople to promote their understanding, and to assist States Parties in implementing \ntheir obligations under those instruments;  \n \n4. \nTakes note of the report of the Secretary-General entitled \u201cStatus of the \nConvention on the Rights of Persons with Disabilities and the Optional Protocol \nthereto: diverse contexts that amplify the barriers faced by persons with \n\nA/RES/80/197 \nImplementation of the Convention on the Rights of Persons with \nDisabilities and the Optional Protocol thereto: amplified barriers in \ndiverse contexts\n \n25-20944\n8/14 \n \ndisabilities\u201d,12 and also takes note of reports from special procedure mandate holders \nof the Human Rights Council, such as the report of the Special Rapporteur on the \nrights of persons with disabilities entitled \u201cCare and support for children with \ndisabilities within the family environment and its gendered dimensions\u201d;13 \n \n5. \nCalls upon those States that have not yet done so to consider signing and \nratifying the Marrakesh Treaty to Facilitate Access to Published Works for Persons \nWho Are Blind, Visually Impaired, or Otherwise Print Disabled;14 \n \n6. \nEmphasizes the importance of mainstreaming disability issues as an \nintegral part of relevant sustainable development strategies, and encourages States to \napply a human rights-based and gender-responsive approach and to intensify their \nefforts to advance the rights of persons with disabilities in the implementation of the \n2030 Agenda for Sustainable Development, consistent with their international \nobligations; \n \n7. \nAlso emphasizes that efforts to reform and strengthen the impact of the \nUnited Nations, including the UN80 Initiative, must be inclusive of persons with \ndisabilities and promote and protect their rights, and in this regard welcomes the \ncommitment of the Secretary-General to advancing the implementation of the United \nNations Disability Inclusion Strategy;  \n \n8. \nEncourages States to review and repeal any law or policy that restricts the \nfull and effective participation in political and public life of persons with disabilities \non an equal basis with others or discriminates against persons with disabilities, \nincluding with regard to accessing a service or facility open to the public, and to \nestablish accessible and effective channels of redress for discrimination on the basis \nof disability, considering also diverse contexts that may amplify barriers faced by \npersons with disabilities to access their rights;  \n \n9. \nCalls upon States to take effective and appropriate measures to remove all \nbarriers preventing persons with disabilities from having effective access to justice \non an equal basis with others, and to ensure the full enjoyment of equality and \nnon\u2011discrimination by persons with disabilities in the fields of equality and \nnon\u2011discrimination and access to justice, including by training professionals in the \njustice system for such purposes; \n \n10. Urges States to take steps to eliminate multiple and intersecting forms of \ndiscrimination against all women and girls with disabilities through repealing \ndiscriminatory laws, policies and practices, to take all effective measures to remove \nany other barriers faced by women and girls with disabilities in accessing, inter alia, \nthe physical, social, economic and cultural environment, transportation, health and \neducation, \ninformation \nand \ncommunications, \nincluding \ninformation \nand \ncommunications technologies and systems, and other facilities and services open or \nprovided to the public and to ensure the full and equal enjoyment of all rights \nstipulated in the Convention, including to effectively and fully participate in public \nlife and in the conduct of public affairs;  \n \n11. Also urges\u202fStates to ensure that persons with disabilities in different \ncontexts and conditions are provided with adequate support in order to participate \nfully in the labour market, including by prohibiting discrimination on the basis of \ndisability with regard to all matters concerning all forms of employment, recognizing \nthe right of persons with disabilities to work on an equal basis with others;  \n_______________ \n \n12 A/80/423. \n \n13 See A/80/170. \n \n14 United Nations, Treaty Series, vol. 3162, No. 54134. \n\nImplementation of the Convention on the Rights of Persons with \nDisabilities and the Optional Protocol thereto: amplified barriers in \ndiverse contexts \nA/RES/80/197\n \n9/14\n25-20944 \n \n \n12. Further urges States to take all appropriate measures to eliminate violence \nand discrimination against persons with disabilities, and to ensure that victims and \nsurvivors with disabilities of all forms of violence, including sexual and gender-based \nviolence, have prompt and universal access to quality social and healthcare services, \nsuch as psychological and counselling services, as well as access to justice, including \nlegal services, to end impunity;  \n \n13. Calls upon all States to ensure the full enjoyment by children with \ndisabilities of all human rights and fundamental freedoms, on an equal basis with \nother children, in recognition that discrimination against any child on the basis of a \ndisability is a violation of the inherent dignity and worth of the child, to enhance \ninclusion and address barriers faced by children with disabilities, including \naddressing discriminatory, attitudinal and environmental barriers to their participation \nand inclusion in society and in the community, to develop gender- and age-sensitive \npolicies and capacities to ensure the rights and address the particular needs of children \nwith disabilities, including children in vulnerable situations, including migrant \nchildren, children without parental care, children in street situations and child victims \nof trafficking, and those affected by climate change, and to prevent and respond to all \nforms of violence, including cases of sexual and gender-based violence;  \n \n14. Calls upon States to ensure that persons with disabilities are able to access \ninclusive and accessible quality primary, secondary and tertiary education, vocational \ntraining, adult education and lifelong learning without discrimination and on an equal \nbasis with others and to facilitate the full and equal participation of persons with \ndisabilities in education by taking appropriate steps through the provision of \ninformation in accessible and alternative communication formats, reasonable \naccommodation and other support as required, while also promoting science, \ntechnology, engineering and mathematics skills among persons with disabilities to \naddress divides in science, technology and innovation, responding to the diverse \ncontexts that may amplify the barriers faced by persons with disabilities to fulfil their \nright to inclusive education; \n \n15. Urges States to ensure that all schools are safe and free from violence, such \nas bullying, including cyberbullying, and sexual harassment, including peer-to-peer \nsexual harassment, online and offline, and that they address all forms of violence \nagainst children with disabilities, including with particular attention to girls with \ndisabilities and in vulnerable situations; \n \n16. Calls upon Member States, the United Nations system, civil society and \nother relevant stakeholders to fully include persons with disabilities in all stages of \naddressing situations of risk, including armed conflict, humanitarian emergencies and \nthe occurrence of disasters caused by natural or man-made hazards, especially in areas \nwhere they experience additional barriers due to their disability, and recognize that \npersons with disabilities have the right to the enjoyment of the highest attainable \nstandard of physical and mental health without discrimination, including through \nproviding timely and appropriate, quality and free or affordable healthcare services \nand programmes as provided to other persons in situations of risk and humanitarian \nemergencies, including in the area of sexual and reproductive health and population-\nbased public health programmes, and provide healthcare services needed by persons \nwith disabilities specifically because of their disabilities; \n \n17. Urges Member States to promote a paradigm shift in mental health, inter \nalia, in the fields of clinical practice, policy, research, medical education and \ninvestment, through the promotion of disability-inclusive, community- and evidence-\nbased and people-centred services and by respecting, protecting and fulfilling human \nrights, individual autonomy of persons using or seeking to use mental health services, \nincluding by relying on peer support, as appropriate, and by providing a range of \n\nA/RES/80/197 \nImplementation of the Convention on the Rights of Persons with \nDisabilities and the Optional Protocol thereto: amplified barriers in \ndiverse contexts\n \n25-20944\n10/14 \n \nvoluntary supported decision-making mechanisms, such as safeguards against abuse, \ncoercion and undue influence within support arrangements, over a model based on the \ndominance of biomedical interventions, medicalization and institutionalization; \n \n18. Calls upon Member States to ensure the availability of and access to \nhealthcare services for all persons with disabilities, as well as to remove physical, \nattitudinal, social, structural and financial barriers, provide quality standards of care \nand scale up efforts for their empowerment and inclusion, noting with concern that \npersons with disabilities continue to experience unmet health needs; \n \n19. Encourages States to adopt inclusive strategies that address the barriers to \nthe participation of persons with disabilities and their representative organizations at \nall levels of decision-making processes, and to adopt a framework for equality, \nnon\u2011discrimination and the full and effective participation of persons with disabilities; \n \n20. Encourages Member States and other relevant stakeholders to consider \nappropriate measures to ensure adequate, predictable and sustainable financing for \ndisability inclusion, including through voluntary contributions to the United Nations \nGlobal Disability Fund, and to explore, as appropriate, innovative financing \nmodalities on a voluntary basis, with a view to strengthening the Fund\u2019s capacity to \nsupport the implementation of the Convention on the Rights of Persons with \nDisabilities at all levels; \n \n21. Calls upon States to ensure the full and effective participation of and \nconsultation with persons with disabilities, including through their representative \norganizations, in the development and implementation of policies and programmes \nfor the implementation of the Convention, as well as in other relevant issues at the \nnational and local levels, including through the inclusion of persons with disabilities \nin boards, organs and institutions and integrating consultative processes in such \npolicies and programmes as appropriate;  \n \n22. Also calls upon States to promote other appropriate forms of assistance \nand support to persons with disabilities to ensure their access to information, to \nprovide information intended for the general public to persons with disabilities using \naccessible formats and technologies useful for persons with different kinds of \ndisabilities in a timely manner and without additional cost, and to expand the \navailability and improve the affordability of information and communications \ntechnologies, as well as to facilitate cooperation in research and access to scientific \nand technical knowledge to promote the inclusion of persons with disabilities; \n \n23. Urges Member States, in collaboration with other stakeholders, to close \nthe digital divides and promote the digital inclusion of persons with disabilities, \naddressing the challenges associated with accessibility, affordability, digital literacy \nand digital skills, and awareness;  \n \n24. Calls upon States to ensure the equal right of all persons with disabilities \nto live independently in the community with choices equal to others, including by \nensuring that persons with disabilities have the opportunity to choose their place of \nresidence and where and with whom they live on an equal basis with others and are \nnot obliged to live in a particular living arrangement and that persons with disabilities \nhave access to a range of in-home, residential and other community support services, \nincluding personal assistance necessary to support living and inclusion in the \ncommunity, and to prevent isolation or segregation from the community;  \n \n25. Also calls upon States to promote and facilitate access to and sharing of \naccessible and assistive technologies, especially new and emerging ones, including \ninformation and communications systems, mobility aids, assistive devices and other \nassistive technologies, by persons with disabilities, and to promote research and \n\nImplementation of the Convention on the Rights of Persons with \nDisabilities and the Optional Protocol thereto: amplified barriers in \ndiverse contexts \nA/RES/80/197\n \n11/14\n25-20944 \n \ndevelopment in this regard, so that these technologies and systems become accessible \nat minimal cost and at an early stage;  \n \n26. Urges States to consider laws, policies and procedures relating to public \nprocurement to ensure that persons with disabilities can access any service or facility \nopen to the public on an equal basis with others, and in this regard encourages States \nto disseminate information to and work with the private sector, including employers \nand other relevant stakeholders, to implement accessibility measures for persons with \ndisabilities in any facilities or services that are open or provided to the public;  \n \n27. Also urges States to consider investment in care and support and promote \nlegal systems or frameworks in care and support policies and infrastructure, and \npromote national legislation and capacity-building to ensure universal access to \naffordable and quality services for all, including childcare, in the health and support \nsector for persons with disabilities and older persons, which is necessary to address \ncare needs for persons throughout their life course, and to promote universal access \nto social protection, including paid maternity, paternity and parental leave and social \nprotection for all workers, including for both informal workers and those in \nnon\u2011standard forms of employment; \n \n28. Urges Member States, in collaboration with the organizations of the United \nNations system and civil society, to promote the rights of persons with disabilities in \nrural areas, including women with disabilities, and girls with disabilities as \nappropriate, by ensuring access on an equal basis to productive employment and \ndecent work, economic and financial resources and disability-inclusive infrastructure \nand services, in particular in relation to health and education, as well as by ensuring \nthat their priorities and needs are fully incorporated into policies and programmes, \nthrough, inter alia, their participation in decision-making processes; \n \n29. Recognizes the challenges faced by migrants with disabilities and the \nspecific needs they may have, and invites Member States to accelerate efforts, at all \nlevels, to integrate public health considerations into migration policies and to \nincorporate the health needs of migrants with disabilities into national and local \nhealthcare services policies and plans, in ways which are transparent, equitable, \nnon\u2011discriminatory, people-centred, gender-responsive, child-sensitive and disability-\ninclusive and which leave no one behind; \n \n30. Calls upon States to strengthen efforts to empower all persons with \ndisabilities and enhance their participation and promote their leadership in society \nthrough taking measures to address and remove all barriers that prevent or restrict \ntheir access and full inclusion and participation in the community on an equal basis \nwith others, including in the government and public sector, the private sector, civil \nsociety and all branches and bodies of the national monitoring system of the \nConvention, and to work to ensure that persons with disabilities are closely consulted \nand actively involved, through their representative organizations, in the design, \nimplementation and monitoring of all legislation, policies and programmes which \nhave an impact on their lives;  \n \n31. Encourages States to provide support to existing organizations and \npromote the creation of organizations, including civil society organizations and \nnetworks of persons with disabilities, as appropriate, and to promote and support \npersons with disabilities in taking leadership roles in public decision-making bodies \nat all levels, recognizing the importance for States of having an open, inclusive and \ntransparent engagement with civil society in the implementation of measures on \npersons with disabilities;  \n \n32. Calls upon States to collect and analyse data disaggregated by income, sex, \nrace, age, ethnicity, migratory status, disability, geographical location and other \n\nA/RES/80/197 \nImplementation of the Convention on the Rights of Persons with \nDisabilities and the Optional Protocol thereto: amplified barriers in \ndiverse contexts\n \n25-20944\n12/14 \n \ncharacteristics relevant to national contexts to assist, inter alia, with the identification \nand eradication of barriers and all forms of discrimination, including multiple and \nintersecting forms of discrimination, that prevent persons with disabilities from \nenjoying all the rights stipulated in the Convention, to guide inclusive policy planning \nand to be used on an ongoing basis to assess and advance participation, and also calls \nupon States to improve data-collection systems for adequate monitoring and \nevaluation frameworks on the implementation of the Convention and the Sustainable \nDevelopment Goals for all persons with disabilities;  \n \n33. Urges States and other relevant stakeholders, including national human \nrights institutions in compliance with the Paris Principles, 15 where they exist, to \ncontinue to support the inclusion of persons with disabilities in the implementation of \nthe 2030 Agenda for Sustainable Development by, inter alia, supporting the \ndisaggregation of data by disability, sex and age for specific indicators, using \nappropriate measurement tools, including, as appropriate, the United Nations \nChildren\u2019s Fund Module on Child Functioning and the Washington Group short set of \nquestions on disability and other data-collection methodologies, to assist States in \nmeasuring the achievement of the 17 Sustainable Development Goals and 169 \nassociated targets and programming policies in the context of the Goals;  \n \n34. Encourages States, United Nations entities and relevant international \norganizations, in partnership with persons with disabilities, including through their \nrepresentative organizations, inter alia:  \n \n(a) \nTo ensure that international cooperation is gender-responsive and \ndisability-inclusive, including through the implementation of disability markers to \nmonitor the implementation of programmes and the collection of data and statistics \non persons with disabilities in the implementation of the 2030 Agenda for Sustainable \nDevelopment and the Sustainable Development Goals, targets and indicators, as well \nas other international frameworks; \n \n(b) \nTo support, promote and strengthen international cooperation and \nassistance, and enhance partnerships and coordination, including South-South \ncooperation, among themselves and with the active participation of persons with \ndisabilities, through their representative organizations, as well as other relevant civil \nsociety organizations and stakeholders, in strengthening the means of implementation \nof the Convention and the 2030 Agenda for Sustainable Development, including \nthrough the mobilization of financial resources, technical cooperation and facilitation \nof access to and sharing of accessible and assistive technologies on mutually agreed \nterms; \n \n(c) \nTo take effective and appropriate steps to facilitate the protection and \nsafety of persons with disabilities in situations of risk, including situations of armed \nconflict, humanitarian emergencies and the occurrence of disasters caused by natural \nor man-made hazards, including by building capacity and sensitivity for disability \ninclusion among personnel involved in responding to such contexts, and to include \npersons with disabilities in disaster risk reduction and their preparedness efforts, \nplanning, response and recovery actions, as well as in post-emergency reconstruction \nand rebuilding, to identify and eliminate obstacles and barriers to ensuring their safety \nand accessibility; \n \n(d) \nTo enhance the collection, dissemination and use of data on the diverse \ncontexts that may amplify the barriers faced by persons with disabilities in situations \nof risk and humanitarian emergencies, disaggregated by disability, age, income, sex, \nrace, ethnicity, migration status, geographical location and other characteristics \n_______________ \n \n15 Resolution 48/134, annex. \n\nImplementation of the Convention on the Rights of Persons with \nDisabilities and the Optional Protocol thereto: amplified barriers in \ndiverse contexts \nA/RES/80/197\n \n13/14\n25-20944 \n \nrelevant to national contexts, using data collection methodologies such as the \nWashington Group short set of questions on disability, as appropriate, in consultation \nwith persons with disabilities, including through their representative organizations;  \n \n35. Encourages the United Nations system, international financial and \ndevelopment institutions, and other international and regional organizations:  \n \n(a) \nTo increase assistance to support Member States, upon their request, in \nsubstantially enhancing the participation of persons with disabilities, including \nthrough their organizations, in decision-making, including through building capacity, \ntraining and supporting persons with disabilities in participating in public life, and \nsharing experiences and best practices;  \n \n(b) \nTo provide sustained, long-term support to national partners, including \norganizations of persons with disabilities, and civil society organizations, in their \nefforts to become more disability-inclusive and promote the participation of persons \nwith disabilities;  \n \n(c) \nTo ensure non\u2011discrimination for all persons with disabilities, and ensure \nopportunities for persons with disabilities to participate on an equal basis with others; \n \n36. Encourages the Secretariat to make the United Nations more accessible \nfor persons and representatives with disabilities, in line with paragraphs 33 to 37 of \nresolution 73/341 of 12 September 2019, and recalls all relevant accessibility-related \nresolutions of the General Assembly, including resolutions 76/154 of 16 December \n2021, 76/273 of 29 June 2022, 77/189 of 15 December 2022 and 77/240 of \n16 December 2022;  \n \n37. Invites the Chair of the Committee on the Rights of Persons with \nDisabilities and the Special Rapporteur on the rights of persons with disabilities to \naddress and engage in an interactive dialogue with the General Assembly annually, \nunder the item entitled \u201cPromotion and protection of human rights\u201d, as a way to \nenhance communication between the Assembly and the Committee;  \n \n38. Takes note of the reports of the Secretary-General on the system-wide \nimplementation of the United Nations Disability Inclusion Strategy,16 as well as the \nprogress made in this regard, and calls upon the United Nations system, including its \nagencies, funds and programmes, within their respective mandates, to continue to \nwork collaboratively to accelerate the full and effective mainstreaming of disability \ninclusion into the United Nations system, including by implementing and reporting \non the United Nations Disability Inclusion Strategy across its programmes and \noperations;  \n \n39. Encourages the Secretary-General, in line with the recommendations of \nhis report on disability inclusion in the United Nations system, 17 to continue to \nexplore options or modalities to support, through sustainable and predictable \nresources, the United Nations Disability Inclusion Strategy, to mainstream disability \ninclusion into the work of the Secretariat entities and support implementation across \nthe United Nations system; \n \n40. Requests the Secretary-General to submit to the General Assembly at its \neighty-first session a progress report on steps taken by the United Nations system \ntowards mainstreaming disability inclusion, including implementation of the United \nNations Disability Inclusion Strategy, within existing resources;  \n_______________ \n \n16 A/79/233 and A/80/361. \n \n17 A/80/361. \n\nA/RES/80/197 \nImplementation of the Convention on the Rights of Persons with \nDisabilities and the Optional Protocol thereto: amplified barriers in \ndiverse contexts\n \n25-20944\n14/14 \n \n \n41. Calls upon Member States, the United Nations and other relevant \nstakeholders to take part in implementing the recommendations endorsed by the \nSteering Committee on Accessibility in June 2019;  \n \n42. Requests the Secretary-General to ensure that all Committee members can \nparticipate in the work of the Committee on an equal basis by guaranteeing necessary \nsupport and access to information, within existing resources and when requested with \nsufficient time in advance, including by providing sign language assistance needed \nby Committee members, in accordance with article 34 of the Convention on the Rights \nof Persons with Disabilities and rule 7 of the rules of procedure of the Committee on \nthe Rights of Persons with Disabilities; \n \n43. Also requests the Secretary-General to submit to the General Assembly, \nprior to the start of its eighty-second session, a comprehensive report made available \nin accessible formats marking the twentieth anniversary of the adoption of the \nConvention on the Rights of Persons with Disabilities by the Assembly, assessing \nprogress, good practices, areas of opportunity and challenges in the implementation \nof the Convention, in consultation with persons with disabilities, including through \ntheir representative organizations, relevant United Nations entities, including the \nOffice of the United Nations High Commissioner for Human Rights, the Committee \non the Rights of Persons with Disabilities, the United Nations Global Disability Fund \nand the United Nations Children\u2019s Fund, taking into account the views of relevant \nstakeholders and using existing available materials, and to include a segment on the \nstatus of the Convention and the Optional Protocol thereto; \n \n44. Further requests the Secretary-General to continue to maintain the levels \nof resources required by the relevant offices in the United Nations system for the \nfulfilment of their tasks with respect to their work on the rights of and inclusive \ndevelopment for persons with disabilities.  \n \n67th plenary meeting \n17 December 2025 \n \n",
  "paragraphs": {
    "1": "Calls upon those States that have not yet done so to consider signing and ratifying the Convention on the Rights of Persons with Disabilities and the Optional Protocol thereto as a matter of priority;",
    "2": "Encourages States that have ratified the Convention and submitted one or more reservations to it to review regularly the effect and continued relevance of such reservations and to consider the possibility of withdrawing them;",
    "3": "Requests United Nations agencies and organizations, and invites intergovernmental and non\u2011governmental organizations, to continue to strengthen efforts undertaken to disseminate accessible and easy-to-understand information on the Convention and the Optional Protocol thereto, including to children and young people to promote their understanding, and to assist States Parties in implementing their obligations under those instruments;",
    "4": " disabilities\u201d,12 and also takes note of reports from special procedure mandate holders of the Human Rights Council, such as the report of the Special Rapporteur on the rights of persons with disabilities entitled \u201cCare and support for children with disabilities within the family environment and its gendered dimensions\u201d;13",
    "5": "Calls upon those States that have not yet done so to consider signing and ratifying the Marrakesh Treaty to Facilitate Access to Published Works for Persons Who Are Blind, Visually Impaired, or Otherwise Print Disabled;14",
    "6": "Emphasizes the importance of mainstreaming disability issues as an integral part of relevant sustainable development strategies, and encourages States to apply a human rights-based and gender-responsive approach and to intensify their efforts to advance the rights of persons with disabilities in the implementation of the 2030 Agenda for Sustainable Development, consistent with their international obligations;",
    "7": "Also emphasizes that efforts to reform and strengthen the impact of the United Nations, including the UN80 Initiative, must be inclusive of persons with disabilities and promote and protect their rights, and in this regard welcomes the commitment of the Secretary-General to advancing the implementation of the United Nations Disability Inclusion Strategy;",
    "8": "Encourages States to review and repeal any law or policy that restricts the full and effective participation in political and public life of persons with disabilities on an equal basis with others or discriminates against persons with disabilities, including with regard to accessing a service or facility open to the public, and to establish accessible and effective channels of redress for discrimination on the basis of disability, considering also diverse contexts that may amplify barriers faced by persons with disabilities to access their rights;",
    "9": "Calls upon States to take effective and appropriate measures to remove all barriers preventing persons with disabilities from having effective access to justice on an equal basis with others, and to ensure the full enjoyment of equality and non\u2011discrimination by persons with disabilities in the fields of equality and non\u2011discrimination and access to justice, including by training professionals in the justice system for such purposes;",
    "10": "Urges States to take steps to eliminate multiple and intersecting forms of discrimination against all women and girls with disabilities through repealing discriminatory laws, policies and practices, to take all effective measures to remove any other barriers faced by women and girls with disabilities in accessing, inter alia, the physical, social, economic and cultural environment, transportation, health and education, information and communications, including information and communications technologies and systems, and other facilities and services open or provided to the public and to ensure the full and equal enjoyment of all rights stipulated in the Convention, including to effectively and fully participate in public life and in the conduct of public affairs;",
    "11": "Also urges States to ensure that persons with disabilities in different contexts and conditions are provided with adequate support in order to participate fully in the labour market, including by prohibiting discrimination on the basis of disability with regard to all matters concerning all forms of employment, recognizing the right of persons with disabilities to work on an equal basis with others;",
    "12": "Further urges States to take all appropriate measures to eliminate violence and discrimination against persons with disabilities, and to ensure that victims and survivors with disabilities of all forms of violence, including sexual and gender-based violence, have prompt and universal access to quality social and healthcare services, such as psychological and counselling services, as well as access to justice, including legal services, to end impunity;",
    "13": "Calls upon all States to ensure the full enjoyment by children with disabilities of all human rights and fundamental freedoms, on an equal basis with other children, in recognition that discrimination against any child on the basis of a disability is a violation of the inherent dignity and worth of the child, to enhance inclusion and address barriers faced by children with disabilities, including addressing discriminatory, attitudinal and environmental barriers to their participation and inclusion in society and in the community, to develop gender- and age-sensitive policies and capacities to ensure the rights and address the particular needs of children with disabilities, including children in vulnerable situations, including migrant children, children without parental care, children in street situations and child victims of trafficking, and those affected by climate change, and to prevent and respond to all forms of violence, including cases of sexual and gender-based violence;",
    "14": "Calls upon States to ensure that persons with disabilities are able to access inclusive and accessible quality primary, secondary and tertiary education, vocational training, adult education and lifelong learning without discrimination and on an equal basis with others and to facilitate the full and equal participation of persons with disabilities in education by taking appropriate steps through the provision of information in accessible and alternative communication formats, reasonable accommodation and other support as required, while also promoting science, technology, engineering and mathematics skills among persons with disabilities to address divides in science, technology and innovation, responding to the diverse contexts that may amplify the barriers faced by persons with disabilities to fulfil their right to inclusive education;",
    "15": "Urges States to ensure that all schools are safe and free from violence, such as bullying, including cyberbullying, and sexual harassment, including peer-to-peer sexual harassment, online and offline, and that they address all forms of violence against children with disabilities, including with particular attention to girls with disabilities and in vulnerable situations;",
    "16": "Calls upon Member States, the United Nations system, civil society and other relevant stakeholders to fully include persons with disabilities in all stages of addressing situations of risk, including armed conflict, humanitarian emergencies and the occurrence of disasters caused by natural or man-made hazards, especially in areas where they experience additional barriers due to their disability, and recognize that persons with disabilities have the right to the enjoyment of the highest attainable standard of physical and mental health without discrimination, including through providing timely and appropriate, quality and free or affordable healthcare services and programmes as provided to other persons in situations of risk and humanitarian emergencies, including in the area of sexual and reproductive health and population- based public health programmes, and provide healthcare services needed by persons with disabilities specifically because of their disabilities;",
    "17": " voluntary supported decision-making mechanisms, such as safeguards against abuse, coercion and undue influence within support arrangements, over a model based on the dominance of biomedical interventions, medicalization and institutionalization;",
    "18": "Calls upon Member States to ensure the availability of and access to healthcare services for all persons with disabilities, as well as to remove physical, attitudinal, social, structural and financial barriers, provide quality standards of care and scale up efforts for their empowerment and inclusion, noting with concern that persons with disabilities continue to experience unmet health needs;",
    "19": "Encourages States to adopt inclusive strategies that address the barriers to the participation of persons with disabilities and their representative organizations at all levels of decision-making processes, and to adopt a framework for equality, non\u2011discrimination and the full and effective participation of persons with disabilities;",
    "20": "Encourages Member States and other relevant stakeholders to consider appropriate measures to ensure adequate, predictable and sustainable financing for disability inclusion, including through voluntary contributions to the United Nations Global Disability Fund, and to explore, as appropriate, innovative financing modalities on a voluntary basis, with a view to strengthening the Fund\u2019s capacity to support the implementation of the Convention on the Rights of Persons with Disabilities at all levels;",
    "21": "Calls upon States to ensure the full and effective participation of and consultation with persons with disabilities, including through their representative organizations, in the development and implementation of policies and programmes for the implementation of the Convention, as well as in other relevant issues at the national and local levels, including through the inclusion of persons with disabilities in boards, organs and institutions and integrating consultative processes in such policies and programmes as appropriate;",
    "22": "Also calls upon States to promote other appropriate forms of assistance and support to persons with disabilities to ensure their access to information, to provide information intended for the general public to persons with disabilities using accessible formats and technologies useful for persons with different kinds of disabilities in a timely manner and without additional cost, and to expand the availability and improve the affordability of information and communications technologies, as well as to facilitate cooperation in research and access to scientific and technical knowledge to promote the inclusion of persons with disabilities;",
    "23": "Urges Member States, in collaboration with other stakeholders, to close the digital divides and promote the digital inclusion of persons with disabilities, addressing the challenges associated with accessibility, affordability, digital literacy and digital skills, and awareness;",
    "24": "Calls upon States to ensure the equal right of all persons with disabilities to live independently in the community with choices equal to others, including by ensuring that persons with disabilities have the opportunity to choose their place of residence and where and with whom they live on an equal basis with others and are not obliged to live in a particular living arrangement and that persons with disabilities have access to a range of in-home, residential and other community support services, including personal assistance necessary to support living and inclusion in the community, and to prevent isolation or segregation from the community;",
    "25": " development in this regard, so that these technologies and systems become accessible at minimal cost and at an early stage;",
    "26": "Urges States to consider laws, policies and procedures relating to public procurement to ensure that persons with disabilities can access any service or facility open to the public on an equal basis with others, and in this regard encourages States to disseminate information to and work with the private sector, including employers and other relevant stakeholders, to implement accessibility measures for persons with disabilities in any facilities or services that are open or provided to the public;",
    "27": "Also urges States to consider investment in care and support and promote legal systems or frameworks in care and support policies and infrastructure, and promote national legislation and capacity-building to ensure universal access to affordable and quality services for all, including childcare, in the health and support sector for persons with disabilities and older persons, which is necessary to address care needs for persons throughout their life course, and to promote universal access to social protection, including paid maternity, paternity and parental leave and social protection for all workers, including for both informal workers and those in non\u2011standard forms of employment;",
    "28": "Urges Member States, in collaboration with the organizations of the United Nations system and civil society, to promote the rights of persons with disabilities in rural areas, including women with disabilities, and girls with disabilities as appropriate, by ensuring access on an equal basis to productive employment and decent work, economic and financial resources and disability-inclusive infrastructure and services, in particular in relation to health and education, as well as by ensuring that their priorities and needs are fully incorporated into policies and programmes, through, inter alia, their participation in decision-making processes;",
    "29": "Recognizes the challenges faced by migrants with disabilities and the specific needs they may have, and invites Member States to accelerate efforts, at all levels, to integrate public health considerations into migration policies and to incorporate the health needs of migrants with disabilities into national and local healthcare services policies and plans, in ways which are transparent, equitable, non\u2011discriminatory, people-centred, gender-responsive, child-sensitive and disability- inclusive and which leave no one behind;",
    "30": "Calls upon States to strengthen efforts to empower all persons with disabilities and enhance their participation and promote their leadership in society through taking measures to address and remove all barriers that prevent or restrict their access and full inclusion and participation in the community on an equal basis with others, including in the government and public sector, the private sector, civil society and all branches and bodies of the national monitoring system of the Convention, and to work to ensure that persons with disabilities are closely consulted and actively involved, through their representative organizations, in the design, implementation and monitoring of all legislation, policies and programmes which have an impact on their lives;",
    "31": "Encourages States to provide support to existing organizations and promote the creation of organizations, including civil society organizations and networks of persons with disabilities, as appropriate, and to promote and support persons with disabilities in taking leadership roles in public decision-making bodies at all levels, recognizing the importance for States of having an open, inclusive and transparent engagement with civil society in the implementation of measures on persons with disabilities;",
    "32": " characteristics relevant to national contexts to assist, inter alia, with the identification and eradication of barriers and all forms of discrimination, including multiple and intersecting forms of discrimination, that prevent persons with disabilities from enjoying all the rights stipulated in the Convention, to guide inclusive policy planning and to be used on an ongoing basis to assess and advance participation, and also calls upon States to improve data-collection systems for adequate monitoring and evaluation frameworks on the implementation of the Convention and the Sustainable Development Goals for all persons with disabilities;",
    "33": "Urges States and other relevant stakeholders, including national human rights institutions in compliance with the Paris Principles, 15 where they exist, to continue to support the inclusion of persons with disabilities in the implementation of the 2030 Agenda for Sustainable Development by, inter alia, supporting the disaggregation of data by disability, sex and age for specific indicators, using appropriate measurement tools, including, as appropriate, the United Nations Children\u2019s Fund Module on Child Functioning and the Washington Group short set of questions on disability and other data-collection methodologies, to assist States in measuring the achievement of the 17 Sustainable Development Goals and 169 associated targets and programming policies in the context of the Goals;",
    "34": "Encourages States, United Nations entities and relevant international organizations, in partnership with persons with disabilities, including through their representative organizations, inter alia: (a) To ensure that international cooperation is gender-responsive and disability-inclusive, including through the implementation of disability markers to monitor the implementation of programmes and the collection of data and statistics on persons with disabilities in the implementation of the 2030 Agenda for Sustainable Development and the Sustainable Development Goals, targets and indicators, as well as other international frameworks; (b) To support, promote and strengthen international cooperation and assistance, and enhance partnerships and coordination, including South-South cooperation, among themselves and with the active participation of persons with disabilities, through their representative organizations, as well as other relevant civil society organizations and stakeholders, in strengthening the means of implementation of the Convention and the 2030 Agenda for Sustainable Development, including through the mobilization of financial resources, technical cooperation and facilitation of access to and sharing of accessible and assistive technologies on mutually agreed terms; (c) To take effective and appropriate steps to facilitate the protection and safety of persons with disabilities in situations of risk, including situations of armed conflict, humanitarian emergencies and the occurrence of disasters caused by natural or man-made hazards, including by building capacity and sensitivity for disability inclusion among personnel involved in responding to such contexts, and to include persons with disabilities in disaster risk reduction and their preparedness efforts, planning, response and recovery actions, as well as in post-emergency reconstruction and rebuilding, to identify and eliminate obstacles and barriers to ensuring their safety and accessibility; (d) To enhance the collection, dissemination and use of data on the diverse contexts that may amplify the barriers faced by persons with disabilities in situations of risk and humanitarian emergencies, disaggregated by disability, age, income, sex, race, ethnicity, migration status, geographical location and other characteristics relevant to national contexts, using data collection methodologies such as the Washington Group short set of questions on disability, as appropriate, in consultation with persons with disabilities, including through their representative organizations;",
    "35": "Encourages the United Nations system, international financial and development institutions, and other international and regional organizations: (a) To increase assistance to support Member States, upon their request, in substantially enhancing the participation of persons with disabilities, including through their organizations, in decision-making, including through building capacity, training and supporting persons with disabilities in participating in public life, and sharing experiences and best practices; (b) To provide sustained, long-term support to national partners, including organizations of persons with disabilities, and civil society organizations, in their efforts to become more disability-inclusive and promote the participation of persons with disabilities; (c) To ensure non\u2011discrimination for all persons with disabilities, and ensure opportunities for persons with disabilities to participate on an equal basis with others;",
    "36": "Encourages the Secretariat to make the United Nations more accessible for persons and representatives with disabilities, in line with paragraphs 33 to 37 of resolution 73/341 of 12 September 2019, and recalls all relevant accessibility-related resolutions of the General Assembly, including resolutions 76/154 of 16 December 2021, 76/273 of 29 June 2022, 77/189 of 15 December 2022 and 77/240 of 16 December 2022;",
    "37": "Invites the Chair of the Committee on the Rights of Persons with Disabilities and the Special Rapporteur on the rights of persons with disabilities to address and engage in an interactive dialogue with the General Assembly annually, under the item entitled \u201cPromotion and protection of human rights\u201d, as a way to enhance communication between the Assembly and the Committee;",
    "38": "Takes note of the reports of the Secretary-General on the system-wide implementation of the United Nations Disability Inclusion Strategy,16 as well as the progress made in this regard, and calls upon the United Nations system, including its agencies, funds and programmes, within their respective mandates, to continue to work collaboratively to accelerate the full and effective mainstreaming of disability inclusion into the United Nations system, including by implementing and reporting on the United Nations Disability Inclusion Strategy across its programmes and operations;",
    "39": "Encourages the Secretary-General, in line with the recommendations of his report on disability inclusion in the United Nations system, 17 to continue to explore options or modalities to support, through sustainable and predictable resources, the United Nations Disability Inclusion Strategy, to mainstream disability inclusion into the work of the Secretariat entities and support implementation across the United Nations system;",
    "40": "Requests the Secretary-General to submit to the General Assembly at its eighty-first session a progress report on steps taken by the United Nations system towards mainstreaming disability inclusion, including implementation of the United Nations Disability Inclusion Strategy, within existing resources;",
    "41": "Calls upon Member States, the United Nations and other relevant stakeholders to take part in implementing the recommendations endorsed by the Steering Committee on Accessibility in June 2019;",
    "42": "Requests the Secretary-General to ensure that all Committee members can participate in the work of the Committee on an equal basis by guaranteeing necessary support and access to information, within existing resources and when requested with sufficient time in advance, including by providing sign language assistance needed by Committee members, in accordance with article 34 of the Convention on the Rights of Persons with Disabilities and rule 7 of the rules of procedure of the Committee on the Rights of Persons with Disabilities;",
    "43": "Also requests the Secretary-General to submit to the General Assembly, prior to the start of its eighty-second session, a comprehensive report made available in accessible formats marking the twentieth anniversary of the adoption of the Convention on the Rights of Persons with Disabilities by the Assembly, assessing progress, good practices, areas of opportunity and challenges in the implementation of the Convention, in consultation with persons with disabilities, including through their representative organizations, relevant United Nations entities, including the Office of the United Nations High Commissioner for Human Rights, the Committee on the Rights of Persons with Disabilities, the United Nations Global Disability Fund and the United Nations Children\u2019s Fund, taking into account the views of relevant stakeholders and using existing available materials, and to include a segment on the status of the Convention and the Optional Protocol thereto;",
    "44": "Further requests the Secretary-General to continue to maintain the levels of resources required by the relevant offices in the United Nations system for the fulfilment of their tasks with respect to their work on the rights of and inclusive development for persons with disabilities."
  },
  "agenda_items": [
    "Item 71"
  ],
  "symbol_references": []
}