{
  "symbol": "A/RES/73/309",
  "filename": "A_RES_73_309.pdf",
  "title": "73/309. Financing of the Regional Service Centre in Entebbe, Uganda",
  "text": "United Nations \nA/RES/73/309 \n \n \nGeneral Assembly \nDistr.: General \n17 July 2019 \n \n19-11305 (E)    190719 \n*1911305* \n \n \nSeventy-third session \nAgenda item 150 \n \n \n \n \n Resolution adopted by the General Assembly on 3 July 2019 \n \n \n \n \n[on the report of the Fifth Committee (A/73/936)] \n \n \n 73/309. Financing of the Regional Service Centre in Entebbe, Uganda \n \n \n \nThe General Assembly, \n \nRecalling its resolutions 69/307 of 25 June 2015, 70/289 of 17 June 2016, \n71/293 of 30 June 2017 and 72/286 of 5 July 2018, as well as its decision 72/558 of \n5 July 2018,  \n \nHaving considered the reports of the Secretary-General on the financing of the \nRegional Service Centre in Entebbe, Uganda,1 and the related report of the Advisory \nCommittee on Administrative and Budgetary Questions,2  \n \n1. \nReaffirms its resolutions 57/290 B of 18 June 2003, 59/296 of 22 June \n2005, 60/266 of 30 June 2006, 61/276 of 29 June 2007, 64/269 of 24 June 2010, \n65/289 of 30 June 2011, 66/264 of 21 June 2012, 69/307, and 70/286 of 17 June 2016, \nand requests the Secretary-General to ensure the full implementation of their relevant \nprovisions; \n \n2. \nTakes note of the reports of the Secretary-General;1 \n \n3. \nEndorses the conclusions and recommendations contained in the report of \nthe Advisory Committee on Administrative and Budgetary Questions,2 subject to the \nprovisions of the present resolution, and requests the Secretary-General to ensure \ntheir full implementation; \n \n4. \nAcknowledges the support of the Government of Uganda in facilitating the \nwork of the United Nations at the Regional Service Centre in Entebbe, Uganda;  \n \n5. \nRecalls the role of the Transportation and Movements Integrated Control \nCentre, notes the precipitous decline in the number of flight hours, and requests the \nSecretary-General to provide more information regarding the utilization of the \nIntegrated Control Centre, including the cause of the decline, in the context of his \nnext report; \n__________________ \n \n1  A/73/612 and A/73/764. \n \n2  A/73/755/Add.14. \n\nA/RES/73/309 \n \n19-11305\n2/2 \n \n \n6. \nEncourages the Regional Service Centre to enable support mechanisms to \nfacilitate the air transportation services provided by Member States to peacekeeping \nmissions in the region from Entebbe; \n \n7. \nEmphasizes the importance of the accountability system of the Secretariat, \nand requests the Secretary-General to continue to strengthen risk management and \ninternal controls in the management of peacekeeping budgets and to report thereon in \nthe context of his next report;  \n \n8. \nAlso emphasizes the importance of overall budgetary performance in \npeacekeeping operations, and requests the Secretary-General to continue to \nimplement the recommendations of the relevant oversight bodies and to report thereon \nin the context of the performance reports;  \n \n \n \nBudget performance report for the period from 1 July 2017 to 30 June 2018 \n \n \n9. \nTakes note of the report of the Secretary-General on the budget \nperformance of the Regional Service Centre for the period from 1 July 2017 to \n30 June 2018;3 \n \n \n \nBudget estimates for the period from 1 July 2019 to 30 June 2020 \n \n \n10. Approves the amount of 35,386,900 United States dollars for the \nmaintenance of the Regional Service Centre for the period from 1 July 2019 to \n30 June 2020;  \n \n \n \nFinancing of the budget estimates \n \n \n11. Decides that the requirements for the Regional Service Centre for the \nperiod from 1 July 2019 to 30 June 2020 shall be financed as follows: \n \n(a) \nThe unencumbered balance and other revenue in the amount of 918,100 \ndollars in respect of the financial period ended 30 June 2018, to be applied against \nthe resources required for the period from 1 July 2019 to 30 June 2020; \n \n(b) \nThe amount of 33,044,400 dollars, to be prorated among the budgets of \nthe active client peacekeeping operations for the period from 1 July 2019 to \n30 June 2020; \n \n(c) \nThe amount of 1,424,400 dollars, with respect to the share of client special \npolitical missions, to be funded under section 3, Political affairs, as may be approved \nby the General Assembly in the context of the proposed programme budget for 2020; \n \n(d) \nThe estimated staff assessment income of 3,191,300 dollars, comprising \nthe amount of 3,217,400 dollars for the period from 1 July 2019 to 30 June 2020 and \nthe decrease of 26,100 dollars in respect of the period from 1 July 2017 to 30 June \n2018, to be offset against the balance referred to in subparagraph (b) above, to be \nprorated among the budgets of the individual active client peacekeeping operations; \n \n12. Also decides to consider at its seventy-fourth session the question of the \nfinancing of the Regional Service Centre. \n \n97th plenary meeting \n3 July 2019 \n \n \n__________________ \n \n3  A/73/612. \n",
  "paragraphs": {
    "1": "Reaffirms its resolutions 57/290 B of 18 June 2003, 59/296 of 22 June 2005, 60/266 of 30 June 2006, 61/276 of 29 June 2007, 64/269 of 24 June 2010, 65/289 of 30 June 2011, 66/264 of 21 June 2012, 69/307, and 70/286 of 17 June 2016, and requests the Secretary-General to ensure the full implementation of their relevant provisions;",
    "2": "Takes note of the reports of the Secretary-General;1",
    "3": "Endorses the conclusions and recommendations contained in the report of the Advisory Committee on Administrative and Budgetary Questions,2 subject to the provisions of the present resolution, and requests the Secretary-General to ensure their full implementation;",
    "4": "Acknowledges the support of the Government of Uganda in facilitating the work of the United Nations at the Regional Service Centre in Entebbe, Uganda;",
    "5": "Recalls the role of the Transportation and Movements Integrated Control Centre, notes the precipitous decline in the number of flight hours, and requests the Secretary-General to provide more information regarding the utilization of the Integrated Control Centre, including the cause of the decline, in the context of his next report; __________________ 1 A/73/612 and A/73/764. 2 A/73/755/Add.14. A/RES/73/309 19-11305 2/2",
    "6": "Encourages the Regional Service Centre to enable support mechanisms to facilitate the air transportation services provided by Member States to peacekeeping missions in the region from Entebbe;",
    "7": "Emphasizes the importance of the accountability system of the Secretariat, and requests the Secretary-General to continue to strengthen risk management and internal controls in the management of peacekeeping budgets and to report thereon in the context of his next report;",
    "8": "Also emphasizes the importance of overall budgetary performance in peacekeeping operations, and requests the Secretary-General to continue to implement the recommendations of the relevant oversight bodies and to report thereon in the context of the performance reports; Budget performance report for the period from 1 July 2017 to 30 June 2018",
    "9": "Takes note of the report of the Secretary-General on the budget performance of the Regional Service Centre for the period from 1 July 2017 to 30 June 2018;3 Budget estimates for the period from 1 July 2019 to 30 June 2020",
    "10": "Approves the amount of 35,386,900 United States dollars for the maintenance of the Regional Service Centre for the period from 1 July 2019 to 30 June 2020; Financing of the budget estimates",
    "11": "Decides that the requirements for the Regional Service Centre for the period from 1 July 2019 to 30 June 2020 shall be financed as follows: (a) The unencumbered balance and other revenue in the amount of 918,100 dollars in respect of the financial period ended 30 June 2018, to be applied against the resources required for the period from 1 July 2019 to 30 June 2020; (b) The amount of 33,044,400 dollars, to be prorated among the budgets of the active client peacekeeping operations for the period from 1 July 2019 to 30 June 2020; (c) The amount of 1,424,400 dollars, with respect to the share of client special political missions, to be funded under section 3, Political affairs, as may be approved by the General Assembly in the context of the proposed programme budget for 2020; (d) The estimated staff assessment income of 3,191,300 dollars, comprising the amount of 3,217,400 dollars for the period from 1 July 2019 to 30 June 2020 and the decrease of 26,100 dollars in respect of the period from 1 July 2017 to 30 June 2018, to be offset against the balance referred to in subparagraph (b) above, to be prorated among the budgets of the individual active client peacekeeping operations;",
    "12": "Also decides to consider at its seventy-fourth session the question of the financing of the Regional Service Centre. 97th plenary meeting 3 July 2019 __________________ 3 A/73/612."
  },
  "agenda_items": [
    "Item 150"
  ],
  "symbol_references": []
}