{
  "symbol": "A/RES/79/205",
  "filename": "A_RES_79_205.pdf",
  "title": "79/205. Disaster risk reduction",
  "text": "United Nations \nA/RES/79/205\n \n \nGeneral Assembly \nDistr.: General \n23 December 2024 \n \n24-24345 (E)     \n*2424345* \n \n \nSeventy-ninth session \nAgenda item 18 (c) \nSustainable development: disaster risk reduction \n \n \n \n \n Resolution adopted by the General Assembly \non 19 December 2024 \n \n \n \n \n[on the report of the Second Committee (A/79/437/Add.3, para. 7)] \n \n \n 79/205. Disaster risk reduction \n \n \n \nThe General Assembly, \n \nRecalling its resolution 78/152 of 19 December 2023 and all previous relevant \nresolutions,  \n \nRecalling also its resolution 73/230 of 20 December 2018 on the effective global \nresponse to address the impacts of the El Ni\u00f1o phenomenon and all previous relevant \nresolutions, and recalling further the decision on this subject matter taken in decision \n74/537 B of 11 August 2020, \n \nRecalling further the Sendai Declaration 1  and the Sendai Framework for \nDisaster Risk Reduction 2015\u20132030,2 \n \nRecalling the Rio Declaration on Environment and Development, 3 Agenda 21,4 \nthe Programme for the Further Implementation of Agenda 21, 5 the Johannesburg \nDeclaration on Sustainable Development 6 and the Plan of Implementation of the \nWorld Summit on Sustainable Development (Johannesburg Plan of Implementation), 7 \nand reaffirming the outcome document of the United Nations Conference on \n__________________ \n \n1  Resolution 69/283, annex I. \n \n2  Ibid., annex II. \n \n3  Report of the United Nations Conference on Environment and Development, Rio de Janeiro, \n3\u2013 14 June 1992, vol. I, Resolutions Adopted by the Conference (United Nations publication, \nSales No. E.93.I.8 and corrigendum), resolution 1, annex I. \n \n4  Ibid., annex II. \n \n5  Resolution S-19/2, annex. \n \n6  Report of the World Summit on Sustainable Development, Johannesburg, South Africa, \n26 August\u20134 September 2002 (United Nations publication, Sales No. E.03.II.A.1 and \ncorrigendum), chap. I, resolution 1, annex. \n \n7  Ibid., resolution 2, annex. \n\nA/RES/79/205 \nDisaster risk reduction\n \n24-24345\n2/18 \n \nSustainable Development, entitled \u201cThe future we want\u201d, 8 in particular the decisions \nrelated to disaster risk reduction, \n \nReaffirming its resolution 70/1 of 25 September 2015, entitled \u201cTransforming \nour world: the 2030 Agenda for Sustainable Development\u201d, in which it adopted a \ncomprehensive, far-reaching and people-centred set of universal and transformative \nSustainable Development Goals and targets, its commitment to working tirelessly for \nthe full implementation of the Agenda by 2030, its recognition that eradicating \npoverty in all its forms and dimensions, including extreme poverty, is the greatest \nglobal challenge and an indispensable requirement for sustainable development, its \ncommitment to achieving sustainable development in its three dimensions \u2013 \neconomic, social and environmental \u2013 in a balanced and integrated manner, and to \nbuilding upon the achievements of the Millennium Development Goals and seeking \nto address their unfinished business, \n \nReaffirming also its resolution 69/313 of 27 July 2015 on the Addis Ababa \nAction Agenda of the Third International Conference on Financing for Development, \nwhich is an integral part of the 2030 Agenda for Sustainable Development, supports \nand complements it, helps to contextualize its means of implementation targets with \nconcrete policies and actions, and reaffirms the strong political commitment to \naddress the challenge of financing and creating an enabling environment at all levels \nfor sustainable development in the spirit of global partnership and solidarity,  \n \nReaffirming further the New Urban Agenda, adopted at the United Nations \nConference on Housing and Sustainable Urban Development (Habitat III), held in \nQuito from 17 to 20 October 2016,9 and recognizing the linkages between disaster \nrisk reduction and sustainable urban development, \n \nRecognizing the need for a broader and a more people-centred preventive \napproach to disaster risk, reflecting the 2030 Agenda, and that disaster risk reduction \npractices need to be multi-hazard and multisectoral, inclusive and accessible in order \nto be efficient and effective, \n \nReiterating the call in the Sendai Framework for the substantial reduction of \ndisaster risk and losses in lives, livelihoods and health and in the economic, physical, \nsocial, cultural and environmental assets of persons, businesses, communities and \ncountries, \n \nRecalling that the Sendai Framework applies to risks of small-scale and large-\nscale, frequent and infrequent, sudden- and slow-onset disasters caused by natural or \nhuman-made hazards, as well as related environmental, technological and biological \nhazards and risks, \n \nExpressing its deep concern at the number and scale of disasters and their \ndevastating impact this year and in recent years, which have resulted in massive loss \nof life, food insecurity, water-related challenges, displacement, humanitarian needs \nand long-term negative economic, social and environmental consequences for \nvulnerable societies throughout the world, and which hamper the achievement of their \nsustainable development, in particular that of developing countries, \n \nRecognizing that disaster risk is increasingly complex and systemic and that \nhazards can trigger each other with cascading impacts across sectors and geographies, \nas well as at the local, national, regional and global levels, and that the interrelation \nof risks across multiple dimensions and scales and potential unintended negative \nconsequences should inform development policies and investments, emphasizing that \nthese policies should be oriented towards building resilience and achieving \n__________________ \n \n8  Resolution 66/288, annex. \n \n9  Resolution 71/256, annex. \n\nDisaster risk reduction \nA/RES/79/205\n \n3/18\n24-24345 \n \nsustainability and the Sustainable Development Goals, and recalling in this regard the \nfindings contained in the Sustainable Development Goals Report 2023: Special \nEdition, the Global Sustainable Development Report and the 2023 and 2024 special \nreports of the Global Assessment Report on Disaster Risk Reduction, and stressing \nthe importance of an integrated understanding of disaster risk in the implementation \nof the 2030 Agenda, the Paris Agreement10 and the Sendai Framework, \n \nRecognizing also the importance of promoting policies and planning that build \nresilience and reduce displacement risk in the context of disasters, including through \ninternational, regional, subregional, transboundary and bilateral cooperation,  \n \nNoting that the El Ni\u00f1o phenomenon has a recurring character and can lead to \nextensive natural hazards with the potential to seriously affect humankind, recalling \nthat the peak of the 2015/16 El Ni\u00f1o phenomenon was comparable in strength to the \n1982/83 and 1997/98 events and, therefore, one of the strongest on record, and \naffected more than 60 million people during 2015 and 2016, in particular in \ndeveloping countries, with significant short- and long-term impacts on the health of \nindividuals, the economy and food production locally, regionally and globally, \nparticularly affecting people whose livelihood depends on agriculture, fisheries and \nlivestock activities, and noting the impacts of the protracted 2020\u20132023 La Ni\u00f1a \nphase of the El Ni\u00f1o Southern Oscillation on heat and drought, wildfires, heavy \nrainfall and flooding, with implications for, inter alia, livelihoods and food security, \nand loss of biodiversity, which have combined with the impacts of climate change, \nand noting the impacts of the 2023\u20132024 El Ni\u00f1o phenomenon conditions, which \ncontributed towards 2023 being the warmest year on record, at 1.45 degrees Celsius \nabove the pre-industrial average, by a significant margin of 0.12 degrees Celsius, \nimpacting other parts of the climate system, including ocean heat, the cryosphere and \nsea level rise, and contributing towards heatwaves, droughts and flooding, with \nimplications for livelihoods, food security and loss of biodiversity, \n \nNoting with concern the increasing chance of La Ni\u00f1a conditions re-emerging \nin late 2024, with a 60 per cent chance of La Ni\u00f1a conditions developing from \nOctober,  \n \nReaffirming the importance of strengthening international cooperation, in the \nface of natural and human-made hazards, including weather-related hazards, those \ndriven by natural climate cycles such as the El Ni\u00f1o Southern Oscillation, and the \nadverse effects of climate change, to estimate and prevent major damage and ensure \nan adequate response, early action and attention to the affected populations in a timely \nmanner in order to enhance resilience to their impacts, and recognizing in this regard \nthe importance of developing risk-informed strategies, risk finance tools, including \nforecast-based financing approaches and disaster risk insurance mechanisms and \ncoordinated multi-hazard early warning systems, including timely risk communication \nat the local, national and regional levels, \n \nNoting with great concern the severe negative impact on human health, safety \nand well-being caused by the coronavirus disease (COVID-19) pandemic, as well as \nthe severe disruption to societies and economies and the devastating impact on lives \nand livelihoods, and that the poorest and most vulnerable are the hardest hit by the \npandemic, reaffirming the ambition to get back on track to achieve the Sustainable \nDevelopment Goals by designing and implementing sustainable and inclusive \nrecovery strategies to accelerate progress towards the full implementation of the 2030 \nAgenda for Sustainable Development and to help to reduce the risk of and build \nresilience to future shocks, crises and pandemics, including by strengthening health \nsystems and achieving universal health coverage, and recognizing that equitable and \n__________________ \n \n10  Adopted under the UNFCCC in FCCC/CP/2015/10/Add.1, decision 1/CP.21. \n\nA/RES/79/205 \nDisaster risk reduction\n \n24-24345\n4/18 \n \ntimely access for all to safe, quality, effective and affordable COVID-19 vaccines, \ntherapeutics and diagnostics are an essential part of a global response based on unity, \nsolidarity, renewed multilateral cooperation and the principle of leaving no one behind, \n \nRecognizing that it is urgent and critical to anticipate, plan for and reduce \ndisaster risk, expressing deep concern at the devastating impacts of COVID-19 and \nclimate change on sustainable development, which have deepened vulnerabilities to \ndisasters and exposure to hazards and have highlighted the urgency of implementing \nthe Sendai Framework as an integral part of the 2030 Agenda, and noting in this \nregard that recovery from the COVID-19 pandemic will provide opportunities for and \nshould be accompanied by policies and focused action to understand disaster risk, \nstrengthen disaster risk governance to manage disaster risk, invest in disaster risk \nreduction for resilience and enhance disaster preparedness for effective response and \nto build back better in recovery, rehabilitation and reconstruction through a resilient, \nsustainable and inclusive recovery, as well as to address the underlying drivers of \ndisaster risk and build resilience across systems, integrate systemic risk management \nand strengthen multisectoral and multi-hazard approaches to disaster risk reduction \nand disaster risk finance arrangements and support sustainable and inclusive recovery, \naddressing climate change as one of the drivers of disaster risk, \n \nRecalling the Bangkok Principles for the implementation of the health aspects \nof the Sendai Framework as a contribution to the Sendai Framework to build resilient \nhealth systems, \n \nRecalling also the high-level political forum on sustainable development \nconvened under the auspices of the General Assembly (Sustainable Development \nGoals Summit) on 18 and 19 September 2023 and the commitment to promote \nresilience and reduce disaster risk contained in the adopted political declaration, \n \nRecognizing climate change as one of the drivers of disaster risk and that the \nadverse effects of climate change, as contributors to environmental degradation and \nextreme weather events, in certain instances contribute, among other factors, to \ndisaster-induced human mobility, and in this regard acknowledging the \ninternationally agreed outcomes adopted under the United Nations Framework \nConvention on Climate Change11 and the Paris Agreement,12  \n \nRecognizing also that disasters, many of which are exacerbated by climate \nchange and are increasing in frequency and intensity, significantly impede progress \ntowards sustainable development,  \n \nReaffirming the Paris Agreement, and encouraging all its parties to fully \nimplement the Agreement, and parties to the United Nations Framework Convention \non Climate Change that have not yet done so to deposit their instruments of \nratification, acceptance, approval or accession, where appropriate, as soon as possible,  \n \nRecalling the holding of the Climate Action Summit convened by the Secretary-\nGeneral on 23 September 2019,  \n \nWelcoming the convening of the twenty-ninth session of the Conference of the \nParties to the United Nations Framework Convention on Climate Change in Baku, \nfrom 11 to 22 November 2024, and looking forward to the thirtieth session of the \nConference of the Parties to the United Nations Framework Convention on Climate \nChange to be held in the city of Bel\u00e9m, Brazil, from 10 to 21 November 2025,  \n \nWelcoming also the convening of the United Nations Conference on the Midterm \nComprehensive Review of the Implementation of the Objectives of the International \n__________________ \n \n11  United Nations, Treaty Series, vol. 1771, No. 30822. \n \n12  Adopted under the UNFCCC in FCCC/CP/2015/10/Add.1, decision 1/CP.21. \n\nDisaster risk reduction \nA/RES/79/205\n \n5/18\n24-24345 \n \nDecade for Action, \u201cWater for Sustainable Development\u201d 2018\u20132028 in New York \nfrom 22 to 24 March 2023, and looking forward to the convening of the 2026 United \nNations Water Conference, to be co-hosted by Senegal and the United Arab Emirates \nand to be held in the United Arab Emirates from 2 to 4 December 2026, and the 2028 \nUnited Nations Conference on the Final Comprehensive Review of the \nImplementation of the Objectives of the International Decade for Action, \u201cWater for \nSustainable Development\u201d, 2018\u20132028, to be hosted by Tajikistan,  \n \nHighlighting the synergies between the implementation of the Sendai \nFramework, the 2030 Agenda and the Paris Agreement, 13 \n \nNoting with concern the findings contained in the special report of the \nIntergovernmental Panel on Climate Change on the impacts of global warming of \n1.5 degrees Celsius above pre-industrial levels and related global greenhouse gas \nemission pathways, Global Warming of 1.5\u00b0C, in the context of strengthening the \nglobal response to the threat of climate change, sustainable development and efforts \nto eradicate poverty, the findings contained in the special report of the Panel on \nclimate change, desertification, land degradation, sustainable land management, food \nsecurity and greenhouse gas fluxes in terrestrial ecosystems, entitled Climate Change \nand Land, the findings contained in the special report of the Panel entitled The Ocean \nand Cryosphere in a Changing Climate, and the findings contained in the contribution \nof Working Groups I, II, and III, as well as the synthesis report for the Sixth \nAssessment Report of the Intergovernmental Panel on Climate Change,  \n \nStressing the urgent need to address the unprecedented global decline in \nbiodiversity, recalling with concern the findings of the Intergovernmental Science-\nPolicy Platform on Biodiversity and Ecosystem Services, further recalling the \nKunming-Montreal Global Biodiversity Framework adopted at the fifteenth meeting \nof the Conference of the Parties to the Convention on Biological Diversity and urging \nits early, inclusive and effective implementation, and welcoming the convening of the \nsixteenth meeting of the Conference of the Parties to the Convention on Biological \nDiversity, held in Cali, Colombia, from 21 October to 1 November 2024, on the theme \n\u201cPeace with nature\u201d,  \n \nRecognizing that disaster-prone developing countries, in particular the least \ndeveloped countries, small island developing States, landlocked developing countries \nand African countries, as well as middle-income countries facing specific challenges, \nwarrant particular attention in view of their higher vulnerability and risk levels, \nincluding access to climate and disaster risk finance, which often greatly exceed their \ncapacity to prepare for, respond to and recover from disasters, and recognizing also \nthat similar attention and appropriate assistance should also be extended to other \ndisaster-prone countries with specific characteristics, such as archipelagic countries, \nas well as countries with extensive coastlines,  \n \nRecalling the adoption of the Doha Programme of Action for the Least \nDeveloped Countries14 on 17 March 2022, recognizing that, guided by the principles \nof resilience-building and risk reduction, implementation of the Programme of Action \ncan support the integration of disaster risk reduction into sustainable development \npolicies and social protection strategies and international support to the least \ndeveloped countries, and recalling the convening of the second part of the Fifth \nUnited Nations Conference on the Least Developed Countries, held in Qatar from 5 to \n9 March 2023, to raise ambition and accelerate action to reduce disaster risk in the \nleast developed countries,  \n__________________ \n \n13  Adopted under the UNFCCC in FCCC/CP/2015/10/Add.1, decision 1/CP.21. \n \n14  Resolution 76/258, annex. \n\nA/RES/79/205 \nDisaster risk reduction\n \n24-24345\n6/18 \n \n \nWelcoming the adoption of the Antigua and Barbuda Agenda for Small Island \nDeveloping States: A Renewed Declaration for Resilient Prosperity 15 at the fourth \nInternational Conference on Small Island Developing States, held in Antigua and \nBarbuda from 27 to 30 May 2024, which identifies the mainstreaming of disaster risk \nreduction as a clear priority, and that its implementation can, inter alia, support the \nintegration of disaster risk reduction into sustainable development policies, \nstrengthen social protection strategies and enhance international support to the small \nisland developing States in this regard,  \n \nLooking forward to the convening of the third United Nations Conference on \nLandlocked Developing Countries, which will, inter alia, provide an opportunity for \nthe international community to scale up its support to landlocked developing \ncountries in their efforts to reduce disaster risk,  \n \nRecalling the commitment contained in the Addis Ababa Action Agenda to \ninvest in efforts to strengthen the capacity of national and local actors to manage and \nfinance disaster risk, as part of national sustainable development strategies, and to \nensure that countries can draw on international assistance when needed,  \n \nReiterating the pledge that no one will be left behind, reaffirming the \nrecognition that the dignity of the human person is fundamental, and the wish to see \nthe Goals and targets met for all nations and peoples and for all segments of society, \nand recommitting to endeavour to reach the furthest behind first,  \n \nNoting the progress on the initiative of the Food and Agriculture Organization \nof the United Nations and the United Nations Environment Programme, in close \ncooperation with the United Nations Office for Disaster Risk Reduction, to develop \nand implement a Global Fire Management Hub to reduce the increasingly worrying \nimpacts of wildfires, noting the need, as appropriate, to scale up efforts for fire \nprevention and fire suppression,  \n \nStriving to adopt an integrated approach to wildland fire management, including \nearly warning systems, to prevent, manage and address the negative impacts of \nextreme wildfires and related disasters, while recognizing ecological benefits of fire, \nthrough policy interventions and actions, harnessing science and technology and \nenhanced international and regional cooperation, as appropriate, and in this regard \nnoting the Landscape Fire Governance Framework,  \n \nNoting the launch of the Gender Action Plan to support the implementation of \nthe Sendai Framework for Disaster Risk Reduction 2015\u20132030 on 18 March 2024,  \n \n1. \nTakes note of the report of the Secretary-General on the implementation of \nGeneral Assembly resolution 78/152;16 \n \n2. \nUrges the effective implementation of the Sendai Declaration and the \nSendai Framework for Disaster Risk Reduction 2015\u20132030;  \n \n3. \nWelcomes the convening of the high-level meeting on the midterm review \nof the Sendai Framework on 18 and 19 May 2023 at which the General Assembly \nadopted the political declaration on the midterm review of the Sendai Framework; 17  \n \n4. \nReiterates its call for the prevention of new and the reduction of existing \ndisaster risk through the implementation of integrated and inclusive economic, \nstructural, legal, social, health, cultural, educational, environmental, technological, \npolitical, financial and institutional measures that prevent and reduce hazard exposure \n__________________ \n \n15  Resolution 78/317, annex. \n \n16  A/79/268. \n \n17  Resolution 77/289, annex. \n\nDisaster risk reduction \nA/RES/79/205\n \n7/18\n24-24345 \n \nand vulnerability to disaster, increase preparedness for response and recovery and \nthus strengthen resilience;  \n \n5. \nUnderlines the need to address the economic, social and environmental \nimpacts of disasters caused by human-made or natural hazards, many of which are \nexacerbated by climate change, in this regard stresses the urgent need to enhance \nadaptive capacity, strengthen resilience and reduce vulnerability to climate change \nand extreme weather events, and urges Member States to continue to engage in \nadaptation planning processes and to enhance cooperation in disaster risk reduction \nat all levels;  \n \n6. \nStresses the significant need to improve means of implementation and \nstrengthen capacity-building, financial resources, data and technology and partnerships \nto assist developing countries in implementing the Sendai Framework, and recognizes \nin this regard the need for sustainable and predictable investment in disaster risk \nreduction in all sectors;  \n \n7. \nRecognizes the ongoing efforts of the Coalition for Disaster-Resilient \nInfrastructure, the Risk-Informed Early Action Partnership, the Early Warnings for \nAll initiative and the Climate Risk and Early Warning Systems (CREWS) initiative;  \n \n8. \nAlso recognizes that in some cases the use of public debt and renewed \nexternal borrowing to absorb the impact of a disaster could lead to higher debt \nservicing for developing countries and constrain their growth and their capacity to \ninvest in long-term resilience-building, and acknowledges that, with each new \ndisaster, financial vulnerabilities may grow and domestic response capacities may \nweaken, and in that regard welcomes the development of climate-resilient debt \nclauses, where appropriate, and the exploration of clauses that consider other \ncatastrophic external shocks;  \n \n9. \nFurther recognizes the need for the global community, including \ninternational financial institutions, development banks and the private sector, to better \nintegrate inclusive disaster risk reduction in decision-making, with more transparent \naccounting of exposure and management of disaster-related risks, and enhance efforts \nto scale up disaster risk reduction financing instruments to meet the scale of financing \nneeded by developing countries to prevent and reduce risks and build resilience \nagainst current and future shocks and hazards;  \n \n10. Calls upon all relevant actors to work towards the achievement of the \nglobal targets adopted in the Sendai Framework;  \n \n11. \nRecognizes progress made in achieving target (e) of the Sendai Framework \nand that the development and implementation of risk-informed strategic plans, \npolicies, programmes and investments and national and local disaster risk reduction \nstrategies are essential for sustainable development and the achievement of the \nSustainable Development Goals;  \n \n12. Reaffirms the importance of developing multi-hazard strategies at the \nlocal, national, subregional, regional and international levels, in line with the Sendai \nFramework, that aim to prevent, mitigate and repair the adverse economic, social and \nenvironmental impacts of natural climate cycles, such as the El Ni\u00f1o Southern \nOscillation phenomenon, while recognizing ongoing national initiatives by affected \ncountries to strengthen their capacities;  \n \n13. Stresses that, during neutral El Ni\u00f1o Southern Oscillation phenomenon \nyears, it is critical to prepare for, build resilience to and reduce the risks of the next \nevent, particularly in the context of existing climate-related impacts, including \nthrough integrated plans, and calls upon the international community to provide \n\nA/RES/79/205 \nDisaster risk reduction\n \n24-24345\n8/18 \n \nfinancial, technical and capacity-building support to countries affected by the El Ni\u00f1o \nSouthern Oscillation phenomenon, prioritizing resources to developing countries;  \n \n14. Welcomes the convening of the joint thematic event by the President of the \nGeneral Assembly and the President of the Economic and Social Council entitled \u201cEl \nNi\u00f1o 2023\u20132024: Actions for the safety, sustainability, and resilience of people and \nthe planet\u201d on 30 April 2024;  \n \n15. Urges the international community to accelerate progress and allocate the \nresources necessary to support the development and implementation of inclusive, \nincluding gender-responsive, and participatory, multi-hazard national and local \ndisaster risk reduction strategies with a broadened scope beyond preparedness and \nresponse to include a focus on risk reduction and prevention, in line with the Sendai \nFramework, with a particular focus on local strategies and programmes, to promote \ncoherence and integration with sustainable development and climate change \nadaptation strategies including national adaptation plans, as well as sector-specific \nplans, to include the objective of preparing to build back better through sustainable, \nresilient and inclusive recovery in disaster risk reduction strategies and, where \nappropriate, to incorporate considerations regarding the risk of disaster displacement, \nin accordance with national circumstances, making use of practical guidance to \nsupport the achievement of target (e), and recalls in this regard the relevant voluntary \n\u201cWords into action\u201d guidelines;  \n \n16. Encourages Member States to strengthen national and local disaster risk \ngovernance by implementing the whole-of-government and all-of-society approaches \nthrough establishing or strengthening national platforms for disaster risk reduction, \nor similar mechanisms, for multisectoral and inter-institutional coordination, with \nclearly defined roles and responsibilities for disaster risk reduction across ministries \nand institutions and at the national, subnational and local levels, and by expanding \ndisaster risk reduction beyond national disaster management and civil protection \nauthorities, or equivalent agencies, to include all branches of government and all \nrelevant stakeholders, as appropriate, and welcomes the \u201cMaking Cities Resilient \n2030\u201d initiative in support of local capacities for disaster risk governance and of \npromoting urban resilience;  \n \n17. Expresses concern that countries affected by protracted humanitarian \ncrises and emergencies are among those most vulnerable to the impacts of disasters \nand are furthest behind in implementing the Sendai Framework, and recognizes that \nimplementation of the Sendai Framework can address drivers of vulnerability and \nexposure to build resilience and reduce humanitarian impacts and needs, and in this \nregard recognizes the need for multidimensional and comprehensive risk assessment \nand the promotion of complementarity and coherence between humanitarian and \ndevelopment assistance, in accordance with respective mandates, which can \ncontribute to strengthening resilience and climate change adaptation, for a more \ntargeted and effective approach to prevention and resilience-building;  \n \n18. Notes with appreciation the voluntary national reports and reporting \nagainst the seven global targets through the Sendai Framework monitor, takes note of \nthe outcomes of the global and regional platforms for disaster risk reduction, and also \ntakes note of the report on the main findings and recommendations of the midterm \nreview of the implementation of the Sendai Framework 18  and the report of the \nmidterm review of the implementation of the Sendai Framework prepared by the \nUnited Nations Office for Disaster Risk Reduction;19  \n__________________ \n \n18  A/77/640. \n \n19  United Nations Office for Disaster Risk Reduction, The Report of the Midterm Review of the \nImplementation of the Sendai Framework for Disaster Risk Reduction 2015\u20132030 (Geneva, 2023). \n\nDisaster risk reduction \nA/RES/79/205\n \n9/18\n24-24345 \n \n \n19. \nRecognizes the importance of monitoring the Sendai Framework, \nencourages States to use the online monitor to report on progress against the Sendai \nFramework global targets by referring to the report of the open-ended \nintergovernmental expert working group on indicators and terminology relating to \ndisaster risk reduction, 20  also encourages States, while implementing the Sendai \nFramework, to systematically evaluate, record, share and publicly account for disaster \nlosses and understand the economic, social, health, educational, environmental and \ncultural heritage impacts, as appropriate, in the context of event-specific hazard-\nexposure and vulnerability information, and enhance the development and \ndissemination of science-based methodologies and tools to record and share disaster \nlosses and relevant disaggregated data and statistics, as well as to strengthen disaster \nrisk modelling, assessment, mapping, monitoring and multi-hazard early warning \nsystems, and in this regard further encourages efforts to create or enhance systems for \ndata collection and to support the capacity of national statistical offices to integrate \ndata from the Sendai Framework monitor into official national statistics to enhance \nand institutionalize its use in decision-making processes and investments across \nsectors and all relevant ministries and institutions, and to prioritize the collection and \nanalysis of data on disaster loss and the establishment and strengthening of national \ndisaster loss databases, and to develop baselines on current losses, working towards \nthe collection of information on historical disaster losses going back, at least, to 2005, \nif feasible;  \n \n20. Welcomes the operationalization of the new funding arrangements, \nincluding the Fund for responding to loss and damage;  \n \n21. Recalls the decision of the General Assembly authorizing the United \nNations Office for Disaster Risk Reduction to enter into a memorandum of \nunderstanding with the Conference of the Parties to the United Nations Framework \nConvention on Climate Change and the Conference of the Parties serving as the \nMeeting of the Parties to the Paris Agreement regarding the hosting of the secretariat \nof the Santiago network for averting, minimizing and addressing loss and damage \nassociated with the adverse effects of climate change;  \n \n22. Urges States to conduct inclusive and multi-hazard disaster risk \nassessments that consider climate change projections to support evidence-based \ndisaster risk reduction strategies and guide risk-informed development investments \nby the private and public sectors, including comprehensive disaster risk reduction \nfinancing strategies, to support early action and recovery;  \n \n23. Encourages States to strengthen inter-institutional, inclusive coordination \non disaster risk data and integrated analysis, investment in and the transfer of \ntechnology, on mutually agreed terms, to developing countries for the development \nof science and technology and in strengthening capacities for multidimensional and \nmulti-hazard risk assessment, risk analytics, and strategic foresight and monitoring \nof systemic risk, and capitalize on the risk data and risk modelling capacity of the \nprivate sector, including development of tools for multi-hazard risk assessments, and \nin this regard takes note of the ongoing work on the Global Risk Assessment \nFramework and Risk Information Exchange; \n \n24. Also encourages States to prioritize and enhance the allocation of and \naccess to sustainable and predictable financing for disaster risk reduction at all levels, \nand technology transfer to developing countries, in particular for the least developed \ncountries, small island developing States, landlocked developing countries and \nAfrican countries, as well as middle-income countries facing specific challenges, on \nconcessional and preferential terms, as mutually agreed, for the development and \n__________________ \n \n20  A/71/644 and A/71/644/Corr.1. \n\nA/RES/79/205 \nDisaster risk reduction\n \n24-24345\n10/18 \n \nstrengthening of their capacities, including to build resilient health, water, waste \nmanagement and agrifood systems, cultural heritage, transport, energy and digital \nconnectivity systems;  \n \n25. Recognizes the important contribution of healthy ecosystems to reducing \ndisaster risk and building community resilience, encourages all States, United Nations \nentities and other relevant actors to promote nature-based solutions, ecosystem-based \napproaches and other management and conservation approaches, in line with United \nNations Environment Assembly resolution 5/5 of 2 March 2022, 21 at all levels and \nacross all phases of disaster risk reduction and management, and reiterates the \nimportance of the conservation and sustainable use of biodiversity as well as \nproviding long-term and affordable investments in these approaches to reduce the \nimpacts and costs of disasters, and ensure synergies between the implementation of \nthe Sendai Framework and the Kunming-Montreal Global Biodiversity Framework, \nincluding by integrating disaster risk reduction into national biodiversity strategies \nand action plans, as appropriate;  \n \n26. Stresses the need to foster better understanding and knowledge of the \ncauses of disasters, as well as to build and strengthen coping capacities in developing \ncountries through, inter alia, the exchange of best practices, technology transfer on \nmutually agreed terms, educational and training programmes for disaster risk \nreduction, the development of open and accessible data systems to support effective \ndisaster early warning, early action and crisis response, access to relevant data and \ninformation, the strengthening of institutional arrangements and the promotion of \ncommunity participation and ownership through community-based disaster risk \nmanagement approaches, and enhance understanding of risks posed by rapidly \ntransforming, inter alia, economic, social, technological and ecological systems, \nincluding advancements in artificial intelligence;  \n \n27. Acknowledges the importance of community-driven disaster risk reduction \nand resilience efforts, and the need to strengthen the preparedness of communities as \nwell as their ability to respond, including through raising awareness and fostering a \nculture of risk reduction and prevention, and supports efforts to scale up community-\nlevel pre-disaster recovery and reconstruction planning;  \n \n28. Also acknowledges the role of productive assets, including livestock and \nworking animals, and the need to strengthen preparedness, response, recovery, \nrehabilitation and reconstruction by, inter alia, integrating the protection of working \nanimals in disaster risk management plans to enhance long-term community resilience \nwhile also strengthen and promote collaboration and capacity-building for the \nprotection of productive assets, including livestock, working animals, tools and seeds;  \n \n29. Further acknowledges that water is essential to the achievement of the \nSustainable Development Goals, that water-related disasters and multidimensional \nhazards threaten lives, livelihoods, agriculture and basic service infrastructure and \ncause substantial socioeconomic damage and losses, and that sustainable, integrated \ndisaster risk-informed water resource management is necessary for successful disaster \npreparedness, disaster risk reduction and climate change adaptation, in this regard \ninvites all countries to integrate land and water management, including for floods and \ndroughts, into their national and subnational planning and management processes, \nand reiterates that the achievement of the water-related goals and targets would \ncontribute to the successful implementation of the Sendai Framework;  \n \n30. Urges the incorporation of disaster risk management into post-disaster \nrecovery, rehabilitation and reconstruction processes, enhancing the development and \n__________________ \n \n21  UNEP/EA.5/Res.5. \n\nDisaster risk reduction \nA/RES/79/205\n \n11/18\n24-24345 \n \ndissemination of science-based and targeted methodologies and tools and facilitating \ncooperation among States for the sharing of experiences;  \n \n31. Urges Member States, the United Nations and other relevant organizations \nto take further steps to address the food and nutrition needs of affected populations, \nprioritizing tools that strengthen resilience to current crises and future shocks, and \nintegrating a disaster risk reduction perspective aimed at improving food security and \nnutrition;  \n \n32. Recognizes that the Sendai Framework, including its core provision to \n\u201cbuild back better\u201d, provides guidance relevant to a sustainable recovery from \nCOVID-19 and also to identify and address underlying drivers of disaster risk in a \nsystemic manner, that biological hazards require strengthened systematic coordination, \ncoherence and integration between disaster and health risk management systems in \nthe areas of risk assessment, surveillance and early warning, and that resilient health \ninfrastructure and strengthened health systems capable of implementing the \nInternational Health Regulations (2005),22 as well as increasing the overall capacity \nof health systems, including through the application of the Bangkok Principles for the \nimplementation of the health aspects of the Sendai Framework and other relevant \ninitiatives, as appropriate, to reduce overall disaster risk and build disaster resilience, \nwhile also recognizing the value of integrated approaches, including the One Health \napproach and other holistic approaches that foster cooperation between human health, \nanimal health and plant health, as well as environmental and other relevant sectors; \n \n33. Also recognizes that disaster risk reduction requires a multi-hazard and \nsystemic approach and inclusive risk-informed decision-making based on the open \nexchange and dissemination of data disaggregated by, inter alia, income, sex, age and \ndisability, and analysis with an adequate understanding of how the information is to \nbe interpreted and used, as well as on easily accessible, up-to-date, comprehensible, \ninteroperable, science-based, non-sensitive risk information, for a wide range of users \nand decision makers, complemented by traditional knowledge, and in this regard \nencourages States to commence or, as appropriate, further enhance the collection and \nanalysis of data on disaster loss and other relevant disaster risk reduction targets, \ndisaggregated by income, sex, age and disability and other characteristics relevant in \nnational contexts, and to strengthen inter-institutional, inclusive coordination on \ndisaster risk data and integrated analysis, and invites Member States to mobilize \nnational statistical and planning offices and other relevant authorities, and strengthen \ntheir capacity in the systemic collection, analysis and validation of disaster risk data \nto institutionalize its use in decision-making processes and investments across \nsectors;  \n \n34. Welcomes the political declaration adopted by the high-level political \nforum on sustainable development convened under the auspices of the General \nAssembly (Sustainable Development Goals Summit), held in New York on 18 and \n19 September 2023,23 and urges timely action to ensure its full implementation;  \n \n35. Also welcomes progress under the Strategic Framework on Geospatial \nInformation and Services for Disasters24 for the period 2020\u20132023, which is a guide \nfor Member States to ensure the availability and accessibility of quality geospatial \ninformation and services across all phases of disaster risk reduction and management, \nand encourages enhanced support to developing countries for the implementation of \nthe Framework as a means to provide quality geospatial information and services to \nsupport decision-making and disaster risk management efforts, the Sendai Framework \n__________________ \n \n22  World Health Organization, document WHA58/2005/REC/1, resolution 58.3, annex. \n \n23  Resolution 78/1, annex. \n \n24  Economic and Social Council resolution 2018/14, annex. \n\nA/RES/79/205 \nDisaster risk reduction\n \n24-24345\n12/18 \n \nfor Disaster Risk Reduction 2015\u20132030 and achieving the 2030 Agenda for \nSustainable Development;25  \n \n36. Emphasizes the importance of a broader and a more people-centred \npreventive approach to and systemic risk management of disaster risk reduction, \nreflecting the 2030 Agenda for Sustainable Development, recognizing that disaster \nprevention, preparedness, early and anticipatory actions, and resilience-building, in \nmost cases, are significantly more cost-effective than emergency responses, stresses \nthe importance of promoting the further development of and investment in effective, \nnational and regional, multi-hazard early warning mechanisms, where relevant, and \nfacilitating the sharing and exchange of information across all countries;  \n \n37. Recognizes the need for inclusive development of preparedness plans and \nthe importance of systematically identifying the needs of the poor and people in \nvulnerable situations before a disaster hits, and noting the importance of community-\nbased multi-hazard early warning systems; \n \n38. Welcomes the call by the Secretary-General for a United Nations action \nplan to ensure that every person on Earth is protected by early warning systems within \nfive years as an accelerator towards the achievement of target (g) of the Sendai \nFramework, and also welcomes the invitation from States to development partners, \ninternational financial institutions and the operating entities of the Financial \nMechanism to provide support for implementation of the Early Warnings for All \ninitiative, and recognizes the importance of the CREWS initiative in achieving that \ngoal and takes note with appreciation of the findings of the Global Status of \nMulti-hazard Early Warning Systems: Target (g) report, and calls upon all relevant \nentities of the United Nations system to ensure a coordinated and integrated approach \nin the implementation of the early warning action plan presented at the twenty-\nseventh Conference of the Parties to the United Nations Framework Convention on \nClimate Change;  \n \n39. Takes note of the report of the Secretary-General on multi-hazard early \nwarning systems in the least developed countries, 26  and also takes note of the \nrecommendations for accelerating action to address gaps and deliver people-centred, \nend-to-end multi-hazard early warning systems in the least developed countries; \n \n40. Takes note of the operationalization of the Secretary-General\u2019s Action \nAgenda on Internal Displacement, aimed at advancing commitments to enhance the \nprevention of disaster-induced displacement;  \n \n41. Recognizes the increased official reporting through the online Sendai \nFramework monitor, and further encourages States to report on progress against the \nSustainable Development Goals related to disaster risk to provide, inter alia, a \ncomprehensive overview of progress to inform the deliberations and outcomes of the \nhigh-level political forum on sustainable development and the Global Platform for \nDisaster Risk Reduction, and recalls the ongoing work towards integrated national \nclimate change adaptation and national disaster risk reduction strategies as well as the \nSendai Framework targets, and further recalls ongoing work under the Paris \nAgreement27 to apply the Sendai Framework targets in the context of the global goal \non adaptation;  \n \n42.  Encourages countries to apply a comprehensive approach to disaster and \nclimate risk management and to establish or strengthen policy, programmatic and \nfinancing coherence between national climate change adaptation and national disaster \nrisk reduction strategies, as well as sector-specific plans, as appropriate, and apply \n__________________ \n \n25  Resolution 70/1. \n \n26  A/79/288. \n \n27  Adopted under the UNFCCC in FCCC/CP/2015/10/Add.1, decision 1/CP.21. \n\nDisaster risk reduction \nA/RES/79/205\n \n13/18\n24-24345 \n \nthe Sendai Framework for the effective implementation of all the relevant decisions \nof the Conferences of the Parties made under the United Nations Framework \nConvention on Climate Change and the Paris Agreement;28  \n \n43. Reaffirms that the establishment of common indicators and shared data \nsets to measure the Sendai Framework global targets and the disaster risk reduction \ntargets of Sustainable Development Goals 1, 11 and 13, as well as in the development \nof the monitoring and evaluation framework of the Antigua and Barbuda Agenda for \nSmall Island Developing States: A Renewed Declaration for Resilient Prosperity, 29 \nare important contributions to ensure coherence, feasibility and consistency in \nimplementation, the collection of data and reporting, calls for coherence between the \nSendai Framework global targets and the monitoring of the Doha Programme of \nAction, and in this regard recognizes the importance of prioritizing capacity-building \nsupport to developing countries, in particular the least developed countries, small \nisland developing States, landlocked developing countries and African countries, as \nwell as middle-income countries facing specific challenges;  \n \n44. Encourages States to give appropriate consideration to disaster risk \nreduction in the implementation of the 2030 Agenda for Sustainable Development, \nwhere it is reflected across several Goals and targets, including in their voluntary \nnational reviews, inter alia, through the engagement of national Sendai Framework \nfocal points early in the national review process, as appropriate, and stresses the \nimportance of considering disaster risk reduction in the deliberations and outcomes \nof the high-level political forum on sustainable development and integrating disaster \nrisk reduction across the work of the Economic and Social Council;  \n \n45. Reiterates its strong encouragement of and the need for effective \ncoordination and coherence, as applicable, in the implementation of the 2030 Agenda, \nthe Addis Ababa Action Agenda of the Third International Conference on Financing \nfor Development, 30  the Paris Agreement adopted under the United Nations \nFramework Convention on Climate Change, and the Sendai Framework, as well as \nthe United Nations Framework Convention on Climate Change, the Convention on \nBiological Diversity,31 the United Nations Convention to Combat Desertification in \nThose Countries Experiencing Serious Drought and/or Desertification, Particularly in \nAfrica,32 and the New Urban Agenda, while respecting the relevant mandates, in order \nto build synergies and resilience, translate integrated global policy frameworks, as \nappropriate, into national laws, policies or regulations defining roles and \nresponsibilities across the public and private sectors, as well as into integrated \nmultisectoral programmes at the national and local levels, and reduce disaster risk \nacross sectors, and addressing the global challenge of eradicating poverty in all its \nforms and dimensions, including extreme poverty; \n \n46. Recognizes the important work and contribution of regional and \nsubregional organizations in advancing cooperation in disaster risk reduction at the \nregional level, encourages greater engagement and partnership between the United \nNations Office for Disaster Risk Reduction and regional and subregional organizations \nto accelerate the implementation of the Sendai Framework;  \n \n47. Encourages countries, the relevant United Nations bodies, agencies, funds \nand programmes and other relevant institutions and stakeholders to take into \nconsideration the important role of coordinated, inclusive and participatory disaster \nrisk governance across sectors for the achievement of sustainable development and, \n__________________ \n \n28  Adopted under the UNFCCC in FCCC/CP/2015/10/Add.1, decision 1/CP.21. \n \n29  Resolution 78/317, annex. \n \n30  Resolution 69/313, annex. \n \n31  United Nations, Treaty Series, vol. 1760, No. 30619. \n \n32  Ibid., vol. 1954, No. 33480. \n\nA/RES/79/205 \nDisaster risk reduction\n \n24-24345\n14/18 \n \ninter alia, the strengthening of disaster prevention, as well as preparedness for \neffective response, recovery, rehabilitation and reconstruction, including through \ndisaster risk reduction, early warnings systems that lead to early action, and response \nfinancing;  \n \n48. Urges that due consideration continue to be given to the review of the \nglobal progress in the implementation of the Sendai Framework as part of the \nintegrated and coordinated follow-up processes to United Nations conferences and \nsummits, aligned with the Economic and Social Council, the high-level political \nforum on sustainable development and the quadrennial comprehensive policy review \ncycles, as appropriate, taking into account the contributions of the Global Platform \nfor Disaster Risk Reduction and regional and subregional platforms for disaster risk \nreduction and the Sendai Framework monitor;  \n \n49. Reaffirms that international cooperation for disaster risk reduction \nincludes a variety of sources and is a critical element in supporting the efforts of \ndeveloping countries to reduce disaster risk, and encourages States to strengthen \ninternational and regional information exchange and information-sharing, including \nthrough North-South cooperation complemented by South-South and triangular \ncooperation, establishing and networking risk management centres, promoting critical \nscience and technology research cooperation on disaster reduction and improving \ninternational coordination mechanisms to respond to large-scale disasters;  \n \n50. Recognizes that effective and meaningful global and regional partnerships \nand the further strengthening of international cooperation, including the fulfilment of \nrespective commitments of official development assistance by developed countries, \nare essential for effective disaster risk management and the ability of developing \ncountries, including those most vulnerable to disasters, to effectively enhance and \nimplement national disaster risk reduction policies and measures, taking into account \ntheir respective national circumstances and capabilities;  \n \n51. Reaffirms the need for the enhancement of the means of implementation \nand the capacity and capability of developing countries, in particular the least \ndeveloped countries, small island developing States, landlocked developing countries \nand African countries, as well as middle-income countries facing specific challenges, \nincluding the mobilization of support through international cooperation, for the \nprovision of means of implementation to augment domestic efforts in accordance with \ntheir national priorities;  \n \n52. Encourages the incorporation of disaster risk reduction measures, as \nappropriate, into multilateral and bilateral development assistance programmes and \ninfrastructure financing, including through North-South cooperation complemented \nby South-South as well as triangular cooperation, within and across all sectors related \nto sustainable development, and calls for international cooperation that is aligned with \nnational disaster risk reduction strategies and for alignment between risk-informed \nnational development cooperation policies and national disaster risk reduction \nstrategies;  \n \n53. Recognizes that financing for disaster risk reduction requires greater \nattention, and in this regard encourages increased investments in disaster risk \nreduction, including resilient infrastructure, and calls upon the United Nations system \nand its entities, within the scope of their respective mandates, in partnership with \ninternational financial institutions, regional development banks and other relevant \ninstitutions and stakeholders, to support developing countries in developing \ncomprehensive disaster risk reduction financing strategies in support of national and \nlocal disaster risk reduction strategies, and incentivizing investments in resilience, \nprevention and rehabilitation, and to explore the development of tailored financing \n\nDisaster risk reduction \nA/RES/79/205\n \n15/18\n24-24345 \n \nmechanisms for disaster risk reduction, including forecast-based financing \napproaches and disaster risk insurance mechanisms;  \n \n54. Encourages States to allocate increased domestic resources to disaster risk \nreduction, including to strengthen resilience and upgrade existing infrastructure, to \ninclude disaster risk reduction in budgeting and financial planning across all relevant \nsectors, and to ensure that national financing frameworks and infrastructure plans are \nrisk-informed, according to national plans and policies;  \n \n55. Acknowledges that earthquakes have resulted in significant loss of lives, \ndamage to property, displacement of communities and the loss of livelihoods, food \nsecurity and nutrition, health and access to social infrastructure, calls for support to \ncountries to better understand the exposure and vulnerability to earthquake risks, and \nfurther calls upon the international community to provide financial, technical and \ncapacity-building support to countries prone to earthquake risk, prioritizing resources \nto developing countries;  \n \n56. Notes that extreme heat is deadly and disrupts economies and societies, \nand calls for urgent and concerted efforts to enhance international cooperation to \naddress extreme heat;  \n \n57. Recognizes that economic losses are rising as a result of the increasing \nnumber and value of assets exposed to hazards, encourages countries to conduct a \ndisaster risk assessment of existing critical infrastructure, to ensure that infrastructure \nplans are aligned to national disaster risk reduction strategies and risk assessments, \nto support the publication of disaster risk assessments, to make multi-hazard disaster \nrisk assessments a prerequisite for infrastructure, housing and real estate investments \nin all sectors, to routinely conduct stress testing of existing infrastructure and to \nstrengthen regulatory frameworks for land-use planning and building codes, as \nappropriate, towards the achievement of target (d) of the Sendai Framework, and in \nthis regard also encourages countries and other relevant stakeholders to integrate \ndisaster risk reduction considerations into their social, economic and environmental \ninvestments;  \n \n58. Encourages all relevant stakeholders to collaborate with the private sector \nto enhance the resilience of businesses, as well as the societies within which they \noperate, by integrating disaster risk into their management practices, to facilitate \nprivate investments in disaster risk reduction and to promote risk-informed private \ninvestments and the disclosure of disaster risk in business operations and asset values, \nand also encourages the engagement of credit rating agencies, the insurance sector \nand the financial services sector in disaster risk reduction, to support countries in the \ndevelopment of innovative instruments, tools and guidelines for de-risking \ninvestments and to enhance financing available for disaster risk reduction;  \n \n59. Reaffirms that investing in national and local skills, systems and knowledge \nto build resilience and preparedness will save lives, reduce the risk of displacement \nin the context of disasters, strengthen the adaptive capacity of food production \nsystems and enhance food security, cut costs and preserve development gains, and in \nthis regard encourages exploring innovative ways, such as forecast-based financing \napproaches and disaster risk insurance mechanisms, to increase the availability of \nresources for Member States before a disaster is credibly expected to occur;  \n \n60. Recalls that the economic and environmental vulnerability index gives \nconsideration to the impacts of disasters, recognizes the relevance of disaster risk and \nthe impact of disasters in the process of graduation from the least developed country \ncategory, encourages the integration of disaster risk reduction into the smooth \ntransition strategies of graduating countries in order to promote the sustainability of \ndevelopment progress, including the impact assessment of the likely consequences of \n\nA/RES/79/205 \nDisaster risk reduction\n \n24-24345\n16/18 \n \ngraduation and the vulnerability profiles, and also encourages development and \ntrading partners of graduating and recently graduated countries to support those \ncountries in reducing disaster risk and building resilience;  \n \n61. Recognizes the importance of giving priority to the development of local \nand national disaster risk reduction capacity-building, policies, strategies and plans \nwith the participation of all relevant stakeholders, in accordance with national \npractices and legislation;  \n \n62. Also recognizes that, while each State has the primary responsibility for \npreventing and reducing disaster risk, it is a shared responsibility between Governments \nand relevant stakeholders, and recognizes that non-State and other relevant \nstakeholders, including major groups, parliaments, civil society, the International Red \nCross and Red Crescent Movement, non-governmental organizations, Indigenous \nPeoples and their organizations, national platforms for disaster risk reduction focal \npoints for the Sendai Framework, local government representatives, scientific \ninstitutions and the private sector, as well as organizations and relevant agencies, \nfunds and programmes of the United Nations system and other relevant institutions \nand intergovernmental organizations, play an important role as enablers in providing \nsupport to States, in accordance with national policies, laws and regulations, in the \nimplementation of the Sendai Framework at the local, national, regional and global \nlevels, and that greater efforts are needed to mobilize multi-stakeholder partnerships \nfor disaster risk reduction, according to national plans and policies;  \n \n63. Encourages Governments to promote the full, equal, effective and \nmeaningful participation and leadership of women, as well as of persons with \ndisabilities and people in vulnerable situations, the design, management, resourcing \nand implementation of gender-responsive and disability-inclusive disaster risk \nreduction policies, plans and programmes, and recognizes in this regard that women \nand girls are disproportionately exposed to risk, increased loss of livelihoods and even \nloss of life during and in the aftermath of disasters, and that disasters and the \nconsequent disruption to physical, social, economic and environmental networks and \nsupport systems disproportionately affect persons with disabilities and their families;  \n \n64. Stresses the importance of mainstreaming a gender perspective and the \nperspectives of persons with disabilities, as well as other people in vulnerable \nsituations, into disaster risk management, and of engaging and appropriately drawing \non the capacities of children, youth, including young professionals, as contributors in \ndisaster risk management so as to strengthen the resilience of communities and reduce \nsocial vulnerabilities to disasters, and in this regard recognizes the need for the \ninclusive participation and contribution of women, children, older persons, persons \nwith disabilities, Indigenous Peoples and local communities, as well as the role of \nyouth, volunteers, migrants, academia, scientific and research entities and networks, \nbusiness, professional associations, private sector financing institutions and the \nmedia, in all forums and processes related to disaster risk reduction, in accordance \nwith the Sendai Framework;  \n \n65. Acknowledges the continuous work of the entities of the United Nations \nsystem, in accordance with their respective mandates, in supporting the efforts of \ndeveloping countries in the area of disaster risk reduction, including through the \ninclusion, where appropriate, of disaster risk reduction in the United Nations \nSustainable Development Cooperation Framework as part of the common country \nassessment\u2019s multidimensional analysis, requests the relevant United Nations entities \nand United Nations country teams, and urges other relevant stakeholders, to continue \nto integrate disaster risk reduction and the implementation of the Sendai Framework \ninto their work and to align their work with the United Nations Plan of Action on \nDisaster Risk Reduction for Resilience: Towards a Risk-informed and Integrated \n\nDisaster risk reduction \nA/RES/79/205\n \n17/18\n24-24345 \n \nApproach to Sustainable Development, including the supplementary recommendations \nissued in 2023, guided by the Senior Leadership Group on Disaster Risk Reduction \nfor Resilience convened by the Special Representative of the Secretary-General for \nDisaster Risk Reduction, and notes the ongoing work of the Centre of Excellence on \nClimate and Disaster Resilience;  \n \n66. Also acknowledges the importance of the work of the agencies, funds and \nprogrammes of the United Nations system and other relevant institutions in disaster \nrisk reduction, the substantial increase in demands on the United Nations Office for \nDisaster Risk Reduction and the need for timely, stable, adequate and predictable \nresources necessary for supporting the implementation of the Sendai Framework, and \nin this regard encourages Member States to consider providing or augmenting \nvoluntary contributions to the United Nations Office for Disaster Risk Reduction;  \n \n67. Recognizes the continued importance of voluntary funding, and urges \nexisting and new donors to provide sufficient funding and, where possible, to augment \nfinancial contributions to the United Nations Trust Fund for Disaster Reduction to \nsupport the implementation of the Sendai Framework, including through unearmarked \nand, where possible, multi-annual contributions;  \n \n68. Reaffirms the importance of the Global Platform for Disaster Risk \nReduction and the regional and subregional platforms for disaster risk reduction as \nforums to assess and discuss progress on the implementation of the Sendai Framework \nand advance coherence between disaster risk reduction, sustainable development and \nclimate change mitigation and adaptation, including financing, and recognizes their \noutcomes as contributions to the high-level political forum on sustainable development;  \n \n69. Recognizes the importance of the discussions that took place at the seventh \nsession of the Global Platform for Disaster Risk Reduction in Bali, Indonesia, and the \neighth Africa Regional Platform for Disaster Risk Reduction, held in Nairobi, Kenya, \nthe seventh Regional Platform for Disaster Risk Reduction for the Americas and the \nCaribbean, held in Kingston, Jamaica, the fifth Arab Regional Platform for Disaster \nRisk Reduction, held in Rabat, Morocco, the European Forum for Disaster Risk \nReduction, held in Matosinhos, Portugal, and other regional platforms for disaster \nrisk reduction in strengthening the commitment to achieving the targets of the Sendai \nFramework and as valuable inputs to the midterm review;  \n \n70. Expresses its appreciation to the Government of Uruguay for hosting, in \n2023, and to the Governments of Montenegro, Namibia and the Philippines for \nhosting, in 2024, the regional platforms for disaster risk reduction, events jointly \norganized with the United Nations Office for Disaster Risk Reduction, looks forward \nto the regional platform to be convened in Kuwait in 2025, and encourages \nparticipation by all stakeholders, sectors and ministries at the highest level possible \nat the eighth session of the Global Platform for Disaster Risk Reduction to be held in \nGeneva from 2 to 6 June 2025;  \n \n71. Encourages the eighth session of the Global Platform for Disaster Risk \nReduction to include in its discussions ways to enhance preparedness, build resilience, \npromote early actions, reduce risks and to address the impacts of the El Ni\u00f1o/La Ni\u00f1a \nphenomenon, as appropriate, as well as to assess the progress made on the calls to \naction of the political declaration on the midterm review of the Sendai Framework;  \n \n72. Stresses the importance of promoting the incorporation of disaster risk \nknowledge, including disaster prevention, mitigation, preparedness, financing, \nresponse, recovery, reconstruction and rehabilitation, in formal and non-formal \neducation, as well as in civic education at all levels and in professional education and \ntraining, and of raising awareness and creating a culture of disaster prevention, \nresilience and responsible citizenship to foster all-of-society engagement in disaster \n\nA/RES/79/205 \nDisaster risk reduction\n \n24-24345\n18/18 \n \nrisk reduction, and emphasizes the need for new and existing educational \ninfrastructure, school facilities and teaching and learning practices to be risk-\ninformed, resilient and fully accessible to all, which requires channelling financial \nand other resources towards strengthening these efforts;  \n \n73. Recognizes the need to promote traditional, local and Indigenous \nknowledge and wisdom that have been tested and improved through generations \nacross the world, to further strengthen scientific practices and know-how and enhance \nefforts on awareness-raising and education on disaster risk reduction;  \n \n74. Welcomes the annual observance of the International Day for Disaster Risk \nReduction on 13 October and World Tsunami Awareness Day on 5 November, as well \nas World Water Day on 22 March, World Meteorological Day on 23 March and World \nEnvironment Day on 5 June, and encourages all States, United Nations bodies and \nother relevant actors to observe the Days to further raise public awareness of disaster \nrisk reduction;  \n \n75. Reaffirms the commitment at the very heart of the 2030 Agenda to leave \nno one behind and commit to taking more tangible steps to support people in \nvulnerable situations and the most vulnerable countries and to reach the furthest \nbehind first;  \n \n76. Recognizes that the findings of the midterm review of the Sendai \nFramework and the political declaration of the high-level meeting on the midterm \nreview can be an input to upcoming relevant United Nations conferences and \nprocesses towards a risk-informed approach to sustainable development and climate \naction in all sectors and in all countries;  \n \n77. Urges the Secretary-General, by 2026, within existing resources, to ensure \nthe allocation of adequate resources to the United Nations Office for Disaster Risk \nReduction, to support its mandate for the implementation of the Sendai Framework \nfor Disaster Risk Reduction 2015\u20132030;  \n \n78. Requests the Secretary-General to submit to the General Assembly at its \neightieth session a report on the implementation of the present resolution, the \neffective global response to address the impacts of the El Ni\u00f1o phenomenon and the \nimplementation of the United Nations action plan to ensure that every person on Earth \nis protected by early warning systems within the next four years;  \n \n79. Decides to include in the provisional agenda of its eightieth session, under \nthe item entitled \u201cSustainable development\u201d, the sub-item entitled \u201cDisaster risk \nreduction\u201d. \n \n54th plenary meeting \n19 December 2024 \n \n",
  "paragraphs": {
    "1": "Takes note of the report of the Secretary-General on the implementation of General Assembly resolution 78/152;16",
    "2": "Urges the effective implementation of the Sendai Declaration and the Sendai Framework for Disaster Risk Reduction 2015\u20132030;",
    "3": "Welcomes the convening of the high-level meeting on the midterm review of the Sendai Framework on 18 and 19 May 2023 at which the General Assembly adopted the political declaration on the midterm review of the Sendai Framework; 17",
    "4": "Reiterates its call for the prevention of new and the reduction of existing disaster risk through the implementation of integrated and inclusive economic, structural, legal, social, health, cultural, educational, environmental, technological, political, financial and institutional measures that prevent and reduce hazard exposure __________________ 15 Resolution 78/317, annex. 16 A/79/268. 17 Resolution 77/289, annex. Disaster risk reduction A/RES/79/205 7/18 24-24345 and vulnerability to disaster, increase preparedness for response and recovery and thus strengthen resilience;",
    "5": "Underlines the need to address the economic, social and environmental impacts of disasters caused by human-made or natural hazards, many of which are exacerbated by climate change, in this regard stresses the urgent need to enhance adaptive capacity, strengthen resilience and reduce vulnerability to climate change and extreme weather events, and urges Member States to continue to engage in adaptation planning processes and to enhance cooperation in disaster risk reduction at all levels;",
    "6": "Stresses the significant need to improve means of implementation and strengthen capacity-building, financial resources, data and technology and partnerships to assist developing countries in implementing the Sendai Framework, and recognizes in this regard the need for sustainable and predictable investment in disaster risk reduction in all sectors;",
    "7": "Recognizes the ongoing efforts of the Coalition for Disaster-Resilient Infrastructure, the Risk-Informed Early Action Partnership, the Early Warnings for All initiative and the Climate Risk and Early Warning Systems (CREWS) initiative;",
    "8": "Also recognizes that in some cases the use of public debt and renewed external borrowing to absorb the impact of a disaster could lead to higher debt servicing for developing countries and constrain their growth and their capacity to invest in long-term resilience-building, and acknowledges that, with each new disaster, financial vulnerabilities may grow and domestic response capacities may weaken, and in that regard welcomes the development of climate-resilient debt clauses, where appropriate, and the exploration of clauses that consider other catastrophic external shocks;",
    "9": "Further recognizes the need for the global community, including international financial institutions, development banks and the private sector, to better integrate inclusive disaster risk reduction in decision-making, with more transparent accounting of exposure and management of disaster-related risks, and enhance efforts to scale up disaster risk reduction financing instruments to meet the scale of financing needed by developing countries to prevent and reduce risks and build resilience against current and future shocks and hazards;",
    "10": "Calls upon all relevant actors to work towards the achievement of the global targets adopted in the Sendai Framework;",
    "11": "Recognizes progress made in achieving target (e) of the Sendai Framework and that the development and implementation of risk-informed strategic plans, policies, programmes and investments and national and local disaster risk reduction strategies are essential for sustainable development and the achievement of the Sustainable Development Goals;",
    "12": "Reaffirms the importance of developing multi-hazard strategies at the local, national, subregional, regional and international levels, in line with the Sendai Framework, that aim to prevent, mitigate and repair the adverse economic, social and environmental impacts of natural climate cycles, such as the El Ni\u00f1o Southern Oscillation phenomenon, while recognizing ongoing national initiatives by affected countries to strengthen their capacities;",
    "13": "Stresses that, during neutral El Ni\u00f1o Southern Oscillation phenomenon years, it is critical to prepare for, build resilience to and reduce the risks of the next event, particularly in the context of existing climate-related impacts, including through integrated plans, and calls upon the international community to provide A/RES/79/205 Disaster risk reduction 24-24345 8/18 financial, technical and capacity-building support to countries affected by the El Ni\u00f1o Southern Oscillation phenomenon, prioritizing resources to developing countries;",
    "14": "Welcomes the convening of the joint thematic event by the President of the General Assembly and the President of the Economic and Social Council entitled \u201cEl Ni\u00f1o 2023\u20132024: Actions for the safety, sustainability, and resilience of people and the planet\u201d on 30 April 2024;",
    "15": "Urges the international community to accelerate progress and allocate the resources necessary to support the development and implementation of inclusive, including gender-responsive, and participatory, multi-hazard national and local disaster risk reduction strategies with a broadened scope beyond preparedness and response to include a focus on risk reduction and prevention, in line with the Sendai Framework, with a particular focus on local strategies and programmes, to promote coherence and integration with sustainable development and climate change adaptation strategies including national adaptation plans, as well as sector-specific plans, to include the objective of preparing to build back better through sustainable, resilient and inclusive recovery in disaster risk reduction strategies and, where appropriate, to incorporate considerations regarding the risk of disaster displacement, in accordance with national circumstances, making use of practical guidance to support the achievement of target (e), and recalls in this regard the relevant voluntary \u201cWords into action\u201d guidelines;",
    "16": "Encourages Member States to strengthen national and local disaster risk governance by implementing the whole-of-government and all-of-society approaches through establishing or strengthening national platforms for disaster risk reduction, or similar mechanisms, for multisectoral and inter-institutional coordination, with clearly defined roles and responsibilities for disaster risk reduction across ministries and institutions and at the national, subnational and local levels, and by expanding disaster risk reduction beyond national disaster management and civil protection authorities, or equivalent agencies, to include all branches of government and all relevant stakeholders, as appropriate, and welcomes the \u201cMaking Cities Resilient 2030\u201d initiative in support of local capacities for disaster risk governance and of promoting urban resilience;",
    "17": "Expresses concern that countries affected by protracted humanitarian crises and emergencies are among those most vulnerable to the impacts of disasters and are furthest behind in implementing the Sendai Framework, and recognizes that implementation of the Sendai Framework can address drivers of vulnerability and exposure to build resilience and reduce humanitarian impacts and needs, and in this regard recognizes the need for multidimensional and comprehensive risk assessment and the promotion of complementarity and coherence between humanitarian and development assistance, in accordance with respective mandates, which can contribute to strengthening resilience and climate change adaptation, for a more targeted and effective approach to prevention and resilience-building;",
    "18": "Notes with appreciation the voluntary national reports and reporting against the seven global targets through the Sendai Framework monitor, takes note of the outcomes of the global and regional platforms for disaster risk reduction, and also takes note of the report on the main findings and recommendations of the midterm review of the implementation of the Sendai Framework 18 and the report of the midterm review of the implementation of the Sendai Framework prepared by the United Nations Office for Disaster Risk Reduction;19 __________________ 18 A/77/640. 19 United Nations Office for Disaster Risk Reduction, The Report of the Midterm Review of the Implementation of the Sendai Framework for Disaster Risk Reduction 2015\u20132030 (Geneva, 2023). Disaster risk reduction A/RES/79/205 9/18 24-24345",
    "19": "Recognizes the importance of monitoring the Sendai Framework, encourages States to use the online monitor to report on progress against the Sendai Framework global targets by referring to the report of the open-ended intergovernmental expert working group on indicators and terminology relating to disaster risk reduction, 20 also encourages States, while implementing the Sendai Framework, to systematically evaluate, record, share and publicly account for disaster losses and understand the economic, social, health, educational, environmental and cultural heritage impacts, as appropriate, in the context of event-specific hazard- exposure and vulnerability information, and enhance the development and dissemination of science-based methodologies and tools to record and share disaster losses and relevant disaggregated data and statistics, as well as to strengthen disaster risk modelling, assessment, mapping, monitoring and multi-hazard early warning systems, and in this regard further encourages efforts to create or enhance systems for data collection and to support the capacity of national statistical offices to integrate data from the Sendai Framework monitor into official national statistics to enhance and institutionalize its use in decision-making processes and investments across sectors and all relevant ministries and institutions, and to prioritize the collection and analysis of data on disaster loss and the establishment and strengthening of national disaster loss databases, and to develop baselines on current losses, working towards the collection of information on historical disaster losses going back, at least, to 2005, if feasible;",
    "20": "Welcomes the operationalization of the new funding arrangements, including the Fund for responding to loss and damage;",
    "21": "Recalls the decision of the General Assembly authorizing the United Nations Office for Disaster Risk Reduction to enter into a memorandum of understanding with the Conference of the Parties to the United Nations Framework Convention on Climate Change and the Conference of the Parties serving as the Meeting of the Parties to the Paris Agreement regarding the hosting of the secretariat of the Santiago network for averting, minimizing and addressing loss and damage associated with the adverse effects of climate change;",
    "22": "Urges States to conduct inclusive and multi-hazard disaster risk assessments that consider climate change projections to support evidence-based disaster risk reduction strategies and guide risk-informed development investments by the private and public sectors, including comprehensive disaster risk reduction financing strategies, to support early action and recovery;",
    "23": "Encourages States to strengthen inter-institutional, inclusive coordination on disaster risk data and integrated analysis, investment in and the transfer of technology, on mutually agreed terms, to developing countries for the development of science and technology and in strengthening capacities for multidimensional and multi-hazard risk assessment, risk analytics, and strategic foresight and monitoring of systemic risk, and capitalize on the risk data and risk modelling capacity of the private sector, including development of tools for multi-hazard risk assessments, and in this regard takes note of the ongoing work on the Global Risk Assessment Framework and Risk Information Exchange;",
    "24": "Also encourages States to prioritize and enhance the allocation of and access to sustainable and predictable financing for disaster risk reduction at all levels, and technology transfer to developing countries, in particular for the least developed countries, small island developing States, landlocked developing countries and African countries, as well as middle-income countries facing specific challenges, on concessional and preferential terms, as mutually agreed, for the development and __________________ 20 A/71/644 and A/71/644/Corr.1. A/RES/79/205 Disaster risk reduction 24-24345 10/18 strengthening of their capacities, including to build resilient health, water, waste management and agrifood systems, cultural heritage, transport, energy and digital connectivity systems;",
    "25": "Recognizes the important contribution of healthy ecosystems to reducing disaster risk and building community resilience, encourages all States, United Nations entities and other relevant actors to promote nature-based solutions, ecosystem-based approaches and other management and conservation approaches, in line with United Nations Environment Assembly resolution 5/5 of 2 March 2022, 21 at all levels and across all phases of disaster risk reduction and management, and reiterates the importance of the conservation and sustainable use of biodiversity as well as providing long-term and affordable investments in these approaches to reduce the impacts and costs of disasters, and ensure synergies between the implementation of the Sendai Framework and the Kunming-Montreal Global Biodiversity Framework, including by integrating disaster risk reduction into national biodiversity strategies and action plans, as appropriate;",
    "26": "Stresses the need to foster better understanding and knowledge of the causes of disasters, as well as to build and strengthen coping capacities in developing countries through, inter alia, the exchange of best practices, technology transfer on mutually agreed terms, educational and training programmes for disaster risk reduction, the development of open and accessible data systems to support effective disaster early warning, early action and crisis response, access to relevant data and information, the strengthening of institutional arrangements and the promotion of community participation and ownership through community-based disaster risk management approaches, and enhance understanding of risks posed by rapidly transforming, inter alia, economic, social, technological and ecological systems, including advancements in artificial intelligence;",
    "27": "Acknowledges the importance of community-driven disaster risk reduction and resilience efforts, and the need to strengthen the preparedness of communities as well as their ability to respond, including through raising awareness and fostering a culture of risk reduction and prevention, and supports efforts to scale up community- level pre-disaster recovery and reconstruction planning;",
    "28": "Also acknowledges the role of productive assets, including livestock and working animals, and the need to strengthen preparedness, response, recovery, rehabilitation and reconstruction by, inter alia, integrating the protection of working animals in disaster risk management plans to enhance long-term community resilience while also strengthen and promote collaboration and capacity-building for the protection of productive assets, including livestock, working animals, tools and seeds;",
    "29": "Further acknowledges that water is essential to the achievement of the Sustainable Development Goals, that water-related disasters and multidimensional hazards threaten lives, livelihoods, agriculture and basic service infrastructure and cause substantial socioeconomic damage and losses, and that sustainable, integrated disaster risk-informed water resource management is necessary for successful disaster preparedness, disaster risk reduction and climate change adaptation, in this regard invites all countries to integrate land and water management, including for floods and droughts, into their national and subnational planning and management processes, and reiterates that the achievement of the water-related goals and targets would contribute to the successful implementation of the Sendai Framework;",
    "30": "Urges the incorporation of disaster risk management into post-disaster recovery, rehabilitation and reconstruction processes, enhancing the development and __________________ 21 UNEP/EA.5/Res.5. Disaster risk reduction A/RES/79/205 11/18 24-24345 dissemination of science-based and targeted methodologies and tools and facilitating cooperation among States for the sharing of experiences;",
    "31": "Urges Member States, the United Nations and other relevant organizations to take further steps to address the food and nutrition needs of affected populations, prioritizing tools that strengthen resilience to current crises and future shocks, and integrating a disaster risk reduction perspective aimed at improving food security and nutrition;",
    "32": "Recognizes that the Sendai Framework, including its core provision to \u201cbuild back better\u201d, provides guidance relevant to a sustainable recovery from COVID-19 and also to identify and address underlying drivers of disaster risk in a systemic manner, that biological hazards require strengthened systematic coordination, coherence and integration between disaster and health risk management systems in the areas of risk assessment, surveillance and early warning, and that resilient health infrastructure and strengthened health systems capable of implementing the International Health Regulations (2005),22 as well as increasing the overall capacity of health systems, including through the application of the Bangkok Principles for the implementation of the health aspects of the Sendai Framework and other relevant initiatives, as appropriate, to reduce overall disaster risk and build disaster resilience, while also recognizing the value of integrated approaches, including the One Health approach and other holistic approaches that foster cooperation between human health, animal health and plant health, as well as environmental and other relevant sectors;",
    "33": "Also recognizes that disaster risk reduction requires a multi-hazard and systemic approach and inclusive risk-informed decision-making based on the open exchange and dissemination of data disaggregated by, inter alia, income, sex, age and disability, and analysis with an adequate understanding of how the information is to be interpreted and used, as well as on easily accessible, up-to-date, comprehensible, interoperable, science-based, non-sensitive risk information, for a wide range of users and decision makers, complemented by traditional knowledge, and in this regard encourages States to commence or, as appropriate, further enhance the collection and analysis of data on disaster loss and other relevant disaster risk reduction targets, disaggregated by income, sex, age and disability and other characteristics relevant in national contexts, and to strengthen inter-institutional, inclusive coordination on disaster risk data and integrated analysis, and invites Member States to mobilize national statistical and planning offices and other relevant authorities, and strengthen their capacity in the systemic collection, analysis and validation of disaster risk data to institutionalize its use in decision-making processes and investments across sectors;",
    "34": "Welcomes the political declaration adopted by the high-level political forum on sustainable development convened under the auspices of the General Assembly (Sustainable Development Goals Summit), held in New York on 18 and 19 September 2023,23 and urges timely action to ensure its full implementation;",
    "35": "Also welcomes progress under the Strategic Framework on Geospatial Information and Services for Disasters24 for the period 2020\u20132023, which is a guide for Member States to ensure the availability and accessibility of quality geospatial information and services across all phases of disaster risk reduction and management, and encourages enhanced support to developing countries for the implementation of the Framework as a means to provide quality geospatial information and services to support decision-making and disaster risk management efforts, the Sendai Framework __________________ 22 World Health Organization, document WHA58/2005/REC/1, resolution 58.3, annex. 23 Resolution 78/1, annex. 24 Economic and Social Council resolution 2018/14, annex. A/RES/79/205 Disaster risk reduction 24-24345 12/18 for Disaster Risk Reduction 2015\u20132030 and achieving the 2030 Agenda for Sustainable Development;25",
    "36": "Emphasizes the importance of a broader and a more people-centred preventive approach to and systemic risk management of disaster risk reduction, reflecting the 2030 Agenda for Sustainable Development, recognizing that disaster prevention, preparedness, early and anticipatory actions, and resilience-building, in most cases, are significantly more cost-effective than emergency responses, stresses the importance of promoting the further development of and investment in effective, national and regional, multi-hazard early warning mechanisms, where relevant, and facilitating the sharing and exchange of information across all countries;",
    "37": "Recognizes the need for inclusive development of preparedness plans and the importance of systematically identifying the needs of the poor and people in vulnerable situations before a disaster hits, and noting the importance of community- based multi-hazard early warning systems;",
    "38": "Welcomes the call by the Secretary-General for a United Nations action plan to ensure that every person on Earth is protected by early warning systems within five years as an accelerator towards the achievement of target (g) of the Sendai Framework, and also welcomes the invitation from States to development partners, international financial institutions and the operating entities of the Financial Mechanism to provide support for implementation of the Early Warnings for All initiative, and recognizes the importance of the CREWS initiative in achieving that goal and takes note with appreciation of the findings of the Global Status of Multi-hazard Early Warning Systems: Target (g) report, and calls upon all relevant entities of the United Nations system to ensure a coordinated and integrated approach in the implementation of the early warning action plan presented at the twenty- seventh Conference of the Parties to the United Nations Framework Convention on Climate Change;",
    "39": "Takes note of the report of the Secretary-General on multi-hazard early warning systems in the least developed countries, 26 and also takes note of the recommendations for accelerating action to address gaps and deliver people-centred, end-to-end multi-hazard early warning systems in the least developed countries;",
    "40": "Takes note of the operationalization of the Secretary-General\u2019s Action Agenda on Internal Displacement, aimed at advancing commitments to enhance the prevention of disaster-induced displacement;",
    "41": "Recognizes the increased official reporting through the online Sendai Framework monitor, and further encourages States to report on progress against the Sustainable Development Goals related to disaster risk to provide, inter alia, a comprehensive overview of progress to inform the deliberations and outcomes of the high-level political forum on sustainable development and the Global Platform for Disaster Risk Reduction, and recalls the ongoing work towards integrated national climate change adaptation and national disaster risk reduction strategies as well as the Sendai Framework targets, and further recalls ongoing work under the Paris Agreement27 to apply the Sendai Framework targets in the context of the global goal on adaptation;",
    "42": "Encourages countries to apply a comprehensive approach to disaster and climate risk management and to establish or strengthen policy, programmatic and financing coherence between national climate change adaptation and national disaster risk reduction strategies, as well as sector-specific plans, as appropriate, and apply __________________ 25 Resolution 70/1. 26 A/79/288. 27 Adopted under the UNFCCC in FCCC/CP/2015/10/Add.1, decision 1/CP.21. Disaster risk reduction A/RES/79/205 13/18 24-24345 the Sendai Framework for the effective implementation of all the relevant decisions of the Conferences of the Parties made under the United Nations Framework Convention on Climate Change and the Paris Agreement;28",
    "43": "Reaffirms that the establishment of common indicators and shared data sets to measure the Sendai Framework global targets and the disaster risk reduction targets of Sustainable Development Goals 1, 11 and 13, as well as in the development of the monitoring and evaluation framework of the Antigua and Barbuda Agenda for Small Island Developing States: A Renewed Declaration for Resilient Prosperity, 29 are important contributions to ensure coherence, feasibility and consistency in implementation, the collection of data and reporting, calls for coherence between the Sendai Framework global targets and the monitoring of the Doha Programme of Action, and in this regard recognizes the importance of prioritizing capacity-building support to developing countries, in particular the least developed countries, small island developing States, landlocked developing countries and African countries, as well as middle-income countries facing specific challenges;",
    "44": "Encourages States to give appropriate consideration to disaster risk reduction in the implementation of the 2030 Agenda for Sustainable Development, where it is reflected across several Goals and targets, including in their voluntary national reviews, inter alia, through the engagement of national Sendai Framework focal points early in the national review process, as appropriate, and stresses the importance of considering disaster risk reduction in the deliberations and outcomes of the high-level political forum on sustainable development and integrating disaster risk reduction across the work of the Economic and Social Council;",
    "45": "Reiterates its strong encouragement of and the need for effective coordination and coherence, as applicable, in the implementation of the 2030 Agenda, the Addis Ababa Action Agenda of the Third International Conference on Financing for Development, 30 the Paris Agreement adopted under the United Nations Framework Convention on Climate Change, and the Sendai Framework, as well as the United Nations Framework Convention on Climate Change, the Convention on Biological Diversity,31 the United Nations Convention to Combat Desertification in Those Countries Experiencing Serious Drought and/or Desertification, Particularly in Africa,32 and the New Urban Agenda, while respecting the relevant mandates, in order to build synergies and resilience, translate integrated global policy frameworks, as appropriate, into national laws, policies or regulations defining roles and responsibilities across the public and private sectors, as well as into integrated multisectoral programmes at the national and local levels, and reduce disaster risk across sectors, and addressing the global challenge of eradicating poverty in all its forms and dimensions, including extreme poverty;",
    "46": "Recognizes the important work and contribution of regional and subregional organizations in advancing cooperation in disaster risk reduction at the regional level, encourages greater engagement and partnership between the United Nations Office for Disaster Risk Reduction and regional and subregional organizations to accelerate the implementation of the Sendai Framework;",
    "47": "Encourages countries, the relevant United Nations bodies, agencies, funds and programmes and other relevant institutions and stakeholders to take into consideration the important role of coordinated, inclusive and participatory disaster risk governance across sectors for the achievement of sustainable development and, __________________ 28 Adopted under the UNFCCC in FCCC/CP/2015/10/Add.1, decision 1/CP.21. 29 Resolution 78/317, annex. 30 Resolution 69/313, annex. 31 United Nations, Treaty Series, vol. 1760, No. 30619. 32 Ibid., vol. 1954, No. 33480. A/RES/79/205 Disaster risk reduction 24-24345 14/18 inter alia, the strengthening of disaster prevention, as well as preparedness for effective response, recovery, rehabilitation and reconstruction, including through disaster risk reduction, early warnings systems that lead to early action, and response financing;",
    "48": "Urges that due consideration continue to be given to the review of the global progress in the implementation of the Sendai Framework as part of the integrated and coordinated follow-up processes to United Nations conferences and summits, aligned with the Economic and Social Council, the high-level political forum on sustainable development and the quadrennial comprehensive policy review cycles, as appropriate, taking into account the contributions of the Global Platform for Disaster Risk Reduction and regional and subregional platforms for disaster risk reduction and the Sendai Framework monitor;",
    "49": "Reaffirms that international cooperation for disaster risk reduction includes a variety of sources and is a critical element in supporting the efforts of developing countries to reduce disaster risk, and encourages States to strengthen international and regional information exchange and information-sharing, including through North-South cooperation complemented by South-South and triangular cooperation, establishing and networking risk management centres, promoting critical science and technology research cooperation on disaster reduction and improving international coordination mechanisms to respond to large-scale disasters;",
    "50": "Recognizes that effective and meaningful global and regional partnerships and the further strengthening of international cooperation, including the fulfilment of respective commitments of official development assistance by developed countries, are essential for effective disaster risk management and the ability of developing countries, including those most vulnerable to disasters, to effectively enhance and implement national disaster risk reduction policies and measures, taking into account their respective national circumstances and capabilities;",
    "51": "Reaffirms the need for the enhancement of the means of implementation and the capacity and capability of developing countries, in particular the least developed countries, small island developing States, landlocked developing countries and African countries, as well as middle-income countries facing specific challenges, including the mobilization of support through international cooperation, for the provision of means of implementation to augment domestic efforts in accordance with their national priorities;",
    "52": "Encourages the incorporation of disaster risk reduction measures, as appropriate, into multilateral and bilateral development assistance programmes and infrastructure financing, including through North-South cooperation complemented by South-South as well as triangular cooperation, within and across all sectors related to sustainable development, and calls for international cooperation that is aligned with national disaster risk reduction strategies and for alignment between risk-informed national development cooperation policies and national disaster risk reduction strategies;",
    "53": "Recognizes that financing for disaster risk reduction requires greater attention, and in this regard encourages increased investments in disaster risk reduction, including resilient infrastructure, and calls upon the United Nations system and its entities, within the scope of their respective mandates, in partnership with international financial institutions, regional development banks and other relevant institutions and stakeholders, to support developing countries in developing comprehensive disaster risk reduction financing strategies in support of national and local disaster risk reduction strategies, and incentivizing investments in resilience, prevention and rehabilitation, and to explore the development of tailored financing Disaster risk reduction A/RES/79/205 15/18 24-24345 mechanisms for disaster risk reduction, including forecast-based financing approaches and disaster risk insurance mechanisms;",
    "54": "Encourages States to allocate increased domestic resources to disaster risk reduction, including to strengthen resilience and upgrade existing infrastructure, to include disaster risk reduction in budgeting and financial planning across all relevant sectors, and to ensure that national financing frameworks and infrastructure plans are risk-informed, according to national plans and policies;",
    "55": "Acknowledges that earthquakes have resulted in significant loss of lives, damage to property, displacement of communities and the loss of livelihoods, food security and nutrition, health and access to social infrastructure, calls for support to countries to better understand the exposure and vulnerability to earthquake risks, and further calls upon the international community to provide financial, technical and capacity-building support to countries prone to earthquake risk, prioritizing resources to developing countries;",
    "56": "Notes that extreme heat is deadly and disrupts economies and societies, and calls for urgent and concerted efforts to enhance international cooperation to address extreme heat;",
    "57": "Recognizes that economic losses are rising as a result of the increasing number and value of assets exposed to hazards, encourages countries to conduct a disaster risk assessment of existing critical infrastructure, to ensure that infrastructure plans are aligned to national disaster risk reduction strategies and risk assessments, to support the publication of disaster risk assessments, to make multi-hazard disaster risk assessments a prerequisite for infrastructure, housing and real estate investments in all sectors, to routinely conduct stress testing of existing infrastructure and to strengthen regulatory frameworks for land-use planning and building codes, as appropriate, towards the achievement of target (d) of the Sendai Framework, and in this regard also encourages countries and other relevant stakeholders to integrate disaster risk reduction considerations into their social, economic and environmental investments;",
    "58": "Encourages all relevant stakeholders to collaborate with the private sector to enhance the resilience of businesses, as well as the societies within which they operate, by integrating disaster risk into their management practices, to facilitate private investments in disaster risk reduction and to promote risk-informed private investments and the disclosure of disaster risk in business operations and asset values, and also encourages the engagement of credit rating agencies, the insurance sector and the financial services sector in disaster risk reduction, to support countries in the development of innovative instruments, tools and guidelines for de-risking investments and to enhance financing available for disaster risk reduction;",
    "59": "Reaffirms that investing in national and local skills, systems and knowledge to build resilience and preparedness will save lives, reduce the risk of displacement in the context of disasters, strengthen the adaptive capacity of food production systems and enhance food security, cut costs and preserve development gains, and in this regard encourages exploring innovative ways, such as forecast-based financing approaches and disaster risk insurance mechanisms, to increase the availability of resources for Member States before a disaster is credibly expected to occur;",
    "60": "Recalls that the economic and environmental vulnerability index gives consideration to the impacts of disasters, recognizes the relevance of disaster risk and the impact of disasters in the process of graduation from the least developed country category, encourages the integration of disaster risk reduction into the smooth transition strategies of graduating countries in order to promote the sustainability of development progress, including the impact assessment of the likely consequences of A/RES/79/205 Disaster risk reduction 24-24345 16/18 graduation and the vulnerability profiles, and also encourages development and trading partners of graduating and recently graduated countries to support those countries in reducing disaster risk and building resilience;",
    "61": "Recognizes the importance of giving priority to the development of local and national disaster risk reduction capacity-building, policies, strategies and plans with the participation of all relevant stakeholders, in accordance with national practices and legislation;",
    "62": "Also recognizes that, while each State has the primary responsibility for preventing and reducing disaster risk, it is a shared responsibility between Governments and relevant stakeholders, and recognizes that non-State and other relevant stakeholders, including major groups, parliaments, civil society, the International Red Cross and Red Crescent Movement, non-governmental organizations, Indigenous Peoples and their organizations, national platforms for disaster risk reduction focal points for the Sendai Framework, local government representatives, scientific institutions and the private sector, as well as organizations and relevant agencies, funds and programmes of the United Nations system and other relevant institutions and intergovernmental organizations, play an important role as enablers in providing support to States, in accordance with national policies, laws and regulations, in the implementation of the Sendai Framework at the local, national, regional and global levels, and that greater efforts are needed to mobilize multi-stakeholder partnerships for disaster risk reduction, according to national plans and policies;",
    "63": "Encourages Governments to promote the full, equal, effective and meaningful participation and leadership of women, as well as of persons with disabilities and people in vulnerable situations, the design, management, resourcing and implementation of gender-responsive and disability-inclusive disaster risk reduction policies, plans and programmes, and recognizes in this regard that women and girls are disproportionately exposed to risk, increased loss of livelihoods and even loss of life during and in the aftermath of disasters, and that disasters and the consequent disruption to physical, social, economic and environmental networks and support systems disproportionately affect persons with disabilities and their families;",
    "64": "Stresses the importance of mainstreaming a gender perspective and the perspectives of persons with disabilities, as well as other people in vulnerable situations, into disaster risk management, and of engaging and appropriately drawing on the capacities of children, youth, including young professionals, as contributors in disaster risk management so as to strengthen the resilience of communities and reduce social vulnerabilities to disasters, and in this regard recognizes the need for the inclusive participation and contribution of women, children, older persons, persons with disabilities, Indigenous Peoples and local communities, as well as the role of youth, volunteers, migrants, academia, scientific and research entities and networks, business, professional associations, private sector financing institutions and the media, in all forums and processes related to disaster risk reduction, in accordance with the Sendai Framework;",
    "65": "Acknowledges the continuous work of the entities of the United Nations system, in accordance with their respective mandates, in supporting the efforts of developing countries in the area of disaster risk reduction, including through the inclusion, where appropriate, of disaster risk reduction in the United Nations Sustainable Development Cooperation Framework as part of the common country assessment\u2019s multidimensional analysis, requests the relevant United Nations entities and United Nations country teams, and urges other relevant stakeholders, to continue to integrate disaster risk reduction and the implementation of the Sendai Framework into their work and to align their work with the United Nations Plan of Action on Disaster Risk Reduction for Resilience: Towards a Risk-informed and Integrated Disaster risk reduction A/RES/79/205 17/18 24-24345 Approach to Sustainable Development, including the supplementary recommendations issued in 2023, guided by the Senior Leadership Group on Disaster Risk Reduction for Resilience convened by the Special Representative of the Secretary-General for Disaster Risk Reduction, and notes the ongoing work of the Centre of Excellence on Climate and Disaster Resilience;",
    "66": "Also acknowledges the importance of the work of the agencies, funds and programmes of the United Nations system and other relevant institutions in disaster risk reduction, the substantial increase in demands on the United Nations Office for Disaster Risk Reduction and the need for timely, stable, adequate and predictable resources necessary for supporting the implementation of the Sendai Framework, and in this regard encourages Member States to consider providing or augmenting voluntary contributions to the United Nations Office for Disaster Risk Reduction;",
    "67": "Recognizes the continued importance of voluntary funding, and urges existing and new donors to provide sufficient funding and, where possible, to augment financial contributions to the United Nations Trust Fund for Disaster Reduction to support the implementation of the Sendai Framework, including through unearmarked and, where possible, multi-annual contributions;",
    "68": "Reaffirms the importance of the Global Platform for Disaster Risk Reduction and the regional and subregional platforms for disaster risk reduction as forums to assess and discuss progress on the implementation of the Sendai Framework and advance coherence between disaster risk reduction, sustainable development and climate change mitigation and adaptation, including financing, and recognizes their outcomes as contributions to the high-level political forum on sustainable development;",
    "69": "Recognizes the importance of the discussions that took place at the seventh session of the Global Platform for Disaster Risk Reduction in Bali, Indonesia, and the eighth Africa Regional Platform for Disaster Risk Reduction, held in Nairobi, Kenya, the seventh Regional Platform for Disaster Risk Reduction for the Americas and the Caribbean, held in Kingston, Jamaica, the fifth Arab Regional Platform for Disaster Risk Reduction, held in Rabat, Morocco, the European Forum for Disaster Risk Reduction, held in Matosinhos, Portugal, and other regional platforms for disaster risk reduction in strengthening the commitment to achieving the targets of the Sendai Framework and as valuable inputs to the midterm review;",
    "70": "Expresses its appreciation to the Government of Uruguay for hosting, in 2023, and to the Governments of Montenegro, Namibia and the Philippines for hosting, in 2024, the regional platforms for disaster risk reduction, events jointly organized with the United Nations Office for Disaster Risk Reduction, looks forward to the regional platform to be convened in Kuwait in 2025, and encourages participation by all stakeholders, sectors and ministries at the highest level possible at the eighth session of the Global Platform for Disaster Risk Reduction to be held in Geneva from 2 to 6 June 2025;",
    "71": "Encourages the eighth session of the Global Platform for Disaster Risk Reduction to include in its discussions ways to enhance preparedness, build resilience, promote early actions, reduce risks and to address the impacts of the El Ni\u00f1o/La Ni\u00f1a phenomenon, as appropriate, as well as to assess the progress made on the calls to action of the political declaration on the midterm review of the Sendai Framework;",
    "72": "Stresses the importance of promoting the incorporation of disaster risk knowledge, including disaster prevention, mitigation, preparedness, financing, response, recovery, reconstruction and rehabilitation, in formal and non-formal education, as well as in civic education at all levels and in professional education and training, and of raising awareness and creating a culture of disaster prevention, resilience and responsible citizenship to foster all-of-society engagement in disaster A/RES/79/205 Disaster risk reduction 24-24345 18/18 risk reduction, and emphasizes the need for new and existing educational infrastructure, school facilities and teaching and learning practices to be risk- informed, resilient and fully accessible to all, which requires channelling financial and other resources towards strengthening these efforts;",
    "73": "Recognizes the need to promote traditional, local and Indigenous knowledge and wisdom that have been tested and improved through generations across the world, to further strengthen scientific practices and know-how and enhance efforts on awareness-raising and education on disaster risk reduction;",
    "74": "Welcomes the annual observance of the International Day for Disaster Risk Reduction on 13 October and World Tsunami Awareness Day on 5 November, as well as World Water Day on 22 March, World Meteorological Day on 23 March and World Environment Day on 5 June, and encourages all States, United Nations bodies and other relevant actors to observe the Days to further raise public awareness of disaster risk reduction;",
    "75": "Reaffirms the commitment at the very heart of the 2030 Agenda to leave no one behind and commit to taking more tangible steps to support people in vulnerable situations and the most vulnerable countries and to reach the furthest behind first;",
    "76": "Recognizes that the findings of the midterm review of the Sendai Framework and the political declaration of the high-level meeting on the midterm review can be an input to upcoming relevant United Nations conferences and processes towards a risk-informed approach to sustainable development and climate action in all sectors and in all countries;",
    "77": "Urges the Secretary-General, by 2026, within existing resources, to ensure the allocation of adequate resources to the United Nations Office for Disaster Risk Reduction, to support its mandate for the implementation of the Sendai Framework for Disaster Risk Reduction 2015\u20132030;",
    "78": "Requests the Secretary-General to submit to the General Assembly at its eightieth session a report on the implementation of the present resolution, the effective global response to address the impacts of the El Ni\u00f1o phenomenon and the implementation of the United Nations action plan to ensure that every person on Earth is protected by early warning systems within the next four years;",
    "79": "Decides to include in the provisional agenda of its eightieth session, under the item entitled \u201cSustainable development\u201d, the sub-item entitled \u201cDisaster risk reduction\u201d. 54th plenary meeting 19 December 2024"
  },
  "agenda_items": [
    "Item 18"
  ],
  "symbol_references": []
}