{
  "symbol": "A/RES/79/317",
  "filename": "A_RES_79_317.pdf",
  "title": "79/317. The situation in Afghanistan",
  "text": "United Nations \nA/RES/79/317 \n \nGeneral Assembly \nDistr.: General \n8 July 2025 \n25-11209 (E) \n*2511209* \n \n \nSeventy-ninth session \nAgenda item 36 \nThe situation in Afghanistan \n \n \n \n \n Resolution adopted by the General Assembly \non 7 July 2025 \n \n \n[without reference to a Main Committee (A/79/L.100)] \n \n \n 79/317. The situation in Afghanistan \n \n \n \nThe General Assembly, \n \nRecalling its resolution 77/10 of 10 November 2022 and all its previous relevant \nresolutions,  \n \nRecalling also all relevant Security Council resolutions, in particular resolutions \n2593 (2021) of 30 August 2021, 2681 (2023) of 27 April 2023, 2721 (2023) of \n29 December 2023 and 2777 (2025) of 17 March 2025, and statements by the \nPresident of the Council on the situation in Afghanistan,  \n \nReaffirming its strong commitment to the sovereignty, independence, territorial \nintegrity and national unity of Afghanistan, and respecting its multicultural, \nmulti\u2011ethnic and historical heritage,  \n \nReaffirming the right of the Afghan people to independently decide the future of \ntheir country in accordance with international law, \n \nRecognizing the continued need to address the multifaceted challenges faced by \nAfghanistan, and reaffirming that an integrated and coherent approach among relevant \npolitical, humanitarian and development actors, within and outside of the United \nNations system, consistent with their respective mandates, is critical to building and \nsustaining peace in Afghanistan,  \n \nTaking note with satisfaction of the independent assessment on Afghanistan1 and \nthe meetings convened under the United Nations-led Doha process, initiated in May \n2023 in Doha, and encouraging Member States and all other relevant stakeholders to \nconsider increasing international engagement in a more coherent, coordinated and \nstructured manner in order to achieve an Afghanistan at peace with itself and its \n_______________ \n \n1 S/2023/856. \n\nA/RES/79/317 \nThe situation in Afghanistan\n \n25-11209\n2/12 \n \nneighbours, fully reintegrated into the international community and meeting its \ninternational obligations,  \n \nExpressing its support to the people of Afghanistan in their pursuit of dignity \nand freedom as laid out in the Universal Declaration of Human Rights, 2  and \nhighlighting that the will of the people shall be the basis of the authority of \ngovernment,  \n \nStrongly emphasizing the importance of the establishment of an inclusive and \nrepresentative government, through an intra-Afghan dialogue, that reflects the \ninterests and aspirations of all segments of Afghan society, and further emphasizing \nthe importance of upholding human rights, including for women, children and persons \nbelonging to minorities, and of promoting full, equal, meaningful and safe \nparticipation of women in all aspects of Afghan society,  \n \nExpressing serious concern about the grave, worsening, widespread and \nsystematic oppression of all women and girls in Afghanistan, and calling for the \nTaliban to swiftly reverse these policies,  \n \nExpressing serious concern also over the presence of terrorist groups in \nAfghanistan, condemning in the strongest terms all terrorist activity and all terrorist \nattacks, and reaffirming the importance of combating terrorism in Afghanistan, \n \nReaffirming its support for regional and international efforts to prevent and \naddress the illicit trade in and destabilizing accumulation of small arms and light \nweapons and their diversion in Afghanistan and the region,  \n \nNoting the Taliban\u2019s efforts to reduce the cultivation of opium, and calling for \ncomprehensive measures to combat the production and trafficking of illicit narcotics, \n \nEmphasizing its deep concern regarding the dire economic situation in \nAfghanistan, and recognizing the need to help to address the substantial challenges \nfacing the country\u2019s economy, \n \nEmphasizing its deep concern also regarding the dire humanitarian situation in \nAfghanistan, reaffirming the principles of neutrality, humanity, impartiality and \nindependence for the provision of humanitarian assistance, acknowledging the need \nto enhance donor support, and urging the Taliban to ensure conditions for the \nunhindered delivery of humanitarian assistance to every person in need,  \n \nUnderlining the need for disaster risk reduction to address the impacts of natural \ndisasters such as floods and drought that can adversely affect the humanitarian \nsituation and stability in Afghanistan, including by exacerbating food insecurity, \nwater scarcity and land degradation,  \n \nCalling for efforts to provide generous and sustainable assistance to Afghan \nrefugees and their host countries, and to internally displaced persons, in order to \nfacilitate the voluntary, safe and dignified return of refugees and internally displaced \npersons and their sustainable reintegration into their community of origin so that they \ncan contribute to the stabilization of Afghanistan, and also calling for efforts to create \nconditions that facilitate the return of Afghan refugees to their homeland and prevent \nfurther migration, and for serious measures to be taken to ensure returnees\u2019 \nlivelihoods and their reintegration into political and social processes in order to \nachieve a lasting solution, \n \nEmphasizing the important role of regional cooperation to promote long-term \nstability, peace, security, prosperity, sustainable development and human rights in \n_______________ \n \n2 Resolution 217 A (III). \n\nThe situation in Afghanistan \nA/RES/79/317\n \n3/12\n25-11209 \n \nAfghanistan, and welcoming the efforts by regional organizations, international \npartners and regional and neighbouring countries in this regard,  \n \nRecognizing the historical role of Afghanistan as a platform for regional \ncooperation and mutual benefit, and calls upon all Member States to support this role \nwith civility and constructive engagement, free from rivalries and antagonism, and to \nwork towards legitimate and inclusive governance in full respect of the sovereignty, \nindependence and territorial integrity of Afghanistan, \n \nRecalling the Organization of Islamic Cooperation Plan of Action for the \nAdvancement of Women, which recognizes the importance of the inclusion of women \nin decision-making processes, full and equal access to education for boys and girls at \nall levels, women\u2019s and girls\u2019 access to quality healthcare and services, equal \neconomic opportunities for men and women, equal access to humanitarian assistance, \nand combating all forms of violence against women and girls, as well as the final \ncommuniqu\u00e9 of the extraordinary meeting of the Executive Committee of the \nOrganization of Islamic Cooperation, entitled \u201cThe recent developments and the \nhumanitarian situation in Afghanistan\u201d of 11 January 2023, and welcoming the \nestablishment by the Organization of Islamic Cooperation of the Ministerial Contact \nGroup on Afghanistan, which will strengthen the engagement of the international \ncommunity with Afghanistan,  \n \nStressing the central and impartial role of the United Nations in promoting peace \nand stability in Afghanistan, expressing its appreciation and strong support for all the \nefforts of the Secretary-General and his Special Representative for Afghanistan in this \nregard, and expressing its appreciation and full support, in particular, for the work of \nthe United Nations Assistance Mission in Afghanistan,  \n \nWelcoming the regular reports of the United Nations Assistance Mission in \nAfghanistan on human rights issues and the reports of the Special Rapporteur on the \nsituation of human rights in Afghanistan,  \n \nWelcoming also reports of United Nations bodies and agencies on issues related \nto the humanitarian and economic situation and to counter-terrorism and counter-\nnarcotics efforts in Afghanistan, \n \nWelcoming further the reports of the Secretary-General, \n \n1. \nExpresses deep concern over the dire economic, humanitarian and social \nconditions, persistent violence and the presence of terrorist groups, the absence of \npolitical inclusivity and representative decision-making, as well as violations and \nabuses of human rights, including those of women, girls and persons belonging to \nminorities since the takeover by the Taliban;  \n \n2. \nRecognizes that the health, well-being, prosperity and security of the \npeople of Afghanistan affect the entire region and beyond;  \n \n3. \nMaintains that sustainable and lasting peace can be achieved only through \nlong-term social, economic and political stability, which requires full respect for civil, \npolitical, social, economic and cultural rights as well as commitment to inclusive and \nrepresentative governance;  \n \n4. \nPledges its continued support to the people of Afghanistan in order to \nrebuild a stable, secure and economically self-sufficient State, free of terrorism, illicit \nnarcotics, transnational organized crime, including trafficking in persons, and \ncorruption, and to strengthen the foundations of a constitutional and inclusive \ngovernment aimed at ensuring the well-being of the Afghan people as a responsible \nmember of the international community;  \n\nA/RES/79/317 \nThe situation in Afghanistan\n \n25-11209\n4/12 \n \n \n5. \nAcknowledges the efforts of the international community, including \nneighbouring countries, donor agencies and other international organizations in \nurgent provision of humanitarian assistance to Afghanistan, and emphasizes that long-\nterm peace, security, prosperity and sustainable development in Afghanistan and the \nregion require the respect of international obligations by Afghanistan, closer and more \neffective cooperation, as well as greater coherence and complementarity of approach \nwithin the international community; \n \n6. \nUrges Afghanistan to adhere to international law, comply with its \ninternational obligations and honour and fully respect and implement all treaties, \ncovenants or conventions, bilateral or multilateral, to which it is Party, and coexist \npeacefully with neighbouring countries and the region;  \n \n7. \nCalls upon the Taliban to fulfil and respect their assurances for the safety \nand security of diplomatic personnel and premises, humanitarian workers and \ninternational organizations in Afghanistan;  \n \n8. \nEmphasizes that relations of all relevant Afghan political actors and \nstakeholders with the international community will be informed by their \ncommitments, actions and achievements with regard to the expectations of the Afghan \npeople widely shared by the international community;  \n \nHuman rights, governance and the rule of law \n \n9. \nExpresses its serious concern about the grave, worsening, widespread and \nsystematic oppression of all women and girls in Afghanistan by the Taliban, which, \nas documented by the Special Rapporteur on the situation of human rights in \nAfghanistan, 3  has put in place an institutionalized system of discrimination, \nsegregation, disrespect for human dignity and the exclusion of women and girls, \nrecalls the obligations of Afghanistan under international law, in particular human \nrights, refugee and international humanitarian law, and stresses the need to ensure \nrespect for human rights and fundamental freedoms;  \n \n10. Reiterates its unwavering commitment to international law, including \ninternational humanitarian law and the human rights of all Afghans, including all \nethnic and religious groups, calls for the full, equal, meaningful and safe participation \nof women and girls in Afghanistan, in this regard calls for the Taliban to swiftly \nreverse contradictory policies and practices, including the \u201cvice and virtue\u201d directive, \nwhich extend the already intolerable restrictions on the human rights of women and \ngirls and on basic personal freedoms for all Afghans, and the decision to suspend \nwomen\u2019s and girls\u2019 access to education in private and public medical institutions, the \nban on Afghan women working for the United Nations and non\u2011governmental \norganizations in Afghanistan, as well as other policies and practices that restrict the \nenjoyment by women and girls of their human rights and fundamental freedoms, \nincluding as related to their access to education, employment and health services, \nfreedom of movement, and women\u2019s full, equal and meaningful participation in public \nlife, while reaffirming the indispensable role of women in Afghan society, the need to \nincrease their roles and participation in decision-making and the importance of gender \nequality in achieving sustainable, peaceful and inclusive societies;  \n \n11. Emphasizes the need to ensure respect for the human rights and \nfundamental freedoms of women and children in Afghanistan and to end and prevent \nall abuses against women and children, encourages the full implementation of the \nConvention on the Elimination of All Forms of Discrimination against Women4 and \n_______________ \n \n3 See A/HRC/56/25. \n \n4 United Nations, Treaty Series, vol. 1249, No. 20378. \n\nThe situation in Afghanistan \nA/RES/79/317\n \n5/12\n25-11209 \n \nthe Convention on the Rights of the Child and the Optional Protocols thereto, 5 and \nstrongly condemns all forms of violence against women and children;  \n \n12. Reiterates the importance of dialogue between all relevant Afghan \npolitical actors and stakeholders with a focus on the establishment of inclusive, \nrepresentative, participatory and responsive governance at the national and \nsubnational levels;  \n \n13. Strongly emphasizes the necessity of investigating allegations of current \nand past human rights abuses and violations, as well as violations of international \nhumanitarian law, in Afghanistan, and stresses the importance of facilitating the \nprovision of efficient and effective remedies to the victims and survivors and of \nbringing those responsible to justice in accordance with national and international \nlaw;  \n \n14. Condemns in the strongest possible terms all violations and abuses of \nhuman rights and violations of international humanitarian law committed in \nAfghanistan, including all attacks, reprisals and violence against journalists and \nmedia workers, urges that the perpetrators of attacks on journalists be brought to \njustice in accordance with national and international law, expresses concern regarding \nincreasing challenges faced by journalists, media workers and media outlets in \nAfghanistan, where they operate under an environment of censorship and tight \nrestrictions on accessing information, and urges all Afghan political actors and \nstakeholders to ensure and respect freedom of opinion and expression, media freedom \nand access to media;  \n \n15. Expresses its concern about reports of extrajudicial punishments, such as \nreprisals and summary executions, enforced disappearances and arbitrary detentions, \nincluding those against former members of the Afghan National Defence and Security \nForces and other officials, and expresses its deep concern about inhumane \npunishments in Afghanistan;  \n \n16. Reiterates that sustained and effective efforts in fighting corruption in \nAfghanistan remain critical for the country\u2019s future, and urges all relevant Afghan \npolitical actors and stakeholders to promote the rule of law and address impunity for \ncorruption, and establish a more effective, accountable and transparent administration \nat the national, provincial and local levels;  \n \nSecurity, counter-terrorism and counter-narcotics \n \n17. Notes improvements in the overall security conditions in Afghanistan, at \nthe same times reiterates its serious concern about the continuing violence and the \npresence of terrorist groups such as Al-Qaida and their affiliates, Islamic State in Iraq \nand the Levant (ISIL) (Da\u2019esh) and their affiliates, including ISIL-Khorasan, and \nTehrik-e Taliban Pakistan, as well as the presence of foreign terrorist fighters, and \ncondemns attacks against civilians and civilian infrastructure, which have especially \ntargeted educational facilities, diplomatic premises and personnel and religious sites \nbelonging to minorities, as well as deplorable attempts to undermine relations \nbetween communities, posing a serious threat to the security of Afghanistan, its \nimmediate neighbours and the countries of the region;  \n \n18. Reaffirms the importance of combating terrorism in Afghanistan, including \nthose individuals and groups designated by the Security Council Committee pursuant \nto resolutions 1267 (1999), 1989 (2011) and 2253 (2015) concerning ISIL (Da\u2019esh), \nAl-Qaida and associated individuals, groups, undertakings and entities and of \npreventing violent extremism as and when conducive to terrorism, demands that the \n_______________ \n \n5 Ibid., vol. 1577, vol. 2171, vol. 2173, vol. 2983, No. 27531. \n\nA/RES/79/317 \nThe situation in Afghanistan\n \n25-11209\n6/12 \n \nterritory of Afghanistan not be used as a platform or safe haven by any terrorist group, \norganization or individual to threaten or attack any country, to plan or finance terrorist \nacts or to shelter and train terrorists, and that no Afghan group or individual should \nsupport terrorists operating on the territory of any country, and also reaffirms that all \nmeasures taken by States to counter terrorism must comply with their obligations \nunder international law, including international humanitarian law, international \nhuman rights law and international refugee law;  \n \n19. Calls upon Afghanistan to take active measures to tackle, dismantle and \neliminate all terrorist organizations equally and without discrimination and prevent \nthe use of Afghan territory by such groups against its neighbours, the region and \nbeyond; \n \n20. Recognizes that terrorism has devastating consequences on the human \nrights and fundamental freedoms of victims and their families, deplores the suffering \nof the people of Afghanistan, and reaffirms its profound solidarity with them, and \nemphasizes the need to promote international solidarity in support of victims of \nterrorism and to ensure that victims of terrorism are treated with dignity and respect, \nand that their right to access to justice and redress mechanisms, as provided for in \napplicable domestic law and in accordance with international law, is fully respected;  \n \n21. Stresses the need for neighbouring and regional countries and the \ninternational community to continue to work closely together and to improve \ncoordination in countering all acts of terrorism and the associated threats, including \nthe threat posed by foreign terrorist fighters and terrorism financing in Afghanistan, \nthe region and beyond, and affirms its support for continued efforts in this regard;  \n \n22. Remains deeply concerned about the persistent harm to civilians, including \nthe disproportionate impact on children, caused by anti\u2011personnel landmines, \nexplosive remnants of war, improvised explosive devices and weapons, encourages \nall relevant Afghan political actors and stakeholders to continue efforts to eradicate \nthe threat posed by anti\u2011personnel landmines and improvised explosive devices, and \nencourages steps towards addressing the illicit trade in and destabilizing accumulation \nof small arms and light weapons in Afghanistan, and their diversion;  \n \n23. Expresses its continued deep concern at the undiminished serious threat \nand harm of illicit opium cultivation and methamphetamine production and at the \nconsumption and trafficking of these drugs in Afghanistan, and that they continue to \nbe a source of financing for terrorist groups and non\u2011State actors that threaten regional \nand international security, calls for comprehensive measures to combat illicit \nnarcotics, particularly in light of the significant rise in the production of synthetic \ndrugs, calls upon States to strengthen international and regional cooperation to \ncounter this threat, and recognizes the important role played by neighbouring \ncountries of Afghanistan in combating and countering international drug trafficking, \nalso recognizes the important role of the United Nations Office on Drugs and Crime, \nand stresses the importance of agricultural development and alternative livelihoods to \naddress the drug problem;  \n \n24. Welcomes steps taken by the Taliban with regard to a ban on opium \ncultivation, calls for its full and sustainable implementation, stresses the impact of the \nnarcotics ban on the cultivation, production, trafficking and consumption of illicit \ndrugs in Afghanistan, calls for its full and sustainable implementation, and \nemphasizes the importance of a comprehensive, integrated and balanced approach in \naddressing the drug problem of Afghanistan, which, to be effective, must be integrated \ninto the wider context of efforts carried out in the areas of security, governance, the \nrule of law, human rights, public health and economic and social development, in \nparticular in rural areas, including the development of improved alternative livelihood \n\nThe situation in Afghanistan \nA/RES/79/317\n \n7/12\n25-11209 \n \nprogrammes, such as initiatives to promote legal agricultural production, including \nwheat cultivation in central Afghanistan, and encourages more comprehensive \nengagement with the Counter-Narcotics Working Group established under the United \nNations-led Doha process, with a view to enhancing cooperation in addressing the \nillicit drug economy and its regional and global ramifications;  \n \n25. Notes with great concern the strong nexus between drug trafficking and \nterrorism in Afghanistan, stresses the importance of continued attention to the \nlinkages in Afghanistan between the proceeds of organized crime, inter alia, the illicit \nproduction of and trafficking in drugs and their chemical precursors and the financing, \nrespectively, of terrorists including those individuals and groups designated by the \nSecurity Council Committee pursuant to resolutions 1267 (1999), 1989 (2011) and \n2253 (2015), and underscores the need to improve the necessary capacity of the \nrelevant Afghan institutions to address challenges posed by terrorism, narcotics, \nsmuggling, money-laundering and organized crime;  \n \nHumanitarian assistance \n \n26. Notes with grave concern the dire humanitarian situation affecting \nAfghanistan, including the funding gap for and continuing obstacles to humanitarian \noperations, with millions of people facing emergency levels of food insecurity, \nacknowledges that women and children, including girls, are disproportionally affected \nby the humanitarian and economic crisis, urges the international community to \nprovide, in accordance with international law, including international humanitarian \nlaw, humanitarian assistance and financial resources to support humanitarian \nactivities across Afghanistan, consistent with humanitarian principles, and calls for \nsupport to the Afghanistan Humanitarian Needs and Response Plan for 2025;  \n \n27. Emphasizes the importance of strengthened efforts to provide \nhumanitarian assistance and other activities that support basic human needs in \nAfghanistan, in accordance with resolution 2615 (2021) of 22 December 2021, while \nacknowledging the important coordination role of the United Nations in this regard, \nand reiterates that full, rapid, safe and unhindered humanitarian access consistent with \ninternational law, including international humanitarian law and other international \nlegal obligations, for all international and national humanitarian personnel, including \nnational and locally recruited personnel, in particular women, and international and \nnational non\u2011governmental organizations, is essential;  \n \n28. Stresses the critical importance of predictable, principled and sustained \ninternational humanitarian assistance to Afghanistan, particularly in addressing \nurgent needs in the areas of public health, nutrition and the prevention of \ncommunicable diseases, and calls upon all donor countries and relevant stakeholders \nto reconsider any decisions that may lead to reductions in such assistance, taking into \naccount the potential adverse humanitarian consequences for the most vulnerable \npopulations; \n \n29. Acknowledges that natural disasters such as earthquakes, floods and \ndroughts underline the need for disaster risk reduction measures and lead to a further \nincrease in humanitarian needs in Afghanistan;  \n \n30. Takes note of Security Council resolution 2615 (2021), in which the \nCouncil underlined that humanitarian assistance and other activities that support basic \nhuman needs in Afghanistan were not a violation of paragraph 1 (a) of Council \nresolution 2255 (2015) of 21 December 2015, while recalling the need to minimize \nand monitor the risk of aid diversion, and also recalling the humanitarian exemption \nset out in Council resolution 2664 (2022) of 9 December 2022;  \n\nA/RES/79/317 \nThe situation in Afghanistan\n \n25-11209\n8/12 \n \n \n31. Calls upon all actors to work towards improving the accessibility of the \nfull spectrum of activities by humanitarian and development agencies and personnel, \nincluding all Afghans across all ethnic groups, in all areas of the country, in support \nof all people in need, including women, children, displaced persons, minorities and \npersons with disabilities, as well as to support efforts to create conditions conducive \nto a voluntary, safe, dignified and sustainable return and reintegration of internally \ndisplaced persons and refugee populations, in particular those in neighbouring \ncountries which have faced a major influx of refugees;  \n \nSocial and economic development \n \n32. Emphasizes the importance of creating opportunities for economic \nrecovery, development and prosperity in Afghanistan, including measures to help the \ncountry strengthen its capacity for sustainable and self-reliant development; \n \n33. Recognizes the necessity of improving the living conditions of the Afghan \npeople, and therefore emphasizes the need to address basic human needs across \nAfghanistan, in particular equal access to basic services such as education and public \nhealth services, taking into account Security Council resolution 2615 (2021) and the \nUnited Nations Strategic Framework for Afghanistan for 2023\u20132025;  \n \n34. Also recognizes the need to help to address the substantial challenges \nfacing the economy of Afghanistan, including through efforts to restore the banking \nand financial systems as well as enabling access to assets belonging to the Central \nBank of Afghanistan for the benefit of the Afghan people, acknowledges that the \nfinancial system of Afghanistan continues to face serious challenges, and calls upon \nall relevant Afghan political actors and stakeholders to create favourable conditions \nfor economic activity and recovery by adhering to the rule of law, respecting fully \ncivil, political, social, economic and cultural rights, ensuring educational rights for \nall Afghans, including women and girls, by providing responsible and accountable \ngovernance, and expanding the capacities and professionalism of Afghan institutions;  \n \n35. Encourages continued efforts, working with all relevant Afghan political \nactors and stakeholders, to contribute to supporting the provision of essential services \nto the Afghan population and to creating economic and social conditions that can lead \nto self-reliance and stability and to facilitate commercial and financial activity in \nAfghanistan for the benefit of the Afghan people, especially women, including \nthrough efforts to restore the banking and financial systems in Afghanistan;  \n \n36. Recalls its concern about the adverse impact of climate change, natural \ndisasters and environmental issues in Afghanistan, and emphasizes the urgent need to \nbuild resilience, especially for the most vulnerable, including through the \nrevitalization of sustainable food systems and improvements in water management;  \n \nEducation \n \n37. Reaffirms its commitment to ensure inclusive and equitable quality \neducation and promote lifelong learning opportunities for all;  \n \n38. Strongly emphasizes that education is a human right that needs to be \ngranted to every citizen, including women and girls, minorities and persons with \ndisabilities, expresses deep concern about the decisions of the Taliban to close \nsecondary schools for girls and to ban women from universities and from private and \npublic medical institutions, which may also hinder the growth and competitiveness of \nthe Afghan economy, and calls for Afghanistan to comply with its international \nobligations and in this regard swiftly reverse all policies and practices that restrict the \nenjoyment by women and girls of the human right to education;  \n\nThe situation in Afghanistan \nA/RES/79/317\n \n9/12\n25-11209 \n \n \n39. Emphasizes the importance of the rights and needs of the entire population \nof the country, including all ethnic and religious groups, and stresses that women and \ngirls\u2019 access to education and economic opportunities, including access to work, \nparticipation in public life, freedom of movement, justice and basic services, will \ncontribute to peace, stability and prosperity in the country; \n \n40. Strongly welcomes initiatives of regional and international actors that aim \nto provide quality education for the Afghan population, especially for women and \ngirls, subsequent to the Taliban\u2019s edicts, and encourages all relevant actors to consider \nfurther activities in this regard, while recalling the primary responsibility of the \nTaliban to ensure equal, adequate and quality education in Afghanistan; \n \n41. Takes note of the Islamabad Declaration on Girls\u2019 Education in Muslim \nCommunities adopted under the auspices of the Muslim World League, which \nemphasized girls\u2019 education as a human right, consistent with Islamic teachings; \n \nRefugees \n \n42. Expresses its concern over the number of internally displaced persons in \nand refugees from Afghanistan, including members of all ethnic and religious groups, \nrecalls the respective obligations of States under international refugee law with \nrespect to the protection of refugees, to respect the principle of voluntary return of \nrefugees and the right to seek asylum and to ensure full, safe and unhindered access \nfor humanitarian relief agencies in order to provide protection and assistance to \nAfghan people in need;  \n \n43. Reaffirms its commitment to manage national borders in a coordinated \nmanner, promoting bilateral and regional cooperation, ensuring security for States, \ncommunities and migrants, and facilitating safe and regular cross-border movements \nof people while preventing irregular migration, thereby allowing Member States to \nconsider further resettlement efforts;  \n \n44. Expresses its appreciation to those governments that host Afghan refugees, \nincluding the Islamic Republic of Iran and Pakistan, and underlines the centrality of \ninternational cooperation to the refugee protection regime, recognizes the burden that \nlarge movements of refugees place on major and long-standing refugee-hosting \ncountries and communities, as well as their national resources, especially in the case \nof developing countries, and calls for a more equitable sharing of the burden and \nresponsibility for hosting and supporting the world\u2019s refugees, addressing the needs \nof refugees and hosting States, while taking account of existing contributions and the \ndiffering capacities and resources among States;  \n \n45. Expresses concern over the significant challenges associated with hosting, \nprotecting and integrating Afghan refugees in national systems and strategies given \nsocioeconomic difficulties, stretched resources and the impact on the social and \npolitical cohesion of major hosting countries in the region and beyond;  \n \n46. Underlines that the return of migrants who do not have the legal right to \nstay on another State\u2019s territory should be safe and dignified and in compliance with \ninternational law, including international human rights law;  \n \n47. Requests relevant international organizations, in particular the Office of \nthe United Nations High Commissioner for Refugees and the International \nOrganization for Migration, to continue to work closely with all relevant Afghan \npolitical actors and stakeholders and the countries hosting Afghan refugees with a \nview to facilitating the voluntary, safe and dignified return of refugees and their \nsustainable reintegration, and encourages relevant stakeholders to support and \nfacilitate as a matter of priority the repatriation of Afghan refugees reasonably \n\nA/RES/79/317 \nThe situation in Afghanistan\n \n25-11209\n10/12 \n \nregarded as a threat to public safety in order to preserve hosting countries\u2019 \nreceptiveness to refugees;  \n \n48. Reaffirms that peace and stability, social and economic development, \nrespect for human rights and inclusive government in Afghanistan would also \ncontribute to the voluntary, safe, dignified and sustainable return of all Afghan \nrefugees and internally displaced persons to play their constructive role in \nAfghanistan;  \n \nRegional cooperation \n \n49. Stresses the crucial importance of advancing constructive and sustainable \nregional cooperation as an effective means of promoting and complementing peace, \nsecurity, stability and economic and social development in Afghanistan and the \nregion;  \n \n50. Highlights the importance of the contributions of neighbouring and \nregional partners and regional organizations to the well-being of the Afghan people, \nincluding educational opportunities provided by such countries as India, Iran (Islamic \nRepublic of) and T\u00fcrkiye, as well as the regional programme to support Afghan \nstudents\u2019 access to higher education in Kazakhstan, Kyrgyzstan, Turkmenistan and \nUzbekistan, which serves as a practical example of regional solidarity and investment \nin the future of Afghanistan, and urges the Taliban to establish mechanisms to enable \ncooperation with the interested actors and to benefit from their knowledge and \nexpertise in this regard; \n \n51. Recognizes the importance of the potential role of Afghanistan in \nconnecting Central and South Asia, as well as its economic development and \nintegration into interregional economic processes for lasting peace and stability;  \n \n52. Notes the historical role of Afghanistan as a land bridge in Asia, and recalls \nthat regional economic cooperation plays an important role in achieving stability and \ndevelopment in Afghanistan;  \n \n53. Recognizes the importance of regional connectivity projects with \nneighbouring countries and Central Asia that can provide a pathway to economic \ngrowth and stabilization in Afghanistan;  \n \n54. Expresses appreciation for the commitment of neighbouring and regional \npartners to peace and stability in Afghanistan and Central Asia and for demonstrating \nunwavering support to the United Nations;  \n \n55. Welcomes regional diplomatic initiatives conducive to an Afghanistan at \npeace with itself and its neighbours as complementary efforts to the United Nations-\nled Doha process; \n \n56. Also welcomes the work of the United Nations Regional Centre for \nPreventive Diplomacy for Central Asia in accordance with its mandate aimed at \nstrengthening the cooperation and engagement of Central Asian countries in dealing \nwith current challenges in Afghanistan;  \n \n57. Further welcomes the formalization of the United Nations Regional Centre \nfor the Sustainable Development Goals for Central Asia and Afghanistan, and \nunderscores the important role the Centre can play in fostering regional cooperation \nby implementing regional projects and programmes aimed at contributing to \ninternational efforts towards peace, stability and sustainable development in \nAfghanistan, and encourages the Centre to work in close collaboration with all \nrelevant stakeholders, including United Nations agencies and regional partners;  \n \n\nThe situation in Afghanistan \nA/RES/79/317\n \n11/12\n25-11209 \n \nInternational cooperation \n \n58. Stresses the importance of an engagement architecture to guide and bring \nmore coherence to political, humanitarian and development activities, and a \nsubstantive road map that will enable more effective negotiation and implementation \nof the priorities of Afghan and international stakeholders;  \n \n59. Reaffirms that an integrated and coherent approach among relevant \npolitical, humanitarian and development actors, within and outside of the United \nNations system, consistent with their respective mandates, is critical to building and \nsustaining peace in Afghanistan;  \n \n60. Takes note with satisfaction of the independent assessment on Afghanistan;  \n \n61. Encourages Member States and all other relevant stakeholders to consider \nthe independent assessment and the implementation of its recommendations, \nespecially increasing international engagement in a more coherent, coordinated and \nstructured manner, affirms that the objective of this process should be a clear end state \nof an Afghanistan at peace with itself and its neighbours, fully reintegrated into the \ninternational community and meeting international obligations, and stresses the need \nto ensure the full, equal, meaningful and safe participation of Afghan women in the \nprocess throughout;  \n \n62. Encourages the Secretary-General, in consultation with all relevant \nstakeholders, to appoint a coordinator to facilitate a more coherent, coordinated and \nstructured international approach and to promote implementation of the \nrecommendations of the independent assessment, without prejudice to the mandates \nof the United Nations Assistance Mission in Afghanistan and the Special \nRepresentative of the Secretary-General and their vital work in Afghanistan; \n \n63. Welcomes the Secretary-General\u2019s initiative for establishing the United \nNations-led Doha process that initially met in May 2023 in Doha, encourages further \ndiscussions on the implementations of the recommendations of the independent \nassessment; in this regard welcomes the Secretariat\u2019s efforts towards a comprehensive \napproach in facilitating principled international engagement, including through the \nestablishment of Working Groups in line with priority issues identified by the \nindependent assessment, and emphasizes the importance of developing a political \nroad map;  \n \nUnited Nations Assistance Mission in Afghanistan \n \n64. Fully supports the work of the United Nations Assistance Mission in \nAfghanistan, as mandated by the Security Council in its resolution 2777 (2025), \nstresses the critical importance of the continued presence of the Mission and other \nUnited Nations agencies, funds and programmes across Afghanistan, and expresses \nits appreciation for the work of the Special Representative of the Secretary-General \nfor Afghanistan;  \n \n65. Reiterates the necessity for all relevant Afghan political actors and \nstakeholders as well as international actors to coordinate with the Mission and other \nUnited Nations agencies, funds and programmes across Afghanistan in the \nimplementation of their mandates and to ensure the safety, security and freedom of \nmovement of United Nations and associated personnel, irrespective of gender, \nthroughout the country;  \n \n66. Requests the Secretary-General to continue to report every three months \non developments in Afghanistan, as well as on the progress made in the \nimplementation of the present resolution;  \n\nA/RES/79/317 \nThe situation in Afghanistan\n \n25-11209\n12/12 \n \n \n67. Decides to include in the provisional agenda of its eighty-second session \nthe item entitled \u201cThe situation in Afghanistan\u201d. \n \n83rd plenary meeting \n7 July 2025 \n \n",
  "paragraphs": {
    "1": "Expresses deep concern over the dire economic, humanitarian and social conditions, persistent violence and the presence of terrorist groups, the absence of political inclusivity and representative decision-making, as well as violations and abuses of human rights, including those of women, girls and persons belonging to minorities since the takeover by the Taliban;",
    "2": "Recognizes that the health, well-being, prosperity and security of the people of Afghanistan affect the entire region and beyond;",
    "3": "Maintains that sustainable and lasting peace can be achieved only through long-term social, economic and political stability, which requires full respect for civil, political, social, economic and cultural rights as well as commitment to inclusive and representative governance;",
    "4": "Pledges its continued support to the people of Afghanistan in order to rebuild a stable, secure and economically self-sufficient State, free of terrorism, illicit narcotics, transnational organized crime, including trafficking in persons, and corruption, and to strengthen the foundations of a constitutional and inclusive government aimed at ensuring the well-being of the Afghan people as a responsible member of the international community; A/RES/79/317 The situation in Afghanistan 25-11209 4/12",
    "5": "Acknowledges the efforts of the international community, including neighbouring countries, donor agencies and other international organizations in urgent provision of humanitarian assistance to Afghanistan, and emphasizes that long- term peace, security, prosperity and sustainable development in Afghanistan and the region require the respect of international obligations by Afghanistan, closer and more effective cooperation, as well as greater coherence and complementarity of approach within the international community;",
    "6": "Urges Afghanistan to adhere to international law, comply with its international obligations and honour and fully respect and implement all treaties, covenants or conventions, bilateral or multilateral, to which it is Party, and coexist peacefully with neighbouring countries and the region;",
    "7": "Calls upon the Taliban to fulfil and respect their assurances for the safety and security of diplomatic personnel and premises, humanitarian workers and international organizations in Afghanistan;",
    "8": "Emphasizes that relations of all relevant Afghan political actors and stakeholders with the international community will be informed by their commitments, actions and achievements with regard to the expectations of the Afghan people widely shared by the international community; Human rights, governance and the rule of law",
    "9": "Expresses its serious concern about the grave, worsening, widespread and systematic oppression of all women and girls in Afghanistan by the Taliban, which, as documented by the Special Rapporteur on the situation of human rights in Afghanistan, 3 has put in place an institutionalized system of discrimination, segregation, disrespect for human dignity and the exclusion of women and girls, recalls the obligations of Afghanistan under international law, in particular human rights, refugee and international humanitarian law, and stresses the need to ensure respect for human rights and fundamental freedoms;",
    "10": "Reiterates its unwavering commitment to international law, including international humanitarian law and the human rights of all Afghans, including all ethnic and religious groups, calls for the full, equal, meaningful and safe participation of women and girls in Afghanistan, in this regard calls for the Taliban to swiftly reverse contradictory policies and practices, including the \u201cvice and virtue\u201d directive, which extend the already intolerable restrictions on the human rights of women and girls and on basic personal freedoms for all Afghans, and the decision to suspend women\u2019s and girls\u2019 access to education in private and public medical institutions, the ban on Afghan women working for the United Nations and non\u2011governmental organizations in Afghanistan, as well as other policies and practices that restrict the enjoyment by women and girls of their human rights and fundamental freedoms, including as related to their access to education, employment and health services, freedom of movement, and women\u2019s full, equal and meaningful participation in public life, while reaffirming the indispensable role of women in Afghan society, the need to increase their roles and participation in decision-making and the importance of gender equality in achieving sustainable, peaceful and inclusive societies;",
    "11": "Emphasizes the need to ensure respect for the human rights and fundamental freedoms of women and children in Afghanistan and to end and prevent all abuses against women and children, encourages the full implementation of the Convention on the Elimination of All Forms of Discrimination against Women4 and _______________ 3 See A/HRC/56/25. 4 United Nations, Treaty Series, vol. 1249, No. 20378. The situation in Afghanistan A/RES/79/317 5/12 25-11209 the Convention on the Rights of the Child and the Optional Protocols thereto, 5 and strongly condemns all forms of violence against women and children;",
    "12": "Reiterates the importance of dialogue between all relevant Afghan political actors and stakeholders with a focus on the establishment of inclusive, representative, participatory and responsive governance at the national and subnational levels;",
    "13": "Strongly emphasizes the necessity of investigating allegations of current and past human rights abuses and violations, as well as violations of international humanitarian law, in Afghanistan, and stresses the importance of facilitating the provision of efficient and effective remedies to the victims and survivors and of bringing those responsible to justice in accordance with national and international law;",
    "14": "Condemns in the strongest possible terms all violations and abuses of human rights and violations of international humanitarian law committed in Afghanistan, including all attacks, reprisals and violence against journalists and media workers, urges that the perpetrators of attacks on journalists be brought to justice in accordance with national and international law, expresses concern regarding increasing challenges faced by journalists, media workers and media outlets in Afghanistan, where they operate under an environment of censorship and tight restrictions on accessing information, and urges all Afghan political actors and stakeholders to ensure and respect freedom of opinion and expression, media freedom and access to media;",
    "15": "Expresses its concern about reports of extrajudicial punishments, such as reprisals and summary executions, enforced disappearances and arbitrary detentions, including those against former members of the Afghan National Defence and Security Forces and other officials, and expresses its deep concern about inhumane punishments in Afghanistan;",
    "16": "Reiterates that sustained and effective efforts in fighting corruption in Afghanistan remain critical for the country\u2019s future, and urges all relevant Afghan political actors and stakeholders to promote the rule of law and address impunity for corruption, and establish a more effective, accountable and transparent administration at the national, provincial and local levels; Security, counter-terrorism and counter-narcotics",
    "17": "Notes improvements in the overall security conditions in Afghanistan, at the same times reiterates its serious concern about the continuing violence and the presence of terrorist groups such as Al-Qaida and their affiliates, Islamic State in Iraq and the Levant (ISIL) (Da\u2019esh) and their affiliates, including ISIL-Khorasan, and Tehrik-e Taliban Pakistan, as well as the presence of foreign terrorist fighters, and condemns attacks against civilians and civilian infrastructure, which have especially targeted educational facilities, diplomatic premises and personnel and religious sites belonging to minorities, as well as deplorable attempts to undermine relations between communities, posing a serious threat to the security of Afghanistan, its immediate neighbours and the countries of the region;",
    "18": "Reaffirms the importance of combating terrorism in Afghanistan, including those individuals and groups designated by the Security Council Committee pursuant to resolutions 1267 (1999), 1989 (2011) and 2253 (2015) concerning ISIL (Da\u2019esh), Al-Qaida and associated individuals, groups, undertakings and entities and of preventing violent extremism as and when conducive to terrorism, demands that the _______________ 5 Ibid., vol. 1577, vol. 2171, vol. 2173, vol. 2983, No. 27531. A/RES/79/317 The situation in Afghanistan 25-11209 6/12 territory of Afghanistan not be used as a platform or safe haven by any terrorist group, organization or individual to threaten or attack any country, to plan or finance terrorist acts or to shelter and train terrorists, and that no Afghan group or individual should support terrorists operating on the territory of any country, and also reaffirms that all measures taken by States to counter terrorism must comply with their obligations under international law, including international humanitarian law, international human rights law and international refugee law;",
    "19": "Calls upon Afghanistan to take active measures to tackle, dismantle and eliminate all terrorist organizations equally and without discrimination and prevent the use of Afghan territory by such groups against its neighbours, the region and beyond;",
    "20": "Recognizes that terrorism has devastating consequences on the human rights and fundamental freedoms of victims and their families, deplores the suffering of the people of Afghanistan, and reaffirms its profound solidarity with them, and emphasizes the need to promote international solidarity in support of victims of terrorism and to ensure that victims of terrorism are treated with dignity and respect, and that their right to access to justice and redress mechanisms, as provided for in applicable domestic law and in accordance with international law, is fully respected;",
    "21": "Stresses the need for neighbouring and regional countries and the international community to continue to work closely together and to improve coordination in countering all acts of terrorism and the associated threats, including the threat posed by foreign terrorist fighters and terrorism financing in Afghanistan, the region and beyond, and affirms its support for continued efforts in this regard;",
    "22": "Remains deeply concerned about the persistent harm to civilians, including the disproportionate impact on children, caused by anti\u2011personnel landmines, explosive remnants of war, improvised explosive devices and weapons, encourages all relevant Afghan political actors and stakeholders to continue efforts to eradicate the threat posed by anti\u2011personnel landmines and improvised explosive devices, and encourages steps towards addressing the illicit trade in and destabilizing accumulation of small arms and light weapons in Afghanistan, and their diversion;",
    "23": "Expresses its continued deep concern at the undiminished serious threat and harm of illicit opium cultivation and methamphetamine production and at the consumption and trafficking of these drugs in Afghanistan, and that they continue to be a source of financing for terrorist groups and non\u2011State actors that threaten regional and international security, calls for comprehensive measures to combat illicit narcotics, particularly in light of the significant rise in the production of synthetic drugs, calls upon States to strengthen international and regional cooperation to counter this threat, and recognizes the important role played by neighbouring countries of Afghanistan in combating and countering international drug trafficking, also recognizes the important role of the United Nations Office on Drugs and Crime, and stresses the importance of agricultural development and alternative livelihoods to address the drug problem;",
    "24": "Welcomes steps taken by the Taliban with regard to a ban on opium cultivation, calls for its full and sustainable implementation, stresses the impact of the narcotics ban on the cultivation, production, trafficking and consumption of illicit drugs in Afghanistan, calls for its full and sustainable implementation, and emphasizes the importance of a comprehensive, integrated and balanced approach in addressing the drug problem of Afghanistan, which, to be effective, must be integrated into the wider context of efforts carried out in the areas of security, governance, the rule of law, human rights, public health and economic and social development, in particular in rural areas, including the development of improved alternative livelihood The situation in Afghanistan A/RES/79/317 7/12 25-11209 programmes, such as initiatives to promote legal agricultural production, including wheat cultivation in central Afghanistan, and encourages more comprehensive engagement with the Counter-Narcotics Working Group established under the United Nations-led Doha process, with a view to enhancing cooperation in addressing the illicit drug economy and its regional and global ramifications;",
    "25": "Notes with great concern the strong nexus between drug trafficking and terrorism in Afghanistan, stresses the importance of continued attention to the linkages in Afghanistan between the proceeds of organized crime, inter alia, the illicit production of and trafficking in drugs and their chemical precursors and the financing, respectively, of terrorists including those individuals and groups designated by the Security Council Committee pursuant to resolutions 1267 (1999), 1989 (2011) and 2253 (2015), and underscores the need to improve the necessary capacity of the relevant Afghan institutions to address challenges posed by terrorism, narcotics, smuggling, money-laundering and organized crime; Humanitarian assistance",
    "26": "Notes with grave concern the dire humanitarian situation affecting Afghanistan, including the funding gap for and continuing obstacles to humanitarian operations, with millions of people facing emergency levels of food insecurity, acknowledges that women and children, including girls, are disproportionally affected by the humanitarian and economic crisis, urges the international community to provide, in accordance with international law, including international humanitarian law, humanitarian assistance and financial resources to support humanitarian activities across Afghanistan, consistent with humanitarian principles, and calls for support to the Afghanistan Humanitarian Needs and Response Plan for 2025;",
    "27": "Emphasizes the importance of strengthened efforts to provide humanitarian assistance and other activities that support basic human needs in Afghanistan, in accordance with resolution 2615 (2021) of 22 December 2021, while acknowledging the important coordination role of the United Nations in this regard, and reiterates that full, rapid, safe and unhindered humanitarian access consistent with international law, including international humanitarian law and other international legal obligations, for all international and national humanitarian personnel, including national and locally recruited personnel, in particular women, and international and national non\u2011governmental organizations, is essential;",
    "28": "Stresses the critical importance of predictable, principled and sustained international humanitarian assistance to Afghanistan, particularly in addressing urgent needs in the areas of public health, nutrition and the prevention of communicable diseases, and calls upon all donor countries and relevant stakeholders to reconsider any decisions that may lead to reductions in such assistance, taking into account the potential adverse humanitarian consequences for the most vulnerable populations;",
    "29": "Acknowledges that natural disasters such as earthquakes, floods and droughts underline the need for disaster risk reduction measures and lead to a further increase in humanitarian needs in Afghanistan;",
    "30": "Takes note of Security Council resolution 2615 (2021), in which the Council underlined that humanitarian assistance and other activities that support basic human needs in Afghanistan were not a violation of paragraph 1 (a) of Council resolution 2255 (2015) of 21 December 2015, while recalling the need to minimize and monitor the risk of aid diversion, and also recalling the humanitarian exemption set out in Council resolution 2664 (2022) of 9 December 2022; A/RES/79/317 The situation in Afghanistan 25-11209 8/12",
    "31": "Calls upon all actors to work towards improving the accessibility of the full spectrum of activities by humanitarian and development agencies and personnel, including all Afghans across all ethnic groups, in all areas of the country, in support of all people in need, including women, children, displaced persons, minorities and persons with disabilities, as well as to support efforts to create conditions conducive to a voluntary, safe, dignified and sustainable return and reintegration of internally displaced persons and refugee populations, in particular those in neighbouring countries which have faced a major influx of refugees; Social and economic development",
    "32": "Emphasizes the importance of creating opportunities for economic recovery, development and prosperity in Afghanistan, including measures to help the country strengthen its capacity for sustainable and self-reliant development;",
    "33": "Recognizes the necessity of improving the living conditions of the Afghan people, and therefore emphasizes the need to address basic human needs across Afghanistan, in particular equal access to basic services such as education and public health services, taking into account Security Council resolution 2615 (2021) and the United Nations Strategic Framework for Afghanistan for 2023\u20132025;",
    "34": "Also recognizes the need to help to address the substantial challenges facing the economy of Afghanistan, including through efforts to restore the banking and financial systems as well as enabling access to assets belonging to the Central Bank of Afghanistan for the benefit of the Afghan people, acknowledges that the financial system of Afghanistan continues to face serious challenges, and calls upon all relevant Afghan political actors and stakeholders to create favourable conditions for economic activity and recovery by adhering to the rule of law, respecting fully civil, political, social, economic and cultural rights, ensuring educational rights for all Afghans, including women and girls, by providing responsible and accountable governance, and expanding the capacities and professionalism of Afghan institutions;",
    "35": "Encourages continued efforts, working with all relevant Afghan political actors and stakeholders, to contribute to supporting the provision of essential services to the Afghan population and to creating economic and social conditions that can lead to self-reliance and stability and to facilitate commercial and financial activity in Afghanistan for the benefit of the Afghan people, especially women, including through efforts to restore the banking and financial systems in Afghanistan;",
    "36": "Recalls its concern about the adverse impact of climate change, natural disasters and environmental issues in Afghanistan, and emphasizes the urgent need to build resilience, especially for the most vulnerable, including through the revitalization of sustainable food systems and improvements in water management; Education",
    "37": "Reaffirms its commitment to ensure inclusive and equitable quality education and promote lifelong learning opportunities for all;",
    "38": "Strongly emphasizes that education is a human right that needs to be granted to every citizen, including women and girls, minorities and persons with disabilities, expresses deep concern about the decisions of the Taliban to close secondary schools for girls and to ban women from universities and from private and public medical institutions, which may also hinder the growth and competitiveness of the Afghan economy, and calls for Afghanistan to comply with its international obligations and in this regard swiftly reverse all policies and practices that restrict the enjoyment by women and girls of the human right to education; The situation in Afghanistan A/RES/79/317 9/12 25-11209",
    "39": "Emphasizes the importance of the rights and needs of the entire population of the country, including all ethnic and religious groups, and stresses that women and girls\u2019 access to education and economic opportunities, including access to work, participation in public life, freedom of movement, justice and basic services, will contribute to peace, stability and prosperity in the country;",
    "40": "Strongly welcomes initiatives of regional and international actors that aim to provide quality education for the Afghan population, especially for women and girls, subsequent to the Taliban\u2019s edicts, and encourages all relevant actors to consider further activities in this regard, while recalling the primary responsibility of the Taliban to ensure equal, adequate and quality education in Afghanistan;",
    "41": "Takes note of the Islamabad Declaration on Girls\u2019 Education in Muslim Communities adopted under the auspices of the Muslim World League, which emphasized girls\u2019 education as a human right, consistent with Islamic teachings; Refugees",
    "42": "Expresses its concern over the number of internally displaced persons in and refugees from Afghanistan, including members of all ethnic and religious groups, recalls the respective obligations of States under international refugee law with respect to the protection of refugees, to respect the principle of voluntary return of refugees and the right to seek asylum and to ensure full, safe and unhindered access for humanitarian relief agencies in order to provide protection and assistance to Afghan people in need;",
    "43": "Reaffirms its commitment to manage national borders in a coordinated manner, promoting bilateral and regional cooperation, ensuring security for States, communities and migrants, and facilitating safe and regular cross-border movements of people while preventing irregular migration, thereby allowing Member States to consider further resettlement efforts;",
    "44": "Expresses its appreciation to those governments that host Afghan refugees, including the Islamic Republic of Iran and Pakistan, and underlines the centrality of international cooperation to the refugee protection regime, recognizes the burden that large movements of refugees place on major and long-standing refugee-hosting countries and communities, as well as their national resources, especially in the case of developing countries, and calls for a more equitable sharing of the burden and responsibility for hosting and supporting the world\u2019s refugees, addressing the needs of refugees and hosting States, while taking account of existing contributions and the differing capacities and resources among States;",
    "45": "Expresses concern over the significant challenges associated with hosting, protecting and integrating Afghan refugees in national systems and strategies given socioeconomic difficulties, stretched resources and the impact on the social and political cohesion of major hosting countries in the region and beyond;",
    "46": "Underlines that the return of migrants who do not have the legal right to stay on another State\u2019s territory should be safe and dignified and in compliance with international law, including international human rights law;",
    "47": "Requests relevant international organizations, in particular the Office of the United Nations High Commissioner for Refugees and the International Organization for Migration, to continue to work closely with all relevant Afghan political actors and stakeholders and the countries hosting Afghan refugees with a view to facilitating the voluntary, safe and dignified return of refugees and their sustainable reintegration, and encourages relevant stakeholders to support and facilitate as a matter of priority the repatriation of Afghan refugees reasonably A/RES/79/317 The situation in Afghanistan 25-11209 10/12 regarded as a threat to public safety in order to preserve hosting countries\u2019 receptiveness to refugees;",
    "48": "Reaffirms that peace and stability, social and economic development, respect for human rights and inclusive government in Afghanistan would also contribute to the voluntary, safe, dignified and sustainable return of all Afghan refugees and internally displaced persons to play their constructive role in Afghanistan; Regional cooperation",
    "49": "Stresses the crucial importance of advancing constructive and sustainable regional cooperation as an effective means of promoting and complementing peace, security, stability and economic and social development in Afghanistan and the region;",
    "50": "Highlights the importance of the contributions of neighbouring and regional partners and regional organizations to the well-being of the Afghan people, including educational opportunities provided by such countries as India, Iran (Islamic Republic of) and T\u00fcrkiye, as well as the regional programme to support Afghan students\u2019 access to higher education in Kazakhstan, Kyrgyzstan, Turkmenistan and Uzbekistan, which serves as a practical example of regional solidarity and investment in the future of Afghanistan, and urges the Taliban to establish mechanisms to enable cooperation with the interested actors and to benefit from their knowledge and expertise in this regard;",
    "51": "Recognizes the importance of the potential role of Afghanistan in connecting Central and South Asia, as well as its economic development and integration into interregional economic processes for lasting peace and stability;",
    "52": "Notes the historical role of Afghanistan as a land bridge in Asia, and recalls that regional economic cooperation plays an important role in achieving stability and development in Afghanistan;",
    "53": "Recognizes the importance of regional connectivity projects with neighbouring countries and Central Asia that can provide a pathway to economic growth and stabilization in Afghanistan;",
    "54": "Expresses appreciation for the commitment of neighbouring and regional partners to peace and stability in Afghanistan and Central Asia and for demonstrating unwavering support to the United Nations;",
    "55": "Welcomes regional diplomatic initiatives conducive to an Afghanistan at peace with itself and its neighbours as complementary efforts to the United Nations- led Doha process;",
    "56": "Also welcomes the work of the United Nations Regional Centre for Preventive Diplomacy for Central Asia in accordance with its mandate aimed at strengthening the cooperation and engagement of Central Asian countries in dealing with current challenges in Afghanistan;",
    "57": "Further welcomes the formalization of the United Nations Regional Centre for the Sustainable Development Goals for Central Asia and Afghanistan, and underscores the important role the Centre can play in fostering regional cooperation by implementing regional projects and programmes aimed at contributing to international efforts towards peace, stability and sustainable development in Afghanistan, and encourages the Centre to work in close collaboration with all relevant stakeholders, including United Nations agencies and regional partners; The situation in Afghanistan A/RES/79/317 11/12 25-11209 International cooperation",
    "58": "Stresses the importance of an engagement architecture to guide and bring more coherence to political, humanitarian and development activities, and a substantive road map that will enable more effective negotiation and implementation of the priorities of Afghan and international stakeholders;",
    "59": "Reaffirms that an integrated and coherent approach among relevant political, humanitarian and development actors, within and outside of the United Nations system, consistent with their respective mandates, is critical to building and sustaining peace in Afghanistan;",
    "60": "Takes note with satisfaction of the independent assessment on Afghanistan;",
    "61": "Encourages Member States and all other relevant stakeholders to consider the independent assessment and the implementation of its recommendations, especially increasing international engagement in a more coherent, coordinated and structured manner, affirms that the objective of this process should be a clear end state of an Afghanistan at peace with itself and its neighbours, fully reintegrated into the international community and meeting international obligations, and stresses the need to ensure the full, equal, meaningful and safe participation of Afghan women in the process throughout;",
    "62": "Encourages the Secretary-General, in consultation with all relevant stakeholders, to appoint a coordinator to facilitate a more coherent, coordinated and structured international approach and to promote implementation of the recommendations of the independent assessment, without prejudice to the mandates of the United Nations Assistance Mission in Afghanistan and the Special Representative of the Secretary-General and their vital work in Afghanistan;",
    "63": "Welcomes the Secretary-General\u2019s initiative for establishing the United Nations-led Doha process that initially met in May 2023 in Doha, encourages further discussions on the implementations of the recommendations of the independent assessment; in this regard welcomes the Secretariat\u2019s efforts towards a comprehensive approach in facilitating principled international engagement, including through the establishment of Working Groups in line with priority issues identified by the independent assessment, and emphasizes the importance of developing a political road map; United Nations Assistance Mission in Afghanistan",
    "64": "Fully supports the work of the United Nations Assistance Mission in Afghanistan, as mandated by the Security Council in its resolution 2777 (2025), stresses the critical importance of the continued presence of the Mission and other United Nations agencies, funds and programmes across Afghanistan, and expresses its appreciation for the work of the Special Representative of the Secretary-General for Afghanistan;",
    "65": "Reiterates the necessity for all relevant Afghan political actors and stakeholders as well as international actors to coordinate with the Mission and other United Nations agencies, funds and programmes across Afghanistan in the implementation of their mandates and to ensure the safety, security and freedom of movement of United Nations and associated personnel, irrespective of gender, throughout the country;",
    "66": "Requests the Secretary-General to continue to report every three months on developments in Afghanistan, as well as on the progress made in the implementation of the present resolution; A/RES/79/317 The situation in Afghanistan 25-11209 12/12",
    "67": "Decides to include in the provisional agenda of its eighty-second session the item entitled \u201cThe situation in Afghanistan\u201d. 83rd plenary meeting 7 July 2025"
  },
  "agenda_items": [
    "Item 36"
  ],
  "symbol_references": [
    "A/79/L.100"
  ]
}