{
  "symbol": "A/RES/79/281",
  "filename": "A_RES_79_281.pdf",
  "title": "79/281. Joint Inspection Unit",
  "text": "United Nations \nA/RES/79/281 \n \n \nGeneral Assembly \nDistr.: General \n16 April 2025 \n \n25-06206 (E) \n*2506206* \n \n \nSeventy-ninth session \nAgenda item 146 \nJoint Inspection Unit \n \n \n \n \n Resolution adopted by the General Assembly \non 11 April 2025 \n \n \n \n \n[on the report of the Fifth Committee (A/79/840, para. 6)] \n \n \n 79/281. Joint Inspection Unit \n \n \n \nThe General Assembly, \n \nRecalling its previous resolutions on the Joint Inspection Unit, in particular \nresolutions 31/192 of 22 December 1976, 50/233 of 7 June 1996, 54/16 of 29 October \n1999, 56/245 of 24 December 2001, 57/284 A and B of 20 December 2002, 58/286 of \n8 April 2004, 59/267 of 23 December 2004, 60/258 of 8 May 2006, 61/238 of \n22 December 2006, 61/260 of 4 April 2007, 62/226 of 22 December 2007, 62/246 of \n3 April 2008, 63/272 of 7 April 2009, 64/262 of 29 March 2010, 65/270 of 4 April \n2011, 66/259 of 9 April 2012, 67/256 of 12 April 2013, 68/266 of 9 April 2014, 69/275 \nof 2 April 2015, 70/257 of 1 April 2016, 71/281 of 6 April 2017, 72/269 of 4 April \n2018, 73/287 of 15 April 2018, 75/270 of 16 April 2021, 76/261 of 13 April 2022, \n77/279 of 18 April 2023 and 78/276 of 24 April 2024,  \n \nReaffirming the statute of the Unit1 and the unique role of the Unit as the only \nexternal and independent system-wide inspection, evaluation and investigation body, \n \n \n \nI \n \n \nReport of the Joint Inspection Unit \n \n \nHaving considered the report of the Joint Inspection Unit for 2024 and \nprogramme of work for 20252 and the note by the Secretary-General on the report of \nthe Unit for 2024,3  \n \n1. \nTakes note with appreciation of the report of the Joint Inspection Unit for \n2024 and programme of work for 2025; \n__________________ \n \n1 Resolution 31/192, annex. \n \n2 Official Records of the General Assembly, Seventy-ninth Session, Supplement No. 34 (A/79/34). \n \n3 A/79/742. \n\nA/RES/79/281 \nJoint Inspection Unit\n \n25-06206\n2/3 \n \n \n2. \nTakes note of the note by the Secretary-General on the report of the Unit \nfor 2024;  \n \n3. \nStresses the importance of the oversight functions of the Unit in \nidentifying concrete managerial, administrative and programming questions within \nthe participating organizations and providing the General Assembly and other \nlegislative organs of participating organizations with practical and action-oriented \nrecommendations to improve and strengthen the governance of the United Nations as \na whole;  \n \n4. \nNotes with appreciation the continued efforts of the Unit to ensure \nefficient and effective mandate delivery, and encourages the Unit to continue its \nefforts towards enhancing accountability, oversight and governance of the United \nNations; \n \n5. \nRecognizes that the effectiveness of the Unit system-wide is a shared \nresponsibility of the Unit, the Member States and the secretariats of the participating \norganizations;  \n \n6. \nAlso recognizes the need to continue to enhance the impact of the Unit on \nthe management efficiency and transparency of the participating organizations within \nthe United Nations system;  \n \n7. \nWelcomes the coordination of the Unit with the Board of Auditors and the \nOffice of Internal Oversight Services of the Secretariat, and encourages those bodies \nto continue to share experiences, knowledge, best practices and lessons learned with \nother United Nations audit and oversight bodies, as well as with the Independent \nAudit Advisory Committee, with a view to avoiding overlap or duplication and \nachieving further synergy, cooperation, effectiveness and efficiency, without \nprejudice to the respective mandates of the audit and oversight bodies;  \n \n8. \nUnderscores the unique role of the Unit as an external and independent \nsystem-wide inspection, evaluation and investigation body, and stresses the important \ncontribution that its recommendations make towards improving the efficient and \neffective performance of the United Nations system;  \n \n9. \nReaffirms the independence of the Unit as set out in article 7 of its statute \nand stresses that budget estimates are to be prepared in a transparent and consistent \nmanner for submission to the General Assembly in accordance with article 20 of the \nstatute of the Unit; \n \n10. Encourages the Unit to continue to identify projects which support a more \neffective United Nations that is capable of providing relevant single and system-wide \nsolutions to current and future challenges; \n \n11. Reiterates its request to the executive heads of the participating \norganizations to fully comply with the statutory procedures for consideration of the \nreports of the Unit and, in particular, to submit their comments, including information \non what they intend to do regarding the recommendations of the Unit, to distribute \nreports in time for their consideration by legislative organs and to provide information \non the steps to be taken to implement those recommendations accepted by the \nlegislative organs and the executive heads of participating organizations;  \n \n12. Reiterates its request to the Secretary-General and the other executive \nheads of the participating organizations to fully assist the Unit with the timely \nprovision of all information requested by it;  \n \n13. Recalls paragraph 12 of its resolution 78/276, and invites the legislative \nbodies of participating organizations to effectively and substantially use the reports \nof the Unit, and to give unselective and due consideration to its recommendations, in \n\nJoint Inspection Unit \nA/RES/79/281\n \n3/3\n25-06206 \n \naccordance with article 11, paragraph 4, of the statute of the Unit, and regularly \nreview the status of acceptance and implementation of the recommendations of the \nUnit in an effort to make best use of its recommendations; \n \n14. Also recalls paragraph 13 of its resolution 78/276 and notes with concern \nthe continuation of significantly different rates of acceptance and implementation of \nrecommendations from the Unit by some participating United Nations system \norganizations, and therefore requests the Unit to continue to examine and improve the \nstatus quo without damaging the strength of recommendations; \n \n15. Invites the executive heads of participating United Nations system \norganizations to implement accepted recommendations of the Unit in a timely \nmanner; \n \n16. Recalls paragraph 14 of its resolution 78/276 and invites participating \norganizations within the United Nations system to regularly review the status of \nacceptance and implementation of the recommendations of the Unit, especially those \nrelated to system-wide coordination and coherence, and invites participating \norganizations to report non-acceptance and non-implementation to the Unit; \n \n17. Invites the Unit, in the course of its work, to continue its efforts for \noversight and review of the efficiency and effectiveness of the United Nations; \n \n18. Also invites the Unit to keep under review the long-term effectiveness of \nits implemented recommendations; \n \n19. Encourages the Unit to continue its efforts to maximize the efficiency of \nlimited resources in implementing its mandates, and to promote a culture of efficiency \nwithin the Unit; \n \n \n \nII \n \n \nReview of consideration of and action taken on the reports and recommendations \nof the Joint Inspection Unit by United Nations system organizations \n \n \nHaving considered the note by the Secretary-General drawing attention to the \nreport of the Joint Inspection Unit entitled \u201cReview of consideration of and action \ntaken on the reports and recommendations of the Joint Inspection Unit by United \nNations system organizations\u201d4 and the note by the Secretary-General transmitting \nhis comments and those of the United Nations System Chief Executives Board for \nCoordination thereon,5 \n \nTakes note of the notes by the Secretary-General. \n \n63rd plenary meeting \n11 April 2025 \n \n__________________ \n \n4 A/79/717. \n \n5 A/79/717/Add.1. \n",
  "paragraphs": {
    "1": "Takes note with appreciation of the report of the Joint Inspection Unit for 2024 and programme of work for 2025; __________________ 1 Resolution 31/192, annex. 2 Official Records of the General Assembly, Seventy-ninth Session, Supplement No. 34 (A/79/34). 3 A/79/742. A/RES/79/281 Joint Inspection Unit 25-06206 2/3",
    "2": "Takes note of the note by the Secretary-General on the report of the Unit for 2024;",
    "3": "Stresses the importance of the oversight functions of the Unit in identifying concrete managerial, administrative and programming questions within the participating organizations and providing the General Assembly and other legislative organs of participating organizations with practical and action-oriented recommendations to improve and strengthen the governance of the United Nations as a whole;",
    "4": "Notes with appreciation the continued efforts of the Unit to ensure efficient and effective mandate delivery, and encourages the Unit to continue its efforts towards enhancing accountability, oversight and governance of the United Nations;",
    "5": "Recognizes that the effectiveness of the Unit system-wide is a shared responsibility of the Unit, the Member States and the secretariats of the participating organizations;",
    "6": "Also recognizes the need to continue to enhance the impact of the Unit on the management efficiency and transparency of the participating organizations within the United Nations system;",
    "7": "Welcomes the coordination of the Unit with the Board of Auditors and the Office of Internal Oversight Services of the Secretariat, and encourages those bodies to continue to share experiences, knowledge, best practices and lessons learned with other United Nations audit and oversight bodies, as well as with the Independent Audit Advisory Committee, with a view to avoiding overlap or duplication and achieving further synergy, cooperation, effectiveness and efficiency, without prejudice to the respective mandates of the audit and oversight bodies;",
    "8": "Underscores the unique role of the Unit as an external and independent system-wide inspection, evaluation and investigation body, and stresses the important contribution that its recommendations make towards improving the efficient and effective performance of the United Nations system;",
    "9": "Reaffirms the independence of the Unit as set out in article 7 of its statute and stresses that budget estimates are to be prepared in a transparent and consistent manner for submission to the General Assembly in accordance with article 20 of the statute of the Unit;",
    "10": "Encourages the Unit to continue to identify projects which support a more effective United Nations that is capable of providing relevant single and system-wide solutions to current and future challenges;",
    "11": "Reiterates its request to the executive heads of the participating organizations to fully comply with the statutory procedures for consideration of the reports of the Unit and, in particular, to submit their comments, including information on what they intend to do regarding the recommendations of the Unit, to distribute reports in time for their consideration by legislative organs and to provide information on the steps to be taken to implement those recommendations accepted by the legislative organs and the executive heads of participating organizations;",
    "12": "Reiterates its request to the Secretary-General and the other executive heads of the participating organizations to fully assist the Unit with the timely provision of all information requested by it;",
    "13": "Recalls paragraph 12 of its resolution 78/276, and invites the legislative bodies of participating organizations to effectively and substantially use the reports of the Unit, and to give unselective and due consideration to its recommendations, in Joint Inspection Unit A/RES/79/281 3/3 25-06206 accordance with article 11, paragraph 4, of the statute of the Unit, and regularly review the status of acceptance and implementation of the recommendations of the Unit in an effort to make best use of its recommendations;",
    "14": "Also recalls paragraph 13 of its resolution 78/276 and notes with concern the continuation of significantly different rates of acceptance and implementation of recommendations from the Unit by some participating United Nations system organizations, and therefore requests the Unit to continue to examine and improve the status quo without damaging the strength of recommendations;",
    "15": "Invites the executive heads of participating United Nations system organizations to implement accepted recommendations of the Unit in a timely manner;",
    "16": "Recalls paragraph 14 of its resolution 78/276 and invites participating organizations within the United Nations system to regularly review the status of acceptance and implementation of the recommendations of the Unit, especially those related to system-wide coordination and coherence, and invites participating organizations to report non-acceptance and non-implementation to the Unit;",
    "17": "Invites the Unit, in the course of its work, to continue its efforts for oversight and review of the efficiency and effectiveness of the United Nations;",
    "18": "Also invites the Unit to keep under review the long-term effectiveness of its implemented recommendations;",
    "19": "Encourages the Unit to continue its efforts to maximize the efficiency of limited resources in implementing its mandates, and to promote a culture of efficiency within the Unit; II Review of consideration of and action taken on the reports and recommendations of the Joint Inspection Unit by United Nations system organizations Having considered the note by the Secretary-General drawing attention to the report of the Joint Inspection Unit entitled \u201cReview of consideration of and action taken on the reports and recommendations of the Joint Inspection Unit by United Nations system organizations\u201d4 and the note by the Secretary-General transmitting his comments and those of the United Nations System Chief Executives Board for Coordination thereon,5 Takes note of the notes by the Secretary-General. 63rd plenary meeting 11 April 2025 __________________ 4 A/79/717. 5 A/79/717/Add.1."
  },
  "agenda_items": [
    "Item 146"
  ],
  "symbol_references": []
}