{
  "symbol": "A/RES/72/42",
  "filename": "A_RES_72_42.pdf",
  "title": "72/42. Measures to prevent terrorists from acquiring weapons of mass destruction",
  "text": "United Nations \nA/RES/72/42\n \n \nGeneral Assembly \nDistr.: General \n12 December 2017 \n \n17-21719 (E)    141217 \n*1721719* \n \n \nSeventy-second session \nAgenda item 99 (s) \n \n \n \n \n Resolution adopted by the General Assembly \non 4 December 2017 \n \n \n \n \n[on the report of the First Committee (A/72/409)] \n \n \n \n72/42. Measures to prevent terrorists from acquiring weapons \nof mass destruction \n \n \n \nThe General Assembly, \n \nRecalling its resolution 71/38 of 5 December 2016, \n \nRecognizing the determination of the international community to combat \nterrorism, as evidenced in relevant General Assembly and Security Council \nresolutions, \n \nDeeply concerned by the growing risk of linkages between terrorism and \nweapons of mass destruction, and in particular by the fact that terrorists may seek to \nacquire weapons of mass destruction, \n \nCognizant of the steps taken by States to implement Security Council \nresolution 1540 (2004) of 28 April 2004 on the non-proliferation of weapons of \nmass destruction, \n \nTaking note of Security Council resolution 2325 (2016) of 15 December 2016 \non the non-proliferation of weapons of mass destruction, \n \nWelcoming the entry into force on 7 July 2007 of the International Convention \nfor the Suppression of Acts of Nuclear Terrorism, 1 \n \nWelcoming also the adoption, by consensus, of amendments to strengthen the \nConvention on the Physical Protection of Nuclear Material 2 by the International \nAtomic Energy Agency on 8 July 2005, and their entry into force on 8 May 2016, \n \nNoting the support expressed in the Final Document of the Seventeenth \nConference of Heads of State or Government of Non-Aligned Countries, held on \nMargarita Island, Bolivarian Republic of Venezuela, from 13 to 18 September 2016, \nfor measures to prevent terrorists from acquiring weapons of mass destruction, \n__________________ \n \n1  United Nations, Treaty Series, vol. 2445, No. 44004. \n \n2  Ibid., vol. 1456, No. 24631. \n\nA/RES/72/42 \nMeasures to prevent terrorists from acquiring weapons of mass destruction\n \n17-21719 \n2/3 \n \n \nNoting also that the Group of Eight, the European Union, the Regional Forum \nof the Association of Southeast Asian Nations and others have taken into account in \ntheir deliberations the dangers posed by the likely acquisition by terrorists of \nweapons of mass destruction and the need for international cooperation in \ncombating it, and that the Global Initiative to Combat Nuclear Terrorism has been \nlaunched jointly by the Russian Federation and the United States of America, \n \nNoting further the holding of the Nuclear Security Summit on 12 and 13 April \n2010 in Washington, D.C., on 26 and 27 March 2012 in Seoul, on 24 and 25 March \n2014 in The Hague and on 31 March and 1 April 2016 in Washington, D.C., \n \nNoting the holding of the high-level meeting on countering nuclear \nterrorism, with a focus on strengthening the legal framework, in New York on \n28 September 2012, \n \nAcknowledging the consideration of issues relating to terrorism and weapons \nof mass destruction by the Advisory Board on Disarmament Matters, 3  \n \nTaking note of the holding by the International Atomic Energy Agency of the \nInternational Conference on Nuclear Security: Commitments and Actions, in Vienna \nin December 2016, and the first International Conference on Nuclear Security: \nEnhancing Global Efforts, in Vienna in July 2013, and the relevant resolutions \nadopted by the General Conference of the Agency at its sixty-first regular session, \n \nTaking note also of the Code of Conduct on the Safety and Security of \nRadioactive Sources, approved by the Board of Governors of the International \nAtomic Energy Agency on 8 September 2003, and the supplementary Guidance on \nthe Management of Disused Radioactive Sources, approved by the Board of \nGovernors of the Agency on 11 September 2017, \n \nTaking note further of the 2005 World Summit Outcome adopted at the \nhigh-level plenary meeting of the General Assembly on 16 September 20054 and \nthe adoption of the United Nations Global Counter-Terrorism Strategy5 on \n8 September 2006, \n \nTaking note of the report of the Secretary-General submitted pursuant to \nparagraph 5 of resolution 71/38,6  \n \nMindful of the urgent need for addressing, within the United Nations \nframework and through international cooperation, this threat to humanity, \n \nEmphasizing that progress is urgently needed in the area of disarmament and \nnon-proliferation in order to maintain international peace and security and to \ncontribute to global efforts against terrorism, \n \n1. \nCalls upon all Member States to support international efforts to prevent \nterrorists from acquiring weapons of mass destruction and their means of delivery; \n \n2. \nAppeals to all Member States to consider early accession to and \nratification of the International Convention for the Suppression of Acts of Nuclear \nTerrorism,1 and encourages States parties to the Convention to review its \nimplementation; \n \n3. \nUrges all Member States to take and strengthen national measures, as \nappropriate, to prevent terrorists from acquiring weapons of mass destruction, their \nmeans of delivery and materials and technologies related to their manufacture; \n__________________ \n \n3  See A/59/361. \n \n4  Resolution 60/1. \n \n5  Resolution 60/288. \n \n6  A/72/344. \n\nMeasures to prevent terrorists from acquiring weapons of mass destruction \nA/RES/72/42\n \n3/3 \n17-21719 \n \n \n4. \nEncourages cooperation among and between Member States and relevant \nregional and international organizations for strengthening national capacities in this \nregard; \n \n5. \nRequests the Secretary-General to compile a report on measures already \ntaken by international organizations on issues relating to the linkage between the \nfight against terrorism and the proliferation of weapons of mass destruction and to \nseek the views of Member States on additional relevant measures, including \nnational measures, for tackling the global threat posed by the acquisition by \nterrorists of weapons of mass destruction and to report to the General Assembly at \nits seventy-third session; \n \n6. \nDecides to include in the provisional agenda of its seventy-third session, \nunder the item entitled \u201cGeneral and complete disarmament\u201d, the sub-item entitled \n\u201cMeasures to prevent terrorists from acquiring weapons of mass destruction\u201d. \n \n62nd plenary meeting  \n4 December 2017 \n \n",
  "paragraphs": {
    "1": "Calls upon all Member States to support international efforts to prevent terrorists from acquiring weapons of mass destruction and their means of delivery;",
    "2": "Appeals to all Member States to consider early accession to and ratification of the International Convention for the Suppression of Acts of Nuclear Terrorism,1 and encourages States parties to the Convention to review its implementation;",
    "3": "Urges all Member States to take and strengthen national measures, as appropriate, to prevent terrorists from acquiring weapons of mass destruction, their means of delivery and materials and technologies related to their manufacture; __________________ 3 See A/59/361. 4 Resolution 60/1. 5 Resolution 60/288. 6 A/72/344. Measures to prevent terrorists from acquiring weapons of mass destruction A/RES/72/42 3/3 17-21719",
    "4": "Encourages cooperation among and between Member States and relevant regional and international organizations for strengthening national capacities in this regard;",
    "5": "Requests the Secretary-General to compile a report on measures already taken by international organizations on issues relating to the linkage between the fight against terrorism and the proliferation of weapons of mass destruction and to seek the views of Member States on additional relevant measures, including national measures, for tackling the global threat posed by the acquisition by terrorists of weapons of mass destruction and to report to the General Assembly at its seventy-third session;",
    "6": "Decides to include in the provisional agenda of its seventy-third session, under the item entitled \u201cGeneral and complete disarmament\u201d, the sub-item entitled \u201cMeasures to prevent terrorists from acquiring weapons of mass destruction\u201d. 62nd plenary meeting 4 December 2017"
  },
  "agenda_items": [
    "Item 99"
  ],
  "symbol_references": []
}