{
  "symbol": "A/RES/79/320",
  "filename": "A_RES_79_320.pdf",
  "title": "79/320. International Day of Awareness of the Special Development Needs and Challenges of Landlocked Developing Countries",
  "text": "United Nations \nA/RES/79/320 \n \nGeneral Assembly \nDistr.: General \n29 July 2025 \n25-12361 (E) \n*2512361* \n \n \nSeventy-ninth session \nAgenda item 13 \nIntegrated and coordinated implementation of and follow-up \nto the outcomes of the major United Nations conferences and \nsummits in the economic, social and related fields \n \n \n \n \n Resolution adopted by the General Assembly \non 25 July 2025 \n \n \n[without reference to a Main Committee (A/79/L.108)] \n \n \n 79/320. International Day of Awareness of the Special Development Needs \nand Challenges of Landlocked Developing Countries \n \n \n \nThe General Assembly, \n \nReaffirming its resolution 70/1 of 25 September 2015, entitled \u201cTransforming \nour world: the 2030 Agenda for Sustainable Development\u201d, in which it adopted a \ncomprehensive, far-reaching and people-centred set of universal and transformative \nSustainable Development Goals and targets, and its commitment to working tirelessly \nfor the full implementation of the Agenda by 2030, \n \nReaffirming also its resolutions 53/199 of 15 December 1998 and 61/185 of \n20 December 2006 on the proclamation of international years, and Economic and \nSocial Council resolution 1980/67 of 25 July 1980 on international years and \nanniversaries, in particular paragraphs 1 to 10 of the annex thereto on the agreed \ncriteria for the proclamation of international years, as well as paragraphs 13 and 14, \nin which it is stated that an international year should not be proclaimed before the \nbasic arrangements for its organization and financing have been made,  \n \nRecalling the Almaty Programme of Action: Addressing the Special Needs of \nLandlocked Developing Countries within a New Global Framework for Transit \nTransport Cooperation for Landlocked and Transit Developing Countries 1 and the \nVienna Programme of Action for Landlocked Developing Countries for the Decade \n2014\u20132024,2 \n_______________ \n \n1 Report of the International Ministerial Conference of Landlocked and Transit Developing \nCountries and Donor Countries and International Financial and Development Institutions on \nTransit Transport Cooperation, Almaty, Kazakhstan, 28 and 29 August 2003 (A/CONF.202/3), \nannex I. \n \n2 Resolution 69/137, annexes I and II. \n\nA/RES/79/320 \nInternational Day of Awareness of the Special Development Needs \nand Challenges of Landlocked Developing Countries\n \n25-12361\n2/2 \n \n \nWelcoming the adoption of the Awaza Programme of Action for Landlocked \nDeveloping Countries for the Decade 2024\u20132034,3 which underscores that we are at \na defining moment in history where the decisions we make now will determine the \nfuture of the 32 landlocked developing countries situated in Africa, Asia, Europe and \nSouth America, with a population of about 606 million, which continue to face a \nhighly challenging pathway to sustainable development, and which is grounded in the \noverarching goals of addressing the special development needs, vulnerabilities and \nchallenges of landlocked developing countries arising from their landlockedness, \nremoteness and geographical constraints,  \n \nExpressing concern that the share of global merchandise exports of landlocked \ndeveloping countries remains marginal, at only 1.1 per cent of the total global share \nin 2022,  \n \nNoting that trade costs are estimated to be 30 per cent higher for landlocked than \nfor coastal developing countries, owing in part to the barriers and burdens of trading \nacross a greater multitude of borders, \n \n1. \nDecides to proclaim 6 August as the International Day of Awareness of the \nSpecial Development Needs and Challenges of Landlocked Developing Countries, to \nbe observed annually beginning in 2025 during the Third United Nations Conference \non Landlocked Developing Countries, to be held in Awaza, Turkmenistan, from 5 to \n8 August 2025; \n \n2. \nInvites all Member States and observers of the United Nations, \norganizations of the United Nations system and other international and regional \norganizations to observe and collaborate on the commemoration of the International \nDay, jointly with other competent organizations and relevant stakeholders, civil \nsociety, non\u2011governmental organizations and multilateral development banks, as well \nas with the private sector, local authorities and Indigenous Peoples, as appropriate, \nincluding through activities aimed at raising awareness of the importance of \naddressing the special development needs and challenges of landlocked developing \ncountries;  \n \n3. \nInvites the Office of the High Representative for the Least Developed \nCountries, Landlocked Developing Countries and Small Island Developing States to \nfacilitate the observance of the International Day, mindful of the provisions contained \nin the annex to Economic and Social Council resolution 1980/67;  \n \n4. \nStresses that the cost of all activities that may arise from the \nimplementation of the present resolution should be met from voluntary contributions;  \n \n5. \nRequests the Secretary-General to bring the present resolution to the \nattention of all Member States, the organizations of the United Nations system and \ncivil society organizations for appropriate observance. \n \n86th plenary meeting \n25 July 2025 \n \n_______________ \n \n3 Resolution 79/233, annex; see also resolution 79/279. \n",
  "paragraphs": {
    "1": "Decides to proclaim 6 August as the International Day of Awareness of the Special Development Needs and Challenges of Landlocked Developing Countries, to be observed annually beginning in 2025 during the Third United Nations Conference on Landlocked Developing Countries, to be held in Awaza, Turkmenistan, from 5 to 8 August 2025;",
    "2": "Invites all Member States and observers of the United Nations, organizations of the United Nations system and other international and regional organizations to observe and collaborate on the commemoration of the International Day, jointly with other competent organizations and relevant stakeholders, civil society, non\u2011governmental organizations and multilateral development banks, as well as with the private sector, local authorities and Indigenous Peoples, as appropriate, including through activities aimed at raising awareness of the importance of addressing the special development needs and challenges of landlocked developing countries;",
    "3": "Invites the Office of the High Representative for the Least Developed Countries, Landlocked Developing Countries and Small Island Developing States to facilitate the observance of the International Day, mindful of the provisions contained in the annex to Economic and Social Council resolution 1980/67;",
    "4": "Stresses that the cost of all activities that may arise from the implementation of the present resolution should be met from voluntary contributions;",
    "5": "Requests the Secretary-General to bring the present resolution to the attention of all Member States, the organizations of the United Nations system and civil society organizations for appropriate observance."
  },
  "agenda_items": [
    "Item 13"
  ],
  "symbol_references": [
    "A/79/L.108"
  ]
}