{
  "symbol": "A/RES/75/135",
  "filename": "A_RES_75_135.pdf",
  "title": "75/135. Report of the International Law Commission on the work of its seventy-second session",
  "text": "United Nations \nA/RES/75/135\n \n \nGeneral Assembly \nDistr.: General \n22 December 2020 \n \n \n20-17197 (E)    291220 \n*2017197* \n \n \nSeventy-fifth session \nAgenda item 80 \nReport of the International Law Commission on the work \nof its seventy-second session  \n \n \n \n \n Resolution adopted by the General Assembly \non 15 December 2020 \n \n \n \n \n[on the report of the Sixth Committee (A/75/426, para. 7)] \n \n \n 75/135. Report of the International Law Commission on the work of its \nseventy-second session \n \n \n \nThe General Assembly, \n \nRecalling its decision 74/545 of 2 April 2020, in which it decided to postpone \nthe first part of the seventy-second session of the International Law Commission, and \nto extend by one week the second part of the session so that it would be held from \n29 June to 7 August 2020, \n \nRecalling also its decision 74/559 of 23 June 2020, in which it decided that the \nseventy-second session of the International Law Commission would be postponed to \na later date,  \n \nRecalling further its decision 74/566 of 12 August 2020, in which it decided that \nthe seventy-second session of the International Law Commission should be postponed \nand should be held at the United Nations Office at Geneva in 2021, and that the \nseventy-third session of the Commission should be held at the United Nations Office \nat Geneva in 2022, \n \nEmphasizing the importance of furthering the progressive development and \ncodification of international law as a means of implementing the purposes and \nprinciples set forth in the Charter of the United Nations and in the Declaration on \nPrinciples of International Law concerning Friendly Relations and Cooperation \namong States in accordance with the Charter of the United Nations, 1 \n \nRecognizing the desirability of referring legal and drafting questions to the Sixth \nCommittee, including topics that might be submitted to the International Law \nCommission for closer examination, and of enabling the Sixth Committee and the \n__________________ \n \n1  Resolution 2625 (XXV), annex. \n\nA/RES/75/135 \nReport of the International Law Commission \non the work of its seventy-second session\n \n20-17197\n2/7 \n \nCommission to enhance further their contribution to the progressive development and \ncodification of international law, \n \nRecalling the need to keep under review those topics of international law which, \ngiven their new or renewed interest for the international community, may be suitable for \nthe progressive development and codification of international law and therefore may be \nincluded in the future programme of work of the International Law Commission, \n \nRecalling also the role of Member States in submitting proposals for new topics \nfor the consideration of the International Law Commission, and noting in this regard \nthe recommendation of the Commission that such proposals be accompanied by a \nstatement of reasons, \n \nReaffirming the importance for the successful work of the International Law \nCommission of the information provided by Member States concerning their views \nand practice, \n \nRecognizing the importance of the work of the special rapporteurs of the \nInternational Law Commission, \n \nWelcoming the holding of the International Law Seminar, and noting with \nappreciation the voluntary contributions made to the United Nations trust fund for the \nInternational Law Seminar, \n \nAcknowledging the importance of facilitating the timely publication of the \nYearbook of the International Law Commission and of eliminating the backlog, \n \nStressing the usefulness of focusing and structuring the debate on the report of \nthe International Law Commission in the Sixth Committee in such a manner that \nconditions are provided for concentrated attention to each of the main topics dealt \nwith in the report and for discussions on specific topics, \n \nWishing to enhance further, in the context of the revitalization of the debate on \nthe report of the International Law Commission, the interaction between the Sixth \nCommittee as a body of governmental representatives and the Commission as a body \nof independent legal experts, with a view to improving the dialogue between the two \nbodies, \n \nWelcoming initiatives to hold interactive debates, panel discussions and question \ntime in the Sixth Committee, as envisaged in General Assembly resolution 58/316 of \n1 July 2004 on further measures for the revitalization of the work of the Assembly, \n \nNoting the oral reports at the informal briefing on 5 November 2020 by the \nChair-designate for the seventy-second session of the International Law Commission \nand by the Secretariat on the activities of the Commission, 2 \n \n1. \nAffirms its decisions 74/545, 74/559 and 74/566; \n \n2. \nTakes note once again of the report of the International Law Commission \non the work of its seventy-first session;3 \n \n3. \nReiterates its appreciation to the International Law Commission for the \nwork accomplished at its seventy-first session;4 \n \n4. \nRecommends that the International Law Commission continue its work on \nthe topics in its current programme of work, taking into account the comments and \nobservations of Governments, whether submitted in writing or expressed orally in \ndebates in the Sixth Committee; \n__________________ \n \n2  See A/C.6/75/SR.13. \n \n3  See Official Records of the General Assembly, Seventy-fourth Session, Supplement No. 10 (A/74/10). \n \n4  Ibid. \n\nReport of the International Law Commission \non the work of its seventy-second session \nA/RES/75/135\n \n3/7\n20-17197 \n \n \n5. \nDraws the attention of Governments to the importance for the \nInternational Law Commission of having their views, which remain welcome until \n31 December 2020, on the various aspects of the topics on the agenda of the \nCommission, in particular on all the specific issues identified in chapter III of its \nreport,5 regarding: \n \n(a) \nImmunity of State officials from foreign criminal jurisdiction; \n \n(b) \nSuccession of States in respect of State responsibility; \n \n(c) \nGeneral principles of law; \n \n(d) \nSea-level rise in relation to international law; \n \n6. \nAlso draws the attention of Governments to the importance for the \nInternational Law Commission of having their comments and observations on the draft \nconclusions on peremptory norms of general international law (jus cogens) and the draft \nprinciples on protection of the environment in relation to armed conflicts adopted on first \nreading by the Commission at its seventy-first session,6 and takes note of the extension \nof the deadline to 30 June 2021 for Governments, international organizations and others, \nas applicable, to submit comments and observations to the Secretary-General; \n \n7. \nTakes note of the decision of the International Law Commission to include \nthe topic \u201cSea-level rise in relation to international law\u201d in its programme of work, 7 \nand encourages the Commission to continue the examination of the topics that are in \nits long-term programme of work;8 \n \n8. \nEncourages the International Law Commission to take particular account \nof the capacity and views of Member States, as well as of the workload of the \nCommission, when including topics in its current programme of work; \n \n9. \nTakes note of paragraphs 289 to 291 of the report of the International Law \nCommission9 and notes, in particular, the inclusion of the topics \u201cReparation to \nindividuals for gross violations of international human rights law and serious \nviolations of international humanitarian law\u201d and \u201cPrevention and repression of \npiracy and armed robbery at sea\u201d in the long-term programme of work of the \nCommission,10 and in this regard calls upon the Commission to take into consideration \nthe comments, concerns and observations expressed by Governments during the \ndebate in the Sixth Committee; \n \n10. Also takes note of paragraph 302 of the report of the International Law \nCommission,11 and requests the Secretary-General to continue his efforts to identify \nconcrete options for support for the work of special rapporteurs, additional to those \nprovided under General Assembly resolution 56/272 of 27 March 2002; \n__________________ \n \n5  Ibid. \n \n6  Ibid., paras. 56 and 70. \n \n7  Ibid., para. 285. \n \n8  The following topics are currently in the long-term programme of work of the International Law \nCommission: \u201cOwnership and protection of wrecks beyond the limits of national maritime \njurisdiction\u201d, \u201cJurisdictional immunity of international organizations\u201d, \u201cProtection of personal \ndata in transborder flow of information\u201d, \u201cExtraterritorial jurisdiction\u201d, \u201cThe fair and equitable \ntreatment standard in international investment law\u201d, \u201cSettlement of international disputes to \nwhich international organizations are parties\u201d, \u201cEvidence before international courts and \ntribunals\u201d, \u201cUniversal criminal jurisdiction\u201d, \u201cReparation to individuals for gross violations of \ninternational human rights law and serious violations of international humanitarian law\u201d and \n\u201cPrevention and repression of piracy and armed robbery at sea\u201d. \n \n9  Official Records of the General Assembly, Seventy-fourth Session, Supplement No. 10 (A/74/10). \n \n10  Ibid., para. 290. \n \n11  Official Records of the General Assembly, Seventy-fourth Session, Supplement No. 10 (A/74/10). \n\nA/RES/75/135 \nReport of the International Law Commission \non the work of its seventy-second session\n \n20-17197\n4/7 \n \n \n11. \nReiterates its appreciation of the efforts of the International Law \nCommission to improve its methods of work,12 and encourages the Commission to \ncontinue this practice; \n \n12. Invites the International Law Commission to continue to take measures to \nenhance its efficiency and productivity and to consider making proposals to Member \nStates to that end; \n \n13. Recalls the importance of an in-depth analysis of State practice and the \nconsideration of the diversity of legal systems of Member States to the work of the \nInternational Law Commission;  \n \n14. Takes note of paragraph 306 of the report of the International Law \nCommission,13 recalls the paramount importance of multilingualism as set forth in \nGeneral Assembly resolutions 69/324 of 11 September 2015 and 71/328 of \n11 September 2017 on multilingualism, underlines the importance of having the \ndocuments of the Commission published in due time in the six official languages of \nthe United Nations while ensuring their accuracy in all official languages, and to this \nend requests special rapporteurs to submit their reports within the time limits specified \nby the Secretariat, and the Secretariat to give due consideration to the quality of the \ntranslation of the documents of the Commission in the six official languages; \n \n15. Encourages the International Law Commission to continue to take cost-\nsaving measures at its future sessions, without prejudice to the efficiency and \neffectiveness of its work; \n \n16. Recalls that the seat of the International Law Commission is at the United \nNations Office at Geneva; \n \n17. Takes note of the letter dated 10 September 2020 from the Chair of the \nInternational Law Commission at its seventy-first session and the Chair-designate for \nthe seventy-second session of the Commission, and decides that the next session of \nthe Commission shall be held at the United Nations Office at Geneva from 26 April \nto 4 June and from 5 July to 6 August 2021; \n \n18. Stresses the desirability of further enhancing the dialogue between the \nInternational Law Commission, in particular the special rapporteurs, and the Sixth \nCommittee, and in this context encourages, inter alia, the continued practice of \ninformal consultations in the form of discussions between the members of the Sixth \nCommittee and the members of the Commission throughout the year; \n \n19. Encourages delegations, during the debate on the report of the \nInternational Law Commission, to continue to adhere as far as possible to the \nstructured work programme agreed to by the Sixth Committee and to consider \npresenting concise and focused statements; \n \n20. Encourages Member States to consider being represented at the level of \nlegal adviser during the first week in which the report of the International Law \nCommission is discussed in the Sixth Committee (International Law Week) to enable \nhigh-level discussions on issues of international law; \n \n21. Underlines in this regard the necessity to allow sufficient time for the \nconsideration of the report of the International Law Commission in the Sixth \nCommittee; \n \n22. Requests the International Law Commission to continue to pay special \nattention to indicating in its annual report, for each topic, any specific issues on which \n__________________ \n \n12  Ibid., Sixty-sixth Session, Supplement No. 10 (A/66/10), paras. 370\u2013388. \n \n13  Ibid., Seventy-fourth Session, Supplement No. 10 (A/74/10). \n\nReport of the International Law Commission \non the work of its seventy-second session \nA/RES/75/135\n \n5/7\n20-17197 \n \nexpressions of views by Governments, either in the Sixth Committee or in written \nform, would be of particular interest in providing effective guidance for the \nCommission in its further work; \n \n23. Takes note of paragraphs 314 to 319 of the report of the International Law \nCommission14 with regard to cooperation and interaction with other bodies, and \nencourages the Commission to continue the implementation of articles 16 (e), 25 and \n26 of its statute in order to further strengthen cooperation between the Commission \nand other bodies concerned with international law, having in mind the usefulness of \nsuch cooperation; \n \n24. Notes that consulting with national organizations and individual experts \nconcerned with international law may assist Governments in considering whether to \nmake comments and observations on drafts submitted by the International Law \nCommission and in formulating their comments and observations; \n \n25. Reaffirms its previous decisions concerning the indispensable role of the \nCodification Division of the Office of Legal Affairs of the Secretariat in providing \nassistance to the International Law Commission, including in the preparation of \nmemorandums and studies on topics on the agenda of the Commission; \n \n26. Also reaffirms its previous decisions concerning the documentation and \nsummary records of the International Law Commission;15 \n \n27. Stresses the need to expedite the preparation of the summary records of \nthe International Law Commission, and welcomes the continuation of the measures \ntaken to streamline the processing of summary records during the sixty-fifth session \nof the Commission,16 which have led to a more rational use of resources, and \nexpresses its satisfaction that the summary records of the Commission, constituting \ntravaux pr\u00e9paratoires in the progressive development and codification of \ninternational law, will not be subject to arbitrary length restrictions; \n \n28. Welcomes the institutionalization of the practice of the Secretariat to \ninclude on the website of the International Law Commission the provisional summary \nrecords in English and French relating to the work of the Commission; \n \n29. Also welcomes the efforts of the Secretariat in seeking to ensure the timely \nand efficient processing of the documents of the International Law Commission and \nthe institutionalization of the experimental measures taken during the sixty-eighth \nsession of the Commission to streamline the editing of those documents; \n \n30. Takes note of paragraph 303 of the report of the International Law \nCommission,17 and underlines the importance of the publications of the Codification \nDivision to the work of the Commission, welcomes in particular the issuance of the \nninth edition of The Work of the International Law Commission also in Chinese, \nFrench, Russian and Spanish, and reiterates its request that the Secretary-General \ncontinue to publish The Work of the International Law Commission in all six official \nlanguages at the beginning of each quinquennium, the Reports of International \nArbitral Awards in English or French and the Summaries of the Judgments, Advisory \nOpinions and Orders of the International Court of Justice in all six official languages \nevery five years; \n__________________ \n \n14  Ibid. \n \n15  See resolutions 32/151, para. 10, and 37/111, para. 5, and all subsequent resolutions on the \nannual reports of the International Law Commission to the General Assembly; see also Yearbook \nof the International Law Commission 1982, vol. II (Part Two), paras. 267\u2013269 and 271, as well \nas all subsequent annual reports of the International Law Commission. \n \n16  Official Records of the General Assembly, Sixty-eighth Session, Supplement No. 10 (A/68/10), \npara. 183. \n \n17  Ibid., Seventy-fourth Session, Supplement No. 10 (A/74/10). \n\nA/RES/75/135 \nReport of the International Law Commission \non the work of its seventy-second session\n \n20-17197\n6/7 \n \n \n31. Also takes note of paragraph 308 of the report of the International Law \nCommission,18 stresses the unique value of the Yearbook of the International Law \nCommission, and requests the Secretary-General to ensure its timely publication in \nall official languages;  \n \n32. Expresses its appreciation to Governments that have made voluntary \ncontributions to the trust fund on the backlog relating to the Yearbook of the \nInternational Law Commission, and encourages further contributions to the trust fund; \n \n33. Takes note of paragraph 309 of the report of the International Law \nCommission,19 expresses its satisfaction with the remarkable progress achieved in the \npast few years in reducing the backlog of the Yearbook of the International Law \nCommission in all six languages, welcomes the efforts made by the Division of \nConference Management of the United Nations Office at Geneva, especially its \nEditing Section, in effectively implementing relevant resolutions of the General \nAssembly calling for the reduction of the backlog, encourages that Division to \nprovide continuous necessary support to the Editing Section in advancing the \nYearbook of the International Law Commission, and requests that updates on progress \nmade in this respect be provided to the Commission on a regular basis; \n \n34. Welcomes the continuous efforts of the Codification Division to maintain \nand improve the website relating to the work of the International Law Commission; \n \n35. Expresses the hope that the International Law Seminar will continue to be \nheld in connection with the sessions of the International Law Commission and that \nan increasing number of participants representing the principal legal systems of the \nworld, including in particular those from developing countries, will be given the \nopportunity to attend the Seminar, as well as delegates to the Sixth Committee, and \nappeals to States to continue to make urgently needed voluntary contributions to the \nUnited Nations trust fund for the International Law Seminar; \n \n36. Requests the Secretary-General to provide the International Law Seminar \nwith adequate services, including interpretation, as required, and encourages him to \ncontinue to consider ways to improve the structure and content of the Seminar; \n \n37. Underlines the importance of the records and topical summary of the \ndebate in the Sixth Committee for the deliberations of the International Law \nCommission, and in this regard requests the Secretary-General to forward to the \nCommission, for its attention, the records of the debate on the report of the \nCommission, together with such written statements as delegations may circulate in \nconjunction with their oral statements, and to prepare and distribute a topical \nsummary of the debate, following established practice; \n \n38. Requests the Secretariat to circulate to States, as soon as possible after the \nconclusion of the session of the International Law Commission, chapter II of its report \ncontaining a summary of the work of that session, chapter III containing the specific \nissues on which the views of Governments would be of particular interest to the \nCommission and the draft articles adopted on either first or second reading by the \nCommission; \n \n39. Also requests the Secretariat to make the complete report of the \nInternational Law Commission available as soon as possible after the conclusion of \nthe session of the Commission for the consideration of Member States with due \nanticipation and no later than the prescribed time limit for reports in the General \nAssembly; \n__________________ \n \n18  Ibid. \n \n19  Ibid. \n\nReport of the International Law Commission \non the work of its seventy-second session \nA/RES/75/135\n \n7/7\n20-17197 \n \n \n40. Encourages the International Law Commission to continue to consider \nways in which specific issues on which the views of Governments would be of \nparticular interest to the Commission could be framed so as to help Governments to \nhave a better appreciation of the issues on which responses are required; \n \n41. Recommends that the debate on the report of the International Law \nCommission at the seventy-sixth session of the General Assembly commence on \n25 October 2021. \n \n45th plenary meeting \n15 December 2020 \n \n \n",
  "paragraphs": {
    "1": "Affirms its decisions 74/545, 74/559 and 74/566;",
    "2": "Takes note once again of the report of the International Law Commission on the work of its seventy-first session;3",
    "3": "Reiterates its appreciation to the International Law Commission for the work accomplished at its seventy-first session;4",
    "4": "Recommends that the International Law Commission continue its work on the topics in its current programme of work, taking into account the comments and observations of Governments, whether submitted in writing or expressed orally in debates in the Sixth Committee;",
    "5": "Draws the attention of Governments to the importance for the International Law Commission of having their views, which remain welcome until 31 December 2020, on the various aspects of the topics on the agenda of the Commission, in particular on all the specific issues identified in chapter III of its report,5 regarding: (a) Immunity of State officials from foreign criminal jurisdiction; (b) Succession of States in respect of State responsibility; (c) General principles of law; (d) Sea-level rise in relation to international law;",
    "6": "Also draws the attention of Governments to the importance for the International Law Commission of having their comments and observations on the draft conclusions on peremptory norms of general international law (jus cogens) and the draft principles on protection of the environment in relation to armed conflicts adopted on first reading by the Commission at its seventy-first session,6 and takes note of the extension of the deadline to 30 June 2021 for Governments, international organizations and others, as applicable, to submit comments and observations to the Secretary-General;",
    "7": "Takes note of the decision of the International Law Commission to include the topic \u201cSea-level rise in relation to international law\u201d in its programme of work, 7 and encourages the Commission to continue the examination of the topics that are in its long-term programme of work;8",
    "8": "Encourages the International Law Commission to take particular account of the capacity and views of Member States, as well as of the workload of the Commission, when including topics in its current programme of work;",
    "9": "Takes note of paragraphs 289 to 291 of the report of the International Law Commission9 and notes, in particular, the inclusion of the topics \u201cReparation to individuals for gross violations of international human rights law and serious violations of international humanitarian law\u201d and \u201cPrevention and repression of piracy and armed robbery at sea\u201d in the long-term programme of work of the Commission,10 and in this regard calls upon the Commission to take into consideration the comments, concerns and observations expressed by Governments during the debate in the Sixth Committee;",
    "10": "Also takes note of paragraph 302 of the report of the International Law Commission,11 and requests the Secretary-General to continue his efforts to identify concrete options for support for the work of special rapporteurs, additional to those provided under General Assembly resolution 56/272 of 27 March 2002;",
    "11": "Reiterates its appreciation of the efforts of the International Law Commission to improve its methods of work,12 and encourages the Commission to continue this practice;",
    "12": "Invites the International Law Commission to continue to take measures to enhance its efficiency and productivity and to consider making proposals to Member States to that end;",
    "13": "Recalls the importance of an in-depth analysis of State practice and the consideration of the diversity of legal systems of Member States to the work of the International Law Commission;",
    "14": "Takes note of paragraph 306 of the report of the International Law Commission,13 recalls the paramount importance of multilingualism as set forth in General Assembly resolutions 69/324 of 11 September 2015 and 71/328 of 11 September 2017 on multilingualism, underlines the importance of having the documents of the Commission published in due time in the six official languages of the United Nations while ensuring their accuracy in all official languages, and to this end requests special rapporteurs to submit their reports within the time limits specified by the Secretariat, and the Secretariat to give due consideration to the quality of the translation of the documents of the Commission in the six official languages;",
    "15": "Encourages the International Law Commission to continue to take cost- saving measures at its future sessions, without prejudice to the efficiency and effectiveness of its work;",
    "16": "Recalls that the seat of the International Law Commission is at the United Nations Office at Geneva;",
    "17": "Takes note of the letter dated 10 September 2020 from the Chair of the International Law Commission at its seventy-first session and the Chair-designate for the seventy-second session of the Commission, and decides that the next session of the Commission shall be held at the United Nations Office at Geneva from 26 April to 4 June and from 5 July to 6 August 2021;",
    "18": "Stresses the desirability of further enhancing the dialogue between the International Law Commission, in particular the special rapporteurs, and the Sixth Committee, and in this context encourages, inter alia, the continued practice of informal consultations in the form of discussions between the members of the Sixth Committee and the members of the Commission throughout the year;",
    "19": "Encourages delegations, during the debate on the report of the International Law Commission, to continue to adhere as far as possible to the structured work programme agreed to by the Sixth Committee and to consider presenting concise and focused statements;",
    "20": "Encourages Member States to consider being represented at the level of legal adviser during the first week in which the report of the International Law Commission is discussed in the Sixth Committee (International Law Week) to enable high-level discussions on issues of international law;",
    "21": "Underlines in this regard the necessity to allow sufficient time for the consideration of the report of the International Law Commission in the Sixth Committee;",
    "22": "Requests the International Law Commission to continue to pay special attention to indicating in its annual report, for each topic, any specific issues on which expressions of views by Governments, either in the Sixth Committee or in written form, would be of particular interest in providing effective guidance for the Commission in its further work;",
    "23": "Takes note of paragraphs 314 to 319 of the report of the International Law Commission14 with regard to cooperation and interaction with other bodies, and encourages the Commission to continue the implementation of articles 16 (e), 25 and 26 of its statute in order to further strengthen cooperation between the Commission and other bodies concerned with international law, having in mind the usefulness of such cooperation;",
    "24": "Notes that consulting with national organizations and individual experts concerned with international law may assist Governments in considering whether to make comments and observations on drafts submitted by the International Law Commission and in formulating their comments and observations;",
    "25": "Reaffirms its previous decisions concerning the indispensable role of the Codification Division of the Office of Legal Affairs of the Secretariat in providing assistance to the International Law Commission, including in the preparation of memorandums and studies on topics on the agenda of the Commission;",
    "26": "Also reaffirms its previous decisions concerning the documentation and summary records of the International Law Commission;15",
    "27": "Stresses the need to expedite the preparation of the summary records of the International Law Commission, and welcomes the continuation of the measures taken to streamline the processing of summary records during the sixty-fifth session of the Commission,16 which have led to a more rational use of resources, and expresses its satisfaction that the summary records of the Commission, constituting travaux pr\u00e9paratoires in the progressive development and codification of international law, will not be subject to arbitrary length restrictions;",
    "28": "Welcomes the institutionalization of the practice of the Secretariat to include on the website of the International Law Commission the provisional summary records in English and French relating to the work of the Commission;",
    "29": "Also welcomes the efforts of the Secretariat in seeking to ensure the timely and efficient processing of the documents of the International Law Commission and the institutionalization of the experimental measures taken during the sixty-eighth session of the Commission to streamline the editing of those documents;",
    "30": "Takes note of paragraph 303 of the report of the International Law Commission,17 and underlines the importance of the publications of the Codification Division to the work of the Commission, welcomes in particular the issuance of the ninth edition of The Work of the International Law Commission also in Chinese, French, Russian and Spanish, and reiterates its request that the Secretary-General continue to publish The Work of the International Law Commission in all six official languages at the beginning of each quinquennium, the Reports of International Arbitral Awards in English or French and the Summaries of the Judgments, Advisory Opinions and Orders of the International Court of Justice in all six official languages every five years;",
    "31": "Also takes note of paragraph 308 of the report of the International Law Commission,18 stresses the unique value of the Yearbook of the International Law Commission, and requests the Secretary-General to ensure its timely publication in all official languages;",
    "32": "Expresses its appreciation to Governments that have made voluntary contributions to the trust fund on the backlog relating to the Yearbook of the International Law Commission, and encourages further contributions to the trust fund;",
    "33": "Takes note of paragraph 309 of the report of the International Law Commission,19 expresses its satisfaction with the remarkable progress achieved in the past few years in reducing the backlog of the Yearbook of the International Law Commission in all six languages, welcomes the efforts made by the Division of Conference Management of the United Nations Office at Geneva, especially its Editing Section, in effectively implementing relevant resolutions of the General Assembly calling for the reduction of the backlog, encourages that Division to provide continuous necessary support to the Editing Section in advancing the Yearbook of the International Law Commission, and requests that updates on progress made in this respect be provided to the Commission on a regular basis;",
    "34": "Welcomes the continuous efforts of the Codification Division to maintain and improve the website relating to the work of the International Law Commission;",
    "35": "Expresses the hope that the International Law Seminar will continue to be held in connection with the sessions of the International Law Commission and that an increasing number of participants representing the principal legal systems of the world, including in particular those from developing countries, will be given the opportunity to attend the Seminar, as well as delegates to the Sixth Committee, and appeals to States to continue to make urgently needed voluntary contributions to the United Nations trust fund for the International Law Seminar;",
    "36": "Requests the Secretary-General to provide the International Law Seminar with adequate services, including interpretation, as required, and encourages him to continue to consider ways to improve the structure and content of the Seminar;",
    "37": "Underlines the importance of the records and topical summary of the debate in the Sixth Committee for the deliberations of the International Law Commission, and in this regard requests the Secretary-General to forward to the Commission, for its attention, the records of the debate on the report of the Commission, together with such written statements as delegations may circulate in conjunction with their oral statements, and to prepare and distribute a topical summary of the debate, following established practice;",
    "38": "Requests the Secretariat to circulate to States, as soon as possible after the conclusion of the session of the International Law Commission, chapter II of its report containing a summary of the work of that session, chapter III containing the specific issues on which the views of Governments would be of particular interest to the Commission and the draft articles adopted on either first or second reading by the Commission;",
    "39": "Also requests the Secretariat to make the complete report of the International Law Commission available as soon as possible after the conclusion of the session of the Commission for the consideration of Member States with due anticipation and no later than the prescribed time limit for reports in the General Assembly;",
    "40": "Encourages the International Law Commission to continue to consider ways in which specific issues on which the views of Governments would be of particular interest to the Commission could be framed so as to help Governments to have a better appreciation of the issues on which responses are required;",
    "41": "Recommends that the debate on the report of the International Law Commission at the seventy-sixth session of the General Assembly commence on 25 October 2021."
  },
  "agenda_items": [
    "Item 80"
  ],
  "symbol_references": []
}