{
  "symbol": "A/RES/72/291",
  "filename": "A_RES_72_291.pdf",
  "title": "72/291. Financing of the United Nations Operation in C\u00f4te d\u2019Ivoire",
  "text": "United Nations \nA/RES/72/291\n \n \nGeneral Assembly \nDistr.: General \n18 July 2018 \n \n18-11307 (E)    200718  \n*1811307* \n \n \nSeventy-second session \nAgenda item 152 \n \n \n \n \n Resolution adopted by the General Assembly on 5 July 2018 \n \n \n \n \n[on the report of the Fifth Committee (A/72/915)] \n \n \n 72/291. Financing of the United Nations Operation in C\u00f4te d\u2019Ivoire \n \n \n \nThe General Assembly, \n \nHaving considered the report of the Secretary-General on the financing of the \nUnited Nations Operation in C\u00f4te d\u2019Ivoire1 and the related report of the Advisory \nCommittee on Administrative and Budgetary Questions,2  \n \nRecalling Security Council resolution 1528 (2004) of 27 February 2004, by \nwhich the Council decided to establish the United Nations Operation in C\u00f4te d\u2019Ivoire \nfor an initial period of 12 months as from 4 April 2004, and the subsequent resolutions \nby which the Council extended the mandate of the Operation, the latest of which was \nresolution 2284 (2016) of 28 April 2016, by which the Council extended the mandate \nof the Operation for a final period until 30 June 2017,  \n \nRecalling also its resolution 58/310 of 18 June 2004 on the financing of the \nOperation and its subsequent resolutions thereon, the latest of which was resolution \n71/271 B of 30 June 2017,  \n \nReaffirming the general principles underlying the financing of United Nations \npeacekeeping operations, as stated in its resolutions 1874 (S-IV) of 27 June 1963, \n3101 (XXVIII) of 11 December 1973 and 55/235 of 23 December 2000,  \n \n1. \nTakes note of the status of contributions to the United Nations Operation \nin C\u00f4te d\u2019Ivoire as at 30 April 2018, including the contributions outstanding in the \namount of 15.7 million United States dollars, representing some 0.3 per cent of the \ntotal assessed contributions, notes with concern that only 151 Member States have \npaid their assessed contributions in full, and urges all other Member States, in \nparticular those in arrears, to ensure payment of their outstanding assessed \ncontributions;  \n__________________ \n \n1  A/72/655. \n \n2  A/72/852. \n\nA/RES/72/291 \nFinancing of the United Nations Operation in C\u00f4te d\u2019Ivoire\n \n18-11307\n2/2 \n \n \n2. \nExpresses its appreciation to those Member States that have paid their \nassessed contributions in full, and urges all other Member States to make every \npossible effort to ensure payment of their assessed contributions to the Operation \nin full;  \n \n3.  \nEndorses the conclusions and recommendations contained in the report of \nthe Advisory Committee on Administrative and Budgetary Questions, 2 and requests \nthe Secretary-General to ensure their full implementation;  \n \n4. \nRecalls paragraph 10 of the report of the Advisory Committee, and in this \nregard requests the Secretary-General to closely analyse the level of personnel \nrequired to successfully drawdown and liquidate a closing mission, drawing on \nlessons learned during the liquidation of the Operation, and identify human resources \nstrategies that facilitate the retention of expertise from already onboarded staff, \nincluding national staff, until the end of the liquidation period; \n \n5. \nRequests the Secretary-General, in the context of the final performance \nreport, to provide information on the lessons learned from the deployment of the \nOperation, including the liquidation period; \n \n6. \nAlso requests the Secretary-General to identify and address all residual \nactivities, and stresses the importance of awareness-raising of contractors relating to \nthe settlement of any residual claims;  \n \n \n \nBudget performance report for the period from 1 July 2016 to 30 June 2017 \n \n \n7.  \nTakes note of the report of the Secretary-General on the budget \nperformance of the Operation for the period from 1 July 2016 to 30 June 2017;1  \n \n8.  \nDecides that Member States that have fulfilled their financial obligations \nto the Operation shall be credited with their respective share of the unencumbered \nbalance and other revenue in the amount of 21,920,000 dollars in respect of the \nfinancial period ended 30 June 2017, in accordance with the levels updated in its \nresolution 70/246 of 23 December 2015, taking into account the scale of assessments \nfor 2017, as set out in its resolution 70/245 of 23 December 2015;  \n \n9. \nAlso decides that, for Member States that have not fulfilled their financial \nobligations to the Operation, there shall be set off against their outstanding \nobligations their respective share of the unencumbered balance and other revenue in \nthe amount of 21,920,000 dollars in respect of the financial period ended 30 June \n2017, in accordance with the scheme set out in paragraph 8 above;  \n \n10. Further decides that the increase of 1,147,600 dollars in the estimated staff \nassessment income in respect of the financial period ended 30 June 2017 shall be \nadded to the credits in the amount of 21,920,000 dollars referred to in paragraphs 8 \nand 9 above;  \n \n11. \nDecides to include in the provisional agenda of its seventy-third session \nthe item entitled \u201cFinancing of the United Nations Operation in C\u00f4te d\u2019Ivoire\u201d. \n \n104th plenary meeting  \n5 July 2018 \n \n",
  "paragraphs": {
    "1": "Takes note of the status of contributions to the United Nations Operation in C\u00f4te d\u2019Ivoire as at 30 April 2018, including the contributions outstanding in the amount of 15.7 million United States dollars, representing some 0.3 per cent of the total assessed contributions, notes with concern that only 151 Member States have paid their assessed contributions in full, and urges all other Member States, in particular those in arrears, to ensure payment of their outstanding assessed contributions;",
    "2": "Expresses its appreciation to those Member States that have paid their assessed contributions in full, and urges all other Member States to make every possible effort to ensure payment of their assessed contributions to the Operation in full;",
    "3": "Endorses the conclusions and recommendations contained in the report of the Advisory Committee on Administrative and Budgetary Questions, 2 and requests the Secretary-General to ensure their full implementation;",
    "4": "Recalls paragraph 10 of the report of the Advisory Committee, and in this regard requests the Secretary-General to closely analyse the level of personnel required to successfully drawdown and liquidate a closing mission, drawing on lessons learned during the liquidation of the Operation, and identify human resources strategies that facilitate the retention of expertise from already onboarded staff, including national staff, until the end of the liquidation period;",
    "5": "Requests the Secretary-General, in the context of the final performance report, to provide information on the lessons learned from the deployment of the Operation, including the liquidation period;",
    "6": "Also requests the Secretary-General to identify and address all residual activities, and stresses the importance of awareness-raising of contractors relating to the settlement of any residual claims; Budget performance report for the period from 1 July 2016 to 30 June 2017",
    "7": "Takes note of the report of the Secretary-General on the budget performance of the Operation for the period from 1 July 2016 to 30 June 2017;1",
    "8": "Decides that Member States that have fulfilled their financial obligations to the Operation shall be credited with their respective share of the unencumbered balance and other revenue in the amount of 21,920,000 dollars in respect of the financial period ended 30 June 2017, in accordance with the levels updated in its resolution 70/246 of 23 December 2015, taking into account the scale of assessments for 2017, as set out in its resolution 70/245 of 23 December 2015;",
    "9": "Also decides that, for Member States that have not fulfilled their financial obligations to the Operation, there shall be set off against their outstanding obligations their respective share of the unencumbered balance and other revenue in the amount of 21,920,000 dollars in respect of the financial period ended 30 June 2017, in accordance with the scheme set out in paragraph 8 above;",
    "10": "Further decides that the increase of 1,147,600 dollars in the estimated staff assessment income in respect of the financial period ended 30 June 2017 shall be added to the credits in the amount of 21,920,000 dollars referred to in paragraphs 8 and 9 above;",
    "11": "Decides to include in the provisional agenda of its seventy-third session the item entitled \u201cFinancing of the United Nations Operation in C\u00f4te d\u2019Ivoire\u201d."
  },
  "agenda_items": [
    "Item 152"
  ],
  "symbol_references": []
}