{
  "symbol": "A/RES/73/35",
  "filename": "A_RES_73_35.pdf",
  "title": "73/35.  Confidence-building measures in the regional and subregional context",
  "text": "United Nations \nA/RES/73/35\n \n \nGeneral Assembly \nDistr.: General \n11 December 2018 \n \n18-21230 (E)    131218     \n*1821230* \n \n \nSeventy-third session \nAgenda item 101 (x) \n \n \n \n \n Resolution adopted by the General Assembly \non 5 December 2018 \n \n \n \n \n[on the report of the First Committee (A/73/510 and A/73/510/Corr.1)] \n \n \n \n73/35.  Confidence-building measures in the regional \nand subregional context \n \n \n \nThe General Assembly, \n \nGuided by the purposes and principles enshrined in the Charter of the United \nNations, \n \nRecalling its resolutions 58/43 of 8 December 2003, 59/87 of 3 December 2004, \n60/64 of 8 December 2005, 61/81 of 6 December 2006, 62/45 of 5 December 2007, \n63/45 of 2 December 2008, 64/43 of 2 December 2009, 65/47 of 8 December 2010, \n66/38 of 2 December 2011, 67/61 of 3 December 2012, 68/55 of 5 December 2013, \n69/46 of 2 December 2014, 70/42 of 7 December 2015, 71/39 of 5 December 2016 \nand 72/33 of 4 December 2017 on confidence-building measures in the regional and \nsubregional context, \n \nRecalling also its resolution 57/337 of 3 July 2003 on the prevention of armed \nconflict, in which the General Assembly calls upon Member States to settle their \ndisputes by peaceful means, as set out in Chapter VI of the Charter, inter alia, by any \nprocedures adopted by the parties, \n \nRecalling further the resolutions and guidelines adopted by consensus by the \nGeneral Assembly and the Disarmament Commission relating to confidence-building \nmeasures and their implementation at the global, regional and subregional levels, \n \nConsidering the importance and effectiveness of confidence-building measures \ntaken at the initiative and with the agreement of all States concerned, and taking into \naccount the specific characteristics of each region, since such measures can contribute \nto regional stability, \n \nConvinced that resources released by disarmament, including regional \ndisarmament, can be devoted to economic and social development and to the \nprotection of the environment for the benefit of all peoples, in particular those of the \ndeveloping countries, \n\nA/RES/73/35 \nConfidence-building measures in the regional and subregional context\n \n18-21230\n2/2 \n \n \nRecognizing the need for meaningful dialogue among States concerned to avert \nconflict, \n \nWelcoming the peace processes already initiated by States concerned to resolve \ntheir disputes through peaceful means bilaterally or through mediation, inter alia, by \nthird parties, regional organizations or the United Nations, \n \nRecognizing that States in some regions have already taken steps towards \nconfidence-building measures at the bilateral, subregional and regional levels in the \npolitical and military fields, including arms control and disarmament, and noting that \nsuch confidence-building measures have improved peace and security in those regions \nand contributed to progress in the socioeconomic conditions of their people, \n \nConcerned that the continuation of disputes among States, particularly in the \nabsence of an effective mechanism to resolve them through peaceful means, may \ncontribute to the arms race and endanger the maintenance of international peace and \nsecurity and the efforts of the international community to promote arms control and \ndisarmament, \n \n1. \nCalls upon Member States to refrain from the use or threat of use of force \nin accordance with the purposes and principles of the Charter of the United Nations; \n \n2. \nReaffirms its commitment to the peaceful settlement of disputes under \nChapter VI of the Charter, in particular Article 33, which provides for a solution by \nnegotiation, enquiry, mediation, conciliation, arbitration, judicial settlement, resort to \nregional agencies or arrangements or other peaceful means chosen by the parties; \n \n3. \nReaffirms the ways and means regarding confidence- and security-building \nmeasures set out in the report of the Disarmament Commission on its 1993 session; 1  \n \n4. \nCalls upon Member States to pursue these ways and means through \nsustained consultations and dialogue, while at the same time avoiding actions that \nmay hinder or impair such a dialogue; \n \n5. \nUrges States to comply strictly with all bilateral, regional and international \nagreements, including arms control and disarmament agreements, to which they are \nparty; \n \n6. \nEmphasizes that the objective of confidence-building measures should be \nto help to strengthen international peace and security and to be consistent with the \nprinciple of undiminished security at the lowest level of armaments; \n \n7. \nEncourages the promotion of bilateral and regional confidence-building \nmeasures, with the consent and participation of the parties concerned, to avoid \nconflict and prevent the unintended and accidental outbreak of hostilities; \n \n8. \nRequests the Secretary-General to submit a report to the General Assembly \nat its seventy-fourth session containing the views of Member States on confidence-\nbuilding measures in the regional and subregional context; \n \n9. \nDecides to include in the provisional agenda of its seventy-fourth session, \nunder the item entitled \u201cGeneral and complete disarmament\u201d, the sub-item entitled \n\u201cConfidence-building measures in the regional and subregional context\u201d. \n \n45th plenary meeting  \n5 December 2018 \n \n__________________ \n \n1  Official Records of the General Assembly, Forty-eighth Session, Supplement No. 42 (A/48/42), \nannex II, sect. III.A. \n",
  "paragraphs": {
    "1": "Calls upon Member States to refrain from the use or threat of use of force in accordance with the purposes and principles of the Charter of the United Nations;",
    "2": "Reaffirms its commitment to the peaceful settlement of disputes under Chapter VI of the Charter, in particular Article 33, which provides for a solution by negotiation, enquiry, mediation, conciliation, arbitration, judicial settlement, resort to regional agencies or arrangements or other peaceful means chosen by the parties;",
    "3": "Reaffirms the ways and means regarding confidence- and security-building measures set out in the report of the Disarmament Commission on its 1993 session; 1",
    "4": "Calls upon Member States to pursue these ways and means through sustained consultations and dialogue, while at the same time avoiding actions that may hinder or impair such a dialogue;",
    "5": "Urges States to comply strictly with all bilateral, regional and international agreements, including arms control and disarmament agreements, to which they are party;",
    "6": "Emphasizes that the objective of confidence-building measures should be to help to strengthen international peace and security and to be consistent with the principle of undiminished security at the lowest level of armaments;",
    "7": "Encourages the promotion of bilateral and regional confidence-building measures, with the consent and participation of the parties concerned, to avoid conflict and prevent the unintended and accidental outbreak of hostilities;",
    "8": "Requests the Secretary-General to submit a report to the General Assembly at its seventy-fourth session containing the views of Member States on confidence- building measures in the regional and subregional context;",
    "9": "Decides to include in the provisional agenda of its seventy-fourth session, under the item entitled \u201cGeneral and complete disarmament\u201d, the sub-item entitled \u201cConfidence-building measures in the regional and subregional context\u201d."
  },
  "agenda_items": [
    "Item 101"
  ],
  "symbol_references": []
}