{
  "symbol": "A/RES/72/94",
  "filename": "A_RES_72_94.pdf",
  "title": "72/94. Offers by Member States of study and training facilities for inhabitants of Non-Self-Governing Territories",
  "text": "United Nations \nA/RES/72/94\n \n \nGeneral Assembly \nDistr.: General \n14 December 2017 \n \n17-22126 (E)    181217 \n*1722126* \n \n \nSeventy-second session \nAgenda item 61 \n \n \n \n \n Resolution adopted by the General Assembly \non 7 December 2017 \n \n \n \n \n[on the report of the Special Political and Decolonization Committee \n(Fourth Committee) (A/72/455)] \n \n \n \n72/94. Offers by Member States of study and training facilities \nfor inhabitants of Non-Self-Governing Territories \n \n \n \nThe General Assembly, \n \nRecalling its resolution 71/105 of 6 December 2016, \n \nHaving examined the report of the Secretary-General,1 prepared pursuant to its \nresolution 845 (IX) of 22 November 1954, \n \nConscious of the importance of promoting the educational advancement of the \ninhabitants of Non-Self-Governing Territories, \n \nStrongly convinced that the continuation and expansion of offers of \nscholarships is essential in order to meet the increasing need of students from \nNon-Self-Governing Territories for educational and training assistance, and \nconsidering that students in those Territories should be encouraged to avail \nthemselves of such offers, \n \n1. \nTakes note of the report of the Secretary-General;1 \n \n2. \nExpresses its appreciation to those Member States that have made \nscholarships available to the inhabitants of Non-Self-Governing Territories; \n \n3. \nInvites all States to make or continue to make generous offers of study \nand training facilities to the inhabitants of those Territories that have not yet \nattained self-government or independence and, wherever possible, to provide travel \nfunds to prospective students; \n \n4. \nUrges the administering Powers to take effective measures to ensure the \nwidespread and continuous dissemination in the Territories under their administration \n__________________ \n \n1 A/72/66/Rev.1 and A/72/66/Add.1. \n\nA/RES/72/94 \nOffers by Member States of study and training facilities\nfor inhabitants of Non-Self-Governing Territories\n \n17-22126 \n2/2 \n \nof information relating to offers of study and training facilities made by States and \nto provide all the facilities necessary to enable students to avail themselves of such \noffers; \n \n5. \nRequests the Secretary-General to report to the General Assembly at its \nseventy-third session on the implementation of the present resolution; \n \n6. \nDraws the attention of the Special Committee on the Situation with \nregard to the Implementation of the Declaration on the Granting of Independence to \nColonial Countries and Peoples to the present resolution. \n \n66th plenary meeting  \n7 December 2017 \n \n",
  "paragraphs": {
    "1": "Takes note of the report of the Secretary-General;1",
    "2": "Expresses its appreciation to those Member States that have made scholarships available to the inhabitants of Non-Self-Governing Territories;",
    "3": "Invites all States to make or continue to make generous offers of study and training facilities to the inhabitants of those Territories that have not yet attained self-government or independence and, wherever possible, to provide travel funds to prospective students;",
    "4": "Urges the administering Powers to take effective measures to ensure the widespread and continuous dissemination in the Territories under their administration of information relating to offers of study and training facilities made by States and to provide all the facilities necessary to enable students to avail themselves of such offers;",
    "5": "Requests the Secretary-General to report to the General Assembly at its seventy-third session on the implementation of the present resolution;",
    "6": "Draws the attention of the Special Committee on the Situation with regard to the Implementation of the Declaration on the Granting of Independence to Colonial Countries and Peoples to the present resolution."
  },
  "agenda_items": [
    "Item 61"
  ],
  "symbol_references": []
}