{
  "symbol": "A/RES/76/238",
  "filename": "A_RES_76_238.pdf",
  "title": "76/238. Scale of assessments for the apportionment of the expenses of the United Nations",
  "text": "United Nations \nA/RES/76/238\n \n \nGeneral Assembly \nDistr.: General \n4 January 2022 \n \n21-19693 (E)    070122     \n*2119693* \n \n \nSeventy-sixth session \nAgenda item 142 \nScale of assessments for the apportionment of the expenses \nof the United Nations \n \n \n \n \n Resolution adopted by the General Assembly \non 24 December 2021 \n \n \n \n \n[on the report of the Fifth Committee (A/76/383/Add.1, para. 6)] \n \n \n 76/238. Scale of assessments for the apportionment of the expenses of the \nUnited Nations \n \n \n \nThe General Assembly, \n \nRecalling its previous resolutions and decisions on the scale of assessments for \nthe apportionment of the expenses of the United Nations, including its resolutions \n55/5 B and C of 23 December 2000, 57/4 B of 20 December 2002, 58/1 B of \n23 December 2003, 61/237 of 22 December 2006, 64/248 of 24 December 2009, \n67/238 of 24 December 2012, 70/245 of 23 December 2015 and 73/271 of \n22 December 2018 and its decision 68/548 of 27 December 2013,  \n \nReaffirming Article 17 of the Charter of the United Nations and rule 160 of its \nrules of procedure,  \n \nRecalling paragraphs 5 and 6 of its resolution 58/1 B,  \n \nHaving considered the report of the Committee on Contributions on its \neighty-first session1 and the report of the Secretary-General on multi-year payment \nplans,2  \n \n1. \nTakes note of the report of the Committee on Contributions; \n \n2. \nAlso takes note of the report of the Secretary-General on multi-year \npayment plans; \n \n3. \nReaffirms that the determination of the scale of assessments for the \napportionment of the expenses of the United Nations shall remain the prerogative of \nthe General Assembly;  \n__________________ \n \n1  Official Records of the General Assembly, Seventy-sixth Session, Supplement No. 11 (A/76/11 and \nA/76/11/Add.1). \n \n2  A/76/70. \n\nA/RES/76/238 \nScale of assessments for the apportionment of the expenses of the \nUnited Nations\n \n21-19693\n2/8 \n \n \n4. \nAlso reaffirms the fundamental principle that the expenses of the \nOrganization shall be apportioned broadly according to capacity to pay;  \n \n5. \nFurther reaffirms the obligation of all Member States to bear the expenses \nof the United Nations, as apportioned by the General Assembly, in conformity with \nArticle 17, paragraph 2, of the Charter of the United Nations;  \n \n6. \nReaffirms that the Committee on Contributions as a technical body is \nrequired to prepare the scale of assessments strictly on the basis of reliable, verifiable \nand comparable data;  \n \n7. \nDecides that the scale of assessments for the period from 2022 to 2024 \nshall be based on the following elements and criteria:  \n \n(a) \nEstimates of gross national income;  \n \n(b) \nAverage statistical base periods of three and six years;  \n \n(c) \nConversion rates based on market exchange rates, except where that would \ncause excessive fluctuations and distortions in the income of some Member States, \nwhen price-adjusted rates of exchange or other appropriate conversion rates should \nbe employed, taking due account of its resolution 46/221 B of 20 December 1991;  \n \n(d) \nThe debt-burden approach employed in the scale of assessments for the \nperiod from 2019 to 2021;  \n \n(e) \nA low per capita income adjustment of 80 per cent, with a threshold per \ncapita income limit of the average per capita gross national income of all Member \nStates for the statistical base periods;  \n \n(f) \nA minimum assessment rate of 0.001 per cent;  \n \n(g) \nA maximum assessment rate for the least developed countries of 0.01 per cent; \n \n(h) \nA maximum assessment rate of 22 per cent;  \n \n8. \nRecognizes that the current methodology can be enhanced, bearing in mind \nthe principle of capacity to pay;  \n \n9. \nRequests the Committee on Contributions, in accordance with its mandate \nand the rules of procedure of the General Assembly, to review and make \nrecommendations on the elements of the methodology of the scale of assessments in \norder to reflect the capacity of Member States to pay, and to report thereon to the \nAssembly by the main part of its seventy-ninth session;  \n \n10. Encourages Member States to submit national accounts data under the \n2008 System of National Accounts on a timely basis;  \n \n11. \nSupports the efforts of the Statistics Division of the Department of \nEconomic and Social Affairs of the Secretariat in supporting statistics at the national \nlevel and in providing support to countries and regional organizations to enhance \ncoordination, advocacy and resources for the implementation of the 2008 System of \nNational Accounts;  \n\nScale of assessments for the apportionment of the expenses of the \nUnited Nations \nA/RES/76/238\n \n3/8\n21-19693 \n \n \n12. Resolves that the scale of assessments for the contributions of Member \nStates to the regular budget of the United Nations for 2022, 2023 and 2024 shall be \nas follows:  \n \n \nMember State \nPercentage \nAfghanistan \n 0.006 \nAlbania \n 0.008 \nAlgeria \n 0.109 \nAndorra \n 0.005 \nAngola \n 0.010 \nAntigua and Barbuda \n 0.002 \nArgentina \n 0.719 \nArmenia \n 0.007 \nAustralia \n 2.111 \nAustria \n 0.679 \nAzerbaijan \n 0.030 \nBahamas \n 0.019 \nBahrain \n 0.054 \nBangladesh \n 0.010 \nBarbados \n 0.008 \nBelarus \n 0.041 \nBelgium \n 0.828 \nBelize \n 0.001 \nBenin \n 0.005 \nBhutan \n 0.001 \nBolivia (Plurinational State of) \n 0.019 \nBosnia and Herzegovina \n 0.012 \nBotswana \n 0.015 \nBrazil \n 2.013 \nBrunei Darussalam \n 0.021 \nBulgaria \n 0.056 \nBurkina Faso \n 0.004 \nBurundi \n 0.001 \nCabo Verde \n 0.001 \nCambodia \n 0.007 \nCameroon \n 0.013 \nCanada \n 2.628 \nCentral African Republic \n 0.001 \nChad \n 0.003 \nChile \n 0.420 \nChina \n 15.254 \nColombia \n 0.246 \nComoros \n 0.001 \nCongo \n 0.005 \nCosta Rica \n 0.069 \n\nA/RES/76/238 \nScale of assessments for the apportionment of the expenses of the \nUnited Nations\n \n21-19693\n4/8 \n \nMember State \nPercentage \nC\u00f4te d\u2019Ivoire \n 0.022 \nCroatia \n 0.091 \nCuba \n 0.095 \nCyprus \n 0.036 \nCzechia \n 0.340 \nDemocratic People\u2019s Republic of Korea \n 0.005 \nDemocratic Republic of the Congo \n 0.010 \nDenmark \n 0.553 \nDjibouti \n 0.001 \nDominica \n 0.001 \nDominican Republic \n 0.067 \nEcuador \n 0.077 \nEgypt \n 0.139 \nEl Salvador \n 0.013 \nEquatorial Guinea \n 0.012 \nEritrea \n 0.001 \nEstonia \n 0.044 \nEswatini \n 0.002 \nEthiopia \n 0.010 \nFiji \n 0.004 \nFinland \n 0.417 \nFrance \n 4.318 \nGabon \n 0.013 \nGambia \n 0.001 \nGeorgia \n 0.008 \nGermany \n 6.111 \nGhana \n 0.024 \nGreece \n 0.325 \nGrenada \n 0.001 \nGuatemala \n 0.041 \nGuinea \n 0.003 \nGuinea-Bissau \n 0.001 \nGuyana \n 0.004 \nHaiti \n 0.006 \nHonduras \n 0.009 \nHungary \n 0.228 \nIceland \n 0.036 \nIndia \n 1.044 \nIndonesia \n 0.549 \nIran (Islamic Republic of) \n 0.371 \nIraq \n 0.128 \nIreland \n 0.439 \nIsrael \n 0.561 \n\nScale of assessments for the apportionment of the expenses of the \nUnited Nations \nA/RES/76/238\n \n5/8\n21-19693 \n \nMember State \nPercentage \nItaly \n 3.189 \nJamaica \n 0.008 \nJapan \n 8.033 \nJordan \n 0.022 \nKazakhstan \n 0.133 \nKenya \n 0.030 \nKiribati \n 0.001 \nKuwait \n 0.234 \nKyrgyzstan \n 0.002 \nLao People\u2019s Democratic Republic \n 0.007 \nLatvia \n 0.050 \nLebanon \n 0.036 \nLesotho \n 0.001 \nLiberia \n 0.001 \nLibya \n 0.018 \nLiechtenstein \n 0.010 \nLithuania \n 0.077 \nLuxembourg \n 0.068 \nMadagascar \n 0.004 \nMalawi \n 0.002 \nMalaysia \n 0.348 \nMaldives \n 0.004 \nMali \n 0.005 \nMalta \n 0.019 \nMarshall Islands \n 0.001 \nMauritania \n 0.002 \nMauritius \n 0.019 \nMexico \n 1.221 \nMicronesia (Federated States of) \n 0.001 \nMonaco \n 0.011 \nMongolia \n 0.004 \nMontenegro \n 0.004 \nMorocco \n 0.055 \nMozambique \n 0.004 \nMyanmar \n 0.010 \nNamibia \n 0.009 \nNauru \n 0.001 \nNepal \n 0.010 \nNetherlands \n 1.377 \nNew Zealand \n 0.309 \nNicaragua \n 0.005 \nNiger \n 0.003 \nNigeria \n 0.182 \n\nA/RES/76/238 \nScale of assessments for the apportionment of the expenses of the \nUnited Nations\n \n21-19693\n6/8 \n \nMember State \nPercentage \nNorth Macedonia \n 0.007 \nNorway \n 0.679 \nOman \n 0.111 \nPakistan \n 0.114 \nPalau \n 0.001 \nPanama \n 0.090 \nPapua New Guinea \n 0.010 \nParaguay \n 0.026 \nPeru \n 0.163 \nPhilippines \n 0.212 \nPoland \n 0.837 \nPortugal \n 0.353 \nQatar \n 0.269 \nRepublic of Korea \n 2.574 \nRepublic of Moldova \n 0.005 \nRomania \n 0.312 \nRussian Federation \n 1.866 \nRwanda \n 0.003 \nSaint Kitts and Nevis \n 0.002 \nSaint Lucia \n 0.002 \nSaint Vincent and the Grenadines \n 0.001 \nSamoa \n 0.001 \nSan Marino \n 0.002 \nSao Tome and Principe \n 0.001 \nSaudi Arabia \n 1.184 \nSenegal \n 0.007 \nSerbia \n 0.032 \nSeychelles \n 0.002 \nSierra Leone \n 0.001 \nSingapore \n 0.504 \nSlovakia \n 0.155 \nSlovenia \n 0.079 \nSolomon Islands \n 0.001 \nSomalia \n 0.001 \nSouth Africa \n 0.244 \nSouth Sudan \n 0.002 \nSpain \n 2.134 \nSri Lanka \n 0.045 \nSudan \n 0.010 \nSuriname \n 0.003 \nSweden \n 0.871 \nSwitzerland \n 1.134 \nSyrian Arab Republic \n 0.009 \n\nScale of assessments for the apportionment of the expenses of the \nUnited Nations \nA/RES/76/238\n \n7/8\n21-19693 \n \nMember State \nPercentage \nTajikistan \n 0.003 \nThailand \n 0.368 \nTimor-Leste \n 0.001 \nTogo \n 0.002 \nTonga \n 0.001 \nTrinidad and Tobago \n 0.037 \nTunisia \n 0.019 \nTurkey \n 0.845 \nTurkmenistan \n 0.034 \nTuvalu \n 0.001 \nUganda \n 0.010 \nUkraine \n 0.056 \nUnited Arab Emirates \n 0.635 \nUnited Kingdom of Great Britain and Northern Ireland \n 4.375 \nUnited Republic of Tanzania \n 0.010 \nUnited States of America \n 22.000 \nUruguay \n 0.092 \nUzbekistan \n 0.027 \nVanuatu \n 0.001 \nVenezuela (Bolivarian Republic of) \n 0.175 \nViet Nam \n 0.093 \nYemen \n 0.008 \nZambia \n 0.008 \nZimbabwe \n 0.007 \nTotal \n 100.000 \n \n \n \n13. Takes note of the report of the Secretary-General on multi-year payment \nplans and the related conclusions and recommendations of the Committee on \nContributions;  \n \n14. Reaffirms paragraph 1 of its resolution 57/4 B;  \n \n15. Urges all Member States to pay their assessed contributions in full, on time \nand without imposing conditions;  \n \n16. Urges all Member States currently in arrears to settle those arrears \npromptly and in full;  \n \n17. Encourages Member States in arrears with their assessed contributions to \nthe United Nations to consider submitting multi-year payment plans;  \n \n18. Resolves that:  \n \n(a) \nNotwithstanding the terms of financial regulation 3.10 of the Financial \nRegulations and Rules of the United Nations, 3  the Secretary-General shall be \nempowered to accept, at his discretion and after consultation with the Chair of the \n__________________ \n \n3  ST/SGB/2013/4 and ST/SGB/2013/4/Amend.1. \n\nA/RES/76/238 \nScale of assessments for the apportionment of the expenses of the \nUnited Nations\n \n21-19693\n8/8 \n \nCommittee on Contributions, a portion of the contributions of Member States for the \ncalendar years 2022, 2023 and 2024 in currencies other than the United States dollar;  \n \n(b) \nIn accordance with financial regulation 3.9, the Holy See, which is not a \nmember of the United Nations but which participates in certain of its activities, shall \nbe called upon to contribute towards the expenses of the Organization for 2022, 2023 \nand 2024 on the basis of a notional assessment rate of 0.001 per cent, which represents \nthe basis for the calculation of the flat annual fees to be charged to the Holy See in \naccordance with General Assembly resolution 44/197 B of 21 December 1989;  \n \n(c) \nIn accordance with financial regulation 3.9, the State of Palestine, which \nis not a member of the United Nations but which participates in certain of its \nactivities, shall be called upon to contribute towards the expenses of the Organization \nfor 2022, 2023 and 2024 on the basis of a notional assessment rate of 0.011 per cent, \nwhich represents the basis for the calculation of the flat annual fees to be charged to \nthe State of Palestine in accordance with its resolution 44/197 B.  \n \n54th (resumed) plenary meeting \n24 December 2021 \n \n \n",
  "paragraphs": {
    "1": "Takes note of the report of the Committee on Contributions;",
    "2": "Also takes note of the report of the Secretary-General on multi-year payment plans;",
    "3": "Reaffirms that the determination of the scale of assessments for the apportionment of the expenses of the United Nations shall remain the prerogative of the General Assembly; __________________ 1 Official Records of the General Assembly, Seventy-sixth Session, Supplement No. 11 (A/76/11 and A/76/11/Add.1). 2 A/76/70. A/RES/76/238 Scale of assessments for the apportionment of the expenses of the United Nations 21-19693 2/8",
    "4": "Also reaffirms the fundamental principle that the expenses of the Organization shall be apportioned broadly according to capacity to pay;",
    "5": "Further reaffirms the obligation of all Member States to bear the expenses of the United Nations, as apportioned by the General Assembly, in conformity with Article 17, paragraph 2, of the Charter of the United Nations;",
    "6": "Reaffirms that the Committee on Contributions as a technical body is required to prepare the scale of assessments strictly on the basis of reliable, verifiable and comparable data;",
    "7": "Decides that the scale of assessments for the period from 2022 to 2024 shall be based on the following elements and criteria: (a) Estimates of gross national income; (b) Average statistical base periods of three and six years; (c) Conversion rates based on market exchange rates, except where that would cause excessive fluctuations and distortions in the income of some Member States, when price-adjusted rates of exchange or other appropriate conversion rates should be employed, taking due account of its resolution 46/221 B of 20 December 1991; (d) The debt-burden approach employed in the scale of assessments for the period from 2019 to 2021; (e) A low per capita income adjustment of 80 per cent, with a threshold per capita income limit of the average per capita gross national income of all Member States for the statistical base periods; (f) A minimum assessment rate of 0.001 per cent; (g) A maximum assessment rate for the least developed countries of 0.01 per cent; (h) A maximum assessment rate of 22 per cent;",
    "8": "Recognizes that the current methodology can be enhanced, bearing in mind the principle of capacity to pay;",
    "9": "Requests the Committee on Contributions, in accordance with its mandate and the rules of procedure of the General Assembly, to review and make recommendations on the elements of the methodology of the scale of assessments in order to reflect the capacity of Member States to pay, and to report thereon to the Assembly by the main part of its seventy-ninth session;",
    "10": "Encourages Member States to submit national accounts data under the 2008 System of National Accounts on a timely basis;",
    "11": "Supports the efforts of the Statistics Division of the Department of Economic and Social Affairs of the Secretariat in supporting statistics at the national level and in providing support to countries and regional organizations to enhance coordination, advocacy and resources for the implementation of the 2008 System of National Accounts; Scale of assessments for the apportionment of the expenses of the United Nations A/RES/76/238 3/8 21-19693",
    "12": "Resolves that the scale of assessments for the contributions of Member States to the regular budget of the United Nations for 2022, 2023 and 2024 shall be as follows: Member State Percentage Afghanistan 0.006 Albania 0.008 Algeria 0.109 Andorra 0.005 Angola 0.010 Antigua and Barbuda 0.002 Argentina 0.719 Armenia 0.007 Australia 2.111 Austria 0.679 Azerbaijan 0.030 Bahamas 0.019 Bahrain 0.054 Bangladesh 0.010 Barbados 0.008 Belarus 0.041 Belgium 0.828 Belize 0.001 Benin 0.005 Bhutan 0.001 Bolivia (Plurinational State of) 0.019 Bosnia and Herzegovina 0.012 Botswana 0.015 Brazil 2.013 Brunei Darussalam 0.021 Bulgaria 0.056 Burkina Faso 0.004 Burundi 0.001 Cabo Verde 0.001 Cambodia 0.007 Cameroon 0.013 Canada 2.628 Central African Republic 0.001 Chad 0.003 Chile 0.420 China 15.254 Colombia 0.246 Comoros 0.001 Congo 0.005 Costa Rica 0.069 A/RES/76/238 Scale of assessments for the apportionment of the expenses of the United Nations 21-19693 4/8 Member State Percentage C\u00f4te d\u2019Ivoire 0.022 Croatia 0.091 Cuba 0.095 Cyprus 0.036 Czechia 0.340 Democratic People\u2019s Republic of Korea 0.005 Democratic Republic of the Congo 0.010 Denmark 0.553 Djibouti 0.001 Dominica 0.001 Dominican Republic 0.067 Ecuador 0.077 Egypt 0.139 El Salvador 0.013 Equatorial Guinea 0.012 Eritrea 0.001 Estonia 0.044 Eswatini 0.002 Ethiopia 0.010 Fiji 0.004 Finland 0.417 France 4.318 Gabon 0.013 Gambia 0.001 Georgia 0.008 Germany 6.111 Ghana 0.024 Greece 0.325 Grenada 0.001 Guatemala 0.041 Guinea 0.003 Guinea-Bissau 0.001 Guyana 0.004 Haiti 0.006 Honduras 0.009 Hungary 0.228 Iceland 0.036 India 1.044 Indonesia 0.549 Iran (Islamic Republic of) 0.371 Iraq 0.128 Ireland 0.439 Israel 0.561 Scale of assessments for the apportionment of the expenses of the United Nations A/RES/76/238 5/8 21-19693 Member State Percentage Italy 3.189 Jamaica 0.008 Japan 8.033 Jordan 0.022 Kazakhstan 0.133 Kenya 0.030 Kiribati 0.001 Kuwait 0.234 Kyrgyzstan 0.002 Lao People\u2019s Democratic Republic 0.007 Latvia 0.050 Lebanon 0.036 Lesotho 0.001 Liberia 0.001 Libya 0.018 Liechtenstein 0.010 Lithuania 0.077 Luxembourg 0.068 Madagascar 0.004 Malawi 0.002 Malaysia 0.348 Maldives 0.004 Mali 0.005 Malta 0.019 Marshall Islands 0.001 Mauritania 0.002 Mauritius 0.019 Mexico 1.221 Micronesia (Federated States of) 0.001 Monaco 0.011 Mongolia 0.004 Montenegro 0.004 Morocco 0.055 Mozambique 0.004 Myanmar 0.010 Namibia 0.009 Nauru 0.001 Nepal 0.010 Netherlands 1.377 New Zealand 0.309 Nicaragua 0.005 Niger 0.003 Nigeria 0.182 A/RES/76/238 Scale of assessments for the apportionment of the expenses of the United Nations 21-19693 6/8 Member State Percentage North Macedonia 0.007 Norway 0.679 Oman 0.111 Pakistan 0.114 Palau 0.001 Panama 0.090 Papua New Guinea 0.010 Paraguay 0.026 Peru 0.163 Philippines 0.212 Poland 0.837 Portugal 0.353 Qatar 0.269 Republic of Korea 2.574 Republic of Moldova 0.005 Romania 0.312 Russian Federation 1.866 Rwanda 0.003 Saint Kitts and Nevis 0.002 Saint Lucia 0.002 Saint Vincent and the Grenadines 0.001 Samoa 0.001 San Marino 0.002 Sao Tome and Principe 0.001 Saudi Arabia 1.184 Senegal 0.007 Serbia 0.032 Seychelles 0.002 Sierra Leone 0.001 Singapore 0.504 Slovakia 0.155 Slovenia 0.079 Solomon Islands 0.001 Somalia 0.001 South Africa 0.244 South Sudan 0.002 Spain 2.134 Sri Lanka 0.045 Sudan 0.010 Suriname 0.003 Sweden 0.871 Switzerland 1.134 Syrian Arab Republic 0.009 Scale of assessments for the apportionment of the expenses of the United Nations A/RES/76/238 7/8 21-19693 Member State Percentage Tajikistan 0.003 Thailand 0.368 Timor-Leste 0.001 Togo 0.002 Tonga 0.001 Trinidad and Tobago 0.037 Tunisia 0.019 Turkey 0.845 Turkmenistan 0.034 Tuvalu 0.001 Uganda 0.010 Ukraine 0.056 United Arab Emirates 0.635 United Kingdom of Great Britain and Northern Ireland 4.375 United Republic of Tanzania 0.010 United States of America 22.000 Uruguay 0.092 Uzbekistan 0.027 Vanuatu 0.001 Venezuela (Bolivarian Republic of) 0.175 Viet Nam 0.093 Yemen 0.008 Zambia 0.008 Zimbabwe 0.007 Total 100.000",
    "13": "Takes note of the report of the Secretary-General on multi-year payment plans and the related conclusions and recommendations of the Committee on Contributions;",
    "14": "Reaffirms paragraph 1 of its resolution 57/4 B;",
    "15": "Urges all Member States to pay their assessed contributions in full, on time and without imposing conditions;",
    "16": "Urges all Member States currently in arrears to settle those arrears promptly and in full;",
    "17": "Encourages Member States in arrears with their assessed contributions to the United Nations to consider submitting multi-year payment plans;",
    "18": "Resolves that: (a) Notwithstanding the terms of financial regulation 3.10 of the Financial Regulations and Rules of the United Nations, 3 the Secretary-General shall be empowered to accept, at his discretion and after consultation with the Chair of the __________________ 3 ST/SGB/2013/4 and ST/SGB/2013/4/Amend.1. A/RES/76/238 Scale of assessments for the apportionment of the expenses of the United Nations 21-19693 8/8 Committee on Contributions, a portion of the contributions of Member States for the calendar years 2022, 2023 and 2024 in currencies other than the United States dollar; (b) In accordance with financial regulation 3.9, the Holy See, which is not a member of the United Nations but which participates in certain of its activities, shall be called upon to contribute towards the expenses of the Organization for 2022, 2023 and 2024 on the basis of a notional assessment rate of 0.001 per cent, which represents the basis for the calculation of the flat annual fees to be charged to the Holy See in accordance with General Assembly resolution 44/197 B of 21 December 1989; (c) In accordance with financial regulation 3.9, the State of Palestine, which is not a member of the United Nations but which participates in certain of its activities, shall be called upon to contribute towards the expenses of the Organization for 2022, 2023 and 2024 on the basis of a notional assessment rate of 0.011 per cent, which represents the basis for the calculation of the flat annual fees to be charged to the State of Palestine in accordance with its resolution 44/197 B. 54th (resumed) plenary meeting 24 December 2021"
  },
  "agenda_items": [
    "Item 142"
  ],
  "symbol_references": []
}