{
  "symbol": "A/RES/78/260",
  "filename": "A_RES_78_260.pdf",
  "title": "78/260. International Year of Sustainable and Resilient Tourism, 2027",
  "text": "United Nations \nA/RES/78/260\n \n \nGeneral Assembly \nDistr.: General \n6 March 2024 \n \n24-04404 (E)    110324 \n*2404404* \n \n \nSeventy-eighth session \nAgenda item 18 \nSustainable development \n \n \n \n \n Resolution adopted by the General Assembly \non 26 February 2024 \n \n \n \n \n[without reference to a Main Committee (A/78/L.42)] \n \n \n 78/260. International Year of Sustainable and Resilient Tourism, 2027 \n \n \n \nThe General Assembly, \n \nGuided by the purposes and principles of the Charter of the United Nations,  \n \nReaffirming its resolutions 53/199 of 15 December 1998 and 61/185 of \n20 December 2006 on the proclamation of international years, and Economic and \nSocial Council resolution 1980/67 of 25 July 1980 on international years and \nanniversaries, in particular paragraphs 1 to 10 of the annex thereto on the agreed \ncriteria for the proclamation of international years, as well as paragraphs 13 and 14, \nin which it is stated that an international year should not be proclaimed before the \nbasic arrangements necessary for its organization and financing have been made,  \n \nRecalling its relevant resolutions, in particular resolutions 70/193 of \n22 December 2015 on the proclamation of 2017 as the International Year of \nSustainable Tourism for Development, 74/214 of 19 December 2019 on sustainable \ntourism and sustainable development in Central Asia, 75/223 of 21 December 2020 \non the Global Code of Ethics for Tourism, 77/178 of 14 December 2022 on the \npromotion of sustainable and resilient tourism, including ecotourism, for poverty \neradication and environmental protection, 78/145 of 19 December 2023 on \nsustainable and resilient tourism and sustainable development in Central America and \nthe Dominican Republic, and other related resolutions,  \n \nReaffirming its resolution 70/1 of 25 September 2015, entitled \u201cTransforming \nour world: the 2030 Agenda for Sustainable Development\u201d, in which it adopted a \ncomprehensive, far-reaching and people-centred set of universal and transformative \nSustainable Development Goals and targets, and its commitment to working tirelessly \nfor the full implementation of the Agenda by 2030,  \n \nRecognizing that sustainable tourism, including ecotourism, is a cross-cutting \nactivity that can contribute to the three dimensions of sustainable development and \nthe achievement of the Sustainable Development Goals, including by fostering \neconomic growth, alleviating poverty, creating full and productive employment and \n\nA/RES/78/260 \nInternational Year of Sustainable and Resilient Tourism, 2027\n \n24-04404\n2/2 \n \ndecent work for all, accelerating the change to more sustainable consumption and \nproduction patterns and promoting the sustainable use of oceans, seas and marine \nresources, promoting local culture, improving the quality of life and the economic \nempowerment of women and young people, Indigenous Peoples and local \ncommunities and promoting rural development and better living conditions for rural \npopulations, including smallholder and family farmers,  \n \nEmphasizing that sustainable and resilient tourism can contribute directly to the \nconservation of environmentally vulnerable natural areas and habitats through a \nvariety of activities and by raising awareness of the importance of biodiversity, and \nstressing the urgent need to address the unprecedented global decline in biodiversity, \n \nWelcoming the efforts of those United Nations system entities that promote \necotourism and sustainable tourism worldwide,  \n \nRecognizing the importance of international tourism, and particularly of the \ndesignation of an international year of sustainable and resilient tourism, in fostering \nbetter understanding among peoples everywhere, leading to a greater awareness of \nthe rich heritage of various civilizations and bringing about a better appreciation of \nthe inherent values of different cultures, thereby contributing to the strengthening of \npeace in the world,  \n \nRecognizing also that sustainable consumption and production in tourism is \naimed at increasing net welfare gains from economic activities by improving resource \nuse and reducing ecosystem degradation and pollution along the entire tourism value \nchain, and that a systemic approach and cooperation among actors operating along \nthe value chain, from tourism service providers, to adjacent communities, to tourists, \ncan ensure the sustainability of the sector,  \n \n1. \nDecides to proclaim 2027 the International Year of Sustainable and \nResilient Tourism;  \n \n2. \nInvites the World Tourism Organization, mindful of the provisions \ncontained in the annex to Economic and Social Council resolution 1980/67, to \nfacilitate the organization and implementation of the International Year, in \ncollaboration with Governments, relevant organizations of the United Nations system, \ninternational and regional organizations and other relevant stakeholders;  \n \n3. \nStresses that the costs of all activities that may arise from the \nimplementation of the present resolution should be met from voluntary contributions;  \n \n4. \nEncourages Member States, the United Nations system and all other actors \nto take effective measures, in the context of sustainable and resilient tourism, \nincluding ecotourism initiatives, to promote the equal participation of women and the \nbalanced participation of youth, older persons, persons with disabilities, Indigenous \nPeoples and local communities, at all levels and in decision-making processes in all \nareas, and to promote effective economic empowerment, mainly through decent job \nand income creation;  \n \n5. \nEncourages all States, the United Nations system and all other actors to \ntake advantage of the International Year to promote actions at all levels, including \nthrough international cooperation, and to support sustainable and resilient tourism as \na means of promoting and accelerating sustainable development;  \n \n6. \nInvites the World Tourism Organization, mindful of the provisions of \nparagraphs 23 to 27 of the annex to Economic and Social Council resolution 1980/67, \nto inform the General Assembly at its eighty-third session on the implementation of \nthe present resolution, elaborating on the evaluation of the International Year. \n \n57th plenary meeting \n26 February 2024 \n",
  "paragraphs": {
    "1": "Decides to proclaim 2027 the International Year of Sustainable and Resilient Tourism;",
    "2": "Invites the World Tourism Organization, mindful of the provisions contained in the annex to Economic and Social Council resolution 1980/67, to facilitate the organization and implementation of the International Year, in collaboration with Governments, relevant organizations of the United Nations system, international and regional organizations and other relevant stakeholders;",
    "3": "Stresses that the costs of all activities that may arise from the implementation of the present resolution should be met from voluntary contributions;",
    "4": "Encourages Member States, the United Nations system and all other actors to take effective measures, in the context of sustainable and resilient tourism, including ecotourism initiatives, to promote the equal participation of women and the balanced participation of youth, older persons, persons with disabilities, Indigenous Peoples and local communities, at all levels and in decision-making processes in all areas, and to promote effective economic empowerment, mainly through decent job and income creation;",
    "5": "Encourages all States, the United Nations system and all other actors to take advantage of the International Year to promote actions at all levels, including through international cooperation, and to support sustainable and resilient tourism as a means of promoting and accelerating sustainable development;",
    "6": "Invites the World Tourism Organization, mindful of the provisions of paragraphs 23 to 27 of the annex to Economic and Social Council resolution 1980/67, to inform the General Assembly at its eighty-third session on the implementation of the present resolution, elaborating on the evaluation of the International Year."
  },
  "agenda_items": [
    "Item 18"
  ],
  "symbol_references": [
    "A/78/L.42"
  ]
}