{
  "symbol": "A/RES/74/78",
  "filename": "A_RES_74_78.pdf",
  "title": "74/78. Comprehensive Nuclear-Test-Ban Treaty",
  "text": "United Nations \nA/RES/74/78\n \n \nGeneral Assembly \nDistr.: General \n23 December 2019 \n \n19-21885 (E)    060120 \n*1921885* \n \n \nSeventy-fourth session \nAgenda item 104 \nComprehensive Nuclear-Test-Ban Treaty \n \n \n \n \n Resolution adopted by the General Assembly \non 12 December 2019 \n \n \n \n \n[on the report of the First Committee (A/74/374)] \n \n \n \n74/78. Comprehensive Nuclear-Test-Ban Treaty \n \n \n \nThe General Assembly, \n \nReiterating that the cessation of nuclear-weapon test explosions or any other \nnuclear explosions constitutes an effective nuclear disarmament and non-proliferation \nmeasure, and convinced that this is a meaningful step in the realization of a systematic \nprocess for achieving nuclear disarmament,  \n \nRecalling that the Comprehensive Nuclear-Test-Ban Treaty, adopted by the \nGeneral Assembly by its resolution 50/245 of 10 September 1996, was opened for \nsignature on 24 September 1996,  \n \nStressing that a universal and effectively verifiable Treaty constitutes a \nfundamental instrument in the field of nuclear disarmament and non-proliferation and \nwill be a major contribution to international peace and security,  \n \nStressing also the vital importance and urgency of achieving the entry into force \nof the Treaty, as noted also in Security Council resolution 2310 (2016) of \n23 September 2016, and affirming its resolute determination, 23 years after the Treaty \nwas opened for signature, to achieve its entry into force,  \n \nEncouraged by the signing of the Treaty by 184 States, including 41 of the 44 \nwhose ratification is needed for its entry into force, and welcoming the ratification of \nthe Treaty by 168 States, including 36 of the 44 whose ratification is needed for its \nentry into force, among which there are 3 nuclear-weapon States,  \n \nRecalling its resolution 73/86 of 5 December 2018,  \n \nRecalling also the adoption by consensus of the conclusions and recommendations \nfor follow-on actions of the 2010 Review Conference of the Parties to the Treaty on \n\nA/RES/74/78 \nComprehensive Nuclear-Test-Ban Treaty \n \n19-21885\n2/3 \n \nthe Non-Proliferation of Nuclear Weapons, 1 in which the Conference, inter alia, \nreaffirmed the vital importance of the entry into force of the Comprehensive Nuclear-\nTest-Ban Treaty as a core element of the international nuclear disarmament and \nnon-proliferation regime and included specific actions to be taken in support of the \nentry into force of the Treaty,  \n \nWelcoming the Final Declaration adopted by the eleventh Conference on \nFacilitating the Entry into Force of the Comprehensive Nuclear-Test-Ban Treaty, held \nin New York on 25 September 2019, convened pursuant to article XIV of the Treaty, \nand recalling the Joint Ministerial Statement on the Comprehensive Nuclear-Test-Ban \nTreaty, adopted at the ministerial meeting held in New York on 27 September 2018, 2  \n \nNoting the contribution of diverse participation in building and sustaining \nmomentum for the universalization and entry into force of the Treaty, including \nthrough the Youth Group of the Preparatory Commission for the Comprehensive \nNuclear-Test-Ban Treaty Organization,  \n \nWelcoming continuing progress in the development of the Treaty\u2019s verification \nregime, which advances the Treaty\u2019s primary non-proliferation and disarmament \nobjective, and the establishment of 298 certified facilities of the International \nMonitoring System network,  \n \nRecognizing the civil and scientific benefits provided by the Treaty\u2019s global \nmonitoring system,  \n \n1. \nStresses the vital importance and urgency of signature and ratification, \nwithout delay and without conditions, in order to achieve the earliest entry into force \nof the Comprehensive Nuclear-Test-Ban Treaty;3  \n \n2. \nWelcomes the contributions by the signatory States to the work of the \nPreparatory Commission for the Comprehensive Nuclear-Test-Ban Treaty Organization, \nin particular its efforts to ensure that the verification regime of the Treaty will be \ncapable of meeting the verification requirements of the Treaty upon its entry into \nforce, in accordance with article IV of the Treaty, and encourages their continuation;  \n \n3. \nUnderlines the need to maintain momentum towards the completion of all \nelements of the verification regime;  \n \n4. \nUrges all States not to carry out nuclear-weapon test explosions or any \nother nuclear explosions, to maintain their moratoriums in this regard and to refrain \nfrom acts that would defeat the object and purpose of the Treaty, while stressing that \nthese measures do not have the same permanent and legally binding effect as the entry \ninto force of the Treaty;  \n \n5. \nReiterates its condemnation of the six nuclear tests conducted by the \nDemocratic People\u2019s Republic of Korea in violation of relevant Security Council \nresolutions, 4  urges full compliance with the obligations under those resolutions, \nincluding that the Democratic People\u2019s Republic of Korea abandon its nuclear \nweapons programme and not conduct any further nuclear tests, notes with \nencouragement the statement of the Democratic People\u2019s Republic of Korea \nconcerning a moratorium on nuclear tests and efforts towards the dismantlement of \nthe Punggye-ri nuclear test site, reaffirms its support for the complete, verifiable and \n__________________ \n \n1  2010 Review Conference of the Parties to the Treaty on the Non-Proliferation of Nuclear \nWeapons, Final Document, vol. I (NPT/CONF.2010/50 (Vol. I)), part I, Conclusions and \nrecommendations for follow-on actions.  \n \n2  A/73/838, annex.  \n \n3  See resolution 50/245 and A/50/1027.  \n \n4  Including Security Council resolutions 1718 (2006), 1874 (2009), 2094 (2013), 2270 (2016), \n2321 (2016) and 2375 (2017).  \n\nComprehensive Nuclear-Test-Ban Treaty \nA/RES/74/78\n \n3/3\n19-21885 \n \nirreversible denuclearization of the Korean Peninsula in a peaceful manner, including \nthrough the Six-Party Talks, welcomes all efforts and dialogue to this end, including \nthe inter-Korean summits and summits between the United States of America and the \nDemocratic People\u2019s Republic of Korea, and encourages all parties to continue such \nefforts and dialogue;  \n \n6. \nUrges all States that have not yet signed or ratified, or that have signed but \nnot yet ratified, the Treaty, in particular those whose ratification is needed for its entry \ninto force, to sign and ratify it as soon as possible and to accelerate their ratification \nprocesses with a view to ensuring their earliest successful conclusion;  \n \n7. \nWelcomes, since the adoption of its previous resolution on the subject, the \nratification of the Treaty by Zimbabwe, since each ratification is a significant step \ntowards the entry into force and universalization of the Treaty;  \n \n8. \nEncourages further expressions from among the remaining States whose \nratification is needed for the Treaty to enter into force of their intention to pursue and \ncomplete the ratification process;  \n \n9. \nUrges all States to remain seized of the issue at the highest political level \nand, where in a position to do so, to promote adherence to the Treaty through bilateral \nand joint outreach, seminars and other means;  \n \n10. Decides to include in the provisional agenda of its seventy-fifth session \nthe item entitled \u201cComprehensive Nuclear-Test-Ban Treaty\u201d. \n \n46th plenary meeting \n12 December 2019 \n \n",
  "paragraphs": {
    "1": "Stresses the vital importance and urgency of signature and ratification, without delay and without conditions, in order to achieve the earliest entry into force of the Comprehensive Nuclear-Test-Ban Treaty;3",
    "2": "Welcomes the contributions by the signatory States to the work of the Preparatory Commission for the Comprehensive Nuclear-Test-Ban Treaty Organization, in particular its efforts to ensure that the verification regime of the Treaty will be capable of meeting the verification requirements of the Treaty upon its entry into force, in accordance with article IV of the Treaty, and encourages their continuation;",
    "3": "Underlines the need to maintain momentum towards the completion of all elements of the verification regime;",
    "4": "Urges all States not to carry out nuclear-weapon test explosions or any other nuclear explosions, to maintain their moratoriums in this regard and to refrain from acts that would defeat the object and purpose of the Treaty, while stressing that these measures do not have the same permanent and legally binding effect as the entry into force of the Treaty;",
    "5": "Reiterates its condemnation of the six nuclear tests conducted by the Democratic People\u2019s Republic of Korea in violation of relevant Security Council resolutions, 4 urges full compliance with the obligations under those resolutions, including that the Democratic People\u2019s Republic of Korea abandon its nuclear weapons programme and not conduct any further nuclear tests, notes with encouragement the statement of the Democratic People\u2019s Republic of Korea concerning a moratorium on nuclear tests and efforts towards the dismantlement of the Punggye-ri nuclear test site, reaffirms its support for the complete, verifiable and __________________ 1 2010 Review Conference of the Parties to the Treaty on the Non-Proliferation of Nuclear Weapons, Final Document, vol. I (NPT/CONF.2010/50 (Vol. I)), part I, Conclusions and recommendations for follow-on actions. 2 A/73/838, annex. 3 See resolution 50/245 and A/50/1027. 4 Including Security Council resolutions 1718 (2006), 1874 (2009), 2094 (2013), 2270 (2016), 2321 (2016) and 2375 (2017). Comprehensive Nuclear-Test-Ban Treaty A/RES/74/78 3/3 19-21885 irreversible denuclearization of the Korean Peninsula in a peaceful manner, including through the Six-Party Talks, welcomes all efforts and dialogue to this end, including the inter-Korean summits and summits between the United States of America and the Democratic People\u2019s Republic of Korea, and encourages all parties to continue such efforts and dialogue;",
    "6": "Urges all States that have not yet signed or ratified, or that have signed but not yet ratified, the Treaty, in particular those whose ratification is needed for its entry into force, to sign and ratify it as soon as possible and to accelerate their ratification processes with a view to ensuring their earliest successful conclusion;",
    "7": "Welcomes, since the adoption of its previous resolution on the subject, the ratification of the Treaty by Zimbabwe, since each ratification is a significant step towards the entry into force and universalization of the Treaty;",
    "8": "Encourages further expressions from among the remaining States whose ratification is needed for the Treaty to enter into force of their intention to pursue and complete the ratification process;",
    "9": "Urges all States to remain seized of the issue at the highest political level and, where in a position to do so, to promote adherence to the Treaty through bilateral and joint outreach, seminars and other means;",
    "10": "Decides to include in the provisional agenda of its seventy-fifth session the item entitled \u201cComprehensive Nuclear-Test-Ban Treaty\u201d. 46th plenary meeting 12 December 2019"
  },
  "agenda_items": [
    "Item 104"
  ],
  "symbol_references": []
}