{
  "symbol": "A/RES/76/91",
  "filename": "A_RES_76_91.pdf",
  "title": "76/91. Question of Anguilla",
  "text": "United Nations \nA/RES/76/91\n \n \nGeneral Assembly \nDistr.: General \n16 December 2021 \n \n21-18694 (E)    211221     \n*2118694* \n \n \nSeventy-sixth session \nAgenda item 63 \nImplementation of the Declaration on the Granting of \nIndependence to Colonial Countries and Peoples \n \n \n \n \n Resolution adopted by the General Assembly \non 9 December 2021 \n \n \n \n \n[on the report of the Special Political and Decolonization Committee \n(Fourth Committee) (A/76/425, para. 37)] \n \n \n \n76/91. Question of Anguilla \n \n \n \nThe General Assembly, \n \nHaving considered the question of Anguilla and examined the report of the \nSpecial Committee on the Situation with regard to the Implementation of the \nDeclaration on the Granting of Independence to Colonial Countries and Peoples for \n2021,1 \n \nTaking note of the working paper prepared by the Secretariat on Anguilla2 and \nother relevant information, \n \nRecognizing that all available options for self-determination of the Territory are \nvalid as long as they are in accordance with the freely expressed wishes of the people \nof Anguilla and in conformity with the clearly defined principles contained in General \nAssembly resolutions 1514 (XV) of 14 December 1960, 1541 (XV) of 15 December \n1960 and other resolutions of the Assembly, \n \nExpressing concern that, more than 60 years after the adoption of the \nDeclaration on the Granting of Independence to Colonial Countries and Peoples, 3 \nthere still remain 17 Non-Self-Governing Territories, including Anguilla, \n \nConscious of the importance of continuing the effective implementation of the \nDeclaration, taking into account the target set by the United Nations to eradicate \ncolonialism by 2030 and the plan of action for the International Decades for the \nEradication of Colonialism,4 \n__________________ \n \n1  Official Records of the General Assembly, Seventy-sixth Session, Supplement No. 23 (A/76/23). \n \n2  A/AC.109/2021/2. \n \n3  Resolution 1514 (XV). \n \n4  A/56/61, annex. \n\nA/RES/76/91 \nQuestion of Anguilla\n \n21-18694\n2/6 \n \n \nRecognizing that the specific characteristics and the aspirations of the people of \nAnguilla require flexible, practical and innovative approaches to the options for self-\ndetermination, without any prejudice to territorial size, geographical location, size of \npopulation or natural resources, \n \nConvinced that the wishes and aspirations of the people of the Territory should \ncontinue to guide the development of their future political status and that \nreferendums, free and fair elections and other forms of popular consultation play an \nimportant role in ascertaining the wishes and aspirations of the people, \n \nConcerned by the use and exploitation of the natural resources of the Non-Self-\nGoverning Territories by the administering Powers for their benefit, by the use of the \nTerritories as international financial centres to the detriment of the world economy \nand by the consequences of any economic activities of the administering Powers that \nare contrary to the interests of the people of the Territories, as well as to resolution \n1514 (XV), \n \nConvinced that any negotiations to determine the status of the Territory must \ntake place with the active involvement and participation of the people of the Territory, \nunder the auspices of the United Nations, on a case-by-case basis, and that the views \nof the people of Anguilla in respect of their right to self-determination should be \nascertained, \n \nNoting the continued cooperation of the Non-Self-Governing Territories at the \nlocal and regional levels, including participation in the work of regional \norganizations, \n \nMindful that, in order for the Special Committee to enhance its understanding \nof the political status of the people of Anguilla and to fulfil its mandate effectively, it \nis important for it to be apprised by the United Kingdom of Great Britain and Northern \nIreland as the administering Power and to receive information from other appropriate \nsources, including the representatives of the Territory, concerning the wishes and \naspirations of the people of the Territory, \n \nAware of the importance both to Anguilla and to the Special Committee of the \nparticipation of elected and appointed representatives of Anguilla in the work of the \nCommittee, \n \nRecognizing the need for the Special Committee to ensure that the appropriate \nbodies of the United Nations actively pursue a public awareness campaign aimed at \nassisting the people of Anguilla with their inalienable right to self-determination and \nin gaining a better understanding of the options for self-determination, on a case-by-\ncase basis, \n \nMindful, in that connection, that the holding of regional seminars in the \nCaribbean and Pacific regions and at Headquarters, with the active participation of \nrepresentatives of the Non-Self-Governing Territories, provides a helpful means for \nthe Special Committee to fulfil its mandate and that the regional nature of the \nseminars, which alternate between the Caribbean and the Pacific, is a crucial element \nin the context of a United Nations programme for ascertaining the political status of \nthe Territories, \n \nRecalling the Caribbean regional seminar on the theme \u201cImplementation of the \nThird International Decade for the Eradication of Colonialism: accelerating \ndecolonization through renewed commitment and pragmatic measures\u201d, held by the \nSpecial Committee in Grand Anse, Grenada, and hosted by the Government of \nGrenada from 2 to 4 May 2019, as a significant and forward-looking event, which \nenabled the participants to assess progress made and address challenges faced in the \n\nQuestion of Anguilla \nA/RES/76/91\n \n3/6\n21-18694 \n \ndecolonization process, review the existing working methods of the Committee and \nrenew its commitment to implementing its historic task, \n \nRecalling also the importance of the conclusions and recommendations adopted \nby the seminar, which were annexed to the report of the Special Committee for 2019 5 \nand which outlined the findings of the seminar, including, especially, the way forward \nfor the decolonization process within the context of the proclamation by the General \nAssembly of the period 2011\u20132020 as the Third International Decade for the \nEradication of Colonialism,6 \n \nMindful that the 2021 Caribbean regional seminar, originally scheduled to be \nconvened in Dominica, from 19 to 21 May 2021, had to be rescheduled, and \nwelcoming the holding of the regional seminar in the Parish of Saint John, Dominica, \nfrom 25 to 27 August 2021, \n \nNoting with appreciation the contribution to the development of some \nTerritories by the specialized agencies and other organizations of the United Nations \nsystem, in particular the Economic Commission for Latin America and the Caribbean, \nthe Economic and Social Commission for Asia and the Pacific, the United Nations \nDevelopment Programme and the World Food Programme, as well as regional \ninstitutions such as the Caribbean Development Bank, the Caribbean Community, the \nOrganisation of Eastern Caribbean States, the Pacific Islands Forum and the agencies \nof the Council of Regional Organizations in the Pacific, \n \nRecalling that the first regional seminar held in a Non-Self-Governing Territory \nwas the 2003 Caribbean regional seminar in Anguilla, hosted by the territorial \nGovernment with the cooperation of the administering Power, \n \nNoting with serious concern that the Territory last participated in the activities \nof the Special Committee in 2012, \n \nAware of the follow-up meeting, held after the 2012 Pacific regional seminar, \nbetween the Chair of the Special Committee and the Chief Minister of Anguilla, who \nreiterated the urgent need for a visiting mission, \n \nRecalling the decisions taken in 2011 to set up a drafting team to prepare a new \nconstitution and present it for public consultation in the Territory and the recent \nefforts undertaken in that regard, including the establishment, in September 2015, of \na new Constitutional and Electoral Reform Committee to advance constitutional and \nelectoral reform, draft proposals for electoral and constitutional reforms submitted as \nthe draft constitution by the Committee in November 2016, as well as the revised \ndraft Constitution issued in March 2017 and presented to the Executive Council in \nMay 2017, and aware of the proposals made by the territorial Government to the \nadministering Power on amendments to the Constitution of Anguilla and of the \nAnguilla Constitution (Amendment) Orders 2019 and 2020, which came into force in \nMay 2019 and November 2020, respectively, \n \nNoting the participation of the Territory as a member in the Caribbean Overseas \nCountries and Territories Council and an associate member in the Caribbean \nCommunity, the Organisation of Eastern Caribbean States and the Economic \nCommission for Latin America and the Caribbean, \n \nRecalling with concern the devastating damage and impact caused in the \nTerritory by Hurricane Irma and Hurricane Maria in 2017, \n__________________ \n \n5  Official Records of the General Assembly, Seventy-fourth Session, Supplement No. 23 (A/74/23). \n \n6  See resolution 65/119. \n\nA/RES/76/91 \nQuestion of Anguilla\n \n21-18694\n4/6 \n \n \nStressing the importance of regional ties for the development of a small island \nTerritory, \n \nRecalling the general elections that were held in June 2020,7 \n \nRecalling also its resolutions 74/270 of 2 April 2020, entitled \u201cGlobal solidarity \nto fight the coronavirus disease 2019 (COVID-19)\u201d, 74/274 of 20 April 2020, entitled \n\u201cInternational cooperation to ensure global access to medicines, vaccines and medical \nequipment to face COVID-19\u201d, 74/306 of 11 September 2020, entitled \u201cComprehensive \nand coordinated response to the coronavirus disease (COVID-19) pandemic\u201d, 74/307 \nof 11 September 2020, entitled \u201cUnited response against global health threats: \ncombating COVID-19\u201d, 75/156 of 16 December 2020, entitled \u201cStrengthening \nnational and international rapid response to the impact of the coronavirus disease \n(COVID-19) on women and girls\u201d, and 75/157 of 16 December 2020, entitled \n\u201cWomen and girls and the response to the coronavirus disease (COVID-19)\u201d, as well \nas other relevant resolutions, \n \n1. \nReaffirms the inalienable right of the people of Anguilla to self-\ndetermination, in conformity with the Charter of the United Nations and with General \nAssembly resolution 1514 (XV), containing the Declaration on the Granting of \nIndependence to Colonial Countries and Peoples; \n \n2. \nAlso reaffirms that, in the process of decolonization of Anguilla, there is \nno alternative to the principle of self-determination, which is also a fundamental \nhuman right, as recognized under the relevant human rights conventions; \n \n3. \nFurther reaffirms that it is ultimately for the people of Anguilla to \ndetermine freely their future political status in accordance with the relevant \nprovisions of the Charter, the Declaration and the relevant resolutions of the General \nAssembly, and in that connection calls upon the administering Power, in cooperation \nwith the territorial Government and appropriate bodies of the United Nations system, \nto develop political education programmes for the Territory in order to foster an \nawareness among the people of their right to self-determination in conformity with \nthe legitimate political status options, based on the principles clearly defined in \nAssembly resolution 1541 (XV) and other relevant resolutions and decisions; \n \n4. \nWelcomes the preparations made for a new constitution, urges that \nconstitutional discussions with the administering Power, including public \nconsultations, be concluded as soon as possible, and notes the first stage of \namendments to the Constitution, which came into force on 14 May 2019; \n \n5. \nRequests the administering Power to assist the Territory in its current \nefforts with regard to advancing the internal constitutional review exercise, if \nrequested; \n \n6. \nStresses the importance of the previously expressed desire of the territorial \nGovernment for a visiting mission by the Special Committee on the Situation with \nregard to the Implementation of the Declaration on the Granting of Independence to \nColonial Countries and Peoples, calls upon the administering Power to facilitate such \na mission, if the territorial Government so desires, and requests the Chair of the \nSpecial Committee to take all the steps necessary to that end; \n \n7. \nRequests the administering Power to assist the Territory by facilitating its \nwork concerning public educational outreach efforts consistent with Article 73 b of \nthe Charter, and in that regard calls upon the relevant United Nations organizations \nto provide assistance to the Territory, if requested; \n__________________ \n \n7  See A/AC.109/2021/2, para. 3. \n\nQuestion of Anguilla \nA/RES/76/91\n \n5/6\n21-18694 \n \n \n8. \nCalls upon the administering Power to assist the territorial Government in \nstrengthening its commitments in the economic domain, including budgetary matters, \nwith regional support as needed and appropriate; \n \n9. \nWelcomes the active participation of the Territory in the work of the \nEconomic Commission for Latin America and the Caribbean; \n \n10. Stresses that the Territory should continue to participate in the activities of \nthe Special Committee, including regional seminars, in order to provide the \nCommittee with up-to-date information regarding the decolonization process; \n \n11. \nAlso stresses the importance of the Special Committee being apprised of \nthe views and wishes of the people of Anguilla and enhancing its understanding of \ntheir conditions, including the nature and scope of the existing political and \nconstitutional arrangements between Anguilla and the administering Power; \n \n12. Calls upon the administering Power to participate in and cooperate fully \nwith the work of the Special Committee in order to implement the provisions of \nArticle 73 e of the Charter and the Declaration and in order to advise the Committee \non the implementation of the provisions under Article 73 b of the Charter on efforts \nto promote self-government in Anguilla, and encourages the administering Power to \nfacilitate visiting and special missions to the Territory; \n \n13. Reaffirms the responsibility of the administering Power under the Charter \nto promote the economic and social development and to preserve the cultural identity \nof the Territory, and requests the administering Power to take steps to enlist and make \neffective use of all possible assistance, on both a bilateral and a multilateral basis, in \nthe strengthening of the economy of the Territory; \n \n14. Takes into account the 2030 Agenda for Sustainable Development, 8 \nincluding the Sustainable Development Goals, stresses the importance of fostering \nthe economic and social sustainable development of the Territory by promoting \nsustained, inclusive and equitable economic growth, creating greater opportunities for \nall, reducing inequalities, raising basic standards of living, fostering equitable social \ndevelopment and inclusion and promoting the integrated and sustainable management \nof natural resources and ecosystems that supports, inter alia, economic, social and \nhuman development, while facilitating ecosystem conservation, regeneration, \nrestoration and resilience in the face of new and emerging challenges, and strongly \nurges the administering Power to refrain from undertaking any kind of illicit, harmful \nand unproductive activities, including the use of the Territory as an international \nfinancial centre, that are not aligned with the interest of the people of the Territory; \n \n15. Requests the Territory and the administering Power to take all measures \nnecessary to protect and conserve the environment of the Territory against any \ndegradation, and once again requests the specialized agencies concerned to monitor \nenvironmental conditions in the Territory and to provide assistance to the Territory, \nconsistent with their prevailing rules of procedure; \n \n16. Reiterates its call upon the administering Power, the specialized agencies \nand other organizations of the United Nations system and regional organizations to \nprovide all the assistance necessary to the Territory, support the recovery and \nrebuilding efforts and enhance capabilities for emergency preparedness and risk \nreduction, in particular in the aftermath of Hurricane Irma and Hurricane Maria that \nimpacted the Territory in 2017; \n__________________ \n \n8  Resolution 70/1. \n\nA/RES/76/91 \nQuestion of Anguilla\n \n21-18694\n6/6 \n \n \n17. Requests the Special Committee to continue to examine the question of \nAnguilla and to report thereon to the General Assembly at its seventy-seventh session \nand on the implementation of the present resolution.  \n \n49th plenary meeting \n9 December 2021 \n \n",
  "paragraphs": {
    "1": "Reaffirms the inalienable right of the people of Anguilla to self- determination, in conformity with the Charter of the United Nations and with General Assembly resolution 1514 (XV), containing the Declaration on the Granting of Independence to Colonial Countries and Peoples;",
    "2": "Also reaffirms that, in the process of decolonization of Anguilla, there is no alternative to the principle of self-determination, which is also a fundamental human right, as recognized under the relevant human rights conventions;",
    "3": "Further reaffirms that it is ultimately for the people of Anguilla to determine freely their future political status in accordance with the relevant provisions of the Charter, the Declaration and the relevant resolutions of the General Assembly, and in that connection calls upon the administering Power, in cooperation with the territorial Government and appropriate bodies of the United Nations system, to develop political education programmes for the Territory in order to foster an awareness among the people of their right to self-determination in conformity with the legitimate political status options, based on the principles clearly defined in Assembly resolution 1541 (XV) and other relevant resolutions and decisions;",
    "4": "Welcomes the preparations made for a new constitution, urges that constitutional discussions with the administering Power, including public consultations, be concluded as soon as possible, and notes the first stage of amendments to the Constitution, which came into force on 14 May 2019;",
    "5": "Requests the administering Power to assist the Territory in its current efforts with regard to advancing the internal constitutional review exercise, if requested;",
    "6": "Stresses the importance of the previously expressed desire of the territorial Government for a visiting mission by the Special Committee on the Situation with regard to the Implementation of the Declaration on the Granting of Independence to Colonial Countries and Peoples, calls upon the administering Power to facilitate such a mission, if the territorial Government so desires, and requests the Chair of the Special Committee to take all the steps necessary to that end;",
    "7": "Requests the administering Power to assist the Territory by facilitating its work concerning public educational outreach efforts consistent with Article 73 b of the Charter, and in that regard calls upon the relevant United Nations organizations to provide assistance to the Territory, if requested; __________________ 7 See A/AC.109/2021/2, para. 3. Question of Anguilla A/RES/76/91 5/6 21-18694",
    "8": "Calls upon the administering Power to assist the territorial Government in strengthening its commitments in the economic domain, including budgetary matters, with regional support as needed and appropriate;",
    "9": "Welcomes the active participation of the Territory in the work of the Economic Commission for Latin America and the Caribbean;",
    "10": "Stresses that the Territory should continue to participate in the activities of the Special Committee, including regional seminars, in order to provide the Committee with up-to-date information regarding the decolonization process;",
    "11": "Also stresses the importance of the Special Committee being apprised of the views and wishes of the people of Anguilla and enhancing its understanding of their conditions, including the nature and scope of the existing political and constitutional arrangements between Anguilla and the administering Power;",
    "12": "Calls upon the administering Power to participate in and cooperate fully with the work of the Special Committee in order to implement the provisions of Article 73 e of the Charter and the Declaration and in order to advise the Committee on the implementation of the provisions under Article 73 b of the Charter on efforts to promote self-government in Anguilla, and encourages the administering Power to facilitate visiting and special missions to the Territory;",
    "13": "Reaffirms the responsibility of the administering Power under the Charter to promote the economic and social development and to preserve the cultural identity of the Territory, and requests the administering Power to take steps to enlist and make effective use of all possible assistance, on both a bilateral and a multilateral basis, in the strengthening of the economy of the Territory;",
    "14": "Takes into account the 2030 Agenda for Sustainable Development, 8 including the Sustainable Development Goals, stresses the importance of fostering the economic and social sustainable development of the Territory by promoting sustained, inclusive and equitable economic growth, creating greater opportunities for all, reducing inequalities, raising basic standards of living, fostering equitable social development and inclusion and promoting the integrated and sustainable management of natural resources and ecosystems that supports, inter alia, economic, social and human development, while facilitating ecosystem conservation, regeneration, restoration and resilience in the face of new and emerging challenges, and strongly urges the administering Power to refrain from undertaking any kind of illicit, harmful and unproductive activities, including the use of the Territory as an international financial centre, that are not aligned with the interest of the people of the Territory;",
    "15": "Requests the Territory and the administering Power to take all measures necessary to protect and conserve the environment of the Territory against any degradation, and once again requests the specialized agencies concerned to monitor environmental conditions in the Territory and to provide assistance to the Territory, consistent with their prevailing rules of procedure;",
    "16": "Reiterates its call upon the administering Power, the specialized agencies and other organizations of the United Nations system and regional organizations to provide all the assistance necessary to the Territory, support the recovery and rebuilding efforts and enhance capabilities for emergency preparedness and risk reduction, in particular in the aftermath of Hurricane Irma and Hurricane Maria that impacted the Territory in 2017; __________________ 8 Resolution 70/1. A/RES/76/91 Question of Anguilla 21-18694 6/6",
    "17": "Requests the Special Committee to continue to examine the question of Anguilla and to report thereon to the General Assembly at its seventy-seventh session and on the implementation of the present resolution. 49th plenary meeting 9 December 2021"
  },
  "agenda_items": [
    "Item 63"
  ],
  "symbol_references": []
}