{
  "symbol": "A/RES/79/134",
  "filename": "A_RES_79_134.pdf",
  "title": "79/134. Cooperation between the United Nations and the Organisation for the Prohibition of Chemical Weapons",
  "text": "United Nations \nA/RES/79/134\n \nGeneral Assembly \nDistr.: General \n12 December 2024 \n24-23450 (E) \n*2423450* \n \n \nSeventy-ninth session \nAgenda item 125 (n) \nCooperation between the United Nations and regional and other \norganizations: cooperation between the United Nations and the \nOrganisation for the Prohibition of Chemical Weapons \n \n \n \n \n Resolution adopted by the General Assembly \non 6 December 2024 \n \n \n[without reference to a Main Committee (A/79/L.31)] \n \n \n 79/134. Cooperation between the United Nations and the Organisation for \nthe Prohibition of Chemical Weapons \n \n \n \nThe General Assembly, \n \nRecalling its resolution 77/272 of 20 February 2023 on cooperation between the \nUnited Nations and the Organisation for the Prohibition of Chemical Weapons, \n \nHaving received the report for 2023 of the Organisation for the Prohibition of \nChemical Weapons on the implementation of the Convention on the Prohibition of the \nDevelopment, Production, Stockpiling and Use of Chemical Weapons and on Their \nDestruction,1 \n \n1. \nTakes note of the report for 2023 of the Organisation for the Prohibition of \nChemical Weapons submitted on its behalf by its Director General; \n \n2. \nNotes with appreciation the ongoing work of the Organisation for the \nProhibition of Chemical Weapons with regard to the implementation of the \nConvention on the Prohibition of the Development, Production, Stockpiling and Use \nof Chemical Weapons and on Their Destruction;2 \n \n3. \nCommends the continued work of the Organisation for the Prohibition of \nChemical Weapons to enhance the capacity of States parties and the Organisation to \nuse chemistry for peaceful purposes and respond to threats involving toxic chemicals, \nincluding through the development of a Centre for Chemistry and Technology as a \nplatform where the Technical Secretariat and States parties can learn, exchange views \n_______________ \n \n1 See A/79/131. \n \n2 United Nations, Treaty Series, vol. 1974, No. 33757. \n\nA/RES/79/134 \nCooperation between the United Nations and the Organisation for \nthe Prohibition of Chemical Weapons\n \n24-23450\n2/3 \n \nand work in common purpose to further achieve the object and purpose of the \nConvention; \n \n4. \nWelcomes the effective and ongoing cooperation between the United \nNations and the Organisation for the Prohibition of Chemical Weapons as set out in \nthe Agreement concerning the Relationship between the United Nations and the \nOrganisation for the Prohibition of Chemical Weapons;3 \n \n5. \nNotes with appreciation the participation of the Organisation for the \nProhibition of Chemical Weapons in the United Nations Global Counter-Terrorism \nCoordination Compact; \n \n6. \nRecalls the report of the Conference of the States Parties to the Convention \non the Prohibition of the Development, Production, Stockpiling and Use of Chemical \nWeapons and on Their Destruction on its fourth special session, held in The Hague on \n26 and 27 June 2018, and also recalls the decision adopted at the special session \nentitled \u201cAddressing the threat from chemical weapons use\u201d; \n \n7. \nAlso recalls the establishment of the Investigation and Identification Team \nof the Organisation for the Prohibition of Chemical Weapons as announced at the \nninety-first session of the Executive Council of the Organisation in a note by the \nTechnical Secretariat, EC-91/S/3, dated 28 June 2019, entitled \u201cWork of the \nInvestigation and Identification Team established by decision C-SS-4/DEC.3 (dated \n27 June 2018)\u201d, in which all States parties were informed about the establishment of \nthe Investigation and Identification Team with the purpose of identifying, in \ncompliance with C-SS-4/DEC.3, the perpetrators of the use of chemical weapons in \nthe Syrian Arab Republic; \n \n8. \nTakes note with grave concern of the first report of the Investigation and \nIdentification Team pursuant to paragraph 10 of decision C-SS-4/DEC.3, entitled \n\u201cAddressing the threat from chemical weapons use: Ltamenah (Syrian Arab \nRepublic) \u2013 24, 25, and 30 March 2017\u201d, released on 8 April 2020,4 the second report \nof the Investigation and Identification Team, entitled \u201cAddressing the threat from \nchemical weapons use: Saraqib (Syrian Arab Republic) \u2013 4 February 2018\u201d, released \non 12 April 2021, 5 the third report of the Investigation and Identification Team, \nentitled \u201cAddressing the threat from chemical weapons use: Douma (Syrian Arab \nRepublic) \u2013 7 April 2018\u201d, released on 27 January 20236 and the fourth report of the \nInvestigation and Identification Team, entitled \u201cAddressing the threat from chemical \nweapons use: Marea (Syrian Arab Republic) \u2013 1 September 2015\u201d, released on \n22 February 2024,7 and expresses appreciation for the work done in this regard;  \n \n9. \nRecalls Executive Council decision EC-94/DEC.2, dated 9 July 2020, \nentitled \u201cAddressing the possession and use of chemical weapons by the Syrian Arab \nRepublic\u201d,8 and welcomes the transmission of that decision and its associated reports \nto the Security Council and the General Assembly through the Secretary-General; \n \n10. Also recalls decision C-25/DEC.9, dated 21 April 2021, of the Conference \nof the States Parties to the Convention, entitled \u201cAddressing the possession and \nuse of chemical weapons by the Syrian Arab Republic\u201d, 9  and takes note of \n_______________ \n \n3 Ibid., vol. 2160, No. 1240. \n \n4 See S/2020/310, annex. \n \n5 See S/2021/371, annex. \n \n6 See S/2023/81, annex. \n \n7 See S/2024/200, annex. \n \n8 See A/74/959-S/2020/724, annex. \n \n9 See A/75/871-S/2021/425, annex. \n\nCooperation between the United Nations and the Organisation for \nthe Prohibition of Chemical Weapons \nA/RES/79/134\n \n3/3\n24-23450 \n \ndecision C-28/DEC.12, dated 30 November 2023, entitled \u201cAddressing the threat \nfrom chemical weapons use and the threat of future use\u201d; 10 \n \n11. \nFurther recalls Security Council resolution 2118 (2013) of 27 September \n2013, in which, inter alia, the Council requested the Director General of the \nOrganisation for the Prohibition of Chemical Weapons to report to the Security \nCouncil, through the Secretary-General, on a monthly basis, on the implementation \nof resolution 2118 (2013) and the decision of the Executive Council of the \nOrganisation of 27 September 2013,11 also recalls paragraph 5 of Security Council \nresolution 2209 (2015) of 6 March 2015, in which the Council welcomed the intention \nof the Director General to include future reports of the Organisation for the \nProhibition of Chemical Weapons fact-finding mission in the Syrian Arab Republic, \nwhich was mandated to establish the facts surrounding allegations of the use of toxic \nchemicals for hostile purposes in the Syrian Arab Republic, as part of his monthly \nreport to the Council, notes in this regard the transmission by the Director General of \nall monthly reports, as well as all reports of the fact-finding mission, during the \nreporting period, and expresses appreciation for the work done in this regard; \n \n12. Takes note with grave concern of the note by the Technical Secretariat of \nthe Organisation for the Prohibition of Chemical Weapons of 18 November 2024,12 \nconfirming the presence of riot control agents (CS gas) in samples recovered by \nUkrainian authorities from the battlefield, and urges the Technical Secretariat to \nclosely monitor the use of chemical weapons arising from the aggression against \nUkraine, or any other armed conflict, and calls upon all parties involved to comply \nwith the obligations and prohibitions established in the Convention; \n \n13. Decides to include in the provisional agenda of its eighty-first session, \nunder the item entitled \u201cCooperation between the United Nations and regional and \nother organizations\u201d, the sub-item entitled \u201cCooperation between the United Nations \nand the Organisation for the Prohibition of Chemical Weapons\u201d. \n \n48th plenary meeting \n6 December 2024 \n \n_______________ \n \n10 See A/78/710. \n \n11 Security Council resolution 2118 (2013), annex I. \n \n12 See Organisation for the Prohibition of Chemical Weapons, document S/2338/2024. \n",
  "paragraphs": {
    "1": "Takes note of the report for 2023 of the Organisation for the Prohibition of Chemical Weapons submitted on its behalf by its Director General;",
    "2": "Notes with appreciation the ongoing work of the Organisation for the Prohibition of Chemical Weapons with regard to the implementation of the Convention on the Prohibition of the Development, Production, Stockpiling and Use of Chemical Weapons and on Their Destruction;2",
    "3": "Commends the continued work of the Organisation for the Prohibition of Chemical Weapons to enhance the capacity of States parties and the Organisation to use chemistry for peaceful purposes and respond to threats involving toxic chemicals, including through the development of a Centre for Chemistry and Technology as a platform where the Technical Secretariat and States parties can learn, exchange views and work in common purpose to further achieve the object and purpose of the Convention;",
    "4": "Welcomes the effective and ongoing cooperation between the United Nations and the Organisation for the Prohibition of Chemical Weapons as set out in the Agreement concerning the Relationship between the United Nations and the Organisation for the Prohibition of Chemical Weapons;3",
    "5": "Notes with appreciation the participation of the Organisation for the Prohibition of Chemical Weapons in the United Nations Global Counter-Terrorism Coordination Compact;",
    "6": "Recalls the report of the Conference of the States Parties to the Convention on the Prohibition of the Development, Production, Stockpiling and Use of Chemical Weapons and on Their Destruction on its fourth special session, held in The Hague on 26 and 27 June 2018, and also recalls the decision adopted at the special session entitled \u201cAddressing the threat from chemical weapons use\u201d;",
    "7": "Also recalls the establishment of the Investigation and Identification Team of the Organisation for the Prohibition of Chemical Weapons as announced at the ninety-first session of the Executive Council of the Organisation in a note by the Technical Secretariat, EC-91/S/3, dated 28 June 2019, entitled \u201cWork of the Investigation and Identification Team established by decision C-SS-4/DEC.3 (dated 27 June 2018)\u201d, in which all States parties were informed about the establishment of the Investigation and Identification Team with the purpose of identifying, in compliance with C-SS-4/DEC.3, the perpetrators of the use of chemical weapons in the Syrian Arab Republic;",
    "8": "Takes note with grave concern of the first report of the Investigation and Identification Team pursuant to paragraph 10 of decision C-SS-4/DEC.3, entitled \u201cAddressing the threat from chemical weapons use: Ltamenah (Syrian Arab Republic) \u2013 24, 25, and 30 March 2017\u201d, released on 8 April 2020,4 the second report of the Investigation and Identification Team, entitled \u201cAddressing the threat from chemical weapons use: Saraqib (Syrian Arab Republic) \u2013 4 February 2018\u201d, released on 12 April 2021, 5 the third report of the Investigation and Identification Team, entitled \u201cAddressing the threat from chemical weapons use: Douma (Syrian Arab Republic) \u2013 7 April 2018\u201d, released on 27 January 20236 and the fourth report of the Investigation and Identification Team, entitled \u201cAddressing the threat from chemical weapons use: Marea (Syrian Arab Republic) \u2013 1 September 2015\u201d, released on 22 February 2024,7 and expresses appreciation for the work done in this regard;",
    "9": "Recalls Executive Council decision EC-94/DEC.2, dated 9 July 2020, entitled \u201cAddressing the possession and use of chemical weapons by the Syrian Arab Republic\u201d,8 and welcomes the transmission of that decision and its associated reports to the Security Council and the General Assembly through the Secretary-General;",
    "10": "Also recalls decision C-25/DEC.9, dated 21 April 2021, of the Conference of the States Parties to the Convention, entitled \u201cAddressing the possession and use of chemical weapons by the Syrian Arab Republic\u201d, 9 and takes note of decision C-28/DEC.12, dated 30 November 2023, entitled \u201cAddressing the threat from chemical weapons use and the threat of future use\u201d; 10",
    "11": "Further recalls Security Council resolution 2118 (2013) of 27 September 2013, in which, inter alia, the Council requested the Director General of the Organisation for the Prohibition of Chemical Weapons to report to the Security Council, through the Secretary-General, on a monthly basis, on the implementation of resolution 2118 (2013) and the decision of the Executive Council of the Organisation of 27 September 2013,11 also recalls paragraph 5 of Security Council resolution 2209 (2015) of 6 March 2015, in which the Council welcomed the intention of the Director General to include future reports of the Organisation for the Prohibition of Chemical Weapons fact-finding mission in the Syrian Arab Republic, which was mandated to establish the facts surrounding allegations of the use of toxic chemicals for hostile purposes in the Syrian Arab Republic, as part of his monthly report to the Council, notes in this regard the transmission by the Director General of all monthly reports, as well as all reports of the fact-finding mission, during the reporting period, and expresses appreciation for the work done in this regard;",
    "12": "Takes note with grave concern of the note by the Technical Secretariat of the Organisation for the Prohibition of Chemical Weapons of 18 November 2024,12 confirming the presence of riot control agents (CS gas) in samples recovered by Ukrainian authorities from the battlefield, and urges the Technical Secretariat to closely monitor the use of chemical weapons arising from the aggression against Ukraine, or any other armed conflict, and calls upon all parties involved to comply with the obligations and prohibitions established in the Convention;",
    "13": "Decides to include in the provisional agenda of its eighty-first session, under the item entitled \u201cCooperation between the United Nations and regional and other organizations\u201d, the sub-item entitled \u201cCooperation between the United Nations and the Organisation for the Prohibition of Chemical Weapons\u201d."
  },
  "agenda_items": [
    "Item 125"
  ],
  "symbol_references": [
    "A/79/L.31"
  ]
}