{
  "symbol": "A/RES/73/127",
  "filename": "A_RES_73_127.pdf",
  "title": "73/127. International Day of Multilateralism and Diplomacy for Peace",
  "text": "United Nations \nA/RES/73/127\n \n \nGeneral Assembly \nDistr.: General \n19 December 2018 \n \n18-21725 (E)    241218     \n*1821725* \n \n \nSeventy-third session \nAgenda item 15 \n \n \n \n \n Resolution adopted by the General Assembly \non 12 December 2018 \n \n \n \n \n[without reference to a Main Committee (A/73/L.48 and A/73/L.48/Add.1)] \n \n \n 73/127. International Day of Multilateralism and Diplomacy for Peace \n \n \n \nThe General Assembly, \n \nReaffirming the Charter of the United Nations and its purposes and principles, \nand especially the commitment to settle disputes through peaceful means and the \ndetermination to save succeeding generations from the scourge of war, \n \nAcknowledging that the approach of multilateralism and diplomacy could \nreinforce the advancement of the three pillars of the United Nations, namely, \nsustainable development, peace and security and human rights, which are interlinked \nand mutually reinforcing, while observing respective mandates and the Charter, \n \nRecognizing the United Nations as the most representative international \norganization and the utmost expression of multilateralism, which is the main instrument \nto address multifaceted and complex global challenges through collective action, \n \nRecognizing also the urgent need to promote and strengthen multilateralism and \nthat the United Nations plays a central role in this regard, \n \nRecognizing further the role of international, regional and subregional \norganizations in the promotion and preservation of multilateralism and in the \nfacilitation of diplomacy, and noting in this regard the Movement of Non-Aligned \nCountries and its political declaration of 26 September 2018,1 \n \nReaffirming its resolutions 53/199 of 15 December 1998 and 61/185 of \n20 December 2006 on the proclamation of international years, and Economic and \nSocial Council resolution 1980/67 of 25 July 1980 on international years and \nanniversaries, in particular paragraphs 1 to 10 of the annex thereto on the agreed \ncriteria for the proclamation of international years, as well as paragraphs 13 and 14, \nin which it is stated that an international day or year should not be proclaimed before \nthe basic arrangements for its organization and financing have been made, \n__________________ \n \n1 A/73/407, annex. \n\nA/RES/73/127 \nInternational Day of Multilateralism and Diplomacy for Peace\n \n18-21725\n2/2 \n \n \n1. \nDeclares 24 April as the International Day of Multilateralism and \nDiplomacy for Peace, with effect from the seventy-third session of the General \nAssembly; \n \n2. \nUnderlines that the International Day constitutes a means to promote the \nvalues of the United Nations and to reaffirm the faith of our peoples in the purposes \nand principles enshrined in its Charter, to reaffirm the importance and relevance of \nmultilateralism and international law and to advance the common goal of lasting and \nsustained peace through diplomacy; \n \n3. \nRequests the Secretary-General to bring the present resolution to the \nattention of all Member States, organizations of the United Nations system and other \ninternational and regional organizations, as well as civil society, including \nnon-governmental organizations and individuals; \n \n4. \nAlso requests the Secretary-General to take the necessary measures and \narrangements for the United Nations to commemorate and promote the \nInternational Day; \n \n5. \nFurther requests the Secretary-General to recommend ways and means by \nwhich the United Nations system and the Secretariat could assist Member States, upon \nrequest, in organizing activities to commemorate and promote the International Day; \n \n6. \nInvites all Member States and observers of the United Nations, \norganizations of the United Nations system and other international and regional \norganizations, as well as civil society, including non-governmental organizations and \nindividuals, to observe the International Day in an appropriate manner and to \ndisseminate the advantages of multilateralism and diplomacy for peace, including \nthrough educational and public awareness-raising activities; \n \n7. \nInvites the President of the General Assembly to organize, on 24 April \n2019, a one-day high-level plenary meeting of the General Assembly to commemorate \nand promote the International Day, with the participation of Member States and \nobservers, as well as of the President of the General Assembly and the Secretary-\nGeneral; \n \n8. \nAlso invites the President of the General Assembly to commemorate and \npromote, as appropriate, the International Day; \n \n9. \nStresses that the cost of all activities that may arise from the \nimplementation of the present resolution should be met from voluntary contributions. \n \n51st plenary meeting  \n12 December 2018 \n \n",
  "paragraphs": {
    "1": "Declares 24 April as the International Day of Multilateralism and Diplomacy for Peace, with effect from the seventy-third session of the General Assembly;",
    "2": "Underlines that the International Day constitutes a means to promote the values of the United Nations and to reaffirm the faith of our peoples in the purposes and principles enshrined in its Charter, to reaffirm the importance and relevance of multilateralism and international law and to advance the common goal of lasting and sustained peace through diplomacy;",
    "3": "Requests the Secretary-General to bring the present resolution to the attention of all Member States, organizations of the United Nations system and other international and regional organizations, as well as civil society, including non-governmental organizations and individuals;",
    "4": "Also requests the Secretary-General to take the necessary measures and arrangements for the United Nations to commemorate and promote the International Day;",
    "5": "Further requests the Secretary-General to recommend ways and means by which the United Nations system and the Secretariat could assist Member States, upon request, in organizing activities to commemorate and promote the International Day;",
    "6": "Invites all Member States and observers of the United Nations, organizations of the United Nations system and other international and regional organizations, as well as civil society, including non-governmental organizations and individuals, to observe the International Day in an appropriate manner and to disseminate the advantages of multilateralism and diplomacy for peace, including through educational and public awareness-raising activities;",
    "7": "Invites the President of the General Assembly to organize, on 24 April 2019, a one-day high-level plenary meeting of the General Assembly to commemorate and promote the International Day, with the participation of Member States and observers, as well as of the President of the General Assembly and the Secretary- General;",
    "8": "Also invites the President of the General Assembly to commemorate and promote, as appropriate, the International Day;",
    "9": "Stresses that the cost of all activities that may arise from the implementation of the present resolution should be met from voluntary contributions."
  },
  "agenda_items": [
    "Item 15"
  ],
  "symbol_references": [
    "A/73/L.48"
  ]
}