{
  "symbol": "A/RES/75/79",
  "filename": "A_RES_75_79.pdf",
  "title": "75/79. Regional confidence-building measures: activities of the United Nations Standing Advisory Committee on Security Questions in Central Africa",
  "text": "United Nations \nA/RES/75/79 \n \n \nGeneral Assembly \nDistr.: General \n17 December 2020 \n \n20-16910 (E)    221220 \n*2016910* \n \n \nSeventy-fifth session \nAgenda item 104 (f) \nReview and implementation of the Concluding Document \nof the Twelfth Special Session of the General Assembly: \nregional confidence-building measures: activities of the \nUnited Nations Standing Advisory Committee on Security \nQuestions in Central Africa  \n \n \n \n \n Resolution adopted by the General Assembly \non 7 December 2020 \n \n \n \n \n[on the report of the First Committee (A/75/400, para. 21)] \n \n \n \n75/79. Regional confidence-building measures: activities of the \nUnited Nations Standing Advisory Committee on Security \nQuestions in Central Africa \n \n \n \nThe General Assembly, \n \nRecalling its previous relevant resolutions, in particular, its resolution 74/73 of \n12 December 2019, \n \nRecalling also the guidelines for general and complete disarmament adopted at \nits tenth special session, the first special session devoted to disarmament, \n \nBearing in mind the establishment by the Secretary-General on 28 May 1992 of \nthe United Nations Standing Advisory Committee on Security Questions in Central \nAfrica, the purpose of which is to encourage arms limitation, disarmament, \nnon-proliferation and development in the Central Africa subregion, \n \nRecalling that the purpose of the Standing Advisory Committee is to conduct \nreconstruction and confidence-building activities in Central Africa among its member \nStates, including through confidence-building and arms limitation measures, \n \nReaffirming the importance and relevance of the Standing Advisory Committee \nas an instrument of preventive diplomacy in the subregional architecture for the \npromotion of peace and security in Central Africa, \n \nBearing in mind the revitalization of the activities of the Standing Advisory \nCommittee decided upon at the forty-fourth ministerial meeting of the Committee, \nheld in Yaound\u00e9 from 29 May to 2 June 2017, with a view to enhancing its \n\nA/RES/75/79 \nRegional confidence-building measures: activities of the \nUnited Nations Standing Advisory Committee on \nSecurity Questions in Central Africa\n \n20-16910\n2/7 \n \ncontribution to the achievement of the objectives of peace, security and development \nin Central Africa, \n \nRecalling the entry into force of the Central African Convention for the Control \nof Small Arms and Light Weapons, Their Ammunition and All Parts and Components \nThat Can Be Used for Their Manufacture, Repair and Assembly (Kinshasa \nConvention) on 8 March 20171 and the third Conference of States Parties to the Arms \nTrade Treaty, held in Geneva from 11 to 15 September 2017, \n \nConvinced that the resources released by disarmament, including regional \ndisarmament, can be devoted to economic and social development and to the \nprotection of the environment for the benefit of all peoples, in particular those of \ndeveloping countries, \n \nReaffirming the Libreville Declaration on the Adoption and Implementation of \nthe Regional Strategy and Plan of Action for Combating Terrorism and the Trafficking \nin Small Arms and Light Weapons in Central Africa, adopted by the States members \nof the Standing Advisory Committee on 26 November 2015 at their forty-first \nministerial meeting, held in Libreville from 23 to 27 November 2015,2  \n \nConsidering the importance and effectiveness of confidence-building measures \ntaken on the initiative and with the participation of all States concerned and taking \ninto account the specific characteristics of each region, since such measures can \ncontribute to regional stability and to international peace and security, \n \nConvinced that development can be achieved only in a climate of peace, security \nand mutual confidence both within and among States, \n \nRecalling the communiqu\u00e9s of the forty-eighth 3  and forty-ninth ministerial \nmeetings of the Standing Advisory Committee, held from 27 to 31 May and from \n25 to 29 November 2019 in Kinshasa and Luanda, respectively, the Brazzaville \nDeclaration on Cooperation for Peace and Security in Central Africa, 4  the Bata \nDeclaration for the Promotion of Lasting Democracy, Peace and Development in \nCentral Africa 5 and the Yaound\u00e9 Declaration on Peace, Security and Stability in \nCentral Africa,6  \n \nBearing in mind resolutions 1196 (1998) and 1197 (1998), adopted by the \nSecurity Council on 16 and 18 September 1998, respectively, following its \nconsideration of the report of the Secretary-General on the causes of conflict and the \npromotion of durable peace and sustainable development in Africa, 7  \n \nRecalling the successful conclusion of the Summit of Heads of State and \nGovernment on Maritime Safety and Security in the Gulf of Guinea, held in Yaound\u00e9 \non 24 and 25 June 2013, the inauguration in Yaound\u00e9, on 11 September 2014, of the \nInterregional Coordination Centre for Maritime Security in the Gulf of Guinea, the \neffective commencement of its activities with the installation of its statutory officials \nin Yaound\u00e9 on 22 February 2017, the inauguration of new offices of the Regional \nCentre for Maritime Security in Central Africa in Pointe Noire, Congo, on 20 October \n2014, and the launch of the Multinational Maritime Coordination Centre in Cotonou, \nBenin, in March 2015, and also the conclusion of the African Union Extraordinary \n__________________ \n \n1  See A/65/517-S/2010/534, annex. \n \n2  See A/70/682-S/2016/39, annex 3. \n \n3  A/73/967-S/2019/613, annex, enclosure I. \n \n4  A/50/474, annex I. \n \n5  A/53/258-S/1998/763, annex II, appendix I. \n \n6  A/53/868-S/1999/303, annex II. \n \n7  A/52/871-S/1998/318. \n\nRegional confidence-building measures: activities of the  \nUnited Nations Standing Advisory Committee on  \nSecurity Questions in Central Africa \nA/RES/75/79\n \n3/7\n20-16910 \n \nSummit of Heads of State and Government on Maritime Security and Safety and \nDevelopment in Africa, held in Lom\u00e9 on 15 October 2016, \n \nRecalling also its resolution 69/314 of 30 July 2015, the first such resolution on \ntackling illicit trafficking in wildlife, and also its resolutions 70/301 of 9 September \n2016, 71/326 of 11 September 2017 and 73/343 of 16 September 2019, and \nreaffirming the outcome of the high-level meetings on poaching and illicit wildlife \ntrafficking, hosted by Gabon and Germany and held on the margins of the high-level \nsegments of the sixty-eighth and sixty-ninth sessions of the General Assembly, \n \nEmphasizing the need to strengthen the capacity for early warning, conflict \nprevention and peacekeeping in Africa, and recalling in this regard the concrete \nconflict prevention initiatives facilitated by the Department of Political and \nPeacebuilding Affairs of the Secretariat, \n \nWelcoming the establishment of the Commission of the Economic Community \nof Central African States and the close cooperation established between the United \nNations Regional Office for Central Africa and the Economic Community, as well as \nthe signing of the framework of cooperation agreement between the two entities on \n14 June 2016, \n \nTaking note of the decisions adopted by the Conference of Heads of State and \nGovernment of the Economic Community of Central African States at its seventeenth \nordinary session, held virtually on 30 July 2020, \n \nBearing in mind the increased focus of the Standing Advisory Committee on \nhuman security questions, such as trafficking in persons, especially women and \nchildren, as an important consideration for subregional peace, stability and conflict \nprevention, and recalling the adoption by the General Assembly at its seventy-second \nsession of the political declaration on the implementation of the United Nations \nGlobal Plan of Action to Combat Trafficking in Persons8 following the high-level \nmeeting of the Assembly on the appraisal of the Global Plan of Action, \n \nExpressing continued concern about the fragile situation in the Central African \nRepublic and in the neighbouring countries affected, and noting the importance of \npromoting the political process through the reactivation of the joint bilateral \ncommissions between the Central African Republic and its neighbours and the \nimplementation of the Political Agreement for Peace and Reconciliation in the Central \nAfrican Republic between the Government and armed groups for lasting peace, in \nparticular with regard to the protection of civilians, disarmament, demobilization and \nreintegration of former combatants, and strengthening the authority of the State, \n \nHighlighting the regional security implications of the situation in the Central \nAfrican Republic, and reiterating the commitment of the region and the international \ncommunity to supporting the parties in the effective implementation of the Political \nAgreement, including through the provision of political, security, technical and \nfinancial support, \n \nRecalling the Brazzaville Declaration on Confidence-Building Measures,9 and \nexpressing concern that the issue of mercenaries has become a major security concern, \nundermining trust and creating tensions among States members of the Standing \nAdvisory Committee, \n \nWelcoming the call by States members of the Economic Community of Central \nAfrican States during the forty-ninth session of the Standing Advisory Committee, in \n__________________ \n \n8  Resolution 72/1. \n \n9  A/73/224, annex IV. \n\nA/RES/75/79 \nRegional confidence-building measures: activities of the \nUnited Nations Standing Advisory Committee on \nSecurity Questions in Central Africa\n \n20-16910\n4/7 \n \nLuanda, on the need to strengthen partnership with the United Nations to address the \nimpact of climate change on peace and security in the subregion, \n \nExpressing concern about the increasing impact of cross-border criminality, in \nparticular the activities of the Lord\u2019s Resistance Army, the terrorist attacks by Boko \nHaram in the Lake Chad basin region and incidents of piracy in the Gulf of Guinea, \nthe illegal exploitation of natural resources, and the issue of transhumance and its \ncross-border security implications for peace, security and development in Central \nAfrica, \n \nWelcoming the progress made by the States members of the Lake Chad Basin \nCommission and Benin in making the Multinational Joint Task Force operational in \norder to combat effectively the threat posed by the Boko Haram terrorist group to the \nLake Chad basin region, \n \nRecalling the adoption by the Lake Chad Basin Commission, with the support \nof the African Union, of the Regional Stabilization, Recovery and Resilience Strategy \nfor Areas Affected by Boko Haram in the Lake Chad Basin Region in Abuja on \n30 August 2018, \n \nBearing in mind Security Council resolution 2349 (2017) of 31 March 2017, in \nwhich the Council called for, inter alia, increased assistance to the countries of the \nregion, \n \nConsidering the urgent need to prevent the possible movement of illicit \nweapons, mercenaries and combatants involved in conflicts in the Sahel and in \nneighbouring countries in the Central African subregion, \n \n1. \nReaffirms its support for efforts aimed at promoting confidence-building \nmeasures at the regional and subregional levels in order to ease tensions and conflicts \nin Central Africa and to further sustainable peace, stability and development in the \nsubregion; \n \n2. \nWelcomes and encourages the initiative of the States members of the \nUnited Nations Standing Advisory Committee on Security Questions in Central \nAfrica to further develop collaboration and synergies with the Economic Community \nof Central African States, in particular the Commission for Defence and Security, \nincluding by means of closed meetings, with a view to promoting the implementation \nof the regional strategy for combating terrorism and the trafficking in small arms and \nlight weapons in Central Africa adopted by the Committee; \n \n3. \nWelcomes the completion of the institutional reform process of the \nEconomic Community of Central African States and the transformation of its \nsecretariat into a commission in August 2020, as well as the integration of the Council \nfor Peace and Security in Central Africa into the organizational structure of the \nCommission of the Economic Community of Central African States; \n \n4. \nInvites the Standing Advisory Committee and the Economic Community \nof Central African States to initiate discussions on the relationship between the two \nentities in the light of the institutional reform of the Economic Community; \n \n5. \nWelcomes efforts under way by the Standing Advisory Committee and its \nsecretariat to implement the communication strategy adopted at the forty-fifth \nministerial meeting of the Committee, held in Kigali from 4 to 8 December 2017, and \nencourages Member States and other partners to support initiatives aimed at \nincreasing the visibility of the Committee, including among the populations of the \nsubregion, in cooperation with civil society; \n\nRegional confidence-building measures: activities of the  \nUnited Nations Standing Advisory Committee on  \nSecurity Questions in Central Africa \nA/RES/75/79\n \n5/7\n20-16910 \n \n \n6. \nReaffirms the importance of disarmament and arms control programmes in \nCentral Africa carried out by the States of the subregion with the support of the United \nNations, the African Union and other international partners; \n \n7. \nEncourages Member States to provide assistance to those States members \nof the Standing Advisory Committee that have ratified the Arms Trade Treaty, 10 and \nencourages those that have not yet done so to ratify the Treaty; \n \n8. \nEncourages States members of the Standing Advisory Committee and \nother interested States to provide financial support for the implementation of the \nCentral African Convention for the Control of Small Arms and Light Weapons, Their \nAmmunition and All Parts and Components That Can Be Used for Their Manufacture, \nRepair and Assembly (Kinshasa Convention), and encourages signatories that have \nnot yet done so to ratify the Convention; \n \n9. \nWelcomes the holding of the first Conference of States Parties to the \nCentral African Convention for the Control of Small Arms and Light Weapons, Their \nAmmunition and All Parts and Components That Can Be Used for Their Manufacture, \nRepair and Assembly, in Yaound\u00e9 from 11 to 13 June 2018, in accordance with article \n34, paragraph 3, of the Kinshasa Convention; \n \n10. Encourages Member States to assist States parties to the Kinshasa \nConvention with coordination activities for the control of small arms and light \nweapons at the regional and national levels, including funding thereof, as \nexpeditiously as possible; \n \n11. Reaffirms its support for the United Nations Global Counter-Terrorism \nStrategy11 and its four pillars, which constitute an ongoing effort, and calls upon \nMember States, the United Nations and other appropriate international, regional and \nsubregional organizations to step up their efforts to implement the Strategy in an \nintegrated and balanced manner and in all aspects; \n \n12. Welcomes the adoption, by the Conference of Heads of State and \nGovernment of the Economic Community of Central African States at its seventeenth \nordinary session, on 30 July 2020, of the strategy on preventing and combating \nterrorism in Central Africa, and requests United Nations, regional and international \npartners to support its implementation; \n \n13. Welcomes the joint summit of the Heads of State and Government of the \nEconomic Community of West African States and the Economic Community of \nCentral African States, in coordination with the African Union Commission, on peace, \nsecurity, stability and the fight against terrorism and violent extremism, held in Lom\u00e9 \non 30 July 2018, and recalls the Lom\u00e9 Declaration on Peace, Security, Stability and \nthe Fight against Terrorism and Violent Extremism adopted at that summit; \n \n14. Encourages the Economic Community of Central African States and the \nEconomic Community of West African States to work together towards the \nimplementation of the Lom\u00e9 Declaration; \n \n15. Encourages the States members of the Standing Advisory Committee to \ncarry out the programmes of activities adopted at their ministerial meetings, and \nrequests the United Nations Regional Office for Central Africa to continue to provide \nsupport; \n \n16. Appeals to the international community to support the efforts undertaken \nby the States concerned to implement disarmament, demobilization and reintegration \n__________________ \n \n10  See resolution 67/234 B. \n \n11  Resolution 60/288. \n\nA/RES/75/79 \nRegional confidence-building measures: activities of the \nUnited Nations Standing Advisory Committee on \nSecurity Questions in Central Africa\n \n20-16910\n6/7 \n \nprogrammes, and urges the States concerned to ensure that such programmes take into \nconsideration the needs of women and children associated with former combatants; \n \n17. Welcomes the efforts of Cameroon and the Congo in providing assistance \nto the Interregional Coordination Centre for Maritime Security in the Gulf of Guinea \nand the Regional Centre for Maritime Security in Central Africa, respectively, and \nurges other member States to honour their financial commitments in order to ensure \nthe predictable and sustainable operation of the two Centres; \n \n18. Encourages Member States to continue to implement the outcomes of the \nSummit of Heads of State and Government on Maritime Safety and Security in the \nGulf of Guinea by operationalizing the Interregional Coordination Centre for \nMaritime Security in the Gulf of Guinea and activities of the Regional Centre for \nMaritime Security in Central Africa, and also encourages the implementation of the \nCharter on Maritime Security and Safety and Development in Africa adopted at the \nAfrican Union Extraordinary Summit of Heads of State and Government on Maritime \nSecurity and Safety and Development in Africa; \n \n19. Calls upon Member States and subregional bodies to take immediate \nconcerted action to counter the phenomenon of poaching and trafficking in wildlife \nand natural resources, including through the implementation of the provisions of its \nresolutions 69/314, 70/301, 71/326 and 73/343; \n \n20. Welcomes the progress made by the Economic Community of Central \nAfrican States and the Economic Community of West African States in initiating \ncommon policies and joint programmes on the management of pastoralism and cross-\nborder transhumance, and encourages the Economic Community of Central African \nStates to adopt the protocol on pastoralism and cross-border transhumance in Central \nAfrica; \n \n21. Encourages the development of mechanisms for regulation by the \nEconomic Community of Central African States, and calls for the holding of a high-\nlevel conference to discuss issues relating to pastoralism and cross-border \ntranshumance with a view to ensuring joint and integrated management thereof; \n \n22. Requests the United Nations Regional Office for Central Africa, in \ncollaboration with the United Nations Regional Centre for Peace and Disarmament in \nAfrica, to facilitate the efforts undertaken by the States members of the Standing \nAdvisory Committee, in particular for their execution of the Implementation Plan for \nthe Kinshasa Convention;12  \n \n23. Requests the Secretary-General and the Office of the United Nations High \nCommissioner for Refugees, with the support of the international community, to \ncontinue to assist the countries of Central Africa in tackling the issues of refugees and \ndisplaced persons in their territories; \n \n24. Requests the Secretary-General and the Office of the United Nations High \nCommissioner for Human Rights to continue to provide their full assistance to the \nSubregional Centre for Human Rights and Democracy in Central Africa; \n \n25. Welcomes the increased contributions made by several Member States to \nthe trust fund of the United Nations Standing Advisory Committee on Security \nQuestions in Central Africa, reminds the States members of the Standing Advisory \nCommittee of the commitments that they undertook on the adoption of the Declaration \non the Trust Fund of the United Nations Standing Advisory Committee on Security \nQuestions in Central Africa on 8 May 200913 and the Bangui Declaration on 10 June \n__________________ \n \n12  See A/65/717-S/2011/53, annex. \n \n13  A/64/85-S/2009/288, annex I. \n\nRegional confidence-building measures: activities of the  \nUnited Nations Standing Advisory Committee on  \nSecurity Questions in Central Africa \nA/RES/75/79\n \n7/7\n20-16910 \n \n2016,14 and invites those States members of the Committee that have not already done \nso to contribute to the trust fund; \n \n26. Urges other Member States and intergovernmental and non-governmental \norganizations to support the activities of the Standing Advisory Committee effectively \nthrough voluntary contributions to the trust fund; \n \n27. Urges the States members of the Standing Advisory Committee, in \naccordance with Security Council resolution 1325 (2000) of 31 October 2000, to \nstrengthen the gender component of the various meetings of the Committee relating \nto disarmament and international security, in line with the Sao Tome Declaration on \nthe Participation of Women in the Statutory Meetings of the United Nations Standing \nAdvisory Committee on Security Questions in Central Africa, adopted on 1 December \n2016,15 in which member States were invited to increase the representation of women \nin delegations participating in the statutory meetings of the Committee; \n \n28. Expresses its satisfaction to the Secretary-General for his support to the \nStanding Advisory Committee, expresses appreciation for the role played by the \nUnited Nations Regional Office for Central Africa, welcomes the outcome of the \nstrategic review of the Office, and strongly encourages the States members of the \nStanding Advisory Committee and international partners to support the work of the \nOffice; \n \n29. Welcomes the efforts of the Standing Advisory Committee towards \naddressing cross-border security threats in Central Africa, including activities of \nBoko Haram and the Lord\u2019s Resistance Army, and acts of piracy and armed robbery \nat sea in the Gulf of Guinea, the issue of transhumance and its cross-border security \nimplications, as well as the fallout from the situation in the Central African Republic, \nand also welcomes the role of the United Nations Regional Office for Central Africa \nin coordinating those efforts, working closely with the Economic Community of \nCentral African States, the African Union and all relevant regional and international \npartners; \n \n30. Expresses its satisfaction to the Secretary-General for his support for the \nrevitalization of the activities of the Standing Advisory Committee, and requests him \nto continue to provide the assistance needed to ensure the success of its regular \nmeetings; \n \n31. Calls upon the Secretary-General to submit to the General Assembly at its \nseventy-sixth session a report on the implementation of the present resolution; \n \n32. Decides to include in the provisional agenda of its seventy-sixth session, \nunder the item entitled \u201cReview and implementation of the Concluding Document of \nthe Twelfth Special Session of the General Assembly\u201d, the sub-item entitled \n\u201cRegional confidence-building measures: activities of the United Nations Standing \nAdvisory Committee on Security Questions in Central Africa\u201d. \n \n37th plenary meeting \n7 December 2020 \n \n \n__________________ \n \n14  A/71/293, annex I. \n \n15  A/72/363, annex II. \n",
  "paragraphs": {
    "1": "Reaffirms its support for efforts aimed at promoting confidence-building measures at the regional and subregional levels in order to ease tensions and conflicts in Central Africa and to further sustainable peace, stability and development in the subregion;",
    "2": "Welcomes and encourages the initiative of the States members of the United Nations Standing Advisory Committee on Security Questions in Central Africa to further develop collaboration and synergies with the Economic Community of Central African States, in particular the Commission for Defence and Security, including by means of closed meetings, with a view to promoting the implementation of the regional strategy for combating terrorism and the trafficking in small arms and light weapons in Central Africa adopted by the Committee;",
    "3": "Welcomes the completion of the institutional reform process of the Economic Community of Central African States and the transformation of its secretariat into a commission in August 2020, as well as the integration of the Council for Peace and Security in Central Africa into the organizational structure of the Commission of the Economic Community of Central African States;",
    "4": "Invites the Standing Advisory Committee and the Economic Community of Central African States to initiate discussions on the relationship between the two entities in the light of the institutional reform of the Economic Community;",
    "5": "Welcomes efforts under way by the Standing Advisory Committee and its secretariat to implement the communication strategy adopted at the forty-fifth ministerial meeting of the Committee, held in Kigali from 4 to 8 December 2017, and encourages Member States and other partners to support initiatives aimed at increasing the visibility of the Committee, including among the populations of the subregion, in cooperation with civil society; Regional confidence-building measures: activities of the United Nations Standing Advisory Committee on Security Questions in Central Africa A/RES/75/79 5/7 20-16910",
    "6": "Reaffirms the importance of disarmament and arms control programmes in Central Africa carried out by the States of the subregion with the support of the United Nations, the African Union and other international partners;",
    "7": "Encourages Member States to provide assistance to those States members of the Standing Advisory Committee that have ratified the Arms Trade Treaty, 10 and encourages those that have not yet done so to ratify the Treaty;",
    "8": "Encourages States members of the Standing Advisory Committee and other interested States to provide financial support for the implementation of the Central African Convention for the Control of Small Arms and Light Weapons, Their Ammunition and All Parts and Components That Can Be Used for Their Manufacture, Repair and Assembly (Kinshasa Convention), and encourages signatories that have not yet done so to ratify the Convention;",
    "9": "Welcomes the holding of the first Conference of States Parties to the Central African Convention for the Control of Small Arms and Light Weapons, Their Ammunition and All Parts and Components That Can Be Used for Their Manufacture, Repair and Assembly, in Yaound\u00e9 from 11 to 13 June 2018, in accordance with article 34, paragraph 3, of the Kinshasa Convention;",
    "10": "Encourages Member States to assist States parties to the Kinshasa Convention with coordination activities for the control of small arms and light weapons at the regional and national levels, including funding thereof, as expeditiously as possible;",
    "11": "Reaffirms its support for the United Nations Global Counter-Terrorism Strategy11 and its four pillars, which constitute an ongoing effort, and calls upon Member States, the United Nations and other appropriate international, regional and subregional organizations to step up their efforts to implement the Strategy in an integrated and balanced manner and in all aspects;",
    "12": "Welcomes the adoption, by the Conference of Heads of State and Government of the Economic Community of Central African States at its seventeenth ordinary session, on 30 July 2020, of the strategy on preventing and combating terrorism in Central Africa, and requests United Nations, regional and international partners to support its implementation;",
    "13": "Welcomes the joint summit of the Heads of State and Government of the Economic Community of West African States and the Economic Community of Central African States, in coordination with the African Union Commission, on peace, security, stability and the fight against terrorism and violent extremism, held in Lom\u00e9 on 30 July 2018, and recalls the Lom\u00e9 Declaration on Peace, Security, Stability and the Fight against Terrorism and Violent Extremism adopted at that summit;",
    "14": "Encourages the Economic Community of Central African States and the Economic Community of West African States to work together towards the implementation of the Lom\u00e9 Declaration;",
    "15": "Encourages the States members of the Standing Advisory Committee to carry out the programmes of activities adopted at their ministerial meetings, and requests the United Nations Regional Office for Central Africa to continue to provide support;",
    "16": "Appeals to the international community to support the efforts undertaken by the States concerned to implement disarmament, demobilization and reintegration __________________ 10 See resolution 67/234 B. 11 Resolution 60/288. A/RES/75/79 Regional confidence-building measures: activities of the United Nations Standing Advisory Committee on Security Questions in Central Africa 20-16910 6/7 programmes, and urges the States concerned to ensure that such programmes take into consideration the needs of women and children associated with former combatants;",
    "17": "Welcomes the efforts of Cameroon and the Congo in providing assistance to the Interregional Coordination Centre for Maritime Security in the Gulf of Guinea and the Regional Centre for Maritime Security in Central Africa, respectively, and urges other member States to honour their financial commitments in order to ensure the predictable and sustainable operation of the two Centres;",
    "18": "Encourages Member States to continue to implement the outcomes of the Summit of Heads of State and Government on Maritime Safety and Security in the Gulf of Guinea by operationalizing the Interregional Coordination Centre for Maritime Security in the Gulf of Guinea and activities of the Regional Centre for Maritime Security in Central Africa, and also encourages the implementation of the Charter on Maritime Security and Safety and Development in Africa adopted at the African Union Extraordinary Summit of Heads of State and Government on Maritime Security and Safety and Development in Africa;",
    "19": "Calls upon Member States and subregional bodies to take immediate concerted action to counter the phenomenon of poaching and trafficking in wildlife and natural resources, including through the implementation of the provisions of its resolutions 69/314, 70/301, 71/326 and 73/343;",
    "20": "Welcomes the progress made by the Economic Community of Central African States and the Economic Community of West African States in initiating common policies and joint programmes on the management of pastoralism and cross- border transhumance, and encourages the Economic Community of Central African States to adopt the protocol on pastoralism and cross-border transhumance in Central Africa;",
    "21": "Encourages the development of mechanisms for regulation by the Economic Community of Central African States, and calls for the holding of a high- level conference to discuss issues relating to pastoralism and cross-border transhumance with a view to ensuring joint and integrated management thereof;",
    "22": "Requests the United Nations Regional Office for Central Africa, in collaboration with the United Nations Regional Centre for Peace and Disarmament in Africa, to facilitate the efforts undertaken by the States members of the Standing Advisory Committee, in particular for their execution of the Implementation Plan for the Kinshasa Convention;12",
    "23": "Requests the Secretary-General and the Office of the United Nations High Commissioner for Refugees, with the support of the international community, to continue to assist the countries of Central Africa in tackling the issues of refugees and displaced persons in their territories;",
    "24": "Requests the Secretary-General and the Office of the United Nations High Commissioner for Human Rights to continue to provide their full assistance to the Subregional Centre for Human Rights and Democracy in Central Africa;",
    "25": "Welcomes the increased contributions made by several Member States to the trust fund of the United Nations Standing Advisory Committee on Security Questions in Central Africa, reminds the States members of the Standing Advisory Committee of the commitments that they undertook on the adoption of the Declaration on the Trust Fund of the United Nations Standing Advisory Committee on Security Questions in Central Africa on 8 May 200913 and the Bangui Declaration on 10 June __________________ 12 See A/65/717-S/2011/53, annex. 13 A/64/85-S/2009/288, annex I. Regional confidence-building measures: activities of the United Nations Standing Advisory Committee on Security Questions in Central Africa A/RES/75/79 7/7 20-16910 2016,14 and invites those States members of the Committee that have not already done so to contribute to the trust fund;",
    "26": "Urges other Member States and intergovernmental and non-governmental organizations to support the activities of the Standing Advisory Committee effectively through voluntary contributions to the trust fund;",
    "27": "Urges the States members of the Standing Advisory Committee, in accordance with Security Council resolution 1325 (2000) of 31 October 2000, to strengthen the gender component of the various meetings of the Committee relating to disarmament and international security, in line with the Sao Tome Declaration on the Participation of Women in the Statutory Meetings of the United Nations Standing Advisory Committee on Security Questions in Central Africa, adopted on 1 December 2016,15 in which member States were invited to increase the representation of women in delegations participating in the statutory meetings of the Committee;",
    "28": "Expresses its satisfaction to the Secretary-General for his support to the Standing Advisory Committee, expresses appreciation for the role played by the United Nations Regional Office for Central Africa, welcomes the outcome of the strategic review of the Office, and strongly encourages the States members of the Standing Advisory Committee and international partners to support the work of the Office;",
    "29": "Welcomes the efforts of the Standing Advisory Committee towards addressing cross-border security threats in Central Africa, including activities of Boko Haram and the Lord\u2019s Resistance Army, and acts of piracy and armed robbery at sea in the Gulf of Guinea, the issue of transhumance and its cross-border security implications, as well as the fallout from the situation in the Central African Republic, and also welcomes the role of the United Nations Regional Office for Central Africa in coordinating those efforts, working closely with the Economic Community of Central African States, the African Union and all relevant regional and international partners;",
    "30": "Expresses its satisfaction to the Secretary-General for his support for the revitalization of the activities of the Standing Advisory Committee, and requests him to continue to provide the assistance needed to ensure the success of its regular meetings;",
    "31": "Calls upon the Secretary-General to submit to the General Assembly at its seventy-sixth session a report on the implementation of the present resolution;",
    "32": "Decides to include in the provisional agenda of its seventy-sixth session, under the item entitled \u201cReview and implementation of the Concluding Document of the Twelfth Special Session of the General Assembly\u201d, the sub-item entitled \u201cRegional confidence-building measures: activities of the United Nations Standing Advisory Committee on Security Questions in Central Africa\u201d. 37th plenary meeting 7 December 2020 __________________ 14 A/71/293, annex I. 15 A/72/363, annex II."
  },
  "agenda_items": [
    "Item 104"
  ],
  "symbol_references": []
}