{
  "symbol": "A/RES/72/139",
  "filename": "A_RES_72_139.pdf",
  "title": "72/139. Global health and foreign policy: addressing the health of the most vulnerable for an inclusive society",
  "text": "United Nations \nA/RES/72/139\n \n \nGeneral Assembly \nDistr.: General \n15 January 2018 \n \n17-22392 (E)    180118 \n*1722392* \n \n \nSeventy-second session \nAgenda item 127 \n \n \n \n \n Resolution adopted by the General Assembly \non 12 December 2017 \n \n \n \n \n[without reference to a Main Committee (A/72/L.28 and A/72/L.28/Add.1)] \n \n \n 72/139. Global health and foreign policy: addressing the health of the most \nvulnerable for an inclusive society \n \n \n \nThe General Assembly, \n \nRecalling its resolutions 63/33 of 26 November 2008, 64/108 of 10 December \n2009, 65/95 of 9 December 2010, 66/115 of 12 December 2011, 67/81 of \n12 December 2012, 68/98 of 11 December 2013, 69/132 of 11 December 2014, \n70/183 of 17 December 2015 and 71/159 of 15 December 2016, \n \nReaffirming its resolution 70/1 of 25 September 2015, entitled \u201cTransforming \nour world: the 2030 Agenda for Sustainable Development\u201d, in which it adopted a \ncomprehensive, far-reaching and people-centred set of universal and transformative \nSustainable Development Goals and targets, its commitment to working tirelessly for \nthe full implementation of the Agenda by 2030, its recognition that eradicating \npoverty in all its forms and dimensions, including extreme poverty, is the greatest \nglobal challenge and an indispensable requirement for sustainable development, its \ncommitment to achieving sustainable development in its three dimensions \u2014 \neconomic, social and environmental \u2014 in a balanced and integrated manner, and to \nbuilding upon the achievements of the Millennium Development Goals and seeking \nto address their unfinished business, \n \nReaffirming also its resolution 69/313 of 27 July 2015 on the Addis Ababa \nAction Agenda of the Third International Conference on Financing for Development, \nwhich is an integral part of the 2030 Agenda for Sustainable Development, supports \nand complements it, helps to contextualize its means of implementation targets with \nconcrete policies and actions, and reaffirms the strong political commitment to \naddress the challenge of financing and creating an enabling environment at all levels \nfor sustainable development in the spirit of global partnership and solidarity, \n\nA/RES/72/139 \nGlobal health and foreign policy: addressing the health\nof the most vulnerable for an inclusive society\n \n17-22392 \n2/9 \n \n \nRecalling the Universal Declaration of Human Rights,1 international \nhumanitarian law, the International Covenant on Economic, Social and Cultural \nRights2 and the Constitution of the World Health Organization, 3 \n \nReaffirming the commitment to fully and effectively implement the Beijing \nPlatform for Action,4 the Programme of Action of the International Conference on \nPopulation and Development5 and the outcomes of their review conferences, \nincluding the commitments relating to sexual and reproductive health and the \npromotion and protection of all human rights, \n \nRecognizing that health is a precondition for and an outcome and indicator of \nall three dimensions \u2014 economic, social and environmental \u2014 of sustainable \ndevelopment and that, despite progress made, challenges in global health, including \nmajor inequities and vulnerabilities within and among countries, regions and \npopulations, still remain and demand persistent attention, \n \nUnderscoring the fact that global health is also a long-term objective which is \nnational, regional and international in scope and requires sustained attention, \ncommitment and closer international cooperation, beyond emergencies, \n \nReaffirming the right of every human being, without distinction of any kind, to \nthe enjoyment of the highest attainable standard of physical and mental health and to \na standard of living adequate for the health and well-being of oneself and one\u2019s \nfamily, including adequate food, clothing and housing, and to the continuous \nimprovement of living conditions, with particular attention to the alarming situation \nof millions of people for whom access to health-care services and medicines remains \na distant goal, in particular vulnerable populations and destitute people, \n \nUnderlining that health is not just an end in itself, but is a means of reaching \nother targets under the Sustainable Development Goals of the 2030 Agenda for \nSustainable Development, and noting that investments in health contribute to \nsustainable, inclusive economic growth, social development, environmental \nprotection and the eradication of poverty and hunger, and to reducing inequality, and \nalso acknowledging the reciprocal benefits between the attainment of the health Goal \nand the achievement of all other Goals, \n \nRecognizing the commitment made in the 2030 Agenda to leave no one behind, \nand to endeavour to reach the furthest behind first, founded on the dignity of the \nhuman person and reflecting the principles of equality and non-discrimination, as well \nas to empower those who are vulnerable or in vulnerable situations and address their \nphysical and mental health needs which are reflected in the Agenda, including all \nchildren, youth, persons with disabilities, people living with HIV/AIDS, older \npersons, indigenous peoples, refugees and internally displaced persons and migrants, \n \nAffirming the primary responsibility of Member States to determine and promote \ntheir own path towards achieving universal health coverage that comprises universal \nand equitable access to quality health services and quality, essential, affordable and \neffective medicines for all, with particular attention to those who are vulnerable or in \nvulnerable situations, and that is critical to promote physical and mental health and \nwell-being, especially through primary health care, health services and social \n__________________ \n \n1 Resolution 217 A (III). \n \n2 See resolution 2200 A (XXI), annex. \n \n3 United Nations, Treaty Series, vol. 14, No. 221. \n \n4 Report of the Fourth World Conference on Women, Beijing, 4\u201315 September 1995 (United \nNations publication, Sales No. E.96.IV.13), chap. I, resolution 1, annex II. \n \n5 Report of the International Conference on Population and Development, Cairo, 5\u201313 September \n1994 (United Nations publication, Sales No. E.95.XIII.18), chap. I, resolution 1, annex. \n\nGlobal health and foreign policy: addressing the health \nof the most vulnerable for an inclusive society \nA/RES/72/139\n \n3/9 \n17-22392 \n \nprotection mechanisms, including through community outreach and private sector \nengagement, and with the support of the international community, \n \nRecognizing the importance of giving due consideration to all the rights of \nindigenous peoples, including the right to access, without any discrimination, all \nsocial and health services, and an equal right to the enjoyment of the highest attainable \nstandard of physical and mental health, \n \nUnderscoring the need for far-reaching partnerships for global health to support \nthe promotion of, inter alia, gender equality and women\u2019s empowerment and ensure \nuniversal access to sexual and reproductive health and women\u2019s and girls\u2019 full \nenjoyment of all human rights, so as to contribute to the eradication of poverty and to \neconomic and social development, including improved health outcomes, \n \nRecognizing that women and girls play a vital role as agents of development, \nand acknowledging that realizing gender equality and the empowerment of all women \nand girls is crucial to making progress across all Sustainable Development Goals and \ntargets, \n \nRecognizing also the essential contribution that older persons can continue to \nmake to the functioning of societies and towards the implementation of the 2030 \nAgenda if adequate guarantees are in place, and concerned that many health systems \nare not sufficiently prepared to respond to the needs of the rapidly ageing population, \nincluding the need for promotive, preventive, curative, palliative and specialized care, \n \nRecognizing further the positive contributions made by migrants to inclusive \ngrowth and sustainable development, and reaffirming the right of all refugees and \nmigrants to the enjoyment of the highest attainable standard of physical and mental \nhealth, \n \nRecognizing the special needs of people living in areas affected by complex \nhumanitarian emergencies, and expressing concern that the most vulnerable in areas \naffected by conflicts often have no or limited access to health services, and, moreover, \nthat attacks against medical personnel and facilities have immediate and long-term \nconsequences for health-care systems, \n \nUnderlining the urgency of having strong and resilient health systems, reaching \nthose who are vulnerable or in vulnerable situations, and capable of effectively \nimplementing the International Health Regulations (2005), 6 ensuring pandemic \npreparedness and the prevention and detection of and response to any outbreaks, \n \nRecognizing the challenge of antimicrobial resistance, which requires \nmultisectoral actions, and the importance of the political declaration of the high-level \nmeeting of the General Assembly on antimicrobial resistance, 7 including the report to \nbe submitted by the Secretary-General for consideration by Member States by the \nseventy-third session of the Assembly, \n \nUnderscoring the importance of motivated, well-trained and appropriately \nequipped health professionals and health workers in decent jobs, to build a sustained \nand resilient health system and contribute towards the achievement of sustainable \nuniversal health coverage and the protection of health workers during emergencies, \n \nRecalling the Rio Political Declaration on Social Determinants of Health, \nadopted at the 2011 World Conference on Social Determinants of Health, which \nreaffirmed that health inequities within and between countries are politically, socially \nand economically unacceptable, as well as unfair and largely avoidable, and noting \n__________________ \n \n6 World Health Organization, document WHA58/2005/REC/1, resolution 58.3, annex. \n \n7 Resolution 71/3. \n\nA/RES/72/139 \nGlobal health and foreign policy: addressing the health\nof the most vulnerable for an inclusive society\n \n17-22392 \n4/9 \n \nthat many of the underlying determinants of health and risk factors of communicable \nand non-communicable diseases are associated with social and economic conditions, \n \nRecognizing that coordinated health, social and economic policies are needed to \naddress the health of the most vulnerable and marginalized, who are often victims of \ninequity, inequality, discrimination, stigmatization, social exclusion and violence, and \nare the most exposed to health risk factors, owing mostly to their living conditions, \npoor health literacy and lack of access to health care and other relevant services, \n \nAcknowledging that the promotion of health equity and the elimination of stigma \nand discrimination in health-care settings are important for achieving the Sustainable \nDevelopment Goals and building a more inclusive society whereby those who are \nvulnerable or in vulnerable situations, especially women and girls, persons with \ndisabilities, persons living with mental health conditions or psychological disabilities, \nand those living with, at risk of or affected by HIV/AIDS, as well as tuberculosis, \ncholera and other diseases, will have a better quality of life and well-being, and in \nthis regard taking note of the joint United Nations statement on ending discrimination \nin health-care settings, \n \nNoting the significant role of the Foreign Policy and Global Health Initiative in \npromoting synergy between foreign policy and global health, as well as the \ncontribution of the Oslo Ministerial Declaration of 20 March 2007, entitled \u201cGlobal \nhealth: a pressing foreign policy issue of our time\u201d,8 which was reaffirmed, with \nrenewed actions and commitments, in the ministerial communiqu\u00e9 of the Initiative, \nentitled \u201cRenewing 10 years of concerted efforts and preparing for new challenges\u201d, \nof 22 September 2017,9 \n \nRecognizing the need to revitalize the global partnership for sustainable \ndevelopment, which engages all stakeholders, including the private sector, civil \nsociety, the United Nations system and other actors, to mobilize all necessary \nfinancial and non-financial means to collaboratively support the efforts of Member \nStates to achieve health-related Sustainable Development Goals, including addressing \nthe health needs of those who are vulnerable or in vulnerable situations, and \nunderscoring the importance of enhanced international cooperation and assistance to \nsupport the efforts of Member States to achieve health goals, implement universal \naccess to health services and address health challenges, while taking into account \ndifferent national circumstances and capacities and respecting national policies and \npriorities, \n \nEmphasizing the importance of seeking synergies and collaboration with other \nrelevant actors within and outside the United Nations system, such as the Global Fund \nto Fight AIDS, Tuberculosis and Malaria, the International Drug Purchase Facility, \nthe Gavi Alliance, the Global Polio Eradication Initiative, the Global Financing \nFacility in support of Every Woman, Every Child, the Drugs for Neglected Diseases \ninitiative, the World Bank, regional organizations, non-governmental organizations \nand the private sector, to address the health needs of the most vulnerable, \n \nUnderlining the importance of developing efficient and innovative approaches, \nincluding through the private sector, to address the health needs of the most \nvulnerable and to achieve universal health coverage, such as integrated community-\nbased and people-centred health services, health investment incentives and public-\nprivate partnerships to increase health financing and develop and train the health \nworkforce, and strengthening health capacity for early warning, risk reduction and \nmanagement of national and global health risks, \n__________________ \n \n8 A/63/591, annex. \n \n9 A/72/559, annex. \n\nGlobal health and foreign policy: addressing the health \nof the most vulnerable for an inclusive society \nA/RES/72/139\n \n5/9 \n17-22392 \n \n \nReaffirming the right to use, to the fullest extent, the provisions contained in the \nWorld Trade Organization Agreement on Trade-Related Aspects of Intellectual \nProperty Rights (TRIPS Agreement), which provides flexibilities for the protection \nof public health and promotes access to medicines for all, in particular for developing \ncountries, and the Doha Declaration on the TRIPS Agreement and Public Health, \nwhich recognizes that intellectual property protection is important for the \ndevelopment of new medicines and also recognizes the concerns about its effects on \nprices, \n \nRecognizing \nthat \nrapidly \nchanging \ntechnologies, \nparticularly \ndigital \ntechnologies, have the potential to enhance people\u2019s access to health services, \nimprove the responsiveness of the health system to the needs of individuals and \ncommunities and increase the quality and efficiency of health services, \n \nRecalling the political declaration of the high-level meeting of the General \nAssembly on the prevention and control of non-communicable diseases10 and the \noutcome document of the high-level meeting of the Assembly on the comprehensive \nreview and assessment of the progress achieved in the prevention and control of \nnon-communicable diseases,11 and looking forward to the high-level meeting of the \nAssembly on non-communicable diseases to be held in 2018, \n \nEmphasizing that the United Nations system has an important responsibility to \nassist Member States in the follow-up to and full implementation of agreements and \ncommitments reached at the major United Nations conferences and summits, \nespecially those focusing on health-related areas, \n \nEmphasizing also the primary role of the World Health Organization, as the \nUnited Nations specialized agency for health and the lead agency to support the \nimplementation of the International Health Regulations, in fostering coordination of \nglobal health interventions to strengthen health systems and build the capacities of its \nmember States in achieving better health outcomes, including through public health \nmeasures, health protection, including the international response to outbreaks and \nemergencies with health consequences, and health promotion, and addressing social, \neconomic, behavioural and environmental determinants of health, to promote physical \nand mental health and well-being for all at all ages, with special attention to \nimproving the health of the most vulnerable, \n \n1. \nWelcomes the note by the Secretary-General transmitting the report of the \nDirector General of the World Health Organization on the operationalization of the \nimmediate actions and five-year action plan of the High-level Commission on Health \nEmployment and Economic Growth and on global health and foreign policy, 12 and \nthe adoption by the World Health Assembly on 29 May 2017, at its seventieth session, \nof the five-year action plan for health employment and inclusive economic growth \n(2017\u20132021);13 \n \n2. \nReiterates the call for more attention to health, which is a state of \ncomplete, physical, mental and social well-being, as an important cross-cutting policy \nissue on the international agenda, as it is a precondition for and an outcome and \nindicator of all three dimensions of sustainable development, and for recognition that \nglobal health challenges require policy coherence across government and concerted, \nsustained and intersectoral efforts; \n \n3. \nUrges Member States to respect, protect and promote the right to the \nenjoyment of the highest attainable standard of physical and mental health, with \n__________________ \n \n10 Resolution 66/2, annex. \n \n11 Resolution 68/300. \n \n12 A/72/378. \n \n13  World Health Organization, document WHA70/2017/REC/1, annex 2. \n\nA/RES/72/139 \nGlobal health and foreign policy: addressing the health\nof the most vulnerable for an inclusive society\n \n17-22392 \n6/9 \n \nparticular attention given to the health needs of the most vulnerable, and to consider \nhealth in a holistic manner, including in the formulation of foreign policy; \n \n4. \nNotes with appreciation the work of the Global Health Crises Task Force, \nconcluded in July 2017, to support and monitor the implementation of \nrecommendations contained in the report of the High-level Panel on the Global \nResponse to Health Crises,14 and the level 3 activation procedures for infectious \ndisease events, for humanitarian actors in large-scale infectious disease events in \nhumanitarian contexts, endorsed in December 2016, and requests the Secretary-General \nto provide periodic updates on the recommendations of the Global Health Crises Task \nForce, in close consultation with the Director General of the World Health Organization, \nwith a special focus on preparedness for and the prevention of health crises; \n \n5. \nCalls upon Member States and the United Nations system to urgently and \neffectively assist countries affected by the cholera epidemic in the strengthening of \ntheir national health, water and sanitation systems in order to eliminate cholera; \n \n6. \nCalls upon Member States to accelerate progress towards the goal of \nuniversal health coverage, which implies that all people have equal access, without \ndiscrimination of any kind, to nationally determined sets of quality promotive, \npreventive, curative, rehabilitative and palliative basic health services needed and \nessential, safe, affordable, effective and quality medicines, while ensuring that the \nuse of such services and medicines does not expose the users to financial hardship, \nwith a specific emphasis on the poor, vulnerable and marginalized segments of the \npopulation; \n \n7. \nEncourages Member States to promote the effective, full and meaningful \nparticipation of all, in particular those who are vulnerable or in vulnerable situations, \nin the design, implementation and monitoring of law, policies and programmes \nrelevant to realizing the right of everyone to the enjoyment of the highest attainable \nstandard of physical and mental health and to implementing the health-related \nSustainable Development Goals, including strategies for universal health coverage; \n \n8. \nCalls upon the international community and global health partners, as well \nas regional and national stakeholders, to support Member States in carrying out their \nprimary responsibilities to accelerate the transition towards universal health coverage, \nand tackle social, economic and environmental determinants of health, as well as \ndemographic challenges, including population ageing, provide social protection and \nadopt integrated, people-centred, community-based and gender-responsive health \nservices based on human rights, which will help to empower those who are vulnerable \nor in vulnerable situations, enhance health equity and equality, end discrimination and \ncreate a more inclusive society; \n \n9. \nNotes that challenges in global health still remain and demand persistent \nattention and that this urgently requires the fulfilment of commitments to strengthen \nthe global partnership for development, and emphasizes in particular in this regard \nNorth-South cooperation, the importance of South-South and triangular cooperation \nand the exchange of best practices, as well as capacity-building and the transfer of \ntechnology on mutually agreed terms, to address health inequities in the context of \npoverty eradication and sustainable development, in line with national priorities; \n \n10. Encourages Member States to secure sustainable financing for health \nresearch and development on emerging and re-emerging diseases, neglected tropical \ndiseases, non-communicable diseases, including cancers and mental health, and \nantimicrobials, promote safe, affordable, effective and quality medicines, including \nantimicrobials and traditional medicines, and vaccines, enhance access to health \n__________________ \n \n14 A/70/723. \n\nGlobal health and foreign policy: addressing the health \nof the most vulnerable for an inclusive society \nA/RES/72/139\n \n7/9 \n17-22392 \n \nproducts, therapies and medical devices, and promote preventive and treatment \ninterventions and diagnostics for all those in need, in particular for the most \nvulnerable; \n \n11. \nCalls upon Member States to promote and strengthen, as appropriate, their \ndialogue with other stakeholders, including civil society, academia and the private \nsector, in order to maximize their engagement in and contribution to the \nimplementation of health goals and targets through an intersectoral and \nmulti-stakeholder approach, while at the same time safeguarding public health \ninterests from undue influence by any form of real, perceived or potential conflict of \ninterest, through the management of risk, the strengthening of due diligence and \naccountability, the promotion of policy coherence and an increase in the transparency \nof engagement; \n \n12. Encourages the development of innovative and sustainable mechanisms to \nensure necessary and sustained health financing and enhance international \ncoordination and an enabling environment at all levels to strengthen health systems, \nand promote universal access to quality health services, including through \npartnerships with civil society and the private sector; \n \n13. Encourages Governments, the United Nations system, civil society, local \ncommunities, the private sector and other stakeholders to scale up efforts on an urgent \nbasis to achieve the goals of the Joint United Nations Programme on HIV/AIDS \n2016\u20132021 Strategy and the 2016 Political Declaration on HIV and AIDS: On the \nFast Track to Accelerating the Fight against HIV and to Ending the AIDS Epidemic \nby 203015 as an important prerequisite and enabler for the achievement of the \nSustainable Development Goals, while recognizing the critical importance of the \nJoint United Nations Programme on HIV/AIDS in actively contributing to and \nengaging in the follow-up and review process with respect to progress on the 2030 \nAgenda for Sustainable Development;16 \n \n14. Urges Member States to ensure universal access to sexual and reproductive \nhealth and reproductive rights, as agreed in accordance with the Programme of Action \nof the International Conference on Population and Development5 and the Beijing \nPlatform for Action4 and the outcome documents of their review conferences; \n \n15. Notes with appreciation the framework of priorities and guiding principles \nto promote the health of refugees and migrants prepared by the World Health \nOrganization, and invites all Member States, in accordance with their national \ncontexts, priorities and legal frameworks, to take into account the crucial importance \nof addressing the physical and mental health needs of refugees, migrants and their \nfamilies in the development of a global compact on refugees and a global compact \nfor safe, orderly and regular migration; \n \n16. Urges Member States to develop, implement and evaluate policies and \nprogrammes that promote healthy and active ageing and the highest attainable \nstandard of health and well-being for older persons, and to develop health care for \nolder persons as part of primary care in the existing national health systems; \n \n17. Calls upon all Member States to tackle health inequities and inequalities \nwithin and across countries through political commitment and national policies that \naddress social, economic and environmental determinants of health, including \nthrough health promotion, disease prevention and health care, and promoting \navailability of and access to goods and services essential to health and well-being; \n__________________ \n \n15 Resolution 70/266, annex. \n \n16 Resolution 70/1. \n\nA/RES/72/139 \nGlobal health and foreign policy: addressing the health\nof the most vulnerable for an inclusive society\n \n17-22392 \n8/9 \n \n \n18. Reiterates the call upon Member States to make greater investments in and \npromote decent work with adequate remuneration in the health and social sectors, \nenable safe working environments and conditions, effective retention and equitable \nand broad distribution of the health workforce, and strengthen capacities to optimize \nthe existing health workforce, including by expanding rural and community-based \nhealth education and training and strengthening health professional education in both \nthe institutional and instructional dimensions, to create a more effective and socially \naccountable health workforce; \n \n19. Urges Member States to reinforce the protection of medical personnel and \nhumanitarian personnel exclusively engaged in medical duties, their means of \ntransport and equipment, and hospitals and other medical facilities, especially in \narmed conflict, consistent with their specific obligations under international \nhumanitarian law, recognizing the need to enhance the protection of medical missions \nin order to support the restoration and provision of essential health-care services to \nensure that physical and mental health needs are met for civilians affected by conflict, \nin particular for women and children; \n \n20. Encourages greater coherence and coordination among United Nations \nbodies, specialized agencies and entities on matters related to global health and \nforeign policy, including through the consideration, where appropriate, of related \nactions; \n \n21. Requests the Secretary-General, in close collaboration with the World \nHealth Organization, development partners and other relevant initiatives, such as the \nInternational Health Partnership for UHC2030, to provide support to Member States, \nespecially through technical assistance and capacity-building programmes, for the \ndevelopment and strengthening of the sustainability of universal health coverage at \nthe national level with the aim of promoting access to health services for the most \nvulnerable; \n \n22. Welcomes the convening of the World Health Organization First Global \nMinisterial Conference on Ending Tuberculosis in the Sustainable Development Era: \nA Multisectoral Response, held in Moscow on 16 and 17 November 2017, and takes \nnote with appreciation of its outcome, which forms part of the way towards the high-\nlevel meeting of the General Assembly on tuberculosis to be held in 2018; \n \n23. Also welcomes the convening of the World Health Organization Global \nConference on Non-Communicable Diseases: Enhancing Policy Coherence between \nDifferent Spheres of Policymaking That Have a Bearing on Attaining Sustainable \nDevelopment Goal Target 3.4 on Non-Communicable Diseases by 2030, held in \nMontevideo from 18 to 20 October 2017, as part of the preparations for the high-level \nmeeting of the General Assembly on the comprehensive review and assessment of the \nprogress achieved in the prevention and control of non-communicable diseases; \n \n24. Decides to hold a high-level meeting in 2019 on universal health coverage, \nand requests the President of the General Assembly, in close collaboration with the \nDirector General of the World Health Organization and in consultation with Member \nStates, to propose options and modalities for the conduct of such a meeting, with a \nview to ensuring the most effective and efficient outcomes, including potential \ndeliverables, complementing and building on existing efforts in this regard, before \nthe end of the seventy-second session; \n \n25. Requests the Secretary-General, in close collaboration with the Director \nGeneral of the World Health Organization as well as other relevant international \norganizations, to report to the General Assembly at its seventy-third session, under \nthe item entitled \u201cGlobal health and foreign policy\u201d, on improving international \n\nGlobal health and foreign policy: addressing the health \nof the most vulnerable for an inclusive society \nA/RES/72/139\n \n9/9 \n17-22392 \n \ncoordination and cooperation to address the health needs of the most vulnerable for \nthe achievement of the Sustainable Development Goals. \n \n72nd plenary meeting  \n12 December 2017 \n \n",
  "paragraphs": {
    "1": "Welcomes the note by the Secretary-General transmitting the report of the Director General of the World Health Organization on the operationalization of the immediate actions and five-year action plan of the High-level Commission on Health Employment and Economic Growth and on global health and foreign policy, 12 and the adoption by the World Health Assembly on 29 May 2017, at its seventieth session, of the five-year action plan for health employment and inclusive economic growth (2017\u20132021);13",
    "2": "Reiterates the call for more attention to health, which is a state of complete, physical, mental and social well-being, as an important cross-cutting policy issue on the international agenda, as it is a precondition for and an outcome and indicator of all three dimensions of sustainable development, and for recognition that global health challenges require policy coherence across government and concerted, sustained and intersectoral efforts;",
    "3": "Urges Member States to respect, protect and promote the right to the enjoyment of the highest attainable standard of physical and mental health, with particular attention given to the health needs of the most vulnerable, and to consider health in a holistic manner, including in the formulation of foreign policy;",
    "4": "Notes with appreciation the work of the Global Health Crises Task Force, concluded in July 2017, to support and monitor the implementation of recommendations contained in the report of the High-level Panel on the Global Response to Health Crises,14 and the level 3 activation procedures for infectious disease events, for humanitarian actors in large-scale infectious disease events in humanitarian contexts, endorsed in December 2016, and requests the Secretary-General to provide periodic updates on the recommendations of the Global Health Crises Task Force, in close consultation with the Director General of the World Health Organization, with a special focus on preparedness for and the prevention of health crises;",
    "5": "Calls upon Member States and the United Nations system to urgently and effectively assist countries affected by the cholera epidemic in the strengthening of their national health, water and sanitation systems in order to eliminate cholera;",
    "6": "Calls upon Member States to accelerate progress towards the goal of universal health coverage, which implies that all people have equal access, without discrimination of any kind, to nationally determined sets of quality promotive, preventive, curative, rehabilitative and palliative basic health services needed and essential, safe, affordable, effective and quality medicines, while ensuring that the use of such services and medicines does not expose the users to financial hardship, with a specific emphasis on the poor, vulnerable and marginalized segments of the population;",
    "7": "Encourages Member States to promote the effective, full and meaningful participation of all, in particular those who are vulnerable or in vulnerable situations, in the design, implementation and monitoring of law, policies and programmes relevant to realizing the right of everyone to the enjoyment of the highest attainable standard of physical and mental health and to implementing the health-related Sustainable Development Goals, including strategies for universal health coverage;",
    "8": "Calls upon the international community and global health partners, as well as regional and national stakeholders, to support Member States in carrying out their primary responsibilities to accelerate the transition towards universal health coverage, and tackle social, economic and environmental determinants of health, as well as demographic challenges, including population ageing, provide social protection and adopt integrated, people-centred, community-based and gender-responsive health services based on human rights, which will help to empower those who are vulnerable or in vulnerable situations, enhance health equity and equality, end discrimination and create a more inclusive society;",
    "9": "Notes that challenges in global health still remain and demand persistent attention and that this urgently requires the fulfilment of commitments to strengthen the global partnership for development, and emphasizes in particular in this regard North-South cooperation, the importance of South-South and triangular cooperation and the exchange of best practices, as well as capacity-building and the transfer of technology on mutually agreed terms, to address health inequities in the context of poverty eradication and sustainable development, in line with national priorities;",
    "10": "Encourages Member States to secure sustainable financing for health research and development on emerging and re-emerging diseases, neglected tropical diseases, non-communicable diseases, including cancers and mental health, and antimicrobials, promote safe, affordable, effective and quality medicines, including antimicrobials and traditional medicines, and vaccines, enhance access to health products, therapies and medical devices, and promote preventive and treatment interventions and diagnostics for all those in need, in particular for the most vulnerable;",
    "11": "Calls upon Member States to promote and strengthen, as appropriate, their dialogue with other stakeholders, including civil society, academia and the private sector, in order to maximize their engagement in and contribution to the implementation of health goals and targets through an intersectoral and multi-stakeholder approach, while at the same time safeguarding public health interests from undue influence by any form of real, perceived or potential conflict of interest, through the management of risk, the strengthening of due diligence and accountability, the promotion of policy coherence and an increase in the transparency of engagement;",
    "12": "Encourages the development of innovative and sustainable mechanisms to ensure necessary and sustained health financing and enhance international coordination and an enabling environment at all levels to strengthen health systems, and promote universal access to quality health services, including through partnerships with civil society and the private sector;",
    "13": "Encourages Governments, the United Nations system, civil society, local communities, the private sector and other stakeholders to scale up efforts on an urgent basis to achieve the goals of the Joint United Nations Programme on HIV/AIDS 2016\u20132021 Strategy and the 2016 Political Declaration on HIV and AIDS: On the Fast Track to Accelerating the Fight against HIV and to Ending the AIDS Epidemic by 203015 as an important prerequisite and enabler for the achievement of the Sustainable Development Goals, while recognizing the critical importance of the Joint United Nations Programme on HIV/AIDS in actively contributing to and engaging in the follow-up and review process with respect to progress on the 2030 Agenda for Sustainable Development;16",
    "14": "Urges Member States to ensure universal access to sexual and reproductive health and reproductive rights, as agreed in accordance with the Programme of Action of the International Conference on Population and Development5 and the Beijing Platform for Action4 and the outcome documents of their review conferences;",
    "15": "Notes with appreciation the framework of priorities and guiding principles to promote the health of refugees and migrants prepared by the World Health Organization, and invites all Member States, in accordance with their national contexts, priorities and legal frameworks, to take into account the crucial importance of addressing the physical and mental health needs of refugees, migrants and their families in the development of a global compact on refugees and a global compact for safe, orderly and regular migration;",
    "16": "Urges Member States to develop, implement and evaluate policies and programmes that promote healthy and active ageing and the highest attainable standard of health and well-being for older persons, and to develop health care for older persons as part of primary care in the existing national health systems;",
    "17": "Calls upon all Member States to tackle health inequities and inequalities within and across countries through political commitment and national policies that address social, economic and environmental determinants of health, including through health promotion, disease prevention and health care, and promoting availability of and access to goods and services essential to health and well-being;",
    "18": "Reiterates the call upon Member States to make greater investments in and promote decent work with adequate remuneration in the health and social sectors, enable safe working environments and conditions, effective retention and equitable and broad distribution of the health workforce, and strengthen capacities to optimize the existing health workforce, including by expanding rural and community-based health education and training and strengthening health professional education in both the institutional and instructional dimensions, to create a more effective and socially accountable health workforce;",
    "19": "Urges Member States to reinforce the protection of medical personnel and humanitarian personnel exclusively engaged in medical duties, their means of transport and equipment, and hospitals and other medical facilities, especially in armed conflict, consistent with their specific obligations under international humanitarian law, recognizing the need to enhance the protection of medical missions in order to support the restoration and provision of essential health-care services to ensure that physical and mental health needs are met for civilians affected by conflict, in particular for women and children;",
    "20": "Encourages greater coherence and coordination among United Nations bodies, specialized agencies and entities on matters related to global health and foreign policy, including through the consideration, where appropriate, of related actions;",
    "21": "Requests the Secretary-General, in close collaboration with the World Health Organization, development partners and other relevant initiatives, such as the International Health Partnership for UHC2030, to provide support to Member States, especially through technical assistance and capacity-building programmes, for the development and strengthening of the sustainability of universal health coverage at the national level with the aim of promoting access to health services for the most vulnerable;",
    "22": "Welcomes the convening of the World Health Organization First Global Ministerial Conference on Ending Tuberculosis in the Sustainable Development Era: A Multisectoral Response, held in Moscow on 16 and 17 November 2017, and takes note with appreciation of its outcome, which forms part of the way towards the high- level meeting of the General Assembly on tuberculosis to be held in 2018;",
    "23": "Also welcomes the convening of the World Health Organization Global Conference on Non-Communicable Diseases: Enhancing Policy Coherence between Different Spheres of Policymaking That Have a Bearing on Attaining Sustainable Development Goal Target 3.4 on Non-Communicable Diseases by 2030, held in Montevideo from 18 to 20 October 2017, as part of the preparations for the high-level meeting of the General Assembly on the comprehensive review and assessment of the progress achieved in the prevention and control of non-communicable diseases;",
    "24": "Decides to hold a high-level meeting in 2019 on universal health coverage, and requests the President of the General Assembly, in close collaboration with the Director General of the World Health Organization and in consultation with Member States, to propose options and modalities for the conduct of such a meeting, with a view to ensuring the most effective and efficient outcomes, including potential deliverables, complementing and building on existing efforts in this regard, before the end of the seventy-second session;",
    "25": " coordination and cooperation to address the health needs of the most vulnerable for the achievement of the Sustainable Development Goals."
  },
  "agenda_items": [
    "Item 127"
  ],
  "symbol_references": [
    "A/72/L.28"
  ]
}