{
  "symbol": "A/RES/78/145",
  "filename": "A_RES_78_145.pdf",
  "title": "78/145. Sustainable and resilient tourism and sustainable development in Central America and the Dominican Republic",
  "text": "United Nations \nA/RES/78/145\n \n \nGeneral Assembly \nDistr.: General \n21 December 2023 \n \n23-25923 (E)    020124     \n*2325923* \n \n \nSeventy-eighth session \nAgenda item 18 \nSustainable development \n \n \n \n \n Resolution adopted by the General Assembly \non 19 December 2023 \n \n \n \n \n[on the report of the Second Committee (A/78/461, para. 53)] \n \n \n 78/145. Sustainable and resilient tourism and sustainable development \nin Central America and the Dominican Republic \n \n \n \nThe General Assembly, \n \nRecalling its resolutions 68/207 of 20 December 2013, 70/196 of 22 December \n2015, 72/214 of 20 December 2017, 74/211 of 19 December 2019 and 76/201 of \n17 December 2021, and all relevant declarations and conferences on this matter, \n \nReaffirming its resolution 70/1 of 25 September 2015, entitled \u201cTransforming \nour world: the 2030 Agenda for Sustainable Development\u201d, in which it adopted a \ncomprehensive, far-reaching and people-centred set of universal and transformative \nSustainable Development Goals and targets, its commitment to working tirelessly for \nthe full implementation of the Agenda by 2030, its recognition that eradicating \npoverty in all its forms and dimensions, including extreme poverty, is the greatest \nglobal challenge and an indispensable requirement for sustainable development, its \ncommitment to achieving sustainable development in its three dimensions \u2013 \neconomic, social and environmental \u2013 in a balanced and integrated manner, and to \nbuilding upon the achievements of the Millennium Development Goals and seeking \nto address their unfinished business, \n \nReaffirming also its resolution 69/313 of 27 July 2015 on the Addis Ababa \nAction Agenda of the Third International Conference on Financing for Development, \nwhich is an integral part of the 2030 Agenda for Sustainable Development, supports \nand complements it, helps to contextualize its means of implementation targets with \nconcrete policies and actions, and reaffirms the strong political commitment to \naddress the challenge of financing and creating an enabling environment at all levels \nfor sustainable development in the spirit of global partnership and solidarity, \n\nA/RES/78/145 \nSustainable and resilient tourism and sustainable development \nin Central America and the Dominican Republic\n \n23-25923\n2/10 \n \n \nReaffirming further the Paris Agreement,1 encouraging all its parties to fully \nimplement the Agreement, and parties to the United Nations Framework Convention \non Climate Change 2  that have not yet done so to deposit their instruments of \nratification, acceptance, approval or accession, where appropriate, as soon as \npossible, \n \nRecalling the New Urban Agenda, adopted at the United Nations Conference on \nHousing and Sustainable Urban Development (Habitat III), held in Quito from 17 to \n20 October 2016,3 which recognized the commitment to sustain and support urban \neconomies to transition progressively to higher productivity through high-value-\nadded sectors, including through the promotion of cultural and creative industries, \nsustainable tourism, performing arts and heritage conservation activities, among \nothers, \n \nRecalling also the Sendai Declaration and the Sendai Framework for Disaster \nRisk Reduction 2015\u20132030,4 adopted at the Third United Nations World Conference \non Disaster Risk Reduction, the latter of which, inter alia, recognized the need to \npromote and integrate disaster risk management approaches throughout the tourism \nindustry, given the often heavy reliance on tourism as a key economic driver,  \n \nWelcoming the Kunming-Montreal Global Biodiversity Framework, adopted at \nthe fifteenth meeting of the Conference of the Parties to the Convention on Biological \nDiversity, and calls for its timely implementation, \n \nWelcoming also the convening of the United Nations Conference on the Midterm \nComprehensive Review of the Implementation of the Objectives of the International \nDecade for Action, \u201cWater for Sustainable Development\u201d, 2018\u20132028, from 22 to \n24 March 2023, \n \nLooking forward to the third United Nations Ocean Conference, to be co-hosted \nby Costa Rica and France and to be held in Nice, France, in June 2025,  \n \nRecalling its resolution 77/178 of 14 December 2022 on the promotion of \nsustainable and resilient tourism, including ecotourism, for poverty eradication and \nenvironmental protection, and its resolution 77/269 of 6 February 2023, in which it \nproclaimed 17 February as Global Tourism Resilience Day, \n \nWelcoming the decision by the United Nations Environment Assembly at its \nresumed fifth session, in its resolution 5/14 of 2 March 2022, 5  to convene an \nintergovernmental negotiating committee to develop an international legally binding \ninstrument on plastic pollution, including in the marine environment,  \n \nTaking note of the Global Tourism Plastics Initiative and its role in accelerating \nclimate action and advancing the tourism sector towards a sustained, sustainable and \nresilient economic growth pathway, while acknowledging the efforts that are being \nundertaken by countries in the Central American Integration System region to combat \nplastic pollution,  \n \nRecalling its resolution 77/282 of 26 April 2023 on building global resilience \nand promoting sustainable development through regional and interregional \ninfrastructure connectivity, in which it emphasized that infrastructure impacts the \nattainment of the Sustainable Development Goals, and stressing the importance of \n__________________ \n \n1  Adopted under the UNFCCC in FCCC/CP/2015/10/Add.1, decision 1/CP.21. \n \n2  United Nations, Treaty Series, vol. 1771, No. 30822. \n \n3  Resolution 71/256, annex. \n \n4  Resolution 69/283, annexes I and II. \n \n5  UNEP/EA.5/Res.14. \n\nSustainable and resilient tourism and sustainable development  \nin Central America and the Dominican Republic \nA/RES/78/145\n \n3/10\n23-25923 \n \nquality, reliable, sustainable and resilient infrastructure for addressing the \ninterconnected social, economic and environmental challenges,  \n \nWelcoming the holding of the high-level thematic debate on tourism on the \ntheme \u201cPutting sustainable and resilient tourism at the heart of an inclusive recovery\u201d, \nconvened by the President of the General Assembly in May 2022, in collaboration \nwith the World Tourism Organization, as an important milestone to work towards a \nconcerted approach on tourism at the highest level, within the United Nations system, \n \nRecognizing the important cross-cutting role of sustainable tourism as a positive \ncontribution to the three dimensions of sustainable development and the achievement \nof the Sustainable Development Goals, including the eradication of poverty, with a \nfocus on ecotourism, rural tourism, community-based tourism and micro-, small and \nmedium-sized enterprises, the generation of trade opportunities, the creation of decent \njobs, protection of the environment, improvement of quality of life, and advancement \nof social inclusion, gender equality and the empowerment of women and girls, \nespecially in developing countries,  \n \nNoting in this regard the role of the Central American Integration System, 6 \nthrough the Central American Tourism Integration Secretariat, and the Central \nAmerican Tourism Council in the promotion of sustainable tourism in the region, \n \nCommending the ongoing efforts of the Governments of the States members of \nthe Central American Integration System, in coordination with the Central American \nCommission on Environment and Development and in cooperation with the World \nTourism Organization, in the implementation of existing and new programmes \ndesigned to launch and promote sustainable tourism throughout the region, \n \nAcknowledging that tourism is among the economic sectors hardest hit by the \ncoronavirus disease (COVID-19) pandemic, and stressing that the challenges require \ncomprehensive solutions and international collaboration which contribute to \nstrengthening policies and financial support needed to sustain the livelihoods \ndependent on the sector, reduce inequalities, eradicate poverty and safeguard the \nbenefits of tourism, including coastal and rural tourism, in order to promote a more \nsustainable tourism model based on social inclusion and the conservation and \nprotection of the environment, \n \nTaking note of the World Tourism Organization World Tourism Barometer of \nSeptember 2023, which highlights that international tourism is expected to continue \nits recovery backed by strong travel demand, that the latest World Tourism \nOrganization data show that the recovery has continued in 2023, with an estimated \n700 million tourists travelling internationally between January and July 2023, about \n43 per cent more than in the same period of 2022, and noting, however, that it was \nmentioned in the World Tourism Barometer of May 2023 that, according to experts, \nthe economic environment continues to be the main factor weighing on the recovery \nof international tourism,  \n \nNoting with concern that, owing to its geographical location and its geological \nand hydrometeorological characteristics, Central America is a region prone and \nvulnerable to natural hazards, including those that are climate-related, which have \nresulted in disasters causing substantial human and economic losses, including \nimpacts on gross domestic product per capita, income, and poverty reduction,  \n \nRecognizing that the Central American Integration System region contains \nsignificant natural resources and that its rich biodiversity provides invaluable benefits \nto its populations and to its countries\u2019 economies, and noting that sustainable tourism \n__________________ \n \n6  The membership of the Central American Integration System includes Belize, Costa Rica, the \nDominican Republic, El Salvador, Guatemala, Honduras, Nicaragua and Panama. \n\nA/RES/78/145 \nSustainable and resilient tourism and sustainable development \nin Central America and the Dominican Republic\n \n23-25923\n4/10 \n \ncan contribute directly to the conservation of ecosystems through a variety of \nactivities and by raising awareness of the importance of biodiversity and, in this \nregard, that the States members of the Central American Integration System are \nimproving their institutional and policy frameworks, strategies and action plans, \n \nNoting the role of the World Tourism Organization as a member of the informal \nadvisory group on mainstreaming biodiversity, which is tasked with supporting the \nExecutive Secretary and the Bureau of the Conference of the Parties to the Convention \non Biological Diversity,  \n \nAcknowledging the importance of ongoing actions to accelerate the shift towards \nsustainable consumption and production7 in the tourism sector while contributing to \nsustainable development and resilient societies, \n \nStressing the importance of the tourism sector becoming more sustainable, \nresilient, digital and accessible, while stressing the need to close the digital divides, \nboth between and within countries and including the rural-urban, youth-older persons \nand gender digital divides, and to harness information and communications \ntechnologies for development, and recalling the need to emphasize quality and \naffordability of access to bridge digital and knowledge divides, and improve digital \nliteracy using a multidimensional approach that includes speed, stability, \naffordability, language, training, capacity-building, local content and accessibility for \npersons with disabilities,  \n \nRecalling its resolution 70/193 of 22 December 2015, entitled \u201cInternational \nYear of Sustainable Tourism for Development, 2017\u201d, noting the efforts and \ninitiatives taken to celebrate the Year, with a view to creating awareness of the \nimportant contribution of tourism to sustainable development while promoting the \nexchange of good practices, knowledge and experiences, as well as increased cross-\nborder collaboration by developing joint ventures to increase the synergies of tourism, \nincluding the sharing of tourism-related data and statistics, as appropriate, and noting \nthe report of the Secretary-General on the proclamation of 2017 as the International \nYear of Sustainable Tourism for Development, 8  and recalling also its resolution \n74/198 of 19 December 2019, entitled \u201cInternational Year of Creative Economy for \nSustainable Development, 2021\u201d, \n \nRecognizing the importance of promoting tourism product development by \nIndigenous Peoples and local communities in order to support their economic \ndevelopment and participation in trade while protecting natural environments and \ncultural traditions, \n \nStressing the need for responsible tourism and for its beneficial socioeconomic \nimpact on local communities, the economic empowerment of women through tourism, \nfair tourism, the protection of women, children and people in vulnerable situations \nagainst all forms of exploitation in tourism, the prevention of trafficking in persons \nand trafficking in cultural artefacts, respect for intangible cultural heritage and \ncultural and natural sites, the protection of tourists as consumers and the provision of \nunbiased information to tourists, \n \nNoting the existing joint initiatives designed and implemented to stimulate \nregional tourism integration and to foster the development of Indigenous and local \ncommunities, such as the Mayan World regional brand, \n \nRecalling the outcomes of the Forum on Sustainable Tourism and Climate \nChange in Central America, held from 21 to 24 September 2023 in La Ceiba, \nHonduras, the outcomes adopted at the 126th meeting of the Central American \n__________________ \n \n7  In accordance with United Nations Environment Assembly resolution 4/1 (UNEP/EA.4/Res.1). \n \n8  A/73/283. \n\nSustainable and resilient tourism and sustainable development  \nin Central America and the Dominican Republic \nA/RES/78/145\n \n5/10\n23-25923 \n \nTourism Council, held in San Salvador on 30 August 2023, the twenty-second Forum \nfor the Development of Tourism Integration of Central America and the Caribbean, \nheld in San Salvador on 28 September 2022, and the declaration of the fifteenth forum \non the development of tourism and on the harmonization of efforts to promote tourism \nin Central America and the Dominican Republic, held in Guatemala City on 27 August \n2014, and looks forward to the second Social, Solidarity and Sustainable Tourism \nForum, to be held with the support of the International Social Tourism Organization, \n \nRecalling also the twenty-fourth session of the General Assembly of the World \nTourism Organization, held in Madrid from 30 November to 3 December 2021, and \nwelcoming its twenty-fifth session, held in Samarkand, Uzbekistan, from 16 to \n20 October 2023, \n \nEmphasizing that rebuilding tourism after the disruption caused by the \nCOVID-19 pandemic is an opportunity for transformation, with a focus on leveraging \nits impact on destinations, fostering community-based models and building more \nsustainable, resilient and inclusive communities and businesses through innovation \nand public-private partnerships to foster investments in sustainable travel and \ninfrastructure, targeted training and human resources development,  \n \n1. \nTakes note of the report of the Secretary-General on sustainable tourism \nand sustainable development in Central America;9 \n \n2. \nRecognizes the major role that sustainable and resilient tourism plays in \nadvancing towards the achievement of sustainable development of the States \nmembers of the Central American Integration System, as an instrument of social \ninclusion that generates decent jobs and entrepreneurship opportunities, contributing \nto inclusive economic growth and the improvement of the quality of life of the \npopulation, aimed at achieving poverty eradication in all its forms and dimensions, \nand that it contributes to the promotion of climate resilience, environmental \nsustainability and disaster risk management in tourist activities and destinations; \n \n3. \nEmphasizes, taking into account the fact that the tourism sector is \nvulnerable to natural hazards and disasters, including those that are climate-related, \nthe need to foster resilient tourism development in the Central American Integration \nSystem region, including through national strategies for rehabilitation aftershocks, \nclimate change adaptation and disaster risk reduction plans and public-private \npartnerships;  \n \n4. \nRecognizes that since the adoption of resolution 76/201 in 2021, despite \nthe many challenges they have faced owing to the COVID-19 pandemic, Central \nAmerica and the Dominican Republic have shown numerous positive developments, \ninitiatives and efforts to promote sustainable tourism and sustainable development, \nmaking significant progress towards recovery and enhancing resilience, recognizing \nthe implementation of policies at the national level, and employing an integrated and \nholistic approach for the promotion of sustainable tourism and sustainable \ndevelopment to generate benefits in the social, economic and environmental pillars; \n \n5. \nEncourages strategic actions and accelerators to address the impacts of the \nCOVID-19 pandemic on sustainable development and to promote a sustainable \nrecovery in the tourism sector, through global and regional political action and \ncoordination to mitigate the effects of the pandemic and support the recovery \ntherefrom, which will require substantial financial efforts to rebuild a more resilient, \ndiversified, inclusive and sustainable tourism sector; \n \n6. \nRecalls the adoption of the principles of sustainable tourism, developed by \nthe Central American Tourism Integration Secretariat and found in its strategic plan \n__________________ \n \n9  A/78/210. \n\nA/RES/78/145 \nSustainable and resilient tourism and sustainable development \nin Central America and the Dominican Republic\n \n23-25923\n6/10 \n \nfor sustainable tourism development, 2021\u20132025, which captures the region\u2019s vision \nof itself as an integrated, sustainable, multi-location, cross-border destination of high \nquality and emphasizes its action plan for tourism and climate change as a component \nof the regional strategy on climate change; \n \n7. \nRecognizes that the tourism sector has been a catalyst for achieving \nsustainable development in its three dimensions in Central America and the \nDominican Republic, including addressing environmental issues, in particular climate \nchange, poverty eradication and economic development, highlighting the importance \nof strengthening appropriate policies and financial support within a broader \nframework of sustainable development policies and of adopting a comprehensive, \nmultisectoral approach for the sustainable development of tourism; \n \n8. \nEncourages regional and national tourism organizations to promote \ndestination models that seek the highest possible direct benefits for local and national \neconomies, in order to contribute to improving quality of life and reducing poverty in \nlocal communities, taking into account the integration of sustainability policies in the \ntourism sector, and invites all stakeholders to identify, assess and mitigate the impacts \nof tourism on the three dimensions of sustainable development; \n \n9. \nStresses the importance of biocultural heritage, endogenous development, \nscientific research and replicable models to promote sustainable, community-based, \nrural and local tourism activities for the benefit of people and nature, in close \ncollaboration with Indigenous Peoples and youth, as a priority for the Central \nAmerican Integration System region, recognizes that some countries in the region are \ndeveloping new and innovative models, such as the tourism, conservation and \nsustainable livelihoods model, and also recognizes the importance of strengthening \nefforts to protect and safeguard the world\u2019s cultural and natural heritage, as well as \npromoting the participation of Indigenous Peoples and local communities in the \nprotection of cultural and traditional knowledge and practices for the achievement of \na more sustainable tourism sector; \n \n10. Recognizes the valuable role of international cooperation with relevant \npartners, and encourages them to continue to support the implementation of various \nprojects aimed at promoting sustainable tourism in the region by, inter alia, \nstrengthening ecotourism, rural, cultural and heritage tourism, including colonial \nsites, preventing trafficking in cultural artefacts and ensuring respect for intangible \ncultural heritage and cultural and natural sites; \n \n11. \nEncourages Member States and relevant stakeholders to support \ncooperatives, community-based organizations and micro-, small and medium-sized \nenterprises with initiatives towards achieving a stronger business environment, \ntechnical assistance, institutional networking and capacity-building and by enhancing \ninstitutional coherence policy that supports funding mechanisms and initiatives for \npoverty eradication programmes and projects;  \n \n12. Welcomes the progress made by the States members of the Central \nAmerican Integration System in converging towards a regional tourism strategy based \non preserving the region\u2019s biodiversity and natural and cultural attractions and \nreducing poverty through employment and entrepreneurial tourism development that \nemphasizes micro-, small and medium-sized enterprises, while addressing the adverse \neffects of climate change, to improve the quality of life of the region\u2019s inhabitants; \n \n13. Appreciates the continued efforts of the States members of the Central \nAmerican Integration System to support sustainable tourism development, including \nthe adoption and implementation of new legislation and policies, and encourages \nthem to use sustainable tourism as a tool to promote the eradication of poverty and \nenhance the protection of biodiversity, cultural heritage and community development; \n\nSustainable and resilient tourism and sustainable development  \nin Central America and the Dominican Republic \nA/RES/78/145\n \n7/10\n23-25923 \n \n \n14. Encourages cooperation to promote the engagement of women, youth, \nIndigenous Peoples, and local communities, and initiatives that foster their \nsocioeconomic empowerment through sustainable tourism that continues to promote \nequitable partnerships, the creation of jobs and entrepreneurial opportunities; \n \n15. Recognizes the important efforts made by the Central American \nIntegration System region to include those in vulnerable situations in decision-\nmaking in the tourism sector, with a more decentralized and participatory approach, \nespecially rural and local communities and Indigenous Peoples, aiming also to \nadvance the empowerment of women and girls and provide opportunities for youth, \nand calls upon the international community to support local, rural and community-\nbased tourism initiatives to ensure that tourism continues to support economic growth \nand sustainable development;  \n \n16. Also recognizes the continued need to support sustainable tourism \nactivities and relevant capacity-building efforts that promote environmental \nawareness, conserve and protect the environment, respect wildlife, biodiversity, \necosystems and cultural diversity and improve the welfare and livelihoods of local \ncommunities by supporting their local economies and the human and natural \nenvironment as a whole; \n \n17. Notes the importance of adequately measuring the sociocultural and \nenvironmental impact of tourism, and encourages efforts to fill the present data gap \nin this area by taking advantage of the emergence of non-traditional solutions and \nsources of data, with an overarching goal of advancing the national sustainable \ndevelopment agenda beyond the tourism sector; \n \n18. Recognizes that the implementation of sustainable consumption and \nproduction patterns in the tourism sector in Central America, and hence advancing \nthe 2030 Agenda for Sustainable Development10 in the region, requires, inter alia, the \nidentification and adoption of more resource-efficient tourism planning approaches \nby all relevant stakeholders; \n \n19. Stresses the need to promote the further development of sustainable \ntourism, in particular through the consumption of sustainable tourism products and \nservices, and to strengthen the development of ecotourism, maintaining, in particular, \nthe culture and environmental integrity of Indigenous and local communities and \nenhancing the protection of ecologically sensitive areas and the natural heritage and \nIndigenous cultural and religious sites of those communities; \n \n20. Invites Governments and other stakeholders to join the Sustainable \nTourism Programme of the 10-Year Framework of Programmes on Sustainable \nConsumption and Production Patterns, 11 which aims at promoting innovation and \ncircular thinking to accelerate resource efficiency in the tourism value chain; \n \n21. Notes with appreciation the launch of the first phase of the Tourism \nObservatory of the Central American Integration System Region in June 2023, and \nlooks forward to its completion, and invites Governments and other stakeholders to \nconsider joining the International Network of Sustainable Tourism Observatories of \nthe World Tourism Organization, which contributes to the promotion of economically, \nsocially and environmentally sustainable tourism, and to support the practice of \ninformed policymaking around the world;  \n \n22. Encourages further collaboration by public-private partnerships towards \nthe enhancement of quality data collection, including disaggregated data, in \naccordance with national legislation, taking into account the concerted efforts by \n__________________ \n \n10  Resolution 70/1. \n \n11  A/CONF.216/5, annex. \n\nA/RES/78/145 \nSustainable and resilient tourism and sustainable development \nin Central America and the Dominican Republic\n \n23-25923\n8/10 \n \nnational authorities of the States members of the Central American Integration \nSystem, in conjunction with the private sector, through the establishment of \nobservatories for sustainable tourism to monitor the development of tourism at the \ndestination level in order to provide timely information for evidence-based policies \nand decision-making;  \n \n23. Urges the tourism sector in the States members of the Central American \nIntegration System to be part of the coordination, knowledge-sharing and \ncommunication mechanisms for security and emergency management at the national \nand regional levels and to collectively promote an evidence-based approach in \ndeveloping measures for safe, secure and seamless travel, which will enable \ngovernment agencies to make relevant, informed and coordinated decisions, and in \nthat sense welcomes the progress of the Secretary-General\u2019s call to protect everyone \non Earth through universal coverage of early warning systems, including through the \nEarly Warning for All initiative; \n \n24. Welcomes the efforts of the World Tourism Organization, the United \nNations Environment Programme, the United Nations Conference on Trade and \nDevelopment, the United Nations Educational, Scientific and Cultural Organization, \nregional commissions and other regional organizations, as well as the Conference of \nthe Parties to the United Nations Framework Convention on Climate Change and the \nConference of the Parties to the Convention on Biological Diversity, to promote \nsustainable tourism worldwide;  \n \n25. Invites Member States and other stakeholders and the World Tourism \nOrganization to continue to support the activities undertaken by the States members \nof the Central American Integration System for the promotion of sustainable tourism \nin the region, including with regard to emergency preparedness for better disaster risk \nreduction, the vulnerabilities of the Central American Integration System region to \ndisasters caused by natural hazards and their impacts on sustainable tourism, as well \nas for capacity-building, job creation and the promotion of local culture and products, \nand the achievement of the Sustainable Development Goals; \n \n26. Invites Member States and relevant stakeholders to welcome the many \nopportunities that the new digital transformation of the tourism sector offers for \ncreating and implementing innovative technologies to modernize the tourism industry \nin the States members of the Central American Integration System, by creating \nmomentum for economic growth and expanding opportunities, including for women \nand young people, harnessing digital technology, fostering innovation and training \nand building human capacity, for the successful recovery and resilience of the tourism \nsector; \n \n27. Encourages the States members of the Central American Integration \nSystem, through the Central American Tourism Council and the Central American \nTourism Integration Secretariat, to promote sustainable tourism by intensifying \nbilateral, regional and multilateral cooperation at the level of the tourism industry, \nand to continue to support sustainable tourism through policies that foster responsive \nand inclusive tourism, strengthen regional identity and protect their natural and \ncultural heritage, including their ecosystems and biodiversity, and notes that existing \ninitiatives, such as the One Planet Sustainable Tourism Programme, among other \ninternational initiatives, can deliver direct and focused support to Governments; \n \n28. Also encourages the States members of the Central American Integration \nSystem to establish and strengthen quality, reliable, sustainable and resilient \ninfrastructure, emphasizing the need to promote investments in infrastructure that are \nsocially, economically and environmentally sustainable, so as to promote sustainable \ntourism in the region;  \n\nSustainable and resilient tourism and sustainable development  \nin Central America and the Dominican Republic \nA/RES/78/145\n \n9/10\n23-25923 \n \n \n29. Reiterates the commitment to the development of sustainable regional \ninfrastructure projects that stimulate sustainable economic productivity, promoting \nequitable growth of regions across the urban-rural continuum, and encourages urban-\nrural interactions and connectivity by strengthening sustainable transport and \nmobility, and technology and communications networks and infrastructure, including \nconnectivity between cities and their surroundings, peri-urban and rural areas, as well \nas greater land-sea connections, where appropriate, and encourages the development \nof tourism infrastructure and the promotion of tourism diversification, including \nthrough public-private partnerships, as a way to foster job creation for local \ncommunities, the preservation of their way of life, culture and heritage and the \npromotion of the three dimensions of sustainable development, while simultaneously \ninviting Member States to take measures to protect the environment and the \nsociocultural heritage of a destination; \n \n30. Recognizes that persons with disabilities have equal rights to access \ntourism services and opportunities, such as independent travel, accessible services, \ntrained staff, reliable information and inclusive marketing, and that great efforts \nshould be made to ensure that tourism policies and practices are inclusive of persons \nwith disabilities, the majority of whom live in developing countries; \n \n31. Calls upon Member States and the tourism sector to take effective \nmeasures, in the context of sustainable tourism, including ecotourism initiatives, to \nhelp to promote the equal participation of women and the balanced participation of \nyouth, older persons, persons with disabilities, Indigenous Peoples, and local \ncommunities, at all levels and in decision-making processes in all areas, and to \npromote effective economic empowerment, mainly through decent job and income \ncreation; \n \n32. Recognizes that addressing the need for improved monitoring of the \ndevelopment impacts of tourism requires rethinking and changing traditional \npractices in order to incorporate multiple data sources to provide public \nadministrations and the tourism sector with the most updated intelligence on tourism, \nand notes the progress achieved through the International Network of Sustainable \nTourism Observatories of the World Tourism Organization, which is focused on \ncontinuously monitoring the impacts of tourism, tackling the three dimensions of \nsustainability, strengthening evidence-based decision-making and creating a culture \nof continuous and timely monitoring and measurement; \n \n33. Welcomes the positive role that tourism can play in the conservation of \nbiodiversity and in fighting climate change, which provides a further argument for \nenhancing the environmental components of tourism policies and better utilizing the \npotential of sustainable tourism as an enabling agent of change, and also welcomes \nthe convening of the twenty-eighth session of the Conference of the Parties to the \nUnited Nations Framework Convention on Climate Change, in Dubai, United Arab \nEmirates, from 30 November to 12 December 2023, and looks forward to the sixteenth \nmeeting of the Conference of the Parties to the Convention on Biological Diversity, \nto be held in 2024;  \n \n34. Reiterates its call for the prevention of new and the reduction of existing \ndisaster risk through the implementation of integrated and inclusive economic, \nstructural, legal, social, health, cultural, educational, environmental, technological, \npolitical, financial and institutional measures that prevent and reduce hazard exposure \nand vulnerability to disaster, increase preparedness for response and recovery and \nthus strengthen resilience, and reaffirms the need for the enhancement of the means \nof implementation and the capacity and capability of developing countries, including \nthe mobilization of support through international cooperation, for the provision of \n\nA/RES/78/145 \nSustainable and resilient tourism and sustainable development \nin Central America and the Dominican Republic\n \n23-25923\n10/10 \n \nmeans of implementation to augment domestic efforts in accordance with their \nnational priorities;  \n \n35. Requests the Secretary-General, in cooperation with the Secretary-General \nof the World Tourism Organization and with other relevant United Nations entities, \nto submit to the General Assembly at its eightieth session an action-oriented report \non the implementation of the present resolution, including concrete recommendations \nto accelerate the implementation of the 2030 Agenda in this regard, in the States \nmembers of the Central American Integration System, and decides to include in the \nprovisional agenda of its eightieth session the item entitled \u201cSustainable \ndevelopment\u201d. \n \n49th plenary meeting \n19 December 2023 \n \n",
  "paragraphs": {
    "1": "Takes note of the report of the Secretary-General on sustainable tourism and sustainable development in Central America;9",
    "2": "Recognizes the major role that sustainable and resilient tourism plays in advancing towards the achievement of sustainable development of the States members of the Central American Integration System, as an instrument of social inclusion that generates decent jobs and entrepreneurship opportunities, contributing to inclusive economic growth and the improvement of the quality of life of the population, aimed at achieving poverty eradication in all its forms and dimensions, and that it contributes to the promotion of climate resilience, environmental sustainability and disaster risk management in tourist activities and destinations;",
    "3": "Emphasizes, taking into account the fact that the tourism sector is vulnerable to natural hazards and disasters, including those that are climate-related, the need to foster resilient tourism development in the Central American Integration System region, including through national strategies for rehabilitation aftershocks, climate change adaptation and disaster risk reduction plans and public-private partnerships;",
    "4": "Recognizes that since the adoption of resolution 76/201 in 2021, despite the many challenges they have faced owing to the COVID-19 pandemic, Central America and the Dominican Republic have shown numerous positive developments, initiatives and efforts to promote sustainable tourism and sustainable development, making significant progress towards recovery and enhancing resilience, recognizing the implementation of policies at the national level, and employing an integrated and holistic approach for the promotion of sustainable tourism and sustainable development to generate benefits in the social, economic and environmental pillars;",
    "5": "Encourages strategic actions and accelerators to address the impacts of the COVID-19 pandemic on sustainable development and to promote a sustainable recovery in the tourism sector, through global and regional political action and coordination to mitigate the effects of the pandemic and support the recovery therefrom, which will require substantial financial efforts to rebuild a more resilient, diversified, inclusive and sustainable tourism sector;",
    "6": "Recalls the adoption of the principles of sustainable tourism, developed by the Central American Tourism Integration Secretariat and found in its strategic plan for sustainable tourism development, 2021\u20132025, which captures the region\u2019s vision of itself as an integrated, sustainable, multi-location, cross-border destination of high quality and emphasizes its action plan for tourism and climate change as a component of the regional strategy on climate change;",
    "7": "Recognizes that the tourism sector has been a catalyst for achieving sustainable development in its three dimensions in Central America and the Dominican Republic, including addressing environmental issues, in particular climate change, poverty eradication and economic development, highlighting the importance of strengthening appropriate policies and financial support within a broader framework of sustainable development policies and of adopting a comprehensive, multisectoral approach for the sustainable development of tourism;",
    "8": "Encourages regional and national tourism organizations to promote destination models that seek the highest possible direct benefits for local and national economies, in order to contribute to improving quality of life and reducing poverty in local communities, taking into account the integration of sustainability policies in the tourism sector, and invites all stakeholders to identify, assess and mitigate the impacts of tourism on the three dimensions of sustainable development;",
    "9": "Stresses the importance of biocultural heritage, endogenous development, scientific research and replicable models to promote sustainable, community-based, rural and local tourism activities for the benefit of people and nature, in close collaboration with Indigenous Peoples and youth, as a priority for the Central American Integration System region, recognizes that some countries in the region are developing new and innovative models, such as the tourism, conservation and sustainable livelihoods model, and also recognizes the importance of strengthening efforts to protect and safeguard the world\u2019s cultural and natural heritage, as well as promoting the participation of Indigenous Peoples and local communities in the protection of cultural and traditional knowledge and practices for the achievement of a more sustainable tourism sector;",
    "10": "Recognizes the valuable role of international cooperation with relevant partners, and encourages them to continue to support the implementation of various projects aimed at promoting sustainable tourism in the region by, inter alia, strengthening ecotourism, rural, cultural and heritage tourism, including colonial sites, preventing trafficking in cultural artefacts and ensuring respect for intangible cultural heritage and cultural and natural sites;",
    "11": "Encourages Member States and relevant stakeholders to support cooperatives, community-based organizations and micro-, small and medium-sized enterprises with initiatives towards achieving a stronger business environment, technical assistance, institutional networking and capacity-building and by enhancing institutional coherence policy that supports funding mechanisms and initiatives for poverty eradication programmes and projects;",
    "12": "Welcomes the progress made by the States members of the Central American Integration System in converging towards a regional tourism strategy based on preserving the region\u2019s biodiversity and natural and cultural attractions and reducing poverty through employment and entrepreneurial tourism development that emphasizes micro-, small and medium-sized enterprises, while addressing the adverse effects of climate change, to improve the quality of life of the region\u2019s inhabitants;",
    "13": "",
    "14": "Encourages cooperation to promote the engagement of women, youth, Indigenous Peoples, and local communities, and initiatives that foster their socioeconomic empowerment through sustainable tourism that continues to promote equitable partnerships, the creation of jobs and entrepreneurial opportunities;",
    "15": "Recognizes the important efforts made by the Central American Integration System region to include those in vulnerable situations in decision- making in the tourism sector, with a more decentralized and participatory approach, especially rural and local communities and Indigenous Peoples, aiming also to advance the empowerment of women and girls and provide opportunities for youth, and calls upon the international community to support local, rural and community- based tourism initiatives to ensure that tourism continues to support economic growth and sustainable development;",
    "16": "Also recognizes the continued need to support sustainable tourism activities and relevant capacity-building efforts that promote environmental awareness, conserve and protect the environment, respect wildlife, biodiversity, ecosystems and cultural diversity and improve the welfare and livelihoods of local communities by supporting their local economies and the human and natural environment as a whole;",
    "17": "Notes the importance of adequately measuring the sociocultural and environmental impact of tourism, and encourages efforts to fill the present data gap in this area by taking advantage of the emergence of non-traditional solutions and sources of data, with an overarching goal of advancing the national sustainable development agenda beyond the tourism sector;",
    "18": "Recognizes that the implementation of sustainable consumption and production patterns in the tourism sector in Central America, and hence advancing the 2030 Agenda for Sustainable Development10 in the region, requires, inter alia, the identification and adoption of more resource-efficient tourism planning approaches by all relevant stakeholders;",
    "19": "Stresses the need to promote the further development of sustainable tourism, in particular through the consumption of sustainable tourism products and services, and to strengthen the development of ecotourism, maintaining, in particular, the culture and environmental integrity of Indigenous and local communities and enhancing the protection of ecologically sensitive areas and the natural heritage and Indigenous cultural and religious sites of those communities;",
    "20": "Invites Governments and other stakeholders to join the Sustainable Tourism Programme of the 10-Year Framework of Programmes on Sustainable Consumption and Production Patterns, 11 which aims at promoting innovation and circular thinking to accelerate resource efficiency in the tourism value chain;",
    "21": "Notes with appreciation the launch of the first phase of the Tourism Observatory of the Central American Integration System Region in June 2023, and looks forward to its completion, and invites Governments and other stakeholders to consider joining the International Network of Sustainable Tourism Observatories of the World Tourism Organization, which contributes to the promotion of economically, socially and environmentally sustainable tourism, and to support the practice of informed policymaking around the world;",
    "22": "Encourages further collaboration by public-private partnerships towards the enhancement of quality data collection, including disaggregated data, in accordance with national legislation, taking into account the concerted efforts by national authorities of the States members of the Central American Integration System, in conjunction with the private sector, through the establishment of observatories for sustainable tourism to monitor the development of tourism at the destination level in order to provide timely information for evidence-based policies and decision-making;",
    "23": "Urges the tourism sector in the States members of the Central American Integration System to be part of the coordination, knowledge-sharing and communication mechanisms for security and emergency management at the national and regional levels and to collectively promote an evidence-based approach in developing measures for safe, secure and seamless travel, which will enable government agencies to make relevant, informed and coordinated decisions, and in that sense welcomes the progress of the Secretary-General\u2019s call to protect everyone on Earth through universal coverage of early warning systems, including through the Early Warning for All initiative;",
    "24": "Welcomes the efforts of the World Tourism Organization, the United Nations Environment Programme, the United Nations Conference on Trade and Development, the United Nations Educational, Scientific and Cultural Organization, regional commissions and other regional organizations, as well as the Conference of the Parties to the United Nations Framework Convention on Climate Change and the Conference of the Parties to the Convention on Biological Diversity, to promote sustainable tourism worldwide;",
    "25": "Invites Member States and other stakeholders and the World Tourism Organization to continue to support the activities undertaken by the States members of the Central American Integration System for the promotion of sustainable tourism in the region, including with regard to emergency preparedness for better disaster risk reduction, the vulnerabilities of the Central American Integration System region to disasters caused by natural hazards and their impacts on sustainable tourism, as well as for capacity-building, job creation and the promotion of local culture and products, and the achievement of the Sustainable Development Goals;",
    "26": "Invites Member States and relevant stakeholders to welcome the many opportunities that the new digital transformation of the tourism sector offers for creating and implementing innovative technologies to modernize the tourism industry in the States members of the Central American Integration System, by creating momentum for economic growth and expanding opportunities, including for women and young people, harnessing digital technology, fostering innovation and training and building human capacity, for the successful recovery and resilience of the tourism sector;",
    "27": "Encourages the States members of the Central American Integration System, through the Central American Tourism Council and the Central American Tourism Integration Secretariat, to promote sustainable tourism by intensifying bilateral, regional and multilateral cooperation at the level of the tourism industry, and to continue to support sustainable tourism through policies that foster responsive and inclusive tourism, strengthen regional identity and protect their natural and cultural heritage, including their ecosystems and biodiversity, and notes that existing initiatives, such as the One Planet Sustainable Tourism Programme, among other international initiatives, can deliver direct and focused support to Governments;",
    "28": "",
    "29": "Reiterates the commitment to the development of sustainable regional infrastructure projects that stimulate sustainable economic productivity, promoting equitable growth of regions across the urban-rural continuum, and encourages urban- rural interactions and connectivity by strengthening sustainable transport and mobility, and technology and communications networks and infrastructure, including connectivity between cities and their surroundings, peri-urban and rural areas, as well as greater land-sea connections, where appropriate, and encourages the development of tourism infrastructure and the promotion of tourism diversification, including through public-private partnerships, as a way to foster job creation for local communities, the preservation of their way of life, culture and heritage and the promotion of the three dimensions of sustainable development, while simultaneously inviting Member States to take measures to protect the environment and the sociocultural heritage of a destination;",
    "30": "Recognizes that persons with disabilities have equal rights to access tourism services and opportunities, such as independent travel, accessible services, trained staff, reliable information and inclusive marketing, and that great efforts should be made to ensure that tourism policies and practices are inclusive of persons with disabilities, the majority of whom live in developing countries;",
    "31": "Calls upon Member States and the tourism sector to take effective measures, in the context of sustainable tourism, including ecotourism initiatives, to help to promote the equal participation of women and the balanced participation of youth, older persons, persons with disabilities, Indigenous Peoples, and local communities, at all levels and in decision-making processes in all areas, and to promote effective economic empowerment, mainly through decent job and income creation;",
    "32": "Recognizes that addressing the need for improved monitoring of the development impacts of tourism requires rethinking and changing traditional practices in order to incorporate multiple data sources to provide public administrations and the tourism sector with the most updated intelligence on tourism, and notes the progress achieved through the International Network of Sustainable Tourism Observatories of the World Tourism Organization, which is focused on continuously monitoring the impacts of tourism, tackling the three dimensions of sustainability, strengthening evidence-based decision-making and creating a culture of continuous and timely monitoring and measurement;",
    "33": "Welcomes the positive role that tourism can play in the conservation of biodiversity and in fighting climate change, which provides a further argument for enhancing the environmental components of tourism policies and better utilizing the potential of sustainable tourism as an enabling agent of change, and also welcomes the convening of the twenty-eighth session of the Conference of the Parties to the United Nations Framework Convention on Climate Change, in Dubai, United Arab Emirates, from 30 November to 12 December 2023, and looks forward to the sixteenth meeting of the Conference of the Parties to the Convention on Biological Diversity, to be held in 2024;",
    "34": " means of implementation to augment domestic efforts in accordance with their national priorities;",
    "35": "Requests the Secretary-General, in cooperation with the Secretary-General of the World Tourism Organization and with other relevant United Nations entities, to submit to the General Assembly at its eightieth session an action-oriented report on the implementation of the present resolution, including concrete recommendations to accelerate the implementation of the 2030 Agenda in this regard, in the States members of the Central American Integration System, and decides to include in the provisional agenda of its eightieth session the item entitled \u201cSustainable development\u201d."
  },
  "agenda_items": [
    "Item 18"
  ],
  "symbol_references": []
}