{
  "symbol": "A/RES/75/322",
  "filename": "A_RES_75_322.pdf",
  "title": "75/322. New Partnership for Africa\u2019s Development: progress in implementation and international support",
  "text": "United Nations \nA/RES/75/322 \n \n \nGeneral Assembly \nDistr.: General \n16 September 2021 \n \n21-12749 (E)    210921     \n*2112749* \n \n \nSeventy-fifth session \nAgenda item 66 (a) \nNew Partnership for Africa\u2019s Development: progress in \nimplementation and international support: New \nPartnership for Africa\u2019s Development: progress in \nimplementation and international support  \n \n \n \n \n Resolution adopted by the General Assembly \non 9 September 2021 \n \n \n \n \n[without reference to a Main Committee (A/75/L.111/Rev.1 and \nA/75/L.111/Rev.1/Add.1)] \n \n \n 75/322. New Partnership for Africa\u2019s Development: progress in \nimplementation and international support \n \n \n \nThe General Assembly, \n \nRecalling its resolution 57/2 of 16 September 2002 on the United Nations \nDeclaration on the New Partnership for Africa\u2019s Development, \n \nRecalling also its resolution 57/7 of 4 November 2002 on the final review and \nappraisal of the United Nations New Agenda for the Development of Africa in the \n1990s and support for the New Partnership for Africa\u2019s Development and all its \nsubsequent resolutions, including resolution 74/301 of 3 September 2020, entitled \n\u201cNew Partnership for Africa\u2019s Development: progress in implementation and \ninternational support\u201d and Economic and Social Council resolution 2020/6 of 18 June \n2020 on the social dimensions of the New Partnership for Africa\u2019s Development, \n \nReaffirming its resolution 70/1 of 25 September 2015, entitled \u201cTransforming \nour world: the 2030 Agenda for Sustainable Development\u201d, in which it adopted a \ncomprehensive, far-reaching and people-centred set of universal and transformative \nSustainable Development Goals and targets, its commitment to working tirelessly for \nthe full implementation of the Agenda by 2030, its recognition that eradicating \npoverty in all its forms and dimensions, including extreme poverty, is the greatest \nglobal challenge and an indispensable requirement for sustainable development, its \ncommitment to achieving sustainable development in its three dimensions \u2013 \neconomic, social and environmental \u2013 in a balanced and integrated manner, and to \nbuilding upon the achievements of the Millennium Development Goals and seeking \nto address their unfinished business, \n\nA/RES/75/322 \nNew Partnership for Africa\u2019s Development: progress in \nimplementation and international support\n \n21-12749\n2/8 \n \n \nReaffirming also its resolution 69/313 of 27 July 2015 on the Addis Ababa \nAction Agenda of the Third International Conference on Financing for Development, \nwhich is an integral part of the 2030 Agenda for Sustainable Development, supports \nand complements it, helps to contextualize its means of implementation targets with \nconcrete policies and actions, and reaffirms the strong political commitment to \naddress the challenge of financing and creating an enabling environment at all levels \nfor sustainable development in the spirit of global partnership and solidarity, \n \nRecalling that the 2030 Agenda for Sustainable Development underscores the \nspecial challenges facing the most vulnerable countries, including African countries, \nand recalling also that significant challenges remain in achieving sustainable \ndevelopment in Africa and the importance of fulfilling all commitments to advance \naction in areas critical to Africa\u2019s sustainable development, \n \nRecognizing the adoption of Agenda 2063 by the Assembly of Heads of State \nand Government of the African Union at its twenty-fourth ordinary session, held in \nAddis Ababa on 30 and 31 January 2015, as the African Union long-term political \nstrategy for Africa\u2019s development and its first 10-year implementation plan (2014\u20132023), \nwhich outlines key flagship projects and programmes to be fast-tracked during the \ndecade, and recognizing the commitment to the full implementation of the political \ndeclaration on Africa\u2019s development needs, adopted on 22 September 2008, 1 \n \nReaffirming the Paris Agreement 2  and encouraging all its parties to fully \nimplement the Agreement, and parties to the United Nations Framework Convention \non Climate Change 3  that have not yet done so to deposit their instruments of \nratification, acceptance, approval or accession, where appropriate, as soon as \npossible, \n \nNoting the need for all parties to submit enhanced nationally determined \ncontributions well ahead of the twenty-sixth meeting of the Conference of the Parties \nto the United Nations Framework Conference on Climate Change, in line with the \nbest available science, and to protect people in vulnerable situations, especially in \nAfrica, \n \nHighlighting the synergies between the implementation of the 2030 Agenda for \nSustainable Development, the Addis Ababa Action Agenda, and the Paris Agreement \nand other relevant major intergovernmental outcomes of United Nations conferences \nand summits in the economic, social and environmental fields, \n \nNoting with great concern the multidimensional impact of the coronavirus \ndisease (COVID-19) pandemic on African countries, including significant impacts on \npoverty, food security, unemployment, trade, disrupted supply chains, tourism and \nfinancial flows, as well as its social impacts, including violence against women and \ngirls, causing more challenges for African countries to achieve the 2030 Agenda and \nAgenda 2063, and recognizing the great efforts made by African countries in \ncombating the COVID-19 pandemic to save lives and achieve sustainable, inclusive \nand resilient recovery, \n \nRecalling its resolution 75/206 of 21 December 2020 on the promotion of \ninternational cooperation to combat illicit financial flows and strengthen good \npractices on assets return to foster sustainable development, \n \nUnderlining the need to promote peaceful and inclusive societies for achieving \nsustainable development and to build effective, transparent, accountable and inclusive \ninstitutions at all levels, and reaffirming that good governance, the rule of law, human \n__________________ \n \n1 Resolution 63/1. \n \n2 See FCCC/CP/2015/10/Add.1, decision 1/CP.21, annex. \n \n3 United Nations, Treaty Series, vol. 1771, No. 30822. \n\nNew Partnership for Africa\u2019s Development: progress in \nimplementation and international support \nA/RES/75/322\n \n3/8\n21-12749 \n \nrights, fundamental freedoms, equal access to fair justice systems and global \ncollaboration and mutual accountability measures to combat corruption and curb \nillicit financial flows will be integral to our efforts, \n \nRecalling its resolution 71/254 of 23 December 2016 on the Framework for a \nRenewed United Nations-African Union Partnership on Africa\u2019s Integration and \nDevelopment Agenda 2017\u20132027, and its resolution 66/293 of 17 September 2012, \nby which it established a United Nations monitoring mechanism to review \ncommitments made towards Africa\u2019s development, \n \nWelcoming the high-level events and artistic exhibitions to celebrate Africa\u2019s \nculture and history organized during the 2021 Africa Dialogue Series on the theme \n\u201cCultural identity and ownership: reshaping mindsets\u201d, organized by the Office of the \nSpecial Adviser on Africa, in close partnership with the African Union Commission \nand the United Nations Educational, Scientific and Cultural Organization, \n \nEmphasizing economic development, including inclusive industrial development, \nand policies which seek to enhance productive capacities in Africa, bearing in mind \nthat African countries have primary responsibility for their own economic, social and \nenvironmental development and that the role of national policies and development \nstrategies cannot be overemphasized, \n \nWelcoming the ongoing support of the United Nations Industrial Development \nOrganization to Agenda 2063, the African Accelerated Agribusiness and \nAgro-industries Development Initiative, the Pharmaceutical Manufacturing Plan for \nAfrica and other programmes of the African Union aimed at further strengthening the \nindustrialization process in Africa, \n \nNoting that the impact of the COVID-19 pandemic exacerbates the inequalities \ncaused by digital divides, especially in African countries, since the poorest and the \nmost vulnerable, who are the hardest hit, are also those who lag behind the most in \naccess to information and communications technologies,  \n \nReaffirming the convening of the intergovernmental conference held on 10 and \n11 December 2018 in Marrakech, Morocco, and recalling the adoption of the Global \nCompact for Safe, Orderly and Regular Migration, also known as the Marrakech \nCompact on Migration,4  \n \nReaffirming also the outcome of the second High-level United Nations \nConference on South-South Cooperation, held in Buenos Aires from 20 to 22 March \n2019,5  \n \nTaking note with appreciation of the transformation of the New Partnership \nPlanning and Coordinating Agency into the African Union Development Agency in \nconformity with the decision of the Assembly of Heads of State and Government of \nthe African Union to rename the African Union Development Agency as the African \nUnion Development Agency-New Partnership for Africa\u2019s Development,6  \n \n1. \nTakes note of the report of the Secretary-General entitled \u201cNew \nPartnership for Africa\u2019s Development: eighteenth consolidated progress report on \nimplementation and international support\u201d7 and the addendum thereto, as well as the \n__________________ \n \n4 Resolution 73/195, annex. \n \n5 Resolution 73/291, annex. \n \n6 See decision Ext/Assembly/AU/Dec.1(XI) of the Assembly of Heads of State and Government of \nthe African Union adopted at its eleventh extraordinary session, held in Addis Ababa on 17 and \n18 November 2018. \n \n7 A/75/918. \n\nA/RES/75/322 \nNew Partnership for Africa\u2019s Development: progress in \nimplementation and international support\n \n21-12749\n4/8 \n \nfourth biennial report of the Secretary-General on the review of the implementation \nof the commitments made towards Africa\u2019s development;8 \n \n2. \nRecognizes the efforts of the New Partnership for Africa\u2019s Development,9 \nand in this regard reaffirms the essential role played by the New Partnership Heads \nof State and Government Orientation Committee, welcomes the efforts by \ndevelopment partners to strengthen cooperation with the New Partnership and \nunderscores the importance of coherent and coordinated implementation of Agenda \n2063 and the 2030 Agenda for Sustainable Development, while acknowledging that \nmuch needs to be done to overcome the challenges in its implementation;  \n \n3. \nWelcomes the progress made by African countries in fulfilling their \ncommitments in the implementation of the New Partnership to deepen democracy, \nhuman rights, good governance and sound economic management, and encourages \nAfrican countries, with the participation of stakeholders, including civil society, \nacademia and the private sector, to continue their efforts towards implementing the \n2030 Agenda;  \n \n4. \nEncourages African countries to strengthen and expand local and regional \ninfrastructure, while recognizing the importance of quality infrastructure investment, \nthrough both foreign and domestic investment, and to continue to share best practices \nwith a view to strengthening regional and continental integration, and in this regard \nrecognizes the need for Africa\u2019s development partners to align their efforts towards \nsupporting the Programme for Infrastructure Development in Africa;  \n \n5. \nStresses the importance of taking targeted measures to eradicate poverty \nin all its forms and dimensions, including extreme poverty, of implementing \nnationally appropriate social protection systems and measures for all, including social \nprotection floors, and of achieving substantial and universal coverage of the poor and \nthe vulnerable;  \n \n6. \nEncourages African countries to accelerate the achievement of the \nobjective of food security and nutrition in Africa through healthy diets and sustainable \nfood systems with the support of Africa\u2019s development partners, and welcomes the \ninitiative of the Secretary-General to convene a Food Systems Summit in 2021;  \n \n7. \nCalls for effective measures and targeted investments to strengthen \nnational health systems and to ensure access to safe drinking water, sanitation and \nhygiene to prevent, protect against and combat outbreaks of diseases, including the \nEbola virus disease and coronavirus disease (COVID-19), recognizes, in this regard, \nthat human, animal, plant and ecosystem health are interdependent, invites \ndevelopment partners to continue to assist African countries in their efforts to \nstrengthen national health systems, to expand, strengthen and maintain surveillance \nsystems in the health sector, in order to implement and comply with the International \nHealth Regulations (2005),10 and to eliminate diseases, and in this context calls upon \ndevelopment partners to support the implementation of the African Health Strategy \n2016\u20132030 and the transition towards universal health coverage in Africa; \n \n8. \nRecalls the adoption of the political declaration of the high-level meeting \nof the General Assembly on the fight against tuberculosis, as reflected in its resolution \n73/3 of 10 October 2018, the political declaration on HIV and AIDS, as reflected in \nits resolution 75/284 of 8 June 2021, the political declaration of the third high-level \nmeeting of the Assembly on the prevention and control of non-communicable \ndiseases, as reflected in its resolution 73/2 of 10 October 2018, as well as the Abuja \n__________________ \n \n8 A/75/950. \n \n9 A/57/304, annex. \n \n10 World Health Organization, document WHA58/2005/REC/1, resolution 58.3, annex. \n\nNew Partnership for Africa\u2019s Development: progress in \nimplementation and international support \nA/RES/75/322\n \n5/8\n21-12749 \n \nDeclaration on Roll Back Malaria in Africa,11 and calls upon developed countries, \ninternational health funds and other development partners to continue their support, \nincluding financial and technical support, to African countries to scale up their \nnational efforts to fully implement, as appropriate, the actions committed to by the \nHeads of State and Government and their representatives; \n \n9. \nNotes the unprecedented threat that COVID-19 presents to the continent\u2019s \nhard-won development and economic gains; welcomes efforts of African leaders in \nmitigating the impact of the pandemic on their countries and citizens; expresses its \nhighest appreciation to all partners and international organizations that have \nsupported the continent in mitigating the effects of COVID-19; notes that there is a \nneed for additional support to reduce the effects of the pandemic on the continent\u2019s \nachievement of the 2030 Agenda for Sustainable Development12 and Agenda 2063, \nand to support the implementation of the Adapted Africa Joint Continental Strategy \nfor COVID-19 Pandemic and enhance the capacity of the African Medicines Agency \nfor manufacturing vaccines against COVID-19; and in this regard calls for global \nsolidarity, particularly with regard to equitable access to vaccines in Africa, and urges \nMember States and the international community to enable global equitable, affordable \nand timely access to safe and effective COVID-19 vaccines, therapeutics, diagnostics \nand health-care services, including as supported through the World Health \nOrganization and the COVID-19 Vaccine Global Access (COVAX) Facility and other \nrelevant initiatives, such as the African Vaccine Acquisition Task Team initiative, \naccelerating post-COVID economic and social development;  \n \n10. Encourages African countries to continue their efforts in enhancing \neducation and vocational training and stresses in this regard the importance of \ncreating a conducive environment for technological innovation, taking advantage of \nfrontier technologies and investing in digitalization to strengthen connectivity, and \nurges all relevant stakeholders to consider ensuring appropriate financing of digital \ndevelopment and adequate means of implementation, including strengthened \ncapacity-building of developing countries, especially African countries;  \n \n11. Recognizes the important role that African regional economic communities \ncan play in the implementation of the mandate of the New Partnership and of Agenda \n2063 and its first 10-year implementation plan in close cooperation with the African \nUnion, and in this regard encourages African countries and the international \ncommunity to give regional economic communities the support necessary to \nstrengthen their capacity;  \n \n12. Reiterates the need to support African countries in strengthening the \ncapacity of national statistical offices and data systems to ensure access to high-\nquality, timely, reliable and disaggregated data;  \n \n13. Recognizes that Africa is one of the regions that contribute the least to \nclimate change, yet is extremely vulnerable and exposed to its adverse impacts, \nexpresses deep concern about the increasing challenges posed by drought, land \ndegradation, desertification, the loss of biodiversity and floods, and their negative \nconsequences on the fight against poverty, famine and hunger, and in this regard calls \nupon the international community, including developed countries, to continue to \nsupport Africa to address its adaptation needs through, inter alia, the development, \nvoluntary transfer and deployment of technology on mutually agreed terms, including \non concessional and preferential terms, capacity-building and the provision of \nadequate and predictable resources, in line with existing commitments, and highlights \nthe need for full implementation by their respective parties of the agreed outcomes of \n__________________ \n \n11 See A/55/240/Add.1, annex. \n \n12 Resolution 70/1. \n\nA/RES/75/322 \nNew Partnership for Africa\u2019s Development: progress in \nimplementation and international support\n \n21-12749\n6/8 \n \nthe United Nations Framework Convention on Climate Change, including the Paris \nAgreement, and the Convention on Biological Diversity, 13 as well as the United \nNations Convention to Combat Desertification in Those Countries Experiencing \nSerious Drought and/or Desertification, Particularly in Africa, 14  including its \n2018-2030 strategic framework,15 looks forward to the post-2020 global biodiversity \nframework, urges developed countries to meet their commitment to a goal of \nmobilizing jointly 100 billion United States dollars per year by 2020 and through to \n2025 to address the needs of developing countries, in the context of meaningful \nmitigation actions and transparency on implementation, for climate action, \nparticularly for climate adaptation, in accordance with the United Nations Framework \nConvention on Climate Change;  \n \n14. Reiterates its deep concern about the growing illicit financial flows, \ninternationally and domestically, including those derived from crimes, welcomes the \npolitical declaration adopted on 2 June 2021 at the thirty-second special session of \nthe General Assembly, entitled \u201cOur common commitment to effectively addressing \nchallenges and implementing measures to prevent and combat corruption and \nstrengthen international cooperation\u201d,16 reiterates the commitment to redouble efforts \nto substantially reduce illicit financial flows by 2030, with a view to eventually \neliminating them, including by combating tax evasion and corruption through \nstrengthened national regulation and international cooperation in line with the Addis \nAbaba Action Agenda and its implementation, acknowledges the need to strengthen \ngood practices on assets return and recovery, and emphasizes that illicit financial \nflows reduce the availability of valuable resources, including for financing for \ndevelopment;  \n \n15. Notes the establishment of the High-level Panel on International Financial \nAccountability, Transparency and Integrity for Achieving the 2030 Agenda; \n \n16. Reaffirms that achieving gender equality, empowering all women and \ngirls, and the full realization of their human rights are essential to achieving sustained, \ninclusive and equitable economic growth and sustainable development, reiterates the \nneed for gender mainstreaming, including targeted actions and investments in the \nformulation and implementation of all financial, economic, environmental and social \npolicies, and recommits to adopting and strengthening sound policies and enforceable \nlegislation and transformative actions for the promotion of gender equality and \nwomen\u2019s and girls\u2019 empowerment at all levels, to ensure women\u2019s equal rights, access \nand opportunities for participation and leadership in the economy and to eliminate \ngender-based violence, sexual exploitation and abuse and discrimination in all its \nforms;  \n \n17. Welcomes the progress that has been achieved in implementing the African \nPeer Review Mechanism, in particular the voluntary adherence of 41 African \ncountries to the Mechanism and the completion of the peer review process in \n23 countries, welcomes the progress in implementing the national programmes of \naction resulting from those reviews, in this regard urges African States that have not \nyet done so to consider joining the Mechanism process by 2023, as envisaged in the \nfirst 10-year implementation plan of Agenda 2063, takes note of the decision on its \ninstitutional reform,17 and emphasizes African ownership of the process, and invites \nthe international community to support the efforts of African countries, at their \nrequest, in implementing their respective national programmes of action;  \n__________________ \n \n13 United Nations, Treaty Series, vol. 1760, No. 30619. \n \n14 Ibid., vol. 1954, No. 33480. \n \n15 ICCD/COP(13)/21/Add.1, decision 7/COP.13, annex. \n \n16 Resolution S-32/1, annex. \n \n17 See decision Ext/Assembly/AU/Dec.1(XI), sect. XI. \n\nNew Partnership for Africa\u2019s Development: progress in \nimplementation and international support \nA/RES/75/322\n \n7/8\n21-12749 \n \n \n18. Expresses deep concern at the increased debt burden of many African \ncountries, exacerbated by the COVID-19 pandemic, underlines the importance of debt \nsustainability, transparency and liquidity, debt crisis prevention and prudent debt \nmanagement in Africa, welcomes the final extension of the Debt Service Suspension \nInitiative for six months, until the end of December 2021, and recognizes the \nimportant role, on a case-by-case basis, of debt relief, including under the Common \nFramework for Debt Treatment beyond the Debt Service Suspension Initiative, \nincluding debt cancellation, debt restructuring and any other mechanism, such as debt \nswap initiatives for sustainable development and climate action where appropriate, in \norder to achieve a comprehensive and sustainable solution to the external debt \nproblems of African countries; \n \n19. Calls upon African countries to continue their efforts to create a domestic \nenvironment conducive to encouraging entrepreneurship, supporting small and \nmedium-sized enterprises, especially those owned by women, promoting the \nformalization of informal sector activities in Africa and attracting investments by, \ninter alia, achieving a transparent, stable and predictable investment climate, and \ninvites Africa\u2019s development partners to promote investment by their private sector \nin Africa and to facilitate the development and transfer of technology to African \ncountries, on mutually agreed terms;  \n \n20. Notes that foreign direct investment is a major source of financing for \ndevelopment, that it has a critical role in achieving inclusive economic growth and \nsustainable development, including through the promotion of job creation and the \neradication of poverty and hunger, and that it contributes to the active participation \nof the African economies in the global economy and facilitates regional economic \ncooperation and integration, and in this regard calls upon, as appropriate, developed \ncountries to continue to devise source-country measures to encourage and facilitate \nthe flow of foreign direct investment through, inter alia, the provision of export \ncredits and other lending instruments, risk guarantees and business development \nservices;  \n \n21. Acknowledges the progress made towards ensuring the free movement of \npersons as well as goods and services in Africa, and in this regard welcomes the start \nof trading under the African Continental Free Trade Area on 1 January 2021, and \nunderscores the importance of strengthening efforts to achieve the objective of \ndoubling intra-African trade;  \n \n22. Notes with concern Africa\u2019s disproportionately low share of the volume of \ninternational trade, reiterates the need for all countries and relevant multilateral \ninstitutions to continue efforts to enhance coherence in their trade policies towards \nAfrican countries, and acknowledges the importance of efforts to fully integrate \nAfrican countries into the multilateral trading system and to build their capacity to \ncompete through such initiatives as Aid for Trade and, given the world economic and \nfinancial crisis and the profound socioeconomic impact of the COVID-19 pandemic, \nthe provision of assistance to address the adjustment challenges of trade liberalization;  \n \n23. Emphasizes the importance of making progress on the accession of \ndeveloping countries to the World Trade Organization, recognizing the contribution \nthat their accession would make to the full integration of those countries into the \nmultilateral trading system, urges in this regard the facilitation of the accession \nprocess on a technical and legal basis and in a transparent manner for African \ncountries that are in the process of accession to the World Trade Organization, and \nreaffirms the importance of that organization\u2019s decision on accession by the least \ndeveloped countries;18  \n \n24. Reiterates that we are setting out together on the path towards sustainable \ndevelopment in its three dimensions \u2013 economic, social and environmental \u2013 in a \n__________________ \n \n18 Decision WT/L/508/Add.1 of 25 July 2012. \n\nA/RES/75/322 \nNew Partnership for Africa\u2019s Development: progress in \nimplementation and international support\n \n21-12749\n8/8 \n \nbalanced and integrated manner, including through international cooperation and \npartnership on the basis of mutual trust and the full benefit of all, in a spirit of global \nsolidarity, and for the common future of present and coming generations, focusing on \nthe needs of African countries and the achievement of the Sustainable Development \nGoals; \n \n25. Welcomes the various important initiatives established between African \ncountries and their development partners, and emphasizes the need for their effective \nimplementation, and in this regard recognizes the important role that North-South, \nSouth-South and triangular cooperation can play in supporting Africa\u2019s development \nefforts, particularly the implementation of the New Partnership, while bearing in mind \nthat South-South cooperation is not a substitute for but rather a complement to North-\nSouth cooperation;  \n \n26. Reiterates that the fulfilment of all official development assistance \ncommitments remains crucial, including the commitment by many developed \ncountries to achieve the target of 0.7 per cent of gross national income for official \ndevelopment assistance and 0.15 to 0.20 per cent of gross national income for official \ndevelopment assistance to the least developed countries, is encouraged by those few \ncountries that have met or surpassed their commitment to 0.7 per cent of gross \nnational income for official development assistance and the target of 0.15 to 0.20 per \ncent of gross national income for official development assistance to the least \ndeveloped countries, and urges all others to step up efforts to increase their official \ndevelopment assistance and to make additional concrete efforts towards official \ndevelopment assistance targets;  \n \n27. Emphasizes the need to continue to hold open, inclusive and transparent \ndiscussions on the modernization of official development assistance measurement and \non the proposed measure of \u201ctotal official support for sustainable development\u201d, \nwhile reaffirming that any such measure will not dilute commitments already made; \n \n28. Requests the United Nations system to continue to provide assistance to \nthe New Partnership and to African countries in developing projects and programmes \nwithin the scope of the priorities of the New Partnership and requests the Secretary-\nGeneral to promote greater coherence in the work of the United Nations system in \nsupport of Agenda 2063, and in this regard calls upon the United Nations system to \ncontinue to mainstream the special needs of Africa in all its normative and operational \nactivities;19 \n \n29. Invites Member States and all relevant entities of the United Nations \nsystem, including funds, programmes, specialized agencies and regional \ncommissions, in particular the Economic Commission for Africa, and all relevant \ninternational and regional organizations, to continue to contribute to the effectiveness \nand reliability of the United Nations monitoring mechanism process by cooperating \nin the collection of data and the evaluation of performance;  \n \n30. Requests the Secretary-General to submit to the General Assembly, on an \nannual basis, a comprehensive and action-oriented report on the implementation of \nthe present resolution, based on the provision of inputs from Governments, \norganizations of the United Nations system and other stakeholders in the New \nPartnership.  \n \n102nd plenary meeting \n9 September 2021 \n \n__________________ \n \n19 In conformity with the African Union-United Nations Framework for the Implementation of \nAgenda 2063 and the 2030 Agenda for Sustainable Development signed by the Secretary-General \nand the Chairperson of the African Union Commission on 27 January 2018. \n",
  "paragraphs": {
    "1": "Takes note of the report of the Secretary-General entitled \u201cNew Partnership for Africa\u2019s Development: eighteenth consolidated progress report on implementation and international support\u201d7 and the addendum thereto, as well as the __________________ 4 Resolution 73/195, annex. 5 Resolution 73/291, annex. 6 See decision Ext/Assembly/AU/Dec.1(XI) of the Assembly of Heads of State and Government of the African Union adopted at its eleventh extraordinary session, held in Addis Ababa on 17 and 18 November 2018. 7 A/75/918. A/RES/75/322 New Partnership for Africa\u2019s Development: progress in implementation and international support 21-12749 4/8 fourth biennial report of the Secretary-General on the review of the implementation of the commitments made towards Africa\u2019s development;8",
    "2": "Recognizes the efforts of the New Partnership for Africa\u2019s Development,9 and in this regard reaffirms the essential role played by the New Partnership Heads of State and Government Orientation Committee, welcomes the efforts by development partners to strengthen cooperation with the New Partnership and underscores the importance of coherent and coordinated implementation of Agenda 2063 and the 2030 Agenda for Sustainable Development, while acknowledging that much needs to be done to overcome the challenges in its implementation;",
    "3": "Welcomes the progress made by African countries in fulfilling their commitments in the implementation of the New Partnership to deepen democracy, human rights, good governance and sound economic management, and encourages African countries, with the participation of stakeholders, including civil society, academia and the private sector, to continue their efforts towards implementing the 2030 Agenda;",
    "4": "Encourages African countries to strengthen and expand local and regional infrastructure, while recognizing the importance of quality infrastructure investment, through both foreign and domestic investment, and to continue to share best practices with a view to strengthening regional and continental integration, and in this regard recognizes the need for Africa\u2019s development partners to align their efforts towards supporting the Programme for Infrastructure Development in Africa;",
    "5": "Stresses the importance of taking targeted measures to eradicate poverty in all its forms and dimensions, including extreme poverty, of implementing nationally appropriate social protection systems and measures for all, including social protection floors, and of achieving substantial and universal coverage of the poor and the vulnerable;",
    "6": "Encourages African countries to accelerate the achievement of the objective of food security and nutrition in Africa through healthy diets and sustainable food systems with the support of Africa\u2019s development partners, and welcomes the initiative of the Secretary-General to convene a Food Systems Summit in 2021;",
    "7": "Calls for effective measures and targeted investments to strengthen national health systems and to ensure access to safe drinking water, sanitation and hygiene to prevent, protect against and combat outbreaks of diseases, including the Ebola virus disease and coronavirus disease (COVID-19), recognizes, in this regard, that human, animal, plant and ecosystem health are interdependent, invites development partners to continue to assist African countries in their efforts to strengthen national health systems, to expand, strengthen and maintain surveillance systems in the health sector, in order to implement and comply with the International Health Regulations (2005),10 and to eliminate diseases, and in this context calls upon development partners to support the implementation of the African Health Strategy 2016\u20132030 and the transition towards universal health coverage in Africa;",
    "8": "Recalls the adoption of the political declaration of the high-level meeting of the General Assembly on the fight against tuberculosis, as reflected in its resolution 73/3 of 10 October 2018, the political declaration on HIV and AIDS, as reflected in its resolution 75/284 of 8 June 2021, the political declaration of the third high-level meeting of the Assembly on the prevention and control of non-communicable diseases, as reflected in its resolution 73/2 of 10 October 2018, as well as the Abuja __________________ 8 A/75/950. 9 A/57/304, annex. 10 World Health Organization, document WHA58/2005/REC/1, resolution 58.3, annex. New Partnership for Africa\u2019s Development: progress in implementation and international support A/RES/75/322 5/8 21-12749 Declaration on Roll Back Malaria in Africa,11 and calls upon developed countries, international health funds and other development partners to continue their support, including financial and technical support, to African countries to scale up their national efforts to fully implement, as appropriate, the actions committed to by the Heads of State and Government and their representatives;",
    "9": "Notes the unprecedented threat that COVID-19 presents to the continent\u2019s hard-won development and economic gains; welcomes efforts of African leaders in mitigating the impact of the pandemic on their countries and citizens; expresses its highest appreciation to all partners and international organizations that have supported the continent in mitigating the effects of COVID-19; notes that there is a need for additional support to reduce the effects of the pandemic on the continent\u2019s achievement of the 2030 Agenda for Sustainable Development12 and Agenda 2063, and to support the implementation of the Adapted Africa Joint Continental Strategy for COVID-19 Pandemic and enhance the capacity of the African Medicines Agency for manufacturing vaccines against COVID-19; and in this regard calls for global solidarity, particularly with regard to equitable access to vaccines in Africa, and urges Member States and the international community to enable global equitable, affordable and timely access to safe and effective COVID-19 vaccines, therapeutics, diagnostics and health-care services, including as supported through the World Health Organization and the COVID-19 Vaccine Global Access (COVAX) Facility and other relevant initiatives, such as the African Vaccine Acquisition Task Team initiative, accelerating post-COVID economic and social development;",
    "10": "Encourages African countries to continue their efforts in enhancing education and vocational training and stresses in this regard the importance of creating a conducive environment for technological innovation, taking advantage of frontier technologies and investing in digitalization to strengthen connectivity, and urges all relevant stakeholders to consider ensuring appropriate financing of digital development and adequate means of implementation, including strengthened capacity-building of developing countries, especially African countries;",
    "11": "Recognizes the important role that African regional economic communities can play in the implementation of the mandate of the New Partnership and of Agenda 2063 and its first 10-year implementation plan in close cooperation with the African Union, and in this regard encourages African countries and the international community to give regional economic communities the support necessary to strengthen their capacity;",
    "12": "Reiterates the need to support African countries in strengthening the capacity of national statistical offices and data systems to ensure access to high- quality, timely, reliable and disaggregated data;",
    "13": "Recognizes that Africa is one of the regions that contribute the least to climate change, yet is extremely vulnerable and exposed to its adverse impacts, expresses deep concern about the increasing challenges posed by drought, land degradation, desertification, the loss of biodiversity and floods, and their negative consequences on the fight against poverty, famine and hunger, and in this regard calls upon the international community, including developed countries, to continue to support Africa to address its adaptation needs through, inter alia, the development, voluntary transfer and deployment of technology on mutually agreed terms, including on concessional and preferential terms, capacity-building and the provision of adequate and predictable resources, in line with existing commitments, and highlights the need for full implementation by their respective parties of the agreed outcomes of __________________ 11 See A/55/240/Add.1, annex. 12 Resolution 70/1. A/RES/75/322 New Partnership for Africa\u2019s Development: progress in implementation and international support 21-12749 6/8 the United Nations Framework Convention on Climate Change, including the Paris Agreement, and the Convention on Biological Diversity, 13 as well as the United Nations Convention to Combat Desertification in Those Countries Experiencing Serious Drought and/or Desertification, Particularly in Africa, 14 including its 2018-2030 strategic framework,15 looks forward to the post-2020 global biodiversity framework, urges developed countries to meet their commitment to a goal of mobilizing jointly 100 billion United States dollars per year by 2020 and through to 2025 to address the needs of developing countries, in the context of meaningful mitigation actions and transparency on implementation, for climate action, particularly for climate adaptation, in accordance with the United Nations Framework Convention on Climate Change;",
    "14": "Reiterates its deep concern about the growing illicit financial flows, internationally and domestically, including those derived from crimes, welcomes the political declaration adopted on 2 June 2021 at the thirty-second special session of the General Assembly, entitled \u201cOur common commitment to effectively addressing challenges and implementing measures to prevent and combat corruption and strengthen international cooperation\u201d,16 reiterates the commitment to redouble efforts to substantially reduce illicit financial flows by 2030, with a view to eventually eliminating them, including by combating tax evasion and corruption through strengthened national regulation and international cooperation in line with the Addis Ababa Action Agenda and its implementation, acknowledges the need to strengthen good practices on assets return and recovery, and emphasizes that illicit financial flows reduce the availability of valuable resources, including for financing for development;",
    "15": "Notes the establishment of the High-level Panel on International Financial Accountability, Transparency and Integrity for Achieving the 2030 Agenda;",
    "16": "Reaffirms that achieving gender equality, empowering all women and girls, and the full realization of their human rights are essential to achieving sustained, inclusive and equitable economic growth and sustainable development, reiterates the need for gender mainstreaming, including targeted actions and investments in the formulation and implementation of all financial, economic, environmental and social policies, and recommits to adopting and strengthening sound policies and enforceable legislation and transformative actions for the promotion of gender equality and women\u2019s and girls\u2019 empowerment at all levels, to ensure women\u2019s equal rights, access and opportunities for participation and leadership in the economy and to eliminate gender-based violence, sexual exploitation and abuse and discrimination in all its forms;",
    "17": "Welcomes the progress that has been achieved in implementing the African Peer Review Mechanism, in particular the voluntary adherence of 41 African countries to the Mechanism and the completion of the peer review process in 23 countries, welcomes the progress in implementing the national programmes of action resulting from those reviews, in this regard urges African States that have not yet done so to consider joining the Mechanism process by 2023, as envisaged in the first 10-year implementation plan of Agenda 2063, takes note of the decision on its institutional reform,17 and emphasizes African ownership of the process, and invites the international community to support the efforts of African countries, at their request, in implementing their respective national programmes of action; __________________ 13 United Nations, Treaty Series, vol. 1760, No. 30619. 14 Ibid., vol. 1954, No. 33480. 15 ICCD/COP(13)/21/Add.1, decision 7/COP.13, annex. 16 Resolution S-32/1, annex. 17 See decision Ext/Assembly/AU/Dec.1(XI), sect. XI. New Partnership for Africa\u2019s Development: progress in implementation and international support A/RES/75/322 7/8 21-12749",
    "18": "Expresses deep concern at the increased debt burden of many African countries, exacerbated by the COVID-19 pandemic, underlines the importance of debt sustainability, transparency and liquidity, debt crisis prevention and prudent debt management in Africa, welcomes the final extension of the Debt Service Suspension Initiative for six months, until the end of December 2021, and recognizes the important role, on a case-by-case basis, of debt relief, including under the Common Framework for Debt Treatment beyond the Debt Service Suspension Initiative, including debt cancellation, debt restructuring and any other mechanism, such as debt swap initiatives for sustainable development and climate action where appropriate, in order to achieve a comprehensive and sustainable solution to the external debt problems of African countries;",
    "19": "Calls upon African countries to continue their efforts to create a domestic environment conducive to encouraging entrepreneurship, supporting small and medium-sized enterprises, especially those owned by women, promoting the formalization of informal sector activities in Africa and attracting investments by, inter alia, achieving a transparent, stable and predictable investment climate, and invites Africa\u2019s development partners to promote investment by their private sector in Africa and to facilitate the development and transfer of technology to African countries, on mutually agreed terms;",
    "20": "Notes that foreign direct investment is a major source of financing for development, that it has a critical role in achieving inclusive economic growth and sustainable development, including through the promotion of job creation and the eradication of poverty and hunger, and that it contributes to the active participation of the African economies in the global economy and facilitates regional economic cooperation and integration, and in this regard calls upon, as appropriate, developed countries to continue to devise source-country measures to encourage and facilitate the flow of foreign direct investment through, inter alia, the provision of export credits and other lending instruments, risk guarantees and business development services;",
    "21": "Acknowledges the progress made towards ensuring the free movement of persons as well as goods and services in Africa, and in this regard welcomes the start of trading under the African Continental Free Trade Area on 1 January 2021, and underscores the importance of strengthening efforts to achieve the objective of doubling intra-African trade;",
    "22": "Notes with concern Africa\u2019s disproportionately low share of the volume of international trade, reiterates the need for all countries and relevant multilateral institutions to continue efforts to enhance coherence in their trade policies towards African countries, and acknowledges the importance of efforts to fully integrate African countries into the multilateral trading system and to build their capacity to compete through such initiatives as Aid for Trade and, given the world economic and financial crisis and the profound socioeconomic impact of the COVID-19 pandemic, the provision of assistance to address the adjustment challenges of trade liberalization;",
    "23": "Emphasizes the importance of making progress on the accession of developing countries to the World Trade Organization, recognizing the contribution that their accession would make to the full integration of those countries into the multilateral trading system, urges in this regard the facilitation of the accession process on a technical and legal basis and in a transparent manner for African countries that are in the process of accession to the World Trade Organization, and reaffirms the importance of that organization\u2019s decision on accession by the least developed countries;18",
    "24": "Reiterates that we are setting out together on the path towards sustainable development in its three dimensions \u2013 economic, social and environmental \u2013 in a __________________ 18 Decision WT/L/508/Add.1 of 25 July 2012. A/RES/75/322 New Partnership for Africa\u2019s Development: progress in implementation and international support 21-12749 8/8 balanced and integrated manner, including through international cooperation and partnership on the basis of mutual trust and the full benefit of all, in a spirit of global solidarity, and for the common future of present and coming generations, focusing on the needs of African countries and the achievement of the Sustainable Development Goals;",
    "25": "Welcomes the various important initiatives established between African countries and their development partners, and emphasizes the need for their effective implementation, and in this regard recognizes the important role that North-South, South-South and triangular cooperation can play in supporting Africa\u2019s development efforts, particularly the implementation of the New Partnership, while bearing in mind that South-South cooperation is not a substitute for but rather a complement to North- South cooperation;",
    "26": "Reiterates that the fulfilment of all official development assistance commitments remains crucial, including the commitment by many developed countries to achieve the target of 0.7 per cent of gross national income for official development assistance and 0.15 to 0.20 per cent of gross national income for official development assistance to the least developed countries, is encouraged by those few countries that have met or surpassed their commitment to 0.7 per cent of gross national income for official development assistance and the target of 0.15 to 0.20 per cent of gross national income for official development assistance to the least developed countries, and urges all others to step up efforts to increase their official development assistance and to make additional concrete efforts towards official development assistance targets;",
    "27": "Emphasizes the need to continue to hold open, inclusive and transparent discussions on the modernization of official development assistance measurement and on the proposed measure of \u201ctotal official support for sustainable development\u201d, while reaffirming that any such measure will not dilute commitments already made;",
    "28": "Requests the United Nations system to continue to provide assistance to the New Partnership and to African countries in developing projects and programmes within the scope of the priorities of the New Partnership and requests the Secretary- General to promote greater coherence in the work of the United Nations system in support of Agenda 2063, and in this regard calls upon the United Nations system to continue to mainstream the special needs of Africa in all its normative and operational activities;19",
    "29": "Invites Member States and all relevant entities of the United Nations system, including funds, programmes, specialized agencies and regional commissions, in particular the Economic Commission for Africa, and all relevant international and regional organizations, to continue to contribute to the effectiveness and reliability of the United Nations monitoring mechanism process by cooperating in the collection of data and the evaluation of performance;",
    "30": "Requests the Secretary-General to submit to the General Assembly, on an annual basis, a comprehensive and action-oriented report on the implementation of the present resolution, based on the provision of inputs from Governments, organizations of the United Nations system and other stakeholders in the New Partnership. 102nd plenary meeting 9 September 2021 __________________ 19 In conformity with the African Union-United Nations Framework for the Implementation of Agenda 2063 and the 2030 Agenda for Sustainable Development signed by the Secretary-General and the Chairperson of the African Union Commission on 27 January 2018."
  },
  "agenda_items": [
    "Item 66"
  ],
  "symbol_references": [
    "A/75/L.111"
  ]
}