{
  "symbol": "A/RES/72/282",
  "filename": "A_RES_72_282.pdf",
  "title": "72/282. Complete and unconditional withdrawal of foreign military forces from the territory of the Republic of Moldova",
  "text": "United Nations \nA/RES/72/282\n \n \nGeneral Assembly \nDistr.: General \n26 June 2018 \n \n18-10331 (E)    050718     \n*1810331* \n \n \nSeventy-second session \nAgenda item 35 \n \n \n \n \n Resolution adopted by the General Assembly \non 22 June 2018 \n \n \n \n \n[without reference to a Main Committee (A/72/L.58 and A/72/L.58/Add.1)] \n \n \n 72/282. Complete and unconditional withdrawal of foreign military forces \nfrom the territory of the Republic of Moldova \n \n \n \nThe General Assembly, \n \nRecalling the obligations of all Member States under Article 2 of the Charter of \nthe United Nations, \n \nRecalling also its resolution 2625 (XXV) of 24 October 1970, in which it approved \nthe Declaration on Principles of International Law concerning Friendly Relations and \nCooperation among States in accordance with the Charter of the United Nations, \n \nReaffirming the need for all Member States to adhere strictly to the principles \nof the Charter, which include the sovereign equality of all Members of the United \nNations, the obligation to refrain from the threat or use of force against the territorial \nintegrity or political independence of any State, or in any other manner inconsistent \nwith the purposes of the United Nations, and the obligation to settle international \ndisputes by peaceful means, \n \nReferring to its relevant resolutions on cooperation between the United Nations \nand the Organization for Democracy and Economic Development \u2013 GUAM aimed, inter \nalia, at promoting the purposes and principles of the United Nations in the GUAM area, \n \nBearing in mind that the Constitution of the Republic of Moldova proclaims the \npermanent neutrality of the country and expressly prohibits the stationing of foreign \ntroops on its territory, \n \nRecognizing that the stationing of foreign military forces on the territory of the \nRepublic of Moldova, without its consent, violates its sovereignty and territorial \nintegrity, and that this is a problem that must be resolved in good faith, \nunconditionally, without further delay and in a peaceful manner, \n \nRecalling the repeated past calls of the Republic of Moldova, which were \nreiterated at the twenty-fourth meeting of the Organization for Security and \nCooperation in Europe Ministerial Council, held in Vienna in December 2017, for the \nfull withdrawal of Russian military forces and armaments from its territory, \n\nA/RES/72/282 \nComplete and unconditional withdrawal of foreign military forces\n from the territory of the Republic of Moldova\n \n18-10331\n2/2 \n \n \nNoting with appreciation the efforts made by the States participating in the \nOrganization for Security and Cooperation in Europe aimed at facilitating the \ncompletion of the withdrawal process of the Russian military forces and armaments \nfrom the territory of the Republic of Moldova, in accordance with the relevant \ndecisions of the Organization for Security and Cooperation in Europe, \n \nEmphasizing the commitment by the Russian Federation to complete the \nwithdrawal of its military forces and armaments from the territory of the Republic of \nMoldova within a specific timetable, as agreed at the summit of the Organization for \nSecurity and Cooperation in Europe held in Istanbul, Turkey, in 1999, \n \nRecalling its relevant resolutions on cooperation between the United Nations \nand the Organization for Security and Cooperation in Europe, particularly resolutions \n54/117 of 15 December 1999, 55/179 of 19 December 2000, 56/216 of 21 December \n2001 and 57/298 of 20 December 2002, emphasizing the commitments undertaken by \nthe Russian Federation at the Organization for Security and Cooperation in Europe \nsummit held in Istanbul in 1999 on the withdrawal of its military forces and \narmaments from the territory of the Republic of Moldova, \n \nStressing that the Operational Group of Russian Forces is not a part of the \nmilitary component of the Joint Control Commission established under the 1992 \nceasefire agreement,1 which also includes a rotating Russian contingent, and, as such, \nhas not been entrusted with any peacekeeping or other legal mandate, \n \nTaking note with concern of the continuous illegal joint military exercises of the \nOperational Group of Russian Forces with the paramilitaries of the separatist entity \nin the eastern part of the country, which endangers the security situation, disregards \nthe sovereignty and territorial integrity of the Republic of Moldova and undermines \nthe international efforts aimed at the peaceful resolution of the protracted \nTransnistrian conflict, \n \nRecognizing that the completion of the withdrawal of the Operational Group of \nRussian Forces, and the armaments that it guards, from the territory of the Republic \nof Moldova will demonstrate respect for its sovereignty, territorial integrity and \npermanent neutrality, \n \n1. \nExpresses deep concern about the continued stationing of the Operational \nGroup of Russian Forces and its armaments on the territory of the Republic of \nMoldova without the consent of that State Member of the United Nations; \n \n2. \nUrges the Russian Federation to complete, unconditionally and without \nfurther delay, the orderly withdrawal of the Operational Group of Russian Forces and \nits armaments from the territory of the Republic of Moldova; \n \n3. \nExpresses support for and further encourages the facilitation by the States \nparticipating in the Organization for Security and Cooperation in Europe of the \ncompletion of the process of withdrawal of the Russian forces and armaments from \nthe territory of the Republic of Moldova, in accordance with the relevant decisions of \nthe Organization for Security and Cooperation in Europe and as agreed at its summit \nheld in Istanbul in 1999; \n \n4. \nDecides to include in the provisional agenda of its seventy-third session \nan item entitled \u201cComplete withdrawal of foreign military forces from the territory of \nthe Republic of Moldova\u201d. \n \n98th plenary meeting \n22 June 2018 \n \n__________________ \n1 See S/24369. \n",
  "paragraphs": {
    "1": "Expresses deep concern about the continued stationing of the Operational Group of Russian Forces and its armaments on the territory of the Republic of Moldova without the consent of that State Member of the United Nations;",
    "2": "Urges the Russian Federation to complete, unconditionally and without further delay, the orderly withdrawal of the Operational Group of Russian Forces and its armaments from the territory of the Republic of Moldova;",
    "3": "Expresses support for and further encourages the facilitation by the States participating in the Organization for Security and Cooperation in Europe of the completion of the process of withdrawal of the Russian forces and armaments from the territory of the Republic of Moldova, in accordance with the relevant decisions of the Organization for Security and Cooperation in Europe and as agreed at its summit held in Istanbul in 1999;",
    "4": "Decides to include in the provisional agenda of its seventy-third session an item entitled \u201cComplete withdrawal of foreign military forces from the territory of the Republic of Moldova\u201d."
  },
  "agenda_items": [
    "Item 35"
  ],
  "symbol_references": [
    "A/72/L.58"
  ]
}