{
  "symbol": "A/RES/75/200",
  "filename": "A_RES_75_200.pdf",
  "title": "75/200. International Day of Human Fraternity",
  "text": "United Nations \nA/RES/75/200\n \n \nGeneral Assembly \nDistr.: General \n28 December 2020 \n \n20-17539 (E)    050121     \n*2017539* \n \n \nSeventy-fifth session \nAgenda item 15 \nCulture of peace \n \n \n \n \n Resolution adopted by the General Assembly \non 21 December 2020 \n \n \n \n \n[without reference to a Main Committee (A/75/L.52 and A/75/L.52/Add.1)] \n \n \n 75/200. International Day of Human Fraternity \n \n \n \nThe General Assembly, \n \nReaffirming the purposes and principles enshrined in the Charter of the United \nNations and the Universal Declaration of Human Rights, 1 in particular the right to \nfreedom of thought, conscience and religion, \n \nRecalling its resolution 36/55 of 25 November 1981, by which it proclaimed the \nDeclaration on the Elimination of All Forms of Intolerance and of Discrimination \nBased on Religion or Belief, \n \nRecalling also that in its resolution 67/104 of 17 December 2012 the General \nAssembly proclaimed the period 2013\u20132022 as the International Decade for the \nRapprochement of Cultures, \n \nRecognizing the importance of the Declaration and Programme of Action on a \nCulture of Peace,2 which serve as the universal mandate for the international \ncommunity, particularly the United Nations system, for the promotion of a culture of \npeace and non-violence that benefits humanity, in particular future generations, and \nrecalling in this regard its resolution 72/130 of 8 December 2017, by which it declared \n16 May the international Day of Living Together in Peace, \n \nExpressing deep concern at those acts that advocate religious hatred and thereby \nundermine the spirit of tolerance and respect for diversity, especially at a time when \nthe world confronts the unprecedented crisis caused by the coronavirus disease \n(COVID-19) pandemic, which requires a global response based on unity, solidarity \nand renewed multilateral cooperation, \n \nRecognizing the valuable contribution of people of all religions or beliefs to \nhumanity and the contribution that dialogue among all religious groups can make \n__________________ \n \n1 Resolution 217 A (III). \n \n2 Resolutions 53/243 A and B. \n\nA/RES/75/200 \nInternational Day of Human Fraternity\n \n20-17539\n2/2 \n \ntowards an improved awareness and understanding of the common values shared by \nall humankind, \n \nUnderlining the importance of raising awareness about different cultures and \nreligions or beliefs and of education in the promotion of tolerance, which involves \nthe acceptance by the public of and its respect for religious and cultural diversity, \nincluding with regard to religious expression, and underlining further the fact that \neducation, in particular at school, should contribute in a meaningful way to promoting \ntolerance and the elimination of discrimination based on religion or belief, \n \nEncouraging activities aimed at promoting interreligious and intercultural \ndialogue in order to enhance peace and social stability, respect for diversity and \nmutual respect and to create, at the global level, and also at the regional, national and \nlocal levels, an environment conducive to peace and mutual understanding, \n \nAcknowledging that tolerance, pluralistic tradition, mutual respect and the \ndiversity of religions and beliefs promote human fraternity, \n \nTaking note of all international, regional, national and local initiatives, as \nappropriate, as well as efforts by religious leaders, to promote interreligious and \nintercultural dialogue, and in this regard taking note also of the meeting between Pope \nFrancis and the Grand Imam of Al-Azhar, Ahmad al-Tayyib, on 4 February 2019 in \nAbu Dhabi, which resulted in the signing of the document entitled \u201cHuman fraternity \nfor world peace and living together\u201d, \n \n1. \nDecides to proclaim 4 February as the International Day of Human \nFraternity, to be observed each year beginning in 2021; \n \n2. \nInvites all Member States, relevant organizations of the United Nations \nsystem, other international organizations and civil society, including non-governmental \norganizations and the private sector, to observe the International Day of Human \nFraternity annually on 4 February in a manner that each considers most appropriate, \nwith the cost covered exclusively by voluntary contributions; \n \n3. \nInvites all Member States to further promote the culture of peace to help \nto ensure peace and sustainable development, including through the celebration of the \ninternational, regional and national days in this regard and by mobilizing the efforts \nof the international community to promote peace, tolerance, inclusion, understanding \nand solidarity. \n \n47th plenary meeting \n21 December 2020 \n \n",
  "paragraphs": {
    "1": "Decides to proclaim 4 February as the International Day of Human Fraternity, to be observed each year beginning in 2021;",
    "2": "Invites all Member States, relevant organizations of the United Nations system, other international organizations and civil society, including non-governmental organizations and the private sector, to observe the International Day of Human Fraternity annually on 4 February in a manner that each considers most appropriate, with the cost covered exclusively by voluntary contributions;",
    "3": "Invites all Member States to further promote the culture of peace to help to ensure peace and sustainable development, including through the celebration of the international, regional and national days in this regard and by mobilizing the efforts of the international community to promote peace, tolerance, inclusion, understanding and solidarity. 47th plenary meeting 21 December 2020"
  },
  "agenda_items": [
    "Item 15"
  ],
  "symbol_references": [
    "A/75/L.52"
  ]
}