{
  "symbol": "A/RES/74/19",
  "filename": "A_RES_74_19.pdf",
  "title": "74/19. Oceans and the law of the sea",
  "text": "United Nations \nA/RES/74/19\n \n \nGeneral Assembly \nDistr.: General \n20 December 2019 \n \n19-21313 (E)    111219    090120 \n*1921313* \n \n \nSeventy-fourth session \nAgenda item 74 (a) \nOceans and the law of the sea: oceans and the law of the sea \n \n \n \n \n Resolution adopted by the General Assembly \non 10 December 2019 \n \n \n \n \n[without reference to a Main Committee (A/74/L.22 and A/74/L.22/Add.1)] \n \n \n \n74/19. Oceans and the law of the sea \n \n \n \nThe General Assembly, \n \nReaffirming its annual resolutions on the law of the sea and on oceans and the \nlaw of the sea, including resolution 73/124 of 11 December 2018, as well as other \nrelevant resolutions concerning the United Nations Convention on the Law of the Sea \n(the Convention),1 \n \nRecalling, in this regard, resolution 72/249 of 24 December 2017 on an \ninternational legally binding instrument under the Convention on the conservation and \nsustainable use of marine biological diversity of areas beyond national jurisdiction,  \n \nUnderscoring the importance of the work undertaken by the intergovernmental \nconference to elaborate the text of an international legally binding instrument under \nthe Convention on the conservation and sustainable use of marine biological diversity \nof areas beyond national jurisdiction, \n \nHaving considered the reports of the Secretary-General,2 the reports on the work \nof the Ad Hoc Working Group of the Whole on the Regular Process for Global \nReporting and Assessment of the State of the Marine Environment, including \nSocioeconomic Aspects (the Regular Process)3 and of the United Nations Open-ended \nInformal Consultative Process on Oceans and the Law of the Sea (the Informal \nConsultative Process) at its twentieth meeting4 and the report of the twenty-ninth \nMeeting of States Parties to the Convention,5 \n__________________ \n \n1 United Nations, Treaty Series, vol. 1833, No. 31363. \n \n2 A/74/70 and A/74/350. \n \n3 A/74/315. \n \n4 A/74/119. \n \n5 SPLOS/29/9. \n\nA/RES/74/19 \nOceans and the law of the sea\n \n19-21313\n2/57 \n \n \nNoting with satisfaction that 16 November 2019 marked the twenty-fifth \nanniversary of the entry into force of the Convention, and recognizing the pre-eminent \ncontribution provided by the Convention to the strengthening of peace, security, \ncooperation and friendly relations among all nations in conformity with the principles \nof justice and equal rights and to the promotion of the economic and social \nadvancement of all peoples of the world, in accordance with the purposes and \nprinciples of the United Nations as set forth in the Charter of the United Nations, as \nwell as to the sustainable development of the oceans and seas,  \n \nEmphasizing the universal and unified character of the Convention, and \nreaffirming that the Convention sets out the legal framework within which all \nactivities in the oceans and seas must be carried out and is of strategic importance as \nthe basis for national, regional and global action and cooperation in the marine sector, \nand that its integrity needs to be maintained, as recognized also by the United Nations \nConference on Environment and Development in chapter 17 of Agenda 21, 6 \n \nNoting with satisfaction that, in the outcome document of the United Nations \nConference on Sustainable Development, held in Rio de Janeiro, Brazil, from 20 to \n22 June 2012, entitled \u201cThe future we want\u201d,7 as endorsed by the General Assembly \nin resolution 66/288 of 27 July 2012, States recognized that oceans, seas and coastal \nareas form an integrated and essential component of the Earth\u2019s ecosystem and are \ncritical to sustaining it, and that international law, as reflected in the Convention, \nprovides the legal framework for the conservation and sustainable use of the oceans \nand their resources, and stressed the importance of the conservation and sustainable \nuse of the oceans and seas and of their resources for sustainable development, \nincluding through their contributions to poverty eradication, sustained economic \ngrowth, food security and creation of sustainable livelihoods and decent work, while \nat the same time protecting biodiversity and the marine environment and addressing \nthe impacts of climate change,  \n \nRecalling that, in \u201cThe future we want\u201d, States underscored that broad public \nparticipation and access to information and judicial and administrative proceedings \nwere essential to the promotion of sustainable development and that sustainable \ndevelopment required the meaningful involvement and active participation of \nregional, national and subnational legislatures and judiciaries, and all major groups, \nand, in this regard, that they agreed to work more closely with major groups and other \nstakeholders and encouraged their active participation, as appropriate, in processes \nthat contribute to decision-making, planning and implementation of policies and \nprogrammes for sustainable development at all levels,  \n \nRecalling also the 2030 Agenda for Sustainable Development, 8 and in this \nregard reaffirming the commitment to conserve and sustainably use the oceans, seas \nand marine resources for sustainable development, as reflected in Goal 14 of the 2030 \nAgenda, which is important to the achievement of the Sustainable Development Goals \ncontained in the 2030 Agenda,  \n \nRecalling further its resolution 71/312 of 6 July 2017 in which it endorsed the \ndeclaration entitled \u201cOur ocean, our future: call for action\u201d adopted by the high-level \nUnited Nations Conference to Support the Implementation of Sustainable \nDevelopment Goal 14: Conserve and sustainably use the oceans, seas and marine \nresources for sustainable development, held from 5 to 9 June 2017, coinciding with \n__________________ \n \n6 Report of the United Nations Conference on Environment and Development, Rio de Janeiro, \n3\u221214 June 1992, vol. I, Resolutions Adopted by the Conference (United Nations publication, \nSales No. E.93.I.8 and corrigendum), resolution 1, annex II. \n \n7 Resolution 66/288, annex. \n \n8 Resolution 70/1. \n\nOceans and the law of the sea \nA/RES/74/19\n \n3/57\n19-21313 \n \nWorld Oceans Day on 8 June, and in this regard affirming the important role of the \ndeclaration in demonstrating the collective will to take action to conserve and \nsustainably use our oceans, seas and marine resources for sustainable development, \n \nRecognizing the important contributions of the partnership dialogues and \nvoluntary commitments made in the context of the high-level 2017 United Nations \nConference to Support the Implementation of Sustainable Development Goal 14 to \nthe effective and timely implementation of Goal 14, \n \nRecalling its decision to convene the high-level 2020 United Nations \nConference to Support the Implementation of Sustainable Development Goal 14: \nConserve and sustainably use the oceans, seas and marine resources for sustainable \ndevelopment in Lisbon, from 2 to 6 June 2020, to support the implementation of \nSustainable Development Goal 14,9 \n \nRecognizing paragraphs 64 and 65 of the Addis Ababa Action Agenda of the \nThird International Conference on Financing for Development, adopted by the \nConference, which was held from 13 to 16 July 2015,10 \n \nWelcoming the ocean-related outcomes of the fourth session of the United \nNations Environment Assembly of the United Nations Environment Programme, \nespecially the resolutions on marine plastic litter and microplastics,11 on protection of \nthe marine environment from land-based activities,12 on sustainable management for \nglobal health of mangroves, 13  on sustainable coral reefs management 14  and on \nsustainable nitrogen management,15 \n \nWelcoming also the adoption by the International Maritime Organization of the \nAction Plan to Address Marine Plastic Litter from Ships, 16 and noting that the fortieth \nConsultative Meeting of Contracting Parties to the Convention on the Prevention of \nMarine Pollution by Dumping of Wastes and Other Matter, 1972 (the London \nConvention) and the thirteenth Meeting of Contracting Parties to the 1996 Protocol \nto that Convention, held from 5 to 9 November 2018, identified a number of actions \nrelevant to the London Convention and the Protocol thereto and reiterated the \ncommitment of the governing bodies to combat marine litter and microplastics, \n \nConscious that the problems of ocean space are closely interrelated and need to \nbe considered as a whole through an integrated, interdisciplinary and intersectoral \napproach, and reaffirming the need to improve cooperation and coordination at the \nnational, regional and global levels, in accordance with the Convention, to support \nand supplement the efforts of each State in promoting the implementation and \nobservance of the Convention and the integrated management and sustainable \ndevelopment of the oceans and seas,  \n \nReiterating the essential need for cooperation, including through capacity-\nbuilding and transfer of marine technology, to ensure that all States, especially \ndeveloping countries, in particular the least developed countries, landlocked \ndeveloping countries and small island developing States, as well as coastal African \nStates, are able both to implement the Convention and to benefit from the sustainable \ndevelopment of the oceans and seas, as well as to participate fully in global and \n__________________ \n \n9 See resolution 73/292. \n \n10 Resolution 69/313, annex. \n \n11 UNEP/EA.4/Res.6. \n \n12 UNEP/EA.4/Res.11. \n \n13 UNEP/EA.4/Res.12. \n \n14 UNEP/EA.4/Res.13. \n \n15 UNEP/EA.4/Res.14. \n \n16 Marine Environment Protection Committee, document MEPC 73/19/Add.1, annex 10, resolution \nMEPC.310(73). \n\nA/RES/74/19 \nOceans and the law of the sea\n \n19-21313\n4/57 \n \nregional forums and processes dealing with oceans and law of the sea issues, while \nrecognizing the need to also address the particular challenges faced by developing \nmiddle-income countries, \n \nEmphasizing the need to strengthen the ability of competent international \norganizations to contribute, at the global, regional, subregional and bilateral levels, \nthrough cooperation programmes with Governments, to the development of national \ncapacity in marine science and the sustainable management of the oceans and their \nresources, \n \nRecalling that marine science is important for eradicating poverty, contributing \nto food security, conserving the world\u2019s marine environment and resources, helping \nto understand, predict and respond to natural events and promoting the sustainable \ndevelopment of the oceans and seas, by improving knowledge, through sustained \nresearch efforts and the evaluation of monitoring results, and applying such \nknowledge to management and decision-making,  \n \nReiterating its deep concern at the serious adverse impacts on the marine \nenvironment and biodiversity, in particular on vulnerable marine ecosystems and their \nphysical and biogenic structure, including coral reefs, cold water habitats, \nhydrothermal vents and seamounts, of certain human activities,  \n \nEmphasizing the need for the safe and environmentally sound recycling of ships, \n \nExpressing deep concern at the adverse economic, social and environmental \nimpacts of the physical alteration and destruction of marine habitats that may result \nfrom land-based and coastal development activities, in particular those land \nreclamation activities that are carried out in a manner that has a detrimental impact \non the marine environment, \n \nReiterating its serious concern at the current and projected adverse effects of \nclimate change and ocean acidification on the marine environment and marine \nbiodiversity, and emphasizing the urgency of addressing these issues,  \n \nNoting with concern, in this regard, the findings by the World Meteorological \nOrganization, in its annual Greenhouse Gas Bulletin, that, in 2017, carbon dioxide \nlevels in the atmosphere surpassed 405 parts per million, which represents an increase \nof 2.2 parts per million, a relative increase of 0.55 per cent, over the period 2016\u20132017, \nand the findings in its Statement on the State of the Global Climate in 2018 that global \nmean temperatures in 2018 were about 1\u00b0C above the 1850 to 1900 average, \n \nNoting with concern also that the World Meteorological Organization, in its \nStatement on the State of the Global Climate in 2018, highlighted that the world also \ncontinued to see increasing ocean heat content, rising sea levels, with some \nacceleration, and increasing concentrations of greenhouse gases, while the cryosphere \ncontinued its contraction, with global sea ice shrinking, \n \nExpressing concern that climate change continues to increase the severity and \nincidence of coral bleaching throughout tropical seas and weakens the ability of reefs \nto withstand ocean acidification, which could have serious and irreversible negative \neffects on marine organisms, particularly corals, as well as to withstand other \npressures, including overfishing and pollution,  \n \nReiterating its deep concern at the vulnerability of the environment and the \nfragile ecosystems of the polar regions, including the Arctic Ocean and the Arctic ice \ncap, particularly affected by the observed and projected adverse effects of climate \nchange and ocean acidification, \n\nOceans and the law of the sea \nA/RES/74/19\n \n5/57\n19-21313 \n \n \nRecognizing the need for a more integrated and ecosystem-based approach to, \nfurther study of and the promotion of measures for enhanced cooperation, \ncoordination and collaboration relating to the conservation and sustainable use of \nmarine biological diversity of areas beyond national jurisdiction,  \n \nRecognizing also that the realization of the benefits of the Convention could be \nenhanced by international cooperation, technical assistance and advanced scientific \nknowledge, as well as by funding and capacity-building,  \n \nRecognizing further that hydrographic surveys and nautical charting are critical \nto the safety of navigation and life at sea, environmental protection, including the \nprotection of vulnerable marine ecosystems, and the economics of the global shipping \nindustry, and encouraging further efforts towards electronic charting, which not only \nprovides significantly increased benefits for safe navigation and management of ship \nmovement, but also provides data and information that can be used for sustainable \nfisheries activities and other sectoral uses of the marine environment, the delimitation \nof maritime boundaries and environmental protection, and noting that, under the \nInternational Convention for the Safety of Life at Sea, 1974, 17 ships on international \nvoyages are required to carry an electronic chart display and information system, in \naccordance with the implementation schedule as set out in that Convention,  \n \nRecognizing that ocean data buoys deployed and operated in accordance with \ninternational law are critical for improving understanding of weather, climate and \necosystems, and that certain types of ocean data buoys contribute to saving lives by \ndetecting tsunamis, and reiterating its serious concern at intentional and unintentional \ndamage to such buoys,  \n \nEmphasizing that underwater archaeological, cultural and historical heritage, \nincluding shipwrecks and watercraft, holds essential information on the history of \nhumankind and that such heritage is a resource that needs to be protected and preserved,  \n \nRecognizing the duty of States under article 303, paragraph 1, of the Convention \nto protect objects of an archaeological and historical nature found at sea and to \ncooperate for this purpose, \n \nExpressing concern, in this regard, at various threats posed to such objects, \nincluding their destruction as well as the illicit trafficking in such objects, \n \nRecognizing that illicit trafficking in wildlife is, in some cases, committed by \ntransnational organized criminal groups using maritime routes, contributes to \nbiodiversity loss and damage to ecosystems and livelihoods and requires enhanced \nregional and global cooperation and coordination in response, in accordance with \ninternational law, \n \nNoting with concern the continuing problem of transnational organized crime \ncommitted at sea, including illicit traffic in narcotic drugs and psychotropic substances, \nthe smuggling of migrants, trafficking in persons and illicit trafficking in firearms, and \nthreats to maritime safety and security, including piracy, armed robbery at sea, \nsmuggling and terrorist acts against shipping, offshore installations and other maritime \ninterests, and noting the deplorable loss of life and adverse impact on international \ntrade, energy security and the global economy resulting from such activities, \n \nReiterating the importance of the fair treatment of crew members and its \ninfluence on maritime safety, \n \nRecognizing that fibre-optic submarine cables transmit most of the world\u2019s data \nand communications and hence are vitally important to the global economy and the \nnational security of all States, conscious that these cables are susceptible to \n__________________ \n \n17 United Nations, Treaty Series, vol. 1184, No. 18961. \n\nA/RES/74/19 \nOceans and the law of the sea\n \n19-21313\n6/57 \n \nintentional and accidental damage from shipping and other activities and that the \nmaintenance, including the repair, of these cables is important, noting that these \nmatters have been brought to the attention of States at various workshops and \nseminars, and conscious of the need for States to adopt national laws and regulations \nto protect submarine cables and render their wilful damage or damage by culpable \nnegligence punishable offences,  \n \nNoting the importance of the delineation of the outer limits of the continental \nshelf beyond 200 nautical miles and that it is in the broader interest of the international \ncommunity that coastal States with a continental shelf beyond 200 nautical miles \nsubmit information on the outer limits of the continental shelf beyond 200 nautical \nmiles to the Commission on the Limits of the Continental Shelf (the Commission), \nand welcoming the submissions to the Commission by a considerable number of \nStates Parties to the Convention on the outer limits of their continental shelf beyond \n200 nautical miles, that the Commission has continued to fulfil its role, including of \nmaking recommendations to coastal States, and that the summaries of \nrecommendations are being made publicly available, 18 \n \nNoting also that some coastal States may continue to face particular challenges \nin relation to preparing and presenting submissions to the Commission,  \n \nNoting further that financial and technical assistance may be sought by \ndeveloping countries for activities in relation to preparing and presenting submissions \nto the Commission, including additional information with respect to submissions and \nrevised or new submissions, including through the voluntary trust fund established by \nthe General Assembly in its resolution 55/7 of 30 October 200019 for the purpose of \nfacilitating the preparation of submissions to the Commission for developing States, \nin particular the least developed countries and small island developing States, and \ncompliance with article 76 of the Convention, as well as other accessible international \nassistance, \n \nReaffirming the importance of the work of the Commission for coastal States \nand for the international community,  \n \nRecognizing that practical difficulties can arise when there is a considerable \ndelay between the preparation of submissions and their consideration by the \nCommission, including in retaining expertise up to and during the consideration of \nthe submissions by the Commission,  \n \nRecognizing also the significant workload of the Commission in view of the \nlarge number of submissions already received and a number of submissions yet to be \nreceived, which places significant demands and challenges on its members and the \nsecretariat as provided by the Secretary-General of the United Nations through the \nDivision for Ocean Affairs and the Law of the Sea of the Office of Legal Affairs of \nthe Secretariat (the Division), \n \nNoting with concern the projected timetable of the work of the Commission on \nthe submissions already received by it and those yet to be received, and in this regard \nnoting the decisions of the Meeting of States Parties to the Convention to request the \nCommission to consider, in coordination with the secretariat, within the existing \nresources made available to the Secretariat, that the Commission, and its \nsubcommissions meeting simultaneously as far as possible, meet at United Nations \nHeadquarters for up to 26 weeks but not less than an intended minimum of 21 weeks \n__________________ \n \n18 Available from the web page of the Commission maintained by the Division for Ocean Affairs \nand the Law of the Sea. \n \n19 The terms of reference, guidelines and rules of the trust fund were amended by the General \nAssembly in its resolutions 58/240, 70/235 and 73/124. \n\nOceans and the law of the sea \nA/RES/74/19\n \n7/57\n19-21313 \n \na year, distributed in such a way that the Commission determines to be the most \neffective, and that no two sessions be sequential,20 \n \nRecognizing the need to ensure that the Commission can perform its functions \nunder the Convention expeditiously, efficiently and effectively and maintain its high \nlevel of quality and expertise,  \n \nExpressing concern about the implications of the workload of the Commission \nfor the conditions of service of its members, \n \nRecalling, in this regard, the decisions of the twenty-fifth, twenty-sixth and \ntwenty-ninth Meetings of States Parties to the Convention regarding the conditions \nof service of the members of the Commission,21 \n \nRecalling also its decision, in resolutions 57/141 of 12 December 2002 and \n58/240 of 23 December 2003, to establish a regular process under the United Nations \nfor global reporting and assessment of the state of the marine environment, including \nsocioeconomic aspects, both current and foreseeable, building on existing regional \nassessments, as recommended by the World Summit on Sustainable Development, 22 \nand noting the need for cooperation among all States to this end, \n \nRecalling further its decisions, in resolution 65/37 A of 7 December 2010, \nresolution 66/231 of 24 December 2011, resolution 70/235 of 23 December 2015, \nresolution 71/257 of 23 December 2016, resolution 72/73 of 5 December 2017 and \nresolution 73/124, regarding the Regular Process, as established under the United \nNations and accountable to the General Assembly, \n \nRecalling that the Division was designated to provide secretariat support to the \nRegular Process, including its established institutions,  \n \nReaffirming the cross-cutting role of ocean science in Sustainable Development \nGoal 14 of the 2030 Agenda, \n \nReaffirming also its decision, in resolution 72/73, to proclaim the United \nNations Decade of Ocean Science for Sustainable Development for the 10-year period \nbeginning on 1 January 2021, within existing structures and available resources, \n \nRecognizing the importance and the contribution of the work of the Informal \nConsultative Process established by the General Assembly in its resolution 54/33 of \n24 November 1999 to facilitate the annual review of developments in ocean affairs \nby the Assembly,  \n \nNoting the continuously growing responsibilities of the Secretary-General under \nthe Convention and related resolutions of the General Assembly, in particular \nresolutions 49/28 of 6 December 1994, 52/26 of 26 November 1997, 54/33, 65/37 A, \n65/37 B of 4 April 2011, 66/231, 67/78 of 11 December 2012, 68/70 of 9 December \n2013, 69/245 of 29 December 2014, 70/235, 71/257, 72/73, 72/249 and 73/124, and \nin this context the unprecedented substantial increase in activities of the Division, in \nparticular in view of the growing number of requests to the Division for additional \noutputs and servicing of meetings, the provision of technical assistance and capacity-\nbuilding, the need for enhanced support and assistance to the Commission and the \nrole of the Division in carrying out its functions as the secretariat of the Regular \nProcess, in relation to the functions as focal point for UN-Oceans and in relation to \n__________________ \n \n20 See SPLOS/229 and SPLOS/303. \n \n21 See SPLOS/286, SPLOS/303 and SPLOS/29/9. \n \n22 See Report of the World Summit on Sustainable Development, Johannesburg, South Africa, \n26 August\u20134 September 2002 (United Nations publication, Sales No. E.03.II.A.1 and \ncorrigendum), chap. I, resolution 2, annex. \n\nA/RES/74/19 \nOceans and the law of the sea\n \n19-21313\n8/57 \n \nsupport for the implementation by Member States of the oceans-related Sustainable \nDevelopment Goals in the 2030 Agenda, \n \nReaffirming the importance of the work of the International Seabed Authority \n(the Authority) in accordance with the Convention and the Agreement relating to the \nImplementation of Part XI of the United Nations Convention on the Law of the Sea \nof 10 December 1982 (the Part XI Agreement),23 \n \nReaffirming also the importance of the work of the International Tribunal for \nthe Law of the Sea (the Tribunal) in accordance with the Convention, \n \n \n \nI \n \n \nImplementation of the Convention and related agreements and instruments \n \n \n1. \nReaffirms the unified character of the Convention1 and the vital \nimportance of preserving its integrity;  \n \n2. \nCalls upon all States that have not done so, in order to fully achieve the \ngoal of universal participation, to become parties to the Convention and the Part XI \nAgreement;23 \n \n3. \nCalls upon States that have not done so, in order to achieve the goal of \nuniversal participation, to become parties to the Agreement for the Implementation \nof the Provisions of the United Nations Convention on the Law of the Sea of \n10 December 1982 relating to the Conservation and Management of Straddling Fish \nStocks and Highly Migratory Fish Stocks (the Fish Stocks Agreement); 24 \n \n4. \nCalls upon States to harmonize their national legislation with the \nprovisions of the Convention and, where applicable, relevant agreements and \ninstruments, to ensure the consistent application of those provisions and to ensure \nalso that any declarations or statements that they have made or make when signing, \nratifying or acceding to the Convention do not purport to exclude or to modify the \nlegal effect of the provisions of the Convention in their application to the State \nconcerned and to withdraw any such declarations or statements;  \n \n5. \nCalls upon States Parties to the Convention that have not yet done so to \ndeposit with the Secretary-General charts or lists of geographical coordinates, as \nprovided for in the Convention, preferably using the generally accepted and most \nrecent geodetic datums;  \n \n6. \nNotes, in this regard, the ongoing efforts of the Secretary-General to \nimprove the existing geographic information system for the deposit by States of charts \nand geographical coordinates concerning maritime zones, including lines of \ndelimitation, submitted pursuant to the Convention, and to give due publicity thereto, \nalso notes the ongoing cooperation and progress achieved in the development by the \nInternational Hydrographic Organization, in cooperation with the Division, of the \ntechnical standards for the collection, storage and dissemination of the information \ndeposited, which are not legally binding, in order to ensure compatibility among \ngeographic information systems, electronic nautical charts and other systems, and \nre-emphasizes the importance of the completion of these efforts through wide \nparticipation and reviews by Member States;  \n \n7. \nAlso notes that the twenty-ninth Meeting of States Parties to the \nConvention requested the Secretariat to prepare a note on the practice of the \nSecretary-General in respect of the deposit of charts and geographical coordinates \nunder the Convention for submission to the thirtieth Meeting, in 2020;5 \n__________________ \n \n23 United Nations, Treaty Series, vol. 1836, No. 31364. \n \n24 Ibid., vol. 2167, No. 37924. \n\nOceans and the law of the sea \nA/RES/74/19\n \n9/57\n19-21313 \n \n \n8. \nUrges all States to cooperate, directly or through competent international \nbodies, in taking measures to protect and preserve objects of an archaeological and \nhistorical nature found at sea, in conformity with the Convention, and calls upon \nStates to work together on such diverse challenges and opportunities as the \nappropriate relationship between salvage law and scientific management and \nconservation of underwater cultural heritage, increasing technological abilities to \ndiscover and reach underwater sites, looting and growing underwater tourism; \n \n9. \nAcknowledges the recent deposit of instruments of ratification of the 2001 \nConvention on the Protection of the Underwater Cultural Heritage, 25 calls upon States \nthat have not yet done so to consider becoming parties to that Convention, and notes \nin particular the rules annexed to that Convention, which address the relationship \nbetween salvage law and scientific principles of management, conservation and \nprotection of underwater cultural heritage among Parties, their nationals and vessels \nflying their flag; \n \n \n \nII \n \n \nCapacity-building \n \n \n10. Recognizes the importance of assisting developing States, in particular the \nleast developed countries, landlocked developing countries and small island \ndeveloping States, as well as coastal African States, in implementing the Convention, \nurges States, international financial institutions, donor agencies, intergovernmental \norganizations, non-governmental organizations and natural and juridical persons to \nmake voluntary financial or other contributions to the trust funds, as referred to in \nresolutions 55/7, 57/141, and 64/71 of 4 December 2009, established for this purpose, \nand expresses its appreciation to those that have contributed;26 \n \n11. \nEmphasizes that capacity-building is essential to ensure that States, \nespecially developing countries, in particular the least developed countries, \nlandlocked developing countries and small island developing States, as well as coastal \nAfrican States, are able to fully implement the Convention, benefit from the \nsustainable development of the oceans and seas and participate fully in global and \nregional forums on ocean affairs and the law of the sea;  \n \n12. Also emphasizes the need to address the particular challenges faced by \ndeveloping middle-income countries through capacity-building;  \n \n13. Calls for capacity-building initiatives to take into account the needs of \ndeveloping countries, and calls upon States, international organizations and donor \nagencies to make efforts to ensure the sustainability of such initiatives;  \n \n14. \nRecalls, in this regard, that, in \u201cThe future we want\u201d,7 States recognized the \nimportance of building the capacity of developing countries to be able to benefit from \nthe conservation and sustainable use of the oceans and seas and their resources, and in \nthis regard emphasized the need for cooperation in marine scientific research to \nimplement the provisions of the Convention and the outcomes of the major summits on \nsustainable development, as well as for the transfer of technology, taking into account \nthe Criteria and Guidelines on the Transfer of Marine Technology adopted by the \nAssembly of the Intergovernmental Oceanographic Commission of the United Nations \nEducational, Scientific and Cultural Organization at its twenty-second session, in 2003;  \n \n15. Emphasizes the need for international cooperation for capacity-building, \nincluding cross-sectoral cooperation, at national, regional and global levels, to \naddress, in particular, gaps in capacity-building in ocean affairs and the law of the \nsea, including marine science;  \n__________________ \n \n25 Ibid., vol. 2562, No. 45694. \n \n26 See www.un.org/Depts/los/general_assembly/TrustFunds.pdf.  \n\nA/RES/74/19 \nOceans and the law of the sea\n \n19-21313\n10/57 \n \n \n16. Calls upon donor agencies and international financial institutions to keep \ntheir programmes systematically under review to ensure the availability in all States, \nparticularly in developing States, of the economic, legal, navigational, scientific and \ntechnical skills necessary for the full implementation of the Convention and the \nobjectives of the present resolution, as well as the sustainable development of the \noceans and seas nationally, regionally and globally, and in so doing to bear in mind \nthe interests and needs of landlocked developing States;  \n \n17. Encourages intensified efforts to build capacity for developing countries, \nin particular for the least developed countries and small island developing States, as \nwell as coastal African States, to improve aids to navigation and search and rescue \nservices, hydrographic services and the production of nautical charts, including \nelectronic charts, as well as the mobilization of resources and building of capacity \nwith support from international financial institutions and the donor community; \n \n18. Calls upon States and international organizations, including through \nbilateral, regional and global cooperation programmes, technical partnerships and \nfellowships, to continue in a sustainable and comprehensive way to support, promote \nand strengthen capacity-building activities, in particular in developing countries, in \nthe field of marine scientific research by, inter alia, training personnel to develop and \nenhance relevant expertise, providing the necessary equipment, facilities and vessels \nand transferring environmentally sound technologies, and taking into account the \nneed to improve capacities in the field of taxonomy; \n \n19. Also calls upon States and international institutions, including through \nbilateral, regional and global cooperation programmes, technical partnerships and \nfellowships, to support and strengthen capacity-building activities in developing \ncountries, in particular least developed countries and small island developing States, \nto develop their maritime administration and appropriate legal frameworks to \nestablish or enhance the necessary infrastructure, legislative and enforcement \ncapabilities to promote effective compliance with and implementation and \nenforcement of their responsibilities under international law;  \n \n20. Invites States, in particular those States with advanced technology and \nmarine capabilities, to explore prospects for improving cooperation with and \nassistance to developing States, in particular least developed countries, landlocked \ndeveloping countries and small island developing States, as well as coastal African \nStates, with a view to better integrating into national policies and programmes \nsustainable and effective development in the marine sector;  \n \n21. Recognizes that promoting the voluntary transfer of technology is an \nessential aspect of building capacity in marine science, encourages States to use the \nIntergovernmental Oceanographic Commission Criteria and Guidelines on the \nTransfer of Marine Technology, and recalls the important role of the secretariat of that \nCommission in the implementation and promotion of the Criteria and Guidelines;  \n \n22. Calls upon States and international institutions, including through \nbilateral, regional and global cooperation programmes, technical partnerships and \nfellowships, to develop and strengthen capacity-building activities in and to transfer \nto developing countries, in particular least developed countries and small island \ndeveloping States, on mutually agreed terms, and taking into account the Criteria and \nGuidelines on the Transfer of Marine Technology, environmentally sound \ntechnologies to study and minimize the impacts of ocean acidification;  \n \n23. \nNotes the international scientific cooperation through the Ocean Acidification \nInternational Coordination Centre of the International Atomic Energy Agency and within \nthe Global Ocean Acidification Observing Network, and their respective efforts in \n\nOceans and the law of the sea \nA/RES/74/19\n \n11/57\n19-21313 \n \nbuilding scientific capacity for ocean acidification monitoring, research and \nexperimentation, including through the Pier2Peer scientific mentorship programme; \n \n24. Recognizes the ongoing activities of the secretariat of the Convention on \nBiological Diversity in coordinating capacity-building efforts to support developing \nStates in achieving the Aichi Biodiversity Targets in marine and coastal areas;27 \n \n25. Emphasizes the need to focus on strengthening South-South cooperation \nas an additional way to build capacity and as a cooperative mechanism to further \nenable countries to set their own priorities and needs and to foster actions to \nimplement such cooperation; \n \n26. Recognizes with appreciation the important contribution to capacity-\nbuilding in the field of the law of the sea by the Rhodes Academy of Oceans Law and \nPolicy, a cooperative undertaking by the Center for Oceans Law and Policy of the \nUniversity of Virginia School of Law, the Aegean Institute of the Law of the Sea and \nMaritime Law, the Law of the Sea Institute of Iceland, the Max Planck Institute for \nComparative Public Law and International Law, the Netherlands Institute for the Law \nof the Sea of Utrecht University and the Centre for International Law of the National \nUniversity of Singapore, which enjoys associate sponsorship of the Korea Maritime \nInstitute and the Ankara University Research Center of the Sea and Maritime Law \nand offers a prominent three-week summer course annually in Rhodes, Greece, and \nhas graduated 998 students from more than 120 countries;  \n \n27. Also recognizes with appreciation the important contribution to capacity-\nbuilding in the field of the law of the sea by the Summer Academy of the International \nFoundation for the Law of the Sea at the Tribunal;  \n \n28. Further recognizes with appreciation the important contribution of the \nKorea Maritime Institute to the trust fund to support the internship programmes at the \nTribunal since 2011 and its continued efforts, in cooperation with the Expo 2012 \nYeosu Korea Foundation, to provide education and training for capacity-building of \ndeveloping countries through the Yeosu Academy of the Law of the Sea programme; \n \n29. Recognizes the holding of the regional courses on the continental shelf in \nArusha, United Republic of Tanzania, jointly organized by the African Institute of \nInternational Law and the University of the Faroe Islands, and their continuing \nimportant contribution to capacity-building, particularly in developing countries;  \n \n30. Also recognizes the importance of the work of the Malta-based \nInternational Maritime Law Institute of the International Maritime Organization, as a \ncentre of education and training of specialists in maritime law, including government \nlegal advisers and other high-level officials, mainly from developing States, confirms \nits effective capacity-building role in the field of international maritime law, shipping \nlaw and marine environmental law, and urges States, intergovernmental organizations \nand financial institutions to make voluntary financial contributions to the budget of \nthe Institute which runs annually;  \n \n31. Further recognizes the importance of the World Maritime University of \nthe International Maritime Organization, as a centre of excellence for maritime \neducation and research, confirms its effective capacity-building role in the field of \nmaritime transportation, policy, administration, management, safety, security and \nenvironmental protection, as well as its role in the international exchange and transfer \nof knowledge, notes the role of the World Maritime University-Sasakawa Global \n__________________ \n \n27 See United Nations Environment Programme, document UNEP/CBD/COP/12/29, sect. I, and \nConference of the Parties to the Convention on Biological Diversity decision XII/23, paras. 19\u201322. \n\nA/RES/74/19 \nOceans and the law of the sea\n \n19-21313\n12/57 \n \nOcean Institute, and urges States, intergovernmental organizations and other bodies \nto make voluntary financial contributions to the University\u2019s Endowment Fund; \n \n32. Welcomes the efforts of the Tribunal in holding regional workshops, \nincluding the latest workshop on the role of the Tribunal in the settlement of disputes \nrelating to the law of the sea for the Latin American region, held in Montevideo on \n13 and 14 November 2019, in cooperation with the Government of Uruguay and the \nKorea Maritime Institute;  \n \n33. Also welcomes ongoing activities for capacity-building so as to address \nmaritime security and protection of the marine environment of developing States, and \nencourages States and international financial institutions to provide additional \nfunding for capacity-building programmes, including for transfer of technology, \nincluding through the International Maritime Organization and other competent \ninternational organizations;  \n \n34. Recognizes the considerable need to provide sustained capacity-building \nassistance, including on financial and technical aspects, by relevant international \norganizations and donors to developing States, with a view to further strengthening \ntheir capacity to take effective measures against the multiple facets of international \ncriminal activities at sea, in line with the relevant international instruments, including \nthe United Nations Convention against Transnational Organized Crime and the \nProtocols thereto;28 \n \n35. Also recognizes the need to build the capacity of developing States to raise \nawareness of and support the implementation of improved waste management \npractices, noting the particular vulnerability of small island developing States to the \nimpact of marine pollution of all kinds, in particular from land-based activities and \nmarine debris and nutrient pollution;29 \n \n36. Acknowledges the importance of capacity-building for developing States, \nin particular the least developed countries, landlocked developing countries and small \nisland developing States, as well as coastal African States, for the protection of the \nmarine environment and the conservation and sustainable use of marine resources;  \n \n37. Encourages States to consider additional opportunities for capacity-\nbuilding at the regional level;  \n \n38. Takes note of the first edition of the Global Ocean Science Report of the \nIntergovernmental Oceanographic Commission, which assesses for the first time the \nstatus of and trends in ocean science capacity around the world; \n \n39. Also takes note of the Capacity Development Strategy (2015\u20132021) of the \nIntergovernmental Oceanographic Commission, which takes into account that \ncapacity development is a fundamental tenet of the mission of the Intergovernmental \nOceanographic Commission;  \n \n40. Expresses its appreciation for the contribution of the Intergovernmental \nOceanographic Commission to capacity-building through its Ocean Teacher Academy \ntraining system, which has provided training in ocean data and information \nmanagement, and notes the setting up of the Ocean Teacher Global Academy, \noperating through a network of regional training centres, which builds capacity and \npromotes expertise available in developing countries;  \n \n41. Welcomes the establishment by the Assembly of the Intergovernmental \nOceanographic Commission at its twenty-ninth session of the Group of Experts on \n__________________ \n \n28 United Nations, Treaty Series, vols. 2225, 2237, 2241 and 2326, No. 39574. \n \n29 See 2012 Guidelines for the Development of a Regional Reception Facilities Plan, International \nMaritime Organization, resolution MEPC.221(63). \n\nOceans and the law of the sea \nA/RES/74/19\n \n13/57\n19-21313 \n \nCapacity Development and, in particular, its invitation to the Group of Experts in its \ndecision IOC-XXX/11.1 to continue the assessment of the capacity development \nneeds of the Intergovernmental Oceanographic Commission member States and to \nprepare a proposal for the development of an Intergovernmental Oceanographic \nCommission Clearing House Mechanism for the Transfer of Marine Technology, \nincluding analysis of the possibility of expanding the clearing house mechanism to \nrespond to other requirements; \n \n42. Calls upon States to continue to assist developing States, and especially \nthe least developed countries and small island developing States, as well as coastal \nAfrican States, at the bilateral and, where appropriate, multilateral levels, in the \npreparation of submissions to the Commission regarding the establishment of \nthe outer limits of the continental shelf beyond 200 nautical miles, including the \nassessment of the nature and extent of the continental shelf of a coastal State, and \nrecalls that coastal States can make requests to the Commission for scientific and \ntechnical advice in the preparation of data for their submissions, in accordance with \narticle 3 of annex II to the Convention; \n \n43. \nRecognizes the importance of the trust fund established pursuant to resolution \n55/7 for the purpose of facilitating the preparation of submissions to the Commission for \ndeveloping States, in particular the least developed countries and small island \ndeveloping States, and compliance with article 76 of the Convention, and for the purpose \nof providing assistance to developing States to meet the travel and daily subsistence \nallowance costs associated with meeting with the Commission when their submissions \nare being examined and upon the invitation of the Commission,30 in accordance with \nparagraph 31 of the terms of reference, guidelines and rules of the trust fund, and also \nrecognizes the need for assistance in the preparation of additional information with \nrespect to submissions and revised or new submissions and in maintaining critical \ncapacity during the period from the submission by a coastal developing State of the \nparticulars of the outer limits of its continental shelf beyond 200 nautical miles to the \nCommission up to the final stages of its examination by the Commission;  \n \n44. Calls upon the Division to continue to disseminate information on relevant \nprocedures related to the trust fund established for the purpose of facilitating the \npreparation of submissions to the Commission and to continue its dialogue with \npotential beneficiaries with a view to providing financial support to developing \ncountries for activities to facilitate their submissions in accordance with the \nrequirements of article 76 of the Convention and with the Rules of Procedure 31 and \nthe Scientific and Technical Guidelines of the Commission; 32 \n \n45. Requests the Secretary-General, in cooperation with States and relevant \ninternational organizations and institutions, to continue to support training and other \nactivities to assist developing States in the preparation and presentation of their \nsubmissions to the Commission;  \n \n46. Recognizes with appreciation the contribution of the Division to capacity-\nbuilding activities at the national and regional levels, in particular the work of the \nDivision in promoting wider appreciation of the Convention and in assisting with its \nimplementation, through the provision of information, advice and assistance to States \nand intergovernmental organizations, as well as the support of the Division for \nMember State implementation of the relevant parts of the 2030 Agenda for \nSustainable Development;8  \n__________________ \n \n30 See resolution 70/235, para. 37. \n \n31 CLCS/40/Rev.1. \n \n32 CLCS/11, CLCS/11/Corr.1, CLCS/11/Add.1 and CLCS/11/Add.1/Corr.1. \n\nA/RES/74/19 \nOceans and the law of the sea\n \n19-21313\n14/57 \n \n \n47. Notes with appreciation the joint implementation by the Division and the \nUnited Nations Conference on Trade and Development of a project funded through \nthe United Nations Development Account to assist participating developing States in \ndeveloping evidence-based and policy-coherent oceans economy and trade strategies \nand aimed at supporting participating developing States in realizing economic \nbenefits from the sustainable use of marine resources; \n \n48. Notes the partnership between the Division and the Intergovernmental \nOceanographic Commission on a training programme on marine scientific research \nunder the Convention, and encourages States, relevant international organizations and \nother donors to consider supporting the initiative; \n \n49. Invites the Secretary-General, in cooperation with Member States, \ninternational \nfinancial \ninstitutions, \ndonor \nagencies \nand \nintergovernmental \norganizations, to endeavour to expand the capacity-building activities of the Division \nin order to meet the increased need for assistance to developing States; \n \n50. Invites States, international financial institutions, donor agencies, \nintergovernmental organizations, non-governmental organizations and natural and \njuridical persons to support the capacity-building activities of the Division, including \nby making earmarked voluntary contributions to the trust fund established by the \nSecretary-General for the Office of Legal Affairs to support the promotion of \ninternational law, and expresses its appreciation to those that have contributed; \n \n51. Recognizes with appreciation the important contribution to the capacity-\nbuilding of developing countries and the promotion of the law of the sea made by the \nHamilton Shirley Amerasinghe Memorial Fellowship on the Law of the Sea, which \nwas established by the General Assembly in 1981 in honour of the first President of \nthe Third United Nations Conference on the Law of the Sea, and recalls in this regard \nthe provisions of its resolutions on the United Nations Programme of Assistance in \nthe Teaching, Study, Dissemination and Wider Appreciation of International Law;33 \n \n52. \nExpresses its appreciation to States that have made contributions to the \nvoluntary trust fund for the Hamilton Shirley Amerasinghe Memorial Fellowship on the \nLaw of the Sea, notes that the financial state of the Fellowship remains critical and that \ncontributions are urgently needed to ensure that at least one fellowship can be awarded \nannually, expresses its commitment to further promote the importance of the \nFellowship, and urges States, international financial institutions, donor agencies, \nintergovernmental organizations, non-governmental organizations and natural and \njuridical persons to make voluntary financial contributions in support of the Fellowship; \n \n53. Recognizes with appreciation the important contribution of the United \nNations-Nippon Foundation of Japan Fellowship Programme and the newer United \nNations-Nippon Foundation Sustainable Ocean Programme, which includes the \nCritical Needs Fellowship, Thematic Fellowship and training programme to reinforce \ncapacity in the context of the intergovernmental conference on an international legally \nbinding instrument under the Convention on the conservation and sustainable use of \nmarine biological diversity of areas beyond national jurisdiction, to human resources \ndevelopment for Member States, particularly developing Member States, in the field \nof ocean affairs and the law of the sea and related disciplines, as well as the fostering \nof global interlinkages and continuing capacity development through the alumni \nprogramme;  \n \n54. Encourages competent international organizations, the United Nations \nDevelopment Programme and international financial institutions and funds to \n__________________ \n \n33 Resolutions 69/117, para. 8, 70/116, para. 4, 71/139, para. 7, 72/115, paras. 7\u20138, and 73/201, \npara. 7. \n\nOceans and the law of the sea \nA/RES/74/19\n \n15/57\n19-21313 \n \nconsider expanding their programmes within their respective fields of competence for \nassistance to developing countries and to coordinate their efforts, and recognizes the \nfunding available from the Global Environment Facility, as well as other funds \nallocated for projects relating to oceans;  \n \n \n \nIII \n \n \nMeeting of States Parties \n \n \n55. Notes with satisfaction that the twenty-ninth Meeting of States Parties to \nthe Convention commemorated the twenty-fifth anniversary of the entry into force of \nthe Convention, and welcomes the report of that Meeting;5 \n \n56. Requests the Secretary-General to convene the thirtieth Meeting of States \nParties to the Convention from 15 to 19 June 2020, with full conference services, \nincluding documentation, as required;  \n \n \n \nIV \n \n \nPeaceful settlement of disputes \n \n \n57. Notes with satisfaction the continued and significant contribution of the \nTribunal to the settlement of disputes by peaceful means in accordance with Part XV \nof the Convention, and underlines the important role and authority of the Tribunal \nconcerning the interpretation or application of the Convention and the Part XI \nAgreement;  \n \n58. Pays tribute to the important and long-standing role of the International \nCourt of Justice with regard to the peaceful settlement of disputes concerning the law \nof the sea;  \n \n59. Notes that States parties to an international agreement relating to the \npurposes of the Convention may submit to, inter alia, the Tribunal or the International \nCourt of Justice any dispute concerning the interpretation or application of that \nagreement submitted in accordance with that agreement, and also notes the \npossibility, provided for in the Statutes of the Tribunal and the Court, to submit \ndisputes to a chamber;  \n \n60. Encourages States Parties to the Convention that have not yet done so to \nconsider making a written declaration, choosing from the means set out in article 287 \nof the Convention for the settlement of disputes concerning the interpretation or \napplication of the Convention and the Part XI Agreement, bearing in mind the \ncomprehensive character of the dispute settlement mechanism provided for in \nPart XV of the Convention;  \n \n61. Recalls the successful completion of the first compulsory conciliation \nunder annex V to the Convention, pursuant to section 3 of Part XV, which assisted the \nparties in reaching agreement on a treaty establishing their maritime boundaries, 34 \nand encourages States to consider all means to peacefully settle disputes in \naccordance with international law; \n \n \n \nV \n \n \nThe Area \n \n \n62. Notes with satisfaction that the Authority commemorated the twenty-fifth \nanniversary of the entry into force of the Convention and its establishment at a special \ncommemorative session of the Assembly;  \n__________________ \n \n34 See A/73/368, para. 19. \n\nA/RES/74/19 \nOceans and the law of the sea\n \n19-21313\n16/57 \n \n \n63. Reiterates the importance of the ongoing elaboration and standardization \nby the Authority, pursuant to article 145 of the Convention, of rules, regulations and \nprocedures to ensure the effective protection of the marine environment, for, inter \nalia, the protection and conservation of the natural resources of the Area and for the \nprevention of damage to the flora and fauna of the marine environment from harmful \neffects that may arise from activities in the Area;  \n \n64. Notes that, as at 31 July 2019, the Authority had entered into 15-year \ncontracts with 17 contractors for exploration for polymetallic nodules, 7 contractors \nfor exploration for polymetallic sulphides and 5 contractors for exploration for cobalt-\nrich ferromanganese crusts, 35  and had approved the thirtieth plan of work, for \nexploration for polymetallic nodules, during the twenty-fifth session of the \nAuthority;36 \n \n65. Welcomes the progress of the work of the Authority on draft regulations \nfor exploitation of mineral resources in the Area, takes note of the invitation to submit \nadditional written comments on the draft regulations, including specific drafting \nsuggestions, and encourages the Authority to continue its work on the draft \nregulations as a matter of priority and to provide sufficient opportunities and time for \nsubstantive consideration and discussion of the draft regulations, and emphasizes the \nongoing need for openness and transparency; \n \n66. Recalls the relevance of the advisory opinion on the responsibilities and \nobligations of States sponsoring persons and entities with respect to activities in the \nArea, issued by the Seabed Disputes Chamber of the Tribunal on 1 February 2011;37 \n \n67. Takes note of the public consultations organized in 2018 by two sponsoring \nStates with regard to the environmental impact assessments submitted to the \nAuthority, ahead of technical tests to be held in 2019 in the respective contract areas \nof their sponsored contractors in the Clarion-Clipperton Zone; \n \n68. Recognizes the importance of the responsibilities entrusted to the \nAuthority by articles 143 and 145 of the Convention, which refer to marine scientific \nresearch and protection of the marine environment in the Area, respectively; \n \n69. Welcomes the adoption by the Assembly, at the twenty-fifth session of the \nAuthority, of the high-level action plan and performance indicators developed for \neach priority against each of the strategic directions in the strategic plan of the \nAuthority for the period 2019\u20132023, which provides a uniform basis for the \nstrengthening of existing working practices of the Authority; 38 \n \n70. Also welcomes the public launch of the Authority database (DeepData), \nwhich aims to serve as the principal repository of all data and information relating to \nactivities in the Area; \n \n71. Notes the endorsement by the Assembly, at the twenty-fifth session of the \nAuthority, of the memorandum of understanding between the Authority and the \nMinistry of Natural Resources of China on the establishment of a joint training and \nresearch centre, 39  which aims to promote and encourage the conduct of marine \nscientific research in the Area, as well as international cooperation for the \ndevelopment of technological knowledge and research, including by creating training \nand capacity-building opportunities, in particular for developing countries;40 \n__________________ \n \n35 See ISBA/25/C/9. \n \n36 See ISBA/25/C/33. \n \n37 See ISBA/17/A/9. \n \n38 See ISBA/25/A/15 and ISBA/25/A/15/Corr.1. \n \n39 See ISBA/25/A/17. \n \n40 ISBA/25/A/4. \n\nOceans and the law of the sea \nA/RES/74/19\n \n17/57\n19-21313 \n \n \n72. Encourages the Authority to continue its work towards the standardization \nof marine bathymetric information collected in the Area, in cooperation with relevant \ninternational \norganizations, including the Intergovernmental \nOceanographic \nCommission and the International Hydrographic Organization, particularly under the \nSeabed 2030 project;41 \n \n73. Welcomes the efforts of the Authority to make progress on the development \nof regional environmental management plans in other priority areas in the Area, in \nparticular where there are currently exploration contracts;42 \n \n \n \nVI \n \n \nEffective functioning of the Authority and the Tribunal \n \n \n74. Commends the progress in the work of the Authority;  \n \n75. Also commends the work of the Tribunal since its establishment;  \n \n76. Appeals to all States Parties to the Convention to pay their assessed \ncontributions to the Tribunal in full and on time, and also appeals to States Parties in \narrears with their contributions to fulfil their obligations without delay;  \n \n77. Expresses serious concern about the number of States Parties to the \nConvention in arrears with their assessed contributions to the Authority, appeals to all \nStates Parties to the Convention to pay their assessed contributions to the Authority \nin full and on time, and urges them to fulfil their obligations without delay, in \nparticular those States whose exercise of voting rights has been suspended by virtue \nof article 184 of the Convention, and invites the Secretary-General of the Authority \nto continue his efforts to recover arrears, including bilateral efforts;  \n \n78. Notes that there remains room for improvement in the level of attendance \nat the Assembly, and urges all members of the Authority to participate in the meetings \nof the Assembly; \n \n79. Welcomes the adoption by the Assembly of the terms of reference for the \nvoluntary trust fund for extrabudgetary support for the Authority and the adoption by \nthe Assembly of the terms of reference for the voluntary trust fund for the purpose of \nproviding the requisite funds related to the work of the Special Representative of the \nSecretary-General of the Authority for the Enterprise, expresses its appreciation to \nthe donors that have made contributions to the voluntary trust funds, and encourages \nMember States, observers, contractors and other stakeholders to contribute financially \nto those and other voluntary trust funds maintained by the Authority;43 \n \n80. Notes with serious concern the negative balance of the voluntary trust fund \nestablished pursuant to the decision of the Authority at its eighth session 44 for the \npurpose of defraying the cost of participation of members of the Legal and Technical \nCommission from developing countries and members of the Finance Committee from \ndeveloping countries in the meetings of the Commission and of the Committee, notes \nthe appeals to members and other possible donors to make contributions to that fund, \nand to contractors to consider making a payment of 6,000 United States dollars on a \nvoluntary basis, and expresses its appreciation to those that have made contributions \nto the voluntary trust fund; \n \n81. \nExpresses its appreciation to States that have made contributions to the \nendowment fund for marine scientific research in the Area established by the Authority \n__________________ \n \n41 See ISBA/23/A/2. \n \n42 See ISBA/25/C/12/Add.1, ISBA/25/C/13, ISBA/25/C/19/Add.1 and ISBA/25/C/37. \n \n43 See ISBA/25/A/10-ISBA/25/C/31 and ISBA/25/A/14. \n \n44 See ISBA/8/A/11. \n\nA/RES/74/19 \nOceans and the law of the sea\n \n19-21313\n18/57 \n \nat its twelfth session,45 for the purpose of promoting and encouraging the conduct of \ncollaborative marine scientific research in the Area, and encourages States, observers, \ncontractors and other stakeholders to make additional contributions to this fund; \n \n82. Calls upon States that have not done so to consider ratifying or acceding \nto the Agreement on the Privileges and Immunities of the Tribunal 46 and to the \nProtocol on the Privileges and Immunities of the Authority; 47  \n \n83. Emphasizes the importance of the rules and staff regulations of the \nTribunal in promoting the recruitment of a geographically representative staff in the \nProfessional and higher categories, and welcomes the actions taken by the Tribunal \nin observance of those rules and regulations;  \n \n84. Calls upon coastal States that have not yet done so to deposit a copy of \ncharts or lists of geographical coordinates showing the outer limit lines of the \ncontinental shelf with the Secretary-General of the Authority, as provided for in \narticle 84, paragraph 2, of the Convention; \n \n \n \nVII \n \n \nThe continental shelf and the work of the Commission \n \n \n85. Recalls that, in accordance with article 76, paragraph 8, of the Convention, \ninformation on the limits of the continental shelf beyond 200 nautical miles from the \nbaselines from which the breadth of the territorial sea is measured shall be submitted \nby the coastal State to the Commission set up under annex II to the Convention on \nthe basis of equitable geographical representation, that the Commission shall make \nrecommendations to coastal States on matters related to the establishment of the outer \nlimits of their continental shelf, and that the limits of the shelf established by a coastal \nState on the basis of these recommendations shall be final and binding;  \n \n86. Also recalls that, in accordance with article 77, paragraph 3, of the \nConvention, the rights of the coastal State over the continental shelf do not depend \non occupation, effective or notional, or on any express proclamation;  \n \n87. Notes with satisfaction that a considerable number of States Parties to the \nConvention have submitted information to the Commission regarding the \nestablishment of the outer limits of the continental shelf beyond 200 nautical miles, \nin conformity with article 76 of the Convention and article 4 of annex II to the \nConvention, taking into account the decision of the eleventh Meeting of States Parties \nto the Convention contained in SPLOS/72, paragraph (a); \n \n88. Also notes with satisfaction that a considerable number of States Parties to \nthe Convention have submitted to the Secretary-General, pursuant to the decision of \nthe eighteenth Meeting of States Parties to the Convention, 48 preliminary information \nindicative of the outer limits of the continental shelf beyond 200 nautical miles and a \ndescription of the status of preparation and intended date of submission in accordance \nwith the requirements of article 76 of the Convention and with the Rules of Procedure \nand the Scientific and Technical Guidelines of the Commission, and notes with \nsatisfaction that additional submissions referred to in preliminary information have \nbeen filed with the Commission;  \n \n89. Further notes with satisfaction the progress in the work of the \nCommission49 and that it is giving current consideration to a number of submissions \n__________________ \n \n45 See ISBA/12/A/11. \n \n46 United Nations, Treaty Series, vol. 2167, No. 37925. \n \n47 Ibid., vol. 2214, No. 39357. \n \n48 See SPLOS/183. \n \n49 See CLCS/106, CLCS/106/Corr.1, CLCS/108, CLCS/50/2 and CLCS/50/2/Corr.1. \n\nOceans and the law of the sea \nA/RES/74/19\n \n19/57\n19-21313 \n \nthat have been made regarding the establishment of the outer limits of the continental \nshelf beyond 200 nautical miles; \n \n90. Takes note of the 33 recommendations made by the Commission on the \nsubmissions of a number of coastal States, and welcomes the fact that summaries of \nrecommendations are being made publicly available in accordance with \nparagraph 11.3 of annex III to the Rules of Procedure of the Commission;  \n \n91. Notes that the consideration by the Commission of submissions by coastal \nStates in accordance with article 76 of and annex II to the Convention is without \nprejudice to the application of other parts of the Convention by States Parties;  \n \n92. Also notes the considerable number of submissions yet to be considered \nby the Commission and the demands that this places on its members and the \nsecretariat as provided by the Division, and emphasizes the need to ensure that the \nCommission can perform its functions expeditiously, efficiently and effectively and \nmaintain its high level of quality and expertise;  \n \n93. Takes note with appreciation of the decision of the Commission at its \nforty-fourth session to continue, during its five-year term of office, to meet for a total \nof 21 weeks per year by holding three sessions of seven weeks each, and that no two \nsessions would be sequential,50 and further notes that more than nine subcommissions \nare actively considering submissions; \n \n94. Requests the Secretary-General to continue to take appropriate measures, \nwithin overall existing resource levels, to further strengthen the capacity of the \nDivision, serving as the secretariat of the Commission, in order to ensure enhanced \nsupport and assistance to the Commission and its subcommissions in their \nconsideration of submissions, as required by paragraph 9 of annex III to the Rules of \nProcedure of the Commission, in particular its human resources, taking into account \nthe need for simultaneous work on several submissions;  \n \n95. Urges the Secretary-General to continue to provide all necessary \nsecretariat services to the Commission in accordance with article 2, paragraph 5, of \nannex II to the Convention;  \n \n96. Requests the Secretary-General to take appropriate and timely measures to \nensure secretariat services for the Commission and its subcommissions for the \nextended duration of time requested in the decisions of the twenty-first and twenty-\nsixth Meetings of States Parties to the Convention;20  \n \n97. Also requests the Secretary-General, consequently, to continue to allocate \nappropriate and sufficient resources to the Division to provide adequate services and \nassistance to the Commission in view of the number of its working weeks;  \n \n98. Expresses its appreciation to States that have made contributions to the \nvoluntary trust fund established pursuant to resolution 55/7 for the purpose of \nfacilitating the preparation of submissions to the Commission, and encourages States, \ninternational financial institutions, donor agencies, intergovernmental organizations, \nnon-governmental organizations and natural and juridical persons to make additional \ncontributions to this fund; \n \n99. Notes that the Meeting of States Parties to the Convention, in its decisions \nregarding the conditions of service of the members of the Commission, 51 reaffirmed \nthe obligation of States under the Convention whose experts were serving on the \nCommission to defray the expenses of the experts they had nominated while the \nexperts are in performance of Commission duties, including the provision of medical \n__________________ \n \n50 See CLCS/100. \n \n51 SPLOS/276 and SPLOS/286. \n\nA/RES/74/19 \nOceans and the law of the sea\n \n19-21313\n20/57 \n \ncoverage, and urged those States to do their utmost to ensure the full participation of \nthose experts in the work of the Commission, including the meetings of \nsubcommissions, in accordance with the Convention; \n \n100. Also notes the decision of the twenty-ninth Meeting of States Parties to the \nConvention to continue the consideration of the conditions of service of the members \nof the Commission within the open-ended working group established by the twenty-\nthird Meeting of States Parties to the Convention, as well as the request of the twenty-\nninth Meeting that the Secretariat prepare a comprehensive study that sets out possible \noptions to address the working conditions of the Commission, including its funding, \nto be discussed by the thirtieth Meeting of States Parties, in 2020;5 \n \n101. Emphasizes the importance of the voluntary trust fund established \npursuant to resolution 55/7 in facilitating the participation of members of the \nCommission from developing States in the meetings of the Commission, and \nexpresses its appreciation to States that have made contributions to this trust fund; \n \n102. Reiterates its serious concern that the chronic underfunding of the trust \nfund referred to in paragraph 101 above may preclude the Commission from \nadvancing its work as a result of the potential lack of a quorum at future sessions, and \nmay prevent it from further implementing the decision of the twenty-sixth Meeting \nof States Parties that requested the Commission to meet for up to 26 weeks, and urges \nStates, international financial institutions, donor agencies, intergovernmental \norganizations, non-governmental organizations and natural and juridical persons to \nmake additional contributions to this fund; \n \n103. Authorizes the use, as appropriate, of the trust fund referred to in \nparagraph 101 above, and in accordance with the purpose of its terms of reference, to \ndefray the cost of the participation of the Chair of the Commission, when nominated \nby a developing country, in the Meetings of States Parties to the Convention;  \n \n104. Takes note of the written information, provided by the Secretary-General \nin response to the request in paragraph 81 of resolution 69/245, on options for \nmechanisms to provide medical insurance coverage to members of the Commission, \nincluding costs, and the information provided by the Secretariat during the twenty-\nseventh, twenty-eighth and twenty-ninth Meetings of States Parties to the Convention; \n \n105. Recalls its decision that, on an exceptional basis and without setting a \nprecedent for other agenda items, the members of the Commission have the option to \njoin the Headquarters medical insurance scheme upon payment of the full cost of the \npremium, and hereby authorizes the use of the trust fund referred to in paragraph 101 \nabove by the Secretary-General to reimburse the full costs of the premium paid by \nthe members of the Commission from developing States, subject to the availability of \nfunds following the allocation of the required funds to cover the costs of travel and \ndaily subsistence allowance of the members of the Commission from developing \nStates for the sessions of the Commission during the annual insurance coverage \nperiod (1 July\u201330 June); \n \n106. Authorizes the Secretary-General, in case the full costs of the Headquarters \nmedical insurance scheme have not been reimbursed, as an interim measure and \nsubject to the availability of funds following the allocation of the required funds to \ncover the costs of travel and daily subsistence allowance of the members of the \nCommission from developing States for the sessions of the Commission in 2020, to \nreimburse those members for the costs of medical travel insurance and short-term \nmedical insurance from that trust fund on a session-by-session basis and subject to a \nreasonable limit that the Secretary-General shall determine, based on the information \nregarding medical travel insurance available; \n\nOceans and the law of the sea \nA/RES/74/19\n \n21/57\n19-21313 \n \n \n107. Expresses its intention to continue to consider options for mechanisms to \nprovide medical insurance coverage to members of the Commission and, if necessary, \nto further review the terms of reference for the trust fund referred to in paragraph 101 \nabove;  \n \n108. Emphasizes the continued need for members of the Commission to have \nsuitable working space for their work at the sessions of the Commission and its \nsubcommissions, recognizes, with regard to the long-term accommodation \ndiscussions, that, owing to its exceptional character, the Commission has special \nrequirements for its working space, including the need for fit-for-purpose working \nspace, adequate technical equipment and climate control, and needs to remain located \nwithin the same premises as the Division, and emphasizes that, in the context of any \nrelocation of the Division or any change in its working space, full regard will be paid \nto these special requirements of the Commission; \n \n109. Approves the convening by the Secretary-General of the fifty-second, \nfifty-third and fifty-fourth sessions of the Commission, in New York, from 27 January \nto 13 March 2020, from 6 July to 21 August 2020 and from 7 October to 24 November \n2020, respectively, with full conference services, including documentation, for the \nplenary parts of these sessions,52 as well as any resumed sessions as may be required \nby the Commission, and requests the Secretary-General to make every effort to meet \nthese requirements within overall existing resources; \n \n110. Expresses its firm conviction about the importance of the work of the \nCommission, carried out in accordance with the Convention as well as in accordance \nwith its Rules of Procedure, including with respect to the participation of coastal \nStates in relevant proceedings concerning their submissions, and recognizes the \ncontinued need for active interaction between coastal States and the Commission; \n \n111. Expresses its appreciation to States that have exchanged views in order to \nincrease understanding of issues, including expenditures involved, arising from the \napplication of article 76 of the Convention, thus facilitating the preparation of \nsubmissions by States, in particular developing States, to the Commission, and \nencourages States to continue to exchange views;  \n \n112. Requests the Secretary-General, in cooperation with Member States, to \ncontinue to support workshops or symposiums on scientific and technical aspects of \nthe establishment of the outer limits of the continental shelf beyond 200 nautical \nmiles, taking into account the need to strengthen capacity-building for developing \ncountries in preparing their submissions;  \n \n \n \nVIII \nMaritime safety and security and flag State implementation \n \n \n113. Encourages States to ratify or accede to international agreements \naddressing the safety and security of navigation, as well as maritime labour, and to \nadopt the necessary measures consistent with the Convention and other relevant \ninternational instruments aimed at implementing and enforcing the rules contained in \nthose agreements, and emphasizes the need for capacity-building for and assistance \nto developing States;  \n \n114. Recognizes that the legal regimes governing maritime safety and maritime \nsecurity may have common and mutually reinforcing objectives that may be \ninterrelated and could benefit from synergies, and encourages States to take this into \naccount in their implementation;  \n__________________ \n \n52 From 3 to 7 February and from 2 to 6 March 2020 during the fifty-second session, and from 27 to \n30 July and from 10 to 14 August 2020 during the fifty-third session. \n\nA/RES/74/19 \nOceans and the law of the sea\n \n19-21313\n22/57 \n \n \n115. Emphasizes the need for further efforts to promote a culture of safety and \nsecurity in the shipping industry and to address the shortage of adequately trained \npersonnel, and urges the development and strengthening of capacity-building \nactivities and the provision of knowledge and skills through the required education \nand training, promoted in particular by the International Maritime Organization in \ncollaboration with other relevant international organizations and agencies, as \nappropriate;  \n \n116. Also emphasizes that safety and security measures should be implemented \nin support of and with minimal negative effects on seafarers and fishers, especially in \nrelation to their working conditions, and welcomes the ongoing cooperation between \nthe Food and Agriculture Organization of the United Nations and the International \nLabour Organization in relation to decent work and employment in fisheries and \naquaculture and on child labour in fisheries and aquaculture, as well as the work that \nhas been conducted by the United Nations Office on Drugs and Crime and the \nInternational Labour Organization on the issue of trafficking in persons and forced \nlabour on fishing vessels;  \n \n117. Welcomes the consideration by the International Maritime Organization of \nthe fair treatment of seafarers, recalls the adoption by the Organization on \n4 December 2013 of resolution A.1090(28) on the fair treatment of crew members in \nrespect of shore leave and access to shore-side facilities, and welcomes the provision \non shore leave, which entered into force on 1 January 2018, in the Convention on \nFacilitation of International Maritime Traffic;53  \n \n118. Notes the themes for the 2019 and 2020 World Maritime Day, \n\u201cEmpowering women in the maritime community\u201d and \u201cSustainable shipping for a \nsustainable planet\u201d, respectively;  \n \n119. Invites States that have not yet done so to become parties to the \nInternational Convention on Standards of Training, Certification and Watchkeeping \nfor Seafarers, 1978,54 as amended, and the International Convention on Standards of \nTraining, Certification and Watchkeeping for Fishing Vessel Personnel, 1995; \n \n120. Encourages States that have not yet done so to consider becoming parties \nto the Work in Fishing Convention, 2007 (No. 188), the Seafarers\u2019 Identity Documents \nConvention (Revised), 2003 (No. 185) 55  and the Protocol to the Forced Labour \nConvention, 1930 (No. 29) of the International Labour Organization, as well as to the \nMaritime Labour Convention, 2006,56 as amended, calls upon States to effectively \nimplement their obligations under those instruments, and emphasizes the need to \nprovide to States, at their request, technical cooperation and assistance in this regard; \n \n121. Invites States to ratify or accede to the Cape Town Agreement of 2012 on \nthe Implementation of the Provisions of the Torremolinos Protocol of 1993 relating \nto the Torremolinos International Convention for the Safety of Fishing Vessels, 1977; \n \n122. Welcomes in this regard the holding of a Ministerial Conference on Fishing \nVessel Safety and Illegal, Unreported and Unregulated Fishing, organized by the \nInternational Maritime Organization and the Government of Spain in Torremolinos, \nSpain, from 21 to 23 October 2019, to promote the ratification of the Cape Town \nAgreement, whose entry into force would create a more robust International Maritime \nOrganization regulatory framework for the safety of fishing vessels and fishing vessel \npersonnel; \n__________________ \n \n53 United Nations, Treaty Series, vol. 591, No. 8564. \n \n54 Ibid., vol. 1361, No. 23001. \n \n55 Ibid., vol. 2304, No. 41069. \n \n56 Ibid., vol. 2952, No. 51299. \n\nOceans and the law of the sea \nA/RES/74/19\n \n23/57\n19-21313 \n \n \n123. Welcomes ongoing cooperation between the Food and Agriculture \nOrganization of the United Nations, the International Maritime Organization and the \nInternational Labour Organization relating to the safety of fishers and fishing vessels, \nand underlines the urgent need for continued work in that area;  \n \n124. Notes that, in its resolution A.1117(30) of 6 December 2017, the Assembly \nof the International Maritime Organization revised the International Maritime \nOrganization ship identification number scheme to expand its voluntary application \nto a wider scope of vessels with a view to enhancing maritime safety and pollution \nprevention and to facilitate the prevention of maritime fraud; \n \n125. Recalls that all actions taken to combat threats to maritime security must \nbe in accordance with international law, including the principles embodied in the \nCharter of the United Nations and the Convention;  \n \n126. Recognizes the crucial role of international cooperation at the global, \nregional, subregional and bilateral levels in combating, in accordance with \ninternational law, threats to maritime security, including piracy, armed robbery \nagainst ships at sea and terrorist acts against shipping, offshore installations and other \nmaritime interests, through bilateral and multilateral instruments and mechanisms \naimed at monitoring, preventing and responding to such threats, the enhanced sharing \nof information among States relevant to the detection, prevention and suppression of \nsuch threats, and the prosecution of offenders with due regard to national legislation, \nand the need for sustained capacity-building to support such objectives, and in this \nregard welcomes initiatives under the twenty-sixth Association of Southeast Asian \nNations Regional Forum, held in Bangkok on 2 August 2019, and the Work Plan for \nMaritime Security 2018\u20132020; \n \n127. Welcomes the adoption, in Lom\u00e9 on 15 October 2016, by the African Union \nExtraordinary Summit of Heads of State and Government on Maritime Security and \nSafety and Development in Africa of the Charter on Maritime Security and Safety and \nDevelopment in Africa (Lom\u00e9 Charter), and encourages African Member States of the \nUnited Nations that have not yet done so to consider ratifying this Charter to facilitate \nits entry into force;  \n \n128. Notes with satisfaction the organization in Mauritius in June 2019 of the \nsecond Ministerial Conference on Maritime Security in the Western Indian Ocean; \n \n129. Acknowledges the work of the Commission on Crime Prevention and \nCriminal Justice in promoting international cooperation and strengthening capacity \nto combat the problem of transnational organized crime committed at sea; \n \n130. Notes with concern that piracy and armed robbery at sea affect a wide \nrange of vessels engaged in maritime activities, and expresses grave concern at the \nthreats posed by piracy and armed robbery at sea to the safety and welfare of seafarers \nand other persons; \n \n131. Emphasizes the importance of promptly reporting incidents to enable \naccurate information on the scope of the problem of piracy and armed robbery against \nships at sea and, in the case of armed robbery against ships at sea, by affected vessels \nto the coastal State, underlines the importance of effective information-sharing with \nStates potentially affected by incidents of piracy and armed robbery against ships at \nsea, notes with appreciation the important role of the International Maritime \nOrganization and the important contribution of the Information Sharing Centre of the \nRegional Cooperation Agreement on Combating Piracy and Armed Robbery against \nShips in Asia, based in Singapore, which aspires to be recognized as a centre of \nexcellence within its purpose and mandate, and notes the Maritime Domain \nAwareness for Trade \u2013 Gulf of Guinea mechanism, the United Kingdom Maritime \nTrade Operations covering the high-risk area, the Regional Maritime Information \n\nA/RES/74/19 \nOceans and the law of the sea\n \n19-21313\n24/57 \n \nFusion Centre, based in Madagascar, and the Regional Maritime Centre for \nOperational Coordination in Seychelles; \n \n132. Urges all States, in cooperation with the International Maritime \nOrganization, to actively combat piracy and armed robbery at sea by adopting \nmeasures, including those relating to assistance with capacity-building through \ntraining of seafarers, port staff and enforcement personnel in the prevention, reporting \nand investigation of incidents, by bringing the alleged perpetrators to justice, in \naccordance with international law, and by adopting national legislation, as well as by \nproviding enforcement vessels and equipment and guarding against fraudulent ship \nregistration;  \n \n133. Encourages States to ensure effective implementation of international law \napplicable to combating piracy, as reflected in the Convention, calls upon States to \ntake appropriate steps under their national law to facilitate, in accordance with \ninternational law, the apprehension and prosecution of those who are alleged to have \ncommitted acts of piracy, including the financing or facilitation of such acts, also \ntaking into account other relevant instruments that are consistent with the Convention, \nand encourages States to cooperate, as appropriate, with a view to developing their \nnational legislation in this regard;  \n \n134. Invites all States, the International Maritime Organization, the \nInternational Labour Organization and other relevant international organizations and \nagencies to adopt or recommend, as appropriate, measures to protect the interest and \nwelfare of seafarers, fishers and passengers who are victims of pirates, after their \nrelease from captivity, including their post-incident care and reintegration into \nsociety;  \n \n135. Notes the compilation of national legislation on piracy on the website of \nthe Division, and encourages the United Nations Office on Drugs and Crime and the \nDivision to continue to cooperate with the International Maritime Organization with \na view to assisting Member States, upon request, in developing their national laws on \npiracy; \n \n136. Recognizes continued national, bilateral and trilateral initiatives, as well \nas regional cooperative mechanisms, in accordance with international law, to address \npiracy, including the financing or facilitation of acts of piracy, and armed robbery at \nsea, and calls upon States to give immediate attention to adopting, concluding and \nimplementing cooperation agreements at the regional level on combating piracy and \narmed robbery against ships; \n \n137. Expresses serious concern at the inhuman conditions hostages taken at sea \nface in captivity and also the adverse impact on their families, calls for the immediate \nrelease of all hostages taken at sea, and stresses the importance of cooperation among \nMember States on the issue of hostage-taking at sea; \n \n138. Welcomes, in this regard, the ongoing work of the United Nations Office \non Drugs and Crime Hostage Support Programme, funded by the Board of the trust \nfund to support initiatives of States countering piracy off the coast of Somalia, in \nsecuring the release of seafarers held hostage off the coast of Somalia;57 \n \n139. Also welcomes the recent achievements against piracy and armed robbery \nat sea off the coast of Somalia resulting from efforts at the global and regional levels, \nwhich have resulted in a steady decline in pirate attacks as well as hijackings since \n2011, in that regard continues to be gravely concerned by the ongoing threat that \npiracy and armed robbery at sea continue to pose in the region off the coast of \nSomalia, notes the adoption by the Security Council of resolution 2500 (2019) \n__________________ \n \n57 See S/2013/623, paras. 11\u201313, and S/2014/740, para. 10. \n\nOceans and the law of the sea \nA/RES/74/19\n \n25/57\n19-21313 \n \nof 4 December 2019, as well as the statements by the President of the Council of \n25 August 201058 and of 19 November 2012,59 also notes that the authorization in \nresolution 2500 (2019) and relevant resolutions apply only with respect to the \nsituation in Somalia and shall not affect the rights, obligations or responsibilities of \nMember States under international law, including any rights or obligations under the \nConvention, with respect to any other situation, and underscores, in particular, that \nthey shall not be considered as establishing customary international law; \n \n140. Notes the continued efforts within the Contact Group on Piracy off the \nCoast of Somalia following the adoption of Security Council resolution 1851 (2008) \nof 16 December 2008, including at its twenty-second plenary session, chaired by \nMauritius in Balaclava, Mauritius, in June 2019, and commends the contributions of \nall States in the efforts to fight piracy off the coast of Somalia; \n \n141. Recognizes the primary responsibility of the Federal Government of \nSomalia in combating piracy and armed robbery at sea off the coast of Somalia, \nacknowledges the importance of a comprehensive and sustainable settlement of the \nsituation in Somalia, and emphasizes the need to address the underlying causes of \npiracy and to assist Somalia and States in the region, at their request, in strengthening \ninstitutional capacity to fight piracy and tackle its underlying causes, including the \nfinancing or facilitation of acts of piracy, and armed robbery against ships off the \ncoast of Somalia and to bring to justice those involved in such acts; \n \n142. Notes the International Maritime Organization guidelines to assist in the \ninvestigation of the crimes of piracy and armed robbery against ships, revised interim \nguidance to shipowners, ship operators and shipmasters on the use of privately \ncontracted armed security personnel on board ships in the high-risk area, revised \ninterim recommendations for flag States regarding the use of privately contracted \narmed security personnel on board ships in the high-risk area, revised interim \nrecommendations for port and coastal States regarding the use of privately contracted \narmed security personnel on board ships in the high-risk area, interim guidance to \nprivate maritime security companies providing privately contracted armed security \npersonnel on board ships in the high-risk area, and interim guidance for flag States \non measures to prevent and mitigate Somalia-based piracy;  \n \n143. Notes with concern that the continuing limited capacity and domestic \nlegislation to facilitate the custody and prosecution of suspected pirates after their \ncapture has hindered more robust international action against pirates off the coast of \nSomalia; \n \n144. Encourages States to ensure that ships flying their flag apply ship security \nmeasures approved in accordance with national and international law;  \n \n145. Notes the efforts made by the shipping industry to cooperate with the \nefforts by States regarding piracy off the coast of Somalia, in particular in assisting \nships that navigate in that area, and recalls the adoption on 30 November 2011 by the \nAssembly of the International Maritime Organization of resolution A.1044(27) on \npiracy and armed robbery against ships in waters off the coast of Somalia; \n \n146. Also notes the continued implementation of the Code of Conduct \nconcerning the Repression of Piracy and Armed Robbery against Ships in the Western \nIndian Ocean and the Gulf of Aden (Djibouti Code of Conduct), adopted on \n29 January 2009 under the auspices of the International Maritime Organization, in the \nfour thematic areas of information-sharing, training, national legislation and capacity-\n__________________ \n \n58 S/PRST/2010/16; see Resolutions and Decisions of the Security Council, 1 August 2010\u201331 July \n2011 (S/INF/66). \n \n59 S/PRST/2012/24; see Resolutions and Decisions of the Security Council, 1 August 2012\u201331 July \n2013 (S/INF/68). \n\nA/RES/74/19 \nOceans and the law of the sea\n \n19-21313\n26/57 \n \nbuilding, and notes the adoption in January 2017 of the Jeddah Amendment to the \nDjibouti Code of Conduct;  \n \n147. Expresses its deep concern at the continuing incidents of piracy and armed \nrobbery at sea in the Gulf of Guinea, in particular violence against innocent crew \nmembers of vessels, notes the adoption by the Security Council of resolutions \n2018 (2011) of 31 October 2011 and 2039 (2012) of 29 February 2012 and the \nstatement by the President of the Council of 25 April 2016,60 supports the recent \nefforts to address this problem at the global and regional levels, recalls the primary \nrole of States in the region to counter the threat and address the underlying causes of \npiracy and armed robbery at sea in the Gulf of Guinea, welcomes the adoption in \nYaound\u00e9 on 25 June 2013 of the Code of Conduct concerning the Repression of \nPiracy, Armed Robbery against Ships, and Illegal Maritime Activity in West and \nCentral Africa, and calls upon States in the region to implement the Code of Conduct \nas soon as possible and consistent with international law, in particular the Convention; \n \n148. Urges States to ensure the full implementation of resolution A.1069(28) of \n29 November 2013 of the Assembly of the International Maritime Organization on \nprevention and suppression of piracy, armed robbery against ships and illicit maritime \nactivity in the Gulf of Guinea;  \n \n149. Calls upon States that have not yet done so to become parties to the \nConvention for the Suppression of Unlawful Acts against the Safety of Maritime \nNavigation61 and the Protocol for the Suppression of Unlawful Acts against the Safety \nof Fixed Platforms Located on the Continental Shelf, 61 invites States that have not yet \ndone so to consider becoming parties to the 2005 Protocol to the Convention for the \nSuppression of Unlawful Acts against the Safety of Maritime Navigation 62  and \nthe 2005 Protocol to the 1988 Protocol for the Suppression of Unlawful Acts against \nthe Safety of Fixed Platforms Located on the Continental Shelf, 63 and urges States \nparties to take appropriate measures to ensure the effective implementation of those \ninstruments through the adoption of legislation, where appropriate;  \n \n150. Calls upon States to effectively implement the International Ship and Port \nFacility Security Code and the amendments to the International Convention for the \nSafety of Life at Sea,64 and to work with the International Maritime Organization to \npromote safe and secure shipping while ensuring freedom of navigation;  \n \n151. Urges all States, in cooperation with the International Maritime \nOrganization, to improve the protection of offshore installations by adopting \nmeasures related to the prevention, reporting and investigation of acts of violence \nagainst installations, in accordance with international law, and by implementing such \nmeasures through national legislation to ensure proper and adequate enforcement;  \n \n152. Emphasizes the progress in regional cooperation, including the efforts of \nlittoral States, on the enhancement of safety, security and environmental protection in \nthe Straits of Malacca and Singapore, and the effective functioning of the Cooperative \nMechanism on Safety of Navigation and Environmental Protection in the Straits of \nMalacca and Singapore (the Cooperative Mechanism) to promote dialogue and \nfacilitate close cooperation between the littoral States, user States, shipping industries \nand other stakeholders in line with article 43 of the Convention, notes with \n__________________ \n \n60 S/PRST/2016/4; see Resolutions and Decisions of the Security Council, 1 August 2015\u2013\n31 December 2016 (S/INF/71). \n \n61 United Nations, Treaty Series, vol. 1678, No. 29004. \n \n62 International Maritime Organization, document LEG/CONF.15/21. \n \n63 International Maritime Organization, document LEG/CONF.15/22. \n \n64 International Maritime Organization, documents SOLAS/CONF.5/32 and SOLAS/CONF.5/34, \nand document MSC 81/25/Add.1, annex 2, resolution MSC.202(81), introducing the long-range \nidentification and tracking of ships system. \n\nOceans and the law of the sea \nA/RES/74/19\n \n27/57\n19-21313 \n \nappreciation the convening of the twelfth Cooperation Forum, in Indonesia on \n30 September and 1 October 2019, the twelfth Project Coordination Committee \nMeeting, in Indonesia on 4 October 2019, the forty-fourth Tripartite Technical Experts \nGroup Meeting in Indonesia on 2 and 3 October 2019 and the twenty-second and \ntwenty-third Aids to Navigation Fund Committee Meetings, in Malaysia on 25 and \n26 April 2019 and on 26 and 27 September 2019, notes with appreciation the \nimportant role of the Information Sharing Centre of the Regional Cooperation \nAgreement on Combating Piracy and Armed Robbery against Ships in Asia, based in \nSingapore, and calls upon States to give immediate attention to adopting, concluding \nand implementing cooperation agreements at the regional level; \n \n153. Recognizes that some transnational organized criminal activities threaten \nlegitimate uses of the oceans and endanger the lives of people at sea, as well as the \nlivelihoods and security of coastal communities; \n \n154. Notes that transnational organized criminal activities are diverse and may \nbe interrelated in some cases and that criminal organizations are adaptive and take \nadvantage of the vulnerabilities of States, in particular coastal and small island \ndeveloping States in transit areas, and calls upon States and relevant \nintergovernmental organizations to increase cooperation and coordination at all levels \nto detect and suppress the smuggling of migrants, trafficking in persons and illicit \ntrafficking in firearms, in accordance with international law; \n \n155. Recognizes the importance of enhancing international cooperation at all \nlevels to fight transnational organized criminal activities, including illicit traffic in \nnarcotic drugs and psychotropic substances, within the scope of the United Nations \ninstruments against illicit drug trafficking, as well as the smuggling of migrants, \ntrafficking in persons and illicit trafficking in firearms and criminal activities at sea \nfalling within the scope of the United Nations Convention against Transnational \nOrganized Crime and the Protocols thereto; \n \n156. Encourages States to cooperate at the bilateral, regional and global levels \nto prevent, combat and eradicate illicit trafficking in protected species of wild fauna \nand flora where such trafficking occurs via maritime routes, through, inter alia, the \nuse of applicable international legal instruments as appropriate, such as the United \nNations Convention against Transnational Organized Crime, 65 the United Nations \nConvention against Corruption 66  and the Convention on International Trade in \nEndangered Species of Wild Fauna and Flora,67 and reiterates its call upon Member \nStates expressed in its resolution 71/326 of 11 September 2017 to make illicit \ntrafficking in protected species of wild fauna and flora a serious crime, in accordance \nwith their national legislation and as defined in article 2 (b) and article 3, \nparagraph 1 (b), of the United Nations Convention against Transnational Organized \nCrime, in order to ensure that, where the offence is transnational in nature and \ninvolves an organized criminal group, effective international cooperation can be \nafforded under the United Nations Convention against Transnational Organized \nCrime to prevent and combat transnational organized crime;  \n \n157. Notes with grave concern the recent proliferation of, and endangerment of \nlives through, the smuggling of migrants by sea, underscores the necessity to address \nsuch situations in accordance with applicable international law, and encourages \nStates, acting nationally or through relevant global or regional organizations, as \nappropriate, to provide technical assistance and capacity-building to flag, port and \n__________________ \n \n65 United Nations, Treaty Series, vol. 2225, No. 39574. \n \n66 Ibid., vol. 2349, No. 42146. \n \n67 Ibid., vol. 993, No. 14537. \n\nA/RES/74/19 \nOceans and the law of the sea\n \n19-21313\n28/57 \n \ncoastal States, upon request, to enhance their capabilities to prevent smuggling of \nmigrants and human trafficking by sea;  \n \n158. Calls upon States, in that context, to take measures in accordance with \nrelevant international obligations to prevent and combat all forms of trafficking in \npersons, to identify victims of human trafficking, including among migrant flows, and \nto provide trafficking victims with appropriate protection and assistance, according \nto their national law and policy;  \n \n159. Calls upon States that have not yet done so to consider becoming parties \nto the Protocol against the Smuggling of Migrants by Land, Sea and Air, \nsupplementing the United Nations Convention against Transnational Organized \nCrime,68 the Protocol against the Illicit Manufacturing of and Trafficking in Firearms, \nTheir Parts and Components and Ammunition, supplementing the United Nations \nConvention against Transnational Organized Crime, 69 and the Protocol to Prevent, \nSuppress and Punish Trafficking in Persons, Especially Women and Children, \nsupplementing the United Nations Convention against Transnational Organized \nCrime,70 and to take appropriate measures to ensure their effective implementation;  \n \n160. Calls upon States to ensure freedom of navigation, the safety of navigation \nand the rights of transit passage, archipelagic sea lanes passage and innocent passage \nin accordance with international law, in particular the Convention;  \n \n161. Welcomes the work of the International Maritime Organization relating to \nthe protection of shipping lanes of strategic importance and significance, and in \nparticular in enhancing safety, security and environmental protection in straits used \nfor international navigation, and calls upon that Organization, States bordering straits \nand user States to continue their cooperation to keep such straits safe, secure and \nenvironmentally protected and open to international navigation at all times, consistent \nwith international law, in particular the Convention;  \n \n162. Calls upon user States and States bordering straits used for international \nnavigation to continue to cooperate by agreement on matters relating to navigational \nsafety, including safety aids for navigation, and the prevention, reduction and control \nof pollution from ships, and welcomes developments in this regard;  \n \n163. Calls upon States that have accepted the amendments to regulation XI-1/6 \nof the International Convention for the Safety of Life at Sea, 1974, 71 to implement the \nCode of International Standards and Recommended Practices for a Safety \nInvestigation into a Marine Casualty or Marine Incident, 72 which took effect on \n1 January 2010, and, in particular, to comply with the mandatory conduct of a marine \nsafety investigation into very serious marine casualties and submission of a marine \nsafety investigation report to the International Maritime Organization to identify \ntrends and develop knowledge and risk-based recommendations; \n \n164. Takes note of International Maritime Organization resolution A.1091(28) \nof 4 December 2013 on guidelines on the preservation and collection of evidence \nfollowing an allegation of a serious crime having taken place on board a ship or \nfollowing a report of a missing person from a ship, and pastoral and medical care of \npersons affected; \n__________________ \n \n68 Ibid., vol. 2241, No. 39574. \n \n69 Ibid., vol. 2326, No. 39574. \n \n70 Ibid., vol. 2237, No. 39574. \n \n71 International Maritime Organization, document MSC 84/24/Add.1, annex 3, resolution \nMSC.257(84). \n \n72 International Maritime Organization, document MSC 84/24/Add.1, annex 1, resolution \nMSC.255(84). \n\nOceans and the law of the sea \nA/RES/74/19\n \n29/57\n19-21313 \n \n \n165. Recognizes the important work of the International Hydrographic \nOrganization, calls upon States that have not yet done so to consider becoming \nmembers of that Organization, encourages all its members to actively consider, in \naccordance with applicable rules and procedures, applications of States that wish to \nbecome members of that Organization, and urges all States to work with that \nOrganization to increase the coverage of hydrographic information on a global basis \nto enhance capacity-building and technical assistance and to promote safe navigation, \nparticularly through the production and use of accurate electronic navigational charts, \nespecially in areas used for international navigation, in ports and where there are \nvulnerable or protected marine areas;  \n \n166. Also recognizes the importance of navigational warning services based on \nmarine meteorological data for the safety of ships and lives at sea and the optimization \nof navigation routes, and notes the collaboration between the World Meteorological \nOrganization and the International Maritime Organization for the enhancement of \nthese services and their extension to the Arctic region;  \n \n167. Encourages States to continue their efforts in the implementation of all \nareas of the Action Plan for the Safety of Transport of Radioactive Material, \napproved by the Board of Governors of the International Atomic Energy Agency in \nMarch 2004; \n \n168. Also encourages States to ensure effective implementation of the \nInternational Maritime Dangerous Goods Code, the International Maritime Solid Bulk \nCargoes Code, the International Code for the Construction and Equipment of Ships \ncarrying Liquefied Gases in Bulk and the International Code for the Construction and \nEquipment of Ships carrying Dangerous Chemicals in Bulk; \n \n169. Notes that cessation of the transport of radioactive materials through the \nregions of small island developing States is an ultimate desired goal of small island \ndeveloping States and some other countries, and recognizes the right of freedom of \nnavigation in accordance with international law; that States should maintain dialogue \nand consultation, in particular under the auspices of the International Atomic Energy \nAgency and the International Maritime Organization, with the aim of improved \nmutual understanding, confidence-building and enhanced communication in relation \nto the safe maritime transport of radioactive materials; that States involved in the \ntransport of such materials are urged to continue to engage in dialogue with small \nisland developing States and other States to address their concerns; and that these \nconcerns include the further development and strengthening, within the appropriate \nforums, of international regulatory regimes to enhance safety, disclosure, liability, \nsecurity and compensation in relation to such transport;  \n \n170. Acknowledges, in the context of paragraph 169 above, the potential \nenvironmental and economic impacts of maritime incidents and accidents on coastal \nStates, in particular those related to the transport of radioactive materials, and \nemphasizes the importance of effective liability regimes in that regard;  \n \n171. Invites States that have not yet done so to consider becoming parties to the \nNairobi International Convention on the Removal of Wrecks, 2007;73  \n \n172. Requests States to take appropriate measures with regard to ships flying \ntheir flag or of their registry to address hazards that may be caused by wrecks and \ndrifting or sunken cargo to navigation or the marine environment;  \n__________________ \n \n73 International Maritime Organization, document LEG/CONF.16/19. \n\nA/RES/74/19 \nOceans and the law of the sea\n \n19-21313\n30/57 \n \n \n173. Calls upon States to ensure that masters on ships flying their flag take the \nsteps required by relevant instruments74 to provide assistance to persons in distress at \nsea, and urges States to cooperate and to take all measures necessary to ensure the \neffective implementation of the amendments to the International Convention on \nMaritime Search and Rescue75 and to the International Convention for the Safety of \nLife at Sea76 relating to the delivery of persons rescued at sea to a place of safety, as \nwell as of the associated Guidelines on the Treatment of Persons Rescued at Sea;77  \n \n174. Recognizes that all States must fulfil their search and rescue \nresponsibilities in accordance with international law, including the Convention, \nreaffirms the ongoing need for the International Maritime Organization and other \nrelevant organizations to assist, in particular, developing States both to increase and \nimprove their search and rescue capabilities, including, as appropriate, through the \nestablishment of additional rescue coordination centres and regional sub-centres, and \nto take effective action to address, to the extent feasible, the issue of unseaworthy \nships and small craft within their national jurisdiction, and emphasizes in this regard \nthe importance of cooperation for these purposes, including within the framework of \nthe International Convention on Maritime Search and Rescue, 1979; 78 \n \n175. Notes the ongoing work of the International Maritime Organization, the \nOffice of the United Nations High Commissioner for Refugees and other relevant \nactors in relation to disembarkation of persons rescued at sea, underscores in this \nregard the need to implement all relevant and applicable international instruments and \nthe importance of cooperation among States as provided for in those instruments, and \nemphasizes in particular the importance of full respect for the principle of \nnon-refoulement in accordance with applicable international law;  \n \n176. Invites States to implement the Revised Guidelines on the Prevention of \nAccess by Stowaways and the Allocation of Responsibilities to Seek the Successful \nResolution of Stowaway Cases, adopted by the Maritime Safety Committee of the \nInternational Maritime Organization in its resolution MSC.448(99) of 24 May 2018 \nand by the Facilitation Committee of that Organization in its resolution FAL.13(42) \nof 8 June 2018; \n \n177. Calls upon States to continue to cooperate in developing comprehensive \napproaches to international migration and development, including through dialogue \non all their aspects;  \n \n178. Also calls upon States to take measures to protect fibre-optic submarine \ncables and to fully address issues relating to these cables, in accordance with \ninternational law, as reflected in the Convention;  \n \n179. Encourages greater dialogue and cooperation among States and the \nrelevant regional and global organizations through workshops and seminars on the \nprotection and maintenance of fibre-optic submarine cables to promote the security \nof such critical communications infrastructure;  \n__________________ \n \n74 Convention on International Civil Aviation, 1944, annex 12, International Convention for the \nSafety of Life at Sea, 1974, International Convention on Maritime Search and Rescue, 1979, as \namended, United Nations Convention on the Law of the Sea, 1982, and International Convention \non Salvage, 1989. \n \n75 International Maritime Organization, document MSC 78/26/Add.1, annex 5, resolution \nMSC.155(78). \n \n76 International Maritime Organization, document MSC 78/26/Add.1, annex 3, resolution \nMSC.153(78). \n \n77 International Maritime Organization, document MSC 78/26/Add.2, annex 34, resolution \nMSC.167(78). \n \n78 United Nations, Treaty Series, vol. 1405, No. 23489. \n\nOceans and the law of the sea \nA/RES/74/19\n \n31/57\n19-21313 \n \n \n180. Also encourages the adoption by States of laws and regulations addressing \nthe breaking or injury of submarine cables or pipelines beneath the high seas done \nwilfully or through culpable negligence by a ship flying its flag or by a person subject \nto its jurisdiction, in accordance with international law, as reflected in the Convention;  \n \n181. Affirms the importance of maintenance, including the repair, of submarine \ncables, undertaken in conformity with international law, as reflected in the \nConvention;  \n \n182. Reaffirms that flag, port and coastal States all bear responsibility for \nensuring the effective implementation and enforcement of international instruments \nrelating to maritime security and safety, in accordance with international law, in \nparticular the Convention, and that flag States have primary responsibility that \nrequires further strengthening, including through increased transparency of \nownership of vessels and the monitoring of organizations authorized to carry out \nsurveys and issue certificates on their behalf, taking into account the Code for \nRecognized Organizations;79  \n \n183. Urges flag States without an effective maritime administration and \nappropriate legal frameworks to establish or enhance the necessary infrastructure, \nlegislative and enforcement capabilities to ensure effective compliance with and \nimplementation and enforcement of their responsibilities under international law, in \nparticular the Convention, and, until such action is taken, to consider declining the \ngranting of the right to fly their flag to new vessels, suspending their registry or not \nopening a registry, and calls upon flag and port States to take all measures consistent \nwith international law necessary to prevent the operation of substandard vessels;  \n \n184. Notes the ongoing work of the International Maritime Organization on \nmeasures to prevent the fraudulent registration and fraudulent registries of ships; \n \n185. Recognizes that international shipping rules and standards adopted by the \nInternational Maritime Organization in respect of maritime safety, efficiency of \nnavigation and the prevention and control of marine pollution, complemented by best \npractices of the shipping industry, have led to a significant reduction in maritime \naccidents and pollution incidents;  \n \n186. Notes that audits of Member States under the International Maritime \nOrganization Member State Audit Scheme became mandatory in January 2016 under \nnine mandatory International Maritime Organization instruments and are being \ncarried out in accordance with the Framework and the Procedures for the International \nMaritime Organization Member State Audit Scheme and using the International \nMaritime Organization Instruments Implementation Code (III Code) as the audit \nstandard;80  \n \n187. Encourages States and competent international organizations and bodies \nto support the effective implementation of the requirements of the International Code \nfor Ships Operating in Polar Waters (Polar Code), adopted by the International \nMaritime Organization under the International Convention for the Safety of Life at \nSea and the International Convention for the Prevention of Pollution from Ships, \n1973, as modified by the Protocol of 1978 relating thereto, as amended, 81 including \n__________________ \n \n79 International Maritime Organization, resolutions MSC.349(92) and MEPC.237(65). \n \n80 See International Maritime Organization, Assembly resolutions A.1018(26), A.1067(28), \nA.1068(28) and A.1070(28). \n \n81 International Maritime Organization, document MEPC 62/24/Add.1, annex 19, resolution \nMEPC.203(62). \n\nA/RES/74/19 \nOceans and the law of the sea\n \n19-21313\n32/57 \n \nrelevant requirements of the International Convention on Standards of Training, \nCertification and Watchkeeping for Seafarers, 1978, as amended; 82  \n \n188. Notes the ongoing work of the International Maritime Organization on \nmatters related to passenger ship safety, and encourages States and competent \ninternational organizations and bodies to support continued efforts, including \ntechnical cooperation activities, to improve passenger ship safety; \n \n189. Recognizes that maritime safety can also be improved through effective \nport State control, the strengthening of regional arrangements and increased \ncoordination and cooperation among them and increased transparency and \ninformation-sharing, making ample use of information systems, such as the \nInternational Maritime Organization Global Integrated Shipping Information \nSystem,83 including among safety and security sectors;  \n \n190. Encourages flag States to take appropriate measures sufficient to achieve \nor maintain recognition by intergovernmental arrangements that recognize \nsatisfactory flag State performance, including, as appropriate, satisfactory port State \ncontrol examination results on a sustained basis, with a view to improving quality \nshipping and furthering flag State implementation of relevant instruments under the \nInternational Maritime Organization as well as relevant goals and objectives of the \npresent resolution; \n \n191. Notes with appreciation the important contribution of the International \nAssociation of Marine Aids to Navigation and Lighthouse Authorities to the \nimprovement and harmonization of marine aids to navigation for the reduction of \nmarine accidents, increased safety of life and property at sea and the protection of the \nmarine environment, and in this regard notes with interest the convening of the \nInternational Association of Marine Aids to Navigation and Lighthouse Authorities \ndiplomatic conference, to be held in Kuala Lumpur from 25 to 28 February 2020, to \nconsider the adoption of a convention on the international organization for marine \naids to navigation; \n \n \n \nIX \nMarine environment and marine resources \n \n \n192. Emphasizes once again the importance of the implementation of Part XII \nof the Convention in order to protect and preserve the marine environment and its \nliving marine resources against pollution and physical degradation, and calls upon all \nStates to cooperate and take measures consistent with the Convention, directly or \nthrough competent international organizations, for the protection and preservation of \nthe marine environment;  \n \n193. Calls upon States to implement the 2030 Agenda, including Goal 14 to \nconserve and sustainably use the oceans, seas and marine resources for sustainable \ndevelopment, and recalls that the Goals and targets are integrated and indivisible;  \n \n194. Reiterates, in this regard, the call made in the declaration entitled \u201cOur \nocean, our future: call for action\u201d for action to be taken on an urgent basis to conserve \nand sustainably use the oceans, seas and marine resources for sustainable \ndevelopment;84  \n__________________ \n \n82 International Maritime Organization, resolutions MSC.385(94) and MEPC.264(68) and related \namendments to the International Convention for the Safety of Life at Sea (resolution \nMSC.386(94)) and the International Convention for the Prevention of Pollution from Ships \n(resolution MEPC.265(68)). \n \n83 International Maritime Organization, Assembly resolutions A.1029(26) and A.1074(28). \n \n84 Resolution 71/312, annex. \n\nOceans and the law of the sea \nA/RES/74/19\n \n33/57\n19-21313 \n \n \n195. Recalls that, in \u201cThe future we want\u201d, States committed themselves to \nprotect and restore the health, productivity and resilience of oceans and marine \necosystems, to maintain their biodiversity, enabling their conservation and sustainable \nuse for present and future generations, and to effectively apply an ecosystem approach \nand the precautionary approach in the management, in accordance with international \nlaw, of activities having an impact on the marine environment, to deliver on all three \ndimensions of sustainable development; \n \n196. Reaffirms paragraph 119 of resolution 61/222 of 20 December 2006 \nregarding ecosystem approaches and oceans, including the proposed elements of an \necosystem approach, means to achieve implementation of an ecosystem approach and \nrequirements for improved application of an ecosystem approach, and in this regard: \n \n(a) \nNotes that continued environmental degradation in many parts of the world \nand increasing competing demands require an urgent response and the setting of \npriorities for management actions aimed at conserving ecosystem integrity; \n \n(b) \nAlso notes that ecosystem approaches to ocean management should be \nfocused on managing human activities in order to maintain and, where needed, restore \necosystem health to sustain goods and environmental services, provide social and \neconomic benefits for food security, sustain livelihoods in support of international \ndevelopment goals, including those contained in the United Nations Millennium \nDeclaration,85 and conserve marine biodiversity; \n \n(c) \nRecalls that States should be guided in the application of ecosystem \napproaches by a number of existing instruments, in particular the Convention, which \nsets out the legal framework for all activities in the oceans and seas, and its \nimplementing Agreements, as well as other commitments, such as those contained in \nthe Convention on Biological Diversity 86  and the World Summit on Sustainable \nDevelopment call for the application of an ecosystem approach by 2010, 22 and in this \ncontext encourages States to enhance their efforts towards applying such an approach; \n \n(d) \nEncourages States to cooperate and coordinate their efforts and take, \nindividually or jointly, as appropriate, all measures, in conformity with international \nlaw, including the Convention and other applicable instruments, to address impacts \non marine ecosystems within and beyond areas of national jurisdiction, taking into \naccount the integrity of the ecosystems concerned; \n \n197. Encourages competent organizations and bodies that have not yet done so \nto incorporate an ecosystem approach into their mandates, as appropriate, in order to \naddress impacts on marine ecosystems;  \n \n198. Acknowledges the request by the United Nations Environment Assembly \nat its second session, in paragraph 6 of its resolution 2/10 of 27 May 2016, to the \nUnited Nations Environment Programme to step up its work, including through its \nRegional Seas Programme, on assisting countries and regions in the application of the \necosystem approach to managing the marine and coastal environment, including \nthrough enabling intersectoral cooperation in integrated coastal zone management \nand marine spatial planning;87  \n \n199. Encourages \nStates, \ndirectly \nor \nthrough \ncompetent \ninternational \norganizations, to consider the further development and application, as appropriate and \nconsistent with international law, including the Convention, of environmental impact \nassessment processes covering planned activities under their jurisdiction or control \n__________________ \n \n85 Resolution 55/2. \n \n86 United Nations, Treaty Series, vol. 1760, No. 30619. \n \n87 See Official Records of the General Assembly, Seventy-first Session, Supplement No. 25 \n(A/71/25), annex. \n\nA/RES/74/19 \nOceans and the law of the sea\n \n19-21313\n34/57 \n \nthat may cause substantial pollution of or significant and harmful changes to the \nmarine environment, and also encourages the communication of the reports of the \nresults of such assessments to the competent international organizations in accordance \nwith the Convention;  \n \n200. Notes with concern the impacts of climate change on the oceans and the \ncryosphere, to which low-lying islands, in particular small island developing States, \ncoasts and coastal communities are particularly exposed;  \n \n201. Also notes with concern the findings of the Intergovernmental Panel on \nClimate Change in its special report entitled The Ocean and Cryosphere in a \nChanging Climate, as well as the summary for policymakers, which was accepted by \nthe Intergovernmental Panel at its fifty-first session on 23 September 2019; \n \n202. Recognizes the importance of improving understanding of the impact of \nclimate change on oceans and seas, and recalls that, in \u201cThe future we want\u201d, States \nnoted that sea level rise and coastal erosion are serious threats for many coastal \nregions and islands, particularly in developing countries, and in this regard called \nupon the international community to enhance its efforts to address these challenges; \n \n203. Takes note of the findings of reports of the Intergovernmental Panel on \nClimate Change, including its Special Report on Global Warming of 1.5\u00b0C, that \nincreasing warming amplifies the exposure of small islands, low-lying coastal areas \nand deltas to the risks associated with sea level rise; \n \n204. Also takes note of the decision by the International Law Commission at its \nseventy-first session to include the topic \u201cSea-level rise in relation to international \nlaw\u201d in its programme of work;88  \n \n205. Notes the eighteenth meeting of the Informal Consultative Process in 2017, \nwhich focused on the theme \u201cThe effects of climate change on oceans\u201d, during which \ndelegations discussed, inter alia, the environmental, social and economic impacts on \nall States, in particular developing States, of the effects of climate change on the \noceans, as well as the urgent need to address such effects and impacts, the need for \ninternational cooperation and coordination, including concerted and immediate action \nto combat the effects of climate change on the oceans, as well as the need for \ncontinued coordinated international focus in recognition that, owing to the \ninterconnected nature of the oceans, ensuing impacts cannot be overcome by any \nsingle State and, in particular, in view of the grave implications for countries with \nlow-lying coasts, some of whose very existence is under threat; 89  \n \n206. Welcomes the Paris Agreement 90  and its early entry into force on \n4 November 2016, encourages all its parties to fully implement the Agreement and \nparties to the United Nations Framework Convention on Climate Change 91 that have \nnot yet done so to deposit their instruments of ratification, acceptance, approval or \naccession, as appropriate, as soon as possible, and recognizes the importance of \nraising awareness of the adverse impact of climate change on the marine environment, \nmarine biodiversity and sea level; \n \n207. Also welcomes, in this regard, the convening of the twenty-fifth session of \nthe Conference of the Parties to the United Nations Framework Convention on \nClimate Change, the fifteenth session of the Conference of the Parties serving as the \nMeeting of the Parties to the Kyoto Protocol and the second session of the Conference \n__________________ \n \n88 Ibid., Seventy-fourth Session, Supplement No. 10 (A/74/10). \n \n89 See A/72/95. \n \n90 See FCCC/CP/2015/10/Add.1, decision 1/CP.21, annex. \n \n91 United Nations, Treaty Series, vol. 1771, No. 30822. \n\nOceans and the law of the sea \nA/RES/74/19\n \n35/57\n19-21313 \n \nof the Parties serving as the Meeting of the Parties to the Paris Agreement in Madrid, \nfrom 2 to 13 December 2019; \n \n208. Notes with concern the severe impacts on coastal communities of extreme \nweather events, such as tropical cyclones and associated storm surges, and encourages \ncooperative actions by relevant United Nations bodies and organizations, including \nthe World Meteorological Organization and the Intergovernmental Oceanographic \nCommission with the advice of the Joint WMO-IOC Collaborative Board,92 to assist \nStates in improving forecasting, including impact-based forecasting, of such events \nand its application in multi-hazard early warning systems and risk management under \na more integrated approach to addressing the impacts of flooding types from multiple \nsources and severe weather;93  \n \n209. Also notes with concern the approximately 30 per cent increase in the \nacidity of ocean surface waters since the beginning of the industrial era 94 and the wide \nrange of impacts associated with the continuing and alarming acidification of the \nworld\u2019s oceans, and urges States to make significant efforts to tackle the causes of \nocean acidification, recognizing countries\u2019 national circumstances and respective \ncapabilities, and to further study and minimize its impacts, to enhance local, national, \nregional and global cooperation in this regard, including the sharing of relevant \ninformation and the development of worldwide capacity, including in developing \ncountries, to measure ocean acidification, and to take steps to make marine \necosystems healthier and, as a result, more resilient, to the extent possible, to the \nimpacts of ocean acidification; \n \n210. Recalls that, in \u201cThe future we want\u201d, States called for support for \ninitiatives that address ocean acidification and the impacts of climate change on \nmarine and coastal ecosystems and resources and in this regard reiterated the need to \nwork collectively to prevent further ocean acidification, as well as to enhance the \nresilience of marine ecosystems and of the communities whose livelihoods depend on \nthem, and to support marine scientific research, monitoring and observation of ocean \nacidification and particularly vulnerable ecosystems, including through enhanced \ninternational cooperation in this regard; \n \n211. Recognizes the attention paid to ocean acidification at the fourteenth, \neighteenth and nineteenth meetings of the Informal Consultative Process, in 2013, \n2017 and 2018, respectively, and commits itself to continue to pay attention to this \nimportant issue, including by taking into account the First Global Integrated Marine \nAssessment (the first World Ocean Assessment), the ongoing work of the Ocean \nAcidification International Coordination Centre of the International Atomic Energy \nAgency and the scientific cooperation fostered by the Global Ocean Acidification \nObserving Network; \n \n212. Notes the work of the Intergovernmental Panel on Climate Change, notes \nwith concern its findings on the acidification of the oceans and the substantial risks \nto marine ecosystems, especially polar ecosystems, coral reefs, plankton and other \norganisms which have a calcareous exoskeleton, or a shell, like crustaceans, and the \npotentially detrimental consequences for fisheries and livelihoods, as well as the \nfindings of the World Meteorological Organization contained in its annual \nGreenhouse Gas Bulletin, and notes its decision to foster collaboration with \n__________________ \n \n92 Established through World Meteorological Organization resolution 9 (Cg-18) and \nIntergovernmental Oceanographic Commission resolution XXX-2, which also disbanded the \nJoint WMO-IOC Technical Commission for Oceanography and Marine Meteorology. \n \n93 See World Meteorological Organization resolution 15 (Cg-18). \n \n94 As stated in the 2013 report of Working Group I of the Intergovernmental Panel on Climate \nChange on the physical science basis of climate change. \n\nA/RES/74/19 \nOceans and the law of the sea\n \n19-21313\n36/57 \n \norganizations and institutions that address the carbon budget of the ocean, 95 and in \nthis regard encourages States and competent international organizations and other \nrelevant institutions, individually and in cooperation, to urgently pursue further \nresearch on ocean acidification, especially programmes of observation and \nmeasurement, noting in particular the continued work under the Convention on \nBiological Diversity, and to increase national, regional and global efforts to address \nlevels of ocean acidity and the negative impact of such acidity on vulnerable marine \necosystems, particularly coral reefs; \n \n213. Encourages States, individually or in collaboration with relevant \ninternational organizations and bodies, to enhance their scientific activity to better \nunderstand the effects of climate change on the marine environment and marine \nbiodiversity, support continued coordination of scientific work to study and minimize \nthe impacts of ocean acidification and develop ways and means of adaptation, taking \ninto account, as appropriate, the precautionary approach and ecosystem approaches;  \n \n214. Notes the vital role that coastal blue carbon ecosystems, including \nmangroves, tidal marshes and seagrasses, play in climate adaptation and mitigation \nthrough carbon sequestration, and in increasing the resilience of coastal ecosystems \nto ocean acidification, and the range of other benefits that these ecosystems provide, \nincluding sustainable livelihoods, food security and biodiversity conservation, and \ncoastal protection, and encourages States and relevant international institutions and \norganizations to work collaboratively to protect and restore coastal blue carbon \necosystems;  \n \n215. Recalls that, in \u201cThe future we want\u201d, States noted with concern that the \nhealth of oceans and marine biodiversity are negatively affected by marine pollution, \nincluding marine debris, especially plastic, persistent organic pollutants, heavy metals \nand nitrogen-based compounds, from a number of marine and land-based sources, \nincluding shipping and land run-off, and that States committed to take action to reduce \nthe incidence and impacts of such pollution on marine ecosystems, including through \nthe effective implementation of relevant conventions adopted in the framework of the \nInternational Maritime Organization, and the follow-up of relevant initiatives such as \nthe Global Programme of Action for the Protection of the Marine Environment from \nLand-based Activities,96 as well as the adoption of coordinated strategies to this end, \nand that they further committed to take action, by 2025, based on collected scientific \ndata, to achieve significant reductions in marine debris to prevent harm to the coastal \nand marine environment;  \n \n216. Encourages States, in accordance with the commitment expressed in \u201cThe \nfuture we want\u201d and based on collected scientific data, to take action by 2025 to \nachieve significant reductions in marine debris to prevent harm to the coastal and \nmarine environment; \n \n217. Notes the discussions at the seventeenth meeting of the Informal \nConsultative Process, in 2016, which focused on the theme \u201cMarine debris, plastics \nand microplastics\u201d and which, inter alia, highlighted that the size of the problem had \nincreased exponentially since the topic of marine debris was addressed at the sixth \nmeeting of the Informal Consultative Process, in 2005, noted that marine debris in \ngeneral, and plastics in particular, were some of the greatest environmental concerns \nof our time, along with climate change, ocean acidification and loss of biodiversity, \ndiscussed prevention and emphasized the need to address the issue, both downstream, \nthrough improved mechanisms for waste management, disposal and recycling, and \n__________________ \n \n95 See World Meteorological Organization resolution 46 (Cg 17). \n \n96 A/51/116, annex II. \n\nOceans and the law of the sea \nA/RES/74/19\n \n37/57\n19-21313 \n \nupstream, by addressing consumption and production patterns, including through \nawareness-raising campaigns;97  \n \n218. Recognizes the need for better understanding of the sources, amounts, \npathways, distribution, trends, nature and impacts of marine debris, especially plastics \nand microplastics, and to examine possible measures and best available techniques \nand environmental practices to prevent its accumulation and minimize its levels in \nthe marine environment, and welcomes in this regard the work conducted under the \nJoint Group of Experts on the Scientific Aspects of Marine Environmental Protection, \nled by the Intergovernmental Oceanographic Commission, and its report entitled \nSources, Fate and Effects of Microplastics in the Marine Environment: A Global \nAssessment, its report entitled Guidelines for the Monitoring and Assessment of \nPlastic Litter in the Ocean, and the report of the Executive Director of the United \nNations Environment Programme on marine plastic debris and microplastics, which \nreviews best-available knowledge and experiences in this regard and gives \nrecommendations for further steps to reduce plastic litter and microplastic in the \noceans;98  \n \n219. Notes that the UNEP Frontiers 2016 Report identifies microplastics as one \nof six key emerging environmental issues, further notes that the sixth Global \nEnvironment Outlook stresses, inter alia, the urgency of addressing ocean plastic \npollution and the proven adverse impacts of microplastics to marine ecosystems, and \ncalls upon States to implement resolution 4/6 on marine plastic litter and \nmicroplastics, adopted by the United Nations Environment Assembly of the United \nNations Environment Programme at its fourth session, held in Nairobi from 11 to \n15 March 2019;11 \n \n220. Welcomes the request by the United Nations Environment Assembly, in \nparagraph 2 of its resolution 4/6, to the Executive Director of the United Nations \nEnvironment Programme, subject to the availability of resources and benefiting from \nthe work of existing mechanisms, to immediately strengthen scientific and \ntechnological knowledge with regard to marine litter, including marine plastic litter \nand microplastics; \n \n221. Acknowledges the decision of the United Nations Environment Assembly, \nin paragraph 7 of its resolution 4/6, to extend the mandate of the ad hoc open-ended \nexpert group on marine litter and microplastics, and its request to the Executive \nDirector of the United Nations Environment Programme to report to the United \nNations Environment Assembly at its fifth session on the progress achieved in the \nimplementation of that resolution;  \n \n222. Welcomes the activities of relevant United Nations bodies and \norganizations, in particular the United Nations Environment Programme, the Food \nand Agriculture Organization of the United Nations and the International Maritime \nOrganization and other intergovernmental organizations, to address the sources and \nimpacts of marine debris, including through the Global Partnership on Marine Litter, \nas well as actions relating to marine debris taken under the Convention on Biological \nDiversity and the Convention on the Conservation of Migratory Species of Wild \nAnimals, 99  in particular the adoption by the Conference of the Parties to that \nConvention at its twelfth meeting of resolution 12.20 on the management of marine \ndebris, and notes the work of the International Whaling Commission on assessing the \nimpacts of marine debris on cetaceans;  \n__________________ \n \n97 See A/71/204. \n \n98 UNEP/EA.2/5. \n \n99 United Nations, Treaty Series, vol. 1651, No. 28395. \n\nA/RES/74/19 \nOceans and the law of the sea\n \n19-21313\n38/57 \n \n \n223. Encourages States to further develop partnerships with industry and civil \nsociety to raise awareness of the extent of the impact of marine debris on the \nbiological diversity, health and productivity of the marine environment and \nconsequent economic loss and to cooperate with other States, industry and civil \nsociety, as appropriate, on environmentally sound and cost-effective measures to \nprevent and reduce, as appropriate, marine debris and microplastics in the marine \nenvironment, including through strengthened cooperation under the Global \nPartnership on Marine Litter; \n \n224. Urges States to integrate the issue of marine debris into national and, as \nappropriate, regional strategies dealing with waste management, especially in the \ncoastal zone, ports and maritime industries, including recycling, reuse, reduction and \ndisposal, to consider developing an integrated waste management infrastructure and \nto encourage the development of appropriate economic incentives with the aim of \nreducing marine debris to address this issue, including the development of cost-\nrecovery systems that provide an incentive to use port reception facilities and \ndiscourage ships from discharging marine debris at sea, and support for measures to \nprevent, reduce and control pollution from any source, including land-based sources, \nsuch as community-based coastal and waterway clean-up and monitoring activities, \nand encourages States to cooperate regionally and subregionally to identify potential \nsources and coastal and oceanic locations where marine debris aggregates and to \ndevelop and implement joint prevention programmes for marine debris and to develop \nand implement environmentally sound options for recovery programmes, as well as \nto raise awareness of the issue of marine debris and the need to consider \nenvironmentally sound options for its removal;  \n \n225. Notes the activities carried out by organizations at the regional level to \ndevelop and implement regional action plans and other joint prevention and recovery \nprogrammes for marine debris, and further notes in this regard, the revised Regional \nAction Plan on Marine Litter adopted at the twenty-fourth Intergovernmental Meeting \nof the Coordinating Body on the Seas of East Asia, held in Bali, Indonesia, on 19 and \n20 June 2019, which comprises actions to prevent and reduce marine litter from \nland-based sources as well as sea-based sources, monitoring and assessment of marine \nlitter, and activities supporting implementation, the twenty-third Intergovernmental \nMeeting of the Northwest Pacific Action Plan, held in Moscow from 9 to 11 October \n2018, and the Bangkok Declaration on Combating Marine Debris in the ASEAN \nRegion, adopted at the thirty-fourth Summit of the Association of Southeast Asian \nNations, held in Bangkok on 22 June 2019, to enhance efforts in addressing the issue \nof marine debris; \n \n226. Also notes the work done under the Asia-Pacific Economic Cooperation \nframework to share best practices, enable innovative waste management financing \nand encourage public-private partnerships in order to prevent and reduce marine \ndebris, including the outcomes of the 2018 workshop hosted by the Republic of \nKorea, which informed the APEC Road Map on Marine Debris endorsed in 2019 at \nthe Senior Officials\u2019 Meeting in Chile;  \n \n227. Welcomes the ongoing work of the members of the Group of 20 on the \n\u201cOsaka Blue Ocean Vision\u201d, which aims to reduce additional pollution by marine \nplastic litter to zero by 2050, and calls upon other members of the international \ncommunity to also share the vision; \n \n228. Encourages States that have not yet done so to become parties to \ninternational agreements addressing the protection and preservation of the marine \nenvironment and its living marine resources against the introduction of harmful \naquatic organisms and pathogens and marine pollution from all sources, including the \ndumping of wastes and other matter, and other forms of physical degradation, as well \n\nOceans and the law of the sea \nA/RES/74/19\n \n39/57\n19-21313 \n \nas agreements that provide for preparedness for, response to and cooperation on \npollution incidents and that include provisions on liability and compensation for \ndamage resulting from marine pollution, and to adopt the necessary measures \nconsistent with international law, including the Convention, aimed at implementing \nand enforcing the rules contained in those agreements; \n \n229. Recalls that, in \u201cThe future we want\u201d, States noted the significant threat \nthat alien invasive species pose to marine ecosystems and resources and committed \nto implement measures to prevent the introduction and manage the adverse \nenvironmental impacts of alien invasive species, including, as appropriate, those \nadopted in the framework of the International Maritime Organization;  \n \n230. Encourages States that have not yet done so to consider ratifying or \nacceding to the International Convention for the Control and Management of Ships\u2019 \nBallast Water and Sediments, 2004, 100  and also encourages States to consider \nimplementing the Guidelines for the control and management of ships\u2019 biofouling to \nminimize the transfer of invasive aquatic species, adopted by the International \nMaritime Organization in resolution MEPC.207(62) of 15 July 2011; \n \n231. Notes the ongoing work of the International Maritime Organization to \nprevent pollution from ships, including through the designation of Special Areas \nunder the International Convention for the Prevention of Pollution from Ships, 1973, \nas modified by the Protocol of 1978 relating thereto, as amended, 101 welcomes the \nadoption by the Marine Environment Protection Committee of an action plan to \naddress marine plastic litter from ships,102 and encourages the International Maritime \nOrganization to continue working on the prevention of pollution from ships; \n \n232. Also notes that the global limit of 0.50 per cent on sulphur in fuel oil under \nannex VI to the International Convention for the Prevention of Pollution from Ships \nwill enter into force on 1 January 2020, encourages States that have not yet done so \nto become parties to the Protocol of 1997 (annex VI \u2013 Regulations for the Prevention \nof Air Pollution from Ships) to the International Convention for the Prevention of \nPollution from Ships, 1973, as modified by the Protocol of 1978 relating thereto, as \namended, and encourages the effective implementation of that Protocol; 103  \n \n233. Further notes the ongoing work of the International Maritime \nOrganization and the resolution on International Maritime Organization policies and \npractices related to the reduction of greenhouse gas emissions from ships, 104 and in \nthis regard also notes its adoption of an initial strategy on the reduction of greenhouse \ngas emissions from ships;105  \n \n234. Urges States to cooperate in correcting the shortfall in port waste reception \nfacilities in accordance with the action plan to address the inadequacy of port waste \nreception facilities developed by the International Maritime Organization; \n__________________ \n \n100 International Maritime Organization, document BWM/CONF/36, annex. \n \n101 International Convention for the Prevention of Pollution from Ships, annex IV (Regulations for \nthe prevention of pollution by sewage from ships) and annex V (Regulations for the prevention \nof pollution by garbage from ships). \n \n102 International Maritime Organization, resolution MEPC.310(73). \n \n103 International Maritime Organization, document MEPC 62/24/Add.1, annex 19, resolution \nMEPC.203(62). \n \n104 International Maritime Organization, Assembly resolution A.963(23). \n \n105 International Maritime Organization, document MEPC 72/17/Add.1, annex 11, resolution \nMEPC.304(72). \n\nA/RES/74/19 \nOceans and the law of the sea\n \n19-21313\n40/57 \n \n \n235. Encourages States that have not yet done so to consider ratifying or \nacceding to the Hong Kong International Convention for the Safe and \nEnvironmentally Sound Recycling of Ships, 2009 106 to facilitate its entry into force; \n \n236. Encourages continued cooperation between the parties to the Basel \nConvention on the Control of Transboundary Movements of Hazardous Wastes and \nTheir Disposal107 and the International Maritime Organization on regulations on the \nprevention of pollution from ships; \n \n237. Notes the role of the Basel Convention in ensuring that the management \nof hazardous wastes and other wastes, under the scope of that Convention, including \ntheir transboundary movement and disposal, is consistent with the protection of the \nmarine environment, and in this regard also notes the recent amendments of \nannexes II, VIII and IX to the Basel Convention in relation to plastic waste, as well \nas decision BC-14/13 of the Conference of the Parties to the Basel Convention, which \nincludes, in particular, the establishment of the Basel Convention Partnership on \nPlastic Waste;  \n \n238. Notes with concern the potential for serious environmental consequences \nresulting from oil spill incidents or pollution incidents involving hazardous or \nnoxious substances, urges States, consistent with international law, to cooperate, \ndirectly or through competent international organizations, and share best practices, in \nthe fields of protection of the marine environment, human health and safety, \nprevention, emergency response and mitigation, and in this regard encourages the \nundertaking of and collaboration on scientific research, including marine scientific \nresearch, to better understand the consequences of marine oil spills or marine spills \ninvolving hazardous or noxious substances;  \n \n239. Encourages States, in accordance with international law, including the \nConvention and other relevant instruments, either bilaterally or regionally, to jointly \ndevelop and promote contingency plans for responding to pollution incidents, as well \nas other incidents that are likely to have significant adverse effects on the marine \nenvironment and biodiversity; \n \n240. Encourages States that have not yet done so to consider ratifying or \nacceding to the International Convention on Oil Pollution Preparedness, Response \nand Cooperation, 1990, 108  and the Protocol on Preparedness, Response and \nCooperation to Pollution Incidents by Hazardous and Noxious Substances, 2000, of \nthe International Maritime Organization, and in this regard to consider developing \nand joining regional arrangements to enhance international cooperation for combating \nmajor oil and hazardous substances pollution incidents;  \n \n241. Encourages States to consider becoming parties to the 2010 Protocol to \nthe 1996 International Convention on Liability and Compensation for Damage in \nConnection with the Carriage of Hazardous and Noxious Substances by Sea; 109  \n \n242. Recognizes that most of the pollution load of the oceans emanates from \nland-based activities and affects the most productive areas of the marine environment, \nand calls upon States, as a matter of priority, to implement the Global Programme of \nAction for the Protection of the Marine Environment from Land-based Activities and \nto take all appropriate measures to fulfil the commitments of the international \ncommunity embodied in the Bali Declaration on the Protection of the Marine \nEnvironment from Land-based Activities, adopted at the fourth Intergovernmental \nReview Meeting on the Implementation of the Global Programme of Action for the \n__________________ \n \n106 International Maritime Organization, document SR/CONF/45. \n \n107 United Nations, Treaty Series, vol. 1673, No. 28911. \n \n108 Ibid., vol. 1891, No. 32194. \n \n109 International Maritime Organization, document LEG/CONF.17/10. \n\nOceans and the law of the sea \nA/RES/74/19\n \n41/57\n19-21313 \n \nProtection of the Marine Environment from Land-based Activities, held in Bali, \nIndonesia, on 31 October and 1 November 2018;110  \n \n243. Welcomes the continued work of States, the United Nations Environment \nProgramme and regional organizations in the implementation of the Global \nProgramme of Action, and encourages increased emphasis on the link between fresh \nwater, the coastal zone and marine resources in the implementation of the 2030 \nAgenda and its Sustainable Development Goals, as well as of the Addis Ababa Action \nAgenda of the Third International Conference on Financing for Development;10 \n \n244. Expresses its concern regarding the spreading of hypoxic dead zones and \nharmful algal blooms in oceans as a result of eutrophication fuelled by riverine run-\noff of fertilizers, sewage outfall and reactive nitrogen resulting from the burning of \nfossil fuels and resulting in serious consequences for ecosystem functioning, and calls \nupon States to enhance their efforts to reduce eutrophication, particularly by reducing \ntotal nutrient pollution from land-based sources and, to this effect, to continue to \ncooperate within the framework of relevant international organizations, in particular \nthe Global Programme of Action and the Global Partnership on Nutrient Management \nand Global Wastewater Initiative, including through capacity-building initiatives and \nefforts to monitor, via the Global Ocean Observing System, stressors such as harmful \nalgal blooms, areas of hypoxia, sargassum seaweed invasions and jellyfish blooms, \nto assess their possible linkage to eutrophication and their potential adverse impacts \non the marine environment as well as on human health;  \n \n245. Encourages States that have not yet done so to take, as soon as possible, \nthe domestic measures necessary to enable them to meet their obligations upon \nratification and, thereafter, to ratify, accept, approve or accede to the Minamata \nConvention on Mercury;111  \n \n246. Calls upon all States to ensure that urban and coastal development projects \nand related land-reclamation activities are carried out in a responsible manner that \nprotects the marine habitat and environment and mitigates the negative consequences \nof such activities;  \n \n247. Encourages States that have not yet done so to become parties to the 1996 \nProtocol to the Convention on the Prevention of Marine Pollution by Dumping of \nWastes and Other Matter, 1972 (the London Protocol); \n \n248. Recalls the resolution of the thirtieth Consultative Meeting of Contracting \nParties to the Convention on the Prevention of Marine Pollution by Dumping of \nWastes and Other Matter, 1972 (the London Convention) and the third Meeting of \nContracting Parties to the London Protocol, held from 27 to 31 October 2008, on the \nregulation of ocean fertilization,112 in which the Contracting Parties agreed, inter alia, \nthat the scope of the London Convention and Protocol includes ocean fertilization \nactivities and that, given the present state of knowledge, ocean fertilization activities \nother than for legitimate scientific research should not be allowed, and that scientific \nresearch proposals should be assessed on a case-by-case basis using an assessment \nframework that was subsequently developed and adopted in 2010 by the Contracting \nParties to the London Convention and Protocol, namely, the Assessment Framework \nfor Scientific Research Involving Ocean Fertilization, 113 and also agreed that, to this \nend, such other activities should be considered as contrary to the aims of the London \nConvention and Protocol and should not currently qualify for any exemption from the \n__________________ \n \n110 UNEP/GPA/IGR.4/5, annex. \n \n111 UNEP(DTIE)/Hg/CONF/4, annex II. \n \n112 International Maritime Organization, document LC 30/16, annex 6, resolution LC-LP.1 (2008). \n \n113 International Maritime Organization, document LC 32/15 and Corr.1, annex 5, resolution LC \nLP.2 (2010). \n\nA/RES/74/19 \nOceans and the law of the sea\n \n19-21313\n42/57 \n \ndefinition of dumping in article III, paragraph 1 (b), of the London Convention and \narticle 1, paragraph 4.2, of the London Protocol;113 \n \n249. Notes the continued work of the Contracting Parties to the London \nConvention and Protocol towards a global, transparent and effective control and \nregulatory mechanism for ocean fertilization activities and other activities that fall \nwithin the scope of the London Convention and Protocol and have the potential to \ncause harm to the marine environment, and notes the resolution adopted by the eighth \nMeeting of Contracting Parties to the London Protocol, held from 14 to 18 October \n2013, on the amendment to the London Protocol to regulate the placement of matter \nfor ocean fertilization and other marine geoengineering activities; 114  \n \n250. Recalls decision IX/16 C, adopted at the ninth meeting of the Conference \nof the Parties to the Convention on Biological Diversity, held in Bonn, Germany, from \n19 to 30 May 2008,115 in which the Conference of the Parties, inter alia, bearing in \nmind the ongoing scientific and legal analysis occurring under the auspices of the \nLondon Convention and Protocol, requested parties and urged other Governments, in \naccordance with the precautionary approach, to ensure that ocean fertilization \nactivities were not carried out until there was an adequate scientific basis on which to \njustify such activities, including an assessment of associated risks, and that a global, \ntransparent and effective control and regulatory mechanism was in place for those \nactivities, with the exception of small-scale scientific research studies within coastal \nwaters, and stated that such studies should be authorized only if justified by the need \nto gather specific scientific data, should be subject to a thorough prior assessment of \nthe potential impacts of the research studies on the marine environment, should be \nstrictly controlled and should not be used for generating and selling carbon offsets or \nfor any other commercial purposes, and takes note of decision X/29, adopted at the \ntenth meeting of the Conference of the Parties to the Convention on Biological \nDiversity, held in Nagoya, Japan, from 18 to 29 October 2010, 116  in which the \nConference of the Parties requested parties to implement decision IX/16 C;  \n \n251. Also recalls that, in \u201cThe future we want\u201d, States stressed their concern \nabout the potential environmental impacts of ocean fertilization, recalled in this \nregard the decisions related to ocean fertilization adopted by the relevant \nintergovernmental bodies, and resolved to continue addressing ocean fertilization \nwith utmost caution, consistent with the precautionary approach;  \n \n252. Encourages States that have not done so to become parties to regional seas \nconventions and the protocols thereto addressing the protection and preservation of \nthe marine environment, while noting the role of the United Nations Environment \nProgramme Regional Seas Programme; \n \n \n \nX \nMarine biodiversity \n \n \n253. Reaffirms its central role relating to the conservation and sustainable use \nof marine biological diversity of areas beyond national jurisdiction;  \n \n254. Notes the work and contributions of States and relevant intergovernmental \norganizations and bodies in the context of the Ad Hoc Open-ended Informal Working \nGroup to study issues relating to the conservation and sustainable use of marine \nbiological diversity beyond areas of national jurisdiction, and the extensive and \ncomplex discussions and exchange of views at the four sessions of the Preparatory \nCommittee established by resolution 69/292: Development of an international legally \n__________________ \n \n114 International Maritime Organization, document LC 35/15, annex 4, resolution LP.4(8). \n \n115 See United Nations Environment Programme, document UNEP/CBD/COP/9/29, annex I. \n \n116 See United Nations Environment Programme, document UNEP/CBD/COP/10/27, annex. \n\nOceans and the law of the sea \nA/RES/74/19\n \n43/57\n19-21313 \n \nbinding instrument under the United Nations Convention on the Law of the Sea on \nthe conservation and sustainable use of marine biological diversity of areas beyond \nnational jurisdiction, which concluded on 21 July 2017, as well as the report of the \nPreparatory Committee and the recommendations contained therein;117  \n \n255. Welcomes the holding of the second and third sessions of the \nintergovernmental conference convened under resolution 72/249, from 25 March to \n5 April 2019 and 19 to 30 August 2019, respectively, and takes note of the substantive \ndiscussions that addressed the topics identified in the package agreed in 2011, namely, \nthe conservation and sustainable use of marine biological diversity of areas beyond \nnational jurisdiction, in particular, together and as a whole, marine genetic resources, \nincluding questions on the sharing of benefits, measures such as area-based \nmanagement tools, including marine protected areas, environmental impact \nassessments, and capacity-building and the transfer of marine technology, and further \ntakes note that the President of the conference will prepare, as part of the preparation \nfor the fourth session of the conference, a revised draft text of an agreement; \n \n256. Requests the Secretary-General to convene the fourth session of the \nintergovernmental conference from 23 March to 3 April 2020;  \n \n257. Recognizes the abundance and diversity of marine genetic resources and \ntheir value in terms of the benefits, goods and services they can provide;  \n \n258. Also recognizes the importance of research on marine genetic resources \nfor the purpose of enhancing the scientific understanding, potential use and \napplication, and enhanced management of marine ecosystems;  \n \n259. Notes the work under the Jakarta Mandate on Marine and Coastal \nBiological Diversity 118  and the Convention on Biological Diversity elaborated \nprogramme of work on marine and coastal biological diversity, 119  and, while \nreiterating the central role of the General Assembly relating to the conservation and \nsustainable use of marine biological diversity of areas beyond national jurisdiction, \nnotes with appreciation the complementary technical and scientific work done by the \nConference of the Parties to the Convention on Biological Diversity;  \n \n260. Reaffirms the need for States, individually or through competent \ninternational organizations, to urgently consider ways to integrate and improve, based \non the best available scientific information and the precautionary approach and in \naccordance with the Convention and related agreements and instruments, the \nmanagement of risks to the marine biodiversity of seamounts, cold water corals, \nhydrothermal vents and certain other underwater features;  \n \n261. Invites parties to the Convention on Biological Diversity to implement the \nvoluntary specific workplan on biodiversity in cold water areas within the \njurisdictional scope of that Convention, adopted in 2016 by the thirteenth meeting of \nthe Conference of the Parties to that Convention;120  \n \n262. Calls upon States and international organizations to urgently take further \naction to address, in accordance with international law, destructive practices that have \nadverse impacts on marine biodiversity and ecosystems, including seamounts, \nhydrothermal vents and cold water corals;  \n__________________ \n \n117 A/AC.287/2017/PC.4/2. \n \n118 See A/51/312, annex II, decision II/10. \n \n119 United Nations Environment Programme, document UNEP/CBD/COP/7/21, annex, decision \nVII/5, annex I. \n \n120 United Nations Environment Programme, document UNEP/CBD/COP/13/25, sect. I, decision \nXIII/11, annex II. \n\nA/RES/74/19 \nOceans and the law of the sea\n \n19-21313\n44/57 \n \n \n263. Calls upon States to strengthen, in a manner consistent with international \nlaw, in particular the Convention, the conservation and management of marine \nbiodiversity and ecosystems, and national policies in relation to area-based \nmanagement tools, including marine protected areas; \n \n264. Recalls that, in \u201cThe future we want\u201d, States reaffirmed the importance of \narea-based conservation measures, including marine protected areas, consistent with \ninternational law and based on best available scientific information, as a tool for \nconservation of biological diversity and sustainable use of its components, and noted \ndecision X/2 of the tenth meeting of the Conference of the Parties to the Convention \non Biological Diversity, that by 2020, 10 per cent of coastal and marine areas, \nespecially areas of particular importance for biodiversity and ecosystem services, are \nto be conserved through effectively and equitably managed, ecologically \nrepresentative and well-connected systems of protected areas and other effective area-\nbased conservation measures;116 \n \n265. Encourages States, in this regard, to further progress towards the \nestablishment of marine protected areas, including representative networks, and calls \nupon States to further consider options to identify and protect ecologically or \nbiologically significant areas, consistent with international law and on the basis of the \nbest available scientific information; \n \n266. Invites States to identify measures to achieve Aichi Biodiversity Target 11, \nenshrined in decision X/2 of the tenth meeting of the Conference of the Parties to the \nConvention on Biological Diversity, and takes note of the announcements made by \nsome States in this regard; \n \n267. Reaffirms the need for States to continue and intensify their efforts, \ndirectly and through competent international organizations, to develop and facilitate \nthe use of diverse approaches and tools for conserving and managing vulnerable \nmarine ecosystems, including the possible establishment of marine protected areas, \nconsistent with international law, as reflected in the Convention, and based on the \nbest scientific information available;  \n \n268. Notes the work of States, relevant intergovernmental organizations and \nbodies, including the Convention on Biological Diversity, in the assessment of \nscientific information on and compilation of ecological criteria for the identification \nof marine areas that may require protection, in the light of the objective of the World \nSummit on Sustainable Development to develop and facilitate the use of diverse \napproaches and tools, such as ecosystem approaches and the establishment of marine \nprotected areas consistent with international law, as reflected in the Convention, and \nbased on scientific information, including representative networks; 22 \n \n269. Recalls that the Conference of the Parties to the Convention on Biological \nDiversity, at its ninth meeting, adopted scientific criteria for identifying ecologically \nor biologically significant marine areas in need of protection in open-ocean waters \nand deep-sea habitats and scientific guidance for selecting areas to establish a \nrepresentative network of marine protected areas, including in open-ocean waters and \ndeep-sea habitats,121 and notes the ongoing work under the Convention on Biological \nDiversity on the application of the scientific criteria for ecologically or biologically \nsignificant marine areas through the organization of a series of regional workshops; \n \n270. Also recalls that the Food and Agriculture Organization of the United \nNations has developed guidance for the identification of vulnerable marine \necosystems through the International Guidelines for the Management of Deep-Sea \n__________________ \n \n121 United Nations Environment Programme, document UNEP/CBD/COP/9/29, annex I, decision IX/20, \nannexes I and II. \n\nOceans and the law of the sea \nA/RES/74/19\n \n45/57\n19-21313 \n \nFisheries in the High Seas, and notes its ongoing work to support application of the \nGuidelines by States and to maintain a database of vulnerable marine ecosystems;  \n \n271. Notes with appreciation the work of the Sustainable Ocean Initiative under \nthe Convention on Biological Diversity; \n \n272. Notes the ongoing work of the International Maritime Organization to \nidentify and designate as Particularly Sensitive Sea Areas marine areas which are \nrecognized for their significance in terms of ecological, socioeconomic or scientific \ncriteria and are vulnerable to damage by international shipping activities;122  \n \n273. Acknowledges the Micronesia Challenge, the Eastern Tropical Pacific \nSeascape project, the Caribbean Challenge and the Coral Triangle Initiative, which \nseek to create and link domestic marine protected areas to better facilitate ecosystem \napproaches, notes the Phoenix Islands Protected Area as a multinational partnership, \nand reaffirms the need for further international cooperation, coordination and \ncollaboration in support of such initiatives; \n \n274. Recalls that, in \u201cThe future we want\u201d, States recognized the significant \neconomic, social and environmental contributions of coral reefs, in particular to \nislands and other coastal States, as well as the significant vulnerability of coral reefs \nand mangroves to impacts, including from climate change, ocean acidification, \noverfishing, destructive fishing practices and pollution, and supported international \ncooperation with a view to conserving coral reef and mangrove ecosystems and \nrealizing their social, economic and environmental benefits, as well as facilitating \ntechnical collaboration and voluntary information-sharing; \n \n275. Emphasizes the need to mainstream sustainable coral reef management and \nintegrated watershed management into national development strategies, as well as \ninto the activities of relevant United Nations agencies and programmes, international \nfinancial institutions and the donor community;  \n \n276. Reiterates its support for the International Coral Reef Initiative, notes that \nthe thirty-fourth International Coral Reef Initiative General Meeting was held in \nTownsville, Australia, from 2 to 7 December 2019, and supports the elaborated \nprogramme of work of the Convention on Biological Diversity on marine and coastal \nbiological diversity related to coral reefs under the Jakarta Mandate on Marine and \nCoastal Biological Diversity; \n \n277. Encourages States and relevant international institutions to improve \nefforts to address coral bleaching by, inter alia, improving monitoring to predict and \nidentify bleaching events, supporting and strengthening action taken during such \nevents and improving strategies to manage reefs to support their natural resilience \nand enhance their ability to withstand other pressures, including ocean acidification, \nand in this regard also encourages States to implement the priority actions to achieve \nAichi Biodiversity Target 10 for coral reefs and closely associated ecosystems, \nadopted by the twelfth meeting of the Conference of the Parties to the Convention on \nBiological Diversity;123  \n \n278. Encourages States to cooperate, directly or through competent \ninternational bodies, in exchanging information in the event of accidents involving \nvessels on coral reefs and in promoting the development of economic assessment \ntechniques for both restoration and non-use values of coral reef systems;  \n__________________ \n \n122 International Maritime Organization, Revised Guidelines for the Identification and Designation \nof Particularly Sensitive Sea Areas, Assembly resolution A.982(24). \n \n123 United Nations Environment Programme, document UNEP/CBD/COP/12/29, sect. I, decision \nXII/23, annex. \n\nA/RES/74/19 \nOceans and the law of the sea\n \n19-21313\n46/57 \n \n \n279. Notes that ocean noise has potential significant adverse impacts on living \nmarine resources, affirms the importance of sound scientific studies in addressing this \nmatter, encourages further research, studies and consideration of the impacts of ocean \nnoise on living marine resources, notes the work of States and competent international \norganizations in that regard, and requests the Division to continue to compile the peer-\nreviewed scientific studies it receives from Member States and intergovernmental \norganizations pursuant to paragraph 107 of resolution 61/222 and, as appropriate, to \nmake them, or references and links to them, available on its website;  \n \n280. Also notes the discussions at the nineteenth meeting of the Informal \nConsultative Process, in 2018, on the theme of anthropogenic underwater noise, \nduring which delegations, inter alia, expressed concern over the potential social, \neconomic and environmental impacts of anthropogenic underwater noise due to the \ngrowth of ocean-related human activities, which has resulted in increased sound in \nmany parts of the ocean, as well as the potential impacts of anthropogenic underwater \nnoise on different marine species and, in view of the continuing gaps in knowledge \nand lack of data, stressed the urgent need for further research and international \ncooperation to assess and address the potential effects of anthropogenic underwater \nnoise in all ocean areas;124  \n \n281. Calls upon States to consider appropriate cost-effective measures and \napproaches to assess and address the potential socioeconomic and environmental \nimpacts of anthropogenic underwater noise, taking into account the precautionary \napproach and ecosystem approaches and the best available scientific information, as \nappropriate; \n \n282. Notes the approval by the International Maritime Organization of \nGuidelines for the Reduction of Underwater Noise from Commercial Shipping to \nAddress Adverse Impacts on Marine Life, and invites the International Maritime \nOrganization to promote and encourage their implementation for existing ships and \nnew vessels, when appropriate, including by promoting measures that may reduce \ncavitation, 125  and encourages States to continue their work at the International \nMaritime Organization to enhance understanding of the extent to which improved \nship technology, including efficient propeller design, could lead to reduced \nintroduction of underwater noise in the oceans; \n \n283. Also notes the convening of the Quieting Ships to Protect the Marine \nEnvironment: Policy Workshop, in Vancouver, Canada, on 4 and 5 November 2019; \n \n284. Encourages further research into, and testing of, technologies to reduce \nthe impact of underwater noise on marine life; \n \n \n \nXI \nMarine science \n \n \n285. Calls upon States, individually or in collaboration with each other or with \ncompetent international organizations and bodies, to continue to strive to improve \nunderstanding and knowledge of the oceans and the deep sea, including, in particular, \nthe extent and vulnerability of deep sea biodiversity and ecosystems, by increasing \ntheir marine scientific research activities in accordance with the Convention;  \n \n286. Encourages, in that regard, relevant international organizations and other \ndonors to consider supporting the Endowment Fund of the Authority in order to \npromote the conduct of collaborative marine scientific research in the international \nseabed area by supporting the participation of qualified scientists and technical \n__________________ \n \n124 See A/73/124. \n \n125 International Maritime Organization, document MEPC.1/Circ.833, annex. \n\nOceans and the law of the sea \nA/RES/74/19\n \n47/57\n19-21313 \n \npersonnel from developing countries in relevant programmes, initiatives and \nactivities;  \n \n287. Notes with concern that human-related threats, such as marine debris, ship \nstrikes, underwater noise, persistent contaminants, coastal development activities, oil \nspills and discarded fishing gear, together may severely impact marine life, including \nits higher trophic levels, and calls upon States and competent international \norganizations to cooperate and coordinate their research efforts in this regard so as to \nreduce these impacts and preserve the integrity of the whole marine ecosystem, while \nfully respecting the mandates of relevant international organizations;  \n \n288. Invites all relevant organizations, funds, programmes and bodies within \nthe United Nations system, in consultation with interested States, to coordinate \nrelevant activities with regional and national marine scientific and technological \ncentres in small island developing States, as appropriate, to ensure the more effective \nachievement of their objectives in accordance with relevant United Nations small \nisland developing States development programmes and strategies;  \n \n289. Welcomes \nthe \nresolution \nadopted \nby \nthe \nAssembly \nof \nthe \nIntergovernmental Oceanographic Commission at its twenty-eighth session, held in \nParis from 18 to 25 June 2015, regarding the adoption of the Second International \nIndian Ocean Expedition as an important catalyst project linking Indian Ocean \nprocesses to the global ocean and atmosphere, officially launched in Goa, India, on \n4 December 2015 for an initial period of five years, invites States to participate in \nthis initiative, and notes that two nodes of the Second International Indian Ocean \nExpedition Joint Project Office have been established to coordinate operations of the \nexpedition in Perth, Australia, and Hyderabad, India;  \n \n290. Notes with appreciation the work of the Intergovernmental Oceanographic \nCommission, with the advice of the Advisory Body of Experts on the Law of the Sea, \non the development of procedures for the implementation of Parts XIII and XIV of \nthe Convention;  \n \n291. Notes that the depth of a significant percentage of the world\u2019s oceans, seas \nand waterways has yet to be measured directly and that bathymetric knowledge \nunderpins the safe, sustainable and cost-effective execution of almost every human \nactivity in, on or under the sea; \n \n292. Welcomes the work of the General Bathymetric Chart of the Oceans project \nunder the International Hydrographic Organization and the Intergovernmental \nOceanographic Commission and, in particular, the outcome of the Forum for Future \nOcean Floor Mapping, held in June 2016 in Monaco, and the subsequent development \nby the Guiding Committee of the Seabed 2030 project for improving bathymetry \nglobally;  \n \n293. Encourages Member States to consider contributing to mechanisms that \nencourage the widest possible availability of all bathymetric data, so as to support the \nsustainable development, management and governance of the marine environment; \n \n294. Notes with appreciation the contribution to marine biodiversity research \nof the Ocean Biogeographic Information System, a free and open-access data holding \nand sharing facility, hosted by the Intergovernmental Oceanographic Commission;  \n \n295. Welcomes the increasing attention being focused on oceans as a potential \nsource of renewable energy, and notes in this regard the summary of discussions of \nthe Informal Consultative Process at its thirteenth meeting, in 2012;126  \n__________________ \n \n126 See A/67/120. \n\nA/RES/74/19 \nOceans and the law of the sea\n \n19-21313\n48/57 \n \n \n296. Stresses the importance of increasing the scientific understanding of the \noceans-atmosphere interface, including through participation in ocean observing \nprogrammes and geographic information systems, such as the Global Ocean \nObserving System, sponsored by the Intergovernmental Oceanographic Commission, \nthe United Nations Environment Programme, the World Meteorological Organization \nand the International Science Council, particularly considering their role in \nmonitoring and forecasting climate change and variability, in supporting Earth system \nprediction127 and in the establishment and operation of tsunami warning systems;  \n \n297. Welcomes the progress made by the Intergovernmental Oceanographic \nCommission and Member States towards the establishment and operation of regional \nand national tsunami warning and mitigation systems, also welcomes the continued \ncollaboration of the United Nations and other intergovernmental organizations in this \neffort, further welcomes the development and recent dissemination of the new \nEnhanced Tsunami Products for the Pacific Tsunami Warning and Mitigation System \nand the development of Enhanced Tsunami Products for the Tsunami and Other \nCoastal Hazards Warning System for the Caribbean and Adjacent Regions, which will \nassist countries in the Pacific and the Caribbean to assess tsunami threats and issue \nwarnings, and encourages Member States to establish and sustain their national \nwarning and mitigation systems, within a global, ocean-related multi-hazard \napproach, as necessary, to reduce loss of life and damage to national economies and \nstrengthen the resilience of coastal communities to natural disasters;  \n \n298. Stresses the need for continued efforts in developing mitigation and \npreparedness measures for natural disasters, particularly following tsunami events \nsuch as the 11 March 2011 event in Japan and the events on 28 September and \n22 December 2018 in Indonesia; \n \n299. Takes note of the sixth Global Environment Outlook, entitled Healthy \nPlanet, Healthy People, approved on 24 January 2019, which, inter alia, identifies the \nprincipal drivers of change facing oceans and coasts and their impacts;  \n \n300. Urges States to take necessary action and to cooperate in relevant \norganizations, including the Food and Agriculture Organization of the United \nNations, the Intergovernmental Oceanographic Commission and the World \nMeteorological Organization, to address damage to ocean data buoys deployed and \noperated in accordance with international law, including through education and \noutreach about the importance and purpose of these buoys and by strengthening these \nbuoys against such damage and increasing reporting of such damage;  \n \n301. Notes the discussions at the twentieth meeting of the Informal Consultative \nProcess, from 10 to 14 June 2019, on the theme of ocean science and the United \nNations Decade of Ocean Science for Sustainable Development, during which \ndelegations, inter alia, stressed the importance of marine scientific research, \ninternational cooperation and coordination, as well as of a stronger science-policy \ninterface in understanding and effectively addressing the unprecedented pressures on \nthe ocean, provided input to assist in preparing for the Decade and considered that \nthe Decade will be an important opportunity to address gaps in ocean science, increase \nknowledge, improve synergies and support the sustainable conservation and \nmanagement of marine resources, and during which several delegations underlined \nthe important complementary role of traditional knowledge held by indigenous \npeoples and local communities;4  \n \n302. Welcomes the steps taken by the Intergovernmental Oceanographic \nCommission to prepare the implementation plan for the United Nations Decade of \nOcean Science for Sustainable Development (2021\u20132030) in consultation with Member \n__________________ \n \n127 See World Meteorological Organization resolution 47 (Cg-18). \n\nOceans and the law of the sea \nA/RES/74/19\n \n49/57\n19-21313 \n \nStates, specialized agencies, funds, programmes and bodies of the United Nations, as \nwell as other intergovernmental organizations, non-governmental organizations and \nrelevant stakeholders, and requests the Intergovernmental Oceanographic Commission \nto continue to provide information on the development of the implementation plan and \npresent it to the General Assembly at its seventy-fifth session;  \n \n303. Requests that the Intergovernmental Oceanographic Commission regularly \nconsult with, and report to, Member States on the United Nations Decade of Ocean \nScience for Sustainable Development and its implementation; \n \n304. Invites the Secretary-General to inform the General Assembly on the \nimplementation of the United Nations Decade of Ocean Science for Sustainable \nDevelopment through his report on oceans and the law of the sea, on the basis of \ninformation to be provided by the Intergovernmental Oceanographic Commission; \n \n305. Invites UN-Oceans and its participants to collaborate with the \nIntergovernmental Oceanographic Commission on the United Nations Decade of \nOcean Science for Sustainable Development; \n \n \n \nXII \nRegular Process for Global Reporting and Assessment of the State \nof the Marine Environment, including Socioeconomic Aspects  \n \n \n306. Reiterates the need to strengthen the regular scientific assessment of the \nstate of the marine environment in order to enhance the scientific basis for \npolicymaking; \n \n307. Reaffirms the principles guiding the Regular Process and its objective and \nscope, recalls the crucial importance of the Regular Process for ongoing ocean-related \nintergovernmental processes and its possible inputs, including for the 2030 Agenda, \nthe development of an international legally binding instrument under the United \nNations Convention on the Law of the Sea on the conservation and sustainable use of \nmarine biological diversity of areas beyond national jurisdiction, the United Nations \nFramework Convention on Climate Change and the United Nations Open-ended \nInformal Consultative Process on Oceans and the Law of the Sea, among other \nrelevant processes, and notes the importance of continuing support and cooperation \nbetween the activities of the United Nations Decade of Ocean Science for Sustainable \nDevelopment and those of the Regular Process; \n \n308. Recalls the importance of ensuring that assessments, such as those \nincluded in the Global Sustainable Development Report and those prepared under the \nIntergovernmental Panel on Climate Change, the Intergovernmental Science-Policy \nPlatform on Biodiversity and Ecosystem Services and the Regular Process, support \none another and avoid unnecessary duplication, and also recalls the importance of \ncompatibility and synergies between such assessments and assessments at the \nregional level; \n \n309. Reaffirms the importance of the first World Ocean Assessment as the \noutcome of the first cycle of the Regular Process, recalls the technical abstracts of the \nAssessment, and reiterates its concern as reflected in the findings of the Assessment, \nas recorded in paragraph 289 of its resolution 71/257 and in subsequent resolutions; \n \n310. Recalls the decision that, in the first cycle, the scope of the Regular \nProcess focused on establishing a baseline, and that the scope of the second cycle \nwould extend to evaluating trends and identifying gaps, also recalls the approval by \nthe Ad Hoc Working Group of the Whole of the outline for the second world ocean \nassessment, notes the consideration by the Bureau of the Ad Hoc Working Group \nduring the intersessional period of an annotated outline for the second world ocean \nassessment, and also notes the further revised timetable and implementation plan for \n\nA/RES/74/19 \nOceans and the law of the sea\n \n19-21313\n50/57 \n \nthe second world ocean assessment prepared by the Group of Experts in consultation \nwith the secretariat of the Regular Process; \n \n311. Welcomes the holding of the second round of regional workshops in \nsupport of the second cycle of the Regular Process in Koror, Palau, on 8 and 9 August \n2018, in Valletta on 27 and 28 August 2018, in Odessa, Ukraine, on 17 and 18 October \n2018, in Bali, Indonesia, on 8 and 9 November 2018, in Doha on 28 and 29 November \n2018, in Accra on 3 and 4 December 2018 and in Guayaquil, Ecuador, on 17 and \n18 December 2018, and takes note of the summaries of those workshops; \n \n312. Recognizes the need for early preparation for possible future regional \nworkshops in support of the Regular Process, and invites States to consider hosting \nsuch workshops and inform the secretariat of their intent as early as possible;  \n \n313. Recalls the importance of raising awareness of the first World Ocean \nAssessment and the Regular Process, and recognizes with appreciation the activities \nundertaken to raise awareness of the Assessment, including during the regional \nworkshops held in 2017 and 2018 in support of the second cycle of the Regular \nProcess;  \n \n314. Welcomes the holding of the multi-stakeholder dialogue and capacity-\nbuilding partnership event on 24 and 25 January 2019, notes the summary of \ndiscussions, and welcomes the approval by the Ad Hoc Working Group of the Whole \nat its twelfth meeting of the conclusions from the partnership event;3  \n \n315. Reiterates \nits \ninvitation \nto \nStates \nand \nintergovernmental \nand \nnon-governmental organizations to provide relevant information to the secretariat for \ninclusion in the capacity-building inventory of needs and opportunities relevant for \nthe Regular Process, and expresses its appreciation for the information contributed \nthus far and for the work undertaken by the secretariat;  \n \n316. Also reiterates its request to intergovernmental and non-governmental \norganizations to provide information on recent and ongoing assessments and other \nprocesses at the regional and global levels relevant to the Regular Process in order \nfor the secretariat to update the inventory, and expresses its appreciation for the \ninformation contributed thus far and for the work of the secretariat in compiling the \ninformation received;  \n \n317. Welcomes the holding of the twelfth meeting of the Ad Hoc Working Group \nof the Whole on 29 and 30 July 2019, in accordance with paragraph 334 of resolution \n73/124, and endorses the recommendations adopted by the Ad Hoc Working Group at \nits twelfth meeting;3 \n \n318. Decides to launch the third cycle of the Regular Process, to cover five \nyears, from 2021 to 2025, and requests the Bureau, with the assistance of the Group \nof Experts and the secretariat, to develop a draft programme of work for the third \ncycle, on the basis of the possible outcomes and building blocks of the third cycle \nprepared by the Bureau and endorsed by the Ad Hoc Working Group of the Whole at \nits twelfth meeting and taking into account lessons learned from the second cycle, and \nto report to Member States in advance of the thirteenth meeting of the Ad Hoc \nWorking Group;  \n \n319. Requests the Bureau of the Ad Hoc Working Group of the Whole to \nconsider the lessons learned from the second cycle of the Regular Process, including \nwith regard to the duration of the cycle and its outputs, in line with the modalities set \nforth in paragraph 282 of resolution 70/235 and on the basis of input received from \nMember States and other participants in the Ad Hoc Working Group and the Group \nof Experts, as well as from the secretariat, and also requests the Bureau to inform the \n\nOceans and the law of the sea \nA/RES/74/19\n \n51/57\n19-21313 \n \nAd Hoc Working Group of the views received and to circulate that information in \nadvance of the thirteenth meeting of the Ad Hoc Working Group;  \n \n320. Requests the Secretary-General to prepare the resource requirements for \nthe third cycle of the Regular Process on the basis of the draft programme of work for \nthe third cycle, to be developed in the intersessional period by the Bureau, and to \nreport to Member States in advance of the thirteenth meeting of the Ad Hoc Working \nGroup of the Whole;  \n \n321. Recognizes with appreciation the important role of the Co-Chairs and the \nBureau of the Ad Hoc Working Group of the Whole in providing guidance during the \nintersessional period before the twelfth meeting of the Ad Hoc Working Group, \nrequests the Bureau to continue to implement the decisions and guidance of the Ad \nHoc Working Group during the intersessional period before the thirteenth meeting of \nthe Ad Hoc Working Group, and recognizes the support provided by the secretariat in \nthat regard;  \n \n322. Also recognizes with appreciation the continued work of the members of \nthe Group of Experts and that of the Pool of Experts of the Regular Process in the \nimplementation of the second cycle of the Regular Process;  \n \n323. Urges regional groups that have not yet done so to appoint experts to the \nGroup of Experts, taking into account the need to ensure equitable geographical \ndistribution and adequate expertise in socioeconomic disciplines;  \n \n324. Welcomes the appointment of additional experts to the Pool of Experts for \nthe second cycle of the Regular Process by States and through recommendations from \nrelevant intergovernmental organizations, in accordance with the revised mechanism \nfor the establishment of the Pool of Experts for the second cycle of the Regular \nProcess;  \n \n325. Also welcomes the designation by States of national focal points pursuant \nto paragraph 319 of resolution 73/124, and urges States that have not yet done so to \ndesignate their national focal points as soon as possible; \n \n326. Recalls \nits \ninvitation \nto \nthe \nIntergovernmental \nOceanographic \nCommission of the United Nations Educational Scientific and Cultural Organization, \nthe United Nations Environment Programme, the International Maritime \nOrganization, the Food and Agriculture Organization of the United Nations, the World \nMeteorological Organization and relevant United Nations system organizations, \nbodies, funds and programmes, as appropriate, to assist in the implementation of the \nsecond cycle of the Regular Process with regard to the following activities: \nawareness-raising, the identification of experts for the Pool of Experts, technical and \nscientific support for the Bureau and the Group of Experts, hosting meetings of the \nwriting teams and capacity-building, and also recalls its invitation to relevant \nintergovernmental organizations to contribute, as appropriate, to the activities of the \nsecond cycle;  \n \n327. Requests the Secretary-General to convene the thirteenth meeting of the \nAd Hoc Working Group of the Whole on 9 and 10 September 2020 with a view to \nproviding recommendations to the General Assembly on progress in the \nimplementation of the second cycle and on the draft programme of work and resource \nrequirements for the third cycle of the Regular Process, and also to convene the \nfourteenth meeting of the Ad Hoc Working Group for one day in December 2020 or \nJanuary 2021, depending on the calendar of meetings of the seventy-fifth session of \nthe General Assembly, with a view to considering the second world ocean assessment \nand providing recommendations to the General Assembly;  \n\nA/RES/74/19 \nOceans and the law of the sea\n \n19-21313\n52/57 \n \n \n328. Urges States, international financial institutions, donor agencies, \nintergovernmental organizations, non-governmental organizations and natural and \njuridical persons to make financial contributions to the voluntary trust fund and to \nmake other contributions to the Regular Process;  \n \n329. Recalls the potential of the Regular Process special scholarship fund, \nestablished pursuant to resolution 64/71, to support training programmes for developing \ncountries, including through cooperation projects among various stakeholders, in order \nto strengthen the human and institutional capacity of those countries to carry out \nintegrated assessments, and encourages States, international financial institutions, \ndonor agencies, intergovernmental organizations, non-governmental organizations and \nnatural and juridical persons to make financial contributions to that fund; \n \n \n \nXIII \nRegional cooperation \n \n \n330. Notes with appreciation efforts and initiatives at the regional level, in \nvarious regions, to further the implementation of the Convention and to respond, \nincluding through capacity-building, to issues related to maritime safety and security, \nthe conservation and sustainable use of living marine resources, the protection and \npreservation of the marine environment and the conservation and sustainable use of \nmarine biodiversity; \n \n331. Invites States and international organizations to enhance their cooperation \nto better protect the marine environment; \n \n332. Notes the Caribbean-focused Assistance Fund, which is intended to \nfacilitate, mainly through technical assistance, the voluntary undertaking of maritime \ndelimitation negotiations between Caribbean States, notes once again the Fund for \nPeace: Peaceful Settlement of Territorial Disputes, established by the General \nAssembly of the Organization of American States in 2000 as a primary mechanism, \ngiven its broader regional scope, for the prevention and resolution of pending \nterritorial, land border and maritime boundary disputes, and calls upon States and \nothers in a position to do so to contribute to these funds; \n \n333. Recalls the outcome document of the third International Conference on \nSmall Island Developing States, the SIDS Accelerated Modalities of Action \n(SAMOA) Pathway128 and the modalities set forth for strengthened action on a range \nof small island developing States challenges and priorities, including challenges \nrelated to the conservation and sustainable use of marine resources, and the \npreservation of the marine environment, and in this regard welcomes the convening \nof the high-level midterm review of the Samoa Pathway in September 2019 and the \nadoption of its political declaration,129 which notes the importance of oceans, seas and \nmarine resources to small island developing States and acknowledges their efforts to \ndevelop and implement strategies for the conservation and sustainable use of the \nocean and its resources, and reaffirms its commitment to work with small island \ndeveloping States towards the full implementation of the Samoa Pathway to ensure \nits success;  \n \n334. Recognizes the results of the International Polar Year, 2007\u20132008 with \nparticular emphasis on new knowledge about the linkages between environmental \nchange in the polar regions and global climate systems, and encourages States and \nscientific communities to strengthen their cooperation in this respect;  \n \n335. Acknowledges the important contributions to scientific understanding of \nthe marine environment and its resources, as well as the scientific advice for their \n__________________ \n \n128 Resolution 69/15, annex. \n \n129 Resolution 74/3. \n\nOceans and the law of the sea \nA/RES/74/19\n \n53/57\n19-21313 \n \nsustainable use, provided by the International Council for the Exploration of the Sea \nin its wide-ranging cooperation with organizations at the regional level under the \nConvention for the International Council for the Exploration of the Sea, 1964;130  \n \n336. Welcomes regional cooperation, and in this regard notes the Pacific \nOceanscape Framework as an initiative to enhance cooperation among coastal States \nin the Pacific island region to foster marine conservation and sustainable \ndevelopment; \n \n337. Notes with appreciation the various cooperative efforts displayed by States \nat the regional and subregional levels, and in this regard welcomes initiatives, such \nas the Integrated Assessment and Management of the Gulf of Mexico Large Marine \nEcosystem;  \n \n338. Acknowledges relevant cooperation among the members of the Zone of \nPeace and Cooperation of the South Atlantic;  \n \n339. Recalls the decision of the Assembly of the African Union in January 2015 \nto adopt Agenda 2063, also recalls that the African Union launched the Decade of \nAfrican Seas and Oceans (2015\u20132025), and notes that the African Day of the Seas and \nOceans is to be celebrated annually on 25 July; \n \n340. Notes the adoption of the Vienna Programme of Action for Landlocked \nDeveloping Countries for the Decade 2014\u20132024 by the second United Nations \nConference on Landlocked Developing Countries, held in Vienna from 3 to \n5 November 2014,\n131  following the comprehensive 10-year review of the \nimplementation of the Almaty Programme of Action: Addressing the Special Needs \nof Landlocked Developing Countries within a New Global Framework for Transit \nTransport Cooperation for Landlocked and Transit Developing Countries, 132 and also \nnotes the need for cooperation to address the development needs and challenges faced \nby landlocked developing countries associated with, inter alia, their lack of direct \nterritorial access to the sea, remoteness and isolation from world markets, in line with \nthe objectives of the Vienna Programme of Action; \n \n341. Also notes the efforts of the Sargasso Sea Commission, led by the \nGovernment of Bermuda, to raise awareness of the ecological significance of the \nSargasso Sea;  \n \n342. Further notes the Agreement on Enhancing International Arctic Scientific \nCooperation, negotiated under the auspices of the Arctic Council, and notes that its \nimplementation will increase the development of scientific knowledge about the region; \n \n343. Notes the cooperation between the OSPAR Commission established by the \nConvention for the Protection of the Marine Environment of the North-East \nAtlantic133 and the North-East Atlantic Fisheries Commission; \n \n \n \nXIV \nOpen-ended Informal Consultative Process on Oceans and the Law of the Sea \n \n \n344. Welcomes the report of the Co-Chairs on the work of the Informal \nConsultative Process at its twentieth meeting, which focused on the theme of ocean \n__________________ \n \n130 United Nations, Treaty Series, vol. 652, No. 9344. \n \n131 Resolution 69/137, annex II. \n \n132 Report of the International Ministerial Conference of Landlocked and Transit Developing \nCountries and Donor Countries and International Financial and Development Institutions on \nTransit Transport Cooperation, Almaty, Kazakhstan, 28 and 29 August 2003 (A/CONF.202/3), \nannex I. \n \n133 United Nations, Treaty Series, vol. 2354, No. 42279. \n\nA/RES/74/19 \nOceans and the law of the sea\n \n19-21313\n54/57 \n \nscience and the United Nations Decade of Ocean Science for Sustainable \nDevelopment;4  \n \n345. Recognizes the role of the Informal Consultative Process as a unique forum \nfor comprehensive discussions on issues related to oceans and the law of the sea, \nconsistent with the framework provided by the Convention and chapter 17 of \nAgenda 21,6 and that the perspective of the three pillars of sustainable development \nshould be further enhanced in the examination of the selected topics;  \n \n346. Welcomes the work of the Informal Consultative Process and its \ncontribution to improving coordination and cooperation between States and \nstrengthening the annual debate of the General Assembly on oceans and the law of \nthe sea by effectively drawing attention to key issues and current trends;  \n \n347. Also welcomes efforts to improve and focus the work of the Informal \nConsultative Process, and in that respect recognizes the primary role of the Informal \nConsultative Process in integrating knowledge, the exchange of opinions among \nmultiple stakeholders and coordination among competent agencies, and enhancing \nawareness of topics, including emerging issues, while promoting the three pillars of \nsustainable development;  \n \n348. Recalls the need to strengthen and improve the efficiency of the Informal \nConsultative Process, and encourages States, intergovernmental organizations and \nprogrammes to provide guidance to the Co-Chairs to this effect, particularly before \nand during the preparatory meeting for the Informal Consultative Process;  \n \n349. Requests the Secretary-General to convene, in accordance with paragraphs \n2 and 3 of resolution 54/33, the twenty-first meeting of the Informal Consultative \nProcess, in New York for eight meetings during the week of 22 to 26 June 2020, to \nprovide it with the facilities necessary for the performance of its work, including \ndocumentation, and to arrange for support to be provided by the Division, in \ncooperation with other relevant parts of the Secretariat, as appropriate;  \n \n350. Expresses its continued serious concern regarding the lack of resources \navailable in the voluntary trust fund established pursuant to resolution 55/7 for the \npurpose of assisting developing countries, in particular least developed countries, \nsmall island developing States and landlocked developing States, in attending the \nmeetings of the Informal Consultative Process, and urges States, international \nfinancial \ninstitutions, \ndonor \nagencies, \nintergovernmental \norganizations, \nnon-governmental organizations and natural and juridical persons to make additional \ncontributions to the trust fund;  \n \n351. Decides that those representatives from developing countries who are \ninvited by the Co-Chairs, in consultation with Governments, to make presentations \nduring the meetings of the Informal Consultative Process shall receive priority \nconsideration in the disbursement of funds from the voluntary trust fund established \npursuant to resolution 55/7 in order to cover the costs of their travel, and shall also \nbe eligible to receive daily subsistence allowance subject to the availability of funds \nafter the travel costs of all other eligible representatives from those countries \nmentioned in paragraph 350 above have been covered;  \n \n352. Also decides that, in its deliberations on the report of the Secretary-\nGeneral on oceans and the law of the sea, the Informal Consultative Process shall \nfocus its discussions at its twenty-first meeting, in 2020, on the theme \u201cSea-level rise \nand its impacts\u201d;  \n \n \n\nOceans and the law of the sea \nA/RES/74/19\n \n55/57\n19-21313 \n \nXV \nCoordination and cooperation \n \n \n353. Encourages States to work closely with and through international \norganizations, funds and programmes, as well as the specialized agencies of the \nUnited Nations system and relevant international conventions, to identify emerging \nareas of focus for improved coordination and cooperation and how best to address \nthese issues;  \n \n354. Expresses its concern at the desecration of graves at sea and the looting of \nwrecks of ships constituting such graves, and calls upon States to cooperate, as \nappropriate, to prevent the looting and desecration of wrecks of ships constituting \ngraves in order to ensure that proper respect is given to all human remains located in \nmaritime waters, consistent with international law, including, as appropriate, the 2001 \nConvention on the Protection of the Underwater Cultural Heritage, among parties \nthereto; \n \n355. Encourages bodies established by the Convention to strengthen \ncoordination and cooperation, as appropriate, in fulfilling their respective mandates; \n \n356. Requests the Secretary-General to bring the present resolution to the \nattention of heads of intergovernmental organizations, the specialized agencies, funds \nand programmes of the United Nations engaged in activities relating to ocean affairs \nand the law of the sea, as well as funding institutions, and underlines the importance \nof their constructive and timely input for the report of the Secretary-General on \noceans and the law of the sea and of their participation in relevant meetings and \nprocesses;  \n \n357. Welcomes the work done by the secretariats of relevant United Nations \nspecialized agencies, programmes, funds and bodies and the secretariats of related \norganizations and conventions to enhance inter-agency coordination and cooperation \non ocean issues, including, where appropriate, through UN-Oceans, the inter-agency \ncoordination mechanism on ocean and coastal issues within the United Nations system;  \n \n358. Recognizes the work undertaken by UN-Oceans, in particular the \ninventory of mandates and the development of a draft methodology for the indicator \nfor target 14.c of the 2030 Agenda, under the revised terms of reference for the work \nof UN-Oceans, and with the United Nations Legal Counsel/the Division as the focal \npoint of UN-Oceans, and, as an interim measure, in this regard invites States, \ninternational financial institutions, donor agencies, intergovernmental organizations, \nnon-governmental organizations and natural and juridical persons to make financial \nearmarked contributions to the trust fund established by the Secretary-General for the \nOffice of Legal Affairs to support the promotion of international law, and authorizes \nthe Secretary-General to disburse funds from such contributions to that trust fund for \nthe purposes of the maintenance of an online searchable database for an inventory of \nthe mandates of UN-Oceans members and priorities approved by the respective \ngoverning bodies of the participating organizations of UN-Oceans, with a view to \nidentifying possible areas of collaboration and synergy, as well as for travel associated \nwith the performance of the functions of the focal point;  \n \n359. Recalls its decision to defer the review of the terms of reference for the \nwork of UN-Oceans until its seventy-fifth session; \n \n \n \nXVI \nActivities of the Division for Ocean Affairs and the Law of the Sea \n \n \n360. Expresses its appreciation to the Secretary-General for the annual reports \non oceans and the law of the sea, prepared by the Division, as well as for the other \n\nA/RES/74/19 \nOceans and the law of the sea\n \n19-21313\n56/57 \n \nactivities of the Division, which reflect the high standard of assistance provided to \nMember States by the Division; \n \n361. Notes with satisfaction the eleventh observance by the United Nations of \nWorld Oceans Day in 2019,134 recognizes with appreciation the efforts deployed by \nthe Division in this regard, and invites the Division to continue to promote and \nfacilitate international cooperation on the law of the sea and ocean affairs in the \ncontext of the future observance of World Oceans Day, as well as through its \nparticipation in other events;  \n \n362. Recalls the responsibilities and functions entrusted to the Secretary-\nGeneral in the Convention and in the related resolutions of the General Assembly, \nincluding resolutions 49/28 and 52/26, notes the increased number of requests to the \nDivision for additional outputs and servicing of meetings and in relation to the support \nto be provided by the Division as secretariat of the Regular Process during the second \ncycle of the Regular Process, and requests the Secretary-General to ensure the \nallocation of appropriate resources to the Division for the performance of its activities \nunder the approved budget for the Organization;  \n \n363. Requests the Secretary-General to continue the publication activities of \nthe Division, in particular through the publication of Guidelines on deposit with the \nSecretary-General of charts or lists of geographical coordinates under the \nConvention135 and the Law of the Sea Bulletin; \n \n \n \nXVII \nSeventy-fifth session of the General Assembly \n \n \n364. Requests the Secretary-General to prepare reports for consideration by the \nGeneral Assembly at its seventy-fifth session, namely, a report on developments and \nissues relating to ocean affairs and the law of the sea, including the implementation \nof the present resolution, in accordance with resolutions 49/28, 52/26 and 54/33, and \na report on the topic that is the focus of the twenty-first meeting of the Informal \nConsultative Process;  \n \n365. Emphasizes the critical role of the annual reports of the Secretary-General, \nwhich integrate information on developments relating to the implementation of the \nConvention and the work of the Organization, its specialized agencies and other \ninstitutions in the field of ocean affairs and the law of the sea at the global and regional \nlevels, and as a result constitute the basis for the annual consideration and review of \ndevelopments relating to ocean affairs and the law of the sea by the General Assembly \nas the global institution having the competence to undertake such a review;  \n \n366. Notes that the reports referred to in paragraph 364 above will also be \nsubmitted to States Parties pursuant to article 319 of the Convention regarding issues \nof a general nature that have arisen with respect to the Convention;  \n \n367. Also notes the desire to further improve the efficiency of and effective \nparticipation of delegations in the informal consultations concerning the annual \nGeneral Assembly resolution on oceans and the law of the sea, decides that the period \nof the informal consultations on that resolution should not exceed a maximum of eight \ndays in total and that the consultations should be scheduled in such a way that the \nDivision has sufficient time to produce the report on developments and issues relating \nto ocean affairs and the law of the sea referred to in paragraph 364 above, requests \nthe Secretary-General to continue to provide support to the consultations through the \n__________________ \n \n134 By its resolution 63/111, the General Assembly designated 8 June as World Oceans Day. \n \n135 This publication replaces The Law of the Sea: A Select Bibliography. \n\nOceans and the law of the sea \nA/RES/74/19\n \n57/57\n19-21313 \n \nDivision, and encourages States to submit proposals for the resolution to the \nCoordinator of the informal consultations no later than one week before the first day \nof the first round of the informal consultations; \n \n368. Decides to include in the provisional agenda of its seventy-fifth session \nthe item entitled \u201cOceans and the law of the sea\u201d.  \n \n43rd plenary meeting \n10 December 2019 \n \n",
  "paragraphs": {
    "1": "Reaffirms the unified character of the Convention1 and the vital importance of preserving its integrity;",
    "2": "Calls upon all States that have not done so, in order to fully achieve the goal of universal participation, to become parties to the Convention and the Part XI Agreement;23",
    "3": "Calls upon States that have not done so, in order to achieve the goal of universal participation, to become parties to the Agreement for the Implementation of the Provisions of the United Nations Convention on the Law of the Sea of 10 December 1982 relating to the Conservation and Management of Straddling Fish Stocks and Highly Migratory Fish Stocks (the Fish Stocks Agreement); 24",
    "4": "Calls upon States to harmonize their national legislation with the provisions of the Convention and, where applicable, relevant agreements and instruments, to ensure the consistent application of those provisions and to ensure also that any declarations or statements that they have made or make when signing, ratifying or acceding to the Convention do not purport to exclude or to modify the legal effect of the provisions of the Convention in their application to the State concerned and to withdraw any such declarations or statements;",
    "5": "Calls upon States Parties to the Convention that have not yet done so to deposit with the Secretary-General charts or lists of geographical coordinates, as provided for in the Convention, preferably using the generally accepted and most recent geodetic datums;",
    "6": "Notes, in this regard, the ongoing efforts of the Secretary-General to improve the existing geographic information system for the deposit by States of charts and geographical coordinates concerning maritime zones, including lines of delimitation, submitted pursuant to the Convention, and to give due publicity thereto, also notes the ongoing cooperation and progress achieved in the development by the International Hydrographic Organization, in cooperation with the Division, of the technical standards for the collection, storage and dissemination of the information deposited, which are not legally binding, in order to ensure compatibility among geographic information systems, electronic nautical charts and other systems, and re-emphasizes the importance of the completion of these efforts through wide participation and reviews by Member States;",
    "7": "Also notes that the twenty-ninth Meeting of States Parties to the Convention requested the Secretariat to prepare a note on the practice of the Secretary-General in respect of the deposit of charts and geographical coordinates under the Convention for submission to the thirtieth Meeting, in 2020;5",
    "8": "Urges all States to cooperate, directly or through competent international bodies, in taking measures to protect and preserve objects of an archaeological and historical nature found at sea, in conformity with the Convention, and calls upon States to work together on such diverse challenges and opportunities as the appropriate relationship between salvage law and scientific management and conservation of underwater cultural heritage, increasing technological abilities to discover and reach underwater sites, looting and growing underwater tourism;",
    "9": "Acknowledges the recent deposit of instruments of ratification of the 2001 Convention on the Protection of the Underwater Cultural Heritage, 25 calls upon States that have not yet done so to consider becoming parties to that Convention, and notes in particular the rules annexed to that Convention, which address the relationship between salvage law and scientific principles of management, conservation and protection of underwater cultural heritage among Parties, their nationals and vessels flying their flag; II Capacity-building",
    "10": "Recognizes the importance of assisting developing States, in particular the least developed countries, landlocked developing countries and small island developing States, as well as coastal African States, in implementing the Convention, urges States, international financial institutions, donor agencies, intergovernmental organizations, non-governmental organizations and natural and juridical persons to make voluntary financial or other contributions to the trust funds, as referred to in resolutions 55/7, 57/141, and 64/71 of 4 December 2009, established for this purpose, and expresses its appreciation to those that have contributed;26",
    "11": "Emphasizes that capacity-building is essential to ensure that States, especially developing countries, in particular the least developed countries, landlocked developing countries and small island developing States, as well as coastal African States, are able to fully implement the Convention, benefit from the sustainable development of the oceans and seas and participate fully in global and regional forums on ocean affairs and the law of the sea;",
    "12": "Also emphasizes the need to address the particular challenges faced by developing middle-income countries through capacity-building;",
    "13": "Calls for capacity-building initiatives to take into account the needs of developing countries, and calls upon States, international organizations and donor agencies to make efforts to ensure the sustainability of such initiatives;",
    "14": "Recalls, in this regard, that, in \u201cThe future we want\u201d,7 States recognized the importance of building the capacity of developing countries to be able to benefit from the conservation and sustainable use of the oceans and seas and their resources, and in this regard emphasized the need for cooperation in marine scientific research to implement the provisions of the Convention and the outcomes of the major summits on sustainable development, as well as for the transfer of technology, taking into account the Criteria and Guidelines on the Transfer of Marine Technology adopted by the Assembly of the Intergovernmental Oceanographic Commission of the United Nations Educational, Scientific and Cultural Organization at its twenty-second session, in 2003;",
    "15": "Emphasizes the need for international cooperation for capacity-building, including cross-sectoral cooperation, at national, regional and global levels, to address, in particular, gaps in capacity-building in ocean affairs and the law of the sea, including marine science;",
    "16": "Calls upon donor agencies and international financial institutions to keep their programmes systematically under review to ensure the availability in all States, particularly in developing States, of the economic, legal, navigational, scientific and technical skills necessary for the full implementation of the Convention and the objectives of the present resolution, as well as the sustainable development of the oceans and seas nationally, regionally and globally, and in so doing to bear in mind the interests and needs of landlocked developing States;",
    "17": "Encourages intensified efforts to build capacity for developing countries, in particular for the least developed countries and small island developing States, as well as coastal African States, to improve aids to navigation and search and rescue services, hydrographic services and the production of nautical charts, including electronic charts, as well as the mobilization of resources and building of capacity with support from international financial institutions and the donor community;",
    "18": "Calls upon States and international organizations, including through bilateral, regional and global cooperation programmes, technical partnerships and fellowships, to continue in a sustainable and comprehensive way to support, promote and strengthen capacity-building activities, in particular in developing countries, in the field of marine scientific research by, inter alia, training personnel to develop and enhance relevant expertise, providing the necessary equipment, facilities and vessels and transferring environmentally sound technologies, and taking into account the need to improve capacities in the field of taxonomy;",
    "19": "Also calls upon States and international institutions, including through bilateral, regional and global cooperation programmes, technical partnerships and fellowships, to support and strengthen capacity-building activities in developing countries, in particular least developed countries and small island developing States, to develop their maritime administration and appropriate legal frameworks to establish or enhance the necessary infrastructure, legislative and enforcement capabilities to promote effective compliance with and implementation and enforcement of their responsibilities under international law;",
    "20": "Invites States, in particular those States with advanced technology and marine capabilities, to explore prospects for improving cooperation with and assistance to developing States, in particular least developed countries, landlocked developing countries and small island developing States, as well as coastal African States, with a view to better integrating into national policies and programmes sustainable and effective development in the marine sector;",
    "21": "Recognizes that promoting the voluntary transfer of technology is an essential aspect of building capacity in marine science, encourages States to use the Intergovernmental Oceanographic Commission Criteria and Guidelines on the Transfer of Marine Technology, and recalls the important role of the secretariat of that Commission in the implementation and promotion of the Criteria and Guidelines;",
    "22": "Calls upon States and international institutions, including through bilateral, regional and global cooperation programmes, technical partnerships and fellowships, to develop and strengthen capacity-building activities in and to transfer to developing countries, in particular least developed countries and small island developing States, on mutually agreed terms, and taking into account the Criteria and Guidelines on the Transfer of Marine Technology, environmentally sound technologies to study and minimize the impacts of ocean acidification;",
    "23": " building scientific capacity for ocean acidification monitoring, research and experimentation, including through the Pier2Peer scientific mentorship programme;",
    "24": "Recognizes the ongoing activities of the secretariat of the Convention on Biological Diversity in coordinating capacity-building efforts to support developing States in achieving the Aichi Biodiversity Targets in marine and coastal areas;27",
    "25": "Emphasizes the need to focus on strengthening South-South cooperation as an additional way to build capacity and as a cooperative mechanism to further enable countries to set their own priorities and needs and to foster actions to implement such cooperation;",
    "26": "Recognizes with appreciation the important contribution to capacity- building in the field of the law of the sea by the Rhodes Academy of Oceans Law and Policy, a cooperative undertaking by the Center for Oceans Law and Policy of the University of Virginia School of Law, the Aegean Institute of the Law of the Sea and Maritime Law, the Law of the Sea Institute of Iceland, the Max Planck Institute for Comparative Public Law and International Law, the Netherlands Institute for the Law of the Sea of Utrecht University and the Centre for International Law of the National University of Singapore, which enjoys associate sponsorship of the Korea Maritime Institute and the Ankara University Research Center of the Sea and Maritime Law and offers a prominent three-week summer course annually in Rhodes, Greece, and has graduated 998 students from more than 120 countries;",
    "27": "Also recognizes with appreciation the important contribution to capacity- building in the field of the law of the sea by the Summer Academy of the International Foundation for the Law of the Sea at the Tribunal;",
    "28": "Further recognizes with appreciation the important contribution of the Korea Maritime Institute to the trust fund to support the internship programmes at the Tribunal since 2011 and its continued efforts, in cooperation with the Expo 2012 Yeosu Korea Foundation, to provide education and training for capacity-building of developing countries through the Yeosu Academy of the Law of the Sea programme;",
    "29": "Recognizes the holding of the regional courses on the continental shelf in Arusha, United Republic of Tanzania, jointly organized by the African Institute of International Law and the University of the Faroe Islands, and their continuing important contribution to capacity-building, particularly in developing countries;",
    "30": "Also recognizes the importance of the work of the Malta-based International Maritime Law Institute of the International Maritime Organization, as a centre of education and training of specialists in maritime law, including government legal advisers and other high-level officials, mainly from developing States, confirms its effective capacity-building role in the field of international maritime law, shipping law and marine environmental law, and urges States, intergovernmental organizations and financial institutions to make voluntary financial contributions to the budget of the Institute which runs annually;",
    "31": "Further recognizes the importance of the World Maritime University of the International Maritime Organization, as a centre of excellence for maritime education and research, confirms its effective capacity-building role in the field of maritime transportation, policy, administration, management, safety, security and environmental protection, as well as its role in the international exchange and transfer of knowledge, notes the role of the World Maritime University-Sasakawa Global Ocean Institute, and urges States, intergovernmental organizations and other bodies to make voluntary financial contributions to the University\u2019s Endowment Fund;",
    "32": "Welcomes the efforts of the Tribunal in holding regional workshops, including the latest workshop on the role of the Tribunal in the settlement of disputes relating to the law of the sea for the Latin American region, held in Montevideo on 13 and 14 November 2019, in cooperation with the Government of Uruguay and the Korea Maritime Institute;",
    "33": "Also welcomes ongoing activities for capacity-building so as to address maritime security and protection of the marine environment of developing States, and encourages States and international financial institutions to provide additional funding for capacity-building programmes, including for transfer of technology, including through the International Maritime Organization and other competent international organizations;",
    "34": "Recognizes the considerable need to provide sustained capacity-building assistance, including on financial and technical aspects, by relevant international organizations and donors to developing States, with a view to further strengthening their capacity to take effective measures against the multiple facets of international criminal activities at sea, in line with the relevant international instruments, including the United Nations Convention against Transnational Organized Crime and the Protocols thereto;28",
    "35": "Also recognizes the need to build the capacity of developing States to raise awareness of and support the implementation of improved waste management practices, noting the particular vulnerability of small island developing States to the impact of marine pollution of all kinds, in particular from land-based activities and marine debris and nutrient pollution;29",
    "36": "Acknowledges the importance of capacity-building for developing States, in particular the least developed countries, landlocked developing countries and small island developing States, as well as coastal African States, for the protection of the marine environment and the conservation and sustainable use of marine resources;",
    "37": "Encourages States to consider additional opportunities for capacity- building at the regional level;",
    "38": "Takes note of the first edition of the Global Ocean Science Report of the Intergovernmental Oceanographic Commission, which assesses for the first time the status of and trends in ocean science capacity around the world;",
    "39": "Also takes note of the Capacity Development Strategy (2015\u20132021) of the Intergovernmental Oceanographic Commission, which takes into account that capacity development is a fundamental tenet of the mission of the Intergovernmental Oceanographic Commission;",
    "40": "Expresses its appreciation for the contribution of the Intergovernmental Oceanographic Commission to capacity-building through its Ocean Teacher Academy training system, which has provided training in ocean data and information management, and notes the setting up of the Ocean Teacher Global Academy, operating through a network of regional training centres, which builds capacity and promotes expertise available in developing countries;",
    "41": "Welcomes the establishment by the Assembly of the Intergovernmental Oceanographic Commission at its twenty-ninth session of the Group of Experts on Capacity Development and, in particular, its invitation to the Group of Experts in its decision IOC-XXX/11.1 to continue the assessment of the capacity development needs of the Intergovernmental Oceanographic Commission member States and to prepare a proposal for the development of an Intergovernmental Oceanographic Commission Clearing House Mechanism for the Transfer of Marine Technology, including analysis of the possibility of expanding the clearing house mechanism to respond to other requirements;",
    "42": "Calls upon States to continue to assist developing States, and especially the least developed countries and small island developing States, as well as coastal African States, at the bilateral and, where appropriate, multilateral levels, in the preparation of submissions to the Commission regarding the establishment of the outer limits of the continental shelf beyond 200 nautical miles, including the assessment of the nature and extent of the continental shelf of a coastal State, and recalls that coastal States can make requests to the Commission for scientific and technical advice in the preparation of data for their submissions, in accordance with article 3 of annex II to the Convention;",
    "43": "Recognizes the importance of the trust fund established pursuant to resolution 55/7 for the purpose of facilitating the preparation of submissions to the Commission for developing States, in particular the least developed countries and small island developing States, and compliance with article 76 of the Convention, and for the purpose of providing assistance to developing States to meet the travel and daily subsistence allowance costs associated with meeting with the Commission when their submissions are being examined and upon the invitation of the Commission,30 in accordance with paragraph 31 of the terms of reference, guidelines and rules of the trust fund, and also recognizes the need for assistance in the preparation of additional information with respect to submissions and revised or new submissions and in maintaining critical capacity during the period from the submission by a coastal developing State of the particulars of the outer limits of its continental shelf beyond 200 nautical miles to the Commission up to the final stages of its examination by the Commission;",
    "44": "Calls upon the Division to continue to disseminate information on relevant procedures related to the trust fund established for the purpose of facilitating the preparation of submissions to the Commission and to continue its dialogue with potential beneficiaries with a view to providing financial support to developing countries for activities to facilitate their submissions in accordance with the requirements of article 76 of the Convention and with the Rules of Procedure 31 and the Scientific and Technical Guidelines of the Commission; 32",
    "45": "Requests the Secretary-General, in cooperation with States and relevant international organizations and institutions, to continue to support training and other activities to assist developing States in the preparation and presentation of their submissions to the Commission;",
    "46": "Recognizes with appreciation the contribution of the Division to capacity- building activities at the national and regional levels, in particular the work of the Division in promoting wider appreciation of the Convention and in assisting with its implementation, through the provision of information, advice and assistance to States and intergovernmental organizations, as well as the support of the Division for Member State implementation of the relevant parts of the 2030 Agenda for Sustainable Development;8",
    "47": "Notes with appreciation the joint implementation by the Division and the United Nations Conference on Trade and Development of a project funded through the United Nations Development Account to assist participating developing States in developing evidence-based and policy-coherent oceans economy and trade strategies and aimed at supporting participating developing States in realizing economic benefits from the sustainable use of marine resources;",
    "48": "Notes the partnership between the Division and the Intergovernmental Oceanographic Commission on a training programme on marine scientific research under the Convention, and encourages States, relevant international organizations and other donors to consider supporting the initiative;",
    "49": "Invites the Secretary-General, in cooperation with Member States, international financial institutions, donor agencies and intergovernmental organizations, to endeavour to expand the capacity-building activities of the Division in order to meet the increased need for assistance to developing States;",
    "50": "Invites States, international financial institutions, donor agencies, intergovernmental organizations, non-governmental organizations and natural and juridical persons to support the capacity-building activities of the Division, including by making earmarked voluntary contributions to the trust fund established by the Secretary-General for the Office of Legal Affairs to support the promotion of international law, and expresses its appreciation to those that have contributed;",
    "51": "Recognizes with appreciation the important contribution to the capacity- building of developing countries and the promotion of the law of the sea made by the Hamilton Shirley Amerasinghe Memorial Fellowship on the Law of the Sea, which was established by the General Assembly in 1981 in honour of the first President of the Third United Nations Conference on the Law of the Sea, and recalls in this regard the provisions of its resolutions on the United Nations Programme of Assistance in the Teaching, Study, Dissemination and Wider Appreciation of International Law;33",
    "52": "Expresses its appreciation to States that have made contributions to the voluntary trust fund for the Hamilton Shirley Amerasinghe Memorial Fellowship on the Law of the Sea, notes that the financial state of the Fellowship remains critical and that contributions are urgently needed to ensure that at least one fellowship can be awarded annually, expresses its commitment to further promote the importance of the Fellowship, and urges States, international financial institutions, donor agencies, intergovernmental organizations, non-governmental organizations and natural and juridical persons to make voluntary financial contributions in support of the Fellowship;",
    "53": "Recognizes with appreciation the important contribution of the United Nations-Nippon Foundation of Japan Fellowship Programme and the newer United Nations-Nippon Foundation Sustainable Ocean Programme, which includes the Critical Needs Fellowship, Thematic Fellowship and training programme to reinforce capacity in the context of the intergovernmental conference on an international legally binding instrument under the Convention on the conservation and sustainable use of marine biological diversity of areas beyond national jurisdiction, to human resources development for Member States, particularly developing Member States, in the field of ocean affairs and the law of the sea and related disciplines, as well as the fostering of global interlinkages and continuing capacity development through the alumni programme;",
    "54": "Encourages competent international organizations, the United Nations Development Programme and international financial institutions and funds to consider expanding their programmes within their respective fields of competence for assistance to developing countries and to coordinate their efforts, and recognizes the funding available from the Global Environment Facility, as well as other funds allocated for projects relating to oceans; III Meeting of States Parties",
    "55": "Notes with satisfaction that the twenty-ninth Meeting of States Parties to the Convention commemorated the twenty-fifth anniversary of the entry into force of the Convention, and welcomes the report of that Meeting;5",
    "56": "Requests the Secretary-General to convene the thirtieth Meeting of States Parties to the Convention from 15 to 19 June 2020, with full conference services, including documentation, as required; IV Peaceful settlement of disputes",
    "57": "Notes with satisfaction the continued and significant contribution of the Tribunal to the settlement of disputes by peaceful means in accordance with Part XV of the Convention, and underlines the important role and authority of the Tribunal concerning the interpretation or application of the Convention and the Part XI Agreement;",
    "58": "Pays tribute to the important and long-standing role of the International Court of Justice with regard to the peaceful settlement of disputes concerning the law of the sea;",
    "59": "Notes that States parties to an international agreement relating to the purposes of the Convention may submit to, inter alia, the Tribunal or the International Court of Justice any dispute concerning the interpretation or application of that agreement submitted in accordance with that agreement, and also notes the possibility, provided for in the Statutes of the Tribunal and the Court, to submit disputes to a chamber;",
    "60": "Encourages States Parties to the Convention that have not yet done so to consider making a written declaration, choosing from the means set out in article 287 of the Convention for the settlement of disputes concerning the interpretation or application of the Convention and the Part XI Agreement, bearing in mind the comprehensive character of the dispute settlement mechanism provided for in Part XV of the Convention;",
    "61": "Recalls the successful completion of the first compulsory conciliation under annex V to the Convention, pursuant to section 3 of Part XV, which assisted the parties in reaching agreement on a treaty establishing their maritime boundaries, 34 and encourages States to consider all means to peacefully settle disputes in accordance with international law; V The Area",
    "62": "Notes with satisfaction that the Authority commemorated the twenty-fifth anniversary of the entry into force of the Convention and its establishment at a special commemorative session of the Assembly;",
    "63": "Reiterates the importance of the ongoing elaboration and standardization by the Authority, pursuant to article 145 of the Convention, of rules, regulations and procedures to ensure the effective protection of the marine environment, for, inter alia, the protection and conservation of the natural resources of the Area and for the prevention of damage to the flora and fauna of the marine environment from harmful effects that may arise from activities in the Area;",
    "64": "Notes that, as at 31 July 2019, the Authority had entered into 15-year contracts with 17 contractors for exploration for polymetallic nodules, 7 contractors for exploration for polymetallic sulphides and 5 contractors for exploration for cobalt- rich ferromanganese crusts, 35 and had approved the thirtieth plan of work, for exploration for polymetallic nodules, during the twenty-fifth session of the Authority;36",
    "65": "Welcomes the progress of the work of the Authority on draft regulations for exploitation of mineral resources in the Area, takes note of the invitation to submit additional written comments on the draft regulations, including specific drafting suggestions, and encourages the Authority to continue its work on the draft regulations as a matter of priority and to provide sufficient opportunities and time for substantive consideration and discussion of the draft regulations, and emphasizes the ongoing need for openness and transparency;",
    "66": "Recalls the relevance of the advisory opinion on the responsibilities and obligations of States sponsoring persons and entities with respect to activities in the Area, issued by the Seabed Disputes Chamber of the Tribunal on 1 February 2011;37",
    "67": "Takes note of the public consultations organized in 2018 by two sponsoring States with regard to the environmental impact assessments submitted to the Authority, ahead of technical tests to be held in 2019 in the respective contract areas of their sponsored contractors in the Clarion-Clipperton Zone;",
    "68": "Recognizes the importance of the responsibilities entrusted to the Authority by articles 143 and 145 of the Convention, which refer to marine scientific research and protection of the marine environment in the Area, respectively;",
    "69": "Welcomes the adoption by the Assembly, at the twenty-fifth session of the Authority, of the high-level action plan and performance indicators developed for each priority against each of the strategic directions in the strategic plan of the Authority for the period 2019\u20132023, which provides a uniform basis for the strengthening of existing working practices of the Authority; 38",
    "70": "Also welcomes the public launch of the Authority database (DeepData), which aims to serve as the principal repository of all data and information relating to activities in the Area;",
    "71": "Notes the endorsement by the Assembly, at the twenty-fifth session of the Authority, of the memorandum of understanding between the Authority and the Ministry of Natural Resources of China on the establishment of a joint training and research centre, 39 which aims to promote and encourage the conduct of marine scientific research in the Area, as well as international cooperation for the development of technological knowledge and research, including by creating training and capacity-building opportunities, in particular for developing countries;40",
    "72": "Encourages the Authority to continue its work towards the standardization of marine bathymetric information collected in the Area, in cooperation with relevant international organizations, including the Intergovernmental Oceanographic Commission and the International Hydrographic Organization, particularly under the Seabed 2030 project;41",
    "73": "Welcomes the efforts of the Authority to make progress on the development of regional environmental management plans in other priority areas in the Area, in particular where there are currently exploration contracts;42 VI Effective functioning of the Authority and the Tribunal",
    "74": "Commends the progress in the work of the Authority;",
    "75": "Also commends the work of the Tribunal since its establishment;",
    "76": "Appeals to all States Parties to the Convention to pay their assessed contributions to the Tribunal in full and on time, and also appeals to States Parties in arrears with their contributions to fulfil their obligations without delay;",
    "77": "Expresses serious concern about the number of States Parties to the Convention in arrears with their assessed contributions to the Authority, appeals to all States Parties to the Convention to pay their assessed contributions to the Authority in full and on time, and urges them to fulfil their obligations without delay, in particular those States whose exercise of voting rights has been suspended by virtue of article 184 of the Convention, and invites the Secretary-General of the Authority to continue his efforts to recover arrears, including bilateral efforts;",
    "78": "Notes that there remains room for improvement in the level of attendance at the Assembly, and urges all members of the Authority to participate in the meetings of the Assembly;",
    "79": "Welcomes the adoption by the Assembly of the terms of reference for the voluntary trust fund for extrabudgetary support for the Authority and the adoption by the Assembly of the terms of reference for the voluntary trust fund for the purpose of providing the requisite funds related to the work of the Special Representative of the Secretary-General of the Authority for the Enterprise, expresses its appreciation to the donors that have made contributions to the voluntary trust funds, and encourages Member States, observers, contractors and other stakeholders to contribute financially to those and other voluntary trust funds maintained by the Authority;43",
    "80": "Notes with serious concern the negative balance of the voluntary trust fund established pursuant to the decision of the Authority at its eighth session 44 for the purpose of defraying the cost of participation of members of the Legal and Technical Commission from developing countries and members of the Finance Committee from developing countries in the meetings of the Commission and of the Committee, notes the appeals to members and other possible donors to make contributions to that fund, and to contractors to consider making a payment of 6,000 United States dollars on a voluntary basis, and expresses its appreciation to those that have made contributions to the voluntary trust fund;",
    "81": "Expresses its appreciation to States that have made contributions to the endowment fund for marine scientific research in the Area established by the Authority at its twelfth session,45 for the purpose of promoting and encouraging the conduct of collaborative marine scientific research in the Area, and encourages States, observers, contractors and other stakeholders to make additional contributions to this fund;",
    "82": "Calls upon States that have not done so to consider ratifying or acceding to the Agreement on the Privileges and Immunities of the Tribunal 46 and to the Protocol on the Privileges and Immunities of the Authority; 47",
    "83": "Emphasizes the importance of the rules and staff regulations of the Tribunal in promoting the recruitment of a geographically representative staff in the Professional and higher categories, and welcomes the actions taken by the Tribunal in observance of those rules and regulations;",
    "84": "Calls upon coastal States that have not yet done so to deposit a copy of charts or lists of geographical coordinates showing the outer limit lines of the continental shelf with the Secretary-General of the Authority, as provided for in article 84, paragraph 2, of the Convention; VII The continental shelf and the work of the Commission",
    "85": "Recalls that, in accordance with article 76, paragraph 8, of the Convention, information on the limits of the continental shelf beyond 200 nautical miles from the baselines from which the breadth of the territorial sea is measured shall be submitted by the coastal State to the Commission set up under annex II to the Convention on the basis of equitable geographical representation, that the Commission shall make recommendations to coastal States on matters related to the establishment of the outer limits of their continental shelf, and that the limits of the shelf established by a coastal State on the basis of these recommendations shall be final and binding;",
    "86": "Also recalls that, in accordance with article 77, paragraph 3, of the Convention, the rights of the coastal State over the continental shelf do not depend on occupation, effective or notional, or on any express proclamation;",
    "87": "Notes with satisfaction that a considerable number of States Parties to the Convention have submitted information to the Commission regarding the establishment of the outer limits of the continental shelf beyond 200 nautical miles, in conformity with article 76 of the Convention and article 4 of annex II to the Convention, taking into account the decision of the eleventh Meeting of States Parties to the Convention contained in SPLOS/72, paragraph (a);",
    "88": "Also notes with satisfaction that a considerable number of States Parties to the Convention have submitted to the Secretary-General, pursuant to the decision of the eighteenth Meeting of States Parties to the Convention, 48 preliminary information indicative of the outer limits of the continental shelf beyond 200 nautical miles and a description of the status of preparation and intended date of submission in accordance with the requirements of article 76 of the Convention and with the Rules of Procedure and the Scientific and Technical Guidelines of the Commission, and notes with satisfaction that additional submissions referred to in preliminary information have been filed with the Commission;",
    "89": "Further notes with satisfaction the progress in the work of the Commission49 and that it is giving current consideration to a number of submissions that have been made regarding the establishment of the outer limits of the continental shelf beyond 200 nautical miles;",
    "90": "Takes note of the 33 recommendations made by the Commission on the submissions of a number of coastal States, and welcomes the fact that summaries of recommendations are being made publicly available in accordance with paragraph 11.3 of annex III to the Rules of Procedure of the Commission;",
    "91": "Notes that the consideration by the Commission of submissions by coastal States in accordance with article 76 of and annex II to the Convention is without prejudice to the application of other parts of the Convention by States Parties;",
    "92": "Also notes the considerable number of submissions yet to be considered by the Commission and the demands that this places on its members and the secretariat as provided by the Division, and emphasizes the need to ensure that the Commission can perform its functions expeditiously, efficiently and effectively and maintain its high level of quality and expertise;",
    "93": "Takes note with appreciation of the decision of the Commission at its forty-fourth session to continue, during its five-year term of office, to meet for a total of 21 weeks per year by holding three sessions of seven weeks each, and that no two sessions would be sequential,50 and further notes that more than nine subcommissions are actively considering submissions;",
    "94": "Requests the Secretary-General to continue to take appropriate measures, within overall existing resource levels, to further strengthen the capacity of the Division, serving as the secretariat of the Commission, in order to ensure enhanced support and assistance to the Commission and its subcommissions in their consideration of submissions, as required by paragraph 9 of annex III to the Rules of Procedure of the Commission, in particular its human resources, taking into account the need for simultaneous work on several submissions;",
    "95": "Urges the Secretary-General to continue to provide all necessary secretariat services to the Commission in accordance with article 2, paragraph 5, of annex II to the Convention;",
    "96": "Requests the Secretary-General to take appropriate and timely measures to ensure secretariat services for the Commission and its subcommissions for the extended duration of time requested in the decisions of the twenty-first and twenty- sixth Meetings of States Parties to the Convention;20",
    "97": "Also requests the Secretary-General, consequently, to continue to allocate appropriate and sufficient resources to the Division to provide adequate services and assistance to the Commission in view of the number of its working weeks;",
    "98": "Expresses its appreciation to States that have made contributions to the voluntary trust fund established pursuant to resolution 55/7 for the purpose of facilitating the preparation of submissions to the Commission, and encourages States, international financial institutions, donor agencies, intergovernmental organizations, non-governmental organizations and natural and juridical persons to make additional contributions to this fund;",
    "99": "Notes that the Meeting of States Parties to the Convention, in its decisions regarding the conditions of service of the members of the Commission, 51 reaffirmed the obligation of States under the Convention whose experts were serving on the Commission to defray the expenses of the experts they had nominated while the experts are in performance of Commission duties, including the provision of medical coverage, and urged those States to do their utmost to ensure the full participation of those experts in the work of the Commission, including the meetings of subcommissions, in accordance with the Convention;",
    "100": "Also notes the decision of the twenty-ninth Meeting of States Parties to the Convention to continue the consideration of the conditions of service of the members of the Commission within the open-ended working group established by the twenty- third Meeting of States Parties to the Convention, as well as the request of the twenty- ninth Meeting that the Secretariat prepare a comprehensive study that sets out possible options to address the working conditions of the Commission, including its funding, to be discussed by the thirtieth Meeting of States Parties, in 2020;5",
    "101": "Emphasizes the importance of the voluntary trust fund established pursuant to resolution 55/7 in facilitating the participation of members of the Commission from developing States in the meetings of the Commission, and expresses its appreciation to States that have made contributions to this trust fund;",
    "102": "Reiterates its serious concern that the chronic underfunding of the trust fund referred to in paragraph 101 above may preclude the Commission from advancing its work as a result of the potential lack of a quorum at future sessions, and may prevent it from further implementing the decision of the twenty-sixth Meeting of States Parties that requested the Commission to meet for up to 26 weeks, and urges States, international financial institutions, donor agencies, intergovernmental organizations, non-governmental organizations and natural and juridical persons to make additional contributions to this fund;",
    "103": "Authorizes the use, as appropriate, of the trust fund referred to in paragraph 101 above, and in accordance with the purpose of its terms of reference, to defray the cost of the participation of the Chair of the Commission, when nominated by a developing country, in the Meetings of States Parties to the Convention;",
    "104": "Takes note of the written information, provided by the Secretary-General in response to the request in paragraph 81 of resolution 69/245, on options for mechanisms to provide medical insurance coverage to members of the Commission, including costs, and the information provided by the Secretariat during the twenty- seventh, twenty-eighth and twenty-ninth Meetings of States Parties to the Convention;",
    "105": "Recalls its decision that, on an exceptional basis and without setting a precedent for other agenda items, the members of the Commission have the option to join the Headquarters medical insurance scheme upon payment of the full cost of the premium, and hereby authorizes the use of the trust fund referred to in paragraph 101 above by the Secretary-General to reimburse the full costs of the premium paid by the members of the Commission from developing States, subject to the availability of funds following the allocation of the required funds to cover the costs of travel and daily subsistence allowance of the members of the Commission from developing States for the sessions of the Commission during the annual insurance coverage period (1 July\u201330 June);",
    "106": "",
    "107": "Expresses its intention to continue to consider options for mechanisms to provide medical insurance coverage to members of the Commission and, if necessary, to further review the terms of reference for the trust fund referred to in paragraph 101 above;",
    "108": "Emphasizes the continued need for members of the Commission to have suitable working space for their work at the sessions of the Commission and its subcommissions, recognizes, with regard to the long-term accommodation discussions, that, owing to its exceptional character, the Commission has special requirements for its working space, including the need for fit-for-purpose working space, adequate technical equipment and climate control, and needs to remain located within the same premises as the Division, and emphasizes that, in the context of any relocation of the Division or any change in its working space, full regard will be paid to these special requirements of the Commission;",
    "109": "Approves the convening by the Secretary-General of the fifty-second, fifty-third and fifty-fourth sessions of the Commission, in New York, from 27 January to 13 March 2020, from 6 July to 21 August 2020 and from 7 October to 24 November 2020, respectively, with full conference services, including documentation, for the plenary parts of these sessions,52 as well as any resumed sessions as may be required by the Commission, and requests the Secretary-General to make every effort to meet these requirements within overall existing resources;",
    "110": "Expresses its firm conviction about the importance of the work of the Commission, carried out in accordance with the Convention as well as in accordance with its Rules of Procedure, including with respect to the participation of coastal States in relevant proceedings concerning their submissions, and recognizes the continued need for active interaction between coastal States and the Commission;",
    "111": "Expresses its appreciation to States that have exchanged views in order to increase understanding of issues, including expenditures involved, arising from the application of article 76 of the Convention, thus facilitating the preparation of submissions by States, in particular developing States, to the Commission, and encourages States to continue to exchange views;",
    "112": "Requests the Secretary-General, in cooperation with Member States, to continue to support workshops or symposiums on scientific and technical aspects of the establishment of the outer limits of the continental shelf beyond 200 nautical miles, taking into account the need to strengthen capacity-building for developing countries in preparing their submissions; VIII Maritime safety and security and flag State implementation",
    "113": "Encourages States to ratify or accede to international agreements addressing the safety and security of navigation, as well as maritime labour, and to adopt the necessary measures consistent with the Convention and other relevant international instruments aimed at implementing and enforcing the rules contained in those agreements, and emphasizes the need for capacity-building for and assistance to developing States;",
    "114": "Recognizes that the legal regimes governing maritime safety and maritime security may have common and mutually reinforcing objectives that may be interrelated and could benefit from synergies, and encourages States to take this into account in their implementation;",
    "115": "Emphasizes the need for further efforts to promote a culture of safety and security in the shipping industry and to address the shortage of adequately trained personnel, and urges the development and strengthening of capacity-building activities and the provision of knowledge and skills through the required education and training, promoted in particular by the International Maritime Organization in collaboration with other relevant international organizations and agencies, as appropriate;",
    "116": "Also emphasizes that safety and security measures should be implemented in support of and with minimal negative effects on seafarers and fishers, especially in relation to their working conditions, and welcomes the ongoing cooperation between the Food and Agriculture Organization of the United Nations and the International Labour Organization in relation to decent work and employment in fisheries and aquaculture and on child labour in fisheries and aquaculture, as well as the work that has been conducted by the United Nations Office on Drugs and Crime and the International Labour Organization on the issue of trafficking in persons and forced labour on fishing vessels;",
    "117": "Welcomes the consideration by the International Maritime Organization of the fair treatment of seafarers, recalls the adoption by the Organization on 4 December 2013 of resolution A.1090(28) on the fair treatment of crew members in respect of shore leave and access to shore-side facilities, and welcomes the provision on shore leave, which entered into force on 1 January 2018, in the Convention on Facilitation of International Maritime Traffic;53",
    "118": "Notes the themes for the 2019 and 2020 World Maritime Day, \u201cEmpowering women in the maritime community\u201d and \u201cSustainable shipping for a sustainable planet\u201d, respectively;",
    "119": "Invites States that have not yet done so to become parties to the International Convention on Standards of Training, Certification and Watchkeeping for Seafarers, 1978,54 as amended, and the International Convention on Standards of Training, Certification and Watchkeeping for Fishing Vessel Personnel, 1995;",
    "120": "Encourages States that have not yet done so to consider becoming parties to the Work in Fishing Convention, 2007 (No. 188), the Seafarers\u2019 Identity Documents Convention (Revised), 2003 (No. 185) 55 and the Protocol to the Forced Labour Convention, 1930 (No. 29) of the International Labour Organization, as well as to the Maritime Labour Convention, 2006,56 as amended, calls upon States to effectively implement their obligations under those instruments, and emphasizes the need to provide to States, at their request, technical cooperation and assistance in this regard;",
    "121": "Invites States to ratify or accede to the Cape Town Agreement of 2012 on the Implementation of the Provisions of the Torremolinos Protocol of 1993 relating to the Torremolinos International Convention for the Safety of Fishing Vessels, 1977;",
    "122": "Welcomes in this regard the holding of a Ministerial Conference on Fishing Vessel Safety and Illegal, Unreported and Unregulated Fishing, organized by the International Maritime Organization and the Government of Spain in Torremolinos, Spain, from 21 to 23 October 2019, to promote the ratification of the Cape Town Agreement, whose entry into force would create a more robust International Maritime Organization regulatory framework for the safety of fishing vessels and fishing vessel personnel;",
    "123": "Welcomes ongoing cooperation between the Food and Agriculture Organization of the United Nations, the International Maritime Organization and the International Labour Organization relating to the safety of fishers and fishing vessels, and underlines the urgent need for continued work in that area;",
    "124": "Notes that, in its resolution A.1117(30) of 6 December 2017, the Assembly of the International Maritime Organization revised the International Maritime Organization ship identification number scheme to expand its voluntary application to a wider scope of vessels with a view to enhancing maritime safety and pollution prevention and to facilitate the prevention of maritime fraud;",
    "125": "Recalls that all actions taken to combat threats to maritime security must be in accordance with international law, including the principles embodied in the Charter of the United Nations and the Convention;",
    "126": "Recognizes the crucial role of international cooperation at the global, regional, subregional and bilateral levels in combating, in accordance with international law, threats to maritime security, including piracy, armed robbery against ships at sea and terrorist acts against shipping, offshore installations and other maritime interests, through bilateral and multilateral instruments and mechanisms aimed at monitoring, preventing and responding to such threats, the enhanced sharing of information among States relevant to the detection, prevention and suppression of such threats, and the prosecution of offenders with due regard to national legislation, and the need for sustained capacity-building to support such objectives, and in this regard welcomes initiatives under the twenty-sixth Association of Southeast Asian Nations Regional Forum, held in Bangkok on 2 August 2019, and the Work Plan for Maritime Security 2018\u20132020;",
    "127": "Welcomes the adoption, in Lom\u00e9 on 15 October 2016, by the African Union Extraordinary Summit of Heads of State and Government on Maritime Security and Safety and Development in Africa of the Charter on Maritime Security and Safety and Development in Africa (Lom\u00e9 Charter), and encourages African Member States of the United Nations that have not yet done so to consider ratifying this Charter to facilitate its entry into force;",
    "128": "Notes with satisfaction the organization in Mauritius in June 2019 of the second Ministerial Conference on Maritime Security in the Western Indian Ocean;",
    "129": "Acknowledges the work of the Commission on Crime Prevention and Criminal Justice in promoting international cooperation and strengthening capacity to combat the problem of transnational organized crime committed at sea;",
    "130": "Notes with concern that piracy and armed robbery at sea affect a wide range of vessels engaged in maritime activities, and expresses grave concern at the threats posed by piracy and armed robbery at sea to the safety and welfare of seafarers and other persons;",
    "131": " Fusion Centre, based in Madagascar, and the Regional Maritime Centre for Operational Coordination in Seychelles;",
    "132": "Urges all States, in cooperation with the International Maritime Organization, to actively combat piracy and armed robbery at sea by adopting measures, including those relating to assistance with capacity-building through training of seafarers, port staff and enforcement personnel in the prevention, reporting and investigation of incidents, by bringing the alleged perpetrators to justice, in accordance with international law, and by adopting national legislation, as well as by providing enforcement vessels and equipment and guarding against fraudulent ship registration;",
    "133": "Encourages States to ensure effective implementation of international law applicable to combating piracy, as reflected in the Convention, calls upon States to take appropriate steps under their national law to facilitate, in accordance with international law, the apprehension and prosecution of those who are alleged to have committed acts of piracy, including the financing or facilitation of such acts, also taking into account other relevant instruments that are consistent with the Convention, and encourages States to cooperate, as appropriate, with a view to developing their national legislation in this regard;",
    "134": "Invites all States, the International Maritime Organization, the International Labour Organization and other relevant international organizations and agencies to adopt or recommend, as appropriate, measures to protect the interest and welfare of seafarers, fishers and passengers who are victims of pirates, after their release from captivity, including their post-incident care and reintegration into society;",
    "135": "Notes the compilation of national legislation on piracy on the website of the Division, and encourages the United Nations Office on Drugs and Crime and the Division to continue to cooperate with the International Maritime Organization with a view to assisting Member States, upon request, in developing their national laws on piracy;",
    "136": "Recognizes continued national, bilateral and trilateral initiatives, as well as regional cooperative mechanisms, in accordance with international law, to address piracy, including the financing or facilitation of acts of piracy, and armed robbery at sea, and calls upon States to give immediate attention to adopting, concluding and implementing cooperation agreements at the regional level on combating piracy and armed robbery against ships;",
    "137": "Expresses serious concern at the inhuman conditions hostages taken at sea face in captivity and also the adverse impact on their families, calls for the immediate release of all hostages taken at sea, and stresses the importance of cooperation among Member States on the issue of hostage-taking at sea;",
    "138": "Welcomes, in this regard, the ongoing work of the United Nations Office on Drugs and Crime Hostage Support Programme, funded by the Board of the trust fund to support initiatives of States countering piracy off the coast of Somalia, in securing the release of seafarers held hostage off the coast of Somalia;57",
    "139": "Also welcomes the recent achievements against piracy and armed robbery at sea off the coast of Somalia resulting from efforts at the global and regional levels, which have resulted in a steady decline in pirate attacks as well as hijackings since 2011, in that regard continues to be gravely concerned by the ongoing threat that piracy and armed robbery at sea continue to pose in the region off the coast of Somalia, notes the adoption by the Security Council of resolution 2500 (2019) of 4 December 2019, as well as the statements by the President of the Council of 25 August 201058 and of 19 November 2012,59 also notes that the authorization in resolution 2500 (2019) and relevant resolutions apply only with respect to the situation in Somalia and shall not affect the rights, obligations or responsibilities of Member States under international law, including any rights or obligations under the Convention, with respect to any other situation, and underscores, in particular, that they shall not be considered as establishing customary international law;",
    "140": "Notes the continued efforts within the Contact Group on Piracy off the Coast of Somalia following the adoption of Security Council resolution 1851 (2008) of 16 December 2008, including at its twenty-second plenary session, chaired by Mauritius in Balaclava, Mauritius, in June 2019, and commends the contributions of all States in the efforts to fight piracy off the coast of Somalia;",
    "141": "Recognizes the primary responsibility of the Federal Government of Somalia in combating piracy and armed robbery at sea off the coast of Somalia, acknowledges the importance of a comprehensive and sustainable settlement of the situation in Somalia, and emphasizes the need to address the underlying causes of piracy and to assist Somalia and States in the region, at their request, in strengthening institutional capacity to fight piracy and tackle its underlying causes, including the financing or facilitation of acts of piracy, and armed robbery against ships off the coast of Somalia and to bring to justice those involved in such acts;",
    "142": "Notes the International Maritime Organization guidelines to assist in the investigation of the crimes of piracy and armed robbery against ships, revised interim guidance to shipowners, ship operators and shipmasters on the use of privately contracted armed security personnel on board ships in the high-risk area, revised interim recommendations for flag States regarding the use of privately contracted armed security personnel on board ships in the high-risk area, revised interim recommendations for port and coastal States regarding the use of privately contracted armed security personnel on board ships in the high-risk area, interim guidance to private maritime security companies providing privately contracted armed security personnel on board ships in the high-risk area, and interim guidance for flag States on measures to prevent and mitigate Somalia-based piracy;",
    "143": "Notes with concern that the continuing limited capacity and domestic legislation to facilitate the custody and prosecution of suspected pirates after their capture has hindered more robust international action against pirates off the coast of Somalia;",
    "144": "Encourages States to ensure that ships flying their flag apply ship security measures approved in accordance with national and international law;",
    "145": "Notes the efforts made by the shipping industry to cooperate with the efforts by States regarding piracy off the coast of Somalia, in particular in assisting ships that navigate in that area, and recalls the adoption on 30 November 2011 by the Assembly of the International Maritime Organization of resolution A.1044(27) on piracy and armed robbery against ships in waters off the coast of Somalia;",
    "146": "Also notes the continued implementation of the Code of Conduct concerning the Repression of Piracy and Armed Robbery against Ships in the Western Indian Ocean and the Gulf of Aden (Djibouti Code of Conduct), adopted on 29 January 2009 under the auspices of the International Maritime Organization, in the four thematic areas of information-sharing, training, national legislation and capacity- building, and notes the adoption in January 2017 of the Jeddah Amendment to the Djibouti Code of Conduct;",
    "147": "Expresses its deep concern at the continuing incidents of piracy and armed robbery at sea in the Gulf of Guinea, in particular violence against innocent crew members of vessels, notes the adoption by the Security Council of resolutions 2018 (2011) of 31 October 2011 and 2039 (2012) of 29 February 2012 and the statement by the President of the Council of 25 April 2016,60 supports the recent efforts to address this problem at the global and regional levels, recalls the primary role of States in the region to counter the threat and address the underlying causes of piracy and armed robbery at sea in the Gulf of Guinea, welcomes the adoption in Yaound\u00e9 on 25 June 2013 of the Code of Conduct concerning the Repression of Piracy, Armed Robbery against Ships, and Illegal Maritime Activity in West and Central Africa, and calls upon States in the region to implement the Code of Conduct as soon as possible and consistent with international law, in particular the Convention;",
    "148": "Urges States to ensure the full implementation of resolution A.1069(28) of 29 November 2013 of the Assembly of the International Maritime Organization on prevention and suppression of piracy, armed robbery against ships and illicit maritime activity in the Gulf of Guinea;",
    "149": "Calls upon States that have not yet done so to become parties to the Convention for the Suppression of Unlawful Acts against the Safety of Maritime Navigation61 and the Protocol for the Suppression of Unlawful Acts against the Safety of Fixed Platforms Located on the Continental Shelf, 61 invites States that have not yet done so to consider becoming parties to the 2005 Protocol to the Convention for the Suppression of Unlawful Acts against the Safety of Maritime Navigation 62 and the 2005 Protocol to the 1988 Protocol for the Suppression of Unlawful Acts against the Safety of Fixed Platforms Located on the Continental Shelf, 63 and urges States parties to take appropriate measures to ensure the effective implementation of those instruments through the adoption of legislation, where appropriate;",
    "150": "Calls upon States to effectively implement the International Ship and Port Facility Security Code and the amendments to the International Convention for the Safety of Life at Sea,64 and to work with the International Maritime Organization to promote safe and secure shipping while ensuring freedom of navigation;",
    "151": "Urges all States, in cooperation with the International Maritime Organization, to improve the protection of offshore installations by adopting measures related to the prevention, reporting and investigation of acts of violence against installations, in accordance with international law, and by implementing such measures through national legislation to ensure proper and adequate enforcement;",
    "152": "Emphasizes the progress in regional cooperation, including the efforts of littoral States, on the enhancement of safety, security and environmental protection in the Straits of Malacca and Singapore, and the effective functioning of the Cooperative Mechanism on Safety of Navigation and Environmental Protection in the Straits of Malacca and Singapore (the Cooperative Mechanism) to promote dialogue and facilitate close cooperation between the littoral States, user States, shipping industries and other stakeholders in line with article 43 of the Convention, notes with appreciation the convening of the twelfth Cooperation Forum, in Indonesia on 30 September and 1 October 2019, the twelfth Project Coordination Committee Meeting, in Indonesia on 4 October 2019, the forty-fourth Tripartite Technical Experts Group Meeting in Indonesia on 2 and 3 October 2019 and the twenty-second and twenty-third Aids to Navigation Fund Committee Meetings, in Malaysia on 25 and 26 April 2019 and on 26 and 27 September 2019, notes with appreciation the important role of the Information Sharing Centre of the Regional Cooperation Agreement on Combating Piracy and Armed Robbery against Ships in Asia, based in Singapore, and calls upon States to give immediate attention to adopting, concluding and implementing cooperation agreements at the regional level;",
    "153": "Recognizes that some transnational organized criminal activities threaten legitimate uses of the oceans and endanger the lives of people at sea, as well as the livelihoods and security of coastal communities;",
    "154": "Notes that transnational organized criminal activities are diverse and may be interrelated in some cases and that criminal organizations are adaptive and take advantage of the vulnerabilities of States, in particular coastal and small island developing States in transit areas, and calls upon States and relevant intergovernmental organizations to increase cooperation and coordination at all levels to detect and suppress the smuggling of migrants, trafficking in persons and illicit trafficking in firearms, in accordance with international law;",
    "155": "Recognizes the importance of enhancing international cooperation at all levels to fight transnational organized criminal activities, including illicit traffic in narcotic drugs and psychotropic substances, within the scope of the United Nations instruments against illicit drug trafficking, as well as the smuggling of migrants, trafficking in persons and illicit trafficking in firearms and criminal activities at sea falling within the scope of the United Nations Convention against Transnational Organized Crime and the Protocols thereto;",
    "156": "Encourages States to cooperate at the bilateral, regional and global levels to prevent, combat and eradicate illicit trafficking in protected species of wild fauna and flora where such trafficking occurs via maritime routes, through, inter alia, the use of applicable international legal instruments as appropriate, such as the United Nations Convention against Transnational Organized Crime, 65 the United Nations Convention against Corruption 66 and the Convention on International Trade in Endangered Species of Wild Fauna and Flora,67 and reiterates its call upon Member States expressed in its resolution 71/326 of 11 September 2017 to make illicit trafficking in protected species of wild fauna and flora a serious crime, in accordance with their national legislation and as defined in article 2 (b) and article 3, paragraph 1 (b), of the United Nations Convention against Transnational Organized Crime, in order to ensure that, where the offence is transnational in nature and involves an organized criminal group, effective international cooperation can be afforded under the United Nations Convention against Transnational Organized Crime to prevent and combat transnational organized crime;",
    "157": "Notes with grave concern the recent proliferation of, and endangerment of lives through, the smuggling of migrants by sea, underscores the necessity to address such situations in accordance with applicable international law, and encourages States, acting nationally or through relevant global or regional organizations, as appropriate, to provide technical assistance and capacity-building to flag, port and coastal States, upon request, to enhance their capabilities to prevent smuggling of migrants and human trafficking by sea;",
    "158": "Calls upon States, in that context, to take measures in accordance with relevant international obligations to prevent and combat all forms of trafficking in persons, to identify victims of human trafficking, including among migrant flows, and to provide trafficking victims with appropriate protection and assistance, according to their national law and policy;",
    "159": "Calls upon States that have not yet done so to consider becoming parties to the Protocol against the Smuggling of Migrants by Land, Sea and Air, supplementing the United Nations Convention against Transnational Organized Crime,68 the Protocol against the Illicit Manufacturing of and Trafficking in Firearms, Their Parts and Components and Ammunition, supplementing the United Nations Convention against Transnational Organized Crime, 69 and the Protocol to Prevent, Suppress and Punish Trafficking in Persons, Especially Women and Children, supplementing the United Nations Convention against Transnational Organized Crime,70 and to take appropriate measures to ensure their effective implementation;",
    "160": "Calls upon States to ensure freedom of navigation, the safety of navigation and the rights of transit passage, archipelagic sea lanes passage and innocent passage in accordance with international law, in particular the Convention;",
    "161": "Welcomes the work of the International Maritime Organization relating to the protection of shipping lanes of strategic importance and significance, and in particular in enhancing safety, security and environmental protection in straits used for international navigation, and calls upon that Organization, States bordering straits and user States to continue their cooperation to keep such straits safe, secure and environmentally protected and open to international navigation at all times, consistent with international law, in particular the Convention;",
    "162": "Calls upon user States and States bordering straits used for international navigation to continue to cooperate by agreement on matters relating to navigational safety, including safety aids for navigation, and the prevention, reduction and control of pollution from ships, and welcomes developments in this regard;",
    "163": "Calls upon States that have accepted the amendments to regulation XI-1/6 of the International Convention for the Safety of Life at Sea, 1974, 71 to implement the Code of International Standards and Recommended Practices for a Safety Investigation into a Marine Casualty or Marine Incident, 72 which took effect on 1 January 2010, and, in particular, to comply with the mandatory conduct of a marine safety investigation into very serious marine casualties and submission of a marine safety investigation report to the International Maritime Organization to identify trends and develop knowledge and risk-based recommendations;",
    "164": "Takes note of International Maritime Organization resolution A.1091(28) of 4 December 2013 on guidelines on the preservation and collection of evidence following an allegation of a serious crime having taken place on board a ship or following a report of a missing person from a ship, and pastoral and medical care of persons affected;",
    "165": "Recognizes the important work of the International Hydrographic Organization, calls upon States that have not yet done so to consider becoming members of that Organization, encourages all its members to actively consider, in accordance with applicable rules and procedures, applications of States that wish to become members of that Organization, and urges all States to work with that Organization to increase the coverage of hydrographic information on a global basis to enhance capacity-building and technical assistance and to promote safe navigation, particularly through the production and use of accurate electronic navigational charts, especially in areas used for international navigation, in ports and where there are vulnerable or protected marine areas;",
    "166": "Also recognizes the importance of navigational warning services based on marine meteorological data for the safety of ships and lives at sea and the optimization of navigation routes, and notes the collaboration between the World Meteorological Organization and the International Maritime Organization for the enhancement of these services and their extension to the Arctic region;",
    "167": "Encourages States to continue their efforts in the implementation of all areas of the Action Plan for the Safety of Transport of Radioactive Material, approved by the Board of Governors of the International Atomic Energy Agency in March 2004;",
    "168": "Also encourages States to ensure effective implementation of the International Maritime Dangerous Goods Code, the International Maritime Solid Bulk Cargoes Code, the International Code for the Construction and Equipment of Ships carrying Liquefied Gases in Bulk and the International Code for the Construction and Equipment of Ships carrying Dangerous Chemicals in Bulk;",
    "169": "Notes that cessation of the transport of radioactive materials through the regions of small island developing States is an ultimate desired goal of small island developing States and some other countries, and recognizes the right of freedom of navigation in accordance with international law; that States should maintain dialogue and consultation, in particular under the auspices of the International Atomic Energy Agency and the International Maritime Organization, with the aim of improved mutual understanding, confidence-building and enhanced communication in relation to the safe maritime transport of radioactive materials; that States involved in the transport of such materials are urged to continue to engage in dialogue with small island developing States and other States to address their concerns; and that these concerns include the further development and strengthening, within the appropriate forums, of international regulatory regimes to enhance safety, disclosure, liability, security and compensation in relation to such transport;",
    "170": "Acknowledges, in the context of paragraph 169 above, the potential environmental and economic impacts of maritime incidents and accidents on coastal States, in particular those related to the transport of radioactive materials, and emphasizes the importance of effective liability regimes in that regard;",
    "171": "Invites States that have not yet done so to consider becoming parties to the Nairobi International Convention on the Removal of Wrecks, 2007;73",
    "172": "Requests States to take appropriate measures with regard to ships flying their flag or of their registry to address hazards that may be caused by wrecks and drifting or sunken cargo to navigation or the marine environment;",
    "173": "Calls upon States to ensure that masters on ships flying their flag take the steps required by relevant instruments74 to provide assistance to persons in distress at sea, and urges States to cooperate and to take all measures necessary to ensure the effective implementation of the amendments to the International Convention on Maritime Search and Rescue75 and to the International Convention for the Safety of Life at Sea76 relating to the delivery of persons rescued at sea to a place of safety, as well as of the associated Guidelines on the Treatment of Persons Rescued at Sea;77",
    "174": "Recognizes that all States must fulfil their search and rescue responsibilities in accordance with international law, including the Convention, reaffirms the ongoing need for the International Maritime Organization and other relevant organizations to assist, in particular, developing States both to increase and improve their search and rescue capabilities, including, as appropriate, through the establishment of additional rescue coordination centres and regional sub-centres, and to take effective action to address, to the extent feasible, the issue of unseaworthy ships and small craft within their national jurisdiction, and emphasizes in this regard the importance of cooperation for these purposes, including within the framework of the International Convention on Maritime Search and Rescue, 1979; 78",
    "175": "Notes the ongoing work of the International Maritime Organization, the Office of the United Nations High Commissioner for Refugees and other relevant actors in relation to disembarkation of persons rescued at sea, underscores in this regard the need to implement all relevant and applicable international instruments and the importance of cooperation among States as provided for in those instruments, and emphasizes in particular the importance of full respect for the principle of non-refoulement in accordance with applicable international law;",
    "176": "Invites States to implement the Revised Guidelines on the Prevention of Access by Stowaways and the Allocation of Responsibilities to Seek the Successful Resolution of Stowaway Cases, adopted by the Maritime Safety Committee of the International Maritime Organization in its resolution MSC.448(99) of 24 May 2018 and by the Facilitation Committee of that Organization in its resolution FAL.13(42) of 8 June 2018;",
    "177": "Calls upon States to continue to cooperate in developing comprehensive approaches to international migration and development, including through dialogue on all their aspects;",
    "178": "Also calls upon States to take measures to protect fibre-optic submarine cables and to fully address issues relating to these cables, in accordance with international law, as reflected in the Convention;",
    "179": "Encourages greater dialogue and cooperation among States and the relevant regional and global organizations through workshops and seminars on the protection and maintenance of fibre-optic submarine cables to promote the security of such critical communications infrastructure;",
    "180": "Also encourages the adoption by States of laws and regulations addressing the breaking or injury of submarine cables or pipelines beneath the high seas done wilfully or through culpable negligence by a ship flying its flag or by a person subject to its jurisdiction, in accordance with international law, as reflected in the Convention;",
    "181": "Affirms the importance of maintenance, including the repair, of submarine cables, undertaken in conformity with international law, as reflected in the Convention;",
    "182": "Reaffirms that flag, port and coastal States all bear responsibility for ensuring the effective implementation and enforcement of international instruments relating to maritime security and safety, in accordance with international law, in particular the Convention, and that flag States have primary responsibility that requires further strengthening, including through increased transparency of ownership of vessels and the monitoring of organizations authorized to carry out surveys and issue certificates on their behalf, taking into account the Code for Recognized Organizations;79",
    "183": "Urges flag States without an effective maritime administration and appropriate legal frameworks to establish or enhance the necessary infrastructure, legislative and enforcement capabilities to ensure effective compliance with and implementation and enforcement of their responsibilities under international law, in particular the Convention, and, until such action is taken, to consider declining the granting of the right to fly their flag to new vessels, suspending their registry or not opening a registry, and calls upon flag and port States to take all measures consistent with international law necessary to prevent the operation of substandard vessels;",
    "184": "Notes the ongoing work of the International Maritime Organization on measures to prevent the fraudulent registration and fraudulent registries of ships;",
    "185": "Recognizes that international shipping rules and standards adopted by the International Maritime Organization in respect of maritime safety, efficiency of navigation and the prevention and control of marine pollution, complemented by best practices of the shipping industry, have led to a significant reduction in maritime accidents and pollution incidents;",
    "186": "Notes that audits of Member States under the International Maritime Organization Member State Audit Scheme became mandatory in January 2016 under nine mandatory International Maritime Organization instruments and are being carried out in accordance with the Framework and the Procedures for the International Maritime Organization Member State Audit Scheme and using the International Maritime Organization Instruments Implementation Code (III Code) as the audit standard;80",
    "187": "Encourages States and competent international organizations and bodies to support the effective implementation of the requirements of the International Code for Ships Operating in Polar Waters (Polar Code), adopted by the International Maritime Organization under the International Convention for the Safety of Life at Sea and the International Convention for the Prevention of Pollution from Ships, 1973, as modified by the Protocol of 1978 relating thereto, as amended, 81 including relevant requirements of the International Convention on Standards of Training, Certification and Watchkeeping for Seafarers, 1978, as amended; 82",
    "188": "Notes the ongoing work of the International Maritime Organization on matters related to passenger ship safety, and encourages States and competent international organizations and bodies to support continued efforts, including technical cooperation activities, to improve passenger ship safety;",
    "189": "Recognizes that maritime safety can also be improved through effective port State control, the strengthening of regional arrangements and increased coordination and cooperation among them and increased transparency and information-sharing, making ample use of information systems, such as the International Maritime Organization Global Integrated Shipping Information System,83 including among safety and security sectors;",
    "190": "Encourages flag States to take appropriate measures sufficient to achieve or maintain recognition by intergovernmental arrangements that recognize satisfactory flag State performance, including, as appropriate, satisfactory port State control examination results on a sustained basis, with a view to improving quality shipping and furthering flag State implementation of relevant instruments under the International Maritime Organization as well as relevant goals and objectives of the present resolution;",
    "191": "Notes with appreciation the important contribution of the International Association of Marine Aids to Navigation and Lighthouse Authorities to the improvement and harmonization of marine aids to navigation for the reduction of marine accidents, increased safety of life and property at sea and the protection of the marine environment, and in this regard notes with interest the convening of the International Association of Marine Aids to Navigation and Lighthouse Authorities diplomatic conference, to be held in Kuala Lumpur from 25 to 28 February 2020, to consider the adoption of a convention on the international organization for marine aids to navigation; IX Marine environment and marine resources",
    "192": "Emphasizes once again the importance of the implementation of Part XII of the Convention in order to protect and preserve the marine environment and its living marine resources against pollution and physical degradation, and calls upon all States to cooperate and take measures consistent with the Convention, directly or through competent international organizations, for the protection and preservation of the marine environment;",
    "193": "Calls upon States to implement the 2030 Agenda, including Goal 14 to conserve and sustainably use the oceans, seas and marine resources for sustainable development, and recalls that the Goals and targets are integrated and indivisible;",
    "194": "Reiterates, in this regard, the call made in the declaration entitled \u201cOur ocean, our future: call for action\u201d for action to be taken on an urgent basis to conserve and sustainably use the oceans, seas and marine resources for sustainable development;84",
    "195": "Recalls that, in \u201cThe future we want\u201d, States committed themselves to protect and restore the health, productivity and resilience of oceans and marine ecosystems, to maintain their biodiversity, enabling their conservation and sustainable use for present and future generations, and to effectively apply an ecosystem approach and the precautionary approach in the management, in accordance with international law, of activities having an impact on the marine environment, to deliver on all three dimensions of sustainable development;",
    "196": "Reaffirms paragraph 119 of resolution 61/222 of 20 December 2006 regarding ecosystem approaches and oceans, including the proposed elements of an ecosystem approach, means to achieve implementation of an ecosystem approach and requirements for improved application of an ecosystem approach, and in this regard: (a) Notes that continued environmental degradation in many parts of the world and increasing competing demands require an urgent response and the setting of priorities for management actions aimed at conserving ecosystem integrity; (b) Also notes that ecosystem approaches to ocean management should be focused on managing human activities in order to maintain and, where needed, restore ecosystem health to sustain goods and environmental services, provide social and economic benefits for food security, sustain livelihoods in support of international development goals, including those contained in the United Nations Millennium Declaration,85 and conserve marine biodiversity; (c) Recalls that States should be guided in the application of ecosystem approaches by a number of existing instruments, in particular the Convention, which sets out the legal framework for all activities in the oceans and seas, and its implementing Agreements, as well as other commitments, such as those contained in the Convention on Biological Diversity 86 and the World Summit on Sustainable Development call for the application of an ecosystem approach by 2010, 22 and in this context encourages States to enhance their efforts towards applying such an approach; (d) Encourages States to cooperate and coordinate their efforts and take, individually or jointly, as appropriate, all measures, in conformity with international law, including the Convention and other applicable instruments, to address impacts on marine ecosystems within and beyond areas of national jurisdiction, taking into account the integrity of the ecosystems concerned;",
    "197": "Encourages competent organizations and bodies that have not yet done so to incorporate an ecosystem approach into their mandates, as appropriate, in order to address impacts on marine ecosystems;",
    "198": "Acknowledges the request by the United Nations Environment Assembly at its second session, in paragraph 6 of its resolution 2/10 of 27 May 2016, to the United Nations Environment Programme to step up its work, including through its Regional Seas Programme, on assisting countries and regions in the application of the ecosystem approach to managing the marine and coastal environment, including through enabling intersectoral cooperation in integrated coastal zone management and marine spatial planning;87",
    "199": "Encourages States, directly or through competent international organizations, to consider the further development and application, as appropriate and consistent with international law, including the Convention, of environmental impact assessment processes covering planned activities under their jurisdiction or control that may cause substantial pollution of or significant and harmful changes to the marine environment, and also encourages the communication of the reports of the results of such assessments to the competent international organizations in accordance with the Convention;",
    "200": "Notes with concern the impacts of climate change on the oceans and the cryosphere, to which low-lying islands, in particular small island developing States, coasts and coastal communities are particularly exposed;",
    "201": "Also notes with concern the findings of the Intergovernmental Panel on Climate Change in its special report entitled The Ocean and Cryosphere in a Changing Climate, as well as the summary for policymakers, which was accepted by the Intergovernmental Panel at its fifty-first session on 23 September 2019;",
    "202": "Recognizes the importance of improving understanding of the impact of climate change on oceans and seas, and recalls that, in \u201cThe future we want\u201d, States noted that sea level rise and coastal erosion are serious threats for many coastal regions and islands, particularly in developing countries, and in this regard called upon the international community to enhance its efforts to address these challenges;",
    "203": "Takes note of the findings of reports of the Intergovernmental Panel on Climate Change, including its Special Report on Global Warming of 1.5\u00b0C, that increasing warming amplifies the exposure of small islands, low-lying coastal areas and deltas to the risks associated with sea level rise;",
    "204": "Also takes note of the decision by the International Law Commission at its seventy-first session to include the topic \u201cSea-level rise in relation to international law\u201d in its programme of work;88",
    "205": "Notes the eighteenth meeting of the Informal Consultative Process in 2017, which focused on the theme \u201cThe effects of climate change on oceans\u201d, during which delegations discussed, inter alia, the environmental, social and economic impacts on all States, in particular developing States, of the effects of climate change on the oceans, as well as the urgent need to address such effects and impacts, the need for international cooperation and coordination, including concerted and immediate action to combat the effects of climate change on the oceans, as well as the need for continued coordinated international focus in recognition that, owing to the interconnected nature of the oceans, ensuing impacts cannot be overcome by any single State and, in particular, in view of the grave implications for countries with low-lying coasts, some of whose very existence is under threat; 89",
    "206": "Welcomes the Paris Agreement 90 and its early entry into force on 4 November 2016, encourages all its parties to fully implement the Agreement and parties to the United Nations Framework Convention on Climate Change 91 that have not yet done so to deposit their instruments of ratification, acceptance, approval or accession, as appropriate, as soon as possible, and recognizes the importance of raising awareness of the adverse impact of climate change on the marine environment, marine biodiversity and sea level;",
    "207": "Also welcomes, in this regard, the convening of the twenty-fifth session of the Conference of the Parties to the United Nations Framework Convention on Climate Change, the fifteenth session of the Conference of the Parties serving as the Meeting of the Parties to the Kyoto Protocol and the second session of the Conference of the Parties serving as the Meeting of the Parties to the Paris Agreement in Madrid, from 2 to 13 December 2019;",
    "208": "Notes with concern the severe impacts on coastal communities of extreme weather events, such as tropical cyclones and associated storm surges, and encourages cooperative actions by relevant United Nations bodies and organizations, including the World Meteorological Organization and the Intergovernmental Oceanographic Commission with the advice of the Joint WMO-IOC Collaborative Board,92 to assist States in improving forecasting, including impact-based forecasting, of such events and its application in multi-hazard early warning systems and risk management under a more integrated approach to addressing the impacts of flooding types from multiple sources and severe weather;93",
    "209": "Also notes with concern the approximately 30 per cent increase in the acidity of ocean surface waters since the beginning of the industrial era 94 and the wide range of impacts associated with the continuing and alarming acidification of the world\u2019s oceans, and urges States to make significant efforts to tackle the causes of ocean acidification, recognizing countries\u2019 national circumstances and respective capabilities, and to further study and minimize its impacts, to enhance local, national, regional and global cooperation in this regard, including the sharing of relevant information and the development of worldwide capacity, including in developing countries, to measure ocean acidification, and to take steps to make marine ecosystems healthier and, as a result, more resilient, to the extent possible, to the impacts of ocean acidification;",
    "210": "Recalls that, in \u201cThe future we want\u201d, States called for support for initiatives that address ocean acidification and the impacts of climate change on marine and coastal ecosystems and resources and in this regard reiterated the need to work collectively to prevent further ocean acidification, as well as to enhance the resilience of marine ecosystems and of the communities whose livelihoods depend on them, and to support marine scientific research, monitoring and observation of ocean acidification and particularly vulnerable ecosystems, including through enhanced international cooperation in this regard;",
    "211": "Recognizes the attention paid to ocean acidification at the fourteenth, eighteenth and nineteenth meetings of the Informal Consultative Process, in 2013, 2017 and 2018, respectively, and commits itself to continue to pay attention to this important issue, including by taking into account the First Global Integrated Marine Assessment (the first World Ocean Assessment), the ongoing work of the Ocean Acidification International Coordination Centre of the International Atomic Energy Agency and the scientific cooperation fostered by the Global Ocean Acidification Observing Network;",
    "212": "Notes the work of the Intergovernmental Panel on Climate Change, notes with concern its findings on the acidification of the oceans and the substantial risks to marine ecosystems, especially polar ecosystems, coral reefs, plankton and other organisms which have a calcareous exoskeleton, or a shell, like crustaceans, and the potentially detrimental consequences for fisheries and livelihoods, as well as the findings of the World Meteorological Organization contained in its annual Greenhouse Gas Bulletin, and notes its decision to foster collaboration with organizations and institutions that address the carbon budget of the ocean, 95 and in this regard encourages States and competent international organizations and other relevant institutions, individually and in cooperation, to urgently pursue further research on ocean acidification, especially programmes of observation and measurement, noting in particular the continued work under the Convention on Biological Diversity, and to increase national, regional and global efforts to address levels of ocean acidity and the negative impact of such acidity on vulnerable marine ecosystems, particularly coral reefs;",
    "213": "Encourages States, individually or in collaboration with relevant international organizations and bodies, to enhance their scientific activity to better understand the effects of climate change on the marine environment and marine biodiversity, support continued coordination of scientific work to study and minimize the impacts of ocean acidification and develop ways and means of adaptation, taking into account, as appropriate, the precautionary approach and ecosystem approaches;",
    "214": "Notes the vital role that coastal blue carbon ecosystems, including mangroves, tidal marshes and seagrasses, play in climate adaptation and mitigation through carbon sequestration, and in increasing the resilience of coastal ecosystems to ocean acidification, and the range of other benefits that these ecosystems provide, including sustainable livelihoods, food security and biodiversity conservation, and coastal protection, and encourages States and relevant international institutions and organizations to work collaboratively to protect and restore coastal blue carbon ecosystems;",
    "215": "Recalls that, in \u201cThe future we want\u201d, States noted with concern that the health of oceans and marine biodiversity are negatively affected by marine pollution, including marine debris, especially plastic, persistent organic pollutants, heavy metals and nitrogen-based compounds, from a number of marine and land-based sources, including shipping and land run-off, and that States committed to take action to reduce the incidence and impacts of such pollution on marine ecosystems, including through the effective implementation of relevant conventions adopted in the framework of the International Maritime Organization, and the follow-up of relevant initiatives such as the Global Programme of Action for the Protection of the Marine Environment from Land-based Activities,96 as well as the adoption of coordinated strategies to this end, and that they further committed to take action, by 2025, based on collected scientific data, to achieve significant reductions in marine debris to prevent harm to the coastal and marine environment;",
    "216": "Encourages States, in accordance with the commitment expressed in \u201cThe future we want\u201d and based on collected scientific data, to take action by 2025 to achieve significant reductions in marine debris to prevent harm to the coastal and marine environment;",
    "217": "Notes the discussions at the seventeenth meeting of the Informal Consultative Process, in 2016, which focused on the theme \u201cMarine debris, plastics and microplastics\u201d and which, inter alia, highlighted that the size of the problem had increased exponentially since the topic of marine debris was addressed at the sixth meeting of the Informal Consultative Process, in 2005, noted that marine debris in general, and plastics in particular, were some of the greatest environmental concerns of our time, along with climate change, ocean acidification and loss of biodiversity, discussed prevention and emphasized the need to address the issue, both downstream, through improved mechanisms for waste management, disposal and recycling, and upstream, by addressing consumption and production patterns, including through awareness-raising campaigns;97",
    "218": "Recognizes the need for better understanding of the sources, amounts, pathways, distribution, trends, nature and impacts of marine debris, especially plastics and microplastics, and to examine possible measures and best available techniques and environmental practices to prevent its accumulation and minimize its levels in the marine environment, and welcomes in this regard the work conducted under the Joint Group of Experts on the Scientific Aspects of Marine Environmental Protection, led by the Intergovernmental Oceanographic Commission, and its report entitled Sources, Fate and Effects of Microplastics in the Marine Environment: A Global Assessment, its report entitled Guidelines for the Monitoring and Assessment of Plastic Litter in the Ocean, and the report of the Executive Director of the United Nations Environment Programme on marine plastic debris and microplastics, which reviews best-available knowledge and experiences in this regard and gives recommendations for further steps to reduce plastic litter and microplastic in the oceans;98",
    "219": "Notes that the UNEP Frontiers 2016 Report identifies microplastics as one of six key emerging environmental issues, further notes that the sixth Global Environment Outlook stresses, inter alia, the urgency of addressing ocean plastic pollution and the proven adverse impacts of microplastics to marine ecosystems, and calls upon States to implement resolution 4/6 on marine plastic litter and microplastics, adopted by the United Nations Environment Assembly of the United Nations Environment Programme at its fourth session, held in Nairobi from 11 to 15 March 2019;11",
    "220": "Welcomes the request by the United Nations Environment Assembly, in paragraph 2 of its resolution 4/6, to the Executive Director of the United Nations Environment Programme, subject to the availability of resources and benefiting from the work of existing mechanisms, to immediately strengthen scientific and technological knowledge with regard to marine litter, including marine plastic litter and microplastics;",
    "221": "Acknowledges the decision of the United Nations Environment Assembly, in paragraph 7 of its resolution 4/6, to extend the mandate of the ad hoc open-ended expert group on marine litter and microplastics, and its request to the Executive Director of the United Nations Environment Programme to report to the United Nations Environment Assembly at its fifth session on the progress achieved in the implementation of that resolution;",
    "222": "Welcomes the activities of relevant United Nations bodies and organizations, in particular the United Nations Environment Programme, the Food and Agriculture Organization of the United Nations and the International Maritime Organization and other intergovernmental organizations, to address the sources and impacts of marine debris, including through the Global Partnership on Marine Litter, as well as actions relating to marine debris taken under the Convention on Biological Diversity and the Convention on the Conservation of Migratory Species of Wild Animals, 99 in particular the adoption by the Conference of the Parties to that Convention at its twelfth meeting of resolution 12.20 on the management of marine debris, and notes the work of the International Whaling Commission on assessing the impacts of marine debris on cetaceans;",
    "223": "Encourages States to further develop partnerships with industry and civil society to raise awareness of the extent of the impact of marine debris on the biological diversity, health and productivity of the marine environment and consequent economic loss and to cooperate with other States, industry and civil society, as appropriate, on environmentally sound and cost-effective measures to prevent and reduce, as appropriate, marine debris and microplastics in the marine environment, including through strengthened cooperation under the Global Partnership on Marine Litter;",
    "224": "Urges States to integrate the issue of marine debris into national and, as appropriate, regional strategies dealing with waste management, especially in the coastal zone, ports and maritime industries, including recycling, reuse, reduction and disposal, to consider developing an integrated waste management infrastructure and to encourage the development of appropriate economic incentives with the aim of reducing marine debris to address this issue, including the development of cost- recovery systems that provide an incentive to use port reception facilities and discourage ships from discharging marine debris at sea, and support for measures to prevent, reduce and control pollution from any source, including land-based sources, such as community-based coastal and waterway clean-up and monitoring activities, and encourages States to cooperate regionally and subregionally to identify potential sources and coastal and oceanic locations where marine debris aggregates and to develop and implement joint prevention programmes for marine debris and to develop and implement environmentally sound options for recovery programmes, as well as to raise awareness of the issue of marine debris and the need to consider environmentally sound options for its removal;",
    "225": "Notes the activities carried out by organizations at the regional level to develop and implement regional action plans and other joint prevention and recovery programmes for marine debris, and further notes in this regard, the revised Regional Action Plan on Marine Litter adopted at the twenty-fourth Intergovernmental Meeting of the Coordinating Body on the Seas of East Asia, held in Bali, Indonesia, on 19 and 20 June 2019, which comprises actions to prevent and reduce marine litter from land-based sources as well as sea-based sources, monitoring and assessment of marine litter, and activities supporting implementation, the twenty-third Intergovernmental Meeting of the Northwest Pacific Action Plan, held in Moscow from 9 to 11 October 2018, and the Bangkok Declaration on Combating Marine Debris in the ASEAN Region, adopted at the thirty-fourth Summit of the Association of Southeast Asian Nations, held in Bangkok on 22 June 2019, to enhance efforts in addressing the issue of marine debris;",
    "226": "Also notes the work done under the Asia-Pacific Economic Cooperation framework to share best practices, enable innovative waste management financing and encourage public-private partnerships in order to prevent and reduce marine debris, including the outcomes of the 2018 workshop hosted by the Republic of Korea, which informed the APEC Road Map on Marine Debris endorsed in 2019 at the Senior Officials\u2019 Meeting in Chile;",
    "227": "Welcomes the ongoing work of the members of the Group of 20 on the \u201cOsaka Blue Ocean Vision\u201d, which aims to reduce additional pollution by marine plastic litter to zero by 2050, and calls upon other members of the international community to also share the vision;",
    "228": " as agreements that provide for preparedness for, response to and cooperation on pollution incidents and that include provisions on liability and compensation for damage resulting from marine pollution, and to adopt the necessary measures consistent with international law, including the Convention, aimed at implementing and enforcing the rules contained in those agreements;",
    "229": "Recalls that, in \u201cThe future we want\u201d, States noted the significant threat that alien invasive species pose to marine ecosystems and resources and committed to implement measures to prevent the introduction and manage the adverse environmental impacts of alien invasive species, including, as appropriate, those adopted in the framework of the International Maritime Organization;",
    "230": "Encourages States that have not yet done so to consider ratifying or acceding to the International Convention for the Control and Management of Ships\u2019 Ballast Water and Sediments, 2004, 100 and also encourages States to consider implementing the Guidelines for the control and management of ships\u2019 biofouling to minimize the transfer of invasive aquatic species, adopted by the International Maritime Organization in resolution MEPC.207(62) of 15 July 2011;",
    "231": "Notes the ongoing work of the International Maritime Organization to prevent pollution from ships, including through the designation of Special Areas under the International Convention for the Prevention of Pollution from Ships, 1973, as modified by the Protocol of 1978 relating thereto, as amended, 101 welcomes the adoption by the Marine Environment Protection Committee of an action plan to address marine plastic litter from ships,102 and encourages the International Maritime Organization to continue working on the prevention of pollution from ships;",
    "232": "Also notes that the global limit of 0.50 per cent on sulphur in fuel oil under annex VI to the International Convention for the Prevention of Pollution from Ships will enter into force on 1 January 2020, encourages States that have not yet done so to become parties to the Protocol of 1997 (annex VI \u2013 Regulations for the Prevention of Air Pollution from Ships) to the International Convention for the Prevention of Pollution from Ships, 1973, as modified by the Protocol of 1978 relating thereto, as amended, and encourages the effective implementation of that Protocol; 103",
    "233": "Further notes the ongoing work of the International Maritime Organization and the resolution on International Maritime Organization policies and practices related to the reduction of greenhouse gas emissions from ships, 104 and in this regard also notes its adoption of an initial strategy on the reduction of greenhouse gas emissions from ships;105",
    "234": "Urges States to cooperate in correcting the shortfall in port waste reception facilities in accordance with the action plan to address the inadequacy of port waste reception facilities developed by the International Maritime Organization;",
    "235": "Encourages States that have not yet done so to consider ratifying or acceding to the Hong Kong International Convention for the Safe and Environmentally Sound Recycling of Ships, 2009 106 to facilitate its entry into force;",
    "236": "Encourages continued cooperation between the parties to the Basel Convention on the Control of Transboundary Movements of Hazardous Wastes and Their Disposal107 and the International Maritime Organization on regulations on the prevention of pollution from ships;",
    "237": "Notes the role of the Basel Convention in ensuring that the management of hazardous wastes and other wastes, under the scope of that Convention, including their transboundary movement and disposal, is consistent with the protection of the marine environment, and in this regard also notes the recent amendments of annexes II, VIII and IX to the Basel Convention in relation to plastic waste, as well as decision BC-14/13 of the Conference of the Parties to the Basel Convention, which includes, in particular, the establishment of the Basel Convention Partnership on Plastic Waste;",
    "238": "Notes with concern the potential for serious environmental consequences resulting from oil spill incidents or pollution incidents involving hazardous or noxious substances, urges States, consistent with international law, to cooperate, directly or through competent international organizations, and share best practices, in the fields of protection of the marine environment, human health and safety, prevention, emergency response and mitigation, and in this regard encourages the undertaking of and collaboration on scientific research, including marine scientific research, to better understand the consequences of marine oil spills or marine spills involving hazardous or noxious substances;",
    "239": "Encourages States, in accordance with international law, including the Convention and other relevant instruments, either bilaterally or regionally, to jointly develop and promote contingency plans for responding to pollution incidents, as well as other incidents that are likely to have significant adverse effects on the marine environment and biodiversity;",
    "240": "Encourages States that have not yet done so to consider ratifying or acceding to the International Convention on Oil Pollution Preparedness, Response and Cooperation, 1990, 108 and the Protocol on Preparedness, Response and Cooperation to Pollution Incidents by Hazardous and Noxious Substances, 2000, of the International Maritime Organization, and in this regard to consider developing and joining regional arrangements to enhance international cooperation for combating major oil and hazardous substances pollution incidents;",
    "241": "Encourages States to consider becoming parties to the 2010 Protocol to the 1996 International Convention on Liability and Compensation for Damage in Connection with the Carriage of Hazardous and Noxious Substances by Sea; 109",
    "242": "Recognizes that most of the pollution load of the oceans emanates from land-based activities and affects the most productive areas of the marine environment, and calls upon States, as a matter of priority, to implement the Global Programme of Action for the Protection of the Marine Environment from Land-based Activities and to take all appropriate measures to fulfil the commitments of the international community embodied in the Bali Declaration on the Protection of the Marine Environment from Land-based Activities, adopted at the fourth Intergovernmental Review Meeting on the Implementation of the Global Programme of Action for the Protection of the Marine Environment from Land-based Activities, held in Bali, Indonesia, on 31 October and 1 November 2018;110",
    "243": "Welcomes the continued work of States, the United Nations Environment Programme and regional organizations in the implementation of the Global Programme of Action, and encourages increased emphasis on the link between fresh water, the coastal zone and marine resources in the implementation of the 2030 Agenda and its Sustainable Development Goals, as well as of the Addis Ababa Action Agenda of the Third International Conference on Financing for Development;10",
    "244": "Expresses its concern regarding the spreading of hypoxic dead zones and harmful algal blooms in oceans as a result of eutrophication fuelled by riverine run- off of fertilizers, sewage outfall and reactive nitrogen resulting from the burning of fossil fuels and resulting in serious consequences for ecosystem functioning, and calls upon States to enhance their efforts to reduce eutrophication, particularly by reducing total nutrient pollution from land-based sources and, to this effect, to continue to cooperate within the framework of relevant international organizations, in particular the Global Programme of Action and the Global Partnership on Nutrient Management and Global Wastewater Initiative, including through capacity-building initiatives and efforts to monitor, via the Global Ocean Observing System, stressors such as harmful algal blooms, areas of hypoxia, sargassum seaweed invasions and jellyfish blooms, to assess their possible linkage to eutrophication and their potential adverse impacts on the marine environment as well as on human health;",
    "245": "Encourages States that have not yet done so to take, as soon as possible, the domestic measures necessary to enable them to meet their obligations upon ratification and, thereafter, to ratify, accept, approve or accede to the Minamata Convention on Mercury;111",
    "246": "Calls upon all States to ensure that urban and coastal development projects and related land-reclamation activities are carried out in a responsible manner that protects the marine habitat and environment and mitigates the negative consequences of such activities;",
    "247": "Encourages States that have not yet done so to become parties to the 1996 Protocol to the Convention on the Prevention of Marine Pollution by Dumping of Wastes and Other Matter, 1972 (the London Protocol);",
    "248": "Recalls the resolution of the thirtieth Consultative Meeting of Contracting Parties to the Convention on the Prevention of Marine Pollution by Dumping of Wastes and Other Matter, 1972 (the London Convention) and the third Meeting of Contracting Parties to the London Protocol, held from 27 to 31 October 2008, on the regulation of ocean fertilization,112 in which the Contracting Parties agreed, inter alia, that the scope of the London Convention and Protocol includes ocean fertilization activities and that, given the present state of knowledge, ocean fertilization activities other than for legitimate scientific research should not be allowed, and that scientific research proposals should be assessed on a case-by-case basis using an assessment framework that was subsequently developed and adopted in 2010 by the Contracting Parties to the London Convention and Protocol, namely, the Assessment Framework for Scientific Research Involving Ocean Fertilization, 113 and also agreed that, to this end, such other activities should be considered as contrary to the aims of the London Convention and Protocol and should not currently qualify for any exemption from the definition of dumping in article III, paragraph 1 (b), of the London Convention and article 1, paragraph 4.2, of the London Protocol;113",
    "249": "Notes the continued work of the Contracting Parties to the London Convention and Protocol towards a global, transparent and effective control and regulatory mechanism for ocean fertilization activities and other activities that fall within the scope of the London Convention and Protocol and have the potential to cause harm to the marine environment, and notes the resolution adopted by the eighth Meeting of Contracting Parties to the London Protocol, held from 14 to 18 October 2013, on the amendment to the London Protocol to regulate the placement of matter for ocean fertilization and other marine geoengineering activities; 114",
    "250": "Recalls decision IX/16 C, adopted at the ninth meeting of the Conference of the Parties to the Convention on Biological Diversity, held in Bonn, Germany, from 19 to 30 May 2008,115 in which the Conference of the Parties, inter alia, bearing in mind the ongoing scientific and legal analysis occurring under the auspices of the London Convention and Protocol, requested parties and urged other Governments, in accordance with the precautionary approach, to ensure that ocean fertilization activities were not carried out until there was an adequate scientific basis on which to justify such activities, including an assessment of associated risks, and that a global, transparent and effective control and regulatory mechanism was in place for those activities, with the exception of small-scale scientific research studies within coastal waters, and stated that such studies should be authorized only if justified by the need to gather specific scientific data, should be subject to a thorough prior assessment of the potential impacts of the research studies on the marine environment, should be strictly controlled and should not be used for generating and selling carbon offsets or for any other commercial purposes, and takes note of decision X/29, adopted at the tenth meeting of the Conference of the Parties to the Convention on Biological Diversity, held in Nagoya, Japan, from 18 to 29 October 2010, 116 in which the Conference of the Parties requested parties to implement decision IX/16 C;",
    "251": "Also recalls that, in \u201cThe future we want\u201d, States stressed their concern about the potential environmental impacts of ocean fertilization, recalled in this regard the decisions related to ocean fertilization adopted by the relevant intergovernmental bodies, and resolved to continue addressing ocean fertilization with utmost caution, consistent with the precautionary approach;",
    "252": "Encourages States that have not done so to become parties to regional seas conventions and the protocols thereto addressing the protection and preservation of the marine environment, while noting the role of the United Nations Environment Programme Regional Seas Programme; X Marine biodiversity",
    "253": "Reaffirms its central role relating to the conservation and sustainable use of marine biological diversity of areas beyond national jurisdiction;",
    "254": "Notes the work and contributions of States and relevant intergovernmental organizations and bodies in the context of the Ad Hoc Open-ended Informal Working Group to study issues relating to the conservation and sustainable use of marine biological diversity beyond areas of national jurisdiction, and the extensive and complex discussions and exchange of views at the four sessions of the Preparatory Committee established by resolution 69/292: Development of an international legally binding instrument under the United Nations Convention on the Law of the Sea on the conservation and sustainable use of marine biological diversity of areas beyond national jurisdiction, which concluded on 21 July 2017, as well as the report of the Preparatory Committee and the recommendations contained therein;117",
    "255": "Welcomes the holding of the second and third sessions of the intergovernmental conference convened under resolution 72/249, from 25 March to 5 April 2019 and 19 to 30 August 2019, respectively, and takes note of the substantive discussions that addressed the topics identified in the package agreed in 2011, namely, the conservation and sustainable use of marine biological diversity of areas beyond national jurisdiction, in particular, together and as a whole, marine genetic resources, including questions on the sharing of benefits, measures such as area-based management tools, including marine protected areas, environmental impact assessments, and capacity-building and the transfer of marine technology, and further takes note that the President of the conference will prepare, as part of the preparation for the fourth session of the conference, a revised draft text of an agreement;",
    "256": "Requests the Secretary-General to convene the fourth session of the intergovernmental conference from 23 March to 3 April 2020;",
    "257": "Recognizes the abundance and diversity of marine genetic resources and their value in terms of the benefits, goods and services they can provide;",
    "258": "Also recognizes the importance of research on marine genetic resources for the purpose of enhancing the scientific understanding, potential use and application, and enhanced management of marine ecosystems;",
    "259": "Notes the work under the Jakarta Mandate on Marine and Coastal Biological Diversity 118 and the Convention on Biological Diversity elaborated programme of work on marine and coastal biological diversity, 119 and, while reiterating the central role of the General Assembly relating to the conservation and sustainable use of marine biological diversity of areas beyond national jurisdiction, notes with appreciation the complementary technical and scientific work done by the Conference of the Parties to the Convention on Biological Diversity;",
    "260": "Reaffirms the need for States, individually or through competent international organizations, to urgently consider ways to integrate and improve, based on the best available scientific information and the precautionary approach and in accordance with the Convention and related agreements and instruments, the management of risks to the marine biodiversity of seamounts, cold water corals, hydrothermal vents and certain other underwater features;",
    "261": "Invites parties to the Convention on Biological Diversity to implement the voluntary specific workplan on biodiversity in cold water areas within the jurisdictional scope of that Convention, adopted in 2016 by the thirteenth meeting of the Conference of the Parties to that Convention;120",
    "262": "Calls upon States and international organizations to urgently take further action to address, in accordance with international law, destructive practices that have adverse impacts on marine biodiversity and ecosystems, including seamounts, hydrothermal vents and cold water corals;",
    "263": "Calls upon States to strengthen, in a manner consistent with international law, in particular the Convention, the conservation and management of marine biodiversity and ecosystems, and national policies in relation to area-based management tools, including marine protected areas;",
    "264": "Recalls that, in \u201cThe future we want\u201d, States reaffirmed the importance of area-based conservation measures, including marine protected areas, consistent with international law and based on best available scientific information, as a tool for conservation of biological diversity and sustainable use of its components, and noted decision X/2 of the tenth meeting of the Conference of the Parties to the Convention on Biological Diversity, that by 2020, 10 per cent of coastal and marine areas, especially areas of particular importance for biodiversity and ecosystem services, are to be conserved through effectively and equitably managed, ecologically representative and well-connected systems of protected areas and other effective area- based conservation measures;116",
    "265": "Encourages States, in this regard, to further progress towards the establishment of marine protected areas, including representative networks, and calls upon States to further consider options to identify and protect ecologically or biologically significant areas, consistent with international law and on the basis of the best available scientific information;",
    "266": "Invites States to identify measures to achieve Aichi Biodiversity Target 11, enshrined in decision X/2 of the tenth meeting of the Conference of the Parties to the Convention on Biological Diversity, and takes note of the announcements made by some States in this regard;",
    "267": "Reaffirms the need for States to continue and intensify their efforts, directly and through competent international organizations, to develop and facilitate the use of diverse approaches and tools for conserving and managing vulnerable marine ecosystems, including the possible establishment of marine protected areas, consistent with international law, as reflected in the Convention, and based on the best scientific information available;",
    "268": "Notes the work of States, relevant intergovernmental organizations and bodies, including the Convention on Biological Diversity, in the assessment of scientific information on and compilation of ecological criteria for the identification of marine areas that may require protection, in the light of the objective of the World Summit on Sustainable Development to develop and facilitate the use of diverse approaches and tools, such as ecosystem approaches and the establishment of marine protected areas consistent with international law, as reflected in the Convention, and based on scientific information, including representative networks; 22",
    "269": "Recalls that the Conference of the Parties to the Convention on Biological Diversity, at its ninth meeting, adopted scientific criteria for identifying ecologically or biologically significant marine areas in need of protection in open-ocean waters and deep-sea habitats and scientific guidance for selecting areas to establish a representative network of marine protected areas, including in open-ocean waters and deep-sea habitats,121 and notes the ongoing work under the Convention on Biological Diversity on the application of the scientific criteria for ecologically or biologically significant marine areas through the organization of a series of regional workshops;",
    "270": "Also recalls that the Food and Agriculture Organization of the United Nations has developed guidance for the identification of vulnerable marine ecosystems through the International Guidelines for the Management of Deep-Sea Fisheries in the High Seas, and notes its ongoing work to support application of the Guidelines by States and to maintain a database of vulnerable marine ecosystems;",
    "271": "Notes with appreciation the work of the Sustainable Ocean Initiative under the Convention on Biological Diversity;",
    "272": "Notes the ongoing work of the International Maritime Organization to identify and designate as Particularly Sensitive Sea Areas marine areas which are recognized for their significance in terms of ecological, socioeconomic or scientific criteria and are vulnerable to damage by international shipping activities;122",
    "273": "Acknowledges the Micronesia Challenge, the Eastern Tropical Pacific Seascape project, the Caribbean Challenge and the Coral Triangle Initiative, which seek to create and link domestic marine protected areas to better facilitate ecosystem approaches, notes the Phoenix Islands Protected Area as a multinational partnership, and reaffirms the need for further international cooperation, coordination and collaboration in support of such initiatives;",
    "274": "Recalls that, in \u201cThe future we want\u201d, States recognized the significant economic, social and environmental contributions of coral reefs, in particular to islands and other coastal States, as well as the significant vulnerability of coral reefs and mangroves to impacts, including from climate change, ocean acidification, overfishing, destructive fishing practices and pollution, and supported international cooperation with a view to conserving coral reef and mangrove ecosystems and realizing their social, economic and environmental benefits, as well as facilitating technical collaboration and voluntary information-sharing;",
    "275": "Emphasizes the need to mainstream sustainable coral reef management and integrated watershed management into national development strategies, as well as into the activities of relevant United Nations agencies and programmes, international financial institutions and the donor community;",
    "276": "Reiterates its support for the International Coral Reef Initiative, notes that the thirty-fourth International Coral Reef Initiative General Meeting was held in Townsville, Australia, from 2 to 7 December 2019, and supports the elaborated programme of work of the Convention on Biological Diversity on marine and coastal biological diversity related to coral reefs under the Jakarta Mandate on Marine and Coastal Biological Diversity;",
    "277": "Encourages States and relevant international institutions to improve efforts to address coral bleaching by, inter alia, improving monitoring to predict and identify bleaching events, supporting and strengthening action taken during such events and improving strategies to manage reefs to support their natural resilience and enhance their ability to withstand other pressures, including ocean acidification, and in this regard also encourages States to implement the priority actions to achieve Aichi Biodiversity Target 10 for coral reefs and closely associated ecosystems, adopted by the twelfth meeting of the Conference of the Parties to the Convention on Biological Diversity;123",
    "278": "Encourages States to cooperate, directly or through competent international bodies, in exchanging information in the event of accidents involving vessels on coral reefs and in promoting the development of economic assessment techniques for both restoration and non-use values of coral reef systems;",
    "279": "Notes that ocean noise has potential significant adverse impacts on living marine resources, affirms the importance of sound scientific studies in addressing this matter, encourages further research, studies and consideration of the impacts of ocean noise on living marine resources, notes the work of States and competent international organizations in that regard, and requests the Division to continue to compile the peer- reviewed scientific studies it receives from Member States and intergovernmental organizations pursuant to paragraph 107 of resolution 61/222 and, as appropriate, to make them, or references and links to them, available on its website;",
    "280": "Also notes the discussions at the nineteenth meeting of the Informal Consultative Process, in 2018, on the theme of anthropogenic underwater noise, during which delegations, inter alia, expressed concern over the potential social, economic and environmental impacts of anthropogenic underwater noise due to the growth of ocean-related human activities, which has resulted in increased sound in many parts of the ocean, as well as the potential impacts of anthropogenic underwater noise on different marine species and, in view of the continuing gaps in knowledge and lack of data, stressed the urgent need for further research and international cooperation to assess and address the potential effects of anthropogenic underwater noise in all ocean areas;124",
    "281": "Calls upon States to consider appropriate cost-effective measures and approaches to assess and address the potential socioeconomic and environmental impacts of anthropogenic underwater noise, taking into account the precautionary approach and ecosystem approaches and the best available scientific information, as appropriate;",
    "282": "Notes the approval by the International Maritime Organization of Guidelines for the Reduction of Underwater Noise from Commercial Shipping to Address Adverse Impacts on Marine Life, and invites the International Maritime Organization to promote and encourage their implementation for existing ships and new vessels, when appropriate, including by promoting measures that may reduce cavitation, 125 and encourages States to continue their work at the International Maritime Organization to enhance understanding of the extent to which improved ship technology, including efficient propeller design, could lead to reduced introduction of underwater noise in the oceans;",
    "283": "Also notes the convening of the Quieting Ships to Protect the Marine Environment: Policy Workshop, in Vancouver, Canada, on 4 and 5 November 2019;",
    "284": "Encourages further research into, and testing of, technologies to reduce the impact of underwater noise on marine life; XI Marine science",
    "285": "Calls upon States, individually or in collaboration with each other or with competent international organizations and bodies, to continue to strive to improve understanding and knowledge of the oceans and the deep sea, including, in particular, the extent and vulnerability of deep sea biodiversity and ecosystems, by increasing their marine scientific research activities in accordance with the Convention;",
    "286": "Encourages, in that regard, relevant international organizations and other donors to consider supporting the Endowment Fund of the Authority in order to promote the conduct of collaborative marine scientific research in the international seabed area by supporting the participation of qualified scientists and technical personnel from developing countries in relevant programmes, initiatives and activities;",
    "287": "Notes with concern that human-related threats, such as marine debris, ship strikes, underwater noise, persistent contaminants, coastal development activities, oil spills and discarded fishing gear, together may severely impact marine life, including its higher trophic levels, and calls upon States and competent international organizations to cooperate and coordinate their research efforts in this regard so as to reduce these impacts and preserve the integrity of the whole marine ecosystem, while fully respecting the mandates of relevant international organizations;",
    "288": "Invites all relevant organizations, funds, programmes and bodies within the United Nations system, in consultation with interested States, to coordinate relevant activities with regional and national marine scientific and technological centres in small island developing States, as appropriate, to ensure the more effective achievement of their objectives in accordance with relevant United Nations small island developing States development programmes and strategies;",
    "289": "Welcomes the resolution adopted by the Assembly of the Intergovernmental Oceanographic Commission at its twenty-eighth session, held in Paris from 18 to 25 June 2015, regarding the adoption of the Second International Indian Ocean Expedition as an important catalyst project linking Indian Ocean processes to the global ocean and atmosphere, officially launched in Goa, India, on 4 December 2015 for an initial period of five years, invites States to participate in this initiative, and notes that two nodes of the Second International Indian Ocean Expedition Joint Project Office have been established to coordinate operations of the expedition in Perth, Australia, and Hyderabad, India;",
    "290": "Notes with appreciation the work of the Intergovernmental Oceanographic Commission, with the advice of the Advisory Body of Experts on the Law of the Sea, on the development of procedures for the implementation of Parts XIII and XIV of the Convention;",
    "291": "Notes that the depth of a significant percentage of the world\u2019s oceans, seas and waterways has yet to be measured directly and that bathymetric knowledge underpins the safe, sustainable and cost-effective execution of almost every human activity in, on or under the sea;",
    "292": "Welcomes the work of the General Bathymetric Chart of the Oceans project under the International Hydrographic Organization and the Intergovernmental Oceanographic Commission and, in particular, the outcome of the Forum for Future Ocean Floor Mapping, held in June 2016 in Monaco, and the subsequent development by the Guiding Committee of the Seabed 2030 project for improving bathymetry globally;",
    "293": "Encourages Member States to consider contributing to mechanisms that encourage the widest possible availability of all bathymetric data, so as to support the sustainable development, management and governance of the marine environment;",
    "294": "Notes with appreciation the contribution to marine biodiversity research of the Ocean Biogeographic Information System, a free and open-access data holding and sharing facility, hosted by the Intergovernmental Oceanographic Commission;",
    "295": "Welcomes the increasing attention being focused on oceans as a potential source of renewable energy, and notes in this regard the summary of discussions of the Informal Consultative Process at its thirteenth meeting, in 2012;126",
    "296": "Stresses the importance of increasing the scientific understanding of the oceans-atmosphere interface, including through participation in ocean observing programmes and geographic information systems, such as the Global Ocean Observing System, sponsored by the Intergovernmental Oceanographic Commission, the United Nations Environment Programme, the World Meteorological Organization and the International Science Council, particularly considering their role in monitoring and forecasting climate change and variability, in supporting Earth system prediction127 and in the establishment and operation of tsunami warning systems;",
    "297": "Welcomes the progress made by the Intergovernmental Oceanographic Commission and Member States towards the establishment and operation of regional and national tsunami warning and mitigation systems, also welcomes the continued collaboration of the United Nations and other intergovernmental organizations in this effort, further welcomes the development and recent dissemination of the new Enhanced Tsunami Products for the Pacific Tsunami Warning and Mitigation System and the development of Enhanced Tsunami Products for the Tsunami and Other Coastal Hazards Warning System for the Caribbean and Adjacent Regions, which will assist countries in the Pacific and the Caribbean to assess tsunami threats and issue warnings, and encourages Member States to establish and sustain their national warning and mitigation systems, within a global, ocean-related multi-hazard approach, as necessary, to reduce loss of life and damage to national economies and strengthen the resilience of coastal communities to natural disasters;",
    "298": "Stresses the need for continued efforts in developing mitigation and preparedness measures for natural disasters, particularly following tsunami events such as the 11 March 2011 event in Japan and the events on 28 September and 22 December 2018 in Indonesia;",
    "299": "Takes note of the sixth Global Environment Outlook, entitled Healthy Planet, Healthy People, approved on 24 January 2019, which, inter alia, identifies the principal drivers of change facing oceans and coasts and their impacts;",
    "300": "Urges States to take necessary action and to cooperate in relevant organizations, including the Food and Agriculture Organization of the United Nations, the Intergovernmental Oceanographic Commission and the World Meteorological Organization, to address damage to ocean data buoys deployed and operated in accordance with international law, including through education and outreach about the importance and purpose of these buoys and by strengthening these buoys against such damage and increasing reporting of such damage;",
    "301": "Notes the discussions at the twentieth meeting of the Informal Consultative Process, from 10 to 14 June 2019, on the theme of ocean science and the United Nations Decade of Ocean Science for Sustainable Development, during which delegations, inter alia, stressed the importance of marine scientific research, international cooperation and coordination, as well as of a stronger science-policy interface in understanding and effectively addressing the unprecedented pressures on the ocean, provided input to assist in preparing for the Decade and considered that the Decade will be an important opportunity to address gaps in ocean science, increase knowledge, improve synergies and support the sustainable conservation and management of marine resources, and during which several delegations underlined the important complementary role of traditional knowledge held by indigenous peoples and local communities;4",
    "302": "Welcomes the steps taken by the Intergovernmental Oceanographic Commission to prepare the implementation plan for the United Nations Decade of Ocean Science for Sustainable Development (2021\u20132030) in consultation with Member States, specialized agencies, funds, programmes and bodies of the United Nations, as well as other intergovernmental organizations, non-governmental organizations and relevant stakeholders, and requests the Intergovernmental Oceanographic Commission to continue to provide information on the development of the implementation plan and present it to the General Assembly at its seventy-fifth session;",
    "303": "Requests that the Intergovernmental Oceanographic Commission regularly consult with, and report to, Member States on the United Nations Decade of Ocean Science for Sustainable Development and its implementation;",
    "304": "Invites the Secretary-General to inform the General Assembly on the implementation of the United Nations Decade of Ocean Science for Sustainable Development through his report on oceans and the law of the sea, on the basis of information to be provided by the Intergovernmental Oceanographic Commission;",
    "305": "Invites UN-Oceans and its participants to collaborate with the Intergovernmental Oceanographic Commission on the United Nations Decade of Ocean Science for Sustainable Development; XII Regular Process for Global Reporting and Assessment of the State of the Marine Environment, including Socioeconomic Aspects",
    "306": "Reiterates the need to strengthen the regular scientific assessment of the state of the marine environment in order to enhance the scientific basis for policymaking;",
    "307": "Reaffirms the principles guiding the Regular Process and its objective and scope, recalls the crucial importance of the Regular Process for ongoing ocean-related intergovernmental processes and its possible inputs, including for the 2030 Agenda, the development of an international legally binding instrument under the United Nations Convention on the Law of the Sea on the conservation and sustainable use of marine biological diversity of areas beyond national jurisdiction, the United Nations Framework Convention on Climate Change and the United Nations Open-ended Informal Consultative Process on Oceans and the Law of the Sea, among other relevant processes, and notes the importance of continuing support and cooperation between the activities of the United Nations Decade of Ocean Science for Sustainable Development and those of the Regular Process;",
    "308": "Recalls the importance of ensuring that assessments, such as those included in the Global Sustainable Development Report and those prepared under the Intergovernmental Panel on Climate Change, the Intergovernmental Science-Policy Platform on Biodiversity and Ecosystem Services and the Regular Process, support one another and avoid unnecessary duplication, and also recalls the importance of compatibility and synergies between such assessments and assessments at the regional level;",
    "309": "Reaffirms the importance of the first World Ocean Assessment as the outcome of the first cycle of the Regular Process, recalls the technical abstracts of the Assessment, and reiterates its concern as reflected in the findings of the Assessment, as recorded in paragraph 289 of its resolution 71/257 and in subsequent resolutions;",
    "310": " the second world ocean assessment prepared by the Group of Experts in consultation with the secretariat of the Regular Process;",
    "311": "Welcomes the holding of the second round of regional workshops in support of the second cycle of the Regular Process in Koror, Palau, on 8 and 9 August 2018, in Valletta on 27 and 28 August 2018, in Odessa, Ukraine, on 17 and 18 October 2018, in Bali, Indonesia, on 8 and 9 November 2018, in Doha on 28 and 29 November 2018, in Accra on 3 and 4 December 2018 and in Guayaquil, Ecuador, on 17 and 18 December 2018, and takes note of the summaries of those workshops;",
    "312": "Recognizes the need for early preparation for possible future regional workshops in support of the Regular Process, and invites States to consider hosting such workshops and inform the secretariat of their intent as early as possible;",
    "313": "Recalls the importance of raising awareness of the first World Ocean Assessment and the Regular Process, and recognizes with appreciation the activities undertaken to raise awareness of the Assessment, including during the regional workshops held in 2017 and 2018 in support of the second cycle of the Regular Process;",
    "314": "Welcomes the holding of the multi-stakeholder dialogue and capacity- building partnership event on 24 and 25 January 2019, notes the summary of discussions, and welcomes the approval by the Ad Hoc Working Group of the Whole at its twelfth meeting of the conclusions from the partnership event;3",
    "315": "Reiterates its invitation to States and intergovernmental and non-governmental organizations to provide relevant information to the secretariat for inclusion in the capacity-building inventory of needs and opportunities relevant for the Regular Process, and expresses its appreciation for the information contributed thus far and for the work undertaken by the secretariat;",
    "316": "Also reiterates its request to intergovernmental and non-governmental organizations to provide information on recent and ongoing assessments and other processes at the regional and global levels relevant to the Regular Process in order for the secretariat to update the inventory, and expresses its appreciation for the information contributed thus far and for the work of the secretariat in compiling the information received;",
    "317": "Welcomes the holding of the twelfth meeting of the Ad Hoc Working Group of the Whole on 29 and 30 July 2019, in accordance with paragraph 334 of resolution 73/124, and endorses the recommendations adopted by the Ad Hoc Working Group at its twelfth meeting;3",
    "318": "Decides to launch the third cycle of the Regular Process, to cover five years, from 2021 to 2025, and requests the Bureau, with the assistance of the Group of Experts and the secretariat, to develop a draft programme of work for the third cycle, on the basis of the possible outcomes and building blocks of the third cycle prepared by the Bureau and endorsed by the Ad Hoc Working Group of the Whole at its twelfth meeting and taking into account lessons learned from the second cycle, and to report to Member States in advance of the thirteenth meeting of the Ad Hoc Working Group;",
    "319": " Ad Hoc Working Group of the views received and to circulate that information in advance of the thirteenth meeting of the Ad Hoc Working Group;",
    "320": "Requests the Secretary-General to prepare the resource requirements for the third cycle of the Regular Process on the basis of the draft programme of work for the third cycle, to be developed in the intersessional period by the Bureau, and to report to Member States in advance of the thirteenth meeting of the Ad Hoc Working Group of the Whole;",
    "321": "Recognizes with appreciation the important role of the Co-Chairs and the Bureau of the Ad Hoc Working Group of the Whole in providing guidance during the intersessional period before the twelfth meeting of the Ad Hoc Working Group, requests the Bureau to continue to implement the decisions and guidance of the Ad Hoc Working Group during the intersessional period before the thirteenth meeting of the Ad Hoc Working Group, and recognizes the support provided by the secretariat in that regard;",
    "322": "Also recognizes with appreciation the continued work of the members of the Group of Experts and that of the Pool of Experts of the Regular Process in the implementation of the second cycle of the Regular Process;",
    "323": "Urges regional groups that have not yet done so to appoint experts to the Group of Experts, taking into account the need to ensure equitable geographical distribution and adequate expertise in socioeconomic disciplines;",
    "324": "Welcomes the appointment of additional experts to the Pool of Experts for the second cycle of the Regular Process by States and through recommendations from relevant intergovernmental organizations, in accordance with the revised mechanism for the establishment of the Pool of Experts for the second cycle of the Regular Process;",
    "325": "Also welcomes the designation by States of national focal points pursuant to paragraph 319 of resolution 73/124, and urges States that have not yet done so to designate their national focal points as soon as possible;",
    "326": "Recalls its invitation to the Intergovernmental Oceanographic Commission of the United Nations Educational Scientific and Cultural Organization, the United Nations Environment Programme, the International Maritime Organization, the Food and Agriculture Organization of the United Nations, the World Meteorological Organization and relevant United Nations system organizations, bodies, funds and programmes, as appropriate, to assist in the implementation of the second cycle of the Regular Process with regard to the following activities: awareness-raising, the identification of experts for the Pool of Experts, technical and scientific support for the Bureau and the Group of Experts, hosting meetings of the writing teams and capacity-building, and also recalls its invitation to relevant intergovernmental organizations to contribute, as appropriate, to the activities of the second cycle;",
    "327": "",
    "328": "Urges States, international financial institutions, donor agencies, intergovernmental organizations, non-governmental organizations and natural and juridical persons to make financial contributions to the voluntary trust fund and to make other contributions to the Regular Process;",
    "329": "Recalls the potential of the Regular Process special scholarship fund, established pursuant to resolution 64/71, to support training programmes for developing countries, including through cooperation projects among various stakeholders, in order to strengthen the human and institutional capacity of those countries to carry out integrated assessments, and encourages States, international financial institutions, donor agencies, intergovernmental organizations, non-governmental organizations and natural and juridical persons to make financial contributions to that fund; XIII Regional cooperation",
    "330": "Notes with appreciation efforts and initiatives at the regional level, in various regions, to further the implementation of the Convention and to respond, including through capacity-building, to issues related to maritime safety and security, the conservation and sustainable use of living marine resources, the protection and preservation of the marine environment and the conservation and sustainable use of marine biodiversity;",
    "331": "Invites States and international organizations to enhance their cooperation to better protect the marine environment;",
    "332": "Notes the Caribbean-focused Assistance Fund, which is intended to facilitate, mainly through technical assistance, the voluntary undertaking of maritime delimitation negotiations between Caribbean States, notes once again the Fund for Peace: Peaceful Settlement of Territorial Disputes, established by the General Assembly of the Organization of American States in 2000 as a primary mechanism, given its broader regional scope, for the prevention and resolution of pending territorial, land border and maritime boundary disputes, and calls upon States and others in a position to do so to contribute to these funds;",
    "333": "Recalls the outcome document of the third International Conference on Small Island Developing States, the SIDS Accelerated Modalities of Action (SAMOA) Pathway128 and the modalities set forth for strengthened action on a range of small island developing States challenges and priorities, including challenges related to the conservation and sustainable use of marine resources, and the preservation of the marine environment, and in this regard welcomes the convening of the high-level midterm review of the Samoa Pathway in September 2019 and the adoption of its political declaration,129 which notes the importance of oceans, seas and marine resources to small island developing States and acknowledges their efforts to develop and implement strategies for the conservation and sustainable use of the ocean and its resources, and reaffirms its commitment to work with small island developing States towards the full implementation of the Samoa Pathway to ensure its success;",
    "334": "Recognizes the results of the International Polar Year, 2007\u20132008 with particular emphasis on new knowledge about the linkages between environmental change in the polar regions and global climate systems, and encourages States and scientific communities to strengthen their cooperation in this respect;",
    "335": "Acknowledges the important contributions to scientific understanding of the marine environment and its resources, as well as the scientific advice for their sustainable use, provided by the International Council for the Exploration of the Sea in its wide-ranging cooperation with organizations at the regional level under the Convention for the International Council for the Exploration of the Sea, 1964;130",
    "336": "Welcomes regional cooperation, and in this regard notes the Pacific Oceanscape Framework as an initiative to enhance cooperation among coastal States in the Pacific island region to foster marine conservation and sustainable development;",
    "337": "Notes with appreciation the various cooperative efforts displayed by States at the regional and subregional levels, and in this regard welcomes initiatives, such as the Integrated Assessment and Management of the Gulf of Mexico Large Marine Ecosystem;",
    "338": "Acknowledges relevant cooperation among the members of the Zone of Peace and Cooperation of the South Atlantic;",
    "339": "Recalls the decision of the Assembly of the African Union in January 2015 to adopt Agenda 2063, also recalls that the African Union launched the Decade of African Seas and Oceans (2015\u20132025), and notes that the African Day of the Seas and Oceans is to be celebrated annually on 25 July;",
    "340": "Notes the adoption of the Vienna Programme of Action for Landlocked Developing Countries for the Decade 2014\u20132024 by the second United Nations Conference on Landlocked Developing Countries, held in Vienna from 3 to 5 November 2014, 131 following the comprehensive 10-year review of the implementation of the Almaty Programme of Action: Addressing the Special Needs of Landlocked Developing Countries within a New Global Framework for Transit Transport Cooperation for Landlocked and Transit Developing Countries, 132 and also notes the need for cooperation to address the development needs and challenges faced by landlocked developing countries associated with, inter alia, their lack of direct territorial access to the sea, remoteness and isolation from world markets, in line with the objectives of the Vienna Programme of Action;",
    "341": "Also notes the efforts of the Sargasso Sea Commission, led by the Government of Bermuda, to raise awareness of the ecological significance of the Sargasso Sea;",
    "342": "Further notes the Agreement on Enhancing International Arctic Scientific Cooperation, negotiated under the auspices of the Arctic Council, and notes that its implementation will increase the development of scientific knowledge about the region;",
    "343": "Notes the cooperation between the OSPAR Commission established by the Convention for the Protection of the Marine Environment of the North-East Atlantic133 and the North-East Atlantic Fisheries Commission; XIV Open-ended Informal Consultative Process on Oceans and the Law of the Sea",
    "344": "Welcomes the report of the Co-Chairs on the work of the Informal Consultative Process at its twentieth meeting, which focused on the theme of ocean science and the United Nations Decade of Ocean Science for Sustainable Development;4",
    "345": "Recognizes the role of the Informal Consultative Process as a unique forum for comprehensive discussions on issues related to oceans and the law of the sea, consistent with the framework provided by the Convention and chapter 17 of Agenda 21,6 and that the perspective of the three pillars of sustainable development should be further enhanced in the examination of the selected topics;",
    "346": "Welcomes the work of the Informal Consultative Process and its contribution to improving coordination and cooperation between States and strengthening the annual debate of the General Assembly on oceans and the law of the sea by effectively drawing attention to key issues and current trends;",
    "347": "Also welcomes efforts to improve and focus the work of the Informal Consultative Process, and in that respect recognizes the primary role of the Informal Consultative Process in integrating knowledge, the exchange of opinions among multiple stakeholders and coordination among competent agencies, and enhancing awareness of topics, including emerging issues, while promoting the three pillars of sustainable development;",
    "348": "Recalls the need to strengthen and improve the efficiency of the Informal Consultative Process, and encourages States, intergovernmental organizations and programmes to provide guidance to the Co-Chairs to this effect, particularly before and during the preparatory meeting for the Informal Consultative Process;",
    "349": "Requests the Secretary-General to convene, in accordance with paragraphs 2 and 3 of resolution 54/33, the twenty-first meeting of the Informal Consultative Process, in New York for eight meetings during the week of 22 to 26 June 2020, to provide it with the facilities necessary for the performance of its work, including documentation, and to arrange for support to be provided by the Division, in cooperation with other relevant parts of the Secretariat, as appropriate;",
    "350": "Expresses its continued serious concern regarding the lack of resources available in the voluntary trust fund established pursuant to resolution 55/7 for the purpose of assisting developing countries, in particular least developed countries, small island developing States and landlocked developing States, in attending the meetings of the Informal Consultative Process, and urges States, international financial institutions, donor agencies, intergovernmental organizations, non-governmental organizations and natural and juridical persons to make additional contributions to the trust fund;",
    "351": "Decides that those representatives from developing countries who are invited by the Co-Chairs, in consultation with Governments, to make presentations during the meetings of the Informal Consultative Process shall receive priority consideration in the disbursement of funds from the voluntary trust fund established pursuant to resolution 55/7 in order to cover the costs of their travel, and shall also be eligible to receive daily subsistence allowance subject to the availability of funds after the travel costs of all other eligible representatives from those countries mentioned in paragraph 350 above have been covered;",
    "352": " XV Coordination and cooperation",
    "353": "Encourages States to work closely with and through international organizations, funds and programmes, as well as the specialized agencies of the United Nations system and relevant international conventions, to identify emerging areas of focus for improved coordination and cooperation and how best to address these issues;",
    "354": "Expresses its concern at the desecration of graves at sea and the looting of wrecks of ships constituting such graves, and calls upon States to cooperate, as appropriate, to prevent the looting and desecration of wrecks of ships constituting graves in order to ensure that proper respect is given to all human remains located in maritime waters, consistent with international law, including, as appropriate, the 2001 Convention on the Protection of the Underwater Cultural Heritage, among parties thereto;",
    "355": "Encourages bodies established by the Convention to strengthen coordination and cooperation, as appropriate, in fulfilling their respective mandates;",
    "356": "Requests the Secretary-General to bring the present resolution to the attention of heads of intergovernmental organizations, the specialized agencies, funds and programmes of the United Nations engaged in activities relating to ocean affairs and the law of the sea, as well as funding institutions, and underlines the importance of their constructive and timely input for the report of the Secretary-General on oceans and the law of the sea and of their participation in relevant meetings and processes;",
    "357": "Welcomes the work done by the secretariats of relevant United Nations specialized agencies, programmes, funds and bodies and the secretariats of related organizations and conventions to enhance inter-agency coordination and cooperation on ocean issues, including, where appropriate, through UN-Oceans, the inter-agency coordination mechanism on ocean and coastal issues within the United Nations system;",
    "358": "Recognizes the work undertaken by UN-Oceans, in particular the inventory of mandates and the development of a draft methodology for the indicator for target 14.c of the 2030 Agenda, under the revised terms of reference for the work of UN-Oceans, and with the United Nations Legal Counsel/the Division as the focal point of UN-Oceans, and, as an interim measure, in this regard invites States, international financial institutions, donor agencies, intergovernmental organizations, non-governmental organizations and natural and juridical persons to make financial earmarked contributions to the trust fund established by the Secretary-General for the Office of Legal Affairs to support the promotion of international law, and authorizes the Secretary-General to disburse funds from such contributions to that trust fund for the purposes of the maintenance of an online searchable database for an inventory of the mandates of UN-Oceans members and priorities approved by the respective governing bodies of the participating organizations of UN-Oceans, with a view to identifying possible areas of collaboration and synergy, as well as for travel associated with the performance of the functions of the focal point;",
    "359": "Recalls its decision to defer the review of the terms of reference for the work of UN-Oceans until its seventy-fifth session; XVI Activities of the Division for Ocean Affairs and the Law of the Sea",
    "360": " activities of the Division, which reflect the high standard of assistance provided to Member States by the Division;",
    "361": "Notes with satisfaction the eleventh observance by the United Nations of World Oceans Day in 2019,134 recognizes with appreciation the efforts deployed by the Division in this regard, and invites the Division to continue to promote and facilitate international cooperation on the law of the sea and ocean affairs in the context of the future observance of World Oceans Day, as well as through its participation in other events;",
    "362": "Recalls the responsibilities and functions entrusted to the Secretary- General in the Convention and in the related resolutions of the General Assembly, including resolutions 49/28 and 52/26, notes the increased number of requests to the Division for additional outputs and servicing of meetings and in relation to the support to be provided by the Division as secretariat of the Regular Process during the second cycle of the Regular Process, and requests the Secretary-General to ensure the allocation of appropriate resources to the Division for the performance of its activities under the approved budget for the Organization;",
    "363": "Requests the Secretary-General to continue the publication activities of the Division, in particular through the publication of Guidelines on deposit with the Secretary-General of charts or lists of geographical coordinates under the Convention135 and the Law of the Sea Bulletin; XVII Seventy-fifth session of the General Assembly",
    "364": "Requests the Secretary-General to prepare reports for consideration by the General Assembly at its seventy-fifth session, namely, a report on developments and issues relating to ocean affairs and the law of the sea, including the implementation of the present resolution, in accordance with resolutions 49/28, 52/26 and 54/33, and a report on the topic that is the focus of the twenty-first meeting of the Informal Consultative Process;",
    "365": "Emphasizes the critical role of the annual reports of the Secretary-General, which integrate information on developments relating to the implementation of the Convention and the work of the Organization, its specialized agencies and other institutions in the field of ocean affairs and the law of the sea at the global and regional levels, and as a result constitute the basis for the annual consideration and review of developments relating to ocean affairs and the law of the sea by the General Assembly as the global institution having the competence to undertake such a review;",
    "366": "Notes that the reports referred to in paragraph 364 above will also be submitted to States Parties pursuant to article 319 of the Convention regarding issues of a general nature that have arisen with respect to the Convention;",
    "367": "Also notes the desire to further improve the efficiency of and effective participation of delegations in the informal consultations concerning the annual General Assembly resolution on oceans and the law of the sea, decides that the period of the informal consultations on that resolution should not exceed a maximum of eight days in total and that the consultations should be scheduled in such a way that the Division has sufficient time to produce the report on developments and issues relating to ocean affairs and the law of the sea referred to in paragraph 364 above, requests the Secretary-General to continue to provide support to the consultations through the Division, and encourages States to submit proposals for the resolution to the Coordinator of the informal consultations no later than one week before the first day of the first round of the informal consultations;",
    "368": "Decides to include in the provisional agenda of its seventy-fifth session the item entitled \u201cOceans and the law of the sea\u201d."
  },
  "agenda_items": [
    "Item 74"
  ],
  "symbol_references": [
    "A/74/L.22"
  ]
}