{
  "symbol": "A/RES/75/317",
  "filename": "A_RES_75_317.pdf",
  "title": "75/317. World Wetlands Day",
  "text": "United Nations \nA/RES/75/317\n \n \nGeneral Assembly \nDistr.: General \n1 September 2021 \n \n21-12015 (E)    080921    \n*2112015* \n \n \nSeventy-fifth session \nAgenda item 14 \nIntegrated and coordinated implementation of and \nfollow-up to the outcomes of the major United Nations \nconferences and summits in the economic, social and \nrelated fields \n \n \n \n \n Resolution adopted by the General Assembly \non 30 August 2021 \n \n \n \n \n[without reference to a Main Committee (A/75/L.125 and A/75/L.125/Add.1)] \n \n \n 75/317. World Wetlands Day \n \n \n \nThe General Assembly, \n \nReaffirming its resolution 70/1 of 25 September 2015, entitled \u201cTransforming \nour world: the 2030 Agenda for Sustainable Development\u201d, in which it adopted a \ncomprehensive, far-reaching and people-centred set of universal and transformative \nSustainable Development Goals and targets, its commitment to working tirelessly for \nthe full implementation of the Agenda by 2030, its recognition that eradicating \npoverty in all its forms and dimensions, including extreme poverty, is the greatest \nglobal challenge and an indispensable requirement for sustainable development, and \nits commitment to achieving sustainable development in its three dimensions \u2013 \neconomic, social and environmental \u2013 in a balanced and integrated manner, and to \nbuilding upon the achievements of the Millennium Development Goals and seeking \nto address their unfinished business,  \n \nReaffirming also its resolutions 53/199 of 15 December 1998 and 61/185 of \n20 December 2006 on the proclamation of international years, and Economic and \nSocial Council resolution 1980/67 of 25 July 1980 on international years and \nanniversaries, particularly paragraphs 1 to 10 of the annex thereto on the agreed \ncriteria for the proclamation of international years, as well as paragraphs 13 and 14, \nin which it is stated that an international day or year should not be proclaimed before \nthe basic arrangements for its organization and financing have been made,  \n \nReaffirming further that wetlands are critical to people and nature, given the \nintrinsic value of these ecosystems, and their benefits and services, including their \nenvironmental, climate, ecological, social, economic, scientific, educational, cultural, \nrecreational and aesthetic contributions to sustainable development and human well-\nbeing,  \n\nA/RES/75/317 \nWorld Wetlands Day\n \n21-12015\n2/3 \n \n \nAcknowledging that wetlands are among the ecosystems with the highest rates \nof decline, loss and degradation, and considering that indicators of current negative \ntrends in global biodiversity and ecosystem functions are projected to continue in \nresponse to direct and indirect drivers such as rapid human population growth, \nunsustainable \nproduction \nand \nconsumption \nand \nassociated \ntechnological \ndevelopment, as well as the adverse impacts of climate change,  \n \nTaking into account that wetlands are essential to achieving the Sustainable \nDevelopment Goals related to poverty eradication, food and nutrition, healthy living, \ngender equality, water quality and availability, energy supply, the reduction of natural \ndisasters, innovation and the development of appropriate infrastructure, sustainable \nand resilient human settlements, the mitigation of and adaptation to climate change, \noceans, seas and marine resources, biodiversity and the sustainable use of ecosystems, \n \nRecalling Sustainable Development Goal 6, which focuses on ensuring the \navailability and sustainable management of water and sanitation for all, and its \ntarget 6.6, which seeks to protect and restore water-related ecosystems; Goal 14, on \nthe conservation and sustainable use of the oceans, seas and marine resources for \nsustainable development, including its target 14.2, which seeks to sustainably manage \nand protect marine and coastal ecosystems; and Goal 15, related to life on land, and \nits target 15.1, which seeks to ensure the conservation, restoration and sustainable use \nof terrestrial and inland freshwater ecosystems and their services, including wetlands, \nin line with obligations under international agreements,  \n \nReaffirming the important role of the Convention on Wetlands of International \nImportance especially as Waterfowl Habitat1 (Ramsar Convention) in ensuring the \nconservation and wise use of all wetlands through local and national actions and \ninternational cooperation, and its contribution towards achieving sustainable \ndevelopment throughout the world,  \n \nTaking into account that the secretariat of the Ramsar Convention is \nco-custodian of Sustainable Development Goal indicator 6.6.1, which monitors \nchange in the extent of water-related ecosystems over time, and that the Convention \nis a partner agency for indicators 6.5.1, 14.5.1 and 15.1.2,  \n \nNoting decision III/21 of the Conference of the Parties to the Convention on \nBiological Diversity, of 15 November 1996,2 recalling the role of the Ramsar \nConvention as the lead partner in the implementation of activities related to wetlands \nunder the Convention on Biological Diversity,3 and recognizing the important \ncontribution that the Ramsar Convention has made towards the Aichi Biodiversity \nTargets of the Strategic Plan for Biodiversity 2011\u20132020,4  \n \nRecognizing that 171 States had become Contracting Parties to the Convention \non Wetlands of International Importance especially as Waterfowl Habitat as of July \n2021 and that the secretariat of the Ramsar Convention provides outreach materials \nto help to raise public awareness of the importance and value of wetlands on \n2 February each year, the anniversary of the date of adoption of the Convention, in \n1971,  \n \nTaking note of the outcome of the thirteenth meeting of the Conference of the \nContracting Parties to the Convention on Wetlands of International Importance \nespecially as Waterfowl Habitat, held in Dubai, United Arab Emirates, from 21 to \n29 October 2018, and in particular its resolution XIII.1, in which the Conference \n__________________ \n \n1  United Nations, Treaty Series, vol. 996, No. 14583. \n \n2  See United Nations Environment Programme, document UNEP/CBD/COP/3/38, annex II. \n \n3  United Nations, Treaty Series, vol. 1760, No. 30619. \n \n4  See United Nations Environment Programme, document UNEP/CBD/COP/10/27, annex, \ndecision X/2, annex. \n\nWorld Wetlands Day \nA/RES/75/317\n \n3/3\n21-12015 \n \ninvited the General Assembly to recognize 2 February of each year, the date of \nadoption of the Convention on Wetlands, as World Wetlands Day,  \n \n1. \nDecides to proclaim 2 February, the date of adoption of the Convention on \nWetlands of International Importance especially as Waterfowl Habitat (Ramsar \nConvention), as World Wetlands Day;  \n \n2. \nInvites all Member States, organizations of the United Nations system and \nother global, regional and subregional organizations, as well as other relevant \nstakeholders, including civil society, international and national non-governmental \norganizations and individuals, to observe and raise awareness of World Wetlands Day \nin an appropriate manner, in accordance with national priorities;  \n \n3. \nStresses that the cost of all activities that may arise from the \nimplementation of the present resolution should be met from voluntary contributions, \nand that such activities would be subject to the availability and provision of voluntary \ncontributions;  \n \n4. \nInvites the secretariat of the Ramsar Convention, in collaboration with \nrelevant organizations of the United Nations system, to facilitate the implementation \nof World Wetlands Day, mindful of the provisions contained in the annex to Economic \nand Social Council resolution 1980/67, and also invites the secretariat of the Ramsar \nConvention to inform the General Assembly at its seventy-sixth session about the \nimplementation of the present resolution;  \n \n5. \nRequests the Secretary-General to bring the present resolution to the \nattention of all Member States, the organizations of the United Nations system and \nother relevant stakeholders, including civil society organizations, academia and the \nprivate sector, for appropriate observance. \n \n99th plenary meeting \n30 August 2021 \n \n",
  "paragraphs": {
    "1": "Decides to proclaim 2 February, the date of adoption of the Convention on Wetlands of International Importance especially as Waterfowl Habitat (Ramsar Convention), as World Wetlands Day;",
    "2": "Invites all Member States, organizations of the United Nations system and other global, regional and subregional organizations, as well as other relevant stakeholders, including civil society, international and national non-governmental organizations and individuals, to observe and raise awareness of World Wetlands Day in an appropriate manner, in accordance with national priorities;",
    "3": "Stresses that the cost of all activities that may arise from the implementation of the present resolution should be met from voluntary contributions, and that such activities would be subject to the availability and provision of voluntary contributions;",
    "4": "Invites the secretariat of the Ramsar Convention, in collaboration with relevant organizations of the United Nations system, to facilitate the implementation of World Wetlands Day, mindful of the provisions contained in the annex to Economic and Social Council resolution 1980/67, and also invites the secretariat of the Ramsar Convention to inform the General Assembly at its seventy-sixth session about the implementation of the present resolution;",
    "5": "Requests the Secretary-General to bring the present resolution to the attention of all Member States, the organizations of the United Nations system and other relevant stakeholders, including civil society organizations, academia and the private sector, for appropriate observance. 99th plenary meeting 30 August 2021"
  },
  "agenda_items": [
    "Item 14"
  ],
  "symbol_references": [
    "A/75/L.125"
  ]
}