{
  "symbol": "A/RES/76/279",
  "filename": "A_RES_76_279.pdf",
  "title": "76/279. Support account for peacekeeping operations",
  "text": "United Nations \nA/RES/76/279\n \n \nGeneral Assembly \nDistr.: General \n7 July 2022 \n \n22-10335 (E)    070722 \n*2210335* \n \n \nSeventy-sixth session \nAgenda item 150 \nAdministrative and budgetary aspects of the financing of \nthe United Nations peacekeeping operations  \n \n \n \n \n Resolution adopted by the General Assembly \non 29 June 2022 \n \n \n \n \n[on the report of the Fifth Committee (A/76/874, para. 21)] \n \n \n 76/279. Support account for peacekeeping operations \n \n \n \nThe General Assembly, \n \nRecalling its resolutions 45/258 of 3 May 1991, 47/218 A of 23 December 1992, \n48/226 A of 23 December 1993, 48/226 C of 29 July 1994, 49/250 of 20 July 1995, \n50/221 B of 7 June 1996, section I of its resolution 55/238 of 23 December 2000, its \nresolutions 55/271 of 14 June 2001, 56/241 of 24 December 2001, 56/293 of 27 June \n2002, 57/318 of 18 June 2003, 58/298 of 18 June 2004, 59/301 of 22 June 2005, \n60/268 of 30 June 2006, 61/279 of 29 June 2007, 62/250 of 20 June 2008, 63/287 of \n30 June 2009, 64/271 of 24 June 2010, 65/290 of 30 June 2011, 66/265 of 21 June \n2012, 67/287 of 28 June 2013, 68/283 of 30 June 2014, 69/308 of 25 June 2015, \n70/287 of 17 June 2016, 71/295 of 30 June 2017, 72/288 of 5 July 2018, 73/308 of \n3 July 2019, 74/280 of 30 June 2020, 75/293 of 30 June 2021 and its other relevant \nresolutions, as well as its decisions 49/469 of 23 December 1994, 50/473 of \n23 December 1995, 72/558 of 5 July 2018, 73/555 of 3 July 2019 and 74/571 of \n3 September 2020,  \n \nHaving considered the reports of the Secretary-General on the budget \nperformance of the support account for peacekeeping operations for the period from \n1 July 2020 to 30 June 2021 1  and on the budget for the support account for \npeacekeeping operations for the period from 1 July 2022 to 30 June 2023, 2 the report \nof the Independent Audit Advisory Committee on the proposed budget of the Office \nof Internal Oversight Services under the support account for peacekeeping operations \n__________________ \n \n1  A/76/596. \n \n2  A/76/725. \n\nA/RES/76/279 \nSupport account for peacekeeping operations\n \n22-10335\n2/4 \n \nfor the period from 1 July 2022 to 30 June 20233 and the related report of the Advisory \nCommittee on Administrative and Budgetary Questions,4 \n \nRecognizing the importance of the United Nations being able to respond and \ndeploy rapidly to a peacekeeping operation upon the adoption of a relevant resolution \nof the Security Council, within 30 days for traditional peacekeeping operations and \n90 days for complex peacekeeping operations,  \n \nRecognizing also the need for adequate support during all phases of \npeacekeeping operations, including the liquidation and termination phases,  \n \nMindful that the level of the support account should broadly correspond to the \nmandate, number, size and complexity of peacekeeping missions,  \n \n1. \nTakes note of the report of the Secretary-General on the budget for the \nsupport account for peacekeeping operations for the period from 1 July 2022 to \n30 June 2023 and the report of the Independent Audit Advisory Committee on the \nproposed budget of the Office of Internal Oversight Services under the support \naccount for peacekeeping operations for the period from 1 July 2022 to 30 June 2023;  \n \n2. \nReaffirms its role in carrying out a thorough analysis and approval of \nhuman and financial resources and policies with a view to ensuring the full, effective \nand efficient implementation of all mandated programmes and activities and the \nimplementation of policies in this regard;  \n \n3. \nAlso reaffirms that the Fifth Committee is the appropriate Main Committee \nof the General Assembly entrusted with responsibility for administrative and \nbudgetary matters;  \n \n4. \nFurther reaffirms rule 153 of its rules of procedure;  \n \n5. \nReaffirms that the support account funds shall be used for the sole purpose \nof financing human resources and non-human resources requirements for \nbackstopping and supporting peacekeeping operations at Headquarters, and that any \nchanges in this limitation require the prior approval of the General Assembly;  \n \n6. \nAlso reaffirms the need for adequate funding for the backstopping of \npeacekeeping operations, as well as the need for full justification for that funding in \nsupport account budget submissions;  \n \n7. \nFurther reaffirms the need for effective and efficient administration and \nfinancial management of peacekeeping operations, and urges the Secretary-General \nto continue to identify measures to increase the productivity and efficiency of the \nsupport account;  \n \n8. \nRequests the Secretary-General to ensure the full implementation of the \nrelevant provisions of its resolutions 59/296 of 22 June 2005, 60/266 of 30 June 2006, \n61/276 of 29 June 2007, 64/269 of 24 June 2010, 65/289 of 30 June 2011, 66/264 of \n21 June 2012, 69/307 of 25 June 2015, 70/286 of 17 June 2016, 76/274 of 29 June \n2022 and its other relevant resolutions;  \n \n9. \nEndorses the conclusions and recommendations contained in the report of \nthe Advisory Committee on Administrative and Budgetary Questions, subject to the \nprovisions of the present resolution, and requests the Secretary-General to ensure \ntheir full implementation;  \n__________________ \n \n3  A/76/720. \n \n4  A/76/808. \n\nSupport account for peacekeeping operations \nA/RES/76/279\n \n3/4\n22-10335 \n \n \n10. Decides to maintain, for the financial period from 1 July 2022 to 30 June \n2023, the funding mechanism for the support account used in the current period, from \n1 July 2021 to 30 June 2022, as approved in paragraph 3 of its resolution 50/221 B;  \n \nBudget performance report for the period from 1 July 2020 to 30 June 2021 \n \n \n11. \nTakes note of the report of the Secretary-General on the budget \nperformance of the support account for peacekeeping operations for the period from \n1 July 2020 to 30 June 2021;  \n \nBudget estimates for the financial period from 1 July 2022 to 30 June 2023 \n \n \n12. Approves the support account requirements in the amount of \n371,787,000 United States dollars for the financial period from 1 July 2022 to 30 June \n2023, inclusive of the amount of 17,196,900 dollars for the enterprise resource \nplanning project, 868,500 dollars for the global service delivery model project, \n3,881,600 dollars for peacekeeping capability readiness and 18,588,600 dollars for \nUmoja maintenance and support costs, including 1,354 continuing posts and 8 new \ntemporary posts, as well as the abolishment, redeployment, reassignment and \nreclassification of posts, 55 continuing and 16 new general temporary assistance \npositions and 51.5 person-months, as well as related post and non-post requirements;  \n \nFinancing of the support account for peacekeeping operations for the financial \nperiods from 1 July 2020 to 30 June 2021 and from 1 July 2022 to 30 June 2023 \n \n \n13. Decides that the requirements for the support account for peacekeeping \noperations for the financial period from 1 July 2022 to 30 June 2023 shall be financed \nas follows:  \n \n(a) \nThe unencumbered balance in the amount of 201,300 dollars, in respect of \nthe financial period from 1 July 2020 to 30 June 2021, to be applied to the resources \nrequired for the financial period from 1 July 2022 to 30 June 2023;  \n \n(b) \nThe total amount of 2,113,400 dollars, comprising investment revenue of \n536,200 dollars, other miscellaneous revenue of 52,200 dollars and cancellation of \nprior-period obligations of 1,525,000 dollars, in respect of the period from 1 July \n2020 to 30 June 2021, to be applied to the resources required for the financial period \nfrom 1 July 2022 to 30 June 2023;  \n \n(c) \nThe amount of 4,201,000 dollars, representing the peacekeeping share of \nthe unused balance of the resources provided for the enterprise resource planning \nproject in the amount of 4,201,000 dollars, in accordance with its resolution 74/263 \nof 27 December 2019, to be applied to the resources required for the financial period \nfrom 1 July 2022 to 30 June 2023;  \n \n(d) \nThe amount of 459,300 dollars, representing the excess of the authorized \nlevel of the Peacekeeping Reserve Fund in respect of the financial period ended \n30 June 2021, to be applied to the resources required for the financial period from \n1 July 2022 to 30 June 2023;  \n \n(e) \nThe balance of 364,812,000 dollars to be prorated among the budgets of \nthe active peacekeeping operations for the financial period from 1 July 2022 to \n30 June 2023;  \n \n(f) \nThe net estimated staff assessment income of 29,429,900 dollars, \ncomprising the amount of 28,631,400 dollars for the financial period from 1 July 2022 \nto 30 June 2023 and the increase of 798,500 dollars in respect of the financial period \nended 30 June 2021, to be offset against the balance referred to in subparagraph (e) \n\nA/RES/76/279 \nSupport account for peacekeeping operations\n \n22-10335\n4/4 \n \nabove, to be prorated among the budgets of the individual active peacekeeping \noperations. \n \n89th plenary meeting \n29 June 2022 \n \n",
  "paragraphs": {
    "1": "Takes note of the report of the Secretary-General on the budget for the support account for peacekeeping operations for the period from 1 July 2022 to 30 June 2023 and the report of the Independent Audit Advisory Committee on the proposed budget of the Office of Internal Oversight Services under the support account for peacekeeping operations for the period from 1 July 2022 to 30 June 2023;",
    "2": "Reaffirms its role in carrying out a thorough analysis and approval of human and financial resources and policies with a view to ensuring the full, effective and efficient implementation of all mandated programmes and activities and the implementation of policies in this regard;",
    "3": "Also reaffirms that the Fifth Committee is the appropriate Main Committee of the General Assembly entrusted with responsibility for administrative and budgetary matters;",
    "4": "Further reaffirms rule 153 of its rules of procedure;",
    "5": "Reaffirms that the support account funds shall be used for the sole purpose of financing human resources and non-human resources requirements for backstopping and supporting peacekeeping operations at Headquarters, and that any changes in this limitation require the prior approval of the General Assembly;",
    "6": "Also reaffirms the need for adequate funding for the backstopping of peacekeeping operations, as well as the need for full justification for that funding in support account budget submissions;",
    "7": "Further reaffirms the need for effective and efficient administration and financial management of peacekeeping operations, and urges the Secretary-General to continue to identify measures to increase the productivity and efficiency of the support account;",
    "8": "Requests the Secretary-General to ensure the full implementation of the relevant provisions of its resolutions 59/296 of 22 June 2005, 60/266 of 30 June 2006, 61/276 of 29 June 2007, 64/269 of 24 June 2010, 65/289 of 30 June 2011, 66/264 of 21 June 2012, 69/307 of 25 June 2015, 70/286 of 17 June 2016, 76/274 of 29 June 2022 and its other relevant resolutions;",
    "9": "Endorses the conclusions and recommendations contained in the report of the Advisory Committee on Administrative and Budgetary Questions, subject to the provisions of the present resolution, and requests the Secretary-General to ensure their full implementation;",
    "10": "Decides to maintain, for the financial period from 1 July 2022 to 30 June 2023, the funding mechanism for the support account used in the current period, from 1 July 2021 to 30 June 2022, as approved in paragraph 3 of its resolution 50/221 B; Budget performance report for the period from 1 July 2020 to 30 June 2021",
    "11": "Takes note of the report of the Secretary-General on the budget performance of the support account for peacekeeping operations for the period from 1 July 2020 to 30 June 2021; Budget estimates for the financial period from 1 July 2022 to 30 June 2023",
    "12": "Approves the support account requirements in the amount of 371,787,000 United States dollars for the financial period from 1 July 2022 to 30 June 2023, inclusive of the amount of 17,196,900 dollars for the enterprise resource planning project, 868,500 dollars for the global service delivery model project, 3,881,600 dollars for peacekeeping capability readiness and 18,588,600 dollars for Umoja maintenance and support costs, including 1,354 continuing posts and 8 new temporary posts, as well as the abolishment, redeployment, reassignment and reclassification of posts, 55 continuing and 16 new general temporary assistance positions and 51.5 person-months, as well as related post and non-post requirements; Financing of the support account for peacekeeping operations for the financial periods from 1 July 2020 to 30 June 2021 and from 1 July 2022 to 30 June 2023",
    "13": " above, to be prorated among the budgets of the individual active peacekeeping operations."
  },
  "agenda_items": [
    "Item 150"
  ],
  "symbol_references": []
}