{
  "symbol": "A/RES/72/164",
  "filename": "A_RES_72_164.pdf",
  "title": "72/164. Strengthening the role of the United Nations in enhancing periodic and genuine elections and the promotion of democratization",
  "text": "United Nations \nA/RES/72/164\n \n \nGeneral Assembly \nDistr.: General \n25 January 2018 \n \n17-22973 (E)    301217     \n*1722973* \n \n \nSeventy-second session \nAgenda item 72 (b) \n \n \n \n \n Resolution adopted by the General Assembly \non 19 December 2017 \n \n \n \n \n[on the report of the Third Committee (A/72/439/Add.2)] \n \n \n 72/164. Strengthening the role of the United Nations in enhancing periodic \nand genuine elections and the promotion of democratization \n \n \n \nThe General Assembly, \n \nGuided by the purposes and principles of the Charter of the United Nations, \n \nReaffirming that democracy is a universal value based on the freely expressed \nwill of the people to determine their own political, economic, social and cultural \nsystems and their full participation in all aspects of their lives, \n \nReaffirming also that, while democracies share common features, there is no \nsingle model of democracy and that democracy does not belong to any country or \nregion, and reaffirming further the necessity of due respect for sovereignty and the \nright to self-determination, \n \nStressing that democracy, development and respect for all human rights and \nfundamental freedoms are interdependent and mutually reinforcing, \n \nReaffirming that Member States are responsible for organizing, conducting and \nensuring transparent, free and fair electoral processes and that Member States, in the \nexercise of their sovereignty, may request that international organizations provide \nadvisory services or assistance for strengthening and developing their electoral \ninstitutions and processes, including sending preliminary missions for that purpose, \n \nRecognizing the importance of fair, periodic and genuine elections, including in \nnew democracies and countries undergoing democratization, in order to empower \ncitizens to express their will and to promote successful transition to long-term \nsustainable democracies, \n \nRecognizing also that Member States are responsible for ensuring transparent, \nfree and fair elections, free of intimidation, coercion and tampering with vote counts, \nand that all such acts are sanctioned accordingly, \n\nA/RES/72/164 \nStrengthening the role of the United Nations in enhancing periodic\nand genuine elections and the promotion of democratization\n \n17-22973 \n2/6 \n \n \nEmphasizing that Member States are responsible for respecting the will of the \nvoters as expressed through genuine, periodic, free and fair elections, which shall be \nby universal and equal suffrage, and in this respect expressing serious concern about \nthe unconstitutional or unlawful disruption of representative governance and \ndemocratic institutions and the unlawful removal of any democratically elected \nofficials, whether by States or non-State actors, \n \nRecalling its previous resolutions on the subject, in particular resolution 70/168 \nof 17 December 2015, \n \nRecalling also all relevant Human Rights Council resolutions on the topic, \nincluding resolutions 19/11 of 22 March 2012,1 31/14 of 23 March 2016,2 31/37 of \n24 March 2016,2 33/22 of 30 September 20163 and 34/41 of 24 March 2017,4 \n \nReaffirming that United Nations electoral assistance and support for the \npromotion of democratization are provided only at the specific request of the Member \nState concerned, \n \nNoting with satisfaction that an increasing number of Member States are using \nelections as a peaceful means of discerning the will of the people, which builds \nconfidence in representational governance and contributes to greater national peace \nand stability, and which may contribute to regional peace and stability, \n \nRecalling the Universal Declaration of Human Rights, adopted on 10 December \n1948,5 in particular the principle that the will of the people, as expressed through \nperiodic and genuine elections, shall be the basis of government authority, as well as \nthe right freely to choose representatives through periodic and genuine elections, \nwhich shall be by universal and equal suffrage and shall be held by secret vote or by \nequivalent free voting procedures, \n \nReaffirming the International Covenant on Civil and Political Rights, 6 the \nConvention on the Elimination of All Forms of Discrimination against Women,7 the \nInternational Convention on the Elimination of All Forms of Racial Discrimination 8 \nand the Convention on the Rights of Persons with Disabilities, 9 and reaffirming also \nthat no distinctions are permitted among citizens on any grounds, such as race, colour, \nsex, language, religion, political or other opinion, national or social origin, property, \nbirth or other status, or on the basis of disability, in the enjoyment of the right to \nparticipate, directly or through freely chosen representatives, and to vote and to be \nelected in genuine periodic elections, which shall be by universal and equal suffrage \nand shall be held by secret ballot, guaranteeing the free expression of the will of the \nelectors, \n \nReaffirming also that the promotion and protection of human rights and \nfundamental freedoms at the national and international levels should be universal and \nconducted without conditions attached and that the international community should \nsupport the strengthening and promotion of democracy, development and respect for \nhuman rights and fundamental freedoms in the entire world, 10  \n__________________ \n \n1  See Official Records of the General Assembly, Sixty-seventh Session, Supplement No. 53 and \ncorrigendum (A/67/53 and A/67/53/Corr.1), chap. III, sect. A. \n \n2  Ibid., Seventy-first Session, Supplement No. 53 (A/71/53), chap. IV, sect. A. \n \n3  Ibid., Supplement No. 53A and corrigendum (A/71/53/Add.1 and A/71/53/Add.1/Corr.1), chap. II. \n \n4  Ibid., Seventy-second Session, Supplement No. 53 (A/72/53), chap. IV, sect. A. \n \n5  Resolution 217 A (III). \n \n6  See resolution 2200 A (XXI), annex. \n \n7  United Nations, Treaty Series, vol. 1249, No. 20378. \n \n8  Ibid., vol. 660, No. 9464. \n \n9  Ibid., vol. 2515, No. 44910. \n \n10  A/CONF.157/24 (Part I), chap. III, para. 8. \n\nStrengthening the role of the United Nations in enhancing periodic \nand genuine elections and the promotion of democratization \nA/RES/72/164\n \n3/6 \n17-22973 \n \n \nUnderscoring the important role that regional and subregional organizations \nplay, in accordance with the Charter, in the areas of peace and security, development \nand human rights,11 and recalling their commitments to supporting the principles of \nfree and fair elections, \n \nReaffirming that the full and effective participation of women, on equal terms \nwith men, at all levels of decision-making is essential to the achievement of equality \nand social inclusion, sustainable development, peace and democracy, \n \nStressing the importance, generally and in the context of promoting free and fair \nelections, of respect for the freedoms of peaceful assembly and association and \nexpression, including the freedom to seek, receive and impart information, in \naccordance with the International Covenant on Civil and Political Rights, and noting \nin particular the fundamental importance of access to information and media freedom, \nincluding through accessible and easy-to-understand formats for new information and \ncommunications technologies, \n \nNoting that some countries are beginning to use online technology for balloting \npurposes, and reaffirming the right to privacy, according to which no one shall be \nsubjected to arbitrary or unlawful interference with his or her privacy, family, home \nor correspondence, and the right to the protection of the law against such interference, \nas set out in article 12 of the Universal Declaration of Human Rights and article 17 \nof the International Covenant on Civil and Political Rights, and that the same rights \nthat people have offline must also be protected online, \n \nRecognizing the need for strengthening democratic processes, electoral \ninstitutions and national capacity-building in requesting countries, including the \ncapacity to administer fair elections, promote voter education, the development of \nelectoral expertise and technology and the participation of women on equal terms \nwith men, take all appropriate measures to ensure the effective and full participation \nof all persons with disabilities on an equal basis with others, increase citizen \nparticipation and provide civic education, including to youth, in requesting countries \nin order to consolidate and regularize the achievements of previous elections and \nsupport subsequent elections, \n \nNoting the importance of ensuring orderly, open, fair and transparent democratic \nprocesses that protect the rights to peaceful assembly, association and freedom of \nexpression and opinion, \n \nNoting also that the international community can contribute to the creation of \nconditions which could foster stability and security throughout the pre-election, \nelection and post-election periods in transitional and post-conflict situations, \n \nReiterating that transparency is a fundamental basis for free and fair elections, \nwhich contribute to the accountability of Governments to their citizens, which, in \nturn, is an underpinning of democratic societies, \n \nAcknowledging, in this regard, the importance of international observation of \nelections for the promotion of free and fair elections and its contribution to enhancing \nthe integrity of election processes in requesting countries, to promoting public \nconfidence and electoral participation and to mitigating the potential for election-\nrelated disturbances, \n \nAcknowledging also that extending invitations regarding international electoral \nassistance and/or observation is the sovereign right of Member States, and welcoming \nthe decisions of those States that have requested such assistance and/or observation, \n__________________ \n \n11  Resolution 69/277, para. 2. \n\nA/RES/72/164 \nStrengthening the role of the United Nations in enhancing periodic\nand genuine elections and the promotion of democratization\n \n17-22973 \n4/6 \n \n \nRecalling its resolution 60/1 of 16 September 2005, entitled \u201c2005 World \nSummit Outcome\u201d, in which it welcomed the establishment by the Secretary-General \nof the United Nations Democracy Fund, \n \nWelcoming the support provided by Member States to the electoral assistance \nactivities of the United Nations, inter alia, through the provision of electoral experts, \nincluding electoral commission staff, and observers, as well as through contributions \nto the United Nations trust fund for electoral assistance, the democratic governance \nthematic trust fund of the United Nations Development Programme and the United \nNations Democracy Fund, \n \nRecognizing that electoral assistance, particularly through appropriate, \nsustainable, accessible and cost-effective electoral technology, can facilitate full \naccess for persons with disabilities and supports the electoral processes of developing \ncountries, \n \nRecognizing also the coordination challenges posed by the multiplicity of actors \ninvolved in electoral assistance both within and outside the United Nations, \n \nWelcoming the contributions made by international and regional organizations \nand also by non-governmental organizations to enhancing the effectiveness of the \nprinciple of periodic and genuine elections and the promotion of democratization, \n \nRecognizing the importance of the links that exist between development, peace, \nhuman rights, the rule of law, democracy and good governance, including the holding \nof free and fair elections, and in this regard welcoming the adoption of the 2030 \nAgenda for Sustainable Development,12  \n \n1. \nWelcomes the report of the Secretary-General on strengthening the role of \nthe United Nations in enhancing the effectiveness of the principle of periodic and \ngenuine elections and the promotion of democratization;13 \n \n2. \nCommends the electoral assistance provided upon request to Member \nStates by the United Nations, and requests that such assistance continue on a case-by-\ncase basis in accordance with the evolving needs and legislation of requesting \ncountries to develop, improve and refine their electoral institutions and processes, \nincluding by ensuring full access to all stages of the elections process for persons with \ndisabilities, recognizing that the responsibility for organizing free and fair elections \nlies with Governments; \n \n3. \nReaffirms that the electoral assistance provided by the United Nations \nshould continue to be carried out in an objective, impartial, neutral and independent \nmanner; \n \n4. \nRequests the Under-Secretary-General for Political Affairs, in his role as \nUnited Nations focal point for electoral assistance matters, to continue to regularly \ninform Member States about the requests received and the nature of any assistance \nprovided; \n \n5. \nRequests that the United Nations continue its efforts to ensure, before \nundertaking to provide electoral assistance to a requesting State, that there is adequate \ntime to organize and carry out an effective mission providing such assistance, \nincluding the provision of long-term technical cooperation, that conditions exist to \nallow a free and fair election and that the results of the mission will be reported \ncomprehensively and consistently; \n__________________ \n \n12  Resolution 70/1. \n \n13  A/72/260. \n\nStrengthening the role of the United Nations in enhancing periodic \nand genuine elections and the promotion of democratization \nA/RES/72/164\n \n5/6 \n17-22973 \n \n \n6. \nNotes the importance of adequate resources for the administration of \nefficient and transparent elections at the national and local levels, and recommends \nthat Member States provide adequate resources for those elections, including by \nconsidering the possibility of establishing internal funding, where feasible; \n \n7. \nReaffirms the obligation of all States to take all appropriate measures to \nensure that every citizen has the effective right and opportunity to participate in \nelections on an equal basis; \n \n8. \nStrongly condemns any manipulation of election processes, coercion and \ntampering with vote counts, particularly when done by States, and calls upon all \nMember States to respect the rule of law, the human rights and fundamental freedoms \nof all persons and the will of voters as expressed through genuine, periodic, free and \nfair elections, which shall be by universal and equal suffrage, as well as by secret \nballot, thereby fostering conditions in which all citizens, regardless of how they \nvoted, whom they supported or whether their candidates prevailed, have the \nmotivation and incentive, as well as the right and opportunity, to continue to \nparticipate directly or through elected representatives in the conduct of public affairs \nand their Government; \n \n9. \nCalls upon all States to ensure that persons with disabilities can effectively \nand fully participate in political and public life on an equal basis with others, directly \nor through freely chosen representatives, including the right and opportunity for \npersons with disabilities to vote and to be elected; \n \n10. Also calls upon all States to enhance the political participation of women, \naccelerate the achievement of equality between men and women and, in all situations, \npromote and protect the human rights of women with respect to voting in elections \nand public referendums and being eligible for election to publicly elected bodies on \nequal terms with men; \n \n11. \nRecommends that, throughout the timespan of the entire electoral cycle, \nincluding before and after elections, as appropriate, on the basis of a needs assessment \nand in accordance with the evolving needs of requesting Member States, bearing in \nmind sustainability and cost-effectiveness, the United Nations continue to provide \ntechnical advice and other assistance to requesting States and electoral institutions in \norder to help to strengthen their democratic processes, also bearing in mind that the \nrelevant office may provide additional assistance in the form of mediation and good \noffices, upon the request of Member States; \n \n12. Notes with appreciation the additional efforts being made to enhance \ncooperation \nwith other international, \ngovernmental \nand \nnon-governmental \norganizations in order to facilitate more comprehensive and needs-specific responses \nto requests for electoral assistance, encourages those organizations to share \nknowledge and experience in order to promote best practices in the assistance they \nprovide and in their reporting on electoral processes, and expresses its appreciation \nto those Member States, regional organizations and non-governmental organizations \nthat have provided observers or technical experts in support of United Nations \nelectoral assistance efforts; \n \n13. Acknowledges the aim of harmonizing the methods and standards of the \nmany intergovernmental and non-governmental organizations engaged in observing \nelections, and in this regard expresses appreciation for the Declaration of Principles \nfor International Election Observation and the Code of Conduct for International \nElection Observers, which elaborate guidelines for international electoral \nobservation; \n\nA/RES/72/164 \nStrengthening the role of the United Nations in enhancing periodic\nand genuine elections and the promotion of democratization\n \n17-22973 \n6/6 \n \n \n14. Recalls the establishment by the Secretary-General of the United Nations \ntrust fund for electoral assistance, and, bearing in mind that the fund is currently close \nto depletion, calls upon Member States to consider contributing to the fund; \n \n15. Encourages the Secretary-General, through the United Nations focal point \nfor electoral assistance matters and with the support of the Electoral Assistance \nDivision of the Department of Political Affairs of the Secretariat, to continue to \nrespond to the evolving nature of requests for assistance and the growing need for \nspecific types of medium-term expert assistance aimed at supporting and \nstrengthening the existing capacity of the requesting Government, in particular by \nenhancing the capacity of national electoral institutions; \n \n16. Requests the Secretary-General to provide the Electoral Assistance \nDivision with adequate human and financial resources to allow it to carry out its \nmandate, including to enhance the accessibility and diversity of the roster of electoral \nexperts and the electoral institutional memory of the Organization, and to continue to \nensure that the Office of the United Nations High Commissioner for Human Rights is \nable to respond, within its mandate and in close coordination with the Division, to the \nnumerous and increasingly complex and comprehensive requests from Member States \nfor advisory services; \n \n17. Reiterates the need for ongoing comprehensive coordination, under the \nauspices of the United Nations focal point for electoral assistance matters, between \nthe Electoral Assistance Division, the United Nations Development Programme, the \nDepartment of Peacekeeping Operations and the Department of Field Support of the \nSecretariat and the Office of the High Commissioner to ensure coordination and \ncoherence and avoid duplication of United Nations electoral assistance; \n \n18. Requests the United Nations Development Programme to continue its \ndemocratic governance assistance programmes in cooperation with other relevant \norganizations, in particular those that promote the strengthening of democratic \ninstitutions and linkages between civil society and Governments; \n \n19. Reiterates the role of civil society and the importance of its active \nengagement in the promotion of democratization, and invites Member States to \nfacilitate the full participation of civil society in electoral processes; \n \n20. Also reiterates the importance of reinforced coordination within and \noutside the United Nations system, and reaffirms the clear leadership role within the \nUnited Nations system of the United Nations focal point for electoral assistance \nmatters, including in ensuring system-wide coherence and consistency and in \nstrengthening the institutional memory and the development, dissemination and \nissuance of United Nations electoral assistance policies; \n \n21. Requests the Secretary-General to report to the General Assembly at its \nseventy-fourth session on the implementation of the present resolution, in particular \non the status of requests from Member States for electoral assistance, and on his \nefforts to enhance support by the Organization for the democratization process in \nMember States. \n \n73rd plenary meeting \n19 December 2017 \n \n",
  "paragraphs": {
    "1": "Welcomes the report of the Secretary-General on strengthening the role of the United Nations in enhancing the effectiveness of the principle of periodic and genuine elections and the promotion of democratization;13",
    "2": "Commends the electoral assistance provided upon request to Member States by the United Nations, and requests that such assistance continue on a case-by- case basis in accordance with the evolving needs and legislation of requesting countries to develop, improve and refine their electoral institutions and processes, including by ensuring full access to all stages of the elections process for persons with disabilities, recognizing that the responsibility for organizing free and fair elections lies with Governments;",
    "3": "Reaffirms that the electoral assistance provided by the United Nations should continue to be carried out in an objective, impartial, neutral and independent manner;",
    "4": "Requests the Under-Secretary-General for Political Affairs, in his role as United Nations focal point for electoral assistance matters, to continue to regularly inform Member States about the requests received and the nature of any assistance provided;",
    "5": "Requests that the United Nations continue its efforts to ensure, before undertaking to provide electoral assistance to a requesting State, that there is adequate time to organize and carry out an effective mission providing such assistance, including the provision of long-term technical cooperation, that conditions exist to allow a free and fair election and that the results of the mission will be reported comprehensively and consistently; __________________ 12 Resolution 70/1. 13 A/72/260. Strengthening the role of the United Nations in enhancing periodic and genuine elections and the promotion of democratization A/RES/72/164 5/6 17-22973",
    "6": "Notes the importance of adequate resources for the administration of efficient and transparent elections at the national and local levels, and recommends that Member States provide adequate resources for those elections, including by considering the possibility of establishing internal funding, where feasible;",
    "7": "Reaffirms the obligation of all States to take all appropriate measures to ensure that every citizen has the effective right and opportunity to participate in elections on an equal basis;",
    "8": "Strongly condemns any manipulation of election processes, coercion and tampering with vote counts, particularly when done by States, and calls upon all Member States to respect the rule of law, the human rights and fundamental freedoms of all persons and the will of voters as expressed through genuine, periodic, free and fair elections, which shall be by universal and equal suffrage, as well as by secret ballot, thereby fostering conditions in which all citizens, regardless of how they voted, whom they supported or whether their candidates prevailed, have the motivation and incentive, as well as the right and opportunity, to continue to participate directly or through elected representatives in the conduct of public affairs and their Government;",
    "9": "Calls upon all States to ensure that persons with disabilities can effectively and fully participate in political and public life on an equal basis with others, directly or through freely chosen representatives, including the right and opportunity for persons with disabilities to vote and to be elected;",
    "10": "Also calls upon all States to enhance the political participation of women, accelerate the achievement of equality between men and women and, in all situations, promote and protect the human rights of women with respect to voting in elections and public referendums and being eligible for election to publicly elected bodies on equal terms with men;",
    "11": "Recommends that, throughout the timespan of the entire electoral cycle, including before and after elections, as appropriate, on the basis of a needs assessment and in accordance with the evolving needs of requesting Member States, bearing in mind sustainability and cost-effectiveness, the United Nations continue to provide technical advice and other assistance to requesting States and electoral institutions in order to help to strengthen their democratic processes, also bearing in mind that the relevant office may provide additional assistance in the form of mediation and good offices, upon the request of Member States;",
    "12": "Notes with appreciation the additional efforts being made to enhance cooperation with other international, governmental and non-governmental organizations in order to facilitate more comprehensive and needs-specific responses to requests for electoral assistance, encourages those organizations to share knowledge and experience in order to promote best practices in the assistance they provide and in their reporting on electoral processes, and expresses its appreciation to those Member States, regional organizations and non-governmental organizations that have provided observers or technical experts in support of United Nations electoral assistance efforts;",
    "13": "Acknowledges the aim of harmonizing the methods and standards of the many intergovernmental and non-governmental organizations engaged in observing elections, and in this regard expresses appreciation for the Declaration of Principles for International Election Observation and the Code of Conduct for International Election Observers, which elaborate guidelines for international electoral observation; A/RES/72/164 Strengthening the role of the United Nations in enhancing periodic and genuine elections and the promotion of democratization 17-22973 6/6",
    "14": "Recalls the establishment by the Secretary-General of the United Nations trust fund for electoral assistance, and, bearing in mind that the fund is currently close to depletion, calls upon Member States to consider contributing to the fund;",
    "15": "Encourages the Secretary-General, through the United Nations focal point for electoral assistance matters and with the support of the Electoral Assistance Division of the Department of Political Affairs of the Secretariat, to continue to respond to the evolving nature of requests for assistance and the growing need for specific types of medium-term expert assistance aimed at supporting and strengthening the existing capacity of the requesting Government, in particular by enhancing the capacity of national electoral institutions;",
    "16": "Requests the Secretary-General to provide the Electoral Assistance Division with adequate human and financial resources to allow it to carry out its mandate, including to enhance the accessibility and diversity of the roster of electoral experts and the electoral institutional memory of the Organization, and to continue to ensure that the Office of the United Nations High Commissioner for Human Rights is able to respond, within its mandate and in close coordination with the Division, to the numerous and increasingly complex and comprehensive requests from Member States for advisory services;",
    "17": "Reiterates the need for ongoing comprehensive coordination, under the auspices of the United Nations focal point for electoral assistance matters, between the Electoral Assistance Division, the United Nations Development Programme, the Department of Peacekeeping Operations and the Department of Field Support of the Secretariat and the Office of the High Commissioner to ensure coordination and coherence and avoid duplication of United Nations electoral assistance;",
    "18": "Requests the United Nations Development Programme to continue its democratic governance assistance programmes in cooperation with other relevant organizations, in particular those that promote the strengthening of democratic institutions and linkages between civil society and Governments;",
    "19": "Reiterates the role of civil society and the importance of its active engagement in the promotion of democratization, and invites Member States to facilitate the full participation of civil society in electoral processes;",
    "20": "Also reiterates the importance of reinforced coordination within and outside the United Nations system, and reaffirms the clear leadership role within the United Nations system of the United Nations focal point for electoral assistance matters, including in ensuring system-wide coherence and consistency and in strengthening the institutional memory and the development, dissemination and issuance of United Nations electoral assistance policies;",
    "21": "Requests the Secretary-General to report to the General Assembly at its seventy-fourth session on the implementation of the present resolution, in particular on the status of requests from Member States for electoral assistance, and on his efforts to enhance support by the Organization for the democratization process in Member States. 73rd plenary meeting 19 December 2017"
  },
  "agenda_items": [
    "Item 72"
  ],
  "symbol_references": []
}