{
  "symbol": "A/RES/79/4",
  "filename": "A_RES_79_4.pdf",
  "title": "79/4. Report of the International Atomic Energy Agency",
  "text": "United Nations \nA/RES/79/4\n \nGeneral Assembly \nDistr.: General \n17 October 2024 \n24-19073 (E) \n*2419073* \n \n \nSeventy-ninth session \nAgenda item 89 \nReport of the International Atomic Energy Agency \n \n \n \n \n Resolution adopted by the General Assembly \non 15 October 2024 \n \n \n[without reference to a Main Committee (A/79/L.7)] \n \n \n \n79/4. Report of the International Atomic Energy Agency \n \n \n \nThe General Assembly, \n \nHaving received the report of the International Atomic Energy Agency for \n2023,1 \n \nTaking note of the statement by the Director General of the Agency, in which he \nprovided additional information on the main developments in the activities of the \nAgency during 2024, \n \nRecognizing the importance of the work of the Agency,  \n \nRecognizing also the cooperation between the United Nations and the Agency \nand the Agreement governing the relationship between the United Nations and the \nAgency as approved by the General Conference of the Agency on 23 October 1957 \nand by the General Assembly in the annex to its resolution 1145 (XII) of 14 November \n1957, \n \n1. \nTakes note with appreciation of the report of the International Atomic \nEnergy Agency; \n \n2. \nTakes note of resolutions GC(68)/RES/8, entitled \u201cNuclear and radiation \nsafety\u201d; GC(68)/RES/9, entitled \u201cNuclear security\u201d; GC(68)/RES/10, entitled \n\u201cStrengthening of the Agency\u2019s technical cooperation activities\u201d; GC(68)/RES/11, \nentitled \u201cStrengthening the Agency\u2019s activities related to nuclear science, technology \nand applications\u201d, comprising GC(68)/RES/11 A, entitled \u201cNon-power nuclear \napplications\u201d, GC(68)/RES/11 B, entitled \u201cNuclear power applications\u201d, and \nGC(68)/RES/11 C, entitled \u201cNuclear knowledge management\u201d; GC(68)/RES/12, \nentitled \u201cStrengthening the effectiveness and improving the efficiency of Agency \nsafeguards\u201d; GC(68)/RES/13, entitled \u201cImplementation of the NPT safeguards \n_______________ \n \n1 See A/79/266. \n\nA/RES/79/4 \nReport of the International Atomic Energy Agency\n \n24-19073\n2/2 \n \nagreement between the Agency and the Democratic People\u2019s Republic of Korea\u201d; \nGC(68)/RES/14, entitled \u201cApplication of IAEA safeguards in the Middle East\u201d; \nGC(68)/RES/15, entitled \u201cNuclear safety, security and safeguards in Ukraine\u201d; and \ndecisions GC(68)/DEC/9, entitled \u201cAmendment to Article XIV.A of the Statute\u201d; and \nGC(68)/DEC/10, entitled \u201cPromotion of efficiency and effectiveness of the IAEA \ndecision making process\u201d, adopted by the General Conference of the Agency at its \nsixty-eighth regular session, held from 16 to 20 September 2024;  \n \n3. \nReaffirms its strong support for the indispensable role of the Agency in \nencouraging and assisting the development and practical application of atomic energy \nfor peaceful uses, in technology transfer to developing countries and in nuclear safety, \nverification and security; \n \n4. \nAppeals to Member States to continue to support the activities of the \nAgency;  \n \n5. \nRequests the Secretary-General to transmit to the Director General of the \nAgency the records of the seventy-ninth session of the General Assembly relating to \nthe activities of the Agency. \n \n22nd plenary meeting \n15 October 2024 \n \n",
  "paragraphs": {
    "1": "Takes note with appreciation of the report of the International Atomic Energy Agency;",
    "2": "Takes note of resolutions GC(68)/RES/8, entitled \u201cNuclear and radiation safety\u201d; GC(68)/RES/9, entitled \u201cNuclear security\u201d; GC(68)/RES/10, entitled \u201cStrengthening of the Agency\u2019s technical cooperation activities\u201d; GC(68)/RES/11, entitled \u201cStrengthening the Agency\u2019s activities related to nuclear science, technology and applications\u201d, comprising GC(68)/RES/11 A, entitled \u201cNon-power nuclear applications\u201d, GC(68)/RES/11 B, entitled \u201cNuclear power applications\u201d, and GC(68)/RES/11 C, entitled \u201cNuclear knowledge management\u201d; GC(68)/RES/12, entitled \u201cStrengthening the effectiveness and improving the efficiency of Agency safeguards\u201d; GC(68)/RES/13, entitled \u201cImplementation of the NPT safeguards agreement between the Agency and the Democratic People\u2019s Republic of Korea\u201d; GC(68)/RES/14, entitled \u201cApplication of IAEA safeguards in the Middle East\u201d; GC(68)/RES/15, entitled \u201cNuclear safety, security and safeguards in Ukraine\u201d; and decisions GC(68)/DEC/9, entitled \u201cAmendment to Article XIV.A of the Statute\u201d; and GC(68)/DEC/10, entitled \u201cPromotion of efficiency and effectiveness of the IAEA decision making process\u201d, adopted by the General Conference of the Agency at its sixty-eighth regular session, held from 16 to 20 September 2024;",
    "3": "Reaffirms its strong support for the indispensable role of the Agency in encouraging and assisting the development and practical application of atomic energy for peaceful uses, in technology transfer to developing countries and in nuclear safety, verification and security;",
    "4": "Appeals to Member States to continue to support the activities of the Agency;",
    "5": "Requests the Secretary-General to transmit to the Director General of the Agency the records of the seventy-ninth session of the General Assembly relating to the activities of the Agency."
  },
  "agenda_items": [
    "Item 89"
  ],
  "symbol_references": [
    "A/79/L.7"
  ]
}