{
  "symbol": "A/RES/72/184",
  "filename": "A_RES_72_184.pdf",
  "title": "72/184. Effective promotion of the Declaration on the Rights of Persons Belonging to National or Ethnic, Religious and Linguistic Minorities",
  "text": "United Nations \nA/RES/72/184\n \n \nGeneral Assembly \nDistr.: General \n29 January 2018 \n \n17-23176 (E)    010218     \n*1723176* \n \n \nSeventy-second session \nAgenda item 72 (b) \n \n \n \n \n Resolution adopted by the General Assembly \non 19 December 2017 \n \n \n \n \n[on the report of the Third Committee (A/72/439/Add.2)] \n \n \n 72/184. Effective promotion of the Declaration on the Rights of Persons \nBelonging to National or Ethnic, Religious and Linguistic Minorities \n \n \n \nThe General Assembly, \n \nRecalling its resolution 47/135 of 18 December 1992, by which it adopted the \nDeclaration on the Rights of Persons Belonging to National or Ethnic, Religious and \nLinguistic Minorities annexed to that resolution, and bearing in mind article 27 of the \nInternational Covenant on Civil and Political Rights 1 as well as other relevant existing \ninternational and regional standards and national legislation, \n \nRecalling also its subsequent resolutions on the effective promotion of the \nDeclaration and all relevant resolutions of the Human Rights Council, \n \nAffirming that the promotion and protection of the rights of persons belonging \nto national or ethnic, religious and linguistic minorities and dialogue between these \nminorities and the rest of society, as well as the constructive and inclusive \ndevelopment of practices and institutional arrangements to accommodate diversity \nwithin societies, contribute to political and social stability and the prevention and \npeaceful resolution of conflicts involving the rights of persons belonging to national \nor ethnic, religious and linguistic minorities, \n \nWelcoming the adoption of the 2030 Agenda for Sustainable Development, 2 of \nwhich the Addis Ababa Action Agenda of the Third International Conference on \nFinancing for Development3 is an integral part, recalling that the Sustainable \nDevelopment Goals and targets seek to realize the human rights of all, and stressing \nthe need for Member States to integrate the 2030 Agenda into their respective national \npolicies and development frameworks, as appropriate, to promote the effective \nimplementation, follow-up and review of the 2030 Agenda, in order to ensure that no \none is left behind, \n__________________ \n \n1 See resolution 2200 A (XXI), annex. \n \n2  Resolution 70/1. \n \n3  Resolution 69/313, annex. \n\nA/RES/72/184 \nEffective promotion of the Declaration on the Rights of Persons Belonging\nto National or Ethnic, Religious and Linguistic Minorities\n \n17-23176 \n2/6 \n \n \nExpressing concern at the frequency and severity of disputes and conflicts \ninvolving persons belonging to national or ethnic, religious and linguistic minorities \nin many countries and their often tragic consequences, and that such persons often \nsuffer disproportionately from the effects of conflicts resulting in the violation of their \nhuman rights and are particularly vulnerable to displacement through, inter alia, \npopulation transfers, revocation of previously held identity documents, refugee flows \nand forced relocation, \n \nEmphasizing the need for reinforced efforts to realize the rights of persons \nbelonging to national or ethnic, religious and linguistic minorities, including by \naddressing economic and social conditions and marginalization, as well as to end any \ntype of discrimination against them, including by addressing multiple, aggravated and \nintersecting forms of discrimination, \n \nEmphasizing also the fundamental importance of human rights education, \ntraining and learning as well as of dialogue, including intercultural and interfaith \ndialogue, and interaction among all relevant stakeholders and members of society on \nthe promotion and protection of the rights of persons belonging to national or ethnic, \nreligious and linguistic minorities, \n \nRecognizing the importance of realizing the right to education for all and, \nwherever possible, providing persons belonging to national or ethnic, religious and \nlinguistic minorities with adequate opportunities to learn their own language or to \nhave instruction in their own language, \n \nAffirming that the twenty-fifth anniversary of the adoption of the Declaration \noffers an important opportunity to intensify efforts to promote and protect the rights \nof persons belonging to national or ethnic, religious and linguistic minorities, \nincluding by taking stock of, and sharing among States and other stakeholders \ninformation on, the achievements, best practices and challenges with regard to the \nimplementation of the Declaration, the diverse ways in which it has been used and \nimplemented in practice at the local, national, regional and international levels and \nthe impact that it has had on national legislation, policies and practices and \ninstitutional mechanisms and their activities and programmes to advance the rights of \npersons belonging to national or ethnic, religious and linguistic minorities, as well as \nthe effect that it has had on the ground, \n \nEmphasizing the important role that national institutions can play in the \npromotion and protection of the rights of persons belonging to national or ethnic, \nreligious and linguistic minorities, and acknowledging the role that the United \nNations, its specialized agencies and other relevant organizations, and the Special \nRapporteur of the Human Rights Council on minority issues, play in this regard by, \ninter alia, promoting the implementation of the Declaration, \n \n1. \nReaffirms the obligation of States to ensure that persons belonging to \nnational or ethnic, religious and linguistic minorities may exercise fully and \neffectively all human rights and fundamental freedoms without any discrimination \nand in full equality before the law, as proclaimed in the Declaration on the Rights of \nPersons Belonging to National or Ethnic, Religious and Linguistic Minorities, 4 and \ndraws attention to the relevant provisions of the Durban Declaration and Programme \nof Action,5 including the provisions on forms of multiple discrimination; \n \n2. \nUrges States and the international community to promote and protect the \nrights of persons belonging to national or ethnic, religious and linguistic minorities, \nas set out in the Declaration, including through the encouragement of conditions for \n__________________ \n \n4  Resolution 47/135, annex. \n \n5  See A/CONF.189/12 and A/CONF.189/12/Corr.1, chap. I. \n\nEffective promotion of the Declaration on the Rights of Persons Belonging \nto National or Ethnic, Religious and Linguistic Minorities \nA/RES/72/184\n \n3/6 \n17-23176 \n \nthe promotion of their identity, the provision of adequate education and the \nfacilitation of their participation in all aspects of the political, economic, social, \nreligious and cultural life of society and in the economic progress and development \nof their country, without discrimination, and to apply a gender perspective while \ndoing so; \n \n3. \nEncourages States to take appropriate measures so that, wherever possible, \npersons belonging to national or ethnic, religious and linguistic minorities may have \nadequate opportunities to learn their own language or to have instruction in their own \nlanguage; \n \n4. \nUrges States to take all appropriate measures, inter alia, constitutional, \nlegislative, administrative and other measures, for the promotion and implementation \nof the Declaration, and appeals to States to cooperate bilaterally and multilaterally, in \nparticular on the exchange of best practices and lessons learned, in accordance with \nthe Declaration, in order to promote and protect the rights of persons belonging to \nnational or ethnic, religious and linguistic minorities; \n \n5. \nRecommends that States use the twenty-fifth anniversary of the \nDeclaration as an opportunity to reflect on current and emerging challenges facing \npersons belonging to national or ethnic, religious and linguistic minorities, including \nthe rise in persecution on religious and ethnic grounds and increasing levels of hate \ncrimes and hate speech targeting, among others, persons belonging to national or \nethnic, religious and linguistic minorities; \n \n6. \nAlso recommends that States ensure that all measures taken with a view to \nimplementing the Declaration are, to the fullest extent possible, developed, designed, \nimplemented and reviewed with the full, effective and equal participation of persons \nbelonging to national or ethnic, religious and linguistic minorities; \n \n7. \nCalls upon States to take all appropriate measures to ensure the protection \nof children belonging to national or ethnic, religious and linguistic minorities who are \nat risk of or have experienced violence, in accordance with the relevant obligations \nunder the Convention on the Rights of the Child,6 and of women who can be exposed \nto both gender-based violence and violence on the grounds of their belonging to \nnational or ethnic, religious and linguistic minorities, and to give special attention to \nthe situation and specific needs of older persons and persons with disabilities \nbelonging to national or ethnic, religious and linguistic minorities; \n \n8. \nRecommends that States and other relevant actors ensure to the fullest \nextent possible that the Declaration is translated into all minority languages and \ndisseminated widely; \n \n9. \nExpresses its appreciation for the successful completion, in November \n2016, of the ninth session of the Forum on Minority Issues, on the theme \u201cMinorities \nin situations of humanitarian crises\u201d, which, through the widespread participation of \nstakeholders, provided an important platform for the promotion of dialogue on this \ntopic and, as part of its outcome, produced recommendations to prevent crises and the \ndisproportionate effect of crises on persons belonging to national or ethnic, religious \nand linguistic minorities, promote respect for the rights of persons belonging to \nnational or ethnic, religious and linguistic minorities during crises and ensure durable \nsolutions for persons belonging to national or ethnic, religious and linguistic \nminorities after crises,7 and encourages States to take into consideration the relevant \nrecommendations of the Forum; \n__________________ \n \n6  United Nations, Treaty Series, vol. 1577, No. 27531. \n \n7  A/HRC/34/68. \n\nA/RES/72/184 \nEffective promotion of the Declaration on the Rights of Persons Belonging\nto National or Ethnic, Religious and Linguistic Minorities\n \n17-23176 \n4/6 \n \n \n10. Calls upon States, while bearing in mind the theme of the ninth session of \nthe Forum and with a view to enhancing the implementation of the Declaration and \nensuring the realization of the rights of persons belonging to national or ethnic, \nreligious and linguistic minorities, to take appropriate measures by, inter alia: \n \n(a) \nReviewing any legislation, policy or practice that has a discriminatory or \ndisproportionately negative effect on persons belonging to national or ethnic, \nreligious and linguistic minorities and that may render them vulnerable, with a view \nto considering its amendment;  \n \n(b) \nEnhancing efforts to prevent and combat acts of violence specifically \ntargeting persons belonging to national or ethnic, religious and linguistic minorities; \n \n(c) \nStrongly condemning any advocacy of national, racial or religious hatred \nthat constitutes incitement to discrimination, hostility or violence, and adopting and \nimplementing measures to criminalize incitement to imminent violence based on \nnationality, race, religion or belief, while respecting all internationally recognized \nhuman rights and fundamental freedoms;  \n \n(d) \nDeveloping effective and adequate disaster risk reduction programmes that \ninclude measures to enhance the preparedness of potentially affected populations and, \nwhere necessary, address the specific needs of persons belonging to national or ethnic, \nreligious and linguistic minorities;  \n \n(e) \nEnsuring that protection responses are participatory, non-discriminatory \nand sensitive to the specific needs of persons belonging to national or ethnic, religious \nand linguistic minorities;  \n \n(f) \nEnsuring the restoration or reissuance of identity documents to persons \nbelonging to national or ethnic, religious and linguistic minorities after a \nhumanitarian emergency, including documents such as birth certificates or nationality \ndocumentation, so that the risk of statelessness is prevented; \n \n(g) \nEnsuring that persons belonging to national or ethnic, religious and \nlinguistic minorities affected by displacement are adequately included, on an equal \nbasis with other persons affected, in any durable solution, strategy or displacement-\nfocused policy developed following the displacement of a population; \n \n11. \nAlso calls upon States to integrate the promotion and protection of the \nrights of persons belonging to national or ethnic, religious and linguistic minorities, \nas well as effective non-discrimination and equality for all, into strategies for the \nprevention and resolution of conflicts involving these minorities, while ensuring their \nfull and effective participation in the design, implementation and evaluation of such \nstrategies; \n \n12. Takes note of the report of the Secretary-General on the effective \npromotion of the Declaration8 and the reports of the Special Rapporteur of the Human \nRights Council on minority issues, and their special focus on minorities in situations \nof humanitarian crises9 and on main concerns and recommendations from all thematic \nreports;10 \n \n13. Commends the Special Rapporteur for the work that has been done and the \nimportant role played in raising the level of awareness of and in giving added \nvisibility to the rights of persons belonging to national or ethnic, religious and \nlinguistic minorities; \n__________________ \n \n8  A/72/219. \n \n9  A/71/254. \n \n10  A/72/165. \n\nEffective promotion of the Declaration on the Rights of Persons Belonging \nto National or Ethnic, Religious and Linguistic Minorities \nA/RES/72/184\n \n5/6 \n17-23176 \n \n \n14. Calls upon all States to cooperate with and assist the Special Rapporteur \nin the performance of the tasks and duties mandated to him, to provide him with all \nthe necessary information requested and to seriously consider responding promptly \nand favourably to the requests of the Special Rapporteur to visit their countries in \norder to enable him to fulfil his duties effectively; \n \n15. Encourages the specialized agencies, regional organizations, national \nhuman rights institutions and non-governmental organizations to develop regular \ndialogue and cooperation with the mandate holder, as well as to continue to contribute \nto the promotion and protection of the rights of persons belonging to national or \nethnic, religious and linguistic minorities; \n \n16. Calls upon the United Nations High Commissioner for Human Rights to \ncontinue to promote, within his mandate, the implementation of the Declaration, and \nto engage in a dialogue with Governments for that purpose and regularly update and \ndisseminate widely the United Nations Guide for Minorities; \n \n17. Welcomes the inter-agency cooperation among United Nations agencies, \nfunds and programmes on minority issues, led by the Office of the United Nations \nHigh Commissioner for Human Rights, and urges them to further increase their \ncoordination and cooperation by, inter alia, developing policies on the promotion and \nprotection of the rights of persons belonging to minorities, drawing also on relevant \noutcomes of the Forum and taking into account the work of relevant regional \norganizations; \n \n18. Calls upon the Secretary-General to make available, at the request of \nGovernments concerned, qualified expertise on minority issues, including in the \ncontext of the prevention and resolution of disputes and conflicts, to assist in \nresolving existing or potential situations involving minorities; \n \n19. Invites the human rights treaty bodies, as well as special procedures of the \nHuman Rights Council, to continue to give attention, within their respective \nmandates, to situations and rights of persons belonging to national or ethnic, religious \nand linguistic minorities and in this regard to take into consideration relevant \nrecommendations of the Forum; \n \n20. Invites the United Nations mechanisms and bodies, the specialized \nagencies and regional organizations, within their respective mandates, to continue to \ncontribute to the protection and the prevention of violations of the rights of persons \nbelonging to national or ethnic, religious and linguistic minorities, including by \nstrengthening cooperation in respect of information-gathering and improving the \ninformation flow between themselves and with States; \n \n21. Encourages regional intergovernmental bodies, within their respective \nregions, to promote greater attention to the rights of persons belonging to national or \nethnic, religious and linguistic minorities by, inter alia, actively raising awareness of \nand promoting the Declaration in their work, encouraging its implementation at the \nnational level and considering the creation of thematic and/or special mechanisms on \nthis issue; \n \n22. Encourages national human rights institutions to pay due attention to the \nrights of persons belonging to national or ethnic, religious and linguistic minorities, \nincluding by monitoring situations of potential threats for persons belonging to \nnational or ethnic, religious and linguistic minorities, and by investigating and \nreporting, in accordance with the principles relating to the status of national \ninstitutions for the promotion and protection of human rights (the Paris Principles) 11 \nand their respective mandates, episodes of targeted violence against persons \n__________________ \n \n11  Resolution 48/134, annex. \n\nA/RES/72/184 \nEffective promotion of the Declaration on the Rights of Persons Belonging\nto National or Ethnic, Religious and Linguistic Minorities\n \n17-23176 \n6/6 \n \nbelonging to minorities, including, when necessary, to regional and international \nbodies; \n \n23. Encourages civil society, including non-governmental organizations, to \npromote awareness of the Declaration and to review the extent to which it integrates \nthe rights of persons belonging to national or ethnic, religious and linguistic \nminorities and the Declaration into its work, as well as to inform persons belonging \nto national or ethnic, religious and linguistic minorities about their rights; \n \n24. Requests the Special Rapporteur to report annually to the General \nAssembly and include recommendations for effective strategies for the better \nimplementation of the rights of persons belonging to national or ethnic, religious and \nlinguistic minorities; \n \n25. Requests the Secretary-General to submit to the General Assembly at its \nseventy-fourth session a report on the implementation of the present resolution, \nincluding information on activities undertaken by Member States, the Office of the \nHigh Commissioner, the Special Rapporteur, relevant United Nations entities and \nother relevant stakeholders to enhance the implementation of the Declaration and to \nensure the realization of the rights of persons belonging to national or ethnic, religious \nand linguistic minorities, with a focus on the international legal and institutional \nframework for the protection of the rights of all persons belonging to national or \nethnic, religious and linguistic minorities; \n \n26. Decides to continue consideration of the question at its seventy-fourth \nsession under the item entitled \u201cPromotion and protection of human rights\u201d. \n \n73rd plenary meeting  \n19 December 2017 \n \n",
  "paragraphs": {
    "1": "Reaffirms the obligation of States to ensure that persons belonging to national or ethnic, religious and linguistic minorities may exercise fully and effectively all human rights and fundamental freedoms without any discrimination and in full equality before the law, as proclaimed in the Declaration on the Rights of Persons Belonging to National or Ethnic, Religious and Linguistic Minorities, 4 and draws attention to the relevant provisions of the Durban Declaration and Programme of Action,5 including the provisions on forms of multiple discrimination;",
    "2": "Urges States and the international community to promote and protect the rights of persons belonging to national or ethnic, religious and linguistic minorities, as set out in the Declaration, including through the encouragement of conditions for the promotion of their identity, the provision of adequate education and the facilitation of their participation in all aspects of the political, economic, social, religious and cultural life of society and in the economic progress and development of their country, without discrimination, and to apply a gender perspective while doing so;",
    "3": "Encourages States to take appropriate measures so that, wherever possible, persons belonging to national or ethnic, religious and linguistic minorities may have adequate opportunities to learn their own language or to have instruction in their own language;",
    "4": "Urges States to take all appropriate measures, inter alia, constitutional, legislative, administrative and other measures, for the promotion and implementation of the Declaration, and appeals to States to cooperate bilaterally and multilaterally, in particular on the exchange of best practices and lessons learned, in accordance with the Declaration, in order to promote and protect the rights of persons belonging to national or ethnic, religious and linguistic minorities;",
    "5": "Recommends that States use the twenty-fifth anniversary of the Declaration as an opportunity to reflect on current and emerging challenges facing persons belonging to national or ethnic, religious and linguistic minorities, including the rise in persecution on religious and ethnic grounds and increasing levels of hate crimes and hate speech targeting, among others, persons belonging to national or ethnic, religious and linguistic minorities;",
    "6": "Also recommends that States ensure that all measures taken with a view to implementing the Declaration are, to the fullest extent possible, developed, designed, implemented and reviewed with the full, effective and equal participation of persons belonging to national or ethnic, religious and linguistic minorities;",
    "7": "Calls upon States to take all appropriate measures to ensure the protection of children belonging to national or ethnic, religious and linguistic minorities who are at risk of or have experienced violence, in accordance with the relevant obligations under the Convention on the Rights of the Child,6 and of women who can be exposed to both gender-based violence and violence on the grounds of their belonging to national or ethnic, religious and linguistic minorities, and to give special attention to the situation and specific needs of older persons and persons with disabilities belonging to national or ethnic, religious and linguistic minorities;",
    "8": "Recommends that States and other relevant actors ensure to the fullest extent possible that the Declaration is translated into all minority languages and disseminated widely;",
    "9": "Expresses its appreciation for the successful completion, in November 2016, of the ninth session of the Forum on Minority Issues, on the theme \u201cMinorities in situations of humanitarian crises\u201d, which, through the widespread participation of stakeholders, provided an important platform for the promotion of dialogue on this topic and, as part of its outcome, produced recommendations to prevent crises and the disproportionate effect of crises on persons belonging to national or ethnic, religious and linguistic minorities, promote respect for the rights of persons belonging to national or ethnic, religious and linguistic minorities during crises and ensure durable solutions for persons belonging to national or ethnic, religious and linguistic minorities after crises,7 and encourages States to take into consideration the relevant recommendations of the Forum;",
    "10": "Calls upon States, while bearing in mind the theme of the ninth session of the Forum and with a view to enhancing the implementation of the Declaration and ensuring the realization of the rights of persons belonging to national or ethnic, religious and linguistic minorities, to take appropriate measures by, inter alia: (a) Reviewing any legislation, policy or practice that has a discriminatory or disproportionately negative effect on persons belonging to national or ethnic, religious and linguistic minorities and that may render them vulnerable, with a view to considering its amendment; (b) Enhancing efforts to prevent and combat acts of violence specifically targeting persons belonging to national or ethnic, religious and linguistic minorities; (c) Strongly condemning any advocacy of national, racial or religious hatred that constitutes incitement to discrimination, hostility or violence, and adopting and implementing measures to criminalize incitement to imminent violence based on nationality, race, religion or belief, while respecting all internationally recognized human rights and fundamental freedoms; (d) Developing effective and adequate disaster risk reduction programmes that include measures to enhance the preparedness of potentially affected populations and, where necessary, address the specific needs of persons belonging to national or ethnic, religious and linguistic minorities; (e) Ensuring that protection responses are participatory, non-discriminatory and sensitive to the specific needs of persons belonging to national or ethnic, religious and linguistic minorities; (f) Ensuring the restoration or reissuance of identity documents to persons belonging to national or ethnic, religious and linguistic minorities after a humanitarian emergency, including documents such as birth certificates or nationality documentation, so that the risk of statelessness is prevented; (g) Ensuring that persons belonging to national or ethnic, religious and linguistic minorities affected by displacement are adequately included, on an equal basis with other persons affected, in any durable solution, strategy or displacement- focused policy developed following the displacement of a population;",
    "11": "Also calls upon States to integrate the promotion and protection of the rights of persons belonging to national or ethnic, religious and linguistic minorities, as well as effective non-discrimination and equality for all, into strategies for the prevention and resolution of conflicts involving these minorities, while ensuring their full and effective participation in the design, implementation and evaluation of such strategies;",
    "12": "Takes note of the report of the Secretary-General on the effective promotion of the Declaration8 and the reports of the Special Rapporteur of the Human Rights Council on minority issues, and their special focus on minorities in situations of humanitarian crises9 and on main concerns and recommendations from all thematic reports;10",
    "13": "Commends the Special Rapporteur for the work that has been done and the important role played in raising the level of awareness of and in giving added visibility to the rights of persons belonging to national or ethnic, religious and linguistic minorities;",
    "14": "Calls upon all States to cooperate with and assist the Special Rapporteur in the performance of the tasks and duties mandated to him, to provide him with all the necessary information requested and to seriously consider responding promptly and favourably to the requests of the Special Rapporteur to visit their countries in order to enable him to fulfil his duties effectively;",
    "15": "Encourages the specialized agencies, regional organizations, national human rights institutions and non-governmental organizations to develop regular dialogue and cooperation with the mandate holder, as well as to continue to contribute to the promotion and protection of the rights of persons belonging to national or ethnic, religious and linguistic minorities;",
    "16": "Calls upon the United Nations High Commissioner for Human Rights to continue to promote, within his mandate, the implementation of the Declaration, and to engage in a dialogue with Governments for that purpose and regularly update and disseminate widely the United Nations Guide for Minorities;",
    "17": "Welcomes the inter-agency cooperation among United Nations agencies, funds and programmes on minority issues, led by the Office of the United Nations High Commissioner for Human Rights, and urges them to further increase their coordination and cooperation by, inter alia, developing policies on the promotion and protection of the rights of persons belonging to minorities, drawing also on relevant outcomes of the Forum and taking into account the work of relevant regional organizations;",
    "18": "Calls upon the Secretary-General to make available, at the request of Governments concerned, qualified expertise on minority issues, including in the context of the prevention and resolution of disputes and conflicts, to assist in resolving existing or potential situations involving minorities;",
    "19": "Invites the human rights treaty bodies, as well as special procedures of the Human Rights Council, to continue to give attention, within their respective mandates, to situations and rights of persons belonging to national or ethnic, religious and linguistic minorities and in this regard to take into consideration relevant recommendations of the Forum;",
    "20": "Invites the United Nations mechanisms and bodies, the specialized agencies and regional organizations, within their respective mandates, to continue to contribute to the protection and the prevention of violations of the rights of persons belonging to national or ethnic, religious and linguistic minorities, including by strengthening cooperation in respect of information-gathering and improving the information flow between themselves and with States;",
    "21": "Encourages regional intergovernmental bodies, within their respective regions, to promote greater attention to the rights of persons belonging to national or ethnic, religious and linguistic minorities by, inter alia, actively raising awareness of and promoting the Declaration in their work, encouraging its implementation at the national level and considering the creation of thematic and/or special mechanisms on this issue;",
    "22": "Encourages national human rights institutions to pay due attention to the rights of persons belonging to national or ethnic, religious and linguistic minorities, including by monitoring situations of potential threats for persons belonging to national or ethnic, religious and linguistic minorities, and by investigating and reporting, in accordance with the principles relating to the status of national institutions for the promotion and protection of human rights (the Paris Principles) 11 and their respective mandates, episodes of targeted violence against persons belonging to minorities, including, when necessary, to regional and international bodies;",
    "23": "Encourages civil society, including non-governmental organizations, to promote awareness of the Declaration and to review the extent to which it integrates the rights of persons belonging to national or ethnic, religious and linguistic minorities and the Declaration into its work, as well as to inform persons belonging to national or ethnic, religious and linguistic minorities about their rights;",
    "24": "Requests the Special Rapporteur to report annually to the General Assembly and include recommendations for effective strategies for the better implementation of the rights of persons belonging to national or ethnic, religious and linguistic minorities;",
    "25": "Requests the Secretary-General to submit to the General Assembly at its seventy-fourth session a report on the implementation of the present resolution, including information on activities undertaken by Member States, the Office of the High Commissioner, the Special Rapporteur, relevant United Nations entities and other relevant stakeholders to enhance the implementation of the Declaration and to ensure the realization of the rights of persons belonging to national or ethnic, religious and linguistic minorities, with a focus on the international legal and institutional framework for the protection of the rights of all persons belonging to national or ethnic, religious and linguistic minorities;",
    "26": "Decides to continue consideration of the question at its seventy-fourth session under the item entitled \u201cPromotion and protection of human rights\u201d."
  },
  "agenda_items": [
    "Item 72"
  ],
  "symbol_references": []
}