{
  "symbol": "A/RES/79/70",
  "filename": "A_RES_79_70.pdf",
  "title": "79/70. United Nations regional centres for peace and disarmament",
  "text": "United Nations \nA/RES/79/70\n \n \nGeneral Assembly \nDistr.: General \n9 December 2024 \n \n24-23082 (E) \n*2423082* \n \n \nSeventy-ninth session \nAgenda item 99 (h)  \nReview and implementation of the Concluding Document \nof the Twelfth Special Session of the General Assembly: \nUnited Nations regional centres for peace and disarmament \n \n \n \n \n Resolution adopted by the General Assembly \non 2 December 2024 \n \n \n \n \n[on the report of the First Committee (A/79/409, para. 21)] \n \n \n \n79/70. United Nations regional centres for peace and disarmament \n \n \n \nThe General Assembly, \n \nRecalling its resolutions 60/83 of 8 December 2005, 61/90 of 6 December 2006, \n62/50 of 5 December 2007, 63/76 of 2 December 2008, 64/58 of 2 December 2009, \n65/78 of 8 December 2010, 66/53 of 2 December 2011, 67/63 of 3 December 2012, \n68/57 of 5 December 2013, 69/70 of 2 December 2014, 70/61 of 7 December 2015, \n71/80 of 5 December 2016, 72/64 of 4 December 2017, 73/80 of 5 December 2018, \n74/70 of 12 December 2019, 75/81 of 7 December 2020, 76/61 of 6 December 2021, \n77/88 of 7 December 2022 and 78/60 of 4 December 2023 regarding the maintenance \nand revitalization of the three United Nations regional centres for peace and \ndisarmament, \n \nRecalling also the reports of the Secretary-General on the United Nations \nRegional Centre for Peace and Disarmament in Africa,1 the United Nations Regional \nCentre for Peace and Disarmament in Asia and the Pacific2 and the United Nations \nRegional Centre for Peace, Disarmament and Development in Latin America and the \nCaribbean,3 \n \nReaffirming its decision, taken in 1982 at its twelfth special session, to establish \nthe United Nations Disarmament Information Programme, the purpose of which is to \ninform, educate and generate public understanding and support for the objectives of \nthe United Nations in the field of arms control and disarmament, \n__________________ \n \n1 A/79/128. \n \n2 A/79/129. \n \n3 A/79/126. \n\nA/RES/79/70 \nUnited Nations regional centres for peace and disarmament\n \n24-23082\n2/2 \n \n \nBearing in mind its resolutions 40/151 G of 16 December 1985, 41/60 J of \n3 December 1986, 42/39 D of 30 November 1987 and 44/117 F of 15 December 1989 \non the regional centres for peace and disarmament in Nepal, Peru and Togo, \n \nRecalling that the thirtieth anniversary of the establishment by the General \nAssembly of the United Nations Regional Centre for Peace and Disarmament in \nAfrica, the United Nations Regional Centre for Peace and Disarmament in Asia and \nthe Pacific and the United Nations Regional Centre for Peace, Disarmament and \nDevelopment in Latin America and the Caribbean was celebrated in 2016 and in 2017, \n \nRecognizing that the changes that have taken place in the world have created \nnew opportunities and posed new challenges for the pursuit of disarmament, and \nbearing in mind in this regard that the regional centres for peace and disarmament can \ncontribute substantially to understanding and cooperation among States in each \nparticular region in the areas of peace, disarmament and development, \n \nNoting that, in paragraph 329 of the Final Document of the Nineteenth Summit of \nHeads of State or Government of Non-Aligned Countries, held in Kampala on 19 and \n20 January 2024, the Heads of State or Government emphasized the importance of \nUnited Nations activities at the regional level to increase the stability and security of its \nMember States, which could be promoted in a substantive manner by the maintenance \nand revitalization of the three regional centres for peace and disarmament, \n \n1. \nReiterates the importance of United Nations activities at the regional level \nto advance disarmament and to increase the stability and security of its Member \nStates, which could be promoted in a substantive manner by the maintenance and \nfurther strengthening of the three regional centres for peace and disarmament; \n \n2. \nCommends the three regional centres for peace and disarmament for their \nsustained support provided to Member States for over 30 years in implementing \ndisarmament, arms control and non-proliferation activities through seminars and \nconferences, capacity-building and training, policy and technical expertise, and \ninformation and advocacy at the global, regional and national levels; \n \n3. \nReaffirms that, in order to achieve positive results, it is useful for the three \nregional centres to carry out dissemination and educational programmes that promote \nregional peace and security and that are aimed at changing basic attitudes with respect \nto peace and security and disarmament so as to support the achievement of the \npurposes and principles of the United Nations; \n \n4. \nAppeals to Member States in each region that are able to do so, as well as \nto international governmental and non-governmental organizations and foundations, \nto make voluntary contributions to the regional centres in their respective regions in \norder to strengthen their activities and initiatives; \n \n5. \nEmphasizes the importance of the activities of the Regional Disarmament, \nInformation and Outreach Branch of the Office for Disarmament Affairs of the \nSecretariat; \n \n6. \nRequests the Secretary-General to provide all support necessary, within \nexisting resources, to the regional centres in carrying out their programmes of activities; \n \n7. \nDecides to include in the provisional agenda of its eightieth session, under \nthe item entitled \u201cReview and implementation of the Concluding Document of the \nTwelfth Special Session of the General Assembly\u201d, the sub-item entitled \u201cUnited \nNations regional centres for peace and disarmament\u201d. \n \n44th plenary meeting \n2 December 2024 \n \n",
  "paragraphs": {
    "1": "Reiterates the importance of United Nations activities at the regional level to advance disarmament and to increase the stability and security of its Member States, which could be promoted in a substantive manner by the maintenance and further strengthening of the three regional centres for peace and disarmament;",
    "2": "Commends the three regional centres for peace and disarmament for their sustained support provided to Member States for over 30 years in implementing disarmament, arms control and non-proliferation activities through seminars and conferences, capacity-building and training, policy and technical expertise, and information and advocacy at the global, regional and national levels;",
    "3": "Reaffirms that, in order to achieve positive results, it is useful for the three regional centres to carry out dissemination and educational programmes that promote regional peace and security and that are aimed at changing basic attitudes with respect to peace and security and disarmament so as to support the achievement of the purposes and principles of the United Nations;",
    "4": "Appeals to Member States in each region that are able to do so, as well as to international governmental and non-governmental organizations and foundations, to make voluntary contributions to the regional centres in their respective regions in order to strengthen their activities and initiatives;",
    "5": "Emphasizes the importance of the activities of the Regional Disarmament, Information and Outreach Branch of the Office for Disarmament Affairs of the Secretariat;",
    "6": "Requests the Secretary-General to provide all support necessary, within existing resources, to the regional centres in carrying out their programmes of activities;",
    "7": "Decides to include in the provisional agenda of its eightieth session, under the item entitled \u201cReview and implementation of the Concluding Document of the Twelfth Special Session of the General Assembly\u201d, the sub-item entitled \u201cUnited Nations regional centres for peace and disarmament\u201d."
  },
  "agenda_items": [
    "Item 99"
  ],
  "symbol_references": []
}