{
  "symbol": "A/RES/78/305",
  "filename": "A_RES_78_305.pdf",
  "title": "78/305. Financing of the United Nations Interim Force in Lebanon",
  "text": "United Nations \nA/RES/78/305\n \n \nGeneral Assembly \nDistr.: General \n3 July 2024 \n \n24-12159 (E)     \n*2412159* \n \n \nSeventy-eighth session \nAgenda item 156 (b) \nFinancing of the United Nations peacekeeping forces in \nthe Middle East: United Nations Interim Force in Lebanon \n \n \n \n \n Resolution adopted by the General Assembly \non 28 June 2024 \n \n \n \n \n[on the report of the Fifth Committee (A/78/929, para. 12)] \n \n \n 78/305. Financing of the United Nations Interim Force in Lebanon \n \n \n \nThe General Assembly, \n \nHaving considered the reports of the Secretary-General on the financing of the \nUnited Nations Interim Force in Lebanon 1 and the related report of the Advisory \nCommittee on Administrative and Budgetary Questions,2 \n \nRecalling Security Council resolution 425 (1978) of 19 March 1978 regarding \nthe establishment of the United Nations Interim Force in Lebanon and the subsequent \nresolutions by which the Council extended the mandate of the Force, the latest of \nwhich was resolution 2695 (2023) of 31 August 2023, by which the Council extended \nthe mandate of the Force until 31 August 2024, \n \nRecalling also its resolution S-8/2 of 21 April 1978 on the financing of the Force \nand its subsequent resolutions thereon, the latest of which was resolution 77/313 of \n30 June 2023, \n \nReaffirming its resolutions 51/233 of 13 June 1997, 52/237 of 26 June 1998, \n53/227 of 8 June 1999, 54/267 of 15 June 2000, 55/180 A of 19 December 2000, \n55/180 B of 14 June 2001, 56/214 A of 21 December 2001, 56/214 B of 27 June 2002, \n57/325 of 18 June 2003, 58/307 of 18 June 2004, 59/307 of 22 June 2005, 60/278 of \n30 June 2006, 61/250 A of 22 December 2006, 61/250 B of 2 April 2007, 61/250 C of \n29 June 2007, 62/265 of 20 June 2008, 63/298 of 30 June 2009, 64/282 of 24 June \n2010, 65/303 of 30 June 2011, 66/277 of 21 June 2012, 67/279 of 28 June 2013, \n68/292 of 30 June 2014, 69/302 of 25 June 2015, 70/280 of 15 July 2016, 71/307 of \n30 June 2017, 72/299 of 5 July 2018, 73/322 of 3 July 2019, 75/250 A of 31 December \n2020, 75/250 B of 30 June 2021,76/290 of 19 June 2022 and 77/313,  \n__________________ \n \n1  A/78/596 and A/78/725. \n \n2  A/78/744/Add.3. \n\nA/RES/78/305 \nFinancing of the United Nations Interim Force in Lebanon\n \n24-12159\n2/5 \n \n \nReaffirming also the general principles underlying the financing of United \nNations peacekeeping operations, as stated in its resolutions 1874 (S-IV) of 27 June \n1963, 3101 (XXVIII) of 11 December 1973 and 55/235 of 23 December 2000, \n \nNoting with appreciation that voluntary contributions have been made to the \nForce, \n \nMindful of the fact that it is essential to provide the Force with the financial \nresources necessary to enable it to fulfil its responsibilities under the relevant \nresolutions of the Security Council, \n \n1. \nRequests the Secretary-General to entrust the Head of Mission with the \ntask of formulating future budget proposals in full accordance with the provisions of \nits resolutions 59/296 of 22 June 2005, 60/266 of 30 June 2006, 61/276 of 29 June \n2007, 64/269 of 24 June 2010, 65/289 of 30 June 2011, 66/264 of 21 June 2012, \n69/307 of 25 June 2015, 70/286 of 17 June 2016 and 76/274 of 29 June 2022, as well \nas other relevant resolutions; \n \n2. \nTakes note of the status of contributions to the United Nations Interim \nForce in Lebanon as at 30 April 2024, including the contributions outstanding in the \namount of 134 million United States dollars, representing some 1.1 per cent of the \ntotal assessed contributions, notes with concern that only 109 Member States have \npaid their assessed contributions in full, and urges all other Member States, in \nparticular those in arrears, to ensure payment of their outstanding assessed \ncontributions; \n \n3. \nExpresses its appreciation to those Member States that have paid their \nassessed contributions in full, and urges all other Member States to make every \npossible effort to ensure payment of their assessed contributions to the Force in full; \n \n4. \nExpresses deep concern that Israel did not comply with resolutions 51/233, \n52/237, 53/227, 54/267, 55/180 A, 55/180 B, 56/214 A, 56/214 B, 57/325, 58/307, \n59/307, 60/278, 61/250 A, 61/250 B, 61/250 C, 62/265, 63/298, 64/282, 65/303, \n66/277, 67/279, 68/292, 69/302, 70/280, 71/307, 72/299, 73/322, 75/250 A, 75/250 B, \n76/290 and 77/313; \n \n5. \nStresses once again that Israel should strictly abide by resolutions 51/233, \n52/237, 53/227, 54/267, 55/180 A, 55/180 B, 56/214 A, 56/214 B, 57/325, 58/307, \n59/307, 60/278, 61/250 A, 61/250 B, 61/250 C, 62/265, 63/298, 64/282, 65/303, \n66/277, 67/279, 68/292, 69/302, 70/280, 71/307, 72/299, 73/322, 75/250 A, 75/250 B, \n76/290 and 77/313; \n \n6. \nExpresses concern at the financial situation with regard to peacekeeping \nactivities, in particular as regards the reimbursements to troop contributors that bear \nadditional burdens owing to overdue payments by Member States of their \nassessments; \n \n7. \nEmphasizes that all future and existing peacekeeping missions shall be \ngiven equal and non-discriminatory treatment in respect of financial and \nadministrative arrangements; \n \n8. \nAlso emphasizes that all peacekeeping missions shall be provided with \nadequate resources for the effective and efficient discharge of their respective \nmandates; \n \n9. \nRequests the Secretary-General to ensure that proposed peacekeeping \nbudgets are based on the relevant legislative mandates; \n \n10. Endorses the conclusions and recommendations contained in the report of \nthe Advisory Committee on Administrative and Budgetary Questions, subject to the \n\nFinancing of the United Nations Interim Force in Lebanon \nA/RES/78/305\n \n3/5\n24-12159 \n \nprovisions of the present resolution, and requests the Secretary-General to ensure \ntheir full implementation; \n \n11. \nRequests the Secretary-General to ensure the full implementation of the \nrelevant provisions of its resolutions 59/296, 60/266, 61/276, 64/269, 65/289, 66/264, \n69/307, 70/286 and 76/274; \n \n12. Also requests the Secretary-General to take all action necessary to ensure \nthat the Force is administered with a maximum of efficiency and economy; \n \n13. Reiterates its request to the Secretary-General to take the measures \nnecessary to ensure the full implementation of paragraph 8 of resolution 51/233, \nparagraph 5 of resolution 52/237, paragraph 11 of resolution 53/227, paragraph 14 of \nresolution 54/267, paragraph 14 of resolution 55/180 A, paragraph 15 of resolution \n55/180 B, paragraph 13 of resolution 56/214 A, paragraph 13 of resolution 56/214 B, \nparagraph 14 of resolution 57/325, paragraph 13 of resolution 58/307, paragraph 13 \nof resolution 59/307, paragraph 17 of resolution 60/278, paragraph 21 of resolution \n61/250 A, paragraph 20 of resolution 61/250 B, paragraph 20 of resolution 61/250 C, \nparagraph 21 of resolution 62/265, paragraph 19 of resolution 63/298, paragraph 18 \nof resolution 64/282, paragraph 15 of resolution 65/303, paragraph 13 of resolution \n66/277, paragraph 13 of resolution 67/279, paragraph 13 of resolution 68/292, \nparagraph 14 of resolution 69/302, paragraph 13 of resolution 70/280, paragraph 14 \nof resolution 71/307, paragraph 14 of resolution 72/299, paragraph 16 of resolution \n73/322, paragraph 3 of resolution 75/250 A, paragraph 39 of resolution 75/250 B, \nparagraph 15 of resolution 76/290 and paragraph 14 of resolution 77/313, stresses \nonce again that Israel shall pay the amount of 1,117,005 dollars resulting from the \nincident at Qana on 18 April 1996, and requests the Secretary-General to report on \nthis matter to the General Assembly at its seventy-ninth session; \n \n \n \nBudget performance report for the period from 1 July 2022 to 30 June 2023 \n \n \n14. Takes note of the report of the Secretary-General on the budget \nperformance of the Force for the period from 1 July 2022 to 30 June 2023; 3 \n \n \n \nBudget estimates for the period from 1 July 2024 to 30 June 2025 \n \n \n15. Decides to appropriate to the special account for the United Nations \nInterim Force in Lebanon the amount of 582,625,000 dollars for the period from \n1 July 2024 to 30 June 2025, inclusive of 536,808,200 dollars for the maintenance of \nthe Force, 39,008,100 dollars for the support account for peacekeeping operations and \n6,808,700 dollars for the United Nations Logistics Base at Brindisi, Italy; \n \n \n \nFinancing of the appropriation for the period from 1 July 2024 to 30 June 2025 \n \n \n16. Decides to apportion among Member States the amount of 97,104,200 \ndollars for the period from 1 July to 31 August 2024 in accordance with the levels \nupdated in its resolution 76/239 of 24 December 2021, taking into account the scale \nof assessments for 2024, as set out in its resolution 76/238 of 24 December 2021; \n \n17. Also decides that, in accordance with the provisions of its resolution \n973 (X) of 15 December 1955, there shall be set off against the apportionment among \nMember States, as provided for in paragraph 16 above, their respective share in the \nTax Equalization Fund of 3,653,000 dollars, comprising the estimated staff \nassessment income of 3,019,500 dollars approved for the Force, the prorated share of \n529,900 dollars of the estimated staff assessment income approved for the support \n__________________ \n \n3  A/78/596. \n\nA/RES/78/305 \nFinancing of the United Nations Interim Force in Lebanon\n \n24-12159\n4/5 \n \naccount and the prorated share of 103,600 dollars of the estimated staff assessment \nincome approved for the United Nations Logistics Base; \n \n18. Further decides to apportion among Member States the amount of \n194,208,300 dollars for the period from 1 September to 31 December 2024, at a \nmonthly rate of 48,552,083 dollars, in accordance with the levels updated in its \nresolution 76/239, taking into account the scale of assessments for 2024, as set out in \nits resolution 76/238, subject to a decision of the Security Council to extend the \nmandate of the Force; \n \n19. Decides that, in accordance with the provisions of its resolution 973 (X), \nthere shall be set off against the apportionment among Member States, as provided \nfor in paragraph 18 above, their respective share in the Tax Equalization Fund of \n7,305,800 dollars, comprising the estimated staff assessment income of 6,039,000 \ndollars approved for the Force, the prorated share of 1,059,900 dollars of the \nestimated staff assessment income approved for the support account and the prorated \nshare of 206,900 dollars of the estimated staff assessment income approved for the \nUnited Nations Logistics Base; \n \n20. Also decides to apportion among Member States the amount of \n291,312,500 dollars for the period from 1 January to 30 June 2025, at a monthly rate \nof 48,552,083 dollars, in accordance with the scale of assessments for 2025 and the \nupdated levels,4 subject to a decision of the Security Council to extend the mandate \nof the Force; \n \n21. Further decides that, in accordance with the provisions of its resolution \n973 (X), there shall be set off against the apportionment among Member States, as \nprovided for in paragraph 20 above, their respective share in the Tax Equalization \nFund of 10,958,700 dollars, comprising the estimated staff assessment income of \n9,058,400 dollars approved for the Force, the prorated share of 1,589,900 dollars of \nthe estimated staff assessment income approved for the support account, and the \nprorated share of 310,400 dollars of the estimated staff assessment income approved \nfor the United Nations Logistics Base; \n \n22. Decides that, for Member States that have fulfilled their financial \nobligations to the Force, there shall be set off against the apportionment, as provided \nfor in paragraphs 16, 18 and 20 above, their respective share of the unencumbered \nbalance and other revenue in the amount of 9,368,800 dollars in respect of the \nfinancial period ended 30 June 2023, in accordance with the levels updated in its \nresolution 76/239, taking into account the scale of assessments for 2023, as set out in \nits resolution 76/238; \n \n23. Also decides that, for Member States that have not fulfilled their financial \nobligations to the Force, there shall be set off against their outstanding obligations \ntheir respective share of the unencumbered balance and other revenue in the amount \nof 9,368,800 dollars in respect of the financial period ended 30 June 2023, in \naccordance with the scheme set out in paragraph 22 above; \n \n24. Further decides that the increase of 1,623,000 dollars in the estimated staff \nassessment income in respect of the financial period ended 30 June 2023 shall be \nadded to the credits in the amount of 9,368,800 dollars referred to in paragraphs 22 \nand 23 above; \n \n25. Encourages the Secretary-General to continue to take additional measures \nto ensure the safety and security of all personnel participating in the Force under the \n__________________ \n \n4  To be adopted by the General Assembly. \n\nFinancing of the United Nations Interim Force in Lebanon \nA/RES/78/305\n \n5/5\n24-12159 \n \nauspices of the United Nations, bearing in mind paragraphs 5 and 6 of Security \nCouncil resolution 1502 (2003) of 26 August 2003; \n \n26. Invites voluntary contributions to the Force in cash and in the form of \nservices and supplies acceptable to the Secretary-General, to be administered, as \nappropriate, in accordance with the procedure and practices established by the \nGeneral Assembly; \n \n27. Decides to include in the provisional agenda of its seventy-ninth session, \nunder the item entitled \u201cFinancing of the United Nations peacekeeping forces in the \nMiddle East\u201d, the sub-item entitled \u201cUnited Nations Interim Force in Lebanon\u201d. \n \n95th plenary meeting \n28 June 2024 \n \n",
  "paragraphs": {
    "1": "Requests the Secretary-General to entrust the Head of Mission with the task of formulating future budget proposals in full accordance with the provisions of its resolutions 59/296 of 22 June 2005, 60/266 of 30 June 2006, 61/276 of 29 June 2007, 64/269 of 24 June 2010, 65/289 of 30 June 2011, 66/264 of 21 June 2012, 69/307 of 25 June 2015, 70/286 of 17 June 2016 and 76/274 of 29 June 2022, as well as other relevant resolutions;",
    "2": "Takes note of the status of contributions to the United Nations Interim Force in Lebanon as at 30 April 2024, including the contributions outstanding in the amount of 134 million United States dollars, representing some 1.1 per cent of the total assessed contributions, notes with concern that only 109 Member States have paid their assessed contributions in full, and urges all other Member States, in particular those in arrears, to ensure payment of their outstanding assessed contributions;",
    "3": "Expresses its appreciation to those Member States that have paid their assessed contributions in full, and urges all other Member States to make every possible effort to ensure payment of their assessed contributions to the Force in full;",
    "4": "Expresses deep concern that Israel did not comply with resolutions 51/233, 52/237, 53/227, 54/267, 55/180 A, 55/180 B, 56/214 A, 56/214 B, 57/325, 58/307, 59/307, 60/278, 61/250 A, 61/250 B, 61/250 C, 62/265, 63/298, 64/282, 65/303, 66/277, 67/279, 68/292, 69/302, 70/280, 71/307, 72/299, 73/322, 75/250 A, 75/250 B, 76/290 and 77/313;",
    "5": "Stresses once again that Israel should strictly abide by resolutions 51/233, 52/237, 53/227, 54/267, 55/180 A, 55/180 B, 56/214 A, 56/214 B, 57/325, 58/307, 59/307, 60/278, 61/250 A, 61/250 B, 61/250 C, 62/265, 63/298, 64/282, 65/303, 66/277, 67/279, 68/292, 69/302, 70/280, 71/307, 72/299, 73/322, 75/250 A, 75/250 B, 76/290 and 77/313;",
    "6": "Expresses concern at the financial situation with regard to peacekeeping activities, in particular as regards the reimbursements to troop contributors that bear additional burdens owing to overdue payments by Member States of their assessments;",
    "7": "Emphasizes that all future and existing peacekeeping missions shall be given equal and non-discriminatory treatment in respect of financial and administrative arrangements;",
    "8": "Also emphasizes that all peacekeeping missions shall be provided with adequate resources for the effective and efficient discharge of their respective mandates;",
    "9": "Requests the Secretary-General to ensure that proposed peacekeeping budgets are based on the relevant legislative mandates;",
    "10": "Endorses the conclusions and recommendations contained in the report of the Advisory Committee on Administrative and Budgetary Questions, subject to the Financing of the United Nations Interim Force in Lebanon A/RES/78/305 3/5 24-12159 provisions of the present resolution, and requests the Secretary-General to ensure their full implementation;",
    "11": "Requests the Secretary-General to ensure the full implementation of the relevant provisions of its resolutions 59/296, 60/266, 61/276, 64/269, 65/289, 66/264, 69/307, 70/286 and 76/274;",
    "12": "Also requests the Secretary-General to take all action necessary to ensure that the Force is administered with a maximum of efficiency and economy;",
    "13": "Reiterates its request to the Secretary-General to take the measures necessary to ensure the full implementation of paragraph 8 of resolution 51/233, paragraph 5 of resolution 52/237, paragraph 11 of resolution 53/227, paragraph 14 of resolution 54/267, paragraph 14 of resolution 55/180 A, paragraph 15 of resolution 55/180 B, paragraph 13 of resolution 56/214 A, paragraph 13 of resolution 56/214 B, paragraph 14 of resolution 57/325, paragraph 13 of resolution 58/307, paragraph 13 of resolution 59/307, paragraph 17 of resolution 60/278, paragraph 21 of resolution 61/250 A, paragraph 20 of resolution 61/250 B, paragraph 20 of resolution 61/250 C, paragraph 21 of resolution 62/265, paragraph 19 of resolution 63/298, paragraph 18 of resolution 64/282, paragraph 15 of resolution 65/303, paragraph 13 of resolution 66/277, paragraph 13 of resolution 67/279, paragraph 13 of resolution 68/292, paragraph 14 of resolution 69/302, paragraph 13 of resolution 70/280, paragraph 14 of resolution 71/307, paragraph 14 of resolution 72/299, paragraph 16 of resolution 73/322, paragraph 3 of resolution 75/250 A, paragraph 39 of resolution 75/250 B, paragraph 15 of resolution 76/290 and paragraph 14 of resolution 77/313, stresses once again that Israel shall pay the amount of 1,117,005 dollars resulting from the incident at Qana on 18 April 1996, and requests the Secretary-General to report on this matter to the General Assembly at its seventy-ninth session; Budget performance report for the period from 1 July 2022 to 30 June 2023",
    "14": "Takes note of the report of the Secretary-General on the budget performance of the Force for the period from 1 July 2022 to 30 June 2023; 3 Budget estimates for the period from 1 July 2024 to 30 June 2025",
    "15": "Decides to appropriate to the special account for the United Nations Interim Force in Lebanon the amount of 582,625,000 dollars for the period from 1 July 2024 to 30 June 2025, inclusive of 536,808,200 dollars for the maintenance of the Force, 39,008,100 dollars for the support account for peacekeeping operations and 6,808,700 dollars for the United Nations Logistics Base at Brindisi, Italy; Financing of the appropriation for the period from 1 July 2024 to 30 June 2025",
    "16": "Decides to apportion among Member States the amount of 97,104,200 dollars for the period from 1 July to 31 August 2024 in accordance with the levels updated in its resolution 76/239 of 24 December 2021, taking into account the scale of assessments for 2024, as set out in its resolution 76/238 of 24 December 2021;",
    "17": "Also decides that, in accordance with the provisions of its resolution 973 (X) of 15 December 1955, there shall be set off against the apportionment among Member States, as provided for in paragraph 16 above, their respective share in the Tax Equalization Fund of 3,653,000 dollars, comprising the estimated staff assessment income of 3,019,500 dollars approved for the Force, the prorated share of 529,900 dollars of the estimated staff assessment income approved for the support __________________ 3 A/78/596. A/RES/78/305 Financing of the United Nations Interim Force in Lebanon 24-12159 4/5 account and the prorated share of 103,600 dollars of the estimated staff assessment income approved for the United Nations Logistics Base;",
    "18": "Further decides to apportion among Member States the amount of 194,208,300 dollars for the period from 1 September to 31 December 2024, at a monthly rate of 48,552,083 dollars, in accordance with the levels updated in its resolution 76/239, taking into account the scale of assessments for 2024, as set out in its resolution 76/238, subject to a decision of the Security Council to extend the mandate of the Force;",
    "19": "Decides that, in accordance with the provisions of its resolution 973 (X), there shall be set off against the apportionment among Member States, as provided for in paragraph 18 above, their respective share in the Tax Equalization Fund of 7,305,800 dollars, comprising the estimated staff assessment income of 6,039,000 dollars approved for the Force, the prorated share of 1,059,900 dollars of the estimated staff assessment income approved for the support account and the prorated share of 206,900 dollars of the estimated staff assessment income approved for the United Nations Logistics Base;",
    "20": "Also decides to apportion among Member States the amount of 291,312,500 dollars for the period from 1 January to 30 June 2025, at a monthly rate of 48,552,083 dollars, in accordance with the scale of assessments for 2025 and the updated levels,4 subject to a decision of the Security Council to extend the mandate of the Force;",
    "21": "Further decides that, in accordance with the provisions of its resolution 973 (X), there shall be set off against the apportionment among Member States, as provided for in paragraph 20 above, their respective share in the Tax Equalization Fund of 10,958,700 dollars, comprising the estimated staff assessment income of 9,058,400 dollars approved for the Force, the prorated share of 1,589,900 dollars of the estimated staff assessment income approved for the support account, and the prorated share of 310,400 dollars of the estimated staff assessment income approved for the United Nations Logistics Base;",
    "22": "Decides that, for Member States that have fulfilled their financial obligations to the Force, there shall be set off against the apportionment, as provided for in paragraphs 16, 18 and 20 above, their respective share of the unencumbered balance and other revenue in the amount of 9,368,800 dollars in respect of the financial period ended 30 June 2023, in accordance with the levels updated in its resolution 76/239, taking into account the scale of assessments for 2023, as set out in its resolution 76/238;",
    "23": "Also decides that, for Member States that have not fulfilled their financial obligations to the Force, there shall be set off against their outstanding obligations their respective share of the unencumbered balance and other revenue in the amount of 9,368,800 dollars in respect of the financial period ended 30 June 2023, in accordance with the scheme set out in paragraph 22 above;",
    "24": "Further decides that the increase of 1,623,000 dollars in the estimated staff assessment income in respect of the financial period ended 30 June 2023 shall be added to the credits in the amount of 9,368,800 dollars referred to in paragraphs 22 and 23 above;",
    "25": "Encourages the Secretary-General to continue to take additional measures to ensure the safety and security of all personnel participating in the Force under the __________________ 4 To be adopted by the General Assembly. Financing of the United Nations Interim Force in Lebanon A/RES/78/305 5/5 24-12159 auspices of the United Nations, bearing in mind paragraphs 5 and 6 of Security Council resolution 1502 (2003) of 26 August 2003;",
    "26": "Invites voluntary contributions to the Force in cash and in the form of services and supplies acceptable to the Secretary-General, to be administered, as appropriate, in accordance with the procedure and practices established by the General Assembly;",
    "27": "Decides to include in the provisional agenda of its seventy-ninth session, under the item entitled \u201cFinancing of the United Nations peacekeeping forces in the Middle East\u201d, the sub-item entitled \u201cUnited Nations Interim Force in Lebanon\u201d. 95th plenary meeting 28 June 2024"
  },
  "agenda_items": [
    "Item 156"
  ],
  "symbol_references": []
}