{
  "symbol": "A/RES/79/324",
  "filename": "A_RES_79_324.pdf",
  "title": "79/324. Extraordinary Chambers in the Courts of Cambodia \u2013 residual functions",
  "text": "United Nations \nA/RES/79/324\n \nGeneral Assembly \nDistr.: General \n27 August 2025 \n25-13707 (E) \n*2513707* \n \n \nSeventy-ninth session \nAgenda item 88 \nExtraordinary Chambers in the Courts of \nCambodia \u2013 residual functions \n \n \n \n \n Resolution adopted by the General Assembly \non 25 August 2025 \n \n \n[without reference to a Main Committee (A/79/L.116/Rev.1)] \n \n \n 79/324. Extraordinary Chambers in the Courts of Cambodia \u2013 \nresidual functions \n \n \n \nThe General Assembly, \n \nRecalling its resolutions 75/257 \u0412 of 7 July 2021 and 77/299 of 26 June 2023, \n \nRecalling also that the expenses of the Extraordinary Chambers in the Courts of \nCambodia shall be defrayed in accordance with the relevant provisions of the \nAgreement between the United Nations and the Royal Government of Cambodia \nconcerning the Prosecution under Cambodian Law of Crimes Committed during the \nPeriod of Democratic Kampuchea (the Agreement) 1 and that the expenses to be \ndefrayed by the United Nations in accordance with those provisions shall be borne by \nvoluntary contributions from the international community, in accordance with \nresolution 57/228 \u0412 of 13 May 2003, \n \nWelcoming the efforts of the Secretary-General and the Royal Government of \nCambodia towards completion of the work of the Extraordinary Chambers, including \nwith regard to the drawdown of activities and the residual functions requiring \nperformance, \n \nWelcoming also the report of the Secretary-General,2 and taking note of the \ndetermination by the United Nations and the Royal Government of Cambodia that the \nExtraordinary Chambers will continue to implement residual functions for an \nadditional period of two years, from 1 January 2026 to 31 December 2027, \n \nWelcoming further the intention of the Royal Government of Cambodia to \nestablish a permanent public independent institution to, among other tasks, serve as a \nresearch centre, as well as the principal repository for the public to access information \n_______________ \n \n1 United Nations, Treaty Series, vol. 2329. No. 41723. \n \n2 A/79/827.  \n\nA/RES/79/324 \nExtraordinary Chambers in the Courts of Cambodia \u2013\nresidual functions\n \n25-13707\n2/2 \n \non the Cambodian accountability process, and encouraging the Royal Government of \nCambodia to take steps in that respect, \n \n1. \nEncourages the Secretary-General and the Royal Government of \nCambodia to take all the measures necessary to fully implement the Addendum to the \nAgreement between the United Nations and the Royal Government of Cambodia \nconcerning the Prosecution under Cambodian Law of Crimes Committed during the \nPeriod of Democratic Kampuchea on the Transitional Arrangements and the \nCompletion of Work of the Extraordinary Chambers (the Addendum) 3 with a view to \nworking towards the completion of the remaining residual functions and ensuring an \norderly and timely transition to the new Cambodian institution; \n \n2. \nRequests the Secretary-General to undertake with the Royal Government \nof Cambodia similar consultations, as envisaged under article 2, paragraph 2, of the \nAddendum, with respect to the period beyond 2027 or, in the event of the earlier \ncompletion of the judicial functions during the additional period from 1 January 2026 \nto 31 December 2027, to assess whether there is any need for the remaining residual \nfunctions to be performed by the Extraordinary Chambers; \n \n3. \nAlso requests the Secretary-General to report to the General Assembly at \nits eighty-first session on the implementation of the present resolution. \n \n88th plenary meeting \n25 August 2025 \n \n_______________ \n \n3 Resolution 75/257 B, annex. \n",
  "paragraphs": {
    "1": "Encourages the Secretary-General and the Royal Government of Cambodia to take all the measures necessary to fully implement the Addendum to the Agreement between the United Nations and the Royal Government of Cambodia concerning the Prosecution under Cambodian Law of Crimes Committed during the Period of Democratic Kampuchea on the Transitional Arrangements and the Completion of Work of the Extraordinary Chambers (the Addendum) 3 with a view to working towards the completion of the remaining residual functions and ensuring an orderly and timely transition to the new Cambodian institution;",
    "2": "Requests the Secretary-General to undertake with the Royal Government of Cambodia similar consultations, as envisaged under article 2, paragraph 2, of the Addendum, with respect to the period beyond 2027 or, in the event of the earlier completion of the judicial functions during the additional period from 1 January 2026 to 31 December 2027, to assess whether there is any need for the remaining residual functions to be performed by the Extraordinary Chambers;",
    "3": "Also requests the Secretary-General to report to the General Assembly at its eighty-first session on the implementation of the present resolution."
  },
  "agenda_items": [
    "Item 88"
  ],
  "symbol_references": [
    "A/79/L.116"
  ]
}