{
  "symbol": "A/RES/77/35",
  "filename": "A_RES_77_35.pdf",
  "title": "77/35. Treaty for the Prohibition of Nuclear Weapons in Latin America and the Caribbean (Treaty of Tlatelolco)",
  "text": "United Nations \nA/RES/77/35 \n \n \nGeneral Assembly \nDistr.: General \n12 December 2022 \n \n22-28100 (E)    151222     \n*2228100* \n \n \nSeventy-seventh session \nAgenda item 92 \nTreaty for the Prohibition of Nuclear Weapons in Latin \nAmerica and the Caribbean (Treaty of Tlatelolco) \n \n \n \nResolution adopted by the General Assembly on \n7 December 2022 \n \n \n \n \n[on the report of the First Committee (A/77/378, para. 7)] \n \n \n \n77/35. Treaty for the Prohibition of Nuclear Weapons in Latin America \nand the Caribbean (Treaty of Tlatelolco) \n \n \n \nThe General Assembly, \n \nRecalling that the Treaty for the Prohibition of Nuclear Weapons in Latin \nAmerica and the Caribbean (Treaty of Tlatelolco)1 was opened for signature in \nMexico City on 14 February 1967, \n \nRecalling also that, in its resolution 2286 (XXII) of 5 December 1967, it \nwelcomed with special satisfaction the Treaty of Tlatelolco as an event of historic \nsignificance in the efforts to prevent the proliferation of nuclear weapons and to \npromote international peace and security, \n \nRecalling further that, in its preamble, the Treaty of Tlatelolco states that \nmilitarily denuclearized zones are not an end in themselves but rather a means for \nachieving general and complete disarmament at a later stage, \n \nRecalling that, in its preamble, the Treaty of Tlatelolco notes that the \nestablishment of militarily denuclearized zones is closely linked with the maintenance \nof peace and security in the respective regions and that the military denuclearization \nof vast geographical zones, adopted by the sovereign decision of the States comprised \ntherein, will exercise a beneficial influence on other regions where similar conditions \nexist, \n \nConsidering that, 55 years following its adoption, the Treaty of Tlatelolco \nremains a living instrument and a source of inspiration for the creation of other \nnuclear-weapon-free zones, \n__________________ \n \n1 United Nations, Treaty Series, vol. 634, No. 9068. \n\nA/RES/77/35 \nTreaty for the Prohibition of Nuclear Weapons in Latin America \nand the Caribbean (Treaty of Tlatelolco)\n \n22-28100\n2/3 \n \n \nTaking note of the proclamation of Latin America and the Caribbean as a zone \nof peace by the Community of Latin American and Caribbean States at its second \nsummit, held in Havana on 28 and 29 January 2014, and the commitment undertaken \nin this context by the States of the region to continue to promote nuclear disarmament \nas a priority objective,2 \n \nHighlighting the fact that the Treaty of Tlatelolco, which is in force for all \n33 sovereign States of the region, consolidated the first nuclear-weapon-free zone \nestablished in a densely populated region, \n \nRecognizing the important contribution of the treaties of Tlatelolco, Rarotonga,3 \nBangkok4 and Pelindaba5 and the Treaty on a Nuclear-Weapon-Free Zone in Central \nAsia,6 as well as the Antarctic Treaty7 and the declaration by Mongolia of its nuclear-\nweapon-free status, to the achievement of nuclear non-proliferation and nuclear \ndisarmament, \n \nRecalling all relevant United Nations resolutions in support of nuclear-weapon-\nfree zones, \n \nHighlighting the value of enhancing cooperation among the nuclear-weapon-\nfree zones, including through the holding of joint meetings of States parties, \nsignatories and observers to the treaties establishing such zones, \n \nWelcoming the convening of Conferences of States Parties and Signatories to \nTreaties that Establish Nuclear-Weapon-Free Zones and Mongolia and their \ncontribution to achieving and maintaining a nuclear-weapon-free world, \n \nNoting that the 2010 Review Conference of the Parties to the Treaty on the \nNon-Proliferation of Nuclear Weapons, in its Final Document,8 encouraged the \nestablishment of new nuclear-weapon-free zones on the basis of arrangements freely \narrived at among States of the region concerned and the fostering of cooperation and \nenhanced consultation mechanisms among the existing nuclear-weapon-free zones \nthrough the establishment of concrete measures, in order to fully implement the \nprinciples and objectives of the relevant nuclear-weapon-free zone treaties, and \ncommended the Agency for the Prohibition of Nuclear Weapons in Latin America and \nthe Caribbean for its leadership in this field, \n \nReaffirming the importance of the Agency as the appropriate legal and political \nforum for ensuring full compliance with and implementation of the Treaty of \nTlatelolco, as well as cooperation with the entities of other nuclear-weapon-free zones, \n \nRecalling that its resolution 73/71 of 5 December 2018 decided to convene the \nfourth Conference of Nuclear-Weapon-Free Zones and Mongolia as a one-day \nconference at United Nations Headquarters in New York, on a date yet to be \ndetermined, \n \nRecalling also its resolution 74/27 of 12 December 2019, \n__________________ \n \n2 See A/68/914, annex. \n \n3 The United Nations Disarmament Yearbook, vol. 10: 1985 (United Nations publication, Sales \nNo. E.86.IX.7), appendix VII. \n \n4 United Nations, Treaty Series, vol. 1981, No. 33873. \n \n5 A/50/426, annex. \n \n6 United Nations, Treaty Series, vol. 2970, No. 51633. \n \n7 Ibid., vol. 402, No. 5778. \n \n8 2010 Review Conference of the Parties to the Treaty on the Non-Proliferation of Nuclear Weapons, \nFinal Document, vols. I\u2013III (NPT/CONF.2010/50 (Vol. I), NPT/CONF.2010/50 (Vol. II) and \nNPT/CONF.2010/50 (Vol. III)). \n\nTreaty for the Prohibition of Nuclear Weapons in Latin America \nand the Caribbean (Treaty of Tlatelolco) \nA/RES/77/35\n \n3/3\n22-28100 \n \n \n1. \nWelcomes the fact that the Treaty for the Prohibition of Nuclear Weapons \nin Latin America and the Caribbean (Treaty of Tlatelolco) is in force for all sovereign \nStates of the region; \n \n2. \nNotes with satisfaction that the year 2022 marks the fifty-third anniversary \nof the entry into force, on 25 April 1969, of the Treaty of Tlatelolco and of the \nestablishment of the Agency for the Prohibition of Nuclear Weapons in Latin America \nand the Caribbean; \n \n3. \nWelcomes with satisfaction the memorandum of understanding signed \nbetween the Agency for the Prohibition of Nuclear Weapons in Latin America and the \nCaribbean and the African Commission on Nuclear Energy on 1 December 2021, and \nencourages both regions to advance in its full and effective implementation with the \nobjective of fostering cooperation and consultation mechanisms; \n \n4. \nEncourages once again States parties to Additional Protocols I and II to \nthe Treaty of Tlatelolco9 to review their interpretative declarations thereto, in \naccordance with action 9 of the Final Document of the 2010 Review Conference of \nthe Parties to the Treaty on the Non-Proliferation of Nuclear Weapons,10 reaffirming \nand recognizing the legitimate interests of the States that comprise the nuclear-\nweapon-free zone in Latin America and the Caribbean in receiving full and \nunequivocal security assurances from the nuclear-weapon States; \n \n5. \nEncourages the States members of the Agency for the Prohibition of \nNuclear Weapons in Latin America and the Caribbean to continue the activities and \nefforts that they conduct jointly with the Agency, inter alia: \n \n(a) \nTo support the efforts that are being undertaken in a multilateral context \nto identify and seek effective measures that favour compliance with disarmament and \nnon-proliferation commitments; \n \n(b) \nTo enhance cooperation with States parties and signatories to treaties that \nestablish nuclear-weapon-free zones and Mongolia; \n \n(c) \nTo promote activities on nuclear disarmament and non-proliferation \neducation; \n \n6. \nDecides to include in the provisional agenda of its eightieth session the \nitem entitled \u201cTreaty for the Prohibition of Nuclear Weapons in Latin America and \nthe Caribbean (Treaty of Tlatelolco)\u201d. \n \n46th plenary meeting \n7 December 2022 \n \n__________________ \n \n9 United Nations, Treaty Series, vol. 634, No. 9068. \n \n10 See 2010 Review Conference of the Parties to the Treaty on the Non-Proliferation of Nuclear \nWeapons, Final Document, vol. I (NPT/CONF.2010/50 (Vol. I)), part I, Conclusions and \nrecommendations for follow-on actions, section I, entitled \u201cNuclear disarmament\u201d. \n",
  "paragraphs": {
    "1": "Welcomes the fact that the Treaty for the Prohibition of Nuclear Weapons in Latin America and the Caribbean (Treaty of Tlatelolco) is in force for all sovereign States of the region;",
    "2": "Notes with satisfaction that the year 2022 marks the fifty-third anniversary of the entry into force, on 25 April 1969, of the Treaty of Tlatelolco and of the establishment of the Agency for the Prohibition of Nuclear Weapons in Latin America and the Caribbean;",
    "3": "Welcomes with satisfaction the memorandum of understanding signed between the Agency for the Prohibition of Nuclear Weapons in Latin America and the Caribbean and the African Commission on Nuclear Energy on 1 December 2021, and encourages both regions to advance in its full and effective implementation with the objective of fostering cooperation and consultation mechanisms;",
    "4": "Encourages once again States parties to Additional Protocols I and II to the Treaty of Tlatelolco9 to review their interpretative declarations thereto, in accordance with action 9 of the Final Document of the 2010 Review Conference of the Parties to the Treaty on the Non-Proliferation of Nuclear Weapons,10 reaffirming and recognizing the legitimate interests of the States that comprise the nuclear- weapon-free zone in Latin America and the Caribbean in receiving full and unequivocal security assurances from the nuclear-weapon States;",
    "5": "Encourages the States members of the Agency for the Prohibition of Nuclear Weapons in Latin America and the Caribbean to continue the activities and efforts that they conduct jointly with the Agency, inter alia: (a) To support the efforts that are being undertaken in a multilateral context to identify and seek effective measures that favour compliance with disarmament and non-proliferation commitments; (b) To enhance cooperation with States parties and signatories to treaties that establish nuclear-weapon-free zones and Mongolia; (c) To promote activities on nuclear disarmament and non-proliferation education;",
    "6": "Decides to include in the provisional agenda of its eightieth session the item entitled \u201cTreaty for the Prohibition of Nuclear Weapons in Latin America and the Caribbean (Treaty of Tlatelolco)\u201d."
  },
  "agenda_items": [
    "Item 92"
  ],
  "symbol_references": []
}