{
  "symbol": "A/RES/78/213",
  "filename": "A_RES_78_213.pdf",
  "title": "78/213. Promotion and protection of human rights in the context of digital technologies",
  "text": "United Nations \nA/RES/78/213\n \n \nGeneral Assembly \nDistr.: General \n22 December 2023 \n \n23-26010 (E)    090124     \n*2326010* \n \n \nSeventy-eighth session \nAgenda item 71 (b) \nPromotion and protection of human rights: human rights \nquestions, including alternative approaches for improving \nthe effective enjoyment of human rights and \nfundamental freedoms  \n \n \n \n \n Resolution adopted by the General Assembly \non 19 December 2023 \n \n \n \n \n[on the report of the Third Committee (A/78/481/Add.2, para. 139)] \n \n \n 78/213. Promotion and protection of human rights in the context of \ndigital technologies \n \n \n \nThe General Assembly, \n \nReaffirming the purposes and principles of the Charter of the United Nations, the \nhuman rights and fundamental freedoms enshrined in the Universal Declaration of \nHuman Rights 1 and international human rights treaties, including the International \nCovenant on Civil and Political Rights, 2 the International Covenant on Economic, \nSocial and Cultural Rights,3 the Convention on the Rights of the Child,4 the Convention \nagainst Torture and Other Cruel, Inhuman or Degrading Treatment or Punishment, 5 \nthe International Convention on the Elimination of All Forms of Racial Discrimination, 6 \nthe Convention on the Rights of Persons with Disabilities, 7 the Convention on the \nElimination of All Forms of Discrimination against Women, 8 as well as the Vienna \nDeclaration and Programme of Action,9  \n__________________ \n \n1 Resolution 217 A (III). \n \n2 See resolution 2200 A (XXI), annex. \n \n3 Ibid. \n \n4 United Nations, Treaty Series, vol. 1577, No. 27531. \n \n5 Ibid., vol. 1465, No. 24841. \n \n6 Ibid., vol. 660, No. 9464. \n \n7 Ibid., vol. 2515, No. 44910. \n \n8 Ibid., vol. 1249, No. 20378. \n \n9 A/CONF.157/24 (Part I), chap. III. \n\nA/RES/78/213 \nPromotion and protection of human rights in the context of \ndigital technologies\n \n23-26010\n2/7 \n \n \nRecalling all relevant General Assembly resolutions, all relevant Human Rights \nCouncil resolutions, as well as the agreed conclusions adopted by the Commission on \nthe Status of Women at its sixty-seventh session, on 17 March 2023,10 \n \nRecalling also the World Summit on the Information Society, as well as the \noutcome document of the high-level meeting of the General Assembly on the overall \nreview of the implementation of the outcomes of the Summit, 11  and noting the \ndiscussions taking place in the Internet Governance Forum, \n \nTaking note with appreciation of the Recommendation on the Ethics of Artificial \nIntelligence of the United Nations Educational, Scientific and Cultural Organization, 12  \n \nTaking note of all the relevant reports of the Secretary-General, including the \nreport entitled \u201cRoad map for digital cooperation: implementation of the \nrecommendations of the High-level Panel on Digital Cooperation\u201d,13 as well as all \nrelevant reports of the Office of the United Nations High Commissioner for Human \nRights, including the report on human rights and technical standard-setting processes \nfor new and emerging digital technologies,14 and all relevant reports of the special \nprocedure mandate holders,  \n \nRecalling that the obligation and the primary responsibility to promote and \nprotect human rights and fundamental freedoms lie with the State,  \n \nReiterating that all human rights are universal, indivisible, interrelated, \ninterdependent and mutually reinforcing, and affirming that the same rights that \npeople have offline must also be protected online,  \n \nRecognizing the global and open nature of the Internet and the rapid \nadvancement in information and communications technologies as a driving force in \naccelerating progress towards development in its various forms, including in \nachieving the Sustainable Development Goals,15  \n \nNoting that the increasing use of digital technologies has impacts on the \nenjoyment of a wide range of human rights, and recognizing that digital technologies \ncan work as enablers of human rights, but that, without appropriate safeguards, they \ncan be used to seriously threaten the protection and full enjoyment of human rights, \n \nRecalling that, in line with the Guiding Principles on Business and Human \nRights, 16 business enterprises must meet their responsibility to avoid causing or \ncontributing to adverse human rights impacts through their own activities, and address \nsuch impacts as they occur, as well as for business enterprises to seek to prevent or \nmitigate adverse human rights impacts that are directly linked to their operations, \nproducts or services by their business relationships, even if they have not contributed \nto those impacts,  \n \nRecognizing the need to ensure that human rights are promoted, respected, \nprotected and fulfilled through the entirety of digital technologies\u2019 life cycle, \nincluding through their conception, design, development, deployment, use, evaluation \nand regulation, and to ensure that they are subject to adequate safeguards in order to \n__________________ \n \n10 Official Records of the Economic and Social Council, 2023, Supplement No. 7 (E/2023/27), \nchap. I, sect. A. \n \n11 Resolution 70/125. \n \n12 United Nations Educational, Scientific and Cultural Organization, Records of the General \nConference, Forty-first Session, Paris, 9\u201324 November 2021, vol. 1, Resolutions, annex VII. \n \n13 A/74/821. \n \n14 A/HRC/53/42. \n \n15 See resolution 70/1. \n \n16 A/HRC/17/31, annex. \n\nPromotion and protection of human rights in the context of \ndigital technologies \nA/RES/78/213\n \n3/7\n23-26010 \n \npromote a free, open, universal, interoperable, safe, secure, stable, accessible and \naffordable digital environment for all, \n \nRecognizing also that certain applications of new and emerging digital \ntechnologies are not compatible with international human rights law, and noting that \nuses of new and emerging digital technologies that impact the enjoyment of human \nrights may lack adequate regulation and governance mechanisms, and recognizing the \nneed for accountability and effective measures to prevent, mitigate and remedy \npotential and actual adverse human rights impacts of such technologies in line with \nobligations of States under international human rights law and responsibilities of \nbusiness enterprises in line with the Guiding Principles on Business and Human Rights, \n \nRecognizing further that a lack of access to affordable, safe, quality and reliable \ntechnologies and services remains a critical challenge in many developing countries, \n \nStressing the importance for all Member States, and stakeholders as appropriate, \nto promote universal, free, open, interoperable, safe, reliable and secure use of and \naccess to the Internet by facilitating international cooperation aimed at the \ndevelopment of media and information and communications facilities in all countries, \nby respecting and protecting human rights and by refraining from undue restrictions, \nsuch as Internet shutdowns, arbitrary or unlawful surveillance or online censorship, \n \nStressing also the need to close digital divides, both between and within \ncountries, including the rural-urban, youth-older persons and gender digital divides, \nand to harness digital technologies for sustainable development and the promotion and \nprotection of human rights, and recalling the need to emphasize quality of access to \nbridge digital and knowledge divides, using a multidimensional approach that includes \nspeed, stability, affordability, safety, language, training, capacity-building, local content \nand accessibility, including for older persons and persons with disabilities,  \n \nUnderlining that digital contexts provide opportunities for exercising human \nrights, including by improving access to information, and by seeking, receiving and \nimparting information and ideas of all kinds, and emphasizing that efforts to promote \naccess to digital technologies, digital, media and information literacy, civic \nparticipation and online safety are important to bridge digital divides and ensure \ndigital inclusion in its broader interpretation, which includes the development of \ndigital skills,  \n \nRecognizing that the human right to privacy, according to which no one shall be \nsubjected to arbitrary or unlawful interference with his or her privacy, family, home \nor correspondence, and the right to the protection of the law against such interference, \nis important for the enjoyment of other rights and can contribute to an individual\u2019s \nability to enjoy political, economic, social and cultural rights, and noting with concern \nthat violations or abuses of the right to privacy might affect the enjoyment of human \nrights, including the right to freedom of expression and to hold opinions without \ninterference, and the right to freedom of peaceful assembly and association,  \n \nEmphasizing that, in the digital age, technical solutions to secure and to protect \nthe confidentiality of digital communications and transactions, including measures \nfor strong encryption, pseudonymization and anonymity, are important to ensure the \nenjoyment of human rights, in particular the rights to privacy, to freedom of opinion \nand expression and to freedom of peaceful assembly and association, and recognizing \nthat Member States should promote such measures and refrain from employing \nunlawful or arbitrary surveillance techniques, which may include forms of hacking,  \n \nNoting with deep concern the use of technological tools developed by the private \nsurveillance industry and by private or public actors to undertake surveillance, \nhacking of devices and systems, interception and disruption of communications, and \ndata collection, interfering with the professional and private lives of individuals, \n\nA/RES/78/213 \nPromotion and protection of human rights in the context of \ndigital technologies\n \n23-26010\n4/7 \n \nincluding those engaged in the promotion and defence of human rights and \nfundamental freedoms, journalists and other media workers, in violation or abuse of \ntheir human rights,  \n \nStressing that, in times when physical assemblies are restricted, measures should \nbe taken to ensure that access to the Internet and online information and ideas of all \nkinds extends to everyone, and that all restrictions are in line with international law, \nincluding with the principles of legality, necessity, proportionality and non-\ndiscrimination,  \n \nUnequivocally condemning the use of blanket Internet shutdowns and unlawful \nrestrictions to intentionally prevent or disrupt access to, or the dissemination of, \ninformation online, and stressing the importance of a free, open, interoperable, \nreliable and secure Internet,  \n \nNoting that the use of algorithmic or automated decision-making processes can \nnegatively affect the enjoyment of human rights, including by perpetuating \nstereotypes or by resulting in discrimination, in particular when the data used for the \ntraining of algorithms are non-representative, inaccurate or irrelevant,  \n \nNoting also that the use of data collection, data extraction and algorithms to \ntarget content towards online users may undermine user agency and access to \ninformation online, and noting further that the collection, processing, use, storage and \nsharing of personal data, including for reuse, sale or multiple resale, risks infringing \non the user\u2019s human rights,  \n \nNoting further that the use of artificial intelligence can contribute to the \npromotion and protection of human rights and has the potential to transform \nGovernments and societies, economic sectors and the world of work,  \n \nNoting with concern that artificial intelligence or machine-learning \ntechnologies, without human rights safeguards, as well as proper technical, \nregulatory, legal and ethical safeguards, and without adequate and effective \nevaluation and feedback mechanisms, may pose the risk of reinforcing systemic, \nracial and gender-based discrimination and can lead to decisions that have the \npotential to affect the enjoyment of human rights, including economic, social and \ncultural rights, and affect non-discrimination, and recognizing the need to prevent \nracial and otherwise discriminatory outcomes and apply international human rights \nlaw and data-protection frameworks in the conception, design, development, \ndeployment, use, evaluation and regulation of these technologies and practices, \n \nRecognizing that persons in vulnerable situations, including children, may be \nparticularly exposed to online risks, and that there is a need to take steps to ensure \nthat the digital environment, including safety information, protective strategies, \nservices and forums relating to it, is accessible, inclusive and safe,  \n \nStressing the importance of all women\u2019s and girls\u2019 empowerment by enhancing \ntheir equal access to information and communications technology, promoting digital, \nmedia and information literacy and connectivity to enable the participation and \nleadership of women and girls in education and training, as well as in science, \ntechnology, engineering and mathematics, which is also essential to respecting and \npromoting all human rights, including economic, social and cultural rights, and \nensuring that women can participate in and contribute to society at large on equal \nterms and without discrimination, particularly in the realms of economic and political \nparticipation, and reaffirming that the full, equal and meaningful participation of \nwomen and girls in the digital age is critical to achieving gender equality, sustainable \ndevelopment, peace and democracy,  \n\nPromotion and protection of human rights in the context of \ndigital technologies \nA/RES/78/213\n \n5/7\n23-26010 \n \n \nRecognizing that racism, racial discrimination, xenophobia and related \nintolerance have a deep negative impact on the enjoyment of human rights and \ntherefore require a comprehensive response, both online and offline, which can \ncontribute to the prevention and elimination of all forms of violence and harassment, \nincluding in digital contexts,  \n \n1. \nAffirms that human rights and fundamental freedoms must be protected, \nonline and offline;  \n \n2. \nEncourages all Member States to promote an open, safe, secure, stable, \nfree, interoperable, inclusive, accessible and peaceful digital technology environment \nin accordance with international law, including the obligations enshrined in the \nCharter of the United Nations and international human rights law;  \n \n3. \nCalls upon all Member States:  \n \n(a) \nTo consider developing or maintaining and implementing adequate \nlegislation, in consultation with all relevant stakeholders, including business \nenterprises, international organizations, civil society and technical and academic \ncommunities, with effective sanctions and appropriate remedies, that protects \nindividuals against violations and abuses of their human rights in the digital context;  \n \n(b) \nTo provide effective and up-to-date guidance to business enterprises on \nhow to respect human rights by advising on appropriate methods, including human \nrights due diligence, and on how to consider effectively issues of vulnerability and \naccessibility;  \n \n(c) \nTo ensure that victims of violations and abuses have effective and \naccessible remedy, that threats and acts of violence are investigated effectively, and \nthat those responsible are brought to justice in order to combat impunity;  \n \n4. \nEncourages the private sector and all relevant stakeholders to meet their \nresponsibility to respect human rights in line with the Guiding Principles on Business \nand Human Rights: Implementing the United Nations \u201cProtect, Respect and Remedy\u201d \nFramework and applicable domestic laws;  \n \n5. \nRecognizes the importance of combating all forms of violence in the \ncontext of digital technologies, including sexual exploitation and abuse, harassment, \nstalking, bullying, non-consensual sharing of personal sexually explicit content, \nthreats and acts of sexual and gender-based violence, death threats, arbitrary or \nunlawful surveillance and tracking, trafficking in persons, extortion, censorship, \nillegal access to digital accounts, mobile telephones and other electronic devices, in \nline with international human rights law;  \n \n6. \nCalls upon the private sector and all relevant stakeholders to ensure that \nrespect for human rights is incorporated into the conception, design, development, \ndeployment, operation, use, evaluation and regulation of all new and emerging digital \ntechnologies and to provide for redress and effective remedy for the human rights \nabuses that they may cause, contribute to, or to which they may be directly linked;  \n \n7. \nEncourages online platforms, including social media companies, to review \ntheir business models and ensure that their design and development processes, their \nbusiness operations, data-collection and data-processing practices are in line with the \nGuiding Principles on Business and Human Rights, and emphasizes the importance \nof conducting human rights due diligence of their products, particularly of the role of \nalgorithms and ranking systems in amplifying disinformation and hate speech, and \ncalls upon them to adopt and make publicly available, after consultation with all \nrelevant stakeholders, clear, transparent, narrowly defined content and advertising \npolicies on countering disinformation and advocacy of hatred that constitutes \nincitement to discrimination, hostility or violence that are in line with international \nhuman rights law, and emphasizing the role of States to put in place safeguards so \n\nA/RES/78/213 \nPromotion and protection of human rights in the context of \ndigital technologies\n \n23-26010\n6/7 \n \nthat companies, including technology companies, meet their responsibilities to \nrespect human rights;  \n \n8. \nCalls upon Member States to work with relevant stakeholders, including \nthe private sector and civil society, to take steps to close all digital divides, including \nthrough creating an enabling and inclusive regulatory environment for small and non-\nprofit Internet operators, and to promote digital inclusion by addressing the \nchallenges associated with access, affordability, safety, digital literacy and digital \nskills, ensuring that the benefits of new and emerging digital technologies are \navailable to all without discrimination of any kind;  \n \n9. \nStresses that many Member States all over the world, especially \ndeveloping countries, need support in expanding infrastructure, cooperation in \nscience, technology and innovation and capacity-building, including human and \ninstitutional capacity-building, to ensure the accessibility, affordability and \navailability of the Internet in order to bridge digital divides, to achieve the Sustainable \nDevelopment Goals and to ensure the full enjoyment of human rights;  \n \n10. Calls upon Member States to encourage the inclusiveness of innovation, \nespecially with regard to local communities, women, persons with disabilities, older \npersons and youth, and to ensure that the scaling and diffusion of new technologies \nare inclusive and do not create further divides;  \n \n11. \nAlso calls upon Member States to adopt specific measures to close the \ngender digital divide and to ensure that particular attention is paid to access, \naffordability, digital literacy, privacy and online safety, to enhance the use of digital \ntechnologies and to mainstream a disability, gender and racial equality perspective in \npolicy decisions and the frameworks that guide them;  \n \n12. Affirms the important role that the exercise of the right to freedom of \nopinion and expression and the full respect for the freedom to seek, receive and impart \ninformation \nplays \nin \nstrengthening \ndemocracy, \npromoting \npluralism \nand \nmulticulturalism, enhancing transparency and press freedom and countering \ndisinformation and hate speech;  \n \n13. Also affirms the responsibility of States to counter, as appropriate, and in \naccordance with international human rights law, the dissemination of disinformation, \nwhich can be designed and implemented so as to mislead, to violate and abuse human \nrights, and expressing concern that the dissemination of disinformation can violate \nand abuse human rights, including privacy and the freedom of individuals to seek, \nreceive and impart information, and to incite all forms of violence, hatred, \ndiscrimination and hostility, inter alia, racism, xenophobia, negative stereotyping and \nstigmatization, and stresses that responses to the spread of disinformation and \nmisinformation must be grounded in international human rights law, including the \nprinciples of legality, necessity, proportionality and non-discrimination and \nunderlines the importance of free, independent, plural and diverse media and of \nproviding and promoting access to independent, fact-based information to counter \ndisinformation and misinformation; \n \n14. Calls upon Member States to strengthen international cooperation, \nincluding with international and regional organizations, and cooperation with the \nprivate sector, including technology companies, national human rights institutions and \ncivil society in order to share expertise, knowledge and effective practices in addressing \ndisinformation and advocacy of hatred that constitutes incitement to discrimination, \nhostility or violence, including in the development and use of digital technologies;  \n \n15. Urges Member States to refrain from interference with the use of \ntechnologies such as encryption and anonymity tools, and from employing unlawful \nor arbitrary surveillance techniques, including through hacking;  \n\nPromotion and protection of human rights in the context of \ndigital technologies \nA/RES/78/213\n \n7/7\n23-26010 \n \n \n16. Calls upon Member States to ensure that targeted surveillance \ntechnologies are only used in accordance with the human rights principles of legality, \nnecessity and proportionality, and that legal mechanisms of redress and effective \nremedies are available for victims of surveillance-related violations and abuses;  \n \n17. Emphasizes that, in the digital age, encryption and anonymity tools have \nbecome vital for many journalists and media workers to freely exercise their work and \ntheir enjoyment of human rights, in particular their rights to freedom of expression and \nto privacy, including to secure their communications and to protect the confidentiality \nof their sources, and calls upon States not to interfere with the use by journalists and \nmedia workers of such technologies and to ensure that any restrictions thereon comply \nwith the obligations of States under international human rights law;  \n \n18. Calls upon Member States to refrain from imposing restrictions on the free \nflow of information and ideas that are inconsistent with relevant obligations under \ninternational law, including articles 19 and 20 of the International Covenant on Civil \nand Political Rights, through practices such as the use of Internet shutdowns and online \ncensorship to intentionally prevent or disrupt access to or the dissemination of \ninformation, and from using digital technologies to silence, unlawfully or arbitrarily \nsurveil or harass individuals or groups, including in the context of peaceful assemblies;  \n \n19. Affirms that human rights and fundamental freedoms must be respected, \nprotected and promoted throughout the life cycle of artificial intelligence systems and \nthat new and emerging digital technologies should provide new means to promote, \nprotect and exercise human rights and not to infringe upon them;  \n \n20. Calls upon Member States and, where applicable, other stakeholders:  \n \n(a) \nTo conduct human rights due diligence, including regular, comprehensive \nhuman rights impact assessments of digital technologies, including artificial \nintelligence, throughout their life cycle, including their conception, design, \ndevelopment, deployment, use, sale, procurement or operation, in order to prevent \nand mitigate their adverse human rights impacts, and ensuring effective remedies as \nwell as human oversight, accountability and legal responsibility;  \n \n(b) \nTo prevent harm to individuals caused by artificial intelligence systems \nand to refrain from or cease the use of artificial intelligence applications that are \nimpossible to operate in compliance with international human rights law or that pose \nundue risks to the enjoyment of human rights, unless and until the adequate \nsafeguards to protect human rights and fundamental freedoms are in place;  \n \n(c) \nTo promote the transparency of artificial intelligence systems and adequate \nexplainability of artificial intelligence-supported decisions, taking into account the \nvarious human rights risks arising from these technologies;  \n \n(d) \nTo ensure that digital or biometric identity programmes are designed, \nimplemented and operated after appropriate human rights safeguards, as well as \ntechnical, regulatory, legal and ethical safeguards, are in place, and in line with \ninternational human rights law;  \n \n21. Encourages Member States and business enterprises to ensure \nparticipation of all relevant stakeholders in decisions on the development, deployment \nand use of artificial intelligence;  \n \n22. Decides to continue its consideration of the question at its eightieth \nsession. \n \n50th plenary meeting \n19 December 2023  \n \n",
  "paragraphs": {
    "1": "Affirms that human rights and fundamental freedoms must be protected, online and offline;",
    "2": "Encourages all Member States to promote an open, safe, secure, stable, free, interoperable, inclusive, accessible and peaceful digital technology environment in accordance with international law, including the obligations enshrined in the Charter of the United Nations and international human rights law;",
    "3": "Calls upon all Member States: (a) To consider developing or maintaining and implementing adequate legislation, in consultation with all relevant stakeholders, including business enterprises, international organizations, civil society and technical and academic communities, with effective sanctions and appropriate remedies, that protects individuals against violations and abuses of their human rights in the digital context; (b) To provide effective and up-to-date guidance to business enterprises on how to respect human rights by advising on appropriate methods, including human rights due diligence, and on how to consider effectively issues of vulnerability and accessibility; (c) To ensure that victims of violations and abuses have effective and accessible remedy, that threats and acts of violence are investigated effectively, and that those responsible are brought to justice in order to combat impunity;",
    "4": "Encourages the private sector and all relevant stakeholders to meet their responsibility to respect human rights in line with the Guiding Principles on Business and Human Rights: Implementing the United Nations \u201cProtect, Respect and Remedy\u201d Framework and applicable domestic laws;",
    "5": "Recognizes the importance of combating all forms of violence in the context of digital technologies, including sexual exploitation and abuse, harassment, stalking, bullying, non-consensual sharing of personal sexually explicit content, threats and acts of sexual and gender-based violence, death threats, arbitrary or unlawful surveillance and tracking, trafficking in persons, extortion, censorship, illegal access to digital accounts, mobile telephones and other electronic devices, in line with international human rights law;",
    "6": "Calls upon the private sector and all relevant stakeholders to ensure that respect for human rights is incorporated into the conception, design, development, deployment, operation, use, evaluation and regulation of all new and emerging digital technologies and to provide for redress and effective remedy for the human rights abuses that they may cause, contribute to, or to which they may be directly linked;",
    "7": "Encourages online platforms, including social media companies, to review their business models and ensure that their design and development processes, their business operations, data-collection and data-processing practices are in line with the Guiding Principles on Business and Human Rights, and emphasizes the importance of conducting human rights due diligence of their products, particularly of the role of algorithms and ranking systems in amplifying disinformation and hate speech, and calls upon them to adopt and make publicly available, after consultation with all relevant stakeholders, clear, transparent, narrowly defined content and advertising policies on countering disinformation and advocacy of hatred that constitutes incitement to discrimination, hostility or violence that are in line with international human rights law, and emphasizing the role of States to put in place safeguards so A/RES/78/213 Promotion and protection of human rights in the context of digital technologies 23-26010 6/7 that companies, including technology companies, meet their responsibilities to respect human rights;",
    "8": "Calls upon Member States to work with relevant stakeholders, including the private sector and civil society, to take steps to close all digital divides, including through creating an enabling and inclusive regulatory environment for small and non- profit Internet operators, and to promote digital inclusion by addressing the challenges associated with access, affordability, safety, digital literacy and digital skills, ensuring that the benefits of new and emerging digital technologies are available to all without discrimination of any kind;",
    "9": "Stresses that many Member States all over the world, especially developing countries, need support in expanding infrastructure, cooperation in science, technology and innovation and capacity-building, including human and institutional capacity-building, to ensure the accessibility, affordability and availability of the Internet in order to bridge digital divides, to achieve the Sustainable Development Goals and to ensure the full enjoyment of human rights;",
    "10": "Calls upon Member States to encourage the inclusiveness of innovation, especially with regard to local communities, women, persons with disabilities, older persons and youth, and to ensure that the scaling and diffusion of new technologies are inclusive and do not create further divides;",
    "11": "Also calls upon Member States to adopt specific measures to close the gender digital divide and to ensure that particular attention is paid to access, affordability, digital literacy, privacy and online safety, to enhance the use of digital technologies and to mainstream a disability, gender and racial equality perspective in policy decisions and the frameworks that guide them;",
    "12": "Affirms the important role that the exercise of the right to freedom of opinion and expression and the full respect for the freedom to seek, receive and impart information plays in strengthening democracy, promoting pluralism and multiculturalism, enhancing transparency and press freedom and countering disinformation and hate speech;",
    "13": "Also affirms the responsibility of States to counter, as appropriate, and in accordance with international human rights law, the dissemination of disinformation, which can be designed and implemented so as to mislead, to violate and abuse human rights, and expressing concern that the dissemination of disinformation can violate and abuse human rights, including privacy and the freedom of individuals to seek, receive and impart information, and to incite all forms of violence, hatred, discrimination and hostility, inter alia, racism, xenophobia, negative stereotyping and stigmatization, and stresses that responses to the spread of disinformation and misinformation must be grounded in international human rights law, including the principles of legality, necessity, proportionality and non-discrimination and underlines the importance of free, independent, plural and diverse media and of providing and promoting access to independent, fact-based information to counter disinformation and misinformation;",
    "14": "Calls upon Member States to strengthen international cooperation, including with international and regional organizations, and cooperation with the private sector, including technology companies, national human rights institutions and civil society in order to share expertise, knowledge and effective practices in addressing disinformation and advocacy of hatred that constitutes incitement to discrimination, hostility or violence, including in the development and use of digital technologies;",
    "15": "Urges Member States to refrain from interference with the use of technologies such as encryption and anonymity tools, and from employing unlawful or arbitrary surveillance techniques, including through hacking; Promotion and protection of human rights in the context of digital technologies A/RES/78/213 7/7 23-26010",
    "16": "Calls upon Member States to ensure that targeted surveillance technologies are only used in accordance with the human rights principles of legality, necessity and proportionality, and that legal mechanisms of redress and effective remedies are available for victims of surveillance-related violations and abuses;",
    "17": "Emphasizes that, in the digital age, encryption and anonymity tools have become vital for many journalists and media workers to freely exercise their work and their enjoyment of human rights, in particular their rights to freedom of expression and to privacy, including to secure their communications and to protect the confidentiality of their sources, and calls upon States not to interfere with the use by journalists and media workers of such technologies and to ensure that any restrictions thereon comply with the obligations of States under international human rights law;",
    "18": "Calls upon Member States to refrain from imposing restrictions on the free flow of information and ideas that are inconsistent with relevant obligations under international law, including articles 19 and 20 of the International Covenant on Civil and Political Rights, through practices such as the use of Internet shutdowns and online censorship to intentionally prevent or disrupt access to or the dissemination of information, and from using digital technologies to silence, unlawfully or arbitrarily surveil or harass individuals or groups, including in the context of peaceful assemblies;",
    "19": "Affirms that human rights and fundamental freedoms must be respected, protected and promoted throughout the life cycle of artificial intelligence systems and that new and emerging digital technologies should provide new means to promote, protect and exercise human rights and not to infringe upon them;",
    "20": "Calls upon Member States and, where applicable, other stakeholders: (a) To conduct human rights due diligence, including regular, comprehensive human rights impact assessments of digital technologies, including artificial intelligence, throughout their life cycle, including their conception, design, development, deployment, use, sale, procurement or operation, in order to prevent and mitigate their adverse human rights impacts, and ensuring effective remedies as well as human oversight, accountability and legal responsibility; (b) To prevent harm to individuals caused by artificial intelligence systems and to refrain from or cease the use of artificial intelligence applications that are impossible to operate in compliance with international human rights law or that pose undue risks to the enjoyment of human rights, unless and until the adequate safeguards to protect human rights and fundamental freedoms are in place; (c) To promote the transparency of artificial intelligence systems and adequate explainability of artificial intelligence-supported decisions, taking into account the various human rights risks arising from these technologies; (d) To ensure that digital or biometric identity programmes are designed, implemented and operated after appropriate human rights safeguards, as well as technical, regulatory, legal and ethical safeguards, are in place, and in line with international human rights law;",
    "21": "Encourages Member States and business enterprises to ensure participation of all relevant stakeholders in decisions on the development, deployment and use of artificial intelligence;",
    "22": "Decides to continue its consideration of the question at its eightieth session. 50th plenary meeting 19 December 2023"
  },
  "agenda_items": [
    "Item 71"
  ],
  "symbol_references": []
}