{
  "symbol": "A/RES/74/263",
  "filename": "A_RES_74_263.pdf",
  "title": "74/263. Special subjects relating to the proposed programme budget for 2020",
  "text": "United Nations \nA/RES/74/263\n \n \nGeneral Assembly \nDistr.: General \n14 January 2020 \n \n19-22730 (E)    170120 \n*1922730* \n \n \nSeventy-fourth session \nAgenda item 135 \nProposed programme budget for 2020 \n \n \n \n \n Resolution adopted by the General Assembly \non 27 December 2019 \n \n \n \n \n[on the report of the Fifth Committee (A/74/614)] \n \n \n 74/263. Special subjects relating to the proposed programme budget \nfor 2020 \n \n \n \nThe General Assembly, \n \n \n \nI \nRequest for a subvention to the United Nations Institute for Disarmament \nResearch resulting from the recommendations of the Board of Trustees \nof the Institute on the work programme of the Institute for 2020 \n \n \nHaving considered the note by the Secretary-General on the request for a \nsubvention to the United Nations Institute for Disarmament Research resulting from \nthe recommendations of the Board of Trustees of the Institute on the work programme \nof the Institute for 2020 1  and the related report of the Advisory Committee on \nAdministrative and Budgetary Questions,2  \n \n1. \nTakes note of the note by the Secretary-General;1 \n \n2. \nEndorses the conclusions and recommendations contained in the report of \nthe Advisory Committee on Administrative and Budgetary Questions; 2 \n \n3. \nApproves the request for a subvention to the United Nations Institute for \nDisarmament Research of 275,000 United States dollars (before recosting) from the \nregular budget of the United Nations, for which the provision has already been \nincluded under section 4, Disarmament, of the proposed programme budget for 2020; \n \n__________________ \n \n1  A/74/339. \n \n2  A/74/7/Add.9. \n\nA/RES/74/263 \nSpecial subjects relating to the proposed\nprogramme budget for 2020\n \n19-22730\n2/25 \n \n \n \nII \nRevised estimates resulting from resolutions and decisions adopted \nby the Economic and Social Council at its 2019 session \n \n \nHaving considered the report of the Secretary-General3 and the related report of \nthe Advisory Committee,4  \n \n1. \nTakes note of the report of the Secretary-General;3  \n \n2. \nEndorses the conclusions and recommendations contained in the report of \nthe Advisory Committee;4  \n \n3. \nWelcomes with appreciation the generous offer of the Government of Qatar \nto host the Fifth United Nations Conference on the Least Developed Countries, in \nDoha in 2021;  \n \n \n \nIII \nInternational Trade Centre \n \n \nRecalling its resolution 74/262 of 27 December 2019 on questions relating to \nthe proposed programme budget for 2020,  \n \nDecides to approve resources in the amount of 18,861,800 dollars (the United \nNations share equivalent to 50 per cent of 36,739,000 Swiss francs at the exchange \nrate of 0.9739 Swiss francs to 1 dollar) proposed for 2020 under section 13, \nInternational Trade Centre, of the proposed programme budget for 2020;  \n \n \n \nIV \nAdministrative and financial implications of the decisions and \nrecommendations contained in the report of the International Civil Service \nCommission for 2019 \n \n \nHaving considered the statement submitted by the Secretary-General in \naccordance with rule 153 of the rules of procedure of the General Assembly5 and the \nrelated report of the Advisory Committee,6  \n \n1. \nRecalls its resolution 74/255 B of 27 December 2019;  \n \n2. \nTakes note of the statement submitted by the Secretary-General;5  \n \n3. \nEndorses the conclusions and recommendations contained in the report of \nthe Advisory Committee;6  \n \n4. \nDecides not to approve the request for an additional post of \nCommunications Officer (P-4); \n \n \n \nV \nRequest for a subvention to the Extraordinary Chambers in the Courts \nof Cambodia \n \n \nRecalling section I of its resolution 68/247 B of 9 April 2014, section I of its \nresolution 69/274 A of 2 April 2015, section IV of its resolution 70/248 A of \n23 December 2015, section II of its resolution 71/272 A of 23 December 2016, \nsection IX of its resolution 72/262 A of 24 December 2017 and section IV of its \nresolution 73/279 A of 22 December 2018,  \n__________________ \n \n3  A/74/347. \n \n4  A/74/7/Add.12. \n \n5  A/C.5/74/2.  \n \n6  A/74/7/Add.7.  \n\nSpecial subjects relating to the proposed \nprogramme budget for 2020 \nA/RES/74/263\n \n3/25\n19-22730 \n \n \nHaving considered the report of the Secretary-General on the request for a \nsubvention to the Extraordinary Chambers in the Courts of Cambodia 7 and the related \nreport of the Advisory Committee,8  \n \nHaving also considered the report of the Office of Internal Oversight Services \non the audit of the international component of the Extraordinary Chambers in the \nCourts of Cambodia,9  \n \n1. \nTakes note of the report of the Secretary-General;7  \n \n2. \nEndorses the conclusions and recommendations contained in the report of \nthe Advisory Committee;8  \n \n3. \nRecalls paragraph 30 of the report of the Advisory Committee, and \nrequests the Extraordinary Chambers in the Courts of Cambodia to report on the status \nof implementation of the recommendations of the Office of Internal Oversight \nServices in the next report of the Secretary-General;  \n \n4. \nReaffirms the high priority accorded to the work of the Extraordinary \nChambers;  \n \n5. \nNotes with appreciation the sustained contributions of the Government of \nCambodia, as the host country, for the Extraordinary Chambers;  \n \n6. \nEncourages the Extraordinary Chambers to continue to adopt appropriate \nmeasures for achieving operational savings and efficiencies, and to properly complete \nthe judicial mandate in a transparent, accountable and cost-effective manner;  \n \n7. \nNotes the steps taken by the Secretary-General to develop a framework for \nthe completion of the work of the Extraordinary Chambers and the identification of \npossible residual functions, and requests the Secretary-General to expedite the \nfinalization of the framework;  \n \n8. \nRecalls paragraph 25 of the report of the Advisory Committee, in which \nthe Committee reiterates the ongoing need for intensified fundraising efforts, \nincluding by broadening the donor base, and encourages all Member States to provide \ncontinuing and additional voluntary support for both the international and national \ncomponents of the Extraordinary Chambers in support of the expeditious completion \nof the mandate of the Chambers;  \n \n9. \nAlso recalls paragraphs 28 and 29 of the report of the Advisory Committee, \nand requests the Secretary-General to inform the General Assembly of the revised \nterms and conditions, to provide further justification for the remuneration level of the \ninternational judges and the international prosecutors and to review the differences \nwith the remuneration levels of other comparable senior level officials of the United \nNations in his next report;  \n \n10. Authorizes the Secretary-General, as an exceptional measure, to enter into \ncommitments in an amount not exceeding 7 million dollars to supplement the \nvoluntary financial resources of the international component of the Extraordinary \nChambers for the period from 1 January to 31 December 2020, so as to enable the \nChambers to carry out its judicial mandate, and requests the Secretary-General to \nreport on the use of the commitment authority in the context of his next report;  \n \n__________________ \n \n7  A/74/359. \n \n8  A/74/7/Add.16. \n \n9  A/74/281. \n\nA/RES/74/263 \nSpecial subjects relating to the proposed\nprogramme budget for 2020\n \n19-22730\n4/25 \n \n \n \nVI \nRequest for a subvention to the Residual Special Court for Sierra Leone \n \n \nRecalling its resolution 58/284 of 8 April 2004, section VII of its resolution \n59/276 of 23 December 2004, section II of its resolution 59/294 of 22 June 2005, \nsection XII of its resolution 65/259 of 24 December 2010, section IX of its resolution \n66/247 of 24 December 2011, section I of its resolution 67/246 of 24 December 2012, \nsection VII of its resolution 70/248 A, section III of its resolution 71/272 A, section VIII \nof its resolution 72/262 A and section III of its resolution 73/279 A,  \n \nHaving considered the report of the Secretary-General on the use of the \ncommitment authority and request for a subvention to the Residual Special Court for \nSierra Leone10 and the related report of the Advisory Committee,11  \n \n1. \nTakes note of the report of the Secretary-General;10  \n \n2. \nEndorses the conclusions and recommendations contained in the report of \nthe Advisory Committee;11 \n \n3. \nReaffirms the high priority accorded to the work of the Residual Special \nCourt for Sierra Leone;  \n \n4. \nWelcomes the in-kind support provided by the Government of Sierra Leone \nto the Residual Special Court, including support for the sub-office of the Court in \nFreetown and for the provision of security personnel;  \n \n5. \nAlso welcomes the support provided by several countries, including \nvoluntary contributions, pro bono services and in-kind support in housing the archives \nof the Residual Special Court and prisoners of the Court;  \n \n6. \nEncourages all Member States to provide voluntary support to the \nResidual Special Court;  \n \n7. \nExpresses serious concern over the adverse financial situation facing the \nResidual Special Court, and in this regard requests the Secretary-General to redouble \nhis efforts to seek voluntary contributions, including through broadening the donor \nbase and holding regular consultations with the key stakeholders, as well as to \nimplement innovative fundraising approaches, and to report thereon to the General \nAssembly at the main part of its seventy-fifth session;  \n \n8. \nAuthorizes the Secretary-General to enter into commitments in an amount \nnot to exceed 2,537,000 dollars to supplement the voluntary financial resources of the \nResidual Special Court for the period from 1 January to 31 December 2020, and \nrequests the Secretary-General to report to the General Assembly, at the main part of \nits seventy-fifth session, on the use of the commitment authority; \n \n \n \nVII \nStrategic heritage plan of the United Nations Office at Geneva \n \n \nRecalling part XI of its resolution 64/243 of 24 December 2009, section VII of \nits resolution 66/247, section V of its resolution 68/247 A of 27 December 2013, \nsections III and VII of its resolution 69/262 of 29 December 2014, section X of its \nresolution 70/248 A, section XVIII of its resolution 71/272 A, section XVI of its \nresolution 72/262 A and section XIII of its resolution 73/279 A,  \n__________________ \n \n10  A/74/352. \n \n11  A/74/7/Add.21. \n\nSpecial subjects relating to the proposed \nprogramme budget for 2020 \nA/RES/74/263\n \n5/25\n19-22730 \n \n \nHaving considered the sixth annual progress report of the Secretary-General on \nthe strategic heritage plan of the United Nations Office at Geneva 12 and the related \nreport of the Advisory Committee,13  \n \n1. \nTakes note of the report of the Secretary-General;12  \n \n2. \nEndorses the conclusions and recommendations contained in the report of \nthe Advisory Committee;13  \n \n3. \nWelcomes the continued support of the Government of Switzerland for the \nconstruction project in Geneva;  \n \n4. \nRequests the Secretary-General to ensure that the strategic heritage plan is \nfully completed within the project scope and overall cost approved in its resolution \n70/248 A without further delays;  \n \n5. \nReaffirms paragraph 19 of section XIII of its resolution 73/279 A, and \nreiterates its request to preserve the historical heritage of the Palais des Nations;  \n \n6. \nAlso reaffirms the proposed project scope, schedule and estimated cost of \nthe strategic heritage plan in the maximum amount of 836,500,000 Swiss francs;  \n \n7. \nStresses the importance of effective governance, oversight, transparency \nand accountability in the management of the project to ensure that the project \nobjectives are achieved on time and within budget;  \n \n8. \nAlso stresses the importance of close coordination between the strategic \nheritage plan project team and the Secretariat in New York, in particular the Global \nAsset Management Policy Service, to ensure success in all aspects of the project;  \n \n9. \nExpresses concern at the six-month delay, increased costs and risks to the \nproject schedule and cost plan, as well as the decreasing level of confidence, and \nrequests the Secretary-General to ensure rigorous risk and project management and \nclose monitoring of the areas of risk and vulnerability and to take all mitigation \nmeasures necessary in a timely manner in order to alleviate potential risks of further \ndelays and cost overruns, and to report thereon in his next progress report;  \n \n10. Requests the Secretary-General to make every effort to avoid budget \nincreases through the application of sound project management practices and to \nensure that the strategic heritage plan is completed within the approved budget and \nthe envisaged schedule;  \n \n11. \nAlso requests the Secretary-General to ensure that the recommendations \nof the Board of Auditors are implemented fully and expeditiously;  \n \n12. Notes the progress that has been made and the completion of some of the \nproject activities;  \n \n13. Notes with appreciation the efforts of the Secretary-General to ensure \nbusiness continuity of conferences through a temporary conference facility available \nthroughout the duration of the renovation works, and requests the Secretary-General \nto absorb the expenditure of the facility within the approved budget of the project;  \n \n14. Reaffirms paragraph 10 of section XIII of its resolution 73/279 A;  \n \n15. Requests the Secretary-General to continue to ensure that the procurement \nof goods and services for the construction project is carried out in strict compliance \nwith the existing regulations, rules and relevant provisions of General Assembly \nresolutions governing procurement in the United Nations;  \n__________________ \n \n12  A/74/452. \n \n13  A/74/7/Add.13. \n\nA/RES/74/263 \nSpecial subjects relating to the proposed\nprogramme budget for 2020\n \n19-22730\n6/25 \n \n \n16. Recalls paragraph 16 of its resolution 69/273 of 2 April 2015, reaffirms \nthe importance of transparency in the procurement process, and requests the \nSecretary-General to ensure that the project team takes vendors from developing \ncountries and countries with economies in transition fully into account when \ncontracting and subcontracting and to report on the specific steps taken and progress \nachieved in the context of increasing procurement opportunities for vendors from \ndeveloping countries and countries with economies in transition in the \nimplementation of the strategic heritage plan;  \n \n17. Notes that the strategic heritage plan will reach its midpoint at the end of \n2019 and will enter into significant high-value, multi-year construction contracts, and \nin this regard emphasizes the necessity of a predictable and secure funding \nmechanism for the project;  \n \n18. Decides to continue to use the multi-year construction-in-progress account \nestablished within the regular budget for expenditures related to the strategic heritage \nplan in 2020;  \n \n19. Also decides to revert to the establishment of an assessment scheme and \ncurrency of appropriation and assessment for the strategic heritage plan at the main \npart of its seventy-fifth session, and requests the Secretary-General to provide \nupdated detailed information on these issues;  \n \n20. Further decides to revert to the establishment of the multi-year special \naccount for the strategic heritage plan at the main part of its seventy-fifth session;  \n \n21. Decides that the annual repayments of the loans to the host country will \nbe funded under the regular budget until decided otherwise by the General Assembly;  \n \n22. Appreciates the existing voluntary contributions received from Member \nStates to finance the strategic heritage plan, and requests the Secretary-General to \nremain proactive in seeking both voluntary and in-kind contributions from Member \nStates, as well as donations by private entities, in full compliance with all relevant \nrules and regulations of the Organization and agreements related to donations for the \nstrategic heritage plan, and to provide detailed information on this matter in the \ncontext of his next progress report;  \n \n23. Reiterates that all income from the rental or valorization of land owned by \nthe Organization in Geneva will be reflected under income section 2, General income, \nof the proposed programme budget for 2020;  \n \n24. Reiterates its request to the Secretary-General to continue to explore the \npossibility of attracting additional United Nations entities to be accommodated at the \nrenovated Palais des Nations;  \n \n25. Encourages the Secretary-General to continue his efforts in maximizing \nthe long-term generation of income through long-term, community-oriented leasing \narrangements for United Nations-owned land in Geneva, and in this regard requests \nthe Secretary-General to present detailed plans on the valorization strategy and \npreparatory works, including the scope, duration and resource requirements for the \npreparatory works, for the consideration of the General Assembly as early as \npracticable;  \n \n26. Decides to appropriate the amount of 36,799,600 dollars (equivalent to \n36,505,200 Swiss francs) for 2020, under section 33, Construction, alteration, \nimprovement and major maintenance, of the proposed programme budget for 2020; \n \n \n \nVIII \nAdministrative expenses of the United Nations Joint Staff Pension Fund \n \n \nRecalling its resolution 70/238 A of 23 December 2015, section XV of its \nresolution 72/262 A and its resolution 73/274 of 22 December 2018,  \n\nSpecial subjects relating to the proposed \nprogramme budget for 2020 \nA/RES/74/263\n \n7/25\n19-22730 \n \n \nHaving considered the report of the United Nations Joint Staff Pension Board \non the administrative expenses of the United Nations Joint Staff Pension Fund and \nreport of the United Nations Joint Staff Pension Board on the work of its sixty-sixth \nsession, 14 the report of the Secretary-General on the administrative and financial \nimplications arising from the report of the United Nations Joint Staff Pension Board, 15 \nthe financial report and audited financial statements for the year ended 31 December \n2018 and report of the Board of Auditors on the Pension Fund 16  and the \nrecommendations contained therein, the report of the Secretary of the United Nations \nJoint Staff Pension Board and the Representative of the Secretary-General for the \ninvestment of the assets of the United Nations Joint Staff Pension Fund on the \nimplementation of the recommendations of the Board of Auditors contained in its \nreport for the year ended 31 December 2018 on the Pension Fund17 and the related \nreport of the Advisory Committee,18  \n \n1. \nTakes note of the report of the United Nations Joint Staff Pension Board 14 \nand the report of the Secretary-General;15  \n \n2. \nAlso takes note of the report of the Secretary of the United Nations Joint \nStaff Pension Board and the Representative of the Secretary-General for the \ninvestment of the assets of the United Nations Joint Staff Pension Fund; 17 \n \n3. \nEndorses the conclusions and recommendations contained in the report of \nthe Advisory Committee,18 subject to the provisions of the present resolution;  \n \n4. \nEmphasizes the existing prerogative of the General Assembly on matters \npertaining to the Pension Fund;  \n \nA \nReport of the United Nations Joint Staff Pension Board on the work \nof its sixty-sixth session \n \n \n5. \nStresses the importance of continuing to achieve the necessary 3.5 per cent \nannual real rate of return on a long-term basis for the future solvency of the Pension \nFund;  \n \n6. \nReiterates \nthe \nimportance \nof \nthe \nimplementation \nof \nall \nthe \nrecommendations of the Board of Auditors by the secretariat of the Pension Fund, the \nPension Board and the Representative of the Secretary-General in full and in a timely \nmanner, and of reporting thereon in the next report to the General Assembly;  \n \n7. \nRecalls paragraph 13 of its resolution 73/274, and decides that the head of \nthe pension administration shall have the title of Chief Executive of Pension \nAdministration and to amend the relevant articles in the regulations of the Pension \nFund accordingly;  \n \n8. \nRequests the Chief Executive of Pension Administration, drawing on the \nexpertise of the Procurement Division of the Secretariat, to engage promptly, through \na transparent and competitive procurement process, an independent external entity \nwith expertise in pension fund governance matters to conduct a comprehensive and \nobjective analysis, giving due regard to best practice standards of pension funds, with \nrecommendations on:  \n \n(a) \nSize, composition and frequency of meetings;  \n__________________ \n \n14  A/74/331 and A/74/331/Corr.1. \n \n15  A/C.5/74/3. \n \n16  Official Records of the General Assembly, Seventy-fourth Session, Supplement No. 5P \n(A/74/5/Add.16). \n \n17  A/74/329. \n \n18  A/74/7/Add.14. \n\nA/RES/74/263 \nSpecial subjects relating to the proposed\nprogramme budget for 2020\n \n19-22730\n8/25 \n \n \n(b) \nAllocation of seats;  \n \n(c) \nImplementation of a review and rotation scheme for the adjustment of the \ncomposition of the Pension Board on a regular basis, to allow eligible member \norganizations to share rotating seats in a fair and equitable manner;  \n \n(d) \nTerms of reference for the Chair and all members of the Pension Board, \nincluding the issue of conflict of interest;  \n \n(e) \nSelf-evaluation methodology and any appropriate restrictions or \nlimitations of the Pension Board and its Standing Committee;  \n \n9. \nRequests the Pension Board to submit the report of the external entity, \nalong with the comments of the Board, in the context of the next report of the Pension \nBoard;  \n \n10. Decides that the work of the Fund Solvency and Assets and Liabilities \nMonitoring Committee will pertain solely to asset-liability matters;  \n \n11. \nStresses that the Secretary of the Pension Board shall be fully independent \nfrom the Chief Executive of Pension Administration and the Representative of the \nSecretary-General, in this regard decides that the Secretary shall be selected and \nevaluated by the Succession Planning Committee of the Board in accordance with \nrelevant staff regulations and rules, while noting the redeployment of the D-1 from \nthe Geneva Office as a temporary arrangement beginning in January 2020, requests \nthe Board, through the Committee, to expedite the selection and nomination process, \nand decides that the Secretary shall report directly to the Board, while being provided \nwith administrative support from the Pension Administration and the Office of \nInvestment Management, as necessary;  \n \n12. Requests the Pension Board to provide further information on measures \ntaken to ensure the independence of the Secretary of the Board from the Chief \nExecutive of Pension Administration and to report thereon in the context of its next \nreport;  \n \n13. Decides that alternates should be entitled to attend Pension Board sessions \nonly when principal Board members cannot attend, with the exception of the elected \nalternates of the General Assembly, and requests the Board to implement this \nrecommendation beginning at the next meeting of the Board;  \n \n14. Emphasizes that the Office of Internal Oversight Services shall remain the \nsole internal oversight body of the secretariat of the Pension Fund and its investments, \nin line with the mandate of the Office, as set out by the General Assembly its \nresolution 48/218 B of 29 July 1994, and stresses that any change to the mandate in \nthis regard remains the sole prerogative of the Assembly;  \n \n15. Recalls paragraph 31 of its resolution 73/274, regrets that the Secretary-\nGeneral and the Pension Board did not provide an update, and reiterates its request \nthat they ensure that the staff composition of the Office of Investment Management \nand in the Pension Administration is based on as wide a geographical coverage as \npossible, bearing in mind Article 101, paragraph 3, of the Charter of the United \nNations, and to make every effort to provide an update on progress achieved in the \ncontext of their next reports;  \n \n16. Decides to defer the amendment to article 6 of the Regulations of the \nPension Fund, recalls paragraph 25 of its resolution 73/274, and urges the Pension \nBoard to finalize the development of a comprehensive code of conduct applicable to \nall Board members and observers, drawing from the code of conduct of the \nInternational Civil Service Commission, to develop appropriate regulations and \nprocedures to address all questions of ethics, including confidentiality matters, on the \n\nSpecial subjects relating to the proposed \nprogramme budget for 2020 \nA/RES/74/263\n \n9/25\n19-22730 \n \nrequested changes to the Regulations of the Fund, including on article 6, and to report \nthereon in its next report;  \n \n17. Also decides to defer the amendment to article 48 of the Regulations of the \nPension Fund, and requests the Pension Board to provide further analysis of and \nclarification on the proposed amendment, in particular to examine the possible impact \non the access of staff members and participants in the Fund to justice in the United \nNations Appeals Tribunal and its possible legal consequences, and to report thereon \nin the context of its next report;  \n \n18. Requests the Secretary-General to provide further analysis of and \nclarification on proposed amendments to the statute of the Appeals Tribunal on \npension matters, and invites the Sixth Committee to consider the legal aspects in the \ncontext of the next report of the Secretary-General on the administration of justice \nwithout prejudice to the role of the Fifth Committee as the Main Committee of the \nGeneral Assembly responsible for administrative and budgetary matters;  \n \n19. Requests the Pension Administration to continue to adhere to the target of \n15 business days for benefit processing and to report thereon in the context of the \nnext report of the Pension Board;  \n \n20. Also requests the Pension Administration to make every effort to reduce \nthe number of open workflows, with a dedicated effort to address non-processable \ncases, to establish and implement benchmarks to measure progress in their reduction \nand to report thereon in the context of the next report;  \n \n21. Welcomes the implementation of a monthly reconciliation process by all \nmember organizations of the Pension Fund to facilitate the timely payment of \nbenefits, and requests an update on progress made in the context of the next report of \nthe Pension Board;  \n \n22. Requests the Pension Board to extend the mandate and membership of the \nGovernance Working Group, which should adhere to the tripartite structure of the \nBoard, until its next session;  \n \n23. Highlights the fact that the investment strategy of the Pension Fund should \nbe guided by its annualized real rate of return target, and calls upon the Secretary-\nGeneral to continue intensive efforts towards meeting the investment policy \nobjectives;  \n \n24. Reaffirms that the Secretary-General serves as fiduciary for the investment \nof the assets of the Pension Fund;  \n \n25. Requests the Secretary-General, as fiduciary for the investment of the \nassets of the Pension Fund, to continue to diversify its investments among developed, \ndeveloping and emerging markets, wherever this serves the interests of the \nparticipants and the beneficiaries of the Fund, and also requests the Secretary-General \nto ensure that decisions concerning the investments of the Fund in any market are \nimplemented prudently, taking fully into account the four main criteria for \ninvestment, namely, safety, profitability, liquidity and convertibility;  \n \n26. Notes that emerging and frontier markets, including markets in Africa, are \nincreasingly important to the investment strategy of the Pension Fund;  \n \n27. Also notes the planned audit by the Office of Internal Oversight Services \non the governance of the Office of Investment Management, and requests the \nsubmission of the audit report, along with the comments of the Pension Board, in the \ncontext of the next report of the Board;  \n \n28. Encourages the Secretary of the Pension Board to restructure and \nstreamline the report of the Board with the aim of making it more concise and to the \n\nA/RES/74/263 \nSpecial subjects relating to the proposed\nprogramme budget for 2020\n \n19-22730\n10/25 \n \npoint and presenting the rationale of financial and administrative proposals in a more \ncomprehensive manner;  \n \n29. Highlights the importance attached by the General Assembly to continuing \nto ensure unfaltering accountability by the Pension Board, and requests the Board to \nprovide detailed follow-up on all aspects of the implementation of the present \nresolution, including information on the implementation of the recommendations of \nthe Office of Internal Oversight Services agreed to by the Board, in the context of its \nreport to be submitted to the General Assembly at its seventy-fifth session;  \n \n \n \nB \nAdministrative expenses of the United Nations Joint Staff Pension Fund \n \n \n30. Notes that the Pension Fund is funded in part through contributions from \nits member organizations and participating staff members, whereby the contributions \nof member organizations are resourced by Member States through the United Nations \nregular budget, extrabudgetary contributions and the budget of other participating \nmember organizations;  \n \n31. Also notes that the Pension Fund is administered by the Pension Board, \nwhich, as a subsidiary organ, reports to the General Assembly, and calls upon the \nBoard to operate in a more efficient way, utilizing technology and other means to \nreduce its operating costs;  \n \n32. Stresses the important role of the Pension Board in ensuring the \nsustainability of the Pension Fund by managing expenses prudently, setting cost \nbenchmarks and monitoring the cost per participant and beneficiary, and calls upon \nthe Board to report on progress made in the context of its next report;  \n \n33. Recalls paragraph 33 of the report of the Advisory Committee, notes the \nproposed increase in posts for the Office of Investment Management, and decides to \nretain the general temporary assistance resources for the Office in 2020 at the level \napproved for 2019;  \n \n34. Requests the Pension Fund and the Secretary-General to find appropriate \nsolutions in 2020 to resolve the situation of the P-4 and P-5 posts in the Executive \nOffice, and requests the Pension Administration to report thereon in the context of the \nnext report of the Pension Board;  \n \n35. Stresses the importance of having a consistent benefit processing rate and \nof maintaining the quality of service provided to clients in Europe, West Asia and \nAfrica, and in this regard requests the Chief Executive of Pension Administration to \nmaintain appropriate parallel characteristics of the Geneva Office and to provide \nupdates on the issue in the context of the next report of the Pension Board;  \n \n36. Approves the changes to the staffing table as set out in the table below:  \n \n \n \nA. \nPension Board secretariat  \n \nAction \nTitle of post \nCategory \nNumber \nRedeployment (from \nPension Administration) \nProgramme Management Officer \nP-4 \n1 \nRedeployment (from \nPension Administration) \nMeeting Services Assistant \nGS-OL \n1 \nRedeployment (from \nPension Administration) \nSecretary of the Pension Board \nD-1 \n1 \nTotal net changes  \n \n \n3 \n \n \n\nSpecial subjects relating to the proposed \nprogramme budget for 2020 \nA/RES/74/263\n \n11/25\n19-22730 \n \n \n \nB. \nPension Administration \n \nAction \nTitle of post \nCategory \nNumber \nNew post \nHuman Resources Officer \n(recruitment) \nP-3 \n1 \nNew post \nAdministrative Assistant  \nGS-OL \n1 \nNew post \nBenefits Assistant, Nairobi \nregional office (CS) \nLL \n1 \nNew post \nBenefits Assistant, Bangkok \nregional office (CS) \nLL \n1 \nNew post \nInformation Systems Officer \n(Chief of Pension Interface Unit) \nP-4 \n1 \nNew post \nInformation Systems Assistant \nGS-OL \n2 \nTotal new posts  \n \n7 \nConversion \nBenefits Officer, Nairobi \nregional office (CS) \nP-3 \n1 \nConversion \nBenefits Officer, Bangkok \nregional office (CS) \nP-3 \n1 \n \nTotal conversion  \n \n2 \nRedeployment (to Pension \nBoard secretariat) \nProgramme Management Officer \nP-4 \n-1 \nRedeployment (to Pension \nBoard secretariat) \nMeeting services Assistant \nGS-OL \n-1 \nRedeployment (to Pension \nBoard secretariat) \nChief of Geneva Office \nD-1 \n-1 \nRedeployment (to Office of \nInvestment Management) \nInformation Systems Officer \nP-4 \n-1 \nRedeployment (to Office of \nInvestment Management) \nInformation Systems Assistant \nGS-OL \n-1 \nTotal outward redeployment \n \n-5 \nTotal net changes  \n \n4 \n \n \n \n \nC. \nOffice of Investment Management \n \nAction \nTitle of post \nCategory \nNumber \nNew post \nSenior Legal Officer \nP-5 \n1 \nNew post \nLegal Assistant \nGS-OL \n1 \nNew post \nInvestment Officer \u2013 Private \nEquity \nP-3 \n1 \nNew post \nInvestment Officer \u2013 North \nAmerica \nP-3 \n1 \nNew post \nSenior Risk Officer \u2013 Head of \nMarket Risk \nP-5 \n1 \nNew post \nRisk Officer \u2013 Private Market  \nP-4 \n1 \nNew post \nRisk Officer \u2013 Portfolio \nConstruction \nP-4 \n1 \n\nA/RES/74/263 \nSpecial subjects relating to the proposed\nprogramme budget for 2020\n \n19-22730\n12/25 \n \nAction \nTitle of post \nCategory \nNumber \nNew post \nRisk Officer \u2013 Operational and \nFraud  \nP-3 \n1 \nNew post \nRisk Officer \u2013 Performance and \nReporting \nP-3 \n1 \nNew post \nRisk Officer \u2013 Credit Risk  \nP-3 \n1 \nNew post \nAdministrative Assistant \u2013 Risk \nand Compliance \nGS-OL \n1 \nNew post \nInformation System Officer \u2013 \nSystems Analyst \nP-3 \n1 \nTotal new posts \n \n12 \nConversion \nProgramme Management Officer \nP-4 \n1 \nConversion \nInformation System Officer \u2013 \nService Desk Manager \nP-3 \n1 \nConversion \nInformation System Officer \u2013 \nBusiness Analyst \nP-3 \n2 \nConversion \nInformation System Assistant \u2013 \nService Desk Assistant \nGS-OL \n2 \nConversion \nProgramme Management \nAssistant  \nGS-OL \n1 \nConversion \nInformation System Officer \u2013 \nBusiness Continuity Manager \nP-3 \n1 \nConversion \nAssociate Accountant \nP-2 \n2 \nConversion \nSenior Accounting Assistant \nGS-PL \n1 \nTotal conversions \n \n11 \nRedeployment (from \nPension Administration) \nInformation Systems Officer \nP-4 \n1 \nRedeployment (from \nPension Administration) \nInformation Systems Assistant \nGS-OL \n1 \nTotal inward redeployment \n \n2 \nTotal net changes \n \n25 \n \nAbbreviations: CS, Client Services; GS-OL, General Service (Other level); GS-PL, General \nService (Principal level); LL, Local level. \n \n \n \n37. Also approves the revised estimates of 184,916,800 dollars for the \nbiennium 2018\u20132019 for the administration of the Pension Fund;  \n \n38. Further approves expenses, chargeable directly to the Pension Fund, \ntotalling 92,899,100 dollars net for 2020;  \n \n39. Approves the amount of 7,782,200 dollars as the United Nations share of \nthe cost of the administrative expenses of the Pension Fund for 2020, of which \n4,863,900 dollars would represent the share of the regular budget and the balance of \n2,918,300 dollars would represent the share of the funds and programmes;  \n \n40. Also approves the decrease of 2,306,300 dollars in the United Nations \nshare of the cost of the administrative expenses of the central secretariat of the \nPension Fund under section 1, Overall policymaking, direction and coordination, of \nthe proposed programme budget for 2020;  \n\nSpecial subjects relating to the proposed \nprogramme budget for 2020 \nA/RES/74/263\n \n13/25\n19-22730 \n \n \n41. Authorizes the Pension Board to supplement the voluntary contributions \nto the Emergency Fund for 2020 by an amount not to exceed 112,500 dollars;  \n \n \n \nIX \n \n \nProgress in the implementation of a flexible workplace at \nUnited Nations Headquarters \n \n \nRecalling section V of its resolution 67/246, section III of its resolution 67/254 A \nof 12 April 2013, section IV of its resolution 68/247 B, section VII of its resolution \n69/274 A, section XVI of its resolution 71/272 A, section XI of its resolution 72/262 A \nand section VI of its resolution 73/279 A,  \n \nHaving considered the report of the Secretary-General19 and the related report \nof the Advisory Committee,20 \n \n1. \nTakes note of the report of the Secretary-General;19 \n \n2. \nEndorses the conclusions and recommendations contained in the report of \nthe Advisory Committee;20 \n \n3. \nReaffirms that flexible workplace strategies in the United Nations should \nbe aimed at improving the overall productivity and efficiency of the Organization, as \nwell as the staff workplace environment; \n \n4. \nRequests the Secretary-General to ensure full compliance with its \ndecisions and full cooperation with the implementation plan for the project, while \nmeeting the needs of staff and ensuring their well-being and productivity;  \n \n5. \nRecalls paragraph 5 of section XVI of its resolution 71/272 A, and \nreiterates its request that the Office of Human Resources of the Secretariat assess in \ndetail the impact of the flexible workplace on productivity and provide reliable \nqualitative and quantitative benefit indicators as well as other factors for the \nimprovement of overall productivity and staff well-being, and report thereon in the \ncontext of the next progress report;  \n \n6. \nAlso recalls section VII of its resolution 69/274 A, and requests the \nSecretary-General to ensure that the implementation of flexible workplace strategies \nand other potential changes in logistical arrangements takes into account the needs of \nlanguage staff in order to continue to ensure that the services provided to Member \nStates meet the highest standard of quality;  \n \n7. \nRequests the Secretary-General to provide detailed information with \nrespect to the planning and costs of rental leases, including rental savings from all \nvacated rental buildings and spaces, in the context of his next report;  \n \n8. \nAlso requests the Secretary-General to continue with the implementation \nof flexible workplace strategies in New York in 2020, with the full utilization of \nmaximum occupancy per floor, and to report thereon at the main part of the seventy-\nfifth session of the General Assembly;  \n \n9. \nFurther requests the Secretary-General to closely monitor and manage the \nremaining works to ensure completion of the flexible workspace project in the third \nquarter of 2020, and stresses the need to ensure completion of the project on time and \nwithin the estimated cost;  \n \n10. \nRecalls paragraph 28 of the report of the Advisory Committee, and decides \nthat future reports of the Secretary-General should continue to include the unit costs of \ngoods and services procured under the construction and systems furniture categories;  \n__________________ \n \n19  A/74/345. \n \n20  A/74/7/Add.18. \n\nA/RES/74/263 \nSpecial subjects relating to the proposed\nprogramme budget for 2020\n \n19-22730\n14/25 \n \n \n11. \nAlso recalls paragraph 27 of the report of the Advisory Committee, and \nrequests the Secretary-General to seek further efficiencies in this regard and to \ninclude detailed information and explanations for the cost changes for each completed \nfloor in his next report;  \n \n12. Approves the continuation of three temporary positions (1 P-5, 1 P-4 and \n1 General Service (Other level)) for the project team;  \n \n13. Appropriates an amount of 6,795,948 dollars for the project costs under \nsection 29B, Department of Operational Support, of the proposed programme budget \nfor 2020; \n \n \n \nX \n \n \nProgress in the renovation of Africa Hall and the construction of new office \nfacilities at the Economic Commission for Africa in Addis Ababa \n \n \nRecalling its resolution 56/270 of 27 March 2002, section IX of its resolution \n62/238 of 22 December 2007, section I of its resolution 63/263 of 24 December 2008, \nits resolution 64/243, section III of its resolution 65/259, section VII of its resolution \n66/247, section II of its resolution 67/246, section III of its resolution 68/247 A, \nsection V of its resolution 69/262, section IX of its resolution 70/248 A, section V of \nits resolution 71/272 A, section XII of its resolution 72/262 A and section VIII of its \nresolution 73/279 A,  \n \nHaving considered the report of the Secretary-General21 and the related report \nof the Advisory Committee,22 \n \n1. \nTakes note of the report of the Secretary-General;21 \n \n2. \nEndorses the conclusions and recommendations contained in the report of \nthe Advisory Committee;22 \n \n3. \nExpresses its gratitude to the Government of Ethiopia, as the host country, \nfor its continued support for the construction of additional office facilities, as well as \nthe renovation of Africa Hall, including conference rooms, at the Economic \nCommission for Africa in Addis Ababa;  \n \n4. \nWelcomes the close-out of the construction project of the new office \nfacilities (Zambezi Building) and its ancillary works, and encourages the Secretary-\nGeneral to continue to engage with the host country in the preservation of the \nenvironment, including the greening of the compound and public spaces in its vicinity;  \n \n5. \nAppreciates the financial contribution of the Government of Mali, the \nin-kind contribution from the Government of Ethiopia and a pledge by the \nGovernment of Switzerland, and reiterates its request to the Secretary-General to \ncontinue to seek both voluntary and in-kind contributions from Member States, in full \ncompliance with all relevant regulations and rules of the Organization, and to provide \ndetailed information in the context of the next progress report;  \n \n6. \nEncourages the Secretary-General to continue to utilize local knowledge, \nmaterial, technology and capacity throughout the implementation of construction and \nrenovation projects at the Economic Commission for Africa in Addis Ababa, as \nappropriate;  \n \n7. \nRequests the Secretary-General to make additional efforts to raise global \nawareness of the historic Africa Hall and the African heritage that it represents, and \n__________________ \n \n21  A/74/328. \n \n22  A/74/7/Add.19. \n\nSpecial subjects relating to the proposed \nprogramme budget for 2020 \nA/RES/74/263\n \n15/25\n19-22730 \n \nto cultivate partnerships with regional and international academic and research \ninstitutions, including universities and museums, specializing in African history and \nculture;  \n \n8. \nAppreciates the continued commitment of the Secretary-General to ensure \nthe preservation of the historical and architectural integrity of Africa Hall, and \nunderlines the need to continue to engage key stakeholders, including the host \nGovernment, the African Union and the United Nations Educational, Scientific and \nCultural Organization, in safeguarding the heritage conservation objective;  \n \n9. \nRequests the Secretary-General to provide a comprehensive assessment of \nthe number of possible visitors annually to the renovated Africa Hall and its visitors\u2019 \ncentre, and to propose different admission options for visitors of various income \nbrackets, including a fee exemption for children, students and those above the age \nof 65, as well as a more refined outreach strategy, following the completion of the \nrenovation of Africa Hall and its visitors\u2019 centre, and to report his findings thereon in \nhis next progress report;  \n \n10. Stresses the importance of governance, effective oversight, transparency \nand accountability in the management of the project to ensure that the objectives of \nthe project are achieved within the approved budget and time schedule;  \n \n11. \nEmphasizes the need for the Office of Internal Oversight Services to \ncontinue to provide oversight on the renovation of Africa Hall, as appropriate, and to \ncontinue to include information on key findings;  \n \n12. Emphasizes that the Global Asset Management Policy Service should \ncontinue to be actively involved in overseeing the project to ensure the central \nsupervision of capital projects, including risk management and alignment with \nlessons learned, and encourages the Secretary-General to continue to engage with the \nStakeholders Committee, the Advisory Board and the host country to improve \ncoordination efforts in the implementation of the project;  \n \n13. Reiterates its request to the Secretary-General to submit to the General \nAssembly, at the main part of its seventy-fifth session, a progress report on the \nimplementation of the construction projects and the renovation of the conference \nfacilities, including Africa Hall and its visitors\u2019 centre, outlining, inter alia, project \nexpenditure and total costs;  \n \n14. Requests the Secretary-General to continue to engage with the host country \nand to provide, in his next progress report, an update on the construction of a parking \nlot on the parcel of land provided by the Government of Ethiopia;  \n \n15. Reaffirms its request to the Secretary-General to continue to take \nappropriate measures to mitigate potential risks and to monitor closely the Africa Hall \nrenovation project in order to avoid any further delay;  \n \n16. \nReiterates its request to the Secretary-General to include an update on the \nmanagement of the main risks and the related mitigation measures, with a view to \nkeeping the approved time frame of the project, to avoiding cost overruns and to ensuring \nthe delivery of the project within the scope, budget and timeline, as approved by the \nGeneral Assembly, and requests an update in the context of his next progress report;  \n \n17. Recalls paragraph 21 of the report of the Advisory Committee, and \nrequests the Secretary-General to include in his next progress report detailed \ninformation on the envisaged renewable energy efficiency measures, wastewater \ntreatment, solid waste management and water management in the context of the Africa \nHall renovation project, drawing from best practices and lessons learned from other \nUnited Nations construction projects, as appropriate;  \n\nA/RES/74/263 \nSpecial subjects relating to the proposed\nprogramme budget for 2020\n \n19-22730\n16/25 \n \n \n18. Welcomes the steps taken by the Secretary-General to ensure conformity \nof Africa Hall and its visitors\u2019 centre with relevant building codes and standards, as \nwell as best practices for persons with disabilities;  \n \n19. Appropriates an amount of 8,434,100 dollars for the project for 2020, \ncomprising 752,000 dollars under section 18, Economic and social development in \nAfrica, 7,577,100 dollars under section 33, Construction, alteration, improvement and \nmajor maintenance, and 105,000 dollars under section 34, Safety and security, of the \nproposed programme budget for 2020, which would represent a charge against the \ncontingency fund;  \n \n \n \nXI \n \n \nProgress on the renovation of the North Building at the Economic Commission \nfor Latin America and the Caribbean in Santiago \n \n \nRecalling section VII of its resolution 69/274 A, section VI of its resolution \n70/248 B of 1 April 2016, section V of its resolution 72/262 A and section X of its \nresolution 73/279 A,  \n \nHaving considered the report of the Secretary-General23 and the related report \nof the Advisory Committee,24 \n \n1. \nTakes note of the report of the Secretary-General;23 \n \n2. \nEndorses the conclusions and recommendations contained in the report of \nthe Advisory Committee;24 \n \n3. \nAcknowledges the important role played by the host countries in \nfacilitating the maintenance and construction of United Nations facilities, and stresses \nthe value of continued collaboration with host countries in this regard;  \n \n4. \nExpresses its gratitude to the Government of Chile, as the host country, for \nits continued efforts in supporting and facilitating the work of the Economic \nCommission for Latin America and the Caribbean;  \n \n5. \nRecalls paragraph 4 of the report of the Advisory Committee, and requests \nthe Secretary-General to remain proactive in seeking both voluntary and in-kind \ncontributions from Member States, in full compliance with all relevant regulations \nand rules of the Organization, and to provide detailed information on the matter in the \ncontext of his next progress report;  \n \n6. \nStresses the importance of governance, effective oversight, transparency \nand accountability in the management of the project to ensure that its objectives are \nachieved within the scope, budget and timeline approved by the General Assembly;  \n \n7. \nEmphasizes that the Global Asset Management Policy Service should \ncontinue to be actively involved in overseeing the project to ensure the central \nsupervision of capital projects, including risk management and alignment with \nlessons learned;  \n \n8. \nRecalls paragraphs 8 and 10 of the report of the Advisory Committee, \nrequests the Secretary-General to closely monitor and mitigate all project risks and \ntake all measures necessary to ensure the delivery of the project within the scope, \nbudget and timeline, as approved by the General Assembly, and also requests the \nSecretary-General to include information on risk management and mitigation \nmeasures taken in his next progress report;  \n__________________ \n \n23  A/74/330. \n \n24  A/74/7/Add.11. \n\nSpecial subjects relating to the proposed \nprogramme budget for 2020 \nA/RES/74/263\n \n17/25\n19-22730 \n \n \n9. \nWelcomes the wastewater treatment plans under way, and requests the \nSecretary-General to report to the General Assembly in his next report in this regard;  \n \n10. Recalls paragraph 21 of the report of the Advisory Committee, welcomes \nthe planned renovation of the North Building at the Economic Commission for Latin \nAmerica and the Caribbean as a sustainable and energy-efficient building where the \ntotal amount of energy used by the building on an annual basis is equal to or less than \nthe amount of renewable energy generated on site;  \n \n11. \nAlso recalls paragraphs 14 and 16 of the report of the Advisory Committee, \nand requests the Secretary-General to provide more detailed information regarding \nthe planned seismic mitigation measures in his future reports on the renovation of the \nNorth Building at the Economic Commission for Latin America and the Caribbean;  \n \n12. Reiterates its request to the Secretary-General to ensure that the project \ndelivers renovation works that conform to relevant building codes and standards, \nincluding provisions for persons with disabilities concerning accessibility, technology \nand workplace safety;  \n \n13. Requests the Secretary-General to annually review the role and funding \nratio of the position of Project Coordinator (P-3), jointly funded by the Economic \nCommission for Latin America and the Caribbean and the United Nations Office at \nNairobi, and provide detailed information in his next report;  \n \n14. Appropriates an amount of 389,100 dollars for the project in 2020, \ncomprising 285,800 dollars under section 21, Economic and social development in \nLatin America and the Caribbean, and 103,300 dollars under section 33, Construction, \nalteration, improvement and major maintenance, of the proposed programme budget \nfor 2020;  \n \n \n \nXII \n \n \nSeismic mitigation retrofit and life-cycle replacements project at the Economic \nand Social Commission for Asia and the Pacific premises in Bangkok \n \n \nRecalling section XII of its resolution 70/248 A, section IV of its resolution \n71/272 A, section XIII of its resolution 72/262 A and section VII of its resolution \n73/279 A,  \n \nHaving considered the report of the Secretary-General25 and the related report \nof the Advisory Committee,26 \n \n1. \nTakes note of the report of the Secretary-General;25  \n \n2. \nEndorses the conclusions and recommendations contained in the report of \nthe Advisory Committee;26 \n \n3. \nWelcomes the continued efforts of the Government of Thailand, as the host \ncountry, in facilitating the work of the Economic and Social Commission for Asia and \nthe Pacific in Bangkok;  \n \n4. \nAlso welcomes the positive steps taken towards engaging with the host \ncountry, and encourages the Economic and Social Commission for Asia and the \nPacific to continue the discussions on cooperation with the host country in this regard;  \n \n5. \nEncourages the Secretary-General to continue his efforts to include local \nknowledge, technology and capacity throughout the implementation of the \nconstruction project, as appropriate;  \n__________________ \n \n25  A/74/317. \n \n26  A/74/7/Add.8. \n\nA/RES/74/263 \nSpecial subjects relating to the proposed\nprogramme budget for 2020\n \n19-22730\n18/25 \n \n \n6. \nRecalls paragraph 20 of the report of the Advisory Committee, and \nwelcomes the steps taken by the Secretary-General to make the Economic and Social \nCommission for Asia and the Pacific building conform to relevant building standards \nand best practices for persons with disabilities;  \n \n7. \nStresses the importance of governance, effective oversight, transparency \nand accountability in the management of the project to ensure that the objectives of \nthe project are achieved within budget and in a timely manner;  \n \n8. \nEmphasizes that the Global Asset Management Policy Service should \ncontinue to be actively involved in overseeing the project to ensure the central \nsupervision of capital projects, including risk management and alignment with \nlessons learned;  \n \n9. \nRequests the Secretary-General to continue to take into account lessons \nlearned and best practices from past construction and renovation projects and, in \nparticular, to draw from experience and knowledge acquired from other capital projects;  \n \n10. Recalls paragraph 9 of section VII of its resolution 73/279 A, and reiterates \nthat unused contingency funds must be carried over to subsequent years and that all \nremaining unused contingency funds must be returned to Member States at the \nconclusion of the project, in 2023;  \n \n11. \nAlso recalls paragraph 21 of the report of the Advisory Committee, and \nrequests the Secretary-General to proactively manage and mitigate risks identified to \nensure the successful delivery of the project within the scope, budget and timeline \napproved by the General Assembly, and to provide an update on relevant measures \ntaken in his next report;  \n \n12. Further recalls paragraph 22 of the report of the Advisory Committee, and \nrequests the Secretary-General to continue to ensure the implementation of the \nrecommendations of the Office of Internal Oversight Services;  \n \n13. Reiterates its request to the Secretary-General to remain proactive in \nseeking both voluntary and in-kind contributions from Member States, in full \ncompliance with all relevant rules and regulations of the Organization, and to provide \ndetailed information on the matter in the context of his next report;  \n \n14. Approves the establishment of three temporary positions, (1 Safety Project \nOfficer (Local level), 1 Information Technology Assistant (Local level) and 1 Security \nOfficer (Local level)), effective 1 January 2020, in the project team, under section 19, \nEconomic and social development in Asia and the Pacific, of the proposed programme \nbudget for 2020;  \n \n15. Appropriates an amount of 6,410,700 dollars for project activities in 2020, \ncomprising 907,200 dollars under section 19, Economic and social development in \nAsia and the Pacific, and 5,503,500 dollars under section 33, Construction, alteration, \nimprovement and major maintenance, of the proposed programme budget for 2020, \nwhich would represent a charge against the contingency fund;  \n \n \n \nXIII \n \n \nProgress on the replacement of office blocks A to J at the United Nations Office \nat Nairobi \n \n \nRecalling section XIV of its resolution 72/262 A and section IX of its resolution \n73/279 A,  \n\nSpecial subjects relating to the proposed \nprogramme budget for 2020 \nA/RES/74/263\n \n19/25\n19-22730 \n \n \nHaving considered the report of the Secretary-General27 and the related report \nof the Advisory Committee,28 \n \n1. \nTakes note of the report of the Secretary-General;27  \n \n2. \nEndorses the conclusions and recommendations contained in the report of \nthe Advisory Committee;28  \n \n3. \nAcknowledges the important role played by the host country in facilitating \nthe maintenance and construction of United Nations facilities in Nairobi, and stresses \nthe value of continued collaboration with the host country in this regard;  \n \n4. \nExpresses its gratitude to the host country for its continued support for the \nUnited Nations Office at Nairobi, and trusts that the Secretary-General will continue \nto engage, as appropriate, with the host country as has been the practice with respect \nto other construction projects at the Office;  \n \n5. \nEncourages the Secretary-General to continue his efforts to include local \nknowledge, technology, material and capacity, in particular the use of materials available \nand/or manufactured locally, throughout the implementation of the replacement of office \nblocks A to J at the United Nations Office at Nairobi, as appropriate;  \n \n6. \nReiterates its request to the Secretary-General to remain proactive in \nseeking both voluntary and in-kind contributions from Member States, in full \ncompliance with all relevant rules and regulations of the Organization, and to provide \ndetailed information on the matter in the context of his next progress report;  \n \n7. \nStresses the importance of governance, effective oversight, transparency \nand accountability in the management of the project to ensure that the objectives of \nthe project are achieved within the approved budget and time schedule;  \n \n8. \nEmphasizes that the Global Asset Management Policy Service should \ncontinue to be actively involved in overseeing the project to ensure the central \nsupervision of capital projects, including risk management and alignment with \nlessons learned;  \n \n9. \nRequests the Secretary-General, through the Global Asset Management \nPolicy Service, to take into account lessons learned and best practices from similar \npast construction and renovation projects in the planning, design and implementation \nof the proposed replacement of office blocks A to J;  \n \n10. Encourages the Secretary-General to continue to make every effort in \nimplementing measures against slippages in the timeline of the project, and to \nmitigate their potential impact on project costs and completion time;  \n \n11. \nRecalls paragraph 10 of section IX of its resolution 73/279 A, and reiterates \nits request to the Secretary-General for an updated proposal, including refined \ninformation on the full scope, maximum overall cost and implementation strategy;  \n \n12. Requests the Secretary-General to ensure conformity with relevant building \ncodes and standards, as well as best practices for persons with disabilities, in the \ndesign, construction and renovation of United Nations Office at Nairobi facilities;  \n \n13. Recalls paragraph 23 of the report of the Advisory Committee, and requests \nthe Secretary-General to incorporate the envisaged renewable energy efficiency \nmeasures, wastewater treatment, solid waste management and water management into \nthe design and construction of the United Nations Office at Nairobi project on office \nblocks A to J, including lessons learned from other construction projects;  \n__________________ \n \n27  A/74/343. \n \n28  A/74/7/Add.15. \n\nA/RES/74/263 \nSpecial subjects relating to the proposed\nprogramme budget for 2020\n \n19-22730\n20/25 \n \n \n14. Appropriates an amount of 10,490,100 dollars, comprising 1,095,400 \ndollars under section 29G, Administration, Nairobi, 9,169,600 dollars under \nsection 33, Construction, alteration, improvement and major maintenance, and \n225,100 dollars under section 34, Safety and security, of the proposed programme \nbudget for 2020;  \n \n \n \nXIV \n \n \nAddressing the deteriorating conditions and limited capacity of the conference \nservices facilities at the United Nations Office at Nairobi \n \n \nRecalling its resolution 73/270 of 22 December 2018,  \n \nHaving considered the report of the Secretary-General29 and the related report \nof the Advisory Committee,30 \n \n1. \nTakes note of the report of the Secretary-General;29 \n \n2. \nEndorses the conclusions and recommendations contained in the report of \nthe Advisory Committee;30 \n \n3. \nRecalls paragraph 23 of the report of the Advisory Committee, and \nrequests the Secretary-General to conduct a needs assessment and explore options \nthat maximize efficiency and cost-effectiveness, taking into consideration the future \nneeds of the United Nations Office at Nairobi conference facilities, and to submit a \nreport to the General Assembly at its seventy-fifth session;  \n \n4. \nAppropriates an amount of 470,000 dollars under section 29G, \nAdministration, Nairobi, of the proposed programme budget for 2020, which would \nrepresent a charge against the contingency fund;  \n \n \n \nXV \n \n \nRevised estimates resulting from resolutions and decisions adopted by the \nHuman Rights Council at its fortieth, forty-first and forty-second sessions \n \n \nHaving considered the report of the Secretary-General31 and the related report \nof the Advisory Committee,32 \n \n1. \nTakes note of the report of the Secretary-General;31 \n \n2. \nEndorses the conclusions and recommendations contained in the report of \nthe Advisory Committee;32 \n \n3. \nApproves the establishment, effective 1 January 2020, of 18 posts under \nsection 24, Human rights, of the proposed programme budget for 2020, comprising \n6 posts to support the activities mandated by the Human Rights Council in its \nresolutions 40/13 of 22 March 2019,33 42/20 and 42/22 of 26 September 2019 and \n42/23 of 27 September 201934 and 12 posts for the establishment of the country office \nin the Sudan, as mandated in resolution 42/35 of 27 September 2019;34  \n \n4. \nAppropriates an additional amount of 20,198,300 dollars, comprising \n1,701,200 dollars under section 2, General Assembly and Economic and Social \nCouncil affairs and conference management, 18,488,700 dollars under section 24, \n__________________ \n \n29  A/74/471. \n \n30  A/74/7/Add.22. \n \n31  A/74/529. \n \n32  A/74/7/Add.26. \n \n33  See Official Records of the General Assembly, Seventy-fourth Session, Supplement No. 53 \n(A/74/53), chap. IV, sect. A. \n \n34  Ibid., Supplement No. 53A (A/74/53/Add.1), chap. III. \n\nSpecial subjects relating to the proposed \nprogramme budget for 2020 \nA/RES/74/263\n \n21/25\n19-22730 \n \nHuman rights, and 8,400 dollars under section 29E, Administration, Geneva, of the \nproposed programme budget for 2020;  \n \n5. \nAlso appropriates an amount of 866,000 dollars under section 36, Staff \nassessment, to be offset by an equivalent amount under income section 1, Income \nfrom staff assessment, of the proposed programme budget for 2020;  \n \n \n \nXVI \n \n \nRevised estimates relating to the programme budget for 2020 under section 27, \nHumanitarian assistance, and section 36, Staff assessment, for the Office of the \nUnited Nations Emergency Ebola Response Coordinator \n \n \nHaving considered the report of the Secretary-General35 and the related report \nof the Advisory Committee,36 \n \n1. \nTakes note of the report of the Secretary-General;35  \n \n2. \nEndorses the conclusions and recommendations contained in the report of \nthe Advisory Committee,36 subject to the provisions of the present resolution;  \n \n3. \nRecalls paragraph 6 of the report of the Advisory Committee, and \nwelcomes the development of the \u201cgetting to zero\u201d strategy to address the fluctuating \nnature of the Ebola virus in the region;  \n \n4. \nTakes note of paragraphs 17 and 20 of the report of the Advisory Committee;  \n \n5. \nAppropriates an additional amount of 6,325,500 dollars for the Office of \nthe United Nations Emergency Ebola Response Coordinator for the period from \n1 January to 30 June 2020 under section 27, Humanitarian assistance, of the proposed \nprogramme budget for 2020, representing a charge against the contingency fund;  \n \n6. \nAlso appropriates an amount of 351,200 dollars under section 36, Staff \nassessment, to be offset by an equivalent amount under income section 1, Income \nfrom staff assessment, of the proposed programme budget for 2020;  \n \n \n \nXVII \n \n \nEnterprise resource planning project, Umoja \n \n \nRecalling section II of its resolution 60/283 of 7 July 2006, section II of its \nresolution 63/262 of 24 December 2008, its resolution 64/243, section II.A of its \nresolution 65/259, its resolution 66/246 of 24 December 2011, section III of \nits resolution 66/263 of 21 June 2012, section III of its resolution 67/246, its \nresolution 68/246 of 27 December 2013, sections IV and VI of its resolution 69/274 \nA, section XVII of its resolution 70/248 A, section XIV of its resolution 71/272 A, \nsection XXI of its resolution 72/262 A and section XVII of its resolution 73/279 A, \n \nHaving considered the eleventh progress report of the Secretary-General on the \nenterprise resource planning project,37 the note by the Secretary-General transmitting \nthe eighth annual progress report of the Board of Auditors on the implementation of \nthe United Nations enterprise resource planning system 38 and the related report of the \nAdvisory Committee,39 \n \n1. \nTakes note of the report of the Secretary-General37 and the note by the \nSecretary-General;38  \n__________________ \n \n35  A/74/544. \n \n36  A/74/7/Add.27. \n \n37  A/74/478. \n \n38  A/74/153. \n \n39  A/74/7/Add.17. \n\nA/RES/74/263 \nSpecial subjects relating to the proposed\nprogramme budget for 2020\n \n19-22730\n22/25 \n \n \n2. \nAlso takes note of the findings of the report of the Board of Auditors,38 and \nendorses the recommendations contained therein; \n \n3. \nEndorses the conclusions and recommendations contained in the report of \nthe Advisory Committee;39  \n \n4. \nApproves the resource requirements for the completion of the project in \n2020, in the amount of 34,316,700 dollars;  \n \n \n \nProgramme budget \n \n \n5. \nApproves an amount of 3,237,400 dollars under the proposed programme \nbudget for 2020 under component 1, Enterprise resource planning project, of \nsubsection 29A, Department of Management Strategy, Policy and Compliance, \nrepresenting the additional regular budget share for the Umoja project costs for 2020;  \n \n \n \nSupport account for peacekeeping operations \n \n \n6. \nNotes that resource requirements in the amount of 13,381,300 dollars will \nbe included in the subsequent requirements for the support account for peacekeeping \noperations for the financial period from 1 July 2020 to 30 June 2021;  \n \n \nExtrabudgetary resources  \n \n \n7. \nNotes that requirements in the amount of 4,964,000 dollars will be funded \nfrom extrabudgetary resources in the financial year 2020;  \n \n \n \nXVIII \n \n \nEstimates in respect of special political missions, good offices and other political \ninitiatives authorized by the General Assembly and/or the Security Council \n \n \nHaving considered the reports of the Secretary-General40 and the related reports \nof the Advisory Committee,41 \n \n1. \nTakes note of the reports of the Secretary-General;40  \n \n2. \nEndorses the conclusions and recommendations contained in the reports \nof the Advisory Committee,41 subject to the provisions of the present resolution;  \n \n3. \nAffirms that special political missions play a critical role in the \nmaintenance of international peace and security;  \n \n4. \nExpresses its concern at the late consideration of the budgets of special \npolitical missions, particularly as part of the annual budgeting, and reiterates the \nimportance of the Advisory Committee considering the budgets of special political \nmissions in sufficient time to allow the General Assembly the time necessary to make \nconsidered decisions;  \n \n5. \nRecalls paragraph 9 of the report of the Advisory Committee, 42  and \nreiterates its request to the Secretary-General to present future budget proposals for \nspecial political missions no later than the last week of October;  \n \n6. \nStresses that finance serves as the foundation of and an important element \nunderpinning United Nations governance;  \n__________________ \n \n40  A/74/6 (Sect. 3)/Add.1, A/74/6 (Sect. 3)/Add.2, A/74/6 (Sect. 3)/Add.3, A/74/6 (Sect. 3)/Add.4, \nA/74/6 (Sect. 3)/Add.5, A/74/6 (Sect. 3)/Add.5/Corr.1, A/74/6 (Sect. 3)/Add.6,  \nA/74/6 (Sect. 3)/Add.6/Corr.1, A/74/6 (Sect. 3)/Add.7 and A/74/6 (Sect. 3)/Add.8. \n \n41  A/74/7, A/74/7/Add.1, A/74/7/Add.2, A/74/7/Add.3, A/74/7/Add.4, A/74/7/Add.5, A/74/7/Add.6, \nA/74/7/Add.7, A/74/7/Add.23 and A/74/7/Add.24. \n \n42  A/74/7/Add.1. \n\nSpecial subjects relating to the proposed \nprogramme budget for 2020 \nA/RES/74/263\n \n23/25\n19-22730 \n \n \n7. \nNotes that, pursuant to its resolution 72/266 A of 24 December 2017, it had \napproved the earlier submission of budget proposals for special political missions to \nensure alignment with the rest of the proposed annual budget, also notes that, with \nthis change, the envelope for special political missions within the biennium \nprogramme budget was discontinued, given that budgets are produced annually, and \nfurther notes that the resource requirements of the individual special political \nmissions were included as a special subject in addenda 1 to 6 to section 3, Political \naffairs, of the proposed programme budget for 2020; \n \n8. \nStresses the importance of developing a comprehensive performance \nmanagement system, and requests the Secretary-General to develop qualitative and \nquantitative indicators to help missions to measure progress in mandate \nimplementation and to report thereon in the context of his next report;  \n \n9. \nRequests the Secretary-General to continue his efforts to promote the \nnationalization of positions, whenever appropriate, as well as to build local capacity \nwithin the special political missions and to report thereon in the context of future \nbudget submissions;  \n \n10. Also requests the Secretary-General to promptly complete the recruitment \nprocess for those positions presently encumbered by the use of special post \nallowances and to include information on temporary assignments with special post \nallowances, including the length of those assignments and the recruitment status of \nthe related posts, in the context of special political mission budget proposals in 2020;  \n \n11. \nRecalls its stipulation that the use of external consultants should be kept \nto an absolute minimum and that the Organization should utilize its in-house capacity \nto perform core activities or to fulfil functions that are recurrent over the long term;  \n \n12. Also recalls paragraph 39 of the report of the Advisory Committee,42 and \nrequests the Secretary-General to report the ratios of allocations of vehicles and \ninformation technology equipment and to provide specific justification for higher \nallocations by missions in the context of future budget submissions;  \n \n13. Further recalls paragraph 41 of the report of the Advisory Committee,42 \nand encourages the Secretary-General to ensure that the cost-sharing arrangements \nwill be enhanced, with a view to maximizing efficiency;  \n \n14. Requests the Secretary-General, in his next budget submission, to \nsummarize the justification and link of the appropriation and use of travel expenses \nto support the implementation of Security Council resolution 2231 (2015) of 20 July \n2015 and to present the role of the Secretariat in preparing reports on the resolution, \nas guided by the mandate of the Council; \n \n15. Reaffirms its commitment to considering the review of the arrangements \non the funding and backstopping of the special political missions and the \nrecommendations of the Advisory Committee, and expresses its commitment to \nconsidering this matter, with a view to making a decision, without prejudging the \noutcome, at the main part of its seventy-fifth session; \n \n \n \nThematic cluster III: Regional offices, offices in support of political processes \nand other missions \n \n \n \nUnited Nations Office for West Africa and the Sahel \n \n \n16. Recalls paragraph 28 of section XIV of its resolution 73/279 A, and \ndecides to retain one position of Finance and Budget Assistant (Local level) as a \ngeneral temporary assistance position until 31 December 2020;  \n \n17. Decides to further reduce resources by 77,100 dollars; \n\nA/RES/74/263 \nSpecial subjects relating to the proposed\nprogramme budget for 2020\n \n19-22730\n24/25 \n \n \n \nUnited Nations Integrated Peacebuilding Office in Guinea-Bissau \n \n \n18. Decides to further reduce resources by 700,000 dollars;  \n \n \n \nUnited Nations Assistance Mission in Somalia  \n \n \n19. Takes note of paragraph 19 of the report of the Advisory Committee,43 and \ndecides to establish one position of Electoral Officer (P-4) in New York in the \nDepartment of Political and Peacebuilding Affairs;  \n \n20. Decides to further reduce resources by 1,176,100 dollars; \n \n \n \nUnited Nations support for the Cameroon-Nigeria Mixed Commission  \n \n \n21. Decides to further reduce resources by 43,000 dollars; \n \n \n \nUnited Nations Regional Office for Central Africa  \n \n \n22. Decides to further reduce resources by 42,300 dollars; \n \n \nUnited Nations Support Mission in Libya  \n \n \n23. Decides to establish one position of Contract Management Officer \n(National Professional Officer); \n \n24. Also decides to further reduce resources by 35,300 dollars; \n \n \n \nUnited Nations Verification Mission in Colombia \n \n \n25. Decides to further reduce resources by 123,800 dollars; \n \n \n \nUnited Nations Assistance Mission in Afghanistan  \n \n \n26. Decides to further reduce resources by 430,800 dollars; \n \n \n \nUnited Nations Mission to Support the Hudaydah Agreement  \n \n \n27. Decides to further reduce resources by 794,000 dollars; \n \n \n \nUnited Nations Integrated Office in Haiti  \n \n \n28. Takes note of the request of the Secretary-General, and decides to establish \na position of Principal Human Rights Officer (D-1) as a general temporary assistance \nposition;  \n \n29. Decides to further reduce resources by 177,600 dollars; \n \n30. Approves the budgets in the amount of 710,210,400 dollars for the \n39 continuing special political missions authorized by the General Assembly and/or \nthe Security Council and an amount of 1,424,400 dollars for the share of special \npolitical missions in the budget of the Regional Service Centre in Entebbe, Uganda, \nfor 2020, of which 639,877,900 has been included under section 3, Political affairs, \nof the proposed programme budget for 2020;  \n \n31. Decides to appropriate an additional amount of 71,756,900, dollars under \nsection 3, Political affairs, of the programme budget for 2020 for the United Nations \nMission to Support the Hudaydah Agreement and the United Nations Integrated \nOffice in Haiti, under the procedures provided for in paragraph 11 of annex I to \nresolution 41/213 of 19 December 1986;  \n__________________ \n \n43  A/74/7/Add.4. \n\nSpecial subjects relating to the proposed \nprogramme budget for 2020 \nA/RES/74/263\n \n25/25\n19-22730 \n \n \n32. Also decides to appropriate the related staff assessment portion in the \namount of 2,768,400 dollars under section 36, Staff assessment, to be offset by a \ncorresponding amount under income section 1, Income from staff assessment, of the \nproposed programme budget for 2020;  \n \n \n \nXIX \n \n \nGross jointly financed budget of the Joint Inspection Unit  \n \n \nApproves the gross budget for the Joint Inspection Unit for 2020 in the amount \nof 7,049,000 dollars;  \n \n \n \nXX \n \n \nGross jointly financed budget of the International Civil Service Commission \n \n \nApproves the gross budget for the International Civil Service Commission for \n2020 in the amount of 9,729,700 dollars;  \n \n \n \nXXI \n \n \nGross jointly financed budget of the United Nations System Chief Executives \nBoard for Coordination \n \n \nNotes the gross budget for the United Nations System Chief Executives Board \nfor Coordination for 2020 in the amount of 3,192,200 dollars; \n \n \n \nXXII \n \n \nGross jointly financed budget of the Department of Safety and Security \n \n \nApproves the gross jointly financed budget of the Department of Safety and \nSecurity of the Secretariat for 2020 in the amount of 139,658,100 dollars, broken \ndown as follows: \n \n(a) \nField Security Operations: 124,169,400 dollars;  \n \n(b) \nSecurity and Safety Services at the United Nations Office at Vienna: \n15,488,700 dollars; \n \n \n \nXXIII \n \n \nEffects of changes in rates of exchange and inflation \n \n \nHaving considered the report of the Secretary-General on the revised estimates \nresulting from changes in rates of exchange and inflation44 and the related report of \nthe Advisory Committee,45 \n \nTakes note of the revised estimates arising from recosting owing to changes in \nthe rates of exchange and inflation; \n \n \n \nXXIV \n \n \nContingency fund \n \n \nNotes that a balance of 8,200 dollars remains in the contingency fund. \n \n52nd (resumed) plenary meeting \n27 December 2019 \n \n__________________ \n \n44  A/74/585. \n \n45  A/74/7/Add.31. \n",
  "paragraphs": {
    "1": "Takes note of the reports of the Secretary-General;40",
    "2": "Endorses the conclusions and recommendations contained in the reports of the Advisory Committee,41 subject to the provisions of the present resolution;",
    "3": "Affirms that special political missions play a critical role in the maintenance of international peace and security;",
    "4": "Expresses its concern at the late consideration of the budgets of special political missions, particularly as part of the annual budgeting, and reiterates the importance of the Advisory Committee considering the budgets of special political missions in sufficient time to allow the General Assembly the time necessary to make considered decisions;",
    "5": "Recalls paragraph 9 of the report of the Advisory Committee, 42 and reiterates its request to the Secretary-General to present future budget proposals for special political missions no later than the last week of October;",
    "6": "Stresses that finance serves as the foundation of and an important element underpinning United Nations governance; __________________ 40 A/74/6 (Sect. 3)/Add.1, A/74/6 (Sect. 3)/Add.2, A/74/6 (Sect. 3)/Add.3, A/74/6 (Sect. 3)/Add.4, A/74/6 (Sect. 3)/Add.5, A/74/6 (Sect. 3)/Add.5/Corr.1, A/74/6 (Sect. 3)/Add.6, A/74/6 (Sect. 3)/Add.6/Corr.1, A/74/6 (Sect. 3)/Add.7 and A/74/6 (Sect. 3)/Add.8. 41 A/74/7, A/74/7/Add.1, A/74/7/Add.2, A/74/7/Add.3, A/74/7/Add.4, A/74/7/Add.5, A/74/7/Add.6, A/74/7/Add.7, A/74/7/Add.23 and A/74/7/Add.24. 42 A/74/7/Add.1. Special subjects relating to the proposed programme budget for 2020 A/RES/74/263 23/25 19-22730",
    "7": "Notes that, pursuant to its resolution 72/266 A of 24 December 2017, it had approved the earlier submission of budget proposals for special political missions to ensure alignment with the rest of the proposed annual budget, also notes that, with this change, the envelope for special political missions within the biennium programme budget was discontinued, given that budgets are produced annually, and further notes that the resource requirements of the individual special political missions were included as a special subject in addenda 1 to 6 to section 3, Political affairs, of the proposed programme budget for 2020;",
    "8": "Stresses the importance of developing a comprehensive performance management system, and requests the Secretary-General to develop qualitative and quantitative indicators to help missions to measure progress in mandate implementation and to report thereon in the context of his next report;",
    "9": "Requests the Secretary-General to continue his efforts to promote the nationalization of positions, whenever appropriate, as well as to build local capacity within the special political missions and to report thereon in the context of future budget submissions;",
    "10": "Also requests the Secretary-General to promptly complete the recruitment process for those positions presently encumbered by the use of special post allowances and to include information on temporary assignments with special post allowances, including the length of those assignments and the recruitment status of the related posts, in the context of special political mission budget proposals in 2020;",
    "11": "Recalls its stipulation that the use of external consultants should be kept to an absolute minimum and that the Organization should utilize its in-house capacity to perform core activities or to fulfil functions that are recurrent over the long term;",
    "12": "Also recalls paragraph 39 of the report of the Advisory Committee,42 and requests the Secretary-General to report the ratios of allocations of vehicles and information technology equipment and to provide specific justification for higher allocations by missions in the context of future budget submissions;",
    "13": "Further recalls paragraph 41 of the report of the Advisory Committee,42 and encourages the Secretary-General to ensure that the cost-sharing arrangements will be enhanced, with a view to maximizing efficiency;",
    "14": "Requests the Secretary-General, in his next budget submission, to summarize the justification and link of the appropriation and use of travel expenses to support the implementation of Security Council resolution 2231 (2015) of 20 July 2015 and to present the role of the Secretariat in preparing reports on the resolution, as guided by the mandate of the Council;",
    "15": "Reaffirms its commitment to considering the review of the arrangements on the funding and backstopping of the special political missions and the recommendations of the Advisory Committee, and expresses its commitment to considering this matter, with a view to making a decision, without prejudging the outcome, at the main part of its seventy-fifth session; Thematic cluster III: Regional offices, offices in support of political processes and other missions United Nations Office for West Africa and the Sahel",
    "16": "Recalls paragraph 28 of section XIV of its resolution 73/279 A, and decides to retain one position of Finance and Budget Assistant (Local level) as a general temporary assistance position until 31 December 2020;",
    "17": "Decides to further reduce resources by 77,100 dollars; A/RES/74/263 Special subjects relating to the proposed programme budget for 2020 19-22730 24/25 United Nations Integrated Peacebuilding Office in Guinea-Bissau",
    "18": "Decides to further reduce resources by 700,000 dollars; United Nations Assistance Mission in Somalia",
    "19": "Takes note of paragraph 19 of the report of the Advisory Committee,43 and decides to establish one position of Electoral Officer (P-4) in New York in the Department of Political and Peacebuilding Affairs;",
    "20": "Decides to further reduce resources by 1,176,100 dollars; United Nations support for the Cameroon-Nigeria Mixed Commission",
    "21": "Decides to further reduce resources by 43,000 dollars; United Nations Regional Office for Central Africa",
    "22": "Decides to further reduce resources by 42,300 dollars; United Nations Support Mission in Libya",
    "23": "Decides to establish one position of Contract Management Officer (National Professional Officer);",
    "24": "Also decides to further reduce resources by 35,300 dollars; United Nations Verification Mission in Colombia",
    "25": "Decides to further reduce resources by 123,800 dollars; United Nations Assistance Mission in Afghanistan",
    "26": "Decides to further reduce resources by 430,800 dollars; United Nations Mission to Support the Hudaydah Agreement",
    "27": "Decides to further reduce resources by 794,000 dollars; United Nations Integrated Office in Haiti",
    "28": "Takes note of the request of the Secretary-General, and decides to establish a position of Principal Human Rights Officer (D-1) as a general temporary assistance position;",
    "29": "Decides to further reduce resources by 177,600 dollars;",
    "30": "Approves the budgets in the amount of 710,210,400 dollars for the 39 continuing special political missions authorized by the General Assembly and/or the Security Council and an amount of 1,424,400 dollars for the share of special political missions in the budget of the Regional Service Centre in Entebbe, Uganda, for 2020, of which 639,877,900 has been included under section 3, Political affairs, of the proposed programme budget for 2020;",
    "31": "Decides to appropriate an additional amount of 71,756,900, dollars under section 3, Political affairs, of the programme budget for 2020 for the United Nations Mission to Support the Hudaydah Agreement and the United Nations Integrated Office in Haiti, under the procedures provided for in paragraph 11 of annex I to resolution 41/213 of 19 December 1986; __________________ 43 A/74/7/Add.4. Special subjects relating to the proposed programme budget for 2020 A/RES/74/263 25/25 19-22730",
    "32": "Also decides to appropriate the related staff assessment portion in the amount of 2,768,400 dollars under section 36, Staff assessment, to be offset by a corresponding amount under income section 1, Income from staff assessment, of the proposed programme budget for 2020; XIX Gross jointly financed budget of the Joint Inspection Unit Approves the gross budget for the Joint Inspection Unit for 2020 in the amount of 7,049,000 dollars; XX Gross jointly financed budget of the International Civil Service Commission Approves the gross budget for the International Civil Service Commission for 2020 in the amount of 9,729,700 dollars; XXI Gross jointly financed budget of the United Nations System Chief Executives Board for Coordination Notes the gross budget for the United Nations System Chief Executives Board for Coordination for 2020 in the amount of 3,192,200 dollars; XXII Gross jointly financed budget of the Department of Safety and Security Approves the gross jointly financed budget of the Department of Safety and Security of the Secretariat for 2020 in the amount of 139,658,100 dollars, broken down as follows: (a) Field Security Operations: 124,169,400 dollars; (b) Security and Safety Services at the United Nations Office at Vienna: 15,488,700 dollars; XXIII Effects of changes in rates of exchange and inflation Having considered the report of the Secretary-General on the revised estimates resulting from changes in rates of exchange and inflation44 and the related report of the Advisory Committee,45 Takes note of the revised estimates arising from recosting owing to changes in the rates of exchange and inflation; XXIV Contingency fund Notes that a balance of 8,200 dollars remains in the contingency fund. 52nd (resumed) plenary meeting 27 December 2019 __________________ 44 A/74/585. 45 A/74/7/Add.31.",
    "33": "Recalls paragraph 33 of the report of the Advisory Committee, notes the proposed increase in posts for the Office of Investment Management, and decides to retain the general temporary assistance resources for the Office in 2020 at the level approved for 2019;",
    "34": "Requests the Pension Fund and the Secretary-General to find appropriate solutions in 2020 to resolve the situation of the P-4 and P-5 posts in the Executive Office, and requests the Pension Administration to report thereon in the context of the next report of the Pension Board;",
    "35": "Stresses the importance of having a consistent benefit processing rate and of maintaining the quality of service provided to clients in Europe, West Asia and Africa, and in this regard requests the Chief Executive of Pension Administration to maintain appropriate parallel characteristics of the Geneva Office and to provide updates on the issue in the context of the next report of the Pension Board;",
    "36": "Approves the changes to the staffing table as set out in the table below: A. Pension Board secretariat Action Title of post Category Number Redeployment (from Pension Administration) Programme Management Officer P-4 1 Redeployment (from Pension Administration) Meeting Services Assistant GS-OL 1 Redeployment (from Pension Administration) Secretary of the Pension Board D-1 1 Total net changes 3 Special subjects relating to the proposed programme budget for 2020 A/RES/74/263 11/25 19-22730 B. Pension Administration Action Title of post Category Number New post Human Resources Officer (recruitment) P-3 1 New post Administrative Assistant GS-OL 1 New post Benefits Assistant, Nairobi regional office (CS) LL 1 New post Benefits Assistant, Bangkok regional office (CS) LL 1 New post Information Systems Officer (Chief of Pension Interface Unit) P-4 1 New post Information Systems Assistant GS-OL 2 Total new posts 7 Conversion Benefits Officer, Nairobi regional office (CS) P-3 1 Conversion Benefits Officer, Bangkok regional office (CS) P-3 1 Total conversion 2 Redeployment (to Pension Board secretariat) Programme Management Officer P-4 -1 Redeployment (to Pension Board secretariat) Meeting services Assistant GS-OL -1 Redeployment (to Pension Board secretariat) Chief of Geneva Office D-1 -1 Redeployment (to Office of Investment Management) Information Systems Officer P-4 -1 Redeployment (to Office of Investment Management) Information Systems Assistant GS-OL -1 Total outward redeployment -5 Total net changes 4 C. Office of Investment Management Action Title of post Category Number New post Senior Legal Officer P-5 1 New post Legal Assistant GS-OL 1 New post Investment Officer \u2013 Private Equity P-3 1 New post Investment Officer \u2013 North America P-3 1 New post Senior Risk Officer \u2013 Head of Market Risk P-5 1 New post Risk Officer \u2013 Private Market P-4 1 New post Risk Officer \u2013 Portfolio Construction P-4 1 A/RES/74/263 Special subjects relating to the proposed programme budget for 2020 19-22730 12/25 Action Title of post Category Number New post Risk Officer \u2013 Operational and Fraud P-3 1 New post Risk Officer \u2013 Performance and Reporting P-3 1 New post Risk Officer \u2013 Credit Risk P-3 1 New post Administrative Assistant \u2013 Risk and Compliance GS-OL 1 New post Information System Officer \u2013 Systems Analyst P-3 1 Total new posts 12 Conversion Programme Management Officer P-4 1 Conversion Information System Officer \u2013 Service Desk Manager P-3 1 Conversion Information System Officer \u2013 Business Analyst P-3 2 Conversion Information System Assistant \u2013 Service Desk Assistant GS-OL 2 Conversion Programme Management Assistant GS-OL 1 Conversion Information System Officer \u2013 Business Continuity Manager P-3 1 Conversion Associate Accountant P-2 2 Conversion Senior Accounting Assistant GS-PL 1 Total conversions 11 Redeployment (from Pension Administration) Information Systems Officer P-4 1 Redeployment (from Pension Administration) Information Systems Assistant GS-OL 1 Total inward redeployment 2 Total net changes 25 Abbreviations: CS, Client Services; GS-OL, General Service (Other level); GS-PL, General Service (Principal level); LL, Local level.",
    "37": "Also approves the revised estimates of 184,916,800 dollars for the biennium 2018\u20132019 for the administration of the Pension Fund;",
    "38": "Further approves expenses, chargeable directly to the Pension Fund, totalling 92,899,100 dollars net for 2020;",
    "39": "Approves the amount of 7,782,200 dollars as the United Nations share of the cost of the administrative expenses of the Pension Fund for 2020, of which 4,863,900 dollars would represent the share of the regular budget and the balance of 2,918,300 dollars would represent the share of the funds and programmes;",
    "40": "Also approves the decrease of 2,306,300 dollars in the United Nations share of the cost of the administrative expenses of the central secretariat of the Pension Fund under section 1, Overall policymaking, direction and coordination, of the proposed programme budget for 2020; Special subjects relating to the proposed programme budget for 2020 A/RES/74/263 13/25 19-22730",
    "41": "Authorizes the Pension Board to supplement the voluntary contributions to the Emergency Fund for 2020 by an amount not to exceed 112,500 dollars; IX Progress in the implementation of a flexible workplace at United Nations Headquarters Recalling section V of its resolution 67/246, section III of its resolution 67/254 A of 12 April 2013, section IV of its resolution 68/247 B, section VII of its resolution 69/274 A, section XVI of its resolution 71/272 A, section XI of its resolution 72/262 A and section VI of its resolution 73/279 A, Having considered the report of the Secretary-General19 and the related report of the Advisory Committee,20"
  },
  "agenda_items": [
    "Item 135"
  ],
  "symbol_references": []
}