{
  "symbol": "A/RES/74/61",
  "filename": "A_RES_74_61.pdf",
  "title": "74/61. Implementation of the Convention on the Prohibition of the Use, Stockpiling, Production and Transfer of Anti-Personnel Mines and on Their Destruction",
  "text": "United Nations \nA/RES/74/61\n \n \nGeneral Assembly \nDistr.: General \n20 December 2019 \n \n19-21860 (E)    030120 \n*1921860* \n \n \nSeventy-fourth session \nAgenda item 98 (n) \nGeneral and complete disarmament: implementation of the \nConvention on the Prohibition of the Use, Stockpiling, \nProduction and Transfer of Anti-Personnel Mines \nand on Their Destruction \n \n \n \n \n Resolution adopted by the General Assembly \non 12 December 2019 \n \n \n \n \n[on the report of the First Committee (A/74/368)] \n \n \n \n74/61. Implementation of the Convention on the Prohibition of the Use, \nStockpiling, Production and Transfer of Anti-Personnel Mines \nand on Their Destruction \n \n \n \nThe General Assembly,  \n \nRecalling its resolutions 54/54 B of 1 December 1999, 55/33 V of 20 November \n2000, 56/24 M of 29 November 2001, 57/74 of 22 November 2002, 58/53 of \n8 December 2003, 59/84 of 3 December 2004, 60/80 of 8 December 2005, 61/84 of \n6 December 2006, 62/41 of 5 December 2007, 63/42 of 2 December 2008, 64/56 of \n2 December 2009, 65/48 of 8 December 2010, 66/29 of 2 December 2011, 67/32 of \n3 December 2012, 68/30 of 5 December 2013, 69/34 of 2 December 2014, 70/55 of \n7 December 2015, 71/34 of 5 December 2016, 72/53 of 4 December 2017 and 73/61 \nof 5 December 2018, \n \nReaffirming its determination to put an end to the suffering and casualties \ncaused by anti-personnel mines, which kill or injure thousands of people \u2013 women, \ngirls, boys and men \u2013 every year, and which place people living in affected areas at \nrisk and hinder the development of their communities, \n \nBelieving it necessary to do the utmost to contribute in an efficient and \ncoordinated manner to facing the challenge of removing anti-personnel mines placed \nthroughout the world and to assure their destruction, \n \nWishing to do the utmost to ensure assistance for the care and rehabilitation, \nincluding the social and economic reintegration, of mine victims, \n \nNoting with satisfaction the work undertaken to implement the Convention on \nthe Prohibition of the Use, Stockpiling, Production and Transfer of Anti-Personnel \n\nA/RES/74/61 \nImplementation of the Convention on the Prohibition\nof the Use, Stockpiling, Production and Transfer\nof Anti-Personnel Mines and on Their Destruction\n \n19-21860\n2/3 \n \nMines and on Their Destruction 1  and the substantial progress made towards \naddressing the global anti-personnel landmine problem, \n \nRecalling the first to seventeenth meetings of the States parties to the \nConvention, held in Maputo (1999), Geneva (2000), Managua (2001), Geneva (2002), \nBangkok (2003), Zagreb (2005), Geneva (2006), the Dead Sea (2007), Geneva (2008 \nand 2010), Phnom Penh (2011), Geneva (2012, 2013 and 2015), Santiago (2016), \nVienna (2017) and Geneva (2018), and the First, Second and Third Review \nConferences of the States Parties to the Convention, held in Nairobi (2004), \nCartagena, Colombia (2009), and Maputo (2014), \n \nRecalling also that, at the Third Review Conference of the States Parties to the \nConvention, the international community reviewed the implementation of the \nConvention and the States parties adopted a declaration and an action plan for the period \n2014\u20132019 to support the enhanced implementation and promotion of the Convention, \n \nUnderlining the importance of cooperation and assistance in the implementation \nof the Convention, including through the so-called individualized approach, which \noffers mine-affected countries a platform for presenting their challenges, \n \nStressing the need to take into account gender aspects in mine action, \n \nNoting with satisfaction that 164 States have ratified or acceded to the \nConvention and have formally accepted the obligations of the Convention, \n \nEmphasizing the desirability of attracting the adherence of all States to the \nConvention, and determined to work strenuously towards the promotion of its \nuniversalization and norms, \n \nNoting with regret that anti-personnel mines continue to be used in some conflicts \naround the world, causing human suffering and impeding post-conflict development, \n \n1. \nInvites all States that have not signed the Convention on the Prohibition of \nthe Use, Stockpiling, Production and Transfer of Anti-Personnel Mines and on Their \nDestruction1 to accede to it without delay; \n \n2. \nUrges the one remaining State that has signed but has not ratified the \nConvention to ratify it without delay; \n \n3. \nStresses the importance of the full and effective implementation of and \ncompliance with the Convention, including through the continued implementation of \nthe action plans under the Convention; \n \n4. \nExpresses strong concern regarding the use of anti-personnel mines in \nvarious parts of the world, including use highlighted in recent allegations, reports and \ndocumented evidence; \n \n5. \nUrges all States parties to provide the Secretary-General with complete \nand timely information as required under article 7 of the Convention in order to \npromote transparency and compliance with the Convention; \n \n6. \nInvites all States that have not ratified the Convention or acceded to it to \nprovide, on a voluntary basis, information to make global mine action efforts more \neffective; \n \n7. \nRenews its call upon all States and other relevant parties to work together \nto promote, support and advance the care, rehabilitation and social and economic \nreintegration of mine victims, mine risk education programmes and the removal and \ndestruction of anti-personnel mines placed or stockpiled throughout the world; \n__________________ \n \n1  United Nations, Treaty Series, vol. 2056, No. 35597. \n\nImplementation of the Convention on the Prohibition \nof the Use, Stockpiling, Production and Transfer \nof Anti-Personnel Mines and on Their Destruction \nA/RES/74/61\n \n3/3\n19-21860 \n \n \n8. \nUrges all States to remain seized of the issue at the highest political level \nand, where in a position to do so, to promote adherence to the Convention through \nbilateral, subregional, regional and multilateral contacts, outreach, seminars and other \nmeans; \n \n9. \nInvites and encourages all interested States, the United Nations, other \nrelevant international organizations or institutions, regional organizations, the \nInternational Committee of the Red Cross and relevant non-governmental \norganizations to attend the Fourth Review Conference of the States Parties to the \nConvention, to be held in Oslo from 25 to 29 November 2019, and to participate in \nthe future programme of meetings of the States parties to the Convention; \n \n10. Requests the Secretary-General, in accordance with article 12, paragraph 1, \nof the Convention, to undertake the preparations necessary to convene the Eighteenth \nMeeting of the States Parties to the Convention and, on behalf of the States parties \nand in accordance with article 12, paragraph 3, of the Convention, to invite States not \nparties to the Convention, as well as the United Nations, other relevant international \norganizations or institutions, regional organizations, the International Committee of \nthe Red Cross and relevant non-governmental organizations, to attend the Eighteenth \nMeeting of the States Parties as observers; \n \n11. \nCalls upon States parties and States participating in meetings to address \nissues arising from outstanding dues and to proceed promptly with the payment of \ntheir share of the estimated costs; \n \n12. Decides to include in the provisional agenda of its seventy-fifth session, \nunder the item entitled \u201cGeneral and complete disarmament\u201d, the sub-item entitled \n\u201cImplementation of the Convention on the Prohibition of the Use, Stockpiling, \nProduction and Transfer of Anti-Personnel Mines and on Their Destruction\u201d. \n \n46th plenary meeting \n12 December 2019 \n \n",
  "paragraphs": {
    "1": "Invites all States that have not signed the Convention on the Prohibition of the Use, Stockpiling, Production and Transfer of Anti-Personnel Mines and on Their Destruction1 to accede to it without delay;",
    "2": "Urges the one remaining State that has signed but has not ratified the Convention to ratify it without delay;",
    "3": "Stresses the importance of the full and effective implementation of and compliance with the Convention, including through the continued implementation of the action plans under the Convention;",
    "4": "Expresses strong concern regarding the use of anti-personnel mines in various parts of the world, including use highlighted in recent allegations, reports and documented evidence;",
    "5": "Urges all States parties to provide the Secretary-General with complete and timely information as required under article 7 of the Convention in order to promote transparency and compliance with the Convention;",
    "6": "Invites all States that have not ratified the Convention or acceded to it to provide, on a voluntary basis, information to make global mine action efforts more effective;",
    "7": "Renews its call upon all States and other relevant parties to work together to promote, support and advance the care, rehabilitation and social and economic reintegration of mine victims, mine risk education programmes and the removal and destruction of anti-personnel mines placed or stockpiled throughout the world; __________________ 1 United Nations, Treaty Series, vol. 2056, No. 35597. Implementation of the Convention on the Prohibition of the Use, Stockpiling, Production and Transfer of Anti-Personnel Mines and on Their Destruction A/RES/74/61 3/3 19-21860",
    "8": "Urges all States to remain seized of the issue at the highest political level and, where in a position to do so, to promote adherence to the Convention through bilateral, subregional, regional and multilateral contacts, outreach, seminars and other means;",
    "9": "Invites and encourages all interested States, the United Nations, other relevant international organizations or institutions, regional organizations, the International Committee of the Red Cross and relevant non-governmental organizations to attend the Fourth Review Conference of the States Parties to the Convention, to be held in Oslo from 25 to 29 November 2019, and to participate in the future programme of meetings of the States parties to the Convention;",
    "10": "Requests the Secretary-General, in accordance with article 12, paragraph 1, of the Convention, to undertake the preparations necessary to convene the Eighteenth Meeting of the States Parties to the Convention and, on behalf of the States parties and in accordance with article 12, paragraph 3, of the Convention, to invite States not parties to the Convention, as well as the United Nations, other relevant international organizations or institutions, regional organizations, the International Committee of the Red Cross and relevant non-governmental organizations, to attend the Eighteenth Meeting of the States Parties as observers;",
    "11": "Calls upon States parties and States participating in meetings to address issues arising from outstanding dues and to proceed promptly with the payment of their share of the estimated costs;",
    "12": "Decides to include in the provisional agenda of its seventy-fifth session, under the item entitled \u201cGeneral and complete disarmament\u201d, the sub-item entitled \u201cImplementation of the Convention on the Prohibition of the Use, Stockpiling, Production and Transfer of Anti-Personnel Mines and on Their Destruction\u201d. 46th plenary meeting 12 December 2019"
  },
  "agenda_items": [
    "Item 98"
  ],
  "symbol_references": []
}