{
  "symbol": "A/RES/73/169",
  "filename": "A_RES_73_169.pdf",
  "title": "73/169. Promotion of a democratic and equitable international order",
  "text": "United Nations \nA/RES/73/169\n \n \nGeneral Assembly \nDistr.: General \n18 January 2019 \n \n18-22265 (E)    220119 \n*1822265* \n \n \nSeventy-third session \nAgenda item 74 (b) \n \n \n \n \n Resolution adopted by the General Assembly \non 17 December 2018 \n \n \n \n \n[on the report of the Third Committee (A/73/589/Add.2)] \n \n \n 73/169. Promotion of a democratic and equitable international order \n \n \n \nThe General Assembly, \n \nRecalling its previous resolutions on the promotion of a democratic and \nequitable international order, including resolution 72/172 of 19 December 2017, and \nHuman Rights Council resolutions 18/6 of 29 September 2011,1 33/3 of 29 September \n2016,2 36/4 of 28 September 20173 and 39/4 of 27 September 2018,4  \n \nReaffirming the commitment of all States to fulfil their obligations to promote \nuniversal respect for, and observance and protection of, all human rights and \nfundamental freedoms for all, in accordance with the Charter of the United Nations, \nother instruments relating to human rights and international law, \n \nAffirming that the enhancement of international cooperation for the promotion \nand protection of all human rights should continue to be carried out in full conformity \nwith the purposes and principles of the Charter and international law, as set forth in \nArticles 1 and 2 of the Charter, and with full respect for, inter alia, sovereignty, \nterritorial integrity, political independence, the non-use of force or the threat of force \nin international relations and non-intervention in matters that are essentially within \nthe domestic jurisdiction of any State, \n \nRecalling the Preamble to the Charter, in particular the determination to reaffirm \nfaith in fundamental human rights, in the dignity and worth of the human person and \nin the equal rights of men and women and of nations large and small, \n__________________ \n \n1  See Official Records of the General Assembly, Sixty-sixth Session, Supplement No. 53A and \ncorrigendum (A/66/53/Add.1 and A/66/53/Add.1/Corr.1), chap. II. \n \n2  Ibid., Seventy-first Session, Supplement No. 53A and corrigendum (A/71/53/Add.1 and \nA/71/53/Add.1/Corr.1), chap. II. \n \n3  Ibid., Seventy-second Session, Supplement No. 53A (A/72/53/Add.1), chap. III. \n \n4  Ibid., Seventy-third Session, Supplement No. 53A (A/73/53/Add.1), chap. III. \n\nA/RES/73/169 \nPromotion of a democratic and equitable international order\n \n18-22265\n2/6 \n \n \nReaffirming that everyone is entitled to a social and international order in which \nthe rights and freedoms set forth in the Universal Declaration of Human Rights 5 can \nbe fully realized, \n \nReaffirming also the determination expressed in the Preamble to the Charter to \nsave succeeding generations from the scourge of war, to establish conditions under \nwhich justice and respect for the obligations arising from treaties and other sources \nof international law can be maintained, to promote social progress and better \nstandards of life in larger freedom, to practise tolerance and good-neighbourliness \nand to employ international machinery for the promotion of the economic and social \nadvancement of all peoples, \n \nStressing that the responsibility for managing worldwide economic and social \nissues, as well as threats to international peace and security, must be shared among \nthe nations of the world and should be exercised multilaterally, and that in this regard \nthe central role must be played by the United Nations, as the most universal and \nrepresentative organization in the world, \n \nConcerned about the continued abuse by Member States of the extraterritorial \napplication of their national legislation in a manner that affects the sovereignty of \nother States, the legitimate interests of entities or persons under their jurisdiction and \nthe full enjoyment of human rights, \n \nConsidering the major changes taking place on the international scene and the \naspirations of all peoples for an international order based on the principles enshrined \nin the Charter, including promoting and encouraging respect for human rights and \nfundamental freedoms for all and respect for the principle of equal rights and self-\ndetermination of peoples, peace, democracy, justice, equality, the rule of law, \npluralism, development, better standards of living and solidarity, \n \nRecognizing that the enhancement of international cooperation in the field of \nhuman rights is essential for the full achievement of the purposes of the United \nNations, including the effective promotion and protection of all human rights, \n \nConsidering that the Universal Declaration of Human Rights proclaims that all \nhuman beings are born free and equal in dignity and rights and that everyone is \nentitled to all the rights and freedoms set out therein, without distinction of any kind, \nsuch as race, colour, sex, language, religion, political or other opinion, national or \nsocial origin, property, birth or other status, \n \nReaffirming that democracy, development and respect for human rights and \nfundamental freedoms are interdependent and mutually reinforcing and that \ndemocracy is based on the freely expressed will of the people to determine their own \npolitical, economic, social and cultural systems and their full participation in all \naspects of their lives, \n \nRecognizing that the promotion and protection of human rights should be based \non the principle of cooperation and genuine dialogue and aimed at strengthening the \ncapacity of Member States to comply with their human rights obligations for the \nbenefit of all human beings, \n \nEmphasizing that democracy is not only a political concept, but that it also has \neconomic and social dimensions, \n \nRecognizing that democracy, respect for all human rights, including the right to \ndevelopment, transparent and accountable governance and administration in all \nsectors of society and effective participation by civil society are an essential part of \n__________________ \n \n5  Resolution 217 A (III). \n\nPromotion of a democratic and equitable international order \nA/RES/73/169\n \n3/6\n18-22265 \n \nthe necessary foundations for the realization of social and people-centred sustainable \ndevelopment, \n \nNoting with concern that racism, racial discrimination, xenophobia and related \nintolerance may be aggravated by, inter alia, inequitable distribution of wealth, \nmarginalization and social exclusion, \n \nReaffirming that dialogue among religions, cultures and civilizations could \ncontribute greatly to the enhancement of international cooperation at all levels, \n \nUnderlining the fact that it is imperative for the international community to \nensure that globalization becomes a positive force for all the world\u2019s people and that \nonly through broad and sustained efforts, based on our common humanity in all its \ndiversity, can globalization be made fully inclusive and equitable, \n \nDeeply concerned that the current global economic, financial, energy and food \ncrises, resulting from a combination of several major factors, including \nmacroeconomic and other factors, such as environmental degradation, desertification \nand global climate change, natural disasters and the lack of financial resources and \nthe technology necessary to confront their negative impact in developing countries, \nparticularly in the least developed countries and small island developing States, \nrepresent a global scenario that is threatening the adequate enjoyment of all human \nrights and widening the gap between developed and developing countries, \n \nRecognizing that a democratic and equitable order requires the reform of \ninternational financial institutions, in order to widen and strengthen the level of \nparticipation of developing countries in the international decision-making process, \nand a more transparent and open financial system, as well as adequate measures \nagainst illicit financial flows, such as tax fraud, tax evasion, illegal capital flight, \nmoney-laundering and the proceeds of corruption, and for improving tax transparency \nworldwide,  \n \nStressing that efforts to make globalization fully inclusive and equitable must \ninclude policies and measures at the global level that correspond to the needs of \ndeveloping countries and countries with economies in transition and are formulated \nand implemented with their effective participation, \n \nStressing also the need for adequate financing of, technology transfer to and \ncapacity-building in developing countries, in particular the least developed countries, \nlandlocked developing countries and small island developing States, including to \nsupport their efforts to adapt to climate change, \n \nHaving listened to the peoples of the world, and recognizing their aspirations to \njustice, to equality of opportunity for all, to the enjoyment of their human rights, \nincluding the right to development, to live in peace and freedom and to equal \nparticipation without discrimination in economic, social, cultural, civil and \npolitical life, \n \nRecalling Human Rights Council resolutions 5/1 on institution-building of the \nCouncil and 5/2 on the Code of Conduct for Special Procedures Mandate Holders of \nthe Council of 18 June 2007,6 and stressing that all mandate holders shall discharge \ntheir duties in accordance with those resolutions and the annexes thereto, \n \nEmphasizing the importance of the 2030 Agenda for Sustainable Development 7 \nfor the promotion of a democratic and equitable international order, \n__________________ \n \n6  See Official Records of the General Assembly, Sixty-second Session, Supplement No. 53 \n(A/62/53), chap. IV, sect. A. \n \n7  Resolution 70/1. \n\nA/RES/73/169 \nPromotion of a democratic and equitable international order\n \n18-22265\n4/6 \n \n \nResolved to take all measures within its power to secure a democratic and \nequitable international order, \n \n1. \nAffirms that everyone is entitled to a democratic and equitable \ninternational order; \n \n2. \nAlso affirms that a democratic and equitable international order fosters the \nfull realization of all human rights for all; \n \n3. \nTakes note of the report of the Independent Expert of the Human Rights \nCouncil on the promotion of a democratic and equitable international order; 8  \n \n4. \nCalls upon all Member States to fulfil their commitment expressed in \nDurban, South Africa, during the World Conference against Racism, Racial \nDiscrimination, Xenophobia and Related Intolerance, to maximize the benefits of \nglobalization through, inter alia, the strengthening and enhancement of international \ncooperation to increase equality of opportunities for trade, economic growth and \nsustainable development, global communications through the use of new technologies \nand increased intercultural exchange through the preservation and promotion of \ncultural diversity, 9 and reiterates that only through broad and sustained efforts to \ncreate a shared future based upon our common humanity and all its diversity can \nglobalization be made fully inclusive and equitable; \n \n5. \nDeclares that democracy includes respect for all human rights and \nfundamental freedoms and is a universal value based on the freely expressed will of \npeople to determine their own political, economic, social and cultural systems and \ntheir full participation in all aspects of their lives, and reaffirms the need for universal \nadherence to and implementation of the rule of law at both the national and \ninternational levels; \n \n6. \nAffirms that a democratic and equitable international order requires, inter \nalia, the realization of the following:  \n \n(a) \nThe right of all peoples to self-determination, by virtue of which they can \nfreely determine their political status and freely pursue their economic, social and \ncultural development; \n \n(b) \nThe right of peoples and nations to permanent sovereignty over their \nnatural wealth and resources; \n \n(c) \nThe right of every human person and all peoples to development; \n \n(d) \nThe right of all peoples to peace; \n \n(e) \nThe right to an international economic order based on equal participation \nin the decision-making process, interdependence, mutual interest, solidarity and \ncooperation among all States; \n \n(f) \nInternational solidarity, as a right of peoples and individuals; \n \n(g) \nThe promotion and consolidation of transparent, democratic, just and \naccountable international institutions in all areas of cooperation, in particular through \nthe implementation of the principle of full and equal participation in their respective \ndecision-making mechanisms; \n \n(h) \nThe right to equitable participation of all, without any discrimination, in \ndomestic and global decision-making; \n \n(i) \nThe principle of equitable regional and gender-balanced representation in \nthe composition of the staff of the United Nations system; \n__________________ \n \n8  See A/73/158. \n \n9  See A/CONF.189/12 and A/CONF.189/12/Corr.1, chap. I. \n\nPromotion of a democratic and equitable international order \nA/RES/73/169\n \n5/6\n18-22265 \n \n \n(j) \nThe promotion of a free, just, effective and balanced international \ninformation and communications order based on international cooperation for the \nestablishment of a new equilibrium and greater reciprocity in the international flow \nof information, in particular correcting the inequalities in the flow of information to \nand from developing countries; \n \n(k) \nRespect for cultural diversity and the cultural rights of all, since this \nenhances cultural pluralism, contributes to a wider exchange of knowledge and \nunderstanding of cultural backgrounds, advances the application and enjoyment of \nuniversally accepted human rights across the world and fosters stable, friendly \nrelations among peoples and nations worldwide; \n \n(l) \nThe right of every person and all peoples to a healthy environment and to \nenhanced international cooperation that responds effectively to the needs for \nassistance of national efforts to adapt to climate change, particularly in developing \ncountries, and that promotes the fulfilment of international agreements in the field of \nmitigation; \n \n(m) The promotion of equitable access to benefits from the international \ndistribution of wealth through enhanced international cooperation, in particular in \ninternational economic, commercial and financial relations; \n \n(n) \nThe enjoyment by everyone of ownership of the common heritage of \nhumankind in connection to the public right of access to culture; \n \n(o) \nThe shared responsibility of the nations of the world for managing \nworldwide economic and social development, as well as threats to international peace \nand security, which should be exercised multilaterally; \n \n7. \nStresses the importance of preserving the rich and diverse nature of the \ninternational community of nations and peoples, as well as respect for national and \nregional particularities and various historical, cultural and religious backgrounds, in \nthe enhancement of international cooperation in the field of human rights; \n \n8. \nAlso stresses that all human rights are universal, indivisible, interdependent \nand interrelated and that the international community must treat human rights globally \nin a fair and equal manner, on the same footing and with the same emphasis, and \nreaffirms that, while the significance of national and regional particularities and \nvarious historical, cultural and religious backgrounds must be borne in mind, it is the \nduty of States, regardless of their political, economic and cultural systems, to promote \nand protect all human rights and fundamental freedoms for all; \n \n9. \nReaffirms, among other principles, the sovereign equality of States, \nnon-intervention and non-interference in internal affairs; \n \n10. Urges all actors on the international scene to build an international order \nbased on inclusion, social justice, equality and equity, human dignity, mutual \nunderstanding and promotion of and respect for cultural diversity and universal \nhuman rights and to reject all doctrines of exclusion based on racism, racial \ndiscrimination, xenophobia and related intolerance; \n \n11. \nReaffirms that all States should promote the establishment, maintenance \nand strengthening of international peace and security and, to that end, should do their \nutmost to achieve general and complete disarmament under effective international \ncontrol, as well as to ensure that the resources released by effective disarmament \nmeasures are used for comprehensive development, in particular that of the \ndeveloping countries; \n \n12. Underlines that attempts to overthrow legitimate Governments by force \ndisrupt the democratic and constitutional order, the legitimate exercise of power and \nthe full enjoyment of human rights, and reaffirms that every State has an inalienable \n\nA/RES/73/169 \nPromotion of a democratic and equitable international order\n \n18-22265\n6/6 \n \nright to choose its political, economic, social and cultural system, without interference \nin any form by other States; \n \n13. Reaffirms the need to continue working urgently for the establishment of \na new international economic order based on equity, sovereign equality, \ninterdependence, common interest and cooperation among all States, irrespective of \ntheir economic and social systems, which shall correct inequalities and redress \nexisting injustices, make it possible to eliminate the widening gap between the \ndeveloped and the developing countries and ensure steadily accelerating economic \nand social development and peace and justice for present and future generations, in \naccordance with relevant previous General Assembly resolutions, programmes of \naction and major conferences and summits in the economic, social and related areas; \n \n14. Also reaffirms that the international community should devise ways and \nmeans to remove the current obstacles and meet the challenges to the full realization \nof all human rights and to prevent the continuation of human rights violations \nresulting therefrom throughout the world; \n \n15. Urges States to continue their efforts, through enhanced international \ncooperation, towards the promotion of a democratic and equitable international order; \n \n16. Affirms that a democratic and equitable international order, as prescribed \nin the Charter of the United Nations, cannot be achieved only through the deregulation \nof trade, markets and financial services; \n \n17. Requests the Secretary-General and the United Nations High Commissioner \nfor Human Rights to continue to provide all the human and financial resources \nnecessary for the effective fulfilment of the mandate of the Independent Expert; \n \n18. Calls upon all Governments to cooperate with and assist the Independent \nExpert in his task, to supply all necessary information requested by him and to \nconsider responding favourably to the requests of the Independent Expert to visit their \ncountries to enable him to fulfil his mandate more effectively; \n \n19. Requests the Human Rights Council, the human rights treaty bodies, the \nOffice of the United Nations High Commissioner for Human Rights, the special \nmechanisms extended by the Council and the Human Rights Council Advisory \nCommittee to pay due attention, within their respective mandates, to the present \nresolution and to make contributions towards its implementation; \n \n20. Calls upon the Office of the High Commissioner to build upon the issue \nof the promotion of a democratic and equitable international order; \n \n21. Requests the Secretary-General to bring the present resolution to the \nattention of Member States, United Nations organs, bodies and components, \nintergovernmental organizations, in particular the Bretton Woods institutions, and \nnon-governmental organizations and to disseminate it on the widest possible basis; \n \n22. Requests the Independent Expert to submit to the General Assembly at its \nseventy-fourth session a report on the implementation of the present resolution, and \ninvites him to undertake research into the impact of financial and economic policies \npursued by international organizations and other institutions on a democratic and \nequitable international order;  \n \n23. Decides to continue consideration of the matter at its seventy-fourth \nsession under the item entitled \u201cPromotion and protection of human rights\u201d. \n \n55th plenary meeting  \n17 December 2018 \n \n",
  "paragraphs": {
    "1": "Affirms that everyone is entitled to a democratic and equitable international order;",
    "2": "Also affirms that a democratic and equitable international order fosters the full realization of all human rights for all;",
    "3": "Takes note of the report of the Independent Expert of the Human Rights Council on the promotion of a democratic and equitable international order; 8",
    "4": "Calls upon all Member States to fulfil their commitment expressed in Durban, South Africa, during the World Conference against Racism, Racial Discrimination, Xenophobia and Related Intolerance, to maximize the benefits of globalization through, inter alia, the strengthening and enhancement of international cooperation to increase equality of opportunities for trade, economic growth and sustainable development, global communications through the use of new technologies and increased intercultural exchange through the preservation and promotion of cultural diversity, 9 and reiterates that only through broad and sustained efforts to create a shared future based upon our common humanity and all its diversity can globalization be made fully inclusive and equitable;",
    "5": "Declares that democracy includes respect for all human rights and fundamental freedoms and is a universal value based on the freely expressed will of people to determine their own political, economic, social and cultural systems and their full participation in all aspects of their lives, and reaffirms the need for universal adherence to and implementation of the rule of law at both the national and international levels;",
    "6": "Affirms that a democratic and equitable international order requires, inter alia, the realization of the following: (a) The right of all peoples to self-determination, by virtue of which they can freely determine their political status and freely pursue their economic, social and cultural development; (b) The right of peoples and nations to permanent sovereignty over their natural wealth and resources; (c) The right of every human person and all peoples to development; (d) The right of all peoples to peace; (e) The right to an international economic order based on equal participation in the decision-making process, interdependence, mutual interest, solidarity and cooperation among all States; (f) International solidarity, as a right of peoples and individuals; (g) The promotion and consolidation of transparent, democratic, just and accountable international institutions in all areas of cooperation, in particular through the implementation of the principle of full and equal participation in their respective decision-making mechanisms; (h) The right to equitable participation of all, without any discrimination, in domestic and global decision-making; (i) The principle of equitable regional and gender-balanced representation in the composition of the staff of the United Nations system; (j) The promotion of a free, just, effective and balanced international information and communications order based on international cooperation for the establishment of a new equilibrium and greater reciprocity in the international flow of information, in particular correcting the inequalities in the flow of information to and from developing countries; (k) Respect for cultural diversity and the cultural rights of all, since this enhances cultural pluralism, contributes to a wider exchange of knowledge and understanding of cultural backgrounds, advances the application and enjoyment of universally accepted human rights across the world and fosters stable, friendly relations among peoples and nations worldwide; (l) The right of every person and all peoples to a healthy environment and to enhanced international cooperation that responds effectively to the needs for assistance of national efforts to adapt to climate change, particularly in developing countries, and that promotes the fulfilment of international agreements in the field of mitigation; (m) The promotion of equitable access to benefits from the international distribution of wealth through enhanced international cooperation, in particular in international economic, commercial and financial relations; (n) The enjoyment by everyone of ownership of the common heritage of humankind in connection to the public right of access to culture; (o) The shared responsibility of the nations of the world for managing worldwide economic and social development, as well as threats to international peace and security, which should be exercised multilaterally;",
    "7": "Stresses the importance of preserving the rich and diverse nature of the international community of nations and peoples, as well as respect for national and regional particularities and various historical, cultural and religious backgrounds, in the enhancement of international cooperation in the field of human rights;",
    "8": "Also stresses that all human rights are universal, indivisible, interdependent and interrelated and that the international community must treat human rights globally in a fair and equal manner, on the same footing and with the same emphasis, and reaffirms that, while the significance of national and regional particularities and various historical, cultural and religious backgrounds must be borne in mind, it is the duty of States, regardless of their political, economic and cultural systems, to promote and protect all human rights and fundamental freedoms for all;",
    "9": "Reaffirms, among other principles, the sovereign equality of States, non-intervention and non-interference in internal affairs;",
    "10": "Urges all actors on the international scene to build an international order based on inclusion, social justice, equality and equity, human dignity, mutual understanding and promotion of and respect for cultural diversity and universal human rights and to reject all doctrines of exclusion based on racism, racial discrimination, xenophobia and related intolerance;",
    "11": "Reaffirms that all States should promote the establishment, maintenance and strengthening of international peace and security and, to that end, should do their utmost to achieve general and complete disarmament under effective international control, as well as to ensure that the resources released by effective disarmament measures are used for comprehensive development, in particular that of the developing countries;",
    "12": " right to choose its political, economic, social and cultural system, without interference in any form by other States;",
    "13": "Reaffirms the need to continue working urgently for the establishment of a new international economic order based on equity, sovereign equality, interdependence, common interest and cooperation among all States, irrespective of their economic and social systems, which shall correct inequalities and redress existing injustices, make it possible to eliminate the widening gap between the developed and the developing countries and ensure steadily accelerating economic and social development and peace and justice for present and future generations, in accordance with relevant previous General Assembly resolutions, programmes of action and major conferences and summits in the economic, social and related areas;",
    "14": "Also reaffirms that the international community should devise ways and means to remove the current obstacles and meet the challenges to the full realization of all human rights and to prevent the continuation of human rights violations resulting therefrom throughout the world;",
    "15": "Urges States to continue their efforts, through enhanced international cooperation, towards the promotion of a democratic and equitable international order;",
    "16": "Affirms that a democratic and equitable international order, as prescribed in the Charter of the United Nations, cannot be achieved only through the deregulation of trade, markets and financial services;",
    "17": "Requests the Secretary-General and the United Nations High Commissioner for Human Rights to continue to provide all the human and financial resources necessary for the effective fulfilment of the mandate of the Independent Expert;",
    "18": "Calls upon all Governments to cooperate with and assist the Independent Expert in his task, to supply all necessary information requested by him and to consider responding favourably to the requests of the Independent Expert to visit their countries to enable him to fulfil his mandate more effectively;",
    "19": "Requests the Human Rights Council, the human rights treaty bodies, the Office of the United Nations High Commissioner for Human Rights, the special mechanisms extended by the Council and the Human Rights Council Advisory Committee to pay due attention, within their respective mandates, to the present resolution and to make contributions towards its implementation;",
    "20": "Calls upon the Office of the High Commissioner to build upon the issue of the promotion of a democratic and equitable international order;",
    "21": "Requests the Secretary-General to bring the present resolution to the attention of Member States, United Nations organs, bodies and components, intergovernmental organizations, in particular the Bretton Woods institutions, and non-governmental organizations and to disseminate it on the widest possible basis;",
    "22": "Requests the Independent Expert to submit to the General Assembly at its seventy-fourth session a report on the implementation of the present resolution, and invites him to undertake research into the impact of financial and economic policies pursued by international organizations and other institutions on a democratic and equitable international order;",
    "23": "Decides to continue consideration of the matter at its seventy-fourth session under the item entitled \u201cPromotion and protection of human rights\u201d."
  },
  "agenda_items": [
    "Item 74"
  ],
  "symbol_references": []
}