{
  "symbol": "A/RES/79/331",
  "filename": "A_RES_79_331.pdf",
  "title": "79/331. Cooperation between the United Nations and the International Organization of la Francophonie",
  "text": "United Nations \nA/RES/79/331 \n \nGeneral Assembly \nDistr.: General \n8 September 2025 \n25-14349 (E) \n*2514349* \n \n \nSeventy-ninth session \nAgenda item 125 (j) \nCooperation between the United Nations and regional and \nother organizations: cooperation between the United Nations \nand the International Organization of la Francophonie \n \n \n \n \n Resolution adopted by the General Assembly \non 5 September 2025 \n \n \n[without reference to a Main Committee (A/79/L.121)] \n \n \n 79/331. Cooperation between the United Nations and the International \nOrganization of la Francophonie \n \n \n \nThe General Assembly, \n \nRecalling its resolutions 33/18 of 10 November 1978, 50/3 of 16 October 1995, \n52/2 of 17 October 1997, 54/25 of 15 November 1999, 56/45 of 7 December 2001, \n57/43 of 21 November 2002, 59/22 of 8 November 2004, 61/7 of 20 October 2006, \n63/236 of 22 December 2008, 65/263 of 14 January 2011, 67/137 of 18 December \n2012, 69/270 of 2 April 2015, 71/289 of 24 May 2017, 73/290 of 15 April 2019, \n75/307 of 7 July 2021 and 77/331 of 25 August 2023, as well as its decision 53/453 \nof 18 December 1998, \n \nRecalling also its resolutions 61/266 of 16 May 2007, 63/306 of 9 September \n2009, 65/311 of 19 July 2011, 67/292 of 24 July 2013, 69/324 of 11 September 2015, \n71/328 of 11 September 2017, 73/346 of 16 September 2019,76/268 of 10 June 2022 \nand \n78/330 \nof \n6 September \n2024 \non \nmultilingualism, \nrecognizing \nthat \nmultilingualism, as a core value of the Organization, contributes to the achievement \nof the goals of the United Nations, as set out in Article 1 of its Charter, \n \nRecalling further its resolution 75/144 of 15 December 2020, in which it \nrequested the Secretary-General to continue his efforts to ensure that multilingualism, \nas a core value of the United Nations, is not undermined by the measures taken in \nresponse to the liquidity situation,  \n \nConsidering that the International Organization of la Francophonie, which is \nmade up of 83 States Members of the United Nations, representing more than one \nthird of the members of the General Assembly, is promoting multilateral cooperation \nin areas of common interest, \n\nA/RES/79/331 \nCooperation between the United Nations and the \nInternational Organization of la Francophonie\n \n25-14349\n2/13 \n \n \nBearing in mind the provisions of the Charter of the United Nations which \nencourage the promotion of the purposes and principles of the United Nations through \nregional cooperation, \n \nBearing in mind also that, according to the Charter of la Francophonie, adopted \non 23 November 2005 at the Ministerial Conference of la Francophonie, held in \nAntananarivo, the objectives of la Francophonie are to assist in the establishment and \ndevelopment of democracy, the prevention, management and settlement of conflicts, \nsupport for the rule of law and for human rights, the intensification of dialogue \nbetween cultures and civilizations, the establishment of closer ties among peoples \nthrough mutual knowledge, the strengthening of their solidarity through multilateral \ncooperation activities with a view to promoting the growth of their economies, and \nthe promotion of education and training, \n \nWelcoming the continued transformation of the International Organization of la \nFrancophonie undertaken by the Secretary-General of la Francophonie to make it \nmore flexible and efficient, \n \nWelcoming also the steps taken by the International Organization of la \nFrancophonie to strengthen its ties with the organizations of the United Nations \nsystem and with international and regional organizations with a view to attaining its \nobjectives, including strengthening the mandate of its external representations and \ntheir role in promoting partnership with United Nations interlocutors, \n \nAffirming the importance of a balanced and effective multilateral system that is \nrepresentative of today\u2019s world, one that is based upon a strong and renewed United \nNations, \n \nReaffirming its commitment to the multilateral system, which remains the \nprincipal framework for sustainable solutions to global challenges, \n \nWelcoming the convening of the Summit of the Future on 22 and 23 September \n2024 at the United Nations Headquarters in New York, at which resolution 79/1 \nentitled \u201cThe Pact for the Future\u201d and its annexes were adopted, and underlining in \nthis respect the valuable contributions made by the States members of the \nInternational Organization of la Francophonie to its elaboration, for a renewed global \ngovernance that is more efficient, more representative and fairer,  \n \nNoting with satisfaction the commitment of the International Organization of la \nFrancophonie to human rights, gender equality, the empowerment of women, girls \nand youth and their active participation in society, access to quality education and \ntraining, multilingualism and multilateral cooperation for peace, democratic \ngovernance and the rule of law, preservation of information integrity, digital \ninclusion, inclusive economic development and solidarity, sustainable development \nand its financing, especially eradication of poverty in all its forms and dimensions, \nprotection of the environment, access to affordable, reliable and modern energy for \nall, combating climate change, promotion and progressive realization of access for all \nto economic, social, cultural, civil and political rights, the prevention of genocide, \ncountering terrorism in all its forms and preventing and countering radicalization to \nterrorism, \n \nWelcoming the nineteenth Summit of la Francophonie, held in France, in Villers-\nCotter\u00eats and Paris, on 4 and 5 October 2024 on the theme \u201cCreate, innovate and \nundertake in French\u201d, noting the adoption of the Villers-Cotter\u00eats Declaration and the \nDeclaration of Solidarity with Lebanon, and taking note of the Villers-Cotter\u00eats Call \nfor a trustworthy and ethical digital space in the francophone world, \n \nLooking forward with interest to the twentieth Summit of la Francophonie, to be \nheld in Cambodia in 2026, \n\nCooperation between the United Nations and the \nInternational Organization of la Francophonie \nA/RES/79/331\n \n3/13\n25-14349 \n \n \nReaffirming its resolution 70/1 of 25 September 2015, entitled \u201cTransforming \nour world: the 2030 Agenda for Sustainable Development\u201d, in which it adopted a \ncomprehensive, far-reaching and people-centred set of universal and transformative \nSustainable Development Goals and targets, its commitment to working tirelessly for \nthe full implementation of the Agenda by 2030, its recognition that eradicating \npoverty in all its forms and dimensions, including extreme poverty, is the greatest \nglobal challenge and an indispensable requirement for sustainable development, its \ncommitment to achieving sustainable development in its three dimensions \u2013 \neconomic, social and environmental \u2013 in a balanced and integrated manner, and to \nbuilding upon the achievements of the Millennium Development Goals and seeking \nto address their unfinished business, \n \nRecalling with satisfaction the commitments by the member States and \nGovernments of the International Organization of la Francophonie to the \nimplementation of the Addis Ababa Action Agenda of the Third International \nConference on Financing for Development1 and the follow-up Fourth International \nConference on Financing for Development, held in Sevilla, Spain, and the Paris \nAgreement on climate change,2 reaffirmed by the Heads of State and Government of \ncountries using French as a common language at the seventeenth Summit of la \nFrancophonie, together with an undertaking to play an active role in achieving the \nSustainable Development Goals and a determination to implement national \nsustainable development strategies to make an effective contribution to eradicating \npoverty, to ensuring sustainable and universal access to affordable, reliable, \nsustainable and modern energy services and to protecting the environment, \n \nHaving considered the report of the Secretary-General on the implementation of \nresolution 77/331,3 \n \nNoting with satisfaction the substantial progress achieved in cooperation \nbetween the United Nations, the specialized agencies and other United Nations bodies \nand programmes and the International Organization of la Francophonie, \n \nConvinced that strengthening cooperation between the United Nations and the \nInternational Organization of la Francophonie serves the purposes and principles of \nthe United Nations, \n \nNoting the will of the two organizations to consolidate, develop and strengthen \nthe ties that exist between them in the political, economic, social and cultural fields \nwith respect to each of the pillars of international peace and security, development \nand human rights, \n \nWelcoming the advocacy by the Secretary-General of la Francophonie for taking \nmultidimensional vulnerability into account in the allocation of development funding, \n \nTaking note with appreciation of the advocacy by the Group of Francophone \nAmbassadors to the United Nations for multilingualism and the promotion of cultural \nand linguistic diversity, in support of a strong and effective multilateralism, \n \nWelcoming the first open debate at the Security Council, organized by the Niger \nin its capacity as President of the Security Council, on 8 September 2020, on \ncooperation between the United Nations and the International Organization of la \nFrancophonie, which highlighted the substantial cooperation between the two \norganizations on international peace and security issues, and during which the \n_______________ \n \n1 Resolution 69/313, annex. \n \n2 See FCCC/CP/2015/10/Add.1, decision 1/CP.21, annex. \n \n3 See A/79/302-S/2024/600, sect. II. \n\nA/RES/79/331 \nCooperation between the United Nations and the \nInternational Organization of la Francophonie\n \n25-14349\n4/13 \n \nSecretary-General of la Francophonie called for, inter alia, strengthening cooperation \nwith the United Nations,  \n \nNoting the technical support provided within the framework of the francophone \nplatform in the Security Council, launched on 25 September 2019 by the Secretary-\nGeneral of la Francophonie and the Minister for Foreign Affairs of C\u00f4te d\u2019Ivoire, in \norder to develop a constructive synergy within the French-speaking diplomatic family \non issues of common interest on the agenda of the Security Council, to promote \nmultilingualism and to increase and strengthen the francophone position in the \ndevelopment and implementation of the normative and political framework of the \npeace and security agenda, including youth, peace and security and women and peace \nand security, consistent with Council resolution 1325 (2000) of 31 October 2000 and \nall other relevant resolutions, \n \n1. \nTakes note of the report of the Secretary-General, and welcomes the \nstrengthened and fruitful cooperation between the United Nations and the \nInternational Organization of la Francophonie; \n \n2. \nNotes with satisfaction, in accordance with the Yerevan Declaration \nadopted by the Heads of State and Government of countries using French as a common \nlanguage at the seventeenth Summit of la Francophonie,4 the active participation of \nthe International Organization of la Francophonie in the work of the United Nations, \namong whose purposes, as set forth in its Charter, are to maintain international peace \nand security, to develop friendly relations among nations based on respect for the \nprinciple of equal rights and self-determination of peoples, and respect for the \nprinciple of the sovereignty and territorial integrity of States, to achieve international \ncooperation in solving international problems of an economic, social, cultural or \nhumanitarian character and to be a centre for harmonizing the actions of nations in \nthe attainment of those common ends; \n \n3. \nTakes note of the adoption of the 2024\u20132027 four-year programme of the \nInternational Organization of la Francophonie, particularly in the fields of democracy, \ngovernance, sustainable development, education and gender equality, and encourages \nthe complementarity of its programmes with the initiatives of United Nations \nagencies;  \n \n4. \nNotes with satisfaction the continued strengthening of cooperation \nbetween the United Nations and the International Organization of la Francophonie in \nthe area of human rights and in the promotion of gender equality, commends the \ninitiatives taken by the International Organization of la Francophonie in the areas of \ncrisis and conflict prevention, management and resolution, the promotion of peace, \nsupport for democracy and the rule of law, full respect for human rights and good \ngovernance, the fight against impunity and the promotion of international criminal \njustice, in accordance with the commitments set forth in its Bamako Declaration of \n3 November 2000 on the practices of democracy, rights and freedoms in the \nfrancophone world,5 and reaffirmed at the Ministerial Conference of la Francophonie \non Conflict Prevention and Human Security, held on 13 and 14 May 2006 in Saint-\nBoniface, Canada; \n \n5. \nRecalls the involvement of the International Organization of la \nFrancophonie in high-level consultations and its genuine contribution, in cooperation \nwith, among others, the United Nations, to conflict resolution, recovery and \npeacebuilding, and notes with interest the adoption on 19 June 2024 of a mechanism \n_______________ \n \n4 A/73/596, annex. \n \n5 A/55/731, annex. \n\nCooperation between the United Nations and the \nInternational Organization of la Francophonie \nA/RES/79/331\n \n5/13\n25-14349 \n \nfor monitoring and evaluating the situation of States and Governments subject to \nmeasures taken by Francophonie bodies; \n \n6. \nWelcomes the strengthened cooperation between the Office of the United \nNations High Commissioner for Human Rights and the International Organization of \nla Francophonie, to strengthen the national capacities of francophone States in \naddressing the recommendations of United Nations human rights mechanisms, in \nparticular the universal periodic review, as well as promoting diversity and combating \nall forms of discrimination, and welcomes the adoption of a new road map for \ncooperation between the two organizations for the period 2024\u20132025;  \n \n7. \nRecalls the principles relating to the status of national institutions for the \npromotion and protection of human rights (the Paris Principles) 6  and the \nestablishment of the Global Alliance of National Human Rights Institutions, with \nwhich the United Nations and the International Organization of la Francophonie \ncooperate in a complementary manner for the promotion and protection of human \nrights; \n \n8. \nExpresses its deep concern about the continued violations and abuses of \nhuman rights and violations of international humanitarian law, including in countries \naffected by conflict or in post-conflict situations, and particularly against women and \nchildren, as well as refugees, internally displaced persons and migrants and persons \nin vulnerable situations; \n \n9. \nWelcomes the development of cooperation between the United Nations and \nthe International Organization of la Francophonie, with the participation of other \nregional and subregional organizations, in the fields of early warning and crisis and \nconflict prevention in accordance with the relevant resolutions of the Security Council \nand the General Assembly, and, in accordance with the Charter of the United Nations, \nencourages the pursuit of this initiative with a view to formulating practical \nrecommendations to facilitate the establishment of relevant operational mechanisms, \nwhere necessary, and invites the relevant stakeholders to redouble their efforts to \nreduce risks and latent vulnerabilities, including by considering the development of \nrisk management and resilience strategies;  \n \n10. Recognizes, as part of the cooperation between the United Nations and the \nInternational Organization of la Francophonie, the interest in intensifying efforts to \nmove towards rapid response and the need to promote the full participation of women \nand youth in conflict prevention and ensure the full, equal and meaningful \nparticipation and protection of women in all aspects and at all levels of conflict \nprevention, management and resolution mechanisms, including through their \ninvolvement in the negotiation and implementation of peace agreement processes \nthrough the full implementation of the women and peace and security agenda in \naccordance with all relevant Security Council resolutions; and welcomes in this \nrespect the training developed by the International Organization of la Francophonie, \nin partnership with the Senghor University in Alexandria, Egypt, with a view to the \npromotion and ownership, by the national actors of its member States, of the women \nand peace and security and the youth, peace and security agendas;  \n \n11. Welcomes the impetus given to the participation of States members of the \nInternational Organization of la Francophonie in peacekeeping operations, while \nrecalling that it is up to the United Nations to preserve multilingualism and the \nSecretariat to integrate multilingualism into the activities of these operations, and \ndraws attention to the strengthened cooperation between the International \nOrganization of la Francophonie, on the one hand, and the Department of Peace \n_______________ \n \n6 Resolution 48/134, annex. \n\nA/RES/79/331 \nCooperation between the United Nations and the \nInternational Organization of la Francophonie\n \n25-14349\n6/13 \n \nOperations and the Department of Operational Support of the Secretariat, on the other, \nwith a view to reaching a satisfactory level of French-speaking personnel involved in \nUnited Nations peacekeeping operations in French-speaking countries, where the \nneed has been expressed by the Secretariat, including the number of women, within \nthe existing relevant United Nations legislative framework on staff selection; \n \n12. Also welcomes that this cooperation, carried out in conjunction with the \nStates members of the International Organization of la Francophonie in order to \ndevelop technical and linguistic capabilities in French, has contributed to \nstrengthening the presence of French speakers in peacekeeping operations and their \nfull participation in the strategic discussions on peacekeeping, and welcomes the \nstrengthening of the cooperation between the International Organization of la \nFrancophonie, its member States, the Department of Peace Operations, the \nDepartment of Operational Support and the United Nations Institute for Training and \nResearch in the field of peacekeeping, to the benefit of innovative and unprecedented \ncapacity-building initiatives for contributing countries; \n \n13. Recalls that the International Organization of la Francophonie was among \nthe first international organizations to endorse the Declaration of Shared \nCommitments on United Nations Peacekeeping Operations and has volunteered to \npromote capacity-building of French-speaking personnel and the development of \nFrench-language skills, and underlines that the Action for Peacekeeping initiative \nrecognizes language skills as a necessary specialized capability, which is part of, inter \nalia, the performance of peacekeeping operations; \n \n14. Welcomes the good functioning of the Boutros-Ghali Peacekeeping \nObservatory, managed by the Group for Research and Information on Peace and \nSecurity, which constitutes in particular a framework for exchanges between French-\nspeaking experts and personalities from personnel-contributing countries and strives \nto support francophone States in their efforts to better prepare for their participation \nin peacekeeping operations, particularly those deployed in a francophone \nenvironment, and strongly encourages continued active collaboration between the \nInternational Organization of la Francophonie and the Peacebuilding Commission;  \n \n15. Also welcomes the partnership developed between the International \nOrganization of la Francophonie and the United Nations Institute for Disarmament \nResearch and the organization, within this framework, of training and information \nsessions for francophone countries on disarmament issues;  \n \n16. Notes the actions taken by la Francophonie to prevent and counter \nterrorism and violent extremism conducive to terrorism;  \n \n17. Welcomes the involvement of the International Organization of la \nFrancophonie in promoting international criminal justice, and recalls the signing of a \npartnership agreement between the International Organization of la Francophonie and \nthe International Criminal Court, which illustrates the role played by the International \nOrganization of la Francophonie in protecting human rights, restoring the rule of law \nand combating impunity; \n \n18. Also welcomes the importance given by the States members of the \nInternational Organization of la Francophonie to cooperating in the area of \ninternational criminal justice, and their efforts to prevent the crime of genocide, war \ncrimes and crimes against humanity and to combat impunity for the perpetrators of \nsuch crimes, and in this connection stresses the importance of facilitating the \ndevelopment of mutual legal assistance between States in order to investigate and \nprosecute the most serious crimes;  \n\nCooperation between the United Nations and the \nInternational Organization of la Francophonie \nA/RES/79/331\n \n7/13\n25-14349 \n \n \n19. Further welcomes the efforts of the International Organization of la \nFrancophonie to establish citizen-responsive democratic governance of the security \nsector, to define a francophone position with regard to justice, truth and reconciliation \nin order to support French-speaking States in crisis and in transition, and to promote \nthe diversity of legal systems; \n \n20. Welcomes local cooperation carried out by the network of external \nrepresentations of the International Organization of la Francophonie in partnership \nwith United Nations institutions, in support of their objectives in the fields of peace, \nsustainable development and human rights; \n \n21. Also welcomes the action taken by the International Organization of la \nFrancophonie and its member States and Governments aimed at promoting the \nimplementation of the Sustainable Development Goals, and welcomes in this respect \nthe support provided by the International Organization of la Francophonie to its \nmember countries in the process of monitoring the implementation of the 2030 \nAgenda for Sustainable Development7 and the Sustainable Development Goals by \nencouraging a peer review of their voluntary national reviews, allowing the action \ntaken by the International Organization of la Francophonie and the Institute for \nSustainable Development of la Francophonie to promote greater inclusiveness in \nclimate and environmental negotiations, and better access for francophone countries \nto sustainable finance; \n \n22. Further welcomes the action taken by the International Organization of la \nFrancophonie in promoting education and training, including the integration of digital \nissues in those areas, and recalls in this regard the primary and effective role of the \nInternational French Language University for African Development (Senghor \nUniversity in Alexandria, Egypt) in training African country executives and in \nsupporting the promotion of their skills; \n \n23. Welcomes the work of the Francophonie Institute for Education and \nTraining in Dakar, the main mission of which is to provide the States and \nGovernments of the International Organization of la Francophonie with technical \nexpertise to guarantee inclusive and equitable access to quality education throughout \nlife, in particular by encouraging the integration of national languages into education \nsystems, also welcomes the efforts of the International Organization of la \nFrancophonie to enhance the value of the teaching profession through initiatives that \nstrengthen teachers\u2019 skills, including digital skills, improve their working conditions \nand raise their status, and further welcomes the participation of the International \nOrganization of la Francophonie in the Transforming Education Summit, held in New \nYork from 16 to 19 September 2022, reaffirming the key role of teachers and national \nlanguages in the transformation of education systems; \n \n24. Also welcomes the development of resources and activities within the \ndigital portal of free educational resources known as RELIEFH, established by the \nInternational Organization of la Francophonie, which allows for the exchange and \nsharing of resources, quarterly training sessions, an annual awareness-raising caravan \nand best practices between member States and Governments in order to improve \naccess to equal education from an early age, taking fully into account the fact that \nStates members of the International Organization of la Francophonie have different \neducation systems, further welcomes the approach of consultation and coordination \nin the field of education between the actors of the Charter of la Francophonie, and the \npriority areas in the fields of teachers\u2019 training and mobility, girls\u2019 education, bilingual \neducation and digital education, and further welcomes the strengthening of the \nregional centres for French-language education deployed for Asia and the Pacific in \n_______________ \n \n7 Resolution 70/1. \n\nA/RES/79/331 \nCooperation between the United Nations and the \nInternational Organization of la Francophonie\n \n25-14349\n8/13 \n \nViet Nam (CREFAP), for Central and Eastern Europe in Bulgaria (CREFECO) and \nfor Africa in Djibouti (CREFA), which strengthen international cooperation in the \nfield of quality education in French and offer trainings and resources, notably through \nthe \u201cSpeak French\u201d platform; \n \n25. Further welcomes the action taken by the International Organization of la \nFrancophonie to modernize and strengthen civil registry systems for the benefit of its \nmember States, in collaboration with international partners such as the United Nations \nEducational, Scientific and Cultural Organization, the World Health Organization and \nthe Economic Commission for Africa;  \n \n26. Notes the collaborations and regular exchanges between the International \nOrganization of la Francophonie and the United Nations Conference on Trade and \nDevelopment on the role of digital and new technologies as a vector of economic and \nsocial development, and also notes the technical cooperation between the \nInternational Organization of la Francophonie and the United Nations Commission \non International Trade Law regarding possible reform of investor-State dispute \nsettlement; \n \n27. Welcomes the strengthening of the cooperation between the International \nOrganization of la Francophonie and the International Telecommunication Union \nthrough the membership of the International Organization of la Francophonie in the \nthree International Telecommunication Union sectors, as part of joint awareness-\nraising activities on cultural and linguistic diversity in the field of digital cooperation \nand in the life cycle of artificial intelligence; \n \n28. Also welcomes the strengthening of cooperation between the World Health \nOrganization and the International Organization of la Francophonie, through the \nsigning of a cooperation agreement, on 9 November 2021, and deepened by the \ncreation of the World Health Organization Academy in Lyon, France, a centre for \ncontinuing education of healthcare personnel inaugurated on 17 December 2024 to \nstrengthen francophone capacities in the healthcare field;  \n \n29. Further welcomes the contribution of the Secretary-General of la \nFrancophonie to the international community\u2019s advocacy for universal access to safe, \nefficacious and affordable vaccines and global access to treatments, as well as to \ndiagnostic tools against communicable diseases, and further welcomes the holding of \nfrancophone ministerial consultations in 2023 and 2024 on the margins of the World \nHealth Assembly, dedicated to the challenges faced in this area in the francophone \nworld; \n \n30. Underlines the strengthening of cooperation between the International \nLabour Organization and the International Organization of la Francophonie, \nwelcomes in this regard the joint organization of awareness-raising and capacity-\nbuilding actions, in particular the francophone contribution to the International \nLabour Conference held from 3 to 14 June 2024 and regular dialogues with the \nDirector General of the International Labour Organization, and encourages further \ncooperation to enhance decent work opportunities for all, and adopt and adhere to \ninternational labour standards; \n \n31. Takes note of the Digital Francophonie Strategy for 2022\u20132026 and of the \ncontribution of la Francophonie to the consultations in the framework of the Global \nDigital Compact,8 and welcomes the partnership developed with the United Nations \nOffice for Digital and Emerging Technologies to strengthen the capacities of \nfrancophone delegations and promote inclusive governance of artificial intelligence;  \n_______________ \n \n8 Resolution 79/1, annex I. \n\nCooperation between the United Nations and the \nInternational Organization of la Francophonie \nA/RES/79/331\n \n9/13\n25-14349 \n \n \n32. Notes with satisfaction and encourages the strengthening of the \ncollaboration between the United Nations and the International Organization of la \nFrancophonie in supporting democratic processes, particularly during election \nperiods, welcomes the technical support given by the International Organization of la \nFrancophonie to electoral processes in countries members of the International \nOrganization of la Francophonie in 2023 and 2024, notably in Guinea-Bissau, the \nComoros, Togo, Chad, Madagascar, Rwanda, Mauritania, the Republic of Moldova, \nTunisia, Mauritius and Senegal, as well as ongoing electoral processes, especially \nthose marking the end of transition periods; \n \n33. Welcomes the efforts undertaken by the International Organization of la \nFrancophonie in combating intolerance, hate speech, misinformation and \ndisinformation, particularly in terms of fact-checking, takes note of the launch by the \nStates members of the International Organization of la Francophonie of the Villers-\nCotter\u00eats Call for a trustworthy and ethical digital space in the francophone world, \naddressed to digital platforms, at the nineteenth Summit of la Francophonie, in 2024, \nand notes with satisfaction tools implemented through the francophone platform of \ninitiatives to combat disinformation and collaborations on these issues developed with \nthe Department of Global Communications of the Secretariat and the Communication \nand Information Sector of the United Nations Educational, Scientific and Cultural \nOrganization; \n \n34. Expresses its appreciation to the Secretary-General of the United Nations \nfor including the International Organization of la Francophonie in the periodic \nmeetings he holds with heads of international and regional organizations, and invites \nhim to continue to do so, taking into account the role played by the International \nOrganization of la Francophonie in conflict prevention and support for democracy \nand the rule of law, gender equality and the empowerment of women and girls, and \nsustainable development, and in that regard encourages cooperation in the field \nbetween the United Nations, the International Organization of la Francophonie and \nother international and regional organizations aimed at promoting the peaceful \nsettlement of disputes, including through mediation; \n \n35. Invites the Secretary-General to continue to involve the International \nOrganization of la Francophonie, taking into account its expertise as well as the \nDeclaration on the French language within the linguistic diversity of la Francophonie, \nwhich provides for a mechanism for monitoring commitments based on the work of \nthe French Language Observatory of the International Organization of la \nFrancophonie, in the efforts to promote multilingualism, a core value of the United \nNations, bearing in mind the objective of eliminating disparities between the use of \nEnglish and the use of other official languages within the Organization, including the \nactivities linked to public relations and information, documentation, language \nservices and conference services, human resources management and staff training, as \nwell as the activities affected by those disparities in field offices and peacekeeping \nand peacebuilding operations; \n \n36. Recalls the support of the International Organization of la Francophonie \nto the Secretariat of the United Nations in the development of the United Nations \nLanguage Framework issued in 2020 and in the development of trainings aimed at \nfighting against linguistic bias and promoting multilingualism and linguistic \ndiversity; \n \n37. Welcomes the concrete contribution that the International Organization of \nla Francophonie has made to the development of the 2024 United Nations Strategic \nFramework on Multilingualism by providing high-level expertise, and encourages \nfurther collaboration in the implementation of the Framework; \n\nA/RES/79/331 \nCooperation between the United Nations and the \nInternational Organization of la Francophonie\n \n25-14349\n10/13 \n \n \n38. Reaffirms the need to respect the equality of the two working languages of \nthe Secretariat, also reaffirms the use of additional working languages in specific duty \nstations as mandated, and in this regard requests the Secretary-General to ensure that \nvacancy announcements specify the need for either of the working languages of the \nSecretariat unless the functions of the post require a specific working language, \nwelcomes the establishment by the International Organization of la Francophonie of \na monitoring, alert and action system for the French language and multilingualism in \ninternational organizations, and also welcomes the publication in December 2020 of \nthe report of the Joint Inspection Unit on the implementation of multilingualism in \nthe United Nations system, 9  in which 13 recommendations are made to the \ndeliberative or governing bodies of United Nations system agencies to improve the \neffective implementation of this principle; \n \n39. Emphasizes the paramount importance of the equality of the six official \nlanguages of the United Nations and the importance of multilingualism in the \nactivities of the United Nations, and recalls its support for the approach of the \nSecretary-General to integrate multilingualism, as a core value of the Organization, \ninto the activities of the Secretariat, on an equitable basis; \n \n40. Invites the United Nations and the International Organization of la \nFrancophonie to strengthen their cooperation and dialogue for the removal of \nobstacles to multilingualism, a core value of the United Nations, within existing \nresources, and the implementation of the resolution on multilingualism adopted \nduring the seventy-eighth session of the General Assembly;10 \n \n41. Considers that the interaction of the United Nations with the local \npopulation in the field is essential and that language skills constitute an important \nelement of the selection and training processes, and therefore affirms that a good \ncommand of the official language or languages spoken in the country of residence \nshould be taken into account as an important asset during those processes; \n \n42. Notes the commitment of States members of the International Organization \nof la Francophonie to promote a balanced multilateral system which assures \npermanent and equal representation of African member States in decision-making \nbodies; \n \n43. Also notes the firm commitment by the member States and Governments \nof the International Organization of la Francophonie to international peace and \nsecurity, democracy, human rights, the rule of law, linguistic and cultural diversity, \ngood governance, sustainable development and bridging digital divides between and \nwithin countries, as reaffirmed at the nineteenth Summit of la Francophonie, and the \ncommitment of the States members of the International Organization of la \nFrancophonie to take specific actions, as agreed at the nineteenth Summit and set out \nin the Villers-Cotter\u00eats Declaration, in the following areas: \n \n(a) \nSupport for creation, innovation and entrepreneurship in French; \n \n(b) \nPromotion of gender equality and the empowerment of women and girls; \n \n(c) \nStrengthening of digital and artificial intelligence governance, digital \ncooperation and information integrity; \n \n(d) \nImplementation of international commitments in the fields of climate, \nenvironment and biodiversity;  \n_______________ \n \n9 JIU/REP/2020/6 and JIU/REP/2020/6/Corr.1. \n \n10 Resolution 78/330. \n\nCooperation between the United Nations and the \nInternational Organization of la Francophonie \nA/RES/79/331\n \n11/13\n25-14349 \n \n \n(e) \nPromotion of the use of the French language and linguistic and cultural \ndiversity; \n \n(f) \nPromotion of peace, democracy and human rights;  \n \n44. Invites the specialized agencies, funds and programmes of the United \nNations system, as well as the regional commissions, including the Economic \nCommission for Africa, to strengthen the cooperation with the International \nOrganization of la Francophonie and its Institute for Sustainable Development of la \nFrancophonie, by identifying new synergies in favour of sustainable development, in \nparticular in the areas of poverty eradication, economic growth, energy, the \nconservation and sustainable use of biodiversity, the environment, sustainable \nagriculture and the global response to climate change, culture, education, training and \nthe development of new information and communications technologies, in particular \nwith a view to achieving the internationally agreed development goals, including the \nSustainable Development Goals, to the benefit of all, including children, young \npeople and women; \n \n45. Welcomes the implementation of the agreement between the United \nNations Entity for Gender Equality and the Empowerment of Women (UN-Women) \nand the International Organization of la Francophonie, as well as their cooperation, \nin particular in such areas as women\u2019s participation in political decision-making and \nin economic, social and cultural life, advocacy for the equality of women and men, \nthe integration of gender equality into sustainable development, and combating \nviolence and sexual exploitation and abuse against women and girls, as well as in the \nimplementation of the strategy entitled \u201cEquality in law for women and girls by 2030: \na multi-stakeholder strategy for accelerated action\u201d, and invites the two institutions \nto strengthen their cooperation in the implementation of the 2030 Agenda for \nSustainable Development;  \n \n46. Notes the activities implemented within the La Francophonie avec Elles \nfund, a support fund that provides technical and financial support to women and girls \nin vulnerable situations so that they have full and equal access to social and economic \ndevelopment, the sixth edition of which was launched in January 2025, and welcomes \nthe action taken by the Equality for Women and Men Unit within the International \nOrganization of la Francophonie, for the purpose of operationalizing the strategy for \nthe promotion of equality between women and men and the rights and empowerment \nof women and girls in the francophone countries, adopted in October 2018 at the \nseventeenth Summit of la Francophonie, held in Yerevan; \n \n47. Recalls the adoption by the Heads of State and Government of countries \nusing French as a common language, at the seventeenth Summit of la Francophonie, \nof the strategy for the promotion of equality between women and men and the rights \nand empowerment of women and girls in the francophone countries, which is intended \nto promote gender equality in the public and private spheres, encourage access for \ngirls and women to high-quality and inclusive education, training, decent work and \nhealth, promote their empowerment, prevent and combat all forms of violence, abuse \nand discrimination committed against them, and promote their full, effective and \nequal participation in political, economic, cultural and public life, including the \nprevention and resolution of conflicts; \n \n48. Welcomes the implementation of the Framework Agreement signed on \n7 December 2015 between the International Organization of la Francophonie and the \nUnited Nations Development Programme, and their cooperation, particularly in the \nfields of peace and democracy, sustainable development, climate change, economic \ndevelopment, South-South cooperation and support for civil society, and the \nimplementation of the 2030 Agenda for Sustainable Development, giving priority to \n\nA/RES/79/331 \nCooperation between the United Nations and the \nInternational Organization of la Francophonie\n \n25-14349\n12/13 \n \njob creation and entrepreneurship, as well as inclusive, sustainable and resilient \ndevelopment; \n \n49. Also welcomes the strengthening of the partnership between the \nInternational Organization of la Francophonie and the United Nations Office for \nSouth-South Cooperation for the benefit of the implementation of the Sustainable \nDevelopment Goals, and recalls, in particular, the signing of the memorandum of \nunderstanding between the two parties in New York on 25 September 2018, as well \nas the launch of the Network of Francophone Actors for South-South and Tripartite \nCooperation in Rabat in July 2018; \n \n50. Further welcomes the launch of the Francophone Alliance for Intellectual \nProperty on 2 October 2024, to promote and strengthen the French language in \ninternational intellectual property forums, and to complement the cooperation \nbetween the World Intellectual Property Organization and the International \nOrganization of la Francophonie based on the memorandum of understanding signed \nin Geneva on 12 May 2014 between the two organizations aimed at intensifying their \ntechnical cooperation efforts for the benefit of their members; \n \n51. Expresses its gratitude to the International Organization of la \nFrancophonie for the steps it has taken in recent years to promote cultural and \nlinguistic diversity and dialogue between cultures and civilizations, refers to the \nYerevan Call on Living Together, endorsed by the Heads of State and Government of \ncountries using French as a common language at the seventeenth Summit of la \nFrancophonie as a document to set forth the principles of living together for the \nfrancophone countries and to guide their collective efforts towards enhanced \ncooperation, solidarity, dialogue and tolerance, and encourages the United Nations \nand the International Organization of la Francophonie to cooperate more closely to \nensure full respect for provisions on multilingualism; \n \n52. Expresses its appreciation to the Secretary-General of the United Nations \nand the Secretary-General of la Francophonie for their sustained efforts to strengthen \ncooperation and coordination between the two organizations, thereby serving their \nmutual interests in the political, economic, social, cultural and environmental fields, \nin particular in the framework of the joint activities carried out by the International \nOrganization of la Francophonie with the United Nations Environment Programme \nand with the United Nations Educational, Scientific and Cultural Organization, as \nwell as in the context of developing exchanges between the International Organization \nof la Francophonie and United Nations Volunteers; \n \n53. Welcomes the involvement of the countries that use French as a common \nlanguage, particularly through the International Organization of la Francophonie, in \nthe preparation for, conduct of and follow-up to international conferences organized \nunder the auspices of the United Nations, such as the twenty-ninth session of the \nConference of the Parties to the United Nations Framework Convention on Climate \nChange, held in Baku, Azerbaijan, from 11 to 22 November 2024, the sixteenth \nmeeting of the Conference of the Parties to the Convention on Biological Diversity, \nheld in Cali, Colombia, from 21 October to 1 November 2024, the sixteenth session \nof the Conference of the Parties to the Convention to Combat Desertification in Those \nCountries Experiencing Serious Drought and/or Desertification, Particularly in \nAfrica, held in Riyadh, Saudi Arabia, from 2 to 13 December 2024, the third United \nNations Ocean Conference, held in Nice, France, from 9 to 13 June 2025, and the \nFourth International Conference on Financing for Development, held in Sevilla, \nSpain, from 30 June to 3 July 2025; \n \n54. Also welcomes the high-level meetings held periodically between the \nSecretary-General of the United Nations and the Secretary-General of la Francophonie, \n\nCooperation between the United Nations and the \nInternational Organization of la Francophonie \nA/RES/79/331\n \n13/13\n25-14349 \n \nand requests the Secretary-General of the United Nations, acting in cooperation with \nthe Secretary-General of la Francophonie, to encourage the holding of periodic \nmeetings between their representatives as well as with the Group of Francophone \nAmbassadors at United Nations Headquarters in order to promote the exchange of \ninformation, coordination of activities and identification of new areas of cooperation \nthrough the use of the French language as a vector for development; \n \n55. Invites the Secretary-General of the United Nations to take the steps \nnecessary, in collaboration with the Secretary-General of la Francophonie, to continue \nto promote cooperation between the two organizations; \n \n56. Requests the Secretary-General to submit to the General Assembly at its \neighty-first session a report on the implementation of the present resolution; \n \n57. Decides to include in the provisional agenda of its eighty-first session, \nunder the item entitled \u201cCooperation between the United Nations and regional and \nother organizations\u201d, the sub-item entitled \u201cCooperation between the United Nations \nand the International Organization of la Francophonie\u201d. \n \n95th plenary meeting \n5 September 2025 \n \n",
  "paragraphs": {
    "1": "Takes note of the report of the Secretary-General, and welcomes the strengthened and fruitful cooperation between the United Nations and the International Organization of la Francophonie;",
    "2": "Notes with satisfaction, in accordance with the Yerevan Declaration adopted by the Heads of State and Government of countries using French as a common language at the seventeenth Summit of la Francophonie,4 the active participation of the International Organization of la Francophonie in the work of the United Nations, among whose purposes, as set forth in its Charter, are to maintain international peace and security, to develop friendly relations among nations based on respect for the principle of equal rights and self-determination of peoples, and respect for the principle of the sovereignty and territorial integrity of States, to achieve international cooperation in solving international problems of an economic, social, cultural or humanitarian character and to be a centre for harmonizing the actions of nations in the attainment of those common ends;",
    "3": "Takes note of the adoption of the 2024\u20132027 four-year programme of the International Organization of la Francophonie, particularly in the fields of democracy, governance, sustainable development, education and gender equality, and encourages the complementarity of its programmes with the initiatives of United Nations agencies;",
    "4": "Notes with satisfaction the continued strengthening of cooperation between the United Nations and the International Organization of la Francophonie in the area of human rights and in the promotion of gender equality, commends the initiatives taken by the International Organization of la Francophonie in the areas of crisis and conflict prevention, management and resolution, the promotion of peace, support for democracy and the rule of law, full respect for human rights and good governance, the fight against impunity and the promotion of international criminal justice, in accordance with the commitments set forth in its Bamako Declaration of 3 November 2000 on the practices of democracy, rights and freedoms in the francophone world,5 and reaffirmed at the Ministerial Conference of la Francophonie on Conflict Prevention and Human Security, held on 13 and 14 May 2006 in Saint- Boniface, Canada;",
    "5": "Recalls the involvement of the International Organization of la Francophonie in high-level consultations and its genuine contribution, in cooperation with, among others, the United Nations, to conflict resolution, recovery and peacebuilding, and notes with interest the adoption on 19 June 2024 of a mechanism for monitoring and evaluating the situation of States and Governments subject to measures taken by Francophonie bodies;",
    "6": "Welcomes the strengthened cooperation between the Office of the United Nations High Commissioner for Human Rights and the International Organization of la Francophonie, to strengthen the national capacities of francophone States in addressing the recommendations of United Nations human rights mechanisms, in particular the universal periodic review, as well as promoting diversity and combating all forms of discrimination, and welcomes the adoption of a new road map for cooperation between the two organizations for the period 2024\u20132025;",
    "7": "Recalls the principles relating to the status of national institutions for the promotion and protection of human rights (the Paris Principles) 6 and the establishment of the Global Alliance of National Human Rights Institutions, with which the United Nations and the International Organization of la Francophonie cooperate in a complementary manner for the promotion and protection of human rights;",
    "8": "Expresses its deep concern about the continued violations and abuses of human rights and violations of international humanitarian law, including in countries affected by conflict or in post-conflict situations, and particularly against women and children, as well as refugees, internally displaced persons and migrants and persons in vulnerable situations;",
    "9": "Welcomes the development of cooperation between the United Nations and the International Organization of la Francophonie, with the participation of other regional and subregional organizations, in the fields of early warning and crisis and conflict prevention in accordance with the relevant resolutions of the Security Council and the General Assembly, and, in accordance with the Charter of the United Nations, encourages the pursuit of this initiative with a view to formulating practical recommendations to facilitate the establishment of relevant operational mechanisms, where necessary, and invites the relevant stakeholders to redouble their efforts to reduce risks and latent vulnerabilities, including by considering the development of risk management and resilience strategies;",
    "10": "Recognizes, as part of the cooperation between the United Nations and the International Organization of la Francophonie, the interest in intensifying efforts to move towards rapid response and the need to promote the full participation of women and youth in conflict prevention and ensure the full, equal and meaningful participation and protection of women in all aspects and at all levels of conflict prevention, management and resolution mechanisms, including through their involvement in the negotiation and implementation of peace agreement processes through the full implementation of the women and peace and security agenda in accordance with all relevant Security Council resolutions; and welcomes in this respect the training developed by the International Organization of la Francophonie, in partnership with the Senghor University in Alexandria, Egypt, with a view to the promotion and ownership, by the national actors of its member States, of the women and peace and security and the youth, peace and security agendas;",
    "11": "Welcomes the impetus given to the participation of States members of the International Organization of la Francophonie in peacekeeping operations, while recalling that it is up to the United Nations to preserve multilingualism and the Secretariat to integrate multilingualism into the activities of these operations, and draws attention to the strengthened cooperation between the International Organization of la Francophonie, on the one hand, and the Department of Peace Operations and the Department of Operational Support of the Secretariat, on the other, with a view to reaching a satisfactory level of French-speaking personnel involved in United Nations peacekeeping operations in French-speaking countries, where the need has been expressed by the Secretariat, including the number of women, within the existing relevant United Nations legislative framework on staff selection;",
    "12": "Also welcomes that this cooperation, carried out in conjunction with the States members of the International Organization of la Francophonie in order to develop technical and linguistic capabilities in French, has contributed to strengthening the presence of French speakers in peacekeeping operations and their full participation in the strategic discussions on peacekeeping, and welcomes the strengthening of the cooperation between the International Organization of la Francophonie, its member States, the Department of Peace Operations, the Department of Operational Support and the United Nations Institute for Training and Research in the field of peacekeeping, to the benefit of innovative and unprecedented capacity-building initiatives for contributing countries;",
    "13": "Recalls that the International Organization of la Francophonie was among the first international organizations to endorse the Declaration of Shared Commitments on United Nations Peacekeeping Operations and has volunteered to promote capacity-building of French-speaking personnel and the development of French-language skills, and underlines that the Action for Peacekeeping initiative recognizes language skills as a necessary specialized capability, which is part of, inter alia, the performance of peacekeeping operations;",
    "14": "Welcomes the good functioning of the Boutros-Ghali Peacekeeping Observatory, managed by the Group for Research and Information on Peace and Security, which constitutes in particular a framework for exchanges between French- speaking experts and personalities from personnel-contributing countries and strives to support francophone States in their efforts to better prepare for their participation in peacekeeping operations, particularly those deployed in a francophone environment, and strongly encourages continued active collaboration between the International Organization of la Francophonie and the Peacebuilding Commission;",
    "15": "Also welcomes the partnership developed between the International Organization of la Francophonie and the United Nations Institute for Disarmament Research and the organization, within this framework, of training and information sessions for francophone countries on disarmament issues;",
    "16": "Notes the actions taken by la Francophonie to prevent and counter terrorism and violent extremism conducive to terrorism;",
    "17": "Welcomes the involvement of the International Organization of la Francophonie in promoting international criminal justice, and recalls the signing of a partnership agreement between the International Organization of la Francophonie and the International Criminal Court, which illustrates the role played by the International Organization of la Francophonie in protecting human rights, restoring the rule of law and combating impunity;",
    "18": "",
    "19": "Further welcomes the efforts of the International Organization of la Francophonie to establish citizen-responsive democratic governance of the security sector, to define a francophone position with regard to justice, truth and reconciliation in order to support French-speaking States in crisis and in transition, and to promote the diversity of legal systems;",
    "20": "Welcomes local cooperation carried out by the network of external representations of the International Organization of la Francophonie in partnership with United Nations institutions, in support of their objectives in the fields of peace, sustainable development and human rights;",
    "21": "Also welcomes the action taken by the International Organization of la Francophonie and its member States and Governments aimed at promoting the implementation of the Sustainable Development Goals, and welcomes in this respect the support provided by the International Organization of la Francophonie to its member countries in the process of monitoring the implementation of the 2030 Agenda for Sustainable Development7 and the Sustainable Development Goals by encouraging a peer review of their voluntary national reviews, allowing the action taken by the International Organization of la Francophonie and the Institute for Sustainable Development of la Francophonie to promote greater inclusiveness in climate and environmental negotiations, and better access for francophone countries to sustainable finance;",
    "22": "Further welcomes the action taken by the International Organization of la Francophonie in promoting education and training, including the integration of digital issues in those areas, and recalls in this regard the primary and effective role of the International French Language University for African Development (Senghor University in Alexandria, Egypt) in training African country executives and in supporting the promotion of their skills;",
    "23": "Welcomes the work of the Francophonie Institute for Education and Training in Dakar, the main mission of which is to provide the States and Governments of the International Organization of la Francophonie with technical expertise to guarantee inclusive and equitable access to quality education throughout life, in particular by encouraging the integration of national languages into education systems, also welcomes the efforts of the International Organization of la Francophonie to enhance the value of the teaching profession through initiatives that strengthen teachers\u2019 skills, including digital skills, improve their working conditions and raise their status, and further welcomes the participation of the International Organization of la Francophonie in the Transforming Education Summit, held in New York from 16 to 19 September 2022, reaffirming the key role of teachers and national languages in the transformation of education systems;",
    "24": "Also welcomes the development of resources and activities within the digital portal of free educational resources known as RELIEFH, established by the International Organization of la Francophonie, which allows for the exchange and sharing of resources, quarterly training sessions, an annual awareness-raising caravan and best practices between member States and Governments in order to improve access to equal education from an early age, taking fully into account the fact that States members of the International Organization of la Francophonie have different education systems, further welcomes the approach of consultation and coordination in the field of education between the actors of the Charter of la Francophonie, and the priority areas in the fields of teachers\u2019 training and mobility, girls\u2019 education, bilingual education and digital education, and further welcomes the strengthening of the regional centres for French-language education deployed for Asia and the Pacific in Viet Nam (CREFAP), for Central and Eastern Europe in Bulgaria (CREFECO) and for Africa in Djibouti (CREFA), which strengthen international cooperation in the field of quality education in French and offer trainings and resources, notably through the \u201cSpeak French\u201d platform;",
    "25": "Further welcomes the action taken by the International Organization of la Francophonie to modernize and strengthen civil registry systems for the benefit of its member States, in collaboration with international partners such as the United Nations Educational, Scientific and Cultural Organization, the World Health Organization and the Economic Commission for Africa;",
    "26": "Notes the collaborations and regular exchanges between the International Organization of la Francophonie and the United Nations Conference on Trade and Development on the role of digital and new technologies as a vector of economic and social development, and also notes the technical cooperation between the International Organization of la Francophonie and the United Nations Commission on International Trade Law regarding possible reform of investor-State dispute settlement;",
    "27": "Welcomes the strengthening of the cooperation between the International Organization of la Francophonie and the International Telecommunication Union through the membership of the International Organization of la Francophonie in the three International Telecommunication Union sectors, as part of joint awareness- raising activities on cultural and linguistic diversity in the field of digital cooperation and in the life cycle of artificial intelligence;",
    "28": "Also welcomes the strengthening of cooperation between the World Health Organization and the International Organization of la Francophonie, through the signing of a cooperation agreement, on 9 November 2021, and deepened by the creation of the World Health Organization Academy in Lyon, France, a centre for continuing education of healthcare personnel inaugurated on 17 December 2024 to strengthen francophone capacities in the healthcare field;",
    "29": "Further welcomes the contribution of the Secretary-General of la Francophonie to the international community\u2019s advocacy for universal access to safe, efficacious and affordable vaccines and global access to treatments, as well as to diagnostic tools against communicable diseases, and further welcomes the holding of francophone ministerial consultations in 2023 and 2024 on the margins of the World Health Assembly, dedicated to the challenges faced in this area in the francophone world;",
    "30": "Underlines the strengthening of cooperation between the International Labour Organization and the International Organization of la Francophonie, welcomes in this regard the joint organization of awareness-raising and capacity- building actions, in particular the francophone contribution to the International Labour Conference held from 3 to 14 June 2024 and regular dialogues with the Director General of the International Labour Organization, and encourages further cooperation to enhance decent work opportunities for all, and adopt and adhere to international labour standards;",
    "31": "Takes note of the Digital Francophonie Strategy for 2022\u20132026 and of the contribution of la Francophonie to the consultations in the framework of the Global Digital Compact,8 and welcomes the partnership developed with the United Nations Office for Digital and Emerging Technologies to strengthen the capacities of francophone delegations and promote inclusive governance of artificial intelligence;",
    "32": "Notes with satisfaction and encourages the strengthening of the collaboration between the United Nations and the International Organization of la Francophonie in supporting democratic processes, particularly during election periods, welcomes the technical support given by the International Organization of la Francophonie to electoral processes in countries members of the International Organization of la Francophonie in 2023 and 2024, notably in Guinea-Bissau, the Comoros, Togo, Chad, Madagascar, Rwanda, Mauritania, the Republic of Moldova, Tunisia, Mauritius and Senegal, as well as ongoing electoral processes, especially those marking the end of transition periods;",
    "33": "Welcomes the efforts undertaken by the International Organization of la Francophonie in combating intolerance, hate speech, misinformation and disinformation, particularly in terms of fact-checking, takes note of the launch by the States members of the International Organization of la Francophonie of the Villers- Cotter\u00eats Call for a trustworthy and ethical digital space in the francophone world, addressed to digital platforms, at the nineteenth Summit of la Francophonie, in 2024, and notes with satisfaction tools implemented through the francophone platform of initiatives to combat disinformation and collaborations on these issues developed with the Department of Global Communications of the Secretariat and the Communication and Information Sector of the United Nations Educational, Scientific and Cultural Organization;",
    "34": "Expresses its appreciation to the Secretary-General of the United Nations for including the International Organization of la Francophonie in the periodic meetings he holds with heads of international and regional organizations, and invites him to continue to do so, taking into account the role played by the International Organization of la Francophonie in conflict prevention and support for democracy and the rule of law, gender equality and the empowerment of women and girls, and sustainable development, and in that regard encourages cooperation in the field between the United Nations, the International Organization of la Francophonie and other international and regional organizations aimed at promoting the peaceful settlement of disputes, including through mediation;",
    "35": "Invites the Secretary-General to continue to involve the International Organization of la Francophonie, taking into account its expertise as well as the Declaration on the French language within the linguistic diversity of la Francophonie, which provides for a mechanism for monitoring commitments based on the work of the French Language Observatory of the International Organization of la Francophonie, in the efforts to promote multilingualism, a core value of the United Nations, bearing in mind the objective of eliminating disparities between the use of English and the use of other official languages within the Organization, including the activities linked to public relations and information, documentation, language services and conference services, human resources management and staff training, as well as the activities affected by those disparities in field offices and peacekeeping and peacebuilding operations;",
    "36": "Recalls the support of the International Organization of la Francophonie to the Secretariat of the United Nations in the development of the United Nations Language Framework issued in 2020 and in the development of trainings aimed at fighting against linguistic bias and promoting multilingualism and linguistic diversity;",
    "37": "",
    "38": "Reaffirms the need to respect the equality of the two working languages of the Secretariat, also reaffirms the use of additional working languages in specific duty stations as mandated, and in this regard requests the Secretary-General to ensure that vacancy announcements specify the need for either of the working languages of the Secretariat unless the functions of the post require a specific working language, welcomes the establishment by the International Organization of la Francophonie of a monitoring, alert and action system for the French language and multilingualism in international organizations, and also welcomes the publication in December 2020 of the report of the Joint Inspection Unit on the implementation of multilingualism in the United Nations system, 9 in which 13 recommendations are made to the deliberative or governing bodies of United Nations system agencies to improve the effective implementation of this principle;",
    "39": "Emphasizes the paramount importance of the equality of the six official languages of the United Nations and the importance of multilingualism in the activities of the United Nations, and recalls its support for the approach of the Secretary-General to integrate multilingualism, as a core value of the Organization, into the activities of the Secretariat, on an equitable basis;",
    "40": "Invites the United Nations and the International Organization of la Francophonie to strengthen their cooperation and dialogue for the removal of obstacles to multilingualism, a core value of the United Nations, within existing resources, and the implementation of the resolution on multilingualism adopted during the seventy-eighth session of the General Assembly;10",
    "41": "Considers that the interaction of the United Nations with the local population in the field is essential and that language skills constitute an important element of the selection and training processes, and therefore affirms that a good command of the official language or languages spoken in the country of residence should be taken into account as an important asset during those processes;",
    "42": "Notes the commitment of States members of the International Organization of la Francophonie to promote a balanced multilateral system which assures permanent and equal representation of African member States in decision-making bodies;",
    "43": "Also notes the firm commitment by the member States and Governments of the International Organization of la Francophonie to international peace and security, democracy, human rights, the rule of law, linguistic and cultural diversity, good governance, sustainable development and bridging digital divides between and within countries, as reaffirmed at the nineteenth Summit of la Francophonie, and the commitment of the States members of the International Organization of la Francophonie to take specific actions, as agreed at the nineteenth Summit and set out in the Villers-Cotter\u00eats Declaration, in the following areas: (a) Support for creation, innovation and entrepreneurship in French; (b) Promotion of gender equality and the empowerment of women and girls; (c) Strengthening of digital and artificial intelligence governance, digital cooperation and information integrity; (d) Implementation of international commitments in the fields of climate, environment and biodiversity; (e) Promotion of the use of the French language and linguistic and cultural diversity; (f) Promotion of peace, democracy and human rights;",
    "44": "Invites the specialized agencies, funds and programmes of the United Nations system, as well as the regional commissions, including the Economic Commission for Africa, to strengthen the cooperation with the International Organization of la Francophonie and its Institute for Sustainable Development of la Francophonie, by identifying new synergies in favour of sustainable development, in particular in the areas of poverty eradication, economic growth, energy, the conservation and sustainable use of biodiversity, the environment, sustainable agriculture and the global response to climate change, culture, education, training and the development of new information and communications technologies, in particular with a view to achieving the internationally agreed development goals, including the Sustainable Development Goals, to the benefit of all, including children, young people and women;",
    "45": "Welcomes the implementation of the agreement between the United Nations Entity for Gender Equality and the Empowerment of Women (UN-Women) and the International Organization of la Francophonie, as well as their cooperation, in particular in such areas as women\u2019s participation in political decision-making and in economic, social and cultural life, advocacy for the equality of women and men, the integration of gender equality into sustainable development, and combating violence and sexual exploitation and abuse against women and girls, as well as in the implementation of the strategy entitled \u201cEquality in law for women and girls by 2030: a multi-stakeholder strategy for accelerated action\u201d, and invites the two institutions to strengthen their cooperation in the implementation of the 2030 Agenda for Sustainable Development;",
    "46": "Notes the activities implemented within the La Francophonie avec Elles fund, a support fund that provides technical and financial support to women and girls in vulnerable situations so that they have full and equal access to social and economic development, the sixth edition of which was launched in January 2025, and welcomes the action taken by the Equality for Women and Men Unit within the International Organization of la Francophonie, for the purpose of operationalizing the strategy for the promotion of equality between women and men and the rights and empowerment of women and girls in the francophone countries, adopted in October 2018 at the seventeenth Summit of la Francophonie, held in Yerevan;",
    "47": "Recalls the adoption by the Heads of State and Government of countries using French as a common language, at the seventeenth Summit of la Francophonie, of the strategy for the promotion of equality between women and men and the rights and empowerment of women and girls in the francophone countries, which is intended to promote gender equality in the public and private spheres, encourage access for girls and women to high-quality and inclusive education, training, decent work and health, promote their empowerment, prevent and combat all forms of violence, abuse and discrimination committed against them, and promote their full, effective and equal participation in political, economic, cultural and public life, including the prevention and resolution of conflicts;",
    "48": " job creation and entrepreneurship, as well as inclusive, sustainable and resilient development;",
    "49": "Also welcomes the strengthening of the partnership between the International Organization of la Francophonie and the United Nations Office for South-South Cooperation for the benefit of the implementation of the Sustainable Development Goals, and recalls, in particular, the signing of the memorandum of understanding between the two parties in New York on 25 September 2018, as well as the launch of the Network of Francophone Actors for South-South and Tripartite Cooperation in Rabat in July 2018;",
    "50": "Further welcomes the launch of the Francophone Alliance for Intellectual Property on 2 October 2024, to promote and strengthen the French language in international intellectual property forums, and to complement the cooperation between the World Intellectual Property Organization and the International Organization of la Francophonie based on the memorandum of understanding signed in Geneva on 12 May 2014 between the two organizations aimed at intensifying their technical cooperation efforts for the benefit of their members;",
    "51": "Expresses its gratitude to the International Organization of la Francophonie for the steps it has taken in recent years to promote cultural and linguistic diversity and dialogue between cultures and civilizations, refers to the Yerevan Call on Living Together, endorsed by the Heads of State and Government of countries using French as a common language at the seventeenth Summit of la Francophonie as a document to set forth the principles of living together for the francophone countries and to guide their collective efforts towards enhanced cooperation, solidarity, dialogue and tolerance, and encourages the United Nations and the International Organization of la Francophonie to cooperate more closely to ensure full respect for provisions on multilingualism;",
    "52": "Expresses its appreciation to the Secretary-General of the United Nations and the Secretary-General of la Francophonie for their sustained efforts to strengthen cooperation and coordination between the two organizations, thereby serving their mutual interests in the political, economic, social, cultural and environmental fields, in particular in the framework of the joint activities carried out by the International Organization of la Francophonie with the United Nations Environment Programme and with the United Nations Educational, Scientific and Cultural Organization, as well as in the context of developing exchanges between the International Organization of la Francophonie and United Nations Volunteers;",
    "53": "Welcomes the involvement of the countries that use French as a common language, particularly through the International Organization of la Francophonie, in the preparation for, conduct of and follow-up to international conferences organized under the auspices of the United Nations, such as the twenty-ninth session of the Conference of the Parties to the United Nations Framework Convention on Climate Change, held in Baku, Azerbaijan, from 11 to 22 November 2024, the sixteenth meeting of the Conference of the Parties to the Convention on Biological Diversity, held in Cali, Colombia, from 21 October to 1 November 2024, the sixteenth session of the Conference of the Parties to the Convention to Combat Desertification in Those Countries Experiencing Serious Drought and/or Desertification, Particularly in Africa, held in Riyadh, Saudi Arabia, from 2 to 13 December 2024, the third United Nations Ocean Conference, held in Nice, France, from 9 to 13 June 2025, and the Fourth International Conference on Financing for Development, held in Sevilla, Spain, from 30 June to 3 July 2025;",
    "54": " and requests the Secretary-General of the United Nations, acting in cooperation with the Secretary-General of la Francophonie, to encourage the holding of periodic meetings between their representatives as well as with the Group of Francophone Ambassadors at United Nations Headquarters in order to promote the exchange of information, coordination of activities and identification of new areas of cooperation through the use of the French language as a vector for development;",
    "55": "Invites the Secretary-General of the United Nations to take the steps necessary, in collaboration with the Secretary-General of la Francophonie, to continue to promote cooperation between the two organizations;",
    "56": "Requests the Secretary-General to submit to the General Assembly at its eighty-first session a report on the implementation of the present resolution;",
    "57": "Decides to include in the provisional agenda of its eighty-first session, under the item entitled \u201cCooperation between the United Nations and regional and other organizations\u201d, the sub-item entitled \u201cCooperation between the United Nations and the International Organization of la Francophonie\u201d."
  },
  "agenda_items": [
    "Item 125"
  ],
  "symbol_references": [
    "A/79/L.121"
  ]
}