{
  "symbol": "A/RES/79/76",
  "filename": "A_RES_79_76.pdf",
  "title": "79/76. Strengthening of security and cooperation in the Mediterranean region",
  "text": "United Nations \nA/RES/79/76\n \n \nGeneral Assembly \nDistr.: General \n10 December 2024 \n \n24-23053 (E) \n*2423053* \n \n \nSeventy-ninth session \nAgenda item 103 \nStrengthening of security and cooperation in the \nMediterranean region \n \n \n \n \n Resolution adopted by the General Assembly \non 2 December 2024 \n \n \n \n \n[on the report of the First Committee (A/79/413, para. 7)] \n \n \n \n79/76. Strengthening of security and cooperation in the \nMediterranean region \n \n \n \nThe General Assembly, \n \nRecalling its previous resolutions on the subject, including resolution 78/65 of \n4 December 2023,  \n \nReaffirming the primary role of the Mediterranean countries in strengthening \nand promoting peace, security and cooperation in the Mediterranean region,  \n \nWelcoming the efforts deployed by the Euro-Mediterranean countries to \nstrengthen their cooperation in combating terrorism, in particular through the \nadoption of the Euro-Mediterranean Code of Conduct on Countering Terrorism by the \nEuro-Mediterranean Summit, held in Barcelona, Spain, on 27 and 28 November 2005, \n \nBearing in mind all the previous declarations and commitments, as well as all \nthe initiatives taken by the riparian countries at the recent summits, ministerial \nmeetings and various forums concerning the question of the Mediterranean region,  \n \nRecalling, in this regard, the adoption on 13 July 2008 of the Joint Declaration \nof the Paris Summit for the Mediterranean, which launched a reinforced partnership, \nnamed the \u201cBarcelona Process: Union for the Mediterranean\u201d, and the common \npolitical will to revive efforts to transform the Mediterranean into an area of peace, \ndemocracy, cooperation and prosperity,  \n \nWelcoming the entry into force of the African Nuclear-Weapon-Free Zone Treaty \n(Treaty of Pelindaba)1 as a contribution to the strengthening of peace and security \nboth regionally and internationally,  \n__________________ \n \n1  A/50/426, annex. \n\nA/RES/79/76 \nStrengthening of security and cooperation in the\nMediterranean region\n \n24-23053\n2/3 \n \n \nRecognizing the indivisible character of security in the Mediterranean and that \nthe enhancement of cooperation among Mediterranean countries with a view to \npromoting the economic and social development of all peoples of the region will \ncontribute significantly to stability, peace and security in the region,  \n \nRecognizing also the efforts made so far and the determination of the \nMediterranean countries to intensify the process of dialogue and consultations with a \nview to resolving the problems existing in the Mediterranean region and to \neliminating the causes of tension and the consequent threat to peace and security, as \nwell as their growing awareness of the need for further joint efforts to strengthen \neconomic, social, cultural and environmental cooperation in the region,  \n \nRecognizing further that prospects for closer Euro-Mediterranean cooperation \nin all spheres can be enhanced by positive developments worldwide, in particular in \nEurope, in the Maghreb and in the Middle East,  \n \nReaffirming the responsibility of all States to contribute to the stability and \nprosperity of the Mediterranean region and their commitment to respecting the \npurposes and principles of the Charter of the United Nations as well as the provisions \nof the Declaration on Principles of International Law concerning Friendly Relations \nand Cooperation among States in accordance with the Charter of the United Nations, 2 \n \nNoting the peace negotiations in the Middle East, which should be of a \ncomprehensive nature and represent an appropriate framework for the peaceful \nsettlement of contentious issues in the region,  \n \nExpressing concern at the persistent tension and continuing military activities \nin parts of the Mediterranean that hinder efforts to strengthen security and cooperation \nin the region,  \n \nTaking note of the report of the Secretary-General,3 \n \n1. \nReaffirms that security in the Mediterranean is closely linked to European \nsecurity as well as to international peace and security;  \n \n2. \nInvites Mediterranean countries to consolidate their efforts in order to \ncontribute actively to the elimination of all causes of tension in the region and to the \npromotion of just and lasting solutions to the persistent problems of the region \nthrough peaceful means, thus ensuring the withdrawal of foreign forces of occupation \nand respecting the sovereignty, independence and territorial integrity of all countries \nof the Mediterranean and the right of peoples to self-determination, and therefore \ncalls for full adherence to the principles of non-interference, non-intervention, \nnon-use of force or threat of use of force and the inadmissibility of the acquisition of \nterritory by force, in accordance with the Charter and the relevant resolutions of the \nUnited Nations;  \n \n3. \nCommends the Mediterranean countries for their efforts in meeting \ncommon challenges through coordinated overall responses, based on a spirit of \nmultilateral partnership, towards the general objective of turning the Mediterranean \nbasin into an area of dialogue, exchanges and cooperation, guaranteeing peace, \nstability and prosperity, encourages them to strengthen such efforts through, inter alia, \na lasting multilateral and action-oriented cooperative dialogue among States of the \nregion, and recognizes the role of the United Nations in promoting regional and \ninternational peace and security; \n \n4. \nRecognizes that the elimination of the economic and social disparities in \nlevels of development and other obstacles, as well as respect and greater \n__________________ \n \n2  Resolution 2625 (XXV), annex. \n \n3  A/79/113. \n\nStrengthening of security and cooperation in the \nMediterranean region \nA/RES/79/76\n \n3/3\n24-23053 \n \nunderstanding among cultures in the Mediterranean area, will contribute to enhancing \npeace, security and cooperation among Mediterranean countries through the existing \nforums; \n \n5. \nCalls upon all countries of the Mediterranean region to adhere to the \nrelevant multilaterally negotiated legal instruments related to the field of disarmament \nand non-proliferation, thus creating the conditions necessary for strengthening peace \nand cooperation in the region;  \n \n6. \nEncourages all States of the region to favour the conditions necessary for \nstrengthening the confidence-building measures among them by promoting genuine \nopenness and transparency on all military matters, by participating, inter alia, in the \nUnited Nations Report on Military Expenditures and by providing accurate data and \ninformation to the United Nations Register of Conventional Arms;  \n \n7. \nEncourages the Mediterranean countries to strengthen further their \ncooperation in combating terrorism in all its forms and manifestations, including the \npossible resort by terrorists to weapons of mass destruction, taking into account the \nrelevant resolutions of the United Nations, and in combating international crime and \nillicit arms transfers and illicit drug production, consumption and trafficking, which \npose a serious threat to peace, security and stability in the region and therefore to the \nimprovement of the current political, economic and social situation and which \njeopardize friendly relations among States, hinder the development of international \ncooperation and result in the destruction of human rights, fundamental freedoms and \nthe democratic basis of pluralistic society;  \n \n8. \nRequests the Secretary-General to submit to the General Assembly at its \neightieth session a report on means to strengthen security and cooperation in the \nMediterranean region; \n \n9. \nDecides to include in the provisional agenda of its eightieth session the \nitem entitled \u201cStrengthening of security and cooperation in the Mediterranean \nregion\u201d. \n \n44th plenary meeting \n2 December 2024 \n \n",
  "paragraphs": {
    "1": "Reaffirms that security in the Mediterranean is closely linked to European security as well as to international peace and security;",
    "2": "Invites Mediterranean countries to consolidate their efforts in order to contribute actively to the elimination of all causes of tension in the region and to the promotion of just and lasting solutions to the persistent problems of the region through peaceful means, thus ensuring the withdrawal of foreign forces of occupation and respecting the sovereignty, independence and territorial integrity of all countries of the Mediterranean and the right of peoples to self-determination, and therefore calls for full adherence to the principles of non-interference, non-intervention, non-use of force or threat of use of force and the inadmissibility of the acquisition of territory by force, in accordance with the Charter and the relevant resolutions of the United Nations;",
    "3": "Commends the Mediterranean countries for their efforts in meeting common challenges through coordinated overall responses, based on a spirit of multilateral partnership, towards the general objective of turning the Mediterranean basin into an area of dialogue, exchanges and cooperation, guaranteeing peace, stability and prosperity, encourages them to strengthen such efforts through, inter alia, a lasting multilateral and action-oriented cooperative dialogue among States of the region, and recognizes the role of the United Nations in promoting regional and international peace and security;",
    "4": "Recognizes that the elimination of the economic and social disparities in levels of development and other obstacles, as well as respect and greater __________________ 2 Resolution 2625 (XXV), annex. 3 A/79/113. Strengthening of security and cooperation in the Mediterranean region A/RES/79/76 3/3 24-23053 understanding among cultures in the Mediterranean area, will contribute to enhancing peace, security and cooperation among Mediterranean countries through the existing forums;",
    "5": "Calls upon all countries of the Mediterranean region to adhere to the relevant multilaterally negotiated legal instruments related to the field of disarmament and non-proliferation, thus creating the conditions necessary for strengthening peace and cooperation in the region;",
    "6": "Encourages all States of the region to favour the conditions necessary for strengthening the confidence-building measures among them by promoting genuine openness and transparency on all military matters, by participating, inter alia, in the United Nations Report on Military Expenditures and by providing accurate data and information to the United Nations Register of Conventional Arms;",
    "7": "Encourages the Mediterranean countries to strengthen further their cooperation in combating terrorism in all its forms and manifestations, including the possible resort by terrorists to weapons of mass destruction, taking into account the relevant resolutions of the United Nations, and in combating international crime and illicit arms transfers and illicit drug production, consumption and trafficking, which pose a serious threat to peace, security and stability in the region and therefore to the improvement of the current political, economic and social situation and which jeopardize friendly relations among States, hinder the development of international cooperation and result in the destruction of human rights, fundamental freedoms and the democratic basis of pluralistic society;",
    "8": "Requests the Secretary-General to submit to the General Assembly at its eightieth session a report on means to strengthen security and cooperation in the Mediterranean region;",
    "9": "Decides to include in the provisional agenda of its eightieth session the item entitled \u201cStrengthening of security and cooperation in the Mediterranean region\u201d. 44th plenary meeting 2 December 2024"
  },
  "agenda_items": [
    "Item 103"
  ],
  "symbol_references": []
}