{
  "symbol": "A/RES/75/5",
  "filename": "A_RES_75_5.pdf",
  "title": "75/5. Seventy-fifth anniversary of the end of the Second World War",
  "text": "United Nations \nA/RES/75/5 \n \n \nGeneral Assembly \nDistr.: General \n9 November 2020 \n \n20-14788 (E)    111120 \n*2014788* \n \n \nSeventy-fifth session \nAgenda item 137 \nSeventy-fifth anniversary of the end of the \nSecond World War \n \n \n \n \n Resolution adopted by the General Assembly \non 5 November 2020 \n \n \n \n \n[without reference to a Main Committee (A/75/L.4 and A/75/L.4/Add.1)] \n \n \n \n75/5. Seventy-fifth anniversary of the end of the Second World War \n \n \n \nThe General Assembly, \n \nRecalling its resolution 59/26 of 22 November 2004, in which it, inter alia, \ndeclared 8\u20139 May as a time of remembrance and reconciliation, while recognizing \nthat Member States may have individual dates of victory, liberation and \ncommemoration, \n \nRecalling that 2020 marks the seventy-fifth anniversary of the end of the Second \nWorld War, a war which brought untold sorrow to humankind, particularly in Europe, \nAsia, Africa, the Pacific and other parts of the world, \n \nStressing that this historic event established the conditions for the creation of \nthe United Nations, designed to save succeeding generations from the scourge of war, \n \nNoting that the United Nations has helped to shape the very structure of relations \nbetween nations in the modern age, including through the process of decolonization, \nand recalling in this regard the Declaration on the Granting of Independence to \nColonial Countries and Peoples of 14 December 1960,1 \n \nCalling upon the States Members of the United Nations to unite their efforts in \ndealing with challenges and threats to international peace and security, with the \nUnited Nations playing a central role, and to make every effort to refrain in their \ninternational relations from the threat or use of force against the territorial integrity \nor political independence of any State, or in any other manner inconsistent with the \npurposes of the United Nations, and to settle all disputes by peaceful means in \nconformity with the Charter of the United Nations, \n__________________ \n \n1  Resolution 1514 (XV). \n\nA/RES/75/5 \nSeventy-fifth anniversary of the end of the Second World War\n \n20-14788\n2/2 \n \n \nUnderlining the progress made since the end of the Second World War in \novercoming its legacy and towards reconciliation, international and regional \ncooperation and the promotion of democratic values, human rights and fundamental \nfreedoms, in particular through the United Nations, and the establishment of regional \norganizations and other appropriate frameworks, \n \n1. \nInvites all Member States, organizations of the United Nations system, \nnon-governmental organizations and individuals to observe these days in an \nappropriate manner to pay tribute to all victims of the Second World War; \n \n2. \nRequests the President of the General Assembly to hold a special solemn \nmeeting of the General Assembly on 1 December 2020 in commemoration of all \nvictims of the war; \n \n3. \nRequests the Secretary-General to bring the present resolution to the \nattention of all Member States and organizations of the United Nations system and to \ntake measures necessary for its implementation. \n \n21st plenary meeting \n5 November 2020 \n \n",
  "paragraphs": {
    "1": "Invites all Member States, organizations of the United Nations system, non-governmental organizations and individuals to observe these days in an appropriate manner to pay tribute to all victims of the Second World War;",
    "2": "Requests the President of the General Assembly to hold a special solemn meeting of the General Assembly on 1 December 2020 in commemoration of all victims of the war;",
    "3": "Requests the Secretary-General to bring the present resolution to the attention of all Member States and organizations of the United Nations system and to take measures necessary for its implementation."
  },
  "agenda_items": [
    "Item 137"
  ],
  "symbol_references": [
    "A/75/L.4"
  ]
}