{
  "symbol": "A/RES/75/139",
  "filename": "A_RES_75_139.pdf",
  "title": "75/139. Consideration of effective measures to enhance the protection, security and safety of diplomatic and consular missions and representatives",
  "text": "United Nations \nA/RES/75/139\n \n \nGeneral Assembly \nDistr.: General \n22 December 2020 \n \n20-17202 (E)    291220     \n*2017202* \n \n \nSeventy-fifth session \nAgenda item 84 \nConsideration of effective measures to enhance the \nprotection, security and safety of diplomatic and \nconsular missions and representatives  \n \n \n \n \n Resolution adopted by the General Assembly \non 15 December 2020 \n \n \n \n \n[on the report of the Sixth Committee (A/75/430, para. 7)] \n \n \n 75/139. Consideration of effective measures to enhance the protection, \nsecurity and safety of diplomatic and consular missions \nand representatives \n \n \n \nThe General Assembly, \n \nHaving considered the report of the Secretary-General,1 \n \nConscious of the need to develop and strengthen friendly relations and \ncooperation among States, \n \nConvinced that respect for the principles and rules of international law \ngoverning diplomatic and consular relations, including those derived from the \nprinciple of sovereign equality of States, is a basic prerequisite for the normal conduct \nof relations among States and for the fulfilment of the purposes and principles of the \nCharter of the United Nations, \n \nAlarmed by the new and recurring acts of violence against diplomatic and \nconsular representatives, as well as against representatives to international \nintergovernmental organizations and officials of such organizations, which endanger \nor take innocent lives and seriously impede the normal work of such representatives \nand officials, \n \nExpressing sympathy for the victims of such illegal acts, \n \nRecalling that, to the extent provided by the relevant rules of international law, \npremises of diplomatic missions, consular premises and premises of permanent \nmissions with diplomatic status to international intergovernmental organizations, as \nwell as private residences of relevant members of diplomatic missions and \n__________________ \n \n1  A/75/168. \n\nA/RES/75/139 \nConsideration of effective measures to enhance the protection, \nsecurity and safety of diplomatic and consular missions \nand representatives\n \n20-17202\n2/4 \n \nrepresentatives to international intergovernmental organizations, shall be inviolable \nand that, to the extent consistent with the relevant rules of international law, agents of \nthe receiving State shall not enter them, except with the consent of the sending State, \n \nNoting that diplomatic and consular missions may maintain archives and \ndocuments in various forms, that official correspondence may take a variety of forms \nand that diplomatic and consular missions may use a variety of means of communication, \n \nRecalling that the archives and documents of diplomatic and consular missions \nshall be inviolable at any time and wherever they may be and that the official \ncorrespondence of diplomatic and consular missions shall be inviolable, \n \nRecalling also that States shall permit and protect free communication of \ndiplomatic and consular missions for all official purposes and that diplomatic and \nconsular missions may employ all appropriate means in communicating with their \nGovernments and other diplomatic and consular missions of their State, wherever \nsituated, \n \nConcerned at the failure to respect the inviolability of diplomatic and consular \nmissions and representatives and, as appropriate, their family members, as well as of \npermanent missions and, as appropriate, relevant representatives to international \nintergovernmental organizations and their family members, \n \nRecalling that, without prejudice to their privileges and immunities, it is the \nduty of all persons enjoying such privileges and immunities to respect the laws and \nregulations of the receiving State, \n \nRecalling also that diplomatic and consular premises must not be used in any \nmanner incompatible with the functions of diplomatic and consular missions, \n \nEmphasizing the duty of States to take all appropriate measures, as required by \ninternational law, in a timely manner, for the protection of diplomatic and consular \nmissions and representatives as well as missions and representatives to international \nintergovernmental organizations and officials of such organizations, including \nmeasures of a preventive nature, and to bring offenders to justice, \n \nWelcoming measures already taken by States to this end in conformity with their \ninternational obligations, \n \nRecognizing that measures to enhance the protection, security and safety of \ndiplomatic and consular missions and representatives, as well as close cooperation \nbetween States in this regard, are particularly important in the light of the challenges \nposed by the coronavirus disease (COVID-19) pandemic, \n \nConvinced that the role of the United Nations, which includes the reporting \nprocedures established pursuant to General Assembly resolution 35/168 of \n15 December 1980 and further elaborated in subsequent Assembly resolutions, is \nimportant in promoting efforts to enhance the protection, security and safety of \ndiplomatic and consular missions and representatives, \n \n1. \nWelcomes the report of the Secretary-General; \n \n2. \nStrongly condemns all acts of violence against diplomatic and consular \nmissions and representatives, as well as against missions and representatives to \ninternational intergovernmental organizations and officials of such organizations, and \nemphasizes that such acts can never be justified; \n \n3. \nUrges States to strictly observe, implement and enforce, including during \na period of armed conflict, all the applicable principles and rules of international law \ngoverning diplomatic and consular relations, including those relating to inviolability, \nand, in particular, to ensure, in conformity with their international obligations, the \n\nConsideration of effective measures to enhance the protection, \nsecurity and safety of diplomatic and consular missions \nand representatives \nA/RES/75/139\n \n3/4\n20-17202 \n \nprotection, security and safety of the missions, representatives and officials \nmentioned in paragraph 2 above officially present in territories under their \njurisdiction, including practical measures to prevent and prohibit in their territories \nillegal activities of persons, groups and organizations that encourage, instigate, \norganize or engage in the perpetration of acts against the security and safety of such \nmissions, representatives and officials; \n \n4. \nAlso urges States to take all appropriate measures at the national and \ninternational levels to prevent any acts of violence against the missions, \nrepresentatives and officials mentioned in paragraph 2 above, including during a \nperiod of armed conflict, and to ensure, with the participation of the United Nations \nwhere appropriate, that such acts are fully investigated with a view to bringing \noffenders to justice; \n \n5. \nRecommends that States cooperate closely through, inter alia, contacts \nbetween the diplomatic and consular missions and the receiving State with regard to \npractical measures designed to enhance the protection, security and safety of \ndiplomatic and consular missions and representatives, including measures of a \npreventive nature, and with regard to the timely exchange of information on the \ncircumstances of all serious violations thereof; \n \n6. \nUrges States to strictly comply with the applicable rules of international \nlaw governing the protection and inviolability of premises of diplomatic missions, \nconsular premises and premises of permanent missions with diplomatic status to \ninternational intergovernmental organizations; \n \n7. \nAlso urges States to take all appropriate measures, in accordance with \ninternational law, at the national and international levels, to prevent any abuse of \ndiplomatic or consular privileges and immunities, in particular serious abuses, \nincluding those involving acts of violence; \n \n8. \nRecommends that States cooperate closely with the State in whose territory \nabuses of diplomatic and consular privileges and immunities may have occurred, \nincluding by exchanging information and providing assistance to its juridical \nauthorities in order to bring offenders to justice; \n \n9. \nCalls upon States that have not yet done so to consider becoming parties \nto the instruments relevant to the protection, security and safety of diplomatic and \nconsular missions and representatives; \n \n10. Calls upon States, in cases where a dispute arises in connection with a \nviolation of their international obligations concerning the protection of the missions, \ntheir archives and premises or the security of the representatives and officials \nmentioned in paragraph 2 above, to make use of the means available for peaceful \nsettlement of disputes, including the good offices of the Secretary-General, and \nrequests the Secretary-General, when he deems it appropriate, to offer his good \noffices to the States directly concerned; \n \n11. \nUrges: \n \n(a) \nAll States to report to the Secretary-General, in a concise and expeditious \nmanner and in accordance with the guidelines prepared by the Secretary-General,2 \nserious violations of the protection, security and safety of diplomatic and consular \nmissions and representatives as well as missions and representatives with diplomatic \nstatus to international intergovernmental organizations; \n \n(b) \nThe State in which the violation took place \u2013 and, to the extent possible, \nthe State where the alleged offender is present \u2013 to report to the Secretary-General, \n__________________ \n \n2  A/42/485, annex. \n\nA/RES/75/139 \nConsideration of effective measures to enhance the protection, \nsecurity and safety of diplomatic and consular missions \nand representatives\n \n20-17202\n4/4 \n \nin a concise and expeditious manner and in accordance with the guidelines prepared \nby the Secretary-General, on measures taken to bring the offender to justice and to \ncommunicate, in accordance with its laws, the final outcome of the proceedings \nagainst the offender, and to report on measures adopted with a view to preventing a \nrepetition of such violations; \n \n12. Requests the Secretary-General: \n \n(a) \nTo send, without delay, a circular note to all States reminding them of the \nrequest contained in paragraph 11 above; \n \n(b) \nTo circulate to all States, upon receipt, the reports received by him \npursuant to paragraph 11 above, unless the reporting State requests otherwise; \n \n(c) \nTo draw the attention, when appropriate, of the States directly concerned \nto the reporting procedures provided for in paragraph 11 above, when a serious \nviolation has been reported pursuant to paragraph 11 (a) above; \n \n(d) \nTo address reminders to States where such violations have occurred if \nreports pursuant to paragraph 11 (a) above or follow-up reports pursuant to \nparagraph 11 (b) above have not been made within a reasonable period of time; \n \n13. \nAlso requests the Secretary-General to invite States, in the circular note \nreferred to in paragraph 12 (a) above, to inform him of their views with respect to any \nmeasures needed or already taken to enhance the protection, security and safety of \ndiplomatic and consular missions and representatives as well as missions and \nrepresentatives with diplomatic status to international intergovernmental organizations; \n \n14. Further requests the Secretary-General to submit to the General Assembly \nat its seventy-seventh session a report containing: \n \n(a) \nInformation on the state of ratification of and accessions to the instruments \nreferred to in paragraph 9 above; \n \n(b) \nA summary of the reports received and views expressed pursuant to \nparagraphs 11 and 13 above; \n \n15. Invites the Secretary-General to include in his report to the General \nAssembly any views he may wish to express on the matters referred to in paragraph 14 \nabove; \n \n16. Decides to include in the provisional agenda of its seventy-seventh session \nthe item entitled \u201cConsideration of effective measures to enhance the protection, \nsecurity and safety of diplomatic and consular missions and representatives\u201d. \n \n45th plenary meeting \n15 December 2020 \n \n \n",
  "paragraphs": {
    "1": "Welcomes the report of the Secretary-General;",
    "2": "Strongly condemns all acts of violence against diplomatic and consular missions and representatives, as well as against missions and representatives to international intergovernmental organizations and officials of such organizations, and emphasizes that such acts can never be justified;",
    "3": " protection, security and safety of the missions, representatives and officials mentioned in paragraph 2 above officially present in territories under their jurisdiction, including practical measures to prevent and prohibit in their territories illegal activities of persons, groups and organizations that encourage, instigate, organize or engage in the perpetration of acts against the security and safety of such missions, representatives and officials;",
    "4": "Also urges States to take all appropriate measures at the national and international levels to prevent any acts of violence against the missions, representatives and officials mentioned in paragraph 2 above, including during a period of armed conflict, and to ensure, with the participation of the United Nations where appropriate, that such acts are fully investigated with a view to bringing offenders to justice;",
    "5": "Recommends that States cooperate closely through, inter alia, contacts between the diplomatic and consular missions and the receiving State with regard to practical measures designed to enhance the protection, security and safety of diplomatic and consular missions and representatives, including measures of a preventive nature, and with regard to the timely exchange of information on the circumstances of all serious violations thereof;",
    "6": "Urges States to strictly comply with the applicable rules of international law governing the protection and inviolability of premises of diplomatic missions, consular premises and premises of permanent missions with diplomatic status to international intergovernmental organizations;",
    "7": "Also urges States to take all appropriate measures, in accordance with international law, at the national and international levels, to prevent any abuse of diplomatic or consular privileges and immunities, in particular serious abuses, including those involving acts of violence;",
    "8": "Recommends that States cooperate closely with the State in whose territory abuses of diplomatic and consular privileges and immunities may have occurred, including by exchanging information and providing assistance to its juridical authorities in order to bring offenders to justice;",
    "9": "Calls upon States that have not yet done so to consider becoming parties to the instruments relevant to the protection, security and safety of diplomatic and consular missions and representatives;",
    "10": "Calls upon States, in cases where a dispute arises in connection with a violation of their international obligations concerning the protection of the missions, their archives and premises or the security of the representatives and officials mentioned in paragraph 2 above, to make use of the means available for peaceful settlement of disputes, including the good offices of the Secretary-General, and requests the Secretary-General, when he deems it appropriate, to offer his good offices to the States directly concerned;",
    "11": "Urges: (a) All States to report to the Secretary-General, in a concise and expeditious manner and in accordance with the guidelines prepared by the Secretary-General,2 serious violations of the protection, security and safety of diplomatic and consular missions and representatives as well as missions and representatives with diplomatic status to international intergovernmental organizations; (b) The State in which the violation took place \u2013 and, to the extent possible, the State where the alleged offender is present \u2013 to report to the Secretary-General, in a concise and expeditious manner and in accordance with the guidelines prepared by the Secretary-General, on measures taken to bring the offender to justice and to communicate, in accordance with its laws, the final outcome of the proceedings against the offender, and to report on measures adopted with a view to preventing a repetition of such violations;",
    "12": "Requests the Secretary-General: (a) To send, without delay, a circular note to all States reminding them of the request contained in paragraph 11 above; (b) To circulate to all States, upon receipt, the reports received by him pursuant to paragraph 11 above, unless the reporting State requests otherwise; (c) To draw the attention, when appropriate, of the States directly concerned to the reporting procedures provided for in paragraph 11 above, when a serious violation has been reported pursuant to paragraph 11 (a) above; (d) To address reminders to States where such violations have occurred if reports pursuant to paragraph 11 (a) above or follow-up reports pursuant to paragraph 11 (b) above have not been made within a reasonable period of time;",
    "13": "Also requests the Secretary-General to invite States, in the circular note referred to in paragraph 12 (a) above, to inform him of their views with respect to any measures needed or already taken to enhance the protection, security and safety of diplomatic and consular missions and representatives as well as missions and representatives with diplomatic status to international intergovernmental organizations;",
    "14": "Further requests the Secretary-General to submit to the General Assembly at its seventy-seventh session a report containing: (a) Information on the state of ratification of and accessions to the instruments referred to in paragraph 9 above; (b) A summary of the reports received and views expressed pursuant to paragraphs 11 and 13 above;",
    "15": "Invites the Secretary-General to include in his report to the General Assembly any views he may wish to express on the matters referred to in paragraph 14 above;",
    "16": "Decides to include in the provisional agenda of its seventy-seventh session the item entitled \u201cConsideration of effective measures to enhance the protection, security and safety of diplomatic and consular missions and representatives\u201d."
  },
  "agenda_items": [
    "Item 84"
  ],
  "symbol_references": []
}