{
  "symbol": "A/RES/72/126",
  "filename": "A_RES_72_126.pdf",
  "title": "72/126. Observer status for the ASEAN+3 Macroeconomic Research Office in the General Assembly",
  "text": "United Nations \nA/RES/72/126\n \n \nGeneral Assembly \nDistr.: General \n18 December 2017 \n \n17-22171 (E)    201217  \n*1722171* \n \n \nSeventy-second session \nAgenda item 171 \n \n \n \n \n Resolution adopted by the General Assembly \non 7 December 2017 \n \n \n \n \n[on the report of the Sixth Committee (A/72/474)] \n \n \n 72/126. Observer status for the ASEAN+3 Macroeconomic Research Office \nin the General Assembly \n \n \n \nThe General Assembly, \n \nWishing to promote cooperation between the United Nations and the ASEAN+3 \nMacroeconomic Research Office, \n \n1. \nDecides to invite the ASEAN+3 Macroeconomic Research Office to \nparticipate in the sessions and the work of the General Assembly in the capacity of \nobserver; \n \n2. \nRequests the Secretary-General to take the action necessary to implement \nthe present resolution. \n \n67th plenary meeting  \n7 December 2017 \n \n",
  "paragraphs": {
    "1": "Decides to invite the ASEAN+3 Macroeconomic Research Office to participate in the sessions and the work of the General Assembly in the capacity of observer;",
    "2": "Requests the Secretary-General to take the action necessary to implement the present resolution. 67th plenary meeting 7 December 2017"
  },
  "agenda_items": [
    "Item 171"
  ],
  "symbol_references": []
}