{
  "symbol": "A/RES/74/27",
  "filename": "A_RES_74_27.pdf",
  "title": "74/27. Treaty for the Prohibition of Nuclear Weapons in Latin America and the Caribbean (Treaty of Tlatelolco)",
  "text": "United Nations \nA/RES/74/27\n \n \nGeneral Assembly \nDistr.: General \n18 December 2019 \n \n19-21681 (E)    231219 \n*1921681* \n \n \nSeventy-fourth session \nAgenda item 92 \nTreaty for the Prohibition of Nuclear Weapons in Latin \nAmerica and the Caribbean (Treaty of Tlatelolco) \n \n \n \n \n Resolution adopted by the General Assembly \non 12 December 2019 \n \n \n \n \n[on the report of the First Committee (A/74/451)] \n \n \n \n74/27. Treaty for the Prohibition of Nuclear Weapons in Latin America \nand the Caribbean (Treaty of Tlatelolco) \n \n \n \nThe General Assembly,  \n \nRecalling that the Treaty for the Prohibition of Nuclear Weapons in Latin \nAmerica and the Caribbean (Treaty of Tlatelolco) 1  was opened for signature in \nMexico City on 14 February 1967, \n \nRecalling also that, in its resolution 2286 (XXII) of 5 December 1967, it \nwelcomed with special satisfaction the Treaty of Tlatelolco as an event of historic \nsignificance in the efforts to prevent the proliferation of nuclear weapons and to \npromote international peace and security, \n \nRecalling further that, in its preamble, the Treaty of Tlatelolco states that \nmilitarily denuclearized zones are not an end in themselves but rather a means for \nachieving general and complete disarmament at a later stage, \n \nRecalling that, in its preamble, the Treaty of Tlatelolco notes that the \nestablishment of militarily denuclearized zones is closely linked with the maintenance \nof peace and security in the respective regions and that the military denuclearization \nof vast geographical zones, adopted by the sovereign decision of the States comprised \ntherein, will exercise a beneficial influence on other regions where similar conditions \nexist,  \n \nConsidering that, 52 years following its adoption, the Treaty of Tlatelolco \nremains a living instrument and a source of inspiration for the creation of other \nnuclear-weapon-free zones,  \n__________________ \n \n1  United Nations, Treaty Series, vol. 634, No. 9068. \n\nA/RES/74/27 \nTreaty for the Prohibition of Nuclear Weapons in Latin America \nand the Caribbean (Treaty of Tlatelolco)\n \n19-21681\n2/3 \n \n \nTaking note of the proclamation of Latin America and the Caribbean as a zone \nof peace by the Community of Latin American and Caribbean States at its second \nsummit, held in Havana on 28 and 29 January 2014, and the commitment undertaken \nin this context by the States of the region to continue to promote nuclear disarmament \nas a priority objective,2 \n \nHighlighting the fact that the Treaty of Tlatelolco, which is in force for all \n33 sovereign States of the region, consolidated the first nuclear-weapon-free zone \nestablished in a densely populated region, \n \nRecognizing the important contribution of the treaties of Tlatelolco, Rarotonga,3 \nBangkok4 and Pelindaba5 and the Treaty on a Nuclear-Weapon-Free Zone in Central \nAsia, as well as the Antarctic Treaty6 and the declaration by Mongolia of its nuclear-\nweapon-free status, to the achievement of nuclear non-proliferation and nuclear \ndisarmament, \n \nRecalling all relevant United Nations resolutions in support of nuclear-weapon-\nfree zones, \n \nHighlighting the value of enhancing cooperation among the nuclear-weapon-\nfree zones, including through the holding of joint meetings of States parties, \nsignatories and observers to the treaties establishing such zones, \n \nWelcoming the convening of Conferences of States Parties and Signatories to \nTreaties that Establish Nuclear-Weapon-Free Zones and Mongolia and their \ncontribution to achieving and maintaining a nuclear-weapon-free world, \n \nNoting with satisfaction the adoption of its resolution 73/71 of 5 December 2018, \nin which it decided to convene the fourth Conference of Nuclear-Weapon-Free-Zones \nand Mongolia as a one-day conference at United Nations Headquarters in New York \non 24 April 2020, and welcoming the offer by Mongolia to act as coordinator of the \nfourth Conference and to conduct preparatory meetings and informal consultations,  \n \nNoting that the 2010 Review Conference of the Parties to the Treaty on the \nNon-Proliferation of Nuclear Weapons, in its final document, 7  encouraged the \nestablishment of new nuclear-weapon-free zones on the basis of arrangements freely \narrived at among States of the region concerned and the fostering of cooperation and \nenhanced consultation mechanisms among the existing nuclear-weapon-free zones \nthrough the establishment of concrete measures, in order to fully implement the \nprinciples and objectives of the relevant nuclear-weapon-free zone treaties, and \ncommended the Agency for the Prohibition of Nuclear Weapons in Latin America and \nthe Caribbean for its leadership in this field, \n \nReaffirming the importance of the Agency as the appropriate legal and political \nforum for ensuring full compliance with and implementation of the Treaty of \nTlatelolco, as well as cooperation with the entities of other nuclear-weapon-free zones, \n \n1. \nWelcomes the fact that the Treaty for the Prohibition of Nuclear Weapons \nin Latin America and the Caribbean (Treaty of Tlatelolco)1 is in force for all sovereign \nStates of the region; \n__________________ \n \n2  See A/68/914, annex. \n \n3  The United Nations Disarmament Yearbook, vol. 10: 1985 (United Nations publication, Sales \nNo. E.86.IX.7), appendix VII. \n \n4  United Nations, Treaty Series, vol. 1981, No. 33873. \n \n5  A/50/426, annex. \n \n6  United Nations, Treaty Series, vol. 402, No. 5778. \n \n7  2010 Review Conference of the Parties to the Treaty on the Non-Proliferation of Nuclear \nWeapons, Final Document, vols. I\u2013III (NPT/CONF.2010/50 (Vol. I), NPT/CONF.2010/50 \n(Vol. II) and NPT/CONF.2010/50 (Vol. III)). \n\nTreaty for the Prohibition of Nuclear Weapons in Latin America \nand the Caribbean (Treaty of Tlatelolco) \nA/RES/74/27\n \n3/3\n19-21681 \n \n \n2. \nNotes with satisfaction that the year 2019 marks the fiftieth anniversary of \nthe entry into force, on 25 April 1969, of the Treaty of Tlatelolco and of the \nestablishment of the Agency for the Prohibition of Nuclear Weapons in Latin America \nand the Caribbean, which will be commemorated during the twenty-sixth session of \nthe General Conference of the Agency; \n \n3. \nEncourages once again States parties to Additional Protocols I and II to \nthe Treaty of Tlatelolco1 to review their interpretative declarations thereto, in \naccordance with action 9 of the Final Document of the 2010 Review Conference of \nthe Parties to the Treaty on the Non-Proliferation of Nuclear Weapons,8 reaffirming \nand recognizing the legitimate interests of the States that comprise the nuclear-\nweapon-free zone in Latin America and the Caribbean in receiving full and \nunequivocal security assurances from the nuclear-weapon States; \n \n4. \nEncourages the States members of the Agency for the Prohibition of \nNuclear Weapons in Latin America and the Caribbean to continue the activities and \nefforts that they conduct jointly with the Agency, inter alia: \n \n(a) \nTo support the efforts that are being undertaken in a multilateral context \nto identify and seek effective measures that favour compliance with disarmament and \nnon-proliferation commitments;  \n \n(b) \nTo enhance cooperation with States parties and signatories to treaties that \nestablish nuclear-weapon-free zones and Mongolia;  \n \n(c) \nTo promote activities on nuclear disarmament and non-proliferation \neducation; \n \n5. \nDecides to include in the provisional agenda of its seventy-seventh session \nthe item entitled \u201cTreaty for the Prohibition of Nuclear Weapons in Latin America \nand the Caribbean (Treaty of Tlatelolco)\u201d. \n \n46th plenary meeting \n12 December 2019 \n \n__________________ \n \n8  Ibid., vol. I (NPT/CONF.2010/50 (Vol. I)), part I, Conclusions and recommendations for \nfollow-on actions, section I, entitled \u201cNuclear disarmament\u201d. \n",
  "paragraphs": {
    "1": "Welcomes the fact that the Treaty for the Prohibition of Nuclear Weapons in Latin America and the Caribbean (Treaty of Tlatelolco)1 is in force for all sovereign States of the region;",
    "2": "Notes with satisfaction that the year 2019 marks the fiftieth anniversary of the entry into force, on 25 April 1969, of the Treaty of Tlatelolco and of the establishment of the Agency for the Prohibition of Nuclear Weapons in Latin America and the Caribbean, which will be commemorated during the twenty-sixth session of the General Conference of the Agency;",
    "3": "Encourages once again States parties to Additional Protocols I and II to the Treaty of Tlatelolco1 to review their interpretative declarations thereto, in accordance with action 9 of the Final Document of the 2010 Review Conference of the Parties to the Treaty on the Non-Proliferation of Nuclear Weapons,8 reaffirming and recognizing the legitimate interests of the States that comprise the nuclear- weapon-free zone in Latin America and the Caribbean in receiving full and unequivocal security assurances from the nuclear-weapon States;",
    "4": "Encourages the States members of the Agency for the Prohibition of Nuclear Weapons in Latin America and the Caribbean to continue the activities and efforts that they conduct jointly with the Agency, inter alia: (a) To support the efforts that are being undertaken in a multilateral context to identify and seek effective measures that favour compliance with disarmament and non-proliferation commitments; (b) To enhance cooperation with States parties and signatories to treaties that establish nuclear-weapon-free zones and Mongolia; (c) To promote activities on nuclear disarmament and non-proliferation education;",
    "5": "Decides to include in the provisional agenda of its seventy-seventh session the item entitled \u201cTreaty for the Prohibition of Nuclear Weapons in Latin America and the Caribbean (Treaty of Tlatelolco)\u201d."
  },
  "agenda_items": [
    "Item 92"
  ],
  "symbol_references": []
}