{
  "symbol": "A/RES/79/288",
  "filename": "A_RES_79_288.pdf",
  "title": "79/288. Scope, modalities, format and organization of the high-level meeting on the thirtieth anniversary of the Fourth World Conference on Women",
  "text": "United Nations \nA/RES/79/288\n \nGeneral Assembly \nDistr.: General \n8 May 2025 \n25-07308 (E) \n*2507308* \n \n \nSeventy-ninth session \nAgenda item 27 \nAdvancement of women \n \n \n \n \n Resolution adopted by the General Assembly \non 7 May 2025 \n \n \n[without reference to a Main Committee (A/79/L.81)] \n \n \n 79/288. Scope, modalities, format and organization of the high-level \nmeeting on the thirtieth anniversary of the Fourth World \nConference on Women \n \n \n \nThe General Assembly, \n \nRecognizing the significance of the Fourth World Conference on Women, held \nin Beijing in September 1995, \n \nReaffirming the Beijing Declaration and Platform for Action adopted in 1995 at \nthe Fourth World Conference on Women1 and the outcome documents of its twenty-\nthird special session,2 \n \nRecalling its resolution 78/182 of 19 December 2023 on the follow-up to the \nFourth World Conference on Women and full implementation of the Beijing \nDeclaration and Platform for Action and the outcome of the twenty-third special \nsession of the General Assembly, in which it decided to convene a one-day high-level \nmeeting of the General Assembly in the margins of the general debate at its eightieth \nsession in order to celebrate the thirtieth anniversary of the Fourth World Conference \non Women, so as to accelerate the realization of gender equality and the empowerment \nof all women and girls,  \n \nRecognizing that, through the adoption of the 2030 Agenda for Sustainable \nDevelopment3 and its Sustainable Development Goals in September 2015, Heads of \nState and Government confirmed that realizing gender equality and the empowerment \n_______________ \n \n1 Report of the Fourth World Conference on Women, Beijing, 4\u201315 September 1995 (United \nNations publication, Sales No. E.96.IV.13), chap. I, resolution 1, annexes I and II. \n \n2 Resolution S-23/2, annex, and resolution S-23/3, annex. \n \n3 Resolution 70/1. \n\nA/RES/79/288 \nScope, modalities, format and organization of the high-level \nmeeting on the thirtieth anniversary of the Fourth World \nConference on Women\n \n25-07308\n2/4 \n \nof women and girls would make a crucial contribution to progress across all the Goals \nand targets, which was reaffirmed in the Pact for the Future in 2024, 4 \n \nReiterating that the full, effective and accelerated implementation of the Beijing \nDeclaration and Platform for Action and the outcome of the twenty-third special \nsession is essential to achieving gender equality and the empowerment of all women \nand girls and the Sustainable Development Goals, \n \n1. \nDecides that the one-day high-level meeting of the General Assembly on \nthe thirtieth anniversary of the Fourth World Conference on Women shall be held in \nNew York on Monday, 22 September 2025, during the eightieth session of the General \nAssembly, from 10 a.m. to 8 p.m., and consist of an opening segment, a plenary \nsegment for general discussion and a closing segment;  \n \n2. \nAlso decides that the theme of the high-level meeting of the General \nAssembly will be \u201cRecommitting to, resourcing and accelerating the implementation \nof the Beijing Declaration and Platform for Action to achieve gender equality and the \nempowerment of all women and girls\u201d and that this meeting will highlight \nachievements, best practices, gaps and challenges; \n \n3. \nFurther decides that: \n \n(a) \nThe opening segment, to be held from 10 to 10.45 a.m., will feature \nstatements by the President of the General Assembly at its eightieth session, the \nSecretary-General, a representative of China as the host country of the Fourth World \nConference on Women, the Under-Secretary-General/Executive Director of the United \nNations Entity for Gender Equality and the Empowerment of Women (UN-Women), the \nExecutive Director of the United Nations Population Fund, the Chair of the \nCommittee on the Elimination of Discrimination against Women, the Chair of the \nWorking Group on discrimination against women and girls, the Special Rapporteur \non violence against women and girls, its causes and consequences, as well as an \neminent high-level champion of gender equality, a representative from civil society \nand a young woman leader, to be selected, in consultation with Member States, by the \nPresident of the General Assembly;  \n \n(b) \nThe plenary segment, to be held from 10.45 a.m. to 7.45 p.m., without \ninterruption, will comprise statements by all States Members of the United Nations, \nall members of the specialized agencies that have observer status with the General \nAssembly, and intergovernmental organizations and entities that have observer status \nwith the General Assembly; a list of speakers will be established in accordance with \nestablished practices of the General Assembly and the time limits for these statements \nwill be three minutes for individual delegations and five minutes for statements made \non behalf of a group of States;  \n \n(c) \nThe closing segment, to be held from 7.45 to 8 p.m., will comprise \nconcluding remarks by the President of the General Assembly; \n \n4. \nRequests the President of the General Assembly, with the support of \nUN\u2011Women, to organize and preside over an interactive multi-stakeholder hearing on \nthe occasion of the thirtieth anniversary of the Beijing Declaration and Platform for \nAction following the high-level political forum on sustainable development in July \n2025, with the active participation of representatives of States Members of the United \nNations and members of the specialized agencies that have observer status with the \nGeneral Assembly, intergovernmental organizations and entities that have observer \nstatus with the General Assembly, and parliamentarians, representatives of \nnon\u2011governmental organizations in consultative status with the Economic and Social \n_______________ \n \n4 See resolution 79/1. \n\nScope, modalities, format and organization of the high-level \nmeeting on the thirtieth anniversary of the Fourth World \nConference on Women \nA/RES/79/288\n \n3/4\n25-07308 \n \nCouncil, invited civil society organizations, national human rights institutions where \nthey exist, academic institutions and the private sector, ensuring the participation and \nvoices of women and girls as part of the preparations for the high-level meeting of \nthe General Assembly, to take stock of the outcomes and recommendations of other \nUnited Nations intergovernmental processes, including the sixty-ninth session of the \nCommission on the Status of Women and relevant initiatives, and also requests the \nPresident of the General Assembly to prepare a summary of the interactive \nmulti\u2011stakeholder hearing prior to the high-level meeting of the General Assembly; \n \n5. \nInvites non\u2011governmental organizations in consultative status with the \nEconomic and Social Council with relevant expertise to register with the Secretariat \nto attend the high-level meeting of the General Assembly and to participate in the \ninteractive multi-stakeholder hearing;  \n \n6. \nRequests the President of the General Assembly to draw up a list of \nrepresentatives of other relevant non\u2011governmental organizations, civil society \norganizations, academic institutions and the private sector who may participate in the \nhigh-level meeting, taking into account the principles of transparency and equitable \ngeographical representation, with due regard for gender parity, to submit the proposed \nlist to Member States for their consideration on a non\u2011objection basis 5 and in any case, \nno later than July 2025 for the preparatory process, and to bring the list to the attention \nof the General Assembly for a final decision by the Assembly on participation in the \nhigh-level meeting; \n \n7. \nInvites members of civil society, non\u2011governmental organizations, the \nprivate sector, academia, development partners, youth and other relevant initiatives \nto make a fundamental contribution to the process in terms of raising awareness of \ngaps and challenges and identifying concrete actions to accelerate the realization of \ngender equality and the empowerment of all women and girls and its contribution \ntowards the achievement of the Sustainable Development Goals; \n \n8. \nEncourages all Member States, members of the United Nations specialized \nagencies and observers of the General Assembly to be represented at the highest \npossible level and to consider including in their national delegations heads of national \nmechanisms for gender equality and the empowerment of all women and girls, as \nappropriate, as well as representatives such as parliamentarians, representatives of \ncivil society, youth and other relevant stakeholders; \n \n9. \nInvites the Inter-Parliamentary Union to contribute to the high-level \nmeeting of the General Assembly;  \n \n10. Invites the United Nations system, including funds, programmes and \nspecialized agencies, regional commissions and relevant envoys of the Secretary-\nGeneral, to participate in the high-level meeting of the General Assembly, as \nappropriate, and urges them to consider initiatives in support of the high-level meeting \nof the General Assembly and the preparations for the meeting, particularly with regard \nto sharing good practices, challenges, lessons learned and urgent actions that need to \nbe taken for the realization of gender equality and the empowerment of all women \nand girls; \n \n11. \nDecides that the proceedings of the high-level meeting of the General \nAssembly shall be webcast; and encourages the Secretary-General, the President of \nthe General Assembly and UN-Women to give the highest visibility to this meeting \n_______________ \n \n5 The list will include proposed as well as final names. The general basis of any objections, if \nrequested by one or more States Members of the United Nations or States members of the \nspecialized agencies, will be made known to the Office of the President of the General Assembly \nand the requester. \n\nA/RES/79/288 \nScope, modalities, format and organization of the high-level \nmeeting on the thirtieth anniversary of the Fourth World \nConference on Women\n \n25-07308\n4/4 \n \nand its summary, as well as to the interactive multi-stakeholder hearing, through all \nrelevant media platforms and information and communications technologies; \n \n12. Requests the President of the General Assembly to prepare a summary of \nthe high-level meeting of the General Assembly and to bring the summary to the \nattention of Member States, relevant United Nations entities and other relevant \nstakeholders. \n \n69th plenary meeting \n7 May 2025 \n \n",
  "paragraphs": {
    "1": "Decides that the one-day high-level meeting of the General Assembly on the thirtieth anniversary of the Fourth World Conference on Women shall be held in New York on Monday, 22 September 2025, during the eightieth session of the General Assembly, from 10 a.m. to 8 p.m., and consist of an opening segment, a plenary segment for general discussion and a closing segment;",
    "2": "Also decides that the theme of the high-level meeting of the General Assembly will be \u201cRecommitting to, resourcing and accelerating the implementation of the Beijing Declaration and Platform for Action to achieve gender equality and the empowerment of all women and girls\u201d and that this meeting will highlight achievements, best practices, gaps and challenges;",
    "3": "Further decides that: (a) The opening segment, to be held from 10 to 10.45 a.m., will feature statements by the President of the General Assembly at its eightieth session, the Secretary-General, a representative of China as the host country of the Fourth World Conference on Women, the Under-Secretary-General/Executive Director of the United Nations Entity for Gender Equality and the Empowerment of Women (UN-Women), the Executive Director of the United Nations Population Fund, the Chair of the Committee on the Elimination of Discrimination against Women, the Chair of the Working Group on discrimination against women and girls, the Special Rapporteur on violence against women and girls, its causes and consequences, as well as an eminent high-level champion of gender equality, a representative from civil society and a young woman leader, to be selected, in consultation with Member States, by the President of the General Assembly; (b) The plenary segment, to be held from 10.45 a.m. to 7.45 p.m., without interruption, will comprise statements by all States Members of the United Nations, all members of the specialized agencies that have observer status with the General Assembly, and intergovernmental organizations and entities that have observer status with the General Assembly; a list of speakers will be established in accordance with established practices of the General Assembly and the time limits for these statements will be three minutes for individual delegations and five minutes for statements made on behalf of a group of States; (c) The closing segment, to be held from 7.45 to 8 p.m., will comprise concluding remarks by the President of the General Assembly;",
    "4": "Requests the President of the General Assembly, with the support of UN\u2011Women, to organize and preside over an interactive multi-stakeholder hearing on the occasion of the thirtieth anniversary of the Beijing Declaration and Platform for Action following the high-level political forum on sustainable development in July 2025, with the active participation of representatives of States Members of the United Nations and members of the specialized agencies that have observer status with the General Assembly, intergovernmental organizations and entities that have observer status with the General Assembly, and parliamentarians, representatives of non\u2011governmental organizations in consultative status with the Economic and Social _______________ 4 See resolution 79/1. Scope, modalities, format and organization of the high-level meeting on the thirtieth anniversary of the Fourth World Conference on Women A/RES/79/288 3/4 25-07308 Council, invited civil society organizations, national human rights institutions where they exist, academic institutions and the private sector, ensuring the participation and voices of women and girls as part of the preparations for the high-level meeting of the General Assembly, to take stock of the outcomes and recommendations of other United Nations intergovernmental processes, including the sixty-ninth session of the Commission on the Status of Women and relevant initiatives, and also requests the President of the General Assembly to prepare a summary of the interactive multi\u2011stakeholder hearing prior to the high-level meeting of the General Assembly;",
    "5": "Invites non\u2011governmental organizations in consultative status with the Economic and Social Council with relevant expertise to register with the Secretariat to attend the high-level meeting of the General Assembly and to participate in the interactive multi-stakeholder hearing;",
    "6": "Requests the President of the General Assembly to draw up a list of representatives of other relevant non\u2011governmental organizations, civil society organizations, academic institutions and the private sector who may participate in the high-level meeting, taking into account the principles of transparency and equitable geographical representation, with due regard for gender parity, to submit the proposed list to Member States for their consideration on a non\u2011objection basis 5 and in any case, no later than July 2025 for the preparatory process, and to bring the list to the attention of the General Assembly for a final decision by the Assembly on participation in the high-level meeting;",
    "7": "Invites members of civil society, non\u2011governmental organizations, the private sector, academia, development partners, youth and other relevant initiatives to make a fundamental contribution to the process in terms of raising awareness of gaps and challenges and identifying concrete actions to accelerate the realization of gender equality and the empowerment of all women and girls and its contribution towards the achievement of the Sustainable Development Goals;",
    "8": "Encourages all Member States, members of the United Nations specialized agencies and observers of the General Assembly to be represented at the highest possible level and to consider including in their national delegations heads of national mechanisms for gender equality and the empowerment of all women and girls, as appropriate, as well as representatives such as parliamentarians, representatives of civil society, youth and other relevant stakeholders;",
    "9": "Invites the Inter-Parliamentary Union to contribute to the high-level meeting of the General Assembly;",
    "10": "Invites the United Nations system, including funds, programmes and specialized agencies, regional commissions and relevant envoys of the Secretary- General, to participate in the high-level meeting of the General Assembly, as appropriate, and urges them to consider initiatives in support of the high-level meeting of the General Assembly and the preparations for the meeting, particularly with regard to sharing good practices, challenges, lessons learned and urgent actions that need to be taken for the realization of gender equality and the empowerment of all women and girls;",
    "11": "Decides that the proceedings of the high-level meeting of the General Assembly shall be webcast; and encourages the Secretary-General, the President of the General Assembly and UN-Women to give the highest visibility to this meeting _______________ 5 The list will include proposed as well as final names. The general basis of any objections, if requested by one or more States Members of the United Nations or States members of the specialized agencies, will be made known to the Office of the President of the General Assembly and the requester. A/RES/79/288 Scope, modalities, format and organization of the high-level meeting on the thirtieth anniversary of the Fourth World Conference on Women 25-07308 4/4 and its summary, as well as to the interactive multi-stakeholder hearing, through all relevant media platforms and information and communications technologies;",
    "12": "Requests the President of the General Assembly to prepare a summary of the high-level meeting of the General Assembly and to bring the summary to the attention of Member States, relevant United Nations entities and other relevant stakeholders. 69th plenary meeting 7 May 2025"
  },
  "agenda_items": [
    "Item 27"
  ],
  "symbol_references": [
    "A/79/L.81"
  ]
}