{
  "symbol": "A/RES/77/23",
  "filename": "A_RES_77_23.pdf",
  "title": "77/23. Division for Palestinian Rights of the Secretariat",
  "text": "United Nations \nA/RES/77/23\n \n \nGeneral Assembly \nDistr.: General \n5 December 2022 \n \n22-27264 (E)    081222     \n*2227264* \n \n \nSeventy-seventh session \nAgenda item 33 \nQuestion of Palestine \n \n \n \n \n Resolution adopted by the General Assembly \non 30 November 2022 \n \n \n \n \n[without reference to a Main Committee (A/77/L.24)] \n \n \n \n77/23. Division for Palestinian Rights of the Secretariat \n \n \n \nThe General Assembly,  \n \nHaving considered the report of the Committee on the Exercise of the \nInalienable Rights of the Palestinian People,1 \n \nTaking note, in particular, of the action taken by the Committee and the Division \nfor Palestinian Rights of the Secretariat in accordance with their mandates, \n \nRecalling its resolution 32/40 B of 2 December 1977 and all its subsequent \nrelevant resolutions, including its resolution 75/21 of 2 December 2020, \n \n1. \nNotes with appreciation the action taken by the Secretary-General in \ncompliance with its resolution 75/21; \n \n2. \nConsiders that, by providing substantive support to the Committee on the \nExercise of the Inalienable Rights of the Palestinian People in the implementation of \nits mandate, the Division for Palestinian Rights of the Secretariat continues to make \na constructive and positive contribution to raising international awareness of the \nquestion of Palestine and of the urgency of a peaceful settlement of the question of \nPalestine in all its aspects on the basis of international law and United Nations \nresolutions and the efforts being exerted in this regard and to generating international \nsupport for the rights of the Palestinian people and the achievement without delay of \nan end to the Israeli occupation that began in 1967 and of the two-State solution on \nthe basis of the pre-1967 borders, with an independent, sovereign and viable State of \nPalestine, living side by side, in peace and security, with Israel; \n \n3. \nRequests the Secretary-General to continue to provide the Division with \nthe necessary resources and to ensure that it continues to effectively carry out its \n__________________ \n \n1  Official Records of the General Assembly, Seventy-seventh Session, Supplement No. 35 \n(A/77/35). \n\nA/RES/77/23 \nDivision for Palestinian Rights of the Secretariat\n \n22-27264\n2/2 \n \nprogramme of work as detailed in relevant earlier resolutions, in consultation with \nthe Committee and under its guidance; \n \n4. \nRequests the Division, in particular, to continue to monitor developments \nrelevant to the question of Palestine, to organize international meetings and activities \nin support of the Committee\u2019s mandate with the participation of all sectors of the \ninternational community and to ensure, within existing resources, the continued \nparticipation of eminent persons and international renowned experts in these meetings \nand activities, to be invited on a par with the members of the Committee, to liaise and \ncooperate with civil society and parliamentarians, including through the Working \nGroup of the Committee, to develop and expand the \u201cQuestion of Palestine\u201d website \nand the documents collection of the United Nations Information System on the \nQuestion of Palestine, to prepare and widely disseminate publications and \ninformation materials on various aspects of the question of Palestine in the relevant \nofficial languages of the United Nations and information materials on various aspects \nof the question of Palestine and to develop and enhance the annual training \nprogramme for staff of the Palestinian Government in contribution to Palestinian \ncapacity-building efforts; \n \n5. \nAlso requests the Division, as part of the observance of the International \nDay of Solidarity with the Palestinian People on 29 November, to continue to \norganize, under the guidance of the Committee, an annual exhibit on Palestinian rights \nor a cultural event in cooperation with the Permanent Observer Mission of the State \nof Palestine to the United Nations, and encourages Member States to continue to give \nthe widest support and publicity to the observance of the Day of Solidarity; \n \n6. \nFurther requests the Division to dedicate its activities in 2023 to the \ncommemoration of the seventy-fifth anniversary of the Nakba, including by \norganizing a high-level event at the General Assembly Hall on 15 May 2023 and \nthrough the dissemination of relevant archives and testimonies;  \n \n7. \nRequests the Secretary-General to ensure the continued cooperation with \nthe Division of the United Nations system entities with programme components \naddressing various aspects of the question of Palestine and the situation in the \nOccupied Palestinian Territory, including East Jerusalem; \n \n8. \nInvites all Governments and organizations to extend their cooperation to \nthe Division in the performance of its tasks. \n \n42nd plenary meeting \n30 November 2022 \n \n",
  "paragraphs": {
    "1": "Notes with appreciation the action taken by the Secretary-General in compliance with its resolution 75/21;",
    "2": "Considers that, by providing substantive support to the Committee on the Exercise of the Inalienable Rights of the Palestinian People in the implementation of its mandate, the Division for Palestinian Rights of the Secretariat continues to make a constructive and positive contribution to raising international awareness of the question of Palestine and of the urgency of a peaceful settlement of the question of Palestine in all its aspects on the basis of international law and United Nations resolutions and the efforts being exerted in this regard and to generating international support for the rights of the Palestinian people and the achievement without delay of an end to the Israeli occupation that began in 1967 and of the two-State solution on the basis of the pre-1967 borders, with an independent, sovereign and viable State of Palestine, living side by side, in peace and security, with Israel;",
    "3": "Requests the Secretary-General to continue to provide the Division with the necessary resources and to ensure that it continues to effectively carry out its programme of work as detailed in relevant earlier resolutions, in consultation with the Committee and under its guidance;",
    "4": "Requests the Division, in particular, to continue to monitor developments relevant to the question of Palestine, to organize international meetings and activities in support of the Committee\u2019s mandate with the participation of all sectors of the international community and to ensure, within existing resources, the continued participation of eminent persons and international renowned experts in these meetings and activities, to be invited on a par with the members of the Committee, to liaise and cooperate with civil society and parliamentarians, including through the Working Group of the Committee, to develop and expand the \u201cQuestion of Palestine\u201d website and the documents collection of the United Nations Information System on the Question of Palestine, to prepare and widely disseminate publications and information materials on various aspects of the question of Palestine in the relevant official languages of the United Nations and information materials on various aspects of the question of Palestine and to develop and enhance the annual training programme for staff of the Palestinian Government in contribution to Palestinian capacity-building efforts;",
    "5": "Also requests the Division, as part of the observance of the International Day of Solidarity with the Palestinian People on 29 November, to continue to organize, under the guidance of the Committee, an annual exhibit on Palestinian rights or a cultural event in cooperation with the Permanent Observer Mission of the State of Palestine to the United Nations, and encourages Member States to continue to give the widest support and publicity to the observance of the Day of Solidarity;",
    "6": "Further requests the Division to dedicate its activities in 2023 to the commemoration of the seventy-fifth anniversary of the Nakba, including by organizing a high-level event at the General Assembly Hall on 15 May 2023 and through the dissemination of relevant archives and testimonies;",
    "7": "Requests the Secretary-General to ensure the continued cooperation with the Division of the United Nations system entities with programme components addressing various aspects of the question of Palestine and the situation in the Occupied Palestinian Territory, including East Jerusalem;",
    "8": "Invites all Governments and organizations to extend their cooperation to the Division in the performance of its tasks."
  },
  "agenda_items": [
    "Item 33"
  ],
  "symbol_references": [
    "A/77/L.24"
  ]
}