{
  "symbol": "A/RES/78/313",
  "filename": "A_RES_78_313.pdf",
  "title": "78/313. World Conjoined Twins Day",
  "text": "United Nations \nA/RES/78/313\n \n \nGeneral Assembly \nDistr.: General \n5 July 2024 \n \n24-12317 (E)     \n*2412317* \n \n \nSeventy-eighth session \nAgenda item 125 \nGlobal health and foreign policy \n \n \n \n \n Resolution adopted by the General Assembly \non 1 July 2024 \n \n \n \n \n[without reference to a Main Committee (A/78/L.72)] \n \n \n 78/313. World Conjoined Twins Day \n \n \n \nThe General Assembly,  \n \nReaffirming its resolution 70/1 of 25 September 2015, entitled \u201cTransforming \nour world: the 2030 Agenda for Sustainable Development\u201d, in which it adopted a \nwide, far-reaching and people-centred set of universal and transformative Sustainable \nDevelopment Goals and targets, and its commitment to working tirelessly for the full \nimplementation of the Agenda by 2030,  \n \nReaffirming also its resolutions 53/199 of 15 December 1998 and 61/185 of \n20 December 2006 on the proclamation of international years, and Economic and \nSocial Council resolution 1980/67 of 25 July 1980 on international years and \nanniversaries, in particular paragraphs 1 to 10 of the annex thereto on the agreed \ncriteria for the proclamation of international years, as well as paragraphs 13 and 14, \nin which it is stated that an international day or year should not be proclaimed before \nthe basic arrangements for its organization and financing have been made,  \n \nReaffirming further the commitment to ensure healthy lives and promote well-\nbeing for all at all ages, including by strengthening health systems and achieving \nuniversal health coverage and all other health-related targets and leaving no one \nbehind,  \n \nReaffirming the right of every human being, without distinction of any kind, to \nthe enjoyment of the highest attainable standard of physical and mental health,  \n \nStressing the need to ensure that no one is left behind, with an endeavour to \nreach the furthest behind first, and address the physical and mental health needs of \nall, while respecting and promoting human rights and the dignity of the person and \nthe principles of equality and non-discrimination,  \n \nReaffirming the need to scale up efforts to build and strengthen quality, people-\ncentred, sustainable and resilient health systems, and to promote strong global \n\nA/RES/78/313 \nWorld Conjoined Twins Day\n \n24-12317\n2/2 \n \npartnerships with all relevant stakeholders to collaboratively support the efforts of \nMember States, as appropriate, to achieve universal health coverage and other health-\nrelated targets of the Sustainable Development Goals,  \n \nReaffirming also the need to strengthen regional and international cooperation, \nmultilateralism, global solidarity, coordination and health governance, towards the \nprogressive realization of the right to the enjoyment of the highest attainable standard \nof physical and mental health for all, without distinction of any kind,  \n \nRecognizing that the case of conjoined twins is a rare condition where the \nestimated incidence can be 1 in 50,000 births, and that the rate of stillbirth is high and \nis estimated to be around 60 per cent, while noting the lack of quality, timely and \nreliable data in this regard,  \n \nEmphasizing the need to address the condition of conjoined twins, by raising \nawareness of their cases at all levels and through a life-course approach, in \ncooperation with relevant United Nations agencies and other stakeholders, as well as \nby advocating for their well-being and social inclusion, while taking into account \nrelevant agreed international standards, norms and principles,  \n \n1. \nDecides to proclaim 24 November as World Conjoined Twins Day, to be \nobserved each year beginning in 2024;  \n \n2. \nInvites all Member States, relevant organizations of the United Nations \nsystem, \nother \ninternational \norganizations \nand \ncivil \nsociety, \nincluding \nnon-governmental organizations and the private sector, to observe World Conjoined \nTwins Day, in an appropriate manner, in order to raise awareness of the condition of \nconjoined twins, and to promote their human rights, as well as their well-being and \nsocial inclusion;  \n \n3. \nRequests the Secretary-General to bring the present resolution to the \nattention of all Member States and organizations of the United Nations system;  \n \n4. \nStresses that the cost of all activities that may arise from the \nimplementation of the present resolution should be met from voluntary contributions \nand that such activities would be subject to the availability and provision of voluntary \ncontributions. \n \n97th plenary meeting \n1 July 2024 \n \n \n",
  "paragraphs": {
    "1": "Decides to proclaim 24 November as World Conjoined Twins Day, to be observed each year beginning in 2024;",
    "2": "Invites all Member States, relevant organizations of the United Nations system, other international organizations and civil society, including non-governmental organizations and the private sector, to observe World Conjoined Twins Day, in an appropriate manner, in order to raise awareness of the condition of conjoined twins, and to promote their human rights, as well as their well-being and social inclusion;",
    "3": "Requests the Secretary-General to bring the present resolution to the attention of all Member States and organizations of the United Nations system;",
    "4": "Stresses that the cost of all activities that may arise from the implementation of the present resolution should be met from voluntary contributions and that such activities would be subject to the availability and provision of voluntary contributions. 97th plenary meeting 1 July 2024"
  },
  "agenda_items": [
    "Item 125"
  ],
  "symbol_references": [
    "A/78/L.72"
  ]
}