{
  "symbol": "A/RES/73/197",
  "filename": "A_RES_73_197.pdf",
  "title": "73/197. Report of the United Nations Commission on International Trade Law on the work of its fifty-first session",
  "text": "United Nations \nA/RES/73/197\n \n \nGeneral Assembly \nDistr.: General \n3 January 2019 \n \n18-22459 (E)    070119 \n*1822459* \n \n \nSeventy-third session \nAgenda item 80 \n \n \n \n \n Resolution adopted by the General Assembly \non 20 December 2018 \n \n \n \n \n[on the report of the Sixth Committee (A/73/496)] \n \n \n 73/197. Report of the United Nations Commission on International Trade \nLaw on the work of its fifty-first session  \n \n \n \nThe General Assembly, \n \nRecalling its resolution 2205 (XXI) of 17 December 1966, by which it \nestablished the United Nations Commission on International Trade Law with a \nmandate to further the progressive harmonization and unification of the law of \ninternational trade and in that respect to bear in mind the interests of all peoples, in \nparticular those of developing countries, in the extensive development of international \ntrade, \n \nReaffirming its belief that the progressive modernization and harmonization of \ninternational trade law, in reducing or removing legal obstacles to the flow of \ninternational trade, especially those affecting developing countries, would contribute \nsignificantly to universal economic cooperation among all States on a basis of \nequality, equity, common interest and respect for the rule of law, to the elimination of \ndiscrimination in international trade and, thereby, to peace, stability and the well-\nbeing of all peoples, \n \nHaving considered the report of the Commission,1  \n \nReiterating its concern that activities undertaken by other bodies in the field of \ninternational trade law without adequate coordination with the Commission might \nlead to undesirable duplication of efforts and would not be in keeping with the aim of \npromoting efficiency, consistency and coherence in the unification and harmonization \nof international trade law, \n \nReaffirming the mandate of the Commission, as the core legal body within the \nUnited Nations system in the field of international trade law, to coordinate legal \nactivities in this field, in particular to avoid duplication of efforts, including among \norganizations formulating rules of international trade, and to promote efficiency, \n__________________ \n \n1  Official Records of the General Assembly, Seventy-third Session, Supplement No. 17 (A/73/17). \n\nA/RES/73/197 \nReport of the United Nations Commission on International\nTrade Law on the work of its fifty-first session\n \n18-22459\n2/7 \n \nconsistency and coherence in the modernization and harmonization of international \ntrade law, and to continue, through its secretariat, to maintain close cooperation with \nother international organs and organizations, including regional organizations, active \nin the field of international trade law, \n \n1. \nTakes note with appreciation of the report of the United Nations \nCommission on International Trade Law;1 \n \n2. \nCommends the Commission for the finalization of the draft convention on \ninternational settlement agreements resulting from mediation; 2  \n \n3. \nAlso commends the Commission for the finalization and adoption of the \nModel Law on International Commercial Mediation and International Settlement \nAgreements Resulting from Mediation,3 the Legislative Guide on Key Principles of a \nBusiness Registry 4  and the Model Law on Recognition and Enforcement of \nInsolvency-Related Judgments and its Guide to Enactment;5  \n \n4. \nNotes with appreciation the event held to mark the sixtieth anniversary of \nthe Convention on the Recognition and Enforcement of Foreign Arbitral Awards (the \nNew York Convention of 1958),6 at which it was acknowledged that the Convention, \nwith its almost universal acceptance, brings legal certainty to business operations \nworldwide, thereby contributing to decreasing the level of risk and transactional costs \nassociated with international trade, furthering the Sustainable Development Goals7 \nand, by establishing a fundamental legal framework for the use of arbitration and its \neffectiveness, strengthens respect for binding commitments, inspires confidence in \nthe rule of law and ensures fair treatment in the resolution of disputes arising over \ncontractual rights and obligations;8  \n \n5. \nNotes with satisfaction the contributions from the Fund for International \nDevelopment of the Organization of the Petroleum Exporting Countries and from the \nEuropean Commission, which allow the operation of the repository of published \ninformation under the Rules on Transparency in Treaty-based Investor-State \nArbitration9 and that the Commission reiterated its strong and unanimous opinion that \nthe secretariat of the Commission should continue to operate the transparency \nrepository, which constitutes a central feature both of the Rules on Transparency and \nof the United Nations Convention on Transparency in Treaty-based Investor-State \nArbitration (Mauritius Convention on Transparency);10  \n \n6. \nRequests the Secretary-General to continue to operate, through the \nsecretariat of the Commission, the repository of published information in accordance \nwith article 8 of the Rules on Transparency, as a pilot project until the end of 2020, \nto be funded entirely by voluntary contributions, and to keep the General Assembly \ninformed of developments regarding the funding and budgetary situation of the \ntransparency repository based on its pilot operation; \n \n7. \nTakes note with interest of the decisions taken by the Commission as \nregards its future work and the progress made by the Commission in its work in the \nareas of micro, small and medium-sized enterprises, dispute settlement, investor-State \n__________________ \n \n2  Ibid., chap. III, sect. B, and annex I. \n \n3  Ibid., chap. III, sect. C, and annex II. \n \n4  Ibid., chap. IV, sects. B and C. \n \n5  Ibid., chap. V, sect. A, and annex III. \n \n6  United Nations, Treaty Series, vol. 330, No. 4739. \n \n7  See resolution 70/1. \n \n8  See Official Records of the General Assembly, Seventy-third Session, Supplement No. 17 \n(A/73/17), chap. X. \n \n9  Ibid., Sixty-eighth Session, Supplement No. 17 (A/68/17), annex I. \n \n10  Resolution 69/116, annex. \n\nReport of the United Nations Commission on International \nTrade Law on the work of its fifty-first session \nA/RES/73/197\n \n3/7\n18-22459 \n \ndispute settlement reform, electronic commerce, insolvency law and security interests \nand privately financed infrastructure projects,11 as well as the decisions to take up \nwork on expedited arbitration and, as its next priority, the judicial sale of ships, to \nconduct exploratory and preparatory work on warehouse receipts, to compile \ninformation on legal issues related to the digital economy aimed at enabling the \ncommercial use of new technologies and methods and assisting developing economies \nin bridging the digital gap, and to undertake exploratory work on contractual networks \nand the civil law aspects of asset tracing and recovery, 12  and encourages the \nCommission to continue to move forward efficiently to achieve tangible work \noutcomes in those areas; \n \n8. \nWelcomes the decision by the Commission to give Working Group IV a \nmore specific mandate to conduct work on legal issues in the area of identity \nmanagement and trust services with a view to facilitating cross-border recognition of \nidentity management and trust services on the basis of the principles and issues \nidentified by the Working Group at its fifty-sixth session,13 and takes note of the \ndecision of the Commission to request the Secretariat to prepare, within existing \nresources, a pilot online tool containing the draft notes on the main issues of cloud \ncomputing contracts, for consideration at its next session, in 2019; 14 \n \n9. \nEndorses the efforts and initiatives of the Commission, as the core legal \nbody within the United Nations system in the field of international trade law, aimed \nat increasing coordination of and cooperation on legal activities of international and \nregional organizations active in the field of international trade law and at promoting \nthe rule of law at the national and international levels in this field, and in this regard \nappeals to relevant international and regional organizations to coordinate their \nactivities with those of the Commission, to avoid duplication of efforts and to promote \nefficiency, consistency and coherence in the modernization and harmonization of \ninternational trade law; \n \n10. Reaffirms the importance, in particular for developing countries, of the \nwork of the Commission concerned with technical cooperation and assistance in the \nfield of international trade law reform and development, and in this connection: \n \n(a) \nWelcomes the initiatives of the Commission towards expanding, through \nits secretariat, its technical cooperation and assistance programme, in that respect \nencourages the Secretary-General to seek partnerships with State and non-State actors \nto increase awareness about the work of the Commission and facilitate the effective \nimplementation of legal standards resulting from its work, and notes in that regard \nthe round table on technical assistance held during the fifty-first session of the \nCommission, which brought together governmental and intergovernmental \norganizations active in international development assistance to explore synergies and \ndiscuss ways to further cooperate with the secretariat of the Commission in \nimplementing sound reforms of international trade law; \n \n(b) \nExpresses its appreciation to the Commission for carrying out technical \ncooperation and assistance activities and for providing assistance with legislative \ndrafting in the field of international trade law, and draws the attention of the \nSecretary-General to the limited resources that are made available in this field; \n \n(c) \nExpresses its appreciation to the Governments whose contributions \nenabled the technical cooperation and assistance activities to take place, and appeals \n__________________ \n \n11  See Official Records of the General Assembly, Seventy-third Session, Supplement No. 17 \n(A/73/17), chaps. IV\u2013IX. \n \n12  Ibid., chap. XVII, sects. A and B. \n \n13  Ibid., chap. VIII, para. 159. \n \n14  Ibid., para. 155. \n\nA/RES/73/197 \nReport of the United Nations Commission on International\nTrade Law on the work of its fifty-first session\n \n18-22459\n4/7 \n \nto Governments, the relevant bodies of the United Nations system, organizations, \ninstitutions and individuals to make voluntary contributions to the United Nations \nCommission on International Trade Law trust fund for symposia and, where \nappropriate, for the financing of special projects and otherwise to assist the secretariat \nof the Commission in carrying out technical cooperation and assistance activities, in \nparticular in developing countries; \n \n(d) \nReiterates its appeal to the United Nations Development Programme and \nother bodies responsible for development assistance, such as the World Bank and \nregional development banks, as well as to Governments in their bilateral aid \nprogrammes, to support the technical cooperation and assistance programme of the \nCommission and to cooperate with the Commission and coordinate their activities \nwith those of the Commission in the light of the relevance and importance of the work \nand programmes of the Commission for the promotion of the rule of law at the \nnational and international levels and for the implementation of the international \ndevelopment agenda, including the achievement of the 2030 Agenda for Sustainable \nDevelopment;7 \n \n(e) \nRecalls its resolutions stressing the need to strengthen support to Member \nStates, upon their request, in the domestic implementation of their respective \ninternational obligations through enhanced technical assistance and capacity-\nbuilding, and welcomes the efforts of the Secretary-General to ensure greater \ncoordination and coherence among United Nations entities and with donors and \nrecipients; \n \n11. \nRecalls the importance of adherence to the rules of procedure and methods \nof work of the Commission, including transparent and inclusive deliberations, taking \ninto account the summary of conclusions as reproduced in annex III to the report on \nthe work of its forty-third session,15 requests the Secretariat to issue, prior to meetings \nof the Commission and of its working groups, a reminder of those rules of procedure \nand methods of work with a view to ensuring the high quality of the work of the \nCommission and encouraging the assessment of its instruments, recalls in this regard \nits previous resolutions related to this matter, and notes that the Commission, during \nits fifty-first session, welcomed a joint comprehensive proposal submitted by Member \nStates on its methods of work, including to use information-only documents on \nmatters not requiring in-depth discussions, to apply a flexible approach to the \nallocation of meeting days with the goal of finalizing instruments and subsequently \nmaking decisions on future work in consecutive sessions of the Commission, to \nconduct a more efficient discussion of the topic of the role of the Commission in the \npromotion of the rule of law and to explore the possibility of reducing the duration of \nCommission sessions to two weeks, when possible and subject to the need for \nfinalization of ongoing projects by the Commission, all aimed at enhancing the \nefficiency of the Commission\u2019s work as well as reducing the burden on delegations, \nand to streamline and focus the Commission\u2019s agenda and preparation for the session, \nand notes in that respect that the Secretariat was requested to plan and prepare for the \nfifty-second session of the Commission, in 2019, on the basis of that proposal; 16  \n \n12. Welcomes the activities of the United Nations Commission on \nInternational Trade Law Regional Centre for Asia and the Pacific, in the Republic of \nKorea, towards providing capacity-building and technical assistance services to \nStates in the Asia-Pacific region, including to international and regional \norganizations, expresses its appreciation to the Republic of Korea and China, whose \ncontributions enabled continuing operation of the Regional Centre, notes that the \ncontinuation of the regional presence relies entirely on extrabudgetary resources, \n__________________ \n \n15  Ibid., Sixty-fifth Session, Supplement No. 17 (A/65/17). \n \n16  Ibid., Seventy-third Session, Supplement No. 17 (A/73/17), chap. XVIII, sect. A. \n\nReport of the United Nations Commission on International \nTrade Law on the work of its fifty-first session \nA/RES/73/197\n \n5/7\n18-22459 \n \nincluding but not limited to voluntary contributions from States, welcomes \nexpressions of interest from other States in hosting regional centres of the \nCommission, and requests the Secretary-General to keep the General Assembly \ninformed of developments regarding the establishment of regional centres, in \nparticular their funding and budgetary situation; \n \n13. Notes that, further to the offer of the Government of Cameroon in 2017, \napproved by the Commission, to establish, subject to the relevant rules and \nregulations of the United Nations and the internal approval process of the Office of \nLegal Affairs of the Secretariat, a regional centre for Africa in Cameroon, 17 the \nGovernment of Cameroon is continuing to examine the financial implications and the \nfeasibility of establishing that regional centre, and encourages the secretariat of the \nCommission to continue its consultations and consider carefully the level of human \nresources that it would need for the efficient management of any new regional centre \nand for ensuring adequate supervision by, and coordination with, Vienna-based \nsecretariat staff, 18 and requests the Commission, in its annual report, to keep the \nGeneral Assembly informed of developments regarding the project, in particular its \nfunding and budgetary situation; \n \n14. Appeals to Governments, the relevant bodies of the United Nations system, \norganizations, institutions and individuals to make voluntary contributions to the trust \nfund established to provide travel assistance to developing countries that are members \nof the Commission, at their request and in consultation with the Secretary-General, \nin order to enable renewal of the provision of that assistance and to increase expert \nrepresentation from developing countries at sessions of the Commission and its \nworking groups, necessary to build local expertise and capacities in those countries \nto put in place a regulatory and enabling environment for business, trade and \ninvestment; \n \n15. Decides, in order to ensure full participation of all Member States in the \nsessions of the Commission and its working groups, to continue, in the competent \nMain Committee during the seventy-third session of the General Assembly, its \nconsideration of granting travel assistance to the least developed countries that are \nmembers of the Commission, at their request and in consultation with the Secretary-\nGeneral, and notes the contributions from the European Union and the Swiss Agency \nfor Development and Cooperation to the trust fund, which would facilitate the \nparticipation of representatives of developing States in the deliberations of Working \nGroup III; \n \n16. Endorses the conviction of the Commission that the implementation and \neffective use of modern private law standards in international trade are essential for \nadvancing good governance, sustained economic development and the eradication of \npoverty and hunger and that the promotion of the rule of law in commercial relations \nshould be an integral part of the broader agenda of the United Nations to promote the \nrule of law at the national and international levels, including through the Rule of Law \nCoordination and Resource Group, supported by the Rule of Law Unit in the \nExecutive Office of the Secretary-General; \n \n17. Notes the role of the Commission in promoting the rule of law, respective \nactivity in the Commission at its fifty-first session19 and the comments transmitted by \nthe Commission, pursuant to paragraph 25 of General Assembly resolution 72/119 of \n7 December 2017, highlighting the role in the promotion of the rule of law of the texts \nadopted or approved by the Commission and of its ongoing work, in particular \n__________________ \n \n17  Ibid., Seventy-second Session, Supplement No. 17 (A/72/17), para. 293. \n \n18  Ibid., Seventy-third Session, Supplement No. 17 (A/73/17), para. 200. \n \n19  Ibid., paras. 230\u2013231. \n\nA/RES/73/197 \nReport of the United Nations Commission on International\nTrade Law on the work of its fifty-first session\n \n18-22459\n6/7 \n \nthrough wide dissemination of international commercial law, including across the \nUnited Nations system;20  \n \n18. Notes with satisfaction that, in paragraph 8 of the declaration of the high-\nlevel meeting of the General Assembly on the rule of law at the national and \ninternational levels, adopted by consensus as resolution 67/1 of 24 September 2012, \nMember States recognized the importance of fair, stable and predictable legal \nframeworks for generating inclusive, sustainable and equitable development, \neconomic growth and employment, generating investment and facilitating \nentrepreneurship and, in this regard, commended the work of the Commission in \nmodernizing and harmonizing international trade law and that, in paragraph 7 of the \ndeclaration, Member States expressed their conviction that the rule of law and \ndevelopment were strongly interrelated and mutually reinforcing; \n \n19. Also notes with satisfaction that, in paragraph 89 of the Addis Ababa \nAction Agenda of the Third International Conference on Financing for Development, \nadopted by the General Assembly by consensus as resolution 69/313 of 27 July 2015, \nStates endorsed the efforts and initiatives of the Commission, as the core legal body \nwithin the United Nations system in the field of international trade law, aimed at \nincreasing coordination of and cooperation on legal activities of international and \nregional organizations active in the field of international trade law and at promoting \nthe rule of law at the national and international levels in this field; \n \n20. Reiterates its request to the Secretary-General, in conformity with \nresolutions of the General Assembly on documentation-related matters,21 which, in \nparticular, emphasize that any invitation to limit, where appropriate, the length of \ndocuments should not adversely affect either the quality of the presentation or the \nsubstance of the documents, to bear in mind the particular characteristics of the \nmandate and functions of the Commission in the progressive development and \ncodification of international trade law when implementing page limits with respect to \nthe documentation of the Commission;22  \n \n21. Requests the Secretary-General to continue the publication of Commission \nstandards and the provision of summary records of the meetings of the Commission, \nincluding committees of the whole established by the Commission for the duration of \nits annual session, relating to the formulation of normative texts, and takes note of \nthe decision of the Commission to continue the trial use of digital recordings, in \nparallel with summary records where applicable, with a view to assessing the \nexperience of using digital recordings and, on the basis of that assessment, taking a \ndecision at a future session regarding the possible replacement of summary records \nby digital recordings;23  \n \n22. Recalls paragraph 48 of its resolution 66/246 of 24 December 2011 \nregarding the rotation scheme of meetings between Vienna and New York; \n \n23. Stresses the importance of promoting the use of texts emanating from the \nwork of the Commission for the global unification and harmonization of international \ntrade law, and to this end urges States that have not yet done so to consider signing, \nratifying or acceding to conventions, enacting model laws and encouraging the use of \nother relevant texts; \n__________________ \n \n20  Ibid., chap. XV. \n \n21  Resolutions 52/214, sect. B, 57/283 B, sect. III, and 58/250, sect. III. \n \n22  See resolutions 59/39, para. 9, and 65/21, para. 18; see also Official Records of the General \nAssembly, Fifty-ninth Session, Supplement No. 17 (A/59/17), paras. 124\u2013128. \n \n23  See Official Records of the General Assembly, Sixty-ninth Session, Supplement No. 17 (A/69/17), \npara. 276. \n\nReport of the United Nations Commission on International \nTrade Law on the work of its fifty-first session \nA/RES/73/197\n \n7/7\n18-22459 \n \n \n24. Notes with appreciation the work of the Secretariat on the system for the \ncollection and dissemination of case law on Commission texts in the six official \nlanguages of the United Nations (the CLOUT system), notes the resource-intensive \nnature of the system, acknowledges the need for further resources to sustain and \nexpand it, and in this regard welcomes efforts by the Secretariat towards building \npartnerships with interested institutions, and appeals to Governments, the relevant \nbodies of the United Nations system, organizations, institutions and individuals to \nassist the secretariat of the Commission in raising awareness as to the availability and \nusefulness of the CLOUT system in professional, academic and judiciary circles and \nin securing the funding required for the coordination and expansion of the system and \nthe establishment, within the secretariat of the Commission, of a pillar focused on the \npromotion of ways and means of interpreting Commission texts in a uniform manner; \n \n25. Welcomes the continuing work of the Secretariat on digests of case law \nrelated to Commission texts, including their wide dissemination, as well as the \ncontinuing increase in the number of abstracts available through the CLOUT system, \nin view of the role of the digests and the CLOUT system as important tools for the \npromotion of the uniform interpretation of international trade law, in particular by \nbuilding local capacity of judges, arbitrators and other legal practitioners to interpret \nthose standards in the light of their international character and the need to promote \nuniformity in their application and the observance of good faith in international trade, \nand notes the satisfaction of the Commission with the performance of the New York \nConvention website24 and the successful coordination between that website and the \nCLOUT system; \n \n26. Recalls its resolutions affirming the importance of high-quality, user-\nfriendly and cost-effective United Nations websites and the need for their multilingual \ndevelopment, maintenance and enrichment,25 commends the fact that the website of \nthe Commission is published simultaneously in the six official languages of the \nUnited Nations, and welcomes the continuous efforts of the Commission to maintain \nand improve its website, including by developing its latest updated version, and to \nenhance the visibility of its work by utilizing social media features in accordance with \nthe applicable guidelines.26 \n \n62nd plenary meeting  \n20 December 2018 \n \n__________________ \n \n24  www.newyorkconvention1958.org.  \n \n25  Resolutions 52/214, sect. C, para. 3; 55/222, sect. III, para. 12; 56/64 B, sect. X; 57/130 B, \nsect. X; 58/101 B, sect. V, paras. 61\u201376; 59/126 B, sect. V, paras. 76\u201395; 60/109 B, sect. IV, \nparas. 66\u201380; and 61/121 B, sect. IV, paras. 65\u201377. \n \n26  See resolution 63/120, para. 20. \n",
  "paragraphs": {
    "1": "Takes note with appreciation of the report of the United Nations Commission on International Trade Law;1",
    "2": "Commends the Commission for the finalization of the draft convention on international settlement agreements resulting from mediation; 2",
    "3": "Also commends the Commission for the finalization and adoption of the Model Law on International Commercial Mediation and International Settlement Agreements Resulting from Mediation,3 the Legislative Guide on Key Principles of a Business Registry 4 and the Model Law on Recognition and Enforcement of Insolvency-Related Judgments and its Guide to Enactment;5",
    "4": "Notes with appreciation the event held to mark the sixtieth anniversary of the Convention on the Recognition and Enforcement of Foreign Arbitral Awards (the New York Convention of 1958),6 at which it was acknowledged that the Convention, with its almost universal acceptance, brings legal certainty to business operations worldwide, thereby contributing to decreasing the level of risk and transactional costs associated with international trade, furthering the Sustainable Development Goals7 and, by establishing a fundamental legal framework for the use of arbitration and its effectiveness, strengthens respect for binding commitments, inspires confidence in the rule of law and ensures fair treatment in the resolution of disputes arising over contractual rights and obligations;8",
    "5": "Notes with satisfaction the contributions from the Fund for International Development of the Organization of the Petroleum Exporting Countries and from the European Commission, which allow the operation of the repository of published information under the Rules on Transparency in Treaty-based Investor-State Arbitration9 and that the Commission reiterated its strong and unanimous opinion that the secretariat of the Commission should continue to operate the transparency repository, which constitutes a central feature both of the Rules on Transparency and of the United Nations Convention on Transparency in Treaty-based Investor-State Arbitration (Mauritius Convention on Transparency);10",
    "6": "Requests the Secretary-General to continue to operate, through the secretariat of the Commission, the repository of published information in accordance with article 8 of the Rules on Transparency, as a pilot project until the end of 2020, to be funded entirely by voluntary contributions, and to keep the General Assembly informed of developments regarding the funding and budgetary situation of the transparency repository based on its pilot operation;",
    "7": "Takes note with interest of the decisions taken by the Commission as regards its future work and the progress made by the Commission in its work in the areas of micro, small and medium-sized enterprises, dispute settlement, investor-State dispute settlement reform, electronic commerce, insolvency law and security interests and privately financed infrastructure projects,11 as well as the decisions to take up work on expedited arbitration and, as its next priority, the judicial sale of ships, to conduct exploratory and preparatory work on warehouse receipts, to compile information on legal issues related to the digital economy aimed at enabling the commercial use of new technologies and methods and assisting developing economies in bridging the digital gap, and to undertake exploratory work on contractual networks and the civil law aspects of asset tracing and recovery, 12 and encourages the Commission to continue to move forward efficiently to achieve tangible work outcomes in those areas;",
    "8": "Welcomes the decision by the Commission to give Working Group IV a more specific mandate to conduct work on legal issues in the area of identity management and trust services with a view to facilitating cross-border recognition of identity management and trust services on the basis of the principles and issues identified by the Working Group at its fifty-sixth session,13 and takes note of the decision of the Commission to request the Secretariat to prepare, within existing resources, a pilot online tool containing the draft notes on the main issues of cloud computing contracts, for consideration at its next session, in 2019; 14",
    "9": "Endorses the efforts and initiatives of the Commission, as the core legal body within the United Nations system in the field of international trade law, aimed at increasing coordination of and cooperation on legal activities of international and regional organizations active in the field of international trade law and at promoting the rule of law at the national and international levels in this field, and in this regard appeals to relevant international and regional organizations to coordinate their activities with those of the Commission, to avoid duplication of efforts and to promote efficiency, consistency and coherence in the modernization and harmonization of international trade law;",
    "10": "Reaffirms the importance, in particular for developing countries, of the work of the Commission concerned with technical cooperation and assistance in the field of international trade law reform and development, and in this connection: (a) Welcomes the initiatives of the Commission towards expanding, through its secretariat, its technical cooperation and assistance programme, in that respect encourages the Secretary-General to seek partnerships with State and non-State actors to increase awareness about the work of the Commission and facilitate the effective implementation of legal standards resulting from its work, and notes in that regard the round table on technical assistance held during the fifty-first session of the Commission, which brought together governmental and intergovernmental organizations active in international development assistance to explore synergies and discuss ways to further cooperate with the secretariat of the Commission in implementing sound reforms of international trade law; (b) Expresses its appreciation to the Commission for carrying out technical cooperation and assistance activities and for providing assistance with legislative drafting in the field of international trade law, and draws the attention of the Secretary-General to the limited resources that are made available in this field; (c) Expresses its appreciation to the Governments whose contributions enabled the technical cooperation and assistance activities to take place, and appeals to Governments, the relevant bodies of the United Nations system, organizations, institutions and individuals to make voluntary contributions to the United Nations Commission on International Trade Law trust fund for symposia and, where appropriate, for the financing of special projects and otherwise to assist the secretariat of the Commission in carrying out technical cooperation and assistance activities, in particular in developing countries; (d) Reiterates its appeal to the United Nations Development Programme and other bodies responsible for development assistance, such as the World Bank and regional development banks, as well as to Governments in their bilateral aid programmes, to support the technical cooperation and assistance programme of the Commission and to cooperate with the Commission and coordinate their activities with those of the Commission in the light of the relevance and importance of the work and programmes of the Commission for the promotion of the rule of law at the national and international levels and for the implementation of the international development agenda, including the achievement of the 2030 Agenda for Sustainable Development;7 (e) Recalls its resolutions stressing the need to strengthen support to Member States, upon their request, in the domestic implementation of their respective international obligations through enhanced technical assistance and capacity- building, and welcomes the efforts of the Secretary-General to ensure greater coordination and coherence among United Nations entities and with donors and recipients;",
    "11": "Recalls the importance of adherence to the rules of procedure and methods of work of the Commission, including transparent and inclusive deliberations, taking into account the summary of conclusions as reproduced in annex III to the report on the work of its forty-third session,15 requests the Secretariat to issue, prior to meetings of the Commission and of its working groups, a reminder of those rules of procedure and methods of work with a view to ensuring the high quality of the work of the Commission and encouraging the assessment of its instruments, recalls in this regard its previous resolutions related to this matter, and notes that the Commission, during its fifty-first session, welcomed a joint comprehensive proposal submitted by Member States on its methods of work, including to use information-only documents on matters not requiring in-depth discussions, to apply a flexible approach to the allocation of meeting days with the goal of finalizing instruments and subsequently making decisions on future work in consecutive sessions of the Commission, to conduct a more efficient discussion of the topic of the role of the Commission in the promotion of the rule of law and to explore the possibility of reducing the duration of Commission sessions to two weeks, when possible and subject to the need for finalization of ongoing projects by the Commission, all aimed at enhancing the efficiency of the Commission\u2019s work as well as reducing the burden on delegations, and to streamline and focus the Commission\u2019s agenda and preparation for the session, and notes in that respect that the Secretariat was requested to plan and prepare for the fifty-second session of the Commission, in 2019, on the basis of that proposal; 16",
    "12": "Welcomes the activities of the United Nations Commission on International Trade Law Regional Centre for Asia and the Pacific, in the Republic of Korea, towards providing capacity-building and technical assistance services to States in the Asia-Pacific region, including to international and regional organizations, expresses its appreciation to the Republic of Korea and China, whose contributions enabled continuing operation of the Regional Centre, notes that the continuation of the regional presence relies entirely on extrabudgetary resources, including but not limited to voluntary contributions from States, welcomes expressions of interest from other States in hosting regional centres of the Commission, and requests the Secretary-General to keep the General Assembly informed of developments regarding the establishment of regional centres, in particular their funding and budgetary situation;",
    "13": "Notes that, further to the offer of the Government of Cameroon in 2017, approved by the Commission, to establish, subject to the relevant rules and regulations of the United Nations and the internal approval process of the Office of Legal Affairs of the Secretariat, a regional centre for Africa in Cameroon, 17 the Government of Cameroon is continuing to examine the financial implications and the feasibility of establishing that regional centre, and encourages the secretariat of the Commission to continue its consultations and consider carefully the level of human resources that it would need for the efficient management of any new regional centre and for ensuring adequate supervision by, and coordination with, Vienna-based secretariat staff, 18 and requests the Commission, in its annual report, to keep the General Assembly informed of developments regarding the project, in particular its funding and budgetary situation;",
    "14": "Appeals to Governments, the relevant bodies of the United Nations system, organizations, institutions and individuals to make voluntary contributions to the trust fund established to provide travel assistance to developing countries that are members of the Commission, at their request and in consultation with the Secretary-General, in order to enable renewal of the provision of that assistance and to increase expert representation from developing countries at sessions of the Commission and its working groups, necessary to build local expertise and capacities in those countries to put in place a regulatory and enabling environment for business, trade and investment;",
    "15": "Decides, in order to ensure full participation of all Member States in the sessions of the Commission and its working groups, to continue, in the competent Main Committee during the seventy-third session of the General Assembly, its consideration of granting travel assistance to the least developed countries that are members of the Commission, at their request and in consultation with the Secretary- General, and notes the contributions from the European Union and the Swiss Agency for Development and Cooperation to the trust fund, which would facilitate the participation of representatives of developing States in the deliberations of Working Group III;",
    "16": "Endorses the conviction of the Commission that the implementation and effective use of modern private law standards in international trade are essential for advancing good governance, sustained economic development and the eradication of poverty and hunger and that the promotion of the rule of law in commercial relations should be an integral part of the broader agenda of the United Nations to promote the rule of law at the national and international levels, including through the Rule of Law Coordination and Resource Group, supported by the Rule of Law Unit in the Executive Office of the Secretary-General;",
    "17": "Notes the role of the Commission in promoting the rule of law, respective activity in the Commission at its fifty-first session19 and the comments transmitted by the Commission, pursuant to paragraph 25 of General Assembly resolution 72/119 of 7 December 2017, highlighting the role in the promotion of the rule of law of the texts adopted or approved by the Commission and of its ongoing work, in particular through wide dissemination of international commercial law, including across the United Nations system;20",
    "18": "Notes with satisfaction that, in paragraph 8 of the declaration of the high- level meeting of the General Assembly on the rule of law at the national and international levels, adopted by consensus as resolution 67/1 of 24 September 2012, Member States recognized the importance of fair, stable and predictable legal frameworks for generating inclusive, sustainable and equitable development, economic growth and employment, generating investment and facilitating entrepreneurship and, in this regard, commended the work of the Commission in modernizing and harmonizing international trade law and that, in paragraph 7 of the declaration, Member States expressed their conviction that the rule of law and development were strongly interrelated and mutually reinforcing;",
    "19": "Also notes with satisfaction that, in paragraph 89 of the Addis Ababa Action Agenda of the Third International Conference on Financing for Development, adopted by the General Assembly by consensus as resolution 69/313 of 27 July 2015, States endorsed the efforts and initiatives of the Commission, as the core legal body within the United Nations system in the field of international trade law, aimed at increasing coordination of and cooperation on legal activities of international and regional organizations active in the field of international trade law and at promoting the rule of law at the national and international levels in this field;",
    "20": "Reiterates its request to the Secretary-General, in conformity with resolutions of the General Assembly on documentation-related matters,21 which, in particular, emphasize that any invitation to limit, where appropriate, the length of documents should not adversely affect either the quality of the presentation or the substance of the documents, to bear in mind the particular characteristics of the mandate and functions of the Commission in the progressive development and codification of international trade law when implementing page limits with respect to the documentation of the Commission;22",
    "21": "Requests the Secretary-General to continue the publication of Commission standards and the provision of summary records of the meetings of the Commission, including committees of the whole established by the Commission for the duration of its annual session, relating to the formulation of normative texts, and takes note of the decision of the Commission to continue the trial use of digital recordings, in parallel with summary records where applicable, with a view to assessing the experience of using digital recordings and, on the basis of that assessment, taking a decision at a future session regarding the possible replacement of summary records by digital recordings;23",
    "22": "Recalls paragraph 48 of its resolution 66/246 of 24 December 2011 regarding the rotation scheme of meetings between Vienna and New York;",
    "23": "Stresses the importance of promoting the use of texts emanating from the work of the Commission for the global unification and harmonization of international trade law, and to this end urges States that have not yet done so to consider signing, ratifying or acceding to conventions, enacting model laws and encouraging the use of other relevant texts;",
    "24": "Notes with appreciation the work of the Secretariat on the system for the collection and dissemination of case law on Commission texts in the six official languages of the United Nations (the CLOUT system), notes the resource-intensive nature of the system, acknowledges the need for further resources to sustain and expand it, and in this regard welcomes efforts by the Secretariat towards building partnerships with interested institutions, and appeals to Governments, the relevant bodies of the United Nations system, organizations, institutions and individuals to assist the secretariat of the Commission in raising awareness as to the availability and usefulness of the CLOUT system in professional, academic and judiciary circles and in securing the funding required for the coordination and expansion of the system and the establishment, within the secretariat of the Commission, of a pillar focused on the promotion of ways and means of interpreting Commission texts in a uniform manner;",
    "25": "Welcomes the continuing work of the Secretariat on digests of case law related to Commission texts, including their wide dissemination, as well as the continuing increase in the number of abstracts available through the CLOUT system, in view of the role of the digests and the CLOUT system as important tools for the promotion of the uniform interpretation of international trade law, in particular by building local capacity of judges, arbitrators and other legal practitioners to interpret those standards in the light of their international character and the need to promote uniformity in their application and the observance of good faith in international trade, and notes the satisfaction of the Commission with the performance of the New York Convention website24 and the successful coordination between that website and the CLOUT system;",
    "26": "Recalls its resolutions affirming the importance of high-quality, user- friendly and cost-effective United Nations websites and the need for their multilingual development, maintenance and enrichment,25 commends the fact that the website of the Commission is published simultaneously in the six official languages of the United Nations, and welcomes the continuous efforts of the Commission to maintain and improve its website, including by developing its latest updated version, and to enhance the visibility of its work by utilizing social media features in accordance with the applicable guidelines.26"
  },
  "agenda_items": [
    "Item 80"
  ],
  "symbol_references": []
}