{
  "symbol": "A/RES/78/299",
  "filename": "A_RES_78_299.pdf",
  "title": "78/299. Financing of the United Nations Operation in C\u00f4te d\u2019Ivoire",
  "text": "United Nations \nA/RES/78/299\n \n \nGeneral Assembly \nDistr.: General \n3 July 2024 \n \n24-12121 (E)        \n*2412121* \n \n \nSeventy-eighth session \nAgenda item 149 \nFinancing of the United Nations Operation in C\u00f4te d\u2019Ivoire \n \n \n \n \n Resolution adopted by the General Assembly \non 28 June 2024 \n \n \n \n \n[on the report of the Fifth Committee (A/78/923, para. 6)] \n \n \n 78/299. Financing of the United Nations Operation in C\u00f4te d\u2019Ivoire \n \n \n \nThe General Assembly, \n \nHaving considered the report of the Secretary-General on the final performance \nof the United Nations Operation in C\u00f4te d\u2019Ivoire 1 and the related report of the \nAdvisory Committee on Administrative and Budgetary Questions, 2  \n \n1. \nTakes note of the status of contributions to the United Nations Operation \nin C\u00f4te d\u2019Ivoire as at 30 April 2024, including the contributions outstanding in the \namount of 0.4 million United States dollars, representing some 0.01 per cent of the \ntotal assessed contributions, notes with concern that only 188 Member States have \npaid their assessed contributions in full, and urges all other Member States, in \nparticular those in arrears, to ensure payment of their outstanding assessed \ncontributions; \n \n2. \nEndorses the conclusions and recommendations contained in the report of \nthe Advisory Committee on Administrative and Budgetary Questions, subject to the \nprovisions of the present resolution, and requests the Secretary-General to ensure \ntheir full implementation; \n \n3. \nTakes note of the report of the Secretary-General on the final performance \nof the United Nations Operation in C\u00f4te d\u2019Ivoire and the updated information on the \nnet cash available in the special account for the United Nations Operation in C\u00f4te \nd\u2019Ivoire in the amount of 6,481,000 dollars as at 30 April 2024; \n \n4. \nTakes note of paragraph 9 of the report of the Advisory Committee; \n \n5. \nDecides that Member States that have fulfilled their financial obligations \nto the Operation shall be credited with their respective share of the net cash available \nin the special account for the Operation in the amount of 6,481,000 dollars as at \n__________________ \n \n1  A/74/711. \n \n2  A/74/785. \n\nA/RES/78/299 \nFinancing of the United Nations Operation in C\u00f4te d\u2019Ivoire\n \n24-12121\n2/2 \n \n30 April 2024, in accordance with the levels updated in its resolution 70/246 of \n23 December 2015, taking into account the scale of assessments for 2017, as set out \nin its resolution 70/245 of 23 December 2015; \n \n6. \nEncourages Member States that are owed credits referred to in paragraph \n5 above to apply those credits to any accounts where they have outstanding assessed \ncontributions; \n \n7. \nUrges all Member States to make every possible effort to ensure payment \nof their assessed contributions in full; \n \n8. \nDecides that, for Member States that have not fulfilled their financial \nobligations to the Operation, their respective share of the net cash available in the \nspecial account for the Operation in the amount of 6,481,000 dollars as at 30 April \n2024 shall be set off against their outstanding obligations, in accordance with the \nscheme set out in paragraph 5 above; \n \n9. \nAlso decides that updated information on the financial position of the \nOperation shall be included in the report on the updated position of closed \npeacekeeping missions, to be considered by the General Assembly at its seventy-ninth \nsession under the agenda item entitled \u201cAdministrative and budgetary aspects of the \nfinancing of the United Nations peacekeeping operations\u201d; \n \n10. Further decides to delete from its agenda the item entitled \u201cFinancing of \nthe United Nations Operation in C\u00f4te d\u2019Ivoire\u201d.  \n \n95th plenary meeting \n28 June 2024 \n \n",
  "paragraphs": {
    "1": "Takes note of the status of contributions to the United Nations Operation in C\u00f4te d\u2019Ivoire as at 30 April 2024, including the contributions outstanding in the amount of 0.4 million United States dollars, representing some 0.01 per cent of the total assessed contributions, notes with concern that only 188 Member States have paid their assessed contributions in full, and urges all other Member States, in particular those in arrears, to ensure payment of their outstanding assessed contributions;",
    "2": "Endorses the conclusions and recommendations contained in the report of the Advisory Committee on Administrative and Budgetary Questions, subject to the provisions of the present resolution, and requests the Secretary-General to ensure their full implementation;",
    "3": "Takes note of the report of the Secretary-General on the final performance of the United Nations Operation in C\u00f4te d\u2019Ivoire and the updated information on the net cash available in the special account for the United Nations Operation in C\u00f4te d\u2019Ivoire in the amount of 6,481,000 dollars as at 30 April 2024;",
    "4": "Takes note of paragraph 9 of the report of the Advisory Committee;",
    "5": "Decides that Member States that have fulfilled their financial obligations to the Operation shall be credited with their respective share of the net cash available in the special account for the Operation in the amount of 6,481,000 dollars as at __________________ 1 A/74/711. 2 A/74/785. A/RES/78/299 Financing of the United Nations Operation in C\u00f4te d\u2019Ivoire 24-12121 2/2 30 April 2024, in accordance with the levels updated in its resolution 70/246 of 23 December 2015, taking into account the scale of assessments for 2017, as set out in its resolution 70/245 of 23 December 2015;",
    "6": "Encourages Member States that are owed credits referred to in paragraph 5 above to apply those credits to any accounts where they have outstanding assessed contributions;",
    "7": "Urges all Member States to make every possible effort to ensure payment of their assessed contributions in full;",
    "8": "Decides that, for Member States that have not fulfilled their financial obligations to the Operation, their respective share of the net cash available in the special account for the Operation in the amount of 6,481,000 dollars as at 30 April 2024 shall be set off against their outstanding obligations, in accordance with the scheme set out in paragraph 5 above;",
    "9": "Also decides that updated information on the financial position of the Operation shall be included in the report on the updated position of closed peacekeeping missions, to be considered by the General Assembly at its seventy-ninth session under the agenda item entitled \u201cAdministrative and budgetary aspects of the financing of the United Nations peacekeeping operations\u201d;",
    "10": "Further decides to delete from its agenda the item entitled \u201cFinancing of the United Nations Operation in C\u00f4te d\u2019Ivoire\u201d. 95th plenary meeting 28 June 2024"
  },
  "agenda_items": [
    "Item 149"
  ],
  "symbol_references": []
}