{
  "symbol": "A/RES/78/27",
  "filename": "A_RES_78_27.pdf",
  "title": "78/27. Follow-up to the 2013 high-level meeting of the General Assembly on nuclear disarmament",
  "text": "United Nations \nA/RES/78/27\n \n \nGeneral Assembly \nDistr.: General \n6 December 2023 \n \n23-24531 (E)    151223 \n*2324531* \n \n \nSeventy-eighth session \nAgenda item 99 (aa) \nGeneral and complete disarmament: follow-up to the \n2013 high-level meeting of the General Assembly on \nnuclear disarmament \n \n \n \n \n Resolution adopted by the General Assembly \non 4 December 2023 \n \n \n \n \n[on the report of the First Committee (A/78/409, para. 89)] \n \n \n \n78/27. Follow-up to the 2013 high-level meeting of the General Assembly \non nuclear disarmament \n \n \n \nThe General Assembly, \n \nRecalling its resolutions 67/39 of 3 December 2012, 68/32 of 5 December 2013, \n69/58 of 2 December 2014, 70/34 of 7 December 2015, 71/71 of 5 December 2016, \n72/251 of 24 December 2017, 73/40 of 5 December 2018, 74/54 of 12 December \n2019, 75/45 of 7 December 2020, 76/36 of 6 December 2021 and 77/47 of 7 December \n2022, \n \nWelcoming the convening of the high-level meeting of the General Assembly on \nnuclear disarmament, on 26 September 2013, and recognizing its contribution to \nfurthering the objective of the total elimination of nuclear weapons, \n \nEmphasizing the importance of seeking a safer world for all and achieving peace \nand security in a world without nuclear weapons, \n \nReaffirming that effective measures of nuclear disarmament have the highest \npriority, as affirmed at the first special session of the General Assembly devoted to \ndisarmament, \n \nConvinced that nuclear disarmament and the total elimination of nuclear \nweapons are the only absolute guarantee against the use or threat of use of nuclear \nweapons, \n \nAcknowledging the significant contribution made by a number of countries \ntowards realizing the objective of nuclear disarmament by the establishment of \nnuclear-weapon-free zones, as well as by the voluntary renunciation of nuclear \nweapon programmes or withdrawal of all nuclear weapons from their territories, and \n\nA/RES/78/27 \nFollow-up to the 2013 high-level meeting of the General Assembly \non nuclear disarmament\n \n23-24531\n2/4 \n \nstrongly supporting the speedy establishment of a nuclear-weapon-free zone in the \nMiddle East, \n \nRecalling the resolve of the Heads of State and Government, as contained in the \nUnited Nations Millennium Declaration,1 to strive for the elimination of weapons of \nmass destruction, particularly nuclear weapons, and to keep all options open for \nachieving this aim, including the possibility of convening an international conference \nto identify ways of eliminating nuclear dangers, \n \nReaffirming the central role of the United Nations in the field of disarmament, \nand reaffirming also the continued importance and relevance of multilateral \ndisarmament machinery as mandated by the General Assembly at its first special \nsession devoted to disarmament, \n \nAcknowledging the important role of civil society, including non-governmental \norganizations, academia, parliamentarians and the mass media, in advancing the \nobjective of nuclear disarmament, \n \nSharing the deep concern at the catastrophic humanitarian consequences of any \nuse of nuclear weapons, and in this context reaffirming the need for all States at all \ntimes to comply with applicable international law, including international \nhumanitarian law, \n \nTaking note of the report of the Secretary-General submitted pursuant to \nresolution 77/47,2 and welcoming the fact that a large number of Member States \ncontributed their views to this report, \n \nNoting the adoption, with a vote, of the Treaty on the Prohibition of Nuclear \nWeapons3 on 7 July 2017 at the United Nations conference to negotiate a legally \nbinding instrument to prohibit nuclear weapons, leading towards their total \nelimination, its entry into force on 22 January 2021 and the first Meeting of States \nParties to the Treaty, held in Vienna from 21 to 23 June 2022,  \n \nMindful of the solemn obligations of States parties, undertaken in article VI of \nthe Treaty on the Non-Proliferation of Nuclear Weapons, 4 particularly to pursue \nnegotiations in good faith on effective measures relating to the cessation of the \nnuclear arms race at an early date and to nuclear disarmament, \n \nExpressing its concern that improvements in existing nuclear weapons and the \ndevelopment of new types of nuclear weapons, as provided for in the military \ndoctrines of some nuclear-weapon States, violate their legal obligations on nuclear \ndisarmament, as well as the commitments made to diminish the role of nuclear \nweapons in their military and security policies, and contravene the negative security \nassurances provided by the nuclear-weapon States, \n \nExpressing its deep concern that the negotiations in the Conference on \nDisarmament for the conclusion of a comprehensive convention on nuclear weapons \nhave not yet commenced, \n \nDetermined to work collectively towards the realization of nuclear \ndisarmament, \n \n1. \nUnderlines the strong support, expressed at the high-level meeting of the \nGeneral Assembly on nuclear disarmament, held on 26 September 2013, for taking \nurgent and effective measures to achieve the total elimination of nuclear weapons; \n__________________ \n \n1  Resolution 55/2. \n \n2  A/78/133. \n \n3  A/CONF.229/2017/8. \n \n4  United Nations, Treaty Series, vol. 729, No. 10485. \n\nFollow-up to the 2013 high-level meeting of the General Assembly \non nuclear disarmament \nA/RES/78/27\n \n3/4\n23-24531 \n \n \n2. \nCalls for urgent compliance with the legal obligations and the fulfilment \nof the commitments undertaken on nuclear disarmament; \n \n3. \nEndorses the wide support expressed at the high-level meeting for a \ncomprehensive convention on nuclear weapons; \n \n4. \nCalls for the urgent commencement of negotiations in the Conference on \nDisarmament on effective nuclear disarmament measures to achieve the total \nelimination of nuclear weapons, including, in particular, on a comprehensive \nconvention on nuclear weapons; \n \n5. \nDecides to convene, in New York, on a date to be decided later, a United \nNations high-level international conference on nuclear disarmament to review the \nprogress made in this regard; \n \n6. \nTakes note of the views provided by Member States with regard to \nachieving the objective of the total elimination of nuclear weapons, in particular on \nthe elements of a comprehensive convention on nuclear weapons, as reflected in the \nreport submitted by the Secretary-General pursuant to resolution 77/47, and requests \nthe Secretary-General to forward this report to the Conference on Disarmament and \nthe Disarmament Commission for their early consideration; \n \n7. \nWelcomes the commemoration and promotion of 26 September as the \nInternational Day for the Total Elimination of Nuclear Weapons devoted to furthering \nthis objective; \n \n8. \nExpresses its appreciation to Member States, the United Nations system \nand \ncivil \nsociety, \nincluding \nnon-governmental \norganizations, \nacademia, \nparliamentarians, the mass media and individuals that developed activities in \npromotion of the International Day for the Total Elimination of Nuclear Weapons; \n \n9. \nReiterates its request to the President of the General Assembly to organize, \non 26 September every year, a one-day high-level plenary meeting of the Assembly \nto commemorate and promote the International Day for the Total Elimination of \nNuclear Weapons; \n \n10. Decides that the aforementioned high-level plenary meeting shall be held \nwith the participation of Member and observer States, represented at the highest \npossible level, as well as with the participation of the President of the General \nAssembly and the Secretary-General; \n \n11. \nRequests the Secretary-General to continue to update the platform for the \npromotion of these activities and to undertake all the arrangements, providing all the \nnecessary resources and services, including webcasts, to commemorate and promote \nthe International Day for the Total Elimination of Nuclear Weapons, including \nthrough the United Nations Offices at Geneva and Vienna, as well as the United \nNations regional centres for peace and disarmament; \n \n12. Calls upon Member States, the United Nations system and civil society, \nincluding non-governmental organizations, academia, parliamentarians, the mass \nmedia and individuals, to commemorate and promote the International Day for the \nTotal Elimination of Nuclear Weapons through all means of educational and public \nawareness-raising activities about the threat posed to humanity by nuclear weapons \nand the necessity for their total elimination in order to mobilize international efforts \ntowards achieving the common goal of a nuclear-weapon-free world; \n \n13. Requests the Secretary-General to seek the views of Member States with \nregard to achieving the objective of the total elimination of nuclear weapons, in \nparticular on effective nuclear disarmament measures, including elements of a \ncomprehensive convention on nuclear weapons, and to submit a report thereon to the \n\nA/RES/78/27 \nFollow-up to the 2013 high-level meeting of the General Assembly \non nuclear disarmament\n \n23-24531\n4/4 \n \nGeneral Assembly at its seventy-ninth session, and also to transmit the report to the \nConference on Disarmament; \n \n14. Also requests the Secretary-General to report on the implementation of the \npresent resolution to the General Assembly at its seventy-ninth session; \n \n15. Decides to include in the provisional agenda of its seventy-ninth session, \nunder the item entitled \u201cGeneral and complete disarmament\u201d, the sub-item entitled \n\u201cFollow-up to the 2013 high-level meeting of the General Assembly on nuclear \ndisarmament\u201d. \n \n42nd plenary meeting \n4 December 2023 \n \n",
  "paragraphs": {
    "1": "Underlines the strong support, expressed at the high-level meeting of the General Assembly on nuclear disarmament, held on 26 September 2013, for taking urgent and effective measures to achieve the total elimination of nuclear weapons; __________________ 1 Resolution 55/2. 2 A/78/133. 3 A/CONF.229/2017/8. 4 United Nations, Treaty Series, vol. 729, No. 10485. Follow-up to the 2013 high-level meeting of the General Assembly on nuclear disarmament A/RES/78/27 3/4 23-24531",
    "2": "Calls for urgent compliance with the legal obligations and the fulfilment of the commitments undertaken on nuclear disarmament;",
    "3": "Endorses the wide support expressed at the high-level meeting for a comprehensive convention on nuclear weapons;",
    "4": "Calls for the urgent commencement of negotiations in the Conference on Disarmament on effective nuclear disarmament measures to achieve the total elimination of nuclear weapons, including, in particular, on a comprehensive convention on nuclear weapons;",
    "5": "Decides to convene, in New York, on a date to be decided later, a United Nations high-level international conference on nuclear disarmament to review the progress made in this regard;",
    "6": "Takes note of the views provided by Member States with regard to achieving the objective of the total elimination of nuclear weapons, in particular on the elements of a comprehensive convention on nuclear weapons, as reflected in the report submitted by the Secretary-General pursuant to resolution 77/47, and requests the Secretary-General to forward this report to the Conference on Disarmament and the Disarmament Commission for their early consideration;",
    "7": "Welcomes the commemoration and promotion of 26 September as the International Day for the Total Elimination of Nuclear Weapons devoted to furthering this objective;",
    "8": "Expresses its appreciation to Member States, the United Nations system and civil society, including non-governmental organizations, academia, parliamentarians, the mass media and individuals that developed activities in promotion of the International Day for the Total Elimination of Nuclear Weapons;",
    "9": "Reiterates its request to the President of the General Assembly to organize, on 26 September every year, a one-day high-level plenary meeting of the Assembly to commemorate and promote the International Day for the Total Elimination of Nuclear Weapons;",
    "10": "Decides that the aforementioned high-level plenary meeting shall be held with the participation of Member and observer States, represented at the highest possible level, as well as with the participation of the President of the General Assembly and the Secretary-General;",
    "11": "Requests the Secretary-General to continue to update the platform for the promotion of these activities and to undertake all the arrangements, providing all the necessary resources and services, including webcasts, to commemorate and promote the International Day for the Total Elimination of Nuclear Weapons, including through the United Nations Offices at Geneva and Vienna, as well as the United Nations regional centres for peace and disarmament;",
    "12": "Calls upon Member States, the United Nations system and civil society, including non-governmental organizations, academia, parliamentarians, the mass media and individuals, to commemorate and promote the International Day for the Total Elimination of Nuclear Weapons through all means of educational and public awareness-raising activities about the threat posed to humanity by nuclear weapons and the necessity for their total elimination in order to mobilize international efforts towards achieving the common goal of a nuclear-weapon-free world;",
    "13": "Requests the Secretary-General to seek the views of Member States with regard to achieving the objective of the total elimination of nuclear weapons, in particular on effective nuclear disarmament measures, including elements of a comprehensive convention on nuclear weapons, and to submit a report thereon to the A/RES/78/27 Follow-up to the 2013 high-level meeting of the General Assembly on nuclear disarmament 23-24531 4/4 General Assembly at its seventy-ninth session, and also to transmit the report to the Conference on Disarmament;",
    "14": "Also requests the Secretary-General to report on the implementation of the present resolution to the General Assembly at its seventy-ninth session;",
    "15": "Decides to include in the provisional agenda of its seventy-ninth session, under the item entitled \u201cGeneral and complete disarmament\u201d, the sub-item entitled \u201cFollow-up to the 2013 high-level meeting of the General Assembly on nuclear disarmament\u201d. 42nd plenary meeting 4 December 2023"
  },
  "agenda_items": [
    "Item 99"
  ],
  "symbol_references": []
}