{
  "symbol": "A/RES/74/246",
  "filename": "A_RES_74_246.pdf",
  "title": "74/246. Situation of human rights of Rohingya Muslims and other minorities in Myanmar",
  "text": "United Nations \nA/RES/74/246\n \n \nGeneral Assembly \nDistr.: General \n15 January 2020 \n \n19-22672 (E)    200120 \n*1922672* \n \n \nSeventy-fourth session \nAgenda item 70 (c) \nPromotion and protection of human rights: human rights \nsituations and reports of special rapporteurs \nand representatives \n \n \n \n \n Resolution adopted by the General Assembly on \n27 December 2019 \n \n \n \n \n[on the report of the Third Committee (A/74/399/Add.3)] \n \n \n 74/246. Situation of human rights of Rohingya Muslims and other \nminorities in Myanmar \n \n \nThe General Assembly, \n \nGuided by the Charter of the United Nations and the Universal Declaration of \nHuman Rights,1 the International Covenants on Human Rights 2 and other relevant \ninternational law and human rights law instruments,  \n \nReaffirming its previous resolutions on the situation of human rights in \nMyanmar, the most recent of which being resolutions 73/264 of 22 December 2018 \nand 72/248 of 24 December 2017, and recalling the resolutions and decisions of the \nHuman Rights Council, the most recent of which being resolutions 42/3 of \n26 September 2019, 3 39/2 of 27 September 2018, 4 37/32 of 23 March 2018 5 and \nS-27/1 of 5 December 2017,6 and the presidential statement issued by the Security \nCouncil on 6 November 2017,7 as well as Security Council resolution 2467 (2019) of \n23 April 2019, \n \nWelcoming the work and the reports of the Special Rapporteur on the situation \nof human rights in Myanmar, while deeply regretting the decision of the Government \n__________________ \n \n1  Resolution 217 A (III). \n \n2  Resolution 2200 A (XXI). \n \n3  Official Records of the General Assembly, Seventy-fourth Session, Supplement No. 53A \n(A/74/53/Add.1), chap. II. \n \n4  Ibid., Seventy-third Session, Supplement No. 53A (A/73/53/Add.1), chap. II. \n \n5  Ibid., Supplement No. 53 (A/73/53), chap. IV, sect. A. \n \n6  Ibid., chap. III. \n \n7  S/PRST/2017/22. \n\nA/RES/74/246 \nSituation of human rights of Rohingya Muslims and\nother minorities in Myanmar\n \n19-22672\n2/8 \n \nof Myanmar to discontinue cooperation with the Special Rapporteur and to deny her \naccess to the country since January 2018,  \n \nWelcoming also the work of the Special Envoy of the Secretary-General on \nMyanmar, and encouraging her further engagement and dialogue with the \nGovernment of Myanmar and other relevant stakeholders and affected populations,  \n \nWelcoming further the first report to the General Assembly of the ongoing \nindependent mechanism established by the Human Rights Council in its resolution \n39/2,8 and its operationalization, as well as the appointment of its head, \n \nWelcoming the work of the independent international fact-finding mission on \nMyanmar, including its final report9 and all its other reports, including the reports on \nthe economic interests of the Myanmar military and on sexual and gender-based \nviolence in Myanmar and the gendered impact of its ethnic conflicts, and furthermore \ndeeply regretting that the Government of Myanmar did not cooperate with the fact-\nfinding mission, \n \nRecognizing the complementary and mutually reinforcing work of the various \nUnited Nations mandate holders and mechanisms working on Myanmar to improve \nthe situation of human rights in Myanmar,  \n \nNoting the importance of the role of regional organizations in efforts to achieve \npacific settlement of local disputes, as stipulated in Chapter VIII of the Charter, while \nnoting that such efforts do not preclude action under Chapter VI of the Charter,  \n \nAcknowledging the efforts of the Organization of Islamic Cooperation, \nalongside relevant international efforts, aimed at bringing peace and stability to \nRakhine State, including through the appointment by the Organization of a new \nspecial envoy to Myanmar,  \n \nWelcoming the report of the Secretary-General,10 \n \nCondemning all violations and abuses of human rights in Myanmar, including \nagainst Rohingya Muslims and other minorities in Rakhine, Kachin and Shan States, \nand expressing deep concern at the reports of ongoing human rights violations, as also \nnoted by the United Nations High Commissioner for Human Rights in her oral update \non 10 July 2019, as well as at the ongoing non-cooperation of the Government of \nMyanmar and the denial of access to United Nations mechanisms, including the \nSpecial Rapporteur on the situation of human rights in Myanmar and the Independent \nMechanism,  \n \nContinuing to underline the need for the security and armed forces of Myanmar \nto cease all actions that run counter to the protection of all persons within the country, \nincluding those belonging to the Rohingya community, by respecting international \nlaw, including international human rights law and international humanitarian law, and \nending the violence, including sexual violence, and calling for urgent steps to ensure \njustice in respect of all human rights violations and violations of international \nhumanitarian law so that those displaced by violence are able to voluntarily return in \nsafety and dignity to their places of origin or to a place of their choice in a sustainable \nmanner, \n \nCalling for an immediate cessation of fighting and hostilities, of targeting of \ncivilians and of all violations and abuses of international human rights law and \ninternational humanitarian law in northern Myanmar, and recognizing the need for \n__________________ \n \n8  See A/74/278. \n \n9  A/HRC/42/50. \n \n10  A/74/311. \n\nSituation of human rights of Rohingya Muslims and  \nother minorities in Myanmar \nA/RES/74/246\n \n3/8\n19-22672 \n \ncontinued de-escalation and an enduring ceasefire, best achieved by dialogue between \nall parties, as a necessary means of improving the human rights situation,  \n \nReiterating its grave concern that, in spite of the fact that Rohingya Muslims \nlived in Myanmar for generations prior to the independence of Myanmar, they were \nmade stateless by the enactment of the 1982 Citizenship Law and were eventually \ndisenfranchised, in 2015, from the electoral process,  \n \nReaffirming that the denial of citizenship status and related rights to Rohingya \nMuslims and others, including voting rights, is a serious human rights concern,  \n \nReiterating its deep distress at reports that unarmed individuals in Rakhine State \nhave been and continue to be subjected to the excessive use of force and violations of \nhuman rights and international humanitarian law by the military and security and \narmed forces, including extrajudicial, summary or arbitrary killings, systematic rape \nand other forms of sexual and gender-based violence, arbitrary detention, enforced \ndisappearance and government seizure of Rohingya lands from which Rohingya \nMuslims were evicted and their homes destroyed, and remaining concerned by the \nprevious large-scale destruction of homes and systematic evictions in northern \nRakhine State, including the use of arson and violence, as well as the unlawful use of \nforce by non-State actors, \n \nRecalling the responsibility of States to comply with their relevant obligations, \nto prosecute those responsible for violations of international law, including \ninternational humanitarian law, international human rights law, international criminal \nlaw and international refugee law, as well as abuses of human rights, and to provide \nan effective remedy to any person whose rights have been violated, with a view to \nending impunity,  \n \nReiterating the urgent need to ensure that all those responsible for crimes related \nto violations and abuses of international law throughout Myanmar, including \ninternational human rights law, international humanitarian law and international \ncriminal law, are held to account through credible and independent national, regional \nor international justice mechanisms, while recalling the authority of the Security \nCouncil in this regard,  \n \nRecalling the establishment of an independent commission of inquiry by the \nGovernment of Myanmar on 30 July 2018 with a view to ensuring accountability for \nthe human rights violations and abuses committed in Rakhine State, reiterating that \nthe commission should conduct its work with independence, impartiality, \ntransparency and objectivity, and encouraging the commission to issue an initial \nreport and to cooperate with all relevant United Nations mandate holders,  \n \nRecalling also some steps taken by the Government of Myanmar to create the \nconditions necessary for refugees and other forcibly displaced persons to return to \ntheir places of origin or to a place of their choice voluntarily, in safety and dignity, \nbut regretting, however, that the situation has not improved in Rakhine State to create \nthe conditions necessary for refugees and other forcibly displaced persons to return \nto their places of origin voluntarily, safely and with dignity, \n \nExpressing concern that in northern Rakhine State, the implementation of \npolicies under the guise of economic development and reconstruction by the \nGovernment of Myanmar and the heavy militarization of the area have resulted in the \nalteration of the demographic structure, which further prevents the members of the \ndisplaced Rohingya Muslim population from returning to Rakhine State, \n \nRe-emphasizing the right of all refugees and the importance of internally \ndisplaced persons being able to return home in safety and dignity and in a voluntary \nand sustainable manner,  \n\nA/RES/74/246 \nSituation of human rights of Rohingya Muslims and\nother minorities in Myanmar\n \n19-22672\n4/8 \n \n \nNoting the extension for one year of the memorandum of understanding between \nMyanmar and the United Nations Development Programme and the Office of the \nUnited Nations High Commissioner for Refugees on assistance in the repatriation \nprocess of displaced persons from Rakhine State, and calling upon Myanmar to grant \nUnited Nations agencies unfettered access to northern Rakhine State so that they can \ncarry out this assistance, \n \nExpressing deep concern at the continued armed conflict and violence and \nabuses in a number of areas in Myanmar affecting tens of thousands of people, most \nnotably in Rakhine State, causing their forced displacement, and recognizing the need \nfor continued de-escalation and an enduring ceasefire as a necessary means of \nimproving the human rights situation,  \n \nAlarmed by the continued influx to Bangladesh over the last four decades of \n1.1 million Rohingya Muslims, including the 744,000 who arrived since 25 August \n2017 in the aftermath of atrocities committed by the security and armed forces of \nMyanmar,  \n \nExpressing deep concern over the virulent and rapid spread of false news, hate \nspeech and inflammatory rhetoric, in particular through social media, tolerated by the \nauthorities of Myanmar,  \n \nNoting the steps taken by the Government of Myanmar towards establishing a \nnational strategy for the sustainable closure of camps for internally displaced persons \nin Myanmar,  \n \nAlarmed by the findings of the independent international fact-finding mission \non Myanmar of evidence of gross human rights violations and abuses suffered by \nRohingya Muslims and other minorities, perpetrated by the security and armed forces \nof Myanmar, which, according to the fact-finding mission, undoubtedly amount to the \ngravest crimes under international law, \n \nUnderlining the urgency of the call by the Secretary-General for increased \nefforts to implement the recommendations of the Advisory Commission on Rakhine \nState, to address the root causes of the crisis, including those on access to citizenship \nfor the Rohingya, freedom of movement, the elimination of systematic segregation \nand all forms of discrimination, and inclusive and equal access to health services and \neducation, and birth registration, in full consultation with all ethnic and minority \ngroups and persons in vulnerable situations, including on matters of citizenship for \nRohingya Muslims, \n \nWelcoming the commitment of the Secretary-General to implementing the \nrecommendations made by the independent inquiry into the involvement of the United \nNations in Myanmar from 2010 to 2018, \n \nReiterating its urgent call upon the Government of Myanmar to sustain the \ndemocratic transition of Myanmar by bringing all national institutions, including the \nmilitary, under the democratically elected civilian Government, \n \nWelcoming the involvement of the Association of Southeast Asian Nations in \naddressing the situation in Rakhine State, including through carrying out \nhumanitarian assessments in northern Rakhine State through its Coordinating Centre \nfor Humanitarian Assistance on Disaster Management, and recognizing the need for \nclose engagement with the Rohingya refugee community, while encouraging close \ncooperation with all relevant United Nations agencies and international partners and \nto address the root causes of the conflict, so that affected communities can rebuild \ntheir lives there,  \n \n1. \nExpresses grave concern at continuing reports of serious human rights \nviolations and abuses as well as violations of international humanitarian law in \n\nSituation of human rights of Rohingya Muslims and  \nother minorities in Myanmar \nA/RES/74/246\n \n5/8\n19-22672 \n \nMyanmar against Rohingya Muslims and other minorities in Kachin, Rakhine and \nShan States, including those involving arbitrary arrests, deaths in detention, torture \nand other cruel, inhuman or degrading treatment or punishment, forced labour, \ndeprivation of economic and social rights, the forced displacement of more than a \nmillion Rohingya Muslims to Bangladesh, rape, sexual slavery and other forms of \nsexual and gender-based violence against women and children, as well as restrictions \non exercising the rights to freedom of religion or belief, expression and peaceful \nassembly; \n \n2. \nStrongly condemns all violations and abuses of human rights in Myanmar, \nand calls upon Myanmar, in particular its security and armed forces, to end \nimmediately all violence and all violations of international law in Myanmar, to ensure \nthe protection of the human rights of all persons in Myanmar, including of Rohingya \nMuslims and persons belonging to other minorities, and to take all measures necessary \nto provide justice to victims, to ensure full accountability and to end impunity for all \nviolations and abuses of human rights law and violations of international \nhumanitarian law, starting with a full, transparent and independent investigation into \nreports of all these violations; \n \n3. \nEmphasizes the importance of conducting international, independent, fair \nand transparent investigations into the gross human rights violations in Myanmar, \nincluding sexual and gender-based violence against women and children, and of \nholding accountable all those responsible for brutal acts and crimes against all \npersons, including the Rohingya Muslims, in order to deliver justice to victims using \nall legal instruments and domestic, regional and international judicial mechanisms; \n \n4. \nExpresses grave concern about the increasing restrictions on humanitarian \naccess, in particular in Rakhine State, and urges the Government of Myanmar to \ncooperate fully with and to grant full, unrestricted and unmonitored access to all \nUnited Nations mandate holders and human rights mechanisms, including the Special \nRapporteur on the situation of human rights in Myanmar, the Independent Mechanism \nand relevant United Nations agencies, and international and regional human rights \nbodies to independently monitor the situation of human rights, and to ensure that \nindividuals can cooperate without hindrance with these mechanisms and without fear \nof reprisal, intimidation or attack, and expresses deep concern that international \naccess to affected areas of northern Rakhine State remains severely restricted for the \ninternational community, including for United Nations agencies, humanitarian actors \nand international media;  \n \n5. \nCalls upon the United Nations to ensure that the Independent Mechanism \nis afforded the flexibility that it needs in terms of staffing, location and operational \nfreedom so it can deliver as effectively as possible on its mandate;  \n \n6. \nUrges the Independent Mechanism to swiftly advance its work and to \nensure the effective use of evidence of the most serious international crimes and \nviolations of international law collected by the independent international fact-finding \nmission on Myanmar; \n \n7. \nUrges the independent commission of inquiry of Myanmar to deliver \ntangible results on its work carried out so far with independence, impartiality, \ntransparency and objectivity in order to promote accountability, and to deliver a \ncredible report that acknowledges the human rights violations and mass atrocities \ncommitted in Rakhine State and that can lay the groundwork for confidence-building, \nand encourages the commission to cooperate with all relevant United Nations \nmandate holders;  \n \n8. \nReiterates the urgent call upon the Government of Myanmar:  \n\nA/RES/74/246 \nSituation of human rights of Rohingya Muslims and\nother minorities in Myanmar\n \n19-22672\n6/8 \n \n \n(a) \nTo manifest clear political will supported by concrete actions for the safe, \ndignified, voluntary and sustainable return and reintegration of Rohingya Muslims in \nMyanmar;  \n \n(b) \nTo take the necessary measures to address the spread of discrimination and \nprejudice and to combat the incitement of hatred against Rohingya Muslims and \npersons belonging to other minorities, and to publicly condemn such acts and combat \nhate speech, while fully respecting international human rights law, as well as to \npromote interfaith dialogue in cooperation with the international community and \nencourage political and religious leaders in the country to work towards reconciliation \namong communities and national unity through dialogue;  \n \n(c) \nTo expedite efforts to eliminate statelessness and the systematic and \ninstitutionalized discrimination against members of ethnic and religious minorities, \nin particular relating to Rohingya Muslims, by, inter alia, reviewing the 1982 \nCitizenship Law, which has led to deprivation of human rights, by ensuring equal \naccess to full citizenship through a transparent, voluntary and accessible procedure \nand to all civil and political rights, by allowing for self-identification, by amending \nor repealing all discriminatory legislation and policies, including discriminatory \nprovisions of the set of \u201cprotection of race and religion laws\u201d enacted in 2015 \ncovering religious conversion, interfaith marriage, monogamy and population \ncontrol, and by lifting all local orders restricting rights to freedom of movement and \naccess to civil registration, health and education services and livelihoods;  \n \n(d) \nTo dismantle the camps for internally displaced persons in Rakhine State \nwith a clear timeline and without further delay, ensuring that the return and relocation \nof internally displaced persons is carried out in accordance with international \nstandards and best practices, in cooperation with the United Nations and the \ninternational community, including as set forth in the Guiding Principles on Internal \nDisplacement;11 \n \n(e) \nTo ensure full protection of the human rights and fundamental freedoms \nof all persons in Myanmar, including Rohingya Muslims and persons belonging to \nother minorities, in an equal, non-discriminatory and dignified manner, in order to \nprevent further instability and insecurity, alleviate suffering, address the root causes \nof the crisis and forge a viable, lasting and durable solution; \n \n(f) \nTo build trust among Rohingya Muslims in camps in Bangladesh, through \nconfidence-building measures, including direct communication between the \nRohingya representatives and the Myanmar authorities; \n \n(g) \nTo create the conditions necessary for the safe, voluntary, dignified and \nsustainable return of all refugees, including Rohingya Muslim refugees, particularly \nin view of the fact that Rohingya Muslims refused to return to Myanmar on two prior \noccasions that had been bilaterally set up between Bangladesh and Myanmar for \nrepatriation to commence, owing to the failure of the Government of Myanmar to \ncreate such conditions in Rakhine State;  \n \n(h) \nTo ensure the conduct of credible, inclusive and transparent general \nelections in 2020; \n \n(i) \nTo fulfil its human rights obligations and commitments to protect the right \nto freedom of expression, including online, and the rights to freedom of association \nand peaceful assembly, to create and maintain a safe and enabling environment for \ncivil society and independent media; \n__________________ \n \n11  E/CN.4/1998/53/Add.2, annex. \n\nSituation of human rights of Rohingya Muslims and  \nother minorities in Myanmar \nA/RES/74/246\n \n7/8\n19-22672 \n \n \n(j) \nTo fully implement all recommendations of the Advisory Commission on \nRakhine State to address the root causes of the crisis; \n \n9. \nUnderscores the importance of providing protection and assistance, \nincluding non-discriminatory access to services such as medical and psychosocial \ncare, specifically tailored to women and girls, especially those who are victims of \nsexual and gender-based violence and human trafficking; \n \n10. Reiterates its deep concern at the continued plight of Rohingya Muslim \nrefugees and forcibly displaced persons living in Bangladesh and in other countries, \nand appreciates the commitment by the Government of Bangladesh to provide \ntemporary shelter, humanitarian assistance and protection to them; \n \n11. \nNotes the establishment of the Inter-Ministerial Committee for the \nPrevention of the Six Grave Violations during Armed Conflict on 7 January 2019 by \nthe Government of Myanmar, and of the agreement by Parliament to the ratification \nof the Optional Protocol to the Convention on the Rights of the Child on the \ninvolvement of children in armed conflict,12 invites the Government to continue the \nimplementation of the action plan to end and prevent the recruitment and use of \nchildren by government forces, and calls upon the Government to engage with the \nUnited Nations in developing, adopting and implementing without undue delay \ncomprehensive action plans addressing killing, maiming, rape and other sexual \nviolence for which the Tatmadaw, including the integrated border forces, are listed in \nthe annual report of the Secretary General;  \n \n12. Welcomes the recent extension for one year of the memorandum of \nunderstanding between the Government of Myanmar, the United Nations \nDevelopment Programme and the Office of the United Nations High Commissioner \nfor Refugees to associate them to the implementation of bilateral arrangements with \nBangladesh on the return of displaced persons from Rakhine State, and emphasizes \nthe need for the Government of Myanmar to continue to cooperate fully with the \nGovernment of Bangladesh and with the United Nations, in particular the Office of \nthe United Nations High Commissioner for Refugees, and in consultation with the \npopulations concerned to enable the safe, voluntary, dignified, sustainable and well-\ninformed return of all refugees and forcibly displaced persons and internally displaced \npersons to their places of origin in Myanmar, and to give returnees freedom of \nmovement and unimpeded access to livelihoods, social services, including health \nservices, education and shelter, and to compensate them for all losses;  \n \n13. Expresses grave concern at the potential retraumatization of survivors of \nhuman rights violations and abuses, particularly child survivors and sexual violence \nsurvivors, and calls upon all actors engaging in documentation to follow the \u201cdo-no-\nharm\u201d principle for evidence-gathering in order to respect the dignity of survivors \nand to avoid retraumatization; \n \n14. Encourages Myanmar to continue to work with Bangladesh, in line with \nthe bilateral instruments on repatriation signed by Bangladesh and Myanmar, in order \nto expedite the creation of a conducive environment for the voluntary, safe, dignified \nand sustainable return of the forcibly displaced Rohingya in Bangladesh, with the full \nsupport and meaningful involvement of the international community, including the \nUnited Nations and its funds, programmes and agencies, and stresses the importance \nof meaningfully engaging with civil society;  \n \n15. Encourages the international community to (a) assist Bangladesh in \nproviding humanitarian assistance to Rohingya refugees and forcibly displaced \npersons until such time as they are voluntarily repatriated to Myanmar in safety and \n__________________ \n \n12  United Nations, Treaty Series, vol. 2173, No. 27531. \n\nA/RES/74/246 \nSituation of human rights of Rohingya Muslims and\nother minorities in Myanmar\n \n19-22672\n8/8 \n \ndignity; and (b) assist Myanmar in the provision of humanitarian assistance to \naffected persons of all communities who have been internally displaced, including \nthose in camps for internally displaced persons within Rakhine State; \n \n16. Urges the international community to support the 2019 joint response plan \nfor the Rohingya humanitarian crisis to ensure adequate resources for addressing the \nhumanitarian crisis;  \n \n17. Recognizes with appreciation the assistance and support of the \ninternational community, including regional organizations, in particular the \nAssociation of Southeast Asian Nations, and the countries neighbouring Myanmar, \nand encourages support for the Government of Myanmar in the fulfilment of its \ninternational human rights obligations and commitments, the implementation of its \ndemocratic transition process, inclusive socioeconomic development and sustainable \npeace, as well as its national reconciliation process involving all relevant \nstakeholders; \n \n18. Requests the Secretary-General: \n \n(a) \nTo continue to provide his good offices and to pursue his discussions \nrelating to Myanmar, involving all relevant stakeholders, and to offer assistance to \nthe Government of Myanmar; \n \n(b) \nTo extend the appointment of the Special Envoy on Myanmar and submit \nthe report of the Special Envoy covering all relevant issues addressed in the present \nresolution to the General Assembly at its seventy-fifth session; \n \n(c) \nTo provide all assistance necessary to enable the Special Envoy on \nMyanmar to effectively discharge her mandate and to report to Member States every \nsix months, or as warranted by the situation on the ground;  \n \n(d) \nTo identify ways in which the existing mandates can more effectively \ndeliver in their respective areas of responsibility concerning Myanmar and can \ncomplement each other\u2019s work through enhanced coordination;  \n \n(e) \nTo call the continued attention of the Security Council to the situation in \nMyanmar with concrete recommendations for action towards resolving the \nhumanitarian crisis, promoting the safe, dignified, voluntary and sustainable return of \nRohingya refugees and forcibly displaced persons and ensuring accountability for \nthose responsible for mass atrocities and human rights violations and abuses;  \n \n(f) \nTo fully implement the recommendations contained in the report of the \nindependent inquiry into the involvement of the United Nations in Myanmar from \n2010 to 2018; \n \n19. Requests that the Special Envoy continue to participate by way of \ninteractive dialogue in the seventy-fifth session of the General Assembly;  \n \n20. Decides to remain seized of the matter, inter alia, on the basis of the reports \nof the Secretary-General, the independent international fact-finding mission on \nMyanmar, the Independent Mechanism, the Special Rapporteur on the situation of \nhuman rights in Myanmar and the Special Envoy of the Secretary-General on \nMyanmar. \n \n52nd (resumed) plenary meeting \n27 December 2019 \n \n",
  "paragraphs": {
    "1": " Myanmar against Rohingya Muslims and other minorities in Kachin, Rakhine and Shan States, including those involving arbitrary arrests, deaths in detention, torture and other cruel, inhuman or degrading treatment or punishment, forced labour, deprivation of economic and social rights, the forced displacement of more than a million Rohingya Muslims to Bangladesh, rape, sexual slavery and other forms of sexual and gender-based violence against women and children, as well as restrictions on exercising the rights to freedom of religion or belief, expression and peaceful assembly;",
    "2": "Strongly condemns all violations and abuses of human rights in Myanmar, and calls upon Myanmar, in particular its security and armed forces, to end immediately all violence and all violations of international law in Myanmar, to ensure the protection of the human rights of all persons in Myanmar, including of Rohingya Muslims and persons belonging to other minorities, and to take all measures necessary to provide justice to victims, to ensure full accountability and to end impunity for all violations and abuses of human rights law and violations of international humanitarian law, starting with a full, transparent and independent investigation into reports of all these violations;",
    "3": "Emphasizes the importance of conducting international, independent, fair and transparent investigations into the gross human rights violations in Myanmar, including sexual and gender-based violence against women and children, and of holding accountable all those responsible for brutal acts and crimes against all persons, including the Rohingya Muslims, in order to deliver justice to victims using all legal instruments and domestic, regional and international judicial mechanisms;",
    "4": "Expresses grave concern about the increasing restrictions on humanitarian access, in particular in Rakhine State, and urges the Government of Myanmar to cooperate fully with and to grant full, unrestricted and unmonitored access to all United Nations mandate holders and human rights mechanisms, including the Special Rapporteur on the situation of human rights in Myanmar, the Independent Mechanism and relevant United Nations agencies, and international and regional human rights bodies to independently monitor the situation of human rights, and to ensure that individuals can cooperate without hindrance with these mechanisms and without fear of reprisal, intimidation or attack, and expresses deep concern that international access to affected areas of northern Rakhine State remains severely restricted for the international community, including for United Nations agencies, humanitarian actors and international media;",
    "5": "Calls upon the United Nations to ensure that the Independent Mechanism is afforded the flexibility that it needs in terms of staffing, location and operational freedom so it can deliver as effectively as possible on its mandate;",
    "6": "Urges the Independent Mechanism to swiftly advance its work and to ensure the effective use of evidence of the most serious international crimes and violations of international law collected by the independent international fact-finding mission on Myanmar;",
    "7": "Urges the independent commission of inquiry of Myanmar to deliver tangible results on its work carried out so far with independence, impartiality, transparency and objectivity in order to promote accountability, and to deliver a credible report that acknowledges the human rights violations and mass atrocities committed in Rakhine State and that can lay the groundwork for confidence-building, and encourages the commission to cooperate with all relevant United Nations mandate holders;",
    "8": " (a) To manifest clear political will supported by concrete actions for the safe, dignified, voluntary and sustainable return and reintegration of Rohingya Muslims in Myanmar; (b) To take the necessary measures to address the spread of discrimination and prejudice and to combat the incitement of hatred against Rohingya Muslims and persons belonging to other minorities, and to publicly condemn such acts and combat hate speech, while fully respecting international human rights law, as well as to promote interfaith dialogue in cooperation with the international community and encourage political and religious leaders in the country to work towards reconciliation among communities and national unity through dialogue; (c) To expedite efforts to eliminate statelessness and the systematic and institutionalized discrimination against members of ethnic and religious minorities, in particular relating to Rohingya Muslims, by, inter alia, reviewing the 1982 Citizenship Law, which has led to deprivation of human rights, by ensuring equal access to full citizenship through a transparent, voluntary and accessible procedure and to all civil and political rights, by allowing for self-identification, by amending or repealing all discriminatory legislation and policies, including discriminatory provisions of the set of \u201cprotection of race and religion laws\u201d enacted in 2015 covering religious conversion, interfaith marriage, monogamy and population control, and by lifting all local orders restricting rights to freedom of movement and access to civil registration, health and education services and livelihoods; (d) To dismantle the camps for internally displaced persons in Rakhine State with a clear timeline and without further delay, ensuring that the return and relocation of internally displaced persons is carried out in accordance with international standards and best practices, in cooperation with the United Nations and the international community, including as set forth in the Guiding Principles on Internal Displacement;11 (e) To ensure full protection of the human rights and fundamental freedoms of all persons in Myanmar, including Rohingya Muslims and persons belonging to other minorities, in an equal, non-discriminatory and dignified manner, in order to prevent further instability and insecurity, alleviate suffering, address the root causes of the crisis and forge a viable, lasting and durable solution; (f) To build trust among Rohingya Muslims in camps in Bangladesh, through confidence-building measures, including direct communication between the Rohingya representatives and the Myanmar authorities; (g) To create the conditions necessary for the safe, voluntary, dignified and sustainable return of all refugees, including Rohingya Muslim refugees, particularly in view of the fact that Rohingya Muslims refused to return to Myanmar on two prior occasions that had been bilaterally set up between Bangladesh and Myanmar for repatriation to commence, owing to the failure of the Government of Myanmar to create such conditions in Rakhine State; (h) To ensure the conduct of credible, inclusive and transparent general elections in 2020; (i) To fulfil its human rights obligations and commitments to protect the right to freedom of expression, including online, and the rights to freedom of association and peaceful assembly, to create and maintain a safe and enabling environment for civil society and independent media; (j) To fully implement all recommendations of the Advisory Commission on Rakhine State to address the root causes of the crisis;",
    "9": "Underscores the importance of providing protection and assistance, including non-discriminatory access to services such as medical and psychosocial care, specifically tailored to women and girls, especially those who are victims of sexual and gender-based violence and human trafficking;",
    "10": "Reiterates its deep concern at the continued plight of Rohingya Muslim refugees and forcibly displaced persons living in Bangladesh and in other countries, and appreciates the commitment by the Government of Bangladesh to provide temporary shelter, humanitarian assistance and protection to them;",
    "11": "Notes the establishment of the Inter-Ministerial Committee for the Prevention of the Six Grave Violations during Armed Conflict on 7 January 2019 by the Government of Myanmar, and of the agreement by Parliament to the ratification of the Optional Protocol to the Convention on the Rights of the Child on the involvement of children in armed conflict,12 invites the Government to continue the implementation of the action plan to end and prevent the recruitment and use of children by government forces, and calls upon the Government to engage with the United Nations in developing, adopting and implementing without undue delay comprehensive action plans addressing killing, maiming, rape and other sexual violence for which the Tatmadaw, including the integrated border forces, are listed in the annual report of the Secretary General;",
    "12": "Welcomes the recent extension for one year of the memorandum of understanding between the Government of Myanmar, the United Nations Development Programme and the Office of the United Nations High Commissioner for Refugees to associate them to the implementation of bilateral arrangements with Bangladesh on the return of displaced persons from Rakhine State, and emphasizes the need for the Government of Myanmar to continue to cooperate fully with the Government of Bangladesh and with the United Nations, in particular the Office of the United Nations High Commissioner for Refugees, and in consultation with the populations concerned to enable the safe, voluntary, dignified, sustainable and well- informed return of all refugees and forcibly displaced persons and internally displaced persons to their places of origin in Myanmar, and to give returnees freedom of movement and unimpeded access to livelihoods, social services, including health services, education and shelter, and to compensate them for all losses;",
    "13": "Expresses grave concern at the potential retraumatization of survivors of human rights violations and abuses, particularly child survivors and sexual violence survivors, and calls upon all actors engaging in documentation to follow the \u201cdo-no- harm\u201d principle for evidence-gathering in order to respect the dignity of survivors and to avoid retraumatization;",
    "14": "Encourages Myanmar to continue to work with Bangladesh, in line with the bilateral instruments on repatriation signed by Bangladesh and Myanmar, in order to expedite the creation of a conducive environment for the voluntary, safe, dignified and sustainable return of the forcibly displaced Rohingya in Bangladesh, with the full support and meaningful involvement of the international community, including the United Nations and its funds, programmes and agencies, and stresses the importance of meaningfully engaging with civil society;",
    "15": "Encourages the international community to (a) assist Bangladesh in providing humanitarian assistance to Rohingya refugees and forcibly displaced persons until such time as they are voluntarily repatriated to Myanmar in safety and dignity; and (b) assist Myanmar in the provision of humanitarian assistance to affected persons of all communities who have been internally displaced, including those in camps for internally displaced persons within Rakhine State;",
    "16": "Urges the international community to support the 2019 joint response plan for the Rohingya humanitarian crisis to ensure adequate resources for addressing the humanitarian crisis;",
    "17": "Recognizes with appreciation the assistance and support of the international community, including regional organizations, in particular the Association of Southeast Asian Nations, and the countries neighbouring Myanmar, and encourages support for the Government of Myanmar in the fulfilment of its international human rights obligations and commitments, the implementation of its democratic transition process, inclusive socioeconomic development and sustainable peace, as well as its national reconciliation process involving all relevant stakeholders;",
    "18": "Requests the Secretary-General: (a) To continue to provide his good offices and to pursue his discussions relating to Myanmar, involving all relevant stakeholders, and to offer assistance to the Government of Myanmar; (b) To extend the appointment of the Special Envoy on Myanmar and submit the report of the Special Envoy covering all relevant issues addressed in the present resolution to the General Assembly at its seventy-fifth session; (c) To provide all assistance necessary to enable the Special Envoy on Myanmar to effectively discharge her mandate and to report to Member States every six months, or as warranted by the situation on the ground; (d) To identify ways in which the existing mandates can more effectively deliver in their respective areas of responsibility concerning Myanmar and can complement each other\u2019s work through enhanced coordination; (e) To call the continued attention of the Security Council to the situation in Myanmar with concrete recommendations for action towards resolving the humanitarian crisis, promoting the safe, dignified, voluntary and sustainable return of Rohingya refugees and forcibly displaced persons and ensuring accountability for those responsible for mass atrocities and human rights violations and abuses; (f) To fully implement the recommendations contained in the report of the independent inquiry into the involvement of the United Nations in Myanmar from 2010 to 2018;",
    "19": "Requests that the Special Envoy continue to participate by way of interactive dialogue in the seventy-fifth session of the General Assembly;",
    "20": "Decides to remain seized of the matter, inter alia, on the basis of the reports of the Secretary-General, the independent international fact-finding mission on Myanmar, the Independent Mechanism, the Special Rapporteur on the situation of human rights in Myanmar and the Special Envoy of the Secretary-General on Myanmar."
  },
  "agenda_items": [
    "Item 70"
  ],
  "symbol_references": []
}