{
  "symbol": "A/RES/77/81",
  "filename": "A_RES_77_81.pdf",
  "title": "77/81. United Nations disarmament fellowship, training and advisory services",
  "text": "United Nations \nA/RES/77/81\n \n \nGeneral Assembly \nDistr.: General \n15 December 2022 \n \n22-28184 (E)    201222     \n*2228184* \n \n \nSeventy-seventh session \nAgenda item 100 (a) \nReview and implementation of the Concluding Document \nof the Twelfth Special Session of the General Assembly: \nUnited Nations disarmament fellowship, training and \nadvisory services  \n \n \n \n \n Resolution adopted by the General Assembly \non 7 December 2022 \n \n \n \n \n[on the report of the First Committee (A/77/386, para. 21)] \n \n \n \n77/81. United Nations disarmament fellowship, training and \nadvisory services \n \n \n \nThe General Assembly, \n \nHaving considered the report of the Secretary-General,1 \n \nRecalling its decision, contained in paragraph 108 of the Final Document of the \nTenth Special Session of the General Assembly, the first special session devoted to \ndisarmament,2 to establish a programme of fellowships on disarmament, as well as its \ndecisions contained in annex IV to the Concluding Document of the Twelfth Special \nSession of the General Assembly, the second special session devoted to disarmament, 3 \nincluding its decision to continue the programme, \n \nNoting that the programme continues to contribute significantly to developing \ngreater awareness of the importance and benefits of disarmament and a better \nunderstanding of the concerns of the international community in the field of \ndisarmament and security, as well as to enhancing the knowledge and skills of fellows, \nallowing them to participate more effectively in efforts in the field of disarmament at \nall levels, \n \nRecognizing the need for Member States to take into account gender equality \nwhen nominating candidates to the programme, \n__________________ \n \n1  A/77/117. \n \n2  Resolution S-10/2. \n \n3  Official Records of the General Assembly, Twelfth Special Session, Annexes, agenda items 9\u201313, \ndocument A/S-12/32. \n\nA/RES/77/81 \nUnited Nations disarmament fellowship,\n training and advisory services\n \n22-28184\n2/2 \n \n \nRecalling all the resolutions on the matter since the thirty-seventh session of the \nGeneral Assembly, in 1982, including resolution 50/71 A of 12 December 1995, \nresolution 73/73 of 5 December 2018 and resolution 75/74 of 7 December 2020, \n \nBelieving that the forms of assistance available under the programme to Member \nStates, in particular to developing countries, will enhance the capabilities of their \nofficials to follow ongoing deliberations and negotiations on disarmament, both \nbilateral and multilateral, \n \n1. \nReaffirms its decisions contained in annex IV to the Concluding Document \nof the Twelfth Special Session of the General Assembly and the guidelines approved \nby the Assembly in its resolution 33/71 E of 14 December 1978;4 \n \n2. \nNotes with satisfaction that the programme has trained 1,076 officials from \n170 Member States throughout its more than 44 years of existence, many of whom \nhold positions of responsibility in the field of disarmament within their own \nGovernments; \n \n3. \nExpresses its appreciation to all Member States and organizations that \nhave consistently supported the programme throughout the years, thereby \ncontributing to its success, in particular to the European Union and to the \nGovernments of Argentina, Brazil, Germany, Japan, Kazakhstan, Pakistan, the \nRepublic of Korea and Switzerland for continuing extensive and highly educative \nstudy visits for the participants in the programme during 2021 and 2022; \n \n4. \nExpresses its appreciation to the International Atomic Energy Agency, the \nOrganisation for the Prohibition of Chemical Weapons, the Preparatory Commission \nfor the Comprehensive Nuclear-Test-Ban Treaty Organization, the International Court \nof Justice, the International Criminal Court, the Organization for Security and \nCooperation in Europe and the Vienna Centre for Disarmament and Non-Proliferation \nfor organizing specific study programmes in the field of disarmament in their \nrespective areas of competence, thereby contributing to the objectives of the \nprogramme; \n \n5. \nEncourages Member States to leverage the knowledge of the United \nNations disarmament fellows as a useful resource on matters related to disarmament \nand international security; \n \n6. \nCommends the Secretary-General for the diligence with which the \nprogramme has continued to be carried out; \n \n7. \nRequests the Secretary-General to continue to implement annually the \nprogramme within existing resources and to report thereon to the General Assembly \nat its seventy-ninth session; \n \n8. \nDecides to include in the provisional agenda of its seventy-ninth session, \nunder the item entitled \u201cReview and implementation of the Concluding Document of \nthe Twelfth Special Session of the General Assembly\u201d, the sub-item entitled \u201cUnited \nNations disarmament fellowship, training and advisory services\u201d. \n \n46th plenary meeting \n7 December 2022 \n \n__________________ \n \n4  A/33/305. \n",
  "paragraphs": {
    "1": "Reaffirms its decisions contained in annex IV to the Concluding Document of the Twelfth Special Session of the General Assembly and the guidelines approved by the Assembly in its resolution 33/71 E of 14 December 1978;4",
    "2": "Notes with satisfaction that the programme has trained 1,076 officials from 170 Member States throughout its more than 44 years of existence, many of whom hold positions of responsibility in the field of disarmament within their own Governments;",
    "3": "Expresses its appreciation to all Member States and organizations that have consistently supported the programme throughout the years, thereby contributing to its success, in particular to the European Union and to the Governments of Argentina, Brazil, Germany, Japan, Kazakhstan, Pakistan, the Republic of Korea and Switzerland for continuing extensive and highly educative study visits for the participants in the programme during 2021 and 2022;",
    "4": "Expresses its appreciation to the International Atomic Energy Agency, the Organisation for the Prohibition of Chemical Weapons, the Preparatory Commission for the Comprehensive Nuclear-Test-Ban Treaty Organization, the International Court of Justice, the International Criminal Court, the Organization for Security and Cooperation in Europe and the Vienna Centre for Disarmament and Non-Proliferation for organizing specific study programmes in the field of disarmament in their respective areas of competence, thereby contributing to the objectives of the programme;",
    "5": "Encourages Member States to leverage the knowledge of the United Nations disarmament fellows as a useful resource on matters related to disarmament and international security;",
    "6": "Commends the Secretary-General for the diligence with which the programme has continued to be carried out;",
    "7": "Requests the Secretary-General to continue to implement annually the programme within existing resources and to report thereon to the General Assembly at its seventy-ninth session;",
    "8": "Decides to include in the provisional agenda of its seventy-ninth session, under the item entitled \u201cReview and implementation of the Concluding Document of the Twelfth Special Session of the General Assembly\u201d, the sub-item entitled \u201cUnited Nations disarmament fellowship, training and advisory services\u201d."
  },
  "agenda_items": [
    "Item 100",
    "Item 9"
  ],
  "symbol_references": []
}