{
  "symbol": "A/RES/72/182",
  "filename": "A_RES_72_182.pdf",
  "title": "72/182. Protection of and assistance to internally displaced persons",
  "text": "United Nations \nA/RES/72/182\n \n \nGeneral Assembly \nDistr.: General \n19 January 2018 \n \n17-23174 (E)    240118 \n*1723174* \n \n \nSeventy-second session \nAgenda item 72 (b) \n \n \n \n \n Resolution adopted by the General Assembly \non 19 December 2017 \n \n \n \n \n[on the report of the Third Committee (A/72/439/Add.2)] \n \n \n 72/182. Protection of and assistance to internally displaced persons \n \n \n \nThe General Assembly,  \n \nGuided by the purposes and principles of the Charter of the United Nations,  \n \nRecalling that internally displaced persons are persons or groups of persons who \nhave been forced or obliged to flee or to leave their homes or places of habitual \nresidence, in particular as a result of or in order to avoid the effects of armed conflict, \nsituations of generalized violence, violations of human rights or natural or human-\nmade disasters, and who have not crossed an internationally recognized State border, 1  \n \nRecognizing that internally displaced persons are to enjoy, in full equality, the \nsame rights and freedoms under international and domestic law as do other persons \nin their country,  \n \nDeeply disturbed by the alarmingly high numbers of internally displaced \npersons throughout the world, for reasons including violations and abuses of human \nrights and violations of international humanitarian law, armed conflict, persecution, \nviolence and other reasons, including terrorism, as well as natural and human-made \ndisasters, who receive inadequate protection and assistance, and conscious of the \nserious challenges that this is creating for host communities, national and local \nauthorities and the international community,  \n \nMindful of the significant humanitarian assistance required to meet the needs of \npeople in protracted situations of internal displacement and of the large gap between \nneeds and resources,  \n \nRecalling the very large number of people who are displaced within national \nborders and the potential for such persons to seek protection and assistance in other \ncountries as refugees or migrants, and noting the need for reflection on effective \nstrategies to ensure adequate protection and assistance for internally displaced \n__________________ \n \n1  See Guiding Principles on Internal Displacement (E/CN.4/1998/53/Add.2, annex), introduction, \npara. 2.  \n\nA/RES/72/182 \nProtection of and assistance to internally displaced persons\n \n17-23174 \n2/11 \n \npersons in this regard, including the need for comprehensive and disaggregated data \nand other measures aimed at preventing and reducing such displacements,  \n \nRecognizing the increase in the number and scale of natural disasters, including \nthose related to the adverse effects of climate change, which in certain instances may \ncontribute to displacement and additional pressure on host communities, encouraging \nthe United Nations and all relevant actors to strengthen efforts in cooperation with \nnational Governments aimed at addressing the needs of persons displaced internally \nby natural disasters, including those exacerbated by climate change, and noting in this \nregard the importance of sharing best practices to prevent and prepare for such \ndisplacements,  \n \nExpressing concern that many millions of people are displaced each year by \nsudden-onset disasters, and recognizing that disaster risk reduction and climate-\nchange adaptation measures can reduce disaster displacement risk, including through \nintegrating disaster risk reduction strategies into national, regional and global \ndevelopment policies and programmes,  \n \nRecognizing that the vulnerability of internally displaced persons may increase \nwhen their host communities are affected by disasters,  \n \nConscious of the human rights, humanitarian and development dimensions, as \nwell as the possible peacebuilding and transitional justice dimensions, of internal \ndisplacement, including in protracted displacement situations, and the responsibilities \nof States, with the support of the international community, to ensure the provision of \nprotection and assistance, including by respecting and protecting the human rights \nand fundamental freedoms of all internally displaced persons, with a view to finding \ndurable solutions,  \n \nConscious also of the specific needs of those who may be particularly \nvulnerable, including women, children, older persons and persons with disabilities, \nand the need to ensure that their specific needs are met through the provision of \nadequate protection and access to assistance,  \n \nRecognizing that the 2030 Agenda for Sustainable Development2 seeks to \naddress the needs of the most vulnerable, including internally displaced persons, and \nthat addressing the needs of internally displaced persons can help countries to achieve \ntheir overall development goals,  \n \nEmphasizing that States have the primary responsibility to provide protection \nand assistance to internally displaced persons within their jurisdiction, without \ndiscrimination, as well as to address the root causes of the displacement problem and \nto support all durable solutions in appropriate cooperation with those displaced, their \nhosts, civil society, local authorities, development actors, the private sector and the \ninternational community,  \n \nReaffirming that all persons, including those who are internally displaced, \nwithout discrimination, have the right to freedom of movement and residence and \nshould be protected against arbitrary displacement, \n \nNoting the need to address the root causes of displacement and for increased \nawareness within the international community of the issue of internal displacement \nworldwide, including the situation of millions living in protracted situations of \ndisplacement, many of them outside camp settings and in urban areas, and the urgency \nof providing adequate humanitarian assistance and protection to internally displaced \npersons, ensuring protection from landmines and other explosive remnants of war and \nsupporting host communities and local organizations,  \n__________________ \n \n2  Resolution 70/1.  \n\nProtection of and assistance to internally displaced persons \nA/RES/72/182\n \n3/11 \n17-23174 \n \n \nNoting also the need for finding durable solutions for internally displaced \npersons in their countries and addressing possible obstacles in this regard, and \nrecognizing that durable solutions include voluntary and sustainable return in safety \nand with dignity, as well as voluntary local integration in the areas to which persons \nhave been displaced or voluntary settlement in another part of the country, without \nprejudice to the right of internally displaced persons to leave their country or to seek \nasylum,  \n \nRecognizing the important contributions made by national and local authorities \nand host communities to protect and assist internally displaced persons, \nacknowledging that the hosting of large groups of internally displaced persons can \nput pressure on those authorities and communities, and recognizing also the \nimportance of supporting host communities, as well as local capacities, by addressing \ntheir needs,  \n \nEmphasizing that all durable solutions for internally displaced persons should \nbe approached from a humanitarian and development perspective and should involve \nthe timely engagement of internally displaced persons and host communities,  \n \nUnderlining the necessity of safe and unhindered humanitarian access for the \nrelevant United Nations agencies and humanitarian organizations to internally \ndisplaced persons, including those residing in conflict areas, in accordance with \ninternational law,  \n \nExpressing particular concern at the increased level of discrimination \nexperienced by internally displaced persons,  \n \nRecalling the relevant norms of international law, including international human \nrights law, international humanitarian law and international refugee law, and \nrecognizing that the protection of internally displaced persons has been strengthened \nby identifying, reaffirming and consolidating specific standards for their protection, \nin particular through the Guiding Principles on Internal Displacement, 3  \n \nRecalling also the relevance of international humanitarian law, including the \nGeneva Conventions of 19494 and the Additional Protocols thereto of 1977,5 as a vital \nlegal framework for the protection of and assistance to civilians in armed conflict and \nunder foreign occupation, including internally displaced persons,  \n \nRecognizing that violations of international humanitarian law can cause \ndisplacement, and recalling that displacement could be reduced if international \nhumanitarian law was respected by all parties to armed conflict, in particular the \nfundamental principles of distinction, proportionality and precaution, as well as the \nprohibition of forced displacement of the civilian population, unless the security of \nthe civilians involved or imperative military reasons so demand, 6  \n \nWelcoming the increasing dissemination, promotion, application and integration \ninto domestic laws and policies of the Guiding Principles on Internal Displacement \nwhen dealing with situations of internal displacement,  \n \nRecognizing that 2018 marks the twentieth anniversary of the issuance of the \nGuiding Principles on Internal Displacement, and acknowledging that this offers an \nimportant opportunity to raise awareness of those standards and of the plight of \ninternally displaced persons in all regions of the world,  \n__________________ \n \n3  E/CN.4/1998/53/Add.2, annex.  \n \n4  United Nations, Treaty Series, vol. 75, Nos. 970\u2013973.  \n \n5  Ibid., vol. 1125, Nos. 17512 and 17513.  \n \n6  Ibid., vol. 1125, No. 17513, arts. 13 and 17. \n\nA/RES/72/182 \nProtection of and assistance to internally displaced persons\n \n17-23174 \n4/11 \n \n \nDeploring practices of forced displacement and their negative consequences for \nthe enjoyment of human rights and fundamental freedoms by large groups of \npopulations, and recalling the relevant provisions of the Rome Statute of the \nInternational Criminal Court that define the deportation or forcible transfer of \npopulation as a crime against humanity and the unlawful deportation, transfer or \nordering of the displacement of the civilian population as war crimes, 7  \n \nExpressing its appreciation to those Governments and intergovernmental, \nregional and non-governmental organizations that have supported and facilitated the \nwork of the Special Rapporteur of the Human Rights Council on the human rights of \ninternally displaced persons, and of her predecessors, the former representatives of \nthe Secretary-General on the human rights of internally displaced persons, and have \nhelped, according to their roles and responsibilities, to provide protection and \nassistance to internally displaced persons,  \n \nWelcoming the continuing cooperation between the Special Rapporteur and \nnational Governments and the relevant offices and agencies of the United Nations as \nwell as with other international and regional organizations, and encouraging further \nstrengthening of this collaboration in order to promote better strategies for, protection \nof, assistance to and durable solutions for internally displaced persons,  \n \nAcknowledging with appreciation the important and independent contribution \nof the International Red Cross and Red Crescent Movement and other humanitarian \nagencies in protecting and assisting internally displaced persons, in cooperation with \nnational Governments and relevant international bodies,  \n \nWelcoming the priorities set by the Special Rapporteur as contained in the report \nto the Human Rights Council at its thirty-fifth session8 and the two strategic \nobjectives of supporting Governments in developing national instruments and \ninstitutions on internal displacement and facilitating viable, durable solutions for \ninternally displaced persons, including through the engagement of development \nactors,  \n \nRecalling the Vienna Declaration and Programme of Action adopted by the \nWorld Conference on Human Rights on 25 June 1993,9 regarding the need to develop \nglobal strategies to address the problem of internal displacement, and recalling also \nall relevant resolutions of the General Assembly and the Security Council,  \n \nRecalling also its resolution 70/165 of 17 December 2015 and Human Rights \nCouncil resolution 32/11 of 1 July 2016,10  \n \nReaffirming its resolution 46/182 of 19 December 1991 and the guiding \nprinciples contained in the annex thereto, other relevant General Assembly and \nEconomic and Social Council resolutions and agreed conclusions of the Council, \nreaffirming also the principles of humanity, neutrality, impartiality and independence \nin the provision of humanitarian assistance and reaffirming further the need for all \nactors engaged in the provision of humanitarian assistance in situations of complex \nemergencies and natural disasters to promote and fully respect these principles,  \n__________________ \n \n7  Ibid., vol. 2187, No. 38544, art. 7, paras. 1 (d) and 2 (d), and art. 8, paras. 2 (a) (vii) and 2 (e) (viii).  \n \n8  A/HRC/35/27, A/HRC/35/27/Add.1, A/HRC/35/27/Add.2 and A/HRC/35/27/Add.3.  \n \n9  A/CONF.157/24 (Part I), chap. III.  \n \n10  See Official Records of the General Assembly, Seventy-first Session, Supplement No. 53 \n(A/71/53), chap. V, sect. A.  \n\nProtection of and assistance to internally displaced persons \nA/RES/72/182\n \n5/11 \n17-23174 \n \n \n1. \nTakes note with appreciation of the main report of the Special Rapporteur \nof the Human Rights Council on the human rights of internally displaced persons 11 \nand the conclusions contained therein;  \n \n2. \nCommends the Special Rapporteur for the activities undertaken so far, for \nthe catalytic role that she plays in raising the level of awareness about the plight of \ninternally displaced persons and for her ongoing efforts to address their development \nand other specific needs, including through the mainstreaming of the human rights of \ninternally displaced persons into all relevant parts of the United Nations system;  \n \n3. \nEncourages the Special Rapporteur, through continuous dialogue with \nGovernments and all intergovernmental and non-governmental organizations \nconcerned, to continue her analysis of the reasons for internal displacement and to \nremain apprised of the needs and human rights of those who are displaced, including \nthe needs of those who may be in particularly vulnerable situations, including women, \nchildren, older persons and persons with disabilities, the level of emergency \npreparedness and ways to strengthen protection and assistance, including by \nenhancing the role of national human rights institutions, where appropriate, and the \nprotection of internally displaced persons, as well as durable solutions for internally \ndisplaced persons, including by addressing possible obstacles to the exercise of \nhousing, land and property rights for internally displaced persons, also encourages \nthe Special Rapporteur, with regard to the latter, to use, in her activities, the \nFramework on Durable Solutions for Internally Displaced Persons of the \nInter-Agency Standing Committee,12 and further encourages the Special Rapporteur \nto continue to advocate the needs of host communities and promote comprehensive \nstrategies, taking into account the primary responsibility of States for the protection \nof and assistance to internally displaced persons within their jurisdiction;  \n \n4. \nRecognizes the adverse effects of climate change as contributors to \nenvironmental degradation and extreme weather events, which may, among other \nfactors, contribute to human displacement, and in this regard notes the adoption of \nthe Sendai Framework for Disaster Risk Reduction 2015\u2013203013 in March 2015, the \nParis Agreement,14 adopted under the United Nations Framework Convention on \nClimate Change, in December 2015 and relevant initiatives related to internal \ndisplacement, such as the Nansen Initiative, and their follow-up processes, and \nencourages the Special Rapporteur, in close collaboration with States and \nintergovernmental and non-governmental organizations, to continue to explore the \nhuman rights implications and dimensions of disaster-induced internal displacement, \nwith a view to supporting Member States in their efforts to build local resilience and \ncapacity to prevent and prepare for displacement or to provide assistance through \nwell-planned recovery programmes that support internally displaced persons and their \nhosts and provide protection to those who are forced to flee;  \n \n5. \nAlso recognizes that internal displacement is not only a humanitarian but \nalso a development challenge, and calls upon States to provide durable solutions and \naddress possible obstacles in this regard and to include the needs, vulnerabilities and \ncapacities of internally displaced persons and host communities in their national \ndevelopment plans;  \n \n6. \nEncourages closer cooperation between development and humanitarian \nactors, in accordance with their respective mandates, towards collective results over \nmultiple years, with the aim of reducing the needs and vulnerabilities of internally \n__________________ \n \n11  A/HRC/35/27.  \n \n12  A/HRC/13/21/Add.4.  \n \n13  Resolution 69/283, annex II.  \n \n14  See FCCC/CP/2015/10/Add.1, decision 1/CP.21, annex.  \n\nA/RES/72/182 \nProtection of and assistance to internally displaced persons\n \n17-23174 \n6/11 \n \ndisplaced persons, in support of national priorities, while fully respecting the \nimportance of humanitarian principles for humanitarian action;  \n \n7. \nUrges all countries to integrate the 2030 Agenda for Sustainable \nDevelopment2 into their respective national policies and development frameworks, as \nappropriate, and recalls that the 2030 Agenda seeks to address the needs of the most \nvulnerable, including internally displaced persons;  \n \n8. \nRequests Member States to strengthen their efforts to ensure the protection \nof and better assistance to internally displaced persons, in particular to address the \nchallenges of protracted displacement, by adopting and implementing gender-\nsensitive policies and strategies, in accordance with national and regional \nframeworks, while recognizing the Guiding Principles on Internal Displacement 3 as \nan important international framework for the protection of internally displaced \npersons, and in this regard recognizes the central role of national and local authorities \nand institutions in addressing the specific needs of internally displaced persons and \nin finding solutions to displacement through, inter alia, continued and enhanced \ninternational support, upon request, for the capacity-building of States;  \n \n9. \nEncourages Member States, United Nations organizations, the Special \nRapporteur, regional organizations and national human rights institutions, as well as \nnon-governmental organizations and other stakeholders, to mark the twentieth \nanniversary of the issuance of the Guiding Principles on Internal Displacement so as \nto further demonstrate and strengthen collaboration on practices in addressing the \nchallenges of internal displacement;  \n \n10. Encourages strengthened international cooperation, in particular between \nhumanitarian and development actors, including through the provision of resources, \ncoherent multi-year planning that addresses protracted displacement and expertise to \nassist affected countries, in particular developing countries, in their national efforts \nand policies related to assistance, protection, resilience-building and rehabilitation \nfor internally displaced persons and host communities, as appropriate, and the \nintegration of the human rights and needs of internally displaced persons into both \nrural and urban development strategies, as well as the participation of both internally \ndisplaced persons and host communities in the design and implementation of those \nstrategies;  \n \n11. \nRecognizes that Member States have the primary responsibility to promote \ndurable solutions for their internally displaced persons, as well as to respect, protect \nand fulfil their human rights, thus contributing to their national, economic and social \ndevelopment processes, and encourages the international community, the United \nNations system, the Special Rapporteur, relevant international and regional \norganizations and donor countries to continue to support international, regional and \nnational efforts to meet the needs and fulfil the human rights of internally displaced \npersons on the basis of solidarity, the principles of international cooperation and the \nGuiding Principles on Internal Displacement and  to ensure that humanitarian \nassistance, early recovery and development assistance efforts are appropriately \nfunded;  \n \n12. Expresses deep concern at the threat posed by landmines, explosive \nremnants of war and improvised explosive devices to internally displaced persons \nfleeing conflict, impeding, in certain instances, their voluntary return, local \nintegration and resettlement and the safe delivery of humanitarian assistance;  \n \n13. Welcomes the initiatives undertaken by regional organizations, such as the \nAfrican Union, the International Conference on the Great Lakes Region, the \nOrganization of American States and the Council of Europe, to address the protection, \nassistance and development needs of internally displaced persons and to find durable \n\nProtection of and assistance to internally displaced persons \nA/RES/72/182\n \n7/11 \n17-23174 \n \nsolutions for them, and encourages regional organizations to strengthen their \nactivities and their cooperation with the Special Rapporteur;  \n \n14. Also welcomes the recent ratification by several States of the African \nUnion Convention for the Protection and Assistance of Internally Displaced Persons \nin Africa (Kampala Convention), which builds on the Protocol on the Protection of \nand Assistance to Internally Displaced Persons and the Protocol on the Property \nRights of Returning Persons, adopted by the International Conference on the Great \nLakes Region, and which marks a significant step towards strengthening the national \nand regional normative framework for the protection of and assistance to internally \ndisplaced persons in Africa, further welcomes the holding of the first Conference of \nStates Parties to the Convention in April 2017, encourages African States to sign \nand/or ratify the Convention, and encourages other regional mechanisms to develop \ntheir own regional normative frameworks for the protection of internally displaced \npersons;  \n \n15. Calls upon all parties to armed conflict to comply with their obligations \nunder international humanitarian law, and international human rights law, as \napplicable, with a view to preventing forced displacement and promoting the \nprotection of civilians, and calls upon Governments to take measures to respect and \nprotect the human rights of all internally displaced persons, without distinction of any \nkind, in accordance with their applicable obligations under international law;  \n \n16. Expresses particular concern that many internally displaced children, in \nparticular girls, lack access to education in all phases of displacement owing to attacks \nagainst schools, damaged or destroyed school buildings, insecurity, the prevalence of \nviolence, including gender-based violence, in and around schools, loss of \ndocumentation, language barriers and discrimination, calls upon States, in \ncooperation with all other relevant actors, including humanitarian and development \nagencies and donors, to ensure the right to a quality education, including primary and \nsecondary education, for internally displaced children, without discrimination of any \nkind, as well as to support existing schools to enable them to include internally \ndisplaced persons, calls upon all parties to armed conflict to respect the civilian \ncharacter of schools and other educational institutions and to refrain from undertaking \nactions that could adversely affect the protection of these buildings against direct \nattacks, and strongly condemns all attacks, as well as threats of attack, against \nschools, in contravention of international humanitarian law;  \n \n17. Also expresses particular concern about the full range of threats, \nviolations and abuses of human rights and violations of international humanitarian \nlaw experienced by many internally displaced persons, including women and \nchildren, who are particularly vulnerable or specifically targeted especially for sexual \nand gender-based violence and sexual exploitation and abuse, trafficking in persons, \nforced recruitment and abduction, encourages the continued commitment of the \nSpecial Rapporteur to promote action to address their particular assistance and \nprotection needs, and calls upon States, in cooperation with international agencies \nand other stakeholders, to provide protection and assistance to internally displaced \npersons who are victims of the above-mentioned threats, violations and abuses, as \nwell as other groups of internally displaced persons with special needs, such as \nseverely traumatized individuals, older persons and persons with disabilities, taking \ninto account all relevant resolutions of the General Assembly and the Security \nCouncil;  \n \n18. Emphasizes the importance of communication and consultation with \ninternally displaced persons and host communities by Governments and other relevant \nactors, in accordance with their specific mandates, during all phases of displacement, \nas well as the participation of internally displaced persons, where appropriate, in \n\nA/RES/72/182 \nProtection of and assistance to internally displaced persons\n \n17-23174 \n8/11 \n \npolicies, programmes and activities pertaining to them, taking into account the \nprimary responsibility of States for the protection of and assistance to internally \ndisplaced persons within their jurisdiction;  \n \n19. Calls upon States, in cooperation with international agencies and other \nstakeholders, to provide for and support, in particular, the full and meaningful \nparticipation of internally displaced women at all levels of decision-making processes \nand in all activities that have a direct impact on their lives, in all aspects of internal \ndisplacement, including the promotion and protection of human rights, the prevention \nof human rights violations and the design and implementation of durable solutions, \npeace processes, peacebuilding, transitional justice, post-conflict reconstruction and \ndevelopment;  \n \n20. Notes the importance of taking the human rights and the specific protection \nand assistance needs of internally displaced persons into consideration, when \nappropriate, in peace processes, and emphasizes that durable solutions for internally \ndisplaced persons, including through voluntary return, sustainable reintegration, \nrehabilitation and reconciliation processes and their active participation, as \nappropriate, in the peace process are necessary elements of effective peacebuilding;  \n \n21. Welcomes the role of the Peacebuilding Commission in this regard, and \ncontinues to urge the Commission to intensify its efforts, within its mandate, in \ncooperation with national and transitional Governments and in consultation with the \nrelevant United Nations entities, to incorporate the rights and the specific needs of \ninternally displaced persons, including their voluntary return in safety and with \ndignity, reintegration and rehabilitation, as well as related land and property issues, \nwhen advising on or proposing country-specific peacebuilding strategies for \npost-conflict situations in cases under consideration;  \n \n22. Encourages the international community to provide technical cooperation \nto States affected by displacement, upon their request, including for the training of \nstaff members of institutions in charge of registration and development of national \nlaws and policies on internal displacement and issues related to land and property \nrestitution and compensation;  \n \n23. Welcomes the fact that an increasing number of States, United Nations \norganizations and regional and non-governmental organizations are applying the \nGuiding Principles on Internal Displacement as a standard, and encourages all \nrelevant actors to make use of the Guiding Principles when dealing with situations of \ninternal displacement;  \n \n24. Also welcomes the use of the Guiding Principles on Internal Displacement \nby the Special Rapporteur in her dialogue with Governments, intergovernmental and \nnon-governmental organizations and other relevant actors, and requests her to \ncontinue her efforts to further their dissemination, promotion, application and \nintegration into domestic laws and policies and to provide support for efforts to \npromote capacity-building and the use of the Guiding Principles, as well as the \ndevelopment of domestic legislation and policies;  \n \n25. Expresses its appreciation for the fact that an increasing number of States \nhave adopted domestic legislation and policies dealing with all stages of \ndisplacement, encourages States to continue to do so in an inclusive and \nnon-discriminatory way, consistent with the Guiding Principles on Internal \nDisplacement, urges States to increase their efforts to implement such domestic laws \nand policies, including through the identification of national focal points within \nGovernments for issues of internal displacement, in particular for setting national \ntargets and indicators for policy and programmes and for the allocation of budget \n\nProtection of and assistance to internally displaced persons \nA/RES/72/182\n \n9/11 \n17-23174 \n \nresources, and encourages the international community and national actors to provide \nfinancial support and cooperation to Governments, upon request, in this regard;  \n \n26. Urges all Governments to continue to facilitate the activities of the Special \nRapporteur, in particular Governments with situations of internal displacement, and \nto respond favourably to requests from the Special Rapporteur to enable her to \ncontinue and enhance dialogue with Governments in addressing situations of internal \ndisplacement, and thanks those Governments that have already done so;  \n \n27. Invites Governments to give serious consideration, in dialogue with the \nSpecial Rapporteur, to the recommendations and suggestions addressed to them, in \naccordance with her mandate, and to inform her of measures taken thereon;  \n \n28. Calls upon Governments to provide protection and assistance, including \nreintegration and development assistance, to internally displaced persons and to \nfacilitate the efforts of the relevant United Nations agencies and humanitarian \norganizations in this regard by allowing and facilitating safe and unhindered access \nfor  humanitarian personnel and the delivery of supplies and equipment to internally \ndisplaced persons, in accordance with international law, by maintaining the civilian \nand humanitarian character of camps and settlements for internally displaced persons, \nwhere they exist, and by taking the steps necessary to ensure the safety and security \nof humanitarian personnel so that they may efficiently perform their task of assisting \ninternally displaced persons;  \n \n29. Emphasizes the central role of the Emergency Relief Coordinator in the \ncoordination of the protection of and assistance to internally displaced persons, inter \nalia, through the inter-agency cluster system, welcomes continued initiatives to \nensure better protection, assistance and development strategies for internally \ndisplaced persons, as well as better coordination of activities regarding them, and \nemphasizes the need to strengthen the capacities of national and local authorities, host \ncommunities, local organizations, United Nations organizations and other relevant \nactors to meet the immense humanitarian challenges of internal displacement;  \n \n30. Encourages all relevant United Nations organizations and humanitarian \nassistance, human rights and development organizations to enhance their \ncollaboration and coordination through the Inter-Agency Standing Committee and \nUnited Nations country teams in countries with situations of internal displacement \nand to provide all possible assistance and support to the Special Rapporteur, and \nrequests the continued participation of the Special Rapporteur in the work of the \nInter-Agency Standing Committee and its subsidiary bodies;  \n \n31. Encourages \nthe \nInter-Agency \nStanding \nCommittee \nto \nenhance \ncoordination, effectiveness, efficiency and predictability in preventing, responding to \nand finding solutions to internal displacement;  \n \n32. Encourages Member States, humanitarian agencies, donors, development \nactors and other providers of development assistance to continue to work together, in \nclose cooperation with the Special Rapporteur, to provide a more predictable response \nto the needs of internally displaced persons, including long-term development \nassistance for the implementation of durable solutions, with a view to reducing \ninternal displacement, takes note of the decision of the Policy Committee of the \nSecretary-General of 4 October 2011 endorsing the preliminary framework on ending \ndisplacement in the aftermath of conflict, notes the roll-out of the decision in selected \ncountries and the lessons learned in that regard, and calls for United Nations agencies \nimplementing the decision to cooperate closely with the Special Rapporteur in that \nregard and to use the Framework on Durable Solutions for Internally Displaced \nPersons of the Inter-Agency Standing Committee12 in a manner that complements the \ndecision of the Policy Committee;  \n\nA/RES/72/182 \nProtection of and assistance to internally displaced persons\n \n17-23174 \n10/11 \n \n \n33. Notes with appreciation the increased attention paid to the issue of \ninternally displaced persons in humanitarian response plans, and encourages further \nefforts in this regard;  \n \n34. Expresses deep concern at the insufficient funding levels of humanitarian \nappeals, and in this respect urges all relevant actors to provide the relevant United \nNations agencies and humanitarian organizations with sufficient and predictable \nresources to ensure adequate support for those who are forcibly displaced;  \n \n35. Notes with appreciation the increasing role of national human rights \ninstitutions in assisting internally displaced persons and in promoting and protecting \ntheir human rights;  \n \n36. Recognizes the need to collect reliable, timely, longitudinal and \ndisaggregated data, including data disaggregated by sex, age, disability and location, \non internally displaced persons and the impact of protracted displacement on host \ncommunities in order to improve policy and programming, preventive measures on \nand response to internal displacement and to promote the achievement of durable \nsolutions, including, in this respect, the relevance of the Global Internal Displacement \nDatabase maintained by the Internal Displacement Monitoring Centre and the \ntechnical support available from the inter-agency Joint Internally Displaced Person \nProfiling Service;  \n \n37. Encourages Member States, members of the Inter-Agency Standing \nCommittee, United Nations humanitarian coordinators and country teams to \ncontribute to the provision of reliable data on internal displacement situations, with \nthe cooperation of the Internal Displacement Monitoring Centre and the technical \nsupport and assistance of the Joint Internally Displaced Person Profiling Service, and \nto provide financial resources, as appropriate, in these respects;  \n \n38. Affirms the need for the effective implementation of the Sendai Framework \nfor Disaster Risk Reduction 2015\u2013203013 to integrate post-disaster reconstruction and \nrecovery, including the principle of \u201cbuild back better\u201d, into the economic and social \nsustainable development of affected areas, as well as temporary settlements where \ndisplaced persons live, to promote periodic disaster preparedness and response \nexercises in recovery and resettlement efforts, with a view to ensuring a rapid and \neffective response to disasters and related displacement, and to promote \ntransboundary cooperation to build resilience and reduce disaster risk, including \ndisplacement risk;  \n \n39. Takes note of the first World Humanitarian Summit, held in Istanbul, \nTurkey, on 23 and 24 May 2016, and also takes note of the report of the Secretary-\nGeneral on the outcome of the World Humanitarian Summit, 15 which contains, \ninter alia, recommendations to strengthen partnerships between Member States and \nhumanitarian and development actors to address the urgent and long-term needs of \ninternally displaced persons;  \n \n40. Welcomes the New Urban Agenda adopted at the United Nations \nConference on Housing and Sustainable Urban Development (Habitat III), held in \nQuito from 17 to 20 October 2016,16 urges the United Nations, in that regard, to work \nclosely with Member States and other relevant actors, including local governments, \ncivil society and the private sector, to promote more effective emergency \npreparedness and response in urban areas, and notes the importance of addressing, as \nappropriate, the particular needs and vulnerabilities of internally displaced persons in \nurban settings and of supporting host cities, in the spirit of international cooperation;  \n__________________ \n \n15  A/71/353. \n \n16  Resolution 71/256, annex.  \n\nProtection of and assistance to internally displaced persons \nA/RES/72/182\n \n11/11 \n17-23174 \n \n \n41. Encourages Governments, United Nations agencies and other stakeholders \nto promote an inclusive approach to durable solutions that addresses the needs of \ninternally displaced persons and their host communities, including the promotion of \nopportunities to fully harness the human potential of the displaced populations by \npromoting self-sufficiency through income-generating activities and sustainable \nlivelihood opportunities;  \n \n42. Recalls the need to reflect on effective strategies to ensure adequate \nprotection and assistance for internally displaced persons and to prevent and reduce \nsuch displacement, and in this regard encourages the Secretary-General to work with \nMember States and the United Nations system to explore ways to better address the \nlong-term needs of internally displaced persons, support communities that host them \nand improve the lives of the many millions of internally displaced persons;  \n \n43. Requests the Secretary-General to continue to provide the Special \nRapporteur, from within existing resources, with all assistance necessary to \nstrengthen and carry out her mandate effectively, and encourages the Office of the \nUnited Nations High Commissioner for Human Rights, in close cooperation with the \nEmergency Relief Coordinator, the Office for the Coordination of Humanitarian \nAffairs of the Secretariat, the Office of the United Nations High Commissioner for \nRefugees, the International Organization for Migration and all other relevant United \nNations offices and agencies and related organizations, to continue to support and \ncooperate with the Special Rapporteur;  \n \n44. Encourages the Special Rapporteur to continue to seek the contributions \nof States, relevant organizations and institutions in order to create a more stable basis \nfor her work;  \n \n45. Requests the Special Rapporteur to submit to the General Assembly at its \nseventy-third and seventy-fourth sessions a report on the implementation of the \npresent resolution;  \n \n46. Decides to continue its consideration of the question of protection of and \nassistance to internally displaced persons at its seventy-fourth session.  \n \n73rd plenary meeting  \n19 December 2017 \n \n",
  "paragraphs": {
    "1": "Takes note with appreciation of the main report of the Special Rapporteur of the Human Rights Council on the human rights of internally displaced persons 11 and the conclusions contained therein;",
    "2": "Commends the Special Rapporteur for the activities undertaken so far, for the catalytic role that she plays in raising the level of awareness about the plight of internally displaced persons and for her ongoing efforts to address their development and other specific needs, including through the mainstreaming of the human rights of internally displaced persons into all relevant parts of the United Nations system;",
    "3": "Encourages the Special Rapporteur, through continuous dialogue with Governments and all intergovernmental and non-governmental organizations concerned, to continue her analysis of the reasons for internal displacement and to remain apprised of the needs and human rights of those who are displaced, including the needs of those who may be in particularly vulnerable situations, including women, children, older persons and persons with disabilities, the level of emergency preparedness and ways to strengthen protection and assistance, including by enhancing the role of national human rights institutions, where appropriate, and the protection of internally displaced persons, as well as durable solutions for internally displaced persons, including by addressing possible obstacles to the exercise of housing, land and property rights for internally displaced persons, also encourages the Special Rapporteur, with regard to the latter, to use, in her activities, the Framework on Durable Solutions for Internally Displaced Persons of the Inter-Agency Standing Committee,12 and further encourages the Special Rapporteur to continue to advocate the needs of host communities and promote comprehensive strategies, taking into account the primary responsibility of States for the protection of and assistance to internally displaced persons within their jurisdiction;",
    "4": "Recognizes the adverse effects of climate change as contributors to environmental degradation and extreme weather events, which may, among other factors, contribute to human displacement, and in this regard notes the adoption of the Sendai Framework for Disaster Risk Reduction 2015\u2013203013 in March 2015, the Paris Agreement,14 adopted under the United Nations Framework Convention on Climate Change, in December 2015 and relevant initiatives related to internal displacement, such as the Nansen Initiative, and their follow-up processes, and encourages the Special Rapporteur, in close collaboration with States and intergovernmental and non-governmental organizations, to continue to explore the human rights implications and dimensions of disaster-induced internal displacement, with a view to supporting Member States in their efforts to build local resilience and capacity to prevent and prepare for displacement or to provide assistance through well-planned recovery programmes that support internally displaced persons and their hosts and provide protection to those who are forced to flee;",
    "5": "Also recognizes that internal displacement is not only a humanitarian but also a development challenge, and calls upon States to provide durable solutions and address possible obstacles in this regard and to include the needs, vulnerabilities and capacities of internally displaced persons and host communities in their national development plans;",
    "6": "Encourages closer cooperation between development and humanitarian actors, in accordance with their respective mandates, towards collective results over multiple years, with the aim of reducing the needs and vulnerabilities of internally __________________ 11 A/HRC/35/27. 12 A/HRC/13/21/Add.4. 13 Resolution 69/283, annex II. 14 See FCCC/CP/2015/10/Add.1, decision 1/CP.21, annex. A/RES/72/182 Protection of and assistance to internally displaced persons 17-23174 6/11 displaced persons, in support of national priorities, while fully respecting the importance of humanitarian principles for humanitarian action;",
    "7": "Urges all countries to integrate the 2030 Agenda for Sustainable Development2 into their respective national policies and development frameworks, as appropriate, and recalls that the 2030 Agenda seeks to address the needs of the most vulnerable, including internally displaced persons;",
    "8": "Requests Member States to strengthen their efforts to ensure the protection of and better assistance to internally displaced persons, in particular to address the challenges of protracted displacement, by adopting and implementing gender- sensitive policies and strategies, in accordance with national and regional frameworks, while recognizing the Guiding Principles on Internal Displacement 3 as an important international framework for the protection of internally displaced persons, and in this regard recognizes the central role of national and local authorities and institutions in addressing the specific needs of internally displaced persons and in finding solutions to displacement through, inter alia, continued and enhanced international support, upon request, for the capacity-building of States;",
    "9": "Encourages Member States, United Nations organizations, the Special Rapporteur, regional organizations and national human rights institutions, as well as non-governmental organizations and other stakeholders, to mark the twentieth anniversary of the issuance of the Guiding Principles on Internal Displacement so as to further demonstrate and strengthen collaboration on practices in addressing the challenges of internal displacement;",
    "10": "Encourages strengthened international cooperation, in particular between humanitarian and development actors, including through the provision of resources, coherent multi-year planning that addresses protracted displacement and expertise to assist affected countries, in particular developing countries, in their national efforts and policies related to assistance, protection, resilience-building and rehabilitation for internally displaced persons and host communities, as appropriate, and the integration of the human rights and needs of internally displaced persons into both rural and urban development strategies, as well as the participation of both internally displaced persons and host communities in the design and implementation of those strategies;",
    "11": "Recognizes that Member States have the primary responsibility to promote durable solutions for their internally displaced persons, as well as to respect, protect and fulfil their human rights, thus contributing to their national, economic and social development processes, and encourages the international community, the United Nations system, the Special Rapporteur, relevant international and regional organizations and donor countries to continue to support international, regional and national efforts to meet the needs and fulfil the human rights of internally displaced persons on the basis of solidarity, the principles of international cooperation and the Guiding Principles on Internal Displacement and to ensure that humanitarian assistance, early recovery and development assistance efforts are appropriately funded;",
    "12": "Expresses deep concern at the threat posed by landmines, explosive remnants of war and improvised explosive devices to internally displaced persons fleeing conflict, impeding, in certain instances, their voluntary return, local integration and resettlement and the safe delivery of humanitarian assistance;",
    "13": "Welcomes the initiatives undertaken by regional organizations, such as the African Union, the International Conference on the Great Lakes Region, the Organization of American States and the Council of Europe, to address the protection, assistance and development needs of internally displaced persons and to find durable Protection of and assistance to internally displaced persons A/RES/72/182 7/11 17-23174 solutions for them, and encourages regional organizations to strengthen their activities and their cooperation with the Special Rapporteur;",
    "14": "Also welcomes the recent ratification by several States of the African Union Convention for the Protection and Assistance of Internally Displaced Persons in Africa (Kampala Convention), which builds on the Protocol on the Protection of and Assistance to Internally Displaced Persons and the Protocol on the Property Rights of Returning Persons, adopted by the International Conference on the Great Lakes Region, and which marks a significant step towards strengthening the national and regional normative framework for the protection of and assistance to internally displaced persons in Africa, further welcomes the holding of the first Conference of States Parties to the Convention in April 2017, encourages African States to sign and/or ratify the Convention, and encourages other regional mechanisms to develop their own regional normative frameworks for the protection of internally displaced persons;",
    "15": "Calls upon all parties to armed conflict to comply with their obligations under international humanitarian law, and international human rights law, as applicable, with a view to preventing forced displacement and promoting the protection of civilians, and calls upon Governments to take measures to respect and protect the human rights of all internally displaced persons, without distinction of any kind, in accordance with their applicable obligations under international law;",
    "16": "Expresses particular concern that many internally displaced children, in particular girls, lack access to education in all phases of displacement owing to attacks against schools, damaged or destroyed school buildings, insecurity, the prevalence of violence, including gender-based violence, in and around schools, loss of documentation, language barriers and discrimination, calls upon States, in cooperation with all other relevant actors, including humanitarian and development agencies and donors, to ensure the right to a quality education, including primary and secondary education, for internally displaced children, without discrimination of any kind, as well as to support existing schools to enable them to include internally displaced persons, calls upon all parties to armed conflict to respect the civilian character of schools and other educational institutions and to refrain from undertaking actions that could adversely affect the protection of these buildings against direct attacks, and strongly condemns all attacks, as well as threats of attack, against schools, in contravention of international humanitarian law;",
    "17": "Also expresses particular concern about the full range of threats, violations and abuses of human rights and violations of international humanitarian law experienced by many internally displaced persons, including women and children, who are particularly vulnerable or specifically targeted especially for sexual and gender-based violence and sexual exploitation and abuse, trafficking in persons, forced recruitment and abduction, encourages the continued commitment of the Special Rapporteur to promote action to address their particular assistance and protection needs, and calls upon States, in cooperation with international agencies and other stakeholders, to provide protection and assistance to internally displaced persons who are victims of the above-mentioned threats, violations and abuses, as well as other groups of internally displaced persons with special needs, such as severely traumatized individuals, older persons and persons with disabilities, taking into account all relevant resolutions of the General Assembly and the Security Council;",
    "18": "Emphasizes the importance of communication and consultation with internally displaced persons and host communities by Governments and other relevant actors, in accordance with their specific mandates, during all phases of displacement, as well as the participation of internally displaced persons, where appropriate, in A/RES/72/182 Protection of and assistance to internally displaced persons 17-23174 8/11 policies, programmes and activities pertaining to them, taking into account the primary responsibility of States for the protection of and assistance to internally displaced persons within their jurisdiction;",
    "19": "Calls upon States, in cooperation with international agencies and other stakeholders, to provide for and support, in particular, the full and meaningful participation of internally displaced women at all levels of decision-making processes and in all activities that have a direct impact on their lives, in all aspects of internal displacement, including the promotion and protection of human rights, the prevention of human rights violations and the design and implementation of durable solutions, peace processes, peacebuilding, transitional justice, post-conflict reconstruction and development;",
    "20": "Notes the importance of taking the human rights and the specific protection and assistance needs of internally displaced persons into consideration, when appropriate, in peace processes, and emphasizes that durable solutions for internally displaced persons, including through voluntary return, sustainable reintegration, rehabilitation and reconciliation processes and their active participation, as appropriate, in the peace process are necessary elements of effective peacebuilding;",
    "21": "Welcomes the role of the Peacebuilding Commission in this regard, and continues to urge the Commission to intensify its efforts, within its mandate, in cooperation with national and transitional Governments and in consultation with the relevant United Nations entities, to incorporate the rights and the specific needs of internally displaced persons, including their voluntary return in safety and with dignity, reintegration and rehabilitation, as well as related land and property issues, when advising on or proposing country-specific peacebuilding strategies for post-conflict situations in cases under consideration;",
    "22": "Encourages the international community to provide technical cooperation to States affected by displacement, upon their request, including for the training of staff members of institutions in charge of registration and development of national laws and policies on internal displacement and issues related to land and property restitution and compensation;",
    "23": "Welcomes the fact that an increasing number of States, United Nations organizations and regional and non-governmental organizations are applying the Guiding Principles on Internal Displacement as a standard, and encourages all relevant actors to make use of the Guiding Principles when dealing with situations of internal displacement;",
    "24": "Also welcomes the use of the Guiding Principles on Internal Displacement by the Special Rapporteur in her dialogue with Governments, intergovernmental and non-governmental organizations and other relevant actors, and requests her to continue her efforts to further their dissemination, promotion, application and integration into domestic laws and policies and to provide support for efforts to promote capacity-building and the use of the Guiding Principles, as well as the development of domestic legislation and policies;",
    "25": "Expresses its appreciation for the fact that an increasing number of States have adopted domestic legislation and policies dealing with all stages of displacement, encourages States to continue to do so in an inclusive and non-discriminatory way, consistent with the Guiding Principles on Internal Displacement, urges States to increase their efforts to implement such domestic laws and policies, including through the identification of national focal points within Governments for issues of internal displacement, in particular for setting national targets and indicators for policy and programmes and for the allocation of budget Protection of and assistance to internally displaced persons A/RES/72/182 9/11 17-23174 resources, and encourages the international community and national actors to provide financial support and cooperation to Governments, upon request, in this regard;",
    "26": "Urges all Governments to continue to facilitate the activities of the Special Rapporteur, in particular Governments with situations of internal displacement, and to respond favourably to requests from the Special Rapporteur to enable her to continue and enhance dialogue with Governments in addressing situations of internal displacement, and thanks those Governments that have already done so;",
    "27": "Invites Governments to give serious consideration, in dialogue with the Special Rapporteur, to the recommendations and suggestions addressed to them, in accordance with her mandate, and to inform her of measures taken thereon;",
    "28": "Calls upon Governments to provide protection and assistance, including reintegration and development assistance, to internally displaced persons and to facilitate the efforts of the relevant United Nations agencies and humanitarian organizations in this regard by allowing and facilitating safe and unhindered access for humanitarian personnel and the delivery of supplies and equipment to internally displaced persons, in accordance with international law, by maintaining the civilian and humanitarian character of camps and settlements for internally displaced persons, where they exist, and by taking the steps necessary to ensure the safety and security of humanitarian personnel so that they may efficiently perform their task of assisting internally displaced persons;",
    "29": "Emphasizes the central role of the Emergency Relief Coordinator in the coordination of the protection of and assistance to internally displaced persons, inter alia, through the inter-agency cluster system, welcomes continued initiatives to ensure better protection, assistance and development strategies for internally displaced persons, as well as better coordination of activities regarding them, and emphasizes the need to strengthen the capacities of national and local authorities, host communities, local organizations, United Nations organizations and other relevant actors to meet the immense humanitarian challenges of internal displacement;",
    "30": "Encourages all relevant United Nations organizations and humanitarian assistance, human rights and development organizations to enhance their collaboration and coordination through the Inter-Agency Standing Committee and United Nations country teams in countries with situations of internal displacement and to provide all possible assistance and support to the Special Rapporteur, and requests the continued participation of the Special Rapporteur in the work of the Inter-Agency Standing Committee and its subsidiary bodies;",
    "31": "Encourages the Inter-Agency Standing Committee to enhance coordination, effectiveness, efficiency and predictability in preventing, responding to and finding solutions to internal displacement;",
    "32": "Encourages Member States, humanitarian agencies, donors, development actors and other providers of development assistance to continue to work together, in close cooperation with the Special Rapporteur, to provide a more predictable response to the needs of internally displaced persons, including long-term development assistance for the implementation of durable solutions, with a view to reducing internal displacement, takes note of the decision of the Policy Committee of the Secretary-General of 4 October 2011 endorsing the preliminary framework on ending displacement in the aftermath of conflict, notes the roll-out of the decision in selected countries and the lessons learned in that regard, and calls for United Nations agencies implementing the decision to cooperate closely with the Special Rapporteur in that regard and to use the Framework on Durable Solutions for Internally Displaced Persons of the Inter-Agency Standing Committee12 in a manner that complements the decision of the Policy Committee; A/RES/72/182 Protection of and assistance to internally displaced persons 17-23174 10/11",
    "33": "Notes with appreciation the increased attention paid to the issue of internally displaced persons in humanitarian response plans, and encourages further efforts in this regard;",
    "34": "Expresses deep concern at the insufficient funding levels of humanitarian appeals, and in this respect urges all relevant actors to provide the relevant United Nations agencies and humanitarian organizations with sufficient and predictable resources to ensure adequate support for those who are forcibly displaced;",
    "35": "Notes with appreciation the increasing role of national human rights institutions in assisting internally displaced persons and in promoting and protecting their human rights;",
    "36": "Recognizes the need to collect reliable, timely, longitudinal and disaggregated data, including data disaggregated by sex, age, disability and location, on internally displaced persons and the impact of protracted displacement on host communities in order to improve policy and programming, preventive measures on and response to internal displacement and to promote the achievement of durable solutions, including, in this respect, the relevance of the Global Internal Displacement Database maintained by the Internal Displacement Monitoring Centre and the technical support available from the inter-agency Joint Internally Displaced Person Profiling Service;",
    "37": "Encourages Member States, members of the Inter-Agency Standing Committee, United Nations humanitarian coordinators and country teams to contribute to the provision of reliable data on internal displacement situations, with the cooperation of the Internal Displacement Monitoring Centre and the technical support and assistance of the Joint Internally Displaced Person Profiling Service, and to provide financial resources, as appropriate, in these respects;",
    "38": "Affirms the need for the effective implementation of the Sendai Framework for Disaster Risk Reduction 2015\u2013203013 to integrate post-disaster reconstruction and recovery, including the principle of \u201cbuild back better\u201d, into the economic and social sustainable development of affected areas, as well as temporary settlements where displaced persons live, to promote periodic disaster preparedness and response exercises in recovery and resettlement efforts, with a view to ensuring a rapid and effective response to disasters and related displacement, and to promote transboundary cooperation to build resilience and reduce disaster risk, including displacement risk;",
    "39": "Takes note of the first World Humanitarian Summit, held in Istanbul, Turkey, on 23 and 24 May 2016, and also takes note of the report of the Secretary- General on the outcome of the World Humanitarian Summit, 15 which contains, inter alia, recommendations to strengthen partnerships between Member States and humanitarian and development actors to address the urgent and long-term needs of internally displaced persons;",
    "40": "Welcomes the New Urban Agenda adopted at the United Nations Conference on Housing and Sustainable Urban Development (Habitat III), held in Quito from 17 to 20 October 2016,16 urges the United Nations, in that regard, to work closely with Member States and other relevant actors, including local governments, civil society and the private sector, to promote more effective emergency preparedness and response in urban areas, and notes the importance of addressing, as appropriate, the particular needs and vulnerabilities of internally displaced persons in urban settings and of supporting host cities, in the spirit of international cooperation; __________________ 15 A/71/353. 16 Resolution 71/256, annex. Protection of and assistance to internally displaced persons A/RES/72/182 11/11 17-23174",
    "41": "Encourages Governments, United Nations agencies and other stakeholders to promote an inclusive approach to durable solutions that addresses the needs of internally displaced persons and their host communities, including the promotion of opportunities to fully harness the human potential of the displaced populations by promoting self-sufficiency through income-generating activities and sustainable livelihood opportunities;",
    "42": "Recalls the need to reflect on effective strategies to ensure adequate protection and assistance for internally displaced persons and to prevent and reduce such displacement, and in this regard encourages the Secretary-General to work with Member States and the United Nations system to explore ways to better address the long-term needs of internally displaced persons, support communities that host them and improve the lives of the many millions of internally displaced persons;",
    "43": "Requests the Secretary-General to continue to provide the Special Rapporteur, from within existing resources, with all assistance necessary to strengthen and carry out her mandate effectively, and encourages the Office of the United Nations High Commissioner for Human Rights, in close cooperation with the Emergency Relief Coordinator, the Office for the Coordination of Humanitarian Affairs of the Secretariat, the Office of the United Nations High Commissioner for Refugees, the International Organization for Migration and all other relevant United Nations offices and agencies and related organizations, to continue to support and cooperate with the Special Rapporteur;",
    "44": "Encourages the Special Rapporteur to continue to seek the contributions of States, relevant organizations and institutions in order to create a more stable basis for her work;",
    "45": "Requests the Special Rapporteur to submit to the General Assembly at its seventy-third and seventy-fourth sessions a report on the implementation of the present resolution;",
    "46": "Decides to continue its consideration of the question of protection of and assistance to internally displaced persons at its seventy-fourth session. 73rd plenary meeting 19 December 2017"
  },
  "agenda_items": [
    "Item 72"
  ],
  "symbol_references": []
}