{
  "symbol": "A/RES/73/338",
  "filename": "A_RES_73_338.pdf",
  "title": "73/338. International Year of Peace and Trust, 2021",
  "text": "United Nations \nA/RES/73/338\n \n \nGeneral Assembly \nDistr.: General \n17 September 2019 \n \n19-15700 (E)    240919     \n*1915700* \n \n \nSeventy-third session \nAgenda item 15 \n \n \n \n \n Resolution adopted by the General Assembly \non 12 September 2019 \n \n \n \n \n[without reference to a Main Committee (A/73/L.110 and A/73/L.110/Add.1)] \n \n \n 73/338. International Year of Peace and Trust, 2021 \n \n \n \nThe General Assembly, \n \nReaffirming the Charter of the United Nations and its purposes and principles, \nand especially the commitment to settle disputes through peaceful means and the \ndetermination to save succeeding generations from the scourge of war,  \n \nRecognizing the important role of the United Nations in developing friendly \nrelations among nations,  \n \nAcknowledging that the approach of multilateralism and diplomacy could \nreinforce the advancement of the three pillars of the United Nations, namely, \nsustainable development, peace and security, and human rights, which are \ninterconnected and mutually reinforcing, while observing respective mandates and \nthe Charter,  \n \nRecognizing the importance of the Declaration and Programme of Action on a \nCulture of Peace, 1  which serve as the universal mandate for the international \ncommunity, particularly the United Nations system, for the promotion of a culture of \npeace and non-violence that benefits humanity, in particular future generations,  \n \nRecognizing also the urgent need to promote and strengthen preventive \ndiplomacy, inter alia, through multilateralism and political dialogue, and the \nimportant role of the United Nations in this regard,  \n \nAcknowledging that peace and trust entail accepting differences and having the \nability to listen to, recognize, respect and appreciate others, as well as living in a \npeaceful and united way,  \n \nRecognizing the role of international, regional and subregional organizations, in \naccordance with their mandates, in the promotion and preservation of peace,  \n__________________ \n \n1  Resolutions 53/243 A and B. \n\nA/RES/73/338 \nInternational Year of Peace and Trust, 2021\n \n19-15700\n2/2 \n \n \nRecognizing also that peace not only is the absence of conflict, but also requires \na positive, dynamic participatory process where dialogue is encouraged and conflicts \nare solved in a spirit of mutual understanding and cooperation,  \n \nStressing the importance of preventive diplomacy in supporting the efforts of \nthe United Nations to promote the peaceful settlement of conflicts, in order to \npreserve peace,  \n \nReaffirming its resolutions 53/199 of 15 December 1998 and 61/185 of \n20 December 2006 on the proclamation of international years, and Economic and \nSocial Council resolution 1980/67 of 25 July 1980 on international years and \nanniversaries, in particular paragraphs 1 to 10 of the annex thereto on the agreed \ncriteria for the proclamation of international years, as well as paragraphs 13 and 14, \nin which it is stated that an international day or year should not be proclaimed before \nthe basic arrangements for its organization and financing have been made,  \n \nReaffirming also the United Nations Millennium Declaration2 and its resolution \n70/1 of 25 September 2015, entitled \u201cTransforming our world: the 2030 Agenda for \nSustainable Development\u201d,  \n \nEncouraging the continued and increasing efforts and activities on the part of \ncivil society organizations throughout the world in advancing a culture of peace, as \nenvisaged in the Declaration and Programme of Action on a Culture of Peace,  \n \n1. \nDeclares 2021 the International Year of Peace and Trust;  \n \n2. \nUnderlines that the International Year of Peace and Trust constitutes a \nmeans of mobilizing the efforts of the international community to promote peace and \ntrust among nations based on, inter alia, political dialogue, mutual understanding and \ncooperation, in order to build sustainable peace, solidarity and harmony;  \n \n3. \nCalls upon the international community to continue to promote peace and \ntrust among nations as a value that promotes sustainable development, peace and \nsecurity, and human rights;  \n \n4. \nInvites all Member States, organizations of the United Nations system, \nother relevant international and regional organizations and civil society, including \nnon-governmental organizations, individuals and other relevant stakeholders, to \nfacilitate the observance of the International Year of Peace and Trust, in an \nappropriate manner and to disseminate the advantages of peace and trust, including \nthrough educational and public awareness-raising activities;  \n \n5. \nRequests the Secretary-General to bring the present resolution to the \nattention of all Member States, organizations of the United Nations system and other \ninternational and regional organizations, as well as civil society, including \nnon-governmental organizations and individuals;  \n \n6. \nStresses that the cost of all activities that may arise from the \nimplementation of the present resolution should be met from voluntary contributions.  \n \n106th plenary meeting  \n12 September 2019 \n \n__________________ \n \n2  Resolution 55/2. \n",
  "paragraphs": {
    "1": "Declares 2021 the International Year of Peace and Trust;",
    "2": "Underlines that the International Year of Peace and Trust constitutes a means of mobilizing the efforts of the international community to promote peace and trust among nations based on, inter alia, political dialogue, mutual understanding and cooperation, in order to build sustainable peace, solidarity and harmony;",
    "3": "Calls upon the international community to continue to promote peace and trust among nations as a value that promotes sustainable development, peace and security, and human rights;",
    "4": "Invites all Member States, organizations of the United Nations system, other relevant international and regional organizations and civil society, including non-governmental organizations, individuals and other relevant stakeholders, to facilitate the observance of the International Year of Peace and Trust, in an appropriate manner and to disseminate the advantages of peace and trust, including through educational and public awareness-raising activities;",
    "5": "Requests the Secretary-General to bring the present resolution to the attention of all Member States, organizations of the United Nations system and other international and regional organizations, as well as civil society, including non-governmental organizations and individuals;",
    "6": "Stresses that the cost of all activities that may arise from the implementation of the present resolution should be met from voluntary contributions."
  },
  "agenda_items": [
    "Item 15"
  ],
  "symbol_references": [
    "A/73/L.110"
  ]
}