{
  "symbol": "A/RES/75/288",
  "filename": "A_RES_75_288.pdf",
  "title": "75/288. Cooperation between the United Nations and the Pacific Islands Forum",
  "text": "United Nations \nA/RES/75/288\n \n \nGeneral Assembly \nDistr.: General \n28 June 2021 \n \n21-08473 (E)    010721 \n*2108473* \n \n \nSeventy-fifth session \nAgenda item 130 (p) \nCooperation between the United Nations and regional and \nother organizations: cooperation between the United Nations \nand the Pacific Islands Forum \n \n \n \n \n Resolution adopted by the General Assembly \non 22 June 2021 \n \n \n \n \n[without reference to a Main Committee (A/75/L.98 and A/75/L.98/Add.1)] \n \n \n 75/288. Cooperation between the United Nations and the Pacific \nIslands Forum \n \n \n \nThe General Assembly, \n \nGuided by the purposes and principles enshrined in the Charter of the United \nNations, \n \nRecalling its resolutions 49/1 of 17 October 1994, 59/20 of 8 November 2004, \n61/48 of 4 December 2006, 63/200 of 19 December 2008, 65/316 of 12 September \n2011, 67/303 of 16 September 2013, 69/318 of 10 September 2015, 71/316 of 19 July \n2017 and 73/332 of 1 August 2019, \n \nRecognizing the key role the Pacific Islands Forum continues to play in promoting \nsustainable development, environmental protection, good governance and peace and \nsecurity, as well as supporting integrated ocean policy, in the Pacific through regional \ncooperation, \n \nTaking note, in this regard, of the Framework for Pacific Regionalism adopted \nby Pacific Islands Forum leaders in July 2014, the \u201cBlue Pacific\u201d narrative of \nSeptember 2017 and ongoing work in 2020 to develop the 2050 Strategy for the Blue \nPacific Continent on the Pacific region\u2019s collective action on shared stewardship of the \nPacific Ocean interlinking Pacific people with their natural resources, environment, \nculture and livelihoods, the Pacific Road Map for Sustainable Development of \nSeptember 2017, the Communiqu\u00e9 of the Forty-ninth Pacific Islands Forum of \nSeptember 2018 and the Kainaki II Declaration for Urgent Climate Change Action \nNow adopted by the members of the Pacific Islands Forum in August 2019, \n\nA/RES/75/288 \nCooperation between the United Nations and the Pacific \nIslands Forum\n \n21-08473\n2/5 \n \n \nRecalling the SIDS Accelerated Modalities of Action (SAMOA) Pathway, 1 the \n2030 Agenda for Sustainable Development,2 the Addis Ababa Action Agenda of the \nThird International Conference on Financing for Development, 3 the Paris Agreement \nadopted under the United Nations Framework Convention on Climate Change 4 and \nthe Sendai Framework for Disaster Risk Reduction 2015\u20132030,5 \n \nRecognizing the important role and contribution of the United Nations system \nin the region of the Pacific Islands Forum members, \n \nRecalling the unique and particular vulnerabilities of small island developing \nStates and the global commitment to take urgent and concrete action to address those \nvulnerabilities, including through the sustained and effective implementation of the \nProgramme of Action for the Sustainable Development of Small Island Developing \nStates,6 the Mauritius Strategy for the Further Implementation of the Programme of \nAction for the Sustainable Development of Small Island Developing States 7 and the \nSamoa Pathway, \n \nReaffirming the importance of enhanced high-level dialogue between the \nmembers of the Pacific Islands Forum and the United Nations, including regular \nmeetings between the Secretary-General of the United Nations and Forum leaders, \nand recalling with appreciation the first-ever participation by a Secretary-General at \na Forum, at the forty-second Forum, held on 7 and 8 September 2011 in Auckland, \nNew Zealand, the summit meetings between the Secretary-General and Forum leaders \nheld in New York on 26 September 2012, 26 September 2014, 1 October 2015, \n23 September 2016, 22 September 2017, 28 September 2018 and 21 September 2019 \nand the special leaders\u2019 summit held in Suva on 15 May 2019, \n \nMindful of recent developments at the United Nations of particular interest to \nPacific Islands Forum members, including the proclamation by the General Assembly \nof the United Nations Decade of Ocean Science for Sustainable Development8 and \nthe adoption of the declaration on the commemoration of the seventy-fifth anniversary \nof the United Nations,9 \n \nTaking note with appreciation of the report of the Secretary-General on \ncooperation between the United Nations and regional and other organizations,10 \n \nWelcoming the continued mutually beneficial dialogue between the Pacific Islands \nForum leaders and the Secretary-General, \n \n1. \nEncourages the scheduling of the next meeting between the Secretary-\nGeneral and Pacific Islands Forum leaders for September 2021, on the margins of the \ngeneral debate; \n__________________ \n \n1  Resolution 69/15, annex. \n \n2  Resolution 70/1. \n \n3  Resolution 69/313, annex. \n \n4  See FCCC/CP/2015/10/Add.1, decision 1/CP.21, annex. \n \n5  Resolution 69/283, annex II. \n \n6  Report of the Global Conference on the Sustainable Development of Small Island Developing \nStates, Bridgetown, Barbados, 25 April\u20136 May 1994 (United Nations publication, Sales \nNo. E.94.I.18 and corrigenda), chap. I, resolution 1, annex II. \n \n7  Report of the International Meeting to Review the Implementation of the Programme of Action \nfor the Sustainable Development of Small Island Developing States, Port Louis, Mauritius,  \n10\u201314 January 2005 (United Nations publication, Sales No. E.05.II.A.4 and corrigendum), \nchap. I, resolution 1, annex II. \n \n8  Resolution 72/73, para. 292. \n \n9  Resolution 75/1. \n \n10  A/75/345-S/2020/898. \n\nCooperation between the United Nations and the Pacific \nIslands Forum \nA/RES/75/288\n \n3/5\n21-08473 \n \n \n2. \nRecalls with appreciation the visit of the Secretary-General to the region \nof the Pacific Islands Forum members from 12 to 18 May 2019, and the high-level \npolitical dialogue held between the Pacific Islands Forum leaders and the \nSecretary-General on 15 May 2019 at the headquarters of the Forum; \n \n3. \nRecalls the joint statements issued by Pacific Islands Forum leaders and \nthe Secretary-General on 7 September 2011, 26 September 2012 and 29 September \n2014, and urges further progress towards their practical implementation in a timely \nmanner; \n \n4. \nUrges the United Nations system to align its work programmes and \noperations in the region of the Forum members in accordance with the quadrennial \ncomprehensive policy review of operational activities for development of the United \nNations system11 and in support of internationally agreed outcomes, including the \nSIDS Accelerated Modalities of Action (SAMOA) Pathway, the 2030 Agenda for \nSustainable Development, the Addis Ababa Action Agenda of the Third International \nConference on Financing for Development, the Paris Agreement adopted under the \nUnited Nations Framework Convention on Climate Change and the Sendai \nFramework for Disaster Risk Reduction 2015\u20132030, taking into account the priorities \nof the Pacific Islands Forum members, including as reflected in relevant regional \nagreements; \n \n5. \nWelcomes the convening of the high-level meeting to review progress \nmade in addressing the priorities of small island developing States through the \nimplementation of the Samoa Pathway on 27 September 2019 and the adoption on \n10 October 2019 of its political declaration,12 in which Heads of State and \nGovernment reaffirmed their commitment to strengthening cooperation with and \nsupport to small island developing States in the context of sustainable development, \nin line with their national development strategies and priorities, and looks forward to \nthe implementation of the calls made in the political declaration; \n \n6. \nRecalls its resolution 75/215 of 21 December 2020 on the follow-up to and \nimplementation of the Samoa Pathway and the Mauritius Strategy for the Further \nImplementation of the Programme of Action for the Sustainable Development of \nSmall Island Developing States, in which it noted with great concern the threat to \nhuman health, safety and well-being caused by the coronavirus disease (COVID-19) \npandemic for the sustainable development of small island developing States \nenvisioned in the Samoa Pathway and the 2030 Agenda; \n \n7. \nAlso recalls its decision to convene the high-level 2020 United Nations \nConference to Support the Implementation of Sustainable Development Goal 14: \nConserve and sustainably use the oceans, seas and marine resources for sustainable \ndevelopment in Lisbon to support the implementation of Sustainable Development \nGoal 14, and further recalls the decision to postpone the 2020 conference; 13 \n \n8. \nEncourages continued support from the United Nations system for the \nefforts of Pacific States and relevant regional organizations to achieve sustainable \ndevelopment, and calls for greater accountability and regular reporting with regard to \nthe support provided by the United Nations system, including through its regional and \ncountry programmes, to Pacific island States; \n \n9. \nAcknowledges the severe consequences of the COVID-19 pandemic for the \nsustainable development of small island developing States envisioned in the Samoa \nPathway and the 2030 Agenda, including the far-reaching and enduring consequences \n__________________ \n \n11  See resolution 75/233. \n \n12  Resolution 74/3. \n \n13  See decision 74/548. \n\nA/RES/75/288 \nCooperation between the United Nations and the Pacific \nIslands Forum\n \n21-08473\n4/5 \n \nfor poverty eradication, employment, growth and social welfare as a result of the \nunprecedented contraction of their economies, notes with concern that the external \ndebt stocks of small island developing States have increased by 70 percentage points \nsince 2009, resulting in the average rate of external debt to gross domestic product in \nthose States rising by 11 percentage points to 61.7 per cent in 2019, while the ability \nof those States to self-insure against exogenous shocks continues to deteriorate \nfurther, highlighting that achieving the Goals and targets set out in the 2030 Agenda \nwill be more difficult and that integrating the concept of resilience is critical to enable \na sustainable future and avoid creating new risks, and notes the United Nations \nsupport for the Pacific Islands Forum Pacific Humanitarian Pathway on COVID-19 \nas a coordinated unified response to the COVID-19 pandemic; \n \n10. Also acknowledges the need for urgent action to address the adverse \nimpacts of climate change, including those related to sea level rise and extreme \nweather events, which continue to pose a significant risk to small island developing \nStates and to their efforts to achieve sustainable development and, for many, represent \nthe gravest of threats to their survival and viability, including, for some, through loss \nof territory, as well as through threats to water availability, food security and nutrition; \n \n11. \nWelcomes the progress towards enhancing cooperation between the United \nNations and the Pacific Islands Forum and its associated institutions, and urges them to \ncontinue to strengthen their partnership and regional collaboration for the \nimplementation of internationally agreed outcomes in the region of the Forum \nmembers; \n \n12. Also welcomes the substantive progress achieved by the Pacific Centre for \nRenewable Energy and Energy Efficiency since its establishment in Tonga in 2017, \nwith a view to forming an emerging global network of regional centres, thereby \nexpanding dialogue and cooperation on sustainable energy; \n \n13. Recalls the report of the Joint Inspection Unit entitled \u201cComprehensive \nreview of United Nations system support for small island developing States: final \nfindings\u201d, prepared pursuant to resolution 69/288 of 8 June 2015;14 \n \n14. Stresses, in that regard, the value of enhanced close cooperation and \ncoordination between the programmes and activities of the United Nations system \nand Pacific Islands Forum members, the Forum secretariat and associated institutions, \nincluding the Office of the Pacific Ocean Commissioner, welcomes recent efforts by \nUnited Nations and regional agencies in the Pacific to enhance cooperation through \njoint activities, working groups and other means, and encourages further practical \nsteps to enhance such cooperation and coordination; \n \n15. Also stresses the importance of coherent and integrated approaches to \nbuilding resilience to extreme weather events, including both slow- and rapid-onset \nevents, and to stressors related to increased climate variability across the Pacific; \n \n16. Reiterates the importance of strengthening resilience and mitigating risks \nin the region of the Forum members, and encourages the United Nations system to \nwork collaboratively with the Pacific Islands Forum and associated institutions in this \nregard; \n \n17. Stresses the importance of resident coordinators and United Nations \ncountry teams in the region of the Forum members strengthening consultations with \nnational Governments and relevant stakeholders, including the Pacific Islands Forum, \nin accordance with its resolution 71/243 of 21 December 2016, and ensuring that the \ndevelopment and implementation of all United Nations programme and plan \n__________________ \n \n14  A/72/119. \n\nCooperation between the United Nations and the Pacific \nIslands Forum \nA/RES/75/288\n \n5/5\n21-08473 \n \ndocuments increase coherence and coordination in support of national development \nneeds and priorities; \n \n18. Reiterates the importance of continuing to enhance and strengthen the \nUnited Nations field presence in the region of the Forum members, in accordance \nwith its resolution 71/243, in particular with regard to operational activities of the \nmulti-country offices, using flexible, cost-effective and collaborative models, as \nappropriate; \n \n19. Notes the ongoing implementation of the multi-country office reviews, and \nreiterates the request to the Secretary-General to conduct regular monitoring, reporting \nand follow-up, including to the annual operational activities for development segment \nof the Economic and Social Council session, with a view to considering the \nadjustments necessary to ensure the delivery of sustainable and effective development \nresources and services to enable countries served by multi-country offices to \nimplement the 2030 Agenda; \n \n20. Welcomes the progress in the establishment of a multi-country office in the \nNorth Pacific; \n \n21. Requests the Secretary-General to submit to the General Assembly at its \nseventy-seventh session a report on the implementation of the present resolution; \n \n22. Decides to include in the provisional agenda of its seventy-seventh \nsession, under the item entitled \u201cCooperation between the United Nations and \nregional and other organizations\u201d, the sub-item entitled \u201cCooperation between the \nUnited Nations and the Pacific Islands Forum\u201d. \n \n84th plenary meeting \n22 June 2021 \n \n",
  "paragraphs": {
    "1": "Encourages the scheduling of the next meeting between the Secretary- General and Pacific Islands Forum leaders for September 2021, on the margins of the general debate; __________________ 1 Resolution 69/15, annex. 2 Resolution 70/1. 3 Resolution 69/313, annex. 4 See FCCC/CP/2015/10/Add.1, decision 1/CP.21, annex. 5 Resolution 69/283, annex II. 6 Report of the Global Conference on the Sustainable Development of Small Island Developing States, Bridgetown, Barbados, 25 April\u20136 May 1994 (United Nations publication, Sales No. E.94.I.18 and corrigenda), chap. I, resolution 1, annex II. 7 Report of the International Meeting to Review the Implementation of the Programme of Action for the Sustainable Development of Small Island Developing States, Port Louis, Mauritius, 10\u201314 January 2005 (United Nations publication, Sales No. E.05.II.A.4 and corrigendum), chap. I, resolution 1, annex II. 8 Resolution 72/73, para. 292. 9 Resolution 75/1. 10 A/75/345-S/2020/898. Cooperation between the United Nations and the Pacific Islands Forum A/RES/75/288 3/5 21-08473",
    "2": "Recalls with appreciation the visit of the Secretary-General to the region of the Pacific Islands Forum members from 12 to 18 May 2019, and the high-level political dialogue held between the Pacific Islands Forum leaders and the Secretary-General on 15 May 2019 at the headquarters of the Forum;",
    "3": "Recalls the joint statements issued by Pacific Islands Forum leaders and the Secretary-General on 7 September 2011, 26 September 2012 and 29 September 2014, and urges further progress towards their practical implementation in a timely manner;",
    "4": "Urges the United Nations system to align its work programmes and operations in the region of the Forum members in accordance with the quadrennial comprehensive policy review of operational activities for development of the United Nations system11 and in support of internationally agreed outcomes, including the SIDS Accelerated Modalities of Action (SAMOA) Pathway, the 2030 Agenda for Sustainable Development, the Addis Ababa Action Agenda of the Third International Conference on Financing for Development, the Paris Agreement adopted under the United Nations Framework Convention on Climate Change and the Sendai Framework for Disaster Risk Reduction 2015\u20132030, taking into account the priorities of the Pacific Islands Forum members, including as reflected in relevant regional agreements;",
    "5": "Welcomes the convening of the high-level meeting to review progress made in addressing the priorities of small island developing States through the implementation of the Samoa Pathway on 27 September 2019 and the adoption on 10 October 2019 of its political declaration,12 in which Heads of State and Government reaffirmed their commitment to strengthening cooperation with and support to small island developing States in the context of sustainable development, in line with their national development strategies and priorities, and looks forward to the implementation of the calls made in the political declaration;",
    "6": "Recalls its resolution 75/215 of 21 December 2020 on the follow-up to and implementation of the Samoa Pathway and the Mauritius Strategy for the Further Implementation of the Programme of Action for the Sustainable Development of Small Island Developing States, in which it noted with great concern the threat to human health, safety and well-being caused by the coronavirus disease (COVID-19) pandemic for the sustainable development of small island developing States envisioned in the Samoa Pathway and the 2030 Agenda;",
    "7": "Also recalls its decision to convene the high-level 2020 United Nations Conference to Support the Implementation of Sustainable Development Goal 14: Conserve and sustainably use the oceans, seas and marine resources for sustainable development in Lisbon to support the implementation of Sustainable Development Goal 14, and further recalls the decision to postpone the 2020 conference; 13",
    "8": "Encourages continued support from the United Nations system for the efforts of Pacific States and relevant regional organizations to achieve sustainable development, and calls for greater accountability and regular reporting with regard to the support provided by the United Nations system, including through its regional and country programmes, to Pacific island States;",
    "9": "Acknowledges the severe consequences of the COVID-19 pandemic for the sustainable development of small island developing States envisioned in the Samoa Pathway and the 2030 Agenda, including the far-reaching and enduring consequences __________________ 11 See resolution 75/233. 12 Resolution 74/3. 13 See decision 74/548. A/RES/75/288 Cooperation between the United Nations and the Pacific Islands Forum 21-08473 4/5 for poverty eradication, employment, growth and social welfare as a result of the unprecedented contraction of their economies, notes with concern that the external debt stocks of small island developing States have increased by 70 percentage points since 2009, resulting in the average rate of external debt to gross domestic product in those States rising by 11 percentage points to 61.7 per cent in 2019, while the ability of those States to self-insure against exogenous shocks continues to deteriorate further, highlighting that achieving the Goals and targets set out in the 2030 Agenda will be more difficult and that integrating the concept of resilience is critical to enable a sustainable future and avoid creating new risks, and notes the United Nations support for the Pacific Islands Forum Pacific Humanitarian Pathway on COVID-19 as a coordinated unified response to the COVID-19 pandemic;",
    "10": "Also acknowledges the need for urgent action to address the adverse impacts of climate change, including those related to sea level rise and extreme weather events, which continue to pose a significant risk to small island developing States and to their efforts to achieve sustainable development and, for many, represent the gravest of threats to their survival and viability, including, for some, through loss of territory, as well as through threats to water availability, food security and nutrition;",
    "11": "Welcomes the progress towards enhancing cooperation between the United Nations and the Pacific Islands Forum and its associated institutions, and urges them to continue to strengthen their partnership and regional collaboration for the implementation of internationally agreed outcomes in the region of the Forum members;",
    "12": "Also welcomes the substantive progress achieved by the Pacific Centre for Renewable Energy and Energy Efficiency since its establishment in Tonga in 2017, with a view to forming an emerging global network of regional centres, thereby expanding dialogue and cooperation on sustainable energy;",
    "13": "Recalls the report of the Joint Inspection Unit entitled \u201cComprehensive review of United Nations system support for small island developing States: final findings\u201d, prepared pursuant to resolution 69/288 of 8 June 2015;14",
    "14": "Stresses, in that regard, the value of enhanced close cooperation and coordination between the programmes and activities of the United Nations system and Pacific Islands Forum members, the Forum secretariat and associated institutions, including the Office of the Pacific Ocean Commissioner, welcomes recent efforts by United Nations and regional agencies in the Pacific to enhance cooperation through joint activities, working groups and other means, and encourages further practical steps to enhance such cooperation and coordination;",
    "15": "Also stresses the importance of coherent and integrated approaches to building resilience to extreme weather events, including both slow- and rapid-onset events, and to stressors related to increased climate variability across the Pacific;",
    "16": "Reiterates the importance of strengthening resilience and mitigating risks in the region of the Forum members, and encourages the United Nations system to work collaboratively with the Pacific Islands Forum and associated institutions in this regard;",
    "17": "Stresses the importance of resident coordinators and United Nations country teams in the region of the Forum members strengthening consultations with national Governments and relevant stakeholders, including the Pacific Islands Forum, in accordance with its resolution 71/243 of 21 December 2016, and ensuring that the development and implementation of all United Nations programme and plan __________________ 14 A/72/119. Cooperation between the United Nations and the Pacific Islands Forum A/RES/75/288 5/5 21-08473 documents increase coherence and coordination in support of national development needs and priorities;",
    "18": "Reiterates the importance of continuing to enhance and strengthen the United Nations field presence in the region of the Forum members, in accordance with its resolution 71/243, in particular with regard to operational activities of the multi-country offices, using flexible, cost-effective and collaborative models, as appropriate;",
    "19": "Notes the ongoing implementation of the multi-country office reviews, and reiterates the request to the Secretary-General to conduct regular monitoring, reporting and follow-up, including to the annual operational activities for development segment of the Economic and Social Council session, with a view to considering the adjustments necessary to ensure the delivery of sustainable and effective development resources and services to enable countries served by multi-country offices to implement the 2030 Agenda;",
    "20": "Welcomes the progress in the establishment of a multi-country office in the North Pacific;",
    "21": "Requests the Secretary-General to submit to the General Assembly at its seventy-seventh session a report on the implementation of the present resolution;",
    "22": "Decides to include in the provisional agenda of its seventy-seventh session, under the item entitled \u201cCooperation between the United Nations and regional and other organizations\u201d, the sub-item entitled \u201cCooperation between the United Nations and the Pacific Islands Forum\u201d. 84th plenary meeting 22 June 2021"
  },
  "agenda_items": [
    "Item 130"
  ],
  "symbol_references": [
    "A/75/L.98"
  ]
}