{
  "symbol": "A/RES/79/228",
  "filename": "A_RES_79_228.pdf",
  "title": "79/228. Towards global partnerships: a principle-based approach to enhanced cooperation between the United Nations and all relevant partners",
  "text": "United Nations \nA/RES/79/228\n \n \nGeneral Assembly \nDistr.: General \n23 December 2024 \n \n24-24315 (E)     \n*2424315* \n \n \nSeventy-ninth session \nAgenda item 25 \nTowards global partnerships  \n \n \n \n \n Resolution adopted by the General Assembly \non 19 December 2024 \n \n \n \n \n[on the report of the Second Committee (A/79/444, para. 11)] \n \n \n 79/228. Towards global partnerships: a principle-based approach to \nenhanced cooperation between the United Nations and all \nrelevant partners \n \n \n \nThe General Assembly, \n \nRecalling its resolution 76/224 of 17 December 2021 and preceding resolutions \nunder the agenda item as referenced therein, \n \nReaffirming its resolution 70/1 of 25 September 2015, entitled \u201cTransforming \nour world: the 2030 Agenda for Sustainable Development\u201d, in which it adopted a \ncomprehensive, far-reaching and people-centred set of universal and transformative \nSustainable Development Goals and targets, its commitment to working tirelessly for \nthe full implementation of the Agenda by 2030, its recognition that eradicating \npoverty in all its forms and dimensions, including extreme poverty, is the greatest \nglobal challenge and an indispensable requirement for sustainable development, its \ncommitment to achieving sustainable development in its three dimensions \u2013 \neconomic, social and environmental \u2013 in a balanced and integrated manner, and to \nbuilding upon the achievements of the Millennium Development Goals and seeking \nto address their unfinished business,  \n \nReaffirming also its resolution 69/313 of 27 July 2015 on the Addis Ababa \nAction Agenda of the Third International Conference on Financing for Development, \nwhich is an integral part of the 2030 Agenda for Sustainable Development, supports \nand complements it, helps to contextualize its means of implementation targets with \nconcrete policies and actions, and reaffirms the strong political commitment to \naddress the challenge of financing and creating an enabling environment at all levels \nfor sustainable development in the spirit of global partnership and solidarity, \n \nReaffirming further its resolution 72/279 of 31 May 2018 on the repositioning \nof the United Nations development system in the context of the quadrennial \ncomprehensive policy review of operational activities for development of the United \nNations system, as well as its resolution 75/233 of 21 December 2020 on the \n\nA/RES/79/228 \nTowards global partnerships: a principle-based approach to \nenhanced cooperation between the United Nations and all \nrelevant partners\n \n24-24315\n2/8 \n \nquadrennial comprehensive policy review of operational activities for development \nof the United Nations system and the general guidelines and principles contained \ntherein, and welcoming the efforts of the Secretary-General to better position the \nUnited Nations operational activities for development to support countries in their \nefforts to implement the 2030 Agenda for Sustainable Development, \n \nReaffirming its resolution 73/291 of 15 April 2019, the annex to which contains \nthe outcome document of the second High-level United Nations Conference on South-\nSouth Cooperation, held in Buenos Aires in March 2019, in which heads of \ndelegations and high representatives of Governments recognized the increasing role \nplayed by inclusive partnerships in South-South and triangular cooperation, while \nacknowledging that Governments have the principal role of coordinating and leading \ndevelopment efforts, and stressing that South-South cooperation is not a substitute \nfor, but rather a complement to, North-South cooperation,  \n \nRecalling the objectives of the 2030 Agenda and the Addis Ababa Action \nAgenda, in particular with regard to developing partnerships through the provision of \ngreater opportunities to the private sector, non-governmental organizations and civil \nsociety in general so as to enable them to contribute to the realization of the goals and \nprogrammes of the Organization, in particular in the pursuit of sustainable \ndevelopment and the eradication of poverty, \n \nWelcoming the convening of the Summit of the Future on 22\u201323 September 2024 \nat the United Nations Headquarters in New York at which resolution 79/1 entitled \n\u201cThe Pact for the Future\u201d and its annexes were adopted,  \n \nLooking forward to the convening in 2025 of the Fourth International \nConference on Financing for Development in Seville, Spain,  \n \nWelcoming the contribution of all relevant stakeholders including the private \nsector, civil society, non-governmental organizations, philanthropic organizations, \nscientific and technological communities and academia that respect and support the \ncore values and principles of the United Nations, to the realization of the Sustainable \nDevelopment Goals and other internationally agreed development goals, while \nacknowledging the role of parliaments in ensuring accountability for the effective \nimplementation of goals and commitments under the 2030 Agenda,  \n \nEmphasizing that cooperation between the United Nations and all relevant \npartners, in particular the private sector, can further contribute to addressing the \nobstacles confronted in particular by developing countries, including by mobilizing \nthe resources needed to finance sustainable development, and to realizing the \ninternationally agreed development goals in developing countries,  \n \nEmphasizing also that multi-stakeholder partnerships and the resources, \nknowledge and ingenuity of all relevant stakeholders, including the private sector, are \nimportant to mobilizing the knowledge, expertise, technology and financial resources \nneeded for the achievement of the Sustainable Development Goals, complementing \nthe efforts of Governments,  \n \nNoting that the relevant stakeholders, including private sector entities, need \ninformation about and understanding of the nature and the scope of the Sustainable \nDevelopment Goals and of the modalities by which they can engage with the Goals, \nand that, in this regard, decisive action is also imperative for raising awareness of the \nGoals at all levels,  \n \nRecalling that the 2030 Agenda acknowledges that the implementation of \nsustainable development will depend on the active engagement of both the public and \nprivate sectors, recognizing that the active participation of the private sector can \ncontribute to the achievement of sustainable development, inter alia, through the \n\nTowards global partnerships: a principle-based approach to \nenhanced cooperation between the United Nations and all \nrelevant partners \nA/RES/79/228\n \n3/8\n24-24315 \n \ncreation of job opportunities, the advancement of economic development and the \nmobilization of private investment into developing countries and through respecting \nresponsible business practices, such as the principles of the United Nations Global \nCompact and the Guiding Principles on Business and Human Rights: Implementing \nthe United Nations \u201cProtect, Respect and Remedy\u201d Framework, 1 and recognizing also \nthe roles and contributions of civil society, the scientific and technological \ncommunity, non-governmental organizations and other relevant international \norganizations, including international financial institutions and multilateral \ndevelopment banks, in advancing sustainable development, \n \nRecognizing the contributions of all relevant stakeholders, including the private \nsector and civil society, in fostering stability and supporting a sustainable, inclusive \nand equitable recovery by creating job opportunities, advancing economic \ndevelopment, as well as sustainable infrastructure development, and contributing to \ntrust and social cohesion,  \n \nUnderlining the fact that any cooperation between the United Nations and all \nrelevant partners, including the private sector, shall be in accordance with applicable \nnorms and regulations, including those pertaining to the use of the United Nations \nname or emblem, and stressing that such partnerships shall serve the purposes and \nprinciples embodied in the Charter of the United Nations and shall be undertaken in \na manner that maintains and promotes the integrity, impartiality and independence of \nthe Organization,  \n \nRecognizing that, while progress is being made on the global engagement of the \nprivate sector regarding the Sustainable Development Goals at the level of perception \nand awareness as well as the inclusion of sustainability in their business models by \nsome companies, the immense potential of support for the Goals, in particular by \nsmall and medium-sized enterprises, still represents a largely unutilized source for \nthe full implementation of the Goals,  \n \nRecognizing also the unique position of the United Nations as a builder of \nbridges among countries and all stakeholders, and the progress achieved in the work \nof the United Nations on partnerships, notably in the framework of various United \nNations organizations, agencies, funds, programmes, task forces, commissions and \ninitiatives, and noting the establishment of partnerships at the field level entered into \nby various United Nations agencies, non-public partners and Member States, as well \nas multi-stakeholder partnerships,  \n \nWelcoming the efforts and encouraging further efforts by all relevant partners, \nincluding the private sector, to engage as reliable and consistent partners in the \ndevelopment process and to take into account not only the economic and financial but \nalso the development, social, human rights, gender and environmental implications \nof their undertakings, and, in general, towards implementing corporate social and \nenvironmental responsibility, that is, bringing such values and responsibilities to bear \non their conduct and policies premised on profit incentives, in conformity with \nnational laws and regulations, \n \nWelcoming also, in the context of enhanced cooperation between the United \nNations and all its relevant partners, including through multi-stakeholder \npartnerships, efforts to step up international cooperation and collaboration in science, \nresearch, technology and innovation on the basis of common interest and mutual \nbenefit, focusing on the needs of developing countries and the achievement of the \n2030 Agenda,  \n__________________ \n \n1 A/HRC/17/31, annex. \n\nA/RES/79/228 \nTowards global partnerships: a principle-based approach to \nenhanced cooperation between the United Nations and all \nrelevant partners\n \n24-24315\n4/8 \n \n \nRecalling the Guidelines on a Principle-based Approach to the Cooperation \nbetween the United Nations and the Business Sector and their alignment with the \nGuiding Principles on Business and Human Rights,  \n \nNoting that financial and economic crises demonstrate the need for values and \nprinciples in business, including for sustainable business practices, gender equality, \nsocial protection floors and the promotion of full and productive employment and \ndecent work for all,  \n \nReaffirming the principles of sustainable development, and underlining the \nglobal consensus reached on the key values and principles that will promote \nsustainable, fair, equitable and sustained economic development and that corporate \nsocial and environmental responsibility are important elements of that consensus,  \n \nEncouraging the private sector in the context of enhanced cooperation between \nthe United Nations and all its relevant partners to enhance its involvement in \ncombating climate change, biodiversity loss and desertification, and welcoming the \ncommitments to leadership on climate action already made by relevant stakeholders,  \n \nRecalling that the high-level political forum on sustainable development has a \ncentral role in overseeing the follow-up and review of the 2030 Agenda at the global \nlevel, including with regard to partnerships,  \n \nStressing the importance of the high-level political forum on sustainable \ndevelopment in supporting the participation in follow-up and review processes by the \nmajor groups and other relevant stakeholders pursuant to resolution 78/285 of 7 June \n2024, and calling upon those actors to report on their contribution to the \nimplementation of the 2030 Agenda,  \n \nRecognizing the vital role that the United Nations Global Compact Office \ncontinues to play with regard to strengthening the capacity of the United Nations to \npartner strategically with the private sector, in accordance with its mandate from the \nGeneral Assembly, to advance United Nations values and responsible business \npractices within the United Nations system and among the global business \ncommunity, and in this regard noting the principles and initiatives of the United \nNations Global Compact,  \n \nRecognizing also the critical importance of optimizing the potential of \npartnerships across the United Nations system and beyond, in particular in the context \nof sustainable, resilient and inclusive recovery from the coronavirus disease \n(COVID-19) pandemic, and acknowledging the lessons learned from embracing new \ntechnologies and shortening timelines when partnering in response to COVID-19, \nwhich helped to enable greater inclusivity, speed, scale and impact with the \nparticipation of stakeholders, including civil society, academia and the private sector,  \n \n1. \nTakes note of the report of the Secretary-General on enhanced cooperation \nbetween the United Nations and all relevant partners, in particular the private sector; 2 \n \n2. \nAcknowledges that the implementation of the 2030 Agenda for Sustainable \nDevelopment 3 requires a strong commitment to partnership at all levels between \nGovernments, the private sector, civil society and all other relevant stakeholders, and \ntherefore recognizes the importance of the various contributions of all relevant \nstakeholders, including the private sector;  \n \n3. \nCommits to enhancing global, regional, national and local partnerships for \nsustainable development, engaging all relevant stakeholders, including civil society, \nthe private sector, academia and youth, recognizing the important contribution they \n__________________ \n \n2 A/79/531. \n \n3 Resolution 70/1. \n\nTowards global partnerships: a principle-based approach to \nenhanced cooperation between the United Nations and all \nrelevant partners \nA/RES/79/228\n \n5/8\n24-24315 \n \ncan make toward achieving the 2030 Agenda, and the localization of the Sustainable \nDevelopment Goals, and reaffirms the importance of the regional and local dimension \nof sustainable development in addressing regional and local challenges and scaling \nup action among countries;  \n \n4. \nStresses that partnerships are voluntary and collaborative relationships \nbetween various parties, both public and non-public, in which all participants agree \nto work together to achieve a common purpose or undertake a specific task and, as \nmutually agreed, to share risks and responsibilities, resources and benefits;  \n \n5. \nAlso stresses that partnerships will be critical to the achievement of the \nSustainable Development Goals, as an effective instrument for mobilizing additional \nhuman and financial resources, expertise, technology and knowledge, while \nreiterating that partnerships are a complement to, but are not intended as a substitute \nfor, the commitment made by Governments with a view to achieving the Goals;  \n \n6. \nFurther stresses that partnerships should be consistent with national laws \nand national development strategies and plans, as well as the priorities of countries \nwhere they are implemented, bearing in mind the relevant guidance provided by \nGovernments;  \n \n7. \nEmphasizes the vital role played by Governments in promoting \nresponsible business practices, including providing and ensuring enforcement of the \nnecessary legal and regulatory frameworks in accordance with national legislation \nand development priorities, and invites them to continue to provide support to United \nNations efforts to engage with the private sector and other relevant stakeholders, as \nappropriate;  \n \n8. \nRecognizes the vital role that the private sector plays in sustainable \ndevelopment, including by engaging in various partnership models, by conducting \nresponsible business practices, by generating decent employment as well as \ninvestment, by giving access to and developing new technologies, by offering \ntechnical vocational training activities and by stimulating sustained, inclusive and \nsustainable economic growth;  \n \n9. \nWelcomes the efforts of the Secretary-General to steer the United Nations \nsystem towards giving greater attention to longer-term, strategic and innovation-\nbased multi-stakeholder partnerships in order to leverage private sector competencies \nand technologies, with a view to generating greater potential for innovation and \nincreased impact on sustainable development, which is needed for the timely \nachievement of the Sustainable Development Goals;  \n \n10. Emphasizes that the Secretary-General, in his capacity as Chair of the \nUnited Nations System Chief Executives Board for Coordination, and the executive \nheads of interested organizations should build on existing and ongoing efforts and \ncontinue to empower the United Nations Innovation Network or other existing United \nNations joint innovation initiatives, such as Global Pulse, to identify and discuss \nissues that are relevant for the coordination of the existing innovation initiatives, \nfunds, laboratories, accelerators and incubators, and their interface with the private \nsector, with a view to facilitating and stimulating innovation in the implementation \nof the 2030 Agenda;  \n \n11. \nEncourages the United Nations funds and programmes to continue to \nactively engage with other stakeholders, including civil society, the private sector and \nfoundations, with a view to diversifying potential sources of funding, especially core \nfunding, for their operational activities for development, in alignment with the core \nprinciples of the United Nations development system and with full respect for the \nnational priorities of programme countries;  \n\nA/RES/79/228 \nTowards global partnerships: a principle-based approach to \nenhanced cooperation between the United Nations and all \nrelevant partners\n \n24-24315\n6/8 \n \n \n12. Recognizes that these partnerships should give priority to core resources, \nwhile noting the need to make non-core resources from partners flexible and aligned \nwith strategic plans and national priorities;  \n \n13. Stresses that greater effort is required to unlock new financial flows, \nincluding from mainstream institutional investors, for the timely implementation of \nthe 2030 Agenda, as a complement to public finance and international development \ncooperation;  \n \n14. Welcomes the growing number of businesses that embrace a core business \nmodel that takes account of the environmental, social and governance impacts of their \nactivities, encourages and urges all businesses to adopt principles for responsible \nbusiness and investing, and supports the work of the United Nations Global Compact \nin this regard;  \n \n15. Calls upon the United Nations funds, programmes and the specialized \nagencies, at the request of national Governments, to improve their support for the \nbuilding, development and strengthening of national capacities, to support \ndevelopment results at the country level and to promote national ownership and \nleadership, in line with national development policies, plans and priorities, taking into \naccount their respective mandates and bearing in mind their comparative advantages, \nin assisting Governments in leveraging partnerships;  \n \n16. Welcomes the ongoing efforts of the Secretary-General to further improve \nthe collaboration of the United Nations with all relevant partners, including the \nprivate sector, and recognizes his efforts to strengthen the capacities of the United \nNations system, including by mainstreaming understanding of the role of partnerships \nthroughout the system, and to discuss the potential for further strengthening of \ncooperation and coordination across the United Nations system with regard to \npartnerships, with a view to enhancing the results achieved through them, while \nacknowledging the importance of continued consultations with Member States;  \n \n17. Also welcomes the commitment of the Secretary-General to continuing to \nretain the integrity and unique role of the United Nations Global Compact, and \nunderlines the importance of integrity measures as taken and advocated by the United \nNations Global Compact;  \n \n18. Invites the United Nations system, when considering partnerships, to seek \nto engage in a more coherent manner with private sector entities, including micro-, \nsmall and medium-sized enterprises, that support the core values of the United \nNations, as reflected in the Charter of the United Nations and other relevant \nconventions and treaties, and that commit to the 10 principles of the United Nations \nGlobal Compact by translating them into operational corporate policies, codes of \nconduct, and management, monitoring and reporting systems;  \n \n19. Recalls the request to the Secretary-General, in this regard, as appropriate, \nin collaboration with the funds and programmes, the specialized agencies and other \nrelevant United Nations entities and mechanisms, to disclose the partners, \ncontributions and matching funds for all relevant partnerships, including at the \ncountry level, and to ensure that these elements are coherently reflected in the \nreporting of partnership activities by the United Nations funds, programmes and, as \nappropriate, agencies to their respective governing bodies;  \n \n20. Stresses the need for the United Nations system to continue its efforts to \ndevelop, for those partnerships in which it participates, a common and coherent \napproach across the United Nations system that places greater emphasis on \ntransparency, impact, accountability, due diligence and risk management, while \ntaking into account the specific mandates of United Nations agencies, programmes \nand other entities and without imposing undue rigidity in partnership agreements;  \n\nTowards global partnerships: a principle-based approach to \nenhanced cooperation between the United Nations and all \nrelevant partners \nA/RES/79/228\n \n7/8\n24-24315 \n \n \n21. Acknowledges the importance of corporate sustainability reporting, \nencourages companies, especially publicly listed and large companies, to integrate \nsustainability and due diligence information into their reporting cycles, encourages \nindustry, interested Governments and relevant stakeholders, with the support of the \nUnited Nations system, as appropriate, to enhance existing models and develop new \nmodels for best practice and to facilitate action for the integration of sustainability \nreporting, taking into account experiences from already existing frameworks and \npaying particular attention to the needs of developing countries, including for \ncapacity-building, and welcomes in this context the collaboration of the United \nNations Global Compact with the Global Reporting Initiative and the World Business \nCouncil for Sustainable Development;  \n \n22. Requests the Secretary-General to continue to promote effective \nimplementation of the Guidelines on a Principle-based Approach to the Cooperation \nbetween the United Nations and the business sector;  \n \n23. Encourages the international community to strengthen global partnerships \nto foster youth employment and promote frameworks for action, including the Global \nJobs Pact of the International Labour Organization, the Global Initiative on Decent \nJobs for Youth and the call for action on youth employment, in accordance with \nnational plans and priorities;  \n \n24. Invites the academic, research and scientific communities to contribute to \nthe realization of the 2030 Agenda, and in this regard recognizes the important role \nof the United Nations Academic Impact, among other initiatives, and to support and \nparticipate in multi-stakeholder partnerships to this end;  \n \n25. Notes with appreciation the convening of the Global Africa Business \nInitiative annual forum, on the theme \u201cUnstoppable Africa\u201d, the Africa Business \nLeaders Coalition meeting, the annual United Nations Private Sector Forum, the \nUnited Nations Global Compact Leaders Summit, the Sustainable Development Goals \nInvestment Forum, the high-level meeting on the theme \u201cOcean for the future\u201d, the \nannual meeting of the Water Resilience Coalition initiative, as well as the Sustainable \nDevelopment Goals business forum, organized by the United Nations and the \nInternational Chamber of Commerce to foster the implementation of the Goals;  \n \n26. Recognizes the work and the important role of the Global Compact \nCountry Networks in supporting the implementation of the 2030 Agenda locally and \nthe work of the United Nations country teams and national development plans, as \nappropriate, and also recognizes that such networks provide an avenue for \ndisseminating United Nations values and principles, strengthening the capacity of \nbusinesses through programming and facilitating partnerships with business on a \nbroad scale, and notes the contribution of a number of these networks to voluntary \nnational reviews;  \n \n27. Also recognizes the importance of cooperation between the United Nations \nsystem at the local level, including the reinvigorated resident coordinator system, and \nall relevant stakeholders, as appropriate, in alignment with the United Nations \nSustainable Development Cooperation Framework, or equivalent planning \nframework, to support the coordination and application of global partnerships;  \n \n28. Stresses the importance of developing national strategies for the promotion \nof sustainable, inclusive and productive business and entrepreneurial activities \nthrough partnerships, encourages Governments to create an environment that is \nconducive to delivering the Sustainable Development Goals, including by increasing \nthe number of women in leadership, management and entrepreneurship and the size \nof their businesses, and to prevent discrimination, sexual harassment and abuse in the \nworkplace, requests the United Nations Global Compact to promote the Women\u2019s \n\nA/RES/79/228 \nTowards global partnerships: a principle-based approach to \nenhanced cooperation between the United Nations and all \nrelevant partners\n \n24-24315\n8/8 \n \nEmpowerment Principles and to encourage the Global Compact Country Networks to \ncreate awareness of the many ways in which business can promote gender equality in \nthe workplace, marketplace and community, and encourages the private sector to \ncontribute to advancing gender equality;  \n \n29. Welcomes the efforts of the United Nations Global Compact to engage \nMember States in its work through the United Nations Global Compact Government \nGroup and the United Nations Global Compact Group of Friends as two important \nchannels for Governments to engage on issues related to corporate sustainability, \nresponsible business practices and public-private partnerships for advancing the 2030 \nAgenda, and in that regard encourages Member States to further engage with the \nGlobal Compact through those channels;  \n \n30. Recognizes the importance of the private sector, multi-stakeholder \nengagement, innovative partnerships and a conducive policy environment in \nachieving the 2030 Agenda, including by increasing productive capacity in \ndeveloping countries and generating economic growth and sustainable and inclusive \nindustrialization, in order to tackle global challenges, and the need to encourage \nresponsible innovation, resilient value chains and the leveraging of rapid \ntechnological change for sustainable development, for the benefit of present and \nfuture generations, through new opportunities presented by safe, secure and \ntrustworthy emerging technologies, including artificial intelligence;  \n \n31. Recalls that multilateralism is not an option but a necessity, and calls for \nan enabling environment for partnerships that are aligned with the 2030 Agenda, in \nparticular with regard to adherence by the private sector to the 10 principles of the \nUnited Nations Global Compact, and in addition, inter alia, promotion of investment \nin quality, reliable, sustainable and resilient infrastructure and decent job creation, as \nwell as aiming for the reduction of greenhouse gas emissions and negative \nbiodiversity impacts, and for support for the implementation of the United Nations \nGlobal Compact strategy 2024\u20132025, including the United Nations Global Compact \nAfrica Strategy 2024\u20132025 and the United Nations Global Compact sustainable \nsupply chain and small and medium-sized enterprises programme, which are aimed \nat raising ambition and achieving stronger private sector engagement, accountability \nand partnerships, in support of a sustainable, resilient and inclusive recovery from \nCOVID-19;  \n \n32. Looks forward to the forthcoming twenty-fifth anniversary of the mandate \nof the United Nations Global Compact, in 2025, and the interest and engagement of \nthe private sector in advancing the Sustainable Development Goals through the \nexponential growth of the United Nations Global Compact participant base; \n \n33. Recognizes the role of the United Nations Global Compact in advancing \nthe adherence by the private sector to the 10 United Nations Global Compact \nprinciples of responsible business practices, in alignment with United Nations values \nand principles, in an enabling environment for partnerships that are aligned with the \n2030 Agenda;  \n \n34. Requests the Secretary-General to submit to the General Assembly at its \neighty-second session a report on the implementation of the present resolution, and \ndecides to include in the provisional agenda of its eighty-second session the item \nentitled \u201cTowards global partnerships\u201d, unless otherwise agreed. \n \n54th plenary meeting \n19 December 2024 \n \n",
  "paragraphs": {
    "1": "Takes note of the report of the Secretary-General on enhanced cooperation between the United Nations and all relevant partners, in particular the private sector; 2",
    "2": "Acknowledges that the implementation of the 2030 Agenda for Sustainable Development 3 requires a strong commitment to partnership at all levels between Governments, the private sector, civil society and all other relevant stakeholders, and therefore recognizes the importance of the various contributions of all relevant stakeholders, including the private sector;",
    "3": "Commits to enhancing global, regional, national and local partnerships for sustainable development, engaging all relevant stakeholders, including civil society, the private sector, academia and youth, recognizing the important contribution they __________________ 2 A/79/531. 3 Resolution 70/1. Towards global partnerships: a principle-based approach to enhanced cooperation between the United Nations and all relevant partners A/RES/79/228 5/8 24-24315 can make toward achieving the 2030 Agenda, and the localization of the Sustainable Development Goals, and reaffirms the importance of the regional and local dimension of sustainable development in addressing regional and local challenges and scaling up action among countries;",
    "4": "Stresses that partnerships are voluntary and collaborative relationships between various parties, both public and non-public, in which all participants agree to work together to achieve a common purpose or undertake a specific task and, as mutually agreed, to share risks and responsibilities, resources and benefits;",
    "5": "Also stresses that partnerships will be critical to the achievement of the Sustainable Development Goals, as an effective instrument for mobilizing additional human and financial resources, expertise, technology and knowledge, while reiterating that partnerships are a complement to, but are not intended as a substitute for, the commitment made by Governments with a view to achieving the Goals;",
    "6": "Further stresses that partnerships should be consistent with national laws and national development strategies and plans, as well as the priorities of countries where they are implemented, bearing in mind the relevant guidance provided by Governments;",
    "7": "Emphasizes the vital role played by Governments in promoting responsible business practices, including providing and ensuring enforcement of the necessary legal and regulatory frameworks in accordance with national legislation and development priorities, and invites them to continue to provide support to United Nations efforts to engage with the private sector and other relevant stakeholders, as appropriate;",
    "8": "Recognizes the vital role that the private sector plays in sustainable development, including by engaging in various partnership models, by conducting responsible business practices, by generating decent employment as well as investment, by giving access to and developing new technologies, by offering technical vocational training activities and by stimulating sustained, inclusive and sustainable economic growth;",
    "9": "Welcomes the efforts of the Secretary-General to steer the United Nations system towards giving greater attention to longer-term, strategic and innovation- based multi-stakeholder partnerships in order to leverage private sector competencies and technologies, with a view to generating greater potential for innovation and increased impact on sustainable development, which is needed for the timely achievement of the Sustainable Development Goals;",
    "10": "Emphasizes that the Secretary-General, in his capacity as Chair of the United Nations System Chief Executives Board for Coordination, and the executive heads of interested organizations should build on existing and ongoing efforts and continue to empower the United Nations Innovation Network or other existing United Nations joint innovation initiatives, such as Global Pulse, to identify and discuss issues that are relevant for the coordination of the existing innovation initiatives, funds, laboratories, accelerators and incubators, and their interface with the private sector, with a view to facilitating and stimulating innovation in the implementation of the 2030 Agenda;",
    "11": "Encourages the United Nations funds and programmes to continue to actively engage with other stakeholders, including civil society, the private sector and foundations, with a view to diversifying potential sources of funding, especially core funding, for their operational activities for development, in alignment with the core principles of the United Nations development system and with full respect for the national priorities of programme countries; A/RES/79/228 Towards global partnerships: a principle-based approach to enhanced cooperation between the United Nations and all relevant partners 24-24315 6/8",
    "12": "Recognizes that these partnerships should give priority to core resources, while noting the need to make non-core resources from partners flexible and aligned with strategic plans and national priorities;",
    "13": "Stresses that greater effort is required to unlock new financial flows, including from mainstream institutional investors, for the timely implementation of the 2030 Agenda, as a complement to public finance and international development cooperation;",
    "14": "Welcomes the growing number of businesses that embrace a core business model that takes account of the environmental, social and governance impacts of their activities, encourages and urges all businesses to adopt principles for responsible business and investing, and supports the work of the United Nations Global Compact in this regard;",
    "15": "Calls upon the United Nations funds, programmes and the specialized agencies, at the request of national Governments, to improve their support for the building, development and strengthening of national capacities, to support development results at the country level and to promote national ownership and leadership, in line with national development policies, plans and priorities, taking into account their respective mandates and bearing in mind their comparative advantages, in assisting Governments in leveraging partnerships;",
    "16": "Welcomes the ongoing efforts of the Secretary-General to further improve the collaboration of the United Nations with all relevant partners, including the private sector, and recognizes his efforts to strengthen the capacities of the United Nations system, including by mainstreaming understanding of the role of partnerships throughout the system, and to discuss the potential for further strengthening of cooperation and coordination across the United Nations system with regard to partnerships, with a view to enhancing the results achieved through them, while acknowledging the importance of continued consultations with Member States;",
    "17": "Also welcomes the commitment of the Secretary-General to continuing to retain the integrity and unique role of the United Nations Global Compact, and underlines the importance of integrity measures as taken and advocated by the United Nations Global Compact;",
    "18": "Invites the United Nations system, when considering partnerships, to seek to engage in a more coherent manner with private sector entities, including micro-, small and medium-sized enterprises, that support the core values of the United Nations, as reflected in the Charter of the United Nations and other relevant conventions and treaties, and that commit to the 10 principles of the United Nations Global Compact by translating them into operational corporate policies, codes of conduct, and management, monitoring and reporting systems;",
    "19": "Recalls the request to the Secretary-General, in this regard, as appropriate, in collaboration with the funds and programmes, the specialized agencies and other relevant United Nations entities and mechanisms, to disclose the partners, contributions and matching funds for all relevant partnerships, including at the country level, and to ensure that these elements are coherently reflected in the reporting of partnership activities by the United Nations funds, programmes and, as appropriate, agencies to their respective governing bodies;",
    "20": "Stresses the need for the United Nations system to continue its efforts to develop, for those partnerships in which it participates, a common and coherent approach across the United Nations system that places greater emphasis on transparency, impact, accountability, due diligence and risk management, while taking into account the specific mandates of United Nations agencies, programmes and other entities and without imposing undue rigidity in partnership agreements; Towards global partnerships: a principle-based approach to enhanced cooperation between the United Nations and all relevant partners A/RES/79/228 7/8 24-24315",
    "21": "Acknowledges the importance of corporate sustainability reporting, encourages companies, especially publicly listed and large companies, to integrate sustainability and due diligence information into their reporting cycles, encourages industry, interested Governments and relevant stakeholders, with the support of the United Nations system, as appropriate, to enhance existing models and develop new models for best practice and to facilitate action for the integration of sustainability reporting, taking into account experiences from already existing frameworks and paying particular attention to the needs of developing countries, including for capacity-building, and welcomes in this context the collaboration of the United Nations Global Compact with the Global Reporting Initiative and the World Business Council for Sustainable Development;",
    "22": "Requests the Secretary-General to continue to promote effective implementation of the Guidelines on a Principle-based Approach to the Cooperation between the United Nations and the business sector;",
    "23": "Encourages the international community to strengthen global partnerships to foster youth employment and promote frameworks for action, including the Global Jobs Pact of the International Labour Organization, the Global Initiative on Decent Jobs for Youth and the call for action on youth employment, in accordance with national plans and priorities;",
    "24": "Invites the academic, research and scientific communities to contribute to the realization of the 2030 Agenda, and in this regard recognizes the important role of the United Nations Academic Impact, among other initiatives, and to support and participate in multi-stakeholder partnerships to this end;",
    "25": "Notes with appreciation the convening of the Global Africa Business Initiative annual forum, on the theme \u201cUnstoppable Africa\u201d, the Africa Business Leaders Coalition meeting, the annual United Nations Private Sector Forum, the United Nations Global Compact Leaders Summit, the Sustainable Development Goals Investment Forum, the high-level meeting on the theme \u201cOcean for the future\u201d, the annual meeting of the Water Resilience Coalition initiative, as well as the Sustainable Development Goals business forum, organized by the United Nations and the International Chamber of Commerce to foster the implementation of the Goals;",
    "26": "Recognizes the work and the important role of the Global Compact Country Networks in supporting the implementation of the 2030 Agenda locally and the work of the United Nations country teams and national development plans, as appropriate, and also recognizes that such networks provide an avenue for disseminating United Nations values and principles, strengthening the capacity of businesses through programming and facilitating partnerships with business on a broad scale, and notes the contribution of a number of these networks to voluntary national reviews;",
    "27": "Also recognizes the importance of cooperation between the United Nations system at the local level, including the reinvigorated resident coordinator system, and all relevant stakeholders, as appropriate, in alignment with the United Nations Sustainable Development Cooperation Framework, or equivalent planning framework, to support the coordination and application of global partnerships;",
    "28": "Stresses the importance of developing national strategies for the promotion of sustainable, inclusive and productive business and entrepreneurial activities through partnerships, encourages Governments to create an environment that is conducive to delivering the Sustainable Development Goals, including by increasing the number of women in leadership, management and entrepreneurship and the size of their businesses, and to prevent discrimination, sexual harassment and abuse in the workplace, requests the United Nations Global Compact to promote the Women\u2019s A/RES/79/228 Towards global partnerships: a principle-based approach to enhanced cooperation between the United Nations and all relevant partners 24-24315 8/8 Empowerment Principles and to encourage the Global Compact Country Networks to create awareness of the many ways in which business can promote gender equality in the workplace, marketplace and community, and encourages the private sector to contribute to advancing gender equality;",
    "29": "Welcomes the efforts of the United Nations Global Compact to engage Member States in its work through the United Nations Global Compact Government Group and the United Nations Global Compact Group of Friends as two important channels for Governments to engage on issues related to corporate sustainability, responsible business practices and public-private partnerships for advancing the 2030 Agenda, and in that regard encourages Member States to further engage with the Global Compact through those channels;",
    "30": "Recognizes the importance of the private sector, multi-stakeholder engagement, innovative partnerships and a conducive policy environment in achieving the 2030 Agenda, including by increasing productive capacity in developing countries and generating economic growth and sustainable and inclusive industrialization, in order to tackle global challenges, and the need to encourage responsible innovation, resilient value chains and the leveraging of rapid technological change for sustainable development, for the benefit of present and future generations, through new opportunities presented by safe, secure and trustworthy emerging technologies, including artificial intelligence;",
    "31": "Recalls that multilateralism is not an option but a necessity, and calls for an enabling environment for partnerships that are aligned with the 2030 Agenda, in particular with regard to adherence by the private sector to the 10 principles of the United Nations Global Compact, and in addition, inter alia, promotion of investment in quality, reliable, sustainable and resilient infrastructure and decent job creation, as well as aiming for the reduction of greenhouse gas emissions and negative biodiversity impacts, and for support for the implementation of the United Nations Global Compact strategy 2024\u20132025, including the United Nations Global Compact Africa Strategy 2024\u20132025 and the United Nations Global Compact sustainable supply chain and small and medium-sized enterprises programme, which are aimed at raising ambition and achieving stronger private sector engagement, accountability and partnerships, in support of a sustainable, resilient and inclusive recovery from COVID-19;",
    "32": "Looks forward to the forthcoming twenty-fifth anniversary of the mandate of the United Nations Global Compact, in 2025, and the interest and engagement of the private sector in advancing the Sustainable Development Goals through the exponential growth of the United Nations Global Compact participant base;",
    "33": "Recognizes the role of the United Nations Global Compact in advancing the adherence by the private sector to the 10 United Nations Global Compact principles of responsible business practices, in alignment with United Nations values and principles, in an enabling environment for partnerships that are aligned with the 2030 Agenda;",
    "34": "Requests the Secretary-General to submit to the General Assembly at its eighty-second session a report on the implementation of the present resolution, and decides to include in the provisional agenda of its eighty-second session the item entitled \u201cTowards global partnerships\u201d, unless otherwise agreed. 54th plenary meeting 19 December 2024"
  },
  "agenda_items": [
    "Item 25"
  ],
  "symbol_references": []
}