{
  "symbol": "A/RES/74/212",
  "filename": "A_RES_74_212.pdf",
  "title": "74/212. International Day of Clean Air for blue skies",
  "text": "United Nations \nA/RES/74/212\n \n \nGeneral Assembly \nDistr.: General \n22 January 2020 \n \n19-22425 (E)    230120 \n*1922425* \n \n \nSeventy-fourth session \nAgenda item 19 \nSustainable development \n \n \n \n \n Resolution adopted by the General Assembly \non 19 December 2019 \n \n \n \n \n[on the report of the Second Committee (A/74/381)] \n \n \n 74/212. International Day of Clean Air for blue skies \n \n \n \nThe General Assembly, \n \nReaffirming its resolution 70/1 of 25 September 2015, entitled \u201cTransforming \nour world: the 2030 Agenda for Sustainable Development\u201d, in which it adopted a \ncomprehensive, far-reaching and people-centred set of universal and transformative \nSustainable Development Goals and targets, its commitment to working tirelessly for \nthe full implementation of the Agenda by 2030, its recognition that eradicating \npoverty in all its forms and dimensions, including extreme poverty, is the greatest \nglobal challenge and an indispensable requirement for sustainable development, its \ncommitment to achieving sustainable development in its three dimensions \u2013 \neconomic, social and environmental \u2013 in a balanced and integrated manner, and to \nbuilding upon the achievements of the Millennium Development Goals and seeking \nto address their unfinished business, \n \nReaffirming also its resolutions 53/199 of 15 December 1998 and 61/185 of \n20 December 2006 on the proclamation of international years, and Economic and \nSocial Council resolution 1980/67 of 25 July 1980 on international years and \nanniversaries, particularly paragraphs 1 to 10 of the annex thereto on the agreed \ncriteria for the proclamation of international years, as well as paragraphs 13 and 14, \nin which it is stated that an international day or year should not be proclaimed before \nthe basic arrangements for its organization and financing have been made, \n \nRecalling the need to substantially reduce the number of deaths and illnesses \nfrom hazardous chemicals and air, water and soil pollution and contamination by \n2030, as well as to reduce the adverse per capita environmental impact of cities, \nincluding by paying special attention to air quality and municipal and other waste \nmanagement by 2030, \n \nRecognizing that clean air is important for the health and day-to-day lives of \npeople, mindful that air pollution is the single greatest environmental risk to human \n\nA/RES/74/212 \nInternational Day of Clean Air for blue skies\n \n19-22425\n2/2 \n \nhealth and one of the main avoidable causes of death and disease globally, recognizing \nalso that air pollution disproportionately affects women, children and older persons, \nand concerned also by the negative impact of air pollution on ecosystems, \n \nRecalling United Nations Environment Assembly resolution 3/8 of 6 December \n2017,1 World Health Assembly resolution 68.8 of 26 May 2015 2 and Economic and \nSocial Commission for Asia and the Pacific resolution 75/4 of 31 May 2019, \n \nEmphasizing the need to strengthen international cooperation at the global, \nregional and subregional levels in various areas related to improving air quality, \nincluding the collection and utilization of data, joint research and development, and \nthe sharing of best practices, \n \nAcknowledging the importance of and urgent need to raise public awareness at \nall levels and to promote and facilitate actions to improve air quality, bearing in mind \nthat clean air is important for the health and livelihood of people, \n \nAppreciating the progress made in combating air pollution as seen in various \nprojects, partnerships, mechanisms and instruments at the national, regional and \nglobal levels, \n \nAcknowledging that improving air quality can enhance climate change \nmitigation and that climate change mitigation efforts can improve air quality, \n \nEncouraged by the increasing interest of the international community in clean \nair, and emphasizing the need to make further efforts to improve air quality, including \nreducing air pollution, to protect human health, \n \n1. \nDecides to designate 7 September as the International Day of Clean Air \nfor blue skies, to be observed starting in 2020; \n \n2. \nInvites all Member States, organizations of the United Nations system, \nother international and regional organizations and civil society, including \nnon-governmental organizations, individuals and other relevant stakeholders, to \nobserve the International Day in an appropriate manner and in accordance with \nnational priorities, and to continue to give consideration to enhancing international \ncooperation in support of the efforts of all Member States towards attaining clean air; \n \n3. \nInvites the United Nations Environment Programme to facilitate the \nobservance of the International Day, in collaboration with other relevant \norganizations, mindful of the provisions contained in the annex to Economic and \nSocial Council resolution 1980/67 of 25 July 1980; \n \n4. \nStresses that the cost of all activities that may arise from the \nimplementation of the present resolution should be met from voluntary contributions; \n \n5. \nRequests the Secretary-General to bring the present resolution to the \nattention of all Member States, the organizations of the United Nations system and \nother relevant intergovernmental and non-governmental organizations, to promote the \nobservance of the International Day. \n \n52nd plenary meeting \n19 December 2019 \n \n__________________ \n \n1  UNEP/EA.3/Res.8. \n \n2  See World Health Organization, document WHA68/2015/REC/1. \n",
  "paragraphs": {
    "1": "Decides to designate 7 September as the International Day of Clean Air for blue skies, to be observed starting in 2020;",
    "2": "Invites all Member States, organizations of the United Nations system, other international and regional organizations and civil society, including non-governmental organizations, individuals and other relevant stakeholders, to observe the International Day in an appropriate manner and in accordance with national priorities, and to continue to give consideration to enhancing international cooperation in support of the efforts of all Member States towards attaining clean air;",
    "3": "Invites the United Nations Environment Programme to facilitate the observance of the International Day, in collaboration with other relevant organizations, mindful of the provisions contained in the annex to Economic and Social Council resolution 1980/67 of 25 July 1980;",
    "4": "Stresses that the cost of all activities that may arise from the implementation of the present resolution should be met from voluntary contributions;",
    "5": "Requests the Secretary-General to bring the present resolution to the attention of all Member States, the organizations of the United Nations system and other relevant intergovernmental and non-governmental organizations, to promote the observance of the International Day."
  },
  "agenda_items": [
    "Item 19"
  ],
  "symbol_references": []
}