{
  "symbol": "A/RES/73/282",
  "filename": "A_RES_73_282.pdf",
  "title": "73/282. Commemoration of the one-hundredth anniversary of the establishment of the International Labour Organization",
  "text": "United Nations \nA/RES/73/282\n \n \nGeneral Assembly \nDistr.: General \n17 January 2019 \n \n19-00639 (E)    210119 \n*1900639* \n \n \nSeventy-third session \nAgenda item 14 \n \n \n \n \n Resolution adopted by the General Assembly \non 15 January 2019 \n \n \n \n \n[without reference to a Main Committee (A/73/L.73 and A/73/L.73/Add.1)] \n \n \n 73/282. Commemoration of the one-hundredth anniversary of the \nestablishment of the International Labour Organization  \n \n \n \nThe General Assembly,  \n \nRecalling that the International Labour Organization was established in 1919 to \npursue a vision based on the premise that universal, lasting peace can be established \nonly if it is based on social justice, \n \nRecalling also that in 1946 the International Labour Organization became the \nfirst specialized agency of the United Nations, \n \nRecognizing that the International Labour Organization is the principal United \nNations specialized agency responsible for coordinating policies in the world of work, \n \nConsidering that 2019 will mark the one-hundredth anniversary of the \nestablishment of the International Labour Organization,  \n \n1. \nCongratulates the International Labour Organization on the occasion of \nthe one-hundredth anniversary of its establishment; \n \n2. \nNotes with satisfaction the positive contributions that the International \nLabour Organization has made during its 100 years of promoting social justice; \n \n3. \nDecides to devote one day, during its seventy-third session, to the \ncommemoration, within existing resources, of the one-hundredth anniversary of the \nestablishment of the International Labour Organization under the theme \u201cThe future \nof work\u201d;  \n \n4. \nAlso decides, as part of the commemoration of the one-hundredth \nanniversary of the establishment of the International Labour Organization, to convene \na high-level plenary meeting of the General Assembly, to be held on 10 April 2019;  \n \n5. \nDeclares that the commemorative plenary meeting will be held in the \nGeneral Assembly Hall; \n\nA/RES/73/282 \nCommemoration of the one-hundredth anniversary of the\nestablishment of the International Labour Organization\n \n19-00639\n2/2 \n \n \n6. \nDecides that the Director-General of the International Labour \nOrganization, the General Secretary of the International Trade Union Confederation, \nthe President of the International Organization of Employers and a youth \nrepresentative, to be identified by the President of the General Assembly, will address \nthe commemorative plenary meeting; \n \n7. \nRequests the President of the General Assembly, in a transparent manner \nand in consultation with Member States, with support from the International Labour \nOrganization, to finalize the organizational arrangements, including identification of \nthe sub-themes and panellists, with due regard given to gender balance and equitable \ngeographical distribution, for two interactive panel discussions, to be held following \nthe commemorative plenary meeting, one from 3 to 4.25 p.m. and the other from \n4.30 to 5.55 p.m., followed by a brief closing segment of the plenary meeting;  \n \n8. \nAlso requests the President of the General Assembly to prepare and bring \nto the attention of Member States a summary of the panel discussions and to transmit \nthe summary to the high-level political forum on sustainable development, convened \nunder the auspices of the Economic and Social Council, to be held in 2019.  \n \n66th plenary meeting  \n15 January 2019 \n \n",
  "paragraphs": {
    "1": "Congratulates the International Labour Organization on the occasion of the one-hundredth anniversary of its establishment;",
    "2": "Notes with satisfaction the positive contributions that the International Labour Organization has made during its 100 years of promoting social justice;",
    "3": "Decides to devote one day, during its seventy-third session, to the commemoration, within existing resources, of the one-hundredth anniversary of the establishment of the International Labour Organization under the theme \u201cThe future of work\u201d;",
    "4": "Also decides, as part of the commemoration of the one-hundredth anniversary of the establishment of the International Labour Organization, to convene a high-level plenary meeting of the General Assembly, to be held on 10 April 2019;",
    "5": "Declares that the commemorative plenary meeting will be held in the General Assembly Hall; A/RES/73/282 Commemoration of the one-hundredth anniversary of the establishment of the International Labour Organization 19-00639 2/2",
    "6": "Decides that the Director-General of the International Labour Organization, the General Secretary of the International Trade Union Confederation, the President of the International Organization of Employers and a youth representative, to be identified by the President of the General Assembly, will address the commemorative plenary meeting;",
    "7": "Requests the President of the General Assembly, in a transparent manner and in consultation with Member States, with support from the International Labour Organization, to finalize the organizational arrangements, including identification of the sub-themes and panellists, with due regard given to gender balance and equitable geographical distribution, for two interactive panel discussions, to be held following the commemorative plenary meeting, one from 3 to 4.25 p.m. and the other from 4.30 to 5.55 p.m., followed by a brief closing segment of the plenary meeting;",
    "8": "Also requests the President of the General Assembly to prepare and bring to the attention of Member States a summary of the panel discussions and to transmit the summary to the high-level political forum on sustainable development, convened under the auspices of the Economic and Social Council, to be held in 2019. 66th plenary meeting 15 January 2019"
  },
  "agenda_items": [
    "Item 14"
  ],
  "symbol_references": [
    "A/73/L.73"
  ]
}