{
  "symbol": "A/RES/79/73",
  "filename": "A_RES_79_73.pdf",
  "title": "79/73. Activities and operations of the United Nations Institute for Disarmament Research",
  "text": "United Nations \nA/RES/79/73\n \n \nGeneral Assembly \nDistr.: General \n9 December 2024 \n \n24-23068 (E) \n*2423068* \n \n \nSeventy-ninth session \nAgenda item 100 \nReview of the implementation of the recommendations and \ndecisions adopted by the General Assembly at its tenth \nspecial session \n \n \n \n \n Resolution adopted by the General Assembly \non 2 December 2024 \n \n \n \n \n[on the report of the First Committee (A/79/410, para. 12)] \n \n \n \n79/73. Activities and operations of the United Nations Institute for \nDisarmament Research \n \n \n \nThe General Assembly, \n \nRecalling its resolution 34/83 M of 11 December 1979, in which it requested the \nSecretary-General to establish the United Nations Institute for Disarmament \nResearch, and its resolution 39/148 H of 17 December 1984, in which it approved the \nstatute of the Institute,  \n \nRecalling also its resolutions 45/62 G of 4 December 1990, 55/35 A of \n20 November 2000, 60/89 of 8 December 2005, 65/87 of 8 December 2010, 70/69 of \n11 December 2015 and 75/82 of 7 December 2020 on the tenth, twentieth, twenty-\nfifth, thirtieth, thirty-fifth and fortieth anniversaries of the Institute,  \n \nConsidering the important need for the international community to have access \nto independent and in-depth research on security issues and prospects for \ndisarmament and non-proliferation, particularly as various complex security \ndilemmas are converging to reshape the geopolitical landscape, \n \nUnderlining the significant contribution of the Institute to innovative analysis \nand productive thinking on multilateral disarmament and international security issues, \nand acknowledging the adaptation and expansion of its programmatic work better to \nfollow the contours of a rapidly changing international security environment, \n \nRecognizing the ongoing and potential impact of the Institute, through its \nresearch, seminars, networks, outreach activities, publications, confidence-building \nmeasures and capacity-building initiatives, in particular for developing countries, to \nsupport negotiations on disarmament and reinvigorate efforts to ensure greater \ninternational security through progressively lower levels of armament, and to \ncontribute to education in this research area,  \n\nA/RES/79/73 \nActivities and operations of the United Nations Institute for \nDisarmament Research\n \n24-23068\n2/3 \n \n \nRecognizing also the importance of the Institute\u2019s essential research leadership \nelements,  \n \nWelcoming the significant growth of the Institute\u2019s research activities and the \nnotable rise in its productivity in response to growing global demand, with an increase \nof over 200 per cent in event and publication figures since 2020 and a broadening of \nthe range of topics covered by the Institute, \n \nWelcoming also the Institute\u2019s efforts and progress to improve diversity of both \ninternational reach and meaningful participation, which is increasingly reflected in \nits donor base, personnel, partnerships, networks and worldwide hosting of events, \n \nNoting the continued growth in overall voluntary contributions to the Institute, \nand expressing its appreciation to Governments and other strategic partners that have \nsupported or contributed to the Institute in the furtherance of its mission, \n \nReiterating its concern that the Institute relies almost exclusively on voluntary \ncontributions, which could affect the sustainability of its core research leadership \nelements,  \n \nRecognizing that a continuing, solid financial foundation is instrumental to the \nability of the Institute, as an autonomous institution within the framework of the \nUnited Nations, to sustain its statutory research functions, attract world-class \nresearchers to key positions, respond to growing demands for advisory support from \nthe international community, and carry out its mandate to promote informed \nparticipation by all States in disarmament efforts, \n \nReiterating the importance of the Institute\u2019s location in Geneva, \n \nLooking forward to the forty-fifth anniversary of the establishment of the \nInstitute in 2025, \n \n1. \nRecognizes the importance, the timeliness, the high quality and the impact \nof the work of the Institute;  \n \n2. \nReiterates its conviction that the Institute should continue to conduct \nindependent research on problems relating to disarmament and international security \nand to undertake specialized research requiring a high degree of expertise;  \n \n3. \nEmphasizes the importance of the Institute as a stand-alone, autonomous \ninstitution that contributes, through its research, analysis and activities, to progress \nin disarmament and, ultimately, to a more secure world;  \n \n4. \nUnderlines the valuable contribution that the Institute makes and should \ncontinue to make in the field of disarmament, non-proliferation education and \ncapacity-building in all regions of the world;  \n \n5. \nRecalls the appeals1 to all Member States to continue or begin to provide \nvoluntary financial support to the Institute, if possible multiannual, and strongly \nencourages them to unearmark, or softly earmark, these contributions, for example \nthrough programmatic-level funding, so as to contribute to its viability, independence, \nimpartiality and the quality of its work over the long term;  \n \n6. \nRequests the Secretary-General to continue to provide accommodation for \nthe Institute in the Palais des Nations in Geneva at the reduced rate established to \ncover operational expenses only; \n \n7. \nInvites the Secretary-General to carefully assess the finances and the \nfinancial needs of the Institute and to provide budgetary recommendations, if \nnecessary, and taking into account the latest report of the Advisory Board on \n__________________ \n \n1  See resolution 75/82 and A/73/284. \n\nActivities and operations of the United Nations Institute for \nDisarmament Research \nA/RES/79/73\n \n3/3\n24-23068 \n \nDisarmament Matters,2 in its capacity as the Board of Trustees of the Institute, as an \nexceptional measure to ensure the financial stability of the Institute. \n \n44th plenary meeting \n2 December 2024 \n \n__________________ \n \n2  A/79/240. \n",
  "paragraphs": {
    "1": "Recognizes the importance, the timeliness, the high quality and the impact of the work of the Institute;",
    "2": "Reiterates its conviction that the Institute should continue to conduct independent research on problems relating to disarmament and international security and to undertake specialized research requiring a high degree of expertise;",
    "3": "Emphasizes the importance of the Institute as a stand-alone, autonomous institution that contributes, through its research, analysis and activities, to progress in disarmament and, ultimately, to a more secure world;",
    "4": "Underlines the valuable contribution that the Institute makes and should continue to make in the field of disarmament, non-proliferation education and capacity-building in all regions of the world;",
    "5": "Recalls the appeals1 to all Member States to continue or begin to provide voluntary financial support to the Institute, if possible multiannual, and strongly encourages them to unearmark, or softly earmark, these contributions, for example through programmatic-level funding, so as to contribute to its viability, independence, impartiality and the quality of its work over the long term;",
    "6": "Requests the Secretary-General to continue to provide accommodation for the Institute in the Palais des Nations in Geneva at the reduced rate established to cover operational expenses only;",
    "7": "Invites the Secretary-General to carefully assess the finances and the financial needs of the Institute and to provide budgetary recommendations, if necessary, and taking into account the latest report of the Advisory Board on Disarmament Matters,2 in its capacity as the Board of Trustees of the Institute, as an exceptional measure to ensure the financial stability of the Institute."
  },
  "agenda_items": [
    "Item 100"
  ],
  "symbol_references": []
}