{
  "symbol": "A/RES/78/248",
  "filename": "A_RES_78_248.pdf",
  "title": "78/248. Administration of justice at the United Nations",
  "text": "United Nations \nA/RES/78/248\n \n \nGeneral Assembly \nDistr.: General \n28 December 2023 \n \n23-26262 (E)    040124     \n*2326262* \n \n \nSeventy-eighth session \nAgenda item 144 \nAdministration of justice at the United Nations \n \n \n \n \n Resolution adopted by the General Assembly \non 22 December 2023 \n \n \n \n \n[on the report of the Fifth Committee (A/78/663, para. 6)] \n \n \n 78/248. Administration of justice at the United Nations \n \n \n \nThe General Assembly, \n \nRecalling section XI of its resolution 55/258 of 14 June 2001 and its resolutions \n57/307 of 15 April 2003, 59/266 of 23 December 2004, 59/283 of 13 April 2005, \n61/261 of 4 April 2007, 62/228 of 22 December 2007, 63/253 of 24 December 2008, \n64/233 of 22 December 2009, 65/251 of 24 December 2010, 66/237 of 24 December \n2011, 67/241 of 24 December 2012, 68/254 of 27 December 2013, 69/203 of \n18 December 2014, 70/112 of 14 December 2015, 71/266 of 23 December 2016, \n72/256 of 24 December 2107, 73/276 of 22 December 2018, 74/258 of 27 December \n2019, 75/248 of 31 December 2020, 76/242 of 24 December 2021 and 77/260 of \n30 December 2022, \n \nHaving considered the reports of the Secretary-General on administration of \njustice at the United Nations1 and on the activities of the Office of the United Nations \nOmbudsman and Mediation Services,2 the report of the Internal Justice Council on \nadministration of justice at the United Nations3 and the related report of the Advisory \nCommittee on Administrative and Budgetary Questions, 4 as well as the letter dated \n20 November 2023 from the President of the General Assembly addressed to the Chair \nof the Fifth Committee,5 \n \n1. \nTakes note of the report of the Secretary-General on administration of \njustice at the United Nations and on the activities of the Office of the United Nations \nOmbudsman and Mediation Services, the report of the Internal Justice Council on \n__________________ \n \n1  A/78/156. \n \n2  A/78/170. \n \n3  A/78/121. \n \n4  A/78/580. \n \n5  A/C.5/78/20. \n\nA/RES/78/248 \nAdministration of justice at the United Nations\n \n23-26262\n2/3 \n \nadministration of justice at the United Nations and the related report of the Advisory \nCommittee on Administrative and Budgetary Questions;  \n \n2. \nEndorses the conclusions and recommendations contained in the report of \nthe Advisory Committee; \n \n \n \nI \n \n \nSystem of administration of justice \n \n \n3. \nEmphasizes the importance of the principle of judicial independence in the \nsystem of administration of justice; \n \n4. \nStresses the importance of ensuring access for all staff members to the \nsystem of administration of justice, regardless of their duty station; \n \n5. \nAcknowledges the evolving nature of the system of administration of \njustice and the need to carefully monitor its implementation to ensure that it remains \nwithin the parameters set out by the General Assembly; \n \n6. \nReaffirms its decision, contained in paragraph 4 of its resolution 61/261, \nto establish a new, independent, transparent, professionalized, adequately resourced \nand decentralized system of administration of justice consistent with the relevant \nrules of international law and the principles of the rule of law and due process to \nensure respect for the rights and obligations of staff members and the accountability \nof managers and staff members alike; \n \n7. \nCommends the Secretary-General for ensuring the availability of outreach \ndocuments in all six official languages, requests the Secretary-General to intensify \nhis efforts to implement multilingualism within the system of administration of \njustice, and also requests the Secretary-General to report on his efforts to continue to \npromote multilingualism in the system of administration of justice in the context of \nhis future reports; \n \n8. \nRecalls paragraph 6 of the report of the Advisory Committee, and further \nrequests the Secretary-General to provide a comprehensive assessment of the \nfunctioning of the system of administration of justice in his next report; \n \n \n \nII \n \n \nInformal system \n \n \n9. \nRecognizes that the informal system of administration of justice is an \nefficient and effective option both for staff who seek redress of grievances and for the \nparticipation of managers; \n \n10. Reaffirms that the informal resolution of conflict is a crucial element of \nthe system of administration of justice, emphasizes that all possible use should be \nmade of the informal system in order to avoid unnecessary litigation, without \nprejudice to the basic right of staff members to access the formal system, and \nencourages recourse to the informal resolution of disputes; \n \n11. \nDecides to regularize the pilot project for access of non-staff personnel to \nthe services of the Office of the United Nations Ombudsman and Mediation Services, \nwithin existing resources; \n \n \n \nIII \n \n \nFormal system \n \n \n12. Recognizes the ongoing positive contribution of the Office of Staff Legal \nAssistance to the system of administration of justice;  \n\nAdministration of justice at the United Nations \nA/RES/78/248\n \n3/3\n23-26262 \n \n \n13. Recalls paragraph 7 of its resolution 63/253, and reaffirms that interns, \ntype II gratis personnel and volunteers (other than United Nations Volunteers) shall \nhave the possibility of requesting an appropriate management evaluation but shall not \nhave access to the United Nations Dispute Tribunal or to the United Nations Appeals \nTribunal;  \n \n14. Decides to approve the following amendment to the statute of the United \nNations Dispute Tribunal:  \nArticle 9, new paragraph 4: \n4. \nIn hearing an application to appeal an administrative decision imposing a \ndisciplinary measure, the Dispute Tribunal shall pass judgment on the \napplication by conducting a judicial review. In conducting a judicial review, the \nDispute Tribunal shall consider the record assembled by the Secretary-General \nand may admit other evidence to make an assessment on whether the facts on \nwhich the disciplinary measure was based have been established by evidence; \nwhether the established facts legally amount to misconduct; whether the \napplicant\u2019s due process rights were observed; and whether the disciplinary \nmeasure imposed was proportionate to the offence. \n \n \n \nIV \n \n \nOther issues \n \n \n15. Invites the Sixth Committee to consider the legal aspects of the report to \nbe submitted by the Secretary-General, without prejudice to the role of the Fifth \nCommittee as the Main Committee entrusted with responsibilities for administrative \nand budgetary matters; \n \n16. Recalls paragraph 44 of its resolution 73/276 and paragraph 35 of its \nresolution 77/260, stresses that the system of administration of justice must work in \naccordance with the Charter of the United Nations and the legal and regulatory \nframework approved by the General Assembly, and reaffirms that the Dispute \nTribunal and the Appeals Tribunal shall exercise their powers according to their \nrespective statutes.  \n \n50th (resumed) plenary meeting \n22 December 2023 \n \n",
  "paragraphs": {
    "1": "Takes note of the report of the Secretary-General on administration of justice at the United Nations and on the activities of the Office of the United Nations Ombudsman and Mediation Services, the report of the Internal Justice Council on __________________ 1 A/78/156. 2 A/78/170. 3 A/78/121. 4 A/78/580. 5 A/C.5/78/20. A/RES/78/248 Administration of justice at the United Nations 23-26262 2/3 administration of justice at the United Nations and the related report of the Advisory Committee on Administrative and Budgetary Questions;",
    "2": "Endorses the conclusions and recommendations contained in the report of the Advisory Committee; I System of administration of justice",
    "3": "Emphasizes the importance of the principle of judicial independence in the system of administration of justice;",
    "4": "In hearing an application to appeal an administrative decision imposing a disciplinary measure, the Dispute Tribunal shall pass judgment on the application by conducting a judicial review. In conducting a judicial review, the Dispute Tribunal shall consider the record assembled by the Secretary-General and may admit other evidence to make an assessment on whether the facts on which the disciplinary measure was based have been established by evidence; whether the established facts legally amount to misconduct; whether the applicant\u2019s due process rights were observed; and whether the disciplinary measure imposed was proportionate to the offence. IV Other issues",
    "5": "Acknowledges the evolving nature of the system of administration of justice and the need to carefully monitor its implementation to ensure that it remains within the parameters set out by the General Assembly;",
    "6": "Reaffirms its decision, contained in paragraph 4 of its resolution 61/261, to establish a new, independent, transparent, professionalized, adequately resourced and decentralized system of administration of justice consistent with the relevant rules of international law and the principles of the rule of law and due process to ensure respect for the rights and obligations of staff members and the accountability of managers and staff members alike;",
    "7": "Commends the Secretary-General for ensuring the availability of outreach documents in all six official languages, requests the Secretary-General to intensify his efforts to implement multilingualism within the system of administration of justice, and also requests the Secretary-General to report on his efforts to continue to promote multilingualism in the system of administration of justice in the context of his future reports;",
    "8": "Recalls paragraph 6 of the report of the Advisory Committee, and further requests the Secretary-General to provide a comprehensive assessment of the functioning of the system of administration of justice in his next report; II Informal system",
    "9": "Recognizes that the informal system of administration of justice is an efficient and effective option both for staff who seek redress of grievances and for the participation of managers;",
    "10": "Reaffirms that the informal resolution of conflict is a crucial element of the system of administration of justice, emphasizes that all possible use should be made of the informal system in order to avoid unnecessary litigation, without prejudice to the basic right of staff members to access the formal system, and encourages recourse to the informal resolution of disputes;",
    "11": "Decides to regularize the pilot project for access of non-staff personnel to the services of the Office of the United Nations Ombudsman and Mediation Services, within existing resources; III Formal system",
    "12": "Recognizes the ongoing positive contribution of the Office of Staff Legal Assistance to the system of administration of justice; Administration of justice at the United Nations A/RES/78/248 3/3 23-26262",
    "13": "Recalls paragraph 7 of its resolution 63/253, and reaffirms that interns, type II gratis personnel and volunteers (other than United Nations Volunteers) shall have the possibility of requesting an appropriate management evaluation but shall not have access to the United Nations Dispute Tribunal or to the United Nations Appeals Tribunal;",
    "14": "Decides to approve the following amendment to the statute of the United Nations Dispute Tribunal: Article 9, new paragraph 4:",
    "15": "Invites the Sixth Committee to consider the legal aspects of the report to be submitted by the Secretary-General, without prejudice to the role of the Fifth Committee as the Main Committee entrusted with responsibilities for administrative and budgetary matters;",
    "16": "Recalls paragraph 44 of its resolution 73/276 and paragraph 35 of its resolution 77/260, stresses that the system of administration of justice must work in accordance with the Charter of the United Nations and the legal and regulatory framework approved by the General Assembly, and reaffirms that the Dispute Tribunal and the Appeals Tribunal shall exercise their powers according to their respective statutes. 50th (resumed) plenary meeting 22 December 2023"
  },
  "agenda_items": [
    "Item 144"
  ],
  "symbol_references": []
}