{
  "symbol": "A/RES/73/114",
  "filename": "A_RES_73_114.pdf",
  "title": "73/114. Question of Montserrat",
  "text": "United Nations \nA/RES/73/114\n \n \nGeneral Assembly \nDistr.: General \n19 December 2018 \n \n18-21502 (E)    211218     \n*1821502* \n \n \nSeventy-third session \nAgenda item 63 \n \n \n \n \n Resolution adopted by the General Assembly \non 7 December 2018 \n \n \n \n \n[on the report of the Special Political and Decolonization Committee \n(Fourth Committee) (A/73/532)] \n \n \n \n73/114. Question of Montserrat \n \n \n \nThe General Assembly,  \n \nHaving considered the question of Montserrat and examined the relevant \nchapter of the report of the Special Committee on the Situation with regard to the \nImplementation of the Declaration on the Granting of Independence to Colonial \nCountries and Peoples for 2018,1 \n \nTaking note of the working paper prepared by the Secretariat on Montserrat 2 and \nother relevant information,  \n \nRecognizing that all available options for self-determination of the Territory are \nvalid as long as they are in accordance with the freely expressed wishes of the people \nof Montserrat and in conformity with the clearly defined principles contained in \nGeneral Assembly resolutions 1514 (XV) of 14 December 1960, 1541 (XV) of \n15 December 1960 and other resolutions of the Assembly,  \n \nExpressing concern that 58 years after the adoption of the Declaration on the \nGranting of Independence to Colonial Countries and Peoples, 3 there still remain \n17 Non-Self-Governing Territories, including Montserrat,  \n \nConscious of the importance of continuing the effective implementation of the \nDeclaration, taking into account the target set by the United Nations to eradicate \ncolonialism by 2020 and the plans of action for the Second4 and Third International \nDecades for the Eradication of Colonialism,  \n__________________ \n \n1  Official Records of the General Assembly, Seventy-third Session, Supplement No. 23 (A/73/23), \nchap. X. \n \n2  A/AC.109/2018/10. \n \n3  Resolution 1514 (XV). \n \n4  A/56/61, annex. \n\nA/RES/73/114 \nQuestion of Montserrat\n \n18-21502\n2/5 \n \n \nRecognizing that the specific characteristics and the aspirations of the people of \nMontserrat require flexible, practical and innovative approaches to the options for \nself-determination, without any prejudice to territorial size, geographical location, \nsize of population or natural resources,  \n \nConvinced that the wishes and aspirations of the people of the Territory should \ncontinue to guide the development of their future political status and that \nreferendums, free and fair elections and other forms of popular consultation play an \nimportant role in ascertaining the wishes and aspirations of the people,  \n \nConcerned by the use and exploitation of the natural resources of the Non-Self-\nGoverning Territories by the administering Powers for their benefit, by the use of the \nTerritories as international financial centres to the detriment of the world economy \nand by the consequences of any economic activities of the administering Powers that \nare contrary to the interests of the people of the Territories, as well as to \nresolution 1514 (XV),  \n \nConvinced that any negotiations to determine the status of the Territory must \ntake place with the active involvement and participation of the people of the Territory, \nunder the auspices of the United Nations, on a case-by-case basis, and that the views \nof the people of Montserrat in respect of their right to self-determination should be \nascertained,  \n \nNoting the continued cooperation of the Non-Self-Governing Territories at the \nlocal and regional levels, including participation in the work of regional organizations, \n \nMindful that, in order for the Special Committee to enhance its understanding \nof the political status of the people of Montserrat and to fulfil its mandate effectively, \nit is important for it to be apprised by the United Kingdom of Great Britain and \nNorthern Ireland as the administering Power and to receive information from other \nappropriate sources, including the representatives of the Territory, concerning the \nwishes and aspirations of the people of the Territory,  \n \nAware of the importance both to Montserrat and to the Special Committee of the \nparticipation of elected and appointed representatives of Montserrat in the work of \nthe Committee,  \n \nRecognizing the need for the Special Committee to ensure that the appropriate \nbodies of the United Nations actively pursue a public awareness campaign aimed at \nassisting the people of Montserrat with their inalienable right to self-determination \nand in gaining a better understanding of the options for self-determination, on a case-\nby-case basis,  \n \nMindful, in that connection, that the holding of regional seminars in the \nCaribbean and Pacific regions and at Headquarters, with the active participation of \nrepresentatives of the Non-Self-Governing Territories, provides a helpful means for \nthe Special Committee to fulfil its mandate and that the regional nature of the \nseminars, which alternate between the Caribbean and the Pacific, is a crucial element \nin the context of a United Nations programme for ascertaining the political status of \nthe Territories,  \n \nWelcoming the Pacific regional seminar on the theme \u201cImplementation of the \nThird International Decade for the Eradication of Colonialism: towards the \nachievement of the Sustainable Development Goals in the Non-Self-Governing \nTerritories \u2013 social, economic and environmental challenges\u201d, held by the Special \nCommittee in Saint George\u2019s and hosted by the Government of Grenada from 9 to \n11 May 2018, as a significant and forward-looking event, which enabled the \nparticipants to assess progress made and address challenges faced in the \ndecolonization process, review the existing working methods of the Committee and \nrenew its commitment to implementing its historic task,  \n\nQuestion of Montserrat \nA/RES/73/114\n \n3/5\n18-21502 \n \n \nRecognizing the importance of the conclusions and recommendations adopted \nby the seminar, which are annexed to the report of the Special Committee 5 and which \noutline the findings of the seminar, including, especially, the way forward for the \ndecolonization process within the context of the proclamation by the General \nAssembly of the period 2011\u20132020 as the Third International Decade for the \nEradication of Colonialism,6 \n \nNoting the statement made by the Premier of Montserrat at the 2018 Pacific \nregional seminar, in which he expressed the view that the previous request made for the \nremoval of Montserrat from the agenda of the Special Committee should be reversed, \n \nNoting also the information provided by the Premier that Montserrat could not \nachieve its development goals if its economic dependency continued, compounded by \nongoing financial challenges, and that securing funding for rebuilding key \ninfrastructure lost and helping evacuees from the 1995 volcanic crisis required an \nintervention from the Special Committee as a neutral partner,  \n \nNoting further the request made by the Premier for a visiting mission of the \nSpecial Committee to the Territory, which could also include meetings with evacuees \nin Antigua and Barbuda, the United Kingdom and the United States of America,  \n \nNoting with appreciation the contribution to the development of some \nTerritories by the specialized agencies and other organizations of the United Nations \nsystem, in particular the Economic Commission for Latin America and the Caribbean, \nthe Economic and Social Commission for Asia and the Pacific, the United Nations \nDevelopment Programme and the World Food Programme, as well as regional \ninstitutions such as the Caribbean Development Bank, the Caribbean Community, the \nOrganisation of Eastern Caribbean States, the Pacific Islands Forum and the agencies \nof the Council of Regional Organizations in the Pacific, \n \nNoting with concern the continuing consequences of the 1995 volcanic eruption, \nwhich led to the evacuation of three quarters of the population of the Territory to safe \nareas of the island and to areas outside the Territory and which continues to have \nenduring consequences for the economy of the island,  \n \nAcknowledging the continuing assistance provided to the Territory by States \nmembers of the Caribbean Community, in particular Antigua and Barbuda, which has \noffered safe refuge and access to educational and health facilities, as well as \nemployment for thousands who have left the Territory,  \n \nNoting the continuing efforts of the administering Power and the territorial \nGovernment to deal with the consequences of the volcanic eruption,  \n \nRecalling the importance of improving the infrastructure and accessibility of \nMontserrat, as conveyed by the Premier of Montserrat to the Chair of the Special \nCommittee in their meeting on 11 May 2015,  \n \nCognizant of the potential usefulness of regional ties for the development of a \nsmall island Territory and of the Territory\u2019s membership in the Caribbean Overseas \nCountries and Territories Council,  \n \n1. \nReaffirms the inalienable right of the people of Montserrat to self-\ndetermination, in conformity with the Charter of the United Nations and with General \nAssembly resolution 1514 (XV), containing the Declaration on the Granting of \nIndependence to Colonial Countries and Peoples;  \n__________________ \n \n5  Official Records of the General Assembly, Seventy-third Session, Supplement No. 23 (A/73/23). \n \n6  See resolution 65/119. \n\nA/RES/73/114 \nQuestion of Montserrat\n \n18-21502\n4/5 \n \n \n2. \nAlso reaffirms that, in the process of decolonization of Montserrat, there \nis no alternative to the principle of self-determination, which is also a fundamental \nhuman right, as recognized under the relevant human rights conventions;  \n \n3. \nFurther reaffirms that it is ultimately for the people of Montserrat to \ndetermine freely their future political status in accordance with the relevant \nprovisions of the Charter, the Declaration and the relevant resolutions of the General \nAssembly, and in that connection calls upon the administering Power, in cooperation \nwith the territorial Government and appropriate bodies of the United Nations system, \nto develop political education programmes for the Territory in order to foster an \nawareness among the people of their right to self-determination in conformity with \nthe legitimate political status options, based on the principles clearly defined in \nAssembly resolution 1541 (XV) and other relevant resolutions and decisions;  \n \n4. \nRecalls the 2011 Constitution of Montserrat and the work of the territorial \nGovernment with respect to moving forward to consolidate the gains provided for in \nthe Constitution;  \n \n5. \nRequests the administering Power to assist the Territory by facilitating its \nwork concerning public outreach efforts, consistent with Article 73 b of the Charter, \nand in that regard calls upon the relevant United Nations organizations to provide \nassistance to the Territory, if requested;  \n \n6. \nWelcomes the Territory\u2019s participation in the work of the Organisation of \nEastern Caribbean States and the Economic Commission for Latin America and the \nCaribbean;  \n \n7. \nEncourages the Territory to continue to participate in the activities of the \nSpecial Committee on the Situation with regard to the Implementation of the \nDeclaration on the Granting of Independence to Colonial Countries and Peoples, \nincluding regional seminars;  \n \n8. \nCalls upon the administering Power, the specialized agencies and other \norganizations of the United Nations system, as well as regional and other \norganizations, to continue to provide assistance to the Territory in alleviating the \nconsequences of the volcanic eruption;  \n \n9. \nStresses the importance of the Special Committee being apprised of the \nviews and wishes of the people of Montserrat and enhancing its understanding of their \nconditions, including the nature and scope of the existing political and constitutional \narrangements between Montserrat and the administering Power;  \n \n10. Calls upon the administering Power to participate in and cooperate fully \nwith the work of the Special Committee in order to implement the provisions of \nArticle 73 e of the Charter and the Declaration and in order to advise the Committee \non the implementation of the provisions under Article 73 b of the Charter on efforts \nto promote self-government in Montserrat, and encourages the administering Power \nto facilitate visiting and special missions to the Territory;  \n \n11. \nStresses the importance of the invitation extended by the territorial \nGovernment for a visiting mission by the Special Committee, calls upon the \nadministering Power to facilitate such a mission, and requests the Chair of the Special \nCommittee to take all the steps necessary to that end; \n \n12. Reaffirms the responsibility of the administering Power under the Charter \nto promote the economic and social development and to preserve the cultural identity \nof the Territory, and requests the administering Power to take steps to enlist and make \neffective use of all possible assistance, on both a bilateral and a multilateral basis, in \nthe strengthening of the economy of the Territory;  \n\nQuestion of Montserrat \nA/RES/73/114\n \n5/5\n18-21502 \n \n \n13. Takes into account the 2030 Agenda for Sustainable Development, 7 \nincluding the Sustainable Development Goals, stresses the importance of fostering \nthe economic and social sustainable development of the Territory by promoting \nsustained, inclusive and equitable economic growth, creating greater opportunities for \nall, reducing inequalities, raising basic standards of living, fostering equitable social \ndevelopment and inclusion and promoting the integrated and sustainable management \nof natural resources and ecosystems that supports, inter alia, economic, social and \nhuman development, while facilitating ecosystem conservation, regeneration, \nrestoration and resilience in the face of new and emerging challenges, and strongly \nurges the administering Power to refrain from undertaking any kind of illicit, harmful \nand unproductive activities, including the use of the Territory as an international \nfinancial centre, that are not aligned with the interest of the people of the Territory; \n \n14. Requests the Territory and the administering Power to take all measures \nnecessary to protect and conserve the environment of the Territory against any \ndegradation, and once again requests the specialized agencies concerned to monitor \nenvironmental conditions in the Territory and to provide assistance to the Territory, \nconsistent with their prevailing rules of procedure;  \n \n15. Requests the Special Committee to continue to examine the question of \nMontserrat and to report thereon to the General Assembly at its seventy-fourth session \nand on the implementation of the present resolution. \n \n48th plenary meeting  \n7 December 2018 \n \n__________________ \n \n7  Resolution 70/1. \n",
  "paragraphs": {
    "1": "Reaffirms the inalienable right of the people of Montserrat to self- determination, in conformity with the Charter of the United Nations and with General Assembly resolution 1514 (XV), containing the Declaration on the Granting of Independence to Colonial Countries and Peoples; __________________ 5 Official Records of the General Assembly, Seventy-third Session, Supplement No. 23 (A/73/23). 6 See resolution 65/119. A/RES/73/114 Question of Montserrat 18-21502 4/5",
    "2": "Also reaffirms that, in the process of decolonization of Montserrat, there is no alternative to the principle of self-determination, which is also a fundamental human right, as recognized under the relevant human rights conventions;",
    "3": "Further reaffirms that it is ultimately for the people of Montserrat to determine freely their future political status in accordance with the relevant provisions of the Charter, the Declaration and the relevant resolutions of the General Assembly, and in that connection calls upon the administering Power, in cooperation with the territorial Government and appropriate bodies of the United Nations system, to develop political education programmes for the Territory in order to foster an awareness among the people of their right to self-determination in conformity with the legitimate political status options, based on the principles clearly defined in Assembly resolution 1541 (XV) and other relevant resolutions and decisions;",
    "4": "Recalls the 2011 Constitution of Montserrat and the work of the territorial Government with respect to moving forward to consolidate the gains provided for in the Constitution;",
    "5": "Requests the administering Power to assist the Territory by facilitating its work concerning public outreach efforts, consistent with Article 73 b of the Charter, and in that regard calls upon the relevant United Nations organizations to provide assistance to the Territory, if requested;",
    "6": "Welcomes the Territory\u2019s participation in the work of the Organisation of Eastern Caribbean States and the Economic Commission for Latin America and the Caribbean;",
    "7": "Encourages the Territory to continue to participate in the activities of the Special Committee on the Situation with regard to the Implementation of the Declaration on the Granting of Independence to Colonial Countries and Peoples, including regional seminars;",
    "8": "Calls upon the administering Power, the specialized agencies and other organizations of the United Nations system, as well as regional and other organizations, to continue to provide assistance to the Territory in alleviating the consequences of the volcanic eruption;",
    "9": "Stresses the importance of the Special Committee being apprised of the views and wishes of the people of Montserrat and enhancing its understanding of their conditions, including the nature and scope of the existing political and constitutional arrangements between Montserrat and the administering Power;",
    "10": "Calls upon the administering Power to participate in and cooperate fully with the work of the Special Committee in order to implement the provisions of Article 73 e of the Charter and the Declaration and in order to advise the Committee on the implementation of the provisions under Article 73 b of the Charter on efforts to promote self-government in Montserrat, and encourages the administering Power to facilitate visiting and special missions to the Territory;",
    "11": "Stresses the importance of the invitation extended by the territorial Government for a visiting mission by the Special Committee, calls upon the administering Power to facilitate such a mission, and requests the Chair of the Special Committee to take all the steps necessary to that end;",
    "12": "Reaffirms the responsibility of the administering Power under the Charter to promote the economic and social development and to preserve the cultural identity of the Territory, and requests the administering Power to take steps to enlist and make effective use of all possible assistance, on both a bilateral and a multilateral basis, in the strengthening of the economy of the Territory; Question of Montserrat A/RES/73/114 5/5 18-21502",
    "13": "Takes into account the 2030 Agenda for Sustainable Development, 7 including the Sustainable Development Goals, stresses the importance of fostering the economic and social sustainable development of the Territory by promoting sustained, inclusive and equitable economic growth, creating greater opportunities for all, reducing inequalities, raising basic standards of living, fostering equitable social development and inclusion and promoting the integrated and sustainable management of natural resources and ecosystems that supports, inter alia, economic, social and human development, while facilitating ecosystem conservation, regeneration, restoration and resilience in the face of new and emerging challenges, and strongly urges the administering Power to refrain from undertaking any kind of illicit, harmful and unproductive activities, including the use of the Territory as an international financial centre, that are not aligned with the interest of the people of the Territory;",
    "14": "Requests the Territory and the administering Power to take all measures necessary to protect and conserve the environment of the Territory against any degradation, and once again requests the specialized agencies concerned to monitor environmental conditions in the Territory and to provide assistance to the Territory, consistent with their prevailing rules of procedure;",
    "15": "Requests the Special Committee to continue to examine the question of Montserrat and to report thereon to the General Assembly at its seventy-fourth session and on the implementation of the present resolution. 48th plenary meeting 7 December 2018 __________________ 7 Resolution 70/1."
  },
  "agenda_items": [
    "Item 63"
  ],
  "symbol_references": []
}