{
  "symbol": "A/RES/78/306",
  "filename": "A_RES_78_306.pdf",
  "title": "78/306. Financing of the United Nations Mission in South Sudan",
  "text": "United Nations \nA/RES/78/306 \n \n \nGeneral Assembly \nDistr.: General \n3 July 2024 \n \n24-12161 (E)     \n*2412161* \n \n \nSeventy-eighth session \nAgenda item 157 \nFinancing of the United Nations Mission in South Sudan \n \n \n \n \n Resolution adopted by the General Assembly \non 28 June 2024 \n \n \n \n \n[on the report of the Fifth Committee (A/78/930, para. 6)] \n \n \n 78/306. Financing of the United Nations Mission in South Sudan  \n \n \n \nThe General Assembly, \n \nHaving considered the reports of the Secretary-General on the financing of the \nUnited Nations Mission in South Sudan 1 and the related report of the Advisory \nCommittee on Administrative and Budgetary Questions,2  \n \nHaving also considered the report of the Office of Internal Oversight Services \non the evaluation of the contribution of the United Nations Mission in South Sudan \nto strengthening the rule of law and accountability in South Sudan, 3  \n \nRecalling Security Council resolution 1996 (2011) of 8 July 2011, by which the \nCouncil established, as from 9 July 2011, the United Nations Mission in South Sudan, \nand the subsequent resolutions by which the Council extended the mandate of the \nMission, the latest of which was resolution 2729 (2024) of 29 April 2024, by which \nthe Council extended the mandate of the Mission until 30 April 2025,  \n \nRecalling also its resolution 66/243 A of 24 December 2011 on the financing of \nthe Mission and its subsequent resolutions thereon, the latest of which was resolution \n77/292 B of 30 June 2023,  \n \nReaffirming the general principles underlying the financing of United Nations \npeacekeeping operations, as stated in its resolutions 1874 (S-IV) of 27 June 1963, \n3101 (XXVIII) of 11 December 1973 and 55/235 of 23 December 2000, \n \nMindful of the fact that it is essential to provide the Mission with the financial \nresources necessary to enable it to fulfil its responsibilities under the relevant \nresolutions of the Security Council, \n__________________ \n \n1  A/78/629 and A/78/754. \n \n2  A/78/744/Add.13. \n \n3  A/78/742. \n\nA/RES/78/306 \nFinancing of the United Nations Mission in South Sudan \n \n2/4 \n \n \n1. \nRequests the Secretary-General to entrust the Head of Mission with the \ntask of formulating future budget proposals in full accordance with the provisions of \nits resolutions 59/296 of 22 June 2005, 60/266 of 30 June 2006, 61/276 of 29 June \n2007, 64/269 of 24 June 2010, 65/289 of 30 June 2011, 66/264 of 21 June 2012, \n69/307 of 25 June 2015, 70/286 of 17 June 2016 and 76/274 of 29 June 2022, as well \nas other relevant resolutions; \n \n2. \nTakes note of the status of contributions to the United Nations Mission in \nSouth Sudan as at 30 April 2024, including the contributions outstanding in the \namount of 332.7 million United States dollars, representing some 2.4 per cent of the \ntotal assessed contributions, notes with concern that only 81 Member States have paid \ntheir assessed contributions in full, and urges all other Member States, in particular \nthose in arrears, to ensure payment of their outstanding assessed contributions; \n \n3. \nExpresses its appreciation to those Member States that have paid their \nassessed contributions in full, and urges all other Member States to make every \npossible effort to ensure payment of their assessed contributions to the Mission in \nfull; \n \n4. \nExpresses concern at the financial situation with regard to peacekeeping \nactivities, in particular as regards the reimbursements to troop contributors that bear \nadditional burdens owing to overdue payments by Member States of their \nassessments;  \n \n5. \nEmphasizes that all future and existing peacekeeping missions shall be \ngiven equal and non-discriminatory treatment in respect of financial and \nadministrative arrangements;  \n \n6. \nAlso emphasizes that all peacekeeping missions shall be provided with \nadequate resources for the effective and efficient discharge of their respective \nmandates;  \n \n7. \nRequests the Secretary-General to ensure that proposed peacekeeping \nbudgets are based on the relevant legislative mandates;  \n \n8. \nEndorses the conclusions and recommendations contained in the report of \nthe Advisory Committee on Administrative and Budgetary Questions, subject to the \nprovisions of the present resolution, and requests the Secretary-General to ensure \ntheir full implementation;  \n \n9. \nDecides to allocate 1 million dollars for the deployment of the new \nmilitary contingents and formed police units; \n \n10. Takes note of paragraph 41 of the report of the Advisory Committee; \n \n11. Requests the Secretary-General to ensure the full implementation of the \nrelevant provisions of its resolutions 59/296, 60/266, 61/276, 64/269, 65/289, 66/264, \n69/307, 70/286 and 76/274;  \n \n12. Also requests the Secretary-General to take all action necessary to ensure \nthat the Mission is administered with a maximum of efficiency and economy; \n \n \n \nBudget performance report for the period from 1 July 2022 to 30 June 2023 \n \n \n13. Takes note of the report of the Secretary-General on the budget \nperformance of the Mission for the period from 1 July 2022 to 30 June 2023; 4  \n \n__________________ \n \n4  A/78/629. \n\nFinancing of the United Nations Mission in South Sudan \nA/RES/78/306\n \n3/4\n24-12161 \n \n \n \nBudget estimates for the period from 1 July 2024 to 30 June 2025 \n \n \n14. Decides to appropriate to the special account for the United Nations \nMission in South Sudan the amount of 1,355,899,200 dollars for the period from \n1 July 2024 to 30 June 2025, inclusive of 1,237,887,300 dollars for the maintenance \nof the Mission, 89,953,100 dollars for the support account for peacekeeping \noperations, 15,701,200 dollars for the United Nations Logistics Base at Brindisi, Italy, \nand 12,357,600 dollars for the Regional Service Centre in Entebbe, Uganda; \n \n \n \nFinancing of the appropriation for the period from 1 July 2024 to 30 June 2025 \n \n \n15. Decides to apportion among Member States the amount of 677,949,600 \ndollars for the period from 1 July to 31 December 2024, in accordance with the levels \nupdated in its resolution 76/239 of 24 December 2021, taking into account the scale \nof assessments for 2024, as set out in its resolution 76/238 of 24 December 2021; \n \n16. Also decides that, in accordance with the provisions of its resolution 973 (X) \nof 15 December 1955, there shall be set off against the apportionment among Member \nStates, as provided for in paragraph 15 above, their respective share in the Tax \nEqualization Fund of 21,053,500 dollars, comprising the estimated staff assessment \nincome of 15,940,600 dollars approved for the Mission, the prorated share of \n3,666,200 dollars of the estimated staff assessment income approved for the support \naccount, the prorated share of 715,900 dollars of the estimated staff assessment \nincome approved for the United Nations Logistics Base and the prorated share of \n730,800 dollars of the estimated staff assessment income approved for the Regional \nService Centre;  \n \n17. Further decides to apportion among Member States the amount of \n451,966,400 dollars for the period from 1 January to 30 April 2025, in accordance \nwith the scale of assessments for 2025 and the updated levels;5  \n \n18. Decides that, in accordance with the provisions of its resolution 973 (X), \nthere shall be set off against the apportionment among Member States, as provided \nfor in paragraph 17 above, their respective share in the Tax Equalization Fund of \n14,035,600 dollars, comprising the estimated staff assessment income of 10,627,100 \ndollars approved for the Mission, the prorated share of 2,444,100 dollars of the \nestimated staff assessment income approved for the support account, the prorated \nshare of 477,200 dollars of the estimated staff assessment income approved for the \nUnited Nations Logistics Base and the prorated share of 487,200 dollars of the \nestimated staff assessment income approved for the Regional Service Centre; \n \n19. Also decides to apportion among Member States the amount of \n225,983,200 dollars for the period from 1 May to 30 June 2025, at a monthly rate of \n112,991,600 dollars, in accordance with the scale of assessments for 2025 and the \nupdated levels, subject to a decision of the Security Council to extend the mandate of \nthe Mission; \n \n20. Further decides that, in accordance with the provisions of its resolution \n973 (X), there shall be set off against the apportionment among Member States, as \nprovided for in paragraph 19 above, their respective share in the Tax Equalization \nFund of 7,017,600 dollars, comprising the estimated staff assessment income of \n5,313,500 dollars approved for the Mission, the prorated share of 1,222,000 dollars \nof the estimated staff assessment income approved for the support account, the \nprorated share of 238,600 dollars of the estimated staff assessment income approved \n__________________ \n \n5  To be adopted by the General Assembly. \n\nA/RES/78/306 \nFinancing of the United Nations Mission in South Sudan \n \n4/4 \n \nfor the United Nations Logistics Base and the prorated share of 243,500 dollars of the \nestimated staff assessment income approved for the Regional Service Centre; \n \n21. Decides that, for Member States that have fulfilled their financial \nobligations to the Mission, there shall be set off against their apportionment, as \nprovided for in paragraphs 15, 17 and 19 above, their respective share of the \nunencumbered balance and other revenue in the amount of 23,487,900 dollars in \nrespect of the financial period ended 30 June 2023, in accordance with the levels \nupdated in its resolution 76/239, taking into account the scale of assessments for 2023, \nas set out in its resolution 76/238; \n \n22. Also decides that, for Member States that have not fulfilled their financial \nobligations to the Mission, there shall be set off against their outstanding obligations \ntheir respective share of the unencumbered balance and other revenue in the amount \nof 23,487,900 dollars in respect of the financial period ended 30 June 2023, in \naccordance with the scheme set out in paragraph 21 above; \n \n23. Further decides that the increase of 2,327,800 dollars in the estimated staff \nassessment income in respect of the financial period ended 30 June 2023 shall be \nadded to the credits in the amount of 23,487,900 dollars referred to in paragraphs 21 \nand 22 above;  \n \n24. Encourages the Secretary-General to continue to take additional measures \nto ensure the safety and security of all personnel participating in the Mission under \nthe auspices of the United Nations, bearing in mind paragraphs 5 and 6 of Security \nCouncil resolution 1502 (2003) of 26 August 2003;  \n \n25. Invites voluntary contributions to the Mission in cash and in the form of \nservices and supplies acceptable to the Secretary-General, to be administered, as \nappropriate, in accordance with the procedure and practices established by the \nGeneral Assembly;  \n \n26. Decides to include in the provisional agenda of its seventy-ninth session \nthe item entitled \u201cFinancing of the United Nations Mission in South Sudan\u201d. \n \n95th plenary meeting \n28 June 2024 \n \n \n",
  "paragraphs": {
    "1": "Requests the Secretary-General to entrust the Head of Mission with the task of formulating future budget proposals in full accordance with the provisions of its resolutions 59/296 of 22 June 2005, 60/266 of 30 June 2006, 61/276 of 29 June 2007, 64/269 of 24 June 2010, 65/289 of 30 June 2011, 66/264 of 21 June 2012, 69/307 of 25 June 2015, 70/286 of 17 June 2016 and 76/274 of 29 June 2022, as well as other relevant resolutions;",
    "2": "Takes note of the status of contributions to the United Nations Mission in South Sudan as at 30 April 2024, including the contributions outstanding in the amount of 332.7 million United States dollars, representing some 2.4 per cent of the total assessed contributions, notes with concern that only 81 Member States have paid their assessed contributions in full, and urges all other Member States, in particular those in arrears, to ensure payment of their outstanding assessed contributions;",
    "3": "Expresses its appreciation to those Member States that have paid their assessed contributions in full, and urges all other Member States to make every possible effort to ensure payment of their assessed contributions to the Mission in full;",
    "4": "Expresses concern at the financial situation with regard to peacekeeping activities, in particular as regards the reimbursements to troop contributors that bear additional burdens owing to overdue payments by Member States of their assessments;",
    "5": "Emphasizes that all future and existing peacekeeping missions shall be given equal and non-discriminatory treatment in respect of financial and administrative arrangements;",
    "6": "Also emphasizes that all peacekeeping missions shall be provided with adequate resources for the effective and efficient discharge of their respective mandates;",
    "7": "Requests the Secretary-General to ensure that proposed peacekeeping budgets are based on the relevant legislative mandates;",
    "8": "Endorses the conclusions and recommendations contained in the report of the Advisory Committee on Administrative and Budgetary Questions, subject to the provisions of the present resolution, and requests the Secretary-General to ensure their full implementation;",
    "9": "Decides to allocate 1 million dollars for the deployment of the new military contingents and formed police units;",
    "10": "Takes note of paragraph 41 of the report of the Advisory Committee;",
    "11": "Requests the Secretary-General to ensure the full implementation of the relevant provisions of its resolutions 59/296, 60/266, 61/276, 64/269, 65/289, 66/264, 69/307, 70/286 and 76/274;",
    "12": "Also requests the Secretary-General to take all action necessary to ensure that the Mission is administered with a maximum of efficiency and economy; Budget performance report for the period from 1 July 2022 to 30 June 2023",
    "13": "Takes note of the report of the Secretary-General on the budget performance of the Mission for the period from 1 July 2022 to 30 June 2023; 4 Budget estimates for the period from 1 July 2024 to 30 June 2025",
    "14": "Decides to appropriate to the special account for the United Nations Mission in South Sudan the amount of 1,355,899,200 dollars for the period from 1 July 2024 to 30 June 2025, inclusive of 1,237,887,300 dollars for the maintenance of the Mission, 89,953,100 dollars for the support account for peacekeeping operations, 15,701,200 dollars for the United Nations Logistics Base at Brindisi, Italy, and 12,357,600 dollars for the Regional Service Centre in Entebbe, Uganda; Financing of the appropriation for the period from 1 July 2024 to 30 June 2025",
    "15": "Decides to apportion among Member States the amount of 677,949,600 dollars for the period from 1 July to 31 December 2024, in accordance with the levels updated in its resolution 76/239 of 24 December 2021, taking into account the scale of assessments for 2024, as set out in its resolution 76/238 of 24 December 2021;",
    "16": "Also decides that, in accordance with the provisions of its resolution 973 (X) of 15 December 1955, there shall be set off against the apportionment among Member States, as provided for in paragraph 15 above, their respective share in the Tax Equalization Fund of 21,053,500 dollars, comprising the estimated staff assessment income of 15,940,600 dollars approved for the Mission, the prorated share of 3,666,200 dollars of the estimated staff assessment income approved for the support account, the prorated share of 715,900 dollars of the estimated staff assessment income approved for the United Nations Logistics Base and the prorated share of 730,800 dollars of the estimated staff assessment income approved for the Regional Service Centre;",
    "17": "Further decides to apportion among Member States the amount of 451,966,400 dollars for the period from 1 January to 30 April 2025, in accordance with the scale of assessments for 2025 and the updated levels;5",
    "18": "Decides that, in accordance with the provisions of its resolution 973 (X), there shall be set off against the apportionment among Member States, as provided for in paragraph 17 above, their respective share in the Tax Equalization Fund of 14,035,600 dollars, comprising the estimated staff assessment income of 10,627,100 dollars approved for the Mission, the prorated share of 2,444,100 dollars of the estimated staff assessment income approved for the support account, the prorated share of 477,200 dollars of the estimated staff assessment income approved for the United Nations Logistics Base and the prorated share of 487,200 dollars of the estimated staff assessment income approved for the Regional Service Centre;",
    "19": "Also decides to apportion among Member States the amount of 225,983,200 dollars for the period from 1 May to 30 June 2025, at a monthly rate of 112,991,600 dollars, in accordance with the scale of assessments for 2025 and the updated levels, subject to a decision of the Security Council to extend the mandate of the Mission;",
    "20": "Further decides that, in accordance with the provisions of its resolution 973 (X), there shall be set off against the apportionment among Member States, as provided for in paragraph 19 above, their respective share in the Tax Equalization Fund of 7,017,600 dollars, comprising the estimated staff assessment income of 5,313,500 dollars approved for the Mission, the prorated share of 1,222,000 dollars of the estimated staff assessment income approved for the support account, the prorated share of 238,600 dollars of the estimated staff assessment income approved",
    "21": "Decides that, for Member States that have fulfilled their financial obligations to the Mission, there shall be set off against their apportionment, as provided for in paragraphs 15, 17 and 19 above, their respective share of the unencumbered balance and other revenue in the amount of 23,487,900 dollars in respect of the financial period ended 30 June 2023, in accordance with the levels updated in its resolution 76/239, taking into account the scale of assessments for 2023, as set out in its resolution 76/238;",
    "22": "Also decides that, for Member States that have not fulfilled their financial obligations to the Mission, there shall be set off against their outstanding obligations their respective share of the unencumbered balance and other revenue in the amount of 23,487,900 dollars in respect of the financial period ended 30 June 2023, in accordance with the scheme set out in paragraph 21 above;",
    "23": "Further decides that the increase of 2,327,800 dollars in the estimated staff assessment income in respect of the financial period ended 30 June 2023 shall be added to the credits in the amount of 23,487,900 dollars referred to in paragraphs 21 and 22 above;",
    "24": "Encourages the Secretary-General to continue to take additional measures to ensure the safety and security of all personnel participating in the Mission under the auspices of the United Nations, bearing in mind paragraphs 5 and 6 of Security Council resolution 1502 (2003) of 26 August 2003;",
    "25": "Invites voluntary contributions to the Mission in cash and in the form of services and supplies acceptable to the Secretary-General, to be administered, as appropriate, in accordance with the procedure and practices established by the General Assembly;",
    "26": "Decides to include in the provisional agenda of its seventy-ninth session the item entitled \u201cFinancing of the United Nations Mission in South Sudan\u201d."
  },
  "agenda_items": [
    "Item 157"
  ],
  "symbol_references": []
}