{
  "symbol": "A/RES/79/61",
  "filename": "A_RES_79_61.pdf",
  "title": "79/61. Strengthening and developing the system of arms control, disarmament and non-proliferation treaties and agreements",
  "text": "United Nations \nA/RES/79/61\n \n \nGeneral Assembly \nDistr.: General \n10 December 2024 \n \n24-23091 (E) \n*2423091* \n \n \nSeventy-ninth session \nAgenda item 98 (qq) \nGeneral and complete disarmament: strengthening and \ndeveloping the system of arms control, disarmament and \nnon-proliferation treaties and agreements \n \n \n \n \n Resolution adopted by the General Assembly \non 2 December 2024 \n \n \n \n \n[on the report of the First Committee (A/79/408, para. 114)] \n \n \n \n79/61. Strengthening and developing the system of arms control, \ndisarmament and non-proliferation treaties and agreements \n \n \n \nThe General Assembly, \n \nRecalling its previous relevant resolutions, \n \nRecognizing the common interest of all humankind in strengthening and \ndeveloping the system of arms control, disarmament and non-proliferation treaties \nand agreements, \n \nStressing the vital importance of efforts in arms control, disarmament and \nnon-proliferation for providing international peace and strengthening global security, \nand recognizing that the improvement of the international security environment \ncontributes to such efforts, \n \nStressing also the paramount importance of full and strict implementation, \nstrengthening and development of arms control, disarmament and non-proliferation \ntreaties and agreements providing enhanced security to individual nations and the \ninternational community, \n \nUnderlining that any actions that lead to weakening of confidence in, \ncompliance with and viability of such treaties and agreements diminish their \ncontribution to global or regional stability and undermine the credibility and \neffectiveness of the international legal system and regime applicable to arms control, \ndisarmament and non-proliferation, \n \nRecognizing that full implementation by Member States of existing treaties and \nagreements to which they are parties and resolving implementation concerns \neffectively by means consistent with such treaties and agreements and international \nlaw facilitate the conclusion of additional arms control, disarmament and \n\nA/RES/79/61 \nStrengthening and developing the system of arms control, \ndisarmament and non-proliferation treaties and agreements\n \n24-23091\n2/3 \n \nnon-proliferation treaties and agreements, and thereby contribute to better relations \namong States and the strengthening of the existing system of such treaties and \nagreements, as well as international peace and security, \n \nBelieving that supporting and developing the system of arms control, \ndisarmament and non-proliferation through the strengthening of appropriate treaties \nand agreements and their regimes is a matter of interest and concern to all members \nof the international community, and noting the role that the United Nations has played \nand should continue to play in that regard, \n \nStressing the importance of appropriate and sustainable financial support for the \neffectiveness and efficiency of the relevant international arms control, disarmament \nand non-proliferation instruments and proper functioning of their regimes, \n \nEmphasizing the importance of appropriate technical assistance and capacity-\nbuilding efforts for the implementation of arms control, disarmament and \nnon-proliferation treaties and agreements by Member States, \n \nConcerned that any actions that undermine the existing system of arms control, \ndisarmament and non-proliferation treaties and agreements affect the interests of the \ninternational community, \n \nMindful that it is the responsibility and obligation of all Member States to \ncontribute to the process of easing international tension and to strengthening \ninternational peace and security and, in this connection, to refrain from steps that \nnegatively affect the security environment and to make efforts to advance along the \npath of nuclear disarmament, as well as general and complete disarmament under \nstrict and effective international control, \n \n1. \nUrges all States parties to arms control, disarmament and non-proliferation \ntreaties and agreements in force to implement all provisions of such treaties and \nagreements in their entirety; \n \n2. \nCalls for continued efforts aimed at strengthening the system of arms \ncontrol, disarmament and non-proliferation treaties and agreements and at preserving \nits integrity and validity for maintaining global stability and international peace and \nsecurity; \n \n3. \nCalls upon all Member States to give serious consideration to the negative \nimplications of undermining arms control, disarmament and non-proliferation treaties \nand agreements and their regimes for international security and stability, as well as \nfor progress in the field of disarmament; \n \n4. \nUrges all Member States to support efforts aimed at the resolution of \nimplementation issues by means consistent with arms control, disarmament and \nnon-proliferation treaties and agreements and international law, with a view to \nencouraging strict observance by all States parties of the provisions of such treaties \nand agreements, maintaining or restoring the integrity of such treaties and agreements \nand strengthening and developing their regimes; \n \n5. \nConsiders that any actions that undermine the system of arms control, \ndisarmament and non-proliferation treaties and agreements also undermine global \nstability and international peace and security, while undermined international peace \nand security could negatively affect the system; \n \n6. \nSupports efforts by the international community, in the light of emerging \ndevelopments, towards safeguarding the integrity of the existing arms control, \ndisarmament and non-proliferation treaties and agreements, which is in the strongest \ninterest of humankind; \n\nStrengthening and developing the system of arms control, \ndisarmament and non-proliferation treaties and agreements \nA/RES/79/61\n \n3/3\n24-23091 \n \n \n7. \nWelcomes the role that the United Nations has played and continues to play \nin fostering negotiations on arms control, disarmament and non-proliferation treaties \nand agreements; \n \n8. \nExpresses the need to maintain the effectiveness and efficiency as well as \nthe consensus-based nature of the relevant multilateral instruments in the field of \ndisarmament, non-proliferation and arms control; \n \n9. \nRequests the Secretary-General to continue to provide assistance that may \nbe necessary in protecting the integrity of arms control, disarmament and \nnon-proliferation treaties and agreements, and in strengthening the system of such \ntreaties and agreements; \n \n10. Encourages States in a position to do so to provide, upon request, technical \nassistance and capacity-building in support of national implementation of arms \ncontrol, disarmament and non-proliferation treaties and agreements by Member \nStates; \n \n11. \nEncourages efforts by all States parties to elaborate additional cooperative \nmeasures, as appropriate, that can increase confidence in existing arms control, \ndisarmament and non-proliferation treaties and agreements and facilitate the \nconclusion of additional treaties and agreements of that kind; \n \n12. Notes the importance of effective verification provisions for arms control, \ndisarmament and non-proliferation treaties and agreements; \n \n13. Decides to include in the provisional agenda of its eighty-first session, \nunder the item entitled \u201cGeneral and complete disarmament\u201d, the sub-item entitled \n\u201cStrengthening and developing the system of arms control, disarmament and \nnon-proliferation treaties and agreements\u201d. \n \n44th plenary meeting \n2 December 2024 \n \n",
  "paragraphs": {
    "1": "Urges all States parties to arms control, disarmament and non-proliferation treaties and agreements in force to implement all provisions of such treaties and agreements in their entirety;",
    "2": "Calls for continued efforts aimed at strengthening the system of arms control, disarmament and non-proliferation treaties and agreements and at preserving its integrity and validity for maintaining global stability and international peace and security;",
    "3": "Calls upon all Member States to give serious consideration to the negative implications of undermining arms control, disarmament and non-proliferation treaties and agreements and their regimes for international security and stability, as well as for progress in the field of disarmament;",
    "4": "Urges all Member States to support efforts aimed at the resolution of implementation issues by means consistent with arms control, disarmament and non-proliferation treaties and agreements and international law, with a view to encouraging strict observance by all States parties of the provisions of such treaties and agreements, maintaining or restoring the integrity of such treaties and agreements and strengthening and developing their regimes;",
    "5": "Considers that any actions that undermine the system of arms control, disarmament and non-proliferation treaties and agreements also undermine global stability and international peace and security, while undermined international peace and security could negatively affect the system;",
    "6": "Supports efforts by the international community, in the light of emerging developments, towards safeguarding the integrity of the existing arms control, disarmament and non-proliferation treaties and agreements, which is in the strongest interest of humankind; Strengthening and developing the system of arms control, disarmament and non-proliferation treaties and agreements A/RES/79/61 3/3 24-23091",
    "7": "Welcomes the role that the United Nations has played and continues to play in fostering negotiations on arms control, disarmament and non-proliferation treaties and agreements;",
    "8": "Expresses the need to maintain the effectiveness and efficiency as well as the consensus-based nature of the relevant multilateral instruments in the field of disarmament, non-proliferation and arms control;",
    "9": "Requests the Secretary-General to continue to provide assistance that may be necessary in protecting the integrity of arms control, disarmament and non-proliferation treaties and agreements, and in strengthening the system of such treaties and agreements;",
    "10": "Encourages States in a position to do so to provide, upon request, technical assistance and capacity-building in support of national implementation of arms control, disarmament and non-proliferation treaties and agreements by Member States;",
    "11": "Encourages efforts by all States parties to elaborate additional cooperative measures, as appropriate, that can increase confidence in existing arms control, disarmament and non-proliferation treaties and agreements and facilitate the conclusion of additional treaties and agreements of that kind;",
    "12": "Notes the importance of effective verification provisions for arms control, disarmament and non-proliferation treaties and agreements;",
    "13": "Decides to include in the provisional agenda of its eighty-first session, under the item entitled \u201cGeneral and complete disarmament\u201d, the sub-item entitled \u201cStrengthening and developing the system of arms control, disarmament and non-proliferation treaties and agreements\u201d. 44th plenary meeting 2 December 2024"
  },
  "agenda_items": [
    "Item 98"
  ],
  "symbol_references": []
}