{
  "symbol": "A/RES/75/296",
  "filename": "A_RES_75_296.pdf",
  "title": "75/296. Closed peacekeeping missions",
  "text": "United Nations \nA/RES/75/296\n \n \nGeneral Assembly \nDistr.: General \n6 July 2021 \n \n21-09008 (E)    070721 \n*2109008* \n \n \nSeventy-fifth session \nAgenda item 154 \nAdministrative and budgetary aspects of the financing of \nthe United Nations peacekeeping operations \n \n \n \n \n Resolution adopted by the General Assembly \non 30 June 2021 \n \n \n \n \n[on the report of the Fifth Committee (A/75/936, para. 15)] \n \n \n 75/296. Closed peacekeeping missions \n \n \n \nThe General Assembly, \n \nRecalling its resolution 74/278 of 30 June 2020 and its decision 74/571 of \n3 September 2020, \n \nHaving considered the report of the Secretary-General on the updated financial \nposition of closed peacekeeping missions as at 30 June 20201 and the related report \nof the Advisory Committee on Administrative and Budgetary Questions, 2 \n \n1. \nTakes note of the report of the Secretary-General; \n \n2. \nEndorses the conclusions and recommendations contained in the report of \nthe Advisory Committee on Administrative and Budgetary Questions, subject to the \nprovisions of the present resolution; \n \n3. \nTakes note of paragraphs 9 and 10 (b) of the report of the Advisory \nCommittee; \n \n4. \nStresses that all Member States should fulfil their financial obligations as \nset out in the Charter of the United Nations on time, in full and without conditions; \n \n5. \nUrges all Member States to make every possible effort to ensure payment \nof their assessed contributions in full; \n \n6. \nNotes that the use of unreturned balances to cover temporary liquidity \nneeds of the Organization is not an established mechanism, and emphasizes that this \npractice is not sustainable; \n__________________ \n \n1 A/75/619. \n \n2 A/75/838. \n\nA/RES/75/296 \nClosed peacekeeping missions\n \n21-09008\n2/2 \n \n \n7. \nRecognizes that the financial situation of the Organization is improving as \na result of increased payments of contributions, and notes that the practice of the use \nof unreturned balances should not be maintained if this trend continues; \n \n8. \nRegrets that claims payable to troop- and police-contributing countries and \noutstanding dues to Member States from closed peacekeeping operation budgets have \nnot been settled, and emphasizes its commitment to resolve this issue; \n \n9. \nRequests the Secretary-General to continue to take every measure \nnecessary to reimburse troop- and police-contributing countries before the closure of \nany peacekeeping mission. \n \n88th plenary meeting \n30 June 2021 \n \n",
  "paragraphs": {
    "1": "Takes note of the report of the Secretary-General;",
    "2": "Endorses the conclusions and recommendations contained in the report of the Advisory Committee on Administrative and Budgetary Questions, subject to the provisions of the present resolution;",
    "3": "Takes note of paragraphs 9 and 10 (b) of the report of the Advisory Committee;",
    "4": "Stresses that all Member States should fulfil their financial obligations as set out in the Charter of the United Nations on time, in full and without conditions;",
    "5": "Urges all Member States to make every possible effort to ensure payment of their assessed contributions in full;",
    "6": "Notes that the use of unreturned balances to cover temporary liquidity needs of the Organization is not an established mechanism, and emphasizes that this practice is not sustainable;",
    "7": "Recognizes that the financial situation of the Organization is improving as a result of increased payments of contributions, and notes that the practice of the use of unreturned balances should not be maintained if this trend continues;",
    "8": "Regrets that claims payable to troop- and police-contributing countries and outstanding dues to Member States from closed peacekeeping operation budgets have not been settled, and emphasizes its commitment to resolve this issue;",
    "9": "Requests the Secretary-General to continue to take every measure necessary to reimburse troop- and police-contributing countries before the closure of any peacekeeping mission."
  },
  "agenda_items": [
    "Item 154"
  ],
  "symbol_references": []
}