{
  "symbol": "A/RES/74/161",
  "filename": "A_RES_74_161.pdf",
  "title": "74/161. International Convention for the Protection of All Persons from Enforced Disappearance",
  "text": "United Nations \nA/RES/74/161\n \n \nGeneral Assembly \nDistr.: General \n14 January 2020 \n \n19-22288 (E)    200120 \n*1922288* \n \n \nSeventy-fourth session \nAgenda item 70 (b) \nPromotion and protection of human rights: human \nrights questions, including alternative approaches for \nimproving the effective enjoyment of human rights and \nfundamental freedoms \n \n \n \n \n Resolution adopted by the General Assembly \non 18 December 2019 \n \n \n \n \n[on the report of the Third Committee (A/74/399/Add.2)] \n \n \n 74/161. International Convention for the Protection of All Persons \nfrom Enforced Disappearance \n \n \n \nThe General Assembly, \n \nReaffirming its resolution 61/177 of 20 December 2006, by which it adopted \nand opened for signature, ratification and accession the International Convention for \nthe Protection of All Persons from Enforced Disappearance, \n \nRecalling its resolution 47/133 of 18 December 1992, by which it adopted the \nDeclaration on the Protection of All Persons from Enforced Disappearance as a body \nof principles for all States,  \n \nRecalling also all its other resolutions on the matter, including resolutions \n70/160 of 17 December 2015 and 72/183 of 19 December 2017, as well as relevant \nresolutions adopted by the Human Rights Council, including resolution 36/6 of \n28 September 2017,1 \n \nRecalling further its resolution 68/165 of 18 December 2013 on the right to the \ntruth, as well as Human Rights Council resolution 36/7 of 28 September 2017 on the \nSpecial Rapporteur on the promotion of truth, justice, reparation and guarantees of \nnon-recurrence,1  \n \nRecalling its resolution 73/162 of 17 December 2018 on the human rights treaty \nbody system,  \n \nRecalling also that no one shall be subjected to enforced disappearance,  \n__________________ \n \n1  See Official Records of the General Assembly, Seventy-second Session, Supplement No. 53A \n(A/72/53/Add.1), chap. III. \n\nA/RES/74/161 \nInternational Convention for the Protection\nof All Persons from Enforced Disappearance\n \n19-22288\n2/4 \n \n \nRecalling further that no exceptional circumstance whatsoever may be invoked \nas a justification for enforced disappearance, \n \nRecalling that no one shall be held in secret detention,  \n \nDeeply concerned, in particular, by the increase in enforced or involuntary \ndisappearances in various regions of the world, including arrest, detention and \nabduction, when these are part of or amount to enforced disappearances, and by the \ngrowing number of reports concerning harassment, ill-treatment and intimidation of \nwitnesses of disappearance or relatives of persons who have disappeared,  \n \nRecalling that the Convention sets out the right of victims to know the truth \nregarding the circumstances of the enforced disappearance, the progress and results \nof the investigation and the fate of the disappeared person, and sets forth State party \nobligations to take appropriate measures in this regard,  \n \nRecalling also that the Convention defines the victim of enforced disappearance \nas the disappeared person and any individual who has suffered harm as the direct \nresult of an enforced disappearance,  \n \nAcknowledging that the widespread or systematic practice of enforced \ndisappearance is recognized in the Convention as a crime against humanity, as defined \nin applicable international law,  \n \nStressing the importance of the work of the Working Group on Enforced or \nInvoluntary Disappearances,  \n \nCalling upon States that have not provided substantive replies concerning \nclaims of enforced disappearances in their countries to do so, and to give due \nconsideration to relevant recommendations concerning this issue made by the \nWorking Group in its reports, \n \nEncouraging the Working Group, in accordance with its working methods, to \ncontinue to provide the States concerned with relevant and detailed information \nconcerning allegations of enforced disappearances in order to facilitate a prompt and \nsubstantive response to such communications without prejudice to the need for the \nStates concerned to cooperate with the Working Group,  \n \nRecalling the high-level meeting of the General Assembly held on 17 February \n2017 to commemorate the tenth anniversary of the adoption of the Convention, which \nprovided an opportunity to review the positive impact of the Convention and to \ndiscuss ways and best practices to prevent enforced disappearances and to combat \nimpunity by, inter alia, promoting the universal ratification of the Convention,  \n \nRecalling with appreciation the launch by the United Nations High \nCommissioner for Human Rights of an international campaign for the universal \nratification of the Convention,  \n \nAcknowledging the valuable work of the International Committee of the Red \nCross in promoting compliance with international humanitarian law in this field,  \n \n1. \nRecognizes the importance of the International Convention for the \nProtection of All Persons from Enforced Disappearance, 2 the ratification and the \nimplementation of which is a significant contribution to ending impunity and to \npromoting and protecting all human rights for all;  \n \n2. \nWelcomes the fact that 98 States have signed the Convention and 62 have \nratified or acceded to it, and calls upon States that have not yet done so to consider \nsigning, ratifying or acceding to the Convention as a matter of priority, as well as to \n__________________ \n \n2  United Nations, Treaty Series, vol. 2716, No. 48088. \n\nInternational Convention for the Protection \nof All Persons from Enforced Disappearance \nA/RES/74/161\n \n3/4\n19-22288 \n \nconsider the option provided for in articles 31 and 32 of the Convention regarding the \nCommittee on Enforced Disappearances;  \n \n3. \nAlso welcomes the most recent reports of the Secretary-General on the \nstatus of the Convention;3  \n \n4. \nRequests the Secretary-General and the United Nations High Commissioner \nfor Human Rights to increase their intensive efforts to assist States in becoming \nparties to the Convention, including by supporting the actions of States to ratify the \nConvention, providing technical and capacity-building assistance to States and civil \nsociety and raising awareness about the Convention, with a view to achieving \nuniversal adherence;  \n \n5. \nRequests United Nations agencies and organizations, and invites \nintergovernmental and non-governmental organizations and the Working Group on \nEnforced or Involuntary Disappearances to continue to make efforts to disseminate \ninformation on the Convention, to promote understanding of it and to assist States \nparties in implementing their obligations under this instrument, especially in the \ncontext of the commemoration of the fortieth anniversary of the Working Group \nin 2020;  \n \n6. \nRecalls with appreciation the first Conference of the States Parties to the \nConvention, held in Geneva on 19 December 2016, and convened in accordance with \narticle 27 of the Convention, and the decision adopted by consensus that the Committee \nwould continue to monitor the Convention in accordance with its mandate; 4  \n \n7. \nTakes note with appreciation of the fifth meeting of the States parties to \nthe Convention, held in New York on 25 June 2019, and its discussion of substantive \nmatters related to the Convention, and encourages all States parties to the Convention \nto continue to include such a discussion in the agenda of the meeting of the States \nparties;  \n \n8. \nWelcomes the work achieved by the Committee, and encourages all States \nparties to the Convention to submit their reports, to support and promote the work of \nthe Committee and to implement its recommendations; \n \n9. \nTakes note of the guiding principles for the search for disappeared persons \nadopted by the Committee at its sixteenth session and developed in dialogue and \nbroad consultations with Member States and other relevant stakeholders; 5 \n \n10. Recognizes the importance of the Declaration on the Protection of All \nPersons from Enforced Disappearance6 as a body of principles for all States that is \ndesigned to punish enforced disappearances, to prevent their commission and to help \nvictims of such acts and their families to seek fair, prompt and adequate reparation;  \n \n11. \nWelcomes the cooperation established between the Working Group and the \nCommittee, within the framework of their respective mandates, and encourages \nfurther cooperation in the future; \n \n12. Takes note with interest of all the general comments of the Working Group, \nincluding the comments on children7 and women8 affected by enforced disappearances, \nand recognizes in this regard that enforced disappearances have special consequences \nfor women and vulnerable groups, especially children, as they most often bear the \n__________________ \n \n3  A/72/280 and A/74/213. \n \n4  See CED/CSP/2016/4. \n \n5  See CED/C/7. \n \n6  Resolution 47/133. \n \n7  A/HRC/WGEID/98/1 and A/HRC/WGEID/98/1/Corr.1. \n \n8  A/HRC/WGEID/98/2. \n\nA/RES/74/161 \nInternational Convention for the Protection\nof All Persons from Enforced Disappearance\n \n19-22288\n4/4 \n \nserious economic hardships that usually accompany such disappearances and, when \nsubjected to enforced disappearances themselves, may become particularly \nvulnerable to sexual and other forms of violence;  \n \n13. Takes note of the need to document cases concerning enforced or \ninvoluntary disappearances allegedly perpetrated by non-State actors, as decided by \nthe Working Group;  \n \n14. Welcomes the fact that the Committee held its annual meeting with the \nWorking Group, as an opportunity to take stock of the activities of the two parallel \norgans, which are complementary and reinforce each other within the framework of \ntheir respective mandates;  \n \n15. Invites the Chair of the Committee and the Chair of the Working Group to \naddress and engage in an interactive dialogue with the General Assembly at its \nseventy-fifth and seventy-sixth sessions under the item entitled \u201cPromotion and \nprotection of human rights\u201d;  \n \n16. Requests the Secretary-General to submit to the General Assembly at its \nseventy-sixth session a report on the status of the Convention and the implementation \nof the present resolution;  \n \n17. Decides to give its full consideration to the subject matter at its seventy-\nsixth session. \n \n50th plenary meeting \n18 December 2019 \n \n",
  "paragraphs": {
    "1": "Recognizes the importance of the International Convention for the Protection of All Persons from Enforced Disappearance, 2 the ratification and the implementation of which is a significant contribution to ending impunity and to promoting and protecting all human rights for all;",
    "2": "Welcomes the fact that 98 States have signed the Convention and 62 have ratified or acceded to it, and calls upon States that have not yet done so to consider signing, ratifying or acceding to the Convention as a matter of priority, as well as to consider the option provided for in articles 31 and 32 of the Convention regarding the Committee on Enforced Disappearances;",
    "3": "Also welcomes the most recent reports of the Secretary-General on the status of the Convention;3",
    "4": "Requests the Secretary-General and the United Nations High Commissioner for Human Rights to increase their intensive efforts to assist States in becoming parties to the Convention, including by supporting the actions of States to ratify the Convention, providing technical and capacity-building assistance to States and civil society and raising awareness about the Convention, with a view to achieving universal adherence;",
    "5": "Requests United Nations agencies and organizations, and invites intergovernmental and non-governmental organizations and the Working Group on Enforced or Involuntary Disappearances to continue to make efforts to disseminate information on the Convention, to promote understanding of it and to assist States parties in implementing their obligations under this instrument, especially in the context of the commemoration of the fortieth anniversary of the Working Group in 2020;",
    "6": "Recalls with appreciation the first Conference of the States Parties to the Convention, held in Geneva on 19 December 2016, and convened in accordance with article 27 of the Convention, and the decision adopted by consensus that the Committee would continue to monitor the Convention in accordance with its mandate; 4",
    "7": "Takes note with appreciation of the fifth meeting of the States parties to the Convention, held in New York on 25 June 2019, and its discussion of substantive matters related to the Convention, and encourages all States parties to the Convention to continue to include such a discussion in the agenda of the meeting of the States parties;",
    "8": "Welcomes the work achieved by the Committee, and encourages all States parties to the Convention to submit their reports, to support and promote the work of the Committee and to implement its recommendations;",
    "9": "Takes note of the guiding principles for the search for disappeared persons adopted by the Committee at its sixteenth session and developed in dialogue and broad consultations with Member States and other relevant stakeholders; 5",
    "10": "Recognizes the importance of the Declaration on the Protection of All Persons from Enforced Disappearance6 as a body of principles for all States that is designed to punish enforced disappearances, to prevent their commission and to help victims of such acts and their families to seek fair, prompt and adequate reparation;",
    "11": "Welcomes the cooperation established between the Working Group and the Committee, within the framework of their respective mandates, and encourages further cooperation in the future;",
    "12": "Takes note with interest of all the general comments of the Working Group, including the comments on children7 and women8 affected by enforced disappearances, and recognizes in this regard that enforced disappearances have special consequences for women and vulnerable groups, especially children, as they most often bear the serious economic hardships that usually accompany such disappearances and, when subjected to enforced disappearances themselves, may become particularly vulnerable to sexual and other forms of violence;",
    "13": "Takes note of the need to document cases concerning enforced or involuntary disappearances allegedly perpetrated by non-State actors, as decided by the Working Group;",
    "14": "Welcomes the fact that the Committee held its annual meeting with the Working Group, as an opportunity to take stock of the activities of the two parallel organs, which are complementary and reinforce each other within the framework of their respective mandates;",
    "15": "Invites the Chair of the Committee and the Chair of the Working Group to address and engage in an interactive dialogue with the General Assembly at its seventy-fifth and seventy-sixth sessions under the item entitled \u201cPromotion and protection of human rights\u201d;",
    "16": "Requests the Secretary-General to submit to the General Assembly at its seventy-sixth session a report on the status of the Convention and the implementation of the present resolution;",
    "17": "Decides to give its full consideration to the subject matter at its seventy- sixth session."
  },
  "agenda_items": [
    "Item 70"
  ],
  "symbol_references": []
}