{
  "symbol": "A/RES/76/241",
  "filename": "A_RES_76_241.pdf",
  "title": "76/241. Report on the activities of the Office of Internal Oversight Services",
  "text": "United Nations \nA/RES/76/241\n \n \nGeneral Assembly \nDistr.: General \n4 January 2022 \n \n21-19706 (E)    070122     \n*2119706* \n \n \nSeventy-sixth session \nAgenda items 136 and 146 \nReview of the efficiency of the administrative and financial \nfunctioning of the United Nations \nReport on the activities of the Office of Internal \nOversight Services \n \n \n \n \n Resolution adopted by the General Assembly \non 24 December 2021 \n \n \n \n \n[on the report of the Fifth Committee (A/76/631, para. 6)] \n \n \n 76/241. Report on the activities of the Office of Internal Oversight Services \n \n \n \nThe General Assembly, \n \n \n \nI \n \n \nActivities of the Office of Internal Oversight Services \n \n \nRecalling its resolutions 48/218 B of 29 July 1994, 54/244 of 23 December \n1999, 59/272 of 23 December 2004, 60/259 of 8 May 2006, 63/265 of 24 December \n2008, 64/232 of 22 December 2009, 64/263 of 29 March 2010, 65/250 of \n24 December 2010, 66/236 of 24 December 2011, 67/258 of 12 April 2013, 68/21 of \n4 December 2013, 69/252 and 69/253 of 29 December 2014, 70/111 of 14 December \n2015, 71/7 of 27 October 2016, 72/18 of 1 December 2017, 73/275 of 22 December \n2018, 74/256 and 74/257 of 27 December 2019 and 75/247 of 31 December 2020,  \n \nHaving considered the report of the Office of Internal Oversight Services on its \nactivities for the period from 1 July 2020 to 30 June 2021, 1  \n \n1. \nReaffirms its primary role in the consideration of and action taken on \nreports submitted to it;  \n \n2. \nAlso reaffirms its oversight role and the role of the Fifth Committee in \nadministrative and budgetary matters;  \n \n3. \nFurther reaffirms the independence and the separate and distinct roles of \nthe internal and external oversight mechanisms;  \n__________________ \n \n1  A/76/281 (Part I) and A/76/281 (Part I)/Add.1. \n\nA/RES/76/241 \nReport on the activities of the Office of Internal Oversight Services\n \n21-19706\n2/2 \n \n \n4. \nRecognizes the important roles and operational independence of the \noversight bodies, including the Office of Internal Oversight Services of the \nSecretariat, in contributing to improvements in the effectiveness, transparency and \naccountability of the Organization;  \n \n5. \nRecalls that the Office shall exercise operational independence relating to \nthe performance of its internal oversight functions, under the authority of the \nSecretary-General, in accordance with the relevant resolutions;  \n \n6. \nRequests the Secretary-General to ensure that the annual reports of the \nOffice continue to include a brief description of any impairment of its independence;  \n \n7. \nEncourages United Nations internal and external oversight bodies to \nfurther enhance the level of cooperation with one another, such as through joint work-\nplanning sessions, without prejudice to the independence of each;  \n \n8. \nTakes note of the report of the Office on its activities for the period from \n1 July 2020 to 30 June 2021;  \n \n9. \nRequests the Secretary-General to ensure that all relevant resolutions \npertaining to the work of the Office are brought to the attention of the relevant \nmanagers;  \n \n10. Also requests the Secretary-General to ensure that all relevant resolutions, \nincluding those of a cross-cutting nature, are brought to the attention of relevant \nmanagers and that the Office also takes those resolutions into account in the conduct \nof its activities;  \n \n \n \nII \n \n \nActivities of the Independent Audit Advisory Committee \n \n \nRecalling its resolutions 61/275 of 29 June 2007, 64/263, section II of its \nresolution 65/250, section II of its resolution 66/236, section II of its resolution \n67/258, section II of its resolution 68/21, section II of its resolution 69/252, section II \nof its resolution 70/111, section II of its resolution 71/7, section II of its resolution \n72/18, section II of its resolution 73/275, section II of its resolution 74/256 and \nsection II of its resolution 75/247,  \n \nHaving considered the report of the Independent Audit Advisory Committee on \nits activities for the period from 1 August 2020 to 31 July 2021, 2  \n \n1. \nNotes with appreciation the work of the Independent Audit Advisory \nCommittee;  \n \n2. \nReaffirms the terms of reference of the Committee, as contained in the \nannex to its resolution 61/275. \n \n54th (resumed) plenary meeting \n24 December 2021 \n \n \n__________________ \n \n2  A/76/270. \n",
  "paragraphs": {
    "1": "Notes with appreciation the work of the Independent Audit Advisory Committee;",
    "2": "Reaffirms the terms of reference of the Committee, as contained in the annex to its resolution 61/275. 54th (resumed) plenary meeting 24 December 2021 __________________ 2 A/76/270.",
    "3": "Further reaffirms the independence and the separate and distinct roles of the internal and external oversight mechanisms; __________________ 1 A/76/281 (Part I) and A/76/281 (Part I)/Add.1. A/RES/76/241 Report on the activities of the Office of Internal Oversight Services 21-19706 2/2",
    "4": "Recognizes the important roles and operational independence of the oversight bodies, including the Office of Internal Oversight Services of the Secretariat, in contributing to improvements in the effectiveness, transparency and accountability of the Organization;",
    "5": "Recalls that the Office shall exercise operational independence relating to the performance of its internal oversight functions, under the authority of the Secretary-General, in accordance with the relevant resolutions;",
    "6": "Requests the Secretary-General to ensure that the annual reports of the Office continue to include a brief description of any impairment of its independence;",
    "7": "Encourages United Nations internal and external oversight bodies to further enhance the level of cooperation with one another, such as through joint work- planning sessions, without prejudice to the independence of each;",
    "8": "Takes note of the report of the Office on its activities for the period from 1 July 2020 to 30 June 2021;",
    "9": "Requests the Secretary-General to ensure that all relevant resolutions pertaining to the work of the Office are brought to the attention of the relevant managers;",
    "10": "Also requests the Secretary-General to ensure that all relevant resolutions, including those of a cross-cutting nature, are brought to the attention of relevant managers and that the Office also takes those resolutions into account in the conduct of its activities; II Activities of the Independent Audit Advisory Committee Recalling its resolutions 61/275 of 29 June 2007, 64/263, section II of its resolution 65/250, section II of its resolution 66/236, section II of its resolution 67/258, section II of its resolution 68/21, section II of its resolution 69/252, section II of its resolution 70/111, section II of its resolution 71/7, section II of its resolution 72/18, section II of its resolution 73/275, section II of its resolution 74/256 and section II of its resolution 75/247, Having considered the report of the Independent Audit Advisory Committee on its activities for the period from 1 August 2020 to 31 July 2021, 2"
  },
  "agenda_items": [
    "Item 136"
  ],
  "symbol_references": []
}