{
  "symbol": "A/RES/72/283",
  "filename": "A_RES_72_283.pdf",
  "title": "72/283. Strengthening regional and international cooperation to ensure peace, stability and sustainable development in the Central Asian region",
  "text": "United Nations \nA/RES/72/283\n \n \nGeneral Assembly \nDistr.: General \n25 June 2018 \n \n18-10332 (E)    270618 \n*1810332* \n \n \nSeventy-second session \nAgenda item 65 \n \n \n \n \n Resolution adopted by the General Assembly \non 22 June 2018 \n \n \n \n \n[without reference to a Main Committee (A/72/L.61 and A/72/L.61/Add.1)] \n \n \n 72/283. Strengthening regional and international cooperation to ensure \npeace, stability and sustainable development in the Central \nAsian region \n \n \n \nThe General Assembly, \n \nGuided by the provisions of the Charter of the United Nations that encourage \nmeasures for regional cooperation to advance the purposes and principles of the \nUnited Nations, \n \nRecognizing the important role of the Central Asian countries in ensuring peace, \nstability and sustainable development in the region as well as in promoting regional \nand international cooperation, \n \nKeeping in mind modern challenges and threats faced by the countries of \nCentral Asia, \n \nAcknowledging the major regional and international initiatives of the Central \nAsian States in the fields of security and development, including: \n \n(a) \nThe establishment of a nuclear-weapon-free zone in Central Asia as an \neffective measure towards the achievement of a world free of nuclear weapons and \nother weapons of mass destruction,1 \n \n(b) \nThe declaration by the General Assembly of 29 August as the International \nDay against Nuclear Tests as one of the key means of achieving the goal of a nuclear-\nweapon-free world,2 \n__________________ \n \n1  See resolutions 65/49, 67/31, 69/36 and 71/65, entitled \u201cTreaty on a Nuclear-Weapon-Free Zone \nin Central Asia\u201d. \n \n2  See resolution 64/35 on the International Day against Nuclear Tests. \n\nA/RES/72/283 \nStrengthening regional and international cooperation to ensure peace,\n stability and sustainable development in the Central Asian region\n \n18-10332\n2/4 \n \n \n(c) \nThe adoption of the first regional Joint Plan of Action for the \nImplementation of the United Nations Global Counter-Terrorism Strategy in Central \nAsia and the Ashgabat Declaration,3 \n \n(d) \nThe elimination of risks from uranium tailings, the legacy of nuclear tests \nand radioactive waste,4 \n \n(e) \nThe proclamation of the period 2018\u20132028 as the International Decade for \nAction, \u201cWater for Sustainable Development\u201d,5 \n \n(f) \nEnsuring reliable and stable transit in respect of energy carriers and energy \nresources, including through the effective implementation of existing regional energy \nprojects,6 \n \n(g) \nThe development of sustainable, best-value infrastructure supporting \ntransport and transit corridors and the strengthening of links between all modes of \ntransport, including by opening new roads and railways, as well as flight routes, as \nwell as the implementation of transport and transit agreements encompassing Central \nAsia,7,8,9 \n \n(h) \nEnsuring the protection of ecosystems, biodiversity and critical species of \nflora and fauna, \n \nWelcoming the efforts of the Governments of Central Asian countries to \nimplement the 2030 Agenda for Sustainable Development 10  and the Sustainable \nDevelopment Goals contained therein at the national level, \n \nReferring to the results of the international conference on the theme \u201cCentral \nAsia: shared past and common future, cooperation for sustainable development and \nmutual prosperity\u201d, held in Samarkand, Uzbekistan, on 10 and 11 November 2017,11 \nat which the countries of Central Asia reaffirmed their commitment to strengthening \nbilateral and regional cooperation, \n \nNoting with satisfaction the regional support for the initiative to convene regular \nconsultative meetings of the Heads of State of the Central Asian countries, \n \nRecognizing the importance of preventive diplomacy, and noting in this \ncontext the role of the United Nations Regional Centre for Preventive Diplomacy \nfor Central Asia,12 \n \nRecognizing also the efforts of the United Nations Special Programme for the \nEconomies of Central Asia, which Afghanistan has joined, \n__________________ \n \n3  A/71/982-S/2017/600, annex. \n \n4  See resolution 68/218 on the role of the international community in averting the radiation threat \nin Central Asia. \n \n5  See resolution 71/222 on the International Decade for Action, \u201cWater for Sustainable \nDevelopment\u201d, 2018\u20132028. \n \n6  See resolution 63/210 on reliable and stable transit of energy and its role in ensuring sustainable \ndevelopment and international cooperation. \n \n7  See resolution 69/213 on the role of transport and transit corridors in ensuring international \ncooperation for sustainable development. \n \n8  See resolution 70/197, entitled \u201cTowards comprehensive cooperation among all modes of \ntransport for promoting sustainable multimodal transit corridors\u201d. \n \n9  See resolution 72/212 on strengthening the links between all modes of transport to achieve the \nSustainable Development Goals. \n \n10  Resolution 70/1. \n \n11  See A/C.2/72/3, annex. \n \n12  See resolution 72/7 on the role of the United Nations Regional Centre for Preventive Diplomacy \nfor Central Asia. \n\nStrengthening regional and international cooperation to ensure peace,  \nstability and sustainable development in the Central Asian region \nA/RES/72/283\n \n3/4\n18-10332 \n \n \nStressing the importance of the Afghan-led Regional Economic Cooperation \nConference on Afghanistan and other such important regional initiatives, aimed at \npromoting regional cooperation, and welcoming the outcomes of the seventh Regional \nEconomic Cooperation Conference on Afghanistan, held in Ashgabat on 14 and \n15 November 2017, aimed at further economic cooperation, and encouraging the \nefforts and contribution by Central Asian States to the development of Afghanistan, \n \nRecognizing the outcomes of the ministerial debate of the Security Council on \nbuilding regional partnership in Afghanistan and Central Asia as a model to link \nsecurity and development, held on 19 January 2018 during the presidency of \nKazakhstan as the first Central Asian country on the Council, \n \nAcknowledging the efforts of the Central Asian States to actively promote \neducation as an important condition for effectively counteracting violent extremism \nas and when conducive to terrorism, \n \nTaking into account the outcome of the high-level international conference on \ncountering terrorism and preventing violent extremism, held in Dushanbe on 3 and \n4 May 2018,13 \n \nSupporting the holding of the World Nomad Games on a regular basis, thereby \ncontributing to intercultural dialogue, \n \n1. \nNotes with satisfaction the significant practical contribution and efforts of \nthe Central Asian States in strengthening regional security and stability, as well as in \nfostering sustainable development; \n \n2. \nExpresses its support for the ongoing regional efforts and initiatives to \nstrengthen stability and economic cooperation in Central Asia; \n \n3. \nReaffirms that threats to stability and sustainable development in the \nregion require closer and more coordinated cooperation between the States of Central \nAsia, as well as between them and international and regional organizations, and also \nreaffirms the importance of regional cooperation involving regional and international \norganizations in addressing these threats; \n \n4. \nCalls upon the countries of the region to make effective use of the platform \nof regular consultations of Heads of State and other forums to promote cooperation \nin the region and beyond in ensuring peace, stability and sustainable development; \n \n5. \nSupports the active cooperation of the Central Asian countries in \nimplementing the initiatives outlined in the final communiqu\u00e9 of the international \nconference on the theme \u201cCentral Asia: shared past and common future, cooperation \nfor sustainable development and mutual prosperity\u201d;11 \n \n6. \nWelcomes the first summit of Central Asian Heads of State, held in Astana \non 15 March 2018; \n \n7. \nAlso welcomes the holding by Turkmenistan in 2018 of the summit of the \nHeads of the participating States of the International Fund for Saving the Aral Sea; \n \n8. \nEncourages the efforts of the Central Asian States to promote the peace \nprocess and social and economic development in Afghanistan and their participation \nin the regional political and economic processes, and underscores the importance of \nthe Kabul process as a main forum and vehicle for peace initiatives on Afghanistan, \nas well as other regional and international conferences, including the Tashkent \nConference on Afghanistan: Peace Process, Security Cooperation and Regional \nConnectivity, held on 26 and 27 March 2018, as ongoing efforts of the international \ncommunity to support the Afghan-led peace and reconciliation process; \n__________________ \n \n13  See A/72/864, annex. \n\nA/RES/72/283 \nStrengthening regional and international cooperation to ensure peace,\n stability and sustainable development in the Central Asian region\n \n18-10332\n4/4 \n \n \n9. \nNotes the importance of developing and strengthening bilateral and \nregional cooperation in the sphere of the rational and integrated use of water and \nenergy resources in Central Asia, taking into account the interests of all States of the \nregion, and for that purpose calls for the holding of regular consultations to promptly \ndevelop mutually beneficial long-term sustainable mechanisms in this field; \n \n10. Calls upon Member States to support the efforts of the Central Asian States \naimed at mitigating the environmental and socioeconomic consequences of the drying \nup of the Aral Sea; \n \n11. \nSupports the further strengthening of good-neighbourly and friendly \nrelations among the Central Asian States through deepening relations in the fields of \neducation, science, technology, innovation, tourism, culture, the arts and sports, and \nfor continued mutual assistance in emergency situations; \n \n12. Notes the importance of developing an advanced transportation system in \nthe vast area of Central Asia and the wide use of the transit potential of the region as \na necessary condition for sustainable development and free movement of people, \ngoods and services; \n \n13. Calls upon the specialized agencies, funds and programmes of the United \nNations system to harmonize their programmes and activities in support of the \npriorities for regional cooperation, integration and sustainable development in Central \nAsia, as identified by the countries of the region; \n \n14. Encourages the United Nations Regional Centre for Preventive Diplomacy \nfor Central Asia to continue its efforts to promote peace, stability, security and \nprosperity in the region, within its mandate, in promoting preventive diplomacy in \ncooperation with relevant regional and international organizations; \n \n15. Encourages the efforts of the partners of the Central Asian States and the \ninternational community as a whole to strengthen and expand cooperation with the \ncountries of the region in the fields of regional security and sustainable development. \n \n98th plenary meeting  \n22 June 2018 \n \n",
  "paragraphs": {
    "1": "Notes with satisfaction the significant practical contribution and efforts of the Central Asian States in strengthening regional security and stability, as well as in fostering sustainable development;",
    "2": "Expresses its support for the ongoing regional efforts and initiatives to strengthen stability and economic cooperation in Central Asia;",
    "3": "Reaffirms that threats to stability and sustainable development in the region require closer and more coordinated cooperation between the States of Central Asia, as well as between them and international and regional organizations, and also reaffirms the importance of regional cooperation involving regional and international organizations in addressing these threats;",
    "4": "Calls upon the countries of the region to make effective use of the platform of regular consultations of Heads of State and other forums to promote cooperation in the region and beyond in ensuring peace, stability and sustainable development;",
    "5": "Supports the active cooperation of the Central Asian countries in implementing the initiatives outlined in the final communiqu\u00e9 of the international conference on the theme \u201cCentral Asia: shared past and common future, cooperation for sustainable development and mutual prosperity\u201d;11",
    "6": "Welcomes the first summit of Central Asian Heads of State, held in Astana on 15 March 2018;",
    "7": "Also welcomes the holding by Turkmenistan in 2018 of the summit of the Heads of the participating States of the International Fund for Saving the Aral Sea;",
    "8": "Encourages the efforts of the Central Asian States to promote the peace process and social and economic development in Afghanistan and their participation in the regional political and economic processes, and underscores the importance of the Kabul process as a main forum and vehicle for peace initiatives on Afghanistan, as well as other regional and international conferences, including the Tashkent Conference on Afghanistan: Peace Process, Security Cooperation and Regional Connectivity, held on 26 and 27 March 2018, as ongoing efforts of the international community to support the Afghan-led peace and reconciliation process;",
    "9": "Notes the importance of developing and strengthening bilateral and regional cooperation in the sphere of the rational and integrated use of water and energy resources in Central Asia, taking into account the interests of all States of the region, and for that purpose calls for the holding of regular consultations to promptly develop mutually beneficial long-term sustainable mechanisms in this field;",
    "10": "Calls upon Member States to support the efforts of the Central Asian States aimed at mitigating the environmental and socioeconomic consequences of the drying up of the Aral Sea;",
    "11": "Supports the further strengthening of good-neighbourly and friendly relations among the Central Asian States through deepening relations in the fields of education, science, technology, innovation, tourism, culture, the arts and sports, and for continued mutual assistance in emergency situations;",
    "12": "Notes the importance of developing an advanced transportation system in the vast area of Central Asia and the wide use of the transit potential of the region as a necessary condition for sustainable development and free movement of people, goods and services;",
    "13": "Calls upon the specialized agencies, funds and programmes of the United Nations system to harmonize their programmes and activities in support of the priorities for regional cooperation, integration and sustainable development in Central Asia, as identified by the countries of the region;",
    "14": "Encourages the United Nations Regional Centre for Preventive Diplomacy for Central Asia to continue its efforts to promote peace, stability, security and prosperity in the region, within its mandate, in promoting preventive diplomacy in cooperation with relevant regional and international organizations;",
    "15": "Encourages the efforts of the partners of the Central Asian States and the international community as a whole to strengthen and expand cooperation with the countries of the region in the fields of regional security and sustainable development."
  },
  "agenda_items": [
    "Item 65"
  ],
  "symbol_references": [
    "A/72/L.61"
  ]
}