{
  "symbol": "A/RES/73/308",
  "filename": "A_RES_73_308.pdf",
  "title": "73/308. Support account for peacekeeping operations",
  "text": "United Nations \nA/RES/73/308 \n \n \nGeneral Assembly \nDistr.: General \n19 July 2019 \n \n19-11304 (E)    230719     \n*1911304* \n \n \nSeventy-third session \nAgenda item 150 \n \n \n \n \n Resolution adopted by the General Assembly on 3 July 2019 \n \n \n \n \n[on the report of the Fifth Committee (A/73/936)] \n \n \n 73/308. Support account for peacekeeping operations \n \n \n \nThe General Assembly, \n \nRecalling its resolutions 45/258 of 3 May 1991, 47/218 A of 23 December 1992, \n48/226 A of 23 December 1993, 48/226 C of 29 July 1994, 49/250 of 20 July 1995 \nand 50/221 B of 7 June 1996, section I of its resolution 55/238 of 23 December 2000, \nits resolutions 55/271 of 14 June 2001, 56/241 of 24 December 2001, 56/293 of \n27 June 2002, 57/318 of 18 June 2003, 58/298 of 18 June 2004, 59/301 of 22 June \n2005, 60/268 of 30 June 2006, 61/279 of 29 June 2007, 62/250 of 20 June 2008, \n63/287 of 30 June 2009, 64/271 of 24 June 2010, 65/290 of 30 June 2011, 66/265 of \n21 June 2012, 67/287 of 28 June 2013, 68/283 of 30 June 2014, 69/308 of 25 June \n2015, 70/287 of 17 June 2016, 71/295 of 30 June 2017, 72/288 of 5 July 2018 and its \nother relevant resolutions, as well as its decisions 49/469 of 23 December 1994, \n50/473 of 23 December 1995 and 72/558 of 5 July 2018, \n \nHaving considered the reports of the Secretary-General on the budget \nperformance of the support account for peacekeeping operations for the period from \n1 July 2017 to 30 June 2018 1  and on the budget for the support account for \npeacekeeping operations for the period from 1 July 2019 to 30 June 2020, 2 the report \nof the Independent Audit Advisory Committee on the proposed budget of the Office \nof Internal Oversight Services under the support account for peacekeeping operations \nfor the period from 1 July 2019 to 30 June 20203 and the related report of the Advisory \nCommittee on Administrative and Budgetary Questions,4  \n \nRecognizing the importance of the United Nations being able to respond and \ndeploy rapidly to a peacekeeping operation upon the adoption of a relevant resolution \nof the Security Council, within 30 days for traditional peacekeeping operations and \n90 days for complex peacekeeping operations,  \n__________________ \n \n1  A/73/661 and A/73/661/Add.1. \n \n2  A/73/793. \n \n3  A/73/768. \n \n4  A/73/849. \n\nA/RES/73/308 \nSupport account for peacekeeping operations\n \n19-11304\n2/9 \n \n \nRecognizing also the need for adequate support during all phases of \npeacekeeping operations, including the liquidation and termination phases,  \n \nMindful that the level of the support account should broadly correspond to the \nmandate, number, size and complexity of peacekeeping missions,  \n \n1. \nTakes note of the report of the Secretary-General on the budget for the \nsupport account for peacekeeping operations for the period from 1 July 2019 to \n30 June 20202 and the report of the Independent Audit Advisory Committee on the \nproposed budget of the Office of Internal Oversight Services under the support \naccount for peacekeeping operations for the period from 1 July 2019 to 30 June 2020;3 \n \n2. \nReaffirms its role in carrying out a thorough analysis and approval of \nhuman and financial resources and policies with a view to ensuring the full, effective \nand efficient implementation of all mandated programmes and activities and the \nimplementation of policies in this regard;  \n \n3. \nAlso reaffirms that the Fifth Committee is the appropriate Main Committee \nof the General Assembly entrusted with responsibility for administrative and \nbudgetary matters;  \n \n4. \nFurther reaffirms rule 153 of its rules of procedure;  \n \n5. \nReaffirms that the support account funds shall be used for the sole purpose \nof financing human resources and non-human resources requirements for \nbackstopping and supporting peacekeeping operations at Headquarters, and that any \nchanges in this limitation require the prior approval of the General Assembly;  \n \n6. \nAlso reaffirms the need for adequate funding for the backstopping of \npeacekeeping operations, as well as the need for full justification for that funding in \nsupport account budget submissions; \n \n7. \nFurther reaffirms the need for effective and efficient administration and \nfinancial management of peacekeeping operations, and urges the Secretary-General \nto continue to identify measures to increase the productivity and efficiency of the \nsupport account;  \n \n8. \nRequests the Secretary-General to ensure the full implementation of the \nrelevant provisions of its resolutions 59/296 of 22 June 2005, 60/266 of 30 June 2006, \n61/276 of 29 June 2007, 64/269 of 24 June 2010, 65/289 of 30 June 2011, 66/264 of \n21 June 2012, 69/307 of 25 June 2015 and 70/286 of 17 June 2016, and other relevant \nresolutions;  \n \n9. \nEndorses the conclusions and recommendations contained in the report of \nthe Advisory Committee on Administrative and Budgetary Questions,4 subject to the \nprovisions of the present resolution, and requests the Secretary-General to ensure \ntheir full implementation;  \n \n10. Decides to maintain, for the financial period from 1 July 2019 to 30 June \n2020, the funding mechanism for the support account used in the current period, from \n1 July 2018 to 30 June 2019, as approved in paragraph 3 of its resolution 50/221 B;  \n \n11. Reaffirms that the use of external consultants should be kept to an absolute \nminimum and that their services should be used only when necessary, and stresses the \nneed for using the in-house capacity of the Organization to perform core activities or \nto fulfil functions that are recurrent over the long term;  \n \n\nSupport account for peacekeeping operations \nA/RES/73/308\n \n3/9\n19-11304 \n \n \n \nBudget performance report for the period from 1 July 2017 to 30 June 2018 \n \n \n12. Takes note of the report of the Secretary-General on the budget \nperformance of the support account for peacekeeping operations for the period from \n1 July 2017 to 30 June 2018;1  \n \n \n \nBudget estimates for the financial period from 1 July 2019 to 30 June 2020 \n \n \n13. Approves the support account requirements in the amount of 348,868,000 \nUnited States dollars for the financial period from 1 July 2019 to 30 June 2020, \ninclusive of the amount of 19,376,900 dollars for the enterprise resource planning \nproject, 821,500 dollars for information and systems security, 868,500 dollars for the \nglobal service delivery model project, 3,881,600 dollars for peacekeeping capability \nreadiness and 20,803,300 dollars for Umoja maintenance and support costs, including \n1,357 continuing posts and 9 new temporary posts, as well as the abolishment, \nredeployment, reassignment and reclassification of posts, as set out in annex I to the \npresent resolution, and 59 continuing and 3 new general temporary assistance \npositions and 52 person-months, as set out in annex II, as well as related post and \nnon-post requirements; \n \n \n \nFinancing of the support account for peacekeeping operations for the financial \nperiods from 1 July 2017 to 30 June 2018 and from 1 July 2019 to 30 June 2020 \n \n \n14. Decides that the requirements for the support account for peacekeeping \noperations for the financial period from 1 July 2019 to 30 June 2020 shall be financed \nas follows: \n \n(a) \nThe unencumbered balance in the amount of 18,800 dollars, in respect of \nthe financial period from 1 July 2017 to 30 June 2018, to be applied to the resources \nrequired for the financial period from 1 July 2019 to 30 June 2020;  \n \n(b) \nThe total amount of 3,040,600 dollars, comprising investment revenue of \n1,152,200 dollars, other miscellaneous revenue of 277,900 dollars and the \ncancellation of prior-period obligations of 1,610,500 dollars in respect of the period \nfrom 1 July 2017 to 30 June 2018, to be applied to the resources required for the \nfinancial period from 1 July 2019 to 30 June 2020;  \n \n(c) \nThe amount of 1,973,400 dollars, representing the excess of the authorized \nlevel of the Peacekeeping Reserve Fund in respect of the financial period ended \n30 June 2018, to be applied to the resources required for the financial period from \n1 July 2019 to 30 June 2020;  \n \n(d) \nThe balance of 343,835,200 dollars to be prorated among the budgets of \nthe active peacekeeping operations for the financial period from 1 July 2019 to \n30 June 2020; \n \n(e) \nThe net estimated staff assessment income of 24,482,200 dollars, comprising \nthe amount of 25,317,800 dollars for the financial period from 1 July 2019 to 30 June \n2020 and the decrease of 835,600 dollars in respect of the financial period ended 30 June \n2018, to be offset against the balance referred to in subparagraph (d) above, to be prorated \namong the budgets of the individual active peacekeeping operations. \n \n97th plenary meeting \n3 July 2019 \n\nA/RES/73/308 \nSupport account for peacekeeping operations\n \n19-11304\n4/9 \n \nAnnex I \n \nA \nPosts to be established under the support account for peacekeeping \noperations for the period from 1 July 2019 to 30 June 2020 \n \n \n \nPosts \n \n \nDepartment/office \nOrganizational unit \nNumber \nLevel \nFunction \nStatus \nDepartment of Peace Operations \nOffice of the Under-\nSecretary-General/Office of \nthe Director for Coordination \nand Shared Services \nFocal Point for Security \n1 \nGS (OL) \nAdministrative Assistant \n(organizational \nresilience) \nConversion from general \ntemporary assistance \nOffice of Rule of Law and \nSecurity Institutions \nOffice of the Assistant \nSecretary-General \n1 \nP-4 \nRule of Law and \nSecurity Institutions \nOfficer (MINUSCA) \n \nDisarmament, \nDemobilization and \nReintegration Section \n1 \nP-4 \nPolicy and Planning \nOfficer (disarmament, \ndemobilization and \nreintegration) \n(MINUSCA) \n \nPolice Division \n1 \nP-4 \nPolice Programme \nOfficer (MINUSCA) \n \nSubtotal \n4 \n \n \n \nDepartment of Management Strategy, Policy and Compliance \nOffice of Programme \nPlanning, Finance and \nBudget \nField Operations Finance \nDivision \n2 \nP-3 \nFinance and Budget \nOfficer \nConversion from general \ntemporary assistance \nSubtotal \n2 \n \n \n \nOffice of Internal Oversight Services \nInternal Audit Division \nUnited Nations \nMultidimensional \nIntegrated Stabilization \nMission in Mali \n2 \nP-4 \nResident Auditor  \nConversion from general \ntemporary assistance \n1 \nP-3 \nResident Auditor  \nSubtotal \n3 \n \n \n \nTotal \n9 \n \n \n \n \nNote: The specific assignment and location of each of the new posts is set out in the report of the Secretary-General on the budget \nfor the support account for peacekeeping operations for the period from 1 July 2019 to 30 June 2020 (A/73/793) and \nreferenced in the related report of the Advisory Committee on Administrative and Budgetary Questions (A/73/849). \nAbbreviations: GS (OL), General Service (Other level); MINUSCA, United Nations Multidimensional Integrated Stabilization \nMission in the Central African Republic. \n \n \n \n \n\nSupport account for peacekeeping operations \nA/RES/73/308\n \n5/9\n19-11304 \n \n \n B \nRedeployment, reassignment, reclassification and abolishment of \nposts under the support account for peacekeeping operations for  \nthe period from 1 July 2019 to 30 June 2020 \n \n \n \n \nRedeployment \n \n \n \nDepartment of Operational Support/Division of Administration, New York/ \nHeadquarters Client Support Service  \n \nRedeployment of 2 posts (2 GS (OL) Human Resources Assistants) from the Department \nof Management Strategy, Policy and Compliance/Office of Human Resources \n \n \n \nOffice of Internal Oversight Services/Investigations Division/Resident Investigations \nOffice of the United Nations Multidimensional Integrated Stabilization Mission in the \nCentral African Republic \n \nRedeployment of 2 posts (1 P-3 Resident Investigator and 1 NGS Administrative \nAssistant) from the Resident Investigations Office of the United Nations Mission for \nJustice Support in Haiti  \n \n \n \nOffice of Internal Oversight Services/Internal Audit Division/Entebbe \n \nRedeployment of 1 post (1 P-5 Chief Resident Auditor) from the Resident Audit Office \nof the United Nations Mission for Justice Support in Haiti (as of February 2020) \n \n \n \nReassignment \n \n \n \nOffice of Internal Oversight Services/Inspection and Evaluation Division/Entebbe \n \nReassignment of 1 post (1 P-5 Chief Resident Investigator to be reassigned and \nreclassified as 1 P-4 Evaluation Officer (Management and Programme Analyst)) from \nthe Investigations Division/Resident Investigations Office of the United Nations \nMission for Justice Support in Haiti  \nReassignment of 1 post (1 P-3 Resident Auditor to be reassigned as 1 P-3 Evaluation \nOfficer (Management and Programme Analyst)) from the Internal Audit Division/ \nResident Audit Office of the United Nations Mission for Justice Support in Haiti (as \nof February 2020) \n \n \n \nReclassification \n \n \n \nDepartment of Management Strategy, Policy and Compliance/Office of Programme \nPlanning, Finance and Budget/Field Operations Finance Division \n \nReclassification of 1 post (1 GS (OL) Finance and Budget Assistant to be reclassified \nas 1 GS (PL) Senior Finance and Budget Assistant) \n \n \n \nAbolishment  \n \n \n \nOffice of Internal Oversight Services/Internal Audit Division/Resident Audit Office of \nthe United Nations Mission for Justice Support in Haiti \n \nAbolishment of 1 post (1 NGS Administrative Assistant) (as of February 2020) \nAbolishment of 1 post (1 FS Administrative Assistant)  \n \n \n \nOffice of Information and Communications Technology/Enterprise Solutions Service/ \nEnterprise applications centre \u2013 Asia \n \nAbolishment of 1 post (1 GS (OL) Administrative Assistant (Inspira support function)) \n \n \nAbbreviations: FS, Field Service; GS (OL), General Service (Other level); GS (PL), General \nService (Principal level); NGS, national General Service. \n \n\nA/RES/73/308 \nSupport account for peacekeeping operations\n \n19-11304\n6/9 \n \nAnnex II \n \n \n General temporary assistance positions to be established under the support \naccount for peacekeeping operations for the period from 1 July 2019 to \n30 June 2020 \n \n \nPosition \n \n \nDepartment/office \nOrganizational unit \nNumber \nLevel \nFunction \nStatus \nDepartment of Peace Operations \n \n \n \n \nOffice of the Under-\nSecretary-General/ \nOffice of the \nDirector for \nCoordination and \nShared Services \nExecutive Office \n1 \nP-4 \nHuman Resources Officer \nContinuation \n \n\u2013 \n3 months, \n1 P-3 \nLeave replacement \nContinuation \n \n\u2013 \n3 months, \n1 GS (OL) \nLeave replacement \nContinuation \nOffice of Rule of \nLaw and Security \nInstitutions \nJustice and Corrections \nService \n1 \nP-4 \nJudicial Affairs Officer \nContinuation \nPolicy, Evaluation \nand Training \nDivision \nPolicy and Best Practices \nService \n1 \nP-3 \nPolitical Affairs Officer (Action for \nPeacekeeping) \nNew \nSubtotal \n3 \n \n \n \nUnited Nations Office to the African Union \n \n \n \n \nAdministrative \nSupport Section \n \n\u2013 \n3 months, \n1 FS \nLeave replacement \nContinuation \n \n\u2013 \n3 months, \n1 NGS \nLeave replacement \nContinuation \nSubtotal \n\u2013 \n \n \n \nDepartment of Operational Support \n \n \n \n \nOffice of Support \nOperations \nHealth-Care Management \nand Occupational Safety and \nHealth Division \n1 \nP-4 \nMedical Officer \nContinuation \nHuman Resources Services \nDivision \n10 \nP-3 \nHuman Resources Officer \n(occupational groups) \nContinuation \n \n3 \nGS (OL) \nHuman Resources Assistant \n(occupational groups) \nContinuation \nOffice of Supply \nChain Management \nUniformed Capabilities \nSupport Division \n2 \nP-3 \nFinance and Budget Officer \nContinuation \nEnabling and Outreach \nService \n1 \nGS (OL) \nProcurement Assistant \nContinuation \nDivision of \nAdministration, \nNew York \nArchives and Records \nManagement Service \n\u2013 \n10 months, \n1 P-4 \nInformation Management Officer \nContinuation \nSubtotal \n17 \n \n \n \n \n \n\nSupport account for peacekeeping operations \nA/RES/73/308\n \n7/9\n19-11304 \n \n \nPosition \n \n \nDepartment/office \nOrganizational unit \nNumber \nLevel \nFunction \nStatus \nDepartment of Management Strategy, Policy and Compliance \n \n \nOffice of the Under-\nSecretary-General \nBusiness Partner Service \n\u2013 \n4 months, \n1 P-3 \nLeave replacement \nContinuation \n \n\u2013 \n4 months, \n1 GS (OL) \nLeave replacement \nContinuation \nManagement Evaluation Unit \n1 \nP-3 \nLegal Officer \nContinuation \nOffice of Programme \nPlanning, Finance \nand Budget \nFinance Division \n1 \nP-4 \nFinance Officer (accounting policy) \nContinuation \n \n1 \nGS (OL) \nBenefits Assistant (insurance) \nContinuation \nOffice of Human \nResources \nGlobal Strategy and Policy \nDivision \n1 \nP-4 \nProgramme Officer (gender parity) \nContinuation \n1 \nP-3 \nHuman Resources Officer (mobility) \nContinuation \nAdministrative Law Division/ \nConduct and Discipline \nService \n1 \nP-3 \nProgramme Officer \nContinuation \nBusiness \nTransformation and \nAccountability \nDivision \nAnalytics and Project \nManagement Service \n1 \nP-4 \nManagement and Programme \nAnalyst \nContinuation \nSubtotal \n7 \n \n \n \nOffice of Information and Communications Technology \n \n \n \nEnterprise Solutions \nService \nEnterprise applications centre \u2013 \nAsia (Bangkok office) \n1 \nP-4 \nProject Manager (rations \nmanagement system) \nContinuation \n1  \nP-3 \nInformation Systems Officer (fuel \nmanagement system) \nContinuation \nEnterprise applications centre \u2013 \nAsia (New York office) \n1  \nP-3 \nInformation Systems Officer \n(customer relationship management \nfor the troop-contribution \nmanagement project) \nContinuation \nSubtotal \n3 \n \n \n \nOffice of Internal Oversight Services \n \n \n \n \nExecutive Office \n \n\u2013 \n4 months, \n1 P-3 \nLeave replacement \nContinuation \n \n\u2013 \n6 months, \n1 GS (OL) \nLeave replacement \nContinuation \nInvestigations \nDivision \nNew York \n1 \nP-4 \nInvestigator \nContinuation \n \n2 \nP-3 \nInvestigator \nContinuation \n \n1 \nGS (OL) \nAdministrative Assistant \nContinuation \nNairobi \n1 \nP-4 \nInvestigator \nContinuation \n \n2 \nP-3 \nInvestigator \nContinuation \nEntebbe \n1 \nNGS \nAdministrative Assistant \nContinuation \nUnited Nations Mission in \nSouth Sudan \n2 \nP-3 \nResident Investigator \nContinuation \n1 \nNGS \nAdministrative Assistant \nContinuation \n\nA/RES/73/308 \nSupport account for peacekeeping operations\n \n19-11304\n8/9 \n \n \nPosition \n \n \nDepartment/office \nOrganizational unit \nNumber \nLevel \nFunction \nStatus \nUnited Nations \nMultidimensional Integrated \nStabilization Mission in Mali \n1 \nP-5 \nChief Resident Investigator \nContinuation \n1 \nP-4 \nResident Investigator \nContinuation \n2 \nP-3 \nResident Investigator \nContinuation \n \n1 \nNGS \nAdministrative Assistant \nContinuation \nUnited Nations Organization \nStabilization Mission in the \nDemocratic Republic of the \nCongo \n1 \nP-3 \nResident Investigator \nContinuation \nUnited Nations \nMultidimensional Integrated \nStabilization Mission in the \nCentral African Republic \n2 \nP-3 \nResident Investigator \nContinuation \nInternal Audit \nDivision \nUnited Nations \nMultidimensional Integrated \nStabilization Mission in Mali \n1 \nP-4 \nResident Auditor  \nContinuation \n1 \nP-3 \nResident Auditor \nContinuation \nUnited Nations \nMultidimensional Integrated \nStabilization Mission in the \nCentral African Republic \n3 \nP-4 \nResident Auditor \nContinuation \n2 \nP-3 \nResident Auditor  \nContinuation \nSubtotal \n26 \n \n \n \nExecutive Office of the Secretary-General \n \n \n \n \n \n\u2013 \n6 months, \n1 GS (OL) \nLeave replacement \nContinuation \nSubtotal \n\u2013 \n \n \n \nOffice of the United Nations Ombudsman and Mediation Services \n \nRegional Ombudsman\u2019s Office in Entebbe \n2 \nP-4 \nConflict Resolution Officer \nContinuation \nSubtotal \n2 \n \n \n \nOffice of Legal Affairs \n \n \n \n \nGeneral Legal \nDivision \nAdministration of Justice \nCluster \n\u2013 \n3 months, \n1 P-4 \nLeave replacement \nContinuation \nSubtotal \n\u2013 \n \n \n \nDepartment of Global Communications \n \n \n \n \n \n\u2013 \n1.5 months, \n1 P-3 \nLeave replacement \nContinuation \n \n\u2013 \n1.5 months, \n1 GS (OL) \nLeave replacement \nContinuation \nSubtotal \n\u2013 \n \n \n \nDepartment of Safety and Security \n \nOffice of the Under-\nSecretary-General \nExecutive Office \n1 \nP-3 \nAdministrative Officer \nNew \n1 \nGS (OL) \nHuman Resources Assistant \nNew \nSubtotal \n2 \n \n \n \n \n \n\nSupport account for peacekeeping operations \nA/RES/73/308\n \n9/9\n19-11304 \n \n \nPosition \n \n \nDepartment/office \nOrganizational unit \nNumber \nLevel \nFunction \nStatus \nOffice of the United Nations High Commissioner for Human Rights \n \n \nField Engagement \nDivision \nPeace Missions Support \nSection (Addis Ababa) \n1 \nP-3 \nHuman Rights Officer (United \nNations Office to the African \nUnion) \nContinuation \nThematic \nEngagement, Special \nProcedures and Right \nto Development \nDivision \nMethodology, Education and \nTraining Section (New York) \n1 \nP-4 \nHuman Rights Officer (sexual \nexploitation and abuse) \nContinuation \nSubtotal \n2 \n \n \n \nTotal \n62 \n \nPositions  \nand 52 person-months (positions \nof less than 12 months\u2019 duration)a \n \n \nNote: The specific assignment and location of each of the general temporary assistance positions is set out in the report of the \nSecretary-General on the budget for the support account for peacekeeping operations for the period from 1 July 2019 to \n30 June 2020 (A/73/793) and referenced in the report of the Advisory Committee on Administrative and Budgetary Questions \n(A/73/849). \nAbbreviations: FS, Field Service; GS (OL), General Service (Other level); NGS, national General Service. \n \na Person-months are indicated in the column entitled \u201cLevel\u201d. \n \n",
  "paragraphs": {
    "1": "Takes note of the report of the Secretary-General on the budget for the support account for peacekeeping operations for the period from 1 July 2019 to 30 June 20202 and the report of the Independent Audit Advisory Committee on the proposed budget of the Office of Internal Oversight Services under the support account for peacekeeping operations for the period from 1 July 2019 to 30 June 2020;3",
    "2": "Reaffirms its role in carrying out a thorough analysis and approval of human and financial resources and policies with a view to ensuring the full, effective and efficient implementation of all mandated programmes and activities and the implementation of policies in this regard;",
    "3": "Also reaffirms that the Fifth Committee is the appropriate Main Committee of the General Assembly entrusted with responsibility for administrative and budgetary matters;",
    "4": "Further reaffirms rule 153 of its rules of procedure;",
    "5": "Reaffirms that the support account funds shall be used for the sole purpose of financing human resources and non-human resources requirements for backstopping and supporting peacekeeping operations at Headquarters, and that any changes in this limitation require the prior approval of the General Assembly;",
    "6": "Also reaffirms the need for adequate funding for the backstopping of peacekeeping operations, as well as the need for full justification for that funding in support account budget submissions;",
    "7": "Further reaffirms the need for effective and efficient administration and financial management of peacekeeping operations, and urges the Secretary-General to continue to identify measures to increase the productivity and efficiency of the support account;",
    "8": "Requests the Secretary-General to ensure the full implementation of the relevant provisions of its resolutions 59/296 of 22 June 2005, 60/266 of 30 June 2006, 61/276 of 29 June 2007, 64/269 of 24 June 2010, 65/289 of 30 June 2011, 66/264 of 21 June 2012, 69/307 of 25 June 2015 and 70/286 of 17 June 2016, and other relevant resolutions;",
    "9": "Endorses the conclusions and recommendations contained in the report of the Advisory Committee on Administrative and Budgetary Questions,4 subject to the provisions of the present resolution, and requests the Secretary-General to ensure their full implementation;",
    "10": "Decides to maintain, for the financial period from 1 July 2019 to 30 June 2020, the funding mechanism for the support account used in the current period, from 1 July 2018 to 30 June 2019, as approved in paragraph 3 of its resolution 50/221 B;",
    "11": " Budget performance report for the period from 1 July 2017 to 30 June 2018",
    "12": "Takes note of the report of the Secretary-General on the budget performance of the support account for peacekeeping operations for the period from 1 July 2017 to 30 June 2018;1 Budget estimates for the financial period from 1 July 2019 to 30 June 2020",
    "13": "Approves the support account requirements in the amount of 348,868,000 United States dollars for the financial period from 1 July 2019 to 30 June 2020, inclusive of the amount of 19,376,900 dollars for the enterprise resource planning project, 821,500 dollars for information and systems security, 868,500 dollars for the global service delivery model project, 3,881,600 dollars for peacekeeping capability readiness and 20,803,300 dollars for Umoja maintenance and support costs, including 1,357 continuing posts and 9 new temporary posts, as well as the abolishment, redeployment, reassignment and reclassification of posts, as set out in annex I to the present resolution, and 59 continuing and 3 new general temporary assistance positions and 52 person-months, as set out in annex II, as well as related post and non-post requirements; Financing of the support account for peacekeeping operations for the financial periods from 1 July 2017 to 30 June 2018 and from 1 July 2019 to 30 June 2020",
    "14": " B Position Department/office Organizational unit Number Level Function Status Office of the United Nations High Commissioner for Human Rights Field Engagement Division Peace Missions Support Section (Addis Ababa) 1 P-3 Human Rights Officer (United Nations Office to the African Union) Continuation Thematic Engagement, Special Procedures and Right to Development Division Methodology, Education and Training Section (New York) 1 P-4 Human Rights Officer (sexual exploitation and abuse) Continuation Subtotal 2 Total 62 Positions and 52 person-months (positions of less than 12 months\u2019 duration)a Note: The specific assignment and location of each of the general temporary assistance positions is set out in the report of the Secretary-General on the budget for the support account for peacekeeping operations for the period from 1 July 2019 to 30 June 2020 (A/73/793) and referenced in the report of the Advisory Committee on Administrative and Budgetary Questions (A/73/849). Abbreviations: FS, Field Service; GS (OL), General Service (Other level); NGS, national General Service. a Person-months are indicated in the column entitled \u201cLevel\u201d."
  },
  "agenda_items": [
    "Item 150"
  ],
  "symbol_references": []
}