{
  "symbol": "A/RES/79/257",
  "filename": "A_RES_79_257.pdf",
  "title": "79/257. Questions relating to the proposed programme budget for 2025",
  "text": "United Nations \nA/RES/79/257\n \n \nGeneral Assembly \nDistr.: General \n31 December 2024 \n \n24-24698 (E) \n*2424698* \n \n \nSeventy-ninth session \nAgenda item 139 \nProposed programme budget for 2025 \n \n \n \n \n Resolution adopted by the General Assembly \non 24 December 2024 \n \n \n \n \n[on the report of the Fifth Committee (A/79/652, para. 58)] \n \n \n 79/257. Questions relating to the proposed programme budget for 2025 \n \n \n \nThe General Assembly, \n \nReaffirming its resolutions 41/213 of 19 December 1986, 42/211 of \n21 December 1987, 45/248 B, section VI, of 21 December 1990, 55/231 of \n23 December 2000, 56/253 of 24 December 2001, 58/269 and 58/270 of 23 December \n2003, 59/276, section XI, of 23 December 2004, 60/283 of 7 July 2006, 61/263 of \n4 April 2007, 62/236 of 22 December 2007, 63/262 of 24 December 2008, 64/243 of \n24 December 2009, 65/259 of 24 December 2010, 66/246 of 24 December 2011, \n68/246 of 27 December 2013, 70/247 of 23 December 2015, 72/261 and 72/266 A of \n24 December 2017, 72/266 B of 5 July 2018, 73/281 of 22 December 2018, 74/262 \nof 27 December 2019, 75/252 of 31 December 2020, 76/245 of 24 December 2021, \n76/271 of 29 June 2022, 77/262 and 77/267 of 30 December 2022, 77/253 B of \n30 June 2023 and 78/242 A, 78/252, 78/253 and 78/257 of 22 December 2023, \n \nReaffirming also the respective mandates of the Committee for Programme and \nCoordination and the Advisory Committee on Administrative and Budgetary \nQuestions in the consideration of the proposed programme budget, \n \nReaffirming further the role of the General Assembly, through the Fifth \nCommittee, in carrying out a thorough analysis and approval of posts and financial \nresources, as well as of human resources policies, \n \nHaving considered the proposed programme budget for 2025,1 the report of the \nIndependent Audit Advisory Committee on internal oversight: proposed programme \nbudget for 20252 and the related report of the Advisory Committee on Administrative \nand Budgetary Questions,3  \n__________________ \n \n1 A/79/6 (Introduction), sects. 1\u201336 and income sects. 1\u20133 and corrigenda. \n \n2 A/79/89. \n \n3 Official Records of the General Assembly, Seventy-ninth Session, Supplement No. 7 (A/79/7). \n\nA/RES/79/257 \nQuestions relating to the proposed programme budget for 2025\n \n24-24698\n2/12 \n \n \nRecognizing that multilingualism, as a core and fundamental value of the \nOrganization, contributes to the achievement of the goals of the United Nations, as \nset out in Article 1 of the Charter of the United Nations, \n \n1. \nReaffirms rule 153 of its rules of procedure; \n \n2. \nAlso reaffirms the Regulations and Rules Governing Programme Planning, \nthe Programme Aspects of the Budget, the Monitoring of Implementation and the \nMethods of Evaluation;4 \n \n3. \nFurther reaffirms the Financial Regulations and Rules of the United Nations;5  \n \n4. \nReaffirms its resolution 79/247 of 24 December 2024; \n \n5. \nEndorses the conclusions and recommendations contained in the report of \nthe Advisory Committee of Administrative and Budgetary Questions, subject to the \nprovisions of the present resolution; \n \n6. \nReaffirms that the Fifth Committee is the appropriate Main Committee of \nthe General Assembly entrusted with responsibilities for administrative and budgetary \nmatters, and reaffirms the role of the Fifth Committee in carrying out a thorough \nanalysis and approving human and financial resources and policies, with a view to \nensuring full, effective and efficient implementation of all mandated programmes and \nactivities and the implementation of policies in this regard; \n \n7. \nAlso reaffirms the established budgetary procedures and methodologies, \nbased on its resolutions 41/213 and 42/211, and reaffirms that no changes to the \nbudget methodology, established budgetary procedures and practices or the financial \nregulations may be implemented without prior review and approval by the General \nAssembly in accordance with established budgetary procedures; \n \n8. \nNotes the Secretary-General\u2019s initiative to present a report on improving \nthe financial situation of the Organization at the first part of the resumed seventy-\nninth session; \n \n9. \nRecognizes that patterns of underexpenditure across various budget lines \nunder the ongoing liquidity challenges of the Organization can be linked to limited \nreleased allotments, and stresses that this specific type of underexpenditure should \nnot be used to achieve budgetary savings; \n \n10. Reiterates the need for Member States to participate fully in the budget \npreparation process, from its early stages and throughout the process; \n \n11. \nRequests the Secretary-General to continue his efforts to achieve \ntransparency and improve the accuracy, comprehensiveness and analysability of the \nbudgetary data, refine the presentation of the proposed programme budget, and to \nprovide complete, clear, comparable and transparent financial data to the General \nAssembly, including both gross and net requirements, and preliminary cost estimates \nthat are available for the respective year at the time of publication of the proposed \nprogramme budget, such as, inter alia, total construction and total recosting estimates, \nso as to give clarity on the real growth of the budget request to enable Member States \nto make well-informed decisions; \n \n12. Stresses that results-based budgeting and results-based management are \nmutually supportive management tools and that improved implementation of results-\nbased budgeting shall enhance both management and accountability in the Secretariat, \nand encourages the Secretary-General to continue his efforts to improve the \npresentation of the proposed programme budget and ensure that resources are clearly \n__________________ \n \n4 ST/SGB/2018/3. \n \n5 ST/SGB/2013/4 and ST/SGB/2013/4/Amend.1. \n\nQuestions relating to the proposed programme budget for 2025 \nA/RES/79/257\n \n3/12\n24-24698 \n \nlinked to a results-based budgeting framework and reflect existing mandates and the \nmeasures to achieve them; \n \n13. Requests the Secretary-General to take measures in the programme budget \nto promote a culture of effectiveness and cost-efficiency across the Secretariat, \nsimilar to the approach taken under special political missions, being cognizant of the \nimportance of optimizing the use of Member State resources; \n \n14. Also requests the Secretary-General to ensure that all activities promote \ncost-efficiency and transparency, are implemented in accordance with the United \nNations legislative framework, including the Financial Regulations and Rules, while \nmaintaining full accountability to the General Assembly, and that whenever new \nproposals lead to requests for additional resources, sufficient efforts are first made to \nmeet the new requirements using existing resources; \n \n15. Further requests the Secretary-General to ensure effective and efficient \nutilization of available resources and programme delivery by senior managers and \nprogramme managers, including through clearly defined results-based performance \nindicators and benchmarks that provide feedback to senior managers and programme \nmanagers and drive improvements on the delivery of mandates; \n \n16. Urges all Member States to fulfil their financial obligations as set out in \nthe Charter of the United Nations on time, in full and without conditions;  \n \n17. Requests the Secretary-General to make every effort to facilitate Member \nStates\u2019 payments of their contributions, including in cases when there are \ncircumstances beyond their control in making payments;  \n \n18. Stresses that full, effective and efficient mandate delivery is the overriding \nfactor in determining the Secretariat\u2019s resource requirements and its overall staffing \nstructure, with due regard to identifying efficiencies and avoiding duplication of \nefforts, including through improved coordination and cooperation among departments \nand entities;  \n \n19. Requests the Secretary-General to continue to strengthen internal controls \nin programme planning, budgeting, implementation, monitoring and evaluation, and \nreporting;  \n \n20. Regrets that despite its previous observations, general temporary \nassistance continues to be used for purposes other than those for which it is intended, \nstresses that general temporary assistance positions, not temporary posts, are the \nproper arrangement for additional support during periods of exceptional and/or peak \nworkload and the replacement of staff on parental leave or extended sick leave and \nshould be kept to an absolute minimum to meet short-term requirements, and requests \nthe Secretary-General to provide justifications in the next budget proposals for the \ncontinuation of any general temporary assistance positions exceeding 729 days since \ninitial appointment;  \n \n21. Reiterates its concern about the high number of vacancies, and requests \nthe Secretary-General to fill vacant positions expeditiously, and to conduct a review \non how to effectively utilize existing posts, including those that have been vacant for \n24 months or longer, and to report the results of the review by proposing either their \nretention, with clear justification of need, changing of post or proposing their \nabolishment, as appropriate, in his future reports;  \n \n22. Stresses the importance of using realistic and consistent vacancy rate \nassumptions when formulating post resources budget requests; \n \n23. Notes the provision of additional information to Member States through \nthe Umoja portal, and requests the Secretary-General to continue his efforts to provide \n\nA/RES/79/257 \nQuestions relating to the proposed programme budget for 2025\n \n24-24698\n4/12 \n \naccurate and precise information in this regard and further enhance this information \nwhere possible; \n \n24. Requests the Secretary-General to include data on cancelled prior-period \nobligations in the programme budget and the Umoja portal;  \n \n25. Stresses that finance serves as a foundation of and an important element \nunderpinning United Nations governance; \n \n26. Also stresses the importance of early and meaningful engagement with \nMember States to outline the implementation of the recent General Assembly \nresolutions on budgetary matters and their impact on the presentation format of the \nproposed programme budget; \n \n27. Recalls financial regulation 2.10 and rule 153 of the rules of procedure, \nand reiterates that no resolution involving expenditure shall be recommended by a \ncommittee for approval by the General Assembly unless it is accompanied by an \nestimate of expenditures prepared by the Secretary-General;  \n \n28. Also recalls its resolutions 77/262 and 78/252, notes that zero-based \nbudgeting should be applied to end the automaticity in resource proposals, further \nnotes that spending reviews should be based on uniform guidance to carry out this \nexercise, in order to improve the efficiency and effectiveness of the Organization, and \ntherefore requests the Secretary-General to create a common framework for spending \nreviews by all entities and improve the coherence of the exercise, which includes:  \n \n(a) \nReorganization of existing resources based on zero-based budgeting; \n \n(b) \nImproved workforce planning, with repurposed existing and vacant posts \nand general temporary assistance positions, as well as abolishment, where necessary;  \n \n(c) \nAn evaluation of new ways to optimize resource allocation to enable more \nefficient mandate delivery and the generation of meaningful efficiencies;  \n \n(d) \nConduct of the review in conjunction with a review of the programmatic \naspects of the entity, in adherence with the Regulations and Rules Governing \nProgramme Planning, the Programme Aspects of the Budget, the Monitoring of \nImplementation and the Methods of Evaluation;  \n \n(e) \nPresentation of the clear plan, time frame and results in a more \ncomprehensive and consolidated manner, detailing the efficiency gains and the \noperational improvements, in the proposed programme budget;  \n \n29. Decides to recost only the post resources of the proposed programme \nbudget as from 2026, pending the comprehensive review of the annual programme \nbudget cycle at the eighty-third session;  \n \n30. Reiterates its request to the Secretary-General to undertake pre-posting of \njob openings irrespective of the liquidity situation of the Organization and to \nproactively approach pre-posting of vacancies in order to be in a position to \nexpeditiously proceed to the appointment of the selected candidates and complete \nonboarding actions;  \n \n31. Decides to reduce the recosting of non-post resources by 5,500,000 United \nStates dollars; \n \n32. Also decides that the staffing table for 2025 shall be as set out in the annex \nto the present resolution; \n \n33. Further decides that a vacancy rate of 11.1 per cent for Professional staff \nand 9.1 per cent for General Service staff shall be used as a basis for the calculation \nof the budget for 2025; \n \n\nQuestions relating to the proposed programme budget for 2025 \nA/RES/79/257\n \n5/12\n24-24698 \n \n \n \nPart I \n \n \nOverall policymaking, direction and coordination \n \n \n \nSection 1 \n \n \nOverall policymaking, direction and coordination \n \n \n34. Requests the Secretary-General to explore synergies among entities under \nsection 1, Overall policymaking, direction and coordination, to enhance efficiencies \nin the effective implementation of their specific mandates, and provide an update in \nthe next proposed programme budget;  \n \n35. Reaffirms that the Office of the Special Representative of the Secretary-\nGeneral for Children and Armed Conflict should be provided with the necessary \nresources to effectively implement the mandate, including to ensure that the \nmonitoring and reporting mechanism collects and communicates accurate, objective, \nreliable and verifiable information;  \n \n \n \nSection 2 \n \n \nGeneral Assembly and Economic and Social Council affairs and \nconference management \n \n \n36. Recognizes the budgetary and operational factors influencing the provision \nof the interpretation and translation services provided by the Department for General \nAssembly and Conference Management, and encourages the Secretary-General to \nstrengthen efforts to address these challenges, and engage with Member States and \nreceive feedback on opportunities to enhance the quality and effectiveness of these \nservices, for presentation to the General Assembly at its eightieth session; \n \n \n \nPart II \n \n \nPolitical affairs \n \n \n \nSection 3 \n \n \nPolitical affairs \n \n \n37. Recalls paragraph 17 of its resolution 78/257, reiterates its request that the \nSecretary-General report to the General Assembly, on an annual basis, on the \nproposed programme budget for the Peacebuilding Account, in a format similar to the \nbudget presentation under section 35, Development Account, of the proposed \nprogramme budget, with an annex listing the proposed projects, beneficiary countries, \nbudget per country, and objectives, and also requests the Secretary-General to provide \nadditional supplementary information, such as a summary of available budgetary \ninformation, as appropriate, in the course of the sessions of the Fifth Committee; \n \n38. Also recalls paragraph 18 of its resolution 78/257, and reiterates its request \nthat the Secretary-General report annually on the implementation, performance, \nprogress and expenditure of projects funded by assessed contributions, and on the \nimplementation of the recommendations of the Board of Auditors and the Advisory \nCommittee on Administrative and Budgetary Questions; \n \n39. Encourages the Secretary-General to consider how to strengthen the \ncoordination role of the Office of the United Nations Special Coordinator for the \nMiddle East Peace Process;  \n \n40. Decides to designate the current Department of Political and \nPeacebuilding Affairs and Southern African Development Community Liaison Team \nfor Southern Africa as a Department of Political and Peacebuilding Affairs and \nSouthern African Development Community Office for Southern Africa, without \nsetting a precedent, and emphasizes the existing framework with regard to the role of \nthe Fifth Committee in approving the budget of the Organization; \n\nA/RES/79/257 \nQuestions relating to the proposed programme budget for 2025\n \n24-24698\n6/12 \n \n \n41. Encourages the Secretary-General to consider, within existing resources, \nhow to strengthen the core capacity of the Office of Counter-Terrorism, to strengthen \ncoordination across the United Nations system in fulfilling counter-terrorism \nmandates entrusted by the General Assembly under the leadership role of the Office, \nwith a view to avoiding duplication and overlapping with other entities, optimizing \nthe use of resources and delivering coherent and expert capacity-building activities \nin cooperation with Member States, and to report on issues identified and progress \nmade in addressing them, in the next programme budget submission;  \n \n42. Decides to increase resources for the United Nations Office to the African \nUnion by 250,000 dollars for the lease of two vehicles for 60 months; \n \n43. Also decides to convert the following extrabudgetary positions to regular \nbudget posts within the Countering Terrorism Section to support the Global \nProgramme on Countering Terrorist Use of Weapons:  \n \n(a) \nProgramme Management Officer (P-3) in Madrid, established in 2013; \n \n(b) \nProgramme Management Officer and Head of Unit (P-4) in Madrid, \nestablished in 2019; \n \n44. Further decides to convert one P-4 post in the Office of the Director of the \nUnited Nations Counter-Terrorism Centre from extrabudgetary to regular budget; \n \n \n \nSection 4 \n \n \nDisarmament \n \n \n45. Emphasizes that the subvention from the regular budget to the United \nNations Institute for Disarmament Research is a bridging financing mechanism to \nsupplement insufficient voluntary contributions, and therefore encourages the \nSecretary-General to redouble his efforts to seek voluntary contributions for the \nInstitute, including through broadening the donor base and holding regular \nconsultations with the key stakeholders, as well as to implement innovative \nfundraising approaches; \n \n46. Recalls paragraph II.75 of the report of the Advisory Committee, and \ndecides to establish two posts of National Professional Officers, with one each in \nLima and Kathmandu, under subprogramme 5, Regional disarmament; \n \n \n \nSection 5 \n \n \nPeacekeeping operations \n \n \n47. Takes note of paragraph II.114 of the report of the Advisory Committee; \n \n \n \nSection 6 \n \n \nPeaceful uses of outer space \n \n \n48. Takes note of paragraph II.150 of the report of the Advisory Committee; \n \n \n \nPart III \n \n \nInternational justice and law \n \n \n \nSection 7 \n \n \nInternational Court of Justice \n \n \n49. Takes note of paragraphs III.7, III.9, III.11, III.14 and III.16 of the report \nof the Advisory Committee; \n \n\nQuestions relating to the proposed programme budget for 2025 \nA/RES/79/257\n \n7/12\n24-24698 \n \n \n \nSection 8 \n \n \nLegal Affairs \n \n \n50. Takes note of paragraphs III.76, III.77, III.78, III.79 and III.81 of the report \nof the Advisory Committee; \n \n51. Decides that regular budget resources for the International, Impartial and \nIndependent Mechanism to Assist in the Investigation and Prosecution of Persons \nResponsible for the Most Serious Crimes under International Law Committed in the \nSyrian Arab Republic since March 2011 under section 8, Legal affairs, for 2025 \namount to 19,343,800 dollars before recosting; \n \n \n \nPart IV \n \n \nInternational cooperation for development \n \n \n \nSection 11 \n \n \nUnited Nations system support for the African Union\u2019s Agenda 2063: \nThe Africa We Want  \n \n \n52. Recalls that the development of Africa is an established priority of the \nUnited Nations, and reaffirms its commitment to addressing the unique needs of \nAfrica; \n \n53. Takes note of paragraph IV.58 of the report of the Advisory Committee; \n \n54. Recalls paragraph IV.70 of the report of the Advisory Committee, \nwelcomes the launch of the fellowship programme, and requests the Secretary-\nGeneral to remain proactive in seeking voluntary contributions from Member States, \nin full compliance with all relevant rules and regulations of the Organization, and to \nprovide detailed information on the matter in the context of his next progress report;  \n \n55. Notes the widening scope of cooperation between the United Nations and \nthe African Union and the increased responsibilities of the United Nations in \nsupporting Agenda 2063, and requests the Secretary-General to present initiatives, in \nthe context of programme 9, United Nations system support for the African Union\u2019s \nAgenda 2063: The Africa We Want \u2013 strategic partnership for progress towards \nimplementation, to further support the implementation of Agenda 2063;  \n \n \n \nSection 16 \n \n \nInternational drug control, crime and terrorism prevention and \ncriminal justice  \n \n \n56. Encourages the Secretary-General to consider, within existing resources, \nhow to strengthen the core capacity of the United Nations Office on Drugs and Crime \nto avoid duplication and overlap with other entities, including the Office of Counter-\nTerrorism, and to reallocate requirements accordingly, and report thereon in the next \nprogramme budget submission;  \n \n \n \nPart V \n \n \nRegional cooperation for development \n \n \n \nSection 18 \n \n \nEconomic and social development in Africa \n \n \n57. Recalls paragraph V.29 of the report of the Advisory Committee, and \nrequests the Secretary-General to explore the related options and present a business \ncase for establishing a harmonized fellowship programme, in line with existing \nregulations, rules and practices, as appropriate, across all the regional commissions \nas part of the proposed programme budget for 2026; \n \n\nA/RES/79/257 \nQuestions relating to the proposed programme budget for 2025\n \n24-24698\n8/12 \n \n \n \nSection 23 \n \n \nRegular programme of technical cooperation \n \n \n58. Recalls paragraphs V.117, V.122 and V.123 of the report of the Advisory \nCommittee, and requests that the report of the Secretary-General on strengthening the \neffectiveness of the regular programme of technical cooperation, to be presented at \nits eightieth session, reflect the following elements:  \n \n(a) \nOptions for models to enhance the coordination of the programme, \nincluding a uniform tracking system to monitor requests for assistance from Member \nStates, so as to ensure that the most appropriate entity in the Secretariat can respond \nwhile maintaining the programme\u2019s overall agility;  \n \n(b) \nThe principles and underlying criteria to be used for selecting requests for \nassistance, taking into account balance among the beneficiaries of the interventions \nfunded under the programme; \n \n(c) \nA common evaluation framework, including meaningful, measurable and \nquantifiable indicators of achievement across all implementing entities, to ensure full \ntransparency regarding the interventions and results provided by the programme;  \n \n(d) \nAn outreach plan, within existing resources, developed by the Secretary-\nGeneral, to raise awareness of the existence of the programme among Member States \nand in programme countries, including in the context of the Economic and Social \nCouncil and the Main Committees of the General Assembly and through the regional \ncommissions and their subregional offices; \n \n \n \nPart VI \n \n \nHuman rights and humanitarian affairs \n \n \n \nSection 24 \n \n \nHuman rights \n \n \n59. Recalls paragraph VI.29 of the report of the Advisory Committee, and \ndecides to redeploy one post of Chief of Service, Human Rights (D-1), to Panama \nCity; \n \n \n \nSection 27 \n \n \nHumanitarian assistance \n \n \n60. Encourages the Secretary-General to engage the Southern African \nDevelopment Community and explore options for further strengthening cooperation \nwith the secretariat of the Southern African Development Community in order to \nsupport collective efforts in tackling the recurring humanitarian challenges, including \nback-to-back cyclones, floods and droughts, as well as development challenges such \nas the destruction of crops and infrastructure faced by the region and its 16 member \ncountries on an annual basis;  \n \n \n \nPart VII \n \n \nGlobal communications \n \n \n \nSection 28 \n \n \nGlobal communications \n \n \n61. Recalls its resolution 78/252, and reiterates its request to the Secretary-\nGeneral to explore a model for meetings coverage and press releases that is based on \ntranslation from a single language and to submit the results of this study in the next \nprogramme budget submission;  \n\nQuestions relating to the proposed programme budget for 2025 \nA/RES/79/257\n \n9/12\n24-24698 \n \n \n62. Requests the Secretary-General to complete the independent and impartial \nreview of the Department of Global Communications by the end of 2025, considering \nits strategic vision, mandates, workforce and operating models, with the aim of \nmodernizing the Department and ensuring that it can communicate United Nations \nactivities and messages globally, efficiently and effectively, with due regard to its role \nin multilingualism, reiterates that the review itself should be within existing resources \nand be aimed at achieving greater efficiency gains, and also requests the Secretary-\nGeneral to provide the outcome of the review for the consideration of the General \nAssembly at the main part of its eightieth session in the context of the proposed \nprogramme budget for 2026;  \n \n \n \nPart VIII \n \n \nCommon support services \n \n \n \nSection 29A \n \n \nDepartment of Management Strategy, Policy and Compliance \n \n \n63. Recalls paragraph VIII.21 of the report of the Advisory Committee, and \ndecides to transfer the improved service delivery team to the Department of \nOperational Support; \n \n64. Also recalls paragraph VIII.19 of the report of the Advisory Committee, \nstresses that the Department of Management Strategy, Policy and Compliance and the \nDepartment of Operational Support, as the second line of defence in human resources \nand asset management, are accountable for decisions by the first line of defence under \nthe delegation of authority, and requests the Secretary-General to review the \naccountability of the first and second lines of defence so as to improve the culture of \neffective management and accountability; \n \n65. Further recalls paragraph 64 of its resolution 78/252, and requests the \nSecretary-General to merge data contained in the list of staff into the staff analysis \ndashboard in a digital and interactive format on the online Secretariat workforce portal, \nwhile ensuring that the quality and quantity of information available on the portal are \nnot less than what used to be available on the HR Insight online reporting tool;  \n \n66. Recalls paragraph 5 of its resolution 78/275 of 24 April 2024, stresses that \none additional step in grade shall be granted for each additional year of work \nexperience beyond the minimum required for appointment at step one of the relevant \ngrade, and requests the Secretary-General to revisit his guidelines for determination \nof step upon promotion, recruitment or movement to a different category accordingly, \neffective from the adoption date of resolution 78/275;  \n \n \n \nPart X \n \n \nJointly financed administrative activities and special expenses \n \n \n \nSection 31 \n \n \nJointly financed administrative activities \n \n \n67. Recalls paragraph X.7 of the report of the Advisory Committee, and stresses \nthe importance of an objective consideration of the International Civil Service \nCommission and the Joint Inspection Unit budget proposals aimed at ensuring that their \noperational and financial requirements are met and that their status as independent \nsubsidiary organs of the General Assembly and other organizations is preserved;  \n \n68. Also recalls that the budgetary procedures outlined in the statutes of the \nInternational Civil Service Commission and the Joint Inspection Unit are binding on \nall participating organizations, and welcomes the recognition by organizations \nparticipating in the cost-sharing formulas for the entities under section 31, Jointly \nfinanced administrative activities, of the General Assembly decisions on the total \nbudget for each entity so financed; \n\nA/RES/79/257 \nQuestions relating to the proposed programme budget for 2025\n \n24-24698\n10/12 \n \n \n69. Further recalls paragraph X.39 of the report of the Advisory Committee, \nand requests the Secretary-General, in his capacity as the Chair of the United Nations \nSystem Chief Executives Board for Coordination, to explore options to improve the \neffectiveness of reporting and analysis with a view to enhancing the content of the \nreport on the budgetary and financial situation of the organizations of the United \nNations system, with a focus on its analytical component; \n \n \n \nPart XI \n \n \nCapital expenditures \n \n \n \nSection 33 \n \n \nConstruction, alteration, improvement and major maintenance \n \n \n70. Decides to further reduce the resources under section 33, Construction, \nalteration, improvement and major maintenance, by 8,872,500 dollars for the projects \nat Headquarters in New York; \n \n71. Takes note of paragraph XI.27 of the report of the Advisory Committee, \nand decides not to reduce the resources for the Department of Safety and Security for \n2025; \n \n \n \nPart XII \n \n \nSafety and security \n \n \n \nSection 34 \n \n \nSafety and security  \n \n \n72. Takes note of paragraphs XII.14, XII.15, XII.16 and XII.17 of the report \nof the Advisory Committee, and approves the proposal of the Secretary-General for \nnon-post resources; \n \n73. Also takes note of paragraphs XII.20 and XII.23 of the report of the \nAdvisory Committee, and approves the Secretariat\u2019s share of jointly financed \nactivities of the United Nations security management system as proposed by the \nSecretary-General; \n \n \n \nPart XIII \n \n \nDevelopment Account \n \n \n \nSection 35 \n \n \nDevelopment Account \n \n \n74. Recalls paragraph XIII.8 of the report of the Advisory Committee, and \nrequests that the report of the Secretary-General on strengthening the effectiveness \nand impact of the Development Account, to be presented at its eightieth session, \nreflect the following elements: \n \n(a) \nTransparent selection criteria for Development Account projects that are \nbased on the needs of recipient countries; \n \n(b) \nOptions for strengthening the complementarity and interlinkage between \nthe regular programme of technical cooperation and the Development Account, \nincluding such that Member States can build upon short-term advisory services in the \nregular programme of technical cooperation and continue similar work through \nlonger-term projects funded by the Development Account; \n \n(c) \nA common evaluation framework to be used for all projects, including \nmeaningful, measurable and quantifiable indicators of achievement across all \nimplementing entities, to ensure full transparency regarding the interventions \nprovided by the Development Account; \n\nQuestions relating to the proposed programme budget for 2025 \nA/RES/79/257\n \n11/12\n24-24698 \n \n \n(d) \nAn outreach plan, within existing resources, developed by the Secretary-\nGeneral, to raise awareness of the existence of the Development Account and the \nguidelines to apply for its different tranches among Member States and in programme \ncountries, including in the context of the Economic and Social Council and the Main \nCommittees of the General Assembly and through the regional commissions and their \nsubregional offices; \n \n(e) \nOptions to increase the number of sources of funding for the Development \nAccount beyond the regular budget, including through fundraising activities to raise \nextrabudgetary resources and the possibility of establishing partnerships with relevant \nexternal stakeholders; \n \n \n \nIncome section 2 \n \n \nGeneral income \n \n \n75. Recalls paragraph IS2.4 of the report of the Advisory Committee, and \nencourages efforts by the Secretary-General to present updated information on the \nworking group on global rental practices and its work; \n \n \n \nIncome section 3 \n \n \nServices to the public \n \n \n76. Recalls paragraphs IS3.3 and IS3.4 of the report of the Advisory Committee, \nemphasizes that services to the public should be financially self-supporting, and urges \nthe Secretary-General to develop innovative options, while maintaining garage rates at \ntheir current level and not introducing any changes in the garage operations policies, to \nincrease income, avoid deficit and optimize resources, and to report on the measures \ntaken and results achieved in the next programme budget submission;  \n \n77. Requests the Secretary-General to regularly seek feedback from \ndelegations and staff on the quality of catering services provided at United Nations \nHeadquarters, including through online surveys, and regularly follow-up on the \nfeedback received; \n \n78. Decides to increase the income under income section 3, Services to the \npublic, by 2,723,700 dollars, while maintaining garage rates at their current level and \nnot introducing any changes in the garage operations policies. \n \n55th (resumed) plenary meeting \n24 December 2024 \n \n \n \nAnnex \n \n \nStaffing table for 2025 \n \n \nCategory \nNumber of posts \n(excluding special \npolitical missions) \nNumber of posts \n(special political \nmissions) \nTotal \nExpenditure sections \n \n \n \nProfessional and higher \n \n \n \nDeputy Secretary-General \n1 \n\u2013 \n1 \nUnder-Secretary-General \n38 \n18 \n56 \nAssistant Secretary-General \n36 \n18 \n54 \nD-2 \n118 \n8 \n126 \nD-1 \n316 \n51 \n367 \n\nA/RES/79/257 \nQuestions relating to the proposed programme budget for 2025\n \n24-24698\n12/12 \n \nCategory \nNumber of posts \n(excluding special \npolitical missions) \nNumber of posts \n(special political \nmissions) \nTotal \nP-5 \n954 \n186 \n1 140 \nP-4 \n1 702 \n385 \n2 087 \nP-3 \n1 635 \n358 \n1 993 \nP-2/1 \n593 \n24 \n617 \nSubtotal \n5 393 \n1 048 \n6 441 \nGeneral Service \n \n \n \nPrincipal level \n278 \n2 \n280 \nOther level \n2 311 \n44 \n2 355 \nSubtotal \n2 589 \n46 \n2 635 \nOther \n \n \n \nSecurity Service \n306 \n\u2013 \n306 \nLocal level \n1 923 \n1 572 \n3 495 \nField Service \n108 \n672 \n780 \nNational Professional Officer \n118 \n544 \n662 \nTrades and Crafts \n93 \n\u2013 \n93 \nSubtotal \n2 548 \n2 788 \n5 336 \nExpenditure sections total \n10 530 \n3 882 \n14 412 \nIncome section 3 \n \n \n \nProfessional and higher \n \n \n \nP-5 \n2 \n\u2013 \n2 \nP-4 \n4 \n\u2013 \n4 \nP-3 \n4 \n\u2013 \n4 \nP-2/1 \n3 \n\u2013 \n3 \nSubtotal \n13 \n\u2013 \n13 \nGeneral Service \n \n \n \nPrincipal level \n7 \n\u2013 \n7 \nOther level \n42 \n\u2013 \n42 \nSubtotal \n49 \n\u2013 \n49 \nOther \n \n \n \nSecurity Service \n2 \n\u2013 \n2 \nSubtotal \n2 \n\u2013 \n2 \nIncome section 3 total \n64 \n\u2013 \n64 \nTotal \n10 594 \n3 882 \n14 476 \n \n",
  "paragraphs": {
    "1": "Reaffirms rule 153 of its rules of procedure;",
    "2": "Also reaffirms the Regulations and Rules Governing Programme Planning, the Programme Aspects of the Budget, the Monitoring of Implementation and the Methods of Evaluation;4",
    "3": "Further reaffirms the Financial Regulations and Rules of the United Nations;5",
    "4": "Reaffirms its resolution 79/247 of 24 December 2024;",
    "5": "Endorses the conclusions and recommendations contained in the report of the Advisory Committee of Administrative and Budgetary Questions, subject to the provisions of the present resolution;",
    "6": "Reaffirms that the Fifth Committee is the appropriate Main Committee of the General Assembly entrusted with responsibilities for administrative and budgetary matters, and reaffirms the role of the Fifth Committee in carrying out a thorough analysis and approving human and financial resources and policies, with a view to ensuring full, effective and efficient implementation of all mandated programmes and activities and the implementation of policies in this regard;",
    "7": "Also reaffirms the established budgetary procedures and methodologies, based on its resolutions 41/213 and 42/211, and reaffirms that no changes to the budget methodology, established budgetary procedures and practices or the financial regulations may be implemented without prior review and approval by the General Assembly in accordance with established budgetary procedures;",
    "8": "Notes the Secretary-General\u2019s initiative to present a report on improving the financial situation of the Organization at the first part of the resumed seventy- ninth session;",
    "9": "Recognizes that patterns of underexpenditure across various budget lines under the ongoing liquidity challenges of the Organization can be linked to limited released allotments, and stresses that this specific type of underexpenditure should not be used to achieve budgetary savings;",
    "10": "Reiterates the need for Member States to participate fully in the budget preparation process, from its early stages and throughout the process;",
    "11": "Requests the Secretary-General to continue his efforts to achieve transparency and improve the accuracy, comprehensiveness and analysability of the budgetary data, refine the presentation of the proposed programme budget, and to provide complete, clear, comparable and transparent financial data to the General Assembly, including both gross and net requirements, and preliminary cost estimates that are available for the respective year at the time of publication of the proposed programme budget, such as, inter alia, total construction and total recosting estimates, so as to give clarity on the real growth of the budget request to enable Member States to make well-informed decisions;",
    "12": "Stresses that results-based budgeting and results-based management are mutually supportive management tools and that improved implementation of results- based budgeting shall enhance both management and accountability in the Secretariat, and encourages the Secretary-General to continue his efforts to improve the presentation of the proposed programme budget and ensure that resources are clearly __________________ 4 ST/SGB/2018/3. 5 ST/SGB/2013/4 and ST/SGB/2013/4/Amend.1. Questions relating to the proposed programme budget for 2025 A/RES/79/257 3/12 24-24698 linked to a results-based budgeting framework and reflect existing mandates and the measures to achieve them;",
    "13": "Requests the Secretary-General to take measures in the programme budget to promote a culture of effectiveness and cost-efficiency across the Secretariat, similar to the approach taken under special political missions, being cognizant of the importance of optimizing the use of Member State resources;",
    "14": "Also requests the Secretary-General to ensure that all activities promote cost-efficiency and transparency, are implemented in accordance with the United Nations legislative framework, including the Financial Regulations and Rules, while maintaining full accountability to the General Assembly, and that whenever new proposals lead to requests for additional resources, sufficient efforts are first made to meet the new requirements using existing resources;",
    "15": "Further requests the Secretary-General to ensure effective and efficient utilization of available resources and programme delivery by senior managers and programme managers, including through clearly defined results-based performance indicators and benchmarks that provide feedback to senior managers and programme managers and drive improvements on the delivery of mandates;",
    "16": "Urges all Member States to fulfil their financial obligations as set out in the Charter of the United Nations on time, in full and without conditions;",
    "17": "Requests the Secretary-General to make every effort to facilitate Member States\u2019 payments of their contributions, including in cases when there are circumstances beyond their control in making payments;",
    "18": "Stresses that full, effective and efficient mandate delivery is the overriding factor in determining the Secretariat\u2019s resource requirements and its overall staffing structure, with due regard to identifying efficiencies and avoiding duplication of efforts, including through improved coordination and cooperation among departments and entities;",
    "19": "Requests the Secretary-General to continue to strengthen internal controls in programme planning, budgeting, implementation, monitoring and evaluation, and reporting;",
    "20": "Regrets that despite its previous observations, general temporary assistance continues to be used for purposes other than those for which it is intended, stresses that general temporary assistance positions, not temporary posts, are the proper arrangement for additional support during periods of exceptional and/or peak workload and the replacement of staff on parental leave or extended sick leave and should be kept to an absolute minimum to meet short-term requirements, and requests the Secretary-General to provide justifications in the next budget proposals for the continuation of any general temporary assistance positions exceeding 729 days since initial appointment;",
    "21": "Reiterates its concern about the high number of vacancies, and requests the Secretary-General to fill vacant positions expeditiously, and to conduct a review on how to effectively utilize existing posts, including those that have been vacant for 24 months or longer, and to report the results of the review by proposing either their retention, with clear justification of need, changing of post or proposing their abolishment, as appropriate, in his future reports;",
    "22": "Stresses the importance of using realistic and consistent vacancy rate assumptions when formulating post resources budget requests;",
    "23": "Notes the provision of additional information to Member States through the Umoja portal, and requests the Secretary-General to continue his efforts to provide A/RES/79/257 Questions relating to the proposed programme budget for 2025 24-24698 4/12 accurate and precise information in this regard and further enhance this information where possible;",
    "24": "Requests the Secretary-General to include data on cancelled prior-period obligations in the programme budget and the Umoja portal;",
    "25": "Stresses that finance serves as a foundation of and an important element underpinning United Nations governance;",
    "26": "Also stresses the importance of early and meaningful engagement with Member States to outline the implementation of the recent General Assembly resolutions on budgetary matters and their impact on the presentation format of the proposed programme budget;",
    "27": "Recalls financial regulation 2.10 and rule 153 of the rules of procedure, and reiterates that no resolution involving expenditure shall be recommended by a committee for approval by the General Assembly unless it is accompanied by an estimate of expenditures prepared by the Secretary-General;",
    "28": "Also recalls its resolutions 77/262 and 78/252, notes that zero-based budgeting should be applied to end the automaticity in resource proposals, further notes that spending reviews should be based on uniform guidance to carry out this exercise, in order to improve the efficiency and effectiveness of the Organization, and therefore requests the Secretary-General to create a common framework for spending reviews by all entities and improve the coherence of the exercise, which includes: (a) Reorganization of existing resources based on zero-based budgeting; (b) Improved workforce planning, with repurposed existing and vacant posts and general temporary assistance positions, as well as abolishment, where necessary; (c) An evaluation of new ways to optimize resource allocation to enable more efficient mandate delivery and the generation of meaningful efficiencies; (d) Conduct of the review in conjunction with a review of the programmatic aspects of the entity, in adherence with the Regulations and Rules Governing Programme Planning, the Programme Aspects of the Budget, the Monitoring of Implementation and the Methods of Evaluation; (e) Presentation of the clear plan, time frame and results in a more comprehensive and consolidated manner, detailing the efficiency gains and the operational improvements, in the proposed programme budget;",
    "29": "Decides to recost only the post resources of the proposed programme budget as from 2026, pending the comprehensive review of the annual programme budget cycle at the eighty-third session;",
    "30": "Reiterates its request to the Secretary-General to undertake pre-posting of job openings irrespective of the liquidity situation of the Organization and to proactively approach pre-posting of vacancies in order to be in a position to expeditiously proceed to the appointment of the selected candidates and complete onboarding actions;",
    "31": "Decides to reduce the recosting of non-post resources by 5,500,000 United States dollars;",
    "32": "Also decides that the staffing table for 2025 shall be as set out in the annex to the present resolution;",
    "33": "Further decides that a vacancy rate of 11.1 per cent for Professional staff and 9.1 per cent for General Service staff shall be used as a basis for the calculation of the budget for 2025; Questions relating to the proposed programme budget for 2025 A/RES/79/257 5/12 24-24698 Part I Overall policymaking, direction and coordination Section 1 Overall policymaking, direction and coordination",
    "34": "Requests the Secretary-General to explore synergies among entities under section 1, Overall policymaking, direction and coordination, to enhance efficiencies in the effective implementation of their specific mandates, and provide an update in the next proposed programme budget;",
    "35": "Reaffirms that the Office of the Special Representative of the Secretary- General for Children and Armed Conflict should be provided with the necessary resources to effectively implement the mandate, including to ensure that the monitoring and reporting mechanism collects and communicates accurate, objective, reliable and verifiable information; Section 2 General Assembly and Economic and Social Council affairs and conference management",
    "36": "Recognizes the budgetary and operational factors influencing the provision of the interpretation and translation services provided by the Department for General Assembly and Conference Management, and encourages the Secretary-General to strengthen efforts to address these challenges, and engage with Member States and receive feedback on opportunities to enhance the quality and effectiveness of these services, for presentation to the General Assembly at its eightieth session; Part II Political affairs Section 3 Political affairs",
    "37": "Recalls paragraph 17 of its resolution 78/257, reiterates its request that the Secretary-General report to the General Assembly, on an annual basis, on the proposed programme budget for the Peacebuilding Account, in a format similar to the budget presentation under section 35, Development Account, of the proposed programme budget, with an annex listing the proposed projects, beneficiary countries, budget per country, and objectives, and also requests the Secretary-General to provide additional supplementary information, such as a summary of available budgetary information, as appropriate, in the course of the sessions of the Fifth Committee;",
    "38": "Also recalls paragraph 18 of its resolution 78/257, and reiterates its request that the Secretary-General report annually on the implementation, performance, progress and expenditure of projects funded by assessed contributions, and on the implementation of the recommendations of the Board of Auditors and the Advisory Committee on Administrative and Budgetary Questions;",
    "39": "Encourages the Secretary-General to consider how to strengthen the coordination role of the Office of the United Nations Special Coordinator for the Middle East Peace Process;",
    "40": "Decides to designate the current Department of Political and Peacebuilding Affairs and Southern African Development Community Liaison Team for Southern Africa as a Department of Political and Peacebuilding Affairs and Southern African Development Community Office for Southern Africa, without setting a precedent, and emphasizes the existing framework with regard to the role of the Fifth Committee in approving the budget of the Organization; A/RES/79/257 Questions relating to the proposed programme budget for 2025 24-24698 6/12",
    "41": "Encourages the Secretary-General to consider, within existing resources, how to strengthen the core capacity of the Office of Counter-Terrorism, to strengthen coordination across the United Nations system in fulfilling counter-terrorism mandates entrusted by the General Assembly under the leadership role of the Office, with a view to avoiding duplication and overlapping with other entities, optimizing the use of resources and delivering coherent and expert capacity-building activities in cooperation with Member States, and to report on issues identified and progress made in addressing them, in the next programme budget submission;",
    "42": "Decides to increase resources for the United Nations Office to the African Union by 250,000 dollars for the lease of two vehicles for 60 months;",
    "43": "Also decides to convert the following extrabudgetary positions to regular budget posts within the Countering Terrorism Section to support the Global Programme on Countering Terrorist Use of Weapons: (a) Programme Management Officer (P-3) in Madrid, established in 2013; (b) Programme Management Officer and Head of Unit (P-4) in Madrid, established in 2019;",
    "44": "Further decides to convert one P-4 post in the Office of the Director of the United Nations Counter-Terrorism Centre from extrabudgetary to regular budget; Section 4 Disarmament",
    "45": "Emphasizes that the subvention from the regular budget to the United Nations Institute for Disarmament Research is a bridging financing mechanism to supplement insufficient voluntary contributions, and therefore encourages the Secretary-General to redouble his efforts to seek voluntary contributions for the Institute, including through broadening the donor base and holding regular consultations with the key stakeholders, as well as to implement innovative fundraising approaches;",
    "46": "Recalls paragraph II.75 of the report of the Advisory Committee, and decides to establish two posts of National Professional Officers, with one each in Lima and Kathmandu, under subprogramme 5, Regional disarmament; Section 5 Peacekeeping operations",
    "47": "Takes note of paragraph II.114 of the report of the Advisory Committee; Section 6 Peaceful uses of outer space",
    "48": "Takes note of paragraph II.150 of the report of the Advisory Committee; Part III International justice and law Section 7 International Court of Justice",
    "49": "Takes note of paragraphs III.7, III.9, III.11, III.14 and III.16 of the report of the Advisory Committee; Questions relating to the proposed programme budget for 2025 A/RES/79/257 7/12 24-24698 Section 8 Legal Affairs",
    "50": "Takes note of paragraphs III.76, III.77, III.78, III.79 and III.81 of the report of the Advisory Committee;",
    "51": "Decides that regular budget resources for the International, Impartial and Independent Mechanism to Assist in the Investigation and Prosecution of Persons Responsible for the Most Serious Crimes under International Law Committed in the Syrian Arab Republic since March 2011 under section 8, Legal affairs, for 2025 amount to 19,343,800 dollars before recosting; Part IV International cooperation for development Section 11 United Nations system support for the African Union\u2019s Agenda 2063: The Africa We Want",
    "52": "Recalls that the development of Africa is an established priority of the United Nations, and reaffirms its commitment to addressing the unique needs of Africa;",
    "53": "Takes note of paragraph IV.58 of the report of the Advisory Committee;",
    "54": "Recalls paragraph IV.70 of the report of the Advisory Committee, welcomes the launch of the fellowship programme, and requests the Secretary- General to remain proactive in seeking voluntary contributions from Member States, in full compliance with all relevant rules and regulations of the Organization, and to provide detailed information on the matter in the context of his next progress report;",
    "55": "Notes the widening scope of cooperation between the United Nations and the African Union and the increased responsibilities of the United Nations in supporting Agenda 2063, and requests the Secretary-General to present initiatives, in the context of programme 9, United Nations system support for the African Union\u2019s Agenda 2063: The Africa We Want \u2013 strategic partnership for progress towards implementation, to further support the implementation of Agenda 2063; Section 16 International drug control, crime and terrorism prevention and criminal justice",
    "56": "Encourages the Secretary-General to consider, within existing resources, how to strengthen the core capacity of the United Nations Office on Drugs and Crime to avoid duplication and overlap with other entities, including the Office of Counter- Terrorism, and to reallocate requirements accordingly, and report thereon in the next programme budget submission; Part V Regional cooperation for development Section 18 Economic and social development in Africa",
    "57": "Recalls paragraph V.29 of the report of the Advisory Committee, and requests the Secretary-General to explore the related options and present a business case for establishing a harmonized fellowship programme, in line with existing regulations, rules and practices, as appropriate, across all the regional commissions as part of the proposed programme budget for 2026; A/RES/79/257 Questions relating to the proposed programme budget for 2025 24-24698 8/12 Section 23 Regular programme of technical cooperation",
    "58": "Recalls paragraphs V.117, V.122 and V.123 of the report of the Advisory Committee, and requests that the report of the Secretary-General on strengthening the effectiveness of the regular programme of technical cooperation, to be presented at its eightieth session, reflect the following elements: (a) Options for models to enhance the coordination of the programme, including a uniform tracking system to monitor requests for assistance from Member States, so as to ensure that the most appropriate entity in the Secretariat can respond while maintaining the programme\u2019s overall agility; (b) The principles and underlying criteria to be used for selecting requests for assistance, taking into account balance among the beneficiaries of the interventions funded under the programme; (c) A common evaluation framework, including meaningful, measurable and quantifiable indicators of achievement across all implementing entities, to ensure full transparency regarding the interventions and results provided by the programme; (d) An outreach plan, within existing resources, developed by the Secretary- General, to raise awareness of the existence of the programme among Member States and in programme countries, including in the context of the Economic and Social Council and the Main Committees of the General Assembly and through the regional commissions and their subregional offices; Part VI Human rights and humanitarian affairs Section 24 Human rights",
    "59": "Recalls paragraph VI.29 of the report of the Advisory Committee, and decides to redeploy one post of Chief of Service, Human Rights (D-1), to Panama City; Section 27 Humanitarian assistance",
    "60": "Encourages the Secretary-General to engage the Southern African Development Community and explore options for further strengthening cooperation with the secretariat of the Southern African Development Community in order to support collective efforts in tackling the recurring humanitarian challenges, including back-to-back cyclones, floods and droughts, as well as development challenges such as the destruction of crops and infrastructure faced by the region and its 16 member countries on an annual basis; Part VII Global communications Section 28 Global communications",
    "61": "Recalls its resolution 78/252, and reiterates its request to the Secretary- General to explore a model for meetings coverage and press releases that is based on translation from a single language and to submit the results of this study in the next programme budget submission; Questions relating to the proposed programme budget for 2025 A/RES/79/257 9/12 24-24698",
    "62": "Requests the Secretary-General to complete the independent and impartial review of the Department of Global Communications by the end of 2025, considering its strategic vision, mandates, workforce and operating models, with the aim of modernizing the Department and ensuring that it can communicate United Nations activities and messages globally, efficiently and effectively, with due regard to its role in multilingualism, reiterates that the review itself should be within existing resources and be aimed at achieving greater efficiency gains, and also requests the Secretary- General to provide the outcome of the review for the consideration of the General Assembly at the main part of its eightieth session in the context of the proposed programme budget for 2026; Part VIII Common support services Section 29A Department of Management Strategy, Policy and Compliance",
    "63": "Recalls paragraph VIII.21 of the report of the Advisory Committee, and decides to transfer the improved service delivery team to the Department of Operational Support;",
    "64": "Also recalls paragraph VIII.19 of the report of the Advisory Committee, stresses that the Department of Management Strategy, Policy and Compliance and the Department of Operational Support, as the second line of defence in human resources and asset management, are accountable for decisions by the first line of defence under the delegation of authority, and requests the Secretary-General to review the accountability of the first and second lines of defence so as to improve the culture of effective management and accountability;",
    "65": "Further recalls paragraph 64 of its resolution 78/252, and requests the Secretary-General to merge data contained in the list of staff into the staff analysis dashboard in a digital and interactive format on the online Secretariat workforce portal, while ensuring that the quality and quantity of information available on the portal are not less than what used to be available on the HR Insight online reporting tool;",
    "66": "Recalls paragraph 5 of its resolution 78/275 of 24 April 2024, stresses that one additional step in grade shall be granted for each additional year of work experience beyond the minimum required for appointment at step one of the relevant grade, and requests the Secretary-General to revisit his guidelines for determination of step upon promotion, recruitment or movement to a different category accordingly, effective from the adoption date of resolution 78/275; Part X Jointly financed administrative activities and special expenses Section 31 Jointly financed administrative activities",
    "67": "Recalls paragraph X.7 of the report of the Advisory Committee, and stresses the importance of an objective consideration of the International Civil Service Commission and the Joint Inspection Unit budget proposals aimed at ensuring that their operational and financial requirements are met and that their status as independent subsidiary organs of the General Assembly and other organizations is preserved;",
    "68": "Also recalls that the budgetary procedures outlined in the statutes of the International Civil Service Commission and the Joint Inspection Unit are binding on all participating organizations, and welcomes the recognition by organizations participating in the cost-sharing formulas for the entities under section 31, Jointly financed administrative activities, of the General Assembly decisions on the total budget for each entity so financed; A/RES/79/257 Questions relating to the proposed programme budget for 2025 24-24698 10/12",
    "69": "Further recalls paragraph X.39 of the report of the Advisory Committee, and requests the Secretary-General, in his capacity as the Chair of the United Nations System Chief Executives Board for Coordination, to explore options to improve the effectiveness of reporting and analysis with a view to enhancing the content of the report on the budgetary and financial situation of the organizations of the United Nations system, with a focus on its analytical component; Part XI Capital expenditures Section 33 Construction, alteration, improvement and major maintenance",
    "70": "Decides to further reduce the resources under section 33, Construction, alteration, improvement and major maintenance, by 8,872,500 dollars for the projects at Headquarters in New York;",
    "71": "Takes note of paragraph XI.27 of the report of the Advisory Committee, and decides not to reduce the resources for the Department of Safety and Security for 2025; Part XII Safety and security Section 34 Safety and security",
    "72": "Takes note of paragraphs XII.14, XII.15, XII.16 and XII.17 of the report of the Advisory Committee, and approves the proposal of the Secretary-General for non-post resources;",
    "73": "Also takes note of paragraphs XII.20 and XII.23 of the report of the Advisory Committee, and approves the Secretariat\u2019s share of jointly financed activities of the United Nations security management system as proposed by the Secretary-General; Part XIII Development Account Section 35 Development Account",
    "74": "Recalls paragraph XIII.8 of the report of the Advisory Committee, and requests that the report of the Secretary-General on strengthening the effectiveness and impact of the Development Account, to be presented at its eightieth session, reflect the following elements: (a) Transparent selection criteria for Development Account projects that are based on the needs of recipient countries; (b) Options for strengthening the complementarity and interlinkage between the regular programme of technical cooperation and the Development Account, including such that Member States can build upon short-term advisory services in the regular programme of technical cooperation and continue similar work through longer-term projects funded by the Development Account; (c) A common evaluation framework to be used for all projects, including meaningful, measurable and quantifiable indicators of achievement across all implementing entities, to ensure full transparency regarding the interventions provided by the Development Account; Questions relating to the proposed programme budget for 2025 A/RES/79/257 11/12 24-24698 (d) An outreach plan, within existing resources, developed by the Secretary- General, to raise awareness of the existence of the Development Account and the guidelines to apply for its different tranches among Member States and in programme countries, including in the context of the Economic and Social Council and the Main Committees of the General Assembly and through the regional commissions and their subregional offices; (e) Options to increase the number of sources of funding for the Development Account beyond the regular budget, including through fundraising activities to raise extrabudgetary resources and the possibility of establishing partnerships with relevant external stakeholders; Income section 2 General income",
    "75": "Recalls paragraph IS2.4 of the report of the Advisory Committee, and encourages efforts by the Secretary-General to present updated information on the working group on global rental practices and its work; Income section 3 Services to the public",
    "76": "Recalls paragraphs IS3.3 and IS3.4 of the report of the Advisory Committee, emphasizes that services to the public should be financially self-supporting, and urges the Secretary-General to develop innovative options, while maintaining garage rates at their current level and not introducing any changes in the garage operations policies, to increase income, avoid deficit and optimize resources, and to report on the measures taken and results achieved in the next programme budget submission;",
    "77": "Requests the Secretary-General to regularly seek feedback from delegations and staff on the quality of catering services provided at United Nations Headquarters, including through online surveys, and regularly follow-up on the feedback received;",
    "78": "Decides to increase the income under income section 3, Services to the public, by 2,723,700 dollars, while maintaining garage rates at their current level and not introducing any changes in the garage operations policies. 55th (resumed) plenary meeting 24 December 2024 Annex Staffing table for 2025 Category Number of posts (excluding special political missions) Number of posts (special political missions) Total Expenditure sections Professional and higher Deputy Secretary-General 1 \u2013 1 Under-Secretary-General 38 18 56 Assistant Secretary-General 36 18 54 D-2 118 8 126 D-1 316 51 367 A/RES/79/257 Questions relating to the proposed programme budget for 2025 24-24698 12/12 Category Number of posts (excluding special political missions) Number of posts (special political missions) Total P-5 954 186 1 140 P-4 1 702 385 2 087 P-3 1 635 358 1 993 P-2/1 593 24 617 Subtotal 5 393 1 048 6 441 General Service Principal level 278 2 280 Other level 2 311 44 2 355 Subtotal 2 589 46 2 635 Other Security Service 306 \u2013 306 Local level 1 923 1 572 3 495 Field Service 108 672 780 National Professional Officer 118 544 662 Trades and Crafts 93 \u2013 93 Subtotal 2 548 2 788 5 336 Expenditure sections total 10 530 3 882 14 412 Income section 3 Professional and higher P-5 2 \u2013 2 P-4 4 \u2013 4 P-3 4 \u2013 4 P-2/1 3 \u2013 3 Subtotal 13 \u2013 13 General Service Principal level 7 \u2013 7 Other level 42 \u2013 42 Subtotal 49 \u2013 49 Other Security Service 2 \u2013 2 Subtotal 2 \u2013 2 Income section 3 total 64 \u2013 64 Total 10 594 3 882 14 476"
  },
  "agenda_items": [
    "Item 139"
  ],
  "symbol_references": []
}