{
  "symbol": "A/RES/73/48",
  "filename": "A_RES_73_48.pdf",
  "title": "73/48. Treaty on the Prohibition of Nuclear Weapons",
  "text": "United Nations \nA/RES/73/48\n \n \nGeneral Assembly \nDistr.: General \n12 December 2018 \n \n18-21250 (E)    141218  \n*1821250* \n \n \nSeventy-third session \nAgenda item 101 (oo) \n \n \n \n \n Resolution adopted by the General Assembly \non 5 December 2018 \n \n \n \n \n[on the report of the First Committee (A/73/510 and A/73/510/Corr.1)] \n \n \n \n73/48. Treaty on the Prohibition of Nuclear Weapons  \n \n \n \nThe General Assembly, \n \nRecalling its resolution 72/31 of 4 December 2017,  \n \n1. \nWelcomes the adoption of the Treaty on the Prohibition of Nuclear \nWeapons1 on 7 July 2017; \n \n2. \nNotes that the Treaty has been open for signature at United Nations \nHeadquarters in New York since 20 September 2017; \n \n3. \nWelcomes that already 69 States had signed the Treaty and 19 States had \nratified or acceded to it as at 17 October 2018; \n \n4. \nCalls upon all States that have not yet done so to sign, ratify, accept, \napprove or accede to the Treaty at the earliest possible date; \n \n5. \nCalls upon those States in a position to do so to promote adherence to the \nTreaty through bilateral, subregional, regional and multilateral contacts, outreach and \nother means; \n \n6. \nRequests the Secretary-General, as depositary of the Treaty, to report to \nthe General Assembly at its seventy-fourth session on the status of signature and \nratification, acceptance, approval or accession of the Treaty; \n \n7. \nDecides to include in the provisional agenda of its seventy-fourth session, \nunder the item entitled \u201cGeneral and complete disarmament\u201d, the sub-item entitled \n\u201cTreaty on the Prohibition of Nuclear Weapons\u201d. \n \n45th plenary meeting  \n5 December 2018 \n \n__________________ \n \n1  A/CONF.229/2017/8. \n",
  "paragraphs": {
    "1": "Welcomes the adoption of the Treaty on the Prohibition of Nuclear Weapons1 on 7 July 2017;",
    "2": "Notes that the Treaty has been open for signature at United Nations Headquarters in New York since 20 September 2017;",
    "3": "Welcomes that already 69 States had signed the Treaty and 19 States had ratified or acceded to it as at 17 October 2018;",
    "4": "Calls upon all States that have not yet done so to sign, ratify, accept, approve or accede to the Treaty at the earliest possible date;",
    "5": "Calls upon those States in a position to do so to promote adherence to the Treaty through bilateral, subregional, regional and multilateral contacts, outreach and other means;",
    "6": "Requests the Secretary-General, as depositary of the Treaty, to report to the General Assembly at its seventy-fourth session on the status of signature and ratification, acceptance, approval or accession of the Treaty;",
    "7": "Decides to include in the provisional agenda of its seventy-fourth session, under the item entitled \u201cGeneral and complete disarmament\u201d, the sub-item entitled \u201cTreaty on the Prohibition of Nuclear Weapons\u201d. 45th plenary meeting 5 December 2018 __________________ 1 A/CONF.229/2017/8."
  },
  "agenda_items": [
    "Item 101"
  ],
  "symbol_references": []
}