{
  "symbol": "A/RES/76/263",
  "filename": "A_RES_76_263.pdf",
  "title": "76/263. Comprehensive review of the whole question of peacekeeping operations in all their aspects",
  "text": "United Nations \nA/RES/76/263\n \n \nGeneral Assembly \nDistr.: General \n12 May 2022 \n \n22-06936 (E)    160522     \n*2206936* \n \n \nSeventy-sixth session \nAgenda item 56 \nComprehensive review of the whole question of \npeacekeeping operations in all their aspects \n \n \n \n \n Resolution adopted by the General Assembly \non 10 May 2022 \n \n \n \n \n[on the report of the Special Political and Decolonization Committee  \n(Fourth Committee) (A/76/418/Add.1, para. 6)] \n \n \n 76/263. Comprehensive review of the whole question of peacekeeping \noperations in all their aspects \n \n \n \nThe General Assembly, \n \nRecalling its resolution 2006 (XIX) of 18 February 1965 and all other relevant \nresolutions, \n \nRecalling in particular its resolution 75/281 of 24 May 2021, \n \nAffirming that the efforts of the United Nations in the peaceful settlement of \ndisputes, including through its peacekeeping operations, are indispensable, \n \nConvinced of the need for the United Nations to continue to improve its \ncapabilities in the field of peacekeeping and to enhance the effective and efficient \ndeployment of its peacekeeping operations, \n \nConsidering the contribution that all States Members of the United Nations \nmake to peacekeeping, \n \nNoting the widespread interest in contributing to the work of the Special \nCommittee on Peacekeeping Operations expressed by Member States, in particular \ntroop- and police-contributing countries, \n \nBearing in mind the continuous necessity of preserving the efficiency and \nstrengthening the effectiveness of the work of the Special Committee, \n \n1. \nTakes note of the report of the Special Committee on Peacekeeping \nOperations;1 \n__________________ \n \n1 Official Records of the General Assembly, Seventy-sixth Session, Supplement No. 19 (A/76/19). \n\nA/RES/76/263 \nComprehensive review of the whole question of \npeacekeeping operations in all their aspects\n \n22-06936\n2/2 \n \n \n2. \nReiterates that those Member States that become personnel contributors to \nthe United Nations peacekeeping operations in years to come or that participate in the \nfuture in the Special Committee for three consecutive years as observers shall, upon \nrequest in writing to the Chair of the Special Committee, become members at the \nfollowing session of the Special Committee; \n \n3. \nDecides that the Special Committee, in accordance with its mandate, shall \ncontinue its efforts for a comprehensive review of the whole question of peacekeeping \noperations in all their aspects and shall review the implementation of its previous \nproposals and consider any new proposals so as to enhance the capacity of the United \nNations to fulfil its responsibilities in this field; \n \n4. \nRequests the Special Committee to submit a report on its work to the \nGeneral Assembly at its seventy-seventh session; \n \n5. \nRequests the Secretary-General to submit a report to the Special \nCommittee at its 2023 session; \n \n6. \nDecides to include in the provisional agenda of its seventy-seventh session \nthe item entitled \u201cComprehensive review of the whole question of peacekeeping \noperations in all their aspects\u201d. \n \n71st plenary meeting \n10 May 2022 \n \n",
  "paragraphs": {
    "1": "Takes note of the report of the Special Committee on Peacekeeping Operations;1 __________________ 1 Official Records of the General Assembly, Seventy-sixth Session, Supplement No. 19 (A/76/19). A/RES/76/263 Comprehensive review of the whole question of peacekeeping operations in all their aspects 22-06936 2/2",
    "2": "Reiterates that those Member States that become personnel contributors to the United Nations peacekeeping operations in years to come or that participate in the future in the Special Committee for three consecutive years as observers shall, upon request in writing to the Chair of the Special Committee, become members at the following session of the Special Committee;",
    "3": "Decides that the Special Committee, in accordance with its mandate, shall continue its efforts for a comprehensive review of the whole question of peacekeeping operations in all their aspects and shall review the implementation of its previous proposals and consider any new proposals so as to enhance the capacity of the United Nations to fulfil its responsibilities in this field;",
    "4": "Requests the Special Committee to submit a report on its work to the General Assembly at its seventy-seventh session;",
    "5": "Requests the Secretary-General to submit a report to the Special Committee at its 2023 session;",
    "6": "Decides to include in the provisional agenda of its seventy-seventh session the item entitled \u201cComprehensive review of the whole question of peacekeeping operations in all their aspects\u201d. 71st plenary meeting 10 May 2022"
  },
  "agenda_items": [
    "Item 56"
  ],
  "symbol_references": []
}