{
  "symbol": "A/RES/79/208",
  "filename": "A_RES_79_208.pdf",
  "title": "79/208. Implementation of the Convention on Biological Diversity and its contribution to sustainable development",
  "text": "United Nations \nA/RES/79/208\n \n \nGeneral Assembly \nDistr.: General \n23 December 2024 \n \n24-24354 (E)     \n*2424354* \n \n \nSeventy-ninth session \nAgenda item 18 (f) \nSustainable development: Convention on \nBiological Diversity \n \n \n \n \n Resolution adopted by the General Assembly \non 19 December 2024 \n \n \n \n \n[on the report of the Second Committee (A/79/437/Add.6, para. 6)] \n \n \n 79/208. Implementation of the Convention on Biological Diversity and its \ncontribution to sustainable development \n \n \n \nThe General Assembly, \n \nRecalling its resolution 78/155 of 19 December 2023 and its previous \nresolutions relating to the Convention on Biological Diversity,1  \n \nReaffirming the outcomes of the United Nations Conference on Environment \nand Development, including the Rio Declaration on Environment and Development 2 \nand its principles, the outcome document of the United Nations Conference on \nSustainable Development, entitled \u201cThe future we want\u201d, 3  and, inter alia, the \ncommitments concerning biodiversity contained therein, the Programme for the \nFurther Implementation of Agenda 21,4 the Johannesburg Declaration on Sustainable \nDevelopment5 and the Plan of Implementation of the World Summit on Sustainable \nDevelopment (Johannesburg Plan of Implementation) 6 and the outcome document of \nthe special event to follow up efforts made towards achieving the Millennium \nDevelopment Goals convened by the President of the General Assembly, 7  \n__________________ \n \n1 United Nations, Treaty Series, vol. 1760, No. 30619. \n \n2 Report of the United Nations Conference on Environment and Development, Rio de Janeiro, \n3\u2013 14 June 1992, vol. I, Resolutions Adopted by the Conference (United Nations publication, \nSales No. E.93.I.8 and corrigendum), resolution 1, annex I. \n \n3 Resolution 66/288, annex. \n \n4 Resolution S-19/2, annex. \n \n5 Report of the World Summit on Sustainable Development, Johannesburg, South Africa, \n26 August\u20134 September 2002 (United Nations publication, Sales No. E.03.II.A.1 and \ncorrigendum), chap. I, resolution 1, annex. \n \n6 Ibid., resolution 2, annex. \n \n7 Resolution 68/6. \n\nA/RES/79/208 \nImplementation of the Convention on Biological Diversity and its \ncontribution to sustainable development\n \n24-24354\n2/13 \n \n \nReaffirming also its resolution 70/1 of 25 September 2015, entitled \n\u201cTransforming our world: the 2030 Agenda for Sustainable Development\u201d, in which \nit adopted a comprehensive, far-reaching and people-centred set of universal and \ntransformative Sustainable Development Goals and targets, its commitment to \nworking tirelessly for the full implementation of the Agenda by 2030, its recognition \nthat eradicating poverty in all its forms and dimensions, including extreme poverty, \nis the greatest global challenge and an indispensable requirement for sustainable \ndevelopment, its commitment to achieving sustainable development in its three \ndimensions \u2013 economic, social and environmental \u2013 in a balanced and integrated \nmanner, and to building upon the achievements of the Millennium Development \nGoals and seeking to address their unfinished business,  \n \nReaffirming further its resolution 69/313 of 27 July 2015 on the Addis Ababa \nAction Agenda of the Third International Conference on Financing for Development, \nwhich is an integral part of the 2030 Agenda for Sustainable Development, supports \nand complements it, helps to contextualize its means of implementation targets with \nconcrete policies and actions, and reaffirms the strong political commitment to \naddress the challenge of financing and creating an enabling environment at all levels \nfor sustainable development in the spirit of global partnership and solidarity, \n \nReaffirming the New Urban Agenda, adopted at the United Nations Conference \non Housing and Sustainable Urban Development (Habitat III), held in Quito, Ecuador, \nfrom 17 to 20 October 2016,8 and its vision for cities and human settlements that \nprotect, conserve, restore and promote their ecosystems, water, natural habitats and \nbiodiversity and minimize their environmental impact,  \n \nReaffirming also the Paris Agreement9 and encouraging all its parties to fully \nimplement the Agreement, and parties to the United Nations Framework Convention \non Climate Change 10  that have not yet done so to deposit their instruments of \nratification, acceptance, approval or accession, where appropriate, as soon as possible,  \n \nUrging the implementation of the Paris Agreement and the agreed \nintergovernmentally negotiated outcomes and decisions of the subsequent United \nNations Climate Change Conferences,  \n \nWelcoming the convening of the twenty-eighth session of the Conference of the \nParties to the United Nations Framework Convention on Climate Change, held in \nDubai, United Arab Emirates, from 30 November to 13 December 2023, and the \ntwenty-ninth session of the Conference of the Parties to the United Nations \nFramework Convention on Climate Change, held in Baku from 11 to 22 November \n2024, and looking forward to the thirtieth session of the Conference of the Parties to \nthe United Nations Framework Convention on Climate Change, to be held in Bel\u00e9m, \nBrazil, from 10 to 21 November 2025, \n \nNoting with serious concern the findings from the Intergovernmental Panel on \nClimate Change in its special reports entitled Global Warming of 1.5\u00b0C, The Ocean and \nCryosphere in a Changing Climate and Climate Change and Land: An IPCC Special \nReport on Climate Change, Desertification, Land Degradation, Sustainable Land \nManagement, Food Security, and Greenhouse Gas Fluxes in Terrestrial Ecosystems, as \nwell as the contribution of Working Groups I, II and III and the synthesis report of the \nSixth Assessment Report of the Intergovernmental Panel on Climate Change, in which \nthe Intergovernmental Panel highlights the linkages between climate change and \nextreme weather events and slow-onset events and their negative impacts on people and \n__________________ \n \n8 Resolution 71/256, annex. \n \n9 Adopted under the UNFCCC in FCCC/CP/2015/10/Add.1, decision 1/CP.21. \n \n10 United Nations, Treaty Series, vol. 1771, No. 30822. \n\nImplementation of the Convention on Biological Diversity and its \ncontribution to sustainable development \nA/RES/79/208\n \n3/13\n24-24354 \n \nnature, and highlighting the increasing frequency and intensity of extreme weather \nevents, such as heatwaves, droughts and heavy precipitation,  \n \nNoting with profound concern the findings of the Intergovernmental Science \nPolicy Platform on Biodiversity and Ecosystem Services Global Assessment Report \non Biodiversity and Ecosystem Services,  \n \nRecalling the convening of the summit on biodiversity on 30 September 2020, \nin order to highlight the urgency of action at the highest levels in support of a global \nbiodiversity framework that contributes to the 2030 Agenda and places the global \ncommunity on a path towards realizing the 2050 Vision for Biodiversity, \u201cLiving in \nharmony with nature\u201d,  \n \nTaking note with appreciation of the interactive dialogue on Harmony with \nNature convened by the President of the General Assembly on 24 April 2023, in \ncommemoration of International Mother Earth Day,  \n \nRecalling its resolution 76/300 of 28 July 2022 on the human right to a clean, \nhealthy and sustainable environment,  \n \nRecalling also its resolutions 71/312 of 6 July 2017 and 76/296 of 21 July 2022, \nin which it endorsed the declarations adopted by the first and second United Nations \nConferences to Support the Implementation of Sustainable Development Goal 14: \nConserve and sustainably use the oceans, seas and marine resources for sustainable \ndevelopment, demonstrating the collective will to take action to conserve and \nsustainably use our oceans, seas and marine resources for sustainable development, \nas well as to halt and reverse the decline in the health and productivity of our ocean \nand its ecosystems and to protect and restore its resilience and ecological integrity, \nrecognizing the important contributions of the dialogues and voluntary commitments \nmade in the context of those Conferences to the effective and timely implementation \nof Sustainable Development Goal 14, and looking forward to the 2025 United Nations \nConference to Support the Implementation of Sustainable Development Goal 14: \nConserve and sustainably use the oceans, seas and marine resources for sustainable \ndevelopment, to be co-hosted by Costa Rica and France and held in Nice, France, \nfrom 9 to 13 June 2025,  \n \nTaking note of voluntary initiatives to support efforts to achieve the conservation \nand protection of at least 30 per cent of the world\u2019s land and ocean by 2030, which \ncan further contribute to halt and reverse biodiversity loss,  \n \nRecalling its resolution 73/284 of 1 March 2019, in which it proclaimed 2021\u2013\n2030 the United Nations Decade on Ecosystem Restoration, with the aim of supporting \nand scaling up efforts to prevent, halt and reverse the degradation of ecosystems \nworldwide and raise awareness of the importance of successful ecosystem restoration,  \n \nRecalling also the United Nations strategic plan for forests 2017\u20132030,11 and \nrecognizing that forests are home to an estimated 80 per cent of all terrestrial species \nand that forests, including boreal, temperate and tropical, contribute substantially to \nclimate change mitigation and adaptation and to the conservation of biodiversity,  \n \nRecalling further the fifth edition of the Global Biodiversity Outlook, in which \nit was highlighted that none of the 20 Aichi Biodiversity Targets were fully achieved, \nalthough six were partially achieved (targets 9, 11, 16, 17, 19 and 20), and \nemphasizing the need for support and investments at all levels to enhance efforts for \nthe implementation of the goals and targets of the Kunming-Montreal Global \nBiodiversity Framework,  \n__________________ \n \n11 See resolution 71/285. \n\nA/RES/79/208 \nImplementation of the Convention on Biological Diversity and its \ncontribution to sustainable development\n \n24-24354\n4/13 \n \n \nNoting with concern that the Sustainable Development Goal targets with a 2020 \ndeadline have not been fully achieved,  \n \nRecognizing that the coronavirus disease (COVID-19) pandemic and other \npandemics underscore the need to conserve, restore and sustainably use biodiversity, \non land and below water, to reduce the risk of the economic, social and environmental \nimpacts of disasters and future pandemic outbreaks, many of which are exacerbated \nby biodiversity loss, the increased scale of poaching and the illegal use of and trade in \nwildlife and wildlife products, desertification, land degradation and drought, climate \nchange and plastic pollution, including in the marine environment, and emphasizing \nthe need to support and invest at all levels, to enhance efforts to build resilience, to \nreduce the likelihood of zoonotic infections and to avoid or minimize adverse impacts \non biological diversity in order to achieve the objectives of the Convention on \nBiological Diversity and to achieve a sustainable, resilient and inclusive recovery,  \n \nRecalling with appreciation the intergovernmentally agreed outcomes of the \nmeetings of the Conference of the Parties to the Convention on Biological Diversity \nand the meetings of the Conference of the Parties serving as the Meetings of the \nParties to the Protocols to the Convention,  \n \nRecalling that the objectives of the Convention on Biological Diversity, to be \npursued in accordance with its relevant provisions, are the conservation of biological \ndiversity, the sustainable use of its components and the fair and equitable sharing of \nthe benefits arising out of the utilization of genetic resources, including by \nappropriate access to genetic resources, by appropriate transfer of relevant \ntechnologies, taking into account all rights over those resources and to technologies, \nand by appropriate funding,  \n \nRecognizing that the achievement of the three objectives of the Convention on \nBiological Diversity is crucial for sustainable development, poverty eradication, food \nsecurity and the improvement of human health and well-being, and a major factor \nunderpinning the achievement of the Sustainable Development Goals and other \ninternationally agreed development goals,  \n \nReaffirming that, in accordance with the Charter of the United Nations, States \nhave the sovereign right to exploit their own resources pursuant to their own \nenvironmental policies and the responsibility to ensure that activities within their \njurisdiction or control do not cause damage to the environment of other States or of \nareas beyond the limits of national jurisdiction,  \n \nReaffirming also the intrinsic value of biological diversity, as well as the \necological, genetic, social, economic, scientific, educational, cultural, recreational \nand aesthetic values of biological diversity, and its critical role in maintaining \necosystems that provide essential functions and services, which are critical \nfoundations for sustainable development, and human health and well-being,  \n \nEncouraging parties, other Governments and relevant organizations to integrate \nnature-based solutions, ecosystem-based approaches and other management and \nconservation approaches, in line with resolution 5/5 of 7 March 2022 of the United \nNations Environment Assembly,12 to climate change adaptation and mitigation and \ndisaster risk reduction into their strategic planning, as appropriate, across sectors,  \n \nRecognizing that the traditional knowledge, innovations and practices of \nIndigenous Peoples and local communities that are relevant to the Convention make \na key contribution to the conservation and sustainable use of biodiversity and that \ntheir wider application can support social well-being and sustainable livelihoods,  \n__________________ \n \n12 UNEP/EA.5/Res.5. \n\nImplementation of the Convention on Biological Diversity and its \ncontribution to sustainable development \nA/RES/79/208\n \n5/13\n24-24354 \n \n \nRecalling the decisions adopted by the Conference of the Parties to the Convention \non Biological Diversity on article 8 (j) and related provisions, as well as the work done \nby the Ad Hoc Open-ended Intersessional Working Group on Article 8 (j) and Related \nProvisions of the Convention on Biological Diversity,  \n \nRecalling also the United Nations Declaration on the Rights of Indigenous \nPeoples13 and the outcome document of the high-level plenary meeting of the General \nAssembly known as the World Conference on Indigenous Peoples, 14 \n \nRecognizing the vital role that women play in the conservation and sustainable \nuse of biological diversity, and reaffirming the need for their full, equal, effective and \nmeaningful participation at all levels of policymaking and implementation for the \nconservation and sustainable use of biological diversity, as well as ecosystem \nrestoration, \n \nRecognizing also the important role of other biodiversity-related multilateral \nenvironmental agreements, regional agreements and initiatives in contributing to the \nconservation and sustainable use of biodiversity,  \n \nRecognizing further the important role of the Convention on International Trade \nin Endangered Species of Wild Fauna and Flora 15 in contributing to the conservation \nand sustainable use of biodiversity and in ensuring that no species entering into \ninternational trade is threatened with extinction, recognizing also the economic, social \nand environmental impacts of poaching and trafficking in wildlife,  \n \nRecalling the convening of the 2023 United Nations Conference on the Midterm \nComprehensive Review of the Implementation of the Objectives of the International \nDecade for Action, \u201cWater for Sustainable Development\u201d, 2018\u20132028, and looking \nforward to the 2026 United Nations Water Conference to Accelerate the \nImplementation of Sustainable Development Goal 6: Ensure availability and \nsustainable management of water and sanitation for all, to be co-hosted by Senegal \nand the United Arab Emirates and held in the United Arab Emirates from 2 to \n4 December 2026,  \n \nRecognizing the importance of the outcomes of the sixth session of the United \nNations Environment Assembly, held in Nairobi from 26 February to 1 March 2024, \nand looking forward to the seventh session of the United Nations Environment \nAssembly, to be held in Nairobi from 8 to 12 December 2025,  \n \nWelcoming the decision by the United Nations Environment Assembly at its \nresumed fifth session, in resolution 5/14 of 2 March 2022, 16  to convene an \nintergovernmental negotiating committee to develop an international legally binding \ninstrument on plastic pollution, including in the marine environment, and welcoming \nalso the decisions taken by the Environment Assembly at its resumed fifth session to \nstrengthen global action on the sound management of chemicals and waste and to \nprevent pollution, in line with Environment Assembly resolutions 5/2, 5/7 and 5/8 of \n2 March 2022,17 \n \nRecognizing the importance of the outcomes of the fifteenth session of the \nConference of the Parties of the United Nations Convention to Combat Desertification \nin Those Countries Experiencing Serious Drought and/or Desertification, Particularly \nin Africa, held in Abidjan, C\u00f4te d\u2019Ivoire, from 9 to 20 May 2022, and looking forward \nto the sixteenth session of the Conference of the Parties to the United Nations \n__________________ \n \n13 Resolution 61/295, annex. \n \n14 Resolution 69/2. \n \n15 United Nations, Treaty Series, vol. 993, No. 14537. \n \n16 UNEP/EA.5/Res.14. \n \n17 UNEP/EA.5/Res.2, UNEP/EA.5/Res.7 and UNEP/EA.5/Res.8. \n\nA/RES/79/208 \nImplementation of the Convention on Biological Diversity and its \ncontribution to sustainable development\n \n24-24354\n6/13 \n \nConvention to Combat Desertification in Those Countries Experiencing Serious \nDrought and/or Desertification, Particularly in Africa, to be held in Riyadh from 2 to \n13 December 2024, under the theme \u201cOur land, our future\u201d,  \n \nNoting the adoption by the Conference of the Parties to the Convention on \nBiological Diversity, at its tenth meeting, of the Nagoya Protocol on Access to \nGenetic Resources and the Fair and Equitable Sharing of Benefits Arising from Their \nUtilization to the Convention on Biological Diversity,18 the objective of which is the \nfair and equitable sharing of the benefits arising from the utilization of genetic \nresources, including by appropriate access to genetic resources and by appropriate \ntransfer of relevant technologies, taking into account all rights over those resources \nand to technologies, and by appropriate funding, and acknowledging the role of access \nto genetic resources and equitable benefit-sharing arising from their utilization in \ncontributing to the conservation and sustainable use of biological diversity, poverty \neradication and environmental sustainability, and thereby to the achievement of \nsustainable development,  \n \nNoting also that 195 States and 1 regional economic integration organization are \nparties to the Convention and that 141 States and 1 regional economic integration \norganization are parties to the Nagoya Protocol, noting further that 172 States and \n1 regional economic integration organization are parties to the Cartagena Protocol on \nBiosafety to the Convention on Biological Diversity 19  and that 53 States and \n1 regional economic integration organization are parties to the Nagoya-Kuala Lumpur \nSupplementary Protocol on Liability and Redress to the Cartagena Protocol on \nBiosafety, 20  and recalling the entry into force of the Nagoya-Kuala Lumpur \nSupplementary Protocol on 5 March 2018,  \n \nTaking note with appreciation of the initiative launched at the fourteenth \nmeeting of the Conference of the Parties to the Convention to promote a coherent \napproach between the United Nations Framework Convention on Climate Change, \nthe Convention on Biological Diversity and the United Nations Convention to \nCombat Desertification in Those Countries Experiencing Serious Drought and/or \nDesertification, Particularly in Africa21 (the Rio conventions) to address biodiversity \nloss, climate change and land and ecosystem degradation,  \n \nStressing that adequate, predictable and easily accessible financial resources \nfrom all sources will be key to place the global community on a path towards realizing \nthe 2050 Vision for Biodiversity of living in harmony with nature,  \n \nReiterating the pledge that no one will be left behind, reaffirming the \nrecognition that the dignity of the human person is fundamental, and the wish to see \nthe Goals and targets met for all nations and peoples and for all segments of society, \nand recommitting to endeavour to reach the furthest behind first,  \n \n1. \nTakes note of the report of the Executive Secretary of the Convention on \nBiological Diversity;22  \n \n2. \nNotes the recent appointment of the new Executive Secretary of the \nConvention on Biological Diversity, and expresses its support for her tenure;  \n \n3. \nWelcomes the convening of the sixteenth meeting of the Conference of the \nParties to the Convention on Biological Diversity, as well as the Meetings of the \n__________________ \n \n18 United Nations Environment Programme, document UNEP/CBD/COP/10/27, annex, decision X/1. \n \n19 United Nations, Treaty Series, vol. 2226, No. 30619. \n \n20 See United Nations Environment Programme, document UNEP/CBD/BS/COP-MOP/5/17, annex, \ndecision BS-V/11. \n \n21 United Nations, Treaty Series, vol. 1954, No. 33480. \n \n22 A/79/273, sect. III. \n\nImplementation of the Convention on Biological Diversity and its \ncontribution to sustainable development \nA/RES/79/208\n \n7/13\n24-24354 \n \nParties to the Protocols to the Convention, held in Cali, Colombia, from 21 October \nto 1 November 2024, under the theme \u201cPeace with nature\u201d, takes note of its adopted \ndecisions, and looks forward to the seventeenth meeting of the Conference of the \nParties and the meetings of the Conference of the Parties serving as the Meetings of \nthe Parties to the Protocols to the Convention, to be held in Yerevan in 2026;  \n \n4. \nAlso welcomes the Kunming-Montreal Global Biodiversity Framework to \ncontribute to the 2030 Agenda for Sustainable Development,23 to the 2030 mission to \nhalt and reverse biodiversity loss by 2030 and to place the global community on a \npath towards realizing the 2050 Vision for Biodiversity, and urges parties and invites \nother Governments, with the support of United Nations entities and the participation \nof all other stakeholders, to ensure the early, inclusive and effective implementation \nof the Framework and all other decisions adopted by the parties;  \n \n5. \nCalls for the provision and mobilization of new and additional means of \nimplementation to support the full implementation of the Convention on Biological \nDiversity, and emphasizes the importance of urgently increasing the mobilization of \nfinancial resources from all sources, domestic and international, public and private, \nwith a view to closing the biodiversity financing gap and making adequate and \npredictable resources available in a timely manner for the effective implementation \nof the Kunming-Montreal Global Biodiversity Framework;  \n \n6. \nWelcomes the adoption by the Conference of the Parties to the Convention \nat its fifteenth meeting of the strategy for resource mobilization for the Kunming-\nMontreal Global Biodiversity Framework in support of the achievement of the three \nobjectives of the Convention;  \n \n7. \nNotes with concern that, on some issues, no decisions were adopted at the \nsixteenth meeting of the Conference of the Parties to the Convention on Biological \nDiversity, including on resource mobilization, technical updates and additions to the \nmonitoring framework for the Kunming-Montreal Global Biodiversity Framework, \nand mechanisms for planning, monitoring and reporting and review, and urges parties \nto the Convention to promptly take decisions on these issues;  \n \n8. \nEmphasizes that the successful implementation of the Kunming-Montreal \nGlobal Biodiversity Framework requires responsibility and transparency, which will \nbe supported by effective mechanisms for planning, monitoring, reporting and review, \nincluding through revising or updating national biodiversity strategies and action \nplans, in alignment with the Framework, its goals and its targets, in line with decision \n15/6 of 19 December 2022 adopted at the fifteenth meeting of the Conference of the \nParties;24  \n \n9. \nRequests the continuation of efforts made by the secretariat of the \nConvention, parties to the Convention and the Global Environment Facility, as the \nfinancial mechanism of the Convention, in conjunction with United Nations funds \nand programmes and the specialized agencies, as well as other entities, in organizing \ncapacity-building activities to support countries in the updating of national \nbiodiversity strategies and action plans, with a view to enhancing capacity and \naddressing the need for human, technical and financial resources to implement the \nConvention and the Kunming-Montreal Global Biodiversity Framework, in particular \nfor developing countries;  \n \n10. Welcomes the establishment by the Global Environment Facility of the \nGlobal Biodiversity Framework Fund to support the implementation of the Kunming-\nMontreal Global Biodiversity Framework; \n__________________ \n \n23 Resolution 70/1. \n \n24 United Nations Environment Programme, document CBD/COP/15/17, decision 15/6. \n\nA/RES/79/208 \nImplementation of the Convention on Biological Diversity and its \ncontribution to sustainable development\n \n24-24354\n8/13 \n \n \n11. Calls for continued capitalization and timely operationalization of the \nGlobal Biodiversity Framework Fund commensurate with the targets of the \nFramework, from all sources, including, inter alia, international financial resources \nfrom developed countries, philanthropic organizations and the private sector, and to \nprogress towards implementation as soon as possible;  \n \n12. Acknowledges decision 16/2 of 1 November 2024 on the modalities for \noperationalizing the multilateral mechanism for the fair and equitable sharing of \nbenefits from the use of digital sequence information on genetic resources, including \na global fund (referred to as the Cali Fund), adopted at the sixteenth meeting of the \nConference of the Parties to the Convention on Biological Diversity; \n \n13. Also acknowledges the important roles and contributions of Indigenous \nPeoples and local communities as custodians of biodiversity and as partners in its \nconservation, restoration and sustainable use, stresses that the implementation of the \nKunming-Montreal Global Biodiversity Framework must ensure that the rights, \nknowledge, including traditional knowledge associated with biodiversity, innovations, \nworld views, values and practices of Indigenous Peoples and local communities are \nrespected, and documented and preserved with their free, prior and informed consent,25 \nincluding through their full and effective participation in decision-making, in \naccordance with relevant national legislation, international instruments, including the \nUnited Nations Declaration on the Rights of Indigenous Peoples, and human rights \nlaw, and takes note with appreciation of the goal of providing up to 20 per cent of the \nprogramming share of the Global Biodiversity Framework Fund by 2030 to support \naction by Indigenous Peoples and local communities for the conservation, restoration, \nsustainable use and management of biodiversity;  \n \n14. Welcomes decision 16/6 of 1 November 2024 entitled \u201cRole of people of \nAfrican descent, comprising collectives embodying traditional lifestyles, in the \nimplementation of the Convention on Biological Diversity\u201d, adopted at the sixteenth \nmeeting of the Conference of the Parties to the Convention on Biological Diversity;  \n \n15. Also welcomes the political declaration adopted by the high-level political \nforum on sustainable development convened under the auspices of the General \nAssembly (Sustainable Development Goals Summit),26 held in New York on 18 and \n19 September 2023, and urges timely action to ensure its full implementation;  \n \n16. Urges parties to the Convention to ensure the coherence and \ncomplementarity of the Kunming-Montreal Global Biodiversity Framework with \nother existing or upcoming international processes, in particular with regard to the \n2030 Agenda, the Paris Agreement and other related processes, frameworks and \nstrategies, and reiterates the invitation to the other multilateral environmental \nagreements, including biodiversity-related conventions and the Rio conventions, \nrelevant international organizations and their programmes, and other relevant \nprocesses to actively participate in their implementation;  \n \n17. Encourages support for the Sharm el-Sheikh to Kunming Action Agenda \nfor Nature and People, which is aimed at collecting, coordinating and celebrating \nactions in support of biodiversity conservation and its sustainable use, encourages all \nrelevant stakeholders, including Indigenous Peoples and local communities and the \nprivate sector, to consider developing biodiversity commitments, and invites relevant \nagencies, funds and programmes of the United Nations system and other relevant \n__________________ \n \n25 In this framework, free, prior and informed consent refers to the tripartite terminology of \u201cprior \nand informed consent\u201d or \u201cfree, prior and informed consent\u201d or \u201capproval and involvement\u201d.  \n \n26 Resolution 78/1. \n\nImplementation of the Convention on Biological Diversity and its \ncontribution to sustainable development \nA/RES/79/208\n \n9/13\n24-24354 \n \ninstitutions and intergovernmental organizations, where relevant, to support the \nimplementation of the Action Agenda;  \n \n18. Notes that the COVID-19 pandemic has exacerbated pre-existing \ninequalities and challenges for the implementation of the Convention and further \nhighlighted that the loss and degradation of biodiversity increases the risk of zoonotic \ndisease spillover from wildlife to people and urges parties to the Convention and all \nother relevant stakeholders to continue to mainstream biodiversity into COVID-19 \nrecovery plans and in plans aimed at reducing the risk of future pandemics, \nemphasizes the importance of a One Health approach and other holistic approaches \nthat deliver multiple benefits to the health and well-being of people and planet, that \nwould further strengthen the capacity to address biodiversity loss, prevent and \nrespond to the emergence of diseases, including zoonotic infections, and future \npandemics, and contribute to reducing the adverse impacts of climate change, calls \nfor transformative actions from all relevant stakeholders and adequate and sufficient \nmeans of implementation, particularly for developing countries, to ensure the full \nimplementation of the Convention to halt and reverse biodiversity loss, and welcomes \nthe financial commitments and initiatives that have been announced from \ngovernments, organizations and the private sector that contribute to biodiversity \nconservation, restoration and sustainable use and maintain the political momentum \nfor the implementation of the Kunming-Montreal Global Biodiversity Framework;  \n \n19. Notes with concern the limited progress made in the implementation of the \nthree objectives of the Convention, namely, the conservation of biological diversity, \nthe sustainable use of its components and the fair and equitable sharing of the benefits \narising out of the utilization of genetic resources, as well the limited progress made \nin the implementation of the Nagoya Protocol on Access to Genetic Resources and \nthe Fair and Equitable Sharing of Benefits Arising from Their Utilization, noting the \n10-year anniversary of its entry into force on 12 October 2024;  \n \n20. Notes the limited progress made in mainstreaming article 8 (j) of the \nConvention and related provisions into various areas of work under the Convention, \ntakes note with appreciation of decisions 15/10 of 10 December 202227 and 16/4 of \nthe Conference of the Parties to the Convention to develop and adopt a new \nprogramme of work on article 8 (j) and other provisions of the Convention related to \nIndigenous Peoples and local communities to 2030 aligned with the Kunming-\nMontreal Global Biodiversity Framework, with the full and effective participation of \nIndigenous Peoples and local communities, and in this regard invites the secretariat \nof the Convention, through the Secretary-General, to report on the progress made by \nthe Ad Hoc Open-ended Intersessional Working Group on Article 8 (j) and Related \nProvisions when reporting on the implementation of the present resolution to the \nGeneral Assembly;  \n \n21. Welcomes the decision to establish the subsidiary body on article 8 (j) and \nother provisions of the Convention on Biological Diversity, and encourages parties, \nother Governments and relevant organizations to provide additional support to \nrepresentatives of Indigenous Peoples and local communities, to participate \neffectively in its meetings;  \n \n22. Encourages the respective parties, in close collaboration with the relevant \nstakeholders, to take concrete measures towards achieving and coherently and \neffectively implementing the objectives of the Convention and its Protocols, and calls \nupon parties and stakeholders to strengthen international cooperation measures for \nthe fulfilment of obligations contained in the Convention and its protocols, including \n__________________ \n \n27 United Nations Environment Programme, document CBD/COP/15/17, decision 15/10. \n\nA/RES/79/208 \nImplementation of the Convention on Biological Diversity and its \ncontribution to sustainable development\n \n24-24354\n10/13 \n \nthrough comprehensively addressing at all levels the difficulties that may impede \ntheir implementation;  \n \n23. Highlights the importance of parties raising high-level political \nengagement for the achievement of the objectives of the Convention and the \nKunming-Montreal Global Biodiversity Framework adopted at the fifteenth session \nof the Conference of the Parties, and the related Goals and targets of the 2030 Agenda;  \n \n24. Invites all parties, relevant departments of the Secretariat, the specialized \nagencies, funds and programmes of the United Nations system and the regional \ncommissions to continue to contribute to the achievement of the objectives of the \nConvention;  \n \n25. Notes the important role of the United Nations Environment Management \nGroup in enhancing inter-agency coordination to support the implementation of the \nKunming-Montreal Global Biodiversity Framework;  \n \n26. Stresses the importance of mainstreaming biodiversity across government \nand society for achieving the objectives of the Convention, as well as the mission, \nvision, goals and targets of the Kunming-Montreal Global Biodiversity Framework \nadopted at the fifteenth session of the Conference of the Parties, and urges all relevant \nstakeholders to mainstream biodiversity in all relevant sectors;  \n \n27. Calls upon Governments and all stakeholders to take appropriate measures \nto mainstream consideration of the socioeconomic impacts and benefits of the \nconservation and sustainable use of biodiversity and its components, as well as \necosystems that provide essential services, into relevant programmes and policies at \nall levels, in accordance with national legislation, circumstances and priorities; \n \n28. \nStresses the importance of mainstreaming biodiversity in the implementation \nof the 2030 Agenda as part of national implementation plans for the Sustainable \nDevelopment Goals, in particular all biodiversity-related Goals and targets;  \n \n29. Recognizes that integrating biodiversity considerations into sectoral and \ncross-sectoral policies, plans and programmes at all levels is critical for harnessing \nthe benefits of enhanced synergies and policy coherence;  \n \n30. Welcomes the decisions of the parties to the Convention to better \nmainstream biodiversity and to take specific actions tailored to national needs and \ncircumstances, and in line with other relevant international agreements, including in \nkey sectors, such as agriculture, forestry, fisheries and tourism, as well as health, \nenergy, mining, infrastructure, manufacturing and processing sectors, which are \ncrucial for addressing biodiversity loss, bearing in mind the impact of these sectors \non biodiversity;  \n \n31. Recalls its resolution 77/321 of 1 August 2023 entitled \u201cAgreement under \nthe United Nations Convention on the Law of the Sea on the Conservation and \nSustainable Use of Marine Biological Diversity of Areas beyond National Jurisdiction\u201d; \n \n32. Emphasizes the importance of ending illegal, unreported and unregulated \nfishing, and welcomes the Agreement on Fisheries Subsidies reached at the Twelfth \nMinisterial Conference of the World Trade Organization; \n \n33. Notes the critical role of biodiversity and ecosystem functions and services \nfor climate change adaptation, mitigation and disaster risk reduction, including by \nadding resilience to fragile ecosystems and making them less vulnerable, and that \ncontinued climate change will have predominantly adverse and often irreversible \nimpacts on many ecosystems and their functions and services, with significant \nnegative economic, social and cultural consequences;  \n\nImplementation of the Convention on Biological Diversity and its \ncontribution to sustainable development \nA/RES/79/208\n \n11/13\n24-24354 \n \n \n34. Urges the parties to the Convention to facilitate the transfer of technology \non mutually agreed terms for the effective implementation of the Convention in \naccordance with article 16 and other relevant provisions of the Convention, and in \nthis regard welcomes the decision to establish an informal advisory group on technical \nand scientific cooperation, to provide strategic advice on practical measures, tools \nand opportunities to promote and facilitate technical and scientific cooperation in \naccordance with the terms of reference contained in annex III to decision 15/8 of \n19 December 2022 of the Conference of the Parties to the Convention;  28 \n \n35. Urges parties and invites other Governments and relevant organizations to \nrecognize the important role of, and to promote, science, technology and innovation \nin supporting the implementation of the goals and targets of the Kunming-Montreal \nGlobal Biodiversity Framework towards achieving the 2050 Vision for Biodiversity \nof living in harmony with nature;  \n \n36. Recalls decision 15/11 of 19 December 202229 of the Conference of the \nParties to the Convention, entitled \u201cGender Plan of Action\u201d, which recognizes the \nimportance of advancing efforts to achieve gender equality and the empowerment of \nall women and girls and of supporting and advancing gender mainstreaming and \ngender-responsive implementation of the Kunming-Montreal Global Biodiversity \nFramework, and encourages parties to promote the mainstreaming of a gender \nperspective in developing, implementing and revising their national, and where \nappropriate, regional and subnational biodiversity strategies and action plans and \nequivalent instruments in implementing the three objectives of the Convention, and \nalso recognizes the need to enhance cooperation on capacity-building in order to \nsupport parties in this process;  \n \n37. Invites countries that have not yet done so to ratify or accede to the \nConvention;  \n \n38. Invites parties to the Convention to ratify or accede to the Nagoya \nProtocol, and invites the Executive Secretary of the Convention and the Global \nEnvironment Facility, within its mandate as the financial mechanism of the \nConvention, in collaboration with relevant organizations, to continue to support \ncapacity-building and development activities to support the ratification and \nimplementation of the Protocol;  \n \n39. Also invites parties to the Convention to consider, as appropriate, ratifying \nor acceding to the Cartagena Protocol;  \n \n40. Invites parties to the Cartagena Protocol to consider, as appropriate, \nratifying or acceding to the Nagoya-Kuala Lumpur Supplementary Protocol on \nLiability and Redress to the Cartagena Protocol on Biosafety;  \n \n41. Stresses the urgent need to halt the global decline of biodiversity, which is \nunprecedented in human history, including its main indirect and direct drivers, in \nparticular changes in land and sea use, direct exploitation of organisms, climate \nchange, pollution and invasion of alien species;  \n \n42. Notes the findings of the Intergovernmental Science-Policy Platform on \nBiodiversity and Ecosystem Services in its assessment report on the diverse values \nand valuation of nature, and stresses that achieving a sustainable and just future \nrequires institutions that enable a recognition and integration of the diverse values of \nnature and nature\u2019s contributions to people, and that the transformative change needed \nto address the global biodiversity crisis relies on shifting away from predominant \n__________________ \n \n28 Ibid., decision 15/8. \n \n29 Ibid., decision 15/11. \n\nA/RES/79/208 \nImplementation of the Convention on Biological Diversity and its \ncontribution to sustainable development\n \n24-24354\n12/13 \n \nvalues that currently overemphasize short-term and individual material gains to \nnurturing sustainability-aligned values across society;  \n \n43. Takes note of the Intergovernmental Science-Policy Platform on \nBiodiversity and Ecosystem Services assessment reports on the sustainable use of \nwild species and on invasive alien species and their control, and stresses that the \nimpacts of invasive alien species are increasing rapidly and are predicted to continue \nrising in the future, whereas they can be prevented and mitigated through effective \nmanagement, with closer collaboration across sectors and countries;  \n \n44. \nNotes that increasing investments in nature-based solutions, ecosystem-\nbased approaches and other management and conservation approaches, in line with \nresolution 5/5 of the United Nations Environment Assembly, has the potential to cost-\neffectively support biodiversity conservation, restoration and its sustainable use, to help \nadvance climate mitigation and adaptation and to reduce adverse impacts of climate \nchange and to slow, halt and even reverse some aspects of biodiversity and ecosystem \nloss, and therefore invites all relevant stakeholders to consider the opportunities it \npresents;  \n \n45. Stresses the importance of engaging Indigenous Peoples and local \ncommunities, women, youth, civil society, local governments and authorities, \nacademia, the business and financial sectors and other relevant stakeholders to \nsupport action towards the implementation of the Kunming-Montreal Global \nBiodiversity Framework, the 2050 Vision for Biodiversity and the three objectives of \nthe Convention, and invites them to align their practices more explicitly with the \nobjectives of the Convention, including through partnerships, in accordance with \nnational legislation, circumstances and priorities;  \n \n46. Encourages the private sector, in particular business and financial \ninstitutions, to progressively reduce negative impacts on biodiversity, increase \npositive impacts, reduce biodiversity-related risks to business and financial \ninstitutions, and promote actions to ensure sustainable patterns of production, in this \nregard stresses the importance of the work of the Global Partnership for Business and \nBiodiversity, and notes other related and complementary initiatives;  \n \n47. Notes the ongoing work of the Joint Liaison Group of the secretariats and \noffices of the relevant subsidiary bodies of the Convention on Biological Diversity, \nthe Convention to Combat Desertification and the United Nations Framework \nConvention on Climate Change and the Liaison Group of Biodiversity-related \nConventions, acknowledges the importance of improving coherence in the \nimplementation of those conventions, recognizes the importance of enhancing \nsynergies among the biodiversity-related conventions and agreements, without \nprejudice to their specific objectives, in this regard notes the contribution of the \nUnited Nations Environment Assembly, as reflected in its resolution 2/17 of 27 May \n2016,30 and the outcomes of its fourth session, held in Nairobi from 11 to 15 March \n2019,31 in particular its ministerial declaration, and its resolution 6/4 of 1 March \n2024, 32 and encourages the conferences of the parties to the biodiversity-related \nmultilateral environmental agreements to consider strengthening efforts in this \nregard, taking into account relevant experiences and bearing in mind their respective \nindependent legal status and mandates;  \n \n48. Reaffirms the commitment at the very heart of the 2030 Agenda to leave \nno one behind and commit to taking more tangible steps to support people in \n__________________ \n \n30 See Official Records of the General Assembly, Seventy-first Session, Supplement No. 25 \n(A/71/25), annex. \n \n31 Ibid., Seventy-fourth Session, Supplement No. 25 (A/74/25), annex I. \n \n32 UNEP/EA.6/Res.4. \n\nImplementation of the Convention on Biological Diversity and its \ncontribution to sustainable development \nA/RES/79/208\n \n13/13\n24-24354 \n \nvulnerable situations and the most vulnerable countries and to reach the furthest \nbehind first;  \n \n49. Requests the Secretary-General to submit to the General Assembly, at its \neightieth session, a report on the implementation of the present resolution, progress \nin the implementation of the Convention on Biological Diversity and the Kunming-\nMontreal Global Biodiversity Framework, and decides to include in the provisional \nagenda of its eightieth session, under the item entitled \u201cSustainable development\u201d, \nthe sub-item entitled \u201cConvention on Biological Diversity\u201d. \n \n54th plenary meeting \n19 December 2024 \n \n",
  "paragraphs": {
    "1": "Takes note of the report of the Executive Secretary of the Convention on Biological Diversity;22",
    "2": "Notes the recent appointment of the new Executive Secretary of the Convention on Biological Diversity, and expresses its support for her tenure;",
    "3": "Welcomes the convening of the sixteenth meeting of the Conference of the Parties to the Convention on Biological Diversity, as well as the Meetings of the __________________ 18 United Nations Environment Programme, document UNEP/CBD/COP/10/27, annex, decision X/1. 19 United Nations, Treaty Series, vol. 2226, No. 30619. 20 See United Nations Environment Programme, document UNEP/CBD/BS/COP-MOP/5/17, annex, decision BS-V/11. 21 United Nations, Treaty Series, vol. 1954, No. 33480. 22 A/79/273, sect. III. Implementation of the Convention on Biological Diversity and its contribution to sustainable development A/RES/79/208 7/13 24-24354 Parties to the Protocols to the Convention, held in Cali, Colombia, from 21 October to 1 November 2024, under the theme \u201cPeace with nature\u201d, takes note of its adopted decisions, and looks forward to the seventeenth meeting of the Conference of the Parties and the meetings of the Conference of the Parties serving as the Meetings of the Parties to the Protocols to the Convention, to be held in Yerevan in 2026;",
    "4": "Also welcomes the Kunming-Montreal Global Biodiversity Framework to contribute to the 2030 Agenda for Sustainable Development,23 to the 2030 mission to halt and reverse biodiversity loss by 2030 and to place the global community on a path towards realizing the 2050 Vision for Biodiversity, and urges parties and invites other Governments, with the support of United Nations entities and the participation of all other stakeholders, to ensure the early, inclusive and effective implementation of the Framework and all other decisions adopted by the parties;",
    "5": "Calls for the provision and mobilization of new and additional means of implementation to support the full implementation of the Convention on Biological Diversity, and emphasizes the importance of urgently increasing the mobilization of financial resources from all sources, domestic and international, public and private, with a view to closing the biodiversity financing gap and making adequate and predictable resources available in a timely manner for the effective implementation of the Kunming-Montreal Global Biodiversity Framework;",
    "6": "Welcomes the adoption by the Conference of the Parties to the Convention at its fifteenth meeting of the strategy for resource mobilization for the Kunming- Montreal Global Biodiversity Framework in support of the achievement of the three objectives of the Convention;",
    "7": "Notes with concern that, on some issues, no decisions were adopted at the sixteenth meeting of the Conference of the Parties to the Convention on Biological Diversity, including on resource mobilization, technical updates and additions to the monitoring framework for the Kunming-Montreal Global Biodiversity Framework, and mechanisms for planning, monitoring and reporting and review, and urges parties to the Convention to promptly take decisions on these issues;",
    "8": "Emphasizes that the successful implementation of the Kunming-Montreal Global Biodiversity Framework requires responsibility and transparency, which will be supported by effective mechanisms for planning, monitoring, reporting and review, including through revising or updating national biodiversity strategies and action plans, in alignment with the Framework, its goals and its targets, in line with decision 15/6 of 19 December 2022 adopted at the fifteenth meeting of the Conference of the Parties;24",
    "9": "Requests the continuation of efforts made by the secretariat of the Convention, parties to the Convention and the Global Environment Facility, as the financial mechanism of the Convention, in conjunction with United Nations funds and programmes and the specialized agencies, as well as other entities, in organizing capacity-building activities to support countries in the updating of national biodiversity strategies and action plans, with a view to enhancing capacity and addressing the need for human, technical and financial resources to implement the Convention and the Kunming-Montreal Global Biodiversity Framework, in particular for developing countries;",
    "10": "Welcomes the establishment by the Global Environment Facility of the Global Biodiversity Framework Fund to support the implementation of the Kunming- Montreal Global Biodiversity Framework; __________________ 23 Resolution 70/1. 24 United Nations Environment Programme, document CBD/COP/15/17, decision 15/6. A/RES/79/208 Implementation of the Convention on Biological Diversity and its contribution to sustainable development 24-24354 8/13",
    "11": "Calls for continued capitalization and timely operationalization of the Global Biodiversity Framework Fund commensurate with the targets of the Framework, from all sources, including, inter alia, international financial resources from developed countries, philanthropic organizations and the private sector, and to progress towards implementation as soon as possible;",
    "12": "Acknowledges decision 16/2 of 1 November 2024 on the modalities for operationalizing the multilateral mechanism for the fair and equitable sharing of benefits from the use of digital sequence information on genetic resources, including a global fund (referred to as the Cali Fund), adopted at the sixteenth meeting of the Conference of the Parties to the Convention on Biological Diversity;",
    "13": "Also acknowledges the important roles and contributions of Indigenous Peoples and local communities as custodians of biodiversity and as partners in its conservation, restoration and sustainable use, stresses that the implementation of the Kunming-Montreal Global Biodiversity Framework must ensure that the rights, knowledge, including traditional knowledge associated with biodiversity, innovations, world views, values and practices of Indigenous Peoples and local communities are respected, and documented and preserved with their free, prior and informed consent,25 including through their full and effective participation in decision-making, in accordance with relevant national legislation, international instruments, including the United Nations Declaration on the Rights of Indigenous Peoples, and human rights law, and takes note with appreciation of the goal of providing up to 20 per cent of the programming share of the Global Biodiversity Framework Fund by 2030 to support action by Indigenous Peoples and local communities for the conservation, restoration, sustainable use and management of biodiversity;",
    "14": "Welcomes decision 16/6 of 1 November 2024 entitled \u201cRole of people of African descent, comprising collectives embodying traditional lifestyles, in the implementation of the Convention on Biological Diversity\u201d, adopted at the sixteenth meeting of the Conference of the Parties to the Convention on Biological Diversity;",
    "15": "Also welcomes the political declaration adopted by the high-level political forum on sustainable development convened under the auspices of the General Assembly (Sustainable Development Goals Summit),26 held in New York on 18 and 19 September 2023, and urges timely action to ensure its full implementation;",
    "16": "Urges parties to the Convention to ensure the coherence and complementarity of the Kunming-Montreal Global Biodiversity Framework with other existing or upcoming international processes, in particular with regard to the 2030 Agenda, the Paris Agreement and other related processes, frameworks and strategies, and reiterates the invitation to the other multilateral environmental agreements, including biodiversity-related conventions and the Rio conventions, relevant international organizations and their programmes, and other relevant processes to actively participate in their implementation;",
    "17": "Encourages support for the Sharm el-Sheikh to Kunming Action Agenda for Nature and People, which is aimed at collecting, coordinating and celebrating actions in support of biodiversity conservation and its sustainable use, encourages all relevant stakeholders, including Indigenous Peoples and local communities and the private sector, to consider developing biodiversity commitments, and invites relevant agencies, funds and programmes of the United Nations system and other relevant __________________ 25 In this framework, free, prior and informed consent refers to the tripartite terminology of \u201cprior and informed consent\u201d or \u201cfree, prior and informed consent\u201d or \u201capproval and involvement\u201d. 26 Resolution 78/1. Implementation of the Convention on Biological Diversity and its contribution to sustainable development A/RES/79/208 9/13 24-24354 institutions and intergovernmental organizations, where relevant, to support the implementation of the Action Agenda;",
    "18": "Notes that the COVID-19 pandemic has exacerbated pre-existing inequalities and challenges for the implementation of the Convention and further highlighted that the loss and degradation of biodiversity increases the risk of zoonotic disease spillover from wildlife to people and urges parties to the Convention and all other relevant stakeholders to continue to mainstream biodiversity into COVID-19 recovery plans and in plans aimed at reducing the risk of future pandemics, emphasizes the importance of a One Health approach and other holistic approaches that deliver multiple benefits to the health and well-being of people and planet, that would further strengthen the capacity to address biodiversity loss, prevent and respond to the emergence of diseases, including zoonotic infections, and future pandemics, and contribute to reducing the adverse impacts of climate change, calls for transformative actions from all relevant stakeholders and adequate and sufficient means of implementation, particularly for developing countries, to ensure the full implementation of the Convention to halt and reverse biodiversity loss, and welcomes the financial commitments and initiatives that have been announced from governments, organizations and the private sector that contribute to biodiversity conservation, restoration and sustainable use and maintain the political momentum for the implementation of the Kunming-Montreal Global Biodiversity Framework;",
    "19": "Notes with concern the limited progress made in the implementation of the three objectives of the Convention, namely, the conservation of biological diversity, the sustainable use of its components and the fair and equitable sharing of the benefits arising out of the utilization of genetic resources, as well the limited progress made in the implementation of the Nagoya Protocol on Access to Genetic Resources and the Fair and Equitable Sharing of Benefits Arising from Their Utilization, noting the 10-year anniversary of its entry into force on 12 October 2024;",
    "20": "Notes the limited progress made in mainstreaming article 8 (j) of the Convention and related provisions into various areas of work under the Convention, takes note with appreciation of decisions 15/10 of 10 December 202227 and 16/4 of the Conference of the Parties to the Convention to develop and adopt a new programme of work on article 8 (j) and other provisions of the Convention related to Indigenous Peoples and local communities to 2030 aligned with the Kunming- Montreal Global Biodiversity Framework, with the full and effective participation of Indigenous Peoples and local communities, and in this regard invites the secretariat of the Convention, through the Secretary-General, to report on the progress made by the Ad Hoc Open-ended Intersessional Working Group on Article 8 (j) and Related Provisions when reporting on the implementation of the present resolution to the General Assembly;",
    "21": "Welcomes the decision to establish the subsidiary body on article 8 (j) and other provisions of the Convention on Biological Diversity, and encourages parties, other Governments and relevant organizations to provide additional support to representatives of Indigenous Peoples and local communities, to participate effectively in its meetings;",
    "22": "Encourages the respective parties, in close collaboration with the relevant stakeholders, to take concrete measures towards achieving and coherently and effectively implementing the objectives of the Convention and its Protocols, and calls upon parties and stakeholders to strengthen international cooperation measures for the fulfilment of obligations contained in the Convention and its protocols, including __________________ 27 United Nations Environment Programme, document CBD/COP/15/17, decision 15/10. A/RES/79/208 Implementation of the Convention on Biological Diversity and its contribution to sustainable development 24-24354 10/13 through comprehensively addressing at all levels the difficulties that may impede their implementation;",
    "23": "Highlights the importance of parties raising high-level political engagement for the achievement of the objectives of the Convention and the Kunming-Montreal Global Biodiversity Framework adopted at the fifteenth session of the Conference of the Parties, and the related Goals and targets of the 2030 Agenda;",
    "24": "Invites all parties, relevant departments of the Secretariat, the specialized agencies, funds and programmes of the United Nations system and the regional commissions to continue to contribute to the achievement of the objectives of the Convention;",
    "25": "Notes the important role of the United Nations Environment Management Group in enhancing inter-agency coordination to support the implementation of the Kunming-Montreal Global Biodiversity Framework;",
    "26": "Stresses the importance of mainstreaming biodiversity across government and society for achieving the objectives of the Convention, as well as the mission, vision, goals and targets of the Kunming-Montreal Global Biodiversity Framework adopted at the fifteenth session of the Conference of the Parties, and urges all relevant stakeholders to mainstream biodiversity in all relevant sectors;",
    "27": "Calls upon Governments and all stakeholders to take appropriate measures to mainstream consideration of the socioeconomic impacts and benefits of the conservation and sustainable use of biodiversity and its components, as well as ecosystems that provide essential services, into relevant programmes and policies at all levels, in accordance with national legislation, circumstances and priorities;",
    "28": "Stresses the importance of mainstreaming biodiversity in the implementation of the 2030 Agenda as part of national implementation plans for the Sustainable Development Goals, in particular all biodiversity-related Goals and targets;",
    "29": "Recognizes that integrating biodiversity considerations into sectoral and cross-sectoral policies, plans and programmes at all levels is critical for harnessing the benefits of enhanced synergies and policy coherence;",
    "30": "Welcomes the decisions of the parties to the Convention to better mainstream biodiversity and to take specific actions tailored to national needs and circumstances, and in line with other relevant international agreements, including in key sectors, such as agriculture, forestry, fisheries and tourism, as well as health, energy, mining, infrastructure, manufacturing and processing sectors, which are crucial for addressing biodiversity loss, bearing in mind the impact of these sectors on biodiversity;",
    "31": "Recalls its resolution 77/321 of 1 August 2023 entitled \u201cAgreement under the United Nations Convention on the Law of the Sea on the Conservation and Sustainable Use of Marine Biological Diversity of Areas beyond National Jurisdiction\u201d;",
    "32": "Emphasizes the importance of ending illegal, unreported and unregulated fishing, and welcomes the Agreement on Fisheries Subsidies reached at the Twelfth Ministerial Conference of the World Trade Organization;",
    "33": "Notes the critical role of biodiversity and ecosystem functions and services for climate change adaptation, mitigation and disaster risk reduction, including by adding resilience to fragile ecosystems and making them less vulnerable, and that continued climate change will have predominantly adverse and often irreversible impacts on many ecosystems and their functions and services, with significant negative economic, social and cultural consequences; Implementation of the Convention on Biological Diversity and its contribution to sustainable development A/RES/79/208 11/13 24-24354",
    "34": "Urges the parties to the Convention to facilitate the transfer of technology on mutually agreed terms for the effective implementation of the Convention in accordance with article 16 and other relevant provisions of the Convention, and in this regard welcomes the decision to establish an informal advisory group on technical and scientific cooperation, to provide strategic advice on practical measures, tools and opportunities to promote and facilitate technical and scientific cooperation in accordance with the terms of reference contained in annex III to decision 15/8 of 19 December 2022 of the Conference of the Parties to the Convention; 28",
    "35": "Urges parties and invites other Governments and relevant organizations to recognize the important role of, and to promote, science, technology and innovation in supporting the implementation of the goals and targets of the Kunming-Montreal Global Biodiversity Framework towards achieving the 2050 Vision for Biodiversity of living in harmony with nature;",
    "36": "Recalls decision 15/11 of 19 December 202229 of the Conference of the Parties to the Convention, entitled \u201cGender Plan of Action\u201d, which recognizes the importance of advancing efforts to achieve gender equality and the empowerment of all women and girls and of supporting and advancing gender mainstreaming and gender-responsive implementation of the Kunming-Montreal Global Biodiversity Framework, and encourages parties to promote the mainstreaming of a gender perspective in developing, implementing and revising their national, and where appropriate, regional and subnational biodiversity strategies and action plans and equivalent instruments in implementing the three objectives of the Convention, and also recognizes the need to enhance cooperation on capacity-building in order to support parties in this process;",
    "37": "Invites countries that have not yet done so to ratify or accede to the Convention;",
    "38": "Invites parties to the Convention to ratify or accede to the Nagoya Protocol, and invites the Executive Secretary of the Convention and the Global Environment Facility, within its mandate as the financial mechanism of the Convention, in collaboration with relevant organizations, to continue to support capacity-building and development activities to support the ratification and implementation of the Protocol;",
    "39": "Also invites parties to the Convention to consider, as appropriate, ratifying or acceding to the Cartagena Protocol;",
    "40": "Invites parties to the Cartagena Protocol to consider, as appropriate, ratifying or acceding to the Nagoya-Kuala Lumpur Supplementary Protocol on Liability and Redress to the Cartagena Protocol on Biosafety;",
    "41": "Stresses the urgent need to halt the global decline of biodiversity, which is unprecedented in human history, including its main indirect and direct drivers, in particular changes in land and sea use, direct exploitation of organisms, climate change, pollution and invasion of alien species;",
    "42": "Notes the findings of the Intergovernmental Science-Policy Platform on Biodiversity and Ecosystem Services in its assessment report on the diverse values and valuation of nature, and stresses that achieving a sustainable and just future requires institutions that enable a recognition and integration of the diverse values of nature and nature\u2019s contributions to people, and that the transformative change needed to address the global biodiversity crisis relies on shifting away from predominant __________________ 28 Ibid., decision 15/8. 29 Ibid., decision 15/11. A/RES/79/208 Implementation of the Convention on Biological Diversity and its contribution to sustainable development 24-24354 12/13 values that currently overemphasize short-term and individual material gains to nurturing sustainability-aligned values across society;",
    "43": "Takes note of the Intergovernmental Science-Policy Platform on Biodiversity and Ecosystem Services assessment reports on the sustainable use of wild species and on invasive alien species and their control, and stresses that the impacts of invasive alien species are increasing rapidly and are predicted to continue rising in the future, whereas they can be prevented and mitigated through effective management, with closer collaboration across sectors and countries;",
    "44": "Notes that increasing investments in nature-based solutions, ecosystem- based approaches and other management and conservation approaches, in line with resolution 5/5 of the United Nations Environment Assembly, has the potential to cost- effectively support biodiversity conservation, restoration and its sustainable use, to help advance climate mitigation and adaptation and to reduce adverse impacts of climate change and to slow, halt and even reverse some aspects of biodiversity and ecosystem loss, and therefore invites all relevant stakeholders to consider the opportunities it presents;",
    "45": "Stresses the importance of engaging Indigenous Peoples and local communities, women, youth, civil society, local governments and authorities, academia, the business and financial sectors and other relevant stakeholders to support action towards the implementation of the Kunming-Montreal Global Biodiversity Framework, the 2050 Vision for Biodiversity and the three objectives of the Convention, and invites them to align their practices more explicitly with the objectives of the Convention, including through partnerships, in accordance with national legislation, circumstances and priorities;",
    "46": "Encourages the private sector, in particular business and financial institutions, to progressively reduce negative impacts on biodiversity, increase positive impacts, reduce biodiversity-related risks to business and financial institutions, and promote actions to ensure sustainable patterns of production, in this regard stresses the importance of the work of the Global Partnership for Business and Biodiversity, and notes other related and complementary initiatives;",
    "47": "Notes the ongoing work of the Joint Liaison Group of the secretariats and offices of the relevant subsidiary bodies of the Convention on Biological Diversity, the Convention to Combat Desertification and the United Nations Framework Convention on Climate Change and the Liaison Group of Biodiversity-related Conventions, acknowledges the importance of improving coherence in the implementation of those conventions, recognizes the importance of enhancing synergies among the biodiversity-related conventions and agreements, without prejudice to their specific objectives, in this regard notes the contribution of the United Nations Environment Assembly, as reflected in its resolution 2/17 of 27 May 2016,30 and the outcomes of its fourth session, held in Nairobi from 11 to 15 March 2019,31 in particular its ministerial declaration, and its resolution 6/4 of 1 March 2024, 32 and encourages the conferences of the parties to the biodiversity-related multilateral environmental agreements to consider strengthening efforts in this regard, taking into account relevant experiences and bearing in mind their respective independent legal status and mandates;",
    "48": "Reaffirms the commitment at the very heart of the 2030 Agenda to leave no one behind and commit to taking more tangible steps to support people in __________________ 30 See Official Records of the General Assembly, Seventy-first Session, Supplement No. 25 (A/71/25), annex. 31 Ibid., Seventy-fourth Session, Supplement No. 25 (A/74/25), annex I. 32 UNEP/EA.6/Res.4. Implementation of the Convention on Biological Diversity and its contribution to sustainable development A/RES/79/208 13/13 24-24354 vulnerable situations and the most vulnerable countries and to reach the furthest behind first;",
    "49": "Requests the Secretary-General to submit to the General Assembly, at its eightieth session, a report on the implementation of the present resolution, progress in the implementation of the Convention on Biological Diversity and the Kunming- Montreal Global Biodiversity Framework, and decides to include in the provisional agenda of its eightieth session, under the item entitled \u201cSustainable development\u201d, the sub-item entitled \u201cConvention on Biological Diversity\u201d. 54th plenary meeting 19 December 2024"
  },
  "agenda_items": [
    "Item 18"
  ],
  "symbol_references": []
}