{
  "symbol": "A/RES/78/123",
  "filename": "A_RES_78_123.pdf",
  "title": "78/123. International Day of Potato",
  "text": "United Nations \nA/RES/78/123\n \n \nGeneral Assembly \nDistr.: General \n13 December 2023 \n \n23-25275 (E)    211223     \n*2325275* \n \n \nSeventy-eighth session \nAgenda item 13 \nIntegrated and coordinated implementation of and \nfollow-up to the outcomes of the major United Nations \nconferences and summits in the economic, social and \nrelated fields \n \n \n \nResolution adopted by the General Assembly \non 8 December 2023 \n \n \n[without reference to a Main Committee (A/78/L.16)] \n \n \n 78/123. International Day of Potato \n \n \n \nThe General Assembly, \n \nReaffirming its resolution 70/1 of 25 September 2015, entitled \u201cTransforming \nour world: the 2030 Agenda for Sustainable Development\u201d, in which it adopted a \ncomprehensive, far-reaching and people-centred set of universal and transformative \nSustainable Development Goals and targets, its commitment to working tirelessly for \nthe full implementation of the Agenda by 2030, its recognition that eradicating \npoverty in all its forms and dimensions, including extreme poverty, is the greatest \nglobal challenge and an indispensable requirement for sustainable development, its \ncommitment to achieving sustainable development in its three dimensions \u2013 \neconomic, social and environmental \u2013 in a balanced and integrated manner, and to \nbuilding upon the achievements of the Millennium Development Goals and seeking \nto address their unfinished business,  \n \nReaffirming also its resolutions 53/199 of 15 December 1998 and 61/185 of \n20 December 2006 on the proclamation of international years, and Economic and \nSocial Council resolution 1980/67 of 25 July 1980 on international years and \nanniversaries, in particular paragraphs 1 to 10 of the annex thereto on the agreed \ncriteria for the proclamation of international years, as well as paragraphs 13 and 14, \nin which it is stated that an international year should not be proclaimed before the \nbasic arrangements for its organization and financing have been made,  \n \nWelcoming resolution 3/2023 of 7 July 2023, entitled \u201cInternational Day of the \nPotato\u201d, adopted by the Conference of the Food and Agriculture Organization of the \nUnited Nations at its forty-third session,1 \n__________________ \n \n1  Food and Agriculture Organization of the United Nations, document C 2023/REP, appendix C. \n\nA/RES/78/123 \nInternational Day of Potato\n \n23-25275\n2/2 \n \n \nRecalling that the International Year of the Potato in 2008 has contributed to \nraising awareness of the role of the potato in agriculture, the economy and world food \nsecurity,  \n \nRecognizing that Andean Indigenous Peoples, through their traditional knowledge \nand practices of living well, in harmony with nature, have originated, diversified, \nmaintained, controlled, protected and preserved the potato in its natural state, including \nits many varieties and landraces, as food for present and future generations,  \n \nRecognizing also that the potato represents one of the most important \ncontributions of the Andean region to the entire world, as it is one of the five main \nfood crops consumed in the world, contributing to food security,  \n \nRecognizing further that small-scale and family farming production of the \npotato, particularly by rural farmers, including women farmers, supports efforts to \nreduce hunger, malnutrition and poverty, and achieve food security, and relies on and \ncontributes greatly to the conservation and sustainable use of biodiversity,  \n \nRecognizing the decisive importance of this tuber crop for agricultural \ndevelopment, from the phase of pre-production, production, marketing, added value \nand promotion of consumption, highlighting the conservation and sustainable use of \nbiodiversity, food security and nutrition, and standard-setting,  \n \nStressing the need to raise awareness of the multiple nutritional, economic, \nenvironmental and cultural values of the potato and its contribution as an invaluable \nfood resource and as a generator of income for rural families and producers, with a \nview to implementing the 2030 Agenda for Sustainable Development and achieving \nits Sustainable Development Goals,  \n \nTrusting that the observance of an international day will create a comprehensive \nplatform to assess the problems and dynamics of sustainable potato production to \ntransform agrifood systems,  \n \n1. \nDecides to designate 30 May as the International Day of Potato; \n \n2. \nInvites all Member States, organizations of the United Nations system, \nother international and regional organizations and other relevant stakeholders, \nincluding civil society, Indigenous Peoples, the private sector and academia, as well \nas schools, to observe the International Day, as appropriate, through activities aimed \nat raising awareness of the importance of the potato and its economic, social and \nenvironmental impact on food security and nutrition and ecosystem functions, and to \nshare best practices in this regard;  \n \n3. \nInvites the Food and Agriculture Organization of the United Nations to \nfacilitate the observance of the International Day, mindful of the provisions contained \nin the annex to Economic and Social Council resolution 1980/67;  \n \n4. \nStresses that the costs of all the activities that may arise from the \nimplementation of the present resolution should be met through voluntary \ncontributions, including from the private sector;  \n \n5. \nInvites all relevant stakeholders to contribute to and support the \nInternational Day;  \n \n6. \nRequests the Secretary-General to bring the present resolution to the \nattention of all Member States, the organizations of the United Nations system and \nother relevant stakeholders, including civil society, Indigenous Peoples, the private \nsector and academia, for appropriate observance. \n \n47th plenary meeting \n8 December 2023 \n",
  "paragraphs": {
    "1": "Decides to designate 30 May as the International Day of Potato;",
    "2": "Invites all Member States, organizations of the United Nations system, other international and regional organizations and other relevant stakeholders, including civil society, Indigenous Peoples, the private sector and academia, as well as schools, to observe the International Day, as appropriate, through activities aimed at raising awareness of the importance of the potato and its economic, social and environmental impact on food security and nutrition and ecosystem functions, and to share best practices in this regard;",
    "3": "Invites the Food and Agriculture Organization of the United Nations to facilitate the observance of the International Day, mindful of the provisions contained in the annex to Economic and Social Council resolution 1980/67;",
    "4": "Stresses that the costs of all the activities that may arise from the implementation of the present resolution should be met through voluntary contributions, including from the private sector;",
    "5": "Invites all relevant stakeholders to contribute to and support the International Day;",
    "6": "Requests the Secretary-General to bring the present resolution to the attention of all Member States, the organizations of the United Nations system and other relevant stakeholders, including civil society, Indigenous Peoples, the private sector and academia, for appropriate observance."
  },
  "agenda_items": [
    "Item 13"
  ],
  "symbol_references": [
    "A/78/L.16"
  ]
}