{
  "symbol": "A/RES/79/327",
  "filename": "A_RES_79_327.pdf",
  "title": "79/327. Revitalization of the work of the General Assembly",
  "text": "United Nations \nA/RES/79/327 \n \n \nGeneral Assembly \nDistr.: General \n5 September 2025 \n \n25-14294 (E) \n*2514294* \n \n \nSeventy-ninth session \nAgenda item 121 \nRevitalization of the work of the General Assembly \n \n \n \n \n Resolution adopted by the General Assembly \non 5 September 2025 \n \n \n \n \n[without reference to a Main Committee (A/79/995, para. 45)] \n \n \n 79/327. Revitalization of the work of the General Assembly \n \n \n \nThe General Assembly,  \n \nReaffirming its resolution 77/335 of 1 September 2023 and all previous \nresolutions relating to the revitalization of the work of the General Assembly, and \nemphasizing the importance of achieving full implementation of mandates given by \nMember States, \n \nReaffirming also the central position of the General Assembly as the chief \ndeliberative, policymaking and representative organ of the United Nations, as \naffirmed in the sixth preambular paragraph of its resolution 69/321 of 11 September \n2015 and recalled in its resolution 79/1 of 22 September 2024, without prejudice to \nthe functions and powers of United Nations organs provided for in the Charter of the \nUnited Nations and having due regard to its competences, functions and powers, as \nset out in Chapter IV of the Charter, \n \nNoting with appreciation all successive resolutions since the adoption of \ndecision 45/461 on 16 September 1991, aimed at identifying ways to further enhance \nthe role, authority, effectiveness and efficiency of the General Assembly, demonstrating \nthe value of a dedicated agenda item focusing on the revitalization of the work of the \nGeneral Assembly, \n \nWelcoming the efforts of the Secretary-General to strengthen the United Nations \nto keep pace with a changing world and to make it fit for the present and future \nchallenges, as acknowledged in its resolution 79/318 of 18 July 2025, and recognizing \nthe potential of the UN80 Initiative to strengthen the impact of the United Nations \nand enhance its agility, responsiveness and resilience, in a holistic and integrated \napproach, and address the issue of duplicative efforts and ensure effective and \nefficient mandate delivery across all three pillars of the work of the United Nations, \n \nMindful of the importance of the rules of procedure of the General Assembly, \nwhich continue to guide its work, \n\nA/RES/79/327 \nRevitalization of the work of the General Assembly\n \n25-14294\n2/9 \n \n \nRecalling that multilingualism, a core value of the Organization, contributes to \nthe achievement of the purposes of the United Nations, as set out in Article 1 of the \nCharter, recognizing the need to continue to make efforts to ensure that multilingualism, \nas a fundamental value of the Organization, is not undermined, and recalling that \nmultilingualism is considered in a dedicated resolution, most recently adopted by \nconsensus as resolution 78/330 of 6 September 2024, \n \n \n \nRole and authority of the General Assembly \n \n \n1. \nRecognizes the functions, powers and role of the General Assembly in \nmatters related to the maintenance of international peace and security as articulated \nin Articles 10, 11, 12 and 35 of the Charter of the United Nations, without prejudice \nto the functions and powers of the Security Council set out in Article 24, in particular \nby taking action in accordance with the Charter, and emphasizes the importance of \ncontinuing to strengthen the relationship between the Security Council and the \nGeneral Assembly, including as stipulated in resolution 79/1; \n \n2. \nCalls for greater coordination, in accordance with their respective \nmandates, between the General Assembly, the Security Council and the Economic and \nSocial Council, in order to avoid duplication between and align the agendas of these \nbodies, and encourages the Presidents of the respective bodies to continue to hold \nregular meetings to that end;  \n \n3. \nReaffirms the need to reinforce synergy, coherence and complementarity \nbetween the agendas of the General Assembly and its Main Committees and the \nEconomic and Social Council and its subsidiary bodies, welcomes regular interaction \nand enhanced coordination between the Presidents of the General Assembly, the \nEconomic and Social Council and the Security Council, and encourages the \ncontinuation of this practice; \n \n4. \nRecognizes the value of continued engagement between the General \nAssembly and the Peacebuilding Commission, in line with the Commission\u2019s advisory \nrole and its mandate to promote coherence and coordination with the United Nations \nsystem, including, where relevant, through the convening of joint debates and the \nprovision by the Commission of advice and remarks to the Assembly, and encourages \nthe President and the Chair of the respective bodies to hold regular meetings to that end;  \n \n5. \nCommits to the continued implementation of its resolution 377 A (V) of \n3 November 1950, entitled \u201cUniting for peace\u201d, and its resolution 76/262 of 26 April \n2022 on the veto initiative, to enhance the work of the General Assembly, taking into \naccount its role on matters related to the maintenance of international peace and \nsecurity, and recognizing the relevance of these resolutions with respect to the \nfulfilment of the purposes and principles of the Charter, and calls for strengthened \ntransparency and interaction between the General Assembly and the Security Council; \n \n6. \nRequests the President of the General Assembly to continue to prepare \ndetailed summaries following relevant discussions related to the annual report of the \nSecurity Council, on the use of the veto or General Assembly resolution 377 A (V) or \n76/262, including recommendations for action based on such discussions; \n \n7. \nDecides to support credible, timely and decisive action by the Security \nCouncil in exercise of its primary responsibility for the maintenance of international \npeace and security, and in this regard calls upon Member States to refrain from \nmeasures impeding action to prevent or end the commission of genocide, crimes \nagainst humanity or war crimes; \n \n8. \nRecognizes the continued relevance and potential of special reports \nmandated by Article 15, paragraph 1, and Article 24, paragraph 3, of the Charter, \n\nRevitalization of the work of the General Assembly \nA/RES/79/327\n \n3/9\n25-14294 \n \nwhen necessary, and invites the Security Council to continue this practice and to \nsubmit such reports, including in connection with the use of the veto; \n \n9. \nReaffirms the obligation of all Members to fully implement and adhere to \nall provisions of the Charter as they relate to the decision-making process in the \nSecurity Council;  \n \n10. Recalls that, under Article 24, paragraph 1, of the Charter, the Security \nCouncil acts on behalf of the entire membership, and emphasizes that the \nconsideration of the annual report of the Security Council contributes to enhanced \ntransparency on matters relating to the maintenance of international peace and \nsecurity, and includes an account of the measures that the Council has decided upon \nor taken to maintain international peace and security as provided for under Article 15, \nparagraph 1, of the Charter; \n \n11. Welcomes the efforts of the Security Council in producing a more \ncomprehensive annual report and the inclusion of a chapter on special reports on the \nuse of the veto in the annual report of the Security Council, as well as the additional \ninformation provided in the introduction regarding the use of the veto, reiterates the \nimportance of the Security Council continuing its efforts to improve its annual report \nto the General Assembly, and in addition welcomes the practice of convening an \ninformal meeting, with due notice, every January to allow Member States and \nobservers to the General Assembly to express their views ahead of the completion of \nthe introduction to the annual report of the Security Council to the General Assembly, \nand requests the continuation of this practice;  \n \n12. Takes note of the issuance of the digital handbook1 on past practices, data \nand recommendations for the fulfilment of the functions and powers of the General \nAssembly as outlined in Chapter IV of the Charter, as mandated in resolution 77/335, \nand encourages its annual update and its wider dissemination among Member States; \n \n13. Recalls Article 96 of the Charter and recognizes the contribution of the \nInternational Court of Justice, as the principal judicial organ of the United Nations, \nincluding through its advisory opinions, and reaffirms the obligation of all States to \nundertake to comply with the decisions of the International Court of Justice in cases \nto which they are parties; \n \n14. Recognizes the role played by the Special Committee on the Charter of the \nUnited Nations and on the Strengthening of the Role of the Organization, including \nin matters related to the maintenance of international peace and security and in further \nstrengthening its role in accordance with paragraph 1 (a) (ii) of General Assembly \nresolution 3499 (XXX) of 15 December 1975; \n \n \n \nWorking methods \n \n \n15. Decides to establish the Working Group on the Strengthening and \nRevitalizing of the Work of the General Assembly, with the mandate and composition \nof the Ad Hoc Working Group on the Revitalization of the Work of the General \nAssembly; \n \n16. Also decides that the Working Group on the Strengthening and \nRevitalizing of the Work of the General Assembly will address the following clusters \nevery three years, on a trial basis starting at the eighty-first session, while maintaining \nan ongoing focus on the implementation of mandates given by the General Assembly \n__________________ \n \n1  Assembly for Peace: A Digital Handbook on the UN General Assembly\u2019s Past Practice on Peace \nand Security. Available at https://digitallibrary.un.org/record/4061002?ln=en&v=pdf. \n\nA/RES/79/327 \nRevitalization of the work of the General Assembly\n \n25-14294\n4/9 \n \nand continuing the practice of concurrent discussions of the clusters within each \nsession: \n \n(a) \nThe role, authority and working methods of the General Assembly; the \nOffice of the President of the General Assembly, at the eighty-first session and every \nthree years thereafter; \n \n(b) \nThe process for the selection and appointment of the Secretary-General \nand other executive heads, at the eighty-second session and every three years \nthereafter; \n \n17. Further decides that the Working Group will convene, starting from the \neightieth session, to review the implementation of the present and past resolutions; \n \n18. Decides that the Working Group will consider a resolution every three years, \nstarting at the eighty-third session, except for instances where earlier consideration of \na resolution is deemed necessary by the General Assembly, to align with specific \ntimelines related to the work of the Assembly, and issue a report on its deliberations; \n \n19. Also decides to review and assess during the eighty-third session the \nfeasibility and impact of the triennial frequency of the resolution and the timetable of \nthe Working Group; \n \n20. Further decides to continue the practice of the convening of an annual \ninteractive dialogue between Member States and the Secretariat by the President of \nthe General Assembly; \n \n21. Strongly encourages Member States, without prejudice to the sovereign \nright of Member States to submit resolutions and propose agenda items to the General \nAssembly and with a view to ensuring more focused work of its deliberations, to \nreduce the frequency, length and number of resolutions submitted to the Assembly; \n \n22. Acknowledges the recurring nature of multiple resolutions adopted by the \nGeneral Assembly that are substantially similar to their previous versions, and \nstrongly encourages Member States, starting from the eighty-first session, to \nreintroduce any resolution of such nature only when operational adjustments are being \nmade, without prejudice to the sovereign right of Member States to submit resolutions \nand with the exception of certain resolutions, including those resolutions relating to \nthe peace and security agenda of the United Nations, which shall maintain their \nestablished frequency due to political or procedural character or requirements; \n \n23. Strongly urges Member States to limit explanations of vote by delegations, \nboth before and after the vote, to five minutes; written explanations of vote are not \nlimited in length and will be reflected in their entirety in the official records; \n \n24. Decides, starting from the eighty-first session, to limit the number of high-\nlevel meetings mandated by the General Assembly to be convened during high-level \nweek to a maximum of three, with a view to allowing adequate space and time for \ndelegations to focus on the general debate of the Assembly; \n \n25. Requests each of the Main Committees to review their working methods \nduring the eightieth session and submit concrete proposals to the General Committee \non how to make their work more efficient and effective; \n \n26. Requests the General Committee, based on the proposals received by each \nof the Main Committees and respecting the specificities and mandates of each \nCommittee, to present, during the eighty-first session, concrete proposals for the \nconsideration of the General Assembly on how to seek synergies and avoid \nduplication in the work of the Main Committees, with a view to streamlining the \nagenda of the General Assembly and making it more efficient; \n\nRevitalization of the work of the General Assembly \nA/RES/79/327\n \n5/9\n25-14294 \n \n \n27. Looks forward to receiving for the consideration of Member States, during \nthe eightieth session and within the framework of the UN80 Initiative, concrete \nproposals from the Secretariat, taking into account the necessity to have clearly \ndefined objectives and an evidence-based approach, and aiming at strengthening the \nimpact of the United Nations and enhancing its agility, responsiveness and resilience \nwhile addressing the issue of duplicative efforts and ensuring effective and efficient \nmandate delivery across all three pillars of the work of the United Nations; \n \n28. Decides to simplify the adoption of draft resolutions and decisions \nrecommended by a Main Committee in the General Assembly plenary, subject to the \nfollowing provisions: \n \n(a) \nThe General Assembly plenary shall first take all votes, one by one, on \ndraft resolutions and decisions recommended by the Main Committee and/or parts \nthereof where such votes were taken in the Committee; the plenary shall subsequently \nadopt without a vote in one gavel all other draft resolutions and decisions adopted by \nthe Committee without a vote; \n \n(b) \nThe resolutions and decisions shall be numbered in the order listed in the \nreport of the Main Committee, regardless of whether they were adopted with or \nwithout a vote, excluding proposals with programme budget implications; \n \n(c) \nThe procedure for action on proposals with programme budget \nimplications shall remain unchanged, with action taken when the report of the Fifth \nCommittee is available, pursuant to rule 153 of the rules of procedure of the General \nAssembly, with all separate and recorded votes taken as applicable; \n \n29. Requests the General Committee, in consultation with all Member States, \nto submit to the General Assembly a proposal to repurpose the agenda to focus on \nshared priorities and to streamline it to allow for adequate time to consider items and \nachieve outcomes on items; \n \n30. Decides to amend its rules of procedure, effective from the opening of the \neightieth session, to read as reflected in annex I to the report of the Ad Hoc Working \nGroup on the Revitalization of the Work of the General Assembly,2 with a view to \nreflecting feminine pronouns and gender-specific nouns for women, in all six official \nlanguages, in accordance with that annex; \n \n31. Notes with concern the significant increase in the number of proposals to \nproclaim international days, weeks, months, years or decades, and decides, on a trial \nbasis, to put on hold consideration of new proposals for international days, weeks, \nmonths, years and decades during the eighty-first and eighty-second sessions, and \nrequests the President of the General Assembly, effective from the eighty-first \nsession, to group all proclamation requests for international commemoration into a \nsingle resolution per agenda item, where each proposed commemoration contains its \nown operative paragraph focused on its establishment; \n \n32. Decides to review and assess during the eighty-third session the feasibility \nand impact of these measures on the efficiency and effectiveness of the work of the \nGeneral Assembly; \n \n33. Notes an increase in the submission of resolutions with a regional scope to \nthe General Assembly, and in this regard calls upon Member States to refrain from \nsubmitting such resolutions, with a view to streamlining the work of the Assembly \nand to make it more focused and impactful; \n__________________ \n \n2  A/79/995. \n\nA/RES/79/327 \nRevitalization of the work of the General Assembly\n \n25-14294\n6/9 \n \n \n34. Reaffirms that all decisions and resolutions of the General Assembly shall \nbe consistent with the Charter of the United Nations as well as with the financial \nregulations and rules of the Organization; \n \n35. Decides to continue the established pattern of geographical rotation of the \nChairs of the Main Committees, as contained in the annex to General Assembly \nresolution 72/313 of 17 September 2018, starting with the eighty-fourth session; \n \n36. Acknowledges the need for continued work on accessibility of both digital \nand physical platforms, and in this regard welcomes the roll-out of the iGov platform, \nrecognizing the contribution to transparency and efficiency of the work of the General \nAssembly and its subsidiary bodies, and requests its extension to publicly available \ninformation related to the work of the subsidiary bodies including the Economic and \nSocial Council and the Security Council, to consolidate already available information \nfrom different sources; \n \n37. Takes note of the organization of Action Days in the lead-up to the high-\nlevel week of the general debate, emphasizes that this format contributes to freeing \nup attention and space for the general debate itself, and encourages its continuation \nin future sessions of the General Assembly; \n \n \n \nSelection and appointment of the Secretary-General and other executive heads \n \n \n38. Reaffirms the important role played by the Secretary-General in the \ncontext of current global challenges and in the implementation of the three pillars of \nthe United Nations, namely peace and security, human rights and development; \n \n39. Recalls its resolutions 69/321 of 11 September 2015, 70/305 of \n13 September 2016, 71/323 of 8 September 2017, 72/313 and 77/335, which \nintroduced significant improvements to the selection and appointment process of the \nSecretary-General, and reaffirms that the process should be guided by the principles \nset out in the present resolution and previous resolutions; \n \n40. Underlines the importance for candidates to embody the highest standards \nof efficiency, competence and integrity, and a firm commitment to the purposes and \nprinciples of the Charter; \n \n41. Recalls paragraph 59 of resolution 77/335, and reaffirms previous \nresolutions on continued efforts towards achieving equal and fair distribution in terms \nof the gender and geographical balance with regard to appointments of executive \nheads of the Organization, including the Secretary-General, while meeting the highest \npossible standards;  \n \n42. Decides, without prejudice to the prerogatives of the Security Council, and \nin strict compliance with Article 97 of the Charter, that, starting with the eightieth \nsession, the process for the selection and appointment of the Secretary-General should \ninclude the following steps:  \n \n(a) \nThe selection process should be formally initiated in the last quarter of the \nyear preceding the end of the incumbent\u2019s term through a joint letter of the President \nof the General Assembly and the President of the Security Council addressed to \nMember States, announcing the start of the selection process and inviting candidates \nto be presented, after which nominations of candidates are expected; \n \n(b) \nThe joint letter should invite nominations from Member States and outline \nthe principles of the selection process and notional events, inviting the nomination of \ncandidates; \n\nRevitalization of the work of the General Assembly \nA/RES/79/327\n \n7/9\n25-14294 \n \n \n(c) \nNoting with regret that no woman has ever held the position of Secretary-\nGeneral, encourages Member States to strongly consider nominating women as \ncandidates;  \n \n(d) \nThe candidates should be nominated by one Member State or by a group \nof Member States; each Member State may nominate only one candidate, individually \nor jointly with other Member States; \n \n(e) \nThe President of the General Assembly and the President of the Security \nCouncil will jointly inform Member States as candidatures are being submitted;  \n \n(f) \nA nominating Member State may withdraw a candidate at any time during \nthe process; the President of the General Assembly and the President of the Security \nCouncil should be notified of the withdrawal of the candidate submitted anytime \nduring the process and the candidate should be considered automatically withdrawn; \nif a candidate withdraws, the nominating Member State may subsequently nominate \nanother candidate; \n \n(g) \nEach candidate should provide a vision statement at the time of the \nnomination, which will be publicized on the dedicated United Nations web page; each \ncandidate should be given the opportunity to present her or his vision statement; the \nPresident of the General Assembly will convene webcast interactive dialogues with \nall candidates, in accordance with paragraph 42 of resolution 69/321; the President of \nthe General Assembly will engage closely, in a transparent and inclusive manner, with \nMember States;  \n \n(h) \nEach candidate should disclose her or his sources of funding at the time of \nthe nomination;  \n \n(i) \nCandidates holding positions in the United Nations system should consider \nsuspending their work in the United Nations system during the campaign, with a view \nto avoiding any conflict of interest that may arise from their functions and adjacent \nadvantages; \n \n(j) \nThe President of the General Assembly and the President of the Security \nCouncil should jointly maintain and regularly update a public list of candidates, \nincluding the name, nominating State(s), vision statement, curriculum vitae and \ncampaign financing disclosures, published on a dedicated United Nations web page; \n \n(k) \nThe Secretary General shall be appointed by the General Assembly upon \nthe recommendation of the Security Council, in accordance with Article 97 of the \nCharter;  \n \n(l) \nThe selection process should end with the swearing into office of the \nSecretary-General-designate, as detailed in annex I to resolution 77/335, during the \nlast quarter of the year prior to assuming office, bearing in mind the need to allow the \nSecretary-General-designate sufficient time to prepare for her or his term in office;  \n \n(m) In the event of an unforeseen interruption in the term of office of the \nSecretary-General, the General Assembly and the Security Council should, upon \nnotification from the Executive Office of the Secretary-General, convene without \ndelay to initiate an expedited selection and appointment process in accordance with \nArticle 97 of the Charter and the procedures set out in the present and previous \nresolutions; \n \n(n) \nThe Secretariat is requested to continue to regularly update the repository \nof information on past Secretary-General selection processes; \n \n43. Reiterates its request to the Secretary-General to continue the ongoing \nefforts to ensure equitable geographical distribution in the Secretariat and to ensure \n\nA/RES/79/327 \nRevitalization of the work of the General Assembly\n \n25-14294\n8/9 \n \nas wide a geographical distribution of staff as possible in all departments and offices \nand at all levels, of geographic posts, including at the Director and higher levels of \nthe Secretariat, as set out in resolution 77/335; \n \n44. Reiterates the need to ensure equal and fair distribution based on gender \nparity and as wide a geographical basis as possible, while also being diverse from a \nmultilingual perspective, and in this regard recalls its resolutions 46/232 of 2 March \n1992, 51/241 of 31 July 1997, 71/263 of 23 December 2016, 72/254 of 24 December \n2017 and 77/278 of 18 April 2023, adopted without a vote, which contain the \nprinciples that the highest standards of efficiency, competence and integrity are the \nparamount considerations in the recruitment and performance of international civil \nservants, and that candidates\u2019 independence should be considered; \n \n45. Commends the creation and further development of the Senior Leadership \nTalent Pool and the Senior Leadership Vacancies portal, requests the Secretariat to \ncontinue the practice of regularly updating these online platforms, calls upon Member \nStates to submit the names and r\u00e9sum\u00e9s of nationals who may be considered for \npositions of executive heads and senior management of the Secretariat, and requests \nthe Secretariat to ensure that there is a preliminary public call for candidates in all \nsenior appointments and to share on a regular basis with Member States a list of \nupcoming vacancies of senior-level posts; \n \n46. Urges the Secretary-General and all United Nations entities to firmly \nuphold a zero-tolerance policy against all types of misconduct;  \n \n \n \nStrengthening of the accountability, transparency and institutional memory of \nthe Office of the President of the General Assembly \n \n \n47. Emphasizes the important role of the President of the General Assembly \nin the strategic guidance and the overall success of the work of the General Assembly, \nand thus the United Nations, recognizes that the activities and mandates assigned to \nthe President have increased in recent years, recalls the provisions regarding the \nsupport for the Office of the President of the General Assembly in previous \nresolutions and the annexes to resolution 70/305, and expresses continued support to \nthe Office; \n \n48. Recalls paragraph 81 of resolution 77/335 and notes with concern that only \nfive women have been elected as President of the General Assembly up until the \nseventy-ninth session and welcomes with appreciation the appointment of the fifth \nwoman, presiding over the General Assembly for its eightieth session, calls upon \nMember States to continue to nominate women as candidates for this position and \nfurther calls upon Member States to explore measures to address the disparity and to \nalso explore concrete steps at the eighty-first session;  \n \n49. Requests the President of the General Assembly to present to the General \nAssembly recommendations to strengthen the efficiency, accountability, transparency \nand institutional memory of the Office of the President of the General Assembly; \n \n50. Stresses the utmost importance of ensuring a smooth transition between \nthe outgoing and incoming Presidents of the General Assembly, and in this connection \nemphasizes the critical role of close interaction and coordination between the Offices \nof the incoming and outgoing Presidents, including the transmission of a handover \nreport, as well as expeditious provision of personnel and financial support through \nvoluntary contributions by Member States to the Office of the incoming President of \nthe General Assembly;  \n \n51. Acknowledges the efforts of Member States aimed at strengthening and \nproviding the Office of the President of the General Assembly and the President with \n\nRevitalization of the work of the General Assembly \nA/RES/79/327\n \n9/9\n25-14294 \n \nthe adequate means to perform their increasing functions, including thorough \nvoluntary contributions to the trust fund, and strongly encourages more countries to \ncontribute; \n \n52. Requests the Secretary-General to continue to provide to the President of \nthe General Assembly adequate administrative, technical, technological, logistical \nand protocol-related support necessary to effectively execute the mandates entrusted \nto the President of a principal organ of the United Nations; \n \n53. Invites Member States to consider funding for the President of the General \nAssembly Fellowship Programme. \n \n94th plenary meeting \n5 September 2025 \n \n",
  "paragraphs": {
    "1": "Recognizes the functions, powers and role of the General Assembly in matters related to the maintenance of international peace and security as articulated in Articles 10, 11, 12 and 35 of the Charter of the United Nations, without prejudice to the functions and powers of the Security Council set out in Article 24, in particular by taking action in accordance with the Charter, and emphasizes the importance of continuing to strengthen the relationship between the Security Council and the General Assembly, including as stipulated in resolution 79/1;",
    "2": "Calls for greater coordination, in accordance with their respective mandates, between the General Assembly, the Security Council and the Economic and Social Council, in order to avoid duplication between and align the agendas of these bodies, and encourages the Presidents of the respective bodies to continue to hold regular meetings to that end;",
    "3": "Reaffirms the need to reinforce synergy, coherence and complementarity between the agendas of the General Assembly and its Main Committees and the Economic and Social Council and its subsidiary bodies, welcomes regular interaction and enhanced coordination between the Presidents of the General Assembly, the Economic and Social Council and the Security Council, and encourages the continuation of this practice;",
    "4": "Recognizes the value of continued engagement between the General Assembly and the Peacebuilding Commission, in line with the Commission\u2019s advisory role and its mandate to promote coherence and coordination with the United Nations system, including, where relevant, through the convening of joint debates and the provision by the Commission of advice and remarks to the Assembly, and encourages the President and the Chair of the respective bodies to hold regular meetings to that end;",
    "5": "Commits to the continued implementation of its resolution 377 A (V) of 3 November 1950, entitled \u201cUniting for peace\u201d, and its resolution 76/262 of 26 April 2022 on the veto initiative, to enhance the work of the General Assembly, taking into account its role on matters related to the maintenance of international peace and security, and recognizing the relevance of these resolutions with respect to the fulfilment of the purposes and principles of the Charter, and calls for strengthened transparency and interaction between the General Assembly and the Security Council;",
    "6": "Requests the President of the General Assembly to continue to prepare detailed summaries following relevant discussions related to the annual report of the Security Council, on the use of the veto or General Assembly resolution 377 A (V) or 76/262, including recommendations for action based on such discussions;",
    "7": "Decides to support credible, timely and decisive action by the Security Council in exercise of its primary responsibility for the maintenance of international peace and security, and in this regard calls upon Member States to refrain from measures impeding action to prevent or end the commission of genocide, crimes against humanity or war crimes;",
    "8": "Recognizes the continued relevance and potential of special reports mandated by Article 15, paragraph 1, and Article 24, paragraph 3, of the Charter, Revitalization of the work of the General Assembly A/RES/79/327 3/9 25-14294 when necessary, and invites the Security Council to continue this practice and to submit such reports, including in connection with the use of the veto;",
    "9": "Reaffirms the obligation of all Members to fully implement and adhere to all provisions of the Charter as they relate to the decision-making process in the Security Council;",
    "10": "Recalls that, under Article 24, paragraph 1, of the Charter, the Security Council acts on behalf of the entire membership, and emphasizes that the consideration of the annual report of the Security Council contributes to enhanced transparency on matters relating to the maintenance of international peace and security, and includes an account of the measures that the Council has decided upon or taken to maintain international peace and security as provided for under Article 15, paragraph 1, of the Charter;",
    "11": "Welcomes the efforts of the Security Council in producing a more comprehensive annual report and the inclusion of a chapter on special reports on the use of the veto in the annual report of the Security Council, as well as the additional information provided in the introduction regarding the use of the veto, reiterates the importance of the Security Council continuing its efforts to improve its annual report to the General Assembly, and in addition welcomes the practice of convening an informal meeting, with due notice, every January to allow Member States and observers to the General Assembly to express their views ahead of the completion of the introduction to the annual report of the Security Council to the General Assembly, and requests the continuation of this practice;",
    "12": "Takes note of the issuance of the digital handbook1 on past practices, data and recommendations for the fulfilment of the functions and powers of the General Assembly as outlined in Chapter IV of the Charter, as mandated in resolution 77/335, and encourages its annual update and its wider dissemination among Member States;",
    "13": "Recalls Article 96 of the Charter and recognizes the contribution of the International Court of Justice, as the principal judicial organ of the United Nations, including through its advisory opinions, and reaffirms the obligation of all States to undertake to comply with the decisions of the International Court of Justice in cases to which they are parties;",
    "14": "Recognizes the role played by the Special Committee on the Charter of the United Nations and on the Strengthening of the Role of the Organization, including in matters related to the maintenance of international peace and security and in further strengthening its role in accordance with paragraph 1 (a) (ii) of General Assembly resolution 3499 (XXX) of 15 December 1975; Working methods",
    "15": "Decides to establish the Working Group on the Strengthening and Revitalizing of the Work of the General Assembly, with the mandate and composition of the Ad Hoc Working Group on the Revitalization of the Work of the General Assembly;",
    "16": "Also decides that the Working Group on the Strengthening and Revitalizing of the Work of the General Assembly will address the following clusters every three years, on a trial basis starting at the eighty-first session, while maintaining an ongoing focus on the implementation of mandates given by the General Assembly __________________ 1 Assembly for Peace: A Digital Handbook on the UN General Assembly\u2019s Past Practice on Peace and Security. Available at https://digitallibrary.un.org/record/4061002?ln=en&v=pdf. A/RES/79/327 Revitalization of the work of the General Assembly 25-14294 4/9 and continuing the practice of concurrent discussions of the clusters within each session: (a) The role, authority and working methods of the General Assembly; the Office of the President of the General Assembly, at the eighty-first session and every three years thereafter; (b) The process for the selection and appointment of the Secretary-General and other executive heads, at the eighty-second session and every three years thereafter;",
    "17": "Further decides that the Working Group will convene, starting from the eightieth session, to review the implementation of the present and past resolutions;",
    "18": "Decides that the Working Group will consider a resolution every three years, starting at the eighty-third session, except for instances where earlier consideration of a resolution is deemed necessary by the General Assembly, to align with specific timelines related to the work of the Assembly, and issue a report on its deliberations;",
    "19": "Also decides to review and assess during the eighty-third session the feasibility and impact of the triennial frequency of the resolution and the timetable of the Working Group;",
    "20": "Further decides to continue the practice of the convening of an annual interactive dialogue between Member States and the Secretariat by the President of the General Assembly;",
    "21": "Strongly encourages Member States, without prejudice to the sovereign right of Member States to submit resolutions and propose agenda items to the General Assembly and with a view to ensuring more focused work of its deliberations, to reduce the frequency, length and number of resolutions submitted to the Assembly;",
    "22": "Acknowledges the recurring nature of multiple resolutions adopted by the General Assembly that are substantially similar to their previous versions, and strongly encourages Member States, starting from the eighty-first session, to reintroduce any resolution of such nature only when operational adjustments are being made, without prejudice to the sovereign right of Member States to submit resolutions and with the exception of certain resolutions, including those resolutions relating to the peace and security agenda of the United Nations, which shall maintain their established frequency due to political or procedural character or requirements;",
    "23": "Strongly urges Member States to limit explanations of vote by delegations, both before and after the vote, to five minutes; written explanations of vote are not limited in length and will be reflected in their entirety in the official records;",
    "24": "Decides, starting from the eighty-first session, to limit the number of high- level meetings mandated by the General Assembly to be convened during high-level week to a maximum of three, with a view to allowing adequate space and time for delegations to focus on the general debate of the Assembly;",
    "25": "Requests each of the Main Committees to review their working methods during the eightieth session and submit concrete proposals to the General Committee on how to make their work more efficient and effective;",
    "26": "Requests the General Committee, based on the proposals received by each of the Main Committees and respecting the specificities and mandates of each Committee, to present, during the eighty-first session, concrete proposals for the consideration of the General Assembly on how to seek synergies and avoid duplication in the work of the Main Committees, with a view to streamlining the agenda of the General Assembly and making it more efficient; Revitalization of the work of the General Assembly A/RES/79/327 5/9 25-14294",
    "27": "Looks forward to receiving for the consideration of Member States, during the eightieth session and within the framework of the UN80 Initiative, concrete proposals from the Secretariat, taking into account the necessity to have clearly defined objectives and an evidence-based approach, and aiming at strengthening the impact of the United Nations and enhancing its agility, responsiveness and resilience while addressing the issue of duplicative efforts and ensuring effective and efficient mandate delivery across all three pillars of the work of the United Nations;",
    "28": "Decides to simplify the adoption of draft resolutions and decisions recommended by a Main Committee in the General Assembly plenary, subject to the following provisions: (a) The General Assembly plenary shall first take all votes, one by one, on draft resolutions and decisions recommended by the Main Committee and/or parts thereof where such votes were taken in the Committee; the plenary shall subsequently adopt without a vote in one gavel all other draft resolutions and decisions adopted by the Committee without a vote; (b) The resolutions and decisions shall be numbered in the order listed in the report of the Main Committee, regardless of whether they were adopted with or without a vote, excluding proposals with programme budget implications; (c) The procedure for action on proposals with programme budget implications shall remain unchanged, with action taken when the report of the Fifth Committee is available, pursuant to rule 153 of the rules of procedure of the General Assembly, with all separate and recorded votes taken as applicable;",
    "29": "Requests the General Committee, in consultation with all Member States, to submit to the General Assembly a proposal to repurpose the agenda to focus on shared priorities and to streamline it to allow for adequate time to consider items and achieve outcomes on items;",
    "30": "Decides to amend its rules of procedure, effective from the opening of the eightieth session, to read as reflected in annex I to the report of the Ad Hoc Working Group on the Revitalization of the Work of the General Assembly,2 with a view to reflecting feminine pronouns and gender-specific nouns for women, in all six official languages, in accordance with that annex;",
    "31": "Notes with concern the significant increase in the number of proposals to proclaim international days, weeks, months, years or decades, and decides, on a trial basis, to put on hold consideration of new proposals for international days, weeks, months, years and decades during the eighty-first and eighty-second sessions, and requests the President of the General Assembly, effective from the eighty-first session, to group all proclamation requests for international commemoration into a single resolution per agenda item, where each proposed commemoration contains its own operative paragraph focused on its establishment;",
    "32": "Decides to review and assess during the eighty-third session the feasibility and impact of these measures on the efficiency and effectiveness of the work of the General Assembly;",
    "33": "Notes an increase in the submission of resolutions with a regional scope to the General Assembly, and in this regard calls upon Member States to refrain from submitting such resolutions, with a view to streamlining the work of the Assembly and to make it more focused and impactful; __________________ 2 A/79/995. A/RES/79/327 Revitalization of the work of the General Assembly 25-14294 6/9",
    "34": "Reaffirms that all decisions and resolutions of the General Assembly shall be consistent with the Charter of the United Nations as well as with the financial regulations and rules of the Organization;",
    "35": "Decides to continue the established pattern of geographical rotation of the Chairs of the Main Committees, as contained in the annex to General Assembly resolution 72/313 of 17 September 2018, starting with the eighty-fourth session;",
    "36": "Acknowledges the need for continued work on accessibility of both digital and physical platforms, and in this regard welcomes the roll-out of the iGov platform, recognizing the contribution to transparency and efficiency of the work of the General Assembly and its subsidiary bodies, and requests its extension to publicly available information related to the work of the subsidiary bodies including the Economic and Social Council and the Security Council, to consolidate already available information from different sources;",
    "37": "Takes note of the organization of Action Days in the lead-up to the high- level week of the general debate, emphasizes that this format contributes to freeing up attention and space for the general debate itself, and encourages its continuation in future sessions of the General Assembly; Selection and appointment of the Secretary-General and other executive heads",
    "38": "Reaffirms the important role played by the Secretary-General in the context of current global challenges and in the implementation of the three pillars of the United Nations, namely peace and security, human rights and development;",
    "39": "Recalls its resolutions 69/321 of 11 September 2015, 70/305 of 13 September 2016, 71/323 of 8 September 2017, 72/313 and 77/335, which introduced significant improvements to the selection and appointment process of the Secretary-General, and reaffirms that the process should be guided by the principles set out in the present resolution and previous resolutions;",
    "40": "Underlines the importance for candidates to embody the highest standards of efficiency, competence and integrity, and a firm commitment to the purposes and principles of the Charter;",
    "41": "Recalls paragraph 59 of resolution 77/335, and reaffirms previous resolutions on continued efforts towards achieving equal and fair distribution in terms of the gender and geographical balance with regard to appointments of executive heads of the Organization, including the Secretary-General, while meeting the highest possible standards;",
    "42": "Decides, without prejudice to the prerogatives of the Security Council, and in strict compliance with Article 97 of the Charter, that, starting with the eightieth session, the process for the selection and appointment of the Secretary-General should include the following steps: (a) The selection process should be formally initiated in the last quarter of the year preceding the end of the incumbent\u2019s term through a joint letter of the President of the General Assembly and the President of the Security Council addressed to Member States, announcing the start of the selection process and inviting candidates to be presented, after which nominations of candidates are expected; (b) The joint letter should invite nominations from Member States and outline the principles of the selection process and notional events, inviting the nomination of candidates; Revitalization of the work of the General Assembly A/RES/79/327 7/9 25-14294 (c) Noting with regret that no woman has ever held the position of Secretary- General, encourages Member States to strongly consider nominating women as candidates; (d) The candidates should be nominated by one Member State or by a group of Member States; each Member State may nominate only one candidate, individually or jointly with other Member States; (e) The President of the General Assembly and the President of the Security Council will jointly inform Member States as candidatures are being submitted; (f) A nominating Member State may withdraw a candidate at any time during the process; the President of the General Assembly and the President of the Security Council should be notified of the withdrawal of the candidate submitted anytime during the process and the candidate should be considered automatically withdrawn; if a candidate withdraws, the nominating Member State may subsequently nominate another candidate; (g) Each candidate should provide a vision statement at the time of the nomination, which will be publicized on the dedicated United Nations web page; each candidate should be given the opportunity to present her or his vision statement; the President of the General Assembly will convene webcast interactive dialogues with all candidates, in accordance with paragraph 42 of resolution 69/321; the President of the General Assembly will engage closely, in a transparent and inclusive manner, with Member States; (h) Each candidate should disclose her or his sources of funding at the time of the nomination; (i) Candidates holding positions in the United Nations system should consider suspending their work in the United Nations system during the campaign, with a view to avoiding any conflict of interest that may arise from their functions and adjacent advantages; (j) The President of the General Assembly and the President of the Security Council should jointly maintain and regularly update a public list of candidates, including the name, nominating State(s), vision statement, curriculum vitae and campaign financing disclosures, published on a dedicated United Nations web page; (k) The Secretary General shall be appointed by the General Assembly upon the recommendation of the Security Council, in accordance with Article 97 of the Charter; (l) The selection process should end with the swearing into office of the Secretary-General-designate, as detailed in annex I to resolution 77/335, during the last quarter of the year prior to assuming office, bearing in mind the need to allow the Secretary-General-designate sufficient time to prepare for her or his term in office; (m) In the event of an unforeseen interruption in the term of office of the Secretary-General, the General Assembly and the Security Council should, upon notification from the Executive Office of the Secretary-General, convene without delay to initiate an expedited selection and appointment process in accordance with Article 97 of the Charter and the procedures set out in the present and previous resolutions; (n) The Secretariat is requested to continue to regularly update the repository of information on past Secretary-General selection processes;",
    "43": "Reiterates its request to the Secretary-General to continue the ongoing efforts to ensure equitable geographical distribution in the Secretariat and to ensure A/RES/79/327 Revitalization of the work of the General Assembly 25-14294 8/9 as wide a geographical distribution of staff as possible in all departments and offices and at all levels, of geographic posts, including at the Director and higher levels of the Secretariat, as set out in resolution 77/335;",
    "44": "Reiterates the need to ensure equal and fair distribution based on gender parity and as wide a geographical basis as possible, while also being diverse from a multilingual perspective, and in this regard recalls its resolutions 46/232 of 2 March 1992, 51/241 of 31 July 1997, 71/263 of 23 December 2016, 72/254 of 24 December 2017 and 77/278 of 18 April 2023, adopted without a vote, which contain the principles that the highest standards of efficiency, competence and integrity are the paramount considerations in the recruitment and performance of international civil servants, and that candidates\u2019 independence should be considered;",
    "45": "Commends the creation and further development of the Senior Leadership Talent Pool and the Senior Leadership Vacancies portal, requests the Secretariat to continue the practice of regularly updating these online platforms, calls upon Member States to submit the names and r\u00e9sum\u00e9s of nationals who may be considered for positions of executive heads and senior management of the Secretariat, and requests the Secretariat to ensure that there is a preliminary public call for candidates in all senior appointments and to share on a regular basis with Member States a list of upcoming vacancies of senior-level posts;",
    "46": "Urges the Secretary-General and all United Nations entities to firmly uphold a zero-tolerance policy against all types of misconduct; Strengthening of the accountability, transparency and institutional memory of the Office of the President of the General Assembly",
    "47": "Emphasizes the important role of the President of the General Assembly in the strategic guidance and the overall success of the work of the General Assembly, and thus the United Nations, recognizes that the activities and mandates assigned to the President have increased in recent years, recalls the provisions regarding the support for the Office of the President of the General Assembly in previous resolutions and the annexes to resolution 70/305, and expresses continued support to the Office;",
    "48": "Recalls paragraph 81 of resolution 77/335 and notes with concern that only five women have been elected as President of the General Assembly up until the seventy-ninth session and welcomes with appreciation the appointment of the fifth woman, presiding over the General Assembly for its eightieth session, calls upon Member States to continue to nominate women as candidates for this position and further calls upon Member States to explore measures to address the disparity and to also explore concrete steps at the eighty-first session;",
    "49": "Requests the President of the General Assembly to present to the General Assembly recommendations to strengthen the efficiency, accountability, transparency and institutional memory of the Office of the President of the General Assembly;",
    "50": "Stresses the utmost importance of ensuring a smooth transition between the outgoing and incoming Presidents of the General Assembly, and in this connection emphasizes the critical role of close interaction and coordination between the Offices of the incoming and outgoing Presidents, including the transmission of a handover report, as well as expeditious provision of personnel and financial support through voluntary contributions by Member States to the Office of the incoming President of the General Assembly;",
    "51": "Acknowledges the efforts of Member States aimed at strengthening and providing the Office of the President of the General Assembly and the President with Revitalization of the work of the General Assembly A/RES/79/327 9/9 25-14294 the adequate means to perform their increasing functions, including thorough voluntary contributions to the trust fund, and strongly encourages more countries to contribute;",
    "52": "Requests the Secretary-General to continue to provide to the President of the General Assembly adequate administrative, technical, technological, logistical and protocol-related support necessary to effectively execute the mandates entrusted to the President of a principal organ of the United Nations;",
    "53": "Invites Member States to consider funding for the President of the General Assembly Fellowship Programme. 94th plenary meeting 5 September 2025"
  },
  "agenda_items": [
    "Item 121"
  ],
  "symbol_references": []
}