{
  "symbol": "A/RES/80/166",
  "filename": "A_RES_80_166.pdf",
  "title": "80/166. Report of the Special Committee on the Charter of the United Nations and on the Strengthening of the Role of the Organization",
  "text": "United Nations \nA/RES/80/166 \n \nGeneral Assembly \nDistr.: General \n19 December 2025 \n25-20864 (E) \n*2520864* \n \n \nEightieth session \nAgenda item 83 \nReport of the Special Committee on the Charter of the \nUnited Nations and on the Strengthening of the Role of \nthe Organization \n \n \n \n \n Resolution adopted by the General Assembly \non 15 December 2025 \n \n \n[on the report of the Sixth Committee (A/80/453, para. 10)] \n \n \n 80/166. Report of the Special Committee on the Charter of the \nUnited Nations and on the Strengthening of the Role of \nthe Organization \n \n \n \nThe General Assembly, \n \nRecalling its resolution 3499 (XXX) of 15 December 1975, by which it \nestablished the Special Committee on the Charter of the United Nations and on the \nStrengthening of the Role of the Organization, and its relevant resolutions adopted at \nsubsequent sessions, \n \nRecalling also its resolution 47/233 of 17 August 1993 on the revitalization of \nthe work of the General Assembly,  \n \nRecalling further its resolution 47/62 of 11 December 1992 on the question of \nequitable representation on and increase in the membership of the Security Council, \n \nTaking note of the report of the Open-ended Working Group on the Question of \nEquitable Representation on and Increase in the Membership of the Security Council \nand Other Matters related to the Security Council,1 \n \nRecalling the elements relevant to the work of the Special Committee contained \nin its resolution 47/120 B of 20 September 1993,  \n \nRecalling also its resolution 51/241 of 31 July 1997 on the strengthening of the \nUnited Nations system and its resolution 51/242 of 15 September 1997, entitled \n\u201cSupplement to an Agenda for Peace\u201d, by which it adopted the texts on coordination \nand the question of sanctions imposed by the United Nations, which are annexed to \nthat resolution,  \n_______________ \n \n1 Official Records of the General Assembly, Sixty-third Session, Supplement No. 47 (A/63/47). \n\nA/RES/80/166 \nReport of the Special Committee on the Charter of the \nUnited Nations and on the Strengthening of the Role of \nthe Organization\n \n25-20864\n2/5 \n \n \nConcerned about the special economic problems confronting certain States \narising from the carrying-out of preventive or enforcement measures taken by the \nSecurity Council against other States, and taking into account the obligation of \nMembers of the United Nations under Article 49 of the Charter to join in affording \nmutual assistance in carrying out the measures decided upon by the Council,  \n \nRecalling the right of third States confronted with special economic problems \nof that nature to consult the Security Council with regard to a solution of those \nproblems, in accordance with Article 50 of the Charter, \n \nRecalling also that the International Court of Justice is the principal judicial \norgan of the United Nations, reaffirming its authority and independence, and recalling \nthat each State Member of the United Nations undertakes to comply with the decision \nof the Court in any case to which it is a party, \n \nMindful of the adoption of the revised working papers on the working methods \nof the Special Committee,2 \n \nTaking note of the report of the Secretary-General entitled \u201cRepertory of \nPractice of United Nations Organs and Repertoire of the Practice of the Security \nCouncil\u201d,3 \n \nRecalling paragraphs 106 to 110, 176 and 177 of the 2005 World Summit \nOutcome,4 \n \nMindful of the decision of the Special Committee in which it expressed its \nreadiness to engage, as appropriate, in the implementation of any decisions that might \nbe taken at the high-level plenary meeting of the sixtieth session of the General \nAssembly in September 2005 that concerned the Charter and any amendments \nthereto,5 \n \nRecalling the provisions of its resolutions 50/51 of 11 December 1995, 51/208 \nof 17 December 1996, 52/162 of 15 December 1997, 53/107 of 8 December 1998, \n54/107 of 9 December 1999, 55/157 of 12 December 2000, 56/87 of 12 December \n2001, 57/25 of 19 November 2002, 58/80 of 9 December 2003 and 59/45 of \n2 December 2004,  \n \nRecalling also its resolution 64/115 of 16 December 2009 and the document \nentitled \u201cIntroduction and implementation of sanctions imposed by the United \nNations\u201d annexed thereto, \n \nHaving considered the report of the Special Committee on the work of its session \nheld in 2025,6 \n \nNoting with appreciation the work done by the Special Committee to encourage \nStates to focus on the need to prevent and to settle peacefully their disputes which are \nlikely to endanger the maintenance of international peace and security,  \n \n1. \nTakes note of the report of the Special Committee on the Charter of the \nUnited Nations and on the Strengthening of the Role of the Organization;  \n \n2. \nDecides that the Special Committee shall hold its next session from 18 to \n26 February 2026;  \n_______________ \n \n2 Ibid., Sixty-first Session, Supplement No. 33 (A/61/33), para. 72. \n \n3 A/80/210. \n \n4 Resolution 60/1. \n \n5 Official Records of the General Assembly, Sixtieth Session, Supplement No. 33 (A/60/33), \npara. 77. \n \n6 Ibid., Eightieth Session, Supplement No. 33 (A/80/33). \n\nReport of the Special Committee on the Charter of the \nUnited Nations and on the Strengthening of the Role of \nthe Organization \nA/RES/80/166\n \n3/5\n25-20864 \n \n \n3. \nRequests the Special Committee, at its session in 2026, in accordance with \nparagraph 5 of General Assembly resolution 50/52 of 11 December 1995:  \n \n(a) \nTo continue its consideration of all proposals concerning the question of \nthe maintenance of international peace and security in all its aspects in order to \nstrengthen the role of the United Nations and, in this context, to consider other \nproposals relating to the maintenance of international peace and security already \nsubmitted or which may be submitted to the Special Committee at its session in 2026, \nincluding strengthening the relationship and cooperation between the United Nations \nand regional organizations or arrangements in the peaceful settlement of disputes;  \n \n(b) \nTo consider, in accordance with paragraph 2 of the annex to resolution \n71/146 of 13 December 2016, in an appropriate, substantive manner and framework, \nthe question of the implementation of the provisions of the Charter of the United \nNations relating to assistance to third States affected by the application of sanctions \n(Article 50 of the Charter) based on all of the related reports of the Secretary-General7 \nand the proposals submitted on the question, and requests the Secretary-General to \nsubmit the next report on this issue to the General Assembly at its eighty-second \nsession; \n \n(c) \nTo keep on its agenda the question of the peaceful settlement of disputes \nbetween States;  \n \n(d) \nTo consider, as appropriate, any proposal referred to it by the General \nAssembly in the implementation of the decisions of the high-level plenary meeting of \nthe sixtieth session of the Assembly in September 2005 that concern the Charter and \nany amendments thereto;  \n \n(e) \nTo continue to consider, on a priority basis, ways and means of improving \nits working methods and enhancing its efficiency and utilization of resources with a \nview to identifying widely acceptable measures for future implementation;  \n \n4. \nRequests the Secretary-General, in accordance with paragraph 3 of the \nannex to resolution 71/146, to brief the Special Committee at its next session on the \ndocument entitled \u201cIntroduction and implementation of sanctions imposed by the \nUnited Nations\u201d contained in the annex to General Assembly resolution 64/115;  \n \n5. \nAlso requests the Secretary-General to brief the Special Committee at its \nnext session on the information referred to in paragraph 14 of his report on the \nimplementation of the provisions of the Charter related to assistance to third States \naffected by the application of sanctions;8 \n \n6. \nRecalls its decision, in its resolution 72/118 of 7 December 2017, to \nundertake an annual thematic debate in the Special Committee, under the agenda item \non the peaceful settlement of disputes, to discuss the means for the settlement of \ndisputes, in accordance with Chapter VI of the Charter, including in particular those \ncontained in Article 33 thereof, and consistent with the Manila Declaration on the \nPeaceful Settlement of International Disputes,9 and in that regard:  \n \n(a) \nInvites Member States, bearing in mind paragraph 5 (b) of its resolution \n77/109 of 7 December 2022, to focus their comments during the thematic debate, to \nbe held at the next session of the Special Committee, at the eightieth session of the \n_______________ \n \n7 A/48/573-S/26705, A/49/356, A/50/60-S/1995/1, A/50/361, A/50/423, A/51/317, A/52/308, \nA/53/312, A/54/383, A/54/383/Add.1, A/55/295, A/55/295/Add.1, A/56/303, A/57/165, \nA/57/165/Add.1, A/58/346, A/59/334, A/60/320, A/61/304, A/62/206, A/62/206/Corr.1, A/63/224, \nA/64/225, A/65/217, A/66/213, A/67/190, A/68/226, A/69/119, A/70/119, A/71/166, A/72/136, \nA/74/152, A/76/186, A/78/114 and A/80/151. \n \n8 A/80/151. \n \n9 Resolution 37/10, annex. \n\nA/RES/80/166 \nReport of the Special Committee on the Charter of the \nUnited Nations and on the Strengthening of the Role of \nthe Organization\n \n25-20864\n4/5 \n \nGeneral Assembly, on the subtopic \u201cExchange of information on State practices \nregarding the use of adaptation or combination of traditional means\u201d, while ensuring \nthat the other means of dispute settlement will be discussed at the subsequent sessions \nof the Special Committee; \n \n(b) \nAlso invites Member States to comment on the subtopics of the annual \ndebate in their general statements with a view to having the texts of those statements \nposted on the website of the Special Committee;10 \n \n(c) \nCalls upon the Special Committee to include a summary of the subtopics \nof the annual debate in its annual report for further consideration;  \n \n7. \nAlso recalls its endorsement of the decisions and recommendations \nadopted by the Special Committee at its 2016 session, in particular as set forth in \nparagraphs 2 and 3 of the annex to resolution 71/146;  \n \n8. \nInvites the Special Committee, at its session in 2026, to continue to \nidentify new subjects for consideration in its future work with a view to contributing \nto the revitalization of the work of the United Nations;  \n \n9. \nNotes the readiness of the Special Committee to provide, within its \nmandate, such assistance as may be sought at the request of other subsidiary bodies \nof the General Assembly in relation to any issues before them;  \n \n10. Requests the Special Committee to submit a report on its work to the \nGeneral Assembly at its eighty-first session;  \n \n11. Recognizes the important role of the International Court of Justice, the \nprincipal judicial organ of the United Nations, in adjudicating disputes among States \nand the value of its work, as well as the importance of having recourse to the Court \nin the peaceful settlement of disputes, notes that, consistent with Article 96 of the \nCharter, the Court\u2019s advisory jurisdiction may be requested by the General Assembly, \nthe Security Council or other authorized organs of the United Nations and the \nspecialized agencies, and requests the Secretary-General to distribute, in due course, \nthe advisory opinions requested by the principal organs of the United Nations as \nofficial documents of the United Nations;  \n \n12. Commends the Secretary-General for the progress made in the preparation \nof studies for the Repertory of Practice of United Nations Organs, including the use \nof the internship programme of the United Nations and cooperation with academic \ninstitutions for this purpose, as well as the progress made towards updating the \nRepertoire of the Practice of the Security Council;  \n \n13. Further encourages Member States to identify academic institutions that \nhave the capacity to contribute to the preparation of studies for the Repertory and to \nprovide the contact details of such institutions, and in this regard further welcomes \nthe initiative of the Secretariat also to invite members of the International Law \nCommission to recommend academic institutions that the Secretariat could contact \nfor this purpose;  \n \n14. Notes with appreciation the contributions made by Member States to the \ntrust fund for the elimination of the backlog in the Repertory and to the trust fund for \nthe updating of the Repertoire, as well as other contributions, including the sponsoring \nof associate experts to assist in the updating of the Repertoire;  \n \n15. Reiterates its call for voluntary contributions to the trust fund for the \nelimination of the backlog in the Repertory so as to further support the Secretariat in \ncarrying out the effective elimination of that backlog; voluntary contributions to the \n_______________ \n \n10 http://legal.un.org/committees/charter. \n\nReport of the Special Committee on the Charter of the \nUnited Nations and on the Strengthening of the Role of \nthe Organization \nA/RES/80/166\n \n5/5\n25-20864 \n \ntrust fund for the updating of the Repertoire so as to sustain the annual publication \nschedule; and the sponsoring, on a voluntary basis and with no cost to the United \nNations, of associate experts to assist in the updating of the two publications;  \n \n16. Calls upon the Secretary-General to continue his efforts towards updating \nthe two publications and making them available electronically in all their respective \nlanguage versions, and encourages the continued updating of the websites for the \nRepertory11 and for the Repertoire;12 \n \n17. Notes with concern that the backlog in the preparation of all volumes of \nthe Repertory, in particular volume III, although slightly reduced, has not been \neliminated, and calls upon the Secretary-General to address that issue effectively and \non a priority basis, while commending the Secretary-General for progress made in \nreducing the backlog;  \n \n18. Reiterates the responsibility of the Secretary-General for the quality of the \nRepertory and the Repertoire, and with regard to the Repertoire calls upon the \nSecretary-General to continue to follow the modalities outlined in paragraphs 102 to \n106 of his report dated 18 September 1952;13 \n \n19. Requests the Secretary-General to submit to the General Assembly at its \neighty-first session a report on both the Repertory and the Repertoire;  \n \n20. Decides to include in the provisional agenda of its eighty-first session the \nitem entitled \u201cReport of the Special Committee on the Charter of the United Nations \nand on the Strengthening of the Role of the Organization\u201d. \n \n64th plenary meeting \n15 December 2025 \n \n_______________ \n \n11 http://legal.un.org/repertory. \n \n12 www.un.org/securitycouncil/content/repertoire/structure. \n \n13 A/2170. \n",
  "paragraphs": {
    "1": "Takes note of the report of the Special Committee on the Charter of the United Nations and on the Strengthening of the Role of the Organization;",
    "2": "Decides that the Special Committee shall hold its next session from 18 to 26 February 2026; _______________ 2 Ibid., Sixty-first Session, Supplement No. 33 (A/61/33), para. 72. 3 A/80/210. 4 Resolution 60/1. 5 Official Records of the General Assembly, Sixtieth Session, Supplement No. 33 (A/60/33), para. 77. 6 Ibid., Eightieth Session, Supplement No. 33 (A/80/33). Report of the Special Committee on the Charter of the United Nations and on the Strengthening of the Role of the Organization A/RES/80/166 3/5 25-20864",
    "3": "Requests the Special Committee, at its session in 2026, in accordance with paragraph 5 of General Assembly resolution 50/52 of 11 December 1995: (a) To continue its consideration of all proposals concerning the question of the maintenance of international peace and security in all its aspects in order to strengthen the role of the United Nations and, in this context, to consider other proposals relating to the maintenance of international peace and security already submitted or which may be submitted to the Special Committee at its session in 2026, including strengthening the relationship and cooperation between the United Nations and regional organizations or arrangements in the peaceful settlement of disputes; (b) To consider, in accordance with paragraph 2 of the annex to resolution 71/146 of 13 December 2016, in an appropriate, substantive manner and framework, the question of the implementation of the provisions of the Charter of the United Nations relating to assistance to third States affected by the application of sanctions (Article 50 of the Charter) based on all of the related reports of the Secretary-General7 and the proposals submitted on the question, and requests the Secretary-General to submit the next report on this issue to the General Assembly at its eighty-second session; (c) To keep on its agenda the question of the peaceful settlement of disputes between States; (d) To consider, as appropriate, any proposal referred to it by the General Assembly in the implementation of the decisions of the high-level plenary meeting of the sixtieth session of the Assembly in September 2005 that concern the Charter and any amendments thereto; (e) To continue to consider, on a priority basis, ways and means of improving its working methods and enhancing its efficiency and utilization of resources with a view to identifying widely acceptable measures for future implementation;",
    "4": "Requests the Secretary-General, in accordance with paragraph 3 of the annex to resolution 71/146, to brief the Special Committee at its next session on the document entitled \u201cIntroduction and implementation of sanctions imposed by the United Nations\u201d contained in the annex to General Assembly resolution 64/115;",
    "5": "Also requests the Secretary-General to brief the Special Committee at its next session on the information referred to in paragraph 14 of his report on the implementation of the provisions of the Charter related to assistance to third States affected by the application of sanctions;8",
    "6": "Recalls its decision, in its resolution 72/118 of 7 December 2017, to undertake an annual thematic debate in the Special Committee, under the agenda item on the peaceful settlement of disputes, to discuss the means for the settlement of disputes, in accordance with Chapter VI of the Charter, including in particular those contained in Article 33 thereof, and consistent with the Manila Declaration on the Peaceful Settlement of International Disputes,9 and in that regard: (a) Invites Member States, bearing in mind paragraph 5 (b) of its resolution 77/109 of 7 December 2022, to focus their comments during the thematic debate, to be held at the next session of the Special Committee, at the eightieth session of the _______________ 7 A/48/573-S/26705, A/49/356, A/50/60-S/1995/1, A/50/361, A/50/423, A/51/317, A/52/308, A/53/312, A/54/383, A/54/383/Add.1, A/55/295, A/55/295/Add.1, A/56/303, A/57/165, A/57/165/Add.1, A/58/346, A/59/334, A/60/320, A/61/304, A/62/206, A/62/206/Corr.1, A/63/224, A/64/225, A/65/217, A/66/213, A/67/190, A/68/226, A/69/119, A/70/119, A/71/166, A/72/136, A/74/152, A/76/186, A/78/114 and A/80/151. 8 A/80/151. 9 Resolution 37/10, annex. A/RES/80/166 Report of the Special Committee on the Charter of the United Nations and on the Strengthening of the Role of the Organization 25-20864 4/5 General Assembly, on the subtopic \u201cExchange of information on State practices regarding the use of adaptation or combination of traditional means\u201d, while ensuring that the other means of dispute settlement will be discussed at the subsequent sessions of the Special Committee; (b) Also invites Member States to comment on the subtopics of the annual debate in their general statements with a view to having the texts of those statements posted on the website of the Special Committee;10 (c) Calls upon the Special Committee to include a summary of the subtopics of the annual debate in its annual report for further consideration;",
    "7": "Also recalls its endorsement of the decisions and recommendations adopted by the Special Committee at its 2016 session, in particular as set forth in paragraphs 2 and 3 of the annex to resolution 71/146;",
    "8": "Invites the Special Committee, at its session in 2026, to continue to identify new subjects for consideration in its future work with a view to contributing to the revitalization of the work of the United Nations;",
    "9": "Notes the readiness of the Special Committee to provide, within its mandate, such assistance as may be sought at the request of other subsidiary bodies of the General Assembly in relation to any issues before them;",
    "10": "Requests the Special Committee to submit a report on its work to the General Assembly at its eighty-first session;",
    "11": "Recognizes the important role of the International Court of Justice, the principal judicial organ of the United Nations, in adjudicating disputes among States and the value of its work, as well as the importance of having recourse to the Court in the peaceful settlement of disputes, notes that, consistent with Article 96 of the Charter, the Court\u2019s advisory jurisdiction may be requested by the General Assembly, the Security Council or other authorized organs of the United Nations and the specialized agencies, and requests the Secretary-General to distribute, in due course, the advisory opinions requested by the principal organs of the United Nations as official documents of the United Nations;",
    "12": "Commends the Secretary-General for the progress made in the preparation of studies for the Repertory of Practice of United Nations Organs, including the use of the internship programme of the United Nations and cooperation with academic institutions for this purpose, as well as the progress made towards updating the Repertoire of the Practice of the Security Council;",
    "13": "Further encourages Member States to identify academic institutions that have the capacity to contribute to the preparation of studies for the Repertory and to provide the contact details of such institutions, and in this regard further welcomes the initiative of the Secretariat also to invite members of the International Law Commission to recommend academic institutions that the Secretariat could contact for this purpose;",
    "14": "Notes with appreciation the contributions made by Member States to the trust fund for the elimination of the backlog in the Repertory and to the trust fund for the updating of the Repertoire, as well as other contributions, including the sponsoring of associate experts to assist in the updating of the Repertoire;",
    "15": "Reiterates its call for voluntary contributions to the trust fund for the elimination of the backlog in the Repertory so as to further support the Secretariat in carrying out the effective elimination of that backlog; voluntary contributions to the _______________ 10 http://legal.un.org/committees/charter. Report of the Special Committee on the Charter of the United Nations and on the Strengthening of the Role of the Organization A/RES/80/166 5/5 25-20864 trust fund for the updating of the Repertoire so as to sustain the annual publication schedule; and the sponsoring, on a voluntary basis and with no cost to the United Nations, of associate experts to assist in the updating of the two publications;",
    "16": "Calls upon the Secretary-General to continue his efforts towards updating the two publications and making them available electronically in all their respective language versions, and encourages the continued updating of the websites for the Repertory11 and for the Repertoire;12",
    "17": "Notes with concern that the backlog in the preparation of all volumes of the Repertory, in particular volume III, although slightly reduced, has not been eliminated, and calls upon the Secretary-General to address that issue effectively and on a priority basis, while commending the Secretary-General for progress made in reducing the backlog;",
    "18": "Reiterates the responsibility of the Secretary-General for the quality of the Repertory and the Repertoire, and with regard to the Repertoire calls upon the Secretary-General to continue to follow the modalities outlined in paragraphs 102 to 106 of his report dated 18 September 1952;13",
    "19": "Requests the Secretary-General to submit to the General Assembly at its eighty-first session a report on both the Repertory and the Repertoire;",
    "20": "Decides to include in the provisional agenda of its eighty-first session the item entitled \u201cReport of the Special Committee on the Charter of the United Nations and on the Strengthening of the Role of the Organization\u201d. 64th plenary meeting 15 December 2025 _______________ 11 http://legal.un.org/repertory. 12 www.un.org/securitycouncil/content/repertoire/structure. 13 A/2170."
  },
  "agenda_items": [
    "Item 83"
  ],
  "symbol_references": []
}