{
  "symbol": "A/RES/75/82",
  "filename": "A_RES_75_82.pdf",
  "title": "75/82. Fortieth anniversary of the United Nations Institute for Disarmament Research",
  "text": "United Nations \nA/RES/75/82 \n \n \nGeneral Assembly \nDistr.: General \n18 December 2020 \n \n20-16913 (E)    221220     \n*2016913* \n \n \nSeventy-fifth session \nAgenda item 105 \nReview of the implementation of the recommendations \nand decisions adopted by the General Assembly at its \ntenth special session  \n \n \n \n \n Resolution adopted by the General Assembly \non 7 December 2020 \n \n \n \n \n[on the report of the First Committee (A/75/401, para. 16)] \n \n \n \n75/82. Fortieth anniversary of the United Nations Institute for \nDisarmament Research \n \n \n \nThe General Assembly, \n \nRecalling its resolution 34/83 M of 11 December 1979, in which it requested the \nSecretary-General to establish the United Nations Institute for Disarmament \nResearch, and its resolution 39/148 H of 17 December 1984, in which it approved the \nstatute of the Institute, \n \nRecalling also its resolutions 45/62 G of 4 December 1990, 55/35 A of \n20 November 2000, 60/89 of 8 December 2005, 65/87 of 8 December 2010 and 70/69 \nof 11 December 2015 on the tenth, twentieth, twenty-fifth, thirtieth and thirty-fifth \nanniversaries of the Institute, \n \nConsidering the continuing need for the international community to have access \nto independent and in-depth research on security issues and prospects for \ndisarmament and non-proliferation, \n \nUnderlining the particularly relevant contribution of the Institute to thinking \nand analysis on international security issues in the current context,  \n \nRecognizing the potential of the Institute, through its research, seminars, \nnetworks, outreach activities and publications, to assist ongoing negotiations on \ndisarmament and efforts at ensuring greater international security at a progressively \nlower level of armaments and to contribute to education in this regard,  \n \nWelcoming the increased level of research and activity of the Institute, the \nincrease in the number and range of research publications and their relevance for \nmultilateral disarmament discussions, as well as the increase in the range of activities, \n \nWelcoming also the increased outreach and conduct of the Institute\u2019s activities \nin Geneva and in diverse geographical locations, \n\nA/RES/75/82 \nFortieth anniversary of the United Nations\nInstitute for Disarmament Research\n \n20-16913\n2/2 \n \n \nRecognizing that, despite the coronavirus disease (COVID-19) pandemic, the \nInstitute managed to uphold its activities,  \n \nReiterating its preoccupation over the unsustainable financing situation of the \ninstitutional operations budget of the Institute, \n \nRecognizing that a viable solution to the Institute\u2019s financial challenges will be \ninstrumental for the Institute, as an autonomous institution within the framework of \nthe United Nations, to fulfil Member States\u2019 expectations to take forward its mandate \nto promote informed participation by all States in disarmament efforts, assist ongoing \nnegotiations and carry out in-depth, forward-looking and long-term research on \ndisarmament,  \n \nRecognizing also the importance of the Institute\u2019s location in Geneva,  \n \nNoting the new financial and logistical difficulties that have arisen as a \nconsequence of the introduction of rental costs for accommodation in the Palais des \nNations, \n \nNoting also the lack of implementation to date of the recommendations of the \nSecretary-General in his report on a sustainable and stable funding structure and \noperating model for the Institute that drew on the assessment by an independent third \nparty requested by Member States in resolution 70/69,1 as well as the long-standing \nobservations and recommendations of the Advisory Board on Disarmament Matters, \nthe Board of Trustees of the Institute, contained in the latest report of the Secretary-\nGeneral on its work,2 \n \n1. \nWelcomes the fortieth anniversary of the establishment of the United \nNations Institute for Disarmament Research;  \n \n2. \nRecognizes the importance, the timeliness and the high quality of the work \nof the Institute;  \n \n3. \nReiterates its conviction that the Institute should continue to conduct \nindependent research on problems relating to disarmament and security and to \nundertake specialized research requiring a high degree of expertise;  \n \n4. \nEmphasizes the importance of the Institute as a stand-alone, autonomous \ninstitution that contributes, through its research, analysis and activities, to progress \nin disarmament and, ultimately, to a more secure world;  \n \n5. \nUnderlines the contribution that the Institute makes and should continue \nto make in the field of disarmament and non-proliferation education in all regions of \nthe world;  \n \n6. \nAppeals to all Member States to continue to make financial contributions \nto the Institute, if possible multi-annual, and strongly encourages them to unearmark \nthese contributions so as to contribute to its viability, independence and impartiality \nand the quality of its work over the long term;  \n \n7. \nRequests the Secretary-General to continue to provide accommodation for \nthe Institute in the Palais des Nations in Geneva at the reduced rate established to \ncover operational expenses only; \n \n8. \nInvites the Secretary-General to submit, in the context of the 2022 \nprogramme budget, a proposal for an increase in the subvention to the Institute. \n \n37th plenary meeting \n7 December 2020 \n \n__________________ \n \n1 A/73/284. \n \n2 A/75/283. \n",
  "paragraphs": {
    "1": "Welcomes the fortieth anniversary of the establishment of the United Nations Institute for Disarmament Research;",
    "2": "Recognizes the importance, the timeliness and the high quality of the work of the Institute;",
    "3": "Reiterates its conviction that the Institute should continue to conduct independent research on problems relating to disarmament and security and to undertake specialized research requiring a high degree of expertise;",
    "4": "Emphasizes the importance of the Institute as a stand-alone, autonomous institution that contributes, through its research, analysis and activities, to progress in disarmament and, ultimately, to a more secure world;",
    "5": "Underlines the contribution that the Institute makes and should continue to make in the field of disarmament and non-proliferation education in all regions of the world;",
    "6": "Appeals to all Member States to continue to make financial contributions to the Institute, if possible multi-annual, and strongly encourages them to unearmark these contributions so as to contribute to its viability, independence and impartiality and the quality of its work over the long term;",
    "7": "Requests the Secretary-General to continue to provide accommodation for the Institute in the Palais des Nations in Geneva at the reduced rate established to cover operational expenses only;",
    "8": "Invites the Secretary-General to submit, in the context of the 2022 programme budget, a proposal for an increase in the subvention to the Institute. 37th plenary meeting 7 December 2020 __________________ 1 A/73/284. 2 A/75/283."
  },
  "agenda_items": [
    "Item 105"
  ],
  "symbol_references": []
}