{
  "symbol": "A/RES/75/203",
  "filename": "A_RES_75_203.pdf",
  "title": "75/203. International trade and development",
  "text": "United Nations \nA/RES/75/203\n \n \nGeneral Assembly \nDistr.: General \n29 December 2020 \n \n \n20-17617 (E)    060121 \n*2017617* \n \n \nSeventy-fifth session \nAgenda item 17 (a) \nMacroeconomic policy questions: international trade \nand development  \n \n \n \n \n Resolution adopted by the General Assembly \non 21 December 2020 \n \n \n \n \n[on the report of the Second Committee (A/75/455/Add.1, para. 6)] \n \n \n 75/203. International trade and development \n \n \n \nThe General Assembly, \n \nRecalling its resolutions 56/178 of 21 December 2001, 57/235 of 20 December \n2002, 58/197 of 23 December 2003, 59/221 of 22 December 2004, 60/184 of \n22 December 2005, 61/186 of 20 December 2006, 62/184 of 19 December 2007, \n63/203 of 19 December 2008, 64/188 of 21 December 2009, 65/142 of 20 December \n2010, 66/185 of 22 December 2011, 67/196 of 21 December 2012, 68/199 of \n20 December 2013, 69/205 of 19 December 2014, 70/187 of 22 December 2015, \n71/214 of 21 December 2016, 72/202 of 20 December 2017, 73/219 of 20 December \n2018 and 74/201 of 19 December 2019, \n \nReaffirming its resolution 70/1 of 25 September 2015, entitled \u201cTransforming our \nworld: the 2030 Agenda for Sustainable Development\u201d, in which it adopted a \ncomprehensive, far-reaching and people-centred set of universal and transformative \nSustainable Development Goals and targets, its commitment to working tirelessly for the \nfull implementation of the Agenda by 2030, its recognition that eradicating poverty in all \nits forms and dimensions, including extreme poverty, is the greatest global challenge and \nan indispensable requirement for sustainable development, its commitment to achieving \nsustainable development in its three dimensions \u2013 economic, social and environmental \u2013 \nin a balanced and integrated manner, and to building upon the achievements of the \nMillennium Development Goals and seeking to address their unfinished business,  \n \nReaffirming also its resolution 69/313 of 27 July 2015 on the Addis Ababa \nAction Agenda of the Third International Conference on Financing for Development, \nwhich is an integral part of the 2030 Agenda for Sustainable Development, supports \nand complements it, helps to contextualize its means of implementation targets with \nconcrete policies and actions, and reaffirms the strong political commitment to \naddress the challenge of financing and creating an enabling environment at all levels \nfor sustainable development in the spirit of global partnership and solidarity,  \n\nA/RES/75/203 \nInternational trade and development\n \n2/4 \n \n \nRecognizing the need to ensure that the benefits of trade are more widely shared,  \n \nReaffirming World Trade Organization decision WT/MIN(15)/48-WT/L/982 of 19 \nDecember 2015 on the implementation of preferential treatment in favour of services \nand service suppliers of the least developed countries and increasing their participation \nin services trade and decision WT/L/508/Add.1 of 25 July 2012 on accession by the \nleast developed countries, encouraging progress on the implementation of the World \nTrade Organization work programme on small economies, which supports their efforts \ntowards sustainable development, as also reflected in the outcome document of the third \nInternational Conference on Small Island Developing States, the SIDS Accelerated \nModalities of Action (SAMOA) Pathway,1 and stressing that Aid for Trade and targeted \ntrade-related capacity-building are essential to integrating developing countries, in \nparticular the least developed countries, landlocked developing countries and small \nisland developing States, into the international trading system, \n \nRecognizing the critical role of women as producers and traders and the need to \naddress their specific challenges in order to facilitate their equal and active \nparticipation in domestic, regional and international trade, \n \nRecognizing also that multilateral rules and disciplines are the best guarantee \nagainst protectionism and are fundamental to the transparency, predictability and \nstability of international trade, \n \nNoting the commitments to working to ensure that bilateral, regional and \nplurilateral trade agreements complement the multilateral trading system, recognizing \nthat they can play an important role in complementing global liberalization initiatives, \nand in this regard recalling the entry into force of the Agreement Establishing the \nAfrican Continental Free Trade Area, on 30 May 2019, \n \nNoting with great concern the threat to human health, safety and well-being \ncaused by the coronavirus disease (COVID-19) pandemic, as well as the severe \ndisruption to societies and economies and the devastating impact on lives and \nlivelihoods, and that the poorest and most vulnerable are the hardest hit by the \npandemic, reaffirming the ambition to get back on track to achieve the Sustainable \nDevelopment Goals by designing sustainable and inclusive recovery strategies to \naccelerate progress towards the full implementation of the 2030 Agenda and to help to \nreduce the risk of future shocks, and recognizing that the COVID-19 pandemic requires \na global response based on unity, solidarity and renewed multilateral cooperation, \n \nDeeply concerned that the COVID-19 pandemic, owing to its severe disruptions \nto societies, economies, employment, global trade, supply chains and travel, as well as \nto agricultural, industrial and commercial systems, is having a devastating impact on \nsustainable development and humanitarian needs, including on poverty eradication, \nlivelihoods, ending hunger, food security and nutrition, education, environmentally \nsound waste management and access to health care, especially for the poor and people \nin vulnerable situations, in particular in developing countries, including countries in \nspecial situations and those countries most affected by the pandemic and its \nsocioeconomic consequences, and is making the prospect of achieving all Sustainable \nDevelopment Goals more difficult, including eradicating poverty in all its forms and \ndimensions by 2030, ending hunger and achieving food security and improved nutrition,  \n \nReiterating the pledge that no one will be left behind, reaffirming the \nrecognition that the dignity of the human person is fundamental, and the wish to see \nthe Goals and targets met for all nations and peoples and for all segments of society, \nand recommitting to endeavour to reach the furthest behind first, \n__________________ \n \n1  Resolution 69/15, annex. \n\nInternational trade and development \nA/RES/75/203\n \n3/4\n20-17617 \n \n \n1. \nTakes note of the report of the Trade and Development Board of the United \nNations Conference on Trade and Development2 and the note by the Secretary-General;3 \n \n2. \nReaffirms that international trade is an engine for inclusive growth and \npoverty eradication and that it contributes to the promotion of sustainable development, \nstructural transformation and industrialization, particularly in developing countries; \n \n3. \nReiterates that States will not be able to achieve the ambitious Goals and \ntargets of the 2030 Agenda for Sustainable Development 4 without a revitalized and \nenhanced global partnership and comparably ambitious means of implementation, and \nthat a revitalized global partnership will facilitate an intensive global engagement in \nsupport of the implementation of the 2030 Agenda, bringing together Governments, \ncivil society, the private sector, the United Nations system and other actors and \nmobilizing all available resources; \n \n4. \nReaffirms the commitments made through the adoption of the Addis Ababa \nAction Agenda of the Third International Conference on Financing for Development5 in, \ninter alia, international trade as an important action area for sustainable development; \n \n5. \nNotes with concern that the World Trade Organization is increasingly \naffected by insufficient progress in multilateral trade negotiations and that it is \nimperative for the World Trade Organization to address issues that are at the heart of \ncurrent problems in international trade, and recognizes in this regard the need to \nstrengthen the World Trade Organization, with a view to ensuring the continued viability \nand effectiveness of its dispute settlement, negotiating and monitoring functions; \n \n6. \nRecommits firmly to promoting a universal, rules-based, open, transparent, \npredictable, inclusive, non-discriminatory and equitable multilateral trading system \nunder the World Trade Organization, as well as meaningful trade liberalization; \n \n7. \nEmphasizes the urgent need to combat protectionism in all its forms and \nto rectify any trade-distorting measures that are inconsistent with World Trade \nOrganization rules, recognizing the right of countries, in particular developing \ncountries, to fully utilize flexibilities consistent with their World Trade Organization \ncommitments and obligations, and also emphasizes that the work of the World Trade \nOrganization shall maintain development at its centre, with provisions for special and \ndifferential treatment remaining integral; \n \n8. \nAlso emphasizes that the COVID-19 pandemic has disrupted the normal \nfunctioning of open markets, global supply chain connectivity and the flow of \nessential goods and services, and that these disruptions hinder the fight against \npoverty, hunger and inequality, ultimately undermining efforts to achieve the 2030 \nAgenda, reaffirms that emergency measures must be targeted, proportionate, \ntransparent and temporary, that they must not create unnecessary barriers to trade or \ndisruption to global supply chains, and that they must be consistent with World Trade \nOrganization rules, and calls upon Member States to reaffirm the critical importance \nof connected global supply chains in ensuring the unimpeded flow of vital medical \nand food supplies and other essential goods and services across borders, by air, by \nland and by sea, and to encourage cooperation to facilitate cross-border travel of \npersons for essential purposes without undermining efforts to prevent the spread of \nthe virus, highlights, in this regard, the critical role of digital technologies in \nsustaining business continuity and supply chains throughout the COVID-19 \npandemic, and to strengthen cooperation among the World Trade Organization, the \nUnited Nations Conference on Trade and Development and other trade-related \n__________________ \n \n2  A/75/15 (Part I). \n \n3  A/75/225. \n \n4  Resolution 70/1. \n \n5  Resolution 69/313, annex. \n\nA/RES/75/203 \nInternational trade and development\n \n4/4 \n \norganizations and forums, as well as to promote further economic integration through \nregional trade agreements to ensure faster trade recovery and development as an \nimportant source of world economic growth, and in this regard welcomes the \nAgreement Establishing the African Continental Free Trade Area; \n \n9. \nUrges the international community to adopt urgent and effective measures \nto eliminate the use of unilateral economic, financial or trade measures that are not \nauthorized by relevant organs of the United Nations, that are inconsistent with the \nprinciples of international law or the Charter of the United Nations or that contravene \nthe basic principles of the multilateral trading system and that affect, in particular, \nbut not exclusively, developing countries; \n \n10. Calls upon all members of the World Trade Organization to urgently \nconclude negotiations on fisheries subsidies in 2020, consistent with the decision of \nthe eleventh Ministerial Conference of the World Trade Organization 6 and with a view \nto meeting the Sustainable Development Goals; \n \n11. \nUnderlines the importance of the Agreement on Trade Facilitation annexed \nto the Protocol amending the Marrakesh Agreement Establishing the World Trade \nOrganization in improving transparency, expediting the movement, release and \nclearance of goods, including goods in transit, and thereby reducing trade costs, and \nin this regard encourages its full and effective implementation, including through \nenhanced support towards its implementation; \n \n12. Looks forward to the convening of the fifteenth session of the United \nNations Conference on Trade and Development in Barbados from 25 to 30 April 2021; \n \n13. Welcomes the proposal to convene the twelfth Ministerial Conference of \nthe World Trade Organization in June 2021, looks forward to achieving positive \noutcomes in a balanced, inclusive and transparent way, and expresses its appreciation \nto the Government of Kazakhstan for offering to host the meeting; \n \n14. Reiterates the important role of the United Nations Conference on Trade \nand Development as the focal point within the United Nations system for the \nintegrated treatment of trade and development and interrelated issues in the areas of \nfinance, technology, investment and sustainable development, and in contributing to \nsupporting the implementation of the 2030 Agenda; \n \n15. Reaffirms the commitment at the very heart of the 2030 Agenda to leave no \none behind and commit to taking more tangible steps to support people in vulnerable \nsituations and the most vulnerable countries and to reach the furthest behind first; \n \n16. Requests the Secretary-General, in collaboration with the secretariat of the \nUnited Nations Conference on Trade and Development, to submit to the General \nAssembly at its seventy-sixth session a report on the implementation of the present \nresolution and on developments in the international trading system, including \nconcrete recommendations to accelerate the implementation of the Addis Ababa \nAction Agenda in this regard, and decides to include in the provisional agenda of its \nseventy-sixth session, under the item entitled \u201cMacroeconomic policy questions\u201d, the \nsub-item entitled \u201cInternational trade and development\u201d. \n \n48th plenary meeting \n21 December 2020 \n \n__________________ \n \n6  WT/MIN(17)/64-WT/L/1031 of 13 December 2017. \n",
  "paragraphs": {
    "1": "Takes note of the report of the Trade and Development Board of the United Nations Conference on Trade and Development2 and the note by the Secretary-General;3",
    "2": "Reaffirms that international trade is an engine for inclusive growth and poverty eradication and that it contributes to the promotion of sustainable development, structural transformation and industrialization, particularly in developing countries;",
    "3": "Reiterates that States will not be able to achieve the ambitious Goals and targets of the 2030 Agenda for Sustainable Development 4 without a revitalized and enhanced global partnership and comparably ambitious means of implementation, and that a revitalized global partnership will facilitate an intensive global engagement in support of the implementation of the 2030 Agenda, bringing together Governments, civil society, the private sector, the United Nations system and other actors and mobilizing all available resources;",
    "4": "Reaffirms the commitments made through the adoption of the Addis Ababa Action Agenda of the Third International Conference on Financing for Development5 in, inter alia, international trade as an important action area for sustainable development;",
    "5": "Notes with concern that the World Trade Organization is increasingly affected by insufficient progress in multilateral trade negotiations and that it is imperative for the World Trade Organization to address issues that are at the heart of current problems in international trade, and recognizes in this regard the need to strengthen the World Trade Organization, with a view to ensuring the continued viability and effectiveness of its dispute settlement, negotiating and monitoring functions;",
    "6": "Recommits firmly to promoting a universal, rules-based, open, transparent, predictable, inclusive, non-discriminatory and equitable multilateral trading system under the World Trade Organization, as well as meaningful trade liberalization;",
    "7": "Emphasizes the urgent need to combat protectionism in all its forms and to rectify any trade-distorting measures that are inconsistent with World Trade Organization rules, recognizing the right of countries, in particular developing countries, to fully utilize flexibilities consistent with their World Trade Organization commitments and obligations, and also emphasizes that the work of the World Trade Organization shall maintain development at its centre, with provisions for special and differential treatment remaining integral;",
    "8": "Also emphasizes that the COVID-19 pandemic has disrupted the normal functioning of open markets, global supply chain connectivity and the flow of essential goods and services, and that these disruptions hinder the fight against poverty, hunger and inequality, ultimately undermining efforts to achieve the 2030 Agenda, reaffirms that emergency measures must be targeted, proportionate, transparent and temporary, that they must not create unnecessary barriers to trade or disruption to global supply chains, and that they must be consistent with World Trade Organization rules, and calls upon Member States to reaffirm the critical importance of connected global supply chains in ensuring the unimpeded flow of vital medical and food supplies and other essential goods and services across borders, by air, by land and by sea, and to encourage cooperation to facilitate cross-border travel of persons for essential purposes without undermining efforts to prevent the spread of the virus, highlights, in this regard, the critical role of digital technologies in sustaining business continuity and supply chains throughout the COVID-19 pandemic, and to strengthen cooperation among the World Trade Organization, the United Nations Conference on Trade and Development and other trade-related __________________ 2 A/75/15 (Part I). 3 A/75/225. 4 Resolution 70/1. 5 Resolution 69/313, annex. A/RES/75/203 International trade and development 4/4 organizations and forums, as well as to promote further economic integration through regional trade agreements to ensure faster trade recovery and development as an important source of world economic growth, and in this regard welcomes the Agreement Establishing the African Continental Free Trade Area;",
    "9": "Urges the international community to adopt urgent and effective measures to eliminate the use of unilateral economic, financial or trade measures that are not authorized by relevant organs of the United Nations, that are inconsistent with the principles of international law or the Charter of the United Nations or that contravene the basic principles of the multilateral trading system and that affect, in particular, but not exclusively, developing countries;",
    "10": "Calls upon all members of the World Trade Organization to urgently conclude negotiations on fisheries subsidies in 2020, consistent with the decision of the eleventh Ministerial Conference of the World Trade Organization 6 and with a view to meeting the Sustainable Development Goals;",
    "11": "Underlines the importance of the Agreement on Trade Facilitation annexed to the Protocol amending the Marrakesh Agreement Establishing the World Trade Organization in improving transparency, expediting the movement, release and clearance of goods, including goods in transit, and thereby reducing trade costs, and in this regard encourages its full and effective implementation, including through enhanced support towards its implementation;",
    "12": "Looks forward to the convening of the fifteenth session of the United Nations Conference on Trade and Development in Barbados from 25 to 30 April 2021;",
    "13": "Welcomes the proposal to convene the twelfth Ministerial Conference of the World Trade Organization in June 2021, looks forward to achieving positive outcomes in a balanced, inclusive and transparent way, and expresses its appreciation to the Government of Kazakhstan for offering to host the meeting;",
    "14": "Reiterates the important role of the United Nations Conference on Trade and Development as the focal point within the United Nations system for the integrated treatment of trade and development and interrelated issues in the areas of finance, technology, investment and sustainable development, and in contributing to supporting the implementation of the 2030 Agenda;",
    "15": "Reaffirms the commitment at the very heart of the 2030 Agenda to leave no one behind and commit to taking more tangible steps to support people in vulnerable situations and the most vulnerable countries and to reach the furthest behind first;",
    "16": "Requests the Secretary-General, in collaboration with the secretariat of the United Nations Conference on Trade and Development, to submit to the General Assembly at its seventy-sixth session a report on the implementation of the present resolution and on developments in the international trading system, including concrete recommendations to accelerate the implementation of the Addis Ababa Action Agenda in this regard, and decides to include in the provisional agenda of its seventy-sixth session, under the item entitled \u201cMacroeconomic policy questions\u201d, the sub-item entitled \u201cInternational trade and development\u201d. 48th plenary meeting 21 December 2020 __________________ 6 WT/MIN(17)/64-WT/L/1031 of 13 December 2017."
  },
  "agenda_items": [
    "Item 17"
  ],
  "symbol_references": []
}