{
  "symbol": "A/RES/77/22",
  "filename": "A_RES_77_22.pdf",
  "title": "77/22. Committee on the Exercise of the Inalienable Rights of the Palestinian People",
  "text": "United Nations \nA/RES/77/22\n \n \nGeneral Assembly \nDistr.: General \n5 December 2022 \n \n22-27257 (E)    081222 \n*2227257* \n \n \nSeventy-seventh session \nAgenda item 33 \nQuestion of Palestine \n \n \n \n \n Resolution adopted by the General Assembly \non 30 November 2022 \n \n \n \n \n[without reference to a Main Committee (A/77/L.23)] \n \n \n \n77/22. Committee on the Exercise of the Inalienable Rights of the \nPalestinian People \n \n \n \nThe General Assembly, \n \nRecalling its resolutions 181 (II) of 29 November 1947, 194 (III) of \n11 December 1948, 3236 (XXIX) of 22 November 1974, 3375 (XXX) and 3376 \n(XXX) of 10 November 1975, 31/20 of 24 November 1976 and all its subsequent \nrelevant resolutions, including those adopted at its emergency special sessions and its \nresolution 75/20 of 2 December 2020, \n \nRecalling also its resolution 58/292 of 6 May 2004, \n \nHaving considered the report of the Committee on the Exercise of the \nInalienable Rights of the Palestinian People,1 \n \nRecalling the mutual recognition between the Government of the State of Israel \nand the Palestine Liberation Organization, the representative of the Palestinian \npeople, as well as the existing agreements between the two sides and the need for full \ncompliance with those agreements, \n \nAffirming its support for a comprehensive, just, lasting and peaceful settlement \nto the Israeli-Palestinian conflict on the basis of the relevant United Nations \nresolutions, the terms of reference of the Madrid Conference, including the principle \nof land for peace, the Arab Peace Initiative adopted by the Council of the League of \nArab States at its fourteenth session2 and the Quartet road map to a permanent two-\nState solution to the Israeli-Palestinian conflict,3 endorsed by the Security Council in \nresolution 1515 (2003) of 19 November 2003, \n__________________ \n \n1 Official Records of the General Assembly, Seventy-seventh Session, Supplement No. 35 (A/77/35). \n \n2 A/56/1026-S/2002/932, annex II, resolution 14/221. \n \n3 S/2003/529, annex. \n\nA/RES/77/22 \nCommittee on the Exercise of the Inalienable Rights of the \nPalestinian People\n \n22-27257\n2/4 \n \n \nRecalling the relevant Security Council resolutions, including resolution 2334 \n(2016) of 23 December 2016, and underscoring in this regard, inter alia, the call upon \nall parties to continue, in the interest of the promotion of peace and security, to exert \ncollective efforts to launch credible negotiations on all final status issues in the \nMiddle East peace process and within the time frame specified by the Quartet in its \nstatement of 21 September 2010, \n \nRecalling also the advisory opinion rendered on 9 July 2004 by the International \nCourt of Justice on the legal consequences of the construction of a wall in the \nOccupied Palestinian Territory, 4 and recalling further its resolutions ES-10/15 of \n20 July 2004 and ES-10/17 of 15 December 2006, \n \nTaking note of the application of Palestine for admission to membership in the \nUnited Nations, submitted on 23 September 2011,5 \n \nRecalling its resolution 67/19 of 29 November 2012, by which, inter alia, \nPalestine was accorded non-member observer State status in the United Nations, and \ntaking note of the follow-up report of the Secretary-General,6 \n \nTaking note of the accession by Palestine to several human rights treaties and \nthe core humanitarian law conventions, as well as other international treaties, \n \nNoting with deep regret the passage of 55 years since the onset of the Israeli \noccupation and 75 years since the adoption of resolution 181 (II) on 29 November \n1947 and the Nakba without tangible progress towards a peaceful solution, and \nstressing the urgent need for efforts to reverse the negative trends on the ground and \nto restore a political horizon for advancing and accelerating meaningful negotiations \naimed at the achievement of a peace agreement that will bring a complete end to the \nIsraeli occupation that began in 1967 and the resolution of all core final status issues, \nwithout exception, leading to a peaceful, just, lasting and comprehensive solution to \nthe question of Palestine, \n \nReaffirming that the United Nations has a permanent responsibility towards the \nquestion of Palestine until the question is resolved in all its aspects in a satisfactory \nmanner in accordance with international legitimacy, \n \n1. \nExpresses its appreciation to the Committee on the Exercise of the \nInalienable Rights of the Palestinian People for its efforts in performing the tasks \nassigned to it by the General Assembly aimed at achieving a peaceful settlement of \nthe question of Palestine, an expanded multilateral framework for the revitalization \nof peace efforts and ensuring fullest accountability and implementation of the long-\nstanding parameters for peace in accordance with the relevant United Nations \nresolutions; \n \n2. \nRequests the Committee to continue to exert all efforts to promote the \nrealization of the inalienable rights of the Palestinian people, including their right to \nself-determination, to support the achievement without delay of an end to the Israeli \noccupation that began in 1967 and of the two-State solution on the basis of the \npre-1967 borders and the just resolution of all final status issues and to mobilize \ninternational support for and assistance to the Palestinian people, and to report \nthereon to the General Assembly at its seventy-eighth session and thereafter; \n \n3. \nAlso requests the Committee to continue to keep under review the situation \nrelating to the question of Palestine and make suggestions to the General Assembly, \nthe Security Council or the Secretary-General, as appropriate; \n__________________ \n \n4 See A/ES-10/273 and A/ES-10/273/Corr.1. \n \n5 A/66/371-S/2011/592, annex I. \n \n6 A/67/738. \n\nCommittee on the Exercise of the Inalienable Rights of the \nPalestinian People \nA/RES/77/22\n \n3/4\n22-27257 \n \n \n4. \nFurther requests the Committee to continue to extend its cooperation and \nsupport to Palestinian and other civil society organizations and to continue to involve \nadditional civil society organizations and parliamentarians in its work in order to \nmobilize international solidarity and support for the Palestinian people and for \nrestoring a political horizon and advancing just, lasting and comprehensive peace, \nparticularly during this critical period of political instability, further reduction of civic \nspace in the Occupied Palestinian Territory, including East Jerusalem, humanitarian \nhardship and financial crisis, with the overall aim of promoting the achievement by \nthe Palestinian people of their inalienable rights and a just, lasting and peaceful \nsettlement of the question of Palestine, the core of the Arab-Israeli conflict, on the \nbasis of the relevant United Nations resolutions, the terms of reference of the Madrid \nConference, including the principle of land for peace, the Arab Peace Initiative and \nthe Quartet road map; \n \n5. \nCommends the Committee on its efforts and activities in upholding its \nmandate, including through cooperative initiatives with Governments, relevant \norganizations of the United Nations system, intergovernmental organizations and civil \nsociety organizations; \n \n6. \nCommends the Working Group of the Committee on its efforts in \ncoordinating the efforts of international and regional civil society organizations \nregarding the question of Palestine; \n \n7. \nRequests the United Nations Conciliation Commission for Palestine, \nestablished under General Assembly resolution 194 (III), and other United Nations \nbodies associated with the question of Palestine to continue to cooperate fully with \nthe Committee and to make available to it, at its request, the relevant information and \ndocumentation that they have at their disposal; \n \n8. \nInvites all Governments and organizations to extend their cooperation and \nsupport to the Committee in the performance of its tasks, recalling its repeated call \nfor all States and the specialized agencies and organizations of the United Nations \nsystem to continue to support and assist the Palestinian people in the early realization \nof their right to self-determination, including the right to their independent State of \nPalestine, and to support the development and strengthening of Palestinian \ninstitutions and Palestinian State-building efforts in preparation for independence; \n \n9. \nRequests the United Nations Conference on Trade and Development to \ncontinue to report to the General Assembly on economic development in the Occupied \nPalestinian Territory, including East Jerusalem, and the economic costs of the Israeli \noccupation for the Palestinian people, and, while drawing attention to the alarming \nfindings, as reflected in the recent reports7 in this regard, calls for the exertion of all \nefforts for the provision of the resources necessary to expedite the completion and \npublication of the report, including the facilitation and coordination of pertinent \ninputs from the relevant organs, bodies and agencies of the United Nations system; \n \n10. Requests the Secretary-General to circulate the report of the Committee to \nall the competent bodies of the United Nations, and urges them to take the necessary \naction, as appropriate; \n \n11. \nRequests the Committee, bearing in mind the regrettable absence of \ntangible progress towards a peaceful solution, to continue to focus its activities on \nefforts and initiatives to end the Israeli occupation that began in 1967 and to organize \nactivities in this regard, within existing resources and in cooperation with Governments, \nrelevant organizations of the United Nations system, intergovernmental organizations \nand civil society organizations, aimed at raising international awareness and \n__________________ \n \n7 A/73/201, A/74/272, A/75/310, A/76/309 and A/77/295. \n\nA/RES/77/22 \nCommittee on the Exercise of the Inalienable Rights of the \nPalestinian People\n \n22-27257\n4/4 \n \nmobilizing diplomatic efforts to launch credible negotiations aimed at achieving \nwithout delay a just, lasting, comprehensive and peaceful solution to the question of \nPalestine in all its aspects; \n \n12. Requests the Secretary-General to continue to provide the Committee with \nall the facilities necessary for the performance of its tasks. \n \n42nd plenary meeting \n30 November 2022 \n \n",
  "paragraphs": {
    "1": "Expresses its appreciation to the Committee on the Exercise of the Inalienable Rights of the Palestinian People for its efforts in performing the tasks assigned to it by the General Assembly aimed at achieving a peaceful settlement of the question of Palestine, an expanded multilateral framework for the revitalization of peace efforts and ensuring fullest accountability and implementation of the long- standing parameters for peace in accordance with the relevant United Nations resolutions;",
    "2": "Requests the Committee to continue to exert all efforts to promote the realization of the inalienable rights of the Palestinian people, including their right to self-determination, to support the achievement without delay of an end to the Israeli occupation that began in 1967 and of the two-State solution on the basis of the pre-1967 borders and the just resolution of all final status issues and to mobilize international support for and assistance to the Palestinian people, and to report thereon to the General Assembly at its seventy-eighth session and thereafter;",
    "3": "Also requests the Committee to continue to keep under review the situation relating to the question of Palestine and make suggestions to the General Assembly, the Security Council or the Secretary-General, as appropriate;",
    "4": "Further requests the Committee to continue to extend its cooperation and support to Palestinian and other civil society organizations and to continue to involve additional civil society organizations and parliamentarians in its work in order to mobilize international solidarity and support for the Palestinian people and for restoring a political horizon and advancing just, lasting and comprehensive peace, particularly during this critical period of political instability, further reduction of civic space in the Occupied Palestinian Territory, including East Jerusalem, humanitarian hardship and financial crisis, with the overall aim of promoting the achievement by the Palestinian people of their inalienable rights and a just, lasting and peaceful settlement of the question of Palestine, the core of the Arab-Israeli conflict, on the basis of the relevant United Nations resolutions, the terms of reference of the Madrid Conference, including the principle of land for peace, the Arab Peace Initiative and the Quartet road map;",
    "5": "Commends the Committee on its efforts and activities in upholding its mandate, including through cooperative initiatives with Governments, relevant organizations of the United Nations system, intergovernmental organizations and civil society organizations;",
    "6": "Commends the Working Group of the Committee on its efforts in coordinating the efforts of international and regional civil society organizations regarding the question of Palestine;",
    "7": "Requests the United Nations Conciliation Commission for Palestine, established under General Assembly resolution 194 (III), and other United Nations bodies associated with the question of Palestine to continue to cooperate fully with the Committee and to make available to it, at its request, the relevant information and documentation that they have at their disposal;",
    "8": "Invites all Governments and organizations to extend their cooperation and support to the Committee in the performance of its tasks, recalling its repeated call for all States and the specialized agencies and organizations of the United Nations system to continue to support and assist the Palestinian people in the early realization of their right to self-determination, including the right to their independent State of Palestine, and to support the development and strengthening of Palestinian institutions and Palestinian State-building efforts in preparation for independence;",
    "9": "Requests the United Nations Conference on Trade and Development to continue to report to the General Assembly on economic development in the Occupied Palestinian Territory, including East Jerusalem, and the economic costs of the Israeli occupation for the Palestinian people, and, while drawing attention to the alarming findings, as reflected in the recent reports7 in this regard, calls for the exertion of all efforts for the provision of the resources necessary to expedite the completion and publication of the report, including the facilitation and coordination of pertinent inputs from the relevant organs, bodies and agencies of the United Nations system;",
    "10": "Requests the Secretary-General to circulate the report of the Committee to all the competent bodies of the United Nations, and urges them to take the necessary action, as appropriate;",
    "11": "Requests the Committee, bearing in mind the regrettable absence of tangible progress towards a peaceful solution, to continue to focus its activities on efforts and initiatives to end the Israeli occupation that began in 1967 and to organize activities in this regard, within existing resources and in cooperation with Governments, relevant organizations of the United Nations system, intergovernmental organizations and civil society organizations, aimed at raising international awareness and mobilizing diplomatic efforts to launch credible negotiations aimed at achieving without delay a just, lasting, comprehensive and peaceful solution to the question of Palestine in all its aspects;",
    "12": "Requests the Secretary-General to continue to provide the Committee with all the facilities necessary for the performance of its tasks."
  },
  "agenda_items": [
    "Item 33"
  ],
  "symbol_references": [
    "A/77/L.23"
  ]
}