{
  "symbol": "A/RES/75/40",
  "filename": "A_RES_75_40.pdf",
  "title": "75/40. Treaty on the Prohibition of Nuclear Weapons",
  "text": "United Nations \nA/RES/75/40\n \n \nGeneral Assembly \nDistr.: General \n16 December 2020 \n \n \n20-16818 (E)    211220     \n*2016818* \n \n \nSeventy-fifth session \nAgenda item 103 (nn) \nGeneral and complete disarmament: Treaty on the \nProhibition of Nuclear Weapons \n \n \n \n \n Resolution adopted by the General Assembly on \n7 December 2020 \n \n \n \n \n[on the report of the First Committee (A/75/399, para. 96)] \n \n \n \n75/40. Treaty on the Prohibition of Nuclear Weapons \n \n \n \nThe General Assembly, \n \nRecalling its resolutions 72/31 of 4 December 2017, 73/48 of 5 December 2018 \nand 74/41 of 12 December 2019, \n \n1. \nWelcomes the adoption of the Treaty on the Prohibition of Nuclear \nWeapons1 on 7 July 2017; \n \n2. \nNotes that the Treaty has been open for signature at United Nations \nHeadquarters in New York since 20 September 2017; \n \n3. \nWelcomes that the Treaty will enter into force on 22 January 2021, and also \nwelcomes that already 84 States had signed the Treaty and 50 States had ratified or \nacceded to it as at 24 October 2020; \n \n4. \nCalls upon all States that have not yet done so to sign, ratify, accept, \napprove or accede to the Treaty at the earliest possible date; \n \n5. \nCalls upon those States in a position to do so to promote adherence to the \nTreaty through bilateral, subregional, regional and multilateral contacts, outreach and \nother means; \n \n6. \nRequests the Secretary-General, as depositary of the Treaty, to report to \nthe General Assembly at its seventy-sixth session on the status of signature and \nratification, acceptance, approval or accession of the Treaty; \n__________________ \n \n1 A/CONF.229/2017/8. \n\nA/RES/75/40 \nTreaty on the Prohibition of Nuclear Weapons\n \n20-16818\n2/2 \n \n \n7. \nDecides to include in the provisional agenda of its seventy-sixth session, \nunder the item entitled \u201cGeneral and complete disarmament\u201d, the sub-item entitled \n\u201cTreaty on the Prohibition of Nuclear Weapons\u201d. \n \n37th plenary meeting \n7 December 2020 \n \n",
  "paragraphs": {
    "1": "Welcomes the adoption of the Treaty on the Prohibition of Nuclear Weapons1 on 7 July 2017;",
    "2": "Notes that the Treaty has been open for signature at United Nations Headquarters in New York since 20 September 2017;",
    "3": "Welcomes that the Treaty will enter into force on 22 January 2021, and also welcomes that already 84 States had signed the Treaty and 50 States had ratified or acceded to it as at 24 October 2020;",
    "4": "Calls upon all States that have not yet done so to sign, ratify, accept, approve or accede to the Treaty at the earliest possible date;",
    "5": "Calls upon those States in a position to do so to promote adherence to the Treaty through bilateral, subregional, regional and multilateral contacts, outreach and other means;",
    "6": "Requests the Secretary-General, as depositary of the Treaty, to report to the General Assembly at its seventy-sixth session on the status of signature and ratification, acceptance, approval or accession of the Treaty; __________________ 1 A/CONF.229/2017/8. A/RES/75/40 Treaty on the Prohibition of Nuclear Weapons 20-16818 2/2",
    "7": "Decides to include in the provisional agenda of its seventy-sixth session, under the item entitled \u201cGeneral and complete disarmament\u201d, the sub-item entitled \u201cTreaty on the Prohibition of Nuclear Weapons\u201d. 37th plenary meeting 7 December 2020"
  },
  "agenda_items": [
    "Item 103"
  ],
  "symbol_references": []
}