{
  "symbol": "A/RES/75/22",
  "filename": "A_RES_75_22.pdf",
  "title": "75/22. Peaceful settlement of the question of Palestine",
  "text": "United Nations \nA/RES/75/22\n \n \nGeneral Assembly \nDistr.: General \n8 December 2020 \n \n20-16403 (E)    111220     \n*2016403* \n \n \nSeventy-fifth session \nAgenda item 38 \nQuestion of Palestine \n \n \n \n \n Resolution adopted by the General Assembly \non 2 December 2020 \n \n \n \n \n[without reference to a Main Committee (A/75/L.34 and A/75/L.34/Add.1)] \n \n \n \n75/22. Peaceful settlement of the question of Palestine \n \n \n \nThe General Assembly,  \n \nRecalling its relevant resolutions, including those adopted at its tenth emergency \nspecial session,  \n \nRecalling also its resolution 73/89 of 6 December 2018, entitled \u201cComprehensive, \njust and lasting peace in the Middle East\u201d,  \n \nRecalling further relevant Security Council resolutions, including resolutions \n242 (1967) of 22 November 1967, 338 (1973) of 22 October 1973, 478 (1980) of \n20 August 1980, 1397 (2002) of 12 March 2002, 1515 (2003) of 19 November 2003, \n1544 (2004) of 19 May 2004, 1850 (2008) of 16 December 2008 and 2334 (2016) of \n23 December 2016,  \n \nHaving considered the report of the Secretary-General submitted pursuant to the \nrequest made in its resolution 74/11 of 3 December 2019,1 \n \nRecalling its resolution 58/292 of 6 May 2004, \n \nReaffirming the permanent responsibility of the United Nations with regard to \nthe question of Palestine until it is resolved in all its aspects in accordance with \ninternational law and relevant resolutions,  \n \nConvinced that achieving a just, lasting and comprehensive settlement of the \nquestion of Palestine, the core of the Arab-Israeli conflict, is imperative for the \nattainment of comprehensive and lasting peace and stability in the Middle East,  \n \nStressing that the principle of equal rights and self-determination of peoples is \namong the purposes and principles enshrined in the Charter of the United Nations,  \n__________________ \n \n1  A/75/195-S/2020/834. \n\nA/RES/75/22 \nPeaceful settlement of the question of Palestine\n \n20-16403\n2/5 \n \n \nReaffirming the principle of the inadmissibility of the acquisition of territory by \nforce,  \n \nRecalling its resolution 2625 (XXV) of 24 October 1970, and reiterating the \nimportance of maintaining and strengthening international peace founded upon \nfreedom, equality, justice and respect for fundamental human rights and of developing \nfriendly relations among nations irrespective of their political, economic and social \nsystems or the level of their development,  \n \nEmphasizing the need for respect for, and the preservation of, the territorial \nintegrity and unity of the Occupied Palestinian Territory, including East Jerusalem,  \n \nRecalling the advisory opinion rendered on 9 July 2004 by the International \nCourt of Justice on the legal consequences of the construction of a wall in the \nOccupied Palestinian Territory,2 and recalling also its resolutions ES-10/15 of 20 July \n2004 and ES-10/17 of 15 December 2006,  \n \nReaffirming the illegality of Israeli settlement activities and all other unilateral \nmeasures aimed at altering the demographic composition, character and status of the \nCity of Jerusalem and of the Occupied Palestinian Territory as a whole, including the \nwall and its associated regime, and demanding their immediate cessation,  \n \nEmphasizing the importance of the safety, protection and well-being of all \ncivilians in the whole Middle East region, and condemning all acts of violence and \nterror against civilians on all sides,  \n \nCalling for full respect for international law, including for the protection of \ncivilian life, as well as for the promotion of human security, the de-escalation of the \nsituation, the exercise of restraint, including from provocative actions and rhetoric, \nand the establishment of a stable environment conducive to the pursuit of peace,  \n \nStressing the need for measures to be taken to guarantee the safety and \nprotection of the Palestinian civilian population throughout the Occupied Palestinian \nTerritory, consistent with the provisions and obligations of international humanitarian \nlaw, and taking note of the report of the Secretary-General on the protection of the \nPalestinian civilian population,3 \n \nStressing also the need to ensure accountability for all violations of international \nhumanitarian law and international human rights law in order to end impunity, ensure \njustice, deter further violations, protect civilians and promote peace,  \n \nRecalling the mutual recognition 27 years ago between the Government of the \nState of Israel and the Palestine Liberation Organization, the representative of the \nPalestinian people,4 and stressing the urgent need for efforts to ensure full compliance \nwith the agreements concluded between the two sides,  \n \nStressing the need, in particular, for an immediate halt to all actions contrary to \ninternational law that undermine trust and prejudge final status issues,  \n \nUrging renewed and coordinated efforts by the international community aimed \nat restoring a political horizon and advancing and accelerating the conclusion of a \npeace treaty to achieve without delay an end to the Israeli occupation that began in \n1967 by resolving all outstanding issues, including all final status issues, without \nexception, for a just, lasting and peaceful settlement of the Israeli-Palestinian conflict, \nin accordance with the internationally recognized basis of the two-State solution, \nand of the Arab-Israeli conflict, for the realization of a comprehensive peace in the \nMiddle East,  \n__________________ \n \n2  See A/ES-10/273 and A/ES-10/273/Corr.1. \n \n3  A/ES-10/794. \n \n4  See A/48/486-S/26560, annex. \n\nPeaceful settlement of the question of Palestine \nA/RES/75/22\n \n3/5\n20-16403 \n \n \nRecognizing the efforts being undertaken by the Palestinian Government, with \ninternational support, to reform, develop, strengthen and preserve its institutions and \ninfrastructure, despite the obstacles presented by the ongoing Israeli occupation, \ncommending in this regard the ongoing efforts to develop the institutions of an \nindependent Palestinian State, and stressing the need to promote intra-Palestinian \nreconciliation,  \n \nExpressing concern about the risks posed to the significant achievements made, \nas confirmed by the positive assessments by the international institutions regarding \nreadiness for statehood, owing to the negative impact of the current instability and \nfinancial crisis being faced by the Palestinian Government and the continued absence \nof a credible political horizon,  \n \nWelcoming the ongoing efforts of the Ad Hoc Liaison Committee for the \nCoordination of the International Assistance to Palestinians, chaired by Norway, and \nnoting its recent meeting held virtually on 2 June 2020,  \n \nRecognizing the positive contribution of the United Nations Sustainable \nDevelopment Cooperation Framework, which is aimed, inter alia, at enhancing \ndevelopment support and assistance to the Palestinian people and strengthening \ninstitutional capacity in line with Palestinian national priorities,  \n \nWelcoming the holding of the meeting of the Conference on Cooperation among \nEast Asian Countries for Palestinian Development in Ramallah and Jericho in July \n2019 to support Palestinian efforts towards an independent Palestinian State through \nthe sharing of the experience of East Asian countries in economic development and \nexploring effective means of cooperation, aimed at contributing to the promotion of \nPalestinian development, the Middle East peace process and regional stability,  \n \nTaking note of the application of Palestine for admission to membership in the \nUnited Nations, submitted on 23 September 2011,5  \n \nTaking note also of its resolution 67/19 of 29 November 2012, by which, inter \nalia, Palestine was accorded non-member observer State status in the United Nations, \nand taking note further of the follow-up report of the Secretary-General,6  \n \nAcknowledging the efforts being undertaken by civil society to promote a \npeaceful settlement of the question of Palestine,  \n \nStressing the urgency of achieving without delay an end to the Israeli occupation \nthat began in 1967,  \n \nAffirming once again the right of all States in the region to live in peace within \nsecure and internationally recognized borders,  \n \nRecalling the Arab Peace Initiative, adopted by the Council of the League of \nArab States at its fourteenth session, held in Beirut on 27 and 28 March 2002, 7 and \nstressing its importance in the efforts to achieve a just, lasting and comprehensive \npeace,  \n \n1. \nReiterates its call for the achievement, without delay, of a comprehensive, \njust and lasting peace in the Middle East on the basis of the relevant United Nations \nresolutions, including Security Council resolution 2334 (2016), the Madrid terms of \nreference, including the principle of land for peace, the Arab Peace Initiative and the \nQuartet road map,8 and an end to the Israeli occupation that began in 1967, including \nof East Jerusalem, and reaffirms in this regard its unwavering support, in accordance \n__________________ \n \n5  A/66/371-S/2011/592, annex I. \n \n6  A/67/738. \n \n7  A/56/1026-S/2002/932, annex II, resolution 14/221. \n \n8  S/2003/529, annex. \n\nA/RES/75/22 \nPeaceful settlement of the question of Palestine\n \n20-16403\n4/5 \n \nwith international law, for the two-State solution of Israel and Palestine, living side \nby side in peace and security within recognized borders, based on the pre-1967 \nborders;  \n \n2. \nStresses the need to urgently exert collective efforts to launch credible \nnegotiations on all final status issues in the Middle East peace process based on the \nlong-standing terms of reference and clear parameters and within the time frame \nspecified by the Quartet in its statement of 21 September 2010, and calls once more \nfor the intensification of efforts by the parties, including through meaningful \nnegotiations, with the support of the international community, towards the conclusion \nof a final just, lasting and comprehensive peace settlement;  \n \n3. \nCalls for the timely convening of an international conference in Moscow, \nas envisioned by the Security Council in its resolution 1850 (2008), for the \nadvancement and acceleration of the achievement of a just, lasting and comprehensive \npeace settlement;  \n \n4. \nStresses that compliance with and respect for the Charter of the United \nNations and international law, including international humanitarian law and \ninternational human rights law, is a cornerstone of peace and security in the region;  \n \n5. \nCalls upon both parties to act responsibly and in compliance with \ninternational law and their previous agreements and obligations, in both their policies \nand actions, in order to, with the support of the Quartet and other interested parties, \nurgently reverse negative trends, including all measures taken on the ground that are \ncontrary to international law, and create the conditions necessary for a credible \npolitical horizon and the advancement of peace efforts;  \n \n6. \nCalls upon Israel, the occupying Power, to comply strictly with its \nobligations under international law and to cease all of its measures that are contrary \nto international law, including all unilateral actions in the Occupied Palestinian \nTerritory, including East Jerusalem, that are aimed at altering the demographic \ncomposition, character and status of the Territory, and thus at prejudging the final \noutcome of peace negotiations, and recalls in this regard the principle of the \ninadmissibility of the acquisition of land by force and therefore the illegality of the \nannexation of any part of the Occupied Palestinian Territory, including East \nJerusalem, which constitutes a breach of international law, undermines the viability \nof the two-State solution and challenges the prospects for the achievement of a \npeaceful settlement and of just, lasting and comprehensive peace;  \n \n7. \nStresses the need, in particular, for an immediate halt to all settlement \nactivities, land confiscation and home demolitions, for the pursuit of measures to \nensure accountability and for the release of prisoners and an end to arbitrary arrests \nand detentions;  \n \n8. \nAlso stresses the need for respect for and preservation of the territorial \nunity, contiguity and integrity of all the Occupied Palestinian Territory, including East \nJerusalem;  \n \n9. \nFurther stresses the need for an immediate and complete cessation of all \nacts of violence, including military attacks, destruction and acts of terror, as well as \nall acts of provocation and incitement;  \n \n10. Reaffirms its commitment, in accordance with international law, to the \ntwo-State solution of Israel and Palestine, living side by side in peace and security \nwithin recognized borders, based on the pre-1967 borders;  \n \n11. \nUnderscores in this regard the affirmation by the Security Council in its \nresolution 2334 (2016) of its determination to examine practical ways and means to \nsecure the full implementation of its relevant resolutions;  \n\nPeaceful settlement of the question of Palestine \nA/RES/75/22\n \n5/5\n20-16403 \n \n \n12. Calls for:  \n \n(a) \nThe withdrawal of Israel from the Palestinian territory occupied since \n1967, including East Jerusalem;  \n \n(b) \nThe realization of the inalienable rights of the Palestinian people, \nprimarily the right to self-determination and the right to their independent State;  \n \n(c) \nA just resolution of the problem of Palestine refugees in conformity with \nits resolution 194 (III) of 11 December 1948;  \n \n13. Calls upon all States, consistent with their obligations under the Charter \nand relevant Security Council resolutions, inter alia:  \n \n(a) \nNot to recognize any changes to the pre-1967 borders, including with \nregard to Jerusalem, other than those agreed by the parties through negotiations, \nincluding by ensuring that agreements with Israel do not imply recognition of Israeli \nsovereignty over the territories occupied by Israel in 1967;  \n \n(b) \nTo distinguish, in their relevant dealings, between the territory of the State \nof Israel and the territories occupied since 1967;  \n \n(c) \nNot to render aid or assistance to illegal settlement activities, including \nnot to provide Israel with any assistance to be used specifically in connection with \nsettlements in the occupied territories, in line with Security Council resolution \n465 (1980) of 1 March 1980;  \n \n(d) \nTo respect and ensure respect for international law, in all circumstances, \nincluding through measures of accountability, consistent with international law;  \n \n14. Urges all States and the United Nations to continue and expedite the \nprovision of economic, humanitarian and technical assistance to the Palestinian \npeople and the Palestinian Government during this critical period in order to help to \nalleviate the serious humanitarian situation in the Occupied Palestinian Territory, \nincluding East Jerusalem, which is dire in the Gaza Strip, to rehabilitate the \nPalestinian economy and infrastructure and to support the development and \nstrengthening of Palestinian institutions and Palestinian State-building efforts in \npreparation for independence;  \n \n15. Requests the Secretary-General, including through his Special Coordinator \nfor the Middle East Peace Process and Personal Representative to the Palestine \nLiberation Organization and the Palestinian Authority, to continue his efforts with the \nparties concerned, and in consultation with the Security Council, including with \nregard to the reporting required pursuant to resolution 2334 (2016), towards the \nattainment of a peaceful settlement of the question of Palestine and the promotion of \npeace in the region and to submit to the General Assembly at its seventy-sixth session \na report on these efforts and on developments on this matter.  \n \n35th plenary meeting \n2 December 2020 \n \n",
  "paragraphs": {
    "1": "Reiterates its call for the achievement, without delay, of a comprehensive, just and lasting peace in the Middle East on the basis of the relevant United Nations resolutions, including Security Council resolution 2334 (2016), the Madrid terms of reference, including the principle of land for peace, the Arab Peace Initiative and the Quartet road map,8 and an end to the Israeli occupation that began in 1967, including of East Jerusalem, and reaffirms in this regard its unwavering support, in accordance __________________ 5 A/66/371-S/2011/592, annex I. 6 A/67/738. 7 A/56/1026-S/2002/932, annex II, resolution 14/221. 8 S/2003/529, annex. A/RES/75/22 Peaceful settlement of the question of Palestine 20-16403 4/5 with international law, for the two-State solution of Israel and Palestine, living side by side in peace and security within recognized borders, based on the pre-1967 borders;",
    "2": "Stresses the need to urgently exert collective efforts to launch credible negotiations on all final status issues in the Middle East peace process based on the long-standing terms of reference and clear parameters and within the time frame specified by the Quartet in its statement of 21 September 2010, and calls once more for the intensification of efforts by the parties, including through meaningful negotiations, with the support of the international community, towards the conclusion of a final just, lasting and comprehensive peace settlement;",
    "3": "Calls for the timely convening of an international conference in Moscow, as envisioned by the Security Council in its resolution 1850 (2008), for the advancement and acceleration of the achievement of a just, lasting and comprehensive peace settlement;",
    "4": "Stresses that compliance with and respect for the Charter of the United Nations and international law, including international humanitarian law and international human rights law, is a cornerstone of peace and security in the region;",
    "5": "Calls upon both parties to act responsibly and in compliance with international law and their previous agreements and obligations, in both their policies and actions, in order to, with the support of the Quartet and other interested parties, urgently reverse negative trends, including all measures taken on the ground that are contrary to international law, and create the conditions necessary for a credible political horizon and the advancement of peace efforts;",
    "6": "Calls upon Israel, the occupying Power, to comply strictly with its obligations under international law and to cease all of its measures that are contrary to international law, including all unilateral actions in the Occupied Palestinian Territory, including East Jerusalem, that are aimed at altering the demographic composition, character and status of the Territory, and thus at prejudging the final outcome of peace negotiations, and recalls in this regard the principle of the inadmissibility of the acquisition of land by force and therefore the illegality of the annexation of any part of the Occupied Palestinian Territory, including East Jerusalem, which constitutes a breach of international law, undermines the viability of the two-State solution and challenges the prospects for the achievement of a peaceful settlement and of just, lasting and comprehensive peace;",
    "7": "Stresses the need, in particular, for an immediate halt to all settlement activities, land confiscation and home demolitions, for the pursuit of measures to ensure accountability and for the release of prisoners and an end to arbitrary arrests and detentions;",
    "8": "Also stresses the need for respect for and preservation of the territorial unity, contiguity and integrity of all the Occupied Palestinian Territory, including East Jerusalem;",
    "9": "Further stresses the need for an immediate and complete cessation of all acts of violence, including military attacks, destruction and acts of terror, as well as all acts of provocation and incitement;",
    "10": "Reaffirms its commitment, in accordance with international law, to the two-State solution of Israel and Palestine, living side by side in peace and security within recognized borders, based on the pre-1967 borders;",
    "11": "Underscores in this regard the affirmation by the Security Council in its resolution 2334 (2016) of its determination to examine practical ways and means to secure the full implementation of its relevant resolutions; Peaceful settlement of the question of Palestine A/RES/75/22 5/5 20-16403",
    "12": "Calls for: (a) The withdrawal of Israel from the Palestinian territory occupied since 1967, including East Jerusalem; (b) The realization of the inalienable rights of the Palestinian people, primarily the right to self-determination and the right to their independent State; (c) A just resolution of the problem of Palestine refugees in conformity with its resolution 194 (III) of 11 December 1948;",
    "13": "Calls upon all States, consistent with their obligations under the Charter and relevant Security Council resolutions, inter alia: (a) Not to recognize any changes to the pre-1967 borders, including with regard to Jerusalem, other than those agreed by the parties through negotiations, including by ensuring that agreements with Israel do not imply recognition of Israeli sovereignty over the territories occupied by Israel in 1967; (b) To distinguish, in their relevant dealings, between the territory of the State of Israel and the territories occupied since 1967; (c) Not to render aid or assistance to illegal settlement activities, including not to provide Israel with any assistance to be used specifically in connection with settlements in the occupied territories, in line with Security Council resolution 465 (1980) of 1 March 1980; (d) To respect and ensure respect for international law, in all circumstances, including through measures of accountability, consistent with international law;",
    "14": "Urges all States and the United Nations to continue and expedite the provision of economic, humanitarian and technical assistance to the Palestinian people and the Palestinian Government during this critical period in order to help to alleviate the serious humanitarian situation in the Occupied Palestinian Territory, including East Jerusalem, which is dire in the Gaza Strip, to rehabilitate the Palestinian economy and infrastructure and to support the development and strengthening of Palestinian institutions and Palestinian State-building efforts in preparation for independence;",
    "15": "Requests the Secretary-General, including through his Special Coordinator for the Middle East Peace Process and Personal Representative to the Palestine Liberation Organization and the Palestinian Authority, to continue his efforts with the parties concerned, and in consultation with the Security Council, including with regard to the reporting required pursuant to resolution 2334 (2016), towards the attainment of a peaceful settlement of the question of Palestine and the promotion of peace in the region and to submit to the General Assembly at its seventy-sixth session a report on these efforts and on developments on this matter. 35th plenary meeting 2 December 2020"
  },
  "agenda_items": [
    "Item 38"
  ],
  "symbol_references": [
    "A/75/L.34"
  ]
}