{
  "symbol": "A/RES/74/277",
  "filename": "A_RES_74_277.pdf",
  "title": "Seventy-fourth session Comprehensive review of the whole question of peacekeeping operations in all their aspects",
  "text": "United Nations \nA/RES/74/277 \n \n \nGeneral Assembly \nDistr.: General \n19 June 2020  \n \n20-08121 (E)    230620   \n*2008121* \n \n \nSeventy-fourth session \nAgenda item 52 \nComprehensive review of the whole question of \npeacekeeping operations in all their aspects \n \n \n \n \n Resolution adopted by the General Assembly \non 18 June 2020 \n \n \n \n \n[on the report of the Special Political and Decolonization Committee  \n(Fourth Committee) (A/74/411/Add.1)] \n \n \n \n74/277. \nComprehensive review of the whole question of peacekeeping \noperations in all their aspects \n \n \n \nThe General Assembly, \n \nRecalling its resolution 2006 (XIX) of 18 February 1965 and all other relevant \nresolutions, \n \nRecalling in particular its resolution 73/293 of 20 May 2019, \n \nAffirming that the efforts of the United Nations in the peaceful settlement of \ndisputes, including through its peacekeeping operations, are indispensable, \n \nConvinced of the need for the United Nations to continue to improve its \ncapabilities in the field of peacekeeping and to enhance the effective and efficient \ndeployment of its peacekeeping operations, \n \nConsidering the contribution that all States Members of the United Nations \nmake to peacekeeping, \n \nNoting the widespread interest in contributing to the work of the Special \nCommittee on Peacekeeping Operations expressed by Member States, in particular \ntroop- and police-contributing countries, \n \nBearing in mind the continuous necessity of preserving the efficiency and \nstrengthening the effectiveness of the work of the Special Committee, \n \n1. \nWelcomes the report of the Special Committee on Peacekeeping Operations;1 \n \n2. \nEndorses the proposals, recommendations and conclusions of the Special \nCommittee contained in chapter V of its report; \n__________________ \n \n1 Official Records of the General Assembly, Seventy-fourth Session, Supplement No. 19 (A/74/19). \n\nA/RES/74/277 \nComprehensive review of the whole question of \npeacekeeping operations in all their aspects\n \n20-08121\n2/2 \n \n \n3. \nUrges Member States, the Secretariat and relevant organs of the United \nNations to take all steps necessary to implement the proposals, recommendations and \nconclusions of the Special Committee; \n \n4. \nReiterates that those Member States that become personnel contributors to \nUnited Nations peacekeeping operations in years to come or that participate in the \nfuture in the Special Committee for three consecutive years as observers shall, upon \nrequest in writing to the Chair of the Special Committee, become members at the \nfollowing session of the Special Committee; \n \n5. \nDecides that the Special Committee, in accordance with its mandate, shall \ncontinue its efforts for a comprehensive review of the whole question of peacekeeping \noperations in all their aspects and shall review the implementation of its previous \nproposals and consider any new proposals so as to enhance the capacity of the United \nNations to fulfil its responsibilities in this field; \n \n6. \nRequests the Special Committee to submit a report on its work to the \nGeneral Assembly at its seventy-fifth session; \n \n7. \nDecides to include in the provisional agenda of its seventy-fifth session \nthe item entitled \u201cComprehensive review of the whole question of peacekeeping \noperations in all their aspects\u201d. \n \n18 June 2020 \n \n",
  "paragraphs": {
    "1": "Welcomes the report of the Special Committee on Peacekeeping Operations;1",
    "2": "Endorses the proposals, recommendations and conclusions of the Special Committee contained in chapter V of its report; __________________ 1 Official Records of the General Assembly, Seventy-fourth Session, Supplement No. 19 (A/74/19). A/RES/74/277 Comprehensive review of the whole question of peacekeeping operations in all their aspects 20-08121 2/2",
    "3": "Urges Member States, the Secretariat and relevant organs of the United Nations to take all steps necessary to implement the proposals, recommendations and conclusions of the Special Committee;",
    "4": "Reiterates that those Member States that become personnel contributors to United Nations peacekeeping operations in years to come or that participate in the future in the Special Committee for three consecutive years as observers shall, upon request in writing to the Chair of the Special Committee, become members at the following session of the Special Committee;",
    "5": "Decides that the Special Committee, in accordance with its mandate, shall continue its efforts for a comprehensive review of the whole question of peacekeeping operations in all their aspects and shall review the implementation of its previous proposals and consider any new proposals so as to enhance the capacity of the United Nations to fulfil its responsibilities in this field;",
    "6": "Requests the Special Committee to submit a report on its work to the General Assembly at its seventy-fifth session;",
    "7": "Decides to include in the provisional agenda of its seventy-fifth session the item entitled \u201cComprehensive review of the whole question of peacekeeping operations in all their aspects\u201d. 18 June 2020"
  },
  "agenda_items": [
    "Item 52"
  ],
  "symbol_references": []
}