{
  "symbol": "A/RES/74/198",
  "filename": "A_RES_74_198.pdf",
  "title": "74/198. International Year of Creative Economy for Sustainable Development, 2021",
  "text": "United Nations \nA/RES/74/198 \n \n \nGeneral Assembly \nDistr.: General \n14 January 2020 \n \n19-22410 (E)    170120 \n*1922410* \n \n \nSeventy-fourth session \nAgenda item 17 \nMacroeconomic policy questions \n \n \n \n \n Resolution adopted by the General Assembly \non 19 December 2019 \n \n \n \n \n[on the report of the Second Committee (A/74/379)] \n \n \n 74/198. International Year of Creative Economy for Sustainable \nDevelopment, 2021 \n \n \n \nThe General Assembly, \n \nReaffirming the Charter of the United Nations, including the purposes and \nprinciples contained therein, and the functions and powers of the United Nations \nsystem, especially in promoting international cooperation in the economic, social, \ncultural, educational and health fields, \n \nReaffirming also its resolution 70/1 of 25 September 2015, entitled \n\u201cTransforming our world: the 2030 Agenda for Sustainable Development\u201d, in which \nit adopted a comprehensive, far-reaching and people-centred set of universal and \ntransformative Sustainable Development Goals and targets, its commitment to \nworking tirelessly for the full implementation of the Agenda by 2030, its recognition \nthat eradicating poverty in all its forms and dimensions, including extreme poverty, \nis the greatest global challenge and an indispensable requirement for sustainable \ndevelopment, its commitment to achieving sustainable development in its three \ndimensions \u2013 economic, social and environmental \u2013 in a balanced and integrated \nmanner, and to building upon the achievements of the Millennium Development \nGoals and seeking to address their unfinished business, \n \nRecognizing the need to promote sustained and inclusive economic growth, \nfoster innovation and provide opportunities, benefits and empowerment for all and \nrespect for all human rights, \n \nRecalling its resolutions 53/199 of 15 December 1998 and 61/185 of \n20 December 2006 on the proclamation of international years, and Economic and \nSocial Council resolution 1980/67 of 25 July 1980 on international years and \nanniversaries, including paragraphs 1 to 10 of the annex thereto on the agreed criteria \nfor the proclamation of international years, as well as paragraphs 13 and 14, in which \n\nA/RES/74/198 \nInternational Year of Creative Economy\n for Sustainable Development, 2021\n \n19-22410\n2/4 \n \nit is stated that an international day or year should not be proclaimed before the basic \narrangements for its organization and financing have been made, \n \nRecognizing that the creative economy, known as the \u201corange economy\u201d in a \nnumber of countries, involves, inter alia, knowledge-based economic activities and \nthe interplay between human creativity and ideas, knowledge and technology, as well \nas cultural values or artistic, cultural heritage and other individual or collective \ncreative expressions, \n \nRecalling the Constitution of the United Nations Educational, Scientific and \nCultural Organization, which states that the organization, as part of its purposes and \nfunctions, will maintain, increase and diffuse knowledge by encouraging cooperation \namong the nations in all branches of intellectual activity, and noting the report of the \nUnited Nations Educational, Scientific and Cultural Organization on culture and \nsustainable development,1 in which it is stated that cultural and creative industries \nshould be part of economic growth strategies, \n \nRecognizing the ongoing need to support developing countries and countries \nwith economies in transition in diversifying production and exports, including in new \nsustainable growth areas, including creative industries, \n \nRecommitting to sustaining and supporting developing countries\u2019 economies to \ntransition progressively to higher productivity through high-value-added sectors, by \npromoting diversification, technological upgrading, research and innovation, \nincluding the creation of quality, decent and productive jobs, including through the \npromotion of cultural and creative industries, sustainable tourism, performing arts \nand heritage conservation activities, among others, \n \nRecognizing that the international community should support national efforts of \ndeveloping countries to increase their participation in and benefit from dynamic \nsectors and to foster, protect and promote their creative industries, including by way \nof strategies to appropriately protect and enforce intellectual property, \n \nAcknowledging that creative industries can help to foster positive externalities \nwhile preserving and promoting cultural heritages and diversity, as well as enhance \ndeveloping countries\u2019 participation in and benefit from new and dynamic growth \nopportunities in world trade, \n \nWelcoming the efforts of the United Nations Conference on Trade and \nDevelopment, the United Nations Educational, Scientific and Cultural Organization, \nthe United Nations Development Programme, the International Labour Organization, \nthe United Nations Office for South-South Cooperation, the World Intellectual \nProperty Organization, the Food and Agriculture Organization of the United Nations \nand other entities of the United Nations system to promote the creative economy for \nsustainable development, \n \nNoting with appreciation the efforts to promote the creative economy in various \ninternational and regional conferences, including the first World Conference on \nCreative Economy, held in Bali, Indonesia, from 6 to 8 November 2018, and the \nGlobal Summit on the Orange Economy, held in Medell\u00edn, Colombia, on 9 and \n10 September 2019, and looking forward to the convening of the second World \nConference on Creative Economy, to be held in the United Arab Emirates in 2020, \nwhile taking note of the outcome document, the Bali Agenda for Creative Economy, \nand recognizing the role of the creative economy in supporting the Sustainable \nDevelopment Goals and that the protection and enforcement of intellectual property \nrights can bolster and enhance the creative economy, \n__________________ \n \n1 See A/69/216. \n\nInternational Year of Creative Economy \nfor Sustainable Development, 2021 \nA/RES/74/198\n \n3/4\n19-22410 \n \n \nAcknowledging that innovation is essential for harnessing the economic \npotential of each nation and the importance of supporting mass entrepreneurship, \ncreativity and innovation, which create new momentum for economic growth and job \ncreation and expand opportunities for all, including women and youth, \n \nRecognizing the role of the creative economy in creating full and productive \nemployment and decent work, supporting entrepreneurship, creativity and innovation, \nencouraging the formalization and growth of micro-, small and medium-sized \nenterprises, stimulating innovation, empowering people, promoting social inclusion, \nand reducing poverty, \n \nHighlighting that the creative economy encourages creativity and innovation in \nattaining inclusive, equitable and sustainable growth and development, while \nfacilitating life transitions and supporting women, youth, migrants and older persons, \nas well as empowering people in vulnerable situations, \n \nStressing the importance of appropriate national policies aimed at promoting the \ndiversity of cultural expression and advancing creativity for sustainable development, \n \nEmphasizing the resilient growth in international trade in creative industries, \nincluding the trade of creative goods and services, and its contribution to the global \neconomy, and recognizing the economic and cultural values of the creative economy, \n \nReaffirming that all workers should have access to lifelong learning and that all \nlearners should acquire the knowledge and skills needed to promote sustainable \ndevelopment, including, among others, through education for sustainable \ndevelopment and sustainable lifestyles, human rights, gender equality and the \nempowerment of all women and girls, the promotion of a culture of peace and \nnon-violence, global citizenship and the appreciation of cultural diversity and of \nculture\u2019s contribution to sustainable development, \n \nRecognizing the need to optimize the economic, social and cultural benefits \nstemming from the creative economy by creating an enabling environment for the \npromotion of the creative economy, such as the development of digital technology, \ninnovative and digital economy, e-commerce, building relevant digital infrastructure \nand connectivity for supporting sustainable development, increased public and private \nsector investment in creative industries and the development of relevant legal \nframeworks, \n \nStressing that the creative economy can contribute to the three dimensions of \nsustainable development and the achievement of the 2030 Agenda, including by \nfostering economic growth and innovation, eradicating poverty, creating full and \nproductive employment and decent work for all, improving the quality of life and \nempowerment of women and young people and reducing inequality within and among \ncountries, \n \nStressing the importance of regular, reliable and comparable data on the \ncontribution of the creative economy to the achievement of the Sustainable \nDevelopment Goals, \n \n1. \nDecides to declare 2021 the International Year of Creative Economy for \nSustainable Development; \n \n2. \nEncourages all Member States, organizations of the United Nations \nsystem and other international and regional organizations, as well as civil society, the \nprivate sector, non-governmental organizations, academics and individuals, to \nobserve the International Year in an appropriate manner and in accordance with \nnational priorities, in order to raise awareness, promote cooperation and networking, \n\nA/RES/74/198 \nInternational Year of Creative Economy\n for Sustainable Development, 2021\n \n19-22410\n4/4 \n \nencourage the sharing of best practices and experiences, enhance human resource \ncapacity and promote an enabling environment at all levels as well as tackle the \nchallenges of creative economy; \n \n3. \nInvites the United Nations system and all relevant stakeholders to \ncontribute to and support the International Year; \n \n4. \nInvites the Secretary-General to bring the present resolution to the \nattention of all Member States, organizations of the United Nations system and other \ninternational and regional organizations, as well as civil society, including \nnon-governmental organizations, individuals and the private sector, and encourages \nthe Secretary-General to invite United Nations entities to work together and support \nthe implementation of the International Year of Creative Economy in a synergetic \neffect; \n \n5. \nStresses that the cost of all activities that may arise from the \nimplementation of the present resolution should be met from voluntary contributions; \n \n6. \nRequests the secretariat of the United Nations Conference on Trade and \nDevelopment and in consultation with the United Nations Educational, Scientific and \nCultural Organization and relevant entities of the United Nations system, to inform \nthe General Assembly at its seventy-seventh session of the implementation of the \npresent resolution, through a dedicated section of the Creative Economy Outlook, \nelaborating in particular on how the resolution is aligned with and advances the 2030 \nAgenda, including recommendations on concrete actions that would help Member \nStates and the United Nations system to accelerate their efforts in the implementation \nof the Agenda. \n \n52nd plenary meeting \n19 December 2019 \n \n",
  "paragraphs": {
    "1": "Decides to declare 2021 the International Year of Creative Economy for Sustainable Development;",
    "2": " encourage the sharing of best practices and experiences, enhance human resource capacity and promote an enabling environment at all levels as well as tackle the challenges of creative economy;",
    "3": "Invites the United Nations system and all relevant stakeholders to contribute to and support the International Year;",
    "4": "Invites the Secretary-General to bring the present resolution to the attention of all Member States, organizations of the United Nations system and other international and regional organizations, as well as civil society, including non-governmental organizations, individuals and the private sector, and encourages the Secretary-General to invite United Nations entities to work together and support the implementation of the International Year of Creative Economy in a synergetic effect;",
    "5": "Stresses that the cost of all activities that may arise from the implementation of the present resolution should be met from voluntary contributions;",
    "6": "Requests the secretariat of the United Nations Conference on Trade and Development and in consultation with the United Nations Educational, Scientific and Cultural Organization and relevant entities of the United Nations system, to inform the General Assembly at its seventy-seventh session of the implementation of the present resolution, through a dedicated section of the Creative Economy Outlook, elaborating in particular on how the resolution is aligned with and advances the 2030 Agenda, including recommendations on concrete actions that would help Member States and the United Nations system to accelerate their efforts in the implementation of the Agenda."
  },
  "agenda_items": [
    "Item 17"
  ],
  "symbol_references": []
}