{
  "symbol": "A/RES/75/292",
  "filename": "A_RES_75_292.pdf",
  "title": "75/292. Seconded active-duty military and police personnel",
  "text": "United Nations \nA/RES/75/292\n \n \nGeneral Assembly \nDistr.: General \n8 July 2021 \n \n21-08995 (E)    090721 \n*2108995*\n \n \n \nSeventy-fifth session \nAgenda item 146 \nHuman resources management \n \n \n \n \n Resolution adopted by the General Assembly \non 30 June 2021 \n \n \n \n \n[on the report of the Fifth Committee (A/75/935, para. 6)] \n \n \n 75/292. Seconded active-duty military and police personnel \n \n \n \nThe General Assembly, \n \nRecalling its resolutions 67/287 of 28 June 2013, 68/252 of 27 December 2013, \n71/263 of 23 December 2016, 74/254 A of 27 December 2019 and 74/254 B of \n6 August 2020,  \n \nHaving considered the report of the Secretary-General on seconded active-duty \nmilitary and police personnel1 and the related report of the Advisory Committee on \nAdministrative and Budgetary Questions,2 \n \n1. \nTakes note of the report of the Secretary-General;  \n \n2. \nEndorses the conclusions and recommendations contained in the report of \nthe Advisory Committee on Administrative and Budgetary Questions, subject to the \nprovisions of the present resolution;  \n \n3. \nNotes the outreach and engagement that the United Nations has undertaken \nwith Member States on this matter and the options presented by the Secretary-General \nin his report for resolving issues involving the engagement of seconded active-duty \nmilitary and police personnel, in particular conflicts between national legislation and \nthe Staff Regulations and Rules of the United Nations, 3 and requests the Secretary-\nGeneral to intensify his efforts in this regard;  \n \n4. \nRecalls paragraph 4 of its resolution 74/254 B, stresses that the selection \nof staff members, including seconded active-duty military and police personnel, \nshould be made in accordance with the principles of the Charter of the United Nations, \nreiterates its request to the Secretary-General to enable the participation of all \nMember States in seconding active-duty military and police personnel, and urges the \n__________________ \n \n1 A/75/646. \n \n2 A/75/796. \n \n3 ST/SGB/2018/1/Rev.1. \n\nA/RES/75/292 \nSeconded active-duty military and police personnel\n \n21-08995\n2/2 \n \nSecretary-General to make every effort to facilitate timely onboarding and \nrepatriation of seconded personnel;  \n \n5. \nUrges the Secretary-General to continue to ensure accountability and \nimpartiality of the seconded active-duty military and police personnel through \napplicable and relevant standards and supervision;  \n \n6. \nRecognizes the importance of the roles carried out and the expertise \nprovided by seconded active-duty military and police personnel in fulfilling United \nNations mandates, and requests the Secretary-General to continue to actively engage \nin the efforts to improve their timely onboarding, using the various tools at his \ndisposal to address challenges beyond the control of the selected active-duty military \nand police personnel and which prevent their timely onboarding and to report thereon \nin his next report;  \n \n7. \nRequests the Secretary-General to intensify his efforts to ensure equal \nopportunities for seconded active-duty military and police personnel from all Member \nStates;  \n \n8. \nAlso requests the Secretary-General to consider placing the selected \nactive-duty military and police personnel who cannot report to duty promptly owing \nto onboarding challenges beyond their control against similar positions at the same \nduty station once the challenges are addressed;  \n \n9. \nTakes note of paragraph 23 of the report of the Advisory Committee, and \nrequests the Secretary-General to carry out a comprehensive assessment of the \npractical impact, including on Member States, of the different options and possible \ncombinations of options outlined in his report, taking into consideration lessons \nlearned from the implementation of existing agreements and the need to secure \ncontinuous protection of the pension rights of the seconded personnel, and to provide \nthe assessment to the General Assembly for its consideration at its seventy-eighth \nsession;  \n \n10. Authorizes the Secretary-General to continue to enter into agreements with \nMember States to prevent duplication in the payment of salaries, benefits and \nallowances to active-duty seconded military and police personnel and to report \nthereon, including on the lessons learned, in the context of his next report to the \nGeneral Assembly;  \n \n11. \nInvites the Secretary-General to reach out to the Member States without \nagreements with the Secretariat and to encourage them to sign such agreements if \ntheir national legislation is in conflict with the Staff Regulations and Rules of the \nUnited Nations;  \n \n12. Takes note of paragraph 27 of the report of the Advisory Committee, and \ndecides to authorize the Secretary-General to extend the exceptional measures \nregarding seconded active-duty military and police personnel until 1 July 2024; \n \n13. Requests the Secretary-General to provide, during the first part of the \nresumed seventy-seventh session, an informal briefing on the status of and the initial \nfindings from the implementation of bilateral agreements and progress in the \npreparation of the analysis and assessment of options and combinations of options to \nbe outlined in the report of the Secretary-General. \n \n88th plenary meeting \n30 June 2021 \n \n",
  "paragraphs": {
    "1": "Takes note of the report of the Secretary-General;",
    "2": "Endorses the conclusions and recommendations contained in the report of the Advisory Committee on Administrative and Budgetary Questions, subject to the provisions of the present resolution;",
    "3": "Notes the outreach and engagement that the United Nations has undertaken with Member States on this matter and the options presented by the Secretary-General in his report for resolving issues involving the engagement of seconded active-duty military and police personnel, in particular conflicts between national legislation and the Staff Regulations and Rules of the United Nations, 3 and requests the Secretary- General to intensify his efforts in this regard;",
    "4": "Recalls paragraph 4 of its resolution 74/254 B, stresses that the selection of staff members, including seconded active-duty military and police personnel, should be made in accordance with the principles of the Charter of the United Nations, reiterates its request to the Secretary-General to enable the participation of all Member States in seconding active-duty military and police personnel, and urges the Secretary-General to make every effort to facilitate timely onboarding and repatriation of seconded personnel;",
    "5": "Urges the Secretary-General to continue to ensure accountability and impartiality of the seconded active-duty military and police personnel through applicable and relevant standards and supervision;",
    "6": "Recognizes the importance of the roles carried out and the expertise provided by seconded active-duty military and police personnel in fulfilling United Nations mandates, and requests the Secretary-General to continue to actively engage in the efforts to improve their timely onboarding, using the various tools at his disposal to address challenges beyond the control of the selected active-duty military and police personnel and which prevent their timely onboarding and to report thereon in his next report;",
    "7": "Requests the Secretary-General to intensify his efforts to ensure equal opportunities for seconded active-duty military and police personnel from all Member States;",
    "8": "Also requests the Secretary-General to consider placing the selected active-duty military and police personnel who cannot report to duty promptly owing to onboarding challenges beyond their control against similar positions at the same duty station once the challenges are addressed;",
    "9": "Takes note of paragraph 23 of the report of the Advisory Committee, and requests the Secretary-General to carry out a comprehensive assessment of the practical impact, including on Member States, of the different options and possible combinations of options outlined in his report, taking into consideration lessons learned from the implementation of existing agreements and the need to secure continuous protection of the pension rights of the seconded personnel, and to provide the assessment to the General Assembly for its consideration at its seventy-eighth session;",
    "10": "Authorizes the Secretary-General to continue to enter into agreements with Member States to prevent duplication in the payment of salaries, benefits and allowances to active-duty seconded military and police personnel and to report thereon, including on the lessons learned, in the context of his next report to the General Assembly;",
    "11": "Invites the Secretary-General to reach out to the Member States without agreements with the Secretariat and to encourage them to sign such agreements if their national legislation is in conflict with the Staff Regulations and Rules of the United Nations;",
    "12": "Takes note of paragraph 27 of the report of the Advisory Committee, and decides to authorize the Secretary-General to extend the exceptional measures regarding seconded active-duty military and police personnel until 1 July 2024;",
    "13": "Requests the Secretary-General to provide, during the first part of the resumed seventy-seventh session, an informal briefing on the status of and the initial findings from the implementation of bilateral agreements and progress in the preparation of the analysis and assessment of options and combinations of options to be outlined in the report of the Secretary-General."
  },
  "agenda_items": [
    "Item 146"
  ],
  "symbol_references": []
}