{
  "symbol": "A/RES/73/140",
  "filename": "A_RES_73_140.pdf",
  "title": "73/140. Volunteering for the 2030 Agenda for Sustainable Development",
  "text": "United Nations \nA/RES/73/140\n \n \nGeneral Assembly \nDistr.: General \n8 January 2019 \n \n18-22173 (E)    100119 \n*1822173* \n \n \nSeventy-third session \nAgenda item 28 \n \n \n \n \n Resolution adopted by the General Assembly \non 17 December 2018 \n \n \n \n \n[on the report of the Third Committee (A/73/581)] \n \n \n 73/140. Volunteering for the 2030 Agenda for Sustainable Development \n \n \n \nThe General Assembly, \n \nRecalling its resolution 70/129 of 17 December 2015, entitled \u201cIntegrating \nvolunteering into peace and development: the plan of action for the next decade and \nbeyond\u201d, \n \nWelcoming the integration of volunteerism into all relevant issues considered at \nthe United Nations, in particular the 2030 Agenda for Sustainable Development, 1 in \nwhich it adopted a comprehensive, far-reaching and people-centred set of universal \nand transformative Sustainable Development Goals and targets, as well as the Addis \nAbaba Action Agenda of the Third International Conference on Financing for \nDevelopment,2 in which it is acknowledged that volunteers and other stakeholders \nwill be important to mobilize and share knowledge, expertise, technology and \nfinancial resources, complement the efforts of Governments and support the \nachievement of the Sustainable Development Goals, in particular in developing \ncountries, \n \nRecognizing that volunteerism can be a powerful and cross-cutting means of \nimplementation of the 2030 Agenda for Sustainable Development, that it can help to \nexpand and mobilize constituencies and engage people in the national planning and \nimplementation of the 2030 Agenda, and that volunteer groups can help to localize \nthe Agenda by providing new areas of interaction between Governments and people \nfor concrete and scalable actions, \n \nAcknowledging that the 2030 Agenda for Sustainable Development creates \nunprecedented global and national urgency to accelerate progress in the recognition, \npromotion, facilitation, networking and integration of volunteer action by and \n__________________ \n \n1  Resolution 70/1. \n \n2  Resolution 69/313, annex. \n\nA/RES/73/140 \nVolunteering for the 2030 Agenda for Sustainable Development\n \n18-22173\n2/4 \n \nbetween Governments, communities, civil society, the private sector, academia, the \nmedia and international actors, including the United Nations system, \n \nAcknowledging also the existing contribution of the organizations of the United \nNations system in support of volunteering, especially the work of the United Nations \nVolunteers programme around the world, acknowledging further the efforts of the \nInternational Federation of Red Cross and Red Crescent Societies to promote \nvolunteerism throughout its global network, noting the work of other volunteer-\ninvolving organizations at the local, national, regional and global levels, and \nacknowledging the important role of civil society in facilitating volunteering,  \n \nWelcoming the publication by the United Nations Volunteers programme of the \nreport entitled 2018 State of the World\u2019s Volunteerism Report: The Thread that \nBinds \u2013 Volunteerism and Community Resilience, which presents new evidence on the \nrole of volunteerism, especially through equitable and inclusive compacts between \nlocal volunteers and other communities, actors and organizations in strengthening \ncommunity resilience, voice and inclusion in the 2030 Agenda for Sustainable \nDevelopment, \n \n1. \nWelcomes the report of the Secretary-General on the plan of action to \nintegrate volunteering into the 2030 Agenda for Sustainable Development; 3  \n \n2. \nRecognizes the importance of integrating volunteerism, as appropriate, \ninto the planning for the implementation of the 2030 Agenda for Sustainable \nDevelopment,1 and encourages the United Nations system, civil society and the \nprivate sector, in partnership with Member States, to support such efforts and promote \na conducive environment for volunteerism and volunteers to enhance the \nsustainability of development results; \n \n3. \nEncourages Governments, in partnership with United Nations entities, \nvolunteer-involving organizations, the private sector, civil society, including \nacademia, and other stakeholders, as appropriate, to integrate volunteerism into \nnational development strategies, plans and policies, United Nations Development \nAssistance Frameworks or equivalent planning frameworks;  \n \n4. \nEncourages the meaningful participation and integration of all people, \nincluding youth, older persons, women, migrants, refugees, persons with disabilities, \nminorities and other marginalized groups, into volunteer-involving programmes and \nprojects, with the provision of the appropriate means to leverage the full potential of \nvolunteerism; \n \n5. \nCommends the Member States that highlighted the contributions of \nvolunteers to the Sustainable Development Goals in their voluntary national reviews \nfor the high-level political forum on sustainable development held in 2016, 2017 and \n2018, and encourages all Member States to increasingly cooperate with volunteer-\ninvolving and civil society organizations, to include information on the scale, \ncontribution and impact of volunteerism in future voluntary national reviews and \nengage volunteers for the monitoring of progress towards achieving the Goals at the \nnational and subnational levels and as part of wider citizen engagement; \n \n6. \nEncourages all Member States to invest in measuring the scale and \ncontribution of people\u2019s voluntary efforts, in line with the nineteenth International \nConference of Labour Statisticians standard on volunteer work and the International \nLabour Organization Manual on the Measurement of Volunteer Work, and to collect \nand utilize high-quality data disaggregated by sex, age and disability to support and \n__________________ \n \n3  A/73/254. \n\nVolunteering for the 2030 Agenda for Sustainable Development \nA/RES/73/140\n \n3/4\n18-22173 \n \nintegrate volunteerism into national strategies and to measure its impact on the \nimplementation of the 2030 Agenda for Sustainable Development; \n \n7. \nCommends all volunteers globally \u2013 formal, informal, community, \nnational, international, online, youth and older volunteers \u2013 for their contributions to \nthe delivery of the 2030 Agenda for Sustainable Development; \n \n8. \nRequests Member States and the United Nations system to work together \nwith volunteer-involving organizations, including from civil society, to support \nefforts to enhance the protection, security and well-being of volunteers, calls upon \nStates to create and maintain, in law and in practice, a safe and enabling environment \nfor volunteers, and encourages the adoption of good practices in the promotion, \nfacilitation and, where applicable, management of volunteerism; \n \n9. \nReaffirms the institutional arrangements to implement the plan of action \nto integrate volunteering into the 2030 Agenda for Sustainable Development, which \nare consistent with and complement existing global review mechanisms on the \nSustainable Development Goals and build upon and are complemented by \nindependent forums and processes that maximize the participation, voice and \ncontributions of volunteers, and, in particular:  \n \n(a) \nEncourages Member States to continue to work with national and local \npartners to prepare an analysis of volunteering at the national level before the end \nof 2018;  \n \n(b) \nWelcomes that national-level analysis will be inputs for regional \nconsultations on volunteering in 2019, and requests that these regional consultations \nbe held under the auspices of the regional commissions of the United Nations in the \ncontext of the regional forums on sustainable development, providing an opportunity \nfor Member States and partners to discuss evidence and approaches, identify \nopportunities for addressing knowledge gaps and ensure, among other things, that \nnational and regional inputs into the high-level political forum on sustainable \ndevelopment take account of volunteer contributions to the 2030 Agenda;  \n \n(c) \nEncourages civil society, academia and the private sector, and especially \nvolunteer-involving organizations, to use all existing forums and processes, in \naccordance with the rules and mandates of such forums and processes, to increase \nconsultations on trends, evidence and approaches on volunteer contributions to the \n2030 Agenda and the plan of action; \n \n(d) \nRequests the United Nations Volunteers programme, and invites the \nInternational Federation of Red Cross and Red Crescent Societies, to jointly organize \nthe global technical meeting to be held in 2020 on the theme \u201cReimagining \nvolunteerism for the 2030 Agenda\u201d, building upon the foundations provided by the \nprocesses highlighted above, to further strengthen the engagement and contributions \nof volunteers with regard to the 2030 Agenda, and requests that this meeting be held \nas a special event on the margins of the high-level political forum on sustainable \ndevelopment in 2020;  \n \n10. Recognizes the United Nations Volunteers programme as the appropriate \nUnited Nations entity to support the implementation of the plan of action, and expects \nthe programme to coordinate the work to consolidate and disseminate good practices \nand lessons learned, promote successful volunteer actions and ensure that the \ndifferentiated impact of volunteers on the implementation of the 2030 Agenda for \nSustainable Development is documented as part of regular national policy, planning \nand implementation practices; \n \n11. \nAlso recognizes the role of information and communications technologies \nin expanding innovative forms of volunteering, and encourages Governments, the \n\nA/RES/73/140 \nVolunteering for the 2030 Agenda for Sustainable Development\n \n18-22173\n4/4 \n \nprivate sector, civil society and other stakeholders to support online volunteering, \nincluding United Nations online volunteering that provides inclusive technology-\nenabled global platforms;  \n \n12. Further recognizes the Special Voluntary Fund for the United Nations \nVolunteers as the resource enabling the United Nations Volunteers programme to \nsupport the implementation of the plan of action, as well as develop initiatives that \nembed the values of volunteerism in the work of Governments and the United Nations \nsystem, and encourages Member States in a position to do so to enhance their \ncontributions to the Fund, thereby ensuring continuing activities; \n \n13. Requests the Secretary-General to report to the General Assembly at its \nseventy-sixth session on the implementation of the present resolution, including the \nplan of action to integrate volunteering into the 2030 Agenda for Sustainable \nDevelopment, under the item entitled \u201cSocial development\u201d. \n \n55th plenary meeting \n17 December 2018 \n \n",
  "paragraphs": {
    "1": "Welcomes the report of the Secretary-General on the plan of action to integrate volunteering into the 2030 Agenda for Sustainable Development; 3",
    "2": "Recognizes the importance of integrating volunteerism, as appropriate, into the planning for the implementation of the 2030 Agenda for Sustainable Development,1 and encourages the United Nations system, civil society and the private sector, in partnership with Member States, to support such efforts and promote a conducive environment for volunteerism and volunteers to enhance the sustainability of development results;",
    "3": "Encourages Governments, in partnership with United Nations entities, volunteer-involving organizations, the private sector, civil society, including academia, and other stakeholders, as appropriate, to integrate volunteerism into national development strategies, plans and policies, United Nations Development Assistance Frameworks or equivalent planning frameworks;",
    "4": "Encourages the meaningful participation and integration of all people, including youth, older persons, women, migrants, refugees, persons with disabilities, minorities and other marginalized groups, into volunteer-involving programmes and projects, with the provision of the appropriate means to leverage the full potential of volunteerism;",
    "5": "Commends the Member States that highlighted the contributions of volunteers to the Sustainable Development Goals in their voluntary national reviews for the high-level political forum on sustainable development held in 2016, 2017 and 2018, and encourages all Member States to increasingly cooperate with volunteer- involving and civil society organizations, to include information on the scale, contribution and impact of volunteerism in future voluntary national reviews and engage volunteers for the monitoring of progress towards achieving the Goals at the national and subnational levels and as part of wider citizen engagement;",
    "6": "Encourages all Member States to invest in measuring the scale and contribution of people\u2019s voluntary efforts, in line with the nineteenth International Conference of Labour Statisticians standard on volunteer work and the International Labour Organization Manual on the Measurement of Volunteer Work, and to collect and utilize high-quality data disaggregated by sex, age and disability to support and integrate volunteerism into national strategies and to measure its impact on the implementation of the 2030 Agenda for Sustainable Development;",
    "7": "Commends all volunteers globally \u2013 formal, informal, community, national, international, online, youth and older volunteers \u2013 for their contributions to the delivery of the 2030 Agenda for Sustainable Development;",
    "8": "Requests Member States and the United Nations system to work together with volunteer-involving organizations, including from civil society, to support efforts to enhance the protection, security and well-being of volunteers, calls upon States to create and maintain, in law and in practice, a safe and enabling environment for volunteers, and encourages the adoption of good practices in the promotion, facilitation and, where applicable, management of volunteerism;",
    "9": "Reaffirms the institutional arrangements to implement the plan of action to integrate volunteering into the 2030 Agenda for Sustainable Development, which are consistent with and complement existing global review mechanisms on the Sustainable Development Goals and build upon and are complemented by independent forums and processes that maximize the participation, voice and contributions of volunteers, and, in particular: (a) Encourages Member States to continue to work with national and local partners to prepare an analysis of volunteering at the national level before the end of 2018; (b) Welcomes that national-level analysis will be inputs for regional consultations on volunteering in 2019, and requests that these regional consultations be held under the auspices of the regional commissions of the United Nations in the context of the regional forums on sustainable development, providing an opportunity for Member States and partners to discuss evidence and approaches, identify opportunities for addressing knowledge gaps and ensure, among other things, that national and regional inputs into the high-level political forum on sustainable development take account of volunteer contributions to the 2030 Agenda; (c) Encourages civil society, academia and the private sector, and especially volunteer-involving organizations, to use all existing forums and processes, in accordance with the rules and mandates of such forums and processes, to increase consultations on trends, evidence and approaches on volunteer contributions to the 2030 Agenda and the plan of action; (d) Requests the United Nations Volunteers programme, and invites the International Federation of Red Cross and Red Crescent Societies, to jointly organize the global technical meeting to be held in 2020 on the theme \u201cReimagining volunteerism for the 2030 Agenda\u201d, building upon the foundations provided by the processes highlighted above, to further strengthen the engagement and contributions of volunteers with regard to the 2030 Agenda, and requests that this meeting be held as a special event on the margins of the high-level political forum on sustainable development in 2020;",
    "10": "Recognizes the United Nations Volunteers programme as the appropriate United Nations entity to support the implementation of the plan of action, and expects the programme to coordinate the work to consolidate and disseminate good practices and lessons learned, promote successful volunteer actions and ensure that the differentiated impact of volunteers on the implementation of the 2030 Agenda for Sustainable Development is documented as part of regular national policy, planning and implementation practices;",
    "11": " private sector, civil society and other stakeholders to support online volunteering, including United Nations online volunteering that provides inclusive technology- enabled global platforms;",
    "12": "Further recognizes the Special Voluntary Fund for the United Nations Volunteers as the resource enabling the United Nations Volunteers programme to support the implementation of the plan of action, as well as develop initiatives that embed the values of volunteerism in the work of Governments and the United Nations system, and encourages Member States in a position to do so to enhance their contributions to the Fund, thereby ensuring continuing activities;",
    "13": "Requests the Secretary-General to report to the General Assembly at its seventy-sixth session on the implementation of the present resolution, including the plan of action to integrate volunteering into the 2030 Agenda for Sustainable Development, under the item entitled \u201cSocial development\u201d."
  },
  "agenda_items": [
    "Item 28"
  ],
  "symbol_references": []
}