{
  "symbol": "A/RES/73/283",
  "filename": "A_RES_73_283.pdf",
  "title": "73/283. The role of diamonds in fuelling conflict: breaking the link between the illicit transaction of rough diamonds and armed conflict as a contribution to prevention and settlement of conflicts",
  "text": "United Nations \nA/RES/73/283\n \n \nGeneral Assembly \nDistr.: General \n5 March 2019 \n \n \n19-03518 (E)    070319  \n*1903518* \n \n \nSeventy-third session \nAgenda item 33 \n \n \n \n \n Resolution adopted by the General Assembly \non 1 March 2019 \n \n \n \n \n[without reference to a Main Committee (A/73/L.75 and A/73/L.75/Add.1)] \n \n \n 73/283. The role of diamonds in fuelling conflict: breaking the link between \nthe illicit transaction of rough diamonds and armed conflict as a \ncontribution to prevention and settlement of conflicts \n \n \n \nThe General Assembly,  \n \nRecognizing that the trade in conflict diamonds continues to be a matter of \nserious international concern, which can be directly linked to the fuelling of armed \nconflict, the activities of rebel movements aimed at undermining or overthrowing \nlegitimate Governments and the illicit traffic in and proliferation of armaments, \nespecially small arms and light weapons,  \n \nRecognizing also the devastating impact of conflicts fuelled by the trade in \nconflict diamonds on peace and the safety and security of people in affected countries, \nand the systematic and gross human rights violations that have been perpetrated in \nsuch conflicts,  \n \nNoting the negative impact of such conflicts on regional stability and the \nobligations placed upon States by the Charter of the United Nations regarding the \nmaintenance of international peace and security, and recognizing that continued \naction to curb the trade in conflict diamonds is imperative,  \n \nNoting with appreciation that the Kimberley Process, as an international \ninitiative led by Participants, has pursued its deliberations on an inclusive basis \ninvolving concerned stakeholders, including producing, exporting and importing \nStates, the diamond industry and civil society, as well as applicant States and \ninternational organizations,  \n \nWelcoming the important contribution of the Kimberley Process, which was \ninitiated by African diamond-producing countries, and calling for the consistent \nimplementation of commitments made by Kimberley Process Participants and the \ndiamond industry and civil society organizations, as observers,  \n\nA/RES/73/283 \nThe role of diamonds in fuelling conflict: breaking the link between \nthe illicit transaction of rough diamonds and armed conflict as a\ncontribution to prevention and settlement of conflicts\n \n19-03518\n2/4 \n \n \nAcknowledging that the diamond sector is an important catalyst for promoting \neconomic and social development, which are necessary for poverty reduction and \nmeeting the requirements of the Sustainable Development Goals 1 in many producing \ncountries, particularly in developing countries,  \n \nNoting that, while the vast majority of rough diamonds produced in the world \nare from legitimate sources, the elimination of conflict diamonds from legitimate \ntrade is the primary objective of the Kimberley Process, and stressing the need to \ncontinue its activities in order to achieve this objective, \n \nRecognizing that the Kimberley Process promotes legitimate rough diamond \ntrade, and recalling the positive benefits of legitimate diamond trade to producing \ncountries, including its transparency and accountability throughout the diamond \nindustry, and the contribution it has made to the economies of producing, exporting \nand importing States, and therefore underlining the need for continued international \naction with regard to the ethical exploitation, sale and trade of rough diamonds, \n \nAcknowledging the successful role that the Kimberley Process has played, in the \nlast 16 years, in stemming the flow of conflict diamonds and the valuable \ndevelopment impact it has had in improving the lives of many people dependent on \nthe trade in diamonds, recognizing the contribution of the Kimberley Process to the \nsettlement of conflicts and the consolidation of peace in Angola, C\u00f4te d\u2019Ivoire, \nLiberia and Sierra Leone, and noting that the 2018 plenary meeting of the Kimberley \nProcess, in looking towards the future, committed to continuing to ensure that the \nKimberley Process remains an effective multilateral tool for conflict prevention in \nstemming the flow of conflict diamonds, \n \nRecalling the Charter and all the relevant resolutions of the General Assembly \nand of the Security Council related to conflict diamonds, and determined to contribute \nto and support the implementation of the measures provided for in those resolutions,  \n \nNoting with satisfaction that the implementation of the Kimberley Process \nCertification Scheme2 continues to have a positive impact in reducing the opportunity \nfor conflict diamonds to play a role in fuelling armed conflict and helps to protect \nlegitimate trade and ensure the effective implementation of the relevant resolutions \non trade in conflict diamonds,  \n \nRecognizing that regular review and reform of the Kimberley Process will be \nnecessary to keep pace with and aim to address the ongoing threat of instability, \nconflict and contemporary challenges in the diamond trade, as well as to seize \ncontemporary opportunities, \n \nWelcoming the decision of the 55 Kimberley Process Participants, representing \n82 countries, including the 28 States members of the European Union represented by \nthe European Commission, to address the problem of conflict diamonds by \nparticipating in the Kimberley Process and implementing the Kimberley Process \nCertification Scheme,  \n \nWelcoming Gabon as the fifty-fifth Kimberley Process Participant, \n \nRecognizing that State sovereignty should be fully respected and that the \nprinciples of equality, mutual benefits and consensus should be adhered to, and \nwelcoming the implementation of the Kimberley Process Certification Scheme in \nsuch a way as not to impede the legitimate trade in diamonds or impose an undue \n_______________ \n1 See resolution 70/1. \n2 See A/57/489. \n\nThe role of diamonds in fuelling conflict: breaking the link between \nthe illicit transaction of rough diamonds and armed conflict as a \ncontribution to prevention and settlement of conflicts \nA/RES/73/283\n \n3/4\n19-03518 \n \nburden on Governments or industry, particularly smaller producers, and not to hinder \nthe development of the diamond industry, \n \nRecognizing also that the Kimberley Process Certification Scheme, which came \ninto effect on 1 January 2003, will be credible only if all Participants have the \nrequisite national legislation coupled with effective and credible internal systems of \ncontrol designed to eliminate the presence of conflict diamonds in the chain of \nproducing, exporting and importing rough diamonds within their own territories and \nacross their borders, while taking into account that differences in production methods \nand trading practices, as well as differences in the institutional controls thereof, may \nrequire different approaches to meeting minimum standards, and encouraging all \nParticipants to work towards overall compliance with the Kimberley Process \nstandards,  \n \nWelcoming the important contribution to fulfilling the purposes of the \nKimberley Process that has been made and continues to be made by Participants, civil \nsociety organizations from across Participant countries, and the diamond industry, to \nassist international efforts to stop the trade in conflict diamonds,  \n \nTaking note of the updated System of Warranties guidelines promulgated by the \nWorld Diamond Council in 2018, \n \nNoting that the Ad Hoc Committee on Review and Reform agreed in principle \nto the establishment of the Permanent Secretariat and that it plans to work further on \nthis matter in 2019,  \n \nTaking note of the decision of the General Council of the World Trade \nOrganization of 26 July 2018 to grant an extension until 31 December 2024 of a \nwaiver with respect to the measures taken to implement the Kimberley Process \nCertification Scheme, \n \n1. \nTakes note of the outcomes of the 2018 plenary meeting of the Kimberley \nProcess, hosted in Brussels by the European Union from 12 to 16 November 2018,3 \nand reaffirms its strong and continuing support for the Kimberley Process \nCertification Scheme2 and the Kimberley Process as a whole;  \n \n2. \nRecognizes that the Kimberley Process Certification Scheme helps to \nensure the effective implementation of relevant resolutions of the Security Council \ncontaining sanctions on the trade in conflict diamonds and contributes to the \nprevention of future conflicts fuelled by diamonds, and calls for the full \nimplementation of existing Council measures targeting the illicit trade in rough \ndiamonds, particularly conflict diamonds which play a role in fuelling conflict;  \n \n3. \nReaffirms the importance of the tripartite nature of the Kimberley Process, \nstresses that the widest possible participation in the Kimberley Process Certification \nScheme is essential, encourages Participants to contribute to the work of the \nKimberley Process by participating actively in the Certification Scheme and ensuring \ncompliance with its undertakings and the effective implementation of its measures, \nunderscores the importance of the Civil Society Coalition and its members to the \nKimberley Process, and acknowledges the importance of supporting additional \napplications for membership by civil society organizations; \n \n4. \nCommends the work of Kimberley Process working bodies in advancing \nthe objectives of the Kimberley Process;  \n_______________ \n3 See A/73/720. \n\nA/RES/73/283 \nThe role of diamonds in fuelling conflict: breaking the link between \nthe illicit transaction of rough diamonds and armed conflict as a\ncontribution to prevention and settlement of conflicts\n \n19-03518\n4/4 \n \n \n5. \nRecalls the central place of mining communities in the Kimberley Process \nand the need to devote particular attention to engaging artisanal miners in governance \nstructures, developing best practices, building upon experiences in other minerals and \ngold in artisanal and small-scale mining and promoting the rule of law; \n \n6. \nWelcomes efforts to enhance cooperation with and assistance to \nParticipants in Kimberley Process matters, including with a regional dimension, \nfocusing on the implementation of best practices, capacity-building and compliance \nwith Kimberley Process standards, rules and procedures; \n \n7. \nRecognizes the value of engaging with relevant external organizations to \nsupport the work of the Kimberley Process and its working bodies, and in this regard \nwelcomes the guidelines adopted by the Kimberley Process, which will facilitate \nengagement in a spirit of transparency and inclusiveness;  \n \n8. \nEncourages further strengthening of the Kimberley Process to enhance its \neffectiveness in addressing challenges posed to the diamond industry and related \ncommunities, including from instability and conflict, and to ensure that the Kimberley \nProcess remains relevant for the future and continues to contribute to international \npeace and security and the achievement of the 2030 Agenda for Sustainable \nDevelopment1 and the Sustainable Development Goals, and looks forward to further \nexploring and advancing the ways in which the Kimberley Process contributes to \npeacebuilding and sustaining peace;  \n \n9. \nRecalls the commitment of the Kimberley Process to the reform and \nreview, and notes that the Ad Hoc Committee on Review and Reform will continue \ndiscussion and consultations on the areas of consolidation of the core document and \nstrengthening of the peer review mechanism, establishment of the Permanent \nSecretariat, establishment of the multi-donor fund, and considering how to strengthen \nthe scope of the Kimberley Process; \n \n10. Also recalls the critical importance of the peer review mechanism for the \ncredibility of the Kimberley Process, and welcomes progress ongoing towards \nenhancing its effectiveness; \n \n11. \nNotes initiatives put forward by Participants as well as joint initiatives by \nindustry and by civil society as elements of a strengthened Kimberley Process that \nillustrate their continuous engagement towards a more effective, responsible and \ninclusive Kimberley Process, and invites further contributions from other Participants \nand observers for consideration by the Kimberley Process in 2019; \n \n12. Acknowledges with great appreciation the important contribution that the \nEuropean Union, as Chair of the Kimberley Process in 2018, has made towards \ncurbing the trade in conflict diamonds, and welcomes the selection of India as the \nChair of the Kimberley Process for 2019, the Russian Federation as the Vice-Chair \nfor 2019 and the Chair for 2020 and Botswana as the Vice-Chair for 2020 and the \nChair for 2021;  \n \n13. Requests the Chair of the Kimberley Process to submit to the General \nAssembly at its seventy-fourth session a report on the implementation of the \nKimberley Process;  \n \n14. Decides to include in the provisional agenda of its seventy-fourth session \nthe item entitled \u201cThe role of diamonds in fuelling conflict\u201d. \n \n69th plenary meeting \n1 March 2019 \n \n",
  "paragraphs": {
    "1": "Takes note of the outcomes of the 2018 plenary meeting of the Kimberley Process, hosted in Brussels by the European Union from 12 to 16 November 2018,3 and reaffirms its strong and continuing support for the Kimberley Process Certification Scheme2 and the Kimberley Process as a whole;",
    "2": "Recognizes that the Kimberley Process Certification Scheme helps to ensure the effective implementation of relevant resolutions of the Security Council containing sanctions on the trade in conflict diamonds and contributes to the prevention of future conflicts fuelled by diamonds, and calls for the full implementation of existing Council measures targeting the illicit trade in rough diamonds, particularly conflict diamonds which play a role in fuelling conflict;",
    "3": "Reaffirms the importance of the tripartite nature of the Kimberley Process, stresses that the widest possible participation in the Kimberley Process Certification Scheme is essential, encourages Participants to contribute to the work of the Kimberley Process by participating actively in the Certification Scheme and ensuring compliance with its undertakings and the effective implementation of its measures, underscores the importance of the Civil Society Coalition and its members to the Kimberley Process, and acknowledges the importance of supporting additional applications for membership by civil society organizations;",
    "4": "Commends the work of Kimberley Process working bodies in advancing the objectives of the Kimberley Process; _______________ 3 See A/73/720. A/RES/73/283 The role of diamonds in fuelling conflict: breaking the link between the illicit transaction of rough diamonds and armed conflict as a contribution to prevention and settlement of conflicts 19-03518 4/4",
    "5": "Recalls the central place of mining communities in the Kimberley Process and the need to devote particular attention to engaging artisanal miners in governance structures, developing best practices, building upon experiences in other minerals and gold in artisanal and small-scale mining and promoting the rule of law;",
    "6": "Welcomes efforts to enhance cooperation with and assistance to Participants in Kimberley Process matters, including with a regional dimension, focusing on the implementation of best practices, capacity-building and compliance with Kimberley Process standards, rules and procedures;",
    "7": "Recognizes the value of engaging with relevant external organizations to support the work of the Kimberley Process and its working bodies, and in this regard welcomes the guidelines adopted by the Kimberley Process, which will facilitate engagement in a spirit of transparency and inclusiveness;",
    "8": "Encourages further strengthening of the Kimberley Process to enhance its effectiveness in addressing challenges posed to the diamond industry and related communities, including from instability and conflict, and to ensure that the Kimberley Process remains relevant for the future and continues to contribute to international peace and security and the achievement of the 2030 Agenda for Sustainable Development1 and the Sustainable Development Goals, and looks forward to further exploring and advancing the ways in which the Kimberley Process contributes to peacebuilding and sustaining peace;",
    "9": "Recalls the commitment of the Kimberley Process to the reform and review, and notes that the Ad Hoc Committee on Review and Reform will continue discussion and consultations on the areas of consolidation of the core document and strengthening of the peer review mechanism, establishment of the Permanent Secretariat, establishment of the multi-donor fund, and considering how to strengthen the scope of the Kimberley Process;",
    "10": "Also recalls the critical importance of the peer review mechanism for the credibility of the Kimberley Process, and welcomes progress ongoing towards enhancing its effectiveness;",
    "11": "Notes initiatives put forward by Participants as well as joint initiatives by industry and by civil society as elements of a strengthened Kimberley Process that illustrate their continuous engagement towards a more effective, responsible and inclusive Kimberley Process, and invites further contributions from other Participants and observers for consideration by the Kimberley Process in 2019;",
    "12": "Acknowledges with great appreciation the important contribution that the European Union, as Chair of the Kimberley Process in 2018, has made towards curbing the trade in conflict diamonds, and welcomes the selection of India as the Chair of the Kimberley Process for 2019, the Russian Federation as the Vice-Chair for 2019 and the Chair for 2020 and Botswana as the Vice-Chair for 2020 and the Chair for 2021;",
    "13": "Requests the Chair of the Kimberley Process to submit to the General Assembly at its seventy-fourth session a report on the implementation of the Kimberley Process;",
    "14": "Decides to include in the provisional agenda of its seventy-fourth session the item entitled \u201cThe role of diamonds in fuelling conflict\u201d. 69th plenary meeting 1 March 2019"
  },
  "agenda_items": [
    "Item 33"
  ],
  "symbol_references": [
    "A/73/L.75"
  ]
}