{
  "symbol": "A/RES/75/265",
  "filename": "A_RES_75_265.pdf",
  "title": "75/265. Cooperation between the United Nations and the Organisation for the Prohibition of Chemical Weapons",
  "text": "United Nations \nA/RES/75/265\n \n \nGeneral Assembly \nDistr.: General \n8 March 2021 \n \n21-03042 (E)    100321 \n*2103042* \n \n \nSeventy-fifth session \nAgenda item 130 (n) \nCooperation between the United Nations and regional and \nother organizations: cooperation between the United Nations \nand the Organisation for the Prohibition of Chemical Weapons \n \n \n \n \n Resolution adopted by the General Assembly \non 3 March 2021 \n \n \n \n \n[without reference to a Main Committee (A/75/L.56 and A/75/L.56/Add.1)] \n \n \n 75/265. Cooperation between the United Nations and the Organisation for \nthe Prohibition of Chemical Weapons \n \n \n \nThe General Assembly, \n \nRecalling its resolution 73/258 of 20 December 2018 on cooperation between \nthe United Nations and the Organisation for the Prohibition of Chemical Weapons, \n \nHaving received the annual report for 2018 and the draft report for 2019 of the \nOrganisation for the Prohibition of Chemical Weapons on the implementation of the \nConvention on the Prohibition of the Development, Production, Stockpiling and Use \nof Chemical Weapons and on Their Destruction,1 \n \n1. \nTakes note of the annual report for 2018 and the draft report for 2019 of \nthe Organisation for the Prohibition of Chemical Weapons submitted on its behalf by \nits Director General; \n \n2. \nNotes with appreciation the ongoing work of the Organisation for the \nProhibition of Chemical Weapons with regard to the implementation of the \nConvention on the Prohibition of the Development, Production, Stockpiling and Use \nof Chemical Weapons and on Their Destruction;2 \n \n3. \nCommends the continued work of the Organisation for the Prohibition of \nChemical Weapons to enhance the capacity of States parties and the Organisation to \nuse chemistry for peaceful purposes and respond to threats involving toxic chemicals, \nincluding through the development of a Centre for Chemistry and Technology as a \nplatform where the Technical Secretariat and States parties can learn, exchange views \nand work in common purpose to further achieve the object and purpose of the \nConvention; \n__________________ \n \n1 See A/75/128. \n \n2 United Nations, Treaty Series, vol. 1974, No. 33757. \n\nA/RES/75/265 \nCooperation between the United Nations and the \nOrganisation for the Prohibition of Chemical Weapons\n \n21-03042\n2/2 \n \n \n4. \nWelcomes the effective and ongoing cooperation between the United \nNations and the Organisation for the Prohibition of Chemical Weapons as set out in \nthe Agreement concerning the Relationship between the United Nations and the \nOrganisation for the Prohibition of Chemical Weapons;3 \n \n5. \nRecalls the report of the Conference of the States Parties to the Convention \non the Prohibition of the Development, Production, Stockpiling and Use of Chemical \nWeapons and on Their Destruction on its fourth special session, held in The Hague \non 26 and 27 June 2018, and also recalls the decision adopted at the special session \nentitled \u201cAddressing the threat from chemical weapons use\u201d; \n \n6. \nNotes the establishment of the Investigation and Identification Team of the \nOrganisation for the Prohibition of Chemical Weapons as announced at the ninety-\nfirst session of the Executive Council of the Organisation in a note by the Technical \nSecretariat, EC-91/S/3, dated 28 June 2019, entitled \u201cWork of the Investigation and \nIdentification Team established by decision C-SS-4/DEC.3 (dated 27 June 2018)\u201d, in \nwhich all States parties were informed about the establishment of the Investigation \nand Identification Team with the purpose of identifying, in compliance with C-SS-4/ \nDEC.3, the perpetrators of the use of chemical weapons in the Syrian Arab Republic; \n \n7. \nTakes note with grave concern of the first report of the Investigation and \nIdentification Team pursuant to paragraph 10 of decision C-SS-4/DEC.3, entitled \n\u201cAddressing the threat from chemical weapons use: Ltamenah (Syrian Arab Republic) \u2013 \n24, 25, and 30 March 2017\u201d, released on 8 April 2020, and expresses appreciation for \nthe work done in this regard, takes note of the decision of the Executive Council dated \n9 July 2020, entitled \u201cAddressing the possession and use of chemical weapons by the \nSyrian Arab Republic\u201d, and welcomes the transmission of that decision and its \nassociated reports to the Security Council and the General Assembly through the \nSecretary-General; \n \n8. \nRecalls Security Council resolution 2118 (2013) of 27 September 2013, in \nwhich, inter alia, the Council requested the Director General of the Organisation for \nthe Prohibition of Chemical Weapons to report to the Security Council, through the \nSecretary-General, on a monthly basis, on the implementation of resolution \n2118 (2013) and the decision of the Executive Council of the Organisation of \n27 September 2013, also recalls paragraph 5 of Security Council resolution \n2209 (2015) of 6 March 2015, in which the Council welcomed the intention of the \nDirector General to include future reports of the Organisation for the Prohibition of \nChemical Weapons fact-finding mission in the Syrian Arab Republic, which was \nmandated to establish the facts surrounding allegations of the use of toxic chemicals \nfor hostile purposes in the Syrian Arab Republic, as part of his monthly report to the \nCouncil, notes in this regard the transmission by the Director General of all monthly \nreports, as well as all reports of the fact-finding mission, during the reporting period, \nand expresses appreciation for the work done in this regard; \n \n9. \nDecides to include in the provisional agenda of its seventy-seventh \nsession, under the item entitled \u201cCooperation between the United Nations and \nregional and other organizations\u201d, the sub-item entitled \u201cCooperation between the \nUnited Nations and the Organisation for the Prohibition of Chemical Weapons\u201d. \n \n56th plenary meeting \n3 March 2021 \n \n__________________ \n \n3 Ibid., vol. 2160, No. 1240. \n",
  "paragraphs": {
    "1": "Takes note of the annual report for 2018 and the draft report for 2019 of the Organisation for the Prohibition of Chemical Weapons submitted on its behalf by its Director General;",
    "2": "Notes with appreciation the ongoing work of the Organisation for the Prohibition of Chemical Weapons with regard to the implementation of the Convention on the Prohibition of the Development, Production, Stockpiling and Use of Chemical Weapons and on Their Destruction;2",
    "3": "Commends the continued work of the Organisation for the Prohibition of Chemical Weapons to enhance the capacity of States parties and the Organisation to use chemistry for peaceful purposes and respond to threats involving toxic chemicals, including through the development of a Centre for Chemistry and Technology as a platform where the Technical Secretariat and States parties can learn, exchange views and work in common purpose to further achieve the object and purpose of the Convention; __________________ 1 See A/75/128. 2 United Nations, Treaty Series, vol. 1974, No. 33757. A/RES/75/265 Cooperation between the United Nations and the Organisation for the Prohibition of Chemical Weapons 21-03042 2/2",
    "4": "Welcomes the effective and ongoing cooperation between the United Nations and the Organisation for the Prohibition of Chemical Weapons as set out in the Agreement concerning the Relationship between the United Nations and the Organisation for the Prohibition of Chemical Weapons;3",
    "5": "Recalls the report of the Conference of the States Parties to the Convention on the Prohibition of the Development, Production, Stockpiling and Use of Chemical Weapons and on Their Destruction on its fourth special session, held in The Hague on 26 and 27 June 2018, and also recalls the decision adopted at the special session entitled \u201cAddressing the threat from chemical weapons use\u201d;",
    "6": "Notes the establishment of the Investigation and Identification Team of the Organisation for the Prohibition of Chemical Weapons as announced at the ninety- first session of the Executive Council of the Organisation in a note by the Technical Secretariat, EC-91/S/3, dated 28 June 2019, entitled \u201cWork of the Investigation and Identification Team established by decision C-SS-4/DEC.3 (dated 27 June 2018)\u201d, in which all States parties were informed about the establishment of the Investigation and Identification Team with the purpose of identifying, in compliance with C-SS-4/ DEC.3, the perpetrators of the use of chemical weapons in the Syrian Arab Republic;",
    "7": "Takes note with grave concern of the first report of the Investigation and Identification Team pursuant to paragraph 10 of decision C-SS-4/DEC.3, entitled \u201cAddressing the threat from chemical weapons use: Ltamenah (Syrian Arab Republic) \u2013 24, 25, and 30 March 2017\u201d, released on 8 April 2020, and expresses appreciation for the work done in this regard, takes note of the decision of the Executive Council dated 9 July 2020, entitled \u201cAddressing the possession and use of chemical weapons by the Syrian Arab Republic\u201d, and welcomes the transmission of that decision and its associated reports to the Security Council and the General Assembly through the Secretary-General;",
    "8": "Recalls Security Council resolution 2118 (2013) of 27 September 2013, in which, inter alia, the Council requested the Director General of the Organisation for the Prohibition of Chemical Weapons to report to the Security Council, through the Secretary-General, on a monthly basis, on the implementation of resolution 2118 (2013) and the decision of the Executive Council of the Organisation of 27 September 2013, also recalls paragraph 5 of Security Council resolution 2209 (2015) of 6 March 2015, in which the Council welcomed the intention of the Director General to include future reports of the Organisation for the Prohibition of Chemical Weapons fact-finding mission in the Syrian Arab Republic, which was mandated to establish the facts surrounding allegations of the use of toxic chemicals for hostile purposes in the Syrian Arab Republic, as part of his monthly report to the Council, notes in this regard the transmission by the Director General of all monthly reports, as well as all reports of the fact-finding mission, during the reporting period, and expresses appreciation for the work done in this regard;",
    "9": "Decides to include in the provisional agenda of its seventy-seventh session, under the item entitled \u201cCooperation between the United Nations and regional and other organizations\u201d, the sub-item entitled \u201cCooperation between the United Nations and the Organisation for the Prohibition of Chemical Weapons\u201d. 56th plenary meeting 3 March 2021 __________________ 3 Ibid., vol. 2160, No. 1240."
  },
  "agenda_items": [
    "Item 130"
  ],
  "symbol_references": [
    "A/75/L.56"
  ]
}