{
  "symbol": "A/RES/73/10",
  "filename": "A_RES_73_10.pdf",
  "title": "73/10. Cooperation between the United Nations and the Central European Initiative",
  "text": "United Nations \nA/RES/73/10\n \n \nGeneral Assembly \nDistr.: General \n29 November 2018 \n \n18-20442 (E)    031218     \n*1820442* \n \n \nSeventy-third session \nAgenda item 128 (u) \n \n \n \n \n Resolution adopted by the General Assembly \non 26 November 2018 \n \n \n \n \n[without reference to a Main Committee (A/73/L.17 and A/73/L.17/Add.1)] \n \n \n \n73/10. Cooperation between the United Nations and the Central \nEuropean Initiative \n \n \n \nThe General Assembly,  \n \nRecalling its resolution 66/111 of 9 December 2011, by which it granted \nobserver status to the Central European Initiative,  \n \nRecalling also its resolutions 67/7 of 19 November 2012, 69/8 of 11 November \n2014 and 71/13 of 21 November 2016, in which it invited the specialized agencies \nand other organizations and programmes of the United Nations system to cooperate \nwith the Initiative in order to continue joint activities for the achievement of common \nobjectives,  \n \nRecalling further the Articles of the Charter of the United Nations that \nencourage activities through regional cooperation to promote the goals and objectives \nof the United Nations, \n \nAppreciating the active involvement of the Initiative in establishing cooperation \nwith the United Nations system and relevant international and regional organizations, \naimed at the furthering of political and socioeconomic development by covering all \nits relevant dimensions, \n \nTaking note of the report of the Secretary-General submitted pursuant to \nresolution 71/13,1 \n \n1. \nWelcomes the important role consistently played by the Central European \nInitiative as a promoter of political dialogue and as a flexible and pragmatic platform \nfor regional cooperation, thus supporting peace, stability, security and the economic \nprogress of its member States, including through the implementation of tangible \nprojects and programmes in priority fields; \n__________________ \n \n1  See A/73/328-S/2018/592, sect. II. \n\nA/RES/73/10 \nCooperation between the United Nations and the Central European Initiative\n \n18-20442\n2/3 \n \n \n2. \nAppreciates the Central European Initiative Plan of Action 2018\u20132020, \nadopted at the Central European Initiative summit held in Minsk in December 2017 \nduring the presidency of Belarus, aimed at promoting the connectivity and valorizing \nthe diversity in the region; \n \n3. \nRecognizes the commitment of the Initiative to contribute to the attainment \nof the 2030 Agenda for Sustainable Development;2  \n \n4. \nAcknowledges, in this context, that the Central European Initiative Plan of \nAction 2018\u20132020 was elaborated in line with the 2030 Agenda for Sustainable \nDevelopment and thus bears in mind that interconnectivity in sustainable \ndevelopment can facilitate the effective translation of sustainable development \npolicies into concrete action at the national level; \n \n5. \nValues the activities of the Initiative aimed at strengthening regional \ncooperation in such priority fields as good governance, including migration, \ndigitalization and anti-corruption; economic growth, including transport, research and \ninnovation, the bioeconomy and blue growth, and sustainable development and \nentrepreneurship; environmental protection, including climate change, energy, in \nparticular renewable energy and energy efficiency, and biodiversity; intercultural \ncooperation, including social integration; media freedom; and scientific cooperation \nand education, including lifelong learning;  \n \n6. \nWelcomes the financing of projects through the Central European Initiative \ntrust fund at the European Bank for Reconstruction and Development, entirely \nfinanced by Italy, which provides mainly grant-type assistance for specific \ncomponents of technical cooperation projects, linked to large operations of the Bank \nin member States of the Central European Initiative that are not members of the \nEuropean Union; \n \n7. \nAlso welcomes the financing of small-scale multilateral projects in the \npriority fields by the Central European Initiative Cooperation Fund, to which all \nmember States contribute, and of projects related to capacity-building and the sharing \nof good practices with member States of the Central European Initiative that are not \nmembers of the European Union through the Know-how Exchange Programme, \nfinanced by Italy and Poland;  \n \n8. \nAppreciates the vigorous efforts of the Initiative to support, elaborate and \nrealize joint regional projects in strategic areas in cooperation with other important \nregional and international players; \n \n9. \nAcknowledges, in this context, the fruitful cooperation between the \nInitiative and the European Union, as one of the main co-funders of such projects, \nand supports the efforts of the Initiative to take concrete steps to establish other \nmutually beneficial partnerships with the European Union; \n \n10. Also acknowledges the efforts undertaken by the Initiative in intensifying \nits cooperation with the Organization for Security and Cooperation in Europe by \njoining forces in both financing and implementing projects addressing relevant issues, \nand in this regard welcomes the initiatives undertaken in cooperation with that \nOrganization, under the Chairmanship-in-Office of Italy, which are focused on youth, \neducation and human capital development; \n \n11. \nNotes the cooperation established between the Initiative and other regional \norganizations and initiatives; \n__________________ \n \n2  Resolution 70/1. \n\nCooperation between the United Nations and the Central European Initiative \nA/RES/73/10\n \n3/3\n18-20442 \n \n \n12. Welcomes the commitment of the Initiative to promoting fruitful \ncooperation with the United Nations, the specialized agencies and other organizations \nand programmes of the United Nations system, with the aim of achieving mutual \nparticipation in events and meetings of common interest and developing practical and \nresults-oriented joint projects, in particular with the United Nations Educational, \nScientific and Cultural Organization in the fields of culture and science and with the \nEconomic Commission for Europe in the field of energy; \n \n13. Also welcomes the cooperation established between the Initiative and the \nInternational Organization for Migration through the memorandum of understanding \nsigned on 13 December 2016;  \n \n14. Invites the Secretary-General to intensify the exchange with the Initiative \nin order to continue the fruitful cooperation and to facilitate coordination between the \nsecretariats; \n \n15. Encourages the specialized agencies and other organizations and \nprogrammes of the United Nations system to strengthen cooperation with the \nInitiative through common action aimed at achieving the shared goals; \n \n16. Requests the Secretary-General to submit to the General Assembly at its \nseventy-fifth session a report on the implementation of the present resolution;  \n \n17. Decides to include in the provisional agenda of its seventy-fifth session, \nunder the item entitled \u201cCooperation between the United Nations and regional and \nother organizations\u201d, the sub-item entitled \u201cCooperation between the United Nations \nand the Central European Initiative\u201d. \n \n39th plenary meeting  \n26 November 2018 \n \n",
  "paragraphs": {
    "1": "Welcomes the important role consistently played by the Central European Initiative as a promoter of political dialogue and as a flexible and pragmatic platform for regional cooperation, thus supporting peace, stability, security and the economic progress of its member States, including through the implementation of tangible projects and programmes in priority fields; __________________ 1 See A/73/328-S/2018/592, sect. II. A/RES/73/10 Cooperation between the United Nations and the Central European Initiative 18-20442 2/3",
    "2": "Appreciates the Central European Initiative Plan of Action 2018\u20132020, adopted at the Central European Initiative summit held in Minsk in December 2017 during the presidency of Belarus, aimed at promoting the connectivity and valorizing the diversity in the region;",
    "3": "Recognizes the commitment of the Initiative to contribute to the attainment of the 2030 Agenda for Sustainable Development;2",
    "4": "Acknowledges, in this context, that the Central European Initiative Plan of Action 2018\u20132020 was elaborated in line with the 2030 Agenda for Sustainable Development and thus bears in mind that interconnectivity in sustainable development can facilitate the effective translation of sustainable development policies into concrete action at the national level;",
    "5": "Values the activities of the Initiative aimed at strengthening regional cooperation in such priority fields as good governance, including migration, digitalization and anti-corruption; economic growth, including transport, research and innovation, the bioeconomy and blue growth, and sustainable development and entrepreneurship; environmental protection, including climate change, energy, in particular renewable energy and energy efficiency, and biodiversity; intercultural cooperation, including social integration; media freedom; and scientific cooperation and education, including lifelong learning;",
    "6": "Welcomes the financing of projects through the Central European Initiative trust fund at the European Bank for Reconstruction and Development, entirely financed by Italy, which provides mainly grant-type assistance for specific components of technical cooperation projects, linked to large operations of the Bank in member States of the Central European Initiative that are not members of the European Union;",
    "7": "Also welcomes the financing of small-scale multilateral projects in the priority fields by the Central European Initiative Cooperation Fund, to which all member States contribute, and of projects related to capacity-building and the sharing of good practices with member States of the Central European Initiative that are not members of the European Union through the Know-how Exchange Programme, financed by Italy and Poland;",
    "8": "Appreciates the vigorous efforts of the Initiative to support, elaborate and realize joint regional projects in strategic areas in cooperation with other important regional and international players;",
    "9": "Acknowledges, in this context, the fruitful cooperation between the Initiative and the European Union, as one of the main co-funders of such projects, and supports the efforts of the Initiative to take concrete steps to establish other mutually beneficial partnerships with the European Union;",
    "10": "Also acknowledges the efforts undertaken by the Initiative in intensifying its cooperation with the Organization for Security and Cooperation in Europe by joining forces in both financing and implementing projects addressing relevant issues, and in this regard welcomes the initiatives undertaken in cooperation with that Organization, under the Chairmanship-in-Office of Italy, which are focused on youth, education and human capital development;",
    "11": "Notes the cooperation established between the Initiative and other regional organizations and initiatives; __________________ 2 Resolution 70/1. Cooperation between the United Nations and the Central European Initiative A/RES/73/10 3/3 18-20442",
    "12": "Welcomes the commitment of the Initiative to promoting fruitful cooperation with the United Nations, the specialized agencies and other organizations and programmes of the United Nations system, with the aim of achieving mutual participation in events and meetings of common interest and developing practical and results-oriented joint projects, in particular with the United Nations Educational, Scientific and Cultural Organization in the fields of culture and science and with the Economic Commission for Europe in the field of energy;",
    "13": "Also welcomes the cooperation established between the Initiative and the International Organization for Migration through the memorandum of understanding signed on 13 December 2016;",
    "14": "Invites the Secretary-General to intensify the exchange with the Initiative in order to continue the fruitful cooperation and to facilitate coordination between the secretariats;",
    "15": "Encourages the specialized agencies and other organizations and programmes of the United Nations system to strengthen cooperation with the Initiative through common action aimed at achieving the shared goals;",
    "16": "Requests the Secretary-General to submit to the General Assembly at its seventy-fifth session a report on the implementation of the present resolution;",
    "17": "Decides to include in the provisional agenda of its seventy-fifth session, under the item entitled \u201cCooperation between the United Nations and regional and other organizations\u201d, the sub-item entitled \u201cCooperation between the United Nations and the Central European Initiative\u201d. 39th plenary meeting 26 November 2018"
  },
  "agenda_items": [
    "Item 128"
  ],
  "symbol_references": [
    "A/73/L.17"
  ]
}