{
  "symbol": "A/RES/78/223",
  "filename": "A_RES_78_223.pdf",
  "title": "78/223. Follow-up to the Fourteenth United Nations Congress on Crime Prevention and Criminal Justice and preparations for the Fifteenth United Nations Congress on Crime Prevention and Criminal Justice",
  "text": "United Nations \nA/RES/78/223\n \n \nGeneral Assembly \nDistr.: General \n22 December 2023 \n \n23-25990 (E)    100124 \n*2325990* \n \n \nSeventy-eighth session \nAgenda item 107 \nCrime prevention and criminal justice  \n \n \n \n \n Resolution adopted by the General Assembly \non 19 December 2023 \n \n \n \n \n[on the report of the Third Committee (A/78/482, para. 29)] \n \n \n 78/223. Follow-up to the Fourteenth United Nations Congress on Crime \nPrevention and Criminal Justice and preparations for the \nFifteenth United Nations Congress on Crime Prevention and \nCriminal Justice \n \n \n \nThe General Assembly,  \n \nEmphasizing the responsibility assumed by the United Nations in the field of \ncrime prevention and criminal justice in pursuance of Economic and Social Council \nresolution 155 C (VII) of 13 August 1948 and General Assembly resolution 415 (V) \nof 1 December 1950, \n \nAcknowledging that the United Nations congresses on crime prevention and \ncriminal justice, as major intergovernmental forums, have influenced national \npolicies and practices and promoted international cooperation in that field by \nfacilitating the exchange of views and experience, mobilizing public opinion and \nrecommending policy options at the national, regional and international levels, \n \nRecalling its resolution 46/152 of 18 December 1991, in the annex to which \nMember States affirmed that the United Nations congresses on crime prevention and \ncriminal justice should be held every five years and should provide a forum for, inter \nalia, the exchange of views between States, intergovernmental and non-governmental \norganizations and individual experts representing various professions and disciplines, \nthe exchange of experiences in research, law and policy development and the \nidentification of emerging trends and issues in crime prevention and criminal justice,  \n \nRecalling also the applicable provisions of its resolution 56/119 of 19 December \n2001, \n \nRecalling further the applicable provisions of Economic and Social Council \nresolution 1996/31 of 25 July 1996, \n\nA/RES/78/223 \nFollow-up to the Fourteenth United Nations Congress on \nCrime Prevention and Criminal Justice and preparations \nfor the Fifteenth United Nations Congress on Crime \nPrevention and Criminal Justice\n \n23-25990\n2/5 \n \n \nRecalling its resolution 57/270 B of 23 June 2003 on the integrated and \ncoordinated implementation of and follow-up to the outcomes of major United \nNations conferences and summits in the economic and social fields, in which it \nstressed that all countries should promote policies consistent and coherent with the \ncommitments of major United Nations conferences and summits, emphasized that the \nUnited Nations system had an important responsibility to assist Governments in \nstaying fully engaged in the follow-up to and implementation of agreements and \ncommitments reached at major United Nations conferences and summits and invited \nthe intergovernmental bodies of the United Nations system to further promote the \nimplementation of the outcomes of major United Nations conferences and summits, \n \nRecalling also its resolution 76/181 of 16 December 2021, in which it endorsed \nthe Kyoto Declaration on Advancing Crime Prevention, Criminal Justice and the Rule \nof Law: Towards the Achievement of the 2030 Agenda for Sustainable Development, \nadopted by the Fourteenth Congress, and requested the Commission on Crime \nPrevention and Criminal Justice to review the implementation of the Kyoto \nDeclaration under the standing item on its agenda entitled \u201cFollow-up to the \nFourteenth United Nations Congress on Crime Prevention and Criminal Justice and \npreparations for the Fifteenth United Nations Congress on Crime Prevention and \nCriminal Justice\u201d, \n \nRecalling further its resolution 77/231 of 15 December 2022, in which it decided \nto hold the Fifteenth United Nations Congress on Crime Prevention and Criminal \nJustice in 2026, without prejudice to the timing of subsequent United Nations \ncongresses on crime prevention and criminal justice and with a view to maintaining \nthe five-year cycle of the congresses, in the light of the intensive follow-up process \nundertaken by the Commission on Crime Prevention and Criminal Justice in the \nimplementation of the Kyoto Declaration, \n \nRecalling that, in its resolution 77/231, it requested the Commission on Crime \nPrevention and Criminal Justice to approve at its thirty-second session the overall \ntheme, the agenda items and the topics for the workshops of the Fifteenth Congress, \nrecommended that, building on the experience and the success of the Fourteenth \nCongress, all efforts be made to ensure that the overall theme, the agenda items and \nthe topics for the workshops of the Fifteenth Congress were interrelated and that the \nagenda items and workshop topics were streamlined and limited in number, and \nencouraged the holding of side events that were focused on and complemented the \nagenda items and workshops, \n \nRecalling also its resolution 70/1 of 25 September 2015, entitled \u201cTransforming \nour world: the 2030 Agenda for Sustainable Development\u201d, \n \nRecalling further its decisions 74/550 A of 13 April 2020 and 74/550 B of \n12 August 2020, in which it decided to hold the Fourteenth Congress in 2021 instead \nof 2020 owing to the coronavirus disease (COVID-19) pandemic, \n \nEncouraged by the success of the Fourteenth Congress as one of the largest and \nmost diverse forums for the exchange of views on and experiences in research, law \nand policy and programme development between States, intergovernmental and \nnon-governmental organizations and individual experts representing various \nprofessions and disciplines, \n \nPraising the Government of Japan for conducting an intensive, succinct and \nfruitful Fourteenth Congress, despite challenging circumstances due to the \nCOVID-19 pandemic, and mindful of the need to constantly look for ways to further \nimprove the work of future congresses, \n \nStressing the importance of undertaking all preparatory activities for the \nFifteenth Congress in a timely and concerted manner,  \n\nFollow-up to the Fourteenth United Nations Congress on \nCrime Prevention and Criminal Justice and preparations \nfor the Fifteenth United Nations Congress on Crime \nPrevention and Criminal Justice \nA/RES/78/223\n \n3/5\n23-25990 \n \n \nMindful of the Strategy for Sustainability Management in the United Nations \nSystem, 2020\u20132030, and best practices in the preparations for, and the organization \nof, the Fifteenth Congress, \n \nHaving considered the report of the Secretary-General on the follow-up to the \nFourteenth United Nations Congress on Crime Prevention and Criminal Justice and \npreparations for the Fifteenth United Nations Congress on Crime Prevention and \nCriminal Justice,1 \n \n1. \nReiterates its invitation to Governments to take into consideration the \nKyoto Declaration on Advancing Crime Prevention, Criminal Justice and the Rule of \nLaw: Towards the Achievement of the 2030 Agenda for Sustainable Development 2 \nwhen formulating legislation and policy directives and to make every effort, where \nappropriate, to implement the principles contained therein in conformity with the \npurposes and principles of the Charter of the United Nations; \n \n2. \nWelcomes the initiative of the Government of Japan to work with the \nUnited Nations Office on Drugs and Crime, and through the Commission on Crime \nPrevention and Criminal Justice, in ensuring appropriate follow-up to the \nimplementation of the Kyoto Declaration; \n \n3. \nRequests the Commission on Crime Prevention and Criminal Justice, in \naccordance with its mandate, to continue implementing the appropriate policy and \noperational measures for the follow-up to the Kyoto Declaration, including through \nthe holding of intersessional thematic discussions to facilitate the sharing of \ninformation, good practices and lessons learned among Member States and relevant \nstakeholders, subject to the availability of extrabudgetary resources; \n \n4. \nNotes the progress made thus far in the preparations for the Fifteenth \nUnited Nations Congress on Crime Prevention and Criminal Justice; \n \n5. \nDecides that the duration of the Fifteenth Congress should not exceed eight \ndays, including pre-Congress consultations; \n \n6. \nAlso decides that the main theme of the Fifteenth Congress shall be \n\u201cAccelerating crime prevention, criminal justice and the rule of law: protecting \npeople and planet and achieving the 2030 Agenda for Sustainable Development in the \ndigital age\u201d; \n \n7. \nFurther decides that, in accordance with its resolution 56/119, the \nFifteenth Congress shall open with a high-level segment, at which States will be \ninvited to be represented at the highest possible level, for example, by Heads of State \nor Government, government ministers or attorneys general, and that representatives \nwill be given an opportunity to make statements on the topics of the Congress; \n \n8. \nDecides that, in accordance with its resolution 56/119, the Fifteenth \nCongress shall adopt a single declaration, to be submitted to the Commission on \nCrime Prevention and Criminal Justice for its consideration; \n \n9. \nAlso decides that the Commission will give due consideration to the report \nof the Fifteenth Congress; \n \n10. Requests the Secretary-General to encourage the participation of \nrepresentatives from relevant entities of the United Nations system in the Fifteenth \nCongress, bearing in mind the main theme, agenda items and workshop topics of the \nCongress;  \n__________________ \n \n1  E/CN.15/2023/11. \n \n2  Resolution 76/181, annex. \n\nA/RES/78/223 \nFollow-up to the Fourteenth United Nations Congress on \nCrime Prevention and Criminal Justice and preparations \nfor the Fifteenth United Nations Congress on Crime \nPrevention and Criminal Justice\n \n23-25990\n4/5 \n \n \n11. \nApproves the following provisional agenda for the Fifteenth Congress, \nfinalized by the Commission at its thirty-second session: \n \n \n1. \nOpening of the Congress. \n \n \n2. \nOrganizational matters. \n \n \n3. \nAdvancing innovative and evidence-based crime prevention \nstrategies towards social, economic and environmental \ndevelopment. \n \n \n4. \nPromoting people-centred, inclusive and responsive criminal justice \nsystems in a world of continuous change. \n \n \n5. \nAddressing and countering crime \u2013 including organized crime and \nterrorism in all its forms and manifestations \u2013 in new, emerging and \nevolving forms. \n \n \n6. \nWorking better together to elevate cooperation and partnerships, \nincluding technical and material assistance and training, at the \nnational, regional and international levels, in crime prevention and \ncriminal justice. \n \n \n7. \nAdoption of the report of the Congress. \n \n12. Decides that the following issues shall be considered in workshops within \nthe framework of the Fifteenth Congress:  \n \n(a) \nBuilding resilient societies, with a focus on protecting women, children \nand youth: fostering engagement, education and the culture of lawfulness; \n \n(b) \nEnsuring equal access to justice for all: towards safe and secure societies \nwhile respecting the rule of law; \n \n(c) \nGetting ahead: strengthening data collection and analysis to better protect \npeople and planet in times of new, emerging and evolving forms of crime; \n \n(d) \nTurning the digital age into an opportunity: promoting the responsible use \nof technologies in crime prevention and criminal justice. \n \n13. Requests the Secretary-General, in cooperation with the institutes of the \nUnited Nations crime prevention and criminal justice programme network, to prepare \na discussion guide for the regional preparatory meetings for the Fifteenth Congress \nand for the Congress itself in a timely manner in order to enable those meetings to be \nheld as early as possible in 2025, and invites Member States to be actively involved \nin that process;  \n \n14. Also requests the Secretary-General to facilitate the organization of the \nregional preparatory meetings and to make available the necessary resources for the \nparticipation of the least developed countries in those meetings and in the Fifteenth \nCongress itself, in accordance with past practice and in consultation with Member \nStates; \n \n15. Urges participants in the regional preparatory meetings to examine the \nsubstantive items on the agenda and the topics of the workshops of the Fifteenth \nCongress and to make action-oriented recommendations to serve as a basis for the \ndraft recommendations and conclusions for consideration by the Congress;  \n \n16. Encourages Member States to participate actively in the Fifteenth \nCongress by including in the composition of their delegations legal and policy \nexperts, such as practitioners with special training and practical experience in crime \nprevention and criminal justice; \n\nFollow-up to the Fourteenth United Nations Congress on \nCrime Prevention and Criminal Justice and preparations \nfor the Fifteenth United Nations Congress on Crime \nPrevention and Criminal Justice \nA/RES/78/223\n \n5/5\n23-25990 \n \n \n17. Emphasizes the importance of the workshops to be held within the \nframework of the Fifteenth Congress, and invites Member States, intergovernmental \nand non-governmental organizations and other relevant entities to provide financial, \norganizational and technical support to the United Nations Office on Drugs and Crime \nand the institutes of the United Nations crime prevention and criminal justice \nprogramme network for the preparations for the workshops, including the preparation \nand circulation of relevant background material;  \n \n18. Requests the Secretary-General to facilitate the organization of ancillary \nmeetings of non-governmental and professional organizations participating in the \nFifteenth Congress, in accordance with past practice, as well as meetings of \nprofessional and geographical interest groups, and to take appropriate measures to \nencourage the participation of the academic and research community in the Congress, \nand encourages Member States to actively participate in the above-mentioned \nmeetings, as they provide an opportunity to develop and maintain strong partnerships \nwith the private sector and civil society organizations; \n \n19. Encourages States to undertake preparations for the Fifteenth Congress at \nan early stage and by all appropriate means, including, where appropriate, the \nestablishment of national preparatory committees; \n \n20. Encourages the relevant United Nations programmes, specialized agencies \nof the United Nations system and intergovernmental and non-governmental \norganizations, as well as other professional organizations, to cooperate with the \nUnited Nations Office on Drugs and Crime in the preparations for the Fifteenth \nCongress; \n \n21. Requests the Commission to accord sufficient time at its thirty-third \nsession to reviewing the progress made in the preparations for the Fifteenth Congress, \nto finalize in a timely manner all outstanding organizational and substantive \narrangements and to make its recommendations to the General Assembly through the \nEconomic and Social Council; \n \n22. Welcomes with appreciation the offer of the Government of the United \nArab Emirates to host the Fifteenth Congress, to be held in 2026;  \n \n23. Requests the Secretary-General to ensure proper follow-up to the present \nresolution and to report thereon to the General Assembly through the Commission at \nits thirty-third session;  \n \n24. Also requests the Secretary-General to submit to the General Assembly at \nits seventy-ninth session a report on the implementation of the present resolution. \n \n50th plenary meeting \n19 December 2023 \n \n",
  "paragraphs": {
    "1": "Opening of the Congress.",
    "2": "Organizational matters.",
    "3": "Advancing innovative and evidence-based crime prevention strategies towards social, economic and environmental development.",
    "4": "Promoting people-centred, inclusive and responsive criminal justice systems in a world of continuous change.",
    "5": "Addressing and countering crime \u2013 including organized crime and terrorism in all its forms and manifestations \u2013 in new, emerging and evolving forms.",
    "6": "Working better together to elevate cooperation and partnerships, including technical and material assistance and training, at the national, regional and international levels, in crime prevention and criminal justice.",
    "7": "Adoption of the report of the Congress.",
    "8": "Decides that, in accordance with its resolution 56/119, the Fifteenth Congress shall adopt a single declaration, to be submitted to the Commission on Crime Prevention and Criminal Justice for its consideration;",
    "9": "Also decides that the Commission will give due consideration to the report of the Fifteenth Congress;",
    "10": "Requests the Secretary-General to encourage the participation of representatives from relevant entities of the United Nations system in the Fifteenth Congress, bearing in mind the main theme, agenda items and workshop topics of the Congress;",
    "11": "Approves the following provisional agenda for the Fifteenth Congress, finalized by the Commission at its thirty-second session:",
    "12": "Decides that the following issues shall be considered in workshops within the framework of the Fifteenth Congress: (a) Building resilient societies, with a focus on protecting women, children and youth: fostering engagement, education and the culture of lawfulness; (b) Ensuring equal access to justice for all: towards safe and secure societies while respecting the rule of law; (c) Getting ahead: strengthening data collection and analysis to better protect people and planet in times of new, emerging and evolving forms of crime; (d) Turning the digital age into an opportunity: promoting the responsible use of technologies in crime prevention and criminal justice.",
    "13": "Requests the Secretary-General, in cooperation with the institutes of the United Nations crime prevention and criminal justice programme network, to prepare a discussion guide for the regional preparatory meetings for the Fifteenth Congress and for the Congress itself in a timely manner in order to enable those meetings to be held as early as possible in 2025, and invites Member States to be actively involved in that process;",
    "14": "Also requests the Secretary-General to facilitate the organization of the regional preparatory meetings and to make available the necessary resources for the participation of the least developed countries in those meetings and in the Fifteenth Congress itself, in accordance with past practice and in consultation with Member States;",
    "15": "Urges participants in the regional preparatory meetings to examine the substantive items on the agenda and the topics of the workshops of the Fifteenth Congress and to make action-oriented recommendations to serve as a basis for the draft recommendations and conclusions for consideration by the Congress;",
    "16": "",
    "17": "Emphasizes the importance of the workshops to be held within the framework of the Fifteenth Congress, and invites Member States, intergovernmental and non-governmental organizations and other relevant entities to provide financial, organizational and technical support to the United Nations Office on Drugs and Crime and the institutes of the United Nations crime prevention and criminal justice programme network for the preparations for the workshops, including the preparation and circulation of relevant background material;",
    "18": "Requests the Secretary-General to facilitate the organization of ancillary meetings of non-governmental and professional organizations participating in the Fifteenth Congress, in accordance with past practice, as well as meetings of professional and geographical interest groups, and to take appropriate measures to encourage the participation of the academic and research community in the Congress, and encourages Member States to actively participate in the above-mentioned meetings, as they provide an opportunity to develop and maintain strong partnerships with the private sector and civil society organizations;",
    "19": "Encourages States to undertake preparations for the Fifteenth Congress at an early stage and by all appropriate means, including, where appropriate, the establishment of national preparatory committees;",
    "20": "Encourages the relevant United Nations programmes, specialized agencies of the United Nations system and intergovernmental and non-governmental organizations, as well as other professional organizations, to cooperate with the United Nations Office on Drugs and Crime in the preparations for the Fifteenth Congress;",
    "21": "Requests the Commission to accord sufficient time at its thirty-third session to reviewing the progress made in the preparations for the Fifteenth Congress, to finalize in a timely manner all outstanding organizational and substantive arrangements and to make its recommendations to the General Assembly through the Economic and Social Council;",
    "22": "Welcomes with appreciation the offer of the Government of the United Arab Emirates to host the Fifteenth Congress, to be held in 2026;",
    "23": "Requests the Secretary-General to ensure proper follow-up to the present resolution and to report thereon to the General Assembly through the Commission at its thirty-third session;",
    "24": "Also requests the Secretary-General to submit to the General Assembly at its seventy-ninth session a report on the implementation of the present resolution."
  },
  "agenda_items": [
    "Item 107"
  ],
  "symbol_references": []
}