{
  "symbol": "A/RES/75/293",
  "filename": "A_RES_75_293.pdf",
  "title": "75/293. Support account for peacekeeping operations",
  "text": "United Nations \nA/RES/75/293 \n \n \nGeneral Assembly \nDistr.: General \n8 July 2021 \n \n \n21-08996 (E)    090721     \n*2108996* \n \n \nSeventy-fifth session \nAgenda item 154 \nAdministrative and budgetary aspects of the financing of \nthe United Nations peacekeeping operations \n \n \n \n \n Resolution adopted by the General Assembly \non 30 June 2021 \n \n \n \n \n[on the report of the Fifth Committee (A/75/936, para. 15)] \n \n \n 75/293. Support account for peacekeeping operations \n \n \n \nThe General Assembly, \n \nRecalling its resolutions 45/258 of 3 May 1991, 47/218 A of 23 December 1992, \n48/226 A of 23 December 1993, 48/226 C of 29 July 1994, 49/250 of 20 July 1995, \n50/221 B of 7 June 1996, section I of its resolution 55/238 of 23 December 2000, its \nresolutions 55/271 of 14 June 2001, 56/241 of 24 December 2001, 56/293 of 27 June \n2002, 57/318 of 18 June 2003, 58/298 of 18 June 2004, 59/301 of 22 June 2005, \n60/268 of 30 June 2006, 61/279 of 29 June 2007, 62/250 of 20 June 2008, 63/287 of \n30 June 2009, 64/271 of 24 June 2010, 65/290 of 30 June 2011, 66/265 of 21 June \n2012, 67/287 of 28 June 2013, 68/283 of 30 June 2014, 69/308 of 25 June 2015, \n70/287 of 17 June 2016, 71/295 of 30 June 2017, 72/288 of 5 July 2018, 73/308 of \n3 July 2019, 74/280 of 30 June 2020 and its other relevant resolutions, as well as its \ndecisions 49/469 of 23 December 1994, 50/473 of 23 December 1995, 72/558 of \n5 July 2018, 73/555 of 3 July 2019 and 74/571 of 3 September 2020,  \n \nHaving considered the reports of the Secretary-General on the budget \nperformance of the support account for peacekeeping operations for the period from \n1 July 2019 to 30 June 2020 1  and on the budget for the support account for \npeacekeeping operations for the period from 1 July 2021 to 30 June 2022, 2 the report \nof the Independent Audit Advisory Committee on the proposed budget of the Office \nof Internal Oversight Services under the support account for peacekeeping operations \nfor the period from 1 July 2021 to 30 June 20223 and the related report of the Advisory \nCommittee on Administrative and Budgetary Questions,4  \n__________________ \n \n1  A/75/656. \n \n2  A/75/785. \n \n3  A/75/783. \n \n4  A/75/849. \n\nA/RES/75/293 \nSupport account for peacekeeping operations\n \n21-08996\n2/10 \n \n \nRecognizing the importance of the United Nations being able to respond and \ndeploy rapidly to a peacekeeping operation upon the adoption of a relevant resolution \nof the Security Council, within 30 days for traditional peacekeeping operations and \n90 days for complex peacekeeping operations,  \n \nRecognizing also the need for adequate support during all phases of \npeacekeeping operations, including the liquidation and termination phases,  \n \nMindful that the level of the support account should broadly correspond to the \nmandate, number, size and complexity of peacekeeping missions,  \n \n1. \nTakes note of the report of the Secretary-General on the budget for the \nsupport account for peacekeeping operations for the period from 1 July 2021 to \n30 June 2022 and the report of the Independent Audit Advisory Committee on the \nproposed budget of the Office of Internal Oversight Services under the support \naccount for peacekeeping operations for the period from 1 July 2021 to 30 June 2022; \n \n2. \nReaffirms its role in carrying out a thorough analysis and approval of \nhuman and financial resources and policies with a view to ensuring the full, effective \nand efficient implementation of all mandated programmes and activities and the \nimplementation of policies in this regard;  \n \n3. \nAlso reaffirms that the Fifth Committee is the appropriate Main Committee \nof the General Assembly entrusted with responsibility for administrative and \nbudgetary matters;  \n \n4. \nFurther reaffirms rule 153 of its rules of procedure;  \n \n5. \nReaffirms that the support account funds shall be used for the sole purpose \nof financing human resources and non-human resources requirements for \nbackstopping and supporting peacekeeping operations at Headquarters, and that any \nchanges in this limitation require the prior approval of the General Assembly;  \n \n6. \nAlso reaffirms the need for adequate funding for the backstopping of \npeacekeeping operations, as well as the need for full justification for that funding in \nsupport account budget submissions;  \n \n7. \nFurther reaffirms the need for effective and efficient administration and \nfinancial management of peacekeeping operations, and urges the Secretary-General \nto continue to identify measures to increase the productivity and efficiency of the \nsupport account;  \n \n8. \nRequests the Secretary-General to ensure the full implementation of the \nrelevant provisions of its resolutions 59/296 of 22 June 2005, 60/266 of 30 June 2006, \n61/276 of 29 June 2007, 64/269 of 24 June 2010, 65/289 of 30 June 2011, 66/264 of \n21 June 2012, 69/307 of 25 June 2015, 70/286 of 17 June 2016 and its other relevant \nresolutions;  \n \n9. \nEndorses the conclusions and recommendations contained in the report of \nthe Advisory Committee on Administrative and Budgetary Questions, subject to the \nprovisions of the present resolution, and requests the Secretary-General to ensure \ntheir full implementation; \n \n10. Decides to maintain, for the financial period from 1 July 2021 to 30 June \n2022, the funding mechanism for the support account used in the current period, from \n1 July 2020 to 30 June 2021, as approved in paragraph 3 of its resolution 50/221 B;  \n \n\nSupport account for peacekeeping operations \nA/RES/75/293\n \n3/10\n21-08996 \n \n \n \nBudget performance report for the period from 1 July 2019 to 30 June 2020 \n \n \n11. Takes note of the report of the Secretary-General on the budget \nperformance of the support account for peacekeeping operations for the period from \n1 July 2019 to 30 June 2020; \n \n \n \nBudget estimates for the financial period from 1 July 2021 to 30 June 2022 \n \n \n12. Approves the support account requirements in the amount of \n356,413,100 United States dollars for the financial period from 1 July 2021 to 30 June \n2022, inclusive of the amount of 15,799,500 dollars for the enterprise resource \nplanning project, 868,500 dollars for the global service delivery model project, \n3,881,600 dollars for peacekeeping capability readiness and 18,221,400 dollars for \nUmoja maintenance and support costs, including 1,348 continuing posts and 8 new \ntemporary posts, as well as the abolishment, redeployment, reassignment and \nreclassification of posts, as set out in annex I to the present resolution, 60 continuing \ngeneral temporary assistance positions and 50 person-months, as set out in annex II, \nas well as related post and non-post requirements; \n \n \n \nFinancing of the support account for peacekeeping operations for the financial \nperiods from 1 July 2019 to 30 June 2020 and from 1 July 2021 to 30 June 2022 \n \n \n13. Decides that the requirements for the support account for peacekeeping \noperations for the financial period from 1 July 2021 to 30 June 2022 shall be financed \nas follows: \n \n(a) \nThe unencumbered balance in the amount of 600 dollars, in respect of the \nfinancial period from 1 July 2019 to 30 June 2020, to be applied to the resources \nrequired for the financial period from 1 July 2021 to 30 June 2022;  \n \n(b) \nThe total amount of 2,793,700 dollars, comprising investment revenue of \n1,211,100 dollars, other miscellaneous revenue of 560,500 dollars and the \ncancellation of prior-period obligations of 1,022,100 dollars, in respect of the period \nfrom 1 July 2019 to 30 June 2020, to be applied to the resources required for the \nfinancial period from 1 July 2021 to 30 June 2022;  \n \n(c) \nThe amount of 3,738,600 dollars, representing the excess of the authorized \nlevel of the Peacekeeping Reserve Fund in respect of the financial period ended \n30 June 2020, to be applied to the resources required for the financial period from \n1 July 2021 to 30 June 2022;  \n \n(d) \nThe balance of 349,880,200 dollars to be prorated among the budgets of \nthe active peacekeeping operations for the financial period from 1 July 2021 to \n30 June 2022; \n \n(e) \nThe net estimated staff assessment income of 29,125,000 dollars, \ncomprising the amount of 27,361,700 dollars for the financial period from 1 July 2021 \nto 30 June 2022 and the increase of 1,763,300 dollars in respect of the financial period \nended 30 June 2020, to be offset against the balance referred to in subparagraph (d) \nabove, to be prorated among the budgets of the individual active peacekeeping \noperations. \n \n88th plenary meeting \n30 June 2021 \n \n \n \n\nA/RES/75/293 \nSupport account for peacekeeping operations\n \n21-08996\n4/10 \n \nAnnex I \n \n \n \nA \nPosts to be established under the support account for peacekeeping \noperations for the period from 1 July 2021 to 30 June 2022 \n \n \n \nPosts \n \n \nDepartment/office \nOrganizational unit \nNumber \nLevel \nFunction \nStatus \nDepartment of Operational Support \nOffice of Support \nOperations \nHealth-Care Management \nand Occupational Safety and \nHealth Division \n1 \nP-4 \nMedical Officer \n(medical quality and \nsafety) \nConversion from general \ntemporary assistance \nSubtotal \n1 \n \n \n \nDepartment of Management Strategy, Policy and Compliance \nOffice of Programme \nPlanning, Finance and \nBudget \nFinance Division \n1 \nP-4 \nFinance Officer \n(accounting policy) \nConversion from general \ntemporary assistance \nSubtotal \n1 \n \n \n \nOffice of Internal Oversight Services \nInvestigations Division \nEntebbe \n1 \nNGS \nAdministrative Assistant \nConversion from general \ntemporary assistance \nUnited Nations Mission in \nSouth Sudan \n2 \nP-3 \nResident Investigator \n1 \nNGS \nAdministrative Assistant \n \nInternal Audit Division \nUnited Nations \nMultidimensional Integrated \nStabilization Mission in Mali \n1 \nP-3 \nResident Auditor \nConversion from general \ntemporary assistance \nUnited Nations \nMultidimensional Integrated \nStabilization Mission in the \nCentral African Republic \n1 \nP-3 \nResident Auditor \n \nSubtotal \n6 \n \n \n \nTotal \n8 \n \n \n \n \nNote: The specific assignment and location of each of the new posts is set out in the report of the Secretary-General on the budget \nfor the support account for peacekeeping operations for the period from 1 July 2021 to 30 June 2022 (A/75/785) and \nreferenced in the related report of the Advisory Committee on Administrative and Budgetary Questions (A/75/849). \nAbbreviation: NGS, national General Service. \n \n \n \n \n \n\nSupport account for peacekeeping operations \nA/RES/75/293\n \n5/10\n21-08996 \n \n \nB \nRestructuring, redeployment, reassignment and abolishment of \nposts under the support account for peacekeeping operations for \nthe period from 1 July 2021 to 30 June 2022 \n \n \n \n \nRestructuring \n \n \n \nDepartment of Peace Operations/Office of Military Affairs/Office of the \nMilitary Adviser \n \nEstablishment of the Military Performance Evaluation Team in the Office of the \nMilitary Adviser through the redeployment of 6 posts (P-4) and the reassignment of \n2 posts (Senior Military Affairs Officer (P-5) and Information Systems Officer, \nseconded active-duty military personnel (P-3)) within the Office of Military Affairs  \n \n \n \nRedeployment \n \n \n \nDepartment of Operational Support/Office of Support Operations/Human Resources \nServices Division/Personnel Records Management Unit \n \nRedeployment of 2 posts (Associate Human Resources Officer (P-2) and Human \nResources Assistant (GS (OL))) from the Capacity Development and Operational \nTraining Service \n \n \n \nDepartment of Management Strategy, Policy and Compliance/Office of Programme \nPlanning, Finance and Budget/Finance Division \n \nRedeployment of 2 posts (Procurement Officer (P-4) and Finance and Budget \nAssistant (GS (OL))) from the Field Operations Finance Division \n \n \n \nDepartment of Management Strategy, Policy and Compliance/Office of Programme \nPlanning, Finance and Budget/Field Operations Finance Division \n \nRedeployment of 2 posts (Finance and Budget Assistant (GS (OL))) from the Finance \nDivision \n \n \n \nReassignment \n \n \n \nDepartment of Operational Support/Office of Support Operations/Capacity \nDevelopment and Operational Training Service/Knowledge Management Team \n \nReassignment of 2 posts (Finance and Budget Officer (P-3)) to be reassigned as \nProgramme Management Officer (P-3) from the Operational Training Section \n \n \n \nDepartment of Operational Support/Office of Support Operations/Capacity \nDevelopment and Operational Training Service/Business Processes and Systems \nSupport Section \n \nReassignment of 1 post (Senior Human Resource Assistant (GS (PL))) to be \nreassigned as Senior Management and Programme Assistant (GS (PL)) within the \nBusiness Processes and Systems Support Section \n \n \n \nDepartment of Operational Support/Office of Support Operations/Capacity \nDevelopment and Operational Training Service/Operational Training Section \n \nReassignment of 1 post (Senior Human Resource Assistant (GS (PL))) to be \nreassigned as Senior Management and Programme Assistant (GS (PL)) within the \nOperational Training Section \n \n\nA/RES/75/293 \nSupport account for peacekeeping operations\n \n21-08996\n6/10 \n \n \n \nDepartment of Operational Support/Division for Special Activities/Resource \nPlanning and Analysis Section \n \nReassignment of 3 posts (Finance and Budget Officer (2 P-4 and 1 P-3) to be \nreassigned as Programme Officer (2 P-4 and 1 P-3)) within the Resource Planning \nand Analysis Section \n \n \n \nOffice of Internal Oversight Services/Inspection and Evaluation Division/Regional \nInspection and Evaluation Office in Entebbe \n \nReassignment of 1 post (Resident Auditor (P-3) to be reassigned as Evaluation Officer \n(P-3)) from the Internal Audit Division/Resident Audit Office of the African Union-\nUnited Nations Hybrid Operation in Darfur \n \n \n \nTransfer  \n \n \n \nDepartment of Operational Support/Office of Supply Chain Management/ \nProcurement Division \n \nTransfer of 2 posts (Procurement Officer (P-4)) to the funding under the Regional \nService Centre in Entebbe, Uganda  \n \n \n \nAbolishment  \n \n \n \nDepartment of Peace Operations/single regional political-operational structure/ \nEast Africa Division \n \nAbolishment of 4 posts (Senior Political Affairs Officer (P-5), Political Affairs \nOfficer (P-4), Political Affairs Officer (P-3) and Team Assistant (GS (OL))) \n \n \n \nAbbreviations: GS (OL), General Service (Other level); GS (PL), General Service (Principal level). \n \n \n\nSupport account for peacekeeping operations \nA/RES/75/293\n \n7/10\n21-08996 \n \nAnnex II \n \n \n General temporary assistance positions to be established \nunder the support account for peacekeeping operations for \nthe period from 1 July 2021 to 30 June 2022 \n \n \n \nPosition \n \n \nDepartment/office \nOrganizational unit \nNumber Level \nFunction \nStatus \nDepartment of Peace Operations \nOffice of the Under-\nSecretary-General/ \nOffice of the Director \nfor Coordination and \nShared Services \nExecutive Office \n\u2013 3 months, \nP-3 \nLeave replacement \nContinuation \n \n\u2013 3 months, \nGS (OL) \nLeave replacement \nContinuation \n \n1 P-4 \nHuman Resources Officer \nContinuation \nOffice of Rule of Law \nand Security \nInstitutions \nJustice and Corrections Service \n1 P-4 \nJudicial Affairs Officer \nContinuation \nPolicy, Evaluation and \nTraining Division \nPolicy and Best Practices \nService \n1 P-3 \nPolitical Affairs Officer \n(Action for Peacekeeping) \nContinuation \nIntegrated Training Service \n1 P-3 \nTraining Officer \nContinuation \nSubtotal \n4  \n \n \nUnited Nations Office to the African Union \nAdministrative Support \nSection \n \n\u2013 4 months, \nFS \nLeave replacement \nContinuation \n \n\u2013 4 months, \nNGS \nLeave replacement \nContinuation \nSubtotal \n\u2013  \n \n \nDepartment of Operational Support \nOffice of Support \nOperations \nHealth-Care Management and \nOccupational Safety and Health \nDivision \n1 P-4 \nMental Health Officer \n(post-traumatic stress disorder) \nContinuation \nHuman Resources Services \nDivision \n10 P-3 \nHuman Resources Officer \n(occupational groups) \nContinuation \n \n3 GS (OL) \nHuman Resources Assistant \n(occupational groups) \nContinuation \nOffice of Supply Chain \nManagement \nEnabling and Outreach Service \n1 GS (OL) \nProcurement Assistant \nContinuation \nReimbursement Claims \nManagement and Performance \nSection \n2 P-3 \nFinance and Budget Officer \nContinuation \n1 P-4 \nFinance and Budget Officer \n(post-traumatic stress disorder) \nContinuation \n \n1 GS (OL) \nFinance and Budget Assistant \n(post-traumatic stress disorder) \nContinuation \nDivision of \nAdministration, New \nYork \nHeadquarters Client Support \nService \n\u2013 6 months, \nP-4 \nLeave replacement \nContinuation \nSubtotal \n19  \n \n \n\nA/RES/75/293 \nSupport account for peacekeeping operations\n \n21-08996\n8/10 \n \n \nPosition \n \n \nDepartment/office \nOrganizational unit \nNumber Level \nFunction \nStatus \nDepartment of Management Strategy, Policy and Compliance \nOffice of the Under-\nSecretary-General \nBusiness Partner Service \n\u2013 4 months, \nP-3 \nLeave replacement \nContinuation \n \n\u2013 4 months, \nGS (OL) \nLeave replacement \nContinuation \nManagement Evaluation Unit \n1 P-3 \nLegal Officer \nContinuation \nOffice of Programme \nPlanning, Finance and \nBudget \nFinance Division \n1 GS (OL) \nAccounting Assistant \nContinuation \nOffice of Human \nResources \nGlobal Strategy and Policy \nDivision \n1 P-4 \nProgramme Officer (gender parity) Continuation \n1 P-3 \nHuman Resources Officer (mobility) Continuation \nAdministrative Law Division/ \nConduct and Discipline Service \n1 P-3 \nProgramme Officer \nContinuation \nAdministrative Law Division/ \nAppeals Management Section \n1 P-4 \nLegal Officer \nContinuation \n1 P-3 \nLegal Officer \nContinuation \nBusiness \nTransformation and \nAccountability Division \nAnalytics and Project \nManagement Service \n1 P-4 \nManagement and Programme \nAnalyst \nContinuation \nSubtotal \n8  \n \n \nOffice of Information and Communications Technology \nEnterprise Solutions \nService \nEnterprise applications centre \u2013 \nAsia (Bangkok office) \n1 P-4 \nProject Manager \n(rations management system) \nContinuation \n \n1 P-3 \nInformation Systems Officer \n(fuel management system) \nContinuation \nEnterprise applications centre \u2013 \nAsia (New York office) \n1 P-3 \nInformation Systems Officer \n(customer relationship \nmanagement for the troop-\ncontribution management project) \nContinuation \nSubtotal \n3  \n \n \nOffice of Internal Oversight Services \nExecutive Office \n \n\u2013 4 months, \nP-3 \nLeave replacement \nContinuation \n \n\u2013 6 months, \nGS (OL) \nLeave replacement \nContinuation \nInvestigations Division \nNew York \n1 P-4 \nInvestigator (sexual harassment) \nContinuation \n \n2 P-3 \nInvestigator (sexual harassment) \nContinuation \n \n1 GS (OL) \nInvestigations Assistant \nContinuation \nNairobi \n1 P-4 \nInvestigator (sexual harassment) \nContinuation \n \n2 P-3 \nInvestigator (sexual harassment) \nContinuation \nUnited Nations \nMultidimensional Integrated \nStabilization Mission in Mali \n1 P-5 \nChief Resident Investigator \nContinuation \n1 P-4 \nResident Investigator \nContinuation \n2 P-3 \nResident Investigator \nContinuation \n1 NGS \nAdministrative Assistant \nContinuation \n\nSupport account for peacekeeping operations \nA/RES/75/293\n \n9/10\n21-08996 \n \n \nPosition \n \n \nDepartment/office \nOrganizational unit \nNumber Level \nFunction \nStatus \nUnited Nations Organization \nStabilization Mission in the \nDemocratic Republic of the \nCongo \n1 P-3 \nResident Investigator \nContinuation \nUnited Nations \nMultidimensional Integrated \nStabilization Mission in the \nCentral African Republic \n2 P-3 \nResident Investigator \nContinuation \nInternal Audit Division \nUnited Nations \nMultidimensional Integrated \nStabilization Mission in Mali \n1 P-4 \nResident Auditor  \nContinuation \nUnited Nations \nMultidimensional Integrated \nStabilization Mission in the \nCentral African Republic \n3 P-4 \nResident Auditor \nContinuation \n1 P-3 \nResident Auditor  \nContinuation \nSubtotal \n20  \n \n \nExecutive Office of the Secretary-General \n \n\u2013 6 months, \nGS (OL) \nLeave replacement \nContinuation \nSubtotal \n\u2013  \n \n \nOffice of the United Nations Ombudsman and Mediation Services \nRegional Ombudsman\u2019s Office in Entebbe \n1 P-4 \nConflict Resolution Officer \nContinuation \nRegional Ombudsman\u2019s Office in Bamako \n1 P-4 \nConflict Resolution Officer  \nContinuation \nSubtotal \n2  \n \n \nOffice of Legal Affairs \nGeneral Legal Division \nAdministration of Justice \nCluster \n\u2013 3 months, \nP-4 \nLeave replacement \nContinuation \nSubtotal \n\u2013  \n \n \nDepartment of Global Communications \nExecutive Office \n \n\u2013 1.5 months, \nP-3 \nLeave replacement \nContinuation \n \n\u2013 1.5 months, \nGS (OL) \nLeave replacement \nContinuation \nSubtotal \n\u2013  \n \n \nDepartment of Safety and Security \nOffice of the Under-\nSecretary-General \nExecutive Office \n1 P-3 \nAdministrative Officer \nContinuation \n \n1 GS (OL) \nAdministrative Assistant \nContinuation \nSubtotal \n2  \n \n \n\nA/RES/75/293 \nSupport account for peacekeeping operations\n \n21-08996\n10/10 \n \n \nPosition \n \n \nDepartment/office \nOrganizational unit \nNumber Level \nFunction \nStatus \nOffice of the United Nations High Commissioner for Human Rights \nField Engagement \nDivision \nPeace Missions Support Section \n(Addis Ababa) \n1 P-3 \nHuman Rights Officer \n(United Nations Office to the \nAfrican Union) \nContinuation \nThematic Engagement, \nSpecial Procedures and \nRight to Development \nDivision \nMethodology, Education and \nTraining Section (New York) \n1 P-4 \nHuman Rights Officer \n(sexual exploitation and abuse) \nContinuation \nSubtotal \n2  \n \n \nTotal \n60  \nPositions and 50 person-months \n(positions of less than \n12 months\u2019 duration)a \n \n \nNote: The specific assignment and location of each of the general temporary assistance positions is set out in the report of the \nSecretary-General on the budget for the support account for peacekeeping operations for the period from 1 July 2021 to \n30 June 2022 (A/75/785) and referenced in the related report of the Advisory Committee on Administrative and Budgetary \nQuestions (A/75/849). \nAbbreviations: FS, Field Service; GS (OL), General Service (Other level); NGS, national General Service. \n \na  Person-months are indicated in the column entitled \u201cLevel\u201d. \n \n \n \n",
  "paragraphs": {
    "1": "Takes note of the report of the Secretary-General on the budget for the support account for peacekeeping operations for the period from 1 July 2021 to 30 June 2022 and the report of the Independent Audit Advisory Committee on the proposed budget of the Office of Internal Oversight Services under the support account for peacekeeping operations for the period from 1 July 2021 to 30 June 2022;",
    "2": "Reaffirms its role in carrying out a thorough analysis and approval of human and financial resources and policies with a view to ensuring the full, effective and efficient implementation of all mandated programmes and activities and the implementation of policies in this regard;",
    "3": "Also reaffirms that the Fifth Committee is the appropriate Main Committee of the General Assembly entrusted with responsibility for administrative and budgetary matters;",
    "4": "Further reaffirms rule 153 of its rules of procedure;",
    "5": "Reaffirms that the support account funds shall be used for the sole purpose of financing human resources and non-human resources requirements for backstopping and supporting peacekeeping operations at Headquarters, and that any changes in this limitation require the prior approval of the General Assembly;",
    "6": "Also reaffirms the need for adequate funding for the backstopping of peacekeeping operations, as well as the need for full justification for that funding in support account budget submissions;",
    "7": "Further reaffirms the need for effective and efficient administration and financial management of peacekeeping operations, and urges the Secretary-General to continue to identify measures to increase the productivity and efficiency of the support account;",
    "8": "Requests the Secretary-General to ensure the full implementation of the relevant provisions of its resolutions 59/296 of 22 June 2005, 60/266 of 30 June 2006, 61/276 of 29 June 2007, 64/269 of 24 June 2010, 65/289 of 30 June 2011, 66/264 of 21 June 2012, 69/307 of 25 June 2015, 70/286 of 17 June 2016 and its other relevant resolutions;",
    "9": "Endorses the conclusions and recommendations contained in the report of the Advisory Committee on Administrative and Budgetary Questions, subject to the provisions of the present resolution, and requests the Secretary-General to ensure their full implementation;",
    "10": " Budget performance report for the period from 1 July 2019 to 30 June 2020",
    "11": "Takes note of the report of the Secretary-General on the budget performance of the support account for peacekeeping operations for the period from 1 July 2019 to 30 June 2020; Budget estimates for the financial period from 1 July 2021 to 30 June 2022",
    "12": "Approves the support account requirements in the amount of 356,413,100 United States dollars for the financial period from 1 July 2021 to 30 June 2022, inclusive of the amount of 15,799,500 dollars for the enterprise resource planning project, 868,500 dollars for the global service delivery model project, 3,881,600 dollars for peacekeeping capability readiness and 18,221,400 dollars for Umoja maintenance and support costs, including 1,348 continuing posts and 8 new temporary posts, as well as the abolishment, redeployment, reassignment and reclassification of posts, as set out in annex I to the present resolution, 60 continuing general temporary assistance positions and 50 person-months, as set out in annex II, as well as related post and non-post requirements; Financing of the support account for peacekeeping operations for the financial periods from 1 July 2019 to 30 June 2020 and from 1 July 2021 to 30 June 2022",
    "13": " B Position Department/office Organizational unit Number Level Function Status Office of the United Nations High Commissioner for Human Rights Field Engagement Division Peace Missions Support Section (Addis Ababa) 1 P-3 Human Rights Officer (United Nations Office to the African Union) Continuation Thematic Engagement, Special Procedures and Right to Development Division Methodology, Education and Training Section (New York) 1 P-4 Human Rights Officer (sexual exploitation and abuse) Continuation Subtotal 2 Total 60 Positions and 50 person-months (positions of less than 12 months\u2019 duration)a Note: The specific assignment and location of each of the general temporary assistance positions is set out in the report of the Secretary-General on the budget for the support account for peacekeeping operations for the period from 1 July 2021 to 30 June 2022 (A/75/785) and referenced in the related report of the Advisory Committee on Administrative and Budgetary Questions (A/75/849). Abbreviations: FS, Field Service; GS (OL), General Service (Other level); NGS, national General Service. a Person-months are indicated in the column entitled \u201cLevel\u201d."
  },
  "agenda_items": [
    "Item 154"
  ],
  "symbol_references": []
}