{
  "symbol": "A/RES/79/226",
  "filename": "A_RES_79_226.pdf",
  "title": "79/226. Quadrennial comprehensive policy review of operational activities for development of the United Nations system",
  "text": "United Nations \nA/RES/79/226\n \n \nGeneral Assembly \nDistr.: General \n23 December 2024 \n \n24-24320 (E)     \n*2424320* \n \n \nSeventy-ninth session \nAgenda item 23 (a) \nOperational activities for development: operational \nactivities for development of the United Nations system  \n \n \n \n \n Resolution adopted by the General Assembly \non 19 December 2024 \n \n \n \n \n[on the report of the Second Committee (A/79/442/Add.1, para. 12)] \n \n \n 79/226. Quadrennial comprehensive policy review of operational activities \nfor development of the United Nations system \n \n \n \nThe General Assembly, \n \nReaffirming the importance of the quadrennial comprehensive policy review of \noperational activities, through which the General Assembly establishes key system-\nwide strategic policy orientations and operational modalities for the development \ncooperation and country-level modalities of the United Nations development system, \n \nExpressing its resolve to use this review as the main instrument to provide \nguidance to the United Nations development system on its operational activities for \ndevelopment in order to support countries in their efforts to implement the 2030 \nAgenda for Sustainable Development in a coherent and integrated manner and ensure \neffective delivery of support and services to programme countries in line with the \nmandates of the entities of the United Nations development system, and in accordance \nwith national development policies, plans, priorities and needs, and that efforts are \nstrengthened and accelerated in this decade of action and delivery for sustainable \ndevelopment, building upon a United Nations development system that is more \nstrategic, accountable, transparent, coherent, collaborative, efficient, effective and \nresults-oriented,  \n \nReaffirming its resolution 70/1 of 25 September 2015, entitled \u201cTransforming \nour world: the 2030 Agenda for Sustainable Development\u201d, in which it adopted a \ncomprehensive, far-reaching and people-centred set of universal and transformative \nSustainable Development Goals and targets, its commitment to working tirelessly for \nthe full implementation of the Agenda by 2030, its recognition that eradicating poverty \nin all its forms and dimensions, including extreme poverty, is the greatest global \nchallenge and an indispensable requirement for sustainable development, its \ncommitment to achieving sustainable development in its three dimensions \u2013 economic, \nsocial and environmental \u2013 in a balanced and integrated manner, and to building upon \n\nA/RES/79/226 \nQuadrennial comprehensive policy review of operational activities \nfor development of the United Nations system\n \n24-24320\n2/26 \n \nthe achievements of the Millennium Development Goals and seeking to address their \nunfinished business,  \n \nReaffirming also its resolution 69/313 of 27 July 2015 on the Addis Ababa \nAction Agenda of the Third International Conference on Financing for Development, \nwhich is an integral part of the 2030 Agenda for Sustainable Development, supports \nand complements it, helps to contextualize its means of implementation targets with \nconcrete policies and actions, and reaffirms the strong political commitment to \naddress the challenge of financing and creating an enabling environment at all levels \nfor sustainable development in the spirit of global partnership and solidarity,  \n \nReaffirming further the United Nations Framework Convention on Climate \nChange1 and the Paris Agreement,2 the Convention on Biological Diversity,3 and the \nKunming-Montreal Global Biodiversity Framework,4 and the United Nations Convention \nto Combat Desertification in Those Countries Experiencing Serious Drought and/or \nDesertification, Particularly in Africa, 5  and encouraging all their parties to fully \nimplement them, and those countries that have not yet done so to deposit their \ninstruments of ratification, acceptance, approval or accession, where appropriate, as \nsoon as possible,  \n \nRecalling the Sendai Framework for Disaster Risk Reduction 2015\u201320306 and \nthe New Urban Agenda,7 as well as all other outcomes of the major United Nations \nconferences and summits in the economic, social, environmental and related fields, \nand the internationally agreed development goals, including the Sustainable \nDevelopment Goals, and recognizing the vital role played by these conferences and \nsummits in shaping a broad development vision and in identifying commonly agreed \nobjectives which have contributed to our understanding of, and our actions to \novercome, the challenges to improving human life in different parts of the world,  \n \nReaffirming that the Sustainable Development Goals and targets are integrated \nand indivisible and balance the three dimensions of sustainable development, and in \nthis regard recognizing that there are deep interconnections and many cross-cutting \nelements across the Goals and targets and that the interlinkages and integrated nature \nof the Sustainable Development Goals are of crucial importance in ensuring that the \npurpose of the 2030 Agenda is realized,  \n \nRecognizing that the conservation and sustainable use of biodiversity, and \necosystem functions and services, contribute significantly to climate change \nmitigation and adaptation, disaster risk reduction, food security and nutrition, and the \navailability and sustainable management of water and sanitation for all, and \nacknowledging that tackling climate change, addressing biodiversity loss and \npromoting sustainable consumption and production patterns, including through zero-\nwaste initiatives, should contribute to accelerating the eradication of poverty in all its \nforms and dimensions, and the achievement of the 2030 Agenda,  \n \nRecognizing also that there can be no sustainable development without peace \nand no peace without sustainable development and that the development work of the \nentities of the United Nations development system, in accordance with their \nrespective mandates, through their support for the implementation of the 2030 Agenda \nfor Sustainable Development in countries in conflict and post-conflict situations, \n__________________ \n \n1 United Nations, Treaty Series, vol. 1771, No. 30822. \n \n2 Adopted under the UNFCCC in FCCC/CP/2015/10/Add.1, decision 1/CP.21. \n \n3 United Nations, Treaty Series, vol. 1760, No. 30619. \n \n4 United Nations Environment Programme, document CBD/COP/15/17, decision 15/4, annex. \n \n5 United Nations, Treaty Series, vol. 1954, No. 33480. \n \n6 Resolution 69/283, annex II. \n \n7 Resolution 71/256, annex. \n\nQuadrennial comprehensive policy review of operational activities \nfor development of the United Nations system \nA/RES/79/226\n \n3/26\n24-24320 \n \ncontributes to peacebuilding and sustaining peace when reducing people\u2019s needs, \naddressing risks for development programming and fostering resilience, at the request \nof those countries and in accordance with their national ownership, plans and \npriorities,  \n \nReaffirming the importance of freedom, peace and security, respect for all \nhuman rights, including the right to development, the right to an adequate standard of \nliving and the right to food in the context of national food security, the rule of law, \ngender equality and empowerment of all women and girls, the right to enjoyment of \nthe highest attainable standard of physical and mental health and the overall \ncommitment to just, inclusive and democratic societies for development,  \n \nRecalling the Programme of Action of the International Conference on \nPopulation and Development8 and the key actions for its further implementation,9 and \nacknowledging that the Programme of Action requires the adequate mobilization of \nresources for its implementation, particularly for developing countries, at the national \nand international levels,  \n \nReaffirming that promoting gender equality and empowerment of all women and \ngirls, in accordance with the Beijing Declaration and Platform for Action 10 and the \noutcomes of relevant United Nations conferences and resolutions of the General \nAssembly, including through investing in the development of all women and girls, \npromoting women\u2019s economic, social and political empowerment and full, equal and \nmeaningful participation and equal access to leadership and representation at all \nlevels, and promotion of equal access to and control over economic and productive \nresources, decent work, social protection, inclusive and equitable quality education, \nhealth and technology, addressing barriers to their empowerment and their realization \nand enjoyment of their human rights, including the need to eliminate all forms of \ndiscrimination and violence against women and girls, is of fundamental importance \nand has a multiplier effect for achieving sustained and inclusive economic growth, \npoverty eradication and sustainable development,  \n \nReaffirming also its resolution 75/233 of 21 December 2020 and its previous \nresolutions on the quadrennial comprehensive policy review,11 triennial comprehensive \npolicy review 12  and other relevant resolutions 13  on the operational activities for \ndevelopment of the United Nations system,  \n \nReaffirming further its resolution 72/279 of 31 May 2018 on the repositioning \nof the United Nations development system in the context of the quadrennial \ncomprehensive policy review of operational activities for development of the United \nNations system and its resolutions 76/220 of 17 December 2021, 77/184 of \n14 December 2022 and 78/166 of 19 December 2023 on operational activities for \ndevelopment of the United Nations system, as well as its resolution 76/4 of 28 October \n2021 on the review of the functioning of the reinvigorated resident coordinator \nsystem, including its funding arrangement,  \n \nRecalling Economic and Social Council resolutions 2022/25 of 22 July 2022, \n2023/31 of 26 July 2023 and 2024/19 of 23 July 2024, and previous resolutions14 and \nthe role of the Council in providing coordination and guidance to the United Nations \n__________________ \n \n8 Report of the International Conference on Population and Development, Cairo, 5\u201313 September \n1994 (United Nations publication, Sales No. E.95.XIII.18), chap. I, resolution 1, annex. \n \n9 Resolution S-21/2, annex. \n \n10 Report of the Fourth World Conference on Women, Beijing, 4\u201315 September 1995 (United \nNations publication, Sales No. E.96.IV.13), chap. I, resolution 1, annexes I and II. \n \n11 Resolutions 67/226 and 71/243. \n \n12 Resolutions 44/211, 47/199, 50/120, 53/192, 56/201, 59/250 and 62/208. \n \n13 Resolutions 52/12 B, 52/203, 64/289, 73/248, 74/238 and 74/297. \n \n14 Economic and Social Council resolutions 2013/5, 2014/14, 2015/15, 2019/15 and 2020/23. \n\nA/RES/79/226 \nQuadrennial comprehensive policy review of operational activities \nfor development of the United Nations system\n \n24-24320\n4/26 \n \nsystem to ensure that those policy orientations are implemented on a system-wide \nbasis in accordance with the present resolution and relevant General Assembly \nresolutions,15  \n \nRecalling also its resolutions 75/290 B of 25 June 2021 and 78/285 of 7 June \n2024, and previous resolutions,16 reaffirming the commitment to engage in systematic \nfollow-up and review of the implementation of the 2030 Agenda for Sustainable \nDevelopment in accordance with the principles contained therein, and asserting that \nthe high-level political forum on sustainable development has a central role in \noverseeing a network of follow-up and review processes of the 2030 Agenda at the \nglobal level, working coherently with the General Assembly, the Economic and Social \nCouncil and other relevant organs and forums, in accordance with existing mandates,  \n \nRecognizing that relevant stakeholders, including international financial \ninstitutions, civil society and the private sector, can positively contribute to the \nachievement of the Sustainable Development Goals, and encouraging their \ncontribution in supporting national development efforts in accordance with national \nplans and priorities,  \n \nTaking note of the reports of the Secretary-General on the implementation of \nGeneral Assembly resolution 75/233 on the quadrennial comprehensive policy review \nof operational activities for development of the United Nations system, 17  \n \nTaking note also of the reports of the Chair of the United Nations Sustainable \nDevelopment Group on the work of the Development Coordination Office, including \non the operational, administrative and financing aspects of the activities of the \nOffice,18  \n \nRecognizing the essential role played by the United Nations in effectively \nbringing together a global response to control and contain the spread of the \ncoronavirus disease (COVID-19) and address the critical interlinkages between \nhealth, trade, finance and economic and social development, acknowledging that the \ndisease negatively impacted endeavours aimed at achieving the Sustainable \nDevelopment Goals by 2030 and that the poorest and the most vulnerable were the \nhardest hit by the COVID-19 pandemic, and reaffirming the ambition to get back on \ntrack to achieve the 2030 Agenda for Sustainable Development,  \n \nLooking forward to the establishment of an independent high-level expert group \nby the Secretary-General and, following the completion of its work, the initiation of \na United Nations-led intergovernmental process on measures that complement and go \nbeyond gross domestic product, in close consultation with Member States and \nrelevant stakeholders, taking into account the work of the Statistical Commission, \nacknowledging the potential for the development of measures of progress on \nsustainable development that complement or go beyond gross domestic product to \nimprove the support provided by the United Nations development system to \nprogramme countries,  \n \nWelcoming the adoption of its resolution 78/322 of 13 August 2024 on the \nmultidimensional vulnerability index,  \n \nRecalling the political declaration of the high-level political forum on \nsustainable development convened under the auspices of the General Assembly \n__________________ \n \n15 Resolutions 48/162, 50/227, 57/270 B, 61/16, 65/285, 68/1 and 72/305. \n \n16 Resolutions 66/288, 67/290, 68/1, 70/299 and 74/298. \n \n17 A/76/75-E/2021/57, A/76/75/Add.1-E/2021/57/Add.1, A/77/69-E/2022/47, \nA/77/69/Add.1- E/2022/47/Add.1, A/78/72-E/2023/59, A/78/72/Add.1-E/2023/59/Add.1, \nA/79/72-E/2024/12, A/79/72/Add.1-E/2024/12/Add.1 and A/79/72/Add.2-E/2024/12/Add.2. \n \n18 E/2021/55, E/2022/54, E/2023/62 and E/2024/5. \n\nQuadrennial comprehensive policy review of operational activities \nfor development of the United Nations system \nA/RES/79/226\n \n5/26\n24-24320 \n \n(Sustainable Development Goals Summit), 19 which recommitted to accelerate the \nimplementation of the 2030 Agenda and its Sustainable Development Goals,  \n \nWelcoming the convening of the Summit of the Future on 22 and 23 September \n2024 at the United Nations Headquarters in New York, at which resolution 79/1 \nentitled \u201cThe Pact for the Future\u201d and its annexes were adopted, \n \nLooking forward to the convening of the Fourth International Conference on \nFinancing for Development, to be held in 2025 in Seville, Spain,  \n \nI \nGeneral guidelines  \n \n \n1. \nReaffirms that the fundamental characteristics of the operational activities \nfor development of the United Nations system should be, inter alia, their universal, \nvoluntary and grant nature, their neutrality and their multilateralism, as well as their \nability to respond to the development needs of programme countries in a flexible \nmanner, and that the operational activities for development are carried out for the \nbenefit of programme countries, at the request of those countries and in accordance \nwith their own policies and priorities for development;  \n \n2. \nUnderscores that there is no \u201cone size fits all\u201d approach to development, \nand reiterates the call to the United Nations development system to continue to enhance \nits efforts, in a flexible, transparent, accountable, timely, coherent, coordinated and \nintegrated manner, and to continue to pursue full alignment of operational activities for \ndevelopment at the country level with national development plans and strategies to \nstrengthen national ownership and leadership at all stages of the operational activities \nof the United Nations development system in order for the entities to respond to national \ndevelopment needs and priorities in accordance with their mandates, while ensuring the \nfull involvement of all relevant stakeholders at the national level;  \n \n3. \nRecognizes that there are different approaches, visions, models and tools \navailable to each country, in accordance with its national circumstances and priorities, \nto achieve the 2030 Agenda for Sustainable Development;20  \n \n4. \nAlso recognizes that the strength of the United Nations development \nsystem lies in its legitimacy, at the country level, as a neutral, objective, transparent \nand trusted partner for all countries;  \n \n5. \nStresses that national Governments have the primary responsibility for \ntheir countries\u2019 development and for coordinating, on the basis of national strategies \nand priorities, all types of external assistance, including that provided by multilateral \norganizations, in order to effectively integrate such assistance into their development \nprocesses;  \n \n6. \nRecognizes that national efforts should be complemented by supportive \nglobal and regional programmes, measures and policies aimed at expanding the \ndevelopment opportunities of all countries, supported by an enabling economic \nenvironment, including coherent and mutually supporting world trade, tax, monetary \nand financial systems, and enhanced global economic governance, while taking into \naccount national conditions and ensuring respect for national ownership;  \n \n7. \nReaffirms the need to continue to strengthen the United Nations \ndevelopment system to further enhance its coherence, efficiency, transparency and \naccountability, as well as its capacity to address effectively and in accordance with \nthe purposes and principles of the Charter of the United Nations, the full range of \n__________________ \n \n19 Resolution 78/1, annex. \n \n20 Resolution 70/1. \n\nA/RES/79/226 \nQuadrennial comprehensive policy review of operational activities \nfor development of the United Nations system\n \n24-24320\n6/26 \n \ndevelopment challenges of our time, as set out in the 2030 Agenda for Sustainable \nDevelopment, and that it must continue to adapt and respond, including to proactively \nwork to build capacity, to evolving development challenges and opportunities for \ndevelopment cooperation so that no one is left behind;  \n \n8. \nWelcomes the progress achieved to date in implementing the United \nNations development system reform, as initiated by the General Assembly in its \nresolution 72/279, including the realization of the main elements of the reform \nmandates, and underscores the importance of attaining outstanding reform goals with \na view to the full and timely implementation of the reform mandates at all levels, and \nrequests the Secretary-General to provide an update in 2028 within the annual report \non the implementation of the General Assembly resolution on the quadrennial \ncomprehensive policy review of operational activities for development of the United \nNations system on the progress of the United Nations development system reform;  \n \n9. \nReiterates its call to the entities of the United Nations development \nsystem, within their respective mandates, to continue to mainstream the Sustainable \nDevelopment Goals in their strategic planning and, where applicable, in their regional \nand country programme documents, their work and reporting at all levels, taking into \naccount that the eradication of poverty in all its forms and dimensions, including \nextreme poverty, is the greatest global challenge and is an indispensable requirement \nfor sustainable development and should therefore continue to be the highest priority \nfor and overarching objective of the operational activities of the United Nations \ndevelopment system;  \n \n10. Recognizes that the individual entities of the United Nations development \nsystem have specific experience and expertise, derived from and in line with their \nmandates and strategic plans, and stresses in this regard that improvement of \ncoordination, collaboration, efficiency and coherence at the country, regional and \nglobal levels should be undertaken in a manner that recognizes their respective \nmandates and roles with consideration for comparative advantages, and enhances the \neffective utilization of their resources and their unique expertise;  \n \n11. \nReiterates the call to the United Nations development system to continue \nto support developing countries in their efforts to achieve internationally agreed \ndevelopment goals and their development objectives, and requests the system to \naddress, within existing resources and mandates, the special challenges facing the \nmost vulnerable countries and, in particular, African countries, least developed \ncountries, landlocked developing countries and small island developing States, the \nneed for special attention to countries in conflict and post-conflict situations and \ncountries and peoples under foreign occupation, as well as the specific challenges \nfacing the middle-income countries, in line with the Addis Ababa Action Agenda of \nthe Third International Conference on Financing for Development 21 and the 2030 \nAgenda for Sustainable Development;  \n \n12. Urges the United Nations development system to continue to enhance its \nsupport for the implementation of the Doha Programme of Action for the Least \nDeveloped Countries,22 the Antigua and Barbuda Agenda for Small Island Developing \nStates: A Renewed Declaration for Resilient Prosperity 23 and the new Programme of \nAction for Landlocked Developing Countries for the Decade 2024\u20132034, as well as the \nAfrican Union Agenda 2063 and its second 10-year implementation plan, and the New \nPartnership for Africa\u2019s Development,24 all of which are integral to the 2030 Agenda \nfor Sustainable Development, and calls upon the entities of the United Nations \n__________________ \n \n21 Resolution 69/313, annex. \n \n22 Resolution 76/258, annex. \n \n23 Resolution 78/317, annex. \n \n24 A/57/304, annex. \n\nQuadrennial comprehensive policy review of operational activities \nfor development of the United Nations system \nA/RES/79/226\n \n7/26\n24-24320 \n \ndevelopment system to integrate and mainstream them fully into their operational \nactivities for development;  \n \n13. \nEmphasizes that realizing gender equality and the empowerment of women \nand girls will make a crucial contribution to progress across all the Goals and targets of \nthe 2030 Agenda, and reiterates the calls upon all entities of the United Nations \ndevelopment system to continue to promote gender equality and the empowerment of \nall women and girls by enhancing and accelerating gender mainstreaming through the \nfull implementation of the System-wide Action Plan on Gender Equality and the \nEmpowerment of Women, developed under the leadership of the United Nations Entity \nfor Gender Equality and the Empowerment of Women (UN-Women), as well as the \nUnited Nations country team performance indicators for gender equality and the \nempowerment of women (the UNCT SWAP \u201cscorecard\u201d) in particular with regard to \ngender-responsive performance management and strategic planning, and to enhance the \ncollection, availability and use of sex-disaggregated data, reporting and resource \ntracking, and drawing on available gender expertise in the system at all levels, including \nin UN-Women, to assist in mainstreaming gender equality in the preparation of the \nUnited Nations Sustainable Development Cooperation Framework, through a gender \nequality outcome, where appropriate and relevant in the country context and ensuring \nthat gender equality expertise is available throughout the United Nations development \nsystem at all levels;  \n \n14. Recognizes that, in line with the 2030 Agenda for Sustainable \nDevelopment, people who are vulnerable must be empowered, further recognizes that \nthose whose needs are reflected in the Agenda include all children, youth, persons \nwith disabilities, people living with HIV/AIDS, older persons, Indigenous Peoples, \nrefugees and internally displaced persons and migrants, and calls upon the United \nNations development system to continue to have a particular focus on the poorest, \nmost vulnerable and those furthest behind;  \n \n15. Requests the entities of the United Nations development system, within \ntheir respective mandates and where applicable, to consider using the \nmultidimensional vulnerability index, including the vulnerability-resilience country \nprofiles, in their relevant programmes of work and reporting, focusing on the \ncountries interested in its use, as a complement to existing measures, in line with \nGeneral Assembly resolution 78/322;  \n \n16. Requests the United Nations development system to support, as \nappropriate and within existing mandates, the independent high-level expert group on \nmeasures that complement and go beyond gross domestic product, to be established \nby the Secretary-General, and subsequently the United Nations-led intergovernmental \nprocess on measures that complement and go beyond gross domestic product;  \n \n17. Calls upon the United Nations development system entities as well as \nUnited Nations country teams, within their respective mandates, to continue to work \ncollaboratively to accelerate the full and effective mainstreaming of disability \ninclusion into the United Nations system, including by mobilizing and budgeting \nresources, and implementing and providing measurable reporting on the United \nNations Disability Inclusion Strategy across its programmes and operations, and \nstressing the need for country-level support and capacity-development efforts aimed \nat empowering and learning from persons with disabilities and their representative \norganizations, by selecting senior disability inclusion focal points from existing staff \nwithin the United Nations development system entities;  \n \n18. Urges Member States and the United Nations development system to \nexplore and promote concrete new avenues for the full, effective, structured and \nsustainable participation of young people in the implementation of the 2030 Agenda;  \n\nA/RES/79/226 \nQuadrennial comprehensive policy review of operational activities \nfor development of the United Nations system\n \n24-24320\n8/26 \n \n \n19. Recognizes the positive role that sustainable development can play in \nmitigating drivers of conflicts, disaster risks, humanitarian crises and complex \nemergencies, and also recognizes that a comprehensive whole-of-system response, \nincluding greater cooperation, coherence, coordination and complementarity among \ndevelopment, disaster risk reduction, humanitarian action and sustaining peace, is \nfundamental to most efficiently and effectively addressing needs and attaining the \nSustainable Development Goals;  \n \n20. Underscores the importance of results-based management, within and \nacross entities and at all levels of the United Nations development system, as an \nessential element of accountability that can, inter alia, contribute to the achievement \nof the Sustainable Development Goals and targets, and requests the United Nations \ndevelopment system and its individual entities to continue to strengthen results-based \nmanagement, focusing on long-term development outcomes, developing common \nmethodologies for planning and reporting on results, including on agency-specific \nactivities, and on inter-agency and joint activities, improving integrated results and \nresources frameworks, where appropriate, and enhancing a results-oriented culture in \nthe entities of the United Nations development system;  \n \n21. Notes the importance of the contribution of the United Nations \ndevelopment system with the aim of supporting government efforts to achieve the \nSustainable Development Goals, leaving no one behind, based on full respect for \nhuman rights, including the right to development, and stresses in this regard that all \nhuman rights are universal, indivisible, interdependent and interrelated;  \n \nII \nContribution of United Nations operational activities for development  \n \n \n22. Reiterates the call to the United Nations development system to continue \nto support countries, upon their request, in the acceleration of the implementation, \nfollow-up and review of the 2030 Agenda for Sustainable Development, especially in \nthe decade of action and delivery for sustainable development, including by focusing \non addressing the gaps and challenges, including those identified by voluntary \nnational reviews, bearing in mind that the Sustainable Development Goals and targets \nare integrated and indivisible, global in nature and universally applicable, taking into \naccount the different national realities, capacities and levels of development and \nrespecting national policies and priorities, and in this regard urges the United Nations \ndevelopment system:  \n \n(a) \nTo continue to allocate resources to realize the development objectives of \ndeveloping countries, and to support the endeavour to reach the furthest behind first, \nwhile taking into account the universal and inclusive nature of the 2030 Agenda for \nSustainable Development;  \n \n(b) \nTo ensure a coherent, balanced and integrated approach within the system \ntowards its support to the implementation of the Sustainable Development Goals and \ntargets, including their interconnections and cross-cutting elements, in accordance \nwith each entity\u2019s mandate and bearing in mind their comparative advantages, taking \ninto account new and evolving development challenges and the need to build on \nlessons learned, address gaps, avoid duplication and overlap and strengthen the \ninter-agency approach in this regard;  \n \n23. Calls upon the United Nations development system entities, while \nrespecting their respective roles and mandates, to update and build upon their unique \ncontributions and added value to the implementation of the 2030 Agenda for \nSustainable Development in the preparation of their strategic plans and similar \nplanning documents, and in this regard requests each individual entity to elaborate on \nhow it plans to further engage in coherent and integrated support, with a stronger \n\nQuadrennial comprehensive policy review of operational activities \nfor development of the United Nations system \nA/RES/79/226\n \n9/26\n24-24320 \n \nfocus on actions, results, coherence, progress and impact in the field, as called for in \nthe 2030 Agenda for Sustainable Development, under the guidance of and in close \nconsultation with their respective governing bodies, taking into account, inter alia, \nlessons learned from their midterm reviews, the outcome of the present resolution, \nand the efforts of the United Nations development system to address the needs, \npriorities and challenges of programme countries;  \n \n24. Also calls upon the entities of the United Nations development system to \ncontinue to provide evidence-based and integrated policy advice and programmatic \nsupport to help countries in the implementation of, follow-up to and reporting on the \n2030 Agenda for Sustainable Development, particularly by mainstreaming the \nSustainable Development Goals into national plans, including by promoting sustained \nand inclusive economic growth, social development and environmental protection, \nand ending poverty in all its forms and dimensions, and requests, in this regard, the \nUnited Nations country teams, under the leadership and coordination of the Resident \nCoordinators, to contribute their expertise, tools and platforms in line with their \nrespective mandates and strategic plans and as agreed in the United Nations \nSustainable Development Cooperation Frameworks25 in consultation and coordination \nwith national Governments;  \n \n25. Recognizes that eradicating poverty in all its forms and dimensions, \nincluding extreme poverty, is the greatest global challenge and an indispensable \nrequirement for sustainable development, as set out in the 2030 Agenda, notes with \nconcern the rise in global poverty, which disproportionately impacts women and girls, \nand requests the United Nations development system to strengthen actions to \naccelerate progress on eradicating poverty;  \n \n26. Requests the entities of the United Nations development system to enhance \ncoordination to support the efforts on the eradication of poverty in all its forms and \ndimensions through integrated, coordinated and coherent strategies at all levels, in \naccordance with the outcomes of the major United Nations conferences and summits \nin the economic, social and related fields;  \n \n27. Requests the United Nations development system to strengthen actions to \naccelerate progress on ending hunger and malnutrition in all its forms, and to \ncontribute in a coherent manner to achieving food security and building inclusive, \nresilient and sustainable agrifood systems;  \n \n28. Also requests the United Nations development system to strengthen \nactions to accelerate progress on Sustainable Development Goal 6 in programme \ncountries, upon request, in line with national priorities, needs and plans, \nacknowledging that water and sanitation are critical for sustainable development and \nthe eradication of poverty;  \n \n29. Emphasizes the essential role of inclusive and sustainable industrial \ndevelopment as part of a comprehensive strategy of structural economic \ntransformation in eradicating poverty and supporting sustained economic growth and \nthus contributing to sustainable development in developing countries, and invites the \nrelevant entities of the United Nations development system to support efforts in this \nregard in line with the 2030 Agenda and the Sustainable Development Goals;  \n \n30. Recognizes that, in a demographically diverse world, population \ndynamics, including differences in the pace of population growth or decline, changing \npopulation age structures, urbanization and international migration, will continue to \nshape the world for present and future generations, and requests the United Nations \ndevelopment system to support Member States, upon their request and in line with \n__________________ \n \n25 Or equivalent planning framework.  \n\nA/RES/79/226 \nQuadrennial comprehensive policy review of operational activities \nfor development of the United Nations system\n \n24-24320\n10/26 \n \nnational priorities, taking into account the needs of women and children, in their \nresponse to demographic trends and realities, such as rapid population growth, \ndeclining birth rates and ageing populations, as well as in addressing the interlinkages \nbetween population issues and development across all regions, including by helping \nto build capacity and strengthen statistical systems in programme countries;  \n \n31. Requests the United Nations development system to continue to support \nprogramme countries in developing and implementing nationally appropriate social \nprotection systems and measures for all, including social protection floors, and by \n2030 to achieve substantial coverage of the poor and the vulnerable, and takes note \nwith appreciation of the Global Accelerator on Jobs and Social Protection for Just \nTransitions;  \n \n32. Calls upon the entities of the United Nations development system to \npromote partnerships to achieve universal health coverage, which includes primary \nhealthcare, ensure affordable and equitable access for developing countries to health \nproducts and technologies and promote other health measures necessary to deal with \nfuture health-related challenges and countermeasures needed to respond to pandemics \nand other health emergencies, including through financing, health systems \nstrengthening, building capacity, technology transfer on mutually agreed terms and \nknow-how for local and regional manufacturing and production of medical \ncountermeasures, including medicines, vaccines, therapeutics, diagnostics, health \ntechnologies and other health products in developing countries;  \n \n33. Recognizes the United Nations contribution to the promotion of all human \nrights for sustainable development, and calls upon all entities of the United Nations \ndevelopment system, in accordance with their respective mandates, to assist \nGovernments, upon their request and in consultation with them, in their efforts to \nrespect and fulfil their human rights obligations and commitments under international \nlaw, as a critical tool to operationalize the pledge to leave no one behind;  \n \n34. Calls upon the entities of the United Nations development system to \nsupport programme countries that are parties to the Paris Agreement in their \nimplementation of the Agreement, as appropriate and in accordance with their \nnational development policies, plans, priorities and needs, in particular their \nnationally determined contributions and national adaptation plans, as well as the \ndecisions of the Conference of the Parties to the United Nations Framework \nConvention on Climate Change and the Conference of the Parties serving as the \nMeeting of the Parties to the Paris Agreement, including all decisions adopted under \nthe \u201cUAE Consensus\u201d;  \n \n35. Also calls upon the entities of the United Nations development system to \nadopt and mainstream a more climate- and environment-responsive approach into \ntheir programmes and strategic plans, where appropriate, as well as in cooperation \nframeworks and their policy advice to programme countries, in accordance with \nnational development policies, plans, priorities and needs, and continue to advance a \nsystem-wide approach, implement measures and report regularly to their respective \ngoverning bodies, through existing reporting and mandates, on their efforts to reduce \ntheir climate and environmental footprint, and ensure consistency of their operations \nand programmes with low emissions and climate-resilient development pathways and \naddressing pollution, halting biodiversity loss and restoring, conserving, protecting \nand sustainably using the environment;  \n \n36. \nFurther calls upon the entities of the United Nations development system, \nat the request of national Governments and taking into account their respective \nmandates, to improve their support, including, where appropriate, in partnership with \nrelevant stakeholders, with regard to strengthening the mobilization of the means of \nimplementation of the Sustainable Development Goals from all sources, in line with \n\nQuadrennial comprehensive policy review of operational activities \nfor development of the United Nations system \nA/RES/79/226\n \n11/26\n24-24320 \n \nthe 2030 Agenda and the Addis Ababa Action Agenda, including through capacity-\nbuilding, integrated policy advice and programmatic support, technical assistance, \nhigh-quality, timely, reliable and disaggregated data, normative support, support to \nnational institutions, the leveraging of partnerships and the leveraging of science, \ntechnology and innovation, in accordance with national development policies, plans, \npriorities and needs;  \n \n37. Underscores the importance of localization of the Sustainable \nDevelopment Goals, and calls upon the entities of the United Nations development \nsystem, where appropriate at the request of national Governments, and in line with \nnational development policies, plans and priorities, to improve their support to the \nbuilding, developing and strengthening of national, subnational and local institutions \nand capacities, and to continue to also support locally driven development approaches \nand pathways in coordination with national Governments, including through tailored \nand integrated support and by incorporating appropriate capacity development and \nstrengthening in programmes and projects;  \n \n38. Emphasizes the need for country-driven enhanced capacity-building for \nsustainable development, in this regard calls for the strengthening of cooperation in \nscience, technology and innovation, including through promoting an open, fair, \ninclusive and non-discriminatory environment as well as equity, collaboration and \nopenness in the development and dissemination of research and innovation, so that \nscientists, innovators and policymakers everywhere can access and contribute to the \nlatest science and evidence, as well as through North-South, South-South and \ntriangular, regional and international cooperation, and reiterates the importance of \nhuman resources development, including training, the exchange of experience and \nexpertise, knowledge-sharing and technical assistance for capacity-building, which \ninvolves strengthening institutional capacities, including planning, management, \nmonitoring and evaluation capacities, in a sustained manner;  \n \n39. Encourages the entities of the United Nations development system, within \ntheir respective mandates, to support programme countries, upon request and in line \nwith national priorities, needs and plans, to harness digital technologies to accelerate \nthe achievement of the Sustainable Development Goals and to close all digital divides \nby, inter alia, promoting universal, affordable and meaningful connectivity, scaling \nup digital capacity development, supporting resilient, safe, inclusive and \ninteroperable digital public infrastructure, promoting digital public goods and \ninformation integrity and harnessing artificial intelligence, for sustainable \ndevelopment, while considering relevant commitments in the Global Digital Compact \nand recognizing the need to scale up international cooperation and financing for \ndigital capacity development and promoting digital readiness, particularly in \ndeveloping countries;  \n \n40. Calls upon the United Nations development system to encourage the safe \ndevelopment and deployment of new and existing technologies for the global good, \nsharing the benefits while managing the risks, and to ensure that the products and \ntechnologies developed are affordable, available and accessible to those most in need, \nincluding the most vulnerable;  \n \n41. Also calls upon the United Nations development system to strengthen its \nfocus on supporting programme countries in a coherent and integrated manner in \ndeveloping national capacities for research, development planning, collection and \nanalysis of data disaggregated by income, sex, age, race, ethnicity, migratory status, \ndisability, geographical location and other characteristics relevant in national \ncontexts, sectoral data development plans, implementation, reporting, monitoring and \nevaluation, with an emphasis on addressing the gap in data collection and analysis \nand the effective integration of the economic, environmental and social dimensions \n\nA/RES/79/226 \nQuadrennial comprehensive policy review of operational activities \nfor development of the United Nations system\n \n24-24320\n12/26 \n \nof sustainable development, and in this regard recognizes that the resources of the \nUnited Nations development system, including the knowledge base and expertise of \nall resident and non-resident agencies, should be available for access by developing \ncountries, and welcomes efforts of the United Nations development system to take a \nmore coherent approach to supporting national data and statistical systems;  \n \n42. Further calls upon the United Nations development system to enhance its \ncapacities in supporting programme countries to embed the needs and interests of \nfuture generations and long-term thinking in policymaking processes by fostering \ncooperation and facilitating greater use of anticipatory planning and foresight, based \non science, data and statistics;  \n \n43. Reaffirms the central role of Governments in contributing to the work of \nthe United Nations development system, while recognizing that authorities at the \nsubnational level, such as local and regional authorities, where appropriate, \ndevelopment partners and relevant stakeholders, international financial institutions, \ncivil society and the private sector can positively support national development efforts \nand contribute to the achievement of the Sustainable Development Goals, and \nrequests the United Nations development system to continue supporting programme \ncountries to leverage robust partnerships, in accordance with national development \npolicies, plans, priorities and needs, with a view to achieving the scale and pace of \nprogress needed to realize the Goals by 2030;  \n \n44. Reiterates that the entities of the United Nations development system \nshould enhance its support to South-South and triangular cooperation, at the request \nand with the ownership and leadership of developing countries, through a system-\nwide approach, bearing in mind their respective mandates and comparative \nadvantages, taking into account that South-South cooperation is a complement to, \nrather than a substitute for, North-South cooperation, in line with the Nairobi26 and \nBuenos Aires27 outcome documents of the High-level United Nations Conferences on \nSouth-South Cooperation, held in 2009 and 2019, respectively;  \n \n45. Calls upon the United Nations development system entities to further \nintegrate, as appropriate, South-South and triangular cooperation into their strategic \nframeworks and planning instruments, and urges them to allocate sufficient financial \nresources dedicated to supporting and facilitating South-South and triangular \ncooperation;  \n \n46. Also calls upon the entities of the United Nations development system to \nleverage their comparative advantages, in full compliance with their respective \nmandates, to continue to enhance cooperation, collaboration and coordination with \nhumanitarian assistance and peacebuilding efforts at the national level in countries \nfacing humanitarian emergencies, including complex emergencies, and in countries \nin conflict and post-conflict situations, including through agency-specific actions and \ninter-agency collaboration at the country level, in order to foster greater self-reliance \nand resilience and promote development, in accordance with national plans, needs \nand priorities, and in this regard:  \n \n(a) \nRe-emphasizes that in countries facing humanitarian emergencies, there is \na need to work collaboratively to move beyond short-term assistance towards \ncontributing to longer-term development gains, including by engaging, where \npossible, in joint risk analysis, coherent and complementary planning, learning and \nknowledge exchange, needs assessments, practice response and a coherent multi-year \ntime frame, with the aim of reducing need, vulnerability and risk over time, in \ncompliance with international law, and in line with General Assembly resolution \n__________________ \n \n26 Resolution 64/222, annex. \n \n27 Resolution 73/291, annex. \n\nQuadrennial comprehensive policy review of operational activities \nfor development of the United Nations system \nA/RES/79/226\n \n13/26\n24-24320 \n \n46/182 of 19 December 1991 and the annex thereto and all subsequent General \nAssembly resolutions on the subject, including its resolution 78/119 of 8 December \n2023, fully respecting humanitarian principles in the provision of humanitarian \nassistance, and in accordance with national plans and priorities, stressing that this \nshould not adversely affect resources for development;  \n \n(b) \nAlso re-emphasizes that development is a central goal in itself and that in \ncountries in conflict and post-conflict situations the development work of the entities \nof the United Nations development system can contribute to peacebuilding and \nsustaining peace, in accordance with national plans, needs and priorities and respecting \nnational ownership, and stresses in this regard the need to improve inter-agency \ncoordination and synergy, including through the comprehensive review of the United \nNations peacebuilding architecture, with the aim to maximize the sustainable impacts, \nresults and effectiveness of support for the implementation of the 2030 Agenda for \nSustainable Development, stressing that this should not adversely affect resources for \ndevelopment;  \n \n(c) \nRequests the Joint Steering Committee to Advance Humanitarian and \nDevelopment Collaboration to conduct briefings with Member States on its work at \nleast twice a year;  \n \n47. Calls upon the United Nations development system, including United \nNations country teams under the leadership of Resident Coordinators, within their \nrespective mandates, to assist programme countries, upon their request and in line \nwith their national policies and priorities for development, in addressing the \ndevelopment needs of internally displaced persons and to find durable solutions for \nthem;  \n \n48. Recognizes progress made in mainstreaming disaster risk reduction into \nthe United Nations development system\u2019s integrated policy and operational support \nto Governments, and requests relevant entities of the United Nations development \nsystem, in consultation with host Governments and in line with national policies, \npriorities and needs, to elaborate on disaster risk reduction in the common country \nanalysis and in United Nations planning and programming documents, including the \nUnited Nations Sustainable Development Cooperation Framework,28 and to understand \ndisaster risk, strengthen disaster risk governance to manage disaster risk, invest in \ndisaster risk reduction for resilience, and enhance disaster preparedness for effective \nresponse and to build back better in recovery, rehabilitation and reconstruction, taking \nnote of the ongoing efforts of the Coalition for Disaster-Resilient Infrastructure, the \nRisk-Informed Early Action Partnership, the Early Warnings for All initiative and the \nClimate Risk and Early Warning Systems initiative, and encourages the United \nNations development system to support programme countries in the implementation \nof the Sendai Framework for Disaster Risk Reduction 2015\u20132030, including \nmulti-hazard early warning systems, taking note of the political declaration of the \nhigh-level meeting on the midterm review of the Sendai Framework for Disaster Risk \nReduction 2015\u20132030 29 and the United Nations Plan of Action on Disaster Risk \nReduction for Resilience: Towards a Risk-informed and Integrated Approach to \nSustainable Development;  \n \n49. Calls upon the United Nations development system to improve and ensure \nsupport and assistance to programme countries, upon their request, in developing their \nnational capacities to ensure inclusive, safe and equitable quality education, promote \nlifelong learning opportunities for all for sustainable development, including early \nchildhood education and remote learning, and achieve the related targets of the \n__________________ \n \n28 Or equivalent planning framework.  \n \n29 Resolution 77/289, annex. \n\nA/RES/79/226 \nQuadrennial comprehensive policy review of operational activities \nfor development of the United Nations system\n \n24-24320\n14/26 \n \nSustainable Development Goals, recognizing that education, including girls\u2019 \neducation, is a main driver of development and contributes to the achievement of all \ninternationally agreed development goals, including the Sustainable Development \nGoals, the development of human potential, the eradication of poverty and the \nfostering of greater understanding among peoples;  \n \n50. Encourages United Nations development system entities, in accordance \nwith their respective mandates, to assist Governments in taking action to prevent and \neliminate all forms of violence and discrimination against all women and girls, \nincluding through the strengthening of institutional mechanisms and legal \nframeworks, and through multisectoral and coordinated approaches, and to support \nGovernments, upon their request, to adopt specific measures to protect the poor, \nwomen, youth and children from all forms of violence and discrimination;  \n \n51. \nNotes with appreciation the support provided to the least developed countries \nby the entities of the United Nations development system in the implementation of the \nDoha Programme of Action, and urges the entities of the development system to \ncontinue to mainstream the Programme of Action into their work;  \n \n52. Recognizes that small island developing States remain a special case for \nsustainable development, and in this regard calls upon the relevant entities of the \nUnited Nations development system to ensure the mainstreaming of the Antigua and \nBarbuda Agenda for Small Island Developing States and issues related to small island \ndeveloping States in their work, including at the national, regional and global levels, \nand to continue to support small island developing States, upon their request, in \naddressing their particular economic, social and environmental vulnerabilities, as \noutlined in the Antigua and Barbuda Agenda, by strengthening technical assistance \ninitiatives, policy guidance and programme development, in line with their respective \nmandates and in cooperation with relevant institutions, funds and facilities;  \n \n53. Also recognizes that Africa has special challenges and development needs, \ncalls upon the United Nations system to strengthen the quality of its assistance, \npartnership and coordinated regional efforts in Africa and to align its support for the \nspecific needs and priorities of the African region, with a special focus on, inter alia, \nimproving data and statistics, enhancing economic transformation and diversification, \nharnessing the demographic dividend, strengthening quality education and health \nsystems, leveraging new technologies for inclusive development, achieving universal \naccess to affordable, reliable, sustainable and modern energy for all, promoting \ninvestment in climate action, financing climate change mitigation and adaptation in \nAfrica, and the implementation of the African Union-United Nations Framework on \nthe Implementation of Agenda 2063 and the 2030 Agenda for Sustainable \nDevelopment, and in this regard invites the United Nations development system to \nsupport the second 10-year implementation plan (2024\u20132033) of the African Union \nAgenda 2063;  \n \n54. Looks forward to the convening of the third United Nations Conference on \nLandlocked Developing Countries and the full implementation of the new Programme \nof Action for Landlocked Developing Countries for the Decade 2024\u20132034, which is \nintegral to the 2030 Agenda for Sustainable Development and aims to accelerate \nsustainable development and resilience in landlocked developing countries, calls \nupon the entities of the United Nations development system to actively engage in the \nimplementation and reviews of the Programme of Action at the national, subregional, \nregional and global levels, in close cooperation and partnership with all relevant \nstakeholders, and to integrate the Programme of Action into their strategic plans and \nwork, and further calls upon the United Nations development system to mainstream \nthe new Programme of Action into the United Nations Sustainable Development \n\nQuadrennial comprehensive policy review of operational activities \nfor development of the United Nations system \nA/RES/79/226\n \n15/26\n24-24320 \n \nCooperation Framework, developed under the coordination of the Resident \nCoordinators at the country level, in a coordinated and cohesive manner;  \n \n55. Calls upon the United Nations development system to continue to develop \nand provide tailored support to middle-income countries in a manner that addresses \ntheir specific challenges while mindful of their diversity, and recognizes that a shift \nfrom a traditional model of direct support and service provision towards a greater \nemphasis on accurate and multidimensional assessment of each country\u2019s specific \nneeds and support for the leveraging of partnerships and financing is needed, also \ncalls upon the United Nations development system to advance the elaboration of a \nspecific inter-agency, comprehensive, system-wide response plan for middle-income \ncountries, taking note of the mapping exercise conducted by the Secretary-General \nand his recommendations, that is aimed at better addressing the multidimensional \nnature of sustainable development and facilitating sustainable development \ncooperation and coordinated and inclusive support to middle-income countries, and \ninvites the Chair of the United Nations Sustainable Development Group to consider \nfilling leadership gaps on middle-income countries\u2019 issues within existing resources, \nsuch as through the appointment of a focal point on middle-income countries;  \n \n56. Calls upon the United Nations Sustainable Development Group to further \nstrengthen its collaboration with international financial institutions, including \nmultilateral development banks, to improve synergies at the regional and country \nlevels, with a view to accelerating the implementation of the 2030 Agenda through \nenhanced operational effectiveness and efficiency;  \n \n57. Recognizes that volunteerism can be a powerful and cross-cutting means \nof implementation of the 2030 Agenda for Sustainable Development, and encourages \nthe United Nations development system, in partnership with Member States, civil \nsociety and the private sector, to continue supporting such efforts and promoting the \nconducive environment for volunteerism and volunteers, in particular those from \ndeveloping countries, to enhance the sustainability of development results;  \n \nIII \nFunding of operational activities for development of the United Nations system  \n \n \n58. Recognizes that the integrated nature of the 2030 Agenda for Sustainable \nDevelopment calls for a more sustainable funding approach, and stresses the need for \nadequate quantity and quality of voluntary funding to continue to support the United \nNations operational activities for development, as well as the need to improve funding \npractices to make voluntary funding more predictable, transparent, flexible, effective \nand efficient, less earmarked and better aligned with the national priorities and plans \nof programme countries, as reflected in the United Nations Sustainable Development \nCooperation Framework,30 as well as with the strategic plans and mandates of United \nNations funds, programmes and specialized agencies, in order to enable the United \nNations development system to work at all levels in a coherent, coordinated, efficient \nand, where appropriate, integrated manner, reducing duplication and increasing impact;  \n \n59. Stresses that core resources are the bedrock of the United Nations \noperational activities for development, owing to their untied nature, and in this regard, \nexpresses concern at the continuing and accelerated decline in the share of core \ncontributions to the entities of the United Nations development system in recent years;  \n \n60. Acknowledges the efforts by developed countries to increase resources for \ndevelopment, including commitments by some developed countries to increase \nofficial development assistance, expresses concern that most countries still fall short \nof their respective official development assistance commitments, including the \n__________________ \n \n30 Or equivalent planning framework. \n\nA/RES/79/226 \nQuadrennial comprehensive policy review of operational activities \nfor development of the United Nations system\n \n24-24320\n16/26 \n \ncommitment by many developed countries to achieve the targets of 0.7 per cent of \ngross national income for official development assistance to developing countries and \n0.15 to 0.20 per cent to the least developed countries, and urges those developed \ncountries that have not yet done so to make concrete efforts in this regard in \naccordance with their commitments;  \n \n61. Recalls the operationalization of the Technology Bank for the Least \nDeveloped Countries, and in this regard invites Member States, as well as \ninternational organizations, foundations and the private sector, to provide voluntary \nfinancial contributions and technical assistance to ensure its full and effective \nimplementation, and urges the United Nations system and other relevant international \nand regional organizations to support, in a coordinated manner, the activities of the \nTechnology Bank, while respecting the relevant provisions of the intellectual property \nrights-related agreements;  \n \n62. Reiterates the call for the enhancement of accountability, transparency, \nefficiency and effectiveness in the funding of the United Nations operational activities \nfor development in order to incentivize contributions by donor countries and other \ncontributors, and calls upon United Nations funds, programmes and specialized \nagencies to continue to publish timely, harmonized and verifiable data on funding flows, \nincluding annual data disaggregated by the level of earmarking in line with the funding \ncompact,31 as well as to continue to enhance the visibility of contributors at all levels, \nincluding by making information available on providers of flexible global funding and \nthe results they helped to achieve;  \n \n63. Urges the United Nations funds, programmes and specialized agencies to \nensure that funds targeted at and budgeted for development programmatic activities \nare not diverted to unnecessary overhead costs, to maximize funds available for \ndevelopment purposes;  \n \n64. Encourages the United Nations development system entities to ensure that \ntheir business models are structured in a manner that supports the accelerated, \ncomprehensive and balanced implementation of the 2030 Agenda;  \n \n65. Welcomes the funding compact, 32  noting its voluntary nature, and \nencourages all Member States and entities of the United Nations development system \nto contribute to its full and effective implementation and to continue the dialogue, \ninter alia, in the respective governing bodies as well as at the country level with host \nGovernments and development partners to jointly make progress towards compliance \nwith their funding compact commitments to help to achieve development results on \nthe ground, taking note of the progress made thus far in the fulfilment of the first \nfunding compact commitments by all parties;  \n \n66. Requests donor countries and encourages other contributors to maintain \nand substantially increase their core contributions to the United Nations development \nsystem, in particular its funds, programmes and specialized agencies, and to contribute \non a multi-year basis, in a sustained and predictable manner, in line with Member States\u2019 \ncommitments under the funding compact, and encourages Member States to protect \ncore contributions in case of financial constraints;  \n \n67. Notes that non-core resources represent an important contribution to the \noverall resource base of United Nations operational activities for development as a \ncomplement to, and not a substitute for, core resources, and that they should support \nand be aligned with programme priorities regulated by intergovernmental bodies and \n__________________ \n \n31 See A/79/72/Add.2-E/2024/12/Add.2, annex, entitled \u201cTypologies of funding modalities and \nlevels of earmarking for sustainable development\u201d. \n \n32 A/79/72/Add.2-E/2024/12/Add.2. \n\nQuadrennial comprehensive policy review of operational activities \nfor development of the United Nations system \nA/RES/79/226\n \n17/26\n24-24320 \n \nprocesses, and also notes that non-core resources pose their own challenges by \npotentially increasing transaction costs, fragmentation, unproductive competition and \noverlap among entities and/or providing disincentives for pursuing system-wide \npriorities, strategic positioning and coherence, and in this regard:  \n \n(a) \nUrges donor countries and encourages other contributors to make non-core \ncontributions more flexible and aligned with the United Nations Sustainable \nDevelopment Cooperation Framework and strategic plans of United Nations \ndevelopment system entities as approved by their intergovernmental governing \nbodies, to preferably assign resources at the beginning of the annual planning period, \npreferably for multiple years, and to prioritize pooled, thematic and joint funding \nmechanisms at all levels, including the Joint Sustainable Development Goals Fund, \nand limit earmarking to activities in accordance with the national priorities and plans \nof programme countries;  \n \n(b) \nUrges the entities of the United Nations development system to continue \nto take active steps to strengthen their accountability to Member States and build their \ntrust by, inter alia, strengthening transparency of results and clear reporting of funding \nneeds and expenditures, giving clear visibility to outcomes and impact achieved \nthrough core and flexible funding, in particular with regard to entities\u2019 contributions \nto the United Nations system-wide results, including those achieved through joint \nprogramming, and deepening the achievement of efficiencies within and across \nentities to increase resources for programmes instead of administrative costs;  \n \n68. Acknowledges the progress achieved by the Development Coordination \nOffice so far, and requests it to continue to strengthen the transparency of the resident \ncoordinator system through clear reporting on the results and impact of coordination \nand regular briefings to Member States on the implementation of the resident \ncoordinator system to facilitate open dialogue on the system\u2019s performance, including \nat the country level, and increase efficiencies of the resident coordinator system;  \n \n69. Urges the entities of the United Nations development system to continue \nenhancing the transparency and accountability of inter-agency pooled funding \nmechanisms, including by continuing the application of the gender equality marker, \nas well as to continue developing well-designed pooled funds, as a complement to \nagency-specific funds, that reflect and support common objectives and cross-cutting \nissues for United Nations funds, programmes and specialized agencies, and urges the \nentities of the United Nations development system to enhance their participation, \nwhere appropriate, in such funding mechanisms;  \n \n70. Also urges the entities of the United Nations development system, through \ntheir governing bodies, to continue taking concrete steps to address on a continuous \nbasis the decline of the share of core contributions and the growing imbalance \nbetween core and non-core resources, including by, but not limited to:  \n \n(a) \nExploring options on how to incentivize donor countries, other countries \nin a position to do so and other contributors to ensure an adequate and predictable \nlevel of core and non-core funding on a multi-year basis, including by enhancing the \nquality of reporting and the demonstration of the links between expenditures and \nprogramme results;  \n \n(b) \nIdentifying, in the context of integrated results and resources frameworks, \nthe level of resources adequate to produce the results expected in their strategic plans, \nincluding administrative, management and programme support costs;  \n \n(c) \nExploring options to broaden and diversify the donor base in order to \nreduce the reliance of the system on a limited number of donors;  \n\nA/RES/79/226 \nQuadrennial comprehensive policy review of operational activities \nfor development of the United Nations system\n \n24-24320\n18/26 \n \n \n71. Reaffirms the principle of full cost recovery, proportionally from core and \nnon-core resources, thereby avoiding the use of core or regular resources to subsidize \nactivities financed by non-core or extrabudgetary resources, and reiterates its request to \nthe United Nations development system to analyse and explore in a collaborative \nmanner options for harmonized cost-recovery policies, based on common cost \nclassification and cost-recovery methodologies, and invites relevant governing bodies \nof United Nations development system entities that have not yet done so to review \nevidence-based proposals for updated and more harmonized cost-recovery policies, \nincluding cost classifications, from their respective entities, and urges relevant entities \nof the United Nations development system, Member States and other contributors to \ncomply with agreed cost-recovery policies;  \n \n72. Also reaffirms that an important role of international public finance, \nincluding official development assistance, is to catalyse additional resource \nmobilization from other sources, both public and private, as well as to assist countries \nin strengthening domestic enabling environments, building essential public services \nand unlocking additional finance through blended or pooled financing and risk \nmitigation, notably for infrastructure and other investments that support private sector \ndevelopment;  \n \n73. Urges the United Nations development system to mobilize multiple \nfunding sources, further explore and implement innovative funding approaches to \nmobilize additional resources for sustainable development, and deepen partnerships \nwith other relevant stakeholders, including with the private sector and international \nfinancial institutions, with a view to diversifying potential sources of quality funding, \nespecially core funding, for operational activities for development, in alignment with \nthe provisions of the present resolution and with the priorities and plans of the \nprogramme countries, and encourages in this regard the entities of the United Nations \ndevelopment system to share knowledge and best practices on ways to incentivize \ninnovative funding, taking into account the experiences of other multilateral \ninstitutions, and to include this information in their regular financial reporting;  \n \n74. Recognizes the need to further support the United Nations Sustainable \nDevelopment Cooperation Framework by substantially increasing joint resource \nmobilization and distribution for joint programmes at the country level, including \nthrough incentives for joint resource mobilization and programming, and stresses the \nneed for efforts leading towards an integrated funding approach at the country level, \nwhere applicable, while paying due respect to different organizational mandates and \nmodalities;  \n \n75. Expresses its serious concern at the fact that the share of expenditure for \noperational activities for development of the United Nations system in the least \ndeveloped countries is at just 50.7 per cent of total allocations, urges the United \nNations development system to continue to prioritize allocations to least developed \ncountries, while reaffirming that the least developed countries, as the most vulnerable \ngroup of countries, need enhanced support to overcome structural challenges that they \nface in implementing the 2030 Agenda for Sustainable Development, and requests the \nUnited Nations development system to provide assistance to graduating countries in \nthe formulation and implementation of their national transition strategies and to \nconsider country-specific support for graduated countries for a fixed period of time \nand in a predictable manner;  \n \n76. Emphasizes that core funding provides United Nations entities the \nflexibility to allocate funds to priority areas in their strategic plans, including \nunderfunded areas that were further exacerbated by the economic fallout from the \nCOVID-19 pandemic, and in this regard stresses the urgent need to address the \n\nQuadrennial comprehensive policy review of operational activities \nfor development of the United Nations system \nA/RES/79/226\n \n19/26\n24-24320 \n \ncontinued imbalance between core and non-core resources by meeting the funding \ncompact commitment of 30 per cent core resources by 2027;  \n \n77. Also emphasizes that adequate, predictable and sustainable funding of the \nresident coordinator system is essential for a coherent, effective, efficient and \naccountable response to achieve results on the ground in accordance with national \nneeds and priorities, and takes note of the report of the Secretary-General33 in this \nregard; \n \n78. Welcomes the operationalization of the online portal to reflect real-time \ncontributions and expenditures related to the reinvigorated resident coordinator \nsystem, and notes the improvements made to the special purpose trust fund portal to \nbetter report contribution data by donor and United Nations entity in order to ensure \nfurther transparency, and in this regard continues to encourage all Member States to \nprovide voluntary contributions to the special purpose trust fund;  \n \n79. Notes with appreciation the efforts of the Secretary-General to improve \nvisibility of the funding status of the entire United Nations development system in \norder to promote further transparency, and to continue providing relevant \nrecommendations in this regard in his report on the implementation of the present \nresolution;  \n \nIV \nGovernance of the United Nations operational activities for development  \n \n \n80. Continues to stress that the governance architecture of the United Nations \ndevelopment system must be more efficient, transparent, accountable and responsive \nto Member States and able to enhance coordination, coherence, effectiveness and \nefficiency of the operational activities for development within and among all levels \nof the United Nations development system in order to enable system-wide strategic \nplanning, implementation, reporting and evaluation to better support the \nimplementation of the 2030 Agenda for Sustainable Development;  \n \n81. Requests the United Nations Sustainable Development Group to review \nthe current reporting requirements for its members on the quadrennial comprehensive \npolicy review and related reporting on United Nations development system reform, \nand to make a proposal for further streamlining of the reporting requirements to \nreduce the burden on United Nations Sustainable Development Group members and \nMember States, and to, where applicable and required, submit proposed streamlining \noptions to the relevant governing bodies;  \n \n82. Calls upon United Nations Sustainable Development Group entities to \nfurther strengthen their internal oversight mechanisms, and encourages the governing \nbodies of the members of the United Nations Sustainable Development Group to \nstrengthen the execution of their governance and oversight functions, building on best \npractices and in close collaboration with their respective entities and other governing \nbodies;  \n \n83. Welcomes a revitalized, strategic, flexible and results- and action-oriented \nUnited Nations Sustainable Development Cooperation Framework, as the most \nimportant instrument for the planning and implementation of United Nations \ndevelopment activities in each country, in support of the implementation of the 2030 \nAgenda for Sustainable Development and the achievement of the Sustainable \nDevelopment Goals, and the programme countries\u2019 policies, plans, priorities and \n__________________ \n \n33 Report of the Secretary-General on revised estimates relating to the proposed programme budget \nfor 2024 under section 1, Overall policymaking, direction and coordination, and section 29B, \nDepartment of Operational Support (A/78/753). \n\nA/RES/79/226 \nQuadrennial comprehensive policy review of operational activities \nfor development of the United Nations system\n \n24-24320\n20/26 \n \nneeds, to be prepared and finalized in full consultation and agreement with national \nGovernments, through the United Nations country team, under the leadership and \ncoordination of the Resident Coordinators;  \n \n84. Reaffirms the central role and the importance of the active and full \nparticipation of national Governments in the preparation, implementation, monitoring \nand evaluation of the United Nations Sustainable Development Cooperation \nFramework, in order to enhance national ownership and achieve full alignment of \noperational activities with national priorities, challenges, planning and programming, \nand in this sense continues to encourage national Governments to consult with \nrelevant stakeholders, including civil society and non-governmental organizations;  \n \n85. Recognizes the progress made by the reinvigorated resident coordinator \nsystem and the reconfigured United Nations country teams, requests all United \nNations development system entities to strengthen their efforts to prepare and finalize \ntheir entity-specific country development programme documents, according to their \nentity-specific mandates, and in accordance with and aligned with the agreed \npriorities and outcomes of the United Nations Sustainable Development Cooperation \nFramework and in consultation and agreement with host Governments, underlines \nthat members of United Nations country teams should share their country programme \ndocuments with the Resident Coordinators to confirm alignment with United Nations \nSustainable Development Cooperation Framework priorities, and requests relevant \ndevelopment system entities, in coordination with the Development Coordination \nOffice, to make the relevant United Nations Sustainable Development Cooperation \nFramework and/or its outcome matrix available to Member States and the governing \nbodies when the draft country programme document is presented for consideration, \nin accordance with relevant Executive Board processes and timelines;  \n \n86. Recalls the establishment of a clear, matrixed, dual reporting model, with \nUnited Nations country team members accountable and reporting to their respective \nentities on individual mandates, and periodically reporting to the Resident Coordinator \non their individual activities and on their respective contributions to the collective results \nof the United Nations development system towards the achievement of the 2030 Agenda \nat the country level, on the basis of the United Nations Sustainable Development \nCooperation Framework, as well as the reporting by the Resident Coordinator to the \nSecretary-General and to the host Government on the implementation of the United \nNations Sustainable Development Cooperation Framework;  \n \n87. Reiterates its request to present annual reports to the programme country \nGovernments on the results achieved by the United Nations country team as a whole, \nstructured around the United Nations Sustainable Development Cooperation \nFramework, and linked to national development results, and to make such \ncomprehensive, country-level, system-wide reports publicly available, with the \nconsent of the national Governments;  \n \n88. Calls upon the entities of the United Nations development system to \nensure that their country offices utilize the UN-Info platform in a timely and \nconsistent manner to ensure the availability of information on the work of United \nNations country teams, facilitate monitoring of the implementation of United Nations \nSustainable Development Cooperation Frameworks and improve accountability for \ndelivery to national Governments, as well as to enable reporting on the system-wide \ncontribution to achieve the Sustainable Development Goals;  \n \n89. Underscores the importance of coherence, accountability and transparency \nfor implementing reforms at the country level, and in this regard requests the \nSecretary-General and members of the United Nations Sustainable Development \nGroup to ensure full implementation of the management and accountability \nframework in all United Nations country teams;  \n\nQuadrennial comprehensive policy review of operational activities \nfor development of the United Nations system \nA/RES/79/226\n \n21/26\n24-24320 \n \n \n90. Calls upon the United Nations development system entities to complete \nthe United Nations development system reform checklist for United Nations entities\u2019 \ngoverning bodies, and invites the governing bodies to use the checklist as a tool to \nfacilitate their oversight role in support of full implementation of the relevant reform \nmandates contained in General Assembly resolution 72/279;  \n \n91. Reiterates its request to the Secretary-General to continue regular \nfollow-up, monitoring and reporting, including to the Economic and Social Council \nat its operational activities for development segment, on the work of regional assets \nof the United Nations development system in support of the 2030 Agenda with a view \nto enhancing transparency, accountability, efficiency, coordination and results-based \nmanagement at the regional level in order to ensure that the longer-term reprofiling \nand restructuring of the regional assets of the United Nations are addressed on a \nregion-by-region basis and in accordance with the region\u2019s specific needs and \npriorities, as agreed in resolution 74/297 of 11 August 2020;  \n \n92. Emphasizes the role of the General Assembly in developing key system-\nwide strategic policy orientations and operational modalities for the United Nations \ndevelopment system;  \n \n93. Reaffirms that the Economic and Social Council, including through its \noperational activities for development segment, serves as a platform to ensure and \nenhance accountability and oversight for and the acceleration of system-wide \nperformance and results in relation to the 2030 Agenda;  \n \n94. Emphasizes the importance of a more responsive and impactful operational \nactivities for development segment, and in this regard:  \n \n(a) \nRequests that all reporting be made available to Member States at least \ntwo weeks ahead of the segment;  \n \n(b) \nAlso requests that the Bureau of the Economic and Social Council, in \nconsultation with regional groups, duly consider improvements to the programme;  \n \n(c) \nEncourages making the segment more responsive and interactive, \nincluding, but not limited to, through the active participation of the executive heads \nof the United Nations Sustainable Development Group entities;  \n \n95. Welcomes the establishment of the United Nations Sustainable \nDevelopment Group System-wide Evaluation Office, re-emphasizes the need to \nensure its independence, credibility and effectiveness, and requests that the Executive \nDirector of the System-wide Evaluation Office, beginning in 2025, present the annual \nreport to the Economic and Social Council at its operational activities for \ndevelopment segment;  \n \n96. Calls upon the United Nations development system entities to abide by the \nrelevant rules of procedure and working methods and to continue playing their part \nin enhancing system-wide coherence, coordination, harmonization, efficiency, \ntransparency and impact for development, reduce duplication and build synergies, as \nappropriate and in accordance with decisions of their respective governing bodies \nand, where appropriate, guidance from the United Nations Sustainable Development \nGroup, and further requests these entities to align their policies, guidelines and \nregulations with the United Nations development system reforms;  \n \n97. Reiterates its request to the United Nations Sustainable Development \nGroup to conduct regular briefings with Member States on its activities;  \n \n98. Requests the Chair of the United Nations Sustainable Development Group \nto continue to present to the Economic and Social Council at its operational activities \nfor development segment a timely, comprehensive, evidence-based, analytical and \n\nA/RES/79/226 \nQuadrennial comprehensive policy review of operational activities \nfor development of the United Nations system\n \n24-24320\n22/26 \n \ndetailed performance report on an annual basis, including information on progress \nmade and remaining challenges and obstacles encountered, as well as on the \noperational, administrative and financial aspects of the activities of the Development \nCoordination Office, while noting that the Office assumes managerial and oversight \nfunctions of the resident coordinator system under the leadership of an Assistant \nSecretary-General and with collective ownership of the United Nations Sustainable \nDevelopment Group;  \n \nV \nFunctioning of the United Nations development system \n \n \n99. Reaffirms the need to move towards integrated action in response to the \nintegrated and indivisible nature of the 2030 Agenda for Sustainable Development, \nwhile stressing the importance of strengthening national ownership and leadership by \nbuilding on existing efforts to operate as a system within and among countries and at \nthe regional and global levels, as well as enhancing the coordination, coherence, \neffectiveness and efficiency of operational activities for development, to address the \nneeds and priorities of programme countries and in line with their respective national \nplans and strategies;  \n \n100. Reiterates the importance of empowered, strategic, effective and impartial \nleadership through the resident coordinator system to foster coordination and \ncollaboration at the country level and facilitate integrated support to host \nGovernments, in consultation with them, calls upon all entities of the United Nations \ndevelopment system to fully support the reinvigorated resident coordinator system, \nin particular by complying with the management and accountability framework and \nensuring that their operational activities for development at the country level are \naligned with and supportive of the strategic objectives as laid out in the United \nNations Sustainable Development Cooperation Frameworks, and further calls upon \ntheir governing bodies to reinforce within the respective entities the need for \ncontinued cooperation with the Resident Coordinators;  \n \n101. Calls upon the entities of the United Nations development system to \nactively continue to support the Doha Programme of Action for the Least Developed \nCountries at the national, subregional, regional and global levels, in close cooperation \nand partnership with the World Bank and the international financial institutions, and \nto integrate the Doha Programme of Action into their strategic plans and annual work \nprogrammes, and also calls upon the entities of the United Nations development \nsystem to support the Resident Coordinators in the least developed countries and to \nassist them in the mainstreaming of the Doha Programme of Action into development \nplanning at the country level in a coordinated and cohesive manner;  \n \n102. Emphasizes the need to continue to reduce the burden on the entities of the \nUnited Nations development system by promoting more efficient and streamlined \nprocesses by seeking to harmonize donor requirements, in line with the funding \ncompact;  \n \n103. Requests the Secretary-General to fill all Resident Coordinator vacancies \nin a timely and efficient manner, and to avoid undue delay as much as possible, and, \nadditionally, to keep an updated and rolling pool of possible Resident Coordinator \ncandidates with a sound development background paired with diverse and relevant \nexpertise and skill sets in other relevant areas, and also requests the Secretary-General \nto continue to take measures to ensure geographical representation among the \nResident Coordinators, with a view to improving representation of developing \ncountries, and ensure gender balance;  \n \n104. Urges the United Nations development system to align its staff capacities \nto support the implementation of the 2030 Agenda for Sustainable Development, \n\nQuadrennial comprehensive policy review of operational activities \nfor development of the United Nations system \nA/RES/79/226\n \n23/26\n24-24320 \n \nincluding by building transformative and empowered leadership, repositioning staff \ncapacities to respond to the cross-sectoral requirements of the 2030 Agenda, \npromoting inter-agency mobility and facilitating a mobile and flexible global \nworkforce;  \n \n105. Stresses the need to ensure that the Resident Coordinators have sufficient \nleadership, prerogative, impartiality, management tools, experience and skill sets, and \nthat they receive the necessary comprehensive training in an ongoing manner to \neffectively carry out their mandate and exercise their role as the highest-ranking \nrepresentative of the United Nations development system at the country level;  \n \n106. Reiterates its request to the Development Coordination Office to duly \ninform the Governments of programme countries in a timely manner when the tenure \nof the Resident Coordinator is coming to an end, as well as about the selection process \nfor the new Resident Coordinator, which should be done in consultation with, and \ntaking into account the general profile desired by, the host Government in the \nselection process, and in the case of multi-country offices, Governments of countries \nserviced by these offices;  \n \n107. Reaffirms that the reinvigorated role of Resident Coordinators entails \ndedicated, independent, impartial and empowered coordination, as outlined in \nresolution 72/279, and that the focus of the resident coordinator system should remain \nsustainable development, with the eradication of poverty in all its forms and \ndimensions as its overarching objective, consistent with the integrated nature of the \n2030 Agenda and in line with the United Nations Sustainable Development \nCooperation Framework, and with national leadership and ownership;  \n \n108. Urges the resident coordinator system to continue supporting programme \ncountries\u2019 development efforts, including to achieve the 2030 Agenda for Sustainable \nDevelopment, by improving the efficiency, effectiveness and transparency of \noperational activities for development at the country level through the promotion of \nstrategic support for national plans and priorities, enhancing sustainable development \nresults, thus making operations more coherent and efficient, coordinated and \nintegrated, and reducing costs at the country level;  \n \n109. Reiterates its request to United Nations country teams under the leadership \nof the Resident Coordinator to strengthen joint programming, integrated policy \nadvice, as appropriate, and the use of joint programmes at the country level to more \neffectively support the delivery of the United Nations Sustainable Development \nCooperation Framework;  \n \n110. Encourages the United Nations development system to consider options \nfor improving the efficiencies of coordination and reporting processes at the country \nteam level;  \n \n111. Calls upon the entities of the United Nations development system to \nengage in country team configuration discussions facilitated by the Resident \nCoordinators and finalized through open and inclusive dialogue between the host \nGovernment and the United Nations development system, to support the \nimplementation of the United Nations Sustainable Development Cooperation \nFramework by ensuring that their presence at the country level is tailored to meet the \nspecific challenges, priorities and needs of programme countries and that the \nnecessary skills, capacities and expertise are available, and requests that efforts be \ntaken to ensure that this expertise is accessible whether or not an entity has presence \nin a country;  \n \n112. Calls upon the Resident Coordinators in countries experiencing \nhumanitarian emergencies, when the onset is sudden or where a humanitarian \ncoordinator has not already been designated or appointed, to work with the host \n\nA/RES/79/226 \nQuadrennial comprehensive policy review of operational activities \nfor development of the United Nations system\n \n24-24320\n24/26 \n \nGovernment and with humanitarian and development actors to provide, through a \ntransparent, \ncollaborative \nprocess, \na \njoint, \nimpartial, \ncomprehensive \nand \nmethodologically sound assessment of needs for each emergency to inform strategic \ndecisions;  \n \n113. Requests the Secretary-General to provide Resident Coordinators who also \nserve as Humanitarian Coordinators and/or Deputy Special Representatives of the \nSecretary-General with adequate training and support, to ensure that they are well \nprepared and equipped to work and support Governments in countries facing \nhumanitarian emergencies and countries in conflict and post-conflict situations;  \n \n114. Invites all relevant entities of the United Nations development system, led \nby the United Nations Office of the High Representative for the Least Developed \nCountries, Landlocked Developing Countries and Small Island Developing States, to \nextend necessary support in a coordinated manner to the least developed countries \naspiring to graduate in developing their graduation and smooth transition strategies, \nand calls upon these entities of the United Nations development system to ensure that \ngraduation-related capacity development and activities are coordinated and demand-\ndriven and to encourage an ambitious and flexible approach to help Governments to \nmitigate the impact of graduation;  \n \n115. Acknowledges the progress achieved in the revamping of the regional level \nof the United Nations development system, and recognizes the contribution of the \nregional economic commissions and the regional teams of the United Nations \ndevelopment system, and underlines the need to continue to preserve and reaffirm \nthem in addressing development challenges and to support countries and regions in \ntheir implementation of the 2030 Agenda, in line with national development policies, \nplans, priorities and needs, recognizing the specificities of each region and bearing in \nmind that there is no one size fits all;  \n \n116. Encourages strengthened collaboration within the United Nations \ndevelopment system, including the resident coordinator system, regional offices of \nthe United Nations development system and United Nations regional economic \ncommissions, including through the work of regional collaborative platforms to \nenhance the coherence and effectiveness of development activities across the \nregional, subregional and national levels, ensuring that the regional assets are fit for \npurpose in supporting countries and regions in their implementation of the 2030 \nAgenda, and that regional expertise is made available at the country level, taking into \naccount, as appropriate, the work of other regional intergovernmental bodies;  \n \n117. Notes with appreciation the implementation of the recommendations of \nthe multi-country offices reviews that aim at enhancing service delivery to countries \nserved by these offices, welcomes the update provided by the Secretary-General, and \nin this regard requests the Secretary-General to continue to regularly monitor and \nreport on the work of multi-country offices at the annual operational activities for \ndevelopment segment, with a view to considering any further adjustments necessary \nto ensure the delivery of sustainable and effective development resources and services \nto enable countries served by multi-country offices to implement the 2030 Agenda for \nSustainable Development;  \n \n118. Requests the United Nations development system to accelerate efforts to \nsimplify and harmonize programming instruments by entities, business practices, \nprocesses, common business operations and reporting, as well as leverage and utilize, \nas appropriate, digital technologies solutions in support of the United Nations \nSustainable Development Cooperation Framework, including by taking necessary \nsteps at the headquarters level, as appropriate;  \n\nQuadrennial comprehensive policy review of operational activities \nfor development of the United Nations system \nA/RES/79/226\n \n25/26\n24-24320 \n \n \n119. Reiterates that entities within the United Nations development system \nshould operate according to the principle of mutual recognition of best practices in \nterms of policies and procedures, with the aim of facilitating active collaboration \nacross agencies and reducing transaction costs for Governments and collaborating \nagencies, and takes note of the Mutual Recognition Statement of the United Nations \nSystem Chief Executives Board for Coordination;  \n \n120. Stresses the need for the United Nations development system to strengthen \nand improve the ongoing design and implementation of harmonized business \npractices, including the Business Operations Strategies, Common Back Offices, \nCommon Premises and Global Shared Services in order to optimize opportunities for \ncollaboration, maximize efficiency gains and strengthen its reporting processes on \nimpact in terms of efficiency gains resulting from these business practices, so that \nfunding freed up by such gains is redeployed to development activities, including \ncoordination;  \n \n121. Requests the United Nations development system to continue to support \nall programme countries, regardless of which modality for the delivery of assistance \nthey prefer to adopt, in accordance with their national development plans and \npriorities;  \n \n122. Stresses the need to ensure equal and fair distribution based on gender \nbalance and on as wide a geographical basis as possible, and in this regard recalls its \nresolutions 46/232 of 2 March 1992 and 51/241 of 31 July 1997, adopted without a \nvote, which contain the principles that the highest standards of efficiency, competence \nand integrity are the paramount considerations in the recruitment and performance of \ninternational civil servants and that, as a general rule, there should be no monopoly \non senior posts in the United Nations system by nationals of any State or group of \nStates;  \n \n123. Calls upon the entities of the United Nations development system to \ncontinue efforts to achieve gender balance in appointments within the United Nations \nsystem at the global, regional and country levels for positions that affect operational \nactivities for development, including appointments to Resident Coordinator and other \nhigh-level posts, with due regard to the representation of women from programme \ncountries, in particular developing countries, while keeping in mind the principle of \nequitable geographic representation;  \n \n124. Notes with concern the continued system-wide incidents of sexual \nexploitation and abuse and sexual harassment, and in this regard calls upon the \nSecretary-General, as a matter of urgency, to increase prevention and response efforts \nto address this matter, at all levels, acknowledges the efforts made by the United \nNations development system entities to, inter alia, improve the safety of their \noperations and service delivery, sufficiently resource their protection measures, \nensure that their policies and procedures deliver impact, support system-wide efforts \nand a more joined-up approach with implementing partners, and ensure that their \nworkplaces are free from discrimination and exploitation, including sexual \nexploitation and abuse, violence and sexual harassment, and urges them to accelerate \nefforts to implement the Secretary-General\u2019s zero-tolerance policy on sexual \nexploitation and abuse;  \n \nVI \nFollow-up, monitoring and reporting  \n \n \n125. Reaffirms that all entities of the United Nations development system \ncarrying out operational activities for development should continue to align their \nplanning and activities, including through their governing bodies where applicable, \n\nA/RES/79/226 \nQuadrennial comprehensive policy review of operational activities \nfor development of the United Nations system\n \n24-24320\n26/26 \n \nto take appropriate action consistent with each entity\u2019s mandate, role and expertise \nfor the full implementation of the present resolution;  \n \n126. Requests the Secretary-General to continue to strengthen the analytical \nquality of system-wide reporting on funding, performance and programme results for \nthe United Nations operational activities for development, aligned with the \nSustainable Development Goals, and in this regard calls for the publication of timely, \nreliable, verifiable and comparable system-wide and entity-level data, definitions and \nclassifications;  \n \n127. Also requests the Secretary-General to present to the Economic and Social \nCouncil a report in 2025, 2026 and 2027 on system-wide implementation of the \nprovisions of the present resolution, including an update and amendments where \nnecessary of the existing monitoring and reporting framework for the quadrennial \ncomprehensive policy review of operational activities for development with specific \nand measurable performance indicators on progress made, and on that basis invites \nthe Economic and Social Council to exchange views on lessons learned and \nchallenges and to propose to the General Assembly overall recommendations to \ncontribute to strengthening the oversight of States over the United Nations \ndevelopment system and to guide the overall progress in the full implementation of \nthe provisions of the present resolution through the annual General Assembly \nfollow-up resolution on the operational activities for development of the United \nNations system;  \n \n128. Requests the United Nations speakers at the operational activities for \ndevelopment segment to engage in a meaningful dialogue and respond to questions \nraised at the operational activities for development segment of the Economic and \nSocial Council, in order to better inform the deliberations on the annual General \nAssembly follow-up resolution on the operational activities for development of the \nUnited Nations system;  \n \n129. Requests the Secretary-General to submit to the General Assembly at its \neighty-third session, through the Economic and Social Council, a comprehensive \nanalysis of the implementation of the present resolution, including an addendum \ntaking into account the recommendations provided by the operational activities for \ndevelopment segment of the Council, as well as of the unfulfilled mandates contained \nin Assembly resolution 75/233 and in the subsequent follow-up resolutions. \n \n54th plenary meeting \n19 December 2024 \n \n",
  "paragraphs": {
    "1": "Reaffirms that the fundamental characteristics of the operational activities for development of the United Nations system should be, inter alia, their universal, voluntary and grant nature, their neutrality and their multilateralism, as well as their ability to respond to the development needs of programme countries in a flexible manner, and that the operational activities for development are carried out for the benefit of programme countries, at the request of those countries and in accordance with their own policies and priorities for development;",
    "2": "Underscores that there is no \u201cone size fits all\u201d approach to development, and reiterates the call to the United Nations development system to continue to enhance its efforts, in a flexible, transparent, accountable, timely, coherent, coordinated and integrated manner, and to continue to pursue full alignment of operational activities for development at the country level with national development plans and strategies to strengthen national ownership and leadership at all stages of the operational activities of the United Nations development system in order for the entities to respond to national development needs and priorities in accordance with their mandates, while ensuring the full involvement of all relevant stakeholders at the national level;",
    "3": "Recognizes that there are different approaches, visions, models and tools available to each country, in accordance with its national circumstances and priorities, to achieve the 2030 Agenda for Sustainable Development;20",
    "4": "Also recognizes that the strength of the United Nations development system lies in its legitimacy, at the country level, as a neutral, objective, transparent and trusted partner for all countries;",
    "5": "Stresses that national Governments have the primary responsibility for their countries\u2019 development and for coordinating, on the basis of national strategies and priorities, all types of external assistance, including that provided by multilateral organizations, in order to effectively integrate such assistance into their development processes;",
    "6": "Recognizes that national efforts should be complemented by supportive global and regional programmes, measures and policies aimed at expanding the development opportunities of all countries, supported by an enabling economic environment, including coherent and mutually supporting world trade, tax, monetary and financial systems, and enhanced global economic governance, while taking into account national conditions and ensuring respect for national ownership;",
    "7": "Reaffirms the need to continue to strengthen the United Nations development system to further enhance its coherence, efficiency, transparency and accountability, as well as its capacity to address effectively and in accordance with the purposes and principles of the Charter of the United Nations, the full range of development challenges of our time, as set out in the 2030 Agenda for Sustainable Development, and that it must continue to adapt and respond, including to proactively work to build capacity, to evolving development challenges and opportunities for development cooperation so that no one is left behind;",
    "8": "Welcomes the progress achieved to date in implementing the United Nations development system reform, as initiated by the General Assembly in its resolution 72/279, including the realization of the main elements of the reform mandates, and underscores the importance of attaining outstanding reform goals with a view to the full and timely implementation of the reform mandates at all levels, and requests the Secretary-General to provide an update in 2028 within the annual report on the implementation of the General Assembly resolution on the quadrennial comprehensive policy review of operational activities for development of the United Nations system on the progress of the United Nations development system reform;",
    "9": "Reiterates its call to the entities of the United Nations development system, within their respective mandates, to continue to mainstream the Sustainable Development Goals in their strategic planning and, where applicable, in their regional and country programme documents, their work and reporting at all levels, taking into account that the eradication of poverty in all its forms and dimensions, including extreme poverty, is the greatest global challenge and is an indispensable requirement for sustainable development and should therefore continue to be the highest priority for and overarching objective of the operational activities of the United Nations development system;",
    "10": "Recognizes that the individual entities of the United Nations development system have specific experience and expertise, derived from and in line with their mandates and strategic plans, and stresses in this regard that improvement of coordination, collaboration, efficiency and coherence at the country, regional and global levels should be undertaken in a manner that recognizes their respective mandates and roles with consideration for comparative advantages, and enhances the effective utilization of their resources and their unique expertise;",
    "11": "Reiterates the call to the United Nations development system to continue to support developing countries in their efforts to achieve internationally agreed development goals and their development objectives, and requests the system to address, within existing resources and mandates, the special challenges facing the most vulnerable countries and, in particular, African countries, least developed countries, landlocked developing countries and small island developing States, the need for special attention to countries in conflict and post-conflict situations and countries and peoples under foreign occupation, as well as the specific challenges facing the middle-income countries, in line with the Addis Ababa Action Agenda of the Third International Conference on Financing for Development 21 and the 2030 Agenda for Sustainable Development;",
    "12": "Urges the United Nations development system to continue to enhance its support for the implementation of the Doha Programme of Action for the Least Developed Countries,22 the Antigua and Barbuda Agenda for Small Island Developing States: A Renewed Declaration for Resilient Prosperity 23 and the new Programme of Action for Landlocked Developing Countries for the Decade 2024\u20132034, as well as the African Union Agenda 2063 and its second 10-year implementation plan, and the New Partnership for Africa\u2019s Development,24 all of which are integral to the 2030 Agenda for Sustainable Development, and calls upon the entities of the United Nations development system to integrate and mainstream them fully into their operational activities for development;",
    "13": "Emphasizes that realizing gender equality and the empowerment of women and girls will make a crucial contribution to progress across all the Goals and targets of the 2030 Agenda, and reiterates the calls upon all entities of the United Nations development system to continue to promote gender equality and the empowerment of all women and girls by enhancing and accelerating gender mainstreaming through the full implementation of the System-wide Action Plan on Gender Equality and the Empowerment of Women, developed under the leadership of the United Nations Entity for Gender Equality and the Empowerment of Women (UN-Women), as well as the United Nations country team performance indicators for gender equality and the empowerment of women (the UNCT SWAP \u201cscorecard\u201d) in particular with regard to gender-responsive performance management and strategic planning, and to enhance the collection, availability and use of sex-disaggregated data, reporting and resource tracking, and drawing on available gender expertise in the system at all levels, including in UN-Women, to assist in mainstreaming gender equality in the preparation of the United Nations Sustainable Development Cooperation Framework, through a gender equality outcome, where appropriate and relevant in the country context and ensuring that gender equality expertise is available throughout the United Nations development system at all levels;",
    "14": "Recognizes that, in line with the 2030 Agenda for Sustainable Development, people who are vulnerable must be empowered, further recognizes that those whose needs are reflected in the Agenda include all children, youth, persons with disabilities, people living with HIV/AIDS, older persons, Indigenous Peoples, refugees and internally displaced persons and migrants, and calls upon the United Nations development system to continue to have a particular focus on the poorest, most vulnerable and those furthest behind;",
    "15": "Requests the entities of the United Nations development system, within their respective mandates and where applicable, to consider using the multidimensional vulnerability index, including the vulnerability-resilience country profiles, in their relevant programmes of work and reporting, focusing on the countries interested in its use, as a complement to existing measures, in line with General Assembly resolution 78/322;",
    "16": "Requests the United Nations development system to support, as appropriate and within existing mandates, the independent high-level expert group on measures that complement and go beyond gross domestic product, to be established by the Secretary-General, and subsequently the United Nations-led intergovernmental process on measures that complement and go beyond gross domestic product;",
    "17": "Calls upon the United Nations development system entities as well as United Nations country teams, within their respective mandates, to continue to work collaboratively to accelerate the full and effective mainstreaming of disability inclusion into the United Nations system, including by mobilizing and budgeting resources, and implementing and providing measurable reporting on the United Nations Disability Inclusion Strategy across its programmes and operations, and stressing the need for country-level support and capacity-development efforts aimed at empowering and learning from persons with disabilities and their representative organizations, by selecting senior disability inclusion focal points from existing staff within the United Nations development system entities;",
    "18": "",
    "19": "Recognizes the positive role that sustainable development can play in mitigating drivers of conflicts, disaster risks, humanitarian crises and complex emergencies, and also recognizes that a comprehensive whole-of-system response, including greater cooperation, coherence, coordination and complementarity among development, disaster risk reduction, humanitarian action and sustaining peace, is fundamental to most efficiently and effectively addressing needs and attaining the Sustainable Development Goals;",
    "20": "Underscores the importance of results-based management, within and across entities and at all levels of the United Nations development system, as an essential element of accountability that can, inter alia, contribute to the achievement of the Sustainable Development Goals and targets, and requests the United Nations development system and its individual entities to continue to strengthen results-based management, focusing on long-term development outcomes, developing common methodologies for planning and reporting on results, including on agency-specific activities, and on inter-agency and joint activities, improving integrated results and resources frameworks, where appropriate, and enhancing a results-oriented culture in the entities of the United Nations development system;",
    "21": "Notes the importance of the contribution of the United Nations development system with the aim of supporting government efforts to achieve the Sustainable Development Goals, leaving no one behind, based on full respect for human rights, including the right to development, and stresses in this regard that all human rights are universal, indivisible, interdependent and interrelated; II Contribution of United Nations operational activities for development",
    "22": "Reiterates the call to the United Nations development system to continue to support countries, upon their request, in the acceleration of the implementation, follow-up and review of the 2030 Agenda for Sustainable Development, especially in the decade of action and delivery for sustainable development, including by focusing on addressing the gaps and challenges, including those identified by voluntary national reviews, bearing in mind that the Sustainable Development Goals and targets are integrated and indivisible, global in nature and universally applicable, taking into account the different national realities, capacities and levels of development and respecting national policies and priorities, and in this regard urges the United Nations development system: (a) To continue to allocate resources to realize the development objectives of developing countries, and to support the endeavour to reach the furthest behind first, while taking into account the universal and inclusive nature of the 2030 Agenda for Sustainable Development; (b) To ensure a coherent, balanced and integrated approach within the system towards its support to the implementation of the Sustainable Development Goals and targets, including their interconnections and cross-cutting elements, in accordance with each entity\u2019s mandate and bearing in mind their comparative advantages, taking into account new and evolving development challenges and the need to build on lessons learned, address gaps, avoid duplication and overlap and strengthen the inter-agency approach in this regard;",
    "23": " focus on actions, results, coherence, progress and impact in the field, as called for in the 2030 Agenda for Sustainable Development, under the guidance of and in close consultation with their respective governing bodies, taking into account, inter alia, lessons learned from their midterm reviews, the outcome of the present resolution, and the efforts of the United Nations development system to address the needs, priorities and challenges of programme countries;",
    "24": "Also calls upon the entities of the United Nations development system to continue to provide evidence-based and integrated policy advice and programmatic support to help countries in the implementation of, follow-up to and reporting on the 2030 Agenda for Sustainable Development, particularly by mainstreaming the Sustainable Development Goals into national plans, including by promoting sustained and inclusive economic growth, social development and environmental protection, and ending poverty in all its forms and dimensions, and requests, in this regard, the United Nations country teams, under the leadership and coordination of the Resident Coordinators, to contribute their expertise, tools and platforms in line with their respective mandates and strategic plans and as agreed in the United Nations Sustainable Development Cooperation Frameworks25 in consultation and coordination with national Governments;",
    "25": "Recognizes that eradicating poverty in all its forms and dimensions, including extreme poverty, is the greatest global challenge and an indispensable requirement for sustainable development, as set out in the 2030 Agenda, notes with concern the rise in global poverty, which disproportionately impacts women and girls, and requests the United Nations development system to strengthen actions to accelerate progress on eradicating poverty;",
    "26": "Requests the entities of the United Nations development system to enhance coordination to support the efforts on the eradication of poverty in all its forms and dimensions through integrated, coordinated and coherent strategies at all levels, in accordance with the outcomes of the major United Nations conferences and summits in the economic, social and related fields;",
    "27": "Requests the United Nations development system to strengthen actions to accelerate progress on ending hunger and malnutrition in all its forms, and to contribute in a coherent manner to achieving food security and building inclusive, resilient and sustainable agrifood systems;",
    "28": "Also requests the United Nations development system to strengthen actions to accelerate progress on Sustainable Development Goal 6 in programme countries, upon request, in line with national priorities, needs and plans, acknowledging that water and sanitation are critical for sustainable development and the eradication of poverty;",
    "29": "Emphasizes the essential role of inclusive and sustainable industrial development as part of a comprehensive strategy of structural economic transformation in eradicating poverty and supporting sustained economic growth and thus contributing to sustainable development in developing countries, and invites the relevant entities of the United Nations development system to support efforts in this regard in line with the 2030 Agenda and the Sustainable Development Goals;",
    "30": "Recognizes that, in a demographically diverse world, population dynamics, including differences in the pace of population growth or decline, changing population age structures, urbanization and international migration, will continue to shape the world for present and future generations, and requests the United Nations development system to support Member States, upon their request and in line with national priorities, taking into account the needs of women and children, in their response to demographic trends and realities, such as rapid population growth, declining birth rates and ageing populations, as well as in addressing the interlinkages between population issues and development across all regions, including by helping to build capacity and strengthen statistical systems in programme countries;",
    "31": "Requests the United Nations development system to continue to support programme countries in developing and implementing nationally appropriate social protection systems and measures for all, including social protection floors, and by 2030 to achieve substantial coverage of the poor and the vulnerable, and takes note with appreciation of the Global Accelerator on Jobs and Social Protection for Just Transitions;",
    "32": "Calls upon the entities of the United Nations development system to promote partnerships to achieve universal health coverage, which includes primary healthcare, ensure affordable and equitable access for developing countries to health products and technologies and promote other health measures necessary to deal with future health-related challenges and countermeasures needed to respond to pandemics and other health emergencies, including through financing, health systems strengthening, building capacity, technology transfer on mutually agreed terms and know-how for local and regional manufacturing and production of medical countermeasures, including medicines, vaccines, therapeutics, diagnostics, health technologies and other health products in developing countries;",
    "33": "Recognizes the United Nations contribution to the promotion of all human rights for sustainable development, and calls upon all entities of the United Nations development system, in accordance with their respective mandates, to assist Governments, upon their request and in consultation with them, in their efforts to respect and fulfil their human rights obligations and commitments under international law, as a critical tool to operationalize the pledge to leave no one behind;",
    "34": "Calls upon the entities of the United Nations development system to support programme countries that are parties to the Paris Agreement in their implementation of the Agreement, as appropriate and in accordance with their national development policies, plans, priorities and needs, in particular their nationally determined contributions and national adaptation plans, as well as the decisions of the Conference of the Parties to the United Nations Framework Convention on Climate Change and the Conference of the Parties serving as the Meeting of the Parties to the Paris Agreement, including all decisions adopted under the \u201cUAE Consensus\u201d;",
    "35": "Also calls upon the entities of the United Nations development system to adopt and mainstream a more climate- and environment-responsive approach into their programmes and strategic plans, where appropriate, as well as in cooperation frameworks and their policy advice to programme countries, in accordance with national development policies, plans, priorities and needs, and continue to advance a system-wide approach, implement measures and report regularly to their respective governing bodies, through existing reporting and mandates, on their efforts to reduce their climate and environmental footprint, and ensure consistency of their operations and programmes with low emissions and climate-resilient development pathways and addressing pollution, halting biodiversity loss and restoring, conserving, protecting and sustainably using the environment;",
    "36": " the 2030 Agenda and the Addis Ababa Action Agenda, including through capacity- building, integrated policy advice and programmatic support, technical assistance, high-quality, timely, reliable and disaggregated data, normative support, support to national institutions, the leveraging of partnerships and the leveraging of science, technology and innovation, in accordance with national development policies, plans, priorities and needs;",
    "37": "Underscores the importance of localization of the Sustainable Development Goals, and calls upon the entities of the United Nations development system, where appropriate at the request of national Governments, and in line with national development policies, plans and priorities, to improve their support to the building, developing and strengthening of national, subnational and local institutions and capacities, and to continue to also support locally driven development approaches and pathways in coordination with national Governments, including through tailored and integrated support and by incorporating appropriate capacity development and strengthening in programmes and projects;",
    "38": "Emphasizes the need for country-driven enhanced capacity-building for sustainable development, in this regard calls for the strengthening of cooperation in science, technology and innovation, including through promoting an open, fair, inclusive and non-discriminatory environment as well as equity, collaboration and openness in the development and dissemination of research and innovation, so that scientists, innovators and policymakers everywhere can access and contribute to the latest science and evidence, as well as through North-South, South-South and triangular, regional and international cooperation, and reiterates the importance of human resources development, including training, the exchange of experience and expertise, knowledge-sharing and technical assistance for capacity-building, which involves strengthening institutional capacities, including planning, management, monitoring and evaluation capacities, in a sustained manner;",
    "39": "Encourages the entities of the United Nations development system, within their respective mandates, to support programme countries, upon request and in line with national priorities, needs and plans, to harness digital technologies to accelerate the achievement of the Sustainable Development Goals and to close all digital divides by, inter alia, promoting universal, affordable and meaningful connectivity, scaling up digital capacity development, supporting resilient, safe, inclusive and interoperable digital public infrastructure, promoting digital public goods and information integrity and harnessing artificial intelligence, for sustainable development, while considering relevant commitments in the Global Digital Compact and recognizing the need to scale up international cooperation and financing for digital capacity development and promoting digital readiness, particularly in developing countries;",
    "40": "Calls upon the United Nations development system to encourage the safe development and deployment of new and existing technologies for the global good, sharing the benefits while managing the risks, and to ensure that the products and technologies developed are affordable, available and accessible to those most in need, including the most vulnerable;",
    "41": " of sustainable development, and in this regard recognizes that the resources of the United Nations development system, including the knowledge base and expertise of all resident and non-resident agencies, should be available for access by developing countries, and welcomes efforts of the United Nations development system to take a more coherent approach to supporting national data and statistical systems;",
    "42": "Further calls upon the United Nations development system to enhance its capacities in supporting programme countries to embed the needs and interests of future generations and long-term thinking in policymaking processes by fostering cooperation and facilitating greater use of anticipatory planning and foresight, based on science, data and statistics;",
    "43": "Reaffirms the central role of Governments in contributing to the work of the United Nations development system, while recognizing that authorities at the subnational level, such as local and regional authorities, where appropriate, development partners and relevant stakeholders, international financial institutions, civil society and the private sector can positively support national development efforts and contribute to the achievement of the Sustainable Development Goals, and requests the United Nations development system to continue supporting programme countries to leverage robust partnerships, in accordance with national development policies, plans, priorities and needs, with a view to achieving the scale and pace of progress needed to realize the Goals by 2030;",
    "44": "Reiterates that the entities of the United Nations development system should enhance its support to South-South and triangular cooperation, at the request and with the ownership and leadership of developing countries, through a system- wide approach, bearing in mind their respective mandates and comparative advantages, taking into account that South-South cooperation is a complement to, rather than a substitute for, North-South cooperation, in line with the Nairobi26 and Buenos Aires27 outcome documents of the High-level United Nations Conferences on South-South Cooperation, held in 2009 and 2019, respectively;",
    "45": "Calls upon the United Nations development system entities to further integrate, as appropriate, South-South and triangular cooperation into their strategic frameworks and planning instruments, and urges them to allocate sufficient financial resources dedicated to supporting and facilitating South-South and triangular cooperation;",
    "46": "Also calls upon the entities of the United Nations development system to leverage their comparative advantages, in full compliance with their respective mandates, to continue to enhance cooperation, collaboration and coordination with humanitarian assistance and peacebuilding efforts at the national level in countries facing humanitarian emergencies, including complex emergencies, and in countries in conflict and post-conflict situations, including through agency-specific actions and inter-agency collaboration at the country level, in order to foster greater self-reliance and resilience and promote development, in accordance with national plans, needs and priorities, and in this regard: (a) Re-emphasizes that in countries facing humanitarian emergencies, there is a need to work collaboratively to move beyond short-term assistance towards contributing to longer-term development gains, including by engaging, where possible, in joint risk analysis, coherent and complementary planning, learning and knowledge exchange, needs assessments, practice response and a coherent multi-year time frame, with the aim of reducing need, vulnerability and risk over time, in compliance with international law, and in line with General Assembly resolution of 19 December 1991 and the annex thereto and all subsequent General Assembly resolutions on the subject, including its resolution 78/119 of 8 December 2023, fully respecting humanitarian principles in the provision of humanitarian assistance, and in accordance with national plans and priorities, stressing that this should not adversely affect resources for development; (b) Also re-emphasizes that development is a central goal in itself and that in countries in conflict and post-conflict situations the development work of the entities of the United Nations development system can contribute to peacebuilding and sustaining peace, in accordance with national plans, needs and priorities and respecting national ownership, and stresses in this regard the need to improve inter-agency coordination and synergy, including through the comprehensive review of the United Nations peacebuilding architecture, with the aim to maximize the sustainable impacts, results and effectiveness of support for the implementation of the 2030 Agenda for Sustainable Development, stressing that this should not adversely affect resources for development; (c) Requests the Joint Steering Committee to Advance Humanitarian and Development Collaboration to conduct briefings with Member States on its work at least twice a year;",
    "47": "Calls upon the United Nations development system, including United Nations country teams under the leadership of Resident Coordinators, within their respective mandates, to assist programme countries, upon their request and in line with their national policies and priorities for development, in addressing the development needs of internally displaced persons and to find durable solutions for them;",
    "48": "Recognizes progress made in mainstreaming disaster risk reduction into the United Nations development system\u2019s integrated policy and operational support to Governments, and requests relevant entities of the United Nations development system, in consultation with host Governments and in line with national policies, priorities and needs, to elaborate on disaster risk reduction in the common country analysis and in United Nations planning and programming documents, including the United Nations Sustainable Development Cooperation Framework,28 and to understand disaster risk, strengthen disaster risk governance to manage disaster risk, invest in disaster risk reduction for resilience, and enhance disaster preparedness for effective response and to build back better in recovery, rehabilitation and reconstruction, taking note of the ongoing efforts of the Coalition for Disaster-Resilient Infrastructure, the Risk-Informed Early Action Partnership, the Early Warnings for All initiative and the Climate Risk and Early Warning Systems initiative, and encourages the United Nations development system to support programme countries in the implementation of the Sendai Framework for Disaster Risk Reduction 2015\u20132030, including multi-hazard early warning systems, taking note of the political declaration of the high-level meeting on the midterm review of the Sendai Framework for Disaster Risk Reduction 2015\u20132030 29 and the United Nations Plan of Action on Disaster Risk Reduction for Resilience: Towards a Risk-informed and Integrated Approach to Sustainable Development;",
    "49": "Calls upon the United Nations development system to improve and ensure support and assistance to programme countries, upon their request, in developing their national capacities to ensure inclusive, safe and equitable quality education, promote lifelong learning opportunities for all for sustainable development, including early childhood education and remote learning, and achieve the related targets of the Sustainable Development Goals, recognizing that education, including girls\u2019 education, is a main driver of development and contributes to the achievement of all internationally agreed development goals, including the Sustainable Development Goals, the development of human potential, the eradication of poverty and the fostering of greater understanding among peoples;",
    "50": "Encourages United Nations development system entities, in accordance with their respective mandates, to assist Governments in taking action to prevent and eliminate all forms of violence and discrimination against all women and girls, including through the strengthening of institutional mechanisms and legal frameworks, and through multisectoral and coordinated approaches, and to support Governments, upon their request, to adopt specific measures to protect the poor, women, youth and children from all forms of violence and discrimination;",
    "51": "Notes with appreciation the support provided to the least developed countries by the entities of the United Nations development system in the implementation of the Doha Programme of Action, and urges the entities of the development system to continue to mainstream the Programme of Action into their work;",
    "52": "Recognizes that small island developing States remain a special case for sustainable development, and in this regard calls upon the relevant entities of the United Nations development system to ensure the mainstreaming of the Antigua and Barbuda Agenda for Small Island Developing States and issues related to small island developing States in their work, including at the national, regional and global levels, and to continue to support small island developing States, upon their request, in addressing their particular economic, social and environmental vulnerabilities, as outlined in the Antigua and Barbuda Agenda, by strengthening technical assistance initiatives, policy guidance and programme development, in line with their respective mandates and in cooperation with relevant institutions, funds and facilities;",
    "53": "Also recognizes that Africa has special challenges and development needs, calls upon the United Nations system to strengthen the quality of its assistance, partnership and coordinated regional efforts in Africa and to align its support for the specific needs and priorities of the African region, with a special focus on, inter alia, improving data and statistics, enhancing economic transformation and diversification, harnessing the demographic dividend, strengthening quality education and health systems, leveraging new technologies for inclusive development, achieving universal access to affordable, reliable, sustainable and modern energy for all, promoting investment in climate action, financing climate change mitigation and adaptation in Africa, and the implementation of the African Union-United Nations Framework on the Implementation of Agenda 2063 and the 2030 Agenda for Sustainable Development, and in this regard invites the United Nations development system to support the second 10-year implementation plan (2024\u20132033) of the African Union Agenda 2063;",
    "54": " Cooperation Framework, developed under the coordination of the Resident Coordinators at the country level, in a coordinated and cohesive manner;",
    "55": "Calls upon the United Nations development system to continue to develop and provide tailored support to middle-income countries in a manner that addresses their specific challenges while mindful of their diversity, and recognizes that a shift from a traditional model of direct support and service provision towards a greater emphasis on accurate and multidimensional assessment of each country\u2019s specific needs and support for the leveraging of partnerships and financing is needed, also calls upon the United Nations development system to advance the elaboration of a specific inter-agency, comprehensive, system-wide response plan for middle-income countries, taking note of the mapping exercise conducted by the Secretary-General and his recommendations, that is aimed at better addressing the multidimensional nature of sustainable development and facilitating sustainable development cooperation and coordinated and inclusive support to middle-income countries, and invites the Chair of the United Nations Sustainable Development Group to consider filling leadership gaps on middle-income countries\u2019 issues within existing resources, such as through the appointment of a focal point on middle-income countries;",
    "56": "Calls upon the United Nations Sustainable Development Group to further strengthen its collaboration with international financial institutions, including multilateral development banks, to improve synergies at the regional and country levels, with a view to accelerating the implementation of the 2030 Agenda through enhanced operational effectiveness and efficiency;",
    "57": "Recognizes that volunteerism can be a powerful and cross-cutting means of implementation of the 2030 Agenda for Sustainable Development, and encourages the United Nations development system, in partnership with Member States, civil society and the private sector, to continue supporting such efforts and promoting the conducive environment for volunteerism and volunteers, in particular those from developing countries, to enhance the sustainability of development results; III Funding of operational activities for development of the United Nations system",
    "58": "Recognizes that the integrated nature of the 2030 Agenda for Sustainable Development calls for a more sustainable funding approach, and stresses the need for adequate quantity and quality of voluntary funding to continue to support the United Nations operational activities for development, as well as the need to improve funding practices to make voluntary funding more predictable, transparent, flexible, effective and efficient, less earmarked and better aligned with the national priorities and plans of programme countries, as reflected in the United Nations Sustainable Development Cooperation Framework,30 as well as with the strategic plans and mandates of United Nations funds, programmes and specialized agencies, in order to enable the United Nations development system to work at all levels in a coherent, coordinated, efficient and, where appropriate, integrated manner, reducing duplication and increasing impact;",
    "59": "Stresses that core resources are the bedrock of the United Nations operational activities for development, owing to their untied nature, and in this regard, expresses concern at the continuing and accelerated decline in the share of core contributions to the entities of the United Nations development system in recent years;",
    "60": "Acknowledges the efforts by developed countries to increase resources for development, including commitments by some developed countries to increase official development assistance, expresses concern that most countries still fall short of their respective official development assistance commitments, including the commitment by many developed countries to achieve the targets of 0.7 per cent of gross national income for official development assistance to developing countries and 0.15 to 0.20 per cent to the least developed countries, and urges those developed countries that have not yet done so to make concrete efforts in this regard in accordance with their commitments;",
    "61": "Recalls the operationalization of the Technology Bank for the Least Developed Countries, and in this regard invites Member States, as well as international organizations, foundations and the private sector, to provide voluntary financial contributions and technical assistance to ensure its full and effective implementation, and urges the United Nations system and other relevant international and regional organizations to support, in a coordinated manner, the activities of the Technology Bank, while respecting the relevant provisions of the intellectual property rights-related agreements;",
    "62": "Reiterates the call for the enhancement of accountability, transparency, efficiency and effectiveness in the funding of the United Nations operational activities for development in order to incentivize contributions by donor countries and other contributors, and calls upon United Nations funds, programmes and specialized agencies to continue to publish timely, harmonized and verifiable data on funding flows, including annual data disaggregated by the level of earmarking in line with the funding compact,31 as well as to continue to enhance the visibility of contributors at all levels, including by making information available on providers of flexible global funding and the results they helped to achieve;",
    "63": "Urges the United Nations funds, programmes and specialized agencies to ensure that funds targeted at and budgeted for development programmatic activities are not diverted to unnecessary overhead costs, to maximize funds available for development purposes;",
    "64": "Encourages the United Nations development system entities to ensure that their business models are structured in a manner that supports the accelerated, comprehensive and balanced implementation of the 2030 Agenda;",
    "65": "Welcomes the funding compact, 32 noting its voluntary nature, and encourages all Member States and entities of the United Nations development system to contribute to its full and effective implementation and to continue the dialogue, inter alia, in the respective governing bodies as well as at the country level with host Governments and development partners to jointly make progress towards compliance with their funding compact commitments to help to achieve development results on the ground, taking note of the progress made thus far in the fulfilment of the first funding compact commitments by all parties;",
    "66": "Requests donor countries and encourages other contributors to maintain and substantially increase their core contributions to the United Nations development system, in particular its funds, programmes and specialized agencies, and to contribute on a multi-year basis, in a sustained and predictable manner, in line with Member States\u2019 commitments under the funding compact, and encourages Member States to protect core contributions in case of financial constraints;",
    "67": "Notes that non-core resources represent an important contribution to the overall resource base of United Nations operational activities for development as a complement to, and not a substitute for, core resources, and that they should support and be aligned with programme priorities regulated by intergovernmental bodies and processes, and also notes that non-core resources pose their own challenges by potentially increasing transaction costs, fragmentation, unproductive competition and overlap among entities and/or providing disincentives for pursuing system-wide priorities, strategic positioning and coherence, and in this regard: (a) Urges donor countries and encourages other contributors to make non-core contributions more flexible and aligned with the United Nations Sustainable Development Cooperation Framework and strategic plans of United Nations development system entities as approved by their intergovernmental governing bodies, to preferably assign resources at the beginning of the annual planning period, preferably for multiple years, and to prioritize pooled, thematic and joint funding mechanisms at all levels, including the Joint Sustainable Development Goals Fund, and limit earmarking to activities in accordance with the national priorities and plans of programme countries; (b) Urges the entities of the United Nations development system to continue to take active steps to strengthen their accountability to Member States and build their trust by, inter alia, strengthening transparency of results and clear reporting of funding needs and expenditures, giving clear visibility to outcomes and impact achieved through core and flexible funding, in particular with regard to entities\u2019 contributions to the United Nations system-wide results, including those achieved through joint programming, and deepening the achievement of efficiencies within and across entities to increase resources for programmes instead of administrative costs;",
    "68": "Acknowledges the progress achieved by the Development Coordination Office so far, and requests it to continue to strengthen the transparency of the resident coordinator system through clear reporting on the results and impact of coordination and regular briefings to Member States on the implementation of the resident coordinator system to facilitate open dialogue on the system\u2019s performance, including at the country level, and increase efficiencies of the resident coordinator system;",
    "69": "Urges the entities of the United Nations development system to continue enhancing the transparency and accountability of inter-agency pooled funding mechanisms, including by continuing the application of the gender equality marker, as well as to continue developing well-designed pooled funds, as a complement to agency-specific funds, that reflect and support common objectives and cross-cutting issues for United Nations funds, programmes and specialized agencies, and urges the entities of the United Nations development system to enhance their participation, where appropriate, in such funding mechanisms;",
    "70": "",
    "71": "Reaffirms the principle of full cost recovery, proportionally from core and non-core resources, thereby avoiding the use of core or regular resources to subsidize activities financed by non-core or extrabudgetary resources, and reiterates its request to the United Nations development system to analyse and explore in a collaborative manner options for harmonized cost-recovery policies, based on common cost classification and cost-recovery methodologies, and invites relevant governing bodies of United Nations development system entities that have not yet done so to review evidence-based proposals for updated and more harmonized cost-recovery policies, including cost classifications, from their respective entities, and urges relevant entities of the United Nations development system, Member States and other contributors to comply with agreed cost-recovery policies;",
    "72": "Also reaffirms that an important role of international public finance, including official development assistance, is to catalyse additional resource mobilization from other sources, both public and private, as well as to assist countries in strengthening domestic enabling environments, building essential public services and unlocking additional finance through blended or pooled financing and risk mitigation, notably for infrastructure and other investments that support private sector development;",
    "73": "Urges the United Nations development system to mobilize multiple funding sources, further explore and implement innovative funding approaches to mobilize additional resources for sustainable development, and deepen partnerships with other relevant stakeholders, including with the private sector and international financial institutions, with a view to diversifying potential sources of quality funding, especially core funding, for operational activities for development, in alignment with the provisions of the present resolution and with the priorities and plans of the programme countries, and encourages in this regard the entities of the United Nations development system to share knowledge and best practices on ways to incentivize innovative funding, taking into account the experiences of other multilateral institutions, and to include this information in their regular financial reporting;",
    "74": "Recognizes the need to further support the United Nations Sustainable Development Cooperation Framework by substantially increasing joint resource mobilization and distribution for joint programmes at the country level, including through incentives for joint resource mobilization and programming, and stresses the need for efforts leading towards an integrated funding approach at the country level, where applicable, while paying due respect to different organizational mandates and modalities;",
    "75": "Expresses its serious concern at the fact that the share of expenditure for operational activities for development of the United Nations system in the least developed countries is at just 50.7 per cent of total allocations, urges the United Nations development system to continue to prioritize allocations to least developed countries, while reaffirming that the least developed countries, as the most vulnerable group of countries, need enhanced support to overcome structural challenges that they face in implementing the 2030 Agenda for Sustainable Development, and requests the United Nations development system to provide assistance to graduating countries in the formulation and implementation of their national transition strategies and to consider country-specific support for graduated countries for a fixed period of time and in a predictable manner;",
    "76": " continued imbalance between core and non-core resources by meeting the funding compact commitment of 30 per cent core resources by 2027;",
    "77": "Also emphasizes that adequate, predictable and sustainable funding of the resident coordinator system is essential for a coherent, effective, efficient and accountable response to achieve results on the ground in accordance with national needs and priorities, and takes note of the report of the Secretary-General33 in this regard;",
    "78": "Welcomes the operationalization of the online portal to reflect real-time contributions and expenditures related to the reinvigorated resident coordinator system, and notes the improvements made to the special purpose trust fund portal to better report contribution data by donor and United Nations entity in order to ensure further transparency, and in this regard continues to encourage all Member States to provide voluntary contributions to the special purpose trust fund;",
    "79": "Notes with appreciation the efforts of the Secretary-General to improve visibility of the funding status of the entire United Nations development system in order to promote further transparency, and to continue providing relevant recommendations in this regard in his report on the implementation of the present resolution; IV Governance of the United Nations operational activities for development",
    "80": "Continues to stress that the governance architecture of the United Nations development system must be more efficient, transparent, accountable and responsive to Member States and able to enhance coordination, coherence, effectiveness and efficiency of the operational activities for development within and among all levels of the United Nations development system in order to enable system-wide strategic planning, implementation, reporting and evaluation to better support the implementation of the 2030 Agenda for Sustainable Development;",
    "81": "Requests the United Nations Sustainable Development Group to review the current reporting requirements for its members on the quadrennial comprehensive policy review and related reporting on United Nations development system reform, and to make a proposal for further streamlining of the reporting requirements to reduce the burden on United Nations Sustainable Development Group members and Member States, and to, where applicable and required, submit proposed streamlining options to the relevant governing bodies;",
    "82": "Calls upon United Nations Sustainable Development Group entities to further strengthen their internal oversight mechanisms, and encourages the governing bodies of the members of the United Nations Sustainable Development Group to strengthen the execution of their governance and oversight functions, building on best practices and in close collaboration with their respective entities and other governing bodies;",
    "83": "Welcomes a revitalized, strategic, flexible and results- and action-oriented United Nations Sustainable Development Cooperation Framework, as the most important instrument for the planning and implementation of United Nations development activities in each country, in support of the implementation of the 2030 Agenda for Sustainable Development and the achievement of the Sustainable Development Goals, and the programme countries\u2019 policies, plans, priorities and needs, to be prepared and finalized in full consultation and agreement with national Governments, through the United Nations country team, under the leadership and coordination of the Resident Coordinators;",
    "84": "Reaffirms the central role and the importance of the active and full participation of national Governments in the preparation, implementation, monitoring and evaluation of the United Nations Sustainable Development Cooperation Framework, in order to enhance national ownership and achieve full alignment of operational activities with national priorities, challenges, planning and programming, and in this sense continues to encourage national Governments to consult with relevant stakeholders, including civil society and non-governmental organizations;",
    "85": "Recognizes the progress made by the reinvigorated resident coordinator system and the reconfigured United Nations country teams, requests all United Nations development system entities to strengthen their efforts to prepare and finalize their entity-specific country development programme documents, according to their entity-specific mandates, and in accordance with and aligned with the agreed priorities and outcomes of the United Nations Sustainable Development Cooperation Framework and in consultation and agreement with host Governments, underlines that members of United Nations country teams should share their country programme documents with the Resident Coordinators to confirm alignment with United Nations Sustainable Development Cooperation Framework priorities, and requests relevant development system entities, in coordination with the Development Coordination Office, to make the relevant United Nations Sustainable Development Cooperation Framework and/or its outcome matrix available to Member States and the governing bodies when the draft country programme document is presented for consideration, in accordance with relevant Executive Board processes and timelines;",
    "86": "Recalls the establishment of a clear, matrixed, dual reporting model, with United Nations country team members accountable and reporting to their respective entities on individual mandates, and periodically reporting to the Resident Coordinator on their individual activities and on their respective contributions to the collective results of the United Nations development system towards the achievement of the 2030 Agenda at the country level, on the basis of the United Nations Sustainable Development Cooperation Framework, as well as the reporting by the Resident Coordinator to the Secretary-General and to the host Government on the implementation of the United Nations Sustainable Development Cooperation Framework;",
    "87": "Reiterates its request to present annual reports to the programme country Governments on the results achieved by the United Nations country team as a whole, structured around the United Nations Sustainable Development Cooperation Framework, and linked to national development results, and to make such comprehensive, country-level, system-wide reports publicly available, with the consent of the national Governments;",
    "88": "Calls upon the entities of the United Nations development system to ensure that their country offices utilize the UN-Info platform in a timely and consistent manner to ensure the availability of information on the work of United Nations country teams, facilitate monitoring of the implementation of United Nations Sustainable Development Cooperation Frameworks and improve accountability for delivery to national Governments, as well as to enable reporting on the system-wide contribution to achieve the Sustainable Development Goals;",
    "89": "",
    "90": "Calls upon the United Nations development system entities to complete the United Nations development system reform checklist for United Nations entities\u2019 governing bodies, and invites the governing bodies to use the checklist as a tool to facilitate their oversight role in support of full implementation of the relevant reform mandates contained in General Assembly resolution 72/279;",
    "91": "Reiterates its request to the Secretary-General to continue regular follow-up, monitoring and reporting, including to the Economic and Social Council at its operational activities for development segment, on the work of regional assets of the United Nations development system in support of the 2030 Agenda with a view to enhancing transparency, accountability, efficiency, coordination and results-based management at the regional level in order to ensure that the longer-term reprofiling and restructuring of the regional assets of the United Nations are addressed on a region-by-region basis and in accordance with the region\u2019s specific needs and priorities, as agreed in resolution 74/297 of 11 August 2020;",
    "92": "Emphasizes the role of the General Assembly in developing key system- wide strategic policy orientations and operational modalities for the United Nations development system;",
    "93": "Reaffirms that the Economic and Social Council, including through its operational activities for development segment, serves as a platform to ensure and enhance accountability and oversight for and the acceleration of system-wide performance and results in relation to the 2030 Agenda;",
    "94": "Emphasizes the importance of a more responsive and impactful operational activities for development segment, and in this regard: (a) Requests that all reporting be made available to Member States at least two weeks ahead of the segment; (b) Also requests that the Bureau of the Economic and Social Council, in consultation with regional groups, duly consider improvements to the programme; (c) Encourages making the segment more responsive and interactive, including, but not limited to, through the active participation of the executive heads of the United Nations Sustainable Development Group entities;",
    "95": "Welcomes the establishment of the United Nations Sustainable Development Group System-wide Evaluation Office, re-emphasizes the need to ensure its independence, credibility and effectiveness, and requests that the Executive Director of the System-wide Evaluation Office, beginning in 2025, present the annual report to the Economic and Social Council at its operational activities for development segment;",
    "96": "Calls upon the United Nations development system entities to abide by the relevant rules of procedure and working methods and to continue playing their part in enhancing system-wide coherence, coordination, harmonization, efficiency, transparency and impact for development, reduce duplication and build synergies, as appropriate and in accordance with decisions of their respective governing bodies and, where appropriate, guidance from the United Nations Sustainable Development Group, and further requests these entities to align their policies, guidelines and regulations with the United Nations development system reforms;",
    "97": "Reiterates its request to the United Nations Sustainable Development Group to conduct regular briefings with Member States on its activities;",
    "98": " detailed performance report on an annual basis, including information on progress made and remaining challenges and obstacles encountered, as well as on the operational, administrative and financial aspects of the activities of the Development Coordination Office, while noting that the Office assumes managerial and oversight functions of the resident coordinator system under the leadership of an Assistant Secretary-General and with collective ownership of the United Nations Sustainable Development Group; V Functioning of the United Nations development system",
    "99": "Reaffirms the need to move towards integrated action in response to the integrated and indivisible nature of the 2030 Agenda for Sustainable Development, while stressing the importance of strengthening national ownership and leadership by building on existing efforts to operate as a system within and among countries and at the regional and global levels, as well as enhancing the coordination, coherence, effectiveness and efficiency of operational activities for development, to address the needs and priorities of programme countries and in line with their respective national plans and strategies;",
    "100": "Reiterates the importance of empowered, strategic, effective and impartial leadership through the resident coordinator system to foster coordination and collaboration at the country level and facilitate integrated support to host Governments, in consultation with them, calls upon all entities of the United Nations development system to fully support the reinvigorated resident coordinator system, in particular by complying with the management and accountability framework and ensuring that their operational activities for development at the country level are aligned with and supportive of the strategic objectives as laid out in the United Nations Sustainable Development Cooperation Frameworks, and further calls upon their governing bodies to reinforce within the respective entities the need for continued cooperation with the Resident Coordinators;",
    "101": "Calls upon the entities of the United Nations development system to actively continue to support the Doha Programme of Action for the Least Developed Countries at the national, subregional, regional and global levels, in close cooperation and partnership with the World Bank and the international financial institutions, and to integrate the Doha Programme of Action into their strategic plans and annual work programmes, and also calls upon the entities of the United Nations development system to support the Resident Coordinators in the least developed countries and to assist them in the mainstreaming of the Doha Programme of Action into development planning at the country level in a coordinated and cohesive manner;",
    "102": "Emphasizes the need to continue to reduce the burden on the entities of the United Nations development system by promoting more efficient and streamlined processes by seeking to harmonize donor requirements, in line with the funding compact;",
    "103": "Requests the Secretary-General to fill all Resident Coordinator vacancies in a timely and efficient manner, and to avoid undue delay as much as possible, and, additionally, to keep an updated and rolling pool of possible Resident Coordinator candidates with a sound development background paired with diverse and relevant expertise and skill sets in other relevant areas, and also requests the Secretary-General to continue to take measures to ensure geographical representation among the Resident Coordinators, with a view to improving representation of developing countries, and ensure gender balance;",
    "104": " including by building transformative and empowered leadership, repositioning staff capacities to respond to the cross-sectoral requirements of the 2030 Agenda, promoting inter-agency mobility and facilitating a mobile and flexible global workforce;",
    "105": "Stresses the need to ensure that the Resident Coordinators have sufficient leadership, prerogative, impartiality, management tools, experience and skill sets, and that they receive the necessary comprehensive training in an ongoing manner to effectively carry out their mandate and exercise their role as the highest-ranking representative of the United Nations development system at the country level;",
    "106": "Reiterates its request to the Development Coordination Office to duly inform the Governments of programme countries in a timely manner when the tenure of the Resident Coordinator is coming to an end, as well as about the selection process for the new Resident Coordinator, which should be done in consultation with, and taking into account the general profile desired by, the host Government in the selection process, and in the case of multi-country offices, Governments of countries serviced by these offices;",
    "107": "Reaffirms that the reinvigorated role of Resident Coordinators entails dedicated, independent, impartial and empowered coordination, as outlined in resolution 72/279, and that the focus of the resident coordinator system should remain sustainable development, with the eradication of poverty in all its forms and dimensions as its overarching objective, consistent with the integrated nature of the 2030 Agenda and in line with the United Nations Sustainable Development Cooperation Framework, and with national leadership and ownership;",
    "108": "Urges the resident coordinator system to continue supporting programme countries\u2019 development efforts, including to achieve the 2030 Agenda for Sustainable Development, by improving the efficiency, effectiveness and transparency of operational activities for development at the country level through the promotion of strategic support for national plans and priorities, enhancing sustainable development results, thus making operations more coherent and efficient, coordinated and integrated, and reducing costs at the country level;",
    "109": "Reiterates its request to United Nations country teams under the leadership of the Resident Coordinator to strengthen joint programming, integrated policy advice, as appropriate, and the use of joint programmes at the country level to more effectively support the delivery of the United Nations Sustainable Development Cooperation Framework;",
    "110": "Encourages the United Nations development system to consider options for improving the efficiencies of coordination and reporting processes at the country team level;",
    "111": "Calls upon the entities of the United Nations development system to engage in country team configuration discussions facilitated by the Resident Coordinators and finalized through open and inclusive dialogue between the host Government and the United Nations development system, to support the implementation of the United Nations Sustainable Development Cooperation Framework by ensuring that their presence at the country level is tailored to meet the specific challenges, priorities and needs of programme countries and that the necessary skills, capacities and expertise are available, and requests that efforts be taken to ensure that this expertise is accessible whether or not an entity has presence in a country;",
    "112": " Government and with humanitarian and development actors to provide, through a transparent, collaborative process, a joint, impartial, comprehensive and methodologically sound assessment of needs for each emergency to inform strategic decisions;",
    "113": "Requests the Secretary-General to provide Resident Coordinators who also serve as Humanitarian Coordinators and/or Deputy Special Representatives of the Secretary-General with adequate training and support, to ensure that they are well prepared and equipped to work and support Governments in countries facing humanitarian emergencies and countries in conflict and post-conflict situations;",
    "114": "Invites all relevant entities of the United Nations development system, led by the United Nations Office of the High Representative for the Least Developed Countries, Landlocked Developing Countries and Small Island Developing States, to extend necessary support in a coordinated manner to the least developed countries aspiring to graduate in developing their graduation and smooth transition strategies, and calls upon these entities of the United Nations development system to ensure that graduation-related capacity development and activities are coordinated and demand- driven and to encourage an ambitious and flexible approach to help Governments to mitigate the impact of graduation;",
    "115": "Acknowledges the progress achieved in the revamping of the regional level of the United Nations development system, and recognizes the contribution of the regional economic commissions and the regional teams of the United Nations development system, and underlines the need to continue to preserve and reaffirm them in addressing development challenges and to support countries and regions in their implementation of the 2030 Agenda, in line with national development policies, plans, priorities and needs, recognizing the specificities of each region and bearing in mind that there is no one size fits all;",
    "116": "Encourages strengthened collaboration within the United Nations development system, including the resident coordinator system, regional offices of the United Nations development system and United Nations regional economic commissions, including through the work of regional collaborative platforms to enhance the coherence and effectiveness of development activities across the regional, subregional and national levels, ensuring that the regional assets are fit for purpose in supporting countries and regions in their implementation of the 2030 Agenda, and that regional expertise is made available at the country level, taking into account, as appropriate, the work of other regional intergovernmental bodies;",
    "117": "Notes with appreciation the implementation of the recommendations of the multi-country offices reviews that aim at enhancing service delivery to countries served by these offices, welcomes the update provided by the Secretary-General, and in this regard requests the Secretary-General to continue to regularly monitor and report on the work of multi-country offices at the annual operational activities for development segment, with a view to considering any further adjustments necessary to ensure the delivery of sustainable and effective development resources and services to enable countries served by multi-country offices to implement the 2030 Agenda for Sustainable Development;",
    "118": "",
    "119": "Reiterates that entities within the United Nations development system should operate according to the principle of mutual recognition of best practices in terms of policies and procedures, with the aim of facilitating active collaboration across agencies and reducing transaction costs for Governments and collaborating agencies, and takes note of the Mutual Recognition Statement of the United Nations System Chief Executives Board for Coordination;",
    "120": "Stresses the need for the United Nations development system to strengthen and improve the ongoing design and implementation of harmonized business practices, including the Business Operations Strategies, Common Back Offices, Common Premises and Global Shared Services in order to optimize opportunities for collaboration, maximize efficiency gains and strengthen its reporting processes on impact in terms of efficiency gains resulting from these business practices, so that funding freed up by such gains is redeployed to development activities, including coordination;",
    "121": "Requests the United Nations development system to continue to support all programme countries, regardless of which modality for the delivery of assistance they prefer to adopt, in accordance with their national development plans and priorities;",
    "122": "Stresses the need to ensure equal and fair distribution based on gender balance and on as wide a geographical basis as possible, and in this regard recalls its resolutions 46/232 of 2 March 1992 and 51/241 of 31 July 1997, adopted without a vote, which contain the principles that the highest standards of efficiency, competence and integrity are the paramount considerations in the recruitment and performance of international civil servants and that, as a general rule, there should be no monopoly on senior posts in the United Nations system by nationals of any State or group of States;",
    "123": "Calls upon the entities of the United Nations development system to continue efforts to achieve gender balance in appointments within the United Nations system at the global, regional and country levels for positions that affect operational activities for development, including appointments to Resident Coordinator and other high-level posts, with due regard to the representation of women from programme countries, in particular developing countries, while keeping in mind the principle of equitable geographic representation;",
    "124": "Notes with concern the continued system-wide incidents of sexual exploitation and abuse and sexual harassment, and in this regard calls upon the Secretary-General, as a matter of urgency, to increase prevention and response efforts to address this matter, at all levels, acknowledges the efforts made by the United Nations development system entities to, inter alia, improve the safety of their operations and service delivery, sufficiently resource their protection measures, ensure that their policies and procedures deliver impact, support system-wide efforts and a more joined-up approach with implementing partners, and ensure that their workplaces are free from discrimination and exploitation, including sexual exploitation and abuse, violence and sexual harassment, and urges them to accelerate efforts to implement the Secretary-General\u2019s zero-tolerance policy on sexual exploitation and abuse; VI Follow-up, monitoring and reporting",
    "125": " to take appropriate action consistent with each entity\u2019s mandate, role and expertise for the full implementation of the present resolution;",
    "126": "Requests the Secretary-General to continue to strengthen the analytical quality of system-wide reporting on funding, performance and programme results for the United Nations operational activities for development, aligned with the Sustainable Development Goals, and in this regard calls for the publication of timely, reliable, verifiable and comparable system-wide and entity-level data, definitions and classifications;",
    "127": "Also requests the Secretary-General to present to the Economic and Social Council a report in 2025, 2026 and 2027 on system-wide implementation of the provisions of the present resolution, including an update and amendments where necessary of the existing monitoring and reporting framework for the quadrennial comprehensive policy review of operational activities for development with specific and measurable performance indicators on progress made, and on that basis invites the Economic and Social Council to exchange views on lessons learned and challenges and to propose to the General Assembly overall recommendations to contribute to strengthening the oversight of States over the United Nations development system and to guide the overall progress in the full implementation of the provisions of the present resolution through the annual General Assembly follow-up resolution on the operational activities for development of the United Nations system;",
    "128": "Requests the United Nations speakers at the operational activities for development segment to engage in a meaningful dialogue and respond to questions raised at the operational activities for development segment of the Economic and Social Council, in order to better inform the deliberations on the annual General Assembly follow-up resolution on the operational activities for development of the United Nations system;",
    "129": "Requests the Secretary-General to submit to the General Assembly at its eighty-third session, through the Economic and Social Council, a comprehensive analysis of the implementation of the present resolution, including an addendum taking into account the recommendations provided by the operational activities for development segment of the Council, as well as of the unfulfilled mandates contained in Assembly resolution 75/233 and in the subsequent follow-up resolutions."
  },
  "agenda_items": [
    "Item 23"
  ],
  "symbol_references": []
}