{
  "symbol": "A/RES/80/108",
  "filename": "A_RES_80_108.pdf",
  "title": "80/108. 2028 United Nations Conference to Support the Implementation of Sustainable Development Goal 14: Conserve and sustainably use the oceans, seas and marine resources for sustainable development",
  "text": "United Nations \nA/RES/80/108 \n \nGeneral Assembly \nDistr.: General \n9 December 2025 \n25-20234 (E) \n*2520234* \n \n \nEightieth session \nAgenda items 13 and 75 \n \nIntegrated and coordinated implementation of and follow-up \nto the outcomes of the major United Nations conferences and \nsummits in the economic, social and related fields \n \nOceans and the law of the sea \n \n \n \n \n Resolution adopted by the General Assembly \non 9 December 2025 \n \n \n[without reference to a Main Committee (A/80/L.14)] \n \n \n 80/108. 2028 United Nations Conference to Support the Implementation of \nSustainable Development Goal 14: Conserve and sustainably use \nthe oceans, seas and marine resources for sustainable development \n \n \n \nThe General Assembly, \n \nRecalling the outcome document of the United Nations Conference on \nSustainable Development, held in Rio de Janeiro, Brazil, from 20 to 22 June 2012, \nentitled \u201cThe future we want\u201d,1 \n \nReaffirming its resolution 70/1 of 25 September 2015, entitled \u201cTransforming \nour world: the 2030 Agenda for Sustainable Development\u201d, in which it adopted a \ncomprehensive, far-reaching and people-centred set of universal and transformative \nSustainable Development Goals and targets, its commitment to working tirelessly for \nthe full implementation of this Agenda by 2030, its recognition that eradicating \npoverty in all its forms and dimensions, including extreme poverty, is the greatest \nglobal challenge and an indispensable requirement for sustainable development, its \ncommitment to achieving sustainable development in its three dimensions \u2013 \neconomic, social and environmental \u2013 in a balanced and integrated manner, and to \nbuilding upon the achievements of the Millennium Development Goals and seeking \nto address their unfinished business, \n \nReaffirming also its resolutions 79/323 of 25 August 2025 on the Sevilla \nCommitment adopted at the Fourth International Conference on Financing for \nDevelopment and 69/313 of 27 July 2015 on the Addis Ababa Action Agenda of the \nThird International Conference on Financing for Development, which are integral \n_______________ \n \n1 Resolution 66/288. \n\nA/RES/80/108 \n2028 United Nations Conference to Support the Implementation of \nSustainable Development Goal 14: Conserve and sustainably use \nthe oceans, seas and marine resources for sustainable development\n \n25-20234\n2/3 \n \nparts of the 2030 Agenda for Sustainable Development, support and complement it, \nhelp to contextualize its means of implementation targets with concrete policies and \nactions and reaffirm the strong political commitment to addressing the challenge of \nfinancing and creating an enabling environment at all levels for sustainable \ndevelopment in the spirit of global partnership and solidarity, \n \nReaffirming further that the implementation of the Sustainable Development \nGoals will depend upon a revitalized and enhanced Global Partnership for Sustainable \nDevelopment, bringing together Governments, civil society, the private sector, the \nUnited Nations system and other actors, and noting in this regard the interest \nexpressed in holding future conferences or events at a high level that would \ncomplement but not duplicate existing efforts and activities to support the \nimplementation of and to maintain political momentum to achieve Sustainable \nDevelopment Goal 14,  \n \nRecognizing the central role of the General Assembly and the Economic and \nSocial Council, and the high-level political forum on sustainable development held \nunder their auspices, as well as the role of the United Nations Open-ended Informal \nConsultative Process on Oceans and the Law of the Sea and the important contribution \nof all relevant specialized agencies, funds and programmes of the United Nations in \nthe implementation of Sustainable Development Goal 14, \n \nRecalling that, pursuant to its resolutions 70/226 of 22 December 2015 and \n70/303 of 9 September 2016, the first United Nations Conference to Support the \nImplementation of Sustainable Development Goal 14: Conserve and sustainably use \nthe oceans, seas and marine resources for sustainable development was convened at \nUnited Nations Headquarters from 5 to 9 June 2017, coinciding with World Oceans \nDay, to support the implementation of Sustainable Development Goal 14, under the \ntheme \u201cOur oceans, our future: partnering for the implementation of Sustainable \nDevelopment Goal 14\u201d,  \n \nRecalling also that, pursuant to its resolution 73/292 of 9 May 2019 and decision \n75/578 of 9 September 2021, the second United Nations Conference to Support the \nImplementation of Sustainable Development Goal 14: Conserve and sustainably use \nthe oceans, seas and marine resources for sustainable development was convened in \nLisbon from 27 June to 1 July 2022, to support the implementation of Sustainable \nDevelopment Goal 14, under the theme \u201cScaling up ocean action based on science \nand innovation for the implementation of Goal 14: stocktaking, partnerships and \nsolutions\u201d, \n \nRecalling further that, pursuant to its resolutions 77/242 of 20 December 2022 \nand 78/128 of 18 December 2023, the third United Conference to Support the \nImplementation of Sustainable Development Goal 14: Conserve and sustainably use \nthe oceans, seas and marine resources for sustainable development was convened in \nNice, France, from 9 to 13 June 2025, to support the implementation of Sustainable \nDevelopment Goal 14, under the theme \u201cAccelerating action and mobilizing all actors \nto conserve and sustainably use the ocean\u201d, \n \nRecalling its resolutions 71/312 of 6 July 2017, 76/296 of 21 July 2022 and \n79/314 of 30 June 2025, in which it endorsed the declarations adopted by the first, \nsecond and third United Nations Conferences to Support the Implementation of \nSustainable Development Goal 14: Conserve and sustainably use the oceans, seas and \nmarine resources for sustainable development, entitled \u201cOur ocean, our future: call \nfor action\u201d, \u201cOur ocean, our future, our responsibility\u201d and \u201cOur ocean, our future: \nunited for urgent action\u201d, respectively, and in this regard reaffirming the important \nrole of the declarations in demonstrating the collective will to take action to conserve \n\n2028 United Nations Conference to Support the Implementation of \nSustainable Development Goal 14: Conserve and sustainably use \nthe oceans, seas and marine resources for sustainable development \nA/RES/80/108\n \n3/3\n25-20234 \n \nand sustainably use our oceans, seas and marine resources for sustainable \ndevelopment, \n \n1. \nDecides to convene the high-level 2028 United Nations Conference to \nSupport the Implementation of Sustainable Development Goal 14: Conserve and \nsustainably use the oceans, seas and marine resources for sustainable development in \nthe Republic of Korea, in June 2028, to support the implementation of Sustainable \nDevelopment Goal 14;  \n \n2. \nAlso decides that all costs relating to the Conference and its preparation \nshall be financed through extrabudgetary resources; \n \n3. \nWelcomes the generous offer by the Governments of Chile and the \nRepublic of Korea to co-host and assume the costs of the Conference; \n \n4. \nDecides to consider, before the end of the eightieth session of the General \nAssembly, the modalities of the Conference in the most efficient and effective manner \npossible; \n \n5. \nExpresses its intention to consider further opportunities to actively involve \nGovernments, civil society, the private sector, the United Nations system and other \nactors in driving progress and supporting the implementation of Sustainable \nDevelopment Goal 14. \n \n58th plenary meeting \n9 December 2025 \n \n",
  "paragraphs": {
    "1": "Decides to convene the high-level 2028 United Nations Conference to Support the Implementation of Sustainable Development Goal 14: Conserve and sustainably use the oceans, seas and marine resources for sustainable development in the Republic of Korea, in June 2028, to support the implementation of Sustainable Development Goal 14;",
    "2": "Also decides that all costs relating to the Conference and its preparation shall be financed through extrabudgetary resources;",
    "3": "Welcomes the generous offer by the Governments of Chile and the Republic of Korea to co-host and assume the costs of the Conference;",
    "4": "Decides to consider, before the end of the eightieth session of the General Assembly, the modalities of the Conference in the most efficient and effective manner possible;",
    "5": "Expresses its intention to consider further opportunities to actively involve Governments, civil society, the private sector, the United Nations system and other actors in driving progress and supporting the implementation of Sustainable Development Goal 14."
  },
  "agenda_items": [
    "Item 13"
  ],
  "symbol_references": [
    "A/80/L.14"
  ]
}