{
  "symbol": "A/RES/80/239",
  "filename": "A_RES_80_239.pdf",
  "title": "80/239. Financing of the International Residual Mechanism for Criminal Tribunals",
  "text": "United Nations \nA/RES/80/239\n \nGeneral Assembly \nDistr.: General \n31 December 2025 \n25-21256 (E) \n*2521256* \n \n \nEightieth session \nAgenda item 147 \nFinancing of the International Residual Mechanism for \nCriminal Tribunals \n \n \n \n \n Resolution adopted by the General Assembly \non 30 December 2025 \n \n \n[on the report of the Fifth Committee (A/80/568, para. 19)] \n \n \n 80/239. Financing of the International Residual Mechanism for \nCriminal Tribunals \n \n \n \nThe General Assembly, \n \nHaving considered the reports of the Secretary-General on the budget \nperformance for 2024 and the proposed budget for 2026, 1 the financial report and \naudited financial statements for the year ended 31 December 2024 and the report of \nthe Board of Auditors on the International Residual Mechanism for Criminal \nTribunals2 and the recommendations contained therein, as well as the related report \nof the Advisory Committee on Administrative and Budgetary Questions, 3 \n \nRecalling its resolution 66/240 A of 24 December 2011 on the financing of the \nInternational Residual Mechanism for Criminal Tribunals and its subsequent \nresolutions thereon, the latest of which was resolution 79/255 of 24 December 2024,  \n \n1. \nTakes note of the reports of the Secretary-General;  \n \n2. \nEndorses the conclusions and recommendations contained in the report of \nthe Advisory Committee on Administrative and Budgetary Questions;  \n \n3. \nDecides to appropriate to the special account for the International Residual \nMechanism for Criminal Tribunals a total amount of 56,126,600 United States dollars \ngross (51,268,200 dollars net) for the Mechanism for 2026, as detailed in annex I to \nthe present resolution;  \n_______________ \n \n1 A/80/412, A/80/412/Corr.1 and A/80/505. \n \n2  Official Records of the General Assembly, Eightieth Session, Supplement No. 5O \n(A/80/5/Add.15). \n \n3 A/80/570. \n\nA/RES/80/239 \nFinancing of the International Residual Mechanism for \nCriminal Tribunals\n \n25-21256\n2/3 \n \n \n4. \nAlso decides to apportion the amount of 28,063,300 dollars gross \n(25,634,100 dollars net) among Member States in accordance with the scale of \nassessments applicable to the regular budget of the United Nations for 2026; \n \n5. \nFurther decides to apportion the amount of 28,063,300 dollars gross \n(25,634,100 dollars net) among Member States in accordance with the scale of \nassessments applicable to peacekeeping operations of the United Nations for 2026; \n \n6. \nDecides that, in accordance with the provisions of its resolution 973 (X) \nof 15 December 1955, there shall be set off against the apportionment among Member \nStates, as provided for in paragraphs 4 and 5 above, their respective share in the Tax \nEqualization Fund of the estimated staff assessment income in the amount of \n4,858,400 dollars approved for the Mechanism for 2026; \n \n7. \nAlso decides, in accordance with paragraph 4 of section XIV of its resolution \n80/243 of 30 December 2025 on the financial performance report on the programme \nbudget for 2024, that there shall be a credit to Member States for their respective share \nof the credit of 8,898,000 dollars gross (9,756,600 dollars net), as reflected in the \nfinancial performance report on the budget of the International Residual Mechanism \nfor Criminal Tribunals for 20244 and detailed in annex II to the present resolution: \n \n(a) \nFor Member States that have fulfilled their financial obligations to the \nMechanism, as an offset against their assessment for 2026; \n \n(b) \nFor Member States that have not fulfilled their financial obligations to the \nMechanism, as an offset against their arrears. \n \n69th (resumed) plenary meeting \n30 December 2025 \n \nAnnex I \nFinancing for 2026 of the International Residual Mechanism for \nCriminal Tribunals \n \n \nGross \nNet of staff \nassessment \n(United States dollars) \nEstimated appropriation for 2026a \n56 234 300 \n51 375 900 \nRecommendations of the Advisory Committee on Administrative and \nBudgetary Questions  \n(107 700) \n(107 700) \nRecommendations of the Fifth Committee \n\u2013 \n\u2013 \nAppropriation for 2026 \n56 126 600 \n51 268 200 \nOf which: \n \n \nContributions apportioned to Member States in accordance with the scale of \nassessments applicable to the regular budget of the United Nations for 2026 \n28 063 300 \n25 634 100 \nContributions apportioned to Member States in accordance with the scale of \nassessments applicable to peacekeeping operations of the United Nations for 2026 \n28 063 300 \n25 634 100 \n \n \na See A/80/505. \n \n \n_______________ \n \n4 A/80/412 and A/80/412/Corr.1. \n\nFinancing of the International Residual Mechanism for \nCriminal Tribunals \nA/RES/80/239\n \n3/3\n25-21256 \n \nAnnex II \nCredits reported in the financial performance report for 2024 \n \n \nGross \nNet of staff \nassessment \n(United States dollars) \nCancellation of commitments for the year 2023, and other revenue \n(8 894 000) \n(8 894 000) \nSurplus resulting from the final expenditure for the budget for the year 2024  \n(4 000) \n(862 600) \nTotal credits reported in the financial performance report for 2024 \n8 898 000 \n9 756 600 \n \n",
  "paragraphs": {
    "1": "Takes note of the reports of the Secretary-General;",
    "2": "Endorses the conclusions and recommendations contained in the report of the Advisory Committee on Administrative and Budgetary Questions;",
    "3": "Decides to appropriate to the special account for the International Residual Mechanism for Criminal Tribunals a total amount of 56,126,600 United States dollars gross (51,268,200 dollars net) for the Mechanism for 2026, as detailed in annex I to the present resolution; _______________ 1 A/80/412, A/80/412/Corr.1 and A/80/505. 2 Official Records of the General Assembly, Eightieth Session, Supplement No. 5O (A/80/5/Add.15). 3 A/80/570. A/RES/80/239 Financing of the International Residual Mechanism for Criminal Tribunals 25-21256 2/3",
    "4": "Also decides to apportion the amount of 28,063,300 dollars gross (25,634,100 dollars net) among Member States in accordance with the scale of assessments applicable to the regular budget of the United Nations for 2026;",
    "5": "Further decides to apportion the amount of 28,063,300 dollars gross (25,634,100 dollars net) among Member States in accordance with the scale of assessments applicable to peacekeeping operations of the United Nations for 2026;",
    "6": "Decides that, in accordance with the provisions of its resolution 973 (X) of 15 December 1955, there shall be set off against the apportionment among Member States, as provided for in paragraphs 4 and 5 above, their respective share in the Tax Equalization Fund of the estimated staff assessment income in the amount of 4,858,400 dollars approved for the Mechanism for 2026;",
    "7": "Also decides, in accordance with paragraph 4 of section XIV of its resolution 80/243 of 30 December 2025 on the financial performance report on the programme budget for 2024, that there shall be a credit to Member States for their respective share of the credit of 8,898,000 dollars gross (9,756,600 dollars net), as reflected in the financial performance report on the budget of the International Residual Mechanism for Criminal Tribunals for 20244 and detailed in annex II to the present resolution: (a) For Member States that have fulfilled their financial obligations to the Mechanism, as an offset against their assessment for 2026; (b) For Member States that have not fulfilled their financial obligations to the Mechanism, as an offset against their arrears. 69th (resumed) plenary meeting 30 December 2025 Annex I Financing for 2026 of the International Residual Mechanism for Criminal Tribunals Gross Net of staff assessment (United States dollars) Estimated appropriation for 2026a 56 234 300 51 375 900 Recommendations of the Advisory Committee on Administrative and Budgetary Questions (107 700) (107 700) Recommendations of the Fifth Committee \u2013 \u2013 Appropriation for 2026 56 126 600 51 268 200 Of which: Contributions apportioned to Member States in accordance with the scale of assessments applicable to the regular budget of the United Nations for 2026 28 063 300 25 634 100 Contributions apportioned to Member States in accordance with the scale of assessments applicable to peacekeeping operations of the United Nations for 2026 28 063 300 25 634 100 a See A/80/505. _______________ 4 A/80/412 and A/80/412/Corr.1. Financing of the International Residual Mechanism for Criminal Tribunals A/RES/80/239 3/3 25-21256 Annex II Credits reported in the financial performance report for 2024 Gross Net of staff assessment (United States dollars) Cancellation of commitments for the year 2023, and other revenue (8 894 000) (8 894 000) Surplus resulting from the final expenditure for the budget for the year 2024 (4 000) (862 600) Total credits reported in the financial performance report for 2024 8 898 000 9 756 600"
  },
  "agenda_items": [
    "Item 147"
  ],
  "symbol_references": []
}