{
  "symbol": "A/RES/79/294",
  "filename": "A_RES_79_294.pdf",
  "title": "79/294. International Day of Deafblindness",
  "text": "United Nations \nA/RES/79/294 \n \nGeneral Assembly \nDistr.: General \n18 June 2025 \n25-09823 (E) \n*2509823* \n \n \nSeventy-ninth session \nAgenda item 26 (b) \nSocial development: social development, including questions \nrelating to the world social situation and to youth, ageing, \npersons with disabilities and the family \n \n \n \n \n Resolution adopted by the General Assembly \non 16 June 2025 \n \n \n[without reference to a Main Committee (A/79/L.92)] \n \n \n 79/294. International Day of Deafblindness \n \n \n \nThe General Assembly, \n \nRecalling its resolutions 53/199 of 15 December 1998 and 61/185 of \n20 December 2006 on the proclamation of international years and Economic and \nSocial Council resolution 1980/67 of 25 July 1980 on international years and \nanniversaries, particularly paragraphs 1 to 10 of the annex thereto on the agreed \ncriteria for the proclamation of international years, and paragraphs 13 and 14, in \nwhich it is stated that an international day or year should not be proclaimed before \nthe basic arrangements for its organization and financing have been made, \n \nRecalling also the Convention on the Rights of Persons with Disabilities,1 which \nadvocates that all persons with disabilities should be able to live independently and \nparticipate fully in all aspects of life, and aims to promote, protect and ensure the full \nand equal enjoyment of all human rights and fundamental freedoms by all persons \nwith disabilities and to promote respect for their inherent dignity, and by which States \nParties undertake to adopt immediate, effective and appropriate measures to raise \nawareness throughout society regarding persons with disabilities, \n \nRealizing that deafblindness is a combined vision and hearing impairment of \nsuch severity that it is hard for the impaired senses to compensate for each other, and \nis thus a distinct disability with its own specific challenges, barriers and requirements \nfor support and inclusion, different from those provided to individuals who are solely \ndeaf or blind, \n_______________ \n \n1 United Nations, Treaty Series, vol. 2515, No. 44910. \n\nA/RES/79/294 \nInternational Day of Deafblindness\n \n25-09823\n2/2 \n \n \nNoting the barriers that deafblind persons face owing to deafblindness not being \ntreated and/or recognized as a distinct disability, further leading to invisibility in \nstatistics, policies and programmes, and therefore impeding access to services, \n \nNoting also the critical importance of professional deafblind interpreters and \ninterpreter-guides in ensuring access to information, communication, services and \nfundamental rights, as well as enabling individuals with deafblindness to live \nindependently and be included in the community, \n \nAcknowledging that the red and white striped cane is used by the deafblind \ncommunity as an important tool for mobility and identification, \n \n1. \nDecides to proclaim 27 June of each year, beginning in 2025, the \nInternational Day of Deafblindness; \n \n2. \nInvites all States Members of the United Nations, members of the \nspecialized agencies and observers of the General Assembly, organizations of the \nUnited Nations system, other international and regional organizations, civil society, \nincluding non\u2011governmental organizations, academic institutions, the private sector \nand other relevant stakeholders to observe the International Day of Deafblindness \nannually in a manner that each considers most appropriate, including through \neducation and public awareness-raising activities, in order to promote the \nempowerment and inclusion of deafblind individuals in all aspects of society and raise \nawareness of deafblindness as a unique and distinct condition; \n \n3. \nEncourages Governments to consider recognizing deafblindness as a \ndistinct disability in relevant policies and programmes, in accordance with their legal \nand administrative systems; \n \n4. \nInvites the Department of Economic and Social Affairs of the Secretariat, \nin collaboration with other relevant organizations of the United Nations system, \nmindful of the provisions contained in the annex to Economic and Social Council \nresolution 1980/67, to facilitate the observance of the International Day; \n \n5. \nStresses that the cost of all activities that may arise from the \nimplementation of the present resolution should be met from voluntary contributions; \n \n6. \nRequests the Secretary-General to bring the present resolution to the \nattention of all States Members of the United Nations, members of the specialized \nagencies and observers of the General Assembly, the organizations of the United \nNations system and civil society organizations for appropriate observance of the \nInternational Day of Deafblindness. \n \n79th plenary meeting \n16 June 2025 \n \n",
  "paragraphs": {
    "1": "Decides to proclaim 27 June of each year, beginning in 2025, the International Day of Deafblindness;",
    "2": "Invites all States Members of the United Nations, members of the specialized agencies and observers of the General Assembly, organizations of the United Nations system, other international and regional organizations, civil society, including non\u2011governmental organizations, academic institutions, the private sector and other relevant stakeholders to observe the International Day of Deafblindness annually in a manner that each considers most appropriate, including through education and public awareness-raising activities, in order to promote the empowerment and inclusion of deafblind individuals in all aspects of society and raise awareness of deafblindness as a unique and distinct condition;",
    "3": "Encourages Governments to consider recognizing deafblindness as a distinct disability in relevant policies and programmes, in accordance with their legal and administrative systems;",
    "4": "Invites the Department of Economic and Social Affairs of the Secretariat, in collaboration with other relevant organizations of the United Nations system, mindful of the provisions contained in the annex to Economic and Social Council resolution 1980/67, to facilitate the observance of the International Day;",
    "5": "Stresses that the cost of all activities that may arise from the implementation of the present resolution should be met from voluntary contributions;",
    "6": "Requests the Secretary-General to bring the present resolution to the attention of all States Members of the United Nations, members of the specialized agencies and observers of the General Assembly, the organizations of the United Nations system and civil society organizations for appropriate observance of the International Day of Deafblindness."
  },
  "agenda_items": [
    "Item 26"
  ],
  "symbol_references": [
    "A/79/L.92"
  ]
}