{
  "symbol": "A/RES/78/209",
  "filename": "A_RES_78_209.pdf",
  "title": "78/209. United Nations Human Rights Training and Documentation Centre for South-West Asia and the Arab Region",
  "text": "United Nations \nA/RES/78/209\n \n \nGeneral Assembly \nDistr.: General \n22 December 2023 \n \n23-26019 (E)    090124     \n*2326019* \n \n \nSeventy-eighth session \nAgenda item 71 (b) \nPromotion and protection of human rights: human rights \nquestions, including alternative approaches for improving \nthe effective enjoyment of human rights and \nfundamental freedoms  \n \n \n \n \n Resolution adopted by the General Assembly \non 19 December 2023 \n \n \n \n \n[on the report of the Third Committee (A/78/481/Add.2, para. 139)] \n \n \n 78/209. United Nations Human Rights Training and Documentation \nCentre for South-West Asia and the Arab Region \n \n \n \nThe General Assembly, \n \nGuided by the fundamental and universal principles enshrined in the Charter of \nthe United Nations and the Universal Declaration of Human Rights, 1  \n \nRecalling the Vienna Declaration and Programme of Action of 1993, 2 which \nreiterated the need to consider the possibility of establishing regional and subregional \narrangements for the promotion and protection of human rights where they do not \nalready exist,  \n \nRecalling also its resolutions 32/127 of 16 December 1977 and 51/102 of \n12 December 1996 and all its subsequent resolutions concerning regional \narrangements for the promotion and protection of human rights,  \n \nRecalling further its resolutions 60/153 of 16 December 2005, 67/162 of \n20 December 2012, 68/241 of 27 December 2013, 69/171 of 18 December 2014, \n70/171 of 17 December 2015, 72/166 of 19 December 2017, 74/163 of 18 December \n2019 and 76/155 of 16 December 2021 on the United Nations Human Rights Training \nand Documentation Centre for South-West Asia and the Arab Region,  \n \nRecalling Commission on Human Rights resolution 1993/51 of 9 March 1993 3 \nand all its subsequent resolutions concerning regional arrangements for the promotion \nand protection of human rights,  \n__________________ \n \n1  Resolution 217 A (III). \n \n2  A/CONF.157/24 (Part I), chap. III. \n \n3  See Official Records of the Economic and Social Council, 1993, Supplement No. 3 and corrigenda \n(E/1993/23, E/1993/23/Corr.2, E/1993/23/Corr.4 and E/1993/23/Corr.5), chap. II, sect. A. \n\nA/RES/78/209 \nUnited Nations Human Rights Training and Documentation Centre \nfor South-West Asia and the Arab Region\n \n23-26019\n2/3 \n \n \nReaffirming that regional cooperation plays a fundamental role in promoting and \nprotecting human rights and should reinforce universal human rights, as contained in \ninternational human rights instruments, and their protection,  \n \nRecognizing that the Centre has made noticeable progress in the promotion of \nhuman rights and advocacy in the region and will continue to strengthen its \neffectiveness and efficiency in responding to ongoing and emerging needs and will \nenhance its capacity-building and technical assistance, including in countries in \nconflict and post-conflict countries,  \n \nRecognizing also that the work of the Centre remains relevant to the needs of \nthe region, which is demonstrated by the fact that it has been consistently solicited by \nnumerous and diverse partners to provide support and to engage in cooperation,  \n \nMindful of the vastness and the diversity of the needs in the field of human rights \nwithin South-West Asia and the Arab region, and taking into account the need for \nappropriate and sustainable funding of the Centre to fully realize its significant \nfunction and crucial role in the region,  \n \nRecognizing the unprecedented effects of the coronavirus disease (COVID-19) \npandemic, including the severe disruption to societies and economies, as well as to \nglobal travel and commerce, and the devastating impact on the livelihood of people,  \n \n1. \nWelcomes the report of the Secretary-General;4  \n \n2. \nNotes with appreciation the successful assistance that the United Nations \nHuman Rights Training and Documentation Centre for South-West Asia and the Arab \nRegion has provided through human rights capacity-building activities, technical \nassistance programmes and training programmes on human rights and media and \nhuman rights education, with an emphasis on young people, as well as support to \nnational human rights institutions and civil society organizations on several human \nrights topics, and notes that the Centre also provided capacity-building activities in \nthe areas of civil and political rights and economic, social and cultural rights, the \ncountering of hate speech and incitement to discrimination, combating gender \ndiscrimination and the prevention of violent extremism;  \n \n3. \nAlso notes with appreciation the Centre\u2019s adaptation of its methodology to \nthe challenges linked to the COVID-19 pandemic, which enabled it to continue to \nimplement its annual workplan, through the organization of a large number of online \nactivities and by bringing together participants from the majority of countries covered \nby its mandate;  \n \n4. \nWelcomes the Centre\u2019s efforts to reinforce the documentation component \nof its mandate, notably the production and dissemination of human rights resource \nmaterials in Arabic and other languages that resulted in expanding its outreach to a \ngrowing number of beneficiaries, including women and young people;  \n \n5. \nAlso welcomes the Centre\u2019s plan, for the coming two years, to strengthen \nits efforts to accommodate the needs of the 25 States under its coverage by developing \nthe human rights education programme, with more emphasis on the youth sector, in \nline with the fourth phase (2020\u20132024) of the World Programme for Human Rights \nEducation, and to further develop its training programmes for State institutions, \nnational human rights institutions and civil society organizations, as well as \nknowledge management and documentation activities, and notes its call for additional \nvoluntary resources in order to be able to do so;  \n \n6. \nFurther welcomes the work undertaken by the Office of the United Nations \nHigh Commissioner for Human Rights to enhance the Centre\u2019s ability to carry out its \n__________________ \n \n4  A/78/518. \n\nUnited Nations Human Rights Training and Documentation Centre \nfor South-West Asia and the Arab Region \nA/RES/78/209\n \n3/3\n23-26019 \n \nmandate and respond to the growing needs from the region by further developing it \ninto a centre for excellence in the area of human rights education and training, \nknowledge management and documentation for all relevant stakeholders in the \nregion;  \n \n7. \nUnderlines the Centre\u2019s role as a source for regional expertise and the need \nto meet an increasing number of requests in relation to human rights education and \ntraining, knowledge management and documentation, including in Arabic and other \nlanguages;  \n \n8. \nNotes that the increasing demand that has been placed on the Centre by \nMember States and other stakeholders reveals a growing recognition of its role in and \nimpact on strengthening human rights capacities in the region;  \n \n9. \nEncourages the continued engagement of the Centre to work with other \nUnited Nations regional offices to strengthen its work;  \n \n10. Encourages Member States to provide voluntary contributions to support \nthe Centre in carrying out its mandate;  \n \n11. \nRequests the Secretary-General to submit to the General Assembly at its \neightieth session a report, in accordance with existing rules and procedures, on the \nimplementation of the present resolution. \n \n50th plenary meeting \n19 December 2023 \n \n \n",
  "paragraphs": {
    "1": "Welcomes the report of the Secretary-General;4",
    "2": "Notes with appreciation the successful assistance that the United Nations Human Rights Training and Documentation Centre for South-West Asia and the Arab Region has provided through human rights capacity-building activities, technical assistance programmes and training programmes on human rights and media and human rights education, with an emphasis on young people, as well as support to national human rights institutions and civil society organizations on several human rights topics, and notes that the Centre also provided capacity-building activities in the areas of civil and political rights and economic, social and cultural rights, the countering of hate speech and incitement to discrimination, combating gender discrimination and the prevention of violent extremism;",
    "3": "Also notes with appreciation the Centre\u2019s adaptation of its methodology to the challenges linked to the COVID-19 pandemic, which enabled it to continue to implement its annual workplan, through the organization of a large number of online activities and by bringing together participants from the majority of countries covered by its mandate;",
    "4": "Welcomes the Centre\u2019s efforts to reinforce the documentation component of its mandate, notably the production and dissemination of human rights resource materials in Arabic and other languages that resulted in expanding its outreach to a growing number of beneficiaries, including women and young people;",
    "5": "Also welcomes the Centre\u2019s plan, for the coming two years, to strengthen its efforts to accommodate the needs of the 25 States under its coverage by developing the human rights education programme, with more emphasis on the youth sector, in line with the fourth phase (2020\u20132024) of the World Programme for Human Rights Education, and to further develop its training programmes for State institutions, national human rights institutions and civil society organizations, as well as knowledge management and documentation activities, and notes its call for additional voluntary resources in order to be able to do so;",
    "6": "Further welcomes the work undertaken by the Office of the United Nations High Commissioner for Human Rights to enhance the Centre\u2019s ability to carry out its mandate and respond to the growing needs from the region by further developing it into a centre for excellence in the area of human rights education and training, knowledge management and documentation for all relevant stakeholders in the region;",
    "7": "Underlines the Centre\u2019s role as a source for regional expertise and the need to meet an increasing number of requests in relation to human rights education and training, knowledge management and documentation, including in Arabic and other languages;",
    "8": "Notes that the increasing demand that has been placed on the Centre by Member States and other stakeholders reveals a growing recognition of its role in and impact on strengthening human rights capacities in the region;",
    "9": "Encourages the continued engagement of the Centre to work with other United Nations regional offices to strengthen its work;",
    "10": "Encourages Member States to provide voluntary contributions to support the Centre in carrying out its mandate;",
    "11": "Requests the Secretary-General to submit to the General Assembly at its eightieth session a report, in accordance with existing rules and procedures, on the implementation of the present resolution."
  },
  "agenda_items": [
    "Item 71"
  ],
  "symbol_references": []
}