{
  "symbol": "A/RES/78/273",
  "filename": "A_RES_78_273.pdf",
  "title": "78/273. Revised estimates relating to the Independent Institution on Missing Persons in the Syrian Arab Republic",
  "text": "United Nations \nA/RES/78/273\n \n \nGeneral Assembly \nDistr.: General \n1 May 2024 \n \n24-07846 (E)    070524 \n*2407846* \n \n \nSeventy-eighth session \nAgenda item 134 \nProgramme budget for 2024 \n \n \n \n \n Resolution adopted by the General Assembly \non 24 April 2024 \n \n \n \n \n[on the report of the Fifth Committee (A/78/662/Add.1, para. 15)] \n \n \n 78/273. Revised estimates relating to the Independent Institution on \nMissing Persons in the Syrian Arab Republic \n \n \n \nThe General Assembly, \n \nHaving considered the report of the Secretary-General1 and the related report of \nthe Advisory Committee on Administrative and Budgetary Questions,2 \n \n1. \nTakes note of the report of the Secretary-General; \n \n2. \nEndorses the conclusions and recommendations contained in the report of \nthe Advisory Committee on Administrative and Budgetary Questions, subject to the \nprovisions of the present resolution; \n \n3. \nTakes note of paragraph 10 of the report of the Advisory Committee; \n \n4. \nApproves the establishment of 28 posts (1 Assistant Secretary-General, \n1 D-1, 3 P-5, 7 P-4, 9 P-3, 4 P-2, 1 General Service (Principal level) and 2 General \nService (Other level)) for the Independent Institution on Missing Persons in the Syrian \nArab Republic, under section 24, Human rights, of the programme budget for 2024; \n \n5. \nAppropriates an additional amount of 2,991,700 United States dollars, \ncomprising 24,500 dollars under section 2, General Assembly and Economic and \nSocial Council affairs and conference management, and 2,967,200 dollars under \nsection 24, Human rights, of the programme budget for 2024; \n \n6. \nAlso appropriates an amount of 278,600 dollars under section 36, Staff \nassessment, of the programme budget for 2024, to be offset by an equivalent amount \nunder income section 1, Income from staff assessment. \n \n73rd plenary meeting \n24 April 2024 \n \n__________________ \n \n1 A/78/706. \n \n2 A/78/7/Add.43. \n",
  "paragraphs": {
    "1": "Takes note of the report of the Secretary-General;",
    "2": "Endorses the conclusions and recommendations contained in the report of the Advisory Committee on Administrative and Budgetary Questions, subject to the provisions of the present resolution;",
    "3": "Takes note of paragraph 10 of the report of the Advisory Committee;",
    "4": "Approves the establishment of 28 posts (1 Assistant Secretary-General, 1 D-1, 3 P-5, 7 P-4, 9 P-3, 4 P-2, 1 General Service (Principal level) and 2 General Service (Other level)) for the Independent Institution on Missing Persons in the Syrian Arab Republic, under section 24, Human rights, of the programme budget for 2024;",
    "5": "Appropriates an additional amount of 2,991,700 United States dollars, comprising 24,500 dollars under section 2, General Assembly and Economic and Social Council affairs and conference management, and 2,967,200 dollars under section 24, Human rights, of the programme budget for 2024;",
    "6": "Also appropriates an amount of 278,600 dollars under section 36, Staff assessment, of the programme budget for 2024, to be offset by an equivalent amount under income section 1, Income from staff assessment. 73rd plenary meeting 24 April 2024 __________________ 1 A/78/706. 2 A/78/7/Add.43."
  },
  "agenda_items": [
    "Item 134"
  ],
  "symbol_references": []
}