{
  "symbol": "A/RES/78/117",
  "filename": "A_RES_78_117.pdf",
  "title": "78/117. Observer status for the Organization of Ibero-American States for Education, Science and Culture in the General Assembly",
  "text": "United Nations \nA/RES/78/117\n \n \nGeneral Assembly \nDistr.: General \n11 December 2023 \n \n23-24913 (E)    211223     \n*2324913* \n \n \nSeventy-eighth session \nAgenda item 171 \nObserver status for the Organization of Ibero-American \nStates for Education, Science and Culture in the \nGeneral Assembly  \n \n \n \n \n Resolution adopted by the General Assembly \non 7 December 2023 \n \n \n \n \n[on the report of the Sixth Committee (A/78/457, para. 7)] \n \n \n \n78/117. Observer status for the Organization of Ibero-American States for \nEducation, Science and Culture in the General Assembly \n \n \n \nThe General Assembly, \n \nWishing to promote cooperation between the United Nations and the \nOrganization of Ibero-American States for Education, Science and Culture, \n \n1. \nDecides to invite the Organization of Ibero-American States for Education, \nScience and Culture to participate in the sessions and the work of the General \nAssembly in the capacity of observer;  \n \n2. \nRequests the Secretary-General to take the action necessary to implement \nthe present resolution. \n \n45th plenary meeting \n7 December 2023 \n \n",
  "paragraphs": {
    "1": "Decides to invite the Organization of Ibero-American States for Education, Science and Culture to participate in the sessions and the work of the General Assembly in the capacity of observer;",
    "2": "Requests the Secretary-General to take the action necessary to implement the present resolution. 45th plenary meeting 7 December 2023"
  },
  "agenda_items": [
    "Item 171"
  ],
  "symbol_references": []
}