{
  "symbol": "A/RES/74/163",
  "filename": "A_RES_74_163.pdf",
  "title": "74/163. United Nations Human Rights Training and Documentation Centre for South-West Asia and the Arab Region",
  "text": "United Nations \nA/RES/74/163\n \n \nGeneral Assembly \nDistr.: General \n16 January 2020 \n \n19-22291 (E)    200120 \n*1922291* \n \n \nSeventy-fourth session \nAgenda item 70 (b) \nPromotion and protection of human rights: human \nrights questions, including alternative approaches for \nimproving the effective enjoyment of human rights \nand fundamental freedoms \n \n \n \n \n Resolution adopted by the General Assembly \non 18 December 2019 \n \n \n \n \n[on the report of the Third Committee (A/74/399/Add.2)] \n \n \n 74/163. United Nations Human Rights Training and Documentation \nCentre for South-West Asia and the Arab Region \n \n \n \nThe General Assembly, \n \nGuided by the fundamental and universal principles enshrined in the Charter of \nthe United Nations and the Universal Declaration of Human Rights, 1  \n \nRecalling the Vienna Declaration and Programme of Action of 1993, 2 which \nreiterated the need to consider the possibility of establishing regional and subregional \narrangements for the promotion and protection of human rights where they do not \nalready exist, \n \nRecalling also its resolutions 32/127 of 16 December 1977 and 51/102 of \n12 December 1996 and all its subsequent resolutions concerning regional arrangements \nfor the promotion and protection of human rights, \n \nRecalling further its resolutions 60/153 of 16 December 2005, 67/162 of \n20 December 2012, 68/241 of 27 December 2013, 69/171 of 18 December 2014, \n70/171 of 17 December 2015 and 72/166 of 19 December 2017 on the United Nations \nHuman Rights Training and Documentation Centre for South-West Asia and the Arab \nRegion, \n \nRecalling Commission on Human Rights resolution 1993/51 of 9 March 1993 3 \nand all its subsequent resolutions concerning regional arrangements for the promotion \nand protection of human rights, \n__________________ \n \n1  Resolution 217 A (III). \n \n2  A/CONF.157/24 (Part I), chap. III. \n \n3  See Official Records of the Economic and Social Council, 1993, Supplement No. 3 and corrigenda \n(E/1993/23, E/1993/23/Corr.2, E/1993/23/Corr.4 and E/1993/23/Corr.5), chap. II, sect. A. \n\nA/RES/74/163 \nUnited Nations Human Rights Training and Documentation\nCentre for South-West Asia and the Arab Region\n \n19-22291\n2/2 \n \n \nReaffirming that regional cooperation plays a fundamental role in promoting and \nprotecting human rights and should reinforce universal human rights, as contained in \ninternational human rights instruments, and their protection, \n \nRecognizing that the Centre has made noticeable progress in the promotion of \nhuman rights and advocacy in the region and will continue to strengthen its \neffectiveness and efficiency in responding to ongoing and emerging needs and will \nenhance its capacity-building and technical assistance, in particular in countries in \nconflict and post-conflict countries, \n \nMindful of the vastness and the diversity of the needs in the field of human rights \nwithin South-West Asia and the Arab region, and taking into account the need for \nappropriate and sustainable funding of the Centre to fully realize its significant \nfunction and crucial role in the region, \n \n1. \nWelcomes the report of the Secretary-General;4  \n \n2. \nNotes with appreciation the successful assistance that the United Nations \nHuman Rights Training and Documentation Centre for South-West Asia and the Arab \nRegion has provided through human rights capacity-building activities, technical \nassistance programmes and training programmes on human rights and media and \nhuman rights education, as well as support to national human rights institutions on \nseveral human rights topics, and notes that the Centre also provided capacity-building \nactivities in the areas of civil and political rights, as well as economic, social and \ncultural rights, such as on freedoms of opinion and expression, countering hate speech \nand incitement to discrimination, and preventing violent extremism; \n \n3. \nAlso notes with appreciation the Centre\u2019s full commitment to ensuring \ngreater effectiveness and efficiency in the implementation of its mandate; \n \n4. \nWelcomes the expansion of the Centre\u2019s outreach to the League of Arab \nStates and additional countries in the region, as well as to a growing number of \nbeneficiaries, including youth; \n \n5. \nAlso welcomes the Centre\u2019s efforts to reinforce its documentation mandate \nand its production of several publications on human rights issues in Arabic; \n \n6. \nUnderlines the Centre\u2019s role as a source for regional expertise and the need \nto meet an increasing number of requests for training and documentation, including \nin Arabic; \n \n7. \nNotes that the increasing demand that has been placed on the Centre by \nMember States and other stakeholders reveals a growing recognition of its role and \nimpact on strengthening human rights capacities in the region; \n \n8. \nEncourages the continued engagement of the Centre to work with other \nUnited Nations regional offices to strengthen its work and to avoid duplication; \n \n9. \nRequests the Secretary-General to submit to the General Assembly at its \nseventy-sixth session a report, in accordance with existing rules and procedures, on \nthe implementation of the present resolution. \n \n50th plenary meeting \n18 December 2019 \n \n__________________ \n \n4  A/74/262. \n",
  "paragraphs": {
    "1": "Welcomes the report of the Secretary-General;4",
    "2": "Notes with appreciation the successful assistance that the United Nations Human Rights Training and Documentation Centre for South-West Asia and the Arab Region has provided through human rights capacity-building activities, technical assistance programmes and training programmes on human rights and media and human rights education, as well as support to national human rights institutions on several human rights topics, and notes that the Centre also provided capacity-building activities in the areas of civil and political rights, as well as economic, social and cultural rights, such as on freedoms of opinion and expression, countering hate speech and incitement to discrimination, and preventing violent extremism;",
    "3": "Also notes with appreciation the Centre\u2019s full commitment to ensuring greater effectiveness and efficiency in the implementation of its mandate;",
    "4": "Welcomes the expansion of the Centre\u2019s outreach to the League of Arab States and additional countries in the region, as well as to a growing number of beneficiaries, including youth;",
    "5": "Also welcomes the Centre\u2019s efforts to reinforce its documentation mandate and its production of several publications on human rights issues in Arabic;",
    "6": "Underlines the Centre\u2019s role as a source for regional expertise and the need to meet an increasing number of requests for training and documentation, including in Arabic;",
    "7": "Notes that the increasing demand that has been placed on the Centre by Member States and other stakeholders reveals a growing recognition of its role and impact on strengthening human rights capacities in the region;",
    "8": "Encourages the continued engagement of the Centre to work with other United Nations regional offices to strengthen its work and to avoid duplication;",
    "9": "Requests the Secretary-General to submit to the General Assembly at its seventy-sixth session a report, in accordance with existing rules and procedures, on the implementation of the present resolution. 50th plenary meeting 18 December 2019 __________________ 4 A/74/262."
  },
  "agenda_items": [
    "Item 70"
  ],
  "symbol_references": []
}