{
  "symbol": "A/RES/72/217",
  "filename": "A_RES_72_217.pdf",
  "title": "72/217. Follow-up to and implementation of the SIDS Accelerated Modalities of Action (SAMOA) Pathway and the Mauritius Strategy for the Further Implementation of the Programme of Action for the Sustainable Development of Small Island Developing States",
  "text": "United Nations \nA/RES/72/217\n \n \nGeneral Assembly \nDistr.: General \n25 January 2018 \n \n17-23286 (E)    300118     \n*1723286* \n \n \nSeventy-second session \nAgenda item 19 (b) \n \n \n \n \n Resolution adopted by the General Assembly \non 20 December 2017 \n \n \n \n \n[on the report of the Second Committee (A/72/420/Add.2)] \n \n \n 72/217. Follow-up to and implementation of the SIDS Accelerated \nModalities of Action (SAMOA) Pathway and the Mauritius \nStrategy for the Further Implementation of the Programme \nof Action for the Sustainable Development of Small Island \nDeveloping States  \n \n \n \nThe General Assembly, \n \nReaffirming the Declaration of Barbados1 and the Programme of Action for the \nSustainable Development of Small Island Developing States (Barbados Programme \nof Action),2 the Mauritius Declaration3 and the Mauritius Strategy for the Further \nImplementation of the Programme of Action for the Sustainable Development of \nSmall Island Developing States,4 the SIDS Accelerated Modalities of Action \n(SAMOA) Pathway (Samoa Pathway)5 and the Plan of Implementation of the World \nSummit on Sustainable Development (Johannesburg Plan of Implementation), 6 \nincluding chapter VII, on the sustainable development of small island developing \nStates,  \n__________________ \n \n1  Report of the Global Conference on the Sustainable Development of Small Island Developing \nStates, Bridgetown, Barbados, 25 April\u20136 May 1994 (United Nations publication, Sales \nNo. E.94.I.18 and corrigenda), chap. I, resolution 1, annex I. \n \n2  Ibid., annex II. \n \n3  Report of the International Meeting to Review the Implementation of the Programme of Action \nfor the Sustainable Development of Small Island Developing States, Port Louis, Mauritius, \n10\u221214 January 2005 (United Nations publication, Sales No. E.05.II.A.4 and corrigendum), \nchap. I, resolution 1, annex I. \n \n4  Ibid., annex II. \n \n5  Resolution 69/15, annex. \n \n6  Report of the World Summit on Sustainable Development, Johannesburg, South Africa, \n26 August\u20134 September 2002 (United Nations publication, Sales No. E.03.II.A.1 and \ncorrigendum), chap. I, resolution 2, annex. \n\nA/RES/72/217 \nFollow-up to and implementation of the SIDS Accelerated Modalities of Action (SAMOA) \nPathway and the Mauritius Strategy for the Further Implementation of the Programme\nof Action for the Sustainable Development of Small Island Developing States\n \n17-23286 \n2/8 \n \n \nReaffirming also the outcome document of the United Nations Conference on \nSustainable Development, held in Rio de Janeiro, Brazil, from 20 to 22 June 2012, \nentitled \u201cThe future we want\u201d,7 \n \nReaffirming further its resolution 70/1 of 25 September 2015, entitled \n\u201cTransforming our world: the 2030 Agenda for Sustainable Development\u201d, in which \nit adopted a comprehensive, far-reaching and people-centred set of universal and \ntransformative Sustainable Development Goals and targets, its commitment to \nworking tirelessly for the full implementation of the Agenda by 2030, its recognition \nthat eradicating poverty in all its forms and dimensions, including extreme poverty, \nis the greatest global challenge and an indispensable requirement for sustainable \ndevelopment, its commitment to achieving sustainable development in its three \ndimensions \u2014 economic, social and environmental \u2014 in a balanced and integrated \nmanner, and to building upon the achievements of the Millennium Development \nGoals and seeking to address their unfinished business,  \n \nReaffirming its resolution 69/313 of 27 July 2015 on the Addis Ababa Action \nAgenda of the Third International Conference on Financing for Development, which \nis an integral part of the 2030 Agenda for Sustainable Development, supports and \ncomplements it, helps to contextualize its means of implementation targets with \nconcrete policies and actions, and reaffirms the strong political commitment to \naddress the challenge of financing and creating an enabling environment at all levels \nfor sustainable development in the spirit of global partnership and solidarity,  \n \nRecalling the outcome documents and decisions of all United Nations \nconferences and processes related to the sustainable development priorities of small \nisland developing States, including the Sendai Framework for Disaster Risk \nReduction 2015\u20132030,8 \n \nRecalling also its resolution 71/225 of 21 December 2016 and all relevant \nprevious resolutions,9 \n \nWelcoming the New Urban Agenda, adopted at the United Nations Conference \non Housing and Sustainable Urban Development (Habitat III), held in Quito, Ecuador, \nfrom 17 to 20 October 2016,10 \n \nReaffirming its resolution 71/243 of 21 December 2016 on the quadrennial \ncomprehensive policy review of operational activities for development of the United \nNations system, in which it urged the United Nations development system to enhance \nits support for the implementation of, inter alia, the Samoa Pathway and called upon \nthe entities of the development system to integrate and mainstream it fully into their \noperational activities for development,  \n \nReaffirming also that small island developing States remain a special case for \nsustainable development, in view of their unique and particular vulnerabilities, and \nthat they remain constrained in meeting their goals in all three dimensions of \nsustainable development, and recognizing the ownership and leadership of small \nisland developing States in overcoming some of these challenges, while stressing that, \nin the absence of international cooperation, achieving success will remain difficult,  \n \nRecognizing climate change as one of the drivers of disaster risk, and \nreaffirming the importance of strengthening international cooperation in the face of \ndisasters,  \n__________________ \n \n7  Resolution 66/288, annex. \n \n8  Resolution 69/283, annex II. \n \n9  See resolutions 70/202, 69/288, 69/217 and 69/15. \n \n10  Resolution 71/256, annex. \n\nFollow-up to and implementation of the SIDS Accelerated Modalities of Action (SAMOA) \nPathway and the Mauritius Strategy for the Further Implementation of the Programme \nof Action for the Sustainable Development of Small Island Developing States \nA/RES/72/217\n \n3/8 \n17-23286 \n \n \nAcknowledging that climate change and sea level rise continue to pose a \nsignificant risk to small island developing States and their efforts to achieve \nsustainable development and, for some, represent the gravest threat to their survival \nand viability,  \n \nTaking note of the various initiatives embodying the important relationship \nbetween the ocean and climate change, including the Ocean Pathway initiative, \nlaunched on the margins of the twenty-third session of the Conference of the Parties \nto the United Nations Framework Convention on Climate Change, \n \nRecalling the call upon all stakeholders to conserve and sustainably use the \noceans, seas and marine resources for sustainable development by, inter alia, \naccelerating actions to prevent and significantly reduce marine pollution of all kinds, \nin particular from land-based activities, including marine debris, plastics and \nmicroplastics, nutrient pollution, untreated wastewater, solid waste discharges, \nhazardous substances, pollution from ships and abandoned, lost or otherwise \ndiscarded fishing gear, while at the same time recognizing that small island \ndeveloping States are among the most vulnerable to the impacts of marine pollution,  \n \nWelcoming the Paris Agreement11 and its early entry into force, encouraging all \nits parties to fully implement the Agreement, and parties to the United Nations \nFramework Convention on Climate Change12 that have not yet done so to deposit their \ninstruments of ratification, acceptance, approval or accession, where appropriate, as \nsoon as possible, \n \nReaffirming that oceans and seas, along with coastal areas, form an essential \ncomponent of the Earth\u2019s ecosystem and are intrinsically linked to sustainable \ndevelopment, and reaffirming also that healthy, productive and resilient oceans and \ncoasts are critical for, inter alia, poverty eradication, access to sufficient, safe and \nnutritious food, livelihoods, economic development and essential ecosystem services, \nincluding carbon sequestration, and represent an important element of identity and \nculture for the people of small island developing States,  \n \nRecalling its resolution 71/312 of 6 July 2017 in which it endorsed the \ndeclaration entitled \u201cOur ocean, our future: call for action\u201d adopted by the high-level \nUnited Nations Conference to Support the Implementation of Sustainable \nDevelopment Goal 14: Conserve and sustainably use the oceans, seas and marine \nresources for sustainable development, held from 5 to 9 June 2017, coinciding with \nWorld Oceans Day on 8 June, and in this regard reaffirming the important role of the \ndeclaration in demonstrating the collective will to take action to conserve and \nsustainably use our oceans, seas and marine resources for sustainable development \nand recognizing the important contributions of the partnership dialogues and \nvoluntary commitments made in the context of that Conference to the effective and \ntimely implementation of Sustainable Development Goal 14, \n \nRecognizing that health is a precondition for, and an outcome and indicator of, \nall three dimensions of sustainable development and that the Samoa Pathway calls for \npolicies and programmes to ensure better health, and recognizing also the need for \nthe prevention, detection and treatment of communicable and non-communicable \ndiseases and for quality essential health-care services, while also reducing the health-\nrelated impacts resulting from natural and man-made disasters in small island \ndeveloping States,  \n \nReaffirming the importance of the Small Island Developing States Partnership \nFramework and the progress made, including through the Steering Committee on \n__________________ \n \n11  Adopted under the UNFCCC in FCCC/CP/2015/10/Add.1, decision 1/CP.21. \n \n12  United Nations, Treaty Series, vol. 1771, No. 30822. \n\nA/RES/72/217 \nFollow-up to and implementation of the SIDS Accelerated Modalities of Action (SAMOA) \nPathway and the Mauritius Strategy for the Further Implementation of the Programme\nof Action for the Sustainable Development of Small Island Developing States\n \n17-23286 \n4/8 \n \nPartnerships for Small Island Developing States and the second annual global \nmulti-stakeholder small island developing States partnership dialogue held at United \nNations Headquarters in New York on 7 June 2017, as well as the importance and \nprogress of the Small Island Developing States Global Business Network, and the \nneed for its continued coherence with the Partnership Framework,  \n \nWelcoming the meeting of the high-level political forum on sustainable \ndevelopment on the theme \u201cEradicating poverty and promoting prosperity in a \nchanging world \u2014 taking forward the SAMOA Pathway\u201d, held in New York on 12 \nJuly 2017,  \n \nRecognizing that it is crucial to mobilize resources from all sources for the \neffective implementation of the Samoa Pathway,  \n \nRecognizing also that, in spite of the considerable efforts of small island \ndeveloping States and the mobilization of their limited resources, their progress in the \nattainment of the internationally agreed development goals, including the Millennium \nDevelopment Goals, and in implementing the Barbados Programme of Action and the \nMauritius Strategy has been uneven, that some have regressed economically and that \na number of significant challenges remain,  \n \nNoting the decline in correspondent banking relationships experienced by many \nsmall island developing States, and looking forward in this regard to the continuing \nconsideration of this issue in forthcoming reports of the Inter-Agency Task Force on \nFinancing for Development, as appropriate and in accordance with existing mandates,  \n \nRecognizing the long-standing cooperation and support provided by the \ninternational community, which has played an important role in helping small island \ndeveloping States to make progress in addressing their vulnerabilities and in \nsupporting their sustainable development efforts, and recalling paragraph 19 of the \nSamoa Pathway, which calls for strengthening this cooperation,  \n \nReaffirming the need to mainstream sustainable development at all levels, \nintegrating economic, social and environmental aspects, and recognizing their \ninterlinkages, so as to enable small island developing States to achieve sustainable \ndevelopment in all its dimensions,  \n \n1. \nTakes note of the reports of the Secretary-General on the follow-up to and \nimplementation of the SIDS Accelerated Modalities of Action (SAMOA) Pathway \nand the Mauritius Strategy for the Further Implementation of the Programme of \nAction for the Sustainable Development of Small Island Developing States; 13 \n \n2. \nReaffirms the outcome document of the third International Conference on \nSmall Island Developing States, the SIDS Accelerated Modalities of Action \n(SAMOA) Pathway,5 and urges its speedy and effective implementation, as well as \neffective monitoring, follow-up and review;  \n \n3. \nUrges the full and effective implementation of the commitments and \npartnerships announced at the Conference and the fulfilment of the provisions on all \nmeans of implementation, as contained in the Samoa Pathway;  \n \n4. \nWelcomes the continuing commitment of the international community to \ntake urgent and concrete action to address the vulnerabilities of small island \ndeveloping States and to continue to seek solutions, including additional ones, to the \nmajor challenges facing them in a concerted manner in order to support the full \nimplementation of the Samoa Pathway;  \n__________________ \n \n13  A/72/214, A/71/267, A/71/267/Add.1 and A/70/269. \n\nFollow-up to and implementation of the SIDS Accelerated Modalities of Action (SAMOA) \nPathway and the Mauritius Strategy for the Further Implementation of the Programme \nof Action for the Sustainable Development of Small Island Developing States \nA/RES/72/217\n \n5/8 \n17-23286 \n \n \n5. \nRecalls the sustainable development priorities for small island developing \nStates identified in the Samoa Pathway and set out in the 2030 Agenda for Sustainable \nDevelopment,14 as well as the outcome documents of all related United Nations \nconferences and processes, and recognizes the interlinkages between them;  \n \n6. \nAlso recalls paragraph 16 of its resolution 71/225, notes that the high-level \npolitical forum on sustainable development shall devote adequate time at its 2018 \nmeeting and at its future meetings to continuing to address the sustainable \ndevelopment challenges facing small island developing States and the follow-up to \nand implementation of the Samoa Pathway, and encourages the high-level political \nforum to devote sufficient attention to these discussions, bearing in mind that small \nisland developing States are a special case for sustainable development, as well as to \nlessons learned from the follow-up and review processes of previous conferences on \nsmall island developing States and their outcome documents;  \n \n7. \nReiterates the call, made in the declaration entitled \u201cOur ocean, our future: \ncall for action\u201d,15 for action to be taken, on an urgent basis, to conserve and \nsustainably use the oceans, seas and marine resources for sustainable development; \n \n8. \nEncourages the full implementation of the Global Action Programme on \nFood Security and Nutrition in Small Island Developing States, which was launched \nby the Food and Agriculture Organization of the United Nations on 4 July 2017;  \n \n9. \nWelcomes the many ongoing initiatives and programmes in support of the \nsustainable development priorities of small island developing States and of the \nimplementation of the Samoa Pathway, and encourages other initiatives in this regard;  \n \n10.  Acknowledges in this regard that small island developing States are \ncommitted to the implementation of the Samoa Pathway and are mobilizing resources \nat the national and regional levels to that effect, despite their limited resource base, \nand calls upon the international community to assist and support small island \ndeveloping States in the implementation of the Samoa Pathway, including by \nintegrating its provisions into their national and regional policies and development \nframeworks;  \n \n11. \nWelcomes the initial efforts undertaken by the Small Island Developing \nStates Partnership Framework to monitor and ensure full implementation of the \npledges and commitments through partnerships for small island developing States and \nto ensure that partnerships focus on the priorities of those States, identify new \nopportunities to advance their sustainable development and ensure the full \nimplementation of the Samoa Pathway, and in this regard calls upon the Department \nof Economic and Social Affairs and the Office of the High Representative for the \nLeast Developed Countries, Landlocked Developing Countries and Small Island \nDeveloping States of the Secretariat to continue to enhance the necessary analytical \nand advocacy support for the work of the Steering Committee on Partnerships for \nSmall Island Developing States, and, in particular, to ensure an annual action-\noriented, results-focused global multi-stakeholder small island developing States \npartnership dialogue;  \n \n12. Urges all partners to integrate the Samoa Pathway into their respective \ncooperation frameworks, programmes and activities, as appropriate, to ensure its \neffective follow-up and implementation;  \n \n13. Urges entities of the United Nations system to mainstream, within the \nrealm of their mandates, the Samoa Pathway into their respective strategic plans and \nframeworks, and encourages all relevant stakeholders to make available sufficient and \n__________________ \n \n14  Resolution 70/1. \n \n15  Resolution 71/312, annex. \n\nA/RES/72/217 \nFollow-up to and implementation of the SIDS Accelerated Modalities of Action (SAMOA) \nPathway and the Mauritius Strategy for the Further Implementation of the Programme\nof Action for the Sustainable Development of Small Island Developing States\n \n17-23286 \n6/8 \n \npredictable resources for the effective and accelerated implementation of the Samoa \nPathway;  \n \n14. Calls upon the United Nations system, international and regional financial \ninstitutions and other multilateral development partners to continue to support small \nisland developing States in their efforts to implement national sustainable \ndevelopment strategies and programmes by incorporating the priorities and activities \nof small island developing States into their relevant strategic and programmatic \nframeworks, including through the United Nations Development Assistance \nFramework process, at both the national and regional levels, in line with their \nmandates and overall priorities;  \n \n15. Encourages the United Nations system to support the efforts of small \nisland developing States to strengthen their cooperation on building resilience and on \nenhancing action with regard to adaptation to climate change;  \n \n16. Underlines the need to give due consideration to the issues and concerns \nof small island developing States in all relevant major United Nations conferences \nand processes;  \n \n17. Recalls the need to fully mainstream a gender perspective into all United \nNations summits, conferences and special sessions and their follow-up processes;  \n \n18. Takes note of the report of the Joint Inspection Unit entitled \n\u201cComprehensive review of United Nations system support for small island developing \nStates: final findings\u201d, prepared pursuant to General Assembly resolution 69/288 of \n8 June 2015;16  \n \n19. Underscores the important role of the Small Island Developing States Unit \nof the Department of Economic and Social Affairs and the Office of the High \nRepresentative in supporting small island developing States, in accordance with their \nrespective mandates, including those under the Samoa Pathway and other \nintergovernmentally agreed documents and resolutions, and urges their improved \ncoordination and collaboration;  \n \n20. Notes the initial findings of the Joint Inspection Unit that resources have \nnot increased over a period during which the mandates of the Small Island Developing \nStates Unit and the Office of the High Representative have significantly expanded, \nand in this regard requests the Secretary-General to submit to the General Assembly, \nat its seventy-third session, on an exceptional basis, without setting a precedent and \nwithin existing resources, a transparent and clearly substantiated needs assessment \nresulting from the evolving mandates of the relevant programmes and subprogrammes \nof the Secretariat and to ensure the allocation of the resources required to adequately \nrespond to the mandates in support of the sustainable development agenda of the small \nisland developing States;  \n \n21. Welcomes the efforts undertaken by the Department of Economic and \nSocial Affairs and the Office of the High Representative to support the sustainable \ndevelopment agenda of the small island developing States through the Inter-Agency \nConsultative Group on Small Island Developing States, and takes note of the terms \nof reference adopted at its recent meeting to enhance coherence and effective \ncoordination between United Nations agencies and relevant stakeholders and improve \ncommunication and consultation with Member States;  \n \n22. Recommends that the United Nations system continue to work towards \nensuring that the activities in support of sustainable development of small island \ndeveloping States, within the mandate of each entity, are aligned with the priorities \n__________________ \n \n16  See A/72/119 and A/72/119/Add.1. \n\nFollow-up to and implementation of the SIDS Accelerated Modalities of Action (SAMOA) \nPathway and the Mauritius Strategy for the Further Implementation of the Programme \nof Action for the Sustainable Development of Small Island Developing States \nA/RES/72/217\n \n7/8 \n17-23286 \n \nof those States to foster the implementation of the Samoa Pathway and the 2030 \nAgenda;  \n \n23. Recalls paragraph 11 of its resolution 70/299 of 29 July 2016, and urges \nthe United Nations system to take effective measures to reduce the reporting burden \non small island developing States through coherent, coordinated and effective \nlinkages between the follow-up and review arrangements for the Samoa Pathway, the \n2030 Agenda and other intergovernmentally agreed outcomes;  \n \n24. Urges the international community to support small island developing \nStates in strengthening the capacity of national statistical offices and data systems to \nensure access to high-quality, timely, reliable and disaggregated data, in line with \nprovisions of the Samoa Pathway and the 2030 Agenda, as appropriate to national \ncontexts, with a view to supporting the implementation, follow-up and review of the \nSamoa Pathway and the 2030 Agenda;  \n \n25. Urges United Nations system entities to coordinate the planning and \nimplementation of their capacity-building activities in close consultation with the \nsmall island developing States and all development partners so as to strengthen \neffectiveness and efficiency in providing support to achieve the Samoa Pathway and \nthe 2030 Agenda, while avoiding saturation of the absorptive capacity of small island \ndeveloping States at the country level;  \n \n26. Requests United Nations system entities, including the international \nfinancial institutions, to actively contribute, within their respective mandates, to \naddressing the unique and particular vulnerabilities of small island developing States, \nincluding through a more holistic approach for concessional financing so as to enable \nbetter access to financing for development for small island developing States;  \n \n27. Reaffirms its decision to convene a one-day high-level review, at United \nNations Headquarters in September 2019, to review progress made in addressing the \npriorities of small island developing States through the implementation of the Samoa \nPathway, which will result in a concise, action-oriented and intergovernmentally \nagreed political declaration, and decides to consider further the modalities of the \nreview before the end of its seventy-second session;  \n \n28. Decides to convene, in 2018, regional preparatory meetings of small island \ndeveloping States in their respective regions, as well as an interregional meeting for \nall small island developing States, in order to undertake a review of progress in the \nimplementation of the Samoa Pathway at the national and regional levels, and also \ndecides that, for this purpose, the Department of Economic and Social Affairs, \nthrough its Small Island Developing States Unit, the Office of the High \nRepresentative and the relevant agencies of the United Nations system, including the \nregional commissions, within their respective mandates and existing resources, \nshould organize, facilitate and provide necessary support to the review process at the \nnational, regional and international levels;  \n \n29. Reiterates the critical importance of the full and effective participation of \nthe small island developing States in the high-level review process, and in this regard \ninvites Governments, intergovernmental and non-governmental organizations and \nother relevant stakeholders and donors to contribute to the voluntary trust fund for \nthe purpose of assisting small island developing States in participating fully and \neffectively in the high-level review and the various preparatory processes;  \n \n30. Requests the Secretary-General to submit to the General Assembly, at its \nseventy-third session, a report on the follow-up to and implementation of the Samoa \nPathway, including progress made and continuing challenges faced, and the \nimplementation of the present resolution and, in preparing that report, to consult with \nMember States as well as the relevant United Nations funds and programmes, the \n\nA/RES/72/217 \nFollow-up to and implementation of the SIDS Accelerated Modalities of Action (SAMOA) \nPathway and the Mauritius Strategy for the Further Implementation of the Programme\nof Action for the Sustainable Development of Small Island Developing States\n \n17-23286 \n8/8 \n \nspecialized agencies and regional commissions, as appropriate, taking into account \nthe work carried out by the entities of the United Nations system, as well as all \nrelevant national, regional and subregional organizations, with a view to taking stock \nand analysing progress, and to include a section summarizing actions taken and \nplanned to strengthen the coordination and complementarity of the work of the \nDepartment of Economic and Social Affairs and the Office of the High Representative \nin support of the sustainable development of small island developing States;  \n \n31. Decides to include in the provisional agenda of its seventy-third session, \nunder the item entitled \u201cSustainable development\u201d, the sub-item entitled \u201cFollow-up \nto and implementation of the SIDS Accelerated Modalities of Action (SAMOA) \nPathway and the Mauritius Strategy for the Further Implementation of the Programme \nof Action for the Sustainable Development of Small Island Developing States\u201d, unless \notherwise agreed. \n \n74th plenary meeting  \n20 December 2017 \n \n",
  "paragraphs": {
    "1": "Takes note of the reports of the Secretary-General on the follow-up to and implementation of the SIDS Accelerated Modalities of Action (SAMOA) Pathway and the Mauritius Strategy for the Further Implementation of the Programme of Action for the Sustainable Development of Small Island Developing States; 13",
    "2": "Reaffirms the outcome document of the third International Conference on Small Island Developing States, the SIDS Accelerated Modalities of Action (SAMOA) Pathway,5 and urges its speedy and effective implementation, as well as effective monitoring, follow-up and review;",
    "3": "Urges the full and effective implementation of the commitments and partnerships announced at the Conference and the fulfilment of the provisions on all means of implementation, as contained in the Samoa Pathway;",
    "4": "Welcomes the continuing commitment of the international community to take urgent and concrete action to address the vulnerabilities of small island developing States and to continue to seek solutions, including additional ones, to the major challenges facing them in a concerted manner in order to support the full implementation of the Samoa Pathway; __________________ 13 A/72/214, A/71/267, A/71/267/Add.1 and A/70/269. Follow-up to and implementation of the SIDS Accelerated Modalities of Action (SAMOA) Pathway and the Mauritius Strategy for the Further Implementation of the Programme of Action for the Sustainable Development of Small Island Developing States A/RES/72/217 5/8 17-23286",
    "5": "Recalls the sustainable development priorities for small island developing States identified in the Samoa Pathway and set out in the 2030 Agenda for Sustainable Development,14 as well as the outcome documents of all related United Nations conferences and processes, and recognizes the interlinkages between them;",
    "6": "Also recalls paragraph 16 of its resolution 71/225, notes that the high-level political forum on sustainable development shall devote adequate time at its 2018 meeting and at its future meetings to continuing to address the sustainable development challenges facing small island developing States and the follow-up to and implementation of the Samoa Pathway, and encourages the high-level political forum to devote sufficient attention to these discussions, bearing in mind that small island developing States are a special case for sustainable development, as well as to lessons learned from the follow-up and review processes of previous conferences on small island developing States and their outcome documents;",
    "7": "Reiterates the call, made in the declaration entitled \u201cOur ocean, our future: call for action\u201d,15 for action to be taken, on an urgent basis, to conserve and sustainably use the oceans, seas and marine resources for sustainable development;",
    "8": "Encourages the full implementation of the Global Action Programme on Food Security and Nutrition in Small Island Developing States, which was launched by the Food and Agriculture Organization of the United Nations on 4 July 2017;",
    "9": "Welcomes the many ongoing initiatives and programmes in support of the sustainable development priorities of small island developing States and of the implementation of the Samoa Pathway, and encourages other initiatives in this regard;",
    "10": "Acknowledges in this regard that small island developing States are committed to the implementation of the Samoa Pathway and are mobilizing resources at the national and regional levels to that effect, despite their limited resource base, and calls upon the international community to assist and support small island developing States in the implementation of the Samoa Pathway, including by integrating its provisions into their national and regional policies and development frameworks;",
    "11": "Welcomes the initial efforts undertaken by the Small Island Developing States Partnership Framework to monitor and ensure full implementation of the pledges and commitments through partnerships for small island developing States and to ensure that partnerships focus on the priorities of those States, identify new opportunities to advance their sustainable development and ensure the full implementation of the Samoa Pathway, and in this regard calls upon the Department of Economic and Social Affairs and the Office of the High Representative for the Least Developed Countries, Landlocked Developing Countries and Small Island Developing States of the Secretariat to continue to enhance the necessary analytical and advocacy support for the work of the Steering Committee on Partnerships for Small Island Developing States, and, in particular, to ensure an annual action- oriented, results-focused global multi-stakeholder small island developing States partnership dialogue;",
    "12": "Urges all partners to integrate the Samoa Pathway into their respective cooperation frameworks, programmes and activities, as appropriate, to ensure its effective follow-up and implementation;",
    "13": "Urges entities of the United Nations system to mainstream, within the realm of their mandates, the Samoa Pathway into their respective strategic plans and frameworks, and encourages all relevant stakeholders to make available sufficient and __________________ 14 Resolution 70/1. 15 Resolution 71/312, annex. A/RES/72/217 Follow-up to and implementation of the SIDS Accelerated Modalities of Action (SAMOA) Pathway and the Mauritius Strategy for the Further Implementation of the Programme of Action for the Sustainable Development of Small Island Developing States 17-23286 6/8 predictable resources for the effective and accelerated implementation of the Samoa Pathway;",
    "14": "Calls upon the United Nations system, international and regional financial institutions and other multilateral development partners to continue to support small island developing States in their efforts to implement national sustainable development strategies and programmes by incorporating the priorities and activities of small island developing States into their relevant strategic and programmatic frameworks, including through the United Nations Development Assistance Framework process, at both the national and regional levels, in line with their mandates and overall priorities;",
    "15": "Encourages the United Nations system to support the efforts of small island developing States to strengthen their cooperation on building resilience and on enhancing action with regard to adaptation to climate change;",
    "16": "Underlines the need to give due consideration to the issues and concerns of small island developing States in all relevant major United Nations conferences and processes;",
    "17": "Recalls the need to fully mainstream a gender perspective into all United Nations summits, conferences and special sessions and their follow-up processes;",
    "18": "Takes note of the report of the Joint Inspection Unit entitled \u201cComprehensive review of United Nations system support for small island developing States: final findings\u201d, prepared pursuant to General Assembly resolution 69/288 of 8 June 2015;16",
    "19": "Underscores the important role of the Small Island Developing States Unit of the Department of Economic and Social Affairs and the Office of the High Representative in supporting small island developing States, in accordance with their respective mandates, including those under the Samoa Pathway and other intergovernmentally agreed documents and resolutions, and urges their improved coordination and collaboration;",
    "20": "Notes the initial findings of the Joint Inspection Unit that resources have not increased over a period during which the mandates of the Small Island Developing States Unit and the Office of the High Representative have significantly expanded, and in this regard requests the Secretary-General to submit to the General Assembly, at its seventy-third session, on an exceptional basis, without setting a precedent and within existing resources, a transparent and clearly substantiated needs assessment resulting from the evolving mandates of the relevant programmes and subprogrammes of the Secretariat and to ensure the allocation of the resources required to adequately respond to the mandates in support of the sustainable development agenda of the small island developing States;",
    "21": "Welcomes the efforts undertaken by the Department of Economic and Social Affairs and the Office of the High Representative to support the sustainable development agenda of the small island developing States through the Inter-Agency Consultative Group on Small Island Developing States, and takes note of the terms of reference adopted at its recent meeting to enhance coherence and effective coordination between United Nations agencies and relevant stakeholders and improve communication and consultation with Member States;",
    "22": "Recommends that the United Nations system continue to work towards ensuring that the activities in support of sustainable development of small island developing States, within the mandate of each entity, are aligned with the priorities __________________ 16 See A/72/119 and A/72/119/Add.1. Follow-up to and implementation of the SIDS Accelerated Modalities of Action (SAMOA) Pathway and the Mauritius Strategy for the Further Implementation of the Programme of Action for the Sustainable Development of Small Island Developing States A/RES/72/217 7/8 17-23286 of those States to foster the implementation of the Samoa Pathway and the 2030 Agenda;",
    "23": "Recalls paragraph 11 of its resolution 70/299 of 29 July 2016, and urges the United Nations system to take effective measures to reduce the reporting burden on small island developing States through coherent, coordinated and effective linkages between the follow-up and review arrangements for the Samoa Pathway, the 2030 Agenda and other intergovernmentally agreed outcomes;",
    "24": "Urges the international community to support small island developing States in strengthening the capacity of national statistical offices and data systems to ensure access to high-quality, timely, reliable and disaggregated data, in line with provisions of the Samoa Pathway and the 2030 Agenda, as appropriate to national contexts, with a view to supporting the implementation, follow-up and review of the Samoa Pathway and the 2030 Agenda;",
    "25": "Urges United Nations system entities to coordinate the planning and implementation of their capacity-building activities in close consultation with the small island developing States and all development partners so as to strengthen effectiveness and efficiency in providing support to achieve the Samoa Pathway and the 2030 Agenda, while avoiding saturation of the absorptive capacity of small island developing States at the country level;",
    "26": "Requests United Nations system entities, including the international financial institutions, to actively contribute, within their respective mandates, to addressing the unique and particular vulnerabilities of small island developing States, including through a more holistic approach for concessional financing so as to enable better access to financing for development for small island developing States;",
    "27": "Reaffirms its decision to convene a one-day high-level review, at United Nations Headquarters in September 2019, to review progress made in addressing the priorities of small island developing States through the implementation of the Samoa Pathway, which will result in a concise, action-oriented and intergovernmentally agreed political declaration, and decides to consider further the modalities of the review before the end of its seventy-second session;",
    "28": "Decides to convene, in 2018, regional preparatory meetings of small island developing States in their respective regions, as well as an interregional meeting for all small island developing States, in order to undertake a review of progress in the implementation of the Samoa Pathway at the national and regional levels, and also decides that, for this purpose, the Department of Economic and Social Affairs, through its Small Island Developing States Unit, the Office of the High Representative and the relevant agencies of the United Nations system, including the regional commissions, within their respective mandates and existing resources, should organize, facilitate and provide necessary support to the review process at the national, regional and international levels;",
    "29": "Reiterates the critical importance of the full and effective participation of the small island developing States in the high-level review process, and in this regard invites Governments, intergovernmental and non-governmental organizations and other relevant stakeholders and donors to contribute to the voluntary trust fund for the purpose of assisting small island developing States in participating fully and effectively in the high-level review and the various preparatory processes;",
    "30": "Requests the Secretary-General to submit to the General Assembly, at its seventy-third session, a report on the follow-up to and implementation of the Samoa Pathway, including progress made and continuing challenges faced, and the implementation of the present resolution and, in preparing that report, to consult with Member States as well as the relevant United Nations funds and programmes, the A/RES/72/217 Follow-up to and implementation of the SIDS Accelerated Modalities of Action (SAMOA) Pathway and the Mauritius Strategy for the Further Implementation of the Programme of Action for the Sustainable Development of Small Island Developing States 17-23286 8/8 specialized agencies and regional commissions, as appropriate, taking into account the work carried out by the entities of the United Nations system, as well as all relevant national, regional and subregional organizations, with a view to taking stock and analysing progress, and to include a section summarizing actions taken and planned to strengthen the coordination and complementarity of the work of the Department of Economic and Social Affairs and the Office of the High Representative in support of the sustainable development of small island developing States;",
    "31": "Decides to include in the provisional agenda of its seventy-third session, under the item entitled \u201cSustainable development\u201d, the sub-item entitled \u201cFollow-up to and implementation of the SIDS Accelerated Modalities of Action (SAMOA) Pathway and the Mauritius Strategy for the Further Implementation of the Programme of Action for the Sustainable Development of Small Island Developing States\u201d, unless otherwise agreed. 74th plenary meeting 20 December 2017"
  },
  "agenda_items": [
    "Item 19"
  ],
  "symbol_references": []
}