{
  "symbol": "A/RES/72/229",
  "filename": "A_RES_72_229.pdf",
  "title": "72/229. Culture and sustainable development",
  "text": "United Nations \nA/RES/72/229\n \n \nGeneral Assembly \nDistr.: General \n19 January 2018 \n \n17-23306 (E)    240118 \n*1723306* \n \n \nSeventy-second session \nAgenda item 21 (c) \n \n \n \n \n Resolution adopted by the General Assembly \non 20 December 2017 \n \n \n \n \n[on the report of the Second Committee (A/72/422/Add.3)] \n \n \n 72/229. Culture and sustainable development \n \n \n \nThe General Assembly,  \n \nGuided by the purposes and principles enshrined in the Charter of the United \nNations,  \n \nRecalling its resolutions 41/187 of 8 December 1986, 46/158 of 19 December \n1991, 51/179 of 16 December 1996, 52/197 of 18 December 1997, 53/184 of \n15 December 1998, 55/192 of 20 December 2000, 57/249 of 20 December 2002, \n65/166 of 20 December 2010 and 66/208 of 22 December 2011 concerning culture \nand development, 66/288 of 27 July 2012, entitled \u201cThe future we want\u201d, and 68/223 \nof 20 December 2013, 69/230 of 19 December 2014 and 70/214 of 22 December 2015 \non culture and sustainable development,  \n \nReaffirming its resolution 70/1 of 25 September 2015, entitled \u201cTransforming \nour world: the 2030 Agenda for Sustainable Development\u201d, in which it adopted a \ncomprehensive, far-reaching and people-centred set of universal and transformative \nSustainable Development Goals and targets, its commitment to working tirelessly for \nthe full implementation of the Agenda by 2030, its recognition that eradicating \npoverty in all its forms and dimensions, including extreme poverty, is the greatest \nglobal challenge and an indispensable requirement for sustainable development, its \ncommitment to achieving sustainable development in its three dimensions \u2014 \neconomic, social and environmental \u2014 in a balanced and integrated manner, and to \nbuilding upon the achievements of the Millennium Development Goals and seeking \nto address their unfinished business,  \n \nWelcoming the New Urban Agenda, adopted at the United Nations Conference \non Housing and Sustainable Urban Development (Habitat III), held in Quito, Ecuador, \nfrom 17 to 20 October 2016,1  \n__________________ \n \n1  Resolution 71/256, annex.  \n\nA/RES/72/229 \nCulture and sustainable development\n \n17-23306 \n2/7 \n \n \nWelcoming also the Paris Agreement2 and its early entry into force, encouraging \nall its parties to fully implement the Agreement, and parties to the United Nations \nFramework Convention on Climate Change3 that have not yet done so to deposit their \ninstruments of ratification, acceptance, approval or accession, where appropriate, as \nsoon as possible,  \n \nReaffirming its resolution 69/313 of 27 July 2015 on the Addis Ababa Action \nAgenda of the Third International Conference on Financing for Development, which \nis an integral part of the 2030 Agenda for Sustainable Development, supports and \ncomplements it, helps to contextualize its means of implementation targets with \nconcrete policies and actions, and reaffirms the strong political commitment to \naddress the challenge of financing and creating an enabling environment at all levels \nfor sustainable development in the spirit of global partnership and solidarity,  \n \nRecalling that, in the 2030 Agenda for Sustainable Development, inter alia, the \nnatural and cultural diversity of the world is acknowledged and it is recognized that \ncultures and civilizations can contribute to, and are crucial enablers of, sustainable \ndevelopment,  \n \nRecalling also the 2005 Convention on the Protection and Promotion of the \nDiversity of Cultural Expressions,4 as well as other international conventions of the \nUnited Nations Educational, Scientific and Cultural Organization that acknowledge \ncultural diversity and economic and social development,5  \n \nRecognizing that culture is an essential component of human development, that \nit represents a source of identity, innovation and creativity for the individual and the \ncommunity and that it is an important factor in social inclusion and poverty \neradication, providing for sustainable economic growth and ownership of \ndevelopment processes,  \n \nRecognizing also the importance of respect and understanding for cultural \ndiversity throughout the world and of working together and not against each other \nand of fostering intercultural understanding and dialogue, mutual listening and \nlearning and an ethic of global citizenship and solidarity,  \n \nRecalling its resolution 70/76 of 9 December 2015 on the return or restitution \nof cultural property to the countries of origin, aware of the importance attached to the \nreturn of cultural property that is of fundamental spiritual, historical and cultural \nvalue, and expressing deep concern about the continuing illicit traffic in cultural \nproperty and its damage to the cultural heritage of nations,  \n \nRecalling also the principles of the Universal Declaration on Cultural Diversity \nof the United Nations Educational, Scientific and Cultural Organization, 6 and \nacknowledging that cultural diversity is a source of enrichment for humankind and an \nimportant contribution to the sustainable development of local communities, peoples \n__________________ \n \n2  Adopted under the UNFCCC in FCCC/CP/2015/10/Add.1, decision 1/CP.21.  \n \n3  United Nations, Treaty Series, vol. 1771, No. 30822.  \n \n4  Ibid., vol. 2440, No. 43977.  \n \n5  Convention for the Protection of Cultural Property in the Event of Armed Conflict, of 1954 \n(United Nations, Treaty Series, vol. 249, No. 3511); Convention on the Means of Prohibiting and \nPreventing the Illicit Import, Export and Transfer of Ownership of Cultural Property, of 1970 \n(United Nations, Treaty Series, vol. 823, No. 11806); Convention concerning the Protection of \nthe World Cultural and Natural Heritage, of 1972 (United Nations, Treaty Series, vol. 1037, \nNo. 15511); Convention on the Protection of the Underwater Cultural Heritage, of 2001 (United \nNations, Treaty Series, vol. 2562, No. 45694); and Convention for the Safeguarding of the \nIntangible Cultural Heritage, of 2003 (United Nations, Treaty Series, vol. 2368, No. 42671). \n \n6  United Nations Educational, Scientific and Cultural Organization, Records of the General \nConference, Thirty-first Session, Paris, 15 October\u20133 November 2001, vol. 1 and corrigendum, \nResolutions, sect. V, resolution 25, annex I.  \n\nCulture and sustainable development \nA/RES/72/229\n \n3/7 \n17-23306 \n \nand nations, empowering them to play an active and unique role in development \ninitiatives,  \n \nRecognizing the importance of multilingualism as a means of promoting, \nprotecting and preserving the diversity of languages and cultures globally and that \ngenuine multilingualism promotes unity in diversity and international understanding, \nand recognizing also the importance for the peoples of the world to communicate in \ntheir own language,  \n \nRecalling the concerns expressed in the Beijing Declaration and Platform for \nAction7 on the underrepresentation of women in decision-making positions in the area \nof culture, which has prevented women from having a significant impact in the area \nof culture and development,  \n \nRecalling also the importance of the promotion of national cultures, artistic \ncreation in all its forms and international and regional cultural cooperation, and \nreaffirming in this regard the relevance of strengthening national efforts and regional \nand international cooperation mechanisms for cultural action and artistic creation and \nrecognizing respect for cultural pluralism, as defined by the Universal Declaration on \nCultural Diversity, as policies for the inclusion and participation of all citizens that \nguarantee social cohesion and the vitality of civil society and peace, enhance cultural \ndevelopment and contribute to sustainable development,  \n \nRecognizing the linkages between cultural and biological diversity and the \npositive contribution of local and indigenous traditional knowledge in addressing \nenvironmental challenges in a sustainable manner,  \n \nRecalling the United Nations strategic plan for forests 2017\u20132030,8 and \nacknowledging that, in many regions, forests have important cultural and spiritual \nvalue,  \n \nTaking note of the declaration adopted in Florence, Italy, on 4 October 2014, at \nthe third United Nations Educational, Scientific and Cultural Organization World \nForum on Culture and Cultural Industries, the Hangzhou outcomes, adopted at the \nconference on  the theme \u201cCulture for sustainable cities\u201d, held in Hangzhou, China, \nfrom 10 to 12 December 2015, the Bali Declaration, adopted at the second World \nCulture Forum, held in Bali, Indonesia, from 10 to 14 October 2016, the global report \non culture for sustainable urban development of the United Nations Educational, \nScientific and Cultural Organization, entitled Culture: Urban Future, of October \n2016, which placed culture at the heart of an integrated, place-based and innovative \napproach to working towards inclusive, people-centred and culturally sensitive urban \ndevelopment, and the new strategy for the integration of culture and creativity in the \nimplementation of the 2030 Agenda for Sustainable Development, adopted at the \neleventh annual meeting of the Creative Cities Network, held in Enghien-les-Bains, \nFrance, from 30 June to 2 July 2017,  \n \nReiterating the pledge that no one will be left behind, reaffirming the \nrecognition that the dignity of the human person is fundamental, and the wish to see \nthe Goals and targets met for all nations and peoples and for all segments of society, \nand recommitting to endeavour to reach the furthest behind first,  \n \nRecommitting to ensuring that no country or person is left behind and to focusing \nour effort where the challenges are greatest, including by ensuring the inclusion and \nparticipation of those who are furthest behind,  \n__________________ \n \n7  Report of the Fourth World Conference on Women, Beijing, 4\u201315 September 1995 (United \nNations publication, Sales No. E.96.IV.13), chap. I, resolution 1, annexes I and II.  \n \n8  See resolution 71/285.  \n\nA/RES/72/229 \nCulture and sustainable development\n \n17-23306 \n4/7 \n \n \nTaking note of the note by the Secretary-General transmitting the report of the \nUnited Nations Educational, Scientific and Cultural Organization, 9  \n \n1. \nReaffirms the role of culture as an enabler of sustainable development that \nprovides people and communities with a strong sense of identity and social cohesion \nand contributes to more effective and sustainable development policies and measures \nat all levels, and stresses in this regard that policies responsive to cultural contexts \ncan yield better, sustainable, inclusive and equitable development outcomes;  \n \n2. \nRecognizes the potential of culture as a driver of sustainable development, \nwhich contributes to a strong and viable economic sector by generating income, \ncreating decent jobs and addressing both the economic and social dimensions of \npoverty through cultural heritage and cultural and creative industries, while providing \ninnovative and effective solutions to cross-cutting issues, such as education, health, \ngender equality and the environment;  \n \n3. \nEmphasizes the important contribution of culture to the three dimensions \nof sustainable development and to the achievement of national development \nobjectives and the Sustainable Development Goals and other internationally agreed \ndevelopment goals, and in this regard acknowledges:  \n \n(a) \nThat culture contributes to inclusive economic development, as cultural \nheritage, cultural and creative industries, sustainable cultural tourism and cultural \ninfrastructure are sources of income generation and job creation, including at the \ncommunity level, thus improving living conditions and fostering community-based \neconomic growth, and contribute to empowering individuals;  \n \n(b) \nThat culture contributes to inclusive social development for all, including \nlocal communities and indigenous peoples, with respect for cultural diversity, \nsafeguarding of the cultural and natural heritage, fostering of cultural institutions and \nstrengthening of cultural and creative industries;  \n \n(c) \nThat culture contributes to environmental sustainability, since the \nprotection of cultural and biological diversity and the natural heritage is crucial to \nsustainable development, while supporting traditional systems of environmental \nprotection, and resource management can contribute to the increased sustainability of \nfragile ecosystems and the preservation and sustainable use of biodiversity, reducing \nland degradation and mitigating the effects of climate change;  \n \n4. \nCalls upon the relevant organizations of the United Nations system, within \ntheir respective mandates and resources, to ensure that no one is left behind and no \ncountry is left behind in the implementation of the present resolution;  \n \n5. \nReaffirms that sustainable development cannot be realized without peace \nand security and that peace and security will be at risk without sustainable \ndevelopment, and acknowledges that culture can contribute to sustainable \ndevelopment by constituting a valuable resource for empowering communities to \nparticipate fully in social and cultural life, facilitating inclusive governance and \ndialogue at the national, regional and international levels and contributing to conflict \nprevention and resolution, as well as to reconciliation and recovery;  \n \n6. \nReaffirms its commitment to embracing diversity in cities and human \nsettlements, to strengthening social cohesion, intercultural dialogue and understanding, \ntolerance, mutual respect, gender equality, innovation, entrepreneurship, inclusion, \nidentity and safety, and the dignity of all people, as well as to fostering liveability and \na vibrant urban economy and to taking steps to ensure that local institutions promote \n__________________ \n \n9  A/72/336. \n\nCulture and sustainable development \nA/RES/72/229\n \n5/7 \n17-23306 \n \npluralism and peaceful coexistence within increasingly heterogeneous and \nmulticultural societies;  \n \n7. \nRecognizes that culture should be taken into account in the promotion and \nimplementation of new sustainable consumption and production patterns that \ncontribute to the responsible use of resources and address the adverse impacts of \nclimate change;  \n \n8. \nAcknowledges that quality education is enriched by culture, which \ntransmits shared values, knowledge and skills;  \n \n9. \nWelcomes the inclusion in the 2030 Agenda for Sustainable Development 10 \nof several targets reflecting the contribution of culture to sustainable development, \nrecalls that the Sustainable Development Goals and targets are integrated and \nindivisible and balance the three dimensions of sustainable development, and in this \nregard looks forward to their achievement, building on the positive results and impact \nof programmes utilizing culture as an enabler of sustainable development;  \n \n10. Decides to give consideration, as appropriate, to the contribution of culture \nto sustainable development in the follow-up and review framework of the 2030 \nAgenda for Sustainable Development;  \n \n11. \nInvites all countries, intergovernmental bodies, organizations of the United \nNations system, relevant non-governmental organizations and all other relevant \nstakeholders:  \n \n(a) \nTo raise public awareness of the importance of cultural diversity for \nsustainable development, promoting its positive value through education and media \ntools;  \n \n(b) \nTo ensure a more visible and effective integration and mainstreaming of \nculture into economic, social and environmental development policies and strategies \nat all levels;  \n \n(c) \nTo ensure that women and men can equally access, participate in and \ncontribute to cultural life and decision-making, and to further commit themselves to \nthe development of cultural policies and programmes with a gender perspective at the \nlocal, national and international levels in order to promote gender equality and the \nempowerment of women and girls;  \n \n(d) \nTo promote capacity-building, where appropriate, at all levels for the \ndevelopment of a dynamic cultural and creative sector, in particular by encouraging \ncreativity, innovation and entrepreneurship, supporting the development of cultural \ninstitutions and cultural industries, providing technical and vocational training for \nculture professionals and increasing employment opportunities in the cultural and \ncreative sector for sustained, inclusive and equitable economic growth and \ndevelopment;  \n \n(e) \nTo actively support the emergence of local markets for cultural goods and \nservices and to facilitate the effective and licit access of such goods and services to \ninternational markets, taking into account the expanding range of cultural production \nand consumption and, for States parties thereto, the provisions of the Convention on \nthe Protection and Promotion of the Diversity of Cultural Expressions; 4  \n \n(f) \nTo preserve and maintain local and indigenous traditional knowledge and \ncommunity practices of environmental management, which are valuable examples of \nculture as a vehicle for sustainable development, and to foster synergies between \n__________________ \n \n10  Resolution 70/1.  \n\nA/RES/72/229 \nCulture and sustainable development\n \n17-23306 \n6/7 \n \nmodern science and technology and local and indigenous knowledge, practices and \ninnovation;  \n \n(g) \nTo promote global awareness of the linkages between cultural and \nbiological diversity, including through the protection and encouragement of the \ncustomary use of biological resources, in accordance with traditional cultural \npractices, as a key element of a comprehensive approach to sustainable development;  \n \n(h) \nTo support national legal frameworks and policies for the protection and \npreservation of cultural heritage and cultural property, encouraging initiatives to fight \nagainst illicit trafficking in cultural property and the return of cultural property, in \naccordance with national legislation and applicable international legal frameworks, \nincluding by promoting international cooperation to prevent the misappropriation of \ncultural heritage and products, recognizing the importance of intellectual property \nrights in sustaining those involved in cultural creativity;  \n \n(i) \nTo note that, in achieving these objectives, innovative mechanisms of \nfinancing can make a positive contribution in assisting developing countries in \nmobilizing additional resources for development on a stable, predictable and \nvoluntary basis, and to reiterate that such voluntary mechanisms should be effective, \nshould aim to mobilize resources that are stable and predictable, should supplement \nand not be a substitute for traditional sources of financing, should be disbursed in \naccordance with the priorities of developing countries and should not unduly burden \nsuch countries;  \n \n(j) \nTo mobilize culture as a vehicle to foster tolerance, mutual understanding, \npeace and reconciliation in the context of conflict-prevention, conflict-resolution and \npeacebuilding processes;  \n \n12. Expresses deep concern that cultural property, including religious sites and \nobjects, is increasingly targeted by terrorist attacks, often resulting in its damage, \ntheft or complete destruction, and condemns such attacks;  \n \n13. Encourages all countries, intergovernmental bodies, organizations of the \nUnited Nations system, relevant non-governmental organizations and all other \nrelevant stakeholders to enhance international cooperation in supporting the efforts \nof developing countries towards the development, strengthening and consolidation of \ncultural industries, cultural tourism and culture-related microenterprises and to assist \nthose countries in developing the necessary infrastructure and skills, as well as in \nmastering information and communications technologies and in gaining access to new \ntechnologies on mutually agreed terms;  \n \n14. Encourages initiatives to foster cultural cooperation agreements and \nnetworks at the regional level for knowledge- and information-sharing for sustainable \ndevelopment;  \n \n15. Invites the organizations of the United Nations system, in particular the \nUnited Nations Educational, Scientific and Cultural Organization, to continue to \nprovide support, to facilitate financing and to assist Member States, upon their \nrequest, in developing their national capacities to optimize the contribution of culture \nto sustainable development, including through information-sharing, the exchange of \nbest practices, data collection, research and study and the use of appropriate \nevaluation indicators, as well as to implement applicable international cultural \nconventions, taking into account the relevant resolutions of the General Assembly;  \n \n16. Invites the United Nations Educational, Scientific and Cultural \nOrganization and other relevant United Nations bodies to continue to assess, in \nconsultation with Member States, the contribution of culture to the achievement of \nsustainable development through the compilation of quantitative data, including \n\nCulture and sustainable development \nA/RES/72/229\n \n7/7 \n17-23306 \n \nindicators and statistics, with a view to informing development policies and relevant \nreports, where appropriate;  \n \n17. Requests the Secretary-General to ensure that United Nations country \nteams continue to further integrate and mainstream culture into their programming \nexercises, in particular United Nations Development Assistance Frameworks, in \nconsultation with relevant national authorities, when assisting countries in the pursuit \nof their development objectives;  \n \n18. Encourages all countries, intergovernmental bodies, organizations of the \nUnited Nations system, relevant non-governmental organizations and all other \nrelevant stakeholders to give due consideration to the contribution of culture to the \nachievement of sustainable development in the formulation of national, regional and \ninternational development policies and international cooperation instruments, and in \nthis regard invites the President of the General Assembly to host a one-day high-level \nevent on this subject, within existing resources, during the seventy-third session of \nthe Assembly, and to invite the United Nations Educational, Scientific and Cultural \nOrganization to support him or her, within its existing mandates;  \n \n19. Requests the Secretary-General to submit to the General Assembly at its \nseventy-fourth session a report on the implementation of the present resolution, and \ndecides to include in the provisional agenda of its seventy-fourth session, under the \nitem entitled \u201cGlobalization and interdependence\u201d, the sub-item entitled \u201cCulture and \nsustainable development\u201d. \n \n74th plenary meeting  \n20 December 2017 \n \n",
  "paragraphs": {
    "1": "Reaffirms the role of culture as an enabler of sustainable development that provides people and communities with a strong sense of identity and social cohesion and contributes to more effective and sustainable development policies and measures at all levels, and stresses in this regard that policies responsive to cultural contexts can yield better, sustainable, inclusive and equitable development outcomes;",
    "2": "Recognizes the potential of culture as a driver of sustainable development, which contributes to a strong and viable economic sector by generating income, creating decent jobs and addressing both the economic and social dimensions of poverty through cultural heritage and cultural and creative industries, while providing innovative and effective solutions to cross-cutting issues, such as education, health, gender equality and the environment;",
    "3": "Emphasizes the important contribution of culture to the three dimensions of sustainable development and to the achievement of national development objectives and the Sustainable Development Goals and other internationally agreed development goals, and in this regard acknowledges: (a) That culture contributes to inclusive economic development, as cultural heritage, cultural and creative industries, sustainable cultural tourism and cultural infrastructure are sources of income generation and job creation, including at the community level, thus improving living conditions and fostering community-based economic growth, and contribute to empowering individuals; (b) That culture contributes to inclusive social development for all, including local communities and indigenous peoples, with respect for cultural diversity, safeguarding of the cultural and natural heritage, fostering of cultural institutions and strengthening of cultural and creative industries; (c) That culture contributes to environmental sustainability, since the protection of cultural and biological diversity and the natural heritage is crucial to sustainable development, while supporting traditional systems of environmental protection, and resource management can contribute to the increased sustainability of fragile ecosystems and the preservation and sustainable use of biodiversity, reducing land degradation and mitigating the effects of climate change;",
    "4": "Calls upon the relevant organizations of the United Nations system, within their respective mandates and resources, to ensure that no one is left behind and no country is left behind in the implementation of the present resolution;",
    "5": "Reaffirms that sustainable development cannot be realized without peace and security and that peace and security will be at risk without sustainable development, and acknowledges that culture can contribute to sustainable development by constituting a valuable resource for empowering communities to participate fully in social and cultural life, facilitating inclusive governance and dialogue at the national, regional and international levels and contributing to conflict prevention and resolution, as well as to reconciliation and recovery;",
    "6": "Reaffirms its commitment to embracing diversity in cities and human settlements, to strengthening social cohesion, intercultural dialogue and understanding, tolerance, mutual respect, gender equality, innovation, entrepreneurship, inclusion, identity and safety, and the dignity of all people, as well as to fostering liveability and a vibrant urban economy and to taking steps to ensure that local institutions promote pluralism and peaceful coexistence within increasingly heterogeneous and multicultural societies;",
    "7": "Recognizes that culture should be taken into account in the promotion and implementation of new sustainable consumption and production patterns that contribute to the responsible use of resources and address the adverse impacts of climate change;",
    "8": "Acknowledges that quality education is enriched by culture, which transmits shared values, knowledge and skills;",
    "9": "Welcomes the inclusion in the 2030 Agenda for Sustainable Development 10 of several targets reflecting the contribution of culture to sustainable development, recalls that the Sustainable Development Goals and targets are integrated and indivisible and balance the three dimensions of sustainable development, and in this regard looks forward to their achievement, building on the positive results and impact of programmes utilizing culture as an enabler of sustainable development;",
    "10": "Decides to give consideration, as appropriate, to the contribution of culture to sustainable development in the follow-up and review framework of the 2030 Agenda for Sustainable Development;",
    "11": "Invites all countries, intergovernmental bodies, organizations of the United Nations system, relevant non-governmental organizations and all other relevant stakeholders: (a) To raise public awareness of the importance of cultural diversity for sustainable development, promoting its positive value through education and media tools; (b) To ensure a more visible and effective integration and mainstreaming of culture into economic, social and environmental development policies and strategies at all levels; (c) To ensure that women and men can equally access, participate in and contribute to cultural life and decision-making, and to further commit themselves to the development of cultural policies and programmes with a gender perspective at the local, national and international levels in order to promote gender equality and the empowerment of women and girls; (d) To promote capacity-building, where appropriate, at all levels for the development of a dynamic cultural and creative sector, in particular by encouraging creativity, innovation and entrepreneurship, supporting the development of cultural institutions and cultural industries, providing technical and vocational training for culture professionals and increasing employment opportunities in the cultural and creative sector for sustained, inclusive and equitable economic growth and development; (e) To actively support the emergence of local markets for cultural goods and services and to facilitate the effective and licit access of such goods and services to international markets, taking into account the expanding range of cultural production and consumption and, for States parties thereto, the provisions of the Convention on the Protection and Promotion of the Diversity of Cultural Expressions; 4 (f) To preserve and maintain local and indigenous traditional knowledge and community practices of environmental management, which are valuable examples of culture as a vehicle for sustainable development, and to foster synergies between modern science and technology and local and indigenous knowledge, practices and innovation; (g) To promote global awareness of the linkages between cultural and biological diversity, including through the protection and encouragement of the customary use of biological resources, in accordance with traditional cultural practices, as a key element of a comprehensive approach to sustainable development; (h) To support national legal frameworks and policies for the protection and preservation of cultural heritage and cultural property, encouraging initiatives to fight against illicit trafficking in cultural property and the return of cultural property, in accordance with national legislation and applicable international legal frameworks, including by promoting international cooperation to prevent the misappropriation of cultural heritage and products, recognizing the importance of intellectual property rights in sustaining those involved in cultural creativity; (i) To note that, in achieving these objectives, innovative mechanisms of financing can make a positive contribution in assisting developing countries in mobilizing additional resources for development on a stable, predictable and voluntary basis, and to reiterate that such voluntary mechanisms should be effective, should aim to mobilize resources that are stable and predictable, should supplement and not be a substitute for traditional sources of financing, should be disbursed in accordance with the priorities of developing countries and should not unduly burden such countries; (j) To mobilize culture as a vehicle to foster tolerance, mutual understanding, peace and reconciliation in the context of conflict-prevention, conflict-resolution and peacebuilding processes;",
    "12": "Expresses deep concern that cultural property, including religious sites and objects, is increasingly targeted by terrorist attacks, often resulting in its damage, theft or complete destruction, and condemns such attacks;",
    "13": "Encourages all countries, intergovernmental bodies, organizations of the United Nations system, relevant non-governmental organizations and all other relevant stakeholders to enhance international cooperation in supporting the efforts of developing countries towards the development, strengthening and consolidation of cultural industries, cultural tourism and culture-related microenterprises and to assist those countries in developing the necessary infrastructure and skills, as well as in mastering information and communications technologies and in gaining access to new technologies on mutually agreed terms;",
    "14": "Encourages initiatives to foster cultural cooperation agreements and networks at the regional level for knowledge- and information-sharing for sustainable development;",
    "15": "Invites the organizations of the United Nations system, in particular the United Nations Educational, Scientific and Cultural Organization, to continue to provide support, to facilitate financing and to assist Member States, upon their request, in developing their national capacities to optimize the contribution of culture to sustainable development, including through information-sharing, the exchange of best practices, data collection, research and study and the use of appropriate evaluation indicators, as well as to implement applicable international cultural conventions, taking into account the relevant resolutions of the General Assembly;",
    "16": " indicators and statistics, with a view to informing development policies and relevant reports, where appropriate;",
    "17": "Requests the Secretary-General to ensure that United Nations country teams continue to further integrate and mainstream culture into their programming exercises, in particular United Nations Development Assistance Frameworks, in consultation with relevant national authorities, when assisting countries in the pursuit of their development objectives;",
    "18": "Encourages all countries, intergovernmental bodies, organizations of the United Nations system, relevant non-governmental organizations and all other relevant stakeholders to give due consideration to the contribution of culture to the achievement of sustainable development in the formulation of national, regional and international development policies and international cooperation instruments, and in this regard invites the President of the General Assembly to host a one-day high-level event on this subject, within existing resources, during the seventy-third session of the Assembly, and to invite the United Nations Educational, Scientific and Cultural Organization to support him or her, within its existing mandates;",
    "19": "Requests the Secretary-General to submit to the General Assembly at its seventy-fourth session a report on the implementation of the present resolution, and decides to include in the provisional agenda of its seventy-fourth session, under the item entitled \u201cGlobalization and interdependence\u201d, the sub-item entitled \u201cCulture and sustainable development\u201d."
  },
  "agenda_items": [
    "Item 21"
  ],
  "symbol_references": []
}