{
  "symbol": "A/RES/79/85",
  "filename": "A_RES_79_85.pdf",
  "title": "79/85. Effects of atomic radiation",
  "text": "United Nations \nA/RES/79/85\n \n \nGeneral Assembly \nDistr.: General \n12 December 2024 \n \n24-23529 (E)     \n*2423529* \n \n \nSeventy-ninth session \nAgenda item 47 \nEffects of atomic radiation \n \n \n \n \n Resolution adopted by the General Assembly \non 4 December 2024 \n \n \n \n \n[on the report of the Special Political and Decolonization Committee \n(Fourth Committee) (A/79/420, para. 8)] \n \n \n \n79/85. Effects of atomic radiation \n \n \n \nThe General Assembly, \n \nRecalling its resolution 913 (X) of 3 December 1955, by which it established \nthe United Nations Scientific Committee on the Effects of Atomic Radiation, and its \nsubsequent resolutions on the subject, in which, inter alia, it requested the Scientific \nCommittee to continue its work, \n \nConcerned about the potentially harmful effects on present and future \ngenerations resulting from the levels of radiation to which humankind and the \nenvironment are exposed,  \n \nConscious of the continuing need to examine and compile information about the \nobserved levels of exposure to ionizing radiation and to analyse its effects on \nhumankind and the environment, and conscious also of the increasing volume, \ncomplexity and diversity of that information,  \n \nAcknowledging the concerns about the radiological consequences of nuclear \naccidents and other incidents involving ionizing radiation exposure,  \n \nReaffirming the desirability of the Scientific Committee continuing its work, \nand welcoming the increased commitment of States members of the Committee,  \n \nEmphasizing the vital need for sufficient, assured and predictable funding, as \nwell as efficient management of the work of the secretariat of the Scientific \nCommittee to arrange the annual sessions and coordinate the development of \ndocuments based on scientific reviews of the exposures to sources of ionizing \nradiation and its effects on human health and the environment,  \n \nRecognizing the increasing importance of the scientific work of the Scientific \nCommittee and the need to carry out unforeseen additional work, such as after nuclear \naccidents,  \n\nA/RES/79/85 \nEffects of atomic radiation\n \n24-23529\n2/5 \n \n \nConsidering that the high quality of the work and the scientific rigour of the \nScientific Committee need to be maintained in the future,  \n \nRecognizing the importance of disseminating the findings of the Scientific \nCommittee, including to the public, and widely publicizing scientific knowledge \nabout atomic radiation, and recalling in that context principle 10 of the Rio \nDeclaration on Environment and Development,1  \n \nNoting the need for the resources of the Scientific Committee to be sufficient, \nassured and predictable, and recognizing the importance of voluntary contributions, \nboth in kind and to the general trust fund established by the Executive Director of the \nUnited Nations Environment Programme, to support the work of the Committee,  \n \nRecognizing that sufficient staffing of the secretariat is essential to support the \nwork of the Scientific Committee, \n \nCommending the secretariat of the Scientific Committee for its ongoing efforts \nto ensure the sustainable and effective work of the Committee, and encouraging all \nStates in a position to do so to provide support to the secretariat of the Committee,  \n \nRecalling the support expressed by the International Atomic Energy Agency and \nthe World Health Organization for the Scientific Committee\u2019s work in producing the \nmost reliable and comprehensive sources of scientific information about the levels \nand effects of ionizing radiation, without which safety guidance and safety standards \ncould not be developed and maintained and priorities for research in the areas of \nsources and effects of ionizing radiation could not be determined, \n \nRecognizing that the current scientific basis provided by the Scientific \nCommittee for the international safety standards is valid, \n \nRecognizing also the importance of keeping aware of any improvement in the \nunderstanding of the effects and risks, including at low levels, of exposure to ionizing \nradiation,  \n \nRecognizing further the importance of close cooperation between the Scientific \nCommittee and other relevant international organizations,  \n \nNoting the research framework agreement signed with the European \nCommission in June 2023, the memorandums of understanding signed with the \nInternational Commission on Radiological Protection in May 2024 and with the \nNuclear Energy Agency of the Organisation for Economic Co-operation and \nDevelopment in June 2024, and the ongoing dialogue with the International Labour \nOrganization, \n \n1. \nCommends the United Nations Scientific Committee on the Effects of \nAtomic Radiation for the valuable contribution that it has been making since its \ninception to wider knowledge and understanding of the levels, effects and risks of \nexposure to ionizing radiation and for fulfilling its original mandate with scientific \nauthority and independence of judgment;  \n \n2. \nReaffirms the decision to maintain the present functions and independent \nrole of the Scientific Committee; \n \n3. \nRe-emphasizes the need for the Scientific Committee to hold regular \nsessions on an annual basis so that its report will be able to reflect the latest \n__________________ \n \n1 Report of the United Nations Conference on Environment and Development, Rio de Janeiro, \n3\u2013 14 June 1992, vol. I, Resolutions Adopted by the Conference (United Nations publication, \nSales No. E.93.I.8 and corrigendum), resolution 1, annex I. \n\nEffects of atomic radiation \nA/RES/79/85\n \n3/5\n24-23529 \n \ndevelopments and findings in the field of ionizing radiation and thereby provide \nupdated information for dissemination among all States; \n \n4. \nNotes with appreciation the work of the Scientific Committee, takes note \nof the report on its seventy-first session,2 and encourages the Committee, over its \ncoming sessions, to continue to work towards implementing strategies to support its \nlong-term efforts to serve the scientific community, as well as wider audiences; \n \n5. \nWelcomes the decisions on the outlined future programme of work for the \nperiod 2025\u20132029, which will serve to guide the priority areas of the work of the \nScientific Committee; \n \n6. \nNotes with appreciation the implementation of the 2022 strategy to \nimprove collection, analysis and dissemination of data on exposure to ionizing \nradiation aimed at seeking widespread participation in the Scientific Committee\u2019s \nsurveys and ensuring that future surveys adapt to changing data sources and use of \nionizing radiation across the world; \n \n7. \nWelcomes the extension of the mandate of the ad hoc working group on \neffects and mechanisms and the ad hoc working group on sources and exposure to \nassist the Scientific Committee in supporting and monitoring progress in the \nimplementation of its programme of work, to evaluate new scientific developments \nrelevant to the Committee and to monitor the implementation of the updated strategy \nfor data collection; \n \n8. \nSupports the Scientific Committee in continuing to conduct its programme \nof work of scientific review and assessment on behalf of the General Assembly, and \nwelcomes further progress, in particular on its evaluations of epidemiological studies \nof ionizing radiation and cancer, effects of ionizing radiation on the circulatory \nsystem, and effects of ionizing radiation on the nervous system, which are being \nconducted in close cooperation with other relevant organizations;  \n \n9. \nWelcomes the two substantive scientific reports adopted by the Scientific \nCommittee during its seventy-first session, on second primary cancer after \nradiotherapy and on the evaluation of public exposure to ionizing radiation, and looks \nforward to the timely publication of the supporting scientific annexes thereto as their \noutcomes are relied upon by other international organizations; \n \n10. Also welcomes the planned initiation of the evaluation of effects of \nionizing radiation on the eye in early 2025, subject to the availability of resources; \n \n11. \nRequests the Scientific Committee to continue its work, including its \nimportant activities to increase knowledge of the levels, effects and risks of ionizing \nradiation from all sources, and to report thereon to the General Assembly at its \neightieth session; \n \n12. Acknowledges the importance of sharing data with the Scientific \nCommittee as appropriate, and the central role played by the increasing number of \nNational Contact Persons and alternate National Contact Persons in order to \ncoordinate data collection at the country level and to cooperate with technical experts \nto complete the Committee\u2019s questionnaires; \n \n13. Encourages National Contact Persons and their alternates to take part in \nthe global surveys of the Scientific Committee and to submit available scientific data \non radiation exposure of patients, workers and the general public as appropriate; \n \n14. Invites members of the Scientific Committee to introduce alternate \nNational Contact Persons to ensure continuity of engagement by each Member State;  \n__________________ \n \n2 Official Records of the General Assembly, Seventy-ninth Session, Supplement No. 46 (A/79/46). \n\nA/RES/79/85 \nEffects of atomic radiation\n \n24-23529\n4/5 \n \n \n15. Requests the secretariat to monitor the timely publication of approved \nreports and to strive to publish them within 12 months of their approval; \n \n16. Invites the Scientific Committee to continue its consultations with \nscientists and experts from interested Member States in the process of preparing its \nfuture scientific reports, and requests the secretariat to continue to facilitate such \nconsultations; \n \n17. Welcomes, in this context, the readiness of Member States to provide the \nScientific Committee with relevant information on the levels and effects of ionizing \nradiation, and invites the Committee to analyse and give due consideration to such \ninformation, particularly in the light of its own findings;  \n \n18. Recalls the strategy of the Scientific Committee to improve data \ncollection, encourages in this regard Member States, the organizations of the United \nNations system and non-governmental organizations concerned to provide further \nrelevant data about levels, effects and risks of exposure to ionizing radiation from \nvarious sources, which would greatly help in the preparation of future reports of the \nCommittee to the General Assembly, and encourages the International Atomic Energy \nAgency, the World Health Organization, the International Labour Organization and \nother relevant organizations to further collaborate with the secretariat on \narrangements for the collection, analysis and dissemination of data on radiation \nexposures of patients, workers and the general public;  \n \n19. Encourages the relevant agencies of the United Nations system, and other \ninternational bodies, to continue using the Scientific Committee\u2019s evaluations for \nproviding the scientific basis for the establishment of international safety standards;  \n \n20. Welcomes the use and ongoing development by the secretariat of an online \nplatform for collecting data on the exposure of patients, workers and the general \npublic, and urges Member States to take part in the Scientific Committee\u2019s planned \nglobal survey on medical exposure and to nominate National Contact Persons to \nfacilitate coordination of the collection and submission of data on the ionizing \nradiation exposure of patients;  \n \n21. Also welcomes the Scientific Committee\u2019s endorsed outreach strategy for \nthe period 2025\u20132029, focusing on strengthening the Committee\u2019s input to the \nscience-policy interface within and outside the extensive United Nations network, \nenhancing engagement with scientific, diplomatic, academic and professional \ncommunities, subject to the availability of resources, and encouraging the \ninvolvement of young professionals in the work of the Committee;  \n \n22. Notes the successful publication online of the United Nations Environment \nProgramme booklet entitled Radiation: Effects and Sources in 16 different languages, \nand encourages the United Nations Environment Programme to update the booklet on \nthe basis of the most recent Scientific Committee reports and annexes thereto, with \nthe goal of publishing the updated booklet in order to mark the seventieth anniversary \nof the Committee;  \n \n23. Welcomes the ongoing work of the secretariat to publish the website of the \nScientific Committee in the six official languages of the United Nations;  \n \n24. Requests the United Nations Environment Programme to continue, within \nexisting United Nations resources, to service the Scientific Committee and to \ndisseminate its findings to Member States, the scientific community and the public \nand to ensure that the administrative measures in place are appropriate so that the \nsecretariat is able to adequately and efficiently service the Committee in a predictable \nand sustainable manner; \n\nEffects of atomic radiation \nA/RES/79/85\n \n5/5\n24-23529 \n \n \n25. \nEncourages the Scientific Committee to stand ready to carry out unplanned \nadditional work, in strict compliance with its mandate, and in coordination with the \nInternational Atomic Energy Agency and other relevant international organizations, as \nappropriate, such as after nuclear incidents and accidents, that could include those in \nthe context of military actions or natural disasters; \n \n26. Welcomes the increase of the regular budget of the Scientific Committee \nin 2023 as decided after the seventy-eighth session of the General Assembly, allowing \nin particular to sustain the capacities of the secretariat to support the Committee; \n \n27. Expresses strong expectations that, despite liquidity challenges faced by \nthe United Nations, the regular budget of the Scientific Committee will be allocated \nin full, to implement the Committee\u2019s programme of work as referred to above; \n \n28. Requests the Secretary-General to strengthen support for the secretariat, \nas decided in 2023, in order to adequately and efficiently provide service to the \nScientific Committee in a predictable and sustainable manner, and to effectively \nfacilitate the use of the invaluable expertise offered to the Committee by its members, \nand to report to the General Assembly at its eightieth session on these issues; \n \n29. Understands that, as the budgetary situation remains challenging, \nextrabudgetary support continues to be crucial for the timely implementation of the \nprogramme of work to deliver on the mandate of the Scientific Committee, which \nwould require the provision of additional professional and administrative secretariat \nservices; \n \n30. Acknowledges that contributions to the general trust fund by Member \nStates (through funding support and mostly in-kind contributions of cost-free experts \nand technical officers) have augmented the regular budget, allowing work to progress \nin a number of areas; \n \n31. Encourages Member States in a position to do so to make voluntary \ncontributions to the general trust fund established by the Executive Director of the \nUnited Nations Environment Programme and also to make contributions in kind, in \norder to support the work of the Scientific Committee, and the dissemination of its \nfindings, in a sustainable manner. \n \n47th plenary meeting \n4 December2024 \n \n",
  "paragraphs": {
    "1": "Commends the United Nations Scientific Committee on the Effects of Atomic Radiation for the valuable contribution that it has been making since its inception to wider knowledge and understanding of the levels, effects and risks of exposure to ionizing radiation and for fulfilling its original mandate with scientific authority and independence of judgment;",
    "2": "Reaffirms the decision to maintain the present functions and independent role of the Scientific Committee;",
    "3": "Re-emphasizes the need for the Scientific Committee to hold regular sessions on an annual basis so that its report will be able to reflect the latest __________________ 1 Report of the United Nations Conference on Environment and Development, Rio de Janeiro, 3\u2013 14 June 1992, vol. I, Resolutions Adopted by the Conference (United Nations publication, Sales No. E.93.I.8 and corrigendum), resolution 1, annex I. Effects of atomic radiation A/RES/79/85 3/5 24-23529 developments and findings in the field of ionizing radiation and thereby provide updated information for dissemination among all States;",
    "4": "Notes with appreciation the work of the Scientific Committee, takes note of the report on its seventy-first session,2 and encourages the Committee, over its coming sessions, to continue to work towards implementing strategies to support its long-term efforts to serve the scientific community, as well as wider audiences;",
    "5": "Welcomes the decisions on the outlined future programme of work for the period 2025\u20132029, which will serve to guide the priority areas of the work of the Scientific Committee;",
    "6": "Notes with appreciation the implementation of the 2022 strategy to improve collection, analysis and dissemination of data on exposure to ionizing radiation aimed at seeking widespread participation in the Scientific Committee\u2019s surveys and ensuring that future surveys adapt to changing data sources and use of ionizing radiation across the world;",
    "7": "Welcomes the extension of the mandate of the ad hoc working group on effects and mechanisms and the ad hoc working group on sources and exposure to assist the Scientific Committee in supporting and monitoring progress in the implementation of its programme of work, to evaluate new scientific developments relevant to the Committee and to monitor the implementation of the updated strategy for data collection;",
    "8": "Supports the Scientific Committee in continuing to conduct its programme of work of scientific review and assessment on behalf of the General Assembly, and welcomes further progress, in particular on its evaluations of epidemiological studies of ionizing radiation and cancer, effects of ionizing radiation on the circulatory system, and effects of ionizing radiation on the nervous system, which are being conducted in close cooperation with other relevant organizations;",
    "9": "Welcomes the two substantive scientific reports adopted by the Scientific Committee during its seventy-first session, on second primary cancer after radiotherapy and on the evaluation of public exposure to ionizing radiation, and looks forward to the timely publication of the supporting scientific annexes thereto as their outcomes are relied upon by other international organizations;",
    "10": "Also welcomes the planned initiation of the evaluation of effects of ionizing radiation on the eye in early 2025, subject to the availability of resources;",
    "11": "Requests the Scientific Committee to continue its work, including its important activities to increase knowledge of the levels, effects and risks of ionizing radiation from all sources, and to report thereon to the General Assembly at its eightieth session;",
    "12": "Acknowledges the importance of sharing data with the Scientific Committee as appropriate, and the central role played by the increasing number of National Contact Persons and alternate National Contact Persons in order to coordinate data collection at the country level and to cooperate with technical experts to complete the Committee\u2019s questionnaires;",
    "13": "Encourages National Contact Persons and their alternates to take part in the global surveys of the Scientific Committee and to submit available scientific data on radiation exposure of patients, workers and the general public as appropriate;",
    "14": "Invites members of the Scientific Committee to introduce alternate National Contact Persons to ensure continuity of engagement by each Member State; __________________ 2 Official Records of the General Assembly, Seventy-ninth Session, Supplement No. 46 (A/79/46). A/RES/79/85 Effects of atomic radiation 24-23529 4/5",
    "15": "Requests the secretariat to monitor the timely publication of approved reports and to strive to publish them within 12 months of their approval;",
    "16": "Invites the Scientific Committee to continue its consultations with scientists and experts from interested Member States in the process of preparing its future scientific reports, and requests the secretariat to continue to facilitate such consultations;",
    "17": "Welcomes, in this context, the readiness of Member States to provide the Scientific Committee with relevant information on the levels and effects of ionizing radiation, and invites the Committee to analyse and give due consideration to such information, particularly in the light of its own findings;",
    "18": "Recalls the strategy of the Scientific Committee to improve data collection, encourages in this regard Member States, the organizations of the United Nations system and non-governmental organizations concerned to provide further relevant data about levels, effects and risks of exposure to ionizing radiation from various sources, which would greatly help in the preparation of future reports of the Committee to the General Assembly, and encourages the International Atomic Energy Agency, the World Health Organization, the International Labour Organization and other relevant organizations to further collaborate with the secretariat on arrangements for the collection, analysis and dissemination of data on radiation exposures of patients, workers and the general public;",
    "19": "Encourages the relevant agencies of the United Nations system, and other international bodies, to continue using the Scientific Committee\u2019s evaluations for providing the scientific basis for the establishment of international safety standards;",
    "20": "Welcomes the use and ongoing development by the secretariat of an online platform for collecting data on the exposure of patients, workers and the general public, and urges Member States to take part in the Scientific Committee\u2019s planned global survey on medical exposure and to nominate National Contact Persons to facilitate coordination of the collection and submission of data on the ionizing radiation exposure of patients;",
    "21": "Also welcomes the Scientific Committee\u2019s endorsed outreach strategy for the period 2025\u20132029, focusing on strengthening the Committee\u2019s input to the science-policy interface within and outside the extensive United Nations network, enhancing engagement with scientific, diplomatic, academic and professional communities, subject to the availability of resources, and encouraging the involvement of young professionals in the work of the Committee;",
    "22": "Notes the successful publication online of the United Nations Environment Programme booklet entitled Radiation: Effects and Sources in 16 different languages, and encourages the United Nations Environment Programme to update the booklet on the basis of the most recent Scientific Committee reports and annexes thereto, with the goal of publishing the updated booklet in order to mark the seventieth anniversary of the Committee;",
    "23": "Welcomes the ongoing work of the secretariat to publish the website of the Scientific Committee in the six official languages of the United Nations;",
    "24": "Requests the United Nations Environment Programme to continue, within existing United Nations resources, to service the Scientific Committee and to disseminate its findings to Member States, the scientific community and the public and to ensure that the administrative measures in place are appropriate so that the secretariat is able to adequately and efficiently service the Committee in a predictable and sustainable manner; Effects of atomic radiation A/RES/79/85 5/5 24-23529",
    "25": "Encourages the Scientific Committee to stand ready to carry out unplanned additional work, in strict compliance with its mandate, and in coordination with the International Atomic Energy Agency and other relevant international organizations, as appropriate, such as after nuclear incidents and accidents, that could include those in the context of military actions or natural disasters;",
    "26": "Welcomes the increase of the regular budget of the Scientific Committee in 2023 as decided after the seventy-eighth session of the General Assembly, allowing in particular to sustain the capacities of the secretariat to support the Committee;",
    "27": "Expresses strong expectations that, despite liquidity challenges faced by the United Nations, the regular budget of the Scientific Committee will be allocated in full, to implement the Committee\u2019s programme of work as referred to above;",
    "28": "Requests the Secretary-General to strengthen support for the secretariat, as decided in 2023, in order to adequately and efficiently provide service to the Scientific Committee in a predictable and sustainable manner, and to effectively facilitate the use of the invaluable expertise offered to the Committee by its members, and to report to the General Assembly at its eightieth session on these issues;",
    "29": "Understands that, as the budgetary situation remains challenging, extrabudgetary support continues to be crucial for the timely implementation of the programme of work to deliver on the mandate of the Scientific Committee, which would require the provision of additional professional and administrative secretariat services;",
    "30": "Acknowledges that contributions to the general trust fund by Member States (through funding support and mostly in-kind contributions of cost-free experts and technical officers) have augmented the regular budget, allowing work to progress in a number of areas;",
    "31": "Encourages Member States in a position to do so to make voluntary contributions to the general trust fund established by the Executive Director of the United Nations Environment Programme and also to make contributions in kind, in order to support the work of the Scientific Committee, and the dissemination of its findings, in a sustainable manner. 47th plenary meeting 4 December2024"
  },
  "agenda_items": [
    "Item 47"
  ],
  "symbol_references": []
}