{
  "symbol": "A/RES/79/147",
  "filename": "A_RES_79_147.pdf",
  "title": "79/147. Follow-up to the Second World Assembly on Ageing",
  "text": "United Nations \nA/RES/79/147\n \n \nGeneral Assembly \nDistr.: General \n19 December 2024 \n \n24-24133 (E)     \n*2424133* \n \n \nSeventy-ninth session \nAgenda item 26 (b) \nSocial development: social development, including \nquestions relating to the world social situation and to \nyouth, ageing, persons with disabilities and the family \n \n \n \n \n Resolution adopted by the General Assembly \non 17 December 2024 \n \n \n \n \n[on the report of the Third Committee (A/79/450, para. 39)] \n \n \n 79/147. Follow-up to the Second World Assembly on Ageing \n \n \n \nThe General Assembly, \n \nRecalling its resolution 57/167 of 18 December 2002, in which it endorsed the \nPolitical Declaration and the Madrid International Plan of Action on Ageing, 2002,1 \nits resolution 58/134 of 22 December 2003, in which it took note, inter alia, of the \nroad map for the implementation of the Madrid Plan of Action, and its resolutions \n60/135 of 16 December 2005, 61/142 of 19 December 2006, 62/130 of 18 December \n2007, 63/151 of 18 December 2008, 64/132 of 18 December 2009, 65/182 of \n21 December 2010, 66/127 of 19 December 2011, 67/139 and 67/143 of 20 December \n2012, 68/134 of 18 December 2013, 69/146 of 18 December 2014, 70/164 of \n17 December 2015, 71/164 of 19 December 2016, 72/144 of 19 December 2017, \n73/143 of 17 December 2018, 74/125 of 18 December 2019, 75/152 of 16 December \n2020, 76/138 of 16 December 2021, 77/190 of 15 December 2022, 78/177 of \n19 December 2023 and 78/324 of 13 August 2024,  \n \nRecognizing that there has been steady participation of Member States in the \nfourth review and appraisal cycle of implementation of the Madrid Plan of Action, \nalthough, in some parts of the world, awareness of the Madrid Plan of Action remains \nlimited, which limits the scope of implementation efforts,  \n \nTaking note of the report of the Secretary-General,2 \n \nTaking note also of other initiatives that the Secretary-General, United Nations \nagencies and United Nations entities have undertaken, and noting in this regard the \nimportance of promoting equal access of older persons to social services, healthcare \n__________________ \n \n1  Report of the Second World Assembly on Ageing, Madrid, 8\u201312 April 2002 (United Nations \npublication, Sales No. E.02.IV.4), chap. I, resolution 1, annexes I and II. \n \n2  A/79/157. \n\nA/RES/79/147 \nFollow-up to the Second World Assembly on Ageing\n \n24-24133\n2/12 \n \nservices, information and communications technologies, including new technologies, \nassistive technologies, full and productive employment and decent work, encouraging \ntheir effective and meaningful participation, protecting their human rights, combating \nageism and all forms of violence against them, as well as obtaining data disaggregated \nby income, sex, age, race, ethnicity, migratory status, disability, geographical location \nand other characteristics relevant in national contexts,  \n \nRecalling the 2030 Agenda for Sustainable Development,3 and stressing the need \nto ensure that issues of relevance to older persons are taken into account in its \nimplementation in order to ensure that no one is left behind, including older persons, \n \nRecalling also the Universal Declaration of Human Rights,4 the International \nCovenant on Civil and Political Rights,5 the International Covenant on Economic, \nSocial and Cultural Rights, 6 the Convention on the Elimination of All Forms of \nDiscrimination against Women, 7  the Convention on the Rights of Persons with \nDisabilities8 and the International Convention on the Elimination of All Forms of \nRacial Discrimination,9 \n \nNoting the International Convention on the Protection of the Rights of All \nMigrant Workers and Members of their Families10 and the United Nations Declaration \non the Rights of Indigenous Peoples,11  \n \nNoting also the regional developments on the protection and promotion of the \nhuman rights of older persons, including the Inter-American Convention on \nProtecting the Human Rights of Older Persons and the Protocol to the African Charter \non Human and Peoples\u2019 Rights on the Rights of Older Persons in Africa,  \n \nNoting further that, between 2024 and 2030, the number of persons aged 60 \nyears or over is projected to grow by 19 per cent, from 1.2 billion to 1.4 billion, \nglobally outnumbering youth and doubling the number of children under age 5,12 and \nthat this increase will be the greatest and the most rapid in the developing world, and \nrecognizing that greater attention needs to be paid to the specific challenges affecting \nolder persons, including in the field of human rights, \n \nRecalling World Health Assembly resolutions on ageing, specifically resolution \n58.16 of 25 May 2005 on strengthening active and healthy ageing,13 which stressed \nthe important role of public health policies and programmes in enabling the rapidly \ngrowing number of older persons to remain in good health and maintain their many \nvital contributions to the well-being of their families, communities and societies, \nresolution 65.3 of 25 May 2012 on strengthening non-communicable disease policies \nto promote active ageing,14 which recognized that population ageing is among the \nmajor \nfactors \ncontributing \nto \nthe \nrising \nincidence \nand \nprevalence \nof \nnon-communicable diseases and noted the importance of lifelong health-promotion \nand disease-prevention activities, and resolution 69.3 of 29 May 2016, entitled \n__________________ \n \n3  Resolution 70/1. \n \n4  Resolution 217 A (III). \n \n5  See resolution 2200 A (XXI), annex. \n \n6  Ibid. \n \n7  United Nations, Treaty Series, vol. 1249, No. 20378. \n \n8  Ibid., vol. 2515, No. 44910. \n \n9  Ibid., vol. 660, No. 9464. \n \n10  Ibid., vol. 2220, No. 39481. \n \n11  Resolution 61/295, annex. \n \n12  United Nations, Department of Economic and Social Affairs, Population Division, World \nPopulation Prospects: 2024 Revision. \n \n13  See World Health Organization, document WHA58/2005/REC/1. \n \n14  See World Health Organization, document WHA65/2012/REC/1. \n\nFollow-up to the Second World Assembly on Ageing \nA/RES/79/147\n \n3/12\n24-24133 \n \n\u201cGlobal strategy and action plan on ageing and 2016\u20132020: towards a world in which \neveryone can live a long and healthy life\u201d,15 \n \nRecalling also the proclamation of the United Nations Decade of Healthy \nAgeing (2021\u20132030) in its resolution 75/131 of 14 December 2020,  \n \nRecalling further the World Summit on the Information Society and its outcomes,16 \nincluding its special track on information and communications technologies and older \npersons, as well as other relevant intergovernmentally agreed outcomes,  \n \nRecognizing that the coronavirus disease (COVID-19) pandemic has had a \ndisproportionately heavy impact on older persons, in particular older women,  \n \nRecognizing also that COVID-19 has disproportionately affected older persons \nliving in long-term care facilities, including those in the context of informal long-\nterm care provision, and stressing the importance of providing personal protective \nequipment in long-term care facilities, securing emergency funding for such facilities, \napplying telemedicine and telehealth methods for mitigation purposes, and achieving \nuniversal health coverage, ensuring fair and equitable access to vaccines, diagnostics \nand therapeutics,  \n \nAcknowledging that many developing countries and countries with economies in \ntransition are confronting a double burden of fighting communicable diseases, such as \nHIV/AIDS, tuberculosis and malaria, in parallel with the increasing threat of \nnon-communicable diseases, and expressing concern about the impact on older persons,  \n \nConcerned that many health systems are not sufficiently prepared to respond to \nthe needs of the rapidly ageing population, including the need for preventive, curative, \npalliative and specialized care,  \n \nDeeply concerned that the situation of older persons in many parts of the world \nhas been negatively affected by the world financial and economic crisis, and noting \nwith concern the high incidence of poverty among them, particularly older single \nwomen, \n \nRecognizing the essential contribution that older persons can continue to make \nto the functioning of societies and towards the implementation of the 2030 Agenda, \nand recognizing also the importance of the full and effective enjoyment of their \nhuman rights, \n \nRecognizing also the needs and contributions of older persons when addressing \nglobal challenges, inter alia, in climate action, disaster risk reduction, technology and \ninnovation, and recognizing further the importance of intergenerational solidarity in \nsustainable development efforts, \n \nConcerned about the multiple and intersecting forms of discrimination that may \ncreate additional vulnerabilities for older persons and affect their enjoyment of human \nrights and fundamental freedoms, and recognizing that, in particular, older women \noften face multiple forms of discrimination resulting from gender inequality and are \nat greater risk of physical and psychological abuse and violence,  \n \nAcknowledging the accelerated global trend of ageing of the population, which \nwill require more care work and support, and stressing the need to promote and \nstrengthen the estimation of the caregiving contribution and other activities of older \npersons to the economy, including recognition of unpaid care for family members, in \nparticular by older women, and to ensure that national statistics in this regard inform \npolicymaking,  \n__________________ \n \n15  See World Health Organization, document WHA69/2016/REC/1. \n \n16  See A/C.2/59/3 and A/60/687. \n\nA/RES/79/147 \nFollow-up to the Second World Assembly on Ageing\n \n24-24133\n4/12 \n \n \nRecognizing that the prevalence of disabilities increases with age and that many \nolder persons live with a disability,  \n \nRecognizing also that ageism is a widely prevalent and prejudicial attitude that \nmay rest on the assumption that neglect of, and discrimination against, older persons \nis acceptable, and that ageism is the common source of, the justification for and the \ndriving force behind age discrimination,  \n \nRecognizing further that the social exclusion of older persons is a complex \nprocess involving the lack or denial of resources, rights, goods and services as people \nage, and the inability of older persons to participate in societal relationships and \nactivities, including cultural activities, available to the majority of people across the \nvaried and multiple domains of society, and that it affects both the quality of life of \nolder persons and the equity and cohesion of an ageing society as a whole, with \nconsiderable implications for the enjoyment by older persons of their human rights,  \n \nAcknowledging the importance of exploring ways to increase the visibility of and \nattention to the specific challenges faced by older persons in the global development \npolicy framework, including identifying possible gaps and how best to address them,  \n \nDeeply concerned by the increasing number and scale of humanitarian \nemergencies and their impact on older persons, particularly older women, reiterating \nthe importance of giving due consideration to their specific needs, as well as their \ncapacity to respond, and to the contributions of older persons to the planning and \nimplementation of humanitarian assistance and efforts in disaster risk reduction, and \nnoting with concern that the multiple forms of discrimination experienced by older \nwomen can be exacerbated during humanitarian emergencies and aggravate their \npotential vulnerabilities,  \n \nRecognizing the successful conclusion of the fourth review and appraisal of the \nMadrid Plan of Action, noting the results achieved at the international, regional and \nnational levels, and acknowledging in that regard the recommendations of the \nCommission for Social Development at its sixty-first session, as endorsed by the \nEconomic and Social Council in its resolution 2023/15 of 7 June 2023,  \n \n1. \nReaffirms the Political Declaration and the Madrid International Plan of \nAction on Ageing, 2002;  \n \n2. \nCalls upon all States and the international community to cooperate, \nsupport and participate in the global efforts towards an age-inclusive implementation \nof the 2030 Agenda for Sustainable Development and to mobilize all necessary \nresources and support in that regard, according to national plans and strategies, \nincluding through an integrated and multifaceted approach to improving the well-\nbeing of older persons, and in this regard encourages Member States to seize this \nopportunity to take into account issues of relevance to older persons in their efforts \nto promote the attainment of the Sustainable Development Goals;  \n \n3. \nEncourages Member States to address the situation of older persons in \ntheir voluntary national reviews presented at the high-level political forum on \nsustainable development;  \n \n4. \nAlso encourages Member States to accelerate their efforts to mainstream \nthe linkages between population ageing and sustainable development into national \npolicies and programmes across all levels of government, where appropriate, and to \nlink ageing to frameworks for social and economic development and human rights;  \n \n5. \nRecognizes that the major challenges faced by older persons undermine \ntheir social, economic and cultural participation;  \n\nFollow-up to the Second World Assembly on Ageing \nA/RES/79/147\n \n5/12\n24-24133 \n \n \n6. \nEmphasizes the need to take effective measures against ageism and to view \nolder persons as active contributors to society and not as passive receivers of care and \nassistance and an impending burden on welfare systems and economies, while \npromoting and protecting their human rights;  \n \n7. \nEncourages Member States to intensify efforts towards identifying ageing \nas an opportunity, and recognizes that older persons make substantial contributions \nto sustainable development efforts, including through their active participation in \nsociety;  \n \n8. \nReaffirms that older persons should be able to seek and develop \nopportunities for service to the community and to serve as volunteers, while \nrecognizing that older persons can benefit from volunteering both as recipients and \nas providers and can significantly contribute thereto, and emphasizes that their active \nparticipation in those activities fosters their physical and mental well-being, helping \nolder persons to maintain their independence and enhance their quality of life;  \n \n9. \nRecognizes the role of intergenerational relations in promoting social \ncohesion and influencing an individual\u2019s life course through the transfer of \nexperiences, knowledge, values and traditions, and resources, through mutual \nsupport; \n \n10. Calls upon Member States to promote intergenerational knowledge \ntransfer in the workplace to harness the potential of different generations and better \nadapt to changes in labour markets;  \n \n11. Acknowledges that the opportunity for future generations to thrive in \nprosperity and achieve sustainable development must be ensured, including by \neliminating the intergenerational transmission of poverty and hunger, inequality and \ninjustice, and acknowledging the special challenges faced by developing countries;  \n \n12. Recognizes the challenges related to the enjoyment of all human rights that \nolder persons face in different areas and that those challenges require in-depth \nanalysis and action to address protection gaps, and calls upon all States to promote \nand ensure the full realization of all human rights and fundamental freedoms for older \npersons, including by progressively taking measures to combat age discrimination, \nneglect, abuse and violence, as well as social isolation and loneliness, to provide \nsocial protection, access to food and housing, healthcare services, employment, \ninformation and communications technologies, including new technologies, assistive \ntechnologies, legal capacity and access to justice and to address issues related to \nsocial integration and gender inequality through mainstreaming the rights of older \npersons into sustainable development strategies, urban policies and poverty reduction \nstrategies, bearing in mind the crucial importance of intergenerational solidarity for \nsocial development;  \n \n13. Takes note with appreciation of the work of the Independent Expert on the \nenjoyment of all human rights by older persons and the renewal of the mandate at the \nfifty-first session of the Human Rights Council;17  \n \n14. Takes note of the report of the Independent Expert issued in accordance \nwith Human Rights Council resolution 51/4,18 and encourages Member States to be \nmindful of the recommendations contained therein;  \n__________________ \n \n17  See Official Records of the General Assembly, Seventy-seventh Session, Supplement No. 53A, \n(A/77/53/Add.1), chap. III, sect. A, resolution 51/4. \n \n18  See A/79/167. \n\nA/RES/79/147 \nFollow-up to the Second World Assembly on Ageing\n \n24-24133\n6/12 \n \n \n15. Invites Member States to continue to share their national experiences in \ndeveloping and implementing policies and programmes aimed at strengthening the \npromotion and protection of the human rights of older persons;  \n \n16. Encourages Governments to actively address, through national, regional \nand international efforts, issues that affect older persons and to ensure that the social \nintegration of older persons and the promotion and protection of their rights form an \nintegral part of development policies at all levels;  \n \n17. Encourages Member States to create an enabling environment for the \nequal, full, effective and meaningful participation of older persons in political, social, \neconomic and cultural life, while taking into account the diversity of situation of older \npersons and responding to population ageing as well as to multiple forms of \ndiscrimination resulting from ageism and other inequality throughout the life course; \n \n18. Also \nencourages \nMember \nStates \nto \nadopt \nand \nimplement \nnon-discriminatory policies, legislation and regulations, to systematically review and \namend these, where appropriate, if they discriminate against older persons, especially \non the basis of age, and to take appropriate measures to prevent discrimination against \nolder persons in, inter alia, employment, social protection and the provision of social, \nhealthcare and long-term care services;  \n \n19. Calls upon Member States to promote, in accordance with their national \npriorities, equitable and affordable access to sustainable basic physical and social \ninfrastructure for all, without discrimination, including affordable serviced land, \nhousing, modern and renewable energy, safe drinking water and sanitation, safe, \nnutritious and adequate food, waste disposal, sustainable mobility, healthcare services \nand family planning, education, culture and information and communications \ntechnologies, and to ensure that these services are responsive to the rights and needs \nof older persons, while recognizing that planning for and providing opportunities for \nmaking cities inclusive of older persons\u2019 economic and social participation is an \nimportant dimension of the construction of sustainable cities;  \n \n20. Recognizes that the risk of poverty increases with old age in several ways, \nand that the pandemic has had a negative impact on the financial security of older \npersons, including older widows, and in this regard calls upon Member States to \nenable people to reach old age in better economic conditions by, inter alia, addressing \nbarriers in labour markets and inadequate social protection systems and combating \nelder abuse and neglect as well as the adverse impact of all forms of discrimination \nand inequalities experienced by older persons, especially older women;  \n \n21. Encourages Member States to take into account the multidimensional \nnature of the vulnerability of older persons to poverty and economic insecurity, \nincluding through the promotion of good health, care and well-being, in their \nimplementation of the Sustainable Development Goals at the national level;  \n \n22. \nEncourages Governments to pay greater attention to building capacity to \neradicate poverty among older persons, in particular older women and older persons with \ndisabilities, by mainstreaming ageing issues into poverty eradication measures, women\u2019s \nempowerment strategies and national development plans, and to include both ageing-\nspecific policies and ageing-mainstreaming efforts in their national strategies;  \n \n23. Encourages Member States to consider expanding, in accordance with \ndomestic legislation and policies, the reach of sustainable pension schemes, including \nbut not limited to strategies such as social pensions, and increasing their benefits, \nwith a view to ensuring income security in old age;  \n \n24. Also encourages Member States to develop and implement long-term care \nstrategies, as well as to conduct research on good practices of care strategies, \n\nFollow-up to the Second World Assembly on Ageing \nA/RES/79/147\n \n7/12\n24-24133 \n \nrecognizing and supporting both paid and unpaid care work for the benefit of older \npersons, and to further promote long-term care as a positive social and economic \ninvestment and a source of employment expansion;  \n \n25. Further encourages Member States to promote terms and conditions of \ncare work guided by International Labour Organization standards for all care workers, \nincluding but not limited to migrants, and to adopt measures to tackle the gender and \nage stereotypes for care work;  \n \n26. \nEncourages Member States to strengthen their efforts to develop national \ncapacities to address their national implementation priorities identified during the review \nand appraisal of the Madrid Plan of Action by considering and devising strategies that \ntake into account the entirety of the human life course and foster intergenerational \nsolidarity, the strengthening of institutional mechanisms, research, data collection and \nanalysis and the training of necessary personnel in the field of ageing;  \n \n27. Recommends that Member States increase efforts to raise awareness of the \nMadrid Plan of Action and identify key priority areas for its implementation, \nincluding empowering older persons and promoting their rights, bearing in mind the \ncrucial importance of intergenerational family interdependence, solidarity and \nreciprocity for social development, raising awareness of ageing issues and building \nnational capacities, as well as promoting and supporting initiatives to advance a \npositive public image of older persons and their multiple contributions to their \nfamilies, communities and societies and working with the regional commissions, as \nneeded, and enlisting the help of the Department of Global Communications of the \nSecretariat in seeking increased attention for ageing issues;  \n \n28. Encourages Governments that have not done so to designate focal points \nfor handling the follow-up of national plans of action on ageing, and also encourages \nGovernments to strengthen existing networks of national focal points on ageing;  \n \n29. Invites Governments to conduct their ageing-related policies through \ninclusive and participatory consultations with relevant stakeholders and social \ndevelopment partners, in the interest of developing effective policies that create \nnational policy ownership and consensus-building;  \n \n30. Recommends that Governments be inclusive in involving older persons \nand their organizations in the formulation, implementation and monitoring of policies \nand programmes that affect them, including through simple consultative mechanisms \nto co-research or co-design such policies and programmes with or by older persons \nand to take due account of involving those who experience multiple and intersecting \nforms of discrimination and are particularly vulnerable to high incidences of poverty \nand social exclusion;  \n \n31. Encourages Member States to involve older persons, where appropriate, \nin relevant international discussions, such as in the General Assembly and other \nprocesses held under the auspices of the United Nations, by considering incorporating \nthem in their national delegations;  \n \n32. Recommends that Member States enhance their capacity to more \neffectively collect age-disaggregated data, statistics and qualitative information, \ndisaggregated also, when necessary, by other relevant factors, including sex and \ndisability, in order to improve assessment of the situation of older persons, recognizes \nthat the data revolution presents new opportunities and challenges for the use of new \ndata to help with the measurement of progress in the implementation of the 2030 \nAgenda, in particular its aspects of relevance to older persons, and to ensure that no \none is left behind, and in this regard recalls the establishment by the Statistical \nCommission of the Titchfield Group on Ageing-Related Statistics and Age-\nDisaggregated Data and the consideration of its work;  \n\nA/RES/79/147 \nFollow-up to the Second World Assembly on Ageing\n \n24-24133\n8/12 \n \n \n33. Encourages Member States to enhance the capacity of national statistical \noffices to identify and address existing deficits in data on ageing, to contribute to the \neffective follow-up on the implementation of international agreed commitments, \nincluding in the 2030 Agenda for Sustainable Development;  \n \n34. Encourages States parties to existing international human rights \ninstruments, where appropriate, to address the situation of older persons more \nexplicitly in their reports, and encourages treaty body monitoring mechanisms and \nspecial procedure mandate holders to pay due regard to the situation of older persons \nin their dialogue with Member States, particularly in their concluding observations \nand reports, respectively;  \n \n35. Recognizes the importance of strengthening intergenerational partnerships \nand solidarity, and in this regard calls upon Member States to promote opportunities \nfor voluntary, constructive and regular interaction between young people and older \ngenerations in the family, the workplace and society at large;  \n \n36. Also recognizes the crucial and evolving role played by families in \ncontributing to the well-being of their members and communities at large, and \nencourages Member States to implement family-oriented and family-friendly policies \nthat support them, including relevant social protection programmes;  \n \n37. Encourages Member States to adopt social policies that promote the \ndevelopment of community services for older persons, taking into account the \npsychological and physical aspects of ageing and the special needs of older women \nand older persons with disabilities;  \n \n38. Also encourages Member States to ensure that older persons have access \nto information about their rights so as to enable them to participate fully and justly in \ntheir societies and to claim full enjoyment of all human rights;  \n \n39. Calls upon Member States to develop their national capacity for \nmonitoring and enforcing the rights of older persons, in consultation with all sectors \nof society, including organizations of older persons, through, inter alia, national \ninstitutions for the promotion and protection of human rights, where applicable;  \n \n40. Also calls upon Member States to strengthen and incorporate a gender and \ndisability perspective into all policy actions on ageing, as well as to address and \neliminate discrimination on the basis of age, sex or disability, and recommends that \nMember States engage with all sectors of society, in particular with relevant \norganizations with an interest in the matter, including organizations of older persons, \nwomen and persons with disabilities, in changing negative stereotypes about older \npersons, in particular older women and older persons with disabilities, and promote \npositive narratives of all older persons;  \n \n41. Acknowledges that universal health coverage implies that all people, \nincluding older persons, have access, without discrimination, to every country\u2019s \ndetermined sets of needed promotive, preventive, curative and rehabilitative basic \nhealth services and essential, safe, affordable, effective and quality medicines, while \nensuring that the use of such services does not expose older persons to financial \nhardship, with a special emphasis on the poor, vulnerable and marginalized;  \n \n42. Emphasizes the urgent need to ensure the right of everyone to the \nenjoyment of the highest attainable standard of physical and mental health and to \nfacilitate the development of robust health systems and universal health coverage, \nencompassing universal, timely, affordable and equitable access to all health \ntechnologies, diagnostics, therapeutics, medicines and safe, quality and effective \nvaccines, especially during health emergencies, for all, in particular older persons, \n\nFollow-up to the Second World Assembly on Ageing \nA/RES/79/147\n \n9/12\n24-24133 \n \nincluding those who are in vulnerable situations, especially older women and older \npersons with disabilities; \n \n43. Urges Member States to develop, implement and evaluate policies and \nprogrammes that promote healthy and active ageing and the highest attainable \nstandard of health and well-being for older persons and to develop healthcare for older \npersons as part of primary care in the existing health systems;  \n \n44. Recognizes the importance of training, education, lifelong learning and \ncapacity-building of the health workforce, including paid care workers and unpaid \ncaregivers, for home-based care;  \n \n45. Stresses the need to close all digital divides, including, inter alia, both \nbetween and within countries, the rural-urban digital divide, the gender digital divide, \nand between youth and older persons, which can be experienced by older persons by \nproviding universal and affordable access to and use of information and \ncommunications technologies, including new technologies and the meaningful use of \ndigitally enabled services, in line with the 2030 Agenda for Sustainable Development, \nto people throughout their life course without discrimination based on age or other \nforms of discrimination, and welcomes efforts by the United Nations to assist Member \nStates, upon their request, in achieving this;  \n \n46. Encourages Member States to promote digital literacy with a special focus \non enhancing digital skills and competencies of older persons without discrimination \nof any kind, including socioeconomic status, education level, race and/or ethnicity, \ngender and disability as well as language barriers, by taking into account national and \nregional contexts;  \n \n47. Also encourages Member States to ensure that the principle of \nnon-discrimination on the basis of age is incorporated and upheld in health and other \npolicies and programmes and that the implementation of such policies and \nprogrammes is regularly monitored;  \n \n48. Urges Member States to strengthen intersectoral policy frameworks and \ninstitutional mechanisms, as appropriate, for the integrated management of the \nprevention and control of non-communicable diseases, including health promotion, \nhealthcare services and social welfare services, in order to address the needs of older \npersons;  \n \n49. Encourages Member States to provide services and support to older \npersons, including grandparents, who have assumed responsibility for children who \nwere abandoned or whose parents are deceased, have migrated, have been displaced, \nincluding in the context of humanitarian emergencies, or are otherwise unable to care \nfor their dependants;  \n \n50. Calls upon Member States to address the issue of the well-being of and \nadequate healthcare services for older persons, as well as any cases of neglect, abuse \nand violence against older persons, in particular older women, by designing and \nimplementing more effective prevention strategies and stronger laws and by \ndeveloping coherent and comprehensive policy frameworks to address these problems \nand their underlying factors;  \n \n51. Urges Member States to increase the resilience of older persons and ensure \nthat they are able to achieve and maintain financial security during emergencies, \nthrough, inter alia, addressing the digital gap that currently affects many older persons \nand protecting them from violence and abuse in digital contexts; strengthening legal \nand social protection and adopting adequate employment measures; providing better \ncare and support services, promoting long-term care and support at home, in the \ncommunity and in institutional settings, with a view to ensuring their empowerment, \n\nA/RES/79/147 \nFollow-up to the Second World Assembly on Ageing\n \n24-24133\n10/12 \n \nas well as their autonomy and independence; adopting a people-centred, gender-\nsensitive comprehensive and integrated approach, with full respect for human rights, \nto healthcare to improve the well-being of older persons, including mental healthcare, \nnon-communicable disease management and adult immunization efforts; and \ndeveloping national vaccination plans that give priority to older persons and are \nguided by principles of equality and social justice;  \n \n52. Calls upon Member States to take concrete measures, in accordance with \nnational circumstances and, as appropriate, international humanitarian law, to further \nprotect and assist older persons in emergency situations, and invites all States to \npromote a culture of protection, taking into account the particular needs of older \npersons, in accordance with the Madrid Plan of Action and the Sendai Framework for \nDisaster Risk Reduction 2015\u20132030 19  by, inter alia, including older persons in \ndisaster risk reduction and national and local emergency planning and response \nframeworks, collecting and using data disaggregated by age, sex and disability for \npolicy design and implementation, as well as carrying out risk and vulnerabilities \nanalyses of older women in humanitarian emergencies with a view to minimizing the \nrisk to older women of all forms of violence in such emergencies;  \n \n53. Encourages Member States to integrate lessons learned from the pandemic \nwith regard to older persons in order to combat ageism, protect the human rights of \nolder persons and strengthen existing policies and laws to address all forms of \ndiscrimination in all areas of their life, as well as to take concrete measures that \nintegrate age- and gender-responsive preparedness plans into relevant policy areas at \nthe national and international levels and ensure that older persons and their \nrepresentatives are consulted in planning and decision-making processes that affect \nthem, on an equal basis with others, in order to address their specific needs;  \n \n54. Encourages national and local governments to improve access to \naffordable housing, particularly for older persons, through integrated housing policies \nand social protection measures, and to provide a range of support services that \npromote their dignity, autonomy and independence, including by addressing legal and \npolicy barriers to equal and non-discriminatory access to adequate housing for them;  \n \n55. Calls upon Member States to ensure access to justice for older persons, \nwhose right to adequate housing may have been violated due to discrimination based \non age;  \n \n56. Encourages Member States to adopt measures to tackle homelessness and \nto protect older persons from arbitrary forced eviction, as well as to take all \nappropriate measures to ensure that adequate alternative housing or relocation is \navailable, especially in situations of emergencies;  \n \n57. Stresses that, in complementing national development efforts, enhanced \ninternational cooperation, in particular North-South cooperation, which is \ncomplemented by South-South and triangular regional and international cooperation, \nis essential to support developing countries in implementing the Madrid Plan of \nAction, while recognizing the importance of such assistance as well as the provision \nof financial assistance;  \n \n58. \nEncourages Member States to establish or to strengthen strategic approaches \nand policy options in relation to the physical and mental health of older persons in the \nlight of new and emerging disease patterns, notably non-communicable diseases, as well \nas in relation to increased life expectancy, with particular attention to promoting good \nhealth and addressing health needs across a care continuum, including prevention, \n__________________ \n \n19  Resolution 69/283, annex II. \n\nFollow-up to the Second World Assembly on Ageing \nA/RES/79/147\n \n11/12\n24-24133 \n \ndetection and diagnosis, management and rehabilitation, treatment and palliative care, \nwith the aim of achieving comprehensive healthcare coverage for older persons;  \n \n59. Encourages the international community, including international and \nbilateral donors, to enhance international cooperation to support national efforts to \neradicate poverty, in keeping with internationally agreed goals, in order to achieve \nsustainable and adequate social and economic support for older persons, while \nbearing in mind that countries have the primary responsibility for their own economic \nand social development;  \n \n60. Also encourages the international community to support national efforts \nto forge stronger partnerships with civil society, including organizations of older \npersons, academia, research foundations, faith-based organizations, community-\nbased organizations, including caregivers, and the private sector, in an effort to help \nto build capacity on ageing issues;  \n \n61. Encourages the international community and the relevant agencies of the \nUnited Nations system, within their respective mandates, to support national efforts \nto provide funding for research and data-collection initiatives on ageing, as \nappropriate, in order to better understand the challenges and opportunities presented \nby population ageing and to provide policymakers with more accurate and more \nspecific information with regard to a gender perspective on ageing, as well as to \ninclude indicators that provide an evidence base for the equitable delivery and \neffective monitoring of the implementation of the Sustainable Development Goals, \nthe New Urban Agenda 20 and national policymaking, as well as to gain a better \nunderstanding of how to promote ageing in a way that is not adversely affected by \nrapid urbanization and gentrification;  \n \n62. Recognizes the important role of various international and regional \norganizations that deal with training, capacity-building, policy design and monitoring \nat the national and regional levels in promoting and facilitating the implementation \nof the Madrid Plan of Action, and acknowledges the work that is undertaken in various \nparts of the world, through the regional commissions and regional initiatives, as well \nas the work of institutes such as the International Institute on Ageing in Malta and the \nEuropean Centre for Social Welfare Policy and Research in Vienna;  \n \n63. Takes note with appreciation of the work of the Inter-Agency Group on \nAgeing, a network of United Nations entities that exchange information and integrate \nageing into their work programmes on the implementation of the 2030 Agenda;  \n \n64. Requests the focal point on ageing of the United Nations system, the \nProgramme on Ageing of the Department of Economic and Social Affairs of the \nSecretariat, to continue to enhance its collaboration with the focal points of the \nregional commissions, funds and programmes, and recommends that Member States \nreaffirm the roles of focal points within the United Nations system, increase technical \ncooperation efforts, consider expanding the role of the regional commissions on \nageing issues and continue to provide resources for those efforts, facilitate the \ncoordination of national and international non-governmental organizations on ageing \nand enhance cooperation with all relevant stakeholders, to promote ageing issues and \ndevelop partnerships in this regard;  \n \n65. Reiterates the need for additional capacity-building at the national level in \norder to promote and facilitate further implementation of the Madrid Plan of Action, \nas well as the results of its review and appraisal cycle, and in this regard encourages \nGovernments to support the United Nations trust fund for ageing so as to enable the \n__________________ \n \n20  Resolution 71/256, annex. \n\nA/RES/79/147 \nFollow-up to the Second World Assembly on Ageing\n \n24-24133\n12/12 \n \nDepartment of Economic and Social Affairs to provide expanded assistance to \ncountries, upon their request;  \n \n66. Requests the United Nations system to strengthen its capacity to support, \nin an efficient and coordinated manner, national implementation of the Madrid Plan \nof Action, where appropriate;  \n \n67. Requests relevant entities of the United Nations system, including the \nUnited Nations Entity for Gender Equality and the Empowerment of Women \n(UN-Women), to ensure that the situation of older women is mainstreamed and \nincorporated across their work and to support, in accordance with their respective \nmandates, the implementation of the 2030 Agenda, in particular its aspects of \nrelevance to older persons, including gender equality and the empowerment of all \nwomen and girls through, inter alia, the elimination of all forms of discrimination and \nviolence against women;  \n \n68. Invites relevant entities of the United Nations system, including \nUN-Women, the United Nations Development Programme, the United Nations \nPopulation Fund, the International Labour Organization, the United Nations Human \nSettlements Programme (UN-Habitat), the Food and Agriculture Organization of the \nUnited Nations, the World Food Programme, the International Fund for Agricultural \nDevelopment, the Office of the United Nations High Commissioner for Refugees and \nthe World Health Organization, among others, as well as the International \nOrganization for Migration, to include in reports to their respective governing bodies \nrelevant information on efforts made by Member States and the international \ncommunity on issues of relevance to older persons, including their social inclusion;  \n \n69. Decides to formally conclude the mandate of the Open-ended Working \nGroup on Ageing, established by the General Assembly in its resolution 65/182, and \nnotes with appreciation the completed work of the Working Group, in view of the \nadoption by the Working Group of its decision 14/1,21 and recognizes the positive \ncontributions of Member States, as well as relevant bodies and organizations of the \nUnited Nations system, including relevant human rights mandate holders and treaty \nbodies and the regional commissions, as well as national human rights institutions, \nintergovernmental and relevant non-governmental organizations with an interest in the \nmatter and invited panellists, during the 14 working sessions of the Working Group;  \n \n70. Invites the Independent Expert to address and engage in an interactive \ndialogue with the General Assembly at its eightieth session under the agenda item \nentitled \u201cSocial development\u201d;  \n \n71. Requests the Secretary-General to submit to the General Assembly at its \neightieth session a report on the implementation of the present resolution. \n \n53rd plenary meeting \n17 December 2024  \n \n__________________ \n \n21  A/AC.278/2024/2, para. 28. \n",
  "paragraphs": {
    "1": "Reaffirms the Political Declaration and the Madrid International Plan of Action on Ageing, 2002;",
    "2": "Calls upon all States and the international community to cooperate, support and participate in the global efforts towards an age-inclusive implementation of the 2030 Agenda for Sustainable Development and to mobilize all necessary resources and support in that regard, according to national plans and strategies, including through an integrated and multifaceted approach to improving the well- being of older persons, and in this regard encourages Member States to seize this opportunity to take into account issues of relevance to older persons in their efforts to promote the attainment of the Sustainable Development Goals;",
    "3": "Encourages Member States to address the situation of older persons in their voluntary national reviews presented at the high-level political forum on sustainable development;",
    "4": "Also encourages Member States to accelerate their efforts to mainstream the linkages between population ageing and sustainable development into national policies and programmes across all levels of government, where appropriate, and to link ageing to frameworks for social and economic development and human rights;",
    "5": "Recognizes that the major challenges faced by older persons undermine their social, economic and cultural participation; Follow-up to the Second World Assembly on Ageing A/RES/79/147 5/12 24-24133",
    "6": "Emphasizes the need to take effective measures against ageism and to view older persons as active contributors to society and not as passive receivers of care and assistance and an impending burden on welfare systems and economies, while promoting and protecting their human rights;",
    "7": "Encourages Member States to intensify efforts towards identifying ageing as an opportunity, and recognizes that older persons make substantial contributions to sustainable development efforts, including through their active participation in society;",
    "8": "Reaffirms that older persons should be able to seek and develop opportunities for service to the community and to serve as volunteers, while recognizing that older persons can benefit from volunteering both as recipients and as providers and can significantly contribute thereto, and emphasizes that their active participation in those activities fosters their physical and mental well-being, helping older persons to maintain their independence and enhance their quality of life;",
    "9": "Recognizes the role of intergenerational relations in promoting social cohesion and influencing an individual\u2019s life course through the transfer of experiences, knowledge, values and traditions, and resources, through mutual support;",
    "10": "Calls upon Member States to promote intergenerational knowledge transfer in the workplace to harness the potential of different generations and better adapt to changes in labour markets;",
    "11": "Acknowledges that the opportunity for future generations to thrive in prosperity and achieve sustainable development must be ensured, including by eliminating the intergenerational transmission of poverty and hunger, inequality and injustice, and acknowledging the special challenges faced by developing countries;",
    "12": "Recognizes the challenges related to the enjoyment of all human rights that older persons face in different areas and that those challenges require in-depth analysis and action to address protection gaps, and calls upon all States to promote and ensure the full realization of all human rights and fundamental freedoms for older persons, including by progressively taking measures to combat age discrimination, neglect, abuse and violence, as well as social isolation and loneliness, to provide social protection, access to food and housing, healthcare services, employment, information and communications technologies, including new technologies, assistive technologies, legal capacity and access to justice and to address issues related to social integration and gender inequality through mainstreaming the rights of older persons into sustainable development strategies, urban policies and poverty reduction strategies, bearing in mind the crucial importance of intergenerational solidarity for social development;",
    "13": "Takes note with appreciation of the work of the Independent Expert on the enjoyment of all human rights by older persons and the renewal of the mandate at the fifty-first session of the Human Rights Council;17",
    "14": "Takes note of the report of the Independent Expert issued in accordance with Human Rights Council resolution 51/4,18 and encourages Member States to be mindful of the recommendations contained therein; __________________ 17 See Official Records of the General Assembly, Seventy-seventh Session, Supplement No. 53A, (A/77/53/Add.1), chap. III, sect. A, resolution 51/4. 18 See A/79/167. A/RES/79/147 Follow-up to the Second World Assembly on Ageing 24-24133 6/12",
    "15": "Invites Member States to continue to share their national experiences in developing and implementing policies and programmes aimed at strengthening the promotion and protection of the human rights of older persons;",
    "16": "Encourages Governments to actively address, through national, regional and international efforts, issues that affect older persons and to ensure that the social integration of older persons and the promotion and protection of their rights form an integral part of development policies at all levels;",
    "17": "Encourages Member States to create an enabling environment for the equal, full, effective and meaningful participation of older persons in political, social, economic and cultural life, while taking into account the diversity of situation of older persons and responding to population ageing as well as to multiple forms of discrimination resulting from ageism and other inequality throughout the life course;",
    "18": "Also encourages Member States to adopt and implement non-discriminatory policies, legislation and regulations, to systematically review and amend these, where appropriate, if they discriminate against older persons, especially on the basis of age, and to take appropriate measures to prevent discrimination against older persons in, inter alia, employment, social protection and the provision of social, healthcare and long-term care services;",
    "19": "Calls upon Member States to promote, in accordance with their national priorities, equitable and affordable access to sustainable basic physical and social infrastructure for all, without discrimination, including affordable serviced land, housing, modern and renewable energy, safe drinking water and sanitation, safe, nutritious and adequate food, waste disposal, sustainable mobility, healthcare services and family planning, education, culture and information and communications technologies, and to ensure that these services are responsive to the rights and needs of older persons, while recognizing that planning for and providing opportunities for making cities inclusive of older persons\u2019 economic and social participation is an important dimension of the construction of sustainable cities;",
    "20": "Recognizes that the risk of poverty increases with old age in several ways, and that the pandemic has had a negative impact on the financial security of older persons, including older widows, and in this regard calls upon Member States to enable people to reach old age in better economic conditions by, inter alia, addressing barriers in labour markets and inadequate social protection systems and combating elder abuse and neglect as well as the adverse impact of all forms of discrimination and inequalities experienced by older persons, especially older women;",
    "21": "Encourages Member States to take into account the multidimensional nature of the vulnerability of older persons to poverty and economic insecurity, including through the promotion of good health, care and well-being, in their implementation of the Sustainable Development Goals at the national level;",
    "22": "Encourages Governments to pay greater attention to building capacity to eradicate poverty among older persons, in particular older women and older persons with disabilities, by mainstreaming ageing issues into poverty eradication measures, women\u2019s empowerment strategies and national development plans, and to include both ageing- specific policies and ageing-mainstreaming efforts in their national strategies;",
    "23": "Encourages Member States to consider expanding, in accordance with domestic legislation and policies, the reach of sustainable pension schemes, including but not limited to strategies such as social pensions, and increasing their benefits, with a view to ensuring income security in old age;",
    "24": "Also encourages Member States to develop and implement long-term care strategies, as well as to conduct research on good practices of care strategies, Follow-up to the Second World Assembly on Ageing A/RES/79/147 7/12 24-24133 recognizing and supporting both paid and unpaid care work for the benefit of older persons, and to further promote long-term care as a positive social and economic investment and a source of employment expansion;",
    "25": "Further encourages Member States to promote terms and conditions of care work guided by International Labour Organization standards for all care workers, including but not limited to migrants, and to adopt measures to tackle the gender and age stereotypes for care work;",
    "26": "Encourages Member States to strengthen their efforts to develop national capacities to address their national implementation priorities identified during the review and appraisal of the Madrid Plan of Action by considering and devising strategies that take into account the entirety of the human life course and foster intergenerational solidarity, the strengthening of institutional mechanisms, research, data collection and analysis and the training of necessary personnel in the field of ageing;",
    "27": "Recommends that Member States increase efforts to raise awareness of the Madrid Plan of Action and identify key priority areas for its implementation, including empowering older persons and promoting their rights, bearing in mind the crucial importance of intergenerational family interdependence, solidarity and reciprocity for social development, raising awareness of ageing issues and building national capacities, as well as promoting and supporting initiatives to advance a positive public image of older persons and their multiple contributions to their families, communities and societies and working with the regional commissions, as needed, and enlisting the help of the Department of Global Communications of the Secretariat in seeking increased attention for ageing issues;",
    "28": "Encourages Governments that have not done so to designate focal points for handling the follow-up of national plans of action on ageing, and also encourages Governments to strengthen existing networks of national focal points on ageing;",
    "29": "Invites Governments to conduct their ageing-related policies through inclusive and participatory consultations with relevant stakeholders and social development partners, in the interest of developing effective policies that create national policy ownership and consensus-building;",
    "30": "Recommends that Governments be inclusive in involving older persons and their organizations in the formulation, implementation and monitoring of policies and programmes that affect them, including through simple consultative mechanisms to co-research or co-design such policies and programmes with or by older persons and to take due account of involving those who experience multiple and intersecting forms of discrimination and are particularly vulnerable to high incidences of poverty and social exclusion;",
    "31": "Encourages Member States to involve older persons, where appropriate, in relevant international discussions, such as in the General Assembly and other processes held under the auspices of the United Nations, by considering incorporating them in their national delegations;",
    "32": "Recommends that Member States enhance their capacity to more effectively collect age-disaggregated data, statistics and qualitative information, disaggregated also, when necessary, by other relevant factors, including sex and disability, in order to improve assessment of the situation of older persons, recognizes that the data revolution presents new opportunities and challenges for the use of new data to help with the measurement of progress in the implementation of the 2030 Agenda, in particular its aspects of relevance to older persons, and to ensure that no one is left behind, and in this regard recalls the establishment by the Statistical Commission of the Titchfield Group on Ageing-Related Statistics and Age- Disaggregated Data and the consideration of its work; A/RES/79/147 Follow-up to the Second World Assembly on Ageing 24-24133 8/12",
    "33": "Encourages Member States to enhance the capacity of national statistical offices to identify and address existing deficits in data on ageing, to contribute to the effective follow-up on the implementation of international agreed commitments, including in the 2030 Agenda for Sustainable Development;",
    "34": "Encourages States parties to existing international human rights instruments, where appropriate, to address the situation of older persons more explicitly in their reports, and encourages treaty body monitoring mechanisms and special procedure mandate holders to pay due regard to the situation of older persons in their dialogue with Member States, particularly in their concluding observations and reports, respectively;",
    "35": "Recognizes the importance of strengthening intergenerational partnerships and solidarity, and in this regard calls upon Member States to promote opportunities for voluntary, constructive and regular interaction between young people and older generations in the family, the workplace and society at large;",
    "36": "Also recognizes the crucial and evolving role played by families in contributing to the well-being of their members and communities at large, and encourages Member States to implement family-oriented and family-friendly policies that support them, including relevant social protection programmes;",
    "37": "Encourages Member States to adopt social policies that promote the development of community services for older persons, taking into account the psychological and physical aspects of ageing and the special needs of older women and older persons with disabilities;",
    "38": "Also encourages Member States to ensure that older persons have access to information about their rights so as to enable them to participate fully and justly in their societies and to claim full enjoyment of all human rights;",
    "39": "Calls upon Member States to develop their national capacity for monitoring and enforcing the rights of older persons, in consultation with all sectors of society, including organizations of older persons, through, inter alia, national institutions for the promotion and protection of human rights, where applicable;",
    "40": "Also calls upon Member States to strengthen and incorporate a gender and disability perspective into all policy actions on ageing, as well as to address and eliminate discrimination on the basis of age, sex or disability, and recommends that Member States engage with all sectors of society, in particular with relevant organizations with an interest in the matter, including organizations of older persons, women and persons with disabilities, in changing negative stereotypes about older persons, in particular older women and older persons with disabilities, and promote positive narratives of all older persons;",
    "41": "Acknowledges that universal health coverage implies that all people, including older persons, have access, without discrimination, to every country\u2019s determined sets of needed promotive, preventive, curative and rehabilitative basic health services and essential, safe, affordable, effective and quality medicines, while ensuring that the use of such services does not expose older persons to financial hardship, with a special emphasis on the poor, vulnerable and marginalized;",
    "42": "Emphasizes the urgent need to ensure the right of everyone to the enjoyment of the highest attainable standard of physical and mental health and to facilitate the development of robust health systems and universal health coverage, encompassing universal, timely, affordable and equitable access to all health technologies, diagnostics, therapeutics, medicines and safe, quality and effective vaccines, especially during health emergencies, for all, in particular older persons, Follow-up to the Second World Assembly on Ageing A/RES/79/147 9/12 24-24133 including those who are in vulnerable situations, especially older women and older persons with disabilities;",
    "43": "Urges Member States to develop, implement and evaluate policies and programmes that promote healthy and active ageing and the highest attainable standard of health and well-being for older persons and to develop healthcare for older persons as part of primary care in the existing health systems;",
    "44": "Recognizes the importance of training, education, lifelong learning and capacity-building of the health workforce, including paid care workers and unpaid caregivers, for home-based care;",
    "45": "Stresses the need to close all digital divides, including, inter alia, both between and within countries, the rural-urban digital divide, the gender digital divide, and between youth and older persons, which can be experienced by older persons by providing universal and affordable access to and use of information and communications technologies, including new technologies and the meaningful use of digitally enabled services, in line with the 2030 Agenda for Sustainable Development, to people throughout their life course without discrimination based on age or other forms of discrimination, and welcomes efforts by the United Nations to assist Member States, upon their request, in achieving this;",
    "46": "Encourages Member States to promote digital literacy with a special focus on enhancing digital skills and competencies of older persons without discrimination of any kind, including socioeconomic status, education level, race and/or ethnicity, gender and disability as well as language barriers, by taking into account national and regional contexts;",
    "47": "Also encourages Member States to ensure that the principle of non-discrimination on the basis of age is incorporated and upheld in health and other policies and programmes and that the implementation of such policies and programmes is regularly monitored;",
    "48": "Urges Member States to strengthen intersectoral policy frameworks and institutional mechanisms, as appropriate, for the integrated management of the prevention and control of non-communicable diseases, including health promotion, healthcare services and social welfare services, in order to address the needs of older persons;",
    "49": "Encourages Member States to provide services and support to older persons, including grandparents, who have assumed responsibility for children who were abandoned or whose parents are deceased, have migrated, have been displaced, including in the context of humanitarian emergencies, or are otherwise unable to care for their dependants;",
    "50": "Calls upon Member States to address the issue of the well-being of and adequate healthcare services for older persons, as well as any cases of neglect, abuse and violence against older persons, in particular older women, by designing and implementing more effective prevention strategies and stronger laws and by developing coherent and comprehensive policy frameworks to address these problems and their underlying factors;",
    "51": "Urges Member States to increase the resilience of older persons and ensure that they are able to achieve and maintain financial security during emergencies, through, inter alia, addressing the digital gap that currently affects many older persons and protecting them from violence and abuse in digital contexts; strengthening legal and social protection and adopting adequate employment measures; providing better care and support services, promoting long-term care and support at home, in the community and in institutional settings, with a view to ensuring their empowerment, A/RES/79/147 Follow-up to the Second World Assembly on Ageing 24-24133 10/12 as well as their autonomy and independence; adopting a people-centred, gender- sensitive comprehensive and integrated approach, with full respect for human rights, to healthcare to improve the well-being of older persons, including mental healthcare, non-communicable disease management and adult immunization efforts; and developing national vaccination plans that give priority to older persons and are guided by principles of equality and social justice;",
    "52": "Calls upon Member States to take concrete measures, in accordance with national circumstances and, as appropriate, international humanitarian law, to further protect and assist older persons in emergency situations, and invites all States to promote a culture of protection, taking into account the particular needs of older persons, in accordance with the Madrid Plan of Action and the Sendai Framework for Disaster Risk Reduction 2015\u20132030 19 by, inter alia, including older persons in disaster risk reduction and national and local emergency planning and response frameworks, collecting and using data disaggregated by age, sex and disability for policy design and implementation, as well as carrying out risk and vulnerabilities analyses of older women in humanitarian emergencies with a view to minimizing the risk to older women of all forms of violence in such emergencies;",
    "53": "Encourages Member States to integrate lessons learned from the pandemic with regard to older persons in order to combat ageism, protect the human rights of older persons and strengthen existing policies and laws to address all forms of discrimination in all areas of their life, as well as to take concrete measures that integrate age- and gender-responsive preparedness plans into relevant policy areas at the national and international levels and ensure that older persons and their representatives are consulted in planning and decision-making processes that affect them, on an equal basis with others, in order to address their specific needs;",
    "54": "Encourages national and local governments to improve access to affordable housing, particularly for older persons, through integrated housing policies and social protection measures, and to provide a range of support services that promote their dignity, autonomy and independence, including by addressing legal and policy barriers to equal and non-discriminatory access to adequate housing for them;",
    "55": "Calls upon Member States to ensure access to justice for older persons, whose right to adequate housing may have been violated due to discrimination based on age;",
    "56": "Encourages Member States to adopt measures to tackle homelessness and to protect older persons from arbitrary forced eviction, as well as to take all appropriate measures to ensure that adequate alternative housing or relocation is available, especially in situations of emergencies;",
    "57": "Stresses that, in complementing national development efforts, enhanced international cooperation, in particular North-South cooperation, which is complemented by South-South and triangular regional and international cooperation, is essential to support developing countries in implementing the Madrid Plan of Action, while recognizing the importance of such assistance as well as the provision of financial assistance;",
    "58": "Encourages Member States to establish or to strengthen strategic approaches and policy options in relation to the physical and mental health of older persons in the light of new and emerging disease patterns, notably non-communicable diseases, as well as in relation to increased life expectancy, with particular attention to promoting good health and addressing health needs across a care continuum, including prevention, __________________ 19 Resolution 69/283, annex II. Follow-up to the Second World Assembly on Ageing A/RES/79/147 11/12 24-24133 detection and diagnosis, management and rehabilitation, treatment and palliative care, with the aim of achieving comprehensive healthcare coverage for older persons;",
    "59": "Encourages the international community, including international and bilateral donors, to enhance international cooperation to support national efforts to eradicate poverty, in keeping with internationally agreed goals, in order to achieve sustainable and adequate social and economic support for older persons, while bearing in mind that countries have the primary responsibility for their own economic and social development;",
    "60": "Also encourages the international community to support national efforts to forge stronger partnerships with civil society, including organizations of older persons, academia, research foundations, faith-based organizations, community- based organizations, including caregivers, and the private sector, in an effort to help to build capacity on ageing issues;",
    "61": "Encourages the international community and the relevant agencies of the United Nations system, within their respective mandates, to support national efforts to provide funding for research and data-collection initiatives on ageing, as appropriate, in order to better understand the challenges and opportunities presented by population ageing and to provide policymakers with more accurate and more specific information with regard to a gender perspective on ageing, as well as to include indicators that provide an evidence base for the equitable delivery and effective monitoring of the implementation of the Sustainable Development Goals, the New Urban Agenda 20 and national policymaking, as well as to gain a better understanding of how to promote ageing in a way that is not adversely affected by rapid urbanization and gentrification;",
    "62": "Recognizes the important role of various international and regional organizations that deal with training, capacity-building, policy design and monitoring at the national and regional levels in promoting and facilitating the implementation of the Madrid Plan of Action, and acknowledges the work that is undertaken in various parts of the world, through the regional commissions and regional initiatives, as well as the work of institutes such as the International Institute on Ageing in Malta and the European Centre for Social Welfare Policy and Research in Vienna;",
    "63": "Takes note with appreciation of the work of the Inter-Agency Group on Ageing, a network of United Nations entities that exchange information and integrate ageing into their work programmes on the implementation of the 2030 Agenda;",
    "64": "Requests the focal point on ageing of the United Nations system, the Programme on Ageing of the Department of Economic and Social Affairs of the Secretariat, to continue to enhance its collaboration with the focal points of the regional commissions, funds and programmes, and recommends that Member States reaffirm the roles of focal points within the United Nations system, increase technical cooperation efforts, consider expanding the role of the regional commissions on ageing issues and continue to provide resources for those efforts, facilitate the coordination of national and international non-governmental organizations on ageing and enhance cooperation with all relevant stakeholders, to promote ageing issues and develop partnerships in this regard;",
    "65": "Reiterates the need for additional capacity-building at the national level in order to promote and facilitate further implementation of the Madrid Plan of Action, as well as the results of its review and appraisal cycle, and in this regard encourages Governments to support the United Nations trust fund for ageing so as to enable the __________________ 20 Resolution 71/256, annex. A/RES/79/147 Follow-up to the Second World Assembly on Ageing 24-24133 12/12 Department of Economic and Social Affairs to provide expanded assistance to countries, upon their request;",
    "66": "Requests the United Nations system to strengthen its capacity to support, in an efficient and coordinated manner, national implementation of the Madrid Plan of Action, where appropriate;",
    "67": "Requests relevant entities of the United Nations system, including the United Nations Entity for Gender Equality and the Empowerment of Women (UN-Women), to ensure that the situation of older women is mainstreamed and incorporated across their work and to support, in accordance with their respective mandates, the implementation of the 2030 Agenda, in particular its aspects of relevance to older persons, including gender equality and the empowerment of all women and girls through, inter alia, the elimination of all forms of discrimination and violence against women;",
    "68": "Invites relevant entities of the United Nations system, including UN-Women, the United Nations Development Programme, the United Nations Population Fund, the International Labour Organization, the United Nations Human Settlements Programme (UN-Habitat), the Food and Agriculture Organization of the United Nations, the World Food Programme, the International Fund for Agricultural Development, the Office of the United Nations High Commissioner for Refugees and the World Health Organization, among others, as well as the International Organization for Migration, to include in reports to their respective governing bodies relevant information on efforts made by Member States and the international community on issues of relevance to older persons, including their social inclusion;",
    "69": "Decides to formally conclude the mandate of the Open-ended Working Group on Ageing, established by the General Assembly in its resolution 65/182, and notes with appreciation the completed work of the Working Group, in view of the adoption by the Working Group of its decision 14/1,21 and recognizes the positive contributions of Member States, as well as relevant bodies and organizations of the United Nations system, including relevant human rights mandate holders and treaty bodies and the regional commissions, as well as national human rights institutions, intergovernmental and relevant non-governmental organizations with an interest in the matter and invited panellists, during the 14 working sessions of the Working Group;",
    "70": "Invites the Independent Expert to address and engage in an interactive dialogue with the General Assembly at its eightieth session under the agenda item entitled \u201cSocial development\u201d;",
    "71": "Requests the Secretary-General to submit to the General Assembly at its eightieth session a report on the implementation of the present resolution. 53rd plenary meeting 17 December 2024 __________________ 21 A/AC.278/2024/2, para. 28."
  },
  "agenda_items": [
    "Item 26"
  ],
  "symbol_references": []
}