{
  "symbol": "A/RES/72/74",
  "filename": "A_RES_72_74.pdf",
  "title": "72/74. Cooperation between the United Nations and the Organization of Islamic Cooperation",
  "text": "United Nations \nA/RES/72/74\n \n \nGeneral Assembly \nDistr.: General \n13 December 2017 \n \n17-21827 (E)    151217 \n*1721827* \n \n \nSeventy-second session \nAgenda item 176 \n \n \n \n \n Resolution adopted by the General Assembly \non 6 December 2017 \n \n \n \n \n[without reference to a Main Committee (A/72/L.10 and A/72/L.10/Add.1)] \n \n \n \n72/74. Cooperation between the United Nations and the Organization of \nIslamic Cooperation  \n \n \n \nThe General Assembly,  \n \nRecalling its resolutions 37/4 of 22 October 1982, 38/4 of 28 October 1983, 39/7 \nof 8 November 1984, 40/4 of 25 October 1985, 41/3 of 16 October 1986, 42/4 of \n15 October 1987, 43/2 of 17 October 1988, 44/8 of 18 October 1989, 45/9 of \n25 October 1990, 46/13 of 28 October 1991, 47/18 of 23 November 1992, 48/24 of \n24 November 1993, 49/15 of 15 November 1994, 50/17 of 20 November 1995, 51/18 \nof 14 November 1996, 52/4 of 22 October 1997, 53/16 of 29 October 1998, 54/7 of \n25 October 1999, 55/9 of 30 October 2000, 56/47 of 7 December 2001, 57/42 of \n21 November 2002, 59/8 of 22 October 2004, 61/49 of 4 December 2006, 63/114 of \n5 December 2008, 65/140 of 16 December 2010, 67/264 of 17 May 2013 and 69/317 \nof 10 September 2015,  \n \nRecalling also its resolution 3369 (XXX) of 10 October 1975, by which it \ndecided to invite the Organization of the Islamic Conference 1 to participate in the \nsessions and the work of the General Assembly and of its subsidiary organs in the \ncapacity of observer,  \n \nWelcoming the efforts of the Organization of Islamic Cooperation, which have \nbeen undertaken in coordination with the United Nations and in full respect of the \nCharter of the United Nations, in strengthening its role in conflict prevention, \nconfidence-building, \npeacekeeping, \nconflict \nresolution \nand \npost-conflict \nrehabilitation, mediation and preventive diplomacy, including conflict situations \ninvolving Muslim communities,  \n \nNoting the adoption by the Islamic Summit Conference at its thirteenth session, \nheld in Istanbul, Turkey, on 14 and 15 April 2016, of the Organization of Islamic \nCooperation 2025 Programme of Action and the adoption on 14 March 2008 by the \n__________________ \n \n1  On 28 June 2011, the Organization of the Islamic Conference changed its name to the \nOrganization of Islamic Cooperation.  \n\nA/RES/72/74 \nCooperation between the United Nations and the Organization of Islamic Cooperation\n \n17-21827 \n2/7 \n \nIslamic Summit Conference at its eleventh session, held in Dakar on 13 and 14 March \n2008, of the amended Charter of the Organization of the Islamic Conference,  \n \nHaving considered the report of the Secretary-General on cooperation between \nthe United Nations and regional and other organizations,2  \n \nTaking into account the desire of the two organizations to continue to cooperate \nclosely in the political, economic, social, humanitarian, cultural and scientific fields \nand in their common search for solutions to global problems, such as questions \nrelating to international peace and security, disarmament, self-determination, the \npromotion of a culture of peace through dialogue and cooperation, decolonization, \nfundamental human rights, economic and social development, and combating \ninternational terrorism,  \n \nRecalling the Articles of the Charter of the United Nations that encourage \nactivities through regional cooperation for the promotion of the purposes and \nprinciples of the United Nations, and in this regard taking note of the holding on \n17 November 2016 of the Security Council briefing on the cooperation between the \nUnited Nations and the Organization of Islamic Cooperation 3 as well as the high-level \nmeeting of the Council of 28 October 2013 on strengthening the partnership synergy \nbetween the United Nations and the Organization of Islamic Cooperation and the \nstatement by the President of the Council adopted as an outcome of the meeting, 4 \nthrough which the Council, inter alia, recognized and further encouraged the active \ncontribution of the Organization of Islamic Cooperation in the work of the United \nNations towards the realization of the purposes and principles embodied in the \nCharter of the United Nations,  \n \nNoting that the Secretary-General, in his report, recognized the strengthening of \npractical cooperation and the building of complementarity between the United \nNations, its specialized agencies, funds and programmes and the Organization of \nIslamic Cooperation, its subsidiary organs and its specialized and affiliated \ninstitutions,  \n \nNoting also the encouraging progress made in the 10 priority areas of \ncooperation between the two organizations and their respective agencies and \ninstitutions, as well as in the identification of other areas of cooperation \nbetween them, \n \nNoting further that the Secretaries-General of the two organizations have met \nregularly and that consultations among senior officials of the two organizations have \nenhanced cooperation,  \n \nConvinced that the strengthening of cooperation between the United Nations \nand other organizations of the United Nations system and the Organization of Islamic \nCooperation and its subsidiary organs, specialized and affiliated institutions and \nstanding committees contributes to the promotion of the purposes and principles of \nthe United Nations,  \n \nTaking note of the results of the general meeting of the organizations and \nagencies of the United Nations system and the Organization of Islamic Cooperation \nand its subsidiary organs and specialized and affiliated institutions, held in Geneva \nfrom 11 to 13 May 2016, pursuant to General Assembly resolution 69/317, to review \nand appraise the level of cooperation in the fields of international peace and security, \nscience and technology, trade and development, implementation of the Sustainable \n__________________ \n \n2 A/71/160-S/2016/621.  \n \n3  See S/PV.7813.  \n \n4  S/PRST/2013/16; see Resolutions and Decisions of the Security Council, 1 August 2013\u201331 July \n2014 (S/INF/69).  \n\nCooperation between the United Nations and the Organization of Islamic Cooperation \nA/RES/72/74\n \n3/7 \n17-21827 \n \nDevelopment Goals,5 protection of and assistance to refugees, human rights, human \nresource development, food security and agriculture, environment, health and \npopulation, arts and crafts, and the promotion of heritage, and of the fact that these \nmeetings are now being held every two years, with the next scheduled for 2018 and \nto be hosted by the Organization of Islamic Cooperation,  \n \nAcknowledging the intention expressed by the representatives of the United \nNations and the Organization of Islamic Cooperation to reinforce cooperation and \nunderstanding in areas of common interest, noting the commitment of both \norganizations to fostering a global dialogue for the promotion of tolerance and peace, \ncalling for enhanced cooperation to promote better understanding across countries, \nreligions, cultures and civilizations, and in this regard using, inter alia, the United \nNations Alliance of Civilizations as a useful tool in advancing that agenda in \ninternational forums, and welcoming the promotion of effective implementation of \nHuman Rights Council resolution 16/18 of 24 March 20116 to counter global \nviolence, religious discrimination and intolerance, and in this regard, in particular, \nthe Istanbul Process for Combating Intolerance, Discrimination and Incitement to \nHatred and/or Violence on the Basis of Religion or Belief,  \n \nTaking into account the strengthened spirit of cooperation reflected in the \nagreement on a matrix of activities within the framework of United Nations-\nOrganization of Islamic Cooperation collaboration, to be implemented over the next \nbiennium, \n \nRecalling that the Organization of Islamic Cooperation remains an important \npartner of the United Nations in peace, security and the fostering of a culture of peace \nat the global level, and noting various decisions reached by the two sides, including \nthe agreement to continue cooperation in conflict prevention and resolution, \nmediation, peacekeeping and peacebuilding, promotion of good governance at the \nnational and international levels, combating international terrorism, fighting \nextremism, countering religious intolerance, including Islamophobia, promoting and \nprotecting all human rights and fundamental freedoms for all, humanitarian assistance \nand capacity-building in electoral assistance, and the agreement to improve the \nfollow-up mechanism,  \n \nNoting the growing cooperation between the Organization of Islamic \nCooperation, the United Nations and the Organization for Security and Cooperation \nin Europe on mediation,  \n \nNoting also the commitment of the Organization of Islamic Cooperation to \nbuilding its capacity in the field of conflict prevention and resolution, mediation and \npreventive diplomacy through conferences, training sessions and workshops \ndelivered by experts and organizations specializing in that field and the organization \nof \u201cBuilding Resources in Democracy, Governance and Elections\u201d training courses \nand round-table discussions on election monitoring at the General Secretariat of the \nOrganization of Islamic Cooperation in February 2014,  \n \nNoting further the contribution of the Organization of Islamic Cooperation in \npromoting intercultural dialogue and understanding within the framework of the \nUnited Nations Alliance of Civilizations and other initiatives in this regard,  \n \nWelcoming the initiatives for interfaith dialogue undertaken by the Organization \nof Islamic Cooperation and the United Nations, as well as their member States, \nincluding the activities of the King Abdullah Bin Abdulaziz International Centre for \n__________________ \n \n5  See resolution 70/1.  \n \n6  See Official Records of the General Assembly, Sixty-sixth Session, Supplement No. 53 (A/66/53), \nchap. II, sect. A.  \n\nA/RES/72/74 \nCooperation between the United Nations and the Organization of Islamic Cooperation\n \n17-21827 \n4/7 \n \nInterreligious and Intercultural Dialogue in Vienna, and emphasizing the importance \nof engaging relevant United Nations agencies in promoting interfaith dialogue and \nother related activities, as well as General Assembly resolutions 68/127 of \n18 December 2013 and 70/109 of 10 December 2015 on a world against violence and \nviolent extremism,  \n \nTaking note of the cooperation between the Independent Permanent Commission \non Human Rights of the Organization of Islamic Cooperation and relevant United \nNations bodies, including the Office of the United Nations High Commissioner for \nHuman Rights, and recognizing the need for further enhancing this cooperation,  \n \nNoting the adoption by the sixth Ministerial Conference on the Role of Women \nin the Development of Member States of the Organization of Islamic Cooperation, \nheld in Istanbul from 1 to 3 November 2016, of its revised Plan of Action for the \nAdvancement of Women and its implementation mechanism, and the establishment \nof the Advisory Women Council, as well as activities of the Department of Family \nAffairs of the General Secretariat of the Organization to deal specifically with issues \nconcerning women and children, and underscoring the cooperation between the \nDepartment and relevant United Nations agencies, including the United Nations \nEntity for Gender Equality and the Empowerment of Women (UN-Women),  \n \nNoting with appreciation the close and multifaceted cooperation between the \nspecialized agencies of the United Nations and the specialized and affiliated \ninstitutions of the Organization of Islamic Cooperation with a view to strengthening \nthe capacities of the two organizations to address challenges to development and \nsocial progress, including ongoing cooperation between the Organization of Islamic \nCooperation and the World Health Organization, the United Nations Population Fund \nand the United Nations Children\u2019s Fund on health issues, as well as discussions \nbetween the United Nations Children\u2019s Fund and the Organization of Islamic \nCooperation on formalizing their partnership through specific initiatives linked to the \nSustainable Development Goals, as part of the relevant sections of the Organization \nof Islamic Cooperation 2025 Programme of Action,  \n \nWelcoming the existing cooperation between the Organization of Islamic \nCooperation and the Office for the Coordination of Humanitarian Affairs of the \nSecretariat, including dialogue between the two entities on reaching out to \nnon-governmental organizations and other humanitarian actors in States members of \nthe Organization of Islamic Cooperation, as well as participation in joint activities \nand events and information-sharing, with a view to furthering proactive engagement \nand implementing concrete programmes in the areas of capacity-building, emergency \nassistance and strategic partnerships,  \n \nWelcoming also the decision taken by the Counter-Terrorism Committee \nExecutive Directorate and the Organization of Islamic Cooperation at the general \nmeeting of the organizations and agencies of the United Nations system and the \nOrganization of Islamic Cooperation and its subsidiary organs and specialized and \naffiliated institutions, held in Istanbul from 20 to 22 May 2014, to co-organize an \nevent under the auspices of the King Abdullah Bin Abdulaziz International Centre for \nInterreligious and Intercultural Dialogue on the theme \u201cCountering violent \nextremism: elements of an effective strategy\u201d,  \n \nNoting the organization of the brainstorming session to review opportunities for \ncollaboration between the United Nations and the Organization of Islamic \nCooperation on the political and security situation in the Middle East, at the General \nSecretariat of the Organization in Jeddah, Saudi Arabia, on 10 and 11 May 2017, and \nthe agreement to organize a similar session on African issues later,  \n\nCooperation between the United Nations and the Organization of Islamic Cooperation \nA/RES/72/74\n \n5/7 \n17-21827 \n \n \nNoting also the request of the Organization of Islamic Cooperation for greater \ninteraction between the secretariats of the United Nations and the Organization \nextending beyond the current biennial arrangement so as to include periodic reviews \nof cooperation, in the light of the expanding areas of cooperation between the two \norganizations,  \n \nNoting with appreciation the determination of the two organizations to further \nstrengthen the existing cooperation by developing specific proposals in the designated \npriority areas of cooperation, as well as in the political field,  \n \n1. \nTakes note with satisfaction of the report of the Secretary-General;2  \n \n2. \nUrges the United Nations system to cooperate with the Organization of \nIslamic Cooperation in areas of mutual interest, as appropriate;  \n \n3. \nNotes with satisfaction the active participation of the Organization of \nIslamic Cooperation in the work of the United Nations towards the realization of the \npurposes and principles embodied in the Charter of the United Nations;  \n \n4. \nAffirms that the United Nations and the Organization of Islamic \nCooperation share a common goal of promoting and facilitating the Middle East peace \nprocess so that the process can reach its objective of establishing a just and \ncomprehensive peace in the Middle East and also share a common objective of \nfostering peaceful and political solutions to other conflicts in accordance with the \nCharter of the United Nations and the relevant resolutions of the Security Council;  \n \n5. \nRequests the United Nations and the Organization of Islamic Cooperation \nto continue to cooperate in their common search for solutions to global problems, \nsuch as questions relating to international peace and security, disarmament, self-\ndetermination, promotion of a culture of peace through dialogue and cooperation, \ndecolonization, human rights and fundamental freedoms, countering international \nterrorism, including violent extremism, addressing conditions conducive to the spread \nof terrorism, capacity-building, health-related issues such as combating pandemic and \nendemic diseases, protection of the environment, climate change, emergency relief \nand rehabilitation and technical cooperation;  \n \n6. \nWelcomes the strong commitment of the Organization of Islamic \nCooperation in the fight against violent extremism and terrorist groups such as Islamic \nState in Iraq and the Levant, Al-Nusrah Front and all other individuals, groups, \nundertakings and entities associated with Al-Qaida, affirms the important role of the \nOrganization of Islamic Cooperation in responding, in coordination with the United \nNations, to the threat posed by violent extremism, in particular with regard to \ncountering violent extremism and developing counter-narratives, and welcomes the \nestablishment of Sawt Al-Hikma (the Voice of Wisdom) and the Centre for Dialogue, \nPeace and Understanding within the General Secretariat of the Organization of \nIslamic Cooperation to delegitimize and deconstruct the extremist narratives and \ndismantle their contexts, especially through social media;  \n \n7. \nAlso welcomes the cooperation between the United Nations and the \nOrganization \nof Islamic \nCooperation \ntowards \ncombating \nintolerance \nand \nstigmatization of persons based on their religion or belief, recognizes the strong need \nfor global awareness about religious intolerance, condemns any advocacy of religious \nhatred that constitutes incitement to discrimination, hostility or violence, and \nwelcomes cooperation towards addressing the issue with all urgency, including \nthrough the Istanbul Process for Combating Intolerance, Discrimination and \nIncitement to Hatred and/or Violence on the Basis of Religion or Belief;  \n\nA/RES/72/74 \nCooperation between the United Nations and the Organization of Islamic Cooperation\n \n17-21827 \n6/7 \n \n \n8. \nInvites increased cooperation and exchanges between the Independent \nPermanent Commission on Human Rights of the Organization of Islamic Cooperation \nand the Office of the United Nations High Commissioner for Human Rights;  \n \n9. \nRequests the secretariats of the two organizations to strengthen \ncooperation in addressing the social and economic issues that affect the efforts of \nMember States to eradicate poverty, achieve sustainable development and realize the \ninternationally agreed development goals, including the Sustainable Development \nGoals;5 \n \n10. Welcomes the efforts of the United Nations and the Organization of Islamic \nCooperation to continue to strengthen cooperation between the two organizations in \nareas of common concern and to review and explore innovative ways and means of \nenhancing the mechanisms of such cooperation through the recent establishment of a \nworking group;  \n \n11. \nAffirms that, to enhance cooperation and for the purpose of the review and \nappraisal of progress, a general meeting between representatives of the United \nNations system and the Organization of Islamic Cooperation should continue to be \nheld once every two years and to include joint inter-agency sectoral or thematic \nmeetings;  \n \n12. Welcomes the cooperation between the United Nations Entity for Gender \nEquality and the Empowerment of Women (UN-Women) and the General Secretariat \nof the Organization of Islamic Cooperation in the area of gender equality and \nwomen\u2019s empowerment, in particular the signing of a memorandum of understanding \non 22 September 2017;  \n \n13. Also welcomes the cooperation between the United Nations Office for \nSouth-South Cooperation and the General Secretariat of the Organization of Islamic \nCooperation, in particular the signing of a memorandum of cooperation on 24 January \n2016, which provides, inter alia, for the elaboration of a strategic plan for joint \nprogrammes, activities and projects;  \n \n14. Encourages the United Nations and the Organization of Islamic \nCooperation and their subsidiary organs, specialized and affiliated institutions and \nstanding committees to intensify actions in creating bilateral frameworks for \ncooperation in the area of human and industrial capacity development, trade \npromotion, transportation and tourism;  \n \n15. Invites the United Nations system to cooperate with the Organization of \nIslamic Cooperation and its member States in their efforts to implement the \ninternationally agreed development goals, including the Sustainable Development \nGoals; \n \n16. Welcomes with appreciation the continuing cooperation between the \nUnited Nations and the Organization of Islamic Cooperation in the fields of \npeacemaking, preventive diplomacy, peacekeeping and peacebuilding, and notes the \nclose cooperation between the two organizations in reconstruction and development \nin Afghanistan, Bosnia and Herzegovina, the Central African Republic, Mali, Sierra \nLeone and Somalia;  \n \n17. Welcomes the efforts of the secretariats of the two organizations to \nstrengthen information exchange, coordination and cooperation between them in \nareas of mutual interest in the political field and to develop practical modalities for \nsuch cooperation;  \n \n18. Notes with satisfaction the increasing cooperation between the \nOrganization of Islamic Cooperation and the United Nations Educational, Scientific \nand Cultural Organization, which was marked by the opening of the representation \n\nCooperation between the United Nations and the Organization of Islamic Cooperation \nA/RES/72/74\n \n7/7 \n17-21827 \n \noffice of the Organization of Islamic Cooperation at the headquarters of the United \nNations Educational, Scientific and Cultural Organization in Paris, and calls upon the \ntwo organizations to expand their cooperation in the protection of cultural and historic \nheritage;  \n \n19. Expresses its appreciation to the Secretary-General for his continued \nefforts to strengthen cooperation and coordination between the United Nations and \nother organizations of the United Nations system and the Organization of Islamic \nCooperation and its subsidiary organs, specialized and affiliated institutions and \nstanding committees to serve the mutual interests of the two organizations in the \npolitical, economic, social, cultural, humanitarian and scientific fields;  \n \n20. Welcomes the commitment of the Secretary-General to reinforcing \ncooperation in areas of common interest between the Organization of Islamic \nCooperation and the United Nations, also welcomes the periodic high-level meetings \nbetween the Secretaries-General of the United Nations and the Organization of \nIslamic Cooperation, as well as between senior secretariat officials of the two \norganizations, and encourages their participation in important meetings of the two \norganizations;  \n \n21. Encourages the specialized agencies and other organizations of the United \nNations system to continue to expand their cooperation with the subsidiary organs \nand specialized and affiliated institutions of the Organization of Islamic Cooperation, \nparticularly in the fields of science and technology, higher education, health and \nenvironment, by negotiating cooperation agreements and through necessary contacts \nand meetings of the respective focal points for cooperation in priority areas of interest \nto the United Nations and the Organization of Islamic Cooperation;  \n \n22. Invites the United Nations and other organizations of the United Nations \nsystem, especially the lead agencies, to consider providing increased technical and \nother forms of assistance to the Organization of Islamic Cooperation and its \nsubsidiary organs, specialized and affiliated institutions and standing committees in \norder to strengthen their capacities for cooperation;  \n \n23. Invites the Secretary-General to continue to increase awareness, as \nappropriate, of the work and activities of the Organization of Islamic Cooperation, in \naccordance with established practice between the United Nations and other regional \norganizations;  \n \n24. Requests the Secretary-General to report to the General Assembly at its \nseventy-third session on the state of cooperation between the United Nations and the \nOrganization of Islamic Cooperation;  \n \n25. Decides to include in the provisional agenda of its seventy-third session, \nunder the item entitled \u201cCooperation between the United Nations and regional and \nother organizations\u201d, the sub-item entitled \u201cCooperation between the United Nations \nand the Organization of Islamic Cooperation\u201d.  \n \n65th plenary meeting \n6 December 2017 \n \n",
  "paragraphs": {
    "1": "Takes note with satisfaction of the report of the Secretary-General;2",
    "2": "Urges the United Nations system to cooperate with the Organization of Islamic Cooperation in areas of mutual interest, as appropriate;",
    "3": "Notes with satisfaction the active participation of the Organization of Islamic Cooperation in the work of the United Nations towards the realization of the purposes and principles embodied in the Charter of the United Nations;",
    "4": "Affirms that the United Nations and the Organization of Islamic Cooperation share a common goal of promoting and facilitating the Middle East peace process so that the process can reach its objective of establishing a just and comprehensive peace in the Middle East and also share a common objective of fostering peaceful and political solutions to other conflicts in accordance with the Charter of the United Nations and the relevant resolutions of the Security Council;",
    "5": "Requests the United Nations and the Organization of Islamic Cooperation to continue to cooperate in their common search for solutions to global problems, such as questions relating to international peace and security, disarmament, self- determination, promotion of a culture of peace through dialogue and cooperation, decolonization, human rights and fundamental freedoms, countering international terrorism, including violent extremism, addressing conditions conducive to the spread of terrorism, capacity-building, health-related issues such as combating pandemic and endemic diseases, protection of the environment, climate change, emergency relief and rehabilitation and technical cooperation;",
    "6": "Welcomes the strong commitment of the Organization of Islamic Cooperation in the fight against violent extremism and terrorist groups such as Islamic State in Iraq and the Levant, Al-Nusrah Front and all other individuals, groups, undertakings and entities associated with Al-Qaida, affirms the important role of the Organization of Islamic Cooperation in responding, in coordination with the United Nations, to the threat posed by violent extremism, in particular with regard to countering violent extremism and developing counter-narratives, and welcomes the establishment of Sawt Al-Hikma (the Voice of Wisdom) and the Centre for Dialogue, Peace and Understanding within the General Secretariat of the Organization of Islamic Cooperation to delegitimize and deconstruct the extremist narratives and dismantle their contexts, especially through social media;",
    "7": "",
    "8": "Invites increased cooperation and exchanges between the Independent Permanent Commission on Human Rights of the Organization of Islamic Cooperation and the Office of the United Nations High Commissioner for Human Rights;",
    "9": "Requests the secretariats of the two organizations to strengthen cooperation in addressing the social and economic issues that affect the efforts of Member States to eradicate poverty, achieve sustainable development and realize the internationally agreed development goals, including the Sustainable Development Goals;5",
    "10": "Welcomes the efforts of the United Nations and the Organization of Islamic Cooperation to continue to strengthen cooperation between the two organizations in areas of common concern and to review and explore innovative ways and means of enhancing the mechanisms of such cooperation through the recent establishment of a working group;",
    "11": "Affirms that, to enhance cooperation and for the purpose of the review and appraisal of progress, a general meeting between representatives of the United Nations system and the Organization of Islamic Cooperation should continue to be held once every two years and to include joint inter-agency sectoral or thematic meetings;",
    "12": "Welcomes the cooperation between the United Nations Entity for Gender Equality and the Empowerment of Women (UN-Women) and the General Secretariat of the Organization of Islamic Cooperation in the area of gender equality and women\u2019s empowerment, in particular the signing of a memorandum of understanding on 22 September 2017;",
    "13": "Also welcomes the cooperation between the United Nations Office for South-South Cooperation and the General Secretariat of the Organization of Islamic Cooperation, in particular the signing of a memorandum of cooperation on 24 January 2016, which provides, inter alia, for the elaboration of a strategic plan for joint programmes, activities and projects;",
    "14": "Encourages the United Nations and the Organization of Islamic Cooperation and their subsidiary organs, specialized and affiliated institutions and standing committees to intensify actions in creating bilateral frameworks for cooperation in the area of human and industrial capacity development, trade promotion, transportation and tourism;",
    "15": "Invites the United Nations system to cooperate with the Organization of Islamic Cooperation and its member States in their efforts to implement the internationally agreed development goals, including the Sustainable Development Goals;",
    "16": "Welcomes with appreciation the continuing cooperation between the United Nations and the Organization of Islamic Cooperation in the fields of peacemaking, preventive diplomacy, peacekeeping and peacebuilding, and notes the close cooperation between the two organizations in reconstruction and development in Afghanistan, Bosnia and Herzegovina, the Central African Republic, Mali, Sierra Leone and Somalia;",
    "17": "Welcomes the efforts of the secretariats of the two organizations to strengthen information exchange, coordination and cooperation between them in areas of mutual interest in the political field and to develop practical modalities for such cooperation;",
    "18": " office of the Organization of Islamic Cooperation at the headquarters of the United Nations Educational, Scientific and Cultural Organization in Paris, and calls upon the two organizations to expand their cooperation in the protection of cultural and historic heritage;",
    "19": "Expresses its appreciation to the Secretary-General for his continued efforts to strengthen cooperation and coordination between the United Nations and other organizations of the United Nations system and the Organization of Islamic Cooperation and its subsidiary organs, specialized and affiliated institutions and standing committees to serve the mutual interests of the two organizations in the political, economic, social, cultural, humanitarian and scientific fields;",
    "20": "Welcomes the commitment of the Secretary-General to reinforcing cooperation in areas of common interest between the Organization of Islamic Cooperation and the United Nations, also welcomes the periodic high-level meetings between the Secretaries-General of the United Nations and the Organization of Islamic Cooperation, as well as between senior secretariat officials of the two organizations, and encourages their participation in important meetings of the two organizations;",
    "21": "Encourages the specialized agencies and other organizations of the United Nations system to continue to expand their cooperation with the subsidiary organs and specialized and affiliated institutions of the Organization of Islamic Cooperation, particularly in the fields of science and technology, higher education, health and environment, by negotiating cooperation agreements and through necessary contacts and meetings of the respective focal points for cooperation in priority areas of interest to the United Nations and the Organization of Islamic Cooperation;",
    "22": "Invites the United Nations and other organizations of the United Nations system, especially the lead agencies, to consider providing increased technical and other forms of assistance to the Organization of Islamic Cooperation and its subsidiary organs, specialized and affiliated institutions and standing committees in order to strengthen their capacities for cooperation;",
    "23": "Invites the Secretary-General to continue to increase awareness, as appropriate, of the work and activities of the Organization of Islamic Cooperation, in accordance with established practice between the United Nations and other regional organizations;",
    "24": "Requests the Secretary-General to report to the General Assembly at its seventy-third session on the state of cooperation between the United Nations and the Organization of Islamic Cooperation;",
    "25": "Decides to include in the provisional agenda of its seventy-third session, under the item entitled \u201cCooperation between the United Nations and regional and other organizations\u201d, the sub-item entitled \u201cCooperation between the United Nations and the Organization of Islamic Cooperation\u201d."
  },
  "agenda_items": [
    "Item 176"
  ],
  "symbol_references": [
    "A/72/L.10"
  ]
}