{
  "symbol": "A/RES/72/284",
  "filename": "A_RES_72_284.pdf",
  "title": "72/284. The United Nations Global Counter-Terrorism Strategy Review",
  "text": "United Nations \nA/RES/72/284\n \n \nGeneral Assembly \nDistr.: General \n2 July 2018 \n \n18-10508 (E)    060718 \n*1810508* \n \n \nSeventy-second session \nAgenda item 118 \n \n \n \n \n Resolution adopted by the General Assembly \non 26 June 2018 \n \n \n \n \n[without reference to a Main Committee (A/72/L.62)] \n \n \n 72/284. The United Nations Global Counter-Terrorism Strategy Review \n \n \n \nThe General Assembly, \n \nReaffirming the United Nations Global Counter-Terrorism Strategy, contained \nin its resolution 60/288 of 8 September 2006, and recalling its resolution 68/276 of \n13 June 2014, which called for, inter alia, an examination of the report of the \nSecretary-General on the progress made in the implementation of the Strategy and of \nthe implementation of the Strategy by Member States and for consideration to be \ngiven to updating the Strategy to respond to changes, \n \nRecalling the pivotal role of the General Assembly in following up the \nimplementation and the updating of the Strategy, \n \nRecalling also its resolution 71/291 of 15 June 2017, in which it decided to \nestablish the Office of Counter-Terrorism, and underscoring the competencies and \nfunctions of the Office as set out in the report of the Secretary-General on the \ncapability of the United Nations system to assist Member States in implementing the \nStrategy1 and endorsed in resolution 71/291, including providing leadership on the \nGeneral Assembly counter-terrorism mandates entrusted to the Secretary-General, \nenhancing coordination and coherence across the Counter-Terrorism Implementation \nTask Force (Global Counter-Terrorism Coordination Compact entities) to ensure the \nbalanced implementation of the four pillars of the Strategy, strengthening the delivery \nof United Nations counter-terrorism capacity-building assistance to Member States, \nimproving visibility, advocacy and resource mobilization for United Nations counter-\nterrorism efforts, and ensuring that due priority is given to counter-terrorism across \nthe United Nations system and that the important work on preventing violent \nextremism as and when conducive to terrorism is firmly rooted in the Strategy, \n \nRecalling further its resolution 66/10 of 18 November 2011, recognizing the \nimportant work carried out by the United Nations Counter-Terrorism Centre, \nestablished within the Office of Counter-Terrorism, and its role in building the \n__________________ \n \n1 A/71/858. \n\nA/RES/72/284 \nThe United Nations Global Counter-Terrorism Strategy Review\n \n18-10508\n2/17 \n \ncapacity of Member States to counter and respond to terrorism, noting with \nappreciation its continued contribution to strengthening United Nations counter-\nterrorism efforts, and encouraging Member States to provide resources and voluntary \ncontributions to the Centre in this regard, \n \nRenewing \nits \nunwavering \ncommitment \nto \nstrengthening \ninternational \ncooperation to prevent and combat terrorism in all its forms and manifestations, and \nreaffirming that any acts of terrorism are criminal and unjustifiable, regardless of their \nmotivation, wherever, whenever and by whomsoever committed, \n \nReaffirming that terrorism and violent extremism as and when conducive to \nterrorism cannot and should not be associated with any religion, nationality, \ncivilization or ethnic group, \n \nRecalling the Declaration and Programme of Action on a Culture of Peace,2 \n \nNoting with appreciation the continued contribution of United Nations entities \nand the subsidiary bodies of the Security Council to the work of the Counter-Terrorism \nImplementation Task Force (Global Counter-Terrorism Coordination Compact entities), \n \nReaffirming its respect for the sovereignty, territorial integrity, independence \nand unity of all States in accordance with the purposes and principles of the Charter \nof the United Nations, \n \nRecognizing that international cooperation and any measures taken by Member \nStates to prevent and combat terrorism, as well as to prevent violent extremism as and \nwhen conducive to terrorism, must fully comply with their obligations under \ninternational law, including the Charter, in particular the purposes and principles \nthereof, and relevant international conventions and protocols, in particular human \nrights law, refugee law and international humanitarian law, \n \nConvinced that the General Assembly is the competent organ, with universal \nmembership, to address the issue of international terrorism, \n \nMindful of the need to enhance the role of the United Nations and the specialized \nagencies, within their mandates, in the implementation of the Strategy, \n \nReaffirming that the acts, methods and practices of terrorism in all its forms and \nmanifestations are activities aimed at the destruction of human rights, fundamental \nfreedoms and democracy, at threatening territorial integrity and the security of States \nand at destabilizing legitimately constituted Governments, and that the international \ncommunity should take the steps necessary to enhance cooperation to prevent and \ncombat terrorism in a decisive, unified, coordinated, inclusive and transparent manner, \n \nReiterating the obligation of Member States to prevent and suppress the \nfinancing of terrorist acts and to criminalize the wilful provision or collection, by any \nmeans, directly or indirectly, of funds by their nationals or in their territories, with \nthe intention that the funds be used, or with the knowledge that they are to be used, \nin order to carry out terrorist acts, \n \nRecognizing the importance of preventing, combating and eradicating the illicit \nuse of small arms and light weapons by terrorists, \n \nExpressing concern that terrorist attacks on critical infrastructure could \nsignificantly disrupt the functioning of government and the private sector alike and \ncause knock-on effects beyond the infrastructure sector, and therefore underlining the \ngrowing importance of protecting critical infrastructure from terrorist attacks and of \nfostering comprehensive preparedness for such attacks, including through public-\nprivate partnership, as appropriate, \n__________________ \n \n2 Resolutions 53/243 A and B. \n\nThe United Nations Global Counter-Terrorism Strategy Review \nA/RES/72/284\n \n3/17\n18-10508 \n \n \nRecognizing the role of the partnerships of regional and subregional \norganizations with the United Nations in combating terrorism, and encouraging the \nCounter-Terrorism Implementation Task Force (Global Counter-Terrorism Coordination \nCompact entities), in accordance with its mandate, to closely cooperate and coordinate \nwith regional and subregional organizations in their efforts to combat terrorism, \n \nAlarmed by the acts of intolerance, violent extremism conducive to terrorism, \nviolence, including sectarian violence, and terrorism in various parts of the world, \nwhich claim innocent lives, cause destruction and displace people, and rejecting the \nuse of violence, regardless of motivation, \n \nExpressing grave concern over the continued acute and growing threat posed by \nforeign terrorist fighters, namely, individuals who travel to a State other than their \nStates of residence or nationality for the purpose of the perpetration, planning or \npreparation of, or participation in, terrorist acts or providing or receiving terrorist \ntraining, including in connection with armed conflict, as well as individuals returning \nor relocating, particularly from conflict zones, to their countries of origin or \nnationality or to third countries, emphasizing the need for States to address this issue, \nincluding through the implementation of their international obligations, and \nunderlining the importance of United Nations capacity-building and facilitation of \ncapacity-building, in accordance with existing mandates, to assist States, including \nthose in the most affected regions, upon their request, \n \nUnderlining the importance of strengthening international cooperation to \naddress the threat posed by foreign terrorist fighters, including on information-\nsharing, border security, investigations, judicial processes, extradition, improving \nprevention and addressing conditions conducive to the spread of terrorism, preventing \nand countering incitement to commit terrorist acts, preventing radicalization to \nterrorism and recruitment of foreign terrorist fighters, disrupting and preventing \nfinancial support to foreign terrorist fighters, developing and implementing risk \nassessments on returning and relocating foreign terrorist fighters and their families, \nand prosecution, rehabilitation and reintegration efforts, consistent with applicable \ninternational law, \n \nExpressing concern that terrorists may benefit from transnational organized \ncrime in some regions, including from the trafficking of arms, persons, drugs and \ncultural property and from the illicit trade in natural resources, including oil, and in \noil products, modular refineries and related material, gold and other precious metals \nand stones, minerals, charcoal and wildlife, as well as from kidnapping for ransom \nand other crimes, including extortion, money-laundering and bank robbery, and \ncondemning the destruction of cultural heritage perpetrated by terrorist groups in \nsome countries, \n \nStrongly condemning the systematic recruitment and use of children to \nperpetrate terrorist attacks, as well as the violations and abuses committed by terrorist \ngroups against children, including killing and maiming, abduction and rape and other \nforms of sexual violence, and noting that such violations and abuses may amount to \nwar crimes or crimes against humanity, \n \nExpressing deep concern that acts of sexual and gender-based violence are \nknown to be part of the strategic objectives and ideology of certain terrorist groups \nand are used as a tactic of terrorism and as an instrument to increase their power by \nsupporting financing and recruitment and through the destruction of communities, \n \nExpressing deep concern also about the connections, in some cases, between \nsome forms of transnational organized crime and terrorism, and emphasizing the need \nto enhance cooperation at the national, subregional, regional and international levels \nin order to strengthen responses to this evolving challenge, \n\nA/RES/72/284 \nThe United Nations Global Counter-Terrorism Strategy Review\n \n18-10508\n4/17 \n \n \nRecognizing the commitment of all religions to peace, and determined to \ncondemn acts of violent extremism conducive to terrorism and incitement to commit \nterrorist acts that spread hate and threaten lives, \n \nTaking note of the report of the Special Rapporteur of the Human Rights Council \non the promotion and protection of human rights and fundamental freedoms while \ncountering terrorism, 3  including the conclusions and recommendations contained \ntherein, \n \nEncouraging Member States to work together to ensure that terrorists do not \nfind safe haven online, while promoting an open, interoperable, reliable and secure \nInternet that fosters efficiency, innovation, communication and economic prosperity, \nand while respecting international law, including human rights law, \n \nRecognizing the role that victims of terrorism in all its forms and manifestations \ncan play, including in countering the appeal of terrorism, and emphasizing the need \nto promote international solidarity in support of victims of terrorism and to ensure \nthat victims of terrorism are treated with dignity and respect, \n \nRecalling, in this regard, its proclamation of 21 August as the International Day \nof Remembrance of and Tribute to the Victims of Terrorism, in order to honour and \nsupport the victims and survivors of terrorism and to promote and protect the full \nenjoyment of their human rights and fundamental freedoms, \n \nAffirming the importance of education as a tool to help to prevent terrorism and \nviolent extremism conducive to terrorism, and welcoming the engagement of the \nUnited Nations Educational, Scientific and Cultural Organization with Member States \nto implement strategies to prevent violent extremism conducive to terrorism through \neducation, \n \nNoting the important contribution of women to the implementation of the \nStrategy, and encouraging Member States, United Nations entities and international, \nregional and subregional organizations to ensure the participation and leadership of \nwomen in efforts to prevent violent extremism and counter terrorism, \n \nNoting also the important and positive contribution of youth in efforts to counter \nterrorism and prevent violent extremism conducive to terrorism, as well as for the \npromotion of peace and security, and in this regard expressing concern about the \ndanger of recruitment and radicalization to terrorism, including in prisons, \n \nStressing the importance of the development and maintenance of effective, fair, \nhumane, transparent and accountable criminal justice systems, taking into account, \ninter alia, the rights and needs of children, in accordance with applicable international \nlaw, as a fundamental basis of any strategy to counter terrorism, calling for Member \nStates\u2019 continued efforts to combat terrorism through national legislation and \nestablish such justice systems, and stressing the need for training of professionals in \nthe criminal justice systems of Member States, upon their request, including through \nbilateral and multilateral programmes and experience-sharing with a view to \ndeveloping a common understanding of threats and providing an effective response, \n \nRecognizing that achieving the 2030 Agenda for Sustainable Development, 4 \nwhich comprises universal goals and targets that involve the entire world, developed \nand developing countries alike, can contribute to the implementation of the Strategy, \nand recognizing also the importance of regional development frameworks in this \nregard, such as the African Union Agenda 2063,  \n__________________ \n \n3 A/HRC/37/52. \n \n4 Resolution 70/1. \n\nThe United Nations Global Counter-Terrorism Strategy Review \nA/RES/72/284\n \n5/17\n18-10508 \n \n \nStressing that a national criminal justice system based on respect for human \nrights and the rule of law, due process and fair trial guarantees is one of the best means \nfor effectively countering terrorism and ensuring accountability, \n \nReaffirming the determination of Member States to continue to do all that they \ncan to resolve conflict, end foreign occupation, confront oppression, eradicate \npoverty, promote sustained economic growth, sustainable development, global \nprosperity, good governance, human rights for all and the rule of law, improve \nintercultural understanding and ensure respect for all religions, religious values, \nbeliefs and cultures, \n \nReaffirming also the commitment of Member States to take measures aimed at \naddressing the conditions conducive to the spread of terrorism, including but not \nlimited to prolonged unresolved conflicts, dehumanization of victims of terrorism in \nall its forms and manifestations, lack of the rule of law and violations of human rights, \nethnic, national and religious discrimination, political exclusion, socioeconomic \nmarginalization and lack of good governance, while recognizing that none of these \nconditions can excuse or justify acts of terrorism, \n \nNoting the importance of continuing to strive towards achieving a world free of \nterrorism, \n \n1. \nReiterates its strong and unequivocal condemnation of terrorism in all its \nforms and manifestations, committed by whomever, wherever and for whatever \npurposes; \n \n2. \nReaffirms the United Nations Global Counter-Terrorism Strategy5 and its \nfour pillars, which constitute an ongoing effort, and calls upon Member States, the \nUnited Nations and other appropriate international, regional and subregional \norganizations to step up their efforts to implement the Strategy in an integrated and \nbalanced manner and in all its aspects; \n \n3. \nStresses the importance of keeping the Strategy relevant and contemporary \nin the light of emerging new threats and evolving trends of international terrorism;  \n \n4. \nAffirms the importance of the integrated and balanced implementation of \nall pillars of the Strategy, recognizing the need to redouble efforts for even attention \nto be paid to and the even implementation of all the pillars of the Strategy; \n \n5. \nRecognizes the principal responsibility of Member States to implement the \nStrategy, while encouraging the further elaboration and development of national, \nsubregional and regional plans, as appropriate, to support the implementation of the \nStrategy; \n \n6. \nRecalls the establishment of the Office of Counter-Terrorism in its \nresolution 71/291; \n \n7. \nCalls upon States that have not done so to consider becoming parties in a \ntimely manner to the existing international conventions and protocols against \nterrorism, and upon all States to make every effort to conclude a comprehensive \nconvention on international terrorism, and recalls the commitments of Member States \nwith regard to the implementation of General Assembly and Security Council \nresolutions relating to international terrorism; \n \n8. \nRecalls all the resolutions of the General Assembly on measures to \neliminate international terrorism and the relevant resolutions of the Assembly on the \nprotection of human rights and fundamental freedoms while countering terrorism and \nall resolutions of the Security Council relating to international terrorism, and calls \n__________________ \n \n5 Resolution 60/288. \n\nA/RES/72/284 \nThe United Nations Global Counter-Terrorism Strategy Review\n \n18-10508\n6/17 \n \nupon Member States to cooperate fully with the relevant bodies of the United Nations \nin the fulfilment of their tasks, recognizing that many States continue to require \nassistance in implementing these resolutions; \n \n9. \nStresses the significance of a sustained and comprehensive approach, \nincluding through stronger efforts, where necessary, to address conditions conducive \nto the spread of terrorism, bearing in mind that terrorism will not be defeated by \nmilitary force, law enforcement measures and intelligence operations alone; \n \n10. Also stresses that, when counter-terrorism efforts neglect the rule of law \nat the national and international levels and violate international law, including the \nCharter of the United Nations, international humanitarian law and refugee law, human \nrights and fundamental freedoms, they not only betray the values that they seek to \nuphold, but they may also further fuel violent extremism that can be conducive to \nterrorism; \n \n11. \nEncourages Member States to engage with relevant local communities and \nnon-governmental actors, where appropriate, in developing tailored strategies to \ncounter the violent extremist narrative that can incite recruitment to terrorist groups \nand the commission of terrorist acts and to address the conditions conducive to the \nspread of violent extremism as and when conducive to terrorism; \n \n12. Encourages Member States, United Nations entities, regional and \nsubregional organizations and relevant actors to consider instituting mechanisms to \ninvolve youth in the promotion of a culture of peace, tolerance and intercultural and \ninterreligious dialogue and develop, as appropriate, an understanding of respect for \nhuman dignity, pluralism and diversity, including, as appropriate, through education \nprogrammes, that could discourage their participation in acts of terrorism, violent \nextremism conducive to terrorism, violence, xenophobia and all forms of \ndiscrimination, also encourages Member States to empower youth through the \npromotion of media and information literacy by including youth in decision-making \nprocesses and considering practical ways to include youth in the development of \nrelevant programmes and initiatives aimed at preventing violent extremism conducive \nto terrorism, and urges Member States to take effective measures, in conformity with \ninternational law, to protect young people affected or exploited by terrorism or violent \nextremism conducive to terrorism; \n \n13. Deeply deplores the suffering caused by terrorism to the victims of \nterrorism in all its forms and manifestations and to their families, expresses its \nprofound solidarity with them, and encourages Member States to provide them with \nproper support and assistance while taking into account, inter alia, when appropriate, \nconsiderations regarding remembrance, dignity, respect, justice and truth, in \naccordance with international law; \n \n14. Acknowledges the importance of building the resilience of victims and \ntheir families as an integral part of a counter-terrorism strategy, and encourages \nMember States to include this aspect in their national counter-terrorism strategies, \nincluding by providing victims and their families with proper support and assistance \nimmediately after an attack and in the long term and sharing on a voluntary basis best \npractices and lessons learned related to the protection of victims of terrorism, \nincluding regarding the provision of legal, medical, psychosocial or financial support; \n \n15. Emphasizes that tolerance, pluralism, respect for diversity, dialogue \namong civilizations and the enhancement of interreligious and intercultural \nunderstanding and respect among peoples, including at the national, regional and \nglobal levels, while avoiding the escalation of hatred, are among the most important \nelements in promoting cooperation, in combating terrorism and in countering violent \nextremism as and when conducive to terrorism, and welcomes the various initiatives \nto this end; \n\nThe United Nations Global Counter-Terrorism Strategy Review \nA/RES/72/284\n \n7/17\n18-10508 \n \n \n16. Urges all Member States and the United Nations to unite against violent \nextremism as and when conducive to terrorism, encourages the efforts of leaders to \ndiscuss within their communities the drivers of violent extremism conducive to \nterrorism and to evolve strategies to address them, and underlines that States, regional \norganizations, non-governmental organizations, religious bodies and the media have \nan important role to play in promoting tolerance and facilitating understanding, \ninclusive dialogue and respect for religious and cultural diversity and human rights; \n \n17. Recognizes the difficulties faced by the international community in \naddressing the conditions conducive to the spread of terrorism and violent extremism, \nwhich can be conducive to terrorism, and urges Member States and the United Nations \nsystem to take measures, pursuant to international law and while ensuring national \nownership, to address all drivers of violent extremism conducive to terrorism, both \ninternal and external, in a balanced manner; \n \n18. Also recognizes the importance of preventing violent extremism as and \nwhen conducive to terrorism and in this regard recalls its resolution 70/254 of \n12 February 2016, in which it welcomed the initiative by the Secretary-General and \ntook note of his Plan of Action to Prevent Violent Extremism, 6 recommends that \nMember States consider the implementation of relevant recommendations of the Plan \nof Action, as applicable to the national context, encourages United Nations entities, \nin line with their mandates, to implement relevant recommendations of the Plan of \nAction, including by providing technical assistance to Member States upon their \nrequest, and invites Member States and regional and subregional organizations to \nconsider developing national and regional plans of action to prevent violent \nextremism as and when conducive to terrorism, in accordance with their priorities and \ntaking into account, as appropriate, the Secretary-General\u2019s Plan of Action, as well as \nother relevant documents; \n \n19. Urges all States to respect and protect the right to privacy, as set out in \narticle 12 of the Universal Declaration of Human Rights 7  and article 17 of the \nInternational Covenant on Civil and Political Rights, 8 including in the context of \ndigital communication, also while countering terrorism, in accordance with \ninternational law, in particular international human rights law, and to take measures \nto ensure that interferences with or restrictions on that right are not arbitrary or \nunlawful and are subject to effective oversight and to appropriate redress, including \nthrough judicial review or other legal means; \n \n20. Calls upon States, while countering terrorism and preventing violent \nextremism conducive to terrorism, to review their procedures, practices and \nlegislation regarding the surveillance of communications, their interception and the \ncollection of personal data, including mass surveillance, interception and collection, \nwith a view to upholding the right to privacy, as set out in article 12 of the Universal \nDeclaration of Human Rights and article 17 of the International Covenant on Civil \nand Political Rights, by ensuring the full and effective implementation of all their \nobligations under international human rights law; \n \n21. Stresses that it is essential to address the threat posed by narratives used \nby terrorists and that, in this regard, the international community should consider \ndeveloping an accurate understanding of how terrorists motivate others to commit \nterrorist acts or recruit them, and develop the most effective means to counter terrorist \npropaganda, incitement and recruitment, including through the Internet, in \ncompliance with international law, including international human rights law; \n__________________ \n \n6 See A/70/674. \n \n7 Resolution 217 A (III). \n \n8 See resolution 2200 A (XXI), annex. \n\nA/RES/72/284 \nThe United Nations Global Counter-Terrorism Strategy Review\n \n18-10508\n8/17 \n \n \n22. Notes that terrorists may craft distorted narratives that are based on the \nmisinterpretation and misrepresentation of religion to justify violence, which are \nutilized to recruit supporters and foreign terrorist fighters, mobilize resources and \ngarner support from sympathizers, in particular by exploiting information and \ncommunications technologies, including through the Internet and social media, and \nalso notes in this regard the urgent need for the international community to globally \ncounter such activities; \n \n23. Stresses that States should consider engaging, where appropriate, with \nreligious authorities and community leaders with relevant expertise, including in \ncrafting and delivering effective counter-narratives and in countering narratives used \nby terrorists and their supporters, and also stresses that counter-narratives should aim \nnot only to rebut terrorists\u2019 messages but also to amplify positive narratives, provide \ncredible alternatives and address issues of concern to vulnerable audiences who are \nsubject to terrorist narratives; \n \n24. Encourages civil society, including non-governmental organizations, to \nengage, as appropriate, in efforts to enhance the implementation of the Strategy, \nincluding through interaction with Member States and the United Nations system, and \nencourages Member States and the Counter-Terrorism Implementation Task Force \n(Global Counter-Terrorism Coordination Compact entities) to enhance engagement \nwith civil society in accordance with their mandates, as appropriate, and to support \nits role in the implementation of the Strategy; \n \n25. Calls upon all Member States, given the complex global security context \ntoday, to highlight the important role of women in countering terrorism and violent \nextremism as and when conducive to terrorism, and urges Member States and United \nNations entities to integrate a gender analysis on the drivers of radicalization of \nwomen to terrorism into their relevant programmes, to consider, when appropriate, \nthe impacts of counter-terrorism strategies on women\u2019s human rights and women\u2019s \norganizations and to seek greater consultations with women and women\u2019s \norganizations when developing strategies to counter terrorism and violent extremism \nconducive to terrorism; \n \n26. Recognizes the need for Member States to prevent the abuse of \nnon-governmental, non-profit and charitable organizations by and for terrorists, and \ncalls upon non-governmental, non-profit and charitable organizations to prevent and \noppose, as appropriate, attempts by terrorists to abuse the status of those \norganizations, while reaffirming the need to fully respect the rights to freedom of \nexpression and association of individuals in civil society and to freedom of religion \nor belief of all persons; \n \n27. Reaffirms the need for enhanced dialogue and coordination among the \ncounter-terrorism officials, including among law enforcement entities and financial \nintelligence units, of Member States to promote international, regional and \nsubregional cooperation and wider dissemination of knowledge of the Strategy in \norder to counter terrorism, and in this regard recalls the role of the United Nations \nsystem, in particular the Counter-Terrorism Implementation Task Force (Global \nCounter-Terrorism Coordination Compact entities), in promoting international \ncooperation and capacity-building as elements of the Strategy; \n \n28. Calls upon all Member States, in accordance with their obligations under \napplicable international law, including the Charter, to deny terrorist groups safe \nhaven, freedom of operations, movement and recruitment and financial, material or \npolitical support, which endanger national, regional and international peace and \nsecurity, and to bring to justice or, where appropriate, extradite, on the basis of the \nprinciple of extradite or prosecute, the perpetrators of terrorist acts or any person who \n\nThe United Nations Global Counter-Terrorism Strategy Review \nA/RES/72/284\n \n9/17\n18-10508 \n \nsupports, facilitates or participates or attempts to participate in the financing, \nplanning or preparation of terrorist acts; \n \n29. Urges Member States to provide full coordination and afford one another \nthe greatest measure of assistance, in accordance with their obligations under \ninternational law, in criminal investigations or criminal proceedings relating to the \nfinancing or support of terrorist acts, especially with those States where, or against \nwhose citizens, terrorist acts are committed, including obtaining evidence for the \nproceedings involving terrorist organizations, terrorist entities or foreign terrorist \nfighters, and recalls that all States must cooperate fully in the fight against terrorism \non the basis of mutual legal assistance and the principle of extradite or prosecute, \nwelcoming their efforts to elaborate on the existing extradition and mutual legal \nassistance mechanisms; \n \n30. Calls upon Member States to prevent refugee status from being abused by \nthe perpetrators, organizers or facilitators of terrorist acts, and also calls upon \nMember States to take appropriate measures to ensure, before granting asylum, that \nthe asylum seeker has not planned, facilitated or participated in the commission of \nterrorist acts, while reaffirming the importance of protecting refugees and asylum \nseekers in accordance with States\u2019 obligations under international law, in particular \ninternational human rights law, refugee law and humanitarian law; \n \n31. Urges Member States to ensure no tolerance for terrorism, regardless of \nthe targets or motives, and reaffirms its call to refrain from organizing, instigating, \nfacilitating, participating in, financing, encouraging or tolerating terrorist activities \nand to take appropriate practical measures to ensure that their respective territories \nare not used for terrorist installations or training camps or for the preparation or \norganization of terrorist acts intended to be committed against other States or their \ncitizens; \n \n32. Expresses concern over terrorist acts committed by lone terrorists in \nvarious parts of the world, acknowledges the specific challenges created by lone \nterrorists as they are difficult to detect, and recognizes the need to address this issue \nexpeditiously; \n \n33. Condemns the failure to take all feasible precautions to protect the civilian \npopulation and civilian objects against the effects of attacks when using civilian \nobjects, in particular schools and hospitals, for military purposes such as launching \nattacks and storing weapons, and strongly condemns the use of civilians to shield \nmilitary objectives from attacks; \n \n34. Encourages Member States to consider better ways to cooperate to \nexchange information, assist one another, prosecute those who use information and \ncommunications technologies for terrorist purposes and implement other appropriate \ncooperative measures to address such threats; \n \n35. Expresses concern at the increasing use, in a globalized society, by \nterrorists and their supporters, of information and communications technologies, in \nparticular the Internet and other media, and the use of such technologies to commit, \nincite, recruit for, fund or plan terrorist acts, notes the importance of cooperation \namong stakeholders in the implementation of the Strategy, including among Member \nStates, international, regional and subregional organizations, the private sector and \ncivil society, to address this issue, while respecting human rights and fundamental \nfreedoms and complying with international law and the purposes and principles of the \nCharter, and reiterates that such technologies can be powerful tools in countering the \nspread of terrorism, including by promoting tolerance and dialogue among peoples \nand peace; \n\nA/RES/72/284 \nThe United Nations Global Counter-Terrorism Strategy Review\n \n18-10508\n10/17 \n \n \n36. Recalls Security Council resolutions 2178 (2014) of 24 September 2014 \nand 2396 (2017) of 21 December 2017, and reaffirms the need to strengthen efforts \nto address the evolving threat of foreign terrorist fighters; \n \n37. Calls upon Member States to strengthen cooperation at the international, \nregional, subregional and bilateral levels to counter the threat posed by foreign \nterrorist fighters, including through enhanced operational and timely information-\nsharing, recalling in this regard that Member States should notify the relevant \nauthorities, in a timely manner, upon travel, departure, arrival or deportation of \ncaptured or detained individuals whom they have reasonable grounds to believe are \nforeign terrorist fighters, pursuant to Security Council resolution 2396 (2017), \nlogistical support, as appropriate, and capacity-building activities, to share and adopt \nbest practices to identify foreign terrorist fighters, to prevent the travel of foreign \nterrorist fighters from, into or through Member States, to prevent the financing, \nmobilization, recruitment and organization of foreign terrorist fighters, and to \nstrengthen international and regional cooperation in information-sharing and \nevidence-gathering, and calls upon law enforcement and criminal justice authorities \nto better counter the threat of returning and relocating foreign terrorist fighters, to \ncounter violent extremism conducive to terrorism and radicalization to terrorism, to \nenhance efforts to implement deradicalization programmes and to ensure that any \nperson who participates in the financing, planning, preparation or perpetration of \nterrorist acts or in the supporting of terrorist acts or in providing funds to terrorists is \nbrought to justice, in compliance with obligations under international law, as well as \napplicable domestic law; \n \n38. Calls upon all States to use applicable international instruments to which \nthey are parties, as appropriate, as a basis for mutual legal assistance and, as \nappropriate, for extradition in terrorism cases, and encourages States, in the absence \nof applicable conventions or provisions, to cooperate where possible on the basis of \nreciprocity or on a case-by-case basis; \n \n39. Calls upon all Member States, in accordance with their obligations under \ninternational law, to cooperate in efforts to address the threat posed by foreign \nterrorist fighters, including by preventing the radicalization to terrorism and \nrecruitment of foreign terrorist fighters, preventing the movement of foreign terrorist \nfighters across their borders, including through enhanced border security and controls \non issuance of identity papers and travel documents, disrupting and preventing \nfinancial support to foreign terrorist fighters and developing and implementing \nprosecution, rehabilitation and reintegration strategies, taking into account gender \nand age dimensions, for returning and relocating foreign terrorist fighters and their \nfamilies, underscores in this regard the importance of a whole-of-government \napproach, recognizes the role that civil society organizations can play as they may \nhave relevant knowledge of, access to and engagement with local communities, to be \nable to confront the challenges of recruitment and radicalization to terrorism, notes \nthat children may be especially vulnerable to radicalization to violence and in need \nof particular psychosocial support, such as post-trauma counselling, while stressing \nthat children need to be treated in a manner that respects their rights and protects their \ndignity, in accordance with applicable international law, and in this regard encourages \nall Member States to develop effective strategies to deal with returnees, including \nthrough repatriation, in accordance with relevant international obligations and \nnational law; \n \n40. Expresses concern that international networks have been established by \nterrorist organizations that facilitate the travel of foreign terrorist fighters to conflict \nzones, and calls upon all Member States to take appropriate measures to dismantle \nsuch networks, in accordance with their international obligations; \n\nThe United Nations Global Counter-Terrorism Strategy Review \nA/RES/72/284\n \n11/17\n18-10508 \n \n \n41. Also expresses concern at the increasing flow of international recruits to \nterrorist organizations, including foreign terrorist fighters, and at the threat that it \nposes for all Member States, including countries of origin, transit and destination, \nencourages all Member States to address this threat by enhancing their cooperation \nand developing relevant measures to prevent and tackle this phenomenon, including \ninformation-sharing, border management to detect travel, including through the \nimplementation of obligations on the use of advance passenger information, \npassenger name record and biometric data, with full respect for human rights and \nfundamental freedoms, calls upon Member States to make effective use of the \ndatabases of the International Criminal Police Organization (INTERPOL), as \nappropriate, by connecting to law enforcement, border security and customs agencies \nthrough their national central bureaux, requests Member States to help to build the \ncapacity of other Member States, upon their request, to address the threat posed by \nforeign terrorist fighters, notes in this regard that some Member States may require \ntechnical assistance and capacity-building support, and encourages the provision of \nassistance to help to address such gaps, and the consideration of the use of United \nNations instruments, such as sanctions regimes, as well as cooperation; \n \n42. Calls upon Member States to strengthen efforts to improve the security \nand protection of particularly vulnerable targets, such as infrastructure and public \nplaces, as well as resilience to terrorist attacks, in particular in the area of civil \nprotection, and encourages Member States to consider developing or further \nimproving their strategies for reducing risks to critical infrastructure from terrorist \nattacks, which should include, inter alia, assessing and raising awareness of the \nrelevant risks, taking preparedness measures, including effective responses to such \nattacks, as well as promoting better interoperability in security and consequence \nmanagement and facilitating the effective interaction of all stakeholders involved; \n \n43. Expresses concern at the increase, in some regions, in incidents of \nkidnapping and hostage-taking committed by terrorist groups, for any purpose, \nincluding with the aim of raising funds or gaining political concessions, notes that \nransoms paid to terrorists are used as one of the sources of funding for their activities, \nincluding further kidnappings, calls upon all Member States to prevent terrorists from \nbenefiting from ransom payments and political concessions and to secure the safe \nrelease of hostages, in accordance with applicable legal obligations, and encourages \nMember States to cooperate, as appropriate, during incidents of kidnapping and \nhostage-taking committed by terrorist groups; \n \n44. Recognizes the need to continue to take measures to prevent and suppress \nthe financing of terrorism, in this regard encourages United Nations entities to \ncooperate with Member States and to continue to provide assistance, upon their \nrequest, in particular, to help them to fully implement their respective international \nobligations to combat the financing of terrorism, and encourages Member States to \nfurther build the capacity of their financial oversight and regulatory systems around \nthe world in order to deny terrorists the space to exploit and raise funds, including by \ncooperating with the private sector through public-private partnerships with financial \ninstitutions and by taking into account the assessments thereof by relevant entities \nsuch as the Counter-Terrorism Committee Executive Directorate; \n \n45. Calls upon Member States to engage with domestic financial institutions \nand share information on terrorist financing risks to provide greater context for their \nwork in identifying potential terrorist financing activity through multiple authorities \nand channels, including law enforcement, intelligence, security services and financial \nintelligence units, and also calls upon Member States to improve the integration and \nutilization of financial intelligence to more effectively counter the terrorist financing \nthreats; \n\nA/RES/72/284 \nThe United Nations Global Counter-Terrorism Strategy Review\n \n18-10508\n12/17 \n \n \n46. Also calls upon Member States to enhance their efforts in the fight against \nthe financing of terrorism by addressing the anonymity of transactions and by tracing, \ndetecting, sanctioning and effectively dismantling illegal money transmitters and \ntackling the risks associated with the use of cash, informal remittance systems, \nprepaid credit and debit cards, cryptoassets and other anonymous means of monetary \nor financial transactions, as well as to anticipate and address, as appropriate, the risk \nof new financial instruments being abused for the purpose of terrorist financing; \n \n47. Recognizes the importance of sharing information within and between \nGovernments to effectively counter the financing of terrorism, calls upon Member \nStates, in accordance with Security Council resolution 2368 (2017) of 20 July 2017, \nto continue to exercise vigilance over relevant financial transactions and improve \ninformation-sharing capabilities and practices within and between Governments \nthrough multiple authorities and channels, including law enforcement, intelligence, \nsecurity services and financial intelligence units, and also calls upon Member States \nto improve the integration and utilization of financial intelligence with other types of \ninformation available to national Governments in order to more effectively counter \nthe terrorist financing threats posed by Islamic State in Iraq and the Levant (Da\u2019esh), \nAl-Qaida and associated individuals, groups, undertakings and entities; \n \n48. Calls upon all States to adopt such measures as may be necessary and \nappropriate, and in accordance with their obligations under international law, to \nprohibit by law incitement to commit a terrorist act or acts, prevent such conduct and \ndeny safe haven to any persons with respect to whom there is credible and relevant \ninformation giving serious reasons for considering that they have been guilty of such \nconduct; \n \n49. Calls upon Member States to collaborate in the pursuit of developing and \nimplementing effective counter-narrative strategies, in accordance with Security \nCouncil resolution 2354 (2017) of 24 May 2017, and the comprehensive international \nframework to counter terrorist narratives,9 including those relating to foreign terrorist \nfighters, in a manner compliant with their obligations under international law, \nincluding international human rights law, international refugee law and international \nhumanitarian law; \n \n50. Calls upon all Member States to support international efforts to prevent \nterrorists from acquiring weapons of mass destruction and their means of delivery, \nurges all Member States to take and strengthen national measures, as appropriate, to \nprevent terrorists from acquiring weapons of mass destruction, their means of delivery \nand related materials, equipment and technologies related to their manufacture, and \nencourages cooperation among and between Member States and relevant regional and \ninternational organizations for strengthening national capacities in this regard; \n \n51. Recognizes that improvised explosive devices are being increasingly used \nin terrorist activities, takes note of the work of the Counter-Terrorism Implementation \nTask Force (Global Counter-Terrorism Coordination Compact entities) in this regard, \nand urges its further attention to the issue of improvised explosive devices in line with \nthe mandates of the entities; \n \n52. Recalls relevant United Nations resolutions, and reaffirms that Member \nStates shall eliminate the supply of weapons, including small arms and light weapons, \nto terrorists, as well as prevent, combat and eradicate the illicit trade in said weapons, \nincluding their diversion, to terrorists; \n \n53. Calls upon Member States to establish or strengthen national, regional and \ninternational partnerships with stakeholders, both public and private, as appropriate, \nto share information and experience in order to prevent, protect against, mitigate, \n__________________ \n \n9 S/2017/375, annex. \n\nThe United Nations Global Counter-Terrorism Strategy Review \nA/RES/72/284\n \n13/17\n18-10508 \n \ninvestigate, respond to and recover from damage from terrorist attacks on critical \ninfrastructure facilities, and emphasizes the need for States able to do so to assist in \nthe delivery of effective and targeted capacity development, training and other \nnecessary resources, and technical assistance, where it is needed, to enable all States \nto develop appropriate capacity to implement contingency and response plans with \nregard to attacks on critical infrastructure and soft targets or public places; \n \n54. Recognizes that Islamic State in Iraq and the Levant (Da\u2019esh), Al-Qaida \nand its affiliates continue to pose a widespread challenge in the fight against \nterrorism, encourages Member States to integrate the Islamic State in Iraq and the \nLevant (Da\u2019esh) and Al-Qaida sanctions regime, pursuant to Security Council \nresolutions 1267 (1999) of 15 October 1999, 1989 (2011) of 17 June 2011 and \n2253 (2015) of 17 December 2015, into their national and regional counter-terrorism \nstrategies, including by proposing for inclusion on the Islamic State in Iraq and the \nLevant (Da\u2019esh) and Al-Qaida sanctions list the names of individuals, groups, \nundertakings and entities, reminds Member States of their obligation to ensure that \ntheir nationals and persons in their territory do not make economic resources available \nto Islamic State in Iraq and the Levant (Da\u2019esh), Al-Qaida and associated individuals, \ngroups, undertakings and entities, takes note of the significant contribution of the \nOffice of the Ombudsperson, since its establishment, in providing fairness and \ntransparency to the Islamic State in Iraq and the Levant (Da\u2019esh) and Al-Qaida \nsanctions regime, and stresses the need to continue efforts to ensure that procedures \nare fair and clear; \n \n55. Encourages Member States and international and regional organizations \nto enhance knowledge of and support initiatives to address, in the design and \nimplementation of global, regional and national counter-terrorism strategies, the \nlinkages between terrorism and transnational organized crime; \n \n56. Encourages \nall relevant international, regional and \nsubregional \norganizations and forums involved in the fight against terrorism to cooperate with the \nUnited Nations system and Member States in supporting the Strategy and to share \nbest practices, and calls for information-sharing, through appropriate channels and \narrangements, on individuals and entities implicated in any type of terrorist activities, \ntheir tactics and modus operandi, supply of weapons and sources of material or any \nother form of support, specific crimes related to perpetration, planning or preparation \nof terrorist acts, narratives used by terrorists to mobilize resources and garner support \nfrom sympathizers, including by exploiting information and communications \ntechnologies, and on the ongoing international counter-terrorism cooperation, \nespecially among special services, security agencies and law enforcement \norganizations and criminal justice authorities; \n \n57. Takes note of the report of the Secretary-General entitled \u201cActivities of the \nUnited Nations system in implementing the United Nations Global Counter-Terrorism \nStrategy\u201d and the annexes thereto10 and the efforts deployed by the Counter-Terrorism \nImplementation Task Force (Global Counter-Terrorism Coordination Compact \nentities), and underlines the importance of providing the resources necessary for the \nimplementation of these projects; \n \n58. Also takes note of the measures that Member States and relevant \ninternational, regional and subregional organizations have adopted within the \nframework of the Strategy, as referred to in paragraph 51 of the report of the Secretary-\nGeneral and considered at the sixth biennial review of the Strategy, on 26 and 27 June \n2018, all of which strengthen cooperation to fight terrorism, including through the \nexchange of best practices; \n__________________ \n \n10 A/72/840. \n\nA/RES/72/284 \nThe United Nations Global Counter-Terrorism Strategy Review\n \n18-10508\n14/17 \n \n \n59. Reaffirms the principal responsibility of Member States to implement the \nStrategy, while recognizing the need to enhance the important role that the United \nNations, including the Counter-Terrorism Implementation Task Force (Global \nCounter-Terrorism Coordination Compact entities), plays, in coordination with other \ninternational, regional and subregional organizations, as appropriate, in facilitating \nand promoting coordination and coherence in the implementation of the Strategy at \nthe national, regional and global levels and in providing assistance, upon request by \nMember States, especially in the area of capacity-building; \n \n60. Recognizes the work done and efforts made by the relevant United Nations \nbodies and entities and other international, regional and subregional organizations \naimed at supporting, recognizing and protecting the rights of victims of terrorism in \nall its forms and manifestations, and urges them to step up their efforts to provide, \nupon request, technical assistance for building the capacity of Member States in the \ndevelopment and implementation of programmes of assistance and support for \nvictims of terrorism; \n \n61. Also recognizes the continued need to enhance the visibility and \neffectiveness of United Nations counter-terrorism activities, underlines the \nimportance of enhancing counter-terrorism efforts undertaken by all relevant United \nNations agencies and bodies in accordance with their existing mandates, and \nencourages the Office of Counter-Terrorism to continue its collaboration with those \nagencies and bodies while also ensuring overall coordination and coherence in the \ncounter-terrorism efforts of the United Nations system, with a view to maximizing \nsynergies, promoting transparency and greater efficiencies and avoiding duplication \nof their work; \n \n62. Welcomes the efforts of the Office of Counter-Terrorism to increase its \ntransparency, accountability and effectiveness in enhancing cooperation within the \nCounter-Terrorism \nImplementation \nTask \nForce \n(Global \nCounter-Terrorism \nCoordination Compact entities), requests the Secretary-General to ensure that the \nOffice is well organized, in order to achieve these objectives and to report on an \nannual basis on progress in this regard, including on transparency in the selection and \nfunding of projects and their impact, as well as on the efficiency of shared funding \narrangements, with a view to enabling a meaningful review of the United Nations \ncounter-terrorism architecture at the seventh biennial review of the Strategy, at the \nseventy-fourth session of the General Assembly; \n \n63. Takes note of the United Nations Global Counter-Terrorism Coordination \nCompact, a framework between the Secretary-General and the Counter-Terrorism \nImplementation Task Force (Global Counter-Terrorism Coordination Compact \nentities) heads, which aims to strengthen a common-action approach to coordination \nand coherence in the work of the United Nations system to prevent and counter \nterrorism, and to strengthen support to Member States, at their request and in \ncooperation with relevant international, regional and subregional organizations, to \nidentify and share best practices and help in capacity-building, in the implementation \nof the Strategy and relevant Security Council resolutions, while ensuring compliance \nwith international law, including international human rights law and, where \napplicable, international humanitarian law, and looks forward to the periodic briefings \nby the Office of Counter-Terrorism to Member States on the activities of the Compact \nentities; \n \n64. Recognizes the role of the regional organizations, structures and strategies \nin combating terrorism, and encourages those entities to enhance interregional \ndialogue and cooperation and consider using best practices developed by other \nregions in their fight against terrorism, as appropriate, taking into account their \nspecific regional and national circumstances; \n\nThe United Nations Global Counter-Terrorism Strategy Review \nA/RES/72/284\n \n15/17\n18-10508 \n \n \n65. Encourages all Member States to collaborate with the United Nations \nCounter-Terrorism Centre and to contribute to the implementation of its activities \nwithin the Counter-Terrorism Implementation Task Force (Global Counter-Terrorism \nCoordination Compact entities), including through the development, funding and \nimplementation of capacity-building projects in order to mobilize a stronger and more \nsystematic response to terrorism at the national, regional and global levels; \n \n66. Notes with appreciation the activities undertaken in the area of capacity-\nbuilding, including in the areas of countering the financing of terrorism, border \ncontrol, maritime and aviation security, and preventing the flow of foreign terrorist \nfighters, by United Nations entities, including the United Nations Counter-Terrorism \nCentre and the Counter-Terrorism Implementation Task Force (Global Counter-\nTerrorism Coordination Compact entities), inter alia, the United Nations Educational, \nScientific and Cultural Organization, the United Nations Office on Drugs and Crime \nand INTERPOL, in coordination with other relevant international, regional and \nsubregional organizations, to assist Member States, upon their request, in \nimplementing the Strategy, and encourages the Task Force to ensure the focused \ndelivery of capacity-building assistance, including in the framework of the Integrated \nAssistance for Countering Terrorism Initiative; \n \n67. Recalls its resolution 72/194 of 19 December 2017, and notes with \nappreciation the ongoing work of the United Nations Office on Drugs and Crime to \nsupport Member States in their efforts to prevent and counter terrorism in all its forms \nand manifestations in the crime prevention and criminal justice context; \n \n68. Calls upon the United Nations Office on Drugs and Crime, including its \nTerrorism Prevention Branch, to further enhance, in close consultation with the \nCounter-Terrorism Committee and its Executive Directorate, its provision of \ntechnical assistance, upon request, for building the capacity of Member States to \nbecome party to and implement the international conventions and protocols related to \ncounter-terrorism and relevant United Nations resolutions, including through targeted \nprogrammes and the training of relevant criminal justice and law enforcement \nofficials, upon request, to develop their capacity to effectively respond to, prevent, \ninvestigate and prosecute terrorist acts, the development of and participation in \nrelevant initiatives and the development of technical tools and publications, within its \nmandate; \n \n69. Requests the United Nations Office on Drugs and Crime, whenever \nappropriate, to take into account in its technical assistance to counter terrorism, upon \nrequest, the elements necessary for building national capacity in order to strengthen \ncriminal justice systems and the rule of law; \n \n70. Stresses the need to continue to provide tangible capacity-building \nassistance to Member States in counter-terrorism matters, recognizes in this regard \nthe need to contribute more resources for capacity-building projects, takes note of the \nimplementation of the United Nations capacity-building implementation plan for \ncountering the flow of foreign terrorist fighters by the Counter-Terrorism \nImplementation Task Force (Global Counter-Terrorism Coordination Compact \nentities), and encourages Member States to provide financial and other assistance to \nthe Task Force and the United Nations Counter-Terrorism Centre needed for the \neffective delivery of the projects mentioned in that plan, in close consultation with \nMember States; \n \n71. Calls for the enhanced engagement of Member States with the work of the \nCounter-Terrorism \nImplementation \nTask \nForce \n(Global \nCounter-Terrorism \nCoordination Compact entities); \n\nA/RES/72/284 \nThe United Nations Global Counter-Terrorism Strategy Review\n \n18-10508\n16/17 \n \n \n72. Requests the Counter-Terrorism Implementation Task Force (Global \nCounter-Terrorism Coordination Compact entities) to continue its positive efforts in \ninteracting with Member States, and requests the Office of Counter-Terrorism to \ncontinue to provide quarterly briefings and to provide a periodic workplan, including \nthe activities of the United Nations Counter-Terrorism Centre, and to provide full \ntransparency to all Member States on its work and programmes; \n \n73. Encourages the Office of Counter-Terrorism and the Global Counter-\nTerrorism Coordination Compact entities to work closely with Member States and \nrelevant international, regional and subregional organizations to identify and share \nbest practices to prevent terrorist attacks on potentially vulnerable targets, including \ncritical infrastructure, and recognizes the importance of developing public-private \npartnerships in this area; \n \n74. Underscores the role, within the United Nations, of the Counter-Terrorism \nCommittee Executive Directorate, including in assessing issues and trends relating to \nthe implementation of Security Council resolutions 1373 (2001) of 28 September \n2001, 1624 (2005) of 14 September 2005 and 2178 (2014), in accordance with its \nmandate and Council resolution 2395 (2017) of 21 December 2017, and in sharing \ninformation, as appropriate, with relevant United Nations counter-terrorism bodies \nand relevant international, regional and subregional organizations, and calls upon the \nOffice of Counter-Terrorism, all other relevant United Nations funds and \nprogrammes, Member States, donors and recipients to use expert assessments and \nrecommendations of the Directorate as they design technical assistance and capacity-\nbuilding efforts, including in furthering the balanced implementation of the Strategy \nacross all four of its pillars, except when requested by the assessed Member States to \nkeep selected information confidential; \n \n75. Calls for greater coordination and coherence among the United Nations \nentities and with stakeholders, including donors, host countries and recipients of \ncounter-terrorism capacity-building, including in developing and maintaining \neffective and rule of law-based criminal justice systems, and also calls for dialogue \nto be enhanced among all stakeholders, with a view to placing national perspectives \nat the centre of such capacity-building in order to strengthen national ownership, \nwhile recognizing that rule of law activities must be anchored in a national context \nand that States have different national experiences in the development of their \ncriminal justice systems, taking into account their legal, political, socioeconomic, \ncultural, religious and other local specificities, while also recognizing that there are \ncommon features founded on international norms and standards; \n \n76. Calls upon Member States and the United Nations entities involved in \nsupporting counter-terrorism efforts to continue to facilitate the promotion and \nprotection of human rights and fundamental freedoms, as well as due process and the \nrule of law, while countering terrorism, and in this regard expresses serious concern \nat the occurrence of violations of human rights and fundamental freedoms, as well as \nof international refugee and humanitarian law, committed in the context of countering \nterrorism; \n \n77. Reiterates that, given their potential status as victims of terrorism as well \nas of other violations of international law, all children alleged to have, accused of \nhaving or recognized as having infringed the law, particularly those who are deprived \nof their liberty, as well as child victims and witnesses of crimes, should be treated in \na manner consistent with their rights, dignity and needs, in accordance with applicable \ninternational law, in particular obligations under the Convention on the Rights of the \nChild,11 and, bearing in mind relevant international standards on human rights in the \n__________________ \n \n11 United Nations, Treaty Series, vol. 1577, No. 27531. \n\nThe United Nations Global Counter-Terrorism Strategy Review \nA/RES/72/284\n \n17/17\n18-10508 \n \nadministration of justice in this regard, urges Member States to take relevant measures \nto effectively reintegrate children formerly associated with armed groups, including \nterrorist groups; \n \n78. Urges Member States to ensure that any measures taken or means \nemployed to counter terrorism, including the use of remotely piloted aircraft, comply \nwith their obligations under international law, including the Charter, human rights law \nand international humanitarian law, in particular the principles of distinction and \nproportionality; \n \n79. Urges States to ensure, in accordance with their obligations under \ninternational law and national regulations, and whenever international humanitarian \nlaw is applicable, that counter-terrorism legislation and measures do not impede \nhumanitarian and medical activities or engagement with all relevant actors as foreseen \nby international humanitarian law; \n \n80. Reaffirms the primary responsibility of States to protect the population \nthroughout their territory, and recalls in this regard that all parties to armed conflict \nmust comply fully with the obligations applicable to them under international \nhumanitarian law related to the protection of civilians and medical personnel in armed \nconflict; \n \n81. Underlines the importance of multilateral efforts in combating terrorism \nand refraining from any practices and measures inconsistent with international law \nand the principles of the Charter; \n \n82. Takes note of the initiative of the Secretary-General to convene the first-\never United Nations High-level Conference of Heads of Counter-Terrorism Agencies \nof Member States, on 28 and 29 June 2018; \n \n83. Requests the Secretary-General to submit to the General Assembly at its \nseventy-third session, no later than May 2019, a report containing concrete \nrecommendations and options on ways to assess the impact of and progress in the \nimplementation of the Strategy by the United Nations entities with a view to \ninforming discussion among Member States in advance of the seventh biennial review \nof the Strategy, at the seventy-fourth session of the General Assembly; \n \n84. Also requests the Secretary-General to submit to the General Assembly at \nits seventy-fourth session, no later than February 2020, a report on progress made in \nthe implementation of the Strategy, containing suggestions for its future \nimplementation by the United Nations system, as well as on progress made in the \nimplementation of the present resolution; \n \n85. Decides to include in the provisional agenda of its seventy-fourth session \nthe item entitled \u201cThe United Nations Global Counter-Terrorism Strategy\u201d in order to \nundertake, by June 2020, an examination of the report of the Secretary-General \nrequested in paragraph 84 above, as well as of the implementation of the Strategy by \nMember States, and to consider updating the Strategy to respond to changes. \n \n101st plenary meeting \n26 June 2018 \n \n \n",
  "paragraphs": {
    "1": "Reiterates its strong and unequivocal condemnation of terrorism in all its forms and manifestations, committed by whomever, wherever and for whatever purposes;",
    "2": "Reaffirms the United Nations Global Counter-Terrorism Strategy5 and its four pillars, which constitute an ongoing effort, and calls upon Member States, the United Nations and other appropriate international, regional and subregional organizations to step up their efforts to implement the Strategy in an integrated and balanced manner and in all its aspects;",
    "3": "Stresses the importance of keeping the Strategy relevant and contemporary in the light of emerging new threats and evolving trends of international terrorism;",
    "4": "Affirms the importance of the integrated and balanced implementation of all pillars of the Strategy, recognizing the need to redouble efforts for even attention to be paid to and the even implementation of all the pillars of the Strategy;",
    "5": "Recognizes the principal responsibility of Member States to implement the Strategy, while encouraging the further elaboration and development of national, subregional and regional plans, as appropriate, to support the implementation of the Strategy;",
    "6": "Recalls the establishment of the Office of Counter-Terrorism in its resolution 71/291;",
    "7": "Calls upon States that have not done so to consider becoming parties in a timely manner to the existing international conventions and protocols against terrorism, and upon all States to make every effort to conclude a comprehensive convention on international terrorism, and recalls the commitments of Member States with regard to the implementation of General Assembly and Security Council resolutions relating to international terrorism;",
    "8": "Recalls all the resolutions of the General Assembly on measures to eliminate international terrorism and the relevant resolutions of the Assembly on the protection of human rights and fundamental freedoms while countering terrorism and all resolutions of the Security Council relating to international terrorism, and calls __________________ 5 Resolution 60/288. A/RES/72/284 The United Nations Global Counter-Terrorism Strategy Review 18-10508 6/17 upon Member States to cooperate fully with the relevant bodies of the United Nations in the fulfilment of their tasks, recognizing that many States continue to require assistance in implementing these resolutions;",
    "9": "Stresses the significance of a sustained and comprehensive approach, including through stronger efforts, where necessary, to address conditions conducive to the spread of terrorism, bearing in mind that terrorism will not be defeated by military force, law enforcement measures and intelligence operations alone;",
    "10": "Also stresses that, when counter-terrorism efforts neglect the rule of law at the national and international levels and violate international law, including the Charter of the United Nations, international humanitarian law and refugee law, human rights and fundamental freedoms, they not only betray the values that they seek to uphold, but they may also further fuel violent extremism that can be conducive to terrorism;",
    "11": "Encourages Member States to engage with relevant local communities and non-governmental actors, where appropriate, in developing tailored strategies to counter the violent extremist narrative that can incite recruitment to terrorist groups and the commission of terrorist acts and to address the conditions conducive to the spread of violent extremism as and when conducive to terrorism;",
    "12": "Encourages Member States, United Nations entities, regional and subregional organizations and relevant actors to consider instituting mechanisms to involve youth in the promotion of a culture of peace, tolerance and intercultural and interreligious dialogue and develop, as appropriate, an understanding of respect for human dignity, pluralism and diversity, including, as appropriate, through education programmes, that could discourage their participation in acts of terrorism, violent extremism conducive to terrorism, violence, xenophobia and all forms of discrimination, also encourages Member States to empower youth through the promotion of media and information literacy by including youth in decision-making processes and considering practical ways to include youth in the development of relevant programmes and initiatives aimed at preventing violent extremism conducive to terrorism, and urges Member States to take effective measures, in conformity with international law, to protect young people affected or exploited by terrorism or violent extremism conducive to terrorism;",
    "13": "Deeply deplores the suffering caused by terrorism to the victims of terrorism in all its forms and manifestations and to their families, expresses its profound solidarity with them, and encourages Member States to provide them with proper support and assistance while taking into account, inter alia, when appropriate, considerations regarding remembrance, dignity, respect, justice and truth, in accordance with international law;",
    "14": "Acknowledges the importance of building the resilience of victims and their families as an integral part of a counter-terrorism strategy, and encourages Member States to include this aspect in their national counter-terrorism strategies, including by providing victims and their families with proper support and assistance immediately after an attack and in the long term and sharing on a voluntary basis best practices and lessons learned related to the protection of victims of terrorism, including regarding the provision of legal, medical, psychosocial or financial support;",
    "15": "Emphasizes that tolerance, pluralism, respect for diversity, dialogue among civilizations and the enhancement of interreligious and intercultural understanding and respect among peoples, including at the national, regional and global levels, while avoiding the escalation of hatred, are among the most important elements in promoting cooperation, in combating terrorism and in countering violent extremism as and when conducive to terrorism, and welcomes the various initiatives to this end; The United Nations Global Counter-Terrorism Strategy Review A/RES/72/284 7/17 18-10508",
    "16": "Urges all Member States and the United Nations to unite against violent extremism as and when conducive to terrorism, encourages the efforts of leaders to discuss within their communities the drivers of violent extremism conducive to terrorism and to evolve strategies to address them, and underlines that States, regional organizations, non-governmental organizations, religious bodies and the media have an important role to play in promoting tolerance and facilitating understanding, inclusive dialogue and respect for religious and cultural diversity and human rights;",
    "17": "Recognizes the difficulties faced by the international community in addressing the conditions conducive to the spread of terrorism and violent extremism, which can be conducive to terrorism, and urges Member States and the United Nations system to take measures, pursuant to international law and while ensuring national ownership, to address all drivers of violent extremism conducive to terrorism, both internal and external, in a balanced manner;",
    "18": "Also recognizes the importance of preventing violent extremism as and when conducive to terrorism and in this regard recalls its resolution 70/254 of 12 February 2016, in which it welcomed the initiative by the Secretary-General and took note of his Plan of Action to Prevent Violent Extremism, 6 recommends that Member States consider the implementation of relevant recommendations of the Plan of Action, as applicable to the national context, encourages United Nations entities, in line with their mandates, to implement relevant recommendations of the Plan of Action, including by providing technical assistance to Member States upon their request, and invites Member States and regional and subregional organizations to consider developing national and regional plans of action to prevent violent extremism as and when conducive to terrorism, in accordance with their priorities and taking into account, as appropriate, the Secretary-General\u2019s Plan of Action, as well as other relevant documents;",
    "19": "Urges all States to respect and protect the right to privacy, as set out in article 12 of the Universal Declaration of Human Rights 7 and article 17 of the International Covenant on Civil and Political Rights, 8 including in the context of digital communication, also while countering terrorism, in accordance with international law, in particular international human rights law, and to take measures to ensure that interferences with or restrictions on that right are not arbitrary or unlawful and are subject to effective oversight and to appropriate redress, including through judicial review or other legal means;",
    "20": "Calls upon States, while countering terrorism and preventing violent extremism conducive to terrorism, to review their procedures, practices and legislation regarding the surveillance of communications, their interception and the collection of personal data, including mass surveillance, interception and collection, with a view to upholding the right to privacy, as set out in article 12 of the Universal Declaration of Human Rights and article 17 of the International Covenant on Civil and Political Rights, by ensuring the full and effective implementation of all their obligations under international human rights law;",
    "21": "Stresses that it is essential to address the threat posed by narratives used by terrorists and that, in this regard, the international community should consider developing an accurate understanding of how terrorists motivate others to commit terrorist acts or recruit them, and develop the most effective means to counter terrorist propaganda, incitement and recruitment, including through the Internet, in compliance with international law, including international human rights law; __________________ 6 See A/70/674. 7 Resolution 217 A (III). 8 See resolution 2200 A (XXI), annex. A/RES/72/284 The United Nations Global Counter-Terrorism Strategy Review 18-10508 8/17",
    "22": "Notes that terrorists may craft distorted narratives that are based on the misinterpretation and misrepresentation of religion to justify violence, which are utilized to recruit supporters and foreign terrorist fighters, mobilize resources and garner support from sympathizers, in particular by exploiting information and communications technologies, including through the Internet and social media, and also notes in this regard the urgent need for the international community to globally counter such activities;",
    "23": "Stresses that States should consider engaging, where appropriate, with religious authorities and community leaders with relevant expertise, including in crafting and delivering effective counter-narratives and in countering narratives used by terrorists and their supporters, and also stresses that counter-narratives should aim not only to rebut terrorists\u2019 messages but also to amplify positive narratives, provide credible alternatives and address issues of concern to vulnerable audiences who are subject to terrorist narratives;",
    "24": "Encourages civil society, including non-governmental organizations, to engage, as appropriate, in efforts to enhance the implementation of the Strategy, including through interaction with Member States and the United Nations system, and encourages Member States and the Counter-Terrorism Implementation Task Force (Global Counter-Terrorism Coordination Compact entities) to enhance engagement with civil society in accordance with their mandates, as appropriate, and to support its role in the implementation of the Strategy;",
    "25": "Calls upon all Member States, given the complex global security context today, to highlight the important role of women in countering terrorism and violent extremism as and when conducive to terrorism, and urges Member States and United Nations entities to integrate a gender analysis on the drivers of radicalization of women to terrorism into their relevant programmes, to consider, when appropriate, the impacts of counter-terrorism strategies on women\u2019s human rights and women\u2019s organizations and to seek greater consultations with women and women\u2019s organizations when developing strategies to counter terrorism and violent extremism conducive to terrorism;",
    "26": "Recognizes the need for Member States to prevent the abuse of non-governmental, non-profit and charitable organizations by and for terrorists, and calls upon non-governmental, non-profit and charitable organizations to prevent and oppose, as appropriate, attempts by terrorists to abuse the status of those organizations, while reaffirming the need to fully respect the rights to freedom of expression and association of individuals in civil society and to freedom of religion or belief of all persons;",
    "27": "Reaffirms the need for enhanced dialogue and coordination among the counter-terrorism officials, including among law enforcement entities and financial intelligence units, of Member States to promote international, regional and subregional cooperation and wider dissemination of knowledge of the Strategy in order to counter terrorism, and in this regard recalls the role of the United Nations system, in particular the Counter-Terrorism Implementation Task Force (Global Counter-Terrorism Coordination Compact entities), in promoting international cooperation and capacity-building as elements of the Strategy;",
    "28": "Calls upon all Member States, in accordance with their obligations under applicable international law, including the Charter, to deny terrorist groups safe haven, freedom of operations, movement and recruitment and financial, material or political support, which endanger national, regional and international peace and security, and to bring to justice or, where appropriate, extradite, on the basis of the principle of extradite or prosecute, the perpetrators of terrorist acts or any person who The United Nations Global Counter-Terrorism Strategy Review A/RES/72/284 9/17 18-10508 supports, facilitates or participates or attempts to participate in the financing, planning or preparation of terrorist acts;",
    "29": "Urges Member States to provide full coordination and afford one another the greatest measure of assistance, in accordance with their obligations under international law, in criminal investigations or criminal proceedings relating to the financing or support of terrorist acts, especially with those States where, or against whose citizens, terrorist acts are committed, including obtaining evidence for the proceedings involving terrorist organizations, terrorist entities or foreign terrorist fighters, and recalls that all States must cooperate fully in the fight against terrorism on the basis of mutual legal assistance and the principle of extradite or prosecute, welcoming their efforts to elaborate on the existing extradition and mutual legal assistance mechanisms;",
    "30": "Calls upon Member States to prevent refugee status from being abused by the perpetrators, organizers or facilitators of terrorist acts, and also calls upon Member States to take appropriate measures to ensure, before granting asylum, that the asylum seeker has not planned, facilitated or participated in the commission of terrorist acts, while reaffirming the importance of protecting refugees and asylum seekers in accordance with States\u2019 obligations under international law, in particular international human rights law, refugee law and humanitarian law;",
    "31": "Urges Member States to ensure no tolerance for terrorism, regardless of the targets or motives, and reaffirms its call to refrain from organizing, instigating, facilitating, participating in, financing, encouraging or tolerating terrorist activities and to take appropriate practical measures to ensure that their respective territories are not used for terrorist installations or training camps or for the preparation or organization of terrorist acts intended to be committed against other States or their citizens;",
    "32": "Expresses concern over terrorist acts committed by lone terrorists in various parts of the world, acknowledges the specific challenges created by lone terrorists as they are difficult to detect, and recognizes the need to address this issue expeditiously;",
    "33": "Condemns the failure to take all feasible precautions to protect the civilian population and civilian objects against the effects of attacks when using civilian objects, in particular schools and hospitals, for military purposes such as launching attacks and storing weapons, and strongly condemns the use of civilians to shield military objectives from attacks;",
    "34": "Encourages Member States to consider better ways to cooperate to exchange information, assist one another, prosecute those who use information and communications technologies for terrorist purposes and implement other appropriate cooperative measures to address such threats;",
    "35": "Expresses concern at the increasing use, in a globalized society, by terrorists and their supporters, of information and communications technologies, in particular the Internet and other media, and the use of such technologies to commit, incite, recruit for, fund or plan terrorist acts, notes the importance of cooperation among stakeholders in the implementation of the Strategy, including among Member States, international, regional and subregional organizations, the private sector and civil society, to address this issue, while respecting human rights and fundamental freedoms and complying with international law and the purposes and principles of the Charter, and reiterates that such technologies can be powerful tools in countering the spread of terrorism, including by promoting tolerance and dialogue among peoples and peace; A/RES/72/284 The United Nations Global Counter-Terrorism Strategy Review 18-10508 10/17",
    "36": "Recalls Security Council resolutions 2178 (2014) of 24 September 2014 and 2396 (2017) of 21 December 2017, and reaffirms the need to strengthen efforts to address the evolving threat of foreign terrorist fighters;",
    "37": "Calls upon Member States to strengthen cooperation at the international, regional, subregional and bilateral levels to counter the threat posed by foreign terrorist fighters, including through enhanced operational and timely information- sharing, recalling in this regard that Member States should notify the relevant authorities, in a timely manner, upon travel, departure, arrival or deportation of captured or detained individuals whom they have reasonable grounds to believe are foreign terrorist fighters, pursuant to Security Council resolution 2396 (2017), logistical support, as appropriate, and capacity-building activities, to share and adopt best practices to identify foreign terrorist fighters, to prevent the travel of foreign terrorist fighters from, into or through Member States, to prevent the financing, mobilization, recruitment and organization of foreign terrorist fighters, and to strengthen international and regional cooperation in information-sharing and evidence-gathering, and calls upon law enforcement and criminal justice authorities to better counter the threat of returning and relocating foreign terrorist fighters, to counter violent extremism conducive to terrorism and radicalization to terrorism, to enhance efforts to implement deradicalization programmes and to ensure that any person who participates in the financing, planning, preparation or perpetration of terrorist acts or in the supporting of terrorist acts or in providing funds to terrorists is brought to justice, in compliance with obligations under international law, as well as applicable domestic law;",
    "38": "Calls upon all States to use applicable international instruments to which they are parties, as appropriate, as a basis for mutual legal assistance and, as appropriate, for extradition in terrorism cases, and encourages States, in the absence of applicable conventions or provisions, to cooperate where possible on the basis of reciprocity or on a case-by-case basis;",
    "39": "Calls upon all Member States, in accordance with their obligations under international law, to cooperate in efforts to address the threat posed by foreign terrorist fighters, including by preventing the radicalization to terrorism and recruitment of foreign terrorist fighters, preventing the movement of foreign terrorist fighters across their borders, including through enhanced border security and controls on issuance of identity papers and travel documents, disrupting and preventing financial support to foreign terrorist fighters and developing and implementing prosecution, rehabilitation and reintegration strategies, taking into account gender and age dimensions, for returning and relocating foreign terrorist fighters and their families, underscores in this regard the importance of a whole-of-government approach, recognizes the role that civil society organizations can play as they may have relevant knowledge of, access to and engagement with local communities, to be able to confront the challenges of recruitment and radicalization to terrorism, notes that children may be especially vulnerable to radicalization to violence and in need of particular psychosocial support, such as post-trauma counselling, while stressing that children need to be treated in a manner that respects their rights and protects their dignity, in accordance with applicable international law, and in this regard encourages all Member States to develop effective strategies to deal with returnees, including through repatriation, in accordance with relevant international obligations and national law;",
    "40": "Expresses concern that international networks have been established by terrorist organizations that facilitate the travel of foreign terrorist fighters to conflict zones, and calls upon all Member States to take appropriate measures to dismantle such networks, in accordance with their international obligations; The United Nations Global Counter-Terrorism Strategy Review A/RES/72/284 11/17 18-10508",
    "41": "Also expresses concern at the increasing flow of international recruits to terrorist organizations, including foreign terrorist fighters, and at the threat that it poses for all Member States, including countries of origin, transit and destination, encourages all Member States to address this threat by enhancing their cooperation and developing relevant measures to prevent and tackle this phenomenon, including information-sharing, border management to detect travel, including through the implementation of obligations on the use of advance passenger information, passenger name record and biometric data, with full respect for human rights and fundamental freedoms, calls upon Member States to make effective use of the databases of the International Criminal Police Organization (INTERPOL), as appropriate, by connecting to law enforcement, border security and customs agencies through their national central bureaux, requests Member States to help to build the capacity of other Member States, upon their request, to address the threat posed by foreign terrorist fighters, notes in this regard that some Member States may require technical assistance and capacity-building support, and encourages the provision of assistance to help to address such gaps, and the consideration of the use of United Nations instruments, such as sanctions regimes, as well as cooperation;",
    "42": "Calls upon Member States to strengthen efforts to improve the security and protection of particularly vulnerable targets, such as infrastructure and public places, as well as resilience to terrorist attacks, in particular in the area of civil protection, and encourages Member States to consider developing or further improving their strategies for reducing risks to critical infrastructure from terrorist attacks, which should include, inter alia, assessing and raising awareness of the relevant risks, taking preparedness measures, including effective responses to such attacks, as well as promoting better interoperability in security and consequence management and facilitating the effective interaction of all stakeholders involved;",
    "43": "Expresses concern at the increase, in some regions, in incidents of kidnapping and hostage-taking committed by terrorist groups, for any purpose, including with the aim of raising funds or gaining political concessions, notes that ransoms paid to terrorists are used as one of the sources of funding for their activities, including further kidnappings, calls upon all Member States to prevent terrorists from benefiting from ransom payments and political concessions and to secure the safe release of hostages, in accordance with applicable legal obligations, and encourages Member States to cooperate, as appropriate, during incidents of kidnapping and hostage-taking committed by terrorist groups;",
    "44": "Recognizes the need to continue to take measures to prevent and suppress the financing of terrorism, in this regard encourages United Nations entities to cooperate with Member States and to continue to provide assistance, upon their request, in particular, to help them to fully implement their respective international obligations to combat the financing of terrorism, and encourages Member States to further build the capacity of their financial oversight and regulatory systems around the world in order to deny terrorists the space to exploit and raise funds, including by cooperating with the private sector through public-private partnerships with financial institutions and by taking into account the assessments thereof by relevant entities such as the Counter-Terrorism Committee Executive Directorate;",
    "45": "Calls upon Member States to engage with domestic financial institutions and share information on terrorist financing risks to provide greater context for their work in identifying potential terrorist financing activity through multiple authorities and channels, including law enforcement, intelligence, security services and financial intelligence units, and also calls upon Member States to improve the integration and utilization of financial intelligence to more effectively counter the terrorist financing threats; A/RES/72/284 The United Nations Global Counter-Terrorism Strategy Review 18-10508 12/17",
    "46": "Also calls upon Member States to enhance their efforts in the fight against the financing of terrorism by addressing the anonymity of transactions and by tracing, detecting, sanctioning and effectively dismantling illegal money transmitters and tackling the risks associated with the use of cash, informal remittance systems, prepaid credit and debit cards, cryptoassets and other anonymous means of monetary or financial transactions, as well as to anticipate and address, as appropriate, the risk of new financial instruments being abused for the purpose of terrorist financing;",
    "47": "Recognizes the importance of sharing information within and between Governments to effectively counter the financing of terrorism, calls upon Member States, in accordance with Security Council resolution 2368 (2017) of 20 July 2017, to continue to exercise vigilance over relevant financial transactions and improve information-sharing capabilities and practices within and between Governments through multiple authorities and channels, including law enforcement, intelligence, security services and financial intelligence units, and also calls upon Member States to improve the integration and utilization of financial intelligence with other types of information available to national Governments in order to more effectively counter the terrorist financing threats posed by Islamic State in Iraq and the Levant (Da\u2019esh), Al-Qaida and associated individuals, groups, undertakings and entities;",
    "48": "Calls upon all States to adopt such measures as may be necessary and appropriate, and in accordance with their obligations under international law, to prohibit by law incitement to commit a terrorist act or acts, prevent such conduct and deny safe haven to any persons with respect to whom there is credible and relevant information giving serious reasons for considering that they have been guilty of such conduct;",
    "49": "Calls upon Member States to collaborate in the pursuit of developing and implementing effective counter-narrative strategies, in accordance with Security Council resolution 2354 (2017) of 24 May 2017, and the comprehensive international framework to counter terrorist narratives,9 including those relating to foreign terrorist fighters, in a manner compliant with their obligations under international law, including international human rights law, international refugee law and international humanitarian law;",
    "50": "Calls upon all Member States to support international efforts to prevent terrorists from acquiring weapons of mass destruction and their means of delivery, urges all Member States to take and strengthen national measures, as appropriate, to prevent terrorists from acquiring weapons of mass destruction, their means of delivery and related materials, equipment and technologies related to their manufacture, and encourages cooperation among and between Member States and relevant regional and international organizations for strengthening national capacities in this regard;",
    "51": "Recognizes that improvised explosive devices are being increasingly used in terrorist activities, takes note of the work of the Counter-Terrorism Implementation Task Force (Global Counter-Terrorism Coordination Compact entities) in this regard, and urges its further attention to the issue of improvised explosive devices in line with the mandates of the entities;",
    "52": "Recalls relevant United Nations resolutions, and reaffirms that Member States shall eliminate the supply of weapons, including small arms and light weapons, to terrorists, as well as prevent, combat and eradicate the illicit trade in said weapons, including their diversion, to terrorists;",
    "53": "Calls upon Member States to establish or strengthen national, regional and international partnerships with stakeholders, both public and private, as appropriate, to share information and experience in order to prevent, protect against, mitigate, __________________ 9 S/2017/375, annex. The United Nations Global Counter-Terrorism Strategy Review A/RES/72/284 13/17 18-10508 investigate, respond to and recover from damage from terrorist attacks on critical infrastructure facilities, and emphasizes the need for States able to do so to assist in the delivery of effective and targeted capacity development, training and other necessary resources, and technical assistance, where it is needed, to enable all States to develop appropriate capacity to implement contingency and response plans with regard to attacks on critical infrastructure and soft targets or public places;",
    "54": "Recognizes that Islamic State in Iraq and the Levant (Da\u2019esh), Al-Qaida and its affiliates continue to pose a widespread challenge in the fight against terrorism, encourages Member States to integrate the Islamic State in Iraq and the Levant (Da\u2019esh) and Al-Qaida sanctions regime, pursuant to Security Council resolutions 1267 (1999) of 15 October 1999, 1989 (2011) of 17 June 2011 and 2253 (2015) of 17 December 2015, into their national and regional counter-terrorism strategies, including by proposing for inclusion on the Islamic State in Iraq and the Levant (Da\u2019esh) and Al-Qaida sanctions list the names of individuals, groups, undertakings and entities, reminds Member States of their obligation to ensure that their nationals and persons in their territory do not make economic resources available to Islamic State in Iraq and the Levant (Da\u2019esh), Al-Qaida and associated individuals, groups, undertakings and entities, takes note of the significant contribution of the Office of the Ombudsperson, since its establishment, in providing fairness and transparency to the Islamic State in Iraq and the Levant (Da\u2019esh) and Al-Qaida sanctions regime, and stresses the need to continue efforts to ensure that procedures are fair and clear;",
    "55": "Encourages Member States and international and regional organizations to enhance knowledge of and support initiatives to address, in the design and implementation of global, regional and national counter-terrorism strategies, the linkages between terrorism and transnational organized crime;",
    "56": "Encourages all relevant international, regional and subregional organizations and forums involved in the fight against terrorism to cooperate with the United Nations system and Member States in supporting the Strategy and to share best practices, and calls for information-sharing, through appropriate channels and arrangements, on individuals and entities implicated in any type of terrorist activities, their tactics and modus operandi, supply of weapons and sources of material or any other form of support, specific crimes related to perpetration, planning or preparation of terrorist acts, narratives used by terrorists to mobilize resources and garner support from sympathizers, including by exploiting information and communications technologies, and on the ongoing international counter-terrorism cooperation, especially among special services, security agencies and law enforcement organizations and criminal justice authorities;",
    "57": "Takes note of the report of the Secretary-General entitled \u201cActivities of the United Nations system in implementing the United Nations Global Counter-Terrorism Strategy\u201d and the annexes thereto10 and the efforts deployed by the Counter-Terrorism Implementation Task Force (Global Counter-Terrorism Coordination Compact entities), and underlines the importance of providing the resources necessary for the implementation of these projects;",
    "58": "Also takes note of the measures that Member States and relevant international, regional and subregional organizations have adopted within the framework of the Strategy, as referred to in paragraph 51 of the report of the Secretary- General and considered at the sixth biennial review of the Strategy, on 26 and 27 June 2018, all of which strengthen cooperation to fight terrorism, including through the exchange of best practices; __________________ 10 A/72/840. A/RES/72/284 The United Nations Global Counter-Terrorism Strategy Review 18-10508 14/17",
    "59": "Reaffirms the principal responsibility of Member States to implement the Strategy, while recognizing the need to enhance the important role that the United Nations, including the Counter-Terrorism Implementation Task Force (Global Counter-Terrorism Coordination Compact entities), plays, in coordination with other international, regional and subregional organizations, as appropriate, in facilitating and promoting coordination and coherence in the implementation of the Strategy at the national, regional and global levels and in providing assistance, upon request by Member States, especially in the area of capacity-building;",
    "60": "Recognizes the work done and efforts made by the relevant United Nations bodies and entities and other international, regional and subregional organizations aimed at supporting, recognizing and protecting the rights of victims of terrorism in all its forms and manifestations, and urges them to step up their efforts to provide, upon request, technical assistance for building the capacity of Member States in the development and implementation of programmes of assistance and support for victims of terrorism;",
    "61": "Also recognizes the continued need to enhance the visibility and effectiveness of United Nations counter-terrorism activities, underlines the importance of enhancing counter-terrorism efforts undertaken by all relevant United Nations agencies and bodies in accordance with their existing mandates, and encourages the Office of Counter-Terrorism to continue its collaboration with those agencies and bodies while also ensuring overall coordination and coherence in the counter-terrorism efforts of the United Nations system, with a view to maximizing synergies, promoting transparency and greater efficiencies and avoiding duplication of their work;",
    "62": "Welcomes the efforts of the Office of Counter-Terrorism to increase its transparency, accountability and effectiveness in enhancing cooperation within the Counter-Terrorism Implementation Task Force (Global Counter-Terrorism Coordination Compact entities), requests the Secretary-General to ensure that the Office is well organized, in order to achieve these objectives and to report on an annual basis on progress in this regard, including on transparency in the selection and funding of projects and their impact, as well as on the efficiency of shared funding arrangements, with a view to enabling a meaningful review of the United Nations counter-terrorism architecture at the seventh biennial review of the Strategy, at the seventy-fourth session of the General Assembly;",
    "63": "Takes note of the United Nations Global Counter-Terrorism Coordination Compact, a framework between the Secretary-General and the Counter-Terrorism Implementation Task Force (Global Counter-Terrorism Coordination Compact entities) heads, which aims to strengthen a common-action approach to coordination and coherence in the work of the United Nations system to prevent and counter terrorism, and to strengthen support to Member States, at their request and in cooperation with relevant international, regional and subregional organizations, to identify and share best practices and help in capacity-building, in the implementation of the Strategy and relevant Security Council resolutions, while ensuring compliance with international law, including international human rights law and, where applicable, international humanitarian law, and looks forward to the periodic briefings by the Office of Counter-Terrorism to Member States on the activities of the Compact entities;",
    "64": "Recognizes the role of the regional organizations, structures and strategies in combating terrorism, and encourages those entities to enhance interregional dialogue and cooperation and consider using best practices developed by other regions in their fight against terrorism, as appropriate, taking into account their specific regional and national circumstances; The United Nations Global Counter-Terrorism Strategy Review A/RES/72/284 15/17 18-10508",
    "65": "Encourages all Member States to collaborate with the United Nations Counter-Terrorism Centre and to contribute to the implementation of its activities within the Counter-Terrorism Implementation Task Force (Global Counter-Terrorism Coordination Compact entities), including through the development, funding and implementation of capacity-building projects in order to mobilize a stronger and more systematic response to terrorism at the national, regional and global levels;",
    "66": "Notes with appreciation the activities undertaken in the area of capacity- building, including in the areas of countering the financing of terrorism, border control, maritime and aviation security, and preventing the flow of foreign terrorist fighters, by United Nations entities, including the United Nations Counter-Terrorism Centre and the Counter-Terrorism Implementation Task Force (Global Counter- Terrorism Coordination Compact entities), inter alia, the United Nations Educational, Scientific and Cultural Organization, the United Nations Office on Drugs and Crime and INTERPOL, in coordination with other relevant international, regional and subregional organizations, to assist Member States, upon their request, in implementing the Strategy, and encourages the Task Force to ensure the focused delivery of capacity-building assistance, including in the framework of the Integrated Assistance for Countering Terrorism Initiative;",
    "67": "Recalls its resolution 72/194 of 19 December 2017, and notes with appreciation the ongoing work of the United Nations Office on Drugs and Crime to support Member States in their efforts to prevent and counter terrorism in all its forms and manifestations in the crime prevention and criminal justice context;",
    "68": "Calls upon the United Nations Office on Drugs and Crime, including its Terrorism Prevention Branch, to further enhance, in close consultation with the Counter-Terrorism Committee and its Executive Directorate, its provision of technical assistance, upon request, for building the capacity of Member States to become party to and implement the international conventions and protocols related to counter-terrorism and relevant United Nations resolutions, including through targeted programmes and the training of relevant criminal justice and law enforcement officials, upon request, to develop their capacity to effectively respond to, prevent, investigate and prosecute terrorist acts, the development of and participation in relevant initiatives and the development of technical tools and publications, within its mandate;",
    "69": "Requests the United Nations Office on Drugs and Crime, whenever appropriate, to take into account in its technical assistance to counter terrorism, upon request, the elements necessary for building national capacity in order to strengthen criminal justice systems and the rule of law;",
    "70": "Stresses the need to continue to provide tangible capacity-building assistance to Member States in counter-terrorism matters, recognizes in this regard the need to contribute more resources for capacity-building projects, takes note of the implementation of the United Nations capacity-building implementation plan for countering the flow of foreign terrorist fighters by the Counter-Terrorism Implementation Task Force (Global Counter-Terrorism Coordination Compact entities), and encourages Member States to provide financial and other assistance to the Task Force and the United Nations Counter-Terrorism Centre needed for the effective delivery of the projects mentioned in that plan, in close consultation with Member States;",
    "71": "Calls for the enhanced engagement of Member States with the work of the Counter-Terrorism Implementation Task Force (Global Counter-Terrorism Coordination Compact entities); A/RES/72/284 The United Nations Global Counter-Terrorism Strategy Review 18-10508 16/17",
    "72": "Requests the Counter-Terrorism Implementation Task Force (Global Counter-Terrorism Coordination Compact entities) to continue its positive efforts in interacting with Member States, and requests the Office of Counter-Terrorism to continue to provide quarterly briefings and to provide a periodic workplan, including the activities of the United Nations Counter-Terrorism Centre, and to provide full transparency to all Member States on its work and programmes;",
    "73": "Encourages the Office of Counter-Terrorism and the Global Counter- Terrorism Coordination Compact entities to work closely with Member States and relevant international, regional and subregional organizations to identify and share best practices to prevent terrorist attacks on potentially vulnerable targets, including critical infrastructure, and recognizes the importance of developing public-private partnerships in this area;",
    "74": "Underscores the role, within the United Nations, of the Counter-Terrorism Committee Executive Directorate, including in assessing issues and trends relating to the implementation of Security Council resolutions 1373 (2001) of 28 September 2001, 1624 (2005) of 14 September 2005 and 2178 (2014), in accordance with its mandate and Council resolution 2395 (2017) of 21 December 2017, and in sharing information, as appropriate, with relevant United Nations counter-terrorism bodies and relevant international, regional and subregional organizations, and calls upon the Office of Counter-Terrorism, all other relevant United Nations funds and programmes, Member States, donors and recipients to use expert assessments and recommendations of the Directorate as they design technical assistance and capacity- building efforts, including in furthering the balanced implementation of the Strategy across all four of its pillars, except when requested by the assessed Member States to keep selected information confidential;",
    "75": "Calls for greater coordination and coherence among the United Nations entities and with stakeholders, including donors, host countries and recipients of counter-terrorism capacity-building, including in developing and maintaining effective and rule of law-based criminal justice systems, and also calls for dialogue to be enhanced among all stakeholders, with a view to placing national perspectives at the centre of such capacity-building in order to strengthen national ownership, while recognizing that rule of law activities must be anchored in a national context and that States have different national experiences in the development of their criminal justice systems, taking into account their legal, political, socioeconomic, cultural, religious and other local specificities, while also recognizing that there are common features founded on international norms and standards;",
    "76": "Calls upon Member States and the United Nations entities involved in supporting counter-terrorism efforts to continue to facilitate the promotion and protection of human rights and fundamental freedoms, as well as due process and the rule of law, while countering terrorism, and in this regard expresses serious concern at the occurrence of violations of human rights and fundamental freedoms, as well as of international refugee and humanitarian law, committed in the context of countering terrorism;",
    "77": "Reiterates that, given their potential status as victims of terrorism as well as of other violations of international law, all children alleged to have, accused of having or recognized as having infringed the law, particularly those who are deprived of their liberty, as well as child victims and witnesses of crimes, should be treated in a manner consistent with their rights, dignity and needs, in accordance with applicable international law, in particular obligations under the Convention on the Rights of the Child,11 and, bearing in mind relevant international standards on human rights in the __________________ 11 United Nations, Treaty Series, vol. 1577, No. 27531. The United Nations Global Counter-Terrorism Strategy Review A/RES/72/284 17/17 18-10508 administration of justice in this regard, urges Member States to take relevant measures to effectively reintegrate children formerly associated with armed groups, including terrorist groups;",
    "78": "Urges Member States to ensure that any measures taken or means employed to counter terrorism, including the use of remotely piloted aircraft, comply with their obligations under international law, including the Charter, human rights law and international humanitarian law, in particular the principles of distinction and proportionality;",
    "79": "Urges States to ensure, in accordance with their obligations under international law and national regulations, and whenever international humanitarian law is applicable, that counter-terrorism legislation and measures do not impede humanitarian and medical activities or engagement with all relevant actors as foreseen by international humanitarian law;",
    "80": "Reaffirms the primary responsibility of States to protect the population throughout their territory, and recalls in this regard that all parties to armed conflict must comply fully with the obligations applicable to them under international humanitarian law related to the protection of civilians and medical personnel in armed conflict;",
    "81": "Underlines the importance of multilateral efforts in combating terrorism and refraining from any practices and measures inconsistent with international law and the principles of the Charter;",
    "82": "Takes note of the initiative of the Secretary-General to convene the first- ever United Nations High-level Conference of Heads of Counter-Terrorism Agencies of Member States, on 28 and 29 June 2018;",
    "83": "Requests the Secretary-General to submit to the General Assembly at its seventy-third session, no later than May 2019, a report containing concrete recommendations and options on ways to assess the impact of and progress in the implementation of the Strategy by the United Nations entities with a view to informing discussion among Member States in advance of the seventh biennial review of the Strategy, at the seventy-fourth session of the General Assembly;",
    "84": "Also requests the Secretary-General to submit to the General Assembly at its seventy-fourth session, no later than February 2020, a report on progress made in the implementation of the Strategy, containing suggestions for its future implementation by the United Nations system, as well as on progress made in the implementation of the present resolution;",
    "85": "Decides to include in the provisional agenda of its seventy-fourth session the item entitled \u201cThe United Nations Global Counter-Terrorism Strategy\u201d in order to undertake, by June 2020, an examination of the report of the Secretary-General requested in paragraph 84 above, as well as of the implementation of the Strategy by Member States, and to consider updating the Strategy to respond to changes. 101st plenary meeting 26 June 2018"
  },
  "agenda_items": [
    "Item 118"
  ],
  "symbol_references": [
    "A/72/L.62"
  ]
}