{
  "symbol": "A/RES/73/269",
  "filename": "A_RES_73_269.pdf",
  "title": "73/269. Programme planning",
  "text": "United Nations \nA/RES/73/269\n \n \nGeneral Assembly \nDistr.: General \n4 January 2019 \n \n18-22654 (E)    080119  \n*1822654* \n \n \nSeventy-third session \nAgenda item 137 \n \n \n \n \n Resolution adopted by the General Assembly \non 22 December 2018 \n \n \n \n \n[on the report of the Fifth Committee (A/73/667)] \n \n \n 73/269. Programme planning \n \n \n \nThe General Assembly, \n \nRecalling its resolutions 37/234 of 21 December 1982, 38/227 A of \n20 December 1983, 41/213 of 19 December 1986, 55/234 of 23 December 2000, \n56/253 of 24 December 2001, 57/282 of 20 December 2002, 58/268 and 58/269 of \n23 December 2003, 59/275 of 23 December 2004, 60/257 of 8 May 2006, 61/235 of \n22 December 2006, 62/224 of 22 December 2007, 63/247 of 24 December 2008, \n64/229 of 22 December 2009, 65/244 of 24 December 2010, 66/8 of 11 November \n2011, 67/236 of 24 December 2012, 68/20 of 4 December 2013, 69/17 of \n18 November 2014, 70/8 of 13 November 2015, 71/6 of 27 October 2016, 72/9 of \n17 November 2017 and 72/266 A of 24 December 2017,  \n \nRecalling also the terms of reference of the Committee for Programme and \nCoordination, as outlined in the annex to Economic and Social Council resolution \n2008 (LX) of 14 May 1976,  \n \nRecalling further the Regulations and Rules Governing Programme Planning, \nthe Programme Aspects of the Budget, the Monitoring of Implementation and the \nMethods of Evaluation, 1 in accordance with which the relevant programmes and \nsubprogrammes of the proposed strategic framework shall be reviewed by the relevant \nsectoral, functional and regional intergovernmental bodies, if possible during the \nregular cycle of their meetings,  \n \nHaving considered the report of the Committee for Programme and Coordination \non the work of its fifty-eighth session2 and the report of the Secretary-General on the \nprogramme performance of the United Nations for the biennium 2016\u20132017,3  \n__________________ \n \n1  ST/SGB/2018/3. \n \n2  Official Records of the General Assembly, Seventy-third Session, Supplement No. 16 (A/73/16). \n \n3  A/73/77. \n\nA/RES/73/269 \nProgramme planning\n \n18-22654\n2/2 \n \n \n1. \nReaffirms the role of the Committee for Programme and Coordination as \nthe main subsidiary organ of the General Assembly and the Economic and Social \nCouncil for planning, programming and coordination;  \n \n2. \nRe-emphasizes the role of the plenary and the Main Committees of the \nGeneral Assembly \nin \nreviewing \nand \ntaking \naction \non \nthe \nappropriate \nrecommendations of the Committee for Programme and Coordination relevant to their \nwork, in accordance with regulation 4.10 of the Regulations and Rules Governing \nProgramme Planning, the Programme Aspects of the Budget, the Monitoring of \nImplementation and the Methods of Evaluation;1  \n \n3. \nStresses that setting the priorities of the United Nations is the prerogative \nof the Member States, as reflected in legislative mandates;  \n \n4. \nAlso stresses the need for Member States to participate fully in the budget \npreparation process, from its early stages and throughout the process;  \n \n5. \nEndorses the conclusions and recommendations of the Committee for \nProgramme and Coordination on the programme performance of the United Nations \nfor the biennium 2016\u20132017,4 on evaluation,5 on the annual overview report of the \nUnited Nations System Chief Executives Board for Coordination for 2017, 6 on United \nNations system support for the New Partnership for Africa\u2019s Development7 and on \nthe report of the Joint Inspection Unit,8 contained in its report on the work of its fifty-\neighth session, and requests the Secretary-General to ensure the timely \nimplementation of the above-mentioned recommendations.  \n \n65th plenary meeting \n22 December 2018 \n \n__________________ \n \n4  See Official Records of the General Assembly, Seventy-third Session, Supplement No. 16 \n(A/73/16), chap. II, sect. A. \n \n5  Ibid., sect. C. \n \n6  Ibid., chap. III, sect. A. \n \n7  Ibid., sect. B. \n \n8  Ibid., chap. IV. \n",
  "paragraphs": {
    "1": "Reaffirms the role of the Committee for Programme and Coordination as the main subsidiary organ of the General Assembly and the Economic and Social Council for planning, programming and coordination;",
    "2": "Re-emphasizes the role of the plenary and the Main Committees of the General Assembly in reviewing and taking action on the appropriate recommendations of the Committee for Programme and Coordination relevant to their work, in accordance with regulation 4.10 of the Regulations and Rules Governing Programme Planning, the Programme Aspects of the Budget, the Monitoring of Implementation and the Methods of Evaluation;1",
    "3": "Stresses that setting the priorities of the United Nations is the prerogative of the Member States, as reflected in legislative mandates;",
    "4": "Also stresses the need for Member States to participate fully in the budget preparation process, from its early stages and throughout the process;",
    "5": "Endorses the conclusions and recommendations of the Committee for Programme and Coordination on the programme performance of the United Nations for the biennium 2016\u20132017,4 on evaluation,5 on the annual overview report of the United Nations System Chief Executives Board for Coordination for 2017, 6 on United Nations system support for the New Partnership for Africa\u2019s Development7 and on the report of the Joint Inspection Unit,8 contained in its report on the work of its fifty- eighth session, and requests the Secretary-General to ensure the timely implementation of the above-mentioned recommendations."
  },
  "agenda_items": [
    "Item 137"
  ],
  "symbol_references": []
}