{
  "symbol": "A/RES/72/278",
  "filename": "A_RES_72_278.pdf",
  "title": "72/278. Interaction between the United Nations, national parliaments and the Inter-Parliamentary Union",
  "text": "United Nations \nA/RES/72/278\n \n \nGeneral Assembly \nDistr.: General \n23 May 2018 \n \n18-08219 (E)    250518 \n*1808219* \n \n \nSeventy-second session \nAgenda item 126 \n \n \n \n \n Resolution adopted by the General Assembly \non 22 May 2018 \n \n \n \n \n[without reference to a Main Committee (A/72/L.54 and A/72/L.54/Add.1)] \n \n \n 72/278. Interaction between the United Nations, national parliaments \nand the Inter-Parliamentary Union \n \n \n \nThe General Assembly, \n \nRecalling the 2005 World Summit Outcome,1 in which Heads of State and \nGovernment resolved to strengthen further cooperation between the United Nations \nand national parliaments through their world organization, the Inter-Parliamentary \nUnion, in all fields of the work of the United Nations,  \n \nRecalling also its resolution 57/32 of 19 November 2002, in which the Inter-\nParliamentary Union was invited to participate in the work of the General Assembly \nin the capacity of observer, and recalling further its resolution 70/298 of 25 July 2016, \nin which the Assembly, inter alia, decided to strengthen the modalities of the \ncooperation between United Nations entities and the global parliamentary \ncommunity, \n \nTaking into consideration the Cooperation Agreement between the United \nNations and the Inter-Parliamentary Union of 1996,2 which laid the foundation for \ncooperation between the two organizations, and taking note of the revised \nCooperation Agreement of 2016, \n \nTaking note of the resolutions adopted by the Inter-Parliamentary Union, in \nparticular the resolution entitled \u201cSharing our diversity: the twentieth anniversary of \nthe Universal Declaration on Democracy\u201d, adopted at the 137th Assembly of the \nInter-Parliamentary Union, held in Saint Petersburg, Russian Federation, from 14 to \n18 October 2017, and the many activities undertaken by that organization in support \nof the United Nations, \n \nNoting the outcomes of the World Conferences of Speakers of Parliament held \nin 2000, 2005, 2010 and 2015, which affirm the commitment of national parliaments \n__________________ \n \n1 Resolution 60/1. \n \n2 A/51/402, annex. \n\nA/RES/72/278 \nInteraction between the United Nations, national\nparliaments and the Inter-Parliamentary Union\n \n18-08219\n2/4 \n \nand the Inter-Parliamentary Union to support the work of the United Nations and \ncontinue efforts to bridge the democracy gap in international relations, \n \nWelcoming the annual parliamentary hearings at the United Nations, as well as \nother specialized parliamentary meetings organized by the Inter-Parliamentary Union \nin cooperation with the United Nations to correspond to major United Nations \nconferences and events, \n \nRecognizing the work of the Inter-Parliamentary Union in mobilizing \nparliamentary action towards the implementation of the 2030 Agenda for Sustainable \nDevelopment,3 the Sendai Framework for Disaster Risk Reduction 2015\u201320304 and \nthe Paris Agreement adopted under the United Nations Framework Convention on \nClimate Change,5 \n \nRecognizing also the growing role of the Inter-Parliamentary Union Standing \nCommittee on United Nations Affairs in providing a platform for regular interaction \nbetween parliamentarians and United Nations officials, including on the 2030 Agenda \nfor \nSustainable \nDevelopment, \nreviewing \nimplementation \nof \ninternational \ncommitments, facilitating closer ties between the United Nations country teams and \nnational parliaments and helping to shape parliamentary input to major United \nNations processes, \n \nRecognizing further the work of the Inter-Parliamentary Union in the areas of \ndemocracy and human rights, gender equality, the empowerment of women, \ncombating violence against women, including against women in politics, youth \nempowerment, peace and security, disarmament, non-proliferation, sustainable \ndevelopment and interfaith and inter-ethnic dialogue, as well as countering terrorism \nand preventing violent extremism as and when conducive to terrorism, \n \nTaking note of the work carried out upon the request of Member States by \nagencies and programmes of the United Nations system, including the United Nations \nDevelopment Programme, in support of national parliaments around the world, \n \nAcknowledging the role and responsibility of national parliaments in regard to \nnational plans and strategies, as well as in ensuring greater transparency and \naccountability at both the national and the global levels, \n \n1. \nWelcomes the actions taken by the Inter-Parliamentary Union to pursue a \nmore systematic engagement with the United Nations, and encourages both \norganizations to enhance their cooperation in meeting their common objectives; \n \n2. \nEncourages the United Nations and the Inter-Parliamentary Union to \ncontinue to work closely in various fields, including sustainable development, \npeacebuilding and sustaining peace, international law, human rights, gender equality \nand the empowerment of women and girls, youth empowerment, democracy and good \ngovernance, information and communications technologies, disaster risk reduction, \ncapacity-building and financing for development; \n \n3. \nAlso encourages the United Nations and the Inter-Parliamentary Union to \nstrengthen cooperation by engaging parliamentarians in efforts to maintain support \nfor the implementation of relevant United Nations agreements; \n \n4. \nEncourages the continued active involvement of the Inter-Parliamentary \nUnion in promoting the enhanced contribution of parliaments at the national, regional \nand global levels in support of the achievement of the Sustainable Development \nGoals; \n__________________ \n \n3 Resolution 70/1. \n \n4 Resolution 69/283, annex II. \n \n5 See FCCC/CP/2015/10/Add.1, decision 1/CP.21, annex. \n\nInteraction between the United Nations, national \nparliaments and the Inter-Parliamentary Union \nA/RES/72/278\n \n3/4\n18-08219 \n \n \n5. \nWelcomes the practice of including parliamentarians as members of \nnational delegations to major United Nations meetings and events, as appropriate, and \ninvites Member States to continue this practice in a more regular and systematic manner; \n \n6. \nInvites Member States to further consider ways to work regularly with the \nInter-Parliamentary Union in facilitating a parliamentary component to major United \nNations conferences so as to help to inform such deliberations from a parliamentary \nperspective; \n \n7. \nEncourages Member States to consider applying the practice of the joint \nUnited \nNations-Inter-Parliamentary \nUnion \nparliamentary \nhearing \nto \nother \nparliamentary meetings convened in conjunction with major United Nations \nconferences and processes, such as the parliamentary meeting organized on the \noccasion of the annual session of the Commission on the Status of Women, with a \nview to including the outcome of these parliamentary meetings as a formal \ncontribution to the respective United Nations processes; \n \n8. \nWelcomes \nthe \nenhanced \ncontribution \nof \nparliaments \nand \nthe \nInter-Parliamentary Union to the work of the Human Rights Council and the human \nrights treaty bodies, and acknowledges the crucial role that parliaments play in \ntranslating international commitments into national policies and laws; \n \n9. \nEncourages the United Nations Entity for Gender Equality and the \nEmpowerment of Women (UN-Women) and other relevant bodies of the United \nNations system to work closely with national parliaments and the Inter-Parliamentary \nUnion in accordance with their respective mandates and, upon request, in such areas \nas gender equality and the empowerment of women, including in conflict prevention \nand peace processes, institutional gender mainstreaming, support to parliaments in \npromoting gender-sensitive legislation, increasing the representation of women in \nparliaments, combating violence against women, including women in politics, and \nimplementing relevant United Nations resolutions; \n \n10. Encourages the relevant entities of the United Nations system to work \nclosely with national parliaments and the Inter-Parliamentary Union, inter alia, in \nareas such as youth empowerment and participation of young men and women in \npolitics, as appropriate, rapid technological change, as well as countering terrorism \nand preventing violent extremism as and when conducive to terrorism; \n \n11. \nWelcomes the contribution of the Inter-Parliamentary Union to the work of \nthe high-level political forum on sustainable development, through the participation \nof parliamentarians, in convening a regular parliamentary side event on the work of \nparliaments to institutionalize the Sustainable Development Goals, as well as through \nits efforts to encourage parliaments to engage in the voluntary national reviews of \nparticipating countries; \n \n12. Also welcomes the efforts of the Inter-Parliamentary Union to raise \nparliamentary support for health, in particular women\u2019s, adolescent and child health \nand nutrition, and invites the World Health Organization and other relevant agencies, \nfunds and programmes of the United Nations system to enhance cooperation with the \nInter-Parliamentary Union in this regard; \n \n13. Invites the Inter-Parliamentary Union and the relevant bodies of the United \nNations system to continue and enhance their cooperation in supporting Governments \nin facilitating the orderly, safe, regular and responsible migration and mobility of \npeople, including through the implementation of planned and well-managed \nmigration policies, and recognizes the contribution of the Inter-Parliamentary Union \nin the preparatory process for the Global Compact for Safe, Orderly and Regular \nMigration; \n\nA/RES/72/278 \nInteraction between the United Nations, national\nparliaments and the Inter-Parliamentary Union\n \n18-08219\n4/4 \n \n \n14. Encourages the United Nations and the Inter-Parliamentary Union to \ndevelop closer cooperation with parliaments at the national level, including in terms \nof strengthening parliamentary capacities, inter alia, in regard to the allocation of \nbudgetary resources for the implementation of the 2030 Agenda for Sustainable \nDevelopment,3 as appropriate, and in reinforcing the rule of law and helping to align \nnational legislation with international commitments; \n \n15. Takes note of the Common Principles for Support to Parliaments pioneered \nby the Inter-Parliamentary Union and the United Nations Development Programme \nand endorsed by 96 national parliaments and 5 parliamentary assemblies with a view \nto further strengthening the capacity of parliaments to perform their functions; \n \n16. Calls upon United Nations country teams to develop, within their \nmandates and at the request of national authorities, a more structured and integrated \nmanner of working with national parliaments, through appropriate mechanisms, inter \nalia, by involving parliaments in consultations on national development strategies and \non development aid effectiveness, where applicable; \n \n17. Encourages the United Nations system to help to facilitate greater South-\nSouth and triangular cooperation between parliaments and parliamentarians, within \nexisting resources, in cooperation with the Inter-Parliamentary Union; \n \n18. Calls upon United Nations entities to avail themselves more systematically \nof the unique expertise of the Inter-Parliamentary Union and its member parliaments \nin strengthening parliamentary institutions, particularly in countries emerging from \nconflict and/or in transition to democracy; \n \n19. Calls for regular annual exchanges and meetings at both the political and \nthe operational levels between senior officials of the United Nations and of the \nInter-Parliamentary Union, with a view to building greater coherence in the work of the \ntwo organizations and helping to forge a more robust strategic partnership between them; \n \n20. Encourages the United Nations system to reflect more systematically the \nrole and contribution of parliaments in its reports and draft strategic plans; \n \n21. Decides, with effect from its seventy-second session, to observe on 30 June \nof each year the International Day of Parliamentarism, invites all Member States, \nnational parliaments, organizations of the United Nations system and other relevant \ninternational organizations, civil society, including non-governmental organizations, \nand all other relevant stakeholders to observe the Day and to promote awareness of it, \nand stresses that the cost of all activities that may arise from the observance of the Day \nby the United Nations should be met from voluntary contributions; \n \n22. Acknowledges the invitation to the Inter-Parliamentary Union to organize \na world conference on interfaith and inter-ethnic dialogue with the participation of \nHeads of State, parliaments and representatives of world religions, and encourages \nthe conduct of preparations in cooperation with the United Nations; \n \n23. Takes note of the report of the Secretary-General,6 and requests that he \nsubmit to the General Assembly at its seventy-fourth session a report under the item \nentitled \u201cInteraction between the United Nations, national parliaments and the \nInter-Parliamentary Union\u201d, with a special focus on best practices to support the role \nof parliaments in translating international commitments into national policies. \n \n89th plenary meeting  \n22 May 2018 \n \n__________________ \n \n6 A/72/791. \n",
  "paragraphs": {
    "1": "Welcomes the actions taken by the Inter-Parliamentary Union to pursue a more systematic engagement with the United Nations, and encourages both organizations to enhance their cooperation in meeting their common objectives;",
    "2": "Encourages the United Nations and the Inter-Parliamentary Union to continue to work closely in various fields, including sustainable development, peacebuilding and sustaining peace, international law, human rights, gender equality and the empowerment of women and girls, youth empowerment, democracy and good governance, information and communications technologies, disaster risk reduction, capacity-building and financing for development;",
    "3": "Also encourages the United Nations and the Inter-Parliamentary Union to strengthen cooperation by engaging parliamentarians in efforts to maintain support for the implementation of relevant United Nations agreements;",
    "4": "Encourages the continued active involvement of the Inter-Parliamentary Union in promoting the enhanced contribution of parliaments at the national, regional and global levels in support of the achievement of the Sustainable Development Goals; __________________ 3 Resolution 70/1. 4 Resolution 69/283, annex II. 5 See FCCC/CP/2015/10/Add.1, decision 1/CP.21, annex. Interaction between the United Nations, national parliaments and the Inter-Parliamentary Union A/RES/72/278 3/4 18-08219",
    "5": "Welcomes the practice of including parliamentarians as members of national delegations to major United Nations meetings and events, as appropriate, and invites Member States to continue this practice in a more regular and systematic manner;",
    "6": "Invites Member States to further consider ways to work regularly with the Inter-Parliamentary Union in facilitating a parliamentary component to major United Nations conferences so as to help to inform such deliberations from a parliamentary perspective;",
    "7": "Encourages Member States to consider applying the practice of the joint United Nations-Inter-Parliamentary Union parliamentary hearing to other parliamentary meetings convened in conjunction with major United Nations conferences and processes, such as the parliamentary meeting organized on the occasion of the annual session of the Commission on the Status of Women, with a view to including the outcome of these parliamentary meetings as a formal contribution to the respective United Nations processes;",
    "8": "Welcomes the enhanced contribution of parliaments and the Inter-Parliamentary Union to the work of the Human Rights Council and the human rights treaty bodies, and acknowledges the crucial role that parliaments play in translating international commitments into national policies and laws;",
    "9": "Encourages the United Nations Entity for Gender Equality and the Empowerment of Women (UN-Women) and other relevant bodies of the United Nations system to work closely with national parliaments and the Inter-Parliamentary Union in accordance with their respective mandates and, upon request, in such areas as gender equality and the empowerment of women, including in conflict prevention and peace processes, institutional gender mainstreaming, support to parliaments in promoting gender-sensitive legislation, increasing the representation of women in parliaments, combating violence against women, including women in politics, and implementing relevant United Nations resolutions;",
    "10": "Encourages the relevant entities of the United Nations system to work closely with national parliaments and the Inter-Parliamentary Union, inter alia, in areas such as youth empowerment and participation of young men and women in politics, as appropriate, rapid technological change, as well as countering terrorism and preventing violent extremism as and when conducive to terrorism;",
    "11": "Welcomes the contribution of the Inter-Parliamentary Union to the work of the high-level political forum on sustainable development, through the participation of parliamentarians, in convening a regular parliamentary side event on the work of parliaments to institutionalize the Sustainable Development Goals, as well as through its efforts to encourage parliaments to engage in the voluntary national reviews of participating countries;",
    "12": "Also welcomes the efforts of the Inter-Parliamentary Union to raise parliamentary support for health, in particular women\u2019s, adolescent and child health and nutrition, and invites the World Health Organization and other relevant agencies, funds and programmes of the United Nations system to enhance cooperation with the Inter-Parliamentary Union in this regard;",
    "13": "Invites the Inter-Parliamentary Union and the relevant bodies of the United Nations system to continue and enhance their cooperation in supporting Governments in facilitating the orderly, safe, regular and responsible migration and mobility of people, including through the implementation of planned and well-managed migration policies, and recognizes the contribution of the Inter-Parliamentary Union in the preparatory process for the Global Compact for Safe, Orderly and Regular Migration; A/RES/72/278 Interaction between the United Nations, national parliaments and the Inter-Parliamentary Union 18-08219 4/4",
    "14": "Encourages the United Nations and the Inter-Parliamentary Union to develop closer cooperation with parliaments at the national level, including in terms of strengthening parliamentary capacities, inter alia, in regard to the allocation of budgetary resources for the implementation of the 2030 Agenda for Sustainable Development,3 as appropriate, and in reinforcing the rule of law and helping to align national legislation with international commitments;",
    "15": "Takes note of the Common Principles for Support to Parliaments pioneered by the Inter-Parliamentary Union and the United Nations Development Programme and endorsed by 96 national parliaments and 5 parliamentary assemblies with a view to further strengthening the capacity of parliaments to perform their functions;",
    "16": "Calls upon United Nations country teams to develop, within their mandates and at the request of national authorities, a more structured and integrated manner of working with national parliaments, through appropriate mechanisms, inter alia, by involving parliaments in consultations on national development strategies and on development aid effectiveness, where applicable;",
    "17": "Encourages the United Nations system to help to facilitate greater South- South and triangular cooperation between parliaments and parliamentarians, within existing resources, in cooperation with the Inter-Parliamentary Union;",
    "18": "Calls upon United Nations entities to avail themselves more systematically of the unique expertise of the Inter-Parliamentary Union and its member parliaments in strengthening parliamentary institutions, particularly in countries emerging from conflict and/or in transition to democracy;",
    "19": "Calls for regular annual exchanges and meetings at both the political and the operational levels between senior officials of the United Nations and of the Inter-Parliamentary Union, with a view to building greater coherence in the work of the two organizations and helping to forge a more robust strategic partnership between them;",
    "20": "Encourages the United Nations system to reflect more systematically the role and contribution of parliaments in its reports and draft strategic plans;",
    "21": "Decides, with effect from its seventy-second session, to observe on 30 June of each year the International Day of Parliamentarism, invites all Member States, national parliaments, organizations of the United Nations system and other relevant international organizations, civil society, including non-governmental organizations, and all other relevant stakeholders to observe the Day and to promote awareness of it, and stresses that the cost of all activities that may arise from the observance of the Day by the United Nations should be met from voluntary contributions;",
    "22": "Acknowledges the invitation to the Inter-Parliamentary Union to organize a world conference on interfaith and inter-ethnic dialogue with the participation of Heads of State, parliaments and representatives of world religions, and encourages the conduct of preparations in cooperation with the United Nations;",
    "23": "Takes note of the report of the Secretary-General,6 and requests that he submit to the General Assembly at its seventy-fourth session a report under the item entitled \u201cInteraction between the United Nations, national parliaments and the Inter-Parliamentary Union\u201d, with a special focus on best practices to support the role of parliaments in translating international commitments into national policies. 89th plenary meeting 22 May 2018 __________________ 6 A/72/791."
  },
  "agenda_items": [
    "Item 126"
  ],
  "symbol_references": [
    "A/72/L.54"
  ]
}