{
  "symbol": "A/RES/78/280",
  "filename": "A_RES_78_280.pdf",
  "title": "78/280. Global health and foreign policy: addressing global health challenges in the foreign policy space",
  "text": "United Nations \nA/RES/78/280\n \n \nGeneral Assembly \nDistr.: General \n7 May 2024 \n \n \n24-08223 (E)    140524 \n*2408223* \n \n \nSeventy-eighth session \nAgenda item 125 \nGlobal health and foreign policy \n \n \n \n \n Resolution adopted by the General Assembly \non 2 May 2024 \n \n \n \n \n[without reference to a Main Committee (A/78/L.62)] \n \n \n 78/280. Global health and foreign policy: addressing global health \nchallenges in the foreign policy space \n \n \n \nThe General Assembly, \n \nRecalling its resolutions 63/33 of 26 November 2008, 64/108 of 10 December \n2009, 65/95 of 9 December 2010, 66/115 of 12 December 2011, 67/81 of 12 December \n2012, 68/98 of 11 December 2013, 69/132 of 11 December 2014, 70/183 of \n17 December 2015, 71/159 of 15 December 2016, 72/139 of 12 December 2017, \n73/132 of 13 December 2018, 74/20 of 11 December 2019, 75/130 of 14 December \n2020 and 76/257 of 29 March 2022, \n \nReaffirming its resolution 70/1 of 25 September 2015, entitled \u201cTransforming \nour world: the 2030 Agenda for Sustainable Development\u201d, in which it adopted a \nwide, far-reaching and people-centred set of universal and transformative Sustainable \nDevelopment Goals and targets, its commitment to working tirelessly for the full \nimplementation of the Agenda by 2030, its recognition that eradicating poverty in all \nits forms and dimensions, including extreme poverty, is the greatest global challenge \nand an indispensable requirement for sustainable development, its commitment to \nachieving sustainable development goals that are integrated and indivisible and \nbalanced in its three dimensions \u2013 economic, social and environmental \u2013 and its \ncommitment to building upon the achievements of the Millennium Development \nGoals and seeking to address their unfinished business, recommitting that no one will \nbe left behind and endeavouring to reach the furthest behind first, \n \nReaffirming also its resolution 69/313 of 27 July 2015 on the Addis Ababa \nAction Agenda of the Third International Conference on Financing for Development, \nwhich is an integral part of the 2030 Agenda for Sustainable Development, supports \nand complements it, helps to contextualize its means of implementation targets with \nconcrete policies and actions, and reaffirms the strong political commitment to \naddress the challenge of financing and creating an enabling environment at all levels \nfor sustainable development in the spirit of global partnership and solidarity, \n\nA/RES/78/280 \nGlobal health and foreign policy: addressing global \nhealth challenges in the foreign policy space\n \n24-08223\n2/12 \n \n \nRecognizing that universal health coverage is fundamental for achieving the \nSustainable Development Goals related not only to health and well-being, but also to \neradicating poverty in all its forms and dimensions, ensuring quality education, \nachieving gender equality and the empowerment of all women and girls, providing \ndecent work and economic growth, as well as the elimination of all forms of violence \nagainst women and girls, reducing inequalities, ensuring just, peaceful and inclusive \nsocieties and to building and fostering partnerships, recognizing the interdependence \nbetween global health and development, while reaching the goals and targets included \nthroughout the 2030 Agenda is critical for the attainment of healthy lives and well-\nbeing for all, with a focus on health outcomes throughout the life course, \n \nRecalling the Universal Declaration of Human Rights, 1  the International \nCovenant on Economic, Social and Cultural Rights,2 the International Convention on \nthe Elimination of All Forms of Racial Discrimination, 3  the Convention on the \nElimination of All Forms of Discrimination against Women,4 the Convention on the \nRights of the Child,5 the Convention on the Rights of Persons with Disabilities, 6 the \nInternational Covenant on Civil and Political Rights 7 and relevant provisions of \ninternational humanitarian law, \n \nRecognizing that the year 2023 marked the seventy-fifth anniversaries of the \nWorld Health Organization and the Universal Declaration of Human Rights, as well \nas the thirtieth anniversary of the Vienna Declaration and Programme of Action, 8  \n \nRecalling that health is a precondition for and an outcome and indicator of all \nthree dimensions of sustainable development \u2013 economic, social and environmental \u2013 \nand that, despite progress made, challenges in global health, including major \ninequities and vulnerabilities within and among countries, regions and populations, \nstill remain and demand persistent attention, \n \nRecalling also that in the Constitution of the World Health Organization 9 health \nis defined as a state of complete physical, mental and social well-being and not merely \nthe absence of disease or infirmity, and it is declared that the enjoyment of the highest \nattainable standard of health is one of the fundamental rights of every human being \nwithout distinction of race, religion, political belief, economic or social condition, \n \nRecalling further that in the Constitution of the World Health Organization it is \nstated that unequal development in different countries in the promotion of health and \ncontrol of disease, especially communicable disease, is a common danger, \n \nRecognizing the leading role of the World Health Organization, as the primary \nspecialized agency for health, including its roles and functions with regard to health \npolicy in accordance with its mandate, and welcoming ongoing processes to improve \nthe sustainable financing of the World Health Organization, including the adoption of \nthe recommendations of the Working Group on Sustainable Financing by the World \nHealth Assembly at its seventy-fifth session,10  \n \nUnderlining the significant role of the Foreign Policy and Global Health \nInitiative in promoting synergies between foreign policy and global health, as well as \n__________________ \n \n1  Resolution 217 A (III). \n \n2  See resolution 2200 A (XXI), annex. \n \n3  United Nations, Treaty Series, vol. 660, No. 9464. \n \n4  Ibid., vol. 1249, No. 20378. \n \n5  Ibid., vol. 1577, No. 27531. \n \n6  Ibid., vol. 2515, No. 44910. \n \n7  See resolution 2200 A (XXI), annex. \n \n8  A/CONF.157/24 (Part I), chap. III. \n \n9  United Nations, Treaty Series, vol. 14, No. 221. \n \n10  See World Health Organization, document WHA75/2022/REC/1, decision 75(8). \n\nGlobal health and foreign policy: addressing global \nhealth challenges in the foreign policy space \nA/RES/78/280\n \n3/12\n24-08223 \n \nthe contribution of the Oslo Ministerial Declaration of 20 March 2007, entitled \n\u201cGlobal health: a pressing foreign policy issue of our time\u201d, 11 which was reaffirmed, \nwith renewed actions and commitments, in the ministerial communiqu\u00e9 of the \nInitiative entitled \u201cRenewing 10 years of concerted efforts and preparing for new \nchallenges\u201d, of 22 September 2017,12  \n \nUnderlining also that in the Oslo Declaration it is acknowledged that investment \nin health is fundamental to economic growth and development, and in this regard \nrecalling that health inequities arise, as stated in the Rio Political Declaration on \nSocial Determinants of Health, from the societal conditions in which people are born, \ngrow, live, work and age, referred to as social determinants of health,  \n \nRecognizing the close relationship between foreign policy and global health and \ntheir interdependence, and noting that foreign policy can help to sustain political \nmomentum, advance international cooperation and find solutions to health and other \ninterlocking challenges based on the principles of global solidarity and equity, \n \nUnderscoring the importance of enhanced international cooperation to support \nthe efforts of Member States to achieve health goals, including the target of achieving \nuniversal health coverage, including financial risk protection, access to quality \nessential health-care services and access to safe, effective, quality and affordable \nessential medicines and vaccines for all, \n \nUnderlining the primary responsibility of States to promote universal health \ncoverage that comprises universal and equitable access to quality health services and \nensures affordable and quality service delivery, especially through primary health \ncare and social protection mechanisms, with the support of the international \ncommunity and with a view to providing access to health services for all, in particular \nwomen and children and those who are in vulnerable situations or marginalized, \n \nReaffirming the importance of national ownership and the primary role and \nresponsibility of governments at all levels to determine their own path towards \nachieving universal health coverage, in accordance with national contexts and \npriorities, and underscoring the importance of political leadership for universal health \ncoverage beyond the health sector in order to pursue whole-of-government and \nwhole-of-society approaches, as well as health-in-all-policies approaches, equity-\nbased approaches and life-course approaches, \n \nRecognizing that primary health care is the cornerstone of a sustainable health \nsystem for universal health coverage and health-related Sustainable Development \nGoals, in particular Goal 3.8, as declared in the 1978 Declaration of Alma-Ata, the \n2030 Agenda and reaffirmed in the 2018 Declaration of Astana as adopted at the \nGlobal Conference on Primary Health Care in Astana, \n \nRecognizing also that social protection is an important tool to act on social and \neconomic determinants of health, such as poverty, inequality, social exclusion and \nsocial insecurity, and that it protects people and communities in need of health-care \nservices from hardship and from an increased risk of poverty due to the financial \nconsequences of illness and disability,  \n \nRecognizing further that humanitarian emergencies have a devastating impact \non health systems, leaving people, especially people in vulnerable situations, without \nfull access to health-care services and exposing them to preventable diseases and \nother health risks,  \n__________________ \n \n11  A/63/591, annex. \n \n12  A/72/559, annex. \n\nA/RES/78/280 \nGlobal health and foreign policy: addressing global \nhealth challenges in the foreign policy space\n \n24-08223\n4/12 \n \n \nRecalling the consequence of the adverse impact of climate change, natural \ndisasters, extreme weather events as well as other environmental determinants of \nhealth, such as clean air, safe drinking water, sanitation, safe, sufficient and nutritious \nfood and secure shelter, for health, and in this regard underscoring the need to foster \nhealth in climate change adaptation efforts, underlining that resilient and people-\ncentred health systems are necessary to protect the health of all people, in particular \nthose who are vulnerable or in vulnerable situations, particularly those living in small \nisland developing States,  \n \nUnderlining the need to strengthen pandemic prevention, preparedness and \nresponse, including for ongoing global epidemics such as HIV/AIDS, tuberculosis \nand malaria, as well as neglected tropical diseases and preventable diseases, by \nsharing experience and best practices, and raise the level of preparedness, including \nenabling diagnostics of drivers of outbreaks in animals of zoonotic potential, \nsurveillance and early warning systems, in order to have the earliest and most \nadequate response to any outbreak that may arise, recognizing the necessity of a One \nHealth approach that fosters cooperation between the human, animal and plant health, \nas well as other relevant sectors, including through strengthened cooperation and \ncollaboration among the World Health Organization, the Food and Agriculture \nOrganization of the United Nations, the World Organization for Animal Health and \nthe United Nations Environment Programme,  \n \nRecognizing the present and ever-increasing urgent global risk of antimicrobial \nresistance, which kills 1.27 million people a year, about 20 per cent of whom are \nchildren under 5, and emphasizing that antimicrobial resistance could result in \n1 trillion United States dollars of additional health-care costs by 2050 and 1 trillion \nto 3.4 trillion dollars of gross domestic product losses per year by 2030, \n \nRecognizing also the need to strengthen the capacity of all countries, in \nparticular developing countries, for early warning, risk reduction and management of \nnational and global health risks, guided by target 3.d of the 2030 Agenda, \n \nRecalling the political declaration of the high-level meeting on the midterm \nreview of the Sendai Framework for Disaster Reduction 2015\u2013203013 and the Bali \nAgenda for Resilience resulting from the seventh session of the Global Platform for \nDisaster Risk Reduction, which highlighted the importance of strengthening of \ncommunity engagement in preparing for and responding to disaster, including \noutbreaks of infectious disease, including strengthening capacity-building and \nfunding for local governments and local communities to prevent, prepare for and \nrespond to outbreaks and other disasters, \n \nRecognizing that health is an investment in human capital and social and \neconomic development towards the full realization of human potential and \nsignificantly contributes to the promotion and protection of human rights and dignity \nas well as the empowerment of all people, \n \nRecalling the need to further strengthen cooperation to recruit, train, develop \nand retain a skilled health workforce, which is an important element of strong and \nresilient health systems, as part of health emergency prevention and preparedness \nstrategies, guided by target 3.c of the 2030 Agenda and the World Health Organization \nGlobal Code of Practice on the International Recruitment of Health Personnel, 14 and \nnoting with concern that highly trained and skilled health personnel from developing \ncountries continue to emigrate at an increasing rate to certain countries, which \nweakens health systems in countries of origin, while taking into account individual \nrights of health personnel to work in any country in accordance with applicable laws, \n__________________ \n \n13  Resolution 77/289, annex. \n \n14  World Health Organization, document WHA63/2010/REC/1, annex 5. \n\nGlobal health and foreign policy: addressing global \nhealth challenges in the foreign policy space \nA/RES/78/280\n \n5/12\n24-08223 \n \nand taking into account that nothing should be interpreted as limiting the freedom of \nhealth personnel to migrate to countries that wish to employ them,  \n \nNoting the negative impact of misinformation, disinformation and stigmatization \non preparedness and response to health emergencies, and on people\u2019s physical and \nmental health, and the need to counter misinformation, disinformation and \nstigmatization in the context of health emergencies, and recognizing that for all \nstakeholders to be part of the response, they need to have access to timely and accurate \ninformation and to be involved in decisions that affect them,  \n \nEmphasizing the need to tackle health-related inequities and inequalities within \nand among countries, as well as social and economic injustices that were exacerbated \nby the coronavirus disease (COVID-19) pandemic, through political commitment, \npolicies and international cooperation, including those that address social, economic \nand environmental and other determinants of health, \n \nNoting the discussions on innovative options to enhance the global effort \ntowards the production and equitable distribution of medicines and other health \ntechnologies through local and regional production, welcoming the establishment of \ntechnology transfer hubs for mRNA vaccines to develop and strengthen local and \nregional production chains in developing countries, and emphasizing the need to \nenhance the manufacturing and research capacity of countries through innovation and \ntransfer of technology and know-how with the support of developed countries and \nadvanced industries,  \n \nUnderlining the urgency of having strong and resilient health systems, reaching \nthose who are vulnerable or in vulnerable situations, including those in humanitarian \nsettings as well as health emergencies, and capable of effectively implementing the \nInternational Health Regulations (2005) 15  in the context of health emergencies, \nensuring pandemic prevention, preparedness and the detection of and response to any \noutbreaks, infectious disease and other health threats,  \n \nRecognizing that armed conflicts have a devastating impact on health systems, \nleaving persons, especially persons in vulnerable situations, refugees, internally \ndisplaced persons and those living in occupied territories or conflict-affected areas, \nwithout full access to essential health care and exposing them to preventable diseases \nand other health risks, and exacerbate health needs, including for mental health and \npsychosocial support, rehabilitation, treatment for chronic diseases and others such \nas cancer, HIV/AIDS and tuberculosis, \n \nHighlighting that the COVID-19 pandemic has been one of the greatest global \nchallenges in the history of the United Nations, and noting with deep concern its \nimpact on health and the loss of life, mental health and well-being, as well as the \nnegative impact on global humanitarian needs, gender equality and the empowerment \nof all women and girls, the enjoyment of human rights and across all spheres of \nsociety, including on livelihoods, food security and nutrition, and education, the \nexacerbation of poverty, hunger and malnutrition, disruption to economies, trade, \nsocieties and environments, and the exacerbation of economic and social inequalities \nwithin and among countries, particularly between developing and developed \ncountries, which is reversing hard-won development gains and hampering progress \ntowards achieving the 2030 Agenda and all its Goals and targets, \n \nExpressing deep concern about the uneven access of developing countries, \nparticularly African countries, to safe, quality, efficacious, effective, accessible and \naffordable vaccines against COVID-19, emphasizing the need to enhance the \ncapacities of developing countries to achieve universal health coverage and have \n__________________ \n \n15  World Health Organization, document WHA58/2005/REC/1, resolution 58.3, annex. \n\nA/RES/78/280 \nGlobal health and foreign policy: addressing global \nhealth challenges in the foreign policy space\n \n24-08223\n6/12 \n \nequitable access to vaccines and health technologies and means to respond to and \nrecover from the COVID-19 and other pandemics, reaffirming the need to strengthen \nthe support for national, regional and multilateral initiatives that aim to accelerate the \ndevelopment and production of and equitable access to COVID-19 diagnostics, \ntherapeutics and vaccines, and taking note of the Declaration on the Right to \nDevelopment,16  \n \nRecalling that, while the World Health Organization has declared an end to \nCOVID-19 as a public health emergency of international concern, the threat of future \npandemics remains, and the world needs a stronger, better coordinated, inclusive and \nmore agile global health architecture for pandemic prevention, preparedness, \nresponse and recovery to stop the severe impact of future outbreaks, \n \nRecognizing that the COVID-19 pandemic has disproportionately impacted the \npoor and those in vulnerable situations, with repercussions on health and development \ngains, thus hampering the achievement of the Sustainable Development Goals and \nuniversal health coverage, \n \nRecalling World Health Assembly decision SSA2(5) of 1 December 2021, in \nwhich it established an intergovernmental negotiating body to draft and negotiate a \nWorld Health Organization convention, agreement or other international instrument \non pandemic prevention, preparedness and response, with the aim of strengthening \nthe global health architecture and with a whole-of-government and whole-of-society \napproach, and noting the progress made, including the agreement that the new \ninternational instrument should be legally binding, guided by equity and solidarity,  \n \nEmphasizing the need for universal, equitable and timely access to affordable \nmedical and health products to enable rapid and effective response to health \nemergencies and pandemics, while seriously concerned about the high prices of some \nhealth products and the inequitable access within and among States, as well as the \nfinancial hardships associated with high prices, which continue to impede progress \ntowards achieving universal health coverage for all,  \n \nRecognizing that the COVID-19 pandemic has highlighted the relevance of \ndigitalization in strengthening health systems and providing accessible and equitable \nhealth-care services for all, as well as its impact on improving the quality of health-\ncare delivery through information systems that support clinical and management \ndecision-making and planning, to facilitate continuity of care through the creation of \nlongitudinal electronic health records, to enable real-time surveillance and to serve as \na basis for precision medicine and personalized health care, \n \nNoting that the current legal frameworks and funding mechanisms are \nfragmented and rely heavily on bilateral funding and debt, and that there is a need to \ninvest in public health and mobilize international and domestic resources, including \nto assist developing countries,  \n \nWelcoming the launch of the Pandemic Fund in November 2022 as one of the \nmechanisms to finance critical investments to strengthen national, regional and global \npandemic prevention, preparedness and response capacities with a focus on \ndeveloping countries, and recalling that financing effective national, regional and \nglobal health emergency preparedness will require approximately 30 billion dollars \nper year, including an estimated gap of 10 billion dollars, in new external financing \nper year outside current official development assistance levels, \n \nEncouraging the promotion of increased access to affordable, safe, effective and \nquality medicines, including generics, vaccines, diagnostics and health technologies, \nreaffirming the World Trade Organization Agreement on Trade-Related Aspects of \n__________________ \n \n16  Resolution 41/128, annex. \n\nGlobal health and foreign policy: addressing global \nhealth challenges in the foreign policy space \nA/RES/78/280\n \n7/12\n24-08223 \n \nIntellectual Property Rights (TRIPS Agreement) as amended, and also reaffirming the \n2001 World Trade Organization Doha Declaration on the TRIPS Agreement and \nPublic Health, which recognizes that intellectual property rights should be interpreted \nand implemented in a manner supportive of the right of Member States to protect \npublic health and, in particular, to promote access to medicines for all, and noting the \nneed for appropriate incentives in the development of new health products, \n \nReaffirming the right to use, to the fullest extent, the provisions contained in the \nWorld Trade Organization Agreement on Trade-Related Aspects of Intellectual \nProperty Rights (TRIPS Agreement), which provides flexibilities for the protection \nof public health and promotes access to medicines for all, in particular for developing \ncountries, and the World Trade Organization Doha Declaration on the TRIPS \nAgreement and Public Health, which recognizes that intellectual property protection \nis important for the development of new medicines and also recognizes the concerns \nabout its effects on prices, while noting the discussions in the World Trade \nOrganization and other relevant international forums, including on innovative options \nto enhance the global effort towards the production and timely and equitable \ndistribution of COVID-19 vaccines, therapeutics, diagnostics and other health \ntechnologies, including through local production, and noting the outcome of the \nTwelfth Ministerial Conference of the World Trade Organization, including the \nministerial decision on the TRIPS Agreement and the ministerial declaration on the \nWorld Trade Organization response to the COVID-19 pandemic and preparedness for \nfuture pandemics, while noting discussions in the World Trade Organization on a \npossible extension of the decision to cover the production and supply of COVID-19 \ndiagnostics and therapeutics,  \n \nSeriously concerned that the supply of health products and technologies is \ndependent on manufacturing facilities concentrated in few countries and that the lack \nof national or regional production capacities, adequate infrastructure and logistics \nexpertise to store, distribute and deliver diagnostics, medicines, vaccines and other \nhealth products and technologies, particularly in developing countries, among other \nfactors, hampers efforts to achieve diagnosis, treatment and vaccination targets for \nseveral diseases, at the right time, safely and efficiently, especially in the context of \nhealth emergencies, \n \nStressing the urgent need to reinforce actions and initiatives, including research \nand development, to tackle known health challenges, including preventable maternal, \nnewborn and child deaths, and ongoing epidemics, such as HIV/AIDS, tuberculosis \nand malaria, and non-communicable and neglected tropical diseases, which \ndisproportionately affect developing countries and are, in general, determined by \nsocial determinants of health,  \n \nRecognizing that the human and economic cost of non-communicable diseases \ncontributes to poverty and inequities and threatens the health of peoples and the \ndevelopment of countries, and in this regard reaffirming the commitments to mobilize \nand allocate adequate, predictable and sustained resources for national responses to \nprevent and control non-communicable diseases, including through international \ncooperation and official development assistance, \n \nWelcoming the organization and recalling the political declarations of the 2023 \nhigh-level meetings of the General Assembly on pandemic prevention, preparedness \nand response, on universal health coverage and on the fight against tuberculosis,17 \nwhich highlighted the importance of cooperation, equity and solidarity in scaling up \nthe global effort to leave no one behind and to build a healthier world for all, \n__________________ \n \n17  Resolution 78/3, annex, resolution 78/4, annex, and resolution 78/5, annex. \n\nA/RES/78/280 \nGlobal health and foreign policy: addressing global \nhealth challenges in the foreign policy space\n \n24-08223\n8/12 \n \n \nRecalling the 2023 political declaration of the high-level political forum on \nsustainable development convened under the auspices of the General Assembly \n(Sustainable Development Goals Summit),18  \n \nNoting that challenges in global health still remain and demand persistent \nattention and that this urgently requires the fulfilment of commitments to strengthen \nthe global partnership for development, and re-emphasizes in particular North-South \ncooperation, the importance of South-South and triangular cooperation and the \nexchange of best practices, as well as capacity-building, research and development, \nand the transfer of technology on mutually agreed terms to address health inequities \nin the context of poverty eradication and sustainable development, in line with \nnational priorities, \n \nNoting with concern that access to the benefits of research and innovation, such \nas quality, safe, efficacious and affordable diagnostics and treatment, remains \nchallenging, especially for developing countries, \n \nWelcoming international cooperation initiatives by the World Health Organization \ntowards the development of and equitable access to COVID-19, malaria, tuberculosis, \ncholera and HIV/AIDS vaccines in developing countries, inter alia, through the \nmRNA vaccine technology transfer hub based in South Africa, working with \n15 partners across the world, in collaboration with Medicines Patent Pool, \n \n1. \nUrges Member States to continue to consider health issues in the \nformulation of foreign policy; \n \n2. \nEncourages Member States to strengthen regional and international \ncooperation, multilateralism, global solidarity, coordination and health governance, \ntowards the progressive realization of the right to the enjoyment of the highest \nattainable standard of physical and mental health for all, without distinction of any \nkind; \n \n3. \nCalls upon Member States to continue to contribute actively to the \nIntergovernmental Negotiating Body to draft and negotiate a legally binding World \nHealth Organization convention, agreement or other international instrument on \npandemic prevention, preparedness and response, as well as the amendments to the \nInternational Health Regulations (2005) to achieve a timely completion of both \nprocesses by the seventy-seventh session of the World Health Assembly in May 2024; \n \n4. \nUrges Member States to cooperate, including through technical and \nfinancial support to capacity-building and access to technology in acknowledgement \nof their different levels of development and capacities, to ensure that all States, in \nparticular developing countries, can effectively implement measures to prevent, \nprepare for and respond to pandemics and other health emergencies, in accordance \nwith the International Health Regulations (2005); \n \n5. \nAlso urges Member States to commit to strengthening women\u2019s full, \neffective and meaningful participation in leadership and decision-making processes \nin pandemics and other health emergencies at all levels, and to mainstream a gender \nperspective into all policies and programmes, including in budgetary responses; \n \n6. \nCalls upon Member States, as appropriate, to establish stronger regional \ncapacities for research and development, manufacturing, regulation and procurement \nof needed tools for equitable and effective access to vaccines, therapeutics, \ndiagnostics and essential supplies, as well as for clinical trials, and to increase global \nsupply through, inter alia, facilitating transfer of technology within the framework of \nrelevant multilateral agreements, while strengthening their leadership, commitment \n__________________ \n \n18  Resolution 78/1, annex. \n\nGlobal health and foreign policy: addressing global \nhealth challenges in the foreign policy space \nA/RES/78/280\n \n9/12\n24-08223 \n \nand support in promoting the establishment and strengthening of quality and \nsustainable local production of medicines and other health technologies that follows \ngood manufacturing practices; \n \n7. \nUrges Member States, where appropriate, based on the national context, \nto apply a holistic approach in strengthening local and regional production by \nconsidering, for example, promoting research and development, transparency of \nmarkets for medicines and other health products and technologies, strengthening of \nregulatory systems, access to sustainable and affordable financing, development of \nskilled human resources, access to technology transfer on mutually agreed terms for \nproduction and needs-based innovation, the aggregation of national and regional \ndemand, and appropriate incentives for private sector investment; \n \n8. \nAlso urges Member States to ensure that digital health interventions \ncomplement and enhance health system functions through mechanisms such as \naccelerating exchange of information, recognizes that digital health interventions are \nnot a substitute for functioning health systems, that there are significant limitations \nto what digital health is able to address, and that it can never replace the fundamental \ncomponents needed by health systems such as health workforce, financing, leadership \nand governance, and access to essential medicines, and in this regard acknowledges \nthe pressing need to address the major impediments that developing countries face in \naccessing and developing digital technologies, and highlights the importance of \nfinancing and capacity-building; \n \n9. \nUrges the sustainable, affordable, fair, equitable, effective, efficient and \ntimely access to medical countermeasures, including vaccines, therapeutics, \ndiagnostics and other health products, and calls upon the World Health Organization \nto coordinate this with relevant partners, ensuring coherence with the ongoing \ndiscussions of the Intergovernmental Negotiating Body and the Working Group on \nAmendments to the International Health Regulations (2005) in Geneva; \n \n10. Calls upon Member States to remove trade barriers, strengthen supply \nchains, facilitate the movement of medical and public health goods, and diversify \nmanufacturing capacities across regions, especially during pandemics and other \nhealth emergencies among and within countries; \n \n11. \nUrges Member States to prioritize, by increasing or maintaining, as \nappropriate, domestic and international financing for health, to contribute to the \nsustainable financing of the multilateral system, including the World Health \nOrganization consistent with decisions of the World Health Assembly, and to continue \nto support the planning of a World Health Organization investment round as part of a \nmore predictably and sustainably financed Organization;  \n \n12. Encourages Member States to support the Pandemic Fund and in \nmobilizing additional external resources for pandemic prevention, preparedness and \nresponse, including from new donors, and in helping countries to become more \nresilient to future pandemics and other health emergencies;  \n \n13. Calls upon the international community to mobilize the means necessary \nto support Africa\u2019s efforts to prevent, prepare for and respond to outbreaks and \nepidemics that account for over 100 major public health emergency events annually; \n \n14. Calls upon Member States to further implement and reinforce an \nintegrated One Health approach that fosters cooperation and collaboration between \nthe human health, animal health and plant health, as well as environmental and other \nrelevant sectors, taking into account the relevant guidance recommended by the World \nHealth Organization, the Food and Agriculture Organization of the United Nations, \nthe World Organization for Animal Health and United Nations Environment \n\nA/RES/78/280 \nGlobal health and foreign policy: addressing global \nhealth challenges in the foreign policy space\n \n24-08223\n10/12 \n \nProgramme, the Quadripartite organizations, and exchanging reliable information and \nscientific knowledge in a timely manner; \n \n15. Calls for international cooperation and coordination in alignment with the \nQuadripartite One Health Joint Plan of Action (2022\u20132026), as appropriate, to support \nbuilding regional, national and community-level capacities, including through the use \nof a One Health approach, and enable diagnostics of comprehensively addressing \noutbreaks in animals, the environment and humans during both inter-pandemic and \npandemic times; \n \n16. Calls upon Member States to strengthen the resilience of their health \nsystems and universal health coverage as an integral part of their systems for effective \nand sustainable prevention, preparedness and response to pandemics and other public \nhealth and humanitarian emergencies, while maintaining access to essential health \nservices, including routine immunization, or to quickly reinstate them after disruption; \n \n17. Urges Member States to strengthen international cooperation to support \nefforts to finance, build, strengthen and maintain capacity in developing countries to \nimprove water, sanitation, hygiene, waste and electricity services in health-care \nfacilities; \n \n18. Encourages Member States to accelerate action to address the global \nshortfall of health and care workers and encourage the development of nationally \ncosted health workforce plans in accordance with the Global Strategy on Human \nResources for Health: Workforce 2030 by investing in education, employment and \nretention, strengthening the institutional capacity for health workforce governance, \nleadership, disaggregated data and planning, gender equality, addressing causes of \nhealth worker migration as well as departure from the health workforce and protecting \nand supporting all health and care workers from all forms of discrimination, harassment, \nviolence and attacks, and to promote a decent and safe working environment and \nconditions at all times as well as ensure their physical and mental health; \n \n19. Urges Member States to implement their commitment to provide better \nopportunities and decent work for women to ensure their role and leadership in the \nhealth sector, with a view to increasing the meaningful representation, engagement, \nparticipation and empowerment of all women in the workforce at all levels, including \nin decision-making positions, and take measures towards fair employment practices \nand eliminating biases against women, and address inequalities, including the gender \npay gap, by appropriately remunerating health workers and care workers in the health \nsector, including community health workers; \n \n20. Calls upon Member States to strengthen national efforts, international \ncooperation and global solidarity to accelerate the achievement of universal health \ncoverage by 2030, with primary health care as a cornerstone, and leave no one behind \nto ensure healthy lives and promote well-being for all throughout the life course, \nwhile reducing catastrophic out-of-pocket health expenditure and eliminating \nimpoverishment due to health-related expenses by 2030; \n \n21. Also calls upon Member States to take measures to significantly reduce \nmaternal, perinatal, neonatal, infant and child mortality and morbidity and increase \naccess to quality health-care services for newborns, infants and children, as well as \nall women before, during and after pregnancy and childbirth, including through \nproviding antenatal and postnatal care, sufficient numbers of skilled birth attendants \nand adequately supplied birthing facilities; \n \n22. Urges timely, equitable and unhindered access to safe, affordable, \neffective and quality medicines, vaccines, diagnostics and therapeutics and other \nhealth products and technologies as one of the fundamental elements for the full \nrealization of the right of everyone to the enjoyment of the highest attainable standard \n\nGlobal health and foreign policy: addressing global \nhealth challenges in the foreign policy space \nA/RES/78/280\n \n11/12\n24-08223 \n \nof physical and mental health and the correspondent objectives of universal health \ncoverage and health for all, without discrimination, with special attention to reaching \nthose furthest behind first; \n \n23. Urges Member States to ensure, by 2030, universal access to sexual and \nreproductive health-care services, including for family planning, information and \neducation and the integration of reproductive health into national strategies and \nprogrammes, and ensure universal access to sexual and reproductive health and \nreproductive rights as agreed in accordance with the Programme of Action of the \nInternational Conference on Population and Development 19 and the Beijing Platform \nfor Action20 and the outcome documents of their review conferences; \n \n24. Also urges Member States to ensure safe, timely and unhindered access of \nhumanitarian personnel and medical personnel responding to pandemics and other \nhealth emergencies, as well as their means of transport, supplies and equipment, and \nto support, facilitate and enable transportation and logistical supply lines, in order to \nallow such personnel to efficiently and safely perform their task of assisting affected \npopulations, and in this regard also reaffirms the need to take the necessary measures \nto respect and protect such personnel, hospitals and other medical facilities consistent \nwith international humanitarian law; \n \n25. Encourages Member States to strengthen health literacy and address the \nnegative impact of misinformation, disinformation and stigmatization on public \nhealth measures and people\u2019s physical and mental health, including on social media \nplatforms, and foster trust in health systems and vaccine confidence, particularly by \npromoting access to timely and accurate information; \n \n26. Calls upon Member States to scale up investments for the tuberculosis \nresponse, research and innovation to reduce the number of people falling ill, including \nby incorporating lessons learned from the response to the COVID-19 pandemic, and \nachieve the targets agreed in the 2030 Agenda for Sustainable Development21 and in \nthe End TB Strategy;22  \n \n27. Urges Member States to commit to strengthening research capacity and \ncollaboration through improving tuberculosis research platforms and networks across \nthe public and private sectors, noting platforms and networks such as the BRICS \nTuberculosis Research Network in basic science, clinical research and development, \nincluding pre-clinical and clinical trials, as well as operational, qualitative and applied \nresearch, to advance effective tuberculosis prevention, diagnosis, treatment and care \nand actions on the economic and social determinants and impacts of the disease; \n \n28. Calls upon Member States to commit to reinforcing actions and \nmultilateral initiatives like the Global Fund to fight AIDS, Tuberculosis and Malaria, \nUnitaid and Gavi, the Vaccine Alliance, including through outreach to the private \nsector and philanthropic entities with a mission to end ongoing health emergencies \nand health challenges, such as tuberculosis, HIV/AIDS, malaria, neglected tropical \ndiseases and other preventable diseases that disproportionately affect developing \ncountries; \n \n29. Also calls upon Member States to strengthen the meaningful engagement \nof parliaments, civil society, the educational system and local communities, young \npeople, women and, as appropriate, girls in all aspects of the response to health \n__________________ \n \n19  Report of the International Conference on Population and Development, Cairo, 5\u201313 September \n1994 (United Nations publication, Sales No. E.95.XIII.18), chap. I, resolution 1, annex. \n \n20  Report of the Fourth World Conference on Women, Beijing, 4\u201315 September 1995 (United \nNations publication, Sales No. E.96.IV.13), chap. I, resolution 1, annex II. \n \n21  Resolution 70/1. \n \n22  See World Health Organization, document WHA67/2014/REC/1, resolution 67.1. \n\nA/RES/78/280 \nGlobal health and foreign policy: addressing global \nhealth challenges in the foreign policy space\n \n24-08223\n12/12 \n \nchallenges and health emergencies, to ensure that the response is equitable, inclusive, \npeople-centred and promotes gender equality and respects human rights, including \nwith regard to policymaking forums, planning, care delivery, and national \nmultisectoral accountability and review mechanisms as appropriate, and increase and \nsustain investment for initiatives, in particular at the community level, and in line \nwith national contexts;  \n \n30. Urges Member States to strengthen the capacity of health systems for \nmonitoring and minimizing the public health impacts of climate change through \nadequate preventive measures, preparedness, timely response and effective \nmanagement of natural disasters, and to develop health measures and integrate them \ninto plans for adaptation to climate change as appropriate; \n \n31. Invites the World Health Organization to continue to provide quality and \neffectively disseminated normative guidance and technical support to Member States, \nupon their request, in order to build capacity, strengthen health systems and \nprevention, preparedness and response to health emergencies, promote training, \nrecruitment, development and retention of human resources for health systems and \ntechnology transfer on mutually agreed terms with a particular focus on developing \ncountries, and notes with appreciation the creation of the World Health Organization \nAcademy in this regard; \n \n32. Requests the President of the General Assembly to convene, in 2025, \nwithin existing resources, a one-day high-level interactive dialogue on the social, \neconomic and environmental determinants of health and to draft and circulate a \nsummary of the meeting; \n \n33. Requests the Secretary-General, in close collaboration with the Director \nGeneral of the World Health Organization as well as with relevant international \norganizations, to report to the General Assembly at its seventy-ninth session, under \nthe item entitled \u201cGlobal health and foreign policy\u201d, on improving international \ncooperation and multilateral efforts to address global health challenges and promote \nequity in health for the achievement of the 2030 Agenda. \n \n77th plenary meeting \n2 May 2024 \n \n",
  "paragraphs": {
    "1": "Urges Member States to continue to consider health issues in the formulation of foreign policy;",
    "2": "Encourages Member States to strengthen regional and international cooperation, multilateralism, global solidarity, coordination and health governance, towards the progressive realization of the right to the enjoyment of the highest attainable standard of physical and mental health for all, without distinction of any kind;",
    "3": "Calls upon Member States to continue to contribute actively to the Intergovernmental Negotiating Body to draft and negotiate a legally binding World Health Organization convention, agreement or other international instrument on pandemic prevention, preparedness and response, as well as the amendments to the International Health Regulations (2005) to achieve a timely completion of both processes by the seventy-seventh session of the World Health Assembly in May 2024;",
    "4": "Urges Member States to cooperate, including through technical and financial support to capacity-building and access to technology in acknowledgement of their different levels of development and capacities, to ensure that all States, in particular developing countries, can effectively implement measures to prevent, prepare for and respond to pandemics and other health emergencies, in accordance with the International Health Regulations (2005);",
    "5": "Also urges Member States to commit to strengthening women\u2019s full, effective and meaningful participation in leadership and decision-making processes in pandemics and other health emergencies at all levels, and to mainstream a gender perspective into all policies and programmes, including in budgetary responses;",
    "6": "Calls upon Member States, as appropriate, to establish stronger regional capacities for research and development, manufacturing, regulation and procurement of needed tools for equitable and effective access to vaccines, therapeutics, diagnostics and essential supplies, as well as for clinical trials, and to increase global supply through, inter alia, facilitating transfer of technology within the framework of relevant multilateral agreements, while strengthening their leadership, commitment __________________ 18 Resolution 78/1, annex. Global health and foreign policy: addressing global health challenges in the foreign policy space A/RES/78/280 9/12 24-08223 and support in promoting the establishment and strengthening of quality and sustainable local production of medicines and other health technologies that follows good manufacturing practices;",
    "7": "Urges Member States, where appropriate, based on the national context, to apply a holistic approach in strengthening local and regional production by considering, for example, promoting research and development, transparency of markets for medicines and other health products and technologies, strengthening of regulatory systems, access to sustainable and affordable financing, development of skilled human resources, access to technology transfer on mutually agreed terms for production and needs-based innovation, the aggregation of national and regional demand, and appropriate incentives for private sector investment;",
    "8": "Also urges Member States to ensure that digital health interventions complement and enhance health system functions through mechanisms such as accelerating exchange of information, recognizes that digital health interventions are not a substitute for functioning health systems, that there are significant limitations to what digital health is able to address, and that it can never replace the fundamental components needed by health systems such as health workforce, financing, leadership and governance, and access to essential medicines, and in this regard acknowledges the pressing need to address the major impediments that developing countries face in accessing and developing digital technologies, and highlights the importance of financing and capacity-building;",
    "9": "Urges the sustainable, affordable, fair, equitable, effective, efficient and timely access to medical countermeasures, including vaccines, therapeutics, diagnostics and other health products, and calls upon the World Health Organization to coordinate this with relevant partners, ensuring coherence with the ongoing discussions of the Intergovernmental Negotiating Body and the Working Group on Amendments to the International Health Regulations (2005) in Geneva;",
    "10": "Calls upon Member States to remove trade barriers, strengthen supply chains, facilitate the movement of medical and public health goods, and diversify manufacturing capacities across regions, especially during pandemics and other health emergencies among and within countries;",
    "11": "Urges Member States to prioritize, by increasing or maintaining, as appropriate, domestic and international financing for health, to contribute to the sustainable financing of the multilateral system, including the World Health Organization consistent with decisions of the World Health Assembly, and to continue to support the planning of a World Health Organization investment round as part of a more predictably and sustainably financed Organization;",
    "12": "Encourages Member States to support the Pandemic Fund and in mobilizing additional external resources for pandemic prevention, preparedness and response, including from new donors, and in helping countries to become more resilient to future pandemics and other health emergencies;",
    "13": "Calls upon the international community to mobilize the means necessary to support Africa\u2019s efforts to prevent, prepare for and respond to outbreaks and epidemics that account for over 100 major public health emergency events annually;",
    "14": "Calls upon Member States to further implement and reinforce an integrated One Health approach that fosters cooperation and collaboration between the human health, animal health and plant health, as well as environmental and other relevant sectors, taking into account the relevant guidance recommended by the World Health Organization, the Food and Agriculture Organization of the United Nations, the World Organization for Animal Health and United Nations Environment A/RES/78/280 Global health and foreign policy: addressing global health challenges in the foreign policy space 24-08223 10/12 Programme, the Quadripartite organizations, and exchanging reliable information and scientific knowledge in a timely manner;",
    "15": "Calls for international cooperation and coordination in alignment with the Quadripartite One Health Joint Plan of Action (2022\u20132026), as appropriate, to support building regional, national and community-level capacities, including through the use of a One Health approach, and enable diagnostics of comprehensively addressing outbreaks in animals, the environment and humans during both inter-pandemic and pandemic times;",
    "16": "Calls upon Member States to strengthen the resilience of their health systems and universal health coverage as an integral part of their systems for effective and sustainable prevention, preparedness and response to pandemics and other public health and humanitarian emergencies, while maintaining access to essential health services, including routine immunization, or to quickly reinstate them after disruption;",
    "17": "Urges Member States to strengthen international cooperation to support efforts to finance, build, strengthen and maintain capacity in developing countries to improve water, sanitation, hygiene, waste and electricity services in health-care facilities;",
    "18": "Encourages Member States to accelerate action to address the global shortfall of health and care workers and encourage the development of nationally costed health workforce plans in accordance with the Global Strategy on Human Resources for Health: Workforce 2030 by investing in education, employment and retention, strengthening the institutional capacity for health workforce governance, leadership, disaggregated data and planning, gender equality, addressing causes of health worker migration as well as departure from the health workforce and protecting and supporting all health and care workers from all forms of discrimination, harassment, violence and attacks, and to promote a decent and safe working environment and conditions at all times as well as ensure their physical and mental health;",
    "19": "Urges Member States to implement their commitment to provide better opportunities and decent work for women to ensure their role and leadership in the health sector, with a view to increasing the meaningful representation, engagement, participation and empowerment of all women in the workforce at all levels, including in decision-making positions, and take measures towards fair employment practices and eliminating biases against women, and address inequalities, including the gender pay gap, by appropriately remunerating health workers and care workers in the health sector, including community health workers;",
    "20": "Calls upon Member States to strengthen national efforts, international cooperation and global solidarity to accelerate the achievement of universal health coverage by 2030, with primary health care as a cornerstone, and leave no one behind to ensure healthy lives and promote well-being for all throughout the life course, while reducing catastrophic out-of-pocket health expenditure and eliminating impoverishment due to health-related expenses by 2030;",
    "21": "Also calls upon Member States to take measures to significantly reduce maternal, perinatal, neonatal, infant and child mortality and morbidity and increase access to quality health-care services for newborns, infants and children, as well as all women before, during and after pregnancy and childbirth, including through providing antenatal and postnatal care, sufficient numbers of skilled birth attendants and adequately supplied birthing facilities;",
    "22": "Urges timely, equitable and unhindered access to safe, affordable, effective and quality medicines, vaccines, diagnostics and therapeutics and other health products and technologies as one of the fundamental elements for the full realization of the right of everyone to the enjoyment of the highest attainable standard Global health and foreign policy: addressing global health challenges in the foreign policy space A/RES/78/280 11/12 24-08223 of physical and mental health and the correspondent objectives of universal health coverage and health for all, without discrimination, with special attention to reaching those furthest behind first;",
    "23": "Urges Member States to ensure, by 2030, universal access to sexual and reproductive health-care services, including for family planning, information and education and the integration of reproductive health into national strategies and programmes, and ensure universal access to sexual and reproductive health and reproductive rights as agreed in accordance with the Programme of Action of the International Conference on Population and Development 19 and the Beijing Platform for Action20 and the outcome documents of their review conferences;",
    "24": "Also urges Member States to ensure safe, timely and unhindered access of humanitarian personnel and medical personnel responding to pandemics and other health emergencies, as well as their means of transport, supplies and equipment, and to support, facilitate and enable transportation and logistical supply lines, in order to allow such personnel to efficiently and safely perform their task of assisting affected populations, and in this regard also reaffirms the need to take the necessary measures to respect and protect such personnel, hospitals and other medical facilities consistent with international humanitarian law;",
    "25": "Encourages Member States to strengthen health literacy and address the negative impact of misinformation, disinformation and stigmatization on public health measures and people\u2019s physical and mental health, including on social media platforms, and foster trust in health systems and vaccine confidence, particularly by promoting access to timely and accurate information;",
    "26": "Calls upon Member States to scale up investments for the tuberculosis response, research and innovation to reduce the number of people falling ill, including by incorporating lessons learned from the response to the COVID-19 pandemic, and achieve the targets agreed in the 2030 Agenda for Sustainable Development21 and in the End TB Strategy;22",
    "27": "Urges Member States to commit to strengthening research capacity and collaboration through improving tuberculosis research platforms and networks across the public and private sectors, noting platforms and networks such as the BRICS Tuberculosis Research Network in basic science, clinical research and development, including pre-clinical and clinical trials, as well as operational, qualitative and applied research, to advance effective tuberculosis prevention, diagnosis, treatment and care and actions on the economic and social determinants and impacts of the disease;",
    "28": "Calls upon Member States to commit to reinforcing actions and multilateral initiatives like the Global Fund to fight AIDS, Tuberculosis and Malaria, Unitaid and Gavi, the Vaccine Alliance, including through outreach to the private sector and philanthropic entities with a mission to end ongoing health emergencies and health challenges, such as tuberculosis, HIV/AIDS, malaria, neglected tropical diseases and other preventable diseases that disproportionately affect developing countries;",
    "29": "Also calls upon Member States to strengthen the meaningful engagement of parliaments, civil society, the educational system and local communities, young people, women and, as appropriate, girls in all aspects of the response to health __________________ 19 Report of the International Conference on Population and Development, Cairo, 5\u201313 September 1994 (United Nations publication, Sales No. E.95.XIII.18), chap. I, resolution 1, annex. 20 Report of the Fourth World Conference on Women, Beijing, 4\u201315 September 1995 (United Nations publication, Sales No. E.96.IV.13), chap. I, resolution 1, annex II. 21 Resolution 70/1. 22 See World Health Organization, document WHA67/2014/REC/1, resolution 67.1. A/RES/78/280 Global health and foreign policy: addressing global health challenges in the foreign policy space 24-08223 12/12 challenges and health emergencies, to ensure that the response is equitable, inclusive, people-centred and promotes gender equality and respects human rights, including with regard to policymaking forums, planning, care delivery, and national multisectoral accountability and review mechanisms as appropriate, and increase and sustain investment for initiatives, in particular at the community level, and in line with national contexts;",
    "30": "Urges Member States to strengthen the capacity of health systems for monitoring and minimizing the public health impacts of climate change through adequate preventive measures, preparedness, timely response and effective management of natural disasters, and to develop health measures and integrate them into plans for adaptation to climate change as appropriate;",
    "31": "Invites the World Health Organization to continue to provide quality and effectively disseminated normative guidance and technical support to Member States, upon their request, in order to build capacity, strengthen health systems and prevention, preparedness and response to health emergencies, promote training, recruitment, development and retention of human resources for health systems and technology transfer on mutually agreed terms with a particular focus on developing countries, and notes with appreciation the creation of the World Health Organization Academy in this regard;",
    "32": "Requests the President of the General Assembly to convene, in 2025, within existing resources, a one-day high-level interactive dialogue on the social, economic and environmental determinants of health and to draft and circulate a summary of the meeting;",
    "33": "Requests the Secretary-General, in close collaboration with the Director General of the World Health Organization as well as with relevant international organizations, to report to the General Assembly at its seventy-ninth session, under the item entitled \u201cGlobal health and foreign policy\u201d, on improving international cooperation and multilateral efforts to address global health challenges and promote equity in health for the achievement of the 2030 Agenda. 77th plenary meeting 2 May 2024"
  },
  "agenda_items": [
    "Item 125"
  ],
  "symbol_references": [
    "A/78/L.62"
  ]
}