{
  "symbol": "A/RES/73/334",
  "filename": "A_RES_73_334.pdf",
  "title": "73/334. Cooperation between the United Nations and the Shanghai Cooperation Organization",
  "text": "United Nations \nA/RES/73/334\n \n \nGeneral Assembly \nDistr.: General \n5 September 2019 \n \n19-14898 (E)    090919     \n*1914898* \n \n \nSeventy-third session \nAgenda item 128 (s) \n \n \n \n \n Resolution adopted by the General Assembly \non 30 August 2019 \n \n \n \n \n[without reference to a Main Committee (A/73/L.106 and A/73/L.106/Add.1)] \n \n \n 73/334. Cooperation between the United Nations and the Shanghai \nCooperation Organization \n \n \n \nThe General Assembly,  \n \nRecalling that one of the objectives of the United Nations is to achieve \ncooperation in maintaining international peace and security and solving international \nproblems of an economic, social, cultural or humanitarian character, \n \nRecalling also the Articles of the Charter of the United Nations that encourage \nactivities on the basis of regional cooperation to promote the goals and objectives of \nthe United Nations, \n \nRecalling further its resolution 59/48 of 2 December 2004, by which it granted \nobserver status to the Shanghai Cooperation Organization, \n \nRecalling its resolutions 64/183 of 18 December 2009, 65/124 of 13 December \n2010, 67/15 of 19 November 2012, 69/11 of 11 November 2014 and 71/14 of \n21 November 2016 on cooperation between the United Nations and the Shanghai \nCooperation Organization, \n \nRecalling also the Joint Declaration on Cooperation between the secretariats of \nthe United Nations and the Shanghai Cooperation Organization, dated 5 April 2010, \n \nNoting that the Shanghai Cooperation Organization is committed to act \nconsistently with the goals and principles of the United Nations, \n \nNoting also that the Shanghai Cooperation Organization has become an essential \nregional organization for addressing security in the region, in all its dimensions, \nincluding in cooperation with relevant regional organizations, \n\nA/RES/73/334 \nCooperation between the United Nations and the Shanghai Cooperation Organization\n \n19-14898\n2/4 \n \n \nTaking into account the commitment of the States members of the Shanghai \nCooperation Organization to pursue the implementation of the goals outlined in the \n2030 Agenda for Sustainable Development,1 \n \nRecalling the commitment of the States members of the Shanghai Cooperation \nOrganization to achieve a pacific settlement of regional disputes under Chapter VIII \nof the Charter of the United Nations, \n \nRecognizing the efforts of the States members of the Shanghai Cooperation \nOrganization to build the region of the Shanghai Cooperation Organization into a \nregion of lasting peace, friendship, prosperity and harmony, in accordance with the \nTreaty on Long-term Good-neighbourliness, Friendship and Cooperation among the \nStates members of the Shanghai Cooperation Organization, 2  \n \nRecalling that in its resolution 71/14, it noted the aspiration of the States \nmembers of the Shanghai Cooperation Organization to promote stability and the \nmaintenance of international peace and security, and noting in this regard the \neighteenth meeting of the Council of Heads of State of the Shanghai Cooperation \nOrganization, held in Qingdao, China, on 9 and 10 June 2018, as well as the \nnineteenth meeting, held in Bishkek, Kyrgyzstan, on 13 and 14 June 2019,  \n \nWelcoming the commitment of the States party to the Treaty on the \nNon-Proliferation of Nuclear Weapons 3 that are States members of the Shanghai \nCooperation Organization to comply fully with the Treaty, including in Central Asia, \n \nRecognizing the efforts of the States members of the Shanghai Cooperation \nOrganization to promote counter-terrorism cooperation, including through the Regional \nAnti-Terrorist Structure, and welcoming in this regard the protocol on cooperation \nbetween the Regional Anti-Terrorist Structure of the Shanghai Cooperation \nOrganization and the United Nations Office on Drugs and Crime, signed on 22 July \n2012, noting the cooperation between the Regional Anti-Terrorist Structure of the \nShanghai Cooperation Organization and the Office of Counter-Terrorism, including the \nUnited Nations Counter-Terrorism Centre, in implementing the United Nations Global \nCounter-Terrorism Strategy,4 and the cooperation between the Regional Anti-Terrorist \nStructure of the Shanghai Cooperation Organization and the Counter-Terrorism \nCommittee Executive Directorate, and noting the Memorandum of Understanding on \ncooperation between these two entities signed on 25 March 2019,  \n \nRecognizing also the role of the Shanghai Cooperation Organization in \ncombating drugs, based on the outcome of the thirtieth special session of the General \nAssembly on the world drug problem, held in New York from 19 to 21 April 2016, 5 \nand encouraging the Shanghai Cooperation Organization to continue such \ncooperation in this field,  \n \nRecalling the signing of the Memorandum of Understanding between the \nsecretariat of the Shanghai Cooperation Organization and the United Nations Office \non Drugs and Crime in June 2011 with a view to effectively addressing, in cooperation \nwith relevant international and regional actors, the production of and trade and \ntrafficking in drugs, and welcoming the further cooperation of the Shanghai \nCooperation Organization and the Office, \n \nNoting the improved quality of the dynamics of cooperation among the States \nmembers of the Shanghai Cooperation Organization, as well as the further \n__________________ \n \n1  Resolution 70/1. \n \n2  United Nations, Treaty Series, vol. 2896, No. 50518. \n \n3  Ibid., vol. 729, No. 10485. \n \n4  Resolution 60/288. \n \n5  Resolution S-30/1, annex. \n\nCooperation between the United Nations and the Shanghai Cooperation Organization \nA/RES/73/334\n \n3/4\n19-14898 \n \nenhancement of the potential and role of the Shanghai Cooperation Organization in \nthe international arena as a multilateral mechanism, and in this regard welcoming the \nconvening of the meeting of the Council of Heads of State of the Shanghai \nCooperation Organization in Qingdao on 9 and 10 June 2018 as the first summit after \nthe enlargement of the Organization, \n \nTaking note of the initiatives of the Shanghai Cooperation Organization, as well \nas the efforts of others, to address security of and in the use of information and \ncommunications technologies, and recognizing the need for further discussions in \nrelevant forums, \n \nNoting the signing of the Memorandum of Understanding between the \nsecretariat of the Shanghai Cooperation Organization and the secretariat of the United \nNations Economic and Social Commission for Asia and the Pacific in December 2015 \naimed at enhancing cooperation in trade, transport, energy, and information and \ncommunications technology connectivity, \n \nWelcoming the signing of the Memorandum of Understanding on cooperation \nbetween the secretariat of the Shanghai Cooperation Organization and the United \nNations Educational, Scientific and Cultural Organization in June 2018 with the goal \nof strengthening peace, sustainable development and intercultural dialogue by means \nof developing cooperation in education, science, culture, communication and \ninformation, \n \nRecognizing the efforts of the Shanghai Cooperation Organization to promote \ncooperation with other regional organizations, including the Collective Security \nTreaty Organization, the Commonwealth of Independent States, the Association of \nSoutheast Asian Nations, the Conference on Interaction and Confidence-building \nMeasures in Asia and the Economic Cooperation Organization, as well as with the \nInternational Committee of the Red Cross,6 \n \nTaking into consideration the fact that countries with economies in transition \nare among the members of the Shanghai Cooperation Organization, and in this regard \nrecalling its resolution 61/210 of 20 December 2006, in which it proposed that the \nUnited Nations system enhance dialogue with regional and subregional cooperation \norganizations whose membership includes countries with economies in transition and \nincrease support provided to them, \n \nConvinced that strengthening cooperation between the United Nations and other \norganizations of the United Nations system and the Shanghai Cooperation \nOrganization helps to promote the goals and objectives of the United Nations, \n \n1. \nAcknowledges the constructive role of the Shanghai Cooperation \nOrganization in securing peace and sustainable development, advancing regional \ncooperation and strengthening good-neighbourliness and mutual trust, and notes the \nactivities of the Shanghai Cooperation Organization aimed at strengthening peace, \nsecurity and stability in the region, countering terrorism, drug trafficking and other \ntypes of criminal activity of a transnational character and promoting regional \ncooperation in various areas, such as trade and economic development, energy, \ntransportation, agriculture and agro-industry, the regulation of migration, banking and \nfinances, information and telecommunications, science and new technology, customs, \neducation, public health, environmental protection and reducing the danger of natural \ndisasters, as well as in other related areas; \n__________________ \n \n6  A Memorandum of Understanding between the secretariat of the Shanghai Cooperation \nOrganization and the International Committee of the Red Cross was signed in Astana on 9 June \n2017. \n\nA/RES/73/334 \nCooperation between the United Nations and the Shanghai Cooperation Organization\n \n19-14898\n4/4 \n \n \n2. \nEmphasizes the importance of strengthening dialogue, cooperation and \ncoordination between the United Nations system and the Shanghai Cooperation \nOrganization, and proposes that the Secretary-General, for this purpose, continue to \nhold regular consultations with the Secretary-General of the Shanghai Cooperation \nOrganization through the existing inter-agency forums and formats, including the \nhigh-level interactive dialogue of the Secretary-General of the United Nations with \nthe heads of the regional organizations and other organizations; \n \n3. \nProposes that the specialized agencies, organizations, programmes and \nfunds of the United Nations system cooperate with the Shanghai Cooperation \nOrganization with a view to jointly implementing programmes to achieve their goals, \nand in this regard recommends that the heads of such entities continue consultations \nwith the Secretary-General of the United Nations; \n \n4. \nRequests the Secretary-General to submit to the General Assembly at its \nseventy-fifth session a report on the implementation of the present resolution; \n \n5. \nDecides to include in the provisional agenda of its seventy-fifth session, \nunder the item entitled \u201cCooperation between the United Nations and regional and \nother organizations\u201d, the sub-item entitled \u201cCooperation between the United Nations \nand the Shanghai Cooperation Organization\u201d. \n \n103rd plenary meeting  \n30 August 2019 \n \n",
  "paragraphs": {
    "1": "Acknowledges the constructive role of the Shanghai Cooperation Organization in securing peace and sustainable development, advancing regional cooperation and strengthening good-neighbourliness and mutual trust, and notes the activities of the Shanghai Cooperation Organization aimed at strengthening peace, security and stability in the region, countering terrorism, drug trafficking and other types of criminal activity of a transnational character and promoting regional cooperation in various areas, such as trade and economic development, energy, transportation, agriculture and agro-industry, the regulation of migration, banking and finances, information and telecommunications, science and new technology, customs, education, public health, environmental protection and reducing the danger of natural disasters, as well as in other related areas; __________________ 6 A Memorandum of Understanding between the secretariat of the Shanghai Cooperation Organization and the International Committee of the Red Cross was signed in Astana on 9 June",
    "2017": "A/RES/73/334 Cooperation between the United Nations and the Shanghai Cooperation Organization 19-14898 4/4",
    "2": "Emphasizes the importance of strengthening dialogue, cooperation and coordination between the United Nations system and the Shanghai Cooperation Organization, and proposes that the Secretary-General, for this purpose, continue to hold regular consultations with the Secretary-General of the Shanghai Cooperation Organization through the existing inter-agency forums and formats, including the high-level interactive dialogue of the Secretary-General of the United Nations with the heads of the regional organizations and other organizations;",
    "3": "Proposes that the specialized agencies, organizations, programmes and funds of the United Nations system cooperate with the Shanghai Cooperation Organization with a view to jointly implementing programmes to achieve their goals, and in this regard recommends that the heads of such entities continue consultations with the Secretary-General of the United Nations;",
    "4": "Requests the Secretary-General to submit to the General Assembly at its seventy-fifth session a report on the implementation of the present resolution;",
    "5": "Decides to include in the provisional agenda of its seventy-fifth session, under the item entitled \u201cCooperation between the United Nations and regional and other organizations\u201d, the sub-item entitled \u201cCooperation between the United Nations and the Shanghai Cooperation Organization\u201d. 103rd plenary meeting 30 August 2019"
  },
  "agenda_items": [
    "Item 128"
  ],
  "symbol_references": [
    "A/73/L.106"
  ]
}