{
  "symbol": "A/RES/74/90",
  "filename": "A_RES_74_90.pdf",
  "title": "74/90. The occupied Syrian Golan",
  "text": "United Nations \nA/RES/74/90\n \n \nGeneral Assembly \nDistr.: General \n26 December 2019 \n \n19-21904 (E)    070120 \n*1921904* \n \n \nSeventy-fourth session \nAgenda item 51 \nReport of the Special Committee to Investigate Israeli \nPractices Affecting the Human Rights of the Palestinian \nPeople and Other Arabs of the Occupied Territories \n \n \n \n \n Resolution adopted by the General Assembly \non 13 December 2019 \n \n \n \n \n[on the report of the Special Political and Decolonization Committee \n(Fourth Committee) (A/74/410)] \n \n \n \n74/90. The occupied Syrian Golan \n \n \n \n \nThe General Assembly, \n \nHaving considered the report of the Special Committee to Investigate Israeli \nPractices Affecting the Human Rights of the Palestinian People and Other Arabs of \nthe Occupied Territories,1 \n \nDeeply concerned that the Syrian Golan, occupied since 1967, has been under \ncontinued Israeli military occupation, \n \nRecalling Security Council resolution 497 (1981) of 17 December 1981, \n \nRecalling also its previous relevant resolutions, the most recent of which was \nresolution 73/100 of 7 December 2018, \n \nHaving considered the report of the Secretary-General submitted in pursuance \nof resolution 73/100,2 \n \nRecalling its previous relevant resolutions in which, inter alia, it called upon \nIsrael to put an end to its occupation of the Arab territories, \n \nReaffirming once more the illegality of the decision of 14 December 1981 taken \nby Israel to impose its laws, jurisdiction and administration on the occupied Syrian \nGolan, which has resulted in the effective annexation of that territory, \n \nReaffirming that the acquisition of territory by force is inadmissible under \ninternational law, including the Charter of the United Nations, \n__________________ \n \n1  A/74/356. \n \n2  A/74/192. \n\nA/RES/74/90 \nThe occupied Syrian Golan\n \n19-21904\n2/2 \n \n \nReaffirming also the applicability of the Geneva Convention relative to the \nProtection of Civilian Persons in Time of War, of 12 August 1949, 3 to the occupied \nSyrian Golan, \n \nBearing in mind Security Council resolution 237 (1967) of 14 June 1967, \n \nWelcoming the convening at Madrid of the Peace Conference on the Middle East \non the basis of Security Council resolutions 242 (1967) of 22 November 1967 and \n338 (1973) of 22 October 1973 aimed at the realization of a just, comprehensive and \nlasting peace, and expressing grave concern about the stalling of the peace process on \nall tracks, \n \n1. \nCalls upon Israel, the occupying Power, to comply with the relevant \nresolutions on the occupied Syrian Golan, in particular Security Council resolution \n497 (1981), in which the Council, inter alia, decided that the Israeli decision to impose \nits laws, jurisdiction and administration on the occupied Syrian Golan was null and \nvoid and without international legal effect and demanded that Israel, the occupying \nPower, rescind forthwith its decision; \n \n2. \nAlso calls upon Israel to desist from changing the physical character, \ndemographic composition, institutional structure and legal status of the occupied \nSyrian Golan and in particular to desist from the establishment of settlements; \n \n3. \nDetermines that all legislative and administrative measures and actions \ntaken or to be taken by Israel, the occupying Power, that purport to alter the character \nand legal status of the occupied Syrian Golan are null and void, constitute a flagrant \nviolation of international law and of the Geneva Convention relative to the Protection \nof Civilian Persons in Time of War, of 12 August 1949,3 and have no legal effect; \n \n4. \nCalls upon Israel to desist from imposing Israeli citizenship and Israeli \nidentity cards on the Syrian citizens in the occupied Syrian Golan, and from its \nrepressive measures against the population of the occupied Syrian Golan; \n \n5. \nDeplores the violations by Israel of the Geneva Convention relative to the \nProtection of Civilian Persons in Time of War, of 12 August 1949; \n \n6. \nCalls once again upon Member States not to recognize any of the \nlegislative or administrative measures and actions referred to above; \n \n7. \nRequests the Secretary-General to report to the General Assembly at its \nseventy-fifth session on the implementation of the present resolution. \n \n47th plenary meeting \n13 December 2019 \n \n__________________ \n \n3  United Nations, Treaty Series, vol. 75, No. 973. \n",
  "paragraphs": {
    "1": "Calls upon Israel, the occupying Power, to comply with the relevant resolutions on the occupied Syrian Golan, in particular Security Council resolution 497 (1981), in which the Council, inter alia, decided that the Israeli decision to impose its laws, jurisdiction and administration on the occupied Syrian Golan was null and void and without international legal effect and demanded that Israel, the occupying Power, rescind forthwith its decision;",
    "2": "Also calls upon Israel to desist from changing the physical character, demographic composition, institutional structure and legal status of the occupied Syrian Golan and in particular to desist from the establishment of settlements;",
    "3": "Determines that all legislative and administrative measures and actions taken or to be taken by Israel, the occupying Power, that purport to alter the character and legal status of the occupied Syrian Golan are null and void, constitute a flagrant violation of international law and of the Geneva Convention relative to the Protection of Civilian Persons in Time of War, of 12 August 1949,3 and have no legal effect;",
    "4": "Calls upon Israel to desist from imposing Israeli citizenship and Israeli identity cards on the Syrian citizens in the occupied Syrian Golan, and from its repressive measures against the population of the occupied Syrian Golan;",
    "5": "Deplores the violations by Israel of the Geneva Convention relative to the Protection of Civilian Persons in Time of War, of 12 August 1949;",
    "6": "Calls once again upon Member States not to recognize any of the legislative or administrative measures and actions referred to above;",
    "7": "Requests the Secretary-General to report to the General Assembly at its seventy-fifth session on the implementation of the present resolution."
  },
  "agenda_items": [
    "Item 51"
  ],
  "symbol_references": []
}