{
  "symbol": "A/RES/78/316",
  "filename": "A_RES_78_316.pdf",
  "title": "78/316. Safety and security of nuclear facilities of Ukraine, including the Zaporizhzhia nuclear power plant",
  "text": "United Nations \nA/RES/78/316 \n \n \nGeneral Assembly \nDistr.: General \n15 July 2024 \n \n24-12991 (E)     \n*2412991* \n \n \nSeventy-eighth session \nAgenda item 62 \nThe situation in the temporarily occupied territories \nof Ukraine \n \n \n \n \n Resolution adopted by the General Assembly on \n11 July 2024 \n \n \n \n \n[without reference to a Main Committee (A/78/L.90)] \n \n \n 78/316. Safety and security of nuclear facilities of Ukraine, including the \nZaporizhzhia nuclear power plant \n \n \n \nThe General Assembly, \n \nRecalling the purposes and principles enshrined in the Charter of the United \nNations, \n \nRecalling also the obligation of all States under Article 2 of the Charter of the \nUnited Nations to refrain in their international relations from the threat or use of force \nagainst the territorial integrity or political independence of any State, or in any other \nmanner inconsistent with the purposes of the United Nations, and to settle their \ninternational disputes by peaceful means, and reaffirming that no territorial \nacquisition resulting from the threat or use of force shall be recognized as legal,\u202f \n \nRecalling further the order of provisional measures of the International Court \nof Justice of 16 March 2022,1 \n \nRecalling its relevant resolutions adopted at its eleventh emergency special \nsession2 as well as its resolutions 68/262 of 27 March 2014, 78/8 of 8 November 2023 \nand 78/221 of 19 December 2023,  \n \nCondemning in the strongest terms the aggression by the Russian Federation \nagainst Ukraine in violation of Article 2 (4) of the Charter, including the ongoing \ntemporary control or occupation by the Russian Federation of part of the territory of \nUkraine, including the Autonomous Republic of Crimea and the city of Sevastopol, \nand certain areas of the Kherson, Zaporizhzhia, Donetsk and Luhansk regions, and \nreaffirming that the attempted illegal annexation of these regions has no validity under \n__________________ \n \n1  See Official Records of the General Assembly, Seventy-seventh Session, Supplement No. 4 \n(A/77/4), paras. 189\u2013197. \n \n2  Resolutions ES-11/1, ES-11/2, ES-11/4 and ES-11/6. \n\nA/RES/78/316 \nSafety and security of nuclear facilities of Ukraine, including \nthe Zaporizhzhia nuclear power plant\n \n24-12991\n2/4 \n \ninternational law and does not form the basis for any alteration of the status of these \nregions of Ukraine, \n \nRecalling that attacks must not be directed against civilians or civilian objects, \nand recalling also article 56 (1) of Additional Protocol I of 1977 to the Geneva \nConventions of 12 August 1949,3 to which Ukraine and the Russian Federation are \nparties, which includes the provision that works or installations containing dangerous \nforces, namely dams, dykes and nuclear electrical generating stations, shall not be \nmade the object of attack, even where these objects are military objectives, if such \nattack may cause the release of dangerous forces and consequent severe losses among \nthe civilian population, \n \nTaking note of decision GC(53)/DEC/13 of 18 September 2009 of the General \nConference of the International Atomic Energy Agency, entitled \u201cProhibition of \narmed attack or threat of attack against nuclear installations, during operation or \nunder construction\u201d, as well as relevant resolutions of the General Conference of the \nAgency,  \n \nTaking note also of resolution GC(67)/RES/16 of 28 September 2023, entitled \n\u201cNuclear safety, security and safeguards in Ukraine\u201d, of the General Conference of \nthe International Atomic Energy Agency, as well as resolutions GOV/2022/17 of \n3 March 2022, GOV/2022/58 of 15 September 2022 and GOV/2022/71 of \n17 November 2022, entitled \u201cThe safety, security and safeguards implications of the \nsituation in Ukraine\u201d, and GOV/2024/18 of 7 March 2024, entitled \u201cNuclear safety, \nsecurity and safeguards in Ukraine\u201d, of the Board of Governors of the Agency,  \n \nCondemning the attacks by the Russian Federation against critical energy \ninfrastructure of Ukraine, which increases the risk of a nuclear accident or incident at \nall nuclear facilities of Ukraine, \n \nCondemning also the illegal and unprecedented forceful seizure of the \nZaporizhzhia nuclear power plant of Ukraine, and stressing that it has been more than \ntwo years that Russian military and other unauthorized personnel have remained at \nthe plant, and recalling that direct threats to the safety and security of the site and its \ncivilian personnel significantly raise the risk of a nuclear accident or incident, which \nendangers the population of Ukraine, neighbouring States and the international \ncommunity, \n \nExpressing grave concern over the precarious nuclear safety and security \nsituation at the Zaporizhzhia nuclear power plant, and that all of the \u201cseven \nindispensable pillars for ensuring nuclear safety and security during an armed \nconflict\u201d of the Director General of the International Atomic Energy Agency have \nbeen \u201ccompromised either fully or partially\u201d at the site, including the denial of access \nto Ukrainian operating personnel, gaps in routine maintenance activities, the lack of \nreliable supply chains, the vulnerable status of water and off-site power supply due \nto attacks on critical energy infrastructure, the planting of anti-personnel mines in a \nbuffer zone between the facility\u2019s internal and external fences, and other actions by \nRussian military and other unauthorized personnel present at the site,  \n \nEmphasizing the importance of the International Atomic Energy Agency \nDirector General\u2019s \u201cseven indispensable pillars for ensuring nuclear safety and \nsecurity during an armed conflict\u201d, derived from Agency safety standards and nuclear \nsecurity guidance, and the five concrete principles to help to ensure nuclear safety \nand security at the Zaporizhzhia nuclear power plant, and stressing that the \nimplementation of Agency safety standards and security guidance must be carried out \nin full respect of the sovereignty and territorial integrity of Ukraine, \n__________________ \n \n3  United Nations, Treaty Series, vol. 1125, No. 17512. \n\nSafety and security of nuclear facilities of Ukraine, including \nthe Zaporizhzhia nuclear power plant \nA/RES/78/316\n \n3/4\n24-12991 \n \n \nTaking note of the Summit on Peace in Ukraine, held on 15 and 16 June 2024, \nat which it was, inter alia, emphasized that any use of nuclear energy and nuclear \ninstallations must be safe, secured, safeguarded and environmentally sound, and that \nUkrainian nuclear power plants and installations, including the Zaporizhzhia nuclear \npower plant, must remain under full sovereign control of Ukraine in line with \nInternational Atomic Energy Agency principles, \n \n1. \nReaffirms its commitment to the sovereignty, independence, unity and \nterritorial integrity of Ukraine within its internationally recognized borders, \nextending to its territorial waters; \n \n2. \nDemands that the Russian Federation immediately cease its aggression \nagainst Ukraine and unconditionally withdraw all of its military forces from the \nterritory of Ukraine within its internationally recognized borders; \n \n3. \nAlso demands that the Russian Federation urgently withdraw its military \nand other unauthorized personnel from the Zaporizhzhia nuclear power plant and \nimmediately return the plant to the full control of the sovereign and competent \nauthorities of Ukraine to ensure its safety and security and in order for the \nInternational Atomic Energy Agency to conduct safe, efficient and effective \nsafeguards implementation in accordance with the comprehensive safeguards \nagreement and additional protocol of Ukraine, consistent with the repeated calls by \nthe General Conference and the Board of Governors of the Agency; \n \n4. \nCondemns the failure of the Russian Federation to implement relevant \nresolutions of the General Assembly and the General Conference and the Board of \nGovernors of the International Atomic Energy Agency; \n \n5. \nCalls for immediate cessation of the attacks by the Russian Federation \nagainst critical energy infrastructure of Ukraine, which increase the risk of a nuclear \naccident or incident at all nuclear facilities of Ukraine; \n \n6. \nWelcomes and encourages the continued efforts of the Director General of \nthe International Atomic Energy Agency to address the risks to nuclear safety and \nsecurity, as well as to safeguards implementation at the Zaporizhzhia nuclear power \nplant, caused by the aggression by the Russian Federation against Ukraine, including \nthrough the continued and reinforced physical presence of the International Atomic \nEnergy Agency Support and Assistance Mission to Zaporizhzhia; \n \n7. \nCalls upon the Russian Federation, until it returns the Zaporizhzhia \nnuclear power plant of Ukraine to the full control of the sovereign and competent \nauthorities of Ukraine, to provide the International Atomic Energy Agency Support \nand Assistance Mission to Zaporizhzhia with timely and full access to all areas at the \nplant that are important for nuclear safety and security in order to allow the Agency \nto report fully on the nuclear safety and security situation at the site; \n \n8. \nCalls upon all parties to the armed conflict to respect international \nhumanitarian law in all circumstances; \n \n9. \nAlso calls upon all parties to the armed conflict to implement fully the \n\u201cseven indispensable pillars for ensuring nuclear safety and security during an armed \nconflict\u201d and the five concrete principles of the Director General of the International \nAtomic Energy Agency to help to ensure nuclear safety and security at the \nZaporizhzhia nuclear power plant;  \n \n10. Urges the Russian Federation to immediately remove all anti-personnel \nmines placed along the perimeter of the Zaporizhzhia nuclear power plant; \n\nA/RES/78/316 \nSafety and security of nuclear facilities of Ukraine, including \nthe Zaporizhzhia nuclear power plant\n \n24-12991\n4/4 \n \n \n11. Calls upon Member States to continue to support the efforts of the Director \nGeneral of the International Atomic Energy Agency to uphold nuclear safety, security \nand safeguards implementation at all nuclear facilities in Ukraine; \n \n12. Requests the Secretary-General to provide his good offices in close \ncooperation with the Director General of the International Atomic Energy Agency; \n \n13. Decides to continue its consideration of the matter at its seventy-ninth \nsession under the agenda item entitled \u201cThe situation in the temporarily occupied \nterritories of Ukraine\u201d. \n \n99th plenary meeting \n11 July 2024 \n \n",
  "paragraphs": {
    "1": "Reaffirms its commitment to the sovereignty, independence, unity and territorial integrity of Ukraine within its internationally recognized borders, extending to its territorial waters;",
    "2": "Demands that the Russian Federation immediately cease its aggression against Ukraine and unconditionally withdraw all of its military forces from the territory of Ukraine within its internationally recognized borders;",
    "3": "Also demands that the Russian Federation urgently withdraw its military and other unauthorized personnel from the Zaporizhzhia nuclear power plant and immediately return the plant to the full control of the sovereign and competent authorities of Ukraine to ensure its safety and security and in order for the International Atomic Energy Agency to conduct safe, efficient and effective safeguards implementation in accordance with the comprehensive safeguards agreement and additional protocol of Ukraine, consistent with the repeated calls by the General Conference and the Board of Governors of the Agency;",
    "4": "Condemns the failure of the Russian Federation to implement relevant resolutions of the General Assembly and the General Conference and the Board of Governors of the International Atomic Energy Agency;",
    "5": "Calls for immediate cessation of the attacks by the Russian Federation against critical energy infrastructure of Ukraine, which increase the risk of a nuclear accident or incident at all nuclear facilities of Ukraine;",
    "6": "Welcomes and encourages the continued efforts of the Director General of the International Atomic Energy Agency to address the risks to nuclear safety and security, as well as to safeguards implementation at the Zaporizhzhia nuclear power plant, caused by the aggression by the Russian Federation against Ukraine, including through the continued and reinforced physical presence of the International Atomic Energy Agency Support and Assistance Mission to Zaporizhzhia;",
    "7": "Calls upon the Russian Federation, until it returns the Zaporizhzhia nuclear power plant of Ukraine to the full control of the sovereign and competent authorities of Ukraine, to provide the International Atomic Energy Agency Support and Assistance Mission to Zaporizhzhia with timely and full access to all areas at the plant that are important for nuclear safety and security in order to allow the Agency to report fully on the nuclear safety and security situation at the site;",
    "8": "Calls upon all parties to the armed conflict to respect international humanitarian law in all circumstances;",
    "9": "Also calls upon all parties to the armed conflict to implement fully the \u201cseven indispensable pillars for ensuring nuclear safety and security during an armed conflict\u201d and the five concrete principles of the Director General of the International Atomic Energy Agency to help to ensure nuclear safety and security at the Zaporizhzhia nuclear power plant;",
    "10": "",
    "11": "Calls upon Member States to continue to support the efforts of the Director General of the International Atomic Energy Agency to uphold nuclear safety, security and safeguards implementation at all nuclear facilities in Ukraine;",
    "12": "Requests the Secretary-General to provide his good offices in close cooperation with the Director General of the International Atomic Energy Agency;",
    "13": "Decides to continue its consideration of the matter at its seventy-ninth session under the agenda item entitled \u201cThe situation in the temporarily occupied territories of Ukraine\u201d."
  },
  "agenda_items": [
    "Item 62"
  ],
  "symbol_references": [
    "A/78/L.90"
  ]
}