{
  "symbol": "A/RES/79/311",
  "filename": "A_RES_79_311.pdf",
  "title": "79/311. Financing of the African Union-United Nations Hybrid Operation in Darfur",
  "text": "United Nations \nA/RES/79/311\n \n \nGeneral Assembly \nDistr.: General \n1 July 2025 \n \n25-10821 (E) \n*2510821* \n \n \nSeventy-ninth session \nAgenda item 166 \nFinancing of the African Union-United Nations Hybrid \nOperation in Darfur \n \n \n \n \n Resolution adopted by the General Assembly \non 30 June 2025 \n \n \n \n \n[on the report of the Fifth Committee (A/79/936, para. 6)] \n \n \n \n79/311. Financing of the African Union-United Nations Hybrid Operation \nin Darfur \n \n \n \nThe General Assembly, \n \nHaving considered the report of the Secretary-General on the final performance \nof the African Union-United Nations Hybrid Operation in Darfur 1 and the related \nreport of the Advisory Committee on Administrative and Budgetary Questions, 2  \n \n1. \nTakes note of the status of contributions to the African Union-United \nNations Hybrid Operation in Darfur as at 30 April 2025, including the contributions \noutstanding in the amount of 101.1 million United States dollars, representing some \n0.6 per cent of the total assessed contributions, notes with concern that only 162 \nMember States have paid their assessed contributions in full, and urges all other \nMember States, in particular those in arrears, to ensure payment of their outstanding \nassessed contributions; \n \n2. \nEndorses the conclusions and recommendations contained in the report of \nthe Advisory Committee on Administrative and Budgetary Questions, and requests \nthe Secretary-General to ensure their full implementation;  \n \n3. \nTakes note of the report of the Secretary-General on the final performance \nof the African Union-United Nations Hybrid Operation in Darfur;  \n \n4. \nAlso takes note of the net cash shortfall in the special account for the \nAfrican Union-United Nations Hybrid Operation in Darfur in the amount of 3,428,000 \ndollars as at 30 April 2025, and decides that the fund balance shall be earmarked as \n__________________ \n \n1  A/79/621. \n \n2  A/79/824. \n\nA/RES/79/311 \nFinancing of the African Union-United Nations Hybrid Operation \nin Darfur\n \n25-10821\n2/2 \n \ncredits to Member States, based on the scale applicable to the last assessment, but not \nreturned owing to the current cash shortfall in the Operation; \n \n5. \nUrges all Member States to make every possible effort to ensure payment \nof their assessed contributions in full;  \n \n6. \nDecides that updated information on the financial position of the African \nUnion-United Nations Hybrid Operation in Darfur shall be included in the report on \nthe updated position of closed peacekeeping missions, to be considered by the General \nAssembly at its eightieth session under the agenda item entitled \u201cAdministrative and \nbudgetary aspects of the financing of the United Nations peacekeeping operations\u201d; \n \n7. \nAlso decides to delete from its agenda the item entitled \u201cFinancing of the \nAfrican Union-United Nations Hybrid Operation in Darfur\u201d. \n \n81st plenary meeting \n30 June 2025 \n \n",
  "paragraphs": {
    "1": "Takes note of the status of contributions to the African Union-United Nations Hybrid Operation in Darfur as at 30 April 2025, including the contributions outstanding in the amount of 101.1 million United States dollars, representing some 0.6 per cent of the total assessed contributions, notes with concern that only 162 Member States have paid their assessed contributions in full, and urges all other Member States, in particular those in arrears, to ensure payment of their outstanding assessed contributions;",
    "2": "Endorses the conclusions and recommendations contained in the report of the Advisory Committee on Administrative and Budgetary Questions, and requests the Secretary-General to ensure their full implementation;",
    "3": "Takes note of the report of the Secretary-General on the final performance of the African Union-United Nations Hybrid Operation in Darfur;",
    "4": "Also takes note of the net cash shortfall in the special account for the African Union-United Nations Hybrid Operation in Darfur in the amount of 3,428,000 dollars as at 30 April 2025, and decides that the fund balance shall be earmarked as credits to Member States, based on the scale applicable to the last assessment, but not returned owing to the current cash shortfall in the Operation;",
    "5": "Urges all Member States to make every possible effort to ensure payment of their assessed contributions in full;",
    "6": "Decides that updated information on the financial position of the African Union-United Nations Hybrid Operation in Darfur shall be included in the report on the updated position of closed peacekeeping missions, to be considered by the General Assembly at its eightieth session under the agenda item entitled \u201cAdministrative and budgetary aspects of the financing of the United Nations peacekeeping operations\u201d;",
    "7": "Also decides to delete from its agenda the item entitled \u201cFinancing of the African Union-United Nations Hybrid Operation in Darfur\u201d."
  },
  "agenda_items": [
    "Item 166"
  ],
  "symbol_references": []
}