{
  "symbol": "A/RES/76/165",
  "filename": "A_RES_76_165.pdf",
  "title": "76/165. Promotion of a democratic and equitable international order",
  "text": "United Nations \nA/RES/76/165\n \n \nGeneral Assembly \nDistr.: General \n7 January 2022 \n \n21-19229 (E)    140122 \n*2119229* \n \n \nSeventy-sixth session \nAgenda item 74 (b) \nPromotion and protection of human rights: human \nrights questions, including alternative approaches for \nimproving the effective enjoyment of human rights and \nfundamental freedoms \n \n \n \n \n Resolution adopted by the General Assembly \non 16 December 2021 \n \n \n \n \n[on the report of the Third Committee (A/76/462/Add.2, para. 114)] \n \n \n 76/165. Promotion of a democratic and equitable international order \n \n \n \nThe General Assembly, \n \nRecalling its previous resolutions on the promotion of a democratic and \nequitable international order, including resolution 75/178 of 16 December 2020, and \nHuman Rights Council resolutions 18/6 of 29 September 2011,1 33/3 of 29 September \n2016,2 36/4 of 28 September 2017,3 39/4 of 27 September 2018,4 42/8 of \n26 September 2019,5 45/4 of 6 October 20206 and 48/8 of 8 October 2021, \n \nReaffirming the commitment of all States to fulfil their obligations to promote \nuniversal respect for, and observance and protection of, all human rights and \nfundamental freedoms for all, in accordance with the Charter of the United Nations, \nother instruments relating to human rights and international law, \n \nAffirming that the enhancement of international cooperation for the promotion \nand protection of all human rights for all should continue to be carried out in full \nconformity with the purposes and principles of the Charter and international law, as \nset forth in Articles 1 and 2 of the Charter, and with full respect for, inter alia, \nsovereignty, territorial integrity, political independence, the non-use of force or the \n__________________ \n \n1 See Official Records of the General Assembly, Sixty-sixth Session, Supplement No. 53A and \ncorrigendum (A/66/53/Add.1 and A/66/53/Add.1/Corr.1), chap. II. \n \n2 Ibid., Seventy-first Session, Supplement No. 53A and corrigendum (A/71/53/Add.1 and \nA/71/53/Add.1/Corr.1), chap. II. \n \n3 Ibid., Seventy-second Session, Supplement No. 53A (A/72/53/Add.1), chap. III. \n \n4 Ibid., Seventy-third Session, Supplement No. 53A (A/73/53/Add.1), chap. III. \n \n5 Ibid., Seventy-fourth Session, Supplement No. 53A (A/74/53/Add.1), chap. III. \n \n6 Ibid., Seventy-fifth Session, Supplement No. 53A (A/75/53/Add.1), chap. III. \n\nA/RES/76/165 \nPromotion of a democratic and equitable international order\n \n21-19229\n2/7 \n \nthreat of force in international relations and non-intervention in matters that are \nessentially within the domestic jurisdiction of any State, \n \nRecalling the Preamble to the Charter, in particular the determination to reaffirm \nfaith in fundamental human rights, in the dignity and worth of the human person and \nin the equal rights of men and women and of nations large and small, \n \nReaffirming that everyone is entitled to a social and international order in which \nthe rights and freedoms set forth in the Universal Declaration of Human Rights7 can \nbe fully realized, \n \nReaffirming also the determination expressed in the Preamble to the Charter to \nsave succeeding generations from the scourge of war, to establish conditions under \nwhich justice and respect for the obligations arising from treaties and other sources \nof international law can be maintained, to promote social progress and better \nstandards of life in larger freedom, to practise tolerance and good-neighbourliness \nand to employ international machinery for the promotion of the economic and social \nadvancement of all peoples, \n \nStressing that the responsibility for managing worldwide economic and social \nissues, including pandemics and other health-related global challenges, as well as \nthreats to international peace and security, must be shared among the nations of the \nworld and should be exercised multilaterally, and that in this regard the central role \nmust be played by the United Nations, as the most universal and representative \norganization in the world, \n \nConcerned about the continued abuse by Member States of the extraterritorial \napplication of their national legislation in a manner that affects the sovereignty of \nother States, the legitimate interests of entities or persons under their jurisdiction and \nthe full enjoyment of human rights, \n \nConsidering the major changes taking place on the international scene and the \naspirations of all peoples for an international order based on the principles enshrined \nin the Charter, including promoting and encouraging respect for human rights and \nfundamental freedoms for all and respect for the principle of equal rights and \nself-determination of peoples, peace, democracy, justice, equality, the rule of law, \npluralism, development, better standards of living and solidarity, \n \nRecognizing that the enhancement of international cooperation in the field of \nhuman rights is essential for the full achievement of the purposes of the United \nNations, including the effective promotion and protection of all human rights for all, \n \nConsidering that the Universal Declaration of Human Rights proclaims that all \nhuman beings are born free and equal in dignity and rights and that everyone is \nentitled to all the rights and freedoms set out therein, without distinction of any kind, \nsuch as race, colour, sex, language, religion, political or other opinion, national or \nsocial origin, property, birth or other status, \n \nReaffirming that democracy, development and respect for human rights and \nfundamental freedoms are interdependent and mutually reinforcing and that \ndemocracy is based on the freely expressed will of the people to determine their own \npolitical, economic, social and cultural systems and their full participation in all \naspects of their lives, \n \nRecognizing that the promotion and protection of human rights should be based \non the principle of cooperation and genuine dialogue and aimed at strengthening the \n__________________ \n \n7 Resolution 217 A (III). \n\nPromotion of a democratic and equitable international order \nA/RES/76/165\n \n3/7\n21-19229 \n \ncapacity of Member States to comply with their human rights obligations for the \nbenefit of all human beings, \n \nEmphasizing that democracy is not only a political concept, but that it also has \neconomic and social dimensions, \n \nRecognizing that democracy, respect for all human rights, including the right to \ndevelopment, transparent and accountable governance and administration in all \nsectors of society and effective participation by civil society are an essential part of \nthe necessary foundations for the realization of social and people-centred sustainable \ndevelopment, \n \nNoting with concern that racism, racial discrimination, xenophobia and related \nintolerance may be aggravated by, inter alia, inequitable distribution of wealth, \nmarginalization and social exclusion, \n \nReaffirming that dialogue among religions, cultures and civilizations could \ncontribute greatly to the enhancement of international cooperation at all levels, \n \nUnderlining the fact that it is imperative for the international community to \nensure that globalization becomes a positive force for all the world\u2019s people and that \nonly through broad and sustained efforts, based on our common humanity in all its \ndiversity, can globalization be made fully inclusive and equitable, \n \nDeeply concerned that the current global economic, financial, energy and food \ncrises, resulting from a combination of several major factors, including \nmacroeconomic and other factors, such as environmental degradation, desertification \nand global climate change, natural disasters and the lack of financial resources and \nthe technology necessary to confront their negative impact in developing countries, \nparticularly in the least developed countries and small island developing States, \nrepresent a global scenario that is threatening the adequate enjoyment of all human \nrights and widening the gap between developed and developing countries, \n \nRecognizing that the coronavirus disease (COVID-19) pandemic is one of the \ngreatest global challenges in the history of the United Nations, and noting with deep \nconcern its impact on health and the loss of life, mental health and well-being, as well \nas the negative impact on global humanitarian needs, the enjoyment of human rights \nand across all spheres of society, including on livelihoods, food security and nutrition, \nand education, the exacerbation of poverty and hunger, disruption to economies, \ntrade, societies and environments, and the exacerbation of economic and social \ninequalities within and among countries, which is reversing hard-won development \ngains and hampering progress towards achieving the 2030 Agenda for Sustainable \nDevelopment8 and all its Goals and targets, \n \nReaffirming its commitment to international cooperation and multilateralism and \nits strong support for the central role of the United Nations system, recognizing the \nkey leadership role of the World Health Organization in the global response to the \nCOVID-19 pandemic, and recognizing also that a democratic and equitable \ninternational order enhances the capacities of all countries to respond to and recover \nfrom the pandemic and other global challenges, \n \nRecognizing the role of extensive immunization against COVID-19 as a global \npublic good for health in preventing, containing and stopping transmission in order \nto bring the pandemic to an end, through global access to vaccines that are safe, of \nquality, efficacious, effective and affordable for all countries, \n \nDeeply concerned about the uneven access of developing countries to safe, \nquality, efficacious, effective and affordable vaccines against COVID-19, and \n__________________ \n \n8 Resolution 70/1. \n\nA/RES/76/165 \nPromotion of a democratic and equitable international order\n \n21-19229\n4/7 \n \nemphasizing that a multilateral approach, based on a democratic and equitable \ninternational order, enhances the capacities of all countries, in particular developing \ncountries, to have equal access to vaccines and other means to respond to and recover \nfrom the pandemic, \n \nRecognizing that a democratic and equitable order requires the reform of \ninternational financial institutions, in order to widen and strengthen the level of \nparticipation of developing countries in the international decision-making process, \nand a more transparent and open financial system, as well as adequate measures \nagainst illicit financial flows, such as tax fraud, tax evasion, illegal capital flight, \nmoney-laundering and the proceeds of corruption, and for improving tax transparency \nworldwide, \n \nStressing that efforts to make globalization fully inclusive and equitable must \ninclude policies and measures at the global level that correspond to the needs of \ndeveloping countries and countries with economies in transition and are formulated \nand implemented with their effective participation, \n \nStressing also the need for adequate financing of, technology transfer to and \ncapacity-building in developing countries, in particular the least developed countries, \nlandlocked developing countries and small island developing States, including to \nsupport their efforts to adapt to climate change, \n \nHaving listened to the peoples of the world, and recognizing their aspirations to \njustice, to equality of opportunity for all, to the enjoyment of their human rights, \nincluding the right to development, to live in peace and freedom and to equal \nparticipation without discrimination in economic, social, cultural, civil and political \nlife, \n \nRecalling Human Rights Council resolutions 5/1 on institution-building of the \nCouncil and 5/2 on the Code of Conduct for Special Procedures Mandate Holders of \nthe Council of 18 June 2007,9 and stressing that all mandate holders shall discharge \ntheir duties in accordance with those resolutions and the annexes thereto, \n \nEmphasizing the importance of the 2030 Agenda for the promotion of a \ndemocratic and equitable international order, \n \nResolved to take all measures within its power to secure a democratic and \nequitable international order, \n \n1. \nAffirms that everyone is entitled to a democratic and equitable \ninternational order; \n \n2. \nAlso affirms that a democratic and equitable international order fosters the \nfull realization of all human rights for all; \n \n3. \nTakes note of the report of the Independent Expert of the Human Rights \nCouncil on the promotion of a democratic and equitable international order; 10 \n \n4. \nCalls upon all Member States to fulfil their commitment expressed in \nDurban, South Africa, during the World Conference against Racism, Racial \nDiscrimination, Xenophobia and Related Intolerance, to maximize the benefits of \nglobalization through, inter alia, the strengthening and enhancement of international \ncooperation to increase equality of opportunities for trade, economic growth and \nsustainable development, global communications through the use of new technologies \nand increased intercultural exchange through the preservation and promotion of \n__________________ \n \n9 See Official Records of the General Assembly, Sixty-second Session, Supplement No. 53 \n(A/62/53), chap. IV, sect. A. \n \n10 A/HRC/48/58. \n\nPromotion of a democratic and equitable international order \nA/RES/76/165\n \n5/7\n21-19229 \n \ncultural diversity,11 and reiterates that only through broad and sustained efforts to \ncreate a shared future based upon our common humanity and all its diversity can \nglobalization be made fully inclusive and equitable; \n \n5. \nReaffirms that democracy includes respect for all human rights and \nfundamental freedoms for all and is a universal value based on the freely expressed \nwill of people to determine their own political, economic, social and cultural systems \nand their full participation in all aspects of their lives, and re-emphasizes the need for \nuniversal adherence to and implementation of the rule of law at both the national and \ninternational levels; \n \n6. \nAffirms that a democratic and equitable international order requires, inter \nalia, the realization of the following: \n \n(a) \nThe right of all peoples to self-determination, by virtue of which they can \nfreely determine their political status and freely pursue their economic, social and \ncultural development; \n \n(b) \nThe right of peoples and nations to permanent sovereignty over their \nnatural wealth and resources; \n \n(c) \nThe right of every human person and all peoples to development; \n \n(d) \nThe right of all peoples to peace; \n \n(e) \nThe right to an international economic order based on equal participation \nin the decision-making process, interdependence, mutual interest, solidarity and \ncooperation among all States; \n \n(f) \nInternational solidarity, as a right of peoples and individuals; \n \n(g) \nThe promotion and consolidation of transparent, democratic, just and \naccountable international institutions in all areas of cooperation, in particular through \nthe implementation of the principle of full and equal participation in their respective \ndecision-making mechanisms; \n \n(h) \nThe right to equitable participation of all, without any discrimination, in \ndomestic and global decision-making; \n \n(i) \nThe principle of equitable regional and gender-balanced representation in \nthe composition of the staff of the United Nations system; \n \n(j) \nThe promotion of a free, just, effective and balanced international \ninformation and communications order based on international cooperation for the \nestablishment of a new equilibrium and greater reciprocity in the international flow \nof information, in particular correcting the inequalities in the flow of information to \nand from developing countries; \n \n(k) \nRespect for cultural diversity and the cultural rights of all, since this \nenhances cultural pluralism, contributes to a wider exchange of knowledge and \nunderstanding of cultural backgrounds, advances the application and enjoyment of \nuniversally accepted human rights across the world and fosters stable, friendly \nrelations among peoples and nations worldwide; \n \n(l) \nThe right of every person and all peoples to a healthy environment and to \nenhanced international cooperation that responds effectively to the needs for \nassistance of national efforts to adapt to climate change, particularly in developing \ncountries, and that promotes the fulfilment of international agreements in the field of \nmitigation; \n__________________ \n \n11 See A/CONF.189/12 and A/CONF.189/12/Corr.1, chap. I. \n\nA/RES/76/165 \nPromotion of a democratic and equitable international order\n \n21-19229\n6/7 \n \n \n(m) The promotion of equitable access to benefits from the international \ndistribution of wealth through enhanced international cooperation, in particular in \ninternational economic, commercial and financial relations; \n \n(n) \nThe enjoyment by everyone of ownership of the common heritage of \nhumankind in connection to the public right of access to culture; \n \n(o) \nThe shared responsibility of the nations of the world for managing \nworldwide economic and social development, including addressing pandemics and \nother health-related global challenges, as well as threats to international peace and \nsecurity, which should be exercised multilaterally; \n \n7. \nStresses the importance of preserving the rich and diverse nature of the \ninternational community of nations and peoples, as well as respect for national and \nregional particularities and various historical, cultural and religious backgrounds, in \nthe enhancement of international cooperation in the field of human rights; \n \n8. \nAlso stresses that all human rights are universal, indivisible, \ninterdependent and interrelated and that the international community must treat \nhuman rights globally in a fair and equal manner, on the same footing and with the \nsame emphasis, and reaffirms that, while the significance of national and regional \nparticularities and various historical, cultural and religious backgrounds must be \nborne in mind, it is the duty of States, regardless of their political, economic and \ncultural systems, to promote and protect all human rights and fundamental freedoms \nfor all; \n \n9. \nReaffirms, among other principles, the sovereign equality of States, \nnon-intervention and non-interference in internal affairs; \n \n10. Urges all actors on the international scene to build an international order \nbased on inclusion, social justice, equality and equity, human dignity, solidarity, \nmutual understanding and promotion of and respect for cultural diversity and \nuniversal human rights and to reject all doctrines of exclusion based on racism, racial \ndiscrimination, xenophobia and related intolerance; \n \n11. \nReaffirms that all States should promote the establishment, maintenance \nand strengthening of international peace and security and, to that end, should do their \nutmost to achieve general and complete disarmament under effective international \ncontrol, as well as to ensure that the resources released by effective disarmament \nmeasures are used for comprehensive development, in particular that of the \ndeveloping countries; \n \n12. Underlines that attempts to overthrow legitimate Governments by force \ndisrupt the democratic and constitutional order, the legitimate exercise of power and \nthe full enjoyment of human rights, and reaffirms that every State has an inalienable \nright to choose its political, economic, social and cultural system, without interference \nin any form by other States; \n \n13. Reaffirms the need to continue working urgently for the establishment of \na new international economic order based on equity, sovereign equality, \ninterdependence, common interest and cooperation among all States, irrespective of \ntheir economic and social systems, which shall correct inequalities and redress \nexisting injustices, make it possible to eliminate the widening gap between the \ndeveloped and the developing countries and ensure steadily accelerating economic \nand social development and peace and justice for present and future generations, in \naccordance with relevant previous General Assembly resolutions, programmes of \naction and major conferences and summits in the economic, social and related areas; \n \n14. Also reaffirms that the international community should devise ways and \nmeans to remove the current obstacles and meet the challenges to the full realization \n\nPromotion of a democratic and equitable international order \nA/RES/76/165\n \n7/7\n21-19229 \n \nof all human rights for all and to prevent the continuation of human rights violations \nresulting therefrom throughout the world; \n \n15. Urges States to continue their efforts, through enhanced international \ncooperation, towards the promotion of a democratic and equitable international order; \n \n16. Calls upon Member States to continue to support international cooperation \nand multilateral efforts, under the leadership of the United Nations system and in \nparticular the World Health Organization, and to work with all relevant actors to \nmobilize a coordinated global response to the COVID-19 pandemic and its adverse \nsocial, economic and financial impact on all societies that contributes to a more \ndemocratic and equitable international order; \n \n17. Affirms that a democratic and equitable international order, as prescribed \nin the Charter of the United Nations, cannot be achieved only through the deregulation \nof trade, markets and financial services; \n \n18. Requests \nthe \nSecretary-General \nand \nthe \nUnited \nNations \nHigh \nCommissioner for Human Rights to continue to provide all the human and financial \nresources necessary for the effective fulfilment of the mandate of the Independent \nExpert; \n \n19. Calls upon all Governments to cooperate with and assist the Independent \nExpert in his task, to supply all necessary information requested by him and to \nconsider responding favourably to the requests of the Independent Expert to visit their \ncountries to enable him to fulfil his mandate more effectively; \n \n20. Requests the Human Rights Council, the human rights treaty bodies, the \nOffice of the United Nations High Commissioner for Human Rights, the special \nmechanisms extended by the Council and the Human Rights Council Advisory \nCommittee to pay due attention, within their respective mandates, to the present \nresolution and to make contributions towards its implementation; \n \n21. Calls upon the Office of the High Commissioner to build upon the issue \nof the promotion of a democratic and equitable international order; \n \n22. Requests the Secretary-General to bring the present resolution to the \nattention of Member States, United Nations organs, bodies and components, \nintergovernmental organizations, in particular the Bretton Woods institutions, and \nnon-governmental organizations and to disseminate it on the widest possible basis; \n \n23. Requests the Independent Expert to submit to the General Assembly at its \nseventy-seventh session a report on the implementation of the present resolution, and \non the role of a democratic and equitable international order in contributing to the \nequal access of developing countries to safe, quality, efficacious, effective and \naffordable vaccines against COVID-19; \n \n24. Decides to continue consideration of the matter at its seventy-seventh \nsession under the item entitled \u201cPromotion and protection of human rights\u201d. \n \n53rd plenary meeting \n16 December 2021 \n \n \n",
  "paragraphs": {
    "1": "Affirms that everyone is entitled to a democratic and equitable international order;",
    "2": "Also affirms that a democratic and equitable international order fosters the full realization of all human rights for all;",
    "3": "Takes note of the report of the Independent Expert of the Human Rights Council on the promotion of a democratic and equitable international order; 10",
    "4": "Calls upon all Member States to fulfil their commitment expressed in Durban, South Africa, during the World Conference against Racism, Racial Discrimination, Xenophobia and Related Intolerance, to maximize the benefits of globalization through, inter alia, the strengthening and enhancement of international cooperation to increase equality of opportunities for trade, economic growth and sustainable development, global communications through the use of new technologies and increased intercultural exchange through the preservation and promotion of cultural diversity,11 and reiterates that only through broad and sustained efforts to create a shared future based upon our common humanity and all its diversity can globalization be made fully inclusive and equitable;",
    "5": "Reaffirms that democracy includes respect for all human rights and fundamental freedoms for all and is a universal value based on the freely expressed will of people to determine their own political, economic, social and cultural systems and their full participation in all aspects of their lives, and re-emphasizes the need for universal adherence to and implementation of the rule of law at both the national and international levels;",
    "6": "Affirms that a democratic and equitable international order requires, inter alia, the realization of the following: (a) The right of all peoples to self-determination, by virtue of which they can freely determine their political status and freely pursue their economic, social and cultural development; (b) The right of peoples and nations to permanent sovereignty over their natural wealth and resources; (c) The right of every human person and all peoples to development; (d) The right of all peoples to peace; (e) The right to an international economic order based on equal participation in the decision-making process, interdependence, mutual interest, solidarity and cooperation among all States; (f) International solidarity, as a right of peoples and individuals; (g) The promotion and consolidation of transparent, democratic, just and accountable international institutions in all areas of cooperation, in particular through the implementation of the principle of full and equal participation in their respective decision-making mechanisms; (h) The right to equitable participation of all, without any discrimination, in domestic and global decision-making; (i) The principle of equitable regional and gender-balanced representation in the composition of the staff of the United Nations system; (j) The promotion of a free, just, effective and balanced international information and communications order based on international cooperation for the establishment of a new equilibrium and greater reciprocity in the international flow of information, in particular correcting the inequalities in the flow of information to and from developing countries; (k) Respect for cultural diversity and the cultural rights of all, since this enhances cultural pluralism, contributes to a wider exchange of knowledge and understanding of cultural backgrounds, advances the application and enjoyment of universally accepted human rights across the world and fosters stable, friendly relations among peoples and nations worldwide; (l) The right of every person and all peoples to a healthy environment and to enhanced international cooperation that responds effectively to the needs for assistance of national efforts to adapt to climate change, particularly in developing countries, and that promotes the fulfilment of international agreements in the field of mitigation; (m) The promotion of equitable access to benefits from the international distribution of wealth through enhanced international cooperation, in particular in international economic, commercial and financial relations; (n) The enjoyment by everyone of ownership of the common heritage of humankind in connection to the public right of access to culture; (o) The shared responsibility of the nations of the world for managing worldwide economic and social development, including addressing pandemics and other health-related global challenges, as well as threats to international peace and security, which should be exercised multilaterally;",
    "7": "Stresses the importance of preserving the rich and diverse nature of the international community of nations and peoples, as well as respect for national and regional particularities and various historical, cultural and religious backgrounds, in the enhancement of international cooperation in the field of human rights;",
    "8": "Also stresses that all human rights are universal, indivisible, interdependent and interrelated and that the international community must treat human rights globally in a fair and equal manner, on the same footing and with the same emphasis, and reaffirms that, while the significance of national and regional particularities and various historical, cultural and religious backgrounds must be borne in mind, it is the duty of States, regardless of their political, economic and cultural systems, to promote and protect all human rights and fundamental freedoms for all;",
    "9": "Reaffirms, among other principles, the sovereign equality of States, non-intervention and non-interference in internal affairs;",
    "10": "Urges all actors on the international scene to build an international order based on inclusion, social justice, equality and equity, human dignity, solidarity, mutual understanding and promotion of and respect for cultural diversity and universal human rights and to reject all doctrines of exclusion based on racism, racial discrimination, xenophobia and related intolerance;",
    "11": "Reaffirms that all States should promote the establishment, maintenance and strengthening of international peace and security and, to that end, should do their utmost to achieve general and complete disarmament under effective international control, as well as to ensure that the resources released by effective disarmament measures are used for comprehensive development, in particular that of the developing countries;",
    "12": "Underlines that attempts to overthrow legitimate Governments by force disrupt the democratic and constitutional order, the legitimate exercise of power and the full enjoyment of human rights, and reaffirms that every State has an inalienable right to choose its political, economic, social and cultural system, without interference in any form by other States;",
    "13": "Reaffirms the need to continue working urgently for the establishment of a new international economic order based on equity, sovereign equality, interdependence, common interest and cooperation among all States, irrespective of their economic and social systems, which shall correct inequalities and redress existing injustices, make it possible to eliminate the widening gap between the developed and the developing countries and ensure steadily accelerating economic and social development and peace and justice for present and future generations, in accordance with relevant previous General Assembly resolutions, programmes of action and major conferences and summits in the economic, social and related areas;",
    "14": " of all human rights for all and to prevent the continuation of human rights violations resulting therefrom throughout the world;",
    "15": "Urges States to continue their efforts, through enhanced international cooperation, towards the promotion of a democratic and equitable international order;",
    "16": "Calls upon Member States to continue to support international cooperation and multilateral efforts, under the leadership of the United Nations system and in particular the World Health Organization, and to work with all relevant actors to mobilize a coordinated global response to the COVID-19 pandemic and its adverse social, economic and financial impact on all societies that contributes to a more democratic and equitable international order;",
    "17": "Affirms that a democratic and equitable international order, as prescribed in the Charter of the United Nations, cannot be achieved only through the deregulation of trade, markets and financial services;",
    "18": "Requests the Secretary-General and the United Nations High Commissioner for Human Rights to continue to provide all the human and financial resources necessary for the effective fulfilment of the mandate of the Independent Expert;",
    "19": "Calls upon all Governments to cooperate with and assist the Independent Expert in his task, to supply all necessary information requested by him and to consider responding favourably to the requests of the Independent Expert to visit their countries to enable him to fulfil his mandate more effectively;",
    "20": "Requests the Human Rights Council, the human rights treaty bodies, the Office of the United Nations High Commissioner for Human Rights, the special mechanisms extended by the Council and the Human Rights Council Advisory Committee to pay due attention, within their respective mandates, to the present resolution and to make contributions towards its implementation;",
    "21": "Calls upon the Office of the High Commissioner to build upon the issue of the promotion of a democratic and equitable international order;",
    "22": "Requests the Secretary-General to bring the present resolution to the attention of Member States, United Nations organs, bodies and components, intergovernmental organizations, in particular the Bretton Woods institutions, and non-governmental organizations and to disseminate it on the widest possible basis;",
    "23": "Requests the Independent Expert to submit to the General Assembly at its seventy-seventh session a report on the implementation of the present resolution, and on the role of a democratic and equitable international order in contributing to the equal access of developing countries to safe, quality, efficacious, effective and affordable vaccines against COVID-19;",
    "24": "Decides to continue consideration of the matter at its seventy-seventh session under the item entitled \u201cPromotion and protection of human rights\u201d."
  },
  "agenda_items": [
    "Item 74"
  ],
  "symbol_references": []
}