{
  "symbol": "A/RES/73/24",
  "filename": "A_RES_73_24.pdf",
  "title": "73/24. Sport as an enabler of sustainable development",
  "text": "United Nations \nA/RES/73/24\n \n \nGeneral Assembly \nDistr.: General \n6 December 2018 \n \n18-20837 (E)    101218  \n*1820837* \n \n \nSeventy-third session \nAgenda item 12 \n \n \n \n \n Resolution adopted by the General Assembly \non 3 December 2018 \n \n \n \n \n[without reference to a Main Committee (A/73/L.36 and A/73/L.36/Add.1)] \n \n \n \n73/24. Sport as an enabler of sustainable development \n \n \n \nThe General Assembly, \n \nRecalling its resolutions 58/5 of 3 November 2003 and 59/10 of 27 October \n2004, its decision to proclaim 2005 the International Year for Sport and Physical \nEducation to strengthen sport as a means to promote education, health, development \nand peace, and its resolutions 60/1 of 16 September 2005, 60/9 of 3 November 2005, \n61/10 of 3 November 2006, 62/271 of 23 July 2008, 63/135 of 11 December 2008, \n65/4 of 18 October 2010, 67/17 of 28 November 2012, 69/6 of 31 October 2014 and \n71/160 of 16 December 2016,  \n \nRecalling also its resolution 67/296 of 23 August 2013, in which it proclaimed \n6 April the International Day of Sport for Development and Peace, \n \nRecalling further its resolution 72/6 of 13 November 2017 on building a \npeaceful and better world through sport and the Olympic ideal, and all of its previous \nresolutions on this matter,  \n \nRecognizing the contribution of sport to the realization of the Millennium \nDevelopment Goals, as declared in its resolutions 60/1, and 65/1 of 22 September \n2010,  \n \nRecalling that, in the 2030 Agenda for Sustainable Development, 1 inter alia, \nsport is recognized as an important enabler for sustainable development,  \n \nAcknowledging the importance of holistic approaches to health and well-being \nthrough regular physical activity, including sport and recreation, to prevent and \ncontrol non-communicable diseases and promote healthy lifestyles, including through \nphysical education, as reflected in the political declaration of the third high-level \n__________________ \n \n1  Resolution 70/1. \n\nA/RES/73/24 \nSport as an enabler of sustainable development\n \n18-20837\n2/7 \n \nmeeting of the General Assembly on the prevention and control of non-communicable \ndiseases,2  \n \nRecognizing that sports, the arts and physical activity have the power to change \nperceptions, prejudices and behaviours, as well as to inspire people, break down racial \nand political barriers, combat discrimination and defuse conflict, as reflected in the \npolitical declaration adopted at the Nelson Mandela Peace Summit in 2018, 3  \n \nRecognizing also the benefits of sport for the health of older persons, as outlined \nin the Madrid International Plan of Action on Ageing, 2002,4  \n \nRecalling article 31 of the Convention on the Rights of the Child,5 outlining a \nchild\u2019s right to play and leisure, and the outcome document of the twenty-seventh \nspecial session of the General Assembly on children, entitled \u201cA world fit for \nchildren\u201d,6 stressing the promotion of physical, mental and emotional health through \nplay and sports,  \n \nRecalling also the political declaration7 and outcome8 adopted at the five-year \nreview of the Beijing Declaration and Platform for Action 9 and the commitments \nmade therein to ensure equal opportunities for women and girls in recreational and \nsports activities, as well as in participation in athletics and physical activities at the \nnational, regional and international levels, such as access, training, competition, \nremuneration and prizes,  \n \nRecalling further articles 1 and 30 of the Convention on the Rights of Persons \nwith Disabilities, 10  in which States parties recognized the right of persons with \ndisabilities to take part on an equal basis with others in cultural life, recreation, leisure \nand sport, and recognizing that the active involvement of persons with disabilities in \nsport contributes to the full and equal realization of their human rights, as well as \nrespect for their inherent dignity,  \n \nAcknowledging the revised International Charter of Physical Education, \nPhysical Activity and Sport, as proclaimed by the General Conference of the United \nNations Educational, Scientific and Cultural Organization at its thirty-eighth session, \nin November 2015,11 as well as the Declaration of Berlin and the Kazan Action Plan \nadopted at the fifth and sixth International Conferences of Ministers and Senior \nOfficials Responsible for Physical Education and Sport, held, respectively, in Berlin \nin May 2013 and in Kazan, Russian Federation, in July 2017,  \n \nRecognizing the important role played by the International Convention against \nDoping in Sport 12 in harmonizing the actions taken by Governments in the fight \nagainst doping in sport, which are complementary to those undertaken by the sporting \nmovement under the World Anti-Doping Code of the World Anti-Doping Agency,  \n__________________ \n \n2  Resolution 73/2. \n \n3  Resolution 73/1. \n \n4  Report of the Second World Assembly on Ageing, Madrid, 8\u201312 April 2002 (United Nations \npublication, Sales No. E.02.IV.4), chap. I, resolution 1, annex II. \n \n5  United Nations, Treaty Series, vol. 1577, No. 27531. \n \n6  Resolution S-27/2, annex. \n \n7  Resolution S-23/2, annex. \n \n8  Resolution S-23/3, annex. \n \n9  Report of the Fourth World Conference on Women, Beijing, 4\u201315 September 1995 (United \nNations publication, Sales No. E.96.IV.13), chap. I, resolution 1, annexes I and II. \n \n10  United Nations, Treaty Series, vol. 2515, No. 44910. \n \n11  United Nations Educational, Scientific and Cultural Organization, Records of the General \nConference, Thirty-eighth Session, Paris, 3\u201318 November 2015, vol. 1, Resolutions, sect. IV, \nresolution 43. \n \n12  United Nations, Treaty Series, vol. 2419, No. 43649. \n\nSport as an enabler of sustainable development \nA/RES/73/24\n \n3/7\n18-20837 \n \n \nAcknowledging the recommendations contained in the report of the Sport for \nDevelopment and Peace International Working Group entitled \u201cHarnessing the power \nof sport for development and peace: recommendations to Governments\u201d, and \nencouraging Member States to implement and further develop those recommendations,  \n \nRecognizing the need to strengthen and further coordinate efforts, including \nmulti-stakeholder partnerships, at all levels to maximize the potential of sport to \ncontribute to the achievement of the internationally agreed development goals, \nincluding the Goals and targets of the 2030 Agenda, and national peacebuilding and \nState-building priorities, \n \nAcknowledging the major role of the United Nations system and its country \nprogrammes as well as the role of Member States in promoting human development \nthrough sport and physical education, \n \nAcknowledging also the role of the United Nations Educational, Scientific and \nCultural Organization, the Intergovernmental Committee for Physical Education and \nSport and the International Conference of Ministers and Senior Officials Responsible \nfor Physical Education and Sport, including the declarations that it has adopted, in \npromoting the educational, cultural and social dimensions of sport and physical \neducation, including in the context of the 2030 Agenda, and in forging commitments \nand recommendations in this regard, \n \nRecalling the proclamation by the General Conference of the United Nations \nEducational, Scientific and Cultural Organization, at its thirty-eighth session, of \n20 September as the International Day of University Sport,  \n \nRecalling also the role of the United Nations Entity for Gender Equality and the \nEmpowerment of Women (UN-Women) and the opportunities that it provides within \nits mandate for the realization of gender equality and the empowerment of women \nand girls, including in and through sport, and welcoming the continued advancement \nof women and girls in sports and sporting activities, in particular the support for their \nprogressively higher participation in sport events, which provides opportunities for \neconomic development through sports,  \n \nAcknowledging the Olympic Charter, and that any form of discrimination is \nincompatible with belonging to the Olympic movement,  \n \nWelcoming the memorandum of understanding signed between the International \nOlympic Committee and the United Nations in April 2014, in which a call was made \nto strengthen efforts around sport-based initiatives that encourage social and \neconomic development, as well as to strengthen the many partnerships that United \nNations organizations have established with the Committee,  \n \nAffirming the invaluable contribution of the Olympic and Paralympic \nmovements in establishing sport as a unique means for the promotion of peace and \ndevelopment, in particular through the ideal of the Olympic Truce, acknowledging \nthe opportunities provided by past Olympic and Paralympic Games, including those \nheld in Pyeongchang, Republic of Korea, in 2018, as well as the Youth Olympic \nGames held in Buenos Aires in 2018, welcoming with appreciation all upcoming \nOlympic and Paralympic Games, in particular those to be held in Tokyo in 2020, in \nBeijing in 2022, in Paris in 2024 and in Los Angeles, United States of America, in \n2028, as well as the Youth Olympic Games to be held in Lausanne, Switzerland, in \n2020, and calling upon future hosts of such Games and other Member States to include \nsport, as appropriate, in conflict prevention activities and to ensure the effective \nimplementation of the Olympic Truce during the Games,  \n \nRecognizing the role that the Paralympic movement plays in showcasing the \nachievements of athletes with disabilities to a global audience and in acting as a \n\nA/RES/73/24 \nSport as an enabler of sustainable development\n \n18-20837\n4/7 \n \nprimary vehicle to promote positive perceptions and greater inclusion of persons with \ndisabilities in sport and society,  \n \nRecognizing also the importance of international, continental and regional sport \nevents, such as the World Artistic Gymnastics Championships, the Special Olympics \nWorld Games, the Deaflympics, the World Indigenous Games, the European Games, \nthe Games of La Francophonie, the Pan American Games and the Parapan American \nGames, the All Africa Games, the Asian Games, the Pacific Games, the Asian Indoor \nand Martial Arts Games, the World Nomad Games, the Commonwealth Games and \nthe Universiade, for promoting education, health, development, peace and solidarity \namong nations,  \n \nHighlighting the importance of continuing to reduce barriers to participation in \nsport events, particularly for participants from developing countries, \n \nRecognizing that major international sport events should be organized in the \nspirit of peace, mutual understanding, friendship, tolerance and inadmissibility of \ndiscrimination of any kind and that the unifying and conciliative nature of such events \nshould be respected,  \n \nReaffirming the importance of Member States, including those that will host \nsuch Games and other sporting events in the future, as well as relevant sport-related \norganizations, federations and associations, as appropriate, enhancing measures to \naddress the risks of corruption related to such events, and in this regard welcoming \nthe conference on safeguarding sport from corruption, held in Vienna in June 2018,  \n \nEmphasizing the critical role of productive public-private partnerships for \nfunding sport for development and peace programmes, institutional development and \nphysical and social infrastructures,  \n \n1. \nReaffirms that sport is an important enabler of sustainable development, \nand recognizes the growing contribution of sport to the realization of development \nand peace in its promotion of tolerance and respect and the contributions it makes to \nthe empowerment of women and of young people, individuals and communities as \nwell as to health, education and social inclusion objectives; \n \n2. \nTakes note with appreciation of the report of the Secretary-General entitled \n\u201cStrengthening the global framework for leveraging sport for development and \npeace\u201d, 13  reviewing progress towards the implementation of the United Nations \nAction Plan on Sport for Development and Peace and proposing an update to the \nAction Plan aimed at outlining a system-wide approach to leveraging sport for the \nimplementation of the 2030 Agenda for Sustainable Development1 and for the \nachievement of Sustainable Development Goals;  \n \n3. \nWelcomes the growing attention by the international community to \nexploring and leveraging the role of sport and physical activity in the attainment of \ndevelopment objectives and the enjoyment of human rights, and in this regard \nacknowledges the endorsement by the General Conference of the United Nations \nEducational, Scientific and Cultural Organization of the Kazan Action Plan and its \nsport policy follow-up framework, adopted at the sixth International Conference of \nMinisters and Senior Officials Responsible for Physical Education and Sport, as a \nvoluntary, overarching reference for fostering international convergence among \npolicymakers in the fields of physical education, physical activity and sports, as well \nas a potential tool for aligning international and national policy in these fields, 14 and \n__________________ \n \n13  A/73/325. \n \n14  See United Nations Educational, Scientific and Cultural Organization, Records of the General \nConference, Thirty-ninth Session, Paris, 30 October\u201314 November 2017, vol. 1, Resolutions, \nsect. IV, resolution 30. \n\nSport as an enabler of sustainable development \nA/RES/73/24\n \n5/7\n18-20837 \n \nthe endorsement by the World Health Assembly of the global action plan on physical \nactivity 2018\u20132030;15  \n \n4. \nEncourages Member States, the entities of the United Nations system, \nincluding its peacekeeping missions, special political missions and integrated \npeacebuilding missions, sport-related organizations, federations and associations, \nathletes, the media, civil society, academia and the private sector to draw on these \nframeworks, as appropriate, in a coherent and integrated manner, to advance the \nconsolidation of sport in cross-cutting development and peace strategies and the \nincorporation of sport and physical education in international, regional and national \ndevelopment and peace policies and programmes, on the basis of standards, indicators \nand benchmarks, as well as to ensure the monitoring and evaluation of such strategies, \npolicies and programmes;  \n \n5. \nUrges Member States that have not yet done so to consider signing, \nratifying, acceding to and implementing the Convention on the Rights of the Child 5 \nand the Optional Protocols thereto,16 the Convention on the Rights of Persons with \nDisabilities,10 the Convention on the Elimination of All Forms of Discrimination \nAgainst Women17 and the International Convention against Doping in Sport; 12 \n \n6. \nCalls upon the relevant entities of the United Nations system and other \ninternational and regional organizations, within their respective mandates and \nexisting resources, to strengthen and systemize inter-agency collaboration, in line \nwith the updated United Nations Action Plan on Sport for Development and Peace, to \nmaximize the potential of sport and physical activity to contribute to the achievement \nof the internationally agreed development goals, including the Goals and targets of \nthe 2030 Agenda, and national peacebuilding and State-building priorities;  \n \n7. \nEncourages Member States to effectively use all the opportunities offered \nby sport and by its values in the implementation of the 2030 Agenda and in order to \nimplement the Sustainable Development Goals;  \n \n8. \nEncourages the relevant stakeholders to emphasize and advance the use of \nsport as a vehicle to foster sustainable development and, inter alia, strengthen \neducation, including physical education, for children and young persons, including \npersons with disabilities, promote health, prevent disease, including non-communicable \ndiseases, and drug abuse, realize gender equality and the empowerment of women \nand girls, foster inclusion and well-being, promote healthy and active ageing, ensure \nthe participation of everyone without discrimination of any kind, promote tolerance, \nmutual understanding and respect and facilitate social inclusion, conflict prevention \nand peacebuilding;  \n \n9. \nEncourages Member States to provide institutional structures, appropriate \nquality standards, policies and competencies and promote academic research and \nexpertise in the field to enable ongoing training, capacity-building and education of \nphysical education teachers, coaches and community leaders in sport for development \nand peace programmes;  \n \n10. Invites Member States and international sport organizations to continue to \nassist developing countries, in particular the least developed countries, in their \ncapacity-building efforts in sport and physical education by providing national \nexperiences and best practices, as well as financial, technical and logistic resources \nfor the development of sport-based programmes;  \n__________________ \n \n15  See World Health Organization, document WHA71/2018/REC/1, resolution 71.6. \n \n16  United Nations, Treaty Series, vols. 2171 and 2173, No. 27531; and resolution 66/138, annex. \n \n17  United Nations, Treaty Series, vol. 1249, No. 20378. \n\nA/RES/73/24 \nSport as an enabler of sustainable development\n \n18-20837\n6/7 \n \n \n11. \nEncourages relevant stakeholders, and in particular the organizers of sport \nevents, to use and leverage such events to promote and support sport for development \nand peace initiatives and to strengthen existing and build new partnerships, coordinate \ncommon strategies, policies and programmes and increase coherence and synergies, \nwhile raising awareness at the local, national, regional and global levels;  \n \n12. Encourages Member States to adopt best practices and means to promote \nthe practice of sport and physical activities among all members of society, and in this \nregard welcomes initiatives to adopt dedicated education, health, youth and sport \ndays, including specialized sport days, at the national and local levels, as a means to \npromote physical and mental health and well-being and cultivate a sport culture in \nsociety;  \n \n13. Supports the independence and autonomy of sport as well as the mission \nof the International Olympic Committee in leading the Olympic movement and of the \nInternational Paralympic Committee in leading the Paralympic movement;  \n \n14. Notes the efforts undertaken by the Secretary-General, the President of the \nGeneral Assembly, Member States and civil society for the observance of the Olympic \nTruce, and encourages future hosts of the Olympic Games and the Paralympic Games \nand other Member States to support the effective implementation of the Truce; \n \n15. Encourages relevant entities involved in delivering mega sport events to \nrespect applicable laws and international principles, including the Guiding Principles \non Business and Human Rights: Implementing the United Nations \u201cProtect, Respect \nand Remedy\u201d Framework,18 noting other ongoing initiatives in this regard, at every \nstage of the event life cycle, to safeguard the many societal benefits that hosting such \nevents can contribute; \n \n16. Calls upon Member States to enhance their efforts to prevent and fight \ncorruption in sport and, in this regard, stresses the importance of robust legislative \nand law enforcement measures, and also calls upon Member States to improve \ncooperation and the coordination and exchange of information in accordance with the \nfundamental principles of their legal systems; \n \n17. Encourages Member States, in particular those committed to promoting \nsport as a tool for development and peace, and other stakeholders, such as \ninternational sports federations, organizers of sport events, sports clubs and leagues, \nfoundations and the private sector, especially businesses involved in the sports and \ndevelopment sector, to continue and intensify their support for the work of the United \nNations system on sport for development and peace, including through voluntary \ncontributions and the establishment of innovative partnerships to advance policy and \nprogramme development in the field of sport for development and peace; \n \n18. Also encourages Member States to actively participate in the Group of \nFriends of Sport for Development and Peace, an informal group of permanent \nmissions to the United Nations in New York and Geneva serving as a platform to \npromote dialogue and exchange of views and information, including on ongoing \ninitiatives, programmes and partnerships, between Member States and all relevant \nstakeholders, as well as to facilitate and encourage the integration of sport to support \nthe achievement of the United Nations goals and objectives;  \n \n19. Further encourages Member States, with the support of the United Nations \nsystem, within existing resources, and other relevant stakeholders, to explore ways \nand means to integrate sport into various development objectives in the review and \nfollow-up processes of relevant development frameworks and agendas, including the \nfollow-up to the World Summit for Social Development, the Beijing Declaration and \n__________________ \n \n18  A/HRC/17/31, annex. \n\nSport as an enabler of sustainable development \nA/RES/73/24\n \n7/7\n18-20837 \n \nPlatform for Action,9 the reviews of the implementation of the Convention on the \nRights of Persons with Disabilities and of the achievement of the ends of the United \nNations Declaration on the Rights of Indigenous Peoples,19 the follow-up to the World \nProgramme of Action for Youth,20 the follow-up processes of Agenda 2063 of the \nAfrican Union and the review and follow-up processes of the 2030 Agenda, including \nthe high-level political forum on sustainable development and the political \ndeclaration of the third high-level meeting of the General Assembly on the prevention \nand control of non-communicable diseases;2  \n \n20. Requests the Secretary-General to report to the General Assembly at its \nseventy-fifth session on the implementation of the present resolution, including by \nproviding a targeted review of the contribution of sport to the implementation of the \n2030 Agenda, with particular attention to the annual high-level political forum on \nsustainable development, when it convenes under the auspices of the Economic and \nSocial Council;  \n \n21. Decides to include in the provisional agenda of its seventy-fifth session \nthe item entitled \u201cSport for development and peace\u201d. \n \n44th plenary meeting  \n3 December 2018 \n \n__________________ \n \n19  Resolution 61/295, annex. \n \n20  Resolution 50/81, annex, and resolution 62/126, annex. \n",
  "paragraphs": {
    "1": "Reaffirms that sport is an important enabler of sustainable development, and recognizes the growing contribution of sport to the realization of development and peace in its promotion of tolerance and respect and the contributions it makes to the empowerment of women and of young people, individuals and communities as well as to health, education and social inclusion objectives;",
    "2": "Takes note with appreciation of the report of the Secretary-General entitled \u201cStrengthening the global framework for leveraging sport for development and peace\u201d, 13 reviewing progress towards the implementation of the United Nations Action Plan on Sport for Development and Peace and proposing an update to the Action Plan aimed at outlining a system-wide approach to leveraging sport for the implementation of the 2030 Agenda for Sustainable Development1 and for the achievement of Sustainable Development Goals;",
    "3": "Welcomes the growing attention by the international community to exploring and leveraging the role of sport and physical activity in the attainment of development objectives and the enjoyment of human rights, and in this regard acknowledges the endorsement by the General Conference of the United Nations Educational, Scientific and Cultural Organization of the Kazan Action Plan and its sport policy follow-up framework, adopted at the sixth International Conference of Ministers and Senior Officials Responsible for Physical Education and Sport, as a voluntary, overarching reference for fostering international convergence among policymakers in the fields of physical education, physical activity and sports, as well as a potential tool for aligning international and national policy in these fields, 14 and the endorsement by the World Health Assembly of the global action plan on physical activity 2018\u20132030;15",
    "4": "Encourages Member States, the entities of the United Nations system, including its peacekeeping missions, special political missions and integrated peacebuilding missions, sport-related organizations, federations and associations, athletes, the media, civil society, academia and the private sector to draw on these frameworks, as appropriate, in a coherent and integrated manner, to advance the consolidation of sport in cross-cutting development and peace strategies and the incorporation of sport and physical education in international, regional and national development and peace policies and programmes, on the basis of standards, indicators and benchmarks, as well as to ensure the monitoring and evaluation of such strategies, policies and programmes;",
    "5": "Urges Member States that have not yet done so to consider signing, ratifying, acceding to and implementing the Convention on the Rights of the Child 5 and the Optional Protocols thereto,16 the Convention on the Rights of Persons with Disabilities,10 the Convention on the Elimination of All Forms of Discrimination Against Women17 and the International Convention against Doping in Sport; 12",
    "6": "Calls upon the relevant entities of the United Nations system and other international and regional organizations, within their respective mandates and existing resources, to strengthen and systemize inter-agency collaboration, in line with the updated United Nations Action Plan on Sport for Development and Peace, to maximize the potential of sport and physical activity to contribute to the achievement of the internationally agreed development goals, including the Goals and targets of the 2030 Agenda, and national peacebuilding and State-building priorities;",
    "7": "Encourages Member States to effectively use all the opportunities offered by sport and by its values in the implementation of the 2030 Agenda and in order to implement the Sustainable Development Goals;",
    "8": "Encourages the relevant stakeholders to emphasize and advance the use of sport as a vehicle to foster sustainable development and, inter alia, strengthen education, including physical education, for children and young persons, including persons with disabilities, promote health, prevent disease, including non-communicable diseases, and drug abuse, realize gender equality and the empowerment of women and girls, foster inclusion and well-being, promote healthy and active ageing, ensure the participation of everyone without discrimination of any kind, promote tolerance, mutual understanding and respect and facilitate social inclusion, conflict prevention and peacebuilding;",
    "9": "Encourages Member States to provide institutional structures, appropriate quality standards, policies and competencies and promote academic research and expertise in the field to enable ongoing training, capacity-building and education of physical education teachers, coaches and community leaders in sport for development and peace programmes;",
    "10": "Invites Member States and international sport organizations to continue to assist developing countries, in particular the least developed countries, in their capacity-building efforts in sport and physical education by providing national experiences and best practices, as well as financial, technical and logistic resources for the development of sport-based programmes;",
    "11": "Encourages relevant stakeholders, and in particular the organizers of sport events, to use and leverage such events to promote and support sport for development and peace initiatives and to strengthen existing and build new partnerships, coordinate common strategies, policies and programmes and increase coherence and synergies, while raising awareness at the local, national, regional and global levels;",
    "12": "Encourages Member States to adopt best practices and means to promote the practice of sport and physical activities among all members of society, and in this regard welcomes initiatives to adopt dedicated education, health, youth and sport days, including specialized sport days, at the national and local levels, as a means to promote physical and mental health and well-being and cultivate a sport culture in society;",
    "13": "Supports the independence and autonomy of sport as well as the mission of the International Olympic Committee in leading the Olympic movement and of the International Paralympic Committee in leading the Paralympic movement;",
    "14": "Notes the efforts undertaken by the Secretary-General, the President of the General Assembly, Member States and civil society for the observance of the Olympic Truce, and encourages future hosts of the Olympic Games and the Paralympic Games and other Member States to support the effective implementation of the Truce;",
    "15": "Encourages relevant entities involved in delivering mega sport events to respect applicable laws and international principles, including the Guiding Principles on Business and Human Rights: Implementing the United Nations \u201cProtect, Respect and Remedy\u201d Framework,18 noting other ongoing initiatives in this regard, at every stage of the event life cycle, to safeguard the many societal benefits that hosting such events can contribute;",
    "16": "Calls upon Member States to enhance their efforts to prevent and fight corruption in sport and, in this regard, stresses the importance of robust legislative and law enforcement measures, and also calls upon Member States to improve cooperation and the coordination and exchange of information in accordance with the fundamental principles of their legal systems;",
    "17": "Encourages Member States, in particular those committed to promoting sport as a tool for development and peace, and other stakeholders, such as international sports federations, organizers of sport events, sports clubs and leagues, foundations and the private sector, especially businesses involved in the sports and development sector, to continue and intensify their support for the work of the United Nations system on sport for development and peace, including through voluntary contributions and the establishment of innovative partnerships to advance policy and programme development in the field of sport for development and peace;",
    "18": "Also encourages Member States to actively participate in the Group of Friends of Sport for Development and Peace, an informal group of permanent missions to the United Nations in New York and Geneva serving as a platform to promote dialogue and exchange of views and information, including on ongoing initiatives, programmes and partnerships, between Member States and all relevant stakeholders, as well as to facilitate and encourage the integration of sport to support the achievement of the United Nations goals and objectives;",
    "19": "Further encourages Member States, with the support of the United Nations system, within existing resources, and other relevant stakeholders, to explore ways and means to integrate sport into various development objectives in the review and follow-up processes of relevant development frameworks and agendas, including the follow-up to the World Summit for Social Development, the Beijing Declaration and Platform for Action,9 the reviews of the implementation of the Convention on the Rights of Persons with Disabilities and of the achievement of the ends of the United Nations Declaration on the Rights of Indigenous Peoples,19 the follow-up to the World Programme of Action for Youth,20 the follow-up processes of Agenda 2063 of the African Union and the review and follow-up processes of the 2030 Agenda, including the high-level political forum on sustainable development and the political declaration of the third high-level meeting of the General Assembly on the prevention and control of non-communicable diseases;2",
    "20": "Requests the Secretary-General to report to the General Assembly at its seventy-fifth session on the implementation of the present resolution, including by providing a targeted review of the contribution of sport to the implementation of the 2030 Agenda, with particular attention to the annual high-level political forum on sustainable development, when it convenes under the auspices of the Economic and Social Council;",
    "21": "Decides to include in the provisional agenda of its seventy-fifth session the item entitled \u201cSport for development and peace\u201d."
  },
  "agenda_items": [
    "Item 12"
  ],
  "symbol_references": [
    "A/73/L.36"
  ]
}