{
  "symbol": "A/RES/72/41",
  "filename": "A_RES_72_41.pdf",
  "title": "72/41. Reducing nuclear danger",
  "text": "United Nations \nA/RES/72/41\n \n \nGeneral Assembly \nDistr.: General \n12 December 2017 \n \n17-21718 (E)    141217 \n*1721718* \n \n \nSeventy-second session \nAgenda item 99 (o) \n \n \n \n \n Resolution adopted by the General Assembly \non 4 December 2017 \n \n \n \n \n[on the report of the First Committee (A/72/409)] \n \n \n \n72/41. Reducing nuclear danger \n \n \n \nThe General Assembly, \n \nBearing in mind that the use of nuclear weapons poses the most serious threat \nto mankind and to the survival of civilization, \n \nReaffirming that any use or threat of use of nuclear weapons would constitute \na violation of the Charter of the United Nations, \n \nConvinced that the proliferation of nuclear weapons in all its aspects would \nseriously enhance the danger of nuclear war, \n \nConvinced also that nuclear disarmament and the complete elimination of \nnuclear weapons are essential to remove the danger of nuclear war, \n \nConsidering that, until nuclear weapons cease to exist, it is imperative on the \npart of the nuclear-weapon States to adopt measures that assure non-nuclear-weapon \nStates against the use or threat of use of nuclear weapons, \n \nConsidering also that the hair-trigger alert of nuclear weapons carries \nunacceptable risks of unintentional or accidental use of nuclear weapons, which \nwould have catastrophic consequences for all mankind, \n \nEmphasizing the need to adopt measures to avoid accidental, unauthorized or \nunexplained incidents arising from computer anomalies or other technical \nmalfunctions, \n \nConscious that limited steps relating to de-alerting and de-targeting have been \ntaken by the nuclear-weapon States and that further practical, realistic and mutually \nreinforcing steps are necessary to contribute to the improvement in the international \nclimate for negotiations leading to the elimination of nuclear weapons, \n \nMindful that a diminishing role for nuclear weapons in the security policies of \nnuclear-weapon States would have a positive impact on international peace and \nsecurity and improve the conditions for the further reduction and the elimination of \nnuclear weapons, \n\nA/RES/72/41 \nReducing nuclear danger\n \n17-21718 \n2/2 \n \n \nReiterating the highest priority accorded to nuclear disarmament in the Final \nDocument of the Tenth Special Session of the General Assembly 1 and by the \ninternational community, \n \nRecalling the advisory opinion of the International Court of Justice on the \nlegality of the threat or use of nuclear weapons2 that there exists an obligation for \nall States to pursue in good faith and bring to a conclusion negotiations leading to \nnuclear disarmament in all its aspects under strict and effective international \ncontrol, \n \nRecalling also the call, in the United Nations Millennium Declaration, 3 to seek \nto eliminate the dangers posed by weapons of mass destruction and the resolve to \nstrive for the elimination of weapons of mass destruction, particularly nuclear \nweapons, including the possibility of convening an international conference to \nidentify ways of eliminating nuclear dangers, \n \n1. \nCalls for a review of nuclear doctrines and, in this context, immediate \nand urgent steps to reduce the risks of unintentional and accidental use of nuclear \nweapons, including through de-alerting and de-targeting nuclear weapons; \n \n2. \nRequests the five nuclear-weapon States to take measures towards the \nimplementation of paragraph 1 above; \n \n3. \nCalls upon Member States to take the measures necessary to prevent the \nproliferation of nuclear weapons in all its aspects and to promote nuclear \ndisarmament, with the objective of eliminating nuclear weapons; \n \n4. \nTakes note of the report of the Secretary-General submitted pursuant to \nparagraph 5 of its resolution 71/37 of 5 December 2016;4 \n \n5. \nRequests the Secretary-General to intensify efforts and support initiatives \nthat would contribute to the full implementation of the seven recommendations \nidentified in the report of the Advisory Board on Disarmament Matters that would \nsignificantly reduce the risk of nuclear war,5 and also to continue to encourage \nMember States to consider the convening of an international conference, as \nproposed in the United Nations Millennium Declaration, 3 to identify ways of \neliminating nuclear dangers, and to report thereon to the General Assembly at its \nseventy-third session; \n \n6. \nDecides to include in the provisional agenda of its seventy-third session, \nunder the item entitled \u201cGeneral and complete disarmament\u201d, the sub-item entitled \n\u201cReducing nuclear danger\u201d. \n \n62nd plenary meeting  \n4 December 2017 \n \n__________________ \n \n1  Resolution S-10/2. \n \n2  A/51/218, annex. \n \n3  Resolution 55/2. \n \n4  A/72/321. \n \n5  A/56/400, para. 3. \n",
  "paragraphs": {
    "1": "Calls for a review of nuclear doctrines and, in this context, immediate and urgent steps to reduce the risks of unintentional and accidental use of nuclear weapons, including through de-alerting and de-targeting nuclear weapons;",
    "2": "Requests the five nuclear-weapon States to take measures towards the implementation of paragraph 1 above;",
    "3": "Calls upon Member States to take the measures necessary to prevent the proliferation of nuclear weapons in all its aspects and to promote nuclear disarmament, with the objective of eliminating nuclear weapons;",
    "4": "Takes note of the report of the Secretary-General submitted pursuant to paragraph 5 of its resolution 71/37 of 5 December 2016;4",
    "5": "Requests the Secretary-General to intensify efforts and support initiatives that would contribute to the full implementation of the seven recommendations identified in the report of the Advisory Board on Disarmament Matters that would significantly reduce the risk of nuclear war,5 and also to continue to encourage Member States to consider the convening of an international conference, as proposed in the United Nations Millennium Declaration, 3 to identify ways of eliminating nuclear dangers, and to report thereon to the General Assembly at its seventy-third session;",
    "6": "Decides to include in the provisional agenda of its seventy-third session, under the item entitled \u201cGeneral and complete disarmament\u201d, the sub-item entitled \u201cReducing nuclear danger\u201d. 62nd plenary meeting 4 December 2017 __________________ 1 Resolution S-10/2. 2 A/51/218, annex. 3 Resolution 55/2. 4 A/72/321. 5 A/56/400, para. 3."
  },
  "agenda_items": [
    "Item 99"
  ],
  "symbol_references": []
}