{
  "symbol": "A/RES/78/276",
  "filename": "A_RES_78_276.pdf",
  "title": "78/276. Joint Inspection Unit",
  "text": "United Nations \nA/RES/78/276\n \n \nGeneral Assembly \nDistr.: General \n1 May 2024 \n \n24-07850 (E)    070524 \n*2407850* \n \n \nSeventy-eighth session \nAgenda item 141 \nJoint Inspection Unit \n \n \n \n \n Resolution adopted by the General Assembly \non 24 April 2024 \n \n \n \n \n[on the report of the Fifth Committee (A/78/826, para. 6)] \n \n \n 78/276. Joint Inspection Unit \n \n \n \nThe General Assembly, \n \nRecalling its previous resolutions on the Joint Inspection Unit, in particular \nresolutions 31/192 of 22 December 1976, 50/233 of 7 June 1996, 54/16 of 29 October \n1999, 56/245 of 24 December 2001, 57/284 A and B of 20 December 2002, 58/286 of \n8 April 2004, 59/267 of 23 December 2004, 60/258 of 8 May 2006, 61/238 of \n22 December 2006, 61/260 of 4 April 2007, 62/226 of 22 December 2007, 62/246 of \n3 April 2008, 63/272 of 7 April 2009, 64/262 of 29 March 2010, 65/270 of 4 April \n2011, 66/259 of 9 April 2012, 67/256 of 12 April 2013, 68/266 of 9 April 2014, 69/275 \nof 2 April 2015, 70/257 of 1 April 2016, 71/281 of 6 April 2017, 72/269 of 4 April \n2018, 73/287 of 15 April 2018, 75/270 of 16 April 2021, 76/261 of 13 April 2022 and \n77/279 of 18 April 2023,  \n \nReaffirming the statute of the Unit1 and the unique role of the Unit as the only \nexternal and independent system-wide inspection, evaluation and investigation body,  \n \nHaving considered the report of the Unit for 2023 and programme of work for \n20242 and the note by the Secretary-General on the report of the Unit for 2023,3  \n \n1. \nTakes note with appreciation of the report of the Joint Inspection Unit for \n2023 and programme of work for 2024;  \n \n2. \nTakes note of the note by the Secretary-General on the report of the Unit \nfor 2023;  \n \n3. \nStresses the importance of the oversight functions of the Unit in \nidentifying concrete managerial, administrative and programming questions within \nthe participating organizations and providing the General Assembly and other \nlegislative organs of participating organizations with practical and action-oriented \n__________________ \n \n1  Resolution 31/192, annex. \n \n2  Official Records of the General Assembly, Seventy-eighth Session, Supplement No. 34 (A/78/34). \n \n3  A/78/731. \n\nA/RES/78/276 \nJoint Inspection Unit\n \n24-07850\n2/3 \n \nrecommendations to improve and strengthen the governance of the United Nations as \na whole;  \n \n4. \nRecognizes that the effectiveness of the Unit system-wide is a shared \nresponsibility of the Unit, the Member States and the secretariats of the participating \norganizations;  \n \n5. \nAlso recognizes the need to continue to enhance the impact of the Unit on \nthe management efficiency and transparency of the participating organizations within \nthe United Nations system;  \n \n6. \nWelcomes the coordination of the Unit with the Board of Auditors and the \nOffice of Internal Oversight Services of the Secretariat, and encourages those bodies \nto continue to share experiences, knowledge, best practices and lessons learned with \nother United Nations audit and oversight bodies, as well as with the Independent \nAudit Advisory Committee, with a view to avoiding overlap or duplication and \nachieving further synergy, cooperation, effectiveness and efficiency, without \nprejudice to the respective mandates of the audit and oversight bodies; \n \n7. \nUnderscores the unique role of the Unit as an external and independent \nsystem-wide inspection, evaluation and investigation body, and stresses the important \ncontribution that its recommendations make towards improving the efficient and \neffective performance of the United Nations system;  \n \n8. \nReaffirms the independence of the Unit as set out in article 7 of its statute, \nand stresses that budget estimates are to be prepared in a transparent and consistent \nmanner for submission to the General Assembly in accordance with article 20 of the \nstatute of the Unit;  \n \n9. \nEncourages the Unit to continue to identify projects which support a more \neffective United Nations that is capable of providing relevant single and system-wide \nsolutions to current and future challenges, and underscores that all participating \norganizations should adhere to the commencement and review procedures outlined by \nthe Unit;  \n \n10. Reiterates its request to the executive heads of the participating \norganizations to fully comply with the statutory procedures for consideration of the \nreports of the Unit and, in particular, to submit their comments, including information \non what they intend to do regarding the recommendations of the Unit, to distribute \nreports in time for their consideration by legislative organs and to provide information \non the steps to be taken to implement those recommendations accepted by the \nlegislative organs and the executive heads of participating organizations;  \n \n11. Reiterates its request to the Secretary-General and the other executive \nheads of the participating organizations to fully assist the Unit with the timely \nprovision of all information requested by it;  \n \n12. Invites the legislative bodies of participating organizations to effectively \nand substantially use the reports of the Unit, and to give unselective and due \nconsideration to its recommendations, in accordance with article 11, paragraph 4, of \nthe statute of the Unit, and regularly review the status of acceptance and \nimplementation of the recommendations of the Unit in an effort to make best use of \nits recommendations;  \n \n13. Recalls paragraph 15 of its resolution 77/279 and notes with concern the \ncontinuation of significantly different rates of acceptance and implementation of \nrecommendations from the Unit by some participating United Nations system \norganizations, and therefore requests the Unit to continue to examine and improve the \nstatus quo without damaging the strength of recommendations;  \n\nJoint Inspection Unit \nA/RES/78/276\n \n3/3\n24-07850 \n \n \n14. Also recalls paragraph 16 of its resolution 77/279 and invites participating \norganizations within the United Nations system to regularly review the status of \nacceptance and implementation of the recommendations of the Unit, especially those \nrelated to system-wide coordination and coherence, and invites participating \norganizations to report non-acceptance and non-implementation to the Unit;  \n \n15. Further recalls paragraph 18 of its resolution 77/279 and reiterates its \nstrong encouragement to the Unit to strengthen the review of long-term effectiveness \nof its implemented recommendations, and looks forward to the update to the General \nAssembly thereon during the comprehensive midpoint assessment in 2024 and during \nits future comprehensive midpoint assessments; \n \n16. Recognizes the efforts made by the Unit to strengthen its outreach and \nimprove its communications products with a view to highlighting the work of the Unit \nand enhance its engagement with participating organizations and Member States, and \nencourages the Unit to continue such efforts; \n \n17. Invites the executive heads of participating United Nations system \norganizations to implement accepted recommendations of the Unit in a timely manner; \n \n18. Recalls paragraph 19 of its resolution 77/279, and looks forward to a \nfurther update on the implementation of the accepted recommendations from the \nUnit\u2019s self-assessment, including updates on the action plan, in the context of the next \nreport of the Unit. \n \n73rd plenary meeting \n24 April 2024 \n \n",
  "paragraphs": {
    "1": "Takes note with appreciation of the report of the Joint Inspection Unit for 2023 and programme of work for 2024;",
    "2": "Takes note of the note by the Secretary-General on the report of the Unit for 2023;",
    "3": "Stresses the importance of the oversight functions of the Unit in identifying concrete managerial, administrative and programming questions within the participating organizations and providing the General Assembly and other legislative organs of participating organizations with practical and action-oriented recommendations to improve and strengthen the governance of the United Nations as a whole;",
    "4": "Recognizes that the effectiveness of the Unit system-wide is a shared responsibility of the Unit, the Member States and the secretariats of the participating organizations;",
    "5": "Also recognizes the need to continue to enhance the impact of the Unit on the management efficiency and transparency of the participating organizations within the United Nations system;",
    "6": "Welcomes the coordination of the Unit with the Board of Auditors and the Office of Internal Oversight Services of the Secretariat, and encourages those bodies to continue to share experiences, knowledge, best practices and lessons learned with other United Nations audit and oversight bodies, as well as with the Independent Audit Advisory Committee, with a view to avoiding overlap or duplication and achieving further synergy, cooperation, effectiveness and efficiency, without prejudice to the respective mandates of the audit and oversight bodies;",
    "7": "Underscores the unique role of the Unit as an external and independent system-wide inspection, evaluation and investigation body, and stresses the important contribution that its recommendations make towards improving the efficient and effective performance of the United Nations system;",
    "8": "Reaffirms the independence of the Unit as set out in article 7 of its statute, and stresses that budget estimates are to be prepared in a transparent and consistent manner for submission to the General Assembly in accordance with article 20 of the statute of the Unit;",
    "9": "Encourages the Unit to continue to identify projects which support a more effective United Nations that is capable of providing relevant single and system-wide solutions to current and future challenges, and underscores that all participating organizations should adhere to the commencement and review procedures outlined by the Unit;",
    "10": "Reiterates its request to the executive heads of the participating organizations to fully comply with the statutory procedures for consideration of the reports of the Unit and, in particular, to submit their comments, including information on what they intend to do regarding the recommendations of the Unit, to distribute reports in time for their consideration by legislative organs and to provide information on the steps to be taken to implement those recommendations accepted by the legislative organs and the executive heads of participating organizations;",
    "11": "Reiterates its request to the Secretary-General and the other executive heads of the participating organizations to fully assist the Unit with the timely provision of all information requested by it;",
    "12": "Invites the legislative bodies of participating organizations to effectively and substantially use the reports of the Unit, and to give unselective and due consideration to its recommendations, in accordance with article 11, paragraph 4, of the statute of the Unit, and regularly review the status of acceptance and implementation of the recommendations of the Unit in an effort to make best use of its recommendations;",
    "13": "",
    "14": "Also recalls paragraph 16 of its resolution 77/279 and invites participating organizations within the United Nations system to regularly review the status of acceptance and implementation of the recommendations of the Unit, especially those related to system-wide coordination and coherence, and invites participating organizations to report non-acceptance and non-implementation to the Unit;",
    "15": "Further recalls paragraph 18 of its resolution 77/279 and reiterates its strong encouragement to the Unit to strengthen the review of long-term effectiveness of its implemented recommendations, and looks forward to the update to the General Assembly thereon during the comprehensive midpoint assessment in 2024 and during its future comprehensive midpoint assessments;",
    "16": "Recognizes the efforts made by the Unit to strengthen its outreach and improve its communications products with a view to highlighting the work of the Unit and enhance its engagement with participating organizations and Member States, and encourages the Unit to continue such efforts;",
    "17": "Invites the executive heads of participating United Nations system organizations to implement accepted recommendations of the Unit in a timely manner;",
    "18": "Recalls paragraph 19 of its resolution 77/279, and looks forward to a further update on the implementation of the accepted recommendations from the Unit\u2019s self-assessment, including updates on the action plan, in the context of the next report of the Unit."
  },
  "agenda_items": [
    "Item 141"
  ],
  "symbol_references": []
}