{
  "symbol": "A/RES/73/79",
  "filename": "A_RES_73_79.pdf",
  "title": "73/79.  United Nations Disarmament Information Programme",
  "text": "United Nations \nA/RES/73/79\n \n \nGeneral Assembly \nDistr.: General \n14 December 2018 \n \n18-21291 (E)    181218     \n*1821291* \n \n \nSeventy-third session \nAgenda item 102 (g) \n \n \n \n \n Resolution adopted by the General Assembly \non 5 December 2018 \n \n \n \n \n[on the report of the First Committee (A/73/511)] \n \n \n \n73/79.  United Nations Disarmament Information Programme \n \n \n \nThe General Assembly,  \n \nRecalling its decision taken in 1982 at its twelfth special session, the second \nspecial session devoted to disarmament, by which the World Disarmament Campaign \nwas launched,1  \n \nBearing in mind its resolution 47/53 D of 9 December 1992, in which it decided, \ninter alia, that the World Disarmament Campaign should be known thereafter as the \nUnited Nations Disarmament Information Programme and the World Disarmament \nCampaign voluntary trust fund as the voluntary trust fund for the United Nations \nDisarmament Information Programme,  \n \nRecalling its resolutions 51/46 A of 10 December 1996, 53/78 E of 4 December \n1998, 55/34 A of 20 November 2000, 57/90 of 22 November 2002, 59/103 of 3 December \n2004, 61/95 of 6 December 2006, 63/81 of 2 December 2008, 65/81 of 8 December 2010, \n67/67 of 3 December 2012, 69/71 of 2 December 2014 and 71/74 of 5 December 2016,  \n \nWelcoming the report of the Secretary-General,2  \n \n1. \nCommends the Secretary-General for his efforts to make effective use of \nthe limited resources available to him in disseminating, as widely as possible, \ninformation on arms control and disarmament to Governments, the media, \nnon-governmental organizations, educational communities and research institutes and \nin carrying out a seminar and conference programme;  \n \n2. \nStresses the importance of the United Nations Disarmament Information \nProgramme as a significant instrument in enabling all Member States to participate \nfully in the deliberations and negotiations on disarmament in the various United \n__________________ \n \n1  See Official Records of the General Assembly, Twelfth Special Session, Plenary Meetings, \n1st meeting, paras. 110\u2013111. \n \n2  A/73/120. \n\nA/RES/73/79 \nUnited Nations Disarmament Information Programme\n \n18-21291\n2/2 \n \nNations bodies, in assisting them in complying with treaties, as required, and in \ncontributing to agreed mechanisms for transparency;  \n \n3. \nCommends with satisfaction the launch of The United Nations \nDisarmament Yearbook for 2016 and 2017, as well as its online editions, by the Office \nfor Disarmament Affairs of the Secretariat;  \n \n4. \nNotes with appreciation the cooperation of the Department of Public \nInformation of the Secretariat and its information centres in pursuit of the objectives \nof the Programme;  \n \n5. \nRecommends that the Programme continue to inform, educate and generate \npublic understanding of the importance of multilateral action and support for it, \nincluding action by the United Nations and the Conference on Disarmament, in the \nfield of arms control and disarmament, in a factual, balanced and objective manner, \nand that it focus its efforts:  \n \n(a) \nTo continue to publish The United Nations Disarmament Yearbook, the \nflagship publication of the Office for Disarmament Affairs, in all official languages, \nas well as its Occasional Papers, Study Series and other ad hoc information materials \nin accordance with the current practice;  \n \n(b) \nTo continue to update the disarmament website as a part of the United \nNations website in as many official languages as feasible;  \n \n(c) \nTo promote the use of the Programme as a means to provide information \nrelated to progress in the implementation of nuclear disarmament measures;  \n \n(d) \nTo continue to intensify United Nations interaction with the public, \nprincipally non-governmental organizations and research institutes, to help to further \nan informed debate on topical issues of arms limitation, disarmament and security;  \n \n(e) \nTo continue to organize discussions on topics of interest in the field of arms \nlimitation and disarmament with a view to broadening understanding and facilitating an \nexchange of views and information among Member States and civil society;  \n \n6. \nRecognizes the importance of all support extended to the voluntary trust \nfund for the United Nations Disarmament Information Programme, and once again \ninvites all Member States to make further contributions to the fund with a view to \nsustaining a strong outreach programme;  \n \n7. \nTakes note of the recommendations contained in the report of the \nSecretary-General on disarmament and non-proliferation education,3 which reviews \nthe implementation of the recommendations made in the 2002 study on disarmament \nand non-proliferation education;4  \n \n8. \nRequests the Secretary-General to submit to the General Assembly at its \nseventy-fifth session a report covering both the implementation of the activities of \nthe Programme by the United Nations system during the previous two years and the \nactivities of the Programme contemplated by the system for the following two years; \n \n9. \nDecides to include in the provisional agenda of its seventy-fifth session, \nunder the item entitled \u201cReview and implementation of the Concluding Document of \nthe Twelfth Special Session of the General Assembly\u201d, the sub-item entitled \u201cUnited \nNations Disarmament Information Programme\u201d. \n45th plenary meeting  \n5 December 2018 \n \n__________________ \n \n3  A/73/119. \n \n4  A/57/124. \n",
  "paragraphs": {
    "1": "Commends the Secretary-General for his efforts to make effective use of the limited resources available to him in disseminating, as widely as possible, information on arms control and disarmament to Governments, the media, non-governmental organizations, educational communities and research institutes and in carrying out a seminar and conference programme;",
    "2": "Stresses the importance of the United Nations Disarmament Information Programme as a significant instrument in enabling all Member States to participate fully in the deliberations and negotiations on disarmament in the various United Nations bodies, in assisting them in complying with treaties, as required, and in contributing to agreed mechanisms for transparency;",
    "3": "Commends with satisfaction the launch of The United Nations Disarmament Yearbook for 2016 and 2017, as well as its online editions, by the Office for Disarmament Affairs of the Secretariat;",
    "4": "Notes with appreciation the cooperation of the Department of Public Information of the Secretariat and its information centres in pursuit of the objectives of the Programme;",
    "5": "Recommends that the Programme continue to inform, educate and generate public understanding of the importance of multilateral action and support for it, including action by the United Nations and the Conference on Disarmament, in the field of arms control and disarmament, in a factual, balanced and objective manner, and that it focus its efforts: (a) To continue to publish The United Nations Disarmament Yearbook, the flagship publication of the Office for Disarmament Affairs, in all official languages, as well as its Occasional Papers, Study Series and other ad hoc information materials in accordance with the current practice; (b) To continue to update the disarmament website as a part of the United Nations website in as many official languages as feasible; (c) To promote the use of the Programme as a means to provide information related to progress in the implementation of nuclear disarmament measures; (d) To continue to intensify United Nations interaction with the public, principally non-governmental organizations and research institutes, to help to further an informed debate on topical issues of arms limitation, disarmament and security; (e) To continue to organize discussions on topics of interest in the field of arms limitation and disarmament with a view to broadening understanding and facilitating an exchange of views and information among Member States and civil society;",
    "6": "Recognizes the importance of all support extended to the voluntary trust fund for the United Nations Disarmament Information Programme, and once again invites all Member States to make further contributions to the fund with a view to sustaining a strong outreach programme;",
    "7": "Takes note of the recommendations contained in the report of the Secretary-General on disarmament and non-proliferation education,3 which reviews the implementation of the recommendations made in the 2002 study on disarmament and non-proliferation education;4",
    "8": "Requests the Secretary-General to submit to the General Assembly at its seventy-fifth session a report covering both the implementation of the activities of the Programme by the United Nations system during the previous two years and the activities of the Programme contemplated by the system for the following two years;",
    "9": "Decides to include in the provisional agenda of its seventy-fifth session, under the item entitled \u201cReview and implementation of the Concluding Document of the Twelfth Special Session of the General Assembly\u201d, the sub-item entitled \u201cUnited Nations Disarmament Information Programme\u201d."
  },
  "agenda_items": [
    "Item 102"
  ],
  "symbol_references": []
}