{
  "symbol": "A/RES/79/137",
  "filename": "A_RES_79_137.pdf",
  "title": "79/137. World Meditation Day",
  "text": "United Nations \nA/RES/79/137\n \nGeneral Assembly \nDistr.: General \n12 December 2024 \n24-23455 (E) \n*2423455* \n \n \nSeventy-ninth session \nAgenda item 127 \nGlobal health and foreign policy \n \n \n \n \n Resolution adopted by the General Assembly \non 6 December 2024 \n \n \n[without reference to a Main Committee (A/79/L.27)] \n \n \n 79/137. World Meditation Day \n \n \n \nThe General Assembly, \n \nRecalling the right of everyone to the enjoyment of the highest attainable \nstandard of physical and mental health, \n \nReaffirming its resolution 70/1 of 25 September 2015, entitled \u201cTransforming \nour world: the 2030 Agenda for Sustainable Development\u201d, especially target 3.4 on \npromoting mental health and well-being, \n \nRecalling its resolutions 68/98 of 11 December 2013 on global health and \nforeign policy and 77/300 of 26 June 2023 on mental health and psychosocial support, \n \nRecalling also its resolutions 53/199 of 15 December 1998 and 61/185 of \n20 December 2006 on the proclamation of international years and Economic and \nSocial Council resolution 1980/67 of 25 July 1980 on international years and \nanniversaries, \n \nRecalling further its resolution 69/131 of 11 December 2014 on the International \nDay of Yoga, and acknowledging the link between yoga and meditation as \ncomplementary approaches to health and well-being,  \n \nReaffirming rule 62 of its rules of procedure on the invitation to silent prayer or \nmeditation, \n \nAffirming the importance, as a place for prayer and meditation, of the meditation \nroom at United Nations Headquarters in New York, \n \nAcknowledging the universality of meditation, practised in all regions of the \nworld, \n \nRecognizing that meditation can contribute to health and well-being, \n\nA/RES/79/137 \nWorld Meditation Day\n \n24-23455\n2/2 \n \n \nRecognizing also that the wider dissemination of information about the benefits \nof meditation would be beneficial for the health and well-being of people around the \nworld, \n \n1. \nDecides to proclaim 21 December as World Meditation Day;  \n \n2. \nInvites all Member and observer States, the organizations of the United \nNations system and other international and regional organizations, as well as civil \nsociety, including non\u2011governmental organizations and individuals, to observe World \nMeditation Day, in an appropriate manner, in order to raise awareness of the benefits \nof meditation;  \n \n3. \nStresses that the cost of all activities that may arise from the \nimplementation of the present resolution should be met from voluntary contributions;  \n \n4. \nRequests the Secretary-General to bring the present resolution to the \nattention of all Member and observer States, the organizations of the United Nations \nsystem and other relevant stakeholders for appropriate observance. \n \n48th plenary meeting \n6 December 2024 \n \n",
  "paragraphs": {
    "1": "Decides to proclaim 21 December as World Meditation Day;",
    "2": "Invites all Member and observer States, the organizations of the United Nations system and other international and regional organizations, as well as civil society, including non\u2011governmental organizations and individuals, to observe World Meditation Day, in an appropriate manner, in order to raise awareness of the benefits of meditation;",
    "3": "Stresses that the cost of all activities that may arise from the implementation of the present resolution should be met from voluntary contributions;",
    "4": "Requests the Secretary-General to bring the present resolution to the attention of all Member and observer States, the organizations of the United Nations system and other relevant stakeholders for appropriate observance. 48th plenary meeting 6 December 2024"
  },
  "agenda_items": [
    "Item 127"
  ],
  "symbol_references": [
    "A/79/L.27"
  ]
}