{
  "symbol": "A/RES/80/225",
  "filename": "A_RES_80_225.pdf",
  "title": "80/225. Follow-up to the Fourteenth United Nations Congress on Crime Prevention and Criminal Justice and preparations for the Fifteenth United Nations Congress on Crime Prevention and Criminal Justice",
  "text": "United Nations \nA/RES/80/225\n \nGeneral Assembly \nDistr.: General \n22 December 2025 \n25-20991 (E) \n*2520991* \n \n \nEightieth session \nAgenda item 107 \nCrime prevention and criminal justice \n \n \n \n \n Resolution adopted by the General Assembly \non 18 December 2025 \n \n \n[on the report of the Third Committee (A/80/545, para. 5)] \n \n \n 80/225. Follow-up to the Fourteenth United Nations Congress on Crime \nPrevention and Criminal Justice and preparations for the \nFifteenth United Nations Congress on Crime Prevention and \nCriminal Justice \n \n \n \nThe General Assembly, \n \nEmphasizing the responsibility assumed by the United Nations in the field of \ncrime prevention and criminal justice in pursuance of Economic and Social Council \nresolution 155 C (VII) of 13 August 1948 and General Assembly resolution 415 (V) \nof 1 December 1950,  \n \nAcknowledging that the United Nations congresses on crime prevention and \ncriminal justice, as major intergovernmental forums, have influenced national policies \nand practices and promoted international cooperation in that field by facilitating the \nexchange of views and experience, mobilizing public opinion and recommending \npolicy options at the national, regional and international levels,  \n \nRecalling its resolution 46/152 of 18 December 1991, in the annex to which \nMember States affirmed that the United Nations congresses on crime prevention and \ncriminal justice should be held every five years and should provide a forum for, inter \nalia, the exchange of views between States, intergovernmental and non\u2011governmental \norganizations and individual experts representing various professions and disciplines, \nthe exchange of experiences in research, law and policy development and the \nidentification of emerging trends and issues in crime prevention and criminal justice, \nas well as the applicable provisions of its resolution 56/119 of 19 December 2001,  \n \nBearing in mind the applicable provisions of Economic and Social Council \nresolution 1996/31 of 25 July 1996,  \n \nRecalling its resolution 76/181 of 16 December 2021, in which it requested the \nCommission on Crime Prevention and Criminal Justice to review the implementation \n\nA/RES/80/225 \nFollow-up to the Fourteenth United Nations Congress on \nCrime Prevention and Criminal Justice and preparations for the \nFifteenth United Nations Congress on Crime Prevention and \nCriminal Justice\n \n25-20991\n2/4 \n \nof the Kyoto Declaration1 under the standing item on its agenda entitled \u201cFollow-up \nto the Fourteenth United Nations Congress on Crime Prevention and Criminal Justice \nand preparations for the Fifteenth United Nations Congress on Crime Prevention and \nCriminal Justice\u201d, \n \nRecalling also its resolution 78/223 of 19 December 2023, in which it approved \nthe agenda items and decided upon the main theme and the topics for the workshops \nof the Fifteenth United Nations Congress on Crime Prevention and Criminal Justice, \nand also decided that, in accordance with its resolution 56/119, the Fifteenth Congress \nwould adopt a single declaration, to be submitted to the Commission on Crime \nPrevention and Criminal Justice for its consideration,  \n \nRecalling further its resolution 79/186 of 17 December 2024, in which it, inter \nalia, decided to hold the Fifteenth Congress in Abu Dhabi from 25 to 30 April 2026, \nwith pre\u2011Congress consultations to be held on 24 April 2026, decided that the high-\nlevel segment of the Fifteenth Congress would be held during the first two days of \nthe Congress, requested the Secretary-General to prepare a plan for the documentation \nfor the Fifteenth Congress, in consultation with the extended Bureau of the \nCommission on Crime Prevention and Criminal Justice, and to appoint a Secretary-\nGeneral and an Executive Secretary of the Fifteenth Congress, and to ensure, in \ncollaboration with Member States, a wide and effective programme of public \ninformation relating to the preparations for the Fifteenth Congress, to the Congress \nitself and to the follow-up to and implementation of its recommendations, invited \nGovernments to undertake preparations for the Fifteenth Congress at an early stage \nby all appropriate means, including, where appropriate, the establishment of national \npreparatory committees, and encouraged the relevant United Nations programmes, \nspecialized agencies of the United Nations system and intergovernmental and \nnon\u2011governmental organizations, as well as other professional organizations, to \ncooperate with the United Nations Office on Drugs and Crime in the preparations for \nthe Fifteenth Congress,  \n \nRecalling that, in its resolution 79/186, it encouraged Member States to finalize \ntheir negotiations of the Abu Dhabi declaration in a timely manner prior to the \ncommencement of the Fifteenth Congress so that the declaration could be adopted on \nthe opening day of the Fifteenth Congress, thereby following the approach taken in \nthe preparations for the Thirteenth and Fourteenth Congresses,  \n \nRecalling also that, in its resolution 79/186, it decided that the Commission on \nCrime Prevention and Criminal Justice, during the in-session thematic discussion at \nits thirty-fifth session, would give due consideration to the report of the Fifteenth \nCongress,  \n \nRecognizing the efforts made by the Government of the United Arab Emirates \nto ensure an effective preparatory process for the Fifteenth Congress, and stressing \nthe importance of undertaking all preparatory activities for the Fifteenth Congress in \na timely and concerted manner,  \n \nHaving considered the report of the Secretary-General on the follow-up to the \nFourteenth United Nations Congress on Crime Prevention and Criminal Justice and \npreparations for the Fifteenth Congress,2 \n \nBearing in mind the discussion guide for the Fifteenth Congress, prepared by \nthe Secretariat in cooperation with the institutes of the United Nations crime \n_______________ \n \n1 Resolution 76/181, annex. \n \n2 E/CN.15/2025/12. \n\nFollow-up to the Fourteenth United Nations Congress on \nCrime Prevention and Criminal Justice and preparations for the \nFifteenth United Nations Congress on Crime Prevention and \nCriminal Justice \nA/RES/80/225\n \n3/4\n25-20991 \n \nprevention and criminal justice programme network for the regional preparatory \nmeetings for the Congress,  \n \n1. \nEncourages Governments to take into account, as appropriate, the Kyoto \nDeclaration, as well as declarations adopted by previous United Nations congresses \non crime prevention and criminal justice, when formulating legislation and policy \ndirectives and to implement the principles contained therein, in conformity with the \npurposes and principles of the Charter of the United Nations;  \n \n2. \nTakes note of the follow-up by the Commission on Crime Prevention and \nCriminal Justice to the Kyoto Declaration, including through the holding of \nintersessional thematic discussions that facilitated the sharing of information, good \npractices and lessons learned among Member States and relevant stakeholders, in the \nconsideration of the follow-up to the Fifteenth United Nations Congress on Crime \nPrevention and Criminal Justice and to the implementation of the Abu Dhabi \ndeclaration;  \n \n3. \nInvites Governments and relevant intergovernmental and non\u2011governmental \norganizations to inform the Fifteenth Congress about their activities relating to the \nimplementation of the Kyoto Declaration that are aimed at supporting the formulation \nof legislation, policies and programmes in the field of crime prevention and criminal \njustice;  \n \n4. \nNotes with appreciation the work undertaken thus far in the preparations \nfor the Fifteenth Congress, including the convening of the five regional preparatory \nmeetings;  \n \n5. \nTakes note of the reports of the regional preparatory meetings,3 to be taken \ninto account during the preparations for and the deliberations of the Fifteenth \nCongress;  \n \n6. \nReiterates its invitation to Member States to be represented at the Fifteenth \nCongress at the highest possible level and to play an active role in the Fifteenth \nCongress by sending legal and policy experts, including practitioners with special \ntraining and practical experience in crime prevention and criminal justice; \n \n7. \nInvites \nMember States, intergovernmental and non\u2011governmental \norganizations and other relevant entities to provide support to the United Nations \nOffice on Drugs and Crime and the institutes of the United Nations crime prevention \nand criminal justice programme network for the preparations for the workshops to be \nheld during the Fifteenth Congress, including the preparation and circulation of \nrelevant background material, and encourages States, the institutes of the United \nNations crime prevention and criminal justice programme network, other concerned \nentities and the Secretary-General to work together in order to ensure that the \nworkshops are well focused and achieve practical results, leading to technical \ncooperation ideas and projects and documents for enhancing bilateral and multilateral \ntechnical assistance activities in crime prevention and criminal justice;  \n \n8. \nReiterates its request to the Secretary-General to facilitate the organization \nof ancillary meetings of non\u2011governmental and professional organizations participating \nin the Fifteenth Congress, in accordance with past practice, as well as meetings of \nprofessional and geographical interest groups, and to take appropriate measures to \nencourage the participation of the academic and research community in the Congress, \nand encourages Member States to actively participate in the above-mentioned \n_______________ \n \n3 A/CONF.241/RPM.1/2, A/CONF.241/RPM.2/2, A/CONF.241/RPM.3/2, A/CONF.241/RPM.4/2 \nand A/CONF.241/RPM.5/2. \n\nA/RES/80/225 \nFollow-up to the Fourteenth United Nations Congress on \nCrime Prevention and Criminal Justice and preparations for the \nFifteenth United Nations Congress on Crime Prevention and \nCriminal Justice\n \n25-20991\n4/4 \n \nmeetings, as they provide an opportunity to develop and maintain strong partnerships \nwith the private sector and civil society organizations;  \n \n9. \nWelcomes the plan for the documentation for the Fifteenth Congress, \nprepared by the Secretary-General in consultation with the extended Bureau of the \nCommission on Crime Prevention and Criminal Justice;  \n \n10. Requests the Secretary-General to present to the Fifteenth Congress an \noverview of the state of crime and criminal justice worldwide, using available \ninformation and data, intended to inform and facilitate the discussions of Member \nStates;  \n \n11. \nRequests the Commission on Crime Prevention and Criminal Justice to \ngive high priority at its thirty-fifth session to considering the outcome of the Fifteenth \nCongress, with a view to recommending, through the Economic and Social Council, \nappropriate follow-up by the General Assembly at its eighty-first session;  \n \n12. Requests the Secretary-General to ensure proper preparations for the \nFifteenth Congress through the Commission on Crime Prevention and Criminal \nJustice at its thirty-fifth session and to submit a report to the General Assembly at its \neighty-first session;  \n \n13. Also requests the Secretary-General to provide the United Nations Office \non Drugs and Crime with the necessary resources, from within the programme budget \nfor 2026, to support the preparations for and holding of the Fifteenth Congress;  \n \n14. Further requests the Secretary-General to make available, within existing \nresources, the funds necessary to ensure the participation of the least developed \ncountries in the Fifteenth Congress, in accordance with past practice. \n \n69th plenary meeting \n18 December 2025 \n \n",
  "paragraphs": {
    "1": "Encourages Governments to take into account, as appropriate, the Kyoto Declaration, as well as declarations adopted by previous United Nations congresses on crime prevention and criminal justice, when formulating legislation and policy directives and to implement the principles contained therein, in conformity with the purposes and principles of the Charter of the United Nations;",
    "2": "Takes note of the follow-up by the Commission on Crime Prevention and Criminal Justice to the Kyoto Declaration, including through the holding of intersessional thematic discussions that facilitated the sharing of information, good practices and lessons learned among Member States and relevant stakeholders, in the consideration of the follow-up to the Fifteenth United Nations Congress on Crime Prevention and Criminal Justice and to the implementation of the Abu Dhabi declaration;",
    "3": "Invites Governments and relevant intergovernmental and non\u2011governmental organizations to inform the Fifteenth Congress about their activities relating to the implementation of the Kyoto Declaration that are aimed at supporting the formulation of legislation, policies and programmes in the field of crime prevention and criminal justice;",
    "4": "Notes with appreciation the work undertaken thus far in the preparations for the Fifteenth Congress, including the convening of the five regional preparatory meetings;",
    "5": "Takes note of the reports of the regional preparatory meetings,3 to be taken into account during the preparations for and the deliberations of the Fifteenth Congress;",
    "6": "Reiterates its invitation to Member States to be represented at the Fifteenth Congress at the highest possible level and to play an active role in the Fifteenth Congress by sending legal and policy experts, including practitioners with special training and practical experience in crime prevention and criminal justice;",
    "7": "Invites Member States, intergovernmental and non\u2011governmental organizations and other relevant entities to provide support to the United Nations Office on Drugs and Crime and the institutes of the United Nations crime prevention and criminal justice programme network for the preparations for the workshops to be held during the Fifteenth Congress, including the preparation and circulation of relevant background material, and encourages States, the institutes of the United Nations crime prevention and criminal justice programme network, other concerned entities and the Secretary-General to work together in order to ensure that the workshops are well focused and achieve practical results, leading to technical cooperation ideas and projects and documents for enhancing bilateral and multilateral technical assistance activities in crime prevention and criminal justice;",
    "8": "Reiterates its request to the Secretary-General to facilitate the organization of ancillary meetings of non\u2011governmental and professional organizations participating in the Fifteenth Congress, in accordance with past practice, as well as meetings of professional and geographical interest groups, and to take appropriate measures to encourage the participation of the academic and research community in the Congress, and encourages Member States to actively participate in the above-mentioned meetings, as they provide an opportunity to develop and maintain strong partnerships with the private sector and civil society organizations;",
    "9": "Welcomes the plan for the documentation for the Fifteenth Congress, prepared by the Secretary-General in consultation with the extended Bureau of the Commission on Crime Prevention and Criminal Justice;",
    "10": "Requests the Secretary-General to present to the Fifteenth Congress an overview of the state of crime and criminal justice worldwide, using available information and data, intended to inform and facilitate the discussions of Member States;",
    "11": "Requests the Commission on Crime Prevention and Criminal Justice to give high priority at its thirty-fifth session to considering the outcome of the Fifteenth Congress, with a view to recommending, through the Economic and Social Council, appropriate follow-up by the General Assembly at its eighty-first session;",
    "12": "Requests the Secretary-General to ensure proper preparations for the Fifteenth Congress through the Commission on Crime Prevention and Criminal Justice at its thirty-fifth session and to submit a report to the General Assembly at its eighty-first session;",
    "13": "Also requests the Secretary-General to provide the United Nations Office on Drugs and Crime with the necessary resources, from within the programme budget for 2026, to support the preparations for and holding of the Fifteenth Congress;",
    "14": "Further requests the Secretary-General to make available, within existing resources, the funds necessary to ensure the participation of the least developed countries in the Fifteenth Congress, in accordance with past practice."
  },
  "agenda_items": [
    "Item 107"
  ],
  "symbol_references": []
}