{
  "symbol": "A/RES/72/138",
  "filename": "A_RES_72_138.pdf",
  "title": "72/138. International Universal Health Coverage Day",
  "text": "United Nations \nA/RES/72/138\n \n \nGeneral Assembly \nDistr.: General \n15 January 2018 \n \n17-22390 (E)    180118 \n*1722390* \n \n \nSeventy-second session \nAgenda item 127 \n \n \n \n \n Resolution adopted by the General Assembly \non 12 December 2017 \n \n \n \n \n[without reference to a Main Committee (A/72/L.27 and A/72/L.27/Add.1)] \n \n \n 72/138. International Universal Health Coverage Day \n \n \n \nThe General Assembly, \n \nRecalling its resolution 67/81 of 12 December 2012 on global health and foreign \npolicy, which recognized the importance of universal coverage in national health \nsystems and recommended that consideration be given to including universal health \ncoverage in the discussions on the post-2015 development agenda in the context of \nglobal health challenges,  \n \nRecalling also its resolution 70/1 of 25 September 2015, entitled \u201cTransforming \nour world: the 2030 Agenda for Sustainable Development\u201d, in which it adopted a \ncomprehensive, far-reaching and people-centred set of universal and transformative \nSustainable Development Goals and its aspirational and global targets, which include \nachieving the target of universal health coverage by 2030, including financial risk \nprotection, access to quality essential health-care services and access to safe, \neffective, quality and affordable essential medicines and vaccines for all, \n \nRecalling further its resolution 71/159 of 15 December 2016 on global health \nand foreign policy, which underlined the primary responsibility of Member States to \naccelerate their transition towards achieving universal health coverage and \nrecognized that health is a precondition for and an outcome and indicator of all three \ndimensions of sustainable development, \n \nReaffirming its resolutions 53/199 of 15 December 1998 and 61/185 of \n20 December 2006 on the proclamation of international years, and Economic and \nSocial Council resolution 1980/67 of 25 July 1980 on international years and \nanniversaries, particularly paragraphs 1 to 10 of the annex thereto on the agreed \ncriteria for the proclamation of international years, and paragraphs 13 and 14, in \nwhich it is stated that an international day or year should not be proclaimed before \nthe basic arrangements for its organization and financing have been made,  \n \n1. \nDecides to proclaim 12 December as International Universal Health \nCoverage Day; \n\nA/RES/72/138 \nInternational Universal Health Coverage Day\n \n17-22390 \n2/2 \n \n \n2. \nInvites all Member States, organizations of the United Nations system and \nother global, regional and subregional organizations, as well as other relevant \nstakeholders, including civil society, non-governmental organizations, the private \nsector, academia and individuals, to observe International Universal Health Coverage \nDay annually in an appropriate manner and in accordance with national priorities, \nthrough education and activities, in order to raise awareness of the need for strong \nand resilient health systems and universal health coverage;  \n \n3. \nRequests the Secretary-General to bring the present resolution to the \nattention of all Member States in order to encourage them to observe and carry out \nactivities to commemorate, on a voluntary basis, International Universal Health \nCoverage Day. \n \n72nd plenary meeting  \n12 December 2017 \n \n",
  "paragraphs": {
    "1": "Decides to proclaim 12 December as International Universal Health Coverage Day; A/RES/72/138 International Universal Health Coverage Day 17-22390 2/2",
    "2": "Invites all Member States, organizations of the United Nations system and other global, regional and subregional organizations, as well as other relevant stakeholders, including civil society, non-governmental organizations, the private sector, academia and individuals, to observe International Universal Health Coverage Day annually in an appropriate manner and in accordance with national priorities, through education and activities, in order to raise awareness of the need for strong and resilient health systems and universal health coverage;",
    "3": "Requests the Secretary-General to bring the present resolution to the attention of all Member States in order to encourage them to observe and carry out activities to commemorate, on a voluntary basis, International Universal Health Coverage Day. 72nd plenary meeting 12 December 2017"
  },
  "agenda_items": [
    "Item 127"
  ],
  "symbol_references": [
    "A/72/L.27"
  ]
}