{
  "symbol": "A/RES/73/337",
  "filename": "A_RES_73_337.pdf",
  "title": "73/337. Consolidating gains and accelerating efforts to control and eliminate malaria in developing countries, particularly in Africa, by 2030",
  "text": "United Nations \nA/RES/73/337 \n \n \nGeneral Assembly \nDistr.: General \n17 September 2019 \n \n19-15699 (E)    240919     \n*1915699* \n \n \nSeventy-third session \nAgenda item 13 \n \n \n \n \n Resolution adopted by the General Assembly \non 12 September 2019 \n \n \n \n \n[without reference to a Main Committee (A/73/L.109 and A/73/L.109/Add.1)] \n \n \n 73/337. Consolidating gains and accelerating efforts to control and \neliminate malaria in developing countries, particularly \nin Africa, by 2030 \n \n \n \nThe General Assembly, \n \nReaffirming the 2030 Agenda for Sustainable Development, 1  including the \nresolve of Member States to eliminate malaria by 2030, and the Addis Ababa Action \nAgenda of the Third International Conference on Financing for Development,2 \n \nRecalling that the period 2001\u20132010 was proclaimed by the General Assembly \nas the Decade to Roll Back Malaria in Developing Countries, Particularly in Africa, 3 \nand that combating HIV/AIDS, malaria, tuberculosis and other diseases is included \nin the internationally agreed development goals, including the Sustainable \nDevelopment Goals,  \n \nRecalling also its resolution 72/309 of 10 September 2018 and all previous \nresolutions concerning the struggle against malaria in developing countries, \nparticularly in Africa,  \n \nRecalling further World Health Assembly resolutions 60.18 of 23 May 2007 and \n64.17 of 24 May 2011, urging a broad range of national and international actions to \nscale up malaria control programmes, 4  resolution 61.18 of 24 May 2008 on \nmonitoring the achievement of health-related Millennium Development Goals5 and \nresolution 68.2 of 22 May 2015 on the global technical strategy and targets for \nmalaria 2016\u20132030,6 \n__________________ \n \n1  Resolution 70/1. \n \n2  Resolution 69/313, annex. \n \n3  See resolution 55/284. \n \n4  See World Health Organization, documents WHASS1/2006-WHA60/2007/REC/1 and \nWHA64/2011/REC/1. \n \n5  See World Health Organization, document WHA61/2008/REC/1. \n \n6  See World Health Organization, document WHA68/2015/REC/1. \n\nA/RES/73/337 \nConsolidating gains and accelerating efforts to control and eliminate \nmalaria in developing countries, particularly in Africa, by 2030\n \n19-15699\n2/12 \n \n \nRecalling with appreciation the Catalytic Framework to End AIDS and \nTuberculosis and Eliminate Malaria in Africa by 2030, adopted by the African Union \nat its twenty-seventh summit, held in Kigali from 10 to 18 July 2016, \n \nRecalling the adoption of the political declaration of the high-level meeting of \nthe General Assembly on antimicrobial resistance, 7 and in this regard noting the \nimpact of antimicrobial resistance,  \n \nRecalling also the commitment made by African leaders to end the epidemic of \nmalaria by ensuring universal and equitable access to quality health care and by \nimproving health systems and health financing, contained in the African Common \nPosition on the post-2015 development agenda, \n \nBearing in mind the relevant resolutions of the Economic and Social Council \nrelating to the struggle against malaria and diarrhoeal diseases, in particular \nresolution 1998/36 of 30 July 1998, \n \nRecalling declarations and decisions on health issues, in particular those related \nto malaria, adopted by the Organization of African Unity and the African Union, \nincluding the Abuja Declaration on HIV/AIDS, Tuberculosis and Other Related \nInfectious Diseases, containing the pledge to allocate at least 15 per cent of national \nbudgets to the health sector, the Abuja call for accelerated action towards universal \naccess to HIV and AIDS, tuberculosis and malaria services in Africa, issued by the \nHeads of State and Government of the African Union at its special summit on HIV \nand AIDS, tuberculosis and malaria, held in Abuja from 2 to 4 May 2006, the decision \nof the Assembly of the African Union at its fifteenth ordinary session, held in \nKampala from 25 to 27 July 2010, to extend the Abuja call to 2015 to coincide with \nthe Millennium Development Goals, and the declaration of the special summit of the \nAfrican Union on HIV/AIDS, tuberculosis and malaria, held in Abuja from 12 to \n16 July 2013,  \n \nRecognizing the leadership provided by the African Leaders Malaria Alliance \nand the continued commitment to help to achieve the 2015 targets and eliminate \nmalaria by 2030, and encouraging the members of the Alliance to continue to provide \npolitical leadership at the highest level in the fight against malaria in Africa,  \n \nRecalling the decision of the Assembly of Heads of State and Government of \nthe African Union at its thirty-first ordinary session, held in July 2018, to endorse the \n\u201cZero malaria starts with me\u201d campaign, which is a continent-wide public outreach \ncampaign modelled after the successful Senegalese campaign to engage every person \nacross every sector in every country in malaria control and elimination,  \n \nRecalling also the decision of the Assembly of Heads of State and Government \nof the African Union at its twenty-ninth ordinary session, held in Addis Ababa on \n3 and 4 July 2017, in which it endorsed the 2 million community health workers \ninitiative and requested the Joint United Nations Programme on HIV/AIDS, the World \nHealth Organization and other partners, such as the Group of 20, to support and \nfacilitate its implementation, \n \nRecalling further the meeting of the Commonwealth Heads of State and \nGovernment held in London in April 2018, at which member countries committed to \nhalve malaria in the Commonwealth countries by 2023, including the pledge by \nstakeholders to raise 4 billion United States dollars in new commitments to malaria \ncontrol and elimination,  \n__________________ \n \n7  Resolution 71/3. \n\nConsolidating gains and accelerating efforts to control and eliminate \nmalaria in developing countries, particularly in Africa, by 2030 \nA/RES/73/337\n \n3/12\n19-15699 \n \n \nWelcoming the leadership and commitment of the Asia Pacific Leaders Malaria \nAlliance to eliminate malaria in the Asia-Pacific region by 2030, and encouraging the \nmembers of the Alliance to continue to provide political leadership at the highest level \nin the fight against malaria in the region,  \n \nRecalling the launch in 2017 of the Africa Centres for Disease Control and \nPrevention to establish early warning and response surveillance systems, respond to \nemergencies, build capacity and provide technical expertise to address health \nemergencies in a timely and effective manner,  \n \nReaffirming the Global Technical Strategy for Malaria 2016\u20132030 of the World \nHealth Organization, adopted by the World Health Assembly in May 2015, 6 and the \nAction and Investment to Defeat Malaria 2016\u20132030 plan of the RBM Partnership to \nEnd Malaria, launched at the third International Conference on Financing for \nDevelopment, held in Addis Ababa from 13 to 16 July 2015, which together provide \nthe framework for achieving a reduction in global malaria incidence and mortality \nrates by at least 90 per cent by 2030, in line with the 2030 Agenda,  \n \nReaffirming also the World Health Organization framework for action for an \nemergency response to artemisinin resistance in the Greater Mekong subregion of \nSouth-East Asia, launched in April 2013,  \n \nReaffirming further the Declaration of Alma-Ata, adopted at the International \nConference on Primary Health Care, held in Alma-Ata from 6 to 12 September 1978, \nand its central role in launching the vision of the World Health Organization on health \nfor all,  \n \nRecalling the linkages among efforts being made to reach the targets set at the \nExtraordinary Summit of Heads of State and Government of the Organization of \nAfrican Unity, held in Abuja on 24 and 25 April 2000, as necessary and important for \nthe attainment of the \u201cRoll Back Malaria\u201d goal8 and the targets of the Millennium \nDevelopment Goals by 2010 and 2015, respectively, and welcoming in this regard the \ncommitment of Member States to respond to the specific needs of Africa,  \n \nAcknowledging the remarkable progress seen in global malaria control between \n2000 and 2015, during which period mortality decreased in South-East Asia by 44 per \ncent, in Africa by 37 per cent and in the Americas by 27 per cent, but noting with \nconcern the trend of stalling mortality rates in some countries and that the global \nmalaria community needs to increase its focus on supporting countries where malaria \nelimination will be hardest,  \n \nRecognizing that continued scale-up of integrated community case management \nof malaria, pneumonia and diarrhoea in children under 5 years of age in the highest \nburden countries, and a strengthening of integrated delivery systems for malaria \nprevention tools, would be a cost-effective solution to help in bridging systems gaps \nuntil health systems are further strengthened,9 while also helping to reach populations \nat highest risk of malaria,  \n \nRecalling that the target for malaria reduction under Millennium Development \nGoal 6 had been achieved, with the incidence rate decreasing by 18 per cent globally, \nfrom 76 to 63 cases per 1,000 population at risk, between 2010 and 2016,  \n \nRecognizing the important gains in reversing the malaria burden in Africa, \nincluding a 42 per cent decline in malaria case incidence and a 66 per cent decline in \nmalaria death rates between 2000 and 2015,10 \n__________________ \n \n8  See A/55/240/Add.1, annex. \n \n9  See A/71/881, para. 39. \n \n10  See World Health Organization, World Malaria Report 2016. \n\nA/RES/73/337 \nConsolidating gains and accelerating efforts to control and eliminate \nmalaria in developing countries, particularly in Africa, by 2030\n \n19-15699\n4/12 \n \n \nAcknowledging the progress made in parts of Africa in reversing the high burden \nof malaria through political engagement and sustainable national malaria control \nprogrammes, as well as the success achieved in respect of the 2015 goals concerning \nmalaria control set by the World Health Assembly, the RBM Partnership to End \nMalaria and the Abuja Declaration on Roll Back Malaria in Africa, 8 \n \nAcknowledging also the progress made in Latin America in reducing the \nincidence of malaria, with 15 out of 21 countries reducing the incidence by 75 per cent \nby 2015, and in significantly decreasing the number of malaria deaths by 79 per cent \nsince 2000, owing to the commitment of countries to improving access to medicines \nand health services and to sustained efforts in prevention programmes,  \n \nRecognizing that, despite the fact that increased global and national investments \nin malaria control have yielded significant results in decreasing the burden of malaria \nin many countries, and that some countries are moving towards the elimination of \nmalaria, many countries continue to have unacceptably high burdens of malaria and, \nin order to reach the internationally agreed development goals, including the \nSustainable Development Goals, must rapidly increase malaria prevention and control \nefforts, which rely heavily on medicines and insecticides whose utility is continuously \nthreatened by the development of resistance to antimalarial agents, as well as \nresistance of mosquitoes to insecticides and their shift to outdoor biting and resting,  \n \nAware that recent successes in prevention and control are fragile and can be \nmaintained only with sufficient and sustained national and international investment \nto fund global malaria control efforts fully,  \n \nRegretting the high number of people still without access to medicines, and \nunderscoring that improving access to medicines could save millions of lives every year,  \n \nRecognizing the serious challenges relating to substandard and falsified medical \nproducts, poor malaria diagnostics and poor quality of vector control products,  \n \nExpressing concern about the continued morbidity, mortality and debility \nattributed to malaria, and recalling that more efforts are needed as countries implement \nthe Sustainable Development Goals and focus on targets set out in the Global \nTechnical Strategy for Malaria 2016\u20132030 and the Action and Investment to Defeat \nMalaria 2016\u20132030 plan to reduce malaria mortality rates by 90 per cent by 2030, \n \nAware that a concerted and coordinated global effort will be needed to \nsubstantially reduce malaria transmission, morbidity and mortality by 2030 and \nachieve the targets set in the Global Technical Strategy for Malaria 2016\u20132030,  \n \nRecognizing that progress can be accelerated through a multi-pronged response \nby expanding currently available life-saving interventions, making malaria a higher \npolitical priority and considering malaria control as an integrated part of the health \nsystem, increasing accountability, strengthening regional and cross-border \ncollaboration, and ensuring that the development and use of new tools and approaches \nare maximized,  \n \nGravely concerned about the health burden of malaria worldwide, with \n219 million cases and 435,000 deaths reported in 2017 alone, 11  in particular in \nsub-Saharan Africa, where an estimated 90 per cent of the deaths occur, affecting \nmostly young children,  \n \nAcknowledging \u201cHigh burden to high impact\u201d as a country-led approach to \nreignite the pace of progress and get back on track to achieve the targets of the Global \nTechnical Strategy for Malaria 2016\u20132030 in high-burden countries, \n__________________ \n \n11  See World Health Organization, World Malaria Report 2018. \n\nConsolidating gains and accelerating efforts to control and eliminate \nmalaria in developing countries, particularly in Africa, by 2030 \nA/RES/73/337\n \n5/12\n19-15699 \n \n \nEmphasizing the importance of strengthening health systems to effectively \nsustain malaria control and elimination efforts, recognizing the existing opportunities \nto control the vector-borne diseases and to further advance progress towards the \nSustainable Development Goals (target 3.3) by incorporating an integrated approach \nin delivering health services for prevention and eliminating the transmission of \nmalaria and neglected tropical diseases, and enable appropriate responses to other \nhealth issues and emergencies, including investment in entomology and vector control \nfor human resources and infrastructures,  \n \nRecognizing the critical need to strengthen malaria surveillance and data quality \nin all regions where malaria is endemic in order to accurately measure progress, \ncombat resurgence and target resources, particularly in the face of growing resistance \nto treatment and preventive measures, and recognizing also that additional financing \nis needed to strengthen national and regional surveillance systems and to support the \nsharing and analysis of best practices to address urgent programmatic challenges, \nimprove monitoring and evaluation, and conduct regular financial planning and gap \nanalyses,  \n \nAcknowledging that the expansion of malaria interventions can be used as an \nentry point for strengthening health systems more broadly, including maternal and \nchild health services and laboratory services, and for building stronger health \ninformation and disease surveillance systems, which will further support the effective \ncase management of malaria,  \n \nCommending the efforts of the World Health Organization, the United Nations \nChildren\u2019s Fund, the RBM Partnership to End Malaria, the Global Fund to Fight \nAIDS, Tuberculosis and Malaria, the World Bank and other partners to fight malaria \nover the years,  \n \nNoting that the Global Fund is a primary multilateral funder for malaria control \nand elimination and that continued progress on malaria elimination will rely on, \namong other things, the successful replenishment of the Global Fund, noting in \nthis regard that the replenishment conference will be held in Lyon, France, \nin October 2019,  \n \nNoting also that existing bilateral donors have made a significant contribution \nto the progress on malaria control and elimination, and recognizing the need for other \ndonor countries to increase their investments, including official development \nassistance, in anti-malaria efforts,  \n \nRecognizing the commitment of countries in which malaria is endemic to fight \nthe disease, and recognizing also the need for those countries to further increase the \ndomestic resources they make available to combat the disease,  \n \n1. \nWelcomes the report of the World Health Organization transmitted \nby the Secretary-General, 12  and calls for support for the implementation of the \nrecommendations contained therein;  \n \n2. \nCalls for increased support for the implementation of international \ncommitments and goals pertaining to the fight against malaria, including Goal 3, \ntarget 3.3, of the Sustainable Development Goals,1 as well as the related targets \noutlined in the Global Technical Strategy for Malaria 2016\u20132030 of the World Health \nOrganization;6 \n \n3. \nEncourages malaria-endemic countries to increase the domestic resources \nthey make available to combat the disease and to review and strengthen national \n__________________ \n \n12  A/73/853. \n\nA/RES/73/337 \nConsolidating gains and accelerating efforts to control and eliminate \nmalaria in developing countries, particularly in Africa, by 2030\n \n19-15699\n6/12 \n \nstrategic plans in line with technical recommendations of the World Health \nOrganization and embed those firmly in national health sector and development plans;  \n \n4. \nAlso encourages malaria-endemic countries to adopt a multisectoral \napproach to malaria control, taking a whole-of-government approach to fully address \nits social, environmental and economic determinants and building on synergies with \nother development priorities, including progressively achieving universal health \ncoverage;  \n \n5. \nFurther encourages malaria-endemic countries to scale up coverage of \nmalaria prevention, diagnosis and treatment, leverage existing channels for integrated \nservice delivery where possible and strengthen systems to respond to the needs of \nlocal communities;  \n \n6. \nCalls upon Member States, with the support of development partners, to \nprovide universal access to existing life-saving tools for the prevention, diagnosis and \ntreatment of malaria, in particular to the package of core interventions recommended \nby the World Health Organization,13 and to ensure equity in access to health-care \nservices for all people at risk of contracting malaria, especially for those who are \nvulnerable or in vulnerable situations and hard-to-reach populations, including by \nstrengthening cross-collaboration;14 \n \n7. \nEncourages Member States, relevant organizations of the United Nations \nsystem, international institutions, non-governmental organizations, the private sector \nand civil society to continue to observe World Malaria Day on 25 April, in order to \nraise public awareness of and knowledge about the prevention, control and treatment \nof malaria as well as the importance of meeting the Sustainable Development Goals, \nand stresses the importance of engaging local communities in this regard;  \n \n8. \nAcknowledges the urgent need to optimize existing health financing in \ngeneral, including support for malaria control through the use of surveillance to \nincrease programmatic impact and efficiency, while also recognizing that funding \nshould increase substantially if the Global Technical Strategy for Malaria 2016\u20132030 \nmilestone for 2020 of 6.4 billion United States dollars per year is to be achieved;  \n \n9. \nAlso acknowledges the commitments of financial support provided \nthrough multilateral and bilateral channels, and recognizes the need for a substantial \nincrease in financial support to meet the targets of the Global Technical Strategy for \nMalaria 2016\u20132030, from an annual investment of 3.1 billion dollars in 2017 to \n8.7 billion dollars by 2030;6 \n \n10. Welcomes the commitments of financial support, while recognizing the \nneed for additional funding to achieve malaria elimination targets, for malaria \ninterventions and for research and development of preventive, diagnostic and control \ntools from the international community, through funding from multilateral and \nbilateral sources and from the private sector, as well as by making predictable \nfinancing available through appropriate and effective aid modalities and in-country \nhealth financing mechanisms aligned with national priorities, which are key to \nstrengthening health systems, including malaria surveillance, and promoting \nuniversal and equitable access to high-quality malaria prevention, diagnostic and \n__________________ \n \n13  The package of core interventions, including quality-assured vector control, chemoprevention \nand diagnostic testing and treatment, can dramatically reduce morbidity and mortality (see \npara. 36 of the Global Technical Strategy for Malaria 2016\u20132030). \n \n14  The call in the Global Malaria Programme of the World Health Organization for universal access \nto prevention, diagnosis and treatment, and for equity in access to services, are also key pillars of \nits Global Technical Strategy for Malaria 2016\u20132030. \n\nConsolidating gains and accelerating efforts to control and eliminate \nmalaria in developing countries, particularly in Africa, by 2030 \nA/RES/73/337\n \n7/12\n19-15699 \n \ntreatment services, and noting in this regard that a high level of external assistance \nper person at risk of contracting malaria is associated with a decrease in the incidence \nof the disease;  \n \n11. Urges the international community, United Nations agencies and private \norganizations and foundations to support the implementation of the Global Technical \nStrategy for Malaria 2016\u20132030, including through support for the complementary \nAction and Investment to Defeat Malaria 2016\u20132030 plan and for programmes and \nactivities at the country level in order to achieve internationally agreed targets on \nmalaria;  \n \n12. Calls upon the international community to continue to support the RBM \nPartnership to End Malaria and partner organizations, including the World Health \nOrganization, the World Bank and the United Nations Children\u2019s Fund, as vital \ncomplementary sources of support for the efforts of malaria-endemic countries to \ncombat the disease;  \n \n13. Urges the international community to work in a spirit of cooperation \ntowards effective, increased, harmonized, predictable and sustained bilateral and \nmultilateral assistance and research to combat malaria, including support for the \nGlobal Fund to Fight AIDS, Tuberculosis and Malaria, in order to assist States, in \nparticular malaria-endemic countries, to implement sound national plans, in particular \nhealth plans and sanitation plans, including malaria control and elimination strategies \nwhich may include evidence-based, cost-effective and context-appropriate \nenvironmental management solutions, and integrated management of childhood \nillnesses, in a sustained and equitable way that, inter alia, contributes to strengthening \nhealth system development approaches at the district level;  \n \n14. Calls upon the international community to assist malaria-endemic \ncountries to strengthen their health systems, medicine production and human \nresources for health to achieve universal health coverage; \n \n15. Appeals to the malaria partners to resolve the financial, supply chain and \ndelivery bottlenecks that are responsible for stock-outs of long-lasting insecticide-\ntreated nets, insecticides for indoor and outdoor residual spraying, rapid diagnostic \ntests and artemisinin-based combination therapies at the national level, whenever they \noccur, including through the strengthening of malaria programme management at the \ncountry level;  \n \n16. Welcomes the contribution to the mobilization of additional and \npredictable resources for development by voluntary innovative financing initiatives \ntaken by groups of Member States, and in this regard notes the contributions of the \nInternational Drug Purchase Facility, UNITAID, the International Finance Facility for \nImmunization, the advance market commitments for vaccines and Gavi, the Vaccine \nAlliance, and expresses support for the work of the Leading Group on Innovative \nFinancing for Development and its special task force on innovative financing for \nhealth;  \n \n17. Urges malaria-endemic countries to work towards financial sustainability, \nto increase national resources allocated to malaria control and to create favourable \nconditions for working with the private sector in order to improve access to good-\nquality malaria services, as well as to build on synergies with other development \npriorities, including the strengthening of health systems and engagement with \ndevelopment partners on implementing an effective vector control response, 15 as a \ncontribution to the achievement of universal health coverage;  \n__________________ \n \n15  See A/72/822, para. 44. \n\nA/RES/73/337 \nConsolidating gains and accelerating efforts to control and eliminate \nmalaria in developing countries, particularly in Africa, by 2030\n \n19-15699\n8/12 \n \n \n18. Urges Member States to assess and respond to the needs for integrated \nhuman resources at all levels of the health system in order to achieve the Sustainable \nDevelopment Goals, to take action, as appropriate, to effectively govern the \nrecruitment, training and retention of skilled health personnel, and to give particular \nfocus to the availability of skilled personnel at all levels to meet technical and \noperational needs as increased funding for malaria control programmes becomes \navailable;  \n \n19. Stresses the importance of improved community-based systems to control \nmalaria, bearing in mind that families are often the starting point for effective health \ncare for a child with a fever, and encourages malaria-endemic countries to extend the \nreach of public health services by training and deploying community health workers, \nparticularly in rural and remote areas, and to expand integrated community case \nmanagement of malaria, pneumonia and diarrhoea, with a focus on children under \n5 years of age;6 \n \n20. Affirms that close collaboration with community leaders and implementing \npartners, including non-governmental organizations, health workers and volunteers, \nis an essential factor for success in combating malaria, and calls upon Member States \nto introduce integrated, people-centred community services, in coordination with \nhealth-care providers in the public and private sectors, and to continue efforts to \ncollaborate with non-governmental partners, health workers and volunteers in \nimplementing community-based approaches to reach populations in remote and hard-\nto-reach areas;6 \n \n21. Calls upon Member States to promote access to medicines, and \nemphasizes that access to affordable and quality medicines and medical care in the \nevent of sickness, as well as in the prevention, treatment and control of diseases, is \ncentral to the realization of the right to the enjoyment of the highest attainable \nstandard of physical and mental health;  \n \n22. Urges the international community, inter alia, to support the work of the \nGlobal Fund to Fight AIDS, Tuberculosis and Malaria to enable it to meet its financial \nneeds and, through country-led initiatives with adequate international support, to \nintensify access to affordable, safe and effective antimalarial treatments, including \nartemisinin-based combination therapies, intermittent preventive therapies for \npregnant women, children under 5 and infants, adequate diagnostic facilities, long-\nlasting insecticide-treated mosquito nets, including, where appropriate, through the \nfree distribution of such nets and, where appropriate, to insecticides for indoor \nresidual spraying for malaria control, taking into account relevant international rules, \nincluding the Stockholm Convention on Persistent Organic Pollutants16 standards and \nguidelines; \n \n23. Urges relevant international organizations, in particular the World Health \nOrganization and the United Nations Children\u2019s Fund, to enhance the assistance \nefforts of national Governments to provide universal access to malaria control \ninterventions to address all at-risk populations, in particular young children and \npregnant women, in malaria-endemic countries, particularly in Africa, as rapidly as \npossible, with due regard to ensuring the proper use of those interventions, including \nlong-lasting insecticide-treated nets, and sustainability through full community \nparticipation and implementation through the health system;  \n \n24. Calls upon Member States, in particular malaria-endemic countries, with \nthe support of the international community, to establish and/or strengthen national \npolicies, operational plans and research, with a view to scaling up efforts to achieve \n__________________ \n \n16  United Nations, Treaty Series, vol. 2256, No. 40214. \n\nConsolidating gains and accelerating efforts to control and eliminate \nmalaria in developing countries, particularly in Africa, by 2030 \nA/RES/73/337\n \n9/12\n19-15699 \n \ninternationally agreed malaria targets, in accordance with the technical \nrecommendations of the World Health Organization;  \n \n25. Commends those African countries that have implemented the \nrecommendations of the Abuja Summit in 2000 to reduce or waive taxes and tariffs \nfor nets and other products needed for malaria control,8 and encourages other \ncountries to do the same;  \n \n26. Calls upon United Nations agencies and their partners to continue to \nprovide the technical support necessary to build and enhance the capacity of Member \nStates to implement the Global Technical Strategy for Malaria 2016\u20132030, together \nwith the Action and Investment to Defeat Malaria 2016\u20132030 plan, to meet the \ninternationally agreed goals;  \n \n27. Expresses deep concern about emerging drug and insecticide resistance in \nseveral regions of the world, calls upon Member States, with support from the World \nHealth Organization and other partners, to implement the Global Plan for Artemisinin \nResistance Containment and the Global Plan for Insecticide Resistance Management \nin Malaria Vectors and to strengthen and implement surveillance systems for \nmonitoring and assessing changing patterns of drug and insecticide resistance, calls \nupon the World Health Organization to support Member States in the development of \ntheir national insecticide resistance management strategies and to coordinate support \nat the international level for countries to ensure that drug efficacy and insecticide \nresistance testing is fully operational in order to enhance the use of artemisinin-based \ncombination therapies and insecticides, and stresses that the data gathered should be \nutilized to inform local decisions and for further research and development of safe \nand effective therapies and new vector control tools;  \n \n28. Urges all Member States to prohibit the marketing and use of oral \nartemisinin-based monotherapies and to replace them with oral artemisinin-based \ncombination therapies, as recommended by the World Health Organization, and to \ndevelop the financial, legislative and regulatory mechanisms necessary to introduce \nartemisinin combination therapies at affordable prices in both public and private \nfacilities;  \n \n29. Recognizes the importance of the development of safe, affordable and \ncost-effective vaccines, new medicines and diagnostics to prevent and treat malaria \nand the need for further and accelerated research, including into safe, effective and \nhigh-quality therapies, using rigorous standards, including by providing support to \nthe Special Programme for Research and Training in Tropical Diseases, 17 through \neffective global partnerships, such as, inter alia, the various malaria vaccine \ninitiatives and the Medicines for Malaria Venture, where necessary stimulated by new \nincentives to secure their development, and through effective and timely support for \nthe pre-qualification of new antimalarials and their combinations; \n \n30. Also recognizes the importance of innovation in addressing the challenges \nto eliminating malaria, including the role of the World Intellectual Property \nOrganization, in particular its Re: Search platform;  \n \n31. Calls upon the international community, including through existing \npartnerships, to increase investment in and efforts towards research to optimize \ncurrent tools, develop and validate new, safe and affordable malaria-related \nmedicines, products and technologies, such as vaccines, rapid diagnostic tests, \ninsecticides and their delivery modes, to prevent and treat malaria, especially for \n__________________ \n \n17  A joint programme of the United Nations Children\u2019s Fund, the United Nations Development \nProgramme, the World Bank and the World Health Organization. \n\nA/RES/73/337 \nConsolidating gains and accelerating efforts to control and eliminate \nmalaria in developing countries, particularly in Africa, by 2030\n \n19-15699\n10/12 \n \nat-risk children and pregnant women, and test opportunities for integration in order \nto enhance effectiveness and delay the onset of resistance;  \n \n32. Calls upon malaria-endemic countries to assure favourable conditions for \nresearch institutions, including the allocation of adequate resources and the \ndevelopment of national policies and legal frameworks, where appropriate, with a view \nto, inter alia, informing policy formulation and strategic interventions on malaria;  \n \n33. Reaffirms the right to use, to the fullest extent, the provisions contained in \nthe World Trade Organization Agreement on Trade-Related Aspects of Intellectual \nProperty Rights (TRIPS Agreement), the Doha Declaration on the TRIPS Agreement \nand Public Health, the decision of the General Council of the World Trade Organization \nof 30 August 2003 on the implementation of paragraph 6 of the Doha Declaration on \nthe TRIPS Agreement and Public Health, and the latest amendment to article 31 of \nthe TRIPS Agreement, which came into effect in January 2017, which provides \nflexibilities for the protection of public health, and in particular to promote access to \nmedicines for all and to encourage the provision of assistance to developing countries \nin this regard, and calls for the broad and timely acceptance of the amendment to \narticle 31 of the Agreement, as proposed by the General Council of the World Trade \nOrganization in its decision of 6 December 2005, while recognizing that the \nprotection of intellectual property is important for the development of new medicine;  \n \n34. Recognizes the importance in the struggle against malaria of the World \nHealth Organization Global Strategy and Plan of Action on Public Health, Innovation \nand Intellectual Property, adopted by the World Health Assembly on 24 May 2008; 5 \n \n35. Calls upon malaria-endemic countries, development partners and the \ninternational community to support the timely replacement of long-lasting \ninsecticide-treated nets in accordance with the recommendations of the World Health \nOrganization on the service lives of the nets, in order to prevent the risk of malaria \nresurgence and a reversal of the gains made to date and to make further progress in \nstandardizing nets to reduce the cost of their production;  \n \n36. Notes the essential contribution of the scientific community and the private \nsector, and stresses that new products such as improved diagnostic tools, more \neffective medicines and vaccines, new insecticides and more durable insecticide-\ntreated bednets are all fundamental to ensuring sustained progress in efforts to combat \nthe disease;18 \n \n37. Calls upon the international community to support ways to expand \naccess to affordable, effective and safe products and treatments, such as vector \ncontrol measures, including indoor residual spraying, long-lasting insecticide-\ntreated nets, including through the free distribution of such nets, adequate diagnostic \nfacilities, intermittent preventive therapies for pregnant women, children under 5 \nand infants, and artemisinin-based combination therapy for populations at risk of \nfalciparum malaria infection in endemic countries, particularly in Africa, including \nthrough additional funds and innovative mechanisms, inter alia, for the financing \nand scaling up of artemisinin production and procurement, as appropriate, to meet \nthe increased need;  \n \n38. Recognizes the impact of the RBM Partnership to End Malaria, and \nwelcomes the increased level of public-private partnerships for malaria control and \nprevention, including the financial and in-kind contributions of private sector partners \nand companies operating in Africa, as well as the increased engagement of \nnon-governmental service providers;  \n__________________ \n \n18  See A/73/853, para. 48. \n\nConsolidating gains and accelerating efforts to control and eliminate \nmalaria in developing countries, particularly in Africa, by 2030 \nA/RES/73/337\n \n11/12\n19-15699 \n \n \n39. Encourages the producers of long-lasting insecticide-treated nets and \ninsecticides to accelerate technology transfer to developing countries, and invites the \nWorld Bank and regional development funds to consider supporting malaria-endemic \ncountries in establishing factories to scale up production of long-lasting insecticide-\ntreated nets and insecticides, where appropriate;  \n \n40. Calls upon Member States and the international community, especially \nmalaria-endemic countries, in accordance with existing guidelines and recommendations \nof the World Health Organization and the requirements of the Stockholm Convention \non Persistent Organic Pollutants, including those related to DDT, to become fully \nknowledgeable about the technical policies and strategies of the World Health \nOrganization and the provisions of the Stockholm Convention, including for indoor \nresidual spraying, long-lasting insecticide-treated nets and case management, \nintermittent preventive therapies for pregnant women, children under 5 and infants, \nmonitoring of in vivo resistance studies to artemisinin-based combination therapies \nand monitoring and managing insecticide resistance and outdoor malaria transmission, \nas well as to increase capacity for the registration and uptake of new vector control \ntools, the safe, effective and judicious use of indoor residual spraying and other forms \nof vector control, including quality control measures, in accordance with international \nrules, standards and guidelines;  \n \n41. Requests the World Health Organization, the United Nations Children\u2019s \nFund and donor agencies to provide support to those countries that still use DDT for \nindoor residual spraying so as to ensure that it is implemented in accordance with \ninternational rules, standards and guidelines, and to provide all possible support to \nmalaria-endemic countries to manage the intervention effectively and prevent all \ncontamination, in particular, of agricultural products with DDT and other insecticides \nused for indoor residual spraying;  \n \n42. Recognizes the importance of a multisectoral strategy to advance global \ncontrol efforts, invites malaria-endemic countries to consider adopting and \nimplementing the Multisectoral Action Framework for Malaria, developed by the \nRBM Partnership to End Malaria and the United Nations Development Programme, \nand encourages regional and intersectoral collaboration, both public and private, at \nall levels, especially in education, health, agriculture, economic development and the \nenvironment, to advance malaria control objectives;  \n \n43. Also recognizes the need to strengthen malaria surveillance and data \nquality in all endemic regions, which is important to the follow-up and review of the \nprogress in implementing target 3.3 pertaining to Sustainable Development Goal 3 \nand a key pillar of the Global Technical Strategy for Malaria 2016\u20132030, to enable \nMember States to direct financial resources to populations most in need and to \nrespond effectively to disease outbreaks, particularly in the face of growing resistance \nto treatment and preventive measures;  \n \n44. Calls upon Member States and the international community to strengthen \nmechanisms for country-based coordination of technical assistance to achieve \nalignment of the best approaches to implement World Health Organization technical \nguidance and to mobilize support for the sharing and analysis of best practices to \naddress urgent programmatic challenges, to improve monitoring and evaluation and \nto conduct regular financial planning and gap analysis;  \n \n45. Encourages sharing, across regions, of knowledge, experience and lessons \nlearned with regard to the control and elimination of malaria, particularly between \nthe Africa, Asia-Pacific and Latin America regions;  \n \n46. Calls upon the international community to support the strengthening of \nhealth systems, national pesticide and/or pharmaceutical policies and national drug and \n\nA/RES/73/337 \nConsolidating gains and accelerating efforts to control and eliminate \nmalaria in developing countries, particularly in Africa, by 2030\n \n19-15699\n12/12 \n \npesticide regulatory authorities, to monitor and fight against the trade in substandard \nand falsified medical products, such as substandard antimalarial medicines, pesticides \nand/or nets, and prevent their distribution and use, and to support coordinated efforts, \ninter alia, by providing technical assistance for compliance with existing commitments \nand international regulations on the use of pesticides and to improve surveillance, \nmonitoring and evaluation systems and their alignment with national plans and \nsystems so as to better track and report changes in coverage, the need for scaling up \nrecommended interventions and the subsequent reductions in the burden of malaria;  \n \n47. Encourages Member States, the international community and all relevant \nactors, including the private sector, to promote the coordinated implementation and \nenhance the quality of malaria-related activities, in accordance with national policies \nand operational plans that are consistent with the technical recommendations of the \nWorld Health Organization and recent efforts and initiatives, including, where \nappropriate, the Paris Declaration on Aid Effectiveness, the Accra Agenda for Action, \nadopted at the Third High-level Forum on Aid Effectiveness, held in Accra from 2 to \n4 September 2008,19 and the Busan Partnership for Effective Development Cooperation, \nwhich make important contributions to the efforts of the countries that have made \ncommitments to them, and the Buenos Aires outcome document of the second High-\nlevel United Nations Conference on South-South Cooperation;20 \n \n48. Recognizes the need for political commitment and financial support to \nsustain and expand the achievements in the struggle against malaria and to meet the \ninternational malaria targets through prevention and malaria control efforts to end the \nepidemic, while acknowledging the remarkable progress in combating malaria \nto date;  \n \n49. Requests the Secretary-General, in close collaboration with the Director \nGeneral of the World Health Organization and in consultation with Member States, to \nreport to the General Assembly at its seventy-fourth session on the implementation of \nthe present resolution.  \n \n106th plenary meeting  \n12 September 2019 \n \n__________________ \n \n19  A/63/539, annex. \n \n20  Resolution 73/291, annex. \n",
  "paragraphs": {
    "1": "Welcomes the report of the World Health Organization transmitted by the Secretary-General, 12 and calls for support for the implementation of the recommendations contained therein;",
    "2": "Calls for increased support for the implementation of international commitments and goals pertaining to the fight against malaria, including Goal 3, target 3.3, of the Sustainable Development Goals,1 as well as the related targets outlined in the Global Technical Strategy for Malaria 2016\u20132030 of the World Health Organization;6",
    "3": "Encourages malaria-endemic countries to increase the domestic resources they make available to combat the disease and to review and strengthen national __________________ 12 A/73/853. A/RES/73/337 Consolidating gains and accelerating efforts to control and eliminate malaria in developing countries, particularly in Africa, by 2030 19-15699 6/12 strategic plans in line with technical recommendations of the World Health Organization and embed those firmly in national health sector and development plans;",
    "4": "Also encourages malaria-endemic countries to adopt a multisectoral approach to malaria control, taking a whole-of-government approach to fully address its social, environmental and economic determinants and building on synergies with other development priorities, including progressively achieving universal health coverage;",
    "5": "Further encourages malaria-endemic countries to scale up coverage of malaria prevention, diagnosis and treatment, leverage existing channels for integrated service delivery where possible and strengthen systems to respond to the needs of local communities;",
    "6": "Calls upon Member States, with the support of development partners, to provide universal access to existing life-saving tools for the prevention, diagnosis and treatment of malaria, in particular to the package of core interventions recommended by the World Health Organization,13 and to ensure equity in access to health-care services for all people at risk of contracting malaria, especially for those who are vulnerable or in vulnerable situations and hard-to-reach populations, including by strengthening cross-collaboration;14",
    "7": "Encourages Member States, relevant organizations of the United Nations system, international institutions, non-governmental organizations, the private sector and civil society to continue to observe World Malaria Day on 25 April, in order to raise public awareness of and knowledge about the prevention, control and treatment of malaria as well as the importance of meeting the Sustainable Development Goals, and stresses the importance of engaging local communities in this regard;",
    "8": "Acknowledges the urgent need to optimize existing health financing in general, including support for malaria control through the use of surveillance to increase programmatic impact and efficiency, while also recognizing that funding should increase substantially if the Global Technical Strategy for Malaria 2016\u20132030 milestone for 2020 of 6.4 billion United States dollars per year is to be achieved;",
    "9": "Also acknowledges the commitments of financial support provided through multilateral and bilateral channels, and recognizes the need for a substantial increase in financial support to meet the targets of the Global Technical Strategy for Malaria 2016\u20132030, from an annual investment of 3.1 billion dollars in 2017 to 8.7 billion dollars by 2030;6",
    "10": "Welcomes the commitments of financial support, while recognizing the need for additional funding to achieve malaria elimination targets, for malaria interventions and for research and development of preventive, diagnostic and control tools from the international community, through funding from multilateral and bilateral sources and from the private sector, as well as by making predictable financing available through appropriate and effective aid modalities and in-country health financing mechanisms aligned with national priorities, which are key to strengthening health systems, including malaria surveillance, and promoting universal and equitable access to high-quality malaria prevention, diagnostic and __________________ 13 The package of core interventions, including quality-assured vector control, chemoprevention and diagnostic testing and treatment, can dramatically reduce morbidity and mortality (see para. 36 of the Global Technical Strategy for Malaria 2016\u20132030). 14 The call in the Global Malaria Programme of the World Health Organization for universal access to prevention, diagnosis and treatment, and for equity in access to services, are also key pillars of its Global Technical Strategy for Malaria 2016\u20132030. Consolidating gains and accelerating efforts to control and eliminate malaria in developing countries, particularly in Africa, by 2030 A/RES/73/337 7/12 19-15699 treatment services, and noting in this regard that a high level of external assistance per person at risk of contracting malaria is associated with a decrease in the incidence of the disease;",
    "11": "Urges the international community, United Nations agencies and private organizations and foundations to support the implementation of the Global Technical Strategy for Malaria 2016\u20132030, including through support for the complementary Action and Investment to Defeat Malaria 2016\u20132030 plan and for programmes and activities at the country level in order to achieve internationally agreed targets on malaria;",
    "12": "Calls upon the international community to continue to support the RBM Partnership to End Malaria and partner organizations, including the World Health Organization, the World Bank and the United Nations Children\u2019s Fund, as vital complementary sources of support for the efforts of malaria-endemic countries to combat the disease;",
    "13": "Urges the international community to work in a spirit of cooperation towards effective, increased, harmonized, predictable and sustained bilateral and multilateral assistance and research to combat malaria, including support for the Global Fund to Fight AIDS, Tuberculosis and Malaria, in order to assist States, in particular malaria-endemic countries, to implement sound national plans, in particular health plans and sanitation plans, including malaria control and elimination strategies which may include evidence-based, cost-effective and context-appropriate environmental management solutions, and integrated management of childhood illnesses, in a sustained and equitable way that, inter alia, contributes to strengthening health system development approaches at the district level;",
    "14": "Calls upon the international community to assist malaria-endemic countries to strengthen their health systems, medicine production and human resources for health to achieve universal health coverage;",
    "15": "Appeals to the malaria partners to resolve the financial, supply chain and delivery bottlenecks that are responsible for stock-outs of long-lasting insecticide- treated nets, insecticides for indoor and outdoor residual spraying, rapid diagnostic tests and artemisinin-based combination therapies at the national level, whenever they occur, including through the strengthening of malaria programme management at the country level;",
    "16": "Welcomes the contribution to the mobilization of additional and predictable resources for development by voluntary innovative financing initiatives taken by groups of Member States, and in this regard notes the contributions of the International Drug Purchase Facility, UNITAID, the International Finance Facility for Immunization, the advance market commitments for vaccines and Gavi, the Vaccine Alliance, and expresses support for the work of the Leading Group on Innovative Financing for Development and its special task force on innovative financing for health;",
    "17": "Urges malaria-endemic countries to work towards financial sustainability, to increase national resources allocated to malaria control and to create favourable conditions for working with the private sector in order to improve access to good- quality malaria services, as well as to build on synergies with other development priorities, including the strengthening of health systems and engagement with development partners on implementing an effective vector control response, 15 as a contribution to the achievement of universal health coverage; __________________ 15 See A/72/822, para. 44. A/RES/73/337 Consolidating gains and accelerating efforts to control and eliminate malaria in developing countries, particularly in Africa, by 2030 19-15699 8/12",
    "18": "Urges Member States to assess and respond to the needs for integrated human resources at all levels of the health system in order to achieve the Sustainable Development Goals, to take action, as appropriate, to effectively govern the recruitment, training and retention of skilled health personnel, and to give particular focus to the availability of skilled personnel at all levels to meet technical and operational needs as increased funding for malaria control programmes becomes available;",
    "19": "Stresses the importance of improved community-based systems to control malaria, bearing in mind that families are often the starting point for effective health care for a child with a fever, and encourages malaria-endemic countries to extend the reach of public health services by training and deploying community health workers, particularly in rural and remote areas, and to expand integrated community case management of malaria, pneumonia and diarrhoea, with a focus on children under 5 years of age;6",
    "20": "Affirms that close collaboration with community leaders and implementing partners, including non-governmental organizations, health workers and volunteers, is an essential factor for success in combating malaria, and calls upon Member States to introduce integrated, people-centred community services, in coordination with health-care providers in the public and private sectors, and to continue efforts to collaborate with non-governmental partners, health workers and volunteers in implementing community-based approaches to reach populations in remote and hard- to-reach areas;6",
    "21": "Calls upon Member States to promote access to medicines, and emphasizes that access to affordable and quality medicines and medical care in the event of sickness, as well as in the prevention, treatment and control of diseases, is central to the realization of the right to the enjoyment of the highest attainable standard of physical and mental health;",
    "22": "Urges the international community, inter alia, to support the work of the Global Fund to Fight AIDS, Tuberculosis and Malaria to enable it to meet its financial needs and, through country-led initiatives with adequate international support, to intensify access to affordable, safe and effective antimalarial treatments, including artemisinin-based combination therapies, intermittent preventive therapies for pregnant women, children under 5 and infants, adequate diagnostic facilities, long- lasting insecticide-treated mosquito nets, including, where appropriate, through the free distribution of such nets and, where appropriate, to insecticides for indoor residual spraying for malaria control, taking into account relevant international rules, including the Stockholm Convention on Persistent Organic Pollutants16 standards and guidelines;",
    "23": "Urges relevant international organizations, in particular the World Health Organization and the United Nations Children\u2019s Fund, to enhance the assistance efforts of national Governments to provide universal access to malaria control interventions to address all at-risk populations, in particular young children and pregnant women, in malaria-endemic countries, particularly in Africa, as rapidly as possible, with due regard to ensuring the proper use of those interventions, including long-lasting insecticide-treated nets, and sustainability through full community participation and implementation through the health system;",
    "24": "Calls upon Member States, in particular malaria-endemic countries, with the support of the international community, to establish and/or strengthen national policies, operational plans and research, with a view to scaling up efforts to achieve __________________ 16 United Nations, Treaty Series, vol. 2256, No. 40214. Consolidating gains and accelerating efforts to control and eliminate malaria in developing countries, particularly in Africa, by 2030 A/RES/73/337 9/12 19-15699 internationally agreed malaria targets, in accordance with the technical recommendations of the World Health Organization;",
    "25": "Commends those African countries that have implemented the recommendations of the Abuja Summit in 2000 to reduce or waive taxes and tariffs for nets and other products needed for malaria control,8 and encourages other countries to do the same;",
    "26": "Calls upon United Nations agencies and their partners to continue to provide the technical support necessary to build and enhance the capacity of Member States to implement the Global Technical Strategy for Malaria 2016\u20132030, together with the Action and Investment to Defeat Malaria 2016\u20132030 plan, to meet the internationally agreed goals;",
    "27": "Expresses deep concern about emerging drug and insecticide resistance in several regions of the world, calls upon Member States, with support from the World Health Organization and other partners, to implement the Global Plan for Artemisinin Resistance Containment and the Global Plan for Insecticide Resistance Management in Malaria Vectors and to strengthen and implement surveillance systems for monitoring and assessing changing patterns of drug and insecticide resistance, calls upon the World Health Organization to support Member States in the development of their national insecticide resistance management strategies and to coordinate support at the international level for countries to ensure that drug efficacy and insecticide resistance testing is fully operational in order to enhance the use of artemisinin-based combination therapies and insecticides, and stresses that the data gathered should be utilized to inform local decisions and for further research and development of safe and effective therapies and new vector control tools;",
    "28": "Urges all Member States to prohibit the marketing and use of oral artemisinin-based monotherapies and to replace them with oral artemisinin-based combination therapies, as recommended by the World Health Organization, and to develop the financial, legislative and regulatory mechanisms necessary to introduce artemisinin combination therapies at affordable prices in both public and private facilities;",
    "29": "Recognizes the importance of the development of safe, affordable and cost-effective vaccines, new medicines and diagnostics to prevent and treat malaria and the need for further and accelerated research, including into safe, effective and high-quality therapies, using rigorous standards, including by providing support to the Special Programme for Research and Training in Tropical Diseases, 17 through effective global partnerships, such as, inter alia, the various malaria vaccine initiatives and the Medicines for Malaria Venture, where necessary stimulated by new incentives to secure their development, and through effective and timely support for the pre-qualification of new antimalarials and their combinations;",
    "30": "Also recognizes the importance of innovation in addressing the challenges to eliminating malaria, including the role of the World Intellectual Property Organization, in particular its Re: Search platform;",
    "31": "Calls upon the international community, including through existing partnerships, to increase investment in and efforts towards research to optimize current tools, develop and validate new, safe and affordable malaria-related medicines, products and technologies, such as vaccines, rapid diagnostic tests, insecticides and their delivery modes, to prevent and treat malaria, especially for __________________ 17 A joint programme of the United Nations Children\u2019s Fund, the United Nations Development Programme, the World Bank and the World Health Organization. A/RES/73/337 Consolidating gains and accelerating efforts to control and eliminate malaria in developing countries, particularly in Africa, by 2030 19-15699 10/12 at-risk children and pregnant women, and test opportunities for integration in order to enhance effectiveness and delay the onset of resistance;",
    "32": "Calls upon malaria-endemic countries to assure favourable conditions for research institutions, including the allocation of adequate resources and the development of national policies and legal frameworks, where appropriate, with a view to, inter alia, informing policy formulation and strategic interventions on malaria;",
    "33": "Reaffirms the right to use, to the fullest extent, the provisions contained in the World Trade Organization Agreement on Trade-Related Aspects of Intellectual Property Rights (TRIPS Agreement), the Doha Declaration on the TRIPS Agreement and Public Health, the decision of the General Council of the World Trade Organization of 30 August 2003 on the implementation of paragraph 6 of the Doha Declaration on the TRIPS Agreement and Public Health, and the latest amendment to article 31 of the TRIPS Agreement, which came into effect in January 2017, which provides flexibilities for the protection of public health, and in particular to promote access to medicines for all and to encourage the provision of assistance to developing countries in this regard, and calls for the broad and timely acceptance of the amendment to article 31 of the Agreement, as proposed by the General Council of the World Trade Organization in its decision of 6 December 2005, while recognizing that the protection of intellectual property is important for the development of new medicine;",
    "34": "Recognizes the importance in the struggle against malaria of the World Health Organization Global Strategy and Plan of Action on Public Health, Innovation and Intellectual Property, adopted by the World Health Assembly on 24 May 2008; 5",
    "35": "Calls upon malaria-endemic countries, development partners and the international community to support the timely replacement of long-lasting insecticide-treated nets in accordance with the recommendations of the World Health Organization on the service lives of the nets, in order to prevent the risk of malaria resurgence and a reversal of the gains made to date and to make further progress in standardizing nets to reduce the cost of their production;",
    "36": "Notes the essential contribution of the scientific community and the private sector, and stresses that new products such as improved diagnostic tools, more effective medicines and vaccines, new insecticides and more durable insecticide- treated bednets are all fundamental to ensuring sustained progress in efforts to combat the disease;18",
    "37": "Calls upon the international community to support ways to expand access to affordable, effective and safe products and treatments, such as vector control measures, including indoor residual spraying, long-lasting insecticide- treated nets, including through the free distribution of such nets, adequate diagnostic facilities, intermittent preventive therapies for pregnant women, children under 5 and infants, and artemisinin-based combination therapy for populations at risk of falciparum malaria infection in endemic countries, particularly in Africa, including through additional funds and innovative mechanisms, inter alia, for the financing and scaling up of artemisinin production and procurement, as appropriate, to meet the increased need;",
    "38": "Recognizes the impact of the RBM Partnership to End Malaria, and welcomes the increased level of public-private partnerships for malaria control and prevention, including the financial and in-kind contributions of private sector partners and companies operating in Africa, as well as the increased engagement of non-governmental service providers; __________________ 18 See A/73/853, para. 48. Consolidating gains and accelerating efforts to control and eliminate malaria in developing countries, particularly in Africa, by 2030 A/RES/73/337 11/12 19-15699",
    "39": "Encourages the producers of long-lasting insecticide-treated nets and insecticides to accelerate technology transfer to developing countries, and invites the World Bank and regional development funds to consider supporting malaria-endemic countries in establishing factories to scale up production of long-lasting insecticide- treated nets and insecticides, where appropriate;",
    "40": "Calls upon Member States and the international community, especially malaria-endemic countries, in accordance with existing guidelines and recommendations of the World Health Organization and the requirements of the Stockholm Convention on Persistent Organic Pollutants, including those related to DDT, to become fully knowledgeable about the technical policies and strategies of the World Health Organization and the provisions of the Stockholm Convention, including for indoor residual spraying, long-lasting insecticide-treated nets and case management, intermittent preventive therapies for pregnant women, children under 5 and infants, monitoring of in vivo resistance studies to artemisinin-based combination therapies and monitoring and managing insecticide resistance and outdoor malaria transmission, as well as to increase capacity for the registration and uptake of new vector control tools, the safe, effective and judicious use of indoor residual spraying and other forms of vector control, including quality control measures, in accordance with international rules, standards and guidelines;",
    "41": "Requests the World Health Organization, the United Nations Children\u2019s Fund and donor agencies to provide support to those countries that still use DDT for indoor residual spraying so as to ensure that it is implemented in accordance with international rules, standards and guidelines, and to provide all possible support to malaria-endemic countries to manage the intervention effectively and prevent all contamination, in particular, of agricultural products with DDT and other insecticides used for indoor residual spraying;",
    "42": "Recognizes the importance of a multisectoral strategy to advance global control efforts, invites malaria-endemic countries to consider adopting and implementing the Multisectoral Action Framework for Malaria, developed by the RBM Partnership to End Malaria and the United Nations Development Programme, and encourages regional and intersectoral collaboration, both public and private, at all levels, especially in education, health, agriculture, economic development and the environment, to advance malaria control objectives;",
    "43": "Also recognizes the need to strengthen malaria surveillance and data quality in all endemic regions, which is important to the follow-up and review of the progress in implementing target 3.3 pertaining to Sustainable Development Goal 3 and a key pillar of the Global Technical Strategy for Malaria 2016\u20132030, to enable Member States to direct financial resources to populations most in need and to respond effectively to disease outbreaks, particularly in the face of growing resistance to treatment and preventive measures;",
    "44": "Calls upon Member States and the international community to strengthen mechanisms for country-based coordination of technical assistance to achieve alignment of the best approaches to implement World Health Organization technical guidance and to mobilize support for the sharing and analysis of best practices to address urgent programmatic challenges, to improve monitoring and evaluation and to conduct regular financial planning and gap analysis;",
    "45": "Encourages sharing, across regions, of knowledge, experience and lessons learned with regard to the control and elimination of malaria, particularly between the Africa, Asia-Pacific and Latin America regions;",
    "46": "Calls upon the international community to support the strengthening of health systems, national pesticide and/or pharmaceutical policies and national drug and A/RES/73/337 Consolidating gains and accelerating efforts to control and eliminate malaria in developing countries, particularly in Africa, by 2030 19-15699 12/12 pesticide regulatory authorities, to monitor and fight against the trade in substandard and falsified medical products, such as substandard antimalarial medicines, pesticides and/or nets, and prevent their distribution and use, and to support coordinated efforts, inter alia, by providing technical assistance for compliance with existing commitments and international regulations on the use of pesticides and to improve surveillance, monitoring and evaluation systems and their alignment with national plans and systems so as to better track and report changes in coverage, the need for scaling up recommended interventions and the subsequent reductions in the burden of malaria;",
    "47": "Encourages Member States, the international community and all relevant actors, including the private sector, to promote the coordinated implementation and enhance the quality of malaria-related activities, in accordance with national policies and operational plans that are consistent with the technical recommendations of the World Health Organization and recent efforts and initiatives, including, where appropriate, the Paris Declaration on Aid Effectiveness, the Accra Agenda for Action, adopted at the Third High-level Forum on Aid Effectiveness, held in Accra from 2 to 4 September 2008,19 and the Busan Partnership for Effective Development Cooperation, which make important contributions to the efforts of the countries that have made commitments to them, and the Buenos Aires outcome document of the second High- level United Nations Conference on South-South Cooperation;20",
    "48": "Recognizes the need for political commitment and financial support to sustain and expand the achievements in the struggle against malaria and to meet the international malaria targets through prevention and malaria control efforts to end the epidemic, while acknowledging the remarkable progress in combating malaria to date;",
    "49": "Requests the Secretary-General, in close collaboration with the Director General of the World Health Organization and in consultation with Member States, to report to the General Assembly at its seventy-fourth session on the implementation of the present resolution. 106th plenary meeting 12 September 2019 __________________ 19 A/63/539, annex. 20 Resolution 73/291, annex."
  },
  "agenda_items": [
    "Item 13"
  ],
  "symbol_references": [
    "A/73/L.109"
  ]
}