{
  "symbol": "A/RES/72/88",
  "filename": "A_RES_72_88.pdf",
  "title": "72/88. The occupied Syrian Golan",
  "text": "United Nations \nA/RES/72/88\n \n \nGeneral Assembly \nDistr.: General \n14 December 2017 \n \n17-22118 (E)    181217 \n*1722118* \n \n \nSeventy-second session \nAgenda item 54 \n \n \n \n \n Resolution adopted by the General Assembly \non 7 December 2017 \n \n \n \n \n[on the report of the Special Political and Decolonization Committee \n(Fourth Committee) (A/72/448)] \n \n \n \n72/88. The occupied Syrian Golan \n \n \n \nThe General Assembly, \n \nHaving considered the report of the Special Committee to Investigate Israeli \nPractices Affecting the Human Rights of the Palestinian People and Other Arabs of \nthe Occupied Territories,1 \n \nDeeply concerned that the Syrian Golan, occupied since 1967, has been under \ncontinued Israeli military occupation, \n \nRecalling Security Council resolution 497 (1981) of 17 December 1981, \n \nRecalling also its previous relevant resolutions, the most recent of which was \nresolution 71/99 of 6 December 2016, \n \nHaving considered the report of the Secretary-General submitted in pursuance \nof resolution 71/99,2 \n \nRecalling its previous relevant resolutions in which, inter alia, it called upon \nIsrael to put an end to its occupation of the Arab territories, \n \nReaffirming once more the illegality of the decision of 14 December 1981 \ntaken by Israel to impose its laws, jurisdiction and administration on the occupied \nSyrian Golan, which has resulted in the effective annexation of that territory, \n \nReaffirming that the acquisition of territory by force is inadmissible under \ninternational law, including the Charter of the United Nations, \n \nReaffirming also the applicability of the Geneva Convention relative to the \nProtection of Civilian Persons in Time of War, of 12 August 1949,3 to the occupied \nSyrian Golan, \n__________________ \n \n1  A/72/539. \n \n2  A/72/538. \n \n3  United Nations, Treaty Series, vol. 75, No. 973. \n\nA/RES/72/88 \nThe occupied Syrian Golan\n \n17-22118 \n2/2 \n \n \nBearing in mind Security Council resolution 237 (1967) of 14 June 1967, \n \nWelcoming the convening at Madrid of the Peace Conference on the Middle \nEast on the basis of Security Council resolutions 242 (1967) of 22 November 1967 \nand 338 (1973) of 22 October 1973 aimed at the realization of a just, comprehensive \nand lasting peace, and expressing grave concern about the stalling of the peace \nprocess on all tracks, \n \n1. \nCalls upon Israel, the occupying Power, to comply with the relevant \nresolutions on the occupied Syrian Golan, in particular Security Council resolution \n497 (1981), in which the Council, inter alia, decided that the Israeli decision to \nimpose its laws, jurisdiction and administration on the occupied Syrian Golan was \nnull and void and without international legal effect and demanded that Israel, the \noccupying Power, rescind forthwith its decision; \n \n2. \nAlso calls upon Israel to desist from changing the physical character, \ndemographic composition, institutional structure and legal status of the occupied \nSyrian Golan and in particular to desist from the establishment of settlements; \n \n3. \nDetermines that all legislative and administrative measures and actions \ntaken or to be taken by Israel, the occupying Power, that purport to alter the \ncharacter and legal status of the occupied Syrian Golan are null and void, constitute \na flagrant violation of international law and of the Geneva Convention relative to \nthe Protection of Civilian Persons in Time of War, of 12 August 1949,3 and have no \nlegal effect; \n \n4. \nCalls upon Israel to desist from imposing Israeli citizenship and Israeli \nidentity cards on the Syrian citizens in the occupied Syrian Golan, and from its \nrepressive measures against the population of the occupied Syrian Golan; \n \n5. \nDeplores the violations by Israel of the Geneva Convention relative to \nthe Protection of Civilian Persons in Time of War, of 12 August 1949; \n \n6. \nCalls once again upon Member States not to recognize any of the \nlegislative or administrative measures and actions referred to above; \n \n7. \nRequests the Secretary-General to report to the General Assembly at its \nseventy-third session on the implementation of the present resolution. \n \n66th plenary meeting  \n7 December 2017 \n \n",
  "paragraphs": {
    "1": "Calls upon Israel, the occupying Power, to comply with the relevant resolutions on the occupied Syrian Golan, in particular Security Council resolution 497 (1981), in which the Council, inter alia, decided that the Israeli decision to impose its laws, jurisdiction and administration on the occupied Syrian Golan was null and void and without international legal effect and demanded that Israel, the occupying Power, rescind forthwith its decision;",
    "2": "Also calls upon Israel to desist from changing the physical character, demographic composition, institutional structure and legal status of the occupied Syrian Golan and in particular to desist from the establishment of settlements;",
    "3": "Determines that all legislative and administrative measures and actions taken or to be taken by Israel, the occupying Power, that purport to alter the character and legal status of the occupied Syrian Golan are null and void, constitute a flagrant violation of international law and of the Geneva Convention relative to the Protection of Civilian Persons in Time of War, of 12 August 1949,3 and have no legal effect;",
    "4": "Calls upon Israel to desist from imposing Israeli citizenship and Israeli identity cards on the Syrian citizens in the occupied Syrian Golan, and from its repressive measures against the population of the occupied Syrian Golan;",
    "5": "Deplores the violations by Israel of the Geneva Convention relative to the Protection of Civilian Persons in Time of War, of 12 August 1949;",
    "6": "Calls once again upon Member States not to recognize any of the legislative or administrative measures and actions referred to above;",
    "7": "Requests the Secretary-General to report to the General Assembly at its seventy-third session on the implementation of the present resolution. 66th plenary meeting 7 December 2017"
  },
  "agenda_items": [
    "Item 54"
  ],
  "symbol_references": []
}