{
  "symbol": "A/RES/77/3",
  "filename": "A_RES_77_3.pdf",
  "title": "77/3. Revised estimates on United Nations activities to mitigate global food insecurity and its humanitarian impact",
  "text": "United Nations \nA/RES/77/3\n \n \nGeneral Assembly \nDistr.: General \n1 November 2022 \n \n22-24489 (E)    021122 \n*2224489* \n \n \nSeventy-seventh session \nAgenda item 137 \nProgramme budget for 2022 \n \n \n \n \n Resolution adopted by the General Assembly \non 27 October 2022 \n \n \n \n \n[on the report of the Fifth Committee (A/77/535, para. 6)] \n \n \n \n77/3. Revised estimates on United Nations activities to mitigate global \nfood insecurity and its humanitarian impact \n \n \n \nThe General Assembly, \n \nHaving considered the report of the Secretary-General1 and the related report of \nthe Advisory Committee on Administrative and Budgetary Questions, 2 \n \n1. \nTakes note of the report of the Secretary-General;  \n \n2. \nEndorses the conclusions and recommendations contained in the report of \nthe Advisory Committee on Administrative and Budgetary Questions;  \n \n3. \nApproves additional resource requirements in the amount of 3,524,600 United \nStates dollars under the programme budget for 2022, under section 12, Trade and \ndevelopment (848,600 dollars), section 27, Humanitarian assistance (2,481,700 dollars), \nand section 36, Staff assessment (194,300 dollars), to be offset by an equivalent \nincrease of 194,300 dollars under income section 1, Income from staff assessment;  \n \n4. \nAuthorizes the Secretary-General to enter into commitments in an amount \nnot exceeding 3,524,600 dollars;  \n \n5. \nNotes that the use of the commitment authority of 3,524,600 dollars for \n2022 will be reported in the financial performance report for 2022. \n \n21st plenary meeting \n27 October 2022 \n \n__________________ \n \n1  A/77/325. \n \n2  A/77/486. \n",
  "paragraphs": {
    "1": "Takes note of the report of the Secretary-General;",
    "2": "Endorses the conclusions and recommendations contained in the report of the Advisory Committee on Administrative and Budgetary Questions;",
    "3": "Approves additional resource requirements in the amount of 3,524,600 United States dollars under the programme budget for 2022, under section 12, Trade and development (848,600 dollars), section 27, Humanitarian assistance (2,481,700 dollars), and section 36, Staff assessment (194,300 dollars), to be offset by an equivalent increase of 194,300 dollars under income section 1, Income from staff assessment;",
    "4": "Authorizes the Secretary-General to enter into commitments in an amount not exceeding 3,524,600 dollars;",
    "5": "Notes that the use of the commitment authority of 3,524,600 dollars for 2022 will be reported in the financial performance report for 2022."
  },
  "agenda_items": [
    "Item 137"
  ],
  "symbol_references": []
}