{
  "symbol": "A/RES/74/301",
  "filename": "A_RES_74_301.pdf",
  "title": "74/301. New Partnership for Africa\u2019s Development: progress in implementation and international support",
  "text": "United Nations \nA/RES/74/301\n \n \nGeneral Assembly \nDistr.: General \n8 September 2020 \n \n20-11526 (E)    100920 \n*2011526*\n \n \nSeventy-fourth session \nAgenda item 64 (a) \nNew Partnership for Africa\u2019s Development: progress in \nimplementation and international support: New \nPartnership for Africa\u2019s Development: progress in \nimplementation and international support \n \n \n \n \n Resolution adopted by the General Assembly \non 3 September 2020 \n \n \n \n \n[without reference to a Main Committee (A/74/L.68/Rev.1 and \nA/74/L.68/Rev.1/Add.1)] \n \n \n 74/301. New Partnership for Africa\u2019s Development: progress in \nimplementation and international support \n \n \n \nThe General Assembly, \n \nRecalling its resolution 57/2 of 16 September 2002 on the United Nations \nDeclaration on the New Partnership for Africa\u2019s Development, \n \nRecalling also its resolution 57/7 of 4 November 2002 on the final review and \nappraisal of the United Nations New Agenda for the Development of Africa in the \n1990s and support for the New Partnership for Africa\u2019s Development and all its \nsubsequent resolutions, including resolution 73/335 of 10 September 2019, entitled \n\u201cNew Partnership for Africa\u2019s Development: progress in implementation and \ninternational support\u201d, \n \nReaffirming its resolution 70/1 of 25 September 2015, entitled \u201cTransforming \nour world: the 2030 Agenda for Sustainable Development\u201d, in which it adopted a \ncomprehensive, far-reaching and people-centred set of universal and transformative \nSustainable Development Goals and targets, its commitment to working tirelessly for \nthe full implementation of the Agenda by 2030, its recognition that eradicating poverty \nin all its forms and dimensions, including extreme poverty, is the greatest global \nchallenge and an indispensable requirement for sustainable development, its \ncommitment to achieving sustainable development in its three dimensions \u2013 economic, \nsocial and environmental \u2013 in a balanced and integrated manner, and to building upon \nthe achievements of the Millennium Development Goals and seeking to address their \nunfinished business, \n\nA/RES/74/301 \nNew Partnership for Africa\u2019s Development: progress \nin implementation and international support\n \n20-11526\n2/11 \n \n \nReaffirming also its resolution 69/313 of 27 July 2015, entitled \u201cAddis Ababa \nAction Agenda of the Third International Conference on Financing for Development \n(Addis Ababa Action Agenda)\u201d, which is an integral part of the 2030 Agenda for \nSustainable Development, supports and complements it, helps to contextualize its \nmeans of implementation targets with concrete policies and actions, and reaffirms the \nstrong political commitment to address the challenge of financing and creating an \nenabling environment at all levels for sustainable development in the spirit of global \npartnership and solidarity, \n \nWelcoming the adoption by the Assembly of Heads of State and Government of \nthe African Union of the declaration proclaiming \u201cSilencing the guns: creating \nconducive conditions for Africa\u2019s development\u201d as the theme for 2020, \n \nRecalling that the 2030 Agenda for Sustainable Development underscores the \nspecial challenges facing the most vulnerable countries, including African countries, \nand recalling also that significant challenges remain in achieving sustainable \ndevelopment in Africa and the importance of fulfilling all commitments to advance \naction in areas critical to Africa\u2019s sustainable development, \n \nRecognizing the adoption of Agenda 2063 by the Assembly of Heads of State and \nGovernment of the African Union at its twenty-fourth ordinary session, held in Addis \nAbaba on 30 and 31 January 2015, as the African Union long-term strategy \nemphasizing industrialization, youth employment, improved natural resource \ngovernance and the reduction of inequalities, and recognizing also the adoption by the \nAssembly of Heads of State and Government of the African Union of the first 10-year \nimplementation plan (2014\u20132023) of Agenda 2063, which outlines key African \nflagship projects, fast-track programmes, priority areas, specific targets and African \nstrategies and policy measures at all levels to support its implementation, \n \nNoting with appreciation the signing by the Secretary-General and the \nChairperson of the African Union Commission on 27 January 2018 of the African \nUnion-United Nations Framework for the Implementation of Agenda 2063 and the \n2030 Agenda for Sustainable Development to promote the integrated and coordinated \nimplementation, monitoring and reporting of both Agendas through joint activities \nand programmes, \n \nRecalling the adoption of its resolution 74/206 of 19 December 2019 on the \npromotion of international cooperation to combat illicit financial flows and strengthen \ngood practices on assets return to foster sustainable development, \n \nReaffirming the Paris Agreement 1  and encouraging all its parties to fully \nimplement the Agreement, and parties to the United Nations Framework Convention \non Climate Change 2  that have not yet done so to deposit their instruments of \nratification, acceptance, approval or accession, where appropriate, as soon as \npossible, \n \nHighlighting the synergies between the implementation of the 2030 Agenda for \nSustainable Development, the Addis Ababa Action Agenda, the Paris Agreement and \nother relevant major intergovernmental outcomes of United Nations conferences and \nsummits in economic, social and environmental fields, \n \nUnderlining the need to promote peaceful and inclusive societies for achieving \nsustainable development and to build effective, accountable and inclusive institutions \nat all levels, and reaffirming that good governance, the rule of law, human rights, \nfundamental freedoms, equal access to fair justice systems and measures to combat \ncorruption and curb illicit financial flows will be integral to our efforts, \n__________________ \n \n1 See FCCC/CP/2015/10/Add.1, decision 1/CP.21, annex. \n \n2 United Nations, Treaty Series, vol. 1771, No. 30822. \n\nNew Partnership for Africa\u2019s Development: progress  \nin implementation and international support \nA/RES/74/301\n \n3/11\n20-11526 \n \n \nRecalling the adoption of its resolution 71/254 of 23 December 2016 on the \nFramework for a Renewed United Nations-African Union Partnership on Africa\u2019s \nIntegration and Development Agenda 2017\u20132027, \n \nRecalling also the adoption by the Economic and Social Council of resolution \n2020/6 of 18 June 2020 on the social dimensions of the New Partnership for Africa\u2019s \nDevelopment, \n \nRecalling further its resolution 70/259 of 1 April 2016, by which it \nproclaimed 2016\u20132025 the United Nations Decade of Action on Nutrition, and \nrecalling also its resolution 72/306 of 24 July 2018, entitled \u201cImplementation of the \nUnited Nations Decade of Action on Nutrition (2016\u20132025)\u201d, \n \nRecalling its resolution 66/293 of 17 September 2012, by which it established a \nUnited Nations monitoring mechanism to review commitments made towards Africa\u2019s \ndevelopment, and looking forward to the fourth biennial report of the Secretary-\nGeneral on the review of the implementation of the commitments made towards \nAfrica\u2019s development, to be submitted to the General Assembly at its seventy-fifth \nsession, \n \nWelcoming the ongoing support of the United Nations Industrial Development \nOrganization for the New Partnership for Africa\u2019s Development, 3  the African \n(Accelerated) Agribusiness and Agro-industries Development Initiative, the \nPharmaceutical Manufacturing Plan for Africa and other programmes of the African \nUnion aimed at further strengthening the industrialization process in Africa, \n \nWelcoming also the high-level events organized by the Office of the Special \nAdviser on Africa during the 2020 Africa Dialogue Series, on the theme \u201cCOVID-19 \nand silencing the guns in Africa: challenges and opportunities\u201d, \n \nBearing in mind that African countries have primary responsibility for their own \neconomic and social development and that the role of national policies and \ndevelopment strategies cannot be overemphasized, bearing in mind also the need for \ntheir development efforts to be supported by the international community and an \nenabling international economic environment, reiterating the need for the \ninternational community to implement all commitments regarding the economic and \nsocial development of Africa, and in this regard recalling the support given by the \nInternational Conference on Financing for Development to the New Partnership,4 \n \nReaffirming the convening of the intergovernmental conference held on 10 and \n11 December 2018 in Marrakech, Morocco, and recalling that it adopted the Global \nCompact for Safe, Orderly and Regular Migration, also known as the Marrakech \nCompact on Migration,5 \n \nReaffirming also the outcome of the second High-level United Nations \nConference on South-South Cooperation, held in Buenos Aires from 20 to 22 March \n2019,6 \n \nNoting the various international events that have been held and are planned to \nbe held between African countries and their partners, including the seventh Tokyo \nInternational Conference on African Development, held in Yokohama, Japan, from 28 \nto 30 August 2019, the first ever Russia-Africa Summit and Economic Forum, held \nin Sochi, Russian Federation, on 23 and 24 October 2019, the United Kingdom-Africa \nInvestment Summit, held in London on 20 January 2020, and the Extraordinary China-\n__________________ \n \n3 A/57/304, annex. \n \n4 See Report of the International Conference on Financing for Development, Monterrey, Mexico, \n18\u201322 March 2002 (United Nations publication, Sales No. E.02.II.A.7), chap. I, resolution 1, \nannex. \n \n5 Resolution 73/195, annex. \n \n6 Resolution 73/291, annex. \n\nA/RES/74/301 \nNew Partnership for Africa\u2019s Development: progress \nin implementation and international support\n \n20-11526\n4/11 \n \nAfrica Summit on Solidarity against COVID-19, held on 17 June 2020, and looking \nforward to the convening of the sixth European Union-African Union Summit, to be \nheld in October 2020, \n \nTaking note with appreciation of decision Ext/Assembly/AU/Dec.1(XI) of the \nAssembly of Heads of State and Government of the African Union adopted at its \neleventh extraordinary session, held in Addis Ababa on 17 and 18 November 2018, \non the evolutionary trajectory of the New Partnership and the rationale behind the \nestablishment of the African Union Development Agency as a vehicle for the better \nexecution of the African Union Agenda 2063 and the decision that the New \nPartnership Planning and Coordinating Agency shall henceforth be renamed the \nAfrican Union Development Agency-New Partnership for Africa\u2019s Development, \n \n1. \nTakes note of the seventeenth consolidated progress report of the \nSecretary-General on implementation and international support for the New \nPartnership for Africa\u2019s Development;7 \n \n2. \nRecognizes the efforts of the New Partnership for Africa\u2019s Development, 3 \nand welcomes in this regard the efforts by development partners to strengthen \ncooperation with the New Partnership and recognizes the progress made, while \nacknowledging that much needs to be done in its implementation; \n \n3. \nAlso recognizes the importance of supporting Agenda 2063 and its first \n10-year implementation plan (2014\u20132023) and acknowledges the programme of the \nNew Partnership for Africa\u2019s Development, both of which are integral to the 2030 \nAgenda for Sustainable Development,8 and underscores in this regard the importance \nof a coherent and coordinated implementation of Agenda 2063 and the 2030 Agenda; \n \n4. \nEmphasizes that economic development, including inclusive industrial \ndevelopment, and policies which seek to enhance productive capacities in Africa can \ngenerate employment and income for the poor and, therefore, be an engine for poverty \neradication and for achieving internationally agreed development goals, including the \nSustainable Development Goals and recognizes in this regard the adoption by the \nGeneral Assembly of resolution 70/293 of 25 July 2016 on the Third Industrial \nDevelopment Decade for Africa (2016\u20132025); \n \n5. \nRecognizes its commitment to the full implementation of the political \ndeclaration on Africa\u2019s development needs, adopted at the high-level meeting on \nAfrica\u2019s development needs on 22 September 2008;9 \n \n6. \nWelcomes the progress made by African countries in fulfilling their \ncommitments in the implementation of the New Partnership to deepen democracy, \nhuman rights, good governance and sound economic management, and encourages \nAfrican countries, with the participation of stakeholders, including civil society and \nthe private sector, to continue their efforts towards achieving the Sustainable \nDevelopment Goals, developing and strengthening institutions for governance, \ncreating an environment conducive to involving the private sector, including small \nand medium-sized enterprises, in the New Partnership implementation process, \ndeveloping innovative public-private partnerships for financing infrastructure \nprojects and attracting foreign direct investment for development; \n \n7. \nEncourages African countries to strengthen and expand local and regional \ninfrastructure and to continue to share best practices with a view to strengthening \nregional and continental integration, and in this regard notes with appreciation the \n__________________ \n \n7 A/74/193. \n \n8 Resolution 70/1. \n \n9 Resolution 63/1. \n\nNew Partnership for Africa\u2019s Development: progress  \nin implementation and international support \nA/RES/74/301\n \n5/11\n20-11526 \n \nwork of the high-level subcommittee of the African Union on the Presidential \nInfrastructure Champion Initiative; \n \n8. \nAlso encourages African countries to maintain the trend of increasing both \nforeign and domestic investment in infrastructure development, including through \nstrengthened domestic resource mobilization from the public and private sectors, and \nimproving the efficiency of existing infrastructure investment; \n \n9. \nRecalls the third Global Infrastructure Forum, held in Bali, Indonesia, on \n13 October 2018, and in this regard recalls, as outlined in the Addis Ababa Action \nAgenda of the Third International Conference on Financing for Development, 10 that \na greater range of voices should be heard, particularly from developing countries, to \nidentify and address infrastructure and capacity gaps, in particular in African \ncountries, and that it highlights opportunities for investment and cooperation and \nworks to ensure that investments are environmentally, socially and economically \nsustainable; \n \n10. Recognizes the need for Africa\u2019s development partners to align their efforts \nin infrastructure investment towards supporting the Programme for Infrastructure \nDevelopment in Africa, recalls the Dakar Agenda for Action to mobilize investment \ntowards infrastructure development projects, and calls upon development partners to \nsupport the implementation of the Dakar Agenda; \n \n11. \nEncourages African countries to accelerate the achievement of the \nobjective of food security and nutrition in Africa, welcomes the commitment made \nby African leaders to allocate at least 10 per cent of public expenditure to agriculture \nand to ensure its efficiency and effectiveness, in this regard recognizes its support for \nthe commitments contained in the Malabo Declaration on Accelerated Agricultural \nGrowth and Transformation for Shared Prosperity and Improved Livelihoods and for \nthe Comprehensive Africa Agriculture Development Programme, and in this regard \nnotes the important progress made by the 44 African countries and the 4 regional \neconomic communities that have signed compacts under the Programme; \n \n12. Urges continued support of measures to address the challenges of poverty \neradication, hunger and malnutrition, job creation and sustainable development in \nAfrica, including, as appropriate, debt relief, improved market access, support for the \nprivate sector and entrepreneurship, fulfilment of commitments on official \ndevelopment assistance and increased flows of foreign direct investment, and transfer \nof technology on mutually agreed terms; \n \n13. Recognizes the need for Africa\u2019s development partners to align their efforts \nto implement the commitments contained in the Declaration on Nutrition Security for \nInclusive Economic Growth and Sustainable Development in Africa, towards \nsupporting the Comprehensive Africa Agriculture Development Programme and the \nimplementation of the national and regional investment plans of the Programme for \nalignment of external funding, and recalls the Declaration of the World Summit on \nFood Security;11 \n \n14. Calls for effective measures and targeted investments to strengthen \nnational health systems and to ensure access to safe drinking water and sanitation to \nprevent, protect against and combat outbreaks of diseases, including the Ebola virus \ndisease and coronavirus disease (COVID-19); invites development partners to \ncontinue to assist African countries in their efforts to strengthen national health \nsystems, to expand surveillance systems in the health sector, in compliance with the \n__________________ \n \n10 Resolution 69/313, annex. \n \n11 Food and Agriculture Organization of the United Nations, document WSFS 2009/2. \n\nA/RES/74/301 \nNew Partnership for Africa\u2019s Development: progress \nin implementation and international support\n \n20-11526\n6/11 \n \nInternational Health Regulations (2005), 12  and to eliminate diseases, and in this \ncontext calls upon development partners to support the implementation of the African \nHealth Strategy 2016\u20132030 and the transition towards universal health coverage in \nAfrica; \n \n15. Notes the unprecedented threat that COVID-19 presents to the continent\u2019s \nhard-won development and economic gains; welcomes efforts of African leaders in \nmitigating the impact of the pandemic on their countries and citizens; expresses its \nhighest appreciation to all partners and international organizations, including the \nUnited Nations, the World Health Organization, the international financial \ninstitutions, the Paris Club and the Group of 20, that have supported the continent in \nmitigating the effects of COVID-19; notes that there is a need for additional support \nto reduce the effects of the pandemic on the continent\u2019s achievement of the 2030 \nAgenda for Sustainable Development and Agenda 2063; and in this regard calls upon \nthe United Nations development system, under the leadership of the Secretary-\nGeneral, and relevant international organizations and development partners to \nmobilize a coordinated global response to the pandemic and its adverse social, \neconomic and financial impact on all African societies; \n \n16. Recalls the adoption of the political declaration of the high-level meeting \nof the General Assembly on the fight against tuberculosis, as reflected in its resolution \n73/3 of 10 October 2018, and the political declaration of the third high-level meeting \nof the Assembly on the prevention and control of non-communicable diseases, as \nreflected in its resolution 73/2 of 10 October 2018, and calls upon developed countries \nand other development partners to continue their support, including financial and \ntechnical support, to African countries to scale up their national efforts to fully \nimplement, as appropriate, the actions committed to by the Heads of State and \nGovernment and their representatives; \n \n17. Encourages African countries to continue their efforts in investing in \neducation, including mathematics, vocational training, including engineering, \nscience, technology and innovation to enhance value addition and sustainable \nindustrial development; \n \n18. Recognizes the important role that African regional economic communities \ncan play in the implementation of the mandate of the New Partnership and of Agenda \n2063 and its first 10-year implementation plan in close cooperation with the African \nUnion, and in this regard encourages African countries and the international \ncommunity to give regional economic communities the support necessary to \nstrengthen their capacity; \n \n19. Reiterates the need to support developing countries in strengthening the \ncapacity of national statistical offices and data systems to ensure access to high-\nquality, timely, reliable and disaggregated data; \n \n20. Requests the United Nations system to continue to provide assistance to \nthe New Partnership and to African countries in developing projects and programmes \nwithin the scope of the priorities of the New Partnership, reaffirms the essential role \nplayed by the New Partnership Heads of State and Government Orientation \nCommittee, and further requests that emphasis be placed on monitoring and \nevaluation in support of the New Partnership; \n \n21. Expresses concern about the increasing challenges posed by the adverse \nimpacts of climate change, drought, land degradation, desertification, the loss of \nbiodiversity and floods, and their negative consequences for the fight against poverty, \nfamine and hunger, which could pose serious additional challenges to the achievement \n__________________ \n \n12 World Health Organization, document WHA58/2005/REC/1, resolution 58.3, annex. \n\nNew Partnership for Africa\u2019s Development: progress  \nin implementation and international support \nA/RES/74/301\n \n7/11\n20-11526 \n \nof the internationally agreed development goals, including the Sustainable \nDevelopment Goals, particularly in Africa; \n \n22. Expresses deep concern about the continuing negative effects of \ndesertification, land degradation and drought on the African continent and underlines \nthe need for short-, medium- and long-term measures, and in this regard calls for the \ncontinued effective implementation of the United Nations Convention to Combat \nDesertification in Those Countries Experiencing Serious Drought and/or \nDesertification, Particularly in Africa,\n13  including its 2018\u20132030 Strategic \nFramework;14 \n \n23. Recognizes that Africa is one of the regions that contribute the least to \nclimate change, yet is extremely vulnerable and exposed to the adverse impacts of \nclimate change, and in this regard calls upon the international community, including \ndeveloped countries, to continue to support Africa to address its adaptation needs \nthrough, inter alia, the development, transfer and deployment of technology on \nmutually agreed terms, capacity-building and the provision of adequate and \npredictable resources, in line with existing commitments, and highlights the need for \nfull implementation of the agreed outcomes of the United Nations Framework \nConvention on Climate Change,2 including the Paris Agreement;1 \n \n24. Urges Member States that have not yet done so to consider ratifying or \nacceding to the United Nations Convention against Transnational Organized Crime \nand the Protocols thereto, 15 the Single Convention on Narcotic Drugs of 1961 as \namended by the 1972 Protocol, 16 the Convention on Psychotropic Substances of \n1971,17 the United Nations Convention against Illicit Traffic in Narcotic Drugs and \nPsychotropic Substances of 1988, 18  the United Nations Convention against \nCorruption19 and the international conventions and protocols related to terrorism, and \nurges States parties to those conventions and protocols to make efforts towards their \neffective implementation; \n \n25. Underscores the importance of support by Africa\u2019s partners, in particular \ndeveloped countries, of efforts by African countries to strengthen domestic resource \nmobilization, including through capacity-building and strengthening of international \ncooperation to combat illicit financial flows and enhance asset recovery and return; \n \n26. Reiterates the commitment to redouble efforts to substantially reduce \nillicit financial flows by 2030, with a view to eventually eliminating them, including \nby combating tax evasion and corruption through strengthened national regulation \nand increased international cooperation, in line with the Addis Ababa Action Agenda, \nand the strengthening of international cooperation to combat illicit financial flows; \n \n27. Recalls the second International Expert Meeting on the Return of Stolen \nAssets, held in Addis Ababa from 7 to 9 May 2019, and encourages the continuation \nof its work in advancing efforts to strengthen the recovery and return of stolen assets \nand the identification of good practices for the return of stolen assets in support of \nsustainable development; \n \n28. Reaffirms that achieving gender equality, empowering all women and girls, \nand the full realization of their human rights are essential to achieving sustained, \ninclusive and equitable economic growth and sustainable development, reiterates the \n__________________ \n \n13 United Nations, Treaty Series, vol. 1954, No. 33480. \n \n14 ICCD/COP(13)/21/Add.1, decision 7/COP.13, annex. \n \n15 United Nations, Treaty Series, vols. 2225, 2237, 2241 and 2326, No. 39574. \n \n16 Ibid., vol. 976, No. 14152. \n \n17 Ibid., vol. 1019, No. 14956. \n \n18 Ibid., vol. 1582, No. 27627. \n \n19 Ibid., vol. 2349, No. 42146. \n\nA/RES/74/301 \nNew Partnership for Africa\u2019s Development: progress \nin implementation and international support\n \n20-11526\n8/11 \n \nneed for gender mainstreaming, including targeted actions and investments in the \nformulation and implementation of all financial, economic, environmental and social \npolicies, and recommits to adopting and strengthening sound policies and enforceable \nlegislation and transformative actions for the promotion of gender equality and women\u2019s \nand girls\u2019 empowerment at all levels, to ensure women\u2019s equal rights, access and \nopportunities for participation and leadership in the economy and to eliminate gender-\nbased violence, sexual exploitation and abuse and discrimination in all its forms; \n \n29. Welcomes the noteworthy progress that has been achieved in implementing \nthe African Peer Review Mechanism, in particular the voluntary adherence of \n40 African countries to the Mechanism and the completion of the peer review process \nin 21 countries, welcomes the progress in implementing the national programmes of \naction resulting from those reviews, in this regard urges African States that have not \nyet done so to consider joining the Mechanism process by 2023, as envisaged in the \nfirst 10-year implementation plan of Agenda 2063, encourages further strengthening \nof the Mechanism process for its efficient performance, and takes note of the \ndecisions taken by the Assembly of Heads of State and Government of the African \nUnion at its eleventh extraordinary session, held in Addis Ababa on 17 and \n18 November 2018, on the institutional reform of the African Peer Review \nMechanism; \n \n30. Emphasizes African ownership of the African Peer Review Mechanism \nprocess, and invites the international community to support the efforts of African \ncountries, at their request, in implementing their respective national programmes of \naction arising from the process; \n \n31. Notes with concern that the preliminary data indicate that the net bilateral \naid flows to Africa decreased by 4 per cent in 2018 compared with 2017 figures, 20 \nand notes that there are no updated comparable data on bilateral aid flows to Africa \nin 2019; \n \n32. Reiterates that the fulfilment of all official development assistance \ncommitments remains crucial, including the commitment by many developed \ncountries to achieve the target of 0.7 per cent of gross national income for official \ndevelopment assistance and 0.15 to 0.20 per cent of gross national income for official \ndevelopment assistance to least developed countries, is encouraged by those few \ncountries that have met or surpassed their commitment to 0.7 per cent of gross \nnational income for official development assistance and the target of 0.15 to 0.20 per \ncent of gross national income for official development assistance to least developed \ncountries, and urges all others to step up efforts to increase their official development \nassistance and to make additional concrete efforts towards official development \nassistance targets; \n \n33. Notes with appreciation the aspirations embedded in Agenda 2063 of the \nAfrican Union to lift huge sections of the population out of poverty, improve incomes \nand catalyse economic and social transformation, and recognizes the importance of \nthe international community helping African countries to achieve such goals, \nespecially in the rural areas of the African continent; \n \n34. Considers that innovative mechanisms of financing can make a positive \ncontribution towards assisting developing countries in mobilizing additional \nresources for financing for development on a voluntary basis and that such financing \nshould supplement and not be a substitute for traditional sources of financing, and, \nwhile highlighting the considerable progress on innovative sources of financing for \n__________________ \n \n20 Organization for Economic Cooperation and Development press release, \u201cDevelopment aid drops \nin 2018, especially to neediest countries\u201d, 10 April 2019. \n\nNew Partnership for Africa\u2019s Development: progress  \nin implementation and international support \nA/RES/74/301\n \n9/11\n20-11526 \n \ndevelopment achieved to date, stresses the importance of scaling up present initiatives \nand developing new mechanisms, as appropriate; \n \n35. Notes with concern Africa\u2019s disproportionately low share of the volume of \ninternational trade, which stood at approximately 2.45 per cent and 2.96 per cent of \nworld merchandise exports and imports, respectively, in 2019; \n \n36. Expresses concern at the increased debt burden of some African countries, \nunderlines the importance of debt crisis prevention and prudent debt management, \ncalls for a comprehensive and sustainable solution to the external debt problems of \nAfrican countries, including the challenge of undeclared or hidden debt, and \nrecognizes the important role, on a case-by-case basis, of debt relief, including debt \ncancellation, as appropriate, the Heavily Indebted Poor Countries Initiative, debt \nrestructuring and any other mechanism; \n \n37. Welcomes the collaboration between the African Private Sector Forum and \nthe United Nations Global Compact, and encourages the further enhancement of this \npartnership in conjunction with the African Union Commission in support of the \ndevelopment of the African private sector and the achievement of the Sustainable \nDevelopment Goals, in line with the relevant executive decisions of the African Union; \n \n38. Calls upon developing countries and countries with economies in transition \nto continue their efforts to create a domestic environment conducive to encouraging \nentrepreneurship, promoting the formalization of informal sector activities in Africa \nand attracting investments by, inter alia, achieving a transparent, stable and predictable \ninvestment climate with proper contract enforcement and respect for property rights, \nembedded in sound macroeconomic policies and institutions; \n \n39. Notes that foreign direct investment is a major source of financing for \ndevelopment, that it has a critical role in achieving inclusive economic growth and \nsustainable development, including through the promotion of job creation and the \neradication of poverty and hunger, and that it contributes to the active participation of \nthe African economies in the global economy and facilitates regional economic \ncooperation and integration, and in this regard calls upon, as appropriate, developed \ncountries to continue to devise source-country measures to encourage and facilitate \nthe flow of foreign direct investment through, inter alia, the provision of export credits \nand other lending instruments, risk guarantees and business development services; \n \n40. Invites all of Africa\u2019s development partners, in particular developed \ncountries, to support the efforts of African countries to promote and maintain \nmacroeconomic stability, to help African countries to attract investments and promote \npolicies conducive to attracting domestic and foreign investment, for example by \nencouraging private financial flows and supporting small and medium-sized \nenterprises, especially those owned by women, to promote investment by their private \nsectors in Africa, to encourage and facilitate the development and transfer of \ntechnology to African countries, on mutually agreed terms, and to assist in \nstrengthening human and institutional capacities for the implementation of the New \nPartnership, consistent with its priorities and objectives and with a view to furthering \nAfrica\u2019s development at all levels; \n \n41. Acknowledges the progress made towards ensuring free movement of \npersons as well as goods and services in Africa, and in this regard recalls with \nappreciation the entry into force on 30 May 2019 of the agreement on the African \nContinental Free Trade Area, which aims at doubling intra-African trade by, inter alia, \nremoving non-tariff and tariff barriers on goods and services, and the launch of its \noperational phase on 7 July 2019; \n \n42. Reiterates the need for all countries and relevant multilateral institutions \nto continue efforts to enhance coherence in their trade policies towards African \n\nA/RES/74/301 \nNew Partnership for Africa\u2019s Development: progress \nin implementation and international support\n \n20-11526\n10/11 \n \ncountries, and acknowledges the importance of efforts to fully integrate African \ncountries into the multilateral trading system and to build their capacity to compete \nthrough such initiatives as Aid for Trade and, given the world economic and financial \ncrisis, the provision of assistance to address the adjustment challenges of trade \nliberalization; \n \n43. Also reiterates that we are setting out together on the path towards \nsustainable development, devoting ourselves collectively to the pursuit of global \ndevelopment and of \u201cwin-win\u201d cooperation which can bring huge gains to all \ncountries and all parts of the world; \n \n44. Emphasizes the importance of facilitating the accession of developing \ncountries to the World Trade Organization, recognizing the contribution that their \naccession would make to the rapid and full integration of those countries into the \nmultilateral trading system, urges in this regard the acceleration of the accession \nprocess on a technical and legal basis and in an expeditious and transparent manner \nfor developing countries that have applied for membership in the World Trade \nOrganization, and reaffirms the importance of that organization\u2019s decision \nWT/L/508/Add.1 of 25 July 2012 on accession by the least developed countries; \n \n45. Welcomes the various important initiatives established between African \ncountries and their development partners, as well as other initiatives, emphasizes the \nimportance of coordination in such initiatives on Africa and the need for their \neffective implementation, and in this regard recognizes the important role that North-\nSouth, South-South and triangular cooperation can play in supporting Africa\u2019s \ndevelopment efforts, particularly the implementation of the New Partnership, while \nbearing in mind that South-South cooperation is not a substitute for but rather a \ncomplement to North-South cooperation; \n \n46. Also welcomes the efforts of the United Nations and the African Union to \nalign the clusters of the Regional Coordination Mechanism for Africa with the \nstrategic frameworks of the African Union and the New Partnership for 2014\u20132017 \nand Agenda 2063, and invites development partners, including the United Nations \nsystem, to continue to support the Regional Coordination Mechanism for Africa in \nachieving its objectives, including through the allocation of necessary funds to \nsupport the implementation of its activities; \n \n47. Requests the Secretary-General to promote greater coherence in the work \nof the United Nations system in support of the New Partnership towards accelerated \nrealization of Agenda 2063, on the basis of the agreed clusters of the Regional \nCoordination Mechanism for Africa, and in this regard calls upon the United Nations \nsystem to continue to mainstream the special needs of Africa in all its normative and \noperational activities; \n \n48. Recalls the establishment of the United Nations monitoring mechanism to \nreview commitments made relating to Africa\u2019s development, and invites Member States \nand all relevant entities of the United Nations system, including funds, programmes, \nspecialized agencies and regional commissions, in particular the Economic \nCommission for Africa, and all relevant international and regional organizations, to \ncontinue to contribute to the effectiveness and reliability of the review process by \ncooperating in the collection of data and the evaluation of performance; \n \n49. Stresses the crucial importance of partnership for the implementation of \nthe Sustainable Development Goals, calls for coordination and sharing of experience \nthat can boost the capacity of countries to achieve the 2030 Agenda for Sustainable \nDevelopment, and in this regard notes with appreciation the sixth session of the Africa \nRegional Forum on Sustainable Development held in Victoria Falls, Zimbabwe, from \n25 to 27 February 2020, and convened by the Economic Commission for Africa in \n\nNew Partnership for Africa\u2019s Development: progress  \nin implementation and international support \nA/RES/74/301\n \n11/11\n20-11526 \n \ncollaboration with regional organizations and the United Nations system on the theme \n\u201c2020\u20132030: a decade to deliver a transformed and prosperous Africa through the \n2030 Agenda and Agenda 2063\u201d; \n \n50. Reiterates its commitment to further strengthen public policies and the \nmobilization and effective use of domestic resources, recognizing that domestic \nresources are first and foremost generated by economic growth, supported by an \nenabling environment at all levels; \n \n51. Urges the international community to continue to give due attention to \nAfrica\u2019s priorities, in line with Agenda 2063 and the 2030 Agenda for Sustainable \nDevelopment; \n \n52. Welcomes the transformation of the New Partnership Agency into the \nAfrican Union Development Agency, with the specific mandate to provide technical \nsupport to the implementation of Agenda 2063 in synergy with the 2030 Agenda for \nSustainable Development; \n \n53. Also welcomes the increasing efforts to improve the quality of official \ndevelopment assistance and increase its development impact, recognizes the \nDevelopment Cooperation Forum of the Economic and Social Council, notes other \ninitiatives, such as the high-level forums on aid effectiveness, which produced, inter \nalia, the Paris Declaration on Aid Effectiveness, the Accra Agenda for Action 21 and \nthe Busan Partnership for Effective Development Cooperation, which make important \ncontributions to the efforts of the countries that have made commitments to them, \nincluding through the adoption of the fundamental principles of national ownership, \nalignment, harmonization, transparency, accountability and managing for results, and \nbears in mind that there is no one-size-fits-all formula that will guarantee effective \nassistance and that the specific situation of each country needs to be fully considered; \n \n54. Requests the Secretary-General to submit to the General Assembly, on an \nannual basis, a comprehensive and action-oriented report on the implementation of \nthe present resolution, based on the provision of inputs from Governments, \norganizations of the United Nations system and other stakeholders in the New \nPartnership, and to submit to the Assembly in 2021 an addendum on the \ncomprehensive review of international support to the New Partnership, including the \nimpact of such support, lessons learned as well as recommendations on the modalities \nfor future engagement.  \n \n62nd plenary meeting \n3 September 2020 \n \n__________________ \n \n21 A/63/539, annex. \n",
  "paragraphs": {
    "1": "Takes note of the seventeenth consolidated progress report of the Secretary-General on implementation and international support for the New Partnership for Africa\u2019s Development;7",
    "2": "Recognizes the efforts of the New Partnership for Africa\u2019s Development, 3 and welcomes in this regard the efforts by development partners to strengthen cooperation with the New Partnership and recognizes the progress made, while acknowledging that much needs to be done in its implementation;",
    "3": "Also recognizes the importance of supporting Agenda 2063 and its first 10-year implementation plan (2014\u20132023) and acknowledges the programme of the New Partnership for Africa\u2019s Development, both of which are integral to the 2030 Agenda for Sustainable Development,8 and underscores in this regard the importance of a coherent and coordinated implementation of Agenda 2063 and the 2030 Agenda;",
    "4": "Emphasizes that economic development, including inclusive industrial development, and policies which seek to enhance productive capacities in Africa can generate employment and income for the poor and, therefore, be an engine for poverty eradication and for achieving internationally agreed development goals, including the Sustainable Development Goals and recognizes in this regard the adoption by the General Assembly of resolution 70/293 of 25 July 2016 on the Third Industrial Development Decade for Africa (2016\u20132025);",
    "5": "Recognizes its commitment to the full implementation of the political declaration on Africa\u2019s development needs, adopted at the high-level meeting on Africa\u2019s development needs on 22 September 2008;9",
    "6": "Welcomes the progress made by African countries in fulfilling their commitments in the implementation of the New Partnership to deepen democracy, human rights, good governance and sound economic management, and encourages African countries, with the participation of stakeholders, including civil society and the private sector, to continue their efforts towards achieving the Sustainable Development Goals, developing and strengthening institutions for governance, creating an environment conducive to involving the private sector, including small and medium-sized enterprises, in the New Partnership implementation process, developing innovative public-private partnerships for financing infrastructure projects and attracting foreign direct investment for development;",
    "7": "Encourages African countries to strengthen and expand local and regional infrastructure and to continue to share best practices with a view to strengthening regional and continental integration, and in this regard notes with appreciation the __________________ 7 A/74/193. 8 Resolution 70/1. 9 Resolution 63/1. New Partnership for Africa\u2019s Development: progress in implementation and international support A/RES/74/301 5/11 20-11526 work of the high-level subcommittee of the African Union on the Presidential Infrastructure Champion Initiative;",
    "8": "Also encourages African countries to maintain the trend of increasing both foreign and domestic investment in infrastructure development, including through strengthened domestic resource mobilization from the public and private sectors, and improving the efficiency of existing infrastructure investment;",
    "9": "Recalls the third Global Infrastructure Forum, held in Bali, Indonesia, on 13 October 2018, and in this regard recalls, as outlined in the Addis Ababa Action Agenda of the Third International Conference on Financing for Development, 10 that a greater range of voices should be heard, particularly from developing countries, to identify and address infrastructure and capacity gaps, in particular in African countries, and that it highlights opportunities for investment and cooperation and works to ensure that investments are environmentally, socially and economically sustainable;",
    "10": "Recognizes the need for Africa\u2019s development partners to align their efforts in infrastructure investment towards supporting the Programme for Infrastructure Development in Africa, recalls the Dakar Agenda for Action to mobilize investment towards infrastructure development projects, and calls upon development partners to support the implementation of the Dakar Agenda;",
    "11": "Encourages African countries to accelerate the achievement of the objective of food security and nutrition in Africa, welcomes the commitment made by African leaders to allocate at least 10 per cent of public expenditure to agriculture and to ensure its efficiency and effectiveness, in this regard recognizes its support for the commitments contained in the Malabo Declaration on Accelerated Agricultural Growth and Transformation for Shared Prosperity and Improved Livelihoods and for the Comprehensive Africa Agriculture Development Programme, and in this regard notes the important progress made by the 44 African countries and the 4 regional economic communities that have signed compacts under the Programme;",
    "12": "Urges continued support of measures to address the challenges of poverty eradication, hunger and malnutrition, job creation and sustainable development in Africa, including, as appropriate, debt relief, improved market access, support for the private sector and entrepreneurship, fulfilment of commitments on official development assistance and increased flows of foreign direct investment, and transfer of technology on mutually agreed terms;",
    "13": "Recognizes the need for Africa\u2019s development partners to align their efforts to implement the commitments contained in the Declaration on Nutrition Security for Inclusive Economic Growth and Sustainable Development in Africa, towards supporting the Comprehensive Africa Agriculture Development Programme and the implementation of the national and regional investment plans of the Programme for alignment of external funding, and recalls the Declaration of the World Summit on Food Security;11",
    "14": "Calls for effective measures and targeted investments to strengthen national health systems and to ensure access to safe drinking water and sanitation to prevent, protect against and combat outbreaks of diseases, including the Ebola virus disease and coronavirus disease (COVID-19); invites development partners to continue to assist African countries in their efforts to strengthen national health systems, to expand surveillance systems in the health sector, in compliance with the __________________ 10 Resolution 69/313, annex. 11 Food and Agriculture Organization of the United Nations, document WSFS 2009/2. A/RES/74/301 New Partnership for Africa\u2019s Development: progress in implementation and international support 20-11526 6/11 International Health Regulations (2005), 12 and to eliminate diseases, and in this context calls upon development partners to support the implementation of the African Health Strategy 2016\u20132030 and the transition towards universal health coverage in Africa;",
    "15": "Notes the unprecedented threat that COVID-19 presents to the continent\u2019s hard-won development and economic gains; welcomes efforts of African leaders in mitigating the impact of the pandemic on their countries and citizens; expresses its highest appreciation to all partners and international organizations, including the United Nations, the World Health Organization, the international financial institutions, the Paris Club and the Group of 20, that have supported the continent in mitigating the effects of COVID-19; notes that there is a need for additional support to reduce the effects of the pandemic on the continent\u2019s achievement of the 2030 Agenda for Sustainable Development and Agenda 2063; and in this regard calls upon the United Nations development system, under the leadership of the Secretary- General, and relevant international organizations and development partners to mobilize a coordinated global response to the pandemic and its adverse social, economic and financial impact on all African societies;",
    "16": "Recalls the adoption of the political declaration of the high-level meeting of the General Assembly on the fight against tuberculosis, as reflected in its resolution 73/3 of 10 October 2018, and the political declaration of the third high-level meeting of the Assembly on the prevention and control of non-communicable diseases, as reflected in its resolution 73/2 of 10 October 2018, and calls upon developed countries and other development partners to continue their support, including financial and technical support, to African countries to scale up their national efforts to fully implement, as appropriate, the actions committed to by the Heads of State and Government and their representatives;",
    "17": "Encourages African countries to continue their efforts in investing in education, including mathematics, vocational training, including engineering, science, technology and innovation to enhance value addition and sustainable industrial development;",
    "18": "Recognizes the important role that African regional economic communities can play in the implementation of the mandate of the New Partnership and of Agenda 2063 and its first 10-year implementation plan in close cooperation with the African Union, and in this regard encourages African countries and the international community to give regional economic communities the support necessary to strengthen their capacity;",
    "19": "Reiterates the need to support developing countries in strengthening the capacity of national statistical offices and data systems to ensure access to high- quality, timely, reliable and disaggregated data;",
    "20": "Requests the United Nations system to continue to provide assistance to the New Partnership and to African countries in developing projects and programmes within the scope of the priorities of the New Partnership, reaffirms the essential role played by the New Partnership Heads of State and Government Orientation Committee, and further requests that emphasis be placed on monitoring and evaluation in support of the New Partnership;",
    "21": "Expresses concern about the increasing challenges posed by the adverse impacts of climate change, drought, land degradation, desertification, the loss of biodiversity and floods, and their negative consequences for the fight against poverty, famine and hunger, which could pose serious additional challenges to the achievement __________________ 12 World Health Organization, document WHA58/2005/REC/1, resolution 58.3, annex. New Partnership for Africa\u2019s Development: progress in implementation and international support A/RES/74/301 7/11 20-11526 of the internationally agreed development goals, including the Sustainable Development Goals, particularly in Africa;",
    "22": "Expresses deep concern about the continuing negative effects of desertification, land degradation and drought on the African continent and underlines the need for short-, medium- and long-term measures, and in this regard calls for the continued effective implementation of the United Nations Convention to Combat Desertification in Those Countries Experiencing Serious Drought and/or Desertification, Particularly in Africa, 13 including its 2018\u20132030 Strategic Framework;14",
    "23": "Recognizes that Africa is one of the regions that contribute the least to climate change, yet is extremely vulnerable and exposed to the adverse impacts of climate change, and in this regard calls upon the international community, including developed countries, to continue to support Africa to address its adaptation needs through, inter alia, the development, transfer and deployment of technology on mutually agreed terms, capacity-building and the provision of adequate and predictable resources, in line with existing commitments, and highlights the need for full implementation of the agreed outcomes of the United Nations Framework Convention on Climate Change,2 including the Paris Agreement;1",
    "24": "Urges Member States that have not yet done so to consider ratifying or acceding to the United Nations Convention against Transnational Organized Crime and the Protocols thereto, 15 the Single Convention on Narcotic Drugs of 1961 as amended by the 1972 Protocol, 16 the Convention on Psychotropic Substances of 1971,17 the United Nations Convention against Illicit Traffic in Narcotic Drugs and Psychotropic Substances of 1988, 18 the United Nations Convention against Corruption19 and the international conventions and protocols related to terrorism, and urges States parties to those conventions and protocols to make efforts towards their effective implementation;",
    "25": "Underscores the importance of support by Africa\u2019s partners, in particular developed countries, of efforts by African countries to strengthen domestic resource mobilization, including through capacity-building and strengthening of international cooperation to combat illicit financial flows and enhance asset recovery and return;",
    "26": "Reiterates the commitment to redouble efforts to substantially reduce illicit financial flows by 2030, with a view to eventually eliminating them, including by combating tax evasion and corruption through strengthened national regulation and increased international cooperation, in line with the Addis Ababa Action Agenda, and the strengthening of international cooperation to combat illicit financial flows;",
    "27": "Recalls the second International Expert Meeting on the Return of Stolen Assets, held in Addis Ababa from 7 to 9 May 2019, and encourages the continuation of its work in advancing efforts to strengthen the recovery and return of stolen assets and the identification of good practices for the return of stolen assets in support of sustainable development;",
    "28": "Reaffirms that achieving gender equality, empowering all women and girls, and the full realization of their human rights are essential to achieving sustained, inclusive and equitable economic growth and sustainable development, reiterates the __________________ 13 United Nations, Treaty Series, vol. 1954, No. 33480. 14 ICCD/COP(13)/21/Add.1, decision 7/COP.13, annex. 15 United Nations, Treaty Series, vols. 2225, 2237, 2241 and 2326, No. 39574. 16 Ibid., vol. 976, No. 14152. 17 Ibid., vol. 1019, No. 14956. 18 Ibid., vol. 1582, No. 27627. 19 Ibid., vol. 2349, No. 42146. A/RES/74/301 New Partnership for Africa\u2019s Development: progress in implementation and international support 20-11526 8/11 need for gender mainstreaming, including targeted actions and investments in the formulation and implementation of all financial, economic, environmental and social policies, and recommits to adopting and strengthening sound policies and enforceable legislation and transformative actions for the promotion of gender equality and women\u2019s and girls\u2019 empowerment at all levels, to ensure women\u2019s equal rights, access and opportunities for participation and leadership in the economy and to eliminate gender- based violence, sexual exploitation and abuse and discrimination in all its forms;",
    "29": "Welcomes the noteworthy progress that has been achieved in implementing the African Peer Review Mechanism, in particular the voluntary adherence of 40 African countries to the Mechanism and the completion of the peer review process in 21 countries, welcomes the progress in implementing the national programmes of action resulting from those reviews, in this regard urges African States that have not yet done so to consider joining the Mechanism process by 2023, as envisaged in the first 10-year implementation plan of Agenda 2063, encourages further strengthening of the Mechanism process for its efficient performance, and takes note of the decisions taken by the Assembly of Heads of State and Government of the African Union at its eleventh extraordinary session, held in Addis Ababa on 17 and 18 November 2018, on the institutional reform of the African Peer Review Mechanism;",
    "30": "Emphasizes African ownership of the African Peer Review Mechanism process, and invites the international community to support the efforts of African countries, at their request, in implementing their respective national programmes of action arising from the process;",
    "31": "Notes with concern that the preliminary data indicate that the net bilateral aid flows to Africa decreased by 4 per cent in 2018 compared with 2017 figures, 20 and notes that there are no updated comparable data on bilateral aid flows to Africa in 2019;",
    "32": "Reiterates that the fulfilment of all official development assistance commitments remains crucial, including the commitment by many developed countries to achieve the target of 0.7 per cent of gross national income for official development assistance and 0.15 to 0.20 per cent of gross national income for official development assistance to least developed countries, is encouraged by those few countries that have met or surpassed their commitment to 0.7 per cent of gross national income for official development assistance and the target of 0.15 to 0.20 per cent of gross national income for official development assistance to least developed countries, and urges all others to step up efforts to increase their official development assistance and to make additional concrete efforts towards official development assistance targets;",
    "33": "Notes with appreciation the aspirations embedded in Agenda 2063 of the African Union to lift huge sections of the population out of poverty, improve incomes and catalyse economic and social transformation, and recognizes the importance of the international community helping African countries to achieve such goals, especially in the rural areas of the African continent;",
    "34": "Considers that innovative mechanisms of financing can make a positive contribution towards assisting developing countries in mobilizing additional resources for financing for development on a voluntary basis and that such financing should supplement and not be a substitute for traditional sources of financing, and, while highlighting the considerable progress on innovative sources of financing for __________________ 20 Organization for Economic Cooperation and Development press release, \u201cDevelopment aid drops in 2018, especially to neediest countries\u201d, 10 April 2019. New Partnership for Africa\u2019s Development: progress in implementation and international support A/RES/74/301 9/11 20-11526 development achieved to date, stresses the importance of scaling up present initiatives and developing new mechanisms, as appropriate;",
    "35": "Notes with concern Africa\u2019s disproportionately low share of the volume of international trade, which stood at approximately 2.45 per cent and 2.96 per cent of world merchandise exports and imports, respectively, in 2019;",
    "36": "Expresses concern at the increased debt burden of some African countries, underlines the importance of debt crisis prevention and prudent debt management, calls for a comprehensive and sustainable solution to the external debt problems of African countries, including the challenge of undeclared or hidden debt, and recognizes the important role, on a case-by-case basis, of debt relief, including debt cancellation, as appropriate, the Heavily Indebted Poor Countries Initiative, debt restructuring and any other mechanism;",
    "37": "Welcomes the collaboration between the African Private Sector Forum and the United Nations Global Compact, and encourages the further enhancement of this partnership in conjunction with the African Union Commission in support of the development of the African private sector and the achievement of the Sustainable Development Goals, in line with the relevant executive decisions of the African Union;",
    "38": "Calls upon developing countries and countries with economies in transition to continue their efforts to create a domestic environment conducive to encouraging entrepreneurship, promoting the formalization of informal sector activities in Africa and attracting investments by, inter alia, achieving a transparent, stable and predictable investment climate with proper contract enforcement and respect for property rights, embedded in sound macroeconomic policies and institutions;",
    "39": "Notes that foreign direct investment is a major source of financing for development, that it has a critical role in achieving inclusive economic growth and sustainable development, including through the promotion of job creation and the eradication of poverty and hunger, and that it contributes to the active participation of the African economies in the global economy and facilitates regional economic cooperation and integration, and in this regard calls upon, as appropriate, developed countries to continue to devise source-country measures to encourage and facilitate the flow of foreign direct investment through, inter alia, the provision of export credits and other lending instruments, risk guarantees and business development services;",
    "40": "Invites all of Africa\u2019s development partners, in particular developed countries, to support the efforts of African countries to promote and maintain macroeconomic stability, to help African countries to attract investments and promote policies conducive to attracting domestic and foreign investment, for example by encouraging private financial flows and supporting small and medium-sized enterprises, especially those owned by women, to promote investment by their private sectors in Africa, to encourage and facilitate the development and transfer of technology to African countries, on mutually agreed terms, and to assist in strengthening human and institutional capacities for the implementation of the New Partnership, consistent with its priorities and objectives and with a view to furthering Africa\u2019s development at all levels;",
    "41": "Acknowledges the progress made towards ensuring free movement of persons as well as goods and services in Africa, and in this regard recalls with appreciation the entry into force on 30 May 2019 of the agreement on the African Continental Free Trade Area, which aims at doubling intra-African trade by, inter alia, removing non-tariff and tariff barriers on goods and services, and the launch of its operational phase on 7 July 2019;",
    "42": "Reiterates the need for all countries and relevant multilateral institutions to continue efforts to enhance coherence in their trade policies towards African A/RES/74/301 New Partnership for Africa\u2019s Development: progress in implementation and international support 20-11526 10/11 countries, and acknowledges the importance of efforts to fully integrate African countries into the multilateral trading system and to build their capacity to compete through such initiatives as Aid for Trade and, given the world economic and financial crisis, the provision of assistance to address the adjustment challenges of trade liberalization;",
    "43": "Also reiterates that we are setting out together on the path towards sustainable development, devoting ourselves collectively to the pursuit of global development and of \u201cwin-win\u201d cooperation which can bring huge gains to all countries and all parts of the world;",
    "44": "Emphasizes the importance of facilitating the accession of developing countries to the World Trade Organization, recognizing the contribution that their accession would make to the rapid and full integration of those countries into the multilateral trading system, urges in this regard the acceleration of the accession process on a technical and legal basis and in an expeditious and transparent manner for developing countries that have applied for membership in the World Trade Organization, and reaffirms the importance of that organization\u2019s decision WT/L/508/Add.1 of 25 July 2012 on accession by the least developed countries;",
    "45": "Welcomes the various important initiatives established between African countries and their development partners, as well as other initiatives, emphasizes the importance of coordination in such initiatives on Africa and the need for their effective implementation, and in this regard recognizes the important role that North- South, South-South and triangular cooperation can play in supporting Africa\u2019s development efforts, particularly the implementation of the New Partnership, while bearing in mind that South-South cooperation is not a substitute for but rather a complement to North-South cooperation;",
    "46": "Also welcomes the efforts of the United Nations and the African Union to align the clusters of the Regional Coordination Mechanism for Africa with the strategic frameworks of the African Union and the New Partnership for 2014\u20132017 and Agenda 2063, and invites development partners, including the United Nations system, to continue to support the Regional Coordination Mechanism for Africa in achieving its objectives, including through the allocation of necessary funds to support the implementation of its activities;",
    "47": "Requests the Secretary-General to promote greater coherence in the work of the United Nations system in support of the New Partnership towards accelerated realization of Agenda 2063, on the basis of the agreed clusters of the Regional Coordination Mechanism for Africa, and in this regard calls upon the United Nations system to continue to mainstream the special needs of Africa in all its normative and operational activities;",
    "48": "Recalls the establishment of the United Nations monitoring mechanism to review commitments made relating to Africa\u2019s development, and invites Member States and all relevant entities of the United Nations system, including funds, programmes, specialized agencies and regional commissions, in particular the Economic Commission for Africa, and all relevant international and regional organizations, to continue to contribute to the effectiveness and reliability of the review process by cooperating in the collection of data and the evaluation of performance;",
    "49": "Stresses the crucial importance of partnership for the implementation of the Sustainable Development Goals, calls for coordination and sharing of experience that can boost the capacity of countries to achieve the 2030 Agenda for Sustainable Development, and in this regard notes with appreciation the sixth session of the Africa Regional Forum on Sustainable Development held in Victoria Falls, Zimbabwe, from 25 to 27 February 2020, and convened by the Economic Commission for Africa in New Partnership for Africa\u2019s Development: progress in implementation and international support A/RES/74/301 11/11 20-11526 collaboration with regional organizations and the United Nations system on the theme \u201c2020\u20132030: a decade to deliver a transformed and prosperous Africa through the 2030 Agenda and Agenda 2063\u201d;",
    "50": "Reiterates its commitment to further strengthen public policies and the mobilization and effective use of domestic resources, recognizing that domestic resources are first and foremost generated by economic growth, supported by an enabling environment at all levels;",
    "51": "Urges the international community to continue to give due attention to Africa\u2019s priorities, in line with Agenda 2063 and the 2030 Agenda for Sustainable Development;",
    "52": "Welcomes the transformation of the New Partnership Agency into the African Union Development Agency, with the specific mandate to provide technical support to the implementation of Agenda 2063 in synergy with the 2030 Agenda for Sustainable Development;",
    "53": "Also welcomes the increasing efforts to improve the quality of official development assistance and increase its development impact, recognizes the Development Cooperation Forum of the Economic and Social Council, notes other initiatives, such as the high-level forums on aid effectiveness, which produced, inter alia, the Paris Declaration on Aid Effectiveness, the Accra Agenda for Action 21 and the Busan Partnership for Effective Development Cooperation, which make important contributions to the efforts of the countries that have made commitments to them, including through the adoption of the fundamental principles of national ownership, alignment, harmonization, transparency, accountability and managing for results, and bears in mind that there is no one-size-fits-all formula that will guarantee effective assistance and that the specific situation of each country needs to be fully considered;",
    "54": "Requests the Secretary-General to submit to the General Assembly, on an annual basis, a comprehensive and action-oriented report on the implementation of the present resolution, based on the provision of inputs from Governments, organizations of the United Nations system and other stakeholders in the New Partnership, and to submit to the Assembly in 2021 an addendum on the comprehensive review of international support to the New Partnership, including the impact of such support, lessons learned as well as recommendations on the modalities for future engagement. 62nd plenary meeting 3 September 2020 __________________ 21 A/63/539, annex."
  },
  "agenda_items": [
    "Item 64"
  ],
  "symbol_references": [
    "A/74/L.68"
  ]
}