{
  "symbol": "A/RES/74/209",
  "filename": "A_RES_74_209.pdf",
  "title": "74/209. International Day of Awareness of Food Loss and Waste",
  "text": "United Nations \nA/RES/74/209 \n \n \nGeneral Assembly \nDistr.: General \n15 January 2020 \n \n19-22422 (E)    170120 \n*1922422* \n \n \nSeventy-fourth session \nAgenda item 19 \nSustainable development \n \n \n \n \n Resolution adopted by the General Assembly \non 19 December 2019 \n \n \n \n \n[on the report of the Second Committee (A/74/381)] \n \n \n 74/209. International Day of Awareness of Food Loss and Waste \n \n \n \nThe General Assembly, \n \nReaffirming its resolution 70/1 of 25 September 2015, entitled \u201cTransforming \nour world: the 2030 Agenda for Sustainable Development\u201d, in which it adopted a \ncomprehensive, far-reaching and people-centred set of universal and transformative \nSustainable Development Goals and targets, its commitment to working tirelessly for \nthe full implementation of this Agenda by 2030, its recognition that eradicating \npoverty in all its forms and dimensions, including extreme poverty, is the greatest \nglobal challenge and an indispensable requirement for sustainable development, its \ncommitment to achieving sustainable development in its three dimensions \u2013 \neconomic, social and environmental \u2013 in a balanced and integrated manner, and to \nbuilding upon the achievements of the Millennium Development Goals and seeking \nto address their unfinished business,  \n \nReaffirming also its resolutions 53/199 of 15 December 1998 and 61/185 of \n20 December 2006 on the proclamation of international years, and Economic and \nSocial Council resolution 1980/67 of 25 July 1980 on international years and \nanniversaries, particularly paragraphs 1 to 10 of the annex thereto on the agreed \ncriteria for the proclamation of international years, as well as paragraphs 13 and 14, \nin which it is stated that an international day or year should not be proclaimed before \nthe basic arrangements for its organization and financing have been made,  \n \nRecalling resolution 11/2019 adopted by the Conference of the Food and \nAgriculture Organization of the United Nations at its forty-first session, held in Rome \nfrom 22 to 29 June 2019,1 \n \nRecalling also resolution 4/2 of 15 March 2019 of the United Nations \nEnvironment Assembly of the United Nations Environment Programme, on promoting \nsustainable practices and innovative solutions for curbing food loss and waste, 2  \n__________________ \n \n1  See Food and Agriculture Organization of the United Nations, document 2019/REP, appendix H. \n \n2  UNEP/EA.4/Res.2. \n\nA/RES/74/209 \nInternational Day of Awareness of Food Loss and Waste\n \n19-22422\n2/3 \n \n \nRecalling further that the ministerial declaration of the 2018 high-level political \nforum on sustainable development3 called upon all stakeholders to adopt a sustainable \nfood systems approach and to develop effective strategies and innovations to reduce \nfood losses and waste,  \n \nReaffirming the commitment to achieve sustainable development in its three \ndimensions \u2013 economic, social and environmental \u2013 in a balanced and integrated \nmanner, and recognizing that the urgent need to reduce the large quantities of food \nloss and waste taking place worldwide is clearly addressed in the 2030 Agenda for \nSustainable Development, including in Sustainable Development Goal 12, and \nspecifically target 12.3,  \n \nRecalling that the 2030 Agenda for Sustainable Development calls for halving \nper capita global food waste at the retail and consumer levels and reducing food losses \nalong production and supply chains, including post-harvest losses, by 2030,  \n \nRecalling also the global launch of the United Nations Decade of Family \nFarming (2019\u20132028), held in Rome on 29 May 2019, and stressing the important \nrole of family farms in the production of more than 80 per cent of the world\u2019s food in \nterms of value, \n \nRecalling further that, in The State of Food and Agriculture in the World 2019: \nMoving Forward on Food Loss and Waste Reduction, produced by the Food and \nAgriculture Organization of the United Nations, food loss is defined as the decrease \nin the quantity or quality of food resulting from decisions and actions by food \nsuppliers in the chain, excluding retail, food service providers and consumers, and \nfood waste as the decrease in the quantity or quality of food resulting from decisions \nand actions by retailers, food services and consumers,  \n \nNoting that, according to an initial estimate in 2011, one third of the food \nproduced annually in the world for human consumption, equivalent to some \n1.3 billion tons, was lost or wasted, while over 821 million people suffered from \nchronic undernourishment and nearly 151 million children under five years of age \nhad stunted growth in 2018,4 \n \nNoting also that the first estimates for the food loss index, as presented in The \nState of Food and Agriculture in the World 2019, measure food loss from post-harvest \nuntil \u2013 but not including \u2013 the retail level and indicate that around 14 per cent of food \nproduced globally in 2016 was lost,  \n \nRecalling that the Food and Agriculture Organization of the United Nations \nleads international efforts to defeat hunger, food insecurity and malnutrition and is \nmandated to raise levels of nutrition and reduce food losses and food waste, taking \ninto account sustainable production and consumption practices,  \n \nNoting the urgent need to address the issue of food loss and waste worldwide \nand the risks that this implies for climate change, agriculture sustainability, human \nlivelihoods and food supplies,  \n \nNoting also that the 2018 Food and Agriculture Organization of the United \nNations study, Gender and Food Loss in Sustainable Food Value Chains: A Guiding \nNote, found that, in order to be effective and have a long-lasting impact, food loss \nreduction strategies and interventions should go beyond technological solutions by \n__________________ \n \n3  See Official Records of the General Assembly, Seventy-third Session, Supplement No. 3 (A/73/3), \nchap. VI, sect. F. \n \n4  Food and Agriculture Organization of the United Nations, The State of Food and Agriculture, \n2019: Moving Forward on Food Loss and Waste Reduction (Rome, 2019). \n\nInternational Day of Awareness of Food Loss and Waste \nA/RES/74/209\n \n3/3\n19-22422 \n \nbringing to the forefront the underlying sociocultural factors of food value chains and \nmainstream a gender perspective,  \n \nRecognizing the fundamental role of sustainable food production that promotes \nfood security and nutrition for the world\u2019s growing population and contributes to \npoverty alleviation, hunger eradication and human health,  \n \nRecognizing also the importance of addressing issues related to food loss and \nwaste at all stages of the supply chain from producer to end user and of working \ntowards sustainable consumption and production, including through collaboration \nwith relevant stakeholders,  \n \nRecognizing further the food loss and waste happening in storing, transport and \nprocess, and in this regard inviting Member States and other relevant stakeholders to \nstrengthen the capacity-building of developing countries to adopt innovative \napproaches and technology in combating food loss and waste,  \n \nRecognizing that efforts at the national and regional levels already exist to \ncombat food loss and waste and that these efforts need to be sustained and supported \nin conjunction with civil society, the private sector and academia,  \n \nAcknowledging the urgent need to raise awareness at all levels and to promote \nand facilitate actions for the elimination of food loss and waste across the world and \nits importance for the achievement of the Sustainable Development Goals,  \n \nRecognizing that the observance of an International Day of Awareness of Food \nLoss and Waste by the international community would contribute significantly to \nraising awareness of the importance of the problem and its possible solutions at all \nlevels and would promote global efforts and collective action towards meeting \ntarget 12.3 of the Sustainable Development Goals,  \n \n1. \nDecides to designate 29 September as the International Day of Awareness \nof Food Loss and Waste;  \n \n2. \nInvites all Member States, organizations of the United Nations system, \nother international and regional organizations and civil society, including \nnon-governmental organizations, individuals and other relevant stakeholders, to \nobserve the International Day, in an appropriate manner and in accordance with \nnational priorities, including through education and activities aimed at raising \nawareness of the importance of reducing food loss and waste and the contribution of \nthese actions to sustainable development;  \n \n3. \nInvites the Food and Agriculture Organization of the United Nations to \nfacilitate the observance of the International Day, in collaboration with the United \nNations Environmental Programme and other relevant organizations, mindful of the \nprovisions contained in the annex to Economic and Social Council resolution 1980/67 \nof 25 July 1980;  \n \n4. \nStresses that the cost of all activities that may arise from the \nimplementation of the present resolution should be met from voluntary contributions, \nincluding from the private sector;  \n \n5. \nRequests the Secretary-General to bring the present resolution to the \nattention of all Member States, the organizations of the United Nations system and \nother relevant stakeholders for appropriate observance. \n \n52nd plenary meeting \n19 December 2019 \n \n",
  "paragraphs": {
    "1": "Decides to designate 29 September as the International Day of Awareness of Food Loss and Waste;",
    "2": "Invites all Member States, organizations of the United Nations system, other international and regional organizations and civil society, including non-governmental organizations, individuals and other relevant stakeholders, to observe the International Day, in an appropriate manner and in accordance with national priorities, including through education and activities aimed at raising awareness of the importance of reducing food loss and waste and the contribution of these actions to sustainable development;",
    "3": "Invites the Food and Agriculture Organization of the United Nations to facilitate the observance of the International Day, in collaboration with the United Nations Environmental Programme and other relevant organizations, mindful of the provisions contained in the annex to Economic and Social Council resolution 1980/67 of 25 July 1980;",
    "4": "Stresses that the cost of all activities that may arise from the implementation of the present resolution should be met from voluntary contributions, including from the private sector;",
    "5": "Requests the Secretary-General to bring the present resolution to the attention of all Member States, the organizations of the United Nations system and other relevant stakeholders for appropriate observance. 52nd plenary meeting 19 December 2019"
  },
  "agenda_items": [
    "Item 19"
  ],
  "symbol_references": []
}