{
  "symbol": "A/RES/73/295",
  "filename": "A_RES_73_295.pdf",
  "title": "73/295. Advisory opinion of the International Court of Justice on the legal consequences of the separation of the Chagos Archipelago from Mauritius in 1965",
  "text": "United Nations \nA/RES/73/295\n \n \nGeneral Assembly \nDistr.: General \n24 May 2019 \n \n19-08474 (E)    290519 \n*1908474* \n \n \nSeventy-third session \nAgenda item 88 \n \n \n \n \n Resolution adopted by the General Assembly \non 22 May 2019 \n \n \n \n \n[without reference to a Main Committee (A/73/L.84/Rev.1 and A/73/L.84/Rev.1/Add.1)] \n \n \n 73/295. Advisory opinion of the International Court of Justice on the legal \nconsequences of the separation of the Chagos Archipelago from \nMauritius in 1965 \n \n \n \nThe General Assembly,  \n \nGuided by the principles enshrined in the Charter of the United Nations, \nincluding the inalienable right of self-determination of peoples, \n \nConsidering that respect for the obligations arising from the Charter and other \ninstruments and rules of international law is among the basic purposes and principles \nof the United Nations, \n \nRecalling its resolution 71/292 of 22 June 2017, by which it decided, in \naccordance with Article 96 of the Charter, to request the International Court of Justice, \npursuant to Article 65 of the Statute of the Court, to render an advisory opinion on \nthe following two questions relating to the legal consequences of the separation of \nthe Chagos Archipelago from Mauritius in 1965: \n \n(a) \n\u201cWas the process of decolonization of Mauritius lawfully completed when \nMauritius was granted independence in 1968, following the separation of the Chagos \nArchipelago from Mauritius and having regard to international law, including \nobligations reflected in General Assembly resolutions 1514 (XV) of 14 December \n1960, 2066 (XX) of 16 December 1965, 2232 (XXI) of 20 December 1966 and \n2357 (XXII) of 19 December 1967?\u201d,  \n \n(b) \n\u201cWhat are the consequences under international law, including obligations \nreflected in the above-mentioned resolutions, arising from the continued \nadministration by the United Kingdom of Great Britain and Northern Ireland of the \nChagos Archipelago, including with respect to the inability of Mauritius to implement \na programme for the resettlement on the Chagos Archipelago of its nationals, in \nparticular those of Chagossian origin?\u201d, \n\nA/RES/73/295 \nAdvisory opinion of the International Court of Justice on the legal consequences \nof the separation of the Chagos Archipelago from Mauritius in 1965\n \n19-08474\n2/3 \n \n \nHaving received the advisory opinion of the Court, rendered on 25 February \n2019,1 in which the Court found that: \n \n(a) \n\u201cThe process of decolonization of Mauritius was not lawfully completed \nwhen that country acceded to independence in 1968, following the separation of the \nChagos Archipelago\u201d,  \n \n(b) \n\u201cThe United Kingdom is under an obligation to bring to an end its \nadministration of the Chagos Archipelago as rapidly as possible\u201d,  \n \n(c) \n\u201cAll Member States are under an obligation to co-operate with the United \nNations in order to complete the decolonization of Mauritius\u201d,  \n \n(d) \n\u201cAs regards the resettlement on the Chagos Archipelago of Mauritian \nnationals, including those of Chagossian origin, this is an issue relating to the \nprotection of the human rights of those concerned, which should be addressed by the \nGeneral Assembly during the completion of the decolonization of Mauritius\u201d,  \n \nConsidering that respect for the Court and its functions, including in the exercise \nof its advisory jurisdiction, is essential to international law and justice and to an \ninternational order based on the rule of law, \n \nReaffirming the responsibility of the United Nations, in accordance with \nresolution 1514 (XV), to assist in the process of decolonization of Mauritius, \n \n1. \nWelcomes the advisory opinion of the International Court of Justice of \n25 February 2019 on the legal consequences of the separation of the Chagos \nArchipelago from Mauritius in 1965;1  \n \n2. \nAffirms, in accordance with the advisory opinion of the Court, that: \n \n(a) \nBecause the detachment of the Chagos Archipelago was not based on the \nfree and genuine expression of the will of the people of Mauritius, the decolonization \nof Mauritius has not been lawfully completed;  \n \n(b) \nThe Chagos Archipelago forms an integral part of the territory of \nMauritius;  \n \n(c) \nSince the decolonization of Mauritius was not conducted in a manner \nconsistent with the right of peoples to self-determination, it follows that the continued \nadministration of the Chagos Archipelago by the United Kingdom of Great Britain \nand Northern Ireland constitutes a wrongful act entailing the international \nresponsibility of that State;  \n \n(d) \nThe United Kingdom is under an obligation to bring to an end its \nadministration of the Chagos Archipelago as rapidly as possible;  \n \n(e) \nSince respect for the right to self-determination is an obligation erga \nomnes, all States have a legal interest in protecting that right and all Member States \nare under an obligation to cooperate with the United Nations in order to complete the \ndecolonization of Mauritius;  \n \n(f) \nThe resettlement of Mauritian nationals, including those of Chagossian \norigin, must be addressed as a matter of urgency during the completion of the \ndecolonization process; \n \n3. \nDemands that the United Kingdom of Great Britain and Northern Ireland \nwithdraw its colonial administration from the Chagos Archipelago unconditionally \nwithin a period of no more than six months from the adoption of the present \nresolution, thereby enabling Mauritius to complete the decolonization of its territory \nas rapidly as possible; \n__________________ \n \n1  See A/73/773. \n\nAdvisory opinion of the International Court of Justice on the legal consequences \nof the separation of the Chagos Archipelago from Mauritius in 1965 \nA/RES/73/295\n \n3/3\n19-08474 \n \n \n4. \nUrges the United Kingdom of Great Britain and Northern Ireland to \ncooperate with Mauritius in facilitating the resettlement of Mauritian nationals, \nincluding those of Chagossian origin, in the Chagos Archipelago, and to pose no \nimpediment or obstacle to such resettlement; \n \n5. \nCalls upon all Member States to cooperate with the United Nations to \nensure the completion of the decolonization of Mauritius as rapidly as possible, and \nto refrain from any action that will impede or delay the completion of the process of \ndecolonization of Mauritius in accordance with the advisory opinion of the Court and \nthe present resolution; \n \n6. \nCalls upon the United Nations and all its specialized agencies to recognize \nthat the Chagos Archipelago forms an integral part of the territory of Mauritius, to \nsupport the decolonization of Mauritius as rapidly as possible, and to refrain from \nimpeding that process by recognizing, or giving effect to any measure taken by or on \nbehalf of, the \u201cBritish Indian Ocean Territory\u201d; \n \n7. \nCalls upon all other international, regional and intergovernmental \norganizations, including those established by treaty, to recognize that the Chagos \nArchipelago forms an integral part of the territory of Mauritius, to support the \ndecolonization of Mauritius as rapidly as possible, and to refrain from impeding that \nprocess by recognizing, or giving effect to any measure taken by or on behalf of, the \n\u201cBritish Indian Ocean Territory\u201d; \n \n8. \nRequests the Secretary-General to submit a report to the General Assembly \nat its seventy-fourth session on the implementation of the present resolution, \nincluding any actions taken by the United Kingdom of Great Britain and Northern \nIreland and other Member States.  \n \n83rd plenary meeting \n22 May 2019 \n \n",
  "paragraphs": {
    "1": "Welcomes the advisory opinion of the International Court of Justice of 25 February 2019 on the legal consequences of the separation of the Chagos Archipelago from Mauritius in 1965;1",
    "2": "Affirms, in accordance with the advisory opinion of the Court, that: (a) Because the detachment of the Chagos Archipelago was not based on the free and genuine expression of the will of the people of Mauritius, the decolonization of Mauritius has not been lawfully completed; (b) The Chagos Archipelago forms an integral part of the territory of Mauritius; (c) Since the decolonization of Mauritius was not conducted in a manner consistent with the right of peoples to self-determination, it follows that the continued administration of the Chagos Archipelago by the United Kingdom of Great Britain and Northern Ireland constitutes a wrongful act entailing the international responsibility of that State; (d) The United Kingdom is under an obligation to bring to an end its administration of the Chagos Archipelago as rapidly as possible; (e) Since respect for the right to self-determination is an obligation erga omnes, all States have a legal interest in protecting that right and all Member States are under an obligation to cooperate with the United Nations in order to complete the decolonization of Mauritius; (f) The resettlement of Mauritian nationals, including those of Chagossian origin, must be addressed as a matter of urgency during the completion of the decolonization process;",
    "3": "Demands that the United Kingdom of Great Britain and Northern Ireland withdraw its colonial administration from the Chagos Archipelago unconditionally within a period of no more than six months from the adoption of the present resolution, thereby enabling Mauritius to complete the decolonization of its territory as rapidly as possible;",
    "4": "Urges the United Kingdom of Great Britain and Northern Ireland to cooperate with Mauritius in facilitating the resettlement of Mauritian nationals, including those of Chagossian origin, in the Chagos Archipelago, and to pose no impediment or obstacle to such resettlement;",
    "5": "Calls upon all Member States to cooperate with the United Nations to ensure the completion of the decolonization of Mauritius as rapidly as possible, and to refrain from any action that will impede or delay the completion of the process of decolonization of Mauritius in accordance with the advisory opinion of the Court and the present resolution;",
    "6": "Calls upon the United Nations and all its specialized agencies to recognize that the Chagos Archipelago forms an integral part of the territory of Mauritius, to support the decolonization of Mauritius as rapidly as possible, and to refrain from impeding that process by recognizing, or giving effect to any measure taken by or on behalf of, the \u201cBritish Indian Ocean Territory\u201d;",
    "7": "Calls upon all other international, regional and intergovernmental organizations, including those established by treaty, to recognize that the Chagos Archipelago forms an integral part of the territory of Mauritius, to support the decolonization of Mauritius as rapidly as possible, and to refrain from impeding that process by recognizing, or giving effect to any measure taken by or on behalf of, the \u201cBritish Indian Ocean Territory\u201d;",
    "8": "Requests the Secretary-General to submit a report to the General Assembly at its seventy-fourth session on the implementation of the present resolution, including any actions taken by the United Kingdom of Great Britain and Northern Ireland and other Member States."
  },
  "agenda_items": [
    "Item 88"
  ],
  "symbol_references": [
    "A/73/L.84"
  ]
}