{
  "symbol": "A/RES/77/94",
  "filename": "A_RES_77_94.pdf",
  "title": "77/94. Comprehensive Nuclear-Test-Ban Treaty",
  "text": "United Nations \nA/RES/77/94\n \n \nGeneral Assembly \nDistr.: General \n16 December 2022 \n \n \n22-28202 (E)    211222     \n*2228202* \n \n \nSeventy-seventh session \nAgenda item 105 \nComprehensive Nuclear-Test-Ban Treaty  \n \n \n \n \n Resolution adopted by the General Assembly \non 7 December 2022 \n \n \n \n \n[on the report of the First Committee (A/77/391, para. 7)] \n \n \n \n77/94. Comprehensive Nuclear-Test-Ban Treaty \n \n \n \nThe General Assembly,  \n \nReiterating that the cessation of nuclear-weapon test explosions or any other \nnuclear explosions constitutes an effective nuclear disarmament and non-proliferation \nmeasure, and convinced that this is a meaningful step in the realization of a systematic \nprocess for achieving nuclear disarmament,  \n \nRecalling that the Comprehensive Nuclear-Test-Ban Treaty, adopted by the \nGeneral Assembly by its resolution 50/245 of 10 September 1996, was opened for \nsignature on 24 September 1996,  \n \nStressing that a universal and effectively verifiable Treaty constitutes a \nfundamental instrument in the field of nuclear disarmament and non-proliferation and \nwill be a major contribution to international peace and security,  \n \nStressing also the vital importance and urgency of achieving the entry into force \nof the Treaty, and affirming its resolute determination, 26 years after the Treaty was \nopened for signature, to achieve its entry into force,  \n \nEncouraged by the signing of the Treaty by 186 States, including 41 of the 44 \nwhose ratification is needed for its entry into force, and welcoming the ratification of \nthe Treaty by 176 States, including 36 of the 44 whose ratification is needed for its \nentry into force, among which there are 3 nuclear-weapon States,  \n \nRecalling its resolution 76/66 of 6 December 2021,  \n \nRecalling also the adoption by consensus of the conclusions and \nrecommendations for follow-on actions of the 2010 Review Conference of the Parties \n\nA/RES/77/94 \nComprehensive Nuclear-Test-Ban Treaty\n \n22-28202\n2/3 \n \nto the Treaty on the Non-Proliferation of Nuclear Weapons,1 in which the Conference, \ninter alia, reaffirmed the vital importance of the entry into force of the Comprehensive \nNuclear-Test-Ban Treaty as a core element of the international nuclear disarmament \nand non-proliferation regime and included specific actions to be taken in support of \nthe entry into force of the Treaty,  \n \nRecalling further the Final Declaration adopted by the twelfth Conference on \nFacilitating the Entry into Force of the Comprehensive Nuclear-Test-Ban Treaty, held \nin New York on 23 and 24 September 2021, convened pursuant to article XIV of the \nTreaty, and recalling the joint statement issued by the Friends of the Comprehensive \nNuclear-Test-Ban Treaty on 21 September 2022, \n \nNoting the contribution of diverse and inclusive participation in building and \nsustaining momentum for the universalization and entry into force of the Treaty, \nincluding through the Youth Group of the Preparatory Commission for the \nComprehensive Nuclear-Test-Ban Treaty Organization,  \n \nWelcoming continuing progress in the development of the Treaty\u2019s verification \nregime, which advances the Treaty\u2019s primary non-proliferation and disarmament \nobjective, and the establishment of 303 certified facilities of the International \nMonitoring System network,  \n \nRecognizing the civil and scientific benefits provided by the Treaty\u2019s global \nmonitoring system,  \n \n1. \nStresses the vital importance and urgency of signature and ratification, \nwithout delay and without conditions, in order to achieve the earliest entry into force \nof the Comprehensive Nuclear-Test-Ban Treaty;2  \n \n2. \nWelcomes the contributions by the signatory States to the work of the \nPreparatory Commission for the Comprehensive Nuclear-Test-Ban Treaty Organization, \nin particular its efforts to ensure that the verification regime of the Treaty will be \ncapable of meeting the verification requirements of the Treaty upon its entry into \nforce, in accordance with article IV of the Treaty, and encourages their continuation;  \n \n3. \nUnderlines the need to maintain momentum towards the completion of all \nelements of the verification regime;  \n \n4. \nUrges all States not to carry out nuclear-weapon test explosions or any \nother nuclear explosions, to maintain their moratoriums in this regard and to refrain \nfrom acts that would defeat the object and purpose of the Treaty, while stressing that \nthese measures do not have the same permanent and legally binding effect as the entry \ninto force of the Treaty;  \n \n5. \nReiterates its condemnation of the six nuclear tests conducted by the \nDemocratic People\u2019s Republic of Korea in violation of relevant Security Council \nresolutions, 3  urges full compliance with the obligations under those resolutions, \nincluding that the Democratic People\u2019s Republic of Korea abandon its nuclear \nweapons programme and not conduct any further nuclear tests, reaffirms its support \nfor the complete, verifiable and irreversible denuclearization of the Korean Peninsula \nin a peaceful manner, welcomes all efforts and dialogue to this end, and encourages \nall parties to continue diplomatic efforts;  \n__________________ \n \n1 2010 Review Conference of the Parties to the Treaty on the Non-Proliferation of Nuclear \nWeapons, Final Document, vol. I (NPT/CONF.2010/50 (Vol. I)), part I, Conclusions and \nrecommendations for follow-on actions. \n \n2 See resolution 50/245 and A/50/1027. \n \n3 Including Security Council resolutions 1718 (2006), 1874 (2009), 2094 (2013), 2270 (2016), \n2321 (2016) and 2375 (2017). \n\nComprehensive Nuclear-Test-Ban Treaty \nA/RES/77/94\n \n3/3\n22-28202 \n \n \n6. \nUrges all States that have not yet signed or ratified, or that have signed but \nnot yet ratified, the Treaty, in particular those whose ratification is needed for its entry \ninto force, to sign and ratify it as soon as possible and to accelerate their ratification \nprocesses with a view to ensuring their earliest successful conclusion;  \n \n7. \nWelcomes, since the adoption of its previous resolution on the subject, the \nsignature and ratification of the Treaty by Dominica and the ratification of the Treaty \nby Equatorial Guinea, the Gambia, Sao Tome and Principe, Timor-Leste and Tuvalu, \nsince each signature or ratification is a significant step towards the entry into force \nand universalization of the Treaty; \n \n8. \nEncourages further expressions from among the remaining States whose \nratification is needed for the Treaty to enter into force of their intention to pursue and \ncomplete the ratification process; \n \n9. \nUrges all States to remain seized of the issue at the highest political level \nand, where in a position to do so, to promote adherence to the Treaty through bilateral \nand joint outreach, seminars and other means; \n \n10. Decides to include in the provisional agenda of its seventy-eighth session \nthe item entitled \u201cComprehensive Nuclear-Test-Ban Treaty\u201d.  \n \n46th plenary meeting \n7 December 2022 \n \n",
  "paragraphs": {
    "1": "Stresses the vital importance and urgency of signature and ratification, without delay and without conditions, in order to achieve the earliest entry into force of the Comprehensive Nuclear-Test-Ban Treaty;2",
    "2": "Welcomes the contributions by the signatory States to the work of the Preparatory Commission for the Comprehensive Nuclear-Test-Ban Treaty Organization, in particular its efforts to ensure that the verification regime of the Treaty will be capable of meeting the verification requirements of the Treaty upon its entry into force, in accordance with article IV of the Treaty, and encourages their continuation;",
    "3": "Underlines the need to maintain momentum towards the completion of all elements of the verification regime;",
    "4": "Urges all States not to carry out nuclear-weapon test explosions or any other nuclear explosions, to maintain their moratoriums in this regard and to refrain from acts that would defeat the object and purpose of the Treaty, while stressing that these measures do not have the same permanent and legally binding effect as the entry into force of the Treaty;",
    "5": "Reiterates its condemnation of the six nuclear tests conducted by the Democratic People\u2019s Republic of Korea in violation of relevant Security Council resolutions, 3 urges full compliance with the obligations under those resolutions, including that the Democratic People\u2019s Republic of Korea abandon its nuclear weapons programme and not conduct any further nuclear tests, reaffirms its support for the complete, verifiable and irreversible denuclearization of the Korean Peninsula in a peaceful manner, welcomes all efforts and dialogue to this end, and encourages all parties to continue diplomatic efforts;",
    "6": "Urges all States that have not yet signed or ratified, or that have signed but not yet ratified, the Treaty, in particular those whose ratification is needed for its entry into force, to sign and ratify it as soon as possible and to accelerate their ratification processes with a view to ensuring their earliest successful conclusion;",
    "7": "Welcomes, since the adoption of its previous resolution on the subject, the signature and ratification of the Treaty by Dominica and the ratification of the Treaty by Equatorial Guinea, the Gambia, Sao Tome and Principe, Timor-Leste and Tuvalu, since each signature or ratification is a significant step towards the entry into force and universalization of the Treaty;",
    "8": "Encourages further expressions from among the remaining States whose ratification is needed for the Treaty to enter into force of their intention to pursue and complete the ratification process;",
    "9": "Urges all States to remain seized of the issue at the highest political level and, where in a position to do so, to promote adherence to the Treaty through bilateral and joint outreach, seminars and other means;",
    "10": "Decides to include in the provisional agenda of its seventy-eighth session the item entitled \u201cComprehensive Nuclear-Test-Ban Treaty\u201d."
  },
  "agenda_items": [
    "Item 105"
  ],
  "symbol_references": []
}