{
  "symbol": "A/RES/73/233",
  "filename": "A_RES_73_233.pdf",
  "title": "73/233. Implementation of the United Nations Convention to Combat Desertification in Those Countries Experiencing Serious Drought and/or Desertification, Particularly in Africa",
  "text": "United Nations \nA/RES/73/233\n \n \nGeneral Assembly \nDistr.: General \n10 January 2019 \n \n18-22556 (E)    140119     \n*1822556* \n \n \nSeventy-third session \nAgenda item 20 (e) \n \n \n \n \n Resolution adopted by the General Assembly \non 20 December 2018 \n \n \n \n \n[on the report of the Second Committee (A/73/538/Add.5)] \n \n \n 73/233. Implementation of the United Nations Convention to Combat \nDesertification in Those Countries Experiencing Serious \nDrought and/or Desertification, Particularly in Africa  \n \n \n \nThe General Assembly, \n \nRecalling its resolution 72/220 of 20 December 2017, as well as other \nresolutions relating to the implementation of the United Nations Convention to \nCombat Desertification in Those Countries Experiencing Serious Drought and/or \nDesertification, Particularly in Africa,1  \n \nReaffirming its resolution 70/1 of 25 September 2015, entitled \u201cTransforming \nour world: the 2030 Agenda for Sustainable Development\u201d, in which it adopted a \ncomprehensive, far-reaching and people-centred set of universal and transformative \nSustainable Development Goals and targets, its commitment to working tirelessly for \nthe full implementation of the Agenda by 2030, its recognition that eradicating \npoverty in all its forms and dimensions, including extreme poverty, is the greatest \nglobal challenge and an indispensable requirement for sustainable development, and \nits commitment to achieving sustainable development in its three dimensions \u2014 \neconomic, social and environmental \u2014 in a balanced and integrated manner and to \nbuilding upon the achievements of the Millennium Development Goals and seeking \nto address their unfinished business,  \n \nRecalling that, in the 2030 Agenda for Sustainable Development, the \ninternational community committed to combating desertification, restoring degraded \nland and soil, including land affected by desertification, drought and floods, and \nstriving to achieve a land degradation-neutral world by 2030,  \n \nAcknowledging that action to combat desertification, restore degraded land and \nsoil, including land affected by desertification, drought and floods, and achieve a land \ndegradation-neutral world can deliver multiple benefits and that land degradation \n__________________ \n \n1  United Nations, Treaty Series, vol. 1954, No. 33480. \n\nA/RES/73/233 \nImplementation of the United Nations Convention to Combat Desertification in Those \nCountries Experiencing Serious Drought and/or Desertification, Particularly in Africa\n \n18-22556\n2/6 \n \nneutrality has the potential to act as an accelerator for achieving the Sustainable \nDevelopment Goals and as a catalyst for attracting sustainable development financing \nand climate finance to implement the Convention,  \n \nReaffirming its resolution 69/313 of 27 July 2015 on the Addis Ababa Action \nAgenda of the Third International Conference on Financing for Development, which \nis an integral part of the 2030 Agenda for Sustainable Development, supports and \ncomplements it, helps to contextualize its means of implementation targets with \nconcrete policies and actions, and reaffirms the strong political commitment to \naddress the challenge of financing and creating an enabling environment at all levels \nfor sustainable development in the spirit of global partnership and solidarity,  \n \nBearing in mind its resolution 62/195 of 19 December 2007, in which it declared \nthe decade 2010\u20132020 as the United Nations Decade for Deserts and the Fight against \nDesertification, and its resolution 64/201 of 21 December 2009, in which it \ndesignated the secretariat of the United Nations Convention to Combat \nDesertification in Those Countries Experiencing Serious Drought and/or \nDesertification, Particularly in Africa, as the focal point of the Decade, and invited \nStates parties to the Convention, observers and other relevant stakeholders to organize \nactivities to observe the Decade,  \n \nWelcoming the Paris Agreement, 2  and encouraging all its parties to fully \nimplement the Agreement, and parties to the United Nations Framework Convention \non Climate Change 3  that have not yet done so to deposit their instruments of \nratification, acceptance, approval or accession, where appropriate, as soon as \npossible,  \n \nHighlighting the synergies between the implementation of the 2030 Agenda for \nSustainable Development and the Paris Agreement, and noting with concern the \nscientific findings contained in the special report entitled Global Warming of 1.5\u00b0C \nof the Intergovernmental Panel on Climate Change, \n \nLooking forward to the climate summit called for by the Secretary-General, to \nbe held in New York in 2019, to accelerate global action on climate change, \n \nWelcoming the United Nations strategic plan for forests 2017\u20132030, 4  and \nacknowledging that all types of forests provide essential ecosystem services, such as \ntimber, food, fuel, fodder, non-wood products and shelter, as well as soil and water \nconservation and clean air, that the sustainable management of forests and trees \noutside forests is vital to the integrated implementation of the 2030 Agenda for \nSustainable Development and that all forests prevent land degradation and \ndesertification and reduce the risk of floods, landslides and avalanches, droughts, \nsand and dust storms and other disasters, \n \nTaking note of the Assessment Report on Land Degradation and Restoration5 of \nthe Intergovernmental Science-Policy Platform on Biodiversity and Ecosystem \nServices, which reaffirms the global dimension of land degradation and reconfirms \nthe economic sense of urgent and concerted action and investment in avoiding land \ndegradation and restoring degraded lands,  \n \nNoting that combating desertification, land degradation and drought, including \nthrough sustainable land management, can contribute to easing forced migration \nflows influenced by a number of factors, including economic, social, security and \n__________________ \n \n2  Adopted under the UNFCCC in FCCC/CP/2015/10/Add.1, decision 1/CP.21. \n \n3  United Nations, Treaty Series, vol. 1771, No. 30822. \n \n4  See resolution 71/285. \n \n5  Intergovernmental Science-Policy Platform on Biodiversity and Ecosystem Services (Bonn, \nGermany, 2018). \n\nImplementation of the United Nations Convention to Combat Desertification in Those \nCountries Experiencing Serious Drought and/or Desertification, Particularly in Africa \nA/RES/73/233\n \n3/6\n18-22556 \n \nenvironmental concerns, which can, in turn, reduce current and potential fighting over \nresources in degraded areas,  \n \nEncouraging countries to give due consideration to the dissemination, \npromotion and implementation of the Voluntary Guidelines on the Responsible \nGovernance of Tenure of Land, Fisheries and Forests in the Context of National Food \nSecurity,6  \n \nRecognizing that drought resilience is an important element in the \nimplementation of the United Nations Convention to Combat Desertification in Those \nCountries Experiencing Serious Drought and/or Desertification, Particularly in \nAfrica, as well as of target 15.3 on land degradation neutrality, 7  \n \nHighlighting the important role of civil society in the implementation of the \nConvention and its 2018\u20132030 Strategic Framework,8  \n \nRecognizing that sand and dust storms can be exacerbated by desertification, \nland degradation and drought and that sustainable land management in the context of \nland degradation neutrality, including land management and sustainable water use, \ncan contribute to effective responses to sand and dust storms,  \n \nWelcoming the fact that 119 States have subscribed to the voluntary land \ndegradation neutrality target-setting programme under the United Nations \nConvention to Combat Desertification in Those Countries Experiencing Serious \nDrought and/or Desertification, Particularly in Africa, \n \nRecognizing the value of knowledge, education, science and new technology to \nsustainable development and good land management, including making use of, inter \nalia, the Voluntary Guidelines for Sustainable Soil Management of the Food and \nAgriculture Organization of the United Nations, emphasizing the importance of \nscience-based decision-making and that science and technology to combat \ndesertification, land degradation and drought should therefore be further promoted, \nacknowledging the work of the Science-Policy Interface of the Convention, and \nwelcoming the organization of the technology fair at the thirteenth session of the \nConference of the Parties to the United Nations Convention to Combat Desertification \nin Those Countries Experiencing Serious Drought and/or Desertification, Particularly \nin Africa,  \n \nExpressing deep concern about the continuous trend of land degradation, as \nreflected in the findings of the Sustainable Development Goals Report 2018,9  \n \nReaffirming the importance of government leadership, multi-stakeholder \npartnerships and increasing private engagement for the sustainable management, \nrestoration and rehabilitation of ecosystems, biodiversity and land,  \n \nExpressing its appreciation to the Government of China for hosting the \nthirteenth session of the Conference of the Parties to the Convention, held in Ordos, \nChina, from 6 to 16 September 2017,  \n \nNoting with appreciation the global observance event to mark the World Day to \nCombat Desertification and Drought, held in Quito on 17 June 2018 on the theme \n\u201cLand has true value. Invest in it\u201d,  \n \n1. \nTakes note of the report of the Secretary-General on the implementation of \nresolution 72/220 on the United Nations Convention to Combat Desertification in \n__________________ \n \n6  Food and Agriculture Organization of the United Nations, document CL 144/9 (C 2013/20), \nappendix D. \n \n7  See resolution 70/1. \n \n8  ICCD/COP(13)/21/Add.1, decision 7/COP.13, annex. \n \n9  United Nations publication, Sales No. E.18.I.6. \n\nA/RES/73/233 \nImplementation of the United Nations Convention to Combat Desertification in Those \nCountries Experiencing Serious Drought and/or Desertification, Particularly in Africa\n \n18-22556\n4/6 \n \nThose Countries Experiencing Serious Drought and/or Desertification, Particularly \nin Africa;10  \n \n2. \nAffirms that achieving land degradation neutrality would serve as an \naccelerator and integrator for achieving the Sustainable Development Goals and as a \ncatalyst for attracting sustainable development financing and climate finance to \nimplement the Convention, and respond to the overall objectives of the 2030 Agenda \nfor Sustainable Development;7  \n \n3. \nEncourages the organizations of the United Nations system, when \ndesigning and implementing their programmes and projects, to take into account the \nrole of land degradation neutrality as a potential accelerator of the Sustainable \nDevelopment Goals; \n \n4. \nInvites Member States to support efforts to implement the strategic \nobjective of the United Nations Convention to Combat Desertification in Those \nCountries Experiencing Serious Drought and/or Desertification, Particularly in \nAfrica,1 on drought; \n \n5. \nWelcomes the outcomes of the thirteenth session of the Conference of the \nParties to the United Nations Convention to Combat Desertification in Those \nCountries Experiencing Serious Drought and/or Desertification, Particularly in \nAfrica,11 as well as the launch of the Land Degradation Neutrality Fund, a global \nimpact investment vehicle for projects addressing land degradation, and takes note \nwith appreciation of the launch of the first edition of Global Land Outlook,12 which \nprovides, among other things, an assessment of the state of land globally as well as \nsolutions for the sustainable management of land resources to help achieve the \nSustainable Development Goals;  \n \n6. \nTakes note with appreciation of the adoption of the Ordos Declaration at \nthe thirteenth session of the Conference of the Parties to the Convention urging \ncountries to step up efforts on all fronts to tackle desertification, land degradation and \ndrought, which are seen as major environmental, economic and social challenges for \nglobal sustainable development;13  \n \n7. \nRecognizes the importance of applying new and innovative technologies, \nenabling policies and approaches, as well as sharing best practices, in combating \ndesertification, land degradation and drought, and requests the Secretary-General to \nidentify those technologies, enabling policies and best practices in his report on the \nimplementation of the present resolution;  \n \n8. \nUnderlines the importance of comprehensive reporting, follow-up and \nreview at the global, national and regional levels, as appropriate, in order to track \nprogress in the implementation of the Convention, to ensure that its overall objectives \nto reverse desertification and mitigate the effects of drought to achieve sustainable \ndevelopment in the affected areas are duly attained;  \n \n9. \nTakes note, as appropriate, of the decision of the Conference of the Parties \nto the Convention, at its thirteenth session, to promote the positive role that measures \ntaken to implement the United Nations Convention to Combat Desertification in \nThose Countries Experiencing Serious Drought and/or Desertification, Particularly in \nAfrica, can play in addressing desertification, land degradation and drought as one of \nthe drivers that can cause migration, and invites all stakeholders to take note of this \nwhen addressing drivers of migration within the ongoing processes; \n__________________ \n \n10  A/73/255, sect. II. \n \n11  ICCD/COP(13)/21/Add.1. \n \n12  Secretariat of the United Nations Convention to Combat Desertification (Bonn, Germany, 2017). \n \n13  ICCD/COP(13)/21/Add.1, decision 27/COP.13, annex. \n\nImplementation of the United Nations Convention to Combat Desertification in Those \nCountries Experiencing Serious Drought and/or Desertification, Particularly in Africa \nA/RES/73/233\n \n5/6\n18-22556 \n \n \n10. Underlines the need to address the economic, social and environmental \nimpacts of climate change, and emphasizes the need for national and international \naction to enhance efforts to build resilience;  \n \n11. \nEncourages the public and private sectors to continue to invest in \ndeveloping, adapting and scaling up the application of technologies, enabling \npolicies, methods and tools to combat desertification, land degradation and drought \nin different regions, and to boost knowledge exchange, including of traditional \nknowledge with the consent of the knowledge holders, capacity-building and sharing \nof technologies on mutually agreed terms;  \n \n12. Encourages developed countries party to the United Nations Convention \nto Combat Desertification in Those Countries Experiencing Serious Drought and/or \nDesertification, Particularly in Africa, to actively support the efforts of developing \ncountries party to the Convention in promoting sustainable land management \npractices and in seeking to achieve a land degradation-neutral world by providing \nsubstantial financial resources, facilitated access to appropriate technology and other \nforms of support, including through capacity-building measures;  \n \n13. Welcomes the adoption of the 2018\u20132030 Strategic Framework of the \nConvention, including a new strategic objective on drought, and strongly encourages \nthe parties to the Convention to apply and align with the Strategic Framework in their \nnational policies, programmes, plans and processes relating to desertification, land \ndegradation and drought, including in their national action programmes, as \nappropriate, and to implement the Strategic Framework, taking into account the Addis \nAbaba Action Agenda of the Third International Conference on Financing for \nDevelopment;14  \n \n14. Recognizes that gender equality and the empowerment of women and girls \nremains a crucial contribution to the effective implementation of the Convention, \nincluding its 2018\u20132030 Strategic Framework, and to the achievement of the goals of \nthe 2030 Agenda for Sustainable Development, welcomes the adoption of the Gender \nAction Plan by the Conference of the Parties to the Convention at its thirteenth \nsession, and calls upon parties to the Convention and partners to pursue the equal \nparticipation of women and men in planning, decision-making and implementation at \nall levels and to further promote gender equality and the empowerment of all women \nand girls in desertification, land degradation and drought-related policies and \nactivities as a means to strengthen the effective and efficient implementation of action \non the ground;  \n \n15. Invites multilateral and bilateral partners to support parties to the \nConvention in the implementation of the 2018\u20132030 Strategic Framework of the \nConvention;  \n \n16. Encourages parties to the Convention to continue to promote the \nprevention of desertification, land degradation and drought with an integrated \nlandscape approach, including the rehabilitation and restoration of degraded land and \nsustainable land management;  \n \n17. Calls upon parties to the Convention to enhance and support the \npreparation of drought preparedness policies on, inter alia, early warning systems, \nvulnerability and risk assessment, as well as drought risk mitigation measures;  \n \n18. Welcomes target 15.3 of the Sustainable Development Goals, to combat \ndesertification, restore degraded land and soil, including land affected by \ndesertification, drought and floods, and strive to achieve a land degradation-neutral \nworld,7 and takes note with appreciation of the voluntary land degradation neutrality \n__________________ \n \n14  Resolution 69/313, annex. \n\nA/RES/73/233 \nImplementation of the United Nations Convention to Combat Desertification in Those \nCountries Experiencing Serious Drought and/or Desertification, Particularly in Africa\n \n18-22556\n6/6 \n \ntarget setting programme under the Convention and the work of the secretariat of the \nConvention and partners to assist States in carrying out voluntary target setting \nactivities, and in this respect invites States that have not yet subscribed to the \nprogramme to do so;  \n \n19. Notes with appreciation the financial contributions that have been made \nby States and other donors towards the Land Degradation Neutrality Fund, and invites \nStates and other donors to make further contributions;  \n \n20. Invites more investment aimed at the operationalization of the voluntary \nland degradation neutrality target setting programme and the Land Degradation \nNeutrality Fund as an innovative funding scheme to finance the 2030 Agenda for \nSustainable Development, including for the achievement of a land degradation-\nneutral world;  \n \n21. Recognizes the benefits gained from cooperation through the sharing of \nclimate and weather information, forecasting and early warning systems related to \ndesertification, land degradation and drought, while also taking account of dust and \nsand storms, at the global, regional and subregional levels, and in this regard likewise \nrecognizes the need for further cooperation between parties to the Convention and \nrelevant organizations in the sharing of related information, forecasting and early \nwarning systems;  \n \n22. Encourages the United Nations system to harness opportunities for \nleveraging synergies among the Convention on Biological Diversity, 15 the United \nNations Convention to Combat Desertification in Those Countries Experiencing \nSerious Drought and/or Desertification, Particularly in Africa, and the United Nations \nFramework Convention on Climate Change3 and other relevant multilateral \nenvironmental agreements, as well as the 2030 Agenda for Sustainable Development, \nand in this respect welcomes the ongoing efforts to strengthen synergies among the \nsecretariats of the aforementioned conventions;  \n \n23. Requests the Secretary-General to submit to the General Assembly at its \nseventy-fourth session a report on the implementation of the present resolution, and \ndecides to include in the provisional agenda of its seventy-fourth session, under the \nitem entitled \u201cSustainable development\u201d, the sub-item entitled \u201cImplementation of \nthe United Nations Convention to Combat Desertification in Those Countries \nExperiencing Serious Drought and/or Desertification, Particularly in Africa\u201d, unless \notherwise agreed. \n \n62nd plenary meeting  \n20 December 2018 \n \n__________________ \n \n15  United Nations, Treaty Series, vol. 1760, No. 30619. \n",
  "paragraphs": {
    "1": "Takes note of the report of the Secretary-General on the implementation of resolution 72/220 on the United Nations Convention to Combat Desertification in __________________ 6 Food and Agriculture Organization of the United Nations, document CL 144/9 (C 2013/20), appendix D. 7 See resolution 70/1. 8 ICCD/COP(13)/21/Add.1, decision 7/COP.13, annex. 9 United Nations publication, Sales No. E.18.I.6. A/RES/73/233 Implementation of the United Nations Convention to Combat Desertification in Those Countries Experiencing Serious Drought and/or Desertification, Particularly in Africa 18-22556 4/6 Those Countries Experiencing Serious Drought and/or Desertification, Particularly in Africa;10",
    "2": "Affirms that achieving land degradation neutrality would serve as an accelerator and integrator for achieving the Sustainable Development Goals and as a catalyst for attracting sustainable development financing and climate finance to implement the Convention, and respond to the overall objectives of the 2030 Agenda for Sustainable Development;7",
    "3": "Encourages the organizations of the United Nations system, when designing and implementing their programmes and projects, to take into account the role of land degradation neutrality as a potential accelerator of the Sustainable Development Goals;",
    "4": "Invites Member States to support efforts to implement the strategic objective of the United Nations Convention to Combat Desertification in Those Countries Experiencing Serious Drought and/or Desertification, Particularly in Africa,1 on drought;",
    "5": "Welcomes the outcomes of the thirteenth session of the Conference of the Parties to the United Nations Convention to Combat Desertification in Those Countries Experiencing Serious Drought and/or Desertification, Particularly in Africa,11 as well as the launch of the Land Degradation Neutrality Fund, a global impact investment vehicle for projects addressing land degradation, and takes note with appreciation of the launch of the first edition of Global Land Outlook,12 which provides, among other things, an assessment of the state of land globally as well as solutions for the sustainable management of land resources to help achieve the Sustainable Development Goals;",
    "6": "Takes note with appreciation of the adoption of the Ordos Declaration at the thirteenth session of the Conference of the Parties to the Convention urging countries to step up efforts on all fronts to tackle desertification, land degradation and drought, which are seen as major environmental, economic and social challenges for global sustainable development;13",
    "7": "Recognizes the importance of applying new and innovative technologies, enabling policies and approaches, as well as sharing best practices, in combating desertification, land degradation and drought, and requests the Secretary-General to identify those technologies, enabling policies and best practices in his report on the implementation of the present resolution;",
    "8": "Underlines the importance of comprehensive reporting, follow-up and review at the global, national and regional levels, as appropriate, in order to track progress in the implementation of the Convention, to ensure that its overall objectives to reverse desertification and mitigate the effects of drought to achieve sustainable development in the affected areas are duly attained;",
    "9": "Takes note, as appropriate, of the decision of the Conference of the Parties to the Convention, at its thirteenth session, to promote the positive role that measures taken to implement the United Nations Convention to Combat Desertification in Those Countries Experiencing Serious Drought and/or Desertification, Particularly in Africa, can play in addressing desertification, land degradation and drought as one of the drivers that can cause migration, and invites all stakeholders to take note of this when addressing drivers of migration within the ongoing processes; __________________ 10 A/73/255, sect. II. 11 ICCD/COP(13)/21/Add.1. 12 Secretariat of the United Nations Convention to Combat Desertification (Bonn, Germany, 2017). 13 ICCD/COP(13)/21/Add.1, decision 27/COP.13, annex. Implementation of the United Nations Convention to Combat Desertification in Those Countries Experiencing Serious Drought and/or Desertification, Particularly in Africa A/RES/73/233 5/6 18-22556",
    "10": "Underlines the need to address the economic, social and environmental impacts of climate change, and emphasizes the need for national and international action to enhance efforts to build resilience;",
    "11": "Encourages the public and private sectors to continue to invest in developing, adapting and scaling up the application of technologies, enabling policies, methods and tools to combat desertification, land degradation and drought in different regions, and to boost knowledge exchange, including of traditional knowledge with the consent of the knowledge holders, capacity-building and sharing of technologies on mutually agreed terms;",
    "12": "Encourages developed countries party to the United Nations Convention to Combat Desertification in Those Countries Experiencing Serious Drought and/or Desertification, Particularly in Africa, to actively support the efforts of developing countries party to the Convention in promoting sustainable land management practices and in seeking to achieve a land degradation-neutral world by providing substantial financial resources, facilitated access to appropriate technology and other forms of support, including through capacity-building measures;",
    "13": "Welcomes the adoption of the 2018\u20132030 Strategic Framework of the Convention, including a new strategic objective on drought, and strongly encourages the parties to the Convention to apply and align with the Strategic Framework in their national policies, programmes, plans and processes relating to desertification, land degradation and drought, including in their national action programmes, as appropriate, and to implement the Strategic Framework, taking into account the Addis Ababa Action Agenda of the Third International Conference on Financing for Development;14",
    "14": "Recognizes that gender equality and the empowerment of women and girls remains a crucial contribution to the effective implementation of the Convention, including its 2018\u20132030 Strategic Framework, and to the achievement of the goals of the 2030 Agenda for Sustainable Development, welcomes the adoption of the Gender Action Plan by the Conference of the Parties to the Convention at its thirteenth session, and calls upon parties to the Convention and partners to pursue the equal participation of women and men in planning, decision-making and implementation at all levels and to further promote gender equality and the empowerment of all women and girls in desertification, land degradation and drought-related policies and activities as a means to strengthen the effective and efficient implementation of action on the ground;",
    "15": "Invites multilateral and bilateral partners to support parties to the Convention in the implementation of the 2018\u20132030 Strategic Framework of the Convention;",
    "16": "Encourages parties to the Convention to continue to promote the prevention of desertification, land degradation and drought with an integrated landscape approach, including the rehabilitation and restoration of degraded land and sustainable land management;",
    "17": "Calls upon parties to the Convention to enhance and support the preparation of drought preparedness policies on, inter alia, early warning systems, vulnerability and risk assessment, as well as drought risk mitigation measures;",
    "18": "Welcomes target 15.3 of the Sustainable Development Goals, to combat desertification, restore degraded land and soil, including land affected by desertification, drought and floods, and strive to achieve a land degradation-neutral world,7 and takes note with appreciation of the voluntary land degradation neutrality __________________ 14 Resolution 69/313, annex. A/RES/73/233 Implementation of the United Nations Convention to Combat Desertification in Those Countries Experiencing Serious Drought and/or Desertification, Particularly in Africa 18-22556 6/6 target setting programme under the Convention and the work of the secretariat of the Convention and partners to assist States in carrying out voluntary target setting activities, and in this respect invites States that have not yet subscribed to the programme to do so;",
    "19": "Notes with appreciation the financial contributions that have been made by States and other donors towards the Land Degradation Neutrality Fund, and invites States and other donors to make further contributions;",
    "20": "Invites more investment aimed at the operationalization of the voluntary land degradation neutrality target setting programme and the Land Degradation Neutrality Fund as an innovative funding scheme to finance the 2030 Agenda for Sustainable Development, including for the achievement of a land degradation- neutral world;",
    "21": "Recognizes the benefits gained from cooperation through the sharing of climate and weather information, forecasting and early warning systems related to desertification, land degradation and drought, while also taking account of dust and sand storms, at the global, regional and subregional levels, and in this regard likewise recognizes the need for further cooperation between parties to the Convention and relevant organizations in the sharing of related information, forecasting and early warning systems;",
    "22": "Encourages the United Nations system to harness opportunities for leveraging synergies among the Convention on Biological Diversity, 15 the United Nations Convention to Combat Desertification in Those Countries Experiencing Serious Drought and/or Desertification, Particularly in Africa, and the United Nations Framework Convention on Climate Change3 and other relevant multilateral environmental agreements, as well as the 2030 Agenda for Sustainable Development, and in this respect welcomes the ongoing efforts to strengthen synergies among the secretariats of the aforementioned conventions;",
    "23": "Requests the Secretary-General to submit to the General Assembly at its seventy-fourth session a report on the implementation of the present resolution, and decides to include in the provisional agenda of its seventy-fourth session, under the item entitled \u201cSustainable development\u201d, the sub-item entitled \u201cImplementation of the United Nations Convention to Combat Desertification in Those Countries Experiencing Serious Drought and/or Desertification, Particularly in Africa\u201d, unless otherwise agreed. 62nd plenary meeting 20 December 2018 __________________ 15 United Nations, Treaty Series, vol. 1760, No. 30619."
  },
  "agenda_items": [
    "Item 20"
  ],
  "symbol_references": []
}