{
  "symbol": "A/RES/73/289",
  "filename": "A_RES_73_289.pdf",
  "title": "73/289. Progress towards an accountability system in the United Nations Secretariat",
  "text": "United Nations \nA/RES/73/289\n \n \nGeneral Assembly \nDistr.: General \n18 April 2019 \n \n19-06369 (E)    230419     \n*1906369* \n \n \nSeventy-third session \nAgenda item 135 \n \n \n \n \n Resolution adopted by the General Assembly \non 15 April 2019 \n \n \n \n \n[on the report of the First Committee (A/73/687/Add.1)] \n \n \n 73/289. Progress towards an accountability system \nin the United Nations Secretariat \n \n \n \nThe General Assembly, \n \n \n \nI \nProgress towards an accountability system in the United Nations Secretariat \n \n \nRecalling its resolutions 59/272 of 23 December 2004 and 60/254 of 8 May \n2006, section I of its resolution 60/260 of 8 May 2006 and its resolutions 60/283 of \n7 July 2006, 61/245 of 22 December 2006, 63/276 of 7 April 2009, 64/259 of \n29 March 2010, 66/257 of 9 April 2012, 67/253 of 12 April 2013, 68/264 of 9 April \n2014, 69/272 of 2 April 2015, 70/255 of 1 April 2016, 71/283 of 6 April 2017 and \n72/303 of 5 July 2018, \n \nReaffirming its commitment to strengthening accountability in the United \nNations Secretariat and the accountability of the Secretary-General for the \nperformance of the Secretariat to all Member States, \n \nEmphasizing that accountability is a central pillar of effective and efficient \nmanagement that requires attention and strong commitment at all levels of the \nSecretariat, especially at the highest level, \n \nRecognizing and reaffirming the important role of the oversight bodies in the \ndevelopment of an accountability system that is relevant to the United Nations, \n \nHaving considered the eighth progress report of the Secretary-General on the \naccountability system in the United Nations Secretariat: strengthening accountability \nunder the new management paradigm 1  and the related report of the Advisory \nCommittee on Administrative and Budgetary Questions,2 \n__________________ \n \n1  A/73/688 and A/73/688/Corr.1. \n \n2  A/73/800. \n\nA/RES/73/289 \nProgress towards an accountability system in the United Nations Secretariat\n \n19-06369\n2/4 \n \n \n1. \nTakes note of the eighth progress report of the Secretary-General on the \naccountability system in the United Nations Secretariat: strengthening accountability \nunder the new management paradigm;1 \n \n2. \nEndorses the conclusions and recommendations contained in the report of \nthe Advisory Committee on Administrative and Budgetary Questions;2 \n \n3. \nWelcomes the efforts of the Secretary-General towards a strong culture of \naccountability throughout the Secretariat, acknowledges that a culture of \naccountability stems from the leadership of an organization, and stresses that an \neffective accountability system is central to the successful management of the \nOrganization; \n \n4. \nAcknowledges that senior management bears special responsibility for \nsetting the tone and standards for a strong culture of responsibility, accountability and \npersonal integrity in the Secretariat, with an impact on mandate implementation and \non the reputation of the Organization; \n \n5. \nStresses the indispensable roles of external and internal oversight \nmechanisms, carried out through regular audit reviews and the issuance of pertinent \nrecommendations, \nand that the \nfull \nand timely \nimplementation \nof the \nrecommendations of oversight bodies, which are aimed at strengthening the \nperformance of managers in monitoring the activities for which they are held \naccountable, is an essential part of any effective system of accountability; \n \n6. \nAlso stresses the continued need for a well-functioning system of \ndelegation of authority through well-defined roles and responsibilities of individuals \nat all levels to whom authority is delegated, systemic reporting mechanisms on the \nmonitoring and exercise of delegated authority, risk mitigation and safeguard \nmeasures, and actions to be taken in cases of mismanagement or abuse of authority; \n \n7. \nRecalls paragraph 16 of the report of the Advisory Committee, and \nrequests that the Secretary-General provide information on the issues identified \ntherein regarding the new system of delegation of authority that came into effect on \n1 January 2019, in his ninth progress report on accountability; \n \n8. \nAlso recalls paragraph 19 of the report of the Advisory Committee, and \nrequests the Secretary-General to refine the key performance indicators of the \nperformance management framework and to report thereon in his next progress \nreport; \n \n9. \nReaffirms that results-based management and performance reporting are \nessential pillars of a comprehensive accountability framework; \n \n10. Recognizes the importance of results-based management and performance \nreporting, and requests the Secretary-General to continue his efforts aimed at \nstrengthening the implementation of results-based management, programme \nmonitoring and reporting, and at shifting towards a culture of results in the \nSecretariat; \n \n11. \nNotes \nthe \nestablishment \nof \nthe \nBusiness \nTransformation \nand \nAccountability Division and its important role as a new element of the accountability \nsystem, and requests the Secretary-General to include in his next progress report \ninformation on how the Division has provided support to the Secretariat, including \nprogramme managers, in the monitoring, assessment and reporting of programme \nperformance; \n \n12. Stresses, as one of the essential components of accountability, the \nimportance of compliance with the Charter of the United Nations, its resolutions and \nthe regulations and rules; \n\nProgress towards an accountability system in the United Nations Secretariat \nA/RES/73/289\n \n3/4\n19-06369 \n \n \n13. Emphasizes the importance of the internal control framework in the \naccountability system, and requests the Secretary-General to continue to strengthen \ninternal controls in programme planning, the programme aspects of the budget, the \nmonitoring of implementation and the methods of evaluation, and to report on the \nmeasures taken in that regard in the context of his ninth progress report; \n \n14. Notes the measures taken to strengthen senior managers\u2019 compacts, and \nrequests the Secretary-General to include more detailed information on the \neffectiveness of those compacts as instruments of accountability, including measures \nto strengthen performance when objectives are not achieved, in the context of future \nprogress reports on accountability in the Secretariat; \n \n15. Reiterates that the timely submission of documents is an important aspect \nof the accountability of the Secretariat to Member States, notes the ongoing efforts to \naddress the underlying challenges related to documentation, and in this regard \nrequests the Secretary-General to ensure the continued inclusion in the senior \nmanagers\u2019 compacts of a related managerial indicator; \n \n16. Recalls paragraph 36 of the report of the Advisory Committee, stresses the \nimportance of the risk management function under the new system of delegation of \nauthority, and requests the Secretary-General to report comprehensively on progress \nmade towards embedding risk ownership and risk management in Secretariat entities \nin his next progress report; \n \n17. Also recalls paragraph 16 of its resolution 72/303, and requests the \nSecretary-General to continue to take concrete measures to enhance in-house capacity \nfor evaluation and self-evaluation, including through the Evaluation Section in the \nBusiness Transformation and Accountability Division; \n \n18. Requests the Secretary-General to provide details on further developing the \nguidelines for the preparation of agreements with donors and implementing partners; \n \n19. Recalls paragraph 41 of the report of the Advisory Committee, and \nrequests the Secretary-General to provide, in his next progress report, details on the \nimplementation status of the recommendations of the Board of Auditors, as well as \non other actions taken to address the concerns of the Board regarding the management \nof the risk of fraud; \n \n20. Welcomes the measures taken by the Secretary-General to ensure \nappropriate ethical standards and integrity in the Organization, and requests him to \nmake efforts aimed at improving the culture of accountability in the Secretariat, \nincluding by continuing to encourage, inter alia, a conducive environment for the \nreporting of fraud and misconduct, and to continue to take appropriate and effective \nmeasures for the protection of whistle-blowers and the prevention of retaliation; \n \n21. Requests the Secretary-General to submit a report on progress made in the \nimplementation of the accountability system of the Secretariat, including on the \nsystem of delegation of authority, for its consideration at the first part of its resumed \nseventy-fourth session; \n \n \n \nII \nJoint Inspection Unit \n \n \nHaving considered the note by the Secretary-General drawing attention to the \nreport of the Joint Inspection Unit on the review of whistle-blower policies and \npractices in United Nations system organizations 3 as well as the comments of the \n__________________ \n \n3  A/73/665. \n\nA/RES/73/289 \nProgress towards an accountability system in the United Nations Secretariat\n \n19-06369\n4/4 \n \nSecretary-General and of the United Nations System Chief Executives Board for \nCoordination thereon,4 \n \n1. \nNotes with appreciation the review of whistle-blower policies and practices \nin United Nations system organizations conducted by the Joint Inspection Unit; \n \n2. \nRequests the Secretary-General to take action on the relevant \nrecommendations, as appropriate, and to provide an update thereon to the General \nAssembly; \n \n3. \nNotes that a lack of confidence in the accountability system directly \ncontributes to underreporting across the United Nations system, and in this regard \nrequests the Secretary-General to continue to strengthen those measures that will \nincrease reporting. \n \n75th plenary meeting  \n15 April 2019 \n \n__________________ \n \n4  A/73/665/Add.1. \n",
  "paragraphs": {
    "1": "Notes with appreciation the review of whistle-blower policies and practices in United Nations system organizations conducted by the Joint Inspection Unit;",
    "2": "Requests the Secretary-General to take action on the relevant recommendations, as appropriate, and to provide an update thereon to the General Assembly;",
    "3": "Notes that a lack of confidence in the accountability system directly contributes to underreporting across the United Nations system, and in this regard requests the Secretary-General to continue to strengthen those measures that will increase reporting.",
    "4": "Acknowledges that senior management bears special responsibility for setting the tone and standards for a strong culture of responsibility, accountability and personal integrity in the Secretariat, with an impact on mandate implementation and on the reputation of the Organization;",
    "5": "Stresses the indispensable roles of external and internal oversight mechanisms, carried out through regular audit reviews and the issuance of pertinent recommendations, and that the full and timely implementation of the recommendations of oversight bodies, which are aimed at strengthening the performance of managers in monitoring the activities for which they are held accountable, is an essential part of any effective system of accountability;",
    "6": "Also stresses the continued need for a well-functioning system of delegation of authority through well-defined roles and responsibilities of individuals at all levels to whom authority is delegated, systemic reporting mechanisms on the monitoring and exercise of delegated authority, risk mitigation and safeguard measures, and actions to be taken in cases of mismanagement or abuse of authority;",
    "7": "Recalls paragraph 16 of the report of the Advisory Committee, and requests that the Secretary-General provide information on the issues identified therein regarding the new system of delegation of authority that came into effect on 1 January 2019, in his ninth progress report on accountability;",
    "8": "Also recalls paragraph 19 of the report of the Advisory Committee, and requests the Secretary-General to refine the key performance indicators of the performance management framework and to report thereon in his next progress report;",
    "9": "Reaffirms that results-based management and performance reporting are essential pillars of a comprehensive accountability framework;",
    "10": "Recognizes the importance of results-based management and performance reporting, and requests the Secretary-General to continue his efforts aimed at strengthening the implementation of results-based management, programme monitoring and reporting, and at shifting towards a culture of results in the Secretariat;",
    "11": "Notes the establishment of the Business Transformation and Accountability Division and its important role as a new element of the accountability system, and requests the Secretary-General to include in his next progress report information on how the Division has provided support to the Secretariat, including programme managers, in the monitoring, assessment and reporting of programme performance;",
    "12": "",
    "13": "Emphasizes the importance of the internal control framework in the accountability system, and requests the Secretary-General to continue to strengthen internal controls in programme planning, the programme aspects of the budget, the monitoring of implementation and the methods of evaluation, and to report on the measures taken in that regard in the context of his ninth progress report;",
    "14": "Notes the measures taken to strengthen senior managers\u2019 compacts, and requests the Secretary-General to include more detailed information on the effectiveness of those compacts as instruments of accountability, including measures to strengthen performance when objectives are not achieved, in the context of future progress reports on accountability in the Secretariat;",
    "15": "Reiterates that the timely submission of documents is an important aspect of the accountability of the Secretariat to Member States, notes the ongoing efforts to address the underlying challenges related to documentation, and in this regard requests the Secretary-General to ensure the continued inclusion in the senior managers\u2019 compacts of a related managerial indicator;",
    "16": "Recalls paragraph 36 of the report of the Advisory Committee, stresses the importance of the risk management function under the new system of delegation of authority, and requests the Secretary-General to report comprehensively on progress made towards embedding risk ownership and risk management in Secretariat entities in his next progress report;",
    "17": "Also recalls paragraph 16 of its resolution 72/303, and requests the Secretary-General to continue to take concrete measures to enhance in-house capacity for evaluation and self-evaluation, including through the Evaluation Section in the Business Transformation and Accountability Division;",
    "18": "Requests the Secretary-General to provide details on further developing the guidelines for the preparation of agreements with donors and implementing partners;",
    "19": "Recalls paragraph 41 of the report of the Advisory Committee, and requests the Secretary-General to provide, in his next progress report, details on the implementation status of the recommendations of the Board of Auditors, as well as on other actions taken to address the concerns of the Board regarding the management of the risk of fraud;",
    "20": "Welcomes the measures taken by the Secretary-General to ensure appropriate ethical standards and integrity in the Organization, and requests him to make efforts aimed at improving the culture of accountability in the Secretariat, including by continuing to encourage, inter alia, a conducive environment for the reporting of fraud and misconduct, and to continue to take appropriate and effective measures for the protection of whistle-blowers and the prevention of retaliation;",
    "21": "Requests the Secretary-General to submit a report on progress made in the implementation of the accountability system of the Secretariat, including on the system of delegation of authority, for its consideration at the first part of its resumed seventy-fourth session; II Joint Inspection Unit Having considered the note by the Secretary-General drawing attention to the report of the Joint Inspection Unit on the review of whistle-blower policies and practices in United Nations system organizations 3 as well as the comments of the Secretary-General and of the United Nations System Chief Executives Board for Coordination thereon,4"
  },
  "agenda_items": [
    "Item 135"
  ],
  "symbol_references": []
}