{
  "symbol": "A/RES/76/111",
  "filename": "A_RES_76_111.pdf",
  "title": "76/111. Report of the International Law Commission on the work of its seventy-second session",
  "text": "United Nations \nA/RES/76/111\n \n \nGeneral Assembly \nDistr.: General \n17 December 2021 \n \n21-18667 (E)    271221   \n*2118667* \n \n \nSeventy-sixth session \nAgenda item 82 \nReport of the International Law Commission on the work \nof its seventy-second session \n \n \n \n \n Resolution adopted by the General Assembly \non 9 December 2021 \n \n \n \n \n[on the report of the Sixth Committee (A/76/473, para. 12)] \n \n \n \n76/111. Report of the International Law Commission on the work of its \nseventy-second session \n \n \n \nThe General Assembly, \n \nHaving considered the report of the International Law Commission on the work \nof its seventy-second session,1 \n \nEmphasizing the importance of furthering the progressive development and \ncodification of international law as a means of implementing the purposes and \nprinciples set forth in the Charter of the United Nations and in the Declaration on \nPrinciples of International Law concerning Friendly Relations and Cooperation \namong States in accordance with the Charter of the United Nations, 2 \n \nRecognizing the desirability of referring legal and drafting questions to the Sixth \nCommittee, including topics that might be submitted to the International Law \nCommission for closer examination, and of enabling the Sixth Committee and the \nCommission to enhance further their contribution to the progressive development and \ncodification of international law, \n \nRecalling the need to keep under review those topics of international law which, \ngiven their new or renewed interest for the international community, may be suitable \nfor the progressive development and codification of international law and therefore \nmay be included in the future programme of work of the International Law \nCommission, \n \nRecalling also the role of Member States in submitting proposals for new topics \nfor the consideration of the International Law Commission, and noting in this regard \n__________________ \n \n1 Official Records of the General Assembly, Seventy-sixth Session, Supplement No. 10 (A/76/10). \n \n2 Resolution 2625 (XXV), annex. \n\nA/RES/76/111 \nReport of the International Law Commission on the work of its \nseventy-second session\n \n21-18667\n2/7 \n \nthe recommendation of the Commission that such proposals be accompanied by a \nstatement of reasons, \n \nReaffirming the importance for the successful work of the International Law \nCommission of the information provided by Member States concerning their views \nand practice, \n \nRecognizing the importance of the work of the special rapporteurs of the \nInternational Law Commission, \n \nNoting that, due to the coronavirus disease (COVID-19) pandemic, the \nInternational Law Seminar was not convened in 2020 or 2021, stressing the \nimportance and usefulness of holding the Seminar, and noting with appreciation the \nvoluntary contributions made to the United Nations trust fund for the International \nLaw Seminar,  \n \nAcknowledging the importance of facilitating the timely publication of the \nYearbook of the International Law Commission and of eliminating the backlog, \n \nStressing the usefulness of focusing and structuring the debate on the report of \nthe International Law Commission in the Sixth Committee in such a manner that \nconditions are provided for concentrated attention to each of the main topics dealt \nwith in the report and for discussions on specific topics, \n \nWishing to enhance further, in the context of the revitalization of the debate on \nthe report of the International Law Commission, the interaction between the Sixth \nCommittee as a body of governmental representatives and the Commission as a body \nof independent legal experts, with a view to improving the dialogue between the two \nbodies, \n \nWelcoming initiatives to hold interactive debates, panel discussions and question \ntime in the Sixth Committee, as envisaged in General Assembly resolution 58/316 of \n1 July 2004 on further measures for the revitalization of the work of the Assembly, \n \n1. \nTakes note of the report of the International Law Commission on the work \nof its seventy-second session;3  \n \n2. \nExpresses its appreciation to the International Law Commission for the \nwork accomplished at its seventy-second session, and notes in particular:  \n \n(a) \nThe completion of the second reading of the draft guidelines on the \nprotection of the atmosphere and the commentaries thereto; 4  \n \n(b) \nThe completion of the second reading of the draft guidelines and draft \nannex constituting the Guide to Provisional Application of Treaties, and the \ncommentaries thereto;5  \n \n3. \nRecommends that the International Law Commission continue its work on \nthe topics in its current programme of work, taking into account the comments and \nobservations of Governments, whether submitted in writing or expressed orally in \ndebates in the Sixth Committee; \n \n4. \nDraws the attention of Governments to the importance for the \nInternational Law Commission of having their views by 31 December 2021 or, as the \ncase may be, by 30 June 2022, on the various aspects of the topics on the agenda of \n__________________ \n \n3 Official Records of the General Assembly, Seventy-sixth Session, Supplement No. 10 (A/76/10). \n \n4 Ibid, chap. IV, sect. E. \n \n5 Ibid, chap. V, sect. E. \n\nReport of the International Law Commission on the work of its \nseventy-second session \nA/RES/76/111\n \n3/7\n21-18667 \n \nthe Commission, in particular on all the specific issues identified in chapter III of its \nreport,6 regarding: \n \n(a) \nImmunity of State officials from foreign criminal jurisdiction; \n \n(b) \nSuccession of States in respect of State responsibility; \n \n(c) \nGeneral principles of law; \n \n(d) \nSea-level rise in relation to international law; \n \n5. \nEncourages the International Law Commission to continue the \nexamination of the topics that are in its long-term programme of work;7  \n \n6. \nAlso encourages the International Law Commission to take particular \naccount of the capacity and views of Member States, as well as of the workload of \nthe Commission, when including topics in its current programme of work; \n \n7. \nTakes note of paragraphs 301 and 302 of the report of the International \nLaw Commission,8 and notes, in particular, the inclusion of the topic \u201cSubsidiary \nmeans for the determination of rules of international law\u201d in the long-term programme \nof work of the Commission,9 and in this regard calls upon the Commission to take \ninto consideration the comments, concerns and observations expressed by \nGovernments during the debate in the Sixth Committee;  \n \n8. \nAlso takes note of paragraphs 313 and 316 of the report of the International \nLaw Commission, and expresses its appreciation to the Commission for successfully \nconvening a hybrid session despite the challenges outlined in these paragraphs;  \n \n9. \nFurther takes note of paragraph 317 of the report of the International Law \nCommission, and requests the Secretary-General to continue his efforts to identify \nconcrete options for support for the work of special rapporteurs, additional to those \nprovided under General Assembly resolution 56/272 of 27 March 2002; \n \n10. Welcomes the efforts of the International Law Commission to improve its \nmethods of work, and encourages the Commission to continue this practice;  \n \n11. \nInvites the International Law Commission to continue to take measures to \nenhance its efficiency and productivity and to consider making proposals to Member \nStates to that end; \n \n12. Recalls the importance of an in-depth analysis of State practice and the \nconsideration of the diversity of legal systems of Member States to the work of the \nInternational Law Commission;  \n \n13. \nTakes note of paragraph 321 of the report of the International Law \nCommission, recalls the paramount importance of multilingualism as set forth in \n__________________ \n \n6 See Official Records of the General Assembly, Seventy-sixth Session, Supplement No. 10 \n(A/76/10). \n \n7 The following topics are currently in the long-term programme of work of the International Law \nCommission: \u201cOwnership and protection of wrecks beyond the limits of national maritime \njurisdiction\u201d, \u201cJurisdictional immunity of international organizations\u201d, \u201cProtection of personal \ndata in transborder flow of information\u201d, \u201cExtraterritorial jurisdiction\u201d, \u201cThe fair and equitable \ntreatment standard in international investment law\u201d, \u201cSettlement of international disputes to \nwhich international organizations are parties\u201d, \u201cEvidence before international courts and \ntribunals\u201d, \u201cUniversal criminal jurisdiction\u201d, \u201cReparation to individuals for gross violations of \ninternational human rights law and serious violations of international humanitarian law\u201d, \n\u201cPrevention and repression of piracy and armed robbery at sea\u201d and \u201cSubsidiary means for the \ndetermination of rules of international law\u201d. \n \n8 See Official Records of the General Assembly, Seventy-sixth Session, Supplement No. 10 \n(A/76/10). \n \n9 Ibid., para. 302. \n\nA/RES/76/111 \nReport of the International Law Commission on the work of its \nseventy-second session\n \n21-18667\n4/7 \n \nGeneral Assembly resolutions 69/324 of 11 September 2015 and 73/346 of \n16 September 2019 on multilingualism, underlines the importance of having the \ndocuments of the Commission published in due time in the six official languages of the \nUnited Nations while ensuring their accuracy in all official languages, and to this end \nrequests special rapporteurs to submit their reports within the time limits specified by \nthe Secretariat, and the Secretariat to give due consideration to the quality of the \ntranslation of the documents of the Commission in the six official languages; \n \n14. Encourages the International Law Commission to continue to take cost-\nsaving measures at its future sessions, without prejudice to the efficiency and \neffectiveness of its work; \n \n15. Recalls that the seat of the International Law Commission is at the United \nNations Office at Geneva; \n \n16. Takes note of paragraph 328 of the report of the International Law \nCommission, and decides that the next session of the Commission shall be held at the \nUnited Nations Office at Geneva from 18 April to 3 June and from 4 July to 5 August \n2022;  \n \n17. Stresses the desirability of further enhancing the dialogue between the \nInternational Law Commission, in particular the special rapporteurs, and the Sixth \nCommittee, and in this context encourages, inter alia, the continued practice of \ninformal consultations in the form of discussions between the members of the Sixth \nCommittee and the members of the Commission throughout the year; \n \n18. Encourages delegations, during the debate on the report of the \nInternational Law Commission, to continue to adhere as far as possible to the \nstructured work programme agreed to by the Sixth Committee and to consider \npresenting concise and focused statements; \n \n19. Encourages Member States to consider being represented at the level of \nlegal adviser during the first week in which the report of the International Law \nCommission is discussed in the Sixth Committee (International Law Week) to enable \nhigh-level discussions on issues of international law; \n \n20. Underlines in this regard the necessity to allow sufficient time for the \nconsideration of the report of the International Law Commission in the Sixth \nCommittee; \n \n21. Requests the International Law Commission to continue to pay special \nattention to indicating in its annual report, for each topic, any specific issues on which \nexpressions of views by Governments, either in the Sixth Committee or in written \nform, would be of particular interest in providing effective guidance for the \nCommission in its further work; \n \n22. Takes note of paragraphs 330 to 332 of the report of the International Law \nCommission with regard to cooperation and interaction with other bodies, and \nencourages the Commission to continue the implementation of articles 16 (e), 25 and \n26 of its statute in order to further strengthen cooperation between the Commission \nand other bodies concerned with international law, having in mind the usefulness of \nsuch cooperation; \n \n23. Notes that consulting with national organizations and individual experts \nconcerned with international law may assist Governments in considering whether to \nmake comments and observations on drafts submitted by the International Law \nCommission and in formulating their comments and observations; \n \n24. Reaffirms its previous decisions concerning the indispensable role of the \nCodification Division of the Office of Legal Affairs of the Secretariat in providing \n\nReport of the International Law Commission on the work of its \nseventy-second session \nA/RES/76/111\n \n5/7\n21-18667 \n \nassistance to the International Law Commission, including in the preparation of \nmemorandums and studies on topics on the agenda of the Commission; \n \n25. Also reaffirms its previous decisions concerning the documentation and \nsummary records of the International Law Commission;10  \n \n26. Takes note of paragraph 319 of the report of the International Law \nCommission, stresses the need to expedite the preparation of the summary records of \nthe International Law Commission, welcomes the continuation of the measures taken \nto streamline the processing of summary records during the sixty-fifth session of the \nCommission,11 which have led to a more rational use of resources, and expresses its \nsatisfaction that the summary records of the Commission, constituting travaux \npr\u00e9paratoires in the progressive development and codification of international law, \nwill not be subject to arbitrary length restrictions; \n \n27. Welcomes the institutionalization of the practice of the Secretariat to \ninclude on the website of the International Law Commission the provisional summary \nrecords in English and French relating to the work of the Commission; \n \n28. Also welcomes the efforts of the Secretariat in seeking to ensure the timely \nand efficient processing of the documents of the International Law Commission and \nthe institutionalization of the experimental measures taken during the sixty-eighth \nsession of the Commission to streamline the editing of those documents; \n \n29. Takes note of paragraph 318 of the report of the International Law \nCommission, and underlines the importance of the publications of the Codification \nDivision to the work of the Commission, welcomes in particular the issuance of the \nninth edition of The Work of the International Law Commission also in Chinese, \nFrench, Russian and Spanish, and reiterates its request that the Secretary-General \ncontinue to publish The Work of the International Law Commission in all six official \nlanguages at the beginning of each quinquennium, the Reports of International \nArbitral Awards in English or French and the Summaries of the Judgments, Advisory \nOpinions and Orders of the International Court of Justice in all six official languages \nevery five years; \n \n30. Also takes note of paragraph 323 of the report of the International Law \nCommission, stresses the unique value of the Yearbook of the International Law \nCommission, and requests the Secretary-General to ensure its timely publication in \nall official languages;  \n \n31. \nExpresses its appreciation to Governments that have made voluntary \ncontributions to the trust fund on the backlog relating to the Yearbook of the \nInternational Law Commission, and encourages further contributions to the trust fund; \n \n32. Takes note of paragraph 324 of the report of the International Law \nCommission, expresses its satisfaction with the remarkable progress achieved in the \npast few years in reducing the backlog of the Yearbook of the International Law \nCommission in all six languages, welcomes the efforts made by the Division of \nConference Management of the United Nations Office at Geneva, especially its \nEditing Section, in effectively implementing relevant resolutions of the General \nAssembly calling for the reduction of the backlog, encourages that Division to \nprovide continuous necessary support to the Editing Section in advancing the \n__________________ \n \n10 See resolutions 32/151, para. 10, and 37/111, para. 5, and all subsequent resolutions on the \nannual reports of the International Law Commission to the General Assembly; see also Yearbook \nof the International Law Commission 1982, vol. II (Part Two), paras. 267\u2013269 and 271, as well \nas all subsequent annual reports of the International Law Commission. \n \n11 Official Records of the General Assembly, Sixty-eighth Session, Supplement No. 10 (A/68/10), \npara. 183. \n\nA/RES/76/111 \nReport of the International Law Commission on the work of its \nseventy-second session\n \n21-18667\n6/7 \n \nYearbook of the International Law Commission, and requests that updates on progress \nmade in this respect be provided to the Commission on a regular basis; \n \n33. Welcomes the continuous efforts of the Codification Division to maintain \nand improve the website relating to the work of the International Law Commission; \n \n34. Takes note of paragraph 329 of the report of the International Law \nCommission proposing the consideration of the establishment of a trust fund to \nsupport the special rapporteurs, particularly those from developing regions, to obtain \nthe necessary assistance to undertake the research required for the preparation of their \nreports, and to address any budgetary shortfalls in provision for full attendance of its \nsecretariat, stresses the importance of ensuring necessary allocations for the \nCommission and its secretariat in the regular budget, and requests that more \ninformation about the constraints and shortfalls referred to in paragraph 329 be \nprovided, as well as available options to address them, including information \nregarding the terms of reference of the proposed trust fund, for consideration by the \nGeneral Assembly at its seventy-seventh session; \n \n35. Also takes note of paragraphs 334 and 335 of the report of the International \nLaw Commission, expresses the hope that the International Law Seminar will \ncontinue to be held in connection with the sessions of the International Law \nCommission and that an increasing number of participants representing the principal \nlegal systems of the world and from different countries in the various regions, \nincluding in particular those from developing countries, will be given the opportunity \nto attend the Seminar, as well as delegates to the Sixth Committee, and appeals to \nStates to continue to make urgently needed voluntary contributions to the United \nNations trust fund for the International Law Seminar;  \n \n36. Requests the Secretary-General to provide the International Law Seminar \nwith adequate services, including interpretation, as required, and encourages him to \ncontinue to consider ways to improve the structure and content of the Seminar; \n \n37. Underlines the importance of the records and topical summary of the \ndebate in the Sixth Committee for the deliberations of the International Law \nCommission, and in this regard requests the Secretary-General to forward to the \nCommission, for its attention, the records of the debate on the report of the \nCommission, together with such written statements as delegations may circulate in \nconjunction with their oral statements, and to prepare and distribute a topical \nsummary of the debate, following established practice; \n \n38. Requests the Secretariat to circulate to States, as soon as possible after the \nconclusion of the session of the International Law Commission, chapter II of its report \ncontaining a summary of the work of that session, chapter III containing the specific \nissues on which the views of Governments would be of particular interest to the \nCommission and any draft provisions adopted on either first or second reading by the \nCommission; \n \n39. \nAlso requests the Secretariat to make the complete report of the International \nLaw Commission available as soon as possible after the conclusion of the session of the \nCommission for the consideration of Member States with due anticipation and no later \nthan the prescribed time limit for reports in the General Assembly; \n \n40. Encourages the International Law Commission to continue to consider \nways in which specific issues on which the views of Governments would be of \nparticular interest to the Commission could be framed so as to help Governments to \nhave a better appreciation of the issues on which responses are required; \n\nReport of the International Law Commission on the work of its \nseventy-second session \nA/RES/76/111\n \n7/7\n21-18667 \n \n \n41. Recommends that the debate on the report of the International Law \nCommission at the seventy-seventh session of the General Assembly commence on \n24 October 2022. \n \n49th plenary meeting \n9 December 2021 \n \n",
  "paragraphs": {
    "1": "Takes note of the report of the International Law Commission on the work of its seventy-second session;3",
    "2": "Expresses its appreciation to the International Law Commission for the work accomplished at its seventy-second session, and notes in particular: (a) The completion of the second reading of the draft guidelines on the protection of the atmosphere and the commentaries thereto; 4 (b) The completion of the second reading of the draft guidelines and draft annex constituting the Guide to Provisional Application of Treaties, and the commentaries thereto;5",
    "3": "Recommends that the International Law Commission continue its work on the topics in its current programme of work, taking into account the comments and observations of Governments, whether submitted in writing or expressed orally in debates in the Sixth Committee;",
    "4": "Draws the attention of Governments to the importance for the International Law Commission of having their views by 31 December 2021 or, as the case may be, by 30 June 2022, on the various aspects of the topics on the agenda of __________________ 3 Official Records of the General Assembly, Seventy-sixth Session, Supplement No. 10 (A/76/10). 4 Ibid, chap. IV, sect. E. 5 Ibid, chap. V, sect. E. Report of the International Law Commission on the work of its seventy-second session A/RES/76/111 3/7 21-18667 the Commission, in particular on all the specific issues identified in chapter III of its report,6 regarding: (a) Immunity of State officials from foreign criminal jurisdiction; (b) Succession of States in respect of State responsibility; (c) General principles of law; (d) Sea-level rise in relation to international law;",
    "5": "Encourages the International Law Commission to continue the examination of the topics that are in its long-term programme of work;7",
    "6": "Also encourages the International Law Commission to take particular account of the capacity and views of Member States, as well as of the workload of the Commission, when including topics in its current programme of work;",
    "7": "Takes note of paragraphs 301 and 302 of the report of the International Law Commission,8 and notes, in particular, the inclusion of the topic \u201cSubsidiary means for the determination of rules of international law\u201d in the long-term programme of work of the Commission,9 and in this regard calls upon the Commission to take into consideration the comments, concerns and observations expressed by Governments during the debate in the Sixth Committee;",
    "8": "Also takes note of paragraphs 313 and 316 of the report of the International Law Commission, and expresses its appreciation to the Commission for successfully convening a hybrid session despite the challenges outlined in these paragraphs;",
    "9": "Further takes note of paragraph 317 of the report of the International Law Commission, and requests the Secretary-General to continue his efforts to identify concrete options for support for the work of special rapporteurs, additional to those provided under General Assembly resolution 56/272 of 27 March 2002;",
    "10": "Welcomes the efforts of the International Law Commission to improve its methods of work, and encourages the Commission to continue this practice;",
    "11": "Invites the International Law Commission to continue to take measures to enhance its efficiency and productivity and to consider making proposals to Member States to that end;",
    "12": "Recalls the importance of an in-depth analysis of State practice and the consideration of the diversity of legal systems of Member States to the work of the International Law Commission;",
    "13": "Takes note of paragraph 321 of the report of the International Law Commission, recalls the paramount importance of multilingualism as set forth in __________________ 6 See Official Records of the General Assembly, Seventy-sixth Session, Supplement No. 10 (A/76/10). 7 The following topics are currently in the long-term programme of work of the International Law Commission: \u201cOwnership and protection of wrecks beyond the limits of national maritime jurisdiction\u201d, \u201cJurisdictional immunity of international organizations\u201d, \u201cProtection of personal data in transborder flow of information\u201d, \u201cExtraterritorial jurisdiction\u201d, \u201cThe fair and equitable treatment standard in international investment law\u201d, \u201cSettlement of international disputes to which international organizations are parties\u201d, \u201cEvidence before international courts and tribunals\u201d, \u201cUniversal criminal jurisdiction\u201d, \u201cReparation to individuals for gross violations of international human rights law and serious violations of international humanitarian law\u201d, \u201cPrevention and repression of piracy and armed robbery at sea\u201d and \u201cSubsidiary means for the determination of rules of international law\u201d. 8 See Official Records of the General Assembly, Seventy-sixth Session, Supplement No. 10 (A/76/10). 9 Ibid., para. 302. A/RES/76/111 Report of the International Law Commission on the work of its seventy-second session 21-18667 4/7 General Assembly resolutions 69/324 of 11 September 2015 and 73/346 of 16 September 2019 on multilingualism, underlines the importance of having the documents of the Commission published in due time in the six official languages of the United Nations while ensuring their accuracy in all official languages, and to this end requests special rapporteurs to submit their reports within the time limits specified by the Secretariat, and the Secretariat to give due consideration to the quality of the translation of the documents of the Commission in the six official languages;",
    "14": "Encourages the International Law Commission to continue to take cost- saving measures at its future sessions, without prejudice to the efficiency and effectiveness of its work;",
    "15": "Recalls that the seat of the International Law Commission is at the United Nations Office at Geneva;",
    "16": "Takes note of paragraph 328 of the report of the International Law Commission, and decides that the next session of the Commission shall be held at the United Nations Office at Geneva from 18 April to 3 June and from 4 July to 5 August 2022;",
    "17": "Stresses the desirability of further enhancing the dialogue between the International Law Commission, in particular the special rapporteurs, and the Sixth Committee, and in this context encourages, inter alia, the continued practice of informal consultations in the form of discussions between the members of the Sixth Committee and the members of the Commission throughout the year;",
    "18": "Encourages delegations, during the debate on the report of the International Law Commission, to continue to adhere as far as possible to the structured work programme agreed to by the Sixth Committee and to consider presenting concise and focused statements;",
    "19": "Encourages Member States to consider being represented at the level of legal adviser during the first week in which the report of the International Law Commission is discussed in the Sixth Committee (International Law Week) to enable high-level discussions on issues of international law;",
    "20": "Underlines in this regard the necessity to allow sufficient time for the consideration of the report of the International Law Commission in the Sixth Committee;",
    "21": "Requests the International Law Commission to continue to pay special attention to indicating in its annual report, for each topic, any specific issues on which expressions of views by Governments, either in the Sixth Committee or in written form, would be of particular interest in providing effective guidance for the Commission in its further work;",
    "22": "Takes note of paragraphs 330 to 332 of the report of the International Law Commission with regard to cooperation and interaction with other bodies, and encourages the Commission to continue the implementation of articles 16 (e), 25 and 26 of its statute in order to further strengthen cooperation between the Commission and other bodies concerned with international law, having in mind the usefulness of such cooperation;",
    "23": "Notes that consulting with national organizations and individual experts concerned with international law may assist Governments in considering whether to make comments and observations on drafts submitted by the International Law Commission and in formulating their comments and observations;",
    "24": "Reaffirms its previous decisions concerning the indispensable role of the Codification Division of the Office of Legal Affairs of the Secretariat in providing Report of the International Law Commission on the work of its seventy-second session A/RES/76/111 5/7 21-18667 assistance to the International Law Commission, including in the preparation of memorandums and studies on topics on the agenda of the Commission;",
    "25": "Also reaffirms its previous decisions concerning the documentation and summary records of the International Law Commission;10",
    "26": "Takes note of paragraph 319 of the report of the International Law Commission, stresses the need to expedite the preparation of the summary records of the International Law Commission, welcomes the continuation of the measures taken to streamline the processing of summary records during the sixty-fifth session of the Commission,11 which have led to a more rational use of resources, and expresses its satisfaction that the summary records of the Commission, constituting travaux pr\u00e9paratoires in the progressive development and codification of international law, will not be subject to arbitrary length restrictions;",
    "27": "Welcomes the institutionalization of the practice of the Secretariat to include on the website of the International Law Commission the provisional summary records in English and French relating to the work of the Commission;",
    "28": "Also welcomes the efforts of the Secretariat in seeking to ensure the timely and efficient processing of the documents of the International Law Commission and the institutionalization of the experimental measures taken during the sixty-eighth session of the Commission to streamline the editing of those documents;",
    "29": "Takes note of paragraph 318 of the report of the International Law Commission, and underlines the importance of the publications of the Codification Division to the work of the Commission, welcomes in particular the issuance of the ninth edition of The Work of the International Law Commission also in Chinese, French, Russian and Spanish, and reiterates its request that the Secretary-General continue to publish The Work of the International Law Commission in all six official languages at the beginning of each quinquennium, the Reports of International Arbitral Awards in English or French and the Summaries of the Judgments, Advisory Opinions and Orders of the International Court of Justice in all six official languages every five years;",
    "30": "Also takes note of paragraph 323 of the report of the International Law Commission, stresses the unique value of the Yearbook of the International Law Commission, and requests the Secretary-General to ensure its timely publication in all official languages;",
    "31": "Expresses its appreciation to Governments that have made voluntary contributions to the trust fund on the backlog relating to the Yearbook of the International Law Commission, and encourages further contributions to the trust fund;",
    "32": "Takes note of paragraph 324 of the report of the International Law Commission, expresses its satisfaction with the remarkable progress achieved in the past few years in reducing the backlog of the Yearbook of the International Law Commission in all six languages, welcomes the efforts made by the Division of Conference Management of the United Nations Office at Geneva, especially its Editing Section, in effectively implementing relevant resolutions of the General Assembly calling for the reduction of the backlog, encourages that Division to provide continuous necessary support to the Editing Section in advancing the __________________ 10 See resolutions 32/151, para. 10, and 37/111, para. 5, and all subsequent resolutions on the annual reports of the International Law Commission to the General Assembly; see also Yearbook of the International Law Commission 1982, vol. II (Part Two), paras. 267\u2013269 and 271, as well as all subsequent annual reports of the International Law Commission. 11 Official Records of the General Assembly, Sixty-eighth Session, Supplement No. 10 (A/68/10), para. 183. A/RES/76/111 Report of the International Law Commission on the work of its seventy-second session 21-18667 6/7 Yearbook of the International Law Commission, and requests that updates on progress made in this respect be provided to the Commission on a regular basis;",
    "33": "Welcomes the continuous efforts of the Codification Division to maintain and improve the website relating to the work of the International Law Commission;",
    "34": "Takes note of paragraph 329 of the report of the International Law Commission proposing the consideration of the establishment of a trust fund to support the special rapporteurs, particularly those from developing regions, to obtain the necessary assistance to undertake the research required for the preparation of their reports, and to address any budgetary shortfalls in provision for full attendance of its secretariat, stresses the importance of ensuring necessary allocations for the Commission and its secretariat in the regular budget, and requests that more information about the constraints and shortfalls referred to in paragraph 329 be provided, as well as available options to address them, including information regarding the terms of reference of the proposed trust fund, for consideration by the General Assembly at its seventy-seventh session;",
    "35": "Also takes note of paragraphs 334 and 335 of the report of the International Law Commission, expresses the hope that the International Law Seminar will continue to be held in connection with the sessions of the International Law Commission and that an increasing number of participants representing the principal legal systems of the world and from different countries in the various regions, including in particular those from developing countries, will be given the opportunity to attend the Seminar, as well as delegates to the Sixth Committee, and appeals to States to continue to make urgently needed voluntary contributions to the United Nations trust fund for the International Law Seminar;",
    "36": "Requests the Secretary-General to provide the International Law Seminar with adequate services, including interpretation, as required, and encourages him to continue to consider ways to improve the structure and content of the Seminar;",
    "37": "Underlines the importance of the records and topical summary of the debate in the Sixth Committee for the deliberations of the International Law Commission, and in this regard requests the Secretary-General to forward to the Commission, for its attention, the records of the debate on the report of the Commission, together with such written statements as delegations may circulate in conjunction with their oral statements, and to prepare and distribute a topical summary of the debate, following established practice;",
    "38": "Requests the Secretariat to circulate to States, as soon as possible after the conclusion of the session of the International Law Commission, chapter II of its report containing a summary of the work of that session, chapter III containing the specific issues on which the views of Governments would be of particular interest to the Commission and any draft provisions adopted on either first or second reading by the Commission;",
    "39": "Also requests the Secretariat to make the complete report of the International Law Commission available as soon as possible after the conclusion of the session of the Commission for the consideration of Member States with due anticipation and no later than the prescribed time limit for reports in the General Assembly;",
    "40": "Encourages the International Law Commission to continue to consider ways in which specific issues on which the views of Governments would be of particular interest to the Commission could be framed so as to help Governments to have a better appreciation of the issues on which responses are required; Report of the International Law Commission on the work of its seventy-second session A/RES/76/111 7/7 21-18667",
    "41": "Recommends that the debate on the report of the International Law Commission at the seventy-seventh session of the General Assembly commence on 24 October 2022. 49th plenary meeting 9 December 2021"
  },
  "agenda_items": [
    "Item 82"
  ],
  "symbol_references": []
}