{
  "symbol": "A/RES/78/62",
  "filename": "A_RES_78_62.pdf",
  "title": "78/62. Report of the Disarmament Commission",
  "text": "United Nations \nA/RES/78/62\n \n \nGeneral Assembly \nDistr.: General \n6 December 2023 \n \n23-24463 (E)    141223     \n*2324463* \n \n \nSeventy-eighth session \nAgenda item 101 (b) \nReview of the implementation of the recommendations and \ndecisions adopted by the General Assembly at its tenth \nspecial session: report of the Disarmament Commission \n \n \n \n \n Resolution adopted by the General Assembly \non 4 December 2023 \n \n \n \n \n[on the report of the First Committee (A/78/576, para. 9)] \n \n \n \n78/62. Report of the Disarmament Commission \n \n \n \nThe General Assembly, \n \nHaving considered the report of the Disarmament Commission,1 \n \nRecalling its resolutions 47/54 A of 9 December 1992, 47/54 G of 8 April 1993, \n48/77 A of 16 December 1993, 49/77 A of 15 December 1994, 50/72 D of 12 December \n1995, 51/47 B of 10 December 1996, 52/40 B of 9 December 1997, 53/79 A of \n4 December 1998, 54/56 A of 1 December 1999, 55/35 C of 20 November 2000, 56/26 A \nof 29 November 2001, 57/95 of 22 November 2002, 58/67 of 8 December 2003, \n59/105 of 3 December 2004, 60/91 of 8 December 2005, 61/98 of 6 December 2006, \n62/54 of 5 December 2007, 63/83 of 2 December 2008, 64/65 of 2 December 2009, \n65/86 of 8 December 2010, 66/60 of 2 December 2011, 67/71 of 3 December 2012, \n68/63 of 5 December 2013, 69/77 of 2 December 2014, 70/68 of 7 December 2015, \n71/82 of 5 December 2016, 72/66 of 4 December 2017, 73/82 of 5 December 2018 \nand 77/90 of 7 December 2022, and its decisions 74/511 of 12 December 2019, 74/546 \nof 2 April 2020, 75/519 A of 7 December 2020, 75/519 B of 25 March 2021 and 76/518 \nof 6 December 2021, \n \nConsidering the role that the Disarmament Commission has been called upon to \nplay and the contribution that it should make in examining and submitting \nrecommendations on various problems in the field of disarmament and in promoting \nthe implementation of the relevant decisions adopted by the General Assembly at its \ntenth special session, \n \nRecalling in particular General Assembly resolution 45/62 B of 4 December \n1990, in which it noted with satisfaction the adoption by consensus of a set of \u201cWays \n__________________ \n \n1 Official Records of the General Assembly, Seventy-eighth Session, Supplement No. 42 (A/78/42). \n\nA/RES/78/62 \nReport of the Disarmament Commission\n \n23-24463\n2/3 \n \nand means to enhance the functioning of the Disarmament Commission\u201d, 2 Assembly \ndecision 52/492 of 8 September 1998 concerning the efficient functioning of the \nCommission and Assembly resolution 61/98, which contains additional measures for \nimproving the effectiveness of the methods of work of the Commission, \n \nReaffirming the mandate of the Disarmament Commission as the specialized, \ndeliberative subsidiary body of the General Assembly that allows for in-depth \ndeliberations on specific disarmament issues, leading to the submission of concrete \nrecommendations on those issues, and recalling that the Commission shall make every \neffort to ensure that, insofar as possible, decisions on substantive issues be adopted \nby consensus, as set forth in paragraph 118 of the Final Document of the Tenth Special \nSession of the General Assembly,3 \n \nEmphasizing once again the important place of the Disarmament Commission \nwithin the United Nations multilateral disarmament machinery, \n \n1. \nTakes note of the report of the Disarmament Commission;  \n \n2. \nCommends the Disarmament Commission for the successful conclusion of \nits consideration of the item entitled \u201cPreparation of recommendations to promote the \npractical implementation of transparency and confidence-building measures in outer \nspace activities with the goal of preventing an arms race in outer space, in accordance \nwith the recommendations set out in the report of the Group of Governmental Experts \non Transparency and Confidence-Building Measures in Outer Space Activities\u201d, and \nendorses the text adopted thereon;4  \n \n3. \nNotes with regret that the Disarmament Commission was not able to reach \na consensus on the item entitled \u201cRecommendations for achieving the objective of \nnuclear disarmament and non-proliferation of nuclear weapons\u201d;  \n \n4. \nReaffirms the importance of further enhancing the dialogue and \ncooperation among the First Committee, the Disarmament Commission and the \nConference on Disarmament;  \n \n5. \nRequests the Disarmament Commission to continue its work in accordance \nwith its mandate, as set forth in paragraph 118 of the Final Document of the Tenth \nSpecial Session of the General Assembly, and with paragraph 3 of Assembly resolution \n37/78 H of 9 December 1982, and to that end to make every effort to achieve specific \nrecommendations on the items on its agenda, taking into account the adopted \u201cWays \nand means to enhance the functioning of the Disarmament Commission\u201d;  \n \n6. \nRecommends that the Disarmament Commission consider the following \nitems at its substantive session of 2024:  \n \n(a) \n[To be determined]; \n \n(b) \n[To be determined]; \n \n7. \nEncourages the Disarmament Commission to invite, as appropriate, the \nUnited Nations Institute for Disarmament Research to prepare background papers on \nthe items on its agenda and, if need be, other disarmament experts to present their \nviews, as provided for in paragraph 3 (e) of resolution 61/98, upon the invitation of the \nChair and with the prior approval of the Commission; \n \n8. \nRequests the Disarmament Commission to hold a substantive session for a \nperiod not exceeding three weeks during 2024, namely from 1 to 19 April, and an \n__________________ \n \n2 Resolution 44/119 C, annex. \n \n3 Resolution S-10/2. \n \n4 Official Records of the General Assembly, Seventy-eighth Session, Supplement No. 42 (A/78/42), \nannex. \n\nReport of the Disarmament Commission \nA/RES/78/62\n \n3/3\n23-24463 \n \norganizational session at the beginning of 2024 before the substantive session, to elect \nits Bureau and address other outstanding organizational matters, and to submit a \nsubstantive report to the General Assembly at its seventy-ninth session, and stresses \nthat the report of the Commission should contain a summary by the Chair of the \nproceedings to reflect different views or positions if no agreement can be reached on \nthe specific agenda item deliberated on, as provided for in paragraph 3.4 of the adopted \n\u201cWays and means to enhance the functioning of the Disarmament Commission\u201d; \n \n9. \nRequests the Secretary-General to ensure full provision to the Disarmament \nCommission and its subsidiary bodies of interpretation and translation facilities in the \nofficial languages and to assign, as a matter of priority, all the resources and services \nnecessary, including verbatim records, to that end, and also requests the Secretary-\nGeneral to transmit to the Commission the annual report of the Conference on \nDisarmament on its 2023 session,5 together with all the official records of the seventy-\neighth session of the General Assembly relating to disarmament matters, and to render \nall assistance that the Commission may require for implementing the present \nresolution; \n \n10. Invites Member States to submit their views and proposals on the matter \nearly enough to enable practical consultations among them prior to the beginning of \nthe substantive session of 2024 of the Disarmament Commission, with a view to \nfacilitating its constructive outcome, and in this regard encourages the Chair-\ndesignate to commence consultations and preparations for the substantive session of \n2024 in a timely manner upon his or her nomination; \n \n11. \nDecides to include in the provisional agenda of its seventy-ninth session, \nunder the item entitled \u201cReview of the implementation of the recommendations and \ndecisions adopted by the General Assembly at its tenth special session\u201d, the sub-item \nentitled \u201cReport of the Disarmament Commission\u201d. \n \n42nd plenary meeting \n4 December 2023 \n \n__________________ \n \n5 Ibid., Supplement No.27 (A/78/27). \n",
  "paragraphs": {
    "1": "Takes note of the report of the Disarmament Commission;",
    "2": "Commends the Disarmament Commission for the successful conclusion of its consideration of the item entitled \u201cPreparation of recommendations to promote the practical implementation of transparency and confidence-building measures in outer space activities with the goal of preventing an arms race in outer space, in accordance with the recommendations set out in the report of the Group of Governmental Experts on Transparency and Confidence-Building Measures in Outer Space Activities\u201d, and endorses the text adopted thereon;4",
    "3": "Notes with regret that the Disarmament Commission was not able to reach a consensus on the item entitled \u201cRecommendations for achieving the objective of nuclear disarmament and non-proliferation of nuclear weapons\u201d;",
    "4": "Reaffirms the importance of further enhancing the dialogue and cooperation among the First Committee, the Disarmament Commission and the Conference on Disarmament;",
    "5": "Requests the Disarmament Commission to continue its work in accordance with its mandate, as set forth in paragraph 118 of the Final Document of the Tenth Special Session of the General Assembly, and with paragraph 3 of Assembly resolution 37/78 H of 9 December 1982, and to that end to make every effort to achieve specific recommendations on the items on its agenda, taking into account the adopted \u201cWays and means to enhance the functioning of the Disarmament Commission\u201d;",
    "6": "Recommends that the Disarmament Commission consider the following items at its substantive session of 2024: (a) [To be determined]; (b) [To be determined];",
    "7": "Encourages the Disarmament Commission to invite, as appropriate, the United Nations Institute for Disarmament Research to prepare background papers on the items on its agenda and, if need be, other disarmament experts to present their views, as provided for in paragraph 3 (e) of resolution 61/98, upon the invitation of the Chair and with the prior approval of the Commission;",
    "8": "Requests the Disarmament Commission to hold a substantive session for a period not exceeding three weeks during 2024, namely from 1 to 19 April, and an organizational session at the beginning of 2024 before the substantive session, to elect its Bureau and address other outstanding organizational matters, and to submit a substantive report to the General Assembly at its seventy-ninth session, and stresses that the report of the Commission should contain a summary by the Chair of the proceedings to reflect different views or positions if no agreement can be reached on the specific agenda item deliberated on, as provided for in paragraph 3.4 of the adopted \u201cWays and means to enhance the functioning of the Disarmament Commission\u201d;",
    "9": "Requests the Secretary-General to ensure full provision to the Disarmament Commission and its subsidiary bodies of interpretation and translation facilities in the official languages and to assign, as a matter of priority, all the resources and services necessary, including verbatim records, to that end, and also requests the Secretary- General to transmit to the Commission the annual report of the Conference on Disarmament on its 2023 session,5 together with all the official records of the seventy- eighth session of the General Assembly relating to disarmament matters, and to render all assistance that the Commission may require for implementing the present resolution;",
    "10": "Invites Member States to submit their views and proposals on the matter early enough to enable practical consultations among them prior to the beginning of the substantive session of 2024 of the Disarmament Commission, with a view to facilitating its constructive outcome, and in this regard encourages the Chair- designate to commence consultations and preparations for the substantive session of 2024 in a timely manner upon his or her nomination;",
    "11": "Decides to include in the provisional agenda of its seventy-ninth session, under the item entitled \u201cReview of the implementation of the recommendations and decisions adopted by the General Assembly at its tenth special session\u201d, the sub-item entitled \u201cReport of the Disarmament Commission\u201d."
  },
  "agenda_items": [
    "Item 101"
  ],
  "symbol_references": []
}