{
  "symbol": "A/RES/74/211",
  "filename": "A_RES_74_211.pdf",
  "title": "74/211. Sustainable tourism and sustainable development in Central America",
  "text": "United Nations \nA/RES/74/211\n \n \nGeneral Assembly \nDistr.: General \n15 January 2020 \n \n19-22424 (E)    170120 \n*1922424* \n \n \nSeventy-fourth session \nAgenda item 19 \nSustainable development \n \n \n \n \n Resolution adopted by the General Assembly \non 19 December 2019 \n \n \n \n \n[on the report of the Second Committee (A/74/381)] \n \n \n \n74/211. Sustainable tourism and sustainable development \nin Central America \n \n \n \nThe General Assembly, \n \nRecalling its resolutions 68/207 of 20 December 2013, 70/196 of 22 December \n2015 and 72/214 of 20 December 2017, and all relevant declarations and conferences \non this matter, \n \nReaffirming its resolution 70/1 of 25 September 2015, entitled \u201cTransforming \nour world: the 2030 Agenda for Sustainable Development\u201d, in which it adopted a \ncomprehensive, far-reaching and people-centred set of universal and transformative \nSustainable Development Goals and targets, its commitment to working tirelessly for \nthe full implementation of the Agenda by 2030, its recognition that eradicating \npoverty in all its forms and dimensions, including extreme poverty, is the greatest \nglobal challenge and an indispensable requirement for sustainable development, its \ncommitment to achieving sustainable development in its three dimensions \u2013 \neconomic, social and environmental \u2013 in a balanced and integrated manner, and to \nbuilding upon the achievements of the Millennium Development Goals and seeking \nto address their unfinished business, \n \nReaffirming also its resolution 69/313 of 27 July 2015 on the Addis Ababa \nAction Agenda of the Third International Conference on Financing for Development, \nwhich is an integral part of the 2030 Agenda for Sustainable Development, supports \nand complements it, helps to contextualize its means of implementation targets with \nconcrete policies and actions, and reaffirms the strong political commitment to \naddress the challenge of financing and creating an enabling environment at all levels \nfor sustainable development in the spirit of global partnership and solidarity, \n\nA/RES/74/211 \nSustainable tourism and sustainable\ndevelopment in Central America\n \n19-22424\n2/7 \n \n \nReaffirming further the Paris Agreement 1  and its early entry into force, \nencouraging all its parties to fully implement the Agreement, and parties to the United \nNations Framework Convention on Climate Change 2 that have not yet done so to \ndeposit their instruments of ratification, acceptance, approval or accession, where \nappropriate, as soon as possible, \n \nRecalling the Sendai Framework for Disaster Risk Reduction 2015\u20132030,3 in \nwhich Member States recognized the need to promote and integrate disaster risk \nmanagement approaches throughout the tourism industry, given the often heavy \nreliance on tourism as a key economic driver, \n \nNoting with concern that, owing to its geographical location and its geological \nand hydrometeorological characteristics, Central America is a region prone and \nvulnerable to adverse natural events which have caused substantial human and \neconomic losses, including impacts on gross domestic product per capita, income, \nand poverty reduction, \n \nRecognizing that Central America is a region of significant natural resources \nand that its rich biodiversity provides invaluable benefits to its populations and to its \ncountries\u2019 economies, and noting that sustainable tourism can contribute directly to \nthe conservation of ecosystems through a variety of activities and by raising \nawareness of the importance of biodiversity and, in this regard, that the Central \nAmerican countries are improving their institutional and policy frameworks, \nstrategies and action plans, \n \nNoting the role of the World Tourism Organization as a member of the informal \nadvisory group on mainstreaming biodiversity, which is tasked with supporting the \nExecutive Secretary and the Bureau of the Conference of the Parties to the Convention \non Biological Diversity in developing a coherent outline for a long-term approach on \nmainstreaming, including on ways to integrate mainstreaming adequately into a \npost-2020 global biodiversity framework, looking forward to the convening of the \nsummit on biodiversity in 2020, and looking forward also to the fifteenth meeting of \nthe Conference of the Parties to the Convention on Biological Diversity, to be held in \nKunming, China, in 2020, which is expected to adopt a post-2020 global biodiversity \nframework, \n \nRecalling its resolution 70/193 of 22 December 2015, entitled \u201cInternational \nYear of Sustainable Tourism for Development, 2017\u201d, and noting the efforts and \ninitiatives taken to celebrate the Year, with a view to creating awareness of the \nimportant contribution of tourism to sustainable development while promoting the \nexchange of good practices, knowledge and experiences, as well as increased cross-\nborder collaboration by developing joint ventures to increase the synergies of tourism, \nincluding the sharing of tourism-related data and statistics, as appropriate, \n \nRecognizing the important cross-cutting role of sustainable tourism as a positive \ncontribution to the three dimensions of sustainable development and the achievement \nof the Sustainable Development Goals, including the eradication of poverty, with a \nfocus on ecotourism, rural tourism, community-based tourism and micro-, small and \nmedium-sized enterprises, the generation of trade opportunities, protection of the \nenvironment, improvement of quality of life, and advancement on gender equality \nand the empowerment of women and girls, especially in developing countries, \n \nRecognizing also the importance of promoting tourism product development by \nindigenous peoples and local communities in order to support their economic \n__________________ \n \n1  Adopted under the UNFCCC in FCCC/CP/2015/10/Add.1, decision 1/CP.21. \n \n2  United Nations, Treaty Series, vol. 1771, No. 30822. \n \n3  Resolution 69/283, annex II. \n\nSustainable tourism and sustainable \ndevelopment in Central America \nA/RES/74/211\n \n3/7\n19-22424 \n \ndevelopment and participation in trade while protecting natural environments and \ncultural traditions, \n \nStressing the need for responsible tourism and for its beneficial socioeconomic \nimpact on local communities, the economic empowerment of women through tourism, \nfair tourism, the protection of women, children and people in vulnerable situations \nagainst all forms of exploitation in tourism, the prevention of trafficking in persons \nand trafficking in cultural artefacts, respect for intangible cultural heritage and \ncultural and natural sites, the protection of tourists as consumers and the provision of \nunbiased information to tourists, \n \nNoting in this regard the role of the Central American Integration System, 4 \nthrough the Central American Tourism Integration Secretariat, in the promotion of \nsustainable tourism in the region, \n \nCommending the ongoing efforts of the Governments of the Central American \ncountries, in coordination with the Central American Commission on Environment \nand Development and in cooperation with the World Tourism Organization, in the \nimplementation of existing and new programmes designed to launch and promote \nsustainable tourism throughout the region, \n \nNoting the existing joint initiatives designed and implemented to stimulate \nregional tourism integration and to foster the development of indigenous and local \ncommunities, such as the Mayan World regional brand, \n \nRecalling the outcomes of the Forum on Tourism, Sustainability and Climate \nChange in Central America, held from 11 to 13 April 2013 in La Ceiba, Honduras, the \ndeclaration of the fifteenth forum on the development of tourism and on the \nharmonization of efforts to promote tourism in Central America and the Dominican \nRepublic, held in Guatemala City on 27 August 2014, and the outcomes adopted at \nthe 112th meeting of the Central American Tourism Council, held in San Salvador on \n23 September 2019, \n \nNoting the twenty-third session of the General Assembly of the World \nTourism Organization, held in Saint Petersburg, Russian Federation, from 9 to \n13 September 2019, \n \nAcknowledging the importance of ongoing actions to accelerate the shift towards \nsustainable consumption and production5 in the tourism sector while contributing to \nsustainable development and resilient societies, \n \nTaking note of the World Tourism Organization World Tourism Barometer of \nJanuary 2019, according to which the tourism sector has become a major economic \nactivity for many of the countries in the region, creating much-needed job \nopportunities and bringing in significant income and foreign exchange earnings, \n \n1. \nTakes note of the report of the Secretary-General;6 \n \n2. \nRecognizes the major role that sustainable tourism plays in the \ndevelopment of the Central American countries, as an instrument of social inclusion \nthat generates decent jobs and contributes to the improvement of the quality of life of \nthe population, aimed at achieving poverty eradication in all its forms and dimensions; \n \n3. \nAlso recognizes that since the adoption of resolution 72/214 in 2017, the \nCentral American countries have strengthened efforts to promote sustainable tourism \nand sustainable development, as well as enhanced inclusiveness and coordination \n__________________ \n \n4  The membership of the Central American Integration System includes Belize, Costa Rica, the \nDominican Republic, El Salvador, Guatemala, Honduras, Nicaragua and Panama. \n \n5  In accordance with United Nations Environment Assembly resolution 4/1 (UNEP/EA.4/Res.1). \n \n6  A/74/208. \n\nA/RES/74/211 \nSustainable tourism and sustainable\ndevelopment in Central America\n \n19-22424\n4/7 \n \namong all stakeholders, and have also highlighted the key role that sustainable \ntourism plays in achieving the Sustainable Development Goals and targets; 7 \n \n4. \nRecalls the adoption of the principles of sustainable tourism, developed by \nthe Central American Tourism Integration Secretariat and found in its strategic plan \nfor sustainable development, 2014\u20132018, which captures the region\u2019s vision of itself \nas an integrated, sustainable, multi-location, cross-border destination of high quality \nand emphasizes its action plan for tourism and climate change as a component of the \nregional strategy on climate change; \n \n5. \nRecognizes that the tourism sector has been a catalyst for achieving \nsustainable development in its three dimensions in Central America, including \naddressing environmental issues, in particular climate change, poverty eradication \nand economic development, highlighting the importance of strengthening appropriate \npolicies and financial support within a broader framework of sustainable development \npolicies; \n \n6. \nEncourages regional and national tourism organizations to promote \ndestination models that seek the highest possible direct benefits for local and national \neconomies, in order to contribute to improving quality of life and reducing poverty in \nlocal communities, taking into account the integration of sustainability policies in the \ntourism sector, and invites all stakeholders to identify, assess and mitigate the impacts \nof tourism on the three dimensions of sustainable development; \n \n7. \nRecognizes the valuable role of international cooperation with relevant \npartners, and encourages them to continue to support the implementation of various \nprojects aimed at promoting sustainable tourism in the region by, inter alia, \nstrengthening ecotourism, rural, cultural and heritage tourism, including colonial \nsites, preventing trafficking in cultural artefacts and ensuring respect for intangible \ncultural heritage and cultural and natural sites; \n \n8. \nWelcomes the progress made by the Central American countries in \nconverging towards a regional tourism strategy based on preserving the region\u2019s \nbiodiversity and natural and cultural attractions and reducing poverty through \nemployment and entrepreneurial tourism development that emphasizes micro-, small \nand medium-sized enterprises, while addressing the adverse effects of climate change, \nto improve the quality of life of the region\u2019s inhabitants; \n \n9. \nAppreciates the continued efforts of the Central American countries to \nsupport sustainable tourism development, including the adoption and implementation \nof new legislation and policies, and encourages them to use sustainable tourism as a \ntool to promote the eradication of poverty and enhance the protection of biodiversity, \ncultural heritage and community development; \n \n10. Encourages cooperation to promote the engagement of women, youth, \nindigenous peoples and local communities and initiatives that foster their \nsocioeconomic empowerment through sustainable tourism that continues to promote \nequitable partnerships, the creation of jobs and entrepreneurial opportunities; \n \n11. \nRecognizes the continued need to support sustainable tourism activities \nand relevant capacity-building efforts that promote environmental awareness, \nconserve and protect the environment, respect wildlife, biodiversity, ecosystems and \ncultural diversity and improve the welfare and livelihoods of local communities by \nsupporting their local economies and the human and natural environment as a whole; \n \n12. Notes the importance of adequately measuring the sociocultural and \nenvironmental impact of tourism, and encourages efforts to fill the present data gap \n__________________ \n \n7  See resolution 70/1. \n\nSustainable tourism and sustainable \ndevelopment in Central America \nA/RES/74/211\n \n5/7\n19-22424 \n \nin this area by taking advantage of the emergence of non-traditional solutions and \nsources of data, with an overarching goal of advancing the national sustainable \ndevelopment agenda beyond the tourism sector; \n \n13. Recognizes that the implementation of sustainable consumption and \nproduction patterns in the tourism sector in Central America, and hence advancing \nthe 2030 Agenda for Sustainable Development7 in the region, requires, inter alia, the \nidentification and adoption of more resource-efficient tourism planning approaches \nby all relevant stakeholders; \n \n14. Stresses the need to promote the further development of sustainable \ntourism, in particular through the consumption of sustainable tourism products and \nservices, and to strengthen the development of ecotourism, maintaining, in particular, \nthe culture and environmental integrity of indigenous and local communities and \nenhancing the protection of ecologically sensitive areas and the natural heritage and \nindigenous cultural and religious sites of those communities; \n \n15. Invites Governments and other stakeholders to join the Sustainable \nTourism Programme of the 10-Year Framework of Programmes on Sustainable \nConsumption and Production Patterns, 8 which aims at promoting innovation and \ncircular thinking to accelerate resource efficiency in the tourism value chain; \n \n16. Welcomes the establishment of two observatories for sustainable tourism \nin Central America, 9 and invites Governments and other stakeholders to consider \njoining the International Network of Sustainable Tourism Observatories of the World \nTourism Organization, which contributes to the promotion of economically, socially \nand environmentally sustainable tourism, and to support the practice of informed \npolicymaking around the world; \n \n17. Encourages further collaboration by public-private partnerships towards \nthe enhancement of quality data collection, taking into account the concerted efforts \nby national authorities of the Central American countries, in conjunction with the \nprivate sector, through the establishment of observatories for sustainable tourism to \nmonitor the development of tourism at the destination level in order to provide timely \ninformation for evidence-based policies and decision-making; \n \n18. Urges the tourism sector in the Central American countries to be part of \nthe coordination, knowledge-sharing and communication mechanisms for security \nand emergency management at the national and regional levels and to collectively \npromote an evidence-based approach in developing measures for safe, secure and \nseamless travel, which will enable government agencies to make relevant, informed \nand coordinated decisions; \n \n19. Emphasizes, taking into account the fact that the tourism sector is \nvulnerable to natural disasters, the need to foster resilient tourism development in the \nCentral American region, including through national strategies for rehabilitation after \nshocks, climate change adaptation and disaster risk reduction plans and public-private \npartnerships; \n \n20. Welcomes the efforts of the World Tourism Organization, the United \nNations Environment Programme, the United Nations Conference on Trade and \nDevelopment, the United Nations Educational, Scientific and Cultural Organization, \nregional commissions and other regional organizations, as well as the Conference of \nthe Parties to the Convention on Biological Diversity, to promote sustainable tourism \nworldwide; \n__________________ \n \n8  A/CONF.216/5, annex. \n \n9  The observatories are located in Panama City and in La Antigua Guatemala. \n\nA/RES/74/211 \nSustainable tourism and sustainable\ndevelopment in Central America\n \n19-22424\n6/7 \n \n \n21. Invites Member States and other stakeholders and the World Tourism \nOrganization to continue to support the activities undertaken by the Central American \ncountries for the promotion of sustainable tourism in the region, including with regard \nto emergency preparedness for better disaster risk reduction, the vulnerabilities of the \nCentral American countries to natural disasters, and their impacts on sustainable \ntourism, as well as for capacity-building, job creation and the promotion of local \nculture and products, and the achievement of the Sustainable Development Goals; \n \n22. Invites the international community to support efforts, as appropriate, in \ncreating and implementing innovative technologies to modernize the tourism industry \nin the Central American countries; \n \n23. Encourages the Central American countries, through the Central American \nTourism Council and the Central American Tourism Integration Secretariat, to \npromote sustainable tourism by intensifying bilateral, regional and multilateral \ncooperation at the level of the tourism industry, and to continue to support sustainable \ntourism through policies that foster responsive and inclusive tourism, strengthen \nregional identity and protect their natural and cultural heritage, including their \necosystems and biodiversity, and notes that existing initiatives, such as the Global \nPartnership for Sustainable Tourism, among other international initiatives, can deliver \ndirect and focused support to Governments; \n \n24. Also encourages the Central American countries to establish and \nstrengthen secure, reliable, efficient, high-quality, sustainable and resilient \ninfrastructure, including transit transport systems that link them to international \nmarkets, affordable, reliable, sustainable and modern energy and information and \ncommunications technology, with the support of the international community, as \nappropriate, so as to promote sustainable tourism in the region; \n \n25. Recognizes that persons with disabilities have equal rights to access \ntourism services and opportunities, such as independent travel, accessible services, \ntrained staff, reliable information and inclusive marketing, and that great efforts \nshould be made to ensure that tourism policies and practices are inclusive of persons \nwith disabilities, the majority of whom live in developing countries; \n \n26. Calls upon Member States and the tourism sector to take effective \nmeasures, in the context of sustainable tourism, including ecotourism initiatives, to \nhelp to promote the equal participation of women and the balanced participation of \nyouth, older persons, persons with disabilities, indigenous peoples and local \ncommunities, at all levels and in decision-making processes in all areas, and to \npromote effective economic empowerment, mainly through decent job and income \ncreation; \n \n27. Recognizes that addressing the need for improved monitoring of the \ndevelopment impacts of tourism requires rethinking and changing traditional \npractices in order to incorporate multiple data sources to provide public \nadministrations and the tourism sector with the most updated intelligence on tourism, \nand notes the progress achieved through the International Network of Sustainable \nTourism Observatories of the World Tourism Organization, which is focused on \ncontinuously monitoring the impacts of tourism, tackling the three dimensions of \nsustainability, strengthening evidence-based decision-making and creating a culture \nof continuous and timely monitoring and measurement; \n \n28. Welcomes the positive role of tourism in the conservation of biodiversity \nand in fighting climate change, which provides a further argument for enhancing the \nenvironmental components of tourism policies and better utilizing the potential of \ntourism as an enabling agent of change, and the convening of the United Nations \n\nSustainable tourism and sustainable \ndevelopment in Central America \nA/RES/74/211\n \n7/7\n19-22424 \n \nClimate Change Conference in Madrid within the context of the twenty-fifth session \nof the Conference of the Parties to the United Nations Framework Convention on \nClimate Change; \n \n29. Requests the Secretary-General, in cooperation with the Secretary-General \nof the World Tourism Organization and with other relevant United Nations entities, \nto submit to the General Assembly at its seventy-sixth session an action-oriented \nreport on the implementation of the present resolution, including concrete \nrecommendations to accelerate the implementation of the 2030 Agenda for \nSustainable Development in this regard, in the Central American countries, and \ndecides to include in the provisional agenda of its seventy-sixth session the item \nentitled \u201cSustainable development\u201d. \n \n52nd plenary meeting \n19 December 2019 \n \n",
  "paragraphs": {
    "1": "Takes note of the report of the Secretary-General;6",
    "2": "Recognizes the major role that sustainable tourism plays in the development of the Central American countries, as an instrument of social inclusion that generates decent jobs and contributes to the improvement of the quality of life of the population, aimed at achieving poverty eradication in all its forms and dimensions;",
    "3": "Also recognizes that since the adoption of resolution 72/214 in 2017, the Central American countries have strengthened efforts to promote sustainable tourism and sustainable development, as well as enhanced inclusiveness and coordination among all stakeholders, and have also highlighted the key role that sustainable tourism plays in achieving the Sustainable Development Goals and targets; 7",
    "4": "Recalls the adoption of the principles of sustainable tourism, developed by the Central American Tourism Integration Secretariat and found in its strategic plan for sustainable development, 2014\u20132018, which captures the region\u2019s vision of itself as an integrated, sustainable, multi-location, cross-border destination of high quality and emphasizes its action plan for tourism and climate change as a component of the regional strategy on climate change;",
    "5": "Recognizes that the tourism sector has been a catalyst for achieving sustainable development in its three dimensions in Central America, including addressing environmental issues, in particular climate change, poverty eradication and economic development, highlighting the importance of strengthening appropriate policies and financial support within a broader framework of sustainable development policies;",
    "6": "Encourages regional and national tourism organizations to promote destination models that seek the highest possible direct benefits for local and national economies, in order to contribute to improving quality of life and reducing poverty in local communities, taking into account the integration of sustainability policies in the tourism sector, and invites all stakeholders to identify, assess and mitigate the impacts of tourism on the three dimensions of sustainable development;",
    "7": "Recognizes the valuable role of international cooperation with relevant partners, and encourages them to continue to support the implementation of various projects aimed at promoting sustainable tourism in the region by, inter alia, strengthening ecotourism, rural, cultural and heritage tourism, including colonial sites, preventing trafficking in cultural artefacts and ensuring respect for intangible cultural heritage and cultural and natural sites;",
    "8": "Welcomes the progress made by the Central American countries in converging towards a regional tourism strategy based on preserving the region\u2019s biodiversity and natural and cultural attractions and reducing poverty through employment and entrepreneurial tourism development that emphasizes micro-, small and medium-sized enterprises, while addressing the adverse effects of climate change, to improve the quality of life of the region\u2019s inhabitants;",
    "9": "Appreciates the continued efforts of the Central American countries to support sustainable tourism development, including the adoption and implementation of new legislation and policies, and encourages them to use sustainable tourism as a tool to promote the eradication of poverty and enhance the protection of biodiversity, cultural heritage and community development;",
    "10": "Encourages cooperation to promote the engagement of women, youth, indigenous peoples and local communities and initiatives that foster their socioeconomic empowerment through sustainable tourism that continues to promote equitable partnerships, the creation of jobs and entrepreneurial opportunities;",
    "11": "Recognizes the continued need to support sustainable tourism activities and relevant capacity-building efforts that promote environmental awareness, conserve and protect the environment, respect wildlife, biodiversity, ecosystems and cultural diversity and improve the welfare and livelihoods of local communities by supporting their local economies and the human and natural environment as a whole;",
    "12": "Notes the importance of adequately measuring the sociocultural and environmental impact of tourism, and encourages efforts to fill the present data gap in this area by taking advantage of the emergence of non-traditional solutions and sources of data, with an overarching goal of advancing the national sustainable development agenda beyond the tourism sector;",
    "13": "Recognizes that the implementation of sustainable consumption and production patterns in the tourism sector in Central America, and hence advancing the 2030 Agenda for Sustainable Development7 in the region, requires, inter alia, the identification and adoption of more resource-efficient tourism planning approaches by all relevant stakeholders;",
    "14": "Stresses the need to promote the further development of sustainable tourism, in particular through the consumption of sustainable tourism products and services, and to strengthen the development of ecotourism, maintaining, in particular, the culture and environmental integrity of indigenous and local communities and enhancing the protection of ecologically sensitive areas and the natural heritage and indigenous cultural and religious sites of those communities;",
    "15": "Invites Governments and other stakeholders to join the Sustainable Tourism Programme of the 10-Year Framework of Programmes on Sustainable Consumption and Production Patterns, 8 which aims at promoting innovation and circular thinking to accelerate resource efficiency in the tourism value chain;",
    "16": "Welcomes the establishment of two observatories for sustainable tourism in Central America, 9 and invites Governments and other stakeholders to consider joining the International Network of Sustainable Tourism Observatories of the World Tourism Organization, which contributes to the promotion of economically, socially and environmentally sustainable tourism, and to support the practice of informed policymaking around the world;",
    "17": "Encourages further collaboration by public-private partnerships towards the enhancement of quality data collection, taking into account the concerted efforts by national authorities of the Central American countries, in conjunction with the private sector, through the establishment of observatories for sustainable tourism to monitor the development of tourism at the destination level in order to provide timely information for evidence-based policies and decision-making;",
    "18": "Urges the tourism sector in the Central American countries to be part of the coordination, knowledge-sharing and communication mechanisms for security and emergency management at the national and regional levels and to collectively promote an evidence-based approach in developing measures for safe, secure and seamless travel, which will enable government agencies to make relevant, informed and coordinated decisions;",
    "19": "Emphasizes, taking into account the fact that the tourism sector is vulnerable to natural disasters, the need to foster resilient tourism development in the Central American region, including through national strategies for rehabilitation after shocks, climate change adaptation and disaster risk reduction plans and public-private partnerships;",
    "20": "Welcomes the efforts of the World Tourism Organization, the United Nations Environment Programme, the United Nations Conference on Trade and Development, the United Nations Educational, Scientific and Cultural Organization, regional commissions and other regional organizations, as well as the Conference of the Parties to the Convention on Biological Diversity, to promote sustainable tourism worldwide;",
    "21": "Invites Member States and other stakeholders and the World Tourism Organization to continue to support the activities undertaken by the Central American countries for the promotion of sustainable tourism in the region, including with regard to emergency preparedness for better disaster risk reduction, the vulnerabilities of the Central American countries to natural disasters, and their impacts on sustainable tourism, as well as for capacity-building, job creation and the promotion of local culture and products, and the achievement of the Sustainable Development Goals;",
    "22": "Invites the international community to support efforts, as appropriate, in creating and implementing innovative technologies to modernize the tourism industry in the Central American countries;",
    "23": "Encourages the Central American countries, through the Central American Tourism Council and the Central American Tourism Integration Secretariat, to promote sustainable tourism by intensifying bilateral, regional and multilateral cooperation at the level of the tourism industry, and to continue to support sustainable tourism through policies that foster responsive and inclusive tourism, strengthen regional identity and protect their natural and cultural heritage, including their ecosystems and biodiversity, and notes that existing initiatives, such as the Global Partnership for Sustainable Tourism, among other international initiatives, can deliver direct and focused support to Governments;",
    "24": "Also encourages the Central American countries to establish and strengthen secure, reliable, efficient, high-quality, sustainable and resilient infrastructure, including transit transport systems that link them to international markets, affordable, reliable, sustainable and modern energy and information and communications technology, with the support of the international community, as appropriate, so as to promote sustainable tourism in the region;",
    "25": "Recognizes that persons with disabilities have equal rights to access tourism services and opportunities, such as independent travel, accessible services, trained staff, reliable information and inclusive marketing, and that great efforts should be made to ensure that tourism policies and practices are inclusive of persons with disabilities, the majority of whom live in developing countries;",
    "26": "Calls upon Member States and the tourism sector to take effective measures, in the context of sustainable tourism, including ecotourism initiatives, to help to promote the equal participation of women and the balanced participation of youth, older persons, persons with disabilities, indigenous peoples and local communities, at all levels and in decision-making processes in all areas, and to promote effective economic empowerment, mainly through decent job and income creation;",
    "27": "Recognizes that addressing the need for improved monitoring of the development impacts of tourism requires rethinking and changing traditional practices in order to incorporate multiple data sources to provide public administrations and the tourism sector with the most updated intelligence on tourism, and notes the progress achieved through the International Network of Sustainable Tourism Observatories of the World Tourism Organization, which is focused on continuously monitoring the impacts of tourism, tackling the three dimensions of sustainability, strengthening evidence-based decision-making and creating a culture of continuous and timely monitoring and measurement;",
    "28": " Climate Change Conference in Madrid within the context of the twenty-fifth session of the Conference of the Parties to the United Nations Framework Convention on Climate Change;",
    "29": "Requests the Secretary-General, in cooperation with the Secretary-General of the World Tourism Organization and with other relevant United Nations entities, to submit to the General Assembly at its seventy-sixth session an action-oriented report on the implementation of the present resolution, including concrete recommendations to accelerate the implementation of the 2030 Agenda for Sustainable Development in this regard, in the Central American countries, and decides to include in the provisional agenda of its seventy-sixth session the item entitled \u201cSustainable development\u201d."
  },
  "agenda_items": [
    "Item 19"
  ],
  "symbol_references": []
}