{
  "symbol": "A/RES/75/299",
  "filename": "A_RES_75_299.pdf",
  "title": "75/299. Financing of the United Nations Peacekeeping Force in Cyprus",
  "text": "United Nations \nA/RES/75/299\n \n \nGeneral Assembly \nDistr.: General \n7 July 2021  \n \n21-09013 (E)    080721     \n*2109013* \n \n \nSeventy-fifth session \nAgenda item 158 \nFinancing of the United Nations Peacekeeping Force \nin Cyprus \n \n \n \n \n Resolution adopted by the General Assembly \non 30 June 2021 \n \n \n \n \n[on the report of the Fifth Committee (A/75/939, para. 6)] \n \n \n 75/299. Financing of the United Nations Peacekeeping Force in Cyprus \n \n \n \nThe General Assembly, \n \nHaving considered the reports of the Secretary-General on the financing of the \nUnited Nations Peacekeeping Force in Cyprus1 and the related report of the Advisory \nCommittee on Administrative and Budgetary Questions,2  \n \nRecalling Security Council resolution 186 (1964) of 4 March 1964 regarding \nthe establishment of the United Nations Peacekeeping Force in Cyprus and the \nsubsequent resolutions by which the Council extended the mandate of the Force, the \nlatest of which was resolution 2561 (2021) of 29 January 2021, by which the Council \nextended the mandate of the Force until 31 July 2021,  \n \nRecalling also its resolution 47/236 of 14 September 1993 on the financing of \nthe Force and its subsequent resolutions and decisions thereon, the latest of which \nwas resolution 74/285 of 30 June 2020, as well as its decision 74/571 of 3 September \n2020,  \n \nReaffirming the general principles underlying the financing of United Nations \npeacekeeping operations, as stated in its resolutions 1874 (S-IV) of 27 June 1963, \n3101 (XXVIII) of 11 December 1973 and 55/235 of 23 December 2000,  \n \nNoting with appreciation that voluntary contributions have been made to the \nForce by certain Governments,  \n \nNoting that voluntary contributions were insufficient to cover all the costs of the \nForce, including those incurred by troop-contributing Governments prior to 16 June \n1993, and regretting the absence of an adequate response to appeals for voluntary \n__________________ \n \n1  A/75/630 and A/75/746. \n \n2  A/75/822/Add.2. \n\nA/RES/75/299 \nFinancing of the United Nations Peacekeeping Force in Cyprus\n \n21-09013\n2/7 \n \ncontributions, including that contained in the letter dated 17 May 1994 from the \nSecretary-General to all Member States,3  \n \nMindful of the fact that it is essential to provide the Force with the financial \nresources necessary to enable it to fulfil its responsibilities under the relevant \nresolutions of the Security Council, \n \n1. \nRequests the Secretary-General to entrust the Head of Mission with the \ntask of formulating future budget proposals in full accordance with the provisions of \nits resolutions 59/296 of 22 June 2005, 60/266 of 30 June 2006, 61/276 of 29 June \n2007, 64/269 of 24 June 2010, 65/289 of 30 June 2011, 66/264 of 21 June 2012, \n69/307 of 25 June 2015 and 70/286 of 17 June 2016, as well as other relevant \nresolutions; \n \n2. \nTakes note of the status of contributions to the United Nations \nPeacekeeping Force in Cyprus as at 30 April 2021, including the contributions \noutstanding in the amount of 19 million United States dollars, representing some \n2.6 per cent of the total assessed contributions, notes with concern that only 101 \nMember States have paid their assessed contributions in full, and urges all other \nMember States, in particular those in arrears, to ensure payment of their outstanding \nassessed contributions;  \n \n3. \nExpresses its appreciation to those Member States that have paid their \nassessed contributions in full, and urges all other Member States to make every \npossible effort to ensure payment of their assessed contributions to the Force in full; \n \n4. \nExpresses concern at the financial situation with regard to peacekeeping \nactivities, in particular as regards the reimbursements to troop contributors that bear \nadditional burdens owing to overdue payments by Member States of their \nassessments;  \n \n5. \nEmphasizes that all future and existing peacekeeping missions shall be \ngiven equal and non-discriminatory treatment in respect of financial and \nadministrative arrangements;  \n \n6. \nAlso emphasizes that all peacekeeping missions shall be provided with \nadequate resources for the effective and efficient discharge of their respective \nmandates;  \n \n7. \nRequests the Secretary-General to ensure that proposed peacekeeping \nbudgets are based on the relevant legislative mandates;  \n \n8. \nEndorses the conclusions and recommendations contained in the report of \nthe Advisory Committee on Administrative and Budgetary Questions, subject to the \nprovisions of the present resolution, and requests the Secretary-General to ensure \ntheir full implementation; \n \n9.  \nNotes with concern the shortcomings in partnership operations between \nthe Mine Action Service and the United Nations Office for Project Services, and \nrequests the Secretary-General to conduct an independent review on the use of the \nservices of the Office and the partners selected to implement mine action activities, \nincluding an assessment of the comparative advantage of each mission in the delivery \nof those activities, and to submit the results of the analysis in the context of his report \nat the seventy-seventh session;  \n \n10. Reiterates its grave concern about the continued threat to life, health, \nsafety and security caused by the coronavirus disease (COVID-19) pandemic and the \nimportance of ensuring the safety, security and health of peacekeeping personnel, \n__________________ \n \n3  S/1994/647. \n\nFinancing of the United Nations Peacekeeping Force in Cyprus \nA/RES/75/299\n \n3/7\n21-09013 \n \nincluding through the use of safe and effective vaccines for civilian and uniformed \npersonnel, maintaining the continuity of mandate delivery, including protection of \ncivilians, minimizing the risk of mission activities causing the virus to spread and, \nwhere appropriate and within mandates, supporting national authorities, upon their \nrequest, in their response to COVID-19, in collaboration with the Resident \nCoordinator and other United Nations entities in the country; \n \n11. Notes the measures adopted to mitigate the effect of the COVID-19 \npandemic on peacekeeping operations, including facilitating the continued \nimplementation of mission mandates while ensuring the health and safety of \npeacekeeping personnel and local communities in the host country, and requests the \nSecretary-General to provide updated information on the impact of the pandemic, the \nlessons learned, best practices and how the mission improved its preparedness and \nresilience and collaborated with the host Government and regional and subregional \nactors in response to the pandemic in the context of the next performance report and \nbudget submission for the Force;  \n \n12. Notes with concern the mid- and long-term impact of the COVID-19 \npandemic on countries, regions and subregions in conflict, and emphasizes the \nimportance of United Nations peacekeeping operations, where appropriate and within \ntheir respective mandates, coordinating with national authorities and other United \nNations entities in promoting post-conflict reconstruction, peacebuilding and post-\npandemic recovery of countries and regions in conflict;  \n \n13. Recalls paragraphs 16 and 18 of its resolution 69/273 of 2 April 2015, and \nin this regard reiterates its request to the Secretary-General that he continue to explore \nadditional innovative ways to promote procurement from developing countries and \ncountries with economies in transition at Headquarters and field offices and to \nencourage interested local vendors to apply for registration on the Secretariat vendor \nroster, with a view to broadening its geographical base;  \n \n14. Encourages the Secretary-General to utilize local materials, capacity and \nknowledge in the implementation of construction projects for peacekeeping \noperations, in compliance with the United Nations Procurement Manual;  \n \n15. Requests the Secretary-General to establish clear frameworks and \nguidelines to determine the solicitation procedure, whether invitation to bid or request \nfor proposal, to be utilized for, inter alia, acquiring different types of goods and \nservices, including aviation services, and to update the United Nations Procurement \nManual accordingly;  \n \n16. Also requests the Secretary-General to take measures to ensure that the \nOrganization conforms to best practices in public procurement with respect to \ntransparency, including by placing additional information in the public domain on the \noutcome of procurement exercises conducted, including in the area of aviation \nservices, so as to further increase the transparency of the procurement operations of \nthe Organization, and to update the United Nations Procurement Manual accordingly; \n \n17. Recognizes the important role played by regional and subregional actors \nfor peacekeeping operations, and in this regard encourages the Secretary-General to \ncontinue to deepen the partnership, cooperation and coordination of the United \nNations with regional and subregional actors, in accordance with relevant mandates, \nand to provide information on such deepened engagement in the context of his next \nreport;  \n \n18. Reaffirms the provisions of section XVIII of its resolution 61/276, further \nrecognizes the important role played by quick-impact projects in supporting the \nimplementation of mission mandates, stresses the need for the timely, responsible and \n\nA/RES/75/299 \nFinancing of the United Nations Peacekeeping Force in Cyprus\n \n21-09013\n4/7 \n \naccountable implementation of all such projects, and requests the Secretary-General \nto enhance their impact while addressing underlying challenges;  \n \n19. Reiterates that the use of external consultants should be kept to an absolute \nminimum and that the Organization should utilize its in-house capacity to perform \ncore activities or to fulfil functions that are recurrent over the long term;  \n \n20. Stresses the importance of prioritizing the safety and security of United \nNations personnel as well as protection of civilians activities, in the context of \nchallenging security situations, and requests that all peacekeeping missions be \nprovided with adequate resources for the effective and efficient discharge of their \nrespective mandates, including the protection of civilians where mandated;  \n \n21. Recognizes the increasing security challenges faced by United Nations \npeacekeepers, re-emphasizes the importance of improving the safety and security of \npeacekeepers and mission personnel in an integrated manner, including enhanced \ntraining and capacity-building, force protection planning for United Nations camps \nand situational awareness, requests the Secretary-General and host Governments to \nfulfil the responsibilities under relevant resolutions of the General Assembly and the \nSecurity Council to improve the safety and security of United Nations peacekeepers \nand mission personnel, and requests the Secretary-General to report thereon in his \nnext report, and notes with appreciation the efforts of Member States in promoting \nthe safety and security of United Nations peacekeepers in this regard;  \n \n22. Reiterates its concern about the high number of vacancies in civilian \nstaffing, further reiterates its request to the Secretary-General to ensure that vacant \nposts are filled expeditiously, and requests the Secretary-General to review the posts \nthat have been vacant for 24 months or longer and to propose in his next budget \nsubmission either their retention, with clear justification of need, or their abolishment;  \n \n23. Requests the Secretary-General to consider options for greater \nnationalization of functions when formulating budget submissions, commensurate \nwith mission mandates and requirements;  \n \n24. Requests that the Secretary-General continue his ongoing efforts to ensure \nthe attainment of equitable geographical distribution in the Secretariat and to ensure \nas wide a geographical distribution of staff as possible in all departments and offices \nand at all levels, including at the Director and higher levels, of the Secretariat, and \nrequests him to report thereon in his next overview report;  \n \n25. Expresses its deep concern at the delay in the settlement of claims in \nrespect of death and disability, and reiterates its request to the Secretary-General to \nsettle death and disability claims as expeditiously as possible, but no later than three \nmonths from the date of submission of a claim; \n \n26. Notes the ongoing development of impact-based performance indicators \nas part of the implementation of the Comprehensive Performance Assessment System, \nand in this regard requests the Secretary-General in his next report to provide \ninformation on how the indicators will measure the performance by the Force of \nmandated tasks and the impact of resource allocation on that performance, as well as \nhow the indicators will contribute to the identification of the resources required for \neach mandated task;  \n \n27. Requests the Secretary-General to provide in his next report an execution \nplan for, and analysis of, the implementation of the new Comprehensive Performance \nAssessment System, including on its correlation with mission planning and budget \nformulation, in order to facilitate consideration by the General Assembly of resource \nrequests for implementation of the System;  \n\nFinancing of the United Nations Peacekeeping Force in Cyprus \nA/RES/75/299\n \n5/7\n21-09013 \n \n \n28. Notes the progress made in the implementation of the multi-year \nenvironmental strategy to reduce the footprint of peacekeeping operations, and \nrequests the Secretary-General to enhance measures for the implementation of the \nstrategy in all peacekeeping missions, in line with the five pillars of the strategy and \nin accordance with the legislative mandates and particular conditions on the ground \nand in full compliance with the relevant rules and regulations, and to report thereon \nin the context of his next overview report;  \n \n29. Also notes the recommendations of the Advisory Committee on the use of \nvirtual platforms and cost recovery of air transportation of non-United Nations \npersonnel, and urges that their implementation should take into consideration the \nspecific contexts for each mission without impacting mandate implementation;  \n \n30. Emphasizes the importance of the accountability system of the Secretariat, \nand requests the Secretary-General to continue to strengthen risk management, \ntransparency and internal controls in the management of peacekeeping budgets, in \norder to facilitate mandate implementation, and to report thereon in his next report; \n \n31. Also emphasizes the importance of overall budgetary performance in \npeacekeeping operations, and requests the Secretary-General to continue to improve \noversight of the activities of peacekeeping missions, and implement the \nrecommendations of the relevant oversight bodies, and in this regard to avoid \ndeficiencies in management and related economic losses with the aim of ensuring full \ncompliance with financial regulations and rules, while giving due regard to the \nguidance and recommendations of the General Assembly, and to report thereon in the \ncontext of the performance reports;  \n \n32. Highlights the importance of the women and peace and security agenda, \nand underlines that full implementation of the agenda by the mission can contribute \nto achieving sustainable peace and political solutions;  \n \n33. Expresses concern over the allegations of sexual exploitation and abuse \nreported in peacekeeping missions, and requests the Secretary-General to continue to \nimplement his zero-tolerance policy on sexual exploitation and abuse with regard to \nall civilian, military and police personnel, and to report thereon in the context of his \nnext report on cross-cutting issues;  \n \n34. Notes the number of pending post-traumatic stress disorder claims, and \nstresses the importance of addressing the backlog in a timely manner; \n \n35. Requests the Secretary-General to ensure the full implementation of the \nrelevant provisions of resolutions 59/296, 60/266, 61/276, 64/269, 65/289, 66/264, \n69/307 and 70/286; \n \n36. Also requests the Secretary-General to take all action necessary to ensure \nthat the Force is administered with a maximum of efficiency and economy; \n \n \n \nBudget performance report for the period from 1 July 2019 to 30 June 2020 \n \n \n37. Takes note of the report of the Secretary-General on the budget \nperformance of the Force for the period from 1 July 2019 to 30 June 2020; 4  \n \n \n \nBudget estimates for the period from 1 July 2021 to 30 June 2022 \n \n \n38. Decides to appropriate to the special account for the United Nations \nPeacekeeping Force in Cyprus the amount of 57,567,300 dollars for the period from \n1 July 2021 to 30 June 2022, inclusive of 53,798,000 dollars for the maintenance of \n__________________ \n \n4  A/75/630. \n\nA/RES/75/299 \nFinancing of the United Nations Peacekeeping Force in Cyprus\n \n21-09013\n6/7 \n \nthe Force, 3,182,000 dollars for the support account for peacekeeping operations and \n587,300 dollars for the United Nations Logistics Base at Brindisi, Italy; \n \n \n \nFinancing of the appropriation for the period from 1 July 2021 to 30 June 2022 \n \n \n39. Notes with appreciation that a one-third share of the net appropriation, \nequivalent to 18,171,067 dollars, will be funded through voluntary contributions from \nthe Government of Cyprus and the amount of 6.5 million dollars from the Government \nof Greece; \n \n40. Decides to apportion among Member States the amount of 2,741,353 \ndollars for the period from 1 to 31 July 2021, in accordance with the levels updated \nin its resolution 73/272 of 22 December 2018, taking into account the scale of \nassessments for 2021, as set out in its resolution 73/271 of 22 December 2018; \n \n41. Also decides that, in accordance with the provisions of its resolution \n973 (X) of 15 December 1955, there shall be set off against the apportionment among \nMember States, as provided for in paragraph 40 above, their respective share in the \nTax Equalization Fund of 254,508 dollars, comprising the estimated staff assessment \nincome of 227,358 dollars approved for the Force, the prorated share of 22,075 dollars \nof the estimated staff assessment income approved for the support account and the \nprorated share of 5,075 dollars of the estimated staff assessment income approved for \nthe United Nations Logistics Base; \n \n42. Further decides to apportion among Member States the amount of \n13,706,764 dollars for the period from 1 August to 31 December 2021, at a monthly \nrate of 2,741,353 dollars, in accordance with the levels updated in its resolution \n73/272, taking into account the scale of assessments for 2021, as set out in its \nresolution 73/271, subject to a decision of the Security Council to extend the mandate \nof the Force;  \n \n43. Decides that, in accordance with the provisions of its resolution 973 (X), \nthere shall be set off against the apportionment among Member States, as provided \nfor in paragraph 42 above, their respective share in the Tax Equalization Fund of \n1,272,542 dollars, comprising the estimated staff assessment income of 1,136,792 \ndollars approved for the Force, the prorated share of 110,375 dollars of the estimated \nstaff assessment income approved for the support account and the prorated share of \n25,375 dollars of the estimated staff assessment income approved for the United \nNations Logistics Base; \n \n44. Also decides to apportion among Member States the amount of 16,448,116 \ndollars for the period from 1 January to 30 June 2022, at a monthly rate of 2,741,353 \ndollars, in accordance with the scale of assessments for 2022 and the updated levels, 5 \nsubject to a decision of the Security Council to extend the mandate of the Force; \n \n45. Further decides that, in accordance with the provisions of its resolution \n973 (X), there shall be set off against the apportionment among Member States, as \nprovided for in paragraph 44 above, their respective share in the Tax Equalization \nFund of 1,527,050 dollars, comprising the estimated staff assessment income of \n1,364,150 dollars approved for the Force, the prorated share of 132,450 dollars of the \nestimated staff assessment income approved for the support account and the prorated \nshare of 30,450 dollars of the estimated staff assessment income approved for the \nUnited Nations Logistics Base; \n \n46. Decides that, for Member States that have fulfilled their financial \nobligations to the Force, there shall be set off against the apportionment, as provided \nfor in paragraphs 40, 42 and 44 above, their respective share of the unencumbered \n__________________ \n \n5  To be adopted by the General Assembly. \n\nFinancing of the United Nations Peacekeeping Force in Cyprus \nA/RES/75/299\n \n7/7\n21-09013 \n \nbalance and other revenue in the amount of 1,401,562 dollars in respect of the \nfinancial period ended 30 June 2020, in accordance with the levels updated in its \nresolution 73/272, and taking into account the scale of assessments for 2020, as set \nout in its resolution 73/271; \n \n47. Also decides that, for Member States that have not fulfilled their financial \nobligations to the Force, there shall be set off against their outstanding obligations, \ntheir respective share of the unencumbered balance and other revenue in the amount \nof 1,401,562 dollars in respect of the financial period ended 30 June 2020, in \naccordance with the scheme set out in paragraph 46 above; \n \n48. Further decides that the decrease of 124,300 dollars in the estimated staff \nassessment income in respect of the financial period ended 30 June 2020 shall be set \noff against the credits in the amount of 1,401,562 dollars referred to in paragraphs 46 \nand 47 above; \n \n49. Decides, taking into account its voluntary contribution for the financial \nperiod ended 30 June 2020, that one third of the net unencumbered balance and other \nrevenue in the amount of 864,932 dollars in respect of the financial period ended \n30 June 2020 shall be returned to the Government of Cyprus; \n \n50. Also decides, taking into account its voluntary contribution for the \nfinancial period ended 30 June 2020, that the prorated share of the net unencumbered \nbalance and other revenue in the amount of 328,306 dollars in respect of the financial \nperiod ended 30 June 2020 shall be returned to the Government of Greece; \n \n51. Further decides to continue to maintain as separate the account established \nfor the Force for the period prior to 16 June 1993, invites Member States to make \nvoluntary contributions to that account, and requests the Secretary-General to \ncontinue his efforts in appealing for voluntary contributions to the account; \n \n52. Encourages the Secretary-General to continue to take additional measures \nto ensure the safety and security of all personnel participating in the Force under the \nauspices of the United Nations, bearing in mind paragraphs 5 and 6 of Security \nCouncil resolution 1502 (2003) of 26 August 2003; \n \n53. Invites voluntary contributions to the Force in cash and in the form of \nservices and supplies acceptable to the Secretary-General, to be administered, as \nappropriate, in accordance with the procedure and practices established by the \nGeneral Assembly; \n \n54. Decides to include in the provisional agenda of its seventy-sixth session \nthe item entitled \u201cFinancing of the United Nations Peacekeeping Force in Cyprus\u201d. \n \n88th plenary meeting \n30 June 2021 \n \n",
  "paragraphs": {
    "1": "Requests the Secretary-General to entrust the Head of Mission with the task of formulating future budget proposals in full accordance with the provisions of its resolutions 59/296 of 22 June 2005, 60/266 of 30 June 2006, 61/276 of 29 June 2007, 64/269 of 24 June 2010, 65/289 of 30 June 2011, 66/264 of 21 June 2012, 69/307 of 25 June 2015 and 70/286 of 17 June 2016, as well as other relevant resolutions;",
    "2": "Takes note of the status of contributions to the United Nations Peacekeeping Force in Cyprus as at 30 April 2021, including the contributions outstanding in the amount of 19 million United States dollars, representing some 2.6 per cent of the total assessed contributions, notes with concern that only 101 Member States have paid their assessed contributions in full, and urges all other Member States, in particular those in arrears, to ensure payment of their outstanding assessed contributions;",
    "3": "Expresses its appreciation to those Member States that have paid their assessed contributions in full, and urges all other Member States to make every possible effort to ensure payment of their assessed contributions to the Force in full;",
    "4": "Expresses concern at the financial situation with regard to peacekeeping activities, in particular as regards the reimbursements to troop contributors that bear additional burdens owing to overdue payments by Member States of their assessments;",
    "5": "Emphasizes that all future and existing peacekeeping missions shall be given equal and non-discriminatory treatment in respect of financial and administrative arrangements;",
    "6": "Also emphasizes that all peacekeeping missions shall be provided with adequate resources for the effective and efficient discharge of their respective mandates;",
    "7": "Requests the Secretary-General to ensure that proposed peacekeeping budgets are based on the relevant legislative mandates;",
    "8": "Endorses the conclusions and recommendations contained in the report of the Advisory Committee on Administrative and Budgetary Questions, subject to the provisions of the present resolution, and requests the Secretary-General to ensure their full implementation;",
    "9": "Notes with concern the shortcomings in partnership operations between the Mine Action Service and the United Nations Office for Project Services, and requests the Secretary-General to conduct an independent review on the use of the services of the Office and the partners selected to implement mine action activities, including an assessment of the comparative advantage of each mission in the delivery of those activities, and to submit the results of the analysis in the context of his report at the seventy-seventh session;",
    "10": "Reiterates its grave concern about the continued threat to life, health, safety and security caused by the coronavirus disease (COVID-19) pandemic and the importance of ensuring the safety, security and health of peacekeeping personnel, __________________ 3 S/1994/647. Financing of the United Nations Peacekeeping Force in Cyprus A/RES/75/299 3/7 21-09013 including through the use of safe and effective vaccines for civilian and uniformed personnel, maintaining the continuity of mandate delivery, including protection of civilians, minimizing the risk of mission activities causing the virus to spread and, where appropriate and within mandates, supporting national authorities, upon their request, in their response to COVID-19, in collaboration with the Resident Coordinator and other United Nations entities in the country;",
    "11": "Notes the measures adopted to mitigate the effect of the COVID-19 pandemic on peacekeeping operations, including facilitating the continued implementation of mission mandates while ensuring the health and safety of peacekeeping personnel and local communities in the host country, and requests the Secretary-General to provide updated information on the impact of the pandemic, the lessons learned, best practices and how the mission improved its preparedness and resilience and collaborated with the host Government and regional and subregional actors in response to the pandemic in the context of the next performance report and budget submission for the Force;",
    "12": "Notes with concern the mid- and long-term impact of the COVID-19 pandemic on countries, regions and subregions in conflict, and emphasizes the importance of United Nations peacekeeping operations, where appropriate and within their respective mandates, coordinating with national authorities and other United Nations entities in promoting post-conflict reconstruction, peacebuilding and post- pandemic recovery of countries and regions in conflict;",
    "13": "Recalls paragraphs 16 and 18 of its resolution 69/273 of 2 April 2015, and in this regard reiterates its request to the Secretary-General that he continue to explore additional innovative ways to promote procurement from developing countries and countries with economies in transition at Headquarters and field offices and to encourage interested local vendors to apply for registration on the Secretariat vendor roster, with a view to broadening its geographical base;",
    "14": "Encourages the Secretary-General to utilize local materials, capacity and knowledge in the implementation of construction projects for peacekeeping operations, in compliance with the United Nations Procurement Manual;",
    "15": "Requests the Secretary-General to establish clear frameworks and guidelines to determine the solicitation procedure, whether invitation to bid or request for proposal, to be utilized for, inter alia, acquiring different types of goods and services, including aviation services, and to update the United Nations Procurement Manual accordingly;",
    "16": "Also requests the Secretary-General to take measures to ensure that the Organization conforms to best practices in public procurement with respect to transparency, including by placing additional information in the public domain on the outcome of procurement exercises conducted, including in the area of aviation services, so as to further increase the transparency of the procurement operations of the Organization, and to update the United Nations Procurement Manual accordingly;",
    "17": "Recognizes the important role played by regional and subregional actors for peacekeeping operations, and in this regard encourages the Secretary-General to continue to deepen the partnership, cooperation and coordination of the United Nations with regional and subregional actors, in accordance with relevant mandates, and to provide information on such deepened engagement in the context of his next report;",
    "18": "Reaffirms the provisions of section XVIII of its resolution 61/276, further recognizes the important role played by quick-impact projects in supporting the implementation of mission mandates, stresses the need for the timely, responsible and A/RES/75/299 Financing of the United Nations Peacekeeping Force in Cyprus 21-09013 4/7 accountable implementation of all such projects, and requests the Secretary-General to enhance their impact while addressing underlying challenges;",
    "19": "Reiterates that the use of external consultants should be kept to an absolute minimum and that the Organization should utilize its in-house capacity to perform core activities or to fulfil functions that are recurrent over the long term;",
    "20": "Stresses the importance of prioritizing the safety and security of United Nations personnel as well as protection of civilians activities, in the context of challenging security situations, and requests that all peacekeeping missions be provided with adequate resources for the effective and efficient discharge of their respective mandates, including the protection of civilians where mandated;",
    "21": "Recognizes the increasing security challenges faced by United Nations peacekeepers, re-emphasizes the importance of improving the safety and security of peacekeepers and mission personnel in an integrated manner, including enhanced training and capacity-building, force protection planning for United Nations camps and situational awareness, requests the Secretary-General and host Governments to fulfil the responsibilities under relevant resolutions of the General Assembly and the Security Council to improve the safety and security of United Nations peacekeepers and mission personnel, and requests the Secretary-General to report thereon in his next report, and notes with appreciation the efforts of Member States in promoting the safety and security of United Nations peacekeepers in this regard;",
    "22": "Reiterates its concern about the high number of vacancies in civilian staffing, further reiterates its request to the Secretary-General to ensure that vacant posts are filled expeditiously, and requests the Secretary-General to review the posts that have been vacant for 24 months or longer and to propose in his next budget submission either their retention, with clear justification of need, or their abolishment;",
    "23": "Requests the Secretary-General to consider options for greater nationalization of functions when formulating budget submissions, commensurate with mission mandates and requirements;",
    "24": "Requests that the Secretary-General continue his ongoing efforts to ensure the attainment of equitable geographical distribution in the Secretariat and to ensure as wide a geographical distribution of staff as possible in all departments and offices and at all levels, including at the Director and higher levels, of the Secretariat, and requests him to report thereon in his next overview report;",
    "25": "Expresses its deep concern at the delay in the settlement of claims in respect of death and disability, and reiterates its request to the Secretary-General to settle death and disability claims as expeditiously as possible, but no later than three months from the date of submission of a claim;",
    "26": "Notes the ongoing development of impact-based performance indicators as part of the implementation of the Comprehensive Performance Assessment System, and in this regard requests the Secretary-General in his next report to provide information on how the indicators will measure the performance by the Force of mandated tasks and the impact of resource allocation on that performance, as well as how the indicators will contribute to the identification of the resources required for each mandated task;",
    "27": "Requests the Secretary-General to provide in his next report an execution plan for, and analysis of, the implementation of the new Comprehensive Performance Assessment System, including on its correlation with mission planning and budget formulation, in order to facilitate consideration by the General Assembly of resource requests for implementation of the System; Financing of the United Nations Peacekeeping Force in Cyprus A/RES/75/299 5/7 21-09013",
    "28": "Notes the progress made in the implementation of the multi-year environmental strategy to reduce the footprint of peacekeeping operations, and requests the Secretary-General to enhance measures for the implementation of the strategy in all peacekeeping missions, in line with the five pillars of the strategy and in accordance with the legislative mandates and particular conditions on the ground and in full compliance with the relevant rules and regulations, and to report thereon in the context of his next overview report;",
    "29": "Also notes the recommendations of the Advisory Committee on the use of virtual platforms and cost recovery of air transportation of non-United Nations personnel, and urges that their implementation should take into consideration the specific contexts for each mission without impacting mandate implementation;",
    "30": "Emphasizes the importance of the accountability system of the Secretariat, and requests the Secretary-General to continue to strengthen risk management, transparency and internal controls in the management of peacekeeping budgets, in order to facilitate mandate implementation, and to report thereon in his next report;",
    "31": "Also emphasizes the importance of overall budgetary performance in peacekeeping operations, and requests the Secretary-General to continue to improve oversight of the activities of peacekeeping missions, and implement the recommendations of the relevant oversight bodies, and in this regard to avoid deficiencies in management and related economic losses with the aim of ensuring full compliance with financial regulations and rules, while giving due regard to the guidance and recommendations of the General Assembly, and to report thereon in the context of the performance reports;",
    "32": "Highlights the importance of the women and peace and security agenda, and underlines that full implementation of the agenda by the mission can contribute to achieving sustainable peace and political solutions;",
    "33": "Expresses concern over the allegations of sexual exploitation and abuse reported in peacekeeping missions, and requests the Secretary-General to continue to implement his zero-tolerance policy on sexual exploitation and abuse with regard to all civilian, military and police personnel, and to report thereon in the context of his next report on cross-cutting issues;",
    "34": "Notes the number of pending post-traumatic stress disorder claims, and stresses the importance of addressing the backlog in a timely manner;",
    "35": "Requests the Secretary-General to ensure the full implementation of the relevant provisions of resolutions 59/296, 60/266, 61/276, 64/269, 65/289, 66/264, 69/307 and 70/286;",
    "36": "Also requests the Secretary-General to take all action necessary to ensure that the Force is administered with a maximum of efficiency and economy; Budget performance report for the period from 1 July 2019 to 30 June 2020",
    "37": "Takes note of the report of the Secretary-General on the budget performance of the Force for the period from 1 July 2019 to 30 June 2020; 4 Budget estimates for the period from 1 July 2021 to 30 June 2022",
    "38": "Decides to appropriate to the special account for the United Nations Peacekeeping Force in Cyprus the amount of 57,567,300 dollars for the period from 1 July 2021 to 30 June 2022, inclusive of 53,798,000 dollars for the maintenance of __________________ 4 A/75/630. A/RES/75/299 Financing of the United Nations Peacekeeping Force in Cyprus 21-09013 6/7 the Force, 3,182,000 dollars for the support account for peacekeeping operations and 587,300 dollars for the United Nations Logistics Base at Brindisi, Italy; Financing of the appropriation for the period from 1 July 2021 to 30 June 2022",
    "39": "Notes with appreciation that a one-third share of the net appropriation, equivalent to 18,171,067 dollars, will be funded through voluntary contributions from the Government of Cyprus and the amount of 6.5 million dollars from the Government of Greece;",
    "40": "Decides to apportion among Member States the amount of 2,741,353 dollars for the period from 1 to 31 July 2021, in accordance with the levels updated in its resolution 73/272 of 22 December 2018, taking into account the scale of assessments for 2021, as set out in its resolution 73/271 of 22 December 2018;",
    "41": "Also decides that, in accordance with the provisions of its resolution 973 (X) of 15 December 1955, there shall be set off against the apportionment among Member States, as provided for in paragraph 40 above, their respective share in the Tax Equalization Fund of 254,508 dollars, comprising the estimated staff assessment income of 227,358 dollars approved for the Force, the prorated share of 22,075 dollars of the estimated staff assessment income approved for the support account and the prorated share of 5,075 dollars of the estimated staff assessment income approved for the United Nations Logistics Base;",
    "42": "Further decides to apportion among Member States the amount of 13,706,764 dollars for the period from 1 August to 31 December 2021, at a monthly rate of 2,741,353 dollars, in accordance with the levels updated in its resolution 73/272, taking into account the scale of assessments for 2021, as set out in its resolution 73/271, subject to a decision of the Security Council to extend the mandate of the Force;",
    "43": "Decides that, in accordance with the provisions of its resolution 973 (X), there shall be set off against the apportionment among Member States, as provided for in paragraph 42 above, their respective share in the Tax Equalization Fund of 1,272,542 dollars, comprising the estimated staff assessment income of 1,136,792 dollars approved for the Force, the prorated share of 110,375 dollars of the estimated staff assessment income approved for the support account and the prorated share of 25,375 dollars of the estimated staff assessment income approved for the United Nations Logistics Base;",
    "44": "Also decides to apportion among Member States the amount of 16,448,116 dollars for the period from 1 January to 30 June 2022, at a monthly rate of 2,741,353 dollars, in accordance with the scale of assessments for 2022 and the updated levels, 5 subject to a decision of the Security Council to extend the mandate of the Force;",
    "45": "Further decides that, in accordance with the provisions of its resolution 973 (X), there shall be set off against the apportionment among Member States, as provided for in paragraph 44 above, their respective share in the Tax Equalization Fund of 1,527,050 dollars, comprising the estimated staff assessment income of 1,364,150 dollars approved for the Force, the prorated share of 132,450 dollars of the estimated staff assessment income approved for the support account and the prorated share of 30,450 dollars of the estimated staff assessment income approved for the United Nations Logistics Base;",
    "46": "Decides that, for Member States that have fulfilled their financial obligations to the Force, there shall be set off against the apportionment, as provided for in paragraphs 40, 42 and 44 above, their respective share of the unencumbered __________________ 5 To be adopted by the General Assembly. Financing of the United Nations Peacekeeping Force in Cyprus A/RES/75/299 7/7 21-09013 balance and other revenue in the amount of 1,401,562 dollars in respect of the financial period ended 30 June 2020, in accordance with the levels updated in its resolution 73/272, and taking into account the scale of assessments for 2020, as set out in its resolution 73/271;",
    "47": "Also decides that, for Member States that have not fulfilled their financial obligations to the Force, there shall be set off against their outstanding obligations, their respective share of the unencumbered balance and other revenue in the amount of 1,401,562 dollars in respect of the financial period ended 30 June 2020, in accordance with the scheme set out in paragraph 46 above;",
    "48": "Further decides that the decrease of 124,300 dollars in the estimated staff assessment income in respect of the financial period ended 30 June 2020 shall be set off against the credits in the amount of 1,401,562 dollars referred to in paragraphs 46 and 47 above;",
    "49": "Decides, taking into account its voluntary contribution for the financial period ended 30 June 2020, that one third of the net unencumbered balance and other revenue in the amount of 864,932 dollars in respect of the financial period ended 30 June 2020 shall be returned to the Government of Cyprus;",
    "50": "Also decides, taking into account its voluntary contribution for the financial period ended 30 June 2020, that the prorated share of the net unencumbered balance and other revenue in the amount of 328,306 dollars in respect of the financial period ended 30 June 2020 shall be returned to the Government of Greece;",
    "51": "Further decides to continue to maintain as separate the account established for the Force for the period prior to 16 June 1993, invites Member States to make voluntary contributions to that account, and requests the Secretary-General to continue his efforts in appealing for voluntary contributions to the account;",
    "52": "Encourages the Secretary-General to continue to take additional measures to ensure the safety and security of all personnel participating in the Force under the auspices of the United Nations, bearing in mind paragraphs 5 and 6 of Security Council resolution 1502 (2003) of 26 August 2003;",
    "53": "Invites voluntary contributions to the Force in cash and in the form of services and supplies acceptable to the Secretary-General, to be administered, as appropriate, in accordance with the procedure and practices established by the General Assembly;",
    "54": "Decides to include in the provisional agenda of its seventy-sixth session the item entitled \u201cFinancing of the United Nations Peacekeeping Force in Cyprus\u201d. 88th plenary meeting 30 June 2021"
  },
  "agenda_items": [
    "Item 158"
  ],
  "symbol_references": []
}