{
  "symbol": "A/RES/78/243",
  "filename": "A_RES_78_243.pdf",
  "title": "78/243. Information and communications technology strategy",
  "text": "United Nations \nA/RES/78/243 \n \n \nGeneral Assembly \nDistr.: General \n28 December 2023 \n \n23-26253 (E)    040124 \n*2326253* \n \n \nSeventy-eighth session \nAgenda item 133 \nProgramme budget for 2023 \n \n \n \nResolution adopted by the General Assembly \non 22 December 2023 \n \n \n[on the report of the Fifth Committee (A/78/643, para. 7)] \n \n \n 78/243. Information and communications technology strategy \n \n \n \nThe General Assembly, \n \nRecalling section II of its resolution 60/283 of 7 July 2006, its resolutions \n63/262 of 24 December 2008, 63/269 of 7 April 2009 and 64/243 of 24 December \n2009, section XVII of its resolution 65/259 of 24 December 2010, its resolution \n66/246 of 24 December 2011, section I of its resolution 67/254 A of 12 April 2013, \nsection XV of its resolution 68/247 A of 27 December 2013, section II of its resolution \n69/262 of 29 December 2014, paragraph 107 of its resolution 70/247 of 23 December \n2015, section V of its resolution 70/248 A of 23 December 2015, section II of its \nresolution 70/238 B of 1 April 2016, section III of its resolution 71/272 B of 6 April \n2017, its resolution 71/281 of 6 April 2017, section I of its resolution 72/262 C of \n5 July 2018, its resolution 72/266 B of 5 July 2018, its resolution 76/245 of \n24 December 2021 and its decision 77/548 B of 18 April 2023,  \n \nHaving considered the report of the Secretary-General on the information and \ncommunications technology strategy 1  and the related report of the Advisory \nCommittee on Administrative and Budgetary Questions,2 \n \nHaving also considered the note by the Secretary-General drawing attention to \nthe report of the Joint Inspection Unit on cybersecurity in the United Nations system \norganizations3 and the note by the Secretary-General transmitting his comments and \nthose of the United Nations System Chief Executives Board for Coordination thereon,4 \n \n1. \nTakes note of the report of the Secretary-General;  \n__________________ \n \n1  A/77/489. \n \n2  A/77/7/Add.22. \n \n3  A/77/88. \n \n4  A/77/88/Add.1. \n\nA/RES/78/243 \nInformation and communications technology strategy \n \n23-26253\n2/3 \n \n \n2. \nEndorses the conclusions and recommendations contained in the report of \nthe Advisory Committee on Administrative and Budgetary Questions, subject to the \nprovisions of the present resolution;  \n \n3. \nTakes note of paragraph 5 of the report of the Advisory Committee, recalls \nthat the Secretary-General has not submitted a final, full and accurate report on the \nimplementation of the previous information and communications technology strategy, \nand requests that the detailed time-bound implementation road map for the \ninformation and communications technology strategy include lessons learned;  \n \n4. \nRecalls paragraph 6 of the report of the Advisory Committee, and requests \nthe Secretary-General to make every effort to implement expeditiously the \nrecommendations of the oversight bodies and effectively address the root causes \nunderlying, and to provide updated information on the status of, open \nrecommendations of the oversight bodies in his next report on information and \ncommunications technology;  \n \n5. \nAcknowledges the information and communications technology strategy of \nthe Secretary-General as a critical enabler of the mandates of the Organization that is \nintended to define the high-level strategic vision, principles and expected outcomes \nof information and communications technology activities across the Secretariat, and \nencourages the Secretary-General to strengthen system-wide interoperability and \npotential synergies;  \n \n6. \nTakes note of paragraph 26 of the report of the Advisory Committee;  \n \n7. \nRecalls paragraphs 12 and 44 of the report of the Advisory Committee, \nand requests the Secretary-General to submit refined elements of the information and \ncommunications technology strategy by no later than the seventy-ninth session that \ninclude:  \n \n(a) \nMore clarity and precision on the vision and intended objectives of the \nstrategy, identifying for each objective concrete actions to achieve them, taking into \naccount current status, existing and envisaged challenges and risks, including \ncybersecurity, lessons learned and interlinkages with related initiatives; \n \n(b) \nKey performance indicators, deliverables and a clear and effective \ngovernance and accountability framework that clarifies the balance between central \ncontrol and operational freedom;  \n \n(c) \nEstimates of the resources needed for the implementation of the strategy \nmade with a view to rationalizing the allocation of existing information and \ncommunications technology expenditures and avoiding duplication and overlaps; \n \n(d) \nThe Secretary-General\u2019s efforts in leveraging the power of technology \ninnovation in the pursuit of the objectives of the Organization in particular the \nimplementation of the 2030 Agenda for Sustainable Development; 5  \n \n(e) \nAn outreach component to promote awareness of the human resources and \nvendor opportunities, including from developing countries and countries with \neconomies in transition; \n \n8. \nAlso recalls paragraph 19 of the report of the Advisory Committee, \nemphasizes that coherence of information and communications technology \ndeployment throughout the Organization is critical to deliver mandates and requires \nstronger and more unified governance, and stresses that the authority, responsibilities \nand accountability of the Chief Information Technology Officer and delegation of \n__________________ \n \n5  Resolution 70/1. \n\nInformation and communications technology strategy \nA/RES/78/243 \n \n3/3\n23-26253 \n \nauthority principles will be fully clarified in the governance framework of the refined \nstrategy;  \n \n9. \nFurther recalls paragraph 23 of the report of the Advisory Committee, and \nrequests the Secretary-General to clarify the elements of the information and \ncommunications technology governance framework, present a well-defined \naccountability framework, and provide clear explanations of how effective \nmonitoring and compliance will be ensured in the context of the envisaged balance \nbetween central control and operational freedom;  \n \n10. Requests the Secretary-General to ensure, as appropriate, that there is \ncomplementarity and no duplication between the Office of Information and \nCommunications Technology, the Enterprise Resource Planning Solution Division, \nthe United Nations Office for Project Services and the United Nations International \nComputing Centre;  \n \n11. Emphasizes the sensitivity and need for security of the data and \ninformation held by the Organization both at Headquarters and in the field, and \nstresses that data protection shall be at the core of the implementation by the \nSecretary-General of the information and communications technology strategy, and \nrequests the Secretary-General to implement urgently critical measures to that end in \nthe context of the refined strategy;  \n \n12. Requests the Secretary-General to ensure that a comprehensive risk \nanalysis exercise is undertaken with regard to the implementation of the \nrecommendations of the Joint Inspection Unit regarding cybersecurity;  \n \n13. Notes with appreciation the report of the Joint Inspection Unit on \ncybersecurity in the United Nations system organizations, and requests the Secretary-\nGeneral and invites the executive heads of the member organizations, as appropriate, \nto implement the relevant recommendations;  \n \n14. Notes the discussions on terminology held in the Fifth Committee on this \nquestion. \n \n50th (resumed) plenary meeting \n22 December 2023 \n \n",
  "paragraphs": {
    "1": "Takes note of the report of the Secretary-General;",
    "2": "Endorses the conclusions and recommendations contained in the report of the Advisory Committee on Administrative and Budgetary Questions, subject to the provisions of the present resolution;",
    "3": "Takes note of paragraph 5 of the report of the Advisory Committee, recalls that the Secretary-General has not submitted a final, full and accurate report on the implementation of the previous information and communications technology strategy, and requests that the detailed time-bound implementation road map for the information and communications technology strategy include lessons learned;",
    "4": "Recalls paragraph 6 of the report of the Advisory Committee, and requests the Secretary-General to make every effort to implement expeditiously the recommendations of the oversight bodies and effectively address the root causes underlying, and to provide updated information on the status of, open recommendations of the oversight bodies in his next report on information and communications technology;",
    "5": "Acknowledges the information and communications technology strategy of the Secretary-General as a critical enabler of the mandates of the Organization that is intended to define the high-level strategic vision, principles and expected outcomes of information and communications technology activities across the Secretariat, and encourages the Secretary-General to strengthen system-wide interoperability and potential synergies;",
    "6": "Takes note of paragraph 26 of the report of the Advisory Committee;",
    "7": "Recalls paragraphs 12 and 44 of the report of the Advisory Committee, and requests the Secretary-General to submit refined elements of the information and communications technology strategy by no later than the seventy-ninth session that include: (a) More clarity and precision on the vision and intended objectives of the strategy, identifying for each objective concrete actions to achieve them, taking into account current status, existing and envisaged challenges and risks, including cybersecurity, lessons learned and interlinkages with related initiatives; (b) Key performance indicators, deliverables and a clear and effective governance and accountability framework that clarifies the balance between central control and operational freedom; (c) Estimates of the resources needed for the implementation of the strategy made with a view to rationalizing the allocation of existing information and communications technology expenditures and avoiding duplication and overlaps; (d) The Secretary-General\u2019s efforts in leveraging the power of technology innovation in the pursuit of the objectives of the Organization in particular the implementation of the 2030 Agenda for Sustainable Development; 5 (e) An outreach component to promote awareness of the human resources and vendor opportunities, including from developing countries and countries with economies in transition;",
    "8": "Also recalls paragraph 19 of the report of the Advisory Committee, emphasizes that coherence of information and communications technology deployment throughout the Organization is critical to deliver mandates and requires stronger and more unified governance, and stresses that the authority, responsibilities and accountability of the Chief Information Technology Officer and delegation of authority principles will be fully clarified in the governance framework of the refined strategy;",
    "9": "Further recalls paragraph 23 of the report of the Advisory Committee, and requests the Secretary-General to clarify the elements of the information and communications technology governance framework, present a well-defined accountability framework, and provide clear explanations of how effective monitoring and compliance will be ensured in the context of the envisaged balance between central control and operational freedom;",
    "10": "Requests the Secretary-General to ensure, as appropriate, that there is complementarity and no duplication between the Office of Information and Communications Technology, the Enterprise Resource Planning Solution Division, the United Nations Office for Project Services and the United Nations International Computing Centre;",
    "11": "Emphasizes the sensitivity and need for security of the data and information held by the Organization both at Headquarters and in the field, and stresses that data protection shall be at the core of the implementation by the Secretary-General of the information and communications technology strategy, and requests the Secretary-General to implement urgently critical measures to that end in the context of the refined strategy;",
    "12": "Requests the Secretary-General to ensure that a comprehensive risk analysis exercise is undertaken with regard to the implementation of the recommendations of the Joint Inspection Unit regarding cybersecurity;",
    "13": "Notes with appreciation the report of the Joint Inspection Unit on cybersecurity in the United Nations system organizations, and requests the Secretary- General and invites the executive heads of the member organizations, as appropriate, to implement the relevant recommendations;",
    "14": "Notes the discussions on terminology held in the Fifth Committee on this question."
  },
  "agenda_items": [
    "Item 133"
  ],
  "symbol_references": []
}