{
  "symbol": "A/RES/79/329",
  "filename": "A_RES_79_329.pdf",
  "title": "79/329. Cooperation between the United Nations and the African Union",
  "text": "United Nations \nA/RES/79/329 \n \nGeneral Assembly \nDistr.: General \n5 September 2025 \n25-14299 (E) \n*2514299* \n \n \nSeventy-ninth session \nAgenda item 125 (a) \nCooperation between the United Nations and regional and \nother organizations: cooperation between the United Nations \nand the African Union \n \n \n \n \n Resolution adopted by the General Assembly \non 5 September 2025 \n \n \n[without reference to a Main Committee (A/79/L.127)] \n \n \n 79/329. Cooperation between the United Nations and the African Union \n \n \n \nThe General Assembly, \n \nRecalling the Charter of the United Nations, including the provisions of \nChapter VIII on regional arrangements, \n \nRecalling also the principles of the Constitutive Act of the African Union \nadopted in 2000 in Lom\u00e9,1 \n \nRecalling further all its relevant resolutions related to cooperation between the \nUnited Nations and the African Union, in particular resolutions 55/218 of \n21 December 2000, 56/48 of 7 December 2001, 57/48 of 21 November 2002, 59/213 \nof 20 December 2004, 61/296 of 17 September 2007, 63/310 of 14 September 2009, \n65/274 of 18 April 2011 and 67/302 of 16 September 2013, \n \nMindful of all previous relevant resolutions and presidential statements of the \nSecurity Council, especially resolutions 1809 (2008) of 16 April 2008, 2033 (2012) \nof 12 January 2012, 2320 (2016) of 18 November 2016 and 2378 (2017) of \n20 September 2017, as well as the presidential statement dated 31 August 2022,2 in \nwhich the President of the Council underscored the importance of developing \neffective partnerships between the United Nations and regional organizations, in \nparticular the African Union, and recalling Council resolution 2457 (2019) of \n27 February 2019 on silencing the guns in Africa, as well as the acceleration of \nprogress in the realization of Agenda 2063: The Africa We Want and the 2030 Agenda \nfor Sustainable Development,3 \n_______________ \n \n1 United Nations, Treaty Series, vol. 2158, No. 37733. \n \n2 S/PRST/2022/6. \n \n3 Resolution 70/1. \n\nA/RES/79/329 \nCooperation between the United Nations and the African Union\n \n25-14299\n2/9 \n \n \nTaking note of the most recent report of the Secretary-General on cooperation \nbetween the United Nations and regional and subregional organizations, 4 and of the \nreports of the Secretary-General on strengthening the partnership between the United \nNations and the African Union on issues of peace and security in Africa, including the \nwork of the United Nations Office to the African Union, submitted pursuant to the \nSecurity Council presidential statement dated 16 December 2014,5 \n \nWelcoming the convening of the Summit of the Future on 22 and 23 September \n2024 at United Nations Headquarters in New York, at which resolution 79/1, on \u201cThe \nPact for the Future\u201d, and its annexes were adopted, in which the need to strengthen \npartnerships to address global challenges was reaffirmed, including the importance of \nenhanced collaboration between the United Nations and regional and subregional \norganizations, in particular the African Union, including their peace support \noperations and peace enforcement measures authorized by the Security Council to \nmaintain or restore international peace and security, and the Secretary-General was \nencouraged to convene regular high-level meetings with relevant regional \norganizations to discuss matters pertaining to peace operations, peacebuilding and \nconflicts, \n \nRecalling that the development of Africa is an established priority of the United \nNations, reaffirming its commitment to addressing the unique needs of Africa, and \nnoting the widening scope of cooperation between the United Nations and the African \nUnion and the increased responsibilities of the United Nations in supporting Agenda \n2063, \n \nWelcoming in this regard the convening of the eighth United Nations-African \nUnion annual conference at the level of the Secretary-General and the Chairperson of \nthe African Union Commission, held in Addis Ababa on 21 October 2024, and the \nresults that emanated from it to further enhance the partnership between both \norganizations in different fields, at which conference participants reviewed progress \nin the implementation of the Joint United Nations-African Union Framework for \nEnhanced Partnership in Peace and Security, the African Union-United Nations \nFramework for the Implementation of Agenda 2063 and the 2030 Agenda for \nSustainable Development, and the African Union-United Nations Joint Framework on \nHuman Rights, and welcomed the progress made in the implementation of the three \njoint frameworks, and recalling its resolution 71/254 of 23 December 2016, on the \nFramework for a Renewed United Nations-African Union Partnership on Africa\u2019s \nIntegration and Development Agenda 2017\u20132027, \n \nWelcoming also the establishment of the African Union-United Nations high-\nlevel strategic dialogue on sustainable development between the Deputy Chairperson \nof the African Union Commission and the Deputy Secretary-General of the United \nNations to enhance strategic coordination between the United Nations and the African \nUnion, advised by college-to-college forums in which African Union Commissioners \nand relevant principals from the United Nations engage on shared priorities and \npolicies, \n \nReaffirming that the Fifth Committee is the appropriate Main Committee of the \nGeneral Assembly entrusted with responsibilities for administrative and budgetary \nmatters, and reaffirming also the role of the Fifth Committee in carrying out a \nthorough analysis and approving human and financial resources and policies, with a \nview to ensuring full, effective and efficient implementation of all mandated \nprogrammes and activities and the implementation of policies in this regard, \n_______________ \n \n4 A/79/302-S/2024/600. \n \n5 S/PRST/2014/27; see Resolutions and Decisions of the Security Council, 1 August 2014\u201331 July \n2015 (S/INF/70). \n\nCooperation between the United Nations and the African Union \nA/RES/79/329\n \n3/9\n25-14299 \n \n \nRecalling Security Council resolution 2719 (2023) of 21 December 2023, in \nwhich, among other things, the Council reaffirmed its determination to take effective \nsteps to further enhance the partnership between the United Nations and the African \nUnion, including forging greater regional and national ownership, while underscoring \nthe primary responsibility of the Council under the Charter for the maintenance of \ninternational peace and security, and in which it agreed to consider, on a case-by-case \nbasis, requests from the African Union Peace and Security Council seeking \nauthorization from the Security Council for African Union-led peace support \noperations under Chapters VII and VIII of the Charter to have access to United \nNations assessed contributions, and stressing in this regard the importance of ensuring \nadequate, predictable and sustainable financing for such operations to enhance their \neffectiveness and impact, based on the financial arrangements and procedures \nstipulated in Security Council resolution 2719 (2023), \n \nRecalling also its resolutions 76/305 of 8 September 2022, on financing for \npeacebuilding, and 78/257 of 22 December 2023, on investing in prevention and \npeacebuilding, in which the Assembly reaffirmed the importance of ensuring \nadequate, predictable and sustained financing for peacebuilding, noted that the \namount of voluntary contributions had not been sufficient to meet increasing demands \nfor the support of the Peacebuilding Fund, also noted its narrow donor base, and \nfurther noted that voluntary contributions should remain the primary source of \nfunding, \n \nRecognizing the important role of the United Nations resident coordinator \nsystem in supporting and coordinating the activities of the United Nations, including \nthe development system at the country level, and the need to further strengthen the \nresident coordinator system to ensure more effective and coherent support to African \ncountries in the implementation of the 2030 Agenda and Agenda 2063, and \nemphasizing that adequate, predictable and sustainable funding of the resident \ncoordinator system, within existing mandates and resources, is essential to delivering \na coherent, effective, efficient and accountable response in accordance with national \nneeds and priorities, including in Africa, \n \nAcknowledging the significant role and contribution of United Nations \npeacekeeping operations in maintaining peace and security in Africa, noting with \nconcern the challenges faced in United Nations peacekeeping operations in Africa, \nincluding during their drawdown and liquidation, and emphasizing the need to ensure \na smooth transition and the preservation of peace and security gains, \n \nRecognizing that cooperation with regional and subregional organizations in \nmatters relating to the maintenance of international peace and security can improve \ncollective security, and acknowledging the mandate of the African Union Peace and \nSecurity Council for the promotion of peace, security and stability in Africa pursuant \nto the Protocol Relating to the Establishment of the Peace and Security Council of the \nAfrican Union, \n \nRecalling the signing on 19 April 2017 of the Joint United Nations-African \nUnion Framework for Enhanced Partnership in Peace and Security on the African \ncontinent, and recalling also the signing on 18 September 2018 of the memorandum \nof understanding on United Nations-African Union partnership in peacebuilding, as \nwell as the joint declaration signed between the two organizations on 6 December \n2018, which outlined the guiding principles underpinning the cooperation and \ncollaboration between them in responding to conflict and crises in Africa and may \ncontinue to inform the partnership between the African Union and the United Nations \nin meeting peace and security challenges together, which has enhanced consultations \nbetween the Peace and Security Council and the Security Council, \n\nA/RES/79/329 \nCooperation between the United Nations and the African Union\n \n25-14299\n4/9 \n \n \nWelcoming in this regard the eighteenth annual joint consultative meeting \nbetween members of the Security Council and the Peace and Security Council, held \non 18 October 2024 in New York, and acknowledging the joint communiqu\u00e9 agreed \nby the members of the two Councils after that meeting,6 \n \nWelcoming also in this regard the convening of the twenty-fourth consultative \nmeeting of the United Nations-African Union Joint Task Force on Peace and Security \non 17 February 2025, which reviewed the status of the partnership between the United \nNations and the African Union, with an update on the implementation of the Joint \nUnited Nations-African Union Framework for Enhanced Partnership in Peace and \nSecurity, and commending the continued efforts to support that important framework \nfor furthering the strategic partnership on peace and security between the Secretariat \nof the United Nations and the African Union Commission, \n \nNoting that the African Union-United Nations Joint Framework on Human \nRights serves as an overarching policy document for cooperation on human rights \nmatters between the African Union and the United Nations and reaffirms the shared \nobjectives and long-standing commitment of the African Union and the United \nNations towards the promotion and protection of human rights, and noting also the \nsecond African Union-United Nations high-level dialogue on human rights, held on \n15 May 2025, which underscored the importance of implementing the Framework, \n \nWelcoming the efforts of the three African non\u2011permanent members of the \nSecurity Council as a tool for projecting the interests of Africa in the Council, \nacknowledging the efforts of their coordination with the Member States in the \nCaribbean region, and welcoming in this regard the organization of the eleventh high-\nlevel seminar on peace and security in Africa (Oran Process), held in December 2024 \nin Oran, Algeria, \n \nWelcoming also African research and academic efforts aimed at fostering \ncooperation between the United Nations and the African Union, especially the Aswan \nForum for Sustainable Peace and Development, held annually in Egypt, the \nconclusions of which at its fourth edition, in July 2024, sought to contribute towards \nadvancing the operationalization of the peace-security-development nexus, as well as \npeacebuilding and sustainable development in Africa, \n \nWelcoming further the first African Union policy conference on promoting the \npeace-security-development nexus in Africa (Tangier Process), held in October 2022 \nin Tangier, Morocco, which focused on strengthening efforts to concretely address the \nstructural drivers of conflicts in Africa, \n \nAcknowledging the increasing relevance of Africa\u2019s strategic partnerships to the \ndevelopment of the continent, and expressing appreciation for the active role played \nby the United Nations and the African Union in facilitating these relationships to \nenhance the response to Africa\u2019s development needs, \n \nRecalling its resolution 79/263 of 15 January 2025, in which, among other \nthings, the Assembly emphasized the need for the United Nations development system \nto further cooperate with the African Union and the regional economic communities, \nto follow up on African development priorities in line with the 2030 Agenda and \nAgenda 2063 and its flagship projects that could require United Nations financial and \ntechnical assistance within existing resources, and the need for United Nations \nagencies, in line with their respective mandates, to strengthen their relationship with \nthe African Union Development Agency-New Partnership for Africa\u2019s Development, \n_______________ \n \n6 S/2024/762, annex. \n\nCooperation between the United Nations and the African Union \nA/RES/79/329\n \n5/9\n25-14299 \n \n \nRecalling also that the 2030 Agenda underscores the special challenges facing \nthe most vulnerable countries, including African countries, and recalling further that \nsignificant challenges remain in achieving sustainable development in Africa and the \nimportance of fulfilling all commitments to advance action in areas critical to Africa\u2019s \nsustainable development, \n \nConvinced that strengthening cooperation between the United Nations and the \nAfrican Union will contribute to the advancement of the principles of the Charter of \nthe United Nations and of the Constitutive Act of the African Union, \n \n1. \nAcknowledges that the cooperation between the United Nations and the \nAfrican Union is instrumental, among other things, in advancing the purposes and \nprinciples of the Charter of the United Nations; \n \n2. \nEmphasizes in this regard the need to pursue ongoing measures to improve \nthe effectiveness and efficiency of cooperation between the United Nations and the \nAfrican Union in addressing threats to peace and security, and obstacles to \ndevelopment, as well as promoting human rights in Africa, and recognizes the \nimportant role and support of the United Nations Office to the African Union in Addis \nAbaba, the Permanent Observer Mission of the African Union to the United Nations \nin New York and the African Union Partnership Unit at the United Nations in \nstrengthening coordination and cooperation between the United Nations and the \nAfrican Union; \n \n3. \nRecognizes that Agenda 2063: The Africa We Want reflects the \ncommitment to the pan-African vision of an integrated, prosperous and peaceful \nAfrica, driven by its own citizens and representing a dynamic force in the \ninternational arena; \n \nPeace and security \n \n4. \nReaffirms its determination to take effective steps to further enhance the \nlevels of strategic and operational partnership between the United Nations and the \nAfrican Union, especially in the area of peace and security, and welcomes in this \nregard the progress made by the African continent, the African Union and African \nsubregional organizations in different phases of the peace continuum, including \nconflict resolution, conflict prevention, peacekeeping, peacebuilding and sustaining \npeace; \n \n5. \nRecalls that the Security Council has the primary responsibility for the \nmaintenance of international peace and security, and requests the United Nations \nsystem to intensify its assistance to the African Union, as appropriate, and within \nexisting resources, in strengthening the African peace and security architecture, \nincluding the institutional and operational capacity of its Peace and Security Council, \nand in coordinating with other international partners when needed; \n \n6. \nEncourages the continuing efforts of the United Nations-African Union \nJoint Task Force on Peace and Security as an important framework for furthering the \nstrategic partnership on peace and security between the Secretariat of the United \nNations and the African Union Commission, and looks forward to the next meeting \nof the Task Force, to be held in 2026; \n \n7. \nStresses that the unanimous adoption of Security Council resolution 2719 \n(2023) marked a major milestone in the partnership between the African Union and \nthe United Nations, and welcomes the progress made in this regard towards \nimplementing the resolution, especially through the establishment of the joint African \nUnion-United Nations Task Force and the adoption of the road map for the \nimplementation of resolution 2719 (2023); \n\nA/RES/79/329 \nCooperation between the United Nations and the African Union\n \n25-14299\n6/9 \n \n \n8. \nRecalls that the process for mandate authorization under Security Council \nresolution 2719 (2023) will encompass a number of items, including a draft concept \nof operations, developed by the African Union in collaboration with the United \nNations and in consultation with the respective host country; \n \n9. \nUnderscores the importance of the implementation of resolution 2719 \n(2023), on a case-by-case basis as set out in that resolution, while maintaining an \nintegrated approach in addressing conflict situations comprehensively, by ensuring \nthat capacities, systems, procedures and processes, as well as joint accountability and \ninstitutional readiness and effectiveness, continue to be sufficiently prepared for the \ndelivery and sustainment of African Union-led peace support operations to be \nauthorized by the Security Council; \n \n10. Reaffirms the importance of strengthening collaboration between the \nUnited Nations and the African Union, to ensure that peacekeeping and peace support \noperations, including peace enforcement, which are authorized by the Security \nCouncil are framed and guided by inclusive political strategy and other non\u2011military \napproaches, are deployed with clear, sequenced and prioritized mandates, realistic and \nachievable exit strategies and viable transition plans, and address the root causes of \nthe conflict; \n \n11. Stresses the importance of partnership between the United Nations and \nrelevant regional and subregional organizations, including the African Union, to \nimprove cooperation and coordination in peacebuilding, including through joint \nanalysis and effective strategic planning, to increase synergies and ensure the \ncoherence and complementarity of such efforts, and looks forward to the outcome of \nthe 2025 peacebuilding architecture review co-facilitated by Egypt and Slovenia; \n \n12. Urges all relevant stakeholders to ensure adequate, predictable and \nsustained financing for peacebuilding, including in Africa, and welcomes in this \nregard the decision in its resolution 78/257 to approve 50 million United States dollars \nof assessed contributions per annum, under grants and contributions, to fund the \nPeacebuilding Account, starting 1 January 2025, and encourages Member States to \nmake and increase voluntary contributions to peacebuilding, including to the \nPeacebuilding Fund, to ensure sufficient resources to support peacebuilding, while \nnoting that the provision of assessed contributions to financing for peacebuilding \nrepresents a shared commitment of Member States to peacebuilding and sustaining \npeace, and reaffirming the primary responsibility and ownership of national \nGovernments and authorities in identifying, driving and directing priorities, strategies \nand activities for peacebuilding and sustaining peace; \n \n13. Commends the ongoing cooperation between the Office for Disarmament \nAffairs of the Secretariat and the African Union Commission within the framework \nof the Office for Disarmament Affairs-African Union cooperation matrix, including \nsupport for Africa Amnesty Month and other arms control measures, and calls upon \nMember States, as appropriate, to intensify their support and cooperation with Africa \nin this regard to foster the ongoing efforts to achieve the goal of silencing the guns on \nthe continent; \n \n14. Urges international partners, including in the United Nations system, as \nwell as international and regional financial institutions, to coordinate their \npeacebuilding-related efforts in Africa, with nationally led peacebuilding, and \nregionally and continentally supported efforts, including through the role of the \nAfrican Union Commission and the African Union Centre for Post-Conflict \nReconstruction and Development; \n \n15. Welcomes the adoption of the revised African Union Policy on Post-\nConflict Reconstruction and Development, aligned with the evolving international \n\nCooperation between the United Nations and the African Union \nA/RES/79/329\n \n7/9\n25-14299 \n \ndiscourse on peacebuilding and sustaining peace and the actual needs of countries \nemerging from conflict in Africa, and calls upon the United Nations system and \nMember States to support, within existing resources, peace consolidation mechanisms \nand processes, including the African Peace and Security Architecture, the African \nGovernance Architecture and the African Union Post-Conflict Reconstruction and \nDevelopment Framework, in order to fully contribute to conflict prevention, \npeacemaking initiatives, peacebuilding and post-conflict reconstruction; \n \n16. Also welcomes in this regard the establishment and operationalization of \nthe African Union Centre for Post-Conflict Reconstruction and Development, \nheadquartered in Cairo, and calls upon Member States and the relevant United Nations \ninstitutions and agencies, within existing resources, to lend their support to the \nAfrican Union towards effectively operationalizing the Centre in order for it to \nsuccessfully execute its mandate as the principal organ within the African Union \nresponsible for post-conflict reconstruction and development activities in Africa, \nbearing in mind that strengthened consultation between the Centre and the \nPeacebuilding Support Office, in the Department of Political and Peacebuilding \nAffairs of the Secretariat, within the United Nations-African Union cooperation \nframework is essential for implementing the African Union-United Nations \nmemorandum of understanding on peacebuilding; \n \n17. Commends the cooperation between the Office of Counter-Terrorism, \nincluding through the Programme Office for Counter-Terrorism and Training in \nAfrica, in Rabat, and the African Union Commission, including through the African \nUnion Counter-Terrorism Centre, in Algiers, in supporting counter-terrorism efforts \nin Africa, and takes note of the ongoing collaboration in the United Nations-African \nUnion technical working group on counter-terrorism and the prevention of violent \nextremism; \n \n18. Requests the Secretary-General to ensure, at the earliest possible stage, \nintegrated planning and a comprehensive and coordinated approach to the transition, \ndrawdown and liquidation of United Nations peacekeeping operations in Africa, \nwithin existing resources and in close consultation with host countries and troop- and \npolice-contributing countries, to preserve the gains made and support the transition to \nsustainable peace and development; \n \n19. Appreciates initiatives aimed at advancing international peace and \nsecurity, particularly in Africa, recognizes in this regard the significance of the United \nNations Nelson Rolihlahla Mandela Prize, which acknowledges the humanity in the \npromotion of peace, reconciliation, social cohesion and community development, and \nacknowledges in this regard the third prize-award ceremony, held in July 2025; \n \n20. Underlines the importance of promoting gender equality and the \nempowerment of women, including the implementation of Security Council \nresolution 1325 (2000) of 31 October 2000 in Africa, all subsequent Council \nresolutions on women and peace and security, and the Beijing Declaration and \nPlatform for Action,7 recognizes the role of the Special Envoy of the Chairperson of \nthe African Union Commission on Women, Peace and Security in promoting the \nwomen and peace and security agenda on the continent, encourages the African Union \nto continue collaborating with the United Nations in advancing this agenda, and takes \nnote in this regard of the signing of a memorandum of understanding between the \nAfrican Women Leaders Network and the Office of the Special Adviser on Africa; \n_______________ \n \n7 Report of the Fourth World Conference on Women, Beijing, 4\u201315 September 1995 (United Nations \npublication, Sales No. E.96.IV.13), chap. I, resolution 1, annexes I and II. \n\nA/RES/79/329 \nCooperation between the United Nations and the African Union\n \n25-14299\n8/9 \n \n \n21. Reaffirms the important and positive contribution of youth in efforts for \nthe maintenance and promotion of peace and security, and notes the need to consider \nways to increase inclusive representation of youth in decision-making at all levels in \nlocal, national, regional and international institutions and mechanisms for the \nprevention and resolution of conflict in Africa, in accordance with Security Council \nresolution 2250 (2015) of 9 December 2015; \n \n22. Acknowledges the need to pursue peace, security and sustainable \ndevelopment simultaneously, recognizes the role of Agenda 2063 and the 2030 \nAgenda for Sustainable Development in addressing the root causes of conflict in \nAfrica, and in this regard calls upon United Nations entities to continue strengthening \ntheir cooperation with the African Union in the promotion of durable peace through \nsustainable development; \n \nDevelopment \n \n23. Welcomes the recent adoption of the second 10-year implementation plan \n(2024\u20132033) of Agenda 2063, urges further efforts to support the implementation of \nthe plan as a road map for Africa\u2019s transformation, which outlines seven moonshots \nof how the continent aims to achieve key priorities, goals and targets in the next 10 \nyears and identifies flagship projects that will have a high impact, recognizes the \ncontribution of the African Union Development Agency-New Partnership for Africa\u2019s \nDevelopment, and looks forward to enhancing the efforts of development partners to \nstrengthen cooperation with the Agency; \n \n24. Reaffirms the importance of aligning international support with Africa\u2019s \nown priorities, aimed at implementing the 2030 Agenda and Agenda 2063, and in this \nregard calls for the United Nations system to cooperate with the African Union on the \ndomestication, implementation and monitoring of both Agendas; \n \n25. Calls upon the United Nations system, Member States and bilateral and \nmultilateral partners to deliver expeditiously on their commitments and to support the \nfull and speedy implementation of the provisions of the political declaration on \nAfrica\u2019s development needs,8 the 2030 Agenda and Agenda 2063, recognizing the \nrelevance of leveraging new transformative technologies to advance sustainable \ndevelopment on the continent and bridge the digital divide that is undermining the \ndevelopment efforts of African countries; \n \n26. Calls upon the United Nations development system, under the leadership \nof the resident coordinators, according to their mandate, to enhance its support for \nand coordination with African countries, and the African Union as appropriate, in the \nimplementation of the 2030 Agenda and Agenda 2063, including by strengthening \nnational capacities and aligning programming to national priorities; \n \n27. Encourages continued support for measures to address the challenges of \nhunger, poverty eradication, decent job creation and sustainable development in \nAfrica, including, as appropriate, domestic resource mobilization, debt relief, \nincluding through the reform of international financial institutions, improved market \naccess, regional integration and intra-African trade, including through the African \nContinental Free Trade Area, support for the private sector and entrepreneurship, \nfulfilment of commitments on official development assistance and increased flows of \nforeign direct investment, and transfer of technology on mutually agreed terms; \n \n28. Calls upon the United Nations to take appropriate measures to address the \neradication of poverty in all its forms and dimensions, including extreme poverty, \nthrough its agencies, funds and programmes, in line with their mandates, noting the \n_______________ \n \n8 Resolution 63/1. \n\nCooperation between the United Nations and the African Union \nA/RES/79/329\n \n9/9\n25-14299 \n \nimportance of addressing food security, building productive capacities and creating \nemployment opportunities, as well as of the agricultural partnership to combat hunger, \nuniversal primary education initiatives, debt cancellation, enhanced official \ndevelopment assistance, increased inflows of foreign direct investment, and transfer \nof technology on mutually agreed terms; \n \n29. Underscores the need to further consolidate the African Union-United \nNations high-level strategic dialogue on sustainable development between the Deputy \nSecretary-General of the United Nations and the Deputy Chairperson of the African \nUnion Commission, to advance in the joint implementation of Agenda 2063 and the \n2030 Agenda, with the support of the African Union-United Nations college-to-\ncollege forums, and requests the Secretary-General to submit a proposal, within \nexisting resources, to ensure continued support for and follow-up of this strategic \nhigh-level coordination between the two organizations on sustainable development; \n \n30. Underlines the importance of strengthened support from development \npartners and the multilateral system to build and strengthen resilience, State \ninstitutions and effective governance systems, particularly in conflict-affected and \npost-conflict countries, including through scaling up financial assistance, technical \nexpertise and capacity-building; \n \n31. Recognizes the important contribution of the African Peer Review \nMechanism since its inception in improving governance and supporting \nsocioeconomic development in African countries, invites the United Nations system \nand Member States to provide voluntary substantial financial and capacity-building \nsupport to enhance the Mechanism and to advance its activities, and recalls its request \nto develop an initiative with the Mechanism on the strengthening of e-governance in \nAfrica through policy innovation and transformative technologies; \n \n32. Welcomes the signature by the African Union and the United Nations of a \nmemorandum of intent concerning cooperation in operational support and a \nmemorandum of understanding concerning the implementation of the knowledge and \nexpertise exchange programme, and calls upon United Nations entities, as \nappropriate, to continue deepening their collaboration with the African Union in \ncapacity-building and the exchange of best practices in all areas; \n \n33. Also welcomes the strong efforts and progress already made by the \nSecretary-General towards achieving equal and fair distribution in terms of the gender \nbalance and recruitment of staff, including his stronger efforts towards achieving \nequitable geographical representation, when recruiting into the Secretariat, while \nsecuring the highest standards of efficiency, competence and integrity, in accordance \nwith Article 101 of the Charter; \n \n34. Requests the Secretary-General to report to the General Assembly at its \neighty-first session on the implementation of the present resolution. \n \n95th plenary meeting \n5 September 2025 \n \n",
  "paragraphs": {
    "1": "Acknowledges that the cooperation between the United Nations and the African Union is instrumental, among other things, in advancing the purposes and principles of the Charter of the United Nations;",
    "2": "Emphasizes in this regard the need to pursue ongoing measures to improve the effectiveness and efficiency of cooperation between the United Nations and the African Union in addressing threats to peace and security, and obstacles to development, as well as promoting human rights in Africa, and recognizes the important role and support of the United Nations Office to the African Union in Addis Ababa, the Permanent Observer Mission of the African Union to the United Nations in New York and the African Union Partnership Unit at the United Nations in strengthening coordination and cooperation between the United Nations and the African Union;",
    "3": "Recognizes that Agenda 2063: The Africa We Want reflects the commitment to the pan-African vision of an integrated, prosperous and peaceful Africa, driven by its own citizens and representing a dynamic force in the international arena; Peace and security",
    "4": "Reaffirms its determination to take effective steps to further enhance the levels of strategic and operational partnership between the United Nations and the African Union, especially in the area of peace and security, and welcomes in this regard the progress made by the African continent, the African Union and African subregional organizations in different phases of the peace continuum, including conflict resolution, conflict prevention, peacekeeping, peacebuilding and sustaining peace;",
    "5": "Recalls that the Security Council has the primary responsibility for the maintenance of international peace and security, and requests the United Nations system to intensify its assistance to the African Union, as appropriate, and within existing resources, in strengthening the African peace and security architecture, including the institutional and operational capacity of its Peace and Security Council, and in coordinating with other international partners when needed;",
    "6": "Encourages the continuing efforts of the United Nations-African Union Joint Task Force on Peace and Security as an important framework for furthering the strategic partnership on peace and security between the Secretariat of the United Nations and the African Union Commission, and looks forward to the next meeting of the Task Force, to be held in 2026;",
    "7": "Stresses that the unanimous adoption of Security Council resolution 2719 (2023) marked a major milestone in the partnership between the African Union and the United Nations, and welcomes the progress made in this regard towards implementing the resolution, especially through the establishment of the joint African Union-United Nations Task Force and the adoption of the road map for the implementation of resolution 2719 (2023); A/RES/79/329 Cooperation between the United Nations and the African Union 25-14299 6/9",
    "8": "Recalls that the process for mandate authorization under Security Council resolution 2719 (2023) will encompass a number of items, including a draft concept of operations, developed by the African Union in collaboration with the United Nations and in consultation with the respective host country;",
    "9": "Underscores the importance of the implementation of resolution 2719 (2023), on a case-by-case basis as set out in that resolution, while maintaining an integrated approach in addressing conflict situations comprehensively, by ensuring that capacities, systems, procedures and processes, as well as joint accountability and institutional readiness and effectiveness, continue to be sufficiently prepared for the delivery and sustainment of African Union-led peace support operations to be authorized by the Security Council;",
    "10": "Reaffirms the importance of strengthening collaboration between the United Nations and the African Union, to ensure that peacekeeping and peace support operations, including peace enforcement, which are authorized by the Security Council are framed and guided by inclusive political strategy and other non\u2011military approaches, are deployed with clear, sequenced and prioritized mandates, realistic and achievable exit strategies and viable transition plans, and address the root causes of the conflict;",
    "11": "Stresses the importance of partnership between the United Nations and relevant regional and subregional organizations, including the African Union, to improve cooperation and coordination in peacebuilding, including through joint analysis and effective strategic planning, to increase synergies and ensure the coherence and complementarity of such efforts, and looks forward to the outcome of the 2025 peacebuilding architecture review co-facilitated by Egypt and Slovenia;",
    "12": "Urges all relevant stakeholders to ensure adequate, predictable and sustained financing for peacebuilding, including in Africa, and welcomes in this regard the decision in its resolution 78/257 to approve 50 million United States dollars of assessed contributions per annum, under grants and contributions, to fund the Peacebuilding Account, starting 1 January 2025, and encourages Member States to make and increase voluntary contributions to peacebuilding, including to the Peacebuilding Fund, to ensure sufficient resources to support peacebuilding, while noting that the provision of assessed contributions to financing for peacebuilding represents a shared commitment of Member States to peacebuilding and sustaining peace, and reaffirming the primary responsibility and ownership of national Governments and authorities in identifying, driving and directing priorities, strategies and activities for peacebuilding and sustaining peace;",
    "13": "Commends the ongoing cooperation between the Office for Disarmament Affairs of the Secretariat and the African Union Commission within the framework of the Office for Disarmament Affairs-African Union cooperation matrix, including support for Africa Amnesty Month and other arms control measures, and calls upon Member States, as appropriate, to intensify their support and cooperation with Africa in this regard to foster the ongoing efforts to achieve the goal of silencing the guns on the continent;",
    "14": "Urges international partners, including in the United Nations system, as well as international and regional financial institutions, to coordinate their peacebuilding-related efforts in Africa, with nationally led peacebuilding, and regionally and continentally supported efforts, including through the role of the African Union Commission and the African Union Centre for Post-Conflict Reconstruction and Development;",
    "15": "Welcomes the adoption of the revised African Union Policy on Post- Conflict Reconstruction and Development, aligned with the evolving international Cooperation between the United Nations and the African Union A/RES/79/329 7/9 25-14299 discourse on peacebuilding and sustaining peace and the actual needs of countries emerging from conflict in Africa, and calls upon the United Nations system and Member States to support, within existing resources, peace consolidation mechanisms and processes, including the African Peace and Security Architecture, the African Governance Architecture and the African Union Post-Conflict Reconstruction and Development Framework, in order to fully contribute to conflict prevention, peacemaking initiatives, peacebuilding and post-conflict reconstruction;",
    "16": "Also welcomes in this regard the establishment and operationalization of the African Union Centre for Post-Conflict Reconstruction and Development, headquartered in Cairo, and calls upon Member States and the relevant United Nations institutions and agencies, within existing resources, to lend their support to the African Union towards effectively operationalizing the Centre in order for it to successfully execute its mandate as the principal organ within the African Union responsible for post-conflict reconstruction and development activities in Africa, bearing in mind that strengthened consultation between the Centre and the Peacebuilding Support Office, in the Department of Political and Peacebuilding Affairs of the Secretariat, within the United Nations-African Union cooperation framework is essential for implementing the African Union-United Nations memorandum of understanding on peacebuilding;",
    "17": "Commends the cooperation between the Office of Counter-Terrorism, including through the Programme Office for Counter-Terrorism and Training in Africa, in Rabat, and the African Union Commission, including through the African Union Counter-Terrorism Centre, in Algiers, in supporting counter-terrorism efforts in Africa, and takes note of the ongoing collaboration in the United Nations-African Union technical working group on counter-terrorism and the prevention of violent extremism;",
    "18": "Requests the Secretary-General to ensure, at the earliest possible stage, integrated planning and a comprehensive and coordinated approach to the transition, drawdown and liquidation of United Nations peacekeeping operations in Africa, within existing resources and in close consultation with host countries and troop- and police-contributing countries, to preserve the gains made and support the transition to sustainable peace and development;",
    "19": "Appreciates initiatives aimed at advancing international peace and security, particularly in Africa, recognizes in this regard the significance of the United Nations Nelson Rolihlahla Mandela Prize, which acknowledges the humanity in the promotion of peace, reconciliation, social cohesion and community development, and acknowledges in this regard the third prize-award ceremony, held in July 2025;",
    "20": "Underlines the importance of promoting gender equality and the empowerment of women, including the implementation of Security Council resolution 1325 (2000) of 31 October 2000 in Africa, all subsequent Council resolutions on women and peace and security, and the Beijing Declaration and Platform for Action,7 recognizes the role of the Special Envoy of the Chairperson of the African Union Commission on Women, Peace and Security in promoting the women and peace and security agenda on the continent, encourages the African Union to continue collaborating with the United Nations in advancing this agenda, and takes note in this regard of the signing of a memorandum of understanding between the African Women Leaders Network and the Office of the Special Adviser on Africa; _______________ 7 Report of the Fourth World Conference on Women, Beijing, 4\u201315 September 1995 (United Nations publication, Sales No. E.96.IV.13), chap. I, resolution 1, annexes I and II. A/RES/79/329 Cooperation between the United Nations and the African Union 25-14299 8/9",
    "21": "Reaffirms the important and positive contribution of youth in efforts for the maintenance and promotion of peace and security, and notes the need to consider ways to increase inclusive representation of youth in decision-making at all levels in local, national, regional and international institutions and mechanisms for the prevention and resolution of conflict in Africa, in accordance with Security Council resolution 2250 (2015) of 9 December 2015;",
    "22": "Acknowledges the need to pursue peace, security and sustainable development simultaneously, recognizes the role of Agenda 2063 and the 2030 Agenda for Sustainable Development in addressing the root causes of conflict in Africa, and in this regard calls upon United Nations entities to continue strengthening their cooperation with the African Union in the promotion of durable peace through sustainable development; Development",
    "23": "Welcomes the recent adoption of the second 10-year implementation plan (2024\u20132033) of Agenda 2063, urges further efforts to support the implementation of the plan as a road map for Africa\u2019s transformation, which outlines seven moonshots of how the continent aims to achieve key priorities, goals and targets in the next 10 years and identifies flagship projects that will have a high impact, recognizes the contribution of the African Union Development Agency-New Partnership for Africa\u2019s Development, and looks forward to enhancing the efforts of development partners to strengthen cooperation with the Agency;",
    "24": "Reaffirms the importance of aligning international support with Africa\u2019s own priorities, aimed at implementing the 2030 Agenda and Agenda 2063, and in this regard calls for the United Nations system to cooperate with the African Union on the domestication, implementation and monitoring of both Agendas;",
    "25": "Calls upon the United Nations system, Member States and bilateral and multilateral partners to deliver expeditiously on their commitments and to support the full and speedy implementation of the provisions of the political declaration on Africa\u2019s development needs,8 the 2030 Agenda and Agenda 2063, recognizing the relevance of leveraging new transformative technologies to advance sustainable development on the continent and bridge the digital divide that is undermining the development efforts of African countries;",
    "26": "Calls upon the United Nations development system, under the leadership of the resident coordinators, according to their mandate, to enhance its support for and coordination with African countries, and the African Union as appropriate, in the implementation of the 2030 Agenda and Agenda 2063, including by strengthening national capacities and aligning programming to national priorities;",
    "27": "Encourages continued support for measures to address the challenges of hunger, poverty eradication, decent job creation and sustainable development in Africa, including, as appropriate, domestic resource mobilization, debt relief, including through the reform of international financial institutions, improved market access, regional integration and intra-African trade, including through the African Continental Free Trade Area, support for the private sector and entrepreneurship, fulfilment of commitments on official development assistance and increased flows of foreign direct investment, and transfer of technology on mutually agreed terms;",
    "28": "Calls upon the United Nations to take appropriate measures to address the eradication of poverty in all its forms and dimensions, including extreme poverty, through its agencies, funds and programmes, in line with their mandates, noting the _______________ 8 Resolution 63/1. Cooperation between the United Nations and the African Union A/RES/79/329 9/9 25-14299 importance of addressing food security, building productive capacities and creating employment opportunities, as well as of the agricultural partnership to combat hunger, universal primary education initiatives, debt cancellation, enhanced official development assistance, increased inflows of foreign direct investment, and transfer of technology on mutually agreed terms;",
    "29": "Underscores the need to further consolidate the African Union-United Nations high-level strategic dialogue on sustainable development between the Deputy Secretary-General of the United Nations and the Deputy Chairperson of the African Union Commission, to advance in the joint implementation of Agenda 2063 and the 2030 Agenda, with the support of the African Union-United Nations college-to- college forums, and requests the Secretary-General to submit a proposal, within existing resources, to ensure continued support for and follow-up of this strategic high-level coordination between the two organizations on sustainable development;",
    "30": "Underlines the importance of strengthened support from development partners and the multilateral system to build and strengthen resilience, State institutions and effective governance systems, particularly in conflict-affected and post-conflict countries, including through scaling up financial assistance, technical expertise and capacity-building;",
    "31": "Recognizes the important contribution of the African Peer Review Mechanism since its inception in improving governance and supporting socioeconomic development in African countries, invites the United Nations system and Member States to provide voluntary substantial financial and capacity-building support to enhance the Mechanism and to advance its activities, and recalls its request to develop an initiative with the Mechanism on the strengthening of e-governance in Africa through policy innovation and transformative technologies;",
    "32": "Welcomes the signature by the African Union and the United Nations of a memorandum of intent concerning cooperation in operational support and a memorandum of understanding concerning the implementation of the knowledge and expertise exchange programme, and calls upon United Nations entities, as appropriate, to continue deepening their collaboration with the African Union in capacity-building and the exchange of best practices in all areas;",
    "33": "Also welcomes the strong efforts and progress already made by the Secretary-General towards achieving equal and fair distribution in terms of the gender balance and recruitment of staff, including his stronger efforts towards achieving equitable geographical representation, when recruiting into the Secretariat, while securing the highest standards of efficiency, competence and integrity, in accordance with Article 101 of the Charter;",
    "34": "Requests the Secretary-General to report to the General Assembly at its eighty-first session on the implementation of the present resolution. 95th plenary meeting 5 September 2025"
  },
  "agenda_items": [
    "Item 125"
  ],
  "symbol_references": [
    "A/79/L.127"
  ]
}