{
  "symbol": "A/RES/80/155",
  "filename": "A_RES_80_155.pdf",
  "title": "80/155. Operational activities for development of the United Nations system",
  "text": "United Nations \nA/RES/80/155 \n \nGeneral Assembly \nDistr.: General \n18 December 2025 \n25-20790 (E) \n*2520790* \n \n \nEightieth session \nAgenda item 23 (a) \nOperational activities for development: operational activities \nfor development of the United Nations system \n \n \n \n \n Resolution adopted by the General Assembly \non 15 December 2025 \n \n \n[on the report of the Second Committee (A/80/555, para. 7)] \n \n \n 80/155. Operational activities for development of the \nUnited Nations system \n \n \n \nThe General Assembly, \n \nReaffirming its resolution 79/226 of 19 December 2024 on the quadrennial \ncomprehensive policy review of operational activities for development of the United \nNations system, including its general guidelines, \n \nReaffirming also its resolution 72/279 of 31 May 2018 on the repositioning of \nthe United Nations development system in the context of the quadrennial \ncomprehensive policy review of operational activities for development of the United \nNations system and its resolutions 73/248 of 20 December 2018, 74/238 of \n19 December 2019, 76/220 of 17 December 2021, 77/184 of 14 December 2022 and \n78/166 of 19 December 2023 on operational activities for development of the United \nNations system, as well as its resolution 76/4 of 28 October 2021 on the review of the \nfunctioning of the reinvigorated resident coordinator system, including its funding \narrangement, \n \nReaffirming further its resolution 70/1 of 25 September 2015, entitled \n\u201cTransforming our world: the 2030 Agenda for Sustainable Development\u201d, in which \nit adopted a comprehensive, far-reaching and people-centred set of universal and \ntransformative Sustainable Development Goals and targets, its commitment to \nworking tirelessly for the full implementation of the Agenda by 2030, its recognition \nthat eradicating poverty in all its forms and dimensions, including extreme poverty, \nis the greatest global challenge and an indispensable requirement for sustainable \ndevelopment, its commitment to achieving sustainable development in its three \ndimensions \u2013 economic, social and environmental \u2013 in a balanced and integrated \nmanner, and to building upon the achievements of the Millennium Development Goals \nand seeking to address their unfinished business, \n\nA/RES/80/155 \nOperational activities for development of the United Nations system\n \n25-20790\n2/4 \n \n \nReaffirming its resolution 69/313 of 27 July 2015 on the Addis Ababa Action \nAgenda of the Third International Conference on Financing for Development, which \nis an integral part of the 2030 Agenda for Sustainable Development, supports and \ncomplements it, helps to contextualize its means of implementation targets with \nconcrete policies and actions, and reaffirms the strong political commitment to \naddress the challenge of financing and creating an enabling environment at all levels \nfor sustainable development in the spirit of global partnership and solidarity, \n \nWelcoming the convening of the Fourth International Conference on Financing \nfor Development from 30 June to 3 July 2025 in Sevilla, Spain, and reaffirming its \noutcome document, the Sevilla Commitment, endorsed by the General Assembly in \nits resolution 79/323 of 25 August 2025, which sets forth a renewed global framework \nfor financing for development, building on the 2015 Addis Ababa Action Agenda, 1 to \nclose with urgency the estimated annual 4 trillion United States dollar financing gap, 2 \nand catalyse sustainable development investments at scale in developing countries \nand continue the reform of the international financial architecture through continued \nand strong commitment to multilateralism, international cooperation, and global \nsolidarity, \n \nReaffirming the Paris Agreement, 3  and encouraging all its Parties to fully \nimplement the Agreement, and Parties to the United Nations Framework Convention \non Climate Change 4  that have not yet done so to deposit their instruments of \nratification, acceptance, approval or accession, where appropriate, as soon as \npossible, \n \nReaffirming also the importance of the quadrennial comprehensive policy \nreview of operational activities, through which the General Assembly establishes key \nsystem-wide strategic policy orientations and operational modalities for the \ndevelopment cooperation and country-level modalities of the United Nations \ndevelopment system, \n \nRecalling the political declaration of the high-level political forum on \nsustainable development convened under the auspices of the General Assembly \n(Sustainable Development Goals Summit), 5  which recommitted to accelerate the \nimplementation of the 2030 Agenda and its Sustainable Development Goals, \n \nNoting with concern that climate change, geopolitical tensions and ongoing \nconflicts, a turbulent and uncertain global economic outlook, including the increase \nin debt servicing costs, and their respective negative impacts are creating additional \nchallenges relating to eradication of poverty, food security, energy security and cost \nof living, and that developing countries are disproportionately affected by these \nchallenges, \n \nRecalling its resolution 79/318 of 18 July 2025 on the UN80 initiative, and \nstressing that the reform process should be inclusive, evidence-based and transparent, \n \n1. \nTakes note of the reports of the Secretary-General on the implementation \nof General Assembly resolution 79/226 on the quadrennial comprehensive policy \nreview of operational activities for development of the United Nations system, 2025; 6 \n_______________ \n \n1 General Assembly resolution 69/313, annex. \n \n2 Financing for Sustainable Development Report 2024 (United Nations publication, 2024), \nfigure I.1. \n \n3 Adopted under the UNFCCC in FCCC/CP/2015/10/Add.1, decision 1/CP.21. \n \n4 United Nations, Treaty Series, vol. 1771, No. 30822. \n \n5 Resolution 78/1, annex. \n \n6 A/80/74-E/2025/53 and A/80/74/Add.1-E/2025/53/Add.1. \n\nOperational activities for development of the United Nations system \nA/RES/80/155\n \n3/4\n25-20790 \n \n \n2. \nWelcomes the ongoing efforts of the Secretary-General on the \nrepositioning of the United Nations development system and the reinvigorated \nresident coordinator system, and acknowledges the progress achieved thus far in \nadvancing all reform mandates contained in General Assembly resolutions 71/243 of \n21 December 2016, 72/279, 75/233 of 21 December 2020, 76/4 and 79/226 and \ncontinues to call for their full implementation; \n \n3. \nRecalls and reiterates the requests made in Economic and Social Council \nresolutions 2023/31 of 26 July 2023 and 2024/19 of 23 July 2024 on progress in the \nimplementation of General Assembly resolution 75/233 on the quadrennial \ncomprehensive policy review of operational activities for development of the United \nNations system, as well as those previously made in Council resolutions 2019/15 of \n8 July 2019, 2020/23 of 22 July 2020 and 2022/25 of 22 July 2022 on progress in the \nimplementation of General Assembly resolution 71/243 on the quadrennial \ncomprehensive policy review of operational activities for development of the United \nNations system, and calls for their full implementation; \n \n4. \nReaffirms the commitment at the very heart of the 2030 Agenda for \nSustainable Development7 to leave no one behind, commit to taking more tangible \nsteps to support people in vulnerable situations and the most vulnerable countries and \nto reach the furthest behind first, and calls upon the entities of the United Nations \ndevelopment system, within their respective mandates and resources, to assist States \nin the implementation of the 2030 Agenda; \n \n5. \nEncourages the United Nations development system to continue to make \neffective use of the integration and operational support functions of the United \nNations Development Programme, as appropriate;  \n \n6. \nWelcomes the progress made in the establishment of United Nations \nSustainable Development Cooperation Frameworks, while encouraging further \nimprovements in their implementation, and reaffirms that they are the most important \ninstrument for the planning and implementation of United Nations development \nactivities in each programme country in support of their implementation of the 2030 \nAgenda for Sustainable Development and the programme countries\u2019 policies, plans, \npriorities and needs, to be prepared and finalized in full consultation and agreement \nwith national Governments, through the United Nations country team, under the \nleadership and coordination of the resident coordinators, while continuing to \nencourage national Governments to consult with relevant stakeholders; \n \n7. \nStresses that national Governments have the primary responsibility for \ntheir countries\u2019 development and for coordinating, on the basis of national strategies \nand priorities, all types of external assistance, including that provided by multilateral \norganizations, in order to effectively integrate such assistance into their development \nprocesses; \n \n8. \nCalls on all entities of the United Nations development system to \ncooperate and collaborate with and work under the leadership and guidance of the \nresident coordinators, in accordance with resolution 79/226, to ensure a coordinated \nand integrated approach to the development and implementation of the Cooperation \nFrameworks, and further calls on the entities to align their development activities for \ntheir respective country programmes with the agreed priorities of the Cooperation \nFrameworks, to facilitate a stronger and more coherent, coordinated, efficient, \neffective, results-oriented and accountable United Nations development system at the \ncountry level towards the achievement of the Sustainable Development Goals, and \ncalls for the optimization of the country team configuration exercises facilitated by \n_______________ \n \n7 Resolution 70/1. \n\nA/RES/80/155 \nOperational activities for development of the United Nations system\n \n25-20790\n4/4 \n \nthe resident coordinators and finalized through open and inclusive dialogue between \nthe host Government and the United Nations development system; \n \n9. \nStresses the need for the United Nations development system to intensify \nefforts contributing to system-wide and inter-agency efficiencies, including by \nstrengthening and improving the ongoing design and implementation of harmonized \nbusiness practices, including the Business Operations Strategies, Common Back \nOffices, Common Premises and Global Shared Services in order to optimize \nopportunities for collaboration and maximize efficiency gains, while prioritizing the \nmost cost-effective and resource-efficient efforts and strengthening its reporting \nprocesses on impact in terms of efficiency gains resulting from these business \npractices, so that funding freed up by such gains is redeployed to development \nactivities, including coordination; \n \n10. Reiterates its request to the United Nations development system entities \nto complete the United Nations Development System Reform Checklist for United \nNations entities\u2019 governing bodies; \n \n11. Notes the critical role that the United Nations development system plays \nin facilitating countries\u2019 implementation of the 2030 Agenda and its Sustainable \nDevelopment Goals, and remains seriously concerned about the lack of adequate, \npredictable and sustainable funding for the United Nations development system \nentities, the resident coordinator system, and development activities as a whole, and \nstresses the need to prioritize voluntary contributions to core, pooled, thematic and \njoint funding mechanisms at all levels, including the Joint Sustainable Development \nGoals Fund, and to limit earmarking to activities in accordance with the national \npriorities and plans of programme countries; \n \n12. Welcomes the funding compact, noting its voluntary nature, calls on all \nMember States and entities of the United Nations development system to contribute \nto its full and effective implementation, and requests the Secretariat to continue to \nbrief Member States on accelerating its implementation; \n \n13. Requests the Secretary-General to present a comprehensive, evidence-\nbased and analytical report to the Economic and Social Council covering all \nprovisions and progress made, lessons learned and challenges in the implementation \nof the mandates contained in General Assembly resolution 79/226, as part of his \nannual reporting to the Council at the operational activities for development segment \nduring its 2026 session and to the Assembly at its eighty-first session for its further \nconsideration, and also requests the Secretary-General to continue to provide strategic \nand concise briefing notes and informal briefings, in a timely and publicly available \nmanner, on the implementation of all provisions and mandates contained in General \nAssembly resolution 79/226, and on the relevant available analysis provided by \nUnited Nations system evaluation and oversight mechanisms, with an emphasis on \ndevelopment results; \n \n14. Decides to include in the provisional agenda of its eighty-first session, \nunder the item entitled \u201cOperational activities for development\u201d, the sub-item entitled \n\u201cOperational activities for development of the United Nations system\u201d. \n \n64th plenary meeting \n15 December 2025 \n \n",
  "paragraphs": {
    "1": "Takes note of the reports of the Secretary-General on the implementation of General Assembly resolution 79/226 on the quadrennial comprehensive policy review of operational activities for development of the United Nations system, 2025; 6",
    "2": "Welcomes the ongoing efforts of the Secretary-General on the repositioning of the United Nations development system and the reinvigorated resident coordinator system, and acknowledges the progress achieved thus far in advancing all reform mandates contained in General Assembly resolutions 71/243 of 21 December 2016, 72/279, 75/233 of 21 December 2020, 76/4 and 79/226 and continues to call for their full implementation;",
    "3": "Recalls and reiterates the requests made in Economic and Social Council resolutions 2023/31 of 26 July 2023 and 2024/19 of 23 July 2024 on progress in the implementation of General Assembly resolution 75/233 on the quadrennial comprehensive policy review of operational activities for development of the United Nations system, as well as those previously made in Council resolutions 2019/15 of 8 July 2019, 2020/23 of 22 July 2020 and 2022/25 of 22 July 2022 on progress in the implementation of General Assembly resolution 71/243 on the quadrennial comprehensive policy review of operational activities for development of the United Nations system, and calls for their full implementation;",
    "4": "Reaffirms the commitment at the very heart of the 2030 Agenda for Sustainable Development7 to leave no one behind, commit to taking more tangible steps to support people in vulnerable situations and the most vulnerable countries and to reach the furthest behind first, and calls upon the entities of the United Nations development system, within their respective mandates and resources, to assist States in the implementation of the 2030 Agenda;",
    "5": "Encourages the United Nations development system to continue to make effective use of the integration and operational support functions of the United Nations Development Programme, as appropriate;",
    "6": "Welcomes the progress made in the establishment of United Nations Sustainable Development Cooperation Frameworks, while encouraging further improvements in their implementation, and reaffirms that they are the most important instrument for the planning and implementation of United Nations development activities in each programme country in support of their implementation of the 2030 Agenda for Sustainable Development and the programme countries\u2019 policies, plans, priorities and needs, to be prepared and finalized in full consultation and agreement with national Governments, through the United Nations country team, under the leadership and coordination of the resident coordinators, while continuing to encourage national Governments to consult with relevant stakeholders;",
    "7": "Stresses that national Governments have the primary responsibility for their countries\u2019 development and for coordinating, on the basis of national strategies and priorities, all types of external assistance, including that provided by multilateral organizations, in order to effectively integrate such assistance into their development processes;",
    "8": "Calls on all entities of the United Nations development system to cooperate and collaborate with and work under the leadership and guidance of the resident coordinators, in accordance with resolution 79/226, to ensure a coordinated and integrated approach to the development and implementation of the Cooperation Frameworks, and further calls on the entities to align their development activities for their respective country programmes with the agreed priorities of the Cooperation Frameworks, to facilitate a stronger and more coherent, coordinated, efficient, effective, results-oriented and accountable United Nations development system at the country level towards the achievement of the Sustainable Development Goals, and calls for the optimization of the country team configuration exercises facilitated by the resident coordinators and finalized through open and inclusive dialogue between the host Government and the United Nations development system;",
    "9": "Stresses the need for the United Nations development system to intensify efforts contributing to system-wide and inter-agency efficiencies, including by strengthening and improving the ongoing design and implementation of harmonized business practices, including the Business Operations Strategies, Common Back Offices, Common Premises and Global Shared Services in order to optimize opportunities for collaboration and maximize efficiency gains, while prioritizing the most cost-effective and resource-efficient efforts and strengthening its reporting processes on impact in terms of efficiency gains resulting from these business practices, so that funding freed up by such gains is redeployed to development activities, including coordination;",
    "10": "Reiterates its request to the United Nations development system entities to complete the United Nations Development System Reform Checklist for United Nations entities\u2019 governing bodies;",
    "11": "Notes the critical role that the United Nations development system plays in facilitating countries\u2019 implementation of the 2030 Agenda and its Sustainable Development Goals, and remains seriously concerned about the lack of adequate, predictable and sustainable funding for the United Nations development system entities, the resident coordinator system, and development activities as a whole, and stresses the need to prioritize voluntary contributions to core, pooled, thematic and joint funding mechanisms at all levels, including the Joint Sustainable Development Goals Fund, and to limit earmarking to activities in accordance with the national priorities and plans of programme countries;",
    "12": "Welcomes the funding compact, noting its voluntary nature, calls on all Member States and entities of the United Nations development system to contribute to its full and effective implementation, and requests the Secretariat to continue to brief Member States on accelerating its implementation;",
    "13": "Requests the Secretary-General to present a comprehensive, evidence- based and analytical report to the Economic and Social Council covering all provisions and progress made, lessons learned and challenges in the implementation of the mandates contained in General Assembly resolution 79/226, as part of his annual reporting to the Council at the operational activities for development segment during its 2026 session and to the Assembly at its eighty-first session for its further consideration, and also requests the Secretary-General to continue to provide strategic and concise briefing notes and informal briefings, in a timely and publicly available manner, on the implementation of all provisions and mandates contained in General Assembly resolution 79/226, and on the relevant available analysis provided by United Nations system evaluation and oversight mechanisms, with an emphasis on development results;",
    "14": "Decides to include in the provisional agenda of its eighty-first session, under the item entitled \u201cOperational activities for development\u201d, the sub-item entitled \u201cOperational activities for development of the United Nations system\u201d."
  },
  "agenda_items": [
    "Item 23"
  ],
  "symbol_references": []
}