{
  "symbol": "A/RES/72/50",
  "filename": "A_RES_72_50.pdf",
  "title": "72/50. United action with renewed determination towards the total elimination of nuclear weapons",
  "text": "United Nations \nA/RES/72/50\n \n \nGeneral Assembly \nDistr.: General \n12 December 2017 \n \n17-21728 (E)    141217     \n*1721728* \n \n \nSeventy-second session \nAgenda item 99 (z) \n \n \n \n \n Resolution adopted by the General Assembly \non 4 December 2017 \n \n \n \n \n[on the report of the First Committee (A/72/409)] \n \n \n \n72/50. United action with renewed determination towards the total \nelimination of nuclear weapons \n \n \n \nThe General Assembly, \n \nReaffirming its commitment towards a peaceful and secure world free of nuclear \nweapons, \n \nRecalling its resolution 71/49 of 5 December 2016, \n \nReaffirming the crucial importance of the Treaty on the Non-Proliferation of \nNuclear Weapons1 as the cornerstone of the international nuclear non-proliferation \nregime and an essential foundation for the pursuit of nuclear disarmament, nuclear \nnon-proliferation and the peaceful uses of nuclear energy, \n \nReaffirming also its determination to further strengthen the universality of the \nregime of the Treaty on the Non-Proliferation of Nuclear Weapons, and recalling that \nnuclear disarmament, non-proliferation and peaceful uses of nuclear energy are \nmutually reinforcing and are essential for strengthening the Treaty regime, \n \nRecalling the Final Documents of the 1995 Review and Extension Conference \nof the Parties to the Treaty on the Non-Proliferation of Nuclear Weapons2 and the \n20003 and 20104 Review Conferences of the Parties to the Treaty on the \nNon-Proliferation of Nuclear Weapons, \n__________________ \n \n1 United Nations, Treaty Series, vol. 729, No. 10485. \n \n2 1995 Review and Extension Conference of the Parties to the Treaty on the Non-Proliferation of \nNuclear Weapons, Final Document, Part I (NPT/CONF.1995/32 (Part I) and \nNPT/CONF.1995/32 (Part I)/Corr.2). \n \n3 2000 Review Conference of the Parties to the Treaty on the Non-Proliferation of Nuclear \nWeapons, Final Document, vols. I\u2013III (NPT/CONF.2000/28 (Parts I and II), \nNPT/CONF.2000/28 (Part III) and NPT/CONF.2000/28 (Part IV)). \n \n4 2010 Review Conference of the Parties to the Treaty on the Non-Proliferation of Nuclear \nWeapons, Final Document, vols. I\u2013III (NPT/CONF.2010/50 (Vol. I), \nNPT/CONF.2010/50 (Vol. II) and NPT/CONF.2010/50 (Vol. III)). \n\nA/RES/72/50 \nUnited action with renewed determination towards\nthe total elimination of nuclear weapons\n \n17-21728 \n2/6 \n \n \nStressing the importance of the Review Conference of the Parties to the Treaty \non the Non-Proliferation of Nuclear Weapons to be held in 2020, on the occasion of \nthe fiftieth anniversary of the entry into force of the Treaty, and of its review cycle \ntowards the 2020 Review Conference, \n \nEmphasizing the crucial importance of rebuilding trust and enhancing \ncooperation among all States in order to make substantive progress in nuclear \ndisarmament and non-proliferation, bearing in mind there are various approaches \ntowards the realization of a world free of nuclear weapons, \n \nReaffirming that the enhancement of international peace and security and the \npromotion of nuclear disarmament are mutually reinforcing, \n \nExpressing grave concern over the recent developments in regional security \nsituations and the growing dangers posed by the proliferation of weapons of mass \ndestruction, including nuclear weapons, and by related proliferation networks, \n \nRecalling, in this context, that the repeated and frequent unlawful nuclear tests \nand the launches using ballistic missile technology conducted by the Democratic \nPeople\u2019s Republic of Korea, including its nuclear test of 3 September 2017, which it \nannounced as a hydrogen bomb for an intercontinental ballistic missile, and the two \nlaunches of ballistic missiles which flew over Japan on 29 August and 15 September \n2017, pose unprecedented, grave and imminent threats to the peace and security of \nthe region and the world, present grave challenges to the regime centred on the Treaty \non the Non-Proliferation of Nuclear Weapons, and constitute clear and repeated \nviolations of the relevant Security Council resolutions, and reiterating the resolute \nopposition of the international community to the possession of nuclear weapons by \nthe Democratic People\u2019s Republic of Korea, \n \nRecognizing that the relevant Security Council resolutions, including resolution \n2375 (2017) of 11 September 2017, express the Council\u2019s firm opposition to the \nunlawful nuclear and missile programmes of the Democratic People\u2019s Republic of \nKorea in violation of the relevant Council resolutions and the Council\u2019s determination \nto take further significant measures in the event of a further nuclear test or ballistic \nmissile launch by the Democratic People\u2019s Republic of Korea, \n \nReaffirming that further consolidation of the international regime for nuclear \nnon-proliferation, is, inter alia, essential to international peace and security, \n \nNoting that the ultimate objective of the efforts of States in the disarmament \nprocess is general and complete disarmament under strict and effective international \ncontrol, \n \nStressing the importance of the decisions and the resolution on the Middle East \nof the 1995 Review and Extension Conference of the Parties to the Treaty on the Non-\nProliferation of Nuclear Weapons and the Final Documents of the 2000 and 2010 \nReview Conferences of the Parties to the Treaty on the Non-Proliferation of Nuclear \nWeapons, and reaffirming its support for the establishment of a Middle East zone free \nof nuclear weapons and all other weapons of mass destruction and their delivery \nsystems, on the basis of arrangements freely arrived at by the States of the region and \nin accordance with the 1995 resolution on the Middle East, and for the resumption of \ndialogue towards this end involving the States concerned, \n \nWelcoming the efforts undertaken towards the development of nuclear \ndisarmament verification capabilities that can contribute to the pursuit of a world free \nof nuclear weapons, including the International Partnership for Nuclear Disarmament \nVerification, and stressing in this regard the importance of cooperation between \nnuclear-weapon States and non-nuclear-weapon States, \n\nUnited action with renewed determination towards \nthe total elimination of nuclear weapons \nA/RES/72/50\n \n3/6 \n17-21728 \n \n \nStressing the need to continue to explore possibilities for overcoming the \nongoing deadlock of two decades in the Conference on Disarmament, \n \nWelcoming the continuing successful implementation of the Treaty between the \nRussian Federation and the United States of America on Measures for the Further \nReduction and Limitation of Strategic Offensive Arms, \n \nCommending the accomplishments of the Preparatory Commission for the \nComprehensive Nuclear-Test-Ban Treaty Organization since the opening for \nsignature of the Treaty,5 in particular the significant progress made in the \nestablishment of the International Monitoring System and the International Data \nCentre, \n \nExpressing deep concern at the catastrophic humanitarian consequences of \nnuclear weapons use, and reaffirming the need for all States to comply at all times \nwith applicable international law, including international humanitarian law, while \nconvinced that every effort should be made to avoid the use of nuclear weapons, \n \nRecognizing that the catastrophic humanitarian consequences that would result \nfrom the use of nuclear weapons should be fully understood by all, and noting in this \nregard that efforts should be made to increase such understanding, \n \nWelcoming the recent visits of political leaders to Hiroshima and Nagasaki, \n \nRecalling that nuclear and radiological terrorism remains a pressing and \nevolving challenge to the international community, and reaffirming the central role of \nthe International Atomic Energy Agency in nuclear security, \n \n1. \nRenews the determination of all States to take united action towards the \ntotal elimination of nuclear weapons through the easing of international tension and \nthe strengthening of trust between States as envisioned in the preamble to the Treaty \non the Non-Proliferation of Nuclear Weapons1 in order to facilitate disarmament and \nthrough strengthening the nuclear non-proliferation regime; \n \n2. \nReaffirms, in this regard, the unequivocal undertaking of the nuclear-\nweapon States to fully implement the Treaty on the Non-Proliferation of Nuclear \nWeapons, towards a safer world for all and a peaceful and secure world free of nuclear \nweapons; \n \n3. \nCalls upon all States parties to the Treaty on the Non-Proliferation of \nNuclear Weapons to comply with their obligations under all the articles of the Treaty; \n \n4. \nEncourages all States to exert their utmost efforts towards the success of \nthe 2020 Review Conference of the Parties to the Treaty on the Non-Proliferation of \nNuclear Weapons, welcoming the successful convening of the first session of the \nPreparatory Committee for the Review Conference, which was held in Vienna in May \n2017; \n \n5. \nCalls upon all States not parties to the Treaty on the Non-Proliferation of \nNuclear Weapons to accede as non-nuclear-weapon States to the Treaty promptly and \nwithout any conditions to achieve its universality and, pending their accession to the \nTreaty, to adhere to its terms and to take practical steps in support of the Treaty; \n \n6. \nCalls upon all States to take further practical steps and effective measures \ntowards the total elimination of nuclear weapons, based on the principle of \nundiminished and increased security for all; \n__________________ \n \n5 See resolution 50/245 and A/50/1027. \n\nA/RES/72/50 \nUnited action with renewed determination towards\nthe total elimination of nuclear weapons\n \n17-21728 \n4/6 \n \n \n7. \nEncourages all States to further engage in meaningful dialogue that \nfacilitates practical, concrete and effective measures on nuclear disarmament and \nnon-proliferation; \n \n8. \nEmphasizes that deep concerns about the humanitarian consequences of \nthe use of nuclear weapons continue to be a key factor that underpins efforts by all \nStates towards a world free of nuclear weapons; \n \n9. \nEncourages the Russian Federation and the United States of America to \ntake steps to create conditions that would allow for the commencement of \nnegotiations at an early date to achieve greater reductions in their stockpiles of \nnuclear weapons, with a view to concluding such negotiations as soon as possible; \n \n10. Calls upon all States to ease international tension, strengthen trust between \nStates, and create conditions that would allow for further reduction of nuclear \nweapons, and calls upon all nuclear-weapon States to undertake further efforts to \nreduce and ultimately eliminate all types of nuclear weapons, deployed and \nnon-deployed, including through unilateral, bilateral, regional, and multilateral \nmeasures; \n \n11. \nAlso calls upon all States to apply the principles of irreversibility, \nverifiability and transparency in relation to the process of nuclear disarmament and \nnon-proliferation; \n \n12. Encourages the nuclear-weapon States to continue to convene regular \nmeetings, with a view to creating the necessary environment for and thereby \nimplementing further nuclear disarmament, and to build upon and expand their efforts \nto enhance transparency and to increase mutual confidence, including, inter alia, by \nproviding more frequent and further detailed reporting on nuclear weapons and \ndelivery systems dismantled and reduced as part of nuclear disarmament efforts \nthroughout the review process of the Treaty on the Non-Proliferation of Nuclear \nWeapons towards the 2020 Review Conference of the Parties to the Treaty; \n \n13. Calls upon all States to ease international tension and strengthen trust \nbetween States, and create the necessary environment that would allow for further \nconsideration of, and calls upon States concerned to continue to review, their military \nand security concepts, doctrines and policies with a view to reducing further the role \nand significance of nuclear weapons therein, taking into account the security \nenvironment; \n \n14. Recognizes the legitimate interest of non-nuclear-weapon States that are \nparty to the Treaty on the Non-Proliferation of Nuclear Weapons and in compliance \nwith their nuclear non-proliferation obligations in receiving unequivocal and legally \nbinding security assurances from nuclear-weapon States which could strengthen the \nnuclear non-proliferation regime; \n \n15. Recalls Security Council resolution 984 (1995) of 11 April 1995, noting \nthe unilateral statements by each of the nuclear-weapon States, and calls upon all \nnuclear-weapon States to fully respect their commitments with regard to security \nassurances; \n \n16. Encourages the establishment of further nuclear-weapon-free zones, \nwhere appropriate, on the basis of arrangements freely arrived at by the States of the \nregion concerned and in accordance with the 1999 guidelines of the Disarmament \nCommission,6 and recognizes that, by signing and ratifying relevant protocols that \ncontain negative security assurances, nuclear-weapon States would undertake \n__________________ \n \n6 See Official Records of the General Assembly, Fifty-fourth Session, Supplement No. 42 \n(A/54/42). \n\nUnited action with renewed determination towards \nthe total elimination of nuclear weapons \nA/RES/72/50\n \n5/6 \n17-21728 \n \nindividual legally binding commitments with respect to the status of such zones and \nnot to use or threaten to use nuclear weapons against States that are party to such \ntreaties; \n \n17. Urges all States possessing nuclear weapons to continue to undertake all \nefforts necessary to comprehensively address the risks of unintended nuclear \ndetonations; \n \n18. Encourages further efforts towards the establishment of a Middle East \nzone free of nuclear weapons and all other weapons of mass destruction and their \ndelivery systems, on the basis of arrangements freely arrived at by the States of the \nregion and in accordance with the 1995 resolution on the Middle East, 7 and the \nresumption of dialogue towards that end involving the States concerned; \n \n19. Stresses the vital importance and urgency of universal adherence to the \nmoratoria on nuclear-weapon test explosions or any other nuclear explosions in the \nlight of the tests conducted by the Democratic People\u2019s Republic of Korea, \nrecognizing that the Democratic People\u2019s Republic of Korea is an annex 2 State and \nthat the entry into force of the Comprehensive Nuclear-Test-Ban Treaty5 will not be \npossible while such testing by the Democratic People\u2019s Republic of Korea continues, \nand urges the Democratic People\u2019s Republic of Korea to sign and ratify that Treaty \nwithout further delay and without waiting for any other State to do so; \n \n20. Also stresses the vital importance and urgency for all States who have not \ndone so to declare and maintain moratoria on the production of fissile material for \nuse in nuclear weapons or other nuclear explosive devices, pending commencement \nof negotiations on a treaty banning the production of fissile material for nuclear \nweapons or other nuclear explosive devices and its early conclusion, as called for in \ndocument CD/1299 of 24 March 1995 and the mandate contained therein, and \nwelcomes in this context the recent efforts of the high-level expert preparatory group \nestablished by the General Assembly in its resolution 71/259 of 23 December 2016 in \norder to attain recommendations on substantial elements of a future fissile material \ncut-off treaty, including by examining the report of the Group of Governmental \nExperts contained in document A/70/81; \n \n21. Acknowledges the widespread call for the early entry into force of the \nComprehensive Nuclear-Test-Ban Treaty, while recalling that all States, in particular \nthe eight remaining States in annex 2 thereof, have been urged to take individual \ninitiatives to sign and ratify that Treaty without waiting for any other State to do so, \nand the immediate commencement of negotiations on a treaty banning the production \nof fissile material for nuclear weapons or other nuclear explosive devices;  \n \n22. Encourages all States to implement the recommendations contained in the \nreport of the Secretary-General on the United Nations study on disarmament and non-\nproliferation education,8 in support of achieving a world free of nuclear weapons; \n \n23. Encourages every effort to raise awareness of the realities of the use of \nnuclear weapons, including through, among others, visits by leaders, youth and others \nto and interactions with communities and people, including atomic bomb survivors, \nthe hibakusha, that pass on their experiences to the future generations; \n \n24. Condemns in the strongest terms all nuclear tests and launches using \nballistic missile technology by the Democratic People\u2019s Republic of Korea, which \ncannot have the status of a nuclear-weapon State in accordance with the Treaty on the \n__________________ \n \n7 See 1995 Review and Extension Conference of the Parties to the Treaty on the Non-Proliferation \nof Nuclear Weapons, Final Document, Part I (NPT/CONF.1995/32 (Part I) and \nNPT/CONF.1995/32 (Part I)/Corr.2), annex. \n \n8 A/57/124. \n\nA/RES/72/50 \nUnited action with renewed determination towards\nthe total elimination of nuclear weapons\n \n17-21728 \n6/6 \n \nNon-Proliferation of Nuclear Weapons, strongly urges the Democratic People\u2019s \nRepublic of Korea to refrain from conducting further nuclear tests and to abandon all \nongoing nuclear activities immediately in a complete, verifiable and irreversible \nmanner, and calls upon the Democratic People\u2019s Republic of Korea to fully comply \nwith all relevant Security Council resolutions, with special emphasis on Council \nresolutions 2356 (2017) of 2 June 2017, 2371 (2017) of 5 August 2017 and, most \nrecently, resolution 2375 (2017) of 11 September 2017 adopted since the seventy-first \nsession of the General Assembly, to implement the joint statement of the Six-Party \nTalks of 19 September 2005 and to return at an early date to full compliance with the \nTreaty, including that of the International Atomic Energy Agency safeguards; \n \n25. Calls upon all States to make utmost efforts to address the unprecedented, \ngrave and imminent threat posed by the nuclear and missile programmes of the \nDemocratic People\u2019s Republic of Korea, including through the full implementation \nof all relevant Security Council resolutions, including Council resolution \n2375 (2017); \n \n26. Also calls upon all States to redouble their efforts to prevent and curb the \nproliferation of nuclear weapons and their means of delivery and to fully respect and \ncomply with any obligations undertaken to forswear nuclear weapons; \n \n27. Further calls upon all States to establish and enforce effective domestic \ncontrols to prevent proliferation of nuclear weapons and encourages cooperation \namong States and technical assistance to enhance international partnership and \ncapacity-building in non-proliferation efforts; \n \n28. Stresses the fundamental role of the International Atomic Energy Agency \nsafeguards and the importance of the universalization of the comprehensive \nsafeguards agreements, and, while noting that it is the sovereign decision of any State \nto conclude an additional protocol, strongly encourages all States that have not done \nso to conclude and bring into force as soon as possible an additional protocol based \non the Model Additional Protocol to the Agreement(s) between States and the \nInternational Atomic Energy Agency for the Application of Safeguards, approved by \nthe Board of Governors of the Agency on 15 May 1997; \n \n29. Calls upon all States to fully implement relevant Security Council \nresolutions, including Council resolutions 1540 (2004) of 28 April 2004 and \n2325 (2016) of 15 December 2016, based on the outcome of the comprehensive \nreview of the status of implementation of Council resolution 1540 (2004); \n \n30. Encourages all States to attach more importance to, and enhance the \nsecurity of, nuclear and other radiological materials, and to further strengthen the \nglobal nuclear security architecture; \n \n31. Decides to include in the provisional agenda of its seventy-third session, \nunder the item entitled \u201cGeneral and complete disarmament\u201d, the sub-item entitled \n\u201cUnited action with renewed determination towards the total elimination of nuclear \nweapons\u201d. \n \n62nd plenary meeting  \n4 December 2017 \n \n",
  "paragraphs": {
    "1": "Renews the determination of all States to take united action towards the total elimination of nuclear weapons through the easing of international tension and the strengthening of trust between States as envisioned in the preamble to the Treaty on the Non-Proliferation of Nuclear Weapons1 in order to facilitate disarmament and through strengthening the nuclear non-proliferation regime;",
    "2": "Reaffirms, in this regard, the unequivocal undertaking of the nuclear- weapon States to fully implement the Treaty on the Non-Proliferation of Nuclear Weapons, towards a safer world for all and a peaceful and secure world free of nuclear weapons;",
    "3": "Calls upon all States parties to the Treaty on the Non-Proliferation of Nuclear Weapons to comply with their obligations under all the articles of the Treaty;",
    "4": "Encourages all States to exert their utmost efforts towards the success of the 2020 Review Conference of the Parties to the Treaty on the Non-Proliferation of Nuclear Weapons, welcoming the successful convening of the first session of the Preparatory Committee for the Review Conference, which was held in Vienna in May 2017;",
    "5": "Calls upon all States not parties to the Treaty on the Non-Proliferation of Nuclear Weapons to accede as non-nuclear-weapon States to the Treaty promptly and without any conditions to achieve its universality and, pending their accession to the Treaty, to adhere to its terms and to take practical steps in support of the Treaty;",
    "6": "Calls upon all States to take further practical steps and effective measures towards the total elimination of nuclear weapons, based on the principle of undiminished and increased security for all; __________________ 5 See resolution 50/245 and A/50/1027. A/RES/72/50 United action with renewed determination towards the total elimination of nuclear weapons 17-21728 4/6",
    "7": "Encourages all States to further engage in meaningful dialogue that facilitates practical, concrete and effective measures on nuclear disarmament and non-proliferation;",
    "8": "Emphasizes that deep concerns about the humanitarian consequences of the use of nuclear weapons continue to be a key factor that underpins efforts by all States towards a world free of nuclear weapons;",
    "9": "Encourages the Russian Federation and the United States of America to take steps to create conditions that would allow for the commencement of negotiations at an early date to achieve greater reductions in their stockpiles of nuclear weapons, with a view to concluding such negotiations as soon as possible;",
    "10": "Calls upon all States to ease international tension, strengthen trust between States, and create conditions that would allow for further reduction of nuclear weapons, and calls upon all nuclear-weapon States to undertake further efforts to reduce and ultimately eliminate all types of nuclear weapons, deployed and non-deployed, including through unilateral, bilateral, regional, and multilateral measures;",
    "11": "Also calls upon all States to apply the principles of irreversibility, verifiability and transparency in relation to the process of nuclear disarmament and non-proliferation;",
    "12": "Encourages the nuclear-weapon States to continue to convene regular meetings, with a view to creating the necessary environment for and thereby implementing further nuclear disarmament, and to build upon and expand their efforts to enhance transparency and to increase mutual confidence, including, inter alia, by providing more frequent and further detailed reporting on nuclear weapons and delivery systems dismantled and reduced as part of nuclear disarmament efforts throughout the review process of the Treaty on the Non-Proliferation of Nuclear Weapons towards the 2020 Review Conference of the Parties to the Treaty;",
    "13": "Calls upon all States to ease international tension and strengthen trust between States, and create the necessary environment that would allow for further consideration of, and calls upon States concerned to continue to review, their military and security concepts, doctrines and policies with a view to reducing further the role and significance of nuclear weapons therein, taking into account the security environment;",
    "14": "Recognizes the legitimate interest of non-nuclear-weapon States that are party to the Treaty on the Non-Proliferation of Nuclear Weapons and in compliance with their nuclear non-proliferation obligations in receiving unequivocal and legally binding security assurances from nuclear-weapon States which could strengthen the nuclear non-proliferation regime;",
    "15": "Recalls Security Council resolution 984 (1995) of 11 April 1995, noting the unilateral statements by each of the nuclear-weapon States, and calls upon all nuclear-weapon States to fully respect their commitments with regard to security assurances;",
    "16": "Encourages the establishment of further nuclear-weapon-free zones, where appropriate, on the basis of arrangements freely arrived at by the States of the region concerned and in accordance with the 1999 guidelines of the Disarmament Commission,6 and recognizes that, by signing and ratifying relevant protocols that contain negative security assurances, nuclear-weapon States would undertake __________________ 6 See Official Records of the General Assembly, Fifty-fourth Session, Supplement No. 42 (A/54/42). United action with renewed determination towards the total elimination of nuclear weapons A/RES/72/50 5/6 17-21728 individual legally binding commitments with respect to the status of such zones and not to use or threaten to use nuclear weapons against States that are party to such treaties;",
    "17": "Urges all States possessing nuclear weapons to continue to undertake all efforts necessary to comprehensively address the risks of unintended nuclear detonations;",
    "18": "Encourages further efforts towards the establishment of a Middle East zone free of nuclear weapons and all other weapons of mass destruction and their delivery systems, on the basis of arrangements freely arrived at by the States of the region and in accordance with the 1995 resolution on the Middle East, 7 and the resumption of dialogue towards that end involving the States concerned;",
    "19": "Stresses the vital importance and urgency of universal adherence to the moratoria on nuclear-weapon test explosions or any other nuclear explosions in the light of the tests conducted by the Democratic People\u2019s Republic of Korea, recognizing that the Democratic People\u2019s Republic of Korea is an annex 2 State and that the entry into force of the Comprehensive Nuclear-Test-Ban Treaty5 will not be possible while such testing by the Democratic People\u2019s Republic of Korea continues, and urges the Democratic People\u2019s Republic of Korea to sign and ratify that Treaty without further delay and without waiting for any other State to do so;",
    "20": "Also stresses the vital importance and urgency for all States who have not done so to declare and maintain moratoria on the production of fissile material for use in nuclear weapons or other nuclear explosive devices, pending commencement of negotiations on a treaty banning the production of fissile material for nuclear weapons or other nuclear explosive devices and its early conclusion, as called for in document CD/1299 of 24 March 1995 and the mandate contained therein, and welcomes in this context the recent efforts of the high-level expert preparatory group established by the General Assembly in its resolution 71/259 of 23 December 2016 in order to attain recommendations on substantial elements of a future fissile material cut-off treaty, including by examining the report of the Group of Governmental Experts contained in document A/70/81;",
    "21": "Acknowledges the widespread call for the early entry into force of the Comprehensive Nuclear-Test-Ban Treaty, while recalling that all States, in particular the eight remaining States in annex 2 thereof, have been urged to take individual initiatives to sign and ratify that Treaty without waiting for any other State to do so, and the immediate commencement of negotiations on a treaty banning the production of fissile material for nuclear weapons or other nuclear explosive devices;",
    "22": "Encourages all States to implement the recommendations contained in the report of the Secretary-General on the United Nations study on disarmament and non- proliferation education,8 in support of achieving a world free of nuclear weapons;",
    "23": "Encourages every effort to raise awareness of the realities of the use of nuclear weapons, including through, among others, visits by leaders, youth and others to and interactions with communities and people, including atomic bomb survivors, the hibakusha, that pass on their experiences to the future generations;",
    "24": "Condemns in the strongest terms all nuclear tests and launches using ballistic missile technology by the Democratic People\u2019s Republic of Korea, which cannot have the status of a nuclear-weapon State in accordance with the Treaty on the __________________ 7 See 1995 Review and Extension Conference of the Parties to the Treaty on the Non-Proliferation of Nuclear Weapons, Final Document, Part I (NPT/CONF.1995/32 (Part I) and NPT/CONF.1995/32 (Part I)/Corr.2), annex. 8 A/57/124. A/RES/72/50 United action with renewed determination towards the total elimination of nuclear weapons 17-21728 6/6 Non-Proliferation of Nuclear Weapons, strongly urges the Democratic People\u2019s Republic of Korea to refrain from conducting further nuclear tests and to abandon all ongoing nuclear activities immediately in a complete, verifiable and irreversible manner, and calls upon the Democratic People\u2019s Republic of Korea to fully comply with all relevant Security Council resolutions, with special emphasis on Council resolutions 2356 (2017) of 2 June 2017, 2371 (2017) of 5 August 2017 and, most recently, resolution 2375 (2017) of 11 September 2017 adopted since the seventy-first session of the General Assembly, to implement the joint statement of the Six-Party Talks of 19 September 2005 and to return at an early date to full compliance with the Treaty, including that of the International Atomic Energy Agency safeguards;",
    "25": "Calls upon all States to make utmost efforts to address the unprecedented, grave and imminent threat posed by the nuclear and missile programmes of the Democratic People\u2019s Republic of Korea, including through the full implementation of all relevant Security Council resolutions, including Council resolution 2375 (2017);",
    "26": "Also calls upon all States to redouble their efforts to prevent and curb the proliferation of nuclear weapons and their means of delivery and to fully respect and comply with any obligations undertaken to forswear nuclear weapons;",
    "27": "Further calls upon all States to establish and enforce effective domestic controls to prevent proliferation of nuclear weapons and encourages cooperation among States and technical assistance to enhance international partnership and capacity-building in non-proliferation efforts;",
    "28": "Stresses the fundamental role of the International Atomic Energy Agency safeguards and the importance of the universalization of the comprehensive safeguards agreements, and, while noting that it is the sovereign decision of any State to conclude an additional protocol, strongly encourages all States that have not done so to conclude and bring into force as soon as possible an additional protocol based on the Model Additional Protocol to the Agreement(s) between States and the International Atomic Energy Agency for the Application of Safeguards, approved by the Board of Governors of the Agency on 15 May 1997;",
    "29": "Calls upon all States to fully implement relevant Security Council resolutions, including Council resolutions 1540 (2004) of 28 April 2004 and 2325 (2016) of 15 December 2016, based on the outcome of the comprehensive review of the status of implementation of Council resolution 1540 (2004);",
    "30": "Encourages all States to attach more importance to, and enhance the security of, nuclear and other radiological materials, and to further strengthen the global nuclear security architecture;",
    "31": "Decides to include in the provisional agenda of its seventy-third session, under the item entitled \u201cGeneral and complete disarmament\u201d, the sub-item entitled \u201cUnited action with renewed determination towards the total elimination of nuclear weapons\u201d. 62nd plenary meeting 4 December 2017"
  },
  "agenda_items": [
    "Item 99"
  ],
  "symbol_references": []
}