{
  "symbol": "A/RES/79/49",
  "filename": "A_RES_79_49.pdf",
  "title": "79/49. Effects of the use of armaments and ammunitions containing depleted uranium",
  "text": "United Nations \nA/RES/79/49\n \n \nGeneral Assembly \nDistr.: General \n9 December 2024 \n \n24-23071 (E)     \n*2423071* \n \n \nSeventy-ninth session \nAgenda item 98 (cc) \nGeneral and complete disarmament: effects of the use of \narmaments and ammunitions containing depleted uranium\n \n \n \n \n \n Resolution adopted by the General Assembly \non 2 December 2024 \n \n \n \n \n[on the report of the First Committee (A/79/408, para. 114)] \n \n \n \n79/49. Effects of the use of armaments and ammunitions containing \ndepleted uranium \n \n \n \nThe General Assembly, \n \nGuided by the purposes and principles enshrined in the Charter of the United \nNations and the rules of international humanitarian law, \n \nRecalling its resolutions 62/30 of 5 December 2007, 63/54 of 2 December 2008, \n65/55 of 8 December 2010, 67/36 of 3 December 2012, 69/57 of 2 December 2014, \n71/70 of 5 December 2016, 73/38 of 5 December 2018 75/42 of 7 December 2020 \nand 77/49 of 7 December 2022, \n \nDetermined to promote multilateralism as an essential means to carry forward \nnegotiations on arms regulation and disarmament, \n \nTaking note of the opinions expressed by Member States and relevant \ninternational organizations on the effects of the use of armaments and ammunitions \ncontaining depleted uranium, as reflected in the reports submitted by the Secretary-\nGeneral pursuant to resolutions 62/30, 63/54, 65/55, 67/36, 69/57, 71/70, 73/38, 75/42 \nand 77/49,1 \n \nRecognizing \nthe \nimportance \nof \nimplementing, \nas \nappropriate, \nthe \nrecommendations of the International Atomic Energy Agency, the United Nations \nEnvironment Programme and the World Health Organization to mitigate potential \nhazards to human beings and the environment from the contamination of territories \nwith depleted uranium residues, \n__________________ \n \n1  A/63/170, A/63/170/Add.1, A/65/129, A/65/129/Add.1, A/67/177, A/67/177/Add.1, A/69/151, \nA/71/139, A/73/99, A/75/92, A/77/124 and A/79/96. \n\nA/RES/79/49 \nEffects of the use of armaments and ammunitions containing \ndepleted uranium\n \n24-23071\n2/3 \n \n \nConsidering that studies conducted so far by relevant international \norganizations have not provided a detailed enough account of the magnitude of the \npotential long-term effects on human beings and the environment of the use of \narmaments and ammunitions containing depleted uranium, \n \nRecalling that the United Nations Environment Programme, in its report to the \nSecretary-General on the subject,2 affirms that major scientific uncertainties persist \nregarding the long-term environmental impacts of depleted uranium, particularly with \nrespect to long-term groundwater contamination, and calls for a precautionary \napproach to the use of depleted uranium, \n \nConvinced that, as humankind becomes more aware of the need to take \nimmediate measures to protect the environment, any event that could jeopardize such \nefforts requires urgent attention to implement the required measures, \n \nNoting that further research should be done to assess the health risks and \nenvironmental impact of the use of arms and ammunitions containing depleted \nuranium in conflict situations, \n \nNoting also the technical and financial barriers faced by affected States seeking \nto implement post-conflict remedial measures that meet international standards for \nradioactive waste management for locations, infrastructure and materiel contaminated \nby arms and ammunitions containing depleted uranium, \n \nTaking into consideration the potential harmful effects of the use of armaments \nand ammunitions containing depleted uranium on human health and the environment, \nand the ongoing concerns of affected States and communities, health experts and civil \nsociety about such effects, \n \n1. \nExpresses its appreciation to the Member States and international \norganizations that submitted their views to the Secretary-General pursuant to \nresolution 77/49 and previous resolutions on the subject; \n \n2. \nInvites Member States and relevant international organizations, \nparticularly those that have not yet done so, to communicate to the Secretary-General \ntheir views on the effects of the use of armaments and ammunitions containing \ndepleted uranium; \n \n3. \nRequests the Secretary-General to request relevant international \norganizations to update and complete, as appropriate, their studies and research on \nthe effects of the use of armaments and ammunitions containing depleted uranium on \nhuman health and the environment; \n \n4. \nEncourages Member States, particularly the affected States, as necessary, \nto facilitate the studies and research referred to in paragraph 3 above; \n \n5. \nAlso encourages Member States to follow closely the development of the \nstudies and research referred to in paragraph 3 above; \n \n6. \nInvites Member States that have used armaments and ammunitions \ncontaining depleted uranium in armed conflicts to provide the relevant authorities of \naffected States, upon request, with information, as detailed as possible, about the \nlocation of the areas of use and the amounts used, with the objective of facilitating \nthe assessment and clearance of such areas; \n \n7. \nEncourages Member States in a position to do so to provide assistance to \nStates affected by the use of arms and ammunitions containing depleted uranium, in \nparticular in identifying and managing contaminated sites and material; \n__________________ \n \n2 A/65/129/Add.1, sect. III. \n\nEffects of the use of armaments and ammunitions containing \ndepleted uranium \nA/RES/79/49\n \n3/3\n24-23071 \n \n \n8. \nRequests the Secretary-General to submit an updated report on the subject \nto the General Assembly at its eighty-first session, reflecting the information \nsubmitted by Member States and relevant international organizations, including the \ninformation submitted pursuant to paragraphs 2 and 3 above; \n \n9. \nDecides to include in the provisional agenda of its eighty-first session, \nunder the item entitled \u201cGeneral and complete disarmament\u201d, the sub-item entitled \n\u201cEffects of the use of armaments and ammunitions containing depleted uranium\u201d. \n \n43rd plenary meeting \n2 December 2024 \n \n",
  "paragraphs": {
    "1": "Expresses its appreciation to the Member States and international organizations that submitted their views to the Secretary-General pursuant to resolution 77/49 and previous resolutions on the subject;",
    "2": "Invites Member States and relevant international organizations, particularly those that have not yet done so, to communicate to the Secretary-General their views on the effects of the use of armaments and ammunitions containing depleted uranium;",
    "3": "Requests the Secretary-General to request relevant international organizations to update and complete, as appropriate, their studies and research on the effects of the use of armaments and ammunitions containing depleted uranium on human health and the environment;",
    "4": "Encourages Member States, particularly the affected States, as necessary, to facilitate the studies and research referred to in paragraph 3 above;",
    "5": "Also encourages Member States to follow closely the development of the studies and research referred to in paragraph 3 above;",
    "6": "Invites Member States that have used armaments and ammunitions containing depleted uranium in armed conflicts to provide the relevant authorities of affected States, upon request, with information, as detailed as possible, about the location of the areas of use and the amounts used, with the objective of facilitating the assessment and clearance of such areas;",
    "7": "Encourages Member States in a position to do so to provide assistance to States affected by the use of arms and ammunitions containing depleted uranium, in particular in identifying and managing contaminated sites and material; __________________ 2 A/65/129/Add.1, sect. III. Effects of the use of armaments and ammunitions containing depleted uranium A/RES/79/49 3/3 24-23071",
    "8": "Requests the Secretary-General to submit an updated report on the subject to the General Assembly at its eighty-first session, reflecting the information submitted by Member States and relevant international organizations, including the information submitted pursuant to paragraphs 2 and 3 above;",
    "9": "Decides to include in the provisional agenda of its eighty-first session, under the item entitled \u201cGeneral and complete disarmament\u201d, the sub-item entitled \u201cEffects of the use of armaments and ammunitions containing depleted uranium\u201d. 43rd plenary meeting 2 December 2024"
  },
  "agenda_items": [
    "Item 98"
  ],
  "symbol_references": []
}