{
  "symbol": "A/RES/73/277",
  "filename": "A_RES_73_277.pdf",
  "title": "73/277. Financing of the International Residual Mechanism for Criminal Tribunals",
  "text": "United Nations \nA/RES/73/277\n \n \nGeneral Assembly \nDistr.: General \n7 January 2019 \n \n18-22663 (E)    090119     \n*1822663* \n \n \nSeventy-third session \nAgenda item 148 \n \n \n \n \n Resolution adopted by the General Assembly \non 22 December 2018 \n \n \n \n \n[on the report of the Fifth Committee (A/73/670)] \n \n \n 73/277. Financing of the International Residual Mechanism \nfor Criminal Tribunals \n \n \n \nThe General Assembly, \n \nHaving considered the first performance report of the Secretary-General on the \nbudget of the International Residual Mechanism for Criminal Tribunals for the \nbiennium 2018\u20132019,\n1  the related report of the Advisory Committee on \nAdministrative and Budgetary Questions 2  and the financial reports and audited \nfinancial statements for the year ended 31 December 2017 and the reports of the \nBoard of Auditors on the International Tribunal for the Prosecution of Persons \nResponsible for Serious Violations of International Humanitarian Law Committed in \nthe Territory of the Former Yugoslavia since 1991 3 and on the International Residual \nMechanism for Criminal Tribunals,4 \n \nRecalling its resolution 66/240 A of 24 December 2011 on the financing of the \nInternational Residual Mechanism for Criminal Tribunals and its subsequent \nresolutions thereon, the latest of which was resolution 72/258 B of 5 July 2018, \n \n1. \nTakes note of the first performance report of the Secretary-General on the \nbudget of the International Residual Mechanism for Criminal Tribunals for the \nbiennium 2018\u20132019;1 \n \n2. \nEndorses the conclusions and recommendations contained in the report of \nthe Advisory Committee on Administrative and Budgetary Questions; 2 \n \n3. \nDecides on a revised appropriation to the Special Account for the \nInternational Residual Mechanism for Criminal Tribunals of a total amount of \n__________________ \n \n1  A/73/491. \n \n2  A/73/620. \n \n3  Official Records of the General Assembly, Seventy-third Session, Supplement No. 5N \n(A/73/5/Add.14). \n \n4  Ibid., Supplement No. 5O (A/73/5/Add.15). \n\nA/RES/73/277 \nFinancing of the International Residual Mechanism for Criminal Tribunals\n \n18-22663\n2/2 \n \n195,720,600 United States dollars gross (174,690,800 dollars net) for the biennium \n2018\u20132019, as detailed in the annex to the present resolution; \n \n4. \nAlso decides, for the year 2019, to apportion among Member States, in \naccordance with the scale of assessments applicable to the regular budget of the \nUnited Nations for the year, the amount of 48,854,275 dollars gross (43,583,500 \ndollars net), including 151,750 dollars gross (178,400 dollars net), being the decrease \nin assessments; \n \n5. \nFurther decides, for the year 2019, to apportion among Member States, in \naccordance with the rates of assessment applicable to peacekeeping operations of the United \nNations for the year, the amount of 48,854,275 dollars gross (43,583,500 dollars net), \nincluding 151,750 dollars gross (178,400 dollars net), being the decrease in assessments; \n \n6. \nDecides that, in accordance with the provisions of its resolution 973 (X) \nof 15 December 1955, there shall be set off against the apportionment among Member \nStates, as provided for in paragraphs 4 and 5 above, their respective share in the Tax \nEqualization Fund in the amount of 10,541,550 dollars, including 53,300 dollars, \nbeing the increase of the estimated staff assessment income approved for the \nMechanism for the biennium 2018\u20132019. \n \n65th plenary meeting \n22 December 2018 \n \n \n \n \nAnnex \n \n \n \nFinancing of the International Residual Mechanism for Criminal Tribunals \nfor the biennium 2018\u20132019 \n \n \nGross \nNet \n(United States dollars) \nInitial appropriation for the biennium 2018\u20132019 (resolution \n72/258 B) \n196 024 100 \n175 047 600 \nFirst performance report for the biennium 2018\u20132019 (A/73/491) \n(303 500) \n(356 800) \nRecommendations of the Advisory Committee on Administrative \nand Budgetary Questions (A/73/620) \n\u2013 \n\u2013 \nRecommendations of the Fifth Committee \n\u2013 \n\u2013 \nRevised appropriation for the biennium 2018\u20132019 \n195 720 600 \n174 690 800 \nLess: Assessment for 2018 \n98 012 050 \n87 523 800 \nBalance to be assessed for 2019 \n97 708 550 \n87 167 000 \nIncluding: \n \n \nContributions assessed on Member States in accordance with \nthe scale of assessments applicable to the regular budget of the \nUnited Nations for 2019 \n48 854 275 \n43 583 500 \nContributions assessed on Member States in accordance with \nthe rates of assessment applicable to peacekeeping operations \nof the United Nations for 2019 \n48 854 275 \n43 583 500 \n \n \n",
  "paragraphs": {
    "1": "Takes note of the first performance report of the Secretary-General on the budget of the International Residual Mechanism for Criminal Tribunals for the biennium 2018\u20132019;1",
    "2": "Endorses the conclusions and recommendations contained in the report of the Advisory Committee on Administrative and Budgetary Questions; 2",
    "3": "Decides on a revised appropriation to the Special Account for the International Residual Mechanism for Criminal Tribunals of a total amount of 195,720,600 United States dollars gross (174,690,800 dollars net) for the biennium 2018\u20132019, as detailed in the annex to the present resolution;",
    "4": "Also decides, for the year 2019, to apportion among Member States, in accordance with the scale of assessments applicable to the regular budget of the United Nations for the year, the amount of 48,854,275 dollars gross (43,583,500 dollars net), including 151,750 dollars gross (178,400 dollars net), being the decrease in assessments;",
    "5": "Further decides, for the year 2019, to apportion among Member States, in accordance with the rates of assessment applicable to peacekeeping operations of the United Nations for the year, the amount of 48,854,275 dollars gross (43,583,500 dollars net), including 151,750 dollars gross (178,400 dollars net), being the decrease in assessments;",
    "6": "Decides that, in accordance with the provisions of its resolution 973 (X) of 15 December 1955, there shall be set off against the apportionment among Member States, as provided for in paragraphs 4 and 5 above, their respective share in the Tax Equalization Fund in the amount of 10,541,550 dollars, including 53,300 dollars, being the increase of the estimated staff assessment income approved for the Mechanism for the biennium 2018\u20132019. 65th plenary meeting 22 December 2018 Annex Financing of the International Residual Mechanism for Criminal Tribunals for the biennium 2018\u20132019 Gross Net (United States dollars) Initial appropriation for the biennium 2018\u20132019 (resolution 72/258 B) 196 024 100 175 047 600 First performance report for the biennium 2018\u20132019 (A/73/491) (303 500) (356 800) Recommendations of the Advisory Committee on Administrative and Budgetary Questions (A/73/620) \u2013 \u2013 Recommendations of the Fifth Committee \u2013 \u2013 Revised appropriation for the biennium 2018\u20132019 195 720 600 174 690 800 Less: Assessment for 2018 98 012 050 87 523 800 Balance to be assessed for 2019 97 708 550 87 167 000 Including: Contributions assessed on Member States in accordance with the scale of assessments applicable to the regular budget of the United Nations for 2019 48 854 275 43 583 500 Contributions assessed on Member States in accordance with the rates of assessment applicable to peacekeeping operations of the United Nations for 2019 48 854 275 43 583 500"
  },
  "agenda_items": [
    "Item 148"
  ],
  "symbol_references": []
}