{
  "symbol": "A/RES/72/161",
  "filename": "A_RES_72_161.pdf",
  "title": "72/161. International Day of Sign Languages",
  "text": "United Nations \nA/RES/72/161\n \n \nGeneral Assembly \nDistr.: General \n25 January 2018 \n \n17-22970 (E)    301217     \n*1722970* \n \n \nSeventy-second session \nAgenda item 72 \n \n \n \n \n Resolution adopted by the General Assembly \non 19 December 2017 \n \n \n \n \n[on the report of the Third Committee (A/72/439)] \n \n \n 72/161. International Day of Sign Languages \n \n \n \nThe General Assembly, \n \nRecognizing that multilingualism, as a core value of the Organization, \ncontributes to the achievement of the goals of the United Nations, as set out in Article 1 \nof the Charter of the United Nations, \n \nRecognizing also that the United Nations pursues multilingualism as a means of \npromoting, protecting and preserving diversity of languages and cultures globally, as \nwell as of improving the efficiency, performance and transparency of the \nOrganization, \n \nReaffirming its resolutions 53/199 of 15 December 1998 and 61/185 of \n20 December 2006 on the proclamation of international years and Economic and \nSocial Council resolution 1980/67 of 25 July 1980 on international years and \nanniversaries, particularly paragraphs 1 to 10 of the annex thereto on the agreed \ncriteria for the proclamation of international years, and paragraphs 13 and 14, in \nwhich it is stated that an international day or year should not be proclaimed before \nthe basic arrangements for its organization and financing have been made, \n \nRecalling the International Covenant on Civil and Political Rights, 1  \n \nRecalling also the Convention on the Rights of Persons with Disabilities,2 in \nwhich it is reflected that sign languages are equal to spoken languages, and that States \nparties to the Convention undertake to recognize, accept and promote the use of sign \nlanguages, \n \nRecalling further its resolutions 2 (I) of 1 February 1946, 2480 B (XXIII) of \n21 December 1968, 42/207 C of 11 December 1987, 47/135 of 18 December 1992 \nand 50/11 of 2 November 1995 and other subsequent resolutions relating to \nmultilingualism, including resolutions 67/292 of 24 July 2013, 68/307 of \n__________________ \n \n1  See resolution 2200 A (XXI), annex. \n \n2  United Nations, Treaty Series, vol. 2515, No. 44910. \n\nA/RES/72/161 \nInternational Day of Sign Languages\n \n17-22970 \n2/2 \n \n10 September 2014, 69/96 A and B of 5 December 2014, 69/250 of 29 December \n2014, 69/324 of 11 September 2015, 71/101 A and B of 6 December 2016, 71/262 \nand 71/263 of 23 December 2016, 71/288 of 24 May 2017, 71/314 of 19 July 2017 \nand 71/328 of 11 September 2017, \n \nAffirming that ensuring and promoting the full realization of all human rights \nrelevant to matters of language and fundamental freedoms is a critical prerequisite to \nthe full realization of human rights for deaf people, \n \nAware that sign languages are fully fledged natural languages, structurally \ndistinct from spoken languages, alongside which they coexist, and that, when working \nwith deaf communities, the principle of \u201cnothing about us without us\u201d must be \nconsidered and integrated, \n \nRecalling that early access to sign language and services in sign language, \nincluding quality education available in sign language, is vital to the growth and \ndevelopment of the deaf individual and critical to the achievement of the \ninternationally agreed development goals, \n \nRecognizing the importance of preserving sign languages as part of linguistic \nand cultural diversity, \n \n1. \nProclaims 23 September as the International Day of Sign Languages, to be \nobserved each year beginning in 2018, in order to raise awareness of the importance \nof sign language in the full realization of the human rights of people who are deaf; \n \n2. \nInvites all Member States, relevant organizations of the United Nations \nsystem, \nother \ninternational \norganizations \nand \ncivil \nsociety, \nincluding \nnon-governmental organizations and the private sector, to observe the International \nDay of Sign Languages in an appropriate manner, in order to raise public awareness \nof sign languages; \n \n3. \nEncourages Member States to take measures to raise awareness of sign \nlanguages throughout society; \n \n4. \nRequests the Secretary-General to bring the present resolution to the \nattention of all Member States and organizations of the United Nations system; \n \n5. \nStresses that the cost of all activities that may arise from the \nimplementation of the present resolution regarding the International Day of Sign \nLanguages should be met from voluntary contributions. \n \n73rd plenary meeting  \n19 December 2017 \n \n",
  "paragraphs": {
    "1": "Proclaims 23 September as the International Day of Sign Languages, to be observed each year beginning in 2018, in order to raise awareness of the importance of sign language in the full realization of the human rights of people who are deaf;",
    "2": "Invites all Member States, relevant organizations of the United Nations system, other international organizations and civil society, including non-governmental organizations and the private sector, to observe the International Day of Sign Languages in an appropriate manner, in order to raise public awareness of sign languages;",
    "3": "Encourages Member States to take measures to raise awareness of sign languages throughout society;",
    "4": "Requests the Secretary-General to bring the present resolution to the attention of all Member States and organizations of the United Nations system;",
    "5": "Stresses that the cost of all activities that may arise from the implementation of the present resolution regarding the International Day of Sign Languages should be met from voluntary contributions."
  },
  "agenda_items": [
    "Item 72"
  ],
  "symbol_references": []
}