{
  "symbol": "A/RES/78/288",
  "filename": "A_RES_78_288.pdf",
  "title": "78/288. Twenty-fifth anniversary of the International Day for the Elimination of Violence against Women",
  "text": "United Nations \nA/RES/78/288\n \n \nGeneral Assembly \nDistr.: General \n19 June 2024 \n \n24-11038 (E)    240624 \n*2411038* \n \n \nSeventy-eighth session \nAgenda item 25 \nAdvancement of women \n \n \n \n \n Resolution adopted by the General Assembly \non 7 June 2024 \n \n \n \n \n[without reference to a Main Committee (A/78/L.69)] \n \n \n 78/288. Twenty-fifth anniversary of the International Day for the \nElimination of Violence against Women \n \n \n \nThe General Assembly, \n \nRecalling its resolution 54/134 of 17 December 1999, by which it designated \n25 November as the International Day for the Elimination of Violence against \nWomen,  \n \nReaffirming the Universal Declaration of Human Rights1 and other relevant \ninternational human rights instruments, including the Convention on the Elimination \nof All Forms of Discrimination against Women,2  \n \nReaffirming also the Vienna Declaration and Programme of Action3 as well as \nthe Beijing Declaration and Platform for Action, 4 the Cairo Programme of Action of \nthe International Conference on Population and Development 5 and the outcomes of \ntheir review conferences,  \n \nReaffirming further the Declaration on the Elimination of Violence against \nWomen, adopted on 20 December 1993,6 and its provisions, including article 1, in \nwhich violence against women was defined as any act of gender-based violence that \nresults in, or is likely to result in, physical, sexual or psychological harm or suffering \nto women, including threats of such acts, coercion or arbitrary deprivation of liberty, \n__________________ \n \n1  Resolution 217 A (III). \n \n2  United Nations, Treaty Series, vol. 1249, No. 20378. \n \n3  A/CONF.157/24 (Part I), chap. III. \n \n4  Report of the Fourth World Conference on Women, Beijing, 4\u201315 September 1995 (United Nations \npublication, Sales No. E.96.IV.13), chap. I, resolution 1, annexes I and II. \n \n5  Report of the International Conference on Population and Development, Cairo, 5\u201313 September \n1994 (United Nations publication, Sales No. E.95.XIII.18), chap. I, resolution 1, annex. \n \n6  Resolution 48/104. \n\nA/RES/78/288 \nTwenty-fifth anniversary of the International Day for the \nElimination of Violence against Women\n \n24-11038\n2/3 \n \nwhether occurring in public or in private life, and noting the economic and social \nharm caused by such violence,  \n \nReaffirming the obligation of all States to promote and protect all human rights \nand fundamental freedoms, and recognizing that violence against women and girls is \na major impediment to the achievement of gender equality and the empowerment of \nall women and girls and that it violates and impairs or nullifies the full enjoyment of \nall their human rights and fundamental freedoms,  \n \nRecognizing the efforts to eliminate all forms of violence against women and \ngirls and the high number of activities undertaken by the United Nations bodies, \nentities, funds and programmes and the specialized agencies,  \n \nWelcoming the commitment to achieve gender equality and the empowerment \nof all women and girls contained in the 2030 Agenda for Sustainable Development, 7 \nand stressing that preventing and eliminating all forms of violence against all women \nand girls in the public and private spheres is essential to achieving gender equality \nand empowering all women and girls and to promoting women\u2019s full, equal and \nmeaningful participation and leadership in all spheres of society, including in \neconomic and political life, \n \nStrongly condemning all forms of violence against women and girls, many of \nwhich are rooted in historical and structural inequalities and unequal power relations, \nand recognizing that, while progress has been made, violence against women remains \npervasive and is enabled through discriminatory norms that reinforce stereotypes and \ngender inequality and the corresponding impunity and lack of accountability, \n \nExpressing concern that current global challenges may exacerbate violence \nagainst women and girls and therefore threaten to reverse much of the development \nprogress made in recent decades and pose a challenge to the implementation of the \n2030 Agenda for Sustainable Development, and concerned about the challenges of \nnew and emerging forms of violence against women and girls that occur through or \nare amplified by the use of technologies and in digital contexts, especially against \nwomen in public and political life, \n \nRecognizing that the International Day for the Elimination of Violence against \nWomen was established in the light of the killing of the three Mirabal sisters from the \nDominican Republic,  \n \n1. \nWelcomes the twenty-fifth anniversary of the International Day for the \nElimination of Violence against Women, to be observed on 25 November 2024;  \n \n2. \nAcknowledges the progress made towards the elimination of all forms of \nviolence against women and girls and the remaining challenges that need to be \naddressed at all levels;  \n \n3. \nRecognizes the importance of the International Day for the Elimination of \nViolence against Women for raising awareness, educating and engaging communities, \nadvocacy and mobilization of decision makers, policymakers and the whole of society \nto step up efforts to prevent and eliminate all forms of violence against women and \ngirls; \n \n4. \nInvites all Member States, the United Nations system and other global, \nregional and subregional organizations, as well as other relevant stakeholders, \nincluding civil society, the private sector, academia and individuals, to commemorate \nthe twenty-fifth anniversary of the International Day for the Elimination of Violence \nagainst Women in order to increase awareness on the prevention of all forms of \n__________________ \n \n7  Resolution 70/1. \n\nTwenty-fifth anniversary of the International Day for the \nElimination of Violence against Women \nA/RES/78/288\n \n3/3\n24-11038 \n \nviolence against women and girls and achieve gender equality and a culture of peace, \nnon-violent behaviour and respectful relationships; \n \n5. \nRequests the President of the General Assembly to convene a full-day \nhigh-level meeting, within existing resources, to mark the twenty-fifth anniversary of \nthe International Day for the Elimination of Violence against Women, with a focus on \nhighlighting achievements, sharing best practices and identifying gaps and challenges \nto eliminating all forms of violence against women and girls, and to galvanize \naccelerated efforts on the prevention and elimination of all forms of violence against \nwomen and girls in line with the Beijing Declaration and Platform for Action as the \nthirtieth anniversary of their adoption approaches in 2025.  \n \n88th plenary meeting \n7 June 2024 \n \n",
  "paragraphs": {
    "1": "Welcomes the twenty-fifth anniversary of the International Day for the Elimination of Violence against Women, to be observed on 25 November 2024;",
    "2": "Acknowledges the progress made towards the elimination of all forms of violence against women and girls and the remaining challenges that need to be addressed at all levels;",
    "3": "Recognizes the importance of the International Day for the Elimination of Violence against Women for raising awareness, educating and engaging communities, advocacy and mobilization of decision makers, policymakers and the whole of society to step up efforts to prevent and eliminate all forms of violence against women and girls;",
    "4": "Invites all Member States, the United Nations system and other global, regional and subregional organizations, as well as other relevant stakeholders, including civil society, the private sector, academia and individuals, to commemorate the twenty-fifth anniversary of the International Day for the Elimination of Violence against Women in order to increase awareness on the prevention of all forms of violence against women and girls and achieve gender equality and a culture of peace, non-violent behaviour and respectful relationships;",
    "5": "Requests the President of the General Assembly to convene a full-day high-level meeting, within existing resources, to mark the twenty-fifth anniversary of the International Day for the Elimination of Violence against Women, with a focus on highlighting achievements, sharing best practices and identifying gaps and challenges to eliminating all forms of violence against women and girls, and to galvanize accelerated efforts on the prevention and elimination of all forms of violence against women and girls in line with the Beijing Declaration and Platform for Action as the thirtieth anniversary of their adoption approaches in 2025."
  },
  "agenda_items": [
    "Item 25"
  ],
  "symbol_references": [
    "A/78/L.69"
  ]
}