{
  "symbol": "A/RES/75/183",
  "filename": "A_RES_75_183.pdf",
  "title": "75/183. Moratorium on the use of the death penalty",
  "text": "United Nations \nA/RES/75/183\n \n \nGeneral Assembly \nDistr.: General \n28 December 2020 \n \n20-17326 (E)    050120     \n*2017326* \n \n \nSeventy-fifth session \nAgenda item 72 (b) \nPromotion and protection of human rights: human \nrights questions, including alternative approaches for \nimproving the effective enjoyment of human rights and \nfundamental freedoms  \n \n \n \n \n Resolution adopted by the General Assembly \non 16 December 2020 \n \n \n \n \n[on the report of the Third Committee (A/75/478/Add.2, para. 89)] \n \n \n 75/183. Moratorium on the use of the death penalty \n \n \n \nThe General Assembly, \n \nGuided by the purposes and principles contained in the Charter of the United \nNations, \n \nReaffirming the Universal Declaration of Human Rights,1 the International \nCovenant on Civil and Political Rights2 and the Convention on the Rights of the \nChild,3  \n \nRecalling the Second Optional Protocol to the International Covenant on Civil \nand Political Rights, aiming at the abolition of the death penalty, 4 and in this regard \nwelcoming the increasing number of accessions to and ratifications of the Second \nOptional Protocol,  \n \nRecalling also its resolutions 62/149 of 18 December 2007, 63/168 of \n18 December 2008, 65/206 of 21 December 2010, 67/176 of 20 December 2012, \n69/186 of 18 December 2014, 71/187 of 19 December 2016 and 73/175 of \n17 December 2018 on the question of a moratorium on the use of the death penalty, \nin which the General Assembly called upon States that still maintain the death penalty \nto establish a moratorium on executions with a view to abolishing it, \n__________________ \n \n1  Resolution 217 A (III). \n \n2  See resolution 2200 A (XXI), annex. \n \n3  United Nations, Treaty Series, vol. 1577, No. 27531. \n \n4  Ibid., vol. 1642, No. 14668. \n\nA/RES/75/183 \nMoratorium on the use of the death penalty\n \n20-17326\n2/4 \n \n \nRecalling further all relevant decisions and resolutions of the Human Rights \nCouncil, the most recent of which was resolution 42/24 of 27 September 2019,5 \n \nMindful that any miscarriage or failure of justice in the implementation of the \ndeath penalty is irreversible and irreparable, \n \nConvinced that a moratorium on the use of the death penalty contributes to \nrespect for human dignity and to the enhancement and progressive development of \nhuman rights, and considering that there is no conclusive evidence of the deterrent \nvalue of the death penalty, \n \nNoting ongoing local and national debates and regional initiatives on the death \npenalty, as well as the readiness of an increasing number of Member States to make \navailable to the public information on the use of the death penalty, and also, in this \nregard, the decision by the Human Rights Council in its resolution 26/2 of 26 June \n20146 to convene biennial high-level panel discussions in order to further exchange \nviews on the question of the death penalty,  \n \nRecognizing the role of national human rights institutions and civil society in \ncontributing to ongoing local and national debates and regional initiatives on the \ndeath penalty,  \n \nWelcoming the considerable movement towards the abolition of the death penalty \nglobally and the fact that many States are applying a moratorium, including long-\nstanding moratoriums, either in law or in practice, on the use of the death penalty, \n \nNoting the reductions in reported executions as well as the increase in \ncommutations of death sentences, \n \nEmphasizing the need to ensure that persons facing the death penalty have \naccess to justice without discrimination of any kind, including access to legal counsel, \nthat they are treated with humanity and with respect for their inherent dignity and in \ncompliance with their rights under international human rights law, and to improve \nconditions in prisons in accordance with international standards, such as the United \nNations Standard Minimum Rules for the Treatment of Prisoners (the Nelson Mandela \nRules),7 \n \nNoting with deep concern that, as shown in recent reports of the \nSecretary-General, frequently, poor and economically vulnerable persons, foreign \nnationals, persons exercising their human rights and persons belonging to religious or \nethnic minorities are disproportionately represented among those sentenced to the \ndeath penalty and the discriminatory application of the death penalty, to women, 8 \n \nNoting the technical cooperation among Member States, as well as the role of \nrelevant United Nations entities and human rights mechanisms, in supporting State \nefforts to establish moratoriums on the death penalty, \n \nBearing in mind the work of the treaty bodies and special procedure mandate \nholders that have addressed human rights issues related to the death penalty within \nthe framework of their respective mandates, \n \n1. \nReaffirms the sovereign right of all countries to develop their own legal \nsystems, including determining appropriate legal penalties, in accordance with their \ninternational law obligations; \n__________________ \n \n5  See Official Records of the General Assembly, Seventy-fourth Session, Supplement No. 53A \n(A/74/53/Add.1), chap. III. \n \n6  Ibid., Sixty-ninth Session, Supplement No. 53 (A/69/53), chap. V, sect. A. \n \n7  General Assembly resolution 70/175, annex. \n \n8  See, inter alia, A/73/260 and A/75/309. \n\nMoratorium on the use of the death penalty \nA/RES/75/183\n \n3/4\n20-17326 \n \n \n2. \nExpresses its deep concern about the continued application of the death \npenalty; \n \n3. \nWelcomes the report of the Secretary-General on the implementation of \nresolution 73/175 and the recommendations contained therein;9 \n \n4. \nAlso welcomes the steps taken by some States to reduce the number of \noffences for which the death penalty may be imposed, as well as steps taken to limit \nits application, including by commuting death sentences;  \n \n5. \nFurther welcomes initiatives and political leadership encouraging national \ndiscussions and debates on the possibility of moving away from capital punishment \nthrough domestic decision-making;  \n \n6. \nWelcomes the decisions made by an increasing number of States from all \nregions, at all levels of government, to apply a moratorium on executions, followed \nin many cases by the abolition of the death penalty;  \n \n7. \nCalls upon all States: \n \n(a) \nTo respect international standards that provide safeguards guaranteeing \nprotection of the rights of those facing the death penalty, in particular the minimum \nstandards, as set out in the annex to Economic and Social Council resolution 1984/50 \nof 25 May 1984, as well as to provide the Secretary-General with information in this \nregard; \n \n(b) \nTo comply with their obligations under article 36 of the 1963 Vienna \nConvention on Consular Relations,10 particularly the right to receive information on \nconsular assistance; \n \n(c) \nTo make available relevant information, disaggregated by sex, age, \nnationality and race, as applicable, and other applicable criteria, with regard to their \nuse of the death penalty, inter alia, the number of persons sentenced to death, the \nnumber of persons on death row and the number of executions carried out, the number \nof death sentences reversed or commuted on appeal or in which amnesty or pardon \nhas been granted, as well as information on any scheduled execution, which can \ncontribute to possible informed and transparent national and international debates, \nincluding on the obligations of States pertaining to the use of the death penalty; \n \n(d) \nTo progressively restrict the use of the death penalty and not to impose \ncapital punishment for offences committed by persons below 18 years of age or whose \nage above 18 years at the time of the commission of the crime cannot be accurately \ndetermined, on pregnant women or on persons with mental or intellectual disabilities; \n \n(e) \nTo reduce the number of offences for which the death penalty may be \nimposed, including by considering removing the mandatory application of the death \npenalty; \n \n(f) \nTo ensure that those facing the death penalty can exercise their right to \napply for pardon or commutation of their death sentence by ensuring that clemency \nprocedures are fair and transparent and that prompt information is provided at all \nstages of the process; \n \n(g) \nTo ensure that children whose parents or parental caregivers are on death \nrow, the inmates themselves, their families and their legal representatives are \nprovided, in advance, with adequate information about a pending execution, its date, \ntime and location, to allow a last visit or communication with the convicted person, \n__________________ \n \n9  A/75/309. \n \n10  United Nations, Treaty Series, vol. 596, No. 8638. \n\nA/RES/75/183 \nMoratorium on the use of the death penalty\n \n20-17326\n4/4 \n \nthe return of the body to the family for burial or to inform on where the body is \nlocated, unless this is not in the best interests of the child; \n \n(h) \nTo ensure that the death penalty is not applied on the basis of \ndiscriminatory laws or as a result of discriminatory or arbitrary application of the law; \n \n(i) \nTo establish a moratorium on executions with a view to abolishing the \ndeath penalty; \n \n8. \nCalls upon States which have abolished the death penalty not to \nreintroduce it, and encourages them to share their experience in this regard; \n \n9. \nEncourages States which have a moratorium to maintain it and to share \ntheir experience in this regard; \n \n10. Calls upon States that have not yet done so to consider acceding to or \nratifying the Second Optional Protocol to the International Covenant on Civil and \nPolitical Rights, aiming at the abolition of the death penalty; \n \n11. \nRequests the Secretary-General to report to the General Assembly at its \nseventy-seventh session on the implementation of the present resolution; \n \n12. Decides to continue consideration of the matter at its seventy-seventh \nsession under the item entitled \u201cPromotion and protection of human rights\u201d. \n \n46th plenary meeting \n16 December 2020 \n \n \n",
  "paragraphs": {
    "1": "Reaffirms the sovereign right of all countries to develop their own legal systems, including determining appropriate legal penalties, in accordance with their international law obligations; __________________ 5 See Official Records of the General Assembly, Seventy-fourth Session, Supplement No. 53A (A/74/53/Add.1), chap. III. 6 Ibid., Sixty-ninth Session, Supplement No. 53 (A/69/53), chap. V, sect. A. 7 General Assembly resolution 70/175, annex. 8 See, inter alia, A/73/260 and A/75/309. Moratorium on the use of the death penalty A/RES/75/183 3/4 20-17326",
    "2": "Expresses its deep concern about the continued application of the death penalty;",
    "3": "Welcomes the report of the Secretary-General on the implementation of resolution 73/175 and the recommendations contained therein;9",
    "4": "Also welcomes the steps taken by some States to reduce the number of offences for which the death penalty may be imposed, as well as steps taken to limit its application, including by commuting death sentences;",
    "5": "Further welcomes initiatives and political leadership encouraging national discussions and debates on the possibility of moving away from capital punishment through domestic decision-making;",
    "6": "Welcomes the decisions made by an increasing number of States from all regions, at all levels of government, to apply a moratorium on executions, followed in many cases by the abolition of the death penalty;",
    "7": "Calls upon all States: (a) To respect international standards that provide safeguards guaranteeing protection of the rights of those facing the death penalty, in particular the minimum standards, as set out in the annex to Economic and Social Council resolution 1984/50 of 25 May 1984, as well as to provide the Secretary-General with information in this regard; (b) To comply with their obligations under article 36 of the 1963 Vienna Convention on Consular Relations,10 particularly the right to receive information on consular assistance; (c) To make available relevant information, disaggregated by sex, age, nationality and race, as applicable, and other applicable criteria, with regard to their use of the death penalty, inter alia, the number of persons sentenced to death, the number of persons on death row and the number of executions carried out, the number of death sentences reversed or commuted on appeal or in which amnesty or pardon has been granted, as well as information on any scheduled execution, which can contribute to possible informed and transparent national and international debates, including on the obligations of States pertaining to the use of the death penalty; (d) To progressively restrict the use of the death penalty and not to impose capital punishment for offences committed by persons below 18 years of age or whose age above 18 years at the time of the commission of the crime cannot be accurately determined, on pregnant women or on persons with mental or intellectual disabilities; (e) To reduce the number of offences for which the death penalty may be imposed, including by considering removing the mandatory application of the death penalty; (f) To ensure that those facing the death penalty can exercise their right to apply for pardon or commutation of their death sentence by ensuring that clemency procedures are fair and transparent and that prompt information is provided at all stages of the process; (g) To ensure that children whose parents or parental caregivers are on death row, the inmates themselves, their families and their legal representatives are provided, in advance, with adequate information about a pending execution, its date, time and location, to allow a last visit or communication with the convicted person, __________________ 9 A/75/309. 10 United Nations, Treaty Series, vol. 596, No. 8638. A/RES/75/183 Moratorium on the use of the death penalty 20-17326 4/4 the return of the body to the family for burial or to inform on where the body is located, unless this is not in the best interests of the child; (h) To ensure that the death penalty is not applied on the basis of discriminatory laws or as a result of discriminatory or arbitrary application of the law; (i) To establish a moratorium on executions with a view to abolishing the death penalty;",
    "8": "Calls upon States which have abolished the death penalty not to reintroduce it, and encourages them to share their experience in this regard;",
    "9": "Encourages States which have a moratorium to maintain it and to share their experience in this regard;",
    "10": "Calls upon States that have not yet done so to consider acceding to or ratifying the Second Optional Protocol to the International Covenant on Civil and Political Rights, aiming at the abolition of the death penalty;",
    "11": "Requests the Secretary-General to report to the General Assembly at its seventy-seventh session on the implementation of the present resolution;",
    "12": "Decides to continue consideration of the matter at its seventy-seventh session under the item entitled \u201cPromotion and protection of human rights\u201d. 46th plenary meeting 16 December 2020"
  },
  "agenda_items": [
    "Item 72"
  ],
  "symbol_references": []
}