{
  "symbol": "A/RES/76/57",
  "filename": "A_RES_76_57.pdf",
  "title": "76/57. United Nations Regional Centre for Peace and Disarmament in Africa",
  "text": "United Nations \nA/RES/76/57\n \n \nGeneral Assembly \nDistr.: General \n13 December 2021 \n \n21-18504 (E)    161221     \n*2118504* \n \n \nSeventy-sixth session \nAgenda item 101 (b) \nReview and implementation of the Concluding Document \nof the Twelfth Special Session of the General Assembly: \nUnited Nations Regional Centre for Peace and \nDisarmament in Africa \n \n \n \n \n Resolution adopted by the General Assembly \non 6 December 2021 \n \n \n \n \n[on the report of the First Committee (A/76/445, para. 17)] \n \n \n \n76/57. United Nations Regional Centre for Peace and Disarmament \nin Africa \n \n \n \nThe General Assembly, \n \nMindful of the provisions of Article 11, paragraph 1, of the Charter of the United \nNations, in which it is stipulated that a function of the General Assembly is to consider \nthe general principles of cooperation in the maintenance of international peace and \nsecurity, including the principles governing disarmament and arms limitation, \n \nRecalling its resolutions 40/151 G of 16 December 1985, 41/60 D of 3 December \n1986, 42/39 J of 30 November 1987 and 43/76 D of 7 December 1988 on the United \nNations Regional Centre for Peace and Disarmament in Africa and its resolutions \n46/36 F of 6 December 1991 and 47/52 G of 9 December 1992 on regional \ndisarmament, including confidence-building measures, \n \nRecalling also its subsequent resolutions on the Regional Centre, the most \nrecent of which is resolution 75/76 of 7 December 2020, \n \nRecalling further its resolution 73/46 of 5 December 2018, in which it \nrecognized the role of women in disarmament, non-proliferation and arms control, \n \nReaffirming the role of the Regional Centre in promoting disarmament, peace \nand security at the regional level, \n \nWelcoming the continuing and deepening cooperation between the Regional \nCentre, the African Union and African subregional organizations in the context of the \nadoption of Agenda 2063 by the Assembly of Heads of State and Government of the \nAfrican Union, and in particular the objective of silencing the guns in Africa, \n\nA/RES/76/57 \nUnited Nations Regional Centre for Peace and Disarmament \nin Africa\n \n21-18504\n2/3 \n \n \nWelcoming also the work of the Regional Centre in support of the achievement \nof the Sustainable Development Goals,1 in particular Goal 16 on peace, justice and \nstrong institutions, and target 16.4, which addresses the reduction of illicit arms flows, \n \nRecalling the decision taken by the Executive Council of the African Union at \nits eighth ordinary session, held in Khartoum from 16 to 21 January 2006, 2 in which \nthe Council called upon member States to make voluntary contributions to the \nRegional Centre to maintain its operations, \n \nRecalling also the call by the Secretary-General for continued financial and \nin-kind support from Member States, which would enable the Regional Centre to \ndischarge its mandate in full and to respond more effectively to requests for assistance \nfrom African States, \n \n1. \nTakes note of the report of the Secretary-General;3  \n \n2. \nCommends the United Nations Regional Centre for Peace and \nDisarmament in Africa for its sustained support to Member States in implementing \ndisarmament, arms control and non-proliferation activities through seminars and \nconferences, capacity-building and training, policy and technical expertise, and \ninformation and advocacy at the regional and national levels; \n \n3. \nWelcomes the continental dimension of the activities of the Regional \nCentre in response to the evolving needs of African Member States and the region\u2019s \nnew and emerging challenges in the areas of disarmament, peace and security, \nincluding maritime security; \n \n4. \nRecalls the undertaking by the Regional Centre to deepen its partnership \nwith the African Union Commission in the context of the Joint United Nations-\nAfrican Union Framework for Enhanced Partnership in Peace and Security, signed on \n19 April 2017, as well as with African subregional organizations, and requests the \nSecretary-General to continue to facilitate close cooperation between the Regional \nCentre and the African Union, in particular in the areas of disarmament, peace and \nsecurity; \n \n5. \nWelcomes the contribution of the Regional Centre to continental \ndisarmament, peace and security, in particular its contribution to the implementation \nof Agenda 2063 adopted by the Assembly of Heads of State and Government of the \nAfrican Union, the objective of silencing the guns in Africa and its master road map \nof practical steps to silence the guns in Africa, as well as its assistance to the African \nCommission on Nuclear Energy in its implementation of the African Nuclear-\nWeapon-Free Zone Treaty (Treaty of Pelindaba);4  \n \n6. \nAlso welcomes efforts by the Regional Centre to promote the role and \nrepresentation of women in disarmament, non-proliferation and arms control \nactivities; \n \n7. \nCalls upon Member States and other bilateral and multilateral stakeholders \nto further enable the Regional Centre to provide adequate assistance to African \nMember States on arms control and disarmament from a human security perspective, \nnotably in the following areas of arms control: prevention of violent extremism, youth \nand peace and security, and women and peace and security; \n \n8. \nNotes with appreciation the tangible achievements of the Regional Centre \nand the impact of the assistance that it provides to African States to control small \n__________________ \n \n1  See resolution 70/1. \n \n2  A/60/693, annex II, decision EX.CL/Dec.263 (VIII). \n \n3  A/76/96. \n \n4  A/50/426, annex. \n\nUnited Nations Regional Centre for Peace and Disarmament \nin Africa \nA/RES/76/57\n \n3/3\n21-18504 \n \narms and light weapons through capacity-building for national commissions on small \narms and light weapons, defence and security forces, and United Nations \npeacekeeping mission personnel, as well as the support that the Centre provided to \nStates in preventing the diversion of such weapons, in particular to non-State armed \ngroups and terrorist groups,5 and also notes with appreciation the assistance provided \nby the Centre in the implementation of the Central African Convention for the Control \nof Small Arms and Light Weapons, Their Ammunition and All Parts and Components \nThat Can Be Used for Their Manufacture, Repair and Assembly (Kinshasa \nConvention),6 which entered into force on 8 March 2017, and its substantive support \nto the United Nations Standing Advisory Committee on Security Questions in Central \nAfrica, in the implementation of the Economic Community of West African States \nConvention on Small Arms and Light Weapons, Their Ammunition and Other Related \nMaterials and on security sector reform initiatives, and to East Africa on programmes \nto control brokering of small arms and light weapons, including the additional \nassistance provided by the Centre to African Member States in the implementation of \nSecurity Council resolution 1540 (2004) of 28 April 2004;  \n \n9. \nCommends the Regional Centre for the support and assistance that it \nprovided to African States, upon request, on the Arms Trade Treaty, 7 including \nthrough the organization of subregional and regional seminars and workshops; \n \n10. Urges \nall \nStates, \nas \nwell \nas \ninternational, \ngovernmental \nand \nnon-governmental organizations and foundations, to make voluntary contributions to \nenable the Regional Centre to carry out its programmes and activities and meet the \nneeds of African States; \n \n11. \nUrges, in particular, States members of the African Union to make \nvoluntary contributions to the trust fund for the United Nations Regional Centre for \nPeace and Disarmament in Africa, in conformity with the decision taken by the \nExecutive Council of the African Union in Khartoum in January 2006; \n \n12. Requests the Secretary-General to continue to provide the Regional Centre \nwith the support necessary for greater achievements and results; \n \n13. Also requests the Secretary-General to report to the General Assembly at \nits seventy-seventh session on the implementation of the present resolution; \n \n14. Decides to include in the provisional agenda of its seventy-seventh \nsession, under the item entitled \u201cReview and implementation of the Concluding \nDocument of the Twelfth Special Session of the General Assembly\u201d, the sub-item \nentitled \u201cUnited Nations Regional Centre for Peace and Disarmament in Africa\u201d. \n \n45th plenary meeting \n6 December 2021 \n \n__________________ \n \n5  Security Council resolution 2370 (2017). \n \n6  See A/65/517-S/2010/534, annex. \n \n7  United Nations, Treaty Series, vol. 3013, No. 52373. \n",
  "paragraphs": {
    "1": "Takes note of the report of the Secretary-General;3",
    "2": "Commends the United Nations Regional Centre for Peace and Disarmament in Africa for its sustained support to Member States in implementing disarmament, arms control and non-proliferation activities through seminars and conferences, capacity-building and training, policy and technical expertise, and information and advocacy at the regional and national levels;",
    "3": "Welcomes the continental dimension of the activities of the Regional Centre in response to the evolving needs of African Member States and the region\u2019s new and emerging challenges in the areas of disarmament, peace and security, including maritime security;",
    "4": "Recalls the undertaking by the Regional Centre to deepen its partnership with the African Union Commission in the context of the Joint United Nations- African Union Framework for Enhanced Partnership in Peace and Security, signed on 19 April 2017, as well as with African subregional organizations, and requests the Secretary-General to continue to facilitate close cooperation between the Regional Centre and the African Union, in particular in the areas of disarmament, peace and security;",
    "5": "Welcomes the contribution of the Regional Centre to continental disarmament, peace and security, in particular its contribution to the implementation of Agenda 2063 adopted by the Assembly of Heads of State and Government of the African Union, the objective of silencing the guns in Africa and its master road map of practical steps to silence the guns in Africa, as well as its assistance to the African Commission on Nuclear Energy in its implementation of the African Nuclear- Weapon-Free Zone Treaty (Treaty of Pelindaba);4",
    "6": "Also welcomes efforts by the Regional Centre to promote the role and representation of women in disarmament, non-proliferation and arms control activities;",
    "7": "Calls upon Member States and other bilateral and multilateral stakeholders to further enable the Regional Centre to provide adequate assistance to African Member States on arms control and disarmament from a human security perspective, notably in the following areas of arms control: prevention of violent extremism, youth and peace and security, and women and peace and security;",
    "8": "Notes with appreciation the tangible achievements of the Regional Centre and the impact of the assistance that it provides to African States to control small arms and light weapons through capacity-building for national commissions on small arms and light weapons, defence and security forces, and United Nations peacekeeping mission personnel, as well as the support that the Centre provided to States in preventing the diversion of such weapons, in particular to non-State armed groups and terrorist groups,5 and also notes with appreciation the assistance provided by the Centre in the implementation of the Central African Convention for the Control of Small Arms and Light Weapons, Their Ammunition and All Parts and Components That Can Be Used for Their Manufacture, Repair and Assembly (Kinshasa Convention),6 which entered into force on 8 March 2017, and its substantive support to the United Nations Standing Advisory Committee on Security Questions in Central Africa, in the implementation of the Economic Community of West African States Convention on Small Arms and Light Weapons, Their Ammunition and Other Related Materials and on security sector reform initiatives, and to East Africa on programmes to control brokering of small arms and light weapons, including the additional assistance provided by the Centre to African Member States in the implementation of Security Council resolution 1540 (2004) of 28 April 2004;",
    "9": "Commends the Regional Centre for the support and assistance that it provided to African States, upon request, on the Arms Trade Treaty, 7 including through the organization of subregional and regional seminars and workshops;",
    "10": "Urges all States, as well as international, governmental and non-governmental organizations and foundations, to make voluntary contributions to enable the Regional Centre to carry out its programmes and activities and meet the needs of African States;",
    "11": "Urges, in particular, States members of the African Union to make voluntary contributions to the trust fund for the United Nations Regional Centre for Peace and Disarmament in Africa, in conformity with the decision taken by the Executive Council of the African Union in Khartoum in January 2006;",
    "12": "Requests the Secretary-General to continue to provide the Regional Centre with the support necessary for greater achievements and results;",
    "13": "Also requests the Secretary-General to report to the General Assembly at its seventy-seventh session on the implementation of the present resolution;",
    "14": "Decides to include in the provisional agenda of its seventy-seventh session, under the item entitled \u201cReview and implementation of the Concluding Document of the Twelfth Special Session of the General Assembly\u201d, the sub-item entitled \u201cUnited Nations Regional Centre for Peace and Disarmament in Africa\u201d."
  },
  "agenda_items": [
    "Item 101"
  ],
  "symbol_references": []
}