{
  "symbol": "A/RES/72/27",
  "filename": "A_RES_72_27.pdf",
  "title": "72/27. No first placement of weapons in outer space",
  "text": "United Nations \nA/RES/72/27\n \n \nGeneral Assembly \nDistr.: General \n11 December 2017 \n \n17-21700 (E)    131217 \n*1721700* \n \n \nSeventy-second session \nAgenda item 97 (b) \n \n \n \n \n Resolution adopted by the General Assembly \non 4 December 2017 \n \n \n \n \n[on the report of the First Committee (A/72/407)] \n \n \n \n72/27. No first placement of weapons in outer space \n \n \n \nThe General Assembly, \n \nRecognizing the common interest of all humankind in the exploration and use \nof outer space for peaceful purposes, \n \nSeriously concerned about the possibility of an arms race in outer space and of \nouter space turning into an arena for military confrontation, and bearing in mind the \nimportance of articles III and IV of the Treaty on Principles Governing the \nActivities of States in the Exploration and Use of Outer Space, including the Moon \nand Other Celestial Bodies,1 \n \nConscious that the prevention of an arms race in outer space would avert a \ngrave danger to international peace and security, \n \nReaffirming that practical measures should be examined and taken in the \nsearch for agreements to prevent an arms race in outer space in a common effort \ntowards a community of shared future for humankind, \n \nEmphasizing the paramount importance of strict compliance with the existing \nlegal regime providing for the peaceful use of outer space, \n \nReaffirming its recognition that the legal regime applicable to outer space by \nitself does not guarantee prevention of an arms race in outer space and that there is a \nneed to consolidate and reinforce that regime, \n \nWelcoming, in this regard, the draft treaty on the prevention of the placement \nof weapons in outer space and of the threat or use of force against outer space \nobjects, introduced by China and the Russian Federation at the Conference on \nDisarmament in 2008,2 and the submission of its updated version in 2014,3 \n__________________ \n \n1 United Nations, Treaty Series, vol. 610, No. 8843. \n \n2 See CD/1839. \n \n3 See CD/1985. \n\nA/RES/72/27 \nNo first placement of weapons in outer space\n \n17-21700 \n2/2 \n \n \nConsidering that transparency and confidence-building measures in outer \nspace activities are an integral part of the draft treaty referred to above, \n \nRecalling its resolutions 69/32 of 2 December 2014, 70/27 of 7 December \n2015 and 71/32 of 5 December 2016, and its resolutions 45/55 B of 4 December \n1990 and 48/74 B of 16 December 1993, which, inter alia, confirm the importance \nof transparency and confidence-building measures as a means conducive to ensuring \nthe attainment of the objective of the prevention of an arms race in outer space, \n \nNoting the importance of the political statements made by a number of States 4 \nthat they would not be the first to place weapons in outer space, \n \n1. \nReaffirms the importance and urgency of the objective to prevent an arms \nrace in outer space and the willingness of States to contribute to reaching this \ncommon goal; \n \n2. \nReiterates that the Conference on Disarmament, as the single multilateral \nnegotiating forum on this subject,5 has the primary role in the negotiation of a \nmultilateral agreement, or agreements, as appropriate, on the prevention of an arms \nrace in outer space in all its aspects; \n \n3. \nUrges an early commencement of substantive work based on the updated \ndraft treaty on the prevention of the placement of weapons in outer space and of the \nthreat or use of force against outer space objects,3 introduced by China and the \nRussian Federation at the Conference on Disarmament in 2008, 2 under the agenda \nitem entitled \u201cPrevention of an arms race in outer space\u201d; \n \n4. \nStresses that, while such an agreement is not yet concluded, other \nmeasures may contribute to ensuring that weapons are not placed in outer space; \n \n5. \nEncourages all States, especially space-faring nations, to consider the \npossibility of upholding, as appropriate, a political commitment not to be the first to \nplace weapons in outer space; \n \n6. \nDecides to include in the provisional agenda of its seventy-third session \nthe item entitled \u201cNo first placement of weapons in outer space\u201d. \n \n62nd plenary meeting  \n4 December 2017 \n \n__________________ \n \n4 Argentina, Armenia, Belarus, Bolivia (Plurinational State of), Brazil, Cuba, Ecuador, Indonesia, \nKazakhstan, Kyrgyzstan, Nicaragua, Russian Federation, Sri Lanka, Tajikistan, Uruguay, \nVenezuela (Bolivarian Republic of) and Viet Nam. \n \n5 See resolution S-10/2. \n",
  "paragraphs": {
    "1": "Reaffirms the importance and urgency of the objective to prevent an arms race in outer space and the willingness of States to contribute to reaching this common goal;",
    "2": "Reiterates that the Conference on Disarmament, as the single multilateral negotiating forum on this subject,5 has the primary role in the negotiation of a multilateral agreement, or agreements, as appropriate, on the prevention of an arms race in outer space in all its aspects;",
    "3": "Urges an early commencement of substantive work based on the updated draft treaty on the prevention of the placement of weapons in outer space and of the threat or use of force against outer space objects,3 introduced by China and the Russian Federation at the Conference on Disarmament in 2008, 2 under the agenda item entitled \u201cPrevention of an arms race in outer space\u201d;",
    "4": "Stresses that, while such an agreement is not yet concluded, other measures may contribute to ensuring that weapons are not placed in outer space;",
    "5": "Encourages all States, especially space-faring nations, to consider the possibility of upholding, as appropriate, a political commitment not to be the first to place weapons in outer space;",
    "6": "Decides to include in the provisional agenda of its seventy-third session the item entitled \u201cNo first placement of weapons in outer space\u201d. 62nd plenary meeting 4 December 2017 __________________ 4 Argentina, Armenia, Belarus, Bolivia (Plurinational State of), Brazil, Cuba, Ecuador, Indonesia, Kazakhstan, Kyrgyzstan, Nicaragua, Russian Federation, Sri Lanka, Tajikistan, Uruguay, Venezuela (Bolivarian Republic of) and Viet Nam. 5 See resolution S-10/2."
  },
  "agenda_items": [
    "Item 97"
  ],
  "symbol_references": []
}