{
  "symbol": "A/RES/73/249",
  "filename": "A_RES_73_249.pdf",
  "title": "73/249. South-South cooperation",
  "text": "United Nations \nA/RES/73/249*\n \n \nGeneral Assembly \nDistr.: General \n16 January 2019 \n \n18-22627* (E)    150319  \n*1822627* \n \n \nSeventy-third session \nAgenda item 25 (b) \n \n \n \n \n Resolution adopted by the General Assembly \non 20 December 2018 \n \n \n \n \n[on the report of the Second Committee (A/73/543/Add.2)] \n \n \n 73/249. South-South cooperation \n \n \n \nThe General Assembly, \n \nReaffirming its resolution 64/222 of 21 December 2009, in which it endorsed \nthe Nairobi outcome document of the High-level United Nations Conference on \nSouth-South Cooperation, \n \nReaffirming also its resolution 33/134 of 19 December 1978, in which it \nendorsed the Buenos Aires Plan of Action for Promoting and Implementing Technical \nCooperation among Developing Countries,1 \n \nRecalling its resolutions 57/270 B of 23 June 2003, 60/212 of 22 December \n2005, 62/209 of 19 December 2007, 63/233 of 19 December 2008, 64/1 of 6 October \n2009, 66/219 of 22 December 2011, 67/227 of 21 December 2012, 68/230 of \n20 December 2013, 69/239 of 19 December 2014, 70/222 of 22 December 2015, \n71/244 of 21 December 2016 and 72/237 of 20 December 2017, \n \nReaffirming its resolution 71/318 of 28 August 2017 on the modalities of the \nSecond High-level United Nations Conference on South-South Cooperation, \n \nReaffirming also its resolution 70/1 of 25 September 2015, entitled \n\u201cTransforming our world: the 2030 Agenda for Sustainable Development\u201d, in which \nit adopted a comprehensive, far-reaching and people-centred set of universal and \ntransformative Sustainable Development Goals and targets, its commitment to \nworking tirelessly for the full implementation of the Agenda by 2030, its recognition \nthat eradicating poverty in all its forms and dimensions, including extreme poverty, \nis the greatest global challenge and an indispensable requirement for sustainable \ndevelopment, its commitment to achieving sustainable development in its three \n__________________ \n* Reissued for technical reasons on 15 March 2019. \n \n1  Report of the United Nations Conference on Technical Cooperation among Developing \nCountries, Buenos Aires, 30 August\u201312 September 1978 (United Nations publication, Sales \nNo. E.78.II.A.11 and corrigendum), chap. I. \n\nA/RES/73/249 \nSouth-South cooperation\n \n18-22627\n2/3 \n \ndimensions \u2013 economic, social and environmental \u2013 in a balanced and integrated \nmanner, and to building upon the achievements of the Millennium Development \nGoals and seeking to address their unfinished business, \n \nReaffirming further its resolution 69/313 of 27 July 2015 on the Addis Ababa \nAction Agenda of the Third International Conference on Financing for Development, \nwhich is an integral part of the 2030 Agenda for Sustainable Development, supports \nand complements it, helps to contextualize its means of implementation targets with \nconcrete policies and actions and reaffirms the strong political commitment to address \nthe challenge of financing and creating an enabling environment at all levels for \nsustainable development in the spirit of global partnership and solidarity, \n \nRecalling the United Nations resolutions relevant to South-South cooperation \nand the outcomes of the major United Nations conferences and summits in the \neconomic, social and related fields, and acknowledging the Havana Programme of \nAction, adopted by the first South Summit, 2  the Marrakech Framework for the \nImplementation of South-South Cooperation3 and the Doha Plan of Action adopted at \nthe second South Summit,4 \n \nWelcoming the Paris Agreement, 5  and encouraging all its parties to fully \nimplement the Agreement, and parties to the United Nations Framework Convention \non Climate Change 6  that have not yet done so to deposit their instruments of \nratification, acceptance, approval or accession, where appropriate, as soon as \npossible, \n \nReaffirming its resolution 71/243 of 21 December 2016 on the quadrennial \ncomprehensive policy review of the operational activities for development of the \nUnited Nations system and the general guidelines and principles contained therein, \nand reaffirming also its resolution 72/279 of 31 May 2018 on the repositioning of the \nUnited Nations development system in the context of the quadrennial comprehensive \npolicy review of the operational activities for development of the United Nations \nsystem, \n \nReiterating the pledge that no one will be left behind, reaffirming the \nrecognition that the dignity of the human person is fundamental, and the wish to see \nthe Goals and targets met for all nations and peoples and for all segments of society, \nand recommitting to endeavour to reach the furthest behind first, \n \nRecommitting to ensuring that no country or person is left behind and to focusing \nour effort where the challenges are greatest, including by ensuring the inclusion and \nparticipation of those who are furthest behind, \n \n1. \nTakes note of the report of the Secretary-General on the state of South-\nSouth cooperation;7 \n \n2. \nAlso takes note of the Joint Inspection Unit report on South-South and \ntriangular cooperation in the United Nations system 8 and its progress report on the \nrecommendations contained therein;9 \n \n3. \nRecognizes the need to strengthen and further invigorate South-South and \ntriangular cooperation and welcomes the convening of the Second High-level United \n__________________ \n \n2  A/55/74, annex II. \n \n3  A/58/683, annex II. \n \n4  A/60/111, annex II. \n \n5  Adopted under the UNFCCC in FCCC/CP/2015/10/Add.1, decision 1/CP.21. \n \n6  United Nations, Treaty Series, vol. 1771, No. 30822. \n \n7  A/73/321. \n \n8  A/66/717. \n \n9  See A/73/311. \n\nSouth-South cooperation \nA/RES/73/249\n \n3/3\n18-22627 \n \nNations Conference on South-South Cooperation, to be held in Buenos Aires from \n20 to 22 March 2019; \n \n4. \nCalls upon the relevant organizations of the United Nations system, within \ntheir respective mandates and resources, to ensure that no one is left behind and no \ncountry is left behind in the implementation of the present resolution; \n \n5. \nDecides to include in the provisional agenda of its seventy-fourth session, \nunder the item entitled \u201cOperational activities for development\u201d, the sub-item entitled \n\u201cSouth-South cooperation for development\u201d, and requests the Secretary-General to \nsubmit to the General Assembly at its seventy-fourth session a comprehensive report \non the state of South-South cooperation. \n62nd plenary meeting  \n20 December 2018 \n \n",
  "paragraphs": {
    "1": "Takes note of the report of the Secretary-General on the state of South- South cooperation;7",
    "2": "Also takes note of the Joint Inspection Unit report on South-South and triangular cooperation in the United Nations system 8 and its progress report on the recommendations contained therein;9",
    "3": "Recognizes the need to strengthen and further invigorate South-South and triangular cooperation and welcomes the convening of the Second High-level United Nations Conference on South-South Cooperation, to be held in Buenos Aires from 20 to 22 March 2019;",
    "4": "Calls upon the relevant organizations of the United Nations system, within their respective mandates and resources, to ensure that no one is left behind and no country is left behind in the implementation of the present resolution;",
    "5": "Decides to include in the provisional agenda of its seventy-fourth session, under the item entitled \u201cOperational activities for development\u201d, the sub-item entitled \u201cSouth-South cooperation for development\u201d, and requests the Secretary-General to submit to the General Assembly at its seventy-fourth session a comprehensive report on the state of South-South cooperation."
  },
  "agenda_items": [
    "Item 25"
  ],
  "symbol_references": []
}