{
  "symbol": "A/RES/72/40",
  "filename": "A_RES_72_40.pdf",
  "title": "72/40. Assistance to States for curbing the illicit traffic in small arms and light weapons and collecting them",
  "text": "United Nations \nA/RES/72/40\n \n \nGeneral Assembly \nDistr.: General \n12 December 2017 \n \n17-21716 (E)    141217 \n*1721716* \n \n \nSeventy-second session \nAgenda item 99 (n) \n \n \n \n \n Resolution adopted by the General Assembly \non 4 December 2017 \n \n \n \n \n[on the report of the First Committee (A/72/409)] \n \n \n \n72/40. Assistance to States for curbing the illicit traffic in small arms \nand light weapons and collecting them \n \n \n \nThe General Assembly, \n \nRecalling its resolution 71/52 of 5 December 2016 on assistance to States for \ncurbing the illicit traffic in small arms and light weapons and collecting them, \n \nDeeply concerned by the magnitude of human casualty and suffering, \nespecially among children, caused by the illicit proliferation and use of small arms \nand light weapons, \n \nConcerned by the negative impact that the illicit proliferation and use of those \nweapons continue to have on the efforts of States in the Sahelo-Saharan subregion \nin the areas of poverty eradication, sustainable development and the maintenance of \npeace, security and stability, \n \nBearing in mind the Bamako Declaration on an African Common Position on \nthe Illicit Proliferation, Circulation and Trafficking of Small Arms and Light \nWeapons, adopted in Bamako on 1 December 2000,1  \n \nRecalling the report of the Secretary-General entitled \u201cIn larger freedom: \ntowards development, security and human rights for all\u201d, 2 in which he emphasized \nthat States must strive just as hard to eliminate the threat of small arms and light \nweapons as they do to eliminate the threat of weapons of mass destruction, \n \nRecalling also the International Instrument to Enable States to Identify and \nTrace, in a Timely and Reliable Manner, Illicit Small Arms and Light Weapons, \nadopted on 8 December 2005,3  \n__________________ \n \n1  A/CONF.192/PC/23, annex. \n \n2  A/59/2005. \n \n3  See decision 60/519 and A/60/88 and A/60/88/Corr.2, annex. \n\nA/RES/72/40 \nAssistance to States for curbing the illicit traffic in\nsmall arms and light weapons and collecting them\n \n17-21716 \n2/3 \n \n \nRecalling further the expression of support in the 2005 World Summit \nOutcome for the implementation of the Programme of Action to Prevent, Combat \nand Eradicate the Illicit Trade in Small Arms and Light Weapons in All Its Aspects, 4  \n \nRecalling the adoption, on 14 June 2006 in Abuja at the thirtieth ordinary \nsummit of the Economic Community of West African States, of the Convention on \nSmall Arms and Light Weapons, Their Ammunition and Other Related Materials, in \nreplacement of the moratorium on the importation, exportation and manufacture of \nsmall arms and light weapons in West Africa, \n \nRecalling also the entry into force of the Convention on 29 September 2009, \n \nRecalling further the decision taken by the Economic Community to establish \nthe Small Arms Unit, responsible for advocating appropriate policies and \ndeveloping and implementing programmes, as well as the establishment of the \nEconomic Community\u2019s Small Arms Control Programme, launched on 6 June 2006 \nin Bamako, in replacement of the Programme for Coordination and Assistance for \nSecurity and Development, \n \nTaking note of the latest report of the Secretary-General on the illicit trade in \nsmall arms and light weapons in all its aspects and assistance to States for curbing \nthe illicit traffic in small arms and light weapons and collecting them, 5  \n \nRecalling, in that regard, the decision of the European Union to significantly \nsupport the Economic Community in its efforts to combat the illicit proliferation of \nsmall arms and light weapons, \n \nRecognizing the important role that civil society organizations play, by raising \npublic awareness, in efforts to curb the illicit traffic in small arms and light \nweapons, \n \nRecalling the report of the Sixth Biennial Meeting of States to Consider the \nImplementation of the Programme of Action to Prevent, Combat and Eradicate the \nIllicit Trade in Small Arms and Light Weapons in All Its Aspects, held in New York \nfrom 6 to 10 June 2016,6  \n \nWelcoming the inclusion of small arms and light weapons in the scope of the \nArms Trade Treaty,7 as well as the inclusion of international assistance in its \nprovisions, \n \n1. \nCommends the United Nations and international, regional and other \norganizations for their assistance to States for curbing the illicit traffic in small arms \nand light weapons and collecting them; \n \n2. \nEncourages the Secretary-General to pursue his efforts in the context of \nthe implementation of General Assembly resolution 49/75 G of 15 December 1994 \nand the recommendations of the United Nations advisory missions aimed at curbing \nthe illicit circulation of small arms and light weapons and collecting them in the \naffected States that so request, with the support of the United Nations Regional \nCentre for Peace and Disarmament in Africa and in close cooperation with the \nAfrican Union; \n \n3. \nEncourages the international community to support the implementation \nof the Economic Community of West African States Convention on Small Arms and \nLight Weapons, Their Ammunition and Other Related Materials; \n__________________ \n \n4  Resolution 60/1, para. 94. \n \n5  A/72/122. \n \n6  A/CONF.192/BMS/2016/2. \n \n7  See resolution 67/234 B. \n\nAssistance to States for curbing the illicit traffic in \nsmall arms and light weapons and collecting them \nA/RES/72/40\n \n3/3 \n17-21716 \n \n \n4. \nEncourages the countries of the Sahelo-Saharan subregion to facilitate \nthe effective functioning of national commissions to combat the illicit proliferation \nof small arms and light weapons, and in that regard invites the international \ncommunity to lend its support wherever possible; \n \n5. \nEncourages the collaboration of civil society organizations and \nassociations in the efforts of the national commissions to combat the illicit traffic in \nsmall arms and light weapons and in the implementation of the Programme of \nAction to Prevent, Combat and Eradicate the Illicit Trade in Small Arms and Light \nWeapons in All Its Aspects;8  \n \n6. \nEncourages cooperation among State organs, international organizations \nand civil society in support of programmes and projects aimed at combating the \nillicit traffic in small arms and light weapons and collecting them; \n \n7. \nCalls upon the international community to provide technical and \nfinancial support to strengthen the capacity of civil society organizations to take \naction to help to combat the illicit trade in small arms and light weapons; \n \n8. \nInvites the Secretary-General and those States and organizations that are \nin a position to do so to continue to provide assistance to States for curbing the \nillicit traffic in small arms and light weapons and collecting them; \n \n9. \nRequests the Secretary-General to continue to consider the matter and to \nreport to the General Assembly at its seventy-third session on the implementation of \nthe present resolution; \n \n10. Decides to include in the provisional agenda of its seventy-third session, \nunder the item entitled \u201cGeneral and complete disarmament\u201d, the sub-item entitled \n\u201cAssistance to States for curbing the illicit traffic in small arms and light weapons \nand collecting them\u201d. \n \n62nd plenary meeting  \n4 December 2017 \n \n__________________ \n \n8  Report of the United Nations Conference on the Illicit Trade in Small Arms and Light Weapons in \nAll Its Aspects, New York, 9\u201320 July 2001 (A/CONF.192/15), chap. IV, para. 24. \n",
  "paragraphs": {
    "1": "Commends the United Nations and international, regional and other organizations for their assistance to States for curbing the illicit traffic in small arms and light weapons and collecting them;",
    "2": "Encourages the Secretary-General to pursue his efforts in the context of the implementation of General Assembly resolution 49/75 G of 15 December 1994 and the recommendations of the United Nations advisory missions aimed at curbing the illicit circulation of small arms and light weapons and collecting them in the affected States that so request, with the support of the United Nations Regional Centre for Peace and Disarmament in Africa and in close cooperation with the African Union;",
    "3": "Encourages the international community to support the implementation of the Economic Community of West African States Convention on Small Arms and Light Weapons, Their Ammunition and Other Related Materials;",
    "4": "Encourages the countries of the Sahelo-Saharan subregion to facilitate the effective functioning of national commissions to combat the illicit proliferation of small arms and light weapons, and in that regard invites the international community to lend its support wherever possible;",
    "5": "Encourages the collaboration of civil society organizations and associations in the efforts of the national commissions to combat the illicit traffic in small arms and light weapons and in the implementation of the Programme of Action to Prevent, Combat and Eradicate the Illicit Trade in Small Arms and Light Weapons in All Its Aspects;8",
    "6": "Encourages cooperation among State organs, international organizations and civil society in support of programmes and projects aimed at combating the illicit traffic in small arms and light weapons and collecting them;",
    "7": "Calls upon the international community to provide technical and financial support to strengthen the capacity of civil society organizations to take action to help to combat the illicit trade in small arms and light weapons;",
    "8": "Invites the Secretary-General and those States and organizations that are in a position to do so to continue to provide assistance to States for curbing the illicit traffic in small arms and light weapons and collecting them;",
    "9": "Requests the Secretary-General to continue to consider the matter and to report to the General Assembly at its seventy-third session on the implementation of the present resolution;",
    "10": "Decides to include in the provisional agenda of its seventy-third session, under the item entitled \u201cGeneral and complete disarmament\u201d, the sub-item entitled \u201cAssistance to States for curbing the illicit traffic in small arms and light weapons and collecting them\u201d."
  },
  "agenda_items": [
    "Item 99"
  ],
  "symbol_references": []
}