{
  "symbol": "A/RES/73/287",
  "filename": "A_RES_73_287.pdf",
  "title": "73/287.  Joint Inspection Unit",
  "text": "United Nations \nA/RES/73/287\n \n \nGeneral Assembly \nDistr.: General \n17 April 2019 \n \n19-06368 (E)    220419     \n*1906368* \n \n \nSeventy-third session \nAgenda item 142 \n \n \n \n \n Resolution adopted by the General Assembly \non 15 April 2019 \n \n \n \n \n[on the report of the Fifth Committee (A/73/826)] \n \n \n 73/287.  Joint Inspection Unit \n \n \n \nThe General Assembly, \n \nRecalling its previous resolutions on the Joint Inspection Unit, in particular \nresolutions 31/192 of 22 December 1976, 50/233 of 7 June 1996, 54/16 of 29 October \n1999, 56/245 of 24 December 2001, 57/284 A and B of 20 December 2002, 58/286 of \n8 April 2004, 59/267 of 23 December 2004, 60/258 of 8 May 2006, 61/238 of \n22 December 2006, 61/260 of 4 April 2007, 62/226 of 22 December 2007, 62/246 \nof 3 April 2008, 63/272 of 7 April 2009, 64/262 of 29 March 2010, 65/270 of 4 April \n2011, 66/259 of 9 April 2012, 67/256 of 12 April 2013, 68/266 of 9 April 2014, \n69/275 of 2 April 2015, 70/257 of 1 April 2016, 71/281 of 6 April 2017 and 72/269 \nof 4 April 2018, \n \nReaffirming the statute of the Unit1 and the unique role of the Unit as the only \nexternal and independent system-wide inspection, evaluation and investigation body,  \n \nHaving considered the report of the Unit for 2018 and programme of work for \n20192 and the note by the Secretary-General on the report of the Unit for 2018,3  \n \n1. \nTakes note with appreciation of the report of the Joint Inspection Unit for \n2018 and programme of work for 2019;2  \n \n2. \nTakes note of the note by the Secretary-General on the report of the Unit \nfor 2018;3  \n \n3. \nStresses the importance of the oversight functions of the Unit in \nidentifying concrete managerial, administrative and programming questions within \nthe participating organizations and providing the General Assembly and other \nlegislative organs of participating organizations with practical and action-oriented \n__________________ \n \n1  Resolution 31/192, annex. \n \n2  Official Records of the General Assembly, Seventy-third Session, Supplement No. 34 (A/73/34). \n \n3  A/73/727. \n\nA/RES/73/287 \nJoint Inspection Unit\n \n19-06368\n2/3 \n \nrecommendations to improve and strengthen the governance of the United Nations as \na whole;  \n \n4. \nRecognizes that the effectiveness of the Unit system-wide is a shared \nresponsibility of the Unit, the Member States and the secretariats of the participating \norganizations;  \n \n5. \nAlso recognizes the need to continue to enhance the impact of the Unit on \nthe management efficiency and transparency of the participating organizations within \nthe United Nations system;  \n \n6. \nTakes note with appreciation of the preparation by the Unit of a medium- \nand long-term strategic framework for the period from 2020 to 2029, and encourages \nthe Unit to consult and engage with the participating organizations, as well as to apply \nlessons learned in developing its strategic framework for the period from 2020 to \n2029, while taking into account ongoing organizational reforms;  \n \n7. \nStresses the need for the Unit to continuously update and improve its \nmedium- and long-term strategic framework for the period from 2020 to 2029, taking \ninto account the dynamics and challenges of the environment in which it undertakes \nits activities, looks forward to the presentation by the Unit of the strategic framework, \nand decides to consider any resources associated with the implementation of the \nmedium- and long-term strategy approach in the context of future programme \nbudgets;  \n \n8. \nEncourages the Unit, within its medium- and long-term strategic \nframework for the period from 2020 to 2029, to continue to include single \norganizations for management and administrative reviews every year and to \nendeavour to complete those reviews within the programme of work of the Unit;  \n \n9. \nReiterates its request to the Unit to consider optimizing the number of \nprojects in its programme of work through prioritization;  \n \n10. Also reiterates its request to the Unit to continue to focus its reports on \npriority items of the participating organizations and the States Members of the United \nNations, including by taking into consideration the programme of work of the General \nAssembly, with the aim of providing the Assembly and other legislative organs of \nparticipating organizations with thematic reports of the Unit that can be used to \nmaximum effect;  \n \n11. \nWelcomes the coordination of the Unit with the Board of Auditors and the \nOffice of Internal Oversight Services of the Secretariat, and encourages those bodies \nto continue to share experiences, knowledge, best practices and lessons learned with \nother United Nations audit and oversight bodies, as well as with the Independent \nAudit Advisory Committee, with a view to avoiding overlap or duplication and \nachieving further synergy, cooperation, effectiveness and efficiency, without \nprejudice to the respective mandates of the audit and oversight bodies;  \n \n12. Reiterates its request to the executive heads of the participating \norganizations to comply fully with the statutory procedures for consideration of the \nreports of the Unit and, in particular, to submit their comments, including information \non what they intend to do regarding the recommendations of the Unit, to distribute \nreports in time for their consideration by legislative organs and to provide information \non the steps to be taken to implement those recommendations accepted by the \nlegislative organs and the executive heads of participating organizations;  \n \n13. Encourages the executive heads and invites the legislative bodies of \nparticipating organizations to effectively use the reports of the Unit and meaningfully \nengage and implement its recommendations, including through allocating sufficient \ntime for the presentation of reports of the Unit during governing body sessions;  \n\nJoint Inspection Unit \nA/RES/73/287\n \n3/3\n19-06368 \n \n \n14. Reiterates its request to the Secretary-General and the other executive \nheads of the participating organizations to fully assist the Unit with the timely \nprovision of all information requested by it;  \n \n15. Reaffirms article 20 of the statute of the Unit,1 in which it is stipulated that \nthe Unit shall be invited to be represented at meetings when its budget estimates are \nbeing discussed;  \n \n16. Requests the Secretary-General, as Chair of the United Nations System \nChief Executives Board for Coordination, to intensify efforts to ensure that the United \nNations system gives timely and due consideration to the recommendations of the \nUnit and to improve the implementation rates thereof;  \n \n17. Reiterates its invitation to the legislative organs of the participating \norganizations to fully consider, discuss and take concrete action in a timely manner \non the relevant recommendations issued by the Unit, including follow-up, as \nappropriate, taking into account the provisions of paragraph 4 of its resolution \n50/233; \n \n18. Welcomes the increased use of the web-based tracking system and the \nwebsite of the Unit within platforms hosted by the Secretariat, looks forward to the \nupdates being prepared for the system by the Office of Information and \nCommunications Technology of the Secretariat, and requests the heads of \nparticipating organizations to make full use of the web-based tracking system of the \nUnit;  \n \n19. Requests the Secretary-General to continue to provide full support for the \nimprovements in and enhancements to the functionality of the services for hosting \nand maintaining the web-based tracking system and the website of the Unit within \nexisting resources. \n \n75th plenary meeting  \n15 April 2019 \n \n",
  "paragraphs": {
    "1": "Takes note with appreciation of the report of the Joint Inspection Unit for 2018 and programme of work for 2019;2",
    "2": "Takes note of the note by the Secretary-General on the report of the Unit for 2018;3",
    "3": "Stresses the importance of the oversight functions of the Unit in identifying concrete managerial, administrative and programming questions within the participating organizations and providing the General Assembly and other legislative organs of participating organizations with practical and action-oriented __________________ 1 Resolution 31/192, annex. 2 Official Records of the General Assembly, Seventy-third Session, Supplement No. 34 (A/73/34). 3 A/73/727. A/RES/73/287 Joint Inspection Unit 19-06368 2/3 recommendations to improve and strengthen the governance of the United Nations as a whole;",
    "4": "Recognizes that the effectiveness of the Unit system-wide is a shared responsibility of the Unit, the Member States and the secretariats of the participating organizations;",
    "5": "Also recognizes the need to continue to enhance the impact of the Unit on the management efficiency and transparency of the participating organizations within the United Nations system;",
    "6": "Takes note with appreciation of the preparation by the Unit of a medium- and long-term strategic framework for the period from 2020 to 2029, and encourages the Unit to consult and engage with the participating organizations, as well as to apply lessons learned in developing its strategic framework for the period from 2020 to 2029, while taking into account ongoing organizational reforms;",
    "7": "Stresses the need for the Unit to continuously update and improve its medium- and long-term strategic framework for the period from 2020 to 2029, taking into account the dynamics and challenges of the environment in which it undertakes its activities, looks forward to the presentation by the Unit of the strategic framework, and decides to consider any resources associated with the implementation of the medium- and long-term strategy approach in the context of future programme budgets;",
    "8": "Encourages the Unit, within its medium- and long-term strategic framework for the period from 2020 to 2029, to continue to include single organizations for management and administrative reviews every year and to endeavour to complete those reviews within the programme of work of the Unit;",
    "9": "Reiterates its request to the Unit to consider optimizing the number of projects in its programme of work through prioritization;",
    "10": "Also reiterates its request to the Unit to continue to focus its reports on priority items of the participating organizations and the States Members of the United Nations, including by taking into consideration the programme of work of the General Assembly, with the aim of providing the Assembly and other legislative organs of participating organizations with thematic reports of the Unit that can be used to maximum effect;",
    "11": "Welcomes the coordination of the Unit with the Board of Auditors and the Office of Internal Oversight Services of the Secretariat, and encourages those bodies to continue to share experiences, knowledge, best practices and lessons learned with other United Nations audit and oversight bodies, as well as with the Independent Audit Advisory Committee, with a view to avoiding overlap or duplication and achieving further synergy, cooperation, effectiveness and efficiency, without prejudice to the respective mandates of the audit and oversight bodies;",
    "12": "Reiterates its request to the executive heads of the participating organizations to comply fully with the statutory procedures for consideration of the reports of the Unit and, in particular, to submit their comments, including information on what they intend to do regarding the recommendations of the Unit, to distribute reports in time for their consideration by legislative organs and to provide information on the steps to be taken to implement those recommendations accepted by the legislative organs and the executive heads of participating organizations;",
    "13": "Encourages the executive heads and invites the legislative bodies of participating organizations to effectively use the reports of the Unit and meaningfully engage and implement its recommendations, including through allocating sufficient time for the presentation of reports of the Unit during governing body sessions; Joint Inspection Unit A/RES/73/287 3/3 19-06368",
    "14": "Reiterates its request to the Secretary-General and the other executive heads of the participating organizations to fully assist the Unit with the timely provision of all information requested by it;",
    "15": "Reaffirms article 20 of the statute of the Unit,1 in which it is stipulated that the Unit shall be invited to be represented at meetings when its budget estimates are being discussed;",
    "16": "Requests the Secretary-General, as Chair of the United Nations System Chief Executives Board for Coordination, to intensify efforts to ensure that the United Nations system gives timely and due consideration to the recommendations of the Unit and to improve the implementation rates thereof;",
    "17": "Reiterates its invitation to the legislative organs of the participating organizations to fully consider, discuss and take concrete action in a timely manner on the relevant recommendations issued by the Unit, including follow-up, as appropriate, taking into account the provisions of paragraph 4 of its resolution 50/233;",
    "18": "Welcomes the increased use of the web-based tracking system and the website of the Unit within platforms hosted by the Secretariat, looks forward to the updates being prepared for the system by the Office of Information and Communications Technology of the Secretariat, and requests the heads of participating organizations to make full use of the web-based tracking system of the Unit;",
    "19": "Requests the Secretary-General to continue to provide full support for the improvements in and enhancements to the functionality of the services for hosting and maintaining the web-based tracking system and the website of the Unit within existing resources. 75th plenary meeting 15 April 2019"
  },
  "agenda_items": [
    "Item 142"
  ],
  "symbol_references": []
}