{
  "symbol": "A/RES/79/176",
  "filename": "A_RES_79_176.pdf",
  "title": "79/176. Extrajudicial, summary or arbitrary executions",
  "text": "United Nations \nA/RES/79/176\n \n \nGeneral Assembly \nDistr.: General \n19 December 2024 \n \n24-24217 (E)     \n*2424217* \n \n \nSeventy-ninth session \nAgenda item 71 (b) \nPromotion and protection of human rights: human rights \nquestions, including alternative approaches for improving \nthe effective enjoyment of human rights and \nfundamental freedoms \n \n \n \n \n Resolution adopted by the General Assembly \non 17 December 2024 \n \n \n \n \n[on the report of the Third Committee (A/79/458/Add.2, para. 99)] \n \n \n 79/176. Extrajudicial, summary or arbitrary executions \n \n \n \nThe General Assembly, \n \nRecalling the Universal Declaration of Human Rights,1 which guarantees the \nright to life, liberty and security of person, the relevant provisions of the International \nCovenant on Civil and Political Rights2 and other relevant human rights conventions, \n \nReaffirming the mandate of the Special Rapporteur on extrajudicial, summary \nor arbitrary executions, as set out in Human Rights Council resolution 53/4 of 12 July \n2023,3 \n \nWelcoming the universal ratification of the Geneva Conventions of 12 August \n1949, 4  which, alongside international human rights law, provide important legal \nframeworks of accountability in relation to extrajudicial, summary or arbitrary \nexecutions during armed conflict, \n \nRecalling all its resolutions on the subject of extrajudicial, summary or arbitrary \nexecutions as well as the resolutions of the Commission on Human Rights and the \nHuman Rights Council on the subject, and emphasizing the importance of their full \nand effective implementation, \n__________________ \n \n1 Resolution 217 A (III). \n \n2 See resolution 2200 A (XXI), annex. \n \n3 See Official Records of the General Assembly, Seventy-eighth Session, Supplement No. 53 \n(A/78/53), chap. VII, sect. A. \n \n4 United Nations, Treaty Series, vol. 75, Nos. 970\u2013973. \n\nA/RES/79/176 \nExtrajudicial, summary or arbitrary executions\n \n24-24217\n2/8 \n \n \nRecognizing the positive role that governments, regional human rights systems, \nnational human rights institutions, civil society and human rights defenders play in \nthe protection against arbitrary deprivation of life, \n \nAcknowledging the importance of the 2030 Agenda for Sustainable Development5 \nand its implementation for the promotion and protection of the enjoyment by all persons \nof human rights, gender equality and the empowerment of all women and girls, access \nto justice for all and democracy, including effective, accountable and inclusive \ninstitutions at all levels, \n \nRecognizing the work of the treaty bodies and special procedure mandate \nholders that have addressed human rights issues related to extrajudicial, summary or \narbitrary executions within the framework of their respective mandates, \n \nNoting with deep concern that impunity continues to be a major cause of the \nperpetuation of violations of human rights, including extrajudicial, summary or \narbitrary executions, especially with regard to the gender-related killing of women \nand girls, also known as femicide, \n \nRecalling the Principles on the Effective Prevention and Investigation of \nExtralegal, Arbitrary and Summary Executions 6  and the Revised United Nations \nManual on the Effective Prevention and Investigation of Extralegal, Arbitrary and \nSummary Executions,7  \n \nNoting the importance of prompt, effective, exhaustive, thorough, independent, \nimpartial and transparent investigations of all potentially unlawful deaths, including \ndetermining the identity of victims, and the importance of protecting bodies and human \nremains, ensuring their proper and dignified search, recovery, collection, \ndocumentation, preservation and traceability, in line with international standards and \nbest practices, \n \nNoting also that enforced disappearances can end in extrajudicial, summary or \narbitrary executions, recalling the importance in this regard of the International \nConvention for the Protection of All Persons from Enforced Disappearance, 8 and \ncalling upon all States which have not yet done so to consider signing and ratifying \nor acceding to the Convention, \n \nAcknowledging that international human rights law and international \nhumanitarian law are complementary and mutually reinforcing, \n \nNoting with alarm the growing number of civilians and persons hors de combat \nkilled in situations of armed conflict and internal strife and strongly condemning such \nkillings when they take place, and that women and girls and persons with disabilities \nare disproportionately affected by conflict, as recognized in Security Council \nresolution 1325 (2000) of 31 October 2000 on women and peace and security and \nSecurity Council resolution 2475 (2019) of 20 June 2019 on the protection of persons \nwith disabilities in conflict and other resolutions on the matter, \n \nNoting with deep concern the continuing instances of the arbitrary deprivation \nof life, resulting from, inter alia, the imposition and implementation of capital \npunishment when carried out in a manner that violates international law, \n__________________ \n \n5 Resolution 70/1. \n \n6 Economic and Social Council resolution 1989/65, annex. \n \n7 The Minnesota Protocol on the Investigation of Potentially Unlawful Death (2016): The Revised \nUnited Nations Manual on the Effective Prevention and Investigation of Extralegal, Arbitrary \nand Summary Executions (United Nations publication, Sales No. E.17.XIV.3).  \n \n8 United Nations, Treaty Series, vol. 2716, No. 48088. \n\nExtrajudicial, summary or arbitrary executions \nA/RES/79/176\n \n3/8\n24-24217 \n \n \nRecalling the United Nations Rules for the Treatment of Women Prisoners and \nNon-custodial Measures for Women Offenders (the Bangkok Rules)9 and the adoption \nof the United Nations Standard Minimum Rules for the Treatment of Prisoners (the \nNelson Mandela Rules),10 \n \nDeeply concerned about acts that can amount to extrajudicial, summary or \narbitrary executions committed against persons exercising their rights to peaceful \nassembly, freedom of religion or belief and freedom of expression and against human \nrights defenders in all regions of the world, \n \nDeeply concerned also about extrajudicial, summary or arbitrary killings, \nincluding killings of children, committed by non-State actors, including terrorist \ngroups and criminal organizations, which may amount to abuses of international \nhuman rights law and violations of international humanitarian law, \n \nAcknowledging that extrajudicial, summary or arbitrary executions may under \ncertain circumstances amount to genocide, crimes against humanity or war crimes, as \ndefined in international law, including in the Rome Statute of the International Criminal \nCourt,11 and recalling in this regard that each individual State has the responsibility to \nprotect its populations from such crimes, as set out by the General Assembly in its \nresolutions 60/1 of 16 September 2005 and 63/308 of 14 September 2009, \n \nUnderlining the need to ensure that the development and use of new technologies, \nincluding artificial intelligence, contribute to the promotion and protection of and \nrespect for human rights, including the right to life, and that their use does not result in \ndiscriminatory outcomes or constitute a violation of human rights, \n \nConvinced of the need for effective action to address the root causes of, prevent, \ncombat and eliminate the abhorrent practice of extrajudicial, summary or arbitrary \nexecutions, which represent flagrant violations of international human rights law, \nparticularly the right to life, as well as of international humanitarian law, as applicable, \n \n1. \nReiterates its strong condemnation of all the extrajudicial, summary or \narbitrary executions that continue to occur throughout the world; \n \n2. \nDemands that all States ensure that the practice of extrajudicial, summary \nor arbitrary executions is brought to an end and that they take effective action to \nprevent, combat and eliminate the phenomenon in all its forms and manifestations; \n \n3. \nReiterates that all States:  \n \n(a) \nMust conduct prompt, effective, exhaustive, thorough, independent, \nimpartial and transparent investigations, exercising due diligence, in line with \ninternational standards and forensic best practices, and in this regard takes note of the \nRevised United Nations Manual on the Effective Prevention and Investigation of \nExtralegal, Arbitrary and Summary Executions, with reference to as much forensic \nexpertise as necessary, into all suspected cases of extrajudicial, summary or arbitrary \nexecutions, identify and bring to justice those responsible, while ensuring the right of \nevery person to a fair hearing by a competent, independent and impartial tribunal \nestablished by law, grant adequate compensation within a reasonable time to the victims \nor their families and adopt all measures, including legal and judicial measures, as \nrecommended in the Principles on the Effective Prevention and Investigation of \nExtralegal, Arbitrary and Summary Executions, and fully consistent with their \nobligations under international law; \n__________________ \n \n9 Resolution 65/229, annex. \n \n10 Resolution 70/175, annex. \n \n11 United Nations, Treaty Series, vol. 2187, No. 38544. \n\nA/RES/79/176 \nExtrajudicial, summary or arbitrary executions\n \n24-24217\n4/8 \n \n \n(b) \nMust conduct such investigations bearing in mind the need for gender \nequality in access to justice, necessary to put an end to impunity, particularly with \nregard to the gender-related killing of women and girls, also known as femicide, in this \nregard takes note of the reports submitted to the Human Rights Council at its thirty-\nfifth session12 and the General Assembly at its seventy-eighth session13 regarding the \nneed for a gender-responsive approach to extrajudicial, summary or arbitrary killings, \nwhich point to the links between the arbitrary deprivation of life and systemic \ndiscrimination, such as gender-based and racial discrimination, and the greater rates \nof homicide perpetrated against Indigenous women and girls, and women and girls \nwith disabilities, and extrajudicial, summary or arbitrary executions of refugees and \nmigrants and humanitarian workers, and underlines the need for further measures in \norder to prevent the further occurrence of such executions; \n \n4. \nEncourages the Office of the United Nations High Commissioner for Human \nRights, in collaboration with relevant experts, particularly the Special Rapporteur on \nextrajudicial, summary or arbitrary executions, to initiate an expert-led process towards \nthe elaboration of an addendum to the Revised United Nations Manual on the Effective \nPrevention and Investigation of Extralegal, Arbitrary and Summary Executions, \nproviding specific guidance to all professionals with investigation responsibilities on \nproperly identifying, investigating, prosecuting and reliably documenting gender-related \nkillings of women and girls, also known as femicide, and to allocate adequate resources \nfor this purpose; \n \n5. \nCalls \nupon \nGovernments, \nand \ninvites \nintergovernmental \nand \nnon-governmental organizations, to actively support and pay greater attention to the \nwork of national-level commissions of inquiry into extrajudicial, summary or \narbitrary executions, with a view to ensuring the effective contribution of these \ncommissions to accountability and to combating impunity; \n \n6. \nCalls upon all States, in order to prevent extrajudicial, summary or \narbitrary executions, to comply with their obligations under the relevant provisions \nof international human rights instruments, and also calls upon States which retain the \ndeath penalty to pay particular regard to the provisions contained in articles 6, 14 and \n15 of the International Covenant on Civil and Political Rights, articles 37 and 40 of \nthe Convention on the Rights of the Child 14  and articles 12, 13 and 14 of the \nConvention on the Rights of Persons with Disabilities,15 bearing in mind the safeguards \nand guarantees set out in Economic and Social Council resolutions 1984/50 of 25 May \n1984 and 1989/64 of 24 May 1989 and taking into account the recommendations of \nthe Special Rapporteur on extrajudicial, summary or arbitrary executions in reports \nto the Human Rights Council and the General Assembly, including the report \nsubmitted to the Assembly at its sixty-seventh session,16 regarding the need to respect \nall safeguards and restrictions, including limitation to the most serious crimes, stringent \nrespect of due process and fair trial safeguards and the right to seek pardon or \ncommutation of sentence; \n \n7. \nEmphasizes that to prevent extrajudicial, summary or arbitrary executions, \nStates should take necessary steps to adopt such laws or other measures as may be \nnecessary to give effect to the right to life in accordance with international law and \nthat everyone has the right to recognition everywhere as a person before the law; \n__________________ \n \n12 A/HRC/35/23. \n \n13 A/78/254. \n \n14 United Nations, Treaty Series, vol. 1577, No. 27531. \n \n15 Ibid., vol. 2515, No. 44910. \n \n16 A/67/275. \n\nExtrajudicial, summary or arbitrary executions \nA/RES/79/176\n \n5/8\n24-24217 \n \n \n8. \nUrges all States: \n \n(a) \nTo take all measures required by international human rights law and \ninternational humanitarian law to prevent loss of life, in particular that of children, \nduring detention, arrest, public demonstrations, internal and communal violence, civil \nunrest, public emergencies or armed conflicts and to ensure that the police, law \nenforcement agents, armed forces and other agents acting on behalf of or with the \nconsent or acquiescence of the State, including private security providers, act with \nrestraint and in conformity with international human rights law and international \nhumanitarian law, including the principles of proportionality and necessity, and in this \nregard to ensure that police and law enforcement officials are guided by the Code of \nConduct for Law Enforcement Officials17 and the Basic Principles on the Use of Force \nand Firearms by Law Enforcement Officials;18 \n \n(b) \nTo ensure the effective protection of the right to life of all persons, to \nconduct, when required by obligations under international law, prompt, exhaustive \nand impartial investigations into all killings, including those targeted at specific \ngroups of persons, such as racially motivated violence leading to the death of the \nvictim, killings of persons belonging to national or ethnic, religious and linguistic \nminorities or because of their sexual orientation or gender identity, killings of persons \naffected by terrorism or hostage-taking or living under foreign occupation, killings of \nrefugees, internally displaced persons, migrants, street children or members of \nIndigenous communities, killings of persons for reasons related to their activities as \nhuman rights defenders, lawyers, journalists or demonstrators, killings committed in \nthe name of passion or in the name of honour and killings committed for \ndiscriminatory reasons on any basis, to bring those responsible to justice before a \ncompetent, independent and impartial judiciary at the national or, where appropriate, \ninternational level and to ensure that such killings, including those committed by \nsecurity forces, police and law enforcement agents, paramilitary groups or private \nforces, are neither condoned nor sanctioned by State officials or personnel; \n \n9. \nEncourages States, taking into account the relevant recommendations of \nthe United Nations and of regional human rights systems, to review, where necessary, \ntheir domestic laws and practices with regard to the use of force in law enforcement \nin order to ensure that these laws and practices are in conformity with their \ninternational obligations and commitments; \n \n10. Emphasizes that, to prevent extrajudicial, summary or arbitrary \nexecutions, States should take effective measures to ensure that the use of force by \nlaw enforcement officials is in conformity with international obligations and the \nprinciples of legality, precaution, necessity, proportionality and accountability, as \nwell as their national legislation; \n \n11. \nReaffirms that the same human rights that people have offline must also be \nprotected online, in order to help to prevent extrajudicial, summary or arbitrary \nexecutions;  \n \n12. Encourages States, in order to support the protection of the right to life, to \nmake appropriate protective equipment and less-lethal weapons available to their \nofficials exercising law enforcement duties, in order to decrease their need to use \nweapons of any kind, while pursuing efforts to regulate and establish protocols for \nthe training and use of less-lethal weapons and in this regard strengthening \n__________________ \n \n17 Resolution 34/169, annex. \n \n18 See Eighth United Nations Congress on the Prevention of Crime and the Treatment of Offenders, \nHavana, 27 August\u20137 September 1990: report prepared by the Secretariat (United Nations \npublication, Sales No. E.91.IV.2), chap. I, sect. B. \n\nA/RES/79/176 \nExtrajudicial, summary or arbitrary executions\n \n24-24217\n6/8 \n \ninternational cooperation, bearing in mind that even less-lethal weapons can result in \nrisk to life or serious injury; \n \n13. Also encourages States to accelerate the work on fulfilling the 2030 \nAgenda for Sustainable Development, bearing in mind the importance of the full \nenjoyment of human rights and access to justice for all and effective, accountable and \ninclusive institutions at all levels, as well as the systematic mainstreaming and \nintegration of a gender perspective; \n \n14. Urges all States to ensure that all persons deprived of their liberty are \ntreated humanely and with full respect for international law and that their treatment, \nincluding judicial guarantees and conditions, conforms to, as appropriate, the United \nNations Standard Minimum Rules for the Treatment of Prisoners (the Nelson Mandela \nRules), as well as the United Nations Rules for the Treatment of Women Prisoners \nand Non-custodial Measures for Women Offenders (the Bangkok Rules) and, where \napplicable, the Geneva Conventions of 12 August 1949 and the Additional Protocols \nthereto of 8 June 1977,19 as well as other pertinent international instruments; \n \n15. Affirms the obligation of States to protect the right to life of all persons, \nincluding those deprived of their liberty, in all circumstances, and to take appropriate \nmeasures to prevent unlawful deaths and to promptly, effectively and impartially \ninvestigate all deaths in custody, including in institutions, and to ensure that those \nresponsible for any unlawful death are brought to justice, and further calls upon States \nto reliably compile disaggregated, accurate and credible data on deaths in custody; \n \n16. Welcomes: \n \n(a) \nThe International Criminal Court as an important contribution to ending \nimpunity concerning extrajudicial, summary or arbitrary executions, and, noting the \ngrowing awareness of the Court worldwide, as highlighted during the twenty-fifth \nanniversary of the adoption of the Rome Statute of the Court, calls upon those States \nthat are under an obligation to cooperate with the Court to provide such cooperation \nand assistance in the future, in particular with regard to arrest and surrender, the \nprovision of evidence, the protection and relocation of victims and witnesses and the \nenforcement of sentences;  \n \n(b) \nThe fact that 125 States have ratified or acceded to and 31 States have signed, \nbut not yet ratified, the Rome Statute, and calls upon all those States that have not ratified \nor acceded to the Rome Statute and the Agreement on the Privileges and Immunities of \nthe International Criminal Court20 to give serious consideration to doing so; \n \n17. Acknowledges the importance of ensuring the protection of witnesses for \nthe prosecution of those suspected of extrajudicial, summary or arbitrary executions, \nurges States to intensify efforts to establish and implement effective witness \nprotection programmes or other measures, and in this regard encourages the Office of \nthe United Nations High Commissioner for Human Rights to develop practical tools, \nincluding gender-responsive tools, designed to encourage and facilitate greater \nattention to the protection of witnesses; \n \n18. Encourages Governments and intergovernmental and non-governmental \norganizations to organize training programmes and capacity-building and to support \nprojects with a view to training or educating military forces, law enforcement officers, \ngovernment officials and forensic specialists, as well as private personnel acting on \nbehalf of the State, in international humanitarian and human rights law connected \nwith their work, to include a gender, disability and child rights perspective, as well as \ninformation on the role of journalists and media workers, in such training and to require, \n__________________ \n \n19 United Nations, Treaty Series, vol. 1125, Nos. 17512 and 17513. \n \n20 Ibid., vol. 2271, No. 40446. \n\nExtrajudicial, summary or arbitrary executions \nA/RES/79/176\n \n7/8\n24-24217 \n \nwhere appropriate, that all private security providers have vetting and training \nprocedures in place, including mandatory appropriate weapons training, that include \nhuman rights norms and principles, and appeals to the international community and \nrequests the Office of the High Commissioner to support endeavours to that end; \n \n19. Urges States to promote and apply an approach that respects human rights \nobligations and is gender-responsive in the design, development and use of new \ntechnologies on the basis of a multi-stakeholder approach and to regulate new and \nexisting technologies in a manner that ensures that the development and use of such \ntechnologies promote, protect and respect human rights, including the right to life, \nand to make sure that new technologies are not discriminatory and they are not used \nto violate human rights; \n \n20. Strongly urges all States to take the necessary measures to ensure the \nsafety and security of national and international humanitarian personnel; \n \n21. Requests the Secretary-General to continue, in close collaboration with the \nHigh Commissioner and in conformity with the mandate of the High Commissioner, \nestablished by the General Assembly in its resolution 48/141 of 20 December 1993, \nto ensure that personnel specialized in international humanitarian and human rights \nlaw, including in provisions related to gender equality and the empowerment of all \nwomen and girls, form part of United Nations missions, where appropriate, in order \nto deal with serious violations of human rights, such as extrajudicial, summary or \narbitrary executions; \n \n22. Takes note with appreciation of the reports of the Special Rapporteur to \nthe General Assembly21 and the Human Rights Council, and invites States to take due \nconsideration of the recommendations contained therein; \n \n23. Commends the important role that the Special Rapporteur plays in the \nelimination and prevention of extrajudicial, summary or arbitrary executions, and \nencourages the Special Rapporteur to continue, within the mandate, to collect \ninformation, including data disaggregated by sex, age and disability, from all \nconcerned, to respond effectively to reliable information that comes before the \nSpecial Rapporteur, to follow up on communications and country visits and to seek \nthe views and comments of Governments and to reflect them, as appropriate, for \nexample, in reports, as well as to identify relevant issues, provide advice and \nrecommendations and share experiences and best practices to prevent extrajudicial, \nsummary and arbitrary executions; \n \n24. Acknowledges the important role of the Special Rapporteur in identifying \ncases where extrajudicial, summary or arbitrary executions could amount to genocide \nand crimes against humanity or war crimes, and urges the Special Rapporteur to \ncollaborate with the United Nations High Commissioner for Human Rights and, as \nappropriate, the Special Adviser to the Secretary-General on the Prevention of Genocide \nin addressing situations of extrajudicial, summary or arbitrary executions that are of \nparticularly serious concern or in which early action might prevent further deterioration; \n \n25. Welcomes the cooperation established between the Special Rapporteur and \nother United Nations mechanisms and procedures in the field of human rights, and \nencourages the Special Rapporteur to continue efforts in that regard; \n \n26. Urges all States, in particular those that have not done so, to cooperate \nwith the Special Rapporteur so that the mandate can be carried out effectively, \nincluding by favourably and rapidly responding to requests for visits, mindful that \ncountry visits are one of the essential tools for the fulfilment of the mandate, and by \n__________________ \n \n21 See A/76/264, A/77/270 and A/78/254. \n\nA/RES/79/176 \nExtrajudicial, summary or arbitrary executions\n \n24-24217\n8/8 \n \nresponding in a timely manner to communications and other requests transmitted to \nthem by the Special Rapporteur; \n \n27. Expresses its appreciation to those States that have received the Special \nRapporteur, asks them to examine the Special Rapporteur\u2019s recommendations \ncarefully, invites them to inform the Special Rapporteur of the actions taken on those \nrecommendations, and urges other States to cooperate in a similar way; \n \n28. Once again requests the Secretary-General to continue to use his best \nendeavours in cases where the minimum standards of legal safeguards provided for \nin articles 6, 9, 14, 15 and 16 of the International Covenant on Civil and Political \nRights appear not to have been respected; \n \n29. Requests the Secretary-General to provide the Special Rapporteur with \nadequate human, financial and material resources to enable the mandate to be carried \nout effectively, including through country visits;  \n \n30. Requests the Special Rapporteur to submit to the General Assembly, at its \neightieth and eighty-first sessions, a report on the situation worldwide with regard to \nextrajudicial, summary or arbitrary executions and recommendations for more \neffective action to combat this phenomenon; \n \n31. \nDecides to continue its consideration of the question at its eighty-first \nsession. \n \n53rd plenary meeting \n17 December 2024  \n \n",
  "paragraphs": {
    "1": "Reiterates its strong condemnation of all the extrajudicial, summary or arbitrary executions that continue to occur throughout the world;",
    "2": "Demands that all States ensure that the practice of extrajudicial, summary or arbitrary executions is brought to an end and that they take effective action to prevent, combat and eliminate the phenomenon in all its forms and manifestations;",
    "3": "Reiterates that all States: (a) Must conduct prompt, effective, exhaustive, thorough, independent, impartial and transparent investigations, exercising due diligence, in line with international standards and forensic best practices, and in this regard takes note of the Revised United Nations Manual on the Effective Prevention and Investigation of Extralegal, Arbitrary and Summary Executions, with reference to as much forensic expertise as necessary, into all suspected cases of extrajudicial, summary or arbitrary executions, identify and bring to justice those responsible, while ensuring the right of every person to a fair hearing by a competent, independent and impartial tribunal established by law, grant adequate compensation within a reasonable time to the victims or their families and adopt all measures, including legal and judicial measures, as recommended in the Principles on the Effective Prevention and Investigation of Extralegal, Arbitrary and Summary Executions, and fully consistent with their obligations under international law; __________________ 9 Resolution 65/229, annex. 10 Resolution 70/175, annex. 11 United Nations, Treaty Series, vol. 2187, No. 38544. A/RES/79/176 Extrajudicial, summary or arbitrary executions 24-24217 4/8 (b) Must conduct such investigations bearing in mind the need for gender equality in access to justice, necessary to put an end to impunity, particularly with regard to the gender-related killing of women and girls, also known as femicide, in this regard takes note of the reports submitted to the Human Rights Council at its thirty- fifth session12 and the General Assembly at its seventy-eighth session13 regarding the need for a gender-responsive approach to extrajudicial, summary or arbitrary killings, which point to the links between the arbitrary deprivation of life and systemic discrimination, such as gender-based and racial discrimination, and the greater rates of homicide perpetrated against Indigenous women and girls, and women and girls with disabilities, and extrajudicial, summary or arbitrary executions of refugees and migrants and humanitarian workers, and underlines the need for further measures in order to prevent the further occurrence of such executions;",
    "4": "Encourages the Office of the United Nations High Commissioner for Human Rights, in collaboration with relevant experts, particularly the Special Rapporteur on extrajudicial, summary or arbitrary executions, to initiate an expert-led process towards the elaboration of an addendum to the Revised United Nations Manual on the Effective Prevention and Investigation of Extralegal, Arbitrary and Summary Executions, providing specific guidance to all professionals with investigation responsibilities on properly identifying, investigating, prosecuting and reliably documenting gender-related killings of women and girls, also known as femicide, and to allocate adequate resources for this purpose;",
    "5": "Calls upon Governments, and invites intergovernmental and non-governmental organizations, to actively support and pay greater attention to the work of national-level commissions of inquiry into extrajudicial, summary or arbitrary executions, with a view to ensuring the effective contribution of these commissions to accountability and to combating impunity;",
    "6": "Calls upon all States, in order to prevent extrajudicial, summary or arbitrary executions, to comply with their obligations under the relevant provisions of international human rights instruments, and also calls upon States which retain the death penalty to pay particular regard to the provisions contained in articles 6, 14 and 15 of the International Covenant on Civil and Political Rights, articles 37 and 40 of the Convention on the Rights of the Child 14 and articles 12, 13 and 14 of the Convention on the Rights of Persons with Disabilities,15 bearing in mind the safeguards and guarantees set out in Economic and Social Council resolutions 1984/50 of 25 May 1984 and 1989/64 of 24 May 1989 and taking into account the recommendations of the Special Rapporteur on extrajudicial, summary or arbitrary executions in reports to the Human Rights Council and the General Assembly, including the report submitted to the Assembly at its sixty-seventh session,16 regarding the need to respect all safeguards and restrictions, including limitation to the most serious crimes, stringent respect of due process and fair trial safeguards and the right to seek pardon or commutation of sentence;",
    "7": "Emphasizes that to prevent extrajudicial, summary or arbitrary executions, States should take necessary steps to adopt such laws or other measures as may be necessary to give effect to the right to life in accordance with international law and that everyone has the right to recognition everywhere as a person before the law; __________________ 12 A/HRC/35/23. 13 A/78/254. 14 United Nations, Treaty Series, vol. 1577, No. 27531. 15 Ibid., vol. 2515, No. 44910. 16 A/67/275. Extrajudicial, summary or arbitrary executions A/RES/79/176 5/8 24-24217",
    "8": "Urges all States: (a) To take all measures required by international human rights law and international humanitarian law to prevent loss of life, in particular that of children, during detention, arrest, public demonstrations, internal and communal violence, civil unrest, public emergencies or armed conflicts and to ensure that the police, law enforcement agents, armed forces and other agents acting on behalf of or with the consent or acquiescence of the State, including private security providers, act with restraint and in conformity with international human rights law and international humanitarian law, including the principles of proportionality and necessity, and in this regard to ensure that police and law enforcement officials are guided by the Code of Conduct for Law Enforcement Officials17 and the Basic Principles on the Use of Force and Firearms by Law Enforcement Officials;18 (b) To ensure the effective protection of the right to life of all persons, to conduct, when required by obligations under international law, prompt, exhaustive and impartial investigations into all killings, including those targeted at specific groups of persons, such as racially motivated violence leading to the death of the victim, killings of persons belonging to national or ethnic, religious and linguistic minorities or because of their sexual orientation or gender identity, killings of persons affected by terrorism or hostage-taking or living under foreign occupation, killings of refugees, internally displaced persons, migrants, street children or members of Indigenous communities, killings of persons for reasons related to their activities as human rights defenders, lawyers, journalists or demonstrators, killings committed in the name of passion or in the name of honour and killings committed for discriminatory reasons on any basis, to bring those responsible to justice before a competent, independent and impartial judiciary at the national or, where appropriate, international level and to ensure that such killings, including those committed by security forces, police and law enforcement agents, paramilitary groups or private forces, are neither condoned nor sanctioned by State officials or personnel;",
    "9": "Encourages States, taking into account the relevant recommendations of the United Nations and of regional human rights systems, to review, where necessary, their domestic laws and practices with regard to the use of force in law enforcement in order to ensure that these laws and practices are in conformity with their international obligations and commitments;",
    "10": "Emphasizes that, to prevent extrajudicial, summary or arbitrary executions, States should take effective measures to ensure that the use of force by law enforcement officials is in conformity with international obligations and the principles of legality, precaution, necessity, proportionality and accountability, as well as their national legislation;",
    "11": "Reaffirms that the same human rights that people have offline must also be protected online, in order to help to prevent extrajudicial, summary or arbitrary executions;",
    "12": "Encourages States, in order to support the protection of the right to life, to make appropriate protective equipment and less-lethal weapons available to their officials exercising law enforcement duties, in order to decrease their need to use weapons of any kind, while pursuing efforts to regulate and establish protocols for the training and use of less-lethal weapons and in this regard strengthening __________________ 17 Resolution 34/169, annex. 18 See Eighth United Nations Congress on the Prevention of Crime and the Treatment of Offenders, Havana, 27 August\u20137 September 1990: report prepared by the Secretariat (United Nations publication, Sales No. E.91.IV.2), chap. I, sect. B. A/RES/79/176 Extrajudicial, summary or arbitrary executions 24-24217 6/8 international cooperation, bearing in mind that even less-lethal weapons can result in risk to life or serious injury;",
    "13": "Also encourages States to accelerate the work on fulfilling the 2030 Agenda for Sustainable Development, bearing in mind the importance of the full enjoyment of human rights and access to justice for all and effective, accountable and inclusive institutions at all levels, as well as the systematic mainstreaming and integration of a gender perspective;",
    "14": "Urges all States to ensure that all persons deprived of their liberty are treated humanely and with full respect for international law and that their treatment, including judicial guarantees and conditions, conforms to, as appropriate, the United Nations Standard Minimum Rules for the Treatment of Prisoners (the Nelson Mandela Rules), as well as the United Nations Rules for the Treatment of Women Prisoners and Non-custodial Measures for Women Offenders (the Bangkok Rules) and, where applicable, the Geneva Conventions of 12 August 1949 and the Additional Protocols thereto of 8 June 1977,19 as well as other pertinent international instruments;",
    "15": "Affirms the obligation of States to protect the right to life of all persons, including those deprived of their liberty, in all circumstances, and to take appropriate measures to prevent unlawful deaths and to promptly, effectively and impartially investigate all deaths in custody, including in institutions, and to ensure that those responsible for any unlawful death are brought to justice, and further calls upon States to reliably compile disaggregated, accurate and credible data on deaths in custody;",
    "16": "Welcomes: (a) The International Criminal Court as an important contribution to ending impunity concerning extrajudicial, summary or arbitrary executions, and, noting the growing awareness of the Court worldwide, as highlighted during the twenty-fifth anniversary of the adoption of the Rome Statute of the Court, calls upon those States that are under an obligation to cooperate with the Court to provide such cooperation and assistance in the future, in particular with regard to arrest and surrender, the provision of evidence, the protection and relocation of victims and witnesses and the enforcement of sentences; (b) The fact that 125 States have ratified or acceded to and 31 States have signed, but not yet ratified, the Rome Statute, and calls upon all those States that have not ratified or acceded to the Rome Statute and the Agreement on the Privileges and Immunities of the International Criminal Court20 to give serious consideration to doing so;",
    "17": "Acknowledges the importance of ensuring the protection of witnesses for the prosecution of those suspected of extrajudicial, summary or arbitrary executions, urges States to intensify efforts to establish and implement effective witness protection programmes or other measures, and in this regard encourages the Office of the United Nations High Commissioner for Human Rights to develop practical tools, including gender-responsive tools, designed to encourage and facilitate greater attention to the protection of witnesses;",
    "18": "Encourages Governments and intergovernmental and non-governmental organizations to organize training programmes and capacity-building and to support projects with a view to training or educating military forces, law enforcement officers, government officials and forensic specialists, as well as private personnel acting on behalf of the State, in international humanitarian and human rights law connected with their work, to include a gender, disability and child rights perspective, as well as information on the role of journalists and media workers, in such training and to require, __________________ 19 United Nations, Treaty Series, vol. 1125, Nos. 17512 and 17513. 20 Ibid., vol. 2271, No. 40446. Extrajudicial, summary or arbitrary executions A/RES/79/176 7/8 24-24217 where appropriate, that all private security providers have vetting and training procedures in place, including mandatory appropriate weapons training, that include human rights norms and principles, and appeals to the international community and requests the Office of the High Commissioner to support endeavours to that end;",
    "19": "Urges States to promote and apply an approach that respects human rights obligations and is gender-responsive in the design, development and use of new technologies on the basis of a multi-stakeholder approach and to regulate new and existing technologies in a manner that ensures that the development and use of such technologies promote, protect and respect human rights, including the right to life, and to make sure that new technologies are not discriminatory and they are not used to violate human rights;",
    "20": "Strongly urges all States to take the necessary measures to ensure the safety and security of national and international humanitarian personnel;",
    "21": "Requests the Secretary-General to continue, in close collaboration with the High Commissioner and in conformity with the mandate of the High Commissioner, established by the General Assembly in its resolution 48/141 of 20 December 1993, to ensure that personnel specialized in international humanitarian and human rights law, including in provisions related to gender equality and the empowerment of all women and girls, form part of United Nations missions, where appropriate, in order to deal with serious violations of human rights, such as extrajudicial, summary or arbitrary executions;",
    "22": "Takes note with appreciation of the reports of the Special Rapporteur to the General Assembly21 and the Human Rights Council, and invites States to take due consideration of the recommendations contained therein;",
    "23": "Commends the important role that the Special Rapporteur plays in the elimination and prevention of extrajudicial, summary or arbitrary executions, and encourages the Special Rapporteur to continue, within the mandate, to collect information, including data disaggregated by sex, age and disability, from all concerned, to respond effectively to reliable information that comes before the Special Rapporteur, to follow up on communications and country visits and to seek the views and comments of Governments and to reflect them, as appropriate, for example, in reports, as well as to identify relevant issues, provide advice and recommendations and share experiences and best practices to prevent extrajudicial, summary and arbitrary executions;",
    "24": "Acknowledges the important role of the Special Rapporteur in identifying cases where extrajudicial, summary or arbitrary executions could amount to genocide and crimes against humanity or war crimes, and urges the Special Rapporteur to collaborate with the United Nations High Commissioner for Human Rights and, as appropriate, the Special Adviser to the Secretary-General on the Prevention of Genocide in addressing situations of extrajudicial, summary or arbitrary executions that are of particularly serious concern or in which early action might prevent further deterioration;",
    "25": "Welcomes the cooperation established between the Special Rapporteur and other United Nations mechanisms and procedures in the field of human rights, and encourages the Special Rapporteur to continue efforts in that regard;",
    "26": "Urges all States, in particular those that have not done so, to cooperate with the Special Rapporteur so that the mandate can be carried out effectively, including by favourably and rapidly responding to requests for visits, mindful that country visits are one of the essential tools for the fulfilment of the mandate, and by __________________ 21 See A/76/264, A/77/270 and A/78/254. A/RES/79/176 Extrajudicial, summary or arbitrary executions 24-24217 8/8 responding in a timely manner to communications and other requests transmitted to them by the Special Rapporteur;",
    "27": "Expresses its appreciation to those States that have received the Special Rapporteur, asks them to examine the Special Rapporteur\u2019s recommendations carefully, invites them to inform the Special Rapporteur of the actions taken on those recommendations, and urges other States to cooperate in a similar way;",
    "28": "Once again requests the Secretary-General to continue to use his best endeavours in cases where the minimum standards of legal safeguards provided for in articles 6, 9, 14, 15 and 16 of the International Covenant on Civil and Political Rights appear not to have been respected;",
    "29": "Requests the Secretary-General to provide the Special Rapporteur with adequate human, financial and material resources to enable the mandate to be carried out effectively, including through country visits;",
    "30": "Requests the Special Rapporteur to submit to the General Assembly, at its eightieth and eighty-first sessions, a report on the situation worldwide with regard to extrajudicial, summary or arbitrary executions and recommendations for more effective action to combat this phenomenon;",
    "31": "Decides to continue its consideration of the question at its eighty-first session. 53rd plenary meeting 17 December 2024"
  },
  "agenda_items": [
    "Item 71"
  ],
  "symbol_references": []
}