{
  "symbol": "A/RES/77/36",
  "filename": "A_RES_77_36.pdf",
  "title": "77/36. Developments in the field of information and telecommunications in the context of international security",
  "text": "United Nations \nA/RES/77/36\n \n \nGeneral Assembly \nDistr.: General \n12 December 2022 \n \n \n22-28101 (E)    151222     \n*2228101* \n \n \nSeventy-seventh session \nAgenda item 94 \nDevelopments in the field of information and \ntelecommunications in the context of international security \n \n \n \n \n Resolution adopted by the General Assembly \non 7 December 2022 \n \n \n \n \n[on the report of the First Committee (A/77/380, para. 11)] \n \n \n \n77/36. Developments in the field of information and telecommunications \nin the context of international security \n \n \n \nThe General Assembly, \n \nRecalling its resolutions 36/103 of 9 December 1981, 43/78 H of 7 December \n1988, 53/70 of 4 December 1998, 54/49 of 1 December 1999, 55/28 of 20 November \n2000, 56/19 of 29 November 2001, 57/53 of 22 November 2002, 58/32 of 8 December \n2003, 59/61 of 3 December 2004, 60/45 of 8 December 2005, 61/54 of 6 December \n2006, 62/17 of 5 December 2007, 63/37 of 2 December 2008, 64/25 of 2 December \n2009, 65/41 of 8 December 2010, 66/24 of 2 December 2011, 67/27 of 3 December \n2012, 68/243 of 27 December 2013, 69/28 of 2 December 2014, 70/237 of \n23 December 2015, 71/28 of 5 December 2016, 73/27 of 5 December 2018, 74/29 of \n12 December 2019, 75/240 of 31 December 2020 and 76/19 of 6 December 2021, \n \nStressing that it is in the interest of all States to promote the use of information \nand communications technologies for peaceful purposes, with the objective of \nshaping a community of shared future for humankind for peace, security and stability \nin the information space, and that States also have an interest in preventing conflict \narising from the use of such technologies,  \n \nRecognizing that the dissemination and use of information and communications \ntechnologies affect the interests of the entire global community and that broad \ninternational cooperation leads to the most effective universal responses to address \ninformation and communications technology threats and promotes an open, secure, \nstable, accessible and peaceful information and communications technology \nenvironment,  \n \nReaffirming that, given the unique attributes of information and communications \ntechnologies, additional norms could be developed over time, and, separately, noting \nthe possibility of future elaboration of additional binding obligations,  \n\nA/RES/77/36 \nDevelopments in the field of information and telecommunications \nin the context of international security\n \n22-28101\n2/2 \n \n \nNoting that capacity-building is essential for international security, cooperation \nof States and confidence-building in the field of information and communications \ntechnology security and that capacity-building measures should seek to promote the \nuse of information and communications technologies for peaceful purposes, and that \nfurther focused discussions within the Open-ended Working Group on security of and \nin the use of information and communications technologies 2021\u20132025 on funding \nspecifically for capacity-building efforts on security in the use of information and \ncommunications technologies are needed, \n \nReaffirming that the United Nations should continue to play a leading role in \npromoting dialogue on the use of information and communications technologies by \nStates, \n \nUnderlining the importance for the global community of shaping a system of \ninternational information security and continuing a democratic, inclusive, transparent \nand results-oriented negotiation process within the Open-ended Working Group, \nwhile recognizing its centrality as the mechanism within the United Nations for \ndialogue on security in the use of information and communications technologies, \n \nWelcoming the efforts of the Chair of the Open-ended Working Group to forge \nconsensus among States on the common goal of ensuring an open, stable, secure, \naccessible and peaceful information and communications technology environment, \n \n1. \nSupports the work of the Open-ended Working Group on security of and \nin the use of information and communications technologies 2021\u20132025 in accordance \nwith its mandate, as enshrined in General Assembly resolution 75/240;  \n \n2. \nWelcomes the adoption by consensus of the first annual progress report of \nthe Open-ended Working Group,1 and takes note of the compendium of statements in \nexplanation of position on its adoption;2 \n \n3. \nCalls upon States to further engage constructively in the negotiations \nduring formal and intersessional meetings of the Open-ended Working Group, which, \npursuant to its mandate, will present recommendations, adopted by consensus, to the \nGeneral Assembly; \n \n4. \nConfirms that, in considering different proposals on all aspects of the \nmandate of the Open-ended Working Group, the views, concerns and interests of all \nStates should be taken into account, and recommends that these proposals be further \nelaborated within the Open-ended Working Group; \n \n5. \nEncourages Member States to continue exchanging views at the Open-\nended Working Group on regular institutional dialogue on security in the use of \ninformation and communications technologies, with the objective of elaborating a \ncommon understanding on the most effective format for future regular institutional \ndialogue with the broad participation of States under United Nations auspices to be \nestablished upon conclusion of the work of the Open-ended Working Group 2021\u20132025; \n \n6. \nInvites Member States to share within the Open-ended Working Group \ntheir views on capacity-building needs, as well as possible mechanisms to meet them, \nincluding funding; \n \n7. \nDecides to include in the provisional agenda of its seventy-eighth session \nthe item entitled \u201cDevelopments in the field of information and telecommunications \nin the context of international security\u201d. \n \n46th plenary meeting \n7 December 2022 \n__________________ \n \n1 A/77/275. \n \n2 A/AC.292/2022/INF/4. \n",
  "paragraphs": {
    "1": "Supports the work of the Open-ended Working Group on security of and in the use of information and communications technologies 2021\u20132025 in accordance with its mandate, as enshrined in General Assembly resolution 75/240;",
    "2": "Welcomes the adoption by consensus of the first annual progress report of the Open-ended Working Group,1 and takes note of the compendium of statements in explanation of position on its adoption;2",
    "3": "Calls upon States to further engage constructively in the negotiations during formal and intersessional meetings of the Open-ended Working Group, which, pursuant to its mandate, will present recommendations, adopted by consensus, to the General Assembly;",
    "4": "Confirms that, in considering different proposals on all aspects of the mandate of the Open-ended Working Group, the views, concerns and interests of all States should be taken into account, and recommends that these proposals be further elaborated within the Open-ended Working Group;",
    "5": "Encourages Member States to continue exchanging views at the Open- ended Working Group on regular institutional dialogue on security in the use of information and communications technologies, with the objective of elaborating a common understanding on the most effective format for future regular institutional dialogue with the broad participation of States under United Nations auspices to be established upon conclusion of the work of the Open-ended Working Group 2021\u20132025;",
    "6": "Invites Member States to share within the Open-ended Working Group their views on capacity-building needs, as well as possible mechanisms to meet them, including funding;",
    "7": "Decides to include in the provisional agenda of its seventy-eighth session the item entitled \u201cDevelopments in the field of information and telecommunications in the context of international security\u201d."
  },
  "agenda_items": [
    "Item 94"
  ],
  "symbol_references": []
}