{
  "symbol": "A/RES/74/201",
  "filename": "A_RES_74_201.pdf",
  "title": "74/201. International trade and development",
  "text": "United Nations \nA/RES/74/201\n \n \nGeneral Assembly \nDistr.: General \n13 January 2020 \n \n19-22414 (E)    170120 \n*1922414* \n \n \nSeventy-fourth session \nAgenda item 17 (a) \nMacroeconomic policy questions: international trade \nand development \n \n \n \n \n Resolution adopted by the General Assembly on \n19 December 2019 \n \n \n \n \n[on the report of the Second Committee (A/74/A/74/379/Add.1)] \n \n \n 74/201. International trade and development \n \n \n \nThe General Assembly, \n \nRecalling its resolutions 56/178 of 21 December 2001, 57/235 of 20 December \n2002, 58/197 of 23 December 2003, 59/221 of 22 December 2004, 60/184 of \n22 December 2005, 61/186 of 20 December 2006, 62/184 of 19 December 2007, \n63/203 of 19 December 2008, 64/188 of 21 December 2009, 65/142 of 20 December \n2010, 66/185 of 22 December 2011, 67/196 of 21 December 2012, 68/199 of 20 \nDecember 2013, 69/205 of 19 December 2014, 70/187 of 22 December 2015, 71/214 \nof 21 December 2016, 72/202 of 20 December 2017 and 73/219 of 20 December 2018, \n \nReaffirming its resolution 70/1 of 25 September 2015, entitled \u201cTransforming \nour world: the 2030 Agenda for Sustainable Development\u201d, in which it adopted a \ncomprehensive, far-reaching and people-centred set of universal and transformative \nSustainable Development Goals and targets, its  commitment to working tirelessly for \nthe full implementation of the Agenda by 2030, its recognition that eradicating \npoverty in all its forms and dimensions, including extreme poverty, is the greatest \nglobal challenge and an indispensable requirement for sustainable development, its \ncommitment to achieving sustainable development in its three dimensions \u2013 \neconomic, social and environmental \u2013 in a balanced and integrated manner, and to \nbuilding upon the achievements of the Millennium Development Goals and seeking \nto address their unfinished business, \n \nReaffirming also its resolution 69/313 of 27 July 2015 on the Addis Ababa \nAction Agenda of the Third International Conference on Financing for Development, \nwhich is an integral part of the 2030 Agenda for Sustainable Development, supports \nand complements it, helps to contextualize its means of implementation targets with \nconcrete policies and actions, and reaffirms the strong political commitment to \naddress the challenge of financing and creating an enabling environment at all levels \nfor sustainable development in the spirit of global partnership and solidarity, \n\nA/RES/74/201 \nInternational trade and development\n \n19-22414\n2/4 \n \n \nRecognizing the need to ensure that the benefits of trade are more widely shared, \n \nReaffirming World Trade Organization decision WT/MIN(15)/48-WT/L/982 of \n19 December 2015 on the implementation of preferential treatment in favour of \nservices and service suppliers of least developed countries and increasing their \nparticipation in services trade and decision WT/L/508/Add.1 of 25 July 2012 on \naccession by the least developed countries, encouraging progress on the \nimplementation of the World Trade Organization work programme on small \neconomies, which supports their efforts towards sustainable development, as also \nreflected in the outcome document of the third International Conference on Small \nIsland Developing States, the SIDS Accelerated Modalities of Action (SAMOA) \nPathway, 1  and stressing that Aid for Trade and targeted trade-related capacity-\nbuilding are essential to integrating developing countries, in particular the least \ndeveloped countries, landlocked developing countries and small island developing \nStates, into the international trading system, \n \nRecognizing the critical role of women as producers and traders and the need to \naddress their specific challenges in order to facilitate their equal and active \nparticipation in domestic, regional and international trade, \n \nRecognizing also that multilateral rules and disciplines are the best guarantee \nagainst protectionism and are fundamental to the transparency, predictability and \nstability of international trade, \n \nNoting the commitments to working to ensure that bilateral, regional and \nplurilateral trade agreements complement the multilateral trading system, recognizing \nthat they can play an important role in complementing global liberalization initiatives, \nand in this regard welcoming the entry into force of the Agreement Establishing the \nAfrican Continental Free Trade Area, on 30 May 2019, \n \nReiterating the pledge that no one will be left behind, reaffirming the \nrecognition that the dignity of the human person is fundamental, and the wish to see \nthe Goals and targets met for all nations and peoples and for all segments of society, \nand recommitting to endeavour to reach the furthest behind first, \n \n1. \nTakes note of the report of the Trade and Development Board of the United \nNations Conference on Trade and Development 2 and the report of the Secretary-\nGeneral;3 \n \n2. \nReaffirms that international trade is an engine for inclusive growth and \npoverty eradication and that it contributes to the promotion of sustainable development, \nstructural transformation and industrialization, particularly in developing countries; \n \n3. \nReiterates that States will not be able to achieve the ambitious Goals and \ntargets of the 2030 Agenda for Sustainable Development 4 without a revitalized and \nenhanced global partnership and comparably ambitious means of implementation, and \nthat a revitalized global partnership will facilitate an intensive global engagement in \nsupport of the implementation of the 2030 Agenda, bringing together Governments, \ncivil society, the private sector, the United Nations system and other actors and \nmobilizing all available resources; \n \n4. \nReaffirms the commitments made through the adoption of the Addis Ababa \nAction Agenda of the Third International Conference on Financing for Development5 \n__________________ \n \n1 Resolution 69/15, annex. \n \n2 A/74/15 (Part I) and A/74/15 (Part II). \n \n3 A/74/221. \n \n4 Resolution 70/1. \n \n5 Resolution 69/313, annex. \n\nInternational trade and development \nA/RES/74/201\n \n3/4\n19-22414 \n \nin, inter alia, international trade as an important action area for sustainable \ndevelopment; \n \n5. \nNotes with concern that the World Trade Organization is increasingly \naffected by insufficient progress in multilateral trade negotiations and that it is \nimperative for the World Trade Organization to address issues that are at the heart of \ncurrent problems in international trade, and recognizes in this regard the need to \nstrengthen the World Trade Organization, with a view to ensuring the continued \nviability and effectiveness of its dispute settlement, negotiating and monitoring \nfunctions; \n \n6. \nRecommits firmly to promoting a universal, rules-based, open, transparent, \npredictable, inclusive, non-discriminatory and equitable multilateral trading system \nunder the World Trade Organization, as well as meaningful trade liberalization; \n \n7. \nEmphasizes the urgent need to combat protectionism in all its forms and \nto rectify any trade-distorting measures that are inconsistent with World Trade \nOrganization rules, recognizing the right of countries, in particular developing \ncountries, to fully utilize flexibilities consistent with their World Trade Organization \ncommitments and obligations, and also emphasizes that the work of the World Trade \nOrganization shall maintain development at its centre, with provisions for special and \ndifferential treatment remaining integral; \n \n8. \nUrges the international community to adopt urgent and effective measures \nto eliminate the use of unilateral economic, financial or trade measures that are not \nauthorized by relevant organs of the United Nations, that are inconsistent with the \nprinciples of international law or the Charter of the United Nations or that contravene \nthe basic principles of the multilateral trading system and that affect, in particular, \nbut not exclusively, developing countries; \n \n9. \nCalls upon all members of the World Trade Organization to urgently \nconclude negotiations on fisheries subsidies in 2019, consistent with the decision of \nthe eleventh Ministerial Conference of the World Trade Organization6 and with a view \nto meeting the Sustainable Development Goals; \n \n10. Underlines the importance of the Agreement on Trade Facilitation annexed \nto the Protocol amending the Marrakesh Agreement Establishing the World Trade \nOrganization in improving transparency, expediting the movement, release and \nclearance of goods, including goods in transit, and thereby reducing trade costs, and \nin this regard encourages its full and effective implementation, including through \nenhanced support towards its implementation; \n \n11. \nLooks forward to the convening of the fifteenth session of the United Nations \nConference on Trade and Development in Barbados from 18 to 23 October 2020; \n \n12. Welcomes the convening of the twelfth Ministerial Conference of the \nWorld Trade Organization in Nur-Sultan from 8 to 11 June 2020, looks forward to \nachieving positive outcomes in a balanced, inclusive and transparent way, and \nexpresses its appreciation to the Government of Kazakhstan for hosting the meeting; \n \n13. Reiterates the important role of the United Nations Conference on Trade \nand Development as the focal point within the United Nations system for the \nintegrated treatment of trade and development and interrelated issues in the areas of \nfinance, technology, investment and sustainable development, and in contributing to \nsupporting the implementation of the 2030 Agenda; \n \n14. Reaffirms the commitment at the very heart of the 2030 Agenda to leave \nno one behind and commit to taking more tangible steps to support people in \n__________________ \n \n6 WT/MIN(17)/64-WT/L/1031 of 13 December 2017. \n\nA/RES/74/201 \nInternational trade and development\n \n19-22414\n4/4 \n \nvulnerable situations and the most vulnerable countries and to reach the furthest \nbehind first; \n \n15. Requests the Secretary-General, in collaboration with the secretariat of the \nUnited Nations Conference on Trade and Development, to submit to the General \nAssembly at its seventy-fifth session a report on the implementation of the present \nresolution and on developments in the international trading system, including \nconcrete recommendations to accelerate the implementation of the Addis Ababa \nAction Agenda in this regard, and decides to include in the provisional agenda of its \nseventy-fifth session, under the item entitled \u201cMacroeconomic policy questions\u201d, the \nsub-item entitled \u201cInternational trade and development\u201d. \n \n52nd plenary meeting \n19 December 2019 \n \n",
  "paragraphs": {
    "1": "Takes note of the report of the Trade and Development Board of the United Nations Conference on Trade and Development 2 and the report of the Secretary- General;3",
    "2": "Reaffirms that international trade is an engine for inclusive growth and poverty eradication and that it contributes to the promotion of sustainable development, structural transformation and industrialization, particularly in developing countries;",
    "3": "Reiterates that States will not be able to achieve the ambitious Goals and targets of the 2030 Agenda for Sustainable Development 4 without a revitalized and enhanced global partnership and comparably ambitious means of implementation, and that a revitalized global partnership will facilitate an intensive global engagement in support of the implementation of the 2030 Agenda, bringing together Governments, civil society, the private sector, the United Nations system and other actors and mobilizing all available resources;",
    "4": "Reaffirms the commitments made through the adoption of the Addis Ababa Action Agenda of the Third International Conference on Financing for Development5 __________________ 1 Resolution 69/15, annex. 2 A/74/15 (Part I) and A/74/15 (Part II). 3 A/74/221. 4 Resolution 70/1. 5 Resolution 69/313, annex. International trade and development A/RES/74/201 3/4 19-22414 in, inter alia, international trade as an important action area for sustainable development;",
    "5": "Notes with concern that the World Trade Organization is increasingly affected by insufficient progress in multilateral trade negotiations and that it is imperative for the World Trade Organization to address issues that are at the heart of current problems in international trade, and recognizes in this regard the need to strengthen the World Trade Organization, with a view to ensuring the continued viability and effectiveness of its dispute settlement, negotiating and monitoring functions;",
    "6": "Recommits firmly to promoting a universal, rules-based, open, transparent, predictable, inclusive, non-discriminatory and equitable multilateral trading system under the World Trade Organization, as well as meaningful trade liberalization;",
    "7": "Emphasizes the urgent need to combat protectionism in all its forms and to rectify any trade-distorting measures that are inconsistent with World Trade Organization rules, recognizing the right of countries, in particular developing countries, to fully utilize flexibilities consistent with their World Trade Organization commitments and obligations, and also emphasizes that the work of the World Trade Organization shall maintain development at its centre, with provisions for special and differential treatment remaining integral;",
    "8": "Urges the international community to adopt urgent and effective measures to eliminate the use of unilateral economic, financial or trade measures that are not authorized by relevant organs of the United Nations, that are inconsistent with the principles of international law or the Charter of the United Nations or that contravene the basic principles of the multilateral trading system and that affect, in particular, but not exclusively, developing countries;",
    "9": "Calls upon all members of the World Trade Organization to urgently conclude negotiations on fisheries subsidies in 2019, consistent with the decision of the eleventh Ministerial Conference of the World Trade Organization6 and with a view to meeting the Sustainable Development Goals;",
    "10": "Underlines the importance of the Agreement on Trade Facilitation annexed to the Protocol amending the Marrakesh Agreement Establishing the World Trade Organization in improving transparency, expediting the movement, release and clearance of goods, including goods in transit, and thereby reducing trade costs, and in this regard encourages its full and effective implementation, including through enhanced support towards its implementation;",
    "11": "Looks forward to the convening of the fifteenth session of the United Nations Conference on Trade and Development in Barbados from 18 to 23 October 2020;",
    "12": "Welcomes the convening of the twelfth Ministerial Conference of the World Trade Organization in Nur-Sultan from 8 to 11 June 2020, looks forward to achieving positive outcomes in a balanced, inclusive and transparent way, and expresses its appreciation to the Government of Kazakhstan for hosting the meeting;",
    "13": "Reiterates the important role of the United Nations Conference on Trade and Development as the focal point within the United Nations system for the integrated treatment of trade and development and interrelated issues in the areas of finance, technology, investment and sustainable development, and in contributing to supporting the implementation of the 2030 Agenda;",
    "14": "Reaffirms the commitment at the very heart of the 2030 Agenda to leave no one behind and commit to taking more tangible steps to support people in __________________ 6 WT/MIN(17)/64-WT/L/1031 of 13 December 2017. A/RES/74/201 International trade and development 19-22414 4/4 vulnerable situations and the most vulnerable countries and to reach the furthest behind first;",
    "15": "Requests the Secretary-General, in collaboration with the secretariat of the United Nations Conference on Trade and Development, to submit to the General Assembly at its seventy-fifth session a report on the implementation of the present resolution and on developments in the international trading system, including concrete recommendations to accelerate the implementation of the Addis Ababa Action Agenda in this regard, and decides to include in the provisional agenda of its seventy-fifth session, under the item entitled \u201cMacroeconomic policy questions\u201d, the sub-item entitled \u201cInternational trade and development\u201d. 52nd plenary meeting 19 December 2019"
  },
  "agenda_items": [
    "Item 17"
  ],
  "symbol_references": []
}