{
  "symbol": "A/RES/73/191",
  "filename": "A_RES_73_191.pdf",
  "title": "73/191. Special session of the General Assembly against corruption",
  "text": "United Nations \nA/RES/73/191\n \n \nGeneral Assembly \nDistr.: General \n9 January 2019 \n \n18-22287 (E)    110119 \n*1822287* \n \n \nSeventy-third session \nAgenda item 109 \n \n \n \n \n Resolution adopted by the General Assembly \non 17 December 2018 \n \n \n \n \n[on the report of the Third Committee (A/73/590)] \n \n \n 73/191. Special session of the General Assembly against corruption \n \n \n \nThe General Assembly, \n \nRecalling its resolutions 54/205 of 22 December 1999, 55/61 of 4 December \n2000, 55/188 of 20 December 2000, 56/186 of 21 December 2001 and 57/244 of \n20 December 2002, and recalling also its resolutions 58/205 of 23 December 2003, \n59/242 of 22 December 2004, 60/207 of 22 December 2005, 61/209 of 20 December \n2006, 62/202 of 19 December 2007, 63/226 of 19 December 2008, 64/237 of \n24 December 2009, 65/169 of 20 December 2010, 67/189 and 67/192 of 20 December \n2012, 68/195 of 18 December 2013, 69/199 of 18 December 2014 and 71/208 of \n19 December 2016, and all relevant Human Rights Council resolutions, including \nresolutions 23/9 of 13 June 2013,1 29/11 of 2 July 20152 and 35/25 of 23 June 2017,3  \n \nRecalling also the entry into force on 14 December 2005 of the United Nations \nConvention against Corruption, 4 which is the most comprehensive and universal \ninstrument on corruption, recognizing the need to continue to promote its ratification \nor accession thereto and its effective implementation, and acknowledging all relevant \nregional political declarations of Member States against corruption, \n \nStressing that the 2030 Agenda for Sustainable Development 5 addresses the \nneed to promote peaceful and inclusive societies for sustainable development, provide \naccess to justice for all and build effective, accountable and inclusive institutions at \nall levels, and concerned about the seriousness of the problems and threats to the \nstability and security of societies posed by corruption, which undermine the \n__________________ \n \n1  See Official Records of the General Assembly, Sixty-eighth Session, Supplement No. 53 \n(A/68/53), chap. V, sect. A. \n \n2  Ibid., Seventieth Session, Supplement No. 53 (A/70/53), chap. V, sect. A. \n \n3  Ibid., Seventy-second Session, Supplement No. 53 (A/72/53), chap. V, sect. A. \n \n4  United Nations, Treaty Series, vol. 2349, No. 42146. \n \n5  Resolution 70/1. \n\nA/RES/73/191 \nSpecial session of the General Assembly against corruption\n \n18-22287\n2/2 \n \ninstitutions and values of democracy, ethics and justice, and jeopardize sustainable \ndevelopment and the rule of law,  \n \n1. \nDecides to convene in the first half of 2021 a special session of the General \nAssembly on challenges and measures to prevent and combat corruption and \nstrengthen international cooperation; \n \n2. \nAlso decides that at that special session the General Assembly shall adopt \na concise and action-oriented political declaration, agreed upon in advance by \nconsensus through intergovernmental negotiations under the auspices of the \nConference of the States Parties to the United Nations Convention against Corruption; \n \n3. \nInvites the Conference of the States Parties to lead the preparatory process \nfor the special session by addressing all organizational and substantive matters in an \nopen-ended manner; \n \n4. \nRequests the United Nations Office on Drugs and Crime to provide \nsubstantive expertise and technical support; \n \n5. \nDecides to conduct the special session and its preparatory process from \nwithin existing resources. \n \n56th plenary meeting \n17 December 2018 \n \n",
  "paragraphs": {
    "1": "Decides to convene in the first half of 2021 a special session of the General Assembly on challenges and measures to prevent and combat corruption and strengthen international cooperation;",
    "2": "Also decides that at that special session the General Assembly shall adopt a concise and action-oriented political declaration, agreed upon in advance by consensus through intergovernmental negotiations under the auspices of the Conference of the States Parties to the United Nations Convention against Corruption;",
    "3": "Invites the Conference of the States Parties to lead the preparatory process for the special session by addressing all organizational and substantive matters in an open-ended manner;",
    "4": "Requests the United Nations Office on Drugs and Crime to provide substantive expertise and technical support;",
    "5": "Decides to conduct the special session and its preparatory process from within existing resources."
  },
  "agenda_items": [
    "Item 109"
  ],
  "symbol_references": []
}