{
  "symbol": "A/RES/74/278",
  "filename": "A_RES_74_278.pdf",
  "title": "74/278. Closed peacekeeping missions",
  "text": "United Nations \nA/RES/74/278\n \n \nGeneral Assembly \nDistr.: General \n9 July 2020 \n \n20-08786 (E)    140720 \n*2008786* \n \n \nSeventy-fourth session \nAgenda item 148 \nAdministrative and budgetary aspects of the financing \nof the United Nations peacekeeping operations \n \n \n \n \n Resolution adopted by the General Assembly \non 30 June 2020 \n \n \n \n \n[on the report of the Fifth Committee (A/74/910)] \n \n \n 74/278. Closed peacekeeping missions \n \n \n \nThe General Assembly, \n \nRecalling its resolution 65/293 of 30 June 2011 and its decision 73/547 C of \n3 July 2019, \n \nHaving considered the reports of the Secretary-General on the updated financial \nposition of closed peacekeeping missions 1 and the related reports of the Advisory \nCommittee on Administrative and Budgetary Questions,2 \n \n1. \nTakes note of the reports of the Secretary-General;1 \n \n2. \nEndorses the conclusions and recommendations contained in the reports \nof the Advisory Committee on Administrative and Budgetary Questions, 2 subject to \nthe provisions of the present resolution; \n \n3. \nStresses that all Member States should fulfil their financial obligations as \nset out in the Charter of the United Nations on time, in full and without conditions; \n \n4. \nUrges all Member States to make every possible effort to ensure payment \nof their assessed contributions in full; \n \n5. \nTakes note of paragraphs 10 and 11 (b) of the report of the Advisory \nCommittee;3 \n__________________ \n \n1  A/66/665, A/67/739, A/68/666, A/69/659, A/70/552, A/71/652, A/72/649, A/73/604 and \nA/74/574. \n \n2  A/66/713, A/66/713/Corr.1, A/67/837, A/68/837, A/69/827, A/70/829, A/71/856, A/72/838, \nA/73/888 and A/74/772. \n \n3  A/74/772. \n\nA/RES/74/278 \nClosed peacekeeping missions\n \n2/2 \n \n \n6. \nRecalls regulations 5.3, 5.4, 5.5 and 5.10 of the Financial Regulations and \nRules of the United Nations, 4  regrets that claims payable to troop- and police-\ncontributing countries and outstanding dues to Member States from closed \npeacekeeping operation budgets have not been settled, and emphasizes its \ncommitment to resolve this issue; \n \n7. \nRequests the Secretary-General to continue to take every measure \nnecessary to reimburse troop- and police-contributing countries before the closure of \nany peacekeeping mission, and to avoid the current practice of delaying \nreimbursements to troop- and police-contributing countries; \n \n8. \nNotes that the use of unreturned balances to cover temporary liquidity \nneeds of the Organization in 2018 and 2019 is not an established mechanism, and \nemphasizes that this practice is not sustainable; \n \n9. \nDecides to consider at the second part of its resumed seventy-fifth session \nthe financial position of closed peacekeeping missions, under the agenda item entitled \n\u201cAdministrative and budgetary aspects of the financing of the United Nations \npeacekeeping operations\u201d. \n \n30 June 2020 \n \n__________________ \n \n4  ST/SGB/2013/4 and ST/SGB/2013/4/Amend.1. \n",
  "paragraphs": {
    "1": "Takes note of the reports of the Secretary-General;1",
    "2": "Endorses the conclusions and recommendations contained in the reports of the Advisory Committee on Administrative and Budgetary Questions, 2 subject to the provisions of the present resolution;",
    "3": "Stresses that all Member States should fulfil their financial obligations as set out in the Charter of the United Nations on time, in full and without conditions;",
    "4": "Urges all Member States to make every possible effort to ensure payment of their assessed contributions in full;",
    "5": "Takes note of paragraphs 10 and 11 (b) of the report of the Advisory Committee;3",
    "6": "Recalls regulations 5.3, 5.4, 5.5 and 5.10 of the Financial Regulations and Rules of the United Nations, 4 regrets that claims payable to troop- and police- contributing countries and outstanding dues to Member States from closed peacekeeping operation budgets have not been settled, and emphasizes its commitment to resolve this issue;",
    "7": "Requests the Secretary-General to continue to take every measure necessary to reimburse troop- and police-contributing countries before the closure of any peacekeeping mission, and to avoid the current practice of delaying reimbursements to troop- and police-contributing countries;",
    "8": "Notes that the use of unreturned balances to cover temporary liquidity needs of the Organization in 2018 and 2019 is not an established mechanism, and emphasizes that this practice is not sustainable;",
    "9": "Decides to consider at the second part of its resumed seventy-fifth session the financial position of closed peacekeeping missions, under the agenda item entitled \u201cAdministrative and budgetary aspects of the financing of the United Nations peacekeeping operations\u201d. 30 June 2020"
  },
  "agenda_items": [
    "Item 148"
  ],
  "symbol_references": []
}