{
  "symbol": "A/RES/76/171",
  "filename": "A_RES_76_171.pdf",
  "title": "76/171. Subregional Centre for Human Rights and Democracy in Central Africa",
  "text": "United Nations \nA/RES/76/171\n \n \nGeneral Assembly \nDistr.: General \n10 January 2022 \n \n \n21-19205 (E)    140122 \n*2119205* \n \n \nSeventy-sixth session \nAgenda item 74 (b) \nPromotion and protection of human rights: human \nrights questions, including alternative approaches for \nimproving the effective enjoyment of human rights and \nfundamental freedoms \n \n \n \n \n Resolution adopted by the General Assembly \non 16 December 2021 \n \n \n \n \n[on the report of the Third Committee (A/76/462/Add.2, para. 114)] \n \n \n 76/171. Subregional Centre for Human Rights and Democracy in \nCentral Africa \n \n \n \nThe General Assembly, \n \nRecalling its resolution 55/105 of 4 December 2000 concerning regional \narrangements for the promotion and protection of human rights,  \n \nRecalling also its resolutions 55/34 B of 20 November 2000 and 55/233 of \n23 December 2000, section III of its resolution 55/234 of 23 December 2000, and its \nresolutions 56/253 of 24 December 2001 and 75/254 A to C of 31 December 2020, \n \nRecalling further its resolutions 58/176 of 22 December 2003, 59/183 of \n20 December 2004, 60/151 of 16 December 2005, 61/158 of 19 December 2006, \n62/221 of 22 December 2007, 63/177 of 18 December 2008, 64/165 of 18 December \n2009, 66/162 of 19 December 2011, 68/174 of 18 December 2013, 70/167 of \n17 December 2015, 72/187 of 19 December 2017 and 74/162 of 18 December 2019 \non the Subregional Centre for Human Rights and Democracy in Central Africa,  \n \nRecalling that the World Conference on Human Rights recommended that more \nresources be made available for the strengthening of regional arrangements for the \npromotion and protection of human rights under the programme of technical \ncooperation in the field of human rights of the Office of the United Nations High \nCommissioner for Human Rights,1  \n__________________ \n \n1  See A/CONF.157/24 (Part I), chap. III. \n\nA/RES/76/171 \nSubregional Centre for Human Rights \nand Democracy in Central Africa\n \n21-19205\n2/3 \n \n \nRecalling also the report of the United Nations High Commissioner for Human \nRights,2  \n \nTaking note of the report of the Secretary-General,3  \n \nNoting the holding of the forty-fifth, forty-sixth, forty-seventh, forty-eighth, \nforty-ninth, fiftieth and fifty-first ministerial meetings of the United Nations Standing \nAdvisory Committee on Security Questions in Central Africa, in Kigali from 4 to \n8 December 2017, in Brazzaville from 29 May to 1 June 2018, in N\u2019Djamena from \n3 to 7 December 2018, in Kinshasa from 27 to 31 May 2019, in Luanda from 25 to \n29 November 2019, in Malabo, from 2 to 4 December 2020 and in Bujumbura, \nBurundi, from 24 to 28 May 2021, \n \nRecalling the launch of a far-reaching organizational change initiative in the \nOffice of the United Nations High Commissioner for Human Rights with a view to \nbetter integrating work at Headquarters and in the field, 4  \n \nNoting the security and humanitarian situation in the subregion, and in particular \nthe challenges created by indiscriminate attacks and massive abuses of human rights \nby terrorist groups, including Boko Haram, against the civilian population in many \ncountries of the Central African subregion and in the Lake Chad basin countries,  \n \nNoting also that the effective presence of the Office of the United Nations High \nCommissioner for Human Rights in the countries covered and continued dialogue \nwith the authorities have generated an increased number of requests for assistance \nfrom States,  \n \nMindful of the vastness and diversity of the needs in the field of human rights \nwithin the subregion, and taking into account the need for sufficient funding of the \nCentre to fully realize its significant function and crucial role in the subregion,  \n \nNoting with concern the negative effects of the coronavirus disease (COVID-19) \npandemic and the liquidity crisis of the Secretariat on the capacity of the Centre to \ndeliver on some of its mandate, \n \n1. \nWelcomes the activities of the Subregional Centre for Human Rights and \nDemocracy in Central Africa at Yaound\u00e9;  \n \n2. \nNotes with satisfaction the support provided to the Centre by the host \ncountry;  \n \n3. \nAlso notes with satisfaction the increasing activities of the Centre and the \nimproved cooperation between the Centre and the States members of the Economic \nCommunity of Central African States, and in this regard encourages the Centre, in \ndelivering and reporting its activities, to give equal consideration to all of the \ncountries covered and to all human rights, including civil and political as well as \neconomic, social and cultural rights;  \n \n4. \nEncourages the Centre to take into account the requested activities, needs \nand demands of the countries of the subregion in the implementation of the strategic \nthematic priorities of the Office of the United Nations High Commissioner for Human \nRights;  \n \n5. \nNotes with satisfaction the engagement of the Centre in the area of human \nrights in development and in the economic sphere, through advocacy and the \nprovision of guidance to States, private sector companies and businesses in the \n__________________ \n \n2  Official Records of the General Assembly, Fifty-sixth Session, Supplement No. 36, addendum \n(A/56/36/Add.1). \n \n3  A/76/253. \n \n4  See Official Records of the General Assembly, Seventieth Session, Supplement No. 36 (A/70/36), \nchap. III. \n\nSubregional Centre for Human Rights \nand Democracy in Central Africa \nA/RES/76/171\n \n3/3\n21-19205 \n \nsubregion, with a view to strengthening commitments to protect and/or respect human \nrights, and encourages the Centre to increase its support in this field;  \n \n6. \nEncourages the Centre to continue to strengthen its cooperation and invest \nin relations with subregional organizations and bodies, including the African Union, \nthe Economic Community of Central African States, the United Nations Regional \nOffice for Central Africa and the United Nations country teams, as well as with the \npeacekeeping missions of the subregion; \n \n7. \nEncourages the Regional Representative and Director of the Centre to \ncontinue to hold regular briefings for the ambassadors of Central African States based \nin Geneva and Yaound\u00e9, as well as in countries of the subregion during visits of the \nRegional Representative, with the aim of exchanging information on the activities of \nthe Centre and charting its direction;  \n \n8. \nNotes the efforts of the Secretary-General and the United Nations High \nCommissioner for Human Rights to ensure the full implementation of the relevant \nresolutions of the General Assembly5 in order to provide sufficient funds and human \nresources for the missions of the Centre;  \n \n9. \nRequests the Secretary-General and the High Commissioner for Human \nRights to provide additional funds and human resources to the Centre, within existing \nresources, in particular human resources from within the subregion and national staff \nat all levels, so as to enable the Centre to achieve greater results in terms of \nstrengthening national human rights systems and moving more rapidly towards the \nachievement of the Sustainable Development Goals6 in Central Africa;  \n \n10. Requests the Secretary-General to submit to the General Assembly at its \nseventy-eighth session a report on the implementation of the present resolution. \n \n53rd plenary meeting \n16 December 2021 \n \n \n__________________ \n \n5  Resolutions 61/158, 62/221, 63/177, 64/165, 72/187 and 74/162. \n \n6  See resolution 70/1. \n",
  "paragraphs": {
    "1": "Welcomes the activities of the Subregional Centre for Human Rights and Democracy in Central Africa at Yaound\u00e9;",
    "2": "Notes with satisfaction the support provided to the Centre by the host country;",
    "3": "Also notes with satisfaction the increasing activities of the Centre and the improved cooperation between the Centre and the States members of the Economic Community of Central African States, and in this regard encourages the Centre, in delivering and reporting its activities, to give equal consideration to all of the countries covered and to all human rights, including civil and political as well as economic, social and cultural rights;",
    "4": "Encourages the Centre to take into account the requested activities, needs and demands of the countries of the subregion in the implementation of the strategic thematic priorities of the Office of the United Nations High Commissioner for Human Rights;",
    "5": "Notes with satisfaction the engagement of the Centre in the area of human rights in development and in the economic sphere, through advocacy and the provision of guidance to States, private sector companies and businesses in the __________________ 2 Official Records of the General Assembly, Fifty-sixth Session, Supplement No. 36, addendum (A/56/36/Add.1). 3 A/76/253. 4 See Official Records of the General Assembly, Seventieth Session, Supplement No. 36 (A/70/36), chap. III. Subregional Centre for Human Rights and Democracy in Central Africa A/RES/76/171 3/3 21-19205 subregion, with a view to strengthening commitments to protect and/or respect human rights, and encourages the Centre to increase its support in this field;",
    "6": "Encourages the Centre to continue to strengthen its cooperation and invest in relations with subregional organizations and bodies, including the African Union, the Economic Community of Central African States, the United Nations Regional Office for Central Africa and the United Nations country teams, as well as with the peacekeeping missions of the subregion;",
    "7": "Encourages the Regional Representative and Director of the Centre to continue to hold regular briefings for the ambassadors of Central African States based in Geneva and Yaound\u00e9, as well as in countries of the subregion during visits of the Regional Representative, with the aim of exchanging information on the activities of the Centre and charting its direction;",
    "8": "Notes the efforts of the Secretary-General and the United Nations High Commissioner for Human Rights to ensure the full implementation of the relevant resolutions of the General Assembly5 in order to provide sufficient funds and human resources for the missions of the Centre;",
    "9": "Requests the Secretary-General and the High Commissioner for Human Rights to provide additional funds and human resources to the Centre, within existing resources, in particular human resources from within the subregion and national staff at all levels, so as to enable the Centre to achieve greater results in terms of strengthening national human rights systems and moving more rapidly towards the achievement of the Sustainable Development Goals6 in Central Africa;",
    "10": "Requests the Secretary-General to submit to the General Assembly at its seventy-eighth session a report on the implementation of the present resolution. 53rd plenary meeting 16 December 2021 __________________ 5 Resolutions 61/158, 62/221, 63/177, 64/165, 72/187 and 74/162. 6 See resolution 70/1."
  },
  "agenda_items": [
    "Item 74"
  ],
  "symbol_references": []
}