{
  "symbol": "A/RES/73/101",
  "filename": "A_RES_73_101.pdf",
  "title": "73/101. Comprehensive review of special political missions",
  "text": "United Nations \nA/RES/73/101\n \n \nGeneral Assembly \nDistr.: General \n18 December 2018 \n \n18-21443 (E)    201218 \n*1821443* \n \n \nSeventy-third session \nAgenda item 57 \n \n \n \n \n Resolution adopted by the General Assembly \non 7 December 2018 \n \n \n \n \n[on the report of the Special Political and Decolonization Committee \n(Fourth Committee) (A/73/526)] \n \n \n 73/101. Comprehensive review of special political missions \n \n \n \nThe General Assembly, \n \nGuided by the purposes and principles enshrined in the Charter of the United \nNations,  \n \nRecalling its resolutions 67/123 of 18 December 2012, 68/85 of 11 December \n2013, 69/95 of 5 December 2014, 70/92 of 9 December 2015, 71/100 of 6 December \n2016 and 72/89 of 7 December 2017 on the comprehensive review of special political \nmissions,  \n \nReaffirming its commitment to respecting the sovereignty, territorial integrity \nand political independence of all States, \n \nRecalling the primary role of the United Nations and the respective roles and \nauthority of the General Assembly and the Security Council in the maintenance of \ninternational peace and security in accordance with the Charter, and recalling also in \nthis context the contribution of regional and subregional arrangements and the \nimportant role they can play, as appropriate, \n \nRecalling also the adoption by the General Assembly and the Security Council \nof substantively identical resolutions 70/262 and 2282 (2016) of 27 April 2016, \nfurther recalling the adoption of resolutions 72/276 and 2413 (2018) of 26 April 2018 \non peacebuilding and sustaining peace, and recognizing in this regard the important \nrole played by special political missions in the area of sustaining peace, as a goal and \na process, where mandated, \n \nRecognizing the important role of the special political missions as a flexible tool \nfor the maintenance of international peace and security, including through \ncontributions to a comprehensive approach to peacebuilding and sustaining peace, \n \nNoting that the relevant reforms, in particular of the peace and security pillar, \nare an opportunity to further advance and strengthen the work of special political \n\nA/RES/73/101 \nComprehensive review of special political missions\n \n18-21443\n2/4 \n \nmissions in all mandated tasks, including in conflict prevention, and stressing that \nactions by the United Nations should support and complement, as appropriate, the \nconflict prevention roles of national Governments, \n \nEncouraging enhanced exchanges of information, in an appropriate manner, \namong the General Assembly, the Security Council and the Secretariat, making use \nof the advisory role of the Peacebuilding Commission, when relevant, on overall \npolicy matters pertaining to special political missions, \n \nReaffirming the principles of impartiality, consent of the parties, national \nownership and national responsibility, and stressing the significance of the views of \nand dialogue with countries hosting special political missions, \n \nRecalling the relevant reports on the review of arrangements for funding and \nbackstopping special political missions, 1  which addressed the financial and \nadministrative arrangements pertaining to such missions, recognizing that the Fifth \nCommittee is the appropriate Main Committee of the General Assembly entrusted \nwith responsibilities for administrative and budgetary matters, \n \nRecognizing, in this regard, the importance of adequately resourcing the \npeacebuilding components of relevant special political missions, including during \nmission transitions and drawdown, to support the stability and continuity of \npeacebuilding activities, \n \nStressing the need for the United Nations to continue to improve its capabilities \nin the pacific settlement of disputes, including mediation, conflict prevention, conflict \nresolution, peacebuilding and sustaining peace, for the maintenance of international \npeace and security, \n \nAcknowledging the significant increase in the number and complexity of special \npolitical missions and the challenges faced by them, \n \nRecognizing the need for system-wide coherence between special political \nmissions and the United Nations system, and emphasizing the importance of close \ncooperation between special political missions, peacekeeping operations and United \nNations country teams for maintaining sustainable peace, conflict prevention and \nconflict resolution, \n \nRecognizing also the need for special political missions to operate under clear, \ncredible and achievable mandates, including through the articulation of their goals \nand purposes, and the need to review their progress as stipulated in their respective \nmandates, \n \nStressing the need for, as relevant, enhanced coordination and cooperation \nbetween special political missions and concerned regional and subregional \norganizations, particularly leveraging ongoing strategic partnerships, to take concrete \nmeasures to strengthen mechanisms for conflict prevention, management and \nresolution, and emphasizing the need to build and strengthen human and institutional \ncapacities at the national, subregional and regional levels, \n \nRecognizing the importance of efforts towards improving broad geographical \nrepresentation, gender balance and expertise in the composition of all special political \nmissions, and acknowledging the necessity of reducing the overall environmental \nfootprint of relevant special political missions, \n \nRecalling the relevant resolutions on women, peace and security, reaffirming \nthe important role of women in the prevention and resolution of conflicts and in \n__________________ \n \n1  A/66/340 and A/66/7/Add.21. \n\nComprehensive review of special political missions \nA/RES/73/101\n \n3/4\n18-21443 \n \npeacebuilding, and recognizing the importance of the equal and effective participation \nand the full involvement of women at all levels, at all stages and in all aspects of the \npeaceful settlement of disputes, conflict prevention and conflict resolution, \n \nRecalling also the relevant resolutions on youth, peace and security, and \naffirming the important role that youth can play in the prevention and resolution of \nconflicts and as a key aspect of the sustainability, inclusiveness and success of \npeacekeeping and peacebuilding efforts, \n \nNoting the approval of the restructuring of the peace and security architecture \nwithin the Secretariat, particularly the endorsement of the establishment of the new \nDepartment of Political and Peacebuilding Affairs and the Department of Peace \nOperations and of the new single, regional political-operational structure that will be \nshared between both Departments, in accordance with General Assembly resolution \n72/262 C of 5 July 2018, \n \nNoting also that the relevant reform efforts within the United Nations should \nensure a more coordinated approach to strengthen the ability of special political \nmissions to deliver on their mandates and should contribute to ensuring enhanced \naccountability, coherence and effectiveness of special political missions, \n \n1. \nTakes note of the report of the Secretary-General submitted pursuant to \nresolution 72/89;2 \n \n2. \nRequests the Secretary-General to hold regular, inclusive and interactive \ndialogue on the overall policy matters pertaining to special political missions, and \nrequests the Secretariat to reach out to Member States prior to the holding of such \ndialogue to ensure wide and meaningful participation;  \n \n3. \nRespects the purview of the mandate of special political missions, as \nstipulated in the respective relevant resolutions, recognizes the specificity of each \nmandate of such missions, and emphasizes the role of the General Assembly in \ndiscussing the overall policy matters pertaining to special political missions; \n \n4. \nAcknowledges the importance of strong coordination, coherence and \ncooperation of the Security Council and the General Assembly with the Peacebuilding \nCommission, and in this regard notes the intention and recent practice of the Security \nCouncil to regularly request, deliberate and draw upon the specific, strategic and \ntargeted advice of the Commission, including to assist with the longer-term perspective \nrequired for sustaining peace being reflected in the formation, review and drawdown \nof peacekeeping operations and special political missions mandates , in line with \nGeneral Assembly resolution 70/262 and Security Council resolution 2282 (2016); \n \n5. \nRequests the Secretary-General to submit to the General Assembly, at its \nseventy-fourth session, a timely report on the implementation of the present \nresolution regarding the overall policy matters pertaining to special political missions, \nincluding efforts towards improving expertise and effectiveness, transparency, \naccountability, geographical representation, gender perspective and the equal \nparticipation of women, as well as youth participation, and in this regard also requests \nthe Secretary-General to include relevant detailed information on these matters in the \nreport; \n \n6. \nAlso requests the Secretary-General to include in the aforementioned \nreport information on the implementation of the reforms in the Organization in \nrelation to special political missions; \n__________________ \n \n2  A/73/337. \n\nA/RES/73/101 \nComprehensive review of special political missions\n \n18-21443\n4/4 \n \n \n7. \nDecides to include in the provisional agenda of its seventy-fourth session \nthe item entitled \u201cComprehensive review of special political missions\u201d and to \nconsider the above-mentioned report of the Secretary-General under that item.  \n \n48th plenary meeting  \n7 December 2018 \n \n",
  "paragraphs": {
    "1": "Takes note of the report of the Secretary-General submitted pursuant to resolution 72/89;2",
    "2": "Requests the Secretary-General to hold regular, inclusive and interactive dialogue on the overall policy matters pertaining to special political missions, and requests the Secretariat to reach out to Member States prior to the holding of such dialogue to ensure wide and meaningful participation;",
    "3": "Respects the purview of the mandate of special political missions, as stipulated in the respective relevant resolutions, recognizes the specificity of each mandate of such missions, and emphasizes the role of the General Assembly in discussing the overall policy matters pertaining to special political missions;",
    "4": "Acknowledges the importance of strong coordination, coherence and cooperation of the Security Council and the General Assembly with the Peacebuilding Commission, and in this regard notes the intention and recent practice of the Security Council to regularly request, deliberate and draw upon the specific, strategic and targeted advice of the Commission, including to assist with the longer-term perspective required for sustaining peace being reflected in the formation, review and drawdown of peacekeeping operations and special political missions mandates , in line with General Assembly resolution 70/262 and Security Council resolution 2282 (2016);",
    "5": "Requests the Secretary-General to submit to the General Assembly, at its seventy-fourth session, a timely report on the implementation of the present resolution regarding the overall policy matters pertaining to special political missions, including efforts towards improving expertise and effectiveness, transparency, accountability, geographical representation, gender perspective and the equal participation of women, as well as youth participation, and in this regard also requests the Secretary-General to include relevant detailed information on these matters in the report;",
    "6": "Also requests the Secretary-General to include in the aforementioned report information on the implementation of the reforms in the Organization in relation to special political missions;",
    "7": "Decides to include in the provisional agenda of its seventy-fourth session the item entitled \u201cComprehensive review of special political missions\u201d and to consider the above-mentioned report of the Secretary-General under that item."
  },
  "agenda_items": [
    "Item 57"
  ],
  "symbol_references": []
}