{
  "symbol": "A/RES/72/43",
  "filename": "A_RES_72_43.pdf",
  "title": "72/43. Implementation of the Convention on the Prohibition of the Development, Production, Stockpiling and Use of Chemical Weapons and on Their Destruction",
  "text": "United Nations \nA/RES/72/43\n \n \nGeneral Assembly \nDistr.: General \n12 December 2017 \n \n17-21720 (E)    141217 \n*1721720* \n \n \nSeventy-second session \nAgenda item 99 (l) \n \n \n \n \n Resolution adopted by the General Assembly \non 4 December 2017 \n \n \n \n \n[on the report of the First Committee (A/72/409)] \n \n \n \n72/43. Implementation of the Convention on the Prohibition of the \nDevelopment, Production, Stockpiling and Use of Chemical \nWeapons and on Their Destruction \n \n \n \nThe General Assembly,  \n \nRecalling its previous resolutions on the subject of chemical weapons, in \nparticular resolution 71/69 of 5 December 2016, \n \nDetermined to achieve the effective prohibition of the development, \nproduction, acquisition, transfer, stockpiling and use of chemical weapons and their \ndestruction, \n \nReaffirming its strong support for the Convention on the Prohibition of the \nDevelopment, Production, Stockpiling and Use of Chemical Weapons and on Their \nDestruction1 and for the Organisation for the Prohibition of Chemical Weapons on \nthe twentieth anniversary of the entry into force of the Convention and its deep \nappreciation of the Organisation, which was awarded the Nobel Peace Prize for \n2013 for its extensive efforts to eliminate chemical weapons, \n \nRe-emphasizing its unequivocal support for the decision of the Director \nGeneral of the Organisation for the Prohibition of Chemical Weapons to continue \nthe mission to establish the facts surrounding the allegations of the use of chemical \nweapons, including toxic chemicals, for hostile purposes in the Syrian Arab \nRepublic, while stressing that the safety and security of mission personnel remains \nthe top priority, and recalling the continuation of the work, pursuant to Security \nCouncil resolutions 2235 (2015) of 7 August 2015 and 2319 (2016) of 17 November \n2016, of the Joint Investigative Mechanism of the Organisation for the Prohibition \nof Chemical Weapons and the United Nations, which was established to identify to \nthe greatest extent feasible individuals, entities, groups or Governments that were \nperpetrators, organizers, sponsors or otherwise involved in the use of chemicals as \n__________________ \n \n1  United Nations, Treaty Series, vol. 1974, No. 33757. \n\nA/RES/72/43 \nImplementation of the Convention on the Prohibition of the Development, Production,\nStockpiling and Use of Chemical Weapons and on Their Destruction\n \n17-21720 \n2/5 \n \nweapons, including chlorine or any other toxic chemical, in the Syrian Arab \nRepublic, where the fact-finding mission of the Organisation for the Prohibition of \nChemical Weapons determined that a specific incident in the Syrian Arab Republic \ninvolved or likely involved the use of chemicals as weapons, \n \nReaffirming the importance of the outcome of the Third Special Session of the \nConference of the States Parties to Review the Operation of the Chemical Weapons \nConvention, held in The Hague from 8 to 19 April 2013 (the Third Review \nConference), including its consensus final report, in which the Conference \naddressed all aspects of the Convention and made important recommendations on its \ncontinued implementation, \n \nEmphasizing that the Third Review Conference welcomed the fact that the \nConvention is a unique multilateral agreement banning an entire category of \nweapons of mass destruction in a non-discriminatory and verifiable manner under \nstrict and effective international control and noted with satisfaction that the \nConvention continues to be a remarkable success and an example of effective \nmultilateralism, \n \nConvinced that the Convention, 20 years after its entry into force, has \nreinforced its role as the international norm against chemical weapons, and that it \nconstitutes a major contribution to:  \n \n(a) \nInternational peace and security,  \n \n(b) \nEliminating chemical weapons and preventing their re-emergence,  \n \n(c) \nThe ultimate objective of general and complete disarmament under strict \nand effective international control,  \n \n(d) \nExcluding completely, for the sake of all mankind, the possibility of the \nuse of chemical weapons,  \n \n(e) \nPromoting international cooperation and exchange in scientific and \ntechnical information in the field of chemical activities among States parties for \npeaceful purposes in order to enhance the economic and technological development \nof all States parties,  \n \n1. \nReaffirms its condemnation in the strongest possible terms of the use of \nchemical weapons by anyone under any circumstances, emphasizing that any use of \nchemical weapons anywhere, at any time, by anyone, under any circumstances is \nunacceptable and is and would be a violation of international law and expressing its \nstrong conviction that those individuals responsible for the use of chemical weapons \nmust and should be held accountable; \n \n2. \nCondemns in the strongest possible terms the use of chemical weapons as \nreported by the Joint Investigative Mechanism of the Organisation for the \nProhibition of Chemical Weapons and the United Nations in: \n \n(a) \nIts reports of 24 August 20162 and 21 October 2016,3 which concluded \nthat there was sufficient information to determine that the Syrian Arab Armed \nForces were responsible for the attacks which released toxic substances in \nTalmenes, Syrian Arab Republic, on 21 April 2014, in Sarmin, Syrian Arab \nRepublic, on 16 March 2015, and in Qmenas, Syrian Arab Republic, also on \n16 March 2015, and that the so-called \u201cIslamic State in Iraq and the Levant\u201d used \nsulfur mustard in Marea, Syrian Arab Republic, on 21 August 2015; and \n__________________ \n \n2  See S/2016/738/Rev.1. \n \n3  See S/2016/888. \n\nImplementation of the Convention on the Prohibition of the Development, Production, \nStockpiling and Use of Chemical Weapons and on Their Destruction \nA/RES/72/43\n \n3/5 \n17-21720 \n \n \n(b) \nIts report of 26 October 2017,4 which concluded that there was sufficient \ninformation to be confident that Islamic State in Iraq and the Levant was \nresponsible for the use of sulfur mustard at Umm Hawsh on 15 and 16 September \n2016 and that the Syrian Arab Republic was responsible for the release of sarin at \nKhan Shaykhun on 4 April 2017; \nand demands that the perpetrators immediately desist from any further use of \nchemical weapons; \n \n3. \nReiterates the grave concern expressed by the Executive Council of the \nOrganisation for the Prohibition of Chemical Weapons in its decision EC-84/DEC.8 \nof 9 March 2017 that, according to statements by the Government of Malaysia, a \nchemical weapon \u2013 the Schedule 1 nerve agent VX \u2013 was used in a fatal incident on \n13 February 2017 at Kuala Lumpur International Airport 2; \n \n4. \nEmphasizes that the universality of the Convention on the Prohibition of \nthe Development, Production, Stockpiling and Use of Chemical Weapons and on \nTheir Destruction1 is essential to achieving its object and purpose and to enhancing \nthe security of States parties, as well as to international peace and security, \nunderlines the fact that the objectives of the Convention will not be fully realized as \nlong as there remains even a single State not party to the Convention that could \npossess or acquire such weapons, and calls upon all States that have not yet done so \nto become parties to the Convention without delay; \n \n5. \nUnderlines the fact that the full, effective and non-discriminatory \nimplementation of all articles of the Convention makes a major contribution to \ninternational peace and security through the elimination of existing stockpiles of \nchemical weapons and the prohibition of their acquisition and use, and provides for \nassistance and protection in the event of use or threat of use of chemical weapons \nand for international cooperation for peaceful purposes in the field of chemical \nactivities; \n \n6. \nNotes the impact of scientific and technological progress on the effective \nimplementation of the Convention and the importance for the Organisation for the \nProhibition of Chemical Weapons and its policymaking organs of taking due \naccount of such developments; \n \n7. \nReaffirms that the obligation of the States parties to complete the \ndestruction of chemical weapons stockpiles and the destruction or conversion of \nchemical weapons production facilities in accordance with the provisions of the \nConvention and the Annex on Implementation and Verification (Verification Annex) \nand under the verification of the Technical Secretariat of the Organisation for the \nProhibition of Chemical Weapons is essential for the realization of the object and \npurpose of the Convention;  \n \n8. \nStresses the importance to the Convention that all possessors of chemical \nweapons, chemical weapons production facilities or chemical weapons development \nfacilities, including previously declared possessor States, should be among the \nStates parties to the Convention, and welcomes progress to that end; \n \n9. \nRecalls that the Third Special Session of the Conference of the States \nParties to Review the Operation of the Chemical Weapons Convention expressed \nconcern regarding the statement made by the Director General of the Organisation \nfor the Prohibition of Chemical Weapons in his report to the Executive Council of \nthe Organisation at its sixty-eighth session, provided in accordance with paragraph 2 \nof decision C-16/DEC.11 of 1 December 2011 adopted by the Conference of the \nStates Parties at its sixteenth session, that three possessor States parties, namely, \n__________________ \n \n4  See S/2017/904. \n\nA/RES/72/43 \nImplementation of the Convention on the Prohibition of the Development, Production,\nStockpiling and Use of Chemical Weapons and on Their Destruction\n \n17-21720 \n4/5 \n \nLibya, the Russian Federation and the United States of America, had been unable to \nfully meet the final extended deadline of 29 April 2012 for the destruction of their \nchemical weapons stockpiles, and also expressed determination that the destruction \nof all categories of chemical weapons should be completed in the shortest time \npossible in accordance with the provisions of the Convention and the Verification \nAnnex, and with the full application of the relevant decisions that have been taken; \n \n10. Welcomes the confirmation by the Director General of the Organisation \nfor the Prohibition of Chemical Weapons expressed in his report of 5 October 2017,5 \nbased upon information received from the Russian Federation and independent \ninformation received from the inspectors of the Organisation, regarding the \ncompletion of the full destruction of chemical weapons declared by the Russian \nFederation; \n \n11. \nAlso welcomes the ongoing progress related to the destruction of Libya\u2019s \nremaining category 2 chemical weapons outside the territory of Libya in line with \nthe relevant Executive Council decisions; \n \n12. Notes with concern that, along with the threat of the possible production, \nacquisition and use of chemical weapons by States, the international community \nalso faces the danger of the production, acquisition and use of chemical weapons by \nnon-State actors, including terrorists, concerns which have highlighted the necessity \nof achieving universal adherence to the Convention, as well as the high level of \nreadiness of the Organisation for the Prohibition of Chemical Weapons, and stresses \nthat the full and effective implementation of all provisions of the Convention, \nincluding those on national implementation (article VII) and assistance and \nprotection (article X), constitutes an important contribution to the efforts of the \nUnited Nations in the global fight against terrorism in all its forms and \nmanifestations; \n \n13. Notes that the effective application of the verification system builds \nconfidence in compliance with the Convention by States parties; \n \n14. Stresses the importance of the Organisation for the Prohibition of \nChemical Weapons in verifying compliance with the provisions of the Convention \nas well as in promoting the timely and efficient accomplishment of all its objectives; \n \n15. Expresses grave concern that the Technical Secretariat, as reported by \nthe Director General in his report of 4 October 2017,6 is not able to resolve all \nidentified gaps, inconsistencies and discrepancies in the declaration of the Syrian \nArab Republic and, therefore, cannot fully verify that the Syrian Arab Republic has \nsubmitted a declaration that can be considered accurate and complete in accordance \nwith the Convention or Executive Council decision EC-M-33/DEC.1, and \nunderscores the importance of such full verification; \n \n16. Urges all States parties to the Convention to meet in full and on time \ntheir obligations under the Convention and to support the Organisation for the \nProhibition of Chemical Weapons in its implementation activities; \n \n17. Welcomes the progress made in the national implementation of article VII \nobligations, commends the States parties and the Technical Secretariat for assisting \nother States parties, on request, with the implementation of the follow-up to the plan \nof action regarding article VII obligations, and urges States parties that have not \nfulfilled their obligations under article VII to do so without further delay, in \naccordance with their constitutional processes; \n__________________ \n \n5  EC-86/DG.31. \n \n6  EC-86/DG.30. \n\nImplementation of the Convention on the Prohibition of the Development, Production, \nStockpiling and Use of Chemical Weapons and on Their Destruction \nA/RES/72/43\n \n5/5 \n17-21720 \n \n \n18. Emphasizes the continuing relevance and importance of the provisions of \narticle X of the Convention, welcomes the activities of the Organisation for the \nProhibition of Chemical Weapons in relation to assistance and protection against \nchemical weapons, supports further efforts by both States parties and the Technical \nSecretariat to promote a high level of readiness to respond to chemical weapons \nthreats as articulated in article X, and welcomes the effectiveness and efficiency of \nthe increased focus on making full use of regional and subregional capacities and \nexpertise, including taking advantage of established training centres; \n \n19. Reaffirms that the provisions of the Convention shall be implemented in \na manner that avoids hampering the economic or technological development of \nStates parties and international cooperation in the field of chemical activities for \npurposes not prohibited under the Convention, including the international exchange \nof scientific and technical information, and chemicals and equipment for the \nproduction, processing or use of chemicals for purposes not prohibited under the \nConvention; \n \n20. Emphasizes the importance of the provisions of article XI of the \nConvention relating to the economic and technological development of States \nparties, recalls that the full, effective and non-discriminatory implementation of \nthose provisions contributes to universality, and reaffirms the undertaking of the \nStates parties to foster international cooperation for peaceful purposes in the field of \nchemical activities of the States parties and the importance of that cooperation and \nits contribution to the promotion of the Convention as a whole; \n \n21. Notes with appreciation the ongoing work of the Organisation for the \nProhibition of Chemical Weapons to achieve the object and purpose of the \nConvention, to ensure the full implementation of its provisions, including those for \ninternational verification of compliance with it, and to provide a forum for \nconsultation and cooperation among States parties; \n \n22. Stresses the importance of the preparatory work related to the Fourth \nSpecial Session of the Conference of the States Parties to Review the Operation of \nthe Chemical Weapons Convention; \n \n23. Welcomes the cooperation between the United Nations and the \nOrganisation for the Prohibition of Chemical Weapons within the framework of the \nrelationship agreement between the United Nations and the Organisation, 7 in \naccordance with the provisions of the Convention; \n \n24. Decides to include in the provisional agenda of its seventy-third session, \nunder the item entitled \u201cGeneral and complete disarmament\u201d, the sub-item entitled \n\u201cImplementation of the Convention on the Prohibition of the Development, \nProduction, Stockpiling and Use of Chemical Weapons and on Their Destruction\u201d.  \n \n62nd plenary meeting  \n4 December 2017 \n \n__________________ \n \n7  United Nations, Treaty Series, vol. 2160, No. 1240. \n",
  "paragraphs": {
    "1": "Reaffirms its condemnation in the strongest possible terms of the use of chemical weapons by anyone under any circumstances, emphasizing that any use of chemical weapons anywhere, at any time, by anyone, under any circumstances is unacceptable and is and would be a violation of international law and expressing its strong conviction that those individuals responsible for the use of chemical weapons must and should be held accountable;",
    "2": "Condemns in the strongest possible terms the use of chemical weapons as reported by the Joint Investigative Mechanism of the Organisation for the Prohibition of Chemical Weapons and the United Nations in: (a) Its reports of 24 August 20162 and 21 October 2016,3 which concluded that there was sufficient information to determine that the Syrian Arab Armed Forces were responsible for the attacks which released toxic substances in Talmenes, Syrian Arab Republic, on 21 April 2014, in Sarmin, Syrian Arab Republic, on 16 March 2015, and in Qmenas, Syrian Arab Republic, also on 16 March 2015, and that the so-called \u201cIslamic State in Iraq and the Levant\u201d used sulfur mustard in Marea, Syrian Arab Republic, on 21 August 2015; and __________________ 2 See S/2016/738/Rev.1. 3 See S/2016/888. Implementation of the Convention on the Prohibition of the Development, Production, Stockpiling and Use of Chemical Weapons and on Their Destruction A/RES/72/43 3/5 17-21720 (b) Its report of 26 October 2017,4 which concluded that there was sufficient information to be confident that Islamic State in Iraq and the Levant was responsible for the use of sulfur mustard at Umm Hawsh on 15 and 16 September 2016 and that the Syrian Arab Republic was responsible for the release of sarin at Khan Shaykhun on 4 April 2017; and demands that the perpetrators immediately desist from any further use of chemical weapons;",
    "3": "Reiterates the grave concern expressed by the Executive Council of the Organisation for the Prohibition of Chemical Weapons in its decision EC-84/DEC.8 of 9 March 2017 that, according to statements by the Government of Malaysia, a chemical weapon \u2013 the Schedule 1 nerve agent VX \u2013 was used in a fatal incident on 13 February 2017 at Kuala Lumpur International Airport 2;",
    "4": "Emphasizes that the universality of the Convention on the Prohibition of the Development, Production, Stockpiling and Use of Chemical Weapons and on Their Destruction1 is essential to achieving its object and purpose and to enhancing the security of States parties, as well as to international peace and security, underlines the fact that the objectives of the Convention will not be fully realized as long as there remains even a single State not party to the Convention that could possess or acquire such weapons, and calls upon all States that have not yet done so to become parties to the Convention without delay;",
    "5": "Underlines the fact that the full, effective and non-discriminatory implementation of all articles of the Convention makes a major contribution to international peace and security through the elimination of existing stockpiles of chemical weapons and the prohibition of their acquisition and use, and provides for assistance and protection in the event of use or threat of use of chemical weapons and for international cooperation for peaceful purposes in the field of chemical activities;",
    "6": "Notes the impact of scientific and technological progress on the effective implementation of the Convention and the importance for the Organisation for the Prohibition of Chemical Weapons and its policymaking organs of taking due account of such developments;",
    "7": "Reaffirms that the obligation of the States parties to complete the destruction of chemical weapons stockpiles and the destruction or conversion of chemical weapons production facilities in accordance with the provisions of the Convention and the Annex on Implementation and Verification (Verification Annex) and under the verification of the Technical Secretariat of the Organisation for the Prohibition of Chemical Weapons is essential for the realization of the object and purpose of the Convention;",
    "8": "Stresses the importance to the Convention that all possessors of chemical weapons, chemical weapons production facilities or chemical weapons development facilities, including previously declared possessor States, should be among the States parties to the Convention, and welcomes progress to that end;",
    "9": "Recalls that the Third Special Session of the Conference of the States Parties to Review the Operation of the Chemical Weapons Convention expressed concern regarding the statement made by the Director General of the Organisation for the Prohibition of Chemical Weapons in his report to the Executive Council of the Organisation at its sixty-eighth session, provided in accordance with paragraph 2 of decision C-16/DEC.11 of 1 December 2011 adopted by the Conference of the States Parties at its sixteenth session, that three possessor States parties, namely, __________________ 4 See S/2017/904. A/RES/72/43 Implementation of the Convention on the Prohibition of the Development, Production, Stockpiling and Use of Chemical Weapons and on Their Destruction 17-21720 4/5 Libya, the Russian Federation and the United States of America, had been unable to fully meet the final extended deadline of 29 April 2012 for the destruction of their chemical weapons stockpiles, and also expressed determination that the destruction of all categories of chemical weapons should be completed in the shortest time possible in accordance with the provisions of the Convention and the Verification Annex, and with the full application of the relevant decisions that have been taken;",
    "10": "Welcomes the confirmation by the Director General of the Organisation for the Prohibition of Chemical Weapons expressed in his report of 5 October 2017,5 based upon information received from the Russian Federation and independent information received from the inspectors of the Organisation, regarding the completion of the full destruction of chemical weapons declared by the Russian Federation;",
    "11": "Also welcomes the ongoing progress related to the destruction of Libya\u2019s remaining category 2 chemical weapons outside the territory of Libya in line with the relevant Executive Council decisions;",
    "12": "Notes with concern that, along with the threat of the possible production, acquisition and use of chemical weapons by States, the international community also faces the danger of the production, acquisition and use of chemical weapons by non-State actors, including terrorists, concerns which have highlighted the necessity of achieving universal adherence to the Convention, as well as the high level of readiness of the Organisation for the Prohibition of Chemical Weapons, and stresses that the full and effective implementation of all provisions of the Convention, including those on national implementation (article VII) and assistance and protection (article X), constitutes an important contribution to the efforts of the United Nations in the global fight against terrorism in all its forms and manifestations;",
    "13": "Notes that the effective application of the verification system builds confidence in compliance with the Convention by States parties;",
    "14": "Stresses the importance of the Organisation for the Prohibition of Chemical Weapons in verifying compliance with the provisions of the Convention as well as in promoting the timely and efficient accomplishment of all its objectives;",
    "15": "Expresses grave concern that the Technical Secretariat, as reported by the Director General in his report of 4 October 2017,6 is not able to resolve all identified gaps, inconsistencies and discrepancies in the declaration of the Syrian Arab Republic and, therefore, cannot fully verify that the Syrian Arab Republic has submitted a declaration that can be considered accurate and complete in accordance with the Convention or Executive Council decision EC-M-33/DEC.1, and underscores the importance of such full verification;",
    "16": "Urges all States parties to the Convention to meet in full and on time their obligations under the Convention and to support the Organisation for the Prohibition of Chemical Weapons in its implementation activities;",
    "17": "Welcomes the progress made in the national implementation of article VII obligations, commends the States parties and the Technical Secretariat for assisting other States parties, on request, with the implementation of the follow-up to the plan of action regarding article VII obligations, and urges States parties that have not fulfilled their obligations under article VII to do so without further delay, in accordance with their constitutional processes; __________________ 5 EC-86/DG.31. 6 EC-86/DG.30. Implementation of the Convention on the Prohibition of the Development, Production, Stockpiling and Use of Chemical Weapons and on Their Destruction A/RES/72/43 5/5 17-21720",
    "18": "Emphasizes the continuing relevance and importance of the provisions of article X of the Convention, welcomes the activities of the Organisation for the Prohibition of Chemical Weapons in relation to assistance and protection against chemical weapons, supports further efforts by both States parties and the Technical Secretariat to promote a high level of readiness to respond to chemical weapons threats as articulated in article X, and welcomes the effectiveness and efficiency of the increased focus on making full use of regional and subregional capacities and expertise, including taking advantage of established training centres;",
    "19": "Reaffirms that the provisions of the Convention shall be implemented in a manner that avoids hampering the economic or technological development of States parties and international cooperation in the field of chemical activities for purposes not prohibited under the Convention, including the international exchange of scientific and technical information, and chemicals and equipment for the production, processing or use of chemicals for purposes not prohibited under the Convention;",
    "20": "Emphasizes the importance of the provisions of article XI of the Convention relating to the economic and technological development of States parties, recalls that the full, effective and non-discriminatory implementation of those provisions contributes to universality, and reaffirms the undertaking of the States parties to foster international cooperation for peaceful purposes in the field of chemical activities of the States parties and the importance of that cooperation and its contribution to the promotion of the Convention as a whole;",
    "21": "Notes with appreciation the ongoing work of the Organisation for the Prohibition of Chemical Weapons to achieve the object and purpose of the Convention, to ensure the full implementation of its provisions, including those for international verification of compliance with it, and to provide a forum for consultation and cooperation among States parties;",
    "22": "Stresses the importance of the preparatory work related to the Fourth Special Session of the Conference of the States Parties to Review the Operation of the Chemical Weapons Convention;",
    "23": "Welcomes the cooperation between the United Nations and the Organisation for the Prohibition of Chemical Weapons within the framework of the relationship agreement between the United Nations and the Organisation, 7 in accordance with the provisions of the Convention;",
    "24": "Decides to include in the provisional agenda of its seventy-third session, under the item entitled \u201cGeneral and complete disarmament\u201d, the sub-item entitled \u201cImplementation of the Convention on the Prohibition of the Development, Production, Stockpiling and Use of Chemical Weapons and on Their Destruction\u201d. 62nd plenary meeting 4 December 2017 __________________ 7 United Nations, Treaty Series, vol. 2160, No. 1240."
  },
  "agenda_items": [
    "Item 99"
  ],
  "symbol_references": []
}