{
  "symbol": "A/RES/74/143",
  "filename": "A_RES_74_143.pdf",
  "title": "74/143. Torture and other cruel, inhuman or degrading treatment or punishment",
  "text": "United Nations \nA/RES/74/143\n \n \nGeneral Assembly \nDistr.: General \n22 January 2020 \n \n19-22243 (E)    240120 \n*1922243* \n \n \nSeventy-fourth session \nAgenda item 70 (a) \nPromotion and protection of human rights: implementation \nof human rights instruments \n \n \n \n \n Resolution adopted by the General Assembly \non 18 December 2019 \n \n \n \n \n[on the report of the Third Committee (A/74/399/Add.1)] \n \n \n 74/143. Torture and other cruel, inhuman or degrading treatment \nor punishment \n \n \n \n \nThe General Assembly, \n \nReaffirming its previous resolutions on torture and other cruel, inhuman or \ndegrading treatment or punishment, \n \nReaffirming also that no one shall be subjected to torture or other cruel, inhuman \nor degrading treatment or punishment, \n \nRecalling that freedom from torture and other cruel, inhuman or degrading \ntreatment or punishment is a non-derogable right under international law, including \ninternational human rights law and international humanitarian law, which must be \nrespected and protected under all circumstances, including in times of international \nand non-international armed conflict or disturbance or any other public emergency, \nthat the absolute prohibition of torture and other cruel, inhuman or degrading \ntreatment or punishment is affirmed in relevant international instruments and that \nlegal and procedural safeguards against such acts must not be subject to measures that \nwould circumvent this right,  \n \nRecalling also that the prohibition of torture is a peremptory norm of \ninternational law without territorial limitation and that international, regional and \ndomestic courts have recognized the prohibition of cruel, inhuman or degrading \ntreatment or punishment as customary international law, \n \nRecalling further the definition of torture contained in article 1 of the \nConvention against Torture and Other Cruel, Inhuman or Degrading Treatment or \nPunishment1 and the obligation of States to abide strictly by the definition of torture \ncontained in article 1, without prejudice to any international instrument or national \n__________________ \n \n1  United Nations, Treaty Series, vol. 1465, No. 24841. \n\nA/RES/74/143 \nTorture and other cruel, inhuman or\ndegrading treatment or punishment\n \n19-22243\n2/9 \n \nlegislation which contains or may contain provisions of wider application, and \nemphasizing the importance of properly interpreting and implementing the \nobligations of States with respect to torture and other cruel, inhuman or degrading \ntreatment or punishment, \n \nRecognizing that States must protect the rights of those facing criminal \nsentences, including the death penalty and life imprisonment without the possibility \nof parole, and of other affected persons in accordance with their international \nobligations, \n \nNoting that, under the Geneva Conventions of 1949, 2  torture or inhuman \ntreatment are a grave breach and that, under the statute of the International Tribunal \nfor the Prosecution of Persons Responsible for Serious Violations of International \nHumanitarian Law Committed in the Territory of the Former Yugoslavia since 1991, \nthe statute of the International Criminal Tribunal for the Prosecution of Persons \nResponsible for Genocide and Other Serious Violations of International Humanitarian \nLaw Committed in the Territory of Rwanda and Rwandan Citizens Responsible for \nGenocide and Other Such Violations Committed in the Territory of Neighbouring \nStates between 1 January and 31 December 1994 and the Rome Statute of the \nInternational Criminal Court,3 acts of torture can constitute crimes against humanity \nand, when committed in a situation of armed conflict, constitute war crimes,  \n \nRecognizing the importance of the implementation of the International \nConvention for the Protection of All Persons from Enforced Disappearance, 4 which \nmakes a significant contribution to the prevention and prohibition of torture, \nincluding by prohibiting secret places of detention and by ensuring legal and \nprocedural safeguards for persons deprived of their liberty, and encouraging all States \nthat have not done so to consider signing, ratifying or acceding to the Convention, \n \nRecognizing also that the prevalence of corruption, including in law \nenforcement and justice systems, can have a negative impact on the fight against \ntorture and other cruel, inhuman or degrading treatment or punishment, including by \neroding fundamental safeguards and preventing victims of torture and other cruel, \ninhuman or degrading treatment or punishment from effectively seeking justice, \nredress and compensation through the justice system,  \n \nRecognizing further that the effective implementation of the absolute \nprohibition of torture and other cruel, inhuman or degrading treatment or punishment \npromotes, inter alia, peaceful and inclusive societies for sustainable development, \ncontributes to access to justice for all, builds effective, accountable and inclusive \ninstitutions at all levels and contributes to achieving the Sustainable Development \nGoals,5 \n \nCommending the persistent efforts of civil society organizations, including \nnon-governmental organizations, as well as national human rights institutions and \nnational preventive mechanisms, and the considerable network of centres for the \nrehabilitation of victims of torture, to prevent and combat torture and to alleviate the \nsuffering of victims of torture, \n \nDeeply concerned about all acts which can amount to torture and other cruel, \ninhuman or degrading treatment or punishment committed against persons exercising \ntheir rights of peaceful assembly and freedom of expression in all regions of the \nworld, \n__________________ \n \n2  Ibid., vol. 75, Nos. 970\u2013973. \n \n3  Ibid., vol. 2187, No. 38544. \n \n4  Ibid., vol. 2716, No. 48088. \n \n5  See resolution 70/1. \n\nTorture and other cruel, inhuman or \ndegrading treatment or punishment \nA/RES/74/143\n \n3/9\n19-22243 \n \n \n1. \nCondemns all forms of torture and other cruel, inhuman or degrading \ntreatment or punishment, including through intimidation, which are and shall remain \nprohibited at any time and in any place whatsoever and can thus never be justified, \nand calls upon all States to implement fully the absolute and non-derogable \nprohibition of torture and other cruel, inhuman or degrading treatment or punishment; \n \n2. \nAlso condemns any action or attempt by States or public officials to \nlegalize, authorize or acquiesce in torture and other cruel, inhuman or degrading \ntreatment or punishment under any circumstances, including on grounds of national \nsecurity and counter-terrorism or through judicial decisions, and urges States to \nensure the accountability of those responsible for all such acts; \n \n3. \nStresses that States must neither punish personnel for not obeying orders \nto commit or conceal acts amounting to torture or other cruel, inhuman or degrading \ntreatment or punishment nor allow pleas of respondeat superior as a criminal defence \nin cases in which such orders were obeyed; \n \n4. \nEmphasizes that acts of torture or inhuman treatment are grave breaches \nof the Geneva Conventions of 1949,2 that acts of torture and cruel treatment in armed \nconflict are serious violations of international humanitarian law and in this regard \nconstitute war crimes, that acts of torture can constitute crimes against humanity and \nthat the perpetrators of all acts of torture must be prosecuted and punished, and in this \nregard notes the efforts of the International Criminal Court to end impunity by seeking \nto ensure accountability and punishment of perpetrators of such acts, in accordance \nwith the Rome Statute,3 bearing in mind its principle of complementarity, and \nencourages States that have not yet done so to consider ratifying or acceding to the \nRome Statute; \n \n5. \nAlso emphasizes that States must take persistent, determined and effective \nmeasures to prevent and combat all acts of torture and other cruel, inhuman or \ndegrading treatment or punishment, stresses that all acts of torture must be made \noffences under national criminal law punishable by appropriate penalties that take \ninto account their grave nature, and calls upon States to prohibit under national law \nacts constituting cruel, inhuman or degrading treatment or punishment; \n \n6. \nStresses that States must ensure that no statement that is established to \nhave been made as a result of torture is invoked as evidence in any proceedings, \nexcept against a person accused of torture as evidence that the statement was made, \nurges States to extend that prohibition to statements made as a result of cruel, inhuman \nor degrading treatment or punishment, and recognizes that adequate corroboration of \nstatements, including confessions, used as evidence in any proceedings constitutes \none safeguard for the prevention of torture and other cruel, inhuman or degrading \ntreatment or punishment; \n \n7. \nUrges States not to expel, return (\u201crefouler\u201d), extradite or in any other way \ntransfer a person to another State where there are substantial grounds for believing \nthat the person would be in danger of being subjected to torture, stresses the \nimportance of effective legal and procedural safeguards in this regard, and recognizes \nthat diplomatic assurances, where given, do not release States from their obligations \nunder international human rights, humanitarian and refugee law, in particular the \nprinciple of non-refoulement; \n \n8. \nRecalls that, for the purpose of determining whether there are such \ngrounds, the competent authorities shall take into account all relevant considerations, \nincluding, where applicable, the existence in the State concerned of a consistent \npattern of gross, flagrant or mass violations of human rights; \n \n9. \nUrges States to ensure that border control operations and reception centres \nfully comply with international human rights obligations and commitments, including \n\nA/RES/74/143 \nTorture and other cruel, inhuman or\ndegrading treatment or punishment\n \n19-22243\n4/9 \n \nthe prohibition of torture and other cruel, inhuman or degrading treatment or \npunishment; \n \n10. Calls upon all States to adopt and implement effective measures to prevent \ntorture and other cruel, inhuman or degrading treatment or punishment, in particular \nin the context of the use of force by law enforcement officials and in places of \ndetention and other places where persons are deprived of their liberty, including legal \nand procedural safeguards, as well as to ensure that the competent judicial or \ndisciplinary authorities and, where relevant, the prosecution can effectively ensure \ncompliance with such safeguards; \n \n11. \nRecalls its resolution 43/173 of 9 December 1988 on the Body of \nPrinciples for the Protection of All Persons under Any Form of Detention or \nImprisonment, and in this context stresses that ensuring that any individual arrested \nor detained is promptly brought before a judge or other independent judicial officer \nin person, and permitting prompt and regular medical care and legal counsel \nthroughout all stages of detention, as well as visits by family members and \nindependent monitoring mechanisms, are effective measures for the prevention of \ntorture and other cruel, inhuman or degrading treatment or punishment; \n \n12. Stresses the obligation of States to ensure that anyone who is arrested is \ninformed at the time of arrest of the reasons for the arrest and is promptly informed \nof any charges against him or her, in accessible forms of communication, including \nin a language that he or she understands, and is provided with information about, and \nan explanation of, his or her rights; \n \n13. Calls upon States to include education and information regarding the \nabsolute prohibition of torture and other cruel, inhuman or degrading treatment or \npunishment in the training of law enforcement personnel and other personnel \nauthorized to resort to force or who may be involved in the custody, interrogation or \ntreatment of any individual subjected to any form of arrest, detention or \nimprisonment, which may include training on the use of force, all available modern \nscientific methods for the investigation of crimes and the critical importance of \nreporting instances of torture or other cruel, inhuman or degrading treatment or \npunishment to superior authorities; \n \n14. Emphasizes that States shall keep under systematic review interrogation \nrules, instructions, methods and practices, as well as arrangements for the custody \nand treatment of persons subjected to any form of arrest, detention or imprisonment \nin any territory under their jurisdiction, and stresses the importance of the \ndevelopment of domestic guidelines on the conduct of interrogations, with a view to \npreventing any cases of torture and other cruel, inhuman or degrading treatment or \npunishment; \n \n15. Welcomes the collaboration between practitioners, experts and other \nrelevant stakeholders on the elaboration of a set of universal standards for \nnon-coercive \ninterviewing \nmethods \nand \nprocedural \nsafeguards \naimed \nat \noperationalizing the presumption of innocence, improving effective policing and \nensuring that no person is subjected to torture or other cruel, inhuman or degrading \ntreatment or punishment during questioning, and encourages the continued \ncollaboration between practitioners, experts and other relevant stakeholders towards \nthis goal;  \n \n16. Encourages all States to take appropriate effective legislative, \nadministrative, judicial and other measures to apply the United Nations Standard \nMinimum Rules for the Treatment of Prisoners (the Nelson Mandela Rules); 6 \n__________________ \n \n6  Resolution 70/175, annex. \n\nTorture and other cruel, inhuman or \ndegrading treatment or punishment \nA/RES/74/143\n \n5/9\n19-22243 \n \n \n17. Reminds all States that prolonged incommunicado detention or detention \nin secret places can facilitate the perpetration of torture and other cruel, inhuman or \ndegrading treatment or punishment and can in itself constitute a form of such \ntreatment, and urges all States to respect the safeguards concerning the liberty, \nsecurity and dignity of the person and to ensure that prolonged incommunicado \ndetention and secret places of detention and interrogation are abolished;  \n \n18. Emphasizes that conditions of detention must respect the dignity and \nhuman rights of persons deprived of their liberty, highlights the importance of \nreflecting on this in efforts to promote respect for and protection of the rights of \npersons deprived of their liberty, calls upon States to address and prevent detention \nconditions amounting to torture or other cruel, inhuman or degrading treatment or \npunishment, notes in this regard concerns about solitary confinement, and encourages \nStates to take effective measures to address overcrowding in detention facilities, \nwhich may have an impact on the dignity and human rights of persons deprived of \ntheir liberty;  \n \n19. Welcomes the establishment of national preventive mechanisms to prevent \ntorture and other cruel, inhuman or degrading treatment or punishment, urges States \nto consider establishing, appointing, maintaining or enhancing independent and \neffective mechanisms that have experts with the required capabilities and professional \nknowledge to undertake monitoring visits to places of detention, inter alia, with a \nview to preventing acts of torture or other cruel, inhuman or degrading treatment or \npunishment, and calls upon States parties to the Optional Protocol to the Convention \nagainst Torture and Other Cruel, Inhuman or Degrading Treatment or Punishment 7 to \nfulfil their obligation to designate or establish national preventive mechanisms at the \nlatest one year after the entry into force of the Protocol or of its ratification or \naccession, that are truly independent, composed of experts with the required \ncapabilities and professional knowledge, properly resourced and effective;  \n \n20. Calls upon all States to take appropriate effective legislative, \nadministrative, judicial and other measures to prevent and prohibit the production, \ntrade, export, import and use of equipment that has no practical use other than for the \npurpose of torture or other cruel, inhuman or degrading treatment or punishment;  \n \n21. Urges States, as an important element in preventing and combating torture \nand other cruel, inhuman or degrading treatment or punishment, to ensure that no \nauthority or official orders, applies, permits or tolerates any sanction, reprisal, \nintimidation or other prejudice against any person, group or association, including \npersons deprived of their liberty, for contacting, seeking to contact or having been in \ncontact with any national or international monitoring or preventive body active in the \nprevention and combating of torture and other cruel, inhuman or degrading treatment \nor punishment;  \n \n22. Also urges States to ensure accountability for any act of sanction, reprisal, \nintimidation or other form of unlawful prejudicial conduct against any person, group \nor association, including persons deprived of their liberty, for cooperating, seeking to \ncooperate or having cooperated with any national or international monitoring or \npreventive body active in the prevention and combating of torture and other cruel, \ninhuman or degrading treatment or punishment, by ensuring impartial, prompt, \nindependent and thorough investigations of any alleged act of sanction, reprisal, \nintimidation or other form of unlawful prejudicial conduct; to bring the perpetrators \nto justice; to provide access to effective remedies for victims, in accordance with their \ninternational human rights obligations and commitments; and to prevent any \nrecurrence;  \n__________________ \n \n7  United Nations, Treaty Series, vol. 2375, No. 24841. \n\nA/RES/74/143 \nTorture and other cruel, inhuman or\ndegrading treatment or punishment\n \n19-22243\n6/9 \n \n \n23. Calls upon States parties to the Convention against Torture and Other \nCruel, Inhuman or Degrading Treatment or Punishment1 to fulfil their obligation to \nsubmit for prosecution or extradite those alleged to have committed acts of torture, \nregardless of where such acts were committed, if the alleged offender is present in \nany territory under their jurisdiction, and encourages other States also to do so, \nbearing in mind the need to fight impunity;  \n \n24. Encourages States to consider establishing or maintaining appropriate \nnational processes to record allegations of torture and other cruel, inhuman or \ndegrading treatment or punishment and to ensure that such information is accessible \nin accordance with applicable law;  \n \n25. Stresses that an independent, competent domestic authority must promptly, \neffectively and impartially investigate all allegations of torture or other cruel, \ninhuman or degrading treatment or punishment, as well as wherever there is \nreasonable ground to believe that such an act has been committed, and that those who \nencourage, instigate, order, tolerate, acquiesce in, consent to or perpetrate such acts \nmust be held responsible, brought to justice and punished in a manner commensurate \nwith the severity of the offence, including the officials in charge of any place of \ndetention or other place where persons are deprived of their liberty where the \nprohibited act is found to have been committed; \n \n26. Recalls, in this respect, the Principles on the Effective Investigation and \nDocumentation of Torture and Other Cruel, Inhuman or Degrading Treatment or \nPunishment (the Istanbul Principles) 8 as a valuable tool in efforts to prevent and \ncombat torture and the updated set of principles for the protection and promotion of \nhuman rights through action to combat impunity;9 \n \n27. Emphasizes that it is important for law enforcement officials to be able to \nplay their role in safeguarding the right not to be subjected to torture and other cruel, \ninhuman or degrading treatment or punishment, and for States to ensure the proper \nfunctioning of the criminal justice system, in particular by taking effective measures \nto combat corruption, establish proper legal aid programmes and provide for the \nadequate selection, training and remuneration of law enforcement officials;  \n \n28. Encourages all States to ensure that persons charged with torture or other \ncruel, inhuman or degrading treatment or punishment have no involvement in the \ncustody, interrogation or treatment of any person under arrest, detention, \nimprisonment or other deprivation of liberty while such charges are pending and, if \nsuch persons are convicted, after the conviction;  \n \n29. Calls upon all States to adopt a victim-oriented approach10 in the fight \nagainst torture and other cruel, inhuman or degrading treatment or punishment, paying \nspecial attention to the views and needs of victims in policy development and other \nactivities relating to rehabilitation, prevention and accountability for torture;  \n \n30. Also calls upon all States to adopt a gender-responsive approach in the \nfight against torture and other cruel, inhuman or degrading treatment or punishment, \nincluding by taking into consideration the United Nations Rules for the Treatment of \nWomen Prisoners and Non-custodial Measures for Women Offenders (the Bangkok \nRules),11 and to pay special attention to sexual and gender-based violence;  \n \n31. Calls upon States to ensure that the rights of persons who are marginalized \nand most vulnerable, including persons with disabilities, bearing in mind the \n__________________ \n \n8  Resolution 55/89, annex. \n \n9  E/CN.4/2005/102/Add.1. \n \n10  See A/HRC/16/52. \n \n11  Resolution 65/229, annex. \n\nTorture and other cruel, inhuman or \ndegrading treatment or punishment \nA/RES/74/143\n \n7/9\n19-22243 \n \nConvention on the Rights of Persons with Disabilities, 12 are fully integrated into \ntorture prevention and protection, and welcomes the efforts of the Special Rapporteur \nof the Human Rights Council on torture and other cruel, inhuman or degrading \ntreatment or punishment in this regard; \n \n32. Stresses that national legal systems must ensure that victims of torture or \nother cruel, inhuman or degrading treatment or punishment have effective access to \njustice and obtain redress, and that the complainants and witnesses are protected \nagainst all ill-treatment or intimidation as a consequence of making a complaint or \ngiving evidence;  \n \n33. Calls upon States to provide redress for victims of torture or other cruel, \ninhuman or degrading treatment or punishment, encompassing effective remedy and \nadequate, effective and prompt reparation, which should include restitution, fair and \nadequate compensation, rehabilitation, satisfaction and guarantees of non-repetition, \ntaking into full account the specific needs of the victim;  \n \n34. Urges States to ensure that appropriate rehabilitation services are promptly \navailable to all victims without discrimination of any kind and without limitation in \ntime, until the fullest rehabilitation possible has been achieved, and are provided \neither directly by the public health system or through the funding of private \nrehabilitation facilities, including those administered by civil society organizations, \nand to consider making rehabilitation services available to the immediate families or \ndependants of the victims and to persons who have suffered harm while intervening \nto assist victims in distress or to prevent victimization;  \n \n35. Also urges States to establish, maintain, facilitate or support rehabilitation \ncentres or facilities where victims can receive such treatment and where effective \nmeasures for ensuring the safety of their staff and patients are taken;  \n \n36. Urges all States that have not yet done so to become parties to the \nConvention against Torture and the Optional Protocol thereto as a matter of priority;  \n \n37. Urges all States parties to the Convention that have not yet done so to \nmake the declarations provided for in articles 21 and 22 of the Convention concerning \ninter-State and individual communications, to consider the possibility of withdrawing \ntheir reservations to article 20, to notify the Secretary-General of their acceptance of \nthe amendments to articles 17 and 18, with a view to enhancing the effectiveness of \nthe Committee against Torture as soon as possible, and to comply strictly with their \nobligations under the Convention, including, in view of the high number of reports \nnot submitted in time, their obligation to submit reports in accordance with article 19 \nof the Convention, and invites States parties to incorporate a gender perspective and \ninformation concerning persons who are marginalized and most vulnerable, including \nchildren and juveniles and persons with disabilities, when submitting reports to the \nCommittee;  \n \n38. Welcomes the work and the reports of the Committee and of the \nSubcommittee on Prevention of Torture and Other Cruel, Inhuman or Degrading \nTreatment or Punishment, recommends that their reports continue to include \ninformation on the follow-up by States parties to their recommendations, and supports \nthe Committee and the Subcommittee in their efforts to further improve the \neffectiveness of their working methods;  \n \n39. Emphasizes the importance of the Committee and the Subcommittee \nhaving due regard to the principle of non-discrimination, paying particular attention \nto the rights of those who are marginalized, most vulnerable or in vulnerable \n__________________ \n \n12  United Nations, Treaty Series, vol. 2515, No. 44910. \n\nA/RES/74/143 \nTorture and other cruel, inhuman or\ndegrading treatment or punishment\n \n19-22243\n8/9 \n \nsituations, including through a victim-oriented and gender-responsive approach in the \nfight against torture and other cruel, inhuman or degrading treatment or punishment;  \n \n40. Calls upon the United Nations High Commissioner for Human Rights, in \nconformity with her mandate established by the General Assembly in its resolution \n48/141 of 20 December 1993, and other relevant United Nations entities, in \naccordance with their mandates and existing resources, to continue to provide, at the \nrequest of States, advisory services for the prevention of torture and other cruel, \ninhuman or degrading treatment or punishment, including for the preparation of \nnational reports to the Committee, for the implementation of recommendations of the \nCommittee, and for the establishment and operation of national preventive \nmechanisms, as well as technical assistance, including for the development, \nproduction and distribution of teaching materials for this purpose, and further calls \nupon the United Nations High Commissioner for Human Rights to continue to provide \nthe support necessary to enable the Subcommittee to provide advice and assistance to \nStates parties to the Optional Protocol;  \n \n41. Emphasizes the importance of States ensuring proper follow-up to the \nrecommendations and conclusions of the relevant treaty bodies and mechanisms, \nincluding the Committee, the Subcommittee, national preventive mechanisms and the \nSpecial Rapporteur, while recognizing the important role of the universal periodic \nreview, national human rights institutions and other relevant national or regional \nbodies in preventing torture and other cruel, inhuman or degrading treatment or \npunishment;  \n \n42. Takes note with appreciation of the interim report of the Special \nRapporteur addressing the achievements made towards eradicating torture and other \nill-treatment and reflecting on the primary challenges facing the universal \nimplementation of the Convention 13  and of his report contained in document \nA/74/148, encourages him to continue to include, in his recommendations, proposals \non the prevention and investigation of torture and other cruel, inhuman or degrading \ntreatment or punishment, including its gender-based manifestations, requests him to \ncontinue to consider including in his reports information on the follow-up by States \nto his recommendations, visits and communications, including progress made and \nproblems encountered, and on other official contacts, and further encourages future \ncollaboration between practitioners, experts and other relevant stakeholders towards \nthese goals; \n \n43. Calls upon all States to cooperate with and assist the Special Rapporteur \nin the performance of his tasks, to supply all necessary information requested by him, \nto fully and expeditiously respond to and follow up on his urgent appeals, to give \nserious consideration to responding favourably to requests by him to visit their \ncountries and to enter into a constructive dialogue with him on requested visits to \ntheir countries as well as with respect to the follow-up to his recommendations;  \n \n44. Stresses the need for the continued regular exchange of views among the \nCommittee, the Subcommittee, the Special Rapporteur and other relevant United \nNations mechanisms and bodies, as well as for the pursuit of cooperation with \nrelevant United Nations programmes, notably the United Nations crime prevention \nand criminal justice programme, with regional organizations and mechanisms, as \nappropriate, and with civil society organizations, including non-governmental \norganizations, with a view to enhancing further their effectiveness and cooperation \non issues relating to the prevention and eradication of torture by, inter alia, improving \ncoordination;  \n__________________ \n \n13  A/73/207. \n\nTorture and other cruel, inhuman or \ndegrading treatment or punishment \nA/RES/74/143\n \n9/9\n19-22243 \n \n \n45. Requests the Secretary-General to ensure, within the overall budgetary \nframework of the United Nations, the provision of adequate staff and facilities for the \nbodies and mechanisms involved in preventing and combating torture and assisting \nvictims of torture or other cruel, inhuman or degrading treatment or punishment, \nincluding, in particular, the Committee, the Subcommittee and the Special \nRapporteur, commensurate with the strong support expressed by Member States for \npreventing and combating torture and assisting victims of torture, in order to enable \nthem to discharge their mandates in a comprehensive, sustained and effective manner, \nand taking fully into account the specific nature of their mandates; \n \n46. Recognizes the global need for international assistance to victims of \ntorture, stresses the importance of the work of the Board of Trustees of the United \nNations Voluntary Fund for Victims of Torture, appeals to all States and organizations \nto contribute annually to the Fund, preferably with a substantial increase in the level \nof contributions, and welcomes the establishment of and encourages contributions to \nthe Special Fund established by the Optional Protocol to support the implementation \nof the recommendations made by the Subcommittee and of educational programmes \nby the national preventive mechanisms;  \n \n47. Requests the Secretary-General to continue to transmit to all States the \nappeals of the General Assembly for contributions to the Funds, to include the Funds, \non an annual basis, among the programmes for which funds are pledged at the United \nNations Pledging Conference for Development Activities, and to submit to the Human \nRights Council, and to the General Assembly at its seventy-fifth, seventy-sixth and \nseventy-seventh sessions, a report on the operations of the Funds, and encourages the \nChair of the Board of Trustees of the United Nations Voluntary Fund for Victims of \nTorture to continuously raise awareness among States and relevant stakeholders about \nthe overall trends and developments in its operations;  \n \n48. Welcomes and acknowledges the work of the Convention against Torture \nInitiative, launched in March 2014 on the thirtieth anniversary of the adoption of the \nConvention, to achieve the universal ratification and improved implementation of the \nConvention by 2024, as well as related regional initiatives on the prevention and \neradication of torture;  \n \n49. Calls upon all States, the Office of the United Nations High Commissioner \nfor Human Rights and other United Nations bodies and agencies, as well as relevant \nintergovernmental and civil society organizations, including non-governmental \norganizations, to commemorate, on 26 June, the United Nations International Day in \nSupport of Victims of Torture;  \n \n50. Decides to consider at its seventy-fifth, seventy-sixth and seventy-seventh \nsessions the reports of the Secretary-General, including the report on the United \nNations Voluntary Fund for Victims of Torture and the Special Fund established by \nthe Optional Protocol, the report of the Committee, the report of the Subcommittee \nand the interim report of the Special Rapporteur;  \n \n51. Also decides to give its full consideration to the subject matter at its \nseventy-seventh session. \n \n50th plenary meeting \n18 December 2019 \n \n",
  "paragraphs": {
    "1": "Condemns all forms of torture and other cruel, inhuman or degrading treatment or punishment, including through intimidation, which are and shall remain prohibited at any time and in any place whatsoever and can thus never be justified, and calls upon all States to implement fully the absolute and non-derogable prohibition of torture and other cruel, inhuman or degrading treatment or punishment;",
    "2": "Also condemns any action or attempt by States or public officials to legalize, authorize or acquiesce in torture and other cruel, inhuman or degrading treatment or punishment under any circumstances, including on grounds of national security and counter-terrorism or through judicial decisions, and urges States to ensure the accountability of those responsible for all such acts;",
    "3": "Stresses that States must neither punish personnel for not obeying orders to commit or conceal acts amounting to torture or other cruel, inhuman or degrading treatment or punishment nor allow pleas of respondeat superior as a criminal defence in cases in which such orders were obeyed;",
    "4": "Emphasizes that acts of torture or inhuman treatment are grave breaches of the Geneva Conventions of 1949,2 that acts of torture and cruel treatment in armed conflict are serious violations of international humanitarian law and in this regard constitute war crimes, that acts of torture can constitute crimes against humanity and that the perpetrators of all acts of torture must be prosecuted and punished, and in this regard notes the efforts of the International Criminal Court to end impunity by seeking to ensure accountability and punishment of perpetrators of such acts, in accordance with the Rome Statute,3 bearing in mind its principle of complementarity, and encourages States that have not yet done so to consider ratifying or acceding to the Rome Statute;",
    "5": "Also emphasizes that States must take persistent, determined and effective measures to prevent and combat all acts of torture and other cruel, inhuman or degrading treatment or punishment, stresses that all acts of torture must be made offences under national criminal law punishable by appropriate penalties that take into account their grave nature, and calls upon States to prohibit under national law acts constituting cruel, inhuman or degrading treatment or punishment;",
    "6": "Stresses that States must ensure that no statement that is established to have been made as a result of torture is invoked as evidence in any proceedings, except against a person accused of torture as evidence that the statement was made, urges States to extend that prohibition to statements made as a result of cruel, inhuman or degrading treatment or punishment, and recognizes that adequate corroboration of statements, including confessions, used as evidence in any proceedings constitutes one safeguard for the prevention of torture and other cruel, inhuman or degrading treatment or punishment;",
    "7": "Urges States not to expel, return (\u201crefouler\u201d), extradite or in any other way transfer a person to another State where there are substantial grounds for believing that the person would be in danger of being subjected to torture, stresses the importance of effective legal and procedural safeguards in this regard, and recognizes that diplomatic assurances, where given, do not release States from their obligations under international human rights, humanitarian and refugee law, in particular the principle of non-refoulement;",
    "8": "Recalls that, for the purpose of determining whether there are such grounds, the competent authorities shall take into account all relevant considerations, including, where applicable, the existence in the State concerned of a consistent pattern of gross, flagrant or mass violations of human rights;",
    "9": "Urges States to ensure that border control operations and reception centres fully comply with international human rights obligations and commitments, including A/RES/74/143 Torture and other cruel, inhuman or degrading treatment or punishment 19-22243 4/9 the prohibition of torture and other cruel, inhuman or degrading treatment or punishment;",
    "10": "Calls upon all States to adopt and implement effective measures to prevent torture and other cruel, inhuman or degrading treatment or punishment, in particular in the context of the use of force by law enforcement officials and in places of detention and other places where persons are deprived of their liberty, including legal and procedural safeguards, as well as to ensure that the competent judicial or disciplinary authorities and, where relevant, the prosecution can effectively ensure compliance with such safeguards;",
    "11": "Recalls its resolution 43/173 of 9 December 1988 on the Body of Principles for the Protection of All Persons under Any Form of Detention or Imprisonment, and in this context stresses that ensuring that any individual arrested or detained is promptly brought before a judge or other independent judicial officer in person, and permitting prompt and regular medical care and legal counsel throughout all stages of detention, as well as visits by family members and independent monitoring mechanisms, are effective measures for the prevention of torture and other cruel, inhuman or degrading treatment or punishment;",
    "12": "Stresses the obligation of States to ensure that anyone who is arrested is informed at the time of arrest of the reasons for the arrest and is promptly informed of any charges against him or her, in accessible forms of communication, including in a language that he or she understands, and is provided with information about, and an explanation of, his or her rights;",
    "13": "Calls upon States to include education and information regarding the absolute prohibition of torture and other cruel, inhuman or degrading treatment or punishment in the training of law enforcement personnel and other personnel authorized to resort to force or who may be involved in the custody, interrogation or treatment of any individual subjected to any form of arrest, detention or imprisonment, which may include training on the use of force, all available modern scientific methods for the investigation of crimes and the critical importance of reporting instances of torture or other cruel, inhuman or degrading treatment or punishment to superior authorities;",
    "14": "Emphasizes that States shall keep under systematic review interrogation rules, instructions, methods and practices, as well as arrangements for the custody and treatment of persons subjected to any form of arrest, detention or imprisonment in any territory under their jurisdiction, and stresses the importance of the development of domestic guidelines on the conduct of interrogations, with a view to preventing any cases of torture and other cruel, inhuman or degrading treatment or punishment;",
    "15": "Welcomes the collaboration between practitioners, experts and other relevant stakeholders on the elaboration of a set of universal standards for non-coercive interviewing methods and procedural safeguards aimed at operationalizing the presumption of innocence, improving effective policing and ensuring that no person is subjected to torture or other cruel, inhuman or degrading treatment or punishment during questioning, and encourages the continued collaboration between practitioners, experts and other relevant stakeholders towards this goal;",
    "16": "Encourages all States to take appropriate effective legislative, administrative, judicial and other measures to apply the United Nations Standard Minimum Rules for the Treatment of Prisoners (the Nelson Mandela Rules); 6 __________________ 6 Resolution 70/175, annex. Torture and other cruel, inhuman or degrading treatment or punishment A/RES/74/143 5/9 19-22243",
    "17": "Reminds all States that prolonged incommunicado detention or detention in secret places can facilitate the perpetration of torture and other cruel, inhuman or degrading treatment or punishment and can in itself constitute a form of such treatment, and urges all States to respect the safeguards concerning the liberty, security and dignity of the person and to ensure that prolonged incommunicado detention and secret places of detention and interrogation are abolished;",
    "18": "Emphasizes that conditions of detention must respect the dignity and human rights of persons deprived of their liberty, highlights the importance of reflecting on this in efforts to promote respect for and protection of the rights of persons deprived of their liberty, calls upon States to address and prevent detention conditions amounting to torture or other cruel, inhuman or degrading treatment or punishment, notes in this regard concerns about solitary confinement, and encourages States to take effective measures to address overcrowding in detention facilities, which may have an impact on the dignity and human rights of persons deprived of their liberty;",
    "19": "Welcomes the establishment of national preventive mechanisms to prevent torture and other cruel, inhuman or degrading treatment or punishment, urges States to consider establishing, appointing, maintaining or enhancing independent and effective mechanisms that have experts with the required capabilities and professional knowledge to undertake monitoring visits to places of detention, inter alia, with a view to preventing acts of torture or other cruel, inhuman or degrading treatment or punishment, and calls upon States parties to the Optional Protocol to the Convention against Torture and Other Cruel, Inhuman or Degrading Treatment or Punishment 7 to fulfil their obligation to designate or establish national preventive mechanisms at the latest one year after the entry into force of the Protocol or of its ratification or accession, that are truly independent, composed of experts with the required capabilities and professional knowledge, properly resourced and effective;",
    "20": "Calls upon all States to take appropriate effective legislative, administrative, judicial and other measures to prevent and prohibit the production, trade, export, import and use of equipment that has no practical use other than for the purpose of torture or other cruel, inhuman or degrading treatment or punishment;",
    "21": "Urges States, as an important element in preventing and combating torture and other cruel, inhuman or degrading treatment or punishment, to ensure that no authority or official orders, applies, permits or tolerates any sanction, reprisal, intimidation or other prejudice against any person, group or association, including persons deprived of their liberty, for contacting, seeking to contact or having been in contact with any national or international monitoring or preventive body active in the prevention and combating of torture and other cruel, inhuman or degrading treatment or punishment;",
    "22": "Also urges States to ensure accountability for any act of sanction, reprisal, intimidation or other form of unlawful prejudicial conduct against any person, group or association, including persons deprived of their liberty, for cooperating, seeking to cooperate or having cooperated with any national or international monitoring or preventive body active in the prevention and combating of torture and other cruel, inhuman or degrading treatment or punishment, by ensuring impartial, prompt, independent and thorough investigations of any alleged act of sanction, reprisal, intimidation or other form of unlawful prejudicial conduct; to bring the perpetrators to justice; to provide access to effective remedies for victims, in accordance with their international human rights obligations and commitments; and to prevent any recurrence; __________________ 7 United Nations, Treaty Series, vol. 2375, No. 24841. A/RES/74/143 Torture and other cruel, inhuman or degrading treatment or punishment 19-22243 6/9",
    "23": "Calls upon States parties to the Convention against Torture and Other Cruel, Inhuman or Degrading Treatment or Punishment1 to fulfil their obligation to submit for prosecution or extradite those alleged to have committed acts of torture, regardless of where such acts were committed, if the alleged offender is present in any territory under their jurisdiction, and encourages other States also to do so, bearing in mind the need to fight impunity;",
    "24": "Encourages States to consider establishing or maintaining appropriate national processes to record allegations of torture and other cruel, inhuman or degrading treatment or punishment and to ensure that such information is accessible in accordance with applicable law;",
    "25": "Stresses that an independent, competent domestic authority must promptly, effectively and impartially investigate all allegations of torture or other cruel, inhuman or degrading treatment or punishment, as well as wherever there is reasonable ground to believe that such an act has been committed, and that those who encourage, instigate, order, tolerate, acquiesce in, consent to or perpetrate such acts must be held responsible, brought to justice and punished in a manner commensurate with the severity of the offence, including the officials in charge of any place of detention or other place where persons are deprived of their liberty where the prohibited act is found to have been committed;",
    "26": "Recalls, in this respect, the Principles on the Effective Investigation and Documentation of Torture and Other Cruel, Inhuman or Degrading Treatment or Punishment (the Istanbul Principles) 8 as a valuable tool in efforts to prevent and combat torture and the updated set of principles for the protection and promotion of human rights through action to combat impunity;9",
    "27": "Emphasizes that it is important for law enforcement officials to be able to play their role in safeguarding the right not to be subjected to torture and other cruel, inhuman or degrading treatment or punishment, and for States to ensure the proper functioning of the criminal justice system, in particular by taking effective measures to combat corruption, establish proper legal aid programmes and provide for the adequate selection, training and remuneration of law enforcement officials;",
    "28": "Encourages all States to ensure that persons charged with torture or other cruel, inhuman or degrading treatment or punishment have no involvement in the custody, interrogation or treatment of any person under arrest, detention, imprisonment or other deprivation of liberty while such charges are pending and, if such persons are convicted, after the conviction;",
    "29": "Calls upon all States to adopt a victim-oriented approach10 in the fight against torture and other cruel, inhuman or degrading treatment or punishment, paying special attention to the views and needs of victims in policy development and other activities relating to rehabilitation, prevention and accountability for torture;",
    "30": "Also calls upon all States to adopt a gender-responsive approach in the fight against torture and other cruel, inhuman or degrading treatment or punishment, including by taking into consideration the United Nations Rules for the Treatment of Women Prisoners and Non-custodial Measures for Women Offenders (the Bangkok Rules),11 and to pay special attention to sexual and gender-based violence;",
    "31": "Calls upon States to ensure that the rights of persons who are marginalized and most vulnerable, including persons with disabilities, bearing in mind the __________________ 8 Resolution 55/89, annex. 9 E/CN.4/2005/102/Add.1. 10 See A/HRC/16/52. 11 Resolution 65/229, annex. Torture and other cruel, inhuman or degrading treatment or punishment A/RES/74/143 7/9 19-22243 Convention on the Rights of Persons with Disabilities, 12 are fully integrated into torture prevention and protection, and welcomes the efforts of the Special Rapporteur of the Human Rights Council on torture and other cruel, inhuman or degrading treatment or punishment in this regard;",
    "32": "Stresses that national legal systems must ensure that victims of torture or other cruel, inhuman or degrading treatment or punishment have effective access to justice and obtain redress, and that the complainants and witnesses are protected against all ill-treatment or intimidation as a consequence of making a complaint or giving evidence;",
    "33": "Calls upon States to provide redress for victims of torture or other cruel, inhuman or degrading treatment or punishment, encompassing effective remedy and adequate, effective and prompt reparation, which should include restitution, fair and adequate compensation, rehabilitation, satisfaction and guarantees of non-repetition, taking into full account the specific needs of the victim;",
    "34": "Urges States to ensure that appropriate rehabilitation services are promptly available to all victims without discrimination of any kind and without limitation in time, until the fullest rehabilitation possible has been achieved, and are provided either directly by the public health system or through the funding of private rehabilitation facilities, including those administered by civil society organizations, and to consider making rehabilitation services available to the immediate families or dependants of the victims and to persons who have suffered harm while intervening to assist victims in distress or to prevent victimization;",
    "35": "Also urges States to establish, maintain, facilitate or support rehabilitation centres or facilities where victims can receive such treatment and where effective measures for ensuring the safety of their staff and patients are taken;",
    "36": "Urges all States that have not yet done so to become parties to the Convention against Torture and the Optional Protocol thereto as a matter of priority;",
    "37": "Urges all States parties to the Convention that have not yet done so to make the declarations provided for in articles 21 and 22 of the Convention concerning inter-State and individual communications, to consider the possibility of withdrawing their reservations to article 20, to notify the Secretary-General of their acceptance of the amendments to articles 17 and 18, with a view to enhancing the effectiveness of the Committee against Torture as soon as possible, and to comply strictly with their obligations under the Convention, including, in view of the high number of reports not submitted in time, their obligation to submit reports in accordance with article 19 of the Convention, and invites States parties to incorporate a gender perspective and information concerning persons who are marginalized and most vulnerable, including children and juveniles and persons with disabilities, when submitting reports to the Committee;",
    "38": "Welcomes the work and the reports of the Committee and of the Subcommittee on Prevention of Torture and Other Cruel, Inhuman or Degrading Treatment or Punishment, recommends that their reports continue to include information on the follow-up by States parties to their recommendations, and supports the Committee and the Subcommittee in their efforts to further improve the effectiveness of their working methods;",
    "39": "Emphasizes the importance of the Committee and the Subcommittee having due regard to the principle of non-discrimination, paying particular attention to the rights of those who are marginalized, most vulnerable or in vulnerable __________________ 12 United Nations, Treaty Series, vol. 2515, No. 44910. A/RES/74/143 Torture and other cruel, inhuman or degrading treatment or punishment 19-22243 8/9 situations, including through a victim-oriented and gender-responsive approach in the fight against torture and other cruel, inhuman or degrading treatment or punishment;",
    "40": "Calls upon the United Nations High Commissioner for Human Rights, in conformity with her mandate established by the General Assembly in its resolution 48/141 of 20 December 1993, and other relevant United Nations entities, in accordance with their mandates and existing resources, to continue to provide, at the request of States, advisory services for the prevention of torture and other cruel, inhuman or degrading treatment or punishment, including for the preparation of national reports to the Committee, for the implementation of recommendations of the Committee, and for the establishment and operation of national preventive mechanisms, as well as technical assistance, including for the development, production and distribution of teaching materials for this purpose, and further calls upon the United Nations High Commissioner for Human Rights to continue to provide the support necessary to enable the Subcommittee to provide advice and assistance to States parties to the Optional Protocol;",
    "41": "Emphasizes the importance of States ensuring proper follow-up to the recommendations and conclusions of the relevant treaty bodies and mechanisms, including the Committee, the Subcommittee, national preventive mechanisms and the Special Rapporteur, while recognizing the important role of the universal periodic review, national human rights institutions and other relevant national or regional bodies in preventing torture and other cruel, inhuman or degrading treatment or punishment;",
    "42": "Takes note with appreciation of the interim report of the Special Rapporteur addressing the achievements made towards eradicating torture and other ill-treatment and reflecting on the primary challenges facing the universal implementation of the Convention 13 and of his report contained in document A/74/148, encourages him to continue to include, in his recommendations, proposals on the prevention and investigation of torture and other cruel, inhuman or degrading treatment or punishment, including its gender-based manifestations, requests him to continue to consider including in his reports information on the follow-up by States to his recommendations, visits and communications, including progress made and problems encountered, and on other official contacts, and further encourages future collaboration between practitioners, experts and other relevant stakeholders towards these goals;",
    "43": "Calls upon all States to cooperate with and assist the Special Rapporteur in the performance of his tasks, to supply all necessary information requested by him, to fully and expeditiously respond to and follow up on his urgent appeals, to give serious consideration to responding favourably to requests by him to visit their countries and to enter into a constructive dialogue with him on requested visits to their countries as well as with respect to the follow-up to his recommendations;",
    "44": "Stresses the need for the continued regular exchange of views among the Committee, the Subcommittee, the Special Rapporteur and other relevant United Nations mechanisms and bodies, as well as for the pursuit of cooperation with relevant United Nations programmes, notably the United Nations crime prevention and criminal justice programme, with regional organizations and mechanisms, as appropriate, and with civil society organizations, including non-governmental organizations, with a view to enhancing further their effectiveness and cooperation on issues relating to the prevention and eradication of torture by, inter alia, improving coordination; __________________ 13 A/73/207. Torture and other cruel, inhuman or degrading treatment or punishment A/RES/74/143 9/9 19-22243",
    "45": "Requests the Secretary-General to ensure, within the overall budgetary framework of the United Nations, the provision of adequate staff and facilities for the bodies and mechanisms involved in preventing and combating torture and assisting victims of torture or other cruel, inhuman or degrading treatment or punishment, including, in particular, the Committee, the Subcommittee and the Special Rapporteur, commensurate with the strong support expressed by Member States for preventing and combating torture and assisting victims of torture, in order to enable them to discharge their mandates in a comprehensive, sustained and effective manner, and taking fully into account the specific nature of their mandates;",
    "46": "Recognizes the global need for international assistance to victims of torture, stresses the importance of the work of the Board of Trustees of the United Nations Voluntary Fund for Victims of Torture, appeals to all States and organizations to contribute annually to the Fund, preferably with a substantial increase in the level of contributions, and welcomes the establishment of and encourages contributions to the Special Fund established by the Optional Protocol to support the implementation of the recommendations made by the Subcommittee and of educational programmes by the national preventive mechanisms;",
    "47": "Requests the Secretary-General to continue to transmit to all States the appeals of the General Assembly for contributions to the Funds, to include the Funds, on an annual basis, among the programmes for which funds are pledged at the United Nations Pledging Conference for Development Activities, and to submit to the Human Rights Council, and to the General Assembly at its seventy-fifth, seventy-sixth and seventy-seventh sessions, a report on the operations of the Funds, and encourages the Chair of the Board of Trustees of the United Nations Voluntary Fund for Victims of Torture to continuously raise awareness among States and relevant stakeholders about the overall trends and developments in its operations;",
    "48": "Welcomes and acknowledges the work of the Convention against Torture Initiative, launched in March 2014 on the thirtieth anniversary of the adoption of the Convention, to achieve the universal ratification and improved implementation of the Convention by 2024, as well as related regional initiatives on the prevention and eradication of torture;",
    "49": "Calls upon all States, the Office of the United Nations High Commissioner for Human Rights and other United Nations bodies and agencies, as well as relevant intergovernmental and civil society organizations, including non-governmental organizations, to commemorate, on 26 June, the United Nations International Day in Support of Victims of Torture;",
    "50": "Decides to consider at its seventy-fifth, seventy-sixth and seventy-seventh sessions the reports of the Secretary-General, including the report on the United Nations Voluntary Fund for Victims of Torture and the Special Fund established by the Optional Protocol, the report of the Committee, the report of the Subcommittee and the interim report of the Special Rapporteur;",
    "51": "Also decides to give its full consideration to the subject matter at its seventy-seventh session. 50th plenary meeting 18 December 2019"
  },
  "agenda_items": [
    "Item 70"
  ],
  "symbol_references": []
}