{
  "symbol": "A/RES/72/256",
  "filename": "A_RES_72_256.pdf",
  "title": "72/256. Administration of justice at the United Nations",
  "text": "United Nations \nA/RES/72/256\n \n \nGeneral Assembly \nDistr.: General \n12 January 2018 \n \n17-23355 (E)    170118  \n*1723355* \n \n \nSeventy-second session \nAgenda item 146 \n \n \n \n \n Resolution adopted by the General Assembly \non 24 December 2017 \n \n \n \n \n[on the report of the Fifth Committee (A/72/665)] \n \n \n 72/256. Administration of justice at the United Nations  \n \n \n \nThe General Assembly, \n \nRecalling section XI of its resolution 55/258 of 14 June 2001 and its resolutions \n57/307 of 15 April 2003, 59/266 of 23 December 2004, 59/283 of 13 April 2005, \n61/261 of 4 April 2007, 62/228 of 22 December 2007, 63/253 of 24 December 2008, \n64/233 of 22 December 2009, 65/251 of 24 December 2010, 66/237 of 24 December \n2011, 67/241 of 24 December 2012, 68/254 of 27 December 2013, 69/203 of \n18 December 2014, 70/112 of 14 December 2015 and 71/266 of 23 December 2016, \n \nHaving considered the reports of the Secretary-General on administration of \njustice at the United Nations1 and on the activities of the Office of the United Nations \nOmbudsman and Mediation Services,2 the report of the Internal Justice Council on \nadministration of justice at the United Nations3 and the related report of the Advisory \nCommittee on Administrative and Budgetary Questions, 4 as well as the letter dated \n26 October 2017 from the President of the General Assembly to the Chair of the Fifth \nCommittee,5  \n \n1. \nTakes note of the reports of the Secretary-General on administration of \njustice at the United Nations1 and on the activities of the Office of the United Nations \nOmbudsman and Mediation Services,2 the report of the Internal Justice Council on \nadministration of justice at the United Nations3 and the related report of the Advisory \nCommittee on Administrative and Budgetary Questions;4 \n \n2. \nEndorses the conclusions and recommendations contained in the report of \nthe Advisory Committee, subject to the provisions of the present resolution; \n \n__________________ \n \n1  A/72/204. \n \n2  A/72/138. \n \n3  A/72/210. \n \n4  A/72/7/Add.19. \n \n5  A/C.5/72/10. \n\nA/RES/72/256 \nAdministration of justice at the United Nations\n \n17-23355 \n2/5 \n \nI \nSystem of administration of justice \n \n \n \n3. \nEmphasizes the importance of the principle of judicial independence in the \nsystem of administration of justice; \n \n4. \nStresses the importance of ensuring access for all staff members to the \nsystem of administration of justice, regardless of their duty station; \n \n5. \nAcknowledges the evolving nature of the system of administration of \njustice and the need to carefully monitor its implementation to ensure that it remains \nwithin the parameters set out by the General Assembly; \n \n6. \nReaffirms its decision, contained in paragraph 4 of its resolution 61/261, \nto establish a new, independent, transparent, professionalized, adequately resourced \nand decentralized system of administration of justice consistent with the relevant \nrules of international law and the principles of the rule of law and due process to \nensure respect for the rights and obligations of staff members and the accountability \nof managers and staff members alike; \n \n7. \nNotes with appreciation the achievements of the system of administration \nof justice, while recognizing that there is still room for further improvement; \n \n8. \nNotes that staff still appear to have limited awareness of the system of \nadministration of justice, and encourages the system of administration of justice to \ncontinue its outreach and other awareness-raising campaign efforts; \n \n9. \nTakes note of paragraph 17 of the report of the Internal Justice Council, \nand encourages the Secretary-General and the Office of Human Resources \nManagement to ensure that staff have a more comprehensive understanding of the \nrules, regulations, instructions and administrative issuances dealing with human \nresources, including information on benefits and entitlements; \n \n10. Urges the Secretariat to further strengthen and increase its outreach \nactivities with a view to providing information on the role and functioning of the \nvarious parts of the system and the possibilities it offers to address work-related \ncomplaints, paying particular attention to field missions and offices; \n \n11. \nRecalls paragraph 27 of its resolution 71/266, and further stresses the \nimportance of establishing and implementing a comprehensive outreach and \ncommunication strategy for all staff members covered under the formal and informal \nparts of the system of administration of justice; \n \n12. Notes the ongoing efforts to strengthen the policy on protection against \nretaliation for reporting misconduct and for cooperating with duly authorized audits \nor investigations;6  \n \n13. Notes with concern the observations of the Internal Justice Council related \nto protection against retaliation for staff members who lodge cases before the \nTribunals or who appear as witnesses, and requests the Secretary-General to present \na comprehensive analysis of all existing policies and provide recommendations on \nways to improve protections for such staff members at its seventy-third session; \n \n__________________ \n \n6  ST/SGB/2017/2/Rev.1. \n\nAdministration of justice at the United Nations \nA/RES/72/256\n \n3/5 \n17-23355 \n \nII \nInformal system \n \n \n \n14. Recognizes that the informal system of administration of justice is an \nefficient and effective option both for staff who seek redress of grievances and for the \nparticipation of managers; \n \n15. Reaffirms that the informal resolution of conflict is a crucial element of \nthe system of administration of justice, emphasizes that all possible use should be \nmade of the informal system in order to avoid unnecessary litigation, without \nprejudice to the basic right of staff members to access the formal system, and \nencourages recourse to the informal resolution of disputes; \n \n16. Welcomes with appreciation the high resolution rate of cases mediated, \nencourages the Office of the United Nations Ombudsman and Mediation Services to \ncontinue its efforts in informal dispute resolution, and requests the Secretary-General \nto continue to provide detailed information on the activities of the Office, including \nstatistical overviews of mediated cases; \n \n17. Requests \nthe \nSecretary-General \nto \ninclude \ninformation \nand \nrecommendations on the overall results of the staff survey as they relate to staff \nperceptions of workplace conflict in the next report on the activities of the Office of \nthe United Nations Ombudsman and Mediation Services; \n \n18. Encourages the Office of the United Nations Ombudsman and Mediation \nServices to intensify its outreach activities to encourage informal dispute resolution; \n \n19. Recognizes the efforts of the Office of the United Nations Ombudsman and \nMediation Services in enhancing efforts aimed at the informal resolution of conflict, \nand requests the Secretary-General to continue to provide more detailed information \nin his next report to the General Assembly on the impact of conflict prevention \ntraining and on efforts to further enhance cooperation between the informal and \nformal parts of the system of administration of justice; \n \n20. Welcomes the analysis of the root causes of conflict included in the report \nof the Secretary-General on the activities of the Office of the United Nations \nOmbudsman and Mediation Services, stresses the importance of improving \nmanagement performance and staff communications, and urges the Secretary-General \nto continue to address the systemic issues identified in the report in order to improve \nupon the policies and procedures of the Organization; \n \n21. Recalls paragraph 33 of the report of the Advisory Committee, and \nrequests the Secretary-General to provide information on policy changes resulting \nfrom the effort of the Office of the United Nations Ombudsman and Mediation \nServices to help to resolve systemic issues in his future reports; \n \n22. Also recalls paragraph 47 of its resolution 71/266, and notes that no formal \nproposal for additional resources to increase the activities of the Office of the United \nNations Ombudsman and Mediation Services was included in the reports of the \nSecretary-General; \n \n23. Further recalls paragraph 36 of the report of the Advisory Committee, and \nreiterates the continued importance of the informal part of the system of \nadministration of justice; \n \n\nA/RES/72/256 \nAdministration of justice at the United Nations\n \n17-23355 \n4/5 \n \nIII \nFormal system \n \n \n \n24. Recognizes the ongoing positive contribution of the Office of Staff Legal \nAssistance to the system of administration of justice; \n \n25. Requests the Secretary-General to continue to track the data on the number \nof cases received by the Management Evaluation Unit and the United Nations Dispute \nTribunal in order to identify any emerging trends and to include his observations on \nthose statistics in future reports; \n \n26. Also requests the Secretary-General to continue to ensure the \naccountability of managers whose decisions have been established to be grossly \nnegligent, according to the applicable Staff Regulations and Rules of the United \nNations, and which have led to litigation and subsequent financial loss, and to report \nthereon to the General Assembly at its seventy-third session; \n \n27. Decides to extend the experimental period for one year, from 1 January to \n31 December 2018, and requests the Secretary-General to provide further \ninformation, in consultation with the relevant stakeholders, regarding the implications \nof the regularization of the voluntary staff funding mechanism in order to take a \ndecision on the issue of the financing of the Office of Staff Legal Assistance at its \nseventy-third session; \n \n28. Underscores that regularizing the voluntary staff funding mechanism, if \napproved, shall not affect the nature of the funding of the Office of Staff Legal \nAssistance; \n \n29. Notes the continuing high opt-out rates from the voluntary staff funding \nmechanism, and in this regard encourages the Secretary-General to continue to \nstrengthen incentives for staff not to opt out, particularly in locations where the \nparticipation rate is low; \n \n30. Stresses the need to continue to explore means to raise awareness among \nstaff of the importance of financial contributions to the Office of Staff Legal \nAssistance; \n \n31. Requests the Secretary-General to continue to collect and examine data \nrelating to staff contributions to the Office of Staff Legal Assistance, including \nlocation data of opt-out rates, and to report thereon to the General Assembly at the \nmain part of its seventy-third session; \n \n32. Decides to extend the three ad litem judge positions and the current \nincumbent judges, as well as to extend the six current temporary staff positions \nsupporting these judges, for one year, from 1 January to 31 December 2018, and \nrequests the Secretary-General to provide further information, in consultation with \nthe relevant stakeholders, regarding the implication of the establishment of three new \npermanent judges in the Dispute Tribunal, in order for a decision to be taken on this \nissue, at the seventy-third session of the General Assembly; \n \n33. Recalls paragraphs 25 and 26 of the report of the Advisory Committee, and \napproves the payment of 600 United States dollars per interlocutory motion \nadjudicated by a United Nations Appeals Tribunal judge as well as the payment of a \nstipend to the President of the Tribunal in the amount of 1,500 dollars per month, \nstarting on 1 January 2018; \n \n34. Welcomes further views of the Internal Justice Council in its next report to \nthe General Assembly on possible ways to continue to ensure the independence of the \nTribunals; \n\nAdministration of justice at the United Nations \nA/RES/72/256\n \n5/5 \n17-23355 \n \n \n35. Notes the continuing high degree of self-representation before the Dispute \nTribunal, and in this regard requests the Secretary-General to undertake an analysis \nwithin existing resources on this issue, and to report thereon at its seventy-third \nsession; \n \nIV \nOther issues \n \n \n \n36. Stresses that the Internal Justice Council can help to ensure independence, \nprofessionalism and accountability in the system of administration of justice, and \nrequests the Secretary-General to entrust the Council with including the views of both \nthe Dispute Tribunal and the Appeals Tribunal in its reports; \n \n37. Invites the Sixth Committee to consider the legal aspects of the report to \nbe submitted by the Secretary-General, without prejudice to the role of the Fifth \nCommittee as the Main Committee entrusted with responsibilities for administrative \nand budgetary matters; \n \n38. Requests the Secretary-General to prepare, from within existing resources, \nand with a view to informing the discussion at the seventy-third session of the General \nAssembly, a comprehensive analysis of the information provided in annex II to his \nreport on administration of justice at the United Nations on the remedies available to \nnon-staff personnel. \n \n76th plenary meeting  \n24 December 2017 \n \n",
  "paragraphs": {
    "1": "Takes note of the reports of the Secretary-General on administration of justice at the United Nations1 and on the activities of the Office of the United Nations Ombudsman and Mediation Services,2 the report of the Internal Justice Council on administration of justice at the United Nations3 and the related report of the Advisory Committee on Administrative and Budgetary Questions;4",
    "2": "Endorses the conclusions and recommendations contained in the report of the Advisory Committee, subject to the provisions of the present resolution; I System of administration of justice",
    "3": "Emphasizes the importance of the principle of judicial independence in the system of administration of justice;",
    "4": "Stresses the importance of ensuring access for all staff members to the system of administration of justice, regardless of their duty station;",
    "5": "Acknowledges the evolving nature of the system of administration of justice and the need to carefully monitor its implementation to ensure that it remains within the parameters set out by the General Assembly;",
    "6": "Reaffirms its decision, contained in paragraph 4 of its resolution 61/261, to establish a new, independent, transparent, professionalized, adequately resourced and decentralized system of administration of justice consistent with the relevant rules of international law and the principles of the rule of law and due process to ensure respect for the rights and obligations of staff members and the accountability of managers and staff members alike;",
    "7": "Notes with appreciation the achievements of the system of administration of justice, while recognizing that there is still room for further improvement;",
    "8": "Notes that staff still appear to have limited awareness of the system of administration of justice, and encourages the system of administration of justice to continue its outreach and other awareness-raising campaign efforts;",
    "9": "Takes note of paragraph 17 of the report of the Internal Justice Council, and encourages the Secretary-General and the Office of Human Resources Management to ensure that staff have a more comprehensive understanding of the rules, regulations, instructions and administrative issuances dealing with human resources, including information on benefits and entitlements;",
    "10": "Urges the Secretariat to further strengthen and increase its outreach activities with a view to providing information on the role and functioning of the various parts of the system and the possibilities it offers to address work-related complaints, paying particular attention to field missions and offices;",
    "11": "Recalls paragraph 27 of its resolution 71/266, and further stresses the importance of establishing and implementing a comprehensive outreach and communication strategy for all staff members covered under the formal and informal parts of the system of administration of justice;",
    "12": "Notes the ongoing efforts to strengthen the policy on protection against retaliation for reporting misconduct and for cooperating with duly authorized audits or investigations;6",
    "13": "Notes with concern the observations of the Internal Justice Council related to protection against retaliation for staff members who lodge cases before the Tribunals or who appear as witnesses, and requests the Secretary-General to present a comprehensive analysis of all existing policies and provide recommendations on ways to improve protections for such staff members at its seventy-third session; II Informal system",
    "14": "Recognizes that the informal system of administration of justice is an efficient and effective option both for staff who seek redress of grievances and for the participation of managers;",
    "15": "Reaffirms that the informal resolution of conflict is a crucial element of the system of administration of justice, emphasizes that all possible use should be made of the informal system in order to avoid unnecessary litigation, without prejudice to the basic right of staff members to access the formal system, and encourages recourse to the informal resolution of disputes;",
    "16": "Welcomes with appreciation the high resolution rate of cases mediated, encourages the Office of the United Nations Ombudsman and Mediation Services to continue its efforts in informal dispute resolution, and requests the Secretary-General to continue to provide detailed information on the activities of the Office, including statistical overviews of mediated cases;",
    "17": "Requests the Secretary-General to include information and recommendations on the overall results of the staff survey as they relate to staff perceptions of workplace conflict in the next report on the activities of the Office of the United Nations Ombudsman and Mediation Services;",
    "18": "Encourages the Office of the United Nations Ombudsman and Mediation Services to intensify its outreach activities to encourage informal dispute resolution;",
    "19": "Recognizes the efforts of the Office of the United Nations Ombudsman and Mediation Services in enhancing efforts aimed at the informal resolution of conflict, and requests the Secretary-General to continue to provide more detailed information in his next report to the General Assembly on the impact of conflict prevention training and on efforts to further enhance cooperation between the informal and formal parts of the system of administration of justice;",
    "20": "Welcomes the analysis of the root causes of conflict included in the report of the Secretary-General on the activities of the Office of the United Nations Ombudsman and Mediation Services, stresses the importance of improving management performance and staff communications, and urges the Secretary-General to continue to address the systemic issues identified in the report in order to improve upon the policies and procedures of the Organization;",
    "21": "Recalls paragraph 33 of the report of the Advisory Committee, and requests the Secretary-General to provide information on policy changes resulting from the effort of the Office of the United Nations Ombudsman and Mediation Services to help to resolve systemic issues in his future reports;",
    "22": "Also recalls paragraph 47 of its resolution 71/266, and notes that no formal proposal for additional resources to increase the activities of the Office of the United Nations Ombudsman and Mediation Services was included in the reports of the Secretary-General;",
    "23": " III Formal system",
    "24": "Recognizes the ongoing positive contribution of the Office of Staff Legal Assistance to the system of administration of justice;",
    "25": "Requests the Secretary-General to continue to track the data on the number of cases received by the Management Evaluation Unit and the United Nations Dispute Tribunal in order to identify any emerging trends and to include his observations on those statistics in future reports;",
    "26": "Also requests the Secretary-General to continue to ensure the accountability of managers whose decisions have been established to be grossly negligent, according to the applicable Staff Regulations and Rules of the United Nations, and which have led to litigation and subsequent financial loss, and to report thereon to the General Assembly at its seventy-third session;",
    "27": "Decides to extend the experimental period for one year, from 1 January to 31 December 2018, and requests the Secretary-General to provide further information, in consultation with the relevant stakeholders, regarding the implications of the regularization of the voluntary staff funding mechanism in order to take a decision on the issue of the financing of the Office of Staff Legal Assistance at its seventy-third session;",
    "28": "Underscores that regularizing the voluntary staff funding mechanism, if approved, shall not affect the nature of the funding of the Office of Staff Legal Assistance;",
    "29": "Notes the continuing high opt-out rates from the voluntary staff funding mechanism, and in this regard encourages the Secretary-General to continue to strengthen incentives for staff not to opt out, particularly in locations where the participation rate is low;",
    "30": "Stresses the need to continue to explore means to raise awareness among staff of the importance of financial contributions to the Office of Staff Legal Assistance;",
    "31": "Requests the Secretary-General to continue to collect and examine data relating to staff contributions to the Office of Staff Legal Assistance, including location data of opt-out rates, and to report thereon to the General Assembly at the main part of its seventy-third session;",
    "32": "Decides to extend the three ad litem judge positions and the current incumbent judges, as well as to extend the six current temporary staff positions supporting these judges, for one year, from 1 January to 31 December 2018, and requests the Secretary-General to provide further information, in consultation with the relevant stakeholders, regarding the implication of the establishment of three new permanent judges in the Dispute Tribunal, in order for a decision to be taken on this issue, at the seventy-third session of the General Assembly;",
    "33": "Recalls paragraphs 25 and 26 of the report of the Advisory Committee, and approves the payment of 600 United States dollars per interlocutory motion adjudicated by a United Nations Appeals Tribunal judge as well as the payment of a stipend to the President of the Tribunal in the amount of 1,500 dollars per month, starting on 1 January 2018;",
    "34": "",
    "35": "Notes the continuing high degree of self-representation before the Dispute Tribunal, and in this regard requests the Secretary-General to undertake an analysis within existing resources on this issue, and to report thereon at its seventy-third session; IV Other issues",
    "36": "Stresses that the Internal Justice Council can help to ensure independence, professionalism and accountability in the system of administration of justice, and requests the Secretary-General to entrust the Council with including the views of both the Dispute Tribunal and the Appeals Tribunal in its reports;",
    "37": "Invites the Sixth Committee to consider the legal aspects of the report to be submitted by the Secretary-General, without prejudice to the role of the Fifth Committee as the Main Committee entrusted with responsibilities for administrative and budgetary matters;",
    "38": "Requests the Secretary-General to prepare, from within existing resources, and with a view to informing the discussion at the seventy-third session of the General Assembly, a comprehensive analysis of the information provided in annex II to his report on administration of justice at the United Nations on the remedies available to non-staff personnel."
  },
  "agenda_items": [
    "Item 146"
  ],
  "symbol_references": []
}