{
  "symbol": "A/RES/73/62",
  "filename": "A_RES_73_62.pdf",
  "title": "73/62. United action with renewed determination towards the total elimination of nuclear weapons",
  "text": "United Nations \nA/RES/73/62\n \n \nGeneral Assembly \nDistr.: General \n13 December 2018 \n \n18-21269 (E)    171218     \n*1821269* \n \n \nSeventy-third session \nAgenda item 101 (ee) \n \n \n \n \n Resolution adopted by the General Assembly \non 5 December 2018 \n \n \n \n \n[on the report of the First Committee (A/73/510 and A/73/510/Corr.1)] \n \n \n \n73/62. United action with renewed determination towards the total \nelimination of nuclear weapons \n \n \n \nThe General Assembly, \n \nReaffirming its commitment towards a peaceful and secure world free of nuclear \nweapons, \n \nRecalling its resolution 72/50 of 4 December 2017, \n \nReaffirming the crucial importance of the Treaty on the Non-Proliferation of \nNuclear Weapons1 as the cornerstone of the international nuclear non-proliferation \nregime and an essential foundation for the pursuit of nuclear disarmament, nuclear \nnon-proliferation and the peaceful uses of nuclear energy, \n \nReaffirming also its determination to further strengthen the universality of the \nregime of the Treaty on the Non-Proliferation of Nuclear Weapons, and recalling that \nnuclear disarmament, non-proliferation and peaceful uses of nuclear energy are \nmutually reinforcing and are essential for strengthening the Treaty regime, \n \nStressing the essential role of the Treaty on the Non-Proliferation of Nuclear \nWeapons, 2018 being the fiftieth anniversary of its opening for signature, in the \nmaintenance of international peace, security and stability, as well as its centrality to \nthe rules-based international order, and recalling the achievements and the \nsignificance of the Treaty as the cornerstone of the international nuclear disarmament \nand non-proliferation regime, which has contributed to the achievement of major \nreductions in the nuclear arsenals of nuclear-weapon States, \n \nStressing also the importance of the Review Conference of the Parties to the \nTreaty on the Non-Proliferation of Nuclear Weapons to be held in 2020, on the \noccasion of the fiftieth anniversary of the entry into force of the Treaty, and of its \nreview cycle towards the 2020 Review Conference, \n__________________ \n \n1  United Nations, Treaty Series, vol. 729, No. 10485. \n\nA/RES/73/62 \nUnited action with renewed determination towards the total elimination of nuclear weapons\n \n18-21269\n2/7 \n \n \nReaffirming that the enhancement of international peace and security and the \npromotion of nuclear disarmament are mutually reinforcing and that it is in the \ncommon interest of all States to improve the international security environment and \npursue a world free of nuclear weapons in line with article VI of the Treaty on the \nNon-Proliferation of Nuclear Weapons, \n \nEmphasizing the crucial importance of rebuilding trust and enhancing \ncooperation among all States in order to make substantive progress in nuclear \ndisarmament and non-proliferation, bearing in mind there are various approaches \ntowards the realization of a world free of nuclear weapons, \n \nMindful, in this regard, that civility in discourse and respect for divergent views \ncontribute to facilitating a meaningful and realistic dialogue, which enables the \ninternational community to reduce nuclear dangers and move forward towards a world \nfree of nuclear weapons, \n \nRecognizing the importance of ensuring the equitable representation and \nparticipation of both women and men in disarmament discussions to enable a truly \ncomprehensive approach to nuclear non-proliferation and disarmament, \n \nExpressing grave concern over the recent developments in regional security \nsituations and the growing dangers posed by the proliferation of weapons of mass \ndestruction, including nuclear weapons, and by related proliferation networks, \n \nNoting that the ultimate objective of the efforts of States in the disarmament \nprocess is general and complete disarmament under strict and effective international \ncontrol, \n \nReaffirming the commitment to achieving the complete, verifiable and \nirreversible denuclearization of the Democratic People\u2019s Republic of Korea, \nincluding the dismantlement of its nuclear weapons, ballistic missiles and related \nnuclear and ballistic missile programmes, and the cessation of all related activities, \nin accordance with Security Council resolutions,  \n \nWelcoming the inter-Korean summits held on 27 April, 26 May and 18 to \n20 September 2018 and the meeting between the President of the United States of \nAmerica and the Chairman of the Workers\u2019 Party of the Democratic People\u2019s Republic \nof Korea of 12 June 2018 as a positive step toward the final, fully verified \ndenuclearization of the Democratic People\u2019s Republic of Korea,  \n \nRecalling, in this context, that the repeated unlawful nuclear tests and frequent \nmissile launches using United Nations-proscribed ballistic missile technology by the \nDemocratic People\u2019s Republic of Korea pose unprecedented, grave and imminent \nthreats to the peace and security of the region and the world, present grave challenges \nto the regime centred on the Treaty on the Non-Proliferation of Nuclear Weapons, and \nconstitute clear and repeated violations of the relevant Security Council resolutions, \nand reiterating the resolute opposition of the international community to the \npossession of nuclear weapons by the Democratic People\u2019s Republic of Korea,  \n \nRecognizing that the relevant Security Council resolutions, including resolution \n2397 (2017) of 22 December 2017, express the Council\u2019s firm opposition to the \nunlawful nuclear and missile programmes of the Democratic People\u2019s Republic of \nKorea in violation of the relevant Council resolutions and the Council\u2019s determination \nto take further significant measures in the event of a further nuclear test or ballistic \nmissile launch by the Democratic People\u2019s Republic of Korea,  \n \nReaffirming that further consolidation of the international regime for nuclear \nnon-proliferation, is, inter alia, essential to international peace and security, \n\nUnited action with renewed determination towards the total elimination of nuclear weapons \nA/RES/73/62\n \n3/7\n18-21269 \n \n \nStressing the importance of the decisions and the resolution on the Middle East \nof the 1995 Review and Extension Conference of the Parties to the Treaty on the \nNon-Proliferation of Nuclear Weapons2 and the Final Documents of the 20003 and \n20104 Review Conferences of the Parties to the Treaty on the Non-Proliferation of \nNuclear Weapons, and reaffirming its support for the establishment of a Middle East \nzone free of nuclear weapons and all other weapons of mass destruction and their \ndelivery systems, on the basis of arrangements freely arrived at by the States of the \nregion and in accordance with the 1995 resolution on the Middle East, and for the \nresumption of dialogue towards this end involving the States concerned, \n \nExpressing deep concern at the catastrophic humanitarian consequences of \nnuclear weapons use, and reaffirming the need for all States to comply at all times \nwith applicable international law, including international humanitarian law, while \nconvinced that every effort should be made to avoid the use of nuclear weapons, \n \nRecognizing that the catastrophic humanitarian consequences that would result \nfrom the use of nuclear weapons should be fully understood by all, and noting in this \nregard that efforts should be made to increase such understanding, \n \nWelcoming the visits of political leaders to Hiroshima and Nagasaki, in \nparticular the recent visit to Nagasaki by the Secretary-General of the United Nations, \n \nRecalling that nuclear and radiological terrorism remains a pressing and \nevolving challenge to the international community, and reaffirming the central role of \nthe International Atomic Energy Agency in nuclear security, \n \n1. \nRenews the determination of all States to take united action towards the \ntotal elimination of nuclear weapons through the easing of international tension and \nthe strengthening of trust between States as envisioned in the preamble to the Treaty \non the Non-Proliferation of Nuclear Weapons1 in order to facilitate disarmament and \nthrough strengthening the nuclear non-proliferation regime; \n \n2. \nReaffirms, in this regard, the unequivocal undertaking of the nuclear-\nweapon States to fully implement the Treaty on the Non-Proliferation of Nuclear \nWeapons in all its aspects, including article VI, towards the goal of the total \nelimination of nuclear weapons, recalling the Final Document of the 2000 Review \nConference of the Parties to the Treaty on the Non-Proliferation of Nuclear Weapons;3 \n \n3. \nCalls upon all States parties to the Treaty on the Non-Proliferation of \nNuclear Weapons to comply with their obligations under all the articles of the Treaty \nand to implement, with due consideration to developments in global security, steps \nagreed to in the Final Documents of the 1995 Review and Extension Conference of \nthe Parties to the Treaty on the Non-Proliferation of Nuclear Weapons2 and the 2000 \nand 20104 Review Conferences; \n \n4. \nEncourages all States to exert their utmost efforts towards the success of \nthe 2020 Review Conference of the Parties to the Treaty on the Non-Proliferation of \nNuclear Weapons, welcoming the successful convening of the first and second \nsessions of the Preparatory Committee for the Review Conference, which were held, \nrespectively, in Vienna in May 2017 and in Geneva in April and May 2018; \n__________________ \n \n2  1995 Review and Extension Conference of the Parties to the Treaty on the Non-Proliferation of \nNuclear Weapons, Final Document, Part I (NPT/CONF.1995/32 (Part I) and \nNPT/CONF.1995/32 (Part I)/Corr.2), annex. \n \n3  2000 Review Conference of the Parties to the Treaty on the Non-Proliferation of Nuclear \nWeapons, Final Document, vols. I\u2013III (NPT/CONF.2000/28 (Parts I and II), \nNPT/CONF.2000/28 (Part III) and NPT/CONF.2000/28 (Part IV)). \n \n4  2010 Review Conference of the Parties to the Treaty on the Non-Proliferation of Nuclear \nWeapons, Final Document, vols. I\u2013III (NPT/CONF.2010/50 (Vol. I), \nNPT/CONF.2010/50 (Vol. II) and NPT/CONF.2010/50 (Vol. III)). \n\nA/RES/73/62 \nUnited action with renewed determination towards the total elimination of nuclear weapons\n \n18-21269\n4/7 \n \n \n5. \nCalls upon all States not parties to the Treaty on the Non-Proliferation of \nNuclear Weapons to accede as non-nuclear-weapon States to the Treaty promptly and \nwithout any conditions to achieve its universality and, pending their accession to the \nTreaty, to adhere to its terms and to take practical steps in support of the Treaty; \n \n6. \nEncourages all States to further engage in meaningful dialogue that \nfacilitates practical, concrete and effective measures on nuclear disarmament and \nnon-proliferation, and calls for efforts to foster a dialogue through interactive \ndiscussion to improve understanding and develop measures that enable States to \naddress the security environment and improve confidence and trust among all States; \n \n7. \nEmphasizes that deep concerns about the humanitarian consequences of \nthe use of nuclear weapons continue to be a key factor that underpins efforts by all \nStates towards a world free of nuclear weapons; \n \n8. \nCalls upon all States to apply the principles of irreversibility, verifiability \nand transparency in the process of nuclear disarmament and non-proliferation; \n \n9. \nAlso calls upon all States to take further practical steps and effective \nmeasures towards the total elimination of nuclear weapons, based on the principle of \nundiminished and increased security for all; \n \n10. Stresses that increased transparency will build confidence and trust at the \nregional and international levels and contribute to establishing a common ground for \ndialogue and negotiation, which could allow further reductions in nuclear weapons \ntowards their total elimination; \n \n11. \nEncourages the nuclear-weapon States to build upon and expand their \nefforts to enhance transparency and to increase mutual confidence, including, inter \nalia, by providing more frequent and further detailed reporting on nuclear weapons \nand delivery systems dismantled and reduced as part of nuclear disarmament efforts \nthroughout the review process of the Treaty on the Non-Proliferation of Nuclear \nWeapons towards the 2020 Review Conference of the Parties to the Treaty;  \n \n12. Calls upon all States to make utmost efforts to ease international tension, \nstrengthen trust between States and improve the international security environment \nwith a view to facilitating further nuclear reductions, placing special emphasis, among \nothers, on the following actions:  \n \n(a) \nContinued implementation of the Treaty on Measures for the Further \nReduction and Limitation of Strategic Offensive Arms (New START Treaty), \nwelcoming the fact that 5 February 2018 marked the date on which the central limits \non strategic nuclear arsenals under the Treaty took effect, and further welcoming the \nrespective announcements of the Russian Federation and the United States of America \nthat each had by that date met those central limits; \n \n(b) \nContinuing dialogues between the Russian Federation and the United \nStates of America that could enable the commencement of negotiations to achieve \ngreater reductions in their stockpiles of nuclear weapons; \n \n(c) \nEfforts by all States possessing nuclear weapons to reduce and ultimately \neliminate all types of nuclear weapons, deployed and non-deployed, including \nthrough unilateral, bilateral, regional and multilateral measures; \n \n(d) \nRegular discussions among the nuclear-weapon States and other States, \nthrough which the international security environment could be improved with a view \nto facilitating further nuclear disarmament measures;  \n \n(e) \nContinuous review by the States concerned of their military and security \nconcepts, doctrines and policies with a view to reducing further the role and \nsignificance of nuclear weapons therein, taking into account the security \nenvironment; \n\nUnited action with renewed determination towards the total elimination of nuclear weapons \nA/RES/73/62\n \n5/7\n18-21269 \n \n \n13. Urges all States possessing nuclear weapons to continue to undertake all \nefforts necessary to comprehensively address the risks of unintended nuclear \ndetonations; \n \n14. Recognizes the legitimate interest of non-nuclear-weapon States that are \nparty to the Treaty on the Non-Proliferation of Nuclear Weapons and in compliance \nwith their nuclear non-proliferation obligations in receiving unequivocal and legally \nbinding security assurances from nuclear-weapon States which could strengthen the \nnuclear non-proliferation regime; \n \n15. Recalls Security Council resolution 984 (1995) of 11 April 1995, noting the \nunilateral statements by each of the nuclear-weapon States, and calls upon all nuclear-\nweapon States to fully respect their commitments with regard to security assurances; \n \n16. \nEncourages the establishment of further nuclear-weapon-free zones, where \nappropriate, on the basis of arrangements freely arrived at by the States of the region \nconcerned and in accordance with the 1999 guidelines of the Disarmament \nCommission, 5 and recognizes that, by signing and ratifying relevant protocols that \ncontain negative security assurances, nuclear-weapon States would undertake \nindividual legally binding commitments with respect to the status of such zones and not \nto use or threaten to use nuclear weapons against States that are party to such treaties; \n \n17. Also encourages further efforts towards the establishment of a Middle East \nzone free of nuclear weapons and all other weapons of mass destruction and their \ndelivery systems, on the basis of arrangements freely arrived at by the States of the \nregion and in accordance with the 1995 resolution on the Middle East, 2 and the \nresumption of dialogue towards that end involving the States concerned; \n \n18. Acknowledges the widespread call for the early entry into force of the \nComprehensive Nuclear-Test-Ban Treaty,6 while recalling that all States, in particular \nthe eight remaining States in annex 2 thereof, have been urged to take individual \ninitiatives to sign and ratify that Treaty without waiting for any other States to do so, \nand urges all States to maintain all existing moratoria on nuclear-weapon test \nexplosions or any other nuclear explosions and declare their political will to do so, so \nlong as the Treaty has not entered into force; \n \n19. Commends the accomplishments of and continued support by States for \nthe Preparatory Commission for the Comprehensive Nuclear-Test-Ban Treaty \nOrganization since the opening for signature of the Treaty, in particular the significant \nprogress made in the establishment of the International Monitoring System and the \nInternational Data Centre; \n \n20. Urges all States concerned to immediately commence negotiations on a \ntreaty banning the production of fissile material for nuclear weapons or other nuclear \nexplosive devices and its early conclusion on the basis of document CD/1299 of \n24 March 1995 and the mandate contained therein, taking into consideration the \nreport of the Group of Government Experts requested in paragraph 3 of resolution \n67/53 of 3 December 2012,7 the report of the high-level fissile material cut-off treaty \nexpert preparatory group requested in paragraph 2 of resolution 71/259 of \n23 December 2016,8 as well as the report of subsidiary body 2 of the Conference on \nDisarmament, adopted on 5 September 2018;9  \n__________________ \n \n5  See Official Records of the General Assembly, Fifty-fourth Session, Supplement No. 42 \n(A/54/42). \n \n6  See resolution 50/245 and A/50/1027. \n \n7  A/70/81. \n \n8  A/73/159. \n \n9  CD/2139. \n\nA/RES/73/62 \nUnited action with renewed determination towards the total elimination of nuclear weapons\n \n18-21269\n6/7 \n \n \n21. Urges all States concerned to declare and maintain a moratorium on the \nproduction of fissile material for use in nuclear weapons or other nuclear explosive \ndevices, pending the entry into force of the treaty; \n \n22. Welcomes the efforts undertaken towards the development of nuclear \ndisarmament verification capabilities that can contribute to the pursuit of a world free \nof nuclear weapons, including the Group of Governmental Experts mandated pursuant \nto resolution 71/67 of 14 December 2016 and the International Partnership for \nNuclear Disarmament Verification, and stresses in this regard the importance of \ncooperation between nuclear-weapon States and non-nuclear-weapon States; \n \n23. While noting with appreciation the decision of the Conference on \nDisarmament at its 2018 session on the establishment of the subsidiary bodies, calls \nupon the Conference on Disarmament to further intensify consultations and to explore \npossibilities for overcoming its ongoing deadlock of two decades by adopting and \nimplementing a programme of work at the earliest possible date during its 2019 \nsession; \n \n24. Encourages all States to implement the recommendations contained in the \nreport of the Secretary-General on the United Nations study on disarmament and \nnon-proliferation education, 10  in support of achieving a world free of nuclear \nweapons; \n \n25. Encourages every effort to raise awareness of the realities of the use of \nnuclear weapons, including through, among others, visits by leaders, youth and others \nto and interactions with communities and people, including the hibakusha (those who \nhave suffered the use of nuclear weapons) that pass on their experiences to the future \ngenerations; \n \n26. Reaffirms the responsibility of all States for the full implementation of all \nrelevant Security Council resolutions and the obligations of the Democratic People\u2019s \nRepublic of Korea to achieve complete, verifiable and irreversible denuclearization \nin accordance with relevant Security Council resolutions; \n \n27. Urges the Democratic People\u2019s Republic of Korea to fulfil its commitment \nmade at the inter-Korean summits held on 27 April, 26 May and 18 to 20 September \n2018 and the meeting of 12 June 2018 between the President of the United States of \nAmerica and the Chairman of the Workers\u2019 Party of the Democratic People\u2019s Republic \nof Korea for the final, fully verified denuclearization of the Democratic People\u2019s \nRepublic of Korea; \n \n28. Condemns in the strongest terms all nuclear tests and launches using \nballistic missile technology and other activities in furtherance of the development of \nnuclear and ballistic missile technology by the Democratic People\u2019s Republic of \nKorea, which cannot have the status of a nuclear-weapon State in accordance with the \nTreaty on the Non-Proliferation of Nuclear Weapons, and strongly urges the \nDemocratic People\u2019s Republic of Korea to refrain from conducting any further \nnuclear tests as a step toward complete, verifiable and irreversible denuclearization, \nto sign and ratify the Comprehensive Nuclear-Test-Ban Treaty without further delay \nand without waiting for any other States to do so and to abandon all ongoing nuclear \nactivities immediately in a complete, verifiable and irreversible manner, and calls \nupon the Democratic People\u2019s Republic of Korea to fully comply with all relevant \nSecurity Council resolutions, to implement the joint statement of the Six-Party Talks \nof 19 September 2005 and to return at an early date to full compliance with the Treaty, \nincluding that of the International Atomic Energy Agency safeguards; \n__________________ \n \n10  A/57/124. \n\nUnited action with renewed determination towards the total elimination of nuclear weapons \nA/RES/73/62\n \n7/7\n18-21269 \n \n \n29. Calls upon all States to redouble their efforts to prevent and curb the \nproliferation of nuclear weapons and their means of delivery and to fully respect and \ncomply with any obligations undertaken to forswear nuclear weapons; \n \n30. Also calls upon all States to establish and enforce effective domestic \ncontrols to prevent proliferation of nuclear weapons, and encourages cooperation \namong States and technical assistance to enhance international partnership and \ncapacity-building in non-proliferation efforts; \n \n31. Stresses the fundamental role of the International Atomic Energy Agency \nsafeguards and the importance of the universalization of the comprehensive \nsafeguards agreements, and, while noting that it is the sovereign decision of any State \nto conclude an additional protocol, strongly encourages all States that have not done \nso to conclude and bring into force as soon as possible an additional protocol based \non the Model Additional Protocol to the Agreement(s) between States and the \nInternational Atomic Energy Agency for the Application of Safeguards, approved by \nthe Board of Governors of the Agency on 15 May 1997; \n \n32. Calls upon all States to fully implement relevant Security Council \nresolutions, including Council resolutions 1540 (2004) of 28 April 2004 and \n2325 (2016) of 15 December 2016, based on the outcome of the comprehensive \nreview of the status of implementation of Council resolution 1540 (2004); \n \n33. Encourages all States to attach more importance to, and enhance the \nsecurity of, nuclear and other radiological materials, and to further strengthen the \nglobal nuclear security architecture; \n \n34. Decides to include in the provisional agenda of its seventy-fourth session, \nunder the item entitled \u201cGeneral and complete disarmament\u201d, the sub-item entitled \n\u201cUnited action with renewed determination towards the total elimination of nuclear \nweapons\u201d. \n \n45th plenary meeting  \n5 December 2018 \n \n",
  "paragraphs": {
    "1": "Renews the determination of all States to take united action towards the total elimination of nuclear weapons through the easing of international tension and the strengthening of trust between States as envisioned in the preamble to the Treaty on the Non-Proliferation of Nuclear Weapons1 in order to facilitate disarmament and through strengthening the nuclear non-proliferation regime;",
    "2": "Reaffirms, in this regard, the unequivocal undertaking of the nuclear- weapon States to fully implement the Treaty on the Non-Proliferation of Nuclear Weapons in all its aspects, including article VI, towards the goal of the total elimination of nuclear weapons, recalling the Final Document of the 2000 Review Conference of the Parties to the Treaty on the Non-Proliferation of Nuclear Weapons;3",
    "3": "Calls upon all States parties to the Treaty on the Non-Proliferation of Nuclear Weapons to comply with their obligations under all the articles of the Treaty and to implement, with due consideration to developments in global security, steps agreed to in the Final Documents of the 1995 Review and Extension Conference of the Parties to the Treaty on the Non-Proliferation of Nuclear Weapons2 and the 2000 and 20104 Review Conferences;",
    "4": "Encourages all States to exert their utmost efforts towards the success of the 2020 Review Conference of the Parties to the Treaty on the Non-Proliferation of Nuclear Weapons, welcoming the successful convening of the first and second sessions of the Preparatory Committee for the Review Conference, which were held, respectively, in Vienna in May 2017 and in Geneva in April and May 2018; __________________ 2 1995 Review and Extension Conference of the Parties to the Treaty on the Non-Proliferation of Nuclear Weapons, Final Document, Part I (NPT/CONF.1995/32 (Part I) and NPT/CONF.1995/32 (Part I)/Corr.2), annex. 3 2000 Review Conference of the Parties to the Treaty on the Non-Proliferation of Nuclear Weapons, Final Document, vols. I\u2013III (NPT/CONF.2000/28 (Parts I and II), NPT/CONF.2000/28 (Part III) and NPT/CONF.2000/28 (Part IV)). 4 2010 Review Conference of the Parties to the Treaty on the Non-Proliferation of Nuclear Weapons, Final Document, vols. I\u2013III (NPT/CONF.2010/50 (Vol. I), NPT/CONF.2010/50 (Vol. II) and NPT/CONF.2010/50 (Vol. III)). A/RES/73/62 United action with renewed determination towards the total elimination of nuclear weapons 18-21269 4/7",
    "5": "Calls upon all States not parties to the Treaty on the Non-Proliferation of Nuclear Weapons to accede as non-nuclear-weapon States to the Treaty promptly and without any conditions to achieve its universality and, pending their accession to the Treaty, to adhere to its terms and to take practical steps in support of the Treaty;",
    "6": "Encourages all States to further engage in meaningful dialogue that facilitates practical, concrete and effective measures on nuclear disarmament and non-proliferation, and calls for efforts to foster a dialogue through interactive discussion to improve understanding and develop measures that enable States to address the security environment and improve confidence and trust among all States;",
    "7": "Emphasizes that deep concerns about the humanitarian consequences of the use of nuclear weapons continue to be a key factor that underpins efforts by all States towards a world free of nuclear weapons;",
    "8": "Calls upon all States to apply the principles of irreversibility, verifiability and transparency in the process of nuclear disarmament and non-proliferation;",
    "9": "Also calls upon all States to take further practical steps and effective measures towards the total elimination of nuclear weapons, based on the principle of undiminished and increased security for all;",
    "10": "Stresses that increased transparency will build confidence and trust at the regional and international levels and contribute to establishing a common ground for dialogue and negotiation, which could allow further reductions in nuclear weapons towards their total elimination;",
    "11": "Encourages the nuclear-weapon States to build upon and expand their efforts to enhance transparency and to increase mutual confidence, including, inter alia, by providing more frequent and further detailed reporting on nuclear weapons and delivery systems dismantled and reduced as part of nuclear disarmament efforts throughout the review process of the Treaty on the Non-Proliferation of Nuclear Weapons towards the 2020 Review Conference of the Parties to the Treaty;",
    "12": "Calls upon all States to make utmost efforts to ease international tension, strengthen trust between States and improve the international security environment with a view to facilitating further nuclear reductions, placing special emphasis, among others, on the following actions: (a) Continued implementation of the Treaty on Measures for the Further Reduction and Limitation of Strategic Offensive Arms (New START Treaty), welcoming the fact that 5 February 2018 marked the date on which the central limits on strategic nuclear arsenals under the Treaty took effect, and further welcoming the respective announcements of the Russian Federation and the United States of America that each had by that date met those central limits; (b) Continuing dialogues between the Russian Federation and the United States of America that could enable the commencement of negotiations to achieve greater reductions in their stockpiles of nuclear weapons; (c) Efforts by all States possessing nuclear weapons to reduce and ultimately eliminate all types of nuclear weapons, deployed and non-deployed, including through unilateral, bilateral, regional and multilateral measures; (d) Regular discussions among the nuclear-weapon States and other States, through which the international security environment could be improved with a view to facilitating further nuclear disarmament measures; (e) Continuous review by the States concerned of their military and security concepts, doctrines and policies with a view to reducing further the role and significance of nuclear weapons therein, taking into account the security environment; United action with renewed determination towards the total elimination of nuclear weapons A/RES/73/62 5/7 18-21269",
    "13": "Urges all States possessing nuclear weapons to continue to undertake all efforts necessary to comprehensively address the risks of unintended nuclear detonations;",
    "14": "Recognizes the legitimate interest of non-nuclear-weapon States that are party to the Treaty on the Non-Proliferation of Nuclear Weapons and in compliance with their nuclear non-proliferation obligations in receiving unequivocal and legally binding security assurances from nuclear-weapon States which could strengthen the nuclear non-proliferation regime;",
    "15": "Recalls Security Council resolution 984 (1995) of 11 April 1995, noting the unilateral statements by each of the nuclear-weapon States, and calls upon all nuclear- weapon States to fully respect their commitments with regard to security assurances;",
    "16": "Encourages the establishment of further nuclear-weapon-free zones, where appropriate, on the basis of arrangements freely arrived at by the States of the region concerned and in accordance with the 1999 guidelines of the Disarmament Commission, 5 and recognizes that, by signing and ratifying relevant protocols that contain negative security assurances, nuclear-weapon States would undertake individual legally binding commitments with respect to the status of such zones and not to use or threaten to use nuclear weapons against States that are party to such treaties;",
    "17": "Also encourages further efforts towards the establishment of a Middle East zone free of nuclear weapons and all other weapons of mass destruction and their delivery systems, on the basis of arrangements freely arrived at by the States of the region and in accordance with the 1995 resolution on the Middle East, 2 and the resumption of dialogue towards that end involving the States concerned;",
    "18": "Acknowledges the widespread call for the early entry into force of the Comprehensive Nuclear-Test-Ban Treaty,6 while recalling that all States, in particular the eight remaining States in annex 2 thereof, have been urged to take individual initiatives to sign and ratify that Treaty without waiting for any other States to do so, and urges all States to maintain all existing moratoria on nuclear-weapon test explosions or any other nuclear explosions and declare their political will to do so, so long as the Treaty has not entered into force;",
    "19": "Commends the accomplishments of and continued support by States for the Preparatory Commission for the Comprehensive Nuclear-Test-Ban Treaty Organization since the opening for signature of the Treaty, in particular the significant progress made in the establishment of the International Monitoring System and the International Data Centre;",
    "20": "Urges all States concerned to immediately commence negotiations on a treaty banning the production of fissile material for nuclear weapons or other nuclear explosive devices and its early conclusion on the basis of document CD/1299 of 24 March 1995 and the mandate contained therein, taking into consideration the report of the Group of Government Experts requested in paragraph 3 of resolution 67/53 of 3 December 2012,7 the report of the high-level fissile material cut-off treaty expert preparatory group requested in paragraph 2 of resolution 71/259 of 23 December 2016,8 as well as the report of subsidiary body 2 of the Conference on Disarmament, adopted on 5 September 2018;9 __________________ 5 See Official Records of the General Assembly, Fifty-fourth Session, Supplement No. 42 (A/54/42). 6 See resolution 50/245 and A/50/1027. 7 A/70/81. 8 A/73/159. 9 CD/2139. A/RES/73/62 United action with renewed determination towards the total elimination of nuclear weapons 18-21269 6/7",
    "21": "Urges all States concerned to declare and maintain a moratorium on the production of fissile material for use in nuclear weapons or other nuclear explosive devices, pending the entry into force of the treaty;",
    "22": "Welcomes the efforts undertaken towards the development of nuclear disarmament verification capabilities that can contribute to the pursuit of a world free of nuclear weapons, including the Group of Governmental Experts mandated pursuant to resolution 71/67 of 14 December 2016 and the International Partnership for Nuclear Disarmament Verification, and stresses in this regard the importance of cooperation between nuclear-weapon States and non-nuclear-weapon States;",
    "23": "While noting with appreciation the decision of the Conference on Disarmament at its 2018 session on the establishment of the subsidiary bodies, calls upon the Conference on Disarmament to further intensify consultations and to explore possibilities for overcoming its ongoing deadlock of two decades by adopting and implementing a programme of work at the earliest possible date during its 2019 session;",
    "24": "Encourages all States to implement the recommendations contained in the report of the Secretary-General on the United Nations study on disarmament and non-proliferation education, 10 in support of achieving a world free of nuclear weapons;",
    "25": "Encourages every effort to raise awareness of the realities of the use of nuclear weapons, including through, among others, visits by leaders, youth and others to and interactions with communities and people, including the hibakusha (those who have suffered the use of nuclear weapons) that pass on their experiences to the future generations;",
    "26": "Reaffirms the responsibility of all States for the full implementation of all relevant Security Council resolutions and the obligations of the Democratic People\u2019s Republic of Korea to achieve complete, verifiable and irreversible denuclearization in accordance with relevant Security Council resolutions;",
    "27": "Urges the Democratic People\u2019s Republic of Korea to fulfil its commitment made at the inter-Korean summits held on 27 April, 26 May and 18 to 20 September 2018 and the meeting of 12 June 2018 between the President of the United States of America and the Chairman of the Workers\u2019 Party of the Democratic People\u2019s Republic of Korea for the final, fully verified denuclearization of the Democratic People\u2019s Republic of Korea;",
    "28": "Condemns in the strongest terms all nuclear tests and launches using ballistic missile technology and other activities in furtherance of the development of nuclear and ballistic missile technology by the Democratic People\u2019s Republic of Korea, which cannot have the status of a nuclear-weapon State in accordance with the Treaty on the Non-Proliferation of Nuclear Weapons, and strongly urges the Democratic People\u2019s Republic of Korea to refrain from conducting any further nuclear tests as a step toward complete, verifiable and irreversible denuclearization, to sign and ratify the Comprehensive Nuclear-Test-Ban Treaty without further delay and without waiting for any other States to do so and to abandon all ongoing nuclear activities immediately in a complete, verifiable and irreversible manner, and calls upon the Democratic People\u2019s Republic of Korea to fully comply with all relevant Security Council resolutions, to implement the joint statement of the Six-Party Talks of 19 September 2005 and to return at an early date to full compliance with the Treaty, including that of the International Atomic Energy Agency safeguards; __________________ 10 A/57/124. United action with renewed determination towards the total elimination of nuclear weapons A/RES/73/62 7/7 18-21269",
    "29": "Calls upon all States to redouble their efforts to prevent and curb the proliferation of nuclear weapons and their means of delivery and to fully respect and comply with any obligations undertaken to forswear nuclear weapons;",
    "30": "Also calls upon all States to establish and enforce effective domestic controls to prevent proliferation of nuclear weapons, and encourages cooperation among States and technical assistance to enhance international partnership and capacity-building in non-proliferation efforts;",
    "31": "Stresses the fundamental role of the International Atomic Energy Agency safeguards and the importance of the universalization of the comprehensive safeguards agreements, and, while noting that it is the sovereign decision of any State to conclude an additional protocol, strongly encourages all States that have not done so to conclude and bring into force as soon as possible an additional protocol based on the Model Additional Protocol to the Agreement(s) between States and the International Atomic Energy Agency for the Application of Safeguards, approved by the Board of Governors of the Agency on 15 May 1997;",
    "32": "Calls upon all States to fully implement relevant Security Council resolutions, including Council resolutions 1540 (2004) of 28 April 2004 and 2325 (2016) of 15 December 2016, based on the outcome of the comprehensive review of the status of implementation of Council resolution 1540 (2004);",
    "33": "Encourages all States to attach more importance to, and enhance the security of, nuclear and other radiological materials, and to further strengthen the global nuclear security architecture;",
    "34": "Decides to include in the provisional agenda of its seventy-fourth session, under the item entitled \u201cGeneral and complete disarmament\u201d, the sub-item entitled \u201cUnited action with renewed determination towards the total elimination of nuclear weapons\u201d. 45th plenary meeting 5 December 2018"
  },
  "agenda_items": [
    "Item 101"
  ],
  "symbol_references": []
}