{
  "symbol": "A/RES/74/187",
  "filename": "A_RES_74_187.pdf",
  "title": "74/187. Crimes against humanity",
  "text": "United Nations \nA/RES/74/187\n \n \nGeneral Assembly \nDistr.: General \n30 December 2019 \n \n19-22395 (E)    090120 \n*1922395* \n \n \nSeventy-fourth session \nAgenda item 79 \nReport of the International Law Commission on the work \nof its seventy-first session \n \n \n \n \n Resolution adopted by the General Assembly \non 18 December 2019 \n \n \n \n \n[on the report of the Sixth Committee (A/74/425)] \n \n \n 74/187. Crimes against humanity \n \n \n \nThe General Assembly, \n \nHaving considered chapter IV of the report of the International Law \nCommission on the work of its seventy-first session,1 which contains the draft articles \non prevention and punishment of crimes against humanity, \n \nNoting that the Commission decided to recommend the draft articles on \nprevention and punishment of crimes against humanity to the General Assembly and \nrecommended the elaboration of a convention by the Assembly or by an international \nconference of plenipotentiaries on the basis of the draft articles, 2 \n \nEmphasizing the continuing importance of the codification and progressive \ndevelopment of international law, as referred to in Article 13, paragraph 1 (a), of the \nCharter of the United Nations, \n \nRecognizing the need to prevent and punish crimes against humanity, which are \namong the most serious crimes of concern to the international community as a whole, \n \n1. \nExpresses its appreciation to the International Law Commission for its \ncontinuing contribution to the codification and progressive development of \ninternational law;  \n \n2. \nTakes note of the draft articles on prevention and punishment of crimes \nagainst humanity, presented by the Commission;3  \n__________________ \n \n1  Official Records of the General Assembly, Seventy-fourth Session, Supplement No. 10 (A/74/10). \n \n2  Ibid., para. 42. \n \n3  Ibid., chap. IV, sect. E. \n\nA/RES/74/187 \nCrimes against humanity\n \n19-22395\n2/2 \n \n \n3. \nDecides to include in the provisional agenda of its seventy-fifth session an \nitem entitled \u201cCrimes against humanity\u201d and to continue to examine the \nrecommendation of the Commission contained in paragraph 42 of its report on the \nwork of its seventy-first session.1 \n \n51st plenary meeting \n18 December 2019 \n \n",
  "paragraphs": {
    "1": "Expresses its appreciation to the International Law Commission for its continuing contribution to the codification and progressive development of international law;",
    "2": "Takes note of the draft articles on prevention and punishment of crimes against humanity, presented by the Commission;3",
    "3": "Decides to include in the provisional agenda of its seventy-fifth session an item entitled \u201cCrimes against humanity\u201d and to continue to examine the recommendation of the Commission contained in paragraph 42 of its report on the work of its seventy-first session.1"
  },
  "agenda_items": [
    "Item 79"
  ],
  "symbol_references": []
}