{
  "symbol": "A/RES/75/312",
  "filename": "A_RES_75_312.pdf",
  "title": "75/312. Zone of peace and cooperation of the South Atlantic",
  "text": "United Nations \nA/RES/75/312\n \n \nGeneral Assembly \nDistr.: General \n5 August 2021 \n \n21-10594 (E)    100821     \n*2110594* \n \n \nSeventy-fifth session \nAgenda item 36 \nZone of peace and cooperation of the South Atlantic  \n \n \n \n \n Resolution adopted by the General Assembly \non 29 July 2021 \n \n \n \n \n[without reference to a Main Committee (A/75/L.113 and A/75/L.113/Add.1)] \n \n \n 75/312. Zone of peace and cooperation of the South Atlantic \n \n \n \nThe General Assembly, \n \nRecalling its resolution 41/11 of 27 October 1986, in which the Atlantic Ocean, \nin the region situated between Africa and South America, was solemnly declared a \nzone of peace and cooperation of the South Atlantic, \n \nRecalling also its subsequent resolutions on the zone of peace and cooperation \nof the South Atlantic (ZPCSA), \n \nReaffirming that the questions of maintenance of international peace and \nsecurity and those of development are interrelated and inseparable, and considering \nthat cooperation among States, in particular those of the region, for peace and \ndevelopment is essential for the promotion of the objectives of the zone of peace and \ncooperation of the South Atlantic, \n \nReaffirming also the importance of the purposes and objectives of the zone of \npeace and cooperation of the South Atlantic as a basis for the promotion of \ncooperation among the States of the region, \n \nRecalling the strong potential the South Atlantic presents for the socioeconomic \ndevelopment of the States members of the zone, and reiterating that the zone is a \nforum for the development and strengthening of cooperation among its member States \nin areas such as science and technology, education, capacity-building, coastal \nsurveillance, environment, defence, strengthening of national institutions, trade, \nsports, tourism, economy, communications, transport, culture and political dialogue, \n \nNoting with appreciation the commitment of Member States towards fulfilling \nthe goals of the zone of peace and cooperation of the South Atlantic and their \nengagement in its revitalization through a number of initiatives, as reaffirmed during \nthe seventh ministerial meeting of the zone, held in Montevideo on 15 and 16 January \n2013, \n\nA/RES/75/312 \nZone of peace and cooperation of the South Atlantic\n \n21-10594\n2/3 \n \n \nRecalling the first ZPCSA Seminar on Maritime Traffic Safety and Surveillance, \nheld in Salvador in 2013, and the ZPCSA Peacekeeping Operations Seminar, held in \nSalvador in 2015, in accordance with the Montevideo Plan of Action1 and building on \nthe Luanda Initiative, \n \nAlso noting with appreciation the intensification of cooperation among States \nmembers of the zone in the maritime security domain, including through joint naval \nexercises, international symposia and other capacity-building initiatives, \n \nRecalling its relevant resolutions, in which it urged States of the region to \ncontinue their actions aimed at fulfilling the objectives of the zone of peace and \ncooperation of the South Atlantic, especially through the implementation of specific \nprogrammes, \n \nRecalling the latest report of the Secretary-General on the ZPCSA,2 \n \n1. \nStresses the role of the zone of peace and cooperation of the South Atlantic \nas a forum for increased interaction, coordination and cooperation among its member \nStates; \n \n2. \nRecalls with appreciation the holding of the seventh ministerial meeting \nof the zone of peace and cooperation of the South Atlantic, in Montevideo on 15 and \n16 January 2013, and the adoption of the Montevideo Declaration 3  and the \nMontevideo Plan of Action; \n \n3. \nCalls upon States to cooperate in the promotion of the objectives of peace \nand cooperation established in resolution 41/11 and reiterated in the Montevideo \nDeclaration and the Montevideo Plan of Action; \n \n4. \nRequests the relevant organizations, organs and bodies of the United \nNations system, and invites relevant partners, including international financial \ninstitutions, to render all appropriate assistance that States members of the zone of \npeace and cooperation of the South Atlantic may seek in their joint efforts to continue \nto implement the Montevideo Plan of Action; \n \n5. \nEncourages the convening of ministerial meetings on a biennial basis, as \nwell as annual meetings on the sidelines of the General Assembly, and the \nestablishment of a follow-up mechanism, as decided in the Montevideo Declaration; \n \n6. \nAcknowledges the presentation during the seventh ministerial meeting of \na number of bilateral cooperation programmes which complement the efforts aimed \nat enhancing cooperation within the zone of peace and cooperation of the South \nAtlantic; \n \n7. \nAlso recalls the offer by the Government of Cabo Verde to host the eighth \nministerial meeting of the zone of peace and cooperation of the South Atlantic in the \nnear future, and invites the States members of the Zone to actively participate in the \npreparatory process for such meeting; \n \n8. \nRequests the Secretary-General to keep the implementation of resolution \n41/11 and subsequent resolutions on the zone of peace and cooperation of the South \nAtlantic under review and to submit a report to the General Assembly at its seventy-\nsixth session, taking into account, inter alia, the views expressed by Member States; \n__________________ \n \n1  A/67/746, annex II. \n \n2  A/69/973 and A/69/973/Add.1. \n \n3  A/67/746, annex I. \n\nZone of peace and cooperation of the South Atlantic \nA/RES/75/312\n \n3/3\n21-10594 \n \n \n9. \nDecides to include in the provisional agenda of its seventy-sixth session \nthe item entitled \u201cZone of peace and cooperation of the South Atlantic\u201d.  \n \n96th plenary meeting \n29 July 2021 \n \n",
  "paragraphs": {
    "1": "Stresses the role of the zone of peace and cooperation of the South Atlantic as a forum for increased interaction, coordination and cooperation among its member States;",
    "2": "Recalls with appreciation the holding of the seventh ministerial meeting of the zone of peace and cooperation of the South Atlantic, in Montevideo on 15 and 16 January 2013, and the adoption of the Montevideo Declaration 3 and the Montevideo Plan of Action;",
    "3": "Calls upon States to cooperate in the promotion of the objectives of peace and cooperation established in resolution 41/11 and reiterated in the Montevideo Declaration and the Montevideo Plan of Action;",
    "4": "Requests the relevant organizations, organs and bodies of the United Nations system, and invites relevant partners, including international financial institutions, to render all appropriate assistance that States members of the zone of peace and cooperation of the South Atlantic may seek in their joint efforts to continue to implement the Montevideo Plan of Action;",
    "5": "Encourages the convening of ministerial meetings on a biennial basis, as well as annual meetings on the sidelines of the General Assembly, and the establishment of a follow-up mechanism, as decided in the Montevideo Declaration;",
    "6": "Acknowledges the presentation during the seventh ministerial meeting of a number of bilateral cooperation programmes which complement the efforts aimed at enhancing cooperation within the zone of peace and cooperation of the South Atlantic;",
    "7": "Also recalls the offer by the Government of Cabo Verde to host the eighth ministerial meeting of the zone of peace and cooperation of the South Atlantic in the near future, and invites the States members of the Zone to actively participate in the preparatory process for such meeting;",
    "8": "Requests the Secretary-General to keep the implementation of resolution 41/11 and subsequent resolutions on the zone of peace and cooperation of the South Atlantic under review and to submit a report to the General Assembly at its seventy- sixth session, taking into account, inter alia, the views expressed by Member States; __________________ 1 A/67/746, annex II. 2 A/69/973 and A/69/973/Add.1. 3 A/67/746, annex I. Zone of peace and cooperation of the South Atlantic A/RES/75/312 3/3 21-10594",
    "9": "Decides to include in the provisional agenda of its seventy-sixth session the item entitled \u201cZone of peace and cooperation of the South Atlantic\u201d. 96th plenary meeting 29 July 2021"
  },
  "agenda_items": [
    "Item 36"
  ],
  "symbol_references": [
    "A/75/L.113"
  ]
}