{
  "symbol": "A/RES/79/122",
  "filename": "A_RES_79_122.pdf",
  "title": "79/122. United Nations Conference of Plenipotentiaries on Prevention and Punishment of Crimes against Humanity",
  "text": "United Nations \nA/RES/79/122\n \n \nGeneral Assembly \nDistr.: General \n12 December 2024 \n \n24-23508 (E)     \n*2423508* \n \n \nSeventy-ninth session \nAgenda item 80 \nCrimes against humanity \n \n \n \n \n Resolution adopted by the General Assembly \non 4 December 2024 \n \n \n \n \n[on the report of the Sixth Committee (A/79/470, para. 14)] \n \n \n 79/122. United Nations Conference of Plenipotentiaries on Prevention and \nPunishment of Crimes against Humanity \n \n \n \nThe General Assembly, \n \nHaving considered chapter IV of the report of the International Law \nCommission on the work of its seventy-first session,1 which contains the draft articles \non prevention and punishment of crimes against humanity,2 \n \nRecalling that the Commission decided to recommend the draft articles on \nprevention and punishment of crimes against humanity to the General Assembly and \nrecommended the elaboration of a convention by the Assembly or by an international \nconference of plenipotentiaries on the basis of the draft articles,3 \n \nEmphasizing the continuing importance of the codification and progressive \ndevelopment of international law, as referred to in Article 13, paragraph 1 (a), of the \nCharter of the United Nations, \n \nRecalling its resolutions 74/187 of 18 December 2019, 75/136 of 15 December \n2020, 76/114 of 9 December 2021 and 77/249 of 30 December 2022,  \n \nRecalling also the written summary of the deliberations at the first resumed \nsession (2023) and the second resumed session (2024) of the Sixth Committee on the \ndraft articles on prevention and punishment of crimes against humanity and on the \nrecommendation of the Commission,4 as well as the summary by the Chair of the \nCommittee, annexed thereto,  \n__________________ \n \n1  Official Records of the General Assembly, Seventy-fourth Session, Supplement No. 10 (A/74/10). \n \n2  Ibid., chap. IV, sect. E.1. \n \n3  Ibid., sect. C. \n \n4  A/C.6/78/2. \n\nA/RES/79/122 \nUnited Nations Conference of Plenipotentiaries on Prevention and \nPunishment of Crimes against Humanity\n \n24-23508\n2/4 \n \n \nNoting that a number of suggestions for changes to the draft articles were \npresented by Governments, including at the resumed sessions of the Sixth Committee \nheld during the seventy-seventh and seventy-eighth sessions of the General Assembly,  \n \nDeeply disturbed by the persistence of crimes against humanity, and recognizing \nthe need to prevent and punish such crimes, which are among the most serious crimes \nof concern to the international community as a whole,  \n \nEmphasizing that States have the primary responsibility to prevent and punish \ncrimes against humanity, \n \n1. \nExpresses its appreciation to the International Law Commission for its \ncontinuing contribution to the codification and progressive development of \ninternational law; \n \n2. \nTakes note of all the views, comments and concerns expressed in the \ndebates of the Sixth Committee on crimes against humanity5 including at its resumed \nsessions held during the seventy-seventh and seventy-eighth sessions of the General \nAssembly,6 as well as the comments and observations received from Governments on \nthe draft articles on prevention and punishment of crimes against humanity and on \nany future action thereon;  \n \n3. \nAlso takes note of the written summary of the deliberations during the two \nresumed sessions of the Sixth Committee held during the seventy-seventh and \nseventy-eighth sessions of the General Assembly, as well as the report of the \nSecretary-General prepared pursuant to Assembly resolution 77/249 on the basis of \nwritten comments and observations submitted by Governments on the draft articles \nand on the recommendation of the Commission;7 \n \n4. \nDecides to convene the United Nations Conference of Plenipotentiaries on \nPrevention and Punishment of Crimes against Humanity, to meet at United Nations \nHeadquarters in New York for three consecutive weeks in early 2028, and for three \nconsecutive weeks in 2029, unless otherwise agreed by the Preparatory Committee, \nto elaborate and conclude a legally binding instrument on prevention and punishment \nof crimes against humanity, with a possibility to hold an additional session, if \nnecessary, bearing in mind the aim of developing an instrument enjoying the broadest \npossible support; \n \n5. \nRefers to the Conference a compiled text, to serve as the basis for \nnegotiations, consisting of both the draft articles and a compilation of proposals for \namendments to the draft articles submitted by Governments, and also refers the \ncommentaries to the draft articles, 8  the written comments and observations of \nGovernments, the views expressed in discussions at the seventy-fourth to seventy-\neighth sessions of the General Assembly, the written summary of the resumed sessions \nof the Sixth Committee and the recommendation of the Commission; \n__________________ \n \n5  See A/C.6/74/SR.23, A/C.6/74/SR.24, A/C.6/74/SR.25, A/C.6/74/SR.26, A/C.6/74/SR.27, \nA/C.6/74/SR.30, A/C.6/75/SR.5, A/C.6/75/SR.6, A/C.6/76/SR.8, A/C.6/76/SR.9, A/C.6/76/SR.29, \nA/C.6/77/SR.9, A/C.6/77/SR.10 and A/C.6/77/SR.11. \n \n6  See A/C.6/77/SR.37, A/C.6/77/SR.38, A/C.6/77/SR.39, A/C.6/77/SR.40, A/C.6/77/SR.41, \nA/C.6/77/SR.42, A/C.6/77/SR.43, A/C.6/77/SR.44, A/C.6/77/SR.45, A/C.6/78/SR.38, \nA/C.6/78/SR.39, A/C.6/78/SR.40, A/C.6/78/SR.41, A/C.6/78/SR.42, A/C.6/78/SR.43, \nA/C.6/78/SR.44, A/C.6/78/SR.45, A/C.6/78/SR.46 and A/C.6/78/SR.47. \n \n7  A/78/717, A/78/717/Corr.1 and A/78/717/Add.1. \n \n8  Official Records of the General Assembly, Seventy-fourth Session, Supplement No. 10 (A/74/10), \npara. 45. \n\nUnited Nations Conference of Plenipotentiaries on Prevention and \nPunishment of Crimes against Humanity \nA/RES/79/122\n \n3/4\n24-23508 \n \n \n6. \nDecides to convene a preparatory committee for the Conference, to meet \nfor two consecutive weeks, from 19 to 30 January 2026, and for four days, in 2027, \nat United Nations Headquarters in New York; \n \n7. \nAlso decides to convene a working group, which shall be governed by the \nrules of procedure of the General Assembly, to meet for the entire first session of the \nPreparatory Committee to facilitate consultations on the draft articles, and to enable \nGovernments to prepare formal proposals for amendments to the draft articles for \nconsideration by the United Nations Conference of Plenipotentiaries on Prevention \nand Punishment of Crimes against Humanity to be included in the compiled text, and \nencourages Governments to include experts in the relevant fields in their delegations \nto the working group;  \n \n8. \nFurther decides that the Preparatory Committee shall also discuss the \norganization and methods of work of the Conference, including the rules of procedure, \nwith a view to making recommendations thereon, at its second session, to the \nConference, taking into account the importance of promoting consensus on the final \nresults of the work of the Conference, requests the Secretary-General to prepare \nproposals thereon for the consideration of the Preparatory Committee, decides that \nthe Preparatory Committee shall also prepare the compiled text for submission to the \nConference, and shall also decide, at its first session, on the participation of \nstakeholders other than those referred to in paragraph 16, and decides that, upon \ncompletion of its mandate, the Preparatory Committee shall report directly to the \nConference; \n \n9. \nInvites Governments to submit to the Secretary-General, no later than \n30 April 2026, proposals for amendments to the draft articles for inclusion in the \ncompiled text, and requests the Secretary-General to submit a proposed compiled text \nto the Preparatory Committee at its second session; \n \n10. Decides that the rules of procedure of the General Assembly shall apply \nprovisionally to the procedure of the Conference until otherwise agreed by the \nConference; \n \n11. Also decides that the Conference shall exhaust every effort in good faith \nto reach agreement on substantive matters by consensus; \n \n12. Encourages participants in the Conference to organize consultations on \nissues of substance, prior to the convening of the Conference, in order to facilitate the \nconclusion of its work; \n \n13. Decides that the Conference will be undertaken in an open and transparent \nmanner, with a view to promoting universal adherence, and emphasizes the need to \nensure the widest possible and effective participation in the Conference; \n \n14. Also decides that the Conference and the Preparatory Committee shall be \nopen to all States Members of the United Nations and members of the specialized \nagencies, and requests the Secretary-General to invite those States to participate in \nthe Conference; \n \n15. Further decides that the Conference and the Preparatory Committee shall \nbe open to observers having received a standing invitation to participate in the \nsessions and the work of the General Assembly, on the understanding that they shall \nparticipate in the Conference in accordance with the rights and privileges conferred \nupon them by the Assembly, and requests the Secretary-General to invite them to the \nConference, and also to invite, as observers to the Conference, representatives of \ninterested regional intergovernmental organizations and other interested international \nbodies; \n\nA/RES/79/122 \nUnited Nations Conference of Plenipotentiaries on Prevention and \nPunishment of Crimes against Humanity\n \n24-23508\n4/4 \n \n \n16. Decides that attendance at the Conference and the Preparatory Committee \nas observers will also be opened to relevant non-governmental organizations in \nconsultative status with the Economic and Social Council in accordance with the \nprovisions of Council resolution 1996/31 of 25 July 1996; \n \n17. Also decides that participation in respect of paragraphs 8 and 16 above \nmeans attending formal meetings, receiving copies of the official documents, making \ntheir materials available to delegates and addressing the meetings, through a limited \nnumber of their representatives, as appropriate; \n \n18. Invites the States referred to in paragraph 14 above to include as far as \npossible among their representatives experts competent in the field to be considered; \n \n19. Requests the Secretary-General to arrange for the attendance at the \nConference and the first session of the Preparatory Committee, as an expert, of the \nSpecial Rapporteur of the International Law Commission on crimes against humanity; \n \n20. Also requests the Secretary-General to appoint a Secretary-General of the \nConference to serve as focal point within the Secretariat for providing support to the \norganization of the Conference; \n \n21. Further requests the Secretary-General to provide the Preparatory \nCommittee and the Conference with the necessary assistance for the performance of \ntheir work, including secretariat services and the provision of essential background \ninformation and relevant documents, including summary records, as appropriate, and \nUnited Nations media coverage, and to arrange for support to be provided by the \nCodification Division of the Office of Legal Affairs of the Secretariat; \n \n22. Decides to include in the provisional agenda of its eightieth session the \nitem entitled \u201cCrimes against humanity\u201d. \n \n47th plenary meeting \n4 December 2024 \n \n",
  "paragraphs": {
    "1": "Expresses its appreciation to the International Law Commission for its continuing contribution to the codification and progressive development of international law;",
    "2": "Takes note of all the views, comments and concerns expressed in the debates of the Sixth Committee on crimes against humanity5 including at its resumed sessions held during the seventy-seventh and seventy-eighth sessions of the General Assembly,6 as well as the comments and observations received from Governments on the draft articles on prevention and punishment of crimes against humanity and on any future action thereon;",
    "3": "Also takes note of the written summary of the deliberations during the two resumed sessions of the Sixth Committee held during the seventy-seventh and seventy-eighth sessions of the General Assembly, as well as the report of the Secretary-General prepared pursuant to Assembly resolution 77/249 on the basis of written comments and observations submitted by Governments on the draft articles and on the recommendation of the Commission;7",
    "4": "Decides to convene the United Nations Conference of Plenipotentiaries on Prevention and Punishment of Crimes against Humanity, to meet at United Nations Headquarters in New York for three consecutive weeks in early 2028, and for three consecutive weeks in 2029, unless otherwise agreed by the Preparatory Committee, to elaborate and conclude a legally binding instrument on prevention and punishment of crimes against humanity, with a possibility to hold an additional session, if necessary, bearing in mind the aim of developing an instrument enjoying the broadest possible support;",
    "5": "Refers to the Conference a compiled text, to serve as the basis for negotiations, consisting of both the draft articles and a compilation of proposals for amendments to the draft articles submitted by Governments, and also refers the commentaries to the draft articles, 8 the written comments and observations of Governments, the views expressed in discussions at the seventy-fourth to seventy- eighth sessions of the General Assembly, the written summary of the resumed sessions of the Sixth Committee and the recommendation of the Commission;",
    "6": "Decides to convene a preparatory committee for the Conference, to meet for two consecutive weeks, from 19 to 30 January 2026, and for four days, in 2027, at United Nations Headquarters in New York;",
    "7": "Also decides to convene a working group, which shall be governed by the rules of procedure of the General Assembly, to meet for the entire first session of the Preparatory Committee to facilitate consultations on the draft articles, and to enable Governments to prepare formal proposals for amendments to the draft articles for consideration by the United Nations Conference of Plenipotentiaries on Prevention and Punishment of Crimes against Humanity to be included in the compiled text, and encourages Governments to include experts in the relevant fields in their delegations to the working group;",
    "8": "Further decides that the Preparatory Committee shall also discuss the organization and methods of work of the Conference, including the rules of procedure, with a view to making recommendations thereon, at its second session, to the Conference, taking into account the importance of promoting consensus on the final results of the work of the Conference, requests the Secretary-General to prepare proposals thereon for the consideration of the Preparatory Committee, decides that the Preparatory Committee shall also prepare the compiled text for submission to the Conference, and shall also decide, at its first session, on the participation of stakeholders other than those referred to in paragraph 16, and decides that, upon completion of its mandate, the Preparatory Committee shall report directly to the Conference;",
    "9": "Invites Governments to submit to the Secretary-General, no later than 30 April 2026, proposals for amendments to the draft articles for inclusion in the compiled text, and requests the Secretary-General to submit a proposed compiled text to the Preparatory Committee at its second session;",
    "10": "Decides that the rules of procedure of the General Assembly shall apply provisionally to the procedure of the Conference until otherwise agreed by the Conference;",
    "11": "Also decides that the Conference shall exhaust every effort in good faith to reach agreement on substantive matters by consensus;",
    "12": "Encourages participants in the Conference to organize consultations on issues of substance, prior to the convening of the Conference, in order to facilitate the conclusion of its work;",
    "13": "Decides that the Conference will be undertaken in an open and transparent manner, with a view to promoting universal adherence, and emphasizes the need to ensure the widest possible and effective participation in the Conference;",
    "14": "Also decides that the Conference and the Preparatory Committee shall be open to all States Members of the United Nations and members of the specialized agencies, and requests the Secretary-General to invite those States to participate in the Conference;",
    "15": "",
    "16": "Decides that attendance at the Conference and the Preparatory Committee as observers will also be opened to relevant non-governmental organizations in consultative status with the Economic and Social Council in accordance with the provisions of Council resolution 1996/31 of 25 July 1996;",
    "17": "Also decides that participation in respect of paragraphs 8 and 16 above means attending formal meetings, receiving copies of the official documents, making their materials available to delegates and addressing the meetings, through a limited number of their representatives, as appropriate;",
    "18": "Invites the States referred to in paragraph 14 above to include as far as possible among their representatives experts competent in the field to be considered;",
    "19": "Requests the Secretary-General to arrange for the attendance at the Conference and the first session of the Preparatory Committee, as an expert, of the Special Rapporteur of the International Law Commission on crimes against humanity;",
    "20": "Also requests the Secretary-General to appoint a Secretary-General of the Conference to serve as focal point within the Secretariat for providing support to the organization of the Conference;",
    "21": "Further requests the Secretary-General to provide the Preparatory Committee and the Conference with the necessary assistance for the performance of their work, including secretariat services and the provision of essential background information and relevant documents, including summary records, as appropriate, and United Nations media coverage, and to arrange for support to be provided by the Codification Division of the Office of Legal Affairs of the Secretariat;",
    "22": "Decides to include in the provisional agenda of its eightieth session the item entitled \u201cCrimes against humanity\u201d."
  },
  "agenda_items": [
    "Item 80"
  ],
  "symbol_references": []
}