{
  "symbol": "A/RES/75/308",
  "filename": "A_RES_75_308.pdf",
  "title": "75/308. Scope, modalities, format and organization of the high-level meeting on improving global road safety",
  "text": "United Nations \nA/RES/75/308\n \n \nGeneral Assembly \nDistr.: General \n22 July 2021 \n \n21-10118 (E)    280721     \n*2110118* \n \n \nSeventy-fifth session \nAgenda item 12 \nImproving global road safety \n \n \n \n \n Resolution adopted by the General Assembly \non 21 July 2021 \n \n \n \n \n[without reference to a Main Committee (A/75/L.109)] \n \n \n 75/308. Scope, modalities, format and organization of the high-level \nmeeting on improving global road safety \n \n \n \nThe General Assembly, \n \nRecognizing that, through the adoption of the 2030 Agenda for Sustainable \nDevelopment1 and its Sustainable Development Goals in September 2015, Heads of \nState and Government made a bold commitment to halve the number of global deaths \nand injuries from road traffic accidents and to provide access to safe, affordable, \naccessible and sustainable transport systems for all, improving road safety,  \n \nRecalling that the Sustainable Development Goals and targets are integrated and \nindivisible and balance the three dimensions of sustainable development, and \nacknowledging the importance of reaching the road safety-related targets of the \n2030 Agenda,  \n \nRecognizing that the adoption of the Addis Ababa Action Agenda of the Third \nInternational Conference on Financing for Development 2 highlighted the importance \nof investing in sustainable and resilient transport infrastructure,  \n \nAcknowledging that the New Urban Agenda adopted at the United Nations \nConference on Housing and Sustainable Urban Development (Habitat III) 3 supported \nmeasures to improve road safety and integrate it into sustainable mobility and \ntransport infrastructure planning and design,  \n \nRecalling the outcome of the high-level meeting on universal health coverage, \nand reaffirming its political declaration, entitled \u201cUniversal health coverage: moving \ntogether to build a healthier world\u201d,4 in which it reiterated, inter alia, the need to \n__________________ \n \n1  Resolution 70/1. \n \n2  Resolution 69/313, annex \n \n3  Resolution 71/256, annex.  \n \n4  Resolution 74/2. \n\nA/RES/75/308 \nScope, modalities, format and organization of the high-level \nmeeting on improving global road safety\n \n21-10118\n2/5 \n \naddress the growing burden of injuries and deaths, including those related to road \ntraffic accidents, \n \nRecalling also its resolution 64/255 of 2 March 2010, by which it proclaimed \nthe period 2011\u20132020 as the Decade of Action for Road Safety, and acknowledging \nthe lessons learned from the Decade,  \n \nRecalling further resolutions 57.10 of 22 May 20045 and 69.7 of 28 May 20166 \nadopted by the World Health Assembly, in which it addressed the issue of road safety \nand health and the challenges of the United Nations Decade of Action for Road Safety \n(2011\u20132020),  \n \nAcknowledging the importance of the Moscow Declaration adopted at the first \nGlobal Ministerial Conference on Road Safety in 2009, 7 the Brasilia Declaration \nadopted at the second Global High-level Conference on Road Safety in 2015 and the \nStockholm Declaration adopted at the third Global Ministerial Conference on Road \nSafety in 2020,  \n \nExpressing deep concern that the number of road traffic crashes remains \nunacceptably high, particularly in developing countries, and that crashes represent a \nleading cause of death and injury around the world, killing more than 1.35 million \npeople and injuring as many as 50 million people a year, with 90 per cent of those \ncasualties occurring in developing countries,  \n \nRecalling the proclamation of the period 2021\u20132030 as the Second Decade of \nAction for Road Safety, with a goal of reducing road traffic deaths and injuries by at \nleast 50 per cent from 2021 to 2030, in line with the pledge of the 2019 high-level \npolitical forum on sustainable development convened under the auspices of the \nGeneral Assembly,  \n \nRecalling also its resolution 74/299 of 31 August 2020, entitled \u201cImproving \nglobal road safety\u201d, in which it decided to convene, no later than the end of 2022, the \nfirst ever high-level meeting of the General Assembly on improving global road \nsafety,  \n \n1. \nDecides that the high-level meeting of the General Assembly on improving \nglobal road safety shall be held in New York in 2022 back-to-back with the high-level \npolitical forum on sustainable development convened under the auspices of the \nEconomic and Social Council, with a view to addressing gaps and challenges, \nmobilizing political leadership, promoting multisectoral and multi-stakeholder \ncollaboration in this regard, and assessing the progress made in attaining the \nobjectives of the road safety-related targets of the 2030 Agenda for Sustainable \nDevelopment;  \n \n2. \nAlso decides that the overall theme of the high-level meeting will be \u201cThe \n2030 horizon for road safety: securing a decade of action and delivery\u201d;  \n \n3. \nFurther decides that the organizational arrangements for the high-level \nmeeting should be as follows:  \n \n(a) \nThe high-level meeting will comprise an opening segment, a plenary \nsegment, up to three multi-stakeholder thematic panel discussions and a brief closing \nsegment;  \n \n(b) \nThe opening segment, to be held from 10 to 10.30 a.m. on the first day, \nwill feature statements by the President of the General Assembly at its seventy-sixth \n__________________ \n \n5  See World Health Organization, document WHA57/2004/REC/1. \n \n6  See World Health Organization, document WHA69/2016/REC/1.  \n \n7  A/64/540, annex. \n\nScope, modalities, format and organization of the high-level \nmeeting on improving global road safety \nA/RES/75/308\n \n3/5\n21-10118 \n \nsession, the Secretary-General, the Director General of the World Health Organization \nand the Special Envoy of the Secretary-General for Road Safety;   \n \n(c) \nThe plenary segment, to be held from 10.30 a.m. to 1 p.m. and from 3 to \n6 p.m. on the first day and from 4.30 to 5.30 p.m. on the second day, will comprise \nstatements by Member States and observers of the General Assembly; a list of \nspeakers will be established in accordance with the rules of procedure and established \npractices of the Assembly and the time limits for these statements will be three \nminutes for individual delegations and five minutes for statements made on behalf of \na group of States;  \n \n(d) \nThe closing segment, to be held from 5.30 to 6 p.m. on the second day, \nwill comprise summaries of the multi-stakeholder thematic panel discussions and \nconcluding remarks by the President of the General Assembly;  \n \n4. \nDecides that the organizational arrangements for the multi-stakeholder \nthematic panel discussions will be as follows:  \n \n(a) \nUp to three multi-stakeholder panels will be held from 10 a.m. to 1 p.m. \nand from 3 to 4.30 p.m. on the second day;  \n \n(b) \nEach of the multi-stakeholder panel discussions will be co-chaired by two \nrepresentatives, one from a developed country and one from a developing country, to \nbe appointed by the President of the General Assembly from among the senior \nrepresentatives of Member States attending the high-level meeting, in consultation \nwith Member States, taking into account gender balance, level of development and \ngeographical representation;  \n \n(c) \nThe themes of the multi-stakeholder panels will take into consideration the \nroad safety-related targets of the 2030 Agenda, as well as the interactive \nmulti-stakeholder hearing, with a view to ensuring the most effective and efficient \noutcomes and potential deliverables and to sharing experiences and lessons learned \nto address remaining implementation gaps;  \n \n(d) \nThe President of the General Assembly should consider inviting \nparliamentarians, local governments, the heads or senior representatives of Member \nStates, relevant United Nations entities, including the World Bank, development \npartners, civil society, the private sector, academia, youth-led organizations, medical \nassociations, indigenous leadership and community organizations to serve as speakers \nin the panel discussions, taking into account gender balance, level of development \nand geographical representation;  \n \n5. \nAlso decides that the high-level meeting shall adopt a concise and action-\noriented political \ndeclaration, \nagreed \nin \nadvance by \nconsensus through \nintergovernmental negotiations, to be submitted by the President of the General \nAssembly for adoption by the Assembly;  \n \n6. \nInvites the President of the General Assembly, with the support of the \nWorld Health Organization and the United Nations regional commissions, in \ncooperation with other relevant partners, to convene, as part of the preparatory \nprocess for the high-level meeting, before the end of 2021, preside over and prepare \na summary of an informal one-day supporting event which will comprise two \nsegments as follows:  \n \n(a) \nAn interactive thematic dialogue on investment in road safety, to be held \nfrom 10 a.m. to 1 p.m., in order to discuss the importance of road safety-related \ndomestic and international finance for achieving the road safety-related Sustainable \nDevelopment Goal targets and its broader positive impact on public health and the \neconomy;  \n\nA/RES/75/308 \nScope, modalities, format and organization of the high-level \nmeeting on improving global road safety\n \n21-10118\n4/5 \n \n \n(b) \nAn interactive multi-stakeholder hearing, to be held from 3 to 6 p.m., with \nthe active participation of representatives of Member States, observers of the General \nAssembly, parliamentarians, representatives of local governments, relevant United \nNations entities, invited civil society organizations, including non-governmental \norganizations in consultative status with the Economic and Social Council, \nphilanthropic foundations, academia and medical associations, as well as the private \nsector and broader communities, ensuring the participation and voices of women, \nchildren, persons with disabilities, youth and indigenous leadership;  \n \n7. \nEncourages all Member States to participate in the high-level meeting, \nincluding the multi-stakeholder panels, at the highest possible level, and invites all \nobservers of the General Assembly to be represented at the highest possible level;  \n \n8. \nInvites the United Nations system, including funds, programmes and \nspecialized agencies, including the World Health Organization, regional commissions \nand relevant envoys of the Secretary-General, to participate in the high-level meeting, \nas appropriate, and urges them to consider relevant initiatives, such as the United \nNations Road Safety Collaboration, in support of the preparatory process and the \nmeeting, particularly with regard to sharing evidence and good practices, challenges \nand lessons learned, and to demonstrate ambition to accelerate action on global road \nsafety for sustainable development;  \n \n9. \nInvites the Inter-Parliamentary Union to contribute to the high-level \nmeeting;  \n \n10. Invites non-governmental organizations with relevant expertise that are in \nconsultative status with the Economic and Social Council to register with the \nSecretariat to attend the high-level meeting and participate in the interactive \nmulti-stakeholder hearing and the multi-stakeholder panels;  \n \n11. \nRequests the President of the General Assembly to draw up a list of \nrepresentatives of other relevant non-governmental organizations, civil society \norganizations, academic institutions and the private sector who may participate in the \nhigh-level meeting, including its panel discussions, taking into account the principles \nof transparency and equitable geographical representation, with due regard for gender \nparity, to submit the proposed list to Member States for their consideration on a \nnon-objection basis8 and to bring the list to the attention of the Assembly for a final \ndecision by the Assembly on participation in the high-level meeting; \n \n12. Encourages Member States to consider including in their national \ndelegations to the high-level meeting ministers from all relevant ministries, as \nappropriate, as well as representatives such as parliamentarians, mayors and \ngovernors, \nrepresentatives \nof \ncivil \nsociety, \nincluding \nnon-governmental \norganizations, and organizations and networks representing vulnerable road users, \nother stakeholders such as traffic police, employers\u2019 and victims\u2019 associations, \nindigenous leadership, community organizations and faith-based organizations, \nacademia, philanthropic foundations, the private sector and universal health coverage \nnetworks, with due regard to gender equity;  \n \n13. Decides that the proceedings of the high-level meeting will be webcast, \nand encourages the President of the General Assembly and the Secretary-General to \ngive the highest visibility to the high-level meeting, through all relevant media \nplatforms and information and communications technologies;  \n__________________ \n \n8  The list will include proposed as well as final names. The general basis of any objections, if \nrequested by one or more States Members of the United Nations or States members of the \nspecialized agencies, will be made known to the Office of the President of the General \nAssembly and the requester. \n\nScope, modalities, format and organization of the high-level \nmeeting on improving global road safety \nA/RES/75/308\n \n5/5\n21-10118 \n \n \n14. Requests the President of the General Assembly at its seventy-sixth session \nto finalize the organizational arrangements for the high-level meeting, in close \nconsultation with Member States, including the themes of the multi-stakeholder \npanels in line with paragraph 4 (c) of the present resolution. \n \n92nd plenary meeting \n21 July 2021 \n \n",
  "paragraphs": {
    "1": "Decides that the high-level meeting of the General Assembly on improving global road safety shall be held in New York in 2022 back-to-back with the high-level political forum on sustainable development convened under the auspices of the Economic and Social Council, with a view to addressing gaps and challenges, mobilizing political leadership, promoting multisectoral and multi-stakeholder collaboration in this regard, and assessing the progress made in attaining the objectives of the road safety-related targets of the 2030 Agenda for Sustainable Development;",
    "2": "Also decides that the overall theme of the high-level meeting will be \u201cThe 2030 horizon for road safety: securing a decade of action and delivery\u201d;",
    "3": "Further decides that the organizational arrangements for the high-level meeting should be as follows: (a) The high-level meeting will comprise an opening segment, a plenary segment, up to three multi-stakeholder thematic panel discussions and a brief closing segment; (b) The opening segment, to be held from 10 to 10.30 a.m. on the first day, will feature statements by the President of the General Assembly at its seventy-sixth session, the Secretary-General, the Director General of the World Health Organization and the Special Envoy of the Secretary-General for Road Safety; (c) The plenary segment, to be held from 10.30 a.m. to 1 p.m. and from 3 to 6 p.m. on the first day and from 4.30 to 5.30 p.m. on the second day, will comprise statements by Member States and observers of the General Assembly; a list of speakers will be established in accordance with the rules of procedure and established practices of the Assembly and the time limits for these statements will be three minutes for individual delegations and five minutes for statements made on behalf of a group of States; (d) The closing segment, to be held from 5.30 to 6 p.m. on the second day, will comprise summaries of the multi-stakeholder thematic panel discussions and concluding remarks by the President of the General Assembly;",
    "4": "Decides that the organizational arrangements for the multi-stakeholder thematic panel discussions will be as follows: (a) Up to three multi-stakeholder panels will be held from 10 a.m. to 1 p.m. and from 3 to 4.30 p.m. on the second day; (b) Each of the multi-stakeholder panel discussions will be co-chaired by two representatives, one from a developed country and one from a developing country, to be appointed by the President of the General Assembly from among the senior representatives of Member States attending the high-level meeting, in consultation with Member States, taking into account gender balance, level of development and geographical representation; (c) The themes of the multi-stakeholder panels will take into consideration the road safety-related targets of the 2030 Agenda, as well as the interactive multi-stakeholder hearing, with a view to ensuring the most effective and efficient outcomes and potential deliverables and to sharing experiences and lessons learned to address remaining implementation gaps; (d) The President of the General Assembly should consider inviting parliamentarians, local governments, the heads or senior representatives of Member States, relevant United Nations entities, including the World Bank, development partners, civil society, the private sector, academia, youth-led organizations, medical associations, indigenous leadership and community organizations to serve as speakers in the panel discussions, taking into account gender balance, level of development and geographical representation;",
    "5": "Also decides that the high-level meeting shall adopt a concise and action- oriented political declaration, agreed in advance by consensus through intergovernmental negotiations, to be submitted by the President of the General Assembly for adoption by the Assembly;",
    "6": " (b) An interactive multi-stakeholder hearing, to be held from 3 to 6 p.m., with the active participation of representatives of Member States, observers of the General Assembly, parliamentarians, representatives of local governments, relevant United Nations entities, invited civil society organizations, including non-governmental organizations in consultative status with the Economic and Social Council, philanthropic foundations, academia and medical associations, as well as the private sector and broader communities, ensuring the participation and voices of women, children, persons with disabilities, youth and indigenous leadership;",
    "7": "Encourages all Member States to participate in the high-level meeting, including the multi-stakeholder panels, at the highest possible level, and invites all observers of the General Assembly to be represented at the highest possible level;",
    "8": "Invites the United Nations system, including funds, programmes and specialized agencies, including the World Health Organization, regional commissions and relevant envoys of the Secretary-General, to participate in the high-level meeting, as appropriate, and urges them to consider relevant initiatives, such as the United Nations Road Safety Collaboration, in support of the preparatory process and the meeting, particularly with regard to sharing evidence and good practices, challenges and lessons learned, and to demonstrate ambition to accelerate action on global road safety for sustainable development;",
    "9": "Invites the Inter-Parliamentary Union to contribute to the high-level meeting;",
    "10": "Invites non-governmental organizations with relevant expertise that are in consultative status with the Economic and Social Council to register with the Secretariat to attend the high-level meeting and participate in the interactive multi-stakeholder hearing and the multi-stakeholder panels;",
    "11": "Requests the President of the General Assembly to draw up a list of representatives of other relevant non-governmental organizations, civil society organizations, academic institutions and the private sector who may participate in the high-level meeting, including its panel discussions, taking into account the principles of transparency and equitable geographical representation, with due regard for gender parity, to submit the proposed list to Member States for their consideration on a non-objection basis8 and to bring the list to the attention of the Assembly for a final decision by the Assembly on participation in the high-level meeting;",
    "12": "Encourages Member States to consider including in their national delegations to the high-level meeting ministers from all relevant ministries, as appropriate, as well as representatives such as parliamentarians, mayors and governors, representatives of civil society, including non-governmental organizations, and organizations and networks representing vulnerable road users, other stakeholders such as traffic police, employers\u2019 and victims\u2019 associations, indigenous leadership, community organizations and faith-based organizations, academia, philanthropic foundations, the private sector and universal health coverage networks, with due regard to gender equity;",
    "13": "Decides that the proceedings of the high-level meeting will be webcast, and encourages the President of the General Assembly and the Secretary-General to give the highest visibility to the high-level meeting, through all relevant media platforms and information and communications technologies;",
    "14": "Requests the President of the General Assembly at its seventy-sixth session to finalize the organizational arrangements for the high-level meeting, in close consultation with Member States, including the themes of the multi-stakeholder panels in line with paragraph 4 (c) of the present resolution."
  },
  "agenda_items": [
    "Item 12"
  ],
  "symbol_references": [
    "A/75/L.109"
  ]
}