{
  "symbol": "A/RES/78/304",
  "filename": "A_RES_78_304.pdf",
  "title": "78/304. Financing of the United Nations Disengagement Observer Force",
  "text": "United Nations \nA/RES/78/304\n \n \nGeneral Assembly \nDistr.: General \n3 July 2024 \n \n24-12157 (E)     \n*2412157* \n \n \nSeventy-eighth session \nAgenda item 156 (a) \nFinancing of the United Nations peacekeeping forces in the \nMiddle East: United Nations Disengagement Observer Force \n \n \n \n \n Resolution adopted by the General Assembly \non 28 June 2024 \n \n \n \n \n[on the report of the Fifth Committee (A/78/928, para. 6)] \n \n \n 78/304. Financing of the United Nations Disengagement Observer Force \n \n \n \nThe General Assembly, \n \nHaving considered the reports of the Secretary-General on the financing of the \nUnited Nations Disengagement Observer Force 1  and the related report of the \nAdvisory Committee on Administrative and Budgetary Questions, 2  \n \nRecalling Security Council resolution 350 (1974) of 31 May 1974 regarding the \nestablishment of the United Nations Disengagement Observer Force and the \nsubsequent resolutions by which the Council extended the mandate of the Force, the \nlatest of which was resolution 2718 (2023) of 21 December 2023, by which the \nCouncil extended the mandate of the Force until 30 June 2024, \n \nRecalling also its resolution 3211 B (XXIX) of 29 November 1974 on the \nfinancing of the United Nations Emergency Force and of the United Nations \nDisengagement Observer Force and its subsequent resolutions thereon, the latest of \nwhich was resolution 77/291 B of 30 June 2023,  \n \nReaffirming the general principles underlying the financing of United Nations \npeacekeeping operations, as stated in its resolutions 1874 (S-IV) of 27 June 1963, \n3101 (XXVIII) of 11 December 1973 and 55/235 of 23 December 2000,  \n \nMindful of the fact that it is essential to provide the United Nations \nDisengagement Observer Force with the financial resources necessary to enable it to \nfulfil its responsibilities under the relevant resolutions of the Security Council,  \n \n1. \nRequests the Secretary-General to entrust the Head of Mission with the \ntask of formulating future budget proposals in full accordance with the provisions of \nits resolutions 59/296 of 22 June 2005, 60/266 of 30 June 2006, 61/276 of 29 June \n__________________ \n \n1  A/78/582 and A/78/720. \n \n2  A/78/744/Add.1. \n\nA/RES/78/304 \nFinancing of the United Nations Disengagement Observer Force\n \n24-12157\n2/4 \n \n2007, 64/269 of 24 June 2010, 65/289 of 30 June 2011, 66/264 of 21 June 2012, \n69/307 of 25 June 2015, 70/286 of 17 June 2016 and 76/274 of 29 June 2022, as well \nas other relevant resolutions;  \n \n2. \nTakes note of the status of contributions to the United Nations \nDisengagement Observer Force as at 30 April 2024, including the contributions \noutstanding in the amount of 27.6 million United States dollars, representing some \n1.1 per cent of the total assessed contributions, notes with concern that only 104 \nMember States have paid their assessed contributions in full, and urges all other \nMember States, in particular those in arrears, to ensure payment of their outstanding \nassessed contributions; \n \n3. \nExpresses its appreciation to those Member States that have paid their \nassessed contributions in full, and urges all other Member States to make every \npossible effort to ensure payment of their assessed contributions to the Force in full; \n \n4. \nExpresses concern at the financial situation with regard to peacekeeping \nactivities, in particular as regards the reimbursements to troop contributors that bear \nadditional burdens owing to overdue payments by Member States of their \nassessments;  \n \n5. \nEmphasizes that all future and existing peacekeeping missions shall be \ngiven equal and non-discriminatory treatment in respect of financial and \nadministrative arrangements; \n \n6. \nAlso emphasizes that all peacekeeping missions shall be provided with \nadequate resources for the effective and efficient discharge of their respective \nmandates;  \n \n7. \nRequests the Secretary-General to ensure that proposed peacekeeping \nbudgets are based on the relevant legislative mandates; \n \n8. \nEndorses the conclusions and recommendations contained in the report of \nthe Advisory Committee on Administrative and Budgetary Questions, and requests \nthe Secretary-General to ensure their full implementation;  \n \n9. \nRequests the Secretary-General to ensure the full implementation of the \nrelevant provisions of its resolutions 59/296, 60/266, 61/276, 64/269, 65/289, 66/264, \n69/307, 70/286 and 76/274; \n \n10. Also requests the Secretary-General to take all action necessary to ensure \nthat the Force is administered with a maximum of efficiency and economy; \n \n \n \nBudget performance report for the period from 1 July 2022 to 30 June 2023 \n \n \n11. \nTakes note of the report of the Secretary-General on the budget \nperformance of the Force for the period from 1 July 2022 to 30 June 2023; 3 \n \n \n \nBudget estimates for the period from 1 July 2024 to 30 June 2025 \n \n \n12. Decides to appropriate to the special account for the United Nations \nDisengagement Observer Force the amount of 74,611,100 dollars for the period from \n1 July 2024 to 30 June 2025, inclusive of 68,743,800 dollars for the maintenance of \nthe Force, 4,995,400 dollars for the support account for peacekeeping operations and \n871,900 dollars for the United Nations Logistics Base at Brindisi, Italy;  \n \n__________________ \n \n3  A/78/582. \n\nFinancing of the United Nations Disengagement Observer Force \nA/RES/78/304\n \n3/4\n24-12157 \n \n \n \nFinancing of the appropriation for the period from 1 July 2024 to 30 June 2025 \n \n \n13. Decides to apportion among Member States the amount of 37,305,500 \ndollars for the period from 1 July to 31 December 2024, in accordance with the levels \nupdated in its resolution 76/239 of 24 December 2021, taking into account the scale \nof assessments for 2024, as set out in its resolution 76/238 of 24 December 2021, \nsubject to a decision of the Security Council to extend the mandate of the Force;  \n \n14. \nAlso decides that, in accordance with the provisions of its resolution 973 (X) \nof 15 December 1955, there shall be set off against the apportionment among Member \nStates, as provided for in paragraph 13 above, their respective share in the Tax \nEqualization Fund of 1,062,400 dollars, comprising the estimated staff assessment \nincome of 819,100 dollars approved for the Force, the prorated share of 203,600 \ndollars of the estimated staff assessment income approved for the support account and \nthe prorated share of 39,700 dollars of the estimated staff assessment income \napproved for the United Nations Logistics Base;  \n \n15. Further decides to apportion among Member States the amount of \n37,305,600 dollars for the period from 1 January to 30 June 2025, at a monthly rate \nof 6,217,592 dollars, in accordance with the scale of assessments for 2025 and the \nupdated levels,4 subject to a decision of the Security Council to extend the mandate \nof the Force; \n \n16. Decides that, in accordance with the provisions of its resolution 973 (X), \nthere shall be set off against the apportionment among Member States, as provided \nfor in paragraph 15 above, their respective share in the Tax Equalization Fund of \n1,062,500 dollars, comprising the estimated staff assessment income of 819,100 \ndollars approved for the Force, the prorated share of 203,600 dollars of the estimated \nstaff assessment income approved for the support account and the prorated share of \n39,800 dollars of the estimated staff assessment income approved for the United \nNations Logistics Base;  \n \n17. Also decides that, for Member States that have fulfilled their financial \nobligations to the Force, there shall be set off against the apportionment, as provided \nfor in paragraphs 13 and 15 above, their respective share of the unencumbered balance \nand other revenue in the amount of 2,374,100 dollars in respect of the financial period \nended 30 June 2023, in accordance with the levels updated in its resolution 76/239, \ntaking into account the scale of assessments for 2023, as set out in its resolution \n76/238; \n \n18. Further decides that, for Member States that have not fulfilled their \nfinancial obligations to the Force, there shall be set off against their outstanding \nobligations their respective share of the unencumbered balance and other revenue in \nthe total amount of 2,374,100 dollars in respect of the financial period ended 30 June \n2023, in accordance with the scheme set out in paragraph 17 above; \n \n19. Decides that the increase of 147,200 dollars in the estimated staff \nassessment income in respect of the financial period ended 30 June 2023 shall be \nadded to the credits in the amount of 2,374,100 dollars referred to in paragraphs 17 \nand 18 above; \n \n20. Encourages the Secretary-General to continue to take additional measures \nto ensure the safety and security of all personnel participating in the Force under the \nauspices of the United Nations, bearing in mind paragraphs 5 and 6 of Security \nCouncil resolution 1502 (2003) of 26 August 2003; \n__________________ \n \n4  To be adopted by the General Assembly. \n\nA/RES/78/304 \nFinancing of the United Nations Disengagement Observer Force\n \n24-12157\n4/4 \n \n \n21. Invites voluntary contributions to the Force in cash and in the form of \nservices and supplies acceptable to the Secretary-General, to be administered, as \nappropriate, in accordance with the procedure and practices established by the \nGeneral Assembly; \n \n22. Decides to include in the provisional agenda of its seventy-ninth session, \nunder the item entitled \u201cFinancing of the United Nations peacekeeping forces in the \nMiddle East\u201d, the sub-item entitled \u201cUnited Nations Disengagement Observer Force\u201d. \n \n95th plenary meeting \n28 June 2024 \n \n",
  "paragraphs": {
    "1": "Requests the Secretary-General to entrust the Head of Mission with the task of formulating future budget proposals in full accordance with the provisions of its resolutions 59/296 of 22 June 2005, 60/266 of 30 June 2006, 61/276 of 29 June 2007, 64/269 of 24 June 2010, 65/289 of 30 June 2011, 66/264 of 21 June 2012, 69/307 of 25 June 2015, 70/286 of 17 June 2016 and 76/274 of 29 June 2022, as well as other relevant resolutions;",
    "2": "Takes note of the status of contributions to the United Nations Disengagement Observer Force as at 30 April 2024, including the contributions outstanding in the amount of 27.6 million United States dollars, representing some 1.1 per cent of the total assessed contributions, notes with concern that only 104 Member States have paid their assessed contributions in full, and urges all other Member States, in particular those in arrears, to ensure payment of their outstanding assessed contributions;",
    "3": "Expresses its appreciation to those Member States that have paid their assessed contributions in full, and urges all other Member States to make every possible effort to ensure payment of their assessed contributions to the Force in full;",
    "4": "Expresses concern at the financial situation with regard to peacekeeping activities, in particular as regards the reimbursements to troop contributors that bear additional burdens owing to overdue payments by Member States of their assessments;",
    "5": "Emphasizes that all future and existing peacekeeping missions shall be given equal and non-discriminatory treatment in respect of financial and administrative arrangements;",
    "6": "Also emphasizes that all peacekeeping missions shall be provided with adequate resources for the effective and efficient discharge of their respective mandates;",
    "7": "Requests the Secretary-General to ensure that proposed peacekeeping budgets are based on the relevant legislative mandates;",
    "8": "Endorses the conclusions and recommendations contained in the report of the Advisory Committee on Administrative and Budgetary Questions, and requests the Secretary-General to ensure their full implementation;",
    "9": "Requests the Secretary-General to ensure the full implementation of the relevant provisions of its resolutions 59/296, 60/266, 61/276, 64/269, 65/289, 66/264, 69/307, 70/286 and 76/274;",
    "10": "Also requests the Secretary-General to take all action necessary to ensure that the Force is administered with a maximum of efficiency and economy; Budget performance report for the period from 1 July 2022 to 30 June 2023",
    "11": "Takes note of the report of the Secretary-General on the budget performance of the Force for the period from 1 July 2022 to 30 June 2023; 3 Budget estimates for the period from 1 July 2024 to 30 June 2025",
    "12": "Decides to appropriate to the special account for the United Nations Disengagement Observer Force the amount of 74,611,100 dollars for the period from 1 July 2024 to 30 June 2025, inclusive of 68,743,800 dollars for the maintenance of the Force, 4,995,400 dollars for the support account for peacekeeping operations and 871,900 dollars for the United Nations Logistics Base at Brindisi, Italy; Financing of the appropriation for the period from 1 July 2024 to 30 June 2025",
    "13": "Decides to apportion among Member States the amount of 37,305,500 dollars for the period from 1 July to 31 December 2024, in accordance with the levels updated in its resolution 76/239 of 24 December 2021, taking into account the scale of assessments for 2024, as set out in its resolution 76/238 of 24 December 2021, subject to a decision of the Security Council to extend the mandate of the Force;",
    "14": "Also decides that, in accordance with the provisions of its resolution 973 (X) of 15 December 1955, there shall be set off against the apportionment among Member States, as provided for in paragraph 13 above, their respective share in the Tax Equalization Fund of 1,062,400 dollars, comprising the estimated staff assessment income of 819,100 dollars approved for the Force, the prorated share of 203,600 dollars of the estimated staff assessment income approved for the support account and the prorated share of 39,700 dollars of the estimated staff assessment income approved for the United Nations Logistics Base;",
    "15": "Further decides to apportion among Member States the amount of 37,305,600 dollars for the period from 1 January to 30 June 2025, at a monthly rate of 6,217,592 dollars, in accordance with the scale of assessments for 2025 and the updated levels,4 subject to a decision of the Security Council to extend the mandate of the Force;",
    "16": "Decides that, in accordance with the provisions of its resolution 973 (X), there shall be set off against the apportionment among Member States, as provided for in paragraph 15 above, their respective share in the Tax Equalization Fund of 1,062,500 dollars, comprising the estimated staff assessment income of 819,100 dollars approved for the Force, the prorated share of 203,600 dollars of the estimated staff assessment income approved for the support account and the prorated share of 39,800 dollars of the estimated staff assessment income approved for the United Nations Logistics Base;",
    "17": "Also decides that, for Member States that have fulfilled their financial obligations to the Force, there shall be set off against the apportionment, as provided for in paragraphs 13 and 15 above, their respective share of the unencumbered balance and other revenue in the amount of 2,374,100 dollars in respect of the financial period ended 30 June 2023, in accordance with the levels updated in its resolution 76/239, taking into account the scale of assessments for 2023, as set out in its resolution 76/238;",
    "18": "Further decides that, for Member States that have not fulfilled their financial obligations to the Force, there shall be set off against their outstanding obligations their respective share of the unencumbered balance and other revenue in the total amount of 2,374,100 dollars in respect of the financial period ended 30 June 2023, in accordance with the scheme set out in paragraph 17 above;",
    "19": "Decides that the increase of 147,200 dollars in the estimated staff assessment income in respect of the financial period ended 30 June 2023 shall be added to the credits in the amount of 2,374,100 dollars referred to in paragraphs 17 and 18 above;",
    "20": "Encourages the Secretary-General to continue to take additional measures to ensure the safety and security of all personnel participating in the Force under the auspices of the United Nations, bearing in mind paragraphs 5 and 6 of Security Council resolution 1502 (2003) of 26 August 2003;",
    "21": "Invites voluntary contributions to the Force in cash and in the form of services and supplies acceptable to the Secretary-General, to be administered, as appropriate, in accordance with the procedure and practices established by the General Assembly;",
    "22": "Decides to include in the provisional agenda of its seventy-ninth session, under the item entitled \u201cFinancing of the United Nations peacekeeping forces in the Middle East\u201d, the sub-item entitled \u201cUnited Nations Disengagement Observer Force\u201d."
  },
  "agenda_items": [
    "Item 156"
  ],
  "symbol_references": []
}