{
  "symbol": "A/RES/79/326",
  "filename": "A_RES_79_326.pdf",
  "title": "79/326. Cooperation between the United Nations and the Commonwealth of Independent States",
  "text": "United Nations \nA/RES/79/326\n \nGeneral Assembly \nDistr.: General \n27 August 2025 \n25-13721 (E) \n*2513721* \n \n \nSeventy-ninth session \nAgenda item 125 (w) \nCooperation between the United Nations and regional and \nother organizations: cooperation between the United Nations \nand the Commonwealth of Independent States \n \n \n \n \n Resolution adopted by the General Assembly \non 26 August 2025 \n \n \n[without reference to a Main Committee (A/79/L.114)] \n \n \n 79/326. Cooperation between the United Nations and the Commonwealth \nof Independent States \n \n \n \nThe General Assembly, \n \nReferring to the Articles of the Charter of the United Nations that encourage \nmeasures for regional cooperation to advance the purposes and principles of the \nUnited Nations, \n \nReferring also to its resolution 48/237 of 24 March 1994, by which it granted \nthe Commonwealth of Independent States observer status in the General Assembly, \n \nWelcoming the efforts of the States members of the Commonwealth of \nIndependent States to attain objectives consistent with the purposes and principles of \nthe United Nations, \n \nReaffirming that achieving international cooperation in solving international \nproblems of an economic, social, cultural or humanitarian character is one of the \npurposes of the United Nations, \n \nReferring to the relevant resolutions of the Security Council, including \nresolution 1631 (2005) of 17 October 2005, as well as statements by the President of \nthe Council, including the statement of 13 January 2010, 1  in which the Council \nemphasized the importance of developing effective partnerships between the United \nNations and regional and subregional organizations, in accordance with the Charter, \n_______________ \n \n1 S/PRST/2010/1; see Resolutions and Decisions of the Security Council, 1 August 2009\u201331 July \n2010 (S/INF/65). \n\nA/RES/79/326 \nCooperation between the United Nations and the Commonwealth of \nIndependent States\n \n25-13721\n2/2 \n \n \nWelcoming the commitment of the Commonwealth of Independent States to \nintensify and deepen its cooperation with the agencies, programmes and funds of the \nUnited Nations system, \n \nConvinced that strengthening cooperation between the United Nations and the \nCommonwealth of Independent States will advance the purposes and principles of the \nUnited Nations, \n \nRecalling that 2025 marks the eightieth anniversary of the end of the Second \nWorld War, a war which brought untold sorrow to humankind, including the peoples \nof the States members of the Commonwealth of Independent States, \n \nNoting that the eightieth anniversary of the United Nations opens up additional \nopportunities for reaffirming the collective commitment to the purposes and \nprinciples of the Charter and reinvigorating multilateralism, strengthening \ncooperation between the United Nations and regional and subregional organizations \nin the interest of ensuring international peace and security, sustainable socioeconomic \ndevelopment and the realization of human rights, \n \n1. \nNotes the activities of the Commonwealth of Independent States to \nstrengthen regional cooperation in such areas as trade and economic development; \nexchange of statistical data and economic information; culture; education; healthcare; \nsports; tourism; science and innovation; environmental protection and response to \nnatural and human-made disasters; combating organized crime, illicit trafficking in \nnarcotic drugs, psychotropic substances and their precursors, terrorist acts, \nmanifestations of extremism and illegal migration; and other related areas; \n \n2. \nAlso notes the importance of strengthening cooperation and coordination \nbetween the United Nations system and the Commonwealth of Independent States, \nand invites the Secretary-General to hold for that purpose regular consultations with \nthe Secretary-General of the Commonwealth , making use of appropriate inter-agency \nforums and formats, including consultations between the Secretary-General and the \nheads of regional organizations;  \n \n3. \nInvites the specialized agencies and other organizations, programmes and \nfunds of the United Nations system, as well as international financial institutions, to \ndevelop their cooperation with the Commonwealth of Independent States; \n \n4. \nRequests the Secretary-General to report to the General Assembly at its \neighty-first session on the implementation of the present resolution; \n \n5. \nDecides to include in the provisional agenda of its eighty-first session, \nunder the item entitled \u201cCooperation between the United Nations and regional and \nother organizations\u201d, the sub-item entitled \u201cCooperation between the United Nations \nand the Commonwealth of Independent States\u201d. \n \n89th plenary meeting \n26 August 2025 \n \n",
  "paragraphs": {
    "1": "Notes the activities of the Commonwealth of Independent States to strengthen regional cooperation in such areas as trade and economic development; exchange of statistical data and economic information; culture; education; healthcare; sports; tourism; science and innovation; environmental protection and response to natural and human-made disasters; combating organized crime, illicit trafficking in narcotic drugs, psychotropic substances and their precursors, terrorist acts, manifestations of extremism and illegal migration; and other related areas;",
    "2": "Also notes the importance of strengthening cooperation and coordination between the United Nations system and the Commonwealth of Independent States, and invites the Secretary-General to hold for that purpose regular consultations with the Secretary-General of the Commonwealth , making use of appropriate inter-agency forums and formats, including consultations between the Secretary-General and the heads of regional organizations;",
    "3": "Invites the specialized agencies and other organizations, programmes and funds of the United Nations system, as well as international financial institutions, to develop their cooperation with the Commonwealth of Independent States;",
    "4": "Requests the Secretary-General to report to the General Assembly at its eighty-first session on the implementation of the present resolution;",
    "5": "Decides to include in the provisional agenda of its eighty-first session, under the item entitled \u201cCooperation between the United Nations and regional and other organizations\u201d, the sub-item entitled \u201cCooperation between the United Nations and the Commonwealth of Independent States\u201d."
  },
  "agenda_items": [
    "Item 125"
  ],
  "symbol_references": [
    "A/79/L.114"
  ]
}