{
  "symbol": "A/RES/76/64",
  "filename": "A_RES_76_64.pdf",
  "title": "76/64. Convention on Prohibitions or Restrictions on the Use of Certain Conventional Weapons Which May Be Deemed to Be Excessively Injurious or to Have Indiscriminate Effects",
  "text": "United Nations \nA/RES/76/64\n \n \nGeneral Assembly \nDistr.: General \n14 December 2021 \n \n21-18521 (E)    171221 \n*2118521* \n \n \nSeventy-sixth session \nAgenda item 104 \nConvention on Prohibitions or Restrictions on the Use of \nCertain Conventional Weapons Which May Be Deemed to \nBe Excessively Injurious or to Have Indiscriminate Effects \n \n \n \n \n Resolution adopted by the General Assembly \non 6 December 2021 \n \n \n \n \n[on the report of the First Committee (A/76/448, para. 7)] \n \n \n \n76/64. Convention on Prohibitions or Restrictions on the Use of Certain \nConventional Weapons Which May Be Deemed to Be Excessively \nInjurious or to Have Indiscriminate Effects \n \n \n \nThe General Assembly,  \n \nRecalling its resolution 75/85 of 7 December 2020, \n \nRecalling with satisfaction the adoption and entry into force of the Convention \non Prohibitions or Restrictions on the Use of Certain Conventional Weapons Which \nMay Be Deemed to Be Excessively Injurious or to Have Indiscriminate Effects 1 and \nits amended article 1,2 the Protocol on Non-Detectable Fragments (Protocol I),3 the \nProtocol on Prohibitions or Restrictions on the Use of Mines, Booby Traps and Other \nDevices (Protocol II)4 and its amended version,5 the Protocol on Prohibitions or \nRestrictions on the Use of Incendiary Weapons (Protocol III),6 the Protocol on \nBlinding Laser Weapons (Protocol IV)7 and the Protocol on Explosive Remnants of \nWar (Protocol V),8  \n \nRecalling the results of the Fifth Review Conference of the High Contracting \nParties to the Convention, held in Geneva from 12 to 16 December 2016, \n__________________ \n \n1  United Nations, Treaty Series, vol. 1342, No. 22495. \n \n2  Ibid., vol. 2260, No. 22495. \n \n3  Ibid., vol. 1342, No. 22495. \n \n4  Ibid., vol. 1342, No. 22495. \n \n5  Ibid., vol. 2048, No. 22495. \n \n6  Ibid., vol. 1342, No. 22495. \n \n7  Ibid., vol. 2024, No. 22495. \n \n8  Ibid., vol. 2399, No. 22495. \n\nA/RES/76/64 \nConvention on Prohibitions or Restrictions on the Use of Certain \nConventional Weapons Which May Be Deemed to Be Excessively \nInjurious or to Have Indiscriminate Effects\n \n21-18521\n2/4 \n \n \nTaking into account that, due to the extraordinary circumstances related to the \nCOVID-19 pandemic, the 2020 Meeting of the High Contracting Parties did not take \nplace, and technical decisions were adopted by silence procedure, \n \nTaking note of the informal consultations of the High Contracting Parties and \nclose cooperation with each other in 2020 on issues related to the operation of the \nConvention, \n \nWelcoming the technical decisions by the High Contracting Parties to the \nConvention of 3 May 2021,  \n \nWelcoming also the technical decisions by the High Contracting Parties to \nAmended Protocol II of 14 April 2021,  \n \nWelcoming further the technical decisions by the High Contracting Parties to \nProtocol V of 13 April 2021, \n \nNoting with satisfaction that the Meeting of the Group of Experts of the High \nContracting Parties to Amended Protocol II, the Meeting of Experts of the High \nContracting Parties to Protocol V and two out of the three planned sessions of the \nGroup of Governmental Experts related to emerging technologies in the area of lethal \nautonomous weapons systems of the High Contracting Parties to the Convention were \nalready held in 2021, \n \nRecalling the role played by the International Committee of the Red Cross in \nthe elaboration of the Convention and the Protocols thereto, and welcoming the \nparticular efforts of various international, non-governmental and other organizations \nin raising awareness of the humanitarian consequences of various categories of \nconventional weapons which may be deemed to be excessively injurious or to have \nindiscriminate effects, \n \nEmphasizing the importance of the perspectives of women, men, boys and girls \nin considering the issues addressed by the Convention and its Protocols, \n \n1. \nCalls upon all States that have not yet done so to take all measures to \nbecome parties, as soon as possible, to the Convention on Prohibitions or Restrictions \non the Use of Certain Conventional Weapons Which May Be Deemed to Be \nExcessively Injurious or to Have Indiscriminate Effects and the Protocols thereto, as \namended, with a view to achieving the widest possible adherence to these instruments \nat an early date and so as to ultimately achieve their universality; \n \n2. \nCalls upon all High Contracting Parties to the Convention that have not \nyet done so to express their consent to be bound by the Protocols to the Convention \nand the amendment extending the scope of the Convention and the Protocols thereto \nto include armed conflicts of a non-international character; \n \n3. \nEmphasizes the importance of the universalization of the Protocol on \nExplosive Remnants of War (Protocol V); \n \n4. \nWelcomes additional ratifications and acceptances of or accessions to the \nConvention, as well as consents to be bound by the Protocols thereto; \n \n5. \nAcknowledges the continued efforts of the Secretary-General, as \ndepositary of the Convention and the Protocols thereto, and of the respective office \nholders of the conferences of the High Contracting Parties to the Convention, \nProtocol V and Amended Protocol II, on behalf of the High Contracting Parties, to \nachieve the goal of universality; \n \n6. \nRecalls the following decisions by the Fifth Review Conference of the \nHigh Contracting Parties to the Convention: \n\nConvention on Prohibitions or Restrictions on the Use of Certain \nConventional Weapons Which May Be Deemed to Be Excessively \nInjurious or to Have Indiscriminate Effects \nA/RES/76/64\n \n3/4\n21-18521 \n \n \n(a) \nTo establish an open-ended Group of Governmental Experts related to \nemerging technologies in the area of lethal autonomous weapons systems in the \ncontext of the objectives and purposes of the Convention, adhering to the agreed \nrecommendations contained in document CCW/CONF.V/2, and to submit a report to \nthe 2017 Meeting of the High Contracting Parties to the Convention consistent with \nthose recommendations; \n \n(b) \nTo add to the agenda of the next Meeting of the High Contracting Parties \nin 2017 the item \u201cProtocol III\u201d; \n \n(c) \nTo add to the agenda of the next Meeting of the High Contracting Parties \nin 2017 the item \u201cMines other than anti-personnel mines\u201d;9 \n \n(d) \nTo add to the agenda of the next Meeting of the High Contracting Parties \nin 2017 the item for informal discussion \u201cConsideration of how developments in the \nfield of science and technology relevant to the Convention may be addressed under \nthe Convention\u201d; \n \n(e) \nTo invite the Chair-elect to conduct consultations with a view to including \non the agenda of the 2017 annual Meeting of the High Contracting Parties the item \n\u201cStrengthening the respect for international humanitarian law and addressing, in the \ncontext and objectives of the Convention and its annexed Protocols, the challenges \npresented by the use of conventional weapons in armed conflicts and their impact on \ncivilians, particularly in areas where there are concentrations of civilians\u201d; \n \n(f) \nTo include on the agenda of the annual Meetings of the High Contracting \nParties the item \u201cFinancial issues related to the Convention and its annexed Protocols\u201d \nand to consider at the next such meeting efficiency and cost-saving measures and a \nreport to be prepared by the Chair-elect; \n \n(g) \nTo retain the practice of keeping summary records only for the final \nsessions of the future Review Conferences, the meetings of the High Contracting \nParties to the Convention, and the Conferences of the High Contracting Parties to \nAmended Protocol II and Protocol V; \n \n(h) \nTo continue the Sponsorship Programme; \n \n7. \nAlso recalls the following technical decisions by the High Contracting \nParties to the Convention of 3 May 2021: \n \n(a) \nTo organize a total of 20 days of meetings, to be held in Geneva in 2021, \nof the Group of Governmental Experts related to emerging technologies in the area \nof lethal autonomous weapons systems; \n \n(b) \nTo mandate the President-designate of the Sixth Review Conference of the \nHigh Contracting Parties to the Convention to undertake consultations during the \nintersessional period on possible measures to address all aspects of the financial \nsituation of the Convention; \n \n8. \nCalls upon all High Contracting Parties to ensure full and prompt \ncompliance with their financial obligations under the Convention and its annexed \nProtocols; \n \n9. \nWelcomes the technical decisions by the High Contracting Parties to the \nConvention pertaining to the Group of Governmental Experts related to emerging \ntechnologies in the area of lethal autonomous weapons systems; \n__________________ \n \n9  Noting the update included in paragraph 34 of the final report of the 2018 Meeting of the High \nContracting Parties to the Convention (CCW/MSP/2018/11). \n\nA/RES/76/64 \nConvention on Prohibitions or Restrictions on the Use of Certain \nConventional Weapons Which May Be Deemed to Be Excessively \nInjurious or to Have Indiscriminate Effects\n \n21-18521\n4/4 \n \n \n10. Also welcomes the commitment by the High Contracting Parties to \ncontinue to contribute to the further development of international humanitarian law, \nand, in this context, to keep under review both the development of new weapons and \nuses of weapons, which may have indiscriminate effects or cause unnecessary \nsuffering; \n \n11. \nFurther welcomes the commitment of the High Contracting Parties to \nProtocol V to the effective and efficient implementation of the Protocol and the \nimplementation of the decisions of the First and Second Conferences of the High \nContracting Parties to the Protocol establishing a comprehensive framework for the \nexchange of information and cooperation; \n \n12. Notes that, in conformity with article 8 of the Convention, conferences \nmay be convened to examine amendments to the Convention or to any of the Protocols \nthereto, to examine additional protocols concerning other categories of conventional \nweapons not covered by existing Protocols or to review the scope and application of \nthe Convention and the Protocols thereto and to examine any proposed amendments \nor additional protocols; \n \n13. Underlines the vital role of the full and equal participation of women in \ndecision-making and implementation of the Convention; \n \n14. Notes the work of the meeting of the Preparatory Committee for the Sixth \nReview Conference held from 6 to 8 September 2021 under the overall responsibility \nof the President-designate of the Sixth Review Conference;  \n \n15. Requests the Secretary-General to render the assistance necessary and to \nprovide such services as may be required for the Sixth Review Conference, to be held \nfrom 13 to 17 December 2021, and other annual conferences and expert meetings of \nthe High Contracting Parties to the Convention and of the High Contracting Parties \nto Amended Protocol II and Protocol V, as well as for any continuation of the work \nafter the meetings; \n \n16. Also requests the Secretary-General, in his capacity as depositary of the \nConvention and the Protocols thereto, to continue to inform the General Assembly \nperiodically, by electronic means, of ratifications and acceptances of and accessions \nto the Convention, its amended article 1 and the Protocols; \n \n17. Decides to include in the provisional agenda of its seventy-seventh session \nthe item entitled \u201cConvention on Prohibitions or Restrictions on the Use of Certain \nConventional Weapons Which May Be Deemed to Be Excessively Injurious or to \nHave Indiscriminate Effects\u201d. \n \n45th plenary meeting \n6 December 2021 \n \n \n",
  "paragraphs": {
    "1": "Calls upon all States that have not yet done so to take all measures to become parties, as soon as possible, to the Convention on Prohibitions or Restrictions on the Use of Certain Conventional Weapons Which May Be Deemed to Be Excessively Injurious or to Have Indiscriminate Effects and the Protocols thereto, as amended, with a view to achieving the widest possible adherence to these instruments at an early date and so as to ultimately achieve their universality;",
    "2": "Calls upon all High Contracting Parties to the Convention that have not yet done so to express their consent to be bound by the Protocols to the Convention and the amendment extending the scope of the Convention and the Protocols thereto to include armed conflicts of a non-international character;",
    "3": "Emphasizes the importance of the universalization of the Protocol on Explosive Remnants of War (Protocol V);",
    "4": "Welcomes additional ratifications and acceptances of or accessions to the Convention, as well as consents to be bound by the Protocols thereto;",
    "5": "Acknowledges the continued efforts of the Secretary-General, as depositary of the Convention and the Protocols thereto, and of the respective office holders of the conferences of the High Contracting Parties to the Convention, Protocol V and Amended Protocol II, on behalf of the High Contracting Parties, to achieve the goal of universality;",
    "6": " (a) To establish an open-ended Group of Governmental Experts related to emerging technologies in the area of lethal autonomous weapons systems in the context of the objectives and purposes of the Convention, adhering to the agreed recommendations contained in document CCW/CONF.V/2, and to submit a report to the 2017 Meeting of the High Contracting Parties to the Convention consistent with those recommendations; (b) To add to the agenda of the next Meeting of the High Contracting Parties in 2017 the item \u201cProtocol III\u201d; (c) To add to the agenda of the next Meeting of the High Contracting Parties in 2017 the item \u201cMines other than anti-personnel mines\u201d;9 (d) To add to the agenda of the next Meeting of the High Contracting Parties in 2017 the item for informal discussion \u201cConsideration of how developments in the field of science and technology relevant to the Convention may be addressed under the Convention\u201d; (e) To invite the Chair-elect to conduct consultations with a view to including on the agenda of the 2017 annual Meeting of the High Contracting Parties the item \u201cStrengthening the respect for international humanitarian law and addressing, in the context and objectives of the Convention and its annexed Protocols, the challenges presented by the use of conventional weapons in armed conflicts and their impact on civilians, particularly in areas where there are concentrations of civilians\u201d; (f) To include on the agenda of the annual Meetings of the High Contracting Parties the item \u201cFinancial issues related to the Convention and its annexed Protocols\u201d and to consider at the next such meeting efficiency and cost-saving measures and a report to be prepared by the Chair-elect; (g) To retain the practice of keeping summary records only for the final sessions of the future Review Conferences, the meetings of the High Contracting Parties to the Convention, and the Conferences of the High Contracting Parties to Amended Protocol II and Protocol V; (h) To continue the Sponsorship Programme;",
    "7": "Also recalls the following technical decisions by the High Contracting Parties to the Convention of 3 May 2021: (a) To organize a total of 20 days of meetings, to be held in Geneva in 2021, of the Group of Governmental Experts related to emerging technologies in the area of lethal autonomous weapons systems; (b) To mandate the President-designate of the Sixth Review Conference of the High Contracting Parties to the Convention to undertake consultations during the intersessional period on possible measures to address all aspects of the financial situation of the Convention;",
    "8": "Calls upon all High Contracting Parties to ensure full and prompt compliance with their financial obligations under the Convention and its annexed Protocols;",
    "9": "Welcomes the technical decisions by the High Contracting Parties to the Convention pertaining to the Group of Governmental Experts related to emerging technologies in the area of lethal autonomous weapons systems;",
    "10": "Also welcomes the commitment by the High Contracting Parties to continue to contribute to the further development of international humanitarian law, and, in this context, to keep under review both the development of new weapons and uses of weapons, which may have indiscriminate effects or cause unnecessary suffering;",
    "11": "Further welcomes the commitment of the High Contracting Parties to Protocol V to the effective and efficient implementation of the Protocol and the implementation of the decisions of the First and Second Conferences of the High Contracting Parties to the Protocol establishing a comprehensive framework for the exchange of information and cooperation;",
    "12": "Notes that, in conformity with article 8 of the Convention, conferences may be convened to examine amendments to the Convention or to any of the Protocols thereto, to examine additional protocols concerning other categories of conventional weapons not covered by existing Protocols or to review the scope and application of the Convention and the Protocols thereto and to examine any proposed amendments or additional protocols;",
    "13": "Underlines the vital role of the full and equal participation of women in decision-making and implementation of the Convention;",
    "14": "Notes the work of the meeting of the Preparatory Committee for the Sixth Review Conference held from 6 to 8 September 2021 under the overall responsibility of the President-designate of the Sixth Review Conference;",
    "15": "Requests the Secretary-General to render the assistance necessary and to provide such services as may be required for the Sixth Review Conference, to be held from 13 to 17 December 2021, and other annual conferences and expert meetings of the High Contracting Parties to the Convention and of the High Contracting Parties to Amended Protocol II and Protocol V, as well as for any continuation of the work after the meetings;",
    "16": "Also requests the Secretary-General, in his capacity as depositary of the Convention and the Protocols thereto, to continue to inform the General Assembly periodically, by electronic means, of ratifications and acceptances of and accessions to the Convention, its amended article 1 and the Protocols;",
    "17": "Decides to include in the provisional agenda of its seventy-seventh session the item entitled \u201cConvention on Prohibitions or Restrictions on the Use of Certain Conventional Weapons Which May Be Deemed to Be Excessively Injurious or to Have Indiscriminate Effects\u201d."
  },
  "agenda_items": [
    "Item 104"
  ],
  "symbol_references": []
}