{
  "symbol": "A/RES/79/271",
  "filename": "A_RES_79_271.pdf",
  "title": "79/271. Agreement under the United Nations Convention on the Law of the Sea on the Conservation and Sustainable Use of Marine Biological Diversity of Areas beyond National Jurisdiction",
  "text": "United Nations \nA/RES/79/271\n \nGeneral Assembly \nDistr.: General \n4 March 2025 \n25-03668 (E) \n*2503668* \n \n \nSeventy-ninth session \nAgenda item 75 (c) \nOceans and the law of the sea: Agreement under the \nUnited Nations Convention on the Law of the Sea on the \nConservation and Sustainable Use of Marine Biological \nDiversity of Areas beyond National Jurisdiction \n \n \n \n \n Resolution adopted by the General Assembly \non 4 March 2025 \n \n \n[without reference to a Main Committee (A/79/L.55)] \n \n \n 79/271. Agreement under the United Nations Convention on the Law of \nthe Sea on the Conservation and Sustainable Use of Marine \nBiological Diversity of Areas beyond National Jurisdiction \n \n \n \nThe General Assembly, \n \nRecalling its resolution 72/249 of 24 December 2017, in which it decided to \nconvene an intergovernmental conference, under the auspices of the United Nations, \nto consider the recommendations of the Preparatory Committee established by \nresolution 69/292 of 19 June 2015 on the elements and to elaborate the text of an \ninternational legally binding instrument under the United Nations Convention on the \nLaw of the Sea1 on the conservation and sustainable use of marine biological diversity \nof areas beyond national jurisdiction, with a view to developing the instrument as \nsoon as possible, and other relevant resolutions and decisions relating to the \nconvening of sessions of the conference,2 \n \nRecalling also the adoption by the conference, on 19 June 2023, of the \nAgreement under the United Nations Convention on the Law of the Sea on the \nConservation and Sustainable Use of Marine Biological Diversity of Areas beyond \nNational Jurisdiction,3 by consensus,  \n \nRecalling further its resolution 77/321 of 1 August 2023, resolution 78/272 of \n24 April 2024 and decision 78/560 of 13 August 2024 on the Agreement,  \n_______________ \n \n1 United Nations, Treaty Series, vol. 1833, No. 31363. \n \n2 Resolutions 75/239 and 77/248 and decisions 74/543, 75/570, 76/564 and 77/556. \n \n3 A/CONF.232/2023/4. \n\nA/RES/79/271 \nAgreement under the United Nations Convention on the Law of the \nSea on the Conservation and Sustainable Use of Marine Biological \nDiversity of Areas beyond National Jurisdiction\n \n25-03668\n2/3 \n \n \nUnderscoring the importance of the work of the preparatory commission \nestablished by resolution 78/272 to prepare for the entry into force of the Agreement \nand to prepare for the convening of the first meeting of the Conference of the Parties \nto the Agreement,  \n \n1. \nWelcomes the holding of the organizational meeting of the Preparatory \nCommission for the Entry into Force of the Agreement under the United Nations \nConvention on the Law of the Sea on the Conservation and Sustainable Use of Marine \nBiological Diversity of Areas beyond National Jurisdiction and the Convening of the \nFirst Meeting of the Conference of the Parties to the Agreement from 24 to 26 June \n2024 to discuss organizational matters, and recalls its decision 78/560, in which it \nrequested the Secretary-General to, inter alia, convene the first and second sessions \nof the Preparatory Commission from 14 to 25 April and from 18 to 29 August 2025, \nrespectively, and to convene at least one session of 10 working days in 2026, on dates \nto be determined in consultation with the Co-Chairs;  \n \n2. \nTakes note of the statement by the Co-Chair of the Preparatory \nCommission at the closing of the organizational meeting of the Commission; 4 \n \n3. \nEmphasizes the importance of the early entry into force and effective \nimplementation of the Agreement;  \n \n4. \nTakes note of the signatures and ratifications of the Agreement to date; \n \n5. \nCalls upon all States and regional economic integration organizations that \nhave not done so to consider signing and ratifying, approving or accepting the \nAgreement at the earliest possible date, ideally before the 2025 United Nations \nConference to Support the Implementation of Sustainable Development Goal 14: \nConserve and sustainably use the oceans, seas and marine resources for sustainable \ndevelopment, to be co-hosted by Costa Rica and France and held in Nice, France, \nfrom 9 to 13 June 2025, to allow for the early entry into force of the Agreement;  \n \n6. \nInvites Member States, international financial institutions, donor agencies, \nintergovernmental organizations, non\u2011governmental organizations and natural and \njuridical persons to make financial contributions to the voluntary trust fund to assist \ndeveloping countries, in particular the least developed countries, landlocked \ndeveloping countries and small island developing States, in attending the meetings of \nthe Preparatory Commission, and expresses its appreciation to those that have \ncontributed;5 \n \n7. \nNotes with appreciation the capacity-building and technical assistance \nactivities of States, regional economic integration organizations, the Division for \nOcean Affairs and the Law of the Sea of the Office of Legal Affairs of the Secretariat, \nand other relevant United Nations entities and intergovernmental organizations within \ntheir respective mandates, in relation to the Agreement, taking note also of the \ncontributions of other relevant stakeholders in this regard, and encourages the further \nundertaking of such activities; \n \n8. \nRecalls its invitation to States to provide information to the Secretary-\nGeneral on their capacity-building and technical assistance needs with a view to \nbecoming parties to the Agreement to inform the further development and provision \nof capacity-building and technical assistance activities of the Division in support of \nrequesting States becoming parties to the Agreement and the effective implementation \nof the Agreement;  \n_______________ \n \n4 A/AC.296/2024/4. \n \n5 See resolutions 69/292 and 78/272. \n\nAgreement under the United Nations Convention on the Law of the \nSea on the Conservation and Sustainable Use of Marine Biological \nDiversity of Areas beyond National Jurisdiction \nA/RES/79/271\n \n3/3\n25-03668 \n \n \n9. \nDecides to include in the provisional agenda of its eightieth session, under \nthe item entitled \u201cOceans and the law of the sea\u201d, the sub-item entitled \u201cAgreement \nunder the United Nations Convention on the Law of the Sea on the Conservation and \nSustainable Use of Marine Biological Diversity of Areas beyond National \nJurisdiction\u201d.  \n \n58th plenary meeting \n4 March 2025 \n \n",
  "paragraphs": {
    "1": "Welcomes the holding of the organizational meeting of the Preparatory Commission for the Entry into Force of the Agreement under the United Nations Convention on the Law of the Sea on the Conservation and Sustainable Use of Marine Biological Diversity of Areas beyond National Jurisdiction and the Convening of the First Meeting of the Conference of the Parties to the Agreement from 24 to 26 June 2024 to discuss organizational matters, and recalls its decision 78/560, in which it requested the Secretary-General to, inter alia, convene the first and second sessions of the Preparatory Commission from 14 to 25 April and from 18 to 29 August 2025, respectively, and to convene at least one session of 10 working days in 2026, on dates to be determined in consultation with the Co-Chairs;",
    "2": "Takes note of the statement by the Co-Chair of the Preparatory Commission at the closing of the organizational meeting of the Commission; 4",
    "3": "Emphasizes the importance of the early entry into force and effective implementation of the Agreement;",
    "4": "Takes note of the signatures and ratifications of the Agreement to date;",
    "5": "Calls upon all States and regional economic integration organizations that have not done so to consider signing and ratifying, approving or accepting the Agreement at the earliest possible date, ideally before the 2025 United Nations Conference to Support the Implementation of Sustainable Development Goal 14: Conserve and sustainably use the oceans, seas and marine resources for sustainable development, to be co-hosted by Costa Rica and France and held in Nice, France, from 9 to 13 June 2025, to allow for the early entry into force of the Agreement;",
    "6": "Invites Member States, international financial institutions, donor agencies, intergovernmental organizations, non\u2011governmental organizations and natural and juridical persons to make financial contributions to the voluntary trust fund to assist developing countries, in particular the least developed countries, landlocked developing countries and small island developing States, in attending the meetings of the Preparatory Commission, and expresses its appreciation to those that have contributed;5",
    "7": "Notes with appreciation the capacity-building and technical assistance activities of States, regional economic integration organizations, the Division for Ocean Affairs and the Law of the Sea of the Office of Legal Affairs of the Secretariat, and other relevant United Nations entities and intergovernmental organizations within their respective mandates, in relation to the Agreement, taking note also of the contributions of other relevant stakeholders in this regard, and encourages the further undertaking of such activities;",
    "8": "Recalls its invitation to States to provide information to the Secretary- General on their capacity-building and technical assistance needs with a view to becoming parties to the Agreement to inform the further development and provision of capacity-building and technical assistance activities of the Division in support of requesting States becoming parties to the Agreement and the effective implementation of the Agreement;",
    "9": "Decides to include in the provisional agenda of its eightieth session, under the item entitled \u201cOceans and the law of the sea\u201d, the sub-item entitled \u201cAgreement under the United Nations Convention on the Law of the Sea on the Conservation and Sustainable Use of Marine Biological Diversity of Areas beyond National Jurisdiction\u201d."
  },
  "agenda_items": [
    "Item 75"
  ],
  "symbol_references": [
    "A/79/L.55"
  ]
}