{
  "symbol": "A/RES/75/319",
  "filename": "A_RES_75_319.pdf",
  "title": "75/319. Solidarity with and support for the Government and people of Haiti in the aftermath of the recent earthquake",
  "text": "United Nations \nA/RES/75/319\n \n \nGeneral Assembly \nDistr.: General \n1 September 2021 \n \n21-12020 (E)    080921 \n*2112020* \n \n \nSeventy-fifth session \nAgenda item 73 (a) \nStrengthening of the coordination of humanitarian and \ndisaster relief assistance of the United Nations, including \nspecial economic assistance: strengthening of the \ncoordination of emergency humanitarian assistance of the \nUnited Nations \n \n \n \n \n Resolution adopted by the General Assembly \non 30 August 2021 \n \n \n \n \n[without reference to a Main Committee (A/75/L.127 and A/75/L.127/Add.1)] \n \n \n 75/319. Solidarity with and support for the Government and people of \nHaiti in the aftermath of the recent earthquake \n \n \n \nThe General Assembly,  \n \nGuided by the purposes and principles of the Charter of the United Nations,  \n \nReaffirming its resolution 46/182 of 19 December 1991, the annex to which \ncontains the guiding principles for the strengthening of the coordination of emergency \nhumanitarian assistance of the United Nations system, as well as all its resolutions on \ninternational cooperation on humanitarian assistance in the field of natural disasters, \nfrom relief to development, and recalling the resolutions of the humanitarian \nsegments of the substantive sessions of the Economic and Social Council,  \n \nReaffirming also Economic and Social Council resolution 2021/18 of 21 July \n2021, by which the Council extended the mandate of the Ad Hoc Advisory Group on \nHaiti to provide advice on the long-term development strategy of Haiti to promote \nsocioeconomic recovery, reconstruction and stability, with particular attention to the \nneed to ensure coherence and sustainability in international support for Haiti, based \non the long-term national development priorities,  \n \nReaffirming further the principles of humanity, neutrality, impartiality and \nindependence for the provision of humanitarian assistance, \n \nDeeply concerned about the devastating effects of the earthquake that struck \nHaiti on 14 August 2021, followed by the passage of Tropical Storm Grace on \n16 August 2021, which have resulted in significant loss of lives, damage to property, \ndisplacement of residents and the loss of livelihoods, food security and nutrition, \n\nA/RES/75/319 \nSolidarity with and support for the Government and people of \nHaiti in the aftermath of the recent earthquake\n \n21-12020\n2/2 \n \nhealth security and access to social infrastructure, and about the urgent need to restore \nnormal conditions for the population,  \n \nEmphasizing that progress in the recovery and reconstruction of Haiti is crucial \nto achieving lasting stability, security and socioeconomic development,  \n \nReiterating the need for a continued high level of support for and commitment \nto the immediate humanitarian relief phase, early recovery, rehabilitation, \nreconstruction and development efforts, including in the medium and long terms, that \nreflect the spirit of international solidarity and cooperation in addressing the natural \ndisaster,  \n \nRecognizing the urgent need to scale up the access to and intensify the \nadministration of vaccines to address the ongoing public health crisis caused by the \ncoronavirus disease (COVID-19) and to mitigate the risk associated with displaced \nindividuals in enclosed areas, \n \nReiterating the need for the United Nations system to ensure that the \nhumanitarian, early recovery and reconstruction assistance provided is timely, \nadequate, effective and coherent and coordinated among all humanitarian and \ndevelopment actors, in coordination with and in support of the Government of Haiti, \nand in accordance with the principles of humanity, neutrality, impartiality and \nindependence, \n \nWelcoming the generous assistance that has been pledged and provided by the \nCaribbean Community and by other States and non-governmental, regional and \ninternational organizations, in particular the Caribbean Disaster Emergency \nManagement Agency and the United Nations system, to alleviate the devastating \neffects of this crisis on Haiti, \n \n1. \nExpresses its solidarity with and support to the Government and people of \nHaiti;  \n \n2. \nCalls upon the international community to scale up its humanitarian \nassistance and rehabilitation of Haiti, in order to repair and strengthen the country\u2019s \nprospects for achieving sustainable development;  \n \n3. \nUrges international financial institutions and organizations to continue to \ncontribute generously in their response to deliver immediate relief and to maintain \ntheir support for the long-term rehabilitation of Haiti, through prioritizing action to \nreduce the vulnerability of the country by systematically promoting its long-term \nsocioeconomic development; \n \n4. \nRequests the Secretary-General, to the extent of his authority, to support \nthe reconstruction efforts that are being made by the Government of Haiti. \n \n99th plenary meeting \n30 August 2021 \n \n",
  "paragraphs": {
    "1": "Expresses its solidarity with and support to the Government and people of Haiti;",
    "2": "Calls upon the international community to scale up its humanitarian assistance and rehabilitation of Haiti, in order to repair and strengthen the country\u2019s prospects for achieving sustainable development;",
    "3": "Urges international financial institutions and organizations to continue to contribute generously in their response to deliver immediate relief and to maintain their support for the long-term rehabilitation of Haiti, through prioritizing action to reduce the vulnerability of the country by systematically promoting its long-term socioeconomic development;",
    "4": "Requests the Secretary-General, to the extent of his authority, to support the reconstruction efforts that are being made by the Government of Haiti. 99th plenary meeting 30 August 2021"
  },
  "agenda_items": [
    "Item 73"
  ],
  "symbol_references": [
    "A/75/L.127"
  ]
}