{
  "symbol": "A/RES/75/89",
  "filename": "A_RES_75_89.pdf",
  "title": "75/89. Sustainable fisheries, including through the 1995 Agreement for the Implementation of the Provisions of the United Nations Convention on the Law of the Sea of 10 December 1982 relating to the Conservation and Management of Straddling Fish Stocks and Highly Migratory Fish Stocks, and related instruments",
  "text": "United Nations \nA/RES/75/89 \n \n \nGeneral Assembly \nDistr.: General \n18 December 2020 \n \n20-16920 (E)    231220 \n*2016920* \n \n \nSeventy-fifth session \nAgenda item 76 (b) \nOceans and the law of the sea: sustainable fisheries, \nincluding through the 1995 Agreement for the \nImplementation of the Provisions of the United Nations \nConvention on the Law of the Sea of 10 December 1982 \nrelating to the Conservation and Management of \nStraddling Fish Stocks and Highly Migratory Fish Stocks, \nand related instruments \n \n \n \n \n Resolution adopted by the General Assembly \non 8 December 2020 \n \n \n \n \n[without reference to a Main Committee (A/75/L.40 and A/75/L.40/Add.1)] \n \n \n \n75/89. Sustainable fisheries, including through the 1995 Agreement for \nthe Implementation of the Provisions of the United Nations \nConvention on the Law of the Sea of 10 December 1982 relating to \nthe Conservation and Management of Straddling Fish Stocks and \nHighly Migratory Fish Stocks, and related instruments \n \n \n \nThe General Assembly, \n \nReaffirming its annual resolutions on sustainable fisheries, including resolution \n74/18 of 10 December 2019, and other relevant resolutions,  \n \nTaking into account the continuing situation concerning the coronavirus disease \n(COVID-19) and the limitations recommended on meetings within the United Nations \npremises as precautionary measures aimed at containing the spread of COVID-19,  \n \nRecalling the relevant provisions of the United Nations Convention on the Law \nof the Sea (the Convention),1 and bearing in mind the relationship between the \nConvention and the 1995 Agreement for the Implementation of the Provisions of the \nUnited Nations Convention on the Law of the Sea of 10 December 1982 relating to \nthe Conservation and Management of Straddling Fish Stocks and Highly Migratory \nFish Stocks (the Agreement),2  \n__________________ \n \n1  United Nations, Treaty Series, vol. 1833, No. 31363. \n \n2  Ibid., vol. 2167, No. 37924. \n\nA/RES/75/89 \nSustainable fisheries, including through the 1995 Agreement for the Implementation of the \nProvisions of the United Nations Convention on the Law of the Sea of 10 December 1982 \nrelating to the Conservation and Management of Straddling Fish Stocks\nand Highly Migratory Fish Stocks, and related instruments\n \n20-16920\n2/43 \n \n \nNoting with satisfaction that 16 November 2019 marked the twenty-fifth \nanniversary of the entry into force of the Convention, \n \nWelcoming ratifications of and accessions to the Agreement and the fact that a \ngrowing number of States, entities referred to in the Convention and in article 1, \nparagraph 2 (b), of the Agreement, and subregional and regional fisheries \nmanagement organizations and arrangements, have taken measures, as appropriate, \ntowards the implementation of the provisions of the Agreement, in order to improve \ntheir management regimes, \n \nNoting with satisfaction that 4 December 2020 will mark the twenty-fifth \nanniversary of the opening for signature of the Agreement, and welcoming the work \nof the Food and Agriculture Organization of the United Nations and its Committee on \nFisheries, and recognizing in particular the Code of Conduct for Responsible \nFisheries of the Food and Agriculture Organization of the United Nations (the Code), \nwhich will mark its twenty-fifth anniversary in 2020, and other related instruments, \nincluding the international plans of action, which set out principles and global \nstandards of behaviour for responsible practices for the conservation of fisheries \nresources and the management and development of fisheries, as well as the 2005 \nRome Declaration on Illegal, Unreported and Unregulated Fishing, \n \nRecognizing the importance of data collection through accurate and reliable \nreporting and monitoring of catches, including by-catch and discards, as a \nfundamental element of effective fisheries management that provides a basis for \nscientific stock assessment, and ecosystem approaches to fisheries management, \n \nNoting that the United Nations Open-ended Informal Consultative Process on \nOceans and the Law of the Sea focused its discussions at its twentieth meeting, held \nfrom 10 to 14 June 2019, on \u201cOcean science and the United Nations Decade of Ocean \nScience for Sustainable Development\u201d,3  \n \nNoting also the holding of the Forum on Fisheries Science in the Mediterranean \nand the Black Sea by the General Fisheries Commission for the Mediterranean, in \nRome from 10 to 14 December 2018, \n \nNoting further the convening of the International Symposium on Fisheries \nSustainability: Strengthening the Science-Policy Nexus, organized by the Food and \nAgriculture Organization of the United Nations from 18 to 21 November 2019, \n \nNoting with concern that the effective management of marine capture fisheries \nhas been made difficult in some areas by unreliable and incomplete information and \ndata caused by, inter alia, unreported and misreported fish catch and fishing effort and \nthat this lack of accurate data undermines the assessment of fish stocks and \ncontributes to overfishing in some areas, and in this regard recalling that members of \nregional fisheries management organizations or arrangements must fully comply with \ntheir associated data-collection and reporting obligations, including to ensure that \nrequired data submissions are complete, reliable and submitted in a timely manner, \n \nRecognizing the First Global Integrated Marine Assessment (first World Ocean \nAssessment), which provides information on the state of the marine environment, \nincluding socioeconomic aspects, in relation to, inter alia, fisheries, \n \nRecognizing also the significant contribution of sustainable fisheries to food \nsecurity and nutrition, income, wealth and poverty alleviation for present and future \ngenerations, \n \nWelcoming in this regard the outcome document of the United Nations \nConference on Sustainable Development, held in Rio de Janeiro, Brazil, from 20 to \n__________________ \n \n3  See A/74/119. \n\nSustainable fisheries, including through the 1995 Agreement for the Implementation of the \nProvisions of the United Nations Convention on the Law of the Sea of 10 December 1982 \nrelating to the Conservation and Management of Straddling Fish Stocks \nand Highly Migratory Fish Stocks, and related instruments \nA/RES/75/89\n \n3/43\n20-16920 \n \n22 June 2012, entitled \u201cThe future we want\u201d, as endorsed by the General Assembly \nin its resolution 66/288 of 27 July 2012, \n \nWelcoming the outcome document of the United Nations summit for the \nadoption of the post-2015 development agenda, held from 25 to 27 September 2015, \nentitled \u201cTransforming our world: the 2030 Agenda for Sustainable Development\u201d, \nas adopted by the General Assembly in its resolution 70/1 of 25 September 2015, and \nin this regard reaffirming the commitment to conserve and sustainably use the oceans, \nseas and marine resources for sustainable development, as reflected in Goal 14 of the \noutcome document, \n \nNoting the voluntary national reviews on the implementation of the 2030 \nAgenda for Sustainable Development and its Sustainable Development Goals, \nparticularly on Goal 14, \n \nRecalling its resolution 71/312 of 6 July 2017, in which it endorsed the \ndeclaration entitled \u201cOur ocean, our future: call for action\u201d adopted by the high-level \nUnited Nations Conference to Support the Implementation of Sustainable \nDevelopment Goal 14: Conserve and sustainably use the oceans, seas and marine \nresources for sustainable development, held at United Nations Headquarters from 5 to \n9 June 2017, coinciding with World Oceans Day on 8 June, and in this regard \nreaffirming the important role of the declaration in demonstrating the collective will \nto take action to conserve and sustainably use our oceans, seas and marine resources \nfor sustainable development, \n \nRecognizing the important contributions of the partnership dialogues and \nvoluntary commitments made in the context of the United Nations Conference to \nSupport the Implementation of Sustainable Development Goal 14: Conserve and \nsustainably use the oceans, seas and marine resources for sustainable development to \nthe effective and timely implementation of Sustainable Development Goal 14, \n \nRecalling its decision to convene the high-level 2020 United Nations \nConference to Support the Implementation of Sustainable Development Goal 14: \nConserve and sustainably use the oceans, seas and marine resources for sustainable \ndevelopment in Lisbon, from 2 to 6 June 2020,4  \n \nWelcoming in this regard the continuous attention given by the international \ncommunity to the role of fish and fish products in nutrition and food security, \nincluding by the Committee on World Food Security of the Food and Agriculture \nOrganization of the United Nations, especially noting the importance of the \navailability of highly nutritious food for low-income populations, \n \nRecalling the decision in its resolution 71/124 of 7 December 2016 to designate \n2 May as World Tuna Day, \n \nRecalling also the decision in its resolution 72/72 of 5 December 2017 to \nproclaim 5 June the International Day for the Fight against Illegal, Unreported and \nUnregulated Fishing, to draw attention to the threats posed by illegal, unreported and \nunregulated fishing activities to the sustainable use of fisheries resources as well as \nto ongoing efforts to fight these activities, \n \nRecalling further the decision in its resolution 72/72 to proclaim the year \nbeginning on 1 January 2022 the International Year of Artisanal Fisheries and \nAquaculture, \n \nRecalling that, in \u201cThe future we want\u201d, States were encouraged to give due \nconsideration to implementing the Committee on World Food Security Voluntary \n__________________ \n \n4 See resolution 73/292. \n\nA/RES/75/89 \nSustainable fisheries, including through the 1995 Agreement for the Implementation of the \nProvisions of the United Nations Convention on the Law of the Sea of 10 December 1982 \nrelating to the Conservation and Management of Straddling Fish Stocks\nand Highly Migratory Fish Stocks, and related instruments\n \n20-16920\n4/43 \n \nGuidelines on the Responsible Governance of Tenure of Land, Fisheries and Forests \nin the Context of National Food Security,5  \n \nNoting that the Food and Agriculture Organization of the United Nations has \ndeveloped the Global Work Programme to Advance Knowledge on Rights-based \nApproaches for Fisheries as a means to support the implementation of the Voluntary \nGuidelines for Securing Sustainable Small-scale Fisheries in the Context of Food \nSecurity and Poverty Eradication and to facilitate the formalization of appropriate \naccess and resource rights in small-scale and artisanal fisheries in both developing \nand developed countries, in order to improve the governance of fisheries, \n \nRecalling the Voluntary Guidelines for Securing Sustainable Small-scale \nFisheries in the Context of Food Security and Poverty Eradication, \n \nRecognizing the urgent need for action at all levels, relying on the best available \nscientific information to ensure the long-term sustainable use and management of \nfisheries resources through the wide application of the precautionary approach and \necosystem approaches, \n \nReiterating its concern over the current and projected adverse effects of climate \nchange on food security and the sustainability of fisheries, noting in that regard the \nwork of the Intergovernmental Panel on Climate Change, the Food and Agriculture \nOrganization of the United Nations and the United Nations Environment Programme, \nand noting with concern the findings of the Intergovernmental Panel in its special \nreport on the ocean and cryosphere in a changing climate, \n \nRecalling the entry into force of the Paris Agreement,6 and noting that it aims to \nstrengthen the global response to the threat of climate change, including by increasing \nthe ability to adapt to the adverse impacts of climate change and foster climate \nresilience, \n \nNoting with appreciation the comprehensive review of the impacts of climate \nchange on fisheries and aquaculture and adaptation options undertaken by the Food \nand Agriculture Organization of the United Nations, \n \nReaffirming its commitment to ensuring that conservation and management \nmeasures adopted by regional fisheries management organizations and arrangements \nare based on the best available scientific information, \n \nTaking note of the report of the Food and Agriculture Organization of the United \nNations entitled The State of World Fisheries and Aquaculture 2018, in which it was \nstated that 33.1 per cent of assessed marine fish stocks were estimated to be fished at \na biologically unsustainable level and therefore overfished as of 2015, and recalling \nthe report of the Committee on Fisheries, at its thirty-third session,7 in which serious \nconcern about the state of the world\u2019s fish stocks was expressed, noting the continued \nincrease in the proportion of overfished stocks, and in which it was also recognized \nthat the situation was very different in different areas of the world, \n \nExpressing its support for accelerating work to complete the ongoing \nnegotiations in the World Trade Organization to strengthen disciplines on subsidies \nin the fisheries sector, including through the prohibition of certain forms of fisheries \nsubsidies that contribute to overcapacity and overfishing, \n__________________ \n \n5  Food and Agriculture Organization of the United Nations, document CL 144/9 (C 2013/20), \nappendix D. \n \n6  See FCCC/CP/2015/10/Add.1, decision 1/CP.21, annex. \n \n7  Food and Agriculture Organization of the United Nations, document C 2019/23. \n\nSustainable fisheries, including through the 1995 Agreement for the Implementation of the \nProvisions of the United Nations Convention on the Law of the Sea of 10 December 1982 \nrelating to the Conservation and Management of Straddling Fish Stocks \nand Highly Migratory Fish Stocks, and related instruments \nA/RES/75/89\n \n5/43\n20-16920 \n \n \nNoting the ministerial decision on fisheries subsidies, adopted at the eleventh \nMinisterial Conference of the World Trade Organization, held in Buenos Aires from \n10 to 13 December 2017, \n \nConcerned that only a limited number of States have taken measures to \nimplement, individually and through regional fisheries management organizations \nand arrangements, the International Plan of Action for the Management of Fishing \nCapacity adopted by the Food and Agriculture Organization of the United Nations, \n \nRecalling the International Plan of Action to Prevent, Deter and Eliminate \nIllegal, Unreported and Unregulated Fishing adopted by the Food and Agriculture \nOrganization of the United Nations, \n \nParticularly concerned that illegal, unreported and unregulated fishing \ncontinues to constitute a serious threat to fish stocks and marine habitats and \necosystems, to the detriment of sustainable fisheries as well as the food security and \nthe economies of many States, particularly developing States, \n \nConcerned that some operators increasingly take advantage of the globalization \nof fishery markets to trade fishery products stemming from illegal, unreported and \nunregulated fishing and make economic profits from those operations, which \nconstitutes an incentive for them to pursue their activities, \n \nRecognizing that the effective deterrence and combating of illegal, unreported \nand unregulated fishing has significant financial and other resource implications for \nall States, in particular developing States, \n \nRecognizing also that fishing by vessels without nationality on the high seas \nundermines relevant objectives of the Convention and the Agreement to conserve and \nsustainably manage marine resources, and noting with concern that fishing vessels \nwithout nationality operate on the high seas without governance and oversight, \n \nRecognizing further the role of the Global Record of Fishing Vessels, \nRefrigerated Transport Vessels and Supply Vessels in the concerted fight against \nillegal, unreported and unregulated fishing, \n \nRecognizing the duty provided in the Convention, the Agreement to Promote \nCompliance with International Conservation and Management Measures by Fishing \nVessels on the High Seas (the Compliance Agreement),8 the Agreement and the Code \nfor flag States to effectively exercise jurisdiction and control over fishing vessels \nflying their flag, and vessels flying their flag which provide support to fishing vessels, \nto ensure that the activities of such fishing and support vessels do not undermine the \neffectiveness of conservation and management measures taken in accordance with \ninternational law and adopted at the national, subregional, regional or global levels, \n \nNoting the advisory opinion of the International Tribunal for the Law of the Sea \non the request for an advisory opinion submitted by the Subregional Fisheries \nCommission, issued on 2 April 2015, \n \nRecognizing the importance of adequately regulating, monitoring and \ncontrolling trans-shipment at sea, including on the high seas, to contribute to \ncombating illegal, unreported and unregulated fishing activities, \n \nWelcoming the convening of the sixth Global Fisheries Enforcement Training \nWorkshop in Bangkok, from 18 to 22 February 2019, hosted by the International \nMonitoring, Control and Surveillance Network for Fisheries-related Activities, in \norder to share information, experiences and technologies, foster coordination and \nimprove skills among enforcement officials, \n__________________ \n \n8  United Nations, Treaty Series, vol. 2221, No. 39486. \n\nA/RES/75/89 \nSustainable fisheries, including through the 1995 Agreement for the Implementation of the \nProvisions of the United Nations Convention on the Law of the Sea of 10 December 1982 \nrelating to the Conservation and Management of Straddling Fish Stocks\nand Highly Migratory Fish Stocks, and related instruments\n \n20-16920\n6/43 \n \n \nNoting the obligation of all States, in accordance with international law, as \nreflected in the relevant provisions of the Convention, to cooperate in the \nconservation and management of living marine resources, and recognizing the \nimportance of coordination and cooperation at the global, regional, subregional and \nnational levels in the areas, inter alia, of marine scientific research, data collection, \ninformation-sharing, \ncapacity-building \nand \ntraining \nfor \nthe \nconservation, \nmanagement and sustainable development of living marine resources, \n \nAcknowledging the importance of ocean data buoy systems moored in areas \nbeyond national jurisdiction to sustainable development, promoting safety at sea and \nlimiting human vulnerability to natural disasters, due to their use in weather and \nmarine forecasts, fisheries management, tsunami forecasts and climate prediction, and \nexpressing concern that most damage to ocean data buoys, such as moored buoys and \ntsunameters, frequently results from actions taken by some fishing operations which \nrender the buoys inoperable, \n \nWelcoming in this regard the adoption of measures by States, individually or \nthrough regional fisheries management organizations and arrangements, to protect \nocean data buoy systems from the impacts of fishing activities, \n \nEncouraging States, individually or through regional fisheries management \norganizations and arrangements, to cooperate to ensure that interactions between \nfishing operations and ocean data buoys on the high seas are minimized, \n \nRecognizing the need for States, individually and through regional fisheries \nmanagement organizations and arrangements, to continue to develop and implement, \nconsistent with international law, effective port State measures to combat illegal, \nunreported and unregulated fishing and to contribute to addressing overfishing, the \ncritical need for cooperation with developing States to build their capacity, and the \nimportance of cooperation between the Food and Agriculture Organization of the \nUnited Nations and the International Maritime Organization in this regard, \n \nRecalling the entry into force of the Agreement on Port State Measures to \nPrevent, Deter and Eliminate Illegal, Unreported and Unregulated Fishing of the Food \nand Agriculture Organization of the United Nations in 2016,9 \n \nRecognizing the efforts of States, individually and through regional fisheries \nmanagement organizations and arrangements, to implement its resolution 46/215 of \n20 December 1991, in which the General Assembly called for a global moratorium \non all large-scale pelagic drift-net fishing, including collaborative fisheries \nenforcement activities, \n \nConcerned that marine pollution from all sources constitutes a serious threat to \nhuman health and safety, endangers fish stocks, marine biodiversity and marine and \ncoastal habitats and has significant costs to local and national economies, \n \nRecognizing that marine debris is a global transboundary pollution problem and \nthat, owing to the many different types and sources of marine debris, different \napproaches to its prevention and removal are necessary, including the identification \nof such sources and environmentally sound techniques for its removal, \n \nRecognizing also that the majority of marine debris, including plastics and \nmicroplastics, entering the seas and oceans is considered to originate from land-based \nsources, \n \nRecognizing further that abandoned, lost or otherwise discarded fishing gear, \nincluding ghost fishing gear, is an increasingly pervasive and destructive form of \n__________________ \n \n9  Food and Agriculture Organization of the United Nations, document C 2009/REP and Corr.1\u20133, \nappendix E. \n\nSustainable fisheries, including through the 1995 Agreement for the Implementation of the \nProvisions of the United Nations Convention on the Law of the Sea of 10 December 1982 \nrelating to the Conservation and Management of Straddling Fish Stocks \nand Highly Migratory Fish Stocks, and related instruments \nA/RES/75/89\n \n7/43\n20-16920 \n \nmarine debris causing adverse impacts on fish stocks, marine life and the marine \nenvironment and that urgent preventative action is needed, such as the marking of \nfishing gear as proposed by the Committee on Fisheries, as well as removal action, \n \nAcknowledging that anthropogenic underwater noise could have impacts on \ndifferent marine species, which could also have consequent socioeconomic impacts, \nincluding on fishing, and welcoming in this regard the discussions on the issue at the \nnineteenth meeting of the United Nations Open-ended Informal Consultative Process \non Oceans and the Law of the Sea,10  \n \nNoting the continuing gaps in knowledge and lack of data with respect to \nanthropogenic underwater noise and its impacts, and welcoming in this respect the \nencouragement of the Committee on Fisheries of the Food and Agriculture \nOrganization of the United Nations, at its thirty-third session, to consider conducting \na review of the impact of anthropogenic underwater noise on marine resources and its \nsocioeconomic consequences, \n \nNoting also the convening of the joint General Fisheries Commission for the \nMediterranean/OceanCare workshop on anthropogenic underwater noise and impacts \non fish, invertebrates and fish resources, in Rome on 21 and 22 February 2019, \n \nReaffirming the importance of sustainable aquaculture to food security, \nrecognizing that, as indicated in The State of World Fisheries and Aquaculture 2018, \naquaculture is already making a significant contribution to the global seafood supply, \nand that a further increase in that contribution is anticipated, \n \nNoting that the contribution of sustainable aquaculture to global fish supplies \ncontinues to respond to opportunities in developing countries to enhance local food \nsecurity and nutrition and poverty alleviation and, together with the efforts of other \naquaculture-producing countries, will make a significant contribution to meeting \nfuture demands in fish consumption, bearing in mind article 9 of the Code, \n \nNoting in this regard the concern about the potential effects of genetically \nengineered aquatic fish species on the health and sustainability of wild fish stocks, \n \nRecognizing the efforts made by States and regional fisheries management \norganizations and arrangements in regulating deep-sea fisheries, while still concerned \nthat some deep-sea fishing activities in certain areas are being carried out without the \nfull implementation of relevant paragraphs of previous resolutions, representing a \nthreat to vulnerable marine ecosystems, \n \nCalling attention to the particular vulnerabilities of small island developing \nStates, other developing coastal States and subsistence fishing communities whose \nlivelihoods, economic development and food security are heavily dependent on \nsustainable fisheries and will suffer disproportionately if sustainable fisheries are \nnegatively affected, \n \nCalling attention also to the circumstances affecting fisheries in many \ndeveloping States, in particular African States and small island developing States, and \nrecognizing the urgent need for capacity-building, including the transfer of marine \ntechnology and in particular fisheries- and aquaculture-related technology, to enhance \nthe ability of such States to exercise their rights in order to realize the benefits from \nfisheries resources and fulfil their obligations under international instruments, \n \nNoting the need to recognize and address the special role of women and the \nvulnerability of indigenous and local communities and minorities in small-scale \nfisheries, \n__________________ \n \n10  See A/73/124. \n\nA/RES/75/89 \nSustainable fisheries, including through the 1995 Agreement for the Implementation of the \nProvisions of the United Nations Convention on the Law of the Sea of 10 December 1982 \nrelating to the Conservation and Management of Straddling Fish Stocks\nand Highly Migratory Fish Stocks, and related instruments\n \n20-16920\n8/43 \n \n \nRecognizing the important contribution of women in the fisheries and \naquaculture sectors, as well as challenges faced by women in these sectors, including \nlack of access to social protection and unequal employment opportunities, \n \nNoting in this regard the convening of the International Conference of Women \nin Fisheries, in Santiago de Compostela, Spain, from 5 to 7 November 2018, at which \nthe Santiago de Compostela Declaration for Equal Opportunities in the Fisheries and \nAquaculture Sectors was adopted, \n \nNoting that the celebration of World Oceans Day in 2019 focused on the theme \n\u201cGender and the ocean\u201d, \n \nRecognizing the need to adopt, implement and enforce appropriate measures to \nminimize waste, by-catch and discards, including high-grading, loss of fishing gear \nand other factors that adversely affect the sustainability of fish stocks and ecosystems \nand, consequently, can also have harmful effects on the economies and food security \nof small island developing States, other developing coastal States and subsistence \nfishing communities, \n \nRecognizing also the need to adopt and implement appropriate measures, \nconsistent with the best available scientific information, to minimize by-catch of \nnon-targeted species and juveniles through the effective management of fishing \nmethods, including the use and design of fish aggregating devices, in order to mitigate \nadverse effects on fish stocks and ecosystems, \n \nRecognizing further the need to further integrate ecosystem approaches into \nfisheries conservation and management and, more generally, the importance of \napplying ecosystem approaches to the management of human activities in the ocean, \nand noting in this regard the Reykjavik Declaration on Responsible Fisheries in the \nMarine Ecosystem,11 the work of the Food and Agriculture Organization of the United \nNations related to guidelines for the implementation of the ecosystem approach to \nfisheries management and the importance of this approach to relevant provisions of \nthe Agreement and the Code, as well as decision VII/1112 and other relevant decisions \nof the Conference of the Parties to the Convention on Biological Diversity, \n \nRecognizing the economic and cultural importance of sharks in many countries, \nthe biological importance of sharks in the marine ecosystem as key predatory species, \nthe vulnerability of certain shark species to overexploitation, the fact that some are \nthreatened with extinction, the need for measures to promote the long-term \nconservation, management and sustainable use of shark populations and fisheries, and \nthe relevance of the International Plan of Action for the Conservation and \nManagement of Sharks, adopted by the Food and Agriculture Organization of the \nUnited Nations in 1999, in providing guidance on the development of such measures, \n \nWelcoming in this regard the review by the Food and Agriculture Organization \nof the United Nations of the implementation of the International Plan of Action for \nthe Conservation and Management of Sharks, and its ongoing work in this regard, \n \nNoting with concern that basic data on shark stocks and harvests continue to be \nlacking and that not all regional fisheries management organizations and \narrangements have adopted conservation and management measures for directed \nshark fisheries and for the regulation of by-catch of sharks from other fisheries, \n \nWelcoming science-based measures taken by States to conserve and sustainably \nmanage sharks, and noting in this respect management measures taken by coastal \nStates, including limits on catch or fishing effort, technical measures, including by \n__________________ \n \n11  E/CN.17/2002/PC.2/3, annex. \n \n12  See United Nations Environment Programme, document UNEP/CBD/COP/7/21, annex. \n\nSustainable fisheries, including through the 1995 Agreement for the Implementation of the \nProvisions of the United Nations Convention on the Law of the Sea of 10 December 1982 \nrelating to the Conservation and Management of Straddling Fish Stocks \nand Highly Migratory Fish Stocks, and related instruments \nA/RES/75/89\n \n9/43\n20-16920 \n \ncatch reduction measures, sanctuaries, closed seasons and areas and monitoring, \ncontrol and surveillance, \n \nRecalling the decisions on sharks and rays adopted at the eighteenth meeting of \nthe Conference of the Parties to the Convention on International Trade in Endangered \nSpecies of Wild Fauna and Flora, held in Geneva from 17 to 28 August 2019, inter \nalia, the inclusion of additional species of sharks and rays in appendix II to that \nConvention,13 and recalling also the ongoing work of the secretariat of that \nConvention, as well as other organizations, including the Indian Ocean Tuna \nCommission, the Southeast Asian Fisheries Development Center and the Food and \nAgriculture Organization of the United Nations, on capacity-building to facilitate the \nimplementation of requirements associated with such listings, \n \nRecalling also that the Conference of the Parties to the Convention on the \nConservation of Migratory Species of Wild Animals, at its twelfth session, held in \nManila from 23 to 28 October 2017, added 5 new species of sharks and rays to those \nlisted in the appendices to that Convention,14 bringing the number to 34 species, \n \nRecalling further that the signatories to the Memorandum of Understanding on \nthe Conservation of Migratory Sharks, at their third meeting, held in Monaco from \n10 to 14 December 2018, added eight new species of sharks and rays to those listed \nin annex I to that Memorandum of Understanding and adopted a capacity-building \nstrategy aimed at supporting signatories with the implementation of the Memorandum \nof Understanding and its conservation plan, \n \nNoting with concern the continuing practice of the removal of fins from sharks, \nwith the remainder of the carcass being discarded at sea, \n \nRecognizing the importance of marine species occupying low trophic levels in \nthe ecosystem and for food security, and the need to ensure their long-term \nsustainability, \n \nExpressing concern over continued incidental mortality, in fishing operations, \nof seabirds, particularly albatrosses and petrels, as well as other marine species, \nincluding sharks, fin-fish species, marine mammals and marine turtles, while \nrecognizing considerable efforts by States and through various regional fisheries \nmanagement organizations and arrangements to reduce incidental mortality as a result \nof by-catch, \n \nNoting with concern the significant threat that invasive alien species, such as \nthose carried and transferred by ballast water and by biofouling on ships, pose to \nmarine ecosystems and resources, \n \nRecognizing the importance of decent work and productive employment in the \nfishing sector, which is critical to sustainable livelihoods and food security, \n \nNoting the ongoing work by the Food and Agriculture Organization of the \nUnited Nations to develop guidance on social sustainability in fisheries and \naquaculture value chains, in line with the recommendation of its Committee on \nFisheries, and in cooperation with relevant stakeholders, including industry and fish \nworker associations, \n \n \n \nI \n \n \nAchieving sustainable fisheries \n \n \n1. \nReaffirms the importance that it attaches to the long-term conservation, \nmanagement and sustainable use of the living marine resources of the world\u2019s oceans \n__________________ \n \n13  United Nations, Treaty Series, vol. 993, No. 14537. \n \n14  Ibid., vol. 1651, No. 28395. \n\nA/RES/75/89 \nSustainable fisheries, including through the 1995 Agreement for the Implementation of the \nProvisions of the United Nations Convention on the Law of the Sea of 10 December 1982 \nrelating to the Conservation and Management of Straddling Fish Stocks\nand Highly Migratory Fish Stocks, and related instruments\n \n20-16920\n10/43 \n \nand seas and the obligations of States to cooperate to this end, in accordance with \ninternational law, as reflected in the relevant provisions of the Convention, in \nparticular the provisions on cooperation set out in Part V and Part VII, section 2, of \nthe Convention, and where applicable, the Agreement; \n \n2. \nCalls upon all States that have not done so, in order to achieve the goal of \nuniversal participation, to become parties to the Convention, which sets out the legal \nframework within which all activities in the oceans and seas must be carried out, \ntaking into account the relationship between the Convention and the Agreement; \n \n3. \nNotes with satisfaction that, in \u201cThe future we want\u201d,15 States addressed \nthe sustainable development of fisheries, recognized the significant contribution of \nfisheries to the three dimensions of sustainable development and stressed the crucial \nrole of healthy marine ecosystems, sustainable fisheries and sustainable aquaculture \nfor food security and nutrition and in providing for the livelihoods of millions of \npeople, and encourages States to implement the commitments made in \u201cThe future \nwe want\u201d; \n \n4. \nCalls upon States to implement the Sustainable Development Goals \noutlined in the outcome document of the United Nations summit for the adoption of \nthe post-2015 development agenda, entitled \u201cTransforming our world: the 2030 \nAgenda for Sustainable Development\u201d, as adopted by the General Assembly in its \nresolution 70/1, including Goal 14 to conserve and sustainably use the oceans, seas \nand marine resources for sustainable development, recalling that some of its targets \nare to be met by 2020 and that the Goals and targets are integrated and indivisible; \n \n5. \nReiterates, in this regard, the call for action to be taken on an urgent basis \nto conserve and sustainably use the oceans, seas and marine resources for sustainable \ndevelopment made in the declaration entitled \u201cOur ocean, our future: call for \naction\u201d;16  \n \n6. \nEncourages States to give due priority to the implementation of the Plan \nof Implementation of the World Summit on Sustainable Development (Johannesburg \nPlan of Implementation)17 in relation to achieving sustainable fisheries, especially \nrestoring depleted stocks to levels that can produce maximum sustainable yield on an \nurgent basis and, where possible, not later than 2015, and recalls that, in \u201cThe future \nwe want\u201d, States committed themselves to intensify their efforts to meet that target \nand to urgently take the measures necessary to maintain or restore all stocks at least \nto levels that can produce the maximum sustainable yield, with the aim of achieving \nthose goals in the shortest time feasible, as determined by their biological \ncharacteristics, and in order to achieve this, to urgently develop and implement \nscience-based management plans, including by reducing or suspending fishing catch \nand fishing effort commensurate with the status of the stock, consistent with \ninternational law, the applicable international instruments and relevant General \nAssembly resolutions and guidelines of the Food and Agriculture Organization of the \nUnited Nations; \n \n7. \nAlso encourages States to promote the consumption of fish sourced from \nsustainably managed fisheries; \n \n8. \nFurther encourages States to consider sustainable aquaculture, consistent \nwith the Code, as a means to promote diversification of the food supply and of \n__________________ \n \n15  Resolution 66/288, annex. \n \n16  Resolution 71/312, annex. \n \n17  Report of the World Summit on Sustainable Development, Johannesburg, South Africa, \n26 August\u20134 September 2002 (United Nations publication, Sales No. E.03.II.A.1 and \ncorrigendum), chap. I, resolution 2, annex. \n\nSustainable fisheries, including through the 1995 Agreement for the Implementation of the \nProvisions of the United Nations Convention on the Law of the Sea of 10 December 1982 \nrelating to the Conservation and Management of Straddling Fish Stocks \nand Highly Migratory Fish Stocks, and related instruments \nA/RES/75/89\n \n11/43\n20-16920 \n \nincome, while ensuring that aquaculture is conducted responsibly and adverse impacts \non the environment are minimized; \n \n9. \nWelcomes the convening of the high-level midterm review of the outcome \ndocument of the third International Conference on Small Island Developing States, \nentitled \u201cSIDS Accelerated Modalities of Action (SAMOA) Pathway\u201d,18 in September \n2019, reaffirms its resolution 74/3 of 10 October 2019, by which it adopted the \npolitical declaration of the high-level meeting to review progress made in addressing \nthe priorities of small island developing States through the implementation of the \nSamoa Pathway, which notes the importance of oceans, seas and marine resources to \nsmall island developing States and acknowledges their efforts to develop and \nimplement strategies for the conservation and sustainable use of the ocean and its \nresources, and emphasizes the need for the full implementation of the Samoa \nPathway; \n \n10. Expresses its serious concern regarding the impacts of global climate \nchange and ocean acidification on coral reefs and other ecosystems relevant to \nfisheries, and urges States, either directly or through appropriate subregional, regional \nor global organizations or arrangements, to intensify efforts to assess and address, as \nappropriate, the impacts of global climate change and ocean acidification on the \nsustainability of fish stocks and the habitats that support them, in particular the most \naffected ones; \n \n11. Notes, in this regard, the special report on the ocean and cryosphere in a \nchanging climate of the Intergovernmental Panel on Climate Change, and notes with \nconcern the findings contained therein; \n \n12. Also notes the concern expressed by the Committee on Fisheries of the \nFood and Agriculture Organization of the United Nations, at its thirty-third session, \nwith regard to the vulnerability of fisheries and aquaculture communities to climate \nchange and extreme events and, in particular, the impacts on small-scale fisheries and \nsmall island developing States, and urges States to consider appropriate action in this \nregard; \n \n13. Emphasizes the obligations of flag States to discharge their \nresponsibilities, in accordance with the Convention, the Agreement and the \nCompliance Agreement, to ensure compliance by vessels flying their flag with the \nconservation and management measures adopted and in force with respect to fisheries \nresources on the high seas; \n \n14. Calls upon States and regional fisheries management organizations and \narrangements, as appropriate, to assess the risks and potential adverse impacts of \nclimate change with respect to fish stocks, consider them when establishing \nconservation and management measures and identifying options to reduce risks and \nadverse impacts with respect to fisheries management and the health and resilience \nof marine ecosystems and enhance efforts to cooperate to collect, exchange and \npublish scientific and technical data and best practices related to the development and \nimplementation of adaptation strategies, and to assist developing States in this regard, \nespecially those that are particularly vulnerable to the adverse impacts of climate \nchange; \n \n15. Encourages States and relevant organizations and arrangements to assess \nand consider the impacts of climate change on fisheries and aquaculture sectors in \ntheir policies and planning, as appropriate, in order to identify effective adaptation \nstrategies to reduce the vulnerability of these sectors to climate change; \n__________________ \n \n18  Resolution 69/15, annex. \n\nA/RES/75/89 \nSustainable fisheries, including through the 1995 Agreement for the Implementation of the \nProvisions of the United Nations Convention on the Law of the Sea of 10 December 1982 \nrelating to the Conservation and Management of Straddling Fish Stocks\nand Highly Migratory Fish Stocks, and related instruments\n \n20-16920\n12/43 \n \n \n16. Calls upon all States, directly or through regional fisheries management \norganizations and arrangements, to apply widely, in accordance with international law \nand the Code, the precautionary approach and ecosystem approaches to the \nconservation, management and exploitation of fish stocks, and also calls upon States \nparties to the Agreement to implement fully the provisions of article 6 of the \nAgreement as a matter of priority; \n \n17. Urges States to increase their reliance on scientific advice in developing, \nadopting and implementing conservation and management measures, and to increase \ntheir efforts, including through international cooperation, to promote science for \nconservation and management measures that apply, in accordance with international \nlaw, the precautionary approach and ecosystem approaches to fisheries management, \nenhancing understanding of ecosystem approaches, in order to ensure the long-term \nconservation and sustainable use of living marine resources, and in this regard \nencourages the implementation of the Strategy for Improving Information on Status \nand Trends of Capture Fisheries of the Food and Agriculture Organization of the \nUnited Nations as a framework for the improvement and understanding of fishery \nstatus and trends; \n \n18. Calls upon all States, directly or through regional fisheries management \norganizations and arrangements, to apply stock-specific target and limit precautionary \nreference points, which, for target reference points, are intended to meet management \nobjectives, as described in annex II to the Agreement and in the Code, to ensure that \npopulations of harvested stocks and, where necessary, associated or dependent species \nare maintained at or restored to sustainable levels, and to use these reference points \nfor triggering conservation and management action; \n \n19. Encourages States, directly or through regional fisheries management \norganizations and arrangements, to establish and implement rebuilding and recovery \nstrategies and plans where a stock is identified as being overfished, which should \ninclude time frames and probabilities of recovery aimed at bringing the stock back at \nleast to levels that can produce the maximum sustainable yield, and guided by \nscientific assessment and subjected to a periodic evaluation of progress; \n \n20. Also encourages States to apply the precautionary approach and ecosystem \napproaches in adopting and implementing conservation and management measures \naddressing, inter alia, by-catch, pollution and overfishing, and protecting habitats of \nspecific concern, taking into account existing guidelines developed by the Food and \nAgriculture Organization of the United Nations; \n \n21. Further encourages States to enhance or develop observer programmes, \nindividually or through regional fisheries management organizations or arrangements, \nin order to improve data collection on, inter alia, target and by-catch species, which \ncould also assist monitoring, control and surveillance tools, and to take into account \nstandards, forms of cooperation and other existing structures for such programmes as \ndescribed in article 25 of the Agreement and article 5 of the Code; \n \n22. Calls upon, in this regard, States, individually in line with their national \nlegislation or through regional fisheries management organizations or arrangements, \nto take steps as appropriate to ensure the safety of observers; \n \n23. Encourages States to implement, individually and through regional \nfisheries management organizations and arrangements, accurate, complete, reliable \nand effective data collection and reporting of required data on catches, including by \ncatch and discards, reviewing and validating the data, and providing catch \ninformation in support of scientific stock assessment and ecosystem approaches to \nfisheries management, while noting the importance, particularly for developing \n\nSustainable fisheries, including through the 1995 Agreement for the Implementation of the \nProvisions of the United Nations Convention on the Law of the Sea of 10 December 1982 \nrelating to the Conservation and Management of Straddling Fish Stocks \nand Highly Migratory Fish Stocks, and related instruments \nA/RES/75/89\n \n13/43\n20-16920 \n \ncountries, of improving the capacity to collect accurate, complete, reliable and \neffective data; \n \n24. Calls upon States and regional fisheries management organizations and \narrangements to collect and, where appropriate, report to the Food and Agriculture \nOrganization of the United Nations required catch and effort data, and fishery-related \ninformation, in a complete, accurate and timely way, including for straddling fish \nstocks and highly migratory fish stocks within and beyond areas under national \njurisdiction, discrete high seas fish stocks, and by-catch and discards; and, where they \ndo not exist, to establish processes to strengthen data collection and reporting by \nmembers of regional fisheries management organizations and arrangements, \nincluding through regular reviews of member compliance with such obligations, and, \nwhen such obligations are not met, require the member concerned to rectify the \nproblem, including through the preparation of plans of action with timelines; \n \n25. Invites States and regional fisheries management organizations and \narrangements to cooperate with the Food and Agriculture Organization of the United \nNations in the implementation and further development of the Fisheries Resources \nMonitoring System initiative; \n \n26. Reaffirms paragraph 10 of its resolution 61/105 of 8 December 2006, and \ncalls upon States, including through regional fisheries management organizations or \narrangements, to urgently adopt and implement measures to fully implement the \nInternational Plan of Action for the Conservation and Management of Sharks for \ndirected and non-directed shark fisheries, based on the best available scientific \ninformation, through, inter alia, limits on catch or fishing effort, by requiring that \nvessels flying their flag collect and regularly report data on shark catches, including \nspecies-specific data, discards and landings, undertaking, including through \ninternational cooperation, comprehensive stock assessments of sharks, reducing shark \nby-catch and by-catch mortality and, where scientific information is uncertain or \ninadequate, not increasing fishing effort in directed shark fisheries and urgently \nestablishing science-based management measures to ensure the long-term \nconservation, management and sustainable use of shark stocks and to prevent further \ndeclines of vulnerable or threatened shark stocks, and encourages the full utilization \nof dead sharks caught in the context of sustainably managed fisheries; \n \n27. Calls upon States to take immediate and concerted action to improve the \nimplementation of and compliance with existing regional fisheries management \norganizations or arrangements and national measures that regulate shark fisheries and \nincidental catch of sharks, in particular those measures which prohibit or restrict \nfisheries conducted solely for the purpose of harvesting shark fins and, where \nnecessary, to consider taking other measures, as appropriate, such as requiring that all \nsharks be landed with each fin naturally attached; \n \n28. Calls upon regional fisheries management organizations with the \ncompetence to regulate highly migratory species to strengthen or establish \nprecautionary, science-based conservation and management measures, as appropriate, \nfor sharks taken in fisheries within their convention areas consistent with the \nInternational Plan of Action for the Conservation and Management of Sharks; \n \n29. Encourages range States and regional economic integration organizations \nthat have not yet done so to become signatories to and implement the Memorandum \nof Understanding on the Conservation of Migratory Sharks under the Convention on \nthe Conservation of Migratory Species of Wild Animals, and invites non-range States, \nintergovernmental organizations and international and national non-governmental \norganizations or other relevant bodies and entities to consider becoming cooperating \npartners; \n\nA/RES/75/89 \nSustainable fisheries, including through the 1995 Agreement for the Implementation of the \nProvisions of the United Nations Convention on the Law of the Sea of 10 December 1982 \nrelating to the Conservation and Management of Straddling Fish Stocks\nand Highly Migratory Fish Stocks, and related instruments\n \n20-16920\n14/43 \n \n \n30. Encourages States, as appropriate, to cooperate in establishing \nnon-detriment findings for shared stocks of marine species listed in appendices I and II \nto the Convention on International Trade in Endangered Species of Wild Fauna and \nFlora, consistent with the concepts and non-binding guiding principles contained in \nresolution Conf. 16.7 on non-detriment findings, adopted by the Conference of the \nParties to the Convention on International Trade in Endangered Species of Wild Fauna \nand Flora; \n \n31. Urges States to eliminate barriers to trade in fish and fisheries products \nwhich are not consistent with their rights and obligations under the World Trade \nOrganization agreements, taking into account the importance of the trade in fish and \nfisheries products, particularly for developing countries; \n \n32. Recalls that, in \u201cThe future we want\u201d, States committed themselves to \nobserving the need to ensure access to fisheries and the importance of access to \nmarkets by subsistence, small-scale and artisanal fisherfolk and women fish workers, \nas well as indigenous peoples and their communities, particularly in developing \ncountries, especially small island developing States; \n \n33. Notes that the Committee on Fisheries encouraged the Food and \nAgriculture Organization of the United Nations to provide capacity development and \ntechnical support to small-scale fisheries, including by addressing socioeconomics, \ngender dimensions, and post-harvest and data-collection challenges in the sector; \n \n34. Urges States and relevant international and national organizations to \nprovide for the participation of small-scale fishery stakeholders in related policy \ndevelopment and fisheries management strategies in order to achieve long-term \nsustainability for such fisheries, consistent with the duty to ensure the proper \nconservation and management of fisheries resources, and encourages States to \nconsider promoting, as appropriate, participatory management schemes for small-\nscale fisheries in accordance with national laws, regulations and practices, as well as \nthe Voluntary Guidelines for Securing Sustainable Small-scale Fisheries in the \nContext of Food Security and Poverty Eradication of the Food and Agriculture \nOrganization of the United Nations; \n \n35. Welcomes action taken by the Food and Agriculture Organization of the \nUnited Nations and a number of regional organizations to support the implementation \nof the Voluntary Guidelines for Securing Sustainable Small-scale Fisheries in the \nContext of Food Security and Poverty Eradication through regional plans of action, \ndedicated working groups and other initiatives; \n \n36. Encourages States, either directly or through competent and appropriate \nsubregional, regional or global organizations and arrangements, to analyse, as \nappropriate, the impact of fishing for marine species corresponding to low trophic \nlevels; \n \n37. Welcomes, in this regard, the initiation of further studies by the Food and \nAgriculture Organization of the United Nations of the impact of industrial fishing \nactivities on species corresponding to low trophic levels; \n \n38. Invites the Food and Agriculture Organization of the United Nations to \nassess and consider the potential risk and effects of genetically engineered fish \nspecies on the health and sustainability of wild fish stocks and on the biodiversity of \nthe aquatic environment and to provide guidance, consistent with the Code, on \nmanaging risk and minimizing harmful impacts in this regard; \n \n39. Also invites the Food and Agriculture Organization of the United Nations, \nin consultation with other relevant international organizations, including the \nInternational Maritime Organization, to promote awareness and cooperation to \n\nSustainable fisheries, including through the 1995 Agreement for the Implementation of the \nProvisions of the United Nations Convention on the Law of the Sea of 10 December 1982 \nrelating to the Conservation and Management of Straddling Fish Stocks \nand Highly Migratory Fish Stocks, and related instruments \nA/RES/75/89\n \n15/43\n20-16920 \n \ndevelop and strengthen capacity to prevent, minimize and mitigate the adverse \nimpacts of invasive alien species on biodiversity, including fish stocks; \n \n40. Calls upon States to consider the potential environmental and \nsocioeconomic impacts of anthropogenic underwater noise from different activities \nin the marine environment and to address and mitigate such impacts, taking into \naccount the best available scientific information, the precautionary approach and \necosystem approaches, as appropriate; \n \n \n \nII \n \n \nImplementation of the 1995 Agreement for the Implementation of the \nProvisions of the United Nations Convention on the Law of the Sea of \n10 December 1982 relating to the Conservation and Management of  \nStraddling Fish Stocks and Highly Migratory Fish Stocks \n \n \n41. Welcomes the most recent accession to the Agreement, and calls upon all \nStates, and entities referred to in the Convention and in article 1, paragraph 2 (b), of \nthe Agreement, that have not done so to ratify or accede to the Agreement and in the \ninterim to consider applying it provisionally; \n \n42. Calls upon States parties to the Agreement to effectively implement, as a \nmatter of priority, the provisions of the Agreement through their national legislation \nand through regional fisheries management organizations and arrangements in which \nthey participate; \n \n43. Emphasizes the importance of those provisions of the Agreement relating \nto bilateral, subregional and regional cooperation in enforcement, and urges continued \nefforts in this regard; \n \n44. Urges States parties to the Agreement, in accordance with article 21, \nparagraph 4, thereof, to inform, either directly or through the relevant subregional or \nregional fisheries management organization or arrangement, all States whose vessels \nfish on the high seas in the same subregion or region of the form of identification \nissued by those States parties to officials duly authorized to carry out boarding and \ninspection functions in accordance with articles 21 and 22 of the Agreement; \n \n45. Also urges States parties to the Agreement, in accordance with article 21, \nparagraph 4, thereof, to designate an appropriate authority to receive notifications \npursuant to article 21 and to give due publicity to such designation through the \nrelevant subregional or regional fisheries management organization or arrangement; \n \n46. Invites regional fisheries management organizations and arrangements \nwhich have not yet done so to adopt procedures for high seas boarding and inspection \nthat are consistent with articles 21 and 22 of the Agreement, including, inter alia, \nthose to ensure the safety of the crew and the inspectors; \n \n47. Calls upon States, individually and, as appropriate, through subregional \nand regional fisheries management organizations and arrangements with competence \nover discrete high seas fish stocks, to adopt the measures necessary to ensure the long-\nterm conservation, management and sustainable use of such stocks in accordance with \nthe Convention and consistent with the Code and the general principles set forth in \nthe Agreement; \n \n48. Invites States to assist developing States in enhancing their participation \nin regional fisheries management organizations or arrangements, including by \nfacilitating access to fisheries for straddling fish stocks and highly migratory fish \nstocks, in accordance with article 25, paragraph 1 (b), of the Agreement, taking into \naccount the need to ensure that such access benefits the developing States concerned \nand their nationals; \n\nA/RES/75/89 \nSustainable fisheries, including through the 1995 Agreement for the Implementation of the \nProvisions of the United Nations Convention on the Law of the Sea of 10 December 1982 \nrelating to the Conservation and Management of Straddling Fish Stocks\nand Highly Migratory Fish Stocks, and related instruments\n \n20-16920\n16/43 \n \n \n49. Urges States parties to the Agreement, directly or through regional \nfisheries management organizations and arrangements, to take into account the \nspecial requirements of developing States, including small island developing States \nas highlighted in the SIDS Accelerated Modalities of Action (SAMOA) Pathway, in \ngiving effect to the duty to cooperate in the establishment of conservation and \nmanagement measures for straddling fish stocks and highly migratory fish stocks, \nincluding the need to ensure, where appropriate, in accordance with article 24, \nparagraph 2 (c), of the Agreement, that such measures do not transfer a disproportionate \nburden of conservation action onto developing States, and notes in this regard \nongoing efforts to better develop a common understanding of this concept; \n \n50. Calls upon States and international financial institutions and organizations \nof the United Nations system to provide assistance according to Part VII of the \nAgreement, including, if appropriate, the development of special financial \nmechanisms or instruments to assist developing States, in particular the least \ndeveloped among them and small island developing States, to enable them to develop \ntheir national capacity to exploit fisheries resources, including developing their \ndomestically flagged fishing fleet, value-added processing and the expansion of their \neconomic base in the fishing industry, consistent with the duty to ensure the proper \nconservation and management of fisheries resources; \n \n51. Urges States, intergovernmental organizations, international financial \ninstitutions, national institutions and non-governmental organizations, as well as \nnatural and juridical persons, to make voluntary financial contributions to the \nAssistance Fund established under Part VII of the Agreement; \n \n52. Welcomes the adoption on 3 May 2019 of the revised terms of reference of \nthe Assistance Fund established under Part VII of the Agreement at the fourteenth \nround of informal consultations of States parties to the Agreement; \n \n53. Encourages the Food and Agriculture Organization of the United Nations \nand the Division for Ocean Affairs and the Law of the Sea of the Office of Legal \nAffairs of the Secretariat (the Division) to continue their efforts to publicize the \navailability of assistance through the Assistance Fund; \n \n54. Encourages accelerated progress by States, individually and, as \nappropriate, through subregional and regional fisheries management organizations \nand arrangements, regarding the recommendations of the Review Conference on the \nAgreement, held in New York from 22 to 26 May 2006,19 and the identification of \nemerging priorities; \n \n55. Encourages States, individually and, as appropriate, through subregional \nand regional fisheries management organizations and arrangements, to consider \nimplementing, as appropriate, the recommendations of the resumed Review \nConference held in New York from 24 to 28 May 201020 and from 23 to 27 May 2016;21 \n \n56. Acknowledges, in particular, the commitments made at the resumed \nReview Conference held in 2016 to the continued implementation of the Agreement \nthrough the application of the precautionary approach and ecosystem approaches to \nfisheries management, the urgent improvement of the status of straddling fish stocks \nand highly migratory fish stocks, strengthened interaction of the science-policy \ninterface and the strong emphasis on collaboration, at all levels, for improved global \nfisheries outcomes; \n__________________ \n \n19  See A/CONF.210/2006/15, annex. \n \n20  See A/CONF.210/2010/7, annex. \n \n21  See A/CONF.210/2016/5, annex. \n\nSustainable fisheries, including through the 1995 Agreement for the Implementation of the \nProvisions of the United Nations Convention on the Law of the Sea of 10 December 1982 \nrelating to the Conservation and Management of Straddling Fish Stocks \nand Highly Migratory Fish Stocks, and related instruments \nA/RES/75/89\n \n17/43\n20-16920 \n \n \n57. Recalls that the resumed Review Conference agreed to keep the \nAgreement under review through the resumption of the Review Conference at a date \nnot earlier than 2020, notes the agreement at the fourteenth round of informal \nconsultations of States parties to the Agreement that the Review Conference should \nbe resumed in 2021, and takes note of the decision of States parties to the Agreement, \nthrough a consultation by correspondence conducted by the Chair of the fifteenth \nround of informal consultations of States parties to the Agreement, to postpone the \nresumption of the Review Conference on the Agreement to 2022, to invite the General \nAssembly to take note of the decision and to take any appropriate subsequent steps; \n \n58. Requests, in this regard, the Secretary-General to resume the Review \nConference, convened pursuant to article 36 of the Agreement, in New York for one \nweek in the first part of 2022, with a view to assessing the effectiveness of the \nAgreement in securing the conservation and management of straddling fish stocks \nand highly migratory fish stocks, and to render the necessary assistance and provide \nsuch services as may be required for the resumption of the Review Conference; \n \n59. Encourages wide participation in the resumed Review Conference, in \naccordance with article 36 of the Agreement; \n \n60. Recalls its request, in paragraph 60 of resolution 74/18, that the Secretary-\nGeneral submit to the resumed Review Conference an updated report, prepared in \ncooperation with the Food and Agriculture Organization of the United Nations and \nwith the assistance of an expert consultant to be hired by the Division to provide \ninformation and analysis on relevant technical and scientific issues to be covered in \nthe report, to assist the Review Conference in discharging its mandate under \narticle 36, paragraph 2, of the Agreement, and in this regard also reiterates its request \nto the Secretary-General to develop and circulate to States and to regional fisheries \nmanagement organizations and arrangements in a timely manner a voluntary \nquestionnaire regarding the recommendations made by the Review Conference in \n2016, taking into account the specific guidance to be proposed at the fifteenth round \nof informal consultations of States parties to the Agreement in 2021; \n \n61. Recalls paragraph 6 of resolution 56/13 of 28 November 2001 and the \nrecommendation of the resumed Review Conference in 2016 that the informal \nconsultations of States parties to the Agreement be dedicated, on an annual basis, to \nthe consideration of specific issues arising from the implementation of the \nAgreement, with a view to improving understanding, sharing experiences and \nidentifying best practices for the consideration of States parties, as well as the General \nAssembly and the Review Conference; \n \n62. Takes note of the report of the fourteenth round of informal consultations \nof States parties to the Agreement, focusing on the topic \u201cPerformance reviews of \nregional fisheries management organizations and arrangements\u201d; 22  \n \n63. Requests the Secretary-General to convene the fifteenth round of informal \nconsultations of States parties to the Agreement, if conditions allow, for three days in \nthe second half of 2021: two days to focus on the topic \u201cImplementation of an \necosystem approach to fisheries management\u201d and one day to serve as a preparatory \nmeeting for the resumed Review Conference;  \n \n64. Encourages greater participation, including by competent international \norganizations, at the forthcoming fifteenth round of informal consultations of States \nparties to the Agreement; \n__________________ \n \n22  Available from the web page of the Agreement maintained by the Division for Ocean Affairs and \nthe Law of the Sea. \n\nA/RES/75/89 \nSustainable fisheries, including through the 1995 Agreement for the Implementation of the \nProvisions of the United Nations Convention on the Law of the Sea of 10 December 1982 \nrelating to the Conservation and Management of Straddling Fish Stocks\nand Highly Migratory Fish Stocks, and related instruments\n \n20-16920\n18/43 \n \n \n65. Requests the Secretary-General to invite States parties to the Agreement \nand, as observers, States and entities referred to in the Convention and in article 1, \nparagraph 2 (b), of the Agreement not parties to the Agreement, the Food and \nAgriculture Organization of the United Nations and other relevant organizations, \nbodies, funds and programmes within the United Nations system, the secretariats of \nrelevant organizations and conventions and other relevant intergovernmental \norganizations and bodies, in particular subregional and regional fisheries management \norganizations and arrangements and related regional intergovernmental marine \nscience organizations, and relevant non-governmental organizations, in accordance \nwith past practice, to attend the fifteenth round of informal consultations of States \nparties to the Agreement, while relevant scientific institutions may request an \ninvitation to participate in the consultations as observers; \n \n66. Recalls its request, in resolution 74/18, for the Secretary-General to invite \nStates parties to the Agreement, as well as States and entities referred to in the \nConvention and in article 1, paragraph 2 (b), of the Agreement not parties to the \nAgreement and others invited to participate in the consultations as observers pursuant \nto paragraph 66 of the present resolution, to submit their views on the topic \n\u201cImplementation of an ecosystem approach to fisheries management\u201d, together with \na translation into English, to the Division, and requests the Division to post such \nviews, unedited and in the languages in which they are received, on its website, in \naccordance with past practice;  \n \n67. Invites the chairperson of the informal consultations of States parties to \nthe Agreement to circulate widely, through the Secretariat, an informal summary of \nthe discussions at the fifteenth round; \n \n68. Reaffirms its request that the Food and Agriculture Organization of the \nUnited Nations initiate arrangements with States for the collection and dissemination \nof data on fishing on the high seas by vessels flying their flag at the subregional and \nregional levels where no such arrangements exist; \n \n69. Also reaffirms its request that the Food and Agriculture Organization of \nthe United Nations revise its global fisheries statistics database to provide information \non straddling fish stocks, highly migratory fish stocks and discrete high seas fish \nstocks on the basis of where the catch is taken; \n \n70. Notes that the Committee on Fisheries, at its thirty-third session, \nemphasized, in the context of the 2030 Agenda for Sustainable Development, the need \nto ensure comparability and consistency of reporting indicators at global, regional \nand national levels, while minimizing the burden on its members; \n \n71. Recognizes that the Review Conference is the competent intergovernmental \nforum for assessing the effectiveness of the Agreement by reviewing its implementation; \n \n \n \nIII \n \n \nRelated fisheries instruments \n \n \n72. Emphasizes the importance of the effective implementation of the \nprovisions of the Compliance Agreement, and urges continued efforts in this regard; \n \n73. Calls upon all States and other entities referred to in article X, paragraph 1, \nof the Compliance Agreement that have not yet become parties to that Agreement to do \nso as a matter of priority and, in the interim, to consider applying it provisionally; \n \n74. Urges States and subregional and regional fisheries management \norganizations and arrangements to implement and promote the application of the Code \nwithin their areas of competence; \n\nSustainable fisheries, including through the 1995 Agreement for the Implementation of the \nProvisions of the United Nations Convention on the Law of the Sea of 10 December 1982 \nrelating to the Conservation and Management of Straddling Fish Stocks \nand Highly Migratory Fish Stocks, and related instruments \nA/RES/75/89\n \n19/43\n20-16920 \n \n \n75. Urges States to develop and implement, as a matter of priority, national \nand, as appropriate, regional plans of action to put into effect the international plans \nof action of the Food and Agriculture Organization of the United Nations; \n \n76. Encourages States, in this regard, to maintain their commitment in \nreporting on their implementation of the Code, reiterates the importance of \nresponding to the web-based questionnaire of the Food and Agriculture Organization \nof the United Nations for monitoring the implementation of the Code and the \ninternational plans of action and strategies, and notes that the information collected \ncould also be relevant to the implementation of related targets of the 2030 Agenda for \nSustainable Development; \n \n77. Also encourages States to consider signing, ratifying, accepting, \napproving or acceding to the Cape Town Agreement of 2012 on the Implementation \nof the Provisions of the Torremolinos Protocol of 1993 relating to the Torremolinos \nInternational Convention for the Safety of Fishing Vessels, 1977; \n \n78. Welcomes, in this regard, the holding of a Ministerial Conference on \nFishing Vessel Safety and Illegal, Unreported and Unregulated Fishing, organized by \nthe International Maritime Organization and the Government of Spain, in \nTorremolinos, Spain, from 21 to 23 October 2019, to promote the ratification of the \nCape Town Agreement, whose entry into force would mandate minimum safety \nmeasures for fishing vessels of 24 metres in length and over, and together with the \nInternational Convention on Standards of Training, Certification and Watchkeeping \nfor Fishing Vessel Personnel, 1995, would create a more robust International \nMaritime Organization regulatory framework for the safety of fishing vessels and \nfishing vessel personnel; \n \n \n \nIV \n \n \nIllegal, unreported and unregulated fishing \n \n \n79. Emphasizes once again its serious concern that illegal, unreported and \nunregulated fishing remains one of the greatest threats to fish stocks and marine \necosystems and continues to have serious and major implications for the conservation \nand management of ocean resources, as well as the food security and the economies \nof many States, particularly developing States, and renews its call upon States to \ncomply fully with all existing obligations and to combat such fishing and urgently to \ntake all steps necessary to implement the International Plan of Action to Prevent, \nDeter and Eliminate Illegal, Unreported and Unregulated Fishing; \n \n80. Recalls that, in \u201cThe future we want\u201d, States acknowledged that illegal, \nunreported and unregulated fishing deprive many countries of a crucial natural \nresource and remain a persistent threat to their sustainable development and \nrecommitted to eliminate illegal, unreported and unregulated fishing as advanced in \nthe Johannesburg Plan of Implementation, and to prevent and combat those practices, \nincluding by developing and implementing national and regional action plans in \naccordance with the International Plan of Action to Prevent, Deter and Eliminate \nIllegal, Unreported and Unregulated Fishing, implementing, in accordance with \ninternational law, effective and coordinated measures by coastal States, flag States, \nport States, chartering nations and the States of nationality of the beneficial owners \nand others who support or engage in illegal, unreported and unregulated fishing by \nidentifying vessels engaged in such fishing and by depriving offenders of the benefits \naccruing from it, as well as by cooperating with developing countries to \nsystematically identify needs and build capacity, including support for monitoring, \ncontrol, surveillance, compliance and enforcement systems; \n\nA/RES/75/89 \nSustainable fisheries, including through the 1995 Agreement for the Implementation of the \nProvisions of the United Nations Convention on the Law of the Sea of 10 December 1982 \nrelating to the Conservation and Management of Straddling Fish Stocks\nand Highly Migratory Fish Stocks, and related instruments\n \n20-16920\n20/43 \n \n \n81. Notes with satisfaction the development of an increasing number of \nnational plans of action to prevent, deter and eliminate illegal, unreported and \nunregulated fishing, and calls upon States that have not yet done so to consider \ndeveloping such plans; \n \n82. Urges flag States to strengthen effective jurisdiction and control over \nvessels flying their flag, and to exercise due diligence, including by developing or \namending national rules and regulations, where needed, in order to ensure that such \nvessels do not engage in illegal, unreported and unregulated fishing, while reaffirming \nthe importance, under international law, including as reflected in the Convention, of \nthe responsibilities of flag States regarding fishing vessels flying their flag, including \nwith respect to safety at sea and labour conditions on fishing vessels; \n \n83. Urges States to effectively exercise jurisdiction and control over their \nnationals, including beneficial owners, and vessels flying their flag, in order to \nprevent and deter them from engaging in illegal, unreported and unregulated fishing \nactivities or supporting vessels engaging in illegal, unreported and unregulated \nfishing activities, including those vessels listed by regional fisheries management \norganizations or arrangements as engaged in those activities, and to facilitate mutual \nassistance to ensure that such actions can be investigated and proper sanctions \nimposed; \n \n84. Encourages States that have not yet done so to establish penalties for \nnon-compliance by vessels involved in fishing or fishing-related activities and their \nnationals, as appropriate, in accordance with applicable national law and consistent \nwith international law, that are adequate in severity for effectively securing \ncompliance, deterring further violations and depriving offenders of the benefits from \ntheir illegal, unreported and unregulated fishing activities; \n \n85. Urges States to take effective measures, at the national, subregional, \nregional and global levels, to deter the activities, including illegal, unreported and \nunregulated fishing, of any vessel which undermines conservation and management \nmeasures that have been adopted by subregional and regional fisheries management \norganizations and arrangements in accordance with international law; \n \n86. Calls upon States not to permit vessels flying their flag to engage in fishing \non the high seas or in areas under the national jurisdiction of other States, unless duly \nauthorized by the authorities of the States concerned and in accordance with the \nconditions set out in the authorization, and to take specific measures, including \ndeterring the reflagging of vessels by their nationals, in accordance with the relevant \nprovisions of the Convention, the Agreement and the Compliance Agreement, to \ncontrol fishing operations by vessels flying their flag; \n \n87. Urges States, individually and collectively through regional fisheries \nmanagement organizations and arrangements, to develop appropriate processes to \nassess the performance of States with respect to implementing the obligations \nregarding fishing vessels flying their flag set out in relevant international instruments; \n \n88. Reaffirms the need to strengthen, where necessary, the international legal \nframework for intergovernmental cooperation, in particular at the subregional and \nregional levels, in the management of fish stocks and in combating illegal, unreported \nand unregulated fishing, in a manner consistent with international law, and for States \nand entities referred to in the Convention and in article 1, paragraph 2 (b), of the \nAgreement to collaborate in efforts to address these types of fishing activities; \n \n89. Urges regional fisheries management organizations and arrangements to \nfurther coordinate measures for combating illegal, unreported and unregulated fishing \nactivities, such as through the development of a common list of vessels identified as \nengaged in illegal, unreported and unregulated fishing or the mutual recognition of \n\nSustainable fisheries, including through the 1995 Agreement for the Implementation of the \nProvisions of the United Nations Convention on the Law of the Sea of 10 December 1982 \nrelating to the Conservation and Management of Straddling Fish Stocks \nand Highly Migratory Fish Stocks, and related instruments \nA/RES/75/89\n \n21/43\n20-16920 \n \nthe illegal, unreported and unregulated vessel lists established by each organization \nor arrangement; \n \n90. Reaffirms its call upon States to take all necessary measures consistent \nwith international law, without prejudice to a State\u2019s sovereignty over ports in its \nterritory and to reasons of force majeure or distress, including the prohibition of \nvessels from accessing their ports followed by a report to the flag State concerned, \nwhen there is clear evidence that they are or have been engaged in or have supported \nillegal, unreported and unregulated fishing, or when they refuse to give information \neither on the origin of the catch or on the authorization under which the catch has \nbeen made; \n \n91. Reaffirms paragraph 53 of its resolution 64/72 of 4 December 2009 with \nregard to eliminating illegal, unreported and unregulated fishing by vessels flying \n\u201cflags of convenience\u201d and requiring that a \u201cgenuine link\u201d be established between \nStates and fishing vessels flying their flags, and urges States operating open registry \nto effectively control all fishing vessels flying their flag, as required by international \nlaw, or otherwise stop open registry for fishing vessels; \n \n92. Notes the challenges posed by vessels determined under international law \nto be without nationality that are fishing, including conducting fishing-related \nactivities, on the high seas and that such vessels operate without governance and \noversight, undermine relevant legal frameworks and are engaging in illegal, \nunreported and unregulated fishing activities as defined in the International Plan of \nAction to Prevent, Deter and Eliminate Illegal, Unreported and Unregulated Fishing \nof the Food and Agriculture Organization of the United Nations, and encourages \nStates to take necessary measures where appropriate, consistent with international \nlaw, in order to prevent and deter vessels without nationality from engaging in or \nsupporting illegal, unreported and unregulated fishing, such as enacting domestic \nlegislation, including on enforcement, sharing information and prohibiting the \nlanding and preventing trans-shipment, at sea or in port, of fish and fish products by \nsuch vessels; \n \n93. Encourages States, either directly or through competent and appropriate \nsubregional, regional or global organizations and arrangements, to consider adopting \nrules, consistent with international law, to ensure that chartering arrangements and \npractices related to fishing vessels enable compliance with and enforcement of \nrelevant conservation and management measures, so as not to undermine efforts to \ncombat illegal, unreported and unregulated fishing; \n \n94. Recognizes the need for enhanced port State measures to combat illegal, \nunreported and unregulated fishing, and urges States to cooperate, in particular at the \nregional level and through subregional and regional fisheries management \norganizations and arrangements, to adopt all necessary port measures, consistent with \ninternational law taking into account article 23 of the Agreement, and to further \npromote the development and application of standards at the regional level; \n \n95. Welcomes the recent ratifications of and accessions to the Agreement on \nPort State Measures to Prevent, Deter and Eliminate Illegal, Unreported and \nUnregulated Fishing, and encourages States and regional economic integration \norganizations that have not yet done so to consider ratifying, accepting, approving or \nacceding to that Agreement, noting the importance of major port States becoming \nparties at their earliest convenience; \n \n96. Acknowledges, in this regard, the convening of the second meeting of the \nparties to the Agreement on Port State Measures to Prevent, Deter and Eliminate \nIllegal, Unreported and Unregulated Fishing, in Santiago from 3 to 6 June 2019, \n\nA/RES/75/89 \nSustainable fisheries, including through the 1995 Agreement for the Implementation of the \nProvisions of the United Nations Convention on the Law of the Sea of 10 December 1982 \nrelating to the Conservation and Management of Straddling Fish Stocks\nand Highly Migratory Fish Stocks, and related instruments\n \n20-16920\n22/43 \n \nwhich, inter alia, considered the status of that Agreement and developments in its \nimplementation; \n \n97. Notes that, in accordance with article 24 of the Agreement on Port State \nMeasures to Prevent, Deter and Eliminate Illegal, Unreported and Unregulated \nFishing, the first review and assessment of the effectiveness of that Agreement in \nachieving its objective will take place in the context of the third meeting of the parties, \nto be hosted by the European Union in Brussels from 30 November to 4 December \n2020, and encourages the parties to support the review process, including by \nresponding to the questionnaire that will be circulated by the Food and Agriculture \nOrganization of the United Nations for this purpose in June 2020; \n \n98. Also notes the ongoing capacity development programme of the Food and \nAgriculture Organization of the United Nations aimed at facilitating and supporting \nthe implementation of the Agreement on Port State Measures to Prevent, Deter and \nEliminate Illegal, Unreported and Unregulated Fishing and related instruments, which \ncontributes to the development of national capacity of both parties and non-parties, \nincluding the strengthening of the institutional, operational and enforcement capacity \nof developing States with a view to maximizing the benefits of its implementation, \nand further notes the contribution of regional workshops to this end; \n \n99. Recognizes the ongoing collaboration between the Food and Agriculture \nOrganization of the United Nations and the International Maritime Organization, as \nwell as the International Labour Organization, through the Joint Ad Hoc Working \nGroup of the Food and Agriculture Organization of the United Nations, the \nInternational Maritime Organization and the International Labour Organization on \nIllegal, Unreported and Unregulated Fishing and Related Matters with regard to, inter \nalia, illegal, unreported and unregulated fishing, maritime safety and decent labour \nconditions in the fisheries sector, as reflected in the outcomes of the fourth session of \nthe Ad Hoc Working Group, held in Torremolinos from 23 to 25 October 2019, and \nencourages the Food and Agriculture Organization of the United Nations, the \nInternational Labour Organization and the International Maritime Organization to \nstrengthen this collaboration and update its terms of reference; \n \n100. Encourages States, with respect to vessels flying their flag, and port \nStates, to make every effort to share data on landings and catch quotas, and in this \nregard encourages regional fisheries management organizations and arrangements to \nconsider developing open databases containing such data for the purpose of enhancing \nthe effectiveness of fisheries management; \n \n101. Takes note that the Committee on Fisheries, at its thirty-third session, \nexpressed support for the work of the Food and Agriculture Organization of the \nUnited Nations in continuing to develop technical guidelines for the estimation of the \nmagnitude and geographic extent of illegal, unreported and unregulated fishing, \nnoting the value of these guidelines for the production of consistent and reliable \nestimates, determining national, regional, global trends, and measuring the impact of \nillegal, unreported and unregulated fishing; \n \n102. Calls upon States to take all measures necessary to ensure that vessels \nflying their flag do not engage in the trans-shipment of fish caught by fishing vessels \nengaged in illegal, unreported and unregulated fishing, through adequate regulation, \nmonitoring and control of trans-shipment of fish at sea, including through additional \nnational measures applicable to vessels flying their flag to prevent such \ntrans-shipment; \n \n103. Urges States, individually and through regional fisheries management \norganizations and arrangements, to adopt and implement internationally agreed \nmarket-related measures in accordance with international law, including principles, \n\nSustainable fisheries, including through the 1995 Agreement for the Implementation of the \nProvisions of the United Nations Convention on the Law of the Sea of 10 December 1982 \nrelating to the Conservation and Management of Straddling Fish Stocks \nand Highly Migratory Fish Stocks, and related instruments \nA/RES/75/89\n \n23/43\n20-16920 \n \nrights and obligations established in World Trade Organization agreements, as called \nfor in the International Plan of Action to Prevent, Deter and Eliminate Illegal, \nUnreported and Unregulated Fishing; \n \n104. Encourages work to increase awareness of the Voluntary Guidelines for \nCatch Documentation Schemes,23 and encourages States and relevant stakeholders to \nimplement these Guidelines when developing catch documentation schemes and to \nuse them as a reference in related activities, with special attention to the prevention, \ndeterrence and elimination of illegal, unreported and unregulated fishing; \n \n105. Also encourages information-sharing regarding emerging market- and \ntrade-related measures by States and other relevant actors with appropriate \ninternational forums, given the potential implications of these measures for all States, \nconsistent with the established plan of work of the Committee on Fisheries, and taking \ninto account the Technical Guidelines for Responsible Fish Trade of the Food and \nAgriculture Organization of the United Nations; \n \n106. Acknowledges the development of participatory surveillance activities at \nsea involving fishing communities in West Africa as a cost-effective way of detecting \nillegal, unreported and unregulated fishing; \n \n107. Notes the concern expressed by the Committee on Fisheries at the \nproliferation of private standards and ecolabelling schemes potentially leading to the \ncreation of trade barriers and restrictions, and also notes the work by the Food and \nAgriculture Organization of the United Nations to develop an evaluation framework \nto assess the conformity of public and private ecolabelling schemes through the \nGuidelines for the Ecolabelling of Fish and Fishery Products from Marine Capture \nFisheries; \n \n108. Also notes the concerns about possible connections between transnational \norganized crime and illegal fishing in certain regions of the world, and encourages \nStates, including through the appropriate international forums and organizations, to \nstudy the causes and methods of and contributing factors to illegal fishing to increase \nknowledge and understanding of those possible connections, and to make the findings \npublicly available, and in this regard takes note of the study issued by the United \nNations Office on Drugs and Crime on transnational organized crime in the fishing \nindustry, bearing in mind the distinct legal regimes and remedies under international \nlaw applicable to illegal fishing and transnational organized crime; \n \n \n \nV \n \n \nMonitoring, control and surveillance and compliance and enforcement \n \n \n109. Calls upon States, in accordance with international law, to strengthen the \nimplementation of or, where they do not exist, adopt comprehensive monitoring, \ncontrol and surveillance measures and compliance and enforcement schemes \nindividually and within those regional fisheries management organizations or \narrangements in which they participate, in order to provide an appropriate framework \nfor promoting compliance with agreed conservation and management measures, and \nfurther urges enhanced coordination among all relevant States and regional fisheries \nmanagement organizations and arrangements in these efforts; \n \n110. Welcomes the fact that the Committee on Fisheries has urged its members \nto start implementing the Voluntary Guidelines for Flag State Performance 24 as soon \nas possible, and urges all flag States to implement those Guidelines as soon as \npossible, including, as a first step, by carrying out a voluntary assessment; \n__________________ \n \n23  Food and Agriculture Organization of the United Nations, document C/2017/REP, appendix C. \n \n24  Food and Agriculture Organization of the United Nations, document COFI/2014/4.2/Rev.1, \nappendix II. \n\nA/RES/75/89 \nSustainable fisheries, including through the 1995 Agreement for the Implementation of the \nProvisions of the United Nations Convention on the Law of the Sea of 10 December 1982 \nrelating to the Conservation and Management of Straddling Fish Stocks\nand Highly Migratory Fish Stocks, and related instruments\n \n20-16920\n24/43 \n \n \n111. Encourages further work by competent international organizations, \nincluding subregional and regional fisheries management organizations and \narrangements, to develop guidelines on flag State control of fishing vessels; \n \n112. Urges States, individually and through relevant regional fisheries \nmanagement organizations and arrangements, to establish mandatory vessel \nmonitoring, control and surveillance systems, in particular to require that vessel \nmonitoring systems be carried by all vessels fishing on the high seas as soon as \npracticable, recalling that, in paragraph 62 of resolution 63/112 of 5 December 2008, \nit urged that large-scale fishing vessels be required to carry vessel monitoring systems \nno later than December 2008, and to share information on fisheries enforcement \nmatters; \n \n113. Calls upon States, individually and through regional fisheries management \norganizations or arrangements, to strengthen or establish, consistent with national and \ninternational law, positive or negative lists of vessels fishing within the areas covered \nby relevant regional fisheries management organizations and arrangements in order \nto promote compliance with conservation and management measures and to identify \nproducts from illegal, unreported and unregulated catches, and encourages improved \ncoordination among all States and regional fisheries management organizations and \narrangements in sharing and using this information, taking into account the forms of \ncooperation with developing States as set out in article 25 of the Agreement; \n \n114. Encourages the Food and Agriculture Organization of the United Nations, \nin cooperation with States, regional economic integration organizations, the \nInternational Maritime Organization and, as appropriate, regional fisheries \nmanagement organizations and arrangements, to expedite efforts to develop and \nmanage a comprehensive global record of fishing vessels, refrigerated transport \nvessels and supply vessels, including with a unique vessel identifier system, using, as \na first step, the International Maritime Organization Ship Identification Number \nScheme for fishing vessels of 100 gross tonnage and above, adopted by the Assembly \nof the International Maritime Organization in its resolution A.1078(28) of \n4 December 2013; \n \n115. Welcomes the continued development of the Global Record of Fishing \nVessels, Refrigerated Transport Vessels and Supply Vessels by the Food and \nAgriculture Organization of the United Nations, including its efforts to keep it cost-\neffective, and encourages States, including through regional fisheries management \norganizations and arrangements, to provide the necessary data and regular updates to \nthe Global Record; \n \n116. Encourages, in this regard, States to use all available vessel data, including \nfrom the Global Integrated Shipping Information System platform, when providing \ntheir vessel data to the Global Record; \n \n117. Welcomes the decision by the International Maritime Organization, in \nresolution A.1117(30) of 6 December 2017, to extend, beyond the first phase of the \nGlobal Record, the International Maritime Organization Ship Identification Number \nScheme to fishing vessels of steel and non-steel hull construction and to all motorized \ninboard fishing vessels of less than 100 gross tonnage down to a size limit of \n12 metres in length overall authorized to operate outside waters under the national \njurisdiction of the flag State, and welcomes the fact that several regional fisheries \nmanagement organizations and arrangements have made provisions for the \nInternational Maritime Organization number to be compulsory in their convention \nareas for all eligible vessels, and encourages those regional fisheries management \norganizations and arrangements which have not yet done so to do the same; \n\nSustainable fisheries, including through the 1995 Agreement for the Implementation of the \nProvisions of the United Nations Convention on the Law of the Sea of 10 December 1982 \nrelating to the Conservation and Management of Straddling Fish Stocks \nand Highly Migratory Fish Stocks, and related instruments \nA/RES/75/89\n \n25/43\n20-16920 \n \n \n118. Requests States and relevant international bodies to develop, in accordance \nwith international law, more effective measures to trace fish and fishery products to \nenable importing States to identify fish or fishery products caught in a manner that \nundermines international conservation and management measures agreed in \naccordance with international law, taking into account the special requirements of \ndeveloping States and the forms of cooperation with developing States as set out in \narticle 25 of the Agreement, and at the same time to recognize the importance of \nmarket access, in accordance with provisions 11.2.4, 11.2.5 and 11.2.6 of the Code, \nfor fish and fishery products caught in a manner that is in conformity with such \ninternational measures; \n \n119. Requests States to take the necessary measures, consistent with \ninternational law, to help to prevent fish and fishery products caught in a manner that \nundermines applicable conservation and management measures adopted in \naccordance with international law from entering international trade; \n \n120. Encourages States to establish and undertake cooperative surveillance and \nenforcement activities in accordance with international law to strengthen and enhance \nefforts to ensure compliance with conservation and management measures, and \nprevent and deter illegal, unreported and unregulated fishing; \n \n121. Urges States, directly and through regional fisheries management \norganizations or arrangements, to develop and adopt effective monitoring, control and \nsurveillance measures for trans-shipment, as appropriate, in particular at-sea \ntrans-shipment, including on the high seas, in order to, inter alia, monitor compliance, \nto collect and verify fisheries data, and to prevent, deter and eliminate illegal, \nunreported and unregulated fishing activities, in accordance with international law \nand, in parallel, to encourage and support the Food and Agriculture Organization of \nthe United Nations in studying the current practices of trans-shipment and produce a \nset of guidelines for this purpose; \n \n122. Takes note, in this regard, that the Committee on Fisheries, at its thirty-\nthird session, welcomed the Global Study on Trans-shipment by the Food and \nAgriculture Organization of the United Nations, and called for in-depth studies to \nsupport the development of guidelines on best practices for regulating, monitoring \nand controlling trans-shipment; \n \n123. Expresses its appreciation for financial contributions from States to \nimprove the capacity of the existing voluntary International Monitoring, Control and \nSurveillance Network for Fisheries-related Activities, and encourages States to join \nand actively participate in the Network and to consider supporting, when appropriate, \nits transformation in accordance with international law into an international unit with \ndedicated resources to further assist Network members, taking into account the forms \nof cooperation with developing States as set out in article 25 of the Agreement; \n \n \n \nVI \n \n \nFishing overcapacity \n \n \n124. Calls upon States to commit themselves to urgently reducing the capacity \nof the world\u2019s fishing fleets to levels commensurate with the sustainability of fish \nstocks, through the establishment of target levels and plans or other appropriate \nmechanisms for ongoing capacity assessment, while avoiding the transfer of fishing \ncapacity to other fisheries or areas in a manner that undermines the sustainable \nmanagement of fish stocks, including those areas where fish stocks are overexploited \nor in a depleted condition, and recognizing in this context the legitimate rights of \ndeveloping States to develop their fisheries for straddling fish stocks and highly \nmigratory fish stocks consistent with article 25 of the Agreement, article 5 of the Code \n\nA/RES/75/89 \nSustainable fisheries, including through the 1995 Agreement for the Implementation of the \nProvisions of the United Nations Convention on the Law of the Sea of 10 December 1982 \nrelating to the Conservation and Management of Straddling Fish Stocks\nand Highly Migratory Fish Stocks, and related instruments\n \n20-16920\n26/43 \n \nand paragraph 10 of the International Plan of Action for the Management of Fishing \nCapacity of the Food and Agriculture Organization of the United Nations; \n \n125. Calls upon, in this regard, States, individually or through regional fisheries \nmanagement organizations and arrangements, to develop and implement a range of \nmeasures to adjust fishing intensity, including fishing capacity where relevant, to \nlevels commensurate with the sustainability of fish stocks, and including capacity \nassessment and capacity management plans providing incentives for voluntary \nreduction, which take into account all aspects that contribute to fishing capacity, \nconsidering, inter alia, engine power, fishing gear technology, fish detection \ntechnology and storage space, and also to improve transparency on fishing capacity, \nincluding by identifying, sharing and publicizing relevant information in this regard, \nsubject to confidentiality requirements; \n \n126. Reiterates its call upon States, individually and through regional fisheries \nmanagement organizations and arrangements, to ensure that the urgent actions \nrequired in the International Plan of Action for the Management of Fishing Capacity \nare undertaken expeditiously and that its implementation is facilitated without delay; \n \n127. Invites the Food and Agriculture Organization of the United Nations to \nreport on the state of progress in the implementation of the International Plan of \nAction for the Management of Fishing Capacity, as provided for in paragraph 48 of \nthe Plan of Action; \n \n128. Calls upon States, individually and, as appropriate, through subregional and \nregional fisheries management organizations and arrangements with competence to \nregulate highly migratory species, urgently to address global fishing capacity for tunas, \ninter alia, in a way that recognizes the legitimate rights of developing States, in \nparticular small island developing States, to participate in and benefit from such \nfisheries, taking into account the recommendations of the 2010 Joint Tuna Regional \nFisheries Management Organizations International Workshop on RFMO Management \nof Tuna Fisheries, held in Brisbane, Australia, and the recommendations of the 2011 \nthird joint meeting of tuna regional fisheries management organizations and \narrangements; \n \n129. Encourages those States which are cooperating to establish subregional \nand regional fisheries management organizations and arrangements, taking into \naccount the best scientific information available as well as ecosystem approaches and \nthe precautionary approach, to exercise voluntary restraint of fishing effort levels in \nthose areas that will come under the regulation of the future organizations and \narrangements until adequate regional conservation and management measures are \nadopted and implemented, taking into account the need to ensure the long-term \nconservation, management and sustainable use of the relevant fish stocks and to \nprevent significant adverse impacts on vulnerable marine ecosystems; \n \n130. Recalls that, in \u201cThe future we want\u201d, States reaffirmed their commitment \nin the Johannesburg Plan of Implementation to eliminate subsidies that contribute to \nillegal, unreported and unregulated fishing and overcapacity, taking into account the \nimportance of that sector to developing countries, reiterated their commitment to \nconclude multilateral disciplines on fisheries subsidies that would give effect to the \nmandates of the World Trade Organization Doha Development Agenda25 and the Hong \nKong Ministerial Declaration to strengthen disciplines on subsidies in the fisheries \nsector, including through the prohibition of certain forms of fisheries subsidies that \ncontribute to overcapacity and overfishing, recognizing that appropriate and effective \nspecial and differential treatment for developing and least developed countries should \nbe an integral part of World Trade Organization fisheries subsidies negotiation, taking \n__________________ \n \n25  See A/C.2/56/7, annex. \n\nSustainable fisheries, including through the 1995 Agreement for the Implementation of the \nProvisions of the United Nations Convention on the Law of the Sea of 10 December 1982 \nrelating to the Conservation and Management of Straddling Fish Stocks \nand Highly Migratory Fish Stocks, and related instruments \nA/RES/75/89\n \n27/43\n20-16920 \n \ninto account the importance of the sector to development priorities, poverty reduction \nand livelihood and food security concerns, and encouraged one another to further \nimprove the transparency and reporting of existing fisheries subsidies programmes \nthrough the World Trade Organization and, given the state of fisheries resources, and \nwithout prejudicing the Doha and Hong Kong ministerial mandates on fisheries \nsubsidies or the need to conclude those negotiations, to eliminate subsidies that \ncontribute to overcapacity and overfishing and to refrain from introducing new such \nsubsidies or from extending or enhancing existing ones; \n \n131. Urges States to eliminate fisheries subsidies that contribute to overfishing \nand overcapacity and to illegal, unreported and unregulated fishing, including through \naccelerating work to complete negotiations on fisheries subsidies at the World Trade \nOrganization, recognizing that appropriate and effective special and differential \ntreatment for developing and least developed countries should be an integral part of \nthe World Trade Organization negotiations on fisheries subsidies; \n \n \n \nVII \n \n \nLarge-scale pelagic drift-net fishing \n \n \n132. Expresses concern that, despite the adoption of General Assembly \nresolution 46/215, the practice of large-scale pelagic drift-net fishing still exists and \nremains a threat to living marine resources; \n \n133. Urges States, individually and through regional fisheries management \norganizations and arrangements, to adopt effective measures, or strengthen existing \nmeasures, to implement and enforce the provisions of resolution 46/215 and \nsubsequent resolutions on large-scale pelagic drift-net fishing in order to eliminate \nthe use of large-scale pelagic drift nets in all seas and oceans, which means that efforts \nto implement resolution 46/215 should not result in the transfer to other parts of the \nworld of drift nets that contravene the resolution; \n \n134. Also urges States, individually and through regional fisheries management \norganizations and arrangements, to adopt effective measures, or strengthen existing \nmeasures, to implement and enforce the present global moratorium on the use of large-\nscale pelagic drift nets on the high seas, and calls upon States to ensure that vessels \nflying their flag that are duly authorized to use large-scale drift nets in waters under \ntheir national jurisdiction do not use such gear for fishing while on the high seas; \n \n \n \nVIII \n \n \nFisheries by-catch and discards \n \n \n135. Urges \nStates, \nsubregional \nand \nregional \nfisheries \nmanagement \norganizations and arrangements and other relevant international organizations that \nhave not done so to take action, including with consideration of the interests of \ndeveloping coastal States and, as appropriate, subsistence fishing communities, to \nminimize by-catch, as well as to reduce or eliminate catch by lost or abandoned gear, \nfish discards and post-harvest losses, including of juvenile fish, consistent with \ninternational law and relevant international instruments, including the Code, and in \nparticular to consider measures including, as appropriate, technical measures related \nto fish size, mesh size or gear, discards, closed seasons and areas and zones reserved \nfor selected fisheries, particularly artisanal fisheries, the establishment of \nmechanisms for communicating information on areas of high concentration of \njuvenile fish, taking into account the importance of ensuring the confidentiality of \nsuch information, and support for studies and research that will minimize by-catch of \njuvenile fish, and to ensure that these measures are implemented so as to optimize \ntheir effectiveness; \n\nA/RES/75/89 \nSustainable fisheries, including through the 1995 Agreement for the Implementation of the \nProvisions of the United Nations Convention on the Law of the Sea of 10 December 1982 \nrelating to the Conservation and Management of Straddling Fish Stocks\nand Highly Migratory Fish Stocks, and related instruments\n \n20-16920\n28/43 \n \n \n136. Encourages, in this regard, States, individually or through regional \nfisheries management organizations and arrangements, as appropriate, to ensure \nproper implementation and enforcement of the measures that they have taken with \nregard to by-catch and discards; \n \n137. Welcomes the commitment of States in \u201cThe future we want\u201d to enhance \naction to manage by-catch, discards and other adverse ecosystem impacts from \nfisheries, including by eliminating destructive fishing practices, consistent with \ninternational law, the applicable international instruments and relevant General \nAssembly resolutions and guidelines of the Food and Agriculture Organization of the \nUnited Nations; \n \n138. Calls upon States, either individually, collectively or through regional \nfisheries management organizations and arrangements, to further study, develop and \nadopt effective management measures, taking into account the best available \nscientific information on fishing methods, including fish aggregating devices, to \nminimize by-catch; \n \n139. Also calls upon States, either individually, collectively or through regional \nfisheries management organizations and arrangements, to collect the necessary data \nin order to evaluate and closely monitor the use of large-scale fish aggregating devices \nand other devices, as appropriate, and their effects on tuna resources and tuna \nbehaviour and associated and dependent species, to improve management procedures \nto monitor the number, type and use of such devices and to mitigate possible negative \neffects on the ecosystem, including on juveniles and the incidental by-catch of \nnon-target species, particularly sharks and turtles, notes in this regard the measures \nadopted by different regional fisheries management organizations and arrangements, \nand encourages regional fisheries management organizations and arrangements to \ncontinue to work on data collection, evaluation and monitoring of such devices; \n \n140. Notes, in this regard, that some regional fisheries management \norganizations, including the Inter-American Tropical Tuna Commission, the \nInternational Commission for the Conservation of Atlantic Tunas, the Indian Ocean \nTuna Commission and the Western and Central Pacific Fisheries Commission, have \nestablished their own working groups to assess the use and impact of large-scale fish \naggregating devices; \n \n141. Encourages States, individually or through regional fisheries management \norganizations and arrangements, to promote, as appropriate, the use of \nenvironmentally friendly fish aggregating devices, while ensuring compliance with \nmeasures that they have taken relating to such devices; \n \n142. Urgently calls upon States, subregional and regional fisheries management \norganizations and arrangements and, where appropriate, other relevant international \norganizations to develop and implement effective management measures to reduce \nthe incidence of catch and discards of non-target species, including the utilization of \nselective fishing gear, where appropriate, and to take appropriate measures to \nminimize waste, and welcomes in this regard the support of the Committee on \nFisheries for the development of a technical guideline of the Food and Agriculture \nOrganization of the United Nations addressing the causes of and remedies to food \nlosses and waste; \n \n143. Calls upon States and subregional and regional fisheries management \norganizations and arrangements to adopt or improve measures to assess the impact of \ntheir fisheries on species caught as by-catch and to improve the comprehensiveness \nand accuracy of information and reporting on incidental catch of species caught as \nby-catch, including through adequate observer coverage and the use of modern \n\nSustainable fisheries, including through the 1995 Agreement for the Implementation of the \nProvisions of the United Nations Convention on the Law of the Sea of 10 December 1982 \nrelating to the Conservation and Management of Straddling Fish Stocks \nand Highly Migratory Fish Stocks, and related instruments \nA/RES/75/89\n \n29/43\n20-16920 \n \ntechnologies, such as electronic monitoring, and to provide assistance to developing \nStates to meet data-collection and reporting obligations; \n \n144. Requests States and regional fisheries management organizations and \narrangements, as appropriate, to strengthen or establish data-collection programmes \nto obtain reliable species-specific estimates of shark, marine turtle, fin-fish, marine \nmammal and seabird by-catch, and to promote further research on selective fishing \ngear and practices and on the use of appropriate by-catch mitigation measures; \n \n145. Encourages States and regional fisheries management organizations and \narrangements to coordinate in the development and implementation of clear and \nstandardized by-catch data-collection and reporting protocols for non-target species, \nin particular endangered, threatened and protected species, taking into account best-\npractice advice from appropriate international organizations and arrangements, \nincluding the Food and Agriculture Organization of the United Nations and the \nAgreement on the Conservation of Albatrosses and Petrels;26  \n \n146. Encourages States and entities referred to in the Convention and in \narticle 1, paragraph 2 (b), of the Agreement to give due consideration to participation, \nas appropriate, in subregional and regional instruments and organizations with \nmandates to conserve non-target species taken incidentally in fishing operations; \n \n147. Encourages States to strengthen, if necessary, the capacity of those \nsubregional and regional fisheries management organizations and arrangements in \nwhich they participate to ensure the adequate conservation of non-target species taken \nincidentally in fishing operations, taking into consideration best practices for \nnon-target species management, and to expedite their ongoing efforts in this regard; \n \n148. Requests States and regional fisheries management organizations and \narrangements urgently to implement, as appropriate, the measures recommended in \nthe 2004 Guidelines to Reduce Sea Turtle Mortality in Fishing Operations and the \nInternational Plan of Action for Reducing Incidental Catch of Seabirds in Longline \nFisheries of the Food and Agriculture Organization of the United Nations in order to \nprevent the decline of sea turtles and seabird populations by minimizing by-catch and \nincreasing post-release survival in their fisheries, including through research and \ndevelopment of gear and bait alternatives, promoting the use of available by-catch \nmitigation \ntechnology, \nand \nestablishing \nand \nstrengthening \ndata-collection \nprogrammes to obtain standardized information to develop reliable estimates of the \nby-catch of these species; \n \n149. Urges States, individually or through regional fisheries management \norganizations and arrangements, to implement the International Guidelines on \nBycatch Management and Reduction of Discards of the Food and Agriculture \nOrganization of the United Nations;27  \n \n150. Requests States and regional fisheries management organizations and \narrangements to continue to take urgent action to reduce the by-catch of seabirds, \nincluding albatrosses and petrels, in fisheries by adopting and implementing \nconservation measures consistent with the 2009 best practices technical guidelines of \nthe Food and Agriculture Organization of the United Nations to support the \nimplementation of the International Plan of Action for Reducing Incidental Catch of \nSeabirds in Longline Fisheries and taking into account the work of the Agreement on \nthe Conservation of Albatrosses and Petrels and of organizations such as the \nCommission for the Conservation of Antarctic Marine Living Resources; \n \n__________________ \n \n26  United Nations, Treaty Series, vol. 2258, No. 40228. \n \n27  Food and Agriculture Organization of the United Nations, document FIRO/R957 (En), appendix E. \n\nA/RES/75/89 \nSustainable fisheries, including through the 1995 Agreement for the Implementation of the \nProvisions of the United Nations Convention on the Law of the Sea of 10 December 1982 \nrelating to the Conservation and Management of Straddling Fish Stocks\nand Highly Migratory Fish Stocks, and related instruments\n \n20-16920\n30/43 \n \n \n \nIX \n \n \nSubregional and regional cooperation \n \n \n151. Urges coastal States and States fishing on the high seas, in accordance \nwith the Convention, the Agreement and other relevant instruments, to pursue \ncooperation in relation to straddling fish stocks and highly migratory fish stocks, \neither directly or through appropriate subregional or regional fisheries management \norganizations or arrangements, to ensure the effective conservation and management \nof such stocks; \n \n152. Urges States fishing for straddling fish stocks and highly migratory fish \nstocks on the high seas, and relevant coastal States, where a subregional or regional \nfisheries management organization or arrangement has the competence to establish \nconservation and management measures for such stocks, to give effect to their duty \nto cooperate by becoming members of such an organization or participants in such an \narrangement, or by agreeing to apply the conservation and management measures \nestablished by such an organization or arrangement, or to otherwise ensure that no \nvessel flying their flag is authorized to access the fisheries resources to which regional \nfisheries management organizations and arrangements or conservation and \nmanagement measures established by such organizations or arrangements apply; \n \n153. Invites, in this regard, subregional and regional fisheries management \norganizations and arrangements to ensure that all States having a real interest in the \nfisheries concerned may become members of such organizations or participants in \nsuch arrangements, in accordance with the Convention, the Agreement and the Code, \nprovided they have shown their interest in and capacity to comply with the measures \nadopted by the regional fisheries management organizations and arrangements \nconcerned, including their willingness to effectively exercise flag State control, while \nrecognizing the need to enhance the capacity of developing States in this regard; \n \n154. Encourages relevant coastal States and States fishing on the high seas for \na straddling fish stock or a highly migratory fish stock, where there is no subregional \nor regional fisheries management organization or arrangement to establish \nconservation and management measures for such stocks, to cooperate to establish \nsuch an organization or enter into another appropriate arrangement to ensure the \nconservation and management of such stocks, and to participate in the work of the \norganization or arrangement; \n \n155. Welcomes the recent ratifications, acceptances and approval of the \nAgreement to Prevent Unregulated High Seas Fisheries in the Central Arctic Ocean, \nand encourages further ratifications, acceptances and approvals of that Agreement by \nStates listed in article 9, paragraph 1, thereof, with a view to its early entry into force; \n \n156. Urges signatory States and other States whose vessels fish within the area \nof the Convention on the Conservation and Management of Fishery Resources in the \nSouth-East Atlantic Ocean28 for fishery resources covered by that Convention to \nbecome parties to that Convention as a matter of priority and, in the interim, to ensure \nthat vessels flying their flags fully comply with the measures adopted; \n \n157. Encourages further ratifications of, accessions to, acceptances and \napprovals of the Southern Indian Ocean Fisheries Agreement;29  \n \n158. Also encourages further ratifications of, accessions to, acceptances and \napprovals of the Convention on the Conservation and Management of High Seas \nFishery Resources in the South Pacific Ocean;30  \n__________________ \n \n28  United Nations, Treaty Series, vol. 2221, No. 39489. \n \n29  Ibid., vol. 2835, No. 49647. \n \n30  Ibid., vol. 2899, No. 50553. \n\nSustainable fisheries, including through the 1995 Agreement for the Implementation of the \nProvisions of the United Nations Convention on the Law of the Sea of 10 December 1982 \nrelating to the Conservation and Management of Straddling Fish Stocks \nand Highly Migratory Fish Stocks, and related instruments \nA/RES/75/89\n \n31/43\n20-16920 \n \n \n159. Further encourages further accessions to the Convention on the \nConservation and Management of High Seas Fisheries Resources in the North Pacific \nOcean, and notes the ongoing efforts by the North Pacific Fisheries Commission to \ndevelop and implement conservation and management measures and to strengthen \ncooperation to eliminate illegal, unreported and unregulated fishing within the area \nof that Convention; \n \n160. Welcomes the endorsement of the Agreement for the Establishment of the \nGeneral Fisheries Commission for the Mediterranean, as amended, by the \nCommission at its thirty-eighth session, held in Rome from 19 to 24 May 2014, and \nurges those Contracting Parties to the Commission that need to accept the amended \nAgreement to do so with a view to its early entry into force; \n \n161. Notes the ongoing efforts of the members of the Indian Ocean Tuna \nCommission to strengthen the functioning of the Commission so that it can more \neffectively discharge its mandate, and invites the Food and Agriculture Organization \nof the United Nations to provide members of the Commission with the necessary \nassistance to this end; \n \n162. Encourages signatory States and States having a real interest to become \nparties to the Convention for the Strengthening of the Inter-American Tropical Tuna \nCommission Established by the 1949 Convention between the United States of \nAmerica and the Republic of Costa Rica; \n \n163. Urges further efforts by regional fisheries management organizations and \narrangements, as a matter of priority, in accordance with international law, to \nstrengthen and modernize their mandates and the measures adopted by such \norganizations or arrangements, and to implement modern approaches to fisheries \nmanagement, as reflected in the Agreement and other relevant international \ninstruments, relying on the best scientific information available and application of the \nprecautionary approach and incorporating an ecosystem approach to fisheries \nmanagement and biodiversity considerations, including the conservation and \nmanagement of ecologically related and dependent species and protection of their \nhabitats, where these aspects are lacking, to ensure that they effectively contribute to \nthe long-term conservation and management and sustainable use of living marine \nresources, and welcomes those regional fisheries management organizations and \narrangements that have taken steps in this direction; \n \n164. Calls upon regional fisheries management organizations with the \ncompetence to conserve and manage highly migratory fish stocks that have not yet \nadopted effective conservation and management measures in line with the best \nscientific information available to conserve and manage stocks falling under their \nmandate to do so urgently; \n \n165. Urges States to strengthen and enhance cooperation among existing and \ndeveloping regional fisheries management organizations and arrangements in which \nthey participate, including increased communication and further coordination of \nmeasures, such as through the holding of joint consultations, and to strengthen \nintegration, coordination and cooperation by such regional fisheries management \norganizations and arrangements with other relevant fisheries organizations, regional \nseas arrangements and other relevant international organizations; \n \n166. Notes, in this regard, the enhanced cooperation between the OSPAR \nCommission established by the Convention for the Protection of the Marine \nEnvironment of the North-East Atlantic31 and the North-East Atlantic Fisheries \nCommission; \n__________________ \n \n31  Ibid., vol. 2354, No. 42279. \n\nA/RES/75/89 \nSustainable fisheries, including through the 1995 Agreement for the Implementation of the \nProvisions of the United Nations Convention on the Law of the Sea of 10 December 1982 \nrelating to the Conservation and Management of Straddling Fish Stocks\nand Highly Migratory Fish Stocks, and related instruments\n \n20-16920\n32/43 \n \n \n167. Urges the five regional fisheries management organizations with \ncompetence to manage highly migratory species to continue to take measures to \nimplement the Course of Actions adopted at the second joint meeting of tuna regional \nfisheries management organizations and arrangements and to consider the \nrecommendations of the third joint meeting of tuna regional fisheries management \norganizations and arrangements; \n \n168. Invites States and regional fisheries management organizations and \narrangements with competence to manage straddling fish stocks to share experiences \nand good practices, for example by considering organizing joint meetings, where \nappropriate; \n \n169. Invites States and regional fisheries management organizations and \narrangements with competence to manage deep-sea fisheries to share experiences and \ngood practices, for example by considering organizing joint meetings, where \nappropriate; \n \n170. Urges regional fisheries management organizations and arrangements to \nimprove transparency and to ensure that their decision-making processes are fair and \ntransparent and facilitate the adoption of conservation and management measures in \na timely and effective manner, including considering provisions for effective voting \nand objection procedures, where appropriate, to rely on the best scientific information \navailable, incorporate the precautionary approach and ecosystem approaches, and \naddress participatory rights, including through, inter alia, the development of \ntransparent criteria for allocating fishing opportunities which reflects, where \nappropriate, the relevant provisions of the Agreement, taking due account, inter alia, \nof the status of the relevant stocks and the respective interests in the fishery; \n \n171. Recognizes that performance reviews of regional fisheries management \norganizations and arrangements have proven to be an effective tool for strengthening \nthe performance of such organizations and arrangements, and are critical to improve \nthe sustainability of fish stocks covered by such organizations and arrangements; \n \n172. Welcomes the fact that a number of regional fisheries management \norganizations and arrangements have completed performance reviews, and \nencourages the implementation, as appropriate, of the recommendations of their \nrespective reviews as a matter of priority; \n \n173. Urges States, through their participation in regional fisheries management \norganizations and arrangements that have not done so, to undertake, on an urgent \nbasis, performance reviews of those regional fisheries management organizations and \narrangements, initiated either by the organization or arrangement itself or with \nexternal partners, including in cooperation with the Food and Agriculture \nOrganization of the United Nations, using transparent criteria based on the provisions \nof the Agreement and other relevant instruments, and taking into account the best \npractices of regional fisheries management organizations or arrangements and, as \nappropriate, any set of criteria developed by States or other regional fisheries \nmanagement organizations or arrangements, and encourages that such performance \nreviews include some element of independent evaluation and propose means for \nimproving the functioning of the regional fisheries management organization or \narrangement, as appropriate; \n \n174. Calls upon States, through their participation in regional fisheries \nmanagement organizations and arrangements, to undertake performance reviews of \nthose regional fisheries management organizations and arrangements on a regular \nbasis, to make the results publicly available, to implement the recommendations of \nsuch reviews and to strengthen the comprehensiveness of those reviews over time, as \nnecessary; \n\nSustainable fisheries, including through the 1995 Agreement for the Implementation of the \nProvisions of the United Nations Convention on the Law of the Sea of 10 December 1982 \nrelating to the Conservation and Management of Straddling Fish Stocks \nand Highly Migratory Fish Stocks, and related instruments \nA/RES/75/89\n \n33/43\n20-16920 \n \n \n175. Recalls that, in \u201cThe future we want\u201d, States recognized the need for \ntransparency and accountability in fisheries management by regional fisheries \nmanagement organizations and the efforts already made by those regional fisheries \nmanagement organizations that had undertaken independent performance reviews, \ncalled upon all regional fisheries management organizations to regularly undertake \nsuch reviews and make the results publicly available, encouraged implementation of \nthe recommendations of such reviews and recommended that the comprehensiveness \nof those reviews be strengthened over time, as necessary; \n \n176. Urges States to cooperate, taking into account those performance reviews, \nto develop best-practice guidelines for regional fisheries management organizations \nand arrangements and to apply, to the extent possible, those guidelines to \norganizations and arrangements in which they participate; \n \n177. Encourages States, individually or through regional fisheries management \norganizations and arrangements, as appropriate, to recognize the importance and role \nof small-scale, artisanal and subsistence fisheries and to support their long-term \nenvironmental, economic and social sustainability; \n \n178. Encourages the development of regional guidelines for States to use in \nestablishing sanctions for non-compliance by vessels flying their flag and by their \nnationals, to be applied in accordance with national law, that are adequate in severity \nfor effectively securing compliance, deterring further violations and depriving \noffenders of the benefits deriving from their illegal activities, as well as in evaluating \ntheir systems of sanctions to ensure that they are effective in securing compliance and \ndeterring violations; \n \n179. Recognizes the importance of ensuring transparency of reporting of fishing \nactivities within regional fisheries management organizations and arrangements in \norder to facilitate efforts to combat illegal, unreported and unregulated fishing, as \nwell as the importance of respecting the reporting obligations within those \norganizations and arrangements, notes in this regard the measures adopted by the \nInternational Commission for the Conservation of Atlantic Tunas32 and the Indian \nOcean Tuna Commission,33 and encourages other regional fisheries management \norganizations and arrangements to consider establishing similar measures; \n \n \n \nX \n \n \nResponsible fisheries in the marine ecosystem \n \n \n180. Encourages States, individually and through relevant international bodies, \nto improve the understanding of the causes and impacts of forced labour and human \ntrafficking in the fishing and aquaculture industries, including processing and related \nindustries, and to further consider actions to combat these practices, including raising \nawareness of the issue; \n \n181. Highlights the importance of safety at sea and working conditions in the \nfisheries sector, welcomes in this regard the close cooperation between the Food and \nAgriculture Organization of the United Nations, the International Labour \nOrganization and the International Maritime Organization, including with regard to \ntheir joint work on codes and guidelines in relation to fishing vessel safety, 34 and \nreiterates the request by the Committee on Fisheries of the Food and Agriculture \nOrganization of the United Nations, at its thirty-third session, that the Food and \nAgriculture Organization of the United Nations further strengthen international \n__________________ \n \n32  International Commission for the Conservation of Atlantic Tunas, recommendation 11-16. \n \n33  Indian Ocean Tuna Commission, resolutions 12/07 and 13/07. \n \n34  Including the Code of Safety for Fishermen and Fishing Vessels, 2005, and the Voluntary \nGuidelines for the Design, Construction and Equipment of Small Fishing Vessels, 2005. \n\nA/RES/75/89 \nSustainable fisheries, including through the 1995 Agreement for the Implementation of the \nProvisions of the United Nations Convention on the Law of the Sea of 10 December 1982 \nrelating to the Conservation and Management of Straddling Fish Stocks\nand Highly Migratory Fish Stocks, and related instruments\n \n20-16920\n34/43 \n \ncooperation on occupational health and safety issues in the fisheries and aquaculture \nsectors and promote decent work for fish workers; \n \n182. Recalls that the Work in Fishing Convention, 2007 (No. 188) and the \nProtocol of 2014 to the Forced Labour Convention, 1930 (No. 29) are relevant \ninstruments that ensure decent working conditions in fisheries and other maritime \nsectors, calls upon flag States to effectively implement their duty under the \nConvention with respect to labour conditions, taking into account applicable \ninternational instruments and national laws, and in this regard encourages States that \nhave not yet done so to consider becoming parties to the Protocol of 2014 to the \nForced Labour Convention, 1930 (No. 29) and the Work in Fishing Convention, 2007 \n(No. 188), and to implement the Guidelines for port State control officers carrying \nout inspections under the Work in Fishing Convention, 2007 (No. 188) and the \nGuidelines on flag State inspection of working and living conditions on board fishing \nvessels; \n \n183. Urges States, individually or through regional fisheries management \norganizations and arrangements, to enhance their efforts to apply an ecosystem \napproach to fisheries, taking into account paragraph 30 (d) of the Johannesburg Plan \nof Implementation; \n \n184. Acknowledges the importance of adequate training for fishers to improve \nsafety at sea and the importance, in this regard, of the International Convention on \nStandards of Training, Certification and Watchkeeping for Fishing Vessel Personnel, \n1995, and encourages States that have not yet done so to consider becoming parties \nto that Convention; \n \n185. Encourages States, individually or through regional fisheries management \norganizations and arrangements and other relevant international organizations, to \nwork to ensure that fisheries and other ecosystem data collection is performed in a \ncoordinated and integrated manner, facilitating incorporation into global observation \ninitiatives, where appropriate; \n \n186. Calls upon States and regional fisheries management organizations or \narrangements, working in cooperation with other relevant organizations, including the \nFood and Agriculture Organization of the United Nations, the Intergovernmental \nOceanographic Commission and the World Meteorological Organization, to adopt, as \nappropriate, measures to protect ocean data buoy systems moored in areas beyond \nnational jurisdiction from actions that impair their operation; \n \n187. Encourages States to increase scientific research on marine ecosystems in \naccordance with international law; \n \n188. Recognizes that the science-policy interface is vital to the effective \nimplementation of the provisions of the Convention and the Agreement by providing \nthe best available scientific information for the conservation and management of \nliving marine resources; \n \n189. Urges States, individually and through regional fisheries management \norganizations and arrangements, to strengthen the science-policy interface in order to \nfurther improve the application of the ecosystem approach to fisheries management \nand to address uncertainties and changes such as those related to the impacts of \nclimate change in support of the development of adaptive fisheries management \nstrategies; \n \n190. Calls upon States, the Food and Agriculture Organization of the United \nNations and other specialized agencies, subregional and regional fisheries \nmanagement organizations and arrangements, where appropriate, and other \nappropriate intergovernmental bodies to cooperate in achieving sustainable \n\nSustainable fisheries, including through the 1995 Agreement for the Implementation of the \nProvisions of the United Nations Convention on the Law of the Sea of 10 December 1982 \nrelating to the Conservation and Management of Straddling Fish Stocks \nand Highly Migratory Fish Stocks, and related instruments \nA/RES/75/89\n \n35/43\n20-16920 \n \naquaculture, including through information exchange, developing equivalent \nstandards on such issues as aquatic animal health and human health and safety \nconcerns, assessing the potential positive and negative impacts of aquaculture, \nincluding socioeconomics, on the marine and coastal environment, including \nbiodiversity, and adopting relevant methods and techniques to minimize and mitigate \nadverse effects, and in this regard encourages the implementation of the 2007 Strategy \nand Outline Plan for Improving Information on Status and Trends of Aquaculture of \nthe Food and Agriculture Organization of the United Nations as a framework for the \nimprovement and understanding of aquaculture status and trends; \n \n191. Calls upon States to take action immediately, individually and through \nregional fisheries management organizations and arrangements, and consistent with \nthe precautionary approach and ecosystem approaches, to continue to implement the \n2008 International Guidelines for the Management of Deep-Sea Fisheries in the High \nSeas of the Food and Agriculture Organization of the United Nations (the Guidelines) \nin order to sustainably manage fish stocks and protect vulnerable marine ecosystems, \nincluding seamounts, hydrothermal vents and cold water corals, from fishing \npractices with significant adverse impacts on vulnerable marine ecosystems, \nrecognizing the immense importance and value of deep-sea ecosystems and the \nbiodiversity they contain, as documented in the first World Ocean Assessment; \n \n192. Recalls, in this regard, that, in \u201cThe future we want\u201d, States committed to \nenhance actions to protect vulnerable marine ecosystems from significant adverse \nimpacts, including through the effective use of impact assessments, consistent with \ninternational law, the applicable international instruments and relevant General \nAssembly resolutions and guidelines of the Food and Agriculture Organization of the \nUnited Nations; \n \n193. Reaffirms the importance of paragraphs 80 to 90 of resolution 61/105, \nparagraphs 113 to 127 of resolution 64/72, paragraphs 121 to 136 of resolution 66/68 \nof 6 December 2011 and paragraphs 156, 171 to 188 and 219 of resolution 71/123 of \n7 December 2016 addressing the impacts of bottom fishing on vulnerable marine \necosystems and the long-term sustainability of deep-sea fish stocks and the actions \ncalled for in those resolutions, and emphasizes the need for full implementation by \nall States and relevant regional fisheries management organizations and arrangements \nof their commitments under those paragraphs on an urgent basis; \n \n194. Urges States and regional fisheries management organizations and \narrangements to ensure that their actions in sustainably managing deep-sea fisheries \nand implementing paragraphs 80 and 83 to 87 of resolution 61/105, paragraphs 113 \nand 119 to 124 of resolution 64/72, paragraphs 121, 129, 130 and 132 to 134 of \nresolution 66/68 and paragraphs 156, 171 to 188 and 219 of resolution 71/123 are \nconsistent with the Guidelines; \n \n195. Recalls that nothing in the paragraphs of resolutions 61/105, 64/72, 66/68 \nand 71/123 addressing the impacts of bottom fishing on vulnerable marine ecosystems \nprejudices the sovereign rights of coastal States over their continental shelf or the \nexercise of the jurisdiction of coastal States with respect to their continental shelf \nunder international law as reflected in the Convention, in particular article 77 thereof; \n \n196. Notes, in this regard, the adoption by coastal States of conservation \nmeasures regarding their continental shelf to address the impacts of bottom fishing \non vulnerable marine ecosystems, as well as their efforts to ensure compliance with \nthose measures; \n \n197. Reiterates the importance of marine scientific research for the sustainable \nmanagement of deep-sea fishery resources, including target fish stocks and non-target \n\nA/RES/75/89 \nSustainable fisheries, including through the 1995 Agreement for the Implementation of the \nProvisions of the United Nations Convention on the Law of the Sea of 10 December 1982 \nrelating to the Conservation and Management of Straddling Fish Stocks\nand Highly Migratory Fish Stocks, and related instruments\n \n20-16920\n36/43 \n \nspecies, and to protect marine ecosystems, including the prevention of significant \nadverse impacts on vulnerable marine ecosystems; \n \n198. Welcomes the important progress made by States, regional fisheries \nmanagement organizations and arrangements and those States participating in \nnegotiations to establish a regional fisheries management organization or \narrangement competent to regulate bottom fisheries to implement paragraphs 80 and \n83 to 87 of resolution 61/105, paragraphs 113, 117 and 119 to 124 of resolution 64/72 \nand paragraphs 121, 126, 129, 130 and 132 to 134 of resolution 66/68 and address the \nimpacts of bottom fishing on vulnerable marine ecosystems, but notes with concern \nthe uneven implementation of those paragraphs and that, in particular, bottom fishing \ncontinues to occur in certain areas beyond national jurisdiction without an impact \nassessment having been completed in the 12 years since the adoption of resolution \n61/105, in which the General Assembly called for such assessments to be undertaken \nby 31 December 2008; \n \n199. Calls upon, in this regard, States, regional fisheries management \norganizations and arrangements with the competence to regulate deep-sea fisheries, \nand States participating in negotiations to establish such organizations or \narrangements to take, in particular, the following urgent actions regarding bottom \nfishing in areas beyond national jurisdiction: \n \n(a) \nTo use, as applicable, the full set of criteria in the Guidelines to identify \nwhere vulnerable marine ecosystems occur or are likely to occur as well as for \nassessing significant adverse impacts; \n \n(b) \nTo ensure that impact assessments, including for cumulative impacts of \nactivities covered by the assessment, are conducted consistent with the Guidelines, \nparticularly paragraph 47 thereof, are reviewed periodically and are revised thereafter \nwhenever a substantial change in the fishery has occurred or there is relevant new \ninformation, and that, where such impact assessments have not been undertaken, they \nare carried out as a priority before authorizing bottom fishing activities; \n \n(c) \nTo ensure that conservation and management measures adopted by States \nand regional fisheries organizations and arrangements are based on and updated on \nthe basis of the best available scientific information, noting in particular the need to \nimprove the effective implementation of thresholds and move-on rules; \n \n200. Recognizes that different types of marine scientific research, such as \nseabed mapping, mapping of vulnerable marine ecosystems based on information \nfrom the fishing fleet, on-site camera observations from remote vehicles, benthic \necosystem modelling, comparative benthic studies and predictive modelling have \nresulted in the identification of areas where vulnerable marine ecosystems are known \nor are likely to occur and in the adoption of conservation and management measures \nto prevent significant adverse impacts on such ecosystems, including the closure of \nareas to bottom fishing in accordance with paragraph 119 (b) of resolution 64/72; \n \n201. Encourages, in this regard, States, regional fisheries management \norganizations and arrangements with the competence to manage bottom fisheries, and \nStates participating in negotiations to establish such organizations or arrangements, \nto consider the results available from different types of marine scientific research, \nincluding, as appropriate, those listed in paragraph 201 above, concerning the \nidentification of areas containing vulnerable marine ecosystems, and to adopt \nconservation and management measures to prevent significant adverse impacts from \nbottom fishing on such ecosystems, consistent with the Guidelines, or to close such \nareas to bottom fishing until such conservation and management measures are \nadopted, as well as to continue to undertake further marine scientific research, for the \n\nSustainable fisheries, including through the 1995 Agreement for the Implementation of the \nProvisions of the United Nations Convention on the Law of the Sea of 10 December 1982 \nrelating to the Conservation and Management of Straddling Fish Stocks \nand Highly Migratory Fish Stocks, and related instruments \nA/RES/75/89\n \n37/43\n20-16920 \n \nabove-mentioned purposes, in accordance with international law, as reflected in \nPart XIII of the Convention; \n \n202. Encourages, in this regard, States, regional fisheries management \norganizations and arrangements with the competence to manage deep-sea fisheries, \nand States participating in negotiations to establish such organizations or \narrangements to carry out further marine scientific research to address the remaining \nknowledge gaps, in particular with regard to fish stock assessments, and to base and \nupdate conservation and management measures on the best available scientific \ninformation, in accordance with international law, as reflected in Part XIII of the \nConvention; \n \n203. Notes with concern that vulnerable marine ecosystems may also be \nimpacted by human activities other than bottom fishing, and encourages in this regard \nStates and competent international organizations to consider taking action to address \nsuch impacts; \n \n204. Calls upon States, individually and through regional fisheries management \norganizations and arrangements, to take into account the potential impacts of climate \nchange and ocean acidification in taking measures to manage deep-sea fisheries and \nprotect vulnerable marine ecosystems; \n \n205. Calls upon States, individually and through regional fisheries management \norganizations and arrangements with the competence to regulate deep-sea fisheries, \nto adopt conservation and management measures, including monitoring, control and \nsurveillance measures, on the basis of the best available scientific information, \nincluding stock assessments, to ensure the long-term sustainability of deep-sea fish \nstocks and non-target species and the rebuilding of depleted stocks, consistent with \nthe Guidelines and, where scientific information is uncertain, unreliable or \ninadequate, to ensure that conservation and management measures are established \nconsistent with the precautionary approach, in particular with regard to vulnerable, \nthreatened or endangered species; \n \n206. Recognizes, in particular, the special circumstances and requirements of \ndeveloping States and the specific challenges that they may face in giving full effect \nto certain technical aspects of the Guidelines, and that implementation by such States \nof paragraphs 83 to 87 of resolution 61/105, paragraph 119 of resolution 64/72, \nparagraph 129 of resolution 66/68 and paragraph 180 of resolution 71/123 and the \nGuidelines should proceed in a manner that gives full consideration to section 6 of \nthe Guidelines on the special requirements of developing countries; \n \n207. Also recognizes the need to enhance the capacity of developing States, \nincluding with regard to stock assessments, impact assessments, scientific and \ntechnical knowledge and training, and encourages States to provide technical and \nfinancial support to developing countries to address their special requirements and \nchallenges in implementing the Guidelines; \n \n208. Welcomes the substantial ongoing work of the Food and Agriculture \nOrganization of the United Nations related to the management of deep-sea fisheries \nin the high seas and the protection of vulnerable marine ecosystems, including the \npublication of the technical paper entitled \u201cVulnerable marine ecosystems: processes \nand practices in the high seas\u201d, affirms the importance of the work undertaken \npursuant to paragraphs 135 and 136 of resolution 66/68, and notes in particular the \nsupport provided by the Food and Agriculture Organization of the United Nations to \nStates in implementing the Guidelines; \n \n209. Decides, in the light of the impacts of the COVID-19 pandemic, to \npostpone until 2022 the further review of the actions taken by States and regional \nfisheries management organizations and arrangements in response to paragraphs 113, \n\nA/RES/75/89 \nSustainable fisheries, including through the 1995 Agreement for the Implementation of the \nProvisions of the United Nations Convention on the Law of the Sea of 10 December 1982 \nrelating to the Conservation and Management of Straddling Fish Stocks\nand Highly Migratory Fish Stocks, and related instruments\n \n20-16920\n38/43 \n \n117 and 119 to 124 of resolution 64/72, paragraphs 121, 126, 129, 130 and 132 to 134 \nof resolution 66/68 and paragraphs 156, 171, 175, 177 to 188 and 219 of resolution \n71/123, which was to be held in 2020, with a view to ensuring the effective \nimplementation of the measures therein and to make further recommendations, where \nnecessary, and also recalls the decision to precede that review with a two-day \nworkshop;  \n \n210. Requests the Secretary-General to convene in the second half of 2022, with \nfull conference services, without prejudice to future arrangements, the two-day \nworkshop that was to have been held in 2020 pursuant to resolution 73/125 of \n11 December 2018, in order to discuss implementation of paragraphs 113, 117 and \n119 to 124 of resolution 64/72, paragraphs 121, 126, 129, 130 and 132 to 134 of \nresolution 66/68 and paragraphs 156, 171, 175, 177 to 188 and 219 of resolution \n71/123, and to invite States, the Food and Agriculture Organization of the United \nNations and other relevant specialized agencies, funds and programmes, subregional \nand regional fisheries management organizations and arrangements, other fisheries \nbodies, other relevant intergovernmental bodies and relevant non-governmental \norganizations and relevant stakeholders, in accordance with United Nations practice, \nto attend the workshop; \n \n211. Welcomes the report of the Secretary-General on the actions taken by \nStates and regional fisheries management organizations and arrangements in response \nto paragraphs 113, 117 and 119 to 124 of resolution 64/72, paragraphs 121, 126, 129, \n130 and 132 to 134 of resolution 66/68 and paragraphs 156, 171, 175, 177 to 188 and \n219 of resolution 71/123;35  \n \n212. Requests the Secretary-General to prepare a report, in cooperation with the \nFood and Agriculture Organization of the United Nations, for consideration by the \nGeneral Assembly at its seventy-seventh session, on further actions taken by States \nand regional fisheries management organizations and arrangements in response to \nparagraphs 113, 117 and 119 to 124 of resolution 64/72, paragraphs 121, 126, 129, \n130 and 132 to 134 of resolution 66/68 and paragraphs 156, 171, 175, 177 to 188 and \n219 of resolution 71/123 since the preparation of the report referred to in \nparagraph 211 of the present resolution, and invites States and regional fisheries \nmanagement organizations and arrangements to consider making such information \npublicly available; \n \n213. Also requests the Secretary-General, in connection with the report \nrequested in paragraph 212 of the present resolution, to invite States and regional \neconomic integration organizations and regional fisheries management organizations \nand arrangements to submit updated information to the Secretary-General in a timely \nmanner on actions taken pursuant to paragraphs 113, 117 and 119 to 124 of resolution \n64/72, paragraphs 121, 126, 129, 130 and 132 to 134 of resolution 66/68 and \nparagraphs 156, 171, 175, 177 to 188 and 219 of resolution 71/123 after 2019, to \nfacilitate a further review of such actions; \n \n214. Encourages accelerated progress to establish criteria on the objectives, \nestablishment and effective management of marine protected areas for fisheries \npurposes, and in this regard also encourages the application of the technical guidelines \non marine protected areas and fisheries of the Food and Agriculture Organization of \nthe United Nations, and urges involvement, coordination and cooperation among all \nrelevant international organizations and bodies; \n \n215. Also encourages efforts to establish guidance on the objectives, \nestablishment and management of other effective area-based conservation measures \n__________________ \n \n35  A/75/157. \n\nSustainable fisheries, including through the 1995 Agreement for the Implementation of the \nProvisions of the United Nations Convention on the Law of the Sea of 10 December 1982 \nrelating to the Conservation and Management of Straddling Fish Stocks \nand Highly Migratory Fish Stocks, and related instruments \nA/RES/75/89\n \n39/43\n20-16920 \n \nfor fisheries purposes, and encourages coordination and cooperation for this purpose \namong all relevant international organizations and bodies; \n \n216. Urges all States to implement the 1995 Global Programme of Action for \nthe Protection of the Marine Environment from Land-based Activities36 and to \naccelerate activity to safeguard marine ecosystems, including fish stocks, against \nsources of land-based pollution, including plastics and excess nutrients, and physical \ndegradation, taking into account the increase in oceanic dead zones; \n \n217. Calls upon States, either individually, collectively or through regional \nfisheries management organizations and arrangements, to further study, develop and \nadopt effective management measures, and disseminate information in that regard, \ntaking into account the best available scientific information, on fishing methods, gear \ntypes and uses to minimize mortality and other harms caused by abandoned, lost or \notherwise discarded fishing gear; \n \n218. Acknowledges the serious environmental, as well as economic and social, \nimpacts on the marine environment caused by abandoned, lost or otherwise discarded \nfishing gear, and encourages States, and regional fisheries management organizations \nand arrangements, as appropriate, to take action to reduce such gear, noting the \nrecommendations of the 2009 report by the United Nations Environment Programme \nand the Food and Agriculture Organization of the United Nations; \n \n219. Reaffirms the importance that it attaches to paragraphs 77 to 81 of \nresolution 60/31 of 29 November 2005 concerning the issue of lost, abandoned or \notherwise discarded fishing gear and related marine debris and the adverse impacts \nthat such debris and derelict fishing gear have on, inter alia, fish stocks, habitats and \nother marine species, and urges accelerated progress by States and regional fisheries \nmanagement organizations and arrangements in implementing those paragraphs of the \nresolution; \n \n220. Recalls, in this regard, the endorsement by the Committee on Fisheries, at \nits thirty-third session, of the Voluntary Guidelines on the Marking of Fishing Gear, \nand also recalls that the Committee welcomed the recommendations of the Technical \nConsultation on the Marking of Fishing Gear and supported the development of a \ncomprehensive global strategy to tackle issues relating to abandoned, lost or \notherwise discarded fishing gear and to support the implementation of the Guidelines; \n \n221. Also recalls annex V to the International Convention for the Prevention of \nPollution from Ships, 1973, as modified by the Protocol of 1978 relating thereto, in \nwhich it is stated, inter alia, that the accidental loss or discharge of fishing gear which \nposes a significant threat to the marine environment or navigation, shall be reported \nto the State whose flag the ship is entitled to fly, and, where the loss or discharge \noccurs within waters subject to the jurisdiction of a coastal State, also to that coastal \nState;37  \n \n222. Encourages further studies, including by the Food and Agriculture \nOrganization of the United Nations, on the impacts of underwater noise on fish stocks \nand fishing catch rates, as well as associated socioeconomic effects; \n \n223. Calls upon States, including through regional fisheries management \norganizations and arrangements, to play an active role in global efforts to conserve \nand sustainably use living marine resources, so as to contribute to marine biological \ndiversity; \n__________________ \n \n36  A/51/116, annex II. \n \n37  International Maritime Organization, resolution MEPC.201(62). \n\nA/RES/75/89 \nSustainable fisheries, including through the 1995 Agreement for the Implementation of the \nProvisions of the United Nations Convention on the Law of the Sea of 10 December 1982 \nrelating to the Conservation and Management of Straddling Fish Stocks\nand Highly Migratory Fish Stocks, and related instruments\n \n20-16920\n40/43 \n \n \n224. Encourages States, either individually or through regional fisheries \nmanagement organizations and arrangements, as appropriate, to identify any \nspawning and nursery areas for fish stocks under their jurisdiction or competence and, \nwhere required, to adopt science-based measures to conserve such stocks during these \ncritical life stages; \n \n225. Expresses concern about the continuing influx of sargassum seaweed into \nthe waters of the Caribbean and its impact on aquatic resources, fisheries, shorelines, \nwaterways and tourism and the general well-being of coastal communities, and \nencourages States and relevant regional organizations to coordinate efforts to better \nunderstand the causes and impacts of the influx, and to eliminate extraordinary \namounts of sargassum washed up along the coastline using environmentally sound \ntechniques, as well as to work on joint solutions to maintain and protect the \nlivelihoods of fishers and fishing communities and find ways of beneficially utilizing \nthe seaweed and environmentally friendly ways of disposing of sargassum washed up \non shore; \n \n226. Recognizes the wide range of impacts of ocean acidification on marine \necosystems, and calls upon States to tackle the causes of ocean acidification and to \nfurther study its impacts; \n \n227. Emphasizes the importance of developing adaptive marine resource \nmanagement strategies and enhancing capacity-building to implement such strategies \nin order to enhance the resilience of marine ecosystems to minimize the wide range \nof impacts on marine organisms and threats to food security caused by ocean \nacidification, in particular the impacts on the ability of calciferous plankton, coral \nreefs, shellfish and crustaceans to build shells and skeletal structures and the threats \nthat this could pose to protein supply; \n \n \n \nXI \n \n \nCapacity-building \n \n \n228. Reiterates the crucial importance of cooperation by States directly or, as \nappropriate, through the relevant subregional and regional organizations, and by other \ninternational organizations, including the Food and Agriculture Organization of the \nUnited Nations through its FishCode programme, including through financial and/or \ntechnical assistance, in accordance with the Agreement, the Compliance Agreement, \nthe Code and its associated international plans of action, to increase the capacity of \ndeveloping States to achieve the goals and implement the actions called for in the \npresent resolution; \n \n229. Welcomes the ongoing work of the Food and Agriculture Organization of \nthe United Nations in developing guidance on, and assisting in the implementation \nof, the strategies and measures required for the creation of an enabling environment \nfor sustainable small-scale fisheries, and encourages studies for creating possible \nalternative livelihoods for coastal communities; \n \n230. Recalls that, in \u201cThe future we want\u201d, States recognized the importance of \nbuilding the capacity of developing countries to be able to benefit from the \nconservation and sustainable use of the oceans and seas and their resources, and in \nthis regard emphasized the need for cooperation in marine scientific research to \nimplement the provisions of the Convention and the outcomes of the major summits \non sustainable development, as well as for the transfer of technology, taking into \naccount the Intergovernmental Oceanographic Commission Criteria and Guidelines \non the Transfer of Marine Technology; \n \n231. Also recalls that, in \u201cThe future we want\u201d, States urged the identification \nand mainstreaming by 2014 of strategies that further assist developing countries, in \nparticular the least developed countries and small island developing States, in \n\nSustainable fisheries, including through the 1995 Agreement for the Implementation of the \nProvisions of the United Nations Convention on the Law of the Sea of 10 December 1982 \nrelating to the Conservation and Management of Straddling Fish Stocks \nand Highly Migratory Fish Stocks, and related instruments \nA/RES/75/89\n \n41/43\n20-16920 \n \ndeveloping their national capacity to conserve, sustainably manage and realize the \nbenefits of sustainable fisheries, including through improved market access for fish \nproducts from developing countries; \n \n232. Encourages increased capacity-building and technical assistance by \nStates, \ninternational \nfinancial \ninstitutions \nand \nrelevant \nintergovernmental \norganizations and bodies for fishers, in particular small-scale fishers, in developing \ncountries, and in particular small island developing States, consistent with \nenvironmental sustainability, in recognition of the fact that food security and \nlivelihoods may depend on fisheries; \n \n233. Encourages States to cooperate closely, directly or through the United \nNations system, including the Food and Agriculture Organization of the United \nNations, with a view to enhancing the capacity-building of developing States, \nincluding coastal States, in particular small island developing States, in the field of \nfisheries and aquaculture through education and training; \n \n234. Recognizes, in this regard, the work of the United Nations University \nFisheries Training Programme in Iceland and its contribution to training for \ndeveloping States, in particular small island developing States, and emphasizes the \nneed for the continuation and strengthening of this training for developing States; \n \n235. Encourages the international community to enhance the opportunities for \nsustainable development in developing countries, in particular the least developed \ncountries, small island developing States and coastal African States, by encouraging \ngreater participation of those States in authorized fisheries activities being undertaken \nwithin areas under their national jurisdiction, in accordance with the Convention, by \ndistant-water fishing nations in order to achieve better economic returns for \ndeveloping countries from their fisheries resources within areas under their national \njurisdiction and an enhanced role in regional fisheries management, as well as by \nenhancing the ability of developing countries to develop their own fisheries, as well \nas to participate in high seas fisheries, including access to such fisheries, in \nconformity with international law, in particular the Convention and the Agreement, \nand taking into account article 5 of the Code; \n \n236. Recalls the progress made at the first meeting of the parties to the \nAgreement on Port State Measures to Prevent, Deter and Eliminate Illegal, \nUnreported and Unregulated Fishing towards the future establishment of an assistance \nfund under article 21 of that Agreement to be administered by the Food and \nAgriculture Organization of the United Nations for the purpose of assisting \ndeveloping States parties, in particular the least developed among them and small \nisland developing States, in the implementation of that Agreement and the \nacknowledgement by the ad hoc working group established by the parties to that \nAgreement that access to the assistance fund by developing States parties should be \ntransparent, equitable, simple and well coordinated, and notes the adoption of the \nterms of reference for the funding mechanisms under part 6 of the Agreement at the \nsecond meeting of the parties to the Agreement on Port State Measures; \n \n237. Requests distant-water fishing nations, when negotiating access \nagreements and arrangements with developing coastal States, to do so on an equitable \nand sustainable basis and to take into account their legitimate expectation to fully \nbenefit from the sustainable use of the natural resources of their exclusive economic \nzones, to ensure that vessels flying their flag comply with the laws and regulations of \nthe developing coastal States adopted in accordance with international law and to give \ngreater attention to fish processing and fish-processing facilities within the national \njurisdiction of the developing coastal State to assist in the realization of the benefits \nfrom the development of fisheries resources and also to the transfer of technology and \nassistance for monitoring, control and surveillance and compliance and enforcement \n\nA/RES/75/89 \nSustainable fisheries, including through the 1995 Agreement for the Implementation of the \nProvisions of the United Nations Convention on the Law of the Sea of 10 December 1982 \nrelating to the Conservation and Management of Straddling Fish Stocks\nand Highly Migratory Fish Stocks, and related instruments\n \n20-16920\n42/43 \n \nwithin areas under the national jurisdiction of the developing coastal State providing \nfisheries access, taking into account the forms of cooperation set out in article 25 of \nthe Agreement and article 5 of the Code; \n \n238. Encourages, in this regard, greater transparency regarding fisheries access \nagreements, including by making them publicly available, subject to confidentiality \nrequirements; \n \n239. Encourages \nStates, \nindividually \nand \nthrough \nregional \nfisheries \nmanagement organizations and arrangements, to provide greater assistance and to \npromote coherence in such assistance for developing States in designing, establishing \nand implementing relevant agreements, instruments and tools for the conservation \nand sustainable management of fish stocks, including in designing and strengthening \ntheir domestic regulatory fisheries policies and those of regional fisheries \nmanagement organizations or arrangements in their regions, and the enhancement of \nresearch and scientific capabilities through existing funds, such as the Assistance \nFund under Part VII of the Agreement, bilateral assistance, regional fisheries \nmanagement organizations and arrangements assistance funds, the FishCode \nprogramme, the World Bank\u2019s global programme on fisheries and the Global \nEnvironment Facility; \n \n240. Calls upon States to promote, through continuing dialogue and the \nassistance and cooperation provided in accordance with articles 24 to 26 of the \nAgreement, further ratifications of or accessions to the Agreement by seeking to \naddress, inter alia, the issue of lack of capacity and resources that might stand in the \nway of developing States becoming parties; \n \n241. Encourages States, regional fisheries management organizations and \narrangements and other relevant bodies to assist developing States in the \nimplementation of the actions called for in paragraphs 80 and 83 to 87 of resolution \n61/105, paragraphs 113, 117 and 119 to 124 of resolution 64/72, paragraphs 121, 126, \n129, 130 and 132 to 134 of resolution 66/68 and paragraphs 156, 171, 175 and 177 to \n188 of resolution 71/123; \n \n242. Urges States and regional economic integration organizations, individually \nand through regional fisheries management organizations and arrangements, to \nmainstream efforts to assist developing States, in particular the least developed \ncountries and small island developing States, with other relevant international \ndevelopment strategies with a view to enhancing international coordination to enable \nthem to develop their national capacity to exploit fishery resources, consistent with the \nduty to ensure the conservation and management of those resources, and in this regard \nrequests the Secretary-General to fully mobilize and coordinate the agencies, funds \nand programmes of the United Nations system, including at the level of the regional \neconomic commissions, within their respective mandates; \n \n243. Requests States and regional fisheries management organizations to \ndevelop strategies to further assist developing States, in particular the least developed \ncountries and small island developing States, in fully realizing the benefits from the \ncatch of straddling fish stocks and highly migratory fish stocks and in strengthening \nregional efforts to sustainably conserve and manage such stocks and, in this regard, \nto make available such information; \n \n \n \nXII \n \n \nCooperation within the United Nations system \n \n \n244. Requests the relevant parts of the United Nations system, international \nfinancial institutions and donor agencies to support increased enforcement and \ncompliance capabilities for regional fisheries management organizations and their \nmember States; \n\nSustainable fisheries, including through the 1995 Agreement for the Implementation of the \nProvisions of the United Nations Convention on the Law of the Sea of 10 December 1982 \nrelating to the Conservation and Management of Straddling Fish Stocks \nand Highly Migratory Fish Stocks, and related instruments \nA/RES/75/89\n \n43/43\n20-16920 \n \n \n245. Invites the Food and Agriculture Organization of the United Nations to \ncontinue its cooperative arrangements with United Nations agencies on the \nimplementation of the international plans of action; \n \n \n \nXIII \n \n \nActivities of the Division for Ocean Affairs and the Law of the Sea \n \n \n246. Expresses its appreciation to the Secretary-General for the activities of the \nDivision, which reflect the high standard of assistance provided to Member States by \nthe Division; \n \n247. Requests the Secretary-General to continue to carry out the responsibilities \nand functions entrusted to him by the Convention, the Agreement and the related \nresolutions of the General Assembly and to ensure the allocation of appropriate \nresources to the Division for the performance of its activities under the approved \nbudget for the Organization; \n \n \n \nXIV \n \n \nSeventy-sixth session of the General Assembly \n \n \n248. Requests the Secretary-General to bring the present resolution to the \nattention of all States, relevant intergovernmental organizations, the organizations \nand bodies of the United Nations system, subregional and regional fisheries \nmanagement organizations and relevant non-governmental organizations; \n \n249. Notes the desire to further improve the efficiency of and the effective \nparticipation of delegations in the informal consultations concerning the annual \nGeneral Assembly resolution on sustainable fisheries, decides that the informal \nconsultations on this resolution will be held in a single round of consultations in \nNovember for a period of six days, requests the Secretary-General to provide support \nto the consultations through the Division, and invites States to submit proposals for \ninclusion in the text of the resolution to the Coordinator of the informal consultations \nno later than five weeks before the start of the consultations;  \n \n250. Decides to include in the provisional agenda of its seventy-sixth session, \nunder the item entitled \u201cOceans and the law of the sea\u201d, the sub-item entitled \n\u201cSustainable \nfisheries, \nincluding \nthrough \nthe \n1995 Agreement \nfor \nthe \nImplementation of the Provisions of the United Nations Convention on the Law of \nthe Sea of 10 December 1982 relating to the Conservation and Management of \nStraddling Fish Stocks and Highly Migratory Fish Stocks, and related instruments\u201d, \nand to consider the possibility of including this sub-item in future provisional \nagendas on a biennial basis. \n \n39th plenary meeting \n8 December 2020 \n \n",
  "paragraphs": {
    "1": "Reaffirms the importance that it attaches to the long-term conservation, management and sustainable use of the living marine resources of the world\u2019s oceans and seas and the obligations of States to cooperate to this end, in accordance with international law, as reflected in the relevant provisions of the Convention, in particular the provisions on cooperation set out in Part V and Part VII, section 2, of the Convention, and where applicable, the Agreement;",
    "2": "Calls upon all States that have not done so, in order to achieve the goal of universal participation, to become parties to the Convention, which sets out the legal framework within which all activities in the oceans and seas must be carried out, taking into account the relationship between the Convention and the Agreement;",
    "3": "Notes with satisfaction that, in \u201cThe future we want\u201d,15 States addressed the sustainable development of fisheries, recognized the significant contribution of fisheries to the three dimensions of sustainable development and stressed the crucial role of healthy marine ecosystems, sustainable fisheries and sustainable aquaculture for food security and nutrition and in providing for the livelihoods of millions of people, and encourages States to implement the commitments made in \u201cThe future we want\u201d;",
    "4": "Calls upon States to implement the Sustainable Development Goals outlined in the outcome document of the United Nations summit for the adoption of the post-2015 development agenda, entitled \u201cTransforming our world: the 2030 Agenda for Sustainable Development\u201d, as adopted by the General Assembly in its resolution 70/1, including Goal 14 to conserve and sustainably use the oceans, seas and marine resources for sustainable development, recalling that some of its targets are to be met by 2020 and that the Goals and targets are integrated and indivisible;",
    "5": "Reiterates, in this regard, the call for action to be taken on an urgent basis to conserve and sustainably use the oceans, seas and marine resources for sustainable development made in the declaration entitled \u201cOur ocean, our future: call for action\u201d;16",
    "6": "Encourages States to give due priority to the implementation of the Plan of Implementation of the World Summit on Sustainable Development (Johannesburg Plan of Implementation)17 in relation to achieving sustainable fisheries, especially restoring depleted stocks to levels that can produce maximum sustainable yield on an urgent basis and, where possible, not later than 2015, and recalls that, in \u201cThe future we want\u201d, States committed themselves to intensify their efforts to meet that target and to urgently take the measures necessary to maintain or restore all stocks at least to levels that can produce the maximum sustainable yield, with the aim of achieving those goals in the shortest time feasible, as determined by their biological characteristics, and in order to achieve this, to urgently develop and implement science-based management plans, including by reducing or suspending fishing catch and fishing effort commensurate with the status of the stock, consistent with international law, the applicable international instruments and relevant General Assembly resolutions and guidelines of the Food and Agriculture Organization of the United Nations;",
    "7": "Also encourages States to promote the consumption of fish sourced from sustainably managed fisheries;",
    "8": "Further encourages States to consider sustainable aquaculture, consistent with the Code, as a means to promote diversification of the food supply and of income, while ensuring that aquaculture is conducted responsibly and adverse impacts on the environment are minimized;",
    "9": "Welcomes the convening of the high-level midterm review of the outcome document of the third International Conference on Small Island Developing States, entitled \u201cSIDS Accelerated Modalities of Action (SAMOA) Pathway\u201d,18 in September 2019, reaffirms its resolution 74/3 of 10 October 2019, by which it adopted the political declaration of the high-level meeting to review progress made in addressing the priorities of small island developing States through the implementation of the Samoa Pathway, which notes the importance of oceans, seas and marine resources to small island developing States and acknowledges their efforts to develop and implement strategies for the conservation and sustainable use of the ocean and its resources, and emphasizes the need for the full implementation of the Samoa Pathway;",
    "10": "Expresses its serious concern regarding the impacts of global climate change and ocean acidification on coral reefs and other ecosystems relevant to fisheries, and urges States, either directly or through appropriate subregional, regional or global organizations or arrangements, to intensify efforts to assess and address, as appropriate, the impacts of global climate change and ocean acidification on the sustainability of fish stocks and the habitats that support them, in particular the most affected ones;",
    "11": "Notes, in this regard, the special report on the ocean and cryosphere in a changing climate of the Intergovernmental Panel on Climate Change, and notes with concern the findings contained therein;",
    "12": "Also notes the concern expressed by the Committee on Fisheries of the Food and Agriculture Organization of the United Nations, at its thirty-third session, with regard to the vulnerability of fisheries and aquaculture communities to climate change and extreme events and, in particular, the impacts on small-scale fisheries and small island developing States, and urges States to consider appropriate action in this regard;",
    "13": "Emphasizes the obligations of flag States to discharge their responsibilities, in accordance with the Convention, the Agreement and the Compliance Agreement, to ensure compliance by vessels flying their flag with the conservation and management measures adopted and in force with respect to fisheries resources on the high seas;",
    "14": "Calls upon States and regional fisheries management organizations and arrangements, as appropriate, to assess the risks and potential adverse impacts of climate change with respect to fish stocks, consider them when establishing conservation and management measures and identifying options to reduce risks and adverse impacts with respect to fisheries management and the health and resilience of marine ecosystems and enhance efforts to cooperate to collect, exchange and publish scientific and technical data and best practices related to the development and implementation of adaptation strategies, and to assist developing States in this regard, especially those that are particularly vulnerable to the adverse impacts of climate change;",
    "15": "Encourages States and relevant organizations and arrangements to assess and consider the impacts of climate change on fisheries and aquaculture sectors in their policies and planning, as appropriate, in order to identify effective adaptation strategies to reduce the vulnerability of these sectors to climate change;",
    "16": "Calls upon all States, directly or through regional fisheries management organizations and arrangements, to apply widely, in accordance with international law and the Code, the precautionary approach and ecosystem approaches to the conservation, management and exploitation of fish stocks, and also calls upon States parties to the Agreement to implement fully the provisions of article 6 of the Agreement as a matter of priority;",
    "17": "Urges States to increase their reliance on scientific advice in developing, adopting and implementing conservation and management measures, and to increase their efforts, including through international cooperation, to promote science for conservation and management measures that apply, in accordance with international law, the precautionary approach and ecosystem approaches to fisheries management, enhancing understanding of ecosystem approaches, in order to ensure the long-term conservation and sustainable use of living marine resources, and in this regard encourages the implementation of the Strategy for Improving Information on Status and Trends of Capture Fisheries of the Food and Agriculture Organization of the United Nations as a framework for the improvement and understanding of fishery status and trends;",
    "18": "Calls upon all States, directly or through regional fisheries management organizations and arrangements, to apply stock-specific target and limit precautionary reference points, which, for target reference points, are intended to meet management objectives, as described in annex II to the Agreement and in the Code, to ensure that populations of harvested stocks and, where necessary, associated or dependent species are maintained at or restored to sustainable levels, and to use these reference points for triggering conservation and management action;",
    "19": "Encourages States, directly or through regional fisheries management organizations and arrangements, to establish and implement rebuilding and recovery strategies and plans where a stock is identified as being overfished, which should include time frames and probabilities of recovery aimed at bringing the stock back at least to levels that can produce the maximum sustainable yield, and guided by scientific assessment and subjected to a periodic evaluation of progress;",
    "20": "Also encourages States to apply the precautionary approach and ecosystem approaches in adopting and implementing conservation and management measures addressing, inter alia, by-catch, pollution and overfishing, and protecting habitats of specific concern, taking into account existing guidelines developed by the Food and Agriculture Organization of the United Nations;",
    "21": "Further encourages States to enhance or develop observer programmes, individually or through regional fisheries management organizations or arrangements, in order to improve data collection on, inter alia, target and by-catch species, which could also assist monitoring, control and surveillance tools, and to take into account standards, forms of cooperation and other existing structures for such programmes as described in article 25 of the Agreement and article 5 of the Code;",
    "22": "Calls upon, in this regard, States, individually in line with their national legislation or through regional fisheries management organizations or arrangements, to take steps as appropriate to ensure the safety of observers;",
    "23": " countries, of improving the capacity to collect accurate, complete, reliable and effective data;",
    "24": "Calls upon States and regional fisheries management organizations and arrangements to collect and, where appropriate, report to the Food and Agriculture Organization of the United Nations required catch and effort data, and fishery-related information, in a complete, accurate and timely way, including for straddling fish stocks and highly migratory fish stocks within and beyond areas under national jurisdiction, discrete high seas fish stocks, and by-catch and discards; and, where they do not exist, to establish processes to strengthen data collection and reporting by members of regional fisheries management organizations and arrangements, including through regular reviews of member compliance with such obligations, and, when such obligations are not met, require the member concerned to rectify the problem, including through the preparation of plans of action with timelines;",
    "25": "Invites States and regional fisheries management organizations and arrangements to cooperate with the Food and Agriculture Organization of the United Nations in the implementation and further development of the Fisheries Resources Monitoring System initiative;",
    "26": "Reaffirms paragraph 10 of its resolution 61/105 of 8 December 2006, and calls upon States, including through regional fisheries management organizations or arrangements, to urgently adopt and implement measures to fully implement the International Plan of Action for the Conservation and Management of Sharks for directed and non-directed shark fisheries, based on the best available scientific information, through, inter alia, limits on catch or fishing effort, by requiring that vessels flying their flag collect and regularly report data on shark catches, including species-specific data, discards and landings, undertaking, including through international cooperation, comprehensive stock assessments of sharks, reducing shark by-catch and by-catch mortality and, where scientific information is uncertain or inadequate, not increasing fishing effort in directed shark fisheries and urgently establishing science-based management measures to ensure the long-term conservation, management and sustainable use of shark stocks and to prevent further declines of vulnerable or threatened shark stocks, and encourages the full utilization of dead sharks caught in the context of sustainably managed fisheries;",
    "27": "Calls upon States to take immediate and concerted action to improve the implementation of and compliance with existing regional fisheries management organizations or arrangements and national measures that regulate shark fisheries and incidental catch of sharks, in particular those measures which prohibit or restrict fisheries conducted solely for the purpose of harvesting shark fins and, where necessary, to consider taking other measures, as appropriate, such as requiring that all sharks be landed with each fin naturally attached;",
    "28": "Calls upon regional fisheries management organizations with the competence to regulate highly migratory species to strengthen or establish precautionary, science-based conservation and management measures, as appropriate, for sharks taken in fisheries within their convention areas consistent with the International Plan of Action for the Conservation and Management of Sharks;",
    "29": "",
    "30": "Encourages States, as appropriate, to cooperate in establishing non-detriment findings for shared stocks of marine species listed in appendices I and II to the Convention on International Trade in Endangered Species of Wild Fauna and Flora, consistent with the concepts and non-binding guiding principles contained in resolution Conf. 16.7 on non-detriment findings, adopted by the Conference of the Parties to the Convention on International Trade in Endangered Species of Wild Fauna and Flora;",
    "31": "Urges States to eliminate barriers to trade in fish and fisheries products which are not consistent with their rights and obligations under the World Trade Organization agreements, taking into account the importance of the trade in fish and fisheries products, particularly for developing countries;",
    "32": "Recalls that, in \u201cThe future we want\u201d, States committed themselves to observing the need to ensure access to fisheries and the importance of access to markets by subsistence, small-scale and artisanal fisherfolk and women fish workers, as well as indigenous peoples and their communities, particularly in developing countries, especially small island developing States;",
    "33": "Notes that the Committee on Fisheries encouraged the Food and Agriculture Organization of the United Nations to provide capacity development and technical support to small-scale fisheries, including by addressing socioeconomics, gender dimensions, and post-harvest and data-collection challenges in the sector;",
    "34": "Urges States and relevant international and national organizations to provide for the participation of small-scale fishery stakeholders in related policy development and fisheries management strategies in order to achieve long-term sustainability for such fisheries, consistent with the duty to ensure the proper conservation and management of fisheries resources, and encourages States to consider promoting, as appropriate, participatory management schemes for small- scale fisheries in accordance with national laws, regulations and practices, as well as the Voluntary Guidelines for Securing Sustainable Small-scale Fisheries in the Context of Food Security and Poverty Eradication of the Food and Agriculture Organization of the United Nations;",
    "35": "Welcomes action taken by the Food and Agriculture Organization of the United Nations and a number of regional organizations to support the implementation of the Voluntary Guidelines for Securing Sustainable Small-scale Fisheries in the Context of Food Security and Poverty Eradication through regional plans of action, dedicated working groups and other initiatives;",
    "36": "Encourages States, either directly or through competent and appropriate subregional, regional or global organizations and arrangements, to analyse, as appropriate, the impact of fishing for marine species corresponding to low trophic levels;",
    "37": "Welcomes, in this regard, the initiation of further studies by the Food and Agriculture Organization of the United Nations of the impact of industrial fishing activities on species corresponding to low trophic levels;",
    "38": "Invites the Food and Agriculture Organization of the United Nations to assess and consider the potential risk and effects of genetically engineered fish species on the health and sustainability of wild fish stocks and on the biodiversity of the aquatic environment and to provide guidance, consistent with the Code, on managing risk and minimizing harmful impacts in this regard;",
    "39": " develop and strengthen capacity to prevent, minimize and mitigate the adverse impacts of invasive alien species on biodiversity, including fish stocks;",
    "40": "Calls upon States to consider the potential environmental and socioeconomic impacts of anthropogenic underwater noise from different activities in the marine environment and to address and mitigate such impacts, taking into account the best available scientific information, the precautionary approach and ecosystem approaches, as appropriate; II Implementation of the 1995 Agreement for the Implementation of the Provisions of the United Nations Convention on the Law of the Sea of 10 December 1982 relating to the Conservation and Management of Straddling Fish Stocks and Highly Migratory Fish Stocks",
    "41": "Welcomes the most recent accession to the Agreement, and calls upon all States, and entities referred to in the Convention and in article 1, paragraph 2 (b), of the Agreement, that have not done so to ratify or accede to the Agreement and in the interim to consider applying it provisionally;",
    "42": "Calls upon States parties to the Agreement to effectively implement, as a matter of priority, the provisions of the Agreement through their national legislation and through regional fisheries management organizations and arrangements in which they participate;",
    "43": "Emphasizes the importance of those provisions of the Agreement relating to bilateral, subregional and regional cooperation in enforcement, and urges continued efforts in this regard;",
    "44": "Urges States parties to the Agreement, in accordance with article 21, paragraph 4, thereof, to inform, either directly or through the relevant subregional or regional fisheries management organization or arrangement, all States whose vessels fish on the high seas in the same subregion or region of the form of identification issued by those States parties to officials duly authorized to carry out boarding and inspection functions in accordance with articles 21 and 22 of the Agreement;",
    "45": "Also urges States parties to the Agreement, in accordance with article 21, paragraph 4, thereof, to designate an appropriate authority to receive notifications pursuant to article 21 and to give due publicity to such designation through the relevant subregional or regional fisheries management organization or arrangement;",
    "46": "Invites regional fisheries management organizations and arrangements which have not yet done so to adopt procedures for high seas boarding and inspection that are consistent with articles 21 and 22 of the Agreement, including, inter alia, those to ensure the safety of the crew and the inspectors;",
    "47": "Calls upon States, individually and, as appropriate, through subregional and regional fisheries management organizations and arrangements with competence over discrete high seas fish stocks, to adopt the measures necessary to ensure the long- term conservation, management and sustainable use of such stocks in accordance with the Convention and consistent with the Code and the general principles set forth in the Agreement;",
    "48": "",
    "49": "Urges States parties to the Agreement, directly or through regional fisheries management organizations and arrangements, to take into account the special requirements of developing States, including small island developing States as highlighted in the SIDS Accelerated Modalities of Action (SAMOA) Pathway, in giving effect to the duty to cooperate in the establishment of conservation and management measures for straddling fish stocks and highly migratory fish stocks, including the need to ensure, where appropriate, in accordance with article 24, paragraph 2 (c), of the Agreement, that such measures do not transfer a disproportionate burden of conservation action onto developing States, and notes in this regard ongoing efforts to better develop a common understanding of this concept;",
    "50": "Calls upon States and international financial institutions and organizations of the United Nations system to provide assistance according to Part VII of the Agreement, including, if appropriate, the development of special financial mechanisms or instruments to assist developing States, in particular the least developed among them and small island developing States, to enable them to develop their national capacity to exploit fisheries resources, including developing their domestically flagged fishing fleet, value-added processing and the expansion of their economic base in the fishing industry, consistent with the duty to ensure the proper conservation and management of fisheries resources;",
    "51": "Urges States, intergovernmental organizations, international financial institutions, national institutions and non-governmental organizations, as well as natural and juridical persons, to make voluntary financial contributions to the Assistance Fund established under Part VII of the Agreement;",
    "52": "Welcomes the adoption on 3 May 2019 of the revised terms of reference of the Assistance Fund established under Part VII of the Agreement at the fourteenth round of informal consultations of States parties to the Agreement;",
    "53": "Encourages the Food and Agriculture Organization of the United Nations and the Division for Ocean Affairs and the Law of the Sea of the Office of Legal Affairs of the Secretariat (the Division) to continue their efforts to publicize the availability of assistance through the Assistance Fund;",
    "54": "Encourages accelerated progress by States, individually and, as appropriate, through subregional and regional fisheries management organizations and arrangements, regarding the recommendations of the Review Conference on the Agreement, held in New York from 22 to 26 May 2006,19 and the identification of emerging priorities;",
    "55": "Encourages States, individually and, as appropriate, through subregional and regional fisheries management organizations and arrangements, to consider implementing, as appropriate, the recommendations of the resumed Review Conference held in New York from 24 to 28 May 201020 and from 23 to 27 May 2016;21",
    "56": "Acknowledges, in particular, the commitments made at the resumed Review Conference held in 2016 to the continued implementation of the Agreement through the application of the precautionary approach and ecosystem approaches to fisheries management, the urgent improvement of the status of straddling fish stocks and highly migratory fish stocks, strengthened interaction of the science-policy interface and the strong emphasis on collaboration, at all levels, for improved global fisheries outcomes;",
    "57": "Recalls that the resumed Review Conference agreed to keep the Agreement under review through the resumption of the Review Conference at a date not earlier than 2020, notes the agreement at the fourteenth round of informal consultations of States parties to the Agreement that the Review Conference should be resumed in 2021, and takes note of the decision of States parties to the Agreement, through a consultation by correspondence conducted by the Chair of the fifteenth round of informal consultations of States parties to the Agreement, to postpone the resumption of the Review Conference on the Agreement to 2022, to invite the General Assembly to take note of the decision and to take any appropriate subsequent steps;",
    "58": "Requests, in this regard, the Secretary-General to resume the Review Conference, convened pursuant to article 36 of the Agreement, in New York for one week in the first part of 2022, with a view to assessing the effectiveness of the Agreement in securing the conservation and management of straddling fish stocks and highly migratory fish stocks, and to render the necessary assistance and provide such services as may be required for the resumption of the Review Conference;",
    "59": "Encourages wide participation in the resumed Review Conference, in accordance with article 36 of the Agreement;",
    "60": "Recalls its request, in paragraph 60 of resolution 74/18, that the Secretary- General submit to the resumed Review Conference an updated report, prepared in cooperation with the Food and Agriculture Organization of the United Nations and with the assistance of an expert consultant to be hired by the Division to provide information and analysis on relevant technical and scientific issues to be covered in the report, to assist the Review Conference in discharging its mandate under article 36, paragraph 2, of the Agreement, and in this regard also reiterates its request to the Secretary-General to develop and circulate to States and to regional fisheries management organizations and arrangements in a timely manner a voluntary questionnaire regarding the recommendations made by the Review Conference in 2016, taking into account the specific guidance to be proposed at the fifteenth round of informal consultations of States parties to the Agreement in 2021;",
    "61": "Recalls paragraph 6 of resolution 56/13 of 28 November 2001 and the recommendation of the resumed Review Conference in 2016 that the informal consultations of States parties to the Agreement be dedicated, on an annual basis, to the consideration of specific issues arising from the implementation of the Agreement, with a view to improving understanding, sharing experiences and identifying best practices for the consideration of States parties, as well as the General Assembly and the Review Conference;",
    "62": "Takes note of the report of the fourteenth round of informal consultations of States parties to the Agreement, focusing on the topic \u201cPerformance reviews of regional fisheries management organizations and arrangements\u201d; 22",
    "63": "Requests the Secretary-General to convene the fifteenth round of informal consultations of States parties to the Agreement, if conditions allow, for three days in the second half of 2021: two days to focus on the topic \u201cImplementation of an ecosystem approach to fisheries management\u201d and one day to serve as a preparatory meeting for the resumed Review Conference;",
    "64": "Encourages greater participation, including by competent international organizations, at the forthcoming fifteenth round of informal consultations of States parties to the Agreement;",
    "65": "Requests the Secretary-General to invite States parties to the Agreement and, as observers, States and entities referred to in the Convention and in article 1, paragraph 2 (b), of the Agreement not parties to the Agreement, the Food and Agriculture Organization of the United Nations and other relevant organizations, bodies, funds and programmes within the United Nations system, the secretariats of relevant organizations and conventions and other relevant intergovernmental organizations and bodies, in particular subregional and regional fisheries management organizations and arrangements and related regional intergovernmental marine science organizations, and relevant non-governmental organizations, in accordance with past practice, to attend the fifteenth round of informal consultations of States parties to the Agreement, while relevant scientific institutions may request an invitation to participate in the consultations as observers;",
    "66": "Recalls its request, in resolution 74/18, for the Secretary-General to invite States parties to the Agreement, as well as States and entities referred to in the Convention and in article 1, paragraph 2 (b), of the Agreement not parties to the Agreement and others invited to participate in the consultations as observers pursuant to paragraph 66 of the present resolution, to submit their views on the topic \u201cImplementation of an ecosystem approach to fisheries management\u201d, together with a translation into English, to the Division, and requests the Division to post such views, unedited and in the languages in which they are received, on its website, in accordance with past practice;",
    "67": "Invites the chairperson of the informal consultations of States parties to the Agreement to circulate widely, through the Secretariat, an informal summary of the discussions at the fifteenth round;",
    "68": "Reaffirms its request that the Food and Agriculture Organization of the United Nations initiate arrangements with States for the collection and dissemination of data on fishing on the high seas by vessels flying their flag at the subregional and regional levels where no such arrangements exist;",
    "69": "Also reaffirms its request that the Food and Agriculture Organization of the United Nations revise its global fisheries statistics database to provide information on straddling fish stocks, highly migratory fish stocks and discrete high seas fish stocks on the basis of where the catch is taken;",
    "70": "Notes that the Committee on Fisheries, at its thirty-third session, emphasized, in the context of the 2030 Agenda for Sustainable Development, the need to ensure comparability and consistency of reporting indicators at global, regional and national levels, while minimizing the burden on its members;",
    "71": "Recognizes that the Review Conference is the competent intergovernmental forum for assessing the effectiveness of the Agreement by reviewing its implementation; III Related fisheries instruments",
    "72": "Emphasizes the importance of the effective implementation of the provisions of the Compliance Agreement, and urges continued efforts in this regard;",
    "73": "Calls upon all States and other entities referred to in article X, paragraph 1, of the Compliance Agreement that have not yet become parties to that Agreement to do so as a matter of priority and, in the interim, to consider applying it provisionally;",
    "74": "",
    "75": "Urges States to develop and implement, as a matter of priority, national and, as appropriate, regional plans of action to put into effect the international plans of action of the Food and Agriculture Organization of the United Nations;",
    "76": "Encourages States, in this regard, to maintain their commitment in reporting on their implementation of the Code, reiterates the importance of responding to the web-based questionnaire of the Food and Agriculture Organization of the United Nations for monitoring the implementation of the Code and the international plans of action and strategies, and notes that the information collected could also be relevant to the implementation of related targets of the 2030 Agenda for Sustainable Development;",
    "77": "Also encourages States to consider signing, ratifying, accepting, approving or acceding to the Cape Town Agreement of 2012 on the Implementation of the Provisions of the Torremolinos Protocol of 1993 relating to the Torremolinos International Convention for the Safety of Fishing Vessels, 1977;",
    "78": "Welcomes, in this regard, the holding of a Ministerial Conference on Fishing Vessel Safety and Illegal, Unreported and Unregulated Fishing, organized by the International Maritime Organization and the Government of Spain, in Torremolinos, Spain, from 21 to 23 October 2019, to promote the ratification of the Cape Town Agreement, whose entry into force would mandate minimum safety measures for fishing vessels of 24 metres in length and over, and together with the International Convention on Standards of Training, Certification and Watchkeeping for Fishing Vessel Personnel, 1995, would create a more robust International Maritime Organization regulatory framework for the safety of fishing vessels and fishing vessel personnel; IV Illegal, unreported and unregulated fishing",
    "79": "Emphasizes once again its serious concern that illegal, unreported and unregulated fishing remains one of the greatest threats to fish stocks and marine ecosystems and continues to have serious and major implications for the conservation and management of ocean resources, as well as the food security and the economies of many States, particularly developing States, and renews its call upon States to comply fully with all existing obligations and to combat such fishing and urgently to take all steps necessary to implement the International Plan of Action to Prevent, Deter and Eliminate Illegal, Unreported and Unregulated Fishing;",
    "80": "",
    "81": "Notes with satisfaction the development of an increasing number of national plans of action to prevent, deter and eliminate illegal, unreported and unregulated fishing, and calls upon States that have not yet done so to consider developing such plans;",
    "82": "Urges flag States to strengthen effective jurisdiction and control over vessels flying their flag, and to exercise due diligence, including by developing or amending national rules and regulations, where needed, in order to ensure that such vessels do not engage in illegal, unreported and unregulated fishing, while reaffirming the importance, under international law, including as reflected in the Convention, of the responsibilities of flag States regarding fishing vessels flying their flag, including with respect to safety at sea and labour conditions on fishing vessels;",
    "83": "Urges States to effectively exercise jurisdiction and control over their nationals, including beneficial owners, and vessels flying their flag, in order to prevent and deter them from engaging in illegal, unreported and unregulated fishing activities or supporting vessels engaging in illegal, unreported and unregulated fishing activities, including those vessels listed by regional fisheries management organizations or arrangements as engaged in those activities, and to facilitate mutual assistance to ensure that such actions can be investigated and proper sanctions imposed;",
    "84": "Encourages States that have not yet done so to establish penalties for non-compliance by vessels involved in fishing or fishing-related activities and their nationals, as appropriate, in accordance with applicable national law and consistent with international law, that are adequate in severity for effectively securing compliance, deterring further violations and depriving offenders of the benefits from their illegal, unreported and unregulated fishing activities;",
    "85": "Urges States to take effective measures, at the national, subregional, regional and global levels, to deter the activities, including illegal, unreported and unregulated fishing, of any vessel which undermines conservation and management measures that have been adopted by subregional and regional fisheries management organizations and arrangements in accordance with international law;",
    "86": "Calls upon States not to permit vessels flying their flag to engage in fishing on the high seas or in areas under the national jurisdiction of other States, unless duly authorized by the authorities of the States concerned and in accordance with the conditions set out in the authorization, and to take specific measures, including deterring the reflagging of vessels by their nationals, in accordance with the relevant provisions of the Convention, the Agreement and the Compliance Agreement, to control fishing operations by vessels flying their flag;",
    "87": "Urges States, individually and collectively through regional fisheries management organizations and arrangements, to develop appropriate processes to assess the performance of States with respect to implementing the obligations regarding fishing vessels flying their flag set out in relevant international instruments;",
    "88": "Reaffirms the need to strengthen, where necessary, the international legal framework for intergovernmental cooperation, in particular at the subregional and regional levels, in the management of fish stocks and in combating illegal, unreported and unregulated fishing, in a manner consistent with international law, and for States and entities referred to in the Convention and in article 1, paragraph 2 (b), of the Agreement to collaborate in efforts to address these types of fishing activities;",
    "89": " the illegal, unreported and unregulated vessel lists established by each organization or arrangement;",
    "90": "Reaffirms its call upon States to take all necessary measures consistent with international law, without prejudice to a State\u2019s sovereignty over ports in its territory and to reasons of force majeure or distress, including the prohibition of vessels from accessing their ports followed by a report to the flag State concerned, when there is clear evidence that they are or have been engaged in or have supported illegal, unreported and unregulated fishing, or when they refuse to give information either on the origin of the catch or on the authorization under which the catch has been made;",
    "91": "Reaffirms paragraph 53 of its resolution 64/72 of 4 December 2009 with regard to eliminating illegal, unreported and unregulated fishing by vessels flying \u201cflags of convenience\u201d and requiring that a \u201cgenuine link\u201d be established between States and fishing vessels flying their flags, and urges States operating open registry to effectively control all fishing vessels flying their flag, as required by international law, or otherwise stop open registry for fishing vessels;",
    "92": "Notes the challenges posed by vessels determined under international law to be without nationality that are fishing, including conducting fishing-related activities, on the high seas and that such vessels operate without governance and oversight, undermine relevant legal frameworks and are engaging in illegal, unreported and unregulated fishing activities as defined in the International Plan of Action to Prevent, Deter and Eliminate Illegal, Unreported and Unregulated Fishing of the Food and Agriculture Organization of the United Nations, and encourages States to take necessary measures where appropriate, consistent with international law, in order to prevent and deter vessels without nationality from engaging in or supporting illegal, unreported and unregulated fishing, such as enacting domestic legislation, including on enforcement, sharing information and prohibiting the landing and preventing trans-shipment, at sea or in port, of fish and fish products by such vessels;",
    "93": "Encourages States, either directly or through competent and appropriate subregional, regional or global organizations and arrangements, to consider adopting rules, consistent with international law, to ensure that chartering arrangements and practices related to fishing vessels enable compliance with and enforcement of relevant conservation and management measures, so as not to undermine efforts to combat illegal, unreported and unregulated fishing;",
    "94": "Recognizes the need for enhanced port State measures to combat illegal, unreported and unregulated fishing, and urges States to cooperate, in particular at the regional level and through subregional and regional fisheries management organizations and arrangements, to adopt all necessary port measures, consistent with international law taking into account article 23 of the Agreement, and to further promote the development and application of standards at the regional level;",
    "95": "Welcomes the recent ratifications of and accessions to the Agreement on Port State Measures to Prevent, Deter and Eliminate Illegal, Unreported and Unregulated Fishing, and encourages States and regional economic integration organizations that have not yet done so to consider ratifying, accepting, approving or acceding to that Agreement, noting the importance of major port States becoming parties at their earliest convenience;",
    "96": " which, inter alia, considered the status of that Agreement and developments in its implementation;",
    "97": "Notes that, in accordance with article 24 of the Agreement on Port State Measures to Prevent, Deter and Eliminate Illegal, Unreported and Unregulated Fishing, the first review and assessment of the effectiveness of that Agreement in achieving its objective will take place in the context of the third meeting of the parties, to be hosted by the European Union in Brussels from 30 November to 4 December 2020, and encourages the parties to support the review process, including by responding to the questionnaire that will be circulated by the Food and Agriculture Organization of the United Nations for this purpose in June 2020;",
    "98": "Also notes the ongoing capacity development programme of the Food and Agriculture Organization of the United Nations aimed at facilitating and supporting the implementation of the Agreement on Port State Measures to Prevent, Deter and Eliminate Illegal, Unreported and Unregulated Fishing and related instruments, which contributes to the development of national capacity of both parties and non-parties, including the strengthening of the institutional, operational and enforcement capacity of developing States with a view to maximizing the benefits of its implementation, and further notes the contribution of regional workshops to this end;",
    "99": "Recognizes the ongoing collaboration between the Food and Agriculture Organization of the United Nations and the International Maritime Organization, as well as the International Labour Organization, through the Joint Ad Hoc Working Group of the Food and Agriculture Organization of the United Nations, the International Maritime Organization and the International Labour Organization on Illegal, Unreported and Unregulated Fishing and Related Matters with regard to, inter alia, illegal, unreported and unregulated fishing, maritime safety and decent labour conditions in the fisheries sector, as reflected in the outcomes of the fourth session of the Ad Hoc Working Group, held in Torremolinos from 23 to 25 October 2019, and encourages the Food and Agriculture Organization of the United Nations, the International Labour Organization and the International Maritime Organization to strengthen this collaboration and update its terms of reference;",
    "100": "Encourages States, with respect to vessels flying their flag, and port States, to make every effort to share data on landings and catch quotas, and in this regard encourages regional fisheries management organizations and arrangements to consider developing open databases containing such data for the purpose of enhancing the effectiveness of fisheries management;",
    "101": "Takes note that the Committee on Fisheries, at its thirty-third session, expressed support for the work of the Food and Agriculture Organization of the United Nations in continuing to develop technical guidelines for the estimation of the magnitude and geographic extent of illegal, unreported and unregulated fishing, noting the value of these guidelines for the production of consistent and reliable estimates, determining national, regional, global trends, and measuring the impact of illegal, unreported and unregulated fishing;",
    "102": "Calls upon States to take all measures necessary to ensure that vessels flying their flag do not engage in the trans-shipment of fish caught by fishing vessels engaged in illegal, unreported and unregulated fishing, through adequate regulation, monitoring and control of trans-shipment of fish at sea, including through additional national measures applicable to vessels flying their flag to prevent such trans-shipment;",
    "103": " rights and obligations established in World Trade Organization agreements, as called for in the International Plan of Action to Prevent, Deter and Eliminate Illegal, Unreported and Unregulated Fishing;",
    "104": "Encourages work to increase awareness of the Voluntary Guidelines for Catch Documentation Schemes,23 and encourages States and relevant stakeholders to implement these Guidelines when developing catch documentation schemes and to use them as a reference in related activities, with special attention to the prevention, deterrence and elimination of illegal, unreported and unregulated fishing;",
    "105": "Also encourages information-sharing regarding emerging market- and trade-related measures by States and other relevant actors with appropriate international forums, given the potential implications of these measures for all States, consistent with the established plan of work of the Committee on Fisheries, and taking into account the Technical Guidelines for Responsible Fish Trade of the Food and Agriculture Organization of the United Nations;",
    "106": "Acknowledges the development of participatory surveillance activities at sea involving fishing communities in West Africa as a cost-effective way of detecting illegal, unreported and unregulated fishing;",
    "107": "Notes the concern expressed by the Committee on Fisheries at the proliferation of private standards and ecolabelling schemes potentially leading to the creation of trade barriers and restrictions, and also notes the work by the Food and Agriculture Organization of the United Nations to develop an evaluation framework to assess the conformity of public and private ecolabelling schemes through the Guidelines for the Ecolabelling of Fish and Fishery Products from Marine Capture Fisheries;",
    "108": "Also notes the concerns about possible connections between transnational organized crime and illegal fishing in certain regions of the world, and encourages States, including through the appropriate international forums and organizations, to study the causes and methods of and contributing factors to illegal fishing to increase knowledge and understanding of those possible connections, and to make the findings publicly available, and in this regard takes note of the study issued by the United Nations Office on Drugs and Crime on transnational organized crime in the fishing industry, bearing in mind the distinct legal regimes and remedies under international law applicable to illegal fishing and transnational organized crime; V Monitoring, control and surveillance and compliance and enforcement",
    "109": "Calls upon States, in accordance with international law, to strengthen the implementation of or, where they do not exist, adopt comprehensive monitoring, control and surveillance measures and compliance and enforcement schemes individually and within those regional fisheries management organizations or arrangements in which they participate, in order to provide an appropriate framework for promoting compliance with agreed conservation and management measures, and further urges enhanced coordination among all relevant States and regional fisheries management organizations and arrangements in these efforts;",
    "110": "Welcomes the fact that the Committee on Fisheries has urged its members to start implementing the Voluntary Guidelines for Flag State Performance 24 as soon as possible, and urges all flag States to implement those Guidelines as soon as possible, including, as a first step, by carrying out a voluntary assessment;",
    "111": "Encourages further work by competent international organizations, including subregional and regional fisheries management organizations and arrangements, to develop guidelines on flag State control of fishing vessels;",
    "112": "Urges States, individually and through relevant regional fisheries management organizations and arrangements, to establish mandatory vessel monitoring, control and surveillance systems, in particular to require that vessel monitoring systems be carried by all vessels fishing on the high seas as soon as practicable, recalling that, in paragraph 62 of resolution 63/112 of 5 December 2008, it urged that large-scale fishing vessels be required to carry vessel monitoring systems no later than December 2008, and to share information on fisheries enforcement matters;",
    "113": "Calls upon States, individually and through regional fisheries management organizations or arrangements, to strengthen or establish, consistent with national and international law, positive or negative lists of vessels fishing within the areas covered by relevant regional fisheries management organizations and arrangements in order to promote compliance with conservation and management measures and to identify products from illegal, unreported and unregulated catches, and encourages improved coordination among all States and regional fisheries management organizations and arrangements in sharing and using this information, taking into account the forms of cooperation with developing States as set out in article 25 of the Agreement;",
    "114": "Encourages the Food and Agriculture Organization of the United Nations, in cooperation with States, regional economic integration organizations, the International Maritime Organization and, as appropriate, regional fisheries management organizations and arrangements, to expedite efforts to develop and manage a comprehensive global record of fishing vessels, refrigerated transport vessels and supply vessels, including with a unique vessel identifier system, using, as a first step, the International Maritime Organization Ship Identification Number Scheme for fishing vessels of 100 gross tonnage and above, adopted by the Assembly of the International Maritime Organization in its resolution A.1078(28) of 4 December 2013;",
    "115": "Welcomes the continued development of the Global Record of Fishing Vessels, Refrigerated Transport Vessels and Supply Vessels by the Food and Agriculture Organization of the United Nations, including its efforts to keep it cost- effective, and encourages States, including through regional fisheries management organizations and arrangements, to provide the necessary data and regular updates to the Global Record;",
    "116": "Encourages, in this regard, States to use all available vessel data, including from the Global Integrated Shipping Information System platform, when providing their vessel data to the Global Record;",
    "117": "",
    "118": "Requests States and relevant international bodies to develop, in accordance with international law, more effective measures to trace fish and fishery products to enable importing States to identify fish or fishery products caught in a manner that undermines international conservation and management measures agreed in accordance with international law, taking into account the special requirements of developing States and the forms of cooperation with developing States as set out in article 25 of the Agreement, and at the same time to recognize the importance of market access, in accordance with provisions 11.2.4, 11.2.5 and 11.2.6 of the Code, for fish and fishery products caught in a manner that is in conformity with such international measures;",
    "119": "Requests States to take the necessary measures, consistent with international law, to help to prevent fish and fishery products caught in a manner that undermines applicable conservation and management measures adopted in accordance with international law from entering international trade;",
    "120": "Encourages States to establish and undertake cooperative surveillance and enforcement activities in accordance with international law to strengthen and enhance efforts to ensure compliance with conservation and management measures, and prevent and deter illegal, unreported and unregulated fishing;",
    "121": "Urges States, directly and through regional fisheries management organizations or arrangements, to develop and adopt effective monitoring, control and surveillance measures for trans-shipment, as appropriate, in particular at-sea trans-shipment, including on the high seas, in order to, inter alia, monitor compliance, to collect and verify fisheries data, and to prevent, deter and eliminate illegal, unreported and unregulated fishing activities, in accordance with international law and, in parallel, to encourage and support the Food and Agriculture Organization of the United Nations in studying the current practices of trans-shipment and produce a set of guidelines for this purpose;",
    "122": "Takes note, in this regard, that the Committee on Fisheries, at its thirty- third session, welcomed the Global Study on Trans-shipment by the Food and Agriculture Organization of the United Nations, and called for in-depth studies to support the development of guidelines on best practices for regulating, monitoring and controlling trans-shipment;",
    "123": "Expresses its appreciation for financial contributions from States to improve the capacity of the existing voluntary International Monitoring, Control and Surveillance Network for Fisheries-related Activities, and encourages States to join and actively participate in the Network and to consider supporting, when appropriate, its transformation in accordance with international law into an international unit with dedicated resources to further assist Network members, taking into account the forms of cooperation with developing States as set out in article 25 of the Agreement; VI Fishing overcapacity",
    "124": " and paragraph 10 of the International Plan of Action for the Management of Fishing Capacity of the Food and Agriculture Organization of the United Nations;",
    "125": "Calls upon, in this regard, States, individually or through regional fisheries management organizations and arrangements, to develop and implement a range of measures to adjust fishing intensity, including fishing capacity where relevant, to levels commensurate with the sustainability of fish stocks, and including capacity assessment and capacity management plans providing incentives for voluntary reduction, which take into account all aspects that contribute to fishing capacity, considering, inter alia, engine power, fishing gear technology, fish detection technology and storage space, and also to improve transparency on fishing capacity, including by identifying, sharing and publicizing relevant information in this regard, subject to confidentiality requirements;",
    "126": "Reiterates its call upon States, individually and through regional fisheries management organizations and arrangements, to ensure that the urgent actions required in the International Plan of Action for the Management of Fishing Capacity are undertaken expeditiously and that its implementation is facilitated without delay;",
    "127": "Invites the Food and Agriculture Organization of the United Nations to report on the state of progress in the implementation of the International Plan of Action for the Management of Fishing Capacity, as provided for in paragraph 48 of the Plan of Action;",
    "128": "Calls upon States, individually and, as appropriate, through subregional and regional fisheries management organizations and arrangements with competence to regulate highly migratory species, urgently to address global fishing capacity for tunas, inter alia, in a way that recognizes the legitimate rights of developing States, in particular small island developing States, to participate in and benefit from such fisheries, taking into account the recommendations of the 2010 Joint Tuna Regional Fisheries Management Organizations International Workshop on RFMO Management of Tuna Fisheries, held in Brisbane, Australia, and the recommendations of the 2011 third joint meeting of tuna regional fisheries management organizations and arrangements;",
    "129": "Encourages those States which are cooperating to establish subregional and regional fisheries management organizations and arrangements, taking into account the best scientific information available as well as ecosystem approaches and the precautionary approach, to exercise voluntary restraint of fishing effort levels in those areas that will come under the regulation of the future organizations and arrangements until adequate regional conservation and management measures are adopted and implemented, taking into account the need to ensure the long-term conservation, management and sustainable use of the relevant fish stocks and to prevent significant adverse impacts on vulnerable marine ecosystems;",
    "130": "Recalls that, in \u201cThe future we want\u201d, States reaffirmed their commitment in the Johannesburg Plan of Implementation to eliminate subsidies that contribute to illegal, unreported and unregulated fishing and overcapacity, taking into account the importance of that sector to developing countries, reiterated their commitment to conclude multilateral disciplines on fisheries subsidies that would give effect to the mandates of the World Trade Organization Doha Development Agenda25 and the Hong Kong Ministerial Declaration to strengthen disciplines on subsidies in the fisheries sector, including through the prohibition of certain forms of fisheries subsidies that contribute to overcapacity and overfishing, recognizing that appropriate and effective special and differential treatment for developing and least developed countries should be an integral part of World Trade Organization fisheries subsidies negotiation, taking into account the importance of the sector to development priorities, poverty reduction and livelihood and food security concerns, and encouraged one another to further improve the transparency and reporting of existing fisheries subsidies programmes through the World Trade Organization and, given the state of fisheries resources, and without prejudicing the Doha and Hong Kong ministerial mandates on fisheries subsidies or the need to conclude those negotiations, to eliminate subsidies that contribute to overcapacity and overfishing and to refrain from introducing new such subsidies or from extending or enhancing existing ones;",
    "131": "Urges States to eliminate fisheries subsidies that contribute to overfishing and overcapacity and to illegal, unreported and unregulated fishing, including through accelerating work to complete negotiations on fisheries subsidies at the World Trade Organization, recognizing that appropriate and effective special and differential treatment for developing and least developed countries should be an integral part of the World Trade Organization negotiations on fisheries subsidies; VII Large-scale pelagic drift-net fishing",
    "132": "Expresses concern that, despite the adoption of General Assembly resolution 46/215, the practice of large-scale pelagic drift-net fishing still exists and remains a threat to living marine resources;",
    "133": "Urges States, individually and through regional fisheries management organizations and arrangements, to adopt effective measures, or strengthen existing measures, to implement and enforce the provisions of resolution 46/215 and subsequent resolutions on large-scale pelagic drift-net fishing in order to eliminate the use of large-scale pelagic drift nets in all seas and oceans, which means that efforts to implement resolution 46/215 should not result in the transfer to other parts of the world of drift nets that contravene the resolution;",
    "134": "Also urges States, individually and through regional fisheries management organizations and arrangements, to adopt effective measures, or strengthen existing measures, to implement and enforce the present global moratorium on the use of large- scale pelagic drift nets on the high seas, and calls upon States to ensure that vessels flying their flag that are duly authorized to use large-scale drift nets in waters under their national jurisdiction do not use such gear for fishing while on the high seas; VIII Fisheries by-catch and discards",
    "135": "",
    "136": "Encourages, in this regard, States, individually or through regional fisheries management organizations and arrangements, as appropriate, to ensure proper implementation and enforcement of the measures that they have taken with regard to by-catch and discards;",
    "137": "Welcomes the commitment of States in \u201cThe future we want\u201d to enhance action to manage by-catch, discards and other adverse ecosystem impacts from fisheries, including by eliminating destructive fishing practices, consistent with international law, the applicable international instruments and relevant General Assembly resolutions and guidelines of the Food and Agriculture Organization of the United Nations;",
    "138": "Calls upon States, either individually, collectively or through regional fisheries management organizations and arrangements, to further study, develop and adopt effective management measures, taking into account the best available scientific information on fishing methods, including fish aggregating devices, to minimize by-catch;",
    "139": "Also calls upon States, either individually, collectively or through regional fisheries management organizations and arrangements, to collect the necessary data in order to evaluate and closely monitor the use of large-scale fish aggregating devices and other devices, as appropriate, and their effects on tuna resources and tuna behaviour and associated and dependent species, to improve management procedures to monitor the number, type and use of such devices and to mitigate possible negative effects on the ecosystem, including on juveniles and the incidental by-catch of non-target species, particularly sharks and turtles, notes in this regard the measures adopted by different regional fisheries management organizations and arrangements, and encourages regional fisheries management organizations and arrangements to continue to work on data collection, evaluation and monitoring of such devices;",
    "140": "Notes, in this regard, that some regional fisheries management organizations, including the Inter-American Tropical Tuna Commission, the International Commission for the Conservation of Atlantic Tunas, the Indian Ocean Tuna Commission and the Western and Central Pacific Fisheries Commission, have established their own working groups to assess the use and impact of large-scale fish aggregating devices;",
    "141": "Encourages States, individually or through regional fisheries management organizations and arrangements, to promote, as appropriate, the use of environmentally friendly fish aggregating devices, while ensuring compliance with measures that they have taken relating to such devices;",
    "142": "Urgently calls upon States, subregional and regional fisheries management organizations and arrangements and, where appropriate, other relevant international organizations to develop and implement effective management measures to reduce the incidence of catch and discards of non-target species, including the utilization of selective fishing gear, where appropriate, and to take appropriate measures to minimize waste, and welcomes in this regard the support of the Committee on Fisheries for the development of a technical guideline of the Food and Agriculture Organization of the United Nations addressing the causes of and remedies to food losses and waste;",
    "143": " technologies, such as electronic monitoring, and to provide assistance to developing States to meet data-collection and reporting obligations;",
    "144": "Requests States and regional fisheries management organizations and arrangements, as appropriate, to strengthen or establish data-collection programmes to obtain reliable species-specific estimates of shark, marine turtle, fin-fish, marine mammal and seabird by-catch, and to promote further research on selective fishing gear and practices and on the use of appropriate by-catch mitigation measures;",
    "145": "Encourages States and regional fisheries management organizations and arrangements to coordinate in the development and implementation of clear and standardized by-catch data-collection and reporting protocols for non-target species, in particular endangered, threatened and protected species, taking into account best- practice advice from appropriate international organizations and arrangements, including the Food and Agriculture Organization of the United Nations and the Agreement on the Conservation of Albatrosses and Petrels;26",
    "146": "Encourages States and entities referred to in the Convention and in article 1, paragraph 2 (b), of the Agreement to give due consideration to participation, as appropriate, in subregional and regional instruments and organizations with mandates to conserve non-target species taken incidentally in fishing operations;",
    "147": "Encourages States to strengthen, if necessary, the capacity of those subregional and regional fisheries management organizations and arrangements in which they participate to ensure the adequate conservation of non-target species taken incidentally in fishing operations, taking into consideration best practices for non-target species management, and to expedite their ongoing efforts in this regard;",
    "148": "Requests States and regional fisheries management organizations and arrangements urgently to implement, as appropriate, the measures recommended in the 2004 Guidelines to Reduce Sea Turtle Mortality in Fishing Operations and the International Plan of Action for Reducing Incidental Catch of Seabirds in Longline Fisheries of the Food and Agriculture Organization of the United Nations in order to prevent the decline of sea turtles and seabird populations by minimizing by-catch and increasing post-release survival in their fisheries, including through research and development of gear and bait alternatives, promoting the use of available by-catch mitigation technology, and establishing and strengthening data-collection programmes to obtain standardized information to develop reliable estimates of the by-catch of these species;",
    "149": "Urges States, individually or through regional fisheries management organizations and arrangements, to implement the International Guidelines on Bycatch Management and Reduction of Discards of the Food and Agriculture Organization of the United Nations;27",
    "150": "Requests States and regional fisheries management organizations and arrangements to continue to take urgent action to reduce the by-catch of seabirds, including albatrosses and petrels, in fisheries by adopting and implementing conservation measures consistent with the 2009 best practices technical guidelines of the Food and Agriculture Organization of the United Nations to support the implementation of the International Plan of Action for Reducing Incidental Catch of Seabirds in Longline Fisheries and taking into account the work of the Agreement on the Conservation of Albatrosses and Petrels and of organizations such as the Commission for the Conservation of Antarctic Marine Living Resources; IX Subregional and regional cooperation",
    "151": "Urges coastal States and States fishing on the high seas, in accordance with the Convention, the Agreement and other relevant instruments, to pursue cooperation in relation to straddling fish stocks and highly migratory fish stocks, either directly or through appropriate subregional or regional fisheries management organizations or arrangements, to ensure the effective conservation and management of such stocks;",
    "152": "Urges States fishing for straddling fish stocks and highly migratory fish stocks on the high seas, and relevant coastal States, where a subregional or regional fisheries management organization or arrangement has the competence to establish conservation and management measures for such stocks, to give effect to their duty to cooperate by becoming members of such an organization or participants in such an arrangement, or by agreeing to apply the conservation and management measures established by such an organization or arrangement, or to otherwise ensure that no vessel flying their flag is authorized to access the fisheries resources to which regional fisheries management organizations and arrangements or conservation and management measures established by such organizations or arrangements apply;",
    "153": "Invites, in this regard, subregional and regional fisheries management organizations and arrangements to ensure that all States having a real interest in the fisheries concerned may become members of such organizations or participants in such arrangements, in accordance with the Convention, the Agreement and the Code, provided they have shown their interest in and capacity to comply with the measures adopted by the regional fisheries management organizations and arrangements concerned, including their willingness to effectively exercise flag State control, while recognizing the need to enhance the capacity of developing States in this regard;",
    "154": "Encourages relevant coastal States and States fishing on the high seas for a straddling fish stock or a highly migratory fish stock, where there is no subregional or regional fisheries management organization or arrangement to establish conservation and management measures for such stocks, to cooperate to establish such an organization or enter into another appropriate arrangement to ensure the conservation and management of such stocks, and to participate in the work of the organization or arrangement;",
    "155": "Welcomes the recent ratifications, acceptances and approval of the Agreement to Prevent Unregulated High Seas Fisheries in the Central Arctic Ocean, and encourages further ratifications, acceptances and approvals of that Agreement by States listed in article 9, paragraph 1, thereof, with a view to its early entry into force;",
    "156": "Urges signatory States and other States whose vessels fish within the area of the Convention on the Conservation and Management of Fishery Resources in the South-East Atlantic Ocean28 for fishery resources covered by that Convention to become parties to that Convention as a matter of priority and, in the interim, to ensure that vessels flying their flags fully comply with the measures adopted;",
    "157": "Encourages further ratifications of, accessions to, acceptances and approvals of the Southern Indian Ocean Fisheries Agreement;29",
    "158": "Also encourages further ratifications of, accessions to, acceptances and approvals of the Convention on the Conservation and Management of High Seas Fishery Resources in the South Pacific Ocean;30",
    "159": "Further encourages further accessions to the Convention on the Conservation and Management of High Seas Fisheries Resources in the North Pacific Ocean, and notes the ongoing efforts by the North Pacific Fisheries Commission to develop and implement conservation and management measures and to strengthen cooperation to eliminate illegal, unreported and unregulated fishing within the area of that Convention;",
    "160": "Welcomes the endorsement of the Agreement for the Establishment of the General Fisheries Commission for the Mediterranean, as amended, by the Commission at its thirty-eighth session, held in Rome from 19 to 24 May 2014, and urges those Contracting Parties to the Commission that need to accept the amended Agreement to do so with a view to its early entry into force;",
    "161": "Notes the ongoing efforts of the members of the Indian Ocean Tuna Commission to strengthen the functioning of the Commission so that it can more effectively discharge its mandate, and invites the Food and Agriculture Organization of the United Nations to provide members of the Commission with the necessary assistance to this end;",
    "162": "Encourages signatory States and States having a real interest to become parties to the Convention for the Strengthening of the Inter-American Tropical Tuna Commission Established by the 1949 Convention between the United States of America and the Republic of Costa Rica;",
    "163": "Urges further efforts by regional fisheries management organizations and arrangements, as a matter of priority, in accordance with international law, to strengthen and modernize their mandates and the measures adopted by such organizations or arrangements, and to implement modern approaches to fisheries management, as reflected in the Agreement and other relevant international instruments, relying on the best scientific information available and application of the precautionary approach and incorporating an ecosystem approach to fisheries management and biodiversity considerations, including the conservation and management of ecologically related and dependent species and protection of their habitats, where these aspects are lacking, to ensure that they effectively contribute to the long-term conservation and management and sustainable use of living marine resources, and welcomes those regional fisheries management organizations and arrangements that have taken steps in this direction;",
    "164": "Calls upon regional fisheries management organizations with the competence to conserve and manage highly migratory fish stocks that have not yet adopted effective conservation and management measures in line with the best scientific information available to conserve and manage stocks falling under their mandate to do so urgently;",
    "165": "Urges States to strengthen and enhance cooperation among existing and developing regional fisheries management organizations and arrangements in which they participate, including increased communication and further coordination of measures, such as through the holding of joint consultations, and to strengthen integration, coordination and cooperation by such regional fisheries management organizations and arrangements with other relevant fisheries organizations, regional seas arrangements and other relevant international organizations;",
    "166": "Notes, in this regard, the enhanced cooperation between the OSPAR Commission established by the Convention for the Protection of the Marine Environment of the North-East Atlantic31 and the North-East Atlantic Fisheries Commission;",
    "167": "Urges the five regional fisheries management organizations with competence to manage highly migratory species to continue to take measures to implement the Course of Actions adopted at the second joint meeting of tuna regional fisheries management organizations and arrangements and to consider the recommendations of the third joint meeting of tuna regional fisheries management organizations and arrangements;",
    "168": "Invites States and regional fisheries management organizations and arrangements with competence to manage straddling fish stocks to share experiences and good practices, for example by considering organizing joint meetings, where appropriate;",
    "169": "Invites States and regional fisheries management organizations and arrangements with competence to manage deep-sea fisheries to share experiences and good practices, for example by considering organizing joint meetings, where appropriate;",
    "170": "Urges regional fisheries management organizations and arrangements to improve transparency and to ensure that their decision-making processes are fair and transparent and facilitate the adoption of conservation and management measures in a timely and effective manner, including considering provisions for effective voting and objection procedures, where appropriate, to rely on the best scientific information available, incorporate the precautionary approach and ecosystem approaches, and address participatory rights, including through, inter alia, the development of transparent criteria for allocating fishing opportunities which reflects, where appropriate, the relevant provisions of the Agreement, taking due account, inter alia, of the status of the relevant stocks and the respective interests in the fishery;",
    "171": "Recognizes that performance reviews of regional fisheries management organizations and arrangements have proven to be an effective tool for strengthening the performance of such organizations and arrangements, and are critical to improve the sustainability of fish stocks covered by such organizations and arrangements;",
    "172": "Welcomes the fact that a number of regional fisheries management organizations and arrangements have completed performance reviews, and encourages the implementation, as appropriate, of the recommendations of their respective reviews as a matter of priority;",
    "173": "Urges States, through their participation in regional fisheries management organizations and arrangements that have not done so, to undertake, on an urgent basis, performance reviews of those regional fisheries management organizations and arrangements, initiated either by the organization or arrangement itself or with external partners, including in cooperation with the Food and Agriculture Organization of the United Nations, using transparent criteria based on the provisions of the Agreement and other relevant instruments, and taking into account the best practices of regional fisheries management organizations or arrangements and, as appropriate, any set of criteria developed by States or other regional fisheries management organizations or arrangements, and encourages that such performance reviews include some element of independent evaluation and propose means for improving the functioning of the regional fisheries management organization or arrangement, as appropriate;",
    "174": "",
    "175": "Recalls that, in \u201cThe future we want\u201d, States recognized the need for transparency and accountability in fisheries management by regional fisheries management organizations and the efforts already made by those regional fisheries management organizations that had undertaken independent performance reviews, called upon all regional fisheries management organizations to regularly undertake such reviews and make the results publicly available, encouraged implementation of the recommendations of such reviews and recommended that the comprehensiveness of those reviews be strengthened over time, as necessary;",
    "176": "Urges States to cooperate, taking into account those performance reviews, to develop best-practice guidelines for regional fisheries management organizations and arrangements and to apply, to the extent possible, those guidelines to organizations and arrangements in which they participate;",
    "177": "Encourages States, individually or through regional fisheries management organizations and arrangements, as appropriate, to recognize the importance and role of small-scale, artisanal and subsistence fisheries and to support their long-term environmental, economic and social sustainability;",
    "178": "Encourages the development of regional guidelines for States to use in establishing sanctions for non-compliance by vessels flying their flag and by their nationals, to be applied in accordance with national law, that are adequate in severity for effectively securing compliance, deterring further violations and depriving offenders of the benefits deriving from their illegal activities, as well as in evaluating their systems of sanctions to ensure that they are effective in securing compliance and deterring violations;",
    "179": "Recognizes the importance of ensuring transparency of reporting of fishing activities within regional fisheries management organizations and arrangements in order to facilitate efforts to combat illegal, unreported and unregulated fishing, as well as the importance of respecting the reporting obligations within those organizations and arrangements, notes in this regard the measures adopted by the International Commission for the Conservation of Atlantic Tunas32 and the Indian Ocean Tuna Commission,33 and encourages other regional fisheries management organizations and arrangements to consider establishing similar measures; X Responsible fisheries in the marine ecosystem",
    "180": "Encourages States, individually and through relevant international bodies, to improve the understanding of the causes and impacts of forced labour and human trafficking in the fishing and aquaculture industries, including processing and related industries, and to further consider actions to combat these practices, including raising awareness of the issue;",
    "181": "Highlights the importance of safety at sea and working conditions in the fisheries sector, welcomes in this regard the close cooperation between the Food and Agriculture Organization of the United Nations, the International Labour Organization and the International Maritime Organization, including with regard to their joint work on codes and guidelines in relation to fishing vessel safety, 34 and reiterates the request by the Committee on Fisheries of the Food and Agriculture Organization of the United Nations, at its thirty-third session, that the Food and Agriculture Organization of the United Nations further strengthen international cooperation on occupational health and safety issues in the fisheries and aquaculture sectors and promote decent work for fish workers;",
    "182": "Recalls that the Work in Fishing Convention, 2007 (No. 188) and the Protocol of 2014 to the Forced Labour Convention, 1930 (No. 29) are relevant instruments that ensure decent working conditions in fisheries and other maritime sectors, calls upon flag States to effectively implement their duty under the Convention with respect to labour conditions, taking into account applicable international instruments and national laws, and in this regard encourages States that have not yet done so to consider becoming parties to the Protocol of 2014 to the Forced Labour Convention, 1930 (No. 29) and the Work in Fishing Convention, 2007 (No. 188), and to implement the Guidelines for port State control officers carrying out inspections under the Work in Fishing Convention, 2007 (No. 188) and the Guidelines on flag State inspection of working and living conditions on board fishing vessels;",
    "183": "Urges States, individually or through regional fisheries management organizations and arrangements, to enhance their efforts to apply an ecosystem approach to fisheries, taking into account paragraph 30 (d) of the Johannesburg Plan of Implementation;",
    "184": "Acknowledges the importance of adequate training for fishers to improve safety at sea and the importance, in this regard, of the International Convention on Standards of Training, Certification and Watchkeeping for Fishing Vessel Personnel, 1995, and encourages States that have not yet done so to consider becoming parties to that Convention;",
    "185": "Encourages States, individually or through regional fisheries management organizations and arrangements and other relevant international organizations, to work to ensure that fisheries and other ecosystem data collection is performed in a coordinated and integrated manner, facilitating incorporation into global observation initiatives, where appropriate;",
    "186": "Calls upon States and regional fisheries management organizations or arrangements, working in cooperation with other relevant organizations, including the Food and Agriculture Organization of the United Nations, the Intergovernmental Oceanographic Commission and the World Meteorological Organization, to adopt, as appropriate, measures to protect ocean data buoy systems moored in areas beyond national jurisdiction from actions that impair their operation;",
    "187": "Encourages States to increase scientific research on marine ecosystems in accordance with international law;",
    "188": "Recognizes that the science-policy interface is vital to the effective implementation of the provisions of the Convention and the Agreement by providing the best available scientific information for the conservation and management of living marine resources;",
    "189": "Urges States, individually and through regional fisheries management organizations and arrangements, to strengthen the science-policy interface in order to further improve the application of the ecosystem approach to fisheries management and to address uncertainties and changes such as those related to the impacts of climate change in support of the development of adaptive fisheries management strategies;",
    "190": " aquaculture, including through information exchange, developing equivalent standards on such issues as aquatic animal health and human health and safety concerns, assessing the potential positive and negative impacts of aquaculture, including socioeconomics, on the marine and coastal environment, including biodiversity, and adopting relevant methods and techniques to minimize and mitigate adverse effects, and in this regard encourages the implementation of the 2007 Strategy and Outline Plan for Improving Information on Status and Trends of Aquaculture of the Food and Agriculture Organization of the United Nations as a framework for the improvement and understanding of aquaculture status and trends;",
    "191": "Calls upon States to take action immediately, individually and through regional fisheries management organizations and arrangements, and consistent with the precautionary approach and ecosystem approaches, to continue to implement the 2008 International Guidelines for the Management of Deep-Sea Fisheries in the High Seas of the Food and Agriculture Organization of the United Nations (the Guidelines) in order to sustainably manage fish stocks and protect vulnerable marine ecosystems, including seamounts, hydrothermal vents and cold water corals, from fishing practices with significant adverse impacts on vulnerable marine ecosystems, recognizing the immense importance and value of deep-sea ecosystems and the biodiversity they contain, as documented in the first World Ocean Assessment;",
    "192": "Recalls, in this regard, that, in \u201cThe future we want\u201d, States committed to enhance actions to protect vulnerable marine ecosystems from significant adverse impacts, including through the effective use of impact assessments, consistent with international law, the applicable international instruments and relevant General Assembly resolutions and guidelines of the Food and Agriculture Organization of the United Nations;",
    "193": "Reaffirms the importance of paragraphs 80 to 90 of resolution 61/105, paragraphs 113 to 127 of resolution 64/72, paragraphs 121 to 136 of resolution 66/68 of 6 December 2011 and paragraphs 156, 171 to 188 and 219 of resolution 71/123 of 7 December 2016 addressing the impacts of bottom fishing on vulnerable marine ecosystems and the long-term sustainability of deep-sea fish stocks and the actions called for in those resolutions, and emphasizes the need for full implementation by all States and relevant regional fisheries management organizations and arrangements of their commitments under those paragraphs on an urgent basis;",
    "194": "Urges States and regional fisheries management organizations and arrangements to ensure that their actions in sustainably managing deep-sea fisheries and implementing paragraphs 80 and 83 to 87 of resolution 61/105, paragraphs 113 and 119 to 124 of resolution 64/72, paragraphs 121, 129, 130 and 132 to 134 of resolution 66/68 and paragraphs 156, 171 to 188 and 219 of resolution 71/123 are consistent with the Guidelines;",
    "195": "Recalls that nothing in the paragraphs of resolutions 61/105, 64/72, 66/68 and 71/123 addressing the impacts of bottom fishing on vulnerable marine ecosystems prejudices the sovereign rights of coastal States over their continental shelf or the exercise of the jurisdiction of coastal States with respect to their continental shelf under international law as reflected in the Convention, in particular article 77 thereof;",
    "196": "Notes, in this regard, the adoption by coastal States of conservation measures regarding their continental shelf to address the impacts of bottom fishing on vulnerable marine ecosystems, as well as their efforts to ensure compliance with those measures;",
    "197": " species, and to protect marine ecosystems, including the prevention of significant adverse impacts on vulnerable marine ecosystems;",
    "198": "Welcomes the important progress made by States, regional fisheries management organizations and arrangements and those States participating in negotiations to establish a regional fisheries management organization or arrangement competent to regulate bottom fisheries to implement paragraphs 80 and 83 to 87 of resolution 61/105, paragraphs 113, 117 and 119 to 124 of resolution 64/72 and paragraphs 121, 126, 129, 130 and 132 to 134 of resolution 66/68 and address the impacts of bottom fishing on vulnerable marine ecosystems, but notes with concern the uneven implementation of those paragraphs and that, in particular, bottom fishing continues to occur in certain areas beyond national jurisdiction without an impact assessment having been completed in the 12 years since the adoption of resolution 61/105, in which the General Assembly called for such assessments to be undertaken by 31 December 2008;",
    "199": "Calls upon, in this regard, States, regional fisheries management organizations and arrangements with the competence to regulate deep-sea fisheries, and States participating in negotiations to establish such organizations or arrangements to take, in particular, the following urgent actions regarding bottom fishing in areas beyond national jurisdiction: (a) To use, as applicable, the full set of criteria in the Guidelines to identify where vulnerable marine ecosystems occur or are likely to occur as well as for assessing significant adverse impacts; (b) To ensure that impact assessments, including for cumulative impacts of activities covered by the assessment, are conducted consistent with the Guidelines, particularly paragraph 47 thereof, are reviewed periodically and are revised thereafter whenever a substantial change in the fishery has occurred or there is relevant new information, and that, where such impact assessments have not been undertaken, they are carried out as a priority before authorizing bottom fishing activities; (c) To ensure that conservation and management measures adopted by States and regional fisheries organizations and arrangements are based on and updated on the basis of the best available scientific information, noting in particular the need to improve the effective implementation of thresholds and move-on rules;",
    "200": "Recognizes that different types of marine scientific research, such as seabed mapping, mapping of vulnerable marine ecosystems based on information from the fishing fleet, on-site camera observations from remote vehicles, benthic ecosystem modelling, comparative benthic studies and predictive modelling have resulted in the identification of areas where vulnerable marine ecosystems are known or are likely to occur and in the adoption of conservation and management measures to prevent significant adverse impacts on such ecosystems, including the closure of areas to bottom fishing in accordance with paragraph 119 (b) of resolution 64/72;",
    "201": " above-mentioned purposes, in accordance with international law, as reflected in Part XIII of the Convention;",
    "202": "Encourages, in this regard, States, regional fisheries management organizations and arrangements with the competence to manage deep-sea fisheries, and States participating in negotiations to establish such organizations or arrangements to carry out further marine scientific research to address the remaining knowledge gaps, in particular with regard to fish stock assessments, and to base and update conservation and management measures on the best available scientific information, in accordance with international law, as reflected in Part XIII of the Convention;",
    "203": "Notes with concern that vulnerable marine ecosystems may also be impacted by human activities other than bottom fishing, and encourages in this regard States and competent international organizations to consider taking action to address such impacts;",
    "204": "Calls upon States, individually and through regional fisheries management organizations and arrangements, to take into account the potential impacts of climate change and ocean acidification in taking measures to manage deep-sea fisheries and protect vulnerable marine ecosystems;",
    "205": "Calls upon States, individually and through regional fisheries management organizations and arrangements with the competence to regulate deep-sea fisheries, to adopt conservation and management measures, including monitoring, control and surveillance measures, on the basis of the best available scientific information, including stock assessments, to ensure the long-term sustainability of deep-sea fish stocks and non-target species and the rebuilding of depleted stocks, consistent with the Guidelines and, where scientific information is uncertain, unreliable or inadequate, to ensure that conservation and management measures are established consistent with the precautionary approach, in particular with regard to vulnerable, threatened or endangered species;",
    "206": "Recognizes, in particular, the special circumstances and requirements of developing States and the specific challenges that they may face in giving full effect to certain technical aspects of the Guidelines, and that implementation by such States of paragraphs 83 to 87 of resolution 61/105, paragraph 119 of resolution 64/72, paragraph 129 of resolution 66/68 and paragraph 180 of resolution 71/123 and the Guidelines should proceed in a manner that gives full consideration to section 6 of the Guidelines on the special requirements of developing countries;",
    "207": "Also recognizes the need to enhance the capacity of developing States, including with regard to stock assessments, impact assessments, scientific and technical knowledge and training, and encourages States to provide technical and financial support to developing countries to address their special requirements and challenges in implementing the Guidelines;",
    "208": "Welcomes the substantial ongoing work of the Food and Agriculture Organization of the United Nations related to the management of deep-sea fisheries in the high seas and the protection of vulnerable marine ecosystems, including the publication of the technical paper entitled \u201cVulnerable marine ecosystems: processes and practices in the high seas\u201d, affirms the importance of the work undertaken pursuant to paragraphs 135 and 136 of resolution 66/68, and notes in particular the support provided by the Food and Agriculture Organization of the United Nations to States in implementing the Guidelines;",
    "209": " 117 and 119 to 124 of resolution 64/72, paragraphs 121, 126, 129, 130 and 132 to 134 of resolution 66/68 and paragraphs 156, 171, 175, 177 to 188 and 219 of resolution 71/123, which was to be held in 2020, with a view to ensuring the effective implementation of the measures therein and to make further recommendations, where necessary, and also recalls the decision to precede that review with a two-day workshop;",
    "210": "Requests the Secretary-General to convene in the second half of 2022, with full conference services, without prejudice to future arrangements, the two-day workshop that was to have been held in 2020 pursuant to resolution 73/125 of 11 December 2018, in order to discuss implementation of paragraphs 113, 117 and 119 to 124 of resolution 64/72, paragraphs 121, 126, 129, 130 and 132 to 134 of resolution 66/68 and paragraphs 156, 171, 175, 177 to 188 and 219 of resolution 71/123, and to invite States, the Food and Agriculture Organization of the United Nations and other relevant specialized agencies, funds and programmes, subregional and regional fisheries management organizations and arrangements, other fisheries bodies, other relevant intergovernmental bodies and relevant non-governmental organizations and relevant stakeholders, in accordance with United Nations practice, to attend the workshop;",
    "211": "Welcomes the report of the Secretary-General on the actions taken by States and regional fisheries management organizations and arrangements in response to paragraphs 113, 117 and 119 to 124 of resolution 64/72, paragraphs 121, 126, 129, 130 and 132 to 134 of resolution 66/68 and paragraphs 156, 171, 175, 177 to 188 and 219 of resolution 71/123;35",
    "212": "Requests the Secretary-General to prepare a report, in cooperation with the Food and Agriculture Organization of the United Nations, for consideration by the General Assembly at its seventy-seventh session, on further actions taken by States and regional fisheries management organizations and arrangements in response to paragraphs 113, 117 and 119 to 124 of resolution 64/72, paragraphs 121, 126, 129, 130 and 132 to 134 of resolution 66/68 and paragraphs 156, 171, 175, 177 to 188 and 219 of resolution 71/123 since the preparation of the report referred to in paragraph 211 of the present resolution, and invites States and regional fisheries management organizations and arrangements to consider making such information publicly available;",
    "213": "Also requests the Secretary-General, in connection with the report requested in paragraph 212 of the present resolution, to invite States and regional economic integration organizations and regional fisheries management organizations and arrangements to submit updated information to the Secretary-General in a timely manner on actions taken pursuant to paragraphs 113, 117 and 119 to 124 of resolution 64/72, paragraphs 121, 126, 129, 130 and 132 to 134 of resolution 66/68 and paragraphs 156, 171, 175, 177 to 188 and 219 of resolution 71/123 after 2019, to facilitate a further review of such actions;",
    "214": "Encourages accelerated progress to establish criteria on the objectives, establishment and effective management of marine protected areas for fisheries purposes, and in this regard also encourages the application of the technical guidelines on marine protected areas and fisheries of the Food and Agriculture Organization of the United Nations, and urges involvement, coordination and cooperation among all relevant international organizations and bodies;",
    "215": "Also encourages efforts to establish guidance on the objectives, establishment and management of other effective area-based conservation measures for fisheries purposes, and encourages coordination and cooperation for this purpose among all relevant international organizations and bodies;",
    "216": "Urges all States to implement the 1995 Global Programme of Action for the Protection of the Marine Environment from Land-based Activities36 and to accelerate activity to safeguard marine ecosystems, including fish stocks, against sources of land-based pollution, including plastics and excess nutrients, and physical degradation, taking into account the increase in oceanic dead zones;",
    "217": "Calls upon States, either individually, collectively or through regional fisheries management organizations and arrangements, to further study, develop and adopt effective management measures, and disseminate information in that regard, taking into account the best available scientific information, on fishing methods, gear types and uses to minimize mortality and other harms caused by abandoned, lost or otherwise discarded fishing gear;",
    "218": "Acknowledges the serious environmental, as well as economic and social, impacts on the marine environment caused by abandoned, lost or otherwise discarded fishing gear, and encourages States, and regional fisheries management organizations and arrangements, as appropriate, to take action to reduce such gear, noting the recommendations of the 2009 report by the United Nations Environment Programme and the Food and Agriculture Organization of the United Nations;",
    "219": "Reaffirms the importance that it attaches to paragraphs 77 to 81 of resolution 60/31 of 29 November 2005 concerning the issue of lost, abandoned or otherwise discarded fishing gear and related marine debris and the adverse impacts that such debris and derelict fishing gear have on, inter alia, fish stocks, habitats and other marine species, and urges accelerated progress by States and regional fisheries management organizations and arrangements in implementing those paragraphs of the resolution;",
    "220": "Recalls, in this regard, the endorsement by the Committee on Fisheries, at its thirty-third session, of the Voluntary Guidelines on the Marking of Fishing Gear, and also recalls that the Committee welcomed the recommendations of the Technical Consultation on the Marking of Fishing Gear and supported the development of a comprehensive global strategy to tackle issues relating to abandoned, lost or otherwise discarded fishing gear and to support the implementation of the Guidelines;",
    "221": "Also recalls annex V to the International Convention for the Prevention of Pollution from Ships, 1973, as modified by the Protocol of 1978 relating thereto, in which it is stated, inter alia, that the accidental loss or discharge of fishing gear which poses a significant threat to the marine environment or navigation, shall be reported to the State whose flag the ship is entitled to fly, and, where the loss or discharge occurs within waters subject to the jurisdiction of a coastal State, also to that coastal State;37",
    "222": "Encourages further studies, including by the Food and Agriculture Organization of the United Nations, on the impacts of underwater noise on fish stocks and fishing catch rates, as well as associated socioeconomic effects;",
    "223": "Calls upon States, including through regional fisheries management organizations and arrangements, to play an active role in global efforts to conserve and sustainably use living marine resources, so as to contribute to marine biological diversity;",
    "224": "Encourages States, either individually or through regional fisheries management organizations and arrangements, as appropriate, to identify any spawning and nursery areas for fish stocks under their jurisdiction or competence and, where required, to adopt science-based measures to conserve such stocks during these critical life stages;",
    "225": "Expresses concern about the continuing influx of sargassum seaweed into the waters of the Caribbean and its impact on aquatic resources, fisheries, shorelines, waterways and tourism and the general well-being of coastal communities, and encourages States and relevant regional organizations to coordinate efforts to better understand the causes and impacts of the influx, and to eliminate extraordinary amounts of sargassum washed up along the coastline using environmentally sound techniques, as well as to work on joint solutions to maintain and protect the livelihoods of fishers and fishing communities and find ways of beneficially utilizing the seaweed and environmentally friendly ways of disposing of sargassum washed up on shore;",
    "226": "Recognizes the wide range of impacts of ocean acidification on marine ecosystems, and calls upon States to tackle the causes of ocean acidification and to further study its impacts;",
    "227": "Emphasizes the importance of developing adaptive marine resource management strategies and enhancing capacity-building to implement such strategies in order to enhance the resilience of marine ecosystems to minimize the wide range of impacts on marine organisms and threats to food security caused by ocean acidification, in particular the impacts on the ability of calciferous plankton, coral reefs, shellfish and crustaceans to build shells and skeletal structures and the threats that this could pose to protein supply; XI Capacity-building",
    "228": "Reiterates the crucial importance of cooperation by States directly or, as appropriate, through the relevant subregional and regional organizations, and by other international organizations, including the Food and Agriculture Organization of the United Nations through its FishCode programme, including through financial and/or technical assistance, in accordance with the Agreement, the Compliance Agreement, the Code and its associated international plans of action, to increase the capacity of developing States to achieve the goals and implement the actions called for in the present resolution;",
    "229": "Welcomes the ongoing work of the Food and Agriculture Organization of the United Nations in developing guidance on, and assisting in the implementation of, the strategies and measures required for the creation of an enabling environment for sustainable small-scale fisheries, and encourages studies for creating possible alternative livelihoods for coastal communities;",
    "230": "Recalls that, in \u201cThe future we want\u201d, States recognized the importance of building the capacity of developing countries to be able to benefit from the conservation and sustainable use of the oceans and seas and their resources, and in this regard emphasized the need for cooperation in marine scientific research to implement the provisions of the Convention and the outcomes of the major summits on sustainable development, as well as for the transfer of technology, taking into account the Intergovernmental Oceanographic Commission Criteria and Guidelines on the Transfer of Marine Technology;",
    "231": " developing their national capacity to conserve, sustainably manage and realize the benefits of sustainable fisheries, including through improved market access for fish products from developing countries;",
    "232": "Encourages increased capacity-building and technical assistance by States, international financial institutions and relevant intergovernmental organizations and bodies for fishers, in particular small-scale fishers, in developing countries, and in particular small island developing States, consistent with environmental sustainability, in recognition of the fact that food security and livelihoods may depend on fisheries;",
    "233": "Encourages States to cooperate closely, directly or through the United Nations system, including the Food and Agriculture Organization of the United Nations, with a view to enhancing the capacity-building of developing States, including coastal States, in particular small island developing States, in the field of fisheries and aquaculture through education and training;",
    "234": "Recognizes, in this regard, the work of the United Nations University Fisheries Training Programme in Iceland and its contribution to training for developing States, in particular small island developing States, and emphasizes the need for the continuation and strengthening of this training for developing States;",
    "235": "Encourages the international community to enhance the opportunities for sustainable development in developing countries, in particular the least developed countries, small island developing States and coastal African States, by encouraging greater participation of those States in authorized fisheries activities being undertaken within areas under their national jurisdiction, in accordance with the Convention, by distant-water fishing nations in order to achieve better economic returns for developing countries from their fisheries resources within areas under their national jurisdiction and an enhanced role in regional fisheries management, as well as by enhancing the ability of developing countries to develop their own fisheries, as well as to participate in high seas fisheries, including access to such fisheries, in conformity with international law, in particular the Convention and the Agreement, and taking into account article 5 of the Code;",
    "236": "Recalls the progress made at the first meeting of the parties to the Agreement on Port State Measures to Prevent, Deter and Eliminate Illegal, Unreported and Unregulated Fishing towards the future establishment of an assistance fund under article 21 of that Agreement to be administered by the Food and Agriculture Organization of the United Nations for the purpose of assisting developing States parties, in particular the least developed among them and small island developing States, in the implementation of that Agreement and the acknowledgement by the ad hoc working group established by the parties to that Agreement that access to the assistance fund by developing States parties should be transparent, equitable, simple and well coordinated, and notes the adoption of the terms of reference for the funding mechanisms under part 6 of the Agreement at the second meeting of the parties to the Agreement on Port State Measures;",
    "237": " within areas under the national jurisdiction of the developing coastal State providing fisheries access, taking into account the forms of cooperation set out in article 25 of the Agreement and article 5 of the Code;",
    "238": "Encourages, in this regard, greater transparency regarding fisheries access agreements, including by making them publicly available, subject to confidentiality requirements;",
    "239": "Encourages States, individually and through regional fisheries management organizations and arrangements, to provide greater assistance and to promote coherence in such assistance for developing States in designing, establishing and implementing relevant agreements, instruments and tools for the conservation and sustainable management of fish stocks, including in designing and strengthening their domestic regulatory fisheries policies and those of regional fisheries management organizations or arrangements in their regions, and the enhancement of research and scientific capabilities through existing funds, such as the Assistance Fund under Part VII of the Agreement, bilateral assistance, regional fisheries management organizations and arrangements assistance funds, the FishCode programme, the World Bank\u2019s global programme on fisheries and the Global Environment Facility;",
    "240": "Calls upon States to promote, through continuing dialogue and the assistance and cooperation provided in accordance with articles 24 to 26 of the Agreement, further ratifications of or accessions to the Agreement by seeking to address, inter alia, the issue of lack of capacity and resources that might stand in the way of developing States becoming parties;",
    "241": "Encourages States, regional fisheries management organizations and arrangements and other relevant bodies to assist developing States in the implementation of the actions called for in paragraphs 80 and 83 to 87 of resolution 61/105, paragraphs 113, 117 and 119 to 124 of resolution 64/72, paragraphs 121, 126, 129, 130 and 132 to 134 of resolution 66/68 and paragraphs 156, 171, 175 and 177 to 188 of resolution 71/123;",
    "242": "Urges States and regional economic integration organizations, individually and through regional fisheries management organizations and arrangements, to mainstream efforts to assist developing States, in particular the least developed countries and small island developing States, with other relevant international development strategies with a view to enhancing international coordination to enable them to develop their national capacity to exploit fishery resources, consistent with the duty to ensure the conservation and management of those resources, and in this regard requests the Secretary-General to fully mobilize and coordinate the agencies, funds and programmes of the United Nations system, including at the level of the regional economic commissions, within their respective mandates;",
    "243": "Requests States and regional fisheries management organizations to develop strategies to further assist developing States, in particular the least developed countries and small island developing States, in fully realizing the benefits from the catch of straddling fish stocks and highly migratory fish stocks and in strengthening regional efforts to sustainably conserve and manage such stocks and, in this regard, to make available such information; XII Cooperation within the United Nations system",
    "244": "",
    "245": "Invites the Food and Agriculture Organization of the United Nations to continue its cooperative arrangements with United Nations agencies on the implementation of the international plans of action; XIII Activities of the Division for Ocean Affairs and the Law of the Sea",
    "246": "Expresses its appreciation to the Secretary-General for the activities of the Division, which reflect the high standard of assistance provided to Member States by the Division;",
    "247": "Requests the Secretary-General to continue to carry out the responsibilities and functions entrusted to him by the Convention, the Agreement and the related resolutions of the General Assembly and to ensure the allocation of appropriate resources to the Division for the performance of its activities under the approved budget for the Organization; XIV Seventy-sixth session of the General Assembly",
    "248": "Requests the Secretary-General to bring the present resolution to the attention of all States, relevant intergovernmental organizations, the organizations and bodies of the United Nations system, subregional and regional fisheries management organizations and relevant non-governmental organizations;",
    "249": "Notes the desire to further improve the efficiency of and the effective participation of delegations in the informal consultations concerning the annual General Assembly resolution on sustainable fisheries, decides that the informal consultations on this resolution will be held in a single round of consultations in November for a period of six days, requests the Secretary-General to provide support to the consultations through the Division, and invites States to submit proposals for inclusion in the text of the resolution to the Coordinator of the informal consultations no later than five weeks before the start of the consultations;",
    "250": "Decides to include in the provisional agenda of its seventy-sixth session, under the item entitled \u201cOceans and the law of the sea\u201d, the sub-item entitled \u201cSustainable fisheries, including through the 1995 Agreement for the Implementation of the Provisions of the United Nations Convention on the Law of the Sea of 10 December 1982 relating to the Conservation and Management of Straddling Fish Stocks and Highly Migratory Fish Stocks, and related instruments\u201d, and to consider the possibility of including this sub-item in future provisional agendas on a biennial basis."
  },
  "agenda_items": [
    "Item 76"
  ],
  "symbol_references": [
    "A/75/L.40"
  ]
}