{
  "symbol": "A/RES/80/174",
  "filename": "A_RES_80_174.pdf",
  "title": "80/174. International Day of the Mediterranean Diet",
  "text": "United Nations \nA/RES/80/174 \n \nGeneral Assembly \nDistr.: General \n19 December 2025 \n25-20876 (E) \n*2520876* \n \n \nEightieth session \nAgenda item 13 \nIntegrated and coordinated implementation of and follow-up \nto the outcomes of the major United Nations conferences and \nsummits in the economic, social and related fields \n \n \n \n \n Resolution adopted by the General Assembly \non 18 December 2025 \n \n \n[without reference to a Main Committee (A/80/L.21)] \n \n \n 80/174. International Day of the Mediterranean Diet \n \n \n \nThe General Assembly, \n \nReaffirming its resolution 70/1 of 25 September 2015, entitled \u201cTransforming \nour world: the 2030 Agenda for Sustainable Development\u201d, in which it adopted a \ncomprehensive, far-reaching and people-centred set of universal and transformative \nSustainable Development Goals and targets, and its commitment to working tirelessly \nfor the full implementation of the Agenda by 2030, \n \nReaffirming also its resolutions 53/199 of 15 December 1998 and 61/185 of \n20 December 2006 on the proclamation of international years, and Economic and \nSocial Council resolution 1980/67 of 25 July 1980 on international years and \nanniversaries, in particular paragraphs 1 to 10 of the annex thereto on the agreed \ncriteria for the proclamation of international years, as well as paragraphs 13 and 14, \nin which it is stated that an international year should not be proclaimed before the \nbasic arrangements for its organization and financing have been made, \n \nRecalling its resolution 79/276 of 25 March 2025, entitled \u201cImplementation of \nthe United Nations Decade of Action on Nutrition (2016\u20132025)\u201d, which highlighted \nthe importance of nutrition and extended the Decade of Action on Nutrition to 2030, \n \nTaking note of resolution 7/2025 of 4 July 2025, entitled \u201cInternational Day of \nthe Mediterranean Diet\u201d, adopted by the Conference of the Food and Agriculture \nOrganization of the United Nations at its forty-fourth session,1 \n \nRecalling that the United Nations Educational, Scientific and Cultural \nOrganization recognized the Mediterranean diet as an intangible cultural heritage of \n_______________ \n \n1 Food and Agriculture Organization of the United Nations, document C 2025/REP, appendix I. \n\nA/RES/80/174 \nInternational Day of the Mediterranean Diet\n \n25-20876\n2/3 \n \nhumanity in 2010, also in light of its values of hospitality, neighbourliness, \nintercultural dialogue and creativity, and a way of life guided by respect for diversity,  \n \nRecognizing the contribution of the Mediterranean diet to nutrition and its \npotential contribution to biodiversity, environmental sustainability and resilient food \nsystems, as recalled by the Food and Agriculture Organization of the United Nations \nin its resolution 7/2025,  \n \nHighlighting the need to raise awareness about the Mediterranean diet as a well-\nbalanced and healthy diet, among others, which includes the consumption of a broad \nvariety of food such as but not limited to fruits, vegetables, whole grains, legumes, \nnuts and olive oil, and is associated with the prevention of noncommunicable diseases \nand overall well-being, \n \nNoting that the promotion of traditional dietary patterns and healthy diets such \nas the Mediterranean diet can play an important role in the prevention of conditions \nand diseases such as obesity, malnutrition and chronic diseases,  \n \nAcknowledging the importance of youth engagement, and the role historically \nplayed by women in preserving and transmitting the knowledge, practices and \ntraditions associated with the Mediterranean diet in the Mediterranean region,  \n \nRecognizing the importance of the Mediterranean diet to local communities, \neconomies, micro-, small and medium-sized enterprises, smallholders and family \nfarmers, and sustainable agriculture, while fostering social cohesion in the \nMediterranean region, \n \nRecognizing the role played by the Mediterranean diet in cultural spaces, \nfestivals and celebrations, involving people of all ages, conditions and social groups, \nincluding the craftsmanship and production of traditional receptacles for the transport, \npreservation and consumption of food in the Mediterranean region, \n \nTrusting that the observance of an international day will create a platform to \npromote awareness and cultural exchange about the Mediterranean diet as one of the \nwell-balanced and healthy diets, \n \n1. \nDecides to designate 16 November as the International Day of the \nMediterranean Diet; \n \n2. \nInvites all Member States, organizations of the United Nations system, \nmembers of the specialized agencies and observers of the General Assembly, other \ninternational, regional and subregional organizations and other relevant stakeholders, \nincluding civil society, local communities, the private sector and academia, as well as \nschools, to observe the International Day, as appropriate, through activities aimed at \nraising awareness of the importance of this diet and sharing best practices in this \nregard; \n \n3. \nInvites the Food and Agriculture Organization of the United Nations to \nfacilitate the observance of the International Day, mindful of the provisions contained \nin the annex to Economic and Social Council resolution 1980/67;  \n \n4. \nStresses that the costs of all the activities that may arise from the \nimplementation of the present resolution should be met through voluntary \ncontributions, including from the private sector;  \n \n5. \nInvites all relevant stakeholders to contribute to and support the \nInternational Day;  \n \n6. \nRequests the Secretary-General to bring the present resolution to the \nattention of all Member States, members of the specialized agencies and observers of \nthe General Assembly, the organizations of the United Nations system and other \n\nInternational Day of the Mediterranean Diet \nA/RES/80/174\n \n3/3\n25-20876 \n \ninternational, regional and subregional organizations and other relevant stakeholders, \nincluding civil society, local communities, the private sector and academia, for \nappropriate observance.  \n \n69th plenary meeting \n18 December 2025 \n \n",
  "paragraphs": {
    "1": "Decides to designate 16 November as the International Day of the Mediterranean Diet;",
    "2": "Invites all Member States, organizations of the United Nations system, members of the specialized agencies and observers of the General Assembly, other international, regional and subregional organizations and other relevant stakeholders, including civil society, local communities, the private sector and academia, as well as schools, to observe the International Day, as appropriate, through activities aimed at raising awareness of the importance of this diet and sharing best practices in this regard;",
    "3": "Invites the Food and Agriculture Organization of the United Nations to facilitate the observance of the International Day, mindful of the provisions contained in the annex to Economic and Social Council resolution 1980/67;",
    "4": "Stresses that the costs of all the activities that may arise from the implementation of the present resolution should be met through voluntary contributions, including from the private sector;",
    "5": "Invites all relevant stakeholders to contribute to and support the International Day;",
    "6": "Requests the Secretary-General to bring the present resolution to the attention of all Member States, members of the specialized agencies and observers of the General Assembly, the organizations of the United Nations system and other International Day of the Mediterranean Diet A/RES/80/174 3/3 25-20876 international, regional and subregional organizations and other relevant stakeholders, including civil society, local communities, the private sector and academia, for appropriate observance. 69th plenary meeting 18 December 2025"
  },
  "agenda_items": [
    "Item 13"
  ],
  "symbol_references": [
    "A/80/L.21"
  ]
}