{
  "symbol": "A/RES/79/140",
  "filename": "A_RES_79_140.pdf",
  "title": "79/140. Strengthening of the coordination of emergency humanitarian assistance of the United Nations",
  "text": "United Nations \nA/RES/79/140\n \nGeneral Assembly \nDistr.: General \n12 December 2024 \n24-23459 (E) \n*2423459* \n \n \nSeventy-ninth session \nAgenda item 72 (a) \nStrengthening of the coordination of humanitarian and \ndisaster relief assistance of the United Nations, including \nspecial economic assistance: strengthening of the coordination \nof emergency humanitarian assistance of the United Nations \n \n \n \n \n Resolution adopted by the General Assembly \non 9 December 2024 \n \n \n[without reference to a Main Committee (A/79/L.36)] \n \n \n 79/140. Strengthening of the coordination of emergency humanitarian \nassistance of the United Nations \n \n \n \nThe General Assembly, \n \nReaffirming its resolution 46/182 of 19 December 1991 and the guiding \nprinciples contained in the annex thereto, other relevant General Assembly and \nEconomic and Social Council resolutions and agreed conclusions of the Council, \n \nTaking note of the reports of the Secretary-General on the strengthening of the \ncoordination of emergency humanitarian assistance of the United Nations 1 and on the \nCentral Emergency Response Fund,2 \n \nReaffirming \nthe \nprinciples \nof \nhumanity, \nneutrality, \nimpartiality \nand \nindependence in the provision of humanitarian assistance, and reaffirming also the \nneed for all actors engaged in the provision of humanitarian assistance in situations \nof complex emergencies and natural disasters to promote and fully respect these \nprinciples, \n \nExpressing grave concern at the increasing challenges caused by the \nunprecedented number of people affected by humanitarian emergencies, including \nprotracted displacement, which are increasing in number, scale and severity and are \nstretching humanitarian response capacities, and expressing deep concern about the \nimpact of climate change, the ongoing consequences of the financial and economic \ncrisis, regional food crises, continuing food and energy insecurity, water scarcity, \nunplanned and rapid urbanization of populations, epidemics, natural hazards, \n_______________ \n \n1 A/79/78-E/2024/53. \n \n2 A/79/327. \n\nA/RES/79/140 \nStrengthening of the coordination of emergency humanitarian \nassistance of the United Nations\n \n24-23459\n2/22 \n \nenvironmental degradation, armed conflicts and acts of terrorism, which are adding \nto underdevelopment, poverty and inequality and are increasing the vulnerability of \npeople while reducing their ability to cope with humanitarian crises, \n \nExpressing gravest concerns about the humanitarian impact of and risks posed \nby the ongoing consequences and long-term effects of the coronavirus disease \n(COVID\u201119), including on the already significant levels of humanitarian and \ndevelopment needs and suffering of affected people and communities, recognizing \nthe disproportionate impact on women, children and people in vulnerable situations, \nand profoundly concerned by rising humanitarian assistance and protection needs \nincluding due to the increase in violence, including sexual and gender-based violence \nand violence against children, and the significant impact on education, especially for \ngirls, as well as high levels of food insecurity and malnutrition and rising risks of \nfamine, loss of livelihoods, and all the negative impacts on health, including mental \nhealth and psychosocial well-being, which are also exacerbated by weakened health \nsystems, and the impacts and risks for displacement; and recognizing the compounded \nrisks and impacts due to armed conflict, poverty, natural disasters, violence, the \nadverse effects of climate change, and other environmental challenges; and further \nrecognizing the efforts and measures proposed by the Secretary-General concerning \nthe response to the impact of the COVID\u201119 pandemic and taking note of the political \ndeclarations on pandemic prevention, preparedness and response, 3 on universal health \ncoverage4 and on the fight against tuberculosis5 adopted at the respective high-level \nmeetings of the General Assembly held in New York in September 2023, as well as \nGeneral Assembly resolutions on the control and elimination of malaria, \n \nUnderscoring the need, in order to ensure a smooth transition from relief to \nrehabilitation and development, to better align, wherever appropriate, humanitarian \nand development assistance with national development priorities and strategies, and \nencouraging Member States, as well as the United Nations system and regional \norganizations, in supporting the efforts of Member States, to tackle the root causes of \nhumanitarian crises, including poverty and underdevelopment, build the resilience of \naffected States, including host communities, and reduce humanitarian needs, \n \nDeeply concerned about the rapidly growing gap between humanitarian needs \nand available resources, welcoming non\u2011traditional donors and new partnerships, \napproaches and efforts, and emphasizing the need to mobilize adequate, predictable, \ntimely and flexible resources for humanitarian assistance, based on and in proportion \nto assessed risks and needs, with a view to planning for, mitigating, preparing for, \nresponding to and recovering from humanitarian emergencies, \n \nRecognizing, in this regard, the significant achievements of the Central \nEmergency Response Fund in facilitating life-saving assistance to crisis-affected \npeople by providing timely funding, enabling humanitarian organizations and their \nimplementing partners to act quickly when tragedy strikes and steer resources to \ncrises that do not receive the attention that they need and deserve, emphasizing the \nneed to broaden and diversify the income base of the Fund, and welcoming in this \nregard the call by the Secretary-General to increase the level of the Fund to 1 billion \nUnited States dollars, \n \nRecognizing also the significant achievements of country-based pooled funds in \nfacilitating assistance to people in need, noting the Secretary-General\u2019s call for donors \nto increase the proportion of humanitarian appeal funding channelled through \n_______________ \n \n3 Resolution 78/3, annex. \n \n4 Resolution 78/4, annex. \n \n5 Resolution 78/5, annex. \n\nStrengthening of the coordination of emergency humanitarian \nassistance of the United Nations \nA/RES/79/140\n \n3/22\n24-23459 \n \ncountry-based pooled funds, and noting also that other pooled funding mechanisms \ncan make important contributions, \n \nEmphasizing that strengthened needs analysis, risk management and strategic \nplanning, in coordination with affected States, including through the use of open and \ndisaggregated data, are crucial elements to ensure a better informed, more effective, \ntransparent and collective response to the needs of people affected by crises, \n \nReiterating the need for Member States, relevant United Nations organizations \nand other relevant actors to mainstream a gender perspective into humanitarian \nassistance and integrate a gender perspective into all disaster risk reduction efforts, \nincluding by addressing the specific needs, and promoting the priorities and \ncapacities, of women, girls, men and boys in a comprehensive and consistent manner, \nand also respecting and protecting their rights, recognizing that in humanitarian \nemergencies, women, girls and boys face heightened risks to their safety, health and \nwell-being, and reiterating also that it is essential to ensure that women are \nempowered to effectively and meaningfully participate in leadership and decision-\nmaking processes, \n \nReiterating also the need for Member States, relevant United Nations \norganizations and other relevant actors to improve accountability at all levels for the \nneeds of affected populations, and recognizing the importance of inclusive \nparticipation in decision-making, \n \nRecognizing that persons with disabilities are disproportionately affected in \nhumanitarian emergencies and face multiple barriers in accessing assistance, recalling \nthe need for the involvement of persons with disabilities in decision-making processes \nand for mainstreaming, where possible, their perspectives and needs in humanitarian \npreparedness and response, and in this regard recalling the Charter on Inclusion of \nPersons with Disabilities in Humanitarian Action, \n \nWelcoming the convening of the Summit of the Future on 22 and 23 September \n2024 at United Nations Headquarters in New York, and taking note of resolution 79/1 \nof 22 September 2024, entitled \u201cThe Pact for the Future\u201d, and its annexes, and \nrecognizing that the Pact contains actions related to humanitarian assistance, \nincluding action 14 and action 15, \n \nExpressing its deep concern about the increasing challenges faced by Member \nStates and the United Nations humanitarian response system and their capacities as a \nresult of the consequences of disasters, including those related to the continuing \nimpact of climate change, reaffirming the need for the implementation of the Sendai \nFramework for Disaster Risk Reduction 2015\u20132030,6 and welcoming the convening \nof the seventh session of the Global Platform for Disaster Risk Reduction in May \n2022 and of the high-level meeting on the midterm review of the Sendai Framework \non 18 and 19 May 2023, at which the Assembly adopted the political declaration on \nthe midterm review of the Sendai Framework,7 \n \nWelcoming the Paris Agreement8 and its early entry into force, encouraging all \nits parties to fully implement the Agreement, and parties to the United Nations \nFramework Convention on Climate Change9 that have not yet done so to deposit their \ninstruments of ratification, acceptance, approval or accession, where appropriate, as \nsoon as possible, \n_______________ \n \n6 Resolution 69/283, annex II. \n \n7 Resolution 77/289, annex. \n \n8 See FCCC/CP/2015/10/Add.1, decision 1/CP.21, annex. \n \n9 United Nations, Treaty Series, vol. 1771, No. 30822. \n\nA/RES/79/140 \nStrengthening of the coordination of emergency humanitarian \nassistance of the United Nations\n \n24-23459\n4/22 \n \n \nReaffirming the adoption of the New Urban Agenda by the United Nations \nConference on Housing and Sustainable Urban Development (Habitat III), held in \nQuito from 17 to 20 October 2016,10 and noting the commitments undertaken therein \nby Member States regarding persons affected by humanitarian crises in urban areas, \n \nTaking note of the World Humanitarian Summit, held in Istanbul, T\u00fcrkiye, on \n23 and 24 May 2016, and taking note also of the report of the Secretary-General on \nthe outcome of the World Humanitarian Summit,11 \n \nRecognizing the primary role of Member States in preparing for and responding \nto outbreaks of infectious disease, in compliance with the International Health \nRegulations (2005) adopted by the World Health Assembly, 12 including those that \nbecome humanitarian crises, highlighting the critical role played by Member States, \nthe World Health Organization as the directing and coordinating authority of \ninternational health work, the United Nations humanitarian system, regional \norganizations, non\u2011governmental organizations, the private sector and other \nhumanitarian actors in providing financial, technical and in-kind support in order to \nbring epidemics or pandemics under control, and recognizing also the need to \nstrengthen local and national health systems, early reporting and early warning \nsystems, preparedness, cross-sectoral response capacities, and resilience linked to \noutbreaks of infectious disease, including through capacity-building for developing \ncountries, \n \nRecognizing also that developing countries, in particular the least developed \ncountries and small island developing States, remain acutely vulnerable to the adverse \neffects of climate change, the increase in the intensity and frequency of extreme \nweather and climate-related events, as well as the effects of El Ni\u00f1o and La Ni\u00f1a, \nenvironmental degradation and human and economic loss resulting from natural \nhazards, recognizing also the increase in the intensity and frequency of disasters, \nwhich in many circumstances can contribute to displacement, and recognizing further \nthe need for an improved understanding of the multidimensional nature of disaster \nand the adverse effects of climate change to effectively manage disaster risk, and for \ninternational cooperation, as appropriate, to develop and strengthen their resilience in \nthis regard, including the exchange of information, experiences and best practices \namong countries, and reaffirming the importance of international cooperation in \nsupport of the efforts of affected States, including in preparedness, response and early \nrecovery, and of strengthening the response capacity of countries affected by such \ndisasters, \n \nRecognizing further that inclusive economic growth and sustainable \ndevelopment are essential for the prevention of and preparedness for natural disasters \nand other emergencies, \n \nRecognizing, in this respect, that building national and local preparedness and \nresponse capacity through, inter alia, appropriate, inclusive and conducive public \npolicies and international assistance is critical to a more predictable and effective \nresponse and contributes to the achievement of humanitarian and development \nobjectives, including enhanced resilience and a reduced need for humanitarian \nresponse, \n \nRecognizing also that enhanced access to international climate finance is \nimportant to support mitigation and adaptation efforts in developing countries, \n_______________ \n \n10 Resolution 71/256, annex. \n \n11 A/71/353. \n \n12 World Health Organization, document WHA58/2005/REC/1, resolution 58.3, annex. \n\nStrengthening of the coordination of emergency humanitarian \nassistance of the United Nations \nA/RES/79/140\n \n5/22\n24-23459 \n \nespecially those that are particularly vulnerable to the adverse effects of climate \nchange, and recognizing further the ongoing efforts in this regard,  \n \nEmphasizing the fundamentally civilian character of humanitarian assistance, \nand reaffirming, in situations in which military capacity and assets are used as a last \nresort to support the implementation of humanitarian assistance, the need for their use \nto be undertaken with the consent of the affected State and in conformity with \ninternational law, including international humanitarian law, as well as humanitarian \nprinciples, \n \nRecognizing the high number of people affected by humanitarian emergencies, \nincluding the unprecedented number of people who are forcibly displaced, of whom \na majority are women and children, owing to conflict, acts of terrorism, persecution, \nviolence and other reasons, and who are often displaced for protracted periods, \nwherein the national authorities have the primary duty and responsibility to provide \nprotection and humanitarian assistance and promote durable solutions for internally \ndisplaced persons within their jurisdiction, bearing in mind their particular needs, \n \nNoting the need for increased awareness of the international community \nregarding the issue of internal displacement worldwide, including the situation of the \nmillions living in protracted situations of displacement, and the urgency of providing \nadequate humanitarian assistance to and protection for internally displaced persons, \nsupporting host communities, addressing the root causes of displacement, finding \ndurable solutions for internally displaced persons in their countries and addressing \npossible obstacles in this regard, and recognizing that durable solutions include \nvoluntary return in safety and with dignity, as well as voluntary local integration in \nthe areas to which persons have been displaced or voluntary settlement in another part \nof the country, without prejudice to the right of internally displaced persons to leave \ntheir country or to seek asylum, \n \nReaffirming the New York Declaration for Refugees and Migrants, adopted at \nthe high-level plenary meeting of the General Assembly on addressing large \nmovements of refugees and migrants, held on 19 September 2016,13 \n \nExpressing concern about the particular difficulties faced by the millions of \nrefugees in protracted situations, recognizing that the average length of stay has \ncontinued to grow, and emphasizing the need to redouble international efforts and \ncooperation to find practical and comprehensive approaches to resolving their plight \nand to realize durable solutions for them, consistent with the Charter of the United \nNations, international law and relevant General Assembly resolutions, \n \nNoting with great concern that millions of people are facing famine or the \nimmediate risk of famine or are experiencing acute food insecurity and malnutrition \nin several regions of the world, and noting that armed conflicts, drought, poverty and \nthe volatility of commodity prices are among the factors causing or exacerbating \nfamine, and acute food insecurity and malnutrition, and that additional efforts, \nincluding international support, are urgently needed to address this, recognizing in \nthis regard the initiatives and efforts to address and mitigate rising food insecurity \nand malnutrition by the Secretary-General and the United Nations system, \n \nUnderscoring the importance of international humanitarian law, including the \nGeneva Conventions of 1949,14 which provides a vital legal framework for the \nprotection of civilian persons in time of war, including the provision of humanitarian \nassistance, \n_______________ \n \n13 Resolution 71/1. \n \n14 United Nations, Treaty Series, vol. 75, Nos. 970\u2013973. \n\nA/RES/79/140 \nStrengthening of the coordination of emergency humanitarian \nassistance of the United Nations\n \n24-23459\n6/22 \n \n \nUnderscoring also the obligations of all parties to armed conflict to respect and \nensure respect for international humanitarian law in all circumstances, and the \nobligation of all parties to armed conflict to comply strictly with the obligations \napplicable to them under international humanitarian law,  \n \nGravely concerned by the rising levels of devastating harm to civilians and \ncivilian objects in armed conflicts, including from attacks directed against civilians \nand civilian objects and by indiscriminate use of weapons, including in urban and \nother populated areas, and by the impact of hostilities and violations related to the \nconduct of hostilities on humanitarian personnel and United Nations and associated \npersonnel, including national and locally recruited personnel, and their premises and \nassets, as well as the devastating impact of such violence on the provision of \nhumanitarian assistance and protection to people in need, and acknowledging the need \nfor parties to armed conflict to strengthen the protection of civilians and improve \nimplementation of and comply with their obligations under international humanitarian \nlaw, \n \nNoting with great concern difficulties related to access to reaching people in \nneed of humanitarian assistance, including in hard-to-reach areas, for humanitarian \nand medical personnel, supplies, equipment and services due to armed conflicts, \nviolence and threats of violence, deliberate targeting, bureaucratic and other \nimpediments, as well as non\u2011cooperation, and recognizing the severe impact on the \nwork of the United Nations, the International Red Cross and Red Crescent Movement \nand other humanitarian organizations in the provision of assistance and protection to \npeople in need, \n \nStrongly condemning all acts of violence, including direct attacks and threats, \nagainst humanitarian personnel and their facilities and assets, as well as against \nmedical personnel and other humanitarian personnel exclusively engaged in medical \nduties, their means of transport and equipment, and hospitals and other medical \nfacilities, as well as the targeting, killing, harassment, intimidation, reprisal, \ncriminalization, prosecutions, hostage-taking, abduction, assault and sexual assault, \narbitrary arrest and arbitrary detentions of such personnel for carrying out \nhumanitarian activities, which in a majority of cases affect national and locally \nrecruited personnel, and which in 2023 resulted in the highest number of fatalities on \nrecord, noting with concern the negative implications for the provision of \nhumanitarian assistance to populations in need, and welcoming efforts such as the \nHealth Care in Danger project of the International Red Cross and Red Crescent \nMovement, together with States, international and non\u2011governmental organizations \nand other relevant stakeholders, to strengthen compliance with international \nhumanitarian law by raising awareness, and promoting preparedness to address the \ngrave and serious humanitarian consequences arising from such violence, \n \nRecalling the obligations of all States and parties to an armed conflict, in \naccordance with the relevant provisions of international humanitarian law to respect \nand protect, in situations of armed conflict, medical personnel and humanitarian \npersonnel exclusively engaged in medical duties, their means of transport and \nequipment, and hospitals and other medical facilities, which must not be attacked, and \nto ensure that the wounded and sick receive, to the fullest extent practicable and with \nthe least possible delay, the medical care and attention required, and noting the \napplicable rules of international humanitarian law relating to the non\u2011punishment of \nany person for carrying out medical activities compatible with medical ethics, \n \nCommending the courage and commitment of those who take part in \nhumanitarian operations, especially national and locally recruited personnel, and \nincluding those serving with national and international non\u2011governmental \norganizations in the field, often at great personal risk and a negative impact to their \n\nStrengthening of the coordination of emergency humanitarian \nassistance of the United Nations \nA/RES/79/140\n \n7/22\n24-23459 \n \nhealth, including their mental health and psychosocial well-being, especially when \nworking in situations of armed conflict and exposed to direct violence, injury and risk \nof illness with limited access to medical and emergency facilities, and paying tribute \nto their heroic efforts, especially those who have lost their lives in the service of \nhumanity, \n \nNoting with grave concern that violence, including sexual and gender-based \nviolence, and violence against children, including sexual violence, continues to be \ndeliberately directed against civilian populations during and after humanitarian \nsituations, \n \nRecognizing that, while women and girls are disproportionately affected, men \nand boys can also be victims and/or survivors of sexual and gender-based violence,  \n \nNoting with appreciation the efforts that Member States, the United Nations and \nother relevant actors continue to make to improve the effectiveness of humanitarian \nresponse based on needs, including by strengthening humanitarian response \ncapacities, improving humanitarian coordination, identifying and integrating \nappropriate innovation into humanitarian preparedness, response and recovery, \nincreasing transparency, reducing duplication, strengthening partnerships with local \nand national responders as appropriate, enhancing flexible, predictable and adequate \nfunding and strengthening the accountability of all stakeholders, \n \nRecognizing the critical importance of continuing to enhance the capacities of \nthe United Nations humanitarian system and humanitarian organizations to reach \npeople in need of humanitarian assistance and protection, in line with humanitarian \nprinciples, \n \nRecalling that, in line with international humanitarian law, impartial \nhumanitarian organizations may offer their services to any party to armed conflict, \nand recognizing the importance of consistent engagement by humanitarian \norganizations with all parties to armed conflict for humanitarian purposes, including \nactivities aimed at ensuring respect for international humanitarian law, in accordance \nwith their mandates and in line with humanitarian principles and international \nhumanitarian law, \n \nNoting with grave concern that children and youth continue to lack education in \nsituations of complex emergencies, and emphasizing the urgent need for increased \nfinancing and more efficient delivery of quality education in humanitarian \nemergencies and for facilitating continuous and equitable access to quality education \nfor children and youth in humanitarian emergencies, including in the face of the \nongoing consequences and long-term effects of the COVID\u201119 pandemic, disasters \ncaused by natural and human-made hazards, the adverse effects of climate change and \narmed conflicts, \n \nRecognizing that, in strengthening the coordination of humanitarian assistance \nin the field, the organizations of the United Nations system should continue to consult \nand work in close coordination with national Governments, \n \nReaffirming its resolution 70/1 of 25 September 2015, entitled \u201cTransforming \nour world: the 2030 Agenda for Sustainable Development\u201d, in which it adopted a \ncomprehensive, far-reaching and people-centred set of universal and transformative \nSustainable Development Goals and targets, its commitment to working tirelessly for \nthe full implementation of the Agenda by 2030, its recognition that eradicating \npoverty in all its forms and dimensions, including extreme poverty, is the greatest \nglobal challenge and an indispensable requirement for sustainable development, its \ncommitment to achieving sustainable development in its three dimensions \u2013 \neconomic, social and environmental \u2013 in a balanced and integrated manner, and to \n\nA/RES/79/140 \nStrengthening of the coordination of emergency humanitarian \nassistance of the United Nations\n \n24-23459\n8/22 \n \nbuilding upon the achievements of the Millennium Development Goals and seeking \nto address their unfinished business, \n \nReaffirming also its resolution 69/313 of 27 July 2015 on the Addis Ababa \nAction Agenda of the Third International Conference on Financing for Development, \nwhich is an integral part of the 2030 Agenda for Sustainable Development, supports \nand complements it and helps to contextualize its means of implementation targets \nwith concrete policies and actions, \n \nReaffirming further the importance of humanitarian assistance by the United \nNations system, and welcoming the thirty-third anniversary of its resolution 46/182,  \n \n1. \nWelcomes the outcome of the twenty-seventh humanitarian affairs segment \nof the Economic and Social Council at its substantive session of 2024, 15 and also \nwelcomes the adoption of Economic and Social Council resolution 2024/8 of 27 June \n2024; \n \n2. \nRequests the Emergency Relief Coordinator to continue his efforts to \nstrengthen the coordination and accountability of humanitarian assistance and \nleadership within the United Nations humanitarian response system, including \nthrough the transformative agenda of the Inter-Agency Standing Committee, and calls \nupon relevant United Nations organizations and other relevant intergovernmental \norganizations, as well as other humanitarian and development actors, to continue to \nwork with the Office for the Coordination of Humanitarian Affairs of the Secretariat \nto enhance the coordination, effectiveness and efficiency of humanitarian assistance; \n \n3. \nAlso requests the Emergency Relief Coordinator to continue to improve \ndialogue with all Member States on the relevant processes, activities and deliberations \nof the Inter-Agency Standing Committee; \n \n4. \nEncourages Member States and the Office for the Coordination of \nHumanitarian Affairs to continue to improve dialogue and collaboration on \nhumanitarian issues, at the global and field levels, including on policy, in order to \nfoster a more consultative and inclusive approach to humanitarian assistance; \n \n5. \nWelcomes the continued efforts by the Office for the Coordination of \nHumanitarian Affairs to build partnerships with regional organizations and \nnon\u2011traditional donors and the private sector, and encourages Member States and the \nUnited Nations system to continue to strengthen partnerships at the global, regional, \nnational and local levels in support of national efforts in order to effectively cooperate \nto provide humanitarian assistance to those in need and ensure that their collaborative \nefforts adhere to the principles of neutrality, humanity, impartiality and independence; \n \n6. \nEncourages the United Nations to continue to strengthen coordination, \npreparedness and response efforts and to improve the quality and effectiveness of \nhumanitarian action, including through enhancing complementarity with and between \nrelevant stakeholders, such as affected Governments, regional organizations, donors, \ndevelopment organizations, civil society and the private sector, involved in response \nefforts to make use of their comparative advantages and resources;  \n \n7. \nEncourages Member States, the United Nations system and humanitarian \nand development organizations to continue to assess and improve, together with other \nrelevant stakeholders, including the private sector, how innovation can be more \nproactively and systematically identified and integrated into humanitarian action in a \nsustainable manner and to promote the sharing of best practices and lessons learned \non innovative tools, processes and approaches, including those from large-scale \n_______________ \n \n15 See Official Records of the General Assembly, Seventy-ninth Session, Supplement No. 3 (A/79/3), \nchap. XI. \n\nStrengthening of the coordination of emergency humanitarian \nassistance of the United Nations \nA/RES/79/140\n \n9/22\n24-23459 \n \nnatural disasters and humanitarian crises of a protracted nature, that could improve \nthe effectiveness and quality of humanitarian response, and in this regard encourages \nall relevant stakeholders to continue to support the efforts of Member States, in \nparticular developing countries, to strengthen their capacities, including through \nfacilitating access to information and communications technologies; \n \n8. \nWelcomes innovative practices that draw on the knowledge of people \naffected by humanitarian emergencies to develop locally sustainable solutions and to \nproduce life-saving items locally, with minimal logistical and infrastructure \nimplications; \n \n9. \nCalls upon the relevant organizations of the United Nations system and, as \nappropriate, other relevant humanitarian actors to continue efforts to improve the \nhumanitarian response to disasters caused by natural and human-made hazards and \ncomplex emergencies by further strengthening humanitarian response capacities at all \nlevels, by continuing to strengthen the provision and coordination of humanitarian \nassistance at the global, regional and field levels, including through existing cluster \ncoordination mechanisms and in support of national authorities of the affected State, \nas appropriate, and by further enhancing efficiency, transparency, performance and \naccountability;  \n \n10. Recognizes the benefits of engagement and coordination with relevant \nhumanitarian actors to the effectiveness of humanitarian response, and encourages the \nUnited Nations to continue to pursue efforts to strengthen partnerships at the global \nlevel with the International Red Cross and Red Crescent Movement, relevant \nhumanitarian non\u2011governmental organizations, other participants in the Inter-Agency \nStanding Committee and other relevant stakeholders; \n \n11. \nRequests the Secretary-General to continue to strengthen the support \nprovided to United Nations resident/humanitarian coordinators and to United Nations \ncountry teams, including by providing necessary training, identifying resources and \nimproving the identification of and the selection process for United Nations \nresident/humanitarian coordinators, and enhancing their performance accountability; \n \n12. Calls upon the Chair of the United Nations Sustainable Development \nGroup and the Emergency Relief Coordinator to continue to enhance their \nconsultations before presenting final recommendations on the selection process for \nresident coordinators in countries likely to require significant humanitarian response \noperations; \n \n13. Requests the United Nations to continue to strengthen its ability to recruit \nand deploy appropriately senior, skilled and experienced humanitarian staff quickly \nand flexibly, giving paramount consideration to the highest standards of efficiency, \ncompetence and integrity, while paying due regard to gender equality and to recruiting \non as wide a geographical basis as possible, and in this regard encourages the United \nNations Sustainable Development Group to continue to strengthen the resident \ncoordinator system, on which the humanitarian coordinator system is based, ensuring, \ninter alia, full implementation of the management and accountability system of the \nGroup and the resident coordinator system; \n \n14. Recognizes that diversity of humanitarian staff brings value to \nhumanitarian work and understanding of developing countries\u2019 contexts, and requests \nthe Secretary-General to address further the insufficient diversity in geographical \nrepresentation and gender balance in the composition of the humanitarian staff of the \nSecretariat and other United Nations humanitarian agencies, in particular regarding \nprofessional and high-level staff, and to report on concrete measures taken in this \nregard in his annual report; \n\nA/RES/79/140 \nStrengthening of the coordination of emergency humanitarian \nassistance of the United Nations\n \n24-23459\n10/22 \n \n \n15. Also recognizes that accountability is an integral part of effective \nhumanitarian assistance, and emphasizes the need for enhancing the accountability of \nhumanitarian actors at all stages of humanitarian assistance; \n \n16. Urges Member States to continue to give priority to efforts to prevent, \nrespond to, investigate and prosecute acts of sexual and gender-based violence in \nhumanitarian emergencies, calls upon Member States and relevant organizations to \nimprove coordination and strengthen capacity, to ensure that humanitarian relief \nintegrates prevention of, and risk mitigation for, sexual and gender-based violence \nand makes greater use of sex- and age-disaggregated data and to strengthen support \nservices for victims, survivors and others affected by such violence beginning in the \nearliest stages of emergency response, taking into account their unique and specific \nneeds resulting from the impact of such violence, and notes the Call to Action \ninitiative; \n \n17. Underscores the critical importance of protecting all persons affected by \nhumanitarian crises, in particular women and children, from any form of sexual \nexploitation and abuse, including those perpetrated by humanitarian personnel, \nwelcomes the determination of the Secretary-General to fully implement the United \nNations policy of zero tolerance for sexual exploitation and abuse and stresses that \nvictims and survivors should be at the core of such efforts, notes the six core \nprinciples relating to sexual exploitation and abuse adopted by the Inter-Agency \nStanding Committee,16 and encourages Member States to make greater efforts to \nprevent and respond to sexual exploitation and abuse and to ensure that perpetrators \nare held accountable; \n \n18. Urges Member States to continue to seek to prevent, respond to, \ninvestigate and prosecute violations and abuses against children, including \nexploitation, in humanitarian emergencies, calls upon Member States and relevant \norganizations to strengthen support services for children affected by humanitarian \nemergencies, including those who have experienced violations and abuses, and calls \nfor a more effective response in that regard, guided by the rights of the child; \n \n19. Reaffirms the importance of implementing the Sendai Framework for \nDisaster Risk Reduction 2015\u20132030 to ensure the substantial reduction of disaster \nrisk and losses in lives, livelihood and health and in the economic, physical, social, \ncultural and environmental assets of persons, businesses, communities and countries, \nand underlines the importance of tackling the underlying disaster risk drivers, of \nconsidering the impact of climate change and of integrating a disaster risk reduction \nperspective into humanitarian assistance to prevent new and reduce existing disaster \nrisk;  \n \n20. Encourages the United Nations and humanitarian organizations to enhance \nefforts to further study, prepare for, address and minimize the humanitarian \nconsequences of the adverse effects of climate change and environmental risks;  \n \n21. Calls upon Member States, the United Nations and relevant humanitarian \nand development organizations to continue to support multi-year investment, when \npossible, in preparedness, response and coordination capacities, and build the capacity \nat all levels of government, including local government, of organizations and of \ncommunities, particularly in communities exposed to disasters, to better prepare for \nhazards, reduce disaster risk and the risk of displacement within the context of \ndisasters, build resilience and better respond to and recover from and build back better \nafter disasters, and also calls upon all relevant stakeholders to complement, rather \n_______________ \n \n16 A/57/465, annex I, para. 10 (a). \n\nStrengthening of the coordination of emergency humanitarian \nassistance of the United Nations \nA/RES/79/140\n \n11/22\n24-23459 \n \nthan substitute for or displace, national capacities to respond to crises, especially \nwhere those crises are prolonged or recurrent; \n \n22. Calls upon Member States and the international community to provide \nadequate, sustainable and timely resources for disaster risk reduction, in order to build \nresilience and reduce the risk of displacement within the context of disasters, \nenvironmental degradation and climate change, including through complementary \nhumanitarian and development programming and the further strengthening of national \nand local capacities to prevent, prepare for and respond to humanitarian emergencies, \nand encourages closer cooperation between national stakeholders and humanitarian \nand development actors in this regard;  \n \n23. Urges Member States, the United Nations humanitarian system, regional \norganizations, non\u2011governmental organizations, the private sector and other \nhumanitarian actors to reinforce preparedness and response capabilities in relation to \nthose outbreaks of infectious disease that trigger or exacerbate a humanitarian crisis, \nincluding by fully implementing the International Health Regulations (2005), and \ncalls upon the United Nations humanitarian system and humanitarian organizations to \nrespond rapidly, based on the level 3 activation procedure for infectious disease events \nin humanitarian contexts, in close coordination with affected States; \n \n24. Calls upon Member States, the United Nations and humanitarian \norganizations and relevant stakeholders to scale up systematic prevention, \npreparedness and response to health emergencies in humanitarian contexts, and to \ndraw on lessons learned from the COVID\u201119 pandemic, including from the \nstrengthening of national, regional and multilateral approaches and international \ncooperation, such as the Access to COVID\u201119 Tools Accelerator (ACT\u2011A) and its \nCOVAX Facility, and other relevant initiatives in order to enable the fair, equitable, \ntimely and affordable access to safe, quality and effective COVID\u201119 vaccines, testing \nand treatment to prevent and contain transmission as countries transition to pandemic \nrecovery, while also noting the importance of inclusive national vaccination \nprogrammes covering internally displaced persons, migrants and refugees, and \nencourages United Nations agencies and other relevant stakeholders to support \nMember States, including refugee-hosting countries and countries of origin, in full \ncoordination with their national government, and takes note of the political \ndeclarations on pandemic prevention, preparedness and response, on universal health \ncoverage and on the fight against tuberculosis adopted at the respective high-level \nmeetings of the General Assembly held in New York in September 2023, as well as \nGeneral Assembly resolutions on the control and elimination of malaria;  \n \n25. Calls upon Member States, the United Nations and other relevant \norganizations, as appropriate, to address non\u2011communicable diseases and their risk \nfactors and to treat people living with them in humanitarian emergencies; \n \n26. Encourages closer cooperation between development and humanitarian \nactors, in coordination with Member States, to ensure that all relevant actors work \ntogether, in accordance with their mandates, towards common results with the aim of \nreducing need, vulnerability and risk over multiple years, based on shared \nunderstanding of the context and each actor\u2019s operational strengths, in support of \nnational priorities, while fully respecting the humanitarian principles for \nhumanitarian action; \n \n27. Encourages humanitarian and development actors to pursue, where \nappropriate, common risk-management and resilience objectives, achievable through \njoint analysis and multi-year programming and planning cycles; \n \n28. Encourages the United Nations system, humanitarian organizations and \ndevelopment organizations to continue their efforts to mainstream preparedness, early \n\nA/RES/79/140 \nStrengthening of the coordination of emergency humanitarian \nassistance of the United Nations\n \n24-23459\n12/22 \n \naction and early recovery into their programming, acknowledges that preparedness, \nearly action and early recovery should receive further funding, and in this regard \nencourages the provision of timely, flexible, predictable and adequate resources, \nincluding from both humanitarian and development budgets, as appropriate; \n \n29. Calls upon Member States, the United Nations, humanitarian and \ndevelopment organizations and other relevant actors to urgently and effectively \nrespond to, prevent and prepare for rising global food insecurity affecting millions of \npeople, especially those who are facing famine or the immediate risk of famine, \nincluding by enhancing humanitarian and development cooperation and providing \nurgent funding to respond to the needs of the affected population, and calls upon \nMember States and parties to armed conflicts to ensure safe and unhindered \nhumanitarian access to civilians in need and to respect international humanitarian law; \n \n30. Calls upon Member States, parties to armed conflict, the United Nations \nand other humanitarian and development actors, international financial institutions \nand other relevant actors to urgently increase their measures to prevent famine and to \nreduce and address acute food insecurity and malnutrition, and also urges Member \nStates, the United Nations and other relevant organizations to take further steps to \nprovide a coordinated emergency response to the food and nutrition needs of affected \npopulations, while aiming to ensure that such steps are supportive of national \nstrategies and programmes aimed at improving food security and nutrition; \n \n31. Calls upon Member States, parties to armed conflict, the United Nations, \nhumanitarian and development organizations, international financial institutions and \nother relevant actors to urgently increase their measures to prevent famine and to \nreduce and address acute food insecurity and malnutrition, which is compounded by \nthe effects of the COVID\u201119 pandemic, and effectively respond to, prevent and \nprepare for rising global food insecurity affecting millions of people, especially those \nwho are facing famine or the immediate risk of famine, including by enhancing \nhumanitarian and development cooperation and providing urgent funding to respond \nto the needs of the affected population, supported by multisector early warning and \nanalysis; and stresses the need to address food insecurity and malnutrition, including \nthrough: respect for international humanitarian law, investing in gender-sensitive \nhumanitarian assistance and protection, livelihoods, climate adaptation and \nmitigation, health, water, sanitation and hygiene, nutrition, sustainable food systems, \naccess to healthy diets, energy, poverty reduction, and addressing inequalities, \nincluding gender inequality, and providing for the peaceful resolution of armed \nconflict, and encourages strengthening efforts to empower rural women as essential \nactors in achieving food security and improved nutrition, as well as to prevent and \nrespond to negative coping mechanisms, recognizing their disproportionate impact on \nwomen and children; and calls upon Member States and parties to armed conflicts to \nrespect international humanitarian law and ensure safe and unhindered humanitarian \naccess; \n \n32. Strongly condemns the use of starvation of civilians as a method of \nwarfare, including by attacking, destroying, removing or rendering useless objects \nindispensable to the survival of the civilian population, which is prohibited by \ninternational humanitarian law, urges all parties to armed conflict to protect civilian \ninfrastructure, which is critical to the provision of essential services and the delivery \nof humanitarian aid to the civilian population, and the functioning of agrifood systems \nand markets in situations of armed conflict, and also urges all parties to armed \nconflicts to ensure and facilitate safe and unhindered humanitarian access to civilians \nin need;  \n \n33. Expresses concern about the challenges related to, inter alia, safe access \nto and use of fuel, firewood, alternative energy, water and sanitation, shelter and food \n\nStrengthening of the coordination of emergency humanitarian \nassistance of the United Nations \nA/RES/79/140\n \n13/22\n24-23459 \n \nand healthcare services, including mental health and psychosocial services, in \nhumanitarian emergencies, and notes with appreciation initiatives at the national and \ninternational levels, including those that systematically identify and integrate \ninnovative approaches and share best practices, that promote effective cooperation in \nthis regard; \n \n34. Encourages the international community, including relevant United \nNations organizations and the International Federation of Red Cross and Red Crescent \nSocieties, to support efforts of Member States aimed at strengthening their capacity \nto prepare for and respond to disasters and to support efforts, as appropriate, to \nstrengthen systems, especially early warning systems, for identifying and monitoring \ndisaster risk, including vulnerability to natural hazards, and especially to substantially \nincrease the availability of and access to multi-hazard early warning systems in \ncommunities and countries exposed to natural hazards and environmental degradation \nto enable effective early action, including through the Secretary-General\u2019s Early \nWarnings for All initiative to ensure that every person on the planet is protected by \nearly warning systems by 2027;  \n \n35. Welcomes the growing number of Member States and regional \norganizations that have taken steps to promote the implementation of the Guidelines \nfor the Domestic Facilitation and Regulation of International Disaster Relief and \nInitial Recovery Assistance, encourages others to do so, as appropriate, and welcomes \nthe valuable support that national Red Cross and Red Crescent societies are providing \nto their Governments in this area, in collaboration with the International Federation \nof Red Cross and Red Crescent Societies, the Office for the Coordination of \nHumanitarian Affairs and other partners; \n \n36. Encourages States to create an enabling environment for the capacity-\nbuilding of local authorities and of national and local non\u2011governmental and \ncommunity-based organizations in order to ensure better preparedness in providing \ntimely, effective and predictable assistance, and encourages the United Nations and \nother relevant organizations to provide support to such efforts, including, as \nappropriate, under the Common Framework for Preparedness of the Inter-Agency \nStanding Committee, the United Nations Sustainable Development Group and the \nUnited Nations Office for Disaster Risk Reduction, through the transfer of technology, \non mutually agreed terms, and expertise to developing countries and through support \nto enhance the coordination capacities and build capacity in science and technology \nof affected States; \n \n37. Recognizes the increase in the number and scale of disasters, including \nthose related to the adverse effects of climate change, which in certain instances may \ncontribute to displacement and to additional pressure on host communities, \nencourages Member States, the United Nations and relevant organizations and actors \nto further strengthen the efforts aimed at addressing the needs of persons displaced \nwithin the context of disasters, including those induced by climate change, and notes \nin this regard the importance of sharing best practices to prevent and prepare for such \ndisplacements; \n \n38. Calls upon Member States, the United Nations and humanitarian \norganizations to provide emergency assistance in ways that are supportive of recovery \nand long-term development, where appropriate, including through multi-year funding \nand prioritizing humanitarian tools that strengthen resilience, such as, but not limited \nto, cash-based transfers, local procurement of food and services, including for school \nfeeding programmes, and social safety nets; \n \n39. Encourages Member States and the United Nations funds and programmes \nand the specialized agencies to respond more effectively to needs in humanitarian \n\nA/RES/79/140 \nStrengthening of the coordination of emergency humanitarian \nassistance of the United Nations\n \n24-23459\n14/22 \n \ncontexts by, inter alia, scaling up social protection policies and cash assistance, where \nfeasible, including multipurpose cash programming, as appropriate, to offer affected \npeople flexibility on how to meet their humanitarian needs, and to support the \ndevelopment of local markets and strengthen national and local capacities, and in this \nregard calls upon the United Nations humanitarian organizations to continue building \ntheir capacity to systematically consider cash assistance, alongside other forms of \nhumanitarian assistance, and takes note of efforts by the United Nations system, \nincluding moving towards a cash coordination model to increase effectiveness, \nefficiency, predictability and accountability of cash operations to provide \nmultipurpose cash assistance for food, non\u2011food items and access to services and other \nsupport; \n \n40. Encourages Member States, the United Nations system and other relevant \norganizations to improve, where possible, fast and flexible financing for \npreparedness, early action, early response and early recovery, and in this regard \nencourages exploring, developing and, where appropriate, the strengthening of \ninnovative and anticipatory mechanisms and approaches, such as forecast-based \nfinancing and disaster risk insurance, to reduce the impact of disasters and address \nhumanitarian needs; \n \n41. Encourages States, as well as the United Nations, and humanitarian \norganizations, in accordance with their respective mandates and in line with \nhumanitarian principles, learning from the COVID\u201119 pandemic experience, to \ncontinue to scale up anticipatory approaches, early warning early action systems, \nforecasting, prevention-oriented responses and emergency preparedness, and improve \npredictive and risk data analytics across sectors, reinforce systematic risk monitoring, \nearly warning and preparedness capacities at local, national, regional and global \nlevels, including, inter alia, those associated with health risks and disease outbreaks, \nand takes note of the relevant United Nations frameworks and initiatives related to \nhealth emergency preparedness;  \n \n42. Takes note of the efforts of Member States, the United Nations system and \nthe international community to strengthen preparedness and local, national and \nregional humanitarian response capacity, including, as appropriate, through the \ntransfer of technology on mutually agreed terms and expertise to developing \ncountries, calls upon the United Nations and relevant partners to support capacity-\nbuilding of Member States and encourages Member States to create and strengthen an \nenabling environment for the capacity-building of their national and local authorities, \nnational societies of the International Red Cross and Red Crescent Movement and \nnational and local non\u2011governmental and community-based organizations in \nproviding timely humanitarian assistance, and calls further upon Member States to \ncontinue to provide funding to humanitarian country-based and regional pooled funds; \n \n43. Encourages Member States, and calls upon relevant humanitarian \norganizations, to work closely with national institutions, including local governments \nand the private sector, as appropriate, to examine effective, context-specific ways to \nbe better prepared for, respond to and recover from increasing emergencies in urban \nareas, which may have an impact on the provision of such life-saving essential \nservices as water, energy and healthcare; \n \n44. Reaffirms the right to education for all and the importance of ensuring safe \nenabling learning environments in humanitarian emergencies, as well as quality \neducation at all levels, including for girls, including technical and vocational training \nopportunities, where possible, including through adequate funding and infrastructural \ninvestments, for the well-being of all, in this regard recognizes that access to quality \neducation in humanitarian emergencies can contribute to long-term development \ngoals and reiterates the need to protect and respect educational facilities in accordance \n\nStrengthening of the coordination of emergency humanitarian \nassistance of the United Nations \nA/RES/79/140\n \n15/22\n24-23459 \n \nwith international humanitarian law, strongly condemns all attacks directed against \nschools and the use of schools for military purposes, when in contravention of \ninternational humanitarian law, and encourages efforts to promote safe and protective \nschool environments in humanitarian emergencies; \n \n45. Urges Member States, the United Nations and relevant humanitarian actors \nto scale up support for humanitarian programming and response for safe, inclusive, \nequitable and quality education at all levels and ages, in order to mitigate the direct \nand indirect impacts from the closure of schools and other educational institutions \ndue to the COVID\u201119 pandemic, among other causes, in order to help to ensure the \ncontinuation of education services, particularly for women and children, especially \ngirls;  \n \n46. Calls upon the Office for the Coordination of Humanitarian Affairs and \nother United Nations organizations to continue to work with Member States and \nrelevant United Nations entities to facilitate the exchange of updated, accurate and \nreliable information, including through mutually comprehensible, disaggregated and \nharmonized data, to ensure better assessment and analysis of needs in order to \nimprove preparedness and humanitarian response; \n \n47. Calls upon relevant United Nations organizations to support the \nimprovement of the humanitarian programme cycle, including the development of \ncoordinated and comprehensive needs assessment tools, such as multisector initial \nrapid assessments, the implementation of joint, impartial and timely needs \nassessments and prioritized needs-based humanitarian response plans, in consultation \nwith the affected States, in order to strengthen the coordination of humanitarian action \nto meet the needs of people affected by humanitarian emergencies; \n \n48. Encourages Member States to commit and to disburse in a timely fashion \nhumanitarian funding based on, and in accordance with, the humanitarian appeals \nbrought forward by the United Nations; \n \n49. Encourages Member States and relevant United Nations organizations to \nexplore innovative risk-sharing mechanisms and to base risk management funding on \nobjective data; \n \n50. Encourages United Nations and humanitarian organizations to further \nadvance efficiencies in delivering assistance through reducing management costs, \nharmonizing partnership agreements, providing transparent and comparable cost \nstructures, and strengthening measures to achieve greater accountability by taking \nfurther actions to reduce fraud, waste and abuse and identify ways to share incident \nreports and other information among United Nations agencies, where appropriate; \n \n51. Requests Member States, relevant humanitarian organizations of the \nUnited Nations system and other relevant humanitarian actors to promote gender \nequality and the empowerment of women in all stages of humanitarian response, to \ntake measures to ensure the full participation of women, girls, men and boys, \nincluding persons with disabilities and older persons, in all stages of decision-making, \nas appropriate, in order to, inter alia, reduce gender inequalities and ensure that \nhumanitarian assistance is informed, adapted, appropriate and effective, and to take \ninto account the specific needs, vulnerabilities and capacities of women, girls, men \nand boys, taking into consideration age and disability, in the design of needs \nassessments and the implementation of all programming, including by seeking to \nensure the provision of access to the full range of medical, legal and psychosocial and \nlivelihood services, without discrimination, and in this regard encourages efforts to \nensure gender mainstreaming, including in the collection and analysis of \ndisaggregated data, in the analysis of allocations and programme implementation, and \nthrough greater use of the Gender with Age Marker; \n\nA/RES/79/140 \nStrengthening of the coordination of emergency humanitarian \nassistance of the United Nations\n \n24-23459\n16/22 \n \n \n52. Recognizes the important role that women can play as first responders, and \nencourages Member States, the United Nations and other relevant humanitarian \norganizations to support women\u2019s leadership and meaningful participation in the \nplanning and implementation of response strategies, including by strengthening \npartnerships and building the capacities of national and local institutions, including \nnational and local women\u2019s organizations, women-led organizations and other civil \nsociety actors, as appropriate; \n \n53. Calls upon Member States, relevant humanitarian organizations of the \nUnited Nations system and other relevant humanitarian actors to ensure \nnon\u2011discrimination and opportunities for persons with disabilities to participate on an \nequal basis with others in humanitarian preparedness and response; \n \n54. Calls upon the United Nations and humanitarian and development \norganizations, in coordination with Member States, to engage all people affected by \ndisasters and crises, in particular those most at risk, including through \ncommunication, enabling their participation in relevant processes and supporting their \nefforts and capacities to meet their different needs, while taking into account, as \nappropriate, their culture, traditions and local customs; \n \n55. Calls upon United Nations humanitarian organizations, in consultation \nwith Member States, as appropriate, to strengthen the evidence base for humanitarian \nassistance by further developing common mechanisms and methodologies for \nimproving the quality, transparency, reliability, compatibility and comparability of \ncommon humanitarian needs assessments, needs data and analysis, including through \nimproved collection, analysis and reporting of data disaggregated by sex, age and \ndisability and taking into account environmental impact, to assess their performance \nin assistance and to ensure the most effective use of humanitarian resources by those \norganizations; \n \n56. Calls upon the United Nations and its humanitarian partners to enhance \naccountability to Member States, including affected States, and all other stakeholders, \nincluding local governments, relevant local organizations and other actors, as well as \naffected populations, and to further strengthen humanitarian response efforts, \nincluding by monitoring and evaluating the provision and impact of their \nhumanitarian assistance, incorporating lessons learned into programming and \nconsulting with the affected populations in the planning and implementation of \nhumanitarian assistance, and making greater efforts in this regard, including by \nsharing timely and relevant information and enhancing affected community \nengagement and feedback mechanisms, so that their needs are appropriately assessed \nand effectively addressed; \n \n57. Calls upon Member States, the United Nations and humanitarian \norganizations to identify better ways of working to address the increasing capacity \nand resource gap, in order to effectively meet the needs of affected populations, \nincluding by harmonizing and, where possible, simplifying reporting requirements, \nincreasing the flexibility of humanitarian funding, including through reduced \nearmarking and further minimizing the duplication of costs, and making more use of \ninnovation in humanitarian response; \n \n58. Calls upon Member States and other relevant stakeholders to heed the \nurgency of humanitarian appeals brought forward by the United Nations and to \nmobilize resources to support humanitarian response plans, and also calls upon donors \nto provide adequate, timely, predictable and flexible resources, based on and in \nproportion to assessed needs, and to mobilize support for addressing underfunded and \nforgotten emergencies, to consider providing early and multi-year commitments to \npooled humanitarian funds, including the Central Emergency Response Fund and \n\nStrengthening of the coordination of emergency humanitarian \nassistance of the United Nations \nA/RES/79/140\n \n17/22\n24-23459 \n \ncountry-based and regional pooled funds, and to continue to support diverse \nhumanitarian funding channels, including through new and innovative financing \nmechanisms, encourages efforts to follow the Principles and Good Practice of \nHumanitarian Donorship17 and to improve burden-sharing among donors, and in this \nrespect further stresses the importance of broadening both public and private sector \npartnerships and the donor base in order to increase the predictability and \neffectiveness of funding, diversify income, narrow the humanitarian funding gap, and \nto promote South-South and horizontal and triangular cooperation globally and \nencourages the private sector, civil society and other relevant entities to make relevant \ncontributions, complementary to all other sources;  \n \n59. Calls upon Member States to follow through on their respective \ncommitments in the Pact for the Future18 with relation to significantly increasing \nfinancial and other forms of support to countries and communities facing \nhumanitarian emergencies, including host communities, inter alia by scaling up timely \nand predictable funding and innovative and anticipatory financing mechanisms, as \nwell as by strengthening partnerships with international financial institutions in order \nto prevent, reduce and respond to humanitarian suffering and assist those in need; and, \nin addition, encourages Member States to consider, where possible, a voluntary \nfinancial target for their humanitarian aid to support people affected by humanitarian \nemergencies; \n \n60. Welcomes the important achievements of the Central Emergency Response \nFund in ensuring a more timely, and predictable response to humanitarian \nemergencies, stresses the importance of continuing to improve the functioning of the \nFund, and in this regard encourages the United Nations funds and programmes and \nthe specialized agencies to review and evaluate, where necessary, their partnership \npolicies and practices in order to ensure the timely disbursement of funds from the \nFund to implementing partners in order to ensure that resources are used in the most \nefficient, effective, accountable and transparent manner possible; \n \n61. Calls upon all Member States, and invites the private sector and all \nconcerned individuals and institutions, to consider increasing their voluntary \ncontributions, including, where appropriate, through multi-year funding, to the \nCentral Emergency Response Fund in order to achieve an annual funding level of \n1 billion United States dollars and encourages consideration of accelerated efforts to \nachieve the 1 billion dollar annual funding level by 2025, marking the twentieth \nanniversary of the Fund, and to continue to reinforce and strengthen the Fund as the \nglobal emergency response fund, and emphasizes the need to broaden and diversify \nthe income base of the Fund and that contributions should be additional to current \ncommitments to humanitarian programming and should not be to the detriment of \nresources made available for international cooperation for development; \n \n62. Calls upon Member States to continue to increase support to the Central \nEmergency Response Fund and humanitarian country-based and regional pooled \nfunds for strengthening early and rapid response to mitigate the impact of disasters, \nincluding in underfunded contexts and increasingly through local and national \nresponders and implementing partners;  \n \n63. Encourages Member States, the private sector and all relevant individuals \nand institutions to consider increasing their voluntary contributions to country-based \npooled funds and, as appropriate, other pooled funding mechanisms, to facilitate \nhumanitarian assistance to people in need; \n_______________ \n \n17 A/58/99-E/2003/94, annex II. \n \n18 Resolution 79/1. \n\nA/RES/79/140 \nStrengthening of the coordination of emergency humanitarian \nassistance of the United Nations\n \n24-23459\n18/22 \n \n \n64. Calls upon Member States that are in a position to do so and development \nand humanitarian partners, in their efforts to provide flexible resources, to consider \nways of better mainstreaming the need for preparedness and building resilience in the \nprovision of humanitarian and development assistance, including reconstruction and \nrehabilitation, inter alia, with a view to ensuring smooth transition from relief to \ndevelopment, and encourages the United Nations system to strengthen strategic and \noperational partnerships with international financial institutions in order to prevent, \nreduce and respond to humanitarian suffering and assist those in need, strengthen \nearly recovery efforts, reinforce basic services and reinforce rehabilitation and \nreconstruction efforts; \n \n65. Calls upon all Member States that are in a position to do so to increase \ntheir voluntary contributions to humanitarian emergencies, including through \nflexible, unearmarked and multi-year funding where possible, in this context \nreiterates that the Office for the Coordination of Humanitarian Affairs should benefit \nfrom adequate and more predictable funding, and underscores the importance of \nadequate, timely and flexible voluntary funding for the Office to enable it to carry out \nits mandate; \n \n66. Encourages Member States, in cooperation with relevant United Nations \nhumanitarian organizations, to ensure that the basic humanitarian needs of affected \npopulations, including clean water, food, shelter, health, including sexual and \nreproductive health, education and protection, energy and information and \ncommunications technologies, where possible, are addressed as components of \nhumanitarian response, including through providing timely and adequate resources, \nwhile ensuring that their collaborative efforts fully adhere to humanitarian principles; \n \n67. Also encourages Member States, in cooperation with relevant United \nNations humanitarian organizations, to ensure that women and girls have access to \nbasic healthcare services, including reliable and safe access to sexual and \nreproductive healthcare services and mental health and psychosocial support, from \nthe onset of emergencies, in this regard recognizes that such assistance protects \nwomen, adolescent girls and infants from preventable mortality and morbidity that \noccur in humanitarian emergencies, and calls upon Member States, the United Nations \nand other relevant actors to give such programmes due consideration; \n \n68. Urges Member States and humanitarian organizations to integrate \nprotection and health risks, as components of humanitarian response, into \nhumanitarian assessment, planning, implementation, monitoring and evaluation, and \nincrease efforts to reinforce local and national systems, capacities and local \ncommunities and actors, including women-led organizations;  \n \n69. Urges Member States, the United Nations and humanitarian organizations \nto increase efforts to provide and fund cross-sectoral mental health and psychosocial \nsupport services that are of quality, contextually sensitive, gender-sensitive, and \nprovided with respect for human rights, to ensure that such services are incorporated \ninto humanitarian needs assessments and humanitarian programmes for preparedness, \nresponse and recovery, to meet the needs of all affected populations in humanitarian \ncontexts, and to reinforce local and community-based efforts, which will be all the \nmore important in mitigating and responding to additional psychological \nconsequences experienced in the context of the COVID\u201119 pandemic, and calls on the \nUnited Nations and all relevant humanitarian organizations to scale up mental health \nand psychosocial support capacity accordingly, and report on mental health and \npsychosocial support programmes and funding in support of the recovery and \nresilience for the mental health and psychosocial well-being of all those affected, \nwhile also recognizing the impacts on humanitarian personnel and volunteers;  \n\nStrengthening of the coordination of emergency humanitarian \nassistance of the United Nations \nA/RES/79/140\n \n19/22\n24-23459 \n \n \n70. Encourages Member States, the United Nations and humanitarian \norganizations to continue to work together to understand and address the different \nprotection needs of affected populations, particularly the most vulnerable, in \nhumanitarian crises and ensure that these needs are adequately integrated into \npreparedness, response and recovery efforts; \n \n71. Calls upon Member States and relevant organizations and actors to \nrecognize and address the consequences of humanitarian emergencies for migrants, \nin particular those in vulnerable situations, and to strengthen coordinated international \nefforts for their assistance and protection in concert with national authorities; \n \n72. Calls upon Member States to take steps to ensure the international \nprotection of and respect for the rights of refugees, including respect for the principle \nof non\u2011refoulement and adequate standards of treatment in accordance with \ninternational law, including, as applicable, the 1951 Convention relating to the Status \nof Refugees19 and international human rights obligations; \n \n73. Recognizes the importance of early registration and effective registration \nsystems as a tool of protection and as a means of carrying out the quantification and \nassessment of needs for the provision and distribution of humanitarian assistance, \nnotes the many and diverse challenges faced by refugees who remain without any \nform of documentation attesting to their status, and underlines the importance of \nincreasing accountability to ensure that humanitarian assistance reaches its \nbeneficiaries; \n \n74. Reaffirms the obligation of all States and parties to an armed conflict to \nprotect civilians, in accordance with international humanitarian law, encourages \nStates that are parties to an armed conflict to take all measures necessary to enhance \nthe protection of civilians, and invites all States to promote a culture of protection, \ntaking into account the particular needs of women, girls, boys and men, older persons \nand persons with disabilities; \n \n75. Urges all parties to comply with their obligations under international \nhumanitarian law, in particular the principles of distinction, proportionality and the \nobligation to take all feasible precautions to avoid and in any event minimizing harm \nto civilians and civilian objects; \n \n76. Urges Member States to continue to take the steps necessary to ensure the \nprotection of the wounded and sick, as well as the safety and security of medical \npersonnel and humanitarian personnel exclusively engaged in medical duties, their \nfacilities, equipment, transports and supplies, including by developing effective \nmeasures to prevent and address acts of violence, attacks and threats against them, \nand in this regard reaffirms the need for States to ensure that those responsible for \nviolations of international humanitarian law do not operate with impunity, urges \nStates to conduct full, prompt, impartial and effective investigations within their \njurisdiction of violations of international humanitarian law with a view to ensuring \naccountability, as provided for by national laws and obligations under international \nlaw, and to ensure that the wounded and sick receive, to the fullest extent practicable \nand with the least possible delay, the medical care and attention required, and notes \nthe applicable rules of international humanitarian law relating to the non\u2011punishment \nof any person for carrying out medical activities compatible with medical ethics; \n \n77. Condemns in the strongest possible terms the alarming increase in threats \nto and deliberate targeting of humanitarian and medical personnel and United Nations \nand associated personnel; \n_______________ \n \n19 United Nations, Treaty Series, vol. 189, No. 2545. \n\nA/RES/79/140 \nStrengthening of the coordination of emergency humanitarian \nassistance of the United Nations\n \n24-23459\n20/22 \n \n \n78. Urges Member States to continue to take the steps necessary to ensure the \nsafety and security of humanitarian personnel, their facilities, equipment, transports \nand supplies, including by developing effective measures to prevent and address acts \nof violence, attacks and threats against them, requests the Secretary-General to \nexpedite his efforts to enhance the safety and security of personnel involved in United \nNations humanitarian operations, including national and locally recruited personnel, \nand in this regard reaffirms the need for States to ensure that those responsible for \nviolations of international humanitarian law do not operate with impunity, urges \nStates to conduct full, prompt, impartial and effective investigations within their \njurisdiction of violations of international humanitarian law with a view to ensuring \naccountability, as provided for by national laws and obligations under international \nlaw, and urges Member States to scale up their efforts to ensure the safety and security \nof humanitarian personnel; \n \n79. Emphasizes the responsibility of States to adopt preventive measures and \neffective responses to acts of violence committed against civilian populations in \narmed conflicts and to comply with the relevant obligations under international law \nto end impunity and to ensure that those responsible for violations are promptly \nbrought to justice, in accordance with national law and their obligations under \ninternational law, including those violations involving attacks against humanitarian \npersonnel and United Nations and associated personnel, and to strengthen \ninternational cooperation in this regard; \n \n80. Calls upon all States and parties in complex humanitarian emergencies, in \nparticular in armed conflict and in post-conflict situations, in countries in which \nhumanitarian personnel are operating, in conformity with the relevant provisions of \ninternational law and national laws, to cooperate fully with the United Nations and \nother humanitarian agencies and organizations and to ensure the safe and unhindered \naccess of humanitarian and medical personnel, as well as their means of transport, \nsupplies and equipment, and to support, facilitate and enable transportation and \nlogistical supply lines, including to simplify and expedite procedures for the entry \nand deployment of medical and humanitarian personnel, goods and services, and \nremove impediments to such access, in order to allow such personnel to efficiently \nand safely perform their task of assisting affected civilian populations, including \nrefugees and internally displaced persons, and in this regard also reaffirms the need \nto take the measures necessary to respect and protect such personnel, hospitals and \nother medical facilities, as well as their means of transport, supplies and equipment; \nand urges all parties to armed conflicts, consistent with international humanitarian \nlaw, to protect civilian objects which is critical to the delivery of humanitarian \nassistance for the provision of essential services, including for vaccinations and \nrelated medical care;  \n \n81. Strongly condemns the unlawful denial of humanitarian access and \ndepriving civilians of objects indispensable to their survival, including wilfully \nimpeding relief supplies and access for responses to conflict-induced food insecurity \nin situations of armed conflict, which may constitute a violation of international \nhumanitarian law; \n \n82. Urges States, while undertaking counter-terrorism activities, to respect \ntheir international obligations, including whenever international humanitarian law is \napplicable, in particular regarding the provision of humanitarian assistance to civilian \npopulations, as well as recognizes the key role humanitarian organizations play in the \nprovision of principled humanitarian assistance, while also recognizing the \nimportance of preventing and suppressing the financing of and other forms of support \nto terrorism; \n\nStrengthening of the coordination of emergency humanitarian \nassistance of the United Nations \nA/RES/79/140\n \n21/22\n24-23459 \n \n \n83. Recognizes the Guiding Principles on Internal Displacement20 as an \nimportant international framework for the protection of internally displaced persons, \nand that forced displacement is not only a humanitarian but also a development \nchallenge, encourages Member States and humanitarian agencies to continue to work \ntogether, in collaboration with host communities, in endeavours to provide a more \npredictable response to the needs of internally displaced persons and in particular to \naddress the long-term nature of displacement by adopting and implementing long-\nterm strategies and coherent multi-year planning, including in relation to issues such \nas livelihoods, and in this regard calls for continued and enhanced international \nsupport, upon request, for the capacity-building efforts of States and encourages \nhumanitarian organizations to improve coordination, including with development \norganizations, to better address the needs of internally displaced persons in support \nof Member States to promote durable solutions; \n \n84. Notes with appreciation the report of the Secretary-General\u2019s High-level \nPanel on Internal Displacement, acknowledges that increased efforts on addressing \nthe root causes as well as prevention, protection and improved assistance to internally \ndisplaced persons and durable solutions for internal displacement are critically \nimportant, and encourages the Secretary-General to work with Member States, the \nUnited Nations system and relevant actors, as appropriate, on these efforts, and \nrecognizes the importance of the Secretary-General\u2019s follow-up Action Agenda on \nInternal Displacement; \n \n85. Welcomes the progress made towards further enhancing the security \nmanagement system of the United Nations, and supports the approach taken by the \nSecretary-General to focus the efforts of the security management system on enabling \nthe United Nations system to \u201cstay and deliver\u201d its most critical programmes even in \nhigh-risk environments by effectively managing the risks to which personnel are \nexposed, including in the provision of humanitarian assistance, and to adapt quickly \nto changes in local security conditions; \n \n86. Expresses concern about the increasing threat of disinformation \ncampaigns, misinformation, incitement to violence, and hate speech targeting \nhumanitarian personnel, as well as the increase in malicious information and \ncommunication technologies activities, including data breaches and information \noperations, that target humanitarian organizations, disrupt their relief operations, \nundermine trust in the United Nations and humanitarian organizations, threaten the \nsafety and security of humanitarian personnel and United Nations and associated \npersonnel, including national and locally recruited personnel, their premises and \nassets, and ultimately their access and ability to carry out humanitarian activities, and \nencourages Member States and the United Nations system to take appropriate action \nto address these threats;  \n \n87. Encourages the United Nations and other relevant humanitarian actors to \ninclude, as part of their risk management strategy, the building of good relations and \ntrust with national and local governments and to promote acceptance by local \ncommunities and all relevant actors, including religious leaders where appropriate, in \norder to enable humanitarian assistance to be provided in accordance with \nhumanitarian principles; \n \n88. Requests the Secretary-General to report on actions taken to enable the \nUnited Nations to continue to strengthen its ability to recruit and deploy staff quickly, \neffectively and flexibly, to procure emergency relief materials and services rapidly, \ncost-effectively and locally, where applicable, and to quickly disburse funds in order \n_______________ \n \n20 E/CN.4/1998/53/Add.2, annex. \n\nA/RES/79/140 \nStrengthening of the coordination of emergency humanitarian \nassistance of the United Nations\n \n24-23459\n22/22 \n \nto support Governments and United Nations country teams in the coordination of \ninternational humanitarian assistance; \n \n89. Urges all countries to integrate into their respective national policies and \ndevelopment frameworks the 2030 Agenda for Sustainable Development, 21 and urges \nMember States, the United Nations and relevant stakeholders to work together to \nreduce the needs and build the resilience of the most vulnerable in order to contribute \nto the achievement of the Goals included in the 2030 Agenda, including the call to \nleave no one behind; \n \n90. Requests the Secretary-General to report to the General Assembly at its \neightieth session, through the Economic and Social Council at its 2025 session, on \nprogress made in strengthening the coordination of emergency humanitarian \nassistance of the United Nations, and to submit a report to the Assembly on the \ndetailed use of the Central Emergency Response Fund.  \n \n50th plenary meeting \n9 December 2024 \n \n_______________ \n \n21 Resolution 70/1. \n",
  "paragraphs": {
    "1": "Welcomes the outcome of the twenty-seventh humanitarian affairs segment of the Economic and Social Council at its substantive session of 2024, 15 and also welcomes the adoption of Economic and Social Council resolution 2024/8 of 27 June 2024;",
    "2": "Requests the Emergency Relief Coordinator to continue his efforts to strengthen the coordination and accountability of humanitarian assistance and leadership within the United Nations humanitarian response system, including through the transformative agenda of the Inter-Agency Standing Committee, and calls upon relevant United Nations organizations and other relevant intergovernmental organizations, as well as other humanitarian and development actors, to continue to work with the Office for the Coordination of Humanitarian Affairs of the Secretariat to enhance the coordination, effectiveness and efficiency of humanitarian assistance;",
    "3": "Also requests the Emergency Relief Coordinator to continue to improve dialogue with all Member States on the relevant processes, activities and deliberations of the Inter-Agency Standing Committee;",
    "4": "Encourages Member States and the Office for the Coordination of Humanitarian Affairs to continue to improve dialogue and collaboration on humanitarian issues, at the global and field levels, including on policy, in order to foster a more consultative and inclusive approach to humanitarian assistance;",
    "5": "Welcomes the continued efforts by the Office for the Coordination of Humanitarian Affairs to build partnerships with regional organizations and non\u2011traditional donors and the private sector, and encourages Member States and the United Nations system to continue to strengthen partnerships at the global, regional, national and local levels in support of national efforts in order to effectively cooperate to provide humanitarian assistance to those in need and ensure that their collaborative efforts adhere to the principles of neutrality, humanity, impartiality and independence;",
    "6": "Encourages the United Nations to continue to strengthen coordination, preparedness and response efforts and to improve the quality and effectiveness of humanitarian action, including through enhancing complementarity with and between relevant stakeholders, such as affected Governments, regional organizations, donors, development organizations, civil society and the private sector, involved in response efforts to make use of their comparative advantages and resources;",
    "7": "Encourages Member States, the United Nations system and humanitarian and development organizations to continue to assess and improve, together with other relevant stakeholders, including the private sector, how innovation can be more proactively and systematically identified and integrated into humanitarian action in a sustainable manner and to promote the sharing of best practices and lessons learned on innovative tools, processes and approaches, including those from large-scale natural disasters and humanitarian crises of a protracted nature, that could improve the effectiveness and quality of humanitarian response, and in this regard encourages all relevant stakeholders to continue to support the efforts of Member States, in particular developing countries, to strengthen their capacities, including through facilitating access to information and communications technologies;",
    "8": "Welcomes innovative practices that draw on the knowledge of people affected by humanitarian emergencies to develop locally sustainable solutions and to produce life-saving items locally, with minimal logistical and infrastructure implications;",
    "9": "Calls upon the relevant organizations of the United Nations system and, as appropriate, other relevant humanitarian actors to continue efforts to improve the humanitarian response to disasters caused by natural and human-made hazards and complex emergencies by further strengthening humanitarian response capacities at all levels, by continuing to strengthen the provision and coordination of humanitarian assistance at the global, regional and field levels, including through existing cluster coordination mechanisms and in support of national authorities of the affected State, as appropriate, and by further enhancing efficiency, transparency, performance and accountability;",
    "10": "Recognizes the benefits of engagement and coordination with relevant humanitarian actors to the effectiveness of humanitarian response, and encourages the United Nations to continue to pursue efforts to strengthen partnerships at the global level with the International Red Cross and Red Crescent Movement, relevant humanitarian non\u2011governmental organizations, other participants in the Inter-Agency Standing Committee and other relevant stakeholders;",
    "11": "Requests the Secretary-General to continue to strengthen the support provided to United Nations resident/humanitarian coordinators and to United Nations country teams, including by providing necessary training, identifying resources and improving the identification of and the selection process for United Nations resident/humanitarian coordinators, and enhancing their performance accountability;",
    "12": "Calls upon the Chair of the United Nations Sustainable Development Group and the Emergency Relief Coordinator to continue to enhance their consultations before presenting final recommendations on the selection process for resident coordinators in countries likely to require significant humanitarian response operations;",
    "13": "Requests the United Nations to continue to strengthen its ability to recruit and deploy appropriately senior, skilled and experienced humanitarian staff quickly and flexibly, giving paramount consideration to the highest standards of efficiency, competence and integrity, while paying due regard to gender equality and to recruiting on as wide a geographical basis as possible, and in this regard encourages the United Nations Sustainable Development Group to continue to strengthen the resident coordinator system, on which the humanitarian coordinator system is based, ensuring, inter alia, full implementation of the management and accountability system of the Group and the resident coordinator system;",
    "14": "",
    "15": "Also recognizes that accountability is an integral part of effective humanitarian assistance, and emphasizes the need for enhancing the accountability of humanitarian actors at all stages of humanitarian assistance;",
    "16": "Urges Member States to continue to give priority to efforts to prevent, respond to, investigate and prosecute acts of sexual and gender-based violence in humanitarian emergencies, calls upon Member States and relevant organizations to improve coordination and strengthen capacity, to ensure that humanitarian relief integrates prevention of, and risk mitigation for, sexual and gender-based violence and makes greater use of sex- and age-disaggregated data and to strengthen support services for victims, survivors and others affected by such violence beginning in the earliest stages of emergency response, taking into account their unique and specific needs resulting from the impact of such violence, and notes the Call to Action initiative;",
    "17": "Underscores the critical importance of protecting all persons affected by humanitarian crises, in particular women and children, from any form of sexual exploitation and abuse, including those perpetrated by humanitarian personnel, welcomes the determination of the Secretary-General to fully implement the United Nations policy of zero tolerance for sexual exploitation and abuse and stresses that victims and survivors should be at the core of such efforts, notes the six core principles relating to sexual exploitation and abuse adopted by the Inter-Agency Standing Committee,16 and encourages Member States to make greater efforts to prevent and respond to sexual exploitation and abuse and to ensure that perpetrators are held accountable;",
    "18": "Urges Member States to continue to seek to prevent, respond to, investigate and prosecute violations and abuses against children, including exploitation, in humanitarian emergencies, calls upon Member States and relevant organizations to strengthen support services for children affected by humanitarian emergencies, including those who have experienced violations and abuses, and calls for a more effective response in that regard, guided by the rights of the child;",
    "19": "Reaffirms the importance of implementing the Sendai Framework for Disaster Risk Reduction 2015\u20132030 to ensure the substantial reduction of disaster risk and losses in lives, livelihood and health and in the economic, physical, social, cultural and environmental assets of persons, businesses, communities and countries, and underlines the importance of tackling the underlying disaster risk drivers, of considering the impact of climate change and of integrating a disaster risk reduction perspective into humanitarian assistance to prevent new and reduce existing disaster risk;",
    "20": "Encourages the United Nations and humanitarian organizations to enhance efforts to further study, prepare for, address and minimize the humanitarian consequences of the adverse effects of climate change and environmental risks;",
    "21": "Calls upon Member States, the United Nations and relevant humanitarian and development organizations to continue to support multi-year investment, when possible, in preparedness, response and coordination capacities, and build the capacity at all levels of government, including local government, of organizations and of communities, particularly in communities exposed to disasters, to better prepare for hazards, reduce disaster risk and the risk of displacement within the context of disasters, build resilience and better respond to and recover from and build back better after disasters, and also calls upon all relevant stakeholders to complement, rather than substitute for or displace, national capacities to respond to crises, especially where those crises are prolonged or recurrent;",
    "22": "Calls upon Member States and the international community to provide adequate, sustainable and timely resources for disaster risk reduction, in order to build resilience and reduce the risk of displacement within the context of disasters, environmental degradation and climate change, including through complementary humanitarian and development programming and the further strengthening of national and local capacities to prevent, prepare for and respond to humanitarian emergencies, and encourages closer cooperation between national stakeholders and humanitarian and development actors in this regard;",
    "23": "Urges Member States, the United Nations humanitarian system, regional organizations, non\u2011governmental organizations, the private sector and other humanitarian actors to reinforce preparedness and response capabilities in relation to those outbreaks of infectious disease that trigger or exacerbate a humanitarian crisis, including by fully implementing the International Health Regulations (2005), and calls upon the United Nations humanitarian system and humanitarian organizations to respond rapidly, based on the level 3 activation procedure for infectious disease events in humanitarian contexts, in close coordination with affected States;",
    "24": "Calls upon Member States, the United Nations and humanitarian organizations and relevant stakeholders to scale up systematic prevention, preparedness and response to health emergencies in humanitarian contexts, and to draw on lessons learned from the COVID\u201119 pandemic, including from the strengthening of national, regional and multilateral approaches and international cooperation, such as the Access to COVID\u201119 Tools Accelerator (ACT\u2011A) and its COVAX Facility, and other relevant initiatives in order to enable the fair, equitable, timely and affordable access to safe, quality and effective COVID\u201119 vaccines, testing and treatment to prevent and contain transmission as countries transition to pandemic recovery, while also noting the importance of inclusive national vaccination programmes covering internally displaced persons, migrants and refugees, and encourages United Nations agencies and other relevant stakeholders to support Member States, including refugee-hosting countries and countries of origin, in full coordination with their national government, and takes note of the political declarations on pandemic prevention, preparedness and response, on universal health coverage and on the fight against tuberculosis adopted at the respective high-level meetings of the General Assembly held in New York in September 2023, as well as General Assembly resolutions on the control and elimination of malaria;",
    "25": "Calls upon Member States, the United Nations and other relevant organizations, as appropriate, to address non\u2011communicable diseases and their risk factors and to treat people living with them in humanitarian emergencies;",
    "26": "Encourages closer cooperation between development and humanitarian actors, in coordination with Member States, to ensure that all relevant actors work together, in accordance with their mandates, towards common results with the aim of reducing need, vulnerability and risk over multiple years, based on shared understanding of the context and each actor\u2019s operational strengths, in support of national priorities, while fully respecting the humanitarian principles for humanitarian action;",
    "27": "Encourages humanitarian and development actors to pursue, where appropriate, common risk-management and resilience objectives, achievable through joint analysis and multi-year programming and planning cycles;",
    "28": " action and early recovery into their programming, acknowledges that preparedness, early action and early recovery should receive further funding, and in this regard encourages the provision of timely, flexible, predictable and adequate resources, including from both humanitarian and development budgets, as appropriate;",
    "29": "Calls upon Member States, the United Nations, humanitarian and development organizations and other relevant actors to urgently and effectively respond to, prevent and prepare for rising global food insecurity affecting millions of people, especially those who are facing famine or the immediate risk of famine, including by enhancing humanitarian and development cooperation and providing urgent funding to respond to the needs of the affected population, and calls upon Member States and parties to armed conflicts to ensure safe and unhindered humanitarian access to civilians in need and to respect international humanitarian law;",
    "30": "Calls upon Member States, parties to armed conflict, the United Nations and other humanitarian and development actors, international financial institutions and other relevant actors to urgently increase their measures to prevent famine and to reduce and address acute food insecurity and malnutrition, and also urges Member States, the United Nations and other relevant organizations to take further steps to provide a coordinated emergency response to the food and nutrition needs of affected populations, while aiming to ensure that such steps are supportive of national strategies and programmes aimed at improving food security and nutrition;",
    "31": "Calls upon Member States, parties to armed conflict, the United Nations, humanitarian and development organizations, international financial institutions and other relevant actors to urgently increase their measures to prevent famine and to reduce and address acute food insecurity and malnutrition, which is compounded by the effects of the COVID\u201119 pandemic, and effectively respond to, prevent and prepare for rising global food insecurity affecting millions of people, especially those who are facing famine or the immediate risk of famine, including by enhancing humanitarian and development cooperation and providing urgent funding to respond to the needs of the affected population, supported by multisector early warning and analysis; and stresses the need to address food insecurity and malnutrition, including through: respect for international humanitarian law, investing in gender-sensitive humanitarian assistance and protection, livelihoods, climate adaptation and mitigation, health, water, sanitation and hygiene, nutrition, sustainable food systems, access to healthy diets, energy, poverty reduction, and addressing inequalities, including gender inequality, and providing for the peaceful resolution of armed conflict, and encourages strengthening efforts to empower rural women as essential actors in achieving food security and improved nutrition, as well as to prevent and respond to negative coping mechanisms, recognizing their disproportionate impact on women and children; and calls upon Member States and parties to armed conflicts to respect international humanitarian law and ensure safe and unhindered humanitarian access;",
    "32": "Strongly condemns the use of starvation of civilians as a method of warfare, including by attacking, destroying, removing or rendering useless objects indispensable to the survival of the civilian population, which is prohibited by international humanitarian law, urges all parties to armed conflict to protect civilian infrastructure, which is critical to the provision of essential services and the delivery of humanitarian aid to the civilian population, and the functioning of agrifood systems and markets in situations of armed conflict, and also urges all parties to armed conflicts to ensure and facilitate safe and unhindered humanitarian access to civilians in need;",
    "33": " and healthcare services, including mental health and psychosocial services, in humanitarian emergencies, and notes with appreciation initiatives at the national and international levels, including those that systematically identify and integrate innovative approaches and share best practices, that promote effective cooperation in this regard;",
    "34": "Encourages the international community, including relevant United Nations organizations and the International Federation of Red Cross and Red Crescent Societies, to support efforts of Member States aimed at strengthening their capacity to prepare for and respond to disasters and to support efforts, as appropriate, to strengthen systems, especially early warning systems, for identifying and monitoring disaster risk, including vulnerability to natural hazards, and especially to substantially increase the availability of and access to multi-hazard early warning systems in communities and countries exposed to natural hazards and environmental degradation to enable effective early action, including through the Secretary-General\u2019s Early Warnings for All initiative to ensure that every person on the planet is protected by early warning systems by 2027;",
    "35": "Welcomes the growing number of Member States and regional organizations that have taken steps to promote the implementation of the Guidelines for the Domestic Facilitation and Regulation of International Disaster Relief and Initial Recovery Assistance, encourages others to do so, as appropriate, and welcomes the valuable support that national Red Cross and Red Crescent societies are providing to their Governments in this area, in collaboration with the International Federation of Red Cross and Red Crescent Societies, the Office for the Coordination of Humanitarian Affairs and other partners;",
    "36": "Encourages States to create an enabling environment for the capacity- building of local authorities and of national and local non\u2011governmental and community-based organizations in order to ensure better preparedness in providing timely, effective and predictable assistance, and encourages the United Nations and other relevant organizations to provide support to such efforts, including, as appropriate, under the Common Framework for Preparedness of the Inter-Agency Standing Committee, the United Nations Sustainable Development Group and the United Nations Office for Disaster Risk Reduction, through the transfer of technology, on mutually agreed terms, and expertise to developing countries and through support to enhance the coordination capacities and build capacity in science and technology of affected States;",
    "37": "Recognizes the increase in the number and scale of disasters, including those related to the adverse effects of climate change, which in certain instances may contribute to displacement and to additional pressure on host communities, encourages Member States, the United Nations and relevant organizations and actors to further strengthen the efforts aimed at addressing the needs of persons displaced within the context of disasters, including those induced by climate change, and notes in this regard the importance of sharing best practices to prevent and prepare for such displacements;",
    "38": "Calls upon Member States, the United Nations and humanitarian organizations to provide emergency assistance in ways that are supportive of recovery and long-term development, where appropriate, including through multi-year funding and prioritizing humanitarian tools that strengthen resilience, such as, but not limited to, cash-based transfers, local procurement of food and services, including for school feeding programmes, and social safety nets;",
    "39": " contexts by, inter alia, scaling up social protection policies and cash assistance, where feasible, including multipurpose cash programming, as appropriate, to offer affected people flexibility on how to meet their humanitarian needs, and to support the development of local markets and strengthen national and local capacities, and in this regard calls upon the United Nations humanitarian organizations to continue building their capacity to systematically consider cash assistance, alongside other forms of humanitarian assistance, and takes note of efforts by the United Nations system, including moving towards a cash coordination model to increase effectiveness, efficiency, predictability and accountability of cash operations to provide multipurpose cash assistance for food, non\u2011food items and access to services and other support;",
    "40": "Encourages Member States, the United Nations system and other relevant organizations to improve, where possible, fast and flexible financing for preparedness, early action, early response and early recovery, and in this regard encourages exploring, developing and, where appropriate, the strengthening of innovative and anticipatory mechanisms and approaches, such as forecast-based financing and disaster risk insurance, to reduce the impact of disasters and address humanitarian needs;",
    "41": "Encourages States, as well as the United Nations, and humanitarian organizations, in accordance with their respective mandates and in line with humanitarian principles, learning from the COVID\u201119 pandemic experience, to continue to scale up anticipatory approaches, early warning early action systems, forecasting, prevention-oriented responses and emergency preparedness, and improve predictive and risk data analytics across sectors, reinforce systematic risk monitoring, early warning and preparedness capacities at local, national, regional and global levels, including, inter alia, those associated with health risks and disease outbreaks, and takes note of the relevant United Nations frameworks and initiatives related to health emergency preparedness;",
    "42": "Takes note of the efforts of Member States, the United Nations system and the international community to strengthen preparedness and local, national and regional humanitarian response capacity, including, as appropriate, through the transfer of technology on mutually agreed terms and expertise to developing countries, calls upon the United Nations and relevant partners to support capacity- building of Member States and encourages Member States to create and strengthen an enabling environment for the capacity-building of their national and local authorities, national societies of the International Red Cross and Red Crescent Movement and national and local non\u2011governmental and community-based organizations in providing timely humanitarian assistance, and calls further upon Member States to continue to provide funding to humanitarian country-based and regional pooled funds;",
    "43": "Encourages Member States, and calls upon relevant humanitarian organizations, to work closely with national institutions, including local governments and the private sector, as appropriate, to examine effective, context-specific ways to be better prepared for, respond to and recover from increasing emergencies in urban areas, which may have an impact on the provision of such life-saving essential services as water, energy and healthcare;",
    "44": " with international humanitarian law, strongly condemns all attacks directed against schools and the use of schools for military purposes, when in contravention of international humanitarian law, and encourages efforts to promote safe and protective school environments in humanitarian emergencies;",
    "45": "Urges Member States, the United Nations and relevant humanitarian actors to scale up support for humanitarian programming and response for safe, inclusive, equitable and quality education at all levels and ages, in order to mitigate the direct and indirect impacts from the closure of schools and other educational institutions due to the COVID\u201119 pandemic, among other causes, in order to help to ensure the continuation of education services, particularly for women and children, especially girls;",
    "46": "Calls upon the Office for the Coordination of Humanitarian Affairs and other United Nations organizations to continue to work with Member States and relevant United Nations entities to facilitate the exchange of updated, accurate and reliable information, including through mutually comprehensible, disaggregated and harmonized data, to ensure better assessment and analysis of needs in order to improve preparedness and humanitarian response;",
    "47": "Calls upon relevant United Nations organizations to support the improvement of the humanitarian programme cycle, including the development of coordinated and comprehensive needs assessment tools, such as multisector initial rapid assessments, the implementation of joint, impartial and timely needs assessments and prioritized needs-based humanitarian response plans, in consultation with the affected States, in order to strengthen the coordination of humanitarian action to meet the needs of people affected by humanitarian emergencies;",
    "48": "Encourages Member States to commit and to disburse in a timely fashion humanitarian funding based on, and in accordance with, the humanitarian appeals brought forward by the United Nations;",
    "49": "Encourages Member States and relevant United Nations organizations to explore innovative risk-sharing mechanisms and to base risk management funding on objective data;",
    "50": "Encourages United Nations and humanitarian organizations to further advance efficiencies in delivering assistance through reducing management costs, harmonizing partnership agreements, providing transparent and comparable cost structures, and strengthening measures to achieve greater accountability by taking further actions to reduce fraud, waste and abuse and identify ways to share incident reports and other information among United Nations agencies, where appropriate;",
    "51": "",
    "52": "Recognizes the important role that women can play as first responders, and encourages Member States, the United Nations and other relevant humanitarian organizations to support women\u2019s leadership and meaningful participation in the planning and implementation of response strategies, including by strengthening partnerships and building the capacities of national and local institutions, including national and local women\u2019s organizations, women-led organizations and other civil society actors, as appropriate;",
    "53": "Calls upon Member States, relevant humanitarian organizations of the United Nations system and other relevant humanitarian actors to ensure non\u2011discrimination and opportunities for persons with disabilities to participate on an equal basis with others in humanitarian preparedness and response;",
    "54": "Calls upon the United Nations and humanitarian and development organizations, in coordination with Member States, to engage all people affected by disasters and crises, in particular those most at risk, including through communication, enabling their participation in relevant processes and supporting their efforts and capacities to meet their different needs, while taking into account, as appropriate, their culture, traditions and local customs;",
    "55": "Calls upon United Nations humanitarian organizations, in consultation with Member States, as appropriate, to strengthen the evidence base for humanitarian assistance by further developing common mechanisms and methodologies for improving the quality, transparency, reliability, compatibility and comparability of common humanitarian needs assessments, needs data and analysis, including through improved collection, analysis and reporting of data disaggregated by sex, age and disability and taking into account environmental impact, to assess their performance in assistance and to ensure the most effective use of humanitarian resources by those organizations;",
    "56": "Calls upon the United Nations and its humanitarian partners to enhance accountability to Member States, including affected States, and all other stakeholders, including local governments, relevant local organizations and other actors, as well as affected populations, and to further strengthen humanitarian response efforts, including by monitoring and evaluating the provision and impact of their humanitarian assistance, incorporating lessons learned into programming and consulting with the affected populations in the planning and implementation of humanitarian assistance, and making greater efforts in this regard, including by sharing timely and relevant information and enhancing affected community engagement and feedback mechanisms, so that their needs are appropriately assessed and effectively addressed;",
    "57": "Calls upon Member States, the United Nations and humanitarian organizations to identify better ways of working to address the increasing capacity and resource gap, in order to effectively meet the needs of affected populations, including by harmonizing and, where possible, simplifying reporting requirements, increasing the flexibility of humanitarian funding, including through reduced earmarking and further minimizing the duplication of costs, and making more use of innovation in humanitarian response;",
    "58": " country-based and regional pooled funds, and to continue to support diverse humanitarian funding channels, including through new and innovative financing mechanisms, encourages efforts to follow the Principles and Good Practice of Humanitarian Donorship17 and to improve burden-sharing among donors, and in this respect further stresses the importance of broadening both public and private sector partnerships and the donor base in order to increase the predictability and effectiveness of funding, diversify income, narrow the humanitarian funding gap, and to promote South-South and horizontal and triangular cooperation globally and encourages the private sector, civil society and other relevant entities to make relevant contributions, complementary to all other sources;",
    "59": "Calls upon Member States to follow through on their respective commitments in the Pact for the Future18 with relation to significantly increasing financial and other forms of support to countries and communities facing humanitarian emergencies, including host communities, inter alia by scaling up timely and predictable funding and innovative and anticipatory financing mechanisms, as well as by strengthening partnerships with international financial institutions in order to prevent, reduce and respond to humanitarian suffering and assist those in need; and, in addition, encourages Member States to consider, where possible, a voluntary financial target for their humanitarian aid to support people affected by humanitarian emergencies;",
    "60": "Welcomes the important achievements of the Central Emergency Response Fund in ensuring a more timely, and predictable response to humanitarian emergencies, stresses the importance of continuing to improve the functioning of the Fund, and in this regard encourages the United Nations funds and programmes and the specialized agencies to review and evaluate, where necessary, their partnership policies and practices in order to ensure the timely disbursement of funds from the Fund to implementing partners in order to ensure that resources are used in the most efficient, effective, accountable and transparent manner possible;",
    "61": "Calls upon all Member States, and invites the private sector and all concerned individuals and institutions, to consider increasing their voluntary contributions, including, where appropriate, through multi-year funding, to the Central Emergency Response Fund in order to achieve an annual funding level of 1 billion United States dollars and encourages consideration of accelerated efforts to achieve the 1 billion dollar annual funding level by 2025, marking the twentieth anniversary of the Fund, and to continue to reinforce and strengthen the Fund as the global emergency response fund, and emphasizes the need to broaden and diversify the income base of the Fund and that contributions should be additional to current commitments to humanitarian programming and should not be to the detriment of resources made available for international cooperation for development;",
    "62": "Calls upon Member States to continue to increase support to the Central Emergency Response Fund and humanitarian country-based and regional pooled funds for strengthening early and rapid response to mitigate the impact of disasters, including in underfunded contexts and increasingly through local and national responders and implementing partners;",
    "63": "Encourages Member States, the private sector and all relevant individuals and institutions to consider increasing their voluntary contributions to country-based pooled funds and, as appropriate, other pooled funding mechanisms, to facilitate humanitarian assistance to people in need;",
    "64": "Calls upon Member States that are in a position to do so and development and humanitarian partners, in their efforts to provide flexible resources, to consider ways of better mainstreaming the need for preparedness and building resilience in the provision of humanitarian and development assistance, including reconstruction and rehabilitation, inter alia, with a view to ensuring smooth transition from relief to development, and encourages the United Nations system to strengthen strategic and operational partnerships with international financial institutions in order to prevent, reduce and respond to humanitarian suffering and assist those in need, strengthen early recovery efforts, reinforce basic services and reinforce rehabilitation and reconstruction efforts;",
    "65": "Calls upon all Member States that are in a position to do so to increase their voluntary contributions to humanitarian emergencies, including through flexible, unearmarked and multi-year funding where possible, in this context reiterates that the Office for the Coordination of Humanitarian Affairs should benefit from adequate and more predictable funding, and underscores the importance of adequate, timely and flexible voluntary funding for the Office to enable it to carry out its mandate;",
    "66": "Encourages Member States, in cooperation with relevant United Nations humanitarian organizations, to ensure that the basic humanitarian needs of affected populations, including clean water, food, shelter, health, including sexual and reproductive health, education and protection, energy and information and communications technologies, where possible, are addressed as components of humanitarian response, including through providing timely and adequate resources, while ensuring that their collaborative efforts fully adhere to humanitarian principles;",
    "67": "Also encourages Member States, in cooperation with relevant United Nations humanitarian organizations, to ensure that women and girls have access to basic healthcare services, including reliable and safe access to sexual and reproductive healthcare services and mental health and psychosocial support, from the onset of emergencies, in this regard recognizes that such assistance protects women, adolescent girls and infants from preventable mortality and morbidity that occur in humanitarian emergencies, and calls upon Member States, the United Nations and other relevant actors to give such programmes due consideration;",
    "68": "Urges Member States and humanitarian organizations to integrate protection and health risks, as components of humanitarian response, into humanitarian assessment, planning, implementation, monitoring and evaluation, and increase efforts to reinforce local and national systems, capacities and local communities and actors, including women-led organizations;",
    "69": "",
    "70": "Encourages Member States, the United Nations and humanitarian organizations to continue to work together to understand and address the different protection needs of affected populations, particularly the most vulnerable, in humanitarian crises and ensure that these needs are adequately integrated into preparedness, response and recovery efforts;",
    "71": "Calls upon Member States and relevant organizations and actors to recognize and address the consequences of humanitarian emergencies for migrants, in particular those in vulnerable situations, and to strengthen coordinated international efforts for their assistance and protection in concert with national authorities;",
    "72": "Calls upon Member States to take steps to ensure the international protection of and respect for the rights of refugees, including respect for the principle of non\u2011refoulement and adequate standards of treatment in accordance with international law, including, as applicable, the 1951 Convention relating to the Status of Refugees19 and international human rights obligations;",
    "73": "Recognizes the importance of early registration and effective registration systems as a tool of protection and as a means of carrying out the quantification and assessment of needs for the provision and distribution of humanitarian assistance, notes the many and diverse challenges faced by refugees who remain without any form of documentation attesting to their status, and underlines the importance of increasing accountability to ensure that humanitarian assistance reaches its beneficiaries;",
    "74": "Reaffirms the obligation of all States and parties to an armed conflict to protect civilians, in accordance with international humanitarian law, encourages States that are parties to an armed conflict to take all measures necessary to enhance the protection of civilians, and invites all States to promote a culture of protection, taking into account the particular needs of women, girls, boys and men, older persons and persons with disabilities;",
    "75": "Urges all parties to comply with their obligations under international humanitarian law, in particular the principles of distinction, proportionality and the obligation to take all feasible precautions to avoid and in any event minimizing harm to civilians and civilian objects;",
    "76": "Urges Member States to continue to take the steps necessary to ensure the protection of the wounded and sick, as well as the safety and security of medical personnel and humanitarian personnel exclusively engaged in medical duties, their facilities, equipment, transports and supplies, including by developing effective measures to prevent and address acts of violence, attacks and threats against them, and in this regard reaffirms the need for States to ensure that those responsible for violations of international humanitarian law do not operate with impunity, urges States to conduct full, prompt, impartial and effective investigations within their jurisdiction of violations of international humanitarian law with a view to ensuring accountability, as provided for by national laws and obligations under international law, and to ensure that the wounded and sick receive, to the fullest extent practicable and with the least possible delay, the medical care and attention required, and notes the applicable rules of international humanitarian law relating to the non\u2011punishment of any person for carrying out medical activities compatible with medical ethics;",
    "77": "Condemns in the strongest possible terms the alarming increase in threats to and deliberate targeting of humanitarian and medical personnel and United Nations and associated personnel;",
    "78": "Urges Member States to continue to take the steps necessary to ensure the safety and security of humanitarian personnel, their facilities, equipment, transports and supplies, including by developing effective measures to prevent and address acts of violence, attacks and threats against them, requests the Secretary-General to expedite his efforts to enhance the safety and security of personnel involved in United Nations humanitarian operations, including national and locally recruited personnel, and in this regard reaffirms the need for States to ensure that those responsible for violations of international humanitarian law do not operate with impunity, urges States to conduct full, prompt, impartial and effective investigations within their jurisdiction of violations of international humanitarian law with a view to ensuring accountability, as provided for by national laws and obligations under international law, and urges Member States to scale up their efforts to ensure the safety and security of humanitarian personnel;",
    "79": "Emphasizes the responsibility of States to adopt preventive measures and effective responses to acts of violence committed against civilian populations in armed conflicts and to comply with the relevant obligations under international law to end impunity and to ensure that those responsible for violations are promptly brought to justice, in accordance with national law and their obligations under international law, including those violations involving attacks against humanitarian personnel and United Nations and associated personnel, and to strengthen international cooperation in this regard;",
    "80": "Calls upon all States and parties in complex humanitarian emergencies, in particular in armed conflict and in post-conflict situations, in countries in which humanitarian personnel are operating, in conformity with the relevant provisions of international law and national laws, to cooperate fully with the United Nations and other humanitarian agencies and organizations and to ensure the safe and unhindered access of humanitarian and medical personnel, as well as their means of transport, supplies and equipment, and to support, facilitate and enable transportation and logistical supply lines, including to simplify and expedite procedures for the entry and deployment of medical and humanitarian personnel, goods and services, and remove impediments to such access, in order to allow such personnel to efficiently and safely perform their task of assisting affected civilian populations, including refugees and internally displaced persons, and in this regard also reaffirms the need to take the measures necessary to respect and protect such personnel, hospitals and other medical facilities, as well as their means of transport, supplies and equipment; and urges all parties to armed conflicts, consistent with international humanitarian law, to protect civilian objects which is critical to the delivery of humanitarian assistance for the provision of essential services, including for vaccinations and related medical care;",
    "81": "Strongly condemns the unlawful denial of humanitarian access and depriving civilians of objects indispensable to their survival, including wilfully impeding relief supplies and access for responses to conflict-induced food insecurity in situations of armed conflict, which may constitute a violation of international humanitarian law;",
    "82": "",
    "83": "Recognizes the Guiding Principles on Internal Displacement20 as an important international framework for the protection of internally displaced persons, and that forced displacement is not only a humanitarian but also a development challenge, encourages Member States and humanitarian agencies to continue to work together, in collaboration with host communities, in endeavours to provide a more predictable response to the needs of internally displaced persons and in particular to address the long-term nature of displacement by adopting and implementing long- term strategies and coherent multi-year planning, including in relation to issues such as livelihoods, and in this regard calls for continued and enhanced international support, upon request, for the capacity-building efforts of States and encourages humanitarian organizations to improve coordination, including with development organizations, to better address the needs of internally displaced persons in support of Member States to promote durable solutions;",
    "84": "Notes with appreciation the report of the Secretary-General\u2019s High-level Panel on Internal Displacement, acknowledges that increased efforts on addressing the root causes as well as prevention, protection and improved assistance to internally displaced persons and durable solutions for internal displacement are critically important, and encourages the Secretary-General to work with Member States, the United Nations system and relevant actors, as appropriate, on these efforts, and recognizes the importance of the Secretary-General\u2019s follow-up Action Agenda on Internal Displacement;",
    "85": "Welcomes the progress made towards further enhancing the security management system of the United Nations, and supports the approach taken by the Secretary-General to focus the efforts of the security management system on enabling the United Nations system to \u201cstay and deliver\u201d its most critical programmes even in high-risk environments by effectively managing the risks to which personnel are exposed, including in the provision of humanitarian assistance, and to adapt quickly to changes in local security conditions;",
    "86": "Expresses concern about the increasing threat of disinformation campaigns, misinformation, incitement to violence, and hate speech targeting humanitarian personnel, as well as the increase in malicious information and communication technologies activities, including data breaches and information operations, that target humanitarian organizations, disrupt their relief operations, undermine trust in the United Nations and humanitarian organizations, threaten the safety and security of humanitarian personnel and United Nations and associated personnel, including national and locally recruited personnel, their premises and assets, and ultimately their access and ability to carry out humanitarian activities, and encourages Member States and the United Nations system to take appropriate action to address these threats;",
    "87": "Encourages the United Nations and other relevant humanitarian actors to include, as part of their risk management strategy, the building of good relations and trust with national and local governments and to promote acceptance by local communities and all relevant actors, including religious leaders where appropriate, in order to enable humanitarian assistance to be provided in accordance with humanitarian principles;",
    "88": "Requests the Secretary-General to report on actions taken to enable the United Nations to continue to strengthen its ability to recruit and deploy staff quickly, effectively and flexibly, to procure emergency relief materials and services rapidly, cost-effectively and locally, where applicable, and to quickly disburse funds in order to support Governments and United Nations country teams in the coordination of international humanitarian assistance;",
    "89": "Urges all countries to integrate into their respective national policies and development frameworks the 2030 Agenda for Sustainable Development, 21 and urges Member States, the United Nations and relevant stakeholders to work together to reduce the needs and build the resilience of the most vulnerable in order to contribute to the achievement of the Goals included in the 2030 Agenda, including the call to leave no one behind;",
    "90": "Requests the Secretary-General to report to the General Assembly at its eightieth session, through the Economic and Social Council at its 2025 session, on progress made in strengthening the coordination of emergency humanitarian assistance of the United Nations, and to submit a report to the Assembly on the detailed use of the Central Emergency Response Fund."
  },
  "agenda_items": [
    "Item 72"
  ],
  "symbol_references": [
    "A/79/L.36"
  ]
}