{
  "symbol": "A/RES/73/326",
  "filename": "A_RES_73_326.pdf",
  "title": "73/326. Format and organizational aspects of the international migration review forums",
  "text": "United Nations \nA/RES/73/326\n \n \nGeneral Assembly \nDistr.: General \n29 July 2019 \n \n19-12472 (E)    310719 \n*1912472* \n \n \nSeventy-third session \nAgenda items 14 and 119 \n \n \n \n \n Resolution adopted by the General Assembly \non 19 July 2019 \n \n \n \n \n[without reference to a Main Committee (A/73/L.99)] \n \n \n 73/326. Format and organizational aspects of the international migration \nreview forums  \n \n \n \nThe General Assembly, \n \nReaffirming its resolution 71/1 of 19 September 2016, entitled \u201cNew York \nDeclaration for Refugees and Migrants\u201d, welcoming the convening of the \nIntergovernmental Conference held on 10 and 11 December 2018 in Marrakech, \nMorocco, and recalling that it adopted the Global Compact for Safe, Orderly and \nRegular Migration, also known as the Marrakech Compact on Migration, and \nrecalling also resolution 73/195 of 19 December 2018, by which it endorsed the \nGlobal Compact for Safe, Orderly and Regular Migration, \n \nRecalling also the 2030 Agenda for Sustainable Development,1 the Addis Ababa \nAction Agenda of the Third International Conference on Financing for Development,2 \nand the Declaration of the High-level Dialogue on International Migration and \nDevelopment,3 \n \nReaffirming that the Global Compact for Safe, Orderly and Regular Migration \n(Global Compact) presents a non-legally binding, cooperative framework, fostering \ninternational cooperation among all relevant actors on migration, acknowledging that \nno State can address migration alone, and upholding the sovereignty of States and \ntheir obligations under international law, \n \nReaffirming that the Global Compact is based on the following set of cross-\ncutting and interdependent guiding principles: people-centred, international cooperation, \nnational sovereignty, rule of law and due process, sustainable development, human \nrights, gender-responsive, child-sensitive, whole-of-government approach and whole-\nof-society approach,  \n__________________ \n \n1  Resolution 70/1. \n \n2  Resolution 69/313, annex. \n \n3  Resolution 68/4. \n\nA/RES/73/326 \nFormat and organizational aspects of the\ninternational migration review forums\n \n19-12472\n2/5 \n \n \nReaffirming also that the Global Compact will be implemented through \nenhanced bilateral, regional and multilateral cooperation and a revitalized global \npartnership in a spirit of solidarity, building on existing mechanisms, platforms and \nframeworks to address migration in all its dimensions,  \n \nRecalling paragraph 49 of resolution 73/195 on the establishment of the \nInternational Migration Review Forum (the forum), which shall serve as the primary \nintergovernmental global platform for Member States to discuss and share progress \non the implementation of all aspects of the Global Compact, including as it relates to \nthe 2030 Agenda for Sustainable Development, and with the participation of all \nrelevant stakeholders,  \n \n1. \nDecides that the forums: \n \n(a) \nShall be convened under the auspices of the General Assembly and be \nchaired by the President of the General Assembly; \n \n(b) \nShall operate under the rules of procedure of the General Assembly, as \napplicable, unless otherwise provided in the present resolution;  \n \n(c) \nShall take place during the first semester of the year 2022, and thereafter \nevery four years at United Nations Headquarters in New York; \n \n(d) \nShall last for four days;4 \n \n(e) \nShall be held at the highest possible political level, including Heads of \nState or Government; \n \n2. \nAlso decides that the forums shall be open to participation by all States \nMembers of the United Nations and all members of specialized agencies that have \nobserver status with the General Assembly; \n \n3. \nInvites intergovernmental organizations and other entities having received a \nstanding invitation to participate as observers in the work of the General Assembly and \norganizations and bodies of the United Nations to participate as observers in the forums; \n \n4. \nReiterates the importance of the effective participation of all relevant \nstakeholders in the forums, and invites non-governmental organizations that are in \nconsultative status with the Economic and Social Council, as well as all stakeholders \nthat were accredited to the preparatory process of the intergovernmental consultations \nof the Global Compact for Safe, Orderly and Regular Migration 5  or that were \naccredited to participate in the Intergovernmental Conference to Adopt the Global \nCompact for Safe, Orderly and Regular Migration, and encourages them to register \nwith the Secretariat in order to participate in the forums;  \n \n5. \nRequests the President of the General Assembly to draw up a list of other \nrepresentatives of relevant non-governmental organizations, academic, scientific and \nknowledge-based institutions, the private sector, trade unions, faith-based, migrant \nand youth organizations, diaspora communities and other relevant stakeholders, who \nmay attend and participate in each forum, taking into account the principles of \ntransparency and of equitable geographical representation, with due regard to the \nmeaningful participation of women, and to submit the list to Member States for their \nconsideration on a non-objection basis, no later than three months before the forums;6 \n__________________ \n \n4  The forums shall be held from 10 a.m. to 1 p.m. and from 3 to 6 p.m. each day. \n5 Resolution 73/195, annex. \n \n6  The list of proposed as well as final names will be brought to the attention of the General \nAssembly. Where a name is objected to, the objecting Member State will, on a voluntary basis, \nmake known to the Office of the President of the General Assembly the general basis of its \nobjections and the Office will share any information received with any Member State upon its \nrequest. \n\nFormat and organizational aspects of the \ninternational migration review forums \nA/RES/73/326\n \n3/5\n19-12472 \n \n \n6. \nInvites national human rights institutions compliant with the Paris \nPrinciples 7  to register with the Secretariat in order to participate in the forums, \nincluding the informal interactive multi-stakeholder hearings described in paragraph 15 \nbelow, and invites the institutions, as well as the Global Alliance of National Human \nRights Institutions and regional human rights institution networks, to submit inputs \nprior to the forums;  \n \n7. \nRequests the Secretary-General to ensure that the expertise of the United \nNations system as a whole, including specialized agencies, funds and programmes, \nrelated organizations and regional economic commissions, as well as all relevant \nspecial procedures mandate holders and treaty bodies, in accordance with their \nrespective mandates, giving due regard to Geneva-based expertise, is coordinated to \nsupport the State-led forums and to facilitate their participation therein; \n \n8. \nEncourages Member States to take into account, to the extent possible, a \nwhole-of-government and whole-of-society approach when composing their delegations \nto the forums;  \n \n9. \nRequests the Director General of the International Organization for Migration \n(IOM), as Coordinator of the United Nations Network on Migration (the network), to \nassist, upon request by Member States, in the preparation and organization of regional \nreviews of the implementation of the Global Compact;  \n \n10. Invites relevant subregional, regional and cross-regional processes, \nplatforms and organizations, including the United Nations regional economic \ncommissions and regional consultative processes on migration, to review the \nimplementation of the Global Compact, within their respective regions, and to \ncontribute to the work of the forums, with the involvement of all relevant \nstakeholders; \n \n11. \nInvites also the Global Forum on Migration and Development, including \nits civil society, business and mayoral mechanisms, to provide a space for informal \nexchanges on the implementation of the Global Compact, and report the findings, best \npractices and innovative approaches to the forums;  \n \n12. Invites forums such as the IOM International Dialogue on Migration, \nregional consultative processes on migration and others to contribute to each forum \nby providing relevant data, evidence, best practices, innovative approaches and \nrecommendations as they relate to the implementation of the Global Compact;  \n \n13. Requests the network, in preparation for the forums, to collect all inputs \nreceived from local, national, regional and global levels and to develop, as part of the \nglobal knowledge platform, within existing resources, a dedicated website featuring \ninputs submitted by Member States and other relevant stakeholders to the forums; \n \n14. Requests the Secretary-General, as part of the biennial report preceding \neach forum, drawing on the network, to provide guidance for the deliberations during \nthe forum, including the envisaged round tables and policy debate, and to make the \nreport available at least 12 weeks ahead of each forum; \n \n15. Requests the President of the General Assembly to organize and to preside \nover one day of informal interactive multi-stakeholder hearings one day prior to each \nforum with all relevant stakeholders, as listed in paragraphs 4 to 7, and also requests \nthe President of the General Assembly to invite the representative of civil society to \npresent a summary of the hearings during the opening segment of the plenary;  \n__________________ \n \n7  Resolution 48/134, annex. \n\nA/RES/73/326 \nFormat and organizational aspects of the\ninternational migration review forums\n \n19-12472\n4/5 \n \n \n16. Takes note of the establishment of the Start-Up Fund for Safe, Orderly and \nRegular Migration as part of the capacity-building mechanism; \n \n17. Requests the Secretary-General to facilitate the participation of \nrepresentatives of developing countries, particularly the least developed countries, \nand other relevant stakeholders, as appropriate, in the work of the forums, and in this \nregard invites Member States, financial institutions and other organizations to make \nfinancial contributions;  \n \n18. Decides that: \n \n(a) \nEach forum, to be held within existing resources, shall consist of four \ninteractive multi-stakeholder round tables during the first day and the morning of the \nsecond day, followed by a policy debate in the afternoon of the second day, at the \nbeginning of which the technical summaries of the round tables will be presented; the \nplenary will be held during the third and the fourth days; \n \n(b) \nThe plenary shall be divided into an opening segment, a general debate \nand a closing segment; \n \n(c) \nThe opening segment of the plenary shall feature statements from the \nPresident of the General Assembly, the Secretary-General, the Director General of the \nInternational Organization for Migration, as the Coordinator of the network, one \nrepresentative from the migrant community, and the representative from civil society; \n \n19. Invites the President of the General Assembly to deliver remarks during \nthe closing segment; \n \n20. Encourages Member States to consider presenting the result of their \nreviews of progress in implementing the Global Compact, on a voluntary basis, \ndrawing on contributions from all relevant stakeholders, as a part of their national \nstatements; \n \n21. Decides that: \n \n(a) \nThe four round tables will offer space for discussion covering all \n23 objectives of the Global Compact with the aim of reviewing the progress made in \nits implementation at all levels, bearing in mind that the Global Compact is based on \na set of cross-cutting and interdependent guiding principles; \n \n(b) \nAll 23 objectives of the Global Compact shall be covered in the following \nindicative way:  \n \n(i) \nRound table one: objectives 2, 5, 6, 12 and 18;  \n \n(ii) Round table two: objectives 4, 8, 9, 10, 11, 13 and 21; \n \n(iii) Round table three: objectives 14, 15, 16, 19, 20 and 22; \n \n(iv) Round table four: objectives 1, 3, 7, 17 and 23; \n \n(c) \nEach round table will be co-chaired by two Member State representatives, \nto be appointed by the President of the General Assembly, with due regard for \ngeographical and gender balance, in consultation with regional groups; \n \n(d) \nAdequate space should be reserved during each round table for participation \nof non-governmental stakeholders and representatives of local authorities, as well as \nof regional processes, platforms and organizations;  \n \n(e) \nEach round table may include a keynote speaker to guide the interactive \ndebate; \n \n(f) \nEach round table shall result in a technical summary to be prepared by the \nco-chairs; \n\nFormat and organizational aspects of the \ninternational migration review forums \nA/RES/73/326\n \n5/5\n19-12472 \n \n \n22. Requests the Secretary-General, with input from the network, to prepare a \nbackground note for each round table to be circulated at least six weeks prior to each \nforum; \n \n23. Requests the Director General of the IOM, as Coordinator of the network, \nto facilitate the policy debate focusing on challenges in the implementation of the \nGlobal Compact, including links with the 2030 Agenda for Sustainable \nDevelopment,1 the capacity-building mechanism and contemporary and emerging \nissues related to migration; the policy debate will also consider possible guidance for \nthe United Nations system to strengthen its efforts in improving system-wide \neffectiveness and coherence and in supporting Member States in implementing the \nGlobal Compact, upon the request of Member States, based on their national policies \nand priorities; \n \n24. Decides that: \n \n(a) \nThe round tables and the policy debate shall be interactive, evidence-\nbased, and action-oriented in nature, with participation of all relevant stakeholders; \n \n(b) \nThe summaries of the plenary, round tables and policy debate shall be \ndistributed by the President of the General Assembly within 10 working days \nfollowing the conclusion of each forum; \n \n25. Requests the President of the General Assembly to appoint two \nco-facilitators no later than two months ahead of each forum to conduct open, \ntransparent and inclusive intergovernmental consultations with a view to agreeing on \nthe Progress Declaration, preferably before the beginning of each forum; \n \n26. Decides that:  \n \n(a) \nAll inputs to each forum along with the reports of the Secretary-General \nmay inform the Progress Declaration; \n \n(b) \nThe Progress Declaration shall be brief, concise, evidence-based and \naction-oriented and may contain:  \n \n(i) \nAn evaluation of the overall progress made with respect to the \nimplementation of the 23 objectives of the Global Compact at all levels; \n \n(ii) An identification of the key challenges, opportunities and emerging issues \nrelated to the implementation of the Global Compact, and the scope for further \ninternational cooperation on international migration; \n \n(iii) Recommendations on the implementation of the Global Compact, as \nappropriate; \n \n(c) \nThe Progress Declaration shall be adopted during the closing segment of \neach forum; \n \n27. Decides also to review, after the second forum, its format and organizational \naspects, unless otherwise decided. \n \n100th plenary meeting \n19 July 2019 \n \n \n",
  "paragraphs": {
    "1": "Decides that the forums: (a) Shall be convened under the auspices of the General Assembly and be chaired by the President of the General Assembly; (b) Shall operate under the rules of procedure of the General Assembly, as applicable, unless otherwise provided in the present resolution; (c) Shall take place during the first semester of the year 2022, and thereafter every four years at United Nations Headquarters in New York; (d) Shall last for four days;4 (e) Shall be held at the highest possible political level, including Heads of State or Government;",
    "2": "Also decides that the forums shall be open to participation by all States Members of the United Nations and all members of specialized agencies that have observer status with the General Assembly;",
    "3": "Invites intergovernmental organizations and other entities having received a standing invitation to participate as observers in the work of the General Assembly and organizations and bodies of the United Nations to participate as observers in the forums;",
    "4": "Reiterates the importance of the effective participation of all relevant stakeholders in the forums, and invites non-governmental organizations that are in consultative status with the Economic and Social Council, as well as all stakeholders that were accredited to the preparatory process of the intergovernmental consultations of the Global Compact for Safe, Orderly and Regular Migration 5 or that were accredited to participate in the Intergovernmental Conference to Adopt the Global Compact for Safe, Orderly and Regular Migration, and encourages them to register with the Secretariat in order to participate in the forums;",
    "5": "Requests the President of the General Assembly to draw up a list of other representatives of relevant non-governmental organizations, academic, scientific and knowledge-based institutions, the private sector, trade unions, faith-based, migrant and youth organizations, diaspora communities and other relevant stakeholders, who may attend and participate in each forum, taking into account the principles of transparency and of equitable geographical representation, with due regard to the meaningful participation of women, and to submit the list to Member States for their consideration on a non-objection basis, no later than three months before the forums;6 __________________ 4 The forums shall be held from 10 a.m. to 1 p.m. and from 3 to 6 p.m. each day. 5 Resolution 73/195, annex. 6 The list of proposed as well as final names will be brought to the attention of the General Assembly. Where a name is objected to, the objecting Member State will, on a voluntary basis, make known to the Office of the President of the General Assembly the general basis of its objections and the Office will share any information received with any Member State upon its request. Format and organizational aspects of the international migration review forums A/RES/73/326 3/5 19-12472",
    "6": "Invites national human rights institutions compliant with the Paris Principles 7 to register with the Secretariat in order to participate in the forums, including the informal interactive multi-stakeholder hearings described in paragraph 15 below, and invites the institutions, as well as the Global Alliance of National Human Rights Institutions and regional human rights institution networks, to submit inputs prior to the forums;",
    "7": "Requests the Secretary-General to ensure that the expertise of the United Nations system as a whole, including specialized agencies, funds and programmes, related organizations and regional economic commissions, as well as all relevant special procedures mandate holders and treaty bodies, in accordance with their respective mandates, giving due regard to Geneva-based expertise, is coordinated to support the State-led forums and to facilitate their participation therein;",
    "8": "Encourages Member States to take into account, to the extent possible, a whole-of-government and whole-of-society approach when composing their delegations to the forums;",
    "9": "Requests the Director General of the International Organization for Migration (IOM), as Coordinator of the United Nations Network on Migration (the network), to assist, upon request by Member States, in the preparation and organization of regional reviews of the implementation of the Global Compact;",
    "10": "Invites relevant subregional, regional and cross-regional processes, platforms and organizations, including the United Nations regional economic commissions and regional consultative processes on migration, to review the implementation of the Global Compact, within their respective regions, and to contribute to the work of the forums, with the involvement of all relevant stakeholders;",
    "11": "Invites also the Global Forum on Migration and Development, including its civil society, business and mayoral mechanisms, to provide a space for informal exchanges on the implementation of the Global Compact, and report the findings, best practices and innovative approaches to the forums;",
    "12": "Invites forums such as the IOM International Dialogue on Migration, regional consultative processes on migration and others to contribute to each forum by providing relevant data, evidence, best practices, innovative approaches and recommendations as they relate to the implementation of the Global Compact;",
    "13": "Requests the network, in preparation for the forums, to collect all inputs received from local, national, regional and global levels and to develop, as part of the global knowledge platform, within existing resources, a dedicated website featuring inputs submitted by Member States and other relevant stakeholders to the forums;",
    "14": "Requests the Secretary-General, as part of the biennial report preceding each forum, drawing on the network, to provide guidance for the deliberations during the forum, including the envisaged round tables and policy debate, and to make the report available at least 12 weeks ahead of each forum;",
    "15": "Requests the President of the General Assembly to organize and to preside over one day of informal interactive multi-stakeholder hearings one day prior to each forum with all relevant stakeholders, as listed in paragraphs 4 to 7, and also requests the President of the General Assembly to invite the representative of civil society to present a summary of the hearings during the opening segment of the plenary; __________________ 7 Resolution 48/134, annex. A/RES/73/326 Format and organizational aspects of the international migration review forums 19-12472 4/5",
    "16": "Takes note of the establishment of the Start-Up Fund for Safe, Orderly and Regular Migration as part of the capacity-building mechanism;",
    "17": "Requests the Secretary-General to facilitate the participation of representatives of developing countries, particularly the least developed countries, and other relevant stakeholders, as appropriate, in the work of the forums, and in this regard invites Member States, financial institutions and other organizations to make financial contributions;",
    "18": "Decides that: (a) Each forum, to be held within existing resources, shall consist of four interactive multi-stakeholder round tables during the first day and the morning of the second day, followed by a policy debate in the afternoon of the second day, at the beginning of which the technical summaries of the round tables will be presented; the plenary will be held during the third and the fourth days; (b) The plenary shall be divided into an opening segment, a general debate and a closing segment; (c) The opening segment of the plenary shall feature statements from the President of the General Assembly, the Secretary-General, the Director General of the International Organization for Migration, as the Coordinator of the network, one representative from the migrant community, and the representative from civil society;",
    "19": "Invites the President of the General Assembly to deliver remarks during the closing segment;",
    "20": "Encourages Member States to consider presenting the result of their reviews of progress in implementing the Global Compact, on a voluntary basis, drawing on contributions from all relevant stakeholders, as a part of their national statements;",
    "21": "Decides that: (a) The four round tables will offer space for discussion covering all 23 objectives of the Global Compact with the aim of reviewing the progress made in its implementation at all levels, bearing in mind that the Global Compact is based on a set of cross-cutting and interdependent guiding principles; (b) All 23 objectives of the Global Compact shall be covered in the following indicative way: (i) Round table one: objectives 2, 5, 6, 12 and 18; (ii) Round table two: objectives 4, 8, 9, 10, 11, 13 and 21; (iii) Round table three: objectives 14, 15, 16, 19, 20 and 22; (iv) Round table four: objectives 1, 3, 7, 17 and 23; (c) Each round table will be co-chaired by two Member State representatives, to be appointed by the President of the General Assembly, with due regard for geographical and gender balance, in consultation with regional groups; (d) Adequate space should be reserved during each round table for participation of non-governmental stakeholders and representatives of local authorities, as well as of regional processes, platforms and organizations; (e) Each round table may include a keynote speaker to guide the interactive debate; (f) Each round table shall result in a technical summary to be prepared by the co-chairs; Format and organizational aspects of the international migration review forums A/RES/73/326 5/5 19-12472",
    "22": "Requests the Secretary-General, with input from the network, to prepare a background note for each round table to be circulated at least six weeks prior to each forum;",
    "23": "Requests the Director General of the IOM, as Coordinator of the network, to facilitate the policy debate focusing on challenges in the implementation of the Global Compact, including links with the 2030 Agenda for Sustainable Development,1 the capacity-building mechanism and contemporary and emerging issues related to migration; the policy debate will also consider possible guidance for the United Nations system to strengthen its efforts in improving system-wide effectiveness and coherence and in supporting Member States in implementing the Global Compact, upon the request of Member States, based on their national policies and priorities;",
    "24": "Decides that: (a) The round tables and the policy debate shall be interactive, evidence- based, and action-oriented in nature, with participation of all relevant stakeholders; (b) The summaries of the plenary, round tables and policy debate shall be distributed by the President of the General Assembly within 10 working days following the conclusion of each forum;",
    "25": "Requests the President of the General Assembly to appoint two co-facilitators no later than two months ahead of each forum to conduct open, transparent and inclusive intergovernmental consultations with a view to agreeing on the Progress Declaration, preferably before the beginning of each forum;",
    "26": "Decides that: (a) All inputs to each forum along with the reports of the Secretary-General may inform the Progress Declaration; (b) The Progress Declaration shall be brief, concise, evidence-based and action-oriented and may contain: (i) An evaluation of the overall progress made with respect to the implementation of the 23 objectives of the Global Compact at all levels; (ii) An identification of the key challenges, opportunities and emerging issues related to the implementation of the Global Compact, and the scope for further international cooperation on international migration; (iii) Recommendations on the implementation of the Global Compact, as appropriate; (c) The Progress Declaration shall be adopted during the closing segment of each forum;",
    "27": "Decides also to review, after the second forum, its format and organizational aspects, unless otherwise decided. 100th plenary meeting 19 July 2019"
  },
  "agenda_items": [
    "Item 14"
  ],
  "symbol_references": [
    "A/73/L.99"
  ]
}