{
  "symbol": "A/RES/75/11",
  "filename": "A_RES_75_11.pdf",
  "title": "75/11. Cooperation between the United Nations and the League of Arab States",
  "text": "United Nations \nA/RES/75/11\n \n \nGeneral Assembly \nDistr.: General \n30 November 2020 \n \n20-15847 (E)    071220 \n*2015847* \n \n \nSeventy-fifth session \nAgenda item 130 (d) \nCooperation between the United Nations and regional \nand other organizations: cooperation between the \nUnited Nations and the League of Arab States \n \n \n \n \n Resolution adopted by the General Assembly \non 23 November 2020 \n \n \n \n \n[without reference to a Main Committee (A/75/L.21 and A/75/L.21/Add.1)] \n \n \n \n75/11. Cooperation between the United Nations and the League of \nArab States \n \n \n \nThe General Assembly, \n \nRecalling its previous resolutions on cooperation between the United Nations \nand the League of Arab States, \n \nRecalling also article 3 of the Charter of the League of Arab States, 1 which \nentrusts the Council of the League of Arab States with the function of identifying the \nmeans whereby it will collaborate with international organizations to guarantee \ninternational peace and security and organize and strengthen relations in all fields, \n \nTaking into consideration the report of the Secretary-General entitled \u201cAn \nAgenda for Peace\u201d,2 and in particular section VII concerning cooperation with \nregional organizations, and the report of the Secretary-General entitled \u201cSupplement \nto an Agenda for Peace\u201d,3 \n \nConsidering the recommendations of the high-level meeting held by the \nSecretary-General with the heads of regional and subregional organizations in \nNew York on 12 and 13 June 2018, \n \nRecalling the statement by the President of the Security Council issued at the \nhigh-level meeting of the Security Council on cooperation between the Security \nCouncil and the League of Arab States, under the presidency of Kuwait on 13 June \n2019,4 \n__________________ \n \n1 United Nations, Treaty Series, vol. 70, No. 241. \n \n2 A/47/277-S/24111. \n \n3 A/50/60-S/1995/1. \n \n4 S/PRST/2019/5. \n\nA/RES/75/11 \nCooperation between the United Nations \nand the League of Arab States\n \n20-15847\n2/3 \n \n \nTaking into consideration the provisions of the protocol of amendment of the \ntext of the cooperation agreement between the United Nations and the League of Arab \nStates signed in September 2016, which call for strengthening cooperation between \nthe two organizations in new areas, including conflict resolution and prevention, in \naddition to peacebuilding, \n \nRecognizing the need to further strengthen cooperation between the United \nNations and the League of Arab States in pursuit of the common goals and objectives \nof both organizations, \n \nCommending the resolutions and recommendations of the fourteenth sectoral \nmeeting between the United Nations and the League of Arab States and their \nspecialized agencies, which was convened at the headquarters of the League of Arab \nStates on 12 and 13 January 2020 on the theme \u201cCooperation in the eradication of \nmultidimensional poverty in the Arab States\u201d, during which several issues were \ndiscussed, including the development challenges of multidimensional poverty, the \nrole of specialized agencies in eradicating poverty and the challenges hindering \nconcerted efforts in the Arab region, \n \n1. \nRequests the secretariats of the United Nations and the League of Arab \nStates to follow up on the implementation of the recommendations and resolutions of \nthe fourteenth sectoral meeting to assist the Arab States in eradicating the increasing \npoverty resulting from the outbreak of the coronavirus disease (COVID-19) pandemic \nin the region; \n \n2. \nCalls upon both secretariats to exert further efforts to enhance the existing \ncooperation between the two organizations at the political, security, economic, social \nand cultural levels, as well as in other areas of common interest, and requests the \nSecretariat of the United Nations to promote and build the capacities of the staff \nmembers of organs of the League of Arab States dealing with sustaining peace, conflict \nprevention, early warning, mediation, negotiation, peacemaking, peacekeeping and \npeacebuilding processes, and assessing and building national capacities in the post-\nconflict phase; \n \n3. \nStresses the importance of the two secretariats continuing periodic \nconsultations, at all levels, in order to exchange information and review and \nstrengthen coordination and follow-up mechanisms, particularly in the political and \nsecurity fields; \n \n4. \nEmphasizes that it is crucial and important to intensify coordination \nbetween the League of Arab States and the United Nations special envoys addressing \nthe current crises in the Arab region, in order to assist the two organizations in \nreaching a more comprehensive understanding of the crises and to develop an \neffective solution to them; \n \n5. \nRequests both secretariats to convene the fifteenth general cooperation \nmeeting between the two systems, which was postponed owing to the outbreak of the \nCOVID-19 pandemic, at the United Nations Office at Geneva by the end of 2021 or \nthe beginning of 2022 and to hold the fifteenth sectoral meeting between the two \norganizations and their specialized agencies at the headquarters of the League of Arab \nStates by the end of 2021; \n \n6. \nRequests the United Nations specialized agencies, programmes and \ninstitutions to continue their interaction and collaboration with their counterparts in \nthe organizations and institutions of the League of Arab States and to improve their \nconsultation mechanisms for the implementation of the projects and programmes \nagreed upon between both sides; \n\nCooperation between the United Nations  \nand the League of Arab States \nA/RES/75/11\n \n3/3\n20-15847 \n \n \n7. \nCalls upon the United Nations specialized agencies, institutions and \nprogrammes to inform the Secretary-General, no later than January 2022, of the \nprogress achieved in their cooperation with the League of Arab States system, \nparticularly in implementing the multilateral decisions and programmes approved by \nthe general cooperation meeting between the two organizations; \n \n8. \nRequests the Secretary-General to submit a report on the implementation \nof the present resolution to the General Assembly at its seventy-seventh session; \n \n9. \nDecides to include in the provisional agenda of its seventy-seventh \nsession, under the item entitled \u201cCooperation between the United Nations and \nregional and other organizations\u201d, the sub-item entitled \u201cCooperation between the \nUnited Nations and the League of Arab States\u201d. \n \n30th plenary meeting \n23 November 2020 \n \n",
  "paragraphs": {
    "1": "Requests the secretariats of the United Nations and the League of Arab States to follow up on the implementation of the recommendations and resolutions of the fourteenth sectoral meeting to assist the Arab States in eradicating the increasing poverty resulting from the outbreak of the coronavirus disease (COVID-19) pandemic in the region;",
    "2": "Calls upon both secretariats to exert further efforts to enhance the existing cooperation between the two organizations at the political, security, economic, social and cultural levels, as well as in other areas of common interest, and requests the Secretariat of the United Nations to promote and build the capacities of the staff members of organs of the League of Arab States dealing with sustaining peace, conflict prevention, early warning, mediation, negotiation, peacemaking, peacekeeping and peacebuilding processes, and assessing and building national capacities in the post- conflict phase;",
    "3": "Stresses the importance of the two secretariats continuing periodic consultations, at all levels, in order to exchange information and review and strengthen coordination and follow-up mechanisms, particularly in the political and security fields;",
    "4": "Emphasizes that it is crucial and important to intensify coordination between the League of Arab States and the United Nations special envoys addressing the current crises in the Arab region, in order to assist the two organizations in reaching a more comprehensive understanding of the crises and to develop an effective solution to them;",
    "5": "Requests both secretariats to convene the fifteenth general cooperation meeting between the two systems, which was postponed owing to the outbreak of the COVID-19 pandemic, at the United Nations Office at Geneva by the end of 2021 or the beginning of 2022 and to hold the fifteenth sectoral meeting between the two organizations and their specialized agencies at the headquarters of the League of Arab States by the end of 2021;",
    "6": "Requests the United Nations specialized agencies, programmes and institutions to continue their interaction and collaboration with their counterparts in the organizations and institutions of the League of Arab States and to improve their consultation mechanisms for the implementation of the projects and programmes agreed upon between both sides; Cooperation between the United Nations and the League of Arab States A/RES/75/11 3/3 20-15847",
    "7": "Calls upon the United Nations specialized agencies, institutions and programmes to inform the Secretary-General, no later than January 2022, of the progress achieved in their cooperation with the League of Arab States system, particularly in implementing the multilateral decisions and programmes approved by the general cooperation meeting between the two organizations;",
    "8": "Requests the Secretary-General to submit a report on the implementation of the present resolution to the General Assembly at its seventy-seventh session;",
    "9": "Decides to include in the provisional agenda of its seventy-seventh session, under the item entitled \u201cCooperation between the United Nations and regional and other organizations\u201d, the sub-item entitled \u201cCooperation between the United Nations and the League of Arab States\u201d. 30th plenary meeting 23 November 2020"
  },
  "agenda_items": [
    "Item 130"
  ],
  "symbol_references": [
    "A/75/L.21"
  ]
}