{
  "symbol": "A/RES/72/268",
  "filename": "A_RES_72_268.pdf",
  "title": "72/268. Scope, modalities, format and organization of the high-level meeting on the fight against tuberculosis",
  "text": "United Nations \nA/RES/72/268\n \n \nGeneral Assembly \nDistr.: General \n6 April 2018 \n \n18-05308 (E)    100418 \n*1805308* \n \n \nSeventy-second session \nAgenda item 127 \n \n \n \n \n Resolution adopted by the General Assembly \non 4 April 2018 \n \n \n \n \n[without reference to a Main Committee (A/72/L.40)] \n \n \n 72/268. Scope, modalities, format and organization of the high-level \nmeeting on the fight against tuberculosis \n \n \n \nThe General Assembly, \n \nRecalling its resolution 71/159 of 15 December 2016, entitled \u201cGlobal health \nand foreign policy: health employment and economic growth\u201d, in which it decided to \nhold a high-level meeting in 2018 on the fight against tuberculosis, \n \nRecalling also its resolution 71/3 of 5 October 2016, entitled \u201cPolitical \ndeclaration of the high-level meeting of the General Assembly on antimicrobial \nresistance\u201d, and its resolution 70/266 of 8 June 2016, entitled \u201cPolitical Declaration \non HIV and AIDS: On the Fast Track to Accelerating the Fight against HIV and to \nEnding the AIDS Epidemic by 2030\u201d, \n \nRecognizing that through the adoption of the 2030 Agenda for Sustainable \nDevelopment1 and its Sustainable Development Goals in September 2015, Heads of \nState and Government made a bold commitment to ending the tuberculosis epidemic \nby 2030, \n \nRecognizing also the World Health Organization End TB Strategy, endorsed by \nthe sixty-seventh World Health Assembly, in 2014,2 \n \nTaking note of the Global Tuberculosis Report 2017 of the World Health \nOrganization, \n \nEmphasizing that current global actions and investments fall far short of those \nneeded to end the global tuberculosis epidemic, \n \nWelcoming the convening of the World Health Organization First Global \nMinisterial Conference on Ending Tuberculosis in the Sustainable Development Era: \nA Multisectoral Response, held in Moscow on 16 and 17 November 2017, and taking \n__________________ \n \n1  Resolution 70/1. \n \n2  See World Health Organization, document WHA67/2014/REC/1, resolution 67.1. \n\nA/RES/72/268 \nScope, modalities, format and organization of the high-level meeting\non the fight against tuberculosis\n \n18-05308\n2/4 \n \nnote with appreciation of its outcome, which forms part of the way towards the high-\nlevel meeting of the General Assembly on tuberculosis, \n \nTaking note of the report of the Secretary-General on the options and modalities \nfor the organization of the high-level meeting on tuberculosis convened by the \nPresident of the General Assembly,3 \n \n1. \nDecides that the one-day high-level meeting on the fight against \ntuberculosis convened by the President of the General Assembly shall be held in \nNew York on the second day of the general debate of the Assembly at its seventy-\nthird session, from 10.30 a.m. to 1 p.m. and from 3 to 6 p.m., consisting of an opening \nsegment, a plenary segment for general discussion, two multi-stakeholder panels and \na brief closing segment; \n \n2. \nAlso decides that the overall theme of the high-level meeting will be \n\u201cUnited to end tuberculosis: an urgent global response to a global epidemic\u201d; \n \n3. \nFurther decides that: \n \n(a) \nThe opening segment, to be held from 10.30 to 11.30 a.m., will feature \nstatements by the President of the General Assembly at its seventy-third session, the \nSecretary-General, the Director General of the World Health Organization, the Chair \nof the Stop TB Partnership and the Chair of the World Health Organization First \nGlobal Ministerial Conference on Ending Tuberculosis in the Sustainable \nDevelopment Era: A Multisectoral Response, as well as an eminent high-level \nchampion of the fight against tuberculosis and a person affected by tuberculosis, both \nselected, in consultation with Member States, by the President of the General \nAssembly, giving due consideration to gender equity; \n \n(b) \nThe plenary segment, to be held from 11.30 a.m. to 1 p.m. and from 3 to \n5.30 p.m., will comprise statements by Member States and observers of the General \nAssembly; a list of speakers will be established in accordance with established \npractices of the Assembly, and the time limits for these statements will be three \nminutes for individual delegations and five minutes for statements made on behalf of \na group of States; \n \n4. \nDecides that the organizational arrangements for the two multi-\nstakeholder panels will be as follows: \n \n(a) \nTwo consecutive multi-stakeholder panels will be held in parallel to the \nplenary segment, one from 11.30 a.m. to 1 p.m. and the other from 3 to 4.30 p.m.; \n \n(b) \nThe multi-stakeholder panels will address the following themes: \n \nPanel 1: Accelerating comprehensive response through access to affordable \nprevention, diagnosis, treatment and care to end the tuberculosis epidemic, \nincluding \nmulti-drug-resistant \ntuberculosis, \ntaking \ninto \nconsideration \nco-morbidities and the linkages to relevant health challenges on each country\u2019s \npath towards achieving universal health coverage, taking note of and building \non the efforts concerning an accountability framework to drive multisectoral \naction, as envisaged in the Moscow ministerial declaration; \n \nPanel 2: Scaling up sufficient and sustainable national and international \nfinancing and implementation for service delivery, innovation and research and \ndevelopment to identify new diagnostics, drugs, vaccines and other prevention \nstrategies; \n \n(c) \nEach of the two multi-stakeholder panels will be co-chaired by two \nrepresentatives, one from a high-tuberculosis-burden country and one from a low-\ntuberculosis-burden country with successful tuberculosis control programmes, to be \n__________________ \n \n3  A/72/645. \n\nScope, modalities, format and organization of the high-level meeting \non the fight against tuberculosis \nA/RES/72/268\n \n3/4\n18-05308 \n \nappointed by the President of the General Assembly from among the Heads of State \nor Government attending the high-level meeting, in consultation with the regional \ngroups; \n \n(d) \nThe President of the General Assembly may invite parliamentarians, local \ngovernments, the heads or senior representatives of relevant United Nations entities, \ncivil society, the private sector, academia, medical associations, indigenous \nleadership and community organizations to serve as speakers on the panels, taking \ninto account gender equity, level of development and geographical representation; \n \n5. \nAlso decides that the closing segment by the President of the General \nAssembly will comprise summaries of the multi-stakeholder panels and concluding \nremarks by the President of the General Assembly and a statement by a person \naffected by tuberculosis; \n \n6. \nFurther decides that the high-level meeting shall approve a concise and \naction-oriented political declaration, agreed in advance by consensus through \nintergovernmental negotiations, to be submitted by the President of the General \nAssembly for adoption by the Assembly; \n \n7. \nRequests the President of the General Assembly, with the support of the \nWorld Health Organization and the Stop TB Partnership, hosted by the United Nations \nOffice for Project Services, to organize and preside over an interactive civil society \nhearing, no later than July 2018, with the active participation of appropriate senior-\nlevel representatives of Member States, observers of the General Assembly, \nparliamentarians, representatives of local government, relevant United Nations \nentities, non-governmental organizations in consultative status with the Economic \nand Social Council, invited civil society organizations, academia, medical \nassociations and the private sector, as well as people affected by tuberculosis and \nbroader communities, ensuring the participation and voices of women, girls and \nindigenous leadership as part of the preparatory process for the high-level meeting, \nand also requests the President to prepare a summary of the hearing prior to the high-\nlevel meeting; \n \n8. \nEncourages all Member States to participate in the high-level meeting, \nincluding the multi-stakeholder panels, at the highest possible level, preferably at the \nlevel of Heads of State and Government; \n \n9. \nInvites all observers of the General Assembly to be represented at the \nhighest possible level; \n \n10. Invites the United Nations system, including funds, programmes and \nspecialized agencies, including the World Health Organization, regional commissions \nand relevant envoys of the Secretary-General, as well as the Stop TB Partnership, \nhosted by the United Nations Office for Project Services, UNITAID, hosted by the \nWorld Health Organization, and the Global Fund to Fight AIDS, Tuberculosis and \nMalaria, as appropriate, to participate in the high-level meeting, as appropriate, and \nurges them to consider initiatives in support of the preparatory process and the \nmeeting, particularly with regard to sharing good practices, challenges and lessons \nlearned from tuberculosis-related responses; \n \n11. \nInvites non-governmental organizations in consultative status with the \nEconomic and Social Council with relevant expertise to register with the Secretariat \nto attend the meeting; \n \n12. Requests the President of the General Assembly to draw up a list of other \nrelevant representatives of relevant non-governmental organizations, civil society \norganizations, academic institutions and the private sector with expertise in \ntuberculosis who may attend the high-level meeting and participate in the interactive \n\nA/RES/72/268 \nScope, modalities, format and organization of the high-level meeting\non the fight against tuberculosis\n \n18-05308\n4/4 \n \ncivil society hearing and the multi-stakeholder panels, taking into account the \nprinciples of transparency and equitable geographical representation, with due regard \nto the meaningful participation of women, and to submit the list to Member States for \ntheir consideration on a non-objection basis;4 \n \n13. Invites members of civil society, especially those representing \ncommunities and those in vulnerable situations heavily affected by tuberculosis, to \nmake a fundamental contribution to the process in terms of raising awareness of the \nissues faced by the poorest and most marginalized populations of the world; \n \n14. Encourages Member States to consider including in their national \ndelegations representatives such as parliamentarians, mayors and governors of cities \nand states with a high burden of tuberculosis, representatives of civil society, \nincluding non-governmental organizations, indigenous leadership, community \norganizations and faith-based organizations, academia, philanthropic foundations, the \nprivate sector and networks representing people affected by tuberculosis, with due \nregard to gender equity; \n \n15. Requests the President of the General Assembly at its seventy-second \nsession, in consultation with Member States, to finalize the organizational \narrangements for the high-level meeting. \n \n81st plenary meeting  \n4 April 2018 \n \n__________________ \n \n4  The list of proposed as well as final names will be brought to the attention of the General \nAssembly. Where a name is objected to, the objecting Member State will, on a voluntary basis, \nmake known to the Office of the President of the General Assembly the general basis of its \nobjections and the Office will share any information received with any Member State upon its \nrequest. \n",
  "paragraphs": {
    "1": "Decides that the one-day high-level meeting on the fight against tuberculosis convened by the President of the General Assembly shall be held in New York on the second day of the general debate of the Assembly at its seventy- third session, from 10.30 a.m. to 1 p.m. and from 3 to 6 p.m., consisting of an opening segment, a plenary segment for general discussion, two multi-stakeholder panels and a brief closing segment;",
    "2": "Also decides that the overall theme of the high-level meeting will be \u201cUnited to end tuberculosis: an urgent global response to a global epidemic\u201d;",
    "3": "Further decides that: (a) The opening segment, to be held from 10.30 to 11.30 a.m., will feature statements by the President of the General Assembly at its seventy-third session, the Secretary-General, the Director General of the World Health Organization, the Chair of the Stop TB Partnership and the Chair of the World Health Organization First Global Ministerial Conference on Ending Tuberculosis in the Sustainable Development Era: A Multisectoral Response, as well as an eminent high-level champion of the fight against tuberculosis and a person affected by tuberculosis, both selected, in consultation with Member States, by the President of the General Assembly, giving due consideration to gender equity; (b) The plenary segment, to be held from 11.30 a.m. to 1 p.m. and from 3 to 5.30 p.m., will comprise statements by Member States and observers of the General Assembly; a list of speakers will be established in accordance with established practices of the Assembly, and the time limits for these statements will be three minutes for individual delegations and five minutes for statements made on behalf of a group of States;",
    "4": "Decides that the organizational arrangements for the two multi- stakeholder panels will be as follows: (a) Two consecutive multi-stakeholder panels will be held in parallel to the plenary segment, one from 11.30 a.m. to 1 p.m. and the other from 3 to 4.30 p.m.; (b) The multi-stakeholder panels will address the following themes: Panel 1: Accelerating comprehensive response through access to affordable prevention, diagnosis, treatment and care to end the tuberculosis epidemic, including multi-drug-resistant tuberculosis, taking into consideration co-morbidities and the linkages to relevant health challenges on each country\u2019s path towards achieving universal health coverage, taking note of and building on the efforts concerning an accountability framework to drive multisectoral action, as envisaged in the Moscow ministerial declaration; Panel 2: Scaling up sufficient and sustainable national and international financing and implementation for service delivery, innovation and research and development to identify new diagnostics, drugs, vaccines and other prevention strategies; (c) Each of the two multi-stakeholder panels will be co-chaired by two representatives, one from a high-tuberculosis-burden country and one from a low- tuberculosis-burden country with successful tuberculosis control programmes, to be appointed by the President of the General Assembly from among the Heads of State or Government attending the high-level meeting, in consultation with the regional groups; (d) The President of the General Assembly may invite parliamentarians, local governments, the heads or senior representatives of relevant United Nations entities, civil society, the private sector, academia, medical associations, indigenous leadership and community organizations to serve as speakers on the panels, taking into account gender equity, level of development and geographical representation;",
    "5": "Also decides that the closing segment by the President of the General Assembly will comprise summaries of the multi-stakeholder panels and concluding remarks by the President of the General Assembly and a statement by a person affected by tuberculosis;",
    "6": "Further decides that the high-level meeting shall approve a concise and action-oriented political declaration, agreed in advance by consensus through intergovernmental negotiations, to be submitted by the President of the General Assembly for adoption by the Assembly;",
    "7": "Requests the President of the General Assembly, with the support of the World Health Organization and the Stop TB Partnership, hosted by the United Nations Office for Project Services, to organize and preside over an interactive civil society hearing, no later than July 2018, with the active participation of appropriate senior- level representatives of Member States, observers of the General Assembly, parliamentarians, representatives of local government, relevant United Nations entities, non-governmental organizations in consultative status with the Economic and Social Council, invited civil society organizations, academia, medical associations and the private sector, as well as people affected by tuberculosis and broader communities, ensuring the participation and voices of women, girls and indigenous leadership as part of the preparatory process for the high-level meeting, and also requests the President to prepare a summary of the hearing prior to the high- level meeting;",
    "8": "Encourages all Member States to participate in the high-level meeting, including the multi-stakeholder panels, at the highest possible level, preferably at the level of Heads of State and Government;",
    "9": "Invites all observers of the General Assembly to be represented at the highest possible level;",
    "10": "Invites the United Nations system, including funds, programmes and specialized agencies, including the World Health Organization, regional commissions and relevant envoys of the Secretary-General, as well as the Stop TB Partnership, hosted by the United Nations Office for Project Services, UNITAID, hosted by the World Health Organization, and the Global Fund to Fight AIDS, Tuberculosis and Malaria, as appropriate, to participate in the high-level meeting, as appropriate, and urges them to consider initiatives in support of the preparatory process and the meeting, particularly with regard to sharing good practices, challenges and lessons learned from tuberculosis-related responses;",
    "11": "Invites non-governmental organizations in consultative status with the Economic and Social Council with relevant expertise to register with the Secretariat to attend the meeting;",
    "12": " civil society hearing and the multi-stakeholder panels, taking into account the principles of transparency and equitable geographical representation, with due regard to the meaningful participation of women, and to submit the list to Member States for their consideration on a non-objection basis;4",
    "13": "Invites members of civil society, especially those representing communities and those in vulnerable situations heavily affected by tuberculosis, to make a fundamental contribution to the process in terms of raising awareness of the issues faced by the poorest and most marginalized populations of the world;",
    "14": "Encourages Member States to consider including in their national delegations representatives such as parliamentarians, mayors and governors of cities and states with a high burden of tuberculosis, representatives of civil society, including non-governmental organizations, indigenous leadership, community organizations and faith-based organizations, academia, philanthropic foundations, the private sector and networks representing people affected by tuberculosis, with due regard to gender equity;",
    "15": "Requests the President of the General Assembly at its seventy-second session, in consultation with Member States, to finalize the organizational arrangements for the high-level meeting."
  },
  "agenda_items": [
    "Item 127"
  ],
  "symbol_references": [
    "A/72/L.40"
  ]
}