{
  "symbol": "A/RES/72/78",
  "filename": "A_RES_72_78.pdf",
  "title": "72/78. Declaration on the fiftieth anniversary of the Treaty on Principles Governing the Activities of States in the Exploration and Use of Outer Space, including the Moon and Other Celestial Bodies",
  "text": "United Nations \nA/RES/72/78\n \n \nGeneral Assembly \nDistr.: General \n14 December 2017 \n \n17-22104 (E)    151217     \n*1722104* \n \n \n \nSeventy-second session \nAgenda item 52 \n \n \n \n \n Resolution adopted by the General Assembly \non 7 December 2017 \n \n \n \n \n[on the report of the Special Political and Decolonization Committee \n(Fourth Committee) (A/72/446)] \n \n \n \n72/78. Declaration on the fiftieth anniversary of the Treaty on Principles \nGoverning the Activities of States in the Exploration and Use of \nOuter Space, including the Moon and Other Celestial Bodies  \n \n \n \nThe General Assembly \n \nAdopts the following declaration: \n \n \n \n Declaration on the fiftieth anniversary of the Treaty on Principles \nGoverning the Activities of States in the Exploration and Use of \nOuter Space, including the Moon and Other Celestial Bodies \n \n \n \nWe, the States Members of the United Nations, in observing the fiftieth \nanniversary of the Treaty on Principles Governing the Activities of States in the \nExploration and Use of Outer Space, including the Moon and Other Celestial \nBodies,1 \n \n1. \nReiterate the importance of the principles contained in General Assembly \nresolution 1962 (XVIII) of 13 December 1963, entitled \u201cDeclaration of Legal \nPrinciples Governing the Activities of States in the Exploration and Use of Outer \nSpace\u201d; \n \n2. \nRecall that the Treaty on Principles Governing the Activities of States in \nthe Exploration and Use of Outer Space, including the Moon and Other Celestial \nBodies, was adopted by the General Assembly in its resolution 2222 (XXI) of \n19 December 1966, was opened for signature in London, Moscow and Washington, \nD.C., on 27 January 1967, and entered into force on 10 October 1967; \n__________________ \n \n1  United Nations, Treaty Series, vol. 610, No. 8843. \n\nA/RES/72/78 \nDeclaration on the fiftieth anniversary of the Treaty on Principles Governing the Activities of States \nin the Exploration and Use of Outer Space, including the Moon and Other Celestial Bodies\n \n17-22104 \n2/3 \n \n \n3. \nNote that, as at 1 January 2017, 105 States had become parties to the \nTreaty and an additional 25 States had signed it; \n \n4. \nReaffirm the fundamental role played by the Treaty in maintaining outer \nspace for peaceful purposes and in furthering the purposes and principles of the \nCharter of the United Nations, in the interest of maintaining international peace and \nsecurity and promoting international cooperation and understanding; \n \n5. \nAre convinced that the Treaty and its principles, as reflected in its \narticles I to XIII, will continue to provide an indispensable framework for the \nconduct of outer space activities, which continue to hold immense potential to \ndeliver further advancements in human knowledge, to drive socioeconomic progress \nfor all humankind and to contribute to the achievement of the Sustainable \nDevelopment Goals by 2030; \n \n6. \nRecognize that the achievements made in space exploration and the \ndevelopment of space science and technology for the benefit of all humankind, and \ninternational cooperation initiatives to those ends, have exceeded all expectations \nexisting at the time of the adoption of the Treaty; \n \n7. \nAcknowledge that there has been a significant rise in the importance to \nStates of space science and technology applications, which enable greater \nunderstanding of the universe and of the Earth and contribute to advances in, inter \nalia, education, health, environmental monitoring, the management of natural \nresources on Earth, disaster management, meteorological forecasting, climate \nmodelling, the protection of cultural heritage, information technology and satellite \nnavigation and communications, and to the well-being of humanity through \neconomic, social and cultural development; \n \n8. \nAre deeply convinced that strengthening the long-term sustainability of \nouter space activities requires efforts at the national, regional, interregional and \ninternational levels; \n \n9. \nEmphasize the constantly evolving and increasingly multifaceted nature \nof international cooperation in the peaceful uses of outer space, with fundamentally \ncomplex scientific and technological advancements in the space field and an \nincreasing variety of actors in the space arena, and therefore encourage the building \nof stronger partnership, cooperation and coordination; \n \n10. Recognize the need for further promotion of international cooperation in \nthe peaceful uses of outer space, taking into account the particular needs of \ndeveloping countries; \n \n11. Call upon all States parties to the Treaty conducting outer space activities \nto work under the principles of cooperation and mutual assistance, paying due \nregard to the corresponding interests of other parties to the Treaty; \n \n12. Are inspired by the prospects that continue to open up before humankind \nas a result of human activities in outer space; \n \n13. Encourage States that have not yet become parties to the Treaty, in \nparticular those States that are members of the Committee on the Peaceful Uses of \nOuter Space, to consider becoming party to it; \n \n14. Emphasize, in this regard, that the benefits arising from adherence to the \nTreaty, as part of the legal regime of outer space, are significant for all States, \nirrespective of the degree of their economic or scientific development, and that \nbeing party to the Treaty would enhance the ability of States to become part of \ninternational cooperation efforts in the exploration and use of outer space for \npeaceful purposes; \n\nDeclaration on the fiftieth anniversary of the Treaty on Principles Governing the Activities of States  \nin the Exploration and Use of Outer Space, including the Moon and Other Celestial Bodies \nA/RES/72/78 \n \n3/3 \n17-22104 \n \n \n15. Reiterate the role of the Treaty as the cornerstone of the international \nlegal regime governing outer space activities and that the Treaty manifests the \nfundamental principles of international space law; \n \n16. Affirm that the Committee on the Peaceful Uses of Outer Space, together \nwith its Legal Subcommittee and Scientific and Technical Subcommittee, has a \ndistinguished historical record in the establishment and further development of the \ninternational legal regime governing outer space activities, that under that regime, \nouter space activities by States, international intergovernmental organizations and \nnon-governmental entities are flourishing and that, as a result, space science and \ntechnology and their applications contribute immeasurably to economic growth and \nimprovements in the quality of life around the world; \n \n17. Call upon the Committee on the Peaceful Uses of Outer Space and its \nLegal Subcommittee to continue, with the support of the Office for Outer Space \nAffairs of the Secretariat, to promote the widest adherence to the Treaty, and its \napplication by States, and to foster the progressive development of international \nspace law; \n \n18. Request the Office for Outer Space Affairs to continue fostering \ncapacity-building in space law and policy for the benefit of all countries and to \ncontinue providing assistance to developing countries, at their request, in the \ndevelopment of national space policy and legislation, in conformity with \ninternational space law. \n \n66th plenary meeting  \n7 December 2017 \n \n",
  "paragraphs": {
    "1": "Reiterate the importance of the principles contained in General Assembly resolution 1962 (XVIII) of 13 December 1963, entitled \u201cDeclaration of Legal Principles Governing the Activities of States in the Exploration and Use of Outer Space\u201d;",
    "2": "Recall that the Treaty on Principles Governing the Activities of States in the Exploration and Use of Outer Space, including the Moon and Other Celestial Bodies, was adopted by the General Assembly in its resolution 2222 (XXI) of 19 December 1966, was opened for signature in London, Moscow and Washington, D.C., on 27 January 1967, and entered into force on 10 October 1967; __________________ 1 United Nations, Treaty Series, vol. 610, No. 8843. A/RES/72/78 Declaration on the fiftieth anniversary of the Treaty on Principles Governing the Activities of States in the Exploration and Use of Outer Space, including the Moon and Other Celestial Bodies 17-22104 2/3",
    "3": "Note that, as at 1 January 2017, 105 States had become parties to the Treaty and an additional 25 States had signed it;",
    "4": "Reaffirm the fundamental role played by the Treaty in maintaining outer space for peaceful purposes and in furthering the purposes and principles of the Charter of the United Nations, in the interest of maintaining international peace and security and promoting international cooperation and understanding;",
    "5": "Are convinced that the Treaty and its principles, as reflected in its articles I to XIII, will continue to provide an indispensable framework for the conduct of outer space activities, which continue to hold immense potential to deliver further advancements in human knowledge, to drive socioeconomic progress for all humankind and to contribute to the achievement of the Sustainable Development Goals by 2030;",
    "6": "Recognize that the achievements made in space exploration and the development of space science and technology for the benefit of all humankind, and international cooperation initiatives to those ends, have exceeded all expectations existing at the time of the adoption of the Treaty;",
    "7": "Acknowledge that there has been a significant rise in the importance to States of space science and technology applications, which enable greater understanding of the universe and of the Earth and contribute to advances in, inter alia, education, health, environmental monitoring, the management of natural resources on Earth, disaster management, meteorological forecasting, climate modelling, the protection of cultural heritage, information technology and satellite navigation and communications, and to the well-being of humanity through economic, social and cultural development;",
    "8": "Are deeply convinced that strengthening the long-term sustainability of outer space activities requires efforts at the national, regional, interregional and international levels;",
    "9": "Emphasize the constantly evolving and increasingly multifaceted nature of international cooperation in the peaceful uses of outer space, with fundamentally complex scientific and technological advancements in the space field and an increasing variety of actors in the space arena, and therefore encourage the building of stronger partnership, cooperation and coordination;",
    "10": "Recognize the need for further promotion of international cooperation in the peaceful uses of outer space, taking into account the particular needs of developing countries;",
    "11": "Call upon all States parties to the Treaty conducting outer space activities to work under the principles of cooperation and mutual assistance, paying due regard to the corresponding interests of other parties to the Treaty;",
    "12": "Are inspired by the prospects that continue to open up before humankind as a result of human activities in outer space;",
    "13": "Encourage States that have not yet become parties to the Treaty, in particular those States that are members of the Committee on the Peaceful Uses of Outer Space, to consider becoming party to it;",
    "14": "Emphasize, in this regard, that the benefits arising from adherence to the Treaty, as part of the legal regime of outer space, are significant for all States, irrespective of the degree of their economic or scientific development, and that being party to the Treaty would enhance the ability of States to become part of international cooperation efforts in the exploration and use of outer space for peaceful purposes; Declaration on the fiftieth anniversary of the Treaty on Principles Governing the Activities of States in the Exploration and Use of Outer Space, including the Moon and Other Celestial Bodies A/RES/72/78 3/3 17-22104",
    "15": "Reiterate the role of the Treaty as the cornerstone of the international legal regime governing outer space activities and that the Treaty manifests the fundamental principles of international space law;",
    "16": "Affirm that the Committee on the Peaceful Uses of Outer Space, together with its Legal Subcommittee and Scientific and Technical Subcommittee, has a distinguished historical record in the establishment and further development of the international legal regime governing outer space activities, that under that regime, outer space activities by States, international intergovernmental organizations and non-governmental entities are flourishing and that, as a result, space science and technology and their applications contribute immeasurably to economic growth and improvements in the quality of life around the world;",
    "17": "Call upon the Committee on the Peaceful Uses of Outer Space and its Legal Subcommittee to continue, with the support of the Office for Outer Space Affairs of the Secretariat, to promote the widest adherence to the Treaty, and its application by States, and to foster the progressive development of international space law;",
    "18": "Request the Office for Outer Space Affairs to continue fostering capacity-building in space law and policy for the benefit of all countries and to continue providing assistance to developing countries, at their request, in the development of national space policy and legislation, in conformity with international space law. 66th plenary meeting 7 December 2017"
  },
  "agenda_items": [
    "Item 52"
  ],
  "symbol_references": []
}