{
  "symbol": "A/RES/79/62",
  "filename": "A_RES_79_62.pdf",
  "title": "79/62. Lethal autonomous weapons systems",
  "text": "United Nations \nA/RES/79/62\n \n \nGeneral Assembly \nDistr.: General \n10 December 2024 \n \n24-23093 (E) \n*2423093* \n \n \nSeventy-ninth session \nAgenda item 98 (ss) \nGeneral and complete disarmament: lethal autonomous \nweapons systems \n \n \n \n \n Resolution adopted by the General Assembly \non 2 December 2024 \n \n \n \n \n[on the report of the First Committee (A/79/408, para. 114)] \n \n \n \n79/62. Lethal autonomous weapons systems \n \n \n \nThe General Assembly, \n \nRecalling its resolution 78/241 of 22 December 2023, \n \nAffirming that international law, including the Charter of the United Nations, \ninternational humanitarian law, international human rights law and international \ncriminal law, applies in relation to autonomous weapons systems, \n \nMindful of the serious challenges and concerns that new and emerging \ntechnological applications in the military domain, including those related to artificial \nintelligence and autonomy in weapons systems, also raise from humanitarian, legal, \nsecurity, technological and ethical perspectives, \n \nConcerned about the possible negative consequences and impact of autonomous \nweapon systems on global security and regional and international stability, including \nthe risk of an emerging arms race, of exacerbating existing conflicts and humanitarian \ncrises, miscalculations, lowering the threshold for and escalation of conflicts and \nproliferation, including to unauthorized recipients and non-State actors, \n \nRecognizing the rapid development of new and emerging technologies, and \nrecognizing further that they hold great promise for the advancement of human \nwelfare and could, inter alia, help to better protect civilians in conflict in certain \ncircumstances, \n \nReaffirming that any weapon, including autonomous weapons systems, that \ncannot be used in compliance with international humanitarian law must not be used, \n \nWelcoming the interest and sustained efforts on these issues, in particular \nthrough the ongoing and valuable work of the Group of Governmental Experts on \nEmerging Technologies in the Area of Lethal Autonomous Weapons Systems, \nestablished under the Convention on Prohibitions or Restrictions on the Use of \n\nA/RES/79/62 \nLethal autonomous weapons systems\n \n24-23093\n2/3 \n \nCertain Conventional Weapons Which May Be Deemed to Be Excessively Injurious \nor to Have Indiscriminate Effects, 1 and in this regard underlining the significant \nprogress made in these discussions as well as the various proposals presented, \n \nMindful of the importance of addressing the impact of applications of artificial \nintelligence and autonomy in the military domain more comprehensively and of \nensuring complementarity with discussions on lethal autonomous weapons systems, \n \nNoting the adoption by consensus of Human Rights Council resolution 51/22 of \n7 October 2022 on human rights implications of new and emerging technologies in \nthe military domain,2 \n \nAcknowledging the important contribution of State-led international and \nregional conferences and initiatives, including the latest regional conferences hosted \nby the Philippines on 13 and 14 December 2023 and by Sierra Leone on 17 and \n18 April 2024, the international conference hosted by Austria on 29 and 30 April 2024 \nand the Responsible Artificial Intelligence in the Military Domain Summit hosted by \nthe Republic of Korea on 9 and 10 September 2024, \n \nRecognizing the valuable contributions made by United Nations entities and \ninternational and regional organizations, the International Committee of the Red \nCross, civil society organizations, academia, industry and other stakeholders in \nenriching international discussions on autonomous weapons systems, encompassing \nlegal, ethical, human rights, societal and technological dimensions, \n \nRecognizing the efforts of the Secretary-General within the New Agenda for \nPeace initiative to address the issue of autonomous weapons systems,  \n \nNoting the repeated calls by the Secretary-General to urgently conclude \nnegotiations of a legally binding instrument with prohibitions and regulations for \nautonomous weapons systems, in line with a two-tier approach, \n \nStressing the importance of the role of humans in the use of force to ensure \nresponsibility and accountability and for States to comply with international law, \n \nRecalling the importance of comprehensive and inclusive discussions of the \nchallenges and concerns related to autonomous weapons systems, and reaffirming the \nrole of the General Assembly with regard to international peace and security and its \nnear universal membership and wide substantive scope, \n \nHighlighting the importance of international cooperation and capacity-building \nto facilitate further discussions and engagements in international deliberations as well \nas to close the digital divides and support developing countries\u2019 effective, equitable \nand meaningful participation and representation in forums on autonomous weapons \nsystems by all States, \n \n1. \nNotes with appreciation the report of the Secretary-General,3 submitted \npursuant to resolution 78/241 on lethal autonomous weapons systems, which reflects \na wide range of views of Member and observer States and international and regional \norganizations, the International Committee of the Red Cross, civil society, the \nscientific community and industry on ways to address the challenges and concerns \nlethal autonomous weapons systems raise from humanitarian, legal, security, \ntechnological and ethical perspectives and on the role of humans in the use of force; \n \n2. \nWelcomes the high number of submissions to the report of the Secretary-\nGeneral, and notes the broadly shared view expressed therein on the need for the \ninternational community to address the aforementioned challenges and concerns with \n__________________ \n \n1  United Nations, Treaty Series, vol. 1342, No. 22495. \n \n2  See Official Records of the General Assembly, Seventy-seventh Session, Supplement No. 53A \n(A/77/53/Add.1), chap. III, sect. A. \n \n3  A/79/88. \n\nLethal autonomous weapons systems \nA/RES/79/62\n \n3/3\n24-23093 \n \nutmost urgency, in particular through the Group of Governmental Experts on \nEmerging Technologies in the Area of Lethal Autonomous Weapons Systems; \n \n3. \nHighlights the importance of addressing the challenges and concerns \nposed by autonomous weapons systems in the context of the objectives and purpose \nof the Convention on Prohibitions or Restrictions on the Use of Certain Conventional \nWeapons Which May Be Deemed to Be Excessively Injurious or to Have Indiscriminate \nEffects, and encourages all Member States to actively take part in the work of the Group \nof Governmental Experts, including to consider taking part in the work of the Group of \nGovernmental Experts as observers and adhering to the Convention; \n \n4. \nCalls upon the Group of Governmental Experts to fulfil its mandate as \nagreed to by the High Contracting Parties to the Convention on Prohibitions or \nRestrictions on the Use of Certain Conventional Weapons Which May Be Deemed to \nBe Excessively Injurious or to Have Indiscriminate Effects in 2023 as soon as \npossible, preferably by the end of 2025, and also calls upon the High Contracting \nParties to the Convention to spare no effort in this regard; \n \n5. \nInvites the High Contracting Parties to the Convention to take into account \nthe report of the Secretary-General in their work within the Group of Governmental \nExperts; \n \n6. \nUnderlines that a comprehensive and inclusive approach will be required \nto address the full range of challenges and concerns posed by autonomous weapons \nsystems, including consideration of legal, technological, ethical, humanitarian and \nsecurity perspectives, in order to safeguard international peace and security; \n \n7. \nDecides to convene open informal consultations in 2025 to consider the \nreport of the Secretary-General in full complementarity with and in a manner that \nsupports the fulfilment of the mandate of the Group of Governmental Experts in order \nto further the international community\u2019s understanding of the issues involved by \ndiscussing the full range of views received, including proposals and relevant aspects \nraised in the report that may thus far not have been discussed in detail in the Group \nof Governmental Experts;  \n \n8. \nInvites the Chair of the Group of Governmental Experts to participate in \nthe open informal consultations for the purpose of briefing the Member States of the \nwork within the Group of Governmental Experts, its progress, and how it relates to \nthe work of the General Assembly; \n \n9. \nDecides that the open informal consultations should be convened in New \nYork for a duration of two days in 2025 and that these consultations shall be open to \nthe full participation of all Member States and observer States and international and \nregional organizations, the International Committee of the Red Cross and civil \nsociety, including the scientific community and industry; \n \n10. Requests the Secretary-General to facilitate the informal consultations and \nto provide the support necessary to convene them; \n \n11. \nRequests that the open informal consultations be conducted, if possible, \nafter a meeting of the Group of Governmental Experts for the purpose of \ncomplementarity and enriching its discussions; \n \n12. Decides to include in the provisional agenda of its eightieth session the \nitem entitled \u201cLethal autonomous weapons systems\u201d. \n \n44th plenary meeting \n2 December 2024 \n \n",
  "paragraphs": {
    "1": "Notes with appreciation the report of the Secretary-General,3 submitted pursuant to resolution 78/241 on lethal autonomous weapons systems, which reflects a wide range of views of Member and observer States and international and regional organizations, the International Committee of the Red Cross, civil society, the scientific community and industry on ways to address the challenges and concerns lethal autonomous weapons systems raise from humanitarian, legal, security, technological and ethical perspectives and on the role of humans in the use of force;",
    "2": "Welcomes the high number of submissions to the report of the Secretary- General, and notes the broadly shared view expressed therein on the need for the international community to address the aforementioned challenges and concerns with utmost urgency, in particular through the Group of Governmental Experts on Emerging Technologies in the Area of Lethal Autonomous Weapons Systems;",
    "3": "Highlights the importance of addressing the challenges and concerns posed by autonomous weapons systems in the context of the objectives and purpose of the Convention on Prohibitions or Restrictions on the Use of Certain Conventional Weapons Which May Be Deemed to Be Excessively Injurious or to Have Indiscriminate Effects, and encourages all Member States to actively take part in the work of the Group of Governmental Experts, including to consider taking part in the work of the Group of Governmental Experts as observers and adhering to the Convention;",
    "4": "Calls upon the Group of Governmental Experts to fulfil its mandate as agreed to by the High Contracting Parties to the Convention on Prohibitions or Restrictions on the Use of Certain Conventional Weapons Which May Be Deemed to Be Excessively Injurious or to Have Indiscriminate Effects in 2023 as soon as possible, preferably by the end of 2025, and also calls upon the High Contracting Parties to the Convention to spare no effort in this regard;",
    "5": "Invites the High Contracting Parties to the Convention to take into account the report of the Secretary-General in their work within the Group of Governmental Experts;",
    "6": "Underlines that a comprehensive and inclusive approach will be required to address the full range of challenges and concerns posed by autonomous weapons systems, including consideration of legal, technological, ethical, humanitarian and security perspectives, in order to safeguard international peace and security;",
    "7": "Decides to convene open informal consultations in 2025 to consider the report of the Secretary-General in full complementarity with and in a manner that supports the fulfilment of the mandate of the Group of Governmental Experts in order to further the international community\u2019s understanding of the issues involved by discussing the full range of views received, including proposals and relevant aspects raised in the report that may thus far not have been discussed in detail in the Group of Governmental Experts;",
    "8": "Invites the Chair of the Group of Governmental Experts to participate in the open informal consultations for the purpose of briefing the Member States of the work within the Group of Governmental Experts, its progress, and how it relates to the work of the General Assembly;",
    "9": "Decides that the open informal consultations should be convened in New York for a duration of two days in 2025 and that these consultations shall be open to the full participation of all Member States and observer States and international and regional organizations, the International Committee of the Red Cross and civil society, including the scientific community and industry;",
    "10": "Requests the Secretary-General to facilitate the informal consultations and to provide the support necessary to convene them;",
    "11": "Requests that the open informal consultations be conducted, if possible, after a meeting of the Group of Governmental Experts for the purpose of complementarity and enriching its discussions;",
    "12": "Decides to include in the provisional agenda of its eightieth session the item entitled \u201cLethal autonomous weapons systems\u201d."
  },
  "agenda_items": [
    "Item 98"
  ],
  "symbol_references": []
}