{
  "symbol": "A/RES/73/317",
  "filename": "A_RES_73_317.pdf",
  "title": "73/317. Financing of the United Nations Mission for Justice Support in Haiti",
  "text": "United Nations \nA/RES/73/317 \n \n \nGeneral Assembly \nDistr.: General \n16 July 2019 \n \n19-11313 (E)    180719 \n*1911313* \n \n \nSeventy-third session \nAgenda item 158 \n \n \n \n \n Resolution adopted by the General Assembly on 3 July 2019 \n \n \n \n \n[on the report of the Fifth Committee (A/73/932)] \n \n \n \n73/317. Financing of the United Nations Mission for Justice Support \nin Haiti \n \n \n \nThe General Assembly, \n \nHaving considered the report of the Secretary-General \non the budget \nperformance of the United Nations Mission for Justice Support in Haiti for the period \nfrom 16 October 2017 to 30 June 2018,1 the note by the Secretary-General on the \nfinancing arrangements for the Mission for the period from 1 July to 31 December \n2019 2  and the related report of the Advisory Committee on Administrative and \nBudgetary Questions,3 \n \nRecalling Security Council resolution 2350 (2017) of 13 April 2017, by which \nthe Council established the United Nations Mission for Justice Support in Haiti, as a \nfollow-on peacekeeping mission in Haiti, for an initial period of six months from \n16 October 2017 until 15 April 2018, and the subsequent resolutions by which the \nCouncil extended the mandate of the Mission, the latest of which was 2466 (2019) of \n12 April 2019, by which the Council extended the mandate of the Mission for a final \nperiod of six months, until 15 October 2019,  \n \nRecalling also its resolution 72/260 A of 24 December 2017 on the financing of \nthe Mission and its subsequent resolution 72/260 B of 5 July 2018, as well as its \ndecision 72/558 of 5 July 2018,  \n \nReaffirming the general principles underlying the financing of United Nations \npeacekeeping operations, as stated in its resolutions 1874 (S-IV) of 27 June 1963, \n3101 (XXVIII) of 11 December 1973 and 55/235 of 23 December 2000,  \n \nMindful of the fact that it is essential to provide the Mission with the financial \nresources necessary to enable it to fulfil its responsibilities under the relevant \nresolutions of the Security Council,  \n__________________ \n \n1  A/73/641. \n2 A/73/748. \n \n3  A/73/755/Add.6. \n\nA/RES/73/317 \nFinancing of the United Nations Mission for Justice Support in Haiti \n \n19-11313\n2/4 \n \n \n1. \nTakes note of the status of contributions to the United Nations Mission for \nJustice Support in Haiti as at 30 April 2019, including the contributions outstanding \nin the amount of 35.3 million United States dollars, representing some 0.4 per cent of \nthe total assessed contributions, notes with concern that only 110 Member States have \npaid their assessed contributions in full, and urges all other Member States, in \nparticular those in arrears, to ensure payment of their outstanding assessed \ncontributions;  \n \n2. \nExpresses its appreciation to those Member States that have paid their \nassessed contributions in full, and urges all other Member States to make every \npossible effort to ensure payment of their assessed contributions to the Mission in full; \n \n3. \nExpresses concern at the financial situation with regard to peacekeeping \nactivities, in particular as regards the reimbursements to troop contributors that bear \nadditional burdens owing to overdue payments by Member States of their assessments; \n \n4. \nEmphasizes that all future and existing peacekeeping missions shall be \ngiven equal and non-discriminatory treatment in respect of financial and administrative \narrangements;  \n \n5. \nAlso emphasizes that all peacekeeping missions shall be provided with \nadequate resources for the effective and efficient discharge of their respective \nmandates;  \n \n6. \nRequests the Secretary-General to ensure that proposed peacekeeping \nbudgets are based on the relevant legislative mandates;  \n \n7. \nEndorses the conclusions and recommendations contained in the report of \nthe Advisory Committee on Administrative and Budgetary Questions,3 subject to the \nprovisions of the present resolution, and requests the Secretary-General to ensure \ntheir full implementation;  \n \n8. \nReaffirms paragraphs 11 and 12 of its resolution 72/290 of 5 July 2018;  \n \n9. \nNotes that the various programmatic activities, to be financed through \nassessed contributions, of peacekeeping missions must be directly linked to Security \nCouncil mandates and reflect the evolution of those mandates;  \n \n10. \nRequests the Secretary-General to include, in the performance report of \nthe Mission, detailed information on programmatic activities, including on how the \nimplementation of those activities has contributed to implementing mission \nmandates;  \n \n11. \nEmphasizes the importance of overall budgetary performance in \npeacekeeping operations, and requests the Secretary-General to continue to implement \nthe recommendations of the relevant oversight bodies and to report thereon in the \ncontext of the performance reports;  \n \n12. \nAlso emphasizes the importance of the accountability system of the \nSecretariat, and requests the Secretary-General to continue to strengthen risk \nmanagement and internal controls in the management of peacekeeping budgets and to \nreport thereon in the context of his next report;  \n \n13. \nRequests the Secretary-General to ensure the full implementation of the \nrelevant provisions of its resolutions 59/296 of 22 June 2005, 60/266 of 30 June 2006, \n61/276 of 29 June 2007, 64/269 of 24 June 2010, 65/289 of 30 June 2011, 66/264 of \n21 June 2012, 69/307 of 25 June 2015 and 70/286 of 17 June 2016, as well as other \nrelevant resolutions;  \n \n14. \nAlso requests the Secretary-General to take all action necessary to ensure \nthat the Mission is administered with a maximum of efficiency and economy;  \n \n\nFinancing of the United Nations Mission for Justice Support in Haiti \nA/RES/73/317 \n \n3/4\n19-11313 \n \n \n \nBudget performance report for the period from 16 October 2017 \nto 30 June 2018  \n \n \n15. \nTakes note of the report of the Secretary-General on the budget performance \nof the Mission for the period from 16 October 2017 to 30 June 2018; 1 \n \n \n \nEstimates for the period from 1 July to 31 December 2019 \n \n \n16. \nAuthorizes the Secretary-General to enter into commitments for the \nmaintenance of the Mission in an amount not exceeding 49,450,100 dollars for the \nperiod from 1 July to 31 December 2019;  \n \n \n \nFinancing of the commitment authority \n \n \n17. \nDecides to apportion among Member States the amount of 49,450,100 \ndollars for the period from 1 July to 31 December 2019, in accordance with the \nlevels updated in its resolution 73/272 of 22 December 2018, and taking into \naccount the scale of assessments for 2019, as set out in its resolution 73/271 of \n22 December 2018; \n \n18. \nAlso decides that, in accordance with the provisions of its resolution 973 (X) \nof 15 December 1955, there shall be set off against the apportionment among Member \nStates, as provided for in paragraph 17 above, their respective share in the Tax \nEqualization Fund of 1,701,400 dollars, comprising the estimated staff assessment \nincome approved for the Mission for the period from 1 July to 31 December 2019;  \n \n \n \nEstimates for the support account for peacekeeping operations and the \nUnited Nations Logistics Base at Brindisi, Italy, for the period from 1 July 2019 \nto 30 June 2020 \n \n \n19. \nDecides to appropriate to the Special Account for the United Nations \nMission for Justice Support in Haiti the amount of 3,300,000 dollars for the period \nfrom 1 July 2019 to 30 June 2020, comprising 2,801,000 dollars for the support \naccount for peacekeeping operations and 499,000 dollars for the United Nations \nLogistics Base at Brindisi, Italy; \n \n \n \nFinancing of the appropriation  \n \n \n20. \nDecides to apportion among Member States the amount of 3,300,000 \ndollars for the period from 1 July 2019 to 30 June 2020, in accordance with the levels \nupdated in its resolution 73/272, and taking into account the scale of assessments for \n2019 and 2020, as set out in its resolution 73/271;  \n \n21. \nAlso decides that, in accordance with the provisions of its resolution 973 (X), \nthere shall be set off against the apportionment among Member States, as provided \nfor in paragraph 20 above, their respective share in the Tax Equalization Fund of \n252,100 dollars, comprising the prorated share of 199,400 dollars of the estimated \nstaff assessment income approved for the support account and the prorated share of \n52,700 dollars of the estimated staff assessment income approved for the United \nNations Logistics Base; \n \n22. \nFurther decides that, for Member States that have fulfilled their financial \nobligations to the Mission, there shall be set off against their apportionment, as \nprovided for in paragraphs 17 and 20 above, their respective share of the unencumbered \nbalance and other revenue in the total amount of 350,300 dollars in respect of the \nfinancial period ended 30 June 2018, in accordance with the levels updated in its \nresolution 70/246 of 23 December 2015, taking into account the scale of assessments \nfor 2018, as set out in its resolution 70/245 of 23 December 2015;  \n\nA/RES/73/317 \nFinancing of the United Nations Mission for Justice Support in Haiti \n \n19-11313\n4/4 \n \n \n23. \nDecides that, for Member States that have not fulfilled their financial \nobligations to the Mission, there shall be set off against their outstanding obligations \ntheir respective share of the unencumbered balance and other revenue in the amount \nof 350,300 dollars in respect of the financial period ended 30 June 2018, in \naccordance with the scheme set out in paragraph 22 above;  \n \n24. \nAlso decides that the increase of 344,000 dollars in the estimated staff \nassessment income in respect of the financial period ended 30 June 2018 shall be \nadded to the credits in the amount of 350,300 dollars referred to in paragraphs 22 and \n23 above;  \n \n25. \nEncourages the Secretary-General to continue to take additional measures \nto ensure the safety and security of all personnel participating in the Mission under \nthe auspices of the United Nations, bearing in mind paragraphs 5 and 6 of Security \nCouncil resolution 1502 (2003) of 26 August 2003;  \n \n26. \nInvites voluntary contributions to the Mission in cash and in the form of \nservices and supplies acceptable to the Secretary-General, to be administered, as \nappropriate, in accordance with the procedure and practices established by the \nGeneral Assembly;  \n \n27. \nDecides to include in the provisional agenda of its seventy-fourth session \nthe item entitled \u201cFinancing of the United Nations Mission for Justice Support in \nHaiti\u201d. \n \n97th plenary meeting \n3 July 2019 \n \n",
  "paragraphs": {
    "1": "Takes note of the status of contributions to the United Nations Mission for Justice Support in Haiti as at 30 April 2019, including the contributions outstanding in the amount of 35.3 million United States dollars, representing some 0.4 per cent of the total assessed contributions, notes with concern that only 110 Member States have paid their assessed contributions in full, and urges all other Member States, in particular those in arrears, to ensure payment of their outstanding assessed contributions;",
    "2": "Expresses its appreciation to those Member States that have paid their assessed contributions in full, and urges all other Member States to make every possible effort to ensure payment of their assessed contributions to the Mission in full;",
    "3": "Expresses concern at the financial situation with regard to peacekeeping activities, in particular as regards the reimbursements to troop contributors that bear additional burdens owing to overdue payments by Member States of their assessments;",
    "4": "Emphasizes that all future and existing peacekeeping missions shall be given equal and non-discriminatory treatment in respect of financial and administrative arrangements;",
    "5": "Also emphasizes that all peacekeeping missions shall be provided with adequate resources for the effective and efficient discharge of their respective mandates;",
    "6": "Requests the Secretary-General to ensure that proposed peacekeeping budgets are based on the relevant legislative mandates;",
    "7": "Endorses the conclusions and recommendations contained in the report of the Advisory Committee on Administrative and Budgetary Questions,3 subject to the provisions of the present resolution, and requests the Secretary-General to ensure their full implementation;",
    "8": "Reaffirms paragraphs 11 and 12 of its resolution 72/290 of 5 July 2018;",
    "9": "Notes that the various programmatic activities, to be financed through assessed contributions, of peacekeeping missions must be directly linked to Security Council mandates and reflect the evolution of those mandates;",
    "10": "Requests the Secretary-General to include, in the performance report of the Mission, detailed information on programmatic activities, including on how the implementation of those activities has contributed to implementing mission mandates;",
    "11": "Emphasizes the importance of overall budgetary performance in peacekeeping operations, and requests the Secretary-General to continue to implement the recommendations of the relevant oversight bodies and to report thereon in the context of the performance reports;",
    "12": "Also emphasizes the importance of the accountability system of the Secretariat, and requests the Secretary-General to continue to strengthen risk management and internal controls in the management of peacekeeping budgets and to report thereon in the context of his next report;",
    "13": "Requests the Secretary-General to ensure the full implementation of the relevant provisions of its resolutions 59/296 of 22 June 2005, 60/266 of 30 June 2006, 61/276 of 29 June 2007, 64/269 of 24 June 2010, 65/289 of 30 June 2011, 66/264 of 21 June 2012, 69/307 of 25 June 2015 and 70/286 of 17 June 2016, as well as other relevant resolutions;",
    "14": " Budget performance report for the period from 16 October 2017 to 30 June 2018",
    "15": "Takes note of the report of the Secretary-General on the budget performance of the Mission for the period from 16 October 2017 to 30 June 2018; 1 Estimates for the period from 1 July to 31 December 2019",
    "16": "Authorizes the Secretary-General to enter into commitments for the maintenance of the Mission in an amount not exceeding 49,450,100 dollars for the period from 1 July to 31 December 2019; Financing of the commitment authority",
    "17": "Decides to apportion among Member States the amount of 49,450,100 dollars for the period from 1 July to 31 December 2019, in accordance with the levels updated in its resolution 73/272 of 22 December 2018, and taking into account the scale of assessments for 2019, as set out in its resolution 73/271 of 22 December 2018;",
    "18": "Also decides that, in accordance with the provisions of its resolution 973 (X) of 15 December 1955, there shall be set off against the apportionment among Member States, as provided for in paragraph 17 above, their respective share in the Tax Equalization Fund of 1,701,400 dollars, comprising the estimated staff assessment income approved for the Mission for the period from 1 July to 31 December 2019; Estimates for the support account for peacekeeping operations and the United Nations Logistics Base at Brindisi, Italy, for the period from 1 July 2019 to 30 June 2020",
    "19": "Decides to appropriate to the Special Account for the United Nations Mission for Justice Support in Haiti the amount of 3,300,000 dollars for the period from 1 July 2019 to 30 June 2020, comprising 2,801,000 dollars for the support account for peacekeeping operations and 499,000 dollars for the United Nations Logistics Base at Brindisi, Italy; Financing of the appropriation",
    "20": "Decides to apportion among Member States the amount of 3,300,000 dollars for the period from 1 July 2019 to 30 June 2020, in accordance with the levels updated in its resolution 73/272, and taking into account the scale of assessments for 2019 and 2020, as set out in its resolution 73/271;",
    "21": "Also decides that, in accordance with the provisions of its resolution 973 (X), there shall be set off against the apportionment among Member States, as provided for in paragraph 20 above, their respective share in the Tax Equalization Fund of 252,100 dollars, comprising the prorated share of 199,400 dollars of the estimated staff assessment income approved for the support account and the prorated share of 52,700 dollars of the estimated staff assessment income approved for the United Nations Logistics Base;",
    "22": "",
    "23": "Decides that, for Member States that have not fulfilled their financial obligations to the Mission, there shall be set off against their outstanding obligations their respective share of the unencumbered balance and other revenue in the amount of 350,300 dollars in respect of the financial period ended 30 June 2018, in accordance with the scheme set out in paragraph 22 above;",
    "24": "Also decides that the increase of 344,000 dollars in the estimated staff assessment income in respect of the financial period ended 30 June 2018 shall be added to the credits in the amount of 350,300 dollars referred to in paragraphs 22 and 23 above;",
    "25": "Encourages the Secretary-General to continue to take additional measures to ensure the safety and security of all personnel participating in the Mission under the auspices of the United Nations, bearing in mind paragraphs 5 and 6 of Security Council resolution 1502 (2003) of 26 August 2003;",
    "26": "Invites voluntary contributions to the Mission in cash and in the form of services and supplies acceptable to the Secretary-General, to be administered, as appropriate, in accordance with the procedure and practices established by the General Assembly;",
    "27": "Decides to include in the provisional agenda of its seventy-fourth session the item entitled \u201cFinancing of the United Nations Mission for Justice Support in Haiti\u201d."
  },
  "agenda_items": [
    "Item 158"
  ],
  "symbol_references": []
}