{
  "symbol": "A/RES/73/347",
  "filename": "A_RES_73_347.pdf",
  "title": "73/347. Cooperation between the United Nations and the Caribbean Community",
  "text": "United Nations \nA/RES/73/347 \n \n \nGeneral Assembly \nDistr.: General \n20 September 2019 \n \n19-15936 (E)    260919 \n*1915936* \n \n \nSeventy-third session \nAgenda item 128 (h) \n \n \n \n \n Resolution adopted by the General Assembly \non 16 September 2019 \n \n \n \n \n[without reference to a Main Committee (A/73/L.118 and A/73/L.118/Add.1)] \n \n \n 73/347. Cooperation between the United Nations \nand the Caribbean Community \n \n \n \nThe General Assembly, \n \nRecalling its resolution 46/8 of 16 October 1991 and all its subsequent \nresolutions on cooperation between the United Nations and the Caribbean \nCommunity, including its resolution 71/329 of 11 September 2017, \n \nBearing in mind the provisions of Chapter VIII of the Charter of the United \nNations on the existence of regional arrangements or agencies for dealing with such \nmatters relating to the maintenance of international peace and security as are \nappropriate for regional action and other activities consistent with the purposes and \nprinciples of the United Nations, \n \nWelcoming the continued commitment of the States members of the Caribbean \nCommunity to the United Nations as a principal forum for multilateral cooperation, \n \nRecalling the cooperation agreement between the secretariats of the United \nNations and the Caribbean Community, 1  and bearing in mind the cooperation \nactivities undertaken pursuant to that agreement, \n \nEmphasizing the continued importance of regular engagements between the two \norganizations, including contacts between the Secretary-General of the United \nNations and Heads of Government of the Caribbean Community, and also between \nthe Secretary-General of the United Nations and the Secretary-General of the \nCaribbean Community, with a view to reinforcing cooperation and collaboration, \n \nNoting, in this connection, the tenth general meeting between representatives of \nthe Caribbean Community and the United Nations system, held in Georgetown on \n23 and 24 July 2019, \n__________________ \n \n1 United Nations, Treaty Series, vol. 1978, No. 1197. \n\nA/RES/73/347 \nCooperation between the United Nations and the Caribbean Community\n \n19-15936\n2/2 \n \n \nNoting with appreciation the ongoing collaboration, consultations and \ninformation exchanges that have taken place among the United Nations, the \nCaribbean Community and the States members of the Community aimed at \nstrengthening cooperation and regional capacity in a broad range of areas, such as \nsustainable development, non-communicable diseases, drugs and crime, statistics, \nfree and fair elections, plant and animal health, and food safety, among others, \n \nAffirming the need to further expand and deepen the cooperation that already \nexists between the Caribbean Community and the United Nations agencies, funds and \nprogrammes, so as to enhance coherence and effectiveness in the partnership among \nthe United Nations, the Caribbean Community and the States members of the \nCommunity, \n \nConvinced of the need for the coordinated utilization of available resources to \npromote the common objectives of the two organizations, \n \n1. \nTakes note of the report of the Secretary-General on cooperation between \nthe United Nations and regional and other organizations,\n2  in particular \nparagraphs 24 to 26 on the Caribbean Community, concerning efforts to strengthen \nand deepen cooperation; \n \n2. \nCalls upon the Secretary-General of the United Nations, in association \nwith the Secretary-General of the Caribbean Community, as well as the relevant \nregional organizations, to continue to assist in furthering the development and \nmaintenance of peace and security within the Caribbean region; \n \n3. \nNotes the recent engagements between the United Nations and the \nCaribbean Community, and also notes the recently concluded tenth general meeting \nbetween representatives of the Caribbean Community and the United Nations system \nand the joint statement adopted at the conclusion of the meeting3 highlighting areas \nand opportunities of continued cooperation and strengthened collaboration; \n \n4. \nExpresses appreciation for the ongoing cooperation received from the \nDepartment of Global Communications of the Secretariat in the implementation of \nthe annual commemoration of the International Day of Remembrance of the Victims \nof Slavery and the Transatlantic Slave Trade on 25 March and for its support and \ncooperation rendered in the implementation of the permanent memorial initiative, in \nkeeping with the relevant General Assembly resolutions; \n \n5. \nRequests the Secretary-General to submit to the General Assembly at its \nseventy-fifth session a report on the implementation of the present resolution; \n \n6. \nDecides to include in the provisional agenda of its seventy-fifth session, \nunder the item entitled \u201cCooperation between the United Nations and regional and \nother organizations\u201d, the sub-item entitled \u201cCooperation between the United Nations \nand the Caribbean Community\u201d. \n \n107th plenary meeting  \n16 September 2019 \n \n__________________ \n \n2 A/73/328-S/2018/592. \n \n3  A/73/994-S/2019/695, annex. \n",
  "paragraphs": {
    "1": "Takes note of the report of the Secretary-General on cooperation between the United Nations and regional and other organizations, 2 in particular paragraphs 24 to 26 on the Caribbean Community, concerning efforts to strengthen and deepen cooperation;",
    "2": "Calls upon the Secretary-General of the United Nations, in association with the Secretary-General of the Caribbean Community, as well as the relevant regional organizations, to continue to assist in furthering the development and maintenance of peace and security within the Caribbean region;",
    "3": "Notes the recent engagements between the United Nations and the Caribbean Community, and also notes the recently concluded tenth general meeting between representatives of the Caribbean Community and the United Nations system and the joint statement adopted at the conclusion of the meeting3 highlighting areas and opportunities of continued cooperation and strengthened collaboration;",
    "4": "Expresses appreciation for the ongoing cooperation received from the Department of Global Communications of the Secretariat in the implementation of the annual commemoration of the International Day of Remembrance of the Victims of Slavery and the Transatlantic Slave Trade on 25 March and for its support and cooperation rendered in the implementation of the permanent memorial initiative, in keeping with the relevant General Assembly resolutions;",
    "5": "Requests the Secretary-General to submit to the General Assembly at its seventy-fifth session a report on the implementation of the present resolution;",
    "6": "Decides to include in the provisional agenda of its seventy-fifth session, under the item entitled \u201cCooperation between the United Nations and regional and other organizations\u201d, the sub-item entitled \u201cCooperation between the United Nations and the Caribbean Community\u201d."
  },
  "agenda_items": [
    "Item 128"
  ],
  "symbol_references": [
    "A/73/L.118"
  ]
}