{
  "symbol": "A/RES/72/294",
  "filename": "A_RES_72_294.pdf",
  "title": "72/294. Financing of the United Nations Stabilization Mission in Haiti",
  "text": "United Nations \nA/RES/72/294\n \n \nGeneral Assembly \nDistr.: General \n16 July 2018 \n \n18-11310 (E)    180718     \n*1811310* \n \n \nSeventy-second session \nAgenda item 156 \n \n \n \n \n Resolution adopted by the General Assembly on 5 July 2018 \n \n \n \n \n[on the report of the Fifth Committee (A/72/903)] \n \n \n 72/294. Financing of the United Nations Stabilization Mission in Haiti  \n \n \n \nThe General Assembly, \n \nHaving considered the report of the Secretary-General on the financing of the \nUnited Nations Stabilization Mission in Haiti1 and the related report of the Advisory \nCommittee on Administrative and Budgetary Questions,2  \n \nRecalling Security Council resolution 1529 (2004) of 29 February 2004, by \nwhich the Council declared its readiness to establish a United Nations stabilization \nforce to support continuation of a peaceful and constitutional political process and \nthe maintenance of a secure and stable environment in Haiti, \n \nRecalling also Security Council resolution 1542 (2004) of 30 April 2004, by \nwhich the Council established the United Nations Stabilization Mission in Haiti for \nan initial period of six months, and the subsequent resolutions by which the Council \nextended the mandate of the Mission, the latest of which was resolution 2350 (2017) \nof 13 April 2017, by which the Council extended the mandate of the Mission until \n15 October 2017, \n \nRecalling further its resolution 58/315 of 1 July 2004, \n \nRecalling its resolution 58/311 of 18 June 2004 on the financing of the Mission \nand its subsequent resolutions thereon, the latest of which was resolution 71/302 of \n30 June 2017, \n \nReaffirming the general principles underlying the financing of United Nations \npeacekeeping operations, as stated in its resolutions 1874 (S-IV) of 27 June 1963, \n3101 (XXVIII) of 11 December 1973 and 55/235 of 23 December 2000, \n \nMindful of the fact that it is essential to provide the Mission with the financial \nresources necessary to enable it to fulfil its responsibilities under the relevant \nresolutions of the Security Council, \n__________________ \n \n1  A/72/689. \n \n2  A/72/853. \n\nA/RES/72/294 \nFinancing of the United Nations Stabilization Mission in Haiti\n \n18-11310\n2/3 \n \n \n1. \nTakes note of the status of contributions to the United Nations Stabilization \nMission in Haiti as at 30 April 2018, including the contributions outstanding in the \namount of 71.1 million United States dollars, representing some 0.9 per cent of the \ntotal assessed contributions, notes with concern that only seven Member States have \npaid their assessed contributions in full, and urges all other Member States, in \nparticular those in arrears, to ensure payment of their outstanding assessed \ncontributions; \n \n2. \nExpresses its appreciation to those Member States that have paid their \nassessed contributions in full, and urges all other Member States to make every \npossible effort to ensure payment of their assessed contributions to the Mission in full; \n \n3. \nExpresses concern at the financial situation with regard to peacekeeping \nactivities, in particular as regards the reimbursements to troop contributors that bear \nadditional burdens owing to overdue payments by Member States of their \nassessments; \n \n4. \nEmphasizes that all future and existing peacekeeping missions shall be \ngiven equal and non-discriminatory treatment in respect of financial and \nadministrative arrangements; \n \n5. \nAlso emphasizes that all peacekeeping missions shall be provided with \nadequate resources for the effective and efficient discharge of their respective \nmandates; \n \n6. \nRequests the Secretary-General to ensure that proposed peacekeeping \nbudgets are based on the relevant legislative mandates; \n \n7. \nEndorses the conclusions and recommendations contained in the report of \nthe Advisory Committee on Administrative and Budgetary Questions, 2 and requests \nthe Secretary-General to ensure their full implementation; \n \n8. \nRequests the Secretary-General to ensure the full implementation of the \nrelevant provisions of its resolutions 59/296 of 22 June 2005, 60/266 of 30 June 2006, \n61/276 of 29 June 2007, 64/269 of 24 June 2010, 65/289 of 30 June 2011, 66/264 of \n21 June 2012, 69/307 of 25 June 2015 and 70/286 of 17 June 2016, as well as other \nrelevant resolutions; \n \n9. \nAlso requests the Secretary-General to take all action necessary to ensure \nthat the Mission is administered with a maximum of efficiency and economy; \n \n \n \nBudget performance report for the period from 1 July 2016 to 30 June 2017 \n \n \n10. Takes note of the report of the Secretary-General on the budget \nperformance of the Mission for the period from 1 July 2016 to 30 June 2017;1  \n \n11. \nDecides that Member States that have fulfilled their financial obligations \nto the Mission shall be credited with their respective share of the unencumbered \nbalance and other revenue in the amount of 14,382,400 dollars in respect of the \nfinancial period ended 30 June 2017, in accordance with the levels updated in its \nresolution 70/246 of 23 December 2015, taking into account the scale of assessments \nfor 2017, as set out in its resolution 70/245 of 23 December 2015;  \n \n12. Also decides that, for Member States that have not fulfilled their financial \nobligations to the Mission, there shall be set off against their outstanding obligations \ntheir respective share of the unencumbered balance and other revenue in the amount \nof 14,382,400 dollars in respect of the financial period ended 30 June 2017, in \naccordance with the scheme set out in paragraph 11 above;  \n\nFinancing of the United Nations Stabilization Mission in Haiti \nA/RES/72/294\n \n3/3\n18-11310 \n \n \n13. Further decides that the decrease in the estimated staff assessment income \nof 90,000 dollars in respect of the financial period ended 30 June 2017 shall be set \noff against the credits in the amount of 14,382,400 dollars referred to in paragraphs 11 \nand 12 above; \n \n14. Decides to include in the provisional agenda of its seventy-third session \nthe item entitled \u201cFinancing of the United Nations Stabilization Mission in Haiti\u201d. \n \n104th plenary meeting  \n5 July 2018 \n \n",
  "paragraphs": {
    "1": "Takes note of the status of contributions to the United Nations Stabilization Mission in Haiti as at 30 April 2018, including the contributions outstanding in the amount of 71.1 million United States dollars, representing some 0.9 per cent of the total assessed contributions, notes with concern that only seven Member States have paid their assessed contributions in full, and urges all other Member States, in particular those in arrears, to ensure payment of their outstanding assessed contributions;",
    "2": "Expresses its appreciation to those Member States that have paid their assessed contributions in full, and urges all other Member States to make every possible effort to ensure payment of their assessed contributions to the Mission in full;",
    "3": "Expresses concern at the financial situation with regard to peacekeeping activities, in particular as regards the reimbursements to troop contributors that bear additional burdens owing to overdue payments by Member States of their assessments;",
    "4": "Emphasizes that all future and existing peacekeeping missions shall be given equal and non-discriminatory treatment in respect of financial and administrative arrangements;",
    "5": "Also emphasizes that all peacekeeping missions shall be provided with adequate resources for the effective and efficient discharge of their respective mandates;",
    "6": "Requests the Secretary-General to ensure that proposed peacekeeping budgets are based on the relevant legislative mandates;",
    "7": "Endorses the conclusions and recommendations contained in the report of the Advisory Committee on Administrative and Budgetary Questions, 2 and requests the Secretary-General to ensure their full implementation;",
    "8": "Requests the Secretary-General to ensure the full implementation of the relevant provisions of its resolutions 59/296 of 22 June 2005, 60/266 of 30 June 2006, 61/276 of 29 June 2007, 64/269 of 24 June 2010, 65/289 of 30 June 2011, 66/264 of 21 June 2012, 69/307 of 25 June 2015 and 70/286 of 17 June 2016, as well as other relevant resolutions;",
    "9": "Also requests the Secretary-General to take all action necessary to ensure that the Mission is administered with a maximum of efficiency and economy; Budget performance report for the period from 1 July 2016 to 30 June 2017",
    "10": "Takes note of the report of the Secretary-General on the budget performance of the Mission for the period from 1 July 2016 to 30 June 2017;1",
    "11": "Decides that Member States that have fulfilled their financial obligations to the Mission shall be credited with their respective share of the unencumbered balance and other revenue in the amount of 14,382,400 dollars in respect of the financial period ended 30 June 2017, in accordance with the levels updated in its resolution 70/246 of 23 December 2015, taking into account the scale of assessments for 2017, as set out in its resolution 70/245 of 23 December 2015;",
    "12": "",
    "13": "Further decides that the decrease in the estimated staff assessment income of 90,000 dollars in respect of the financial period ended 30 June 2017 shall be set off against the credits in the amount of 14,382,400 dollars referred to in paragraphs 11 and 12 above;",
    "14": "Decides to include in the provisional agenda of its seventy-third session the item entitled \u201cFinancing of the United Nations Stabilization Mission in Haiti\u201d."
  },
  "agenda_items": [
    "Item 156"
  ],
  "symbol_references": []
}