{
  "symbol": "A/RES/72/87",
  "filename": "A_RES_72_87.pdf",
  "title": "72/87. Israeli practices affecting the human rights of the Palestinian people in the Occupied Palestinian Territory, including East Jerusalem",
  "text": "United Nations \nA/RES/72/87\n \n \nGeneral Assembly \nDistr.: General \n14 December 2017 \n \n17-22116 (E)    181217 \n*1722116* \n \n \nSeventy-second session \nAgenda item 54 \n \n \n \n \n Resolution adopted by the General Assembly \non 7 December 2017 \n \n \n \n \n[on the report of the Special Political and Decolonization Committee \n(Fourth Committee) (A/72/448)] \n \n \n \n72/87. Israeli practices affecting the human rights of the Palestinian \npeople in the Occupied Palestinian Territory, including  \nEast Jerusalem \n \n \n \nThe General Assembly, \n \nRecalling the Universal Declaration of Human Rights,1 \n \nRecalling also the International Covenant on Civil and Political Rights, 2 the \nInternational Covenant on Economic, Social and Cultural Rights 2 and the \nConvention on the Rights of the Child,3 and affirming that these human rights \ninstruments must be respected in the Occupied Palestinian Territory, including East \nJerusalem, \n \nReaffirming its relevant resolutions, including resolution 71/98 of 6 December \n2016, as well as those adopted at its tenth emergency special session, \n \nRecalling the relevant resolutions of the Human Rights Council, \n \nRecalling also the relevant resolutions of the Security Council, and stressing \nthe need for their implementation, \n \nHaving considered the report of the Special Committee to Investigate Israeli \nPractices Affecting the Human Rights of the Palestinian People and Other Arabs of \nthe Occupied Territories4 and the report of the Secretary-General on the work of the \nSpecial Committee,5 \n__________________ \n \n1  Resolution 217 A (III). \n \n2  See resolution 2200 A (XXI), annex. \n \n3  United Nations, Treaty Series, vol. 1577, No. 27531. \n \n4  A/72/539. \n \n5  A/72/296. \n\nA/RES/72/87 \nIsraeli practices affecting the human rights of the Palestinian people\nin the Occupied Palestinian Territory, including East Jerusalem\n \n17-22116 \n2/8 \n \n \nTaking note of the recent reports of the Special Rapporteur of the Human \nRights Council on the situation of human rights in the Palestinian territories \noccupied since 1967,6 as well as of other relevant recent reports of the Human \nRights Council, \n \nTaking note also of the recent report by the Economic and Social Commission \nfor Western Asia on the economic and social repercussions of the Israeli occupation \non the living conditions of the Palestinian people in the Occupied Palestinian \nTerritory, including East Jerusalem, and the Arab population in the occupied Syrian \nGolan,7 \n \nDeeply regretting that 50 years have passed since the onset of the Israeli \noccupation, and stressing the urgent need for efforts to reverse the negative trends \non the ground and to restore a political horizon for advancing and accelerating \nmeaningful negotiations aimed at the achievement of a peace agreement that will \nbring a complete end to the Israeli occupation that began in 1967 and the resolution \nof all core final status issues, without exception, leading to a peaceful, just, lasting \nand comprehensive solution of the question of Palestine, \n \nAware of the responsibility of the international community to promote human \nrights and ensure respect for international law, and recalling in this regard its \nresolution 2625 (XXV) of 24 October 1970, \n \nRecalling the advisory opinion rendered on 9 July 2004 by the International \nCourt of Justice on the legal consequences of the construction of a wall in the \nOccupied Palestinian Territory,8 and recalling also General Assembly resolutions \nES-10/15 of 20 July 2004 and ES-10/17 of 15 December 2006, \n \nNoting in particular the Court\u2019s reply, including that the construction of the \nwall being built by Israel, the occupying Power, in the Occupied Palestinian \nTerritory, including in and around East Jerusalem, and its associated regime are \ncontrary to international law, \n \nTaking note of its resolution 67/19 of 29 November 2012, \n \nNoting the accession by Palestine to several human rights treaties and the core \nhumanitarian law conventions, as well as other international treaties, \n \nReaffirming the principle of the inadmissibility of the acquisition of territory \nby force, \n \nReaffirming also the applicability of the Geneva Convention relative to the \nProtection of Civilian Persons in Time of War, of 12 August 1949,9 to the Occupied \nPalestinian Territory, including East Jerusalem, and other Arab territories occupied \nby Israel since 1967, \n \nReaffirming further the obligation of the States parties to the Fourth Geneva \nConvention9 under articles 146, 147 and 148 with regard to penal sanctions, grave \nbreaches and responsibilities of the High Contracting Parties, \n \nRecalling the statement of 15 July 1999 and the declarations adopted on \n5 December 2001 and on 17 December 201410 by the Conference of High \nContracting Parties to the Fourth Geneva Convention on measures to enforce the \nConvention in the Occupied Palestinian Territory, including East Jerusalem, aimed \n__________________ \n \n6  A/HRC/34/70; see also A/72/556. \n \n7  A/72/90-E/2017/71. \n \n8  See A/ES-10/273 and A/ES-10/273/Corr.1. \n \n9  United Nations, Treaty Series, vol. 75, No. 973. \n \n10  A/69/711-S/2015/1, annex. \n\nIsraeli practices affecting the human rights of the Palestinian people \nin the Occupied Palestinian Territory, including East Jerusalem \nA/RES/72/87\n \n3/8 \n17-22116 \n \nat ensuring respect for the Convention in the Occupied Palestinian Territory, \nincluding East Jerusalem, \n \nReaffirming that all States have the right and the duty to take actions in \nconformity with international law and international humanitarian law to counter \ndeadly acts of violence against their civilian population in order to protect the lives \nof their citizens, \n \nStressing the need for full compliance with the Israeli-Palestinian agreements \nreached within the context of the Middle East peace process, including the Sharm \nel-Sheikh understandings, and the implementation of the Quartet road map to a \npermanent two-State solution to the Israeli-Palestinian conflict,11 \n \nStressing also the need for the full implementation of the Agreement on \nMovement and Access and the Agreed Principles for the Rafah Crossing, both of \n15 November 2005, to allow for the freedom of movement of the Palestinian \ncivilian population within and into and out of the Gaza Strip, \n \nGravely concerned by the tensions and violence in the recent period \nthroughout the Occupied Palestinian Territory, including East Jerusalem and \nincluding with regard to the holy places of Jerusalem, including the Haram  \nal-Sharif, and deploring the loss of innocent civilian life, \n \nRecognizing that security measures alone cannot remedy the escalating \ntensions, instability and violence, and calling for full respect for international law, \nincluding humanitarian and human rights law, including for the protection of \ncivilian life, as well as for the promotion of human security, the de-escalation of the \nsituation, the exercise of restraint, including from provocative actions and rhetoric, \nand the establishment of a stable environment conducive to the pursuit of peace, \n \nExpressing grave concern about the continuing systematic violation of the \nhuman rights of the Palestinian people by Israel, the occupying Power, including \nthat arising from the excessive use of force and military operations causing death \nand injury to Palestinian civilians, including children, women and non-violent, \npeaceful demonstrators; the arbitrary imprisonment and detention of Palestinians, \nsome of whom have been imprisoned for decades; the use of collective punishment; \nthe closure of areas; the confiscation of land; the establishment and expansion of \nsettlements; the construction of a wall in the Occupied Palestinian Territory in \ndeparture from the Armistice Line of 1949; the destruction of property and \ninfrastructure; the forced displacement of civilians, including attempts at forced \ntransfers of Bedouin communities; and all other actions by it designed to change the \nlegal status, geographical nature and demographic composition of the Occupied \nPalestinian Territory, including East Jerusalem, \n \nGravely concerned by the ongoing demolition by Israel, the occupying Power, \nof Palestinian homes, as well as of structures, including schools, provided as \ninternational humanitarian aid, in particular in and around Occupied East Jerusalem, \nincluding if carried out as an act of collective punishment in violation of \ninternational humanitarian law, which has escalated at unprecedented rates, and by \nthe revocation of residence permits and eviction of Palestinian residents of the City \nof Jerusalem, \n \nDeploring the continuing and negative consequences of the conflicts in and \naround the Gaza Strip, most recently in July and August 2014, and the thousands of \ncivilian casualties caused, along with the widespread destruction of thousands \nof homes and vital civilian infrastructure, the internal displacement of hundreds of \n__________________ \n \n11  S/2003/529, annex. \n\nA/RES/72/87 \nIsraeli practices affecting the human rights of the Palestinian people\nin the Occupied Palestinian Territory, including East Jerusalem\n \n17-22116 \n4/8 \n \nthousands of civilians, and any violations of international law, including \nhumanitarian and human rights law, in this regard, \n \nGravely concerned about the disastrous humanitarian situation and the critical \nsocioeconomic and security situation in the Gaza Strip, including that resulting from \nthe prolonged closures and severe economic and movement restrictions that in effect \namount to a blockade and deepen poverty and despair among the Palestinian civilian \npopulation, \n \nExpressing grave concern about the alarming conditions and figures reflected \nin the United Nations country team reports of 26 August 2016, entitled \u201cGaza: two \nyears after\u201d, and of July 2017, entitled \u201cGaza ten years later\u201d, \n \nRecalling the statement by the President of the Security Council of \n28 July 2014,12 \n \nStressing the need for the full implementation by all parties of Security \nCouncil resolution 1860 (2009) of 8 January 2009 and General Assembly resolution \nES-10/18 of 16 January 2009, \n \nStressing also that the situation in the Gaza Strip is unsustainable and that a \ndurable ceasefire agreement must lead to a fundamental improvement in the living \nconditions of the Palestinian people in the Gaza Strip, including through the \nsustained and regular opening of crossing points, and ensure the safety and well-\nbeing of civilians on both sides, and regretting the lack of progress made in this \nregard, \n \nGravely concerned by reports regarding serious human rights violations and \ngrave breaches of international humanitarian law committed during the military \noperations in the Gaza Strip between December 2008 and January 2009, including \nthe findings in the summary by the Secretary-General of the report of the Board of \nInquiry13 and in the report of the United Nations Fact-finding Mission on the Gaza \nConflict,14 and the findings of the United Nations Headquarters Board of Inquiry \ninto certain incidents that occurred in the Gaza Strip between 8 July and 26 August \n201415 and of the independent commission of inquiry established pursuant to Human \nRights Council resolution S-21/1,16 and reiterating the necessity for serious follow-up \nby all parties of the recommendations addressed to them towards ensuring \naccountability and justice, \n \nStressing the need for protection of human rights defenders engaged in the \npromotion of human rights issues in the Occupied Palestinian Territory, including \nEast Jerusalem, to allow them to carry out their work freely and without fear of \nattacks and harassment, \n \nExpressing deep concern about the short- and long-term detrimental impact of \nwidespread destruction and the continued impeding of the reconstruction process by \nIsrael, the occupying Power, on the human rights situation and on the \nsocioeconomic and humanitarian conditions of the Palestinian civilian population, \n \nExpressing deep concern also about the Israeli policy of closures and the \nimposition of severe restrictions, including through hundreds of obstacles to \nmovement, checkpoints and a permit regime, all of which obstruct the freedom of \nmovement of persons and goods, including medical and humanitarian goods, and the \n__________________ \n \n12  S/PRST/2014/13; see Resolutions and Decisions of the Security Council, 1 August 2013\u201331 July \n2014 (S/INF/69). \n \n13  See A/63/855-S/2009/250. \n \n14  A/HRC/12/48. \n \n15  See S/2015/286, annex. \n \n16 A/HRC/29/52. \n\nIsraeli practices affecting the human rights of the Palestinian people \nin the Occupied Palestinian Territory, including East Jerusalem \nA/RES/72/87\n \n5/8 \n17-22116 \n \nfollow-up and access to donor-funded projects of development cooperation and \nhumanitarian assistance, throughout the Occupied Palestinian Territory, including \nEast Jerusalem, and impair the Territory\u2019s contiguity, consequently violating the \nhuman rights of the Palestinian people and negatively impacting their \nsocioeconomic and humanitarian situation, which remains dire in the Gaza Strip, \nand the efforts aimed at rehabilitating and developing the Palestinian economy, \nwhile taking note of developments with regard to the situation of access there and \nthe resumption of some trade from Gaza to the West Bank for the first time since \n2007, and calling for the full lifting of restrictions, \n \nExpressing grave concern that thousands of Palestinians, including many \nchildren and women, as well as elected representatives, continue to be held in Israeli \nprisons or detention centres under harsh conditions, including unhygienic \nconditions, solitary confinement, the extensive use of administrative detention of \nexcessive duration without charge and denial of due process, lack of proper medical \ncare and widespread medical neglect, including for prisoners who are ill, with the \nrisk of fatal consequences, and denial of family visits, that impair their well-being, \nand expressing grave concern also about the ill-treatment and harassment and all \nreports of torture of any Palestinian prisoners, \n \nExpressing deep concern about the recent hunger strikes by numerous \nPalestinian prisoners in protest of the harsh conditions of their imprisonment and \ndetention by the occupying Power, while taking note of agreements reached on \nconditions of detention in Israeli prisons and calling for their full and immediate \nimplementation, \n \nRecalling the United Nations Standard Minimum Rules for the Treatment of \nPrisoners (the Nelson Mandela Rules)17 and the United Nations Rules for the \nTreatment of Women Prisoners and Non-custodial Measures for Women Offenders \n(the Bangkok Rules),18 and calling for respect for those Rules, \n \nRecalling also the prohibition under international humanitarian law of the \ndeportation of civilians from occupied territories, \n \nDeploring the practice of withholding the bodies of those killed, and calling \nfor the release of the bodies that have not yet been returned to their relatives, in line \nwith international humanitarian law and human rights law, in order to ensure \ndignified closure in accordance with their religious beliefs and traditions, \n \nStressing the need for the prevention of all acts of violence, harassment, \nprovocation and incitement by extremist Israeli settlers and groups of armed \nsettlers, especially against Palestinian civilians, including children, and their \nproperties, including homes, agricultural lands and historic and religious sites, \nincluding in Occupied East Jerusalem, and deploring the violation of the human \nrights of Palestinians in this regard, including acts of violence leading to death and \ninjury among civilians, \n \nConvinced of the need for an international presence to monitor the situation, to \ncontribute to ending the violence and protecting the Palestinian civilian population \nand to help the parties to implement the agreements reached, and in this regard \nrecalling the positive contribution of the Temporary International Presence in \nHebron, \n \nNoting the continued efforts and tangible progress made in the Palestinian \nsecurity sector, and noting also the continued cooperation that benefits both \nPalestinians and Israelis, in particular by promoting security and building \n__________________ \n \n17  Resolution 70/175, annex. \n \n18  Resolution 65/229, annex. \n\nA/RES/72/87 \nIsraeli practices affecting the human rights of the Palestinian people\nin the Occupied Palestinian Territory, including East Jerusalem\n \n17-22116 \n6/8 \n \nconfidence, and expressing the hope that such progress will be extended to all major \npopulation centres, \n \nUrging the parties to observe calm and restraint and to refrain from \nprovocative actions, incitement and inflammatory rhetoric, especially in areas of \nreligious and cultural sensitivity, including in East Jerusalem, and to take every \npossible step to defuse tensions and promote conditions conducive to the credibility \nand success of the peace negotiations, \n \nEmphasizing the right of all people in the region to the enjoyment of human \nrights as enshrined in the international human rights covenants, \n \n1. \nReiterates that all measures and actions taken by Israel, the occupying \nPower, in the Occupied Palestinian Territory, including East Jerusalem, in violation \nof the relevant provisions of the Geneva Convention relative to the Protection of \nCivilian Persons in Time of War, of 12 August 1949,9 and contrary to the relevant \nresolutions of the Security Council, are illegal and have no validity; \n \n2. \nDemands that Israel, the occupying Power, cease all practices and actions \nthat violate the human rights of the Palestinian people, including the killing and \ninjury of civilians, the arbitrary detention and imprisonment of civilians, the forced \ndisplacement of civilians, including attempts at forced transfers of Bedouin \ncommunities, the destruction and confiscation of civilian property, including home \ndemolitions, including if carried out as collective punishment in violation of \ninternational humanitarian law, and any obstruction of humanitarian assistance, and \nthat it fully respect human rights law and comply with its legal obligations in this \nregard, including in accordance with relevant United Nations resolutions; \n \n3. \nAlso demands that Israel, the occupying Power, comply fully with the \nprovisions of the Fourth Geneva Convention of 1949 9 and cease immediately all \nmeasures and actions taken in violation and in breach of the Convention; \n \n4. \nCalls for urgent measures to ensure the safety and protection of the \nPalestinian civilian population in the Occupied Palestinian Territory, including East \nJerusalem, in accordance with the relevant provisions of international humanitarian \nlaw and as called for by the Security Council in its resolution 904 (1994) of \n18 March 1994; \n \n5. \nAlso calls for full cooperation by Israel with the relevant special \nrapporteurs and other relevant mechanisms and inquiries of the Human Rights \nCouncil, including the facilitation of entry to the Occupied Palestinian Territory, \nincluding East Jerusalem, for monitoring and reporting on the human rights \nsituation therein according to their respective mandates; \n \n6. \nDemands that Israel, the occupying Power, cease all of its settlement \nactivities, the construction of the wall and any other measures aimed at altering the \ncharacter, status and demographic composition of the Occupied Palestinian \nTerritory, including in and around East Jerusalem, all of which, inter alia, gravely \nand detrimentally impact the human rights of the Palestinian people, and the \nprospects for achieving without delay an end to the Israeli occupation that began in \n1967 and a just, lasting and comprehensive peace settlement between the Palestinian \nand Israeli sides, and calls for the full respect and implementation of all relevant \nGeneral Assembly and Security Council resolutions in this regard, including \nSecurity Council resolution 2334 (2016) of 23 December 2016; \n \n7. \nCalls for urgent attention to the plight and the rights, in accordance with \ninternational law, of Palestinian prisoners and detainees in Israeli jails, including \nthose on hunger strike, calls for efforts between the two sides for the further release \nof prisoners and detainees, and also calls for respect for the United Nations \n\nIsraeli practices affecting the human rights of the Palestinian people \nin the Occupied Palestinian Territory, including East Jerusalem \nA/RES/72/87\n \n7/8 \n17-22116 \n \nStandard Minimum Rules for the Treatment of Prisoners (the Nelson Mandela \nRules)17 and the United Nations Rules for the Treatment of Women Prisoners and \nNon-custodial Measures for Women Offenders (the Bangkok Rules);18 \n \n8. \nCondemns all acts of violence, including all acts of terror, provocation, \nincitement and destruction, especially the excessive use of force by the Israeli \noccupying forces against Palestinian civilians, particularly in the Gaza Strip, which \nhave caused extensive loss of life and vast numbers of injuries, including among \nthousands of children and women, massive damage and destruction to homes, \neconomic, industrial and agricultural properties, vital infrastructure, including \nwater, sanitation and electricity networks, religious sites and public institutions, \nincluding hospitals and schools, and United Nations facilities, and agricultural \nlands, and large-scale internal displacement of civilians; \n \n9. \nExpresses grave concern at the firing of rockets against Israeli civilian \nareas, resulting in loss of life and injury; \n \n10. Reiterates its demand for the full implementation of Security Council \nresolution 1860 (2009); \n \n11. \nDemands that Israel, the occupying Power, comply with its legal \nobligations under international law, as mentioned in the advisory opinion rendered \non 9 July 2004 by the International Court of Justice8 and as demanded in General \nAssembly resolutions ES-10/15 and ES-10/13 of 21 October 2003, and that it \nimmediately cease the construction of the wall in the Occupied Palestinian Territory, \nincluding in and around East Jerusalem, dismantle forthwith the structure situated \ntherein, repeal or render ineffective all legislative and regulatory acts relating \nthereto, and make reparations for all damage caused by the construction of the wall, \nwhich has gravely impacted the human rights and the socioeconomic living \nconditions of the Palestinian people; \n \n12. Reiterates the need for respect for the territorial unity, contiguity and \nintegrity of all of the Occupied Palestinian Territory and for guarantees of the \nfreedom of movement of persons and goods within the Palestinian territory, \nincluding movement into and from East Jerusalem, into and from the Gaza Strip, \nbetween the West Bank and the Gaza Strip, and to and from the outside world; \n \n13. Calls upon Israel, the occupying Power, to cease its imposition of \nprolonged closures and economic and movement restrictions, including those \namounting to a blockade on the Gaza Strip, and in this regard to fully implement the \nAgreement on Movement and Access and the Agreed Principles for the Rafah \nCrossing, both of 15 November 2005, in order to allow for the sustained and regular \nmovement of persons and goods and for the acceleration of long overdue and \nmassive reconstruction needs and economic recovery in the Gaza Strip, while noting \nthe tripartite agreement facilitated by the United Nations in this regard; \n \n14. Urges Member States to continue to provide emergency assistance to the \nPalestinian people to alleviate the financial crisis and the dire socioeconomic and \nhumanitarian situation, particularly in the Gaza Strip; \n \n15. Emphasizes the need to preserve and develop the Palestinian institutions \nand infrastructure for the provision of vital public services to the Palestinian civilian \npopulation and the promotion of human rights, including civil, political, economic, \nsocial and cultural rights, and welcomes in this regard the agreement signed in Cairo \non 12 October 2017,19 the implementation of which would be an important step \ntowards achieving Palestinian unity and lead to the effective functioning of the \nPalestinian national consensus government, including in the Gaza Strip, under the \n__________________ \n \n19  S/2017/899, annex. \n\nA/RES/72/87 \nIsraeli practices affecting the human rights of the Palestinian people\nin the Occupied Palestinian Territory, including East Jerusalem\n \n17-22116 \n8/8 \n \nleadership of President Mahmoud Abbas, consistent with the Palestine Liberation \nOrganization commitments and the Quartet principles; \n \n16. Urges all States and the specialized agencies and organizations of the \nUnited Nations system to continue to support and assist the Palestinian people in the \nearly realization of their inalienable human rights, including their right to self-\ndetermination, as a matter of urgency, in the light of the fiftieth year of the Israeli \noccupation and the continued denial and violation of the human rights of the \nPalestinian people; \n \n17. Requests the Secretary-General to report to the General Assembly at its \nseventy-third session on the implementation of the present resolution. \n \n66th plenary meeting  \n7 December 2017 \n \n",
  "paragraphs": {
    "1": "Reiterates that all measures and actions taken by Israel, the occupying Power, in the Occupied Palestinian Territory, including East Jerusalem, in violation of the relevant provisions of the Geneva Convention relative to the Protection of Civilian Persons in Time of War, of 12 August 1949,9 and contrary to the relevant resolutions of the Security Council, are illegal and have no validity;",
    "2": "Demands that Israel, the occupying Power, cease all practices and actions that violate the human rights of the Palestinian people, including the killing and injury of civilians, the arbitrary detention and imprisonment of civilians, the forced displacement of civilians, including attempts at forced transfers of Bedouin communities, the destruction and confiscation of civilian property, including home demolitions, including if carried out as collective punishment in violation of international humanitarian law, and any obstruction of humanitarian assistance, and that it fully respect human rights law and comply with its legal obligations in this regard, including in accordance with relevant United Nations resolutions;",
    "3": "Also demands that Israel, the occupying Power, comply fully with the provisions of the Fourth Geneva Convention of 1949 9 and cease immediately all measures and actions taken in violation and in breach of the Convention;",
    "4": "Calls for urgent measures to ensure the safety and protection of the Palestinian civilian population in the Occupied Palestinian Territory, including East Jerusalem, in accordance with the relevant provisions of international humanitarian law and as called for by the Security Council in its resolution 904 (1994) of 18 March 1994;",
    "5": "Also calls for full cooperation by Israel with the relevant special rapporteurs and other relevant mechanisms and inquiries of the Human Rights Council, including the facilitation of entry to the Occupied Palestinian Territory, including East Jerusalem, for monitoring and reporting on the human rights situation therein according to their respective mandates;",
    "6": "Demands that Israel, the occupying Power, cease all of its settlement activities, the construction of the wall and any other measures aimed at altering the character, status and demographic composition of the Occupied Palestinian Territory, including in and around East Jerusalem, all of which, inter alia, gravely and detrimentally impact the human rights of the Palestinian people, and the prospects for achieving without delay an end to the Israeli occupation that began in 1967 and a just, lasting and comprehensive peace settlement between the Palestinian and Israeli sides, and calls for the full respect and implementation of all relevant General Assembly and Security Council resolutions in this regard, including Security Council resolution 2334 (2016) of 23 December 2016;",
    "7": " Standard Minimum Rules for the Treatment of Prisoners (the Nelson Mandela Rules)17 and the United Nations Rules for the Treatment of Women Prisoners and Non-custodial Measures for Women Offenders (the Bangkok Rules);18",
    "8": "Condemns all acts of violence, including all acts of terror, provocation, incitement and destruction, especially the excessive use of force by the Israeli occupying forces against Palestinian civilians, particularly in the Gaza Strip, which have caused extensive loss of life and vast numbers of injuries, including among thousands of children and women, massive damage and destruction to homes, economic, industrial and agricultural properties, vital infrastructure, including water, sanitation and electricity networks, religious sites and public institutions, including hospitals and schools, and United Nations facilities, and agricultural lands, and large-scale internal displacement of civilians;",
    "9": "Expresses grave concern at the firing of rockets against Israeli civilian areas, resulting in loss of life and injury;",
    "10": "Reiterates its demand for the full implementation of Security Council resolution 1860 (2009);",
    "11": "Demands that Israel, the occupying Power, comply with its legal obligations under international law, as mentioned in the advisory opinion rendered on 9 July 2004 by the International Court of Justice8 and as demanded in General Assembly resolutions ES-10/15 and ES-10/13 of 21 October 2003, and that it immediately cease the construction of the wall in the Occupied Palestinian Territory, including in and around East Jerusalem, dismantle forthwith the structure situated therein, repeal or render ineffective all legislative and regulatory acts relating thereto, and make reparations for all damage caused by the construction of the wall, which has gravely impacted the human rights and the socioeconomic living conditions of the Palestinian people;",
    "12": "Reiterates the need for respect for the territorial unity, contiguity and integrity of all of the Occupied Palestinian Territory and for guarantees of the freedom of movement of persons and goods within the Palestinian territory, including movement into and from East Jerusalem, into and from the Gaza Strip, between the West Bank and the Gaza Strip, and to and from the outside world;",
    "13": "Calls upon Israel, the occupying Power, to cease its imposition of prolonged closures and economic and movement restrictions, including those amounting to a blockade on the Gaza Strip, and in this regard to fully implement the Agreement on Movement and Access and the Agreed Principles for the Rafah Crossing, both of 15 November 2005, in order to allow for the sustained and regular movement of persons and goods and for the acceleration of long overdue and massive reconstruction needs and economic recovery in the Gaza Strip, while noting the tripartite agreement facilitated by the United Nations in this regard;",
    "14": "Urges Member States to continue to provide emergency assistance to the Palestinian people to alleviate the financial crisis and the dire socioeconomic and humanitarian situation, particularly in the Gaza Strip;",
    "15": "Emphasizes the need to preserve and develop the Palestinian institutions and infrastructure for the provision of vital public services to the Palestinian civilian population and the promotion of human rights, including civil, political, economic, social and cultural rights, and welcomes in this regard the agreement signed in Cairo on 12 October 2017,19 the implementation of which would be an important step towards achieving Palestinian unity and lead to the effective functioning of the Palestinian national consensus government, including in the Gaza Strip, under the leadership of President Mahmoud Abbas, consistent with the Palestine Liberation Organization commitments and the Quartet principles;",
    "16": "Urges all States and the specialized agencies and organizations of the United Nations system to continue to support and assist the Palestinian people in the early realization of their inalienable human rights, including their right to self- determination, as a matter of urgency, in the light of the fiftieth year of the Israeli occupation and the continued denial and violation of the human rights of the Palestinian people;",
    "17": "Requests the Secretary-General to report to the General Assembly at its seventy-third session on the implementation of the present resolution."
  },
  "agenda_items": [
    "Item 54"
  ],
  "symbol_references": []
}