{
  "symbol": "A/RES/75/130",
  "filename": "A_RES_75_130.pdf",
  "title": "75/130. Global health and foreign policy: strengthening health system resilience through affordable health care for all",
  "text": "United Nations \nA/RES/75/130\n \n \nGeneral Assembly \nDistr.: General \n21 December 2020 \n \n20-17079 (E)    281220     \n*2017079* \n \n \nSeventy-fifth session \nAgenda item 131 \nGlobal health and foreign policy \n \n \n \n \n Resolution adopted by the General Assembly \non 14 December 2020 \n \n \n \n \n[without reference to a Main Committee (A/75/L.41 and A/75/L.41/Add.1)] \n \n \n 75/130. Global health and foreign policy: strengthening health system \nresilience through affordable health care for all \n \n \n \nThe General Assembly, \n \nRecalling its resolutions 63/33 of 26 November 2008, 64/108 of 10 December \n2009, 65/95 of 9 December 2010, 66/115 of 12 December 2011, 67/81 of 12 December \n2012, 68/98 of 11 December 2013, 69/132 of 11 December 2014, 70/183 of \n17 December 2015, 71/159 of 15 December 2016, 72/139 of 12 December 2017, \n73/132 of 13 December 2018 and 74/20 of 11 December 2019, \n \nReaffirming its resolution 70/1 of 25 September 2015, entitled \u201cTransforming \nour world: the 2030 Agenda for Sustainable Development\u201d, in which it adopted a \nwide, far-reaching and people-centred set of universal and transformative Sustainable \nDevelopment Goals and targets, its commitment to working tirelessly for the full \nimplementation of the Agenda by 2030, its recognition that eradicating poverty in all \nits forms and dimensions, including extreme poverty, is the greatest global challenge \nand an indispensable requirement for sustainable development, its commitment to \nachieving sustainable development goals that are integrated and indivisible and \nbalanced in its three dimensions \u2013 economic, social and environmental \u2013 and its \ncommitment to building upon the achievements of the Millennium Development \nGoals and seeking to address their unfinished business, recommitting that no one will \nbe left behind and endeavouring to reach the furthest behind first, \n \nReaffirming also its resolution 69/313 of 27 July 2015 on the Addis Ababa \nAction Agenda of the Third International Conference on Financing for Development, \nwhich is an integral part of the 2030 Agenda for Sustainable Development, supports \nand complements it, helps to contextualize its means of implementation targets with \nconcrete policies and actions, and reaffirms the strong political commitment to \naddress the challenge of financing and creating an enabling environment at all levels \nfor sustainable development in the spirit of global partnership and solidarity, \n\nA/RES/75/130 \nGlobal health and foreign policy: strengthening health system \nresilience through affordable health care for all\n \n20-17079\n2/9 \n \n \nRecalling the Universal Declaration of Human Rights,1 the International \nCovenant on Economic, Social and Cultural Rights,2 the International Convention on \nthe Elimination of All Forms of Racial Discrimination,3 the Convention on the \nElimination of All Forms of Discrimination against Women, 4 the Convention on the \nRights of the Child,5 the Convention on the Rights of Persons with Disabilities, 6 the \nInternational Covenant on Civil and Political Rights7 and relevant provisions of \ninternational humanitarian law, \n \nRecalling also that the Constitution of the World Health Organization 8 defines \nhealth as a state of complete physical, mental and social well-being and not merely \nthe absence of disease or infirmity, and declares that the enjoyment of the highest \nattainable standard of health is one of the fundamental rights of every human being, \nwithout distinction of race, religion, political belief, economic or social condition, \n \nNoting the significance role of the Foreign Policy and Global Health Initiative \nin promoting synergies between foreign policy and global health, as well as the \ncontribution of the Oslo Ministerial Declaration of 20 March 2007, entitled \u201cGlobal \nhealth: a pressing foreign policy issue of our time\u201d, 9 which was reaffirmed, with \nrenewed actions and commitments, in the ministerial communiqu\u00e9 of the Initiative \nentitled \u201cRenewing 10 years of concerted efforts and preparing for new challenges\u201d, \nof 22 September 2017,10 \n \nRecognizing that States have the primary responsibility for the creation of \nnational and international conditions favourable to the realization of the right to \ndevelopment and should ensure, inter alia, equality of opportunity for all in their \naccess to basic resources, such as health services, food, housing, employment and the \nfair distribution of income, \n \nRecalling the outcome of the high-level meeting on universal health coverage, \nand reaffirming its political declaration, entitled \u201cUniversal health coverage: moving \ntogether to build a healthier world\u201d,11 which reiterated, inter alia, the importance of \nscaling up the global effort to leave no one behind and to build a healthier world for \nall, as well as accelerating efforts towards the achievement of universal health \ncoverage by 2030 to ensure healthy lives and promote well-being for all throughout \nthe life course, \n \nReiterating the importance of national ownership and the primary role and \nresponsibility of governments at all levels to determine their own path towards \nachieving universal health coverage, in accordance with national contexts and \npriorities, which is critical for minimizing public health hazards and vulnerabilities \nas well as delivering effective prevention, surveillance, early warning, response and \nrecovery in health emergencies, and emphasizing the essential role of resilient health \nsystems in disaster risk reduction, as recognized in the Sendai Framework for Disaster \nRisk Reduction 2015\u20132030,12 \n__________________ \n \n1 Resolution 217 A (III). \n \n2 See resolution 2200 A (XXI), annex. \n \n3 United Nations, Treaty Series, vol. 660, No. 9464. \n \n4 Ibid., vol. 1249, No. 20378. \n \n5 Ibid., vol. 1577, No. 27531. \n \n6 Ibid., vol. 2515, No. 44910. \n \n7 See resolution 2200 A (XXI), annex. \n \n8 United Nations, Treaty Series, vol. 14, No. 221. \n \n9 A/63/591, annex. \n \n10 A/72/559, annex. \n \n11 Resolution 74/2. \n \n12 Resolution 69/283, annex II. \n\nGlobal health and foreign policy: strengthening health system \nresilience through affordable health care for all \nA/RES/75/130\n \n3/9\n20-17079 \n \n \nRecalling the adoption of its resolution 74/306 of 11 September 2020, entitled \n\u201cComprehensive and coordinated response to the coronavirus disease (COVID-19) \npandemic\u201d, and World Health Assembly resolution WHA73.1 of 19 May 2020, \nentitled \u201cCOVID-19 response\u201d, \n \nRecognizing that the COVID-19 pandemic is one of the greatest global \nchallenges in the history of the United Nations, and noting with deep concern its \nimpact on health and the loss of life, mental health and well-being, as well as the \nnegative impact on global humanitarian needs, the enjoyment of human rights and \nacross all spheres of society, including on livelihoods, food security and nutrition, \nand education, the exacerbation of poverty and hunger, disruption to economies, \ntrade, societies and environments, and the exacerbation of economic and social \ninequalities within and among countries, which is reversing hard-won development \ngains and hampering progress towards achieving the 2030 Agenda and all its Goals \nand targets, \n \nAcknowledging that the COVID-19 pandemic calls for continued leadership, \nmultilateral commitment and collaboration, among Member States and with relevant \nUnited Nations entities, especially with the World Health Organization, and other \nrelevant international organizations, to implement robust national responses, while \nalso recognizing the key leadership role of the World Health Organization within the \nbroader United Nations response, \n \nUnderlining the importance of achieving Sustainable Development Goal 3, \nuniversal health coverage and universal access to affordable quality essential health \nservices, including financial risk protection and access to quality, safe, effective, \naffordable and essential medicines, diagnostics, vaccines and other health \ntechnologies for all, as well as health promotion and disease prevention, while also \nacknowledging the importance of health across all the goals and targets of the 2030 \nAgenda, \n \nUnderscoring that investments in health systems aligned with the 2030 Agenda \nare key to advancing prosperity and development and alleviating poverty, including \nfor employment, trade, supply chains and travel, and underscoring also the need for \nsustained attention, commitment and closer cooperation, including partnership for \nglobal health, to ensure the promotion of effective implementation of universal health \ncoverage on the basis of solidarity at the national, regional and international levels, \n \nUnderlining the urgency of having strong and resilient health systems, reaching \nthose who are vulnerable or in vulnerable situations and capable of effectively \nimplementing the International Health Regulations (2005) 13 in the context of health \nemergencies, ensuring pandemic preparedness and the prevention and detection of \nand response to any outbreaks, infectious disease and other health threats, \n \nRecognizing the need to enhance cooperation at the national, regional and global \nlevels to address antimicrobial resistance, using an integrated and systems-based One \nHealth approach, and in this regard welcoming the launch of the One Health Global \nLeaders Group on Antimicrobial Resistance, \n \nRecognizing also that the COVID-19 pandemic has a disproportionately heavy \nimpact on the poor and the most vulnerable, with repercussions on health and \ndevelopment gains, thus hampering the achievement of the Sustainable Development \nGoals and universal health coverage, \n \nExpressing deep concern about the rise in discrimination, hate speech, \nstigmatization, racism and xenophobia related to the pandemic, and stressing the need \nto counter them as part of the COVID-19 response, \n__________________ \n \n13 World Health Organization, document WHA58/2005/REC/1, resolution 58.3, annex. \n\nA/RES/75/130 \nGlobal health and foreign policy: strengthening health system \nresilience through affordable health care for all\n \n20-17079\n4/9 \n \n \nDeeply concerned by the increase in cases of sexual and gender-based violence \nagainst women and girls, including domestic violence and violence in digital contexts, \nas a result of lockdown measures, the lack of availability of protection services and \nthe increased challenges to holding perpetrators accountable, which also affect front-\nline health workers and community health volunteers, \n \nNoting that the increasing number of complex emergencies is hindering the \nachievement of universal health coverage and that coherent and inclusive approaches \nto safeguard universal health coverage in emergencies are essential, including through \ninternational cooperation, ensuring the continuum and provision of essential health \nservices and public health functions, in line with humanitarian principles, \n \nEmphasizing the need for all States parties to fully implement and comply with \nthe International Health Regulations (2005), and stressing the importance of the \nadequate capacity of all countries to prevent, detect, assess, notify and respond to \npublic health threats, and support research and development, to prevent and control \nemerging and re-emerging infectious diseases that pose a risk to global public health, \n \nAcknowledging that primary health care is the most inclusive, effective and \nefficient approach to enhance people\u2019s physical and mental health, as well as social \nwell-being, and that primary health care is a cornerstone of a sustainable health \nsystem for universal health coverage and health-related Sustainable Development \nGoals, as recognized in the Declaration of Astana, \n \nStressing the important role of the Access to COVID-19 Tools Accelerator \ninitiative as well as other relevant initiatives, which aim to accelerate development \nand production of and equitable access to COVID-19 diagnostics, therapeutics and \nvaccines to all countries that need them, and to strengthen health systems, without \nundermining incentives for innovation, \n \nRecognizing the role of extensive immunization against COVID-19 as a global \npublic good for health in preventing, containing and stopping transmission in order \nto bring the pandemic to an end once safe, quality, efficacious, effective, accessible \nand affordable vaccines are available, \n \nNoting with concern that non-communicable diseases, notably cardiovascular \ndiseases, cancers, diabetes, chronic respiratory diseases, as well as mental disorders, \nother mental health conditions and neurological disorders, are the leading causes of \npremature death and disability globally, including in low- and middle-income \ncountries, and that people living with non-communicable diseases are more \nsusceptible to the risk of developing severe COVID-19 symptoms and are among the \nmost affected by the pandemic, and recognizing that necessary prevention and control \nefforts are hampered by, inter alia, lack of universal access to quality, safe, effective, \naffordable essential health services, medicines, diagnostics and health technologies, \nas well as a global shortage of qualified health workers, \n \nRecognizing the need to tackle health inequities and inequalities within and \namong countries through political commitment, policies and international \ncooperation, including those that address social, economic, environmental and other \ndeterminants of health, \n \nUnderlining the importance of developing efficient and innovative approaches, \nincluding through the private sector and foreign direct investment, to address the \nhealth needs of the most vulnerable, help to create more resilient health-care systems \nand achieve universal health coverage, while also recognizing the instrumental role \nthat foreign direct investment plays in ensuring that national health priorities are \nachieved, including equality of access, \n\nGlobal health and foreign policy: strengthening health system \nresilience through affordable health care for all \nA/RES/75/130\n \n5/9\n20-17079 \n \n \nRecognizing that people\u2019s engagement, particularly of women and girls, families \nand communities, and the inclusion of all relevant stakeholders is one of the core \ncomponents of health system governance, to fully empower all people in improving \nand protecting their own health, giving due regard to addressing and managing \nconflicts of interest and undue influence, contributing to the achievement of universal \nhealth coverage for all, with a focus on health outcomes, \n \nEmphasizing that illicit financial flows, in particular those caused by tax \nevasion, corruption and transnational organized crime, reduce the availability of vital \nresources for responding to and recovering from the COVID-19 pandemic and \nfinancing the implementation of the 2030 Agenda, \n \nRecalling the World Health Organization Global Strategy and Plan of Action on \nPublic Health, Innovation and Intellectual Property, 14 designed to promote medicinal \ninnovation, build capacity and improve access to medicines, and encouraging further \ndiscussions on access to medicines, \n \nReaffirming the right to use, to the fullest extent the provisions contained in the \nWorld Trade Organization Agreement on Trade-Related Aspects of Intellectual \nProperty Rights (TRIPS Agreement), which provides flexibilities for the protection \nof public health and promotes access to medicines for all, in particular for developing \ncountries, and the Doha Declaration on the TRIPS Agreement and Public Health, \nwhich recognizes that intellectual property protection is important for the development \nof new medicines and also recognizes the concerns about its effects on prices, \n \n1. \nUrges Member States to strengthen national health systems through \nensuring affordable health care for all, with a focus on primary health care, as well as \nthe availability, accessibility and affordability of quality health services and quality, \nsafe, effective, affordable and essential medicines, vaccines, diagnostics and health \ntechnologies, with a view to implementing the most effective, high-impact, quality-\nassured, people-centred, with full respect for human rights, gender- and disability-\nresponsive and evidence-based interventions to meet the health needs of all \nthroughout the life course; \n \n2. \nCalls upon Member States to strengthen the resilience of their health \nsystems as an integral part of their preparedness for health emergencies, so as to be \nable to respond to such emergencies while maintaining access to essential health \nservices or to quickly reinstate them after disruption; \n \n3. \nEncourages Member States to implement high-impact policies to protect \npeople\u2019s health and comprehensively address the social, economic and environmental \ndeterminants of health by working across all sectors through a whole-of-government \nand health-in-all-policies approach, promoting safe access to health-care services and \ntaking into account such factors as socioeconomic status, housing, occupational \ncondition, access to safe water and sanitation, education, digital connectivity and food \nsecurity to obtain better health outcomes; \n \n4. \nAlso encourages Member States to provide access to essential \nsocioeconomic benefits that can preserve the health and well-being of their \npopulation, such as providing social protection in case of public health emergencies; \n \n5. \nFurther encourages Member States to pursue efficient health financing \npolicies, including through close collaboration among relevant authorities, including \nfinance and health authorities, to respond to unmet needs and to eliminate financial \nbarriers to access to quality, safe, effective, affordable and essential health services, \nmedicines, vaccines, diagnostics and health technologies, reduce out-of-pocket \nexpenditures leading to financial hardship and ensure financial risk protection for all \n__________________ \n \n14 See World Health Organization, document WHA61/2008/REC/1. \n\nA/RES/75/130 \nGlobal health and foreign policy: strengthening health system \nresilience through affordable health care for all\n \n20-17079\n6/9 \n \nthroughout the life course, especially for the poor and those who are vulnerable or in \nvulnerable situations, through better allocation and use of resources, with adequate \nfinancing for primary health care, in accordance with national contexts and priorities; \n \n6. \nUrges Member States to strengthen international cooperation to support \nefforts to build and strengthen capacity in developing countries, including through \nenhanced official development assistance; \n \n7. \nAlso urges Member States to pursue sustainable and innovative health \nfinancing policies through, inter alia, effective domestic resource mobilization as well \nas better allocation and use of resources with adequate financing for primary health \ncare, innovative financing and pandemic preparedness through close collaboration \namong relevant authorities, public-private partnerships, civil society, academia and \nphilanthropy; \n \n8. \nCalls upon Member States to address the challenges of preventing and \ncombating illicit financial flows and strengthening international cooperation and good \npractices on assets return and recovery, and recognizes that fighting corruption at all \nlevels and in all its forms is a priority and that corruption is a serious barrier to \neffective resource mobilization and allocation and diverts resources away from \nactivities that are vital for poverty eradication and sustainable development, which \nmay undermine efforts to achieve universal health coverage; \n \n9. \nUrges Member States to further strengthen and improve the quality, \ncapacity, accessibility and affordability of health systems for all through enhancing \nevidence-based public health measures, health workforce and access to quality \nessential health-care services and safe, effective, quality and affordable essential \nmedicines, vaccines, diagnostics and other health technologies for all, including \nprocurement, distribution and availability, infrastructure, information systems, \npreparedness and response plans and service delivery; \n \n10. Encourages Member States to promote coherent and coordinated national \nstrategies for safe, effective, quality, affordable essential health services, in mitigating \nthe impacts from health emergencies and post-emergency recovery processes; \n \n11. \nCalls upon Member States, who have the primary responsibility to counter \ndiscrimination and hate speech, and all relevant actors, including political and \nreligious leaders, to promote inclusion and unity in response to the COVID-19 \npandemic and to prevent, speak out and take strong action against racism, xenophobia, \nhate speech, violence, discrimination, including on the basis of age, and stigmatization; \n \n12. Calls upon States to ensure that all human rights are respected, protected \nand fulfilled while combating the pandemic and that their responses to the COVID-19 \npandemic are in full compliance with their human rights obligations and \ncommitments; \n \n13. Also calls upon States to take all measures necessary to ensure the right of \nwomen and girls to the enjoyment of the highest attainable standard of health, \nincluding sexual and reproductive health, and reproductive rights, in accordance with \nthe Programme of Action of the International Conference on Population and \nDevelopment,15 the Beijing Platform for Action16 and the outcome documents of their \nreview conferences, and to develop sustainable health systems and social services, \nwith a view to ensuring universal access to such systems and services without \ndiscrimination; \n__________________ \n \n15 Report of the International Conference on Population and Development, Cairo, 5\u201313 September \n1994 (United Nations publication, Sales No. E.95.XIII.18), chap. I, resolution 1, annex. \n \n16 Report of the Fourth World Conference on Women, Beijing, 4\u201315 September 1995 (United \nNations publication, Sales No. E.96.IV.13), chap. I, resolution 1, annex II. \n\nGlobal health and foreign policy: strengthening health system \nresilience through affordable health care for all \nA/RES/75/130\n \n7/9\n20-17079 \n \n \n14. Calls upon Member States to ensure access to medicines as one of the \nfundamental elements of a robust health system based on universal health coverage, \nand reaffirms that States have the primary role and responsibility to determine and \npromote their own path towards achieving universal health coverage that ensures \nuniversal and equitable access to quality essential health services and access to safe, \neffective, quality and affordable essential medicines, vaccines, diagnostics and other \nhealth technologies for all, without discrimination; \n \n15. Reaffirms the World Trade Organization Agreement on Trade-Related \nAspects of Intellectual Property Rights (TRIPS Agreement) as amended, and also \nreaffirms the 2001 World Trade Organization Doha Declaration on the TRIPS \nAgreement and Public Health, which recognizes that intellectual property rights should \nbe interpreted and implemented in a manner supportive of the right of Member States \nto protect public health and, in particular, to promote access to medicines for all, and \nnotes the need for appropriate incentives in the development of new health products; \n \n16. Calls upon Member States to enhance and build constructive engagement \nand stronger partnership with relevant stakeholders from the public and private \nsectors, civil society and academia to pursue access to universal health coverage by \nimproving the availability, affordability and efficiency of health products through \nincreasing transparency of prices of medicines, vaccines, medical devices, \ndiagnostics, assistive products, cell- and gene-based therapies and other health \ntechnologies across the value chain, including through improved regulations, in \naccordance with national and regional legal frameworks and contexts, to address the \nglobal concern about the high prices of some health products, and in this regard \nencourages the World Health Organization to continue its efforts to biennially \nconvene the Fair Pricing Forum with Member States and all relevant stakeholders to \ndiscuss the affordability and transparency of prices and costs relating to health \nproducts as one of the fundamental features of a robust health system based on \nuniversal health coverage; \n \n17. Also calls upon Member States to explore ways to consider integrating, as \nappropriate, safe and evidence-based traditional and complementary medicine \nservices within national and/or subnational health systems, particularly at the level of \nprimary health care, according to national context and priorities; \n \n18. Stresses the critical importance of monitoring the indirect impacts of the \nCOVID-19 pandemic on integrated service delivery as well as maintaining the \nessential part of health-care delivery and global supply chains during the pandemic, \nincluding prevention and treatment services for communicable diseases, management \nof emergency health conditions, provision of medication, supplies and support from \nhealth-care workers for the ongoing management of non-communicable diseases, \nincluding mental health conditions, and auxiliary services; \n \n19. Calls upon Member States to scale up efforts to strengthen health \ninformation systems and collect quality, timely and reliable data, including vital \nstatistics, disaggregated by income, sex, age, race, ethnicity, migratory status, \ndisability, geographical location and other characteristics relevant in national contexts \nas required to monitor progress and identify gaps in the universal and inclusive \nachievement of the health-related Sustainable Development Goals, while protecting \nthe privacy of data that could be linked to individuals, and to ensure that the statistics \nare used to support evidence-based health sector planning, monitor the impacts of the \nCOVID-19 pandemic on health service supply and demand, and facilitate progress \ntowards the achievement of universal health coverage, in line with the 2030 Agenda \nfor Sustainable Development;17 \n__________________ \n \n17 Resolution 70/1. \n\nA/RES/75/130 \nGlobal health and foreign policy: strengthening health system \nresilience through affordable health care for all\n \n20-17079\n8/9 \n \n \n20. Encourages Member States, international organizations and other relevant \nstakeholders to work collaboratively at all levels to develop, test and scale up \nproduction of safe, effective, quality, affordable diagnostics, therapeutics, medicines \nand vaccines, inter alia and as appropriate through the use of existing mechanisms, \nsuch as the Medicines Patent Pool, to promote equitable, affordable and timely access \nto medical products and health technologies in health emergencies; \n \n21. Acknowledges with appreciation the devoted efforts of health workers and \ncare workers, especially during the COVID-19 pandemic, and urges Member States \nto scale up efforts to promote the recruitment and retention of competent, skilled and \nmotivated health workers and encourage incentives to secure the equitable \ndistribution of qualified health workers through national human resource mapping \nand planning, to match needs in remote and underserved areas, and in fields with high \ndemand for services, including by providing decent and safe working conditions and \nappropriate remuneration for health workers working in such areas, while adhering to \nthe principles of the World Health Organization Global Code of Practice on the \nInternational Recruitment of Health Personnel;18 \n \n22. Calls upon Member States to scale up and accelerate the implementation \nof the commitments made in the political declaration on HIV and AIDS of 2016 19 and \nthe political declaration on tuberculosis of 2018,20 to sustain the fragile gains towards \nachieving the ambitious commitment of ending the epidemics of AIDS and \ntuberculosis, as set out in Sustainable Development Goal target 3.3, including by \nadvancing comprehensive multisectoral and multi-stakeholder responses and \nintegrated service delivery and ensuring that no one is left behind; \n \n23. Reaffirms the strong commitments made in the political declarations of \n201121 and 201822 and the outcome document of 201423 of the high-level meetings of \nthe General Assembly on the prevention and control of non-communicable diseases, \nand in this regard calls upon Member States to promote ambitious multisectoral \nnational responses and thereby contribute to the overall implementation of the 2030 \nAgenda, including by integrating, throughout the life course, action on the prevention \nand control of non-communicable diseases and the promotion of physical and mental \nhealth and well-being; \n \n24. Stresses the need to address public health issues related to substandard and \nfalsified medical products by advancing collaboration for building regulatory \ncapacity for medicines, vaccines, diagnostics and other essential health commodities, \nassuring the quality and safety of services and training of health-care workers, \nmaintaining and safeguarding the quality control and supply chain management, and \nwhere relevant, enhancing national and regional production capacities, both in regular \nsituations and during health emergencies; \n \n25. Also stresses the need to continue and advance multisectoral collaboration \nto build and strengthen capacities, inter alia, for public health surveillance, detection \nand reporting systems, especially at points of entry, prevention and control measures \nin the community and health-care facilities, clinical management, risk communication \nand community engagement; \n \n26. Calls upon Member States to further implement and reinforce an \nintegrated One Health approach that fosters cooperation between the human health, \nanimal health and plant health, as well as environmental and other relevant sectors, \n__________________ \n \n18 World Health Organization, document WHA63/2010/REC/1, annex 5. \n \n19 Resolution 70/266, annex. \n \n20 Resolution 73/3. \n \n21 Resolution 66/2, annex. \n \n22 Resolution 73/2. \n \n23 Resolution 68/300. \n\nGlobal health and foreign policy: strengthening health system \nresilience through affordable health care for all \nA/RES/75/130\n \n9/9\n20-17079 \n \ntaking into account the relevant guidance recommended by the World Health \nOrganization, the Food and Agriculture Organization of the United Nations and the \nWorld Organization for Animal Health, and exchanging reliable information and \nscientific knowledge in a timely manner; \n \n27. Calls upon Member States, other partners and donors to urgently support \nfunding and close the funding gap for the Access to COVID-19 Tools Accelerator and \nits mechanisms, such as the COVID-19 Vaccine Global Access (COVAX) Facility, \nand support equitable distribution of diagnostics, therapeutics and vaccines, and \nfurther explore innovative financing mechanisms aimed at ensuring continuity and \nstrengthening of essential health services; \n \n28. Encourages Member States to work with the World Health Organization \nand other key stakeholders to strengthen their capacity to deal with public health \nemergencies, with a view to ensuring full and effective implementation of and \ncompliance with the International Health Regulations (2005), in order to build \nresilient health systems and strengthen surveillance and preparedness measures, \nparticularly with regard to infectious diseases and other health threats; \n \n29. Calls upon Member States to continue to support the international efforts \nunder the coordination of the Secretary-General to work with all relevant actors in \norder to mobilize a coordinated global response to the COVID-19 pandemic and its \nadverse social, economic and financial impact on all societies; \n \n30. Invites relevant United Nations entities, especially the World Health \nOrganization, to continue to provide quality and effectively disseminated normative \nguidance and technical support to Member States, upon their request, in order to build \ncapacity, strengthen health systems and promote financial sustainability, training, \nrecruitment, development and retention of human resources for health and technology \ntransfer on mutually agreed terms, to deal with health emergencies, with a particular \nfocus on developing countries; \n \n31. Invites the World Health Organization, the Food and Agriculture \nOrganization of the United Nations and the World Organization for Animal Health to \nfurther strengthen their collaboration before and during pandemics through the \nTripartite Secretariat, to combat health risks in the human health, animal health and \nplant health, as well as environmental and other relevant sectors in the context of the \nOne Health approach, together with other relevant parts of the United Nations system \nand relevant stakeholders in this regard; \n \n32. Requests the Secretary-General, in close collaboration with the Director \nGeneral of the World Health Organization as well as other relevant international \norganizations, to report to the General Assembly at its seventy-sixth session, under \nthe item entitled \u201cGlobal health and foreign policy\u201d, on progress related to \nstrengthening health system resilience through affordable health care for all as well \nas improving international coordination and cooperation to address the health needs \nof all States during health emergencies, as requested in the political declaration of the \nhigh-level meeting on universal health coverage. \n \n44th plenary meeting \n14 December 2020 \n \n \n",
  "paragraphs": {
    "1": "Urges Member States to strengthen national health systems through ensuring affordable health care for all, with a focus on primary health care, as well as the availability, accessibility and affordability of quality health services and quality, safe, effective, affordable and essential medicines, vaccines, diagnostics and health technologies, with a view to implementing the most effective, high-impact, quality- assured, people-centred, with full respect for human rights, gender- and disability- responsive and evidence-based interventions to meet the health needs of all throughout the life course;",
    "2": "Calls upon Member States to strengthen the resilience of their health systems as an integral part of their preparedness for health emergencies, so as to be able to respond to such emergencies while maintaining access to essential health services or to quickly reinstate them after disruption;",
    "3": "Encourages Member States to implement high-impact policies to protect people\u2019s health and comprehensively address the social, economic and environmental determinants of health by working across all sectors through a whole-of-government and health-in-all-policies approach, promoting safe access to health-care services and taking into account such factors as socioeconomic status, housing, occupational condition, access to safe water and sanitation, education, digital connectivity and food security to obtain better health outcomes;",
    "4": "Also encourages Member States to provide access to essential socioeconomic benefits that can preserve the health and well-being of their population, such as providing social protection in case of public health emergencies;",
    "5": "Further encourages Member States to pursue efficient health financing policies, including through close collaboration among relevant authorities, including finance and health authorities, to respond to unmet needs and to eliminate financial barriers to access to quality, safe, effective, affordable and essential health services, medicines, vaccines, diagnostics and health technologies, reduce out-of-pocket expenditures leading to financial hardship and ensure financial risk protection for all __________________ 14 See World Health Organization, document WHA61/2008/REC/1. A/RES/75/130 Global health and foreign policy: strengthening health system resilience through affordable health care for all 20-17079 6/9 throughout the life course, especially for the poor and those who are vulnerable or in vulnerable situations, through better allocation and use of resources, with adequate financing for primary health care, in accordance with national contexts and priorities;",
    "6": "Urges Member States to strengthen international cooperation to support efforts to build and strengthen capacity in developing countries, including through enhanced official development assistance;",
    "7": "Also urges Member States to pursue sustainable and innovative health financing policies through, inter alia, effective domestic resource mobilization as well as better allocation and use of resources with adequate financing for primary health care, innovative financing and pandemic preparedness through close collaboration among relevant authorities, public-private partnerships, civil society, academia and philanthropy;",
    "8": "Calls upon Member States to address the challenges of preventing and combating illicit financial flows and strengthening international cooperation and good practices on assets return and recovery, and recognizes that fighting corruption at all levels and in all its forms is a priority and that corruption is a serious barrier to effective resource mobilization and allocation and diverts resources away from activities that are vital for poverty eradication and sustainable development, which may undermine efforts to achieve universal health coverage;",
    "9": "Urges Member States to further strengthen and improve the quality, capacity, accessibility and affordability of health systems for all through enhancing evidence-based public health measures, health workforce and access to quality essential health-care services and safe, effective, quality and affordable essential medicines, vaccines, diagnostics and other health technologies for all, including procurement, distribution and availability, infrastructure, information systems, preparedness and response plans and service delivery;",
    "10": "Encourages Member States to promote coherent and coordinated national strategies for safe, effective, quality, affordable essential health services, in mitigating the impacts from health emergencies and post-emergency recovery processes;",
    "11": "Calls upon Member States, who have the primary responsibility to counter discrimination and hate speech, and all relevant actors, including political and religious leaders, to promote inclusion and unity in response to the COVID-19 pandemic and to prevent, speak out and take strong action against racism, xenophobia, hate speech, violence, discrimination, including on the basis of age, and stigmatization;",
    "12": "Calls upon States to ensure that all human rights are respected, protected and fulfilled while combating the pandemic and that their responses to the COVID-19 pandemic are in full compliance with their human rights obligations and commitments;",
    "13": "Also calls upon States to take all measures necessary to ensure the right of women and girls to the enjoyment of the highest attainable standard of health, including sexual and reproductive health, and reproductive rights, in accordance with the Programme of Action of the International Conference on Population and Development,15 the Beijing Platform for Action16 and the outcome documents of their review conferences, and to develop sustainable health systems and social services, with a view to ensuring universal access to such systems and services without discrimination; __________________ 15 Report of the International Conference on Population and Development, Cairo, 5\u201313 September 1994 (United Nations publication, Sales No. E.95.XIII.18), chap. I, resolution 1, annex. 16 Report of the Fourth World Conference on Women, Beijing, 4\u201315 September 1995 (United Nations publication, Sales No. E.96.IV.13), chap. I, resolution 1, annex II. Global health and foreign policy: strengthening health system resilience through affordable health care for all A/RES/75/130 7/9 20-17079",
    "14": "Calls upon Member States to ensure access to medicines as one of the fundamental elements of a robust health system based on universal health coverage, and reaffirms that States have the primary role and responsibility to determine and promote their own path towards achieving universal health coverage that ensures universal and equitable access to quality essential health services and access to safe, effective, quality and affordable essential medicines, vaccines, diagnostics and other health technologies for all, without discrimination;",
    "15": "Reaffirms the World Trade Organization Agreement on Trade-Related Aspects of Intellectual Property Rights (TRIPS Agreement) as amended, and also reaffirms the 2001 World Trade Organization Doha Declaration on the TRIPS Agreement and Public Health, which recognizes that intellectual property rights should be interpreted and implemented in a manner supportive of the right of Member States to protect public health and, in particular, to promote access to medicines for all, and notes the need for appropriate incentives in the development of new health products;",
    "16": "Calls upon Member States to enhance and build constructive engagement and stronger partnership with relevant stakeholders from the public and private sectors, civil society and academia to pursue access to universal health coverage by improving the availability, affordability and efficiency of health products through increasing transparency of prices of medicines, vaccines, medical devices, diagnostics, assistive products, cell- and gene-based therapies and other health technologies across the value chain, including through improved regulations, in accordance with national and regional legal frameworks and contexts, to address the global concern about the high prices of some health products, and in this regard encourages the World Health Organization to continue its efforts to biennially convene the Fair Pricing Forum with Member States and all relevant stakeholders to discuss the affordability and transparency of prices and costs relating to health products as one of the fundamental features of a robust health system based on universal health coverage;",
    "17": "Also calls upon Member States to explore ways to consider integrating, as appropriate, safe and evidence-based traditional and complementary medicine services within national and/or subnational health systems, particularly at the level of primary health care, according to national context and priorities;",
    "18": "Stresses the critical importance of monitoring the indirect impacts of the COVID-19 pandemic on integrated service delivery as well as maintaining the essential part of health-care delivery and global supply chains during the pandemic, including prevention and treatment services for communicable diseases, management of emergency health conditions, provision of medication, supplies and support from health-care workers for the ongoing management of non-communicable diseases, including mental health conditions, and auxiliary services;",
    "19": "Calls upon Member States to scale up efforts to strengthen health information systems and collect quality, timely and reliable data, including vital statistics, disaggregated by income, sex, age, race, ethnicity, migratory status, disability, geographical location and other characteristics relevant in national contexts as required to monitor progress and identify gaps in the universal and inclusive achievement of the health-related Sustainable Development Goals, while protecting the privacy of data that could be linked to individuals, and to ensure that the statistics are used to support evidence-based health sector planning, monitor the impacts of the COVID-19 pandemic on health service supply and demand, and facilitate progress towards the achievement of universal health coverage, in line with the 2030 Agenda for Sustainable Development;17 __________________ 17 Resolution 70/1. A/RES/75/130 Global health and foreign policy: strengthening health system resilience through affordable health care for all 20-17079 8/9",
    "20": "Encourages Member States, international organizations and other relevant stakeholders to work collaboratively at all levels to develop, test and scale up production of safe, effective, quality, affordable diagnostics, therapeutics, medicines and vaccines, inter alia and as appropriate through the use of existing mechanisms, such as the Medicines Patent Pool, to promote equitable, affordable and timely access to medical products and health technologies in health emergencies;",
    "21": "Acknowledges with appreciation the devoted efforts of health workers and care workers, especially during the COVID-19 pandemic, and urges Member States to scale up efforts to promote the recruitment and retention of competent, skilled and motivated health workers and encourage incentives to secure the equitable distribution of qualified health workers through national human resource mapping and planning, to match needs in remote and underserved areas, and in fields with high demand for services, including by providing decent and safe working conditions and appropriate remuneration for health workers working in such areas, while adhering to the principles of the World Health Organization Global Code of Practice on the International Recruitment of Health Personnel;18",
    "22": "Calls upon Member States to scale up and accelerate the implementation of the commitments made in the political declaration on HIV and AIDS of 2016 19 and the political declaration on tuberculosis of 2018,20 to sustain the fragile gains towards achieving the ambitious commitment of ending the epidemics of AIDS and tuberculosis, as set out in Sustainable Development Goal target 3.3, including by advancing comprehensive multisectoral and multi-stakeholder responses and integrated service delivery and ensuring that no one is left behind;",
    "23": "Reaffirms the strong commitments made in the political declarations of 201121 and 201822 and the outcome document of 201423 of the high-level meetings of the General Assembly on the prevention and control of non-communicable diseases, and in this regard calls upon Member States to promote ambitious multisectoral national responses and thereby contribute to the overall implementation of the 2030 Agenda, including by integrating, throughout the life course, action on the prevention and control of non-communicable diseases and the promotion of physical and mental health and well-being;",
    "24": "Stresses the need to address public health issues related to substandard and falsified medical products by advancing collaboration for building regulatory capacity for medicines, vaccines, diagnostics and other essential health commodities, assuring the quality and safety of services and training of health-care workers, maintaining and safeguarding the quality control and supply chain management, and where relevant, enhancing national and regional production capacities, both in regular situations and during health emergencies;",
    "25": "Also stresses the need to continue and advance multisectoral collaboration to build and strengthen capacities, inter alia, for public health surveillance, detection and reporting systems, especially at points of entry, prevention and control measures in the community and health-care facilities, clinical management, risk communication and community engagement;",
    "26": "Calls upon Member States to further implement and reinforce an integrated One Health approach that fosters cooperation between the human health, animal health and plant health, as well as environmental and other relevant sectors, __________________ 18 World Health Organization, document WHA63/2010/REC/1, annex 5. 19 Resolution 70/266, annex. 20 Resolution 73/3. 21 Resolution 66/2, annex. 22 Resolution 73/2. 23 Resolution 68/300. Global health and foreign policy: strengthening health system resilience through affordable health care for all A/RES/75/130 9/9 20-17079 taking into account the relevant guidance recommended by the World Health Organization, the Food and Agriculture Organization of the United Nations and the World Organization for Animal Health, and exchanging reliable information and scientific knowledge in a timely manner;",
    "27": "Calls upon Member States, other partners and donors to urgently support funding and close the funding gap for the Access to COVID-19 Tools Accelerator and its mechanisms, such as the COVID-19 Vaccine Global Access (COVAX) Facility, and support equitable distribution of diagnostics, therapeutics and vaccines, and further explore innovative financing mechanisms aimed at ensuring continuity and strengthening of essential health services;",
    "28": "Encourages Member States to work with the World Health Organization and other key stakeholders to strengthen their capacity to deal with public health emergencies, with a view to ensuring full and effective implementation of and compliance with the International Health Regulations (2005), in order to build resilient health systems and strengthen surveillance and preparedness measures, particularly with regard to infectious diseases and other health threats;",
    "29": "Calls upon Member States to continue to support the international efforts under the coordination of the Secretary-General to work with all relevant actors in order to mobilize a coordinated global response to the COVID-19 pandemic and its adverse social, economic and financial impact on all societies;",
    "30": "Invites relevant United Nations entities, especially the World Health Organization, to continue to provide quality and effectively disseminated normative guidance and technical support to Member States, upon their request, in order to build capacity, strengthen health systems and promote financial sustainability, training, recruitment, development and retention of human resources for health and technology transfer on mutually agreed terms, to deal with health emergencies, with a particular focus on developing countries;",
    "31": "Invites the World Health Organization, the Food and Agriculture Organization of the United Nations and the World Organization for Animal Health to further strengthen their collaboration before and during pandemics through the Tripartite Secretariat, to combat health risks in the human health, animal health and plant health, as well as environmental and other relevant sectors in the context of the One Health approach, together with other relevant parts of the United Nations system and relevant stakeholders in this regard;",
    "32": "Requests the Secretary-General, in close collaboration with the Director General of the World Health Organization as well as other relevant international organizations, to report to the General Assembly at its seventy-sixth session, under the item entitled \u201cGlobal health and foreign policy\u201d, on progress related to strengthening health system resilience through affordable health care for all as well as improving international coordination and cooperation to address the health needs of all States during health emergencies, as requested in the political declaration of the high-level meeting on universal health coverage. 44th plenary meeting 14 December 2020"
  },
  "agenda_items": [
    "Item 131"
  ],
  "symbol_references": [
    "A/75/L.41"
  ]
}