{
  "symbol": "A/RES/79/310",
  "filename": "A_RES_79_310.pdf",
  "title": "79/310. Financing of the United Nations Mission for the Referendum in Western Sahara",
  "text": "United Nations \nA/RES/79/310\n \n \nGeneral Assembly \nDistr.: General \n1 July 2025 \n \n25-10830 (E) \n*2510830* \n \n \nSeventy-ninth session \nAgenda item 165 \nFinancing of the United Nations Mission for the \nReferendum in Western Sahara \n \n \n \n \n Resolution adopted by the General Assembly \non 30 June 2025 \n \n \n \n \n[on the report of the Fifth Committee (A/79/935, para. 6)] \n \n \n 79/310. Financing of the United Nations Mission for the Referendum in \nWestern Sahara \n \n \n \nThe General Assembly, \n \nHaving considered the reports of the Secretary-General on the financing of the \nUnited Nations Mission for the Referendum in Western Sahara 1 and the related report \nof the Advisory Committee on Administrative and Budgetary Questions, 2 \n \nRecalling Security Council resolution 690 (1991) of 29 April 1991, by which \nthe Council established the United Nations Mission for the Referendum in Western \nSahara, and the subsequent resolutions by which the Council extended the mandate \nof the Mission, the latest of which was resolution 2756 (2024) of 31 October 2024, \nby which the Council extended the mandate of the Mission until 31 October 2025, \n \nRecalling also its resolution 45/266 of 17 May 1991 on the financing of the \nMission and its subsequent resolutions thereon, the latest of which was resolution \n78/307 of 28 June 2024, \n \nReaffirming the general principles underlying the financing of United Nations \npeacekeeping operations, as stated in its resolutions 1874 (S-IV) of 27 June 1963, \n3101 (XXVIII) of 11 December 1973 and 55/235 of 23 December 2000, \n \nNoting with appreciation that voluntary contributions have been made to the \nMission, \n \nMindful of the fact that it is essential to provide the Mission with the financial \nresources necessary to enable it to fulfil its responsibilities under the relevant \nresolutions of the Security Council, \n__________________ \n \n1 A/79/589 and A/79/736. \n \n2 A/79/724/Add.8. \n\nA/RES/79/310 \nFinancing of the United Nations Mission for the Referendum \nin Western Sahara\n \n25-10830\n2/4 \n \n \n1. \nRequests the Secretary-General to entrust the Head of Mission with the \ntask of formulating future budget proposals in full accordance with the provisions of \nits resolutions 59/296 of 22 June 2005, 60/266 of 30 June 2006, 61/276 of 29 June \n2007, 64/269 of 24 June 2010, 65/289 of 30 June 2011, 66/264 of 21 June 2012, \n69/307 of 25 June 2015, 70/286 of 17 June 2016 and 76/274 of 29 June 2022, as well \nas other relevant resolutions; \n \n2. \nTakes note of the status of contributions to the United Nations Mission for \nthe Referendum in Western Sahara as at 30 April 2025, including the contributions \noutstanding in the amount of 59.6 million United States dollars, representing some \n3.6 per cent of the total assessed contributions, notes with concern that only 89 \nMember States have paid their assessed contributions in full, and urges all other \nMember States, in particular those in arrears, to ensure payment of their outstanding \nassessed contributions; \n \n3. \nExpresses its appreciation to those Member States that have paid their \nassessed contributions in full, and urges all other Member States to make every \npossible effort to ensure payment of their assessed contributions to the Mission in \nfull; \n \n4. \nExpresses concern at the financial situation with regard to peacekeeping \nactivities, in particular as regards the reimbursements to troop contributors that bear \nadditional burdens owing to overdue payments by Member States of their \nassessments; \n \n5. \nEmphasizes that all future and existing peacekeeping missions shall be \ngiven equal and non-discriminatory treatment in respect of financial and \nadministrative arrangements; \n \n6. \nAlso emphasizes that all peacekeeping missions shall be provided with \nadequate resources for the effective and efficient discharge of their respective \nmandates; \n \n7. \nRequests the Secretary-General to ensure that proposed peacekeeping \nbudgets are based on the relevant legislative mandates; \n \n8. \nEndorses the conclusions and recommendations contained in the report of \nthe Advisory Committee on Administrative and Budgetary Questions, subject to the \nprovisions of the present resolution, and requests the Secretary-General to ensure \ntheir full implementation; \n \n9. \nRequests the Secretary-General to ensure the full implementation of the \nrelevant provisions of its resolutions 59/296, 60/266, 61/276, 64/269, 65/289, 66/264, \n69/307, 70/286 and 76/274; \n \n10. Also requests the Secretary-General to take all action necessary to ensure \nthat the Mission is administered with a maximum of efficiency and economy; \n \n \n \nBudget performance report for the period from 1 July 2023 to 30 June 2024 \n \n \n11. \nTakes note of the report of the Secretary-General on the budget \nperformance of the Mission for the period from 1 July 2023 to 30 June 2024; 3 \n \n \n \nBudget estimates for the period from 1 July 2025 to 30 June 2026 \n \n \n12. Decides to appropriate to the special account for the United Nations \nMission for the Referendum in Western Sahara the amount of 78,146,900 dollars for \nthe period from 1 July 2025 to 30 June 2026, inclusive of 70,694,100 dollars for the \n__________________ \n \n3 A/79/589. \n\nFinancing of the United Nations Mission for the Referendum \nin Western Sahara \nA/RES/79/310\n \n3/4\n25-10830 \n \nmaintenance of the Mission, 5,894,200 dollars for the support account for \npeacekeeping operations, 819,000 dollars for the United Nations Logistics Base at \nBrindisi, Italy, and 739,600 dollars for the Regional Service Centre in Entebbe, \nUganda;  \n \n \n \nFinancing of the appropriation for the period from 1 July 2025 to 30 June 2026 \n \n \n13. Decides to apportion among Member States the amount of 26,049,000 \ndollars for the period from 1 July to 31 October 2025 in accordance with the levels \nupdated in its resolution 79/250 of 24 December 2024, taking into account the scale \nof assessments for 2025, as set out in its resolution 79/249 of 24 December 2024;  \n \n14. Also decides that, in accordance with the provisions of its resolution 973 (X) \nof 15 December 1955, there shall be set off against the apportionment among Member \nStates, as provided for in paragraph 13 above, their respective share in the Tax \nEqualization Fund of 1,273,200 dollars, comprising the estimated staff assessment \nincome of 1,031,700 dollars approved for the Mission, the prorated share of 180,500 \ndollars of the estimated staff assessment income approved for the support account, \nthe prorated share of 31,100 dollars of the estimated staff assessment income \napproved for the United Nations Logistics Base and the prorated share of 29,900 \ndollars of the estimated staff assessment income approved for the Regional Service \nCentre;  \n \n15. Further decides to apportion among Member States the amount of \n52,097,900 dollars for the period from 1 November 2025 to 30 June 2026, at a \nmonthly rate of 6,512,238 dollars, in accordance with the levels updated in its \nresolution 79/250, taking into account the scale of assessments for 2025 and 2026, as \nset out in its resolution 79/249, subject to a decision of the Security Council to extend \nthe mandate of the Mission; \n \n16. Decides that, in accordance with the provisions of its resolution 973 (X), \nthere shall be set off against the apportionment among Member States, as provided \nfor in paragraph 15 above, their respective share in the Tax Equalization Fund of \n2,546,700 dollars, comprising the estimated staff assessment income of 2,063,500 \ndollars approved for the Mission, the prorated share of 361,000 dollars of the \nestimated staff assessment income approved for the support account, the prorated \nshare of 62,300 dollars of the estimated staff assessment income approved for the \nUnited Nations Logistics Base and the prorated share of 59,900 dollars of the \nestimated staff assessment income approved for the Regional Service Centre; \n \n17. Also decides that, for Member States that have fulfilled their financial \nobligations to the Mission, there shall be set off against their apportionment, as \nprovided for in paragraphs 13 and 15 above, their respective share of the \nunencumbered balance and other revenue in the amount of 2,060,300 dollars in \nrespect of the financial period ended 30 June 2024, in accordance with the levels \nupdated in its resolution 76/239 of 24 December 2021, taking into account the scale \nof assessments for 2024, as set out in its resolution 76/238 of 24 December 2021;  \n \n18. Further decides that, for Member States that have not fulfilled their \nfinancial obligations to the Mission, there shall be set off against their outstanding \nobligations their respective share of the unencumbered balance and other revenue in \nthe amount of 2,060,300 dollars in respect of the financial period ended 30 June 2024, \nin accordance with the scheme set out in paragraph 17 above;  \n \n19. Decides that the increase of 355,600 dollars in the estimated staff \nassessment income in respect of the financial period ended 30 June 2024 shall be \nadded to the credits in the amount of 2,060,300 dollars referred to in paragraphs 17 \nand 18 above;  \n\nA/RES/79/310 \nFinancing of the United Nations Mission for the Referendum \nin Western Sahara\n \n25-10830\n4/4 \n \n \n20. Encourages the Secretary-General to continue to take additional measures \nto ensure the safety and security of all personnel participating in the Mission under \nthe auspices of the United Nations, bearing in mind paragraphs 5 and 6 of Security \nCouncil resolution 1502 (2003) of 26 August 2003;  \n \n21. Invites voluntary contributions to the Mission in cash and in the form of \nservices and supplies acceptable to the Secretary-General, to be administered, as \nappropriate, in accordance with the procedure and practices established by the \nGeneral Assembly;  \n \n22. Decides to include in the provisional agenda of its eightieth session the \nitem entitled \u201cFinancing of the United Nations Mission for the Referendum in \nWestern Sahara\u201d. \n \n81st plenary meeting \n30 June 2025 \n \n",
  "paragraphs": {
    "1": "Requests the Secretary-General to entrust the Head of Mission with the task of formulating future budget proposals in full accordance with the provisions of its resolutions 59/296 of 22 June 2005, 60/266 of 30 June 2006, 61/276 of 29 June 2007, 64/269 of 24 June 2010, 65/289 of 30 June 2011, 66/264 of 21 June 2012, 69/307 of 25 June 2015, 70/286 of 17 June 2016 and 76/274 of 29 June 2022, as well as other relevant resolutions;",
    "2": "Takes note of the status of contributions to the United Nations Mission for the Referendum in Western Sahara as at 30 April 2025, including the contributions outstanding in the amount of 59.6 million United States dollars, representing some 3.6 per cent of the total assessed contributions, notes with concern that only 89 Member States have paid their assessed contributions in full, and urges all other Member States, in particular those in arrears, to ensure payment of their outstanding assessed contributions;",
    "3": "Expresses its appreciation to those Member States that have paid their assessed contributions in full, and urges all other Member States to make every possible effort to ensure payment of their assessed contributions to the Mission in full;",
    "4": "Expresses concern at the financial situation with regard to peacekeeping activities, in particular as regards the reimbursements to troop contributors that bear additional burdens owing to overdue payments by Member States of their assessments;",
    "5": "Emphasizes that all future and existing peacekeeping missions shall be given equal and non-discriminatory treatment in respect of financial and administrative arrangements;",
    "6": "Also emphasizes that all peacekeeping missions shall be provided with adequate resources for the effective and efficient discharge of their respective mandates;",
    "7": "Requests the Secretary-General to ensure that proposed peacekeeping budgets are based on the relevant legislative mandates;",
    "8": "Endorses the conclusions and recommendations contained in the report of the Advisory Committee on Administrative and Budgetary Questions, subject to the provisions of the present resolution, and requests the Secretary-General to ensure their full implementation;",
    "9": "Requests the Secretary-General to ensure the full implementation of the relevant provisions of its resolutions 59/296, 60/266, 61/276, 64/269, 65/289, 66/264, 69/307, 70/286 and 76/274;",
    "10": "Also requests the Secretary-General to take all action necessary to ensure that the Mission is administered with a maximum of efficiency and economy; Budget performance report for the period from 1 July 2023 to 30 June 2024",
    "11": "Takes note of the report of the Secretary-General on the budget performance of the Mission for the period from 1 July 2023 to 30 June 2024; 3 Budget estimates for the period from 1 July 2025 to 30 June 2026",
    "12": "Decides to appropriate to the special account for the United Nations Mission for the Referendum in Western Sahara the amount of 78,146,900 dollars for the period from 1 July 2025 to 30 June 2026, inclusive of 70,694,100 dollars for the maintenance of the Mission, 5,894,200 dollars for the support account for peacekeeping operations, 819,000 dollars for the United Nations Logistics Base at Brindisi, Italy, and 739,600 dollars for the Regional Service Centre in Entebbe, Uganda; Financing of the appropriation for the period from 1 July 2025 to 30 June 2026",
    "13": "Decides to apportion among Member States the amount of 26,049,000 dollars for the period from 1 July to 31 October 2025 in accordance with the levels updated in its resolution 79/250 of 24 December 2024, taking into account the scale of assessments for 2025, as set out in its resolution 79/249 of 24 December 2024;",
    "14": "Also decides that, in accordance with the provisions of its resolution 973 (X) of 15 December 1955, there shall be set off against the apportionment among Member States, as provided for in paragraph 13 above, their respective share in the Tax Equalization Fund of 1,273,200 dollars, comprising the estimated staff assessment income of 1,031,700 dollars approved for the Mission, the prorated share of 180,500 dollars of the estimated staff assessment income approved for the support account, the prorated share of 31,100 dollars of the estimated staff assessment income approved for the United Nations Logistics Base and the prorated share of 29,900 dollars of the estimated staff assessment income approved for the Regional Service Centre;",
    "15": "Further decides to apportion among Member States the amount of 52,097,900 dollars for the period from 1 November 2025 to 30 June 2026, at a monthly rate of 6,512,238 dollars, in accordance with the levels updated in its resolution 79/250, taking into account the scale of assessments for 2025 and 2026, as set out in its resolution 79/249, subject to a decision of the Security Council to extend the mandate of the Mission;",
    "16": "Decides that, in accordance with the provisions of its resolution 973 (X), there shall be set off against the apportionment among Member States, as provided for in paragraph 15 above, their respective share in the Tax Equalization Fund of 2,546,700 dollars, comprising the estimated staff assessment income of 2,063,500 dollars approved for the Mission, the prorated share of 361,000 dollars of the estimated staff assessment income approved for the support account, the prorated share of 62,300 dollars of the estimated staff assessment income approved for the United Nations Logistics Base and the prorated share of 59,900 dollars of the estimated staff assessment income approved for the Regional Service Centre;",
    "17": "Also decides that, for Member States that have fulfilled their financial obligations to the Mission, there shall be set off against their apportionment, as provided for in paragraphs 13 and 15 above, their respective share of the unencumbered balance and other revenue in the amount of 2,060,300 dollars in respect of the financial period ended 30 June 2024, in accordance with the levels updated in its resolution 76/239 of 24 December 2021, taking into account the scale of assessments for 2024, as set out in its resolution 76/238 of 24 December 2021;",
    "18": "Further decides that, for Member States that have not fulfilled their financial obligations to the Mission, there shall be set off against their outstanding obligations their respective share of the unencumbered balance and other revenue in the amount of 2,060,300 dollars in respect of the financial period ended 30 June 2024, in accordance with the scheme set out in paragraph 17 above;",
    "19": "",
    "20": "Encourages the Secretary-General to continue to take additional measures to ensure the safety and security of all personnel participating in the Mission under the auspices of the United Nations, bearing in mind paragraphs 5 and 6 of Security Council resolution 1502 (2003) of 26 August 2003;",
    "21": "Invites voluntary contributions to the Mission in cash and in the form of services and supplies acceptable to the Secretary-General, to be administered, as appropriate, in accordance with the procedure and practices established by the General Assembly;",
    "22": "Decides to include in the provisional agenda of its eightieth session the item entitled \u201cFinancing of the United Nations Mission for the Referendum in Western Sahara\u201d."
  },
  "agenda_items": [
    "Item 165"
  ],
  "symbol_references": []
}