{
  "symbol": "A/RES/78/144",
  "filename": "A_RES_78_144.pdf",
  "title": "78/144. Agricultural technology for sustainable development",
  "text": "United Nations \nA/RES/78/144\n \n \nGeneral Assembly \nDistr.: General \n21 December 2023 \n \n23-25924 (E)    020124 \n*2325924* \n \n \nSeventy-eighth session \nAgenda item 18 \nSustainable development \n \n \n \n \n Resolution adopted by the General Assembly on \n19 December 2023 \n \n \n \n \n[on the report of the Second Committee (A/78/461, para. 53)] \n \n \n 78/144. Agricultural technology for sustainable development \n \n \n \nThe General Assembly, \n \nRecalling its resolution 76/200 of 17 December 2021, \n \nReaffirming its resolution 70/1 of 25 September 2015, entitled \u201cTransforming \nour world: the 2030 Agenda for Sustainable Development\u201d, in which it adopted a \ncomprehensive, far-reaching and people-centred set of universal and transformative \nSustainable Development Goals and targets, its commitment to working tirelessly for \nthe full implementation of the Agenda by 2030, its recognition that eradicating \npoverty in all its forms and dimensions, including extreme poverty, is the greatest \nglobal challenge and an indispensable requirement for sustainable development, and \nits commitment to achieving sustainable development in its three dimensions \u2013 \neconomic, social and environmental \u2013 in a balanced and integrated manner, and to \nbuilding upon the achievements of the Millennium Development Goals and seeking \nto address their unfinished business, \n \nReaffirming also its resolution 69/313 of 27 July 2015 on the Addis Ababa \nAction Agenda of the Third International Conference on Financing for Development, \nwhich is an integral part of the 2030 Agenda for Sustainable Development, supports \nand complements it, helps to contextualize its means of implementation targets with \nconcrete policies and actions, and reaffirms the strong political commitment to \naddress the challenge of financing and creating an enabling environment at all levels \nfor sustainable development in the spirit of global partnership and solidarity, \n \nExpressing concern about the high level of global hunger, which affected \nbetween 691 million and 783 million people in 2022, \n \nRecognizing that sustainable, affordable and context-specific agricultural \ntechnology has a beneficial impact on and an important role in the successful \nimplementation of the goals and targets of the 2030 Agenda, and in that regard taking \nnote with appreciation of the report of the Secretary-General on progress towards the \n\nA/RES/78/144 \nAgricultural technology for sustainable development\n \n23-25924\n2/11 \n \nSustainable Development Goals,1 the Global Sustainable Development Report and \nthe Secretary-General\u2019s strategy on new technologies, \n \nRecognizing also that the agriculture sector is inextricably linked with the entire \nfood system and that agricultural technologies, innovations and digitalization can be \nenablers of efforts to make agrifood systems more efficient, inclusive, equitable, \nresilient and sustainable and add value throughout the agrifood system by improving \nthe sustainability of production, harvesting, storage, transport, trade, processing, \ntransformation, retail, loss and waste reduction and recycling, as well as interactions \namong these processes, and that it is necessary to identify and analyse opportunities, \nrisks and trade-offs associated with technologies and to ensure the availability, \naccessibility and affordability of relevant technologies for small-scale producers, \nfamily farmers and all actors of the agrifood system, \n \nRecalling the Rome Declaration on Nutrition, adopted at the Second \nInternational Conference on Nutrition, 2 the United Nations Decade of Action on \nNutrition (2016\u20132025)3 and the United Nations Decade on Ecosystem Restoration \n(2021\u20132030),4 taking note of the Nutrition for Growth Summit held in Tokyo in 2021, \nand looking forward to the Nutrition for Growth Summit to be held in Paris, \n \nRecalling also the United Nations Decade of Family Farming (2019\u20132028),5 \nnoting the report on its implementation,6 and that sustainable agricultural technology, \ndigitalization, as well as technological, social, economic and institutional \ninnovations, build on the knowledge, capacities and a science base to respond to the \nneeds and realities of smallholder and family farmers, in particular women and youth \nand Indigenous Peoples in rural areas, and in that regard highlighting the importance \nof innovation-driven development and support to entrepreneurship and innovation \nthat embraces both traditional good practices and innovations, secures access for \nfamily farmers to sustainable, affordable and context-specific innovations, \ntechnologies and connectivity, and leverages the potential for innovation among \nyoung family farmers, and welcoming new sustainable agricultural technologies and \napproaches that can increase productivity and food safety and resilience, contributing \nto their transition from subsistence farming to innovative, commercial production and \nhelping them to increase in a sustainable manner their own food security and nutrition, \ngenerate marketable surpluses and add value to their production, \n \nTaking note with appreciation of the United Nations Food Systems Summit +2 \nStocktaking Moment, convened by the Secretary-General from 24 to 26 July 2023 and \nhosted by the Government of Italy at the Food and Agriculture Organization of the \nUnited Nations in collaboration with the United Nations system in Rome, \n \nStressing the need to design sustainable agrifood systems that conserve the \nnatural resource base and enhance the provision of ecosystem services, while \nincreasing productivity, and that respond to the challenges posed by, inter alia, climate \nchange, the depletion and scarcity of natural resources, urbanization and \nglobalization, and recognizing that agricultural technology, innovation and \ndigitalization can contribute to food security and nutrition and help to build resilience, \n \nRecognizing the need to further enhance the linkages and synergies between \nagricultural technology and sustainable agricultural practices, including agroecological \nand other innovative approaches, resource use efficiency, including sustainable use \n__________________ \n \n1 A/78/80-E/2023/64. \n \n2 World Health Organization, document EB136/8, annex I. \n \n3 See resolution 70/259. \n \n4 See resolution 73/284. \n \n5 See resolution 72/239. \n \n6 A/78/233. \n\nAgricultural technology for sustainable development \nA/RES/78/144\n \n3/11\n23-25924 \n \nof existing domestic agricultural resources acknowledging diversity in circumstance, \ncircular economy, recycling, optimizing external inputs, integration, crop rotation and \ndiversification, no-tillage, soil health monitoring, agroforestry and regenerative \nagricultural practices, by effectively combining safe use and appropriate \ntechnologies, including biotechnologies, with traditional and Indigenous knowledge, \nin order to design sustainable farming systems that strengthen the interactions \nbetween plants, animals, humans and the environment for food security and nutrition \nas well as promote the realization of the right to adequate food, enhance productivity, \nincrease adaptive capacity and reduce greenhouse gas emissions, improve nutrition, \nconserve the natural resource base and attain more sustainable and innovative \nagrifood systems, \n \nNoting with concern the findings contained in the synthesis report of the \nIntergovernmental Panel on Climate Change sixth assessment report, \n \nReaffirming the Paris Agreement7 and its early entry into force, encouraging all \nits parties to fully implement the Agreement, and parties to the United Nations \nFramework Convention on Climate Change8 that have not yet done so to deposit their \ninstruments of ratification, acceptance, approval or accession, where appropriate, as \nsoon as possible, \n \nSeriously concerned about the findings of the Intergovernmental Science-Policy \nPlatform on Biodiversity and Ecosystem Services, and stressing the urgent need to \nstep up efforts to prevent the loss of biological diversity and the degradation of land \nand soil and promote efforts for their conservation and their sustainable use, \n \nWelcoming the adoption on 19 December 2022 of the Kunming-Montreal Global \nBiodiversity Framework, at the fifteenth meeting of the Conference of the Parties to \nthe Convention on Biological Diversity, \n \nRecalling the adoption of the 10-Year Framework of Programmes on \nSustainable Consumption and Production Patterns by the United Nations Conference \non Sustainable Development in 2012,9 \n \nTaking note with appreciation of the United Nations Conference on the Midterm \nComprehensive Review of the Implementation of the Objectives of the International \nDecade for Action, \u201cWater for Sustainable Development\u201d, 2018\u20132028, held in New \nYork from 22 to 24 March 2023, and the Sustainable Development Goals Summit \nheld in New York on 18 and 19 September 2023, noting the twenty-seventh session of \nthe Conference of the Parties to the United Nations Framework Convention on \nClimate Change, held in Sharm el-Sheikh, Egypt, from 6 to 20 November 2022, and \nthe adoption of its decision on the Sharm el-Sheikh joint work on the implementation \nof climate action on agriculture and food security, and looking forward to the twenty-\neighth session of the Conference of the Parties, to be held in Dubai, United Arab \nEmirates, from 30 November to 12 December 2023, \n \nRecalling the United Nations strategic plan for forests 2017\u20132030,10 taking note \nof the Glasgow Leaders\u2019 Declaration on Forests and Land Use, and acknowledging \nthat forests and trees outside forests provide essential ecosystem services, such as \ntimber, food, fuel, fodder, non-wood products and shelter, as well as soil and water \nconservation and clean air, and that forests and trees outside forests contribute \nsubstantially to climate change mitigation and adaptation and to the conservation of \n__________________ \n \n7 Adopted under the UNFCCC in FCCC/CP/2015/10/Add.1, decision 1/CP.21. \n \n8 United Nations, Treaty Series, vol. 1771, No. 30822. \n \n9 A/CONF.216/5, annex. \n \n10 See resolution 71/285. \n\nA/RES/78/144 \nAgricultural technology for sustainable development\n \n23-25924\n4/11 \n \nbiodiversity, prevent land degradation and desertification and reduce the risk of \nfloods, landslides and avalanches, droughts, dust and sand storms and other disasters, \n \nTaking note with appreciation of the activities of the Technology Bank for the \nLeast Developed Countries since its operationalization, and encouraging continued \nsupport to the Bank, \n \nRecognizing the rapid evolution in science and technological innovation and \ndigitalization, and that the development and open access to mega data and information \nwill bring about profound changes in agricultural research, agricultural extension and \nrural development, \n \nStressing the importance of rapid technological change in ensuring food security \nby 2030, and encouraging the adoption of the most advanced and appropriate \ninformation technology in agriculture systems, and calling for enhanced international \ncooperation to facilitate access and promote investment in research, technology and \ninfrastructure, \n \nRecognizing the need to mobilize and scale up financing for science, technology \nand innovation, especially in developing countries, in support of the Sustainable \nDevelopment Goals, particularly Goal 2, \n \nRecognizing also that a systems approach to agricultural innovation is essential \nto ensure that innovations, including technologies and effective approaches, are \nevidence-based, are aligned towards common objectives, promote collaboration, \naddress problems relevant to farmers, and offer incentives to, and the means to \naccelerate adoption by, smallholder and family farmers, and that it is essential to \nenable interactions and knowledge flows among the different stakeholders in \nagricultural innovation systems, including farmers\u2019 organizations, national \nagricultural research systems, extension and advisory services, governments, \ninternational organizations, the private sector and civil society, \n \nRecalling the report of the Secretary-General entitled \u201cRoad map for digital \ncooperation\u201d, presented on 11 June 2020,11 \n \nNoting the creation of the Secretary-General\u2019s Scientific Advisory Board for \nIndependent Advice on Breakthroughs in Science and Technology, \n \nStressing the need to support and strengthen information systems and statistical \nsystems for better disaggregated data collection, including sex-disaggregated data, \nprocessing and interoperability, which will be key in monitoring progress in the \nadoption of sustainable agricultural technologies and their impact on improving food \nsecurity, nutrition and sustainable agriculture, and noting the Committee on World \nFood Security policy recommendations on strengthening collection and use of food \nsecurity and nutrition data and related analysis tools to improve decision-making in \nsupport of the progressive realization of the right to adequate food in the context of \nnational food security, adopted in October 2023, \n \nEmphasizing that participatory research, in conjunction with effective, \npluralistic and demand-driven extension and rural advisory services, is critical in \norder to ensure that agricultural technologies respond to the demands and needs of all \nfarmers, including women, smallholder and family farmers, especially in supporting \nmore efficient, inclusive, equitable, resilient and sustainable agrifood systems that \ncan deliver nutritious food, \n \nRecalling the Sendai Declaration and the Sendai Framework for Disaster Risk \nReduction 2015\u20132030, adopted at the Third United Nations World Conference on \n__________________ \n \n11 A/74/821. \n\nAgricultural technology for sustainable development \nA/RES/78/144\n \n5/11\n23-25924 \n \nDisaster Risk Reduction,12 and the convening of the high-level meeting of the General \nAssembly on the midterm review of the implementation of the Sendai Framework for \nDisaster Risk Reduction 2015\u20132030, at United Nations Headquarters in New York on \n18 and 19 May 2023, \n \nRecalling also the Buenos Aires outcome document of the second High-level \nUnited Nations Conference on South-South Cooperation, held in Buenos Aires in \nMarch 2019,13 \n \nRecalling further all relevant strategies and programmes of action for the least \ndeveloped countries, landlocked developing countries and small island developing \nStates, including the Doha Programme of Action for Least Developed Countries,14 the \nVienna Programme of Action for Landlocked Developing Countries for the Decade \n2014\u2013202415 and the SIDS Accelerated Modalities of Action (SAMOA) Pathway, 16 \nrecalling the Fifth United Nations Conference on the Least Developed Countries, held \nin Doha, looking forward to the convening of the third United Nations Conference on \nLandlocked Developing Countries, in Kigali in June 2024, and the fourth United \nNations Conference on Small Island Developing States, in Antigua and Barbuda in \nMay 2024, reaffirming the importance of supporting Agenda 2063 of the African \nUnion and the programme of the New Partnership for Africa\u2019s Development, 17 and \nrecognizing the major challenge to the achievement of durable peace and sustainable \ndevelopment in countries in conflict and post-conflict situations, \n \nNoting with great concern the severe negative impact on human health, safety \nand well-being caused by the coronavirus disease (COVID-19) pandemic, as well as \nthe severe disruption to societies and economies and the devastating impact on lives \nand livelihoods, and that the poorest and most vulnerable are the hardest hit by the \npandemic, reaffirming the ambition to get back on track to achieve the Sustainable \nDevelopment Goals by designing and implementing sustainable and inclusive \nrecovery strategies to accelerate progress towards the full implementation of the 2030 \nAgenda for Sustainable Development and to help to reduce the risk of and build \nresilience to future shocks, crises and pandemics, including by strengthening health \nsystems and achieving universal health coverage, and recognizing that equitable and \ntimely access for all to safe, quality, effective and affordable COVID-19 vaccines, \ntherapeutics and diagnostics are an essential part of a global response based on unity, \nsolidarity, renewed multilateral cooperation and the principle of leaving no one \nbehind, \n \nRecognizing that the COVID-19 pandemic and mitigation measures taken in \nresponse exposed both strengths and vulnerabilities in agrifood systems, the latter of \nwhich caused disruptions to both livelihoods and food supply chains, increased the \nvolatility of food prices and constrained access to food, and that sustainable \nagricultural technologies, alongside other forms of innovation, can contribute to \nefficient, inclusive, equitable, resilient and sustainable agrifood systems, which \npromote healthy diets and improved nutrition, \n \nStressing the crucial and equal role of women in the agricultural sector and their \ncontribution to enhancing agricultural and rural development, improving food \nsecurity and nutrition and eradicating rural poverty, and underlining the fact that \nmeaningful progress in agricultural and agricultural technology development \nnecessitates, inter alia, closing the gender gap, introducing appropriate gender-\n__________________ \n \n12 Resolution 69/283, annexes I and II. \n \n13 Resolution 73/291, annex. \n \n14 Resolution 76/258, annex. \n \n15 Resolution 69/137, annex I. \n \n16 Resolution 69/15, annex. \n \n17 A/57/304, annex. \n\nA/RES/78/144 \nAgricultural technology for sustainable development\n \n23-25924\n6/11 \n \nresponsive interventions at all stages in agricultural innovation processes, including \nat the policy level, and ensuring that women have equal access to agricultural \ntechnologies, related services and inputs and all necessary productive resources, \nincluding tenure rights and access to land, fisheries and forests, as well as to \naffordable education and training, social services, social protection, health care, \nhealth services and financial services, and full, equal and meaningful access to and \nparticipation in local, regional and international markets, \n \nRecognizing that young people play a significant role in supporting sustainable \neconomic growth and that agricultural technology, innovation and digitalization have \nan essential role to play in facilitating access to agricultural skills for young women \nand men, improving the livelihoods of youth, creating quality and decent jobs and \ncontributing to the prohibition and elimination of the worst forms of child labour, \nstrengthening progress towards achieving the realization of the Sustainable \nDevelopment Goals, \n \nAcknowledging the role and work of civil society, the private sector and \nacademia in furthering progress in developing countries and promoting sustainable \nagriculture and management practices, including through the use of appropriate \nagricultural technology, digitalization and the training of smallholder and family \nfarmers, in particular rural women and Indigenous Peoples, and that multi-stakeholder \npartnerships can contribute to the financing of food security and nutrition as well as \nsustainable development by mobilizing additional resources through advocacy and \ninnovative funding mechanisms and facilitating the coordinated and targeted use of \nexisting resources, aligning them more effectively with global and national public \npriorities, \n \n1. \nTakes note of the report of the Secretary-General;18 \n \n2. \nCalls upon Member States to include sustainable agricultural development \nas an integral part of their national policies and strategies, acknowledges the positive \nimpact of international development cooperation, including North-South, triangular \nand South-South cooperation, as a complement to, not a substitute for, North-South \ncooperation, and urges the relevant bodies of the United Nations system to include \nelements of agricultural technology, innovation, research and extension in efforts to \nrealize the 2030 Agenda for Sustainable Development, 19 with a focus on the research \nand development of technology that is affordable, durable and sustainable and that \ncan be easily used by and disseminated to smallholder and family farmers, in \nparticular rural women, young and ageing farmers; \n \n3. \nUnderlines the importance of supporting sustainable agriculture including \nagroecology and other innovative approaches and advancing research in improving \nand diversifying crop varieties and seed systems, as well as supporting the \nestablishment of sustainable and resilient agricultural systems, sustainable \nmanagement practices and the use of new and existing technologies, such as \nconservation agriculture, integrated soil fertility management, integrated farming \nsystems, animal disease prevention and control and integrated pest management, \nprecision agriculture, irrigation, livestock husbandry and biotechnologies, in order to \nmake agriculture more sustainable and productive, make food more nutritious and, in \nparticular, make crops and farm animals more resistant to diseases, including drug-\nresistant infections, considering international standards in this regard, pests and \nenvironmental stresses, including the impacts of climate change, drought and extreme \nrainfall events, in accordance with national regulations and relevant international \nagreements; \n__________________ \n \n18 A/78/228. \n \n19 Resolution 70/1. \n\nAgricultural technology for sustainable development \nA/RES/78/144\n \n7/11\n23-25924 \n \n \n4. \nRecognizes the important role of family farming and smallholder farming \nin adapting and developing sustainable, affordable and context-specific innovations \nand technologies while helping to preserve and promote traditional products, and in \ncontributing to global food security, poverty eradication and sustainability, as well as \njob creation, and in ending chronic child malnutrition, and in this regard calls upon \nMember States, academia, the private sector and other relevant stakeholders to adapt \nagricultural technologies to the needs of small- and medium-scale family farmers and \ncombine them with credit access for sustainable production and significant \ninvestment in rural infrastructure as well as the training and education of those who \nwould most benefit from them; \n \n5. \nAlso recognizes that strengthening urban-rural linkages can improve both \nrural and urban food security and nutrition, and in this regard highlights the need for \nintegrated urban and rural agricultural land planning, improved rural-urban \ntransportation links, food processing and packaging technology and cold chain \ndevelopment to reduce food loss, and for effective trade links across the urban-rural \ncontinuum, which will contribute to ensuring that small-scale farmers and fishers are \nlinked to local, subnational, national, regional and global value chains and markets; \n \n6. \nRequests relevant United Nations organizations, including the Food and \nAgriculture Organization of the United Nations, the International Fund for \nAgricultural Development and the United Nations Conference on Trade and \nDevelopment, to promote, support and facilitate the exchange of experience among \nMember States through, inter alia, recommendations and other public goods related \nto ways to promote sustainable agriculture and increase the productivity and adaptive \ncapacity of agriculture and the use of a broad range of agricultural technologies that \nsupport more efficient, inclusive, resilient and sustainable agrifood systems, build \nlong-term fertility, healthy and resilient agroecosystems and secure livelihoods and \nhave a positive impact on the entire value chain, including technology for post-harvest \ncrop storage, processing, handling and transportation, including in pressing \nenvironmental circumstances; \n \n7. \nStresses the importance of indicators that can be used to formulate targeted \npolicies towards the development and adoption of, access to and use of agricultural \ntechnology and to measure their impact on the Sustainable Development Goals, and \nin this regard encourages Member States, in cooperation with all relevant \nstakeholders, to continue to contribute to the ongoing work of the Statistical \nCommission on the global indicator framework; \n \n8. \nNotes the need to analyse the potential impacts of agricultural technologies \nbefore their implementation, to ensure that agrifood systems are more inclusive, \nequitable, efficient, resilient and sustainable that can deliver nutritious food, and that \nfostering synergies between government departments, research institutions, national \nand international organizations, alliances and coalitions can accelerate the \ndevelopment and adoption of technologies; \n \n9. \nAlso notes that the development of and access to new technologies should \nbe combined with the preservation and promotion of traditional knowledge, where \nrelevant, to attract Indigenous Peoples and local communities and enable young \npeople to be drivers of more efficient, inclusive, equitable, resilient and sustainable \nagrifood systems, that investments are needed to improve inclusive digital literacy \nand build the digital competencies of young rural people, and that relevant and \neffective policy frameworks and incentives, regulatory measures and economic and \nlegal instruments should be promoted to ensure equity and inclusion in the \ndevelopment of and access to technologies; \n \n10. Stresses the urgent need to enhance adaptive capacity, strengthen \nresilience and reduce vulnerability to climate change, and urges Member States to \n\nA/RES/78/144 \nAgricultural technology for sustainable development\n \n23-25924\n8/11 \n \ncontinue to engage in adaptation planning processes and the implementation of \nmitigation actions; \n \n11. \nAlso stresses the need to significantly reduce pre-harvest, post-harvest and \nother food losses and waste throughout the food supply chain through, inter alia, \nimproved production planning, the promotion of resource-efficient production and \nprocessing practices, improved processing, preservation and packing technologies, \nimproved transportation and logistics management and enhanced household and \nbusiness awareness of food losses and waste prevention, to help all actors in the value \nchain to enjoy greater benefits and to contribute to environmental protection; \n \n12. Recognizes that energy-efficient agrifood systems represent a key \ncomponent in transitioning to sustainable food and agriculture; \n \n13. Underlines the importance of the sustainable use and management of water \nresources to increase and contribute to agricultural productivity, calls upon \nstakeholders to promote integrated water resources management in agriculture and \nadapt agricultural systems to improve their overall water efficiency and water \nproductivity, and their resilience to water stresses, inter alia, by developing and \nimplementing adaptive water and agricultural strategies and action plans based on a \ncomprehensive approach to the long-term availability and variability of all water \nsources, reducing water scarcity risks through integrated water resources management \noptions, designing and implementing agricultural and landscape management \npractices that increase the resilience of agricultural systems to water stress and reduce \npollution, making rain-fed agriculture systems a more reliable option, investing in an \nenabling environment and mobilizing the full set of tools available to them, and calls \nfor further efforts to develop and strengthen irrigation facilities and water-saving \ntechnology, which can also enhance resilience to the current and projected adverse \nimpacts of climate change; \n \n14. Calls upon Member States, academia, the private sector and other \nstakeholders to harness science, technology and innovation, including co-innovation, \nby promoting coherent and integrated agricultural innovation systems through \nparticipatory research, demand-driven extension and rural advisory services and \nincreased, responsible and inclusive public and private investment, building human \ncapacity, encouraging entrepreneurship, creating an enabling economic and \ninstitutional environment and strengthening knowledge flows, in particular between \nscientists and farmers, taking into account local and traditional knowledge systems, \nin combination with new sources of knowledge; \n \n15. Invites the United Nations system and all relevant stakeholders to consider \nways to make available, on mutually agreed terms, data and information relating to \nagrifood systems, including meteorology, big data, the Internet of things, satellite \nimagery, early warning systems and other data-based technologies, that could help to \nbuild the resilience of smallholder and family farmers, optimize yields and support \nrural livelihoods; \n \n16. Recognizes that weather forecasting and climate services and products \nallow farmers to better plan agricultural activities, optimize production, manage \nclimate-related risks and integrate climate change adaptation into their decisions, and \ntherefore encourages governments and meteorological agencies to improve the \ncollection, dissemination and analysis of agrometeorological and agroclimatological \ndata and information; \n \n17. Also recognizes that advanced technologies, such as big data, the Internet \nof things, artificial intelligence and machine learning, distributed ledgers, remote \nsensing and geospatial analysis, have the potential to increase agricultural \nproductivity, improve access to markets and efficiency of inputs, and ensure timely \n\nAgricultural technology for sustainable development \nA/RES/78/144\n \n9/11\n23-25924 \n \ncommunication for informed decision-making, while acknowledging that this should \nbe examined carefully to maximize benefits and minimize downsides; \n \n18. Further recognizes that sustainable agricultural mechanization can have \npotential drawbacks but could also help address shortages of labour, ease drudgery, \nincrease incomes, enhance productivity and the timeliness of agricultural activities, \npromote efficient resource use, enable better market access and attract new \ninvestment and talent into agriculture, thereby creating better prospects for \nsustainable growth and support measures to mitigate climate- and weather-related \nhazards, and acknowledges that mechanization and digitalization can also create new \nand higher-paying jobs in agricultural value chains, making it more attractive for \nyouth to stay in rural areas, and in this regard, welcomes the convening of the Global \nConference on Sustainable Agricultural Mechanization, organized by the Food and \nAgriculture Organization, from 27 to 29 September 2023 in Rome; \n \n19.  Recognizes the important role of information and communications \ntechnology, as well as digitalization and e-agriculture, in achieving the Sustainable \nDevelopment Goals and in improving agricultural productivity, practices and \nsmallholder livelihoods, strengthening agricultural markets and institutions, \nimproving agricultural extension and rural advisory services, empowering farmer \ncommunities, keeping farmers and rural entrepreneurs informed about agricultural \ninnovations, weather conditions, input availability, financial services and market \nprices and connecting them with buyers, and stresses the need to ensure that women \nand youth and Indigenous Peoples have equitable access to information and \ncommunications technology, digitalization and e-agriculture, especially in rural areas, \nand to close digital divides within and between countries, as well as the gender digital \ndivide, to accelerate the achievement of the Sustainable Development Goals; \n \n20. Underlines the instrumental role of agricultural technology, agricultural \nresearch and innovation and technology transfer on mutually agreed terms and the \nsharing of knowledge and practices in furthering sustainable development and in \nachieving the Sustainable Development Goals, calls, therefore, upon Member States, \nand encourages relevant international bodies, to support sustainable agricultural \nresearch and development, emphasizes that research outputs should be appropriate to \nthe needs of and accessible to end users, including governments, water managers, \nlarge-scale private sector enterprises and women, smallholder and family farmers, \nand in this regard calls for continued support to the international agricultural research \nsystem, including the research centres of CGIAR and other relevant international \norganizations and initiatives; \n \n21. Recognizes that agricultural biotechnologies can be harnessed and scaled \nup to enhance the productivity of agrifood systems, notes with concern that national \nagricultural research systems in developing countries face barriers such as restricted \naccess, limited funding and regulatory frameworks to use advanced biotechnologies, \nand in this regard reiterates the need to accelerate the transfer of environmentally \nsound technologies to developing countries on mutually agreed terms; \n \n22. Notes that, according to World Bank estimates, at least 300 billion United \nStates dollars in investments are needed annually to promote sustainable food systems \nand that many developing countries, particularly low-income countries, are grappling \nwith multiple crises, including extreme weather disasters, constrained fiscal \nconditions, and escalating interest rates, making it challenging to finance emergency \nresponses while simultaneously investing in sustainable food systems, and in this \nregard calls upon Member States to promote a concerted effort to jointly mobilize \npublic and private capital, to achieve high-performing food systems; \n \n23. Urges Member States, relevant United Nations organizations and other \nstakeholders to strengthen efforts to improve the development of sustainable \n\nA/RES/78/144 \nAgricultural technology for sustainable development\n \n23-25924\n10/11 \n \nagricultural technologies and their transfer and dissemination on mutually agreed \nterms to developing countries, especially the least developed countries, in particular \nat the bilateral and regional levels, and encourages international, regional and national \nefforts to strengthen capacity and foster the utilization of local know-how in \ndeveloping countries, especially that of smallholder and family farmers, in particular \nrural women and youth, in order to enhance agricultural productivity and the \nnutritional quality of agricultural products, promote sustainable practices in \npre-harvest and post-harvest agricultural activities and enhance food security and \nnutrition-related programmes and policies that take into consideration the specific \nneeds of women, young children and youth, with particular attention to securing the \nprohibition and elimination of the worst forms of child labour, strengthening progress \ntowards achieving the Sustainable Development Goals; \n \n24. Recognizes that recovery efforts from the COVID-19 pandemic present an \nopportunity to promote sustainability and increase resilience of agriculture and food \nsystems to the impact of the pandemic and future crises, including through the use of \ntechnology and innovation in all its forms, including digital services that can increase \naccess to financial services for small-scale producers and family farmers, that are \ngender-responsive, including in rural areas, to address mobility restrictions and bank \nclosures, agricultural extension services, weather and climate services, and online \nplatforms that can enable producers to sell directly to consumers, leading to increased \nprofits, improved supply chain efficiency, reduced wastage and better financial \ninclusion, leveraging artificial intelligence in supporting sustainable agriculture, \nwhich can help to improve the overall harvest quality and accuracy, and calls upon \nall relevant stakeholders to continue to develop policies, investments and partnerships \nthat help to realize the potential of technologies to transform agriculture and food \nsystems, while tackling the persistent digital divides, including the gender digital \ndivide, in order to build back better and achieve the Sustainable Development Goals; \n \n25. Calls upon Member States and relevant United Nations organizations and \nother stakeholders to mainstream gender perspectives into agricultural policies and \nprojects and to focus on closing the gender gap by, inter alia, encouraging gender-\nbalanced investments and innovation in small-scale agricultural production and \ndistribution, and a gender-responsive value chain supported by integrated and \nmultisectoral policies, in order to improve women\u2019s productive capacity and incomes, \nstrengthen their resilience and achieve equitable access to all forms of financing, \nmarkets and networks, labour-saving technologies and agricultural technology \ninformation and know-how, equipment, decision-making forums and associated \nagricultural resources to ensure that agriculture, food security and nutrition-related \nprogrammes and policies take into consideration the specific needs of women and the \nbarriers that women face in accessing agricultural inputs and resources; \n \n26. Encourages Governments to develop and implement youth-focused \nagricultural development projects and programmes, including through training, \neducation, financial inclusion services, including microcredit services, and capacity-\nbuilding, including with regard to innovation, in association with the private sector, in \norder to stimulate the interest and the involvement of youth in sustainable agriculture; \n \n27. Remains concerned that agricultural innovations and technologies often \nbypass ageing farmers, and in particular ageing women farmers, as many do not \npossess the financial resources or the skills to adopt new practices, and in this regard \nstresses the need to strengthen the capacity of ageing farmers through continued \naccess to financial and infrastructure services and training for improved farming \ntechniques and technologies; \n \n28. Acknowledges that technological innovations can be supported by \nfinancial innovations and financial support, such as de-risking strategies and blended \n\nAgricultural technology for sustainable development \nA/RES/78/144\n \n11/11\n23-25924 \n \nfinance options, and that blended finance mechanisms are new institutional models \nthat link public and private financing and patient capital with equity investments and \npromote schemes that more effectively distribute investments to small-scale \nenterprises and producers; \n \n29. Encourages Member States, civil society and public and private \ninstitutions to develop partnerships to support financial and market services, \nincluding training, capacity-building, infrastructure and extension and rural advisory \nservices, and calls for further efforts by all stakeholders to include smallholder and \nfamily farmers, in particular rural women and youth, in planning and in taking \ndecisions about making appropriate sustainable agricultural technologies and \npractices accessible and affordable to them, and strengthen the links between \ncommunity-based initiatives and financial institutions, including through the \npromotion of financing tools that foster agricultural sustainability; \n \n30. Requests the Secretary-General to submit to the General Assembly at its \neightieth session, within existing resources, an action-oriented report that examines the \ncurrent technological trends and key advances in agricultural technologies, provides \nillustrative examples of the transformative use of technologies at scale and includes \nrecommendations that assist Member States in accelerating their efforts to implement \nthe relevant goals and targets of the 2030 Agenda, and decides to include in the \nprovisional agenda of its eightieth session the item entitled \u201cSustainable development\u201d. \n \n49th plenary meeting \n19 December 2023 \n \n",
  "paragraphs": {
    "1": "Takes note of the report of the Secretary-General;18",
    "2": "Calls upon Member States to include sustainable agricultural development as an integral part of their national policies and strategies, acknowledges the positive impact of international development cooperation, including North-South, triangular and South-South cooperation, as a complement to, not a substitute for, North-South cooperation, and urges the relevant bodies of the United Nations system to include elements of agricultural technology, innovation, research and extension in efforts to realize the 2030 Agenda for Sustainable Development, 19 with a focus on the research and development of technology that is affordable, durable and sustainable and that can be easily used by and disseminated to smallholder and family farmers, in particular rural women, young and ageing farmers;",
    "3": "Underlines the importance of supporting sustainable agriculture including agroecology and other innovative approaches and advancing research in improving and diversifying crop varieties and seed systems, as well as supporting the establishment of sustainable and resilient agricultural systems, sustainable management practices and the use of new and existing technologies, such as conservation agriculture, integrated soil fertility management, integrated farming systems, animal disease prevention and control and integrated pest management, precision agriculture, irrigation, livestock husbandry and biotechnologies, in order to make agriculture more sustainable and productive, make food more nutritious and, in particular, make crops and farm animals more resistant to diseases, including drug- resistant infections, considering international standards in this regard, pests and environmental stresses, including the impacts of climate change, drought and extreme rainfall events, in accordance with national regulations and relevant international agreements; __________________ 18 A/78/228. 19 Resolution 70/1. Agricultural technology for sustainable development A/RES/78/144 7/11 23-25924",
    "4": "Recognizes the important role of family farming and smallholder farming in adapting and developing sustainable, affordable and context-specific innovations and technologies while helping to preserve and promote traditional products, and in contributing to global food security, poverty eradication and sustainability, as well as job creation, and in ending chronic child malnutrition, and in this regard calls upon Member States, academia, the private sector and other relevant stakeholders to adapt agricultural technologies to the needs of small- and medium-scale family farmers and combine them with credit access for sustainable production and significant investment in rural infrastructure as well as the training and education of those who would most benefit from them;",
    "5": "Also recognizes that strengthening urban-rural linkages can improve both rural and urban food security and nutrition, and in this regard highlights the need for integrated urban and rural agricultural land planning, improved rural-urban transportation links, food processing and packaging technology and cold chain development to reduce food loss, and for effective trade links across the urban-rural continuum, which will contribute to ensuring that small-scale farmers and fishers are linked to local, subnational, national, regional and global value chains and markets;",
    "6": "Requests relevant United Nations organizations, including the Food and Agriculture Organization of the United Nations, the International Fund for Agricultural Development and the United Nations Conference on Trade and Development, to promote, support and facilitate the exchange of experience among Member States through, inter alia, recommendations and other public goods related to ways to promote sustainable agriculture and increase the productivity and adaptive capacity of agriculture and the use of a broad range of agricultural technologies that support more efficient, inclusive, resilient and sustainable agrifood systems, build long-term fertility, healthy and resilient agroecosystems and secure livelihoods and have a positive impact on the entire value chain, including technology for post-harvest crop storage, processing, handling and transportation, including in pressing environmental circumstances;",
    "7": "Stresses the importance of indicators that can be used to formulate targeted policies towards the development and adoption of, access to and use of agricultural technology and to measure their impact on the Sustainable Development Goals, and in this regard encourages Member States, in cooperation with all relevant stakeholders, to continue to contribute to the ongoing work of the Statistical Commission on the global indicator framework;",
    "8": "Notes the need to analyse the potential impacts of agricultural technologies before their implementation, to ensure that agrifood systems are more inclusive, equitable, efficient, resilient and sustainable that can deliver nutritious food, and that fostering synergies between government departments, research institutions, national and international organizations, alliances and coalitions can accelerate the development and adoption of technologies;",
    "9": "Also notes that the development of and access to new technologies should be combined with the preservation and promotion of traditional knowledge, where relevant, to attract Indigenous Peoples and local communities and enable young people to be drivers of more efficient, inclusive, equitable, resilient and sustainable agrifood systems, that investments are needed to improve inclusive digital literacy and build the digital competencies of young rural people, and that relevant and effective policy frameworks and incentives, regulatory measures and economic and legal instruments should be promoted to ensure equity and inclusion in the development of and access to technologies;",
    "10": "Stresses the urgent need to enhance adaptive capacity, strengthen resilience and reduce vulnerability to climate change, and urges Member States to A/RES/78/144 Agricultural technology for sustainable development 23-25924 8/11 continue to engage in adaptation planning processes and the implementation of mitigation actions;",
    "11": "Also stresses the need to significantly reduce pre-harvest, post-harvest and other food losses and waste throughout the food supply chain through, inter alia, improved production planning, the promotion of resource-efficient production and processing practices, improved processing, preservation and packing technologies, improved transportation and logistics management and enhanced household and business awareness of food losses and waste prevention, to help all actors in the value chain to enjoy greater benefits and to contribute to environmental protection;",
    "12": "Recognizes that energy-efficient agrifood systems represent a key component in transitioning to sustainable food and agriculture;",
    "13": "Underlines the importance of the sustainable use and management of water resources to increase and contribute to agricultural productivity, calls upon stakeholders to promote integrated water resources management in agriculture and adapt agricultural systems to improve their overall water efficiency and water productivity, and their resilience to water stresses, inter alia, by developing and implementing adaptive water and agricultural strategies and action plans based on a comprehensive approach to the long-term availability and variability of all water sources, reducing water scarcity risks through integrated water resources management options, designing and implementing agricultural and landscape management practices that increase the resilience of agricultural systems to water stress and reduce pollution, making rain-fed agriculture systems a more reliable option, investing in an enabling environment and mobilizing the full set of tools available to them, and calls for further efforts to develop and strengthen irrigation facilities and water-saving technology, which can also enhance resilience to the current and projected adverse impacts of climate change;",
    "14": "Calls upon Member States, academia, the private sector and other stakeholders to harness science, technology and innovation, including co-innovation, by promoting coherent and integrated agricultural innovation systems through participatory research, demand-driven extension and rural advisory services and increased, responsible and inclusive public and private investment, building human capacity, encouraging entrepreneurship, creating an enabling economic and institutional environment and strengthening knowledge flows, in particular between scientists and farmers, taking into account local and traditional knowledge systems, in combination with new sources of knowledge;",
    "15": "Invites the United Nations system and all relevant stakeholders to consider ways to make available, on mutually agreed terms, data and information relating to agrifood systems, including meteorology, big data, the Internet of things, satellite imagery, early warning systems and other data-based technologies, that could help to build the resilience of smallholder and family farmers, optimize yields and support rural livelihoods;",
    "16": "Recognizes that weather forecasting and climate services and products allow farmers to better plan agricultural activities, optimize production, manage climate-related risks and integrate climate change adaptation into their decisions, and therefore encourages governments and meteorological agencies to improve the collection, dissemination and analysis of agrometeorological and agroclimatological data and information;",
    "17": "Also recognizes that advanced technologies, such as big data, the Internet of things, artificial intelligence and machine learning, distributed ledgers, remote sensing and geospatial analysis, have the potential to increase agricultural productivity, improve access to markets and efficiency of inputs, and ensure timely Agricultural technology for sustainable development A/RES/78/144 9/11 23-25924 communication for informed decision-making, while acknowledging that this should be examined carefully to maximize benefits and minimize downsides;",
    "18": "Further recognizes that sustainable agricultural mechanization can have potential drawbacks but could also help address shortages of labour, ease drudgery, increase incomes, enhance productivity and the timeliness of agricultural activities, promote efficient resource use, enable better market access and attract new investment and talent into agriculture, thereby creating better prospects for sustainable growth and support measures to mitigate climate- and weather-related hazards, and acknowledges that mechanization and digitalization can also create new and higher-paying jobs in agricultural value chains, making it more attractive for youth to stay in rural areas, and in this regard, welcomes the convening of the Global Conference on Sustainable Agricultural Mechanization, organized by the Food and Agriculture Organization, from 27 to 29 September 2023 in Rome;",
    "19": "Recognizes the important role of information and communications technology, as well as digitalization and e-agriculture, in achieving the Sustainable Development Goals and in improving agricultural productivity, practices and smallholder livelihoods, strengthening agricultural markets and institutions, improving agricultural extension and rural advisory services, empowering farmer communities, keeping farmers and rural entrepreneurs informed about agricultural innovations, weather conditions, input availability, financial services and market prices and connecting them with buyers, and stresses the need to ensure that women and youth and Indigenous Peoples have equitable access to information and communications technology, digitalization and e-agriculture, especially in rural areas, and to close digital divides within and between countries, as well as the gender digital divide, to accelerate the achievement of the Sustainable Development Goals;",
    "20": "Underlines the instrumental role of agricultural technology, agricultural research and innovation and technology transfer on mutually agreed terms and the sharing of knowledge and practices in furthering sustainable development and in achieving the Sustainable Development Goals, calls, therefore, upon Member States, and encourages relevant international bodies, to support sustainable agricultural research and development, emphasizes that research outputs should be appropriate to the needs of and accessible to end users, including governments, water managers, large-scale private sector enterprises and women, smallholder and family farmers, and in this regard calls for continued support to the international agricultural research system, including the research centres of CGIAR and other relevant international organizations and initiatives;",
    "21": "Recognizes that agricultural biotechnologies can be harnessed and scaled up to enhance the productivity of agrifood systems, notes with concern that national agricultural research systems in developing countries face barriers such as restricted access, limited funding and regulatory frameworks to use advanced biotechnologies, and in this regard reiterates the need to accelerate the transfer of environmentally sound technologies to developing countries on mutually agreed terms;",
    "22": "Notes that, according to World Bank estimates, at least 300 billion United States dollars in investments are needed annually to promote sustainable food systems and that many developing countries, particularly low-income countries, are grappling with multiple crises, including extreme weather disasters, constrained fiscal conditions, and escalating interest rates, making it challenging to finance emergency responses while simultaneously investing in sustainable food systems, and in this regard calls upon Member States to promote a concerted effort to jointly mobilize public and private capital, to achieve high-performing food systems;",
    "23": "Urges Member States, relevant United Nations organizations and other stakeholders to strengthen efforts to improve the development of sustainable A/RES/78/144 Agricultural technology for sustainable development 23-25924 10/11 agricultural technologies and their transfer and dissemination on mutually agreed terms to developing countries, especially the least developed countries, in particular at the bilateral and regional levels, and encourages international, regional and national efforts to strengthen capacity and foster the utilization of local know-how in developing countries, especially that of smallholder and family farmers, in particular rural women and youth, in order to enhance agricultural productivity and the nutritional quality of agricultural products, promote sustainable practices in pre-harvest and post-harvest agricultural activities and enhance food security and nutrition-related programmes and policies that take into consideration the specific needs of women, young children and youth, with particular attention to securing the prohibition and elimination of the worst forms of child labour, strengthening progress towards achieving the Sustainable Development Goals;",
    "24": "Recognizes that recovery efforts from the COVID-19 pandemic present an opportunity to promote sustainability and increase resilience of agriculture and food systems to the impact of the pandemic and future crises, including through the use of technology and innovation in all its forms, including digital services that can increase access to financial services for small-scale producers and family farmers, that are gender-responsive, including in rural areas, to address mobility restrictions and bank closures, agricultural extension services, weather and climate services, and online platforms that can enable producers to sell directly to consumers, leading to increased profits, improved supply chain efficiency, reduced wastage and better financial inclusion, leveraging artificial intelligence in supporting sustainable agriculture, which can help to improve the overall harvest quality and accuracy, and calls upon all relevant stakeholders to continue to develop policies, investments and partnerships that help to realize the potential of technologies to transform agriculture and food systems, while tackling the persistent digital divides, including the gender digital divide, in order to build back better and achieve the Sustainable Development Goals;",
    "25": "Calls upon Member States and relevant United Nations organizations and other stakeholders to mainstream gender perspectives into agricultural policies and projects and to focus on closing the gender gap by, inter alia, encouraging gender- balanced investments and innovation in small-scale agricultural production and distribution, and a gender-responsive value chain supported by integrated and multisectoral policies, in order to improve women\u2019s productive capacity and incomes, strengthen their resilience and achieve equitable access to all forms of financing, markets and networks, labour-saving technologies and agricultural technology information and know-how, equipment, decision-making forums and associated agricultural resources to ensure that agriculture, food security and nutrition-related programmes and policies take into consideration the specific needs of women and the barriers that women face in accessing agricultural inputs and resources;",
    "26": "Encourages Governments to develop and implement youth-focused agricultural development projects and programmes, including through training, education, financial inclusion services, including microcredit services, and capacity- building, including with regard to innovation, in association with the private sector, in order to stimulate the interest and the involvement of youth in sustainable agriculture;",
    "27": "Remains concerned that agricultural innovations and technologies often bypass ageing farmers, and in particular ageing women farmers, as many do not possess the financial resources or the skills to adopt new practices, and in this regard stresses the need to strengthen the capacity of ageing farmers through continued access to financial and infrastructure services and training for improved farming techniques and technologies;",
    "28": "Acknowledges that technological innovations can be supported by financial innovations and financial support, such as de-risking strategies and blended Agricultural technology for sustainable development A/RES/78/144 11/11 23-25924 finance options, and that blended finance mechanisms are new institutional models that link public and private financing and patient capital with equity investments and promote schemes that more effectively distribute investments to small-scale enterprises and producers;",
    "29": "Encourages Member States, civil society and public and private institutions to develop partnerships to support financial and market services, including training, capacity-building, infrastructure and extension and rural advisory services, and calls for further efforts by all stakeholders to include smallholder and family farmers, in particular rural women and youth, in planning and in taking decisions about making appropriate sustainable agricultural technologies and practices accessible and affordable to them, and strengthen the links between community-based initiatives and financial institutions, including through the promotion of financing tools that foster agricultural sustainability;",
    "30": "Requests the Secretary-General to submit to the General Assembly at its eightieth session, within existing resources, an action-oriented report that examines the current technological trends and key advances in agricultural technologies, provides illustrative examples of the transformative use of technologies at scale and includes recommendations that assist Member States in accelerating their efforts to implement the relevant goals and targets of the 2030 Agenda, and decides to include in the provisional agenda of its eightieth session the item entitled \u201cSustainable development\u201d. 49th plenary meeting 19 December 2023"
  },
  "agenda_items": [
    "Item 18"
  ],
  "symbol_references": []
}