{
  "symbol": "A/RES/76/97",
  "filename": "A_RES_76_97.pdf",
  "title": "76/97. Question of Montserrat",
  "text": "United Nations \nA/RES/76/97\n \n \nGeneral Assembly \nDistr.: General \n16 December 2021 \n \n21-18700 (E)    211221     \n*2118700* \n \n \nSeventy-sixth session \nAgenda item 63 \nImplementation of the Declaration on the Granting of \nIndependence to Colonial Countries and Peoples \n \n \n \n \n Resolution adopted by the General Assembly \non 9 December 2021 \n \n \n \n \n[on the report of the Special Political and Decolonization Committee  \n(Fourth Committee) (A/76/425, para. 37)] \n \n \n \n76/97. Question of Montserrat \n \n \n \nThe General Assembly,  \n \nHaving considered the question of Montserrat and examined the report of the \nSpecial Committee on the Situation with regard to the Implementation of the \nDeclaration on the Granting of Independence to Colonial Countries and Peoples for \n2021,1 \n \nTaking note of the working paper prepared by the Secretariat on Montserrat2 and \nother relevant information, \n \nRecognizing that all available options for self-determination of the Territory are \nvalid as long as they are in accordance with the freely expressed wishes of the people \nof Montserrat and in conformity with the clearly defined principles contained in \nGeneral Assembly resolutions 1514 (XV) of 14 December 1960, 1541 (XV) of \n15 December 1960 and other resolutions of the Assembly, \n \nExpressing concern that, more than 60 years after the adoption of the \nDeclaration on the Granting of Independence to Colonial Countries and Peoples,3 \nthere still remain 17 Non-Self-Governing Territories, including Montserrat, \n \nConscious of the importance of continuing the effective implementation of the \nDeclaration, taking into account the target set by the United Nations to eradicate \ncolonialism by 2030 and the plan of action for the International Decades for the \nEradication of Colonialism,4 \n__________________ \n \n1  Official Records of the General Assembly, Seventy-sixth Session, Supplement No. 23 (A/76/23). \n \n2  A/AC.109/2021/10. \n \n3  Resolution 1514 (XV). \n \n4  A/56/61, annex. \n\nA/RES/76/97 \nQuestion of Montserrat\n \n21-18700\n2/6 \n \n \nRecognizing that the specific characteristics and the aspirations of the people of \nMontserrat require flexible, practical and innovative approaches to the options for \nself-determination, without any prejudice to territorial size, geographical location, \nsize of population or natural resources, \n \nConvinced that the wishes and aspirations of the people of the Territory should \ncontinue to guide the development of their future political status and that \nreferendums, free and fair elections and other forms of popular consultation play an \nimportant role in ascertaining the wishes and aspirations of the people, \n \nConcerned by the use and exploitation of the natural resources of the Non-Self-\nGoverning Territories by the administering Powers for their benefit, by the use of the \nTerritories as international financial centres to the detriment of the world economy \nand by the consequences of any economic activities of the administering Powers that \nare contrary to the interests of the people of the Territories, as well as to resolution \n1514 (XV), \n \nConvinced that any negotiations to determine the status of the Territory must \ntake place with the active involvement and participation of the people of the Territory, \nunder the auspices of the United Nations, on a case-by-case basis, and that the views \nof the people of Montserrat in respect of their right to self-determination should be \nascertained, \n \nNoting the continued cooperation of the Non-Self-Governing Territories at the \nlocal and regional levels, including participation in the work of regional \norganizations, \n \nMindful that, in order for the Special Committee to enhance its understanding \nof the political status of the people of Montserrat and to fulfil its mandate effectively, \nit is important for it to be apprised by the United Kingdom of Great Britain and \nNorthern Ireland as the administering Power and to receive information from other \nappropriate sources, including the representatives of the Territory, concerning the \nwishes and aspirations of the people of the Territory, \n \nAware of the importance both to Montserrat and to the Special Committee of the \nparticipation of elected and appointed representatives of Montserrat in the work of \nthe Committee, \n \nRecognizing the need for the Special Committee to ensure that the appropriate \nbodies of the United Nations actively pursue a public awareness campaign aimed at \nassisting the people of Montserrat with their inalienable right to self-determination \nand in gaining a better understanding of the options for self-determination, on a case-\nby-case basis, \n \nMindful, in that connection, that the holding of regional seminars in the \nCaribbean and Pacific regions and at Headquarters, with the active participation of \nrepresentatives of the Non-Self-Governing Territories, provides a helpful means for \nthe Special Committee to fulfil its mandate and that the regional nature of the \nseminars, which alternate between the Caribbean and the Pacific, is a crucial element \nin the context of a United Nations programme for ascertaining the political status of \nthe Territories, \n \nRecalling the Caribbean regional seminar on the theme \u201cImplementation of the \nThird International Decade for the Eradication of Colonialism: accelerating \ndecolonization through renewed commitment and pragmatic measures\u201d, held by the \nSpecial Committee in Grand Anse, Grenada, and hosted by the Government of \nGrenada from 2 to 4 May 2019, as a significant and forward-looking event, which \nenabled the participants to assess progress made and address challenges faced in the \n\nQuestion of Montserrat \nA/RES/76/97\n \n3/6\n21-18700 \n \ndecolonization process, review the existing working methods of the Committee and \nrenew its commitment to implementing its historic task,  \n \nRecalling also the importance of the conclusions and recommendations adopted \nby the seminar, which were annexed to the report of the Special Committee for 20195 \nand which outlined the findings of the seminar, including, especially, the way forward \nfor the decolonization process within the context of the proclamation by the General \nAssembly of the period 2011\u20132020 as the Third International Decade for the \nEradication of Colonialism,6 \n \nMindful that the 2021 Caribbean regional seminar, originally scheduled to be \nconvened in Dominica, from 19 to 21 May 2021, had to be rescheduled, and \nwelcoming the holding of the regional seminar in the Parish of Saint John, Dominica, \nfrom 25 to 27 August 2021, \n \nRecalling the statements made by the Premier of Montserrat before the Special \nCommittee in June 2018 and at the 2018 Pacific regional seminar, in which he \nexpressed the view that the previous request made for the removal of Montserrat from \nthe agenda of the Special Committee should be reversed,  \n \nRecalling also the information provided by the Premier that Montserrat could \nnot achieve its development goals if its economic dependency continued, \ncompounded by ongoing financial challenges, and that securing funding for \nrebuilding key infrastructure lost and helping evacuees from the 1995 volcanic crisis \nrequired an intervention from the Special Committee as a neutral partner,  \n \nNoting with appreciation the contribution to the development of some \nTerritories by the specialized agencies and other organizations of the United Nations \nsystem, in particular the Economic Commission for Latin America and the Caribbean, \nthe Economic and Social Commission for Asia and the Pacific, the United Nations \nDevelopment Programme and the World Food Programme, as well as regional \ninstitutions such as the Caribbean Development Bank, the Caribbean Community, the \nOrganisation of Eastern Caribbean States, the Pacific Islands Forum and the agencies \nof the Council of Regional Organizations in the Pacific,  \n \nNoting with concern the continuing consequences of the 1995 volcanic eruption, \nwhich led to the evacuation of three quarters of the population of the Territory to safe \nareas of the island and to areas outside the Territory and which continues to have \nenduring consequences for the economy of the island,  \n \nAcknowledging the continuing assistance provided to the Territory by States \nmembers of the Caribbean Community, in particular Antigua and Barbuda, which has \noffered safe refuge and access to educational and health facilities, as well as \nemployment for thousands who have left the Territory,  \n \nNoting the continuing efforts of the administering Power and the territorial \nGovernment to deal with the consequences of the volcanic eruption,  \n \nRecalling the importance of improving the infrastructure and accessibility of \nMontserrat, as conveyed by the Premier of Montserrat to the Chair of the Special \nCommittee in their meeting on 11 May 2015,  \n \nStressing the importance of regional ties for the development of a small island \nTerritory,  \n \nCognizant of the Territory\u2019s membership in the Caribbean Overseas Countries \nand Territories Council,  \n__________________ \n \n5  Official Records of the General Assembly, Seventy-fourth Session, Supplement No. 23 (A/74/23). \n \n6  See resolution 65/119. \n\nA/RES/76/97 \nQuestion of Montserrat\n \n21-18700\n4/6 \n \n \nRecalling the elections in the Territory that were held in November 2019,7 \n \nWelcoming the dispatch of a United Nations visiting mission to Montserrat in \nDecember 2019, \n \nWelcoming also the cooperation of the administering Power in facilitating the \ndispatching of the visiting mission, \n \nHaving examined the report of the visiting mission,8 \n \nRecalling its resolutions 74/270 of 2 April 2020, entitled \u201cGlobal solidarity to \nfight the coronavirus disease 2019 (COVID-19)\u201d, 74/274 of 20 April 2020, entitled \n\u201cInternational cooperation to ensure global access to medicines, vaccines and medical \nequipment to face COVID-19\u201d, 74/306 of 11 September 2020, entitled \u201cComprehensive \nand coordinated response to the coronavirus disease (COVID-19) pandemic\u201d, 74/307 \nof 11 September 2020, entitled \u201cUnited response against global health threats: \ncombating COVID-19\u201d, 75/156 of 16 December 2020, entitled \u201cStrengthening \nnational and international rapid response to the impact of the coronavirus disease \n(COVID-19) on women and girls\u201d, and 75/157 of 16 December 2020, entitled \n\u201cWomen and girls and the response to the coronavirus disease (COVID-19)\u201d, as well \nas other relevant resolutions, \n \n1. \nReaffirms the inalienable right of the people of Montserrat to self-\ndetermination, in conformity with the Charter of the United Nations and with General \nAssembly resolution 1514 (XV), containing the Declaration on the Granting of \nIndependence to Colonial Countries and Peoples; \n \n2. \nAlso reaffirms that, in the process of decolonization of Montserrat, there \nis no alternative to the principle of self-determination, which is also a fundamental \nhuman right, as recognized under the relevant human rights conventions; \n \n3. \nFurther reaffirms that it is ultimately for the people of Montserrat to \ndetermine freely their future political status in accordance with the relevant \nprovisions of the Charter, the Declaration and the relevant resolutions of the General \nAssembly, and in that connection calls upon the administering Power, in cooperation \nwith the territorial Government and appropriate bodies of the United Nations system, \nto develop political education programmes for the Territory in order to foster an \nawareness among the people of their right to self-determination in conformity with \nthe legitimate political status options, based on the principles clearly defined in \nAssembly resolution 1541 (XV) and other relevant resolutions and decisions; \n \n4. \nRecalls the 2010 Constitution of Montserrat and the work of the territorial \nGovernment with respect to moving forward to consolidate the gains provided for in \nthe Constitution; \n \n5. \nRequests the administering Power to assist the Territory by facilitating its \nwork concerning public educational outreach efforts, consistent with Article 73 b of \nthe Charter, and in that regard calls upon the relevant United Nations organizations \nto provide assistance to the Territory, if requested; \n \n6. \nWelcomes the participation of the Territory in the work of the Organisation \nof Eastern Caribbean States and the Economic Commission for Latin America and the \nCaribbean; \n \n7. \nStresses that the Territory should continue to participate in the activities of \nthe Special Committee on the Situation with regard to the Implementation of the \nDeclaration on the Granting of Independence to Colonial Countries and Peoples, \n__________________ \n \n7  See A/AC.109/2020/10, para. 3. \n \n8  A/AC.109/2020/20. \n\nQuestion of Montserrat \nA/RES/76/97\n \n5/6\n21-18700 \n \nincluding regional seminars, in order to provide the Committee with up-to-date \ninformation regarding the decolonization process; \n \n8. \nCalls upon the administering Power, the specialized agencies and other \norganizations of the United Nations system, as well as regional and other \norganizations, to continue to provide assistance to the Territory in alleviating the \nconsequences of the volcanic eruption; \n \n9. \nStresses the importance of the Special Committee being apprised of the \nviews and wishes of the people of Montserrat and enhancing its understanding of their \nconditions, including the nature and scope of the existing political and constitutional \narrangements between Montserrat and the administering Power; \n \n10. Calls upon the administering Power to participate in and cooperate fully \nwith the work of the Special Committee in order to implement the provisions of \nArticle 73 e of the Charter and the Declaration and in order to advise the Committee \non the implementation of the provisions under Article 73 b of the Charter on efforts \nto promote self-government in Montserrat, and encourages the administering Power \nto facilitate visiting and special missions to the Territory; \n \n11. \nExpresses its appreciation to the administering Power and to the \nGovernment and people of Montserrat for the cooperation and assistance extended to \nthe United Nations visiting mission to Montserrat in December 2019; \n \n12. Reiterates its endorsement of the report, conclusions and recommendations \nof the visiting mission; \n \n13. Commends the conclusions and recommendations of the visiting mission \nto the Government of the United Kingdom of Great Britain and Northern Ireland, as \nthe administering Power, and to the Government of Montserrat for appropriate action; \n \n14. Requests the administering Power to report to the Secretary-General on \nthe steps taken and progress made with regard to the recommendations contained in \nthe report of the visiting mission; \n \n15. Reaffirms the responsibility of the administering Power under the Charter \nto promote the economic and social development and to preserve the cultural identity \nof the Territory, and requests the administering Power to take steps to enlist and make \neffective use of all possible assistance, on both a bilateral and a multilateral basis, in \nthe strengthening of the economy of the Territory; \n \n16. Takes into account the 2030 Agenda for Sustainable Development, 9 \nincluding the Sustainable Development Goals, stresses the importance of fostering \nthe economic and social sustainable development of the Territory by promoting \nsustained, inclusive and equitable economic growth, creating greater opportunities for \nall, reducing inequalities, raising basic standards of living, fostering equitable social \ndevelopment and inclusion and promoting the integrated and sustainable management \nof natural resources and ecosystems that supports, inter alia, economic, social and \nhuman development, while facilitating ecosystem conservation, regeneration, \nrestoration and resilience in the face of new and emerging challenges, and strongly \nurges the administering Power to refrain from undertaking any kind of illicit, harmful \nand unproductive activities, including the use of the Territory as an international \nfinancial centre, that are not aligned with the interest of the people of the Territory; \n \n17. Requests the Territory and the administering Power to take all measures \nnecessary to protect and conserve the environment of the Territory against any \ndegradation, and once again requests the specialized agencies concerned to monitor \n__________________ \n \n9  Resolution 70/1. \n\nA/RES/76/97 \nQuestion of Montserrat\n \n21-18700\n6/6 \n \nenvironmental conditions in the Territory and to provide assistance to the Territory, \nconsistent with their prevailing rules of procedure; \n \n18. Requests the Special Committee to continue to examine the question of \nMontserrat and to report thereon to the General Assembly at its seventy-seventh \nsession and on the implementation of the present resolution. \n \n49th plenary meeting \n9 December 2021 \n \n",
  "paragraphs": {
    "1": "Reaffirms the inalienable right of the people of Montserrat to self- determination, in conformity with the Charter of the United Nations and with General Assembly resolution 1514 (XV), containing the Declaration on the Granting of Independence to Colonial Countries and Peoples;",
    "2": "Also reaffirms that, in the process of decolonization of Montserrat, there is no alternative to the principle of self-determination, which is also a fundamental human right, as recognized under the relevant human rights conventions;",
    "3": "Further reaffirms that it is ultimately for the people of Montserrat to determine freely their future political status in accordance with the relevant provisions of the Charter, the Declaration and the relevant resolutions of the General Assembly, and in that connection calls upon the administering Power, in cooperation with the territorial Government and appropriate bodies of the United Nations system, to develop political education programmes for the Territory in order to foster an awareness among the people of their right to self-determination in conformity with the legitimate political status options, based on the principles clearly defined in Assembly resolution 1541 (XV) and other relevant resolutions and decisions;",
    "4": "Recalls the 2010 Constitution of Montserrat and the work of the territorial Government with respect to moving forward to consolidate the gains provided for in the Constitution;",
    "5": "Requests the administering Power to assist the Territory by facilitating its work concerning public educational outreach efforts, consistent with Article 73 b of the Charter, and in that regard calls upon the relevant United Nations organizations to provide assistance to the Territory, if requested;",
    "6": "Welcomes the participation of the Territory in the work of the Organisation of Eastern Caribbean States and the Economic Commission for Latin America and the Caribbean;",
    "7": "Stresses that the Territory should continue to participate in the activities of the Special Committee on the Situation with regard to the Implementation of the Declaration on the Granting of Independence to Colonial Countries and Peoples, __________________ 7 See A/AC.109/2020/10, para. 3. 8 A/AC.109/2020/20. Question of Montserrat A/RES/76/97 5/6 21-18700 including regional seminars, in order to provide the Committee with up-to-date information regarding the decolonization process;",
    "8": "Calls upon the administering Power, the specialized agencies and other organizations of the United Nations system, as well as regional and other organizations, to continue to provide assistance to the Territory in alleviating the consequences of the volcanic eruption;",
    "9": "Stresses the importance of the Special Committee being apprised of the views and wishes of the people of Montserrat and enhancing its understanding of their conditions, including the nature and scope of the existing political and constitutional arrangements between Montserrat and the administering Power;",
    "10": "Calls upon the administering Power to participate in and cooperate fully with the work of the Special Committee in order to implement the provisions of Article 73 e of the Charter and the Declaration and in order to advise the Committee on the implementation of the provisions under Article 73 b of the Charter on efforts to promote self-government in Montserrat, and encourages the administering Power to facilitate visiting and special missions to the Territory;",
    "11": "Expresses its appreciation to the administering Power and to the Government and people of Montserrat for the cooperation and assistance extended to the United Nations visiting mission to Montserrat in December 2019;",
    "12": "Reiterates its endorsement of the report, conclusions and recommendations of the visiting mission;",
    "13": "Commends the conclusions and recommendations of the visiting mission to the Government of the United Kingdom of Great Britain and Northern Ireland, as the administering Power, and to the Government of Montserrat for appropriate action;",
    "14": "Requests the administering Power to report to the Secretary-General on the steps taken and progress made with regard to the recommendations contained in the report of the visiting mission;",
    "15": "Reaffirms the responsibility of the administering Power under the Charter to promote the economic and social development and to preserve the cultural identity of the Territory, and requests the administering Power to take steps to enlist and make effective use of all possible assistance, on both a bilateral and a multilateral basis, in the strengthening of the economy of the Territory;",
    "16": "Takes into account the 2030 Agenda for Sustainable Development, 9 including the Sustainable Development Goals, stresses the importance of fostering the economic and social sustainable development of the Territory by promoting sustained, inclusive and equitable economic growth, creating greater opportunities for all, reducing inequalities, raising basic standards of living, fostering equitable social development and inclusion and promoting the integrated and sustainable management of natural resources and ecosystems that supports, inter alia, economic, social and human development, while facilitating ecosystem conservation, regeneration, restoration and resilience in the face of new and emerging challenges, and strongly urges the administering Power to refrain from undertaking any kind of illicit, harmful and unproductive activities, including the use of the Territory as an international financial centre, that are not aligned with the interest of the people of the Territory;",
    "17": "Requests the Territory and the administering Power to take all measures necessary to protect and conserve the environment of the Territory against any degradation, and once again requests the specialized agencies concerned to monitor __________________ 9 Resolution 70/1. A/RES/76/97 Question of Montserrat 21-18700 6/6 environmental conditions in the Territory and to provide assistance to the Territory, consistent with their prevailing rules of procedure;",
    "18": "Requests the Special Committee to continue to examine the question of Montserrat and to report thereon to the General Assembly at its seventy-seventh session and on the implementation of the present resolution. 49th plenary meeting 9 December 2021"
  },
  "agenda_items": [
    "Item 63"
  ],
  "symbol_references": []
}