{
  "symbol": "A/RES/75/249",
  "filename": "A_RES_75_249.pdf",
  "title": "75/249. Financing of the International Residual Mechanism for Criminal Tribunals",
  "text": "United Nations \nA/RES/75/249\n \n \nGeneral Assembly \nDistr.: General \n8 January 2021 \n \n21-00057 (E)    110121  \n*2100057* \n \n \nSeventy-fifth session \nAgenda item 153 \nFinancing of the International Residual Mechanism for \nCriminal Tribunals \n \n \n \n \n Resolution adopted by the General Assembly \non 31 December 2020 \n \n \n \n \n[on the report of the Fifth Committee (A/75/680, para. 6)] \n \n \n 75/249. Financing of the International Residual Mechanism for \nCriminal Tribunals \n \n \n \nThe General Assembly, \n \nHaving considered the reports of the Secretary-General on the proposed budget \nfor the International Residual Mechanism for Criminal Tribunals for 2021 1 and on the \nrevised estimates arising from the effect of changes in rates of exchange and \ninflation,2 the financial report and audited financial statements for the year ended \n31 December 2019 and the report of the Board of Auditors on the International \nResidual Mechanism for Criminal Tribunals3 and the recommendations contained \ntherein, as well as the related reports of the Advisory Committee on Administrative \nand Budgetary Questions,4 \n \nRecalling its resolution 66/240 A of 24 December 2011 on the financing of the \nInternational Residual Mechanism for Criminal Tribunals and its subsequent \nresolutions thereon, the latest of which was resolution 74/259 of 27 December 2019, \n \n1. \nTakes note of the reports of the Secretary-General on the proposed budget \nof the International Residual Mechanism for Criminal Tribunals for 2021 and on the \nrevised estimates arising from the effect of changes in rates of exchange and inflation;  \n \n2. \nEndorses the conclusions and recommendations contained in the reports \nof the Advisory Committee, subject to the provisions of the present resolution;   \n__________________ \n \n1  A/75/383.   \n \n2  A/75/639. \n \n3  Official Records of the General Assembly, Seventy-fifth Session, Supplement No. 5O \n(A/75/5/Add.15).  \n \n4  A/75/632 and A/75/647.   \n\nA/RES/75/249 \nFinancing of the International Residual Mechanism for \nCriminal Tribunals\n \n21-00057\n2/3 \n \n \n3. \nRequests the Secretary-General to ensure that the Mechanism makes every \neffort to promptly complete its remaining work and to report on concrete measures \nundertaken in this regard in the next budget proposal; \n \n4. \nAlso requests the Secretary-General to undertake a comprehensive review \nof post and non-post resources, including requirements for general temporary \nassistance positions, across the Mechanism, and to reflect such findings in the context \nof the next budget submission;  \n \n5. \nFurther requests the Secretary-General to continue his efforts to promote \nthe nationalization of positions, as appropriate, and to report thereon in the context of \nhis next budget proposal;  \n \n6. \nRequests the Secretary-General to ensure that the Mechanism undertakes \nall efforts necessary to expedite the conclusion of its remaining work, including by \nmaking greater use of the lessons learned;  \n \n7. \nUrges the Mechanism to undertake all efforts necessary to improve its \ntravel planning procedures, including compliance with the advance purchase policy \ndirective;  \n \n8. \nEncourages the Secretary-General to consider possible options to foster \nthe usage of virtual meetings and online training tools within the Mechanism, as \nappropriate;  \n \n9. \nEmphasizes the importance of the Mechanism strictly abiding by its statute \nand applicable established administrative procedures, the Financial Regulations and \nRules of the United Nations5 and the Staff Regulations and Rules of the United \nNations;6 \n \n10. Approves the establishment of one general temporary assistance position \nwithin existing resources; \n \n11. \nDecides to appropriate to the special account for the International Residual \nMechanism for Criminal Tribunals a total amount of 97,519,900 United States dollars \ngross (88,431,800 dollars net) for 2021, as detailed in the annex to the present \nresolution; \n \n12. Also decides that the total assessment for 2021 under the special account \namounting to 87,435,236 dollars shall consist of:  \n \n(a) \n97,519,900 dollars, being the estimated appropriation approved for the \nperiod; \n \n(b) \nLess 6,818,000 dollars, being the credit of the cancellation of prior period \nobligations corresponding to the biennium 2016\u20132017; \n \n(c) \nLess 3,266,664 dollars, being the surplus resulting from the final \nexpenditure for the budget for the biennium 2018\u20132019; \n \n13. Further decides to apportion the amount of 43,717,618 dollars gross \n(40,208,842 dollars net) among Member States in accordance with the scale of \nassessments applicable to the regular budget of the United Nations for 2021; \n \n14. Decides to apportion the amount of 43,717,618 dollars gross (40,208,842 \ndollars net) among Member States in accordance with the scale of assessments \napplicable to peacekeeping operations of the United Nations for 2021;  \n__________________ \n \n5  ST/SGB/2013/4 and ST/SGB/2013/4/Amend.1. \n \n6  ST/SGB/2018/1. \n\nFinancing of the International Residual Mechanism for  \nCriminal Tribunals \n \n3/3\n21-00057 \n \n \n15. Also decides that, in accordance with the provisions of its resolution \n973 (X) of 15 December 1955, there shall be set off against the apportionment among \nMember States, as provided for in paragraphs 13 and 14 above, their respective share \nin the Tax Equalization Fund of the estimated staff assessment income in the amount \nof 7,017,552 dollars approved for the Mechanism for 2021. \n \n48th (resumed) plenary meeting \n31 December 2020 \n \n \nAnnex \n \n \n Financing of the International Residual Mechanism for Criminal \nTribunals for 2021 \n \n \nGross \nNet of staff \nassessment \n(United States dollars) \nEstimated appropriation for 2021a \n97 194 000 \n88 029 600 \nRevised estimates: effect of changes in rates of exchange and inflation b \n5 471 700 \n4 977 600 \nRecommendations of the Advisory Committee on Administrative and \nBudgetary Questionsc \n (5 145 800) \n (4 575 400) \nRecommendations of the Fifth Committee \n\u2013 \n\u2013 \nEstimated initial appropriation for 2021 \n97 519 900 \n88 431 800 \nTotal assessment for 2021 \n \n \nRequirements for 2021 \n97 519 900 \n88 431 800 \nCancellation of commitments for the biennium 2016\u20132017  \n (6 818 000) \n (6 818 000) \nSurplus resulting from the final expenditure for the budget for the biennium \n2018\u20132019 \n (3 266 664) \n (1 196 116) \nNet contributions assessed on Member States for 2021 \n87 435 236 \n80 417 684 \nOf which: \n \n \nContributions assessed on Member States in accordance with the scale of \nassessments applicable to the regular budget of the United Nations for 2021 \n43 717 618 \n40 208 842 \nContributions assessed on Member States in accordance with the scale of \nassessments applicable to peacekeeping operations of the United Nations for \n2021 \n43 717 618 \n40 208 842 \n \n \na See A/75/383. \n \nb See A/75/639. \n \nc Reflects amounts after recosting. \n \n",
  "paragraphs": {
    "1": "Takes note of the reports of the Secretary-General on the proposed budget of the International Residual Mechanism for Criminal Tribunals for 2021 and on the revised estimates arising from the effect of changes in rates of exchange and inflation;",
    "2": "Endorses the conclusions and recommendations contained in the reports of the Advisory Committee, subject to the provisions of the present resolution; __________________ 1 A/75/383. 2 A/75/639. 3 Official Records of the General Assembly, Seventy-fifth Session, Supplement No. 5O (A/75/5/Add.15). 4 A/75/632 and A/75/647. A/RES/75/249 Financing of the International Residual Mechanism for Criminal Tribunals 21-00057 2/3",
    "3": "Requests the Secretary-General to ensure that the Mechanism makes every effort to promptly complete its remaining work and to report on concrete measures undertaken in this regard in the next budget proposal;",
    "4": "Also requests the Secretary-General to undertake a comprehensive review of post and non-post resources, including requirements for general temporary assistance positions, across the Mechanism, and to reflect such findings in the context of the next budget submission;",
    "5": "Further requests the Secretary-General to continue his efforts to promote the nationalization of positions, as appropriate, and to report thereon in the context of his next budget proposal;",
    "6": "Requests the Secretary-General to ensure that the Mechanism undertakes all efforts necessary to expedite the conclusion of its remaining work, including by making greater use of the lessons learned;",
    "7": "Urges the Mechanism to undertake all efforts necessary to improve its travel planning procedures, including compliance with the advance purchase policy directive;",
    "8": "Encourages the Secretary-General to consider possible options to foster the usage of virtual meetings and online training tools within the Mechanism, as appropriate;",
    "9": "Emphasizes the importance of the Mechanism strictly abiding by its statute and applicable established administrative procedures, the Financial Regulations and Rules of the United Nations5 and the Staff Regulations and Rules of the United Nations;6",
    "10": "Approves the establishment of one general temporary assistance position within existing resources;",
    "11": "Decides to appropriate to the special account for the International Residual Mechanism for Criminal Tribunals a total amount of 97,519,900 United States dollars gross (88,431,800 dollars net) for 2021, as detailed in the annex to the present resolution;",
    "12": "Also decides that the total assessment for 2021 under the special account amounting to 87,435,236 dollars shall consist of: (a) 97,519,900 dollars, being the estimated appropriation approved for the period; (b) Less 6,818,000 dollars, being the credit of the cancellation of prior period obligations corresponding to the biennium 2016\u20132017; (c) Less 3,266,664 dollars, being the surplus resulting from the final expenditure for the budget for the biennium 2018\u20132019;",
    "13": "Further decides to apportion the amount of 43,717,618 dollars gross (40,208,842 dollars net) among Member States in accordance with the scale of assessments applicable to the regular budget of the United Nations for 2021;",
    "14": "Decides to apportion the amount of 43,717,618 dollars gross (40,208,842 dollars net) among Member States in accordance with the scale of assessments applicable to peacekeeping operations of the United Nations for 2021; __________________ 5 ST/SGB/2013/4 and ST/SGB/2013/4/Amend.1. 6 ST/SGB/2018/1. Financing of the International Residual Mechanism for Criminal Tribunals 3/3 21-00057",
    "15": "Also decides that, in accordance with the provisions of its resolution 973 (X) of 15 December 1955, there shall be set off against the apportionment among Member States, as provided for in paragraphs 13 and 14 above, their respective share in the Tax Equalization Fund of the estimated staff assessment income in the amount of 7,017,552 dollars approved for the Mechanism for 2021. 48th (resumed) plenary meeting 31 December 2020 Annex Financing of the International Residual Mechanism for Criminal Tribunals for 2021 Gross Net of staff assessment (United States dollars) Estimated appropriation for 2021a 97 194 000 88 029 600 Revised estimates: effect of changes in rates of exchange and inflation b 5 471 700 4 977 600 Recommendations of the Advisory Committee on Administrative and Budgetary Questionsc (5 145 800) (4 575 400) Recommendations of the Fifth Committee \u2013 \u2013 Estimated initial appropriation for 2021 97 519 900 88 431 800 Total assessment for 2021 Requirements for 2021 97 519 900 88 431 800 Cancellation of commitments for the biennium 2016\u20132017 (6 818 000) (6 818 000) Surplus resulting from the final expenditure for the budget for the biennium 2018\u20132019 (3 266 664) (1 196 116) Net contributions assessed on Member States for 2021 87 435 236 80 417 684 Of which: Contributions assessed on Member States in accordance with the scale of assessments applicable to the regular budget of the United Nations for 2021 43 717 618 40 208 842 Contributions assessed on Member States in accordance with the scale of assessments applicable to peacekeeping operations of the United Nations for 2021 43 717 618 40 208 842 a See A/75/383. b See A/75/639. c Reflects amounts after recosting."
  },
  "agenda_items": [
    "Item 153"
  ],
  "symbol_references": []
}