{
  "symbol": "A/RES/79/143",
  "filename": "A_RES_79_143.pdf",
  "title": "79/143. International Day of the Snow Leopard",
  "text": "United Nations \nA/RES/79/143\n \nGeneral Assembly \nDistr.: General \n16 December 2024 \n24-23831 (E) \n*2423831* \n \n \nSeventy-ninth session \nAgenda item 13 \nIntegrated and coordinated implementation of and follow-up \nto the outcomes of the major United Nations conferences and \nsummits in the economic, social and related fields \n \n \n \n \n Resolution adopted by the General Assembly \non 12 December 2024 \n \n \n[without reference to a Main Committee (A/79/L.40)] \n \n \n 79/143. International Day of the Snow Leopard \n \n \n \nThe General Assembly, \n \nReaffirming its resolution 70/1 of 25 September 2015, entitled \u201cTransforming \nour world: the 2030 Agenda for Sustainable Development\u201d, by which it adopted a \ncomprehensive, far-reaching and people-centred set of universal and transformative \nSustainable Development Goals and targets,  \n \nReaffirming also its resolutions 53/199 of 15 December 1998 and 61/185 of \n20 December 2006 on the proclamation of international years, and Economic and \nSocial Council resolution 1980/67 of 25 July 1980 on international years and \nanniversaries, in particular paragraphs 1 to 10 of the annex thereto on the agreed \ncriteria for the proclamation of international years, as well as paragraphs 13 and 14, \nin which it is stated that an international day or year should not be proclaimed before \nthe basic arrangements for its organization and financing have been made,  \n \nReaffirming further the intrinsic value of wildlife and its various contributions, \nincluding its ecological, genetic, social, economic, scientific, educational, cultural, \nrecreational and aesthetic contributions to sustainable development and human well-\nbeing, and recognizing that wild fauna in their many beautiful and varied forms are \nan irreplaceable part of the natural systems of the Earth which must be protected for \nthis generation and the generations to come,  \n \nStressing the urgent need to address the unprecedented global decline in \nbiodiversity, including by preventing the extinction of threatened species, improving \nand sustaining their conservation status and restoring and safeguarding ecosystems \nthat provide essential functions and services, including services related to water, \nhealth, livelihoods and well-being,  \n\nA/RES/79/143 \nInternational Day of the Snow Leopard\n \n24-23831\n2/3 \n \n \nUnderlining that the snow leopard (Panthera uncia) is found in high mountain \nregions of Asia, and that mountain ecosystems play a crucial role in providing water \nand other essential resources and services to a large portion of the world\u2019s population, \n \nAcknowledging that the snow leopard has been listed in appendix I to the \nConvention on International Trade in Endangered Species of Wild Fauna and Flora 1 \nsince 1975, and on appendix I to the Convention on the Conservation of Migratory \nSpecies of Wild Animals2 since 1986,  \n \nRecognizing that the snow leopard\u2019s population was classified as \u201cvulnerable\u201d \non the International Union for Conservation of Nature Red List of Threatened Species \nin 2017 and facing a high risk of extinction in the wild in the medium-term future, \n \nUnderlining that the snow leopard (Panthera uncia) is an iconic and \necologically significant species found across the mountainous regions, including in \nAfghanistan, Bhutan, China, India, Kazakhstan, Kyrgyzstan, Mongolia, Nepal, \nPakistan, the Russian Federation, Tajikistan and Uzbekistan, \n \nTaking note with appreciation of regional initiatives for range State cooperation, \ntransboundary approaches and outcomes of multi-partner initiatives, conventions and \nmechanisms at the regional level, including Saudi Arabia and Panthera\u2019s Arabian \nLeopard Initiative, the Global Snow Leopard and Ecosystem Protection Programme, \nthe Strategy for Snow Leopard Conservation in the Russian Federation, the Snow \nLeopard Conservation Action Plan 2024\u20132030 and Snow Leopard and Ecosystem \nManagement Plan 2017\u20132026 of Nepal, the Snow Leopard Conservation Action Plan \n2024\u20132034 of Bhutan, a climate-integrated landscape approach to snow leopard \nconservation, the Snow Leopard and Ecosystem Protection Programme of Pakistan, \nthe Bishkek Declaration of 2017 entitled \u201cCaring for snow leopards and mountains: \nour ecological future\u201d, signed by 12 snow leopard range countries, including all five \nCentral Asian countries, the Samarkand Resolution of 2024 for snow leopard \nconservation and climate adaptation, adopted at the eighth Steering Committee \nMeeting of the Global Snow Leopard and Ecosystem Protection Programme, the \nMemorandum of Understanding on the Conservation of the Snow Leopard and its \nEcosystems in the Western Tien Shan and Pamir-Alai, signed by Kazakhstan, \nKyrgyzstan, Tajikistan and Uzbekistan, the initiative of India to create the \nInternational Big Cat Alliance, the Jaguar 2030 road map, the North-East Asian \nSubregional Programme for Environmental Cooperation Nature Conservation \nStrategy on conservation of flagship species that include the amur tiger, the amur \nleopard and the snow leopard, and the International Tiger Forum, \n \nRecognizing that the greatest threats to the survival of the snow leopard are \nhabitat loss and fragmentation, prey depletion and illicit trafficking, illegal hunting, \nincluding poaching, and climate change,  \n \nRecalling its resolution 78/155 of 19 December 2023, entitled \u201cImplementation \nof the Convention on Biological Diversity and its contribution to sustainable \ndevelopment\u201d, which calls upon parties to the Convention and stakeholders to \nstrengthen international cooperation measures for the fulfilment of obligations \ncontained in the Convention,  \n \nWelcoming the sixteenth meeting of the Conference of the Parties to the \nConvention on Biological Diversity,  \n \nRecognizing the efforts towards safeguarding the snow leopard, including the \nestablishment of breeding programmes and the development of a regional strategy \n_______________ \n \n1 United Nations, Treaty Series, vol. 993, No. 14537. \n \n2 Ibid., vol. 1651, No. 28395. \n\nInternational Day of the Snow Leopard \nA/RES/79/143\n \n3/3\n24-23831 \n \nand national action plans for the conservation of the snow leopard in some range \nStates that aim to safeguard the survival of the snow leopard throughout its range,  \n \nNoting the fourteenth meeting of the Conference of the Parties to the Convention \non Migratory Species, and looking forward to the timely implementation of the \nSamarkand Strategic Plan for Migratory Species 2024\u20132032, which underlines \npriorities for the conservation and sustainable management of migratory species and \ntheir habitats as well as the importance of ecological connectivity,  \n \n1. \nDecides to proclaim 23 October International Day of the Snow Leopard; \n \n2. \nInvites all Member States, organizations of the United Nations system, \nother international and regional organizations, civil society, non\u2011governmental \norganizations, individuals and other relevant stakeholders to observe the International \nDay of the Snow Leopard, as appropriate;  \n \n3. \nInvites all relevant stakeholders to give due consideration to enhancing \ninternational and regional cooperation in support of efforts to conserve the snow \nleopard, given its role in the overall ecosystem;  \n \n4. \nInvites the United Nations Environment Programme to facilitate the \nobservance of the International Day of the Snow Leopard, mindful of the provisions \ncontained in the annex to Economic and Social Council resolution 1980/67;  \n \n5. \nStresses that the cost of all activities that may arise from the \nimplementation of the present resolution should be met from voluntary contributions \nand that such activities would be subject to the availability and provision of voluntary \ncontributions;  \n \n6. \nRequests the Secretary-General to bring the present resolution to the \nattention of all Member States, the organizations of the United Nations system and \ncivil society organizations for appropriate observance. \n \n52nd plenary meeting \n12 December 2024 \n \n",
  "paragraphs": {
    "1": "Decides to proclaim 23 October International Day of the Snow Leopard;",
    "2": "Invites all Member States, organizations of the United Nations system, other international and regional organizations, civil society, non\u2011governmental organizations, individuals and other relevant stakeholders to observe the International Day of the Snow Leopard, as appropriate;",
    "3": "Invites all relevant stakeholders to give due consideration to enhancing international and regional cooperation in support of efforts to conserve the snow leopard, given its role in the overall ecosystem;",
    "4": "Invites the United Nations Environment Programme to facilitate the observance of the International Day of the Snow Leopard, mindful of the provisions contained in the annex to Economic and Social Council resolution 1980/67;",
    "5": "Stresses that the cost of all activities that may arise from the implementation of the present resolution should be met from voluntary contributions and that such activities would be subject to the availability and provision of voluntary contributions;",
    "6": "Requests the Secretary-General to bring the present resolution to the attention of all Member States, the organizations of the United Nations system and civil society organizations for appropriate observance."
  },
  "agenda_items": [
    "Item 13"
  ],
  "symbol_references": [
    "A/79/L.40"
  ]
}