{
  "symbol": "A/RES/73/70",
  "filename": "A_RES_73_70.pdf",
  "title": "73/70. Towards a nuclear-weapon-free world: accelerating the implementation of nuclear disarmament commitments",
  "text": "United Nations \nA/RES/73/70\n \n \nGeneral Assembly \nDistr.: General \n13 December 2018 \n \n18-21279 (E)    171218 \n*1821279* \n \n \nSeventy-third session \nAgenda item 101 (r) \n \n \n \n \n Resolution adopted by the General Assembly \non 5 December 2018 \n \n \n \n \n[on the report of the First Committee (A/73/510 and A/73/510/Corr.1)] \n \n \n \n73/70. Towards a nuclear-weapon-free world: accelerating the \nimplementation of nuclear disarmament commitments \n \n \n \nThe General Assembly,  \n \nRecalling its resolutions 1 (I) of 24 January 1946, 71/54 of 5 December 2016 \nand 72/39 of 4 December 2017,  \n \nNoting the twentieth anniversary of the launch of the New Agenda Coalition and \nthe joint declaration outlining a new agenda for disarmament, adopted in Dublin on \n9 June 1998,1 \n \nRecalling its resolution 72/243 of 22 December 2017, in which it decided to \nhold a high-level plenary meeting in 2018, the Nelson Mandela Peace Summit, in \nhonour of the centenary of the birth of Nelson Mandela, welcoming the political \ndeclaration adopted by the Summit on 24 September 2018,2 in which it recalled the \nfirm plea made by Nelson Mandela in favour of the total elimination of nuclear \nweapons, and underscoring commitments towards that goal, \n \nWelcoming the launch of the Secretary-General\u2019s disarmament agenda, Securing \nOur Common Future: An Agenda for Disarmament, in Geneva on 24 May 2018, \n \nReiterating its grave concern at the danger to humanity posed by nuclear \nweapons, which should inform all deliberations, decisions and actions relating to \nnuclear disarmament and nuclear non-proliferation, \n \nRecalling the expression of deep concern by the 2010 Review Conference of \nthe Parties to the Treaty on the Non-Proliferation of Nuclear Weapons at the \ncatastrophic humanitarian consequences of any use of nuclear weapons, and its \n__________________ \n \n1  A/53/138, annex. \n \n2  Resolution 73/1. \n\nA/RES/73/70 \nTowards a nuclear-weapon-free world: accelerating the\nimplementation of nuclear disarmament commitments\n \n18-21279\n2/7 \n \nresolve to seek a safer world for all and to achieve the peace and security of a world \nwithout nuclear weapons,3  \n \nNoting with satisfaction the renewed attention to the catastrophic humanitarian \nconsequences and risks associated with nuclear weapons that has been generated by \nthe international community since 2010 and the growing awareness that these \nconcerns should underpin the need for nuclear disarmament and the urgency of \nachieving and maintaining a nuclear-weapon-free world, and noting with satisfaction \nalso the prominence accorded to the humanitarian impact of nuclear weapons in \nmultilateral disarmament forums,  \n \nRecalling the discussions held at the Conferences on the Humanitarian Impact \nof Nuclear Weapons, hosted by Norway, on 4 and 5 March 2013, Mexico, on 13 and \n14 February 2014, and Austria, on 8 and 9 December 2014, aimed at understanding \nand developing a greater awareness of the catastrophic consequences of nuclear \nweapon detonations which further reinforce the urgency of nuclear disarmament,  \n \nEmphasizing the compelling evidence, including that presented at the \nConferences on the Humanitarian Impact of Nuclear Weapons, that has detailed the \ncatastrophic consequences that would result from a nuclear weapon detonation, \nreaching well beyond national borders and also imperilling the achievement of the \nSustainable Development Goals, 4 the lack of capacity of States and international \norganizations to deal with the aftermath and the risk of an occurrence, due to an \naccident, systems failure or human error,  \n \nNoting the strongly disproportionate and gendered impact of exposure to \nionizing radiation for women and girls,  \n \nWelcoming the commemoration and promotion of 26 September as the \nInternational Day for the Total Elimination of Nuclear Weapons,  \n \nWelcoming also the adoption on 7 July 2017 of the Treaty on the Prohibition of \nNuclear Weapons, negotiated by the United Nations conference to negotiate a legally \nbinding instrument to prohibit nuclear weapons, leading towards their total \nelimination, pursuant to resolution 71/258 of 23 December 2016,5  \n \nUnderlining the importance of nuclear disarmament and non-proliferation \neducation,  \n \nReaffirming that transparency, verifiability and irreversibility are cardinal \nprinciples applying to nuclear disarmament and nuclear non-proliferation, which are \nmutually reinforcing processes,  \n \nRecalling the decisions and the resolution adopted at the 1995 Review and \nExtension Conference of the Parties to the Treaty on the Non-Proliferation of Nuclear \nWeapons,6 the basis upon which the Treaty was indefinitely extended, and the Final \nDocuments of the 2000 7 and the 2010 8 Review Conferences of the Parties to the \n__________________ \n \n3  See 2010 Review Conference of the Parties to the Treaty on the Non-Proliferation of Nuclear \nWeapons, Final Document, vol. I (NPT/CONF.2010/50 (Vol. I)), part I, Conclusions and \nrecommendations for follow-on actions. \n \n4  See resolution 70/1. \n \n5  A/CONF.229/2017/8. \n \n6  See 1995 Review and Extension Conference of the Parties to the Treaty on the Non-Proliferation \nof Nuclear Weapons, Final Document, Part I (NPT/CONF.1995/32 (Part I) and \nNPT/CONF.1995/32 (Part I)/Corr.2), annex. \n \n7  2000 Review Conference of the Parties to the Treaty on the Non-Proliferation of Nuclear \nWeapons, Final Document, vols. I\u2013III (NPT/CONF.2000/28 (Parts I and II), \nNPT/CONF.2000/28 (Part III) and NPT/CONF.2000/28 (Part IV)). \n \n8  2010 Review Conference of the Parties to the Treaty on the Non-Proliferation of Nuclear \nWeapons, Final Document, vols. I\u2013III (NPT/CONF.2010/50 (Vol. I), \nNPT/CONF.2010/50 (Vol. II), and NPT/CONF.2010/50 (Vol. III)). \n\nTowards a nuclear-weapon-free world: accelerating the \nimplementation of nuclear disarmament commitments \nA/RES/73/70\n \n3/7\n18-21279 \n \nTreaty on the Non-Proliferation of Nuclear Weapons, and in particular the \nunequivocal undertaking by the nuclear-weapon States to accomplish the total \nelimination of their nuclear arsenals, leading to nuclear disarmament, in accordance \nwith commitments made under article VI of the Treaty on the Non-Proliferation of \nNuclear Weapons,9  \n \nReaffirming the commitment of all States parties to the Treaty on the \nNon-Proliferation of Nuclear Weapons to applying the principles of irreversibility, \nverifiability and transparency in relation to the implementation of their treaty \nobligations,  \n \nRecognizing the continued vital importance of the entry into force of the \nComprehensive Nuclear-Test-Ban Treaty\n10  to the advancement of nuclear \ndisarmament and nuclear non-proliferation objectives,  \n \nRecalling that the total elimination of nuclear weapons is the only absolute \nguarantee against the use or threat of use of nuclear weapons and the legitimate \ninterest of non-nuclear-weapon States in receiving unequivocal and legally binding \nnegative security assurances from nuclear-weapon States pending the total \nelimination of nuclear weapons,  \n \nReaffirming the conviction that, pending the total elimination of nuclear \nweapons, the establishment and maintenance of nuclear-weapon-free zones enhances \nglobal and regional peace and security, strengthens the nuclear non-proliferation \nregime and contributes towards realizing the objectives of nuclear disarmament, and \nwelcoming the Conferences of States Parties and Signatories to Treaties that Establish \nNuclear-Weapon-Free Zones and Mongolia,  \n \nUrging States to continue to make real progress towards strengthening all \nexisting nuclear-weapon-free zones, inter alia, through the ratification of existing \ntreaties and relevant protocols and the withdrawal or revision of any reservations or \ninterpretative declarations contrary to the object and purpose of the treaties \nestablishing such zones,  \n \nRecalling the encouragement expressed at the 2010 Review Conference for the \nestablishment of further nuclear-weapon-free zones, on the basis of arrangements \nfreely arrived at among the States of the region concerned, reaffirming the expectation \nthat this will be followed by concerted international efforts to create such zones in \nareas where they do not currently exist, especially in the Middle East, in this context \nnoting with deep disappointment the non-fulfilment of the agreement at the 2010 \nReview Conference on practical steps to fully implement the 1995 resolution on the \nMiddle East,6 and disappointed that no agreement could be reached at the 2015 \nReview Conference of the Parties to the Treaty on the Non-Proliferation of Nuclear \nWeapons on this issue,  \n \nDeeply disappointed at the continued absence of progress towards multilateral \nnuclear disarmament at the Conference on Disarmament, which has been unable for \nthe past 22 years to agree upon and implement a programme of work, and \ndisappointed that the Disarmament Commission has not produced a substantive \noutcome on nuclear disarmament since 1999,  \n \nDeeply regretting the lack of any substantive outcome of the 2015 Review \nConference,  \n__________________ \n \n9  United Nations, Treaty Series, vol. 729, No. 10485. \n \n10  See resolution 50/245 and A/50/1027. \n\nA/RES/73/70 \nTowards a nuclear-weapon-free world: accelerating the\nimplementation of nuclear disarmament commitments\n \n18-21279\n4/7 \n \n \nDisappointed that the 2015 Review Conference missed an opportunity to \nstrengthen the Treaty on the Non-Proliferation of Nuclear Weapons, enhance progress \ntowards its full implementation and universality and monitor the implementation of \ncommitments made and actions agreed upon at the 1995, 2000 and 2010 Review \nConferences, and deeply concerned about the impact of this failure on the Treaty and \nthe balance between its three pillars,  \n \nNoting with concern the rising tensions in international relations and the \nincreased prominence being given by some States to nuclear weapons in their security \ndoctrines, including through modernization programmes, \n \nNoting the second session of the Preparatory Committee for the 2020 Review \nConference of the Parties to the Treaty on the Non-Proliferation of Nuclear Weapons, \nheld in Geneva from 23 April to 4 May 2018,  \n \nEmphasizing the importance of a constructive and successful preparatory \nprocess leading to the 2020 Review Conference, and urging all Member States to step \nup their efforts in this regard, and emphasizing also that it should contribute to \nstrengthening the Treaty and making progress towards achieving its full \nimplementation and universality, and monitor the implementation of commitments \nmade and actions agreed upon at the 1995, 2000 and 2010 Review Conferences, \n \nWelcoming that the Russian Federation and the United States of America have \ncompleted the nuclear weapon reductions agreed under the new strategic arms \nreduction treaty, while re-emphasizing the encouragement of the 2010 Review \nConference to both States to continue discussions on follow-on measures in order to \nachieve deeper reductions in their nuclear arsenals,  \n \nUnderlining the importance of multilateralism in relation to nuclear \ndisarmament, while recognizing the value of unilateral, bilateral and regional \ninitiatives and the importance of compliance with the terms of these initiatives,  \n \n1. \nReiterates that each article of the Treaty on the Non-Proliferation of \nNuclear Weapons9 is binding on the States parties at all times and in all circumstances \nand that all States parties should be held fully accountable with respect to strict \ncompliance with their obligations under the Treaty, and calls upon all States parties \nto comply fully with all decisions, resolutions and commitments made at the 1995, \n2000 and 2010 Review Conferences;  \n \n2. \nAlso reiterates the deep concern expressed by the 2010 Review \nConference of the Parties to the Treaty on the Non-Proliferation of Nuclear Weapons \nat the catastrophic humanitarian consequences of any use of nuclear weapons, and the \nneed for all States at all times to comply with applicable international law, including \ninternational humanitarian law;3  \n \n3. \nAcknowledges the evidence presented at the Conferences on the \nHumanitarian Impact of Nuclear Weapons, and calls upon Member States, in their \nrelevant decisions and actions, to give due prominence to the humanitarian \nimperatives that underpin nuclear disarmament and to the urgency of achieving \nthis goal;  \n \n4. \nRecalls the reaffirmation of the continued validity of the practical steps \nagreed to in the Final Document of the 2000 Review Conference of the Parties to the \nTreaty on the Non-Proliferation of Nuclear Weapons, 11  including the specific \nreaffirmation of the unequivocal undertaking of the nuclear-weapon States to \n__________________ \n \n11  2000 Review Conference of the Parties to the Treaty on the Non-Proliferation of Nuclear \nWeapons, Final Document, vol. I (NPT/CONF.2000/28 (Parts I and II)), part I, section entitled \n\u201cArticle VI and eighth to twelfth preambular paragraphs\u201d, para. 15. \n\nTowards a nuclear-weapon-free world: accelerating the \nimplementation of nuclear disarmament commitments \nA/RES/73/70\n \n5/7\n18-21279 \n \naccomplish the total elimination of their nuclear arsenals leading to nuclear \ndisarmament, to which all States parties are committed under article VI of the Treaty, \nrecalls the commitment of the nuclear-weapon States to accelerating concrete \nprogress on the steps leading to nuclear disarmament, and calls upon the nuclear-\nweapon States to take all steps necessary to accelerate the fulfilment of their \ncommitments;  \n \n5. \nCalls upon the nuclear-weapon States to fulfil their commitment to \nundertaking further efforts to reduce and ultimately eliminate all types of nuclear \nweapons, deployed and non-deployed, including through unilateral, bilateral, regional \nand multilateral measures;  \n \n6. \nUrges all States possessing nuclear weapons to decrease the operational \nreadiness of nuclear-weapon systems in a verifiable and transparent manner with a \nview to ensuring that all nuclear weapons are removed from high alert status;  \n \n7. \nEncourages the nuclear-weapon States to make concrete reductions in the \nrole and significance of nuclear weapons in all military and security concepts, \ndoctrines and policies, pending their total elimination;  \n \n8. \nEncourages all States that are part of regional alliances that include \nnuclear-weapon States to diminish the role of nuclear weapons in their collective \nsecurity doctrines, pending their total elimination;  \n \n9. \nUnderlines the recognition by States parties to the Treaty on the \nNon-Proliferation of Nuclear Weapons of the legitimate interest of non-nuclear-\nweapon States in the constraining by the nuclear-weapon States of the development \nand qualitative improvement of nuclear weapons and their ending the development of \nadvanced new types of nuclear weapons, and calls upon the nuclear-weapon States to \ntake steps in this regard;  \n \n10. Notes with concern recent policy statements by nuclear-weapon States \nrelating to the modernization of their nuclear weapon programmes, which undermine \ntheir commitments to nuclear disarmament and increase the risk of the use of nuclear \nweapons and the potential for a new arms race; \n \n11. \nEncourages further steps by all nuclear-weapon States, in accordance with \nthe previous obligations and commitments on nuclear disarmament, to ensure the \nirreversible removal of all fissile material designated by each nuclear-weapon State \nas no longer required for military purposes, and calls upon all States to support, within \nthe context of the International Atomic Energy Agency, the development of \nappropriate nuclear disarmament verification capabilities and legally binding \nverification arrangements, thereby ensuring that such material remains permanently \noutside military programmes in a verifiable manner;  \n \n12. Calls upon all States parties to the Treaty on the Non-Proliferation of \nNuclear Weapons to work towards the full implementation of the resolution on the \nMiddle East adopted at the 1995 Review and Extension Conference of the Parties to \nthe Treaty on the Non-Proliferation of Nuclear Weapons,6 which is inextricably linked \nto the indefinite extension of the Treaty, and expresses disappointment and deep \nconcern at the lack of a substantive outcome of the 2015 Review Conference of the \nParties to the Treaty on the Non-Proliferation of Nuclear Weapons, including on the \nprocess to establish a Middle East zone free of nuclear weapons and all other weapons \nof mass destruction as contained in the 1995 resolution on the Middle East, which \nremains valid until fully implemented;  \n \n13. Urges the co-sponsors of the 1995 resolution on the Middle East to exert \ntheir utmost efforts with a view to ensuring the early establishment of a Middle East \nzone free of nuclear weapons and all other weapons of mass destruction as contained \n\nA/RES/73/70 \nTowards a nuclear-weapon-free world: accelerating the\nimplementation of nuclear disarmament commitments\n \n18-21279\n6/7 \n \nin the 1995 resolution on the Middle East, including through support for the \nconvening of the conference on the establishment of such a zone; \n \n14. Stresses the fundamental role of the Treaty on the Non-Proliferation of \nNuclear Weapons in achieving nuclear disarmament and nuclear non-proliferation, \nand looks forward to the third session of the Preparatory Committee for the 2020 \nReview Conference of the Parties to the Treaty on the Non-Proliferation of Nuclear \nWeapons, to be held in New York from 29 April to 10 May 2019;  \n \n15. Calls upon all States parties to spare no effort to achieve the universality \nof the Treaty on the Non-Proliferation of Nuclear Weapons, and in this regard urges \nIndia, Israel and Pakistan to accede to the Treaty as non-nuclear-weapon States \npromptly and without conditions, and to place all their nuclear facilities under \nInternational Atomic Energy Agency safeguards;  \n \n16. Notes with encouragement the dialogue and discussions held with the \nDemocratic People\u2019s Republic of Korea, including the recent inter-Korean summits, \nand the summit between the United States of America and the Democratic People\u2019s \nRepublic of Korea, urges the Democratic People\u2019s Republic of Korea to fulfil its \ncommitments, to abandon all nuclear weapons and existing nuclear programmes, to \nreturn, at an early date, to the Treaty on the Non-Proliferation of Nuclear Weapons \nand to adhere to its International Atomic Energy Agency safeguards agreement,12 with \na view to achieving the denuclearization of the Korean Peninsula in a peaceful \nmanner, and reaffirms its firm support for the Six-Party Talks;  \n \n17. Urges all States to work together to overcome obstacles within the \ninternational disarmament machinery that are inhibiting efforts to advance the cause \nof nuclear disarmament in a multilateral context, and once again urges the Conference \non Disarmament to commence immediately substantive work that advances the \nagenda of nuclear disarmament, particularly through multilateral negotiations;  \n \n18. Urges all States parties to the Treaty on the Non-Proliferation of Nuclear \nWeapons to fully implement without delay their obligations and commitments under \nthe Treaty and as agreed to at the 1995, 2000 and 2010 Review Conferences;  \n \n19. Also urges all State parties to the Treaty on the Non-Proliferation of \nNuclear Weapons to move forward with urgency in implementing their article VI \nobligations in order to ensure the good standing of the Treaty and its review process; \n \n20. Urges the nuclear-weapon States to implement their nuclear disarmament \nobligations and commitments, both qualitative and quantitative, in a manner that \nenables the States parties to regularly monitor progress, including through a standard \ndetailed reporting format, thereby enhancing confidence and trust not only among the \nnuclear-weapon States but also between the nuclear-weapon States and the \nnon-nuclear-weapon States and contributing to nuclear disarmament;  \n \n21. Also urges the nuclear-weapon States to include in their reports to be \nsubmitted during the 2020 review cycle of the Treaty on the Non-Proliferation of \nNuclear Weapons concrete and detailed information concerning the implementation \nof their obligations and commitments on nuclear disarmament; \n \n22. Encourages States parties to the Treaty on the Non-Proliferation of \nNuclear Weapons to improve the measurability of the implementation of nuclear \ndisarmament obligations and commitments, including through tools such as a set of \nbenchmarks or similar criteria, in order to ensure and facilitate the objective \nevaluation of progress;13  \n__________________ \n \n12  United Nations, Treaty Series, vol. 1677, No. 28986. \n \n13  See NPT/CONF.2020/PC.I/WP.13. \n\nTowards a nuclear-weapon-free world: accelerating the \nimplementation of nuclear disarmament commitments \nA/RES/73/70\n \n7/7\n18-21279 \n \n \n23. Urges Member States to pursue multilateral negotiations without delay in \ngood faith on effective measures for the achievement and maintenance of a nuclear-\nweapon-free world, in keeping with the spirit and purpose of General Assembly \nresolution 1 (I) and article VI of the Treaty on the Non-Proliferation of Nuclear \nWeapons;  \n \n24. Calls upon Member States to continue to support efforts to identify, \nelaborate, negotiate and implement further effective legally binding measures for \nnuclear disarmament, and welcomes in this regard the adoption on 7 July 2017 of the \nTreaty on the Prohibition of Nuclear Weapons;5  \n \n25. Recommends that measures be taken to increase awareness among civil \nsociety of the risks and catastrophic impact of any nuclear detonation, including \nthrough disarmament education; \n \n26. Decides to include in the provisional agenda of its seventy-fourth session, \nunder the item entitled \u201cGeneral and complete disarmament\u201d, the sub-item entitled \n\u201cTowards a nuclear-weapon-free world: accelerating the implementation of nuclear \ndisarmament commitments\u201d and to review the implementation of the present \nresolution at that session. \n \n45th plenary meeting  \n5 December 2018 \n \n",
  "paragraphs": {
    "1": "Reiterates that each article of the Treaty on the Non-Proliferation of Nuclear Weapons9 is binding on the States parties at all times and in all circumstances and that all States parties should be held fully accountable with respect to strict compliance with their obligations under the Treaty, and calls upon all States parties to comply fully with all decisions, resolutions and commitments made at the 1995, 2000 and 2010 Review Conferences;",
    "2": "Also reiterates the deep concern expressed by the 2010 Review Conference of the Parties to the Treaty on the Non-Proliferation of Nuclear Weapons at the catastrophic humanitarian consequences of any use of nuclear weapons, and the need for all States at all times to comply with applicable international law, including international humanitarian law;3",
    "3": "Acknowledges the evidence presented at the Conferences on the Humanitarian Impact of Nuclear Weapons, and calls upon Member States, in their relevant decisions and actions, to give due prominence to the humanitarian imperatives that underpin nuclear disarmament and to the urgency of achieving this goal;",
    "4": "Recalls the reaffirmation of the continued validity of the practical steps agreed to in the Final Document of the 2000 Review Conference of the Parties to the Treaty on the Non-Proliferation of Nuclear Weapons, 11 including the specific reaffirmation of the unequivocal undertaking of the nuclear-weapon States to accomplish the total elimination of their nuclear arsenals leading to nuclear disarmament, to which all States parties are committed under article VI of the Treaty, recalls the commitment of the nuclear-weapon States to accelerating concrete progress on the steps leading to nuclear disarmament, and calls upon the nuclear- weapon States to take all steps necessary to accelerate the fulfilment of their commitments;",
    "5": "Calls upon the nuclear-weapon States to fulfil their commitment to undertaking further efforts to reduce and ultimately eliminate all types of nuclear weapons, deployed and non-deployed, including through unilateral, bilateral, regional and multilateral measures;",
    "6": "Urges all States possessing nuclear weapons to decrease the operational readiness of nuclear-weapon systems in a verifiable and transparent manner with a view to ensuring that all nuclear weapons are removed from high alert status;",
    "7": "Encourages the nuclear-weapon States to make concrete reductions in the role and significance of nuclear weapons in all military and security concepts, doctrines and policies, pending their total elimination;",
    "8": "Encourages all States that are part of regional alliances that include nuclear-weapon States to diminish the role of nuclear weapons in their collective security doctrines, pending their total elimination;",
    "9": "Underlines the recognition by States parties to the Treaty on the Non-Proliferation of Nuclear Weapons of the legitimate interest of non-nuclear- weapon States in the constraining by the nuclear-weapon States of the development and qualitative improvement of nuclear weapons and their ending the development of advanced new types of nuclear weapons, and calls upon the nuclear-weapon States to take steps in this regard;",
    "10": "Notes with concern recent policy statements by nuclear-weapon States relating to the modernization of their nuclear weapon programmes, which undermine their commitments to nuclear disarmament and increase the risk of the use of nuclear weapons and the potential for a new arms race;",
    "11": "Encourages further steps by all nuclear-weapon States, in accordance with the previous obligations and commitments on nuclear disarmament, to ensure the irreversible removal of all fissile material designated by each nuclear-weapon State as no longer required for military purposes, and calls upon all States to support, within the context of the International Atomic Energy Agency, the development of appropriate nuclear disarmament verification capabilities and legally binding verification arrangements, thereby ensuring that such material remains permanently outside military programmes in a verifiable manner;",
    "12": "Calls upon all States parties to the Treaty on the Non-Proliferation of Nuclear Weapons to work towards the full implementation of the resolution on the Middle East adopted at the 1995 Review and Extension Conference of the Parties to the Treaty on the Non-Proliferation of Nuclear Weapons,6 which is inextricably linked to the indefinite extension of the Treaty, and expresses disappointment and deep concern at the lack of a substantive outcome of the 2015 Review Conference of the Parties to the Treaty on the Non-Proliferation of Nuclear Weapons, including on the process to establish a Middle East zone free of nuclear weapons and all other weapons of mass destruction as contained in the 1995 resolution on the Middle East, which remains valid until fully implemented;",
    "13": " in the 1995 resolution on the Middle East, including through support for the convening of the conference on the establishment of such a zone;",
    "14": "Stresses the fundamental role of the Treaty on the Non-Proliferation of Nuclear Weapons in achieving nuclear disarmament and nuclear non-proliferation, and looks forward to the third session of the Preparatory Committee for the 2020 Review Conference of the Parties to the Treaty on the Non-Proliferation of Nuclear Weapons, to be held in New York from 29 April to 10 May 2019;",
    "15": "Calls upon all States parties to spare no effort to achieve the universality of the Treaty on the Non-Proliferation of Nuclear Weapons, and in this regard urges India, Israel and Pakistan to accede to the Treaty as non-nuclear-weapon States promptly and without conditions, and to place all their nuclear facilities under International Atomic Energy Agency safeguards;",
    "16": "Notes with encouragement the dialogue and discussions held with the Democratic People\u2019s Republic of Korea, including the recent inter-Korean summits, and the summit between the United States of America and the Democratic People\u2019s Republic of Korea, urges the Democratic People\u2019s Republic of Korea to fulfil its commitments, to abandon all nuclear weapons and existing nuclear programmes, to return, at an early date, to the Treaty on the Non-Proliferation of Nuclear Weapons and to adhere to its International Atomic Energy Agency safeguards agreement,12 with a view to achieving the denuclearization of the Korean Peninsula in a peaceful manner, and reaffirms its firm support for the Six-Party Talks;",
    "17": "Urges all States to work together to overcome obstacles within the international disarmament machinery that are inhibiting efforts to advance the cause of nuclear disarmament in a multilateral context, and once again urges the Conference on Disarmament to commence immediately substantive work that advances the agenda of nuclear disarmament, particularly through multilateral negotiations;",
    "18": "Urges all States parties to the Treaty on the Non-Proliferation of Nuclear Weapons to fully implement without delay their obligations and commitments under the Treaty and as agreed to at the 1995, 2000 and 2010 Review Conferences;",
    "19": "Also urges all State parties to the Treaty on the Non-Proliferation of Nuclear Weapons to move forward with urgency in implementing their article VI obligations in order to ensure the good standing of the Treaty and its review process;",
    "20": "Urges the nuclear-weapon States to implement their nuclear disarmament obligations and commitments, both qualitative and quantitative, in a manner that enables the States parties to regularly monitor progress, including through a standard detailed reporting format, thereby enhancing confidence and trust not only among the nuclear-weapon States but also between the nuclear-weapon States and the non-nuclear-weapon States and contributing to nuclear disarmament;",
    "21": "Also urges the nuclear-weapon States to include in their reports to be submitted during the 2020 review cycle of the Treaty on the Non-Proliferation of Nuclear Weapons concrete and detailed information concerning the implementation of their obligations and commitments on nuclear disarmament;",
    "22": "Encourages States parties to the Treaty on the Non-Proliferation of Nuclear Weapons to improve the measurability of the implementation of nuclear disarmament obligations and commitments, including through tools such as a set of benchmarks or similar criteria, in order to ensure and facilitate the objective evaluation of progress;13",
    "23": "Urges Member States to pursue multilateral negotiations without delay in good faith on effective measures for the achievement and maintenance of a nuclear- weapon-free world, in keeping with the spirit and purpose of General Assembly resolution 1 (I) and article VI of the Treaty on the Non-Proliferation of Nuclear Weapons;",
    "24": "Calls upon Member States to continue to support efforts to identify, elaborate, negotiate and implement further effective legally binding measures for nuclear disarmament, and welcomes in this regard the adoption on 7 July 2017 of the Treaty on the Prohibition of Nuclear Weapons;5",
    "25": "Recommends that measures be taken to increase awareness among civil society of the risks and catastrophic impact of any nuclear detonation, including through disarmament education;",
    "26": "Decides to include in the provisional agenda of its seventy-fourth session, under the item entitled \u201cGeneral and complete disarmament\u201d, the sub-item entitled \u201cTowards a nuclear-weapon-free world: accelerating the implementation of nuclear disarmament commitments\u201d and to review the implementation of the present resolution at that session."
  },
  "agenda_items": [
    "Item 101"
  ],
  "symbol_references": []
}