{
  "symbol": "A/RES/72/133",
  "filename": "A_RES_72_133.pdf",
  "title": "72/133. Strengthening of the coordination of emergency humanitarian assistance of the United Nations",
  "text": "United Nations \nA/RES/72/133\n \n \nGeneral Assembly \nDistr.: General \n16 January 2018 \n \n17-22357 (E)    190118  \n*1722357* \n \n \nSeventy-second session \nAgenda item 73 (a) \n \n \n \n \n Resolution adopted by the General Assembly \non 11 December 2017 \n \n \n \n \n[without reference to a Main Committee (A/72/L.24 and A/72/L.24/Add.1)] \n \n \n 72/133. Strengthening of the coordination of emergency humanitarian \nassistance of the United Nations  \n \n \n \nThe General Assembly, \n \nReaffirming its resolution 46/182 of 19 December 1991 and the guiding \nprinciples contained in the annex thereto, other relevant General Assembly and \nEconomic and Social Council resolutions and agreed conclusions of the Council, \n \nTaking note of the reports of the Secretary-General on the strengthening of the \ncoordination of emergency humanitarian assistance of the United Nations 1 and on the \nCentral Emergency Response Fund,2 \n \nReaffirming \nthe principles \nof \nhumanity, \nneutrality, \nimpartiality \nand \nindependence in the provision of humanitarian assistance, and reaffirming also the \nneed for all actors engaged in the provision of humanitarian assistance in situations \nof complex emergencies and natural disasters to promote and fully respect these \nprinciples, \n \nExpressing grave concern at the increasing challenges caused by the \nunprecedented number of people affected by humanitarian emergencies, including \nprotracted displacement, which are increasing in number, scale and severity and are \nstretching humanitarian response capacities, and expressing deep concern about the \nimpact of climate change, the ongoing consequences of the financial and economic \ncrisis, regional food crises, continuing food and energy insecurity, water scarcity, \nunplanned and rapid urbanization of populations, epidemics, natural hazards, \nenvironmental degradation, armed conflicts and acts of terrorism, which are adding \nto underdevelopment, poverty and inequality and are increasing the vulnerability of \npeople while reducing their ability to cope with humanitarian crises,  \n__________________ \n \n1  A/72/76-E/2017/58. \n \n2  A/72/358. \n\nA/RES/72/133 \nStrengthening of the coordination of emergency\nhumanitarian assistance of the United Nations\n \n17-22357 \n2/16 \n \n \nUnderscoring the need, in order to ensure a smooth transition from relief to \nrehabilitation and development, to better align, wherever appropriate, humanitarian \nand development assistance with national development priorities and strategies, and \nencouraging Member States, as well as the United Nations system and regional \norganizations in supporting the efforts of Member States, to tackle the root causes of \nhumanitarian crises, including poverty and underdevelopment, build the resilience of \naffected States, including host communities, and reduce humanitarian needs, \n \nRecognizing that a cooperative and complementary framework between \nhumanitarian and development approaches is imperative to build resilience,  \n \nConcerned about the growing gap between the increasing numbers of people in \nneed of assistance and sufficient resources to provide relief, noting the appointment \nby the Secretary-General, in May 2015, of a High-level Panel on Humanitarian \nFinancing to examine ways to raise more humanitarian funding, to make the funding \nmore predictable and to use available funding more effectively, and taking note of the \nreport of the Panel,  \n \nConcerned also about the growing gap between humanitarian needs and \nresources, welcoming non-traditional donors, and emphasizing the need to mobilize \nadequate, predictable, timely and flexible resources for humanitarian assistance, \nbased on and in proportion to assessed risks and needs, with a view to planning for, \nmitigating, preparing for, responding to and recovering from humanitarian \nemergencies and to ensuring fuller coverage of the needs in all sectors and across \nhumanitarian emergencies,  \n \nRecognizing, in this regard, the significant achievements of the Central \nEmergency Response Fund in facilitating life-saving assistance to crisis-affected \npeople by providing timely funding, enabling humanitarian organizations and their \nimplementing partners to act quickly when tragedy strikes and steer resources to \ncrises that do not receive the attention that they need and deserve, emphasizing the \nneed to broaden and diversify the income base of the Fund, and welcoming in this \nregard the call by the Secretary-General to increase the level of the Fund to 1 billion \nUnited States dollars by 2018, \n \nRecognizing also the significant achievements of country-based pooled funds in \nfacilitating assistance to people in need, noting the Secretary-General\u2019s call for \ndonors to increase the proportion of humanitarian appeal funding channelled through \ncountry-based pooled funds, and noting also that other pooled funding mechanisms \ncan make important contributions,  \n \nEmphasizing that strengthened needs analysis, risk management and strategic \nplanning, in coordination with affected States, including through the use of open and \ndisaggregated data, are crucial elements to ensure a better informed, more effective, \ntransparent and collective response to the needs of people affected by crises,  \n \nReiterating the need for Member States, relevant United Nations organizations \nand other relevant actors to mainstream a gender perspective into humanitarian \nassistance and integrate a gender perspective into all disaster risk reduction efforts, \nincluding by addressing the specific needs, and promoting the priorities and \ncapacities, of women, girls, men and boys in a comprehensive and consistent manner, \nrecognizing that in humanitarian emergencies, women, girls and boys face heightened \nrisks to their safety, health and well-being, and also reiterating that it is essential to \nensure that women are empowered to effectively and meaningfully participate in \nleadership and decision-making processes, wherever possible, and that the rights of \nwomen, girls and boys are respected and protected in such emergencies, \n \nReiterating also the need for Member States, relevant United Nations \norganizations and other relevant actors to improve accountability at all levels to the \n\nStrengthening of the coordination of emergency \nhumanitarian assistance of the United Nations \nA/RES/72/133\n \n3/16 \n17-22357 \n \nneeds of affected populations, and recognizing the importance of inclusive \nparticipation in decision-making, \n \nRecognizing that persons with disabilities are disproportionately affected in \nhumanitarian emergencies and face multiple barriers in accessing assistance, recalling \nthe need for the involvement of persons with disabilities in decision-making processes \nand consultations in humanitarian preparedness and response, and in this regard \nrecalling the Charter on Inclusion of Persons with Disabilities in Humanitarian \nAction, \n \nExpressing its deep concern about the increasing challenges faced by Member \nStates and the United Nations humanitarian response system and their capacities as a \nresult of the consequences of disasters, including those related to the continuing \nimpact of climate change, and reaffirming the need for the implementation of the \nSendai Framework for Disaster Risk Reduction 2015\u20132030,3 inter alia, by providing \nadequate resources for disaster risk reduction, including investment, as well as risk \nfinancing, at all levels in disaster preparedness and capacity-building, and through \ndisaster-informed policies, programmes and investments and other proactive \nmeasures that aim towards preventing new and reducing existing risk in order to \nreduce humanitarian needs,  \n \nWelcoming the Paris Agreement4 and its early entry into force, encouraging all \nits parties to fully implement the Agreement, and parties to the United Nations \nFramework Convention on Climate Change5 that have not yet done so to deposit their \ninstruments of ratification, acceptance, approval or accession, where appropriate, as \nsoon as possible, \n \nRecognizing the primary role of Member States in preparing for and responding \nto outbreaks of infectious disease, in compliance with the International Health \nRegulations (2005) adopted by the World Health Assembly,6 including those that \nbecome humanitarian crises, highlighting the critical role played by Member States, \nthe World Health Organization as the directing and coordinating authority of \ninternational health work, the United Nations humanitarian system, regional \norganizations, non-governmental organizations, the private sector and other \nhumanitarian actors in providing financial, technical and in-kind support in order to \nbring epidemics or pandemics under control, and recognizing also the need to \nstrengthen local and national health systems, early reporting and early warning \nsystems, preparedness, cross-sectoral response capacities, and resilience linked to \noutbreaks of infectious disease, including through capacity-building for developing \ncountries,  \n \nRecognizing also that developing countries, in particular the least developed \ncountries and small island developing States, remain acutely vulnerable to human and \neconomic loss resulting from natural hazards, and recognizing further the need for \nstrengthening international cooperation, as appropriate, to strengthen their resilience \nin this regard, \n \nRecognizing further that inclusive economic growth and sustainable \ndevelopment are essential for the prevention of and preparedness for natural disasters \nand other emergencies,  \n \nRecognizing, in this respect, that building national and local preparedness and \nresponse capacity through, inter alia, appropriate, inclusive and conducive public \npolicies and international assistance, is critical to a more predictable and effective \n__________________ \n \n3  Resolution 69/283, annex II. \n \n4  See FCCC/CP/2015/10/Add.1, decision 1/CP.21, annex. \n \n5  United Nations, Treaty Series, vol. 1771, No. 30822. \n \n6  World Health Organization, document WHA58/2005/REC/1, resolution 58.3, annex. \n\nA/RES/72/133 \nStrengthening of the coordination of emergency\nhumanitarian assistance of the United Nations\n \n17-22357 \n4/16 \n \nresponse and contributes to the achievement of humanitarian and development \nobjectives, including enhanced resilience and a reduced need for humanitarian \nresponse, \n \nEmphasizing that enhancing \ninternational cooperation on \nemergency \nhumanitarian assistance is essential, and reaffirming its resolution 71/128 of \n8 December 2016 on international cooperation on humanitarian assistance in the field \nof natural disasters, from relief to development, \n \nEmphasizing also the fundamentally civilian character of humanitarian \nassistance, and reaffirming, in situations in which military capacity and assets are \nused as a last resort to support the implementation of humanitarian assistance, the \nneed for their use to be undertaken with the consent of the affected State and in \nconformity with international law, including international humanitarian law, as well \nas humanitarian principles,  \n \nRecognizing the high number of people affected by humanitarian emergencies, \nincluding the unprecedented number of people who are forcibly displaced, of whom \na majority are women and children, owing to conflict, acts of terrorism, persecution, \nviolence and other reasons, and who are often displaced for protracted periods, \nwherein the national authorities have the primary duty and responsibility to provide \nprotection and humanitarian assistance and promote durable solutions for internally \ndisplaced persons within their jurisdiction, bearing in mind their particular needs, \n \nNoting the need for increased awareness of the international community \nregarding the issue of internal displacement worldwide, including the situation of the \nmillions living in protracted situations of displacement, and the urgency of providing \nadequate humanitarian assistance to and protection for internally displaced persons, \nsupporting host communities, addressing the root causes of displacement, finding \ndurable solutions for internally displaced persons in their countries and addressing \npossible obstacles in this regard, and recognizing that durable solutions include \nvoluntary return in safety and with dignity, as well as voluntary local integration in \nthe areas to which persons have been displaced or voluntary settlement in another part \nof the country, without prejudice to the right of internally displaced persons to leave \ntheir country or to seek asylum,  \n \nReaffirming the New York Declaration for Refugees and Migrants, adopted at \nthe high-level plenary meeting of the General Assembly on addressing large \nmovements of refugees and migrants, held on 19 September 2016,7 \n \nExpressing concern about the particular difficulties faced by the millions of \nrefugees in protracted situations, recognizing that the average length of stay has \ncontinued to grow, and emphasizing the need to redouble international efforts and \ncooperation to find practical and comprehensive approaches to resolving their plight \nand to realize durable solutions for them, consistent with the Charter of the United \nNations, international law and relevant General Assembly resolutions,  \n \nNoting with great concern that millions of people are facing famine or the \nimmediate risk of famine or are experiencing severe food insecurity in several regions \nof the world, and noting that armed conflicts, drought, poverty and the volatility of \ncommodity prices are among the factors causing or exacerbating famine and severe \nfood insecurity and that additional efforts, including international support, are \nurgently needed to address this, \n \nRecognizing the importance of international humanitarian law, including the \nGeneva Conventions of 1949,8 which provides a vital legal framework for the \n__________________ \n \n7  Resolution 71/1. \n \n8  United Nations, Treaty Series, vol. 75, Nos. 970\u2013973. \n\nStrengthening of the coordination of emergency \nhumanitarian assistance of the United Nations \nA/RES/72/133\n \n5/16 \n17-22357 \n \nprotection of civilian persons in time of war, including the provision of humanitarian \nassistance, \n \nStrongly condemning all acts of violence, including direct attacks, against \nhumanitarian personnel and facilities, as well as against medical personnel and other \nhumanitarian personnel exclusively engaged in medical duties, their means of \ntransport and equipment, and hospitals and other medical facilities, which in a \nmajority of cases affect locally recruited personnel, noting with concern the negative \nimplications for the provision of humanitarian assistance to populations in need, and \nwelcoming efforts such as the Health Care in Danger project of the International Red \nCross and Red Crescent Movement, together with States, international and \nnon-governmental organizations and other relevant stakeholders, to strengthen \ncompliance with international humanitarian law by raising awareness and promoting \npreparedness to address the grave and serious humanitarian consequences arising \nfrom such violence, \n \nRecalling the obligations of all States and parties to an armed conflict, in \naccordance with the relevant provisions of international humanitarian law to respect \nand protect, in situations of armed conflict, medical personnel and humanitarian \npersonnel exclusively engaged in medical duties, their means of transport and \nequipment, and hospitals and other medical facilities, which must not be attacked, \nand to ensure that the wounded and sick receive, to the fullest extent practicable and \nwith the least possible delay, the medical care and attention required, and noting the \napplicable rules of international humanitarian law relating to the non-punishment of \nany person for carrying out medical activities compatible with medical ethics, \n \nNoting with grave concern that violence, including gender-based violence, \nparticularly sexual violence, and violence against children, continues to be \ndeliberately directed against civilian populations during and after humanitarian \nsituations,  \n \nNoting with appreciation the efforts that Member States, the United Nations and \nother relevant actors continue to make to improve the effectiveness of humanitarian \nresponse based on needs, including by strengthening humanitarian response \ncapacities, improving humanitarian coordination, identifying and integrating \nappropriate innovation into humanitarian preparedness, response and recovery, \nincreasing transparency, reducing duplication, strengthening partnerships with local \nand national responders as appropriate, enhancing flexible, predictable and adequate \nfunding and strengthening the accountability of all stakeholders, \n \nNoting with grave concern that children and youth continue to lack education in \nsituations of complex emergencies, and emphasizing the urgent need for increased \nfinancing and more efficient delivery of quality education in humanitarian \nemergencies, as a contribution towards achieving the Sustainable Development Goal \non ensuring inclusive and equitable quality education and promoting lifelong learning \nopportunities for all, and to provide quality education for all, in particular children, \nin humanitarian emergencies,  \n \nRecognizing that, in strengthening the coordination of humanitarian assistance \nin the field, the organizations of the United Nations system should continue to consult \nand work in close coordination with national Governments, \n \nReaffirming its resolution 70/1 of 25 September 2015, entitled \u201cTransforming \nour world: the 2030 Agenda for Sustainable Development\u201d, in which it adopted a \ncomprehensive, far-reaching and people-centred set of universal and transformative \nSustainable Development Goals and targets, its commitment to working tirelessly for \nthe full implementation of the Agenda by 2030, its recognition that eradicating \npoverty in all its forms and dimensions, including extreme poverty, is the greatest \n\nA/RES/72/133 \nStrengthening of the coordination of emergency\nhumanitarian assistance of the United Nations\n \n17-22357 \n6/16 \n \nglobal challenge and an indispensable requirement for sustainable development, its \ncommitment to achieving sustainable development in its three dimensions \u2013 \neconomic, social and environmental \u2013 in a balanced and integrated manner, and to \nbuilding upon the achievements of the Millennium Development Goals and seeking \nto address their unfinished business,  \n \nReaffirming also its resolution 69/313 of 27 July 2015 on the Addis Ababa \nAction Agenda of the Third International Conference on Financing for Development, \nwhich is an integral part of the 2030 Agenda for Sustainable Development, supports \nand complements it and helps to contextualize its means of implementation targets \nwith concrete policies and actions,  \n \n1. \nWelcomes the outcome of the twentieth humanitarian affairs segment of \nthe Economic and Social Council at its substantive session of 2017, 9 and also \nwelcomes the adoption of Economic and Social Council resolution 2017/14 of \n23 June 2017; \n \n2. \nRequests the Emergency Relief Coordinator to continue his efforts to \nstrengthen the coordination and accountability of humanitarian assistance and \nleadership within the United Nations humanitarian response system, including \nthrough the transformative agenda of the Inter-Agency Standing Committee, and calls \nupon relevant United Nations organizations and other relevant intergovernmental \norganizations, as well as other humanitarian and development actors, to continue to \nwork with the Office for the Coordination of Humanitarian Affairs of the Secretariat \nto enhance the coordination, effectiveness and efficiency of humanitarian assistance; \n \n3. \nAlso requests the Emergency Relief Coordinator to continue to improve \ndialogue with all Member States on the relevant processes, activities and deliberations \nof the Inter-Agency Standing Committee;  \n \n4. \nEncourages Member States and the Office for the Coordination of \nHumanitarian Affairs to continue to improve dialogue and collaboration on \nhumanitarian issues, at the global and field levels, including on policy, in order to \nfoster a more consultative and inclusive approach to humanitarian assistance;  \n \n5. \nWelcomes the continued efforts by the Office for the Coordination of \nHumanitarian Affairs to build partnerships with regional organizations and \nnon-traditional donors and the private sector, and encourages Member States and the \nUnited Nations system to continue to strengthen partnerships at the global, regional, \nnational and local levels in support of national efforts in order to effectively cooperate \nto provide humanitarian assistance to those in need and ensure that their collaborative \nefforts adhere to the principles of neutrality, humanity, impartiality and independence;  \n \n6. \nEncourages Member States, the United Nations system and humanitarian \nand development organizations to continue to assess and improve, together with other \nrelevant stakeholders, including the private sector, how innovation can be more \nproactively and systematically identified and integrated into humanitarian action in a \nsustainable manner and to promote the sharing of best practices and lessons learned \non innovative tools, processes and approaches, including those from large-scale \nnatural disasters and humanitarian crises of a protracted nature, that could improve \nthe effectiveness and quality of humanitarian response, and in this regard encourages \nall relevant stakeholders to continue to support the efforts of Member States, in \nparticular developing countries, to strengthen their capacities, including through \nfacilitating access to information and communications technologies; \n__________________ \n \n9  See Official Records of the General Assembly, Seventy-second Session, Supplement No. 3 \n(A/72/3), chap. X. \n\nStrengthening of the coordination of emergency \nhumanitarian assistance of the United Nations \nA/RES/72/133\n \n7/16 \n17-22357 \n \n \n7. \nWelcomes innovative practices that draw on the knowledge of people \naffected by humanitarian emergencies to develop locally sustainable solutions and to \nproduce life-saving items locally, with minimal logistical and infrastructure \nimplications;  \n \n8. \nCalls upon the relevant organizations of the United Nations system and, \nas appropriate, other relevant humanitarian actors to continue efforts to improve the \nhumanitarian response to natural and man-made disasters and complex emergencies \nby further strengthening humanitarian response capacities at all levels, by continuing \nto strengthen the provision and coordination of humanitarian assistance at the global, \nregional and field levels, including through existing cluster coordination mechanisms \nand in support of national authorities of the affected State, as appropriate, and by \nfurther enhancing efficiency, transparency, performance and accountability;  \n \n9. \nRecognizes the benefits of engagement and coordination with relevant \nhumanitarian actors to the effectiveness of humanitarian response, and encourages the \nUnited Nations to continue to pursue efforts to strengthen partnerships at the global \nlevel with the International Red Cross and Red Crescent Movement, relevant \nhumanitarian non-governmental organizations, other participants in the Inter-Agency \nStanding Committee and other relevant stakeholders;  \n \n10. Requests the Secretary-General to continue to strengthen the support \nprovided to United Nations resident/humanitarian coordinators and to United Nations \ncountry teams, including by providing necessary training, identifying resources and \nimproving the identification of and the selection process for United Nations \nresident/humanitarian coordinators, and enhancing their performance accountability;  \n \n11. \nCalls upon the Chair of the United Nations Development Group and the \nEmergency Relief Coordinator to continue to enhance their consultations before \npresenting final recommendations on the selection process for resident coordinators \nin countries likely to require significant humanitarian response operations;  \n \n12. Requests the United Nations to continue to strengthen its ability to recruit \nand deploy appropriately senior, skilled and experienced humanitarian staff quickly \nand flexibly, giving paramount consideration to the highest standards of efficiency, \ncompetence and integrity, while paying due regard to gender equality and to recruiting \non as wide a geographical basis as possible, and in this regard encourages the United \nNations Development Group to strengthen the resident coordinator system, on which \nthe humanitarian coordinator system is based, ensuring, inter alia, full implementation \nof the management and accountability system of the Group and the resident \ncoordinator system; \n \n13. Recognizes that diversity of humanitarian staff brings value to \nhumanitarian work and understanding of developing countries\u2019 contexts, and requests \nthe Secretary-General to address further the insufficient diversity in geographical \nrepresentation and gender balance in the composition of the humanitarian staff of the \nSecretariat and other United Nations humanitarian agencies, in particular regarding \nprofessional and high-level staff, and to report on concrete measures taken in this \nregard in his annual report;  \n \n14. Also recognizes that accountability is an integral part of effective \nhumanitarian assistance, and emphasizes the need for enhancing the accountability of \nhumanitarian actors at all stages of humanitarian assistance;  \n \n15. Urges Member States to continue to give priority to efforts to prevent, \nrespond to, investigate and prosecute acts of sexual and gender-based violence in \nhumanitarian emergencies, calls upon Member States and relevant organizations to \nimprove coordination and strengthen capacity, to ensure that humanitarian relief is \nprovided in a way that mitigates the risk of gender-based violence, and to strengthen \n\nA/RES/72/133 \nStrengthening of the coordination of emergency\nhumanitarian assistance of the United Nations\n \n17-22357 \n8/16 \n \nsupport services for victims, survivors and others affected by such violence beginning \nin the earliest stages of emergency response, taking into account their unique and \nspecific needs resulting from the impact of such violence, urges all relevant \nstakeholders to engage for more effective humanitarian relief, and notes the Call to \nAction initiative; \n \n16. Underscores the critical importance of protecting all persons affected by \nhumanitarian crises, in particular women and children, from any form of sexual abuse \nor sexual exploitation, and welcomes the determination of the Secretary-General to \nfully implement the United Nations policy of zero tolerance for sexual exploitation \nand abuse;  \n \n17. Urges Member States to continue to seek to prevent, respond to, \ninvestigate and prosecute violations and abuses against children in humanitarian \nemergencies, calls upon Member States and relevant organizations to strengthen \nsupport services for children affected by humanitarian emergencies, including those \nwho have experienced violations and abuses, and calls for a more effective response \nin that regard, guided by the rights of the child;  \n \n18. Reaffirms the importance of implementing the Sendai Framework for \nDisaster Risk Reduction 2015\u201320303 to ensure the substantial reduction of disaster \nrisk and losses in lives, livelihood and health and in the economic, physical, social, \ncultural and environmental assets of persons, businesses, communities and countries, \nand underlines the importance of tackling the underlying disaster risk drivers, of \nconsidering the impact of climate change and of integrating a disaster risk reduction \nperspective into humanitarian assistance to prevent new and reduce existing disaster \nrisk;  \n \n19. Calls upon Member States, the United Nations and relevant humanitarian \nand development organizations to continue to support multi-year investment, when \npossible, in preparedness, response and coordination capacities, and build the \ncapacity at all levels of government, including local government, of organizations and \nof communities, particularly in communities exposed to disasters, to better prepare \nfor hazards, reduce disaster risk, build resilience and better respond to and recover \nfrom and build back better after disasters, and also calls upon all relevant stakeholders \nto complement, rather than substitute for or displace, national capacities to respond \nto crises, especially where those crises are prolonged or recurrent; \n \n20. Urges Member States, the United Nations humanitarian system, regional \norganizations, non-governmental organizations, the private sector and other \nhumanitarian actors to reinforce preparedness and response capabilities in relation to \nthose outbreaks of infectious disease that trigger or exacerbate a humanitarian crisis, \nincluding by implementing the International Health Regulations (2005), 6 and calls \nupon the United Nations humanitarian system and humanitarian organizations to \nrespond rapidly, based on the level 3 activation procedure for infectious disease \nevents in humanitarian contexts, in close coordination with affected States; \n \n21. Calls upon Member States and the international community to provide \nadequate, sustainable and timely resources for disaster risk reduction in order to build \nresilience and reduce the risk of displacement within the context of disasters, \nincluding through complementary humanitarian and development programming and \nby further strengthening national and local capacities to prevent, prepare for and \nrespond to humanitarian emergencies, and furthermore encourages closer cooperation \nbetween national stakeholders and humanitarian and development actors in this \nregard; \n \n22. Encourages closer cooperation between development and humanitarian \nactors, in coordination with Member States, to ensure that all relevant actors work \n\nStrengthening of the coordination of emergency \nhumanitarian assistance of the United Nations \nA/RES/72/133\n \n9/16 \n17-22357 \n \ntogether, in accordance with their mandates, towards common results with the aim of \nreducing need, vulnerability and risk over multiple years, based on shared \nunderstanding of the context and each actor\u2019s operational strengths, in support of \nnational priorities, while fully respecting the humanitarian principles for \nhumanitarian action;  \n \n23. Encourages humanitarian and development actors to pursue, where \nappropriate, common risk-management and resilience objectives, achievable through \njoint analysis and multi-year programming and planning cycles;  \n \n24. Encourages the United Nations system, humanitarian organizations and \ndevelopment organizations to continue their efforts to mainstream preparedness, early \naction and early recovery into their programming, acknowledges that preparedness, \nearly action and early recovery should receive further funding, and in this regard \nencourages the provision of timely, flexible, predictable and adequate resources, \nincluding from both humanitarian and development budgets, as appropriate;  \n \n25. Urges Member States, the United Nations and other relevant organizations \nto take further steps to provide a coordinated emergency response to the food and \nnutrition needs of affected populations, while aiming to ensure that such steps are \nsupportive of national strategies and programmes aimed at improving food security \nand nutrition; \n \n26. Calls upon Member States, the United Nations, humanitarian and \ndevelopment organizations and other relevant actors to urgently and effectively \nrespond to, prevent and prepare for rising global food insecurity affecting millions of \npeople, especially those who are facing famine or the immediate risk of famine, \nincluding by enhancing humanitarian and development cooperation and providing \nurgent funding to respond to the needs of the affected population, and calls upon \nMember States and parties to armed conflicts to respect international humanitarian \nlaw and ensure safe and unhindered humanitarian access;  \n \n27. \nExpresses concern about the challenges related to, inter alia, safe access to \nand use of fuel, firewood, alternative energy, water and sanitation, shelter and food and \nhealth-care services, including psychosocial services, in humanitarian emergencies, and \nnotes with appreciation initiatives at the national and international levels, including \nthose that more systematically identify and integrate innovative approaches and share \nbest practices, that promote effective cooperation in this regard; \n \n28. Encourages the international community, including relevant United \nNations organizations and the International Federation of Red Cross and Red Crescent \nSocieties, to support efforts of Member States aimed at strengthening their capacity \nto prepare for and respond to disasters and to support efforts, as appropriate, to \nstrengthen systems, especially early warning systems, for identifying and monitoring \ndisaster risk, including vulnerability and natural hazards, and especially to \nsubstantially increase the availability of and access to multi-hazard warning systems; \n \n29. Welcomes the growing number of Member States and regional \norganizations that have taken steps to promote the implementation of the Guidelines \nfor the Domestic Facilitation and Regulation of International Disaster Relief and \nInitial Recovery Assistance, encourages others to do so, as appropriate, and welcomes \nthe valuable support that national Red Cross and Red Crescent societies are providing \nto their Governments in this area, in collaboration with the International Federation \nof Red Cross and Red Crescent Societies, the Office for the Coordination of \nHumanitarian Affairs and other partners; \n \n30. Encourages States to create an enabling environment for the capacity-\nbuilding of local authorities and of national and local non-governmental and \ncommunity-based organizations in order to ensure better preparedness in providing \n\nA/RES/72/133 \nStrengthening of the coordination of emergency\nhumanitarian assistance of the United Nations\n \n17-22357 \n10/16 \n \ntimely, effective and predictable assistance, and encourages the United Nations and \nother relevant organizations to provide support to such efforts, including, as \nappropriate, under the Common Framework for Preparedness of the Inter-Agency \nStanding Committee, the United Nations Development Group and the International \nStrategy for Disaster Reduction, through the transfer of technology, on mutually \nagreed terms, and expertise to developing countries and through support to enhance \nthe coordination capacities and build capacity in science and technology of affected \nStates;  \n \n31. Recognizes the increase in the number and scale of disasters, including \nthose related to the adverse effects of climate change, which in certain instances may \ncontribute to displacement and to additional pressure on host communities, \nencourages Member States, the United Nations and relevant organizations and actors \nto further strengthen the efforts aimed at addressing the needs of persons displaced \nwithin the context of disasters, including those induced by climate change, and notes \nin this regard the importance of sharing best practices to prevent and prepare for such \ndisplacements; \n \n32. Calls upon Member States, the United Nations and humanitarian \norganizations to provide emergency assistance in ways that are supportive of recovery \nand long-term development, where appropriate, including through multi-year funding \nand prioritizing humanitarian tools that strengthen resilience, such as, but not limited \nto, cash-based transfers, local procurement of food and services, including for school \nfeeding programmes, and social safety nets; \n \n33. Encourages Member States and the United Nations funds and programmes \nand the specialized agencies more effectively to respond to needs in humanitarian \ncontexts by, inter alia, scaling up social protection policies and cash-based transfer \nmechanisms, where feasible, including multipurpose cash programming, as \nappropriate, to support the development of local markets and strengthen national and \nlocal capacities, and in this regard calls upon the United Nations humanitarian \norganizations to continue building their capacity to systematically consider cash-\nbased transfer programming, alongside other forms of humanitarian assistance; \n \n34. Encourages Member States and relevant United Nations organizations to \nexamine their own financing mechanisms in order to improve, where possible, fast \nand flexible financing for preparedness, response and early recovery, and in this \nregard encourages exploring innovative ways, including forecast-based financing and \ndisaster risk insurance mechanisms, to increase the availability of resources; \n \n35. Takes note of the efforts of Member States, the United Nations system and \nthe international community to strengthen preparedness and local, national and \nregional humanitarian response capacity, calls upon the United Nations and relevant \npartners to support capacity-building of Member States, and calls upon Member \nStates to continue to provide funding to humanitarian country-based pooled funds; \n \n36. Encourages Member States, and calls upon relevant humanitarian \norganizations, to work closely with national institutions, including local governments \nand the private sector, as appropriate, to examine effective, context-specific ways to \nbe better prepared for, respond to and recover from increasing emergencies in urban \nareas, which may have an impact on the provision of such life-saving essential \nservices as water, energy and health care; \n \n37. Welcomes the adoption of the New Urban Agenda by the United Nations \nConference on Housing and Sustainable Urban Development (Habitat III), held in \nQuito from 17 to 20 October 2016,10 and takes note of the commitments undertaken \n__________________ \n \n10  Resolution 71/256, annex. \n\nStrengthening of the coordination of emergency \nhumanitarian assistance of the United Nations \nA/RES/72/133\n \n11/16 \n17-22357 \n \ntherein by Member States regarding persons affected by humanitarian crises in urban \nareas; \n \n38. Reaffirms the right to education for all and the importance of ensuring safe \nenabling learning environments in humanitarian emergencies, as well as quality \neducation at all levels, including for girls, including technical and vocational training \nopportunities, where possible, including through adequate funding and infrastructural \ninvestments, for the well-being of all, in this regard recognizes that access to quality \neducation in humanitarian emergencies can contribute to long-term development \ngoals and reiterates the need to protect and respect educational facilities in accordance \nwith international humanitarian law, strongly condemns all attacks directed against \nschools and the use of schools for military purposes, when in contravention of \ninternational humanitarian law, and encourages efforts to promote safe and protective \nschool environments in humanitarian emergencies; \n \n39. Calls upon the Office for the Coordination of Humanitarian Affairs and \nother United Nations organizations to continue to work with Member States and \nrelevant United Nations entities to facilitate the exchange of updated, accurate and \nreliable information, including through mutually comprehensible, disaggregated and \nharmonized data, to ensure better assessment and analysis of needs in order to \nimprove preparedness and humanitarian response;  \n \n40. Calls upon relevant United Nations organizations to support the \nimprovement of the humanitarian programme cycle, including the development of \ncoordinated and comprehensive needs assessment tools, such as multisector initial \nrapid assessments, the implementation of joint, impartial and timely needs \nassessments and prioritized needs-based humanitarian response plans, in consultation \nwith the affected States, in order to strengthen the coordination of humanitarian action \nto meet the needs of people affected by humanitarian emergencies; \n \n41. Encourages Member States to commit and to disburse in a timely fashion \nhumanitarian funding based on, and in accordance with, the humanitarian appeals \nbrought forward by the United Nations;  \n \n42. Encourages Member States and relevant United Nations organizations to \nexplore innovative risk-sharing mechanisms and to base risk management funding on \nobjective data;  \n \n43. Encourages United Nations and humanitarian organizations to further \nadvance efficiencies in delivering assistance through reducing management costs, \nharmonizing partnership agreements, providing transparent and comparable cost \nstructures, and strengthening measures to achieve greater accountability by taking \nfurther actions to reduce fraud, waste and abuse and identify ways to share incident \nreports and other information among United Nations agencies, where appropriate; \n \n44. Requests Member States, relevant humanitarian organizations of the \nUnited Nations system and other relevant humanitarian actors to promote gender \nequality and the empowerment of women in all stages of humanitarian response, to \ntake measures to ensure the full participation of women, girls, men and boys, \nincluding persons with disabilities and older persons, in all stages of decision-making, \nas appropriate, in order to, inter alia, reduce gender inequalities and ensure that \nhumanitarian assistance is informed, adapted, appropriate and effective, and to take \ninto account the specific needs, vulnerabilities and capacities of women, girls, men \nand boys on an equal basis, taking into consideration age and disability, in the design \nof needs assessments and the implementation of all programming, including by \nseeking to ensure the provision of access to the full range of medical, legal and \npsychosocial and livelihood services, without discrimination, and in this regard \nencourages efforts to ensure gender mainstreaming, including in the collection and \n\nA/RES/72/133 \nStrengthening of the coordination of emergency\nhumanitarian assistance of the United Nations\n \n17-22357 \n12/16 \n \nanalysis of disaggregated data, in the analysis of allocations and programme \nimplementation, and through greater use of the gender marker;  \n \n45. Recognizes the important role that women can play as first responders, and \nencourages Member States, the United Nations and other relevant humanitarian \norganizations to support women\u2019s leadership and participation in the planning and \nimplementation of response strategies, including by strengthening partnerships and \nbuilding the capacities of national and local institutions, including national and local \nwomen\u2019s organizations, and other civil society actors, as appropriate; \n \n46. Calls upon Member States, relevant humanitarian organizations of the \nUnited Nations system and other relevant humanitarian actors to ensure \nnon-discrimination and opportunities for persons with disabilities to participate on an \nequal basis with others in humanitarian preparedness and response; \n \n47. Calls upon the United Nations and humanitarian and development \norganizations, in coordination with Member States, to engage all people affected by \ndisasters and crises, in particular those most at risk, including through \ncommunication, enabling their participation in relevant processes and supporting \ntheir efforts and capacities to meet their different needs, while taking into account, as \nappropriate, their culture, traditions and local customs;  \n \n48. Calls upon United Nations humanitarian organizations, in consultation \nwith Member States, as appropriate, to strengthen the evidence base for humanitarian \nassistance by further developing common mechanisms and methodologies for \nimproving the quality, transparency, reliability, compatibility and comparability of \ncommon humanitarian needs assessments, needs data and analysis, including through \nimproved collection, analysis and reporting of data disaggregated by sex, age and \ndisability and taking into account environmental impact, to assess their performance \nin assistance and to ensure the most effective use of humanitarian resources by those \norganizations; \n \n49. Calls upon the United Nations and its humanitarian partners to enhance \naccountability to Member States, including affected States, and all other stakeholders, \nincluding local governments, relevant local organizations and other actors, as well as \naffected populations, and to further strengthen humanitarian response efforts, \nincluding by monitoring and evaluating the provision of their humanitarian \nassistance, incorporating lessons learned into programming and consulting with the \naffected populations so that their needs are appropriately assessed and effectively \naddressed; \n \n50. Calls upon Member States, the United Nations and humanitarian \norganizations to identify better ways of working to address the increasing capacity \nand resource gap, in order to effectively meet the needs of affected populations, \nincluding by harmonizing and, where possible, simplifying reporting requirements, \nincreasing the flexibility of humanitarian funding, including through reduced \nearmarking and further minimizing the duplication of costs, and making more use of \ninnovation in humanitarian response; \n \n51. Calls upon donors to provide adequate, timely, predictable and flexible \nresources based on and in proportion to assessed needs, including for underfunded \nand forgotten emergencies, to consider providing early and multi-year commitments \nto pooled humanitarian funds, including the Central Emergency Response Fund and \ncountry-based pooled funds, and to continue to support diverse humanitarian funding \nchannels, encourages efforts to adhere to the Principles and Good Practice of \nHumanitarian Donorship11 and to improve burden-sharing among donors, and in this \n__________________ \n \n11  A/58/99-E/2003/94, annex II. \n\nStrengthening of the coordination of emergency \nhumanitarian assistance of the United Nations \nA/RES/72/133\n \n13/16 \n17-22357 \n \nrespect encourages the private sector, civil society and other relevant entities to make \nrelevant contributions, complementary to those of other sources;  \n \n52. Welcomes the important achievements of the Central Emergency Response \nFund in ensuring a more timely and predictable response to humanitarian \nemergencies, stresses the importance of continuing to improve the functioning of the \nFund, and in this regard encourages the United Nations funds and programmes and \nthe specialized agencies to review and evaluate, where necessary, their partnership \npolicies and practices in order to ensure the timely disbursement of funds from the \nFund to implementing partners in order to ensure that resources are used in the most \nefficient, effective, accountable and transparent manner possible; \n \n53. Calls upon all Member States, and invites the private sector and all \nconcerned individuals and institutions, to consider increasing their voluntary \ncontributions to the Central Emergency Response Fund in order to achieve an annual \nfunding level of 1 billion United States dollars by 2018 and to continue to reinforce \nand strengthen the Fund as the global emergency response fund, and emphasizes the \nneed to broaden and diversify the income base of the Fund and that contributions \nshould be additional to current commitments to humanitarian programming and \nshould not be to the detriment of resources made available for international \ncooperation for development; \n \n54. Encourages Member States, the private sector and all relevant individuals \nand institutions to consider increasing their voluntary contributions to country-based \npooled funds and, as appropriate, other pooled funding mechanisms, to facilitate \nhumanitarian assistance to people in need;  \n \n55. Calls upon Member States that are in a position to do so and development \nand humanitarian partners, in their efforts to provide flexible resources, to consider \nways of better mainstreaming the need for preparedness and building resilience in the \nprovision of humanitarian and development assistance, including reconstruction and \nrehabilitation, inter alia, with a view to ensuring smooth transition from relief to \ndevelopment;  \n \n56. Calls upon all Member States that are in a position to do so to increase \ntheir voluntary contributions to humanitarian emergencies, including through \nflexible, unearmarked and multi-year funding where possible, in this context \nreiterates that the Office for the Coordination of Humanitarian Affairs should benefit \nfrom adequate and more predictable funding, and underscores the importance of \nadequate, timely and flexible voluntary funding for the Office to enable it to carry out \nits mandate;  \n \n57. Encourages Member States, in cooperation with relevant United Nations \nhumanitarian organizations, to ensure that the basic humanitarian needs of affected \npopulations, including clean water, food, shelter, health, including sexual and \nreproductive health, education and protection, energy and information and \ncommunications technologies, where possible, are addressed as components of \nhumanitarian response, including through providing timely and adequate resources, \nwhile ensuring that their collaborative efforts fully adhere to humanitarian principles; \n \n58. Also encourages Member States, in cooperation with relevant United \nNations humanitarian organizations, to ensure that women and girls have access to \nbasic health-care services, including reliable and safe access to sexual and \nreproductive health-care services and psychosocial support, from the onset of \nemergencies, in this regard recognizes that such assistance protects women, \nadolescent girls and infants from preventable mortality and morbidity that occur in \nhumanitarian emergencies, and calls upon Member States, the United Nations and \nother relevant actors to give such programmes due consideration; \n\nA/RES/72/133 \nStrengthening of the coordination of emergency\nhumanitarian assistance of the United Nations\n \n17-22357 \n14/16 \n \n \n59. Encourages Member States, the United Nations and humanitarian \norganizations to continue to work together to understand and address the different \nprotection needs of affected populations, particularly the most vulnerable, in \nhumanitarian crises and ensure that these needs are adequately integrated into \npreparedness, response and recovery efforts;  \n \n60. Calls upon Member States and relevant organizations and actors to \nrecognize and address the consequences of humanitarian emergencies for migrants, \nin particular those in vulnerable situations, and to strengthen coordinated \ninternational efforts for their assistance and protection in concert with national \nauthorities; \n \n61. Calls upon Member States to take steps to ensure the international \nprotection of and respect for the rights of refugees, including respect for the principle \nof non-refoulement and adequate standards of treatment in accordance with \ninternational law, including, as applicable, the 1951 Convention relating to the Status \nof Refugees12 and international human rights obligations; \n \n62. Recognizes the importance of early registration and effective registration \nsystems as a tool of protection and as a means of carrying out the quantification and \nassessment of needs for the provision and distribution of humanitarian assistance, \nnotes the many and diverse challenges faced by refugees who remain without any \nform of documentation attesting to their status, and underlines the importance of \nincreasing accountability to ensure that humanitarian assistance reaches its \nbeneficiaries; \n \n63. Reaffirms the obligation of all States and parties to an armed conflict to \nprotect civilians, in accordance with international humanitarian law, encourages \nStates that are parties to an armed conflict to take all measures necessary to enhance \nthe protection of civilians, and invites all States to promote a culture of protection, \ntaking into account the particular needs of women, children, older persons and \npersons with disabilities; \n \n64. Urges Member States to continue to take the steps necessary to ensure the \nprotection of the wounded and sick, as well as the safety and security of medical \npersonnel and humanitarian personnel exclusively engaged in medical duties, their \nfacilities, equipment, transports and supplies, including by developing effective \nmeasures to prevent and address acts of violence, attacks and threats against them, \nand in this regard reaffirms the need for States to ensure that those responsible for \nviolations of international humanitarian law do not operate with impunity, and urges \nStates to conduct full, prompt, impartial and effective investigations within their \njurisdiction of violations of international humanitarian law with a view to ensuring \naccountability, as provided for by national laws and obligations under international \nlaw, and to ensure that the wounded and sick receive, to the fullest extent practicable \nand with the least possible delay, the medical care and attention required; \n \n65. Also urges Member States to continue to take the steps necessary to ensure \nthe safety and security of humanitarian personnel, their facilities, equipment, \ntransports and supplies, including by developing effective measures to prevent and \naddress acts of violence, attacks and threats against them, requests the Secretary-\nGeneral to expedite his efforts to enhance the safety and security of personnel \ninvolved in United Nations humanitarian operations, and in this regard reaffirms the \nneed for States to ensure that those responsible for violations of international \nhumanitarian law do not operate with impunity, and urges States to conduct, full, \nprompt, impartial and effective investigations within their jurisdiction of violations \n__________________ \n \n12  United Nations, Treaty Series, vol. 189, No. 2545.  \n \n\nStrengthening of the coordination of emergency \nhumanitarian assistance of the United Nations \nA/RES/72/133\n \n15/16 \n17-22357 \n \nof international humanitarian law with a view to ensuring accountability, as provided \nfor by national laws and obligations under international law; \n \n66. Emphasizes the responsibility of States to adopt preventive measures and \neffective responses to acts of violence committed against civilian populations in \narmed conflicts and to comply with the relevant obligations under international law \nto end impunity and to ensure that those responsible are promptly brought to justice, \nin accordance with national law and their obligations under international law;  \n \n67. Calls upon all States and parties in complex humanitarian emergencies, in \nparticular in armed conflict and in post-conflict situations, in countries in which \nhumanitarian personnel are operating, in conformity with the relevant provisions of \ninternational law and national laws, to cooperate fully with the United Nations and \nother humanitarian agencies and organizations and to ensure the safe and unhindered \naccess of humanitarian personnel, as well as the delivery of supplies and equipment, \nin order to allow such personnel to efficiently perform their task of assisting affected \ncivilian populations, including refugees and internally displaced persons; \n \n68. Urges States, while undertaking counter-terrorism activities, to respect \ntheir international obligations, including whenever international humanitarian law is \napplicable, regarding the provision of humanitarian assistance to civilian populations, \nas well as recognizes the key role humanitarian organizations play in the provision of \nprincipled humanitarian assistance, while also recognizing the importance of \npreventing and suppressing the financing of and other forms of support to terrorism;  \n \n69. Recognizes the Guiding Principles on Internal Displacement 13 as an \nimportant international framework for the protection of internally displaced persons, \nand that forced displacement is not only a humanitarian but also a development \nchallenge, encourages Member States and humanitarian agencies to continue to work \ntogether, in collaboration with host communities, in endeavours to provide a more \npredictable response to the needs of internally displaced persons and in particular to \naddress the long-term nature of displacement by adopting and implementing long-\nterm strategies and coherent multi-year planning, including in relation to issues such \nas livelihoods, and in this regard calls for continued and enhanced international \nsupport, upon request, for the capacity-building efforts of States and encourages \nhumanitarian organizations to improve coordination, including with development \norganizations, to better address the needs of internally displaced persons in support \nof Member States to promote durable solutions;  \n \n70. Welcomes the progress made towards further enhancing the security \nmanagement system of the United Nations, and supports the approach taken by the \nSecretary-General to focus the efforts of the security management system on enabling \nthe United Nations system to \u201cstay and deliver\u201d its most critical programmes even in \nhigh-risk environments by effectively managing the risks to which personnel are \nexposed, including in the provision of humanitarian assistance, and to adapt quickly \nto changes in local security conditions;  \n \n71. Encourages the United Nations and other relevant humanitarian actors to \ninclude, as part of their risk management strategy, the building of good relations and \ntrust with national and local governments and to promote acceptance by local \ncommunities and all relevant actors in order to enable humanitarian assistance to be \nprovided in accordance with humanitarian principles;  \n \n72. Requests the Secretary-General to report on actions taken to enable the \nUnited Nations to continue to strengthen its ability to recruit and deploy staff quickly, \neffectively and flexibly, to procure emergency relief materials and services rapidly, \ncost-effectively and locally, where applicable, and to quickly disburse funds in order \n__________________ \n \n13  E/CN.4/1998/53/Add.2, annex. \n\nA/RES/72/133 \nStrengthening of the coordination of emergency\nhumanitarian assistance of the United Nations\n \n17-22357 \n16/16 \n \nto support Governments and United Nations country teams in the coordination of \ninternational humanitarian assistance;  \n \n73. Takes note of the World Humanitarian Summit, held in Istanbul, Turkey, \non 23 and 24 May 2016, and also takes note of the report of the Secretary-General on \nthe outcome of the World Humanitarian Summit;14 \n \n74. Urges all countries to integrate into their respective national policies and \ndevelopment frameworks the 2030 Agenda for Sustainable Development, 15 which \nincludes a comprehensive, far-reaching and people-centred set of universal and \ntransformative Sustainable Development Goals and targets, and urges Member States, \nthe United Nations and relevant stakeholders to work together to reduce the needs \nand build the resilience of the most vulnerable in order to contribute to the \nachievement of the Goals included in the 2030 Agenda, including the call to leave no \none behind;  \n \n75. Requests the Secretary-General to report to the General Assembly at its \nseventy-third session, through the Economic and Social Council at its 2018 session, \non progress made in strengthening the coordination of emergency humanitarian \nassistance of the United Nations, and to submit a report to the Assembly on the \ndetailed use of the Central Emergency Response Fund.  \n \n70th plenary meeting  \n11 December 2017 \n \n__________________ \n \n14  A/71/353. \n \n15  Resolution 70/1. \n",
  "paragraphs": {
    "1": "Welcomes the outcome of the twentieth humanitarian affairs segment of the Economic and Social Council at its substantive session of 2017, 9 and also welcomes the adoption of Economic and Social Council resolution 2017/14 of 23 June 2017;",
    "2": "Requests the Emergency Relief Coordinator to continue his efforts to strengthen the coordination and accountability of humanitarian assistance and leadership within the United Nations humanitarian response system, including through the transformative agenda of the Inter-Agency Standing Committee, and calls upon relevant United Nations organizations and other relevant intergovernmental organizations, as well as other humanitarian and development actors, to continue to work with the Office for the Coordination of Humanitarian Affairs of the Secretariat to enhance the coordination, effectiveness and efficiency of humanitarian assistance;",
    "3": "Also requests the Emergency Relief Coordinator to continue to improve dialogue with all Member States on the relevant processes, activities and deliberations of the Inter-Agency Standing Committee;",
    "4": "Encourages Member States and the Office for the Coordination of Humanitarian Affairs to continue to improve dialogue and collaboration on humanitarian issues, at the global and field levels, including on policy, in order to foster a more consultative and inclusive approach to humanitarian assistance;",
    "5": "Welcomes the continued efforts by the Office for the Coordination of Humanitarian Affairs to build partnerships with regional organizations and non-traditional donors and the private sector, and encourages Member States and the United Nations system to continue to strengthen partnerships at the global, regional, national and local levels in support of national efforts in order to effectively cooperate to provide humanitarian assistance to those in need and ensure that their collaborative efforts adhere to the principles of neutrality, humanity, impartiality and independence;",
    "6": "Encourages Member States, the United Nations system and humanitarian and development organizations to continue to assess and improve, together with other relevant stakeholders, including the private sector, how innovation can be more proactively and systematically identified and integrated into humanitarian action in a sustainable manner and to promote the sharing of best practices and lessons learned on innovative tools, processes and approaches, including those from large-scale natural disasters and humanitarian crises of a protracted nature, that could improve the effectiveness and quality of humanitarian response, and in this regard encourages all relevant stakeholders to continue to support the efforts of Member States, in particular developing countries, to strengthen their capacities, including through facilitating access to information and communications technologies; __________________ 9 See Official Records of the General Assembly, Seventy-second Session, Supplement No. 3 (A/72/3), chap. X. Strengthening of the coordination of emergency humanitarian assistance of the United Nations A/RES/72/133 7/16 17-22357",
    "7": "Welcomes innovative practices that draw on the knowledge of people affected by humanitarian emergencies to develop locally sustainable solutions and to produce life-saving items locally, with minimal logistical and infrastructure implications;",
    "8": "Calls upon the relevant organizations of the United Nations system and, as appropriate, other relevant humanitarian actors to continue efforts to improve the humanitarian response to natural and man-made disasters and complex emergencies by further strengthening humanitarian response capacities at all levels, by continuing to strengthen the provision and coordination of humanitarian assistance at the global, regional and field levels, including through existing cluster coordination mechanisms and in support of national authorities of the affected State, as appropriate, and by further enhancing efficiency, transparency, performance and accountability;",
    "9": "Recognizes the benefits of engagement and coordination with relevant humanitarian actors to the effectiveness of humanitarian response, and encourages the United Nations to continue to pursue efforts to strengthen partnerships at the global level with the International Red Cross and Red Crescent Movement, relevant humanitarian non-governmental organizations, other participants in the Inter-Agency Standing Committee and other relevant stakeholders;",
    "10": "Requests the Secretary-General to continue to strengthen the support provided to United Nations resident/humanitarian coordinators and to United Nations country teams, including by providing necessary training, identifying resources and improving the identification of and the selection process for United Nations resident/humanitarian coordinators, and enhancing their performance accountability;",
    "11": "Calls upon the Chair of the United Nations Development Group and the Emergency Relief Coordinator to continue to enhance their consultations before presenting final recommendations on the selection process for resident coordinators in countries likely to require significant humanitarian response operations;",
    "12": "Requests the United Nations to continue to strengthen its ability to recruit and deploy appropriately senior, skilled and experienced humanitarian staff quickly and flexibly, giving paramount consideration to the highest standards of efficiency, competence and integrity, while paying due regard to gender equality and to recruiting on as wide a geographical basis as possible, and in this regard encourages the United Nations Development Group to strengthen the resident coordinator system, on which the humanitarian coordinator system is based, ensuring, inter alia, full implementation of the management and accountability system of the Group and the resident coordinator system;",
    "13": "Recognizes that diversity of humanitarian staff brings value to humanitarian work and understanding of developing countries\u2019 contexts, and requests the Secretary-General to address further the insufficient diversity in geographical representation and gender balance in the composition of the humanitarian staff of the Secretariat and other United Nations humanitarian agencies, in particular regarding professional and high-level staff, and to report on concrete measures taken in this regard in his annual report;",
    "14": "Also recognizes that accountability is an integral part of effective humanitarian assistance, and emphasizes the need for enhancing the accountability of humanitarian actors at all stages of humanitarian assistance;",
    "15": "Urges Member States to continue to give priority to efforts to prevent, respond to, investigate and prosecute acts of sexual and gender-based violence in humanitarian emergencies, calls upon Member States and relevant organizations to improve coordination and strengthen capacity, to ensure that humanitarian relief is provided in a way that mitigates the risk of gender-based violence, and to strengthen A/RES/72/133 Strengthening of the coordination of emergency humanitarian assistance of the United Nations 17-22357 8/16 support services for victims, survivors and others affected by such violence beginning in the earliest stages of emergency response, taking into account their unique and specific needs resulting from the impact of such violence, urges all relevant stakeholders to engage for more effective humanitarian relief, and notes the Call to Action initiative;",
    "16": "Underscores the critical importance of protecting all persons affected by humanitarian crises, in particular women and children, from any form of sexual abuse or sexual exploitation, and welcomes the determination of the Secretary-General to fully implement the United Nations policy of zero tolerance for sexual exploitation and abuse;",
    "17": "Urges Member States to continue to seek to prevent, respond to, investigate and prosecute violations and abuses against children in humanitarian emergencies, calls upon Member States and relevant organizations to strengthen support services for children affected by humanitarian emergencies, including those who have experienced violations and abuses, and calls for a more effective response in that regard, guided by the rights of the child;",
    "18": "Reaffirms the importance of implementing the Sendai Framework for Disaster Risk Reduction 2015\u201320303 to ensure the substantial reduction of disaster risk and losses in lives, livelihood and health and in the economic, physical, social, cultural and environmental assets of persons, businesses, communities and countries, and underlines the importance of tackling the underlying disaster risk drivers, of considering the impact of climate change and of integrating a disaster risk reduction perspective into humanitarian assistance to prevent new and reduce existing disaster risk;",
    "19": "Calls upon Member States, the United Nations and relevant humanitarian and development organizations to continue to support multi-year investment, when possible, in preparedness, response and coordination capacities, and build the capacity at all levels of government, including local government, of organizations and of communities, particularly in communities exposed to disasters, to better prepare for hazards, reduce disaster risk, build resilience and better respond to and recover from and build back better after disasters, and also calls upon all relevant stakeholders to complement, rather than substitute for or displace, national capacities to respond to crises, especially where those crises are prolonged or recurrent;",
    "20": "Urges Member States, the United Nations humanitarian system, regional organizations, non-governmental organizations, the private sector and other humanitarian actors to reinforce preparedness and response capabilities in relation to those outbreaks of infectious disease that trigger or exacerbate a humanitarian crisis, including by implementing the International Health Regulations (2005), 6 and calls upon the United Nations humanitarian system and humanitarian organizations to respond rapidly, based on the level 3 activation procedure for infectious disease events in humanitarian contexts, in close coordination with affected States;",
    "21": "Calls upon Member States and the international community to provide adequate, sustainable and timely resources for disaster risk reduction in order to build resilience and reduce the risk of displacement within the context of disasters, including through complementary humanitarian and development programming and by further strengthening national and local capacities to prevent, prepare for and respond to humanitarian emergencies, and furthermore encourages closer cooperation between national stakeholders and humanitarian and development actors in this regard;",
    "22": "Encourages closer cooperation between development and humanitarian actors, in coordination with Member States, to ensure that all relevant actors work Strengthening of the coordination of emergency humanitarian assistance of the United Nations A/RES/72/133 9/16 17-22357 together, in accordance with their mandates, towards common results with the aim of reducing need, vulnerability and risk over multiple years, based on shared understanding of the context and each actor\u2019s operational strengths, in support of national priorities, while fully respecting the humanitarian principles for humanitarian action;",
    "23": "Encourages humanitarian and development actors to pursue, where appropriate, common risk-management and resilience objectives, achievable through joint analysis and multi-year programming and planning cycles;",
    "24": "Encourages the United Nations system, humanitarian organizations and development organizations to continue their efforts to mainstream preparedness, early action and early recovery into their programming, acknowledges that preparedness, early action and early recovery should receive further funding, and in this regard encourages the provision of timely, flexible, predictable and adequate resources, including from both humanitarian and development budgets, as appropriate;",
    "25": "Urges Member States, the United Nations and other relevant organizations to take further steps to provide a coordinated emergency response to the food and nutrition needs of affected populations, while aiming to ensure that such steps are supportive of national strategies and programmes aimed at improving food security and nutrition;",
    "26": "Calls upon Member States, the United Nations, humanitarian and development organizations and other relevant actors to urgently and effectively respond to, prevent and prepare for rising global food insecurity affecting millions of people, especially those who are facing famine or the immediate risk of famine, including by enhancing humanitarian and development cooperation and providing urgent funding to respond to the needs of the affected population, and calls upon Member States and parties to armed conflicts to respect international humanitarian law and ensure safe and unhindered humanitarian access;",
    "27": "Expresses concern about the challenges related to, inter alia, safe access to and use of fuel, firewood, alternative energy, water and sanitation, shelter and food and health-care services, including psychosocial services, in humanitarian emergencies, and notes with appreciation initiatives at the national and international levels, including those that more systematically identify and integrate innovative approaches and share best practices, that promote effective cooperation in this regard;",
    "28": "Encourages the international community, including relevant United Nations organizations and the International Federation of Red Cross and Red Crescent Societies, to support efforts of Member States aimed at strengthening their capacity to prepare for and respond to disasters and to support efforts, as appropriate, to strengthen systems, especially early warning systems, for identifying and monitoring disaster risk, including vulnerability and natural hazards, and especially to substantially increase the availability of and access to multi-hazard warning systems;",
    "29": "Welcomes the growing number of Member States and regional organizations that have taken steps to promote the implementation of the Guidelines for the Domestic Facilitation and Regulation of International Disaster Relief and Initial Recovery Assistance, encourages others to do so, as appropriate, and welcomes the valuable support that national Red Cross and Red Crescent societies are providing to their Governments in this area, in collaboration with the International Federation of Red Cross and Red Crescent Societies, the Office for the Coordination of Humanitarian Affairs and other partners;",
    "30": "Encourages States to create an enabling environment for the capacity- building of local authorities and of national and local non-governmental and community-based organizations in order to ensure better preparedness in providing A/RES/72/133 Strengthening of the coordination of emergency humanitarian assistance of the United Nations 17-22357 10/16 timely, effective and predictable assistance, and encourages the United Nations and other relevant organizations to provide support to such efforts, including, as appropriate, under the Common Framework for Preparedness of the Inter-Agency Standing Committee, the United Nations Development Group and the International Strategy for Disaster Reduction, through the transfer of technology, on mutually agreed terms, and expertise to developing countries and through support to enhance the coordination capacities and build capacity in science and technology of affected States;",
    "31": "Recognizes the increase in the number and scale of disasters, including those related to the adverse effects of climate change, which in certain instances may contribute to displacement and to additional pressure on host communities, encourages Member States, the United Nations and relevant organizations and actors to further strengthen the efforts aimed at addressing the needs of persons displaced within the context of disasters, including those induced by climate change, and notes in this regard the importance of sharing best practices to prevent and prepare for such displacements;",
    "32": "Calls upon Member States, the United Nations and humanitarian organizations to provide emergency assistance in ways that are supportive of recovery and long-term development, where appropriate, including through multi-year funding and prioritizing humanitarian tools that strengthen resilience, such as, but not limited to, cash-based transfers, local procurement of food and services, including for school feeding programmes, and social safety nets;",
    "33": "Encourages Member States and the United Nations funds and programmes and the specialized agencies more effectively to respond to needs in humanitarian contexts by, inter alia, scaling up social protection policies and cash-based transfer mechanisms, where feasible, including multipurpose cash programming, as appropriate, to support the development of local markets and strengthen national and local capacities, and in this regard calls upon the United Nations humanitarian organizations to continue building their capacity to systematically consider cash- based transfer programming, alongside other forms of humanitarian assistance;",
    "34": "Encourages Member States and relevant United Nations organizations to examine their own financing mechanisms in order to improve, where possible, fast and flexible financing for preparedness, response and early recovery, and in this regard encourages exploring innovative ways, including forecast-based financing and disaster risk insurance mechanisms, to increase the availability of resources;",
    "35": "Takes note of the efforts of Member States, the United Nations system and the international community to strengthen preparedness and local, national and regional humanitarian response capacity, calls upon the United Nations and relevant partners to support capacity-building of Member States, and calls upon Member States to continue to provide funding to humanitarian country-based pooled funds;",
    "36": "Encourages Member States, and calls upon relevant humanitarian organizations, to work closely with national institutions, including local governments and the private sector, as appropriate, to examine effective, context-specific ways to be better prepared for, respond to and recover from increasing emergencies in urban areas, which may have an impact on the provision of such life-saving essential services as water, energy and health care;",
    "37": "Welcomes the adoption of the New Urban Agenda by the United Nations Conference on Housing and Sustainable Urban Development (Habitat III), held in Quito from 17 to 20 October 2016,10 and takes note of the commitments undertaken __________________ 10 Resolution 71/256, annex. Strengthening of the coordination of emergency humanitarian assistance of the United Nations A/RES/72/133 11/16 17-22357 therein by Member States regarding persons affected by humanitarian crises in urban areas;",
    "38": "Reaffirms the right to education for all and the importance of ensuring safe enabling learning environments in humanitarian emergencies, as well as quality education at all levels, including for girls, including technical and vocational training opportunities, where possible, including through adequate funding and infrastructural investments, for the well-being of all, in this regard recognizes that access to quality education in humanitarian emergencies can contribute to long-term development goals and reiterates the need to protect and respect educational facilities in accordance with international humanitarian law, strongly condemns all attacks directed against schools and the use of schools for military purposes, when in contravention of international humanitarian law, and encourages efforts to promote safe and protective school environments in humanitarian emergencies;",
    "39": "Calls upon the Office for the Coordination of Humanitarian Affairs and other United Nations organizations to continue to work with Member States and relevant United Nations entities to facilitate the exchange of updated, accurate and reliable information, including through mutually comprehensible, disaggregated and harmonized data, to ensure better assessment and analysis of needs in order to improve preparedness and humanitarian response;",
    "40": "Calls upon relevant United Nations organizations to support the improvement of the humanitarian programme cycle, including the development of coordinated and comprehensive needs assessment tools, such as multisector initial rapid assessments, the implementation of joint, impartial and timely needs assessments and prioritized needs-based humanitarian response plans, in consultation with the affected States, in order to strengthen the coordination of humanitarian action to meet the needs of people affected by humanitarian emergencies;",
    "41": "Encourages Member States to commit and to disburse in a timely fashion humanitarian funding based on, and in accordance with, the humanitarian appeals brought forward by the United Nations;",
    "42": "Encourages Member States and relevant United Nations organizations to explore innovative risk-sharing mechanisms and to base risk management funding on objective data;",
    "43": "Encourages United Nations and humanitarian organizations to further advance efficiencies in delivering assistance through reducing management costs, harmonizing partnership agreements, providing transparent and comparable cost structures, and strengthening measures to achieve greater accountability by taking further actions to reduce fraud, waste and abuse and identify ways to share incident reports and other information among United Nations agencies, where appropriate;",
    "44": "Requests Member States, relevant humanitarian organizations of the United Nations system and other relevant humanitarian actors to promote gender equality and the empowerment of women in all stages of humanitarian response, to take measures to ensure the full participation of women, girls, men and boys, including persons with disabilities and older persons, in all stages of decision-making, as appropriate, in order to, inter alia, reduce gender inequalities and ensure that humanitarian assistance is informed, adapted, appropriate and effective, and to take into account the specific needs, vulnerabilities and capacities of women, girls, men and boys on an equal basis, taking into consideration age and disability, in the design of needs assessments and the implementation of all programming, including by seeking to ensure the provision of access to the full range of medical, legal and psychosocial and livelihood services, without discrimination, and in this regard encourages efforts to ensure gender mainstreaming, including in the collection and A/RES/72/133 Strengthening of the coordination of emergency humanitarian assistance of the United Nations 17-22357 12/16 analysis of disaggregated data, in the analysis of allocations and programme implementation, and through greater use of the gender marker;",
    "45": "Recognizes the important role that women can play as first responders, and encourages Member States, the United Nations and other relevant humanitarian organizations to support women\u2019s leadership and participation in the planning and implementation of response strategies, including by strengthening partnerships and building the capacities of national and local institutions, including national and local women\u2019s organizations, and other civil society actors, as appropriate;",
    "46": "Calls upon Member States, relevant humanitarian organizations of the United Nations system and other relevant humanitarian actors to ensure non-discrimination and opportunities for persons with disabilities to participate on an equal basis with others in humanitarian preparedness and response;",
    "47": "Calls upon the United Nations and humanitarian and development organizations, in coordination with Member States, to engage all people affected by disasters and crises, in particular those most at risk, including through communication, enabling their participation in relevant processes and supporting their efforts and capacities to meet their different needs, while taking into account, as appropriate, their culture, traditions and local customs;",
    "48": "Calls upon United Nations humanitarian organizations, in consultation with Member States, as appropriate, to strengthen the evidence base for humanitarian assistance by further developing common mechanisms and methodologies for improving the quality, transparency, reliability, compatibility and comparability of common humanitarian needs assessments, needs data and analysis, including through improved collection, analysis and reporting of data disaggregated by sex, age and disability and taking into account environmental impact, to assess their performance in assistance and to ensure the most effective use of humanitarian resources by those organizations;",
    "49": "Calls upon the United Nations and its humanitarian partners to enhance accountability to Member States, including affected States, and all other stakeholders, including local governments, relevant local organizations and other actors, as well as affected populations, and to further strengthen humanitarian response efforts, including by monitoring and evaluating the provision of their humanitarian assistance, incorporating lessons learned into programming and consulting with the affected populations so that their needs are appropriately assessed and effectively addressed;",
    "50": "Calls upon Member States, the United Nations and humanitarian organizations to identify better ways of working to address the increasing capacity and resource gap, in order to effectively meet the needs of affected populations, including by harmonizing and, where possible, simplifying reporting requirements, increasing the flexibility of humanitarian funding, including through reduced earmarking and further minimizing the duplication of costs, and making more use of innovation in humanitarian response;",
    "51": "Calls upon donors to provide adequate, timely, predictable and flexible resources based on and in proportion to assessed needs, including for underfunded and forgotten emergencies, to consider providing early and multi-year commitments to pooled humanitarian funds, including the Central Emergency Response Fund and country-based pooled funds, and to continue to support diverse humanitarian funding channels, encourages efforts to adhere to the Principles and Good Practice of Humanitarian Donorship11 and to improve burden-sharing among donors, and in this __________________ 11 A/58/99-E/2003/94, annex II. Strengthening of the coordination of emergency humanitarian assistance of the United Nations A/RES/72/133 13/16 17-22357 respect encourages the private sector, civil society and other relevant entities to make relevant contributions, complementary to those of other sources;",
    "52": "Welcomes the important achievements of the Central Emergency Response Fund in ensuring a more timely and predictable response to humanitarian emergencies, stresses the importance of continuing to improve the functioning of the Fund, and in this regard encourages the United Nations funds and programmes and the specialized agencies to review and evaluate, where necessary, their partnership policies and practices in order to ensure the timely disbursement of funds from the Fund to implementing partners in order to ensure that resources are used in the most efficient, effective, accountable and transparent manner possible;",
    "53": "Calls upon all Member States, and invites the private sector and all concerned individuals and institutions, to consider increasing their voluntary contributions to the Central Emergency Response Fund in order to achieve an annual funding level of 1 billion United States dollars by 2018 and to continue to reinforce and strengthen the Fund as the global emergency response fund, and emphasizes the need to broaden and diversify the income base of the Fund and that contributions should be additional to current commitments to humanitarian programming and should not be to the detriment of resources made available for international cooperation for development;",
    "54": "Encourages Member States, the private sector and all relevant individuals and institutions to consider increasing their voluntary contributions to country-based pooled funds and, as appropriate, other pooled funding mechanisms, to facilitate humanitarian assistance to people in need;",
    "55": "Calls upon Member States that are in a position to do so and development and humanitarian partners, in their efforts to provide flexible resources, to consider ways of better mainstreaming the need for preparedness and building resilience in the provision of humanitarian and development assistance, including reconstruction and rehabilitation, inter alia, with a view to ensuring smooth transition from relief to development;",
    "56": "Calls upon all Member States that are in a position to do so to increase their voluntary contributions to humanitarian emergencies, including through flexible, unearmarked and multi-year funding where possible, in this context reiterates that the Office for the Coordination of Humanitarian Affairs should benefit from adequate and more predictable funding, and underscores the importance of adequate, timely and flexible voluntary funding for the Office to enable it to carry out its mandate;",
    "57": "Encourages Member States, in cooperation with relevant United Nations humanitarian organizations, to ensure that the basic humanitarian needs of affected populations, including clean water, food, shelter, health, including sexual and reproductive health, education and protection, energy and information and communications technologies, where possible, are addressed as components of humanitarian response, including through providing timely and adequate resources, while ensuring that their collaborative efforts fully adhere to humanitarian principles;",
    "58": "Also encourages Member States, in cooperation with relevant United Nations humanitarian organizations, to ensure that women and girls have access to basic health-care services, including reliable and safe access to sexual and reproductive health-care services and psychosocial support, from the onset of emergencies, in this regard recognizes that such assistance protects women, adolescent girls and infants from preventable mortality and morbidity that occur in humanitarian emergencies, and calls upon Member States, the United Nations and other relevant actors to give such programmes due consideration; A/RES/72/133 Strengthening of the coordination of emergency humanitarian assistance of the United Nations 17-22357 14/16",
    "59": "Encourages Member States, the United Nations and humanitarian organizations to continue to work together to understand and address the different protection needs of affected populations, particularly the most vulnerable, in humanitarian crises and ensure that these needs are adequately integrated into preparedness, response and recovery efforts;",
    "60": "Calls upon Member States and relevant organizations and actors to recognize and address the consequences of humanitarian emergencies for migrants, in particular those in vulnerable situations, and to strengthen coordinated international efforts for their assistance and protection in concert with national authorities;",
    "61": "Calls upon Member States to take steps to ensure the international protection of and respect for the rights of refugees, including respect for the principle of non-refoulement and adequate standards of treatment in accordance with international law, including, as applicable, the 1951 Convention relating to the Status of Refugees12 and international human rights obligations;",
    "62": "Recognizes the importance of early registration and effective registration systems as a tool of protection and as a means of carrying out the quantification and assessment of needs for the provision and distribution of humanitarian assistance, notes the many and diverse challenges faced by refugees who remain without any form of documentation attesting to their status, and underlines the importance of increasing accountability to ensure that humanitarian assistance reaches its beneficiaries;",
    "63": "Reaffirms the obligation of all States and parties to an armed conflict to protect civilians, in accordance with international humanitarian law, encourages States that are parties to an armed conflict to take all measures necessary to enhance the protection of civilians, and invites all States to promote a culture of protection, taking into account the particular needs of women, children, older persons and persons with disabilities;",
    "64": "Urges Member States to continue to take the steps necessary to ensure the protection of the wounded and sick, as well as the safety and security of medical personnel and humanitarian personnel exclusively engaged in medical duties, their facilities, equipment, transports and supplies, including by developing effective measures to prevent and address acts of violence, attacks and threats against them, and in this regard reaffirms the need for States to ensure that those responsible for violations of international humanitarian law do not operate with impunity, and urges States to conduct full, prompt, impartial and effective investigations within their jurisdiction of violations of international humanitarian law with a view to ensuring accountability, as provided for by national laws and obligations under international law, and to ensure that the wounded and sick receive, to the fullest extent practicable and with the least possible delay, the medical care and attention required;",
    "65": "Also urges Member States to continue to take the steps necessary to ensure the safety and security of humanitarian personnel, their facilities, equipment, transports and supplies, including by developing effective measures to prevent and address acts of violence, attacks and threats against them, requests the Secretary- General to expedite his efforts to enhance the safety and security of personnel involved in United Nations humanitarian operations, and in this regard reaffirms the need for States to ensure that those responsible for violations of international humanitarian law do not operate with impunity, and urges States to conduct, full, prompt, impartial and effective investigations within their jurisdiction of violations __________________ 12 United Nations, Treaty Series, vol. 189, No. 2545. Strengthening of the coordination of emergency humanitarian assistance of the United Nations A/RES/72/133 15/16 17-22357 of international humanitarian law with a view to ensuring accountability, as provided for by national laws and obligations under international law;",
    "66": "Emphasizes the responsibility of States to adopt preventive measures and effective responses to acts of violence committed against civilian populations in armed conflicts and to comply with the relevant obligations under international law to end impunity and to ensure that those responsible are promptly brought to justice, in accordance with national law and their obligations under international law;",
    "67": "Calls upon all States and parties in complex humanitarian emergencies, in particular in armed conflict and in post-conflict situations, in countries in which humanitarian personnel are operating, in conformity with the relevant provisions of international law and national laws, to cooperate fully with the United Nations and other humanitarian agencies and organizations and to ensure the safe and unhindered access of humanitarian personnel, as well as the delivery of supplies and equipment, in order to allow such personnel to efficiently perform their task of assisting affected civilian populations, including refugees and internally displaced persons;",
    "68": "Urges States, while undertaking counter-terrorism activities, to respect their international obligations, including whenever international humanitarian law is applicable, regarding the provision of humanitarian assistance to civilian populations, as well as recognizes the key role humanitarian organizations play in the provision of principled humanitarian assistance, while also recognizing the importance of preventing and suppressing the financing of and other forms of support to terrorism;",
    "69": "Recognizes the Guiding Principles on Internal Displacement 13 as an important international framework for the protection of internally displaced persons, and that forced displacement is not only a humanitarian but also a development challenge, encourages Member States and humanitarian agencies to continue to work together, in collaboration with host communities, in endeavours to provide a more predictable response to the needs of internally displaced persons and in particular to address the long-term nature of displacement by adopting and implementing long- term strategies and coherent multi-year planning, including in relation to issues such as livelihoods, and in this regard calls for continued and enhanced international support, upon request, for the capacity-building efforts of States and encourages humanitarian organizations to improve coordination, including with development organizations, to better address the needs of internally displaced persons in support of Member States to promote durable solutions;",
    "70": "Welcomes the progress made towards further enhancing the security management system of the United Nations, and supports the approach taken by the Secretary-General to focus the efforts of the security management system on enabling the United Nations system to \u201cstay and deliver\u201d its most critical programmes even in high-risk environments by effectively managing the risks to which personnel are exposed, including in the provision of humanitarian assistance, and to adapt quickly to changes in local security conditions;",
    "71": "Encourages the United Nations and other relevant humanitarian actors to include, as part of their risk management strategy, the building of good relations and trust with national and local governments and to promote acceptance by local communities and all relevant actors in order to enable humanitarian assistance to be provided in accordance with humanitarian principles;",
    "72": "Requests the Secretary-General to report on actions taken to enable the United Nations to continue to strengthen its ability to recruit and deploy staff quickly, effectively and flexibly, to procure emergency relief materials and services rapidly, cost-effectively and locally, where applicable, and to quickly disburse funds in order __________________ 13 E/CN.4/1998/53/Add.2, annex. A/RES/72/133 Strengthening of the coordination of emergency humanitarian assistance of the United Nations 17-22357 16/16 to support Governments and United Nations country teams in the coordination of international humanitarian assistance;",
    "73": "Takes note of the World Humanitarian Summit, held in Istanbul, Turkey, on 23 and 24 May 2016, and also takes note of the report of the Secretary-General on the outcome of the World Humanitarian Summit;14",
    "74": "Urges all countries to integrate into their respective national policies and development frameworks the 2030 Agenda for Sustainable Development, 15 which includes a comprehensive, far-reaching and people-centred set of universal and transformative Sustainable Development Goals and targets, and urges Member States, the United Nations and relevant stakeholders to work together to reduce the needs and build the resilience of the most vulnerable in order to contribute to the achievement of the Goals included in the 2030 Agenda, including the call to leave no one behind;",
    "75": "Requests the Secretary-General to report to the General Assembly at its seventy-third session, through the Economic and Social Council at its 2018 session, on progress made in strengthening the coordination of emergency humanitarian assistance of the United Nations, and to submit a report to the Assembly on the detailed use of the Central Emergency Response Fund. 70th plenary meeting 11 December 2017 __________________ 14 A/71/353. 15 Resolution 70/1."
  },
  "agenda_items": [
    "Item 73"
  ],
  "symbol_references": [
    "A/72/L.24"
  ]
}