{
  "symbol": "A/RES/79/20",
  "filename": "A_RES_79_20.pdf",
  "title": "79/20. No first placement of weapons in outer space",
  "text": "United Nations \nA/RES/79/20\n \n \nGeneral Assembly \nDistr.: General \n9 December 2024 \n \n24-23018 (E) \n*2423018* \n \n \nSeventy-ninth session \nAgenda item 96 (b) \nPrevention of an arms race in outer space: no first \nplacement of weapons in outer space \n \n \n \n \n Resolution adopted by the General Assembly \non 2 December 2024 \n \n \n \n \n[on the report of the First Committee (A/79/406, para. 20)] \n \n \n \n79/20. No first placement of weapons in outer space \n \n \n \nThe General Assembly, \n \nRecalling its resolutions 69/32 of 2 December 2014, 70/27 of 7 December 2015, \n71/32 of 5 December 2016, 72/27 of 4 December 2017, 73/31 of 5 December 2018, \n74/33 of 12 December 2019, 75/37 of 7 December 2020, 76/23 of 6 December 2021, \n77/42 of 7 December 2022 and 78/21 of 4 December 2023, and its resolutions 45/55 B \nof 4 December 1990 and 48/74 B of 16 December 1993, which, inter alia, confirm the \nimportance of transparency and confidence-building measures as a means conducive to \nensuring the attainment of the objective of preventing an arms race in outer space, \n \nRecognizing the common interest of all humankind in the exploration and use \nof outer space for peaceful purposes, \n \nSeriously concerned about the possibility of an arms race in outer space and of \nouter space turning into an arena for military confrontation, and bearing in mind the \nimportance of articles III and IV of the Treaty on Principles Governing the Activities \nof States in the Exploration and Use of Outer Space, including the Moon and Other \nCelestial Bodies,1 \n \nConscious that the prevention of an arms race in outer space would avert a grave \ndanger to international peace and security, \n \nReaffirming that practical measures should be examined and taken in the search \nfor agreements to prevent an arms race in outer space in a common effort towards a \ncommunity of shared future for humankind, \n \nEmphasizing the paramount importance of strict compliance with the existing \nlegal regime providing for the peaceful use of outer space, \n__________________ \n \n1  United Nations, Treaty Series, vol. 610, No. 8843. \n\nA/RES/79/20 \nNo first placement of weapons in outer space\n \n24-23018\n2/3 \n \n \nReaffirming its recognition that the legal regime applicable to outer space by \nitself does not guarantee prevention of an arms race in outer space and that there is a \nneed to consolidate and reinforce that regime, \n \nConvinced that such measures could critically improve conditions for efficiently \naddressing the threat of an arms race in outer space, including the placement of \nweapons in outer space, \n \nWelcoming, in this regard, the draft treaty on the prevention of the placement of \nweapons in outer space and of the threat or use of force against outer space objects, \nintroduced by China and the Russian Federation at the Conference on Disarmament \nin 2008,2 and the submission of its updated version in 2014, 3 \n \nConsidering that transparency and confidence-building measures in outer space \nactivities are an integral part of the draft treaty referred to above, \n \nWelcoming the work of the Group of Governmental Experts established under \nresolution 77/250 of 30 December 2022, entitled \u201cFurther practical measures for the \nprevention of an arms race in outer space\u201d, which was tasked with considering and \nmaking recommendations on substantial elements of an international legally binding \ninstrument on the prevention of an arms race in outer space, including, inter alia, on \nthe prevention of the placement of weapons in outer space, and emphasizing that the \nwork of the Group has constituted an important contribution to international efforts \nto conclude the above-mentioned international legally binding instrument, as well as \nto outer space security and the prevention of an arms race in outer space, \n \nWelcoming also the substantive report4 adopted by consensus by the Group of \nGovernmental Experts that could serve as a reference document for further measures \nand appropriate international negotiations on an international legally binding \ninstrument on the prevention of an arms race in outer space, including, inter alia, on \nthe prevention of the placement of weapons in outer space, \n \nWelcoming further the establishment for the period 2024\u20132028 of an open-ended \nworking group, which is tasked with continuing to build on the work of the Group of \nGovernmental Experts to consider and make recommendations on substantial \nelements of an international legally binding instrument on the prevention of an arms \nrace in outer space, including, inter alia, on the prevention of the placement of \nweapons in outer space, as well as with considering various aspects of the prevention \nof an arms race in outer space in the context of an international legally binding \ninstrument on the prevention of an arms race in outer space, \n \nStressing the importance of the political statements made by a number of States 5 \nthat they would not be the first to place weapons in outer space, \n \n1. \nReaffirms the importance and urgency of the objective of preventing an \narms race in outer space and the willingness of States to contribute to reaching this \ncommon goal; \n \n2. \nReiterates that the Conference on Disarmament, as the single multilateral \nnegotiating forum on this subject, 6  has the primary role in the negotiation of a \n__________________ \n \n2  See CD/1839. \n \n3  See CD/1985. \n \n4  A/79/364. \n \n5  Argentina, Armenia, Belarus, Bolivia (Plurinational State of), Brazil, Burkina Faso, Burundi, \nCambodia, Comoros, Congo, Cuba, Ecuador, Guatemala, Indonesia, Kazakhstan, Kyrgyzstan, \nLao People\u2019s Democratic Republic, Mali, Myanmar, Nicaragua, Pakistan, Russian Federation, \nSeychelles, Sierra Leone, Sri Lanka, Suriname, Syrian Arab Republic, Tajikistan, Togo, \nTurkmenistan, Uganda, Uruguay, Uzbekistan, Venezuela (Bolivarian Republic of) and Viet Nam.  \n \n6  See resolution S-10/2. \n\nNo first placement of weapons in outer space \nA/RES/79/20\n \n3/3\n24-23018 \n \nmultilateral agreement, or agreements, as appropriate, on the prevention of an arms \nrace in outer space in all its aspects; \n \n3. \nUrges an early commencement of substantive work based on the updated \ndraft treaty on the prevention of the placement of weapons in outer space and of the \nthreat or use of force against outer space objects, introduced by China and the Russian \nFederation at the Conference on Disarmament in 2008, under the agenda item entitled \n\u201cPrevention of an arms race in outer space\u201d; \n \n4. \nStresses that, while such an agreement is not yet concluded, other measures \nmay contribute to ensuring that weapons are not placed in outer space; \n \n5. \nSupports the efforts aimed at globalizing the international initiative not to \nbe the first to place weapons of any kind in outer space; \n \n6. \nEncourages all States, especially spacefaring nations, to consider the \npossibility of upholding, as appropriate, a political commitment not to be the first to \nplace weapons in outer space; \n \n7. \nDecides to include in the provisional agenda of its eightieth session, under \nthe item entitled \u201cPrevention of an arms race in outer space\u201d, the sub-item entitled \n\u201cNo first placement of weapons in outer space\u201d. \n \n43rd plenary meeting \n2 December 2024 \n \n",
  "paragraphs": {
    "1": "Reaffirms the importance and urgency of the objective of preventing an arms race in outer space and the willingness of States to contribute to reaching this common goal;",
    "2": "Reiterates that the Conference on Disarmament, as the single multilateral negotiating forum on this subject, 6 has the primary role in the negotiation of a __________________ 2 See CD/1839. 3 See CD/1985. 4 A/79/364. 5 Argentina, Armenia, Belarus, Bolivia (Plurinational State of), Brazil, Burkina Faso, Burundi, Cambodia, Comoros, Congo, Cuba, Ecuador, Guatemala, Indonesia, Kazakhstan, Kyrgyzstan, Lao People\u2019s Democratic Republic, Mali, Myanmar, Nicaragua, Pakistan, Russian Federation, Seychelles, Sierra Leone, Sri Lanka, Suriname, Syrian Arab Republic, Tajikistan, Togo, Turkmenistan, Uganda, Uruguay, Uzbekistan, Venezuela (Bolivarian Republic of) and Viet Nam. 6 See resolution S-10/2. No first placement of weapons in outer space A/RES/79/20 3/3 24-23018 multilateral agreement, or agreements, as appropriate, on the prevention of an arms race in outer space in all its aspects;",
    "3": "Urges an early commencement of substantive work based on the updated draft treaty on the prevention of the placement of weapons in outer space and of the threat or use of force against outer space objects, introduced by China and the Russian Federation at the Conference on Disarmament in 2008, under the agenda item entitled \u201cPrevention of an arms race in outer space\u201d;",
    "4": "Stresses that, while such an agreement is not yet concluded, other measures may contribute to ensuring that weapons are not placed in outer space;",
    "5": "Supports the efforts aimed at globalizing the international initiative not to be the first to place weapons of any kind in outer space;",
    "6": "Encourages all States, especially spacefaring nations, to consider the possibility of upholding, as appropriate, a political commitment not to be the first to place weapons in outer space;",
    "7": "Decides to include in the provisional agenda of its eightieth session, under the item entitled \u201cPrevention of an arms race in outer space\u201d, the sub-item entitled \u201cNo first placement of weapons in outer space\u201d. 43rd plenary meeting 2 December 2024"
  },
  "agenda_items": [
    "Item 96"
  ],
  "symbol_references": []
}