{
  "symbol": "A/RES/75/184",
  "filename": "A_RES_75_184.pdf",
  "title": "75/184. Missing persons",
  "text": "United Nations \nA/RES/75/184\n \n \nGeneral Assembly \nDistr.: General \n28 December 2020 \n \n20-17328 (E)    050121     \n*2017328* \n \n \nSeventy-fifth session \nAgenda item 72 (b) \nPromotion and protection of human rights: human \nrights questions, including alternative approaches for \nimproving the effective enjoyment of human rights and \nfundamental freedoms  \n \n \n \n \n Resolution adopted by the General Assembly \non 16 December 2020 \n \n \n \n \n[on the report of the Third Committee (A/75/478/Add.2, para. 89)] \n \n \n 75/184. Missing persons \n \n \n \nThe General Assembly, \n \nGuided by the purposes, principles and provisions of the Charter of the United \nNations, \n \nGuided also by the principles and norms of international humanitarian law, in \nparticular the Geneva Conventions of 12 August 19491 and the Additional Protocols \nthereto of 1977,2 as well as international standards of human rights, in particular the \nUniversal Declaration of Human Rights,3 the International Covenant on Economic, \nSocial and Cultural Rights,4 the International Covenant on Civil and Political Rights,5 \nthe Convention on the Elimination of All Forms of Discrimination against Women, 6 \nthe Convention on the Rights of the Child7 and the Vienna Declaration and \nProgramme of Action adopted by the World Conference on Human Rights on 25 June \n1993,8  \n \nRecalling the accession by 63 States to the International Convention for the \nProtection of All Persons from Enforced Disappearance, 9 and calling upon States that \nhave not yet done so to consider signing, ratifying or acceding to it as a matter of \n__________________ \n \n1  United Nations, Treaty Series, vol. 75, Nos. 970\u2013973. \n \n2  Ibid., vol. 1125, Nos. 17512 and 17513. \n \n3  Resolution 217 A (III). \n \n4  See resolution 2200 A (XXI), annex. \n \n5  Ibid. \n \n6  United Nations, Treaty Series, vol. 1249, No. 20378. \n \n7  Ibid., vol. 1577, No. 27531. \n \n8  A/CONF.157/24 (Part I), chap. III. \n \n9  United Nations, Treaty Series, vol. 2716, No. 48088. \n\nA/RES/75/184 \nMissing persons\n \n20-17328\n2/5 \n \npriority, as well as to consider the option provided for in articles 31 and 32 of the \nConvention regarding the Committee on Enforced Disappearances, \n \nRecalling also all previous relevant resolutions on missing persons adopted by \nthe General Assembly, as well as the resolutions and decisions adopted by the \nCommission on Human Rights and the Human Rights Council, \n \nRecalling further General Assembly resolution 73/178 of 17 December 2018 as \nwell as all previous resolutions and decisions adopted by the Commission on Human \nRights and the Human Rights Council on the right to the truth, \n \nNoting with deep concern the growing number of armed conflicts in various \nparts of the world, often resulting in serious violations of international humanitarian \nlaw and international human rights law, \n \nNoting that the issue of persons reported missing in connection with \ninternational or non-international armed conflicts, in particular those who are victims \nof violations of international humanitarian law and international human rights law, \ncontinues to have a negative impact on efforts to put an end to those conflicts and \ninflicts grievous suffering on the families of missing persons, and stressing in this \nregard the need to address the issue from, inter alia, a humanitarian and rule of law \nperspective, \n \nExpressing its concern about the dramatic increase since 2014 in persons \nreported missing in connection with armed conflict, and recognizing that it is critical \nfor States to address the issue holistically, from prevention to the tracing, location, \nidentification and return of missing persons,  \n \nConsidering that the problem of missing persons may raise questions of \ninternational humanitarian law and international human rights law, as appropriate, \n \nBearing in mind that cases of missing persons involve conduct that may \nconstitute criminal offences, and stressing the importance of ending impunity for \nviolations of international humanitarian law and international human rights law with \nrespect to missing persons, \n \nCognizant that States that are parties to an armed conflict have a responsibility \nfor countering the phenomenon of missing persons, taking all appropriate measures \nto prevent persons from going missing, including, when appropriate, effectively \ninvestigating the conditions relating to persons going missing and determining the \nfate of missing persons, and for recognizing their accountability as regards \nimplementing the relevant mechanisms, policies and laws, \n \nBearing in mind the effective search for and identification of missing persons \nusing forensic sciences and other emerging technologies, and recognizing that great \ntechnological progress has been made in this field, including DNA forensic analysis, \nwhich can significantly assist efforts to identify missing persons and to investigate \nviolations of international humanitarian law and international human rights law, \n \nRecognizing that the establishment and effective work of competent national \ninstitutions can play a crucial role in clarifying the fate of missing persons in \nconnection with armed conflict, \n \nBearing in mind that the question of missing persons entails consequences not \nonly for the victims themselves, but also for their families, especially women, \nchildren and older persons, and in this regard recognizing the importance of \naddressing the legal situation of missing persons in connection with armed conflict \nand supporting their family members through national policies that include a gender \nperspective, as appropriate, \n\nMissing persons \nA/RES/75/184\n \n3/5\n20-17328 \n \n \nNoting, in this regard, the progress made by coordination mechanisms, \nestablished in different parts of the world, aiming at exchanging information and \nidentifying missing persons, which have contributed to informing families of the fate \nand whereabouts of their missing relatives, \n \nRecognizing that respect for and implementation of international humanitarian \nlaw can reduce the number of cases of missing persons in armed conflict, and in this \nregard stressing the importance of encouraging greater understanding of and respect \nfor international humanitarian law,  \n \nStressing the importance of measures to prevent persons from going missing in \nconnection with armed conflict, which may include enacting national legislation, \nensuring detainee registration, providing appropriate training for armed forces, \nproducing and providing proper means of identification, the establishment of \ninformation bureaux, grave registration services and registers of deaths and ensuring \naccountability in cases of missing persons, \n \nStressing also the need to raise public awareness of the problem of missing \npersons in connection with armed conflict as an important concern, as well as relevant \nprovisions of international humanitarian law and human rights law, \n \nNoting the Agreement on the Status and Functions of the International \nCommission on Missing Persons, which established the Commission as an \ninternational organization,  \n \nNoting with appreciation the ongoing international and regional efforts to \naddress the question of missing persons and the initiatives undertaken by international \nand regional organizations in this field, \n \nTaking note of the report of the Secretary-General,10 \n \n1. \nUrges States to strictly observe and to respect and ensure respect for the \nrules of international humanitarian law, as set out in the Geneva Conventions of \n12 August 1949 and, where applicable, in the Additional Protocols thereto of 1977; \n \n2. \nCalls upon States parties to an armed conflict to take all appropriate \nmeasures to prevent persons from going missing in connection with the armed \nconflict, to account for persons reported missing as a result of such a situation and, in \ncases of missing persons, to take such measures, as appropriate, in order to ensure \nthorough, prompt, impartial and effective investigations and the prosecution of \noffences linked to missing persons, consistent with their obligations under \ninternational law, with a view to full accountability; \n \n3. \nCalls upon States to take measures to prevent persons from going missing \nin connection with armed conflict, including by fully implementing their obligations \nand commitments under relevant international law; \n \n4. \nUrges States to avoid harm to civilians as an important factor in preventing \npersons from going missing in connection with armed conflict, including in minimizing \nthe military use of civilian infrastructure, in accordance with applicable international law;  \n \n5. \nReaffirms the right of families to know the fate of their relatives reported \nmissing in connection with armed conflict; \n \n6. \nAlso reaffirms that each party to an armed conflict, as soon as \ncircumstances permit and, at the latest, from the end of active hostilities, shall search \nfor persons who have been reported missing by an adverse party; \n \n7. \nCalls upon States that are parties to an armed conflict to take all necessary \nmeasures, in a timely manner, to determine the identity and fate of persons reported \n__________________ \n \n10  A/75/306. \n\nA/RES/75/184 \nMissing persons\n \n20-17328\n4/5 \n \nmissing in connection with the armed conflict, without any adverse distinction, and, \nto the greatest extent possible, to provide their family members, through appropriate \nchannels, with all relevant information that they have on their fate, including their \nwhereabouts or, if they are dead, the circumstances and cause of their death; \n \n8. \nRecognizes the need for appropriate means of identification and for the \ncollection, protection and management of data on missing persons and unidentified \nremains, consistent with applicable international and national law, and urges all \nconcerned States to cooperate with each other and with other concerned actors \nworking in this area by, inter alia, providing all relevant information related to \nmissing persons, including on their fate and whereabouts; \n \n9. \nRequests States to pay the utmost attention to cases of children reported \nmissing in connection with armed conflict and to take appropriate measures to search \nfor and identify those children and to reunite them with their families; \n \n10. Invites States that are parties to an armed conflict to cooperate fully with \nthe International Committee of the Red Cross in establishing the fate of missing \npersons and to adopt a comprehensive approach to this issue, including all such legal \nand practical measures and coordination mechanisms as may be necessary, based on \nhumanitarian considerations only; \n \n11. \nUrges States that are parties to an armed conflict to cooperate, consistent \nwith their international obligations, in order to effectively solve cases of missing \npersons, including by providing mutual assistance in terms of information-sharing, \nvictim assistance, location and identification of missing persons and recovery, \nidentification and return of human remains and, if possible, by identifying, mapping \nand preserving burial sites; \n \n12. Invites States to encourage interaction between competent organizations \nand institutions, such as national commissions on missing persons, which play a \ncrucial role in clarifying the fate of persons missing in connection with armed conflict \nand providing support to the families of the missing; \n \n13. Urges States, and encourages intergovernmental and non-governmental \norganizations, to take all necessary measures at the national, regional and \ninternational levels to address the problem of persons reported missing in connection \nwith armed conflict without any adverse distinction and to provide appropriate \nassistance, as requested by the concerned States, and welcomes in this regard the \nestablishment and efforts of commissions and working groups on missing persons; \n \n14. Calls upon States, without prejudice to their efforts to determine the fate \nof persons reported missing in connection with armed conflict, to take appropriate \nsteps with regard to the legal situation of missing persons and the individual needs \nand accompaniment of their family members, with particular attention to the needs of \nwomen, children and older persons, in such fields as social welfare, psychological \nand psychosocial support, financial matters, family law and property rights; \n \n15. Invites States, national institutions and, as appropriate, intergovernmental, \ninternational and non-governmental organizations to further their engagement in \norder to follow forensic best practices as they apply to preventing and resolving cases \nof missing persons in connection with armed conflict; \n \n16. \nAlso invites States, national institutions and, as appropriate, intergovernmental, \ninternational and non-governmental organizations to exchange best practices and \ntechnical recommendations pertaining, inter alia, to the search for and clarification of \nthe fate and whereabouts of missing persons, the use and development of digital tools, \nforensic analysis and identification and addressing the needs of families;  \n\nMissing persons \nA/RES/75/184\n \n5/5\n20-17328 \n \n \n17. Further invites States, national institutions and, as appropriate, \nintergovernmental, international and non-governmental organizations to ensure the \ndevelopment and proper management of archives pertaining to missing persons and \nunidentified remains in connection with armed conflict, as well as access to those \narchives, in accordance with relevant applicable laws and regulations; \n \n18. Stresses the need to address the issue of missing persons as a part of peace \nand peacebuilding processes, with reference to all justice and rule of law mechanisms, \nincluding the judiciary, parliamentary commissions and truth-finding mechanisms, on \nthe basis of transparency, accountability and public involvement and participation; \n \n19. Welcomes the progress made in clarifying the fate of missing persons in \nconnection with armed conflict; \n \n20. Invites relevant human rights mechanisms and procedures, as appropriate, \nto address the problem of persons reported missing in connection with armed conflict \nin their forthcoming reports to the General Assembly; \n \n21. Requests the Secretary-General to continue to seek further the views of \nMember States and relevant agencies and to submit to the Human Rights Council at \nits relevant session and to the General Assembly at its seventy-seventh session a \ncomprehensive report on the implementation of the present resolution, including \nrelevant practical recommendations; \n \n22. Also requests the Secretary-General to bring the present resolution to the \nattention of all Governments, the competent United Nations bodies, the specialized \nagencies, regional intergovernmental organizations and international humanitarian \norganizations; \n \n23. Decides to consider the question at its seventy-seventh session.  \n \n46th plenary meeting \n16 December 2020 \n \n \n",
  "paragraphs": {
    "1": "Urges States to strictly observe and to respect and ensure respect for the rules of international humanitarian law, as set out in the Geneva Conventions of 12 August 1949 and, where applicable, in the Additional Protocols thereto of 1977;",
    "2": "Calls upon States parties to an armed conflict to take all appropriate measures to prevent persons from going missing in connection with the armed conflict, to account for persons reported missing as a result of such a situation and, in cases of missing persons, to take such measures, as appropriate, in order to ensure thorough, prompt, impartial and effective investigations and the prosecution of offences linked to missing persons, consistent with their obligations under international law, with a view to full accountability;",
    "3": "Calls upon States to take measures to prevent persons from going missing in connection with armed conflict, including by fully implementing their obligations and commitments under relevant international law;",
    "4": "Urges States to avoid harm to civilians as an important factor in preventing persons from going missing in connection with armed conflict, including in minimizing the military use of civilian infrastructure, in accordance with applicable international law;",
    "5": "Reaffirms the right of families to know the fate of their relatives reported missing in connection with armed conflict;",
    "6": "Also reaffirms that each party to an armed conflict, as soon as circumstances permit and, at the latest, from the end of active hostilities, shall search for persons who have been reported missing by an adverse party;",
    "7": "Calls upon States that are parties to an armed conflict to take all necessary measures, in a timely manner, to determine the identity and fate of persons reported __________________ 10 A/75/306. A/RES/75/184 Missing persons 20-17328 4/5 missing in connection with the armed conflict, without any adverse distinction, and, to the greatest extent possible, to provide their family members, through appropriate channels, with all relevant information that they have on their fate, including their whereabouts or, if they are dead, the circumstances and cause of their death;",
    "8": "Recognizes the need for appropriate means of identification and for the collection, protection and management of data on missing persons and unidentified remains, consistent with applicable international and national law, and urges all concerned States to cooperate with each other and with other concerned actors working in this area by, inter alia, providing all relevant information related to missing persons, including on their fate and whereabouts;",
    "9": "Requests States to pay the utmost attention to cases of children reported missing in connection with armed conflict and to take appropriate measures to search for and identify those children and to reunite them with their families;",
    "10": "Invites States that are parties to an armed conflict to cooperate fully with the International Committee of the Red Cross in establishing the fate of missing persons and to adopt a comprehensive approach to this issue, including all such legal and practical measures and coordination mechanisms as may be necessary, based on humanitarian considerations only;",
    "11": "Urges States that are parties to an armed conflict to cooperate, consistent with their international obligations, in order to effectively solve cases of missing persons, including by providing mutual assistance in terms of information-sharing, victim assistance, location and identification of missing persons and recovery, identification and return of human remains and, if possible, by identifying, mapping and preserving burial sites;",
    "12": "Invites States to encourage interaction between competent organizations and institutions, such as national commissions on missing persons, which play a crucial role in clarifying the fate of persons missing in connection with armed conflict and providing support to the families of the missing;",
    "13": "Urges States, and encourages intergovernmental and non-governmental organizations, to take all necessary measures at the national, regional and international levels to address the problem of persons reported missing in connection with armed conflict without any adverse distinction and to provide appropriate assistance, as requested by the concerned States, and welcomes in this regard the establishment and efforts of commissions and working groups on missing persons;",
    "14": "Calls upon States, without prejudice to their efforts to determine the fate of persons reported missing in connection with armed conflict, to take appropriate steps with regard to the legal situation of missing persons and the individual needs and accompaniment of their family members, with particular attention to the needs of women, children and older persons, in such fields as social welfare, psychological and psychosocial support, financial matters, family law and property rights;",
    "15": "Invites States, national institutions and, as appropriate, intergovernmental, international and non-governmental organizations to further their engagement in order to follow forensic best practices as they apply to preventing and resolving cases of missing persons in connection with armed conflict;",
    "16": "Also invites States, national institutions and, as appropriate, intergovernmental, international and non-governmental organizations to exchange best practices and technical recommendations pertaining, inter alia, to the search for and clarification of the fate and whereabouts of missing persons, the use and development of digital tools, forensic analysis and identification and addressing the needs of families; Missing persons A/RES/75/184 5/5 20-17328",
    "17": "Further invites States, national institutions and, as appropriate, intergovernmental, international and non-governmental organizations to ensure the development and proper management of archives pertaining to missing persons and unidentified remains in connection with armed conflict, as well as access to those archives, in accordance with relevant applicable laws and regulations;",
    "18": "Stresses the need to address the issue of missing persons as a part of peace and peacebuilding processes, with reference to all justice and rule of law mechanisms, including the judiciary, parliamentary commissions and truth-finding mechanisms, on the basis of transparency, accountability and public involvement and participation;",
    "19": "Welcomes the progress made in clarifying the fate of missing persons in connection with armed conflict;",
    "20": "Invites relevant human rights mechanisms and procedures, as appropriate, to address the problem of persons reported missing in connection with armed conflict in their forthcoming reports to the General Assembly;",
    "21": "Requests the Secretary-General to continue to seek further the views of Member States and relevant agencies and to submit to the Human Rights Council at its relevant session and to the General Assembly at its seventy-seventh session a comprehensive report on the implementation of the present resolution, including relevant practical recommendations;",
    "22": "Also requests the Secretary-General to bring the present resolution to the attention of all Governments, the competent United Nations bodies, the specialized agencies, regional intergovernmental organizations and international humanitarian organizations;",
    "23": "Decides to consider the question at its seventy-seventh session. 46th plenary meeting 16 December 2020"
  },
  "agenda_items": [
    "Item 72"
  ],
  "symbol_references": []
}