{
  "symbol": "A/RES/73/131",
  "filename": "A_RES_73_131.pdf",
  "title": "73/131. Scope, modalities, format and organization of the high-level meeting on universal health coverage",
  "text": "United Nations \nA/RES/73/131\n \n \nGeneral Assembly \nDistr.: General \n9 January 2019 \n \n18-21866 (E)    110119 \n*1821866* \n \n \nSeventy-third session \nAgenda item 129 \n \n \n \n \n Resolution adopted by the General Assembly \non 13 December 2018 \n \n \n \n \n[without reference to a Main Committee (A/73/L.37)] \n \n \n 73/131. Scope, modalities, format and organization of the high-level \nmeeting on universal health coverage \n \n \n \nThe General Assembly, \n \nRecognizing that, through the adoption of the 2030 Agenda for Sustainable \nDevelopment1 and its Sustainable Development Goals in September 2015, Heads of \nState and Government made a bold commitment to achieve universal health coverage \nby 2030, including financial risk protection, access to quality essential health-care \nservices and access to safe, effective, quality and affordable essential medicines and \nvaccines for all,  \n \nRecalling its resolution 71/159 of 15 December 2016, entitled \u201cGlobal health \nand foreign policy: health employment and economic growth\u201d, which underlined the \nprimary responsibility of Member States to accelerate the transition towards universal \nhealth coverage,  \n \nRecalling also its resolution 72/139 of 12 December 2017, entitled \u201cGlobal \nhealth and foreign policy: addressing the health of the most vulnerable for an \ninclusive society\u201d, in which it decided to hold a high-level meeting in 2019 on \nuniversal health coverage, \n \nRecalling further its resolution 67/81 of 12 December 2012, entitled \u201cGlobal \nhealth and foreign policy\u201d, in which it recognized the responsibility of Governments \nto urgently and significantly scale up efforts to accelerate the transition towards \nuniversal access to affordable and quality health-care services, and that effective and \nfinancially sustainable implementation of universal health coverage is based on a \nresilient and responsive health system, and reaffirming the primary responsibility of \nMember States to determine and promote their own paths towards achieving universal \nhealth coverage,  \n__________________ \n \n1  Resolution 70/1. \n\nA/RES/73/131 \nScope, modalities, format and organization of the\nhigh-level meeting on universal health coverage\n \n18-21866\n2/4 \n \n \nRecalling its resolution 72/138 of 12 December 2017, entitled \u201cInternational \nUniversal Health Coverage Day\u201d, in which it decided to proclaim 12 December as \nInternational Universal Health Coverage Day,  \n \nRecognizing that health is a precondition for and an outcome and indicator of \nall three dimensions \u2014 economic, social and environmental \u2014 of sustainable \ndevelopment and that, despite progress made, challenges in global health, including \nmajor inequities and vulnerabilities within and among countries, regions and \npopulations, still remain and demand persistent attention,  \n \nEmphasizing the need for the high-level meeting to complement and build on \npreceding and ongoing health processes and initiatives, including the high-level \nmeeting on HIV/AIDS held in New York from 8 to 10 June 2016 and the high-level \nmeeting on antimicrobial resistance held in New York on 21 September 2016, as well \nas the high-level meeting on the fight against tuberculosis and the third high-level \nmeeting of the General Assembly on the prevention and control of non-communicable \ndiseases, convened in New York on 26 and 27 September 2018, respectively, \n \nWelcoming the convening of the Global Conference on Primary Health Care, on \nachieving universal health coverage and the Sustainable Development Goals, held in \nAstana on 25 and 26 October 2018, in celebration of the fortieth anniversary of the \nDeclaration of Alma-Ata, which may contribute to the debates of the high-level \nmeeting of the General Assembly on universal health coverage, \n \n1. \nDecides that the one-day high-level meeting on universal health coverage \nto be convened by the President of the General Assembly shall be held in New York \na day before the start of the general debate of the Assembly at its seventy-fourth \nsession, from 9 a.m. to 1 p.m. and from 3 to 6 p.m., and consist of an opening segment, \na plenary segment for general discussion, two multi-stakeholder panels and a brief \nclosing segment;  \n \n2. \nAlso decides that the overall theme of the high-level meeting will be \n\u201cUniversal health coverage: moving together to build a healthier world\u201d; \n \n3. \nFurther decides that: \n \n(a) \nThe opening segment, to be held from 9 to 9.30 a.m., will feature \nstatements by the President of the General Assembly at its seventy-fourth session, the \nSecretary-General, the Director General of the World Health Organization, the \nPresident of the World Bank Group, as well as an eminent high-level champion of \nuniversal health coverage, selected, in consultation with Member States, by the \nPresident of the Assembly, giving due consideration to gender equity;  \n \n(b) \nThe plenary segment, to be held from 9.30 a.m. to 1 p.m. and from 3 to \n5.30 p.m., will comprise statements by Member States and observers of the General \nAssembly; a list of speakers will be established in accordance with established \npractices of the Assembly, and the time limits for these statements will be three \nminutes for individual delegations and five minutes for statements made on behalf of \na group of States;  \n \n(c) \nThe closing segment, to be held from 5.30 to 6 p.m., will comprise \nsummaries of the multi-stakeholder panels and concluding remarks by the President \nof the General Assembly;  \n \n4. \nDecides \nthat \nthe \norganizational \narrangements \nfor \nthe \ntwo \nmulti-stakeholder panels will be as follows: \n \n(a) \nTwo multi-stakeholder panels will be held in parallel to the plenary \nsegment, one from 11 a.m. to 1 p.m. and the other from 3 to 5 p.m.;  \n\nScope, modalities, format and organization of the \nhigh-level meeting on universal health coverage \nA/RES/73/131\n \n3/4\n18-21866 \n \n \n(b) \nEach of the two multi-stakeholder panels will be co-chaired by two \nrepresentatives, one from a developed country and one from a developing country, to \nbe appointed by the President of the General Assembly from among the Heads of \nState or Government attending the high-level meeting, in consultation with Member \nStates, taking into account gender equity, level of development and geographical \nrepresentation;  \n \n(c) \nThe themes of the multi-stakeholder panels will take into consideration the \ndirection and outcomes of other preceding health processes and initiatives, as well as \nthe interactive multi-stakeholder hearing, with a view to ensuring the most effective \nand efficient outcomes and potential deliverables and to sharing experiences and \nlessons learned to address remaining implementation gaps;  \n \n(d) \nThe President of the General Assembly may invite parliamentarians, local \ngovernments, the heads or senior representatives of relevant United Nations entities, \nincluding the World Bank, development partners, civil society, the private sector, \nacademia, medical associations, indigenous leadership and community organizations \nto serve as speakers on the panels, taking into account gender equity, level of \ndevelopment and geographical representation;  \n \n5. \nAlso decides that the high-level meeting shall approve a concise and \naction-oriented political declaration, agreed in advance by consensus through \nintergovernmental negotiations, to be submitted by the President of the General \nAssembly for adoption by the Assembly;  \n \n6. \nRequests the President of the General Assembly, with the support of the \nWorld Health Organization and other relevant partners, to organize and preside over \nan interactive multi-stakeholder hearing, before the end of July 2019, with the active \nparticipation of appropriate senior-level representatives of Member States, observers \nof the General Assembly, parliamentarians, representatives of local government, \nrelevant United Nations entities, non-governmental organizations in consultative \nstatus with the Economic and Social Council, invited civil society organizations, \nphilanthropic foundations, academia, medical associations, the private sector and \nbroader communities, ensuring the participation and voices of women, children, youth \nand indigenous leadership, as part of the preparatory process for the high-level \nmeeting, and also requests the President to prepare a summary of the hearing prior to \nthe high-level meeting;  \n \n7. \nEncourages all Member States to participate in the high-level meeting, \nincluding the multi-stakeholder panels, at the highest possible level, preferably at the \nlevel of Heads of State and Government, and invites all observers of the General \nAssembly to be represented at the highest possible level;  \n \n8. \nInvites the United Nations system, including funds, programmes and \nspecialized agencies, including the World Health Organization, regional commissions \nand relevant envoys of the Secretary-General, to participate in the high-level meeting, \nas appropriate, and urges them to consider relevant initiatives, such as the \nInternational Health Partnership for UHC2030, in support of the preparatory process \nand the meeting, particularly with regard to sharing evidence and good practices, \nchallenges and lessons learned;  \n \n9. \nInvites the Inter-Parliamentary Union to contribute to the high-level \nmeeting;  \n \n10. Invites non-governmental organizations with relevant expertise that are in \nconsultative status with the Economic and Social Council to register with the \nSecretariat to attend the meeting and the interactive multi-stakeholder hearing;  \n\nA/RES/73/131 \nScope, modalities, format and organization of the\nhigh-level meeting on universal health coverage\n \n18-21866\n4/4 \n \n \n11. \nRequests the President of the General Assembly to draw up a list of other \nrelevant representatives of relevant non-governmental organizations, civil society \norganizations, academic institutions and the private sector who may attend the high-\nlevel meeting and participate in the interactive multi-stakeholder hearing and the \nmulti-stakeholder panels, taking into account the principles of transparency and \nequitable geographical representation, with due regard to the meaningful participation \nof women, and to submit the list to Member States for their consideration on a \nnon-objection basis;2 \n \n12. Invites members of civil society, non-governmental organizations, the \nprivate sector, academia, development partners and other relevant initiatives to make \na fundamental contribution to the process in terms of raising awareness of the \nimportance of universal health coverage and its contribution towards the achievement \nof the Sustainable Development Goals;1  \n \n13. Encourages Member States to consider including in their national \ndelegations ministers from all relevant ministries, as appropriate, as well as \nrepresentatives such as parliamentarians, mayors and governors, representatives of \ncivil society, including non-governmental organizations, indigenous leadership, \ncommunity organizations and faith-based organizations, academia, philanthropic \nfoundations, the private sector and universal health coverage networks, with due \nregard to gender equity;  \n \n14. Requests the President of the General Assembly at its seventy-third session \nto finalize the organizational arrangements for the high-level meeting, in close \nconsultation with Member States, including the themes of the multi-stakeholder \npanels in line with paragraph 4 (c) of the present resolution. \n \n52nd plenary meeting  \n13 December 2018 \n \n__________________ \n \n2  The list of proposed as well as final names will be brought to the attention of the General \nAssembly. Where a name is objected to, the objecting Member State will, on a voluntary basis, \nmake known to the Office of the President of the General Assembly the general basis of its \nobjections and the Office will share any information received with any Member State upon its \nrequest. \n",
  "paragraphs": {
    "1": "Decides that the one-day high-level meeting on universal health coverage to be convened by the President of the General Assembly shall be held in New York a day before the start of the general debate of the Assembly at its seventy-fourth session, from 9 a.m. to 1 p.m. and from 3 to 6 p.m., and consist of an opening segment, a plenary segment for general discussion, two multi-stakeholder panels and a brief closing segment;",
    "2": "Also decides that the overall theme of the high-level meeting will be \u201cUniversal health coverage: moving together to build a healthier world\u201d;",
    "3": "Further decides that: (a) The opening segment, to be held from 9 to 9.30 a.m., will feature statements by the President of the General Assembly at its seventy-fourth session, the Secretary-General, the Director General of the World Health Organization, the President of the World Bank Group, as well as an eminent high-level champion of universal health coverage, selected, in consultation with Member States, by the President of the Assembly, giving due consideration to gender equity; (b) The plenary segment, to be held from 9.30 a.m. to 1 p.m. and from 3 to 5.30 p.m., will comprise statements by Member States and observers of the General Assembly; a list of speakers will be established in accordance with established practices of the Assembly, and the time limits for these statements will be three minutes for individual delegations and five minutes for statements made on behalf of a group of States; (c) The closing segment, to be held from 5.30 to 6 p.m., will comprise summaries of the multi-stakeholder panels and concluding remarks by the President of the General Assembly;",
    "4": " (b) Each of the two multi-stakeholder panels will be co-chaired by two representatives, one from a developed country and one from a developing country, to be appointed by the President of the General Assembly from among the Heads of State or Government attending the high-level meeting, in consultation with Member States, taking into account gender equity, level of development and geographical representation; (c) The themes of the multi-stakeholder panels will take into consideration the direction and outcomes of other preceding health processes and initiatives, as well as the interactive multi-stakeholder hearing, with a view to ensuring the most effective and efficient outcomes and potential deliverables and to sharing experiences and lessons learned to address remaining implementation gaps; (d) The President of the General Assembly may invite parliamentarians, local governments, the heads or senior representatives of relevant United Nations entities, including the World Bank, development partners, civil society, the private sector, academia, medical associations, indigenous leadership and community organizations to serve as speakers on the panels, taking into account gender equity, level of development and geographical representation;",
    "5": "Also decides that the high-level meeting shall approve a concise and action-oriented political declaration, agreed in advance by consensus through intergovernmental negotiations, to be submitted by the President of the General Assembly for adoption by the Assembly;",
    "6": "Requests the President of the General Assembly, with the support of the World Health Organization and other relevant partners, to organize and preside over an interactive multi-stakeholder hearing, before the end of July 2019, with the active participation of appropriate senior-level representatives of Member States, observers of the General Assembly, parliamentarians, representatives of local government, relevant United Nations entities, non-governmental organizations in consultative status with the Economic and Social Council, invited civil society organizations, philanthropic foundations, academia, medical associations, the private sector and broader communities, ensuring the participation and voices of women, children, youth and indigenous leadership, as part of the preparatory process for the high-level meeting, and also requests the President to prepare a summary of the hearing prior to the high-level meeting;",
    "7": "Encourages all Member States to participate in the high-level meeting, including the multi-stakeholder panels, at the highest possible level, preferably at the level of Heads of State and Government, and invites all observers of the General Assembly to be represented at the highest possible level;",
    "8": "Invites the United Nations system, including funds, programmes and specialized agencies, including the World Health Organization, regional commissions and relevant envoys of the Secretary-General, to participate in the high-level meeting, as appropriate, and urges them to consider relevant initiatives, such as the International Health Partnership for UHC2030, in support of the preparatory process and the meeting, particularly with regard to sharing evidence and good practices, challenges and lessons learned;",
    "9": "Invites the Inter-Parliamentary Union to contribute to the high-level meeting;",
    "10": "",
    "11": "Requests the President of the General Assembly to draw up a list of other relevant representatives of relevant non-governmental organizations, civil society organizations, academic institutions and the private sector who may attend the high- level meeting and participate in the interactive multi-stakeholder hearing and the multi-stakeholder panels, taking into account the principles of transparency and equitable geographical representation, with due regard to the meaningful participation of women, and to submit the list to Member States for their consideration on a non-objection basis;2",
    "12": "Invites members of civil society, non-governmental organizations, the private sector, academia, development partners and other relevant initiatives to make a fundamental contribution to the process in terms of raising awareness of the importance of universal health coverage and its contribution towards the achievement of the Sustainable Development Goals;1",
    "13": "Encourages Member States to consider including in their national delegations ministers from all relevant ministries, as appropriate, as well as representatives such as parliamentarians, mayors and governors, representatives of civil society, including non-governmental organizations, indigenous leadership, community organizations and faith-based organizations, academia, philanthropic foundations, the private sector and universal health coverage networks, with due regard to gender equity;",
    "14": "Requests the President of the General Assembly at its seventy-third session to finalize the organizational arrangements for the high-level meeting, in close consultation with Member States, including the themes of the multi-stakeholder panels in line with paragraph 4 (c) of the present resolution."
  },
  "agenda_items": [
    "Item 129"
  ],
  "symbol_references": [
    "A/73/L.37"
  ]
}