{
  "symbol": "A/RES/73/25",
  "filename": "A_RES_73_25.pdf",
  "title": "73/25. International Day of Education",
  "text": "United Nations \nA/RES/73/25\n \n \nGeneral Assembly \nDistr.: General \n6 December 2018 \n \n18-20839 (E)    101218 \n*1820839* \n \n \nSeventy-third session \nAgenda item 14 \n \n \n \n \n Resolution adopted by the General Assembly \non 3 December 2018 \n \n \n \n \n[without reference to a Main Committee (A/73/L.39 and A/73/L.39/Add.1)] \n \n \n \n73/25. International Day of Education  \n \n \n \nThe General Assembly, \n \nReaffirming its resolution 70/1 of 25 September 2015, entitled \u201cTransforming \nour world: the 2030 Agenda for Sustainable Development\u201d, in which it adopted a \ncomprehensive, far-reaching and people-centred set of universal and transformative \nSustainable Development Goals and targets, its commitment to working tirelessly for \nthe full implementation of the Agenda by 2030, its recognition that eradicating \npoverty in all its forms and dimensions, including extreme poverty, is the greatest \nglobal challenge and an indispensable requirement for sustainable development, its \ncommitment to achieving sustainable development in its three dimensions \u2013 economic, \nsocial and environmental \u2013 in a balanced and integrated manner, and to building upon \nthe achievements of the Millennium Development Goals and seeking to address their \nunfinished business, \n \nAcknowledging the importance of education for achieving sustainable \ndevelopment, including in the context of the achievements of the Millennium \nDevelopment Goals, Agenda 21,1 the Plan of Implementation of the World Summit \non Sustainable Development (Johannesburg Plan of Implementation), 2 the Education \nfor All goals, the Global Action Programme on Education for Sustainable \nDevelopment, 3  and the Incheon Declaration and Framework for Action for the \nimplementation of Sustainable Development Goal 4, \n__________________ \n \n1  Report of the United Nations Conference on Environment and Development, Rio de Janeiro, \n3-14 June 1992, vol. I, Resolutions Adopted by the Conference (United Nations publication, \nSales No. E.93.I.8 and corrigendum), resolution 1, annex II. \n \n2  Report of the World Summit on Sustainable Development, Johannesburg, South Africa, \n26 August\u20134 September 2002 (United Nations publication, Sales No. E.03.II.A.1 and \ncorrigendum), chap. I, resolution 2, annex. \n \n3  See A/69/76, annex. \n\nA/RES/73/25 \nInternational Day of Education\n \n18-20839\n2/2 \n \n \nRecalling its resolution 72/222 of 20 December 2017 on education for \nsustainable development in the framework of the 2030 Agenda for Sustainable \nDevelopment, as well as its resolution 70/209 of 22 December 2015 and other previous \nresolutions on the United Nations Decade of Education for Sustainable Development, \n \nReaffirming its resolutions 53/199 of 15 December 1998 and 61/185 of \n20 December 2006 on the proclamation of international years and Economic and \nSocial Council resolution 1980/67 of 25 July 1980 on international years and \nanniversaries, particularly paragraphs 1 to 10 of the annex thereto on the agreed \ncriteria for the proclamation of international years, as well as paragraphs 13 and 14, \nin which it is stated that an international year should not be proclaimed before the \nbasic arrangements for its organization and financing have been made, \n \nRecognizing that education plays a key role in building sustainable and resilient \nsocieties and contributes to the achievement of all of the other Sustainable \nDevelopment Goals; it increases the productivity of individuals and strengthens the \npotential for economic growth, develops the skills needed for decent work, develops \nthe professional skills needed for sustainable development, including in the fields of \nwater and sanitation, green energy and the conservation of natural resources, helps to \neradicate poverty and hunger, contributes to improved health, promotes gender \nequality and can reduce inequality, and promotes peace, the rule of law and respect \nfor human rights, \n \nAcknowledging the importance of working to ensure inclusive and equitable \nquality education at all levels \u2013 early childhood, primary, secondary, tertiary and \ndistance education, including technical and vocational training \u2013 so that all people \nmay have access to lifelong learning opportunities that help them to acquire the \nknowledge and skills needed to access opportunities to participate fully in society and \ncontribute to sustainable development, \n \n1. \nDecides to proclaim 24 January the International Day of Education; \n \n2. \nInvites all Member States, organizations of the United Nations system, \nother international and regional organizations and civil society organizations, \nnon-governmental organizations, faith-based organizations, academic institutions, the \nprivate sector, individuals and other relevant stakeholders to observe the International \nDay of Education in an appropriate manner and to continue to give consideration to \nenhancing international cooperation in support of the efforts of all Member States \ntowards the realization of Sustainable Development Goal 4;4 \n \n3. \nInvites the United Nations Educational, Scientific and Cultural \nOrganization, as the specialized United Nations agency for education, to facilitate the \nobservance of 24 January of every year as the International Day of Education, mindful \nof the provisions contained in the annex to Economic and Social Council \nresolution 1980/67;  \n \n4. \nStresses that the cost of all activities that may arise from the \nimplementation of the present resolution should be met from voluntary contributions; \n \n5. \nRequests the Secretary-General to bring the present resolution to the \nattention of all Member States, the organizations of the United Nations system and \ncivil society organizations for appropriate observance. \n \n44th plenary meeting  \n3 December 2018 \n \n__________________ \n4 See resolution 70/1. \n",
  "paragraphs": {
    "1": "Decides to proclaim 24 January the International Day of Education;",
    "2": "Invites all Member States, organizations of the United Nations system, other international and regional organizations and civil society organizations, non-governmental organizations, faith-based organizations, academic institutions, the private sector, individuals and other relevant stakeholders to observe the International Day of Education in an appropriate manner and to continue to give consideration to enhancing international cooperation in support of the efforts of all Member States towards the realization of Sustainable Development Goal 4;4",
    "3": "Invites the United Nations Educational, Scientific and Cultural Organization, as the specialized United Nations agency for education, to facilitate the observance of 24 January of every year as the International Day of Education, mindful of the provisions contained in the annex to Economic and Social Council resolution 1980/67;",
    "4": "Stresses that the cost of all activities that may arise from the implementation of the present resolution should be met from voluntary contributions;",
    "5": "Requests the Secretary-General to bring the present resolution to the attention of all Member States, the organizations of the United Nations system and civil society organizations for appropriate observance. 44th plenary meeting 3 December 2018 __________________ 4 See resolution 70/1."
  },
  "agenda_items": [
    "Item 14"
  ],
  "symbol_references": [
    "A/73/L.39"
  ]
}