{
  "symbol": "A/RES/76/282",
  "filename": "A_RES_76_282.pdf",
  "title": "76/282. Financing of the United Nations Multidimensional Integrated Stabilization Mission in the Central African Republic",
  "text": "United Nations \nA/RES/76/282\n \n \nGeneral Assembly \nDistr.: General \n7 July 2022 \n \n22-10340 (E)    070722     \n*2210340* \n \n \nSeventy-sixth session \nAgenda item 152 \nFinancing of the United Nations Multidimensional \nIntegrated Stabilization Mission in the Central \nAfrican Republic  \n \n \n \n \n Resolution adopted by the General Assembly \non 29 June 2022 \n \n \n \n \n[on the report of the Fifth Committee (A/76/876, para. 6)] \n \n \n 76/282. Financing of the United Nations Multidimensional Integrated \nStabilization Mission in the Central African Republic \n \n \n \nThe General Assembly, \n \nHaving considered the reports of the Secretary-General on the financing of the \nUnited Nations Multidimensional Integrated Stabilization Mission in the Central \nAfrican Republic1 and the related report of the Advisory Committee on \nAdministrative and Budgetary Questions,2 \n \nRecalling Security Council resolution 2149 (2014) of 10 April 2014, by which \nthe Council established the United Nations Multidimensional Integrated Stabilization \nMission in the Central African Republic as from 10 April 2014 for an initial period \nuntil 30 April 2015, and the subsequent resolutions by which the Council extended \nthe mandate of the Mission, the latest of which was resolution 2605 (2021) of \n12 November 2021, by which the Council extended the mandate of the Mission until \n15 November 2022,  \n \nRecalling also its resolution 68/299 of 30 June 2014 on the financing of the \nMission and its subsequent resolutions thereon, the latest of which was resolution \n75/298 of 30 June 2021, \n \nReaffirming the general principles underlying the financing of United Nations \npeacekeeping operations, as stated in its resolutions 1874 (S-IV) of 27 June 1963, \n3101 (XXVIII) of 11 December 1973 and 55/235 of 23 December 2000, \n__________________ \n \n1  A/76/572 and A/76/708. \n \n2  A/76/760/Add.10. \n\nA/RES/76/282 \nFinancing of the United Nations Multidimensional Integrated \nStabilization Mission in the Central African Republic\n \n22-10340\n2/4 \n \n \nMindful of the fact that it is essential to provide the Mission with the financial \nresources necessary to enable it to fulfil its responsibilities under the relevant \nresolutions of the Security Council, \n \n1. \nRequests the Secretary-General to entrust the Head of Mission with the \ntask of formulating future budget proposals in full accordance with the provisions of \nits resolutions 59/296 of 22 June 2005, 60/266 of 30 June 2006, 61/276 of 29 June \n2007, 64/269 of 24 June 2010, 65/289 of 30 June 2011, 66/264 of 21 June 2012, \n69/307 of 25 June 2015, 70/286 of 17 June 2016 and 76/274 of 29 June 2022, as well \nas other relevant resolutions; \n \n2. \nTakes note of the status of contributions to the United Nations \nMultidimensional Integrated Stabilization Mission in the Central African Republic as \nat 30 April 2022, including the contributions outstanding in the amount of \n339.7 million United States dollars, representing some 4.6 per cent of the total \nassessed contributions, notes with concern that only 81 Member States have paid their \nassessed contributions in full, and urges all other Member States, in particular those \nin arrears, to ensure payment of their outstanding assessed contributions;  \n \n3. \nExpresses its appreciation to those Member States that have paid their \nassessed contributions in full, and urges all other Member States to make every possible \neffort to ensure payment of their assessed contributions to the Mission in full; \n \n4. \nExpresses concern at the financial situation with regard to peacekeeping \nactivities, in particular as regards the reimbursements to troop contributors that bear \nadditional burdens owing to overdue payments by Member States of their \nassessments; \n \n5. \nEmphasizes that all future and existing peacekeeping missions shall be \ngiven equal and non-discriminatory treatment in respect of financial and \nadministrative arrangements; \n \n6. \nAlso emphasizes that all peacekeeping missions shall be provided with \nadequate resources for the effective and efficient discharge of their respective \nmandates;  \n \n7. \nRequests the Secretary-General to ensure that proposed peacekeeping \nbudgets are based on the relevant legislative mandates; \n \n8. \nEndorses the conclusions and recommendations contained in the report of \nthe Advisory Committee on Administrative and Budgetary Questions, subject to the \nprovisions of the present resolution, and requests the Secretary-General to ensure \ntheir full implementation; \n \n9. \nTakes note of paragraph 23 of the report of the Advisory Committee, and \ndecides to reassign the post of Translator (P-4) to a post of Special Assistant in the \nOffice of the Special Representative of the Secretary-General; \n \n10. Decides that the post of Waste Management Officer (P-3) shall be \nestablished as a National Professional Officer; \n \n11. \nAlso decides to abolish one post of Chief of Unit, Supply (P-4) in the \nCentralized Warehouse Section that has been vacant for 24 months or longer; \n \n12. Requests the Secretary-General to ensure the full implementation of the \nrelevant provisions of its resolutions 59/296, 60/266, 61/276, 64/269, 65/289, 66/264, \n69/307, 70/286 and 76/274; \n \n13. Also requests the Secretary-General to take all action necessary to ensure \nthat the Mission is administered with a maximum of efficiency and economy; \n \n\nFinancing of the United Nations Multidimensional Integrated \nStabilization Mission in the Central African Republic \nA/RES/76/282\n \n3/4\n22-10340 \n \nBudget performance report for the period from 1 July 2020 to 30 June 2021 \n \n \n14. Takes note of the report of the Secretary-General on the budget \nperformance of the Mission for the period from 1 July 2020 to 30 June 2021; 3 \n \nBudget estimates for the period from 1 July 2022 to 30 June 2023 \n \n \n15. Decides to appropriate to the special account for the United Nations \nMultidimensional Integrated Stabilization Mission in the Central African Republic \nthe amount of 1,159,870,100 dollars for the period from 1 July 2022 to 30 June 2023, \ninclusive of 1,074,387,700 dollars for the maintenance of the Mission, \n65,634,500 dollars \nfor \nthe \nsupport \naccount \nfor \npeacekeeping \noperations, \n11,816,900 dollars for the United Nations Logistics Base at Brindisi, Italy, and \n8,031,000 dollars for the Regional Service Centre in Entebbe, Uganda; \n \n \n \nFinancing of the appropriation for the period from 1 July 2022 to 30 June 2023  \n \n \n16. Decides \nto \napportion \namong \nMember \nStates \nthe \namount \nof \n434,951,300 dollars for the period from 1 July to 15 November 2022, in accordance \nwith the levels updated in its resolution 76/239 of 24 December 2021, taking into \naccount the scale of assessments for 2022, as set out in its resolution 76/238 of \n24 December 2021; \n \n17. Also decides that, in accordance with the provisions of its resolution \n973 (X) of 15 December 1955, there shall be set off against the apportionment among \nMember States, as provided for in paragraph 16 above, their respective share in the \nTax Equalization Fund of 8,859,800 dollars, comprising the estimated staff \nassessment income of 6,023,600 dollars approved for the Mission, the prorated share \nof 1,985,500 dollars of the estimated staff assessment income approved for the \nsupport account, the prorated share of 514,900 dollars of the estimated staff \nassessment income approved for the United Nations Logistics Base and the prorated \nshare of 335,800 dollars of the estimated staff assessment income approved for the \nRegional Service Centre;  \n \n18. Further decides to apportion among Member States the amount of \n724,918,800 dollars for the period from 16 November 2022 to 30 June 2023, at a \nmonthly rate of 96,655,840 dollars, in accordance with the levels updated in its \nresolution 76/239, taking into account the scale of assessments for 2022 and 2023, as \nset out in its resolution 76/238, subject to a decision of the Security Council to extend \nthe mandate of the Mission; \n \n19. Decides that, in accordance with the provisions of its resolution 973 (X), \nthere shall be set off against the apportionment among Member States, as provided \nfor in paragraph 18 above, their respective share in the Tax Equalization Fund of \n14,766,300 dollars, comprising the estimated staff assessment income of \n10,039,300 dollars approved for the Mission, the prorated share of 3,309,300 dollars \nof the estimated staff assessment income approved for the support account, the \nprorated share of 858,300 dollars of the estimated staff assessment income approved \nfor the United Nations Logistics Base and the prorated share of 559,400 dollars of the \nestimated staff assessment income approved for the Regional Service Centre;  \n \n20. Also decides that, for Member States that have fulfilled their financial \nobligations to the Mission, there shall be set off against the apportionment, as \nprovided for in paragraphs 16 and 18 above, their respective share of the \nunencumbered balance and other revenue in the amount of 21,564,700 dollars in \nrespect of the financial period ended 30 June 2021, in accordance with the levels \n__________________ \n \n3  A/76/572. \n\nA/RES/76/282 \nFinancing of the United Nations Multidimensional Integrated \nStabilization Mission in the Central African Republic\n \n22-10340\n4/4 \n \nupdated in its resolution 73/272 of 22 December 2018, taking into account the scale \nof assessments for 2021, as set out in its resolution 73/271 of 22 December 2018; \n \n21. Further decides that, for Member States that have not fulfilled their \nfinancial obligations to the Mission, there shall be set off against their outstanding \nobligations their respective share of the unencumbered balance and other revenue in \nthe amount of 21,564,700 dollars, in respect of the financial period ended 30 June \n2021, in accordance with the scheme set out in paragraph 20 above; \n \n22. Decides that the increase of 846,800 dollars in the estimated staff \nassessment income in respect of the financial period ended 30 June 2021 shall be \nadded to the credits in the amount of 21,564,700 dollars referred to in paragraphs 20 \nand 21 above; \n \n23. Encourages the Secretary-General to continue to take additional measures \nto ensure the safety and security of all personnel participating in the Mission under \nthe auspices of the United Nations, bearing in mind paragraphs 5 and 6 of Security \nCouncil resolution 1502 (2003) of 26 August 2003; \n \n24. Invites voluntary contributions to the Mission in cash and in the form of \nservices and supplies acceptable to the Secretary-General, to be administered, as \nappropriate, in accordance with the procedure and practices established by the \nGeneral Assembly; \n \n25. Decides to include in the provisional agenda of its seventy-seventh session \nthe item entitled \u201cFinancing of the United Nations Multidimensional Integrated \nStabilization Mission in the Central African Republic\u201d. \n \n89th plenary meeting \n29 June 2022 \n \n",
  "paragraphs": {
    "1": "Requests the Secretary-General to entrust the Head of Mission with the task of formulating future budget proposals in full accordance with the provisions of its resolutions 59/296 of 22 June 2005, 60/266 of 30 June 2006, 61/276 of 29 June 2007, 64/269 of 24 June 2010, 65/289 of 30 June 2011, 66/264 of 21 June 2012, 69/307 of 25 June 2015, 70/286 of 17 June 2016 and 76/274 of 29 June 2022, as well as other relevant resolutions;",
    "2": "Takes note of the status of contributions to the United Nations Multidimensional Integrated Stabilization Mission in the Central African Republic as at 30 April 2022, including the contributions outstanding in the amount of 339.7 million United States dollars, representing some 4.6 per cent of the total assessed contributions, notes with concern that only 81 Member States have paid their assessed contributions in full, and urges all other Member States, in particular those in arrears, to ensure payment of their outstanding assessed contributions;",
    "3": "Expresses its appreciation to those Member States that have paid their assessed contributions in full, and urges all other Member States to make every possible effort to ensure payment of their assessed contributions to the Mission in full;",
    "4": "Expresses concern at the financial situation with regard to peacekeeping activities, in particular as regards the reimbursements to troop contributors that bear additional burdens owing to overdue payments by Member States of their assessments;",
    "5": "Emphasizes that all future and existing peacekeeping missions shall be given equal and non-discriminatory treatment in respect of financial and administrative arrangements;",
    "6": "Also emphasizes that all peacekeeping missions shall be provided with adequate resources for the effective and efficient discharge of their respective mandates;",
    "7": "Requests the Secretary-General to ensure that proposed peacekeeping budgets are based on the relevant legislative mandates;",
    "8": "Endorses the conclusions and recommendations contained in the report of the Advisory Committee on Administrative and Budgetary Questions, subject to the provisions of the present resolution, and requests the Secretary-General to ensure their full implementation;",
    "9": "Takes note of paragraph 23 of the report of the Advisory Committee, and decides to reassign the post of Translator (P-4) to a post of Special Assistant in the Office of the Special Representative of the Secretary-General;",
    "10": "Decides that the post of Waste Management Officer (P-3) shall be established as a National Professional Officer;",
    "11": "Also decides to abolish one post of Chief of Unit, Supply (P-4) in the Centralized Warehouse Section that has been vacant for 24 months or longer;",
    "12": "Requests the Secretary-General to ensure the full implementation of the relevant provisions of its resolutions 59/296, 60/266, 61/276, 64/269, 65/289, 66/264, 69/307, 70/286 and 76/274;",
    "13": "Also requests the Secretary-General to take all action necessary to ensure that the Mission is administered with a maximum of efficiency and economy; Financing of the United Nations Multidimensional Integrated Stabilization Mission in the Central African Republic A/RES/76/282 3/4 22-10340 Budget performance report for the period from 1 July 2020 to 30 June 2021",
    "14": "Takes note of the report of the Secretary-General on the budget performance of the Mission for the period from 1 July 2020 to 30 June 2021; 3 Budget estimates for the period from 1 July 2022 to 30 June 2023",
    "15": "Decides to appropriate to the special account for the United Nations Multidimensional Integrated Stabilization Mission in the Central African Republic the amount of 1,159,870,100 dollars for the period from 1 July 2022 to 30 June 2023, inclusive of 1,074,387,700 dollars for the maintenance of the Mission, 65,634,500 dollars for the support account for peacekeeping operations, 11,816,900 dollars for the United Nations Logistics Base at Brindisi, Italy, and 8,031,000 dollars for the Regional Service Centre in Entebbe, Uganda; Financing of the appropriation for the period from 1 July 2022 to 30 June 2023",
    "16": "Decides to apportion among Member States the amount of 434,951,300 dollars for the period from 1 July to 15 November 2022, in accordance with the levels updated in its resolution 76/239 of 24 December 2021, taking into account the scale of assessments for 2022, as set out in its resolution 76/238 of 24 December 2021;",
    "17": "Also decides that, in accordance with the provisions of its resolution 973 (X) of 15 December 1955, there shall be set off against the apportionment among Member States, as provided for in paragraph 16 above, their respective share in the Tax Equalization Fund of 8,859,800 dollars, comprising the estimated staff assessment income of 6,023,600 dollars approved for the Mission, the prorated share of 1,985,500 dollars of the estimated staff assessment income approved for the support account, the prorated share of 514,900 dollars of the estimated staff assessment income approved for the United Nations Logistics Base and the prorated share of 335,800 dollars of the estimated staff assessment income approved for the Regional Service Centre;",
    "18": "Further decides to apportion among Member States the amount of 724,918,800 dollars for the period from 16 November 2022 to 30 June 2023, at a monthly rate of 96,655,840 dollars, in accordance with the levels updated in its resolution 76/239, taking into account the scale of assessments for 2022 and 2023, as set out in its resolution 76/238, subject to a decision of the Security Council to extend the mandate of the Mission;",
    "19": "Decides that, in accordance with the provisions of its resolution 973 (X), there shall be set off against the apportionment among Member States, as provided for in paragraph 18 above, their respective share in the Tax Equalization Fund of 14,766,300 dollars, comprising the estimated staff assessment income of 10,039,300 dollars approved for the Mission, the prorated share of 3,309,300 dollars of the estimated staff assessment income approved for the support account, the prorated share of 858,300 dollars of the estimated staff assessment income approved for the United Nations Logistics Base and the prorated share of 559,400 dollars of the estimated staff assessment income approved for the Regional Service Centre;",
    "20": "Also decides that, for Member States that have fulfilled their financial obligations to the Mission, there shall be set off against the apportionment, as provided for in paragraphs 16 and 18 above, their respective share of the unencumbered balance and other revenue in the amount of 21,564,700 dollars in respect of the financial period ended 30 June 2021, in accordance with the levels __________________ 3 A/76/572. A/RES/76/282 Financing of the United Nations Multidimensional Integrated Stabilization Mission in the Central African Republic 22-10340 4/4 updated in its resolution 73/272 of 22 December 2018, taking into account the scale of assessments for 2021, as set out in its resolution 73/271 of 22 December 2018;",
    "21": "Further decides that, for Member States that have not fulfilled their financial obligations to the Mission, there shall be set off against their outstanding obligations their respective share of the unencumbered balance and other revenue in the amount of 21,564,700 dollars, in respect of the financial period ended 30 June 2021, in accordance with the scheme set out in paragraph 20 above;",
    "22": "Decides that the increase of 846,800 dollars in the estimated staff assessment income in respect of the financial period ended 30 June 2021 shall be added to the credits in the amount of 21,564,700 dollars referred to in paragraphs 20 and 21 above;",
    "23": "Encourages the Secretary-General to continue to take additional measures to ensure the safety and security of all personnel participating in the Mission under the auspices of the United Nations, bearing in mind paragraphs 5 and 6 of Security Council resolution 1502 (2003) of 26 August 2003;",
    "24": "Invites voluntary contributions to the Mission in cash and in the form of services and supplies acceptable to the Secretary-General, to be administered, as appropriate, in accordance with the procedure and practices established by the General Assembly;",
    "25": "Decides to include in the provisional agenda of its seventy-seventh session the item entitled \u201cFinancing of the United Nations Multidimensional Integrated Stabilization Mission in the Central African Republic\u201d. 89th plenary meeting 29 June 2022"
  },
  "agenda_items": [
    "Item 152"
  ],
  "symbol_references": []
}