{
  "symbol": "A/RES/76/74",
  "filename": "A_RES_76_74.pdf",
  "title": "76/74. Assistance in mine action",
  "text": "United Nations \nA/RES/76/74\n \n \nGeneral Assembly \nDistr.: General \n15 December 2021 \n \n21-18616 (E)    201221 \n*2118616* \n \n \nSeventy-sixth session \nAgenda item 51 \nAssistance in mine action  \n \n \n \n \n Resolution adopted by the General Assembly \non 9 December 2021 \n \n \n \n \n[on the report of the Special Political and Decolonization Committee \n(Fourth Committee) (A/76/413, para. 8)] \n \n \n \n76/74. Assistance in mine action \n \n \n \nThe General Assembly, \n \nRecalling its resolution 74/80 of 13 December 2019 and all its previous \nresolutions on assistance in mine clearance and on assistance in mine action, all \nadopted without a vote, \n \nRecalling also all relevant treaties and conventions1 and their review processes, \n \nNoting with appreciation the extent to which the International Day for Mine \nAwareness and Assistance in Mine Action has been commemorated worldwide, \n \nNoting all relevant United Nations resolutions that take into account the \nhumanitarian aspects of assistance in mine action, \n \nReaffirming its deep concern at the tremendous humanitarian and development \nimpact of mines and explosive remnants of war,2 in affected countries, which have \nserious and lasting social and economic consequences for the civilian populations of \nsuch countries, including refugees and other displaced persons returning to their \nhomes, as well as persons residing in conflict and post-conflict areas, and which \n__________________ \n \n1  These include the Convention on the Prohibition of the Use, Stockpiling, Production and Transfer  \nof Anti-Personnel Mines and on Their Destruction, 1997; the Protocol on Prohibitions or \nRestrictions on the Use of Mines, Booby Traps and Other Devices, as amended in 1996 \n(Protocol II to the 1980 Convention on Prohibitions or Restrictions on the Use of Certain \nConventional Weapons Which May Be Deemed to Be Excessively Injurious or to Have \nIndiscriminate Effects); the Protocol on Explosive Remnants of War, 2003 (Protocol V to the 1980 \nConvention); the Convention on Cluster Munitions, 2008; the Protocol Add itional to the Geneva \nConventions of 12 August 1949, and relating to the Protection of Victims of International Armed \nConflicts 1977 (Protocol I); and the Convention on the Rights of Persons with Disabilities, 2006.  \n \n2  As defined by Protocol V to the 1980 Convention. \n\nA/RES/76/74 \nAssistance in mine action \n \n21-18616\n2/7 \n \nhinder the access of people in need to humanitarian assistance and the achievement \nof sustainable development and inhibit peacebuilding and sustaining peace efforts, \n \nNoting with appreciation the resilience shown by the mine action sector in the \nface of the coronavirus disease (COVID-19) pandemic, whereby using innovative \nmethods, such as virtual training platforms or campaigns merging COVID-19 and risk \neducation messages, has allowed for safety and security training and risk education \nto continue to be delivered to affected communities and international, national and \nlocal personnel operating in high-risk areas,  \n \nDeeply concerned that children continue to be disproportionately affected by \nmines and explosive remnants of war in conflict and post-conflict situations, \n \nBearing in mind the serious humanitarian risk that mines and explosive \nremnants of war pose, in affected countries, to the safety, health and lives of \npopulations, including local civilian populations, as well as of personnel participating \nin humanitarian, peacekeeping, rehabilitation, reconstruction and mine clearance \nprogrammes and operations, \n \nDeeply concerned by the increasing threat of improvised explosive devices to \ncivilian populations, United Nations personnel, including peacekeepers, and national \ndefence and security forces, \n \nStrongly condemning all acts of violence, including direct attacks, against \nhumanitarian mine action personnel and facilities and their means of transport and \nequipment,  \n \nEmphasizing the increased necessity and urgency of strengthening mine action \nefforts by the international community with a view to eliminating the risk and the \nhumanitarian impact of mines and explosive remnants of war on civilians as soon as \npossible and to facilitating the safe and unhindered access of humanitarian personnel \nand the delivery of supplies and equipment, in accordance with the humanitarian \nprinciples, \n \nRecognizing the continued progress made through a comprehensive approach to \nmine action, including assessing, surveying and clearing mines and explosive remnants \nof war, providing risk education to affected populations and supporting victims, \n \nNoting that, for the purposes of the implementation of the present resolution, \nimprovised explosive devices meeting the definition of mines, booby traps or other \ndevices fall under the scope of mine action when their clearance is undertaken for \nhumanitarian purposes and in areas where major active hostilities have ceased, \n \nRecognizing that, in addition to the primary role of Member States, the United \nNations plays a significant role in the field of assistance in mine action, in particular \nthrough the implementation of the Strategy of the United Nations on Mine Action \n2019\u20132023 by members of the Inter-Agency Coordination Group on Mine Action,3 \nchaired by the Mine Action Service at the working level,  \n \nConsidering mine action to be an important and integrated component of United \nNations humanitarian assistance and development activities, and noting the \n__________________ \n \n3  Consisting of the Mine Action Service of the Department of Peace Operations of the Secretariat, the \nOffice for Disarmament Affairs of the Secretariat, the United Nations Development Programme, \nthe United Nations Children\u2019s Fund, the United Nations Office for Project Services, the Food and \nAgriculture Organization of the United Nations, the Office for the Coordination of Humanitarian \nAffairs of the Secretariat, the United Nations Entity for Gender Equality and the Empowerment \nof Women (UN-Women), the Office of the United Nations High Commissioner for Human Rights, \nthe Office of the United Nations High Commissioner for Refugees, the World Food Programme \nand the World Health Organization. The United Nations Institute for Disarmament Research an d \nthe World Bank are observers. \n\nAssistance in mine action \nA/RES/76/74\n \n3/7\n21-18616 \n \nintegration of mine action in numerous United Nations peacekeeping operations and \nspecial political missions mandated by the Security Council, \n \nRecognizing the contribution of mine action to the 2030 Agenda for Sustainable \nDevelopment,4  \n \nNoting the relevance of the United Nations Disability Inclusion Strategy \nlaunched by the Secretary-General in June 2019 to bring about lasting change on \ndisability inclusion, in particular by ensuring, through advocacy and technical \nassistance, equal access for all persons with disabilities, including victims of mines \nand explosive ordnance,  \n \nNoting with satisfaction that humanitarian appeals increasingly include mine \naction, where relevant, and underlining the importance of considering mine action \nduring the earliest stages of planning and programming, where appropriate, in \nhumanitarian emergency responses,5 in accordance with the humanitarian principles, \n \nNoting with appreciation the efforts of the Inter-Agency Coordination Group on \nMine Action in cooperating and coordinating with non-governmental organizations \nand other stakeholders through meetings of, inter alia, the Committee on Mine \nAction,6 and the strengthening of United Nations coordination at the global level \nthrough the mine action area of responsibility within the Global Protection Cluster, \nand encouraging further enhancement of that cooperation, \n \nRecognizing the importance of the full involvement and equal opportunities for \nparticipation of both women and men in mine action programmes and of gender-, age- \nand disability-appropriate perspective in mine action programmes,  \n \nRecognizing also the valuable mine action efforts of national, regional and \ninternational mine action practitioners, including United Nations personnel and \npeacekeepers, and also experts from relevant non-governmental organizations \ninvolved in mine action, enabling local communities and mine survivors to resume \nnormal lives and reclaim their livelihoods by regaining access to previously \ncontaminated lands, \n \nNoting with appreciation national, regional and subregional efforts, including \nthe ongoing development by the African Union of a new strategic framework on mine \naction, as well as other relevant regional mine action strategies,  \n \nTaking note of the United Nations Policy on Victim Assistance in Mine Action, \nwhich highlights the significance of integrating victim assistance efforts into broader \nnational and international frameworks, such as the Convention on the Rights of \nPersons with Disabilities,7 as well as the importance of sustained services and support \nto victims of mines and explosive remnants of war,  \n \nNoting with appreciation the ongoing implementation of the Strategy of the \nUnited Nations on Mine Action 2019\u20132023, including its reinforced monitoring and \nevaluation mechanism, emphasizing the importance of using evaluation to inform the \n__________________ \n \n4  Resolution 70/1. \n \n5  Reaffirming its resolution 46/182 of 19 December 1991 and the guiding principles contained in \nthe annex thereto, other relevant General Assembly and Economic and Social Council resolutions \nand agreed conclusions of the Council, reaffirming also the principles of humanity, neutrality, \nimpartiality and independence in the provision of humanitarian assistance and reaffirming further \nthe need for all actors engaged in the provision of humanitarian assistance in situations of \ncomplex emergencies and natural disasters to promote and fully respect these principles. \n \n6  The Committee on Mine Action is an informal information-sharing forum. The members are the \nInter-Agency Coordination Group on Mine Action, non-governmental organizations involved in \nmine action, the International Committee of the Red Cross, the Geneva International Centre for \nHumanitarian Demining and academic institutions. \n \n7  United Nations, Treaty Series, vol. 2515, No. 44910. \n\nA/RES/76/74 \nAssistance in mine action \n \n21-18616\n4/7 \n \nfuture direction of mine action within the United Nations, including the role and \nfunction of the Mine Action Service, and encouraging the members of the \nInter-Agency Coordination Group on Mine Action to continue their work to improve \nthe impact of the United Nations in the field of mine action,  \n \nNoting the coordination efforts under the informal donor information-sharing \nforum known as the Mine Action Support Group, which endeavours to coordinate the \nhumanitarian mine action programmes of donor States, harmonizing the prioritization \nof their respective mine action programmes and increasing donor support for mine \naction where it is most needed,  \n \nNoting with appreciation the role of the recently established Explosive \nOrdnance Risk Education Advisory Group, which is co-chaired by the United Nations \nChildren\u2019s Fund and a rotating non-governmental organization and comprises \n15 leading organizations in the mine action sector and which was formed to steer risk \neducation efforts and to promote the use of robust behaviour change strategies to \nsystematically protect affected populations from the threat of mines and explosive \nremnants of war,  \n \nNoting the discussions on the issue of improvised explosive devices of the \ninformal group of experts under the Protocol on Prohibitions or Restrictions on the \nUse of Mines, Booby Traps and Other Devices, as amended on 3 May 1996 (Amended \nProtocol II),8 and on the technical annex to the Protocol on Explosive Remnants of \nWar (Protocol V)9 to the Convention on Prohibitions or Restrictions on the Use of \nCertain Conventional Weapons Which May Be Deemed to Be Excessively Injurious \nor to Have Indiscriminate Effects,10  \n \n1. \nTakes note of the report of the Secretary-General, 11  including the \nrecommendations contained therein; \n \n2. \nCalls upon Member States to comply with their respective international \nobligations related to mine action;  \n \n3. \nCalls, in particular, for the continuation of the efforts of Member States, \nincluding through South-South, regional and subregional cooperation, bearing in \nmind the need to ensure national ownership, with the assistance of the United Nations \nand relevant organizations involved in mine action, upon request and as appropriate \nand in coordination with the affected country, to foster the establishment and \ndevelopment of national mine action capacities in countries in which mines and \nexplosive remnants of war constitute a serious threat to the safety, health and lives of \nthe local civilian population or an impediment to the delivery of humanitarian \nassistance and social and economic development efforts at the national and local \nlevels;  \n \n4. \nUrges all Member States, in particular those that have the capacity to do \nso, as well as the United Nations system and other relevant organizations and \ninstitutions involved in mine action, to support mine-affected States, upon request \nand as appropriate, by providing:  \n \n(a) \nAssistance to countries affected by mines and explosive remnants of war \nfor the establishment and development of national mine action capacities, including \nin the fulfilment of the relevant international obligations of those countries and the \nimplementation of national mine action strategies and plans; \n__________________ \n \n8  Ibid., vol. 2048, No. 22495. \n \n9  Ibid., vol. 2399, No. 22495. \n \n10  Ibid., vol. 1342, No. 22495. \n \n11  A/76/283. \n\nAssistance in mine action \nA/RES/76/74\n \n5/7\n21-18616 \n \n \n(b) \nSupport for national and, where and as appropriate, local programmes, in \ncooperation with the relevant bodies of the United Nations system and relevant \nregional, governmental and non-governmental organizations, to reduce the risks \nposed by mines and explosive remnants of war, taking into consideration the different \nneeds of women, girls, boys and men;  \n \n(c) \nReliable, predictable, timely and, where possible, multi-annual \ncontributions for mine action activities, including through national mine action efforts \nand mine action programmes of the United Nations and non-governmental \norganizations, including those relating to rapid response in humanitarian \nemergencies, victim assistance and mine risk education, especially at the local level, \nas well as through relevant national, regional and global trust funds, including the \nvoluntary trust fund for assistance in mine action;  \n \n(d) \nNecessary information and technical, financial and material assistance to \nlocate, remove, destroy and otherwise render ineffective minefields, mines and \nexplosive remnants of war, in accordance with international law, as soon as possible;  \n \n(e) \nTechnological assistance (i) to countries affected by mines and explosive \nremnants of war, and (ii) to promote user-oriented scientific research on and \ndevelopment of mine action techniques and technologies that are effective, \nsustainable, appropriate and environmentally sound;  \n \n5. \nEncourages efforts to conduct all mine action activities in accordance with \nthe International Mine Action Standards or national standards compliant with those \nStandards, and emphasizes the importance of ensuring the accuracy and objectivity \nof reporting information as well as of using state-of-the-art technologies and an \ninformation management system, such as the Information Management System for \nMine Action, to help to facilitate mine action activities;  \n \n6. \nNotes the update of the International Mine Action Standards, and \nencourages the Mine Action Service to continue its efforts in this regard; \n \n7. \nUrges all mine-affected States, pursuant to applicable international law, to \nidentify all areas, as appropriate, under their jurisdiction or control containing mines \nand explosive remnants of war in the most efficient manner possible and to employ \nland release techniques, including non-technical survey, technical survey and \nclearance when appropriate;  \n \n8. \nEncourages mine-affected States, with support from relevant United \nNations agencies and development partners as appropriate, to proactively mainstream \nmine action, including victim assistance requirements and their linkage with health \ncare and disabilities agendas, into development plans and processes to ensure that \ndevelopment priorities include mine action and that mine action, including victim \nassistance requirements, is funded in a predictable and sustainable manner;  \n \n9. \nEncourages all relevant multilateral, regional and national programmes \nand bodies to include activities related to mine action, including clearance, in their \npeacebuilding, humanitarian, stabilization, rehabilitation, reconstruction, peace \nsustainment and development assistance activities, where appropriate, bearing in \nmind the need to ensure national and local ownership, sustainability and capacity-\nbuilding, as well as to include a gender- and age-appropriate perspective in all aspects \nof such activities and to take into account the specific needs of persons with \ndisabilities;  \n \n10. Encourages Member States, as appropriate, and relevant organizations \ninvolved in mine action to continue efforts to ensure that mine action programmes \ntake into account risk education, the specific needs and requirements of victims and \npersons with disabilities, are gender- and age-sensitive, so that women, girls, boys \n\nA/RES/76/74 \nAssistance in mine action \n \n21-18616\n6/7 \n \nand men can benefit equally from them, and also take into account the specific needs \nof refugees and internally displaced persons, as well as persons residing in conflict \nand post-conflict areas, and encourages the participation of all stakeholders, including \nwomen, in the programming of mine action;  \n \n11. Encourages the inclusion of refugees and internally displaced persons, as \nwell as persons residing in conflict and post-conflict areas, in mine action national \nplans and strategies in the spirit of \u201cleaving no one behind\u201d and in order to mobilize \nsolutions and reach social cohesion among the populations of countries affected by \nconflict;  \n \n12. Urges States to provide humanitarian assistance for victims of mines and \nexplosive remnants of war, as well as support to families and communities, taking \ninto account the specific needs of victims of mines and explosive remnants of war, \nincluding persons with disabilities, and to take measures to protect civilians in \nsituations of armed conflict, in accordance with international law, including \ninternational humanitarian law; \n \n13. Encourages States to support victims\u2019 access to appropriate medical care, \nincluding mental health and psychosocial support, physical and sensory \nrehabilitation, education and skills training and income-earning opportunities, and to \nprovide those services to all, while integrating a gender perspective, with respect for \ninternational law, including international humanitarian law; \n \n14. Encourages a focus on the localization of mine action, including through \nlocal capacity development, bearing in mind relevant international and national \nframeworks, in order to ensure that sustainable and tailored mine action benefits for \naffected communities continue, even in the face of the ongoing global COVID-19 \npandemic;  \n \n15. Encourages the provision of capacity-building assistance to affected \ncountries in order to integrate assistance for victims into their national policy \nframeworks on health care, social services and disability-inclusive development by \nrelevant United Nations agencies, civil society organizations and other entities with \nexpertise in those matters;  \n \n16. Stresses the importance of cooperation and coordination in mine action \nand of devoting existing resources, as appropriate, to that end, emphasizes the primary \nresponsibility of national authorities in that regard, and also stresses the supporting \nrole of the United Nations, with the Mine Action Service as the coordinator for mine \naction within the United Nations system, the mine action area of responsibility and \nother relevant organizations in that regard;  \n \n17. Encourages the United Nations to continue to take measures to improve \ncoordination, efficiency, transparency and accountability, in particular by \nimplementing the Strategy of the United Nations on Mine Action 2019\u20132023; \n \n18. Notes with appreciation the continued partnership and cooperation of the \nUnited Nations with regional and subregional organizations, especially the African \nUnion, to mitigate the risk to civilians from mines and explosive remnants of war, \nincluding through the Joint United Nations-African Union Framework for an \nEnhanced Partnership in Peace and Security and other joint initiatives, and \nencourages in this regard the establishment of partnerships with regional, national \nand local organizations, as appropriate; \n \n19. Recognizes the importance of explicitly incorporating references to mine \naction, when appropriate, in ceasefire and peace agreements, as well as in the \nmandates of peacekeeping operations and special political missions, as appropriate, \nin the light of the potential that mine action can have as a peace- and confidence-\n\nAssistance in mine action \nA/RES/76/74\n \n7/7\n21-18616 \n \nbuilding measure in post-conflict situations among the parties concerned and in view \nof the ongoing dangers faced by peacekeeping personnel and host populations; \n \n20. Encourages those Member States and organizations in a position to do so \nto support measures by all relevant actors aimed at improving rapid response capacity \nin humanitarian emergencies, as well as transparency and accountability;  \n \n21. Requests the Secretary-General to submit to the General Assembly at its \nseventy-eighth session a report on the implementation of the present resolution and \non follow-up to previous resolutions on assistance in mine clearance and on assistance \nin mine action;  \n \n22. Decides to include in the provisional agenda of its seventy-eighth session \nthe item entitled \u201cAssistance in mine action\u201d. \n \n49th plenary meeting \n9 December 2021 \n \n",
  "paragraphs": {
    "1": "Takes note of the report of the Secretary-General, 11 including the recommendations contained therein;",
    "2": "Calls upon Member States to comply with their respective international obligations related to mine action;",
    "3": "Calls, in particular, for the continuation of the efforts of Member States, including through South-South, regional and subregional cooperation, bearing in mind the need to ensure national ownership, with the assistance of the United Nations and relevant organizations involved in mine action, upon request and as appropriate and in coordination with the affected country, to foster the establishment and development of national mine action capacities in countries in which mines and explosive remnants of war constitute a serious threat to the safety, health and lives of the local civilian population or an impediment to the delivery of humanitarian assistance and social and economic development efforts at the national and local levels;",
    "4": "Urges all Member States, in particular those that have the capacity to do so, as well as the United Nations system and other relevant organizations and institutions involved in mine action, to support mine-affected States, upon request and as appropriate, by providing: (a) Assistance to countries affected by mines and explosive remnants of war for the establishment and development of national mine action capacities, including in the fulfilment of the relevant international obligations of those countries and the implementation of national mine action strategies and plans; __________________ 8 Ibid., vol. 2048, No. 22495. 9 Ibid., vol. 2399, No. 22495. 10 Ibid., vol. 1342, No. 22495. 11 A/76/283. Assistance in mine action A/RES/76/74 5/7 21-18616 (b) Support for national and, where and as appropriate, local programmes, in cooperation with the relevant bodies of the United Nations system and relevant regional, governmental and non-governmental organizations, to reduce the risks posed by mines and explosive remnants of war, taking into consideration the different needs of women, girls, boys and men; (c) Reliable, predictable, timely and, where possible, multi-annual contributions for mine action activities, including through national mine action efforts and mine action programmes of the United Nations and non-governmental organizations, including those relating to rapid response in humanitarian emergencies, victim assistance and mine risk education, especially at the local level, as well as through relevant national, regional and global trust funds, including the voluntary trust fund for assistance in mine action; (d) Necessary information and technical, financial and material assistance to locate, remove, destroy and otherwise render ineffective minefields, mines and explosive remnants of war, in accordance with international law, as soon as possible; (e) Technological assistance (i) to countries affected by mines and explosive remnants of war, and (ii) to promote user-oriented scientific research on and development of mine action techniques and technologies that are effective, sustainable, appropriate and environmentally sound;",
    "5": "Encourages efforts to conduct all mine action activities in accordance with the International Mine Action Standards or national standards compliant with those Standards, and emphasizes the importance of ensuring the accuracy and objectivity of reporting information as well as of using state-of-the-art technologies and an information management system, such as the Information Management System for Mine Action, to help to facilitate mine action activities;",
    "6": "Notes the update of the International Mine Action Standards, and encourages the Mine Action Service to continue its efforts in this regard;",
    "7": "Urges all mine-affected States, pursuant to applicable international law, to identify all areas, as appropriate, under their jurisdiction or control containing mines and explosive remnants of war in the most efficient manner possible and to employ land release techniques, including non-technical survey, technical survey and clearance when appropriate;",
    "8": "Encourages mine-affected States, with support from relevant United Nations agencies and development partners as appropriate, to proactively mainstream mine action, including victim assistance requirements and their linkage with health care and disabilities agendas, into development plans and processes to ensure that development priorities include mine action and that mine action, including victim assistance requirements, is funded in a predictable and sustainable manner;",
    "9": "Encourages all relevant multilateral, regional and national programmes and bodies to include activities related to mine action, including clearance, in their peacebuilding, humanitarian, stabilization, rehabilitation, reconstruction, peace sustainment and development assistance activities, where appropriate, bearing in mind the need to ensure national and local ownership, sustainability and capacity- building, as well as to include a gender- and age-appropriate perspective in all aspects of such activities and to take into account the specific needs of persons with disabilities;",
    "10": "Encourages Member States, as appropriate, and relevant organizations involved in mine action to continue efforts to ensure that mine action programmes take into account risk education, the specific needs and requirements of victims and persons with disabilities, are gender- and age-sensitive, so that women, girls, boys A/RES/76/74 Assistance in mine action 21-18616 6/7 and men can benefit equally from them, and also take into account the specific needs of refugees and internally displaced persons, as well as persons residing in conflict and post-conflict areas, and encourages the participation of all stakeholders, including women, in the programming of mine action;",
    "11": "Encourages the inclusion of refugees and internally displaced persons, as well as persons residing in conflict and post-conflict areas, in mine action national plans and strategies in the spirit of \u201cleaving no one behind\u201d and in order to mobilize solutions and reach social cohesion among the populations of countries affected by conflict;",
    "12": "Urges States to provide humanitarian assistance for victims of mines and explosive remnants of war, as well as support to families and communities, taking into account the specific needs of victims of mines and explosive remnants of war, including persons with disabilities, and to take measures to protect civilians in situations of armed conflict, in accordance with international law, including international humanitarian law;",
    "13": "Encourages States to support victims\u2019 access to appropriate medical care, including mental health and psychosocial support, physical and sensory rehabilitation, education and skills training and income-earning opportunities, and to provide those services to all, while integrating a gender perspective, with respect for international law, including international humanitarian law;",
    "14": "Encourages a focus on the localization of mine action, including through local capacity development, bearing in mind relevant international and national frameworks, in order to ensure that sustainable and tailored mine action benefits for affected communities continue, even in the face of the ongoing global COVID-19 pandemic;",
    "15": "Encourages the provision of capacity-building assistance to affected countries in order to integrate assistance for victims into their national policy frameworks on health care, social services and disability-inclusive development by relevant United Nations agencies, civil society organizations and other entities with expertise in those matters;",
    "16": "Stresses the importance of cooperation and coordination in mine action and of devoting existing resources, as appropriate, to that end, emphasizes the primary responsibility of national authorities in that regard, and also stresses the supporting role of the United Nations, with the Mine Action Service as the coordinator for mine action within the United Nations system, the mine action area of responsibility and other relevant organizations in that regard;",
    "17": "Encourages the United Nations to continue to take measures to improve coordination, efficiency, transparency and accountability, in particular by implementing the Strategy of the United Nations on Mine Action 2019\u20132023;",
    "18": "Notes with appreciation the continued partnership and cooperation of the United Nations with regional and subregional organizations, especially the African Union, to mitigate the risk to civilians from mines and explosive remnants of war, including through the Joint United Nations-African Union Framework for an Enhanced Partnership in Peace and Security and other joint initiatives, and encourages in this regard the establishment of partnerships with regional, national and local organizations, as appropriate;",
    "19": "Recognizes the importance of explicitly incorporating references to mine action, when appropriate, in ceasefire and peace agreements, as well as in the mandates of peacekeeping operations and special political missions, as appropriate, in the light of the potential that mine action can have as a peace- and confidence- Assistance in mine action A/RES/76/74 7/7 21-18616 building measure in post-conflict situations among the parties concerned and in view of the ongoing dangers faced by peacekeeping personnel and host populations;",
    "20": "Encourages those Member States and organizations in a position to do so to support measures by all relevant actors aimed at improving rapid response capacity in humanitarian emergencies, as well as transparency and accountability;",
    "21": "Requests the Secretary-General to submit to the General Assembly at its seventy-eighth session a report on the implementation of the present resolution and on follow-up to previous resolutions on assistance in mine clearance and on assistance in mine action;",
    "22": "Decides to include in the provisional agenda of its seventy-eighth session the item entitled \u201cAssistance in mine action\u201d. 49th plenary meeting 9 December 2021"
  },
  "agenda_items": [
    "Item 51"
  ],
  "symbol_references": []
}