{
  "symbol": "A/RES/78/326",
  "filename": "A_RES_78_326.pdf",
  "title": "78/326. World Rural Development Day",
  "text": "United Nations \nA/RES/78/326\n \n \nGeneral Assembly \nDistr.: General \n11 September 2024 \n \n24-16427 (E) \n*2416427* \n \n \nSeventy-eighth session \nAgenda item 13 \nIntegrated and coordinated implementation of and follow-up \nto the outcomes of the major United Nations conferences and \nsummits in the economic, social and related fields \n \n \n \nResolution adopted by the General Assembly \non 6 September 2024 \n \n \n \n \n[without reference to a Main Committee (A/78/L.84/Rev.2)] \n \n \n 78/326. World Rural Development Day \n \n \n \nThe General Assembly, \n \nReaffirming its resolution 70/1 of 25 September 2015, entitled \u201cTransforming \nour world: the 2030 Agenda for Sustainable Development\u201d, in which it adopted a \ncomprehensive, far-reaching and people-centred set of universal and transformative \nSustainable Development Goals and targets, its commitment to working tirelessly for \nthe full implementation of the Agenda by 2030, its recognition that eradicating \npoverty in all its forms and dimensions, including extreme poverty, is the greatest \nglobal challenge and an indispensable requirement for sustainable development, its \ncommitment to achieving sustainable development in its three dimensions \u2013 \neconomic, social and environmental \u2013 in a balanced and integrated manner, and to \nbuilding upon the achievements of the Millennium Development Goals and seeking \nto address their unfinished business, \n \nReaffirming also its resolutions 53/199 of 15 December 1998 and 61/185 of \n20 December 2006 on the proclamation of international years, and Economic and \nSocial Council resolution 1980/67 of 25 July 1980 on international years and \nanniversaries, in particular paragraphs 1 to 10 of the annex thereto on the agreed \ncriteria for the proclamation of international years, as well as paragraphs 13 and 14, \nin which it is stated that an international year should not be proclaimed before the \nbasic arrangements for its organization and financing have been made,  \n \nReaffirming further the Addis Ababa Action Agenda of the Third International \nConference on Financing for Development of 2015, 1  \n__________________ \n \n1  Resolution 69/313, annex. \n\nA/RES/78/326 \nWorld Rural Development Day\n \n24-16427\n2/3 \n \n \nReaffirming the Universal Declaration of Human Rights,2 \n \nNoting its resolution 73/165 of 17 December 2018, by which it adopted the \nUnited Nations Declaration on the Rights of Peasants and Other People Working in \nRural Areas, \n \nNoting the Declaration on the Right to Development,3  \n \nNoting with concern that rural poor and other people working in rural areas, \nincluding Indigenous Peoples and local communities, suffer disproportionately from \npoverty, hunger and malnutrition, \n \nRecognizing the interlinkages and integrated nature of the Sustainable \nDevelopment Goals, and reiterating that the eradication of rural poverty and hunger \nis crucial for the achievement of the Sustainable Development Goals, and that rural \ndevelopment should be pursued through an integrated approach that encompasses \neconomic, social and environmental dimensions, \n \nRecognizing also the critical role and contribution of rural women, including \nsmallholders and women farmers, fishers, Indigenous women and their traditional \nknowledge and women in local communities, in enhancing agricultural and rural \ndevelopment, improving food security and nutrition and eradicating rural poverty, and \ntherefore highlighting the importance of promoting their economic empowerment, \ntheir full access to land ownership and decent work and economic opportunities and \ntheir participation in decision-making, \n \nUnderscoring that investing in key facilities and services in rural areas will be \nan effective approach to address rural poverty and hunger, create productive \nemployment and enterprises, and promote digital financial inclusion for rural \ncommunities and rural institutions such as community-based organizations and \ncooperatives, particularly for rural youth and women, including through regional and \nnational initiatives, \n \nRecognizing the importance of sharing locally driven development approaches \nand pathways to promote rural development and accelerate the implementation of the \n2030 Agenda, \n \nNoting the efforts of regional organizations, including the Centre on Integrated \nRural Development for Asia and the Pacific (CIRDAP), in assisting national action \nand promoting regional cooperation relating to integrated rural development, \n \nTrusting that the observance of an international day will create a comprehensive \nplatform to assess the challenges and opportunities of rural development, \n \n1. \nDecides to declare 6 July World Rural Development Day, to highlight the \ncritical importance of rural development and transformation for the achievement of \nthe Sustainable Development Goals;4  \n \n2. \nInvites all Member States, organizations of the United Nations system and \nother international and regional organizations, as well as non-governmental \norganizations, individuals and other relevant stakeholders, including civil society, \nfarmers\u2019 organizations, Indigenous Peoples, local communities, the private sector and \nacademia, as well as schools, to observe World Rural Development Day by presenting \nand promoting, as appropriate in national and regional contexts, concrete activities \nwith regard to the sustainable development of rural areas and communities; \n__________________ \n \n2  Resolution 217 A (III). \n \n3  Resolution 41/128, annex. \n \n4  See resolution 70/1. \n\nWorld Rural Development Day \nA/RES/78/326\n \n3/3\n24-16427 \n \n \n3. \nInvites the Department of Economic and Social Affairs of the Secretariat, \nin cooperation with Governments, relevant international and regional organizations, \nthe specialized agencies and all other stakeholders, and mindful of the provisions \ncontained in the annex to Economic and Social Council resolution 1980/67, to \nfacilitate the organization and implementation of World Rural Development Day as a \nway of promoting rural development, raising awareness of the contribution of rural \ndevelopment in achieving the Sustainable Development Goals and supporting \nMember States in planning and coordinating activities for observing the Day; \n \n4. \nStresses that the cost of all activities that may arise from the \nimplementation of the present resolution should be met from voluntary contributions; \n \n5. \nInvites all relevant stakeholders to contribute to and support World Rural \nDevelopment Day; \n \n6. \nRequests the Secretary-General to bring the present resolution to the \nattention of all Member States, the organizations of the United Nations system and \nother relevant stakeholders, including civil society, farmers\u2019 organizations, \nIndigenous Peoples, local communities, the private sector and academia, for \nappropriate observance. \n \n107th plenary meeting \n6 September 2024 \n \n",
  "paragraphs": {
    "1": "Decides to declare 6 July World Rural Development Day, to highlight the critical importance of rural development and transformation for the achievement of the Sustainable Development Goals;4",
    "2": "Invites all Member States, organizations of the United Nations system and other international and regional organizations, as well as non-governmental organizations, individuals and other relevant stakeholders, including civil society, farmers\u2019 organizations, Indigenous Peoples, local communities, the private sector and academia, as well as schools, to observe World Rural Development Day by presenting and promoting, as appropriate in national and regional contexts, concrete activities with regard to the sustainable development of rural areas and communities;",
    "3": "Invites the Department of Economic and Social Affairs of the Secretariat, in cooperation with Governments, relevant international and regional organizations, the specialized agencies and all other stakeholders, and mindful of the provisions contained in the annex to Economic and Social Council resolution 1980/67, to facilitate the organization and implementation of World Rural Development Day as a way of promoting rural development, raising awareness of the contribution of rural development in achieving the Sustainable Development Goals and supporting Member States in planning and coordinating activities for observing the Day;",
    "4": "Stresses that the cost of all activities that may arise from the implementation of the present resolution should be met from voluntary contributions;",
    "5": "Invites all relevant stakeholders to contribute to and support World Rural Development Day;",
    "6": "Requests the Secretary-General to bring the present resolution to the attention of all Member States, the organizations of the United Nations system and other relevant stakeholders, including civil society, farmers\u2019 organizations, Indigenous Peoples, local communities, the private sector and academia, for appropriate observance."
  },
  "agenda_items": [
    "Item 13"
  ],
  "symbol_references": [
    "A/78/L.84"
  ]
}