{
  "symbol": "A/RES/74/272",
  "filename": "A_RES_74_272.pdf",
  "title": "74/272. Construction of a new facility for the International Residual Mechanism for Criminal Tribunals, Arusha branch",
  "text": "United Nations \nA/RES/74/272\n \n \nGeneral Assembly \nDistr.: General \n14 April 2020 \n \n20-05573 (E)    160420     \n*2005573* \n \n \nSeventy-fourth session \nAgenda item 147 \nFinancing of the International Residual Mechanism for \nCriminal Tribunals \n \n \n \n \n Resolution adopted by the General Assembly \non 13 April 2020 \n \n \n \n \n[without reference to a Main Committee (A/74/L.55)] \n \n \n 74/272. Construction of a new facility for the International Residual \nMechanism for Criminal Tribunals, Arusha branch \n \n \n \nThe General Assembly, \n \nRecalling its resolutions 66/240 A of 24 December 2011, 66/240 B of 21 June 2012, \n67/244 B of 12 April 2013, 68/257 of 27 December 2013, 68/267 of 9 April 2014, \n69/276 of 2 April 2015, 70/258 of 1 April 2016, 71/282 of 6 April 2017, 72/270 of \n4 April 2018 and 73/288 of 15 April 2019, \n \nHaving considered the report of the Secretary-General1 and the related report of \nthe Advisory Committee on Administrative and Budgetary Questions,2  \n \n1. \nTakes note of the report of the Secretary-General;1 \n \n2. \nEndorses the conclusions and recommendations contained in the report of \nthe Advisory Committee on Administrative and Budgetary Questions, 2 subject to the \nprovisions of the present resolution;  \n \n3. \nNotes with appreciation the continued efforts of the Government of the \nUnited Republic of Tanzania in facilitating the construction project; \n \n4. \nNotes the progress made in the construction of the new premises, and \nrequests the Secretary-General to submit a final report to the General Assembly \nduring its seventy-sixth session; \n \n5. \nRecalls paragraphs 10 and 26 of the report of the Advisory Committee, \nurges the Secretary-General to intensify his efforts to ensure full implementation of \nthe project, including the remaining remediation works on the heating, ventilation and \n__________________ \n \n1  A/74/662. \n \n2  A/74/707. \n\nA/RES/74/272 \n \n20-05573\n2/2 \n \nair conditioning system and pending closeout activities, without further delay, within \nthe revised timelines and the total budget of 8,787,733 United States dollars approved \nfor the project, and requests him to report thereon in the context of his final report; \n \n6. \nRequests the Secretary-General, in the context of his final report, to \ninclude, inter alia, an analysis of updated and comprehensive information on lessons \nlearned and best practices, including areas of contract and project management, as \nwell as knowledge gained during the ongoing implementation of the remaining \nproject activities for application, as appropriate, to other construction projects; \n \n7. \nRecalls paragraph 14 of the report of the Advisory Committee, and \nrequests the Secretary-General to continue his efforts to pursue the recovery of the \ndirect and indirect costs arising from errors and delays by contracting partners, \nnamely the architect and the contractor, where economically feasible to do so, and to \nreport thereon in the context of his final report; \n \n8. \nNotes with concern the intention of the contractor to contest the deduction \nin the amount of approximately 230,000 dollars from the final payment, and in this \nregard encourages the Secretary-General to make every effort to bring this matter to \na swift conclusion; \n \n9. \nEncourages the Secretary-General to continue his efforts to include local \nknowledge and capacity in the implementation of the project. \n \n13 April 2020 \n \n \n",
  "paragraphs": {
    "1": "Takes note of the report of the Secretary-General;1",
    "2": "Endorses the conclusions and recommendations contained in the report of the Advisory Committee on Administrative and Budgetary Questions, 2 subject to the provisions of the present resolution;",
    "3": "Notes with appreciation the continued efforts of the Government of the United Republic of Tanzania in facilitating the construction project;",
    "4": "Notes the progress made in the construction of the new premises, and requests the Secretary-General to submit a final report to the General Assembly during its seventy-sixth session;",
    "5": "Recalls paragraphs 10 and 26 of the report of the Advisory Committee, urges the Secretary-General to intensify his efforts to ensure full implementation of the project, including the remaining remediation works on the heating, ventilation and air conditioning system and pending closeout activities, without further delay, within the revised timelines and the total budget of 8,787,733 United States dollars approved for the project, and requests him to report thereon in the context of his final report;",
    "6": "Requests the Secretary-General, in the context of his final report, to include, inter alia, an analysis of updated and comprehensive information on lessons learned and best practices, including areas of contract and project management, as well as knowledge gained during the ongoing implementation of the remaining project activities for application, as appropriate, to other construction projects;",
    "7": "Recalls paragraph 14 of the report of the Advisory Committee, and requests the Secretary-General to continue his efforts to pursue the recovery of the direct and indirect costs arising from errors and delays by contracting partners, namely the architect and the contractor, where economically feasible to do so, and to report thereon in the context of his final report;",
    "8": "Notes with concern the intention of the contractor to contest the deduction in the amount of approximately 230,000 dollars from the final payment, and in this regard encourages the Secretary-General to make every effort to bring this matter to a swift conclusion;",
    "9": "Encourages the Secretary-General to continue his efforts to include local knowledge and capacity in the implementation of the project. 13 April 2020"
  },
  "agenda_items": [
    "Item 147"
  ],
  "symbol_references": [
    "A/74/L.55"
  ]
}