{
  "symbol": "A/RES/75/263",
  "filename": "A_RES_75_263.pdf",
  "title": "75/263. International Year of Millets, 2023",
  "text": "United Nations \nA/RES/75/263\n \n \nGeneral Assembly \nDistr.: General \n5 March 2021 \n \n21-03036 (E)    090321 \n*2103036* \n \n \nSeventy-fifth session \nAgenda item 14 \nIntegrated and coordinated implementation of and follow-up \nto the outcomes of the major United Nations conferences and \nsummits in the economic, social and related fields \n \n \n \n \n Resolution adopted by the General Assembly \non 3 March 2021 \n \n \n \n \n[without reference to a Main Committee (A/75/L.63 and A/75/L.63/Add.1)] \n \n \n 75/263. International Year of Millets, 2023 \n \n \n \nThe General Assembly, \n \nReaffirming its resolution 70/1 of 25 September 2015, entitled \u201cTransforming \nour world: the 2030 Agenda for Sustainable Development\u201d, in which it adopted a \ncomprehensive, far-reaching and people-centred set of universal and transformative \nSustainable Development Goals and targets, its commitment to working tirelessly for \nthe full implementation of the Agenda by 2030, its recognition that eradicating \npoverty in all its forms and dimensions, including extreme poverty, is the greatest \nglobal challenge and an indispensable requirement for sustainable development, its \ncommitment to achieving sustainable development in its three dimensions \u2013 economic, \nsocial and environmental \u2013 in a balanced and integrated manner, and to building upon \nthe achievements of the Millennium Development Goals and seeking to address their \nunfinished business, \n \nReaffirming also its resolutions 53/199 of 15 December 1998 and 61/185 of \n20 December 2006 on the proclamation of international years, and Economic and \nSocial Council resolution 1980/67 of 25 July 1980 on international years and \nanniversaries, in particular paragraphs 1 to 10 of the annex thereto on the agreed \ncriteria for the proclamation of international years, as well as paragraphs 13 and 14, \nin which it is stated that an international year should not be proclaimed before the \nbasic arrangements for its organization and financing have been made, \n \nRecalling resolution 10/2019 of 28 June 2019, adopted by the Conference of the \nFood and Agriculture Organization of the United Nations at its forty-first session,1 \n__________________ \n \n1 Food and Agriculture Organization of the United Nations, document C 2019/REP, appendix G. \n\nA/RES/75/263 \nInternational Year of Millets, 2023\n \n21-03036\n2/3 \n \n \nConsidering the urgent need to raise awareness of the climate-resilient and \nnutritional benefits of millets and to advocate for diversified, balanced and healthy \ndiets through the increased sustainable production and consumption of millets, \n \nRecognizing the important contribution of millets to the cultivation of nutritious \nfoods in climate-adverse environments, \n \nRecalling its resolution 70/259 of 1 April 2016, by which it proclaimed the \nUnited Nations Decade of Action on Nutrition (2016\u20132025), as well as its resolution \n72/306 of 24 July 2018 on the implementation of the Decade, and the need to promote \nsustainable food systems that foster diversified, balanced and healthy diets that \ninclude a variety of foods, \n \nRecognizing that the agriculture sector is inextricably linked with the entire food \nsystem and that agricultural technologies and digitalization can add value throughout \nthe food system by improving the sustainability of storage, transport, trade, \nprocessing, transformation, retail, loss and waste reduction and recycling, as well as \ninteractions among these processes, \n \nRecalling its resolution 72/239 of 20 December 2017, by which it proclaimed \nthe United Nations Decade of Family Farming (2019\u20132028), and the global launch of \nthe Decade in Rome on 29 May 2019, and cognizant of the important contributions \nof millets, particularly indigenous crops, to nutrition, livelihoods and incomes of \nfamily farmers, especially small-scale family farmers, and that they can thus play an \nimportant role in contributing to food security and in eradicating poverty and hence \nin contributing to the achievement of the Sustainable Development Goals, \n \nNoting the importance of sustainable farming and production practices to the \nlivelihoods of millions of rural farm families and small family farmers around the \nworld, \n \nCognizant of the historical contribution of millets to food security, nutrition, \nlivelihoods and incomes of family farmers, \n \nConcerned about the current need to invigorate market recognition of the \nbenefits of millets and to promote efficient value chains, \n \nCalling upon Member States to take effective measures, as appropriate, to help \nto integrate smallholders into global production, value and supply chains for the \nsustainable production and consumption of millets, \n \nRecognizing the vast genetic diversity of millets and their adaptive capacities to \na range of production environments, \n \nRecognizing also the need to empower women through education, to promote \nhealthy diets, \n \nRecognizing further that the observance of an International Year of Millets in \n2023 by the international community would contribute significantly to raising \nawareness on these issues, \n \n1. \nDecides to declare 2023 the International Year of Millets; \n \n2. \nInvites all Member States, organizations of the United Nations system, \nother international and regional organizations and other relevant stakeholders, \nincluding civil society, the private sector and academia, to observe the International \nYear, as appropriate, through activities aimed at raising awareness of and directing \npolicy attention to the nutritional and health benefits of millet consumption and their \nsuitability for cultivation under adverse and changing climatic conditions, while also \ndirecting policy attention to improving value chain efficiencies; \n\nInternational Year of Millets, 2023 \nA/RES/75/263\n \n3/3\n21-03036 \n \n \n3. \nInvites the Food and Agriculture Organization of the United Nations, \nmindful of the provisions contained in the annex to Economic and Social Council \nresolution 1980/67, to facilitate the implementation of the International Year; \n \n4. \nAlso invites the Food and Agriculture Organization of the United Nations, \nmindful of the provisions of paragraphs 23 to 27 of the annex to Economic and Social \nCouncil resolution 1980/67, to inform the General Assembly at its seventy-ninth \nsession regarding the implementation of the present resolution, including an \nevaluation of the International Year; \n \n5. \nStresses that the costs of all the activities that may arise from the \nimplementation of the present resolution should be met through voluntary \ncontributions, including from the private sector; \n \n6. \nInvites all relevant stakeholders to contribute to and support the \nInternational Year; \n \n7. \nRequests the Secretary-General to bring the present resolution to the \nattention of all Member States, the organizations of the United Nations system and \nother relevant stakeholders, including civil society, the private sector and academia, \nfor appropriate observance. \n \n56th plenary meeting \n3 March 2021 \n \n",
  "paragraphs": {
    "1": "Decides to declare 2023 the International Year of Millets;",
    "2": "Invites all Member States, organizations of the United Nations system, other international and regional organizations and other relevant stakeholders, including civil society, the private sector and academia, to observe the International Year, as appropriate, through activities aimed at raising awareness of and directing policy attention to the nutritional and health benefits of millet consumption and their suitability for cultivation under adverse and changing climatic conditions, while also directing policy attention to improving value chain efficiencies; International Year of Millets, 2023 A/RES/75/263 3/3 21-03036",
    "3": "Invites the Food and Agriculture Organization of the United Nations, mindful of the provisions contained in the annex to Economic and Social Council resolution 1980/67, to facilitate the implementation of the International Year;",
    "4": "Also invites the Food and Agriculture Organization of the United Nations, mindful of the provisions of paragraphs 23 to 27 of the annex to Economic and Social Council resolution 1980/67, to inform the General Assembly at its seventy-ninth session regarding the implementation of the present resolution, including an evaluation of the International Year;",
    "5": "Stresses that the costs of all the activities that may arise from the implementation of the present resolution should be met through voluntary contributions, including from the private sector;",
    "6": "Invites all relevant stakeholders to contribute to and support the International Year;",
    "7": "Requests the Secretary-General to bring the present resolution to the attention of all Member States, the organizations of the United Nations system and other relevant stakeholders, including civil society, the private sector and academia, for appropriate observance. 56th plenary meeting 3 March 2021"
  },
  "agenda_items": [
    "Item 14"
  ],
  "symbol_references": [
    "A/75/L.63"
  ]
}