{
  "symbol": "A/RES/79/145",
  "filename": "A_RES_79_145.pdf",
  "title": "79/145. Sustainable fisheries, including through the 1995 Agreement for the Implementation of the Provisions of the United Nations Convention on the Law of the Sea of 10 December 1982 relating to the Conservation and Management of Straddling Fish Stocks and Highly Migratory Fish Stocks, and related instruments",
  "text": "United Nations \nA/RES/79/145\n \nGeneral Assembly \nDistr.: General \n16 December 2024 \n24-23839 (E) \n*2423839* \n \n \nSeventy-ninth session \nAgenda item 75 (b) \nOceans and the law of the sea: sustainable fisheries, including \nthrough the 1995 Agreement for the Implementation of the \nProvisions of the United Nations Convention on the Law of the \nSea of 10 December 1982 relating to the Conservation and \nManagement of Straddling Fish Stocks and Highly Migratory \nFish Stocks, and related instruments \n \n \n \n \n Resolution adopted by the General Assembly \non 12 December 2024 \n \n \n[without reference to a Main Committee (A/79/L.38)] \n \n \n 79/145. Sustainable fisheries, including through the 1995 Agreement for \nthe Implementation of the Provisions of the United Nations \nConvention on the Law of the Sea of 10 December 1982 relating to \nthe Conservation and Management of Straddling Fish Stocks and \nHighly Migratory Fish Stocks, and related instruments \n \n \n \nThe General Assembly, \n \nReaffirming its annual resolutions on sustainable fisheries, including resolution \n78/68 of 9 December 2023, and other relevant resolutions,  \n \nRecalling the relevant provisions of the United Nations Convention on the Law \nof the Sea (the Convention), 1  and bearing in mind the relationship between the \nConvention and the 1995 Agreement for the Implementation of the Provisions of the \nUnited Nations Convention on the Law of the Sea of 10 December 1982 relating to \nthe Conservation and Management of Straddling Fish Stocks and Highly Migratory \nFish Stocks (the Agreement),2 \n \nNoting with satisfaction that 16 November 2024 marked the thirtieth \nanniversary of the entry into force of the Convention,  \n \nWelcoming ratifications of and accessions to the Agreement and the fact that a \ngrowing number of States, entities referred to in the Convention and in article 1, \nparagraph 2 (b), of the Agreement, and subregional and regional fisheries management \n_______________ \n \n1 United Nations, Treaty Series, vol. 1833, No. 31363. \n \n2 Ibid., vol. 2167, No. 37924. \n\nA/RES/79/145 \nSustainable fisheries, including through the 1995 Agreement for the Implementation \nof the Provisions of the United Nations Convention on the Law of the Sea of \n10 December 1982 relating to the Conservation and Management of Straddling \nFish Stocks and Highly Migratory Fish Stocks, and related instruments \n \n24-23839\n2/50 \n \norganizations and arrangements, have taken measures, as appropriate, towards the \nimplementation of the provisions of the Agreement, in order to improve their \nmanagement regimes, \n \nNoting with satisfaction the upcoming thirtieth anniversary of the opening for \nsignature of the Agreement on 4 December 1995 at New York, as well as the upcoming \nthirtieth anniversary of the adoption of the Code of Conduct for Responsible Fisheries \nof the Food and Agriculture Organization of the United Nations (the Code),  \n \nWelcoming the holding of the resumed Review Conference on the Agreement, \nin New York from 22 to 26 May 2023, and its outcome,3 \n \nWelcoming also the work of the Food and Agriculture Organization of the United \nNations and its Committee on Fisheries, and recognizing in particular the Code and \nother related instruments, including the international plans of action, which set out \nprinciples and global standards of behaviour for responsible practices for the \nconservation of fisheries resources and the management and development of fisheries, \nas well as the 2005 Rome Declaration on Illegal, Unreported and Unregulated Fishing, \n \nNoting with appreciation the outcomes, including the decisions and \nrecommendations, of the thirty-sixth session of the Committee on Fisheries of the \nFood and Agriculture Organization of the United Nations, held in Rome from 8 to \n12 July 2024,  \n \nRecognizing the importance of data collection through accurate and reliable \nreporting and monitoring of catches, including by-catch and discards, as a \nfundamental element of effective fisheries management that provides a basis for \nscientific stock assessment, and ecosystem approaches to fisheries management, \n \nRecalling that the United Nations Decade of Ocean Science for Sustainable \nDevelopment and the United Nations Decade on Ecosystem Restoration cover the \nperiod from 2021 to 2030 and provide important opportunities to address gaps in \nocean science, increase knowledge, improve synergies and support the sustainable \nconservation and management of marine resources, as well as to prevent, halt and \nreverse the degradation of ecosystems worldwide, \n \nNoting with concern that the effective management of marine capture fisheries \nhas been made difficult in some areas by unreliable and incomplete information and \ndata caused by, inter alia, unreported and misreported fish catch and fishing effort and \nthat this lack of accurate data undermines the assessment of fish stocks and \ncontributes to overfishing in some areas, and in this regard recalling that members of \nregional fisheries management organizations or arrangements must fully comply with \ntheir associated data-collection and reporting obligations, including to ensure that \nrequired data submissions are complete, reliable and submitted in a timely manner, \n \nRecognizing the second World Ocean Assessment, launched in April 2021, \nwhich provides information on the state of the marine environment, including \nsocioeconomic aspects, in relation to, inter alia, fisheries,  \n \nRecognizing also the significant contribution of sustainable fisheries and \naquaculture to food security and nutrition, income, wealth and poverty alleviation for \npresent and future generations, noting that the Committee on Fisheries, at its thirty-\nsixth session, underscored the importance of their contribution in meeting current and \nfuture food security and sustainable growth needs,  \n_______________ \n \n3 A/CONF.210/2023/6, annex. \n\nSustainable fisheries, including through the 1995 Agreement for the Implementation \nof the Provisions of the United Nations Convention on the Law of the Sea of \n10 December 1982 relating to the Conservation and Management of Straddling \nFish Stocks and Highly Migratory Fish Stocks, and related instruments \nA/RES/79/145\n \n3/50\n24-23839 \n \n \nTaking note of the report of the twenty-fourth session of the United Nations \nOpen-ended Informal Consultative Process on Oceans and the Law of the Sea, \nfocusing on the topic \u201cThe ocean as a source of sustainable food\u201d, 4 \n \nWelcoming in this regard the continuous attention given by the Committee on \nWorld Food Security of the Food and Agriculture Organization of the United Nations \nto the role of aquatic food in nutrition and food security, as well as the growing \nrecognition of this role by the international community,  \n \nNoting especially the importance of the availability of highly nutritious food for \nlow-income populations, \n \nWelcoming in this regard the work by the Food and Agriculture Organization of \nthe United Nations on strengthening food security and nutrition as a contribution to \nachieving the Sustainable Development Goals, \n \nWelcoming in this regard also the outcome document of the United Nations \nConference on Sustainable Development, held in Rio de Janeiro, Brazil, from 20 to \n22 June 2012, entitled \u201cThe future we want\u201d, as endorsed by the General Assembly \nin its resolution 66/288 of 27 July 2012, \n \nWelcoming the outcome document of the United Nations summit for the \nadoption of the post-2015 development agenda, held from 25 to 27 September 2015, \nentitled \u201cTransforming our world: the 2030 Agenda for Sustainable Development\u201d, as \nadopted by the General Assembly in its resolution 70/1 of 25 September 2015, and in \nthis regard reaffirming the commitment to conserve and sustainably use the oceans, \nseas and marine resources for sustainable development, as reflected in Goal 14 of the \noutcome document, \n \nNoting the voluntary national reviews on the implementation of the 2030 \nAgenda for Sustainable Development and its Sustainable Development Goals, \nparticularly on Goal 14, \n \nRecalling its resolution 76/296 of 21 July 2022, in which it endorsed the \ndeclaration entitled \u201cOur ocean, our future, our responsibility\u201d adopted by the high-\nlevel United Nations Conference to Support the Implementation of Sustainable \nDevelopment Goal 14: Conserve and sustainably use the oceans, seas and marine \nresources for sustainable development, held in Lisbon from 27 June to 1 July 2022, \nas well as its resolution 71/312 of 6 July 2017, in which it endorsed the declaration \nentitled \u201cOur ocean, our future: call for action\u201d adopted by the Conference held in \nNew York from 5 to 9 June 2017, and in this regard reaffirming the important role of \nthe declarations in demonstrating the collective determination to act decisively and \nurgently to improve the health, productivity, sustainable use and resilience of the \nocean and its ecosystem, \n \nRecognizing the important contributions of the partnership dialogues and \nvoluntary commitments made in the context of the 2022 United Nations Conference \nto Support the Implementation of Sustainable Development Goal 14: Conserve and \nsustainably use the oceans, seas and marine resources for sustainable development to \nthe effective and timely implementation of Sustainable Development Goal 14, \n \nRecalling the decision of the General Assembly that the high-level 2025 United \nNations Conference to Support the Implementation of Sustainable Development Goal \n14: Conserve and sustainably use the oceans, seas and marine resources for \nsustainable development, to be co-hosted by Costa Rica and France, would be \n_______________ \n \n4 A/79/207. \n\nA/RES/79/145 \nSustainable fisheries, including through the 1995 Agreement for the Implementation \nof the Provisions of the United Nations Convention on the Law of the Sea of \n10 December 1982 relating to the Conservation and Management of Straddling \nFish Stocks and Highly Migratory Fish Stocks, and related instruments \n \n24-23839\n4/50 \n \norganized in Nice, France, from 9 to 13 June 2025, to support the implementation of \nSustainable Development Goal 14, including sustainable fisheries management, \n \nRecalling also the decision in its resolution 71/124 of 7 December 2016 to \ndesignate 2 May as World Tuna Day, \n \nRecalling further the decision in its resolution 72/72 of 5 December 2017 to \nproclaim 5 June the International Day for the Fight against Illegal, Unreported and \nUnregulated Fishing, to draw attention to the threats posed by illegal, unreported and \nunregulated fishing activities to the sustainable use of fisheries resources as well as \nto ongoing efforts to fight these activities, \n \nRecalling that, in \u201cThe future we want\u201d, States were encouraged to give due \nconsideration to implementing the Committee on World Food Security Voluntary \nGuidelines on the Responsible Governance of Tenure of Land, Fisheries and Forests \nin the Context of National Food Security,5 \n \nRecalling with appreciation the high-level special event on the tenth anniversary \nof the Voluntary Guidelines for Securing Sustainable Small-scale Fisheries in the \nContext of Food Security and Poverty Eradication, 6 organized during the thirty-sixth \nsession of the Committee on Fisheries of the Food and Agriculture Organization of \nthe United Nations on 8 July 2024,  \n \nNoting that the Committee on Fisheries, at its thirty-fifth session, called upon \nall States to enable fishers and fish workers in small-scale fisheries to participate in \nthe process of decision-making concerning fisheries management, and reiterated the \nfundamental role that a new subcommittee on fisheries management could play in \nrelation to sustainable small-scale fisheries,  \n \nRecalling the Voluntary Guidelines for Securing Sustainable Small-scale \nFisheries in the Context of Food Security and Poverty Eradication, \n \nNoting, in this regard, the convening of the second Small-scale Fisheries \nSummit, in Rome from 5 to 7 July 2024, and that the Committee on Fisheries, at its \nthirty-sixth session, recognized the importance of the Small-scale Fisheries Summit \nas a platform for small-scale fisheries actors to exchange views and express needs to \nsecure sustainable small-scale fisheries and encouraged the Summit be held every two \nyears prior to sessions of the Committee on Fisheries,  \n \nReaffirming the urgent need for action at all levels, relying on the best available \nscientific information to ensure the long-term sustainable use and management of \nfisheries resources through the wide application of the precautionary approach and \necosystem approaches, \n \nWelcoming the holding of the first session of the Subcommittee on Fisheries \nManagement of the Committee on Fisheries of the Food and Agriculture Organization \nof the United Nations virtually, from 15 to 18 January 2024, and noting that the \nCommittee on Fisheries, at its thirty-sixth session, reaffirmed the role of the \nSubcommittee as a technical forum to identify priority issues, and advance \ndiscussions and future work on how to improve fisheries management in line with the \nCode and related instruments,  \n \nReiterating its concern over the current and projected adverse effects of climate \nchange on food security and the sustainability of fisheries, noting in that regard the \nwork of the Intergovernmental Panel on Climate Change, the Food and Agriculture \nOrganization of the United Nations and the United Nations Environment Programme, \n_______________ \n \n5 Food and Agriculture Organization of the United Nations, document CL 144/9 (C 2013/20), \nappendix D. \n \n6 See Food and Agriculture Organization of the United Nations, document COFI/2022/4.1/Rev.1. \n\nSustainable fisheries, including through the 1995 Agreement for the Implementation \nof the Provisions of the United Nations Convention on the Law of the Sea of \n10 December 1982 relating to the Conservation and Management of Straddling \nFish Stocks and Highly Migratory Fish Stocks, and related instruments \nA/RES/79/145\n \n5/50\n24-23839 \n \nand noting with concern the findings of the Intergovernmental Panel in its special \nreport on the ocean and cryosphere in a changing climate, \n \nRecalling the entry into force of the Paris Agreement,7 and noting that it aims to \nstrengthen the global response to the threat of climate change, including by increasing \nthe ability to adapt to the adverse impacts of climate change and foster climate \nresilience, \n \nNoting the advisory opinion on climate change and international law rendered \nby the International Tribunal on the Law of the Sea on 21 May 2024,8 \n \nNoting with appreciation the comprehensive review of the impacts of climate \nchange on fisheries and aquaculture, as well as adaptation and mitigation options \nundertaken by the Food and Agriculture Organization of the United Nations, 9 \n \nReaffirming its commitment to ensuring that conservation and management \nmeasures adopted by regional fisheries management organizations and arrangements \nare based on the best available scientific information, \n \nWelcoming the actions of those States and regional fisheries management \norganizations and arrangements that have already begun to carry out work to increase \nthe climate resilience of fisheries and aquaculture in response to the adverse impacts \nof climate change, and underscoring the need for international cooperation to support \nStates in such efforts, \n \nTaking note of the report of the Food and Agriculture Organization of the United \nNations entitled The State of World Fisheries and Aquaculture 2024, in which it stated \nthat concern over the state of marine fisheries resources continued despite noticeable \nimprovements in several regions, with examples confirming that effective fisheries \nmanagement leads to stock recovery and increased catches, and called for urgent \naction to reverse the declining stock trend,  \n \nRecognizing the need for enhanced capacity-building, technical assistance and \ninternational cooperation to support developing countries, in particular small island \ndeveloping States, to develop long-term monitoring of marine fish stocks, especially \nin relation to small-scale and artisanal fisheries, \n \nConcerned that only a limited number of States have taken measures to \nimplement, individually and through regional fisheries management organizations \nand arrangements, the International Plan of Action for the Management of Fishing \nCapacity adopted by the Food and Agriculture Organization of the United Nations, \n \nRecalling the International Plan of Action to Prevent, Deter and Eliminate \nIllegal, Unreported and Unregulated Fishing adopted by the Food and Agriculture \n \nOrganization of the United Nations, \n \nParticularly concerned that illegal, unreported and unregulated fishing \ncontinues to constitute a serious threat to fish stocks and marine habitats and \necosystems, to the detriment of sustainable fisheries as well as the food security and \nthe economies of many States, particularly developing States, \n_______________ \n \n7 See FCCC/CP/2015/10/Add.1, decision 1/CP.21, annex. \n \n8 Available at www.itlos.org/fileadmin/itlos/documents/cases/31/Advisory_Opinion/ \nC31_Adv_Op_21.05.2024_orig.pdf.  \n \n9 See Manuel Barange and others, eds., Impacts of Climate Change on Fisheries and Aquaculture \u2013 \nSynthesis of Current Knowledge, Adaptation and Mitigation Options, FAO Fisheries and \nAquaculture Technical Paper 627 (Rome, FAO, 2018). \n\nA/RES/79/145 \nSustainable fisheries, including through the 1995 Agreement for the Implementation \nof the Provisions of the United Nations Convention on the Law of the Sea of \n10 December 1982 relating to the Conservation and Management of Straddling \nFish Stocks and Highly Migratory Fish Stocks, and related instruments \n \n24-23839\n6/50 \n \n \nRecognizing the importance of States\u2019 and relevant international fisheries \norganizations\u2019 expanding existing efforts to address illegal, unreported and \nunregulated fishing, \n \nConcerned that some operators increasingly take advantage of the globalization \nof fishery markets to trade fishery products stemming from illegal, unreported and \nunregulated fishing and make economic profits from those operations, which \nconstitutes an incentive for them to pursue their activities, \n \nRecognizing that the effective deterrence and combating of illegal, unreported \nand unregulated fishing has significant financial and other resource implications for \nall States, in particular developing States, \n \nRecognizing also that fishing by vessels without nationality on the high seas \nundermines relevant objectives of the Convention and the Agreement to conserve and \nsustainably manage marine resources, and noting with concern that fishing vessels \nwithout nationality operate on the high seas without governance and oversight, \n \nRecognizing further the role of the Global Record of Fishing Vessels, \nRefrigerated Transport Vessels and Supply Vessels in the concerted fight against \nillegal, unreported and unregulated fishing, \n \nRecognizing the duty provided in the Convention, the Agreement to Promote \nCompliance with International Conservation and Management Measures by Fishing \nVessels on the High Seas (the Compliance Agreement),10 the Agreement and the Code \nfor flag States to effectively exercise jurisdiction and control over fishing vessels \nflying their flag, and vessels flying their flag which provide support to fishing vessels, \nto ensure that the activities of such fishing and support vessels do not undermine the \neffectiveness of conservation and management measures taken in accordance with \ninternational law and adopted at the national, subregional, regional or global levels, \n \nNoting the advisory opinion of the International Tribunal for the Law of the Sea \non the request for an advisory opinion submitted by the Subregional Fisheries \nCommission, issued on 2 April 2015, \n \nRecognizing the importance of adequately regulating, monitoring and \ncontrolling trans-shipment at sea, including on the high seas, to contribute to \ncombating illegal, unreported and unregulated fishing activities, \n \nNoting in this regard the Voluntary Guidelines for Trans-shipment as a new \ninstrument within the framework of the Code, \n \nNoting the obligation of all States, in accordance with international law, as \nreflected in the relevant provisions of the Convention, to cooperate in the conservation \nand management of living marine resources, and recognizing the importance of \ncoordination and cooperation at the global, regional, subregional and national levels \nin the areas, inter alia, of marine scientific research, data collection, information-\nsharing, capacity-building and training for the conservation, management and \nsustainable development of living marine resources, \n \nAcknowledging the importance of ocean data buoy systems moored in areas \nbeyond national jurisdiction to sustainable development, promoting safety at sea and \nlimiting human vulnerability to natural disasters, due to their use in weather and \nmarine forecasts, fisheries management, tsunami forecasts and climate prediction, and \nexpressing concern that most damage to ocean data buoys, such as moored buoys and \ntsunameters, frequently results from actions taken by some fishing operations which \nrender the buoys inoperable, \n_______________ \n \n10 United Nations, Treaty Series, vol. 2221, No. 39486. \n\nSustainable fisheries, including through the 1995 Agreement for the Implementation \nof the Provisions of the United Nations Convention on the Law of the Sea of \n10 December 1982 relating to the Conservation and Management of Straddling \nFish Stocks and Highly Migratory Fish Stocks, and related instruments \nA/RES/79/145\n \n7/50\n24-23839 \n \n \nWelcoming in this regard the adoption of measures by States, individually or \nthrough regional fisheries management organizations and arrangements, to protect \nocean data buoy systems from the impacts of fishing activities, \n \nEncouraging States, individually or through regional fisheries management \norganizations and arrangements, to cooperate to ensure that interactions between \nfishing operations and ocean data buoys on the high seas are minimized, \n \nRecognizing the need for States, individually and through regional fisheries \nmanagement organizations and arrangements, to continue to develop and implement, \nconsistent with international law, effective port State measures to combat illegal, \nunreported and unregulated fishing and to contribute to addressing overfishing, the \ncritical need for cooperation with developing States to build their capacity, and the \nimportance of cooperation between the Food and Agriculture Organization of the \nUnited Nations and the International Maritime Organization in this regard, \n \nRecalling the entry into force of the Agreement on Port State Measures to \nPrevent, Deter and Eliminate Illegal, Unreported and Unregulated Fishing of the Food \nand Agriculture Organization of the United Nations in 2016, 11 \n \nRecognizing the efforts of States, individually and through regional fisheries \nmanagement organizations and arrangements, to implement its resolution 46/215 of \n20 December 1991, in which the General Assembly called for a global moratorium on \nall large-scale pelagic drift-net fishing, including collaborative fisheries enforcement \nactivities, \n \nConcerned that marine pollution from all sources constitutes a serious threat to \nhuman health and safety, endangers fish stocks, marine biodiversity and marine and \ncoastal habitats and has significant costs to local and national economies, \n \nRecognizing that marine debris is a global transboundary pollution problem and \nthat, owing to the many different types and sources of marine debris, different \napproaches to its prevention and removal are necessary, including the identification \nof such sources and environmentally sound techniques for its removal, \n \nExpressing concern over the serious threat to fisheries and aquaculture in marine \nareas posed by pollution from land-based sources, including sewage pollution, and \nencouraging coordinated efforts by States and organizations to fight the discharge of \nuntreated and environmentally hazardous sewage into coastal ecosystems, \n \nRecognizing that the majority of marine debris, including plastics and \nmicroplastics, entering the seas and oceans is considered to originate from land-based \nsources, while acknowledging that sea-based sources of marine litter are also \nsignificant in some areas, \n \nAcknowledging that marine pollution and debris from both land- and sea-based \nsources pose a risk to aquatic food systems and food safety, \n \nRecognizing that abandoned, lost or otherwise discarded fishing gear, is an \nincreasingly pervasive and destructive form of marine debris causing adverse impacts \non fish stocks, marine life and the marine environment, including through ghost \nfishing, and that urgent preventative action is needed, such as the marking and \nreporting of the loss of fishing gear in line with the Voluntary Guidelines on the \nMarking of Fishing Gear adopted by the Committee on Fisheries of the Food and \nAgriculture Organization of the United Nations, as well as retrieval and removal \naction,  \n_______________ \n \n11 Food and Agriculture Organization of the United Nations, document C 2009/REP and Corr.1\u20133, \nappendix E. \n\nA/RES/79/145 \nSustainable fisheries, including through the 1995 Agreement for the Implementation \nof the Provisions of the United Nations Convention on the Law of the Sea of \n10 December 1982 relating to the Conservation and Management of Straddling \nFish Stocks and Highly Migratory Fish Stocks, and related instruments \n \n24-23839\n8/50 \n \n \nNoting the holding of the first five sessions of the intergovernmental negotiating \ncommittee to develop an international legally binding instrument on plastic pollution, \nincluding in the marine environment, in Punta del Este, Uruguay, from 28 November \nto 2 December 2022, in Paris from 29 May to 2 June 2023, in Nairobi from 13 to \n19 November 2023, in Ottawa from 23 to 29 April 2024, and in Busan, Republic of \nKorea, from 25 November to 1 December 2024, respectively, based on a \ncomprehensive approach and with the ambition of completing its work by the end of \n2024 in line with the mandate of United Nations Environment Assembly resolution \n5/14,12 \n \nAcknowledging that anthropogenic underwater noise could have impacts on \ndifferent marine species, which could also have consequent socioeconomic impacts, \nincluding on fishing, and recalling in this regard the discussions on the issue at the \nnineteenth meeting of the United Nations Open-ended Informal Consultative Process \non Oceans and the Law of the Sea,13 \n \nTaking note of decision 15/24 of the Conference of the Parties to the Convention \non Biological Diversity on conservation and sustainable use of marine and coastal \nbiodiversity,14 in which the Conference noted the role of the Food and Agriculture \nOrganization of the United Nations as the global implementing body related to \nfisheries, and acknowledged the work done to mainstream biodiversity into the \nfisheries sector globally, \n \nNoting the amendment of the appendices to the Convention on International \nTrade in Endangered Species of Wild Fauna and Flora by the Conference of the Parties \nto that Convention to include a number of additional shark and ray species, \n \nNoting also the continuing gaps in knowledge and lack of data with respect to \nanthropogenic underwater noise and its impacts, and welcoming in this respect that \nthe Committee on Fisheries of the Food and Agriculture Organization of the United \nNations, at its thirty-fourth session, recognized the increased science-based \nknowledge on underwater anthropogenic noise and encouraged the Food and \nAgriculture Organization of the United Nations to assess its possible impacts, \nincluding its socioeconomic consequences, on marine resources in collaboration with \nrelevant international organizations such as the International Maritime Organization, \n \nReaffirming the importance of sustainable aquaculture to food security, \nrecognizing that, as indicated in The State of World Fisheries and Aquaculture 2024, \naquaculture has already demonstrated its crucial role in global food security, with its \nproduction growing at 5.2 per cent per year on average from 2000 to 2022, and that, \naccording to available statistics, aquaculture production of aquatic animals surpassed \nfor the first time in history capture fisheries production in 2022, \n \nRecognizing the potential of aquaculture for further growth, but also that the \nimportance of the environmental challenges the sector must face and address as it \nintensifies production demands new sustainable development strategies,  \n \nNoting in this regard that the Committee on Fisheries, at its thirty-sixth session, \nadopted the Guidelines for Sustainable Aquaculture, encouraged the Food and \nAgriculture Organization of the United Nations to raise awareness of the Guidelines, \npromote good practices, and seek funding to provide technical assistance and support \nin their implementation, \n \nNoting that the contribution of sustainable aquaculture to global fish supplies \ncontinues to respond to opportunities in developing countries to enhance local food \n_______________ \n \n12 UNEP/EA.5/Res.14. \n \n13 See A/73/124. \n \n14 See United Nations Environment Programme, document CBD/COP/15/17, sect. I. \n\nSustainable fisheries, including through the 1995 Agreement for the Implementation \nof the Provisions of the United Nations Convention on the Law of the Sea of \n10 December 1982 relating to the Conservation and Management of Straddling \nFish Stocks and Highly Migratory Fish Stocks, and related instruments \nA/RES/79/145\n \n9/50\n24-23839 \n \nsecurity and nutrition and poverty alleviation and, together with the efforts of other \naquaculture-producing countries, will make a significant contribution to meeting \nfuture demands in fish consumption, bearing in mind article 9 of the Code, \n \nNoting in this regard the concern about the potential risks and effects of \ngenetically engineered fish species on the health and sustainability of wild fish stocks \nand on the biodiversity of the aquatic environment, and recognizing in this respect the \nimportance of effective biosafety regulatory frameworks, their associated science-\nbased risk assessments, and international cooperation on biosafety, \n \nRecognizing the efforts made by States and regional fisheries management \norganizations and arrangements in regulating deep-sea fisheries, while still concerned \nthat some deep-sea fishing activities in certain areas are being carried out without the \nfull implementation of relevant paragraphs of previous resolutions, representing a \nthreat to vulnerable marine ecosystems, \n \nCalling attention to the particular vulnerabilities of small island developing \nStates, other developing coastal States and subsistence fishing communities whose \nlivelihoods, economic development and food security are heavily dependent on \nsustainable fisheries and will suffer disproportionately if sustainable fisheries are \nnegatively affected, \n \nCalling attention also to the circumstances affecting fisheries in many \ndeveloping States, in particular African States and small island developing States, and \nrecognizing the urgent need for capacity-building, including the transfer of marine \ntechnology and in particular fisheries- and aquaculture-related technology, to enhance \nthe ability of such States to exercise their rights in order to realize the benefits from \nfisheries resources and fulfil their obligations under international instruments, \n \nNoting the need to recognize and address the special role of women and the \nvulnerability of Indigenous Peoples and local communities and minorities in small-\nscale and artisanal fisheries, \n \nRecognizing the important contribution of women, Indigenous Peoples and local \ncommunities in the fisheries and aquaculture sectors, as well as challenges faced by \nwomen, Indigenous Peoples and local communities in these sectors, including lack of \naccess to social protection and unequal employment opportunities,  \n \nNoting in this regard the Santiago de Compostela Declaration for Equal \nOpportunities in the Fisheries and Aquaculture Sectors adopted by participants at the \nInternational Conference of Women in Fisheries, in November 2018, \n \nRecognizing the need to adopt, implement and enforce appropriate measures to \nminimize waste, by-catch and discards, including high-grading, loss of fishing gear \nand other factors that adversely affect the sustainability of fish stocks and ecosystems \nand, consequently, can also have harmful effects on the economies and food security \nof small island developing States, other developing coastal States and subsistence \nfishing communities, \n \nRecognizing also the need to adopt and implement appropriate measures, \nconsistent with the best available scientific information, to minimize by-catch of \nnon\u2011targeted species and juveniles through the effective management of fishing \nmethods, including the use and design of fish aggregating devices, in order to mitigate \nadverse effects on fish stocks and ecosystems, \n \nRecognizing further the need to further integrate ecosystem approaches into \nfisheries conservation and management and, more generally, the importance of \napplying ecosystem approaches to the management of human activities in the ocean, \nand noting in this regard the fifteenth round of informal consultations of States parties \n\nA/RES/79/145 \nSustainable fisheries, including through the 1995 Agreement for the Implementation \nof the Provisions of the United Nations Convention on the Law of the Sea of \n10 December 1982 relating to the Conservation and Management of Straddling \nFish Stocks and Highly Migratory Fish Stocks, and related instruments \n \n24-23839\n10/50 \n \nto the Agreement, focusing on the topic \u201cImplementation of an ecosystem approach \nto fisheries management\u201d, the Reykjavik Declaration on Responsible Fisheries in the \nMarine Ecosystem,15 the work of the Food and Agriculture Organization of the United \nNations related to guidelines for the implementation of the ecosystem approach to \nfisheries management and the importance of this approach to relevant provisions of \nthe Agreement and the Code, as well as decision VII/1116 and other relevant decisions \nof the Conference of the Parties to the Convention on Biological Diversity,  \n \nRecognizing the economic and cultural importance of sharks in many countries, \nthe biological importance of sharks in the marine ecosystem as key predatory species, \nthe vulnerability of certain shark species to overexploitation, the fact that some are \nthreatened with extinction, the need for measures to promote the long-term \nconservation, management and sustainable use of shark populations and fisheries, and \nthe relevance of the International Plan of Action for the Conservation and \nManagement of Sharks, adopted by the Food and Agriculture Organization of the \nUnited Nations in 1999, in providing guidance on the development of such measures, \n \nWelcoming in this regard the review by the Food and Agriculture Organization \nof the United Nations of the implementation of the International Plan of Action for \nthe Conservation and Management of Sharks, and its ongoing work in this regard, \n \nNoting with concern that basic data on shark stocks and harvests continue to be \nlacking and that not all regional fisheries management organizations and \narrangements have adopted conservation and management measures for directed \nshark fisheries and for the regulation of by-catch of sharks from other fisheries,  \n \nEncouraging the efforts and progress made by regional fisheries management \norganizations and arrangements to improve the collection of species-specific fisheries \nand biological data on sharks, and to adopt conservation and management measures \nbased on the best available scientific information to conserve shark species and \npromote their long-term sustainable management, and urging action within regional \nfisheries management organizations and arrangements to address implementation and \ncompliance within existing measures, \n \nWelcoming science-based measures taken by States to conserve and sustainably \nmanage sharks, and noting in this respect management measures taken by coastal \nStates, including limits on catch or fishing effort, technical measures, including by-\ncatch reduction measures, sanctuaries, closed seasons and areas and monitoring, \ncontrol and surveillance, \n \nRecalling the resolution entitled \u201cConservation and management of sharks\u201d 17 \nand decisions on sharks and rays, as amended at the eighteenth meeting of the \nConference of the Parties to the Convention on International Trade in Endangered \nSpecies of Wild Fauna and Flora, inter alia, the inclusion of additional species of \nsharks and rays in appendix II to that Convention18 at the nineteenth meeting of the \nConference of the Parties, held in Panama City from 14 to 25 November 2022, and \nrecalling also the ongoing work of the secretariat of that Convention, as well as other \norganizations, including the Indian Ocean Tuna Commission, the Southeast Asian \nFisheries Development Center and the Food and Agriculture Organization of the \nUnited Nations, on capacity-building to facilitate the implementation of requirements \nassociated with such listings,  \n_______________ \n \n15 E/CN.17/2002/PC.2/3, annex. \n \n16 See United Nations Environment Programme, document UNEP/CBD/COP/7/21, annex. \n \n17 See resolution Conf. 12.6 (Rev. CoP18) of the Conference of the Parties to the Convention on \nInternational Trade in Endangered Species of Wild Fauna and Flora. \n \n18 United Nations, Treaty Series, vol. 993, No. 14537. \n\nSustainable fisheries, including through the 1995 Agreement for the Implementation \nof the Provisions of the United Nations Convention on the Law of the Sea of \n10 December 1982 relating to the Conservation and Management of Straddling \nFish Stocks and Highly Migratory Fish Stocks, and related instruments \nA/RES/79/145\n \n11/50\n24-23839 \n \n \nRecalling also that the Conference of the Parties to the Convention on the \nConservation of Migratory Species of Wild Animals, at its fourteenth session, held in \nSamarkand, Uzbekistan, from 12 to 17 February 2024, added one new species of shark \nand two new species of rays to those listed in the appendices to that Convention, 19 \nbringing the number of listed shark and ray species to 40 species, \n \nRecalling further that the signatories to the Memorandum of Understanding on \nthe Conservation of Migratory Sharks, at their fourth meeting, held in Bonn, \nGermany, from 28 February to 3 March 2023, added one new species of shark to those \nlisted in annex I to that Memorandum of Understanding, and adopted a capacity-\nbuilding strategy aimed at supporting signatories with the implementation of the \nMemorandum of Understanding and its conservation plan,  \n \nNoting with concern the continuing practice of the removal of fins from sharks, \nwith the remainder of the carcass being discarded at sea, \n \nRecognizing the importance of marine species occupying low trophic levels in \nthe ecosystem and for food security, and the need to ensure their long-term \nsustainability, \n \nExpressing concern over continued incidental mortality, in fishing operations, \nof seabirds, particularly albatrosses and petrels, as well as other marine species, \nincluding sharks, fin-fish species, marine mammals and marine turtles, while \nrecognizing considerable efforts by States and through various regional fisheries \nmanagement organizations and arrangements to reduce incidental mortality as a result \nof by-catch, \n \nNoting with concern the significant threat that invasive alien species, such as \nthose carried and transferred by ballast water and by biofouling on ships, pose to \nmarine ecosystems and resources, \n \nRecognizing the importance of decent work and productive employment in the \nfishing sector, which is critical to sustainable livelihoods and food security, \n \nNoting the ongoing work by the Food and Agriculture Organization of the \nUnited Nations to develop Guidance on Social Responsibility in the Fisheries and \nAquaculture Value Chains, in cooperation with relevant stakeholders, including \nindustry and fish worker associations, and the call by the Committee on Fisheries, at \nits thirty-sixth session, to accelerate this work, \n \nI \nAchieving sustainable fisheries \n \n1. \nReaffirms the importance that it attaches to the long-term conservation, \nmanagement and sustainable use of the living marine resources of the world\u2019s oceans \nand seas and the obligations of States to cooperate to this end, in accordance with \ninternational law, as reflected in the relevant provisions of the Convention, in \nparticular the provisions on cooperation set out in Part V and Part VII, section 2, of \nthe Convention, and where applicable, the Agreement; \n \n2. \nCalls upon all States that have not done so, in order to achieve the goal of \nuniversal participation, to become parties to the Convention, which sets out the legal \nframework within which all activities in the oceans and seas must be carried out, \ntaking into account the relationship between the Convention and the Agreement; \n_______________ \n \n19 Ibid., vol. 1651, No. 28395. \n\nA/RES/79/145 \nSustainable fisheries, including through the 1995 Agreement for the Implementation \nof the Provisions of the United Nations Convention on the Law of the Sea of \n10 December 1982 relating to the Conservation and Management of Straddling \nFish Stocks and Highly Migratory Fish Stocks, and related instruments \n \n24-23839\n12/50 \n \n \n3. \nNotes with satisfaction that, in \u201cThe future we want\u201d,20 States addressed \nthe sustainable development of fisheries, recognized the significant contribution of \nfisheries to the three dimensions of sustainable development and stressed the crucial \nrole of healthy marine ecosystems, sustainable fisheries and sustainable aquaculture \nfor food security and nutrition and in providing for the livelihoods of millions of \npeople, and encourages States to implement the commitments made in \u201cThe future we \nwant\u201d; \n \n4. \nCalls upon States to implement the Sustainable Development Goals \noutlined in the outcome document of the United Nations summit for the adoption of \nthe post-2015 development agenda, entitled \u201cTransforming our world: the 2030 \nAgenda for Sustainable Development\u201d, as adopted by the General Assembly in its \nresolution 70/1, including Goal 14 to conserve and sustainably use the oceans, seas \nand marine resources for sustainable development, recalling that some of its targets \nwere to be met by 2020 and that the Goals and targets are integrated and indivisible;  \n \n5. \nReiterates, in this regard, the calls for action to be taken on an urgent basis \nto conserve and sustainably use the oceans, seas and marine resources for sustainable \ndevelopment made in the declarations entitled \u201cOur ocean, our future: call for \naction\u201d21 and \u201cOur ocean, our future, our responsibility\u201d;22 \n \n6. \nEncourages States to give due priority to the implementation of the Plan \nof Implementation of the World Summit on Sustainable Development (Johannesburg \nPlan of Implementation)23 in relation to achieving sustainable fisheries, especially \nrestoring depleted stocks to levels that can produce maximum sustainable yield on an \nurgent basis and, where possible, not later than 2015, and recalls that, in \u201cThe future \nwe want\u201d, States committed themselves to intensify their efforts to meet that target \nand to urgently take the measures necessary to maintain or restore all stocks at least \nto levels that can produce the maximum sustainable yield, with the aim of achieving \nthose goals in the shortest time feasible, as determined by their biological \ncharacteristics, and in order to achieve this, to urgently develop and implement \nscience-based management plans, including by reducing or suspending fishing catch \nand fishing effort commensurate with the status of the stock, consistent with \ninternational law, the applicable international instruments and relevant General \nAssembly resolutions and guidelines of the Food and Agriculture Organization of the \nUnited Nations; \n \n7. \nWelcomes the technical expertise of the Food and Agriculture Organization \nof the United Nations on fisheries and aquaculture, and notes in this regard its \npublications; \n \n8. \nEncourages States to promote the consumption of fish sourced from \nsustainably managed fisheries and sustainable aquaculture to support environmental, \nsocial and economic goals; \n \n9. \nAlso encourages States to consider sustainable aquaculture, including \nsustainable algae aquaculture, consistent with the Code and the Guidelines for \nSustainable Aquaculture, as a means to promote diversification of the food supply and \nof income, while ensuring that aquaculture is conducted responsibly and adverse \nimpacts on the environment are minimized; \n_______________ \n \n20 Resolution 66/288, annex. \n \n21 Resolution 71/312, annex. \n \n22 Resolution 76/296, annex. \n \n23 Report of the World Summit on Sustainable Development, Johannesburg, South Africa, \n26 August\u20134 September 2002 (United Nations publication, Sales No. E.03.II.A.1 and \ncorrigendum), chap. I, resolution 2, annex. \n\nSustainable fisheries, including through the 1995 Agreement for the Implementation \nof the Provisions of the United Nations Convention on the Law of the Sea of \n10 December 1982 relating to the Conservation and Management of Straddling \nFish Stocks and Highly Migratory Fish Stocks, and related instruments \nA/RES/79/145\n \n13/50\n24-23839 \n \n \n10. Reaffirms its resolution 78/317 of 16 July 2024, by which it adopted the \nAntigua and Barbuda Agenda for Small Island Developing States: A Renewed \nDeclaration for Resilient Prosperity, in which small island developing States sought \nthe support of the international community to conserve and sustainably use the ocean \nand its resources; \n \n11. \nRecalls its resolution 77/321 of 1 August 2023 on the Agreement under the \nUnited Nations Convention on the Law of the Sea on the Conservation and \nSustainable Use of Marine Biological Diversity of Areas beyond National \nJurisdiction, and invites States and regional economic integration organizations to \nconsider its implications for sustainable fisheries;  \n \n12. Expresses its serious concern regarding the impacts of global climate \nchange and ocean acidification on coral reefs and other ecosystems relevant to \nfisheries, and urges States, either directly or through appropriate subregional, regional \nor global organizations or arrangements, to intensify efforts to assess and address, as \nappropriate, the impacts of global climate change and ocean acidification on the \nsustainability of fish stocks and the habitats that support them, in particular the most \naffected ones; \n \n13. Notes, in this regard, the special report on the ocean and cryosphere in a \nchanging climate of the Intergovernmental Panel on Climate Change, and notes with \nconcern the findings contained therein; \n \n14. Invites States to continue capacity-building efforts and to promote \ninternational coordination on scientific research focused on monitoring the impacts \nof climate phenomena with impacts on fisheries, such as the El Ni\u00f1o/Southern \nOscillation (El Ni\u00f1o/La Ni\u00f1a), especially on small-scale and artisanal fisheries and \naquaculture; \n \n15. Notes that the Committee on Fisheries, at its thirty-sixth session, \ncommended the work carried out by the Food and Agriculture Organization of the \nUnited Nations in assessing, projecting and responding to the impacts of climate \nchange on aquatic food systems, and the development of a set of actions on climate-\nresilient fisheries and aquaculture of the Food and Agriculture Organization of the \nUnited Nations,24 in support of the Strategy on Climate Change for 2022\u20132031 of that \nOrganization and aligned with its Blue Transformation road map, and called upon the \nFood and Agriculture Organization of the United Nations to mobilize additional \nresources to scale up climate change adaptation and mitigation solutions; \n \n16. Also notes that the Committee on Fisheries, at its thirty-sixth session, \nwelcomed the progressive discussions on aquatic foods under the United Nations \nFramework Convention on Climate Change,25 and requested the Food and Agriculture \nOrganization of the United Nations to continue engaging with the Ocean and Climate \nChange Dialogue under that Convention and other relevant global forums, while \nencouraging its members to include consideration of aquatic foods into their \nnationally determined contributions and national adaptation plans with support from \nthe Food and Agriculture Organization of the United Nations; \n \n17. Emphasizes \nthe \nobligations \nof \nflag \nStates \nto \ndischarge \ntheir \nresponsibilities, in accordance with the Convention, the Agreement and the \nCompliance Agreement, to ensure compliance by vessels flying their flag with the \nconservation and management measures adopted and in force with respect to fisheries \nresources on the high seas; \n_______________ \n \n24 See Food and Agriculture Organization of the United Nations, document COFI/2024/INF/17. \n \n25 United Nations, Treaty Series, vol. 1771, No. 30822. \n\nA/RES/79/145 \nSustainable fisheries, including through the 1995 Agreement for the Implementation \nof the Provisions of the United Nations Convention on the Law of the Sea of \n10 December 1982 relating to the Conservation and Management of Straddling \nFish Stocks and Highly Migratory Fish Stocks, and related instruments \n \n24-23839\n14/50 \n \n \n18. Calls upon States and regional fisheries management organizations and \narrangements, as appropriate, to act urgently to assess the risks and potential adverse \nimpacts of climate change with respect to fish stocks, consider them when \nestablishing conservation and management measures and identifying options to \nreduce risks and adverse impacts with respect to fisheries management and the health \nand resilience of marine ecosystems and enhance efforts to cooperate to collect, \nexchange and publish scientific and technical data and best practices related to the \ndevelopment and implementation of adaptation strategies, and to assist developing \nStates in this regard, especially those that are particularly vulnerable to the adverse \nimpacts of climate change; \n \n19. Urges States and relevant organizations and arrangements to assess and \nconsider the impacts of climate change on fisheries and aquaculture sectors in their \npolicies and planning, as appropriate, without delay in order to identify and \nimplement effective adaptation strategies to reduce the vulnerability of these sectors \nto climate change; \n \n20. Notes, in this regard, that the Committee on Fisheries, at its thirty-sixth \nsession, acknowledged the role of regional fishery bodies in addressing climate \nchange impacts on fisheries and ecosystems, encouraged its members to advance \nefforts to fully consider climate change in regional fishery body conservation and \nmanagement measures, appreciated the engagement of the Food and Agriculture \nOrganization of the United Nations with such bodies on these issues, and encouraged \nthe Food and Agriculture Organization of the United Nations to facilitate information \nexchange and enhance regional cooperation and coordination with and among \nregional fishery bodies;  \n \n21. Welcomes the convening of the sixteenth meeting of the Conference of the \nParties to the Convention on Biological Diversity, takes note of its adopted decisions, \nencourages the Parties to fully and effectively implement the Convention and its \nProtocols, as well as the Kunming-Montreal Global Biodiversity Framework and its \ntargets relevant to fisheries and aquaculture, and recognizes the role of effectively \nmanaged sustainable fisheries in achieving their objectives; \n \n22. Calls upon all States, directly or through regional fisheries management \norganizations and arrangements, to apply widely, in accordance with international law \nand the Code, the precautionary approach and ecosystem approaches to the \nconservation, management and exploitation of fish stocks, and also calls upon States \nparties to the Agreement to implement fully the provisions of article 6 of the \nAgreement as a matter of priority; \n \n23. Urges States to increase their reliance on scientific advice in developing, \nadopting and implementing conservation and management measures, and to increase \ntheir efforts, including through international cooperation, to promote science for \nconservation and management measures that apply, in accordance with international \nlaw, the precautionary approach and ecosystem approaches to fisheries management, \nenhancing understanding of ecosystem approaches, in order to ensure the long-term \nconservation and sustainable use of living marine resources, and in this regard \nencourages the implementation of the Strategy for Improving Information on Status \nand Trends of Capture Fisheries of the Food and Agriculture Organization of the \nUnited Nations as a framework for the improvement and understanding of fishery \nstatus and trends; \n \n24. Calls upon all States, directly or through regional fisheries management \norganizations and arrangements, to apply stock-specific target and limit precautionary \nreference points, which, for target reference points, are intended to meet management \nobjectives, as described in annex II to the Agreement and in the Code, to ensure that \n\nSustainable fisheries, including through the 1995 Agreement for the Implementation \nof the Provisions of the United Nations Convention on the Law of the Sea of \n10 December 1982 relating to the Conservation and Management of Straddling \nFish Stocks and Highly Migratory Fish Stocks, and related instruments \nA/RES/79/145\n \n15/50\n24-23839 \n \npopulations of harvested stocks and, where necessary, associated or dependent species \nare maintained at or restored to sustainable levels, and to use these reference points \nfor triggering conservation and management action; \n \n25. Encourages States, directly or through regional fisheries management \norganizations and arrangements, to establish and implement rebuilding and recovery \nstrategies and plans where a stock is identified as being overfished, which should \ninclude time frames and probabilities of recovery aimed at bringing the stock back at \nleast to levels that can produce the maximum sustainable yield, and guided by \nscientific assessment and subjected to a periodic evaluation of progress; \n \n26. Also encourages States to apply the precautionary approach and ecosystem \napproaches in adopting and implementing conservation and management measures \naddressing, inter alia, by-catch, pollution and overfishing, and protecting habitats of \nspecific concern, taking into account existing guidelines developed by the Food and \nAgriculture Organization of the United Nations; \n \n27. Further encourages States to enhance or develop observer programmes, \nindividually or through regional fisheries management organizations or arrangements, \nin order to improve data collection on, inter alia, target and by-catch species, which \ncould also assist monitoring, control and surveillance tools, and to take into account \nstandards, forms of cooperation and other existing structures for such programmes as \ndescribed in article 25 of the Agreement and article 5 of the Code; \n \n28. Calls upon, in this regard, States, individually in line with their national \nlegislation or through regional fisheries management organizations or arrangements, \nto take steps as appropriate to ensure the safety of observers; \n \n29. Encourages States to implement, individually and through regional \nfisheries management organizations and arrangements, accurate, complete, reliable \nand effective data collection and reporting of required data on catches, including \nby\u2011catch and discards, and to review, validate and provide such data in support of \nscientific stock assessment and ecosystem approaches to fisheries management, as \nwell as monitoring and compliance activities, while noting the importance, \nparticularly for developing countries, of improving the capacity to collect and report \naccurate, complete, reliable and effective data; \n \n30. Encourages, in this regard, regional fisheries management organizations \nand arrangements and States to implement electronic systems for the collection and \nexchange of fisheries data needed for sustainable fisheries management and for \ndetecting and combating illegal, unreported and unregulated fishing, while \nacknowledging the importance of data harmonization, as appropriate;  \n \n31. Calls upon States and regional fisheries management organizations and \narrangements to collect and, where appropriate, report to the Food and Agriculture \nOrganization of the United Nations required catch and effort data, and fishery-related \ninformation, in a complete, accurate and timely way, including for straddling fish \nstocks and highly migratory fish stocks within and beyond areas under national \njurisdiction, discrete high seas fish stocks, and by-catch and discards; and, where they \ndo not exist, to establish processes to strengthen data collection, including through \ninnovative technologies, and reporting by members of regional fisheries management \norganizations and arrangements, including through regular reviews of member \ncompliance with such obligations, and, when such obligations are not met, require the \nmember concerned to rectify the problem, including through the preparation of plans \nof action with timelines; \n \n32. Notes \nthat \nthe \nCommittee \non \nFisheries, \nat \nits \nthirty-sixth \nsession,\u202fencouraged the Food and Agriculture Organization of the United Nations to \n\nA/RES/79/145 \nSustainable fisheries, including through the 1995 Agreement for the Implementation \nof the Provisions of the United Nations Convention on the Law of the Sea of \n10 December 1982 relating to the Conservation and Management of Straddling \nFish Stocks and Highly Migratory Fish Stocks, and related instruments \n \n24-23839\n16/50 \n \nfacilitate expert work to fill relevant data gaps and share expertise on stock \nassessment methodologies, and therefore affirms the importance of the Food and \nAgriculture Organization of the United Nations and its members working \ncooperatively to address these issues; \n \n33. Invites States and regional fisheries management organizations and \narrangements to cooperate with the Food and Agriculture Organization of the United \nNations in the implementation and further development of the Fisheries Resources \nMonitoring System initiative; \n \n34. Reaffirms paragraph 10 of its resolution 61/105 of 8 December 2006, and \ncalls upon States, including through regional fisheries management organizations or \narrangements, to urgently adopt and implement measures to fully implement the \nInternational Plan of Action for the Conservation and Management of Sharks for \ndirected and non\u2011directed shark fisheries, based on the best available scientific \ninformation, through, inter alia, limits on catch or fishing effort, by requiring that \nvessels flying their flag collect and regularly report data on shark catches, including \nspecies-specific data, discards and landings, undertaking, including through \ninternational cooperation, comprehensive stock assessments of sharks, reducing shark \nby-catch and by-catch mortality and, where scientific information is uncertain or \ninadequate, not increasing fishing effort in directed shark fisheries and urgently \nestablishing science-based management measures to ensure the long-term \nconservation, management and sustainable use of shark stocks and to prevent further \ndeclines of vulnerable or threatened shark stocks, and encourages the full utilization \nof dead sharks caught in the context of sustainably managed fisheries; \n \n35. Calls upon States to take immediate and concerted action to improve the \nimplementation of and compliance with existing regional fisheries management \norganizations or arrangements and national measures that regulate shark fisheries and \nincidental catch of sharks, in particular those measures which prohibit or restrict \nfisheries conducted solely for the purpose of harvesting shark fins and, where \nnecessary, to consider taking other measures, as appropriate, such as requiring that all \nsharks be landed with each fin naturally attached; \n \n36. Calls upon regional fisheries management organizations with the \ncompetence to regulate highly migratory species to strengthen or establish \nprecautionary, science-based conservation and management measures, as appropriate, \nfor sharks taken in fisheries within their convention areas consistent with the \nInternational Plan of Action for the Conservation and Management of Sharks; \n \n37. Encourages range States and regional economic integration organizations \nthat have not yet done so to become signatories to and implement the Memorandum \nof Understanding on the Conservation of Migratory Sharks under the Convention on \nthe Conservation of Migratory Species of Wild Animals, and invites non\u2011range States, \nintergovernmental organizations and international and national non\u2011governmental \norganizations or other relevant bodies and entities to consider becoming cooperating \npartners; \n \n38. Encourages States, as appropriate, to cooperate in establishing \nnon\u2011detriment findings for shared stocks of marine species listed in appendices I and \nII to the Convention on International Trade in Endangered Species of Wild Fauna and \nFlora, consistent with the concepts and non\u2011binding guiding principles contained in \nresolution Conf. 16.7 on non\u2011detriment findings, adopted by the Conference of the \nParties to the Convention on International Trade in Endangered Species of Wild Fauna \nand Flora; \n \n39. Notes, in this regard, the ongoing collaboration between the Food and \nAgriculture Organization of the United Nations and the secretariat of the Convention \n\nSustainable fisheries, including through the 1995 Agreement for the Implementation \nof the Provisions of the United Nations Convention on the Law of the Sea of \n10 December 1982 relating to the Conservation and Management of Straddling \nFish Stocks and Highly Migratory Fish Stocks, and related instruments \nA/RES/79/145\n \n17/50\n24-23839 \n \non International Trade in Endangered Species of Wild Fauna and Flora in raising \nawareness and building capacity on the implementation of that Convention in the \nfisheries sector, as a growing number of commercially exploited aquatic species are \nbeing included in appendix II to that Convention;  \n \n40. Recalls the fundamental role of sound scientific advice as the basis for \ndecisions on fisheries management, and notes the ongoing collaboration of regional \nfisheries management organizations and arrangements with the secretariat of the \nConvention on International Trade in Endangered Species of Wild Fauna and Flora to \nprovide the best scientific data and information; \n \n41. Urges States to eliminate barriers to trade in fish and fisheries products \nwhich are not consistent with their rights and obligations under the World Trade \nOrganization agreements, taking into account the importance of the trade in fish and \nfisheries products, particularly for developing countries; \n \n42. Recalls that, in \u201cThe future we want\u201d, States committed themselves to \nobserving the need to ensure access to fisheries and the importance of access to \nmarkets by subsistence, small-scale and artisanal fisherfolk and women fish workers, \nas well as Indigenous Peoples and their communities, particularly in developing \ncountries, especially small island developing States; \n \n43. Notes that the Committee on Fisheries encouraged the Food and \nAgriculture Organization of the United Nations to provide capacity-development and \ntechnical support to small-scale fisheries, including by addressing socioeconomics, \ngender dimensions, and post-harvest and data-collection challenges in the sector; \n \n44. Urges States and relevant international and national organizations to \nprovide for the participation of small-scale fishery stakeholders in related policy \ndevelopment and fisheries management strategies in order to achieve long-term \nsustainability for such fisheries, consistent with the duty to ensure the proper \nconservation and management of fisheries resources, and encourages States to \nconsider promoting, as appropriate, participatory management schemes for small-\nscale fisheries in accordance with national laws, regulations and practices, as well as \nthe Voluntary Guidelines for Securing Sustainable Small-scale Fisheries in the \nContext of Food Security and Poverty Eradication of the Food and Agriculture \nOrganization of the United Nations; \n \n45. Encourages States to implement actions to highlight the role of and \nsupport small-scale and artisanal fisheries and aquaculture; \n \n46. Welcomes action taken by the Food and Agriculture Organization of the \nUnited Nations and a number of regional organizations to support the implementation \nof the Voluntary Guidelines for Securing Sustainable Small-scale Fisheries in the \nContext of Food Security and Poverty Eradication through, as appropriate, national \nand regional plans of action, including on small-scale fisheries, dedicated working \ngroups and other initiatives; \n \n47. Encourages the Food and Agriculture Organization of the United Nations \nto continue promoting dialogue on small-scale and artisanal fisheries and aquaculture, \nand to consider including these issues as a standing agenda item of the Committee on \nFisheries and its subcommittees, as relevant; \n \n48. Encourages States, either directly or through competent and appropriate \nsubregional, regional or global organizations and arrangements, to analyse, as \nappropriate, the impact of fishing for marine species corresponding to low trophic \nlevels; \n\nA/RES/79/145 \nSustainable fisheries, including through the 1995 Agreement for the Implementation \nof the Provisions of the United Nations Convention on the Law of the Sea of \n10 December 1982 relating to the Conservation and Management of Straddling \nFish Stocks and Highly Migratory Fish Stocks, and related instruments \n \n24-23839\n18/50 \n \n \n49. Welcomes, in this regard, the initiation of further studies by the Food and \nAgriculture Organization of the United Nations of the impact of industrial fishing \nactivities on species corresponding to low trophic levels; \n \n50. Invites the Food and Agriculture Organization of the United Nations to \nassess and consider the potential risk and effects of genetically engineered fish species \non the health and sustainability of wild fish stocks and on the biodiversity of the \naquatic environment and to provide guidance, consistent with the Code, on managing \nrisk and minimizing harmful impacts in this regard; \n \n51. Also invites the Food and Agriculture Organization of the United Nations, \nin consultation with other relevant international organizations, including the \nInternational Maritime Organization, to promote awareness and cooperation to \ndevelop and strengthen capacity to prevent, minimize and mitigate the adverse \nimpacts of invasive alien species on biodiversity, including fish stocks; \n \n52. Calls upon States to consider the potential environmental and \nsocioeconomic impacts of anthropogenic underwater noise from different activities in \nthe marine environment and to address and mitigate such impacts, taking into account \nthe best available scientific information, the precautionary approach and ecosystem \napproaches, as appropriate; \n \nII \nImplementation of the 1995 Agreement for the Implementation of the \nProvisions of the United Nations Convention on the Law of the Sea of \n10 December 1982 relating to the Conservation and Management of Straddling \nFish Stocks and Highly Migratory Fish Stocks \n \n53. Welcomes the most recent accession to the Agreement, and calls upon all \nStates, and entities referred to in the Convention and in article 1, paragraph 2 (b), of \nthe Agreement, that have not done so to ratify or accede to the Agreement and in the \ninterim to consider applying it provisionally;  \n \n54. Calls upon States parties to the Agreement to effectively implement, as a \nmatter of priority, the provisions of the Agreement through their national legislation \nand through regional fisheries management organizations and arrangements in which \nthey participate; \n \n55. Emphasizes the importance of those provisions of the Agreement relating \nto bilateral, subregional and regional cooperation in enforcement, and urges continued \nefforts in this regard; \n \n56. Urges States parties to the Agreement, in accordance with article 21, \nparagraph 4, thereof, to inform, either directly or through the relevant subregional or \nregional fisheries management organization or arrangement, all States whose vessels \nfish on the high seas in the same subregion or region of the form of identification \nissued by those States parties to officials duly authorized to carry out boarding and \ninspection functions in accordance with articles 21 and 22 of the Agreement; \n \n57. Also urges States parties to the Agreement, in accordance with article 21, \nparagraph 4, thereof, to designate an appropriate authority to receive notifications \npursuant to article 21 and to give due publicity to such designation through the \nrelevant subregional or regional fisheries management organization or arrangement; \n \n58. Invites regional fisheries management organizations and arrangements \nwhich have not yet done so to adopt procedures for high seas boarding and inspection \nthat are consistent with articles 21 and 22 of the Agreement, including, inter alia, \nthose to ensure the safety of the crew and the inspectors;  \n\nSustainable fisheries, including through the 1995 Agreement for the Implementation \nof the Provisions of the United Nations Convention on the Law of the Sea of \n10 December 1982 relating to the Conservation and Management of Straddling \nFish Stocks and Highly Migratory Fish Stocks, and related instruments \nA/RES/79/145\n \n19/50\n24-23839 \n \n \n59. Notes that, in the agreed outcome of the resumed Review Conference on \nthe Agreement, in May 2023, the Conference recommended the development, through \nregional fisheries management organizations and arrangements, of high seas boarding \nand inspection measures where they do not currently exist, effective implementation \nof such measures where they already exist, and review of the implementation of \nexisting measures, in accordance with articles 21 and 22 of the Agreement; \n \n60. Calls upon States, individually and, as appropriate, through subregional \nand regional fisheries management organizations and arrangements with competence \nover discrete high seas fish stocks, to adopt the measures necessary to ensure the long-\nterm conservation, management and sustainable use of such stocks in accordance with \nthe Convention and consistent with the Code and the general principles set forth in \nthe Agreement; \n \n61. Invites States to assist developing States in enhancing their participation \nin regional fisheries management organizations or arrangements, including by \nfacilitating access to fisheries for straddling fish stocks and highly migratory fish \nstocks, in accordance with article 25, paragraph 1 (b), of the Agreement, taking into \naccount the need to ensure that such access benefits the developing States concerned \nand their nationals; \n \n62. Urges States parties to the Agreement, directly or through regional \nfisheries management organizations and arrangements, to take into account the special \nrequirements of developing States, including small island developing States as \nhighlighted in the SIDS Accelerated Modalities of Action (SAMOA) Pathway, in \ngiving effect to the duty to cooperate in the establishment of conservation and \nmanagement measures for straddling fish stocks and highly migratory fish stocks, \nincluding the need to ensure, where appropriate, in accordance with article 24, \nparagraph 2 (c), of the Agreement, that such measures do not transfer a \ndisproportionate burden of conservation action onto developing States, and notes in \nthis regard ongoing efforts to better develop a common understanding of this concept; \n \n63. Calls upon States and international financial institutions and organizations \nof the United Nations system to provide assistance according to Part VII of the \nAgreement, including, if appropriate, the development of special financial \nmechanisms or instruments to assist developing States, in particular the least \ndeveloped among them and small island developing States, to enable them to develop \ntheir national capacity to exploit fisheries resources, including developing their \ndomestically flagged fishing fleet, value-added processing and the expansion of their \neconomic base in the fishing industry, consistent with the duty to ensure the proper \nconservation and management of fisheries resources; \n \n64. Notes with appreciation, in this regard, the activities undertaken by the \nDivision for Ocean Affairs and the Law of the Sea of the Office of Legal Affairs of \nthe Secretariat (the Division) to implement the ongoing United Nations Fish Stocks \nAgreement project of assistance, a three-year capacity-building programme funded \nthrough the Assistance Fund established under Part VII of the Agreement, managed \nby the Food and Agriculture Organization of the United Nations, in cooperation with \nthe Division; \n \n65. Notes with concern that the Assistance Fund established under Part VII of \nthe Agreement has been effectively depleted since 2016, and urges States, \nintergovernmental organizations, international financial institutions, national \ninstitutions and non\u2011governmental organizations, as well as natural and juridical \npersons, to make voluntary financial contributions to the Assistance Fund established \nunder Part VII of the Agreement; \n\nA/RES/79/145 \nSustainable fisheries, including through the 1995 Agreement for the Implementation \nof the Provisions of the United Nations Convention on the Law of the Sea of \n10 December 1982 relating to the Conservation and Management of Straddling \nFish Stocks and Highly Migratory Fish Stocks, and related instruments \n \n24-23839\n20/50 \n \n \n66. Encourages the Food and Agriculture Organization of the United Nations \nand the Division to continue their efforts to encourage further contributions to the \nAssistance Fund and, when appropriate, publicize the availability of assistance \nthrough the Assistance Fund; \n \n67. Encourages accelerated progress by States, individually and, as \nappropriate, through subregional and regional fisheries management organizations \nand arrangements, regarding the recommendations of the Review Conference on the \nAgreement, held in New York from 22 to 26 May 2006,26 and the identification of \nemerging priorities; \n \n68. Encourages States, individually and, as appropriate, through subregional \nand regional fisheries management organizations and arrangements, to consider \nimplementing, as appropriate, the recommendations of the resumed Review \nConference held in New York from 24 to 28 May 2010,27 from 23 to 27 May 201628 \nand from 22 to 26 May 2023;29 \n \n69. Acknowledges, in particular, the commitments made at the resumed \nReview Conference held in 2016 to the continued implementation of the Agreement \nthrough the application of the precautionary approach and ecosystem approaches to \nfisheries management, the urgent improvement of the status of straddling fish stocks \nand highly migratory fish stocks, strengthened interaction of the science-policy \ninterface and the strong emphasis on collaboration, at all levels, for improved global \nfisheries outcomes; \n \n70. Recalls that the resumed Review Conference agreed to continue the \ninformal consultations of States parties to the Agreement and keep the Agreement \nunder review through the resumption of the Review Conference at a date not earlier \nthan 2028; \n \n71. Also recalls paragraph 6 of resolution 56/13 of 28 November 2001 and the \nrecommendation of the resumed Review Conference in 2016 that the informal \nconsultations of States parties to the Agreement be dedicated, on an annual basis, to \nthe consideration of specific issues arising from the implementation of the Agreement, \nwith a view to improving understanding, sharing experiences and identifying best \npractices for the consideration of States parties, as well as the General Assembly and \nthe Review Conference; \n \n72. Takes note of the report of the seventeenth round of informal consultations \nof States parties to the Agreement, 30 which focused its discussions on the topic \n\u201cSustainable fisheries management in the face of climate change\u201d; \n \n73. Recalls its request, in paragraph 76 of resolution 78/68, for the Secretary-\nGeneral to convene the eighteenth round of informal consultations of States parties to \nthe Agreement for three days in 2025, and decides that the eighteenth round should \nfocus its discussions on the topic \u201cThe thirtieth anniversary of the 1995 United \nNations Fish Stocks Agreement: looking to the future\u201d; \n \n74. Encourages greater participation, including by competent international \norganizations, at the forthcoming eighteenth round of informal consultations of States \nparties to the Agreement; \n_______________ \n \n26 See A/CONF.210/2006/15, annex. \n \n27 See A/CONF.210/2010/7, annex. \n \n28 See A/CONF.210/2016/5, annex. \n \n29 See A/CONF.210/2023/6, annex. \n \n30 Document ICSP17/UNFSA/INF.3. Available at www.un.org/depts/los/convention_agreements/ \nfish_stocks_agreement_states_parties.htm. \n\nSustainable fisheries, including through the 1995 Agreement for the Implementation \nof the Provisions of the United Nations Convention on the Law of the Sea of \n10 December 1982 relating to the Conservation and Management of Straddling \nFish Stocks and Highly Migratory Fish Stocks, and related instruments \nA/RES/79/145\n \n21/50\n24-23839 \n \n \n75. Requests the Secretary-General to invite States parties to the Agreement \nand, as observers, States and entities referred to in the Convention and in article 1, \nparagraph 2 (b), of the Agreement not parties to the Agreement, the Food and \nAgriculture Organization of the United Nations and other relevant organizations, \nbodies, funds and programmes within the United Nations system, the secretariats of \nrelevant organizations and conventions and other relevant intergovernmental \norganizations and bodies, in particular subregional and regional fisheries management \norganizations and arrangements and related regional intergovernmental marine \nscience organizations, and relevant non\u2011governmental organizations, in accordance \nwith past practice, to attend the eighteenth round of informal consultations of States \nparties to the Agreement, while relevant scientific institutions may request an \ninvitation to participate in the consultations as observers;  \n \n76. Invites the chairperson of the informal consultations of States parties to \nthe Agreement to circulate widely, through the Secretariat, an informal summary of \nthe discussions at the eighteenth round; \n \n77. Requests the Secretary-General to convene the nineteenth round of \ninformal consultations of States parties to the Agreement for three days in 2026; \n \n78. Reaffirms its request that the Food and Agriculture Organization of the \nUnited Nations initiate arrangements with States for the collection and dissemination \nof data on fishing on the high seas by vessels flying their flag at the subregional and \nregional levels where no such arrangements exist;  \n \n79. Also reaffirms its request that the Food and Agriculture Organization of \nthe United Nations revise its global fisheries statistics database to provide information \non straddling fish stocks, highly migratory fish stocks and discrete high seas fish \nstocks on the basis of where the catch is taken; \n \n80. Recalls that the Committee on Fisheries, at its thirty-third session, \nemphasized, in the context of the 2030 Agenda for Sustainable Development, the need \nto ensure comparability and consistency of reporting indicators at global, regional and \nnational levels, while minimizing the burden on its members;31 \n \n81. Recognizes \nthat \nthe \nReview \nConference \nis \nthe \ncompetent \nintergovernmental forum for assessing the effectiveness of the Agreement by \nreviewing its implementation; \n \nIII \nRelated fisheries instruments \n \n82. Emphasizes the importance of the effective implementation of the \nprovisions of the Compliance Agreement, and urges continued efforts in this regard; \n \n83. Calls upon all States and other entities referred to in article X, paragraph 1, \nof the Compliance Agreement that have not yet become parties to that Agreement to \ndo so as a matter of priority and, in the interim, to consider applying it provisionally; \n \n84. Urges States and subregional and regional fisheries management \norganizations and arrangements to implement and promote the application of the Code \nwithin their areas of competence; \n \n85. Urges States to develop and implement, as a matter of priority, national \nand, as appropriate, regional plans of action to put into effect the international plans \nof action of the Food and Agriculture Organization of the United Nations; \n_______________ \n \n31 See Food and Agriculture Organization of the United Nations, document C 2019/23. \n\nA/RES/79/145 \nSustainable fisheries, including through the 1995 Agreement for the Implementation \nof the Provisions of the United Nations Convention on the Law of the Sea of \n10 December 1982 relating to the Conservation and Management of Straddling \nFish Stocks and Highly Migratory Fish Stocks, and related instruments \n \n24-23839\n22/50 \n \n \n86. Encourages States, in this regard, to maintain their commitment in \nreporting on their implementation of the Code, reiterates the importance of responding \nto the web-based questionnaire of the Food and Agriculture Organization of the \nUnited Nations for monitoring the implementation of the Code and the international \nplans of action and strategies, and notes that the information collected could also be \nrelevant to the implementation of related targets of the 2030 Agenda for Sustainable \nDevelopment; \n \n87. Recalls the call by the Ministerial Conference on Fishing Vessel Safety \nand Illegal, Unreported and Unregulated Fishing, held in October 2019 in \nTorremolinos, Spain, to those States that have not yet become parties to the Cape \nTown Agreement to consider doing so by the tenth anniversary of its adoption on \n11 October 2022;  \n \n88. Encourages, in this regard, States to consider signing, ratifying, accepting, \napproving or acceding as soon as possible to the Cape Town Agreement of 2012 on \nthe Implementation of the Provisions of the Torremolinos Protocol of 1993 relating \nto the Torremolinos International Convention for the Safety of Fishing Vessels, 1977; \n \n89. Notes that the Committee on Fisheries, at its thirty-fifth session, welcomed \nthe capacity-building work on decent working conditions and safety at sea of the Food \nand Agriculture Organization of the United Nations, with an emphasis on reducing \naccidents and fatalities among small-scale fishers, fishing vessel safety standards and \nthe promotion of insurance and social protection in fisheries, and requested the Food \nand Agriculture Organization of the United Nations to increase its support to \ndeveloping countries on fishing safety matters and to take a leading role in the \nestablishment of a repository for fisher safety data and accident and mortality \ninformation; \n \nIV \nIllegal, unreported and unregulated fishing \n \n90. Emphasizes once again its serious concern that illegal, unreported and \nunregulated fishing remains one of the greatest threats to fish stocks and marine \necosystems and continues to have serious and major implications for the conservation \nand management of ocean resources, as well as the food security and the economies \nof many States, particularly developing States, and renews its call upon States to \ncomply fully with all existing obligations and to combat such fishing and urgently to \ntake all steps necessary to implement the International Plan of Action to Prevent, \nDeter and Eliminate Illegal, Unreported and Unregulated Fishing; \n \n91. Notes that the Committee on Fisheries of the Food and Agriculture \nOrganization of the United Nations highlighted the high priority its members place \non combating illegal, unreported and unregulated fishing, and encouraged the Food \nand Agriculture Organization of the United Nations to source additional resources and \nfunding to be allocated towards preventing, deterring and eliminating illegal, \nunreported and unregulated fishing; \n \n92. Recalls that, in \u201cThe future we want\u201d, States acknowledged that illegal, \nunreported and unregulated fishing deprive many countries of a crucial natural \nresource and remain a persistent threat to their sustainable development and \nrecommitted to eliminate illegal, unreported and unregulated fishing as advanced in \nthe Johannesburg Plan of Implementation, and to prevent and combat those practices, \nincluding by developing and implementing national and regional action plans in \naccordance with the International Plan of Action to Prevent, Deter and Eliminate \nIllegal, Unreported and Unregulated Fishing, implementing, in accordance with \ninternational law, effective and coordinated measures by coastal States, flag States, \n\nSustainable fisheries, including through the 1995 Agreement for the Implementation \nof the Provisions of the United Nations Convention on the Law of the Sea of \n10 December 1982 relating to the Conservation and Management of Straddling \nFish Stocks and Highly Migratory Fish Stocks, and related instruments \nA/RES/79/145\n \n23/50\n24-23839 \n \nport States, chartering nations and the States of nationality of the beneficial owners \nand others who support or engage in illegal, unreported and unregulated fishing by \nidentifying vessels engaged in such fishing and by depriving offenders of the benefits \naccruing from it, as well as by cooperating with developing countries to \nsystematically identify needs and build capacity, including support for monitoring, \ncontrol, surveillance, compliance and enforcement systems; \n \n93. Notes with satisfaction the development of an increasing number of \nnational plans of action to prevent, deter and eliminate illegal, unreported and \nunregulated fishing, and calls upon States to consider developing and then consider \nreviewing such plans; \n \n94. Urges flag States to strengthen effective jurisdiction and control over \nvessels flying their flag, and to exercise due diligence, including by developing or \namending national rules and regulations, where needed, in order to ensure that such \nvessels do not engage in illegal, unreported and unregulated fishing, while reaffirming \nthe importance, under international law, including as reflected in the Convention, of \nthe responsibilities of flag States regarding fishing vessels flying their flag, including \nwith respect to safety at sea and labour conditions on fishing vessels; \n \n95. Urges States to effectively exercise jurisdiction and control over their \nnationals, including beneficial owners, and vessels flying their flag, in order to \nprevent and deter them from engaging in illegal, unreported and unregulated fishing \nactivities or supporting vessels engaging in illegal, unreported and unregulated \nfishing activities, including those vessels listed by regional fisheries management \norganizations or arrangements as engaged in those activities, and to facilitate mutual \nassistance to ensure that such actions can be investigated and proper sanctions \nimposed; \n \n96. Notes, in this respect, that the Committee on Fisheries of the Food and \nAgriculture Organization of the United Nations, at its thirty-sixth session, recognized \nthe importance and challenges of identifying beneficial ownership of fishing vessels \nand that the Committee and its subcommittees were encouraged to further consider \nthis issue; \n \n97. Encourages States that have not yet done so to establish penalties for \nnon\u2011compliance by vessels involved in fishing or fishing-related activities and their \nnationals, as appropriate, in accordance with applicable national law and consistent \nwith international law, that are adequate in severity for effectively securing \ncompliance, deterring further violations and depriving offenders of the benefits from \ntheir illegal, unreported and unregulated fishing activities; \n \n98. Urges States to take effective measures, at the national, subregional, \nregional and global levels, to deter the activities, including illegal, unreported and \nunregulated fishing, of any vessel which undermines conservation and management \nmeasures that have been adopted by subregional and regional fisheries management \norganizations and arrangements in accordance with international law; \n \n99. Recognizes the importance of transparency and the use of technology in \nfisheries, as part of policies to combat illegal, unreported and unregulated fishing; \n \n100. Also recognizes the importance of transparency for effective fisheries \nmanagement, emphasizing its role in enhancing and fostering sustainable practices, \nand ensuring the responsible management of marine resources, and therefore urges \nStates and relevant international organizations, including regional fisheries \nmanagement organizations and arrangements, to consider ways to better integrate \ntransparent practices into fisheries management and promote data exchange; \n\nA/RES/79/145 \nSustainable fisheries, including through the 1995 Agreement for the Implementation \nof the Provisions of the United Nations Convention on the Law of the Sea of \n10 December 1982 relating to the Conservation and Management of Straddling \nFish Stocks and Highly Migratory Fish Stocks, and related instruments \n \n24-23839\n24/50 \n \n \n101. Calls upon States not to permit vessels flying their flag to engage in fishing \non the high seas or in areas under the national jurisdiction of other States, unless duly \nauthorized by the authorities of the States concerned and in accordance with the \nconditions set out in the authorization, and to take specific measures, including \ndeterring the reflagging of vessels by their nationals, in accordance with the relevant \nprovisions of the Convention, the Agreement and the Compliance Agreement, to \ncontrol fishing operations by vessels flying their flag; \n \n102. Urges States, individually and collectively through regional fisheries \nmanagement organizations and arrangements, to develop appropriate processes to \nassess the performance of States with respect to implementing the obligations \nregarding fishing vessels flying their flag set out in relevant international instruments; \n \n103. Reaffirms the need to strengthen, where necessary, the international legal \nframework for intergovernmental cooperation, in particular at the subregional and \nregional levels, in the management of fish stocks and in combating illegal, unreported \nand unregulated fishing, in a manner consistent with international law, and for States \nand entities referred to in the Convention and in article 1, paragraph 2 (b), of the \nAgreement to collaborate in efforts to address these types of fishing activities; \n \n104. Urges regional fisheries management organizations and arrangements to \nfurther coordinate measures for combating illegal, unreported and unregulated fishing \nactivities, such as through the development of a common list of vessels identified as \nengaged in illegal, unreported and unregulated fishing or the mutual recognition of \nthe illegal, unreported and unregulated vessel lists established by each organization \nor arrangement; \n \n105. Reaffirms its call upon States to take all necessary measures consistent \nwith international law, without prejudice to a State\u2019s sovereignty over ports in its \nterritory and to reasons of force majeure or distress, including the prohibition of \nvessels from accessing their ports followed by a report to the flag State concerned, \nwhen there is clear evidence that they are or have been engaged in or have supported \nillegal, unreported and unregulated fishing, or when they refuse to give information \neither on the origin of the catch or on the authorization under which the catch has \nbeen made; \n \n106. Reaffirms paragraph 53 of its resolution 64/72 of 4 December 2009 with \nregard to eliminating illegal, unreported and unregulated fishing by vessels flying \n\u201cflags of convenience\u201d and requiring that a \u201cgenuine link\u201d be established between \nStates and fishing vessels flying their flags, and urges States operating open registry \nto effectively control all fishing vessels flying their flag, as required by international \nlaw, or otherwise stop open registry for fishing vessels; \n \n107. Notes the challenges posed by vessels determined under international law \nto be without nationality that are fishing, including conducting fishing-related \nactivities, on the high seas and that such vessels operate without governance and \noversight, undermine relevant legal frameworks and are engaging in illegal, \nunreported and unregulated fishing activities as defined in the International Plan of \nAction to Prevent, Deter and Eliminate Illegal, Unreported and Unregulated Fishing \nof the Food and Agriculture Organization of the United Nations, and encourages \nStates to take necessary measures where appropriate, consistent with international \nlaw, in order to prevent and deter vessels without nationality from engaging in or \nsupporting illegal, unreported and unregulated fishing, such as enacting domestic \nlegislation, including on enforcement, sharing information and prohibiting the landing \nand preventing trans-shipment, at sea or in port, of fish and fish products by such \nvessels; \n\nSustainable fisheries, including through the 1995 Agreement for the Implementation \nof the Provisions of the United Nations Convention on the Law of the Sea of \n10 December 1982 relating to the Conservation and Management of Straddling \nFish Stocks and Highly Migratory Fish Stocks, and related instruments \nA/RES/79/145\n \n25/50\n24-23839 \n \n \n108. Encourages States, either directly or through competent and appropriate \nsubregional, regional or global organizations and arrangements, to consider adopting \nrules, consistent with international law, to ensure that chartering arrangements and \npractices related to fishing vessels enable compliance with and enforcement of \nrelevant conservation and management measures, so as not to undermine efforts to \ncombat illegal, unreported and unregulated fishing; \n \n109. Recognizes the need for enhanced port State measures to combat illegal, \nunreported and unregulated fishing, and urges States to cooperate, in particular at the \nregional level and through subregional and regional fisheries management \norganizations and arrangements, to adopt all necessary port measures, consistent with \ninternational law taking into account article 23 of the Agreement, and to further \npromote the development and application of standards at the regional level; \n \n110. Welcomes the recent ratifications of and accessions to the Agreement on \nPort State Measures to Prevent, Deter and Eliminate Illegal, Unreported and \nUnregulated Fishing, and encourages States and regional economic integration \norganizations that have not yet done so to consider ratifying, accepting, approving or \nacceding to that Agreement, noting the importance of major port States and flag States \nbecoming parties at their earliest convenience; \n \n111. Encourages States that are party to the Agreement on Port State Measures \nto Prevent, Deter and Eliminate Illegal, Unreported and Unregulated Fishing to fully \nimplement that Agreement and to adopt, through regional fisheries management \norganizations and arrangements of which they are members, port State measures \nconsistent with that Agreement, noting that that Agreement establishes minimum \nstandards and does not preclude the adoption of more stringent measures, as \nappropriate, in accordance with international law; \n \n112. Acknowledges the follow-up by Parties to the Agreement on Port State \nMeasures to Prevent, Deter and Eliminate Illegal, Unreported and Unregulated \nFishing of the \u201cBali Strategy\u201d to strengthen the implementation and effectiveness of \nthat Agreement, adopted at the Fourth Meeting of the Parties to that Agreement, and \nwelcomes the operationalization of the Global Information Exchange System as an \nessential tool for supporting implementation of that Agreement, together with other \nrelevant international instruments; \n \n113. Notes the ongoing capacity-development programme of the Food and \nAgriculture Organization of the United Nations aimed at facilitating and supporting \nthe implementation of the Agreement on Port State Measures to Prevent, Deter and \nEliminate Illegal, Unreported and Unregulated Fishing and related instruments, which \ncontributes to the development of national capacity of both parties and non\u2011parties, \nincluding the strengthening of the legal, institutional, operational and enforcement \ncapacity of developing States with a view to maximizing the benefits of its \nimplementation, and which, as of 1 July 2024, delivered activities in over 50 \ncountries; \n \n114. Also notes the important role that the Food and Agriculture Organization \nof the United Nations, International Maritime Organization and International Labour \nOrganization Joint Ad Hoc Working Group on Illegal, Unreported and Unregulated \nFishing and Related Matters plays in engaging multiple agencies and stakeholders, \nincluding on measures to attain safe, healthy and fair working conditions and improve \nsafety at sea, and notes that the Committee on Fisheries, at its thirty-sixth session, \nnoted the recommendations of the fifth meeting of the Joint Ad Hoc Working Group, \nheld in Geneva from 8 to 12 January 2024, and requested its Subcommittee on \nFisheries Management to consider the outcomes of the fifth and future sessions of the \nJoint Ad Hoc Working Group; \n\nA/RES/79/145 \nSustainable fisheries, including through the 1995 Agreement for the Implementation \nof the Provisions of the United Nations Convention on the Law of the Sea of \n10 December 1982 relating to the Conservation and Management of Straddling \nFish Stocks and Highly Migratory Fish Stocks, and related instruments \n \n24-23839\n26/50 \n \n \n115. Acknowledges the efforts of the Indian Ocean Rim Association member \nStates in developing a guideline to prevent, deter and eliminate illegal, unreported \nand unregulated fishing in the Indian Ocean, initiated by Indonesia and France, aiming \nto achieve sustained growth and balanced development for the livelihood of coastal \nStates in the Indian Ocean region; \n \n116. Encourages States, with respect to vessels flying their flag, and port States, \nto make every effort to share data on landings and catch quotas, and in this regard \nencourages regional fisheries management organizations and arrangements to \nconsider developing open databases containing such data for the purpose of enhancing \nthe effectiveness of fisheries management; \n \n117. Notes the continued work by the Food and Agriculture Organization of the \nUnited Nations on methodologies to estimate the magnitude of illegal, unreported and \nunregulated fishing and on the use of indicators to evaluate and track performance in \ncombating illegal, unreported and unregulated fishing; \n \n118. Calls upon States to take all measures necessary to ensure that vessels \nflying their flag do not engage in the trans-shipment of fish caught by fishing vessels \nengaged in illegal, unreported and unregulated fishing, through adequate regulation, \nmonitoring and control of trans-shipment of fish at sea, including through additional \nnational measures applicable to vessels flying their flag to prevent such \ntrans\u2011shipment in line with the Voluntary Guidelines for Trans-shipment developed \nunder the auspices of the Food and Agriculture Organization of the United Nations, 32 \nand in this respect notes the call made by the Committee on Fisheries, at its thirty-\nsixth session, for the Food and Agriculture Organization of the United Nations to \nsupport the work of its members and of regional fisheries management organizations \nand to monitor progress;  \n \n119. Urges States, individually and through regional fisheries management \norganizations and arrangements, to adopt and implement internationally agreed \nmarket-related measures in accordance with international law, including principles, \nrights and obligations established in World Trade Organization agreements, as called \nfor in the International Plan of Action to Prevent, Deter and Eliminate Illegal, \nUnreported and Unregulated Fishing; \n \n120. Encourages work to increase awareness of the Voluntary Guidelines for \nCatch Documentation Schemes,33 and encourages States and relevant stakeholders to \nimplement these Guidelines when developing catch documentation schemes and to \nuse them as a reference in related activities, with special attention to the prevention, \ndeterrence and elimination of illegal, unreported and unregulated fishing, and recalls \nthe publication of the technical guidelines entitled Understanding and Implementing \nCatch Documentation Schemes: A Guide for National Authorities; \n \n121. Also encourages information-sharing regarding emerging market- and \ntrade-related measures by States and other relevant actors with appropriate \ninternational forums, given the potential implications of these measures for all States, \nconsistent with the established plan of work of the Committee on Fisheries, and taking \ninto account the Technical Guidelines for Responsible Fish Trade of the Food and \nAgriculture Organization of the United Nations; \n \n122. Acknowledges the development of participatory surveillance activities at \nsea involving fishing communities in West Africa as a cost-effective way of detecting \nillegal, unreported and unregulated fishing; \n_______________ \n \n32 Available at www.fao.org/documents/card/en/c/cc5602t. \n \n33 Food and Agriculture Organization of the United Nations, document C 2017/REP, appendix C. \n\nSustainable fisheries, including through the 1995 Agreement for the Implementation \nof the Provisions of the United Nations Convention on the Law of the Sea of \n10 December 1982 relating to the Conservation and Management of Straddling \nFish Stocks and Highly Migratory Fish Stocks, and related instruments \nA/RES/79/145\n \n27/50\n24-23839 \n \n \n123. Notes the concern expressed by the Committee on Fisheries at the \nproliferation of private standards and ecolabelling schemes potentially leading to the \ncreation of trade barriers and restrictions, and also notes the work by the Food and \nAgriculture Organization of the United Nations to develop an evaluation framework \nto assess the conformity of public and private ecolabelling schemes through the \nGuidelines for the Ecolabelling of Fish and Fishery Products from Marine Capture \nFisheries; \n \n124. Also notes the concerns about possible connections between transnational \norganized crime and illegal fishing in certain regions of the world, and encourages \nStates, including through the appropriate international forums and organizations, to \nstudy the causes and methods of and contributing factors to illegal fishing to increase \nknowledge and understanding of those possible connections, and to make the findings \npublicly available, and in this regard takes note of the study issued by the United \nNations Office on Drugs and Crime on transnational organized crime in the fishing \nindustry and its Global Report on Trafficking in Persons 2022, bearing in mind the \ndistinct legal regimes and remedies under international law applicable to illegal \nfishing and transnational organized crime; \n \nV \nMonitoring, control and surveillance and compliance and enforcement \n \n125. Calls upon States, in accordance with international law, to strengthen the \nimplementation of or, where they do not exist, adopt comprehensive monitoring, \ncontrol and surveillance measures and compliance and enforcement schemes \nindividually and within those regional fisheries management organizations or \narrangements in which they participate, in order to provide an appropriate framework \nfor promoting compliance with agreed conservation and management measures, and \nfurther urges enhanced coordination among all relevant States and regional fisheries \nmanagement organizations and arrangements in these efforts;  \n \n126. Urges all flag States to implement the Voluntary Guidelines for Flag State \nPerformance 34  as soon as possible, including, as a first step, by carrying out a \nvoluntary assessment, and welcomes that the Committee on Fisheries of the Food and \nAgriculture Organization of the United Nations, at its thirty-sixth session, stressed the \nimportance of building on the improvements achieved so far and to continue exploring \nthe possibility to strengthen the implementation of the Compliance Agreement, \nencouraging that future work be based on flag State responsibility more generally, \ntaking into account the provisions of the Compliance Agreement itself and other \nrelevant instruments such as the United Nations Fish Stocks Agreement and Voluntary \nGuidelines for Flag State Performance, as well as work on compliance in regional \nfisheries bodies; \n \n127. Encourages further work by competent international organizations, \nincluding subregional and regional fisheries management organizations and \narrangements, to develop guidelines on flag State control of fishing vessels; \n \n128. Urges States, individually and through relevant regional fisheries \nmanagement organizations and arrangements, to establish mandatory vessel \nmonitoring, control and surveillance systems, in particular to require that vessel \nmonitoring systems be carried by all vessels fishing on the high seas as soon as \npracticable, recalling that, in paragraph 62 of resolution 63/112 of 5 December 2008, \nit urged that large-scale fishing vessels be required to carry vessel monitoring systems \n_______________ \n \n34 Food and Agriculture Organization of the United Nations, document COFI/2014/4.2/Rev.1, \nappendix II. \n\nA/RES/79/145 \nSustainable fisheries, including through the 1995 Agreement for the Implementation \nof the Provisions of the United Nations Convention on the Law of the Sea of \n10 December 1982 relating to the Conservation and Management of Straddling \nFish Stocks and Highly Migratory Fish Stocks, and related instruments \n \n24-23839\n28/50 \n \nno later than December 2008, and to share information on fisheries enforcement \nmatters; \n \n129. Encourages \nStates, \nindividually \nand \nthrough \nregional \nfisheries \nmanagement organizations and arrangements, to strengthen or establish rules and \nregulations on and promote the use of the best available technology, including, where \nappropriate, electronic monitoring systems to ensure effective monitoring, control and \nsurveillance as well as compliance with relevant conservation and management \nmeasures; \n \n130. Notes that the Committee on Fisheries, at its thirty-sixth session, reiterated \nthe importance of vessel tracking in monitoring compliance and surveillance \nmeasures and high seas boarding and inspection and looked forward to receiving the \nresults of the global study on vessel tracking to be conducted by the Food and \nAgriculture Organization of the United Nations; \n \n131. Calls upon States, individually and through regional fisheries management \norganizations or arrangements, to strengthen or establish, consistent with national and \ninternational law, positive or negative lists of vessels fishing within the areas covered \nby relevant regional fisheries management organizations and arrangements in order \nto promote compliance with conservation and management measures and to identify \nproducts from illegal, unreported and unregulated catches, and encourages improved \ncoordination among all States and regional fisheries management organizations and \narrangements in sharing and using this information, taking into account the forms of \ncooperation with developing States as set out in article 25 of the Agreement and, as \nappropriate, articles 4 and 6 of the Compliance Agreement; \n \n132. Encourages the Food and Agriculture Organization of the United Nations, \nin cooperation with States, regional economic integration organizations, the \nInternational Maritime Organization and, as appropriate, regional fisheries \nmanagement organizations and arrangements, to expedite efforts to develop and \nmanage a comprehensive global record of fishing vessels, refrigerated transport \nvessels and supply vessels, including with a unique vessel identifier system, using, as \na first step, the International Maritime Organization Ship Identification Number \nScheme for fishing vessels of 100 gross tonnage and above, adopted by the Assembly \nof the International Maritime Organization in its resolution A.1078(28) of \n4 December 2013; \n \n133. Welcomes the continued development of the Global Record of Fishing \nVessels, Refrigerated Transport Vessels and Supply Vessels by the Food and \nAgriculture Organization of the United Nations, including its efforts to keep it cost-\neffective, and encourages States, including through regional fisheries management \norganizations and arrangements, to provide the necessary data and regular updates to \nthe Global Record; \n \n134. Encourages, in this regard, broader participation in the Global Record, \nreiterating the importance for States to upload and routinely update information on \ntheir fleets and for States to use all available vessel data, including from the Global \nIntegrated Shipping Information System platform, when providing their vessel data \nto the Global Record; \n \n135. Welcomes the decision by the International Maritime Organization, in \nresolution A.1117(30) of 6 December 2017, to extend, beyond the first phase of the \nGlobal Record, the International Maritime Organization Ship Identification Number \nScheme to fishing vessels of steel and non\u2011steel hull construction and to all motorized \ninboard fishing vessels of less than 100 gross tonnage down to a size limit of \n12 metres in length overall authorized to operate outside waters under the national \njurisdiction of the flag State, and welcomes the fact that several regional fisheries \n\nSustainable fisheries, including through the 1995 Agreement for the Implementation \nof the Provisions of the United Nations Convention on the Law of the Sea of \n10 December 1982 relating to the Conservation and Management of Straddling \nFish Stocks and Highly Migratory Fish Stocks, and related instruments \nA/RES/79/145\n \n29/50\n24-23839 \n \nmanagement organizations and arrangements have made provisions for the \nInternational Maritime Organization number to be compulsory in their convention \nareas for all eligible vessels, and encourages those regional fisheries management \norganizations and arrangements which have not yet done so to do the same; \n \n136. Requests States and relevant international bodies to develop, in accordance \nwith international law, more effective measures to trace fish and fishery products to \nenable importing States to identify fish or fishery products caught in a manner that \nundermines international conservation and management measures agreed in \naccordance with international law, taking into account the special requirements of \ndeveloping States and the forms of cooperation with developing States as set out in \narticle 25 of the Agreement, and at the same time to recognize the importance of \nmarket access, in accordance with provisions 11.2.4, 11.2.5 and 11.2.6 of the Code, \nfor fish and fishery products caught in a manner that is in conformity with such \ninternational measures; \n \n137. Requests States to take the necessary measures, consistent with \ninternational law, to help to prevent fish and fishery products caught in a manner that \nundermines applicable conservation and management measures adopted in \naccordance with international law from entering international trade; \n \n138. Encourages States to establish and undertake cooperative surveillance and \nenforcement activities in accordance with international law to strengthen and enhance \nefforts to ensure compliance with conservation and management measures, and \nprevent and deter illegal, unreported and unregulated fishing; \n \n139. Urges States, directly and through regional fisheries management \norganizations or arrangements, to develop and adopt effective monitoring, control and \nsurveillance measures for trans-shipment, as appropriate, in particular at-sea \ntrans\u2011shipment, including on the high seas, in order to, inter alia, monitor compliance, \nto collect and verify fisheries data, and to prevent, deter and eliminate illegal, \nunreported and unregulated fishing activities, in accordance with international law; \n \n140. Recalls the adoption in 2022 of the Voluntary Guidelines for Trans-shipment \nof the Food and Agriculture Organization of the United Nations, and calls for their \nimplementation, including through regional fisheries management organizations and \narrangements;  \n \n141. Notes that the Committee on Fisheries of the Food and Agriculture \nOrganization of the United Nations, at its thirty-sixth session, urged members of the \nFood and Agriculture Organization of the United Nations and regional fisheries \nmanagement organizations and arrangements to ensure that they have a \ncomprehensive framework for monitoring and control of transshipment operations; \n \n142. Expresses its appreciation for financial contributions from States to \nimprove the capacity of the existing voluntary International Monitoring, Control and \nSurveillance Network for Fisheries-related Activities, and encourages States to join \nand actively participate in the Network and to consider supporting, when appropriate, \nits transformation in accordance with international law into an international unit with \ndedicated resources to further assist Network members, taking into account the forms \nof cooperation with developing States as set out in article 25 of the Agreement; \n \nVI \nFishing overcapacity \n \n143. Calls upon States to commit themselves to urgently reducing the capacity \nof the world\u2019s fishing fleets to levels commensurate with the sustainability of fish \nstocks, through the establishment of target levels and plans or other appropriate \n\nA/RES/79/145 \nSustainable fisheries, including through the 1995 Agreement for the Implementation \nof the Provisions of the United Nations Convention on the Law of the Sea of \n10 December 1982 relating to the Conservation and Management of Straddling \nFish Stocks and Highly Migratory Fish Stocks, and related instruments \n \n24-23839\n30/50 \n \nmechanisms for ongoing capacity assessment, while avoiding the transfer of fishing \ncapacity to other fisheries or areas in a manner that undermines the sustainable \nmanagement of fish stocks, including those areas where fish stocks are overexploited \nor in a depleted condition, and recognizing in this context the legitimate rights of \ndeveloping States to develop their fisheries for straddling fish stocks and highly \nmigratory fish stocks consistent with article 25 of the Agreement, article 5 of the Code \nand paragraph 10 of the International Plan of Action for the Management of Fishing \nCapacity of the Food and Agriculture Organization of the United Nations; \n \n144. Calls upon, in this regard, States, individually or through regional fisheries \nmanagement organizations and arrangements, to develop and implement a range of \nmeasures to adjust fishing intensity, including fishing capacity where relevant, to \nlevels commensurate with the sustainability of fish stocks, and including capacity \nassessment and capacity management plans providing incentives for voluntary \nreduction, which take into account all aspects that contribute to fishing capacity, \nconsidering, inter alia, engine power, fishing gear technology, fish detection \ntechnology and storage space, and also to improve transparency on fishing capacity, \nincluding by identifying, sharing and publicizing relevant information in this regard, \nsubject to confidentiality requirements; \n \n145. Reiterates its call upon States, individually and through regional fisheries \nmanagement organizations and arrangements, to ensure that the urgent actions \nrequired in the International Plan of Action for the Management of Fishing Capacity \nare undertaken expeditiously and that its implementation is facilitated without delay; \n \n146. Invites the Food and Agriculture Organization of the United Nations to \nreport on the state of progress in the implementation of the International Plan of \nAction for the Management of Fishing Capacity, as provided for in paragraph 48 of \nthe Plan of Action; \n \n147. Calls upon States, individually and, as appropriate, through subregional \nand regional fisheries management organizations and arrangements with competence \nto regulate highly migratory species, urgently to address global fishing capacity for \ntunas, inter alia, in a way that recognizes the legitimate rights of developing States, \nin particular small island developing States, to participate in and benefit from such \nfisheries, taking into account the recommendations of the 2010 Joint Tuna Regional \nFisheries Management Organizations International Workshop on RFMO Management \nof Tuna Fisheries, held in Brisbane, Australia, and the recommendations of the 2011 \nthird joint meeting of tuna regional fisheries management organizations and \narrangements; \n \n148. Encourages those States which are cooperating to establish subregional \nand regional fisheries management organizations and arrangements, taking into \naccount the best scientific information available as well as ecosystem approaches and \nthe precautionary approach, to exercise voluntary restraint of fishing effort levels in \nthose areas that will come under the regulation of the future organizations and \narrangements until adequate regional conservation and management measures are \nadopted and implemented, taking into account the need to ensure the long-term \nconservation, management and sustainable use of the relevant fish stocks and to \nprevent significant adverse impacts on vulnerable marine ecosystems; \n \n149. Recalls that, in \u201cThe future we want\u201d, States reaffirmed their commitment \nin the Johannesburg Plan of Implementation to eliminate subsidies that contribute to \nillegal, unreported and unregulated fishing and overcapacity, taking into account the \nimportance of that sector to developing countries, reiterated their commitment to \nconclude multilateral disciplines on fisheries subsidies that would give effect to the \n\nSustainable fisheries, including through the 1995 Agreement for the Implementation \nof the Provisions of the United Nations Convention on the Law of the Sea of \n10 December 1982 relating to the Conservation and Management of Straddling \nFish Stocks and Highly Migratory Fish Stocks, and related instruments \nA/RES/79/145\n \n31/50\n24-23839 \n \nmandates of the World Trade Organization Doha Development Agenda 35 and the Hong \nKong Ministerial Declaration to strengthen disciplines on subsidies in the fisheries \nsector, including through the prohibition of certain forms of fisheries subsidies that \ncontribute to overcapacity and overfishing, recognizing that appropriate and effective \nspecial and differential treatment for developing and least developed countries should \nbe an integral part of World Trade Organization fisheries subsidies negotiation, taking \ninto account the importance of the sector to development priorities, poverty reduction \nand livelihood and food security concerns, and encouraged one another to further \nimprove the transparency and reporting of existing fisheries subsidies programmes \nthrough the World Trade Organization and, given the state of fisheries resources, and \nwithout prejudicing the Doha and Hong Kong ministerial mandates on fisheries \nsubsidies or the need to conclude those negotiations, to eliminate subsidies that \ncontribute to overcapacity and overfishing and to refrain from introducing new such \nsubsidies or from extending or enhancing existing ones; \n \n150. Also recalls the adoption in 2022 of the Agreement on Fisheries Subsidies \nby the World Trade Organization,36 and the establishment of the voluntary Fisheries \nFunding Mechanism of the World Trade Organization, which is envisioned to support \ndeveloping and least developed countries in implementing that Agreement, notes the \nrecent acceptances of the Agreement on Fisheries Subsidies, and encourages World \nTrade Organization members to deposit their instruments of acceptance to bring the \nAgreement into force as soon as possible; \n \n151. Notes that members of the World Trade Organization should advance \nnegotiations on the outstanding issues for a comprehensive agreement on fisheries \nsubsidies, including through further disciplines on certain forms of fisheries subsidies \nthat contribute to overcapacity and overfishing, as soon as possible and by its \nFourteenth Ministerial Conference, recognizing that appropriate and effective special \nand differential treatment for developing country members and least developed \ncountry members should be an integral part of these negotiations; \n \nVII \nLarge-scale pelagic drift-net fishing \n \n152. Expresses concern that, despite the adoption of General Assembly \nresolution 46/215, the practice of large-scale pelagic drift-net fishing still exists and \nremains a threat to living marine resources; \n \n153. Urges States, individually and through regional fisheries management \norganizations and arrangements, to adopt effective measures, or strengthen existing \nmeasures, to implement and enforce the provisions of resolution 46/215 and \nsubsequent resolutions on large-scale pelagic drift-net fishing in order to eliminate \nthe use of large-scale pelagic drift nets in all seas and oceans, which means that efforts \nto implement resolution 46/215 should not result in the transfer to other parts of the \nworld of drift nets that contravene the resolution; \n \n154. Also urges States, individually and through regional fisheries management \norganizations and arrangements, to adopt effective measures, or strengthen existing \nmeasures, to implement and enforce the present global moratorium on the use of large-\nscale pelagic drift nets on the high seas, and calls upon States to ensure that vessels \nflying their flag that are duly authorized to use large-scale drift nets in waters under \ntheir national jurisdiction do not use such gear for fishing while on the high seas; \n \n_______________ \n \n35 See A/C.2/56/7, annex. \n \n36 World Trade Organization, document WT/MIN(22)/33, annex. \n\nA/RES/79/145 \nSustainable fisheries, including through the 1995 Agreement for the Implementation \nof the Provisions of the United Nations Convention on the Law of the Sea of \n10 December 1982 relating to the Conservation and Management of Straddling \nFish Stocks and Highly Migratory Fish Stocks, and related instruments \n \n24-23839\n32/50 \n \nVIII \nFisheries by-catch and discards \n \n155. Urges \nStates, \nsubregional \nand \nregional \nfisheries \nmanagement \norganizations and arrangements and other relevant international organizations that \nhave not done so to take action, including with consideration of the interests of \ndeveloping coastal States and, as appropriate, subsistence fishing communities, to \nminimize by-catch, as well as to reduce or eliminate catch by lost or abandoned gear, \nfish discards and post-harvest losses, including of juvenile fish, consistent with \ninternational law and relevant international instruments, including the Code, and in \nparticular to consider measures including, as appropriate, technical measures related \nto fish size, mesh size or gear, discards, closed seasons and areas and zones reserved \nfor selected fisheries, particularly artisanal fisheries, the establishment of mechanisms \nfor communicating information on areas of high concentration of juvenile fish, taking \ninto account the importance of ensuring the confidentiality of such information, and \nsupport for studies and research that will minimize by-catch of juvenile fish, and to \nensure that these measures are implemented so as to optimize their effectiveness; \n \n156. Encourages, in this regard, States, individually or through regional \nfisheries management organizations and arrangements, as appropriate, to ensure \nproper implementation and enforcement of the measures that they have taken with \nregard to by-catch and discards; \n \n157. Welcomes the commitment of States in \u201cThe future we want\u201d to enhance \naction to manage by-catch, discards and other adverse ecosystem impacts from \nfisheries, including by eliminating destructive fishing practices, consistent with \ninternational law, the applicable international instruments and relevant General \nAssembly resolutions and guidelines of the Food and Agriculture Organization of the \nUnited Nations; \n \n158. Calls upon States, either individually, collectively or through regional \nfisheries management organizations and arrangements, to further study, develop and \nadopt effective management measures, taking into account the best available \nscientific information on fishing methods, including fish aggregating devices, to \nminimize by-catch; \n \n159. Also calls upon States, either individually, collectively or through regional \nfisheries management organizations and arrangements, to collect the necessary data \nin order to evaluate and closely monitor the use of large-scale fish aggregating devices \nand other devices, as appropriate, and their effects on tuna resources and tuna \nbehaviour and associated and dependent species, to improve management procedures \nto monitor the number, type and use of such devices and to mitigate possible negative \neffects on the ecosystem, including on juveniles and the incidental by-catch of \nnon\u2011target species, particularly sharks and turtles, notes in this regard the measures \nadopted by different regional fisheries management organizations and arrangements, \nand encourages regional fisheries management organizations and arrangements to \ncontinue to work on data collection, evaluation and monitoring of such devices; \n \n160. Notes, in this regard, that some regional fisheries management \norganizations, including the Inter-American Tropical Tuna Commission, the \nInternational Commission for the Conservation of Atlantic Tunas, the Indian Ocean \nTuna Commission and the Western and Central Pacific Fisheries Commission, have \nestablished their own working groups to assess the use and impact of large-scale fish \naggregating devices; \n \n161. Encourages States, individually or through regional fisheries management \norganizations and arrangements, to promote, as appropriate, the sustainable use of \nenvironmentally friendly fish aggregating devices, while ensuring compliance with \n\nSustainable fisheries, including through the 1995 Agreement for the Implementation \nof the Provisions of the United Nations Convention on the Law of the Sea of \n10 December 1982 relating to the Conservation and Management of Straddling \nFish Stocks and Highly Migratory Fish Stocks, and related instruments \nA/RES/79/145\n \n33/50\n24-23839 \n \nmeasures that they have taken relating to such devices, and promoting the application \nof sustainable design and manufacturing criteria, such as the use of non\u2011entangling \nand biodegradable materials to minimize the negative environmental impacts; \n \n162. Urgently calls upon States, subregional and regional fisheries management \norganizations and arrangements and, where appropriate, other relevant international \norganizations to develop and implement effective management measures to reduce \nthe incidence of catch and discards of non\u2011target species, including the utilization of \nselective fishing gear, where appropriate, and to take appropriate measures to \nminimize waste, and welcomes in this regard the support of the Committee on \nFisheries for the development of a technical guideline of the Food and Agriculture \nOrganization of the United Nations addressing the causes of and remedies to food \nlosses and waste; \n \n163. Calls upon States and regional fisheries management organizations and \narrangements with the competence to regulate fisheries to urgently implement \nmeasures aimed at contributing to minimizing and, where possible, eliminating \ncatches, including incidental catches, of species which are critically endangered;  \n \n164. Calls upon States and subregional and regional fisheries management \norganizations and arrangements to adopt or improve measures to assess the impact of \ntheir fisheries on species caught as by-catch and to improve the comprehensiveness \nand accuracy of information and reporting on species caught as by-catch, including \nthrough adequate observer coverage and the use of modern technologies, such as \nelectronic monitoring, and to provide assistance to developing States to meet data-\ncollection and reporting obligations; \n \n165. Requests States and regional fisheries management organizations and \narrangements, as appropriate, to strengthen or establish data-collection programmes \nto obtain reliable species-specific estimates of shark, marine turtle, fin-fish, marine \nmammal and seabird by-catch, and to promote further research on selective fishing \ngear and practices and on the use of appropriate by-catch mitigation measures; \n \n166. Encourages the widest application of the International Guidelines on \nBycatch Management and Reduction of Discards of the Food and Agriculture \nOrganization of the United Nations 37 and the Guidelines to Prevent and Reduce \nBycatch of Marine Mammals in Capture Fisheries of the Food and Agriculture \nOrganization of the United Nations;38 \n \n167. Encourages States and regional fisheries management organizations and \narrangements to coordinate in the development and implementation of clear and \nstandardized by-catch data-collection and reporting protocols for non\u2011target species, \nin particular endangered, threatened and protected species, taking into account best-\npractice advice from appropriate international organizations and arrangements, \nincluding the Food and Agriculture Organization of the United Nations and the \nAgreement on the Conservation of Albatrosses and Petrels;39 \n \n168. Encourages States and entities referred to in the Convention and in \narticle 1, paragraph 2 (b), of the Agreement to give due consideration to participation, \nas appropriate, in subregional and regional instruments and organizations with \nmandates to conserve non\u2011target species taken incidentally in fishing operations; \n \n169. Encourages States to strengthen, if necessary, the capacity of those \nsubregional and regional fisheries management organizations and arrangements in \n_______________ \n \n37 Food and Agriculture Organization of the United Nations, document FIRO/R957 (En), appendix E. \n \n38 Food and Agriculture Organization of the United Nations, Technical Guidelines for Responsible \nFisheries, No. 1, Supplement No. 4 (Rome. 2021). \n \n39 United Nations, Treaty Series, vol. 2258, No. 40228. \n\nA/RES/79/145 \nSustainable fisheries, including through the 1995 Agreement for the Implementation \nof the Provisions of the United Nations Convention on the Law of the Sea of \n10 December 1982 relating to the Conservation and Management of Straddling \nFish Stocks and Highly Migratory Fish Stocks, and related instruments \n \n24-23839\n34/50 \n \nwhich they participate to ensure the adequate conservation of non\u2011target species taken \nincidentally in fishing operations, taking into consideration best practices for \nnon\u2011target species management, and to expedite their ongoing efforts in this regard; \n \n170. Requests States and regional fisheries management organizations and \narrangements urgently to implement, as appropriate, the measures recommended in \nthe 2004 Guidelines to Reduce Sea Turtle Mortality in Fishing Operations and the \nInternational Plan of Action for Reducing Incidental Catch of Seabirds in Longline \nFisheries of the Food and Agriculture Organization of the United Nations in order to \nprevent the decline of sea turtles and seabird populations by minimizing by-catch and \nincreasing post-release survival in their fisheries, including through research and \ndevelopment of gear and bait alternatives, promoting the use of available by-catch \nmitigation \ntechnology, \nand \nestablishing \nand \nstrengthening \ndata-collection \nprogrammes to obtain standardized information to develop reliable estimates of the \nby-catch of these species; \n \n171. Urges States, individually or through regional fisheries management \norganizations and arrangements, to implement the International Guidelines on \nBycatch Management and Reduction of Discards of the Food and Agriculture \nOrganization of the United Nations;  \n \n172. Requests States and regional fisheries management organizations and \narrangements to continue to take urgent action to reduce the by-catch of seabirds, \nincluding albatrosses and petrels, in fisheries by adopting and implementing \nconservation measures consistent with the 2009 best practices technical guidelines of \nthe Food and Agriculture Organization of the United Nations to support the \nimplementation of the International Plan of Action for Reducing Incidental Catch of \nSeabirds in Longline Fisheries and taking into account the work of the Agreement on \nthe Conservation of Albatrosses and Petrels and of organizations such as the \nCommission for the Conservation of Antarctic Marine Living Resources; \n \nIX \nSubregional and regional cooperation \n \n173. Urges coastal States and States fishing on the high seas, in accordance with \nthe Convention, the Agreement and other relevant instruments, to pursue cooperation \nin relation to straddling fish stocks and highly migratory fish stocks, either directly \nor through appropriate subregional or regional fisheries management organizations or \narrangements, to ensure the effective conservation and management of such stocks; \n \n174. Urges States fishing for straddling fish stocks and highly migratory fish \nstocks on the high seas, and relevant coastal States, where a subregional or regional \nfisheries management organization or arrangement has the competence to establish \nconservation and management measures for such stocks, to give effect to their duty \nto cooperate by becoming members of such an organization or participants in such an \narrangement, or by agreeing to apply the conservation and management measures \nestablished by such an organization or arrangement, or to otherwise ensure that no \nvessel flying their flag is authorized to access the fisheries resources to which regional \nfisheries management organizations and arrangements or conservation and \nmanagement measures established by such organizations or arrangements apply; \n \n175. Invites, in this regard, subregional and regional fisheries management \norganizations and arrangements to ensure that all States having a real interest in the \nfisheries concerned may become members of such organizations or participants in \nsuch arrangements, in accordance with the Convention, the Agreement and the Code, \nprovided they have shown their interest in and capacity to comply with the measures \nadopted by the regional fisheries management organizations and arrangements \n\nSustainable fisheries, including through the 1995 Agreement for the Implementation \nof the Provisions of the United Nations Convention on the Law of the Sea of \n10 December 1982 relating to the Conservation and Management of Straddling \nFish Stocks and Highly Migratory Fish Stocks, and related instruments \nA/RES/79/145\n \n35/50\n24-23839 \n \nconcerned, including their willingness to effectively exercise flag State control, while \nrecognizing the need to enhance the capacity of developing States in this regard; \n \n176. Encourages relevant coastal States and States fishing on the high seas for \na straddling fish stock or a highly migratory fish stock, where there is no subregional \nor regional fisheries management organization or arrangement to establish \nconservation and management measures for such stocks, to cooperate to establish \nsuch an organization or enter into another appropriate arrangement to ensure the \nconservation and management of such stocks, and to participate in the work of the \norganization or arrangement; \n \n177. Recalls the entry into force, on 25 June 2021, of the Agreement to Prevent \nUnregulated High Seas Fisheries in the Central Arctic Ocean; \n \n178. Urges signatory States and other States whose vessels fish within the area \nof the Convention on the Conservation and Management of Fishery Resources in the \nSouth-East Atlantic Ocean 40 for fishery resources covered by that Convention to \nbecome parties to that Convention as a matter of priority and, in the interim, to ensure \nthat vessels flying their flags fully comply with the measures adopted; \n \n179. Encourages further ratifications of, accessions to, acceptances and \napprovals of the Southern Indian Ocean Fisheries Agreement; 41 \n \n180. Also encourages further ratifications of, accessions to, acceptances and \napprovals of the Convention on the Conservation and Management of High Seas \nFishery Resources in the South Pacific Ocean;42 \n \n181. Further encourages further accessions to the Convention on the \nConservation and Management of High Seas Fisheries Resources in the North Pacific \nOcean, and notes the ongoing efforts by the North Pacific Fisheries Commission to \ndevelop and implement conservation and management measures and to strengthen \ncooperation to eliminate illegal, unreported and unregulated fishing within the area \nof that Convention; \n \n182. Welcomes the endorsement of the Agreement for the Establishment of the \nGeneral Fisheries Commission for the Mediterranean, as amended, by the \nCommission at its thirty-eighth session, held in Rome from 19 to 24 May 2014, and \nurges those Contracting Parties to the Commission that need to accept the amended \nAgreement to do so with a view to its early entry into force; \n \n183. Encourages signatory States and States having a real interest to become \nparties to the Convention for the Strengthening of the Inter-American Tropical Tuna \nCommission Established by the 1949 Convention between the United States of \nAmerica and the Republic of Costa Rica; \n \n184. Notes the ongoing efforts of the Association of Southeast Asian Nations, \nthrough its Fisheries Consultative Forum, to address common problems on fisheries \nmanagement and development in the South-East Asian region; \n \n185. Urges further efforts by regional fisheries management organizations and \narrangements, as a matter of priority, in accordance with international law, to \nstrengthen and modernize their mandates and the measures adopted by such \norganizations or arrangements, and to implement modern approaches to fisheries \nmanagement, including responsible conduct of fishing operations as reflected in the \nAgreement and other relevant international instruments, relying on the best scientific \ninformation available and application of the precautionary approach and incorporating \n_______________ \n \n40 Ibid., vol. 2221, No. 39489. \n \n41 Ibid., vol. 2835, No. 49647. \n \n42 Ibid., vol. 2899, No. 50553. \n\nA/RES/79/145 \nSustainable fisheries, including through the 1995 Agreement for the Implementation \nof the Provisions of the United Nations Convention on the Law of the Sea of \n10 December 1982 relating to the Conservation and Management of Straddling \nFish Stocks and Highly Migratory Fish Stocks, and related instruments \n \n24-23839\n36/50 \n \nan ecosystem approach to fisheries management and biodiversity considerations, \nincluding the conservation and management of ecologically related and dependent \nspecies and protection of their habitats, where these aspects are lacking, to ensure that \nthey effectively contribute to the long-term conservation and management and \nsustainable use of living marine resources, and welcomes those regional fisheries \nmanagement organizations and arrangements that have taken steps in this direction; \n \n186. Welcomes in this regard the amendments to the International Convention \nfor the Conservation of Atlantic Tunas made by the Palma de Mallorca Protocol and \nadopted by the International Commission for the Conservation of Atlantic Tunas in \n2019, and urges States Parties that are Contracting Parties to that Convention to \nurgently approve, ratify or accept the Protocol; \n \n187. Calls upon regional fisheries management organizations with the \ncompetence to conserve and manage highly migratory fish stocks that have not yet \nadopted effective conservation and management measures in line with the best \nscientific information available to conserve and manage stocks falling under their \nmandate to do so urgently; \n \n188. Also, in this regard, calls upon regional fisheries management \norganizations to be more cautious when information is uncertain, unreliable or \ninadequate, in line with article 6 of the Agreement; \n \n189. Urges States to strengthen and enhance cooperation among existing and \ndeveloping regional fisheries management organizations and arrangements in which \nthey participate, including increased communication and further coordination of \nmeasures, such as through the holding of joint consultations, and to strengthen \nintegration, coordination and cooperation by such regional fisheries management \norganizations and arrangements with other relevant fisheries organizations, regional \nseas arrangements and other relevant international organizations; \n \n190. Notes, in this regard, the initiative of the Food and Agriculture \nOrganization of the United Nations to promote the establishment of regional \nframeworks among regional fishery bodies to scale up cooperation and coordination \ntowards sustainable fisheries;43 \n \n191. Also notes, in this regard, the enhanced cooperation between the OSPAR \nCommission established by the Convention for the Protection of the Marine \nEnvironment of the North-East Atlantic 44  and the North-East Atlantic Fisheries \nCommission; \n \n192. Urges the five regional fisheries management organizations with \ncompetence to manage highly migratory species to continue to take measures to \nimplement the Course of Actions adopted at the second joint meeting of tuna regional \nfisheries management organizations and arrangements and to consider the \nrecommendations of the third joint meeting of tuna regional fisheries management \norganizations and arrangements; \n \n193. Invites States and regional fisheries management organizations and \narrangements with competence to manage straddling fish stocks to share experiences \nand good practices, for example by considering organizing joint meetings, where \nappropriate; \n_______________ \n \n43 Food and Agriculture Organization of the United Nations, \u201cA regional framework among \nregional fishery bodies \u2013 scaling up cooperation and coordination towards sustainable fisheries\u201d \n(Rome, 2023). \n \n44 United Nations, Treaty Series, vol. 2354, No. 42279. \n\nSustainable fisheries, including through the 1995 Agreement for the Implementation \nof the Provisions of the United Nations Convention on the Law of the Sea of \n10 December 1982 relating to the Conservation and Management of Straddling \nFish Stocks and Highly Migratory Fish Stocks, and related instruments \nA/RES/79/145\n \n37/50\n24-23839 \n \n \n194. Invites States and regional fisheries management organizations and \narrangements with competence to manage deep-sea fisheries to share experiences and \ngood practices, for example, by considering organizing joint meetings, where \nappropriate;  \n \n195. Urges regional fisheries management organizations and arrangements to \nimprove transparency and to ensure that their decision-making processes are fair and \ntransparent and facilitate the adoption of conservation and management measures in \na timely and effective manner, including considering provisions for effective voting \nand objection procedures, where appropriate, to rely on the best scientific information \navailable, incorporate the precautionary approach and ecosystem approaches, and \naddress participatory rights, including through, inter alia, the development of \ntransparent criteria for allocating fishing opportunities which reflects, where \nappropriate, the relevant provisions of the Agreement, taking due account, inter alia, \nof the status of the relevant stocks and the respective interests in the fishery; \n \n196. Recognizes that performance reviews of regional fisheries management \norganizations and arrangements have proven to be an effective tool for strengthening \nthe performance of such organizations and arrangements, and are critical to improve \nthe sustainability of fish stocks covered by such organizations and arrangements, and \nnotes that the fourteenth round of informal consultations of States parties to the \nAgreement focused on the topic \u201cPerformance reviews of regional fisheries \nmanagement organizations and arrangements\u201d;45 \n \n197. Welcomes the fact that a number of regional fisheries management \norganizations and arrangements have completed performance reviews, and \nencourages the implementation, as appropriate, of the recommendations of their \nrespective reviews as a matter of priority; \n \n198. Urges States, through their participation in regional fisheries management \norganizations and arrangements that have not done so, to undertake, on an urgent \nbasis, performance reviews of those regional fisheries management organizations and \narrangements, initiated either by the organization or arrangement itself or with \nexternal partners, including in cooperation with the Food and Agriculture \nOrganization of the United Nations, using transparent criteria based on the provisions \nof the Agreement and other relevant instruments, and taking into account the best \npractices of regional fisheries management organizations or arrangements and, as \nappropriate, any set of criteria developed by States or other regional fisheries \nmanagement organizations or arrangements, and encourages that such performance \nreviews include some element of independent evaluation and propose means for \nimproving the functioning of the regional fisheries management organization or \narrangement, as appropriate; \n \n199. Calls upon States, through their participation in regional fisheries \nmanagement organizations and arrangements, to undertake performance reviews of \nthose regional fisheries management organizations and arrangements on a regular \nbasis, to make the results publicly available, to implement the recommendations of \nsuch reviews and to strengthen the comprehensiveness of those reviews over time, as \nnecessary; \n \n200. Recalls that, in \u201cThe future we want\u201d, States recognized the need for \ntransparency and accountability in fisheries management by regional fisheries \nmanagement organizations and the efforts already made by those regional fisheries \nmanagement organizations that had undertaken independent performance reviews, \n_______________ \n \n45 See document ICSP14/UNFSA/INF.3. Available at www.un.org/depts/los/convention_ \nagreements/ICSP14/ReportICSP14.pdf. \n\nA/RES/79/145 \nSustainable fisheries, including through the 1995 Agreement for the Implementation \nof the Provisions of the United Nations Convention on the Law of the Sea of \n10 December 1982 relating to the Conservation and Management of Straddling \nFish Stocks and Highly Migratory Fish Stocks, and related instruments \n \n24-23839\n38/50 \n \ncalled upon all regional fisheries management organizations to regularly undertake \nsuch reviews and make the results publicly available, encouraged implementation of \nthe recommendations of such reviews and recommended that the comprehensiveness \nof those reviews be strengthened over time, as necessary; \n \n201. Urges States to cooperate, taking into account those performance reviews, \nto develop best-practice guidelines for regional fisheries management organizations \nand arrangements and to apply, to the extent possible, those guidelines to \norganizations and arrangements in which they participate; \n \n202. Encourages States, individually or through regional fisheries management \norganizations and arrangements, as appropriate, to recognize the importance and role \nof small-scale, artisanal and subsistence fisheries and to support their long-term \nenvironmental, economic and social sustainability; \n \n203. Encourages the development of regional guidelines for States to use in \nestablishing sanctions for non\u2011compliance by vessels flying their flag and by their \nnationals, to be applied in accordance with national law, that are adequate in severity \nfor effectively securing compliance, deterring further violations and depriving \noffenders of the benefits deriving from their illegal activities, as well as in evaluating \ntheir systems of sanctions to ensure that they are effective in securing compliance and \ndeterring violations; \n \n204. Recognizes the importance of ensuring transparency of reporting of fishing \nactivities within regional fisheries management organizations and arrangements in \norder to facilitate efforts to combat illegal, unreported and unregulated fishing, as \nwell as the importance of respecting the reporting obligations within those \norganizations and arrangements, notes in this regard the measures adopted by the \nInternational Commission for the Conservation of Atlantic Tunas 46 and the Indian \nOcean Tuna Commission, 47  and encourages other regional fisheries management \norganizations and arrangements to consider establishing similar measures; \n \nX \nResponsible fisheries in the marine ecosystem \n \n205. Encourages States, individually and through relevant international bodies, \nto improve the understanding of the causes and impacts of forced labour and human \ntrafficking in the fishing and aquaculture industries, including processing and related \nindustries, and to further consider actions to combat these practices, including raising \nawareness of the issue; \n \n206. Highlights the importance of safety at sea and working conditions in the \nfisheries sector, welcomes in this regard the close cooperation between the Food and \nAgriculture Organization of the United Nations, the International Labour \nOrganization and the International Maritime Organization, including with regard to \ntheir joint work on codes and guidelines in relation to fishing vessel safety, including \nthrough the Joint Ad Hoc Working Group on Illegal, Unreported and Unregulated \nFishing and Related Matters, and reiterates the request of the Committee on Fisheries \nthat the Food and Agriculture Organization of the United Nations further strengthen \ninternational cooperation on occupational health and safety issues in the fisheries and \naquaculture sectors and promote decent work for fishers and fish workers;  \n \n207. Recalls that the Work in Fishing Convention, 2007 (No. 188) and the \nProtocol of 2014 to the Forced Labour Convention, 1930 (No. 29) are relevant \ninstruments that ensure decent working conditions in fisheries and other maritime \n_______________ \n \n46 International Commission for the Conservation of Atlantic Tunas, recommendation 11\u201316. \n \n47 Indian Ocean Tuna Commission, resolutions 12/07 and 13/07. \n\nSustainable fisheries, including through the 1995 Agreement for the Implementation \nof the Provisions of the United Nations Convention on the Law of the Sea of \n10 December 1982 relating to the Conservation and Management of Straddling \nFish Stocks and Highly Migratory Fish Stocks, and related instruments \nA/RES/79/145\n \n39/50\n24-23839 \n \nsectors, calls upon flag States to effectively implement their duty under the \nConvention with respect to labour conditions, taking into account applicable \ninternational instruments and national laws, and in this regard encourages States that \nhave not yet done so to consider becoming parties to the Protocol of 2014 to the \nForced Labour Convention, 1930 (No. 29) and the Work in Fishing Convention, 2007 \n(No. 188), and to implement the Guidelines for port State control officers carrying \nout inspections under the Work in Fishing Convention, 2007 (No. 188) and the \nGuidelines on flag State inspection of working and living conditions on board fishing \nvessels; \n \n208. Encourages States to establish, as appropriate, including through regional \nfisheries management organizations and arrangements of which they are members, \nstandards for decent working conditions for crew, inspectors and observers within the \nfisheries within their competence, in accordance with international instruments to \nwhich they are party; \n \n209. Urges States, individually or through regional fisheries management \norganizations and arrangements, to enhance their efforts to apply an ecosystem \napproach to fisheries, taking into account paragraph 30 (d) of the Johannesburg Plan \nof Implementation; \n \n210. Acknowledges the importance of adequate training for fishers to improve \nsafety at sea and the importance, in this regard, of the International Convention on \nStandards of Training, Certification and Watchkeeping for Fishing Vessel Personnel, \n1995, and encourages States that have not yet done so to consider becoming parties \nto that Convention; \n \n211. Encourages States, individually or through regional fisheries management \norganizations and arrangements and other relevant international organizations, to \nwork to ensure that fisheries and other ecosystem data collection is performed in a \ncoordinated and integrated manner, facilitating incorporation into global observation \ninitiatives, where appropriate; \n \n212. Calls upon States and regional fisheries management organizations or \narrangements, working in cooperation with other relevant organizations, including the \nFood and Agriculture Organization of the United Nations, the Intergovernmental \nOceanographic Commission and the World Meteorological Organization, to adopt, as \nappropriate, measures to protect ocean data buoy systems moored in areas beyond \nnational jurisdiction from actions that impair their operation; \n \n213. Encourages States to increase scientific research on marine ecosystems in \naccordance with international law; \n \n214. Recognizes that the science-policy interface is vital to the effective \nimplementation of the provisions of the Convention and the Agreement by providing \nthe best available scientific information for the conservation and management of \nliving marine resources; \n \n215. Urges States, individually and through regional fisheries management \norganizations and arrangements, to strengthen the science-policy interface in order to \nfurther improve the application of the ecosystem approach to fisheries management \nand to address uncertainties and changes such as those related to the impacts of \nclimate change in support of the development of adaptive fisheries management \nstrategies;  \n \n216. Calls upon States, the Food and Agriculture Organization of the United \nNations and other specialized agencies, subregional and regional fisheries \nmanagement organizations and arrangements, where appropriate, and other \nappropriate intergovernmental bodies to cooperate in achieving sustainable \n\nA/RES/79/145 \nSustainable fisheries, including through the 1995 Agreement for the Implementation \nof the Provisions of the United Nations Convention on the Law of the Sea of \n10 December 1982 relating to the Conservation and Management of Straddling \nFish Stocks and Highly Migratory Fish Stocks, and related instruments \n \n24-23839\n40/50 \n \naquaculture, including through information exchange, developing equivalent \nstandards on such issues as aquatic animal health and human health and safety \nconcerns, assessing the potential positive and negative impacts of aquaculture, \nincluding socioeconomics, on the marine and coastal environment, including \nbiodiversity, and adopting relevant methods and techniques to minimize and mitigate \nadverse effects, and in this regard encourages the implementation of the 2007 Strategy \nand Outline Plan for Improving Information on Status and Trends of Aquaculture of \nthe Food and Agriculture Organization of the United Nations as a framework for the \nimprovement and understanding of aquaculture status and trends; \n \n217. Calls upon States to take action immediately, individually and through \nregional fisheries management organizations and arrangements, and consistent with \nthe precautionary approach and ecosystem approaches, to continue to implement the \n2008 International Guidelines for the Management of Deep-Sea Fisheries in the High \nSeas of the Food and Agriculture Organization of the United Nations (the Guidelines) \nin order to sustainably manage fish stocks and protect vulnerable marine ecosystems, \nincluding seamounts, hydrothermal vents and cold water corals, from fishing practices \nwith significant adverse impacts on vulnerable marine ecosystems, recognizing the \nimmense importance and value of deep-sea ecosystems and the biodiversity they \ncontain, as documented in the first World Ocean Assessment;  \n \n218. Recalls, in this regard, that, in \u201cThe future we want\u201d, States committed to \nenhance actions to protect vulnerable marine ecosystems from significant adverse \nimpacts, including through the effective use of impact assessments, consistent with \ninternational law, the applicable international instruments and relevant General \nAssembly resolutions and guidelines of the Food and Agriculture Organization of the \nUnited Nations;  \n \n219. Reaffirms the importance of paragraphs 80 to 90 of resolution 61/105, \nparagraphs 113 to 127 of resolution 64/72, paragraphs 121 to 136 of resolution 66/68 \nof 6 December 2011 and paragraphs 156, 171 to 188 and 219 of resolution 71/123 of \n7 December 2016 addressing the impacts of bottom fishing on vulnerable marine \necosystems and the long-term sustainability of deep-sea fish stocks and the actions \ncalled for in those resolutions, and emphasizes the need for full implementation by \nall States and relevant regional fisheries management organizations and arrangements \nof their commitments under those paragraphs on an urgent basis; \n \n220. Urges States and regional fisheries management organizations and \narrangements to ensure that their actions in sustainably managing deep-sea fisheries \nand implementing paragraphs 80 and 83 to 87 of resolution 61/105, paragraphs 113 \nand 119 to 124 of resolution 64/72, paragraphs 121, 129, 130 and 132 to 134 of \nresolution 66/68 and paragraphs 156, 171 to 188 and 219 of resolution 71/123 are \nconsistent with the Guidelines; \n \n221. Recalls that nothing in the paragraphs of resolutions 61/105, 64/72, 66/68 \nand 71/123 addressing the impacts of bottom fishing on vulnerable marine ecosystems \nprejudices the sovereign rights of coastal States over their continental shelf or the \nexercise of the jurisdiction of coastal States with respect to their continental shelf \nunder international law as reflected in the Convention, in particular article 77 thereof; \n \n222. Notes, in this regard, the adoption by coastal States of conservation \nmeasures regarding their continental shelf to address the impacts of bottom fishing on \nvulnerable marine ecosystems, as well as their efforts to ensure compliance with those \nmeasures; \n \n223. Reiterates the importance of marine scientific research for the sustainable \nmanagement of deep-sea fishery resources, including target fish stocks and non\u2011target \n\nSustainable fisheries, including through the 1995 Agreement for the Implementation \nof the Provisions of the United Nations Convention on the Law of the Sea of \n10 December 1982 relating to the Conservation and Management of Straddling \nFish Stocks and Highly Migratory Fish Stocks, and related instruments \nA/RES/79/145\n \n41/50\n24-23839 \n \nspecies, and to protect marine ecosystems, including the prevention of significant \nadverse impacts on vulnerable marine ecosystems; \n \n224. Welcomes the important progress made by States, regional fisheries \nmanagement organizations and arrangements and those States participating in \nnegotiations to establish a regional fisheries management organization or arrangement \ncompetent to regulate bottom fisheries to implement paragraphs 80 and 83 to 87 of \nresolution 61/105, paragraphs 113, 117 and 119 to 124 of resolution 64/72, paragraphs \n121, 126, 129, 130 and 132 to 134 of resolution 66/68 and paragraphs 156, 171, 175, \n177 to 188 and 219 of resolution 71/123, and address the impacts of bottom fishing \non vulnerable marine ecosystems, including that reflected in the summary of \ndiscussions from the two-day United Nations workshop addressing the impacts of \nbottom fishing on vulnerable marine ecosystems and the long-term sustainability of \ndeep-sea fish stocks, but notes with renewed concern the uneven implementation of \nthose paragraphs listed above and that, in particular, bottom fishing continues to occur \nin certain areas beyond national jurisdiction without an impact assessment having \nbeen completed in the 18 years since the adoption of resolution 61/105, in which the \nGeneral Assembly called for such assessments to be undertaken by 31 December \n2008; \n \n225. Recognizes the need for further progress with regard to obtaining more \nbiological information on the species that comprise vulnerable marine ecosystems, \nincluding their associated and dependent species, the assessment of significant \nadverse impacts on vulnerable marine ecosystems, and protecting and conserving \nbiodiversity, including beyond vulnerable marine ecosystems, as well as the \nconsistent application of the Guidelines; \n \n226. Calls upon, in this regard, States, regional fisheries management \norganizations and arrangements and those States participating in negotiations to \nestablish a regional fisheries management organization or arrangement competent to \nregulate bottom fisheries to identify and overcome barriers to the implementation of \nthe relevant paragraphs of General Assembly resolutions 64/72, 66/68 and 71/123 \nsuch as data availability, especially with regard to baseline data and the spatial \ndistribution and connectivity of vulnerable marine ecosystems, including their \nassociated and dependent species, while recognizing the importance of international \ncollaboration for this purpose, further recognizing that effective management of \nbottom fisheries is crucial to ensure the long-term sustainability of the sector; \n \n227. Calls upon, in this regard, States, regional fisheries management \norganizations and arrangements with the competence to regulate deep-sea fisheries, \nand States participating in negotiations to establish such organizations or \narrangements to take, in particular, the following urgent actions regarding bottom \nfishing in areas beyond national jurisdiction: \n \n(a) \nTo use, as applicable, the full set of criteria in the Guidelines to identify \nwhere vulnerable marine ecosystems occur or are likely to occur, as well as for \nassessing significant adverse impacts on such ecosystems, including their associated \nand dependent species; \n \n(b) \nTo ensure that impact assessments, including for cumulative impacts of \nactivities covered by the assessment, are conducted for all types of bottom-fishing \nactivities consistent with the Guidelines, particularly paragraph 47 thereof, are \nreviewed periodically and are revised thereafter whenever a substantial change in the \nfishery has occurred or there is relevant new information, and that, where such impact \nassessments have not been undertaken, they are carried out as a priority before \nauthorizing bottom-fishing activities;  \n\nA/RES/79/145 \nSustainable fisheries, including through the 1995 Agreement for the Implementation \nof the Provisions of the United Nations Convention on the Law of the Sea of \n10 December 1982 relating to the Conservation and Management of Straddling \nFish Stocks and Highly Migratory Fish Stocks, and related instruments \n \n24-23839\n42/50 \n \n \n(c) \nTo ensure that the precautionary approach is applied, including in the \nutilization of impact assessments to inform management decisions and consideration \nof significant adverse impacts on vulnerable marine ecosystems, including their \nassociated and dependent species; \n \n(d) \nTo ensure that conservation and management measures adopted by States \nand regional fisheries organizations and arrangements are based on and updated on \nthe basis of the best available scientific information, noting in particular the need to \nimprove the effective implementation of thresholds and move-on rules; \n \n228. Recognizes that different types of marine scientific research, such as \nseabed mapping, mapping of vulnerable marine ecosystems based on information \nfrom the fishing fleet, on-site camera observations from remote vehicles, benthic \necosystem modelling, comparative benthic studies and predictive modelling have \nresulted in the identification of areas where vulnerable marine ecosystems are known \nor are likely to occur and in the adoption of conservation and management measures \nto prevent significant adverse impacts on such ecosystems, including the closure of \nareas to bottom fishing in accordance with paragraph 119 (b) of resolution 64/72; \n \n229. Encourages, in this regard, States, regional fisheries management \norganizations and arrangements with the competence to manage bottom fisheries, and \nStates participating in negotiations to establish such organizations or arrangements, \nto consider the results available from different types of marine scientific research, \nincluding, as appropriate, those listed in paragraph 223 above, concerning the \nidentification of areas containing vulnerable marine ecosystems, and to adopt \nconservation and management measures to prevent significant adverse impacts from \nbottom fishing on such ecosystems, consistent with the Guidelines, or to close such \nareas to bottom fishing until such conservation and management measures are \nadopted, as well as to continue to undertake further marine scientific research, for the \nabove-mentioned purposes, in accordance with international law, as reflected in \nPart XIII of the Convention; \n \n230. Encourages, in this regard, States, regional fisheries management \norganizations and arrangements with the competence to manage deep-sea fisheries, \nand States participating in negotiations to establish such organizations or \narrangements to continue to improve the best available science, carry out further \nmarine scientific research to address the remaining knowledge gaps, in particular with \nregard to fish stock assessments to improve understanding of the connectivity of \npopulations of deep-sea fish species and to base and update conservation and \nmanagement measures on the best available scientific information, in accordance with \ninternational law, as reflected in Part XIII of the Convention; \n \n231. Notes with concern that vulnerable marine ecosystems may also be \nimpacted by human activities other than bottom fishing, and encourages in this regard \nStates and competent international organizations to consider taking action to address \nsuch impacts; \n \n232. Calls upon States, individually and through regional fisheries management \norganizations and arrangements, to take into account the potential impacts of climate \nchange and ocean acidification in taking measures to manage deep-sea fisheries and \nprotect vulnerable marine ecosystems, including by identifying areas, based on \nscientific information, where deep-water species and vulnerable marine ecosystems \nare likely to better survive such impacts, and establishing measures to support their \nresilience; \n \n233. Also calls upon States, individually and through regional fisheries \nmanagement organizations and arrangements with the competence to regulate deep-\nsea fisheries, to adopt conservation and management measures, including monitoring, \n\nSustainable fisheries, including through the 1995 Agreement for the Implementation \nof the Provisions of the United Nations Convention on the Law of the Sea of \n10 December 1982 relating to the Conservation and Management of Straddling \nFish Stocks and Highly Migratory Fish Stocks, and related instruments \nA/RES/79/145\n \n43/50\n24-23839 \n \ncontrol and surveillance measures, on the basis of the best available scientific \ninformation, including stock assessments, to improve the robustness of such \nmeasures, to ensure the long-term sustainability of deep-sea fish stocks and non\u2011target \nspecies and the rebuilding of depleted stocks, consistent with the Guidelines and, \nwhere scientific information is uncertain, unreliable or inadequate, to ensure that \nconservation and management measures are established consistent with the \nprecautionary approach, in particular with regard to vulnerable, threatened or \nendangered species; \n \n234. Recognizes, in particular, the special circumstances and requirements of \ndeveloping States and the specific challenges that they may face in giving full effect \nto certain technical aspects of the Guidelines, and that implementation by such States \nof paragraphs 83 to 87 of resolution 61/105, paragraph 119 of resolution 64/72, \nparagraph 129 of resolution 66/68 and paragraph 180 of resolution 71/123 and the \nGuidelines should proceed in a manner that gives full consideration to section 6 of \nthe Guidelines on the special requirements of developing countries; \n \n235. Also recognizes the need to enhance the capacity of developing States, \nincluding with regard to stock assessments, impact assessments, scientific and \ntechnical knowledge and training, and encourages States to provide technical and \nfinancial support to developing countries to address their special requirements and \nchallenges in implementing the Guidelines; \n \n236. Welcomes the substantial ongoing work of the Food and Agriculture \nOrganization of the United Nations related to the management of deep-sea fisheries \nin the high seas and the protection of vulnerable marine ecosystems, including the \npublication of the technical paper entitled \u201cVulnerable marine ecosystems: processes \nand practices in the high seas\u201d, affirms the importance of the work undertaken \npursuant to paragraphs 135 and 136 of resolution 66/68, and notes in particular the \nsupport provided by the Food and Agriculture Organization of the United Nations to \nStates in implementing the Guidelines; \n \n237. Recalls its decision, in paragraph 223 of resolution 77/118 of 9 December \n2022, to conduct, in 2026, a further review of the actions taken by States and regional \nfisheries management organizations and arrangements in response to paragraphs 113, \n117 and 119 to 124 of resolution 64/72, paragraphs 121, 126, 129, 130 and 132 to 134 \nof resolution 66/68 and paragraphs 181, 203 to 207, 209, 210, 213, 215 to 222 and \n257 of resolution 77/118, with a view to ensuring the effective implementation of the \nmeasures therein and to make further recommendations, where necessary, and to \nprecede that review with a two-day workshop; \n \n238. Requests the Secretary-General to convene, with full conference services, \nwithout prejudice to future arrangements, a two-day workshop in the second half of \n2026 in order to discuss implementation of paragraphs 113, 117 and 119 to 124 of \nresolution 64/72, paragraphs 121, 126, 129, 130 and 132 to 134 of resolution 66/68 \nand paragraphs 181, 203 to 207, 209, 210, 213, 215 to 222 and 257 of resolution \n77/118, and to invite States, the Food and Agriculture Organization of the United \nNations and other relevant specialized agencies, funds and programmes, subregional \nand regional fisheries management organizations and arrangements, other fisheries \nbodies, other relevant intergovernmental bodies and relevant non\u2011governmental \norganizations and relevant stakeholders, in accordance with United Nations practice, \nto attend the workshop;  \n \n239. Also requests the Secretary-General to prepare a report similar in scope, \nlength and detail to his report to the General Assembly at its seventy-fifth session,48 \n_______________ \n \n48 A/75/157. \n\nA/RES/79/145 \nSustainable fisheries, including through the 1995 Agreement for the Implementation \nof the Provisions of the United Nations Convention on the Law of the Sea of \n10 December 1982 relating to the Conservation and Management of Straddling \nFish Stocks and Highly Migratory Fish Stocks, and related instruments \n \n24-23839\n44/50 \n \nin cooperation with the Food and Agriculture Organization of the United Nations and \nwith the assistance of an expert consultant to be hired by the Division to provide \ninformation and analysis on relevant technical and scientific issues to be covered in \nthe report, for consideration by the Assembly at its eighty-first session, on the actions \ntaken by States and regional fisheries management organizations and arrangements in \nresponse to paragraphs 113, 117 and 119 to 124 of resolution 64/72, paragraphs 121, \n126, 129, 130 and 132 to 134 of resolution 66/68 and paragraphs 181, 203 to 207, \n209, 210, 213, 215 to 222 and 257 of resolution 77/118, and invites States and regional \nfisheries management organizations and arrangements to consider making such \ninformation publicly available; \n \n240. Further requests the Secretary-General, in connection with the report \nrequested in paragraph 239 of the present resolution, to invite States and regional \neconomic integration organizations and regional fisheries management organizations \nand arrangements to submit detailed information to the Secretary-General in a timely \nmanner on actions taken pursuant to paragraphs 113, 117 and 119 to 124 of resolution \n64/72, paragraphs 121, 126, 129, 130 and 132 to 134 of resolution 66/68 and \nparagraphs 181, 203 to 207, 209, 210, 213, 215 to 222 and 257 of resolution 77/118, \nto facilitate a further review of such actions; \n \n241. Encourages accelerated progress to establish criteria on the objectives, \nestablishment and effective management of marine protected areas for fisheries \npurposes, and in this regard also encourages the application of the technical guidelines \non marine protected areas and fisheries of the Food and Agriculture Organization of \nthe United Nations, and urges involvement, coordination and cooperation among all \nrelevant international organizations and bodies; \n \n242. Also encourages efforts to establish guidance on the objectives, \nestablishment and management of other effective area-based conservation measures \nfor fisheries purposes, and encourages coordination and cooperation for this purpose \namong all relevant international organizations and bodies; \n \n243. Welcomes the determinations by the Northwest Atlantic Fisheries \nOrganization and the North-East Atlantic Fisheries Commission of management \nmeasures to protect vulnerable marine habitats as \u201cother effective area-based \nconservation measures\u201d, and encourages other regional fisheries management \norganizations and arrangements which have not already done so to undertake \nevidence-based analysis of management measures to determine if they would qualify \nas other effective area-based conservation measures, as appropriate; \n \n244. Acknowledges the work by the Food and Agriculture Organization of the \nUnited Nations to continue the consultative process to develop and disseminate \npractical guidance, led by the Food and Agriculture Organization of the United \nNations, on other effective area-based conservation measures; \n \n245. Notes the decision by the fifth Intergovernmental Review Meeting on the \nImplementation of the Global Programme of Action for the Protection of the Marine \nEnvironment from Land-based Activities49 to hold no further sessions of the periodic \nIntergovernmental Review, while recognizing the continued relevance and valuable \nrole of the Global Programme of Action and its three global partnerships, namely the \nGlobal Partnership on Marine Litter, the Global Partnership on Nutrient Management \nand the Global Wastewater Initiative, to safeguard marine ecosystems, including fish \nstocks, against sources of land-based pollution, including plastics and excess \nnutrients, and physical degradation, taking into account the increase in oceanic dead \nzones;  \n_______________ \n \n49 A/51/116, annex II. \n\nSustainable fisheries, including through the 1995 Agreement for the Implementation \nof the Provisions of the United Nations Convention on the Law of the Sea of \n10 December 1982 relating to the Conservation and Management of Straddling \nFish Stocks and Highly Migratory Fish Stocks, and related instruments \nA/RES/79/145\n \n45/50\n24-23839 \n \n \n246. Calls upon States, either individually, collectively or through regional \nfisheries management organizations and arrangements, to further study, develop and \nadopt effective management measures, and disseminate information in that regard, \ntaking into account the best available scientific information, on fishing methods, gear \ntypes and uses to minimize mortality and other harms caused by abandoned, lost or \notherwise discarded fishing gear; \n \n247. Acknowledges the serious environmental, as well as economic and social, \nimpacts on the marine environment caused by abandoned, lost or otherwise discarded \nfishing gear, and encourages States, and regional fisheries management organizations \nand arrangements, as appropriate, to take action to reduce such gear, noting the \nrecommendations of the 2009 report by the United Nations Environment Programme \nand the Food and Agriculture Organization of the United Nations; \n \n248. Reaffirms the importance that it attaches to paragraphs 77 to 81 of \nresolution 60/31 of 29 November 2005 concerning the issue of lost, abandoned or \notherwise discarded fishing gear and related marine debris and the adverse impacts \nthat such debris and derelict fishing gear have on, inter alia, fish stocks, habitats and \nother marine species, and urges accelerated progress by States and regional fisheries \nmanagement organizations and arrangements in implementing those paragraphs of the \nresolution; \n \n249. Recalls, in this regard, that the Committee on Fisheries, at its thirty-fourth \nsession, encouraged the Food and Agriculture Organization of the United Nations to \ncontinue promoting the Voluntary Guidelines on the Marking of Fishing Gear and the \nprovision of capacity development at regional and national levels; \n \n250. Encourages the Food and Agriculture Organization of the United Nations \nto continue to participate in the intergovernmental negotiating committee to develop \nan international legally binding instrument on plastic pollution, including in the \nmarine environment, and provide relevant technical and scientific information, \nincluding based on the Voluntary Guidelines of the Food and Agriculture Organization \nof the United Nations; \n \n251. Recalls annex V to the International Convention for the Prevention of \nPollution from Ships, 1973, as modified by the Protocol of 1978 relating thereto, in \nwhich it is stated, inter alia, that the accidental loss or discharge of fishing gear which \nposes a significant threat to the marine environment or navigation, shall be reported \nto the State whose flag the ship is entitled to fly, and, where the loss or discharge \noccurs within waters subject to the jurisdiction of a coastal State, also to that coastal \nState;50 \n \n252. Notes the decision of the Marine Environmental Protection Committee of \nthe International Maritime Organization, at its seventy-eighth session, to develop \ndraft amendments to annex V to the International Convention for the Prevention of \nPollution from Ships, 1973, as modified by the Protocol of 1978 relating thereto, and \nassociated guidelines to make the marking of fishing gear mandatory, using a goal-\nbased approach; \n \n253. Encourages further studies, including by the Food and Agriculture \nOrganization of the United Nations, on the impacts of underwater noise on fish stocks \nand fishing catch rates, as well as associated socioeconomic effects;  \n \n254. Calls upon States, including through regional fisheries management \norganizations and arrangements, to play an active role in global efforts to conserve \n_______________ \n \n50 International Maritime Organization, resolution MEPC.201(62). \n\nA/RES/79/145 \nSustainable fisheries, including through the 1995 Agreement for the Implementation \nof the Provisions of the United Nations Convention on the Law of the Sea of \n10 December 1982 relating to the Conservation and Management of Straddling \nFish Stocks and Highly Migratory Fish Stocks, and related instruments \n \n24-23839\n46/50 \n \nand sustainably use living marine resources, so as to contribute to marine biological \ndiversity;  \n \n255. Encourages States, either individually or through regional fisheries \nmanagement organizations and arrangements, as appropriate, to identify any \nspawning and nursery areas for fish stocks under their jurisdiction or competence and, \nwhere required, to adopt science-based measures to conserve such stocks during these \ncritical life stages; \n \n256. Expresses concern about the continuing influx of sargassum seaweed into \nthe waters of the Caribbean and its impact on aquatic resources, fisheries, shorelines, \nwaterways and tourism and the general well-being of coastal communities, and \nencourages States and relevant regional organizations to coordinate efforts to better \nunderstand the causes and impacts of the influx, and to eliminate extraordinary \namounts of sargassum washed up along the coastline using environmentally sound \ntechniques, as well as to work on joint solutions to maintain and protect the \nlivelihoods of fishers and fishing communities and find ways of beneficially utilizing \nthe seaweed and environmentally friendly ways of disposing of sargassum washed up \non shore; \n \n257. Recognizes the wide range of impacts of ocean acidification on marine \necosystems, and calls upon States to tackle the causes of ocean acidification and to \nfurther study its impacts; \n \n258. Emphasizes the importance of developing adaptive marine resource \nmanagement strategies and enhancing capacity-building to implement such strategies \nin order to enhance the resilience of marine ecosystems to minimize the wide range \nof impacts on marine organisms and threats to food security caused by ocean \nacidification, in particular the impacts on the ability of calciferous plankton, coral \nreefs, shellfish and crustaceans to build shells and skeletal structures and the threats \nthat this could pose to protein supply; \n \nXI \nCapacity-building \n \n259. Reiterates the crucial importance of cooperation by States directly or, as \nappropriate, through the relevant subregional and regional organizations, and by other \ninternational organizations, including the Food and Agriculture Organization of the \nUnited Nations through its FishCode programme, including through financial and/or \ntechnical assistance, in accordance with the Agreement, the Compliance Agreement, \nthe Code and its associated international plans of action, to increase the capacity of \ndeveloping States to achieve the goals and implement the actions called for in the \npresent resolution; \n \n260. Welcomes the ongoing work of the Food and Agriculture Organization of \nthe United Nations in developing guidance on, and assisting in the implementation \nof, the strategies and measures required for the creation of an enabling environment \nfor sustainable small-scale fisheries, and encourages studies for creating possible \nalternative livelihoods for coastal communities; \n \n261. Recalls that, in \u201cThe future we want\u201d, States recognized the importance of \nbuilding the capacity of developing countries to be able to benefit from the \nconservation and sustainable use of the oceans and seas and their resources, and in \nthis regard emphasized the need for cooperation in marine scientific research to \nimplement the provisions of the Convention and the outcomes of the major summits \non sustainable development, as well as for the transfer of technology, taking into \naccount the Intergovernmental Oceanographic Commission Criteria and Guidelines \non the Transfer of Marine Technology; \n\nSustainable fisheries, including through the 1995 Agreement for the Implementation \nof the Provisions of the United Nations Convention on the Law of the Sea of \n10 December 1982 relating to the Conservation and Management of Straddling \nFish Stocks and Highly Migratory Fish Stocks, and related instruments \nA/RES/79/145\n \n47/50\n24-23839 \n \n \n262. Also recalls that, in \u201cThe future we want\u201d, States urged the identification \nand mainstreaming by 2014 of strategies that further assist developing countries, in \nparticular the least developed countries and small island developing States, in \ndeveloping their national capacity to conserve, sustainably manage and realize the \nbenefits of sustainable fisheries, including through improved market access for fish \nproducts from developing countries; \n \n263. Encourages increased capacity-building and technical assistance by \nStates, \ninternational \nfinancial \ninstitutions \nand \nrelevant \nintergovernmental \norganizations and bodies for fishers, in particular small-scale and artisanal fishers, in \ndeveloping countries, and in particular small island developing States, consistent with \nenvironmental sustainability, in recognition of the fact that food security and \nlivelihoods may depend on fisheries; \n \n264. Encourages States to strengthen international cooperation to assist \ndeveloping countries in developing and implementing new sustainable aquaculture \ndevelopment strategies, which contributes to ensuring food security, nutrition, \nlivelihoods, adaptation to climate change and the promotion of poverty reduction and \neradication; \n \n265. Also encourages States to cooperate closely, directly or through the United \nNations system, including the Food and Agriculture Organization of the United \nNations, with a view to enhancing the capacity-building of developing States, \nincluding coastal States, in particular small island developing States, in the field of \nfisheries and aquaculture through education and training; \n \n266. Recognizes, in this regard, the work of the United Nations University \nFisheries Training Programme in Iceland and its contribution to training for \ndeveloping States, in particular small island developing States, and emphasizes the \nneed for the continuation and strengthening of this training for developing States; \n \n267. Acknowledges the continuous efforts of the Food and Agriculture \nOrganization of the United Nations to provide learning opportunities through free \ne\u2011learning courses on a variety of topics, including: port State measures to combat \nillegal, unreported and unregulated fishing; climate change adaptation and mitigation \nin fisheries and aquaculture; food loss and waste in fish value chains; the fisheries \nperformance assessment toolkit; securing sustainable small-scale fisheries; and the \necosystem approach to fisheries, with the overall goal of strengthening the capacity \nof countries to implement the 2030 Agenda for Sustainable Development; \n \n268. Notes that the Committee on Fisheries, at its thirty-sixth session, \nrecognized the importance of the Blue Ports Initiative of the Food and Agriculture \nOrganization of the United Nations in fostering regional cooperation between \nassociated fishing ports, as well as its invitation to the Food and Agriculture \nOrganization of the United Nations and its members to strengthen this cooperation; \n \n269. Encourages the international community to enhance the opportunities for \nsustainable development in developing countries, in particular the least developed \ncountries, small island developing States and coastal African States, by encouraging \ngreater participation of those States in authorized fisheries activities being undertaken \nwithin areas under their national jurisdiction, in accordance with the Convention, by \ndistant-water fishing nations in order to achieve better economic returns for \ndeveloping countries from their fisheries resources within areas under their national \njurisdiction and an enhanced role in regional fisheries management, as well as by \nenhancing the ability of developing countries to develop their own fisheries, as well \nas to participate in high seas fisheries, including access to such fisheries, in \nconformity with international law, in particular the Convention and the Agreement, \nand taking into account article 5 of the Code; \n\nA/RES/79/145 \nSustainable fisheries, including through the 1995 Agreement for the Implementation \nof the Provisions of the United Nations Convention on the Law of the Sea of \n10 December 1982 relating to the Conservation and Management of Straddling \nFish Stocks and Highly Migratory Fish Stocks, and related instruments \n \n24-23839\n48/50 \n \n \n270. Welcomes, in accordance with the decisions taken by the parties to the \nAgreement on Port State Measures to Prevent, Deter and Eliminate Illegal, \nUnreported and Unregulated Fishing at their meetings, the establishment by the Food \nand Agriculture Organization of the United Nations of a trust fund under Part 6 of that \nAgreement to assist developing States parties, in particular the least developed among \nthem and small island developing States parties, in the implementation of that \nAgreement, and the reiterated call by the parties to make the multilateral-partner Port \nState Measures Agreement Part 6 trust fund administered by the Food and Agriculture \nOrganization of the United Nations operational, and invites States, intergovernmental \norganizations, international financial institutions, regional economic integration \norganizations, national institutions, non\u2011governmental organizations, foundations as \nwell as natural and juridical persons to consider making voluntary financial \ncontributions to the fund;  \n \n271. Requests distant-water fishing nations, when negotiating access \nagreements and arrangements with developing coastal States, to do so on an equitable \nand sustainable basis and to take into account their legitimate expectation to fully \nbenefit from the sustainable use of the natural resources of their exclusive economic \nzones, to ensure that vessels flying their flag comply with the laws and regulations of \nthe developing coastal States adopted in accordance with international law and to give \ngreater attention to fish processing and fish-processing facilities within the national \njurisdiction of the developing coastal State to assist in the realization of the benefits \nfrom the development of fisheries resources and also to the transfer of technology and \nassistance for monitoring, control and surveillance and compliance and enforcement \nwithin areas under the national jurisdiction of the developing coastal State providing \nfisheries access, taking into account the forms of cooperation set out in article 25 of \nthe Agreement and article 5 of the Code; \n \n272. Encourages, in this regard, greater transparency regarding fisheries access \nagreements, including by making them publicly available, subject to confidentiality \nrequirements; \n \n273. Encourages \nStates, \nindividually \nand \nthrough \nregional \nfisheries \nmanagement organizations and arrangements, to provide greater assistance and to \npromote coherence in such assistance for developing States in designing, establishing \nand implementing relevant agreements, instruments and tools for the conservation and \nsustainable management of fish stocks, including in designing and strengthening their \ndomestic regulatory fisheries policies and those of regional fisheries management \norganizations or arrangements in their regions, and the enhancement of research and \nscientific capabilities through existing funds, such as the Assistance Fund under Part \nVII of the Agreement, bilateral assistance, regional fisheries management \norganizations and arrangements assistance funds, the FishCode programme, the World \nBank\u2019s global programme on fisheries and the Global Environment Facility; \n \n274. Calls upon States to promote, through continuing dialogue and the \nassistance and cooperation provided in accordance with articles 24 to 26 of the \nAgreement, further ratifications of or accessions to the Agreement by seeking to \naddress, inter alia, the issue of lack of capacity and resources that might stand in the \nway of developing States becoming parties; \n \n275. Encourages States, regional fisheries management organizations and \narrangements and other relevant bodies to assist developing States in the \nimplementation of the actions called for in paragraphs 80 and 83 to 87 of resolution \n61/105, paragraphs 113, 117 and 119 to 124 of resolution 64/72, paragraphs 121, 126, \n129, 130 and 132 to 134 of resolution 66/68; paragraphs 156, 171, 175 and 177 to 188 \nof resolution 71/123 and paragraphs 181, 203 to 207, 209, 210, 213, 215 to 222 and \n257 of resolution 77/118; \n\nSustainable fisheries, including through the 1995 Agreement for the Implementation \nof the Provisions of the United Nations Convention on the Law of the Sea of \n10 December 1982 relating to the Conservation and Management of Straddling \nFish Stocks and Highly Migratory Fish Stocks, and related instruments \nA/RES/79/145\n \n49/50\n24-23839 \n \n \n276. Urges States and regional economic integration organizations, individually \nand through regional fisheries management organizations and arrangements, to \nmainstream efforts to assist developing States, in particular the least developed \ncountries and small island developing States, with other relevant international \ndevelopment strategies with a view to enhancing international coordination to enable \nthem to develop their national capacity to exploit fishery resources, consistent with \nthe duty to ensure the conservation and management of those resources, and in this \nregard requests the Secretary-General to fully mobilize and coordinate the agencies, \nfunds and programmes of the United Nations system, including at the level of the \nregional economic commissions, within their respective mandates; \n \n277. Requests States and regional fisheries management organizations to \ndevelop strategies to further assist developing States, in particular the least developed \ncountries and small island developing States, in fully realizing the benefits from the \ncatch of straddling fish stocks and highly migratory fish stocks and in strengthening \nregional efforts to sustainably conserve and manage such stocks and, in this regard, \nto make available such information; \n \nXII \nCooperation within the United Nations system \n \n278. Requests the relevant parts of the United Nations system, international \nfinancial institutions and donor agencies to support increased enforcement and \ncompliance capabilities for regional fisheries management organizations and their \nmember States; \n \n279. Invites the Food and Agriculture Organization of the United Nations to \ncontinue its cooperative arrangements with United Nations agencies on the \nimplementation of the international plans of action; \n \nXIII \nActivities of the Division for Ocean Affairs and the Law of the Sea \n \n280. Expresses its appreciation to the Secretary-General for the activities of the \nDivision, which reflect the high standard of assistance provided to Member States by \nthe Division; \n \n281. Requests the Secretary-General to continue to carry out the responsibilities \nand functions entrusted to him by the Convention, the Agreement and the related \nresolutions of the General Assembly and to ensure the allocation of appropriate \nresources to the Division for the performance of its activities under the approved \nbudget for the Organization; \n \nXIV \nEightieth session of the General Assembly \n \n282. Requests the Secretary-General to bring the present resolution to the \nattention of all States, relevant intergovernmental organizations, the organizations and \nbodies of the United Nations system, subregional and regional fisheries management \norganizations and relevant non\u2011governmental organizations; \n \n283. Notes the desire to further improve the efficiency of and the effective \nparticipation of delegations in the informal consultations concerning the annual \nGeneral Assembly resolution on sustainable fisheries, decides that the informal \nconsultations on this resolution will be held in a single round of consultations in \nNovember for a period of six days, requests the Secretary-General to provide support \nto the consultations through the Division, and invites States to submit proposals for \n\nA/RES/79/145 \nSustainable fisheries, including through the 1995 Agreement for the Implementation \nof the Provisions of the United Nations Convention on the Law of the Sea of \n10 December 1982 relating to the Conservation and Management of Straddling \nFish Stocks and Highly Migratory Fish Stocks, and related instruments \n \n24-23839\n50/50 \n \ninclusion in the text of the resolution to the Coordinator of the informal consultations \nno later than five weeks before the start of the consultations; \n \n284. Decides to include in the provisional agenda of its eightieth session, under \nthe item entitled \u201cOceans and the law of the sea\u201d, the sub-item entitled \u201cSustainable \nfisheries, including through the 1995 Agreement for the Implementation of the \nProvisions of the United Nations Convention on the Law of the Sea of 10 December \n1982 relating to the Conservation and Management of Straddling Fish Stocks and \nHighly Migratory Fish Stocks, and related instruments\u201d, and to consider the \npossibility of including this sub-item in future provisional agendas on a biennial basis. \n \n52nd plenary meeting \n12 December 2024 \n \n",
  "paragraphs": {
    "1": "Reaffirms the importance that it attaches to the long-term conservation, management and sustainable use of the living marine resources of the world\u2019s oceans and seas and the obligations of States to cooperate to this end, in accordance with international law, as reflected in the relevant provisions of the Convention, in particular the provisions on cooperation set out in Part V and Part VII, section 2, of the Convention, and where applicable, the Agreement;",
    "2": "Calls upon all States that have not done so, in order to achieve the goal of universal participation, to become parties to the Convention, which sets out the legal framework within which all activities in the oceans and seas must be carried out, taking into account the relationship between the Convention and the Agreement;",
    "3": "Notes with satisfaction that, in \u201cThe future we want\u201d,20 States addressed the sustainable development of fisheries, recognized the significant contribution of fisheries to the three dimensions of sustainable development and stressed the crucial role of healthy marine ecosystems, sustainable fisheries and sustainable aquaculture for food security and nutrition and in providing for the livelihoods of millions of people, and encourages States to implement the commitments made in \u201cThe future we want\u201d;",
    "4": "Calls upon States to implement the Sustainable Development Goals outlined in the outcome document of the United Nations summit for the adoption of the post-2015 development agenda, entitled \u201cTransforming our world: the 2030 Agenda for Sustainable Development\u201d, as adopted by the General Assembly in its resolution 70/1, including Goal 14 to conserve and sustainably use the oceans, seas and marine resources for sustainable development, recalling that some of its targets were to be met by 2020 and that the Goals and targets are integrated and indivisible;",
    "5": "Reiterates, in this regard, the calls for action to be taken on an urgent basis to conserve and sustainably use the oceans, seas and marine resources for sustainable development made in the declarations entitled \u201cOur ocean, our future: call for action\u201d21 and \u201cOur ocean, our future, our responsibility\u201d;22",
    "6": "Encourages States to give due priority to the implementation of the Plan of Implementation of the World Summit on Sustainable Development (Johannesburg Plan of Implementation)23 in relation to achieving sustainable fisheries, especially restoring depleted stocks to levels that can produce maximum sustainable yield on an urgent basis and, where possible, not later than 2015, and recalls that, in \u201cThe future we want\u201d, States committed themselves to intensify their efforts to meet that target and to urgently take the measures necessary to maintain or restore all stocks at least to levels that can produce the maximum sustainable yield, with the aim of achieving those goals in the shortest time feasible, as determined by their biological characteristics, and in order to achieve this, to urgently develop and implement science-based management plans, including by reducing or suspending fishing catch and fishing effort commensurate with the status of the stock, consistent with international law, the applicable international instruments and relevant General Assembly resolutions and guidelines of the Food and Agriculture Organization of the United Nations;",
    "7": "Welcomes the technical expertise of the Food and Agriculture Organization of the United Nations on fisheries and aquaculture, and notes in this regard its publications;",
    "8": "Encourages States to promote the consumption of fish sourced from sustainably managed fisheries and sustainable aquaculture to support environmental, social and economic goals;",
    "9": "Also encourages States to consider sustainable aquaculture, including sustainable algae aquaculture, consistent with the Code and the Guidelines for Sustainable Aquaculture, as a means to promote diversification of the food supply and of income, while ensuring that aquaculture is conducted responsibly and adverse impacts on the environment are minimized;",
    "10": "Reaffirms its resolution 78/317 of 16 July 2024, by which it adopted the Antigua and Barbuda Agenda for Small Island Developing States: A Renewed Declaration for Resilient Prosperity, in which small island developing States sought the support of the international community to conserve and sustainably use the ocean and its resources;",
    "11": "Recalls its resolution 77/321 of 1 August 2023 on the Agreement under the United Nations Convention on the Law of the Sea on the Conservation and Sustainable Use of Marine Biological Diversity of Areas beyond National Jurisdiction, and invites States and regional economic integration organizations to consider its implications for sustainable fisheries;",
    "12": "Expresses its serious concern regarding the impacts of global climate change and ocean acidification on coral reefs and other ecosystems relevant to fisheries, and urges States, either directly or through appropriate subregional, regional or global organizations or arrangements, to intensify efforts to assess and address, as appropriate, the impacts of global climate change and ocean acidification on the sustainability of fish stocks and the habitats that support them, in particular the most affected ones;",
    "13": "Notes, in this regard, the special report on the ocean and cryosphere in a changing climate of the Intergovernmental Panel on Climate Change, and notes with concern the findings contained therein;",
    "14": "Invites States to continue capacity-building efforts and to promote international coordination on scientific research focused on monitoring the impacts of climate phenomena with impacts on fisheries, such as the El Ni\u00f1o/Southern Oscillation (El Ni\u00f1o/La Ni\u00f1a), especially on small-scale and artisanal fisheries and aquaculture;",
    "15": "Notes that the Committee on Fisheries, at its thirty-sixth session, commended the work carried out by the Food and Agriculture Organization of the United Nations in assessing, projecting and responding to the impacts of climate change on aquatic food systems, and the development of a set of actions on climate- resilient fisheries and aquaculture of the Food and Agriculture Organization of the United Nations,24 in support of the Strategy on Climate Change for 2022\u20132031 of that Organization and aligned with its Blue Transformation road map, and called upon the Food and Agriculture Organization of the United Nations to mobilize additional resources to scale up climate change adaptation and mitigation solutions;",
    "16": "Also notes that the Committee on Fisheries, at its thirty-sixth session, welcomed the progressive discussions on aquatic foods under the United Nations Framework Convention on Climate Change,25 and requested the Food and Agriculture Organization of the United Nations to continue engaging with the Ocean and Climate Change Dialogue under that Convention and other relevant global forums, while encouraging its members to include consideration of aquatic foods into their nationally determined contributions and national adaptation plans with support from the Food and Agriculture Organization of the United Nations;",
    "17": "Emphasizes the obligations of flag States to discharge their responsibilities, in accordance with the Convention, the Agreement and the Compliance Agreement, to ensure compliance by vessels flying their flag with the conservation and management measures adopted and in force with respect to fisheries resources on the high seas;",
    "18": "Calls upon States and regional fisheries management organizations and arrangements, as appropriate, to act urgently to assess the risks and potential adverse impacts of climate change with respect to fish stocks, consider them when establishing conservation and management measures and identifying options to reduce risks and adverse impacts with respect to fisheries management and the health and resilience of marine ecosystems and enhance efforts to cooperate to collect, exchange and publish scientific and technical data and best practices related to the development and implementation of adaptation strategies, and to assist developing States in this regard, especially those that are particularly vulnerable to the adverse impacts of climate change;",
    "19": "Urges States and relevant organizations and arrangements to assess and consider the impacts of climate change on fisheries and aquaculture sectors in their policies and planning, as appropriate, without delay in order to identify and implement effective adaptation strategies to reduce the vulnerability of these sectors to climate change;",
    "20": "Notes, in this regard, that the Committee on Fisheries, at its thirty-sixth session, acknowledged the role of regional fishery bodies in addressing climate change impacts on fisheries and ecosystems, encouraged its members to advance efforts to fully consider climate change in regional fishery body conservation and management measures, appreciated the engagement of the Food and Agriculture Organization of the United Nations with such bodies on these issues, and encouraged the Food and Agriculture Organization of the United Nations to facilitate information exchange and enhance regional cooperation and coordination with and among regional fishery bodies;",
    "21": "Welcomes the convening of the sixteenth meeting of the Conference of the Parties to the Convention on Biological Diversity, takes note of its adopted decisions, encourages the Parties to fully and effectively implement the Convention and its Protocols, as well as the Kunming-Montreal Global Biodiversity Framework and its targets relevant to fisheries and aquaculture, and recognizes the role of effectively managed sustainable fisheries in achieving their objectives;",
    "22": "Calls upon all States, directly or through regional fisheries management organizations and arrangements, to apply widely, in accordance with international law and the Code, the precautionary approach and ecosystem approaches to the conservation, management and exploitation of fish stocks, and also calls upon States parties to the Agreement to implement fully the provisions of article 6 of the Agreement as a matter of priority;",
    "23": "Urges States to increase their reliance on scientific advice in developing, adopting and implementing conservation and management measures, and to increase their efforts, including through international cooperation, to promote science for conservation and management measures that apply, in accordance with international law, the precautionary approach and ecosystem approaches to fisheries management, enhancing understanding of ecosystem approaches, in order to ensure the long-term conservation and sustainable use of living marine resources, and in this regard encourages the implementation of the Strategy for Improving Information on Status and Trends of Capture Fisheries of the Food and Agriculture Organization of the United Nations as a framework for the improvement and understanding of fishery status and trends;",
    "24": " populations of harvested stocks and, where necessary, associated or dependent species are maintained at or restored to sustainable levels, and to use these reference points for triggering conservation and management action;",
    "25": "Encourages States, directly or through regional fisheries management organizations and arrangements, to establish and implement rebuilding and recovery strategies and plans where a stock is identified as being overfished, which should include time frames and probabilities of recovery aimed at bringing the stock back at least to levels that can produce the maximum sustainable yield, and guided by scientific assessment and subjected to a periodic evaluation of progress;",
    "26": "Also encourages States to apply the precautionary approach and ecosystem approaches in adopting and implementing conservation and management measures addressing, inter alia, by-catch, pollution and overfishing, and protecting habitats of specific concern, taking into account existing guidelines developed by the Food and Agriculture Organization of the United Nations;",
    "27": "Further encourages States to enhance or develop observer programmes, individually or through regional fisheries management organizations or arrangements, in order to improve data collection on, inter alia, target and by-catch species, which could also assist monitoring, control and surveillance tools, and to take into account standards, forms of cooperation and other existing structures for such programmes as described in article 25 of the Agreement and article 5 of the Code;",
    "28": "Calls upon, in this regard, States, individually in line with their national legislation or through regional fisheries management organizations or arrangements, to take steps as appropriate to ensure the safety of observers;",
    "29": "Encourages States to implement, individually and through regional fisheries management organizations and arrangements, accurate, complete, reliable and effective data collection and reporting of required data on catches, including by\u2011catch and discards, and to review, validate and provide such data in support of scientific stock assessment and ecosystem approaches to fisheries management, as well as monitoring and compliance activities, while noting the importance, particularly for developing countries, of improving the capacity to collect and report accurate, complete, reliable and effective data;",
    "30": "Encourages, in this regard, regional fisheries management organizations and arrangements and States to implement electronic systems for the collection and exchange of fisheries data needed for sustainable fisheries management and for detecting and combating illegal, unreported and unregulated fishing, while acknowledging the importance of data harmonization, as appropriate;",
    "31": "Calls upon States and regional fisheries management organizations and arrangements to collect and, where appropriate, report to the Food and Agriculture Organization of the United Nations required catch and effort data, and fishery-related information, in a complete, accurate and timely way, including for straddling fish stocks and highly migratory fish stocks within and beyond areas under national jurisdiction, discrete high seas fish stocks, and by-catch and discards; and, where they do not exist, to establish processes to strengthen data collection, including through innovative technologies, and reporting by members of regional fisheries management organizations and arrangements, including through regular reviews of member compliance with such obligations, and, when such obligations are not met, require the member concerned to rectify the problem, including through the preparation of plans of action with timelines;",
    "32": " facilitate expert work to fill relevant data gaps and share expertise on stock assessment methodologies, and therefore affirms the importance of the Food and Agriculture Organization of the United Nations and its members working cooperatively to address these issues;",
    "33": "Invites States and regional fisheries management organizations and arrangements to cooperate with the Food and Agriculture Organization of the United Nations in the implementation and further development of the Fisheries Resources Monitoring System initiative;",
    "34": "Reaffirms paragraph 10 of its resolution 61/105 of 8 December 2006, and calls upon States, including through regional fisheries management organizations or arrangements, to urgently adopt and implement measures to fully implement the International Plan of Action for the Conservation and Management of Sharks for directed and non\u2011directed shark fisheries, based on the best available scientific information, through, inter alia, limits on catch or fishing effort, by requiring that vessels flying their flag collect and regularly report data on shark catches, including species-specific data, discards and landings, undertaking, including through international cooperation, comprehensive stock assessments of sharks, reducing shark by-catch and by-catch mortality and, where scientific information is uncertain or inadequate, not increasing fishing effort in directed shark fisheries and urgently establishing science-based management measures to ensure the long-term conservation, management and sustainable use of shark stocks and to prevent further declines of vulnerable or threatened shark stocks, and encourages the full utilization of dead sharks caught in the context of sustainably managed fisheries;",
    "35": "Calls upon States to take immediate and concerted action to improve the implementation of and compliance with existing regional fisheries management organizations or arrangements and national measures that regulate shark fisheries and incidental catch of sharks, in particular those measures which prohibit or restrict fisheries conducted solely for the purpose of harvesting shark fins and, where necessary, to consider taking other measures, as appropriate, such as requiring that all sharks be landed with each fin naturally attached;",
    "36": "Calls upon regional fisheries management organizations with the competence to regulate highly migratory species to strengthen or establish precautionary, science-based conservation and management measures, as appropriate, for sharks taken in fisheries within their convention areas consistent with the International Plan of Action for the Conservation and Management of Sharks;",
    "37": "Encourages range States and regional economic integration organizations that have not yet done so to become signatories to and implement the Memorandum of Understanding on the Conservation of Migratory Sharks under the Convention on the Conservation of Migratory Species of Wild Animals, and invites non\u2011range States, intergovernmental organizations and international and national non\u2011governmental organizations or other relevant bodies and entities to consider becoming cooperating partners;",
    "38": "Encourages States, as appropriate, to cooperate in establishing non\u2011detriment findings for shared stocks of marine species listed in appendices I and II to the Convention on International Trade in Endangered Species of Wild Fauna and Flora, consistent with the concepts and non\u2011binding guiding principles contained in resolution Conf. 16.7 on non\u2011detriment findings, adopted by the Conference of the Parties to the Convention on International Trade in Endangered Species of Wild Fauna and Flora;",
    "39": " on International Trade in Endangered Species of Wild Fauna and Flora in raising awareness and building capacity on the implementation of that Convention in the fisheries sector, as a growing number of commercially exploited aquatic species are being included in appendix II to that Convention;",
    "40": "Recalls the fundamental role of sound scientific advice as the basis for decisions on fisheries management, and notes the ongoing collaboration of regional fisheries management organizations and arrangements with the secretariat of the Convention on International Trade in Endangered Species of Wild Fauna and Flora to provide the best scientific data and information;",
    "41": "Urges States to eliminate barriers to trade in fish and fisheries products which are not consistent with their rights and obligations under the World Trade Organization agreements, taking into account the importance of the trade in fish and fisheries products, particularly for developing countries;",
    "42": "Recalls that, in \u201cThe future we want\u201d, States committed themselves to observing the need to ensure access to fisheries and the importance of access to markets by subsistence, small-scale and artisanal fisherfolk and women fish workers, as well as Indigenous Peoples and their communities, particularly in developing countries, especially small island developing States;",
    "43": "Notes that the Committee on Fisheries encouraged the Food and Agriculture Organization of the United Nations to provide capacity-development and technical support to small-scale fisheries, including by addressing socioeconomics, gender dimensions, and post-harvest and data-collection challenges in the sector;",
    "44": "Urges States and relevant international and national organizations to provide for the participation of small-scale fishery stakeholders in related policy development and fisheries management strategies in order to achieve long-term sustainability for such fisheries, consistent with the duty to ensure the proper conservation and management of fisheries resources, and encourages States to consider promoting, as appropriate, participatory management schemes for small- scale fisheries in accordance with national laws, regulations and practices, as well as the Voluntary Guidelines for Securing Sustainable Small-scale Fisheries in the Context of Food Security and Poverty Eradication of the Food and Agriculture Organization of the United Nations;",
    "45": "Encourages States to implement actions to highlight the role of and support small-scale and artisanal fisheries and aquaculture;",
    "46": "Welcomes action taken by the Food and Agriculture Organization of the United Nations and a number of regional organizations to support the implementation of the Voluntary Guidelines for Securing Sustainable Small-scale Fisheries in the Context of Food Security and Poverty Eradication through, as appropriate, national and regional plans of action, including on small-scale fisheries, dedicated working groups and other initiatives;",
    "47": "Encourages the Food and Agriculture Organization of the United Nations to continue promoting dialogue on small-scale and artisanal fisheries and aquaculture, and to consider including these issues as a standing agenda item of the Committee on Fisheries and its subcommittees, as relevant;",
    "48": "",
    "49": "Welcomes, in this regard, the initiation of further studies by the Food and Agriculture Organization of the United Nations of the impact of industrial fishing activities on species corresponding to low trophic levels;",
    "50": "Invites the Food and Agriculture Organization of the United Nations to assess and consider the potential risk and effects of genetically engineered fish species on the health and sustainability of wild fish stocks and on the biodiversity of the aquatic environment and to provide guidance, consistent with the Code, on managing risk and minimizing harmful impacts in this regard;",
    "51": "Also invites the Food and Agriculture Organization of the United Nations, in consultation with other relevant international organizations, including the International Maritime Organization, to promote awareness and cooperation to develop and strengthen capacity to prevent, minimize and mitigate the adverse impacts of invasive alien species on biodiversity, including fish stocks;",
    "52": "Calls upon States to consider the potential environmental and socioeconomic impacts of anthropogenic underwater noise from different activities in the marine environment and to address and mitigate such impacts, taking into account the best available scientific information, the precautionary approach and ecosystem approaches, as appropriate; II Implementation of the 1995 Agreement for the Implementation of the Provisions of the United Nations Convention on the Law of the Sea of 10 December 1982 relating to the Conservation and Management of Straddling Fish Stocks and Highly Migratory Fish Stocks",
    "53": "Welcomes the most recent accession to the Agreement, and calls upon all States, and entities referred to in the Convention and in article 1, paragraph 2 (b), of the Agreement, that have not done so to ratify or accede to the Agreement and in the interim to consider applying it provisionally;",
    "54": "Calls upon States parties to the Agreement to effectively implement, as a matter of priority, the provisions of the Agreement through their national legislation and through regional fisheries management organizations and arrangements in which they participate;",
    "55": "Emphasizes the importance of those provisions of the Agreement relating to bilateral, subregional and regional cooperation in enforcement, and urges continued efforts in this regard;",
    "56": "Urges States parties to the Agreement, in accordance with article 21, paragraph 4, thereof, to inform, either directly or through the relevant subregional or regional fisheries management organization or arrangement, all States whose vessels fish on the high seas in the same subregion or region of the form of identification issued by those States parties to officials duly authorized to carry out boarding and inspection functions in accordance with articles 21 and 22 of the Agreement;",
    "57": "Also urges States parties to the Agreement, in accordance with article 21, paragraph 4, thereof, to designate an appropriate authority to receive notifications pursuant to article 21 and to give due publicity to such designation through the relevant subregional or regional fisheries management organization or arrangement;",
    "58": "",
    "59": "Notes that, in the agreed outcome of the resumed Review Conference on the Agreement, in May 2023, the Conference recommended the development, through regional fisheries management organizations and arrangements, of high seas boarding and inspection measures where they do not currently exist, effective implementation of such measures where they already exist, and review of the implementation of existing measures, in accordance with articles 21 and 22 of the Agreement;",
    "60": "Calls upon States, individually and, as appropriate, through subregional and regional fisheries management organizations and arrangements with competence over discrete high seas fish stocks, to adopt the measures necessary to ensure the long- term conservation, management and sustainable use of such stocks in accordance with the Convention and consistent with the Code and the general principles set forth in the Agreement;",
    "61": "Invites States to assist developing States in enhancing their participation in regional fisheries management organizations or arrangements, including by facilitating access to fisheries for straddling fish stocks and highly migratory fish stocks, in accordance with article 25, paragraph 1 (b), of the Agreement, taking into account the need to ensure that such access benefits the developing States concerned and their nationals;",
    "62": "Urges States parties to the Agreement, directly or through regional fisheries management organizations and arrangements, to take into account the special requirements of developing States, including small island developing States as highlighted in the SIDS Accelerated Modalities of Action (SAMOA) Pathway, in giving effect to the duty to cooperate in the establishment of conservation and management measures for straddling fish stocks and highly migratory fish stocks, including the need to ensure, where appropriate, in accordance with article 24, paragraph 2 (c), of the Agreement, that such measures do not transfer a disproportionate burden of conservation action onto developing States, and notes in this regard ongoing efforts to better develop a common understanding of this concept;",
    "63": "Calls upon States and international financial institutions and organizations of the United Nations system to provide assistance according to Part VII of the Agreement, including, if appropriate, the development of special financial mechanisms or instruments to assist developing States, in particular the least developed among them and small island developing States, to enable them to develop their national capacity to exploit fisheries resources, including developing their domestically flagged fishing fleet, value-added processing and the expansion of their economic base in the fishing industry, consistent with the duty to ensure the proper conservation and management of fisheries resources;",
    "64": "Notes with appreciation, in this regard, the activities undertaken by the Division for Ocean Affairs and the Law of the Sea of the Office of Legal Affairs of the Secretariat (the Division) to implement the ongoing United Nations Fish Stocks Agreement project of assistance, a three-year capacity-building programme funded through the Assistance Fund established under Part VII of the Agreement, managed by the Food and Agriculture Organization of the United Nations, in cooperation with the Division;",
    "65": "",
    "66": "Encourages the Food and Agriculture Organization of the United Nations and the Division to continue their efforts to encourage further contributions to the Assistance Fund and, when appropriate, publicize the availability of assistance through the Assistance Fund;",
    "67": "Encourages accelerated progress by States, individually and, as appropriate, through subregional and regional fisheries management organizations and arrangements, regarding the recommendations of the Review Conference on the Agreement, held in New York from 22 to 26 May 2006,26 and the identification of emerging priorities;",
    "68": "Encourages States, individually and, as appropriate, through subregional and regional fisheries management organizations and arrangements, to consider implementing, as appropriate, the recommendations of the resumed Review Conference held in New York from 24 to 28 May 2010,27 from 23 to 27 May 201628 and from 22 to 26 May 2023;29",
    "69": "Acknowledges, in particular, the commitments made at the resumed Review Conference held in 2016 to the continued implementation of the Agreement through the application of the precautionary approach and ecosystem approaches to fisheries management, the urgent improvement of the status of straddling fish stocks and highly migratory fish stocks, strengthened interaction of the science-policy interface and the strong emphasis on collaboration, at all levels, for improved global fisheries outcomes;",
    "70": "Recalls that the resumed Review Conference agreed to continue the informal consultations of States parties to the Agreement and keep the Agreement under review through the resumption of the Review Conference at a date not earlier than 2028;",
    "71": "Also recalls paragraph 6 of resolution 56/13 of 28 November 2001 and the recommendation of the resumed Review Conference in 2016 that the informal consultations of States parties to the Agreement be dedicated, on an annual basis, to the consideration of specific issues arising from the implementation of the Agreement, with a view to improving understanding, sharing experiences and identifying best practices for the consideration of States parties, as well as the General Assembly and the Review Conference;",
    "72": "Takes note of the report of the seventeenth round of informal consultations of States parties to the Agreement, 30 which focused its discussions on the topic \u201cSustainable fisheries management in the face of climate change\u201d;",
    "73": "Recalls its request, in paragraph 76 of resolution 78/68, for the Secretary- General to convene the eighteenth round of informal consultations of States parties to the Agreement for three days in 2025, and decides that the eighteenth round should focus its discussions on the topic \u201cThe thirtieth anniversary of the 1995 United Nations Fish Stocks Agreement: looking to the future\u201d;",
    "74": "Encourages greater participation, including by competent international organizations, at the forthcoming eighteenth round of informal consultations of States parties to the Agreement;",
    "75": "Requests the Secretary-General to invite States parties to the Agreement and, as observers, States and entities referred to in the Convention and in article 1, paragraph 2 (b), of the Agreement not parties to the Agreement, the Food and Agriculture Organization of the United Nations and other relevant organizations, bodies, funds and programmes within the United Nations system, the secretariats of relevant organizations and conventions and other relevant intergovernmental organizations and bodies, in particular subregional and regional fisheries management organizations and arrangements and related regional intergovernmental marine science organizations, and relevant non\u2011governmental organizations, in accordance with past practice, to attend the eighteenth round of informal consultations of States parties to the Agreement, while relevant scientific institutions may request an invitation to participate in the consultations as observers;",
    "76": "Invites the chairperson of the informal consultations of States parties to the Agreement to circulate widely, through the Secretariat, an informal summary of the discussions at the eighteenth round;",
    "77": "Requests the Secretary-General to convene the nineteenth round of informal consultations of States parties to the Agreement for three days in 2026;",
    "78": "Reaffirms its request that the Food and Agriculture Organization of the United Nations initiate arrangements with States for the collection and dissemination of data on fishing on the high seas by vessels flying their flag at the subregional and regional levels where no such arrangements exist;",
    "79": "Also reaffirms its request that the Food and Agriculture Organization of the United Nations revise its global fisheries statistics database to provide information on straddling fish stocks, highly migratory fish stocks and discrete high seas fish stocks on the basis of where the catch is taken;",
    "80": "Recalls that the Committee on Fisheries, at its thirty-third session, emphasized, in the context of the 2030 Agenda for Sustainable Development, the need to ensure comparability and consistency of reporting indicators at global, regional and national levels, while minimizing the burden on its members;31",
    "81": "Recognizes that the Review Conference is the competent intergovernmental forum for assessing the effectiveness of the Agreement by reviewing its implementation; III Related fisheries instruments",
    "82": "Emphasizes the importance of the effective implementation of the provisions of the Compliance Agreement, and urges continued efforts in this regard;",
    "83": "Calls upon all States and other entities referred to in article X, paragraph 1, of the Compliance Agreement that have not yet become parties to that Agreement to do so as a matter of priority and, in the interim, to consider applying it provisionally;",
    "84": "Urges States and subregional and regional fisheries management organizations and arrangements to implement and promote the application of the Code within their areas of competence;",
    "85": "Urges States to develop and implement, as a matter of priority, national and, as appropriate, regional plans of action to put into effect the international plans of action of the Food and Agriculture Organization of the United Nations;",
    "86": "Encourages States, in this regard, to maintain their commitment in reporting on their implementation of the Code, reiterates the importance of responding to the web-based questionnaire of the Food and Agriculture Organization of the United Nations for monitoring the implementation of the Code and the international plans of action and strategies, and notes that the information collected could also be relevant to the implementation of related targets of the 2030 Agenda for Sustainable Development;",
    "87": "Recalls the call by the Ministerial Conference on Fishing Vessel Safety and Illegal, Unreported and Unregulated Fishing, held in October 2019 in Torremolinos, Spain, to those States that have not yet become parties to the Cape Town Agreement to consider doing so by the tenth anniversary of its adoption on 11 October 2022;",
    "88": "Encourages, in this regard, States to consider signing, ratifying, accepting, approving or acceding as soon as possible to the Cape Town Agreement of 2012 on the Implementation of the Provisions of the Torremolinos Protocol of 1993 relating to the Torremolinos International Convention for the Safety of Fishing Vessels, 1977;",
    "89": "Notes that the Committee on Fisheries, at its thirty-fifth session, welcomed the capacity-building work on decent working conditions and safety at sea of the Food and Agriculture Organization of the United Nations, with an emphasis on reducing accidents and fatalities among small-scale fishers, fishing vessel safety standards and the promotion of insurance and social protection in fisheries, and requested the Food and Agriculture Organization of the United Nations to increase its support to developing countries on fishing safety matters and to take a leading role in the establishment of a repository for fisher safety data and accident and mortality information; IV Illegal, unreported and unregulated fishing",
    "90": "Emphasizes once again its serious concern that illegal, unreported and unregulated fishing remains one of the greatest threats to fish stocks and marine ecosystems and continues to have serious and major implications for the conservation and management of ocean resources, as well as the food security and the economies of many States, particularly developing States, and renews its call upon States to comply fully with all existing obligations and to combat such fishing and urgently to take all steps necessary to implement the International Plan of Action to Prevent, Deter and Eliminate Illegal, Unreported and Unregulated Fishing;",
    "91": "Notes that the Committee on Fisheries of the Food and Agriculture Organization of the United Nations highlighted the high priority its members place on combating illegal, unreported and unregulated fishing, and encouraged the Food and Agriculture Organization of the United Nations to source additional resources and funding to be allocated towards preventing, deterring and eliminating illegal, unreported and unregulated fishing;",
    "92": " port States, chartering nations and the States of nationality of the beneficial owners and others who support or engage in illegal, unreported and unregulated fishing by identifying vessels engaged in such fishing and by depriving offenders of the benefits accruing from it, as well as by cooperating with developing countries to systematically identify needs and build capacity, including support for monitoring, control, surveillance, compliance and enforcement systems;",
    "93": "Notes with satisfaction the development of an increasing number of national plans of action to prevent, deter and eliminate illegal, unreported and unregulated fishing, and calls upon States to consider developing and then consider reviewing such plans;",
    "94": "Urges flag States to strengthen effective jurisdiction and control over vessels flying their flag, and to exercise due diligence, including by developing or amending national rules and regulations, where needed, in order to ensure that such vessels do not engage in illegal, unreported and unregulated fishing, while reaffirming the importance, under international law, including as reflected in the Convention, of the responsibilities of flag States regarding fishing vessels flying their flag, including with respect to safety at sea and labour conditions on fishing vessels;",
    "95": "Urges States to effectively exercise jurisdiction and control over their nationals, including beneficial owners, and vessels flying their flag, in order to prevent and deter them from engaging in illegal, unreported and unregulated fishing activities or supporting vessels engaging in illegal, unreported and unregulated fishing activities, including those vessels listed by regional fisheries management organizations or arrangements as engaged in those activities, and to facilitate mutual assistance to ensure that such actions can be investigated and proper sanctions imposed;",
    "96": "Notes, in this respect, that the Committee on Fisheries of the Food and Agriculture Organization of the United Nations, at its thirty-sixth session, recognized the importance and challenges of identifying beneficial ownership of fishing vessels and that the Committee and its subcommittees were encouraged to further consider this issue;",
    "97": "Encourages States that have not yet done so to establish penalties for non\u2011compliance by vessels involved in fishing or fishing-related activities and their nationals, as appropriate, in accordance with applicable national law and consistent with international law, that are adequate in severity for effectively securing compliance, deterring further violations and depriving offenders of the benefits from their illegal, unreported and unregulated fishing activities;",
    "98": "Urges States to take effective measures, at the national, subregional, regional and global levels, to deter the activities, including illegal, unreported and unregulated fishing, of any vessel which undermines conservation and management measures that have been adopted by subregional and regional fisheries management organizations and arrangements in accordance with international law;",
    "99": "Recognizes the importance of transparency and the use of technology in fisheries, as part of policies to combat illegal, unreported and unregulated fishing;",
    "100": "",
    "101": "Calls upon States not to permit vessels flying their flag to engage in fishing on the high seas or in areas under the national jurisdiction of other States, unless duly authorized by the authorities of the States concerned and in accordance with the conditions set out in the authorization, and to take specific measures, including deterring the reflagging of vessels by their nationals, in accordance with the relevant provisions of the Convention, the Agreement and the Compliance Agreement, to control fishing operations by vessels flying their flag;",
    "102": "Urges States, individually and collectively through regional fisheries management organizations and arrangements, to develop appropriate processes to assess the performance of States with respect to implementing the obligations regarding fishing vessels flying their flag set out in relevant international instruments;",
    "103": "Reaffirms the need to strengthen, where necessary, the international legal framework for intergovernmental cooperation, in particular at the subregional and regional levels, in the management of fish stocks and in combating illegal, unreported and unregulated fishing, in a manner consistent with international law, and for States and entities referred to in the Convention and in article 1, paragraph 2 (b), of the Agreement to collaborate in efforts to address these types of fishing activities;",
    "104": "Urges regional fisheries management organizations and arrangements to further coordinate measures for combating illegal, unreported and unregulated fishing activities, such as through the development of a common list of vessels identified as engaged in illegal, unreported and unregulated fishing or the mutual recognition of the illegal, unreported and unregulated vessel lists established by each organization or arrangement;",
    "105": "Reaffirms its call upon States to take all necessary measures consistent with international law, without prejudice to a State\u2019s sovereignty over ports in its territory and to reasons of force majeure or distress, including the prohibition of vessels from accessing their ports followed by a report to the flag State concerned, when there is clear evidence that they are or have been engaged in or have supported illegal, unreported and unregulated fishing, or when they refuse to give information either on the origin of the catch or on the authorization under which the catch has been made;",
    "106": "Reaffirms paragraph 53 of its resolution 64/72 of 4 December 2009 with regard to eliminating illegal, unreported and unregulated fishing by vessels flying \u201cflags of convenience\u201d and requiring that a \u201cgenuine link\u201d be established between States and fishing vessels flying their flags, and urges States operating open registry to effectively control all fishing vessels flying their flag, as required by international law, or otherwise stop open registry for fishing vessels;",
    "107": "",
    "108": "Encourages States, either directly or through competent and appropriate subregional, regional or global organizations and arrangements, to consider adopting rules, consistent with international law, to ensure that chartering arrangements and practices related to fishing vessels enable compliance with and enforcement of relevant conservation and management measures, so as not to undermine efforts to combat illegal, unreported and unregulated fishing;",
    "109": "Recognizes the need for enhanced port State measures to combat illegal, unreported and unregulated fishing, and urges States to cooperate, in particular at the regional level and through subregional and regional fisheries management organizations and arrangements, to adopt all necessary port measures, consistent with international law taking into account article 23 of the Agreement, and to further promote the development and application of standards at the regional level;",
    "110": "Welcomes the recent ratifications of and accessions to the Agreement on Port State Measures to Prevent, Deter and Eliminate Illegal, Unreported and Unregulated Fishing, and encourages States and regional economic integration organizations that have not yet done so to consider ratifying, accepting, approving or acceding to that Agreement, noting the importance of major port States and flag States becoming parties at their earliest convenience;",
    "111": "Encourages States that are party to the Agreement on Port State Measures to Prevent, Deter and Eliminate Illegal, Unreported and Unregulated Fishing to fully implement that Agreement and to adopt, through regional fisheries management organizations and arrangements of which they are members, port State measures consistent with that Agreement, noting that that Agreement establishes minimum standards and does not preclude the adoption of more stringent measures, as appropriate, in accordance with international law;",
    "112": "Acknowledges the follow-up by Parties to the Agreement on Port State Measures to Prevent, Deter and Eliminate Illegal, Unreported and Unregulated Fishing of the \u201cBali Strategy\u201d to strengthen the implementation and effectiveness of that Agreement, adopted at the Fourth Meeting of the Parties to that Agreement, and welcomes the operationalization of the Global Information Exchange System as an essential tool for supporting implementation of that Agreement, together with other relevant international instruments;",
    "113": "Notes the ongoing capacity-development programme of the Food and Agriculture Organization of the United Nations aimed at facilitating and supporting the implementation of the Agreement on Port State Measures to Prevent, Deter and Eliminate Illegal, Unreported and Unregulated Fishing and related instruments, which contributes to the development of national capacity of both parties and non\u2011parties, including the strengthening of the legal, institutional, operational and enforcement capacity of developing States with a view to maximizing the benefits of its implementation, and which, as of 1 July 2024, delivered activities in over 50 countries;",
    "114": "",
    "115": "Acknowledges the efforts of the Indian Ocean Rim Association member States in developing a guideline to prevent, deter and eliminate illegal, unreported and unregulated fishing in the Indian Ocean, initiated by Indonesia and France, aiming to achieve sustained growth and balanced development for the livelihood of coastal States in the Indian Ocean region;",
    "116": "Encourages States, with respect to vessels flying their flag, and port States, to make every effort to share data on landings and catch quotas, and in this regard encourages regional fisheries management organizations and arrangements to consider developing open databases containing such data for the purpose of enhancing the effectiveness of fisheries management;",
    "117": "Notes the continued work by the Food and Agriculture Organization of the United Nations on methodologies to estimate the magnitude of illegal, unreported and unregulated fishing and on the use of indicators to evaluate and track performance in combating illegal, unreported and unregulated fishing;",
    "118": "Calls upon States to take all measures necessary to ensure that vessels flying their flag do not engage in the trans-shipment of fish caught by fishing vessels engaged in illegal, unreported and unregulated fishing, through adequate regulation, monitoring and control of trans-shipment of fish at sea, including through additional national measures applicable to vessels flying their flag to prevent such trans\u2011shipment in line with the Voluntary Guidelines for Trans-shipment developed under the auspices of the Food and Agriculture Organization of the United Nations, 32 and in this respect notes the call made by the Committee on Fisheries, at its thirty- sixth session, for the Food and Agriculture Organization of the United Nations to support the work of its members and of regional fisheries management organizations and to monitor progress;",
    "119": "Urges States, individually and through regional fisheries management organizations and arrangements, to adopt and implement internationally agreed market-related measures in accordance with international law, including principles, rights and obligations established in World Trade Organization agreements, as called for in the International Plan of Action to Prevent, Deter and Eliminate Illegal, Unreported and Unregulated Fishing;",
    "120": "Encourages work to increase awareness of the Voluntary Guidelines for Catch Documentation Schemes,33 and encourages States and relevant stakeholders to implement these Guidelines when developing catch documentation schemes and to use them as a reference in related activities, with special attention to the prevention, deterrence and elimination of illegal, unreported and unregulated fishing, and recalls the publication of the technical guidelines entitled Understanding and Implementing Catch Documentation Schemes: A Guide for National Authorities;",
    "121": "Also encourages information-sharing regarding emerging market- and trade-related measures by States and other relevant actors with appropriate international forums, given the potential implications of these measures for all States, consistent with the established plan of work of the Committee on Fisheries, and taking into account the Technical Guidelines for Responsible Fish Trade of the Food and Agriculture Organization of the United Nations;",
    "122": "Acknowledges the development of participatory surveillance activities at sea involving fishing communities in West Africa as a cost-effective way of detecting illegal, unreported and unregulated fishing;",
    "123": "Notes the concern expressed by the Committee on Fisheries at the proliferation of private standards and ecolabelling schemes potentially leading to the creation of trade barriers and restrictions, and also notes the work by the Food and Agriculture Organization of the United Nations to develop an evaluation framework to assess the conformity of public and private ecolabelling schemes through the Guidelines for the Ecolabelling of Fish and Fishery Products from Marine Capture Fisheries;",
    "124": "Also notes the concerns about possible connections between transnational organized crime and illegal fishing in certain regions of the world, and encourages States, including through the appropriate international forums and organizations, to study the causes and methods of and contributing factors to illegal fishing to increase knowledge and understanding of those possible connections, and to make the findings publicly available, and in this regard takes note of the study issued by the United Nations Office on Drugs and Crime on transnational organized crime in the fishing industry and its Global Report on Trafficking in Persons 2022, bearing in mind the distinct legal regimes and remedies under international law applicable to illegal fishing and transnational organized crime; V Monitoring, control and surveillance and compliance and enforcement",
    "125": "Calls upon States, in accordance with international law, to strengthen the implementation of or, where they do not exist, adopt comprehensive monitoring, control and surveillance measures and compliance and enforcement schemes individually and within those regional fisheries management organizations or arrangements in which they participate, in order to provide an appropriate framework for promoting compliance with agreed conservation and management measures, and further urges enhanced coordination among all relevant States and regional fisheries management organizations and arrangements in these efforts;",
    "126": "Urges all flag States to implement the Voluntary Guidelines for Flag State Performance 34 as soon as possible, including, as a first step, by carrying out a voluntary assessment, and welcomes that the Committee on Fisheries of the Food and Agriculture Organization of the United Nations, at its thirty-sixth session, stressed the importance of building on the improvements achieved so far and to continue exploring the possibility to strengthen the implementation of the Compliance Agreement, encouraging that future work be based on flag State responsibility more generally, taking into account the provisions of the Compliance Agreement itself and other relevant instruments such as the United Nations Fish Stocks Agreement and Voluntary Guidelines for Flag State Performance, as well as work on compliance in regional fisheries bodies;",
    "127": "Encourages further work by competent international organizations, including subregional and regional fisheries management organizations and arrangements, to develop guidelines on flag State control of fishing vessels;",
    "128": "Urges States, individually and through relevant regional fisheries management organizations and arrangements, to establish mandatory vessel monitoring, control and surveillance systems, in particular to require that vessel monitoring systems be carried by all vessels fishing on the high seas as soon as practicable, recalling that, in paragraph 62 of resolution 63/112 of 5 December 2008, it urged that large-scale fishing vessels be required to carry vessel monitoring systems no later than December 2008, and to share information on fisheries enforcement matters;",
    "129": "Encourages States, individually and through regional fisheries management organizations and arrangements, to strengthen or establish rules and regulations on and promote the use of the best available technology, including, where appropriate, electronic monitoring systems to ensure effective monitoring, control and surveillance as well as compliance with relevant conservation and management measures;",
    "130": "Notes that the Committee on Fisheries, at its thirty-sixth session, reiterated the importance of vessel tracking in monitoring compliance and surveillance measures and high seas boarding and inspection and looked forward to receiving the results of the global study on vessel tracking to be conducted by the Food and Agriculture Organization of the United Nations;",
    "131": "Calls upon States, individually and through regional fisheries management organizations or arrangements, to strengthen or establish, consistent with national and international law, positive or negative lists of vessels fishing within the areas covered by relevant regional fisheries management organizations and arrangements in order to promote compliance with conservation and management measures and to identify products from illegal, unreported and unregulated catches, and encourages improved coordination among all States and regional fisheries management organizations and arrangements in sharing and using this information, taking into account the forms of cooperation with developing States as set out in article 25 of the Agreement and, as appropriate, articles 4 and 6 of the Compliance Agreement;",
    "132": "Encourages the Food and Agriculture Organization of the United Nations, in cooperation with States, regional economic integration organizations, the International Maritime Organization and, as appropriate, regional fisheries management organizations and arrangements, to expedite efforts to develop and manage a comprehensive global record of fishing vessels, refrigerated transport vessels and supply vessels, including with a unique vessel identifier system, using, as a first step, the International Maritime Organization Ship Identification Number Scheme for fishing vessels of 100 gross tonnage and above, adopted by the Assembly of the International Maritime Organization in its resolution A.1078(28) of 4 December 2013;",
    "133": "Welcomes the continued development of the Global Record of Fishing Vessels, Refrigerated Transport Vessels and Supply Vessels by the Food and Agriculture Organization of the United Nations, including its efforts to keep it cost- effective, and encourages States, including through regional fisheries management organizations and arrangements, to provide the necessary data and regular updates to the Global Record;",
    "134": "Encourages, in this regard, broader participation in the Global Record, reiterating the importance for States to upload and routinely update information on their fleets and for States to use all available vessel data, including from the Global Integrated Shipping Information System platform, when providing their vessel data to the Global Record;",
    "135": " management organizations and arrangements have made provisions for the International Maritime Organization number to be compulsory in their convention areas for all eligible vessels, and encourages those regional fisheries management organizations and arrangements which have not yet done so to do the same;",
    "136": "Requests States and relevant international bodies to develop, in accordance with international law, more effective measures to trace fish and fishery products to enable importing States to identify fish or fishery products caught in a manner that undermines international conservation and management measures agreed in accordance with international law, taking into account the special requirements of developing States and the forms of cooperation with developing States as set out in article 25 of the Agreement, and at the same time to recognize the importance of market access, in accordance with provisions 11.2.4, 11.2.5 and 11.2.6 of the Code, for fish and fishery products caught in a manner that is in conformity with such international measures;",
    "137": "Requests States to take the necessary measures, consistent with international law, to help to prevent fish and fishery products caught in a manner that undermines applicable conservation and management measures adopted in accordance with international law from entering international trade;",
    "138": "Encourages States to establish and undertake cooperative surveillance and enforcement activities in accordance with international law to strengthen and enhance efforts to ensure compliance with conservation and management measures, and prevent and deter illegal, unreported and unregulated fishing;",
    "139": "Urges States, directly and through regional fisheries management organizations or arrangements, to develop and adopt effective monitoring, control and surveillance measures for trans-shipment, as appropriate, in particular at-sea trans\u2011shipment, including on the high seas, in order to, inter alia, monitor compliance, to collect and verify fisheries data, and to prevent, deter and eliminate illegal, unreported and unregulated fishing activities, in accordance with international law;",
    "140": "Recalls the adoption in 2022 of the Voluntary Guidelines for Trans-shipment of the Food and Agriculture Organization of the United Nations, and calls for their implementation, including through regional fisheries management organizations and arrangements;",
    "141": "Notes that the Committee on Fisheries of the Food and Agriculture Organization of the United Nations, at its thirty-sixth session, urged members of the Food and Agriculture Organization of the United Nations and regional fisheries management organizations and arrangements to ensure that they have a comprehensive framework for monitoring and control of transshipment operations;",
    "142": "Expresses its appreciation for financial contributions from States to improve the capacity of the existing voluntary International Monitoring, Control and Surveillance Network for Fisheries-related Activities, and encourages States to join and actively participate in the Network and to consider supporting, when appropriate, its transformation in accordance with international law into an international unit with dedicated resources to further assist Network members, taking into account the forms of cooperation with developing States as set out in article 25 of the Agreement; VI Fishing overcapacity",
    "143": " mechanisms for ongoing capacity assessment, while avoiding the transfer of fishing capacity to other fisheries or areas in a manner that undermines the sustainable management of fish stocks, including those areas where fish stocks are overexploited or in a depleted condition, and recognizing in this context the legitimate rights of developing States to develop their fisheries for straddling fish stocks and highly migratory fish stocks consistent with article 25 of the Agreement, article 5 of the Code and paragraph 10 of the International Plan of Action for the Management of Fishing Capacity of the Food and Agriculture Organization of the United Nations;",
    "144": "Calls upon, in this regard, States, individually or through regional fisheries management organizations and arrangements, to develop and implement a range of measures to adjust fishing intensity, including fishing capacity where relevant, to levels commensurate with the sustainability of fish stocks, and including capacity assessment and capacity management plans providing incentives for voluntary reduction, which take into account all aspects that contribute to fishing capacity, considering, inter alia, engine power, fishing gear technology, fish detection technology and storage space, and also to improve transparency on fishing capacity, including by identifying, sharing and publicizing relevant information in this regard, subject to confidentiality requirements;",
    "145": "Reiterates its call upon States, individually and through regional fisheries management organizations and arrangements, to ensure that the urgent actions required in the International Plan of Action for the Management of Fishing Capacity are undertaken expeditiously and that its implementation is facilitated without delay;",
    "146": "Invites the Food and Agriculture Organization of the United Nations to report on the state of progress in the implementation of the International Plan of Action for the Management of Fishing Capacity, as provided for in paragraph 48 of the Plan of Action;",
    "147": "Calls upon States, individually and, as appropriate, through subregional and regional fisheries management organizations and arrangements with competence to regulate highly migratory species, urgently to address global fishing capacity for tunas, inter alia, in a way that recognizes the legitimate rights of developing States, in particular small island developing States, to participate in and benefit from such fisheries, taking into account the recommendations of the 2010 Joint Tuna Regional Fisheries Management Organizations International Workshop on RFMO Management of Tuna Fisheries, held in Brisbane, Australia, and the recommendations of the 2011 third joint meeting of tuna regional fisheries management organizations and arrangements;",
    "148": "Encourages those States which are cooperating to establish subregional and regional fisheries management organizations and arrangements, taking into account the best scientific information available as well as ecosystem approaches and the precautionary approach, to exercise voluntary restraint of fishing effort levels in those areas that will come under the regulation of the future organizations and arrangements until adequate regional conservation and management measures are adopted and implemented, taking into account the need to ensure the long-term conservation, management and sustainable use of the relevant fish stocks and to prevent significant adverse impacts on vulnerable marine ecosystems;",
    "149": " mandates of the World Trade Organization Doha Development Agenda 35 and the Hong Kong Ministerial Declaration to strengthen disciplines on subsidies in the fisheries sector, including through the prohibition of certain forms of fisheries subsidies that contribute to overcapacity and overfishing, recognizing that appropriate and effective special and differential treatment for developing and least developed countries should be an integral part of World Trade Organization fisheries subsidies negotiation, taking into account the importance of the sector to development priorities, poverty reduction and livelihood and food security concerns, and encouraged one another to further improve the transparency and reporting of existing fisheries subsidies programmes through the World Trade Organization and, given the state of fisheries resources, and without prejudicing the Doha and Hong Kong ministerial mandates on fisheries subsidies or the need to conclude those negotiations, to eliminate subsidies that contribute to overcapacity and overfishing and to refrain from introducing new such subsidies or from extending or enhancing existing ones;",
    "150": "Also recalls the adoption in 2022 of the Agreement on Fisheries Subsidies by the World Trade Organization,36 and the establishment of the voluntary Fisheries Funding Mechanism of the World Trade Organization, which is envisioned to support developing and least developed countries in implementing that Agreement, notes the recent acceptances of the Agreement on Fisheries Subsidies, and encourages World Trade Organization members to deposit their instruments of acceptance to bring the Agreement into force as soon as possible;",
    "151": "Notes that members of the World Trade Organization should advance negotiations on the outstanding issues for a comprehensive agreement on fisheries subsidies, including through further disciplines on certain forms of fisheries subsidies that contribute to overcapacity and overfishing, as soon as possible and by its Fourteenth Ministerial Conference, recognizing that appropriate and effective special and differential treatment for developing country members and least developed country members should be an integral part of these negotiations; VII Large-scale pelagic drift-net fishing",
    "152": "Expresses concern that, despite the adoption of General Assembly resolution 46/215, the practice of large-scale pelagic drift-net fishing still exists and remains a threat to living marine resources;",
    "153": "Urges States, individually and through regional fisheries management organizations and arrangements, to adopt effective measures, or strengthen existing measures, to implement and enforce the provisions of resolution 46/215 and subsequent resolutions on large-scale pelagic drift-net fishing in order to eliminate the use of large-scale pelagic drift nets in all seas and oceans, which means that efforts to implement resolution 46/215 should not result in the transfer to other parts of the world of drift nets that contravene the resolution;",
    "154": "Also urges States, individually and through regional fisheries management organizations and arrangements, to adopt effective measures, or strengthen existing measures, to implement and enforce the present global moratorium on the use of large- scale pelagic drift nets on the high seas, and calls upon States to ensure that vessels flying their flag that are duly authorized to use large-scale drift nets in waters under their national jurisdiction do not use such gear for fishing while on the high seas; VIII Fisheries by-catch and discards",
    "155": "Urges States, subregional and regional fisheries management organizations and arrangements and other relevant international organizations that have not done so to take action, including with consideration of the interests of developing coastal States and, as appropriate, subsistence fishing communities, to minimize by-catch, as well as to reduce or eliminate catch by lost or abandoned gear, fish discards and post-harvest losses, including of juvenile fish, consistent with international law and relevant international instruments, including the Code, and in particular to consider measures including, as appropriate, technical measures related to fish size, mesh size or gear, discards, closed seasons and areas and zones reserved for selected fisheries, particularly artisanal fisheries, the establishment of mechanisms for communicating information on areas of high concentration of juvenile fish, taking into account the importance of ensuring the confidentiality of such information, and support for studies and research that will minimize by-catch of juvenile fish, and to ensure that these measures are implemented so as to optimize their effectiveness;",
    "156": "Encourages, in this regard, States, individually or through regional fisheries management organizations and arrangements, as appropriate, to ensure proper implementation and enforcement of the measures that they have taken with regard to by-catch and discards;",
    "157": "Welcomes the commitment of States in \u201cThe future we want\u201d to enhance action to manage by-catch, discards and other adverse ecosystem impacts from fisheries, including by eliminating destructive fishing practices, consistent with international law, the applicable international instruments and relevant General Assembly resolutions and guidelines of the Food and Agriculture Organization of the United Nations;",
    "158": "Calls upon States, either individually, collectively or through regional fisheries management organizations and arrangements, to further study, develop and adopt effective management measures, taking into account the best available scientific information on fishing methods, including fish aggregating devices, to minimize by-catch;",
    "159": "Also calls upon States, either individually, collectively or through regional fisheries management organizations and arrangements, to collect the necessary data in order to evaluate and closely monitor the use of large-scale fish aggregating devices and other devices, as appropriate, and their effects on tuna resources and tuna behaviour and associated and dependent species, to improve management procedures to monitor the number, type and use of such devices and to mitigate possible negative effects on the ecosystem, including on juveniles and the incidental by-catch of non\u2011target species, particularly sharks and turtles, notes in this regard the measures adopted by different regional fisheries management organizations and arrangements, and encourages regional fisheries management organizations and arrangements to continue to work on data collection, evaluation and monitoring of such devices;",
    "160": "Notes, in this regard, that some regional fisheries management organizations, including the Inter-American Tropical Tuna Commission, the International Commission for the Conservation of Atlantic Tunas, the Indian Ocean Tuna Commission and the Western and Central Pacific Fisheries Commission, have established their own working groups to assess the use and impact of large-scale fish aggregating devices;",
    "161": " measures that they have taken relating to such devices, and promoting the application of sustainable design and manufacturing criteria, such as the use of non\u2011entangling and biodegradable materials to minimize the negative environmental impacts;",
    "162": "Urgently calls upon States, subregional and regional fisheries management organizations and arrangements and, where appropriate, other relevant international organizations to develop and implement effective management measures to reduce the incidence of catch and discards of non\u2011target species, including the utilization of selective fishing gear, where appropriate, and to take appropriate measures to minimize waste, and welcomes in this regard the support of the Committee on Fisheries for the development of a technical guideline of the Food and Agriculture Organization of the United Nations addressing the causes of and remedies to food losses and waste;",
    "163": "Calls upon States and regional fisheries management organizations and arrangements with the competence to regulate fisheries to urgently implement measures aimed at contributing to minimizing and, where possible, eliminating catches, including incidental catches, of species which are critically endangered;",
    "164": "Calls upon States and subregional and regional fisheries management organizations and arrangements to adopt or improve measures to assess the impact of their fisheries on species caught as by-catch and to improve the comprehensiveness and accuracy of information and reporting on species caught as by-catch, including through adequate observer coverage and the use of modern technologies, such as electronic monitoring, and to provide assistance to developing States to meet data- collection and reporting obligations;",
    "165": "Requests States and regional fisheries management organizations and arrangements, as appropriate, to strengthen or establish data-collection programmes to obtain reliable species-specific estimates of shark, marine turtle, fin-fish, marine mammal and seabird by-catch, and to promote further research on selective fishing gear and practices and on the use of appropriate by-catch mitigation measures;",
    "166": "Encourages the widest application of the International Guidelines on Bycatch Management and Reduction of Discards of the Food and Agriculture Organization of the United Nations 37 and the Guidelines to Prevent and Reduce Bycatch of Marine Mammals in Capture Fisheries of the Food and Agriculture Organization of the United Nations;38",
    "167": "Encourages States and regional fisheries management organizations and arrangements to coordinate in the development and implementation of clear and standardized by-catch data-collection and reporting protocols for non\u2011target species, in particular endangered, threatened and protected species, taking into account best- practice advice from appropriate international organizations and arrangements, including the Food and Agriculture Organization of the United Nations and the Agreement on the Conservation of Albatrosses and Petrels;39",
    "168": "Encourages States and entities referred to in the Convention and in article 1, paragraph 2 (b), of the Agreement to give due consideration to participation, as appropriate, in subregional and regional instruments and organizations with mandates to conserve non\u2011target species taken incidentally in fishing operations;",
    "169": "Encourages States to strengthen, if necessary, the capacity of those subregional and regional fisheries management organizations and arrangements in which they participate to ensure the adequate conservation of non\u2011target species taken incidentally in fishing operations, taking into consideration best practices for non\u2011target species management, and to expedite their ongoing efforts in this regard;",
    "170": "Requests States and regional fisheries management organizations and arrangements urgently to implement, as appropriate, the measures recommended in the 2004 Guidelines to Reduce Sea Turtle Mortality in Fishing Operations and the International Plan of Action for Reducing Incidental Catch of Seabirds in Longline Fisheries of the Food and Agriculture Organization of the United Nations in order to prevent the decline of sea turtles and seabird populations by minimizing by-catch and increasing post-release survival in their fisheries, including through research and development of gear and bait alternatives, promoting the use of available by-catch mitigation technology, and establishing and strengthening data-collection programmes to obtain standardized information to develop reliable estimates of the by-catch of these species;",
    "171": "Urges States, individually or through regional fisheries management organizations and arrangements, to implement the International Guidelines on Bycatch Management and Reduction of Discards of the Food and Agriculture Organization of the United Nations;",
    "172": "Requests States and regional fisheries management organizations and arrangements to continue to take urgent action to reduce the by-catch of seabirds, including albatrosses and petrels, in fisheries by adopting and implementing conservation measures consistent with the 2009 best practices technical guidelines of the Food and Agriculture Organization of the United Nations to support the implementation of the International Plan of Action for Reducing Incidental Catch of Seabirds in Longline Fisheries and taking into account the work of the Agreement on the Conservation of Albatrosses and Petrels and of organizations such as the Commission for the Conservation of Antarctic Marine Living Resources; IX Subregional and regional cooperation",
    "173": "Urges coastal States and States fishing on the high seas, in accordance with the Convention, the Agreement and other relevant instruments, to pursue cooperation in relation to straddling fish stocks and highly migratory fish stocks, either directly or through appropriate subregional or regional fisheries management organizations or arrangements, to ensure the effective conservation and management of such stocks;",
    "174": "Urges States fishing for straddling fish stocks and highly migratory fish stocks on the high seas, and relevant coastal States, where a subregional or regional fisheries management organization or arrangement has the competence to establish conservation and management measures for such stocks, to give effect to their duty to cooperate by becoming members of such an organization or participants in such an arrangement, or by agreeing to apply the conservation and management measures established by such an organization or arrangement, or to otherwise ensure that no vessel flying their flag is authorized to access the fisheries resources to which regional fisheries management organizations and arrangements or conservation and management measures established by such organizations or arrangements apply;",
    "175": " concerned, including their willingness to effectively exercise flag State control, while recognizing the need to enhance the capacity of developing States in this regard;",
    "176": "Encourages relevant coastal States and States fishing on the high seas for a straddling fish stock or a highly migratory fish stock, where there is no subregional or regional fisheries management organization or arrangement to establish conservation and management measures for such stocks, to cooperate to establish such an organization or enter into another appropriate arrangement to ensure the conservation and management of such stocks, and to participate in the work of the organization or arrangement;",
    "177": "Recalls the entry into force, on 25 June 2021, of the Agreement to Prevent Unregulated High Seas Fisheries in the Central Arctic Ocean;",
    "178": "Urges signatory States and other States whose vessels fish within the area of the Convention on the Conservation and Management of Fishery Resources in the South-East Atlantic Ocean 40 for fishery resources covered by that Convention to become parties to that Convention as a matter of priority and, in the interim, to ensure that vessels flying their flags fully comply with the measures adopted;",
    "179": "Encourages further ratifications of, accessions to, acceptances and approvals of the Southern Indian Ocean Fisheries Agreement; 41",
    "180": "Also encourages further ratifications of, accessions to, acceptances and approvals of the Convention on the Conservation and Management of High Seas Fishery Resources in the South Pacific Ocean;42",
    "181": "Further encourages further accessions to the Convention on the Conservation and Management of High Seas Fisheries Resources in the North Pacific Ocean, and notes the ongoing efforts by the North Pacific Fisheries Commission to develop and implement conservation and management measures and to strengthen cooperation to eliminate illegal, unreported and unregulated fishing within the area of that Convention;",
    "182": "Welcomes the endorsement of the Agreement for the Establishment of the General Fisheries Commission for the Mediterranean, as amended, by the Commission at its thirty-eighth session, held in Rome from 19 to 24 May 2014, and urges those Contracting Parties to the Commission that need to accept the amended Agreement to do so with a view to its early entry into force;",
    "183": "Encourages signatory States and States having a real interest to become parties to the Convention for the Strengthening of the Inter-American Tropical Tuna Commission Established by the 1949 Convention between the United States of America and the Republic of Costa Rica;",
    "184": "Notes the ongoing efforts of the Association of Southeast Asian Nations, through its Fisheries Consultative Forum, to address common problems on fisheries management and development in the South-East Asian region;",
    "185": "Urges further efforts by regional fisheries management organizations and arrangements, as a matter of priority, in accordance with international law, to strengthen and modernize their mandates and the measures adopted by such organizations or arrangements, and to implement modern approaches to fisheries management, including responsible conduct of fishing operations as reflected in the Agreement and other relevant international instruments, relying on the best scientific information available and application of the precautionary approach and incorporating an ecosystem approach to fisheries management and biodiversity considerations, including the conservation and management of ecologically related and dependent species and protection of their habitats, where these aspects are lacking, to ensure that they effectively contribute to the long-term conservation and management and sustainable use of living marine resources, and welcomes those regional fisheries management organizations and arrangements that have taken steps in this direction;",
    "186": "Welcomes in this regard the amendments to the International Convention for the Conservation of Atlantic Tunas made by the Palma de Mallorca Protocol and adopted by the International Commission for the Conservation of Atlantic Tunas in 2019, and urges States Parties that are Contracting Parties to that Convention to urgently approve, ratify or accept the Protocol;",
    "187": "Calls upon regional fisheries management organizations with the competence to conserve and manage highly migratory fish stocks that have not yet adopted effective conservation and management measures in line with the best scientific information available to conserve and manage stocks falling under their mandate to do so urgently;",
    "188": "Also, in this regard, calls upon regional fisheries management organizations to be more cautious when information is uncertain, unreliable or inadequate, in line with article 6 of the Agreement;",
    "189": "Urges States to strengthen and enhance cooperation among existing and developing regional fisheries management organizations and arrangements in which they participate, including increased communication and further coordination of measures, such as through the holding of joint consultations, and to strengthen integration, coordination and cooperation by such regional fisheries management organizations and arrangements with other relevant fisheries organizations, regional seas arrangements and other relevant international organizations;",
    "190": "Notes, in this regard, the initiative of the Food and Agriculture Organization of the United Nations to promote the establishment of regional frameworks among regional fishery bodies to scale up cooperation and coordination towards sustainable fisheries;43",
    "191": "Also notes, in this regard, the enhanced cooperation between the OSPAR Commission established by the Convention for the Protection of the Marine Environment of the North-East Atlantic 44 and the North-East Atlantic Fisheries Commission;",
    "192": "Urges the five regional fisheries management organizations with competence to manage highly migratory species to continue to take measures to implement the Course of Actions adopted at the second joint meeting of tuna regional fisheries management organizations and arrangements and to consider the recommendations of the third joint meeting of tuna regional fisheries management organizations and arrangements;",
    "193": "Invites States and regional fisheries management organizations and arrangements with competence to manage straddling fish stocks to share experiences and good practices, for example by considering organizing joint meetings, where appropriate;",
    "194": "Invites States and regional fisheries management organizations and arrangements with competence to manage deep-sea fisheries to share experiences and good practices, for example, by considering organizing joint meetings, where appropriate;",
    "195": "Urges regional fisheries management organizations and arrangements to improve transparency and to ensure that their decision-making processes are fair and transparent and facilitate the adoption of conservation and management measures in a timely and effective manner, including considering provisions for effective voting and objection procedures, where appropriate, to rely on the best scientific information available, incorporate the precautionary approach and ecosystem approaches, and address participatory rights, including through, inter alia, the development of transparent criteria for allocating fishing opportunities which reflects, where appropriate, the relevant provisions of the Agreement, taking due account, inter alia, of the status of the relevant stocks and the respective interests in the fishery;",
    "196": "Recognizes that performance reviews of regional fisheries management organizations and arrangements have proven to be an effective tool for strengthening the performance of such organizations and arrangements, and are critical to improve the sustainability of fish stocks covered by such organizations and arrangements, and notes that the fourteenth round of informal consultations of States parties to the Agreement focused on the topic \u201cPerformance reviews of regional fisheries management organizations and arrangements\u201d;45",
    "197": "Welcomes the fact that a number of regional fisheries management organizations and arrangements have completed performance reviews, and encourages the implementation, as appropriate, of the recommendations of their respective reviews as a matter of priority;",
    "198": "Urges States, through their participation in regional fisheries management organizations and arrangements that have not done so, to undertake, on an urgent basis, performance reviews of those regional fisheries management organizations and arrangements, initiated either by the organization or arrangement itself or with external partners, including in cooperation with the Food and Agriculture Organization of the United Nations, using transparent criteria based on the provisions of the Agreement and other relevant instruments, and taking into account the best practices of regional fisheries management organizations or arrangements and, as appropriate, any set of criteria developed by States or other regional fisheries management organizations or arrangements, and encourages that such performance reviews include some element of independent evaluation and propose means for improving the functioning of the regional fisheries management organization or arrangement, as appropriate;",
    "199": "Calls upon States, through their participation in regional fisheries management organizations and arrangements, to undertake performance reviews of those regional fisheries management organizations and arrangements on a regular basis, to make the results publicly available, to implement the recommendations of such reviews and to strengthen the comprehensiveness of those reviews over time, as necessary;",
    "200": "Recalls that, in \u201cThe future we want\u201d, States recognized the need for transparency and accountability in fisheries management by regional fisheries management organizations and the efforts already made by those regional fisheries management organizations that had undertaken independent performance reviews, called upon all regional fisheries management organizations to regularly undertake such reviews and make the results publicly available, encouraged implementation of the recommendations of such reviews and recommended that the comprehensiveness of those reviews be strengthened over time, as necessary;",
    "201": "Urges States to cooperate, taking into account those performance reviews, to develop best-practice guidelines for regional fisheries management organizations and arrangements and to apply, to the extent possible, those guidelines to organizations and arrangements in which they participate;",
    "202": "Encourages States, individually or through regional fisheries management organizations and arrangements, as appropriate, to recognize the importance and role of small-scale, artisanal and subsistence fisheries and to support their long-term environmental, economic and social sustainability;",
    "203": "Encourages the development of regional guidelines for States to use in establishing sanctions for non\u2011compliance by vessels flying their flag and by their nationals, to be applied in accordance with national law, that are adequate in severity for effectively securing compliance, deterring further violations and depriving offenders of the benefits deriving from their illegal activities, as well as in evaluating their systems of sanctions to ensure that they are effective in securing compliance and deterring violations;",
    "204": "Recognizes the importance of ensuring transparency of reporting of fishing activities within regional fisheries management organizations and arrangements in order to facilitate efforts to combat illegal, unreported and unregulated fishing, as well as the importance of respecting the reporting obligations within those organizations and arrangements, notes in this regard the measures adopted by the International Commission for the Conservation of Atlantic Tunas 46 and the Indian Ocean Tuna Commission, 47 and encourages other regional fisheries management organizations and arrangements to consider establishing similar measures; X Responsible fisheries in the marine ecosystem",
    "205": "Encourages States, individually and through relevant international bodies, to improve the understanding of the causes and impacts of forced labour and human trafficking in the fishing and aquaculture industries, including processing and related industries, and to further consider actions to combat these practices, including raising awareness of the issue;",
    "206": "Highlights the importance of safety at sea and working conditions in the fisheries sector, welcomes in this regard the close cooperation between the Food and Agriculture Organization of the United Nations, the International Labour Organization and the International Maritime Organization, including with regard to their joint work on codes and guidelines in relation to fishing vessel safety, including through the Joint Ad Hoc Working Group on Illegal, Unreported and Unregulated Fishing and Related Matters, and reiterates the request of the Committee on Fisheries that the Food and Agriculture Organization of the United Nations further strengthen international cooperation on occupational health and safety issues in the fisheries and aquaculture sectors and promote decent work for fishers and fish workers;",
    "207": "Recalls that the Work in Fishing Convention, 2007 (No. 188) and the Protocol of 2014 to the Forced Labour Convention, 1930 (No. 29) are relevant instruments that ensure decent working conditions in fisheries and other maritime sectors, calls upon flag States to effectively implement their duty under the Convention with respect to labour conditions, taking into account applicable international instruments and national laws, and in this regard encourages States that have not yet done so to consider becoming parties to the Protocol of 2014 to the Forced Labour Convention, 1930 (No. 29) and the Work in Fishing Convention, 2007 (No. 188), and to implement the Guidelines for port State control officers carrying out inspections under the Work in Fishing Convention, 2007 (No. 188) and the Guidelines on flag State inspection of working and living conditions on board fishing vessels;",
    "208": "Encourages States to establish, as appropriate, including through regional fisheries management organizations and arrangements of which they are members, standards for decent working conditions for crew, inspectors and observers within the fisheries within their competence, in accordance with international instruments to which they are party;",
    "209": "Urges States, individually or through regional fisheries management organizations and arrangements, to enhance their efforts to apply an ecosystem approach to fisheries, taking into account paragraph 30 (d) of the Johannesburg Plan of Implementation;",
    "210": "Acknowledges the importance of adequate training for fishers to improve safety at sea and the importance, in this regard, of the International Convention on Standards of Training, Certification and Watchkeeping for Fishing Vessel Personnel, 1995, and encourages States that have not yet done so to consider becoming parties to that Convention;",
    "211": "Encourages States, individually or through regional fisheries management organizations and arrangements and other relevant international organizations, to work to ensure that fisheries and other ecosystem data collection is performed in a coordinated and integrated manner, facilitating incorporation into global observation initiatives, where appropriate;",
    "212": "Calls upon States and regional fisheries management organizations or arrangements, working in cooperation with other relevant organizations, including the Food and Agriculture Organization of the United Nations, the Intergovernmental Oceanographic Commission and the World Meteorological Organization, to adopt, as appropriate, measures to protect ocean data buoy systems moored in areas beyond national jurisdiction from actions that impair their operation;",
    "213": "Encourages States to increase scientific research on marine ecosystems in accordance with international law;",
    "214": "Recognizes that the science-policy interface is vital to the effective implementation of the provisions of the Convention and the Agreement by providing the best available scientific information for the conservation and management of living marine resources;",
    "215": "Urges States, individually and through regional fisheries management organizations and arrangements, to strengthen the science-policy interface in order to further improve the application of the ecosystem approach to fisheries management and to address uncertainties and changes such as those related to the impacts of climate change in support of the development of adaptive fisheries management strategies;",
    "216": " aquaculture, including through information exchange, developing equivalent standards on such issues as aquatic animal health and human health and safety concerns, assessing the potential positive and negative impacts of aquaculture, including socioeconomics, on the marine and coastal environment, including biodiversity, and adopting relevant methods and techniques to minimize and mitigate adverse effects, and in this regard encourages the implementation of the 2007 Strategy and Outline Plan for Improving Information on Status and Trends of Aquaculture of the Food and Agriculture Organization of the United Nations as a framework for the improvement and understanding of aquaculture status and trends;",
    "217": "Calls upon States to take action immediately, individually and through regional fisheries management organizations and arrangements, and consistent with the precautionary approach and ecosystem approaches, to continue to implement the 2008 International Guidelines for the Management of Deep-Sea Fisheries in the High Seas of the Food and Agriculture Organization of the United Nations (the Guidelines) in order to sustainably manage fish stocks and protect vulnerable marine ecosystems, including seamounts, hydrothermal vents and cold water corals, from fishing practices with significant adverse impacts on vulnerable marine ecosystems, recognizing the immense importance and value of deep-sea ecosystems and the biodiversity they contain, as documented in the first World Ocean Assessment;",
    "218": "Recalls, in this regard, that, in \u201cThe future we want\u201d, States committed to enhance actions to protect vulnerable marine ecosystems from significant adverse impacts, including through the effective use of impact assessments, consistent with international law, the applicable international instruments and relevant General Assembly resolutions and guidelines of the Food and Agriculture Organization of the United Nations;",
    "219": "Reaffirms the importance of paragraphs 80 to 90 of resolution 61/105, paragraphs 113 to 127 of resolution 64/72, paragraphs 121 to 136 of resolution 66/68 of 6 December 2011 and paragraphs 156, 171 to 188 and 219 of resolution 71/123 of 7 December 2016 addressing the impacts of bottom fishing on vulnerable marine ecosystems and the long-term sustainability of deep-sea fish stocks and the actions called for in those resolutions, and emphasizes the need for full implementation by all States and relevant regional fisheries management organizations and arrangements of their commitments under those paragraphs on an urgent basis;",
    "220": "Urges States and regional fisheries management organizations and arrangements to ensure that their actions in sustainably managing deep-sea fisheries and implementing paragraphs 80 and 83 to 87 of resolution 61/105, paragraphs 113 and 119 to 124 of resolution 64/72, paragraphs 121, 129, 130 and 132 to 134 of resolution 66/68 and paragraphs 156, 171 to 188 and 219 of resolution 71/123 are consistent with the Guidelines;",
    "221": "Recalls that nothing in the paragraphs of resolutions 61/105, 64/72, 66/68 and 71/123 addressing the impacts of bottom fishing on vulnerable marine ecosystems prejudices the sovereign rights of coastal States over their continental shelf or the exercise of the jurisdiction of coastal States with respect to their continental shelf under international law as reflected in the Convention, in particular article 77 thereof;",
    "222": "Notes, in this regard, the adoption by coastal States of conservation measures regarding their continental shelf to address the impacts of bottom fishing on vulnerable marine ecosystems, as well as their efforts to ensure compliance with those measures;",
    "223": " species, and to protect marine ecosystems, including the prevention of significant adverse impacts on vulnerable marine ecosystems;",
    "224": "Welcomes the important progress made by States, regional fisheries management organizations and arrangements and those States participating in negotiations to establish a regional fisheries management organization or arrangement competent to regulate bottom fisheries to implement paragraphs 80 and 83 to 87 of resolution 61/105, paragraphs 113, 117 and 119 to 124 of resolution 64/72, paragraphs 121, 126, 129, 130 and 132 to 134 of resolution 66/68 and paragraphs 156, 171, 175, 177 to 188 and 219 of resolution 71/123, and address the impacts of bottom fishing on vulnerable marine ecosystems, including that reflected in the summary of discussions from the two-day United Nations workshop addressing the impacts of bottom fishing on vulnerable marine ecosystems and the long-term sustainability of deep-sea fish stocks, but notes with renewed concern the uneven implementation of those paragraphs listed above and that, in particular, bottom fishing continues to occur in certain areas beyond national jurisdiction without an impact assessment having been completed in the 18 years since the adoption of resolution 61/105, in which the General Assembly called for such assessments to be undertaken by 31 December 2008;",
    "225": "Recognizes the need for further progress with regard to obtaining more biological information on the species that comprise vulnerable marine ecosystems, including their associated and dependent species, the assessment of significant adverse impacts on vulnerable marine ecosystems, and protecting and conserving biodiversity, including beyond vulnerable marine ecosystems, as well as the consistent application of the Guidelines;",
    "226": "Calls upon, in this regard, States, regional fisheries management organizations and arrangements and those States participating in negotiations to establish a regional fisheries management organization or arrangement competent to regulate bottom fisheries to identify and overcome barriers to the implementation of the relevant paragraphs of General Assembly resolutions 64/72, 66/68 and 71/123 such as data availability, especially with regard to baseline data and the spatial distribution and connectivity of vulnerable marine ecosystems, including their associated and dependent species, while recognizing the importance of international collaboration for this purpose, further recognizing that effective management of bottom fisheries is crucial to ensure the long-term sustainability of the sector;",
    "227": " (c) To ensure that the precautionary approach is applied, including in the utilization of impact assessments to inform management decisions and consideration of significant adverse impacts on vulnerable marine ecosystems, including their associated and dependent species; (d) To ensure that conservation and management measures adopted by States and regional fisheries organizations and arrangements are based on and updated on the basis of the best available scientific information, noting in particular the need to improve the effective implementation of thresholds and move-on rules;",
    "228": "Recognizes that different types of marine scientific research, such as seabed mapping, mapping of vulnerable marine ecosystems based on information from the fishing fleet, on-site camera observations from remote vehicles, benthic ecosystem modelling, comparative benthic studies and predictive modelling have resulted in the identification of areas where vulnerable marine ecosystems are known or are likely to occur and in the adoption of conservation and management measures to prevent significant adverse impacts on such ecosystems, including the closure of areas to bottom fishing in accordance with paragraph 119 (b) of resolution 64/72;",
    "229": "Encourages, in this regard, States, regional fisheries management organizations and arrangements with the competence to manage bottom fisheries, and States participating in negotiations to establish such organizations or arrangements, to consider the results available from different types of marine scientific research, including, as appropriate, those listed in paragraph 223 above, concerning the identification of areas containing vulnerable marine ecosystems, and to adopt conservation and management measures to prevent significant adverse impacts from bottom fishing on such ecosystems, consistent with the Guidelines, or to close such areas to bottom fishing until such conservation and management measures are adopted, as well as to continue to undertake further marine scientific research, for the above-mentioned purposes, in accordance with international law, as reflected in Part XIII of the Convention;",
    "230": "Encourages, in this regard, States, regional fisheries management organizations and arrangements with the competence to manage deep-sea fisheries, and States participating in negotiations to establish such organizations or arrangements to continue to improve the best available science, carry out further marine scientific research to address the remaining knowledge gaps, in particular with regard to fish stock assessments to improve understanding of the connectivity of populations of deep-sea fish species and to base and update conservation and management measures on the best available scientific information, in accordance with international law, as reflected in Part XIII of the Convention;",
    "231": "Notes with concern that vulnerable marine ecosystems may also be impacted by human activities other than bottom fishing, and encourages in this regard States and competent international organizations to consider taking action to address such impacts;",
    "232": "Calls upon States, individually and through regional fisheries management organizations and arrangements, to take into account the potential impacts of climate change and ocean acidification in taking measures to manage deep-sea fisheries and protect vulnerable marine ecosystems, including by identifying areas, based on scientific information, where deep-water species and vulnerable marine ecosystems are likely to better survive such impacts, and establishing measures to support their resilience;",
    "233": " control and surveillance measures, on the basis of the best available scientific information, including stock assessments, to improve the robustness of such measures, to ensure the long-term sustainability of deep-sea fish stocks and non\u2011target species and the rebuilding of depleted stocks, consistent with the Guidelines and, where scientific information is uncertain, unreliable or inadequate, to ensure that conservation and management measures are established consistent with the precautionary approach, in particular with regard to vulnerable, threatened or endangered species;",
    "234": "Recognizes, in particular, the special circumstances and requirements of developing States and the specific challenges that they may face in giving full effect to certain technical aspects of the Guidelines, and that implementation by such States of paragraphs 83 to 87 of resolution 61/105, paragraph 119 of resolution 64/72, paragraph 129 of resolution 66/68 and paragraph 180 of resolution 71/123 and the Guidelines should proceed in a manner that gives full consideration to section 6 of the Guidelines on the special requirements of developing countries;",
    "235": "Also recognizes the need to enhance the capacity of developing States, including with regard to stock assessments, impact assessments, scientific and technical knowledge and training, and encourages States to provide technical and financial support to developing countries to address their special requirements and challenges in implementing the Guidelines;",
    "236": "Welcomes the substantial ongoing work of the Food and Agriculture Organization of the United Nations related to the management of deep-sea fisheries in the high seas and the protection of vulnerable marine ecosystems, including the publication of the technical paper entitled \u201cVulnerable marine ecosystems: processes and practices in the high seas\u201d, affirms the importance of the work undertaken pursuant to paragraphs 135 and 136 of resolution 66/68, and notes in particular the support provided by the Food and Agriculture Organization of the United Nations to States in implementing the Guidelines;",
    "237": "Recalls its decision, in paragraph 223 of resolution 77/118 of 9 December 2022, to conduct, in 2026, a further review of the actions taken by States and regional fisheries management organizations and arrangements in response to paragraphs 113, 117 and 119 to 124 of resolution 64/72, paragraphs 121, 126, 129, 130 and 132 to 134 of resolution 66/68 and paragraphs 181, 203 to 207, 209, 210, 213, 215 to 222 and 257 of resolution 77/118, with a view to ensuring the effective implementation of the measures therein and to make further recommendations, where necessary, and to precede that review with a two-day workshop;",
    "238": "Requests the Secretary-General to convene, with full conference services, without prejudice to future arrangements, a two-day workshop in the second half of 2026 in order to discuss implementation of paragraphs 113, 117 and 119 to 124 of resolution 64/72, paragraphs 121, 126, 129, 130 and 132 to 134 of resolution 66/68 and paragraphs 181, 203 to 207, 209, 210, 213, 215 to 222 and 257 of resolution 77/118, and to invite States, the Food and Agriculture Organization of the United Nations and other relevant specialized agencies, funds and programmes, subregional and regional fisheries management organizations and arrangements, other fisheries bodies, other relevant intergovernmental bodies and relevant non\u2011governmental organizations and relevant stakeholders, in accordance with United Nations practice, to attend the workshop;",
    "239": "Also requests the Secretary-General to prepare a report similar in scope, length and detail to his report to the General Assembly at its seventy-fifth session,48 in cooperation with the Food and Agriculture Organization of the United Nations and with the assistance of an expert consultant to be hired by the Division to provide information and analysis on relevant technical and scientific issues to be covered in the report, for consideration by the Assembly at its eighty-first session, on the actions taken by States and regional fisheries management organizations and arrangements in response to paragraphs 113, 117 and 119 to 124 of resolution 64/72, paragraphs 121, 126, 129, 130 and 132 to 134 of resolution 66/68 and paragraphs 181, 203 to 207, 209, 210, 213, 215 to 222 and 257 of resolution 77/118, and invites States and regional fisheries management organizations and arrangements to consider making such information publicly available;",
    "240": "Further requests the Secretary-General, in connection with the report requested in paragraph 239 of the present resolution, to invite States and regional economic integration organizations and regional fisheries management organizations and arrangements to submit detailed information to the Secretary-General in a timely manner on actions taken pursuant to paragraphs 113, 117 and 119 to 124 of resolution 64/72, paragraphs 121, 126, 129, 130 and 132 to 134 of resolution 66/68 and paragraphs 181, 203 to 207, 209, 210, 213, 215 to 222 and 257 of resolution 77/118, to facilitate a further review of such actions;",
    "241": "Encourages accelerated progress to establish criteria on the objectives, establishment and effective management of marine protected areas for fisheries purposes, and in this regard also encourages the application of the technical guidelines on marine protected areas and fisheries of the Food and Agriculture Organization of the United Nations, and urges involvement, coordination and cooperation among all relevant international organizations and bodies;",
    "242": "Also encourages efforts to establish guidance on the objectives, establishment and management of other effective area-based conservation measures for fisheries purposes, and encourages coordination and cooperation for this purpose among all relevant international organizations and bodies;",
    "243": "Welcomes the determinations by the Northwest Atlantic Fisheries Organization and the North-East Atlantic Fisheries Commission of management measures to protect vulnerable marine habitats as \u201cother effective area-based conservation measures\u201d, and encourages other regional fisheries management organizations and arrangements which have not already done so to undertake evidence-based analysis of management measures to determine if they would qualify as other effective area-based conservation measures, as appropriate;",
    "244": "Acknowledges the work by the Food and Agriculture Organization of the United Nations to continue the consultative process to develop and disseminate practical guidance, led by the Food and Agriculture Organization of the United Nations, on other effective area-based conservation measures;",
    "245": "Notes the decision by the fifth Intergovernmental Review Meeting on the Implementation of the Global Programme of Action for the Protection of the Marine Environment from Land-based Activities49 to hold no further sessions of the periodic Intergovernmental Review, while recognizing the continued relevance and valuable role of the Global Programme of Action and its three global partnerships, namely the Global Partnership on Marine Litter, the Global Partnership on Nutrient Management and the Global Wastewater Initiative, to safeguard marine ecosystems, including fish stocks, against sources of land-based pollution, including plastics and excess nutrients, and physical degradation, taking into account the increase in oceanic dead zones;",
    "246": "Calls upon States, either individually, collectively or through regional fisheries management organizations and arrangements, to further study, develop and adopt effective management measures, and disseminate information in that regard, taking into account the best available scientific information, on fishing methods, gear types and uses to minimize mortality and other harms caused by abandoned, lost or otherwise discarded fishing gear;",
    "247": "Acknowledges the serious environmental, as well as economic and social, impacts on the marine environment caused by abandoned, lost or otherwise discarded fishing gear, and encourages States, and regional fisheries management organizations and arrangements, as appropriate, to take action to reduce such gear, noting the recommendations of the 2009 report by the United Nations Environment Programme and the Food and Agriculture Organization of the United Nations;",
    "248": "Reaffirms the importance that it attaches to paragraphs 77 to 81 of resolution 60/31 of 29 November 2005 concerning the issue of lost, abandoned or otherwise discarded fishing gear and related marine debris and the adverse impacts that such debris and derelict fishing gear have on, inter alia, fish stocks, habitats and other marine species, and urges accelerated progress by States and regional fisheries management organizations and arrangements in implementing those paragraphs of the resolution;",
    "249": "Recalls, in this regard, that the Committee on Fisheries, at its thirty-fourth session, encouraged the Food and Agriculture Organization of the United Nations to continue promoting the Voluntary Guidelines on the Marking of Fishing Gear and the provision of capacity development at regional and national levels;",
    "250": "Encourages the Food and Agriculture Organization of the United Nations to continue to participate in the intergovernmental negotiating committee to develop an international legally binding instrument on plastic pollution, including in the marine environment, and provide relevant technical and scientific information, including based on the Voluntary Guidelines of the Food and Agriculture Organization of the United Nations;",
    "251": "Recalls annex V to the International Convention for the Prevention of Pollution from Ships, 1973, as modified by the Protocol of 1978 relating thereto, in which it is stated, inter alia, that the accidental loss or discharge of fishing gear which poses a significant threat to the marine environment or navigation, shall be reported to the State whose flag the ship is entitled to fly, and, where the loss or discharge occurs within waters subject to the jurisdiction of a coastal State, also to that coastal State;50",
    "252": "Notes the decision of the Marine Environmental Protection Committee of the International Maritime Organization, at its seventy-eighth session, to develop draft amendments to annex V to the International Convention for the Prevention of Pollution from Ships, 1973, as modified by the Protocol of 1978 relating thereto, and associated guidelines to make the marking of fishing gear mandatory, using a goal- based approach;",
    "253": "Encourages further studies, including by the Food and Agriculture Organization of the United Nations, on the impacts of underwater noise on fish stocks and fishing catch rates, as well as associated socioeconomic effects;",
    "254": "Calls upon States, including through regional fisheries management organizations and arrangements, to play an active role in global efforts to conserve and sustainably use living marine resources, so as to contribute to marine biological diversity;",
    "255": "Encourages States, either individually or through regional fisheries management organizations and arrangements, as appropriate, to identify any spawning and nursery areas for fish stocks under their jurisdiction or competence and, where required, to adopt science-based measures to conserve such stocks during these critical life stages;",
    "256": "Expresses concern about the continuing influx of sargassum seaweed into the waters of the Caribbean and its impact on aquatic resources, fisheries, shorelines, waterways and tourism and the general well-being of coastal communities, and encourages States and relevant regional organizations to coordinate efforts to better understand the causes and impacts of the influx, and to eliminate extraordinary amounts of sargassum washed up along the coastline using environmentally sound techniques, as well as to work on joint solutions to maintain and protect the livelihoods of fishers and fishing communities and find ways of beneficially utilizing the seaweed and environmentally friendly ways of disposing of sargassum washed up on shore;",
    "257": "Recognizes the wide range of impacts of ocean acidification on marine ecosystems, and calls upon States to tackle the causes of ocean acidification and to further study its impacts;",
    "258": "Emphasizes the importance of developing adaptive marine resource management strategies and enhancing capacity-building to implement such strategies in order to enhance the resilience of marine ecosystems to minimize the wide range of impacts on marine organisms and threats to food security caused by ocean acidification, in particular the impacts on the ability of calciferous plankton, coral reefs, shellfish and crustaceans to build shells and skeletal structures and the threats that this could pose to protein supply; XI Capacity-building",
    "259": "Reiterates the crucial importance of cooperation by States directly or, as appropriate, through the relevant subregional and regional organizations, and by other international organizations, including the Food and Agriculture Organization of the United Nations through its FishCode programme, including through financial and/or technical assistance, in accordance with the Agreement, the Compliance Agreement, the Code and its associated international plans of action, to increase the capacity of developing States to achieve the goals and implement the actions called for in the present resolution;",
    "260": "Welcomes the ongoing work of the Food and Agriculture Organization of the United Nations in developing guidance on, and assisting in the implementation of, the strategies and measures required for the creation of an enabling environment for sustainable small-scale fisheries, and encourages studies for creating possible alternative livelihoods for coastal communities;",
    "261": "",
    "262": "Also recalls that, in \u201cThe future we want\u201d, States urged the identification and mainstreaming by 2014 of strategies that further assist developing countries, in particular the least developed countries and small island developing States, in developing their national capacity to conserve, sustainably manage and realize the benefits of sustainable fisheries, including through improved market access for fish products from developing countries;",
    "263": "Encourages increased capacity-building and technical assistance by States, international financial institutions and relevant intergovernmental organizations and bodies for fishers, in particular small-scale and artisanal fishers, in developing countries, and in particular small island developing States, consistent with environmental sustainability, in recognition of the fact that food security and livelihoods may depend on fisheries;",
    "264": "Encourages States to strengthen international cooperation to assist developing countries in developing and implementing new sustainable aquaculture development strategies, which contributes to ensuring food security, nutrition, livelihoods, adaptation to climate change and the promotion of poverty reduction and eradication;",
    "265": "Also encourages States to cooperate closely, directly or through the United Nations system, including the Food and Agriculture Organization of the United Nations, with a view to enhancing the capacity-building of developing States, including coastal States, in particular small island developing States, in the field of fisheries and aquaculture through education and training;",
    "266": "Recognizes, in this regard, the work of the United Nations University Fisheries Training Programme in Iceland and its contribution to training for developing States, in particular small island developing States, and emphasizes the need for the continuation and strengthening of this training for developing States;",
    "267": "Acknowledges the continuous efforts of the Food and Agriculture Organization of the United Nations to provide learning opportunities through free e\u2011learning courses on a variety of topics, including: port State measures to combat illegal, unreported and unregulated fishing; climate change adaptation and mitigation in fisheries and aquaculture; food loss and waste in fish value chains; the fisheries performance assessment toolkit; securing sustainable small-scale fisheries; and the ecosystem approach to fisheries, with the overall goal of strengthening the capacity of countries to implement the 2030 Agenda for Sustainable Development;",
    "268": "Notes that the Committee on Fisheries, at its thirty-sixth session, recognized the importance of the Blue Ports Initiative of the Food and Agriculture Organization of the United Nations in fostering regional cooperation between associated fishing ports, as well as its invitation to the Food and Agriculture Organization of the United Nations and its members to strengthen this cooperation;",
    "269": "",
    "270": "Welcomes, in accordance with the decisions taken by the parties to the Agreement on Port State Measures to Prevent, Deter and Eliminate Illegal, Unreported and Unregulated Fishing at their meetings, the establishment by the Food and Agriculture Organization of the United Nations of a trust fund under Part 6 of that Agreement to assist developing States parties, in particular the least developed among them and small island developing States parties, in the implementation of that Agreement, and the reiterated call by the parties to make the multilateral-partner Port State Measures Agreement Part 6 trust fund administered by the Food and Agriculture Organization of the United Nations operational, and invites States, intergovernmental organizations, international financial institutions, regional economic integration organizations, national institutions, non\u2011governmental organizations, foundations as well as natural and juridical persons to consider making voluntary financial contributions to the fund;",
    "271": "Requests distant-water fishing nations, when negotiating access agreements and arrangements with developing coastal States, to do so on an equitable and sustainable basis and to take into account their legitimate expectation to fully benefit from the sustainable use of the natural resources of their exclusive economic zones, to ensure that vessels flying their flag comply with the laws and regulations of the developing coastal States adopted in accordance with international law and to give greater attention to fish processing and fish-processing facilities within the national jurisdiction of the developing coastal State to assist in the realization of the benefits from the development of fisheries resources and also to the transfer of technology and assistance for monitoring, control and surveillance and compliance and enforcement within areas under the national jurisdiction of the developing coastal State providing fisheries access, taking into account the forms of cooperation set out in article 25 of the Agreement and article 5 of the Code;",
    "272": "Encourages, in this regard, greater transparency regarding fisheries access agreements, including by making them publicly available, subject to confidentiality requirements;",
    "273": "Encourages States, individually and through regional fisheries management organizations and arrangements, to provide greater assistance and to promote coherence in such assistance for developing States in designing, establishing and implementing relevant agreements, instruments and tools for the conservation and sustainable management of fish stocks, including in designing and strengthening their domestic regulatory fisheries policies and those of regional fisheries management organizations or arrangements in their regions, and the enhancement of research and scientific capabilities through existing funds, such as the Assistance Fund under Part VII of the Agreement, bilateral assistance, regional fisheries management organizations and arrangements assistance funds, the FishCode programme, the World Bank\u2019s global programme on fisheries and the Global Environment Facility;",
    "274": "Calls upon States to promote, through continuing dialogue and the assistance and cooperation provided in accordance with articles 24 to 26 of the Agreement, further ratifications of or accessions to the Agreement by seeking to address, inter alia, the issue of lack of capacity and resources that might stand in the way of developing States becoming parties;",
    "275": "",
    "276": "Urges States and regional economic integration organizations, individually and through regional fisheries management organizations and arrangements, to mainstream efforts to assist developing States, in particular the least developed countries and small island developing States, with other relevant international development strategies with a view to enhancing international coordination to enable them to develop their national capacity to exploit fishery resources, consistent with the duty to ensure the conservation and management of those resources, and in this regard requests the Secretary-General to fully mobilize and coordinate the agencies, funds and programmes of the United Nations system, including at the level of the regional economic commissions, within their respective mandates;",
    "277": "Requests States and regional fisheries management organizations to develop strategies to further assist developing States, in particular the least developed countries and small island developing States, in fully realizing the benefits from the catch of straddling fish stocks and highly migratory fish stocks and in strengthening regional efforts to sustainably conserve and manage such stocks and, in this regard, to make available such information; XII Cooperation within the United Nations system",
    "278": "Requests the relevant parts of the United Nations system, international financial institutions and donor agencies to support increased enforcement and compliance capabilities for regional fisheries management organizations and their member States;",
    "279": "Invites the Food and Agriculture Organization of the United Nations to continue its cooperative arrangements with United Nations agencies on the implementation of the international plans of action; XIII Activities of the Division for Ocean Affairs and the Law of the Sea",
    "280": "Expresses its appreciation to the Secretary-General for the activities of the Division, which reflect the high standard of assistance provided to Member States by the Division;",
    "281": "Requests the Secretary-General to continue to carry out the responsibilities and functions entrusted to him by the Convention, the Agreement and the related resolutions of the General Assembly and to ensure the allocation of appropriate resources to the Division for the performance of its activities under the approved budget for the Organization; XIV Eightieth session of the General Assembly",
    "282": "Requests the Secretary-General to bring the present resolution to the attention of all States, relevant intergovernmental organizations, the organizations and bodies of the United Nations system, subregional and regional fisheries management organizations and relevant non\u2011governmental organizations;",
    "283": " inclusion in the text of the resolution to the Coordinator of the informal consultations no later than five weeks before the start of the consultations;",
    "284": "Decides to include in the provisional agenda of its eightieth session, under the item entitled \u201cOceans and the law of the sea\u201d, the sub-item entitled \u201cSustainable fisheries, including through the 1995 Agreement for the Implementation of the Provisions of the United Nations Convention on the Law of the Sea of 10 December 1982 relating to the Conservation and Management of Straddling Fish Stocks and Highly Migratory Fish Stocks, and related instruments\u201d, and to consider the possibility of including this sub-item in future provisional agendas on a biennial basis."
  },
  "agenda_items": [
    "Item 75"
  ],
  "symbol_references": [
    "A/79/L.38"
  ]
}