{
  "symbol": "A/RES/72/129",
  "filename": "A_RES_72_129.pdf",
  "title": "72/129. Moderation",
  "text": "United Nations \nA/RES/72/129\n \n \nGeneral Assembly \nDistr.: General \n15 January 2018 \n \n17-22296 (E)    180118     \n*1722296* \n \n \nSeventy-second session \nAgenda item 15 \n \n \n \n \n Resolution adopted by the General Assembly on \n8 December 2017 \n \n \n \n \n[without reference to a Main Committee (A/72/L.21 and A/72/L.21/Add.1)] \n \n \n 72/129. Moderation \n \n \n \nThe General Assembly, \n \nGuided by the purposes and principles of the Charter of the United Nations, \n \nRecalling its resolutions 39/11 of 12 November 1984, 53/243 A and B of \n13 September 1999, 64/14 of 10 November 2009, 67/173 of 20 December 2012, \n69/140 of 15 December 2014, 70/109 of 10 December 2015 and 71/249 of \n22 December 2016, \n \nReaffirming its resolutions 53/199 of 15 December 1998 and 61/185 of \n20 December 2006 on the proclamation of international years and Economic and \nSocial Council resolution 1980/67 of 25 July 1980 on international years and \nanniversaries, in particular paragraphs 1 to 10 of the annex thereto on the agreed \ncriteria for the proclamation of international years, as well as paragraphs 13 and 14, \nin which it is stated that an international day or year should not be proclaimed before \nthe basic arrangements for its organization and financing have been made, \n \nRecalling Security Council resolution 2354 (2017) of 24 May 2017, in which \nthe Council welcomed the comprehensive international framework to counter terrorist \nnarratives1 and stressed, inter alia, that terrorism in all forms and manifestations \nconstituted one of the most serious threats to international peace and security and that \nall measures taken by Member States to counter terrorism, including to counter \nterrorist narratives, must comply with their obligations under international law, \nincluding international human rights law, international refugee law and international \nhumanitarian law, \n \nRecognizing that moderation is an important value and approach to countering \nviolent extremism as and when conducive to terrorism and to promoting dialogue, \nmutual respect and understanding,  \n__________________ \n \n1  S/2017/375, annex. \n\nA/RES/72/129 \nModeration\n \n17-22296 \n2/2 \n \n \nAcknowledging that the approach of moderation could reinforce the \nadvancement of the three pillars of the United Nations, namely, peace and security, \ndevelopment and human rights, \n \nRecognizing the importance of inclusion, mutual respect, tolerance and \nunderstanding, of choosing negotiations over confrontation and of working together \nin order to build a more secure and peaceful world,  \n \nWelcoming the efforts and relevant initiatives at the local, national, regional and \ninternational levels in promoting moderation and fostering greater inclusion, respect \nfor diversity, understanding, tolerance and cooperation among peoples of different \ncultures, religions and beliefs, \n \n1. \nUnderlines the importance of moderation as an approach within societies \nfor countering extremism in all its aspects and for further contributing to the \npromotion of dialogue, tolerance, understanding and cooperation, and encourages \nefforts, as appropriate, to enable voices of moderation to work together in order to \nbuild a more secure, inclusive and peaceful world;  \n \n2. \nCalls upon the international community to continue to promote \nmoderation as a value that promotes peace, security and development;  \n \n3. \nAlso calls upon the international community to support the Global \nMovement of Moderates initiative as a common platform to amplify the voices of \nmoderation over those of violent extremism as and when conducive to terrorism;  \n \n4. \nCalls upon States Members of the United Nations to undertake initiatives \nto promote moderation through such activities as outreach programmes and cross-\ncultural dialogue and to promote the value of moderation, including non-violence, \nmutual respect and understanding, through education, recalls in this regard the \nimportance of human rights education and training in contributing to the promotion, \nprotection and effective realization of human rights, and encourages discourse and \nthe sharing of best practices to amplify the voices of moderates and allow them to \nprevail; \n \n5. \nDecides to proclaim 2019 the International Year of Moderation in an effort \nto amplify the voices of moderation through the promotion of dialogue, tolerance, \nunderstanding and cooperation; \n \n6. \nInvites the United Nations Alliance of Civilizations to facilitate the \nobservance of the International Year of Moderation in collaboration with other \nrelevant organizations, bearing in mind that the cost of all activities that may arise \nfrom the implementation of the present resolution should be met from voluntary \ncontributions. \n \n68th plenary meeting  \n8 December 2017 \n \n",
  "paragraphs": {
    "1": "Underlines the importance of moderation as an approach within societies for countering extremism in all its aspects and for further contributing to the promotion of dialogue, tolerance, understanding and cooperation, and encourages efforts, as appropriate, to enable voices of moderation to work together in order to build a more secure, inclusive and peaceful world;",
    "2": "Calls upon the international community to continue to promote moderation as a value that promotes peace, security and development;",
    "3": "Also calls upon the international community to support the Global Movement of Moderates initiative as a common platform to amplify the voices of moderation over those of violent extremism as and when conducive to terrorism;",
    "4": "Calls upon States Members of the United Nations to undertake initiatives to promote moderation through such activities as outreach programmes and cross- cultural dialogue and to promote the value of moderation, including non-violence, mutual respect and understanding, through education, recalls in this regard the importance of human rights education and training in contributing to the promotion, protection and effective realization of human rights, and encourages discourse and the sharing of best practices to amplify the voices of moderates and allow them to prevail;",
    "5": "Decides to proclaim 2019 the International Year of Moderation in an effort to amplify the voices of moderation through the promotion of dialogue, tolerance, understanding and cooperation;",
    "6": "Invites the United Nations Alliance of Civilizations to facilitate the observance of the International Year of Moderation in collaboration with other relevant organizations, bearing in mind that the cost of all activities that may arise from the implementation of the present resolution should be met from voluntary contributions."
  },
  "agenda_items": [
    "Item 15"
  ],
  "symbol_references": [
    "A/72/L.21"
  ]
}