{
  "symbol": "A/RES/76/270",
  "filename": "A_RES_76_270.pdf",
  "title": "76/270. Interaction between the United Nations, national parliaments and the Inter-Parliamentary Union",
  "text": "United Nations \nA/RES/76/270\n \n \nGeneral Assembly \nDistr.: General \n24 June 2022 \n \n22-09842 (E)    290622 \n*2209842* \n \n \nSeventy-sixth session \nAgenda item 128 \nInteraction between the United Nations, national \nparliaments and the Inter-Parliamentary Union \n \n \n \n \n Resolution adopted by the General Assembly \non 21 June 2022 \n \n \n \n \n[without reference to a Main Committee (A/76/L.63 and A/76/L.63/Add.1)] \n \n \n 76/270. Interaction between the United Nations, national parliaments and \nthe Inter-Parliamentary Union \n \n \n \nThe General Assembly, \n \nRecalling the 2005 World Summit Outcome, 1 in which Heads of State and \nGovernment resolved to strengthen further cooperation between the United Nations \nand national parliaments through their world organization, the Inter-Parliamentary \nUnion, in all fields of the work of the United Nations, \n \nRecalling also its resolution 57/32 of 19 November 2002, in which the \nInter-Parliamentary Union was invited to participate in the work of the General \nAssembly in the capacity of observer, and recalling further its resolution 72/278 of \n22 May 2018, in which the Assembly, inter alia, decided to strengthen the modalities \nof the cooperation between United Nations entities and the global parliamentary \ncommunity, \n \nTaking into consideration the Cooperation Agreement between the United \nNations and the Inter-Parliamentary Union of 1996,2 which laid the foundation for \ncooperation between the two organizations, and recalling the revised Cooperation \nAgreement of 2016, \n \nTaking note of the resolutions adopted by the Inter-Parliamentary Union, as well \nas the many activities undertaken by that organization in support of the United \nNations, \n \nNoting the outcomes of the World Conferences of Speakers of Parliament held \nin 2000, 2005, 2010 and 2015, and in 2021 (preceded by a virtual segment in 2020), \nwhich affirm the commitment of national parliaments and the Inter-Parliamentary \n__________________ \n \n1 Resolution 60/1. \n \n2 A/51/402, annex. \n\nA/RES/76/270 \nInteraction between the United Nations, national \nparliaments and the Inter-Parliamentary Union\n \n22-09842\n2/6 \n \nUnion to support the work of the United Nations, strengthen multilateralism and \ncontinue efforts to bridge the democracy gap in international relations, \n \nRecognizing that the coronavirus disease (COVID-19) pandemic continues to \nrequire a global response based on unity, solidarity and renewed multilateral \ncooperation that is people-centred, and acknowledging the important role of the \nUnited Nations system and the key leadership role of the World Health Organization \nin this regard, as well as the role of national parliaments and the Inter-Parliamentary \nUnion, \n \nWelcoming the annual parliamentary hearings at the United Nations, as well as \nother specialized parliamentary meetings organized by the Inter-Parliamentary Union \nin cooperation with the United Nations to correspond to major United Nations \nconferences and events, \n \nRecognizing the work of the Inter-Parliamentary Union in mobilizing \nparliamentary action towards the implementation of the 2030 Agenda for Sustainable \nDevelopment,3 the Addis Ababa Action Agenda of the Third International Conference \non Financing for Development,4 the Sendai Framework for Disaster Risk Reduction \n2015\u20132030, 5  the Paris Agreement adopted under the United Nations Framework \nConvention on Climate Change 6  and the Beijing Declaration and Platform for \nAction,7 \n \nRecognizing also the work of the Inter-Parliamentary Union Standing \nCommittee on United Nations Affairs to provide a platform for regular interaction \nbetween parliamentarians and United Nations officials, including on the 2030 Agenda, \nreview implementation of international commitments and facilitate closer ties between \nthe United Nations country teams and national parliaments, \n \nRecognizing further the work of the Inter-Parliamentary Union in the areas of \ndemocracy and the rule of law, human rights, gender equality, the empowerment of \nall women and girls and eliminating all forms of violence against women and girls, \nyouth \nempowerment, \npeace \nand \nsecurity, \ndisarmament, \nnon-proliferation, \nhumanitarian assistance, sustainable development, poverty eradication, food security \nand nutrition, climate change, health, and interfaith and inter-ethnic dialogue, as well \nas countering and preventing terrorism and violent extremism as and when conducive \nto terrorism, \n \nDeeply concerned about all acts of sexual and gender-based violence, including \nsexual harassment, in political and in public life, including in digital contexts, as well \nas in parliaments and in leadership positions, and recognizing the work of the \nInter-Parliamentary Union in combating such violence, \n \nHighlighting the importance of women\u2019s full, equal and meaningful participation \nin parliaments, including in leadership positions and in decision-making at all levels, \nand the importance for parliaments to mainstream a gender perspective in their work, \n \nRecognizing multi-stakeholder efforts towards the achievement of gender \nequality and the empowerment of all women and girls, as well as the realization of \ntheir human rights, noting all relevant international, regional and national initiatives \nin this regard, and recognizing the participation of the Inter-Parliamentary Union in \nsuch initiatives, \n__________________ \n \n3 Resolution 70/1. \n \n4 Resolution 69/313, annex. \n \n5 Resolution 69/283, annex II. \n \n6 See FCCC/CP/2015/10/Add.1, decision 1/CP.21, annex. \n \n7 Report of the Fourth World Conference on Women, Beijing, 4\u201315 September 1995 (United \nNations publication, Sales No. E.96.IV.13), chap. I, resolution 1, annexes I and II. \n\nInteraction between the United Nations, national  \nparliaments and the Inter-Parliamentary Union \nA/RES/76/270\n \n3/6\n22-09842 \n \n \nRecognizing and affirming that the global fight against racism, racial \ndiscrimination, xenophobia and related intolerance and all their abhorrent and \ncontemporary forms and manifestations is a matter of priority for the international \ncommunity, and recalling the launch of the United Nations Strategy and Plan of \nAction on Hate Speech in June 2019, \n \nInviting, in this regard, the Inter-Parliamentary Union to observe, in \ncollaboration with other relevant organizations, the international days aimed at \neliminating all forms of discrimination, addressing and countering hate speech and \npromoting interreligious and intercultural dialogue and the values of living together \nin peace, \n \nReaffirming the collective commitment to the purposes and principles of the \nCharter of the United Nations, calling for a reinvigorated multilateralism, and \nrecognizing the outcome of the fifth World Conference of Speakers of Parliament, \nwhich expresses support for a reinvigorated United Nations system and for effective \nmultilateral solutions to current global challenges, \n \nMindful that rapid technological change includes new and powerful tools that \ncan help to realize the vision of the 2030 Agenda, and that the spread of information \nand communications technologies and global interconnectedness has great potential to \naccelerate human development and bridge all digital divides, among and within \ncountries, including the gender digital divide, and recognizing that national \nparliaments, among others, play an important role in addressing the impact, \nopportunities and challenges of rapid technological change, \n \nRecognizing the efforts and the potential of the Technology Bank for the Least \nDeveloped Countries in helping those countries to implement the 2030 Agenda through \nstrengthening their science, technology and innovation capacity, and acknowledging the \nimportant role of parliaments in developing strategies in these areas as well as \noverseeing their implementation, \n \nNoting the work carried out upon the request of Member States by agencies and \nprogrammes of the United Nations system, including the United Nations Sustainable \nDevelopment Group, in support of national parliaments around the world, \n \nAcknowledging the role and responsibility of national parliaments in regard to \nnational plans and strategies, as well as in ensuring greater transparency and \naccountability at both the national and the global levels, \n \n1. \nWelcomes the actions taken by the Inter-Parliamentary Union to continue \nto pursue a more systematic and meaningful engagement with the United Nations, \nand encourages both organizations to enhance their cooperation in meeting their \ncommon objectives; \n \n2. \nEncourages the United Nations and the Inter-Parliamentary Union to \ncontinue to work closely in various fields, including the three dimensions of \nsustainable development \u2013 the economic, social and environmental \u2013 peacebuilding \nand sustaining peace, countering and preventing terrorism and violent extremism as \nand when conducive to terrorism, international law, human rights and fundamental \nfreedoms, combating racism, racial discrimination, xenophobia and related \nintolerance, promoting gender equality and the empowerment of all women and girls, \nyouth empowerment, democracy and good governance, poverty eradication, \ninformation and communications technologies, health, international migration, \nclimate change, biodiversity, disaster risk reduction, capacity-building and financing \nfor development; \n\nA/RES/76/270 \nInteraction between the United Nations, national \nparliaments and the Inter-Parliamentary Union\n \n22-09842\n4/6 \n \n \n3. \nAlso encourages the United Nations and the Inter-Parliamentary Union to \nstrengthen cooperation by engaging parliamentarians in efforts to maintain support \nfor the implementation of relevant United Nations agreements and resolutions; \n \n4. \nEncourages the continued active involvement of the Inter-Parliamentary \nUnion in promoting the enhanced contribution of parliaments at the national, regional \nand global levels, including through multi-stakeholder partnerships, in support of the \naccelerated implementation and achievement of the Sustainable Development Goals \nby 2030; \n \n5. \nInvites parliaments and Governments to support the Technology Bank for \nthe Least Developed Countries in its efforts towards bridging digital divides, and \nencourages the Inter-Parliamentary Union to facilitate inter-parliamentary dialogue \non the role of science and technology in the implementation of the 2030 Agenda for \nSustainable Development; \n \n6. \nCalls upon Member States, including their national parliaments, supported \nupon their request by the United Nations and the Inter-Parliamentary Union, and other \nrelevant stakeholders to further enhance coordination, as appropriate, so that their \nresponses to the COVID-19 pandemic are people-centred and provide equal access, \nwithout discrimination of any kind, to safe, effective, affordable and quality essential \nmedicines, vaccines, testing and diagnostics, personal protective equipment and \nmedical equipment as may be required to effectively address COVID-19, ensuring \nthat women and girls are not disproportionately affected; \n \n7. \nWelcomes the efforts of the Inter-Parliamentary Union to work with \nnational parliaments to further accelerate climate action, as noted most recently in the \nNusa Dua Declaration of 24 March 2022 entitled \u201cGetting to zero: mobilizing \nparliaments to act on climate change\u201d, and encourages the secretariat of the United \nNations Framework Convention on Climate Change to engage closely with the \nInter-Parliamentary Union in this area, as appropriate; \n \n8. \nAlso welcomes the efforts of the Inter-Parliamentary Union to promote \nuniversal health coverage and to address public health emergencies, such as the \nCOVID-19 pandemic, and invites the World Health Organization, as the United \nNations specialized agency for health, and other relevant agencies, funds and \nprogrammes of the United Nations system to enhance cooperation with the \nInter-Parliamentary Union in this regard; \n \n9. \nNotes the contribution of the fifth World Conference of Speakers of \nParliament, organized by the Inter-Parliamentary Union in close cooperation with the \nUnited Nations, entitled \u201cParliamentary leadership for more effective multilateralism \nthat delivers peace and sustainable development for the people and planet\u201d, to the \nhigh-level meeting of the General Assembly on the occasion of the seventy-fifth \nanniversary of the United Nations in September 2020; \n \n10. Welcomes the practice of including parliamentarians as members of \nnational delegations to major United Nations meetings and events, as appropriate, and \ninvites Member States to continue this practice in a more regular and systematic \nmanner, and with due consideration given to achieving gender balance within such \ndelegations; \n \n11. \nInvites Member States to further consider ways to work regularly with the \nInter-Parliamentary Union in facilitating a parliamentary component to major United \nNations conferences so as to help to inform such deliberations from a parliamentary \nperspective; \n \n12. Encourages Member States to further extend the practice of holding \nparliamentary meetings in conjunction with major United Nations conferences and \n\nInteraction between the United Nations, national  \nparliaments and the Inter-Parliamentary Union \nA/RES/76/270\n \n5/6\n22-09842 \n \nprocesses, with a view to including the outcome of these parliamentary meetings as a \nformal contribution to the respective United Nations processes; \n \n13. Welcomes \nthe \nenhanced \ncontribution \nof \nparliaments \nand \nthe \nInter-Parliamentary Union to the work of the Human Rights Council and the human \nrights treaty bodies, and encourages parliaments to strengthen their role in the \npromotion and protection of human rights, with a view to translating international \ncommitments into national policies and laws; \n \n14. Encourages the United Nations Entity for Gender Equality and the \nEmpowerment of Women (UN-Women) and other relevant bodies of the United \nNations system to work closely with national parliaments and the Inter-Parliamentary \nUnion in accordance with their respective mandates and, upon request, in such areas \nas gender equality and the empowerment of women, including in conflict prevention \nand peace processes, institutional gender mainstreaming, support to parliaments in \npromoting gender-sensitive legislation, increasing the representation and full, equal \nand meaningful participation of women in parliaments, combating violence against \nwomen, including women in politics, and implementing relevant United Nations \nresolutions; \n \n15. Welcomes the contributions of the Inter-Parliamentary Union to the high-\nlevel political forum on sustainable development through the participation of \nparliamentarians, in convening a parliamentary event on the work of parliaments to \ninstitutionalize the Sustainable Development Goals, as well as through its efforts to \nencourage parliaments to engage in the voluntary national reviews of participating \ncountries; \n \n16. Invites the Inter-Parliamentary Union and the relevant bodies of the United \nNations system to continue and enhance their cooperation in supporting Governments \nin facilitating the orderly, safe, regular and responsible migration and mobility of \npeople, including through the implementation of planned and well-managed \nmigration policies, and recalls the contribution of the Inter-Parliamentary Union in \nthe follow-up process for the Global Compact for Safe, Orderly and Regular \nMigration;8 \n \n17. Welcomes the joint activities carried out by the Inter-Parliamentary Union, \nthe United Nations Office on Drugs and Crime and the Office of Counter-Terrorism \naimed at mobilizing parliamentary action to combat terrorism and violent extremism \nas and when conducive to terrorism, develop relevant good practices and counter-\nterrorism legislation, and support the victims of terrorism, in accordance with national \ncontext and International law; \n \n18. Encourages the United Nations and the Inter-Parliamentary Union to \ndevelop closer cooperation with parliaments at the national and regional levels, \nincluding in terms of strengthening parliamentary capacities, inter alia, in regard to \nthe allocation of budgetary resources for the implementation of the 2030 Agenda, as \nappropriate, in reinforcing the rule of law and helping to align national legislation \nwith international commitments, and to facilitate, within existing resources, greater \nSouth-South and triangular cooperation between parliaments and parliamentarians; \n \n19. Encourages the United Nations to work with Member States, upon their \nrequest, to strengthen the institutional capacity of national parliaments through \ntechnical support, legal analysis, specific advice, training, monitoring and evaluation \nin all relevant areas; \n \n20. Recognizes that the contributions of young people are important for the \nfull and successful implementation of the 2030 Agenda, and urges Member States and \n__________________ \n \n8  Resolution 73/195, annex. \n\nA/RES/76/270 \nInteraction between the United Nations, national \nparliaments and the Inter-Parliamentary Union\n \n22-09842\n6/6 \n \nUnited Nations entities, in consultation with youth, youth-led and youth-focused and \nyoung women\u2019s organizations, to explore and promote concrete new avenues for the \nfull, effective, structured, increased and sustainable participation of young people, \nyouth-led and young women\u2019s organizations in relevant decision-making processes \nand monitoring, in all spheres of political, economic, social and cultural life, \nincluding in designing and implementing policies, programmes and initiatives, in \nparticular when implementing the 2030 Agenda; \n \n21. Takes note of the Common Principles for Support to Parliaments pioneered \nby the Inter-Parliamentary Union and the United Nations Development Programme \nand endorsed by 143 national parliaments, 8 parliamentary assemblies and 20 partner \norganizations with a view to further strengthening the capacity of parliaments to \nperform their functions; \n \n22. Calls upon United Nations country teams to develop, within their \nmandates and at the request of national authorities, a more structured and integrated \nmanner of working with national parliaments, through appropriate mechanisms, inter \nalia, by involving parliaments in consultations on national development strategies and \non development aid effectiveness, where applicable; \n \n23. Calls upon United Nations entities to avail themselves more systematically \nof the unique expertise of the Inter-Parliamentary Union and its member parliaments \nin strengthening parliamentary institutions, particularly in countries emerging from \nconflict and/or in transition to democracy; \n \n24. Encourages the Secretary-General to include members of parliament, \nparticularly from the developing countries, in multi-stakeholder high-level advisory \ngroups as well as in mediation teams and other such exercises where a multiplicity of \nperspectives can help to ensure fair and lasting solutions to specific challenges; \n \n25. Calls for regular annual exchanges and meetings at both the political and \nthe operational levels between senior officials of the United Nations and of the \nInter-Parliamentary Union, with a view to building greater coherence in the work of \nthe two organizations and helping to forge a more robust strategic partnership \nbetween them; \n \n26. Encourages the United Nations system to reflect more systematically the \nrole and contribution of parliaments in its reports and draft strategic plans; \n \n27. Recalls the decision to observe 30 June of each year as the International \nDay of Parliamentarism, and invites all Member States, national parliaments, \norganizations of the United Nations system and other relevant international \norganizations, civil society, including non-governmental organizations, and all other \nrelevant stakeholders to observe the Day and to promote awareness of it, while \nstressing that the cost of all activities that may arise from the observance of the Day \nby the United Nations should be met from voluntary contributions; \n \n28. Takes note of the report of the Secretary-General,9 and requests that he \nsubmit to the General Assembly at its seventy-ninth session a report under the item \nentitled \u201cInteraction between the United Nations, national parliaments and the \nInter-Parliamentary Union\u201d with a special focus on the implementation of the shared \nglobal objectives of United Nations entities and the Inter-Parliamentary Union, \nincluding best practices and contributions of Member States, national parliaments, \nthe United Nations and the Inter-Parliamentary Union to increase the representation \nand participation of women in parliaments. \n \n85th plenary meeting \n21 June 2022 \n__________________ \n \n9 A/76/780. \n",
  "paragraphs": {
    "1": "Welcomes the actions taken by the Inter-Parliamentary Union to continue to pursue a more systematic and meaningful engagement with the United Nations, and encourages both organizations to enhance their cooperation in meeting their common objectives;",
    "2": "Encourages the United Nations and the Inter-Parliamentary Union to continue to work closely in various fields, including the three dimensions of sustainable development \u2013 the economic, social and environmental \u2013 peacebuilding and sustaining peace, countering and preventing terrorism and violent extremism as and when conducive to terrorism, international law, human rights and fundamental freedoms, combating racism, racial discrimination, xenophobia and related intolerance, promoting gender equality and the empowerment of all women and girls, youth empowerment, democracy and good governance, poverty eradication, information and communications technologies, health, international migration, climate change, biodiversity, disaster risk reduction, capacity-building and financing for development; A/RES/76/270 Interaction between the United Nations, national parliaments and the Inter-Parliamentary Union 22-09842 4/6",
    "3": "Also encourages the United Nations and the Inter-Parliamentary Union to strengthen cooperation by engaging parliamentarians in efforts to maintain support for the implementation of relevant United Nations agreements and resolutions;",
    "4": "Encourages the continued active involvement of the Inter-Parliamentary Union in promoting the enhanced contribution of parliaments at the national, regional and global levels, including through multi-stakeholder partnerships, in support of the accelerated implementation and achievement of the Sustainable Development Goals by 2030;",
    "5": "Invites parliaments and Governments to support the Technology Bank for the Least Developed Countries in its efforts towards bridging digital divides, and encourages the Inter-Parliamentary Union to facilitate inter-parliamentary dialogue on the role of science and technology in the implementation of the 2030 Agenda for Sustainable Development;",
    "6": "Calls upon Member States, including their national parliaments, supported upon their request by the United Nations and the Inter-Parliamentary Union, and other relevant stakeholders to further enhance coordination, as appropriate, so that their responses to the COVID-19 pandemic are people-centred and provide equal access, without discrimination of any kind, to safe, effective, affordable and quality essential medicines, vaccines, testing and diagnostics, personal protective equipment and medical equipment as may be required to effectively address COVID-19, ensuring that women and girls are not disproportionately affected;",
    "7": "Welcomes the efforts of the Inter-Parliamentary Union to work with national parliaments to further accelerate climate action, as noted most recently in the Nusa Dua Declaration of 24 March 2022 entitled \u201cGetting to zero: mobilizing parliaments to act on climate change\u201d, and encourages the secretariat of the United Nations Framework Convention on Climate Change to engage closely with the Inter-Parliamentary Union in this area, as appropriate;",
    "8": "Also welcomes the efforts of the Inter-Parliamentary Union to promote universal health coverage and to address public health emergencies, such as the COVID-19 pandemic, and invites the World Health Organization, as the United Nations specialized agency for health, and other relevant agencies, funds and programmes of the United Nations system to enhance cooperation with the Inter-Parliamentary Union in this regard;",
    "9": "Notes the contribution of the fifth World Conference of Speakers of Parliament, organized by the Inter-Parliamentary Union in close cooperation with the United Nations, entitled \u201cParliamentary leadership for more effective multilateralism that delivers peace and sustainable development for the people and planet\u201d, to the high-level meeting of the General Assembly on the occasion of the seventy-fifth anniversary of the United Nations in September 2020;",
    "10": "Welcomes the practice of including parliamentarians as members of national delegations to major United Nations meetings and events, as appropriate, and invites Member States to continue this practice in a more regular and systematic manner, and with due consideration given to achieving gender balance within such delegations;",
    "11": "Invites Member States to further consider ways to work regularly with the Inter-Parliamentary Union in facilitating a parliamentary component to major United Nations conferences so as to help to inform such deliberations from a parliamentary perspective;",
    "12": "Encourages Member States to further extend the practice of holding parliamentary meetings in conjunction with major United Nations conferences and Interaction between the United Nations, national parliaments and the Inter-Parliamentary Union A/RES/76/270 5/6 22-09842 processes, with a view to including the outcome of these parliamentary meetings as a formal contribution to the respective United Nations processes;",
    "13": "Welcomes the enhanced contribution of parliaments and the Inter-Parliamentary Union to the work of the Human Rights Council and the human rights treaty bodies, and encourages parliaments to strengthen their role in the promotion and protection of human rights, with a view to translating international commitments into national policies and laws;",
    "14": "Encourages the United Nations Entity for Gender Equality and the Empowerment of Women (UN-Women) and other relevant bodies of the United Nations system to work closely with national parliaments and the Inter-Parliamentary Union in accordance with their respective mandates and, upon request, in such areas as gender equality and the empowerment of women, including in conflict prevention and peace processes, institutional gender mainstreaming, support to parliaments in promoting gender-sensitive legislation, increasing the representation and full, equal and meaningful participation of women in parliaments, combating violence against women, including women in politics, and implementing relevant United Nations resolutions;",
    "15": "Welcomes the contributions of the Inter-Parliamentary Union to the high- level political forum on sustainable development through the participation of parliamentarians, in convening a parliamentary event on the work of parliaments to institutionalize the Sustainable Development Goals, as well as through its efforts to encourage parliaments to engage in the voluntary national reviews of participating countries;",
    "16": "Invites the Inter-Parliamentary Union and the relevant bodies of the United Nations system to continue and enhance their cooperation in supporting Governments in facilitating the orderly, safe, regular and responsible migration and mobility of people, including through the implementation of planned and well-managed migration policies, and recalls the contribution of the Inter-Parliamentary Union in the follow-up process for the Global Compact for Safe, Orderly and Regular Migration;8",
    "17": "Welcomes the joint activities carried out by the Inter-Parliamentary Union, the United Nations Office on Drugs and Crime and the Office of Counter-Terrorism aimed at mobilizing parliamentary action to combat terrorism and violent extremism as and when conducive to terrorism, develop relevant good practices and counter- terrorism legislation, and support the victims of terrorism, in accordance with national context and International law;",
    "18": "Encourages the United Nations and the Inter-Parliamentary Union to develop closer cooperation with parliaments at the national and regional levels, including in terms of strengthening parliamentary capacities, inter alia, in regard to the allocation of budgetary resources for the implementation of the 2030 Agenda, as appropriate, in reinforcing the rule of law and helping to align national legislation with international commitments, and to facilitate, within existing resources, greater South-South and triangular cooperation between parliaments and parliamentarians;",
    "19": "Encourages the United Nations to work with Member States, upon their request, to strengthen the institutional capacity of national parliaments through technical support, legal analysis, specific advice, training, monitoring and evaluation in all relevant areas;",
    "20": "Recognizes that the contributions of young people are important for the full and successful implementation of the 2030 Agenda, and urges Member States and __________________ 8 Resolution 73/195, annex. A/RES/76/270 Interaction between the United Nations, national parliaments and the Inter-Parliamentary Union 22-09842 6/6 United Nations entities, in consultation with youth, youth-led and youth-focused and young women\u2019s organizations, to explore and promote concrete new avenues for the full, effective, structured, increased and sustainable participation of young people, youth-led and young women\u2019s organizations in relevant decision-making processes and monitoring, in all spheres of political, economic, social and cultural life, including in designing and implementing policies, programmes and initiatives, in particular when implementing the 2030 Agenda;",
    "21": "Takes note of the Common Principles for Support to Parliaments pioneered by the Inter-Parliamentary Union and the United Nations Development Programme and endorsed by 143 national parliaments, 8 parliamentary assemblies and 20 partner organizations with a view to further strengthening the capacity of parliaments to perform their functions;",
    "22": "Calls upon United Nations country teams to develop, within their mandates and at the request of national authorities, a more structured and integrated manner of working with national parliaments, through appropriate mechanisms, inter alia, by involving parliaments in consultations on national development strategies and on development aid effectiveness, where applicable;",
    "23": "Calls upon United Nations entities to avail themselves more systematically of the unique expertise of the Inter-Parliamentary Union and its member parliaments in strengthening parliamentary institutions, particularly in countries emerging from conflict and/or in transition to democracy;",
    "24": "Encourages the Secretary-General to include members of parliament, particularly from the developing countries, in multi-stakeholder high-level advisory groups as well as in mediation teams and other such exercises where a multiplicity of perspectives can help to ensure fair and lasting solutions to specific challenges;",
    "25": "Calls for regular annual exchanges and meetings at both the political and the operational levels between senior officials of the United Nations and of the Inter-Parliamentary Union, with a view to building greater coherence in the work of the two organizations and helping to forge a more robust strategic partnership between them;",
    "26": "Encourages the United Nations system to reflect more systematically the role and contribution of parliaments in its reports and draft strategic plans;",
    "27": "Recalls the decision to observe 30 June of each year as the International Day of Parliamentarism, and invites all Member States, national parliaments, organizations of the United Nations system and other relevant international organizations, civil society, including non-governmental organizations, and all other relevant stakeholders to observe the Day and to promote awareness of it, while stressing that the cost of all activities that may arise from the observance of the Day by the United Nations should be met from voluntary contributions;",
    "28": "Takes note of the report of the Secretary-General,9 and requests that he submit to the General Assembly at its seventy-ninth session a report under the item entitled \u201cInteraction between the United Nations, national parliaments and the Inter-Parliamentary Union\u201d with a special focus on the implementation of the shared global objectives of United Nations entities and the Inter-Parliamentary Union, including best practices and contributions of Member States, national parliaments, the United Nations and the Inter-Parliamentary Union to increase the representation and participation of women in parliaments. 85th plenary meeting 21 June 2022 __________________ 9 A/76/780."
  },
  "agenda_items": [
    "Item 128"
  ],
  "symbol_references": [
    "A/76/L.63"
  ]
}