{
  "symbol": "A/RES/72/196",
  "filename": "A_RES_72_196.pdf",
  "title": "72/196. Strengthening the United Nations crime prevention and criminal justice programme, in particular its technical cooperation capacity",
  "text": "United Nations \nA/RES/72/196\n \n \nGeneral Assembly \nDistr.: General \n25 January 2018 \n \n17-23196 (E)    300118     \n*1723196* \n \n \nSeventy-second session \nAgenda item 107 \n \n \n \n \n Resolution adopted by the General Assembly \non 19 December 2017 \n \n \n \n \n[on the report of the Third Committee (A/72/440)] \n \n \n 72/196. Strengthening the United Nations crime prevention and criminal \njustice programme, in particular its technical cooperation capacity \n \n \n \nThe General Assembly,  \n \nReaffirming its resolutions 46/152 of 18 December 1991, 60/1 of 16 September \n2005, 67/1 of 19 September 2012, 69/193 and 69/196 of 18 December 2014, 70/178 \nand 70/182 of 17 December 2015 and 71/209 of 19 December 2016,  \n \nReaffirming also its resolutions relating to the urgent need to strengthen \ninternational cooperation and technical assistance in promoting and facilitating the \nratification and implementation of the United Nations Convention against \nTransnational Organized Crime and the Protocols thereto, 1 the Single Convention on \nNarcotic Drugs of 1961 as amended by the 1972 Protocol, 2 the Convention on \nPsychotropic Substances of 1971,3 the United Nations Convention against Illicit \nTraffic in Narcotic Drugs and Psychotropic Substances of 1988, 4 the United Nations \nConvention against Corruption5 and all the international conventions and protocols \nagainst terrorism,  \n \nRecalling the importance of the Doha Declaration on Integrating Crime \nPrevention and Criminal Justice into the Wider United Nations Agenda to Address \nSocial and Economic Challenges and to Promote the Rule of Law at the National and \nInternational Levels, and Public Participation, adopted by the Thirteenth United \nNations Congress on Crime Prevention and Criminal Justice, 6  \n \nWelcoming Economic and Social Council resolution 2017/15 of 6 July 2017 on \nthe follow-up to the Thirteenth United Nations Congress on Crime Prevention and \nCriminal Justice and preparations for the Fourteenth United Nations Congress on \n__________________ \n \n1  United Nations, Treaty Series, vols. 2225, 2237, 2241 and 2326, No. 39574. \n \n2  Ibid., vol. 976, No. 14152. \n \n3  Ibid., vol. 1019, No. 14956. \n \n4  Ibid., vol. 1582, No. 27627. \n \n5  Ibid., vol. 2349, No. 42146. \n \n6  Resolution 70/174, annex. \n\nA/RES/72/196 \nStrengthening the United Nations crime prevention and criminal\njustice programme, in particular its technical cooperation capacity\n \n17-23196 \n2/18 \n \nCrime Prevention and Criminal Justice, and the decision that the main theme of the \nFourteenth Congress should be \u201cAdvancing crime prevention, criminal justice and the \nrule of law: towards the achievement of the 2030 Agenda\u201d,  \n \nExpressing its grave concern about the negative effects of transnational \norganized crime on development, peace, stability and security and human rights, \nabout the increasing vulnerability of States to such crime and about the growing \ndegree of penetration of criminal organizations and their financial and economic \nresources into the economy,  \n \nExpressing concern at the involvement of organized criminal groups, as well as \nthe substantial increase in the volume, rate of transnational occurrence and range of \ncriminal offences related to trafficking in precious metals and stones in some parts of \nthe world, and the potential use of trafficking in precious metals and stones as a source \nof funding for organized crime, other relevant criminal activities and terrorism,  \n \nDeeply concerned about the growing links, in some cases, between forms of \ntransnational organized crime and terrorism, recognizing that countering transnational \norganized crime and terrorism is a common and shared responsibility, and in this \nrespect welcoming Economic and Social Council resolution 2017/17 of 6 July 2017 \non technical assistance for implementing the international conventions and protocols \nrelated to counter-terrorism, \n \nConvinced that the rule of law and development are strongly interrelated and \nmutually reinforcing and that the advancement of the rule of law at the national and \ninternational levels, including through crime prevention and criminal justice \nmechanisms, is essential for sustained and inclusive economic growth and sustainable \ndevelopment and the full realization of all human rights and fundamental freedoms, \nincluding the right to development, and in this respect welcoming the adoption of the \n2030 Agenda for Sustainable Development,7 which, inter alia, includes the \ncommitment to promote peaceful and inclusive societies for sustainable development, \nprovide access to justice for all and build effective, accountable and inclusive \ninstitutions at all levels, and in this respect recalling its resolution 70/299 of 29 July \n2016 on the follow-up and review of the 2030 Agenda for Sustainable Development \nat the global level,  \n \nEmphasizing that transnational organized crime must be addressed with full \nrespect for the principle of the sovereignty of States and in accordance with the rule \nof law as part of a comprehensive response to promote durable solutions through the \npromotion of human rights and more equitable socioeconomic conditions,  \n \nEncouraging Member States to develop and implement, as appropriate, \ncomprehensive crime prevention policies, national and local strategies and action \nplans based on an understanding of the multiple factors that contribute to crime and \nto address such factors in a holistic manner, in close cooperation with all stakeholders, \nincluding civil society, and in this respect stressing that social development and the \npromotion of the rule of law, including the fostering of a culture of lawfulness while \nrespecting cultural identities, in accordance with the Doha Declaration, should be \nintegral elements of strategies to foster crime prevention and economic development \nin all States,  \n \nReaffirming its commitment and strong political will in support of effective, fair, \nhumane and accountable criminal justice systems and the institutions comprising \nthem, encouraging the effective participation and inclusion of all sectors of society, \nthus creating the conditions needed to advance the wider United Nations agenda, and \nrecognizing the responsibility of Member States to uphold human dignity, all human \n__________________ \n \n7  Resolution 70/1. \n\nStrengthening the United Nations crime prevention and criminal \njustice programme, in particular its technical cooperation capacity \nA/RES/72/196\n \n3/18 \n17-23196 \n \nrights and fundamental freedoms for all, in particular for those affected by crime and \nthose who may be in contact with the criminal justice system, including vulnerable \nmembers of society, regardless of their status, who may be subject to multiple and \naggravated forms of discrimination, and to prevent and counter crime motivated by \nintolerance or discrimination of any kind,  \n \nTaking note of resolution 25/2 of 27 May 2016 of the Commission on Crime \nPrevention and Criminal Justice on promoting legal aid, including through a network \nof legal aid providers,8 in which the Commission encouraged Member States to adopt \nor strengthen legislative or other measures to ensure that effective legal aid, including \nfor victims of crime, is provided consistent with their domestic legislation and in line \nwith the United Nations Principles and Guidelines on Access to Legal Aid in Criminal \nJustice Systems,9 and which also contributes to the implementation of the 2030 \nAgenda for Sustainable Development,  \n \nWelcoming the efforts made by some Member States to establish a common \ndocumentation standard as a tool for facilitating both technical interoperability and \naccessibility of legal documentation,  \n \nDeeply concerned about the negative impact of corruption on development and \non the enjoyment of human rights, and recognizing the universal importance of good \ngovernance, transparency, integrity and accountability, thus calling for a zero-\ntolerance approach to corruption and more effective measures to prevent and counter \ncorruption in all its forms, including bribery, as well as measures to prevent the \nlaundering of proceeds of corruption and other forms of crime,  \n \nNoting the holding of the seventh session of the Conference of the States Parties \nto the United Nations Convention against Corruption, in Vienna from 6 to \n10 November 2017, \n \nWelcoming the progress made with regard to the second cycle of the Mechanism \nfor the Review of Implementation of the United Nations Convention against \nCorruption, and stressing the importance of effective implementation of the \nConvention in all its aspects by all States parties,  \n \nBearing in mind that the return of assets is one of the main objectives and a \nfundamental principle of the United Nations Convention against Corruption and that \nthe States parties to the Convention are obligated to afford one another the widest \nmeasure of cooperation and assistance in that regard,  \n \nRecognizing that, thanks to their nearly universal adherence and wide scope of \napplication, the United Nations Convention against Transnational Organized Crime 10 \nand the United Nations Convention against Corruption offer fundamental legal bases \nfor international cooperation to support the investigation and prosecution of crimes \ncovered by those Conventions, including for extradition, mutual legal assistance and \nconfiscation and asset recovery, and that they provide effective mechanisms that \nshould be further implemented and utilized in practice,  \n \nRecognizing also the efforts of the Group of 20 in countering corruption at both \nthe global and the national levels, taking note with appreciation of the anti-corruption \ninitiatives outlined in the Group of 20 Hangzhou Summit communiqu\u00e9, 11 and urging \nthe Group of 20 to continue to engage other States Members of the United Nations \nand the United Nations Office on Drugs and Crime in its work in an inclusive and \n__________________ \n \n8  See Official Records of the Economic and Social Council, 2016, Supplement No. 10 (E/2016/30), \nchap. I, sect. D. \n \n9  Resolution 67/187, annex. \n \n10  United Nations, Treaty Series, vol. 2225, No. 39574. \n11 See A/71/380, annex. \n\nA/RES/72/196 \nStrengthening the United Nations crime prevention and criminal\njustice programme, in particular its technical cooperation capacity\n \n17-23196 \n4/18 \n \ntransparent manner to ensure that Group of 20 initiatives complement or strengthen \nthe work being undertaken by the United Nations system, \n \nStressing the importance of strengthened international cooperation, based on the \nprinciples of shared responsibility and in accordance with international law, to \neffectively address the world drug problem, dismantle illicit networks and counter \ntransnational organized crime, including money-laundering, smuggling of migrants, \ntrafficking in persons, trafficking in arms and other forms of organized crime, all of \nwhich threaten national security and undermine sustainable development and the rule \nof law, and stressing also in this respect the importance of law enforcement \ncooperation and exchange of information, as well as of designated central authorities \nand effective points of contact dedicated to facilitating the procedures related to \ninternational cooperation, including for extradition and mutual legal assistance \nrequests, as well as the importance of the coordinating role of relevant regional \nnetworks, \n \nWelcoming, in this respect, the high-level debate held on 19 June 2017 to \nobserve the twenty-fifth anniversary of the assassination of Judge Giovanni Falcone \nand to support the implementation of the United Nations Convention against \nTransnational Organized Crime and the Protocols thereto, and taking note of the \nsummary of the discussion prepared by the President of the General Assembly and \ntransmitted to the Conference of the Parties to the Convention and to all Member \nStates, \n \nNoting the important contribution that public-private sector cooperation can \nmake in efforts to prevent and combat criminal activities, such as transnational \norganized crime, corruption and terrorism, in particular in the tourism sector,  \n \nReaffirming the commitments made by Member States in the United Nations \nGlobal Counter-Terrorism Strategy, adopted on 8 September 2006,12 and its \nsuccessive biennial reviews, in particular in its resolution 70/291 of 1 July 2016, in \nwhich it encouraged Member States and United Nations entities to strengthen and \nbetter coordinate their actions against terrorism and to prevent and combat violent \nextremism as and when conducive to terrorism, including through technical assistance \nprovided to Member States upon their request, and welcoming in this respect the \nestablishment of the Office of Counter-Terrorism through its resolution 71/291 of \n15 June 2017 on strengthening the capability of the United Nations system to assist \nMember States in implementing the United Nations Global Counter-Terrorism \nStrategy, \n \nHighlighting the importance of its resolutions on measures to eliminate \ninternational terrorism and on the protection of human rights and fundamental \nfreedoms while countering terrorism adopted at its seventy-second session, \n \nRecalling its resolution 71/208 of 19 December 2016 on preventing and \ncombating corrupt practices and the transfer of proceeds of corruption, facilitating \nasset recovery and returning such assets to legitimate owners, in particular to \ncountries of origin, in accordance with the United Nations Convention against \nCorruption, \n \nRecalling also its resolutions 66/177 of 19 December 2011 on strengthening \ninternational cooperation in combating the harmful effects of illicit financial flows \nresulting from criminal activities, in which it urged States parties to the United Nations \nConvention against Illicit Traffic in Narcotic Drugs and Psychotropic Substances of \n1988, the United Nations Convention against Transnational Organized Crime and the \nUnited Nations Convention against Corruption to apply fully the provisions of those \n__________________ \n \n12  Resolution 60/288. \n\nStrengthening the United Nations crime prevention and criminal \njustice programme, in particular its technical cooperation capacity \nA/RES/72/196\n \n5/18 \n17-23196 \n \nConventions, in particular measures to prevent and combat money-laundering, \nincluding by criminalizing the laundering of proceeds of transnational organized \ncrime, as well as measures to enhance national confiscation regimes and international \ncooperation, including in asset recovery, and recalling further its resolution 71/213 of \n21 December 2016, in which, inter alia, it highlighted deep concern about the impact \nof those threats on economic, social and political stability, \n \nExpressing concern that economic resources, such as oil, oil products, modular \nrefineries and related material, other natural resources and other assets become \navailable to organized criminal and terrorist groups,  \n \nTaking into consideration all resolutions of the Commission on Crime \nPrevention and Criminal Justice and the relevant resolutions of the Economic and \nSocial Council, in particular those relating to the strengthening of international \ncooperation, as well as the technical assistance and advisory services of the United \nNations crime prevention and criminal justice programme of the United Nations \nOffice on Drugs and Crime in the fields of crime prevention and criminal justice, \npromotion and reinforcement of the rule of law and reform of criminal justice \ninstitutions, including with regard to the implementation of technical assistance,  \n \nNoting the establishment by the Secretary-General of the United Nations system \ntask force on transnational organized crime and drug trafficking for the purpose of \ndeveloping an effective and comprehensive approach to those crimes within the \nUnited Nations system, and reaffirming the crucial role of Member States in this \nregard, as reflected in the Charter of the United Nations,  \n \nRecognizing the general progress made by the United Nations Office on Drugs \nand Crime in the delivery of advisory services and technical assistance to requesting \nMember States in the areas of crime prevention and criminal justice reform, data and \ninformation analysis, preventing and countering organized crime, corruption, illicit \nfinancial flows, money-laundering, criminal misuse of the Internet and other \ninformation and communications technologies, as well as such misuse for terrorist \npurposes, illicit trafficking in wildlife and timber, trafficking in cultural property, \nkidnapping, smuggling of migrants, organ trafficking, trafficking in persons, \nincluding the support and protection, as appropriate, of victims, their families and \nwitnesses, drug trafficking and terrorism, including progress in tackling the \nphenomenon of foreign terrorist fighters, as well as in the area of international \ncooperation, with special emphasis on extradition and mutual legal assistance and the \ninternational transfer of sentenced persons,  \n \nWelcoming the adoption by the United Nations Office on Drugs and Crime of a \nregional approach to programming, based on continuing consultations and \npartnerships at the national and regional levels, particularly on its implementation, \nand focused on ensuring that the Office responds in a sustainable and coherent manner \nto the priorities of Member States,  \n \nReiterating its concern regarding the overall financial situation of the United \nNations Office on Drugs and Crime, and welcoming the extension of the mandate of \nthe standing open-ended intergovernmental working group on improving the \ngovernance and financial situation of the Office,  \n \nWelcoming resolution 26/3 of 26 May 2017 of the Commission on Crime \nPrevention and Criminal Justice on mainstreaming a gender perspective into crime \nprevention and criminal justice policies and programmes and into efforts to prevent \nand combat transnational organized crime,13  \n__________________ \n \n13  See Official Records of the Economic and Social Council, 2017, Supplement No. 10 (E/2017/30), \nchap. I, sect. D. \n\nA/RES/72/196 \nStrengthening the United Nations crime prevention and criminal\njustice programme, in particular its technical cooperation capacity\n \n17-23196 \n6/18 \n \n \nReaffirming its resolution 71/170 of 19 December 2016, entitled \u201cIntensification \nof efforts to prevent and eliminate all forms of violence against women and girls: \ndomestic violence\u201d, recalling the resolutions of the Commission on Human Rights \nand the Human Rights Council addressing various aspects of violence against women \nand girls of all ages, and recalling also the agreed conclusions adopted by the \nCommission on the Status of Women at its fifty-eighth session, which addressed the \nelimination and prevention of all forms of violence against women and girls, 14  \n \nReiterating its condemnation of all forms of violence against women and girls, \nexpressing deep concern about gender-related killing of women and girls, recalling \nall its relevant resolutions, including resolutions 68/191 of 18 December 2013 and \n70/176 of 17 December 2015 on taking action against gender-related killing of \nwomen and girls, and recognizing the key role of law enforcement and the criminal \njustice system in preventing and responding to gender-related killing of women and \ngirls, including by ending impunity for such crimes,  \n \nNoting the significance of the United Nations Model Strategies and Practical \nMeasures on the Elimination of Violence against Children in the Field of Crime \nPrevention and Criminal Justice15 as a way to assist countries in strengthening their \nnational crime prevention and criminal justice capacities to respond to all forms of \nviolence against women and girls,  \n \nRecalling its resolution 69/194 of 18 December 2014, by which it adopted the \nUnited Nations Model Strategies and Practical Measures on the Elimination of \nViolence against Children in the Field of Crime Prevention and Criminal Justice, \nconvinced of the importance of preventing youth crime, supporting the rehabilitation \nof young offenders and their reintegration into society, protecting in particular child \nvictims of all forms of violence, including those in contact with the law and witnesses, \nincluding efforts to prevent their revictimization, and addressing the needs of children \nof prisoners, stressing that such responses should take into account the human rights \nand best interests of children and young people, consistent with the obligations of the \nStates parties under relevant international instruments, including the Convention on \nthe Rights of the Child16 and the Optional Protocols thereto,17 and noting other \nrelevant United Nations standards and norms in juvenile justice,  \n \nEmphasizing the relevance of international instruments and United Nations \nstandards and norms in crime prevention and criminal justice related to the treatment \nof prisoners, in particular women and juveniles,  \n \nRecalling its resolution 70/146 of 17 December 2015, in which it reaffirmed that \nno one shall be subjected to torture or other cruel, inhuman or degrading treatment or \npunishment,  \n \nStressing the importance of the Code of Conduct for Law Enforcement \nOfficials18 and the Basic Principles on the Use of Force and Firearms by Law \nEnforcement Officials,19 which are voluntary guidelines that emphasize, inter alia, \nefficient and human rights-based policing,  \n \nRecalling its resolution 65/229 of 21 December 2010 on the United Nations \nRules for the Treatment of Women Prisoners and Non-custodial Measures for Women \n__________________ \n \n14  Ibid., 2014, Supplement No. 7 (E/2014/27), chap. I, sect. A. \n \n15  Resolution 69/194, annex. \n \n16  United Nations, Treaty Series, vol. 1577, No. 27531. \n \n17  Ibid., vols. 2171 and 2173, No. 27531; and resolution 66/138, annex. \n \n18  Resolution 34/169, annex. \n \n19  See Eighth United Nations Congress on the Prevention of Crime and the Treatment of Offenders, \nHavana, 27 August\u20137 September 1990: report prepared by the Secretariat (United Nations \npublication, Sales No. E.91.IV.2), chap. I, sect. B. \n\nStrengthening the United Nations crime prevention and criminal \njustice programme, in particular its technical cooperation capacity \nA/RES/72/196\n \n7/18 \n17-23196 \n \nOffenders (the Bangkok Rules), and in this regard encouraging the efforts of Member \nStates to implement the Bangkok Rules,  \n \nWelcoming the adoption, by its resolution 70/175 of 17 December 2015, of the \nrevision to the Standard Minimum Rules for the Treatment of Prisoners, as the United \nNations Standard Minimum Rules for the Treatment of Prisoners (the Nelson Mandela \nRules), and the adoption of Economic and Social Council resolution 2017/16 of 6 July \n2017, in which, inter alia, Member States are encouraged to endeavour to improve \nconditions of imprisonment and to promote the practical application of the Nelson \nMandela Rules as the universally acknowledged and updated minimum standards for \nthe treatment of prisoners, to use the Rules as a guide in the development of prison \nlaws, policies and practices, to continue exchanging good practices and identifying \nchallenges faced in the practical application of the Rules and to share their \nexperiences in dealing with those challenges, \n \nWelcoming also Economic and Social Council resolution 2017/19 of 6 July 2017 \non promoting and encouraging the implementation of alternatives to imprisonment as \npart of comprehensive crime prevention and criminal justice policies,  \n \nReiterating its strong condemnation of trafficking in persons, which constitutes \na serious crime and a grave offence to human dignity and physical integrity, a \nviolation and abuse of human rights and a challenge to sustainable development and \nrequires the implementation of a comprehensive approach that includes measures to \nprevent such trafficking, to punish the traffickers and to protect the victims of such \ntrafficking, and a robust criminal justice response, and recalling in this respect the \nUnited Nations Convention against Transnational Organized Crime and the Protocol \nto Prevent, Suppress and Punish Trafficking in Persons, Especially Women and \nChildren, supplementing the United Nations Convention against Transnational \nOrganized Crime,20 and its resolutions 70/179 of 17 December 2015 and 71/167 of \n19 December 2016,  \n \nRecalling its resolution 71/322 of 8 September 2017 on strengthening and \npromoting effective measures and international cooperation on organ donation and \ntransplantation to prevent and combat trafficking in persons for the purpose of organ \nremoval and trafficking in human organs,  \n \nWelcoming its resolution 72/1 of 27 September 2017, by which it adopted the \npolitical declaration on the implementation of the United Nations Global Plan of \nAction to Combat Trafficking in Persons,  \n \nUnderlining that Member States need to recognize that the crime of smuggling \nof migrants and the crime of trafficking in persons are distinct crimes and require \nseparate and complementary legal, operational and policy responses, and recalling its \nresolutions 69/187 of 18 December 2014 and 70/147 of 17 December 2015, in which \nit called upon all Member States to protect and assist migrants, including migrant \nchildren and adolescents, and Economic and Social Council resolutions 2014/23 of \n16 July 2014 and 2015/23 of 21 July 2015,  \n \nReaffirming its resolution 70/1, in which it, inter alia, committed to taking \nimmediate and effective measures to eradicate forced labour, end modern slavery and \nhuman trafficking and secure the prohibition and elimination of the worst forms of \nchild labour,  \n \nRecalling its resolution 71/1 of 19 September 2016, by which it adopted the \nNew York Declaration for Refugees and Migrants, which addresses the issue of large \nmovements of refugees and migrants,  \n__________________ \n \n20  United Nations, Treaty Series, vol. 2237, No. 39574. \n\nA/RES/72/196 \nStrengthening the United Nations crime prevention and criminal\njustice programme, in particular its technical cooperation capacity\n \n17-23196 \n8/18 \n \n \nWelcoming the work of the United Nations voluntary trust fund for victims of \ntrafficking in persons, especially women and children, established in accordance with \nthe United Nations Global Plan of Action to Combat Trafficking in Persons, adopted \nby its resolution 64/293 of 30 July 2010, as well as the important contribution of the \nSpecial Rapporteur of the Human Rights Council on trafficking in persons, especially \nwomen and children,  \n \nConcerned at the growing involvement of terrorist and organized criminal \ngroups in all forms and aspects of trafficking in cultural property and related offences, \nand alarmed by the destruction of cultural heritage perpetrated recently by terrorist \ngroups, which is linked to trafficking in cultural property in some countries and to \nfinancing of terrorist activities,  \n \nRecognizing the indispensable role of crime prevention and criminal justice \nresponses in combating all forms and aspects of trafficking in cultural property and \nrelated offences in a comprehensive and effective manner, and underlining the \nimportance of the practical assistance tool aimed at supporting the implementation of \nthe International Guidelines for Crime Prevention and Criminal Justice Responses \nwith Respect to Trafficking in Cultural Property and Other Related Offences21 through \nthe Commission on Crime Prevention and Criminal Justice and the implementation \nof resolutions 68/186 of 18 December 2013, 69/196, and 70/76 of 9 December 2015, \nand facilitating operational cooperation against all forms of trafficking in cultural \nproperty, and the request to the United Nations Office on Drugs and Crime to provide \npractical assistance in the implementation of the Guidelines and to facilitate \ncooperation in this area, including in countering the financing of terrorism in \naccordance with resolution 70/177 of 17 December 2015,  \n \nAffirming that the destruction of cultural heritage, which is representative of the \ndiversity of human culture, erases the collective memories of a nation, destabilizes \ncommunities and threatens their cultural identity, and emphasizing the importance of \ncultural diversity and pluralism as well as freedom of religion and belief for achieving \npeace, stability, reconciliation and social cohesion, and recalling in this respect its \nresolution 70/76,  \n \nReaffirming the intrinsic value of biological diversity and its various \ncontributions to sustainable development and human well-being, and recognizing that \nwild fauna and flora in their many beautiful and varied forms are an irreplaceable part \nof the natural systems of the Earth which must be protected for this generation and \nthe generations to come,  \n \nEmphasizing that the protection of wildlife must be part of a comprehensive \napproach to achieving poverty eradication, food security, sustainable development, \nincluding the conservation and sustainable use of biological diversity, economic \ngrowth, social well-being and sustainable livelihoods,  \n \nExpressing deep concern about crimes that affect the environment, including \nillicit trafficking in endangered and, where applicable, protected species of wild fauna \nand flora, and in hazardous waste, and emphasizing the need to combat such crimes \nby strengthening coordinated action to eliminate, prevent and combat corruption and \ndisrupt illicit networks and also by coordinating international cooperation, capacity-\nbuilding, criminal justice responses and law enforcement efforts,  \n \nRecalling the adoption of its resolutions 69/314 of 30 July 2015, 70/301 of \n9 September 2016 and 71/326 of 11 September 2017 on tackling illicit trafficking in \nwildlife, \n__________________ \n \n21  Resolution 69/196, annex. \n\nStrengthening the United Nations crime prevention and criminal \njustice programme, in particular its technical cooperation capacity \nA/RES/72/196\n \n9/18 \n17-23196 \n \n \nConcerned at the growing trend of cybercrime and the misuse of information \nand telecommunications technologies in multiple forms of crime,  \n \nWelcoming, in this respect, resolution 26/4 of 26 May 2017 of the Commission \non Crime Prevention and Criminal Justice on strengthening international cooperation \nto combat cybercrime,1313 in which the open-ended intergovernmental Expert Group \nto Conduct a Comprehensive Study on Cybercrime is requested to continue its work \nand exchange of information on national legislation, best practices, technical \nassistance and international cooperation with a view to examining options to \nstrengthen existing responses and propose new national and international legal or \nother responses to cybercrime, and is encouraged to develop possible conclusions and \nrecommendations for submission to the Commission, \n \nConcerned at the serious challenges and threats posed by trafficking in firearms, \ntheir parts and components and ammunition, and about its links with other forms of \ntransnational organized crime, including drug trafficking, as well as terrorism, \n \nNoting international efforts to prevent, combat and eradicate the illicit trade in \nconventional arms, in particular in small arms and light weapons, as demonstrated by \nthe adoption in 2001 of the Programme of Action to Prevent, Combat and Eradicate \nthe Illicit Trade in Small Arms and Light Weapons in All Its Aspects, 22 the entry into \nforce in 2005 of the Protocol against the Illicit Manufacturing of and Trafficking in \nFirearms, Their Parts and Components and Ammunition, supplementing the United \nNations Convention against Transnational Organized Crime,23 and the entry into force \nin 2014 of the Arms Trade Treaty,24  \n \nReaffirming its resolution 71/211 of 19 December 2016 on international \ncooperation to address and counter the world drug problem, and reaffirming also the \noutcome document, entitled \u201cOur joint commitment to effectively addressing and \ncountering the world drug problem,\u201d adopted at the thirtieth special session of the \nGeneral Assembly, held at United Nations Headquarters from 19 to 21 April 2016,25 \nand the Political Declaration and Plan of Action on International Cooperation towards \nan Integrated and Balanced Strategy to Counter the World Drug Problem, adopted by \nthe General Assembly at its sixty-fourth session,26 and the Joint Ministerial Statement \nof the 2014 high-level review by the Commission on Narcotic Drugs of the \nimplementation by Member States of the Political Declaration and Plan of Action, 27 \n \n1. \nTakes note with appreciation of the report of the Secretary-General \nprepared pursuant to resolutions 64/293, 69/199 of 18 December 2014 and 71/209;28  \n \n2. \nReaffirms its resolution 70/1, entitled \u201cTransforming our world: the 2030 \nAgenda for Sustainable Development\u201d, which, inter alia, includes the commitment to \npromote peaceful and inclusive societies for sustainable development, provide access \nto justice for all and build effective, accountable and inclusive institutions at all \nlevels;  \n \n3. \nCalls upon all Member States, when appropriate, to take into consideration \nthe Doha Declaration on Integrating Crime Prevention and Criminal Justice into the \nWider United Nations Agenda to Address Social and Economic Challenges and to \n__________________ \n \n22  Report of the United Nations Conference on the Illicit Trade in Small Arms and Light Weapons in \nAll Its Aspects, New York, 9\u201320 July 2001 (A/CONF.192/15), chap. IV, para. 24. \n \n23  United Nations, Treaty Series, vol. 2326, No. 39574. \n \n24  See resolution 67/234 B. \n \n25  Resolution S-30/1, annex. \n \n26  See Official Records of the Economic and Social Council, 2009, Supplement No. 8 (E/2009/28), \nchap. I, sect. C. \n27 Ibid, 2014, Supplement No. 8 (E/2014/28), chap. I, sect. C. \n \n28  A/72/125. \n\nA/RES/72/196 \nStrengthening the United Nations crime prevention and criminal\njustice programme, in particular its technical cooperation capacity\n \n17-23196 \n10/18 \n \nPromote the Rule of Law at the National and International Levels, and Public \nParticipation, adopted at the Thirteenth United Nations Congress on Crime Prevention \nand Criminal Justice, held in Doha from 12 to 19 April 2015,6 when formulating \nlegislation and policy directives, and to make every effort, where appropriate, to \nimplement the principles contained therein in conformity with the purposes and \nprinciples of the Charter of the United Nations;  \n \n4. \nUrges Member States that have not yet done so to consider ratifying or \nacceding to the United Nations Convention against Transnational Organized Crime \nand the Protocols thereto,1 the Single Convention on Narcotic Drugs of 1961 as \namended by the 1972 Protocol,2 the Convention on Psychotropic Substances of 1971,3 \nthe United Nations Convention against Illicit Traffic in Narcotic Drugs and \nPsychotropic Substances of 1988,4 the United Nations Convention against \nCorruption5 and the international conventions and protocols related to terrorism, and \nurges States parties to those conventions and protocols to make efforts towards their \neffective implementation;  \n \n5. \nReaffirms that the United Nations Convention against Transnational \nOrganized Crime and the Protocols thereto represent the most important tools of the \ninternational community for fighting transnational organized crime, and notes with \nappreciation that the number of States parties has reached 189, which is a significant \nindication of the commitment shown by the international community to combating \ntransnational organized crime;  \n \n6. \nRecalls article 32 of the United Nations Convention against Transnational \nOrganized Crime10 and General Assembly resolution 69/197 of 18 December 2014, \nin which, inter alia, the need for the establishment of a mechanism to review the \nimplementation of the Convention and the Protocols thereto by States parties was \nreiterated, and underlines that the review of the implementation of the Convention is \nan ongoing and gradual process and that it is necessary to explore all options \nregarding the establishment of a mechanism to assist the Conference of the Parties to \nthe United Nations Convention against Transnational Organized Crime in the review \nof the implementation of the Convention and the Protocols thereto;  \n \n7. \nWelcomes with appreciation the decision of the Conference of the Parties \nto the Convention at its eighth session to continue the process of establishing a \nmechanism for the review of the implementation of the Convention and the Protocols \nthereto and to elaborate specific procedures and rules for the functioning of the \nmechanism, which shall include the elements specified by the Conference of the \nParties, for consideration by the Conference of the Parties at its ninth session, as well \nas its decision that the mechanism shall progressively address all the articles of the \nConvention and the Protocols thereto, in accordance with the clusters of articles and \nthe multi-year workplan, and welcomes in particular the recommendations contained \nin resolution 8/2 of the Conference of the Parties adopted on 21 October 201629 and \nthe first session of the open-ended intergovernmental meeting, held in Vienna from \n24 to 26 April 2017;  \n \n8. \nWelcomes the decisions of the Conference of the Parties at its eighth \nsession to promote greater use of the Convention by central authorities in extradition \nand mutual legal assistance and to enhance the effectiveness of these authorities and \nto strengthen, as appropriate, the implementation of the Protocol against the Illicit \nManufacturing of and Trafficking in Firearms, Their Parts and Components and \nAmmunition, supplementing the United Nations Convention against Transnational \nOrganized Crime;23  \n__________________ \n \n29  See CTOC/COP/2016/15, sect. I.A. \n\nStrengthening the United Nations crime prevention and criminal \njustice programme, in particular its technical cooperation capacity \nA/RES/72/196\n \n11/18 \n17-23196 \n \n \n9. \nUrges States parties to the United Nations Convention against Corruption \nto continue to provide full support to the review mechanism adopted by the \nConference of the States Parties to the United Nations Convention against Corruption, \nnotes the progress made under the second cycle of the Mechanism for the Review of \nImplementation of the Convention, and further notes with appreciation that the \nnumber of States parties has reached 183, which is a significant indication of the \ncommitment shown by the international community to combating corruption and \nrelated crimes; \n \n10. Welcomes the progress achieved by the Conference of the Parties to the \nUnited Nations Convention against Transnational Organized Crime and the \nConference of the States Parties to the United Nations Convention against Corruption \nin the implementation of their respective mandates, and calls upon States parties to \ngive full effect to the resolutions adopted by those bodies, including providing \ninformation regarding compliance with the treaties;  \n \n11. \nInvites the President of the General Assembly, in cooperation with the \nUnited Nations Office on Drugs and Crime and with the involvement of relevant \nstakeholders, to hold, within existing resources and during the seventy-second \nsession, a high-level debate to mark the fifteenth anniversary of the adoption of the \nUnited Nations Convention against Corruption and to highlight emerging trends and \npromote the effective implementation of the Convention, and to prepare a President\u2019s \nsummary of the discussion for transmission to the Conference of the States Parties to \nthe Convention and to all Member States; \n \n12. Encourages Member States to strengthen the capacity of their respective \ncriminal justice systems to investigate, prosecute and punish all forms of crime, while \nsupporting an effective, fair, humane and accountable criminal justice system and \nprotecting the human rights and fundamental freedoms of defendants, as well as the \nlegitimate interests of victims and witnesses, and to adopt and reinforce measures to \nensure access to effective legal aid in criminal justice systems;  \n \n13. Requests the United Nations Office on Drugs and Crime to continue to \nprovide technical assistance to Member States, upon request, to strengthen the rule of \nlaw, taking also into account the work undertaken by other United Nations entities, \nwithin existing mandates, as well as regional and bilateral efforts, and to continue to \nensure coordination and coherence, including through the Rule of Law Coordination \nand Resource Group;  \n \n14. Reiterates the importance of providing the United Nations crime \nprevention and criminal justice programme with sufficient, stable and predictable \nfunding for the full implementation of its mandates;  \n \n15. Encourages all States to have national and local action plans for crime \nprevention in order to take into account, in a comprehensive, integrated and \nparticipatory manner, inter alia, factors that place certain populations and places at \nhigher risk of victimization and/or of offending, and to ensure that such plans are \nbased on the best available evidence and good practices, and stresses that crime \nprevention should be considered an integral element of strategies to foster social and \neconomic development in all States, in accordance with the commitments contained \nin General Assembly resolutions 70/1 and 70/299;  \n \n16. Urges Member States and relevant international organizations, in \ncooperation with the United Nations crime prevention and criminal justice \nprogramme, to develop national, subregional, regional and international strategies, as \nappropriate, and other necessary measures, including the establishment, in accordance \nwith domestic legislation, of designated central authorities and effective points of \ncontact dedicated to facilitating the procedures related to international cooperation, \n\nA/RES/72/196 \nStrengthening the United Nations crime prevention and criminal\njustice programme, in particular its technical cooperation capacity\n \n17-23196 \n12/18 \n \nincluding for extradition and mutual legal assistance requests, in order to effectively \naddress transnational organized crime, and to strengthen all forms of cooperation to \nenable the return of illicitly acquired assets in accordance with the provisions of the \nUnited Nations Convention against Corruption for asset recovery, in particular \nchapter V, with the cooperation of the United Nations Office on Drugs and Crime, \nwithin its existing mandate;  \n \n17. Encourages Member States to study the implementation of a common \ndocumentation standard, including within the United Nations system and in \ncooperation with relevant international institutions; \n \n18. Reaffirms the importance of the United Nations crime prevention and \ncriminal justice programme in promoting effective action to strengthen international \ncooperation in crime prevention and criminal justice, as well as of the work of the \nUnited Nations Office on Drugs and Crime in the fulfilment of its mandate in crime \nprevention and criminal justice, including providing to Member States, upon request \nand as a matter of high priority, technical cooperation, advisory services and other \nforms of assistance, and coordinating with and complementing the work of all \nrelevant and competent United Nations bodies and offices in respect of all forms of \norganized crime, including piracy and transnational organized crime committed at \nsea, cybercrime, the use of new information technologies to abuse and exploit \nchildren, as well as identity-related crime, trafficking in cultural property and \nartefacts, illicit financial flows, economic and financial crimes, including fraud, as \nwell as tax and corporate crimes, trafficking in precious metals and stones, \ncounterfeiting in trademark goods, crimes that affect the environment and illicit \ntrafficking in endangered species of wild fauna and flora, drug trafficking, trafficking \nin persons, smuggling of migrants and illicit manufacturing of and trafficking in \nfirearms, direct and indirect trade in oil and refined oil products with organized \ncriminal and terrorist groups, as well as corruption and terrorism;  \n \n19. Encourages Member States to collect relevant information and to further \nidentify, analyse and counter any existing, growing or potential links, in some cases, \nbetween transnational organized crime, illicit drug-related activities, money-\nlaundering and the financing of terrorism, in order to enhance criminal justice \nresponses to those crimes, and calls upon the United Nations Office on Drugs and \nCrime, within its relevant mandates, to support, upon request, the efforts of Member \nStates in that regard; \n \n20. Calls upon Member States to strengthen cooperation at the international, \nregional, subregional and bilateral levels to counter the threat posed by foreign \nterrorist fighters, including through enhanced operational and timely information-\nsharing, logistical support, as appropriate, and capacity-building activities, such as \nthose provided by the United Nations Office on Drugs and Crime, to share and adopt \nbest practices to identify foreign terrorist fighters, to prevent the travel of foreign \nterrorist fighters from, into or through Member States, to prevent the financing, \nmobilization, recruitment and organization of foreign terrorist fighters, to prevent and \ncounter violent extremism as and when conducive to terrorism, to enhance efforts to \nimplement prosecution, rehabilitation and reintegration strategies and to ensure that \nany person who participates in the financing, planning, preparation or perpetration of \nterrorist acts or in the supporting of terrorist acts is brought to justice, in compliance \nwith obligations under international law, as well as applicable domestic law;  \n \n21. Urges the United Nations Office on Drugs and Crime to increase \ncollaboration with intergovernmental, international and regional organizations that \nhave transnational organized crime mandates, as appropriate, in order to share best \npractices, foster cooperation and take advantage of their unique and comparative \nadvantage;  \n\nStrengthening the United Nations crime prevention and criminal \njustice programme, in particular its technical cooperation capacity \nA/RES/72/196\n \n13/18 \n17-23196 \n \n \n22. Reaffirms the importance of the United Nations Office on Drugs and Crime \nand its country and regional offices in building capacity at the local level in the field \nof crime prevention and criminal justice, and urges the Office to consider regional \nvulnerabilities, projects and impacts in the fight against transnational organized crime \nin all its forms, in particular in developing countries, when deciding to close and \nallocate offices, with a view to maintaining an effective level of support to national \nand regional efforts in those areas;  \n \n23. Requests the Secretary-General to continue to provide the United Nations \nOffice on Drugs and Crime with adequate resources to support, in an effective \nmanner, efforts towards the implementation of the United Nations Convention against \nTransnational Organized Crime and the Protocols thereto, the Single Convention on \nNarcotic Drugs of 1961 as amended by the 1972 Protocol, the Convention on \nPsychotropic Substances of 1971, the United Nations Convention against Illicit \nTraffic in Narcotic Drugs and Psychotropic Substances of 1988 and the United \nNations Convention against Corruption, and to discharge its functions as the \nsecretariat of the conferences of the parties to the conventions, the Commission on \nCrime Prevention and Criminal Justice and the Commission on Narcotic Drugs, as \nwell as the United Nations congresses on crime prevention and criminal justice, in \naccordance with its mandate, and requests the Secretariat to continue to provide \nsupport to the Commissions within their respective mandates, enabling them to \nactively contribute, as appropriate, to the global follow-up and the thematic review \nof progress made by Member States in the achievement of the Sustainable \nDevelopment Goals as set forth in resolution 70/299;  \n \n24. Urges all Member States to provide the fullest possible financial and \npolitical support to the United Nations Office on Drugs and Crime by widening its \ndonor base and increasing voluntary contributions, in particular general-purpose \ncontributions, so as to enable it to continue, expand, improve and strengthen, within \nits mandates, its research, operational and technical cooperation activities;  \n \n25. Expresses concern regarding the overall financial situation of the United \nNations Office on Drugs and Crime, emphasizes the need to provide the Office with \nadequate, predictable and stable resources and to ensure their cost-effective utilization, \nand requests the Secretary-General, also considering the extension of the mandate of \nthe standing open-ended intergovernmental working group on improving the \ngovernance and financial situation of the Office, to continue to report, within existing \nreporting obligations, on the financial situation of the Office and to continue to ensure \nthat the Office has sufficient resources to carry out its mandates fully and effectively; \n \n26. Invites States and other interested parties to make further voluntary \ncontributions to the United Nations voluntary trust fund for victims of trafficking in \npersons, especially women and children, and to the United Nations voluntary trust \nfund on contemporary forms of slavery;  \n \n27. Calls upon Member States to intensify national and international efforts to \neliminate all forms of discrimination, including racism, religious intolerance, \nxenophobia and gender-related discrimination by, inter alia, raising awareness, \ndeveloping educational materials and programmes and considering, where \nappropriate, drafting and enforcing legislation against discrimination;  \n \n28. Emphasizes the importance of protecting vulnerable members of society, \nregardless of their status, who may be subject to multiple and aggravated forms of \ndiscrimination, and in that regard expresses its concern about the increase in the \nactivities of transnational and national organized criminal groups and others who \nprofit from crimes against migrants, especially women and children, without regard \nfor dangerous and inhumane conditions and in flagrant violation of national laws and \ninternational law;  \n\nA/RES/72/196 \nStrengthening the United Nations crime prevention and criminal\njustice programme, in particular its technical cooperation capacity\n \n17-23196 \n14/18 \n \n \n29. Calls upon Member States to implement, when appropriate, the United \nNations Standard Minimum Rules for the Treatment of Prisoners (the Nelson Mandela \nRules),30 bearing in mind their spirit and purpose, and to intensify their efforts to \naddress the challenge of prison overcrowding through appropriate criminal justice \nreforms, which should include, where appropriate, a review of penal policies and \npractical measures to reduce pretrial detention, to enhance the use of non-custodial \nsanctions and measures and to improve access to legal aid to the extent possible, and \nrequests the United Nations Office on Drugs and Crime to continue to provide \ntechnical assistance to Member States, upon request, in this respect;  \n \n30. Invites Member States to mainstream a gender perspective into their \ncriminal justice systems, including by the use of non-custodial measures for women, \nwhen appropriate, and by improving the treatment of women prisoners, taking into \nconsideration the United Nations Rules for the Treatment of Women Prisoners and \nNon-custodial Measures for Women Offenders (the Bangkok Rules), 31 and by \ndeveloping and implementing national strategies and plans to promote the full \nprotection of women and girls from all acts of violence and to strengthen the crime \nprevention and criminal justice response to the gender-related killing of women and \ngirls, in particular by taking measures to support the practical capacity of Member \nStates to prevent, investigate, prosecute and punish all forms of such crime, and \nwelcomes in this respect the practical tools recommended by the open-ended \nintergovernmental expert group on gender-related killing of women and girls at its \nmeeting held in Bangkok from 11 to 13 November 2014;32  \n \n31. Also invites Member States to integrate child- and youth-related issues into \ntheir criminal justice reform efforts, recognizing the importance of protecting children \nfrom all forms of violence, exploitation and abuse, consistent with the obligations of \nparties under relevant international instruments, and to develop comprehensive child-\nsensitive justice policies focused on the best interests of the child, consistent with the \nprinciple that the deprivation of liberty of children should be used only as a measure \nof last resort and for the shortest appropriate period of time;  \n \n32. Recognizes the efforts made by the United Nations Office on Drugs and \nCrime to assist Member States in developing their abilities and strengthening their \ncapacity to prevent and combat kidnapping, and requests the Office to continue to \nprovide technical assistance, with a view to fostering international cooperation, in \nparticular mutual legal assistance, aimed at countering effectively this growing \nserious crime;  \n \n33. Calls upon Member States to consider ratifying or acceding to the Protocol \nagainst the Smuggling of Migrants by Land, Sea and Air, supplementing the United \nNations Convention against Transnational Organized Crime, 33 to reinforce \ninternational cooperation for preventing and combating the smuggling of migrants \nand for the prosecution of smugglers, in accordance, as appropriate, with article 6 of \nthe Protocol and with national laws and legislation, while effectively protecting the \nrights and respecting the dignity of smuggled migrants, consistent with the principles \nof non-discrimination and other applicable obligations under relevant international \nlaw, taking into account the special needs of women, children, especially when \nunaccompanied, and persons with disabilities and older persons, and in collaboration \nwith international organizations, civil society and the private sector, and in this regard \ncalls upon the United Nations Office on Drugs and Crime to continue its technical \nassistance to Member States in accordance with the Protocol;  \n__________________ \n \n30  Resolution 70/175, annex. \n \n31  Resolution 65/229, annex. \n \n32  See E/CN.15/2015/16. \n \n33  United Nations, Treaty Series, vol. 2241, No. 39574. \n\nStrengthening the United Nations crime prevention and criminal \njustice programme, in particular its technical cooperation capacity \nA/RES/72/196\n \n15/18 \n17-23196 \n \n \n34. Encourages Member States to ensure that, in investigating and prosecuting \nthe smuggling of migrants, the concurrent undertaking of financial investigations is \nconsidered, with a view to tracing, freezing and confiscating proceeds acquired \nthrough that crime, and to consider the smuggling of migrants to be a predicate \noffence of money-laundering;  \n \n35. Emphasizes the importance of preventing and combating all forms of \ntrafficking in persons, and in this regard expresses its concern about the activities of \ntransnational and national organized criminal groups and others who profit from such \ncrimes, including for the purpose of organ removal, and calls upon Member States to \nconsider ratifying or acceding to the Protocol to Prevent, Suppress and Punish \nTrafficking in Persons, Especially Women and Children, supplementing the United \nNations Convention against Transnational Organized Crime, 20 as well as to strengthen \nnational efforts to combat all forms of trafficking in persons and to protect and assist \nthe victims of trafficking in accordance with all relevant legal obligations and in \ncollaboration with international organizations, civil society and the private sector, and \nin this regard calls upon the United Office on Drugs and Crime to continue its \ntechnical assistance to Member States in accordance with the Protocol;  \n \n36. Requests the United Nations Office on Drugs and Crime to enhance its \ntechnical assistance to Member States, upon request, to strengthen international \ncooperation in preventing and combating terrorism, including the phenomenon of \ntravelling, returning and relocating foreign terrorist fighters, especially with regard \nto extradition and mutual legal assistance, and its financial sources, through the \nfacilitation of the ratification and implementation of the universal conventions and \nprotocols related to terrorism, in close consultation and cooperation with the Security \nCouncil Committee established pursuant to resolution 1373 (2001) concerning \ncounter-terrorism (the Counter-Terrorism Committee) and its Executive Directorate, \nas well as to contribute to the work of the Office of Counter-Terrorism, established in \naccordance with resolution 71/291, and invites Member States to provide the United \nNations Office on Drugs and Crime with appropriate resources for its mandate;  \n \n37. Urges the United Nations Office on Drugs and Crime to continue to \nprovide, within its mandate, technical assistance to Member States, upon their \nrequest, to combat money-laundering and the financing of terrorism through the \nGlobal Programme against Money-Laundering, Proceeds of Crime and the Financing \nof Terrorism, in accordance with United Nations-related instruments and international \nstandards, including, where applicable, standards and relevant initiatives of regional, \ninterregional and multilateral organizations and intergovernmental bodies against \nmoney-laundering, inter alia and as appropriate, the Financial Action Task Force, in \naccordance with national legislation;  \n \n38. Encourages Member States to enhance the effectiveness of countering \ncriminal threats to the tourism sector, including terrorist threats, through, when \nappropriate, the activities of the United Nations Office on Drugs and Crime and other \nrelevant international organizations, in cooperation with the World Tourism \nOrganization and the private sector;  \n \n39. Affirms that attacks intentionally directed against buildings dedicated to \nreligion, education, art, science or charitable purposes, or historic monuments, or \nhospitals and places where the sick and wounded are collected, may amount to war \ncrimes, stresses the importance of holding accountable perpetrators of attacks \nintentionally directed against the above-mentioned buildings, provided that they are \nnot military objectives, and calls upon all States to take appropriate action to this end \nwithin their jurisdiction in accordance with applicable international law;  \n\nA/RES/72/196 \nStrengthening the United Nations crime prevention and criminal\njustice programme, in particular its technical cooperation capacity\n \n17-23196 \n16/18 \n \n \n40. Urges States parties to make effective use of the United Nations \nConvention against Transnational Organized Crime for broad cooperation in \npreventing and combating all forms and aspects of trafficking in cultural property and \nrelated offences, including money-laundering and the financing of terrorism, \nespecially in returning such confiscated proceeds of crime or property to their \nlegitimate owners, in accordance with article 14, paragraph 2, of the Convention, \ninvites States parties to exchange information and statistical data on all forms and \naspects of trafficking in cultural property and related offences, and reaffirms in this \nregard the importance of the International Guidelines for Crime Prevention and \nCriminal Justice Responses with Respect to Trafficking in Cultural Property and \nOther Related Offences, as adopted by the General Assembly in its resolution 69/196; \n \n41. Urges Member States to introduce effective national and international \nmeasures to prevent and combat illicit trafficking in cultural property, including \npublicizing legislation, international guidelines and related technical background \ndocuments, and offering special training for police, customs and border services, and \ninvites Member States to make trafficking in cultural property, including stealing \nfrom and looting of archaeological and other cultural sites, a serious crime, as defined \nin article 2 (b) of the United Nations Convention against Transnational Organized \nCrime;  \n \n42. Also urges Member States to take decisive steps at the national level to \nprevent, combat and eradicate the illegal trade in wildlife, on both the supply and \ndemand sides, including by strengthening the legislation necessary for the prevention, \ninvestigation and prosecution of such illegal trade, as well as by strengthening \nenforcement and criminal justice responses, in accordance with national legislation \nand international law, acknowledging that the International Consortium on \nCombating Wildlife Crime can provide valuable technical assistance in this regard;  \n \n43. Calls upon Member States to make illicit trafficking in protected species \nof wild fauna and flora and in hazardous waste involving organized criminal groups \na serious crime in accordance with their national legislation and with article 2 (b) of \nthe United Nations Convention against Transnational Organized Crime;  \n \n44. Also calls upon Member States to take appropriate and effective measures \nto prevent and combat trafficking in precious metals and stones by organized criminal \ngroups, including, where appropriate, the adoption and effective implementation of \nthe necessary legislation for the prevention, investigation and prosecution of illicit \ntrafficking in precious metals and stones;  \n \n45. Encourages Member States to continue to support the United Nations \nOffice on Drugs and Crime in providing targeted technical assistance, within its \nexisting mandate, to enhance the capacity of affected States, upon their request, to \ncombat piracy and other forms of crime committed at sea, including by assisting \nMember States in creating an effective law enforcement response and strengthening \ntheir judicial capacity;  \n \n46. Notes with appreciation the third meeting of the open-ended \nintergovernmental Expert Group to Conduct a Comprehensive Study on Cybercrime \nand the responses to cybercrime by Member States, the international community and \nthe private sector, and calls upon Member States to support the work of the expert \ngroup and to explore specific measures and develop possible conclusions and \nrecommendations designed to create a secure and resilient cyberenvironment, to \nprevent and counter effectively criminal activities carried out over the Internet, \npaying particular attention to identity theft, recruitment for the purpose of trafficking \nin persons and protecting children from online exploitation and abuse, to strengthen \nlaw enforcement cooperation at the national and international levels, including with \nthe aim of identifying and protecting victims by, inter alia, removing child \n\nStrengthening the United Nations crime prevention and criminal \njustice programme, in particular its technical cooperation capacity \nA/RES/72/196\n \n17/18 \n17-23196 \n \npornography, in particular child sexual abuse imagery, from the Internet, to enhance \nthe security of computer networks and protect the integrity of relevant infrastructure, \nand to endeavour to provide long-term technical assistance and capacity-building to \nstrengthen the ability of national authorities to deal with cybercrime, including the \nprevention, detection, investigation and prosecution of such crime in all its forms;  \n \n47. Encourages Member States to strengthen their efforts in combating \ncybercrime and all forms of criminal abuse of information and telecommunications \ntechnologies, and to enhance international cooperation in this regard;  \n \n48. Requests the United Nations Office on Drugs and Crime to continue to \nassist Member States, upon request, in combating the illicit manufacturing of and \ntrafficking in firearms, their parts and components and ammunition, and to support \nthem in their efforts to address the links with other forms of transnational organized \ncrime, through, inter alia, legislative assistance, technical support and improved data \ncollection and analysis;  \n \n49. Urges Member States to exchange good practices and experiences of \npractitioners who are involved in combating illicit trafficking in firearms and to \nconsider the use of available tools, including marking and record-keeping \ntechnologies, to facilitate the tracing of firearms and, where possible, their parts and \ncomponents and ammunition, in order to enhance criminal investigations into illicit \ntrafficking in firearms;  \n \n50. Urges States parties to the Protocol against the Illicit Manufacturing of \nand Trafficking in Firearms, Their Parts and Components and Ammunition that import \nand export parts and components of firearms to reinforce their control measures in \nline with the Protocol and other relevant international legal instruments to which they \nare party, with a view to preventing and reducing the risks of their diversion, illicit \nmanufacturing and trafficking; \n \n51. Calls upon Member States to intensify all efforts to address the world drug \nproblem, based upon the principle of common and shared responsibility and through \na comprehensive and balanced approach, including through more effective bilateral, \nregional and international cooperation among judicial and law enforcement \nauthorities, to counter the involvement of organized criminal groups in illicit drug \nproduction and trafficking and related criminal activities and to take steps to reduce \nthe violence that accompanies drug trafficking;  \n \n52. Recommends that Member States, as appropriate to their national contexts, \nadopt a comprehensive and integrated approach to crime prevention and criminal \njustice reform, based on baseline assessments, regular data collection and analysis, \nand focusing on all sectors of the justice system, and develop crime prevention \npolicies, strategies and programmes, including ones that focus on early prevention by \nusing multidisciplinary and participatory approaches, in close cooperation with all \nstakeholders, including civil society, and requests the United Nations Office on Drugs \nand Crime to continue to provide technical assistance, upon request, to Member States \nfor this purpose;  \n \n53. Invites Member States to develop national plans for the gradual adoption \nof the International Classification of Crime for Statistical Purposes and to strengthen \nnational statistical systems of criminal justice, requests the United Nations Office on \nDrugs and Crime, within its existing mandate, to continue to strengthen the regular \ncollection, analysis and dissemination of accurate, reliable and comparable data and \ninformation, including, as appropriate, data disaggregated by sex, age and other \nrelevant criteria, and strongly encourages Member States to share such data and \ninformation with the Office;  \n\nA/RES/72/196 \nStrengthening the United Nations crime prevention and criminal\njustice programme, in particular its technical cooperation capacity\n \n17-23196 \n18/18 \n \n \n54. Requests the United Nations Office on Drugs and Crime to continue to \ndevelop, in close cooperation with Member States, technical and methodological tools \nand trend analyses and studies to enhance knowledge of crime trends and support \nMember States in designing appropriate responses in specific areas of crime, in \nparticular in their transnational dimension, taking into account the need to make the \nbest possible use of existing resources;  \n \n55. Encourages Member States to take relevant measures, as appropriate to \ntheir national contexts, to ensure the diffusion, use and application of the United \nNations standards and norms in crime prevention and criminal justice, including the \nconsideration and, where they deem it necessary, dissemination of existing manuals, \nhandbooks and capacity-building material developed and published by the United \nNations Office on Drugs and Crime;  \n \n56. Requests the United Nations Office on Drugs and Crime, in collaboration \nand close consultation with Member States and within existing resources, to continue \nto support the enhancement of capacity and skills in the field of forensic sciences, \nincluding the setting of standards, and the development of technical assistance \nmaterial for training, such as manuals, compilations of useful practices and guidelines \nand scientific and forensic reference material, for law enforcement officials and \nprosecution authorities, and to promote and facilitate the establishment and \nsustainability of regional networks of forensic science providers in order to enhance \ntheir expertise and capacity to prevent and combat transnational organized crime;  \n \n57. Requests the Secretary-General to submit a report to the General Assembly \nat its seventy-third session on the implementation of the mandates of the United \nNations crime prevention and criminal justice programme, reflecting also emerging \npolicy issues and possible responses. \n \n73rd plenary meeting  \n19 December 2017 \n \n",
  "paragraphs": {
    "1": "Takes note with appreciation of the report of the Secretary-General prepared pursuant to resolutions 64/293, 69/199 of 18 December 2014 and 71/209;28",
    "2": "Reaffirms its resolution 70/1, entitled \u201cTransforming our world: the 2030 Agenda for Sustainable Development\u201d, which, inter alia, includes the commitment to promote peaceful and inclusive societies for sustainable development, provide access to justice for all and build effective, accountable and inclusive institutions at all levels;",
    "3": "Calls upon all Member States, when appropriate, to take into consideration the Doha Declaration on Integrating Crime Prevention and Criminal Justice into the Wider United Nations Agenda to Address Social and Economic Challenges and to __________________ 22 Report of the United Nations Conference on the Illicit Trade in Small Arms and Light Weapons in All Its Aspects, New York, 9\u201320 July 2001 (A/CONF.192/15), chap. IV, para. 24. 23 United Nations, Treaty Series, vol. 2326, No. 39574. 24 See resolution 67/234 B. 25 Resolution S-30/1, annex. 26 See Official Records of the Economic and Social Council, 2009, Supplement No. 8 (E/2009/28), chap. I, sect. C. 27 Ibid, 2014, Supplement No. 8 (E/2014/28), chap. I, sect. C. 28 A/72/125. A/RES/72/196 Strengthening the United Nations crime prevention and criminal justice programme, in particular its technical cooperation capacity 17-23196 10/18 Promote the Rule of Law at the National and International Levels, and Public Participation, adopted at the Thirteenth United Nations Congress on Crime Prevention and Criminal Justice, held in Doha from 12 to 19 April 2015,6 when formulating legislation and policy directives, and to make every effort, where appropriate, to implement the principles contained therein in conformity with the purposes and principles of the Charter of the United Nations;",
    "4": "Urges Member States that have not yet done so to consider ratifying or acceding to the United Nations Convention against Transnational Organized Crime and the Protocols thereto,1 the Single Convention on Narcotic Drugs of 1961 as amended by the 1972 Protocol,2 the Convention on Psychotropic Substances of 1971,3 the United Nations Convention against Illicit Traffic in Narcotic Drugs and Psychotropic Substances of 1988,4 the United Nations Convention against Corruption5 and the international conventions and protocols related to terrorism, and urges States parties to those conventions and protocols to make efforts towards their effective implementation;",
    "5": "Reaffirms that the United Nations Convention against Transnational Organized Crime and the Protocols thereto represent the most important tools of the international community for fighting transnational organized crime, and notes with appreciation that the number of States parties has reached 189, which is a significant indication of the commitment shown by the international community to combating transnational organized crime;",
    "6": "Recalls article 32 of the United Nations Convention against Transnational Organized Crime10 and General Assembly resolution 69/197 of 18 December 2014, in which, inter alia, the need for the establishment of a mechanism to review the implementation of the Convention and the Protocols thereto by States parties was reiterated, and underlines that the review of the implementation of the Convention is an ongoing and gradual process and that it is necessary to explore all options regarding the establishment of a mechanism to assist the Conference of the Parties to the United Nations Convention against Transnational Organized Crime in the review of the implementation of the Convention and the Protocols thereto;",
    "7": "Welcomes with appreciation the decision of the Conference of the Parties to the Convention at its eighth session to continue the process of establishing a mechanism for the review of the implementation of the Convention and the Protocols thereto and to elaborate specific procedures and rules for the functioning of the mechanism, which shall include the elements specified by the Conference of the Parties, for consideration by the Conference of the Parties at its ninth session, as well as its decision that the mechanism shall progressively address all the articles of the Convention and the Protocols thereto, in accordance with the clusters of articles and the multi-year workplan, and welcomes in particular the recommendations contained in resolution 8/2 of the Conference of the Parties adopted on 21 October 201629 and the first session of the open-ended intergovernmental meeting, held in Vienna from 24 to 26 April 2017;",
    "8": "Welcomes the decisions of the Conference of the Parties at its eighth session to promote greater use of the Convention by central authorities in extradition and mutual legal assistance and to enhance the effectiveness of these authorities and to strengthen, as appropriate, the implementation of the Protocol against the Illicit Manufacturing of and Trafficking in Firearms, Their Parts and Components and Ammunition, supplementing the United Nations Convention against Transnational Organized Crime;23 __________________ 29 See CTOC/COP/2016/15, sect. I.A. Strengthening the United Nations crime prevention and criminal justice programme, in particular its technical cooperation capacity A/RES/72/196 11/18 17-23196",
    "9": "Urges States parties to the United Nations Convention against Corruption to continue to provide full support to the review mechanism adopted by the Conference of the States Parties to the United Nations Convention against Corruption, notes the progress made under the second cycle of the Mechanism for the Review of Implementation of the Convention, and further notes with appreciation that the number of States parties has reached 183, which is a significant indication of the commitment shown by the international community to combating corruption and related crimes;",
    "10": "Welcomes the progress achieved by the Conference of the Parties to the United Nations Convention against Transnational Organized Crime and the Conference of the States Parties to the United Nations Convention against Corruption in the implementation of their respective mandates, and calls upon States parties to give full effect to the resolutions adopted by those bodies, including providing information regarding compliance with the treaties;",
    "11": "Invites the President of the General Assembly, in cooperation with the United Nations Office on Drugs and Crime and with the involvement of relevant stakeholders, to hold, within existing resources and during the seventy-second session, a high-level debate to mark the fifteenth anniversary of the adoption of the United Nations Convention against Corruption and to highlight emerging trends and promote the effective implementation of the Convention, and to prepare a President\u2019s summary of the discussion for transmission to the Conference of the States Parties to the Convention and to all Member States;",
    "12": "Encourages Member States to strengthen the capacity of their respective criminal justice systems to investigate, prosecute and punish all forms of crime, while supporting an effective, fair, humane and accountable criminal justice system and protecting the human rights and fundamental freedoms of defendants, as well as the legitimate interests of victims and witnesses, and to adopt and reinforce measures to ensure access to effective legal aid in criminal justice systems;",
    "13": "Requests the United Nations Office on Drugs and Crime to continue to provide technical assistance to Member States, upon request, to strengthen the rule of law, taking also into account the work undertaken by other United Nations entities, within existing mandates, as well as regional and bilateral efforts, and to continue to ensure coordination and coherence, including through the Rule of Law Coordination and Resource Group;",
    "14": "Reiterates the importance of providing the United Nations crime prevention and criminal justice programme with sufficient, stable and predictable funding for the full implementation of its mandates;",
    "15": "Encourages all States to have national and local action plans for crime prevention in order to take into account, in a comprehensive, integrated and participatory manner, inter alia, factors that place certain populations and places at higher risk of victimization and/or of offending, and to ensure that such plans are based on the best available evidence and good practices, and stresses that crime prevention should be considered an integral element of strategies to foster social and economic development in all States, in accordance with the commitments contained in General Assembly resolutions 70/1 and 70/299;",
    "16": "Urges Member States and relevant international organizations, in cooperation with the United Nations crime prevention and criminal justice programme, to develop national, subregional, regional and international strategies, as appropriate, and other necessary measures, including the establishment, in accordance with domestic legislation, of designated central authorities and effective points of contact dedicated to facilitating the procedures related to international cooperation, A/RES/72/196 Strengthening the United Nations crime prevention and criminal justice programme, in particular its technical cooperation capacity 17-23196 12/18 including for extradition and mutual legal assistance requests, in order to effectively address transnational organized crime, and to strengthen all forms of cooperation to enable the return of illicitly acquired assets in accordance with the provisions of the United Nations Convention against Corruption for asset recovery, in particular chapter V, with the cooperation of the United Nations Office on Drugs and Crime, within its existing mandate;",
    "17": "Encourages Member States to study the implementation of a common documentation standard, including within the United Nations system and in cooperation with relevant international institutions;",
    "18": "Reaffirms the importance of the United Nations crime prevention and criminal justice programme in promoting effective action to strengthen international cooperation in crime prevention and criminal justice, as well as of the work of the United Nations Office on Drugs and Crime in the fulfilment of its mandate in crime prevention and criminal justice, including providing to Member States, upon request and as a matter of high priority, technical cooperation, advisory services and other forms of assistance, and coordinating with and complementing the work of all relevant and competent United Nations bodies and offices in respect of all forms of organized crime, including piracy and transnational organized crime committed at sea, cybercrime, the use of new information technologies to abuse and exploit children, as well as identity-related crime, trafficking in cultural property and artefacts, illicit financial flows, economic and financial crimes, including fraud, as well as tax and corporate crimes, trafficking in precious metals and stones, counterfeiting in trademark goods, crimes that affect the environment and illicit trafficking in endangered species of wild fauna and flora, drug trafficking, trafficking in persons, smuggling of migrants and illicit manufacturing of and trafficking in firearms, direct and indirect trade in oil and refined oil products with organized criminal and terrorist groups, as well as corruption and terrorism;",
    "19": "Encourages Member States to collect relevant information and to further identify, analyse and counter any existing, growing or potential links, in some cases, between transnational organized crime, illicit drug-related activities, money- laundering and the financing of terrorism, in order to enhance criminal justice responses to those crimes, and calls upon the United Nations Office on Drugs and Crime, within its relevant mandates, to support, upon request, the efforts of Member States in that regard;",
    "20": "Calls upon Member States to strengthen cooperation at the international, regional, subregional and bilateral levels to counter the threat posed by foreign terrorist fighters, including through enhanced operational and timely information- sharing, logistical support, as appropriate, and capacity-building activities, such as those provided by the United Nations Office on Drugs and Crime, to share and adopt best practices to identify foreign terrorist fighters, to prevent the travel of foreign terrorist fighters from, into or through Member States, to prevent the financing, mobilization, recruitment and organization of foreign terrorist fighters, to prevent and counter violent extremism as and when conducive to terrorism, to enhance efforts to implement prosecution, rehabilitation and reintegration strategies and to ensure that any person who participates in the financing, planning, preparation or perpetration of terrorist acts or in the supporting of terrorist acts is brought to justice, in compliance with obligations under international law, as well as applicable domestic law;",
    "21": "Urges the United Nations Office on Drugs and Crime to increase collaboration with intergovernmental, international and regional organizations that have transnational organized crime mandates, as appropriate, in order to share best practices, foster cooperation and take advantage of their unique and comparative advantage; Strengthening the United Nations crime prevention and criminal justice programme, in particular its technical cooperation capacity A/RES/72/196 13/18 17-23196",
    "22": "Reaffirms the importance of the United Nations Office on Drugs and Crime and its country and regional offices in building capacity at the local level in the field of crime prevention and criminal justice, and urges the Office to consider regional vulnerabilities, projects and impacts in the fight against transnational organized crime in all its forms, in particular in developing countries, when deciding to close and allocate offices, with a view to maintaining an effective level of support to national and regional efforts in those areas;",
    "23": "Requests the Secretary-General to continue to provide the United Nations Office on Drugs and Crime with adequate resources to support, in an effective manner, efforts towards the implementation of the United Nations Convention against Transnational Organized Crime and the Protocols thereto, the Single Convention on Narcotic Drugs of 1961 as amended by the 1972 Protocol, the Convention on Psychotropic Substances of 1971, the United Nations Convention against Illicit Traffic in Narcotic Drugs and Psychotropic Substances of 1988 and the United Nations Convention against Corruption, and to discharge its functions as the secretariat of the conferences of the parties to the conventions, the Commission on Crime Prevention and Criminal Justice and the Commission on Narcotic Drugs, as well as the United Nations congresses on crime prevention and criminal justice, in accordance with its mandate, and requests the Secretariat to continue to provide support to the Commissions within their respective mandates, enabling them to actively contribute, as appropriate, to the global follow-up and the thematic review of progress made by Member States in the achievement of the Sustainable Development Goals as set forth in resolution 70/299;",
    "24": "Urges all Member States to provide the fullest possible financial and political support to the United Nations Office on Drugs and Crime by widening its donor base and increasing voluntary contributions, in particular general-purpose contributions, so as to enable it to continue, expand, improve and strengthen, within its mandates, its research, operational and technical cooperation activities;",
    "25": "Expresses concern regarding the overall financial situation of the United Nations Office on Drugs and Crime, emphasizes the need to provide the Office with adequate, predictable and stable resources and to ensure their cost-effective utilization, and requests the Secretary-General, also considering the extension of the mandate of the standing open-ended intergovernmental working group on improving the governance and financial situation of the Office, to continue to report, within existing reporting obligations, on the financial situation of the Office and to continue to ensure that the Office has sufficient resources to carry out its mandates fully and effectively;",
    "26": "Invites States and other interested parties to make further voluntary contributions to the United Nations voluntary trust fund for victims of trafficking in persons, especially women and children, and to the United Nations voluntary trust fund on contemporary forms of slavery;",
    "27": "Calls upon Member States to intensify national and international efforts to eliminate all forms of discrimination, including racism, religious intolerance, xenophobia and gender-related discrimination by, inter alia, raising awareness, developing educational materials and programmes and considering, where appropriate, drafting and enforcing legislation against discrimination;",
    "28": "Emphasizes the importance of protecting vulnerable members of society, regardless of their status, who may be subject to multiple and aggravated forms of discrimination, and in that regard expresses its concern about the increase in the activities of transnational and national organized criminal groups and others who profit from crimes against migrants, especially women and children, without regard for dangerous and inhumane conditions and in flagrant violation of national laws and international law; A/RES/72/196 Strengthening the United Nations crime prevention and criminal justice programme, in particular its technical cooperation capacity 17-23196 14/18",
    "29": "Calls upon Member States to implement, when appropriate, the United Nations Standard Minimum Rules for the Treatment of Prisoners (the Nelson Mandela Rules),30 bearing in mind their spirit and purpose, and to intensify their efforts to address the challenge of prison overcrowding through appropriate criminal justice reforms, which should include, where appropriate, a review of penal policies and practical measures to reduce pretrial detention, to enhance the use of non-custodial sanctions and measures and to improve access to legal aid to the extent possible, and requests the United Nations Office on Drugs and Crime to continue to provide technical assistance to Member States, upon request, in this respect;",
    "30": "Invites Member States to mainstream a gender perspective into their criminal justice systems, including by the use of non-custodial measures for women, when appropriate, and by improving the treatment of women prisoners, taking into consideration the United Nations Rules for the Treatment of Women Prisoners and Non-custodial Measures for Women Offenders (the Bangkok Rules), 31 and by developing and implementing national strategies and plans to promote the full protection of women and girls from all acts of violence and to strengthen the crime prevention and criminal justice response to the gender-related killing of women and girls, in particular by taking measures to support the practical capacity of Member States to prevent, investigate, prosecute and punish all forms of such crime, and welcomes in this respect the practical tools recommended by the open-ended intergovernmental expert group on gender-related killing of women and girls at its meeting held in Bangkok from 11 to 13 November 2014;32",
    "31": "Also invites Member States to integrate child- and youth-related issues into their criminal justice reform efforts, recognizing the importance of protecting children from all forms of violence, exploitation and abuse, consistent with the obligations of parties under relevant international instruments, and to develop comprehensive child- sensitive justice policies focused on the best interests of the child, consistent with the principle that the deprivation of liberty of children should be used only as a measure of last resort and for the shortest appropriate period of time;",
    "32": "Recognizes the efforts made by the United Nations Office on Drugs and Crime to assist Member States in developing their abilities and strengthening their capacity to prevent and combat kidnapping, and requests the Office to continue to provide technical assistance, with a view to fostering international cooperation, in particular mutual legal assistance, aimed at countering effectively this growing serious crime;",
    "33": "Calls upon Member States to consider ratifying or acceding to the Protocol against the Smuggling of Migrants by Land, Sea and Air, supplementing the United Nations Convention against Transnational Organized Crime, 33 to reinforce international cooperation for preventing and combating the smuggling of migrants and for the prosecution of smugglers, in accordance, as appropriate, with article 6 of the Protocol and with national laws and legislation, while effectively protecting the rights and respecting the dignity of smuggled migrants, consistent with the principles of non-discrimination and other applicable obligations under relevant international law, taking into account the special needs of women, children, especially when unaccompanied, and persons with disabilities and older persons, and in collaboration with international organizations, civil society and the private sector, and in this regard calls upon the United Nations Office on Drugs and Crime to continue its technical assistance to Member States in accordance with the Protocol; __________________ 30 Resolution 70/175, annex. 31 Resolution 65/229, annex. 32 See E/CN.15/2015/16. 33 United Nations, Treaty Series, vol. 2241, No. 39574. Strengthening the United Nations crime prevention and criminal justice programme, in particular its technical cooperation capacity A/RES/72/196 15/18 17-23196",
    "34": "Encourages Member States to ensure that, in investigating and prosecuting the smuggling of migrants, the concurrent undertaking of financial investigations is considered, with a view to tracing, freezing and confiscating proceeds acquired through that crime, and to consider the smuggling of migrants to be a predicate offence of money-laundering;",
    "35": "Emphasizes the importance of preventing and combating all forms of trafficking in persons, and in this regard expresses its concern about the activities of transnational and national organized criminal groups and others who profit from such crimes, including for the purpose of organ removal, and calls upon Member States to consider ratifying or acceding to the Protocol to Prevent, Suppress and Punish Trafficking in Persons, Especially Women and Children, supplementing the United Nations Convention against Transnational Organized Crime, 20 as well as to strengthen national efforts to combat all forms of trafficking in persons and to protect and assist the victims of trafficking in accordance with all relevant legal obligations and in collaboration with international organizations, civil society and the private sector, and in this regard calls upon the United Office on Drugs and Crime to continue its technical assistance to Member States in accordance with the Protocol;",
    "36": "Requests the United Nations Office on Drugs and Crime to enhance its technical assistance to Member States, upon request, to strengthen international cooperation in preventing and combating terrorism, including the phenomenon of travelling, returning and relocating foreign terrorist fighters, especially with regard to extradition and mutual legal assistance, and its financial sources, through the facilitation of the ratification and implementation of the universal conventions and protocols related to terrorism, in close consultation and cooperation with the Security Council Committee established pursuant to resolution 1373 (2001) concerning counter-terrorism (the Counter-Terrorism Committee) and its Executive Directorate, as well as to contribute to the work of the Office of Counter-Terrorism, established in accordance with resolution 71/291, and invites Member States to provide the United Nations Office on Drugs and Crime with appropriate resources for its mandate;",
    "37": "Urges the United Nations Office on Drugs and Crime to continue to provide, within its mandate, technical assistance to Member States, upon their request, to combat money-laundering and the financing of terrorism through the Global Programme against Money-Laundering, Proceeds of Crime and the Financing of Terrorism, in accordance with United Nations-related instruments and international standards, including, where applicable, standards and relevant initiatives of regional, interregional and multilateral organizations and intergovernmental bodies against money-laundering, inter alia and as appropriate, the Financial Action Task Force, in accordance with national legislation;",
    "38": "Encourages Member States to enhance the effectiveness of countering criminal threats to the tourism sector, including terrorist threats, through, when appropriate, the activities of the United Nations Office on Drugs and Crime and other relevant international organizations, in cooperation with the World Tourism Organization and the private sector;",
    "39": "Affirms that attacks intentionally directed against buildings dedicated to religion, education, art, science or charitable purposes, or historic monuments, or hospitals and places where the sick and wounded are collected, may amount to war crimes, stresses the importance of holding accountable perpetrators of attacks intentionally directed against the above-mentioned buildings, provided that they are not military objectives, and calls upon all States to take appropriate action to this end within their jurisdiction in accordance with applicable international law; A/RES/72/196 Strengthening the United Nations crime prevention and criminal justice programme, in particular its technical cooperation capacity 17-23196 16/18",
    "40": "Urges States parties to make effective use of the United Nations Convention against Transnational Organized Crime for broad cooperation in preventing and combating all forms and aspects of trafficking in cultural property and related offences, including money-laundering and the financing of terrorism, especially in returning such confiscated proceeds of crime or property to their legitimate owners, in accordance with article 14, paragraph 2, of the Convention, invites States parties to exchange information and statistical data on all forms and aspects of trafficking in cultural property and related offences, and reaffirms in this regard the importance of the International Guidelines for Crime Prevention and Criminal Justice Responses with Respect to Trafficking in Cultural Property and Other Related Offences, as adopted by the General Assembly in its resolution 69/196;",
    "41": "Urges Member States to introduce effective national and international measures to prevent and combat illicit trafficking in cultural property, including publicizing legislation, international guidelines and related technical background documents, and offering special training for police, customs and border services, and invites Member States to make trafficking in cultural property, including stealing from and looting of archaeological and other cultural sites, a serious crime, as defined in article 2 (b) of the United Nations Convention against Transnational Organized Crime;",
    "42": "Also urges Member States to take decisive steps at the national level to prevent, combat and eradicate the illegal trade in wildlife, on both the supply and demand sides, including by strengthening the legislation necessary for the prevention, investigation and prosecution of such illegal trade, as well as by strengthening enforcement and criminal justice responses, in accordance with national legislation and international law, acknowledging that the International Consortium on Combating Wildlife Crime can provide valuable technical assistance in this regard;",
    "43": "Calls upon Member States to make illicit trafficking in protected species of wild fauna and flora and in hazardous waste involving organized criminal groups a serious crime in accordance with their national legislation and with article 2 (b) of the United Nations Convention against Transnational Organized Crime;",
    "44": "Also calls upon Member States to take appropriate and effective measures to prevent and combat trafficking in precious metals and stones by organized criminal groups, including, where appropriate, the adoption and effective implementation of the necessary legislation for the prevention, investigation and prosecution of illicit trafficking in precious metals and stones;",
    "45": "Encourages Member States to continue to support the United Nations Office on Drugs and Crime in providing targeted technical assistance, within its existing mandate, to enhance the capacity of affected States, upon their request, to combat piracy and other forms of crime committed at sea, including by assisting Member States in creating an effective law enforcement response and strengthening their judicial capacity;",
    "46": "Notes with appreciation the third meeting of the open-ended intergovernmental Expert Group to Conduct a Comprehensive Study on Cybercrime and the responses to cybercrime by Member States, the international community and the private sector, and calls upon Member States to support the work of the expert group and to explore specific measures and develop possible conclusions and recommendations designed to create a secure and resilient cyberenvironment, to prevent and counter effectively criminal activities carried out over the Internet, paying particular attention to identity theft, recruitment for the purpose of trafficking in persons and protecting children from online exploitation and abuse, to strengthen law enforcement cooperation at the national and international levels, including with the aim of identifying and protecting victims by, inter alia, removing child Strengthening the United Nations crime prevention and criminal justice programme, in particular its technical cooperation capacity A/RES/72/196 17/18 17-23196 pornography, in particular child sexual abuse imagery, from the Internet, to enhance the security of computer networks and protect the integrity of relevant infrastructure, and to endeavour to provide long-term technical assistance and capacity-building to strengthen the ability of national authorities to deal with cybercrime, including the prevention, detection, investigation and prosecution of such crime in all its forms;",
    "47": "Encourages Member States to strengthen their efforts in combating cybercrime and all forms of criminal abuse of information and telecommunications technologies, and to enhance international cooperation in this regard;",
    "48": "Requests the United Nations Office on Drugs and Crime to continue to assist Member States, upon request, in combating the illicit manufacturing of and trafficking in firearms, their parts and components and ammunition, and to support them in their efforts to address the links with other forms of transnational organized crime, through, inter alia, legislative assistance, technical support and improved data collection and analysis;",
    "49": "Urges Member States to exchange good practices and experiences of practitioners who are involved in combating illicit trafficking in firearms and to consider the use of available tools, including marking and record-keeping technologies, to facilitate the tracing of firearms and, where possible, their parts and components and ammunition, in order to enhance criminal investigations into illicit trafficking in firearms;",
    "50": "Urges States parties to the Protocol against the Illicit Manufacturing of and Trafficking in Firearms, Their Parts and Components and Ammunition that import and export parts and components of firearms to reinforce their control measures in line with the Protocol and other relevant international legal instruments to which they are party, with a view to preventing and reducing the risks of their diversion, illicit manufacturing and trafficking;",
    "51": "Calls upon Member States to intensify all efforts to address the world drug problem, based upon the principle of common and shared responsibility and through a comprehensive and balanced approach, including through more effective bilateral, regional and international cooperation among judicial and law enforcement authorities, to counter the involvement of organized criminal groups in illicit drug production and trafficking and related criminal activities and to take steps to reduce the violence that accompanies drug trafficking;",
    "52": "Recommends that Member States, as appropriate to their national contexts, adopt a comprehensive and integrated approach to crime prevention and criminal justice reform, based on baseline assessments, regular data collection and analysis, and focusing on all sectors of the justice system, and develop crime prevention policies, strategies and programmes, including ones that focus on early prevention by using multidisciplinary and participatory approaches, in close cooperation with all stakeholders, including civil society, and requests the United Nations Office on Drugs and Crime to continue to provide technical assistance, upon request, to Member States for this purpose;",
    "53": "Invites Member States to develop national plans for the gradual adoption of the International Classification of Crime for Statistical Purposes and to strengthen national statistical systems of criminal justice, requests the United Nations Office on Drugs and Crime, within its existing mandate, to continue to strengthen the regular collection, analysis and dissemination of accurate, reliable and comparable data and information, including, as appropriate, data disaggregated by sex, age and other relevant criteria, and strongly encourages Member States to share such data and information with the Office; A/RES/72/196 Strengthening the United Nations crime prevention and criminal justice programme, in particular its technical cooperation capacity 17-23196 18/18",
    "54": "Requests the United Nations Office on Drugs and Crime to continue to develop, in close cooperation with Member States, technical and methodological tools and trend analyses and studies to enhance knowledge of crime trends and support Member States in designing appropriate responses in specific areas of crime, in particular in their transnational dimension, taking into account the need to make the best possible use of existing resources;",
    "55": "Encourages Member States to take relevant measures, as appropriate to their national contexts, to ensure the diffusion, use and application of the United Nations standards and norms in crime prevention and criminal justice, including the consideration and, where they deem it necessary, dissemination of existing manuals, handbooks and capacity-building material developed and published by the United Nations Office on Drugs and Crime;",
    "56": "Requests the United Nations Office on Drugs and Crime, in collaboration and close consultation with Member States and within existing resources, to continue to support the enhancement of capacity and skills in the field of forensic sciences, including the setting of standards, and the development of technical assistance material for training, such as manuals, compilations of useful practices and guidelines and scientific and forensic reference material, for law enforcement officials and prosecution authorities, and to promote and facilitate the establishment and sustainability of regional networks of forensic science providers in order to enhance their expertise and capacity to prevent and combat transnational organized crime;",
    "57": "Requests the Secretary-General to submit a report to the General Assembly at its seventy-third session on the implementation of the mandates of the United Nations crime prevention and criminal justice programme, reflecting also emerging policy issues and possible responses. 73rd plenary meeting 19 December 2017"
  },
  "agenda_items": [
    "Item 107"
  ],
  "symbol_references": []
}