{
  "symbol": "A/RES/76/286",
  "filename": "A_RES_76_286.pdf",
  "title": "76/286. Financing of the United Nations Mission for Justice Support in Haiti",
  "text": "United Nations \nA/RES/76/286\n \n \nGeneral Assembly \nDistr.: General \n7 July 2022 \n \n22-10345 (E)    070722     \n*2210345* \n \n \nSeventy-sixth session \nAgenda item 158 \nFinancing of the United Nations Mission for Justice \nSupport in Haiti  \n \n \n \n \n Resolution adopted by the General Assembly \non 29 June 2022 \n \n \n \n \n[on the report of the Fifth Committee (A/76/887, para. 6)] \n \n \n 76/286. Financing of the United Nations Mission for Justice Support \nin Haiti \n \n \n \nThe General Assembly, \n \nHaving considered the reports of the Secretary-General on the financing of the \nUnited Nations Mission for Justice Support in Haiti1 and the related reports of the \nAdvisory Committee on Administrative and Budgetary Questions, 2  \n \nRecalling Security Council resolution 2350 (2017) of 13 April 2017, by which \nthe Council established the United Nations Mission for Justice Support in Haiti, as a \nfollow-on peacekeeping mission in Haiti, for an initial period of six months from \n16 October 2017 until 15 April 2018, and the subsequent resolutions by which the \nCouncil extended the mandate of the Mission, the latest of which was resolution 2466 \n(2019) of 12 April 2019, by which the Council extended the mandate of the Mission \nfor a final period of six months, until 15 October 2019,  \n \nRecalling also its resolution 72/260 A of 24 December 2017 on the financing of \nthe Mission and its subsequent resolutions thereon, the latest of which was resolution \n74/260 B of 30 June 2020, as well as its decision 74/571 of 3 September 2020,  \n \nReaffirming the general principles underlying the financing of United Nations \npeacekeeping operations, as stated in its resolutions 1874 (S-IV) of 27 June 1963, \n3101 (XXVIII) of 11 December 1973 and 55/235 of 23 December 2000,  \n \n1. \nTakes note of the status of contributions to the United Nations Mission for \nJustice Support in Haiti as at 30 April 2022, including the contributions outstanding \nin the amount of 19.6 million United States dollars, representing some 7.4 per cent of \nthe total assessed contributions, notes with concern that only 158 Member States have \n__________________ \n \n1  A/75/752 and A/76/747. \n \n2  A/75/848 and A/76/801. \n\nA/RES/76/286 \nFinancing of the United Nations Mission for Justice Support \nin Haiti\n \n22-10345\n2/2 \n \npaid their assessed contributions in full, and urges all other Member States, in \nparticular those in arrears, to ensure payment of their outstanding assessed \ncontributions;  \n \n2. \nExpresses its appreciation to those Member States that have paid their \nassessed contributions in full, and urges all other Member States to make every \npossible effort to ensure payment of their assessed contributions to the Mission in \nfull;  \n \n3. \nEndorses the conclusions and recommendations contained in the reports \nof the Advisory Committee on Administrative and Budgetary Questions, and requests \nthe Secretary-General to ensure their full implementation;  \n \n \n \nBudget performance report for the period from 1 July 2019 to 30 June 2020 \n \n \n4. \nTakes note of the report of the Secretary-General on the budget \nperformance of the Mission for the period from 1 July 2019 to 30 June 2020; 3  \n \n5. \nAlso takes note of the amount of 16,632,600 dollars comprising the \nunencumbered balance of 10,428,500 dollars in respect of the financial period from \n1 July 2019 to 30 June 2020, as well as the other revenue and adjustments in the \namount of 6,204,100 dollars in respect of the same period, and decides to defer action \nthereon until it considers the final performance report of the Mission;  \n \n6. \nFurther takes note of the amount of 244,200 dollars representing the \nincrease in estimated staff assessment revenue in respect of the financial period from \n1 July 2019 to 30 June 2020, and decides to defer action thereon until it considers the \nfinal performance report of the Mission;  \n \n \n \nFinal disposition of the assets of the United Nations Mission for Justice Support \nin Haiti  \n \n \n7. \nTakes note of the report of the Secretary-General on the final disposition \nof the assets of the United Nations Mission for Justice Support in Haiti;4  \n \n8. \nRecalls paragraph 13 of the report of the Advisory Committee, 5  and \nencourages the Secretary-General to update and apply the lessons learned from the \ndisposition of assets in the Mission;  \n \n9. \nDecides to include in the provisional agenda of its seventy-seventh session \nthe item entitled \u201cFinancing of the United Nations Mission for Justice Support in \nHaiti\u201d.  \n \n89th plenary meeting \n29 June 2022 \n \n \n__________________ \n \n3  A/75/752. \n \n4  A/76/747. \n \n5  A/76/801. \n",
  "paragraphs": {
    "1": "Takes note of the status of contributions to the United Nations Mission for Justice Support in Haiti as at 30 April 2022, including the contributions outstanding in the amount of 19.6 million United States dollars, representing some 7.4 per cent of the total assessed contributions, notes with concern that only 158 Member States have __________________ 1 A/75/752 and A/76/747. 2 A/75/848 and A/76/801. A/RES/76/286 Financing of the United Nations Mission for Justice Support in Haiti 22-10345 2/2 paid their assessed contributions in full, and urges all other Member States, in particular those in arrears, to ensure payment of their outstanding assessed contributions;",
    "2": "Expresses its appreciation to those Member States that have paid their assessed contributions in full, and urges all other Member States to make every possible effort to ensure payment of their assessed contributions to the Mission in full;",
    "3": "Endorses the conclusions and recommendations contained in the reports of the Advisory Committee on Administrative and Budgetary Questions, and requests the Secretary-General to ensure their full implementation; Budget performance report for the period from 1 July 2019 to 30 June 2020",
    "4": "Takes note of the report of the Secretary-General on the budget performance of the Mission for the period from 1 July 2019 to 30 June 2020; 3",
    "5": "Also takes note of the amount of 16,632,600 dollars comprising the unencumbered balance of 10,428,500 dollars in respect of the financial period from 1 July 2019 to 30 June 2020, as well as the other revenue and adjustments in the amount of 6,204,100 dollars in respect of the same period, and decides to defer action thereon until it considers the final performance report of the Mission;",
    "6": "Further takes note of the amount of 244,200 dollars representing the increase in estimated staff assessment revenue in respect of the financial period from 1 July 2019 to 30 June 2020, and decides to defer action thereon until it considers the final performance report of the Mission; Final disposition of the assets of the United Nations Mission for Justice Support in Haiti",
    "7": "Takes note of the report of the Secretary-General on the final disposition of the assets of the United Nations Mission for Justice Support in Haiti;4",
    "8": "Recalls paragraph 13 of the report of the Advisory Committee, 5 and encourages the Secretary-General to update and apply the lessons learned from the disposition of assets in the Mission;",
    "9": "Decides to include in the provisional agenda of its seventy-seventh session the item entitled \u201cFinancing of the United Nations Mission for Justice Support in Haiti\u201d. 89th plenary meeting 29 June 2022 __________________ 3 A/75/752. 4 A/76/747. 5 A/76/801."
  },
  "agenda_items": [
    "Item 158"
  ],
  "symbol_references": []
}