{
  "symbol": "A/RES/73/242",
  "filename": "A_RES_73_242.pdf",
  "title": "73/242.  Follow-up to the Fourth United Nations Conference on the Least Developed Countries",
  "text": "United Nations \nA/RES/73/242\n \n \nGeneral Assembly \nDistr.: General \n17 January 2019 \n \n18-22620 (E)    210119     \n*1822620* \n \n \nSeventy-third session \nAgenda item 23 (a) \n \n \n \n \n Resolution adopted by the General Assembly \non 20 December 2018 \n \n \n \n \n[on the report of the Second Committee (A/73/541/Add.1)] \n \n \n 73/242.  Follow-up to the Fourth United Nations Conference on the Least \nDeveloped Countries  \n \n \n \nThe General Assembly, \n \nRecalling the Istanbul Declaration1 and the Programme of Action for the Least \nDeveloped Countries for the Decade 2011\u20132020, 2  adopted at the Fourth United \nNations Conference on the Least Developed Countries, held in Istanbul, Turkey, from \n9 to 13 May 2011, and endorsed by the General Assembly in its resolution 65/280 of \n17 June 2011, in which the Assembly called upon all the relevant stakeholders to \ncommit to implementing the Programme of Action, and recalling also the Political \nDeclaration adopted at the Comprehensive High-level Midterm Review of the \nImplementation of the Istanbul Programme of Action for the Least Developed \nCountries for the Decade 2011\u20132020, held in Antalya, Turkey, from 27 to 29 May \n2016, and endorsed by the Assembly in its resolution 70/294 of 25 July 2016, \n \nReaffirming the overarching goal of the Istanbul Programme of Action of \novercoming the structural challenges faced by the least developed countries to \neradicate poverty, achieve the internationally agreed development goals and enable \ngraduation from the least developed country category,  \n \nReaffirming also its resolution 70/1 of 25 September 2015, entitled \n\u201cTransforming our world: the 2030 Agenda for Sustainable Development\u201d, in which \nit adopted a comprehensive, far-reaching and people-centred set of universal and \ntransformative Sustainable Development Goals and targets, its commitment to \nworking tirelessly for the full implementation of the Agenda by 2030, its recognition \nthat eradicating poverty in all its forms and dimensions, including extreme poverty, \nis the greatest global challenge and an indispensable requirement for sustainable \ndevelopment, its commitment to achieving sustainable development in its three \n__________________ \n \n1  Report of the Fourth United Nations Conference on the Least Developed Countries, Istanbul, \nTurkey, 9\u201313 May 2011 (A/CONF.219/7), chap. I. \n \n2  Ibid., chap. II. \n\nA/RES/73/242 \nFollow-up to the Fourth United Nations Conference on the Least Developed Countries\n \n18-22620\n2/11 \n \ndimensions \u2013 economic, social and environmental \u2013 in a balanced and integrated \nmanner, and to building upon the achievements of the Millennium Development \nGoals and seeking to address their unfinished business, \n \nReaffirming further its resolution 69/313 of 27 July 2015 on the Addis Ababa \nAction Agenda of the Third International Conference on Financing for Development, \nwhich is an integral part of the 2030 Agenda for Sustainable Development, supports \nand complements it, helps to contextualize its means of implementation targets with \nconcrete policies and actions, and reaffirms the strong political commitment to \naddress the challenge of financing and creating an enabling environment at all levels \nfor sustainable development in the spirit of global partnership and solidarity,  \n \nWelcoming the Paris Agreement, 3  and encouraging all its parties to fully \nimplement the Agreement, and parties to the United Nations Framework Convention \non Climate Change 4  that have not yet done so to deposit their instruments of \nratification, acceptance, approval or accession, where appropriate, as soon as possible, \n \nHighlighting the synergies between the implementation of the 2030 Agenda for \nSustainable Development and the Paris Agreement, and noting with concern the \nscientific findings contained in the special report entitled Global Warming of 1.5\u00b0C \nof the Intergovernmental Panel on Climate Change,5 \n \nLooking forward to the climate summit called for by the Secretary-General, to \nbe held in New York in 2019, to accelerate global action on climate change, \n \nReaffirming the New Urban Agenda, adopted at the United Nations Conference \non Housing and Sustainable Urban Development (Habitat III), held in Quito from \n17 to 20 October 2016,6 and acknowledging that, in implementing the New Urban \nAgenda, particular attention should be given to the unique and emerging urban \nchallenges faced by the least developed countries, \n \nRecalling the Sendai Framework for Disaster Risk Reduction 2015\u20132030 and \nits guiding principles,7 recalling also its promotion of regular disaster preparedness, \nresponse and recovery exercises, at the national and local levels, with a view to \nensuring a rapid and effective response to disasters and related displacement, \nincluding access to essential food and non-food relief supplies, as appropriate to local \nneeds, and acknowledging that its implementation can contribute to achievement of \nthe goals and objectives of the Programme of Action for the Least Developed \nCountries for the Decade 2011\u20132020, \n \nRecalling also its resolution 72/231 of 20 December 2017 on the follow-up to \nthe Fourth United Nations Conference on the Least Developed Countries, \n \nRecalling further Economic and Social Council resolution 2018/26 of 24 July \n2018 on the Programme of Action for the Least Developed Countries for the \nDecade 2011\u20132020,  \n \nTaking note of the 2018 Ministerial Declaration of the Least Developed \nCountries,8 \n__________________ \n \n3  Adopted under the UNFCCC in FCCC/CP/2015/10/Add.1, decision 1/CP.21. \n \n4  United Nations, Treaty Series, vol. 1771, No. 30822. \n \n5  Global Warming of 1.5\u00b0C is a special report by the Intergovernmental Panel on Climate Change \non the impact of global warming of 1.5 \u00b0C above pre-industrial levels and related global \ngreenhouse gas emission pathways, in the context of strengthening the global response to the \nthreat of climate change, sustainable development and efforts to eradicate poverty. \n \n6  Resolution 71/256, annex. \n \n7  Resolution 69/283, annex II. \n \n8  A/73/455, annex. \n\nFollow-up to the Fourth United Nations Conference on the Least Developed Countries \nA/RES/73/242\n \n3/11\n18-22620 \n \n \nRecalling its resolutions 59/209 of 20 December 2004 and 67/221 of \n21 December 2012 on a smooth transition for countries graduating from the list of \nleast developed countries, \n \nReaffirming its resolution 71/243 of 21 December 2016 on the quadrennial \ncomprehensive policy review of operational activities for development of the United \nNations system, as well its resolution 72/279 of 31 May 2018 on the repositioning of \nthe United Nations development system in the context of the quadrennial \ncomprehensive policy review of operational activities for development of the United \nNations system, and emphasizing the importance of their full and timely \nimplementation,  \n \n1. \nTakes note of the reports of the Secretary-General on the implementation \nof the Programme of Action for the Least Developed Countries for the Decade \n2011\u201320209 and on the implementation, effectiveness and added value of smooth \ntransition measures and graduation support;10  \n \n2. \nCalls upon the least developed countries, their development partners, the \nUnited Nations system and all other actors to further strengthen the global partnership \nfor development for the least developed countries in all priority areas of the Istanbul \nProgramme of Action2 in order to ensure the timely, effective and full implementation \nof the Programme of Action during the remainder of the decade, in the context of the \n2030 Agenda for Sustainable Development,11 the Addis Ababa Action Agenda of the \nThird International Conference on Financing for Development, 12 which is an integral \npart of the 2030 Agenda, supports and complements it and helps to contextualize its \nmeans of implementation targets with concrete policies and actions, the Paris \nAgreement3 adopted under the United Nations Framework Convention on Climate \nChange,4 the Sendai Framework for Disaster Risk Reduction 2015\u201320307 and the \nNew Urban Agenda;6 \n \n3. \nInvites the private sector, civil society, academia and foundations to \ncontribute to the implementation of the Istanbul Programme of Action in their \nrespective areas of competence, in line with the national priorities of the least \ndeveloped countries; \n \n4. \nRecalls the agreement contained in the 2030 Agenda for Sustainable \nDevelopment that effective linkages will be made with the follow-up and review \narrangements of all relevant United Nations conferences and processes, including on \nthe least developed countries, underlines the importance of strong synergy in the \nimplementation of the recently adopted agendas and the Istanbul Programme of \nAction at all levels, and encourages coordination and coherence in the follow-up of \ntheir implementation; \n \n5. \nReaffirms that the least developed countries, as the most vulnerable group \nof countries, need enhanced global support to overcome the structural challenges they \nface in implementing the 2030 Agenda for Sustainable Development, and in this \nregard calls upon the international community to prioritize and strengthen support \nfrom all sources to facilitate the coordinated implementation and coherent follow-up \nand monitoring of the Istanbul Programme of Action, the 2030 Agenda and the Addis \nAbaba Action Agenda in the least developed countries; \n \n6. \nRecognizes that significant additional domestic public and private \nresources, including at the subnational level, supplemented by international \nassistance and foreign direct investment, as appropriate, will be critical for the \n__________________ \n \n9  A/73/80-E/2018/58. \n \n10  A/73/291. \n \n11  Resolution 70/1. \n \n12  Resolution 69/313, annex. \n\nA/RES/73/242 \nFollow-up to the Fourth United Nations Conference on the Least Developed Countries\n \n18-22620\n4/11 \n \nrealization of sustainable development and the achievement of the Sustainable \nDevelopment Goals, and that the 2030 Agenda for Sustainable Development and the \nAddis Ababa Action Agenda acknowledge the centrality of domestic resource \nmobilization, underscored by the principle of national ownership; \n \n7. \nAlso recognizes that, while the least developed countries have made \nconsiderable efforts to mobilize domestic resources and attract private investment, \nfurther progress is needed; \n \n8. \nWelcomes the reversal in the decline of official development assistance to \nthe least developed countries in 2017, while expressing its concern that bilateral \nofficial development assistance to the least developed countries remains far from the \ntarget of 0.15 to 0.20 per cent of gross national income committed by many developed \ncountries, as set out in the Istanbul Programme of Action and reaffirmed in the Addis \nAbaba Action Agenda, and expressing its appreciation to those few countries that \nhave met or surpassed their commitments to 0.7 per cent of gross national income for \nofficial development assistance to developing countries and the target of 0.15 to \n0.20 per cent of gross national income for official development assistance to the least \ndeveloped countries, urges all others to step up efforts to increase their official \ndevelopment assistance and to make additional concrete efforts towards the official \ndevelopment assistance targets, reiterates that the fulfilment of all official \ndevelopment assistance commitments remains crucial, \ncalls upon official \ndevelopment assistance providers to fulfil their respective official development \nassistance commitments to the least developed countries, and encourages official \ndevelopment assistance providers to consider setting a target to provide at least \n0.2 per cent of gross national income for official development assistance to the least \ndeveloped countries, while reiterating that an important use of international public \nfinance, including official development assistance, is to catalyse additional resource \nmobilization from other sources, public and private;  \n \n9. \nIs encouraged by those countries which are allocating at least 50 per cent \nof their official development assistance to the least developed countries;  \n \n10. Welcomes continued efforts to improve the quality, impact and \neffectiveness of development cooperation and other international efforts in public \nfinance, including adherence to agreed development cooperation effectiveness \nprinciples; \n \n11. \nCalls upon the developing countries, guided by the spirit of solidarity and \nconsistent with their capabilities, to provide support for the effective implementation \nof the Istanbul Programme of Action in mutually agreed areas of cooperation within \nthe framework of South-South cooperation, which is a complement to but not a \nsubstitute for North-South cooperation; \n \n12. Notes that exports of goods and services of the least developed countries \nincreased by 13 per cent in 2017 after three years of continued negative growth, \nexpresses its concern that the share of goods and services exports, which stood at \n0.9 per cent in 2017, remains far from the target of 2 per cent of global exports called \nfor in the Istanbul Programme of Action and target 17.11 of the Sustainable \nDevelopment Goals, and calls upon the least developed countries and their development \npartners to take the measures necessary to further accelerate the progress, with a view \nto achieving the targets of the Programme of Action and the 2030 Agenda;  \n \n13. Urges the least developed countries and their development partners to \nmake use of existing initiatives and programmes, such as the relevant ministerial \ndecisions of the World Trade Organization on duty-free and quota-free market access \nfor the least developed countries and on preferential rules of origin for those \ncountries, as well as aid for trade, reiterates its commitment to increase aid-for-trade \n\nFollow-up to the Fourth United Nations Conference on the Least Developed Countries \nA/RES/73/242\n \n5/11\n18-22620 \n \nsupport, in particular for the least developed countries, strives to allocate an \nincreasing proportion of aid for trade to the least developed countries, in accordance \nwith development cooperation effectiveness principles, welcomes additional \ncooperation among developing countries to that end, and encourages the least \ndeveloped countries to mainstream trade in their national development plans;  \n \n14. Recognizes that the least developed countries face significant \ninfrastructure gaps, including in the areas of transport, energy and information and \ncommunications technology, and reaffirms the need to promote quality, reliable, \nsustainable and resilient infrastructure and to enhance infrastructure connectivity \nwith concrete actions, maximizing synergies in infrastructure planning and \ndevelopment; \n \n15. Emphasizes that the acute energy gap faced by the least developed \ncountries is a severe constraint on their structural transformation, and stresses that \nspecial attention should be given to the least developed countries, including \nthroughout the United Nations Decade of Sustainable Energy for All (2014\u20132024), \nwith a view to ensuring the realization of the objective of access to affordable, \nreliable, sustainable and modern energy for all by 2030 and to addressing the \ninfrastructure needs of the least developed countries; \n \n16. Recognizes the significant potential of regional economic integration and \ninterconnectivity to promote inclusive growth and sustainable development in the \nleast developed countries, and stresses the need to strengthen regional cooperation to \nimprove connectivity and competitiveness, increase productivity, lower transaction \ncosts and expand markets; \n \n17. Also recognizes that maintaining sustainable debt levels is the \nresponsibility of the borrowing countries, while acknowledging that lenders also have \na responsibility to lend in such a way that does not undermine a country\u2019s debt \nsustainability, recalls the need to strengthen information-sharing and transparency to \nmake sure that debt sustainability assessments are based on comprehensive, objective \nand reliable data, encourages Member States to work towards global consensus and \nbest practices on guidelines for debtor and creditor responsibilities in borrowing by \nand lending to sovereigns, building on existing initiatives, and underlines that the \ndebt sustainability framework for the least developed countries should systematically \ntake into account their structural constraints and longer-term investment requirements \nfor the implementation of the Sustainable Development Goals; \n \n18. Expresses its deep concern that a number of least developed countries are \nin debt distress or at high risk of debt distress13 and that the ratio of debt service to \nexports has worsened sharply, rising from 4.1 per cent in 2008 to almost 10 per cent \nin 2017, underlines the urgent need to address the debt problems of the least \ndeveloped countries, and stresses the need for the international community to remain \nvigilant in monitoring the debt situation of the least developed countries and to \ncontinue to take effective measures, preferably within existing frameworks, when \napplicable, to address the debt problem of those countries, including through \ncoordinated policies aimed at fostering debt financing, debt relief, debt restructuring \nand sound debt management, as appropriate, for the multilateral and bilateral debt \nowed by the least developed countries to creditors, both public and private, reiterates \nits commitment to work through existing initiatives, such as the Heavily Indebted \nPoor Countries Initiative, and reaffirms the importance of transparency in debt \nmanagement; \n__________________ \n \n13  See International Monetary Fund, Debt Sustainability Analysis: Low-Income Countries. \n\nA/RES/73/242 \nFollow-up to the Fourth United Nations Conference on the Least Developed Countries\n \n18-22620\n6/11 \n \n \n19. Expresses its concern that foreign direct investment flows to the least \ndeveloped countries contracted by 17 per cent in 2017 compared with 2016, with \ncontinued concentration on extractive and related industries, and underlines the need \nto take the measures necessary at all levels to further accelerate foreign direct \ninvestment in the least developed countries; \n \n20. Encourages the least developed countries, in accordance with their \nnational plans and priorities, and with the full support of their development partners, \nto develop their capacities to track financial transactions, administer taxation and \nregulate customs and to redouble their efforts to substantially reduce illicit financial \nflows by 2030, with a view to eventually eliminating them, including by combating \ntax evasion and corruption through strengthened national regulation, and also \nencourages the United Nations and other relevant international bodies to help to \nsupport these efforts, in accordance with their respective mandates; \n \n21. Recalls target 17.5 of the Sustainable Development Goals, in which the \nGeneral Assembly decided to adopt and implement investment promotion regimes for \nleast developed countries, and underlines the need for its early implementation, \ninvites the Secretary-General, in his capacity as the Chair of the United Nations \nSystem Chief Executives Board for Coordination, to retain the issue of investment \npromotion regimes for the least developed countries in the agenda of the Board, with \na view to enhancing the overall effectiveness of the support provided by the United \nNations system to increase the flow of foreign direct investment to the least developed \ncountries and the ability of those countries to attract such investment, and in that \ncontext takes note of the initiative of the Office of the High Representative for the \nLeast Developed Countries, Landlocked Developing Countries and Small Island \nDeveloping States, jointly with the United Nations Conference on Trade and \nDevelopment, the United Nations Industrial Development Organization, the \nInternational Labour Organization, the Enhanced Integrated Framework and the \nWorld Association of Investment Promotion Agencies, to set up a capacity-\ndevelopment programme for the investment promotion agencies of the least \ndeveloped countries, and calls for financial support to operationalize this programme; \n \n22. Welcomes the operationalization of the Technology Bank for the Least \nDeveloped Countries and the inauguration of its headquarters in Gebze, Turkey, \nwhich signify the achievement of the first Sustainable Development Goal target, \ntarget 17.8, takes note with appreciation of the contributions that Bangladesh, India, \nNorway and Turkey have made, as well as the pledges made by the Philippines and \nthe Sudan, and invites Member States, as well as international organizations, \nfoundations and the private sector, to provide voluntary financial contributions and \ntechnical assistance to the Technology Bank to ensure its effective operation;  \n \n23. Expresses its deep concern that, owing to significant capacity constraints, \nthe least developed countries are disproportionately affected by the adverse impacts \nof climate change, including persistent drought and extreme weather events, sea level \nrise, coastal erosion, salinity intrusion, glacial lake outburst floods, ocean \nacidification and the rise in frequency, as well as the impact, of natural and human-\nmade disasters, which further threaten food security, health and efforts to eradicate \npoverty and achieve sustainable development, and expresses its concern that women \nand girls are often disproportionately affected by the impacts of climate change and \nother environmental issues; \n \n24. Recognizes that disasters, many of which are exacerbated by climate \nchange and which are increasing in frequency and intensity, significantly impede \nprogress towards sustainable development, and also recognizes the synergies between \nthe implementation of the Paris Agreement adopted under the United Nations \nFramework Convention on Climate Change and the 2030 Agenda for Sustainable \n\nFollow-up to the Fourth United Nations Conference on the Least Developed Countries \nA/RES/73/242\n \n7/11\n18-22620 \n \nDevelopment, acknowledges the importance of continued support for and \ninternational cooperation on adaptation and mitigation efforts and on strengthening \nresilience, stresses the necessity of adequate and predictable financial resources from \na variety of sources, including public and private ones, highlights the specific needs \nand special circumstances of developing countries, especially those that are \nparticularly vulnerable to the adverse effects of climate change, recognizes that \neffective disaster risk management contributes to sustainable development, and in this \nregard underlines the importance of strengthening disaster risk reduction and early \nwarning systems in order to minimize the consequences of disasters;  \n \n25. Underlines the importance of peaceful and inclusive societies for the \nachievement of the Sustainable Development Goals, and recalls the objectives of the \nIstanbul Programme of Action of enhancing good governance at all levels by \nstrengthening democratic processes, building effective, accountable and inclusive \ninstitutions and the rule of law; increasing efficiency, coherence, transparency and \nparticipation; protecting and promoting human rights and fundamental freedoms; \nreducing corruption and curbing illicit financial flows; and strengthening the capacity \nof the Governments of the least developed countries to play an effective role in their \neconomic and social development;  \n \n26. Recognizes the importance of developing domestic capital markets in the \nleast developed countries, which can help to channel the growing pool of domestic \nsavings towards productive investments, reaffirms the commitment to enhance \ninternational support in developing domestic capital markets in developing countries, \nin particular in the least developed countries, and reaffirms its commitment to work \nto strengthen capacity-building in this area, including through regional, interregional \nand global forums for knowledge-sharing, technical assistance and data-sharing, on \nmutually agreed terms;  \n \n27. Reaffirms that achieving gender equality, empowering all women and girls \nand the full realization of the human rights of all people are essential to achieving \nsustained, inclusive and equitable economic growth and sustainable development, and \nreiterates the need for gender mainstreaming, including targeted actions and \ninvestments in the formulation and implementation of all financial, economic, \nenvironmental and social policies in the least developed countries;  \n \n28. Recognizes that particular efforts are needed to ensure that all young \npeople, including girls, enjoy access to lifelong learning opportunities and equal \naccess to quality education at all levels, inclusive of early childhood, primary, \nsecondary and tertiary education, as well as technical and vocational training, notes \nwith concern, in this regard, the lack of progress in closing gender gaps in access to, \nretention in and completion of secondary education, recognizes the need to continue \nto provide and encourage, as appropriate, institutes of higher education to allocate \nplaces and scholarships for students and trainees from the least developed countries, \nin particular in the fields of science, technology, business management and \neconomics, and to strengthen support for institutions in relation to gender equality \nand the empowerment of women at the global, regional and national levels, and \nrecognizes that the least developed countries have the most to gain from sustainable \ndevelopment and utilizing the full skills and talents of their people, including women \nand girls;  \n \n29. Also recognizes that increasing participation, empowering civil society, \nyouth and women and strengthening collective action will contribute to the \neradication of poverty and the achievement of sustainable development;  \n \n30. Underlines the need to reduce the vulnerability of the least developed \ncountries to economic, natural and environmental shocks and disasters, as well as \nclimate change, and to enhance their ability to meet these and other challenges by \n\nA/RES/73/242 \nFollow-up to the Fourth United Nations Conference on the Least Developed Countries\n \n18-22620\n8/11 \n \nstrengthening their resilience, and in this regard stresses that it is important that all \ncountries and other actors work together to further develop and implement concrete \nmeasures, on an urgent basis, at the national and international levels so as to build the \nresilience of the least developed countries to withstand economic shocks and mitigate \ntheir adverse effects, to withstand and overcome the adverse effects of climate \nchange, to enhance sustainable growth and protect biodiversity and to withstand \nnatural hazards in order to reduce the risk of disasters, as agreed upon in the Istanbul \nProgramme of Action; \n \n31. Also underlines the need to address the economic, social and \nenvironmental impacts of climate change, and emphasizes the need for national and \ninternational action to enhance efforts to build resilience, especially for the most \nvulnerable, including through mainstreaming resilience into investment decision-\nmaking, building resilience through sustainable management of ecosystems and value \nchains and building resilience to reduce the impact and cost of natural disasters; \n \n32. Further underlines the importance of improving the coordination and \neffectiveness of resilience-building initiatives for the least developed countries by \nleveraging existing measures at the national, regional and global levels to respond to \nvarious types of disasters and shocks, as elaborated in the report of the Secretary-\nGeneral on crisis mitigation and resilience-building for the least developed \ncountries;14 \n \n33. Encourages countries to develop national and local disaster risk reduction \nstrategies by 2020, in accordance with target (e) of the Sendai Framework, recognizes \nthe importance of promoting their alignment and integration with sustainable \ndevelopment and climate change adaptation strategies, recognizes that the \ndevelopment of climate change adaptation and national disaster risk reduction \nstrategies by 2020 is an opportunity to maximize synergies across the Sustainable \nDevelopment Goals, the Paris Agreement and the Sendai Framework, and in this \nregard calls for disaster risk reduction to be considered in the review of and follow-up \nto the Istanbul Programme of Action;  \n \n34. Reiterates the call to substantially enhance international cooperation to \ndeveloping countries through adequate and sustainable support to complement their \nnational actions for the implementation of the Sendai Framework by 2030; \n \n35. Congratulates those countries that have met the criteria for graduation \nfrom least developed country status, notes with appreciation that several least \ndeveloped countries have expressed their intention to reach the status of graduation \nby 2020, invites those countries to start the preparations for their graduation and \ntransition strategy, and requests all relevant organizations of the United Nations \nsystem, led by the Office of the High Representative, to extend necessary support in \nthis regard, in a coordinated manner; \n \n36. Acknowledges that the graduation of a country symbolizes its considerable \nlong-term socioeconomic progress, prevailing over the structural handicaps to \nsocioeconomic development, and that it also presents many challenges for graduated \ncountries, which continue to face vulnerabilities to various shocks and crises; \n \n37. Invites the least developed countries and development partners to integrate \ngraduation and smooth transition strategies into their respective national development \nand aid strategies, as appropriate, including capacity-building and technical \nassistance to diversify sources of financing; \n__________________ \n \n14  A/72/270. \n\nFollow-up to the Fourth United Nations Conference on the Least Developed Countries \nA/RES/73/242\n \n9/11\n18-22620 \n \n \n38. Notes with appreciation that some development partners have extended \nsome of the benefits specific to the least developed countries to countries that have \ngraduated, taking into account the challenges they continue to face, and invites all \ndevelopment partners to strengthen their support for graduation and smooth transition \nso that graduating and recently graduated countries can minimize disruption in their \ndevelopment trajectory;  \n \n39. Invites countries that are found eligible for graduation to establish a \nconsultative mechanism, in line with General Assembly resolution 67/221, to prepare \nthe transition strategy as early as possible, engaging all relevant donors and \nstakeholders;  \n \n40. Recognizes that the activities relating to the least developed countries \ncarried out within the Secretariat need to be further coordinated and consolidated in \norder to ensure the effective monitoring and follow-up of the Istanbul Programme of \nAction, led by the Office of the High Representative, and to provide well-coordinated \nsupport to realizing the goal of enabling half of the least developed countries to meet \nthe criteria for graduation by 2020;  \n \n41. Takes note of the work of the Inter-Agency Consultative Group for the \nleast developed countries, led by the Office of the High Representative, notes the \nsteps taken by the United Nations System Chief Executives Board for Coordination \nand the High-level Committee on Programmes in supporting the coordination and \nfollow-up of the implementation of the Istanbul Programme of Action on a system-\nwide basis, and reiterates its invitation to the Secretary-General, in his capacity as \nChair of the Chief Executives Board, to include the implementation of the Programme \nof Action in the agenda of the Board; \n \n42. Recalls paragraph 157 of the Programme of Action for the Least \nDeveloped Countries for the Decade 2011\u20132020 on holding a Fifth United Nations \nConference on the Least Developed Countries in order to make a comprehensive \nappraisal of the implementation of the Programme of Action and to decide on \nsubsequent action, and decides to convene the Fifth United Nations Conference on \nthe Least Developed Countries at the highest possible level, including Heads of State \nand Government, in 2021 for a duration of not more than five working days, with the \nfollowing mandate: \n \n(a) \nTo undertake a comprehensive appraisal of the implementation of the \nProgramme of Action by the least developed countries and their development \npartners, share best practices and lessons learned and identify obstacles and \nconstraints encountered as well as actions and initiatives needed to overcome them; \n \n(b) \nTo identify effective international and domestic policies in the light of the \noutcome of the appraisal as well as new and emerging challenges and opportunities \nand the means to address them; \n \n(c) \nTo reaffirm the global commitment to addressing the special needs of the \nleast developed countries made at the major United Nations conferences and summits, \nincluding in the 2030 Agenda for Sustainable Development, the Addis Ababa Action \nAgenda, the Paris Agreement and the Sendai Framework; \n \n(d) \nTo mobilize additional international support measures and action, in \naddition to domestic resources, in favour of the least developed countries and, in this \nregard, to formulate and adopt a renewed partnership between the least developed \ncountries and their development partners, including the private sector, civil society \nand governments at all levels; \n\nA/RES/73/242 \nFollow-up to the Fourth United Nations Conference on the Least Developed Countries\n \n18-22620\n10/11 \n \n \n43. Decides to convene, towards the end of 2020 and/or early in 2021, an \nintergovernmental preparatory committee, which would hold no more than two \nmeetings of no more than five days each;  \n \n44. Also decides to take a decision on the organizational aspects, date and \nvenue of the Conference and on the venue, duration and dates of the preparatory \ncommittee meetings at its seventy-fourth session;  \n \n45. Further decides that the meetings of the preparatory committee will be \npreceded by two regional preparatory meetings, each no longer than three days, one \nin collaboration with the Economic Commission for Africa and the other in \ncollaboration with the Economic and Social Commission for Asia and the Pacific, in \nthe context of the regular annual session of each Commission, with those regional \nmeetings to be supported by broad-based and inclusive country-level preparations;  \n \n46. Emphasizes the importance of country-level preparations as a critical input \nto the preparatory process for the Conference and in the implementation of and \nfollow-up to its outcome, and calls upon the Governments of the least developed \ncountries to submit their reports in a timely manner; \n \n47. Stresses that the Conference and the preparatory activities should be \ncarried out within the budget level proposed by the Secretary-General for 2020 and \n2021 and should be organized in the most effective and efficient manner possible; \n \n48. Decides that the Office of the High Representative will be the focal point \nfor the preparations for the Conference, in accordance with mandates given by the \nGeneral Assembly in its resolution 56/227 of 24 December 2001, to ensure that those \npreparations are carried out effectively and to mobilize and coordinate the active \ninvolvement of the entire United Nations system; \n \n49. Encourages the organizations of the United Nations system, including the \nUnited Nations Development Programme, the United Nations Conference on Trade \nand Development, the regional commissions, the specialized agencies, the funds and \nprogrammes, the Bretton Woods institutions, the World Trade Organization and other \nrelevant international and regional organizations, within their respective mandates, to \nprovide necessary support and to contribute actively to the preparatory process and \nthe Conference itself; \n \n50. Requests the Secretary-General to ensure, as appropriate, the full \ninvolvement of resident coordinators and country teams in the preparations for the \nConference, in particular in the country-level and regional preparations; \n \n51. Strongly encourages Governments, intergovernmental and non-governmental \norganizations, major groups and other donors to contribute in a timely manner to the \ntrust fund in support of activities undertaken by the Office of the High Representative \nto support the implementation, follow-up and monitoring of the Istanbul Programme \nof Action and the participation of the representatives from the least developed \ncountries in the high-level political forum on sustainable development of the \nEconomic and Social Council as well as in other relevant forums and the preparatory \nprocess of the Conference, and in this regard expresses its appreciation to those \ncountries that have made voluntary contributions to the trust fund;  \n \n52. Requests the Secretary-General to submit to the General Assembly at its \nseventy-fourth session a report on the implementation of the present resolution and \nthe Istanbul Programme of Action, and decides to include in the provisional agenda \nof its seventy-fourth session, under the item entitled \u201cGroups of countries in special \nsituations\u201d, the sub-item entitled \u201cFollow-up to the Fourth United Nations Conference \non the Least Developed Countries\u201d; \n\nFollow-up to the Fourth United Nations Conference on the Least Developed Countries \nA/RES/73/242\n \n11/11\n18-22620 \n \n \n53. Also requests the Secretary-General to submit to the General Assembly at \nits seventy-sixth session a progress report on the implementation, effectiveness and \nadded value of smooth transition measures covering both graduating and recently \ngraduated countries, including new and dedicated support measures to graduated \ncountries in moving forward on their development path and initiatives taken by the \nUnited Nations system to support countries during their graduation from the least \ndeveloped country category.  \n \n62nd plenary meeting  \n20 December 2018 \n \n",
  "paragraphs": {
    "1": "Takes note of the reports of the Secretary-General on the implementation of the Programme of Action for the Least Developed Countries for the Decade 2011\u201320209 and on the implementation, effectiveness and added value of smooth transition measures and graduation support;10",
    "2": "Calls upon the least developed countries, their development partners, the United Nations system and all other actors to further strengthen the global partnership for development for the least developed countries in all priority areas of the Istanbul Programme of Action2 in order to ensure the timely, effective and full implementation of the Programme of Action during the remainder of the decade, in the context of the 2030 Agenda for Sustainable Development,11 the Addis Ababa Action Agenda of the Third International Conference on Financing for Development, 12 which is an integral part of the 2030 Agenda, supports and complements it and helps to contextualize its means of implementation targets with concrete policies and actions, the Paris Agreement3 adopted under the United Nations Framework Convention on Climate Change,4 the Sendai Framework for Disaster Risk Reduction 2015\u201320307 and the New Urban Agenda;6",
    "3": "Invites the private sector, civil society, academia and foundations to contribute to the implementation of the Istanbul Programme of Action in their respective areas of competence, in line with the national priorities of the least developed countries;",
    "4": "Recalls the agreement contained in the 2030 Agenda for Sustainable Development that effective linkages will be made with the follow-up and review arrangements of all relevant United Nations conferences and processes, including on the least developed countries, underlines the importance of strong synergy in the implementation of the recently adopted agendas and the Istanbul Programme of Action at all levels, and encourages coordination and coherence in the follow-up of their implementation;",
    "5": "Reaffirms that the least developed countries, as the most vulnerable group of countries, need enhanced global support to overcome the structural challenges they face in implementing the 2030 Agenda for Sustainable Development, and in this regard calls upon the international community to prioritize and strengthen support from all sources to facilitate the coordinated implementation and coherent follow-up and monitoring of the Istanbul Programme of Action, the 2030 Agenda and the Addis Ababa Action Agenda in the least developed countries;",
    "6": "Recognizes that significant additional domestic public and private resources, including at the subnational level, supplemented by international assistance and foreign direct investment, as appropriate, will be critical for the realization of sustainable development and the achievement of the Sustainable Development Goals, and that the 2030 Agenda for Sustainable Development and the Addis Ababa Action Agenda acknowledge the centrality of domestic resource mobilization, underscored by the principle of national ownership;",
    "7": "Also recognizes that, while the least developed countries have made considerable efforts to mobilize domestic resources and attract private investment, further progress is needed;",
    "8": "Welcomes the reversal in the decline of official development assistance to the least developed countries in 2017, while expressing its concern that bilateral official development assistance to the least developed countries remains far from the target of 0.15 to 0.20 per cent of gross national income committed by many developed countries, as set out in the Istanbul Programme of Action and reaffirmed in the Addis Ababa Action Agenda, and expressing its appreciation to those few countries that have met or surpassed their commitments to 0.7 per cent of gross national income for official development assistance to developing countries and the target of 0.15 to 0.20 per cent of gross national income for official development assistance to the least developed countries, urges all others to step up efforts to increase their official development assistance and to make additional concrete efforts towards the official development assistance targets, reiterates that the fulfilment of all official development assistance commitments remains crucial, calls upon official development assistance providers to fulfil their respective official development assistance commitments to the least developed countries, and encourages official development assistance providers to consider setting a target to provide at least 0.2 per cent of gross national income for official development assistance to the least developed countries, while reiterating that an important use of international public finance, including official development assistance, is to catalyse additional resource mobilization from other sources, public and private;",
    "9": "Is encouraged by those countries which are allocating at least 50 per cent of their official development assistance to the least developed countries;",
    "10": "Welcomes continued efforts to improve the quality, impact and effectiveness of development cooperation and other international efforts in public finance, including adherence to agreed development cooperation effectiveness principles;",
    "11": "Calls upon the developing countries, guided by the spirit of solidarity and consistent with their capabilities, to provide support for the effective implementation of the Istanbul Programme of Action in mutually agreed areas of cooperation within the framework of South-South cooperation, which is a complement to but not a substitute for North-South cooperation;",
    "12": "Notes that exports of goods and services of the least developed countries increased by 13 per cent in 2017 after three years of continued negative growth, expresses its concern that the share of goods and services exports, which stood at 0.9 per cent in 2017, remains far from the target of 2 per cent of global exports called for in the Istanbul Programme of Action and target 17.11 of the Sustainable Development Goals, and calls upon the least developed countries and their development partners to take the measures necessary to further accelerate the progress, with a view to achieving the targets of the Programme of Action and the 2030 Agenda;",
    "13": " support, in particular for the least developed countries, strives to allocate an increasing proportion of aid for trade to the least developed countries, in accordance with development cooperation effectiveness principles, welcomes additional cooperation among developing countries to that end, and encourages the least developed countries to mainstream trade in their national development plans;",
    "14": "Recognizes that the least developed countries face significant infrastructure gaps, including in the areas of transport, energy and information and communications technology, and reaffirms the need to promote quality, reliable, sustainable and resilient infrastructure and to enhance infrastructure connectivity with concrete actions, maximizing synergies in infrastructure planning and development;",
    "15": "Emphasizes that the acute energy gap faced by the least developed countries is a severe constraint on their structural transformation, and stresses that special attention should be given to the least developed countries, including throughout the United Nations Decade of Sustainable Energy for All (2014\u20132024), with a view to ensuring the realization of the objective of access to affordable, reliable, sustainable and modern energy for all by 2030 and to addressing the infrastructure needs of the least developed countries;",
    "16": "Recognizes the significant potential of regional economic integration and interconnectivity to promote inclusive growth and sustainable development in the least developed countries, and stresses the need to strengthen regional cooperation to improve connectivity and competitiveness, increase productivity, lower transaction costs and expand markets;",
    "17": "Also recognizes that maintaining sustainable debt levels is the responsibility of the borrowing countries, while acknowledging that lenders also have a responsibility to lend in such a way that does not undermine a country\u2019s debt sustainability, recalls the need to strengthen information-sharing and transparency to make sure that debt sustainability assessments are based on comprehensive, objective and reliable data, encourages Member States to work towards global consensus and best practices on guidelines for debtor and creditor responsibilities in borrowing by and lending to sovereigns, building on existing initiatives, and underlines that the debt sustainability framework for the least developed countries should systematically take into account their structural constraints and longer-term investment requirements for the implementation of the Sustainable Development Goals;",
    "18": "Expresses its deep concern that a number of least developed countries are in debt distress or at high risk of debt distress13 and that the ratio of debt service to exports has worsened sharply, rising from 4.1 per cent in 2008 to almost 10 per cent in 2017, underlines the urgent need to address the debt problems of the least developed countries, and stresses the need for the international community to remain vigilant in monitoring the debt situation of the least developed countries and to continue to take effective measures, preferably within existing frameworks, when applicable, to address the debt problem of those countries, including through coordinated policies aimed at fostering debt financing, debt relief, debt restructuring and sound debt management, as appropriate, for the multilateral and bilateral debt owed by the least developed countries to creditors, both public and private, reiterates its commitment to work through existing initiatives, such as the Heavily Indebted Poor Countries Initiative, and reaffirms the importance of transparency in debt management;",
    "19": "Expresses its concern that foreign direct investment flows to the least developed countries contracted by 17 per cent in 2017 compared with 2016, with continued concentration on extractive and related industries, and underlines the need to take the measures necessary at all levels to further accelerate foreign direct investment in the least developed countries;",
    "20": "Encourages the least developed countries, in accordance with their national plans and priorities, and with the full support of their development partners, to develop their capacities to track financial transactions, administer taxation and regulate customs and to redouble their efforts to substantially reduce illicit financial flows by 2030, with a view to eventually eliminating them, including by combating tax evasion and corruption through strengthened national regulation, and also encourages the United Nations and other relevant international bodies to help to support these efforts, in accordance with their respective mandates;",
    "21": "Recalls target 17.5 of the Sustainable Development Goals, in which the General Assembly decided to adopt and implement investment promotion regimes for least developed countries, and underlines the need for its early implementation, invites the Secretary-General, in his capacity as the Chair of the United Nations System Chief Executives Board for Coordination, to retain the issue of investment promotion regimes for the least developed countries in the agenda of the Board, with a view to enhancing the overall effectiveness of the support provided by the United Nations system to increase the flow of foreign direct investment to the least developed countries and the ability of those countries to attract such investment, and in that context takes note of the initiative of the Office of the High Representative for the Least Developed Countries, Landlocked Developing Countries and Small Island Developing States, jointly with the United Nations Conference on Trade and Development, the United Nations Industrial Development Organization, the International Labour Organization, the Enhanced Integrated Framework and the World Association of Investment Promotion Agencies, to set up a capacity- development programme for the investment promotion agencies of the least developed countries, and calls for financial support to operationalize this programme;",
    "22": "Welcomes the operationalization of the Technology Bank for the Least Developed Countries and the inauguration of its headquarters in Gebze, Turkey, which signify the achievement of the first Sustainable Development Goal target, target 17.8, takes note with appreciation of the contributions that Bangladesh, India, Norway and Turkey have made, as well as the pledges made by the Philippines and the Sudan, and invites Member States, as well as international organizations, foundations and the private sector, to provide voluntary financial contributions and technical assistance to the Technology Bank to ensure its effective operation;",
    "23": "Expresses its deep concern that, owing to significant capacity constraints, the least developed countries are disproportionately affected by the adverse impacts of climate change, including persistent drought and extreme weather events, sea level rise, coastal erosion, salinity intrusion, glacial lake outburst floods, ocean acidification and the rise in frequency, as well as the impact, of natural and human- made disasters, which further threaten food security, health and efforts to eradicate poverty and achieve sustainable development, and expresses its concern that women and girls are often disproportionately affected by the impacts of climate change and other environmental issues;",
    "24": " Development, acknowledges the importance of continued support for and international cooperation on adaptation and mitigation efforts and on strengthening resilience, stresses the necessity of adequate and predictable financial resources from a variety of sources, including public and private ones, highlights the specific needs and special circumstances of developing countries, especially those that are particularly vulnerable to the adverse effects of climate change, recognizes that effective disaster risk management contributes to sustainable development, and in this regard underlines the importance of strengthening disaster risk reduction and early warning systems in order to minimize the consequences of disasters;",
    "25": "Underlines the importance of peaceful and inclusive societies for the achievement of the Sustainable Development Goals, and recalls the objectives of the Istanbul Programme of Action of enhancing good governance at all levels by strengthening democratic processes, building effective, accountable and inclusive institutions and the rule of law; increasing efficiency, coherence, transparency and participation; protecting and promoting human rights and fundamental freedoms; reducing corruption and curbing illicit financial flows; and strengthening the capacity of the Governments of the least developed countries to play an effective role in their economic and social development;",
    "26": "Recognizes the importance of developing domestic capital markets in the least developed countries, which can help to channel the growing pool of domestic savings towards productive investments, reaffirms the commitment to enhance international support in developing domestic capital markets in developing countries, in particular in the least developed countries, and reaffirms its commitment to work to strengthen capacity-building in this area, including through regional, interregional and global forums for knowledge-sharing, technical assistance and data-sharing, on mutually agreed terms;",
    "27": "Reaffirms that achieving gender equality, empowering all women and girls and the full realization of the human rights of all people are essential to achieving sustained, inclusive and equitable economic growth and sustainable development, and reiterates the need for gender mainstreaming, including targeted actions and investments in the formulation and implementation of all financial, economic, environmental and social policies in the least developed countries;",
    "28": "Recognizes that particular efforts are needed to ensure that all young people, including girls, enjoy access to lifelong learning opportunities and equal access to quality education at all levels, inclusive of early childhood, primary, secondary and tertiary education, as well as technical and vocational training, notes with concern, in this regard, the lack of progress in closing gender gaps in access to, retention in and completion of secondary education, recognizes the need to continue to provide and encourage, as appropriate, institutes of higher education to allocate places and scholarships for students and trainees from the least developed countries, in particular in the fields of science, technology, business management and economics, and to strengthen support for institutions in relation to gender equality and the empowerment of women at the global, regional and national levels, and recognizes that the least developed countries have the most to gain from sustainable development and utilizing the full skills and talents of their people, including women and girls;",
    "29": "Also recognizes that increasing participation, empowering civil society, youth and women and strengthening collective action will contribute to the eradication of poverty and the achievement of sustainable development;",
    "30": " strengthening their resilience, and in this regard stresses that it is important that all countries and other actors work together to further develop and implement concrete measures, on an urgent basis, at the national and international levels so as to build the resilience of the least developed countries to withstand economic shocks and mitigate their adverse effects, to withstand and overcome the adverse effects of climate change, to enhance sustainable growth and protect biodiversity and to withstand natural hazards in order to reduce the risk of disasters, as agreed upon in the Istanbul Programme of Action;",
    "31": "Also underlines the need to address the economic, social and environmental impacts of climate change, and emphasizes the need for national and international action to enhance efforts to build resilience, especially for the most vulnerable, including through mainstreaming resilience into investment decision- making, building resilience through sustainable management of ecosystems and value chains and building resilience to reduce the impact and cost of natural disasters;",
    "32": "Further underlines the importance of improving the coordination and effectiveness of resilience-building initiatives for the least developed countries by leveraging existing measures at the national, regional and global levels to respond to various types of disasters and shocks, as elaborated in the report of the Secretary- General on crisis mitigation and resilience-building for the least developed countries;14",
    "33": "Encourages countries to develop national and local disaster risk reduction strategies by 2020, in accordance with target (e) of the Sendai Framework, recognizes the importance of promoting their alignment and integration with sustainable development and climate change adaptation strategies, recognizes that the development of climate change adaptation and national disaster risk reduction strategies by 2020 is an opportunity to maximize synergies across the Sustainable Development Goals, the Paris Agreement and the Sendai Framework, and in this regard calls for disaster risk reduction to be considered in the review of and follow-up to the Istanbul Programme of Action;",
    "34": "Reiterates the call to substantially enhance international cooperation to developing countries through adequate and sustainable support to complement their national actions for the implementation of the Sendai Framework by 2030;",
    "35": "Congratulates those countries that have met the criteria for graduation from least developed country status, notes with appreciation that several least developed countries have expressed their intention to reach the status of graduation by 2020, invites those countries to start the preparations for their graduation and transition strategy, and requests all relevant organizations of the United Nations system, led by the Office of the High Representative, to extend necessary support in this regard, in a coordinated manner;",
    "36": "Acknowledges that the graduation of a country symbolizes its considerable long-term socioeconomic progress, prevailing over the structural handicaps to socioeconomic development, and that it also presents many challenges for graduated countries, which continue to face vulnerabilities to various shocks and crises;",
    "37": "Invites the least developed countries and development partners to integrate graduation and smooth transition strategies into their respective national development and aid strategies, as appropriate, including capacity-building and technical assistance to diversify sources of financing;",
    "38": "Notes with appreciation that some development partners have extended some of the benefits specific to the least developed countries to countries that have graduated, taking into account the challenges they continue to face, and invites all development partners to strengthen their support for graduation and smooth transition so that graduating and recently graduated countries can minimize disruption in their development trajectory;",
    "39": "Invites countries that are found eligible for graduation to establish a consultative mechanism, in line with General Assembly resolution 67/221, to prepare the transition strategy as early as possible, engaging all relevant donors and stakeholders;",
    "40": "Recognizes that the activities relating to the least developed countries carried out within the Secretariat need to be further coordinated and consolidated in order to ensure the effective monitoring and follow-up of the Istanbul Programme of Action, led by the Office of the High Representative, and to provide well-coordinated support to realizing the goal of enabling half of the least developed countries to meet the criteria for graduation by 2020;",
    "41": "Takes note of the work of the Inter-Agency Consultative Group for the least developed countries, led by the Office of the High Representative, notes the steps taken by the United Nations System Chief Executives Board for Coordination and the High-level Committee on Programmes in supporting the coordination and follow-up of the implementation of the Istanbul Programme of Action on a system- wide basis, and reiterates its invitation to the Secretary-General, in his capacity as Chair of the Chief Executives Board, to include the implementation of the Programme of Action in the agenda of the Board;",
    "42": "",
    "43": "Decides to convene, towards the end of 2020 and/or early in 2021, an intergovernmental preparatory committee, which would hold no more than two meetings of no more than five days each;",
    "44": "Also decides to take a decision on the organizational aspects, date and venue of the Conference and on the venue, duration and dates of the preparatory committee meetings at its seventy-fourth session;",
    "45": "Further decides that the meetings of the preparatory committee will be preceded by two regional preparatory meetings, each no longer than three days, one in collaboration with the Economic Commission for Africa and the other in collaboration with the Economic and Social Commission for Asia and the Pacific, in the context of the regular annual session of each Commission, with those regional meetings to be supported by broad-based and inclusive country-level preparations;",
    "46": "Emphasizes the importance of country-level preparations as a critical input to the preparatory process for the Conference and in the implementation of and follow-up to its outcome, and calls upon the Governments of the least developed countries to submit their reports in a timely manner;",
    "47": "Stresses that the Conference and the preparatory activities should be carried out within the budget level proposed by the Secretary-General for 2020 and 2021 and should be organized in the most effective and efficient manner possible;",
    "48": "Decides that the Office of the High Representative will be the focal point for the preparations for the Conference, in accordance with mandates given by the General Assembly in its resolution 56/227 of 24 December 2001, to ensure that those preparations are carried out effectively and to mobilize and coordinate the active involvement of the entire United Nations system;",
    "49": "Encourages the organizations of the United Nations system, including the United Nations Development Programme, the United Nations Conference on Trade and Development, the regional commissions, the specialized agencies, the funds and programmes, the Bretton Woods institutions, the World Trade Organization and other relevant international and regional organizations, within their respective mandates, to provide necessary support and to contribute actively to the preparatory process and the Conference itself;",
    "50": "Requests the Secretary-General to ensure, as appropriate, the full involvement of resident coordinators and country teams in the preparations for the Conference, in particular in the country-level and regional preparations;",
    "51": "Strongly encourages Governments, intergovernmental and non-governmental organizations, major groups and other donors to contribute in a timely manner to the trust fund in support of activities undertaken by the Office of the High Representative to support the implementation, follow-up and monitoring of the Istanbul Programme of Action and the participation of the representatives from the least developed countries in the high-level political forum on sustainable development of the Economic and Social Council as well as in other relevant forums and the preparatory process of the Conference, and in this regard expresses its appreciation to those countries that have made voluntary contributions to the trust fund;",
    "52": "",
    "53": "Also requests the Secretary-General to submit to the General Assembly at its seventy-sixth session a progress report on the implementation, effectiveness and added value of smooth transition measures covering both graduating and recently graduated countries, including new and dedicated support measures to graduated countries in moving forward on their development path and initiatives taken by the United Nations system to support countries during their graduation from the least developed country category."
  },
  "agenda_items": [
    "Item 23"
  ],
  "symbol_references": []
}