{
  "symbol": "A/RES/73/300",
  "filename": "A_RES_73_300.pdf",
  "title": "73/300. International Day of the Celebration of the Solstice",
  "text": "United Nations \nA/RES/73/300\n \n \nGeneral Assembly \nDistr.: General \n21 June 2019 \n \n19-10297 (E)    250619 \n*1910297*\n \n \nSeventy-third session \n \nAgenda item 15 \n \n \n \n \n Resolution adopted by the General Assembly \non 20 June 2019 \n \n \n \n \n[without reference to a Main Committee (A/73/L.92 and A/73/L.92/Add.1)] \n \n \n 73/300. International Day of the Celebration of the Solstice \n \n \n \nThe General Assembly, \n \nReaffirming the purposes and principles of the Charter of the United Nations, in \nparticular the achievement of international cooperation in the economic, social and \ncultural fields, \n \nReaffirming also the Universal Declaration on Cultural Diversity, adopted on \n2 November 2001 by the General Conference of the United Nations Educational, \nScientific and Cultural Organization,1 including its appeal for greater solidarity on \nthe basis of recognition of cultural diversity, of awareness of the unity of humankind \nand of the development of intercultural exchanges, \n \nReaffirming further the United Nations Declaration on the Rights of Indigenous \nPeoples,2 which addresses the individual and collective rights of indigenous peoples, \nin particular the right to practise and revitalize their cultural traditions and customs, \nincluding the right to maintain, protect and develop the past, present and future \nmanifestations of their cultures, such as archaeological and historical sites, artefacts, \ndesigns, ceremonies, technologies and visual and performing arts and literature, \n \nRecognizing the importance of facilitating indigenous peoples\u2019 livelihoods, \nwhich may be achieved by, inter alia, the recognition of their traditions, \n \nMindful that the celebration of the solstice, as the embodiment of the unity of \ncultural heritage and centuries-long traditions, plays a significant role in \nstrengthening the ties among peoples on the basis of mutual respect and the ideals of \npeace and good-neighbourliness, \n__________________ \n \n1  United Nations Educational, Scientific and Cultural Organization, Records of the General \nConference, Thirty-first Session, Paris, 15 October\u20133 November 2001, vol. 1 and corrigendum, \nResolutions, sect. V, resolution 25, annex I. \n \n2  Resolution 61/295, annex. \n\nA/RES/73/300 \nInternational Day of the Celebration of the Solstice\n \n19-10297\n2/2 \n \n \nConsidering that indigenous peoples celebrate various sun rituals and \nceremonies, including the beginning of the new year, on the occasion of the solstice \non 21 June, \n \nRecognizing that many indigenous peoples, who belong to civilizations that \nhave existed since ancient times, have a rich history of understanding the symbiotic \nconnection between human beings and nature that fosters a mutually beneficial \nrelationship, \n \nBearing in mind that the solstices and equinoxes are events of particular \nrelevance for indigenous peoples that symbolize the fertility of the land, agricultural \nand food production systems, cultural heritage and their millenary traditions and play \na significant role in strengthening ties among indigenous peoples on the basis of \nmutual respect, complementarity, reciprocity and cooperation, \n \n1. \nRecognizes 21 June as the International Day of the Celebration of the \nSolstice in its different manifestations; \n \n2. \nEncourages Member States to make efforts to raise awareness of the \ncelebration of the solstice in its different manifestations, inter alia, the Inti Raymi, \nthe We Tripantu, the Willkakuti and Yasitata Guas\u00fa, and to organize annual events in \ncommemoration of these celebrations, as appropriate; \n \n3. \nInvites interested Member States, the United Nations, in particular its \nrelevant specialized agencies, funds and programmes, mainly the United Nations \nEducational, Scientific and Cultural Organization, and interested international and \nregional \norganizations, \nwithin \nexisting \nresources, \nand \nnon-governmental \norganizations to participate in events organized by Member States, indigenous \npeoples and communities in which the solstice is celebrated and to raise awareness in \nthis regard; \n \n4. \nRequests the Secretary-General to bring the present resolution to the \nattention of all Member States and organizations of the United Nations system. \n \n91st plenary meeting \n20 June 2019 \n \n",
  "paragraphs": {
    "1": "Recognizes 21 June as the International Day of the Celebration of the Solstice in its different manifestations;",
    "2": "Encourages Member States to make efforts to raise awareness of the celebration of the solstice in its different manifestations, inter alia, the Inti Raymi, the We Tripantu, the Willkakuti and Yasitata Guas\u00fa, and to organize annual events in commemoration of these celebrations, as appropriate;",
    "3": "Invites interested Member States, the United Nations, in particular its relevant specialized agencies, funds and programmes, mainly the United Nations Educational, Scientific and Cultural Organization, and interested international and regional organizations, within existing resources, and non-governmental organizations to participate in events organized by Member States, indigenous peoples and communities in which the solstice is celebrated and to raise awareness in this regard;",
    "4": "Requests the Secretary-General to bring the present resolution to the attention of all Member States and organizations of the United Nations system. 91st plenary meeting 20 June 2019"
  },
  "agenda_items": [
    "Item 15"
  ],
  "symbol_references": [
    "A/73/L.92"
  ]
}