{
  "symbol": "A/RES/79/270",
  "filename": "A_RES_79_270.pdf",
  "title": "79/270. International Day of Hope",
  "text": "United Nations \nA/RES/79/270\n \nGeneral Assembly \nDistr.: General \n4 March 2025 \n25-03667 (E) \n*2503667* \n \n \nSeventy-ninth session \nAgenda item 14 \nCulture of peace \n \n \n \n \n Resolution adopted by the General Assembly \non 4 March 2025 \n \n \n[without reference to a Main Committee (A/79/L.54)] \n \n \n 79/270. International Day of Hope \n \n \n \nThe General Assembly, \n \nBearing in mind the Charter of the United Nations, including the purposes and \nprinciples contained therein, especially the dedication to saving succeeding \ngenerations from the scourge of war, taking other appropriate measures to strengthen \nuniversal peace, to practising tolerance and living together in peace as good \nneighbours, \n \nRecalling the preamble of the Universal Declaration of Human Rights, 1 in which \nit is stated that the advent of a world in which human beings shall enjoy freedom of \nspeech and belief and freedom from fear and want has been proclaimed as the highest \naspiration of the common people, and reaffirming human rights and fundamental \nfreedoms, \n \nRecalling also its resolutions 53/199 of 15 December 1998 and 61/185 of \n20 December 2006 on the proclamation of international years and Economic and \nSocial Council resolution 1980/67 of 25 July 1980 on international years and \nanniversaries, \n \nRecalling further its resolution 73/329 of 25 July 2019 entitled \u201cPromoting the \nCulture of Peace with Love and Conscience\u201d, in which it declared the International \nDay of Conscience as a means of mobilizing the efforts of the international \ncommunity to promote peace, tolerance, inclusion, understanding and solidarity to \nbuild the culture of peace with love and conscience, \n \nRecognizing the relevance of hope and well-being as universal goals and \naspirations in the lives of human beings around the world and the importance of their \nrecognition in public policy objectives, \n_______________ \n \n1 Resolution 217 A (III). \n\nA/RES/79/270 \nInternational Day of Hope\n \n25-03667\n2/2 \n \n \nRecognizing also the need for a more inclusive, equitable and balanced approach \nto economic growth that promotes sustainable development, poverty eradication, \nhappiness and hope for all peoples, \n \nTaking note of the message of the Secretary-General on United Nations Day, \n24 October 2022, in which he highlighted the United Nations as the product of hope \nand the resolve to move beyond global strife to worldwide collaboration, \n \n1. \nDecides to declare 12 July the International Day of Hope; \n \n2. \nWelcomes, in this regard, activities aimed at regularly mobilizing the \nefforts of the international community to promote well-being, in order to amplify hope \nand enhance peace, tolerance and social stability, respect for diversity and mutual \nrespect, and create, at the global level and also at the regional, national and local \nlevels, an environment conducive to well-being, peace and mutual understanding; \n \n3. \nEncourages all Member States and observers of the United Nations, \norganizations of the United Nations system and other international and regional \norganizations, as well as civil society, including non\u2011governmental organizations and \nindividuals, to observe the International Day of Hope in an appropriate manner and \nto disseminate messages of hope, through educational and public awareness-raising \nactivities; \n \n4. \nInvites all Member States to further amplify hope to help to ensure peace, \nwell-being and sustainable development, including by working with communities and \nother relevant actors, through reconciliatory measures and acts of service, and by \nencouraging forgiveness and compassion among individuals; \n \n5. \nStresses that the cost of all activities that may arise from the \nimplementation of the present resolution should be met from voluntary contributions; \n \n6. \nRequests the Secretary-General to bring the present resolution to the \nattention of all Member States, organizations of the United Nations system, \nbusinesses and academic and civil society organizations for appropriate observance. \n \n58th plenary meeting \n4 March 2025 \n \n",
  "paragraphs": {
    "1": "Decides to declare 12 July the International Day of Hope;",
    "2": "Welcomes, in this regard, activities aimed at regularly mobilizing the efforts of the international community to promote well-being, in order to amplify hope and enhance peace, tolerance and social stability, respect for diversity and mutual respect, and create, at the global level and also at the regional, national and local levels, an environment conducive to well-being, peace and mutual understanding;",
    "3": "Encourages all Member States and observers of the United Nations, organizations of the United Nations system and other international and regional organizations, as well as civil society, including non\u2011governmental organizations and individuals, to observe the International Day of Hope in an appropriate manner and to disseminate messages of hope, through educational and public awareness-raising activities;",
    "4": "Invites all Member States to further amplify hope to help to ensure peace, well-being and sustainable development, including by working with communities and other relevant actors, through reconciliatory measures and acts of service, and by encouraging forgiveness and compassion among individuals;",
    "5": "Stresses that the cost of all activities that may arise from the implementation of the present resolution should be met from voluntary contributions;",
    "6": "Requests the Secretary-General to bring the present resolution to the attention of all Member States, organizations of the United Nations system, businesses and academic and civil society organizations for appropriate observance. 58th plenary meeting 4 March 2025"
  },
  "agenda_items": [
    "Item 14"
  ],
  "symbol_references": [
    "A/79/L.54"
  ]
}