{
  "symbol": "A/RES/79/255",
  "filename": "A_RES_79_255.pdf",
  "title": "79/255. Financing of the International Residual Mechanism for Criminal Tribunals",
  "text": "United Nations \nA/RES/79/255\n \n \nGeneral Assembly \nDistr.: General \n31 December 2024 \n \n24-24696 (E)     \n*2424696* \n \n \nSeventy-ninth session \nAgenda item 153 \nFinancing of the International Residual Mechanism for \nCriminal Tribunals \n \n \n \n \n Resolution adopted by the General Assembly \non 24 December 2024 \n \n \n \n \n[on the report of the Fifth Committee (A/79/651, para. 6)] \n \n \n 79/255. Financing of the International Residual Mechanism \nfor Criminal Tribunals \n \n \n \nThe General Assembly, \n \nHaving considered the reports of the Secretary-General on the budget \nperformance for 2023 and the proposed budget for 2025, 1 the financial report and \naudited financial statements for the year ended 31 December 2023 and the report of \nthe Board of Auditors on the International Residual Mechanism for Criminal \nTribunals2 and the recommendations contained therein, as well as the related report \nof the Advisory Committee on Administrative and Budgetary Questions, 3  \n \nRecalling its resolution 66/240 A of 24 December 2011 on the financing of the \nInternational Residual Mechanism for Criminal Tribunals and its subsequent \nresolutions thereon, the latest of which was resolution 78/249 of 22 December 2023,  \n \n1. \nTakes note of the reports of the Secretary-General;  \n \n2. \nEndorses the conclusions and recommendations contained in the report of \nthe Advisory Committee on Administrative and Budgetary Questions; \n \n3. \nReaffirms the high priority accorded to the work of the International \nResidual Mechanism for Criminal Tribunals;  \n \n4. \nEmphasizes the importance of clear and realistic projections of completion \ntimelines for all the Mechanism\u2019s activities;  \n__________________ \n \n1 A/79/373 and A/79/555. \n \n2 Official Records of the General Assembly, Seventy-ninth Session, Supplement No. 5O \n(A/79/5/Add.15). \n \n3 A/79/619. \n\nA/RES/79/255 \nFinancing of the International Residual Mechanism for \nCriminal Tribunals\n \n24-24696\n2/4 \n \n \n5. \nRecalls paragraphs 10 and 21 of the report of the Advisory Committee, \nnotes the efforts of the Mechanism to gradually downsize its operations in the light \nof its reduced functions, and requests Secretary-General to propose, in his next report, \nappropriate and justified post and non-post resources and to ensure the prompt and \nefficient completion of the remaining work of the Mechanism;  \n \n6. \nAlso recalls paragraph 9 of its resolution 75/249 of 31 December 2020, \nand re-emphasizes the importance of the Mechanism\u2019s strictly abiding by its statute \nand applicable established administrative procedures, the Financial Regulations and \nRules of the United Nations4 and the Staff Regulations and Staff Rules, including \nprovisional Staff Rules, of the United Nations;5  \n \n7. \nFurther recalls paragraph 5 of the report of the Advisory Committee, \nrequests the Secretary-General to provide a detailed update on the recommendations of \nthe Board of Auditors that have not been implemented, in the context of his next report, \nand encourages the Mechanism to implement the outstanding recommendations;  \n \n8. \nNotes with appreciation the efforts made by the Mechanism to reduce its \ncosts and enhance its efficiency, as well as the timeliness of its activities, to make \ngreater use of the lessons learned and to adopt appropriate measures for achieving \nfurther operational savings and efficiencies, in order to ensure the expeditious \ncompletion of its work in a transparent, accountable and cost-effective manner; \n \n9. \nRecalls paragraph 13 of the report of the Advisory Committee, and \nencourages the Mechanism to complete the digitization of its archives, including \nthrough the use of voluntary contributions, and to continue to undertake fundraising \nefforts in this regard;  \n \n10. Also recalls paragraph 14 of the report of the Advisory Committee, and \nrequests the Secretary-General to expedite the efforts to address promptly the backlog \nof judgments that remain to be translated, in particular at the Arusha branch, within \nexisting resources;  \n \n11. \nNotes the importance of ensuring continued public consciousness of the \nevents leading to the establishment of the Mechanism, and requests the Mechanism \nto continue the provision of library services to the public within existing resources;  \n \n12. Requests the Mechanism to intensify its efforts to eliminate the duplication \nof functions, which should result in budgetary reductions, and to report on the results \nachieved in the next report;  \n \n13. Requests the Secretary-General to report in his next budget proposal on \nthe efforts made so far during the ongoing downsizing exercise to assist staff in \nidentifying opportunities for future employment in accordance with the relevant staff \nregulations and rules of the United Nations;  \n \n14. Requests the Mechanism to hold managers accountable for the judicious \nuse of travel resources, in particular by increasingly encouraging the use of alternative \nmethods of communication and representation and by giving primary consideration \nto authorizing official travel only where direct face-to-face contact is necessary for \nmandate implementation; \n \n15. Requests the Secretary-General, to review all vacant positions, in the context \nof his next report, with a view to abolishing those vacant for more than 12 months; \n \n16. Reiterates its request to the Secretary-General to continue his efforts to \npromote the nationalization of positions, as appropriate, and to report thereon in the \ncontext of his next budget proposal; \n__________________ \n \n4 ST/SGB/2013/4 and ST/SGB/2013/4/Amend.1. \n \n5 ST/SGB/2023/1/Rev.1. \n\nFinancing of the International Residual Mechanism for \nCriminal Tribunals \nA/RES/79/255\n \n3/4\n24-24696 \n \n \n17. Recalls that the Mechanism is of small, temporary and efficient nature, \nwhose functions and size will diminish over time, with a small number of staff \ncommensurate with its reduced functions;  \n \n18. Also recalls paragraph 7 of its resolution 74/272 of 13 April 2020, and \nrequests the Secretary-General to continue his efforts to settle all outstanding claims \nwithout delay and to report thereon in the context of his next report; \n \n19. Requests the Secretary-General to continue to provide additional and \ndetailed information on the final expenditure and unencumbered balance, as well as \nits return to Member States, in the context of his next report;  \n \n20. Decides to appropriate to the special account for the Mechanism a total \namount of 60,963,800 United States dollars gross (56,127,700 dollars net) for the \nMechanism for 2025, as detailed in the annex to the present resolution;  \n \n21. Also decides that the total assessment for 2025 under the special account, \namounting to 47,998,700 dollars, shall consist of:  \n \n(a) \n60,963,800 dollars, being the estimated appropriation approved for the \nperiod;  \n \n(b) \nLess 8,898,000 dollars, being the credit of the cancellation of prior-period \nobligations and commitments corresponding to the year 2022, and other revenue;  \n \n(c) \nLess 4,067,100 dollars, being the surplus resulting from the final \nexpenditure for the budget for the year 2023;  \n \n22. Further decides to apportion the amount of 23,999,350 dollars gross \n(21,578,050 dollars net) among Member States in accordance with the scale of \nassessments applicable to the regular budget of the United Nations for 2025;  \n \n23. Decides to apportion the amount of 23,999,350 dollars gross \n(21,578,050 dollars net) among Member States in accordance with the scale of \nassessments applicable to peacekeeping operations of the United Nations for 2025;  \n \n24. Also decides that, in accordance with the provisions of its resolution 973 (X) \nof 15 December 1955, there shall be set off against the apportionment among Member \nStates, as provided for in paragraphs 22 and 23 above, their respective share in the \nTax Equalization Fund of the estimated staff assessment income in the amount of \n4,842,600 dollars approved for the Mechanism for 2025.  \n \n55th (resumed) plenary meeting \n24 December 2024 \n \n \n \nAnnex \n \n \n \nFinancing for 2025 of the International Residual Mechanism for \nCriminal Tribunals \n \n \nGross \nNet of staff \nassessment \n(United States dollars) \nEstimated appropriation for 2025a \n62 287 400 \n 57 451 300 \nRecommendations of the Advisory Committee on Administrative \nand Budgetary Questionsb \n (1 323 600) \n(1 323 600) \nRecommendations of the Fifth Committee \n\u2013 \n\u2013 \nEstimated initial appropriation for 2025 \n 60 963 800 \n 56 127 700 \n\nA/RES/79/255 \nFinancing of the International Residual Mechanism for \nCriminal Tribunals\n \n24-24696\n4/4 \n \nGross \nNet of staff \nassessment \n(United States dollars) \nTotal assessment for 2025 \n \n \nRequirements for 2025 \n60 963 800 \n 56 127 700 \nCancellation of commitments for the year 2022, and other revenue  \n (8 898 000) \n(8 898 000) \nSurplus resulting from the final expenditure for the budget for the \nyear 2023  \n(4 067 100) \n(4 073 600) \nNet contributions assessed on Member States for 2025 \n47 998 700 \n 43 156 100 \nOf which: \n \n \nContributions assessed on Member States in accordance with the \nscale of assessments applicable to the regular budget of the \nUnited Nations for 2025 \n23 999 350 \n 21 578 050 \nContributions assessed on Member States in accordance with the \nscale of assessments applicable to peacekeeping operations of the \nUnited Nations for 2025 \n 23 999 350 \n 21 578 050 \n \n \na See A/79/555.  \n \nb Reflects amounts after recosting. \n \n",
  "paragraphs": {
    "1": "Takes note of the reports of the Secretary-General;",
    "2": "Endorses the conclusions and recommendations contained in the report of the Advisory Committee on Administrative and Budgetary Questions;",
    "3": "Reaffirms the high priority accorded to the work of the International Residual Mechanism for Criminal Tribunals;",
    "4": "Emphasizes the importance of clear and realistic projections of completion timelines for all the Mechanism\u2019s activities; __________________ 1 A/79/373 and A/79/555. 2 Official Records of the General Assembly, Seventy-ninth Session, Supplement No. 5O (A/79/5/Add.15). 3 A/79/619. A/RES/79/255 Financing of the International Residual Mechanism for Criminal Tribunals 24-24696 2/4",
    "5": "Recalls paragraphs 10 and 21 of the report of the Advisory Committee, notes the efforts of the Mechanism to gradually downsize its operations in the light of its reduced functions, and requests Secretary-General to propose, in his next report, appropriate and justified post and non-post resources and to ensure the prompt and efficient completion of the remaining work of the Mechanism;",
    "6": "Also recalls paragraph 9 of its resolution 75/249 of 31 December 2020, and re-emphasizes the importance of the Mechanism\u2019s strictly abiding by its statute and applicable established administrative procedures, the Financial Regulations and Rules of the United Nations4 and the Staff Regulations and Staff Rules, including provisional Staff Rules, of the United Nations;5",
    "7": "Further recalls paragraph 5 of the report of the Advisory Committee, requests the Secretary-General to provide a detailed update on the recommendations of the Board of Auditors that have not been implemented, in the context of his next report, and encourages the Mechanism to implement the outstanding recommendations;",
    "8": "Notes with appreciation the efforts made by the Mechanism to reduce its costs and enhance its efficiency, as well as the timeliness of its activities, to make greater use of the lessons learned and to adopt appropriate measures for achieving further operational savings and efficiencies, in order to ensure the expeditious completion of its work in a transparent, accountable and cost-effective manner;",
    "9": "Recalls paragraph 13 of the report of the Advisory Committee, and encourages the Mechanism to complete the digitization of its archives, including through the use of voluntary contributions, and to continue to undertake fundraising efforts in this regard;",
    "10": "Also recalls paragraph 14 of the report of the Advisory Committee, and requests the Secretary-General to expedite the efforts to address promptly the backlog of judgments that remain to be translated, in particular at the Arusha branch, within existing resources;",
    "11": "Notes the importance of ensuring continued public consciousness of the events leading to the establishment of the Mechanism, and requests the Mechanism to continue the provision of library services to the public within existing resources;",
    "12": "Requests the Mechanism to intensify its efforts to eliminate the duplication of functions, which should result in budgetary reductions, and to report on the results achieved in the next report;",
    "13": "Requests the Secretary-General to report in his next budget proposal on the efforts made so far during the ongoing downsizing exercise to assist staff in identifying opportunities for future employment in accordance with the relevant staff regulations and rules of the United Nations;",
    "14": "Requests the Mechanism to hold managers accountable for the judicious use of travel resources, in particular by increasingly encouraging the use of alternative methods of communication and representation and by giving primary consideration to authorizing official travel only where direct face-to-face contact is necessary for mandate implementation;",
    "15": "Requests the Secretary-General, to review all vacant positions, in the context of his next report, with a view to abolishing those vacant for more than 12 months;",
    "16": "Reiterates its request to the Secretary-General to continue his efforts to promote the nationalization of positions, as appropriate, and to report thereon in the context of his next budget proposal; __________________ 4 ST/SGB/2013/4 and ST/SGB/2013/4/Amend.1. 5 ST/SGB/2023/1/Rev.1. Financing of the International Residual Mechanism for Criminal Tribunals A/RES/79/255 3/4 24-24696",
    "17": "Recalls that the Mechanism is of small, temporary and efficient nature, whose functions and size will diminish over time, with a small number of staff commensurate with its reduced functions;",
    "18": "Also recalls paragraph 7 of its resolution 74/272 of 13 April 2020, and requests the Secretary-General to continue his efforts to settle all outstanding claims without delay and to report thereon in the context of his next report;",
    "19": "Requests the Secretary-General to continue to provide additional and detailed information on the final expenditure and unencumbered balance, as well as its return to Member States, in the context of his next report;",
    "20": "Decides to appropriate to the special account for the Mechanism a total amount of 60,963,800 United States dollars gross (56,127,700 dollars net) for the Mechanism for 2025, as detailed in the annex to the present resolution;",
    "21": "Also decides that the total assessment for 2025 under the special account, amounting to 47,998,700 dollars, shall consist of: (a) 60,963,800 dollars, being the estimated appropriation approved for the period; (b) Less 8,898,000 dollars, being the credit of the cancellation of prior-period obligations and commitments corresponding to the year 2022, and other revenue; (c) Less 4,067,100 dollars, being the surplus resulting from the final expenditure for the budget for the year 2023;",
    "22": "Further decides to apportion the amount of 23,999,350 dollars gross (21,578,050 dollars net) among Member States in accordance with the scale of assessments applicable to the regular budget of the United Nations for 2025;",
    "23": "Decides to apportion the amount of 23,999,350 dollars gross (21,578,050 dollars net) among Member States in accordance with the scale of assessments applicable to peacekeeping operations of the United Nations for 2025;",
    "24": "Also decides that, in accordance with the provisions of its resolution 973 (X) of 15 December 1955, there shall be set off against the apportionment among Member States, as provided for in paragraphs 22 and 23 above, their respective share in the Tax Equalization Fund of the estimated staff assessment income in the amount of 4,842,600 dollars approved for the Mechanism for 2025. 55th (resumed) plenary meeting 24 December 2024 Annex Financing for 2025 of the International Residual Mechanism for Criminal Tribunals Gross Net of staff assessment (United States dollars) Estimated appropriation for 2025a 62 287 400 57 451 300 Recommendations of the Advisory Committee on Administrative and Budgetary Questionsb (1 323 600) (1 323 600) Recommendations of the Fifth Committee \u2013 \u2013 Estimated initial appropriation for 2025 60 963 800 56 127 700 A/RES/79/255 Financing of the International Residual Mechanism for Criminal Tribunals 24-24696 4/4 Gross Net of staff assessment (United States dollars) Total assessment for 2025 Requirements for 2025 60 963 800 56 127 700 Cancellation of commitments for the year 2022, and other revenue (8 898 000) (8 898 000) Surplus resulting from the final expenditure for the budget for the year 2023 (4 067 100) (4 073 600) Net contributions assessed on Member States for 2025 47 998 700 43 156 100 Of which: Contributions assessed on Member States in accordance with the scale of assessments applicable to the regular budget of the United Nations for 2025 23 999 350 21 578 050 Contributions assessed on Member States in accordance with the scale of assessments applicable to peacekeeping operations of the United Nations for 2025 23 999 350 21 578 050 a See A/79/555. b Reflects amounts after recosting."
  },
  "agenda_items": [
    "Item 153"
  ],
  "symbol_references": []
}