{
  "symbol": "A/RES/75/214",
  "filename": "A_RES_75_214.pdf",
  "title": "75/214. Towards the sustainable development of the Caribbean Sea for present and future generations",
  "text": "United Nations \nA/RES/75/214 \n \n \nGeneral Assembly \nDistr.: General \n29 December 2020 \n \n20-17646 (E)    060121 \n*2017646* \n \n \nSeventy-fifth session \nAgenda item 19 (b) \nSustainable development: follow-up to and implementation \nof the SIDS Accelerated Modalities of Action (SAMOA) \nPathway and the Mauritius Strategy for the Further \nImplementation of the Programme of Action for the \nSustainable Development of Small Island Developing States\n \n \n \n \n \n Resolution adopted by the General Assembly \non 21 December 2020 \n \n \n \n \n[on the report of the Second Committee (A/75/457/Add.2, para. 13)] \n \n \n 75/214. Towards the sustainable development of the Caribbean Sea for \npresent and future generations \n \n \n \nThe General Assembly, \n \nReaffirming the principles and commitments enshrined in the Rio Declaration \non Environment and Development,1 the principles embodied in the Declaration of \nBarbados,2 the Programme of Action for the Sustainable Development of Small Island \nDeveloping States,3 the Johannesburg Declaration on Sustainable Development,4 the \nPlan of Implementation of the World Summit on Sustainable Development \n(Johannesburg Plan of Implementation),5 the Mauritius Strategy for the Further \nImplementation of the Programme of Action for the Sustainable Development of \nSmall Island Developing States,6 the outcome document of the United Nations \n__________________ \n \n1 Report of the United Nations Conference on Environment and Development, Rio de Janeiro, 3\u221214 June \n1992, vol. I, Resolutions Adopted by the Conference (United Nations publication, Sales No. E.93.I.8 and \ncorrigendum), resolution 1, annex I. \n \n2 Report of the Global Conference on the Sustainable Development of Small Island Developing States, \nBridgetown, Barbados, 25 April\u20136 May 1994 (United Nations publication, Sales No. E.94.I.18 and \ncorrigenda), chap. I, resolution 1, annex I. \n \n3 Ibid., annex II. \n \n4 Report of the World Summit on Sustainable Development, Johannesburg, South Africa, 26 August\u2013\n4 September 2002 (United Nations publication, Sales No. E.03.II.A.1 and corrigendum), chap. I, \nresolution 1, annex. \n \n5 Ibid., resolution 2, annex. \n \n6 Report of the International Meeting to Review the Implementation of the Programme of Action for the \nSustainable Development of Small Island Developing States, Port Louis, Mauritius, 10\u221214 January 2005 \n(United Nations publication, Sales No. E.05.II.A.4 and corrigendum), chap. I, resolution 1, annex II. \n\nA/RES/75/214 \nTowards the sustainable development of the Caribbean Sea \nfor present and future generations\n \n20-17646\n2/7 \n \nConference on Sustainable Development, entitled \u201cThe future we want\u201d,7 the outcome \ndocument of the third International Conference on Small Island Developing States, \nthe SIDS Accelerated Modalities of Action (SAMOA) Pathway,8 the Addis Ababa \nAction Agenda of the Third International Conference on Financing for Development 9 \nand the 2030 Agenda for Sustainable Development,10 as well as other relevant \ndeclarations and international instruments, \n \nWelcoming the Paris Agreement,11 and encouraging all its parties to fully \nimplement the Agreement, and parties to the United Nations Framework Convention \non Climate Change12 that have not yet done so to deposit their instruments of \nratification, acceptance, approval or accession, where appropriate, as soon as \npossible, \n \nRecalling the Sendai Declaration and the Sendai Framework for Disaster Risk \nReduction 2015\u20132030,13 \n \nRecalling also the Declaration and review document adopted by the General \nAssembly at its twenty-second special session,14 \n \nRecalling further its resolution 71/312 of 6 July 2017, in which it endorsed the \ndeclaration entitled \u201cOur ocean, our future: call for action\u201d, adopted by the high-level \nUnited Nations Conference to Support the Implementation of Sustainable Development \nGoal 14: Conserve and sustainably use the oceans, seas and marine resources for \nsustainable development, held from 5 to 9 June 2017, coinciding with World Oceans \nDay on 8 June, reaffirming in this regard the important role of the declaration in \ndemonstrating the collective will to take action to conserve and sustainably use our \noceans, seas and marine resources for sustainable development, and recognizing the \nimportant contributions of the partnership dialogues and voluntary commitments \nmade in the context of that Conference to the effective and timely implementation of \nthe Sustainable Development Goals, \n \nTaking into account all its relevant resolutions, including resolutions 54/225 of \n22 December 1999, 55/203 of 20 December 2000, 57/261 of 20 December 2002, \n59/230 of 22 December 2004, 61/197 of 20 December 2006, 63/214 of 19 December \n2008, 65/155 of 20 December 2010, 67/205 of 21 December 2012, 69/216 of \n19 December 2014, 71/224 of 21 December 2016 and 73/229 of 20 December 2018, \n \nRecalling the 2005 World Summit Outcome,15 \n \nRecalling also the Convention for the Protection and Development of the \nMarine Environment of the Wider Caribbean Region, signed at Cartagena de Indias, \nColombia, on 24 March 1983,16 and the protocols thereto, which contain the definition \nof the wider Caribbean region of which the Caribbean Sea is part, \n \nReaffirming the United Nations Convention on the Law of the Sea,17 which \nprovides the legal framework for ocean activities, and emphasizing its fundamental \ncharacter, conscious that the problems of ocean space are closely interrelated and need \n__________________ \n \n7 Resolution 66/288, annex. \n \n8 Resolution 69/15, annex. \n \n9 Resolution 69/313, annex. \n \n10 Resolution 70/1. \n \n11 Adopted under the UNFCCC in FCCC/CP/2015/10/Add.1, decision 1/CP.21. \n \n12 United Nations, Treaty Series, vol. 1771, No. 30822. \n \n13 Resolution 69/283, annexes I and II. \n \n14 Resolution S-22/2, annex. \n \n15 Resolution 60/1. \n \n16 United Nations, Treaty Series, vol. 1506, No. 25974. \n \n17 Ibid., vol. 1833, No. 31363. \n\nTowards the sustainable development of the Caribbean Sea \nfor present and future generations \nA/RES/75/214\n \n3/7\n20-17646 \n \nto be considered as a whole through an integrated, interdisciplinary and intersectoral \napproach, \n \nRecalling the Convention on Biological Diversity18 and other biodiversity-\nrelated conventions, including the Convention on International Trade in Endangered \nSpecies of Wild Fauna and Flora19 and the Convention on Wetlands of International \nImportance especially as Waterfowl Habitat,20 \n \nEmphasizing the importance of national, regional and global action and \ncooperation in the marine sector as recognized by the United Nations Conference on \nEnvironment and Development in chapter 17 of Agenda 21,21 \n \nRecalling the relevant work done by the International Maritime Organization, \n \nConsidering that the Caribbean Sea area includes a large number of States, \ncountries and territories, most of which are developing countries and small island \ndeveloping States that are ecologically fragile and socially and economically \nvulnerable and are also affected, inter alia, by their limited capacity, narrow resource \nbase, need for financial resources, high levels of poverty and the resulting social \nproblems, and the challenges and opportunities of globalization and trade liberalization, \n \nRecognizing that the Caribbean Sea has unique biodiversity and highly fragile \necosystems, \n \nRecognizing also that the Caribbean has been shown to be the most tourism-\ndependent region in the world relative to its size, \n \nNoting with great concern the threat to human health, safety and well-being \ncaused by the coronavirus disease (COVID-19) pandemic, as well as the severe \ndisruption to societies and economies and the devastating impact on lives and \nlivelihoods, and that the poorest and most vulnerable are the hardest hit by the \npandemic, reaffirming the ambition to get back on track to achieve the Sustainable \nDevelopment Goals by designing sustainable and inclusive recovery strategies to \naccelerate progress towards the full implementation of the 2030 Agenda and to help \nto reduce the risks of future shocks, and recognizing that the COVID-19 pandemic \nrequires a global response based on unity, solidarity and renewed multilateral \ncooperation, \n \nDeeply concerned that the COVID-19 pandemic and its severe global economic \ndisruptions are having a significant negative impact on the sustainable development \nand humanitarian needs of Caribbean countries that are dependent on tourism, \ncommodities, stable global supply chains and remittances, making the prospect of \nachieving the 2030 Agenda more difficult, \n \nNoting that the Caribbean Sea, when compared with all other large marine \necosystems, is surrounded by the largest number of countries in the world, \n \nEmphasizing that the Caribbean countries have a high degree of vulnerability \noccasioned by climate change, climate variability and associated phenomena, such as \nthe rising sea level, oceanic oscillation phenomena, such as the El Ni\u00f1o phenomenon, \nand the potential increase in the frequency and intensity of natural disasters caused \nby hurricanes, floods and droughts, and that they are also subject to natural disasters, \n__________________ \n \n18 Ibid., vol. 1760, No. 30619. \n \n19 Ibid., vol. 993, No. 14537. \n \n20 Ibid., vol. 996, No. 14583. \n \n21 Report of the United Nations Conference on Environment and Development, Rio de Janeiro, 3\u221214 June \n1992, vol. I, Resolutions Adopted by the Conference (United Nations publication, Sales No. E.93.I.8 and \ncorrigendum), resolution 1, annex II. \n\nA/RES/75/214 \nTowards the sustainable development of the Caribbean Sea \nfor present and future generations\n \n20-17646\n4/7 \n \nsuch as those caused by volcanoes, tsunamis and earthquakes, which increase their \nsustainable development challenges, \n \nWelcoming the initiative of the Economic Commission for Latin America and \nthe Caribbean to establish a debt swap task force so that Caribbean economies can \nmitigate and adapt to the consequences of climate change while trying to reduce the \ndebt burden, \n \nBearing in mind the heavy reliance of most of the Caribbean economies on their \ncoastal areas, as well as on the marine environment in general, to achieve their \nsustainable development needs and goals, \n \nAcknowledging that the intensive use of the Caribbean Sea for maritime \ntransport, as well as the considerable number and interlocking character of the \nmaritime areas under national jurisdiction where Caribbean countries exercise their \nrights and duties under international law, present a challenge for the effective \nmanagement of resources, \n \nNoting the problem of marine pollution caused, inter alia, by land-based sources \nand the continuing threat of pollution from ship-generated waste and sewage, as well \nas from the accidental release of hazardous and noxious substances in the Caribbean \nSea area, \n \nRecalling the call upon all stakeholders to conserve and sustainably use the \noceans, seas and marine resources for sustainable development by, inter alia, \naccelerating actions to prevent and significantly reduce marine pollution of all kinds, \nin particular from land-based activities, including marine debris, plastics and \nmicroplastics, nutrient pollution, untreated wastewater, solid waste discharges, \nhazardous substances, pollution from ships and abandoned, lost or otherwise \ndiscarded fishing gear, while at the same time recognizing that small island \ndeveloping States are among the most vulnerable to the impacts of marine pollution, \n \nTaking note of the relevant resolutions of the General Conference of the \nInternational Atomic Energy Agency on the safe transport of radioactive materials, \n \nMindful of the diversity of and dynamic interaction and competition among \nsocioeconomic activities for the use of the coastal areas and the marine environment \nand their resources, \n \nMindful also of the efforts of the Caribbean countries to address in a more \nholistic manner the sectoral issues relating to the management of the wider Caribbean \nSea region and, in so doing, to promote the integrated management of the wider \nCaribbean Sea region in the context of sustainable development, through a regional \ncooperative effort among Caribbean countries, \n \nNoting the significant progress made on regional ocean governance through the \nformulation of the strategic action programme of the Caribbean Large Marine \nEcosystem project, endorsed by ministers in 21 countries of the region, \n \nWelcoming the continued efforts of the States members and associate members \nof the Association of Caribbean States to develop and implement regional initiatives \nto promote the sustainable conservation and management of coastal and marine \nresources, and recognizing in this regard the firm commitment by Heads of State and \nGovernment of the Association to take the steps necessary to ensure the recognition \nof the Caribbean Sea as a special area in the context of sustainable development, \nwithout prejudice to relevant international law, \n \nRecalling the creation by the Association of Caribbean States of the Caribbean \nSea Commission, and welcoming its ongoing work and its contribution to the \nsustainable development of the Caribbean Sea, \n\nTowards the sustainable development of the Caribbean Sea \nfor present and future generations \nA/RES/75/214\n \n5/7\n20-17646 \n \n \nCognizant of the importance of the Caribbean Sea to present and future \ngenerations and to the heritage and the continuing economic well-being and \nsustenance of people living in the area and of the urgent need for the countries of the \nregion to take appropriate steps for its preservation and protection, with the support \nof the international community, \n \n1. \nRecognizes that the Caribbean Sea is an area of unique biodiversity and a \nhighly fragile ecosystem that requires relevant regional and international development \npartners to work together to develop and implement regional initiatives to promote \nthe sustainable conservation and management of coastal and marine resources, \nincluding the consideration of the concept of the Caribbean Sea as a special area in \nthe context of sustainable development, including its designation as such without \nprejudice to international law; \n \n2. \nUnderlines the need to address the economic, social and environmental \nimpacts of climate change, and emphasizes the need for regional and international \naction to enhance efforts at the national and subnational levels, as appropriate, to \nbuild resilience; \n \n3. \nStresses that the COVID-19 pandemic has highlighted the need to support \nand invest in action at all levels to build resilience through, inter alia, disaster risk \nreduction, climate change adaptation, sustainable and resilient infrastructure, the \nsustainable management of ecosystems and the protection and sustainable use of \nbiodiversity; \n \n4. \nNotes the efforts of the Caribbean States and the work undertaken by the \nCaribbean Sea Commission of the Association of Caribbean States, including the \ndevelopment of their concept of the designation of the Caribbean Sea as a special area \nin the context of sustainable development, and invites the international community to \nsupport such efforts; \n \n5. \nReaffirms its support for the plan of action adopted by the Caribbean Sea \nCommission, including its scientific and technical components and its governance \nand outreach components, and invites the international community and the United \nNations system to enhance their support, including financial, technical and capacity-\nbuilding assistance, as appropriate, to Caribbean countries and their regional \norganizations in their efforts to implement the plan of action; \n \n6. \nWelcomes the resources provided by some donors to support the work of \nthe Caribbean Sea Commission, and invites the international community to continue \nand to enhance its support, as appropriate, to the Commission, including through the \nprovision of financial resources, capacity-building and technical support, the transfer \nof technology on mutually agreed terms and the sharing of experience in the areas of \nwork of the Commission; \n \n7. \nInvites the international community to support the efforts of the Caribbean \nSea Commission to establish a databank with the aim of improving the management \nof the specific emerging critical issues related to the sustainability of the Caribbean \nSea through the sharing of management experiences and project resource data, \nincluding, but not limited to, the prediction, monitoring and management of \nsargassum seaweed inundation faced by the Caribbean; \n \n8. \nWelcomes the convening of the eighth summit of the Association of \nCaribbean States, held in Managua in March 2019, which adopted the Declaration of \nManagua and its plan of action for the period 2019\u20132021, which includes measures \nto support and promote the preservation and sustainable use of the Caribbean Sea; \n \n9. \nRecognizes the efforts of Caribbean countries to create conditions leading \nto sustainable development aimed at combating poverty and inequality, and in this \n\nA/RES/75/214 \nTowards the sustainable development of the Caribbean Sea \nfor present and future generations\n \n20-17646\n6/7 \n \nregard notes with interest the initiatives of the Association of Caribbean States in the \nfocal areas of sustainable tourism, trade, transport and natural disasters; \n \n10. Calls upon the United Nations system and the international community to \nassist Caribbean countries and their regional organizations, as appropriate, in their \nefforts to ensure the protection of the Caribbean Sea from degradation as a result of \npollution from ships, in particular through the illegal release of oil and other harmful \nsubstances, and pollution from the illegal dumping or accidental release of hazardous \nwaste, including radioactive materials, nuclear waste and dangerous chemicals, in \nviolation of relevant international rules and standards, as well as pollution from land-\nbased activities; \n \n11. Invites the Association of Caribbean States to submit to the Secretary-\nGeneral a report on the progress made in the implementation of the present resolution, \nfor consideration by the General Assembly at its seventy-seventh session; \n \n12. Calls upon all States to become parties to the relevant international \nagreements to enhance maritime safety and to promote the protection of the marine \nenvironment of the Caribbean Sea from pollution, damage and degradation from ships \nand ship-generated waste; \n \n13. Reaffirms, in this regard, the Special Area designation for the wider \nCaribbean region under annex V to the International Convention for the Prevention \nof Pollution from Ships, 1973, as modified by the Protocol of 1978 relating thereto,22 \nwhich entered into force in May 2011; \n \n14. Supports the efforts of Caribbean countries to implement sustainable \nfisheries management programmes and to meet the principles of the Code of Conduct \nfor Responsible Fisheries of the Food and Agriculture Organization of the United \nNations; \n \n15. Calls upon States, taking into consideration the Convention on Biological \nDiversity, to develop national, regional and international programmes to halt the loss \nof marine biodiversity in the Caribbean Sea, in particular fragile ecosystems such as \ncoral reefs and mangroves; \n \n16. Notes with deep concern that invasive alien species, such as Pterois miles \nand P. volitans, known as lionfish, constitute an emerging threat to biodiversity in the \nwider Caribbean region, and urges the United Nations system and the international \ncommunity to continue to provide assistance and support in addressing this issue in \nthe region; \n \n17. Also notes with deep concern the sargassum seaweed influx and its \nnegative impact on the people, the territory and the economy of the Caribbean, as \nwell as the deterioration of the coral reefs; \n \n18. Invites Member States and intergovernmental organizations of the United \nNations system to continue their efforts to assist Caribbean countries in becoming \nparties to the relevant conventions and protocols concerning the management, \nprotection and sustainable utilization of Caribbean Sea resources and in implementing \nthose conventions and protocols effectively; \n \n19. Calls upon the international community, the United Nations system and \nthe multilateral financial institutions, and invites the Global Environment Facility, \nwithin its mandate, to actively support the national and regional activities of the \nCaribbean States for the promotion of the sustainable management of coastal and \nmarine resources; \n__________________ \n \n22 United Nations, Treaty Series, vol. 1340, No. 22484. \n\nTowards the sustainable development of the Caribbean Sea \nfor present and future generations \nA/RES/75/214\n \n7/7\n20-17646 \n \n \n20. Expresses deep concern about the severe destruction and devastation \ncaused to several countries by heightened hurricane activity in the wider Caribbean \nregion in recent years, in particular the 2017 Atlantic hurricane season; \n \n21. Notes with appreciation the ongoing activities of the Intergovernmental \nCoordination Group for the Tsunami and Other Coastal Hazards Warning System for \nthe Caribbean and Adjacent Regions of the Intergovernmental Oceanographic \nCommission, and invites Member States and other partners to support early warning \nsystems in the region; \n \n22. Urges the United Nations system and the international community to \ncontinue to provide aid and assistance to the countries of the Caribbean region in the \nimplementation of their long-term programmes of disaster prevention, preparedness, \nmitigation, management, relief and recovery, on the basis of their development \npriorities, through the integration of relief, rehabilitation and reconstruction into a \ncomprehensive approach to sustainable development; \n \n23. Acknowledges the pivotal role of the Association of Caribbean States in \nregional dialogue and in the consolidation of a wider Caribbean cooperation zone in \nthe field of disaster risk reduction, as well as the importance of the international \ncommunity in deepening existing cooperation and consolidating new initiatives with \nthat regional mechanism in the context of the outcomes of the High-level Conference \non Disaster Reduction of the Association of Caribbean States, held in Saint-Marc, \nHaiti, from 14 to 16 November 2007, and the plan of action approved by the \nMinisterial Council of the Association upon the recommendation of the Conference; \n \n24. Invites Member States, international and regional organizations and other \nrelevant stakeholders to consider training programmes for the development of a \nhuman resources capacity at different levels and to develop research aimed at \nenhancing the food security of Caribbean countries, as well as the sustainable \nmanagement of renewable marine and coastal resources; \n \n25. Calls upon Member States to improve, as a matter of priority, their \nemergency response capabilities and the containment of environmental damage, \nparticularly in the Caribbean Sea, in the event of natural disasters or an accident or \nincident relating to maritime navigation; \n \n26. Encourages the international community and the United Nations system, \nin line with their programming priorities, to support initiatives aimed at addressing \nmitigation of and adaptation to climate change in the wider Caribbean region included \nin the Plan of Action for 2019\u20132021; \n \n27. Requests the Secretary-General to submit a report to the General Assembly \nat its seventy-seventh session, under the sub-item entitled \u201cFollow-up to and \nimplementation of the SIDS Accelerated Modalities of Action (SAMOA) Pathway \nand the Mauritius Strategy for the Further Implementation of the Programme of \nAction for the Sustainable Development of Small Island Developing States\u201d of the \nitem entitled \u201cSustainable development\u201d, on the implementation of the present \nresolution, emphasizing the three dimensions of sustainable development, including \na section on the possible legal and financial implications of the concept of the \nCaribbean Sea as a special area in the context of sustainable development, including \nits designation as such, without prejudice to relevant international law, taking into \naccount the views expressed by Member States and relevant regional organizations, \nunless otherwise agreed. \n \n48th plenary meeting \n21 December 2020 \n",
  "paragraphs": {
    "1": "Recognizes that the Caribbean Sea is an area of unique biodiversity and a highly fragile ecosystem that requires relevant regional and international development partners to work together to develop and implement regional initiatives to promote the sustainable conservation and management of coastal and marine resources, including the consideration of the concept of the Caribbean Sea as a special area in the context of sustainable development, including its designation as such without prejudice to international law;",
    "2": "Underlines the need to address the economic, social and environmental impacts of climate change, and emphasizes the need for regional and international action to enhance efforts at the national and subnational levels, as appropriate, to build resilience;",
    "3": "Stresses that the COVID-19 pandemic has highlighted the need to support and invest in action at all levels to build resilience through, inter alia, disaster risk reduction, climate change adaptation, sustainable and resilient infrastructure, the sustainable management of ecosystems and the protection and sustainable use of biodiversity;",
    "4": "Notes the efforts of the Caribbean States and the work undertaken by the Caribbean Sea Commission of the Association of Caribbean States, including the development of their concept of the designation of the Caribbean Sea as a special area in the context of sustainable development, and invites the international community to support such efforts;",
    "5": "Reaffirms its support for the plan of action adopted by the Caribbean Sea Commission, including its scientific and technical components and its governance and outreach components, and invites the international community and the United Nations system to enhance their support, including financial, technical and capacity- building assistance, as appropriate, to Caribbean countries and their regional organizations in their efforts to implement the plan of action;",
    "6": "Welcomes the resources provided by some donors to support the work of the Caribbean Sea Commission, and invites the international community to continue and to enhance its support, as appropriate, to the Commission, including through the provision of financial resources, capacity-building and technical support, the transfer of technology on mutually agreed terms and the sharing of experience in the areas of work of the Commission;",
    "7": "Invites the international community to support the efforts of the Caribbean Sea Commission to establish a databank with the aim of improving the management of the specific emerging critical issues related to the sustainability of the Caribbean Sea through the sharing of management experiences and project resource data, including, but not limited to, the prediction, monitoring and management of sargassum seaweed inundation faced by the Caribbean;",
    "8": "Welcomes the convening of the eighth summit of the Association of Caribbean States, held in Managua in March 2019, which adopted the Declaration of Managua and its plan of action for the period 2019\u20132021, which includes measures to support and promote the preservation and sustainable use of the Caribbean Sea;",
    "9": " regard notes with interest the initiatives of the Association of Caribbean States in the focal areas of sustainable tourism, trade, transport and natural disasters;",
    "10": "Calls upon the United Nations system and the international community to assist Caribbean countries and their regional organizations, as appropriate, in their efforts to ensure the protection of the Caribbean Sea from degradation as a result of pollution from ships, in particular through the illegal release of oil and other harmful substances, and pollution from the illegal dumping or accidental release of hazardous waste, including radioactive materials, nuclear waste and dangerous chemicals, in violation of relevant international rules and standards, as well as pollution from land- based activities;",
    "11": "Invites the Association of Caribbean States to submit to the Secretary- General a report on the progress made in the implementation of the present resolution, for consideration by the General Assembly at its seventy-seventh session;",
    "12": "Calls upon all States to become parties to the relevant international agreements to enhance maritime safety and to promote the protection of the marine environment of the Caribbean Sea from pollution, damage and degradation from ships and ship-generated waste;",
    "13": "Reaffirms, in this regard, the Special Area designation for the wider Caribbean region under annex V to the International Convention for the Prevention of Pollution from Ships, 1973, as modified by the Protocol of 1978 relating thereto,22 which entered into force in May 2011;",
    "14": "Supports the efforts of Caribbean countries to implement sustainable fisheries management programmes and to meet the principles of the Code of Conduct for Responsible Fisheries of the Food and Agriculture Organization of the United Nations;",
    "15": "Calls upon States, taking into consideration the Convention on Biological Diversity, to develop national, regional and international programmes to halt the loss of marine biodiversity in the Caribbean Sea, in particular fragile ecosystems such as coral reefs and mangroves;",
    "16": "Notes with deep concern that invasive alien species, such as Pterois miles and P. volitans, known as lionfish, constitute an emerging threat to biodiversity in the wider Caribbean region, and urges the United Nations system and the international community to continue to provide assistance and support in addressing this issue in the region;",
    "17": "Also notes with deep concern the sargassum seaweed influx and its negative impact on the people, the territory and the economy of the Caribbean, as well as the deterioration of the coral reefs;",
    "18": "Invites Member States and intergovernmental organizations of the United Nations system to continue their efforts to assist Caribbean countries in becoming parties to the relevant conventions and protocols concerning the management, protection and sustainable utilization of Caribbean Sea resources and in implementing those conventions and protocols effectively;",
    "19": "Calls upon the international community, the United Nations system and the multilateral financial institutions, and invites the Global Environment Facility, within its mandate, to actively support the national and regional activities of the Caribbean States for the promotion of the sustainable management of coastal and marine resources;",
    "20": "Expresses deep concern about the severe destruction and devastation caused to several countries by heightened hurricane activity in the wider Caribbean region in recent years, in particular the 2017 Atlantic hurricane season;",
    "21": "Notes with appreciation the ongoing activities of the Intergovernmental Coordination Group for the Tsunami and Other Coastal Hazards Warning System for the Caribbean and Adjacent Regions of the Intergovernmental Oceanographic Commission, and invites Member States and other partners to support early warning systems in the region;",
    "22": "Urges the United Nations system and the international community to continue to provide aid and assistance to the countries of the Caribbean region in the implementation of their long-term programmes of disaster prevention, preparedness, mitigation, management, relief and recovery, on the basis of their development priorities, through the integration of relief, rehabilitation and reconstruction into a comprehensive approach to sustainable development;",
    "23": "Acknowledges the pivotal role of the Association of Caribbean States in regional dialogue and in the consolidation of a wider Caribbean cooperation zone in the field of disaster risk reduction, as well as the importance of the international community in deepening existing cooperation and consolidating new initiatives with that regional mechanism in the context of the outcomes of the High-level Conference on Disaster Reduction of the Association of Caribbean States, held in Saint-Marc, Haiti, from 14 to 16 November 2007, and the plan of action approved by the Ministerial Council of the Association upon the recommendation of the Conference;",
    "24": "Invites Member States, international and regional organizations and other relevant stakeholders to consider training programmes for the development of a human resources capacity at different levels and to develop research aimed at enhancing the food security of Caribbean countries, as well as the sustainable management of renewable marine and coastal resources;",
    "25": "Calls upon Member States to improve, as a matter of priority, their emergency response capabilities and the containment of environmental damage, particularly in the Caribbean Sea, in the event of natural disasters or an accident or incident relating to maritime navigation;",
    "26": "Encourages the international community and the United Nations system, in line with their programming priorities, to support initiatives aimed at addressing mitigation of and adaptation to climate change in the wider Caribbean region included in the Plan of Action for 2019\u20132021;",
    "27": "Requests the Secretary-General to submit a report to the General Assembly at its seventy-seventh session, under the sub-item entitled \u201cFollow-up to and implementation of the SIDS Accelerated Modalities of Action (SAMOA) Pathway and the Mauritius Strategy for the Further Implementation of the Programme of Action for the Sustainable Development of Small Island Developing States\u201d of the item entitled \u201cSustainable development\u201d, on the implementation of the present resolution, emphasizing the three dimensions of sustainable development, including a section on the possible legal and financial implications of the concept of the Caribbean Sea as a special area in the context of sustainable development, including its designation as such, without prejudice to relevant international law, taking into account the views expressed by Member States and relevant regional organizations, unless otherwise agreed."
  },
  "agenda_items": [
    "Item 19"
  ],
  "symbol_references": []
}