{
  "symbol": "A/RES/78/204",
  "filename": "A_RES_78_204.pdf",
  "title": "78/204. National human rights institutions",
  "text": "United Nations \nA/RES/78/204\n \n \nGeneral Assembly \nDistr.: General \n22 December 2023 \n \n23-26028 (E)    090124 \n*2326028* \n \n \nSeventy-eighth session \nAgenda item 71 (b) \nPromotion and protection of human rights: human rights \nquestions, including alternative approaches for improving \nthe effective enjoyment of human rights and \nfundamental freedoms \n \n \n \n \n Resolution adopted by the General Assembly on \n19 December 2023 \n \n \n \n \n[on the report of the Third Committee (A/78/481/Add.2, para. 139)] \n \n \n 78/204. National human rights institutions \n \n \n \nThe General Assembly, \n \nRecalling all its relevant resolutions, as well as those of the Human Rights Council \nand the Commission on Human Rights on national institutions for the promotion and \nprotection of human rights, including most recently Council resolution 51/31 of \n7 October 20221 and General Assembly resolution 76/170 of 16 December 2021, as well \nas the previous resolutions on the role of the Ombudsman, mediator institutions and \nother national human rights institutions 2 in the promotion and protection of human \nrights,  \n \nRecalling also the principles relating to the status of national institutions for the \npromotion and protection of human rights (the Paris Principles),3 welcoming the thirtieth \nanniversary of the adoption of the Paris Principles in 2023, and recalling with appreciation \nthe establishment of the Global Alliance of National Human Rights Institutions,  \n \nRecalling further the Vienna Declaration and Programme of Action adopted by \nthe World Conference on Human Rights on 25 June 1993, 4 which reaffirmed the \nimportant and constructive role played by national human rights institutions, in \nparticular in their advisory capacity to the competent authorities and their role in \n__________________ \n \n1  See Official Records of the General Assembly, Seventy-seventh Session, Supplement No. 53A \n(A/77/53/Add.1), chap. III, sect. A. \n \n2  \u201cNational human rights institutions\u201d and \u201cnational institutions for the promotion and protection \nof human rights\u201d are used synonymously. \n \n3  Resolution 48/134, annex. \n \n4  A/CONF.157/24 (Part I), chap. III. \n\nA/RES/78/204 \nNational human rights institutions\n \n23-26028\n2/8 \n \npreventing and remedying human rights violations, in disseminating information on \nhuman rights and in education in human rights,  \n \nAcknowledging that the promotion and protection of human rights and the \nimplementation of the 2030 Agenda for Sustainable Development 5 are interrelated \nand mutually reinforcing, and recognizing that the 2030 Agenda for Sustainable \nDevelopment contains a pledge to leave no one behind and envisages universal \nrespect and promotion of human rights and human dignity, the rule of law, justice, \nequality and non-discrimination,  \n \nRecognizing the importance of the independent contributions of national human \nrights institutions in promoting and protecting all human rights, including, in \naccordance with their mandates, economic, social, cultural, civil and political rights, \nparticularly in the context of the implementation of the 2030 Agenda for Sustainable \nDevelopment, which seeks, among other tasks, to realize the human rights of all \nwithout discrimination on any grounds,  \n \nReaffirming the United Nations Framework Convention on Climate Change6 and \nthe Paris Agreement,7 and emphasizing that parties should, in all climate change-related \nactions, fully respect, promote and consider their respective obligations on human rights,  \n \nReaffirming also the importance of, and welcoming the rapidly growing interest \nthroughout the world in, establishing and strengthening independent and pluralistic \nnational human rights institutions in accordance with the Paris Principles,  \n \nRecalling that the existence of independent national human rights institutions \nestablished in line with the Paris Principles is a global indicator of progress towards \nachieving the 2030 Agenda for Sustainable Development, recognizing that national \nhuman rights institutions in all regions have made important contributions towards \nachieving the 2030 Agenda for Sustainable Development, and taking note of the report \nof the Secretary-General on progress towards the Sustainable Development Goals, 8 \n \nNoting that, when in compliance with the Paris Principles, national human rights \ninstitutions can help States to fast-track vital protection and other services to those \nleft behind, and that the pace of progress in establishing national human rights \ninstitutions in compliance with the Paris Principles must be increased, \n \nConscious that change in the Earth\u2019s climate and the ensuing adverse effects \nhave led to economic, social, cultural and environmental consequences and have \nnegative implications, both direct and indirect, for the enjoyment of human rights and \nthe achievement of the Sustainable Development Goals,  \n \nRecognizing the important role of national human rights institutions in monitoring, \nreporting to and advising government bodies and other stakeholders in relation to climate \nmitigation and adaptation, in accordance with their respective mandates and in order to \npromote the implementation of international human rights obligations and the principles \nof non-discrimination, participation, access to justice and accountability,  \n \nAcknowledging the contribution that many national human rights institutions \nhave made and continue to make in promoting human rights and fundamental \nfreedoms in the context of climate action, and noting the Global Alliance of National \nHuman Rights Institutions Caucus on Human Rights and Climate Change,  \n \nReaffirming the important role that national human rights institutions play, and \nwill continue to play, in promoting and protecting human rights and fundamental \n__________________ \n \n5  Resolution 70/1. \n \n6  United Nations, Treaty Series, vol. 1771, No. 30822. \n \n7  Adopted under the UNFCCC in FCCC/CP/2015/10/Add.1, decision 1/CP.21. \n \n8  A/78/80-E/2023/64. \n\nNational human rights institutions \nA/RES/78/204\n \n3/8\n23-26028 \n \nfreedoms, strengthening participation, in particular of civil society organizations, \npromoting the rule of law, developing and enhancing public awareness of those rights \nand fundamental freedoms and contributing to the prevention of human rights \nviolations and abuses,  \n \nEncouraging greater efforts to investigate and respond to increasing reports of \ncases of reprisal or intimidation against national human rights institutions, their \nmembers and staff and those who cooperate or seek to cooperate with them,  \n \nRecognizing the important role that national human rights institutions can play \nin preventing and addressing cases of reprisal or intimidation as part of supporting \nthe cooperation between States and the United Nations in the promotion of human \nrights, including by contributing to follow-up actions, as appropriate, to \nrecommendations made by international human rights mechanisms, \n \nTaking note of the Belgrade principles on the relationship between national \nhuman rights institutions and parliaments,9 \n \nRecognizing the important role of the United Nations, in particular the Office of \nthe United Nations High Commissioner for Human Rights, in assisting the \ndevelopment of independent and effective national human rights institutions, guided \nby the Paris Principles, and recognizing also in this regard the potential for \nstrengthened and complementary cooperation among the United Nations, the Global \nAlliance of National Human Rights Institutions and its regional coordinating networks \nand those national institutions in the promotion and protection of human rights,  \n \nRecalling the programme of action adopted by national institutions for the \npromotion and protection of human rights at their meeting held in Vienna in June \n1993 during the World Conference on Human Rights, in which it was recommended \nthat United Nations activities and programmes should be reinforced to meet the \nrequests for assistance from States wishing to establish or strengthen their national \ninstitutions for the promotion and protection of human rights, \n \nTaking note with appreciation of the reports of the Secretary-General on national \ninstitutions for the promotion and protection of human rights 10 and on the activities \nof the Global Alliance of National Human Rights Institutions in accrediting national \ninstitutions in compliance with the principles relating to the status of institutions for \nthe promotion and protection of human rights (Paris Principles), 11 \n \nWelcoming efforts to strengthen United Nations system-wide coordination in \nsupport of national human rights institutions and their networks, including the \nestablishment of the tripartite partnership between the Office of the United Nations \nHigh Commissioner for Human Rights, the United Nations Development Programme \nand the Global Alliance of National Human Rights Institutions, and recognizing the \npotential for further cooperation in this regard between the United Nations \nmechanisms and processes and with national human rights institutions, \n \nCommending the strengthening in all regions of regional cooperation among \nnational human rights institutions, and welcoming further the continuing work of the \nNetwork of African National Human Rights Institutions, the Network of National \nInstitutions for the Promotion and Protection of Human Rights in the Americas, the \nAsia-Pacific Forum of National Human Rights Institutions and the European Network \nof National Human Rights Institutions, \n__________________ \n \n9  A/HRC/20/9, annex. \n \n10  A/78/182. \n \n11  A/HRC/51/52. \n\nA/RES/78/204 \nNational human rights institutions\n \n23-26028\n4/8 \n \n \nWelcoming the contribution of the Global Alliance of National Human Rights \nInstitutions to the strengthening of cooperation among existing national human rights \ninstitutions in all regions and the enhancement of the engagement of national human \nrights institutions compliant with the Paris Principles with relevant United Nations \nmechanisms and processes,  \n \nWelcoming also the progress made to date by Member States and all other \nstakeholders, including the Global Alliance of National Human Rights Institutions \nand its regional coordinating networks and relevant United Nations mechanisms and \nprocesses, in the implementation of resolution 76/170, \n \nWelcoming further that the Open-ended Working Group on Ageing is \nimplementing its decision 7/1 of 12 December 2016, entitled \u201cModalities of \nparticipation of national human rights institutions in the work of the Open-ended \nWorking Group on Ageing\u201d,12 and that it invites national human rights institutions fully \ncompliant with the Paris Principles to participate in its work in their own capacity, \n \nNoting with appreciation the opportunities afforded to national human rights \ninstitutions to contribute to the Conference of States Parties to the Convention on the \nRights of Persons with Disabilities and to the Commission on the Status of Women, and \nnoting in this regard the efforts to further enhance the participation of national human \nrights institutions compliant with the Paris Principles at the sessions of the Commission, \nin compliance with the rules of procedure of the Economic and Social Council,  \n \nWelcoming in this regard the decision of the Commission on the Status of \nWomen to encourage the secretariat to continue its consideration of how to enhance \nthe participation, including at the sixty-fourth session of the Commission, of national \nhuman rights institutions that are fully compliant with the Paris Principles, where they \nexist, in compliance with the rules of procedure of the Economic and Social Council,13 \n \nRecalling the invitation to national human rights institutions compliant with the \nParis Principles to register with the Secretariat in order to participate in the international \nmigration review forums, including the informal interactive multi-stakeholder hearings, \nand inviting the institutions, as well as the Global Alliance of National Human Rights \nInstitutions and its regional networks, to submit inputs prior to the forums, \n \nWelcoming the continued contribution of national human rights institutions to the \nwork of the United Nations human rights treaty bodies, as well as the efforts of the \ntreaty bodies, within their respective mandates and in accordance with the treaties \nestablishing these mechanisms, to promote the effective and enhanced participation by \nnational human rights institutions compliant with the Paris Principles at all relevant \nstages of their work, and noting with appreciation the ongoing efforts of the treaty \nbodies, including by the continued consideration of a common treaty body approach to \nthe engagement of the treaty bodies with national human rights institutions at all \nrelevant stages of their work, \n \nTaking note of the Marrakech Declaration adopted at the thirteenth International \nConference of National Human Rights Institutions, \n \n1. \nTakes note with appreciation of the report of the Secretary-General,14 and \nwelcomes the further inclusion of examples of good practices from national human \nrights institutions;  \n \n2. \nReaffirms the importance of the development of effective, independent and \npluralistic national institutions for the promotion and protection of human rights, in \n__________________ \n \n12  See A/AC.278/2016/2, para. 10. \n \n13  See Official Records of the Economic and Social Council, 2019, Supplement No. 7 (E/2019/27), \nchap. I, sect. A. \n \n14  A/78/182. \n\nNational human rights institutions \nA/RES/78/204\n \n5/8\n23-26028 \n \naccordance with the principles relating to the status of national institutions for the \npromotion and protection of human rights (the Paris Principles);  \n \n3. \nRecognizes the role of independent national institutions for the promotion \nand protection of human rights in working together with Governments to ensure full \nrespect for human rights at the national level, including by contributing to follow-up \nactions, as appropriate, to the recommendations resulting from the international \nhuman rights mechanisms; \n \n4. \nAcknowledges that, in the performance of their key functions, in accordance \nwith their mandates and in line with the Paris Principles, national human rights institutions \nare contributing to achieving the 2030 Agenda for Sustainable Development, including \non taking urgent action to combat climate change and its impacts; \n \n5. \nWelcomes the increasingly important role of national institutions for the \npromotion and protection of human rights in supporting cooperation between their \nGovernments and the United Nations in the promotion and protection of human rights; \n \n6. \nUnderlines the value of national human rights institutions, established and \noperating in accordance with the Paris Principles, in the continued monitoring of \nexisting legislation and in consistently informing the State about the impact of such \nlegislation on the activities of human rights defenders, including by making relevant \nand concrete recommendations; \n \n7. \nRecognizes the role that national human rights institutions can play in \npreventing and addressing cases of reprisal or intimidation as part of supporting the \ncooperation between their Governments and the United Nations in the promotion of \nhuman rights, including by contributing to follow-up actions, as appropriate, to \nrecommendations made by international human rights mechanisms, and in that regard \ntakes note of the Marrakech Declaration adopted at the thirteenth International \nConference of National Human Rights Institutions;  \n \n8. \nAlso recognizes that, in accordance with the Vienna Declaration and \nProgramme of Action, it is the right of each State to choose the framework for national \ninstitutions that is best suited to its particular needs at the national level, with due \nconsideration of the Paris Principles, in order to promote human rights in accordance \nwith international human rights standards;  \n \n9. \nEncourages all Member States to establish effective, independent, \npluralistic and adequately resourced national institutions or, where they already exist, \nto strengthen them, in line with the Paris Principles, for the promotion and protection \nof all human rights and fundamental freedoms for all, as outlined in the Vienna \nDeclaration and Programme of Action, and welcomes the growing number of States \nestablishing national human rights institutions in line with the Paris Principles, \nincluding as one of the means for accelerating and guaranteeing progress for the \nimplementation of the 2030 Agenda for Sustainable Development, and to seek \ntechnical cooperation and assistance from the Office of the United Nations High \nCommissioner for Human Rights;  \n \n10. \nEncourages national institutions for the promotion and protection of human \nrights established by Member States to continue to play an active role in preventing and \ncombating all violations of human rights as enumerated in the Vienna Declaration and \nProgramme of Action and relevant international human rights instruments;  \n \n11. \nStresses that national human rights institutions and their respective \nmembers and staff should not face any form of reprisal or intimidation, including \npolitical pressure, physical intimidation, harassment or unjustifiable budgetary \nlimitations, as a result of activities undertaken in accordance with their respective \nmandates, including when taking up individual cases or when reporting on serious or \n\nA/RES/78/204 \nNational human rights institutions\n \n23-26028\n6/8 \n \nsystematic violations in their countries, and calls upon States to promptly and \nthoroughly investigate cases of alleged reprisal or intimidation against members or \nstaff of national human rights institutions or against individuals who cooperate or \nseek to cooperate with them and to bring perpetrators to justice;  \n \n12. Recognizes the role played by national institutions for the promotion and \nprotection of human rights in the Human Rights Council, including its universal \nperiodic review mechanism, in both preparation and follow-up, and the special \nprocedures, in accordance with Council resolutions 5/1 and 5/2 of 18 June 2007 15 and \nCommission on Human Rights resolution 2005/74 of 20 April 2005, 16 and in the \nhuman rights treaty bodies, as well as the strengthening of opportunities for such \nparticipation stipulated in the outcome of the review of the work and functioning of \nthe Council annexed to Council resolution 16/21 of 25 March 201117 and adopted in \nGeneral Assembly resolution 65/281 of 17 June 2011;  \n \n13. Welcomes the contribution of national human rights institutions compliant \nwith the Paris Principles to the work of the United Nations, including of the \nCommission on the Status of Women, the Conference of States Parties to the \nConvention on the Rights of Persons with Disabilities, the Open-ended Working Group \non Ageing and the intergovernmental process of the General Assembly on strengthening \nand enhancing the effective functioning of the human rights treaty body system;  \n \n14. Encourages national human rights institutions compliant with the Paris \nPrinciples to continue to participate in and to contribute to deliberations in all relevant \nUnited Nations mechanisms and processes in accordance with their respective \nmandates, including the discussions on the implementation of the 2030 Agenda for \nSustainable Development;  \n \n15. Encourages all relevant United Nations mechanisms and processes, in \naccordance with their respective mandates, including the Economic and Social Council, \nincluding the Commission on the Status of Women, and the Conference of States Parties \nto the Convention on the Rights of Persons with Disabilities, the Open-ended Working \nGroup on Ageing and the 2030 Agenda for Sustainable Development, including the \nhigh-level political forum on sustainable development and related global and regional \nprocesses, as well as the Sustainable Development Goals Summit, to further enhance \nthe participation of national human rights institutions compliant with the Paris Principles \nand to allow for their contribution to these United Nations mechanisms and processes, \nbearing in mind the relevant provisions dealing with their participation contained in \nGeneral Assembly resolution 60/251 of 15 March 2006, Human Rights Council \nresolutions 5/1, 5/2 and 16/21 and Commission on Human Rights resolution 2005/74;  \n \n16. Encourages all other relevant United Nations forums and meetings, in \naccordance with their respective mandates, existing rules of procedure and modalities, \nto provide for the engagement of national human rights institutions compliant with \nthe Paris Principles and to allow for their contribution to these forums and meetings; \n \n17. Invites the human rights treaty bodies, within their respective mandates \nand in accordance with the treaties establishing these mechanisms, to provide for \nways to ensure the effective and enhanced participation by national human rights \ninstitutions compliant with the Paris Principles at all relevant stages of their work; \n__________________ \n \n15  See Official Records of the General Assembly, Sixty-second Session, Supplement No. 53 \n(A/62/53), chap. IV, sect. A. \n \n16  See Official Records of the Economic and Social Council, 2005, Supplement No. 3 and \ncorrigenda (E/2005/23, E/2005/23/Corr.1 and E/2005/23/Corr.2), chap. II, sect. A. \n \n17  See Official Records of the General Assembly, Sixty-sixth Session, Supplement No. 53 (A/66/53), \nchap. II, sect. A. \n\nNational human rights institutions \nA/RES/78/204\n \n7/8\n23-26028 \n \n \n18. Encourages all United Nations human rights mechanisms and relevant \nUnited Nations agencies, funds and programmes to work, within their respective \nmandates, with Member States and national institutions in the promotion and \nprotection of human rights with respect to, inter alia, projects in the area of good \ngovernance and the rule of law, welcomes in this regard the efforts made by the United \nNations High Commissioner for Human Rights to develop partnerships in support of \nnational institutions, including the tripartite partnership between the Office of the High \nCommissioner, the United Nations Development Programme and the Global Alliance \nof National Human Rights Institutions, and in this respect encourages all United \nNations human rights mechanisms and relevant United Nations agencies, funds and \nprogrammes to enhance their interaction with national human rights institutions, \nincluding by facilitating their access to relevant information and documentation;  \n \n19. Stresses the importance of the financial and administrative independence \nand stability of national human rights institutions, notes with satisfaction the efforts \nof those States that have provided their national institutions with more autonomy and \nindependence, including by giving them an investigative role or enhancing such a \nrole, and encourages other Governments to consider taking similar steps;  \n \n20. Underlines the importance of the autonomy and independence of \nombudsman institutions, encourages increased cooperation between national human \nrights institutions and regional and international associations of ombudsmen, and \nencourages ombudsman institutions to actively draw on the standards enumerated in \ninternational instruments and the Paris Principles to strengthen their independence \nand increase their capacity to act as national human rights protection mechanisms;  \n \n21. Commends the high priority given by the Office of the High Commissioner \nto work on national human rights institutions, encourages the High Commissioner, in \nview of the expanded activities relating to national institutions, including the work of \nthe Subcommittee on Accreditation of the Global Alliance of National Human Rights \nInstitutions, which meets under the auspices of the Office of the High Commissioner, \nto ensure that appropriate arrangements are made and budgetary resources provided \nto continue and further extend activities in support of national institutions, and invites \nStates to contribute additional voluntary funds to that end;  \n \n22. Welcomes the important role played by the Global Alliance of National \nHuman Rights Institutions, in close cooperation with the Office of the High \nCommissioner, in assisting, when requested, in the establishment of, and in \nstrengthening the compliance of, national human rights institutions with the Paris \nPrinciples, in assessing the conformity of national human rights institutions with the \nParis Principles and in providing technical assistance to strengthen national human \nrights institutions, upon request, with a view to enhancing the compliance of national \nhuman rights institutions with the Paris Principles, and calls upon Member States and \nother stakeholders, including United Nations agencies, to follow up on the \nrecommendations of the Subcommittee on Accreditation of the Global Alliance of \nNational Human Rights Institutions, with a view to enabling national human rights \ninstitutions to fully comply with the Paris Principles in both law and practice;  \n \n23. Encourages national institutions, including ombudsman and mediator \ninstitutions, to seek accreditation status through the Global Alliance of National \nHuman Rights Institutions;  \n \n24. Encourages all Member States to take appropriate steps to promote the \nexchange of information and experience concerning the establishment and effective \noperation of national human rights institutions and to support the work of the Global \nAlliance of National Human Rights Institutions and its regional coordinating \nnetworks in this regard, including through support for the relevant technical \nassistance programmes of the Office of the High Commissioner; \n\nA/RES/78/204 \nNational human rights institutions\n \n23-26028\n8/8 \n \n \n25. Requests the Secretary-General to continue to provide support to national \nhuman rights institutions compliant with the Paris Principles, as they engage with \nrelevant United Nations mechanisms and processes, with full respect for their respective \nmandates, and with a view to enabling their most effective contributions, in order to \nfurther the implementation of international human rights obligations and commitments;  \n \n26. Urges the Secretary-General to continue to give high priority to requests \nfrom Member States for assistance in the establishment and strengthening of national \nhuman rights institutions in line with the Paris Principles, including as one of the \nmeans of accelerating and guaranteeing progress in the implementation of the 2030 \nAgenda for Sustainable Development, and encourages the Secretary-General to \nstrengthen cooperation between the United Nations and the Global Alliance of \nNational Human Rights Institutions in this regard; \n \n27. Calls upon the Secretary-General to continue to encourage national human \nrights institutions to interact with and advocate independent participation in all \nrelevant United Nations mechanisms and processes, in accordance with their \nrespective mandates, existing rules of procedure and modalities; \n \n28. Requests the Secretary-General to continue to provide the assistance \nnecessary for holding international and regional meetings of national institutions, \nincluding meetings of the Global Alliance of National Human Rights Institutions, in \ncooperation with the Office of the High Commissioner;  \n \n29. Also requests the Secretary-General, in consultation with Member States \nand national human rights institutions, to report to the General Assembly at its \neightieth session on the implementation of the present resolution, including on best \npractices among national human rights institutions. \n \n50th plenary meeting \n19 December 2023 \n \n",
  "paragraphs": {
    "1": "Takes note with appreciation of the report of the Secretary-General,14 and welcomes the further inclusion of examples of good practices from national human rights institutions;",
    "2": "Reaffirms the importance of the development of effective, independent and pluralistic national institutions for the promotion and protection of human rights, in accordance with the principles relating to the status of national institutions for the promotion and protection of human rights (the Paris Principles);",
    "3": "Recognizes the role of independent national institutions for the promotion and protection of human rights in working together with Governments to ensure full respect for human rights at the national level, including by contributing to follow-up actions, as appropriate, to the recommendations resulting from the international human rights mechanisms;",
    "4": "Acknowledges that, in the performance of their key functions, in accordance with their mandates and in line with the Paris Principles, national human rights institutions are contributing to achieving the 2030 Agenda for Sustainable Development, including on taking urgent action to combat climate change and its impacts;",
    "5": "Welcomes the increasingly important role of national institutions for the promotion and protection of human rights in supporting cooperation between their Governments and the United Nations in the promotion and protection of human rights;",
    "6": "Underlines the value of national human rights institutions, established and operating in accordance with the Paris Principles, in the continued monitoring of existing legislation and in consistently informing the State about the impact of such legislation on the activities of human rights defenders, including by making relevant and concrete recommendations;",
    "7": "Recognizes the role that national human rights institutions can play in preventing and addressing cases of reprisal or intimidation as part of supporting the cooperation between their Governments and the United Nations in the promotion of human rights, including by contributing to follow-up actions, as appropriate, to recommendations made by international human rights mechanisms, and in that regard takes note of the Marrakech Declaration adopted at the thirteenth International Conference of National Human Rights Institutions;",
    "8": "Also recognizes that, in accordance with the Vienna Declaration and Programme of Action, it is the right of each State to choose the framework for national institutions that is best suited to its particular needs at the national level, with due consideration of the Paris Principles, in order to promote human rights in accordance with international human rights standards;",
    "9": "Encourages all Member States to establish effective, independent, pluralistic and adequately resourced national institutions or, where they already exist, to strengthen them, in line with the Paris Principles, for the promotion and protection of all human rights and fundamental freedoms for all, as outlined in the Vienna Declaration and Programme of Action, and welcomes the growing number of States establishing national human rights institutions in line with the Paris Principles, including as one of the means for accelerating and guaranteeing progress for the implementation of the 2030 Agenda for Sustainable Development, and to seek technical cooperation and assistance from the Office of the United Nations High Commissioner for Human Rights;",
    "10": "Encourages national institutions for the promotion and protection of human rights established by Member States to continue to play an active role in preventing and combating all violations of human rights as enumerated in the Vienna Declaration and Programme of Action and relevant international human rights instruments;",
    "11": " systematic violations in their countries, and calls upon States to promptly and thoroughly investigate cases of alleged reprisal or intimidation against members or staff of national human rights institutions or against individuals who cooperate or seek to cooperate with them and to bring perpetrators to justice;",
    "12": "Recognizes the role played by national institutions for the promotion and protection of human rights in the Human Rights Council, including its universal periodic review mechanism, in both preparation and follow-up, and the special procedures, in accordance with Council resolutions 5/1 and 5/2 of 18 June 2007 15 and Commission on Human Rights resolution 2005/74 of 20 April 2005, 16 and in the human rights treaty bodies, as well as the strengthening of opportunities for such participation stipulated in the outcome of the review of the work and functioning of the Council annexed to Council resolution 16/21 of 25 March 201117 and adopted in General Assembly resolution 65/281 of 17 June 2011;",
    "13": "Welcomes the contribution of national human rights institutions compliant with the Paris Principles to the work of the United Nations, including of the Commission on the Status of Women, the Conference of States Parties to the Convention on the Rights of Persons with Disabilities, the Open-ended Working Group on Ageing and the intergovernmental process of the General Assembly on strengthening and enhancing the effective functioning of the human rights treaty body system;",
    "14": "Encourages national human rights institutions compliant with the Paris Principles to continue to participate in and to contribute to deliberations in all relevant United Nations mechanisms and processes in accordance with their respective mandates, including the discussions on the implementation of the 2030 Agenda for Sustainable Development;",
    "15": "Encourages all relevant United Nations mechanisms and processes, in accordance with their respective mandates, including the Economic and Social Council, including the Commission on the Status of Women, and the Conference of States Parties to the Convention on the Rights of Persons with Disabilities, the Open-ended Working Group on Ageing and the 2030 Agenda for Sustainable Development, including the high-level political forum on sustainable development and related global and regional processes, as well as the Sustainable Development Goals Summit, to further enhance the participation of national human rights institutions compliant with the Paris Principles and to allow for their contribution to these United Nations mechanisms and processes, bearing in mind the relevant provisions dealing with their participation contained in General Assembly resolution 60/251 of 15 March 2006, Human Rights Council resolutions 5/1, 5/2 and 16/21 and Commission on Human Rights resolution 2005/74;",
    "16": "Encourages all other relevant United Nations forums and meetings, in accordance with their respective mandates, existing rules of procedure and modalities, to provide for the engagement of national human rights institutions compliant with the Paris Principles and to allow for their contribution to these forums and meetings;",
    "17": "Invites the human rights treaty bodies, within their respective mandates and in accordance with the treaties establishing these mechanisms, to provide for ways to ensure the effective and enhanced participation by national human rights institutions compliant with the Paris Principles at all relevant stages of their work;",
    "18": "Encourages all United Nations human rights mechanisms and relevant United Nations agencies, funds and programmes to work, within their respective mandates, with Member States and national institutions in the promotion and protection of human rights with respect to, inter alia, projects in the area of good governance and the rule of law, welcomes in this regard the efforts made by the United Nations High Commissioner for Human Rights to develop partnerships in support of national institutions, including the tripartite partnership between the Office of the High Commissioner, the United Nations Development Programme and the Global Alliance of National Human Rights Institutions, and in this respect encourages all United Nations human rights mechanisms and relevant United Nations agencies, funds and programmes to enhance their interaction with national human rights institutions, including by facilitating their access to relevant information and documentation;",
    "19": "Stresses the importance of the financial and administrative independence and stability of national human rights institutions, notes with satisfaction the efforts of those States that have provided their national institutions with more autonomy and independence, including by giving them an investigative role or enhancing such a role, and encourages other Governments to consider taking similar steps;",
    "20": "Underlines the importance of the autonomy and independence of ombudsman institutions, encourages increased cooperation between national human rights institutions and regional and international associations of ombudsmen, and encourages ombudsman institutions to actively draw on the standards enumerated in international instruments and the Paris Principles to strengthen their independence and increase their capacity to act as national human rights protection mechanisms;",
    "21": "Commends the high priority given by the Office of the High Commissioner to work on national human rights institutions, encourages the High Commissioner, in view of the expanded activities relating to national institutions, including the work of the Subcommittee on Accreditation of the Global Alliance of National Human Rights Institutions, which meets under the auspices of the Office of the High Commissioner, to ensure that appropriate arrangements are made and budgetary resources provided to continue and further extend activities in support of national institutions, and invites States to contribute additional voluntary funds to that end;",
    "22": "Welcomes the important role played by the Global Alliance of National Human Rights Institutions, in close cooperation with the Office of the High Commissioner, in assisting, when requested, in the establishment of, and in strengthening the compliance of, national human rights institutions with the Paris Principles, in assessing the conformity of national human rights institutions with the Paris Principles and in providing technical assistance to strengthen national human rights institutions, upon request, with a view to enhancing the compliance of national human rights institutions with the Paris Principles, and calls upon Member States and other stakeholders, including United Nations agencies, to follow up on the recommendations of the Subcommittee on Accreditation of the Global Alliance of National Human Rights Institutions, with a view to enabling national human rights institutions to fully comply with the Paris Principles in both law and practice;",
    "23": "Encourages national institutions, including ombudsman and mediator institutions, to seek accreditation status through the Global Alliance of National Human Rights Institutions;",
    "24": "",
    "25": "Requests the Secretary-General to continue to provide support to national human rights institutions compliant with the Paris Principles, as they engage with relevant United Nations mechanisms and processes, with full respect for their respective mandates, and with a view to enabling their most effective contributions, in order to further the implementation of international human rights obligations and commitments;",
    "26": "Urges the Secretary-General to continue to give high priority to requests from Member States for assistance in the establishment and strengthening of national human rights institutions in line with the Paris Principles, including as one of the means of accelerating and guaranteeing progress in the implementation of the 2030 Agenda for Sustainable Development, and encourages the Secretary-General to strengthen cooperation between the United Nations and the Global Alliance of National Human Rights Institutions in this regard;",
    "27": "Calls upon the Secretary-General to continue to encourage national human rights institutions to interact with and advocate independent participation in all relevant United Nations mechanisms and processes, in accordance with their respective mandates, existing rules of procedure and modalities;",
    "28": "Requests the Secretary-General to continue to provide the assistance necessary for holding international and regional meetings of national institutions, including meetings of the Global Alliance of National Human Rights Institutions, in cooperation with the Office of the High Commissioner;",
    "29": "Also requests the Secretary-General, in consultation with Member States and national human rights institutions, to report to the General Assembly at its eightieth session on the implementation of the present resolution, including on best practices among national human rights institutions."
  },
  "agenda_items": [
    "Item 71"
  ],
  "symbol_references": []
}