{
  "symbol": "A/RES/74/48",
  "filename": "A_RES_74_48.pdf",
  "title": "74/48. Nuclear-weapon-free southern hemisphere and adjacent areas",
  "text": "United Nations \nA/RES/74/48\n \n \nGeneral Assembly \nDistr.: General \n19 December 2019 \n \n19-21835 (E)    311219 \n*1921835* \n \n \nSeventy-fourth session \nAgenda item 98 (j) \nGeneral and complete disarmament: nuclear-weapon-free \nsouthern hemisphere and adjacent areas \n \n \n \n \n Resolution adopted by the General Assembly \non 12 December 2019 \n \n \n \n \n[on the report of the First Committee (A/74/368)] \n \n \n \n74/48. Nuclear-weapon-free southern hemisphere and adjacent areas \n \n \n \nThe General Assembly,  \n \nRecalling its resolutions 51/45 B of 10 December 1996, 52/38 N of 9 December \n1997, 53/77 Q of 4 December 1998, 54/54 L of 1 December 1999, 55/33 I of \n20 November 2000, 56/24 G of 29 November 2001, 57/73 of 22 November 2002, \n58/49 of 8 December 2003, 59/85 of 3 December 2004, 60/58 of 8 December 2005, \n61/69 of 6 December 2006, 62/35 of 5 December 2007, 63/65 of 2 December 2008, \n64/44 of 2 December 2009, 65/58 of 8 December 2010, 67/55 of 3 December 2012, \n69/35 of 2 December 2014, 70/45 of 7 December 2015, 71/51 of 5 December 2016 \nand 72/45 of 4 December 2017, \n \nRecalling also the provisions on nuclear-weapon-free zones of the Final \nDocument of the Tenth Special Session of the General Assembly, the first special \nsession devoted to disarmament,1  \n \nRecalling further the adoption by the Disarmament Commission at its 1999 \nsubstantive session of a text entitled \u201cEstablishment of nuclear-weapon-free zones on \nthe basis of arrangements freely arrived at among the States of the region concerned\u201d,2  \n \nDetermined to pursue the total elimination of nuclear weapons, \n \nDetermined also to continue to contribute to the prevention of the proliferation \nof nuclear weapons in all its aspects and to the process of general and complete \ndisarmament under strict and effective international control, in particular in the field \nof nuclear weapons and other weapons of mass destruction, with a view to \nstrengthening international peace and security, in accordance with the purposes and \nprinciples of the Charter of the United Nations, \n__________________ \n \n1  Resolution S-10/2. \n \n2  Official Records of the General Assembly, Fifty-fourth Session, Supplement No. 42 (A/54/42), annex I. \n\nA/RES/74/48 \nNuclear-weapon-free southern hemisphere and adjacent areas\n \n19-21835\n2/3 \n \n \nWelcoming the adoption on 7 July 2017 of the Treaty on the Prohibition of \nNuclear Weapons3 and its reaffirmation of the conviction that the establishment of the \ninternationally recognized nuclear-weapon-free zones on the basis of arrangements \nfreely arrived at among the States of the region concerned enhances global and \nregional peace and security, strengthens the nuclear non-proliferation regime and \ncontributes towards realizing the objective of nuclear disarmament, \n \nRecalling the Final Document of the 2010 Review Conference of the Parties to \nthe Treaty on the Non-Proliferation of Nuclear Weapons, 4  which reaffirmed the \nconviction that the establishment of nuclear-weapon-free zones contributes towards \nrealizing the objectives of nuclear disarmament, \n \nStressing the importance of the treaties of Tlatelolco, 5 Rarotonga,6 Bangkok7 \nand Pelindaba 8  establishing nuclear-weapon-free zones, as well as the Antarctic \nTreaty,9 inter alia, for achieving a world entirely free of nuclear weapons, \n \nWelcoming the preparations for the fourth Conference of Nuclear-Weapon-Free \nZones and Mongolia, to be held in New York on 24 April 2020, \n \nNoting that 115 States are currently parties and signatories to nuclear-weapon-\nfree zone treaties, \n \nUnderlining the value of enhancing cooperation among the nuclear-weapon-free \nzone treaty members by means of mechanisms such as joint meetings of States parties, \nsignatories and observers to those treaties, and welcoming in this regard the seminar \non fostering cooperation and enhancing consultation mechanisms among the existing \nnuclear-weapon-free zones, held in Kazakhstan on 28 and 29 August 2019,  \n \nReaffirming the applicable principles and rules of international law relating to \nthe freedom of the high seas and the rights of passage through maritime space, \nincluding those of the United Nations Convention on the Law of the Sea, 10  \n \n1. \nReaffirms its conviction of the important role of nuclear-weapon-free \nzones in strengthening the nuclear non-proliferation regime and in extending the areas \nof the world that are nuclear-weapon-free, and calls for greater progress towards the \ntotal elimination of all nuclear weapons; \n \n2. \nWelcomes the continued contribution that the Antarctic Treaty9 and the \ntreaties of Tlatelolco,5 Rarotonga,6 Bangkok7 and Pelindaba8 are making towards \nfreeing the southern hemisphere and adjacent areas covered by those treaties from \nnuclear weapons; \n \n3. \nNotes with satisfaction that all nuclear-weapon-free zones in the southern \nhemisphere and adjacent areas are now in force; \n \n4. \nCalls upon all States concerned to continue to work together in order to \nfacilitate adherence to the protocols to nuclear-weapon-free zone treaties by all \nrelevant States that have not yet done so, in this regard welcomes the ratification by \nChina, France, the Russian Federation and the United Kingdom of Great Britain and \n__________________ \n \n3  A/CONF.229/2017/8. \n \n4  2010 Review Conference of the Parties to the Treaty on the Non-Proliferation of Nuclear \nWeapons, Final Document, vols. I\u2013III (NPT/CONF.2010/50 (Vol. I), NPT/CONF.2010/50 (Vol. II) \nand NPT/CONF.2010/50 (Vol. III)). \n \n5  United Nations, Treaty Series, vol. 634, No. 9068. \n \n6  The United Nations Disarmament Yearbook, vol. 10: 1985 (United Nations publication, Sales \nNo. E.86.IX.7), appendix VII. \n \n7  United Nations, Treaty Series, vol. 1981, No. 33873. \n \n8  A/50/426, annex. \n \n9  United Nations, Treaty Series, vol. 402, No. 5778. \n \n10  Ibid., vol. 1833, No. 31363. \n\nNuclear-weapon-free southern hemisphere and adjacent areas \nA/RES/74/48\n \n3/3\n19-21835 \n \nNorthern Ireland of the Protocol to the Treaty on a Nuclear-Weapon-Free Zone in \nCentral Asia and the steps taken by the United States of America towards the \nratification of the protocols to the Treaty on a Nuclear-Weapon-Free Zone in Central \nAsia, to the Treaty of Pelindaba and to the Treaty of Rarotonga, and encourages \nprogress with a view to concluding consultations between the nuclear-weapon States \nand the parties to the Bangkok Treaty on the Protocol to that Treaty;  \n \n5. \nCalls upon the nuclear-weapon States to withdraw any reservations or \ninterpretive declarations contrary to the object and purpose of the treaties establishing \nnuclear-weapon-free zones; \n \n6. \nWelcomes the steps taken to conclude further nuclear-weapon-free zone \ntreaties on the basis of arrangements freely arrived at among the States of the region \nconcerned, including the steps taken towards the establishment of a nuclear-weapon-\nfree zone in the Middle East; \n \n7. \nCongratulates the States parties and signatories to the treaties of \nTlatelolco, Rarotonga, Bangkok and Pelindaba, as well as of Central Asia and \nMongolia, for their efforts to pursue the common goals envisaged in those treaties \nand to promote the nuclear-weapon-free status of the southern hemisphere and \nadjacent areas, and calls upon them to explore and implement further ways and means \nof cooperation among themselves and their treaty agencies; \n \n8. \nEncourages efforts to reinforce coordination among nuclear-weapon-free \nzones; \n \n9. \nEncourages the competent authorities of the nuclear-weapon-free zone \ntreaties to provide assistance to the States parties and signatories to those treaties so \nas to facilitate the accomplishment of the goals of the treaties; \n \n10. Decides to include in the provisional agenda of its seventy-sixth session, \nunder the item entitled \u201cGeneral and complete disarmament\u201d, the sub-item entitled \n\u201cNuclear-weapon-free southern hemisphere and adjacent areas\u201d. \n \n46th plenary meeting \n12 December 2019 \n \n",
  "paragraphs": {
    "1": "Reaffirms its conviction of the important role of nuclear-weapon-free zones in strengthening the nuclear non-proliferation regime and in extending the areas of the world that are nuclear-weapon-free, and calls for greater progress towards the total elimination of all nuclear weapons;",
    "2": "Welcomes the continued contribution that the Antarctic Treaty9 and the treaties of Tlatelolco,5 Rarotonga,6 Bangkok7 and Pelindaba8 are making towards freeing the southern hemisphere and adjacent areas covered by those treaties from nuclear weapons;",
    "3": "Notes with satisfaction that all nuclear-weapon-free zones in the southern hemisphere and adjacent areas are now in force;",
    "4": "Calls upon all States concerned to continue to work together in order to facilitate adherence to the protocols to nuclear-weapon-free zone treaties by all relevant States that have not yet done so, in this regard welcomes the ratification by China, France, the Russian Federation and the United Kingdom of Great Britain and Northern Ireland of the Protocol to the Treaty on a Nuclear-Weapon-Free Zone in Central Asia and the steps taken by the United States of America towards the ratification of the protocols to the Treaty on a Nuclear-Weapon-Free Zone in Central Asia, to the Treaty of Pelindaba and to the Treaty of Rarotonga, and encourages progress with a view to concluding consultations between the nuclear-weapon States and the parties to the Bangkok Treaty on the Protocol to that Treaty;",
    "5": "Calls upon the nuclear-weapon States to withdraw any reservations or interpretive declarations contrary to the object and purpose of the treaties establishing nuclear-weapon-free zones;",
    "6": "Welcomes the steps taken to conclude further nuclear-weapon-free zone treaties on the basis of arrangements freely arrived at among the States of the region concerned, including the steps taken towards the establishment of a nuclear-weapon- free zone in the Middle East;",
    "7": "Congratulates the States parties and signatories to the treaties of Tlatelolco, Rarotonga, Bangkok and Pelindaba, as well as of Central Asia and Mongolia, for their efforts to pursue the common goals envisaged in those treaties and to promote the nuclear-weapon-free status of the southern hemisphere and adjacent areas, and calls upon them to explore and implement further ways and means of cooperation among themselves and their treaty agencies;",
    "8": "Encourages efforts to reinforce coordination among nuclear-weapon-free zones;",
    "9": "Encourages the competent authorities of the nuclear-weapon-free zone treaties to provide assistance to the States parties and signatories to those treaties so as to facilitate the accomplishment of the goals of the treaties;",
    "10": "Decides to include in the provisional agenda of its seventy-sixth session, under the item entitled \u201cGeneral and complete disarmament\u201d, the sub-item entitled \u201cNuclear-weapon-free southern hemisphere and adjacent areas\u201d."
  },
  "agenda_items": [
    "Item 98"
  ],
  "symbol_references": []
}