{
  "symbol": "A/RES/78/308",
  "filename": "A_RES_78_308.pdf",
  "title": "78/308. Financing of the African Union-United Nations Hybrid Operation in Darfur",
  "text": "United Nations \nA/RES/78/308\n \n \nGeneral Assembly \nDistr.: General \n3 July 2024 \n \n24-12174 (E)     \n*2412174* \n \n \nSeventy-eighth session \nAgenda item 159 \nFinancing of the African Union-United Nations Hybrid \nOperation in Darfur \n \n \n \n \n Resolution adopted by the General Assembly \non 28 June 2024 \n \n \n \n \n[on the report of the Fifth Committee (A/78/932, para. 6)] \n \n \n 78/308. Financing of the African Union-United Nations Hybrid Operation \nin Darfur  \n \n \n \nThe General Assembly, \n \nHaving considered the reports of the Secretary-General on the financing of the \nAfrican Union-United Nations Hybrid Operation in Darfur1 and the related reports of \nthe Advisory Committee on Administrative and Budgetary Questions, 2  \n \nRecalling Security Council resolution 1769 (2007) of 31 July 2007, by which \nthe Council established the African Union-United Nations Hybrid Operation in Darfur \nfor an initial period of 12 months from 31 July 2007, and the subsequent resolutions \nby which the Council extended the mandate of the Operation, the latest of which was \nresolution 2559 (2020) of 22 December 2020, by which the Council decided to \nterminate the mandate of the Operation as of 31 December 2020,  \n \nRecalling also its resolution 62/232 A of 22 December 2007 on the financing of \nthe Operation and its subsequent resolutions thereon, the latest of which was \nresolution 76/244 B of 29 June 2022,  \n \nReaffirming the general principles underlying the financing of United Nations \npeacekeeping operations, as stated in its resolutions 1874 (S-IV) of 27 June 1963, \n3101 (XXVIII) of 11 December 1973 and 55/235 of 23 December 2000,  \n \nMindful of the fact that it is essential to provide the Operation with the financial \nresources necessary to enable it to fulfil its responsibilities under the relevant \nresolutions of the Security Council,  \n \n1. \nTakes note of the status of contributions to the African Union-United \nNations Hybrid Operation in Darfur as at 30 April 2024, including the contributions \n__________________ \n \n1  A/77/638 and A/78/702. \n \n2  A/77/780 and A/78/803. \n\nA/RES/78/308 \nFinancing of the African Union-United Nations Hybrid Operation \nin Darfur\n \n24-12174\n2/2 \n \noutstanding in the amount of 106.5 million United States dollars, representing some \n0.6 per cent of the total assessed contributions, notes with concern that only 149 \nMember States have paid their assessed contributions in full, and urges all other \nMember States, in particular those in arrears, to ensure payment of their outstanding \nassessed contributions;  \n \n2. \nExpresses its appreciation to those Member States that have paid their \nassessed contributions in full, and urges all other Member States to make every \npossible effort to ensure payment of their assessed contributions to the Operation in full;  \n \n3. \nExpresses concern at the financial situation with regard to peacekeeping \nactivities, in particular as regards the reimbursements to troop contributors that bear \nadditional burdens owing to overdue payments by Member States of their \nassessments;  \n \n4. \nEndorses the conclusions and recommendations contained in the reports \nof the Advisory Committee on Administrative and Budgetary Questions, and requests \nthe Secretary-General to ensure their full implementation; \n \n \n \n5. \nNotes that the in-field liquidation activities of the mission have been \ncompleted; \n \n6. \nAuthorizes the Secretary-General, on an exceptional basis, with the prior \nconcurrence of the Advisory Committee and subject to relevant rules and regulations, \nto enter into commitments in respect of expenditures related to the mandated \noperation and liquidation of the Operation that are identified after the closure of the \nOperation, and to use the Peacekeeping Reserve Fund for cash flow purposes if \nnecessary, and to report thereon in the context of the final performance report;  \n \n7. \nRequests the Secretary-General to submit the final performance report \nduring the seventy-ninth session of the General Assembly; \n \n \n \nBudget performance report for the period from 1 July 2021 to 30 June 2022 \n \n \n8. \nTakes note of the report of the Secretary-General on the budget \nperformance of the Operation for the period from 1 July 2021 to 30 June 2022;  \n \n9. \nAlso takes note of the amount of 54,105,800 dollars comprising the \nunencumbered balance of 13,974,200 dollars in respect of the financial period ended \n30 June 2022 and other revenue in the amount of 40,131,600 dollars in respect of the \nsame period, and decides to defer action thereon until it considers the final \nperformance report of the Operation; \n \n10. Further takes note of the amount of 2,900,800 dollars representing the \ndecrease in estimated staff assessment income in respect of the financial period ended \n30 June 2022, and decides to defer action thereon until it considers the final \nperformance report of the Operation; \n \n \n \nFinal disposition of the assets of the African Union-United Nations Hybrid \nOperation in Darfur \n \n \n11. \nTakes note of the report of the Secretary-General on the final disposition \nof the assets of the African Union-United Nations Hybrid Operation in Darfur;  \n \n12. \nDecides to include in the provisional agenda of its seventy-ninth session the \nitem entitled \u201cFinancing of the African Union-United Nations Hybrid Operation in Darfur\u201d. \n \n95th plenary meeting \n28 June 2024 \n \n",
  "paragraphs": {
    "1": "Takes note of the status of contributions to the African Union-United Nations Hybrid Operation in Darfur as at 30 April 2024, including the contributions outstanding in the amount of 106.5 million United States dollars, representing some 0.6 per cent of the total assessed contributions, notes with concern that only 149 Member States have paid their assessed contributions in full, and urges all other Member States, in particular those in arrears, to ensure payment of their outstanding assessed contributions;",
    "2": "Expresses its appreciation to those Member States that have paid their assessed contributions in full, and urges all other Member States to make every possible effort to ensure payment of their assessed contributions to the Operation in full;",
    "3": "Expresses concern at the financial situation with regard to peacekeeping activities, in particular as regards the reimbursements to troop contributors that bear additional burdens owing to overdue payments by Member States of their assessments;",
    "4": "Endorses the conclusions and recommendations contained in the reports of the Advisory Committee on Administrative and Budgetary Questions, and requests the Secretary-General to ensure their full implementation;",
    "5": "Notes that the in-field liquidation activities of the mission have been completed;",
    "6": "Authorizes the Secretary-General, on an exceptional basis, with the prior concurrence of the Advisory Committee and subject to relevant rules and regulations, to enter into commitments in respect of expenditures related to the mandated operation and liquidation of the Operation that are identified after the closure of the Operation, and to use the Peacekeeping Reserve Fund for cash flow purposes if necessary, and to report thereon in the context of the final performance report;",
    "7": "Requests the Secretary-General to submit the final performance report during the seventy-ninth session of the General Assembly; Budget performance report for the period from 1 July 2021 to 30 June 2022",
    "8": "Takes note of the report of the Secretary-General on the budget performance of the Operation for the period from 1 July 2021 to 30 June 2022;",
    "9": "Also takes note of the amount of 54,105,800 dollars comprising the unencumbered balance of 13,974,200 dollars in respect of the financial period ended 30 June 2022 and other revenue in the amount of 40,131,600 dollars in respect of the same period, and decides to defer action thereon until it considers the final performance report of the Operation;",
    "10": "Further takes note of the amount of 2,900,800 dollars representing the decrease in estimated staff assessment income in respect of the financial period ended 30 June 2022, and decides to defer action thereon until it considers the final performance report of the Operation; Final disposition of the assets of the African Union-United Nations Hybrid Operation in Darfur",
    "11": "Takes note of the report of the Secretary-General on the final disposition of the assets of the African Union-United Nations Hybrid Operation in Darfur;",
    "12": "Decides to include in the provisional agenda of its seventy-ninth session the item entitled \u201cFinancing of the African Union-United Nations Hybrid Operation in Darfur\u201d."
  },
  "agenda_items": [
    "Item 159"
  ],
  "symbol_references": []
}