{
  "symbol": "A/RES/72/21",
  "filename": "A_RES_72_21.pdf",
  "title": "72/21. Implementation of the Declaration of the Indian Ocean as a Zone of Peace",
  "text": "United Nations \nA/RES/72/21\n \n \nGeneral Assembly \nDistr.: General \n11 December 2017 \n \n17-21687 (E)    131217 \n*1721687* \n \n \nSeventy-second session \nAgenda item 91 \n \n \n \n \n Resolution adopted by the General Assembly \non 4 December 2017 \n \n \n \n \n[on the report of the First Committee (A/72/401)] \n \n \n \n72/21. Implementation of the Declaration of the Indian Ocean as a Zone \nof Peace \n \n \n \nThe General Assembly,  \n \nRecalling the Declaration of the Indian Ocean as a Zone of Peace, contained in \nits resolution 2832 (XXVI) of 16 December 1971, and recalling also its resolutions \n54/47 of 1 December 1999, 56/16 of 29 November 2001, 58/29 of 8 December \n2003, 60/48 of 8 December 2005, 62/14 of 5 December 2007, 64/23 of 2 December \n2009, 66/22 of 2 December 2011, 68/24 of 5 December 2013 and 70/22 of \n7 December 2015 and other relevant resolutions, \n \nRecalling also the report of the Meeting of the Littoral and Hinterland States \nof the Indian Ocean, held in New York from 2 to 13 July 1979,1 \n \nRecalling further paragraph 102 of the Final Document of the Thirteenth \nConference of Heads of State or Government of Non-Aligned Countries, held in \nKuala Lumpur on 24 and 25 February 2003,2 in which it was noted, inter alia, that \nthe Chair of the Ad Hoc Committee on the Indian Ocean would continue his \ninformal consultations on the future work of the Committee, \n \nEmphasizing the need to foster consensual approaches that are conducive to \nthe pursuit of such endeavours, \n \nNoting the initiatives taken by countries of the region to promote cooperation, \nin particular economic cooperation, in the Indian Ocean area and the possible \ncontribution of such initiatives to overall objectives of a zone of peace, \n \nConvinced that the participation of all permanent members of the Security \nCouncil and the major maritime users of the Indian Ocean in the work of the \n__________________ \n \n1  Official Records of the General Assembly, Thirty-fourth Session, Supplement No. 45 and \ncorrigendum (A/34/45 and A/34/45/Corr.1). \n \n2  A/57/759-S/2003/332, annex I. \n\nA/RES/72/21 \nImplementation of the Declaration of the Indian Ocean as a Zone of Peace\n \n17-21687 \n2/2 \n \nAd Hoc Committee is important and would assist the progress of a mutually \nbeneficial dialogue to develop conditions of peace, security and stability in the \nIndian Ocean region,  \n \nConsidering that greater efforts and more time are required to develop a \nfocused discussion on practical measures to ensure conditions of peace, security and \nstability in the Indian Ocean region,  \n \nHaving considered the report of the Ad Hoc Committee,3  \n \n1. \nTakes note of the report of the Ad Hoc Committee on the Indian Ocean; 3 \n \n2. \nReiterates its conviction that the participation of all permanent members \nof the Security Council and the major maritime users of the Indian Ocean in the \nwork of the Ad Hoc Committee is important and would greatly facilitate the \ndevelopment of a mutually beneficial dialogue to advance peace, security and \nstability in the Indian Ocean region;  \n \n3. \nRequests the Chair of the Ad Hoc Committee to continue his informal \nconsultations with the members of the Committee and to report through the \nCommittee to the General Assembly at its seventy-fourth session;  \n \n4. \nRequests the Secretary-General to continue to render, within existing \nresources, all necessary assistance to the Ad Hoc Committee, including the \nprovision of summary records;  \n \n5. \nDecides to include in the provisional agenda of its seventy-fourth session \nthe item entitled \u201cImplementation of the Declaration of the Indian Ocean as a Zone \nof Peace\u201d. \n \n62nd plenary meeting \n4 December 2017 \n \n__________________ \n \n3  Official Records of the General Assembly, Seventy-second Session, Supplement No. 29 (A/72/29). \n",
  "paragraphs": {
    "1": "Takes note of the report of the Ad Hoc Committee on the Indian Ocean; 3",
    "2": "Reiterates its conviction that the participation of all permanent members of the Security Council and the major maritime users of the Indian Ocean in the work of the Ad Hoc Committee is important and would greatly facilitate the development of a mutually beneficial dialogue to advance peace, security and stability in the Indian Ocean region;",
    "3": "Requests the Chair of the Ad Hoc Committee to continue his informal consultations with the members of the Committee and to report through the Committee to the General Assembly at its seventy-fourth session;",
    "4": "Requests the Secretary-General to continue to render, within existing resources, all necessary assistance to the Ad Hoc Committee, including the provision of summary records;",
    "5": "Decides to include in the provisional agenda of its seventy-fourth session the item entitled \u201cImplementation of the Declaration of the Indian Ocean as a Zone of Peace\u201d. 62nd plenary meeting 4 December 2017 __________________ 3 Official Records of the General Assembly, Seventy-second Session, Supplement No. 29 (A/72/29)."
  },
  "agenda_items": [
    "Item 91"
  ],
  "symbol_references": []
}