{
  "symbol": "A/RES/78/118",
  "filename": "A_RES_78_118.pdf",
  "title": "78/118. Safety and security of humanitarian personnel and protection of United Nations personnel",
  "text": "United Nations \nA/RES/78/118\n \n \nGeneral Assembly \nDistr.: General \n13 December 2023 \n \n23-24985 (E)    261223     \n*2324985* \n \n \nSeventy-eighth session \nAgenda item 72 (a) \nStrengthening of the coordination of humanitarian and \ndisaster relief assistance of the United Nations, including \nspecial economic assistance: strengthening of the \ncoordination of emergency humanitarian assistance of the \nUnited Nations \n \n \n \n \n Resolution adopted by the General Assembly \non 8 December 2023 \n \n \n \n \n[without reference to a Main Committee (A/78/L.17)] \n \n \n \n78/118. Safety and security of humanitarian personnel and protection \nof United Nations personnel \n \n \n \nThe General Assembly, \n \nReaffirming its resolution 46/182 of 19 December 1991 on the strengthening of \nthe coordination of humanitarian emergency assistance of the United Nations, \n \nRecalling all relevant resolutions on the safety and security of humanitarian \npersonnel and protection of United Nations personnel, including its resolution 77/31 \nof 6 December 2022, as well as Security Council resolutions on the protection of \nhumanitarian personnel, including resolution 2175 (2014) of 29 August 2014, and \nrelevant statements by the President of the Council,  \n \nRecalling also all Security Council resolutions and presidential statements and \nreports of the Secretary-General to the Council on the protection of civilians in armed \nconflict, including resolution 2286 (2016) of 3 May 2016, \n \nReaffirming the principles, rules and relevant provisions of international law, \nincluding international humanitarian law and human rights law, as well as all relevant \ntreaties,1 and the need to further promote and ensure respect thereof,  \n__________________ \n \n1  These include, notably, the Convention on the Privileges and Immunities of the United Nations of \n13 February 1946, the Convention on the Privileges and Immunities of the Specialized Agencies of \n21 November 1947, the Convention on the Safety of United Nations and Associated Personnel of \n9 December 1994, the Optional Protocol to the Convention on the Safety of United Nations and \nAssociated Personnel of 8 December 2005, the Geneva Convention relative to the Protection of \nCivilian Persons in Time of War of 12 August 1949 and the Additional Protocols to the Geneva \nConventions of 8 June 1977, and Amended Protocol II of 3 May 1996 to the Convention on \nProhibitions or Restrictions on the Use of Certain Conventional Weapons Which May Be Deemed \nto Be Excessively Injurious or to Have Indiscriminate Effects of 10 October 1980, as applicable. \n\nA/RES/78/118 \nSafety and security of humanitarian personnel and protection \nof United Nations personnel\n \n23-24985\n2/13 \n \n \nRecalling the Geneva Conventions of 12 August 19492 and the Additional Protocols \nthereto of 8 June 1977,3 and the obligation of parties to armed conflict to respect and \nensure respect for international humanitarian law in all circumstances, and urging all \nsuch parties to comply with international humanitarian law and ensure respect for and \nprotection of all humanitarian personnel and United Nations and associated personnel,  \n \nRecalling also the specific obligations, under international humanitarian law, to \nrespect and protect, in situations of armed conflict, medical personnel and \nhumanitarian personnel exclusively engaged in medical duties, their means of \ntransport and equipment, and hospitals and other medical facilities, and to ensure that \nthe wounded and sick receive, to the fullest extent practicable and with the least \npossible delay, the medical care and attention required,  \n \nDeeply concerned by the continuous disregard, in many cases, for the principles \nand rules of international law, in particular international humanitarian law,  \n \nReaffirming the principles of humanity, neutrality, impartiality and independence \nfor the provision of humanitarian assistance,  \n \nRecalling that primary responsibility under international law for the security and \nprotection of humanitarian personnel and United Nations and associated personnel \nlies with the Government hosting a United Nations operation conducted under the \nCharter of the United Nations or its agreements with relevant organizations,  \n \nExpressing its appreciation to those Governments which respect the \ninternationally agreed principles on the protection of humanitarian personnel and \nUnited Nations and associated personnel, while expressing concern over the lack of \nrespect for these principles in some areas,  \n \nNoting the fact that the number of States parties to the Convention on the Safety \nof United Nations and Associated Personnel,4 which entered into force on 15 January \n1999, has reached 95, mindful of the need to promote the universality of the \nConvention, and welcoming the entry into force on 19 August 2010 of the Optional \nProtocol to the Convention on the Safety of United Nations and Associated \nPersonnel,5 which expands the scope of legal protection under the Convention,  \n \nExpressing deep concern at the complex and dynamic security environment, \nmarked by the diverse and multifaceted threats and significant security risks faced by \nhumanitarian personnel and United Nations and associated personnel as they operate \nin increasingly high-risk environments, and the number of attacks directed against \nsuch personnel, including when they are on the roads, in public spaces, on United \nNations premises and providing humanitarian assistance, including through United \nNations Humanitarian Air Service,  \n \nDeeply concerned about the particular vulnerability of national and locally \nrecruited  humanitarian personnel, who accounted for once again  the majority of \nsafety and security incidents of all humanitarian personnel in 2022, including road \ntraffic crashes and other safety-related incidents, fatalities and injuries from acts of \nviolence, abduction, robbery, residence break-ins and burglaries, aggravated assault, \nsexual assaults, intimidation and harassment, and arrest and detention, and concerned \nthat 7 out of 11 United Nations personnel killed as a result of violent acts in 2022 \nwere locally recruited,6  \n__________________ \n \n2  United Nations, Treaty Series, vol. 75, Nos. 970\u2013973. \n \n3  Ibid., vol. 1125, Nos. 17512 and 17513. \n \n4  Ibid., vol. 2051, No. 35457. \n \n5  Ibid., vol. 2689, No. 35457. \n \n6 A/78/369, para. 42. \n\nSafety and security of humanitarian personnel and protection  \nof United Nations personnel \nA/RES/78/118\n \n3/13\n23-24985 \n \n \nReaffirming its commitment to the zero-tolerance policy on sexual exploitation \nand abuse throughout the United Nations system, including the agencies, funds and \nprogrammes, and further emphasizing that the United Nations and humanitarian \norganizations should maintain internal systems to prevent, mitigate and address \nsexual exploitation and abuse and sexual harassment against their own staff,  \n \nExpressing deep concern at the exposure of humanitarian personnel and United \nNations and associated personnel to certain forms of crime and acts of intimidation \nand harassment, including sexual violence and other forms of violence against \nwomen, and equally concerned at the significant number of reported sexual assaults \nagainst both male and female United Nations personnel,  \n \nExpressing deep concern also at the increasing trend of safety and security \nincidents, including while carrying out duties, which affect humanitarian personnel \nand United Nations and associated personnel, as well as locally recruited personnel,   \n \nNoting with concern the increasing threat of disinformation campaigns and \nmisinformation that undermine trust in United Nations and humanitarian organizations \nand put humanitarian personnel and United Nations and associated personnel at risk,  \n \nExpressing deep concern that the occurrence of attacks and threats against \nhumanitarian personnel and United Nations and associated personnel is a factor that \nseverely restricts the provision of assistance and protection to populations in need, \nand commending the commitment of United Nations and other humanitarian \npersonnel to stay and deliver effectively the most critical programmes even in \ndangerous environments,  \n \nStressing the need to uphold the respect and protection which the flag of the \nUnited Nations, and the nature of humanitarian work, should command and ensure, \nand stressing the importance of fully respecting the obligations relating to the use of \nvehicles and premises of humanitarian personnel and United Nations and associated \npersonnel as defined by relevant international instruments, as well as the obligations \nrelating to distinctive emblems recognized in the Geneva Conventions,  \n \nNoting that medical personnel, and humanitarian personnel exclusively engaged \nin medical duties, in an armed conflict situation continue to be under a duty to provide \ncompetent medical service in full professional and moral independence, with \ncompassion and respect for human dignity, and always to bear in mind human life and \nto act in the patient\u2019s best interest, stressing the need to uphold their respective \nprofessional codes of ethics, and further noting the applicable rules of international \nhumanitarian law relating to the non-punishment of any person for carrying out \nmedical activities compatible with medical ethics,  \n \nCommending the courage and commitment of those who take part in \nhumanitarian operations, especially national and locally recruited personnel, and \nincluding those serving with national and international non-governmental \norganizations in the field, often at great personal risk and a negative impact on their \nhealth, including their mental health and psychosocial well-being, especially when \nworking in situations of armed conflict and exposed to direct violence, injury and risk \nof illness with limited access to medical and emergency facilities,  \n \nCommending also the courage and commitment of those who take part in peace \noperations, including peacekeeping operations,7 often at great personal risk, especially \nnational and locally recruited personnel,  \n__________________ \n \n7  The safety and security of United Nations peacekeepers is specifically addressed in the annual \nreport of the Special Committee on Peacekeeping Operations (Official Records of the General \nAssembly, Seventy-seventh Session, Supplement No. 19 (A/77/19)). Except where otherwise \nspecified, the present resolution focuses only on the safety and security of civilian United \nNations and associated personnel falling under the United Nations security management system \nunder the responsibility of the Department of Safety and Security of the Secretariat. \n\nA/RES/78/118 \nSafety and security of humanitarian personnel and protection \nof United Nations personnel\n \n23-24985\n4/13 \n \n \nExpressing deep appreciation for the efforts of the United Nations system and \nfor the essential work of medical and humanitarian personnel working on the front \nline of the humanitarian response in the face of the coronavirus disease (COVID-19) \npandemic, and strongly condemning the high number of attacks, including against \nnational and locally recruited medical and humanitarian personnel, as well as their \nmeans of transport and equipment, medical facilities and medical and relief supplies,  \n \nNoting with concern the evolving threats that United Nations personnel face \nwhen deployed and that, in 2022, 1,614 persons were affected by safety and security \nincidents, with 26 fatalities, of which 11 resulted from acts of violence, namely, crime, \nterrorism and armed conflict, 289 injuries, of which 124 resulted from acts of \nviolence, 24 abductions, 16 sexual assaults, 107 arrests and detentions and 351 \nreported cases of intimidation and harassment,8 and noting that these figures do not \ninclude United Nations personnel who are not part of the United Nations security \nmanagement system, such as locally recruited area staff of UNRWA, of whom 29 \nwere injured, 36 were arrested and detained and 96 reported cases of intimidation and \nharassment in 2022, 9 who have suffered unprecedented fatalities in 2023, which \nrepresents the highest number of United Nations fatalities ever recorded in a single \nconflict,10 \n \nStrongly condemning all acts of violence, attacks and threats against \nhumanitarian personnel, expressing profound regret at the deaths, injuries, including \nthose resulting in disabilities, and abductions resulting from these attacks, noting with \nconcern that there were 444 recorded attacks against humanitarian personnel in 2022, \nresulting in at least 116 personnel killed, 143 wounded and 185 kidnapped, 11 and \nnoting with concern that casualties continue to take a heavier toll on personnel of \nnon-governmental organizations than on United Nations personnel, 12  \n \nStrongly condemning also all acts of violence, attacks and threats against \nmedical personnel and humanitarian personnel exclusively engaged in medical duties, \ntheir means of transport and equipment, as well as hospitals and other medical \nfacilities, and the prevailing impunity for violations and abuses committed against \nsuch personnel, which in turn may contribute to the recurrence of those acts, and \ndeploring the long-term consequences of such acts, which undermine relevant efforts \nto build up and strengthen health systems for the population and the health-care \nsystems of the countries concerned, and in this regard welcoming efforts by States, \ninternational and non-governmental organizations and other relevant stakeholders to \nstrengthen compliance with international humanitarian law by raising awareness of \nand promoting preparedness to address the grave and serious humanitarian \nconsequences arising from such violence,  \n \nNoting with appreciation all the measures taken to enhance the performance of \nthe United Nations security management system,  \n \nExpressing profound regret at the deaths, illnesses and other adverse \nconsequences affecting humanitarian personnel and health-care personnel as a result \nof public health hazards, and stressing the need for a conducive environment, \nappropriate equipment and resilient public health systems, and the urgency of \npreparedness,  \n__________________ \n \n8  See A/78/369, annexes I and III. \n \n9  Ibid., annex V. \n \n10  See Statement by Principals of the Inter-Agency Standing Committee on the situation in Israel \nand the Occupied Palestinian Territory, 5 November 2023. \n \n11  See Aid Worker Security Report, August 2023. \n \n12  These data are based entirely on voluntary reporting to the Department of Safety and Security of \nthe Secretariat (see A/78/369, para.44). The personnel of non-governmental organizations are not \ncovered by the United Nations security management system. \n\nSafety and security of humanitarian personnel and protection  \nof United Nations personnel \nA/RES/78/118\n \n5/13\n23-24985 \n \n \nExpressing deep concern at the deep and long-lasting impacts of acts of \nviolence, attacks and threats against humanitarian personnel and United Nations and \nassociated personnel,  \n \nStrongly condemning acts of murder and other forms of violence, rape and sexual \nassault and all forms of violence committed in particular against women and children, \nand intimidation, armed robbery, abduction, hostage-taking, kidnapping, harassment \nand illegal arrest and detention, to which those participating in humanitarian \noperations are exposed, as well as attacks on humanitarian convoys and acts of \ndestruction and looting of property of humanitarian and United Nations and associated \npersonnel,  \n \nAffirming the need for States to ensure that perpetrators of attacks committed on \ntheir territory against humanitarian personnel and United Nations and associated \npersonnel and against their premises or assets do not operate with impunity, that such \nattacks are investigated promptly and effectively and that the perpetrators of such acts \nare brought to justice, as provided for by national laws and in accordance with \nobligations under international law,  \n \nRecognizing the critical importance of continuing to strengthen existing \nmonitoring systems for the safety and security of humanitarian and medical  personnel \nin light of the challenging security environment in which such personnel operate, and \nemphasizing that United Nations and humanitarian organizations, including local \nhumanitarian actors, should have timely access to available and relevant information \nthat can be used effectively and to adequate and predictable resources for emergency \nresponse, including for the deployment of Emergency Response Teams, to strengthen \nrisk assessment and effective security risk management, including through \nmainstreaming a gender and disaster risk-informed perspective, and recognizing the \nimportance of collaboration with States in this regard,  \n \nRecognizing also the role of investigations in the prevention of incidents and \nthe promotion of respect for international humanitarian law,  \n \nRecalling the inclusion of attacks intentionally directed against personnel \ninvolved in a humanitarian assistance or peacekeeping mission in accordance with \nthe Charter, as long as they are entitled to the protection given to civilians or civilian \nobjects under the international law of armed conflict, as a war crime in the Rome \nStatute of the International Criminal Court,13 and noting the role that the Court can \nplay in appropriate cases in bringing to justice those responsible for serious violations \nof international humanitarian law,  \n \nReaffirming the need to ensure adequate levels of safety and security for United \nNations and associated personnel, including locally recruited personnel, which \nconstitutes an underlying duty of the Organization, and mindful of the need to \npromote and enhance security consciousness within the organizational culture of the \nUnited Nations and a culture of accountability at all levels, as well as to continue to \npromote awareness of and sensitivity to national and local cultures and laws,  \n \nGravely concerned at the number of accidents and resulting casualties among \nUnited Nations and associated personnel, and conscious of the importance of road \nand aviation safety in ensuring the continuity of United Nations operations and \npreventing casualties among civilians and United Nations and associated personnel, \nand in this regard regretting the loss of civilian life as a result of such incidents,  \n \nStressing that acceptance of humanitarian personnel and United Nations and \nassociated personnel by the host Governments, local authorities, local communities, \n__________________ \n \n13  United Nations, Treaty Series, vol. 2187, No. 38544. \n\nA/RES/78/118 \nSafety and security of humanitarian personnel and protection \nof United Nations personnel\n \n23-24985\n6/13 \n \npopulations and other parties as appropriate crucially contributes to their safety and \nsecurity,  \n \nNoting the importance of reinforcing close collaboration between the United \nNations and the host country on contingency planning, information exchange and risk \nassessment in the context of good mutual cooperation on issues relating to the security \nof United Nations and associated personnel, as well as the importance of coordinating \nprevention and mitigation measures and managing security in crisis situations, \n \nNoting also the importance of safe evacuation planning and the strengthening \nof capacity of the United Nations in order to enhance the safety and security of \nhumanitarian personnel and United Nations and associated personnel,   \n \nNoting further the importance of further collaboration between the United \nNations, its humanitarian agencies and other humanitarian organizations working in \naccordance with the principles of humanity, neutrality, impartiality and independence \non information-sharing and risk assessment with regard to the safety and security of \nhumanitarian personnel, including, when feasible, national and locally recruited \npersonnel,  \n \nNoting that, in order to remain fit for purpose and to support the effective and \nprincipled delivery of humanitarian assistance, the United Nations security \nmanagement system needs to evolve in response to the challenging global security \nenvironment, requiring, inter alia, an effective management structure, adequate and \npredictable resources and the timely deployment of security personnel with \nappropriate skills and field experience and of the equipment necessary for the \nperformance of their duties, including vehicles and telecommunications equipment, \nwhich have an essential role in facilitating the safety of humanitarian personnel and \nUnited Nations and associated personnel,  \n \n1. \nTakes note with appreciation of the report of the Secretary-General;14  \n \n2. \nUrges all States to make every effort to ensure the full and effective \nimplementation of the relevant principles and rules of international law, including \ninternational humanitarian law and human rights law, and refugee law as applicable, \nrelated to the safety and security of humanitarian personnel and United Nations \npersonnel;  \n \n3. \nCondemns in the strongest possible terms the continued threats to and \ndeliberate targeting of humanitarian personnel and United Nations and associated \npersonnel, acts of terrorism and attacks on humanitarian convoys, and the continued \nincrease in the scale and the increasingly complex nature of threats faced by such \npersonnel, such as the disturbing trend of politically and criminally motivated attacks, \nincluding extremist attacks, against them; \n \n4. \nStrongly urges all States to take the measures necessary to ensure the \nsafety and security of national and international humanitarian personnel and United \nNations and associated personnel and to respect and ensure respect for the \ninviolability of United Nations premises, which are essential to the continuation and \nsuccessful implementation of United Nations operations;  \n \n5. \nCalls upon all Governments and parties in complex humanitarian \nemergencies, in particular in armed conflicts and in post-conflict situations, in \ncountries in which humanitarian personnel are operating, in conformity with the \nrelevant provisions of international law and national laws, to cooperate fully with the \nUnited Nations and other humanitarian agencies and organizations and to ensure the \nsafe and unhindered access of humanitarian personnel and the delivery of supplies and \n__________________ \n \n14  A/78/369. \n\nSafety and security of humanitarian personnel and protection  \nof United Nations personnel \nA/RES/78/118\n \n7/13\n23-24985 \n \nequipment, in order to allow those personnel to perform efficiently their task of \nassisting the affected civilian population, including refugees and internally displaced \npersons;  \n \n6. \nCalls upon all States and parties in complex humanitarian emergencies, in \nparticular in armed conflict and in post-conflict situations, to ensure the safe and \nunhindered access of humanitarian and medical personnel, including those \nresponding to the COVID-19 pandemic and other health emergencies, as well as their \nmeans of transport, supplies and equipment, and to support, facilitate and enable \ntransportation and logistical supply lines, in order to allow such personnel to \nefficiently and safely perform their task of assisting affected populations, and in this \nregard also reaffirms the need to take the measures necessary to respect and protect \nsuch personnel, hospitals and other medical facilities, as well as their means of \ntransport, supplies and equipment, and urges all parties to armed conflicts, consistent \nwith international humanitarian law, to protect civilian infrastructure which is critical \nto the delivery of humanitarian assistance for the provision of essential service;  \n \n7. \nCalls upon all States to consider becoming parties to and to respect fully \ntheir obligations under the relevant international instruments;  \n \n8. \nAlso calls upon all States to consider becoming parties to the Rome Statute \nof the International Criminal Court;  \n \n9. \nFurther calls upon all States to consider becoming parties to the Optional \nProtocol to the Convention on the Safety of United Nations and Associated Personnel, \nand urges States parties to put in place appropriate national legislation, as necessary, \nto enable its effective implementation;  \n \n10. Calls upon all States, all parties involved in armed conflict and all \nhumanitarian actors to respect the principles of humanity, neutrality, impartiality and \nindependence for the provision of humanitarian assistance;  \n \n11. \nWelcomes the contribution of female humanitarian personnel and United \nNations and associated personnel in humanitarian and United Nations operations, \nexpresses concern that these personnel may be more exposed to certain forms of \nviolence, including sexual violence; sexual exploitation and abuse; crime; and acts of \nintimidation and harassment, strongly urges the United Nations system and Member \nStates to analyse the different forms of violence, including sexual violence; sexual \nexploitation and abuse; crime; acts of intimidation and harassment to which women \nand men are differently exposed, and also strongly urges the United Nations system \nand Member States to choose appropriate and gender-sensitive approaches for their \nsafety and security while allowing them to fulfil their duties, and to ensure that female \nhumanitarian personnel and United Nations and associated personnel are \nmeaningfully included in decisions related to their safety and security, and that all \nreports of sexual violence against humanitarian workers are thoroughly investigated, \nand the alleged perpetrators brought to justice, in accordance with applicable laws;  \n \n12. Strongly condemns all acts of violence, attacks and threats against \nhumanitarian personnel and United Nations and associated personnel, also condemns \nattacks intentionally directed against personnel involved in a peacekeeping mission \nin accordance with the Charter of the United Nations as long as they are entitled to \nprotection from attack under international humanitarian law, and reaffirms the need \nto prosecute, penalize and punish those responsible for such acts;  \n \n13. Encourages Member States and the United Nations system to take \nappropriate action to address the increasing threat of disinformation campaigns and \nmisinformation that undermine trust in United Nations and humanitarian \norganizations and put humanitarian personnel and United Nations and associated \npersonnel at risk; \n\nA/RES/78/118 \nSafety and security of humanitarian personnel and protection \nof United Nations personnel\n \n23-24985\n8/13 \n \n \n14. Underscores the critical importance of protecting all persons affected by \nhumanitarian crises, in particular women and children, from any form of sexual \nexploitation and abuse and sexual harassment, including those perpetrated by United \nNations and humanitarian personnel, welcomes the determination of the Secretary-\nGeneral to fully implement the United Nations policy of zero tolerance for sexual \nexploitation and abuse and stresses that victims and survivors should be at the core \nof such efforts, and in this regard requests the Secretary-General to continue to work \nin close consultation with Member States for the effective implementation of the \npolicy, including prevention, reporting, enforcement and remedial actions;  \n \n15. Stresses the importance of continued close coordination and consultation \nwith host Governments on the functioning of the security risk management process \nand related tools, and in this regard encourages the Secretary-General to continue to \nconsult with the host Governments;  \n \n16. Also stresses the importance of ensuring that the security and safety of \nhumanitarian and United Nations personnel, including national and locally recruited \npersonnel, is consistently and integrally considered in the planning for humanitarian \naction;  \n \n17. Calls upon all States to comply fully with their obligations under \ninternational humanitarian law, including as provided for under the Geneva \nConvention relative to the Protection of Civilian Persons in Time of War of 12 August \n1949,15 in order to respect and protect civilians, including humanitarian personnel;  \n \n18. Stresses the obligation, in accordance with international humanitarian law \nand national laws and regulations, as applicable, to respect and protect medical \npersonnel, as well as humanitarian personnel exclusively engaged in medical duties, \ntheir means of transport and equipment, as well as hospitals and other medical \nfacilities, in all circumstances, in this regard notes the role of domestic legal \nframeworks and other appropriate measures in promoting the safety and protection of \nsuch personnel, urges States and all parties to armed conflict to develop and integrate \neffective measures to prevent and address violence against such personnel, their \nmeans of transport and equipment, as well as hospitals and other medical facilities, \nand strongly urges States to conduct full, prompt, impartial and effective \ninvestigations within their jurisdiction of violations of international humanitarian law \nrelated to the protection of the wounded and sick, medical personnel and humanitarian \npersonnel exclusively engaged in medical duties, their means of transport and \nequipment, as well as hospitals and other medical facilities in armed conflict, and, \nwhere appropriate, to take action against those responsible in accordance with \ndomestic and international law, with a view to reinforcing preventive measures, \nensuring accountability and addressing the grievances of victims;  \n \n19. Urges States, while undertaking counter-terrorism activities, to respect \ntheir international obligations, including whenever international humanitarian law is \napplicable, in particular regarding the provision of humanitarian assistance to civilian \npopulations, as well as recognizes the key role humanitarian organizations play in the \nprovision of principled humanitarian assistance, while also recognizing the \nimportance of preventing and suppressing the financing of and other forms of support \nto terrorism;  \n \n20. Strongly urges all States to take stronger action to ensure that crimes \nagainst humanitarian personnel and United Nations and associated personnel, and \npersonnel involved in a peacekeeping mission in accordance with the Charter as long \nas they are entitled to protection from attack under international humanitarian law, do \nnot remain unpunished and are investigated fully and effectively, and affirms the need \n__________________ \n \n15  United Nations, Treaty Series, vol. 75, No. 973. \n\nSafety and security of humanitarian personnel and protection  \nof United Nations personnel \nA/RES/78/118\n \n9/13\n23-24985 \n \nfor States to ensure that perpetrators of any such acts committed on their territory do \nnot operate with impunity, as provided for by national laws and obligations under \ninternational law;  \n \n21. Calls upon all States to provide adequate and prompt information in the \nevent of the arrest or detention of humanitarian personnel or United Nations and \nassociated personnel so as to afford them the necessary medical assistance and to \nallow independent medical teams to visit and examine the health of those detained \nand to ensure their right to legal counsel, and urges States to take the measures \nnecessary to ensure the speedy release of those who have been arrested or detained in \nviolation of the relevant conventions referred to in the present resolution and \napplicable international humanitarian law;  \n \n22. Calls upon all parties involved in armed conflict not to abduct, take \nhostage or kidnap humanitarian personnel or United Nations and associated personnel \nor to detain them in violation of the relevant conventions referred to in the present \nresolution and applicable international humanitarian law, and speedily to release, \nwithout harm or requirement of concession, any abductee or detainee;  \n \n23. Requests the Secretary-General to take the measures necessary to promote \nfull respect for the human rights, privileges and immunities of United Nations and \nassociated personnel, and also requests the Secretary-General to seek the inclusion, \nin negotiations of headquarters and other mission agreements concerning United \nNations and associated personnel, of the applicable conditions contained in the \nConvention on the Privileges and Immunities of the United Nations, 16 the Convention \non the Privileges and Immunities of the Specialized Agencies 17 and the Convention \non the Safety of United Nations and Associated Personnel;  \n \n24. Recommends that the Secretary-General continue to seek the inclusion of, \nand that host countries include, key provisions of the Convention on the Safety of \nUnited Nations and Associated Personnel, among others, those regarding the \nprevention of attacks against members of the operation, the establishment of such \nattacks as crimes punishable by law and the prosecution or extradition of offenders, \nin future as well as, if necessary, in existing status-of-forces, status-of-mission, host \ncountry and other related agreements negotiated between the United Nations and \nthose countries, mindful of the importance of the timely conclusion of such \nagreements, and encourages further efforts in this regard;  \n \n25. Encourages the Secretary-General to strengthen the ongoing efforts of the \nUnited Nations to develop a more systematic follow-up process with relevant host \nGovernments on cases of serious crimes and acts of violence resulting in the death or \nserious injury of United Nations system personnel, in order to bring perpetrators to \njustice; \n \n26. Calls upon States to explore and scale up measures for more systematic \nmonitoring, reporting and investigation of attacks against humanitarian and medical \npersonnel;  \n \n27. Notes with appreciation the adoption by the Department of Safety and \nSecurity, in collaboration with other departments and offices of the Secretariat, of \nstandard operating procedures on the victims of violence registry for fatalities in \nservice, designed to provide follow-up with relevant host Governments on cases of \nserious crimes and acts of violence resulting in the death or serious injury of United \nNations personnel; \n__________________ \n \n16  Resolution 22 A (I). \n \n17  Resolution 179 (II). \n\nA/RES/78/118 \nSafety and security of humanitarian personnel and protection \nof United Nations personnel\n \n23-24985\n10/13 \n \n \n28. Calls attention to and reaffirms the obligation of all humanitarian \npersonnel and United Nations and associated personnel to respect and, where \nrequired, observe the national laws of the country in which they are operating, in \naccordance with international law and the Charter;  \n \n29. Stresses the importance of ensuring that humanitarian personnel and \nUnited Nations and associated personnel are aware and respectful of national and \nlocal customs and traditions in their countries of assignment and communicate clearly \ntheir purpose and objectives to local populations in order to enhance their acceptance, \nthereby contributing to their safety and security, and in this regard ensure that \nhumanitarian action is guided by humanitarian principles; \n \n30. Urges the United Nations and other relevant humanitarian actors to include \nas part of their risk management strategy and training the building of good relations \nand trust with national and local governments and the promotion of acceptance by \nlocal communities and all relevant actors, with a view to enhancing safety and \nsecurity and ensuring access to the affected populations, and encourages Member \nStates to support efforts by the United Nations and other relevant humanitarian actors \nto provide training to humanitarian personnel in this regard;  \n \n31. Requests the Secretary-General to continue to take the measures necessary \nto ensure that United Nations and other personnel carrying out activities in fulfilment \nof the mandate of a United Nations operation are properly informed about and operate \nin conformity with mandatory security risk management measures and relevant codes \nof conduct and are properly informed about the conditions under which they are called \nupon to operate and the standards that they are required to meet, including those \ncontained in relevant national laws and international law, and that adequate training \nin security, human rights law and international humanitarian law is provided so as to \nenhance their security and effectiveness in accomplishing their functions, and \nreaffirms the necessity for all other humanitarian organizations to provide their \npersonnel with similar support;  \n \n32. Also requests the Secretary-General to continue, in coordination with \nMember States, to take the measures necessary to ensure that all United Nations \npremises and assets, including staff residences, are compliant with the United Nations \nmandatory security risk management measures and other relevant United Nations \nsecurity standards, and to continue the ongoing assessment of United Nations \npremises and physical security worldwide;  \n \n33. Welcomes the ongoing efforts of the Secretary-General to ensure that all \nUnited Nations personnel receive adequate safety and security training, stresses the \nneed to continue to improve training so as to enhance cultural awareness and \nknowledge of relevant law, including international humanitarian law, prior to their \ndeployment to the field, and reaffirms the necessity for all other humanitarian \norganizations to provide their personnel with similar support;  \n \n34. Also welcomes the efforts of the Secretary-General to provide counselling \nand support services to United Nations personnel affected by safety and security \nincidents, and emphasizes the importance of making available stress management, \nmental health and related services for United Nations personnel throughout the \nsystem, and encourages all humanitarian organizations to provide their personnel with \nsimilar support;  \n \n35. Further welcomes the ongoing measures taken by the Secretary-General \nand the United Nations system to enhance road safety, including through the United \nNations system road safety strategy, so as to reduce incidents caused by road hazards \nand, in particular, to reduce casualties or injuries resulting from such incidents among \nUnited Nations and associated personnel and among the civilian population in the \n\nSafety and security of humanitarian personnel and protection  \nof United Nations personnel \nA/RES/78/118\n \n11/13\n23-24985 \n \nhost country, encourages humanitarian organizations to promote similar approaches \namong their personnel, and requests the Secretary-General to continue the collection \nand analysis of data to report on road incidents, including civilian casualties resulting \nfrom road accidents, and to encourage road safety preventive measures such as \nspecialized trainings;  \n \n36. Welcomes the progress made towards further enhancing the security \nmanagement system of the United Nations, including the major progress in the \ncompletion of the integration of all security personnel of the Secretariat under the \nleadership of the Under-Secretary-General for Safety and Security, and supports the \ncontinued implementation of the stay-and-deliver strategy while focusing on \neffectively managing the risks to which personnel are exposed in order to enable the \nUnited Nations system to deliver the most critical programmes, even in high-risk \nenvironments; \n \n37. Encourages the Secretary-General to continue consistent implementation \nof the programme criticality framework as an operational tool allowing informed \ndecisions on acceptable risk to United Nations personnel, and welcomes the revised \nprogramme criticality framework;  \n \n38. Also encourages the Secretary-General to continue to develop enabling \nprocedures that facilitate the deployment of suitably qualified United Nations security \npersonnel with the appropriate knowledge, skills and experience, with the aim of \nimproving the safety and security measures of the United Nations, in order to \nstrengthen the ability of the United Nations to deliver on its programmes, mandates \nand activities, including humanitarian programmes;  \n \n39. Requests the Secretary-General, inter alia, through the Inter-Agency \nSecurity Management Network, to continue the increased cooperation and collaboration \namong United Nations departments, organizations, funds and programmes and \naffiliated international organizations, including between their headquarters and field \noffices, in the planning and implementation of measures aimed at improving staff \nsecurity, training and awareness, including field crisis management and gender \ninclusion in security management, calls upon all relevant United Nations departments, \norganizations, funds and programmes and affiliated international organizations to \nsupport those efforts, and notes the approval by the Inter-Agency Security \nManagement Network of a system-wide policy on the security of locally recruited \npersonnel;  \n \n40. Calls upon all relevant actors to make every effort to support in their public \nstatements and other forms of advocacy a favourable environment for the safety and \nsecurity of humanitarian personnel and United Nations and associated personnel, \nincluding locally recruited personnel;  \n \n41. Emphasizes the need to pay particular attention to the safety and security \nof locally recruited humanitarian personnel and United Nations and associated \npersonnel, who play an important role, are often at great personal risk, account for \nthe large majority of casualties and are particularly vulnerable to attacks, including \nin cases of kidnapping, harassment, banditry and intimidation, requests the Secretary-\nGeneral to keep under review the relevant United Nations safety and security policy \nand to enhance the safety and security of locally recruited personnel, while \nmaintaining operational effectiveness, and calls upon the United Nations and \nhumanitarian organizations to ensure that their personnel are adequately consulted \non, informed about and trained in the relevant security measures, plans and initiatives \nof their respective organizations, which should be in line with applicable national \nlaws and international law;  \n\nA/RES/78/118 \nSafety and security of humanitarian personnel and protection \nof United Nations personnel\n \n23-24985\n12/13 \n \n \n42. Requests the Department of Safety and Security of the Secretariat to \nfurther strengthen the security management of the United Nations, focusing on \nstrengthening security risk management policy and tools and their application, \nincreasing situational awareness, analysis and emergency response capacity, taking \ninto account a disaster risk-informed perspective, including by enhancing strategic \nforesight and planning, strengthening policy development and promoting best \npractices, increasing compliance with risk management measures and improving \nmonitoring and evaluation, enhancing surge capacity for emergency response, \ndevising effective physical security measures, developing the expertise of security \nprofessionals and strengthening support to the designated officials and the security \nmanagement teams in the field, increasing lessons learned, extending common \nsecurity training capacities, and continuing to review safety and security policies, \ntraining and risk management processes, and promoting an effective and preventive \nsecurity management approach that is multidimensional;  \n \n43. Encourages the Secretary-General, together with the United Nations \nsecurity management system organizations, to continue to improve and effectively \nutilize the existing incident data system, including digital tools, strengthen \nmonitoring and management of security risks, including through a gender perspective, \nand timely data-sharing;  \n \n44. Calls upon Member States and relevant actors to enhance existing data-\nsharing mechanisms as appropriate, and to facilitate field-driven support services to \nhumanitarian actors, including training and orientation sessions and sharing \ncomparative, predictive and thematic analyses that take into account disaggregated \ndata;  \n \n45. Welcomes the work of the Secretary-General in enhancing security \ncollaboration with host Governments, including efforts to support United Nations \ndesignated officials with regard to collaboration with host government authorities on \nthe safety and security of personnel; \n \n46. Stresses that the effective functioning at the country level of security \noperations requires a unified and robust capacity for policy, standards, coordination, \ncommunication, compliance and threat and risk assessment and operational and \ndeployment flexibility to ensure that the security workforce reflects the changing \ndynamics of the security environment, and notes the benefits thereof to United \nNations and associated personnel, including those achieved by the Department of \nSafety and Security since its establishment;  \n \n47. Welcomes the steps taken by the Secretary-General thus far to strengthen \npartnerships, and encourages further efforts to enhance coordination, cooperation and \ninformation-sharing, at both the headquarters and field levels, between the United \nNations, regional organizations and other humanitarian and non-governmental \norganizations on matters relating to the safety and security of humanitarian personnel \nand United Nations and associated personnel, with a view to addressing mutual \nsecurity concerns in the field, based on the Saving Lives Together framework as well \nas other relevant national and local initiatives in this regard, and requests the \nSecretary-General in this respect to enhance further collaborative initiatives to address \nthe security needs of implementing partners, including through enhanced information-\nsharing, assistance in emergency situations, when feasible, and, where appropriate, \nsecurity training, invites Member States to consider increasing support to those \ninitiatives, and requests the Secretary-General to report on steps taken in this regard;  \n \n48. Underlines the urgent need to allocate adequate and predictable resources \nto the safety and security of United Nations and associated personnel, through regular \nand extrabudgetary resources, including through the consolidated appeals process, \nand encourages all States to contribute to the trust fund for security of staff members \n\nSafety and security of humanitarian personnel and protection  \nof United Nations personnel \nA/RES/78/118\n \n13/13\n23-24985 \n \nof the United Nations system, inter alia, with a view to reinforcing the efforts of the \nDepartment of Safety and Security to meet its mandate and responsibilities to enable \nthe safe delivery of programmes;  \n \n49. Also underlines the need for better coordination between the United \nNations and host Governments, in accordance with the relevant provisions of \ninternational law and national laws, on the use and deployment of essential equipment \nrequired to provide for the safety and security of United Nations personnel and \nassociated personnel working in the delivery of humanitarian assistance by United \nNations organizations;  \n \n50. Calls upon States to consider acceding to or ratifying the Tampere \nConvention on the Provision of Telecommunication Resources for Disaster Mitigation \nand Relief Operations of 18 June 1998,18 which entered into force on 8 January 2005, \nand urges them to facilitate and expedite, consistent with their national laws and \ninternational obligations applicable to them, the use of communications equipment in \nthose and other relief operations, inter alia, by limiting and, whenever possible, \nexpeditiously lifting the restrictions placed on the use of communications equipment \nby United Nations and associated personnel;  \n \n51. Requests the Secretary-General to submit to the General Assembly at its \nseventy-ninth session a comprehensive and updated report on the safety and security \nof humanitarian personnel and protection of United Nations personnel and on the \nimplementation of the present resolution, including an assessment of the impact of \nsafety and security risks on such personnel, and the development, implementation and \noutcomes of policies, strategies and initiatives of the United Nations system in the \nfield of safety and security. \n \n47th plenary meeting \n8 December 2023 \n \n__________________ \n \n18  United Nations, Treaty Series, vol. 2296, No. 40906. \n",
  "paragraphs": {
    "1": "Takes note with appreciation of the report of the Secretary-General;14",
    "2": "Urges all States to make every effort to ensure the full and effective implementation of the relevant principles and rules of international law, including international humanitarian law and human rights law, and refugee law as applicable, related to the safety and security of humanitarian personnel and United Nations personnel;",
    "3": "Condemns in the strongest possible terms the continued threats to and deliberate targeting of humanitarian personnel and United Nations and associated personnel, acts of terrorism and attacks on humanitarian convoys, and the continued increase in the scale and the increasingly complex nature of threats faced by such personnel, such as the disturbing trend of politically and criminally motivated attacks, including extremist attacks, against them;",
    "4": "Strongly urges all States to take the measures necessary to ensure the safety and security of national and international humanitarian personnel and United Nations and associated personnel and to respect and ensure respect for the inviolability of United Nations premises, which are essential to the continuation and successful implementation of United Nations operations;",
    "5": "Calls upon all Governments and parties in complex humanitarian emergencies, in particular in armed conflicts and in post-conflict situations, in countries in which humanitarian personnel are operating, in conformity with the relevant provisions of international law and national laws, to cooperate fully with the United Nations and other humanitarian agencies and organizations and to ensure the safe and unhindered access of humanitarian personnel and the delivery of supplies and equipment, in order to allow those personnel to perform efficiently their task of assisting the affected civilian population, including refugees and internally displaced persons;",
    "6": "Calls upon all States and parties in complex humanitarian emergencies, in particular in armed conflict and in post-conflict situations, to ensure the safe and unhindered access of humanitarian and medical personnel, including those responding to the COVID-19 pandemic and other health emergencies, as well as their means of transport, supplies and equipment, and to support, facilitate and enable transportation and logistical supply lines, in order to allow such personnel to efficiently and safely perform their task of assisting affected populations, and in this regard also reaffirms the need to take the measures necessary to respect and protect such personnel, hospitals and other medical facilities, as well as their means of transport, supplies and equipment, and urges all parties to armed conflicts, consistent with international humanitarian law, to protect civilian infrastructure which is critical to the delivery of humanitarian assistance for the provision of essential service;",
    "7": "Calls upon all States to consider becoming parties to and to respect fully their obligations under the relevant international instruments;",
    "8": "Also calls upon all States to consider becoming parties to the Rome Statute of the International Criminal Court;",
    "9": "Further calls upon all States to consider becoming parties to the Optional Protocol to the Convention on the Safety of United Nations and Associated Personnel, and urges States parties to put in place appropriate national legislation, as necessary, to enable its effective implementation;",
    "10": "Calls upon all States, all parties involved in armed conflict and all humanitarian actors to respect the principles of humanity, neutrality, impartiality and independence for the provision of humanitarian assistance;",
    "11": "Welcomes the contribution of female humanitarian personnel and United Nations and associated personnel in humanitarian and United Nations operations, expresses concern that these personnel may be more exposed to certain forms of violence, including sexual violence; sexual exploitation and abuse; crime; and acts of intimidation and harassment, strongly urges the United Nations system and Member States to analyse the different forms of violence, including sexual violence; sexual exploitation and abuse; crime; acts of intimidation and harassment to which women and men are differently exposed, and also strongly urges the United Nations system and Member States to choose appropriate and gender-sensitive approaches for their safety and security while allowing them to fulfil their duties, and to ensure that female humanitarian personnel and United Nations and associated personnel are meaningfully included in decisions related to their safety and security, and that all reports of sexual violence against humanitarian workers are thoroughly investigated, and the alleged perpetrators brought to justice, in accordance with applicable laws;",
    "12": "Strongly condemns all acts of violence, attacks and threats against humanitarian personnel and United Nations and associated personnel, also condemns attacks intentionally directed against personnel involved in a peacekeeping mission in accordance with the Charter of the United Nations as long as they are entitled to protection from attack under international humanitarian law, and reaffirms the need to prosecute, penalize and punish those responsible for such acts;",
    "13": "",
    "14": "Underscores the critical importance of protecting all persons affected by humanitarian crises, in particular women and children, from any form of sexual exploitation and abuse and sexual harassment, including those perpetrated by United Nations and humanitarian personnel, welcomes the determination of the Secretary- General to fully implement the United Nations policy of zero tolerance for sexual exploitation and abuse and stresses that victims and survivors should be at the core of such efforts, and in this regard requests the Secretary-General to continue to work in close consultation with Member States for the effective implementation of the policy, including prevention, reporting, enforcement and remedial actions;",
    "15": "Stresses the importance of continued close coordination and consultation with host Governments on the functioning of the security risk management process and related tools, and in this regard encourages the Secretary-General to continue to consult with the host Governments;",
    "16": "Also stresses the importance of ensuring that the security and safety of humanitarian and United Nations personnel, including national and locally recruited personnel, is consistently and integrally considered in the planning for humanitarian action;",
    "17": "Calls upon all States to comply fully with their obligations under international humanitarian law, including as provided for under the Geneva Convention relative to the Protection of Civilian Persons in Time of War of 12 August 1949,15 in order to respect and protect civilians, including humanitarian personnel;",
    "18": "Stresses the obligation, in accordance with international humanitarian law and national laws and regulations, as applicable, to respect and protect medical personnel, as well as humanitarian personnel exclusively engaged in medical duties, their means of transport and equipment, as well as hospitals and other medical facilities, in all circumstances, in this regard notes the role of domestic legal frameworks and other appropriate measures in promoting the safety and protection of such personnel, urges States and all parties to armed conflict to develop and integrate effective measures to prevent and address violence against such personnel, their means of transport and equipment, as well as hospitals and other medical facilities, and strongly urges States to conduct full, prompt, impartial and effective investigations within their jurisdiction of violations of international humanitarian law related to the protection of the wounded and sick, medical personnel and humanitarian personnel exclusively engaged in medical duties, their means of transport and equipment, as well as hospitals and other medical facilities in armed conflict, and, where appropriate, to take action against those responsible in accordance with domestic and international law, with a view to reinforcing preventive measures, ensuring accountability and addressing the grievances of victims;",
    "19": "Urges States, while undertaking counter-terrorism activities, to respect their international obligations, including whenever international humanitarian law is applicable, in particular regarding the provision of humanitarian assistance to civilian populations, as well as recognizes the key role humanitarian organizations play in the provision of principled humanitarian assistance, while also recognizing the importance of preventing and suppressing the financing of and other forms of support to terrorism;",
    "20": "Strongly urges all States to take stronger action to ensure that crimes against humanitarian personnel and United Nations and associated personnel, and personnel involved in a peacekeeping mission in accordance with the Charter as long as they are entitled to protection from attack under international humanitarian law, do not remain unpunished and are investigated fully and effectively, and affirms the need for States to ensure that perpetrators of any such acts committed on their territory do not operate with impunity, as provided for by national laws and obligations under international law;",
    "21": "Calls upon all States to provide adequate and prompt information in the event of the arrest or detention of humanitarian personnel or United Nations and associated personnel so as to afford them the necessary medical assistance and to allow independent medical teams to visit and examine the health of those detained and to ensure their right to legal counsel, and urges States to take the measures necessary to ensure the speedy release of those who have been arrested or detained in violation of the relevant conventions referred to in the present resolution and applicable international humanitarian law;",
    "22": "Calls upon all parties involved in armed conflict not to abduct, take hostage or kidnap humanitarian personnel or United Nations and associated personnel or to detain them in violation of the relevant conventions referred to in the present resolution and applicable international humanitarian law, and speedily to release, without harm or requirement of concession, any abductee or detainee;",
    "23": "Requests the Secretary-General to take the measures necessary to promote full respect for the human rights, privileges and immunities of United Nations and associated personnel, and also requests the Secretary-General to seek the inclusion, in negotiations of headquarters and other mission agreements concerning United Nations and associated personnel, of the applicable conditions contained in the Convention on the Privileges and Immunities of the United Nations, 16 the Convention on the Privileges and Immunities of the Specialized Agencies 17 and the Convention on the Safety of United Nations and Associated Personnel;",
    "24": "Recommends that the Secretary-General continue to seek the inclusion of, and that host countries include, key provisions of the Convention on the Safety of United Nations and Associated Personnel, among others, those regarding the prevention of attacks against members of the operation, the establishment of such attacks as crimes punishable by law and the prosecution or extradition of offenders, in future as well as, if necessary, in existing status-of-forces, status-of-mission, host country and other related agreements negotiated between the United Nations and those countries, mindful of the importance of the timely conclusion of such agreements, and encourages further efforts in this regard;",
    "25": "Encourages the Secretary-General to strengthen the ongoing efforts of the United Nations to develop a more systematic follow-up process with relevant host Governments on cases of serious crimes and acts of violence resulting in the death or serious injury of United Nations system personnel, in order to bring perpetrators to justice;",
    "26": "Calls upon States to explore and scale up measures for more systematic monitoring, reporting and investigation of attacks against humanitarian and medical personnel;",
    "27": "Notes with appreciation the adoption by the Department of Safety and Security, in collaboration with other departments and offices of the Secretariat, of standard operating procedures on the victims of violence registry for fatalities in service, designed to provide follow-up with relevant host Governments on cases of serious crimes and acts of violence resulting in the death or serious injury of United Nations personnel;",
    "28": "Calls attention to and reaffirms the obligation of all humanitarian personnel and United Nations and associated personnel to respect and, where required, observe the national laws of the country in which they are operating, in accordance with international law and the Charter;",
    "29": "Stresses the importance of ensuring that humanitarian personnel and United Nations and associated personnel are aware and respectful of national and local customs and traditions in their countries of assignment and communicate clearly their purpose and objectives to local populations in order to enhance their acceptance, thereby contributing to their safety and security, and in this regard ensure that humanitarian action is guided by humanitarian principles;",
    "30": "Urges the United Nations and other relevant humanitarian actors to include as part of their risk management strategy and training the building of good relations and trust with national and local governments and the promotion of acceptance by local communities and all relevant actors, with a view to enhancing safety and security and ensuring access to the affected populations, and encourages Member States to support efforts by the United Nations and other relevant humanitarian actors to provide training to humanitarian personnel in this regard;",
    "31": "Requests the Secretary-General to continue to take the measures necessary to ensure that United Nations and other personnel carrying out activities in fulfilment of the mandate of a United Nations operation are properly informed about and operate in conformity with mandatory security risk management measures and relevant codes of conduct and are properly informed about the conditions under which they are called upon to operate and the standards that they are required to meet, including those contained in relevant national laws and international law, and that adequate training in security, human rights law and international humanitarian law is provided so as to enhance their security and effectiveness in accomplishing their functions, and reaffirms the necessity for all other humanitarian organizations to provide their personnel with similar support;",
    "32": "Also requests the Secretary-General to continue, in coordination with Member States, to take the measures necessary to ensure that all United Nations premises and assets, including staff residences, are compliant with the United Nations mandatory security risk management measures and other relevant United Nations security standards, and to continue the ongoing assessment of United Nations premises and physical security worldwide;",
    "33": "Welcomes the ongoing efforts of the Secretary-General to ensure that all United Nations personnel receive adequate safety and security training, stresses the need to continue to improve training so as to enhance cultural awareness and knowledge of relevant law, including international humanitarian law, prior to their deployment to the field, and reaffirms the necessity for all other humanitarian organizations to provide their personnel with similar support;",
    "34": "Also welcomes the efforts of the Secretary-General to provide counselling and support services to United Nations personnel affected by safety and security incidents, and emphasizes the importance of making available stress management, mental health and related services for United Nations personnel throughout the system, and encourages all humanitarian organizations to provide their personnel with similar support;",
    "35": " host country, encourages humanitarian organizations to promote similar approaches among their personnel, and requests the Secretary-General to continue the collection and analysis of data to report on road incidents, including civilian casualties resulting from road accidents, and to encourage road safety preventive measures such as specialized trainings;",
    "36": "Welcomes the progress made towards further enhancing the security management system of the United Nations, including the major progress in the completion of the integration of all security personnel of the Secretariat under the leadership of the Under-Secretary-General for Safety and Security, and supports the continued implementation of the stay-and-deliver strategy while focusing on effectively managing the risks to which personnel are exposed in order to enable the United Nations system to deliver the most critical programmes, even in high-risk environments;",
    "37": "Encourages the Secretary-General to continue consistent implementation of the programme criticality framework as an operational tool allowing informed decisions on acceptable risk to United Nations personnel, and welcomes the revised programme criticality framework;",
    "38": "Also encourages the Secretary-General to continue to develop enabling procedures that facilitate the deployment of suitably qualified United Nations security personnel with the appropriate knowledge, skills and experience, with the aim of improving the safety and security measures of the United Nations, in order to strengthen the ability of the United Nations to deliver on its programmes, mandates and activities, including humanitarian programmes;",
    "39": "Requests the Secretary-General, inter alia, through the Inter-Agency Security Management Network, to continue the increased cooperation and collaboration among United Nations departments, organizations, funds and programmes and affiliated international organizations, including between their headquarters and field offices, in the planning and implementation of measures aimed at improving staff security, training and awareness, including field crisis management and gender inclusion in security management, calls upon all relevant United Nations departments, organizations, funds and programmes and affiliated international organizations to support those efforts, and notes the approval by the Inter-Agency Security Management Network of a system-wide policy on the security of locally recruited personnel;",
    "40": "Calls upon all relevant actors to make every effort to support in their public statements and other forms of advocacy a favourable environment for the safety and security of humanitarian personnel and United Nations and associated personnel, including locally recruited personnel;",
    "41": "",
    "42": "Requests the Department of Safety and Security of the Secretariat to further strengthen the security management of the United Nations, focusing on strengthening security risk management policy and tools and their application, increasing situational awareness, analysis and emergency response capacity, taking into account a disaster risk-informed perspective, including by enhancing strategic foresight and planning, strengthening policy development and promoting best practices, increasing compliance with risk management measures and improving monitoring and evaluation, enhancing surge capacity for emergency response, devising effective physical security measures, developing the expertise of security professionals and strengthening support to the designated officials and the security management teams in the field, increasing lessons learned, extending common security training capacities, and continuing to review safety and security policies, training and risk management processes, and promoting an effective and preventive security management approach that is multidimensional;",
    "43": "Encourages the Secretary-General, together with the United Nations security management system organizations, to continue to improve and effectively utilize the existing incident data system, including digital tools, strengthen monitoring and management of security risks, including through a gender perspective, and timely data-sharing;",
    "44": "Calls upon Member States and relevant actors to enhance existing data- sharing mechanisms as appropriate, and to facilitate field-driven support services to humanitarian actors, including training and orientation sessions and sharing comparative, predictive and thematic analyses that take into account disaggregated data;",
    "45": "Welcomes the work of the Secretary-General in enhancing security collaboration with host Governments, including efforts to support United Nations designated officials with regard to collaboration with host government authorities on the safety and security of personnel;",
    "46": "Stresses that the effective functioning at the country level of security operations requires a unified and robust capacity for policy, standards, coordination, communication, compliance and threat and risk assessment and operational and deployment flexibility to ensure that the security workforce reflects the changing dynamics of the security environment, and notes the benefits thereof to United Nations and associated personnel, including those achieved by the Department of Safety and Security since its establishment;",
    "47": "Welcomes the steps taken by the Secretary-General thus far to strengthen partnerships, and encourages further efforts to enhance coordination, cooperation and information-sharing, at both the headquarters and field levels, between the United Nations, regional organizations and other humanitarian and non-governmental organizations on matters relating to the safety and security of humanitarian personnel and United Nations and associated personnel, with a view to addressing mutual security concerns in the field, based on the Saving Lives Together framework as well as other relevant national and local initiatives in this regard, and requests the Secretary-General in this respect to enhance further collaborative initiatives to address the security needs of implementing partners, including through enhanced information- sharing, assistance in emergency situations, when feasible, and, where appropriate, security training, invites Member States to consider increasing support to those initiatives, and requests the Secretary-General to report on steps taken in this regard;",
    "48": " of the United Nations system, inter alia, with a view to reinforcing the efforts of the Department of Safety and Security to meet its mandate and responsibilities to enable the safe delivery of programmes;",
    "49": "Also underlines the need for better coordination between the United Nations and host Governments, in accordance with the relevant provisions of international law and national laws, on the use and deployment of essential equipment required to provide for the safety and security of United Nations personnel and associated personnel working in the delivery of humanitarian assistance by United Nations organizations;",
    "50": "Calls upon States to consider acceding to or ratifying the Tampere Convention on the Provision of Telecommunication Resources for Disaster Mitigation and Relief Operations of 18 June 1998,18 which entered into force on 8 January 2005, and urges them to facilitate and expedite, consistent with their national laws and international obligations applicable to them, the use of communications equipment in those and other relief operations, inter alia, by limiting and, whenever possible, expeditiously lifting the restrictions placed on the use of communications equipment by United Nations and associated personnel;",
    "51": "Requests the Secretary-General to submit to the General Assembly at its seventy-ninth session a comprehensive and updated report on the safety and security of humanitarian personnel and protection of United Nations personnel and on the implementation of the present resolution, including an assessment of the impact of safety and security risks on such personnel, and the development, implementation and outcomes of policies, strategies and initiatives of the United Nations system in the field of safety and security."
  },
  "agenda_items": [
    "Item 72"
  ],
  "symbol_references": [
    "A/78/L.17"
  ]
}