{
  "symbol": "A/RES/77/24",
  "filename": "A_RES_77_24.pdf",
  "title": "77/24. Special information programme on the question of Palestine of the Department of Global Communications of the Secretariat",
  "text": "United Nations \nA/RES/77/24\n \n \nGeneral Assembly \nDistr.: General \n5 December 2022 \n \n22-27275 (E)    081222     \n*2227275* \n \n \nSeventy-seventh session \nAgenda item 33 \nQuestion of Palestine \n \n \n \n \n Resolution adopted by the General Assembly \non 30 November 2022 \n \n \n \n \n[without reference to a Main Committee (A/77/L.25)] \n \n \n \n77/24. Special information programme on the question of Palestine of \nthe Department of Global Communications of the Secretariat \n \n \n \nThe General Assembly, \n \nRecalling its resolution 75/23 of 2 December 2020, \n \nRecalling also its resolutions 76/84 A, entitled \u201cInformation in the service of \nhumanity\u201d, and 76/84 B, entitled \u201cUnited Nations global communications policies \nand activities\u201d, of 9 December 2021, \n \nTaking note of the report of the Committee on Information on its forty-fourth \nsession,1 \n \nHaving considered the report of the Committee on the Exercise of the \nInalienable Rights of the Palestinian People,2 \n \nConvinced that the worldwide dissemination of accurate and comprehensive \ninformation and the role of civil society organizations and institutions remain of vital \nimportance in heightening awareness of and support for the inalienable rights of the \nPalestinian people, including the right to self-determination and independence, and \nfor the efforts to achieve a just, lasting and peaceful settlement of the question of \nPalestine, \n \nRecalling the mutual recognition between the Government of the State of Israel \nand the Palestine Liberation Organization, the representative of the Palestinian \npeople, as well as the existing agreements between the two sides, \n \nAffirming its support for a comprehensive, just, lasting and peaceful settlement \nto the Israeli-Palestinian conflict on the basis of the relevant United Nations \n__________________ \n \n1  Official Records of the General Assembly, Seventy-seventh Session, Supplement No. 21 \n(A/77/21). \n \n2  Ibid., Supplement No. 35 (A/77/35). \n\nA/RES/77/24 \nSpecial information programme on the question of Palestine of the \nDepartment of Global Communications of the Secretariat\n \n22-27275\n2/3 \n \nresolutions, the terms of reference of the Madrid Conference, including the principle \nof land for peace, the Arab Peace Initiative adopted by the Council of the League of \nArab States at its fourteenth session,3 and the Quartet road map to a permanent two-\nState solution to the Israeli-Palestinian conflict,4 endorsed by the Security Council in \nits resolution 1515 (2003) of 19 November 2003 and recalled by the Council in its \nresolution 2334 (2016) of 23 December 2016, \n \nRecalling the advisory opinion rendered on 9 July 2004 by the International \nCourt of Justice on the legal consequences of the construction of a wall in the \nOccupied Palestinian Territory,5 \n \nTaking note of its resolution 67/19 of 29 November 2012, \n \nReaffirming that the United Nations has a permanent responsibility towards the \nquestion of Palestine until the question is resolved in all its aspects in a satisfactory \nmanner in accordance with international legitimacy, \n \n1. \nNotes with appreciation the action taken by the Department of Global \nCommunications of the Secretariat in compliance with its resolution 75/23; \n \n2. \nStrongly condemns the killing of Palestinian-American journalist Shireen \nAbu Akleh, stresses the need for accountability, and welcomes the decision of the \nUnited Nations to honour her bravery and legacy by renaming the training programme \nfor Palestinian broadcasters and journalists to \u201cShireen Abu Akleh Training \nProgramme for Palestinian Broadcasters and Journalists\u201d; \n \n3. \nConsiders that the special information programme on the question of \nPalestine of the Department is very useful in raising the awareness of the international \ncommunity concerning the question of Palestine and the situation in the Middle East \nand that the programme is contributing effectively to an atmosphere conducive to \ndialogue and supportive of peace efforts and should receive the necessary support for \nthe fulfilment of its tasks; \n \n4. \nRequests the Department, in full cooperation and coordination with the \nCommittee on the Exercise of the Inalienable Rights of the Palestinian People, to \ncontinue, with the necessary flexibility as may be required by developments affecting \nthe question of Palestine, its special information programme, in particular, inter alia: \n \n(a) \nTo disseminate information on all the activities of the United Nations \nsystem relating to the question of Palestine and peace efforts, including reports on the \nwork carried out by the relevant United Nations organizations, as well as on the efforts \nof the Secretary-General and his Special Envoy vis-\u00e0-vis the objective of peace; \n \n(b) \nTo continue to issue, update and modernize publications and audiovisual \nand online materials on the various aspects of the question of Palestine in all fields, \nincluding materials concerning relevant recent developments, in particular on the \nefforts to achieve a peaceful settlement of the question of Palestine; \n \n(c) \nTo expand its collection of audiovisual material on the question of \nPalestine, to continue the production and preservation of such material and to update, \non a periodic basis, the public exhibit on the question of Palestine displayed in the \nGeneral Assembly Building as well as at United Nations headquarters in Geneva and \nVienna; \n \n(d) \nTo organize and promote fact-finding news missions for journalists to the \nOccupied Palestinian Territory, including East Jerusalem, and Israel; \n__________________ \n \n3  A/56/1026-S/2002/932, annex II, resolution 14/221. \n \n4  S/2003/529, annex. \n \n5  See A/ES-10/273 and A/ES-10/273/Corr.1. \n\nSpecial information programme on the question of Palestine of the \nDepartment of Global Communications of the Secretariat \nA/RES/77/24\n \n3/3\n22-27275 \n \n \n(e) \nTo organize international, regional and national seminars or encounters for \njournalists aimed, in particular, at sensitizing public opinion to the question of \nPalestine and peace efforts and at enhancing dialogue and understanding between \nPalestinians and Israelis for the promotion of a peaceful settlement to the Israeli-\nPalestinian conflict, including by fostering and encouraging the contribution of the \nmedia in support of peace between the two sides; \n \n(f) \nTo continue to provide assistance to the Palestinian people in the field of \nmedia development, in particular through its annual training programme for \nPalestinian broadcasters and journalists, and requests that arrangements be made for \nthe provision of such training in the Euro-Mediterranean and Middle East region; \n \n5. \nEncourages the Department to continue organizing encounters for the \nmedia and representatives of civil society to engage in open and positive discussions \nto explore means for encouraging people-to-people dialogue and promoting peace and \nmutual understanding in the region. \n \n42nd plenary meeting \n30 November 2022 \n \n",
  "paragraphs": {
    "1": "Notes with appreciation the action taken by the Department of Global Communications of the Secretariat in compliance with its resolution 75/23;",
    "2": "Strongly condemns the killing of Palestinian-American journalist Shireen Abu Akleh, stresses the need for accountability, and welcomes the decision of the United Nations to honour her bravery and legacy by renaming the training programme for Palestinian broadcasters and journalists to \u201cShireen Abu Akleh Training Programme for Palestinian Broadcasters and Journalists\u201d;",
    "3": "Considers that the special information programme on the question of Palestine of the Department is very useful in raising the awareness of the international community concerning the question of Palestine and the situation in the Middle East and that the programme is contributing effectively to an atmosphere conducive to dialogue and supportive of peace efforts and should receive the necessary support for the fulfilment of its tasks;",
    "4": "Requests the Department, in full cooperation and coordination with the Committee on the Exercise of the Inalienable Rights of the Palestinian People, to continue, with the necessary flexibility as may be required by developments affecting the question of Palestine, its special information programme, in particular, inter alia: (a) To disseminate information on all the activities of the United Nations system relating to the question of Palestine and peace efforts, including reports on the work carried out by the relevant United Nations organizations, as well as on the efforts of the Secretary-General and his Special Envoy vis-\u00e0-vis the objective of peace; (b) To continue to issue, update and modernize publications and audiovisual and online materials on the various aspects of the question of Palestine in all fields, including materials concerning relevant recent developments, in particular on the efforts to achieve a peaceful settlement of the question of Palestine; (c) To expand its collection of audiovisual material on the question of Palestine, to continue the production and preservation of such material and to update, on a periodic basis, the public exhibit on the question of Palestine displayed in the General Assembly Building as well as at United Nations headquarters in Geneva and Vienna; (d) To organize and promote fact-finding news missions for journalists to the Occupied Palestinian Territory, including East Jerusalem, and Israel; (e) To organize international, regional and national seminars or encounters for journalists aimed, in particular, at sensitizing public opinion to the question of Palestine and peace efforts and at enhancing dialogue and understanding between Palestinians and Israelis for the promotion of a peaceful settlement to the Israeli- Palestinian conflict, including by fostering and encouraging the contribution of the media in support of peace between the two sides; (f) To continue to provide assistance to the Palestinian people in the field of media development, in particular through its annual training programme for Palestinian broadcasters and journalists, and requests that arrangements be made for the provision of such training in the Euro-Mediterranean and Middle East region;",
    "5": "Encourages the Department to continue organizing encounters for the media and representatives of civil society to engage in open and positive discussions to explore means for encouraging people-to-people dialogue and promoting peace and mutual understanding in the region."
  },
  "agenda_items": [
    "Item 33"
  ],
  "symbol_references": [
    "A/77/L.25"
  ]
}