{
  "symbol": "A/RES/76/38",
  "filename": "A_RES_76_38.pdf",
  "title": "76/38. Convening of the fourth special session of the General Assembly devoted to disarmament",
  "text": "United Nations \nA/RES/76/38\n \n \nGeneral Assembly \nDistr.: General \n10 December 2021 \n \n21-18436 (E)    151221     \n*2118436* \n \n \nSeventy-sixth session \nAgenda item 100 (h) \nGeneral and complete disarmament: convening of the \nfourth special session of the General Assembly devoted \nto disarmament \n \n \n \n \n Resolution adopted by the General Assembly \non 6 December 2021 \n \n \n \n \n[on the report of the First Committee (A/76/444, para. 93)] \n \n \n \n76/38. Convening of the fourth special session of the General Assembly \ndevoted to disarmament \n \n \n \nThe General Assembly, \n \nRecalling its resolutions 49/75 I of 15 December 1994, 50/70 F of 12 December \n1995, 51/45 C of 10 December 1996, 52/38 F of 9 December 1997, 53/77 AA of \n4 December 1998, 54/54 U of 1 December 1999, 55/33 M of 20 November 2000, \n56/24 D of 29 November 2001, 57/61 of 22 November 2002, 59/71 of 3 December \n2004, 61/60 of 6 December 2006, 62/29 of 5 December 2007, 65/66 of 8 December \n2010, 72/49 of 4 December 2017, 73/42 of 5 December 2018, 74/56 of 12 December \n2019 and 75/44 of 7 December 2020, as well as its decisions 58/521 of 8 December \n2003, 60/518 of 8 December 2005, 60/559 of 6 June 2006, 63/519 of 2 December \n2008, 64/515 of 2 December 2009 and 70/551 of 23 December 2015, \n \nRecalling also that, there being a consensus to do so in each case, three special \nsessions of the General Assembly devoted to disarmament were held in 1978, 1982 \nand 1988, respectively, \n \nBearing in mind the Final Document of the Tenth Special Session of the General \nAssembly, adopted by consensus at the first special session devoted to disarmament, 1 \n \nBearing in mind also the ultimate objective of general and complete \ndisarmament under effective international control, \n \nReiterating its conviction that a special session of the General Assembly devoted \nto disarmament can set the future course of action in the fields of disarmament, arms \ncontrol, non-proliferation and related international security matters, \n__________________ \n \n1 Resolution S-10/2. \n\nA/RES/76/38 \nConvening of the fourth special session of the \nGeneral Assembly devoted to disarmament\n \n21-18436\n2/2 \n \n \nEmphasizing the importance of multilateralism in the process of disarmament, \narms control, non-proliferation and related international security matters, \n \nRecalling the conclusion of the work of the Open-ended Working Group on the \nfourth special session of the General Assembly devoted to disarmament to consider \nthe objectives and agenda of the fourth special session, and to adopt its report and \nsubstantive recommendations by consensus, \n \nRecalling also the report of the Open-ended Working Group and the \nrecommendations contained therein,2 \n \n1. \nRecalls the adoption by consensus of the recommendations on the \nobjectives and agenda of the fourth special session of the General Assembly devoted \nto disarmament by the Open-ended Working Group on the fourth special session of \nthe General Assembly devoted to disarmament, which was established by the \nAssembly by its resolution 65/66 and its decision 70/551 and which met in New York \nin 2016 and 2017; \n \n2. \nAlso recalls the report of the Open-ended Working Group and the \nsubstantive recommendations contained therein; \n \n3. \nReiterates its appreciation to the participants of the Open-ended Working \nGroup for their constructive contribution to its work; \n \n4. \nEncourages Member States to continue consultations on the next steps for the \nconvening of the fourth special session of the General Assembly devoted to disarmament; \n \n5. \nDecides to include in the provisional agenda of its seventy-seventh session, \nunder the item entitled \u201cGeneral and complete disarmament\u201d, the sub-item entitled \n\u201cConvening of the fourth special session of the General Assembly devoted to \ndisarmament\u201d.  \n \n45th plenary meeting \n6 December 2021 \n \n__________________ \n \n2 A/AC.268/2017/2. \n",
  "paragraphs": {
    "1": "Recalls the adoption by consensus of the recommendations on the objectives and agenda of the fourth special session of the General Assembly devoted to disarmament by the Open-ended Working Group on the fourth special session of the General Assembly devoted to disarmament, which was established by the Assembly by its resolution 65/66 and its decision 70/551 and which met in New York in 2016 and 2017;",
    "2": "Also recalls the report of the Open-ended Working Group and the substantive recommendations contained therein;",
    "3": "Reiterates its appreciation to the participants of the Open-ended Working Group for their constructive contribution to its work;",
    "4": "Encourages Member States to continue consultations on the next steps for the convening of the fourth special session of the General Assembly devoted to disarmament;",
    "5": "Decides to include in the provisional agenda of its seventy-seventh session, under the item entitled \u201cGeneral and complete disarmament\u201d, the sub-item entitled \u201cConvening of the fourth special session of the General Assembly devoted to disarmament\u201d."
  },
  "agenda_items": [
    "Item 100"
  ],
  "symbol_references": []
}