{
  "symbol": "A/RES/72/136",
  "filename": "A_RES_72_136.pdf",
  "title": "72/136. Promotion of interreligious and intercultural dialogue, understanding and cooperation for peace",
  "text": "United Nations \nA/RES/72/136\n \n \nGeneral Assembly \nDistr.: General \n15 January 2018 \n \n17-22363 (E)    180118 \n*1722363* \n \n \nSeventy-second session \nAgenda item 15 \n \n \n \n \n Resolution adopted by the General Assembly \non 11 December 2017 \n \n \n \n \n[without reference to a Main Committee (A/72/L.29 and A/72/L.29/Add.1)] \n \n \n 72/136. Promotion of interreligious and intercultural dialogue, \nunderstanding and cooperation for peace \n \n \n \nThe General Assembly, \n \nReaffirming the purposes and principles enshrined in the Charter of the United \nNations and the Universal Declaration of Human Rights, 1 in particular the right to \nfreedom of thought, conscience and religion, \n \nRecalling its resolution 71/249 of 22 December 2016 on the promotion of \ninterreligious and intercultural dialogue, understanding and cooperation for peace and \nits other related resolutions, \n \nRecalling also that, in its resolution 67/104 of 17 December 2012, it proclaimed \nthe period 2013\u20132022 the International Decade for the Rapprochement of Cultures \nand invited the United Nations Educational, Scientific and Cultural Organization in \nthis context to be the lead agency in the United Nations system, \n \nEncouraging, in this regard, activities aimed at promoting interreligious and \nintercultural dialogue in order to enhance peace and social stability, respect for \ndiversity and mutual respect and to create, at the global level, and also at the regional, \nnational and local levels, an environment conducive to peace and mutual \nunderstanding, \n \nRecalling its resolution 69/312 of 6 July 2015 on the United Nations Alliance of \nCivilizations, in which it reaffirmed its support for the Alliance and reiterated the \nvaluable role of the Alliance in promoting greater understanding and respect among \ncivilizations, cultures, religions and beliefs, \n \nRecalling also its resolution 70/109 of 10 December 2015 on a world against \nviolence and violent extremism and its resolution 70/291 of 1 July 2016 on the United \nNations Global Counter-Terrorism Strategy Review, \n__________________ \n \n1 Resolution 217 A (III). \n\nA/RES/72/136 \nPromotion of interreligious and intercultural dialogue,\nunderstanding and cooperation for peace\n \n17-22363 \n2/5 \n \n \nRecalling further its resolution 53/22 of 4 November 1998, by which it declared \n2001 the United Nations Year of Dialogue among Civilizations and expressed its firm \ndetermination to facilitate and promote dialogue among civilizations, \n \nRecalling its resolution 36/55 of 25 November 1981, by which it proclaimed the \nDeclaration on the Elimination of All Forms of Intolerance and of Discrimination \nBased on Religion or Belief, \n \nBearing in mind the valuable contribution that interreligious and intercultural \ndialogue can make to an improved awareness and understanding of the common \nvalues shared by all humankind, \n \nNoting that interreligious and intercultural dialogue has made significant \ncontributions to mutual understanding, tolerance and respect, as well as to the \npromotion of a culture of peace and an improvement of overall relations among \npeople from different cultural and religious backgrounds and among nations, \n \nNoting also the growing importance of interreligious and intercultural dialogue \nin the context of the global phenomenon of migration, which increases interaction \namong persons and communities from various traditions, cultures and religions, \n \nRecognizing that cultural diversity and the pursuit of cultural development by \nall peoples and nations are sources of mutual enrichment for the cultural life of \nhumankind, \n \nConvinced that the promotion of cultural pluralism and tolerance towards and \ndialogue among various cultures and civilizations would contribute to the efforts of \nall peoples and nations to enrich their cultures and traditions by engaging in a \nmutually beneficial exchange of knowledge and intellectual, moral and material \nachievements, \n \nNoting the Unite for Heritage campaign launched by the United Nations \nEducational, Scientific and Cultural Organization in March 2015, which aims to \ncelebrate and safeguard cultural heritage and diversity around the world, \n \nRecalling that States have the primary responsibility to promote and protect \nhuman rights, including the human rights of persons belonging to religious minorities, \nincluding their right to exercise their religion or belief freely, \n \nBearing in mind that tolerance of cultural, ethnic, religious and linguistic \ndiversities contributes towards peace, mutual understanding and friendship among \npeople of different cultures and nations and that these diversities should be made part \nof intercultural and interreligious dialogue efforts, as appropriate, \n \nWelcoming the adoption of the 2030 Agenda for Sustainable Development, 2 and \nacknowledging that the Agenda includes the promotion of peaceful and inclusive \nsocieties for sustainable development, \n \nWelcoming also the various initiatives at the local, national, regional and \ninternational levels for enhancing interreligious and intercultural dialogue, \nunderstanding and cooperation, and for strengthening people-to-people bonds, which \nare mutually reinforcing and interrelated, such as the African Initiative on Education \nfor Peace and Development through Interreligious and Intercultural Dialogue, \nlaunched in Cotonou, Benin, in May 2015, the fifth Congress of Leaders of World and \nTraditional Religions, held in Astana in June 2015, and the second World Nomad \nGames, held in Issyk-Kul, Kyrgyzstan, in September 2016, all of which contribute to \npromoting social cohesion, peace and development, \n__________________ \n \n2 Resolution 70/1. \n\nPromotion of interreligious and intercultural dialogue, \nunderstanding and cooperation for peace \nA/RES/72/136\n \n3/5 \n17-22363 \n \n \nWelcoming further the leading role of the United Nations Educational, Scientific \nand Cultural Organization, as well as the work of the United Nations Alliance of \nCivilizations, in promoting intercultural dialogue, \n \nWelcoming the work of the Anna Lindh Foundation and the ongoing work of the \nKing Abdullah Bin Abdulaziz International Centre for Interreligious and Intercultural \nDialogue in Vienna, \n \nNoting the declaration of the Forum on the Role of Religious Leaders in \nPreventing Incitement that could Lead to Atrocity Crimes, held in Fez, Morocco, on \n23 and 24 April 2015, and further efforts that build on the Rabat Plan of Action on \nthe prohibition of advocacy of national, racial or religious hatred that constitutes \nincitement to discrimination, hostility or violence 3 and the Istanbul Process for \nCombating Intolerance, Discrimination and Incitement to Hatred and/or Violence on \nthe basis of Religion or Belief, \n \nWelcoming the Declaration on Promoting Cultural Pluralism and Peace through \nInterfaith and Inter-ethnic Dialogue, endorsed by the 137th Assembly of the \nInter-Parliamentary Union, held in Saint Petersburg, Russian Federation, from \n14 to 18 October 2017, \n \nReferring to the World Forum on Intercultural Dialogue, organized biennially \nby Azerbaijan in cooperation with the United Nations Educational, Scientific and \nCultural Organization, the United Nations Alliance of Civilizations, the World \nTourism Organization, the Council of Europe and the Islamic Educational, Scientific \nand Cultural Organization, as a key global platform for promoting intercultural \ndialogue,4 \n \nAcknowledging the positive contribution of individuals and of relevant civil \nsociety organizations to the promotion of interreligious and intercultural dialogue, \nunderstanding and the culture of peace, \n \nUnderlining the importance of education, including education on culture, peace, \ntolerance, mutual understanding and human rights, in promoting interreligious and \nintercultural dialogue, respect for diversity, and the elimination of discrimination \nbased on religion or belief, \n \nRecognizing the contributions of the media and of new information and \ncommunications technology to promoting peoples\u2019 understanding of different cultures \nand religions, including through the promotion of dialogue, \n \nReaffirming the importance of sustaining the process of engaging all \nstakeholders, including young men and women as relevant actors, in interreligious \nand intercultural dialogue within the appropriate initiatives at various levels, which \naims to challenge prejudices, improve mutual understanding and foster cooperation, \n \nRecognizing the commitment of all religions to peace and the contribution that \ninterreligious and intercultural dialogue among religions, groups and individuals, in \nparticular religious leaders, can make towards an improved awareness and \nunderstanding of the common values shared by all humankind, \n \nNoting the United Nations Educational, Scientific and Cultural Organization \nconference on the theme \u201cInternet and the radicalization of youth: preventing, \nacting and living together\u201d, held in Quebec City, Canada, from 30 October to \n1 November 2016, \n \nNoting also the Appeal for Peace, signed by religious leaders during the World \nDay of Prayer for Peace, held in Assisi, Italy, on 20 September 2016, \n__________________ \n \n3 A/HRC/22/17/Add.4, appendix. \n \n4 See A/72/488, para. 40. \n\nA/RES/72/136 \nPromotion of interreligious and intercultural dialogue,\nunderstanding and cooperation for peace\n \n17-22363 \n4/5 \n \n \n1. \nReaffirms that mutual understanding and interreligious and intercultural \ndialogue constitute important dimensions of the dialogue among civilizations and of \nthe culture of peace; \n \n2. \nTakes note of the report of the Secretary-General on the promotion of a \nculture of peace and interreligious and intercultural dialogue, understanding and \ncooperation for peace;5 \n \n3. \nRecognizes the importance of interreligious and intercultural dialogue and \nits valuable contribution to promoting social cohesion, peace and development, and \ncalls upon Member States to consider, as appropriate and where applicable, \ninterreligious and intercultural dialogue as an important tool in efforts aimed at \nachieving peace and social stability and the full realization of internationally agreed \ndevelopment goals; \n \n4. \nAlso recognizes the efforts by relevant stakeholders to foster peaceful and \nharmonious coexistence within societies by promoting respect for religious and \ncultural diversity, including by engendering sustained and robust interaction among \nvarious segments of society; \n \n5. \nFurther recognizes the leading role of the United Nations Educational, \nScientific and Cultural Organization on intercultural dialogue and its contribution to \ninterreligious dialogue, as well as its activities related to the culture of peace and \nnon-violence and its focus on concrete actions at the global, regional and subregional \nlevels; \n \n6. \nEncourages Member States and relevant intergovernmental and \nnon-governmental organizations to continue to consider carrying out activities in \nsupport of the Action Plan for the International Decade for the Rapprochement of \nCultures (2013\u20132022), adopted by the United Nations Educational, Scientific and \nCultural Organization,6 which provides a framework for enhancing interreligious and \nintercultural dialogue and promoting tolerance and mutual understanding, while \nplacing emphasis on the involvement of women and youth in such dialogue; \n \n7. \nCondemns any advocacy of religious hatred that constitutes incitement to \ndiscrimination, hostility or violence, whether it involves the use of print, audiovisual \nor electronic media or any other means; \n \n8. \nReaffirms the solemn commitment of all States to fulfil their obligations \nto promote universal respect for and observance and protection of all human rights \nand fundamental freedoms for all in accordance with the Charter of the United \nNations, the Universal Declaration of Human Rights1 and other instruments relating \nto human rights and international law, the universal nature of these rights and \nfreedoms being beyond question; \n \n9. \nWelcomes the declarations adopted by the Global Forums of the United \nNations Alliance of Civilizations, and invites relevant stakeholders to continue their \nefforts to promote mutual understanding among different civilizations, cultures, \nreligions and beliefs; \n \n10. Underlines the importance of moderation as a value within societies for \ncountering violent extremism as and when conducive to terrorism, while respecting \nhuman rights and fundamental freedoms, and for further contributing to the promotion \nof interreligious and intercultural dialogue, tolerance, understanding and cooperation, \nand encourages efforts, as appropriate, to enable voices of moderation to work \ntogether in order to build a more secure, inclusive and peaceful world; \n__________________ \n \n5 A/72/488. \n \n6 United Nations Educational, Scientific and Cultural Organization, Executive Board decision \n194 EX/10. \n\nPromotion of interreligious and intercultural dialogue, \nunderstanding and cooperation for peace \nA/RES/72/136\n \n5/5 \n17-22363 \n \n \n11. \nWelcomes the efforts by the media to promote interreligious and \nintercultural dialogue, encourages the further promotion of dialogue among the media \nfrom all cultures and civilizations, emphasizes that everyone has the right to freedom \nof expression, and reaffirms that the exercise of this right carries with it special duties \nand responsibilities and may therefore be subject to certain restrictions, but that these \ncan be only such as are provided by law and necessary for respect of the rights or \nreputations of others, and protection of national security or of public order, or of \npublic health or morals; \n \n12. Also welcomes the efforts to use information and communications \ntechnology, including the Internet, to promote interreligious and intercultural \ndialogue, including through the Interfaith Dialogue ePortal established following the \nSpecial Non-Aligned Movement Ministerial Meeting on Interfaith Dialogue and \nCooperation for Peace and Development, held in Manila in 2010, as well as the Peace \nand Dialogue ePortal of the United Nations Educational, Scientific and Cultural \nOrganization, and encourages relevant stakeholders to utilize the opportunity to \ndisseminate their best practices and experiences on interreligious and intercultural \ndialogue by contributing to the Interfaith Dialogue ePortal and to the Peace and \nDialogue ePortal; \n \n13. Encourages Member States to consider, as and where appropriate, \ninitiatives that identify areas for practical action in all sectors and levels of society \nfor the promotion of interreligious and intercultural dialogue, tolerance, \nunderstanding and cooperation, inter alia, the ideas suggested during the High-level \nDialogue on Interreligious and Intercultural Understanding and Cooperation for \nPeace, held in New York in October 2007, including the idea of an enhanced process \nof dialogue among world religions, as well as the ideas suggested during the third \nHigh Panel on Peace and Dialogue among Cultures, held in Paris in November 2012; \n \n14. Acknowledges the active engagement of the United Nations system with \nfaith-based and cultural organizations and relevant non-governmental organizations \nin the promotion of interreligious and intercultural dialogue and in bringing together \npeople of different cultures, religions, faiths or beliefs to discuss common issues and \nobjectives; \n \n15. Also acknowledges the important role of civil society, including academia, \nin fostering interreligious and intercultural dialogue, and encourages support for \npractical measures that mobilize civil society, including building capacities, \nopportunities and frameworks for cooperation; \n \n16. Invites Member States to further promote reconciliation to help to ensure \ndurable peace and sustained development, including by working with faith leaders \nand communities and through reconciliatory measures and acts of service and by \nencouraging forgiveness and compassion among individuals; \n \n17. Recognizes that the Office for Economic and Social Council Support and \nCoordination in the Department of Economic and Social Affairs of the Secretariat \nplays a valuable role as focal point within the Secretariat on the issue, and encourages \nit to continue to interact and coordinate with the relevant entities of the United \nNations system and coordinate their contribution to the intergovernmental process \naimed at promoting interreligious and intercultural dialogue; \n \n18. Requests the Secretary-General to report to the General Assembly at its \nseventy-third session on the implementation of the present resolution. \n \n71st plenary meeting  \n11 December 2017 \n \n",
  "paragraphs": {
    "1": "Reaffirms that mutual understanding and interreligious and intercultural dialogue constitute important dimensions of the dialogue among civilizations and of the culture of peace;",
    "2": "Takes note of the report of the Secretary-General on the promotion of a culture of peace and interreligious and intercultural dialogue, understanding and cooperation for peace;5",
    "3": "Recognizes the importance of interreligious and intercultural dialogue and its valuable contribution to promoting social cohesion, peace and development, and calls upon Member States to consider, as appropriate and where applicable, interreligious and intercultural dialogue as an important tool in efforts aimed at achieving peace and social stability and the full realization of internationally agreed development goals;",
    "4": "Also recognizes the efforts by relevant stakeholders to foster peaceful and harmonious coexistence within societies by promoting respect for religious and cultural diversity, including by engendering sustained and robust interaction among various segments of society;",
    "5": "Further recognizes the leading role of the United Nations Educational, Scientific and Cultural Organization on intercultural dialogue and its contribution to interreligious dialogue, as well as its activities related to the culture of peace and non-violence and its focus on concrete actions at the global, regional and subregional levels;",
    "6": "Encourages Member States and relevant intergovernmental and non-governmental organizations to continue to consider carrying out activities in support of the Action Plan for the International Decade for the Rapprochement of Cultures (2013\u20132022), adopted by the United Nations Educational, Scientific and Cultural Organization,6 which provides a framework for enhancing interreligious and intercultural dialogue and promoting tolerance and mutual understanding, while placing emphasis on the involvement of women and youth in such dialogue;",
    "7": "Condemns any advocacy of religious hatred that constitutes incitement to discrimination, hostility or violence, whether it involves the use of print, audiovisual or electronic media or any other means;",
    "8": "Reaffirms the solemn commitment of all States to fulfil their obligations to promote universal respect for and observance and protection of all human rights and fundamental freedoms for all in accordance with the Charter of the United Nations, the Universal Declaration of Human Rights1 and other instruments relating to human rights and international law, the universal nature of these rights and freedoms being beyond question;",
    "9": "Welcomes the declarations adopted by the Global Forums of the United Nations Alliance of Civilizations, and invites relevant stakeholders to continue their efforts to promote mutual understanding among different civilizations, cultures, religions and beliefs;",
    "10": "Underlines the importance of moderation as a value within societies for countering violent extremism as and when conducive to terrorism, while respecting human rights and fundamental freedoms, and for further contributing to the promotion of interreligious and intercultural dialogue, tolerance, understanding and cooperation, and encourages efforts, as appropriate, to enable voices of moderation to work together in order to build a more secure, inclusive and peaceful world;",
    "11": "Welcomes the efforts by the media to promote interreligious and intercultural dialogue, encourages the further promotion of dialogue among the media from all cultures and civilizations, emphasizes that everyone has the right to freedom of expression, and reaffirms that the exercise of this right carries with it special duties and responsibilities and may therefore be subject to certain restrictions, but that these can be only such as are provided by law and necessary for respect of the rights or reputations of others, and protection of national security or of public order, or of public health or morals;",
    "12": "Also welcomes the efforts to use information and communications technology, including the Internet, to promote interreligious and intercultural dialogue, including through the Interfaith Dialogue ePortal established following the Special Non-Aligned Movement Ministerial Meeting on Interfaith Dialogue and Cooperation for Peace and Development, held in Manila in 2010, as well as the Peace and Dialogue ePortal of the United Nations Educational, Scientific and Cultural Organization, and encourages relevant stakeholders to utilize the opportunity to disseminate their best practices and experiences on interreligious and intercultural dialogue by contributing to the Interfaith Dialogue ePortal and to the Peace and Dialogue ePortal;",
    "13": "Encourages Member States to consider, as and where appropriate, initiatives that identify areas for practical action in all sectors and levels of society for the promotion of interreligious and intercultural dialogue, tolerance, understanding and cooperation, inter alia, the ideas suggested during the High-level Dialogue on Interreligious and Intercultural Understanding and Cooperation for Peace, held in New York in October 2007, including the idea of an enhanced process of dialogue among world religions, as well as the ideas suggested during the third High Panel on Peace and Dialogue among Cultures, held in Paris in November 2012;",
    "14": "Acknowledges the active engagement of the United Nations system with faith-based and cultural organizations and relevant non-governmental organizations in the promotion of interreligious and intercultural dialogue and in bringing together people of different cultures, religions, faiths or beliefs to discuss common issues and objectives;",
    "15": "Also acknowledges the important role of civil society, including academia, in fostering interreligious and intercultural dialogue, and encourages support for practical measures that mobilize civil society, including building capacities, opportunities and frameworks for cooperation;",
    "16": "Invites Member States to further promote reconciliation to help to ensure durable peace and sustained development, including by working with faith leaders and communities and through reconciliatory measures and acts of service and by encouraging forgiveness and compassion among individuals;",
    "17": "Recognizes that the Office for Economic and Social Council Support and Coordination in the Department of Economic and Social Affairs of the Secretariat plays a valuable role as focal point within the Secretariat on the issue, and encourages it to continue to interact and coordinate with the relevant entities of the United Nations system and coordinate their contribution to the intergovernmental process aimed at promoting interreligious and intercultural dialogue;",
    "18": "Requests the Secretary-General to report to the General Assembly at its seventy-third session on the implementation of the present resolution."
  },
  "agenda_items": [
    "Item 15"
  ],
  "symbol_references": [
    "A/72/L.29"
  ]
}