{
  "symbol": "A/RES/72/221",
  "filename": "A_RES_72_221.pdf",
  "title": "72/221. Implementation of the Convention on Biological Diversity and its contribution to sustainable development",
  "text": "United Nations \nA/RES/72/221\n \n \nGeneral Assembly \nDistr.: General \n25 January 2018 \n \n17-23294 (E)    300118     \n*1723294* \n \n \nSeventy-second session \nAgenda item 19 (f) \n \n \n \n \n Resolution adopted by the General Assembly \non 20 December 2017 \n \n \n \n \n[on the report of the Second Committee (A/72/420/Add.6)] \n \n \n 72/221. Implementation of the Convention on Biological Diversity \nand its contribution to sustainable development  \n \n \n \nThe General Assembly, \n \nRecalling its resolutions 64/203 of 21 December 2009, 65/161 of 20 December \n2010, 66/202 of 22 December 2011, 67/212 of 21 December 2012, 68/214 of \n20 December 2013, 69/222 of 19 December 2014, 70/207 of 22 December 2015 and \n71/230 of 21 December 2016 and its previous resolutions relating to the Convention \non Biological Diversity,1  \n \nRecalling also the outcomes of the United Nations Conference on Environment \nand Development, held in Rio de Janeiro, Brazil, in June 1992, 2 the Programme for \nthe Further Implementation of Agenda 21,3 the Johannesburg Declaration on \nSustainable Development4 and the Plan of Implementation of the World Summit on \nSustainable Development (Johannesburg Plan of Implementation)5 and the outcome \ndocument of the special event to follow up efforts made towards achieving the \nMillennium Development Goals convened by the President of the General Assembly,6  \n \nReaffirming the outcome document of the United Nations Conference on \nSustainable Development, entitled \u201cThe future we want\u201d,7 and, inter alia, the \ncommitments concerning biodiversity contained therein,  \n__________________ \n \n1  United Nations, Treaty Series, vol. 1760, No. 30619. \n \n2  Report of the United Nations Conference on Environment and Development, Rio de Janeiro,  \n3\u201314 June 1992, vol. I, Resolutions Adopted by the Conference (United Nations publication, \nSales No. E.93.I.8 and corrigendum), resolution 1, annexes I and II. \n \n3  Resolution S-19/2, annex. \n \n4  Report of the World Summit on Sustainable Development, Johannesburg, South Africa, \n26 August\u20134 September 2002 (United Nations publication, Sales No. E.03.II.A.1 and \ncorrigendum), chap. I, resolution 1, annex. \n \n5  Ibid., resolution 2, annex. \n \n6  Resolution 68/6. \n \n7  Resolution 66/288, annex. \n\nA/RES/72/221 \nImplementation of the Convention on Biological Diversity\nand its contribution to sustainable development\n \n17-23294 \n2/9 \n \n \nReaffirming also the Rio Declaration on Environment and Development8 and its \nprinciples,  \n \nReaffirming further its resolution 70/1 of 25 September 2015, entitled \n\u201cTransforming our world: the 2030 Agenda for Sustainable Development\u201d, in which \nit adopted a comprehensive, far-reaching and people-centred set of universal and \ntransformative Sustainable Development Goals and targets, its commitment to \nworking tirelessly for the full implementation of the Agenda by 2030, its recognition \nthat eradicating poverty in all its forms and dimensions, including extreme poverty, \nis the greatest global challenge and an indispensable requirement for sustainable \ndevelopment, its commitment to achieving sustainable development in its three \ndimensions \u2014 economic, social and environmental \u2014 in a balanced and integrated \nmanner, and to building upon the achievements of the Millennium Development \nGoals and seeking to address their unfinished business,  \n \nReaffirming its resolution 69/313 of 27 July 2015 on the Addis Ababa Action \nAgenda of the Third International Conference on Financing for Development, which \nis an integral part of the 2030 Agenda for Sustainable Development, supports and \ncomplements it, helps to contextualize its means of implementation targets with \nconcrete policies and actions, and reaffirms the strong political commitment to \naddress the challenge of financing and creating an enabling environment at all levels \nfor sustainable development in the spirit of global partnership and solidarity,  \n \nWelcoming the Paris Agreement9 and its early entry into force, encouraging all \nits parties to fully implement the Agreement, and parties to the United Nations \nFramework Convention on Climate Change10 that have not yet done so to deposit their \ninstruments of ratification, acceptance, approval or accession, where appropriate, as \nsoon as possible, \n \nRecalling that the objectives of the Convention on Biological Diversity, to be \npursued in accordance with its relevant provisions, are the conservation of biological \ndiversity, the sustainable use of its components and the fair and equitable sharing of \nthe benefits arising out of the utilization of genetic resources, including by \nappropriate access to genetic resources, by appropriate transfer of relevant \ntechnologies, taking into account all rights over those resources and to technologies, \nand by appropriate funding, \n \nReaffirming the intrinsic value of biological diversity, as well as the ecological, \ngenetic, social, economic, scientific, educational, cultural, recreational and aesthetic \nvalues of biological diversity and its critical role in maintaining ecosystems that \nprovide essential services, which are critical foundations for sustainable development \nand human well-being,  \n \nRecognizing that the achievement of the three objectives of the Convention is \ncrucial for sustainable development, poverty eradication and the improvement of \nhuman well-being and a major factor underpinning the achievement of the \ninternationally agreed development goals, including the Sustainable Development \nGoals,  \n \nReaffirming that, in accordance with the Charter of the United Nations and the \nprinciples of international law, States have the sovereign right to exploit their own \nresources pursuant to their own environmental policies and the responsibility to \n__________________ \n \n8  Report of the United Nations Conference on Environment and Development, Rio de Janeiro,  \n3\u201314 June 1992, vol. I, Resolutions Adopted by the Conference (United Nations publication, \nSales No. E.93.I.8 and corrigendum), resolution 1, annex I. \n \n9  Adopted under the UNFCCC in FCCC/CP/2015/10/Add.1, decision 1/CP.21. \n \n10  United Nations, Treaty Series, vol. 1771, No. 30822. \n\nImplementation of the Convention on Biological Diversity \nand its contribution to sustainable development \nA/RES/72/221\n \n3/9 \n17-23294 \n \nensure that activities within their jurisdiction or control do not cause damage to the \nenvironment of other States or of areas beyond the limits of national jurisdiction,  \n \nRecalling that, in its resolution 65/161, the General Assembly declared  \n2011\u20132020 the United Nations Decade on Biodiversity, with a view to contributing to \nthe implementation of the Strategic Plan for Biodiversity 2011\u20132020,11  \n \nRecognizing that the traditional knowledge, innovations and practices of \nindigenous peoples and local communities make an important contribution to the \nconservation and sustainable use of biodiversity and that their wider application can \nsupport social well-being and sustainable livelihoods,  \n \nTaking note of the decision adopted by the Conference of the Parties to \nthe Convention on Biological Diversity at its thirteenth meeting entitled \u201cArticle 8 (j) and \nrelated \nprovisions\u201d,12 \ndecision \nCBD/CP/MOP/VIII/1913 \nand \ndecision \nCBD/NP/MOP/DEC/2/7,14  \n \nRecalling the United Nations Declaration on the Rights of Indigenous Peoples 15 \nand the outcome document of the high-level plenary meeting of the General Assembly \nknown as the World Conference on Indigenous Peoples, 16  \n \nRecognizing the vital role that women play in the conservation and sustainable \nuse of biological diversity, and reaffirming the need for the full participation of \nwomen at all levels of policymaking and implementation for the conservation and \nsustainable use of biological diversity,  \n \nRecognizing also the important role of the Convention on International Trade in \nEndangered Species of Wild Fauna and Flora,17 an international agreement that stands \nat the intersection between trade, the environment and development in contributing \nto the conservation and sustainable use of biodiversity and in ensuring that no species \nentering into international trade is threatened with extinction, 18 and that should \ncontribute to tangible benefits for indigenous peoples and local communities, \nstressing the importance of basing the listing of species on agreed criteria, \nrecognizing the economic, social and environmental impacts of poaching and of illicit \ntrafficking in wildlife, where firm and strengthened action needs to be taken on both \nthe supply and demand sides, and emphasizing in this regard the importance of \neffective international cooperation among relevant multilateral environmental \nagreements and international organizations,  \n \nNoting the contribution of parties to and the secretariat19 of the Convention on \nInternational Trade in Endangered Species of Wild Fauna and Flora (CITES) to the \nimplementation of the Strategic Plan for Biodiversity 2011\u20132020, its 20 Aichi \nBiodiversity Targets and the Global Strategy for Plant Conservation,  \n__________________ \n \n11  United Nations Environment Programme, document UNEP/CBD/COP/10/27, annex, decision X/2, \nannex. \n \n12  United Nations Environment Programme, document UNEP/CBD/COP/13/25, decision XIII/18. \n \n13  Adopted by the Conference of the Parties serving as the Meeting of the Parties to the Cartagena \nProtocol on Biosafety at its eighth meeting (see United Nations Environment Programme, \ndocument UNEP/CBD/CP/MOP/8/17). \n \n14  Adopted by the Conference of the Parties serving as the Meeting of the Parties to the Nagoya \nProtocol on Access to Genetic Resources and the Fair and Equitable Sharing of Benefits Arising \nfrom Their Utilization at its second meeting (see United Nations Environment Programme, \ndocument UNEP/CBD/NP/MOP/2/13). \n \n15  Resolution 61/295, annex. \n \n16  Resolution 69/2. \n \n17  United Nations, Treaty Series, vol. 993, No. 14537. \n \n18  See resolution Conf. 16.7 of the Conference of the Parties to the Convention on International \nTrade in Endangered Species of Wild Fauna and Flora. \n \n19  See resolution Conf. 16.3 (Rev. CoP17), entitled \u201cCITES Strategic Vision: 2008\u20132020\u201d. \n\nA/RES/72/221 \nImplementation of the Convention on Biological Diversity\nand its contribution to sustainable development\n \n17-23294 \n4/9 \n \n \nRecalling its resolution 71/312 of 6 July 2017, in which it endorsed the \ndeclaration entitled \u201cOur ocean, our future: call for action\u201d adopted by the high-level \nUnited Nations Conference to Support the Implementation of Sustainable \nDevelopment Goal 14: Conserve and sustainably use the oceans, seas and marine \nresources for sustainable development, held from 5 to 9 June 2017, coinciding with \nWorld Oceans Day on 8 June, in this regard reaffirming the important role of the \ndeclaration in demonstrating the collective will to take action to conserve and \nsustainably use our oceans, seas and marine resources for sustainable development, \nand recognizing the important contributions of the partnership dialogues and \nvoluntary commitments made in the context of that Conference to the effective and \ntimely implementation of Sustainable Development Goal 14,  \n \nRecalling also the United Nations strategic plan for forests 2017\u20132030,20 and \nrecognizing that forests are home to an estimated 80 per cent of all terrestrial species \nand that all types of forests contribute substantially to climate change mitigation and \nadaptation and to the conservation of biodiversity,  \n \nNoting the adoption by the Conference of the Parties to the Convention on \nBiological Diversity, at its tenth meeting, of the Nagoya Protocol on Access to \nGenetic Resources and the Fair and Equitable Sharing of Benefits Arising from Their \nUtilization to the Convention on Biological Diversity,21 and acknowledging the role \nof access to genetic resources and equitable benefit-sharing arising from their \nutilization in contributing to the conservation and sustainable use of biological \ndiversity, poverty eradication and environmental sustainability and, thereby, to the \nachievement of sustainable development,  \n \nNoting also that 91 States and 1 regional economic integration organization have \nsigned and that 103 States and 1 regional economic integration organization that are \nparties to the Convention on Biological Diversity have deposited their instrument of \nratification, acceptance, approval or accession to the Nagoya Protocol, and noting \nalso in this regard that the Protocol entered into force on 12 October 2014,  \n \nNoting further the Nagoya Protocol, the objective of which is the fair and \nequitable sharing of the benefits arising from the utilization of genetic resources, \nincluding by appropriate access to genetic resources and by appropriate transfer of \nrelevant technologies, taking into account all rights over those resources and to \ntechnologies, and by appropriate funding, thereby contributing to the conservation of \nbiological diversity and the sustainable use of its components,  \n \nNoting that 195 States and 1 regional economic integration organization are \nparties to the Convention on Biological Diversity and that 170 States and 1 regional \neconomic integration organization are parties to its Cartagena Protocol on Biosafety, 22  \n \nNoting also that 50 States and 1 regional economic integration organization have \nsigned and that 40 States and 1 regional economic integration organization that are \nparties to the Cartagena Protocol have deposited their instrument of ratification, \nacceptance, approval or accession to the Nagoya-Kuala Lumpur Supplementary \nProtocol on Liability and Redress to the Cartagena Protocol on Biosafety, 23  \n \nRecalling the adoption by the Conference of the Parties to the Convention at its \nninth meeting of the strategy for resource mobilization in support of the achievement \n__________________ \n \n20  Economic and Social Council resolution 2017/4, annex I. \n \n21  United Nations Environment Programme, document UNEP/CBD/COP/10/27, annex, decision X/1. \n \n22  United Nations, Treaty Series, vol. 2226, No. 30619. \n \n23  See United Nations Environment Programme, document UNEP/CBD/BS/COP-MOP/5/17, annex, \ndecision BS-V/11. \n\nImplementation of the Convention on Biological Diversity \nand its contribution to sustainable development \nA/RES/72/221\n \n5/9 \n17-23294 \n \nof the three objectives of the Convention,24 as well as decision X/3, adopted by the \nConference of the Parties at its tenth meeting,25 on the review of its implementation, \nand the targets for resource mobilization, under Aichi Target 20 of the Strategic Plan \nfor Biodiversity 2011\u20132020, adopted by the Conference of the Parties in its decision \nXII/3,26  \n \nNoting the outcomes of the thirteenth meeting of the Conference of the Parties \nto the Convention,27 the eighth meeting of the Conference of the Parties serving as \nthe Meeting of the Parties to the Cartagena Protocol 28 and the second meeting of the \nConference of the Parties serving as the Meeting of the Parties to the Nagoya \nProtocol,29 all held in Cancun, Mexico, in 2016,  \n \nNoting also the fourteenth meeting of the Conference of the Parties to the \nConvention, to be held in Sharm el-Sheikh, Egypt, from 10 to 22 November 2018, as \nwell as the ninth meeting of the Conference of the Parties serving as the Meeting of \nthe Parties to the Cartagena Protocol and the third meeting of the Conference of the \nParties serving as the Meeting of the Parties to the Nagoya Protocol, all under the \nproposed theme \u201cInvesting in biodiversity for people and planet\u201d, and recognizing \nthat the outcomes of the meetings will contribute to the implementation of the 2030 \nAgenda for Sustainable Development,  \n \nReiterating the pledge that no one will be left behind, reaffirming the \nrecognition that the dignity of the human person is fundamental, and the wish to see \nthe Goals and targets met for all nations and peoples and for all segments of society, \nand recommitting to endeavour to reach the furthest behind first, \n \nRecommitting to ensuring that no country or person is left behind and to focusing \nour effort where the challenges are greatest, including by ensuring the inclusion and \nparticipation of those who are furthest behind, \n \n1. \nTakes note of the report of the Executive Secretary of the Convention on \nBiological Diversity;30  \n \n2. \nNotes with appreciation the recent appointment of the new Executive \nSecretary, and expresses its support for her tenure; \n \n3. \nAlso notes with appreciation the entry into force of the Nagoya Protocol \non Access to Genetic Resources and the Fair and Equitable Sharing of Benefits \nArising from Their Utilization to the Convention on Biological Diversity21 on \n12 October 2014; \n \n4. \nTakes note with appreciation of the Cancun Declaration on Mainstreaming \nthe Conservation and Sustainable Use of Biodiversity for Well-being, adopted at the \nhigh-level segment of the thirteenth meeting of the Conference of the Parties to the \nConvention on Biological Diversity;31  \n \n5. \nWelcomes the commitment of parties to the Convention on Biological \nDiversity to take specific actions, tailored to national needs and circumstances, and \nin line with other relevant international agreements, in agriculture, forestry, fisheries \n__________________ \n \n24  United Nations Environment Programme, document UNEP/CBD/COP/9/29, annex I, \ndecision IX/11. \n \n25  See United Nations Environment Programme, document UNEP/CBD/COP/10/27, annex. \n \n26  See United Nations Environment Programme, document UNEP/CBD/COP/12/29, sect. I. \n \n27  See United Nations Environment Programme, document UNEP/CBD/COP/13/25, sect. I. \n \n28  See United Nations Environment Programme, document UNEP/CBD/CP/MOP/8/17, sect. I. \n \n29  See United Nations Environment Programme, document UNEP/CBD/NP/MOP/2/13, sect. I. \n \n30  A/72/152, sect. III, and A/72/152/Corr.1. \n \n31  United Nations Environment Programme, document UNEP/CBD/COP/13/24. \n\nA/RES/72/221 \nImplementation of the Convention on Biological Diversity\nand its contribution to sustainable development\n \n17-23294 \n6/9 \n \nand tourism, bearing in mind the impact of these sectors on biodiversity, in various \ndirect and indirect ways;  \n \n6. \nEncourages the respective parties, in close collaboration with relevant \nstakeholders, to take concrete measures towards achieving the objectives of the \nConvention on Biological Diversity1 and the Protocols thereto, the Cartagena \nProtocol on Biosafety22 and the Nagoya Protocol, requests the parties, in close \ncollaboration with relevant stakeholders, to coherently and efficiently implement the \nobligations and commitments under the Convention and the Protocols, and in this \nregard emphasizes the need to comprehensively address at all levels the difficulties \nthat may impede their implementation;  \n \n7. \nRecognizes that the conservation and sustainable use of biodiversity can \nsignificantly contribute to disaster risk reduction and to reducing the adverse impacts \nof climate change, including by adding resilience to fragile ecosystems and making \nthem less vulnerable; \n \n8. \nUrges the parties to the Convention to facilitate the transfer of technology \nfor the effective implementation of the Convention in accordance with article 16 and \nother relevant provisions of the Convention, in this regard takes note of the strategy \nfor the practical implementation of the programme of work on technology transfer \nand scientific and technical cooperation developed by the Ad Hoc Technical Expert \nGroup on Technology Transfer and Scientific and Technological Cooperation, as well \nas of decision XI/2, entitled \u201cReview of progress in implementation of national \nbiodiversity strategies and action plans and related capacity-building support to \nparties\u201d,32 and also takes note of the relevant decisions adopted by the Conference of \nthe Parties at its twelfth meeting in this regard; 26  \n \n9. \nNotes with appreciation the efforts made by the secretariat of the \nConvention, parties to the Convention and the Global Environment Facility, as the \nfinancial mechanism of the Convention, in conjunction with United Nations funds \nand programmes and the specialized agencies, as well as other entities, in organizing \ncapacity-building workshops to support countries in the updating of national \nbiodiversity strategies and action plans, with a view to enhancing capacity and \naddressing the need for human, technical and financial resources to implement the \nStrategic Plan for Biodiversity 2011\u2013202011 and the Aichi Biodiversity Targets,11 \nadopted by the Conference of the Parties to the Convention at its tenth meeting, in \nparticular for developing countries; \n \n10. Urges parties to promote the mainstreaming of gender considerations, \ntaking into account the 2015\u20132020 Gender Plan of Action under the Convention on \nBiological Diversity,33 in developing, implementing and revising their national and, \nwhere appropriate, regional and subnational biodiversity strategies and action plans \nand equivalent instruments in implementing the three objectives of the Convention;  \n \n11. \nCalls upon Governments and all stakeholders to take appropriate measures \nto mainstream consideration of the socioeconomic impacts and benefits of the \nconservation and sustainable use of biodiversity and its components, as well as \necosystems that provide essential services, into relevant programmes and policies at \nall levels, in accordance with national legislation, circumstances and priorities; \n \n12. Reaffirms the importance of continuing to pursue more efficient and \ncoherent implementation of the three objectives of the Convention, and calls upon \n__________________ \n \n32  See United Nations Environment Programme, document UNEP/CBD/COP/11/35, annex I. \n \n33  United Nations Environment Programme, document UNEP/CBD/COP/12/29, sect. I, decision \nXII/7, annex. \n\nImplementation of the Convention on Biological Diversity \nand its contribution to sustainable development \nA/RES/72/221\n \n7/9 \n17-23294 \n \nparties and stakeholders to strengthen international cooperation measures for the \nfulfilment of obligations contained in the Convention; \n \n13. Stresses the importance of the achievement of the Aichi Biodiversity \nTargets and the implementation of the Strategic Plan for Biodiversity 2011\u20132020 by \nthe parties to the Convention, and, given the limited time remaining, calls upon all \nparties to accelerate and scale up efforts to implement them, acknowledging the \ncontribution of such efforts to the implementation of the 2030 Agenda for Sustainable \nDevelopment34 and the achievement of the Sustainable Development Goals; \n \n14. Highlights the importance of parties raising high-level political \nengagement for the achievement by 2020 of the Aichi Biodiversity Targets and the \nrelated Goals and targets of the 2030 Agenda for Sustainable Development; \n \n15. Reiterates the call made in the declaration \u201cOur ocean, our future: call for \naction\u201d35 for action to be taken on an urgent basis to conserve and sustainably use the \noceans, seas and marine resources for sustainable development; \n \n16. Invites all parties, relevant departments of the Secretariat, the specialized \nagencies, funds and programmes of the United Nations system and the regional \ncommissions to continue contributing to the achievement of the objectives of the \nStrategic Plan for Biodiversity 2011\u20132020; \n \n17. Reaffirms the need for a comprehensive and participatory process towards \ndeveloping proposals for the follow-up to the Strategic Plan for Biodiversity 2011\u2013\n2020, fully in line with decision XIII/136 and other relevant decisions of the \nConference of the Parties to the Convention;  \n \n18. Recognizes that parties to the Convention have reiterated that resources, \nfinancial, human and technical, need to be mobilized from all sources, and that this \nshould be balanced with the effective implementation of the Strategic Plan for \nBiodiversity 2011\u20132020, stresses the need for further consideration of the evaluation \nof all resources mobilized in terms of the biodiversity outcomes achieved, in this \nregard welcomes the decision of the parties to the Convention on an overall \nsubstantial increase in total biodiversity-related funding for the implementation of the \nStrategic Plan from a variety of sources, including national and international resource \nmobilization and international cooperation and the exploration of new and innovative \nfinancial mechanisms, as appropriate, and takes note of the decisions of the \nConference of the Parties to the Convention at its thirteenth session, including the \nrequest to the Executive Secretary to prepare a stocktake and updated analysis of \nfinancial reports received in order to provide a more comprehensive picture of the \nglobal overall progress towards the global targets;  \n \n19. Invites countries that have not yet done so to ratify or accede to the \nConvention; \n \n20. Invites parties to the Convention to ratify or accede to the Nagoya \nProtocol, and invites the Executive Secretary of the Convention and the Global \nEnvironment Facility, within its mandate as the financial mechanism of the \nConvention, in collaboration with relevant organizations, to continue to support \ncapacity-building and development activities to support the ratification and \nimplementation of the Protocol; \n \n21. Also invites parties to the Convention to consider, as appropriate, ratifying \nor acceding to the Cartagena Protocol; \n__________________ \n \n34  Resolution 70/1. \n \n35  Resolution 71/312. \n \n36  See United Nations Environment Programme, document UNEP/CBD/COP/13/25. \n\nA/RES/72/221 \nImplementation of the Convention on Biological Diversity\nand its contribution to sustainable development\n \n17-23294 \n8/9 \n \n \n22. Invites parties to the Cartagena Protocol to consider, as appropriate, \nratifying or acceding to the Nagoya-Kuala Lumpur Supplementary Protocol on \nLiability and Redress to the Cartagena Protocol on Biosafety; 23 \n \n23. Takes note of the work done by the Ad Hoc Open-ended Intersessional \nWorking Group on Article 8 (j) and Related Provisions, and in this regard invites the \nsecretariat of the Convention, through the Secretary-General, to report on the progress \nmade when reporting on the implementation of the present resolution to the General \nAssembly; \n \n24. Stresses \nthe \nimportance \nof \nmainstreaming \nbiodiversity \nin \nthe \nimplementation of the 2030 Agenda for Sustainable Development as part of national \nimplementation plans for the Sustainable Development Goals, in particular all \nbiodiversity-related Goals and targets; \n \n25. Looks forward to the sixth plenary meeting of the Intergovernmental \nScience-Policy Platform on Biodiversity and Ecosystem Services, to be held in \nMedellin, Colombia, from 17 to 24 March 2018, which aims to provide policy-\nrelevant information on biodiversity and ecosystem services to assist decision makers, \nincluding through its regional and subregional assessments of biodiversity and \necosystem services and its thematic assessment of land degradation and restoration; \n \n26. Stresses the importance of the engagement of the private sector and other \nstakeholders in the implementation of the three objectives of the Convention and in \nthe achievement of the biodiversity targets, invites them to align their policies and \npractices more explicitly with the objectives of the Convention, including through \npartnerships, in accordance with national legislation, circumstances and priorities, in \nthis regard stresses the importance of the ongoing work of the Global Partnership for \nBusiness and Biodiversity, and notes other related and complementary initiatives; \n \n27. Notes the ongoing work of the Joint Liaison Group of the secretariats and \noffices of the relevant subsidiary bodies of the Convention on Biological Diversity, \nthe United Nations Convention to Combat Desertification in Those Countries \nExperiencing Serious Drought and/or Desertification, Particularly in Africa, 37 and the \nUnited Nations Framework Convention on Climate Change10 (the Rio conventions) \nand the Liaison Group of Biodiversity-related Conventions, acknowledges the \nimportance of improving coherence in the implementation of those conventions, \nrecognizes the importance of enhancing synergies among the biodiversity-related \nconventions, without prejudice to their specific objectives, in this regard notes the \ncontribution of the United Nations Environment Assembly, as reflected in its \nresolution 2/17 of 27 May 2016,38 and encourages the conferences of the parties to \nthe biodiversity-related multilateral environmental agreements to consider \nstrengthening efforts in this regard, taking into account relevant experiences and \nbearing in mind the respective independent legal status and mandates of those \ninstruments; \n \n28. Calls upon the relevant organizations of the United Nations system, within \ntheir respective mandates and resources, to ensure that no one is left behind and no \ncountry is left behind in the implementation of the present resolution; \n \n29. Requests the Secretary-General to submit to the General Assembly, at its \nseventy-third session, a report on the implementation of the present resolution, \nincluding on progress in the implementation of the Convention and the Aichi \nBiodiversity Targets and difficulties encountered in the process of their \n__________________ \n \n37  United Nations, Treaty Series, vol. 1954, No. 33480. \n \n38  See Official Records of the General Assembly, Seventy-first Session, Supplement No. 25 \n(A/71/25), annex. \n\nImplementation of the Convention on Biological Diversity \nand its contribution to sustainable development \nA/RES/72/221\n \n9/9 \n17-23294 \n \nimplementation, and decides to include, under the item entitled \u201cSustainable \ndevelopment\u201d, the sub-item entitled \u201cConvention on Biological Diversity\u201d in the \nprovisional agenda of its seventy-third session, unless otherwise agreed. \n \n74th plenary meeting  \n20 December 2017 \n \n",
  "paragraphs": {
    "1": "Takes note of the report of the Executive Secretary of the Convention on Biological Diversity;30",
    "2": "Notes with appreciation the recent appointment of the new Executive Secretary, and expresses its support for her tenure;",
    "3": "Also notes with appreciation the entry into force of the Nagoya Protocol on Access to Genetic Resources and the Fair and Equitable Sharing of Benefits Arising from Their Utilization to the Convention on Biological Diversity21 on 12 October 2014;",
    "4": "Takes note with appreciation of the Cancun Declaration on Mainstreaming the Conservation and Sustainable Use of Biodiversity for Well-being, adopted at the high-level segment of the thirteenth meeting of the Conference of the Parties to the Convention on Biological Diversity;31",
    "5": "Welcomes the commitment of parties to the Convention on Biological Diversity to take specific actions, tailored to national needs and circumstances, and in line with other relevant international agreements, in agriculture, forestry, fisheries __________________ 24 United Nations Environment Programme, document UNEP/CBD/COP/9/29, annex I, decision IX/11. 25 See United Nations Environment Programme, document UNEP/CBD/COP/10/27, annex. 26 See United Nations Environment Programme, document UNEP/CBD/COP/12/29, sect. I. 27 See United Nations Environment Programme, document UNEP/CBD/COP/13/25, sect. I. 28 See United Nations Environment Programme, document UNEP/CBD/CP/MOP/8/17, sect. I. 29 See United Nations Environment Programme, document UNEP/CBD/NP/MOP/2/13, sect. I. 30 A/72/152, sect. III, and A/72/152/Corr.1. 31 United Nations Environment Programme, document UNEP/CBD/COP/13/24. A/RES/72/221 Implementation of the Convention on Biological Diversity and its contribution to sustainable development 17-23294 6/9 and tourism, bearing in mind the impact of these sectors on biodiversity, in various direct and indirect ways;",
    "6": "Encourages the respective parties, in close collaboration with relevant stakeholders, to take concrete measures towards achieving the objectives of the Convention on Biological Diversity1 and the Protocols thereto, the Cartagena Protocol on Biosafety22 and the Nagoya Protocol, requests the parties, in close collaboration with relevant stakeholders, to coherently and efficiently implement the obligations and commitments under the Convention and the Protocols, and in this regard emphasizes the need to comprehensively address at all levels the difficulties that may impede their implementation;",
    "7": "Recognizes that the conservation and sustainable use of biodiversity can significantly contribute to disaster risk reduction and to reducing the adverse impacts of climate change, including by adding resilience to fragile ecosystems and making them less vulnerable;",
    "8": "Urges the parties to the Convention to facilitate the transfer of technology for the effective implementation of the Convention in accordance with article 16 and other relevant provisions of the Convention, in this regard takes note of the strategy for the practical implementation of the programme of work on technology transfer and scientific and technical cooperation developed by the Ad Hoc Technical Expert Group on Technology Transfer and Scientific and Technological Cooperation, as well as of decision XI/2, entitled \u201cReview of progress in implementation of national biodiversity strategies and action plans and related capacity-building support to parties\u201d,32 and also takes note of the relevant decisions adopted by the Conference of the Parties at its twelfth meeting in this regard; 26",
    "9": "Notes with appreciation the efforts made by the secretariat of the Convention, parties to the Convention and the Global Environment Facility, as the financial mechanism of the Convention, in conjunction with United Nations funds and programmes and the specialized agencies, as well as other entities, in organizing capacity-building workshops to support countries in the updating of national biodiversity strategies and action plans, with a view to enhancing capacity and addressing the need for human, technical and financial resources to implement the Strategic Plan for Biodiversity 2011\u2013202011 and the Aichi Biodiversity Targets,11 adopted by the Conference of the Parties to the Convention at its tenth meeting, in particular for developing countries;",
    "10": "Urges parties to promote the mainstreaming of gender considerations, taking into account the 2015\u20132020 Gender Plan of Action under the Convention on Biological Diversity,33 in developing, implementing and revising their national and, where appropriate, regional and subnational biodiversity strategies and action plans and equivalent instruments in implementing the three objectives of the Convention;",
    "11": "Calls upon Governments and all stakeholders to take appropriate measures to mainstream consideration of the socioeconomic impacts and benefits of the conservation and sustainable use of biodiversity and its components, as well as ecosystems that provide essential services, into relevant programmes and policies at all levels, in accordance with national legislation, circumstances and priorities;",
    "12": "Reaffirms the importance of continuing to pursue more efficient and coherent implementation of the three objectives of the Convention, and calls upon __________________ 32 See United Nations Environment Programme, document UNEP/CBD/COP/11/35, annex I. 33 United Nations Environment Programme, document UNEP/CBD/COP/12/29, sect. I, decision XII/7, annex. Implementation of the Convention on Biological Diversity and its contribution to sustainable development A/RES/72/221 7/9 17-23294 parties and stakeholders to strengthen international cooperation measures for the fulfilment of obligations contained in the Convention;",
    "13": "Stresses the importance of the achievement of the Aichi Biodiversity Targets and the implementation of the Strategic Plan for Biodiversity 2011\u20132020 by the parties to the Convention, and, given the limited time remaining, calls upon all parties to accelerate and scale up efforts to implement them, acknowledging the contribution of such efforts to the implementation of the 2030 Agenda for Sustainable Development34 and the achievement of the Sustainable Development Goals;",
    "14": "Highlights the importance of parties raising high-level political engagement for the achievement by 2020 of the Aichi Biodiversity Targets and the related Goals and targets of the 2030 Agenda for Sustainable Development;",
    "15": "Reiterates the call made in the declaration \u201cOur ocean, our future: call for action\u201d35 for action to be taken on an urgent basis to conserve and sustainably use the oceans, seas and marine resources for sustainable development;",
    "16": "Invites all parties, relevant departments of the Secretariat, the specialized agencies, funds and programmes of the United Nations system and the regional commissions to continue contributing to the achievement of the objectives of the Strategic Plan for Biodiversity 2011\u20132020;",
    "17": "Reaffirms the need for a comprehensive and participatory process towards developing proposals for the follow-up to the Strategic Plan for Biodiversity 2011\u2013 2020, fully in line with decision XIII/136 and other relevant decisions of the Conference of the Parties to the Convention;",
    "18": "Recognizes that parties to the Convention have reiterated that resources, financial, human and technical, need to be mobilized from all sources, and that this should be balanced with the effective implementation of the Strategic Plan for Biodiversity 2011\u20132020, stresses the need for further consideration of the evaluation of all resources mobilized in terms of the biodiversity outcomes achieved, in this regard welcomes the decision of the parties to the Convention on an overall substantial increase in total biodiversity-related funding for the implementation of the Strategic Plan from a variety of sources, including national and international resource mobilization and international cooperation and the exploration of new and innovative financial mechanisms, as appropriate, and takes note of the decisions of the Conference of the Parties to the Convention at its thirteenth session, including the request to the Executive Secretary to prepare a stocktake and updated analysis of financial reports received in order to provide a more comprehensive picture of the global overall progress towards the global targets;",
    "19": "Invites countries that have not yet done so to ratify or accede to the Convention;",
    "20": "Invites parties to the Convention to ratify or accede to the Nagoya Protocol, and invites the Executive Secretary of the Convention and the Global Environment Facility, within its mandate as the financial mechanism of the Convention, in collaboration with relevant organizations, to continue to support capacity-building and development activities to support the ratification and implementation of the Protocol;",
    "21": "Also invites parties to the Convention to consider, as appropriate, ratifying or acceding to the Cartagena Protocol; __________________ 34 Resolution 70/1. 35 Resolution 71/312. 36 See United Nations Environment Programme, document UNEP/CBD/COP/13/25. A/RES/72/221 Implementation of the Convention on Biological Diversity and its contribution to sustainable development 17-23294 8/9",
    "22": "Invites parties to the Cartagena Protocol to consider, as appropriate, ratifying or acceding to the Nagoya-Kuala Lumpur Supplementary Protocol on Liability and Redress to the Cartagena Protocol on Biosafety; 23",
    "23": "Takes note of the work done by the Ad Hoc Open-ended Intersessional Working Group on Article 8 (j) and Related Provisions, and in this regard invites the secretariat of the Convention, through the Secretary-General, to report on the progress made when reporting on the implementation of the present resolution to the General Assembly;",
    "24": "Stresses the importance of mainstreaming biodiversity in the implementation of the 2030 Agenda for Sustainable Development as part of national implementation plans for the Sustainable Development Goals, in particular all biodiversity-related Goals and targets;",
    "25": "Looks forward to the sixth plenary meeting of the Intergovernmental Science-Policy Platform on Biodiversity and Ecosystem Services, to be held in Medellin, Colombia, from 17 to 24 March 2018, which aims to provide policy- relevant information on biodiversity and ecosystem services to assist decision makers, including through its regional and subregional assessments of biodiversity and ecosystem services and its thematic assessment of land degradation and restoration;",
    "26": "Stresses the importance of the engagement of the private sector and other stakeholders in the implementation of the three objectives of the Convention and in the achievement of the biodiversity targets, invites them to align their policies and practices more explicitly with the objectives of the Convention, including through partnerships, in accordance with national legislation, circumstances and priorities, in this regard stresses the importance of the ongoing work of the Global Partnership for Business and Biodiversity, and notes other related and complementary initiatives;",
    "27": "Notes the ongoing work of the Joint Liaison Group of the secretariats and offices of the relevant subsidiary bodies of the Convention on Biological Diversity, the United Nations Convention to Combat Desertification in Those Countries Experiencing Serious Drought and/or Desertification, Particularly in Africa, 37 and the United Nations Framework Convention on Climate Change10 (the Rio conventions) and the Liaison Group of Biodiversity-related Conventions, acknowledges the importance of improving coherence in the implementation of those conventions, recognizes the importance of enhancing synergies among the biodiversity-related conventions, without prejudice to their specific objectives, in this regard notes the contribution of the United Nations Environment Assembly, as reflected in its resolution 2/17 of 27 May 2016,38 and encourages the conferences of the parties to the biodiversity-related multilateral environmental agreements to consider strengthening efforts in this regard, taking into account relevant experiences and bearing in mind the respective independent legal status and mandates of those instruments;",
    "28": "Calls upon the relevant organizations of the United Nations system, within their respective mandates and resources, to ensure that no one is left behind and no country is left behind in the implementation of the present resolution;",
    "29": "Requests the Secretary-General to submit to the General Assembly, at its seventy-third session, a report on the implementation of the present resolution, including on progress in the implementation of the Convention and the Aichi Biodiversity Targets and difficulties encountered in the process of their __________________ 37 United Nations, Treaty Series, vol. 1954, No. 33480. 38 See Official Records of the General Assembly, Seventy-first Session, Supplement No. 25 (A/71/25), annex. Implementation of the Convention on Biological Diversity and its contribution to sustainable development A/RES/72/221 9/9 17-23294 implementation, and decides to include, under the item entitled \u201cSustainable development\u201d, the sub-item entitled \u201cConvention on Biological Diversity\u201d in the provisional agenda of its seventy-third session, unless otherwise agreed. 74th plenary meeting 20 December 2017"
  },
  "agenda_items": [
    "Item 19"
  ],
  "symbol_references": []
}