{
  "symbol": "A/RES/74/23",
  "filename": "A_RES_74_23.pdf",
  "title": "74/23. Promotion of interreligious and intercultural dialogue, understanding and cooperation for peace",
  "text": "United Nations \nA/RES/74/23\n \n \nGeneral Assembly \nDistr.: General \n18 December 2019 \n \n19-21671 (E)    201219 \n*1921671* \n \n \nSeventy-fourth session \nAgenda item 15 \nCulture of peace \n \n \n \n \n Resolution adopted by the General Assembly \non 12 December 2019 \n \n \n \n \n[without reference to a Main Committee (A/74/L.25 and A/74/L.25/Add.1)] \n \n \n \n74/23. Promotion of interreligious and intercultural dialogue, \nunderstanding and cooperation for peace \n \n \n \nThe General Assembly, \n \nReaffirming the purposes and principles enshrined in the Charter of the United \nNations and the Universal Declaration of Human Rights, 1 in particular the right to \nfreedom of thought, conscience and religion,  \n \nRecalling its resolution 73/129 of 12 December 2018 on the promotion of \ninterreligious and intercultural dialogue, understanding and cooperation for peace, \nand its other related resolutions, \n \nRecalling also its resolution 53/243 of 13 September 1999 on the Declaration \nand Programme of Action on a Culture of Peace, which serves as a universal mandate \nfor the international community for the promotion of a culture of peace and \nnon-violence that benefits humanity, in particular future generations, and welcoming \nthe convening of the High-level Forum on the Culture of Peace by the President of \nthe General Assembly on 13 September 2019, in connection with the observance \nof the twentieth anniversary of the adoption of the Declaration and Programme of \nAction, which provided an opportunity for renewing the commitment to further \nstrengthening the global movement for a culture of peace,  \n \nRecalling further that, in its resolution 67/104 of 17 December 2012, it \nproclaimed the period 2013\u20132022 the International Decade for the Rapprochement of \nCultures and invited the United Nations Educational, Scientific and Cultural \nOrganization, in that context, to be the lead agency in the United Nations system,  \n \nEncouraging, in this regard, activities aimed at promoting interreligious and \nintercultural dialogue in order to enhance peace and social stability, respect for \n__________________ \n \n1 Resolution 217 A (III). \n\nA/RES/74/23 \nPromotion of interreligious and intercultural dialogue, \nunderstanding and cooperation for peace\n \n19-21671\n2/7 \n \ndiversity and mutual respect and to create, at the global level, and also at the regional, \nnational and local levels, an environment conducive to peace and mutual \nunderstanding,  \n \nRecalling its resolution 69/312 of 6 July 2015 on the United Nations Alliance of \nCivilizations, in which it reaffirmed its support for the Alliance and reiterated the \nvaluable role of the Alliance in promoting greater understanding and respect among \ncivilizations, cultures, religions and beliefs,  \n \nRecalling also its resolution 72/241 of 20 December 2017 on a world against \nviolence and violent extremism and its resolution 72/284 of 26 June 2018 on the \nUnited Nations Global Counter-Terrorism Strategy Review,  \n \nRecalling further its resolution 53/22 of 4 November 1998, by which it declared \n2001 the United Nations Year of Dialogue among Civilizations and expressed its firm \ndetermination to facilitate and promote dialogue among civilizations,  \n \nRecalling its resolution 36/55 of 25 November 1981, by which it proclaimed the \nDeclaration on the Elimination of All Forms of Intolerance and of Discrimination \nBased on Religion or Belief,  \n \nRecalling also its resolution 73/328 of 25 July 2019 on promoting interreligious \nand intercultural dialogue and tolerance in countering hate speech,  \n \nBearing in mind the valuable contribution that interreligious and intercultural \ndialogue can make to an improved awareness and understanding of the common \nvalues shared by all humankind,  \n \nNoting that interreligious and intercultural dialogue has made significant \ncontributions to mutual understanding, tolerance and respect, as well as to the \npromotion of a culture of peace and an improvement of overall relations among \npeople from different cultural and religious backgrounds and among nations,  \n \nNoting also the growing importance of interreligious and intercultural dialogue \nin the context of the global phenomenon of migration, which increases interaction \namong persons and communities from various traditions, cultures and religions,  \n \nRecognizing that cultural diversity and the pursuit of cultural development by all \npeoples and nations are sources of mutual enrichment for the cultural life of humankind, \n \nConvinced that the promotion of cultural pluralism and tolerance towards and \ndialogue among various cultures and civilizations would contribute to the efforts of \nall peoples and nations to enrich their cultures and traditions by engaging in a \nmutually beneficial exchange of knowledge and intellectual, moral and material \nachievements,  \n \nNoting the launch by the Secretary-General of the United Nations Strategy and \nPlan of Action on Hate Speech,  \n \nNoting also the leading role played the United Nations Alliance of Civilizations \nin preparing the United Nations Plan of Action to Safeguard Religious Sites, noting \nfurther the launch of the Plan of Action by the Secretary-General on 12 September \n2019, and inviting Member States to consider implementing the relevant \nrecommendations addressed to them, in collaboration with other stakeholders, as \nappropriate,  \n \nNoting further the Unite for Heritage campaign launched by the United Nations \nEducational, Scientific and Cultural Organization in March 2015, which is aimed at \ncelebrating and safeguarding cultural heritage and diversity around the world, and the \nConference on Safeguarding Endangered Cultural Heritage, held in Abu Dhabi \non 2 and 3 December 2016, and the declaration adopted at the Conference,  \n\nPromotion of interreligious and intercultural dialogue, \nunderstanding and cooperation for peace \nA/RES/74/23\n \n3/7\n19-21671 \n \n \nRecalling that States have the primary responsibility to promote and protect \nhuman rights, including the human rights of persons belonging to religious minorities, \nincluding their right to exercise their religion or belief freely,  \n \nRecalling also its resolution 73/296 of 28 May 2019, in which it decided to \ndesignate 22 August as the International Day Commemorating the Victims of Acts of \nViolence Based on Religion or Belief,  \n \nRecalling further its resolution 73/329 of 25 July 2019, in which it declared \n5 April the International Day of Conscience,  \n \nBearing in mind that tolerance of cultural, ethnic, religious and linguistic \ndiversities contributes towards peace, mutual understanding and friendship among \npeople of different cultures and nations and that these diversities should be made part \nof intercultural and interreligious dialogue efforts, as appropriate,  \n \nReaffirming the 2030 Agenda for Sustainable Development,2 and acknowledging \nthat the 2030 Agenda includes the promotion of peaceful and inclusive societies for \nsustainable development,  \n \nNoting the various initiatives at the local, national, regional and international \nlevels for enhancing interreligious and intercultural dialogue, understanding and \ncooperation, and for strengthening people-to-people bonds, which are mutually \nreinforcing and interrelated, such as the establishment of the Hamad bin Khalifa \nCivilization Center in Copenhagen in 2014, the African Initiative on Education for \nPeace and Development through Interreligious and Intercultural Dialogue, launched \nin Cotonou, Benin, in May 2015, the thirteenth Doha Conference on Interfaith \nDialogue, held in Qatar, the sixth Congress of Leaders of World and Traditional \nReligions, held in Astana in October 2018, the third World Nomad Games, held in \nIssyk-Kul, Kyrgyzstan, and organized under the patronage of the United Nations \nEducational, Scientific and Cultural Organization in September 2018, the \nestablishment of the International Institute for Tolerance and the Muslim Council of \nElders in the United Arab Emirates, in 2017, and the launch of the World Tolerance \nSummit, in Abu Dhabi, all of which contribute to promoting social cohesion and \ninclusion, peace and development,  \n \nNoting also the cooperation between the United Nations and regional and other \norganizations in the promotion of interreligious and intercultural dialogue, \n \nNoting further the adoption of the Yerevan Declaration of the seventeenth \nSummit of Heads of State and Government of la Francophonie, on the theme \u201cLiving \ntogether\u201d, held in Yerevan on 11 and 12 October 2018,  \n \nWelcoming the leading role of the United Nations Educational, Scientific and \nCultural Organization, as well as the work of the United Nations Alliance of \nCivilizations, in promoting intercultural dialogue,  \n \nWelcoming also the work of the Anna Lindh Foundation and the ongoing work \nof the King Abdullah Bin Abdulaziz International Centre for Interreligious and \nIntercultural Dialogue in Vienna,  \n \nNoting the declaration of the Forum on the Role of Religious Leaders in \nPreventing Incitement that could Lead to Atrocity Crimes, held in Fez, Morocco, \non 23 and 24 April 2015, and further efforts that build on the Rabat Plan of Action on \nthe prohibition of advocacy of national, racial or religious hatred that constitutes \n__________________ \n \n2 Resolution 70/1. \n\nA/RES/74/23 \nPromotion of interreligious and intercultural dialogue, \nunderstanding and cooperation for peace\n \n19-21671\n4/7 \n \nincitement to discrimination, hostility or violence 3  and the Istanbul Process for \nCombating Intolerance, Discrimination and Incitement to Hatred and/or Violence on \nthe Basis of Religion or Belief,  \n \nWelcoming the Declaration on Promoting Cultural Pluralism and Peace through \nInterfaith and Inter-ethnic Dialogue, endorsed by the 137th Assembly of the Inter-\nParliamentary Union, held in Saint Petersburg, Russian Federation, from 14 to \n18 October 2017,  \n \nReferring to the World Forum on Intercultural Dialogue, organized biennially \nby Azerbaijan in cooperation with the United Nations Educational, Scientific and \nCultural Organization, the United Nations Alliance of Civilizations, the World Tourism \nOrganization, the Council of Europe and the Islamic Educational, Scientific and \nCultural Organization, as a key global platform for promoting intercultural dialogue, 4  \n \nAcknowledging the positive contribution of individuals and of relevant civil \nsociety organizations to the promotion of interreligious and intercultural dialogue, \nunderstanding and the culture of peace,  \n \nUnderlining the importance of education, including education on culture, peace, \ntolerance, mutual understanding and human rights, in promoting interreligious and \nintercultural dialogue, respect for diversity, and the elimination of discrimination \nbased on religion or belief,  \n \nRecognizing the contributions of the media and of new information and \ncommunications technologies to promoting peoples\u2019 understanding of different \ncultures and religions, including through the promotion of dialogue,  \n \nReaffirming the importance of sustaining the process of engaging all \nstakeholders, including young men and women as relevant actors, in interreligious and \nintercultural dialogue within the appropriate initiatives at various levels, which is aimed \nat challenging prejudices, improving mutual understanding and fostering cooperation,  \n \nRecognizing the commitment of all religions to peace and the contribution that \ninterreligious and intercultural dialogue among religions, groups and individuals, in \nparticular religious leaders, can make towards an improved awareness and \nunderstanding of the common values shared by all humankind, \n \nNoting the Appeal for Peace, signed by religious leaders during the World Day \nof Prayer for Peace, held in Assisi, Italy, on 20 September 2016, \n \nTaking note of the document entitled \u201cHuman fraternity for world peace and \nliving together\u201d, which was signed by Pope Francis and the Grand Imam of Al-Azhar, \nAhmad al-Tayyib, on 4 February 2019 in Abu Dhabi, \n \n1. \nReaffirms that mutual understanding and interreligious and intercultural \ndialogue constitute important dimensions of the dialogue among civilizations and of \nthe culture of peace;  \n \n2. \nTakes note of the report of the Secretary-General on the promotion of a \nculture of peace and interreligious and intercultural dialogue, understanding and \ncooperation for peace;5  \n \n3. \nRecognizes the importance of interreligious and intercultural dialogue and \nits valuable contribution to promoting social cohesion and inclusion, peace and \ndevelopment, and calls upon Member States to consider, as appropriate and where \n__________________ \n \n3 A/HRC/22/17/Add.4, appendix. \n \n4 A/74/476, para. 9. \n \n5 A/74/476. \n\nPromotion of interreligious and intercultural dialogue, \nunderstanding and cooperation for peace \nA/RES/74/23\n \n5/7\n19-21671 \n \napplicable, interreligious and intercultural dialogue as an important tool in efforts \naimed at achieving peace and social stability and the full realization of the Sustainable \nDevelopment Goals;2  \n \n4. \nAlso recognizes the efforts by relevant stakeholders to foster peaceful and \nharmonious coexistence within societies by promoting respect for religious and \ncultural diversity, including by engendering sustained and robust interaction among \nvarious segments of society;  \n \n5. \nFurther recognizes the leading role of the United Nations Educational, \nScientific and Cultural Organization on intercultural dialogue and its contribution to \ninterreligious dialogue, as well as its activities related to the culture of peace and \nnon-violence and its focus on concrete actions at the global, regional and subregional \nlevels, and recognizes the contribution by the United Nations Alliance of Civilizations \nin this regard;  \n \n6. \nEncourages Member States and relevant intergovernmental and \nnon-governmental organizations to continue to consider carrying out activities in \nsupport of the Action Plan for the International Decade for the Rapprochement of \nCultures (2013\u20132022), adopted by the United Nations Educational, Scientific and \nCultural Organization,6 which provides a framework for enhancing interreligious and \nintercultural dialogue and promoting tolerance and mutual understanding, while \nplacing emphasis on the involvement of women and youth in such dialogue;  \n \n7. \nCondemns any advocacy of religious hatred that constitutes incitement to \ndiscrimination, hostility or violence, whether it involves the use of print, audiovisual \nor electronic media, social media or any other means; \n \n8. \nReaffirms the solemn commitment of all States to fulfil their obligations \nand commitments to promote universal respect for and observance and protection of \nall human rights and fundamental freedoms for all in accordance with the Charter of \nthe United Nations, the Universal Declaration of Human Rights 1 and other \ninstruments relating to human rights and international law, the universal nature of \nthese rights and freedoms being beyond question;  \n \n9. \nWelcomes the initiative to open up the Kartarpur Sahib Corridor in the \nspirit of interfaith harmony and peaceful neighbourhood, and appreciates the \nagreement between the Governments of India and Pakistan to allow visa-free access \nto pilgrims of all faiths, especially Nanak Naam Levas and the Sikh community from \nacross the world, as a landmark initiative for interreligious and intercultural \ncooperation for peace; \n \n10. Also welcomes the declarations adopted by the Global Forums of the \nUnited Nations Alliance of Civilizations, and invites relevant stakeholders to continue \ntheir efforts to promote mutual understanding among different civilizations, cultures, \nreligions and beliefs;  \n \n11. \nFurther welcomes the joint statement issued by Spain and Turkey as \nco-sponsors of the United Nations Alliance of Civilizations after the successful \nconclusion of the eighth Global Forum of the Alliance, on the theme \n\u201c#Commit2Dialogue: partnerships for prevention and sustaining peace\u201d, held in New \nYork on 19 and 20 November 2018, and invites relevant stakeholders to continue their \nefforts to promote cross-cultural dialogue and mutual understanding among different \ncivilizations, cultures, religions and beliefs; \n__________________ \n \n6 United Nations Educational, Scientific and Cultural Organization, Executive Board \ndecision 194 EX/10. \n\nA/RES/74/23 \nPromotion of interreligious and intercultural dialogue, \nunderstanding and cooperation for peace\n \n19-21671\n6/7 \n \n \n12. Underlines the importance of moderation as a value within societies for \ncountering violent extremism as and when conducive to terrorism, while respecting \nhuman rights and fundamental freedoms, and for further contributing to the promotion \nof interreligious and intercultural dialogue, tolerance, understanding and cooperation, \nand encourages efforts, as appropriate, to enable voices of moderation to work \ntogether in order to build a more secure, inclusive and peaceful world;  \n \n13. Welcomes the efforts by the media to promote interreligious and \nintercultural dialogue, encourages the further promotion of dialogue among the media \nfrom all cultures and civilizations, emphasizes that everyone has the right to freedom \nof expression, and reaffirms that the exercise of this right carries with it special duties \nand responsibilities and may therefore be subject to certain restrictions, but that these \ncan be only such as are provided by law and necessary for respect of the rights or \nreputations of others, and protection of national security or of public order, or of \npublic health or morals, and are non-discriminatory and applied in a manner that does \nnot obstruct the right to freedom of thought, conscience and religion; \n \n14. Also welcomes the efforts to use information and communications \ntechnologies, including the Internet, to promote interreligious and intercultural \ndialogue, including through the Interfaith Dialogue ePortal established following the \nSpecial Non-Aligned Movement Ministerial Meeting on Interfaith Dialogue and \nCooperation for Peace and Development, held in Manila in 2010, as well as the Peace \nand Dialogue ePortal of the United Nations Educational, Scientific and Cultural \nOrganization, and encourages relevant stakeholders to utilize the opportunity to \ndisseminate their best practices and experiences on interreligious and intercultural \ndialogue by contributing to the Interfaith Dialogue ePortal and to the Peace and \nDialogue ePortal;  \n \n15. Encourages Member States to consider, as and where appropriate, \ninitiatives that identify areas for practical action in all sectors and levels of society \nfor the promotion of interreligious and intercultural dialogue, tolerance, \nunderstanding and cooperation, inter alia, the ideas suggested during the High-level \nDialogue on Interreligious and Intercultural Understanding and Cooperation for \nPeace, held in New York in October 2007, including the idea of an enhanced process \nof dialogue among world religions, as well as the ideas suggested during the third \nHigh Panel on Peace and Dialogue among Cultures, held in Paris in November 2012; \n \n16. Acknowledges the active engagement of the United Nations system with \nfaith-based and cultural organizations and other relevant non-governmental \norganizations in the promotion of interreligious and intercultural dialogue and in \nbringing together people of different cultures, religions, faiths or beliefs to discuss \ncommon issues and objectives; \n \n17. Also acknowledges the important role of civil society, including academia, \nin fostering interreligious and intercultural dialogue, and encourages support for \npractical measures that mobilize civil society, including building capacities, \nopportunities and frameworks for cooperation; \n \n18. Invites Member States to further promote reconciliation to help to ensure \ndurable peace and sustained development, including by working with faith leaders \nand communities and through reconciliatory measures and acts of service and by \nencouraging forgiveness and compassion among individuals;  \n \n19. Recognizes that the Office of Intergovernmental Support and Coordination \nfor Sustainable Development in the Department of Economic and Social Affairs of \nthe Secretariat plays a valuable role as focal point within the Secretariat on the issue, \n\nPromotion of interreligious and intercultural dialogue, \nunderstanding and cooperation for peace \nA/RES/74/23\n \n7/7\n19-21671 \n \nand encourages it to continue to interact and coordinate with the relevant entities of \nthe United Nations system and coordinate their contribution to the intergovernmental \nprocess aimed at promoting interreligious and intercultural dialogue; \n \n20. Requests the Secretary-General to report to the General Assembly at its \nseventy-fifth session on the implementation of the present resolution.  \n \n45th plenary meeting \n12 December 2019 \n \n",
  "paragraphs": {
    "1": "Reaffirms that mutual understanding and interreligious and intercultural dialogue constitute important dimensions of the dialogue among civilizations and of the culture of peace;",
    "2": "Takes note of the report of the Secretary-General on the promotion of a culture of peace and interreligious and intercultural dialogue, understanding and cooperation for peace;5",
    "3": "Recognizes the importance of interreligious and intercultural dialogue and its valuable contribution to promoting social cohesion and inclusion, peace and development, and calls upon Member States to consider, as appropriate and where __________________ 3 A/HRC/22/17/Add.4, appendix. 4 A/74/476, para. 9. 5 A/74/476. Promotion of interreligious and intercultural dialogue, understanding and cooperation for peace A/RES/74/23 5/7 19-21671 applicable, interreligious and intercultural dialogue as an important tool in efforts aimed at achieving peace and social stability and the full realization of the Sustainable Development Goals;2",
    "4": "Also recognizes the efforts by relevant stakeholders to foster peaceful and harmonious coexistence within societies by promoting respect for religious and cultural diversity, including by engendering sustained and robust interaction among various segments of society;",
    "5": "Further recognizes the leading role of the United Nations Educational, Scientific and Cultural Organization on intercultural dialogue and its contribution to interreligious dialogue, as well as its activities related to the culture of peace and non-violence and its focus on concrete actions at the global, regional and subregional levels, and recognizes the contribution by the United Nations Alliance of Civilizations in this regard;",
    "6": "Encourages Member States and relevant intergovernmental and non-governmental organizations to continue to consider carrying out activities in support of the Action Plan for the International Decade for the Rapprochement of Cultures (2013\u20132022), adopted by the United Nations Educational, Scientific and Cultural Organization,6 which provides a framework for enhancing interreligious and intercultural dialogue and promoting tolerance and mutual understanding, while placing emphasis on the involvement of women and youth in such dialogue;",
    "7": "Condemns any advocacy of religious hatred that constitutes incitement to discrimination, hostility or violence, whether it involves the use of print, audiovisual or electronic media, social media or any other means;",
    "8": "Reaffirms the solemn commitment of all States to fulfil their obligations and commitments to promote universal respect for and observance and protection of all human rights and fundamental freedoms for all in accordance with the Charter of the United Nations, the Universal Declaration of Human Rights 1 and other instruments relating to human rights and international law, the universal nature of these rights and freedoms being beyond question;",
    "9": "Welcomes the initiative to open up the Kartarpur Sahib Corridor in the spirit of interfaith harmony and peaceful neighbourhood, and appreciates the agreement between the Governments of India and Pakistan to allow visa-free access to pilgrims of all faiths, especially Nanak Naam Levas and the Sikh community from across the world, as a landmark initiative for interreligious and intercultural cooperation for peace;",
    "10": "Also welcomes the declarations adopted by the Global Forums of the United Nations Alliance of Civilizations, and invites relevant stakeholders to continue their efforts to promote mutual understanding among different civilizations, cultures, religions and beliefs;",
    "11": "Further welcomes the joint statement issued by Spain and Turkey as co-sponsors of the United Nations Alliance of Civilizations after the successful conclusion of the eighth Global Forum of the Alliance, on the theme \u201c#Commit2Dialogue: partnerships for prevention and sustaining peace\u201d, held in New York on 19 and 20 November 2018, and invites relevant stakeholders to continue their efforts to promote cross-cultural dialogue and mutual understanding among different civilizations, cultures, religions and beliefs; __________________ 6 United Nations Educational, Scientific and Cultural Organization, Executive Board decision 194 EX/10. A/RES/74/23 Promotion of interreligious and intercultural dialogue, understanding and cooperation for peace 19-21671 6/7",
    "12": "Underlines the importance of moderation as a value within societies for countering violent extremism as and when conducive to terrorism, while respecting human rights and fundamental freedoms, and for further contributing to the promotion of interreligious and intercultural dialogue, tolerance, understanding and cooperation, and encourages efforts, as appropriate, to enable voices of moderation to work together in order to build a more secure, inclusive and peaceful world;",
    "13": "Welcomes the efforts by the media to promote interreligious and intercultural dialogue, encourages the further promotion of dialogue among the media from all cultures and civilizations, emphasizes that everyone has the right to freedom of expression, and reaffirms that the exercise of this right carries with it special duties and responsibilities and may therefore be subject to certain restrictions, but that these can be only such as are provided by law and necessary for respect of the rights or reputations of others, and protection of national security or of public order, or of public health or morals, and are non-discriminatory and applied in a manner that does not obstruct the right to freedom of thought, conscience and religion;",
    "14": "Also welcomes the efforts to use information and communications technologies, including the Internet, to promote interreligious and intercultural dialogue, including through the Interfaith Dialogue ePortal established following the Special Non-Aligned Movement Ministerial Meeting on Interfaith Dialogue and Cooperation for Peace and Development, held in Manila in 2010, as well as the Peace and Dialogue ePortal of the United Nations Educational, Scientific and Cultural Organization, and encourages relevant stakeholders to utilize the opportunity to disseminate their best practices and experiences on interreligious and intercultural dialogue by contributing to the Interfaith Dialogue ePortal and to the Peace and Dialogue ePortal;",
    "15": "Encourages Member States to consider, as and where appropriate, initiatives that identify areas for practical action in all sectors and levels of society for the promotion of interreligious and intercultural dialogue, tolerance, understanding and cooperation, inter alia, the ideas suggested during the High-level Dialogue on Interreligious and Intercultural Understanding and Cooperation for Peace, held in New York in October 2007, including the idea of an enhanced process of dialogue among world religions, as well as the ideas suggested during the third High Panel on Peace and Dialogue among Cultures, held in Paris in November 2012;",
    "16": "Acknowledges the active engagement of the United Nations system with faith-based and cultural organizations and other relevant non-governmental organizations in the promotion of interreligious and intercultural dialogue and in bringing together people of different cultures, religions, faiths or beliefs to discuss common issues and objectives;",
    "17": "Also acknowledges the important role of civil society, including academia, in fostering interreligious and intercultural dialogue, and encourages support for practical measures that mobilize civil society, including building capacities, opportunities and frameworks for cooperation;",
    "18": "Invites Member States to further promote reconciliation to help to ensure durable peace and sustained development, including by working with faith leaders and communities and through reconciliatory measures and acts of service and by encouraging forgiveness and compassion among individuals;",
    "19": "Recognizes that the Office of Intergovernmental Support and Coordination for Sustainable Development in the Department of Economic and Social Affairs of the Secretariat plays a valuable role as focal point within the Secretariat on the issue, Promotion of interreligious and intercultural dialogue, understanding and cooperation for peace A/RES/74/23 7/7 19-21671 and encourages it to continue to interact and coordinate with the relevant entities of the United Nations system and coordinate their contribution to the intergovernmental process aimed at promoting interreligious and intercultural dialogue;",
    "20": "Requests the Secretary-General to report to the General Assembly at its seventy-fifth session on the implementation of the present resolution. 45th plenary meeting 12 December 2019"
  },
  "agenda_items": [
    "Item 15"
  ],
  "symbol_references": [
    "A/74/L.25"
  ]
}