{
  "symbol": "A/RES/72/103",
  "filename": "A_RES_72_103.pdf",
  "title": "72/103. Question of Montserrat",
  "text": "United Nations \nA/RES/72/103\n \n \nGeneral Assembly \nDistr.: General \n15 December 2017 \n \n17-22137 (E)    191217 \n*1722137* \n \n \nSeventy-second session \nAgenda item 62 \n \n \n \n \n Resolution adopted by the General Assembly \non 7 December 2017 \n \n \n \n \n[on the report of the Special Political and Decolonization Committee \n(Fourth Committee) (A/72/456)] \n \n \n 72/103. Question of Montserrat \n \n \n \nThe General Assembly,  \n \nHaving considered the question of Montserrat and examined the relevant \nchapter of the report of the Special Committee on the Situation with regard to the \nImplementation of the Declaration on the Granting of Independence to Colonial \nCountries and Peoples for 2017,1  \n \nTaking note of the working paper prepared by the Secretariat on Montserrat 2 \nand other relevant information,  \n \nRecognizing that all available options for self-determination of the Territory \nare valid as long as they are in accordance with the freely expressed wishes of the \npeople of Montserrat and in conformity with the clearly defined principles contained \nin General Assembly resolutions 1514 (XV) of 14 December 1960, 1541 (XV) of \n15 December 1960 and other resolutions of the Assembly,  \n \nExpressing concern that 57 years after the adoption of the Declaration on the \nGranting of Independence to Colonial Countries and Peoples, 3 there still remain \n17 Non-Self-Governing Territories, including Montserrat,  \n \nConscious of the importance of continuing the effective implementation of the \nDeclaration, taking into account the target set by the United Nations to eradicate \ncolonialism by 2020 and the plans of action for the Second 4 and Third International \nDecades for the Eradication of Colonialism,  \n__________________ \n \n1  Official Records of the General Assembly, Seventy-second Session, Supplement No. 23 (A/72/23), \nchap. X. \n \n2  A/AC.109/2017/10. \n \n3  Resolution 1514 (XV). \n \n4  A/56/61, annex. \n\nA/RES/72/103 \nQuestion of Montserrat\n \n17-22137 \n2/5 \n \n \nRecognizing that the specific characteristics and the aspirations of the people \nof Montserrat require flexible, practical and innovative approaches to the options \nfor self-determination, without any prejudice to territorial size, geographical \nlocation, size of population or natural resources,  \n \nConvinced that the wishes and aspirations of the people of the Territory should \ncontinue to guide the development of their future political status and that \nreferendums, free and fair elections and other forms of popular consultation play an \nimportant role in ascertaining the wishes and aspirations of the people,  \n \nConcerned by the use and exploitation of the natural resources of the Non-Self-\nGoverning Territories by the administering Powers for their benefit, by the use of the \nTerritories as tax havens to the detriment of the world economy and by the \nconsequences of any economic activities of the administering Powers that are contrary \nto the interests of the people of the Territories, as well as to resolution 1514 (XV),  \n \nConvinced that any negotiations to determine the status of the Territory must \ntake place with the active involvement and participation of the people of the \nTerritory, under the auspices of the United Nations, on a case-by-case basis, and that \nthe views of the people of Montserrat in respect of their right to self-determination \nshould be ascertained,  \n \nNoting the continued cooperation of the Non-Self-Governing Territories at the \nlocal and regional levels, including participation in the work of regional \norganizations,  \n \nMindful that, in order for the Special Committee to enhance its understanding \nof the political status of the people of Montserrat and to fulfil its mandate \neffectively, it is important for it to be apprised by the United Kingdom of Great \nBritain and Northern Ireland as the administering Power and to receive information \nfrom other appropriate sources, including the representatives of the Territory, \nconcerning the wishes and aspirations of the people of the Territory,  \n \nAware of the importance both to Montserrat and to the Special Committee of \nthe participation of elected and appointed representatives of Montserrat in the work \nof the Committee,  \n \nRecognizing the need for the Special Committee to ensure that the appropriate \nbodies of the United Nations actively pursue a public awareness campaign aimed at \nassisting the people of Montserrat with their inalienable right to self-determination \nand in gaining a better understanding of the options for self-determination, on a \ncase-by-case basis,  \n \nMindful, in that connection, that the holding of regional seminars in the \nCaribbean and Pacific regions and at Headquarters, with the active participation of \nrepresentatives of the Non-Self-Governing Territories, provides a helpful means for \nthe Special Committee to fulfil its mandate and that the regional nature of the \nseminars, which alternate between the Caribbean and the Pacific, is a crucial \nelement in the context of a United Nations programme for ascertaining the political \nstatus of the Territories,  \n \nWelcoming the Caribbean regional seminar on the theme \u201cImplementation of \nthe Third International Decade for the Eradication of Colonialism: the future for \ndecolonization in the Non-Self-Governing Territories \u2013 what are the prospects?\u201d, \nheld by the Special Committee in Kingstown and hosted by the Government of \nSaint Vincent and the Grenadines from 16 to 18 May 2017, as a significant and \nforward-looking event, which enabled the participants to assess progress made and \naddress challenges faced in the decolonization process, review the existing working \nmethods of the Committee and renew its commitment to implementing its \nhistoric task,  \n\nQuestion of Montserrat \nA/RES/72/103\n \n3/5 \n17-22137 \n \n \nRecognizing the importance of the conclusions and recommendations adopted \nby the seminar, which are annexed to the report of the Special Committee 5 and \nwhich outline the findings of the seminar, including, especially, the way forward for \nthe decolonization process within the context of the proclamation by the General \nAssembly of the period 2011\u20132020 as the Third International Decade for the \nEradication of Colonialism,6  \n \nTaking into account that the Territory last participated in the activities of the \nSpecial Committee in 2012, and in this regard stressing the importance of the \ncontinued participation of the Territory in order to provide the Committee with \nup-to-date information regarding the decolonization process,  \n \nNoting with appreciation the contribution to the development of some \nTerritories by the specialized agencies and other organizations of the United Nations \nsystem, in particular the Economic Commission for Latin America and the \nCaribbean, the Economic and Social Commission for Asia and the Pacific, the \nUnited Nations Development Programme and the World Food Programme, as well \nas regional institutions such as the Caribbean Development Bank, the Caribbean \nCommunity, the Organization of Eastern Caribbean States, the Pacific Islands \nForum and the agencies of the Council of Regional Organizations in the Pacific, \n \nNoting with concern the continuing consequences of the 1995 volcanic \neruption, which led to the evacuation of three quarters of the population of the \nTerritory to safe areas of the island and to areas outside the Territory and which \ncontinues to have enduring consequences for the economy of the island,  \n \nAcknowledging the continuing assistance provided to the Territory by States \nmembers of the Caribbean Community, in particular Antigua and Barbuda, which \nhas offered safe refuge and access to educational and health facilities, as well as \nemployment for thousands who have left the Territory,  \n \nNoting the continuing efforts of the administering Power and the territorial \nGovernment to deal with the consequences of the volcanic eruption,  \n \nRecalling the importance of improving the infrastructure and accessibility of \nMontserrat, as conveyed by the Premier of Montserrat to the Chair of the Special \nCommittee in their meeting on 11 May 2015,  \n \nCognizant of the potential usefulness of regional ties for the development of a \nsmall island Territory and of the Territory\u2019s membership in the Caribbean Overseas \nCountries and Territories Council,  \n \n1. \nReaffirms the inalienable right of the people of Montserrat to self-\ndetermination, in conformity with the Charter of the United Nations and with \nGeneral Assembly resolution 1514 (XV), containing the Declaration on the Granting \nof Independence to Colonial Countries and Peoples;  \n \n2. \nAlso reaffirms that, in the process of decolonization of Montserrat, there \nis no alternative to the principle of self-determination, which is also a fundamental \nhuman right, as recognized under the relevant human rights conventions;  \n \n3. \nFurther reaffirms that it is ultimately for the people of Montserrat to \ndetermine freely their future political status in accordance with the relevant \nprovisions of the Charter, the Declaration and the relevant resolutions of the General \nAssembly, and in that connection calls upon the administering Power, in cooperation \nwith the territorial Government and appropriate bodies of the United Nations \nsystem, to develop political education programmes for the Territory in order to \n__________________ \n \n5  Official Records of the General Assembly, Seventy-second Session, Supplement No. 23 (A/72/23). \n \n6  See resolution 65/119. \n\nA/RES/72/103 \nQuestion of Montserrat\n \n17-22137 \n4/5 \n \nfoster an awareness among the people of their right to self-determination in \nconformity with the legitimate political status options, based on the principles \nclearly defined in Assembly resolution 1541 (XV) and other relevant resolutions and \ndecisions;  \n \n4. \nRecalls the 2011 Constitution of Montserrat and the work of the \nterritorial Government with respect to moving forward to consolidate the gains \nprovided for in the Constitution;  \n \n5. \nRequests the administering Power to assist the Territory by facilitating its \nwork concerning public outreach efforts, consistent with Article 73 b of the Charter, \nand in that regard calls upon the relevant United Nations organizations to provide \nassistance to the Territory, if requested;  \n \n6. \nWelcomes the Territory\u2019s participation in the work of the Organization of \nEastern Caribbean States and the Economic Commission for Latin America and the \nCaribbean;  \n \n7. \nEncourages the Territory to continue to participate in the activities of the \nSpecial Committee on the Situation with regard to the Implementation of the \nDeclaration on the Granting of Independence to Colonial Countries and Peoples, \nincluding regional seminars;  \n \n8. \nCalls upon the administering Power, the specialized agencies and other \norganizations of the United Nations system, as well as regional and other \norganizations, to continue to provide assistance to the Territory in alleviating the \nconsequences of the volcanic eruption;  \n \n9. \nStresses the importance of the Special Committee being apprised of the \nviews and wishes of the people of Montserrat and enhancing its understanding of \ntheir conditions, including the nature and scope of the existing political and \nconstitutional arrangements between Montserrat and the administering Power;  \n \n10. Calls upon the administering Power to participate in and cooperate fully \nwith the work of the Special Committee in order to implement the provisions of \nArticle 73 e of the Charter and the Declaration and in order to advise the Committee \non the implementation of the provisions under Article 73 b of the Charter on efforts \nto promote self-government in Montserrat, and encourages the administering Power \nto facilitate visiting and special missions to the Territory;  \n \n11. \nReaffirms the responsibility of the administering Power under the Charter \nto promote the economic and social development and preserve the cultural identity \nof the Territory, and requests the administering Power to take steps to enlist and \nmake effective use of all possible assistance, on both a bilateral and a multilateral \nbasis, in the strengthening of the economy of the Territory;  \n \n12. Takes into account the 2030 Agenda for Sustainable Development, 7 \nincluding the Sustainable Development Goals, stresses the importance of fostering \nthe economic and social sustainable development of the Territory by promoting \nsustained, inclusive and equitable economic growth, creating greater opportunities \nfor all, reducing inequalities, raising basic standards of living, fostering equitable \nsocial development and inclusion and promoting the integrated and sustainable \nmanagement of natural resources and ecosystems that supports, inter alia, economic, \nsocial and human development, while facilitating ecosystem conservation, \nregeneration, restoration and resilience in the face of new and emerging challenges, \nand strongly urges the administering Power to refrain from undertaking any kind of \n__________________ \n \n7  Resolution 70/1. \n\nQuestion of Montserrat \nA/RES/72/103\n \n5/5 \n17-22137 \n \nillicit, harmful and unproductive activities, including the use of the Territory as a \ntax haven, that are not aligned with the interest of the people of the Territory;  \n \n13. Requests the Territory and the administering Power to take all measures \nnecessary to protect and conserve the environment of the Territory against any \ndegradation, and once again requests the specialized agencies concerned to monitor \nenvironmental conditions in the Territory and to provide assistance to the Territory, \nconsistent with their prevailing rules of procedure;  \n \n14. Requests the Special Committee to continue to examine the question of \nMontserrat and to report thereon to the General Assembly at its seventy-third \nsession and on the implementation of the present resolution. \n \n66th plenary meeting  \n7 December 2017 \n \n",
  "paragraphs": {
    "1": "Reaffirms the inalienable right of the people of Montserrat to self- determination, in conformity with the Charter of the United Nations and with General Assembly resolution 1514 (XV), containing the Declaration on the Granting of Independence to Colonial Countries and Peoples;",
    "2": "Also reaffirms that, in the process of decolonization of Montserrat, there is no alternative to the principle of self-determination, which is also a fundamental human right, as recognized under the relevant human rights conventions;",
    "3": "Further reaffirms that it is ultimately for the people of Montserrat to determine freely their future political status in accordance with the relevant provisions of the Charter, the Declaration and the relevant resolutions of the General Assembly, and in that connection calls upon the administering Power, in cooperation with the territorial Government and appropriate bodies of the United Nations system, to develop political education programmes for the Territory in order to __________________ 5 Official Records of the General Assembly, Seventy-second Session, Supplement No. 23 (A/72/23). 6 See resolution 65/119. A/RES/72/103 Question of Montserrat 17-22137 4/5 foster an awareness among the people of their right to self-determination in conformity with the legitimate political status options, based on the principles clearly defined in Assembly resolution 1541 (XV) and other relevant resolutions and decisions;",
    "4": "Recalls the 2011 Constitution of Montserrat and the work of the territorial Government with respect to moving forward to consolidate the gains provided for in the Constitution;",
    "5": "Requests the administering Power to assist the Territory by facilitating its work concerning public outreach efforts, consistent with Article 73 b of the Charter, and in that regard calls upon the relevant United Nations organizations to provide assistance to the Territory, if requested;",
    "6": "Welcomes the Territory\u2019s participation in the work of the Organization of Eastern Caribbean States and the Economic Commission for Latin America and the Caribbean;",
    "7": "Encourages the Territory to continue to participate in the activities of the Special Committee on the Situation with regard to the Implementation of the Declaration on the Granting of Independence to Colonial Countries and Peoples, including regional seminars;",
    "8": "Calls upon the administering Power, the specialized agencies and other organizations of the United Nations system, as well as regional and other organizations, to continue to provide assistance to the Territory in alleviating the consequences of the volcanic eruption;",
    "9": "Stresses the importance of the Special Committee being apprised of the views and wishes of the people of Montserrat and enhancing its understanding of their conditions, including the nature and scope of the existing political and constitutional arrangements between Montserrat and the administering Power;",
    "10": "Calls upon the administering Power to participate in and cooperate fully with the work of the Special Committee in order to implement the provisions of Article 73 e of the Charter and the Declaration and in order to advise the Committee on the implementation of the provisions under Article 73 b of the Charter on efforts to promote self-government in Montserrat, and encourages the administering Power to facilitate visiting and special missions to the Territory;",
    "11": "Reaffirms the responsibility of the administering Power under the Charter to promote the economic and social development and preserve the cultural identity of the Territory, and requests the administering Power to take steps to enlist and make effective use of all possible assistance, on both a bilateral and a multilateral basis, in the strengthening of the economy of the Territory;",
    "12": "Takes into account the 2030 Agenda for Sustainable Development, 7 including the Sustainable Development Goals, stresses the importance of fostering the economic and social sustainable development of the Territory by promoting sustained, inclusive and equitable economic growth, creating greater opportunities for all, reducing inequalities, raising basic standards of living, fostering equitable social development and inclusion and promoting the integrated and sustainable management of natural resources and ecosystems that supports, inter alia, economic, social and human development, while facilitating ecosystem conservation, regeneration, restoration and resilience in the face of new and emerging challenges, and strongly urges the administering Power to refrain from undertaking any kind of __________________ 7 Resolution 70/1. Question of Montserrat A/RES/72/103 5/5 17-22137 illicit, harmful and unproductive activities, including the use of the Territory as a tax haven, that are not aligned with the interest of the people of the Territory;",
    "13": "Requests the Territory and the administering Power to take all measures necessary to protect and conserve the environment of the Territory against any degradation, and once again requests the specialized agencies concerned to monitor environmental conditions in the Territory and to provide assistance to the Territory, consistent with their prevailing rules of procedure;",
    "14": "Requests the Special Committee to continue to examine the question of Montserrat and to report thereon to the General Assembly at its seventy-third session and on the implementation of the present resolution. 66th plenary meeting 7 December 2017"
  },
  "agenda_items": [
    "Item 62"
  ],
  "symbol_references": []
}