{
  "symbol": "A/RES/74/1",
  "filename": "A_RES_74_1.pdf",
  "title": "74/1. Scale of assessments for the apportionment of the expenses of the United Nations: requests under Article 19 of the Charter",
  "text": "United Nations \nA/RES/74/1\n \n \nGeneral Assembly \nDistr.: General \n18 October 2019 \n \n19-17548 (E)    221019 \n*1917548* \n \n \nSeventy-fourth session \nAgenda item 139 \nScale of assessments for the apportionment of the expenses \nof the United Nations \n \n \n \n \n Resolution adopted by the General Assembly \non 10 October 2019 \n \n \n \n \n[on the report of the Fifth Committee (A/74/483)] \n \n \n \n74/1. Scale of assessments for the apportionment of the expenses of the \nUnited Nations: requests under Article 19 of the Charter \n \n \n \nThe General Assembly, \n \nHaving considered chapter V of the report of the Committee on Contributions \non its seventy-ninth session,1 \n \nReaffirming the obligation of Member States under Article 17 of the Charter of \nthe United Nations to bear the expenses of the Organization as apportioned by the \nGeneral Assembly,  \n \n1. \nReaffirms its role in accordance with the provisions of Article 19 of the \nCharter of the United Nations and the advisory role of the Committee on \nContributions in accordance with rule 160 of the rules of procedure of the General \nAssembly;  \n \n2. \nAlso reaffirms its resolution 54/237 C of 23 December 1999;  \n \n3. \nRequests the Secretary-General to continue to bring to the attention of \nMember States the deadline specified in resolution 54/237 C, including through an \nearly announcement in the Journal of the United Nations and through direct \ncommunication;  \n \n4. \nUrges all Member States requesting exemption under Article 19 of the \nCharter to submit as much information as possible in support of their requests and to \nconsider submitting such information in advance of the deadline specified in \nresolution 54/237 C so as to enable the collation of any additional detailed \ninformation that may be necessary;  \n__________________ \n \n1 Official Records of the General Assembly, Seventy-fourth Session, Supplement No. 11 (A/74/11). \n\nA/RES/74/1 \nScale of assessments for the apportionment of the expenses of \nthe United Nations: requests under Article 19 of the Charter\n \n19-17548\n2/2 \n \n \n5. \nAgrees that the failure of the Comoros, Sao Tome and Principe and \nSomalia to pay the full minimum amount necessary to avoid the application of Article \n19 of the Charter was due to conditions beyond their control;  \n \n6. \nDecides that the Comoros, Sao Tome and Principe and Somalia shall be \npermitted to vote in the General Assembly until the end of its seventy-fourth session. \n \n14th plenary meeting \n10 October 2019 \n \n",
  "paragraphs": {
    "1": "Reaffirms its role in accordance with the provisions of Article 19 of the Charter of the United Nations and the advisory role of the Committee on Contributions in accordance with rule 160 of the rules of procedure of the General Assembly;",
    "2": "Also reaffirms its resolution 54/237 C of 23 December 1999;",
    "3": "Requests the Secretary-General to continue to bring to the attention of Member States the deadline specified in resolution 54/237 C, including through an early announcement in the Journal of the United Nations and through direct communication;",
    "4": "Urges all Member States requesting exemption under Article 19 of the Charter to submit as much information as possible in support of their requests and to consider submitting such information in advance of the deadline specified in resolution 54/237 C so as to enable the collation of any additional detailed information that may be necessary;",
    "5": "Agrees that the failure of the Comoros, Sao Tome and Principe and Somalia to pay the full minimum amount necessary to avoid the application of Article 19 of the Charter was due to conditions beyond their control;",
    "6": "Decides that the Comoros, Sao Tome and Principe and Somalia shall be permitted to vote in the General Assembly until the end of its seventy-fourth session."
  },
  "agenda_items": [
    "Item 139"
  ],
  "symbol_references": []
}