{
  "symbol": "A/RES/72/194",
  "filename": "A_RES_72_194.pdf",
  "title": "72/194. Technical assistance for implementing the international conventions and protocols related to counter-terrorism",
  "text": "United Nations \nA/RES/72/194\n \n \nGeneral Assembly \nDistr.: General \n23 January 2018 \n \n17-23194 (E)    260118 \n*1723194* \n \n \nSeventy-second session \nAgenda item 107 \n \n \n \n \n Resolution adopted by the General Assembly \non 19 December 2017 \n \n \n \n \n[on the report of the Third Committee (A/72/440)] \n \n \n 72/194. Technical assistance for implementing the international \nconventions and protocols related to counter-terrorism \n \n \n \nThe General Assembly, \n \nRecalling all relevant United Nations resolutions on technical and legislative \nassistance in countering terrorism, especially the most recent ones, 1 \n \nReaffirming its resolution 70/291 of 1 July 2016, entitled \u201cThe United Nations \nGlobal Counter-Terrorism Strategy Review\u201d, \n \nRecalling that terrorism in all its forms and manifestations constitutes one of the \nmost serious threats to peaceful and secure societies and that all acts of terrorism are \ncriminal and unjustifiable, regardless of their motivations, whenever and by \nwhomsoever committed and that they are to be unequivocally condemned, especially \nwhen they indiscriminately target or injure civilians, \n \nStressing again the need to strengthen international, regional and subregional \ncooperation to effectively prevent and combat terrorism, in particular by enhancing \nthe national capacity of States through the provision of technical assistance, based on \nthe needs and priorities identified by requesting States, \n \nEmphasizing the need to address the conditions conducive to the spread of \nterrorism while fully respecting the fundamental principles and purposes of the \nCharter of the United Nations and international law, \n \nRecalling the Declaration and Programme of Action on a Culture of Peace2 and \nthe Global Agenda for Dialogue among Civilizations, 3 \n__________________ \n \n1  General Assembly resolutions 70/148, 70/177, 70/291, 71/151 and 71/209; and Security Council \nresolutions 2133 (2014), 2178 (2014), 2195 (2014), 2199 (2015), 2253 (2015), 2309 (2016), \n2322 (2016), 2341 (2017), 2347 (2017) and 2349 (2017). \n \n2  Resolutions 53/243 A and B. \n \n3  Resolution 56/6. \n\nA/RES/72/194 \nTechnical assistance for implementing the international\nconventions and protocols related to counter-terrorism\n \n17-23194 \n2/5 \n \n \nRecalling in particular its resolution 70/177 of 17 December 2015, in which it, \ninter alia, called upon the United Nations Office on Drugs and Crime to continue to \nprovide technical assistance, upon request, for building the capacity of Member States \nto become party to and implement the international conventions and protocols related \nto counter-terrorism, including through targeted programmes and the training of \nrelevant criminal justice and law enforcement officials, the development of and \nparticipation in relevant initiatives and the elaboration of technical tools and \npublications, in consultation with Member States, \n \nReiterating all aspects of the United Nations Global Counter-Terrorism \nStrategy4 and the need for States to continue to implement the Strategy, as reaffirmed \nin its resolution 70/291, \n \nRecognizing the importance of countering terrorism and preventing violent \nextremism as and when conducive to terrorism, and in that regard stressing the \nimportance of an integrated and balanced implementation of the United Nations \nGlobal Counter-Terrorism Strategy across its four pillars, reaffirming the principal \nresponsibility of Member States to implement the Strategy, \n \nNoting, in that regard, the need to continue to counter terrorism in all its forms \nand manifestations, including any existing, growing or potential links, in some cases, \nbetween transnational organized crime, illicit drug-related activities, money-\nlaundering and the financing of terrorism, in order to enhance criminal justice \nresponses to those crimes, \n \nNoting with appreciation the ongoing work of the United Nations Office on \nDrugs and Crime to support Member States in their efforts to prevent and counter \nterrorism in all its forms and manifestations in the crime prevention and criminal \njustice context, reiterating that that work needs to be done in close coordination with \nMember States, \n \nTaking note of the report of the Secretary-General on technical assistance in \nimplementing the international conventions and protocols related to terrorism, 5 \n \nReaffirming that terrorism in all its forms and manifestations cannot and should \nnot be associated with any religion, nationality, civilization or ethnic group, \n \nRecognizing the ongoing efforts of the Secretary-General to improve the \ncoordination of the work of United Nations entities on counter-terrorism and to ensure \na balanced implementation of all four pillars of the United Nations Global Counter-\nTerrorism Strategy, \n \n1. \nUrges Member States that have not yet done so to consider becoming \nparties to the existing international conventions and protocols related to counter-\nterrorism, and requests the United Nations Office on Drugs and Crime, within its \nmandate, in close coordination with the relevant entities of the Counter-Terrorism \nImplementation Task Force, to continue to provide technical assistance to Member \nStates for the ratification and legislative incorporation of those international legal \ninstruments; \n \n2. \nEncourages Member States to continue to promote, at the national level, \neffective coordination among law enforcement and other relevant entities and \nauthorities responsible for preventing and countering terrorism, and requests the \nUnited Nations Office on Drugs and Crime, upon request and within its mandate, to \ncontinue to provide technical assistance in that regard; \n__________________ \n \n4  Resolution 60/288. \n \n5  E/CN.15/2017/5. \n\nTechnical assistance for implementing the international \nconventions and protocols related to counter-terrorism \nA/RES/72/194\n \n3/5 \n17-23194 \n \n \n3. \nUrges Member States to continue to strengthen international coordination \nand cooperation in order to prevent and counter terrorism in all its forms and \nmanifestations in accordance with international law, including the Charter of the \nUnited Nations, to effectively implement relevant international instruments and \nUnited Nations resolutions, to consider entering, when appropriate, into treaties on \nextradition and mutual legal assistance, and to ensure adequate training of all relevant \npersonnel on executing international cooperation activities, and calls upon all States \nto consider providing the United Nations Office on Drugs and Crime with the contact \ndetails of and other relevant information about designated authorities for its \nrepository database; \n \n4. \nRequests the United Nations Office on Drugs and Crime, within its \nmandate, to provide technical assistance, upon request, to Member States to those \nends, including by continuing and enhancing its assistance related to international \nlegal and judicial cooperation pertaining to countering terrorism, including in \ncriminal matters related to foreign terrorist fighters, and by fostering the development \nof strong and effective central authorities for international cooperation in criminal \nmatters; \n \n5. \nStresses the importance of the development and maintenance of effective, \nfair, humane, transparent and accountable criminal justice systems in accordance with \napplicable international law, as a fundamental basis of any strategy to counter \nterrorism, and requests the United Nations Office on Drugs and Crime, whenever \nappropriate, to take into account in its technical assistance to counter terrorism the \nelements necessary for building national capacity in order to strengthen criminal \njustice systems and the rule of law; \n \n6. \nRequests the United Nations Office on Drugs and Crime, within its \nmandate in the area of countering and preventing terrorism in all its forms and \nmanifestations, to continue to develop specialized legal knowledge and to continue to \nstrengthen the provision of technical assistance to Member States, upon request, on \neffective measures for criminal justice responses addressing the prevention of \nterrorism in compliance with all their obligations under international law, in particular \nhuman rights, refugee and humanitarian law, in full conformity with human rights and \nfundamental freedoms; \n \n7. \nCalls upon the United Nations Office on Drugs and Crime to further \nenhance technical assistance, upon request, for building the capacity of Member \nStates to become party to and implement the international conventions and protocols \nrelated to counter-terrorism, including through targeted programmes and the training \nof relevant criminal justice and law enforcement officials, upon request, to develop \ntheir capacity to effectively respond to, prevent, investigate and prosecute terrorist \nacts, the development of and participation in relevant initiatives and the development \nof technical tools and publications, within its mandate and in close consultation with \nMember States; \n \n8. \nRequests the United Nations Office on Drugs and Crime, within its mandate \nand in collaboration with, when appropriate, the Counter-Terrorism Committee and its \nExecutive Directorate and the Counter-Terrorism Implementation Task Force, to \ncontinue to provide assistance to requesting Member States in addressing the threat of \nforeign terrorist fighters, including returning foreign terrorist fighters, through its \ncapacity-building activities, with regard to enhancing their cooperation, developing \nrelevant measures and developing appropriate criminal justice responses, to prevent \nthe financing, mobilization, travel, recruitment, organization and radicalization of \nforeign terrorist fighters, to ensure that any person who participates in the financing, \nplanning, preparation or perpetration of terrorist acts or in supporting terrorist acts is \nbrought to justice, and to develop and implement appropriate criminal justice \n\nA/RES/72/194 \nTechnical assistance for implementing the international\nconventions and protocols related to counter-terrorism\n \n17-23194 \n4/5 \n \nresponses, including prosecution and effective reintegration strategies for returning \nforeign terrorist fighters, in compliance with relevant obligations under international \nand domestic law; \n \n9. \nEncourages Member States to further identify, analyse and counter any \nexisting, growing or potential links, in some cases, between transnational organized \ncrime, illicit drug-related activities, money-laundering and the financing of terrorism, \nin order to enhance criminal justice responses to those crimes, and calls upon the \nUnited Nations Office on Drugs and Crime, within its relevant mandates, to support, \nupon request, the efforts of Member States in that regard; \n \n10. Calls upon Member States to strengthen border management to effectively \nprevent the movements of foreign terrorist fighters and terrorist groups, and requests \nthe United Nations Office on Drugs and Crime to continue to provide technical \nassistance to that end to requesting States; \n \n11. \nRequests the United Nations Office on Drugs and Crime, within its \nmandate, to continue to support requesting Member States in the implementation of \ncapacity-building programmes to strengthen crime prevention and criminal justice \nresponses to the destruction of and trafficking in cultural heritage by terrorists; \n \n12. Also requests the United Nations Office on Drugs and Crime, within its \nmandate, to continue to develop its specialized legal knowledge in close consultation \nwith Member States in order to continue to provide assistance to requesting Member \nStates so as to prevent and counter the use of information and communications \ntechnology, in particular the Internet and other media, to plan, incite, recruit for, fund \nor commit terrorist attacks, and to support those Member States in effectively \ncriminalizing, investigating and prosecuting such acts in accordance with domestic law \nand applicable international law on due process while fully respecting human rights and \nfundamental freedoms, including the right to privacy and the freedom of expression, \nand to encourage the use of the Internet as a tool for countering the spread of terrorism; \n \n13. Further requests the United Nations Office on Drugs and Crime to \nprovide, upon request, technical assistance for building the capacity of Member States \nin the development and implementation of programmes of assistance and support for \nvictims of terrorism in accordance with relevant national legislation, with emphasis \non the special needs of women and children; \n \n14. Requests the United Nations Office on Drugs and Crime, through its \nGlobal Programme on Violence against Children, to continue to support requesting \nMember States, in accordance with relevant national legislation, in ensuring that \nchildren alleged to have, accused of having, or recognized as having infringed the \nlaw, particularly those who are deprived of their liberty, as well as child victims and \nwitnesses of crime, are treated in a manner that observes their rights and respects their \ndignity in accordance with applicable international law, in particular the obligations \nunder the Convention on the Rights of the Child,6 and that relevant measures are taken \nto effectively reintegrate children formerly associated with armed groups and terrorist \ngroups; \n \n15. Encourages the United Nations Office on Drugs and Crime to assist \nMember States, upon request, in mainstreaming gender perspectives into criminal \njustice responses to terrorism, in full compliance with human rights law, in order to \nprevent the recruitment of women and girls as terrorists and promote the full \nprotection of women and girls from any form of exploitation or violence perpetrated \nby terrorists; \n \n16. Urges the United Nations Office on Drugs and Crime, in coordination with \nthe Counter-Terrorism Committee and its Executive Directorate and the Counter-\n__________________ \n \n6  United Nations, Treaty Series, vol. 1577, No. 27531. \n\nTechnical assistance for implementing the international \nconventions and protocols related to counter-terrorism \nA/RES/72/194\n \n5/5 \n17-23194 \n \nTerrorism Implementation Task Force, to continue to strengthen its cooperation with \ninternational organizations and relevant entities of the United Nations system, as well \nas with international, regional and subregional organizations and arrangements, in the \ndelivery of technical assistance, whenever appropriate, and notes the ongoing joint \ninitiatives developed by the Office with the Committee and its Executive Directorate \nand the entities of the Task Force; \n \n17. Expresses its appreciation to Member States that have supported the \ntechnical assistance activities of the United Nations Office on Drugs and Crime, \nincluding through financial contributions, and invites Member States to consider \nmaking additional sustainable voluntary financial contributions and providing in-kind \nsupport, in particular in view of the need for enhanced and effective delivery of \ntechnical assistance to assist Member States with the implementation of the relevant \nprovisions of the United Nations Global Counter-Terrorism Strategy;4 \n \n18. Requests the Secretary-General to continue to provide the United Nations \nOffice on Drugs and Crime with sufficient resources to carry out activities, within its \nmandate, to assist Member States, upon request, in the implementation of the relevant \nelements of the United Nations Global Counter-Terrorism Strategy; \n \n19. Also requests the Secretary-General to submit to the General Assembly at \nits seventy-third session a report on the implementation of the present resolution. \n \n73rd plenary meeting  \n19 December 2017 \n \n",
  "paragraphs": {
    "1": "Urges Member States that have not yet done so to consider becoming parties to the existing international conventions and protocols related to counter- terrorism, and requests the United Nations Office on Drugs and Crime, within its mandate, in close coordination with the relevant entities of the Counter-Terrorism Implementation Task Force, to continue to provide technical assistance to Member States for the ratification and legislative incorporation of those international legal instruments;",
    "2": "Encourages Member States to continue to promote, at the national level, effective coordination among law enforcement and other relevant entities and authorities responsible for preventing and countering terrorism, and requests the United Nations Office on Drugs and Crime, upon request and within its mandate, to continue to provide technical assistance in that regard;",
    "3": "Urges Member States to continue to strengthen international coordination and cooperation in order to prevent and counter terrorism in all its forms and manifestations in accordance with international law, including the Charter of the United Nations, to effectively implement relevant international instruments and United Nations resolutions, to consider entering, when appropriate, into treaties on extradition and mutual legal assistance, and to ensure adequate training of all relevant personnel on executing international cooperation activities, and calls upon all States to consider providing the United Nations Office on Drugs and Crime with the contact details of and other relevant information about designated authorities for its repository database;",
    "4": "Requests the United Nations Office on Drugs and Crime, within its mandate, to provide technical assistance, upon request, to Member States to those ends, including by continuing and enhancing its assistance related to international legal and judicial cooperation pertaining to countering terrorism, including in criminal matters related to foreign terrorist fighters, and by fostering the development of strong and effective central authorities for international cooperation in criminal matters;",
    "5": "Stresses the importance of the development and maintenance of effective, fair, humane, transparent and accountable criminal justice systems in accordance with applicable international law, as a fundamental basis of any strategy to counter terrorism, and requests the United Nations Office on Drugs and Crime, whenever appropriate, to take into account in its technical assistance to counter terrorism the elements necessary for building national capacity in order to strengthen criminal justice systems and the rule of law;",
    "6": "Requests the United Nations Office on Drugs and Crime, within its mandate in the area of countering and preventing terrorism in all its forms and manifestations, to continue to develop specialized legal knowledge and to continue to strengthen the provision of technical assistance to Member States, upon request, on effective measures for criminal justice responses addressing the prevention of terrorism in compliance with all their obligations under international law, in particular human rights, refugee and humanitarian law, in full conformity with human rights and fundamental freedoms;",
    "7": "Calls upon the United Nations Office on Drugs and Crime to further enhance technical assistance, upon request, for building the capacity of Member States to become party to and implement the international conventions and protocols related to counter-terrorism, including through targeted programmes and the training of relevant criminal justice and law enforcement officials, upon request, to develop their capacity to effectively respond to, prevent, investigate and prosecute terrorist acts, the development of and participation in relevant initiatives and the development of technical tools and publications, within its mandate and in close consultation with Member States;",
    "8": " responses, including prosecution and effective reintegration strategies for returning foreign terrorist fighters, in compliance with relevant obligations under international and domestic law;",
    "9": "Encourages Member States to further identify, analyse and counter any existing, growing or potential links, in some cases, between transnational organized crime, illicit drug-related activities, money-laundering and the financing of terrorism, in order to enhance criminal justice responses to those crimes, and calls upon the United Nations Office on Drugs and Crime, within its relevant mandates, to support, upon request, the efforts of Member States in that regard;",
    "10": "Calls upon Member States to strengthen border management to effectively prevent the movements of foreign terrorist fighters and terrorist groups, and requests the United Nations Office on Drugs and Crime to continue to provide technical assistance to that end to requesting States;",
    "11": "Requests the United Nations Office on Drugs and Crime, within its mandate, to continue to support requesting Member States in the implementation of capacity-building programmes to strengthen crime prevention and criminal justice responses to the destruction of and trafficking in cultural heritage by terrorists;",
    "12": "Also requests the United Nations Office on Drugs and Crime, within its mandate, to continue to develop its specialized legal knowledge in close consultation with Member States in order to continue to provide assistance to requesting Member States so as to prevent and counter the use of information and communications technology, in particular the Internet and other media, to plan, incite, recruit for, fund or commit terrorist attacks, and to support those Member States in effectively criminalizing, investigating and prosecuting such acts in accordance with domestic law and applicable international law on due process while fully respecting human rights and fundamental freedoms, including the right to privacy and the freedom of expression, and to encourage the use of the Internet as a tool for countering the spread of terrorism;",
    "13": "Further requests the United Nations Office on Drugs and Crime to provide, upon request, technical assistance for building the capacity of Member States in the development and implementation of programmes of assistance and support for victims of terrorism in accordance with relevant national legislation, with emphasis on the special needs of women and children;",
    "14": "Requests the United Nations Office on Drugs and Crime, through its Global Programme on Violence against Children, to continue to support requesting Member States, in accordance with relevant national legislation, in ensuring that children alleged to have, accused of having, or recognized as having infringed the law, particularly those who are deprived of their liberty, as well as child victims and witnesses of crime, are treated in a manner that observes their rights and respects their dignity in accordance with applicable international law, in particular the obligations under the Convention on the Rights of the Child,6 and that relevant measures are taken to effectively reintegrate children formerly associated with armed groups and terrorist groups;",
    "15": "Encourages the United Nations Office on Drugs and Crime to assist Member States, upon request, in mainstreaming gender perspectives into criminal justice responses to terrorism, in full compliance with human rights law, in order to prevent the recruitment of women and girls as terrorists and promote the full protection of women and girls from any form of exploitation or violence perpetrated by terrorists;",
    "16": "Urges the United Nations Office on Drugs and Crime, in coordination with the Counter-Terrorism Committee and its Executive Directorate and the Counter- Terrorism Implementation Task Force, to continue to strengthen its cooperation with international organizations and relevant entities of the United Nations system, as well as with international, regional and subregional organizations and arrangements, in the delivery of technical assistance, whenever appropriate, and notes the ongoing joint initiatives developed by the Office with the Committee and its Executive Directorate and the entities of the Task Force;",
    "17": "Expresses its appreciation to Member States that have supported the technical assistance activities of the United Nations Office on Drugs and Crime, including through financial contributions, and invites Member States to consider making additional sustainable voluntary financial contributions and providing in-kind support, in particular in view of the need for enhanced and effective delivery of technical assistance to assist Member States with the implementation of the relevant provisions of the United Nations Global Counter-Terrorism Strategy;4",
    "18": "Requests the Secretary-General to continue to provide the United Nations Office on Drugs and Crime with sufficient resources to carry out activities, within its mandate, to assist Member States, upon request, in the implementation of the relevant elements of the United Nations Global Counter-Terrorism Strategy;",
    "19": "Also requests the Secretary-General to submit to the General Assembly at its seventy-third session a report on the implementation of the present resolution."
  },
  "agenda_items": [
    "Item 107"
  ],
  "symbol_references": []
}