{
  "symbol": "A/RES/76/75",
  "filename": "A_RES_76_75.pdf",
  "title": "76/75. Effects of atomic radiation",
  "text": "United Nations \nA/RES/76/75\n \n \nGeneral Assembly \nDistr.: General \n15 December 2021 \n \n21-18617 (E)    201221 \n*2118617* \n \n \nSeventy-sixth session \nAgenda item 52 \nEffects of atomic radiation  \n \n \n \n \n Resolution adopted by the General Assembly \non 9 December 2021 \n \n \n \n \n[on the report of the Special Political and Decolonization Committee \n(Fourth Committee) (A/76/414, para. 8)] \n \n \n \n76/75. Effects of atomic radiation \n \n \n \nThe General Assembly,  \n \nRecalling its resolution 913 (X) of 3 December 1955, by which it established \nthe United Nations Scientific Committee on the Effects of Atomic Radiation, and its \nsubsequent resolutions on the subject, in which, inter alia, it requested the Scientific \nCommittee to continue its work, \n \nConcerned about the potentially harmful effects on present and future \ngenerations resulting from the levels of radiation to which humankind and the \nenvironment are exposed, \n \nConscious of the continuing need to examine and compile information about \natomic and ionizing radiation and to analyse its effects on humankind and the \nenvironment, and conscious also of the increased volume, complexity and diversity \nof that information,  \n \nAcknowledging the concerns about the radiological consequences of nuclear \naccidents,  \n \nReaffirming the desirability of the Scientific Committee continuing its work, \nand welcoming the increased commitment of States members of the Committee,  \n \nEmphasizing the vital need for sufficient, assured and predictable funding, as \nwell as efficient management, of the work of the secretariat of the Scientific \nCommittee to arrange the annual sessions and coordinate the development of \ndocuments based on scientific reviews of the sources of ionizing radiation and its \neffects on human health and the environment,  \n \nRecognizing the increasing importance of the scientific work of the Scientific \nCommittee and the need to carry out unforeseen additional work, such as after the \naccident at the Fukushima Daiichi nuclear power station, \n\nA/RES/76/75 \nEffects of atomic radiation \n \n21-18617\n2/5 \n \n \nConsidering that the high quality of the work and the scientific rigour of the \nScientific Committee need to be maintained in the future,  \n \nRecognizing the importance of disseminating the findings of the Scientific \nCommittee, in particular to the public, and widely publicizing scientific knowledge \nabout atomic radiation, and recalling in that context principle 10 of the Rio \nDeclaration on Environment and Development,1 \n \nNoting the need for the resources of the Scientific Committee to be sufficient, \nassured and predictable, and recognizing the importance of voluntary contributions \nto the general trust fund established by the Executive Director of the United Nations \nEnvironment Programme to support the work of the Committee,  \n \nReferring to paragraphs 20 and 21 of its resolution 73/261 of 22 December 2018, \nand confirming that Algeria, Iran (Islamic Republic of), Norway and the United Arab \nEmirates, in accordance with paragraph 18 of its resolution 71/89 of 6 December \n2016, expressed their interest to become members of the Scientific Committee, \n \nAcknowledging the attendance of Algeria, Iran (Islamic Republic of), Norway \nand the United Arab Emirates as observers at the sixty-fifth to sixty-eighth sessions \nof the Scientific Committee,  \n \nBearing in mind that the incorporation of new members will imply a \nproportional increase in operational costs for the Scientific Committee, including \ntravel costs,  \n \nCommending the secretariat of the Scientific Committee for its ongoing efforts \nto ensure the sustainable and effective work of the Committee, and encouraging all \nStates in a position to do so to provide support to the secretariat of the Committee,  \n \nRecalling the support expressed by the International Atomic Energy Agency and \nthe World Health Organization for the Scientific Committee\u2019s work in producing the \nmost reliable and comprehensive sources of scientific information about the levels \nand effects of ionizing radiation, without which safety guidance and safety standards \ncould not be developed and maintained and priorities for research in the areas of \nsources and effects of ionizing radiation could not be determined,  \n \nRecognizing that sufficient staffing of the secretariat is essential to support the \nwork of the Scientific Committee,  \n \nRecognizing also the challenges faced by the Scientific Committee in \nundertaking its important work throughout the coronavirus disease (COVID-19) \npandemic, \n \n1. \nCommends the United Nations Scientific Committee on the Effects of \nAtomic Radiation for the valuable contribution that it has been making since its \ninception to wider knowledge and understanding of the levels, effects and risks of \nexposure to ionizing radiation and for fulfilling its original mandate with scientific \nauthority and independence of judgment;  \n \n2. \nReaffirms the decision to maintain the present functions and independent \nrole of the Scientific Committee; \n \n3. \nRe-emphasizes the need for the Scientific Committee to hold regular \nsessions on an annual basis so that its report will be able to reflect the latest \n__________________ \n \n1  Report of the United Nations Conference on Environment and Development, Rio de Janeiro, 3\u201314 June \n1992, vol. I, Resolutions Adopted by the Conference (United Nations publication, Sales No. E.93.I.8 and \ncorrigendum), resolution 1, annex I. \n\nEffects of atomic radiation \nA/RES/76/75\n \n3/5\n21-18617 \n \ndevelopments and findings in the field of ionizing radiation and thereby provide \nupdated information for dissemination among all States; \n \n4. \nCommends the Scientific Committee and secretariat for its ongoing efforts \nto fulfil its mandate throughout the COVID-19 pandemic;  \n \n5. \nNotes with appreciation the work of the Scientific Committee, takes note \nof the report on its sixty-seventh and sixty-eighth sessions,2 including the report on \nthe implementation of its long-term strategic directions, 3  and encourages the \nCommittee, over its coming sessions, to continue to work towards implementing \nstrategies to support its long-term efforts to serve the scientific community, as well \nas wider audiences;  \n \n6. \nWelcomes the continuation of the ad hoc working group on effects and \nmechanisms and the ad hoc working group on sources and exposure to assist the \nScientific Committee in developing its future programme of work on the effects of \nradiation exposure and the biological mechanisms by which they occur, as well as on \nglobal estimates of radiation sources and levels of exposure and an updated strategy \nfor data collection, analysis and dissemination;  \n \n7. \nAlso welcomes the four substantive scientific reports adopted by the \nScientific Committee during its sixty-seventh and sixty-eighth sessions, on biological \nmechanisms relevant for the inference of cancer risk from low-dose and low-dose-\nrate radiation exposure, the levels and effects of radiation exposure due to the accident \nat the Fukushima Daiichi nuclear power station: implications of information \npublished since the 2013 report of the Committee, and the evaluations of medical and \noccupational exposure to ionizing radiation, and looks forward to the publication of \nthe supporting scientific annexes thereto as their outcomes are relied upon by other \ninternational organizations;  \n \n8. \nEncourages the secretariat of the Scientific Committee to disseminate the \nfindings of the Committee\u2019s updated evaluation on the accident at the Fukushima \nDaiichi nuclear power station, released on 9 March 2021, in particular to the public;  \n \n9. \nNotes the progress of the ongoing evaluations on second primary cancer \nafter radiation therapy, on epidemiological studies of radiation and cancer and on \npublic exposure due to ionizing radiation from natural and other sources;  \n \n10. Requests the Scientific Committee to continue its work, including its \nimportant activities to increase knowledge of the levels, effects and risks of ionizing \nradiation from all sources, and to report thereon to the General Assembly at its \nseventy-seventh session;  \n \n11. Supports the Scientific Committee in continuing to conduct its programme \nof work of scientific review and assessment on behalf of the General Assembly, in \nparticular its global survey of public radiation exposure, its assessments of second \nprimary cancer after radiotherapy, epidemiological studies of radiation and cancer, \nand the new evaluation on diseases of the circulatory system from radiation exposure, \nwhich are being conducted in close cooperation with other relevant organizations, and \nrequests the Committee to submit plans for its ongoing and future programme of work \nto the Assembly at its seventy-seventh session; \n \n12. Welcomes developments in streamlining procedures for publishing the \nreports of the Scientific Committee electronically on its official website and as sales \npublications, and calls upon the secretariat to continue both to monitor the timely \n__________________ \n \n2  Official Records of the General Assembly, Seventy-sixth Session, Supplement No. 46 (A/76/46). \n \n3  Ibid., part one, chap. II, sect. C, and part two, chap. V, sect. C. \n\nA/RES/76/75 \nEffects of atomic radiation \n \n21-18617\n4/5 \n \npublication of those reports and to strive to publish them within the same calendar \nyear as their approval; \n \n13. Invites the Scientific Committee to continue its consultations with \nscientists and experts from interested Member States in the process of preparing its \nfuture scientific reports, and requests the secretariat to continue to facilitate such \nconsultations; \n \n14. Welcomes, in this context, the readiness of Member States to provide the \nScientific Committee with relevant information on the levels and effects of ionizing \nradiation, and invites the Committee to analyse and give due consideration to such \ninformation, particularly in the light of its own findings;  \n \n15. Recalls the strategy of the Scientific Committee to improve data \ncollection, encourages in this regard Member States, the organizations of the United \nNations system and non-governmental organizations concerned to provide further \nrelevant data about levels, effects and risks of radiation exposure from various \nsources, which would greatly help in the preparation of future reports of the \nCommittee to the General Assembly, and encourages the International Atomic Energy \nAgency, the World Health Organization, the International Labour Organization and \nother relevant organizations to further collaborate with the secretariat on \narrangements for the collection, analysis and dissemination of data on radiation \nexposures of patients, workers and the public;  \n \n16. Welcomes the use and ongoing development by the secretariat of an online \nplatform for collecting data on the exposure of patients, workers and the public, and \nurges Member States to take part in the Scientific Committee\u2019s global survey of public \nexposure and to nominate national contact persons to facilitate coordination of the \ncollection and submission of data on the exposure of patients, workers and the public \nwithin the country;  \n \n17. Also welcomes the Scientific Committee\u2019s outreach strategy for the period \n2020\u20132024, in particular the enhancement of the website of the Committee and the \npublication of information for the general public in all the official languages of the \nUnited Nations, continues to encourage that consideration be given to publishing the \nwebsite in all of those languages, and notes that the dissemination of the Committee\u2019s \nfindings and further enhancements to the website would depend on the financial and \nhuman resources made available to the secretariat;  \n \n18. Requests the United Nations Environment Programme to continue, within \nexisting United Nations resources, to service the Scientific Committee and to \ndisseminate its findings to Member States, the scientific community and the public \nand to ensure that the administrative measures in place are appropriate, including \nclear roles and responsibilities of the various actors, so that the secretariat is able to \nadequately and efficiently service the Committee in a predictable and sustainable \nmanner and effectively facilitate the use of the invaluable expertise offered to the \nCommittee by its members in order that the Committee may discharge the \nresponsibilities and mandate entrusted to it by the General Assembly;  \n \n19. Urges the United Nations Environment Programme to ensure that future \nrecruitment processes are conducted in an efficient, effective, timely and transparent \nmanner;  \n \n20. Welcomes the appointment of a Deputy Secretary, which replaces the \nprevious post of Scientific Officer, allows for the deputization of the Deputy Secretary \nas Secretary as appropriate and assists in the avoidance of disruptions in staffing; \n \n21. Requests the Secretary-General to strengthen support for the Scientific \nCommittee within existing United Nations resources, particularly with regard to the \n\nEffects of atomic radiation \nA/RES/76/75\n \n5/5\n21-18617 \n \nconcerns raised by the Committee in relation to resourcing, and with regard to the \nincrease of operational costs in the case of the increase in membership, and to report \nto the General Assembly at its seventy-seventh session on these issues;  \n \n22. Encourages Member States in a position to do so to make voluntary \ncontributions to the general trust fund established by the Executive Director of the \nUnited Nations Environment Programme and also to make contributions in kind, in \norder to support the work of the Scientific Committee, and the dissemination of its \nfindings, in a sustainable manner; \n \n23. Recalls that Algeria, Iran (Islamic Republic of), Norway and the United \nArab Emirates each designated one scientist to attend the sixty-fifth to sixty-eighth \nsessions of the Scientific Committee as an observer, pursuant to paragraph 19 of \nGeneral Assembly resolution 72/76 of 7 December 2017 and to the procedures \nreferred to in paragraph 21 of Assembly resolution 73/261 of 22 December 2018;4 \n \n24. Also recalls the procedure for the possible further increases in membership \nof the Scientific Committee as adopted in paragraph 21 of General Assembly \nresolution 73/261, pursuant to paragraph 19 of Assembly resolution 66/70 of \n9 December 2011; \n \n25. Recognizes the advice of the Scientific Committee to the General \nAssembly that, in its opinion, all four observer States compare favourably against the \nSecretary-General\u2019s suggested framework of criteria and indicators for membership;5 \n \n26. Acknowledges the advice of the Secretary-General that the addition of all \nfour observer States to the Scientific Committee will incur additional annual \noperational costs for the Committee, to be funded from existing United Nations \nresources;6 \n \n27. Notes the Secretary-General\u2019s report, in which it is stated that changes to \nthe membership of the Scientific Committee ought to be to primarily enhance the \neffectiveness of its substantive work,7 and the Committee\u2019s serious concern about its \nability to successfully implement its future programme of work in a timely manner, \nin particular with regard to the increased number of experts involved in its ongoing \nevaluations,8 and looks forward with anticipation to the Committee\u2019s consideration of \nthese challenges in its report to the General Assembly at its seventy-seventh session;9 \n \n28. Invites Algeria, Iran (Islamic Republic of), Norway and the United Arab \nEmirates to become members of the Scientific Committee, and requests the \nGovernment of each of those States to designate one scientist, with alternates and \nconsultants, as appropriate, to be its representative on the Committee. \n \n49th plenary meeting \n9 December 2021 \n \n__________________ \n \n4  See resolutions 74/81 and 75/91. \n \n5  See Official Records of the General Assembly, Seventy-sixth Session, Supplement No. 46 \n(A/76/46), part two, chap. V, sect. E. \n \n6  A/76/279, para. 22. \n \n7  Ibid., summary, and A/66/524, para. 21. \n \n8  A/76/279, para. 16. \n \n9  Ibid., para. 22. \n",
  "paragraphs": {
    "1": "Commends the United Nations Scientific Committee on the Effects of Atomic Radiation for the valuable contribution that it has been making since its inception to wider knowledge and understanding of the levels, effects and risks of exposure to ionizing radiation and for fulfilling its original mandate with scientific authority and independence of judgment;",
    "2": "Reaffirms the decision to maintain the present functions and independent role of the Scientific Committee;",
    "3": "Re-emphasizes the need for the Scientific Committee to hold regular sessions on an annual basis so that its report will be able to reflect the latest __________________ 1 Report of the United Nations Conference on Environment and Development, Rio de Janeiro, 3\u201314 June 1992, vol. I, Resolutions Adopted by the Conference (United Nations publication, Sales No. E.93.I.8 and corrigendum), resolution 1, annex I. Effects of atomic radiation A/RES/76/75 3/5 21-18617 developments and findings in the field of ionizing radiation and thereby provide updated information for dissemination among all States;",
    "4": "Commends the Scientific Committee and secretariat for its ongoing efforts to fulfil its mandate throughout the COVID-19 pandemic;",
    "5": "Notes with appreciation the work of the Scientific Committee, takes note of the report on its sixty-seventh and sixty-eighth sessions,2 including the report on the implementation of its long-term strategic directions, 3 and encourages the Committee, over its coming sessions, to continue to work towards implementing strategies to support its long-term efforts to serve the scientific community, as well as wider audiences;",
    "6": "Welcomes the continuation of the ad hoc working group on effects and mechanisms and the ad hoc working group on sources and exposure to assist the Scientific Committee in developing its future programme of work on the effects of radiation exposure and the biological mechanisms by which they occur, as well as on global estimates of radiation sources and levels of exposure and an updated strategy for data collection, analysis and dissemination;",
    "7": "Also welcomes the four substantive scientific reports adopted by the Scientific Committee during its sixty-seventh and sixty-eighth sessions, on biological mechanisms relevant for the inference of cancer risk from low-dose and low-dose- rate radiation exposure, the levels and effects of radiation exposure due to the accident at the Fukushima Daiichi nuclear power station: implications of information published since the 2013 report of the Committee, and the evaluations of medical and occupational exposure to ionizing radiation, and looks forward to the publication of the supporting scientific annexes thereto as their outcomes are relied upon by other international organizations;",
    "8": "Encourages the secretariat of the Scientific Committee to disseminate the findings of the Committee\u2019s updated evaluation on the accident at the Fukushima Daiichi nuclear power station, released on 9 March 2021, in particular to the public;",
    "9": "Notes the progress of the ongoing evaluations on second primary cancer after radiation therapy, on epidemiological studies of radiation and cancer and on public exposure due to ionizing radiation from natural and other sources;",
    "10": "Requests the Scientific Committee to continue its work, including its important activities to increase knowledge of the levels, effects and risks of ionizing radiation from all sources, and to report thereon to the General Assembly at its seventy-seventh session;",
    "11": "Supports the Scientific Committee in continuing to conduct its programme of work of scientific review and assessment on behalf of the General Assembly, in particular its global survey of public radiation exposure, its assessments of second primary cancer after radiotherapy, epidemiological studies of radiation and cancer, and the new evaluation on diseases of the circulatory system from radiation exposure, which are being conducted in close cooperation with other relevant organizations, and requests the Committee to submit plans for its ongoing and future programme of work to the Assembly at its seventy-seventh session;",
    "12": "Welcomes developments in streamlining procedures for publishing the reports of the Scientific Committee electronically on its official website and as sales publications, and calls upon the secretariat to continue both to monitor the timely __________________ 2 Official Records of the General Assembly, Seventy-sixth Session, Supplement No. 46 (A/76/46). 3 Ibid., part one, chap. II, sect. C, and part two, chap. V, sect. C. A/RES/76/75 Effects of atomic radiation 21-18617 4/5 publication of those reports and to strive to publish them within the same calendar year as their approval;",
    "13": "Invites the Scientific Committee to continue its consultations with scientists and experts from interested Member States in the process of preparing its future scientific reports, and requests the secretariat to continue to facilitate such consultations;",
    "14": "Welcomes, in this context, the readiness of Member States to provide the Scientific Committee with relevant information on the levels and effects of ionizing radiation, and invites the Committee to analyse and give due consideration to such information, particularly in the light of its own findings;",
    "15": "Recalls the strategy of the Scientific Committee to improve data collection, encourages in this regard Member States, the organizations of the United Nations system and non-governmental organizations concerned to provide further relevant data about levels, effects and risks of radiation exposure from various sources, which would greatly help in the preparation of future reports of the Committee to the General Assembly, and encourages the International Atomic Energy Agency, the World Health Organization, the International Labour Organization and other relevant organizations to further collaborate with the secretariat on arrangements for the collection, analysis and dissemination of data on radiation exposures of patients, workers and the public;",
    "16": "Welcomes the use and ongoing development by the secretariat of an online platform for collecting data on the exposure of patients, workers and the public, and urges Member States to take part in the Scientific Committee\u2019s global survey of public exposure and to nominate national contact persons to facilitate coordination of the collection and submission of data on the exposure of patients, workers and the public within the country;",
    "17": "Also welcomes the Scientific Committee\u2019s outreach strategy for the period 2020\u20132024, in particular the enhancement of the website of the Committee and the publication of information for the general public in all the official languages of the United Nations, continues to encourage that consideration be given to publishing the website in all of those languages, and notes that the dissemination of the Committee\u2019s findings and further enhancements to the website would depend on the financial and human resources made available to the secretariat;",
    "18": "Requests the United Nations Environment Programme to continue, within existing United Nations resources, to service the Scientific Committee and to disseminate its findings to Member States, the scientific community and the public and to ensure that the administrative measures in place are appropriate, including clear roles and responsibilities of the various actors, so that the secretariat is able to adequately and efficiently service the Committee in a predictable and sustainable manner and effectively facilitate the use of the invaluable expertise offered to the Committee by its members in order that the Committee may discharge the responsibilities and mandate entrusted to it by the General Assembly;",
    "19": "Urges the United Nations Environment Programme to ensure that future recruitment processes are conducted in an efficient, effective, timely and transparent manner;",
    "20": "Welcomes the appointment of a Deputy Secretary, which replaces the previous post of Scientific Officer, allows for the deputization of the Deputy Secretary as Secretary as appropriate and assists in the avoidance of disruptions in staffing;",
    "21": "Requests the Secretary-General to strengthen support for the Scientific Committee within existing United Nations resources, particularly with regard to the Effects of atomic radiation A/RES/76/75 5/5 21-18617 concerns raised by the Committee in relation to resourcing, and with regard to the increase of operational costs in the case of the increase in membership, and to report to the General Assembly at its seventy-seventh session on these issues;",
    "22": "Encourages Member States in a position to do so to make voluntary contributions to the general trust fund established by the Executive Director of the United Nations Environment Programme and also to make contributions in kind, in order to support the work of the Scientific Committee, and the dissemination of its findings, in a sustainable manner;",
    "23": "Recalls that Algeria, Iran (Islamic Republic of), Norway and the United Arab Emirates each designated one scientist to attend the sixty-fifth to sixty-eighth sessions of the Scientific Committee as an observer, pursuant to paragraph 19 of General Assembly resolution 72/76 of 7 December 2017 and to the procedures referred to in paragraph 21 of Assembly resolution 73/261 of 22 December 2018;4",
    "24": "Also recalls the procedure for the possible further increases in membership of the Scientific Committee as adopted in paragraph 21 of General Assembly resolution 73/261, pursuant to paragraph 19 of Assembly resolution 66/70 of 9 December 2011;",
    "25": "Recognizes the advice of the Scientific Committee to the General Assembly that, in its opinion, all four observer States compare favourably against the Secretary-General\u2019s suggested framework of criteria and indicators for membership;5",
    "26": "Acknowledges the advice of the Secretary-General that the addition of all four observer States to the Scientific Committee will incur additional annual operational costs for the Committee, to be funded from existing United Nations resources;6",
    "27": "Notes the Secretary-General\u2019s report, in which it is stated that changes to the membership of the Scientific Committee ought to be to primarily enhance the effectiveness of its substantive work,7 and the Committee\u2019s serious concern about its ability to successfully implement its future programme of work in a timely manner, in particular with regard to the increased number of experts involved in its ongoing evaluations,8 and looks forward with anticipation to the Committee\u2019s consideration of these challenges in its report to the General Assembly at its seventy-seventh session;9",
    "28": "Invites Algeria, Iran (Islamic Republic of), Norway and the United Arab Emirates to become members of the Scientific Committee, and requests the Government of each of those States to designate one scientist, with alternates and consultants, as appropriate, to be its representative on the Committee. 49th plenary meeting 9 December 2021 __________________ 4 See resolutions 74/81 and 75/91. 5 See Official Records of the General Assembly, Seventy-sixth Session, Supplement No. 46 (A/76/46), part two, chap. V, sect. E. 6 A/76/279, para. 22. 7 Ibid., summary, and A/66/524, para. 21. 8 A/76/279, para. 16. 9 Ibid., para. 22."
  },
  "agenda_items": [
    "Item 52"
  ],
  "symbol_references": []
}