{
  "symbol": "A/RES/75/105",
  "filename": "A_RES_75_105.pdf",
  "title": "75/105. Offers by Member States of study and training facilities for inhabitants of Non-Self-Governing Territories",
  "text": "United Nations \nA/RES/75/105\n \n \nGeneral Assembly \nDistr.: General \n21 December 2020 \n \n20-16940 (E)    221220 \n*2016940* \n \n \nSeventy-fifth session \nAgenda item 60 \nOffers by Member States of study and training facilities for \ninhabitants of Non-Self-Governing Territories  \n \n \n \n \n Resolution adopted by the General Assembly \non 10 December 2020 \n \n \n \n \n[on the report of the Special Political and Decolonization Committee \n \n \n(Fourth Committee) (A/75/419, para. 8)] \n \n \n 75/105. Offers by Member States of study and training facilities for \ninhabitants of Non-Self-Governing Territories \n \n \n \nThe General Assembly, \n \nRecalling its resolution 74/96 of 13 December 2019, \n \nHaving examined the report of the Secretary-General,1 prepared pursuant to its \nresolution 845 (IX) of 22 November 1954, \n \nConscious of the importance of promoting the educational advancement of the \ninhabitants of Non-Self-Governing Territories, \n \nStrongly convinced that the continuation and expansion of offers of scholarships \nis essential in order to meet the increasing need of students from Non-Self-Governing \nTerritories for educational and training assistance, and considering that students in \nthose Territories should be encouraged to avail themselves of such offers, \n \n1. \nTakes note of the report of the Secretary-General; \n \n2. \nExpresses its appreciation to those Member States that have made \nscholarships available to the inhabitants of Non-Self-Governing Territories; \n \n3. \nInvites all States to make or continue to make generous offers of study and \ntraining facilities to the inhabitants of those Territories that have not yet attained \nself-government or independence and, wherever possible, to provide travel funds to \nprospective students; \n \n4. \nUrges the administering Powers to take effective measures to ensure the \nwidespread and continuous dissemination in the Territories under their administration \n__________________ \n \n1  A/75/74 and A/75/74/Add.1. \n\nA/RES/75/105 \nOffers by Member States of study and training facilities for \ninhabitants of Non-Self-Governing Territories\n \n20-16940\n2/2 \n \nof information relating to offers of study and training facilities made by States and to \nprovide all the facilities necessary to enable students to avail themselves of such offers; \n \n5. \nRequests the Secretary-General to report to the General Assembly at its \nseventy-sixth session on the implementation of the present resolution; \n \n6. \nDraws the attention of the Special Committee on the Situation with regard \nto the Implementation of the Declaration on the Granting of Independence to Colonial \nCountries and Peoples to the present resolution. \n \n41st plenary meeting \n10 December 2020 \n \n",
  "paragraphs": {
    "1": "Takes note of the report of the Secretary-General;",
    "2": "Expresses its appreciation to those Member States that have made scholarships available to the inhabitants of Non-Self-Governing Territories;",
    "3": "Invites all States to make or continue to make generous offers of study and training facilities to the inhabitants of those Territories that have not yet attained self-government or independence and, wherever possible, to provide travel funds to prospective students;",
    "4": "Urges the administering Powers to take effective measures to ensure the widespread and continuous dissemination in the Territories under their administration of information relating to offers of study and training facilities made by States and to provide all the facilities necessary to enable students to avail themselves of such offers;",
    "5": "Requests the Secretary-General to report to the General Assembly at its seventy-sixth session on the implementation of the present resolution;",
    "6": "Draws the attention of the Special Committee on the Situation with regard to the Implementation of the Declaration on the Granting of Independence to Colonial Countries and Peoples to the present resolution."
  },
  "agenda_items": [
    "Item 60"
  ],
  "symbol_references": []
}