{
  "symbol": "A/RES/79/38",
  "filename": "A_RES_79_38.pdf",
  "title": "79/38. Treaty on the Prohibition of Nuclear Weapons",
  "text": "United Nations \nA/RES/79/38\n \n \nGeneral Assembly \nDistr.: General \n9 December 2024 \n \n24-23055 (E) \n*2423055* \n \n \nSeventy-ninth session \nAgenda item 98 (pp) \nGeneral and complete disarmament: Treaty on the \nProhibition of Nuclear Weapons \n \n \n \n \n Resolution adopted by the General Assembly \non 2 December 2024 \n \n \n \n \n[on the report of the First Committee (A/79/408, para. 114)] \n \n \n \n79/38. Treaty on the Prohibition of Nuclear Weapons \n \n \n \nThe General Assembly, \n \nRecalling its resolutions 72/31 of 4 December 2017, 73/48 of 5 December 2018, \n74/41 of 12 December 2019, 75/40 of 7 December 2020, 76/34 of 6 December 2021, \n77/54 of 7 December 2022 and 78/35 of 4 December 2023,  \n \n1. \nRecalls the adoption of the Treaty on the Prohibition of Nuclear Weapons 1 \non 7 July 2017; \n \n2. \nWelcomes the entry into force of the Treaty on 22 January 2021; \n \n3. \nNotes that the Treaty has been open for signature at United Nations \nHeadquarters in New York since 20 September 2017; \n \n4. \nWelcomes that already 94 States had signed the Treaty and 73 States had \nbecome parties to it as at 14 October 2024, and also welcomes ongoing \nuniversalization efforts; \n \n5. \nRecalls the adoption of the Vienna Action Plan at the first Meeting of \nStates Parties to the Treaty on the Prohibition of Nuclear Weapons, held in Vienna, \nAustria, from 21 to 23 June 2022;2  \n \n6. \nWelcomes the convening of the second Meeting of States Parties to the \nTreaty on the Prohibition of Nuclear Weapons, held at United Nations Headquarters \nin New York from 27 November to 1 December 2023, which examined the status and \nimplementation of the Treaty and considered the progress towards achieving its \nobjectives, purpose, and the goal of a world free from nuclear weapons, as well as the \nimplementation of the Vienna Action Plan;  \n__________________ \n \n1  A/CONF.229/2017/8. \n \n2 TPNW/MSP/2022/6, annex II. \n\nA/RES/79/38 \nTreaty on the Prohibition of Nuclear Weapons\n \n24-23055\n2/2 \n \n \n7. \nAlso welcomes the decisions taken at the second Meeting of States Parties,3 \nincluding the adoption of the declaration entitled \u201cOur commitment to upholding the \nprohibition of nuclear weapons and averting their catastrophic consequences\u201d, as well \nas the ongoing informal intersessional work to implement the Treaty and the Vienna \nAction Plan;  \n \n8. \nFurther welcomes the participation of States signatories, as well as of other \nStates not party to the Treaty, the relevant entities of the United Nations system, other \nrelevant international organizations or institutions, regional organizations, the \nInternational Committee of the Red Cross, the International Federation of Red Cross \nand Red Crescent Societies and relevant non-governmental organizations at the \nsecond Meeting of States Parties as observers;  \n \n9. \nWelcomes the ongoing work of the Treaty\u2019s Scientific Advisory Group and \nits report on the status and developments regarding nuclear weapons, nuclear weapon \nrisks, the humanitarian consequences of nuclear weapons, nuclear disarmament and \nrelated issues;4  \n \n10. Confirms that the third Meeting of States Parties to the Treaty on the \nProhibition of Nuclear Weapons will be held at United Nations Headquarters in New \nYork from 3 to 7 March 2025;  \n \n11. \nExpresses its gratitude to the Secretary-General for his support provided \nto date, and requests him to render the necessary assistance and to provide such \nservices, as may be required, for the third Meeting of States Parties and its informal \nintersessional process;  \n \n12. Calls upon all States that have not yet done so to sign, ratify, accept, \napprove or accede to the Treaty at the earliest possible date;  \n \n13. Calls upon those States in a position to do so to promote adherence to the \nTreaty and its norms and underlying rationale through bilateral, subregional, regional \nand multilateral contacts, outreach and other means;  \n \n14. Requests the Secretary-General, as depositary of the Treaty, to report to \nthe General Assembly at its eightieth session on the status of signature and \nratification, acceptance, approval or accession of the Treaty;  \n \n15. Decides to include in the provisional agenda of its eightieth session, under \nthe item entitled \u201cGeneral and complete disarmament\u201d, the sub-item entitled \u201cTreaty \non the Prohibition of Nuclear Weapons\u201d. \n \n43rd plenary meeting \n2 December 2024 \n \n__________________ \n \n3 See TPNW/MSP/2023/14. \n \n4 TPNW/MSP/2023/8. \n",
  "paragraphs": {
    "1": "Recalls the adoption of the Treaty on the Prohibition of Nuclear Weapons 1 on 7 July 2017;",
    "2": "Welcomes the entry into force of the Treaty on 22 January 2021;",
    "3": "Notes that the Treaty has been open for signature at United Nations Headquarters in New York since 20 September 2017;",
    "4": "Welcomes that already 94 States had signed the Treaty and 73 States had become parties to it as at 14 October 2024, and also welcomes ongoing universalization efforts;",
    "5": "Recalls the adoption of the Vienna Action Plan at the first Meeting of States Parties to the Treaty on the Prohibition of Nuclear Weapons, held in Vienna, Austria, from 21 to 23 June 2022;2",
    "6": "Welcomes the convening of the second Meeting of States Parties to the Treaty on the Prohibition of Nuclear Weapons, held at United Nations Headquarters in New York from 27 November to 1 December 2023, which examined the status and implementation of the Treaty and considered the progress towards achieving its objectives, purpose, and the goal of a world free from nuclear weapons, as well as the implementation of the Vienna Action Plan;",
    "7": "Also welcomes the decisions taken at the second Meeting of States Parties,3 including the adoption of the declaration entitled \u201cOur commitment to upholding the prohibition of nuclear weapons and averting their catastrophic consequences\u201d, as well as the ongoing informal intersessional work to implement the Treaty and the Vienna Action Plan;",
    "8": "Further welcomes the participation of States signatories, as well as of other States not party to the Treaty, the relevant entities of the United Nations system, other relevant international organizations or institutions, regional organizations, the International Committee of the Red Cross, the International Federation of Red Cross and Red Crescent Societies and relevant non-governmental organizations at the second Meeting of States Parties as observers;",
    "9": "Welcomes the ongoing work of the Treaty\u2019s Scientific Advisory Group and its report on the status and developments regarding nuclear weapons, nuclear weapon risks, the humanitarian consequences of nuclear weapons, nuclear disarmament and related issues;4",
    "10": "Confirms that the third Meeting of States Parties to the Treaty on the Prohibition of Nuclear Weapons will be held at United Nations Headquarters in New York from 3 to 7 March 2025;",
    "11": "Expresses its gratitude to the Secretary-General for his support provided to date, and requests him to render the necessary assistance and to provide such services, as may be required, for the third Meeting of States Parties and its informal intersessional process;",
    "12": "Calls upon all States that have not yet done so to sign, ratify, accept, approve or accede to the Treaty at the earliest possible date;",
    "13": "Calls upon those States in a position to do so to promote adherence to the Treaty and its norms and underlying rationale through bilateral, subregional, regional and multilateral contacts, outreach and other means;",
    "14": "Requests the Secretary-General, as depositary of the Treaty, to report to the General Assembly at its eightieth session on the status of signature and ratification, acceptance, approval or accession of the Treaty;",
    "15": "Decides to include in the provisional agenda of its eightieth session, under the item entitled \u201cGeneral and complete disarmament\u201d, the sub-item entitled \u201cTreaty on the Prohibition of Nuclear Weapons\u201d."
  },
  "agenda_items": [
    "Item 98"
  ],
  "symbol_references": []
}