{
  "symbol": "A/RES/72/219",
  "filename": "A_RES_72_219.pdf",
  "title": "72/219. Protection of global climate for present and future generations of humankind",
  "text": "United Nations \nA/RES/72/219\n \n \nGeneral Assembly \nDistr.: General \n25 January 2018 \n \n17-23289 (E)    300118     \n*1723289* \n \n \nSeventy-second session \nAgenda item 19 (d) \n \n \n \n \n Resolution adopted by the General Assembly \non 20 December 2017 \n \n \n \n \n[on the report of the Second Committee (A/72/420/Add.4)] \n \n \n 72/219. Protection of global climate for present and future generations \nof humankind  \n \n \n \nThe General Assembly, \n \nRecalling its resolutions 43/53 of 6 December 1988, 54/222 of 22 December \n1999, 62/86 of 10 December 2007, 63/32 of 26 November 2008, 64/73 of 7 December \n2009, 65/159 of 20 December 2010, 66/200 of 22 December 2011, 67/210 of \n21 December 2012, 68/212 of 20 December 2013, 69/220 of 19 December 2014, \n70/205 of 22 December 2015 and 71/228 of 21 December 2016 and other resolutions \nand decisions relating to the protection of the global climate for present and future \ngenerations of humankind,  \n \nRecalling also, in full, the United Nations Framework Convention on Climate \nChange1 and the Paris Agreement adopted under the Convention,2 acknowledging that \nthey are the primary international, intergovernmental forums for negotiating the \nglobal response to climate change, expressing determination to address decisively the \nthreat posed by climate change and environmental degradation, recognizing that the \nglobal nature of climate change calls for the widest possible international cooperation \naimed at accelerating the reduction of global greenhouse gas emissions and \naddressing adaptation to the adverse impacts of climate change, and noting with \nconcern the significant gap between the aggregate effect of parties\u2019 mitigation pledges \nin terms of global annual emissions of greenhouse gases by 2020 and aggregate \nemission pathways,  \n \nRecalling further the Paris Agreement, which, pursuant to article 2, paragraph 2, \nthereof, will be implemented to reflect equity and the principle of common but \ndifferentiated responsibilities and respective capabilities, in the light of different \nnational circumstances,  \n \nAcknowledging that action on adaptation to climate change is an urgent priority \nfor developing countries, especially those that are particularly vulnerable to the \n__________________ \n \n1  United Nations, Treaty Series, vol. 1771, No. 30822. \n \n2  See FCCC/CP/2015/10/Add.1, decision 1/CP.21, annex. \n\nA/RES/72/219 \nProtection of global climate for present and future generations of humankind\n \n17-23289 \n2/7 \n \nadverse effects of climate change, and bearing in mind that the provision of scaled-\nup financial resources should aim to achieve a balance between adaptation and \nmitigation,  \n \nWelcoming the convening of the twenty-third session of the Conference of the \nParties to the United Nations Framework Convention on Climate Change, the \nthirteenth session of the Conference of the Parties serving as the Meeting of the \nParties to the Kyoto Protocol and the second part of the first session of the Conference \nof the Parties serving as the Meeting of the Parties to the Paris Agreement, presided \nover by the Government of Fiji, in Bonn, Germany, from 6 to 17 November 2017,  \n \nRecalling the United Nations Millennium Declaration,3 the Johannesburg \nDeclaration on Sustainable Development4 and the Plan of Implementation of the \nWorld Summit on Sustainable Development (Johannesburg Plan of Implementation), 5 \nthe 2005 World Summit Outcome,6 the outcome document of the United Nations \nConference on Sustainable Development, held in Rio de Janeiro, Brazil, from 20 to \n22 June 2012, entitled \u201cThe future we want\u201d,7 the outcomes of the thirteenth to \ntwenty-second sessions of the Conference of the Parties to the United Nations \nFramework Convention on Climate Change and of the third to twelfth sessions of the \nConference of the Parties serving as the Meeting of the Parties to the Kyoto Protocol, \nthe Programme of Action for the Least Developed Countries for the Decade 2011\u2013\n2020, adopted at the Fourth United Nations Conference on the Least Developed \nCountries, held in Istanbul, Turkey, from 9 to 13 May 2011,8 the Political Declaration \nof the Comprehensive High-level Midterm Review of the Implementation of the \nIstanbul Programme of Action for the Least Developed Countries for the Decade \n2011\u20132020, held in Antalya, Turkey, from 27 to 29 May 2016,9 the Vienna Programme \nof Action for Landlocked Developing Countries for the Decade 2014\u20132024, adopted \nat the second United Nations Conference on Landlocked Developing Countries, held \nin Vienna from 3 to 5 November 2014,10 the Programme of Action for the Sustainable \nDevelopment of Small Island Developing States,11 the Mauritius Declaration12 and \nthe Mauritius Strategy for the Further Implementation of the Programme of Action \nfor the Sustainable Development of Small Island Developing States, 13 the SIDS \nAccelerated Modalities of Action (SAMOA) Pathway,14 the Sendai Declaration and \nthe Sendai Framework for Disaster Risk Reduction 2015\u2013203015 and the Beijing \nDeclaration and Platform for Action,16  \n__________________ \n \n3  Resolution 55/2. \n \n4  Report of the World Summit on Sustainable Development, Johannesburg, South Africa, \n26 August\u20134 September 2002 (United Nations publication, Sales No. E.03.II.A.1 and \ncorrigendum), chap. I, resolution 1, annex. \n \n5  Ibid., resolution 2, annex. \n \n6  Resolution 60/1. \n \n7  Resolution 66/288, annex. \n \n8  Report of the Fourth United Nations Conference on the Least Developed Countries, Istanbul, \nTurkey, 9\u201313 May 2011 (A/CONF.219/7), chap. II. \n \n9  Resolution 70/294, annex. \n \n10  Resolution 69/137, annex II. \n \n11  Report of the Global Conference on the Sustainable Development of Small Island Developing \nStates, Bridgetown, Barbados, 25 April\u20136 May 1994 (United Nations publication, Sales \nNo. E.94.I.18 and corrigenda), chap. I, resolution 1, annex II. \n \n12  Report of the International Meeting to Review the Implementation of the Programme of Action \nfor the Sustainable Development of Small Island Developing States, Port Louis, Mauritius,  \n10\u201314 January 2005 (United Nations publication, Sales No. E.05.II.A.4 and corrigendum), \nchap. I, resolution 1, annex I. \n \n13  Ibid., annex II. \n \n14  Resolution 69/15, annex. \n \n15  Resolution 69/283, annexes I and II. \n \n16  Report of the Fourth World Conference on Women, Beijing, 4\u201315 September 1995 (United \nNations publication, Sales No. E.96.IV.13), chap. I, resolution 1, annexes I and II. \n\nProtection of global climate for present and future generations of humankind \nA/RES/72/219\n \n3/7 \n17-23289 \n \n \nReaffirming its resolution 70/1 of 25 September 2015, entitled \u201cTransforming \nour world: the 2030 Agenda for Sustainable Development\u201d, in which it adopted a \ncomprehensive, far-reaching and people-centred set of universal and transformative \nSustainable Development Goals and targets, its commitment to working tirelessly for \nthe full implementation of the Agenda by 2030, its recognition that eradicating \npoverty in all its forms and dimensions, including extreme poverty, is the greatest \nglobal challenge and an indispensable requirement for sustainable development, its \ncommitment to achieving sustainable development in its three dimensions \u2014 \neconomic, social and environmental \u2014 in a balanced and integrated manner, and to \nbuilding upon the achievements of the Millennium Development Goals and seeking \nto address their unfinished business,  \n \nReaffirming also its resolution 69/313 of 27 July 2015 on the Addis Ababa \nAction Agenda of the Third International Conference on Financing for Development, \nwhich is an integral part of the 2030 Agenda for Sustainable Development, supports \nand complements it, helps to contextualize its means of implementation targets with \nconcrete policies and actions, and reaffirms the strong political commitment to \naddress the challenge of financing and creating an enabling environment at all levels \nfor sustainable development in the spirit of global partnership and solidarity,  \n \nExpressing concern over the findings of the World Meteorological Organization,  \nin its Greenhouse gas bulletin of 30 October 2017, which showed that the global \naverage of atmospheric concentrations of carbon dioxide reached 403.3 parts per \nmillion in 2016, the highest such levels in 3 to 5 million years, and that the increase \nin the annual mean from 2015 to 2016 was 50 per cent above the average growth rate \nfor the past decade,  \n \nTaking note of the Green Climate Fund and its successful and timely initial \nresource mobilization process, making it the largest dedicated climate fund, and its \napproval of 2.59 billion United States dollars in funding, stressing its goal of ensuring \nefficient access to its resources through simplified approval procedures and enhancing \nreadiness support, which will help to deliver outcomes in developing countries so as \nto limit or reduce greenhouse gas emissions and help them adapt to the impacts of \nclimate change, and reiterating the objectives and guiding principles of the Fund, \nincluding a gender-sensitive approach in its process and operations,  \n \nWelcoming the New Urban Agenda, adopted at the United Nations Conference \non Housing and Sustainable Urban Development (Habitat III), held in Quito, Ecuador, \nfrom 17 to 20 October 2016,17 \n \nRecalling the United Nations strategic plan for forests, 2017\u20132030,18 and \nacknowledging that all types of forests contribute substantially to climate change \nmitigation and adaptation,  \n \nNoting the existing framework on forests under the United Nations Framework \nConvention on Climate Change,  \n \nTaking note of the high-level event on climate change and the sustainable \ndevelopment agenda, held at United Nations Headquarters on 23 March 2017, \nconvened by the President of the seventy-first session of the General Assembly, \n \nNoting the need for enhanced coordination and cooperation at all levels among \nthe parties to and secretariats of the United Nations Framework Convention on \nClimate Change, the United Nations Convention to Combat Desertification in Those \nCountries Experiencing Serious Drought and/or Desertification, Particularly in \n__________________ \n \n17  Resolution 71/256, annex. \n \n18  See resolution 71/285. \n\nA/RES/72/219 \nProtection of global climate for present and future generations of humankind\n \n17-23289 \n4/7 \n \nAfrica,19 and the Convention on Biological Diversity,20 as appropriate, while \nrespecting their individual mandates, and welcoming in this context the outcomes of \nthe thirteenth session of the Conference of the Parties to the United Nations \nConvention to Combat Desertification,21 as well as the outcomes of the thirteenth \nmeeting of the Conference of the Parties to the United Nations Convention on \nBiological Diversity,22 \n \nNoting also the contribution of the United Nations Environment Assembly to \naddressing the challenge of, inter alia, climate change, within its mandate and in \ncollaboration with other relevant organizations and stakeholders, \n \nRecalling its resolution 71/312 of 6 July 2017, in which it endorsed the \ndeclaration entitled \u201cOur ocean, our future: call for action\u201d adopted by the high-level \nUnited Nations Conference to Support the Implementation of Sustainable \nDevelopment Goal 14: Conserve and sustainably use the oceans, seas and marine \nresources for sustainable development, held from 5 to 9 June 2017, coinciding with \nWorld Oceans Day on 8 June, reaffirming in this regard the important role of the \ndeclaration in demonstrating the collective will to take action to conserve and \nsustainably use our oceans, seas and marine resources for sustainable development, \nand recognizing the important contributions of the partnership dialogues and \nvoluntary commitments made in the context of that Conference to the effective and \ntimely implementation of Sustainable Development Goal 14, \n \nRecognizing that, in undertaking its work, the United Nations should promote \nthe protection of the global climate for the well-being of present and future \ngenerations of humankind, \n \nWelcoming the adoption, at the Twenty-eighth Meeting of the Parties to the \nMontreal Protocol on Substances that Deplete the Ozone Layer, 23 held in Kigali from \n10 to 15 October 2016, of the Kigali Amendment24 to phase down hydrofluorocarbons, \nwelcoming the ratification of the Kigali Amendment to the Montreal Protocol by 23 \ncountries, and encouraging further ratifications as soon as possible, \n \nNoting the contribution of the International Civil Aviation Organization to \nglobal efforts to combat climate change, and noting also the contribution of the \nInternational Maritime Organization in this regard, \n \n1. \nReaffirms that climate change is one of the greatest challenges of our time, \nexpresses profound alarm that the emissions of greenhouse gases continue to rise \nglobally, remains deeply concerned that all countries, particularly developing \ncountries, are vulnerable to the adverse impacts of climate change and are already \nexperiencing an increase in such impacts, including persistent drought and extreme \nweather events, land degradation, sea level rise, coastal erosion, ocean acidification \nand the retreat of mountain glaciers, further threatening food security and efforts to \neradicate poverty and achieve sustainable development, recognizes the substantial \nrisks posed by climate change to health, and emphasizes in this regard that mitigation \nof and adaptation to climate change represent an immediate and urgent global priority; \n \n2. \nWelcomes the twenty-second session of the Conference of the Parties to \nthe United Nations Framework Convention on Climate Change, hosted by the \nGovernment of Morocco in Marrakech from 7 to 18 November 2016; \n__________________ \n \n19  United Nations, Treaty Series, vol. 1954, No. 33480. \n \n20  Ibid., vol. 1760, No. 30619. \n \n21  ICCD/COP(13)/21/Add.1. \n \n22  See United Nations Environment Programme, document UNEP/CBD/COP/13/25. \n \n23  United Nations, Treaty Series, vol. 1522, No. 26369. \n \n24  UNEP/OzL.Pro.28/12, annex I. \n\nProtection of global climate for present and future generations of humankind \nA/RES/72/219\n \n5/7 \n17-23289 \n \n \n3. \nAlso welcomes the early entry into force, on 4 November 2016, of the Paris \nAgreement adopted under the United Nations Framework Convention on Climate \nChange,2 and encourages all its parties to fully implement the Agreement, and parties \nto the United Nations Framework Convention on Climate Change 1 that have not yet \ndone so to deposit their instruments of ratification, acceptance, approval or accession, \nwhere appropriate, as soon as possible; \n \n4. \nRecalls that the Paris Agreement, in enhancing the implementation of the \nConvention, including its objective, aims to strengthen the global response to the threat \nof climate change, in the context of sustainable development and efforts to eradicate \npoverty, including by holding the increase in the global average temperature to well \nbelow 2 degrees Celsius above pre-industrial levels and pursuing efforts to limit the \ntemperature increase to 1.5 degrees Celsius above pre-industrial levels, recognizing \nthat this would significantly reduce the risks and impacts of climate change, increasing \nthe ability to adapt to the adverse impacts of climate change and foster climate \nresilience and low greenhouse gas emissions development, in a manner that does not \nthreaten food production, and making finance flows consistent with a pathway towards \nlow greenhouse gas emissions and climate-resilient development; \n \n5. \nWelcomes the nationally determined contributions submitted to date, and \nrecalls that the regular updating of such contributions should reflect the highest \npossible level of ambition, in the light of different national circumstances, and should \nprovide the information necessary for clarity, transparency and understanding, in \naccordance with the relevant decisions; \n \n6. \nAlso welcomes the call of the Secretary-General for a climate summit to \nbe held in New York in 2019; \n \n7. \nEmphasizes the need for collective efforts to promote sustainable \ndevelopment in its three dimensions in an innovative, coordinated, environmentally \nsound, open and shared manner; \n \n8. \nReiterates the call made in the declaration \u201cOur ocean, our future: call for \naction\u201d25 for action to be taken on an urgent basis to conserve and sustainably use the \noceans, seas and marine resources for sustainable development; \n \n9. \nAcknowledges the work undertaken under the auspices of the Marrakech \nPartnership for Global Climate Action,26 and encourages non-party stakeholders to \nscale up their efforts to address and respond to climate change; \n \n10. Invites the President of the General Assembly to convene a high-level \nmeeting during the seventy-third session of the General Assembly on the issue of the \nprotection of the global climate for present and future generations of humankind in \nthe context of the economic, social and environmental dimensions of the 2030 Agenda \nfor Sustainable Development;27  \n \n11. \nReiterates the resolve of the Conference of the Parties to the Convention, \nas set out in paragraphs 3 and 4 of its decision 1/CP.19,28 to accelerate the full \nimplementation of the decisions constituting the agreed outcome pursuant to its \ndecision 1/CP.1329 and to enhance ambition in the pre-2020 period in order to ensure \nthe highest possible mitigation efforts under the Convention by all parties; \n__________________ \n \n25  See resolution 71/312, annex. \n \n26  See FCCC/CP/2016/10/Add.1. \n \n27  Resolution 70/1. \n \n28  See FCCC/CP/2013/10/Add.1. \n \n29  See FCCC/CP/2007/6/Add.1. \n\nA/RES/72/219 \nProtection of global climate for present and future generations of humankind\n \n17-23289 \n6/7 \n \n \n12. Welcomes the acceptance or ratification of the Doha Amendment to the \nKyoto Protocol30 by 95 countries, and encourages further acceptance or ratifications \nas soon as possible; \n \n13. Takes note of the report of the Executive Secretary of the United Nations \nFramework Convention on Climate Change on the twenty-second session of the \nConference of the Parties to the Convention; 31  \n \n14. Recognizes the importance of averting, minimizing and addressing loss \nand damage associated with the adverse effects of climate change, and in that regard \ntakes note of decisions 2/CP.19,28 2/CP.2032 and 3/CP.2233 adopted by the Conference \nof the Parties to the Convention on the Warsaw International Mechanism for Loss and \nDamage associated with Climate Change Impacts, and decision 1/CP.21, 34 in which \nthe Paris Agreement was adopted by the Conference of the Parties at its twenty-first \nsession; \n \n15. Notes with appreciation the convening by the Government of Fiji of, and \nthe provision of technical assistance by the Government of Germany to, the twenty-\nthird session of the Conference of the Parties to the Convention, the thirteenth session \nof the Conference of the Parties serving as the Meeting of the Parties to the Kyoto \nProtocol and the second part of the first session of the Conference of the Parties \nserving as the Meeting of the Parties to the Paris Agreement, in Bonn, Germany, from \n6 to 17 November 2017; \n \n16. Welcomes the offer by the Government of Poland to host the twenty-fourth \nsession of the Conference of the Parties to the Convention in Katowice, from 3 to \n14 December 2018; \n \n17. Looks forward to the further implementation of the programme of work \nunder the Paris Agreement, in accordance with relevant decisions by the Conference \nof the Parties to the Convention, as well as to the Talanoa (facilitative) dialogue \nin 2018; \n \n18. Urges Member States, taking into account that women and girls are often \ndisproportionately affected by climate change owing to gender inequalities and the \ndependence of many women on natural resources for their livelihoods, to promote the \nintegration of a gender perspective into environmental and climate change policies \nand to strengthen mechanisms and provide adequate resources towards achieving the \nfull and equal participation of women in decision-making at all levels on \nenvironmental issues, and stresses the need to address the challenges posed by climate \nchange that affect women and girls in particular; \n \n19. Endorses the action plan for integrating sustainable development practices \ninto Secretariat-wide operations and facilities management submitted by the \nSecretary-General,35 and requests the Secretary-General to implement his relevant \nrecommendations within existing resources; \n \n20. Requests the Secretary-General to make provisions for the sessions of the \nConference of the Parties to the Convention and its subsidiary bodies in his proposed \nprogramme budget for the biennium 2018\u20132019;  \n \n21. Invites the secretariat of the Convention to report, through the Secretary-\nGeneral, to the General Assembly at its seventy-third session on the work of the \n__________________ \n \n30  See FCCC/KP/CMP/2012/13/Add.1. \n \n31  A/72/152, sect. I, and A/72/152/Corr.1. \n \n32  See FCCC/CP/2014/10/Add.2. \n \n33  See FCCC/CP/2016/10/Add.1. \n \n34  See FCCC/CP/2015/10/Add.1. \n \n35  A/72/82. \n\nProtection of global climate for present and future generations of humankind \nA/RES/72/219\n \n7/7 \n17-23289 \n \nConference of the Parties to the Convention, and decides to include, under the item \nentitled \u201cSustainable development\u201d, the sub-item entitled \u201cProtection of global \nclimate for present and future generations of humankind\u201d in the provisional agenda \nof its seventy-third session, unless otherwise agreed. \n \n74th plenary meeting  \n20 December 2017 \n \n",
  "paragraphs": {
    "1": "Reaffirms that climate change is one of the greatest challenges of our time, expresses profound alarm that the emissions of greenhouse gases continue to rise globally, remains deeply concerned that all countries, particularly developing countries, are vulnerable to the adverse impacts of climate change and are already experiencing an increase in such impacts, including persistent drought and extreme weather events, land degradation, sea level rise, coastal erosion, ocean acidification and the retreat of mountain glaciers, further threatening food security and efforts to eradicate poverty and achieve sustainable development, recognizes the substantial risks posed by climate change to health, and emphasizes in this regard that mitigation of and adaptation to climate change represent an immediate and urgent global priority;",
    "2": "Welcomes the twenty-second session of the Conference of the Parties to the United Nations Framework Convention on Climate Change, hosted by the Government of Morocco in Marrakech from 7 to 18 November 2016; __________________ 19 United Nations, Treaty Series, vol. 1954, No. 33480. 20 Ibid., vol. 1760, No. 30619. 21 ICCD/COP(13)/21/Add.1. 22 See United Nations Environment Programme, document UNEP/CBD/COP/13/25. 23 United Nations, Treaty Series, vol. 1522, No. 26369. 24 UNEP/OzL.Pro.28/12, annex I. Protection of global climate for present and future generations of humankind A/RES/72/219 5/7 17-23289",
    "3": "Also welcomes the early entry into force, on 4 November 2016, of the Paris Agreement adopted under the United Nations Framework Convention on Climate Change,2 and encourages all its parties to fully implement the Agreement, and parties to the United Nations Framework Convention on Climate Change 1 that have not yet done so to deposit their instruments of ratification, acceptance, approval or accession, where appropriate, as soon as possible;",
    "4": "Recalls that the Paris Agreement, in enhancing the implementation of the Convention, including its objective, aims to strengthen the global response to the threat of climate change, in the context of sustainable development and efforts to eradicate poverty, including by holding the increase in the global average temperature to well below 2 degrees Celsius above pre-industrial levels and pursuing efforts to limit the temperature increase to 1.5 degrees Celsius above pre-industrial levels, recognizing that this would significantly reduce the risks and impacts of climate change, increasing the ability to adapt to the adverse impacts of climate change and foster climate resilience and low greenhouse gas emissions development, in a manner that does not threaten food production, and making finance flows consistent with a pathway towards low greenhouse gas emissions and climate-resilient development;",
    "5": "Welcomes the nationally determined contributions submitted to date, and recalls that the regular updating of such contributions should reflect the highest possible level of ambition, in the light of different national circumstances, and should provide the information necessary for clarity, transparency and understanding, in accordance with the relevant decisions;",
    "6": "Also welcomes the call of the Secretary-General for a climate summit to be held in New York in 2019;",
    "7": "Emphasizes the need for collective efforts to promote sustainable development in its three dimensions in an innovative, coordinated, environmentally sound, open and shared manner;",
    "8": "Reiterates the call made in the declaration \u201cOur ocean, our future: call for action\u201d25 for action to be taken on an urgent basis to conserve and sustainably use the oceans, seas and marine resources for sustainable development;",
    "9": "Acknowledges the work undertaken under the auspices of the Marrakech Partnership for Global Climate Action,26 and encourages non-party stakeholders to scale up their efforts to address and respond to climate change;",
    "10": "Invites the President of the General Assembly to convene a high-level meeting during the seventy-third session of the General Assembly on the issue of the protection of the global climate for present and future generations of humankind in the context of the economic, social and environmental dimensions of the 2030 Agenda for Sustainable Development;27",
    "11": "Reiterates the resolve of the Conference of the Parties to the Convention, as set out in paragraphs 3 and 4 of its decision 1/CP.19,28 to accelerate the full implementation of the decisions constituting the agreed outcome pursuant to its decision 1/CP.1329 and to enhance ambition in the pre-2020 period in order to ensure the highest possible mitigation efforts under the Convention by all parties; __________________ 25 See resolution 71/312, annex. 26 See FCCC/CP/2016/10/Add.1. 27 Resolution 70/1. 28 See FCCC/CP/2013/10/Add.1. 29 See FCCC/CP/2007/6/Add.1. A/RES/72/219 Protection of global climate for present and future generations of humankind 17-23289 6/7",
    "12": "Welcomes the acceptance or ratification of the Doha Amendment to the Kyoto Protocol30 by 95 countries, and encourages further acceptance or ratifications as soon as possible;",
    "13": "Takes note of the report of the Executive Secretary of the United Nations Framework Convention on Climate Change on the twenty-second session of the Conference of the Parties to the Convention; 31",
    "14": "Recognizes the importance of averting, minimizing and addressing loss and damage associated with the adverse effects of climate change, and in that regard takes note of decisions 2/CP.19,28 2/CP.2032 and 3/CP.2233 adopted by the Conference of the Parties to the Convention on the Warsaw International Mechanism for Loss and Damage associated with Climate Change Impacts, and decision 1/CP.21, 34 in which the Paris Agreement was adopted by the Conference of the Parties at its twenty-first session;",
    "15": "Notes with appreciation the convening by the Government of Fiji of, and the provision of technical assistance by the Government of Germany to, the twenty- third session of the Conference of the Parties to the Convention, the thirteenth session of the Conference of the Parties serving as the Meeting of the Parties to the Kyoto Protocol and the second part of the first session of the Conference of the Parties serving as the Meeting of the Parties to the Paris Agreement, in Bonn, Germany, from 6 to 17 November 2017;",
    "16": "Welcomes the offer by the Government of Poland to host the twenty-fourth session of the Conference of the Parties to the Convention in Katowice, from 3 to 14 December 2018;",
    "17": "Looks forward to the further implementation of the programme of work under the Paris Agreement, in accordance with relevant decisions by the Conference of the Parties to the Convention, as well as to the Talanoa (facilitative) dialogue in 2018;",
    "18": "Urges Member States, taking into account that women and girls are often disproportionately affected by climate change owing to gender inequalities and the dependence of many women on natural resources for their livelihoods, to promote the integration of a gender perspective into environmental and climate change policies and to strengthen mechanisms and provide adequate resources towards achieving the full and equal participation of women in decision-making at all levels on environmental issues, and stresses the need to address the challenges posed by climate change that affect women and girls in particular;",
    "19": "Endorses the action plan for integrating sustainable development practices into Secretariat-wide operations and facilities management submitted by the Secretary-General,35 and requests the Secretary-General to implement his relevant recommendations within existing resources;",
    "20": "Requests the Secretary-General to make provisions for the sessions of the Conference of the Parties to the Convention and its subsidiary bodies in his proposed programme budget for the biennium 2018\u20132019;",
    "21": "Invites the secretariat of the Convention to report, through the Secretary- General, to the General Assembly at its seventy-third session on the work of the __________________ 30 See FCCC/KP/CMP/2012/13/Add.1. 31 A/72/152, sect. I, and A/72/152/Corr.1. 32 See FCCC/CP/2014/10/Add.2. 33 See FCCC/CP/2016/10/Add.1. 34 See FCCC/CP/2015/10/Add.1. 35 A/72/82. Protection of global climate for present and future generations of humankind A/RES/72/219 7/7 17-23289 Conference of the Parties to the Convention, and decides to include, under the item entitled \u201cSustainable development\u201d, the sub-item entitled \u201cProtection of global climate for present and future generations of humankind\u201d in the provisional agenda of its seventy-third session, unless otherwise agreed. 74th plenary meeting 20 December 2017"
  },
  "agenda_items": [
    "Item 19"
  ],
  "symbol_references": []
}