{
  "symbol": "A/RES/72/5",
  "filename": "A_RES_72_5.pdf",
  "title": "72/5. Report of the International Atomic Energy Agency",
  "text": "United Nations \nA/RES/72/5\n \n \nGeneral Assembly \nDistr.: General \n17 November 2017 \n \n \n17-20047 (E)   171117 \n*1720047* \n \n \nSeventy-second session \nAgenda item 89 \n \n \n \n \n Resolution adopted by the General Assembly \non 10 November 2017 \n \n \n \n \n[without reference to a Main Committee (A/72/L.6 and A/72/L.6/Add.1)] \n \n \n \n72/5. Report of the International Atomic Energy Agency \n \n \n \nThe General Assembly, \n \nHaving received the report of the International Atomic Energy Agency \nfor 2016,1 \n \nTaking note of the statement by the Director General of the Agency, in which he \nprovided additional information on the main developments in the activities of the \nAgency during 2017, \n \nRecognizing the importance of the work of the Agency,  \n \nRecognizing also the cooperation between the United Nations and the Agency \nand the Agreement governing the relationship between the United Nations and the \nAgency as approved by the General Conference of the Agency on 23 October 1957 \nand by the General Assembly in the annex to its resolution 1145 (XII) of 14 November \n1957,  \n \n1. \nTakes note with appreciation of the report of the International Atomic \nEnergy Agency;1 \n \n2. \nTakes note of resolutions GC(61)/RES/8 on measures to strengthen \ninternational cooperation in nuclear, radiation, transport and waste safety; \nGC(61)/RES/9 on nuclear security; GC(61)/RES/10 on the strengthening of the \nAgency\u2019s technical cooperation activities; GC(61)/RES/11 on strengthening the \nAgency\u2019s activities related to nuclear science, technology and applications, \ncomprising \nGC(61)/RES/11 A \non \nnon-power \nnuclear \napplications \nand \nGC(61)/RES/11 B on nuclear power applications; GC(61)/RES/12 on strengthening \nthe effectiveness and improving the efficiency of Agency safeguards; GC(61)/RES/13 \non the implementation of the Treaty on the Non-Proliferation of Nuclear Weapons \nsafeguards agreement between the Agency and the Democratic People\u2019s Republic of \n__________________ \n \n1  See A/72/221. \n\nA/RES/72/5 \nReport of the International Atomic Energy Agency\n \n17-20047 \n2/2 \n \nKorea; GC(61)/RES/14 on the application of Agency safeguards in the Middle East; \nand GC(61)/RES/15 on personnel matters, comprising GC(61)/RES/15 A on the \nstaffing of the Agency\u2019s secretariat and GC(61)/RES/15 B on women in the \nsecretariat; and decisions GC(61)/DEC/10 on the amendment to article XIV.A of the \nstatute of the Agency; GC(61)/DEC/11 on the promotion of the efficiency and \neffectiveness of the Agency\u2019s decision-making process; and GC(61)/DEC/12 on the \namendment to article VI of the statute of the Agency, adopted by the General \nConference of the Agency at its sixty-first regular session, held from 18 to \n22 September 2017; \n \n3. \nReaffirms its strong support for the indispensable role of the Agency in \nencouraging and assisting the development and practical application of atomic energy \nfor peaceful uses, in technology transfer to developing countries and in nuclear safety, \nverification and security;  \n \n4. \nWelcomes resolution GC(61)/RES/2 on the approval of the appointment of \nMr. Yukiya Amano as Director General of the Agency from 1 December 2017 to \n30 November 2021; \n \n5. \nAppeals to Member States to continue to support the activities of the \nAgency;  \n \n6. \nRequests the Secretary-General to transmit to the Director General of the \nAgency the records of the seventy-second session of the General Assembly relating \nto the activities of the Agency. \n \n47th plenary meeting \n10 November 2017 \n \n",
  "paragraphs": {
    "1": "Takes note with appreciation of the report of the International Atomic Energy Agency;1",
    "2": "Takes note of resolutions GC(61)/RES/8 on measures to strengthen international cooperation in nuclear, radiation, transport and waste safety; GC(61)/RES/9 on nuclear security; GC(61)/RES/10 on the strengthening of the Agency\u2019s technical cooperation activities; GC(61)/RES/11 on strengthening the Agency\u2019s activities related to nuclear science, technology and applications, comprising GC(61)/RES/11 A on non-power nuclear applications and GC(61)/RES/11 B on nuclear power applications; GC(61)/RES/12 on strengthening the effectiveness and improving the efficiency of Agency safeguards; GC(61)/RES/13 on the implementation of the Treaty on the Non-Proliferation of Nuclear Weapons safeguards agreement between the Agency and the Democratic People\u2019s Republic of Korea; GC(61)/RES/14 on the application of Agency safeguards in the Middle East; and GC(61)/RES/15 on personnel matters, comprising GC(61)/RES/15 A on the staffing of the Agency\u2019s secretariat and GC(61)/RES/15 B on women in the secretariat; and decisions GC(61)/DEC/10 on the amendment to article XIV.A of the statute of the Agency; GC(61)/DEC/11 on the promotion of the efficiency and effectiveness of the Agency\u2019s decision-making process; and GC(61)/DEC/12 on the amendment to article VI of the statute of the Agency, adopted by the General Conference of the Agency at its sixty-first regular session, held from 18 to 22 September 2017;",
    "3": "Reaffirms its strong support for the indispensable role of the Agency in encouraging and assisting the development and practical application of atomic energy for peaceful uses, in technology transfer to developing countries and in nuclear safety, verification and security;",
    "4": "Welcomes resolution GC(61)/RES/2 on the approval of the appointment of Mr. Yukiya Amano as Director General of the Agency from 1 December 2017 to 30 November 2021;",
    "5": "Appeals to Member States to continue to support the activities of the Agency;",
    "6": "Requests the Secretary-General to transmit to the Director General of the Agency the records of the seventy-second session of the General Assembly relating to the activities of the Agency."
  },
  "agenda_items": [
    "Item 89"
  ],
  "symbol_references": [
    "A/72/L.6"
  ]
}