{
  "symbol": "A/RES/74/81",
  "filename": "A_RES_74_81.pdf",
  "title": "74/81. Effects of atomic radiation",
  "text": "United Nations \nA/RES/74/81\n \n \nGeneral Assembly \nDistr.: General \n26 December 2019 \n \n19-21889 (E)    070120 \n*1921889* \n \n \nSeventy-fourth session \nAgenda item 48 \nEffects of atomic radiation \n \n \n \n \n Resolution adopted by the General Assembly \non 13 December 2019 \n \n \n \n \n[on the report of the Special Political and Decolonization Committee \n(Fourth Committee) (A/74/407)] \n \n \n \n74/81. Effects of atomic radiation \n \n \n \nThe General Assembly, \n \nRecalling its resolution 913 (X) of 3 December 1955, by which it established \nthe United Nations Scientific Committee on the Effects of Atomic Radiation, and its \nsubsequent resolutions on the subject, in which, inter alia, it requested the Scientific \nCommittee to continue its work, \n \nConcerned about the potentially harmful effects on present and future \ngenerations resulting from the levels of radiation to which humankind and the \nenvironment are exposed, \n \nConscious of the continuing need to examine and compile information about \natomic and ionizing radiation and to analyse its effects on humankind and the \nenvironment, and conscious also of the increased volume, complexity and diversity \nof that information, \n \nAcknowledging the concerns about the radiological consequences of nuclear \naccidents, \n \nReaffirming the desirability of the Scientific Committee continuing its work, \nand welcoming the increased commitment of States members of the Committee, \n \nEmphasizing the vital need for sufficient, assured and predictable funding, as \nwell as efficient management, of the work of the secretariat of the Scientific \nCommittee to arrange the annual sessions and coordinate the development of \ndocuments based on scientific reviews of the sources of ionizing radiation and its \neffects on human health and the environment, \n \nRecognizing the increasing importance of the scientific work of the Scientific \nCommittee and the need to carry out unforeseen additional work, such as after the \naccident at the Fukushima Daiichi nuclear power station, \n\nA/RES/74/81 \nEffects of atomic radiation\n \n19-21889\n2/5 \n \n \nConsidering that the high quality of the work and the scientific rigour of the \nScientific Committee need to be maintained in the future, \n \nRecognizing the importance of disseminating the findings of the Scientific \nCommittee, in particular to the public, and widely publicizing scientific knowledge \nabout atomic radiation, and recalling in that context principle 10 of the Rio \nDeclaration on Environment and Development,1  \n \nNoting the need for the resources of the Scientific Committee to be sufficient, \nassured and predictable, and recognizing the importance of voluntary contributions \nto the general trust fund established by the Executive Director of the United Nations \nEnvironment Programme to support the work of the Committee, \n \nAcknowledging the attendance of Algeria, Iran (Islamic Republic of), Norway \nand the United Arab Emirates as observers at the sixty-fifth and sixty-sixth sessions \nof the Scientific Committee,  \n \nBearing in mind that the incorporation of new members will imply a \nproportional increase in operational costs for the Scientific Committee, including \ntravel costs,  \n \nCommending the secretariat of the Scientific Committee for its ongoing efforts \nto ensure the sustainable and effective work of the Committee, and encouraging all \nStates in a position to do so to provide support to the secretariat of the Committee,  \n \nRecalling the support expressed by the International Atomic Energy Agency and \nthe World Health Organization for the Scientific Committee\u2019s work in producing the \nmost reliable and comprehensive sources of scientific information about the levels \nand effects of ionizing radiation, without which safety guidance and safety standards \ncould not be developed and maintained and priorities for research in the areas of \nsources and effects of ionizing radiation could not be determined, \n \nNoting the commitment made by the United Nations Environment Programme \nto addressing the developments that resulted in the request by the Scientific \nCommittee during its sixty-fifth session for an investigation or inspection into the \nprocess to recruit the Scientific Secretary to ensure that the successful candidate was \nselected on the basis of scientific qualifications and credibility and that the process \nwas aligned with Article 101, paragraph 3, of the Charter of the United Nations, 2  \n \nRecognizing that sufficient staffing of the secretariat is essential to support the \nwork of the Scientific Committee, \n \n1. \nCommends the United Nations Scientific Committee on the Effects of \nAtomic Radiation for the valuable contribution that it has been making since its \ninception to wider knowledge and understanding of the levels, effects and risks of \nexposure to ionizing radiation and for fulfilling its original mandate with scientific \nauthority and independence of judgment; \n \n2. \nReaffirms the decision to maintain the present functions and independent \nrole of the Scientific Committee; \n \n3. \nRe-emphasizes the need for the Scientific Committee to hold regular \nsessions on an annual basis so that its report will be able to reflect the latest \n__________________ \n \n1  Report of the United Nations Conference on Environment and Development, Rio de Janeiro, \n3\u221214 June 1992, vol. I, Resolutions Adopted by the Conference (United Nations publication, \nSales No. E.93.I.8 and corrigendum), resolution 1, annex I. \n \n2  See Official Records of the General Assembly, Seventy-fourth Session, Supplement No. 46 \n(A/74/46). \n\nEffects of atomic radiation \nA/RES/74/81\n \n3/5\n19-21889 \n \ndevelopments and findings in the field of ionizing radiation and thereby provide \nupdated information for dissemination among all States; \n \n4. \nNotes with appreciation the work of the Scientific Committee, takes note \nof the report on its sixty-sixth session,2 including the report on the implementation of \nits long-term strategic directions, and encourages the Committee, over its coming \nsessions, to continue to work towards implementing strategies to support its long-\nterm efforts to serve the scientific community, as well as wider audiences;  \n \n5. \nWelcomes the continuation of the ad hoc working group to assist the \nScientific Committee in developing its future programme of work on the effects of \nradiation exposure and the biological mechanisms by which they occur; 3  \n \n6. \nAlso welcomes the establishment of an ad hoc working group on sources \nand exposure, following the experience of the ad hoc working group on effects and \nmechanisms;3 \n \n7. \nAppreciates the arrangements made by the Scientific Committee for \nactivities to follow up on its 2013 evaluation of the levels and effects of radiation \nexposure due to the nuclear accident after the 2011 great east-Japan earthquake and \ntsunami, looks forward to the Committee\u2019s evaluation of the implications of the \ninformation published since the 2013 report, and encourages the secretariat of the \nCommittee to disseminate the findings of the Committee\u2019s evaluation, in particular to \nthe public; \n \n8. \nWelcomes the two substantive scientific reports adopted by the Scientific \nCommittee during its sixty-sixth session, on selected health effects and inference of \nrisk due to radiation exposure and on lung cancer from exposure to radon, 4 and looks \nforward to the publication of the supporting scientific annexes thereto as their \noutcomes are relied upon by other international organizations; \n \n9. \nLooks forward to the Scientific Committee\u2019s evaluations of biological \nmechanisms relevant for the inference of cancer risk after low-dose radiation \nexposure, and the assessments of human exposures to medical ionizing radiation and \noccupational ionizing radiation; \n \n10. Requests the Scientific Committee to continue its work, including its \nimportant activities to increase knowledge of the levels, effects and risks of ionizing \nradiation from all sources, and to report thereon to the General Assembly at its \nseventy-fifth session; \n \n11. \nSupports the intentions and plans of the Scientific Committee for \nconducting its programme of work of scientific review and assessment on behalf of \nthe General Assembly, in particular its next global survey of public radiation \nexposure, its assessments of second primary cancer after radiotherapy and its \nepidemiological studies of radiation and cancer, to be conducted in close cooperation \nwith other relevant organizations, and requests the Committee to submit plans for its \nongoing and future programme of work to the Assembly at its seventy-fifth session; \n \n12. Welcomes developments in streamlining procedures for publishing the \nreports of the Scientific Committee electronically on its official website and as sales \npublications, and calls upon the secretariat to continue both to monitor the timely \npublication of those reports and to strive to publish them within the same calendar \nyear as their approval; \n__________________ \n \n3  Ibid., chap. II, sect. C. \n \n4  Ibid., chap. III. \n\nA/RES/74/81 \nEffects of atomic radiation\n \n19-21889\n4/5 \n \n \n13. Invites the Scientific Committee to continue its consultations with \nscientists and experts from interested Member States in the process of preparing its \nfuture scientific reports, and requests the secretariat to continue to facilitate such \nconsultations; \n \n14. Welcomes, in this context, the readiness of Member States to provide the \nScientific Committee with relevant information on the levels and effects of ionizing \nradiation, and invites the Committee to analyse and give due consideration to such \ninformation, particularly in the light of its own findings; \n \n15. Recalls the strategy of the Scientific Committee to improve data \ncollection, encourages in this regard Member States, the organizations of the United \nNations system and non-governmental organizations concerned to provide further \nrelevant data about levels, effects and risks of radiation exposure from various \nsources, which would greatly help in the preparation of future reports of the \nCommittee to the General Assembly, and encourages the International Atomic Energy \nAgency, the World Health Organization, the International Labour Organization and \nother relevant organizations to further collaborate with the secretariat on \narrangements for the collection, analysis and dissemination of data on radiation \nexposures of patients, workers and the public; \n \n16. Welcomes the use and ongoing development by the secretariat of an online \nplatform for collecting data on the exposure of patients, workers and the public, and \nurges Member States to take part in the Scientific Committee\u2019s global surveys of \nradiation exposure and to nominate a national contact person to facilitate coordination \nof the collection and submission of data on the exposure of patients, workers and the \npublic within the country; \n \n17. Also welcomes the Scientific Committee\u2019s outreach strategy for the period \n2020\u20132024, in particular the enhancement of the website of the Committee and the \npublication of information for the general public in all the official languages of the \nUnited Nations, continues to encourage that consideration be given to publishing the \nwebsite in all of those languages, and notes that the dissemination of the Committee\u2019s \nfindings and further enhancements to the website would depend on the financial and \nhuman resources made available to the secretariat; \n \n18. Requests the United Nations Environment Programme to continue, within \nexisting resources, to service the Scientific Committee and to disseminate its findings \nto Member States, the scientific community and the public and to ensure that the \nadministrative measures in place are appropriate, including clear roles and \nresponsibilities of the various actors, so that the secretariat is able to adequately and \nefficiently service the Committee in a predictable and sustainable manner and \neffectively facilitate the use of the invaluable expertise offered to the Committee by \nits members in order that the Committee may discharge the responsibilities and \nmandate entrusted to it by the General Assembly; \n \n19. Welcomes the appointment of a new Secretary of the Scientific Committee \nby the United Nations Environment Programme, and urges the United Nations \nEnvironment Programme to ensure that future recruitment processes are conducted in \nan efficient, effective, timely and transparent manner;  \n \n20. Also welcomes the establishment of the post of Deputy Secretary, which \nreplaces the previous post of Scientific Officer, allows for the deputization of the \nDeputy Secretary as Secretary as appropriate and assists in the avoidance of \ndisruptions in staffing; \n \n21. Requests the Secretary-General to strengthen support for the Scientific \nCommittee within existing resources, particularly with regard to the increase of \n\nEffects of atomic radiation \nA/RES/74/81\n \n5/5\n19-21889 \n \noperational costs in the case of a further increase in membership, and to report to the \nGeneral Assembly at its seventy-fifth session on these issues;  \n \n22. Encourages Member States in a position to do so to make voluntary \ncontributions to the general trust fund established by the Executive Director of the \nUnited Nations Environment Programme and also to make contributions in kind, in \norder to support the work of the Scientific Committee, and the dissemination of its \nfindings, in a sustainable manner;  \n \n23. Invites Algeria, Iran (Islamic Republic of), Norway and the United Arab \nEmirates to designate one scientist to attend the sixty-seventh session of the Scientific \nCommittee as an observer, pursuant to paragraph 19 of General Assembly resolution \n72/76 of 7 December 2017 and to the procedures referred to in paragraph 21 of \nAssembly resolution 73/261 of 22 December 2018; \n \n24. Recalls the procedure for the possible further increases in membership of \nthe Scientific Committee as adopted in paragraph 21 of General Assembly resolution \n73/261, pursuant to paragraph 19 of Assembly resolution 66/70 of 9 December 2011. \n \n47th plenary meeting \n13 December 2019 \n \n",
  "paragraphs": {
    "1": "Commends the United Nations Scientific Committee on the Effects of Atomic Radiation for the valuable contribution that it has been making since its inception to wider knowledge and understanding of the levels, effects and risks of exposure to ionizing radiation and for fulfilling its original mandate with scientific authority and independence of judgment;",
    "2": "Reaffirms the decision to maintain the present functions and independent role of the Scientific Committee;",
    "3": "Re-emphasizes the need for the Scientific Committee to hold regular sessions on an annual basis so that its report will be able to reflect the latest __________________ 1 Report of the United Nations Conference on Environment and Development, Rio de Janeiro, 3\u221214 June 1992, vol. I, Resolutions Adopted by the Conference (United Nations publication, Sales No. E.93.I.8 and corrigendum), resolution 1, annex I. 2 See Official Records of the General Assembly, Seventy-fourth Session, Supplement No. 46 (A/74/46). Effects of atomic radiation A/RES/74/81 3/5 19-21889 developments and findings in the field of ionizing radiation and thereby provide updated information for dissemination among all States;",
    "4": "Notes with appreciation the work of the Scientific Committee, takes note of the report on its sixty-sixth session,2 including the report on the implementation of its long-term strategic directions, and encourages the Committee, over its coming sessions, to continue to work towards implementing strategies to support its long- term efforts to serve the scientific community, as well as wider audiences;",
    "5": "Welcomes the continuation of the ad hoc working group to assist the Scientific Committee in developing its future programme of work on the effects of radiation exposure and the biological mechanisms by which they occur; 3",
    "6": "Also welcomes the establishment of an ad hoc working group on sources and exposure, following the experience of the ad hoc working group on effects and mechanisms;3",
    "7": "Appreciates the arrangements made by the Scientific Committee for activities to follow up on its 2013 evaluation of the levels and effects of radiation exposure due to the nuclear accident after the 2011 great east-Japan earthquake and tsunami, looks forward to the Committee\u2019s evaluation of the implications of the information published since the 2013 report, and encourages the secretariat of the Committee to disseminate the findings of the Committee\u2019s evaluation, in particular to the public;",
    "8": "Welcomes the two substantive scientific reports adopted by the Scientific Committee during its sixty-sixth session, on selected health effects and inference of risk due to radiation exposure and on lung cancer from exposure to radon, 4 and looks forward to the publication of the supporting scientific annexes thereto as their outcomes are relied upon by other international organizations;",
    "9": "Looks forward to the Scientific Committee\u2019s evaluations of biological mechanisms relevant for the inference of cancer risk after low-dose radiation exposure, and the assessments of human exposures to medical ionizing radiation and occupational ionizing radiation;",
    "10": "Requests the Scientific Committee to continue its work, including its important activities to increase knowledge of the levels, effects and risks of ionizing radiation from all sources, and to report thereon to the General Assembly at its seventy-fifth session;",
    "11": "Supports the intentions and plans of the Scientific Committee for conducting its programme of work of scientific review and assessment on behalf of the General Assembly, in particular its next global survey of public radiation exposure, its assessments of second primary cancer after radiotherapy and its epidemiological studies of radiation and cancer, to be conducted in close cooperation with other relevant organizations, and requests the Committee to submit plans for its ongoing and future programme of work to the Assembly at its seventy-fifth session;",
    "12": "Welcomes developments in streamlining procedures for publishing the reports of the Scientific Committee electronically on its official website and as sales publications, and calls upon the secretariat to continue both to monitor the timely publication of those reports and to strive to publish them within the same calendar year as their approval; __________________ 3 Ibid., chap. II, sect. C. 4 Ibid., chap. III. A/RES/74/81 Effects of atomic radiation 19-21889 4/5",
    "13": "Invites the Scientific Committee to continue its consultations with scientists and experts from interested Member States in the process of preparing its future scientific reports, and requests the secretariat to continue to facilitate such consultations;",
    "14": "Welcomes, in this context, the readiness of Member States to provide the Scientific Committee with relevant information on the levels and effects of ionizing radiation, and invites the Committee to analyse and give due consideration to such information, particularly in the light of its own findings;",
    "15": "Recalls the strategy of the Scientific Committee to improve data collection, encourages in this regard Member States, the organizations of the United Nations system and non-governmental organizations concerned to provide further relevant data about levels, effects and risks of radiation exposure from various sources, which would greatly help in the preparation of future reports of the Committee to the General Assembly, and encourages the International Atomic Energy Agency, the World Health Organization, the International Labour Organization and other relevant organizations to further collaborate with the secretariat on arrangements for the collection, analysis and dissemination of data on radiation exposures of patients, workers and the public;",
    "16": "Welcomes the use and ongoing development by the secretariat of an online platform for collecting data on the exposure of patients, workers and the public, and urges Member States to take part in the Scientific Committee\u2019s global surveys of radiation exposure and to nominate a national contact person to facilitate coordination of the collection and submission of data on the exposure of patients, workers and the public within the country;",
    "17": "Also welcomes the Scientific Committee\u2019s outreach strategy for the period 2020\u20132024, in particular the enhancement of the website of the Committee and the publication of information for the general public in all the official languages of the United Nations, continues to encourage that consideration be given to publishing the website in all of those languages, and notes that the dissemination of the Committee\u2019s findings and further enhancements to the website would depend on the financial and human resources made available to the secretariat;",
    "18": "Requests the United Nations Environment Programme to continue, within existing resources, to service the Scientific Committee and to disseminate its findings to Member States, the scientific community and the public and to ensure that the administrative measures in place are appropriate, including clear roles and responsibilities of the various actors, so that the secretariat is able to adequately and efficiently service the Committee in a predictable and sustainable manner and effectively facilitate the use of the invaluable expertise offered to the Committee by its members in order that the Committee may discharge the responsibilities and mandate entrusted to it by the General Assembly;",
    "19": "Welcomes the appointment of a new Secretary of the Scientific Committee by the United Nations Environment Programme, and urges the United Nations Environment Programme to ensure that future recruitment processes are conducted in an efficient, effective, timely and transparent manner;",
    "20": "Also welcomes the establishment of the post of Deputy Secretary, which replaces the previous post of Scientific Officer, allows for the deputization of the Deputy Secretary as Secretary as appropriate and assists in the avoidance of disruptions in staffing;",
    "21": "Requests the Secretary-General to strengthen support for the Scientific Committee within existing resources, particularly with regard to the increase of Effects of atomic radiation A/RES/74/81 5/5 19-21889 operational costs in the case of a further increase in membership, and to report to the General Assembly at its seventy-fifth session on these issues;",
    "22": "Encourages Member States in a position to do so to make voluntary contributions to the general trust fund established by the Executive Director of the United Nations Environment Programme and also to make contributions in kind, in order to support the work of the Scientific Committee, and the dissemination of its findings, in a sustainable manner;",
    "23": "Invites Algeria, Iran (Islamic Republic of), Norway and the United Arab Emirates to designate one scientist to attend the sixty-seventh session of the Scientific Committee as an observer, pursuant to paragraph 19 of General Assembly resolution 72/76 of 7 December 2017 and to the procedures referred to in paragraph 21 of Assembly resolution 73/261 of 22 December 2018;",
    "24": "Recalls the procedure for the possible further increases in membership of the Scientific Committee as adopted in paragraph 21 of General Assembly resolution 73/261, pursuant to paragraph 19 of Assembly resolution 66/70 of 9 December 2011. 47th plenary meeting 13 December 2019"
  },
  "agenda_items": [
    "Item 48"
  ],
  "symbol_references": []
}