{
  "symbol": "A/RES/73/217",
  "filename": "A_RES_73_217.pdf",
  "title": "73/217. Observer status for the International Think Tank for Landlocked Developing Countries in the General Assembly",
  "text": "United Nations \nA/RES/73/217\n \n \nGeneral Assembly \nDistr.: General \n11 January 2019 \n \n18-22536 (E)    150119 \n*1822536* \n \n \nSeventy-third session \nAgenda item 178 \n \n \n \n \n Resolution adopted by the General Assembly \non 20 December 2018 \n \n \n \n \n[on the report of the Sixth Committee (A/73/466)] \n \n \n 73/217. Observer status for the International Think Tank for Landlocked \nDeveloping Countries in the General Assembly \n \n \n \nThe General Assembly, \n \nWishing to promote cooperation between the United Nations and the \nInternational Think Tank for Landlocked Developing Countries, \n \n1. \nDecides to invite the International Think Tank for Landlocked Developing \nCountries to participate in the sessions and the work of the General Assembly in the \ncapacity of observer; \n \n2. \nRequests the Secretary-General to take the action necessary to implement \nthe present resolution. \n \n62nd plenary meeting  \n20 December 2018 \n \n",
  "paragraphs": {
    "1": "Decides to invite the International Think Tank for Landlocked Developing Countries to participate in the sessions and the work of the General Assembly in the capacity of observer;",
    "2": "Requests the Secretary-General to take the action necessary to implement the present resolution. 62nd plenary meeting 20 December 2018"
  },
  "agenda_items": [
    "Item 178"
  ],
  "symbol_references": []
}