{
  "symbol": "A/RES/76/227",
  "filename": "A_RES_76_227.pdf",
  "title": "76/227. Countering disinformation for the promotion and protection of human rights and fundamental freedoms",
  "text": "United Nations \nA/RES/76/227\n \n \nGeneral Assembly \nDistr.: General \n10 January 2022 \n \n21-19656 (E)    140122 \n*2119656* \n \n \nSeventy-sixth session \nAgenda item 74 (b) \nPromotion and protection of human rights: human \nrights questions, including alternative approaches for \nimproving the effective enjoyment of human rights and \nfundamental freedoms \n \n \n \n \n Resolution adopted by the General Assembly \non 24 December 2021 \n \n \n \n \n[on the report of the Third Committee (A/76/462/Add.2, para. 114)] \n \n \n 76/227. Countering disinformation for the promotion and protection of \nhuman rights and fundamental freedoms \n \n \n \nThe General Assembly, \n \nGuided by the purposes and principles of the Charter of the United Nations, \n \nReaffirming the Universal Declaration of Human Rights, 1  the International \nCovenant on Civil and Political Rights,2 the International Covenant on Economic, \nSocial and Cultural Rights, 3 the Convention on the Elimination of All Forms of \nDiscrimination against Women, 4 the Convention on the Rights of the Child, 5 the \nConvention on the Rights of Persons with Disabilities,6 the International Convention \non the Elimination of All Forms of Racial Discrimination7 and all other relevant \ninternational human rights instruments, including the Vienna Declaration and \nProgramme of Action,8 \n \nRecalling the universality, indivisibility, interdependence and interrelatedness \nof all human rights and fundamental freedoms, \n \nRecalling also its resolutions 75/176 of 16 December 2020, 75/267 of 25 March \n2021 and 75/309 of 21 July 2021, \n__________________ \n \n1 Resolution 217 A (III). \n \n2 See resolution 2200 A (XXI), annex. \n \n3 Ibid. \n \n4  United Nations, Treaty Series, vol. 1249, No. 20378. \n \n5 Ibid., vol. 1577, No. 27531. \n \n6 Ibid., vol. 2515, No. 44910. \n \n7 Ibid., vol. 660, No. 9464. \n \n8  A/CONF.157/24 (Part I), chap. III. \n\nA/RES/76/227 \nCountering disinformation for the promotion and protection of \nhuman rights and fundamental freedoms\n \n21-19656\n2/4 \n \n \nRecalling further the Guiding Principles on Business and Human Rights, 9 as \nendorsed by the Human Rights Council in its resolution 17/4 of 16 June 2011,10 \n \nRecalling the United Nations Strategy and Plan of Action on Hate Speech of \nJune 2019, and acknowledging that hate speech and disinformation are distinct \nphenomena which may overlap in some cases, \n \nTaking note of the report of the Special Rapporteur on the promotion and \nprotection of the right to freedom of opinion and expression on disinformation and \nfreedom of opinion and expression,11 \n \nReaffirming the positive role that the exercise of the right to freedom of opinion \nand expression and full respect for the freedom to seek, receive and impart \ninformation can play in strengthening democracy and countering disinformation, and \nreaffirming further that the exercise of the right to freedom of expression carries with \nit special duties and responsibilities, in accordance with article 19 of the International \nCovenant on Civil and Political Rights,  \n \nRecalling article 20, paragraph 2, of the International Covenant on Civil and \nPolitical Rights, which states that any advocacy of national, racial or religious hatred \nthat constitutes incitement to discrimination, hostility or violence shall be prohibited \nby law, \n \nStressing that responses to the spread of disinformation must comply with \ninternational human rights law and the principles of legality, necessity and \nproportionality, and underlining the importance of free, independent, plural and \ndiverse media and of providing and promoting access to independent, factual and \nevidence-based information to counter disinformation, \n \nReaffirming the need to ensure that efforts to counter disinformation promote \nand protect and do not violate individuals\u2019 freedom of expression and freedom to seek, \nreceive and impart information, and noting that media and information-related \ntechnology literacy can help to achieve this through independent and free media, \nawareness-raising and a focus on the empowerment of people, \n \nHighlighting the global concerns about the rapid spread and proliferation of \ndisinformation, thereby increasing the need for the dissemination of factual, timely, \nclear, accessible, multilingual and evidence-based information, and emphasizing the \nneed for all relevant stakeholders to address the challenge of disinformation, \n \nExpressing concern that the use of digital technology can enable new pathways \nfor intentionally false or misleading information to be created, disseminated and \namplified by State and non-State actors for political, ideological or commercial \nmotives at an alarmingly growing scale, speed and reach, and recognizing, in the \ncontext of the challenges and opportunities arising from new and emerging digital \ntechnologies, the need to counter disinformation, in a manner that complies with \nStates\u2019 obligations under international human rights law, \n \nExpressing concern also about the spread of disinformation on online platforms, \nincluding on social media, which can be designed and implemented so as to mislead, \nto spread racism, xenophobia, negative stereotyping and stigmatization, to undermine \npublic health messaging, to breach individuals\u2019 right to privacy, and to incite all forms \n__________________ \n \n9  Guiding Principles on Business and Human Rights: Implementing the United Nations \u201cProtect, \nRespect and Remedy\u201d Framework (A/HRC/17/31, annex). \n \n10  See Official Records of the General Assembly, Sixty-sixth Session, Supplement No. 53 (A/66/53), \nchap. III, sect. A. \n \n11  A/HRC/47/25. \n\nCountering disinformation for the promotion and protection of \nhuman rights and fundamental freedoms \nA/RES/76/227\n \n3/4\n21-19656 \n \nof violence, intolerance, discrimination and hostility, and emphasizing the important \ncontribution of journalists, civil society and academia in countering this trend, \n \nEncouraging States, international and regional organizations, national human \nrights institutions and civil society, business enterprises, including media, online \nplatforms, social media and technology companies, to foster respect for human rights \nonline and offline in the context of new and emerging digital technologies and human \nrights due diligence processes, \n \nDeeply concerned at the proliferation of disinformation about the coronavirus \ndisease (COVID-19) pandemic, including online, and stressing the importance of \nproviding science- and evidence-based data and information to the public to counter \nsuch practices, \n \nRecognizing with concern that online disinformation campaigns are increasingly \nbeing used to deter women from participating in the public sphere and that women \njournalists, politicians and advocates for women\u2019s empowerment are particularly \ntargeted, \n \nRecognizing the role played by all stakeholders through speaking out against \ndisinformation, expressing solidarity with those targeted by disinformation \ncampaigns, and amplifying messages that serve to counter disinformation, \n \nNoting with appreciation the efforts of the United Nations system, including the \nDepartment of Global Communications of the Secretariat, in helping to counter the \nproliferation of disinformation, especially during the COVID-19 pandemic, by sharing \naccurate, timely, relevant and multilingual information, and in this regard taking note \nof the statement by the President of the General Assembly at its seventy-fifth session \nentitled \u201cResponding to an \u2018infodemic\u2019 \u2013 sharing best practices\u201d and the Secretary-\nGeneral\u2019s message to the high-level conference on the theme \u201cThe danger of \ndisinformation \u2013 countering fake news and safeguarding health in the post-truth era\u201d, \n \n1. \nEmphasizes that all forms of disinformation can negatively impact the \nenjoyment of human rights and fundamental freedoms, as well as the attainment of \nthe Sustainable Development Goals;12 \n \n2. \nAffirms the important role that the exercise of the right to freedom of opinion \nand expression and full respect for the freedom to seek, receive and impart information \nplays in strengthening democracy, promoting pluralism and multiculturalism, enhancing \ntransparency and press freedom, and countering disinformation; \n \n3. \nRecognizes that disinformation has the potential to incite discrimination, \nhostility and violence against vulnerable groups and people in vulnerable situations, \nincluding humanitarian emergencies and conflicts; \n \n4. \nAffirms the responsibility of States to counter, as appropriate, and in \naccordance with international human rights law, the dissemination of disinformation \nwhich undermines the promotion of peace and cooperation;  \n \n5. \nCondemns any advocacy of hatred that constitutes incitement to \ndiscrimination, hostility or violence, whether it involves the use of print, audiovisual \nor electronic media, social media or any other means;  \n \n6. \nExpresses concern about the spread of disinformation and propaganda, \nincluding on the Internet, which can be designed and implemented so as to mislead, \nto violate human rights, including the rights to privacy and to freedom of expression, \nto spread hatred, racism, xenophobia, negative stereotyping or stigmatization, and to \nincite violence, discrimination and hostility, and emphasizes the important \ncontribution by journalists in countering this trend;  \n__________________ \n \n12  See resolution 70/1. \n\nA/RES/76/227 \nCountering disinformation for the promotion and protection of \nhuman rights and fundamental freedoms\n \n21-19656\n4/4 \n \n \n7. \nWelcomes civil society and media efforts aimed at identifying and raising \nawareness about deliberate false news stories and disinformation; \n \n8. \nCalls upon States to counter all forms of disinformation through policy \nmeasures, including education, capacity-building for prevention and resilience to \ndisinformation, advocacy and awareness-raising; \n \n9. \nAcknowledges the significant role of business enterprises in the exercise \nof the right to freedom of opinion and expression and in enabling access to \ninformation, and recalls that all business enterprises have a responsibility to respect \nhuman rights, as set out in the Guiding Principles on Business and Human Rights; \n \n10. Expresses concern that globally disinformation is becoming increasingly \nprofessionalized and in some cases is being driven by commercial motives;  \n \n11. Encourages online platforms, including social media companies, to review \ntheir business models and ensure that their design and development processes, their \nbusiness operations, data collection and data processing practices are in line with the \nGuiding Principles on Business and Human Rights, and emphasizes the importance \nof conducting human rights due diligence of their products, particularly of the role of \nalgorithms and ranking systems in amplifying disinformation, and calls upon them to \nadopt and make publicly available, after consultation with all relevant stakeholders, \nclear, transparent, narrowly defined content and advertising policies on countering \ndisinformation that are in line with international human rights law;  \n \n12. Urges all stakeholders to promote media and information literacy, as a way \nto empower all people and facilitate digital inclusion and global connectivity, and to \nassist in countering disinformation; \n \n13. Underlines that countering disinformation requires multidimensional and \nmulti-stakeholder responses that are in compliance with international human rights \nlaw and the proactive engagement of international organizations, States, business \nenterprises and all other stakeholders; \n \n14. Welcomes the efforts of the Secretary-General to promote international \ncooperation in countering disinformation, and in this regard takes note of his call for \na \u201cglobal code of conduct that promotes integrity in public information\u201d; \n \n15. Invites the Office of the United Nations High Commissioner for Human \nRights, special procedures, treaty bodies and all other human rights mechanisms and \nentities of the United Nations, within their respective mandates, to consider, as \nappropriate, addressing the impact of disinformation on human rights; \n \n16. Requests the Secretary-General to seek the views of States, United Nations \nentities and relevant stakeholders and to submit to the General Assembly at its \nseventy-seventh session a report, within existing resources, based on information and \nbest practices shared by States, United Nations entities and relevant stakeholders on \ncountering disinformation; \n \n17. Also requests the Secretary-General to bring the present resolution to the \nattention of all Governments, relevant United Nations bodies and specialized \nagencies, including the Department of Global Communications, and regional \nintergovernmental organizations; \n \n18. Further requests the Secretary-General to take the steps necessary to \neffectively coordinate and follow up on the implementation of the present resolution \nand, in this regard, to consider briefing the General Assembly on its implementation, \nas appropriate. \n \n54th (resumed) plenary meeting \n24 December 2021 \n",
  "paragraphs": {
    "1": "Emphasizes that all forms of disinformation can negatively impact the enjoyment of human rights and fundamental freedoms, as well as the attainment of the Sustainable Development Goals;12",
    "2": "Affirms the important role that the exercise of the right to freedom of opinion and expression and full respect for the freedom to seek, receive and impart information plays in strengthening democracy, promoting pluralism and multiculturalism, enhancing transparency and press freedom, and countering disinformation;",
    "3": "Recognizes that disinformation has the potential to incite discrimination, hostility and violence against vulnerable groups and people in vulnerable situations, including humanitarian emergencies and conflicts;",
    "4": "Affirms the responsibility of States to counter, as appropriate, and in accordance with international human rights law, the dissemination of disinformation which undermines the promotion of peace and cooperation;",
    "5": "Condemns any advocacy of hatred that constitutes incitement to discrimination, hostility or violence, whether it involves the use of print, audiovisual or electronic media, social media or any other means;",
    "6": "Expresses concern about the spread of disinformation and propaganda, including on the Internet, which can be designed and implemented so as to mislead, to violate human rights, including the rights to privacy and to freedom of expression, to spread hatred, racism, xenophobia, negative stereotyping or stigmatization, and to incite violence, discrimination and hostility, and emphasizes the important contribution by journalists in countering this trend; __________________ 12 See resolution 70/1. A/RES/76/227 Countering disinformation for the promotion and protection of human rights and fundamental freedoms 21-19656 4/4",
    "7": "Welcomes civil society and media efforts aimed at identifying and raising awareness about deliberate false news stories and disinformation;",
    "8": "Calls upon States to counter all forms of disinformation through policy measures, including education, capacity-building for prevention and resilience to disinformation, advocacy and awareness-raising;",
    "9": "Acknowledges the significant role of business enterprises in the exercise of the right to freedom of opinion and expression and in enabling access to information, and recalls that all business enterprises have a responsibility to respect human rights, as set out in the Guiding Principles on Business and Human Rights;",
    "10": "Expresses concern that globally disinformation is becoming increasingly professionalized and in some cases is being driven by commercial motives;",
    "11": "Encourages online platforms, including social media companies, to review their business models and ensure that their design and development processes, their business operations, data collection and data processing practices are in line with the Guiding Principles on Business and Human Rights, and emphasizes the importance of conducting human rights due diligence of their products, particularly of the role of algorithms and ranking systems in amplifying disinformation, and calls upon them to adopt and make publicly available, after consultation with all relevant stakeholders, clear, transparent, narrowly defined content and advertising policies on countering disinformation that are in line with international human rights law;",
    "12": "Urges all stakeholders to promote media and information literacy, as a way to empower all people and facilitate digital inclusion and global connectivity, and to assist in countering disinformation;",
    "13": "Underlines that countering disinformation requires multidimensional and multi-stakeholder responses that are in compliance with international human rights law and the proactive engagement of international organizations, States, business enterprises and all other stakeholders;",
    "14": "Welcomes the efforts of the Secretary-General to promote international cooperation in countering disinformation, and in this regard takes note of his call for a \u201cglobal code of conduct that promotes integrity in public information\u201d;",
    "15": "Invites the Office of the United Nations High Commissioner for Human Rights, special procedures, treaty bodies and all other human rights mechanisms and entities of the United Nations, within their respective mandates, to consider, as appropriate, addressing the impact of disinformation on human rights;",
    "16": "Requests the Secretary-General to seek the views of States, United Nations entities and relevant stakeholders and to submit to the General Assembly at its seventy-seventh session a report, within existing resources, based on information and best practices shared by States, United Nations entities and relevant stakeholders on countering disinformation;",
    "17": "Also requests the Secretary-General to bring the present resolution to the attention of all Governments, relevant United Nations bodies and specialized agencies, including the Department of Global Communications, and regional intergovernmental organizations;",
    "18": "Further requests the Secretary-General to take the steps necessary to effectively coordinate and follow up on the implementation of the present resolution and, in this regard, to consider briefing the General Assembly on its implementation, as appropriate. 54th (resumed) plenary meeting 24 December 2021"
  },
  "agenda_items": [
    "Item 74"
  ],
  "symbol_references": []
}