{
  "symbol": "A/RES/79/249",
  "filename": "A_RES_79_249.pdf",
  "title": "79/249. Scale of assessments for the apportionment of the expenses of the United Nations",
  "text": "United Nations \nA/RES/79/249\n \n \nGeneral Assembly \nDistr.: General \n31 December 2024 \n \n24-24688 (E) \n*2424688* \n \n \nSeventy-ninth session \nAgenda item 143 \nScale of assessments for the apportionment of the expenses \nof the United Nations \n \n \n \n \n Resolution adopted by the General Assembly \non 24 December 2024 \n \n \n \n \n[on the report of the Fifth Committee (A/79/390/Add.1, para. 13)] \n \n \n 79/249. Scale of assessments for the apportionment of the expenses \nof the United Nations \n \n \n \nThe General Assembly, \n \nRecalling its previous resolutions and decisions on the scale of assessments for \nthe apportionment of the expenses of the United Nations, including its resolutions \n55/5 B and C of 23 December 2000, 57/4 B of 20 December 2002, 58/1 B of \n23 December 2003, 61/237 of 22 December 2006, 64/248 of 24 December 2009, \n67/238 of 24 December 2012, 70/245 of 23 December 2015, 73/271 of 22 December \n2018 and 76/238 of 24 December 2021 and its decision 68/548 of 27 December 2013, \n \nReaffirming Article 17, paragraph 2, of the Charter of the United Nations and \nrule 160 of its rules of procedure,  \n \nRecalling paragraphs 5 and 6 of its resolution 58/1 B,  \n \nHaving considered the report of the Committee on Contributions on its eighty-\nfourth session1 and the report of the Secretary-General on multi-year payment plans,2 \n \n1. \nTakes note of the report of the Committee on Contributions on its eighty-\nfourth session;  \n \n2. \nAlso takes note of the report of the Secretary-General on multi-year \npayment plans; \n \n3. \nReaffirms that the determination of the scale of assessments for the \napportionment of the expenses of the United Nations shall remain the prerogative of \nthe General Assembly;  \n__________________ \n \n1  Official Records of the General Assembly, Seventy-ninth Session, Supplement No. 11 and \naddendum (A/79/11 and A/79/11/Add.1). \n \n2  A/79/69. \n\nA/RES/79/249 \nScale of assessments for the apportionment of the expenses of the \nUnited Nations\n \n24-24688\n2/8 \n \n \n4. \nAlso reaffirms the fundamental principle that the expenses of the \nOrganization shall be apportioned broadly according to capacity to pay;  \n \n5. \nFurther reaffirms the obligation of all Member States to bear the expenses \nof the United Nations, as apportioned by the General Assembly, in conformity with \nArticle 17, paragraph 2, of the Charter of the United Nations;  \n \n6. \nReaffirms that the Committee on Contributions as a technical body is \nrequired to prepare the scale of assessments strictly on the basis of reliable, verifiable \nand comparable data;  \n \n7. \nDecides that the scale of assessments for the period from 2025 to 2027 \nshall be based on the following elements and criteria: \n \n(a) \nEstimates of gross national income; \n \n(b) \nAverage statistical base periods of three and six years; \n \n(c) \nConversion rates based on market exchange rates, except where that would \ncause excessive fluctuations and distortions in the income of some Member States, \nwhen price-adjusted rates of exchange or other appropriate conversion rates should \nbe employed, taking due account of its resolution 46/221 B of 20 December 1991; \n \n(d) \nThe debt-burden approach employed in the scale of assessments for the \nperiod from 2022 to 2024; \n \n(e) \nA low per capita income adjustment of 80 per cent, with a threshold per \ncapita income limit of the average per capita gross national income of all Member \nStates for the statistical base periods; \n \n(f) \nA minimum assessment rate of 0.001 per cent; \n \n(g) \nA maximum assessment rate for the least developed countries of 0.01 per \ncent; \n \n(h) \nA maximum assessment rate of 22 per cent;  \n \n8. \nRecognizes that the current methodology can be enhanced, bearing in mind \nthe principle of capacity to pay; \n \n9. \nRequests the Committee on Contributions, in accordance with its mandate \nand the rules of procedure of the General Assembly, to review and make \nrecommendations on the elements of the methodology of the scale of assessments in \norder to reflect the capacity of Member States to pay, and to report thereon to the \nAssembly by the main part of its eighty-second session;  \n \n10. Encourages Member States to submit national accounts data under the \n2008 System of National Accounts on a timely basis;  \n \n11. \nSupports the efforts of the Statistics Division of the Department of \nEconomic and Social Affairs of the Secretariat in supporting statistics at the national \nlevel and in providing support to countries and regional organizations to enhance \ncoordination, advocacy and resources for the implementation of the 2008 System of \nNational Accounts;  \n \n12. \nResolves that the scale of assessments for the contributions of Member States \nto the regular budget of the United Nations for 2025, 2026 and 2027 shall be as follows: \n \nMember State \nPercentage \nAfghanistan \n0.005 \nAlbania \n0.010 \nAlgeria \n0.087 \nAndorra \n0.004 \n\nScale of assessments for the apportionment of the expenses of the \nUnited Nations \nA/RES/79/249\n \n3/8\n24-24688 \n \nMember State \nPercentage \nAngola \n0.010 \nAntigua and Barbuda \n0.002 \nArgentina \n0.490 \nArmenia \n0.007 \nAustralia \n2.040 \nAustria \n0.626 \nAzerbaijan \n0.034 \nBahamas \n0.015 \nBahrain \n0.050 \nBangladesh \n0.010 \nBarbados \n0.007 \nBelarus \n0.043 \nBelgium \n0.773 \nBelize \n0.001 \nBenin \n0.005 \nBhutan \n0.001 \nBolivia (Plurinational State of) \n0.018 \nBosnia and Herzegovina \n0.014 \nBotswana \n0.013 \nBrazil \n1.411 \nBrunei Darussalam \n0.019 \nBulgaria \n0.071 \nBurkina Faso \n0.005 \nBurundi \n0.001 \nCabo Verde \n0.001 \nCambodia \n0.008 \nCameroon \n0.014 \nCanada \n2.543 \nCentral African Republic \n0.001 \nChad \n0.005 \nChile \n0.374 \nChina \n20.004 \nColombia \n0.197 \nComoros \n0.001 \nCongo \n0.005 \nCosta Rica \n0.063 \nC\u00f4te d\u2019Ivoire \n0.024 \nCroatia \n0.088 \nCuba \n0.122 \nCyprus \n0.035 \nCzechia \n0.344 \nDemocratic People\u2019s Republic of Korea \n0.005 \nDemocratic Republic of the Congo \n0.010 \nDenmark \n0.531 \n\nA/RES/79/249 \nScale of assessments for the apportionment of the expenses of the \nUnited Nations\n \n24-24688\n4/8 \n \nMember State \nPercentage \nDjibouti \n0.002 \nDominica \n0.001 \nDominican Republic \n0.069 \nEcuador \n0.065 \nEgypt \n0.182 \nEl Salvador \n0.013 \nEquatorial Guinea \n0.008 \nEritrea \n0.001 \nEstonia \n0.045 \nEswatini \n0.002 \nEthiopia \n0.010 \nFiji \n0.003 \nFinland \n0.386 \nFrance \n3.858 \nGabon \n0.011 \nGambia \n0.001 \nGeorgia \n0.009 \nGermany \n5.692 \nGhana \n0.025 \nGreece \n0.280 \nGrenada \n0.001 \nGuatemala \n0.046 \nGuinea \n0.004 \nGuinea-Bissau \n0.001 \nGuyana \n0.011 \nHaiti \n0.006 \nHonduras \n0.010 \nHungary \n0.223 \nIceland \n0.035 \nIndia \n1.106 \nIndonesia \n0.579 \nIran (Islamic Republic of) \n0.386 \nIraq \n0.131 \nIreland \n0.472 \nIsrael \n0.609 \nItaly \n2.813 \nJamaica \n0.007 \nJapan \n6.930 \nJordan \n0.021 \nKazakhstan \n0.131 \nKenya \n0.037 \nKiribati \n0.001 \nKuwait \n0.222 \n\nScale of assessments for the apportionment of the expenses of the \nUnited Nations \nA/RES/79/249\n \n5/8\n24-24688 \n \nMember State \nPercentage \nKyrgyzstan \n0.003 \nLao People\u2019s Democratic Republic \n0.006 \nLatvia \n0.050 \nLebanon \n0.022 \nLesotho \n0.001 \nLiberia \n0.001 \nLibya \n0.040 \nLiechtenstein \n0.009 \nLithuania \n0.081 \nLuxembourg \n0.073 \nMadagascar \n0.004 \nMalawi \n0.003 \nMalaysia \n0.326 \nMaldives \n0.004 \nMali \n0.005 \nMalta \n0.020 \nMarshall Islands \n0.001 \nMauritania \n0.003 \nMauritius \n0.010 \nMexico \n1.137 \nMicronesia (Federated States of) \n0.001 \nMonaco \n0.011 \nMongolia \n0.004 \nMontenegro \n0.004 \nMorocco \n0.059 \nMozambique \n0.002 \nMyanmar \n0.010 \nNamibia \n0.007 \nNauru \n0.001 \nNepal \n0.010 \nNetherlands (Kingdom of the) \n1.298 \nNew Zealand \n0.302 \nNicaragua \n0.004 \nNiger \n0.004 \nNigeria \n0.150 \nNorth Macedonia \n0.008 \nNorway \n0.653 \nOman \n0.115 \nPakistan \n0.123 \nPalau \n0.001 \nPanama \n0.086 \nPapua New Guinea \n0.009 \nParaguay \n0.023 \n\nA/RES/79/249 \nScale of assessments for the apportionment of the expenses of the \nUnited Nations\n \n24-24688\n6/8 \n \nMember State \nPercentage \nPeru \n0.145 \nPhilippines \n0.198 \nPoland \n0.831 \nPortugal \n0.328 \nQatar \n0.245 \nRepublic of Korea \n2.349 \nRepublic of Moldova \n0.006 \nRomania \n0.358 \nRussian Federation \n2.094 \nRwanda \n0.003 \nSaint Kitts and Nevis \n0.001 \nSaint Lucia \n0.002 \nSaint Vincent and the Grenadines \n0.001 \nSamoa \n0.001 \nSan Marino \n0.002 \nSao Tome and Principe \n0.001 \nSaudi Arabia \n1.217 \nSenegal \n0.007 \nSerbia \n0.040 \nSeychelles \n0.002 \nSierra Leone \n0.001 \nSingapore \n0.479 \nSlovakia \n0.149 \nSlovenia \n0.077 \nSolomon Islands \n0.001 \nSomalia \n0.002 \nSouth Africa \n0.251 \nSouth Sudan \n0.005 \nSpain \n1.895 \nSri Lanka \n0.038 \nSudan \n0.008 \nSuriname \n0.002 \nSweden \n0.822 \nSwitzerland \n1.029 \nSyrian Arab Republic \n0.006 \nTajikistan \n0.003 \nThailand \n0.341 \nTimor-Leste \n0.001 \nTogo \n0.002 \nTonga \n0.001 \nTrinidad and Tobago \n0.033 \nTunisia \n0.018 \nT\u00fcrkiye \n0.685 \n\nScale of assessments for the apportionment of the expenses of the \nUnited Nations \nA/RES/79/249\n \n7/8\n24-24688 \n \nMember State \nPercentage \nTurkmenistan \n0.036 \nTuvalu \n0.001 \nUganda \n0.010 \nUkraine \n0.074 \nUnited Arab Emirates \n0.574 \nUnited Kingdom of Great Britain and Northern Ireland \n3.991 \nUnited Republic of Tanzania \n0.010 \nUnited States of America \n22.000 \nUruguay \n0.079 \nUzbekistan \n0.024 \nVanuatu \n0.001 \nVenezuela (Bolivarian Republic of) \n0.069 \nViet Nam \n0.159 \nYemen \n0.003 \nZambia \n0.006 \nZimbabwe \n0.007 \n \n \n \n13. \nTakes note of the report of the Secretary-General on multi-year payment plans \nand the related conclusions and recommendations of the Committee on Contributions;  \n \n14. Reaffirms paragraph 1 of its resolution 57/4 B;  \n \n15. Urges all Member States to pay their assessed contributions in full, on time \nand without imposing conditions;  \n \n16. Urges all Member States currently in arrears to settle those arrears \npromptly and in full;  \n \n17. Encourages Member States in arrears with their assessed contributions to \nthe United Nations to consider submitting multi-year payment plans;  \n \n18. Resolves that:  \n \n(a) \nNotwithstanding the terms of financial regulation 3.10 of the Financial \nRegulations and Rules of the United Nations, 3  the Secretary-General shall be \nempowered to accept, at his discretion and after consultation with the Chair of the \nCommittee on Contributions, a portion of the contributions of Member States for the \ncalendar years 2025, 2026 and 2027 in currencies other than the United States dollar; \n \n(b) \nIn accordance with financial regulation 3.9, the Holy See, which is not a \nmember of the United Nations but which participates in certain of its activities, shall \nbe called upon to contribute towards the expenses of the Organization for 2025, 2026 \nand 2027 on the basis of a notional assessment rate of 0.001 per cent, which represents \nthe basis for the calculation of the flat annual fees to be charged to the Holy See in \naccordance with General Assembly resolution 44/197 B of 21 December 1989; \n \n(c) \nIn accordance with financial regulation 3.9, the State of Palestine, which \nis not a member of the United Nations but which participates in certain of its \nactivities, shall be called upon to contribute towards the expenses of the Organization \nfor 2025, 2026 and 2027 on the basis of a notional assessment rate of 0.011 per cent, \n__________________ \n \n3  ST/SGB/2013/4 and ST/SGB/2013/4/Amend.1. \n\nA/RES/79/249 \nScale of assessments for the apportionment of the expenses of the \nUnited Nations\n \n24-24688\n8/8 \n \nwhich represents the basis for the calculation of the flat annual fees to be charged to \nthe State of Palestine in accordance with its resolution 44/197 B. \n \n55th (resumed) plenary meeting \n24 December 2024 \n \n",
  "paragraphs": {
    "1": "Takes note of the report of the Committee on Contributions on its eighty- fourth session;",
    "2": "Also takes note of the report of the Secretary-General on multi-year payment plans;",
    "3": "Reaffirms that the determination of the scale of assessments for the apportionment of the expenses of the United Nations shall remain the prerogative of the General Assembly; __________________ 1 Official Records of the General Assembly, Seventy-ninth Session, Supplement No. 11 and addendum (A/79/11 and A/79/11/Add.1). 2 A/79/69. A/RES/79/249 Scale of assessments for the apportionment of the expenses of the United Nations 24-24688 2/8",
    "4": "Also reaffirms the fundamental principle that the expenses of the Organization shall be apportioned broadly according to capacity to pay;",
    "5": "Further reaffirms the obligation of all Member States to bear the expenses of the United Nations, as apportioned by the General Assembly, in conformity with Article 17, paragraph 2, of the Charter of the United Nations;",
    "6": "Reaffirms that the Committee on Contributions as a technical body is required to prepare the scale of assessments strictly on the basis of reliable, verifiable and comparable data;",
    "7": "Decides that the scale of assessments for the period from 2025 to 2027 shall be based on the following elements and criteria: (a) Estimates of gross national income; (b) Average statistical base periods of three and six years; (c) Conversion rates based on market exchange rates, except where that would cause excessive fluctuations and distortions in the income of some Member States, when price-adjusted rates of exchange or other appropriate conversion rates should be employed, taking due account of its resolution 46/221 B of 20 December 1991; (d) The debt-burden approach employed in the scale of assessments for the period from 2022 to 2024; (e) A low per capita income adjustment of 80 per cent, with a threshold per capita income limit of the average per capita gross national income of all Member States for the statistical base periods; (f) A minimum assessment rate of 0.001 per cent; (g) A maximum assessment rate for the least developed countries of 0.01 per cent; (h) A maximum assessment rate of 22 per cent;",
    "8": "Recognizes that the current methodology can be enhanced, bearing in mind the principle of capacity to pay;",
    "9": "Requests the Committee on Contributions, in accordance with its mandate and the rules of procedure of the General Assembly, to review and make recommendations on the elements of the methodology of the scale of assessments in order to reflect the capacity of Member States to pay, and to report thereon to the Assembly by the main part of its eighty-second session;",
    "10": "Encourages Member States to submit national accounts data under the 2008 System of National Accounts on a timely basis;",
    "11": "Supports the efforts of the Statistics Division of the Department of Economic and Social Affairs of the Secretariat in supporting statistics at the national level and in providing support to countries and regional organizations to enhance coordination, advocacy and resources for the implementation of the 2008 System of National Accounts;",
    "12": "Resolves that the scale of assessments for the contributions of Member States to the regular budget of the United Nations for 2025, 2026 and 2027 shall be as follows: Member State Percentage Afghanistan 0.005 Albania 0.010 Algeria 0.087 Andorra 0.004 Scale of assessments for the apportionment of the expenses of the United Nations A/RES/79/249 3/8 24-24688 Member State Percentage Angola 0.010 Antigua and Barbuda 0.002 Argentina 0.490 Armenia 0.007 Australia 2.040 Austria 0.626 Azerbaijan 0.034 Bahamas 0.015 Bahrain 0.050 Bangladesh 0.010 Barbados 0.007 Belarus 0.043 Belgium 0.773 Belize 0.001 Benin 0.005 Bhutan 0.001 Bolivia (Plurinational State of) 0.018 Bosnia and Herzegovina 0.014 Botswana 0.013 Brazil 1.411 Brunei Darussalam 0.019 Bulgaria 0.071 Burkina Faso 0.005 Burundi 0.001 Cabo Verde 0.001 Cambodia 0.008 Cameroon 0.014 Canada 2.543 Central African Republic 0.001 Chad 0.005 Chile 0.374 China 20.004 Colombia 0.197 Comoros 0.001 Congo 0.005 Costa Rica 0.063 C\u00f4te d\u2019Ivoire 0.024 Croatia 0.088 Cuba 0.122 Cyprus 0.035 Czechia 0.344 Democratic People\u2019s Republic of Korea 0.005 Democratic Republic of the Congo 0.010 Denmark 0.531 A/RES/79/249 Scale of assessments for the apportionment of the expenses of the United Nations 24-24688 4/8 Member State Percentage Djibouti 0.002 Dominica 0.001 Dominican Republic 0.069 Ecuador 0.065 Egypt 0.182 El Salvador 0.013 Equatorial Guinea 0.008 Eritrea 0.001 Estonia 0.045 Eswatini 0.002 Ethiopia 0.010 Fiji 0.003 Finland 0.386 France 3.858 Gabon 0.011 Gambia 0.001 Georgia 0.009 Germany 5.692 Ghana 0.025 Greece 0.280 Grenada 0.001 Guatemala 0.046 Guinea 0.004 Guinea-Bissau 0.001 Guyana 0.011 Haiti 0.006 Honduras 0.010 Hungary 0.223 Iceland 0.035 India 1.106 Indonesia 0.579 Iran (Islamic Republic of) 0.386 Iraq 0.131 Ireland 0.472 Israel 0.609 Italy 2.813 Jamaica 0.007 Japan 6.930 Jordan 0.021 Kazakhstan 0.131 Kenya 0.037 Kiribati 0.001 Kuwait 0.222 Scale of assessments for the apportionment of the expenses of the United Nations A/RES/79/249 5/8 24-24688 Member State Percentage Kyrgyzstan 0.003 Lao People\u2019s Democratic Republic 0.006 Latvia 0.050 Lebanon 0.022 Lesotho 0.001 Liberia 0.001 Libya 0.040 Liechtenstein 0.009 Lithuania 0.081 Luxembourg 0.073 Madagascar 0.004 Malawi 0.003 Malaysia 0.326 Maldives 0.004 Mali 0.005 Malta 0.020 Marshall Islands 0.001 Mauritania 0.003 Mauritius 0.010 Mexico 1.137 Micronesia (Federated States of) 0.001 Monaco 0.011 Mongolia 0.004 Montenegro 0.004 Morocco 0.059 Mozambique 0.002 Myanmar 0.010 Namibia 0.007 Nauru 0.001 Nepal 0.010 Netherlands (Kingdom of the) 1.298 New Zealand 0.302 Nicaragua 0.004 Niger 0.004 Nigeria 0.150 North Macedonia 0.008 Norway 0.653 Oman 0.115 Pakistan 0.123 Palau 0.001 Panama 0.086 Papua New Guinea 0.009 Paraguay 0.023 A/RES/79/249 Scale of assessments for the apportionment of the expenses of the United Nations 24-24688 6/8 Member State Percentage Peru 0.145 Philippines 0.198 Poland 0.831 Portugal 0.328 Qatar 0.245 Republic of Korea 2.349 Republic of Moldova 0.006 Romania 0.358 Russian Federation 2.094 Rwanda 0.003 Saint Kitts and Nevis 0.001 Saint Lucia 0.002 Saint Vincent and the Grenadines 0.001 Samoa 0.001 San Marino 0.002 Sao Tome and Principe 0.001 Saudi Arabia 1.217 Senegal 0.007 Serbia 0.040 Seychelles 0.002 Sierra Leone 0.001 Singapore 0.479 Slovakia 0.149 Slovenia 0.077 Solomon Islands 0.001 Somalia 0.002 South Africa 0.251 South Sudan 0.005 Spain 1.895 Sri Lanka 0.038 Sudan 0.008 Suriname 0.002 Sweden 0.822 Switzerland 1.029 Syrian Arab Republic 0.006 Tajikistan 0.003 Thailand 0.341 Timor-Leste 0.001 Togo 0.002 Tonga 0.001 Trinidad and Tobago 0.033 Tunisia 0.018 T\u00fcrkiye 0.685 Scale of assessments for the apportionment of the expenses of the United Nations A/RES/79/249 7/8 24-24688 Member State Percentage Turkmenistan 0.036 Tuvalu 0.001 Uganda 0.010 Ukraine 0.074 United Arab Emirates 0.574 United Kingdom of Great Britain and Northern Ireland 3.991 United Republic of Tanzania 0.010 United States of America 22.000 Uruguay 0.079 Uzbekistan 0.024 Vanuatu 0.001 Venezuela (Bolivarian Republic of) 0.069 Viet Nam 0.159 Yemen 0.003 Zambia 0.006 Zimbabwe 0.007",
    "13": "Takes note of the report of the Secretary-General on multi-year payment plans and the related conclusions and recommendations of the Committee on Contributions;",
    "14": "Reaffirms paragraph 1 of its resolution 57/4 B;",
    "15": "Urges all Member States to pay their assessed contributions in full, on time and without imposing conditions;",
    "16": "Urges all Member States currently in arrears to settle those arrears promptly and in full;",
    "17": "Encourages Member States in arrears with their assessed contributions to the United Nations to consider submitting multi-year payment plans;",
    "18": "Resolves that: (a) Notwithstanding the terms of financial regulation 3.10 of the Financial Regulations and Rules of the United Nations, 3 the Secretary-General shall be empowered to accept, at his discretion and after consultation with the Chair of the Committee on Contributions, a portion of the contributions of Member States for the calendar years 2025, 2026 and 2027 in currencies other than the United States dollar; (b) In accordance with financial regulation 3.9, the Holy See, which is not a member of the United Nations but which participates in certain of its activities, shall be called upon to contribute towards the expenses of the Organization for 2025, 2026 and 2027 on the basis of a notional assessment rate of 0.001 per cent, which represents the basis for the calculation of the flat annual fees to be charged to the Holy See in accordance with General Assembly resolution 44/197 B of 21 December 1989; (c) In accordance with financial regulation 3.9, the State of Palestine, which is not a member of the United Nations but which participates in certain of its activities, shall be called upon to contribute towards the expenses of the Organization for 2025, 2026 and 2027 on the basis of a notional assessment rate of 0.011 per cent, __________________ 3 ST/SGB/2013/4 and ST/SGB/2013/4/Amend.1. A/RES/79/249 Scale of assessments for the apportionment of the expenses of the United Nations 24-24688 8/8 which represents the basis for the calculation of the flat annual fees to be charged to the State of Palestine in accordance with its resolution 44/197 B. 55th (resumed) plenary meeting 24 December 2024"
  },
  "agenda_items": [
    "Item 143"
  ],
  "symbol_references": []
}