{
  "symbol": "A/RES/75/58",
  "filename": "A_RES_75_58.pdf",
  "title": "75/58. Measures to prevent terrorists from acquiring weapons of mass destruction",
  "text": "United Nations \nA/RES/75/58 \n \n \nGeneral Assembly \nDistr.: General \n14 December 2020 \n \n20-16873 (E)    181220 \n*2016873* \n \n \nSeventy-fifth session \nAgenda item 103 (v) \nGeneral and complete disarmament: measures to prevent \nterrorists from acquiring weapons of mass destruction \n \n \n \n \n Resolution adopted by the General Assembly \non 7 December 2020 \n \n \n \n \n[on the report of the First Committee (A/75/399, para. 96)] \n \n \n \n75/58. Measures to prevent terrorists from acquiring weapons of \nmass destruction \n \n \n \nThe General Assembly, \n \nRecalling its resolution 74/43 of 12 December 2019, \n \nRecognizing the determination of the international community to combat \nterrorism, as evidenced in relevant General Assembly and Security Council \nresolutions, \n \nDeeply concerned by the growing risk of linkages between terrorism and \nweapons of mass destruction, and in particular by the fact that terrorists may seek to \nacquire weapons of mass destruction, \n \nCognizant of the steps taken by States to implement Security Council resolution \n1540 (2004) of 28 April 2004 on the non-proliferation of weapons of mass \ndestruction, \n \nTaking note of Security Council resolution 2325 (2016) of 15 December 2016 \non the non-proliferation of weapons of mass destruction, \n \nWelcoming the entry into force on 7 July 2007 of the International Convention \nfor the Suppression of Acts of Nuclear Terrorism,1 \n \nWelcoming also the adoption, by consensus, of amendments to strengthen the \nConvention on the Physical Protection of Nuclear Material2 by the International \nAtomic Energy Agency on 8 July 2005, and their entry into force on 8 May 2016, \n__________________ \n \n1 United Nations, Treaty Series, vol. 2445, No. 44004. \n \n2 Ibid., vol. 1456, No. 24631. \n\nA/RES/75/58 \nMeasures to prevent terrorists from acquiring \nweapons of mass destruction\n \n20-16873\n2/3 \n \n \nNoting the support expressed in the Final Document of the Eighteenth Summit \nof Heads of State or Government of Non-Aligned Countries, held in Baku on 25 and \n26 October 2019,3 for measures to prevent terrorists from acquiring weapons of mass \ndestruction, \n \nNoting also that the Group of Eight, the European Union, the Regional Forum \nof the Association of Southeast Asian Nations and others have taken into account in \ntheir deliberations the dangers posed by the likely acquisition by terrorists of weapons \nof mass destruction and the need for international cooperation in combating it, and \nthat the Global Initiative to Combat Nuclear Terrorism has been launched jointly by \nthe Russian Federation and the United States of America, \n \nNoting further the holding of the Nuclear Security Summit on 12 and 13 April \n2010 in Washington, D.C., on 26 and 27 March 2012 in Seoul, on 24 and 25 March \n2014 in The Hague and on 31 March and 1 April 2016 in Washington, D.C., \n \nNoting the holding of the high-level meeting on countering nuclear terrorism, with \na focus on strengthening the legal framework, in New York on 28 September 2012, \n \nAcknowledging the consideration of issues relating to terrorism and weapons of \nmass destruction by the Advisory Board on Disarmament Matters,4 \n \nTaking note of the holding by the International Atomic Energy Agency of the \nInternational Conference on Nuclear Security: Commitments and Actions, in Vienna \nin December 2016, and the first International Conference on Nuclear Security: \nEnhancing Global Efforts, in Vienna in July 2013, and the relevant resolutions \nadopted by the General Conference of the Agency at its sixty-second regular session, \n \nTaking note also of the Code of Conduct on the Safety and Security of \nRadioactive Sources, approved by the Board of Governors of the International Atomic \nEnergy Agency on 8 September 2003, and the supplementary Guidance on the \nManagement of Disused Radioactive Sources, approved by the Board of Governors \nof the Agency on 11 September 2017, \n \nTaking note further of the 2005 World Summit Outcome adopted at the high-level \nplenary meeting of the General Assembly on 16 September 20055 and the adoption of \nthe United Nations Global Counter-Terrorism Strategy on 8 September 2006,6 \n \nTaking note of the report of the Secretary-General submitted pursuant to \nparagraph 5 of resolution 74/43,7 \n \nMindful of the urgent need for addressing, within the United Nations framework \nand through international cooperation, this threat to humanity, \n \nEmphasizing that progress is urgently needed in the area of disarmament and \nnon-proliferation in order to maintain international peace and security and to \ncontribute to global efforts against terrorism, \n \n1. \nCalls upon all Member States to support international efforts to prevent \nterrorists from acquiring weapons of mass destruction and their means of delivery; \n \n2. \nAppeals to all Member States to consider early accession to and ratification \nof the International Convention for the Suppression of Acts of Nuclear Terrorism, and \nencourages States parties to the Convention to review its implementation; \n__________________ \n \n3 See A/74/548, annex. \n \n4 See A/59/361. \n \n5 Resolution 60/1. \n \n6 Resolution 60/288. \n \n7 A/75/171. \n\nMeasures to prevent terrorists from acquiring  \nweapons of mass destruction \nA/RES/75/58\n \n3/3\n20-16873 \n \n \n3. \nUrges all Member States to take and strengthen national measures, as \nappropriate, to prevent terrorists from acquiring weapons of mass destruction, their \nmeans of delivery and materials and technologies related to their manufacture; \n \n4. \nEncourages cooperation among and between Member States and relevant \nregional and international organizations for strengthening national capacities in this \nregard; \n \n5. \nRequests the Secretary-General to compile a report on measures already \ntaken by international organizations on issues relating to the linkage between the fight \nagainst terrorism and the proliferation of weapons of mass destruction and to seek the \nviews of Member States on additional relevant measures, including national \nmeasures, for tackling the global threat posed by the acquisition by terrorists of \nweapons of mass destruction and to report to the General Assembly at its seventy-\nsixth session; \n \n6. \nDecides to include in the provisional agenda of its seventy-sixth session, \nunder the item entitled \u201cGeneral and complete disarmament\u201d, the sub-item entitled \n\u201cMeasures to prevent terrorists from acquiring weapons of mass destruction\u201d. \n \n37th plenary meeting \n7 December 2020 \n \n",
  "paragraphs": {
    "1": "Calls upon all Member States to support international efforts to prevent terrorists from acquiring weapons of mass destruction and their means of delivery;",
    "2": "Appeals to all Member States to consider early accession to and ratification of the International Convention for the Suppression of Acts of Nuclear Terrorism, and encourages States parties to the Convention to review its implementation; __________________ 3 See A/74/548, annex. 4 See A/59/361. 5 Resolution 60/1. 6 Resolution 60/288. 7 A/75/171. Measures to prevent terrorists from acquiring weapons of mass destruction A/RES/75/58 3/3 20-16873",
    "3": "Urges all Member States to take and strengthen national measures, as appropriate, to prevent terrorists from acquiring weapons of mass destruction, their means of delivery and materials and technologies related to their manufacture;",
    "4": "Encourages cooperation among and between Member States and relevant regional and international organizations for strengthening national capacities in this regard;",
    "5": "Requests the Secretary-General to compile a report on measures already taken by international organizations on issues relating to the linkage between the fight against terrorism and the proliferation of weapons of mass destruction and to seek the views of Member States on additional relevant measures, including national measures, for tackling the global threat posed by the acquisition by terrorists of weapons of mass destruction and to report to the General Assembly at its seventy- sixth session;",
    "6": "Decides to include in the provisional agenda of its seventy-sixth session, under the item entitled \u201cGeneral and complete disarmament\u201d, the sub-item entitled \u201cMeasures to prevent terrorists from acquiring weapons of mass destruction\u201d. 37th plenary meeting 7 December 2020"
  },
  "agenda_items": [
    "Item 103"
  ],
  "symbol_references": []
}