{
  "symbol": "A/RES/72/15",
  "filename": "A_RES_72_15.pdf",
  "title": "72/15. Jerusalem",
  "text": " \nUnited Nations \n \nA/RES/72/15\n \n \nGeneral Assembly \n \nDistr.: General \n7 December 2017 \n \n \n17-21324 (E)    301117    111217 \n*1721324* \n \n \n \nSeventy-second session \nAgenda item 37 \n \n \n \n \n Resolution adopted by the General Assembly  \non 30 November 2017 \n \n \n \n \n[without reference to a Main Committee (A/72/L.11 and A/72/L.11/Add.1)] \n \n \n \n72/15. Jerusalem \n \n \n \nThe General Assembly, \n \nRecalling its resolution 181 (II) of 29 November 1947, in particular its \nprovisions regarding the City of Jerusalem, \n \nRecalling also its resolution 36/120 E of 10 December 1981 and all its \nsubsequent relevant resolutions, including resolution 56/31 of 3 December 2001, in \nwhich it, inter alia, determined that all legislative and administrative measures and \nactions taken by Israel, the occupying Power, which have altered or purported to \nalter the character and status of the Holy City of Jerusalem, in particular the \nso-called \u201cBasic Law\u201d on Jerusalem and the proclamation of Jerusalem as the \ncapital of Israel, were null and void and must be rescinded forthwith, \n \nRecalling further the Security Council resolutions relevant to Jerusalem, \nincluding resolution 478 (1980) of 20 August 1980, in which the Council, inter alia, \ndecided not to recognize the \u201cBasic Law\u201d on Jerusalem, \n \nRecalling Security Council resolution 2334 (2016) of 23 December 2016, in \nwhich the Council affirmed that it would not recognize any changes to the 4 June \n1967 lines, including with regard to Jerusalem, other than those agreed by the \nparties through negotiations, \n \nRecalling also the advisory opinion rendered on 9 July 2004 by the \nInternational Court of Justice on the legal consequences of the construction of a \nwall in the Occupied Palestinian Territory, 1 and recalling further its resolution \nES-10/15 of 20 July 2004, \n \nExpressing its grave concern about any action taken by any body, \ngovernmental or non-governmental, in violation of the above-mentioned resolutions, \n \nExpressing its grave concern also, in particular, about the continuation by \nIsrael, the occupying Power, of illegal settlement activities, including measures \n__________________ \n \n1  See A/ES-10/273 and A/ES-10/273/Corr.1. \n\nA/RES/72/15 \nJerusalem\n \nError! No document variable supplied. \n2/2 \n \nregarding the so-called E-1 plan, its construction of the wall in and around East \nJerusalem, its restrictions on Palestinian access to and residence in East Jerusalem \nand the further isolation of the city from the rest of the Occupied Palestinian \nTerritory, which are having a detrimental effect on the lives of Palestinians and \ncould prejudge a final status agreement on Jerusalem, \n \nExpressing its grave concern further about the continuing Israeli demolition of \nPalestinian homes and other civilian infrastructure in and around East Jerusalem, the \nrevocation of residency rights, and the eviction and displacement of numerous \nPalestinian families from East Jerusalem neighbourhoods, including Bedouin \nfamilies, as well as other acts of provocation and incitement, including by Israeli \nsettlers, in the city, including desecration of mosques and churches, \n \nExpressing its concern about the Israeli excavations undertaken in the Old \nCity of Jerusalem, including in and around religious sites, \n \nExpressing its grave concern, in particular, about tensions, provocations and \nincitement regarding the holy places of Jerusalem, including the Haram al-Sharif, \nand urging restraint and respect for the sanctity of the holy sites by all sides, \n \nReaffirming that the international community, through the United Nations, has \na legitimate interest in the question of the City of Jerusalem and in the protection of \nthe unique spiritual, religious and cultural dimensions of the city, as foreseen in \nrelevant United Nations resolutions on this matter, \n \nHaving considered the report of the Secretary-General on the situation in the \nMiddle East,2 \n \n1. \nReiterates its determination that any actions taken by Israel, the \noccupying Power, to impose its laws, jurisdiction and administration on the Holy \nCity of Jerusalem are illegal and therefore null and void and have no validity \nwhatsoever, and calls upon Israel to immediately cease all such illegal and unilateral \nmeasures; \n \n2. \nStresses that a comprehensive, just and lasting solution to the question of \nthe City of Jerusalem should take into account the legitimate concerns of both the \nPalestinian and Israeli sides and should include internationally guaranteed \nprovisions to ensure the freedom of religion and of conscience of its inhabitants, as \nwell as permanent, free and unhindered access to the holy places by people of all \nreligions and nationalities; \n \n3. \nAlso stresses the need for the parties to observe calm and restraint and to \nrefrain from provocative actions, incitement and inflammatory rhetoric, especially \nin areas of religious and cultural sensitivity, and expresses its grave concern in \nparticular about the recent series of negative incidents in East Jerusalem; \n \n4. \nCalls for respect for the historic status quo at the holy places of \nJerusalem, including the Haram al-Sharif, in word and practice, and urges all sides \nto work immediately and cooperatively to defuse tensions and halt all provocations, \nincitement and violence at the holy sites in the City; \n \n5. \nRequests the Secretary-General to report to the General Assembly at its \nseventy-third session on the implementation of the present resolution. \n \n60th plenary meeting \n30 November 2017 \n \n__________________ \n \n2  A/72/333. \n",
  "paragraphs": {
    "1": "Reiterates its determination that any actions taken by Israel, the occupying Power, to impose its laws, jurisdiction and administration on the Holy City of Jerusalem are illegal and therefore null and void and have no validity whatsoever, and calls upon Israel to immediately cease all such illegal and unilateral measures;",
    "2": "Stresses that a comprehensive, just and lasting solution to the question of the City of Jerusalem should take into account the legitimate concerns of both the Palestinian and Israeli sides and should include internationally guaranteed provisions to ensure the freedom of religion and of conscience of its inhabitants, as well as permanent, free and unhindered access to the holy places by people of all religions and nationalities;",
    "3": "Also stresses the need for the parties to observe calm and restraint and to refrain from provocative actions, incitement and inflammatory rhetoric, especially in areas of religious and cultural sensitivity, and expresses its grave concern in particular about the recent series of negative incidents in East Jerusalem;",
    "4": "Calls for respect for the historic status quo at the holy places of Jerusalem, including the Haram al-Sharif, in word and practice, and urges all sides to work immediately and cooperatively to defuse tensions and halt all provocations, incitement and violence at the holy sites in the City;",
    "5": "Requests the Secretary-General to report to the General Assembly at its seventy-third session on the implementation of the present resolution."
  },
  "agenda_items": [
    "Item 37"
  ],
  "symbol_references": [
    "A/72/L.11"
  ]
}